A1: Victorian Football Association
A2: Season 1897
A3: © Copyright Wal Williams | F3: First created: 2 August 2014
A4: Contact: joywalwi at gmail dot com | F4: Last updated: 30 July 2017 | W4: VFA Results and tables - Link to the main index page
A5: You are free to copy this document in whole or part provided that proper acknowledgement is given to the author. All rights reserved.
A7: ROUND 1 | E7: 1ST MAY | I7: WEATHER | M7: FINE
D9: 1ST QTR | H9: 2ND QTR | L9: 3RD QTR | P9: FINAL | S9: AT
S10: PORT MELB
A11: PORT MELBOURNE | C11: 0 | D11: 2 | E11: =C11*6+D11 -> 2 | G11: 4 | H11: 10 | I11: =G11*6+H11 -> 34 | K11: 4 | L11: 10 | M11: =K11*6+L11 -> 34 | O11: 8 | P11: 19 | Q11: =O11*6+P11 -> 67 | S11: UMPIRE | W11: LADDER | AB11: ROUND | AD11: 1
A12: NORTH MELBOURNE | C12: 1 | D12: 2 | E12: =C12*6+D12 -> 8 | G12: 1 | H12: 2 | I12: =G12*6+H12 -> 8 | K12: 2 | L12: 6 | M12: =K12*6+L12 -> 18 | O12: 2 | P12: 6 | Q12: =O12*6+P12 -> 18 | S12: MOLYNEAUX
A13: BEST PLAYERS | W13: TEAM | X13: W | Y13: L | Z13: D | AA13: FOR | AB13: AGST | AC13: % | AD13: PTS
A14: PORT MELBOURNE | C14: JOHNSON | F14: O'BRIEN | I14: HENDERSON | L14: McGREGOR | O14: ROBERTSON | R14: DALY
A15: NORTH MELBOURNE | C15: E. LAUNDER | F15: H . LAUNDER | I15: GRIERSON | L15: TORPEY | O15: STUCKEY | R15: SNOW | W15: PORT MELBOURNE | X15: 1 | Y15: 0 | Z15: 0 | AA15: 67 | AB15: 18 | AC15: 372.22222222222223 | AD15: 4
A16: GOALKICKERS | W16: RICHMOND | X16: 1 | Y16: 0 | Z16: 0 | AA16: 38 | AB16: 15 | AC16: 253.33333333333334 | AD16: 4
A17: PORT MELBOURNE | C17: DALY 3 | F17: ROWAN 2 | I17: POWER | K17: HENDERSON | N17: ANDERSON | W17: FOOTSCRAY | X17: 1 | Y17: 0 | Z17: 0 | AA17: 29 | AB17: 22 | AC17: 131.81818181818181 | AD17: 4
A18: NORTH MELBOURNE | C18: H LAUNDER 2 | W18: WILLIAMSTOWN | X18: 0 | Y18: 1 | Z18: 0 | AA18: 22 | AB18: 29 | AC18: 75.862068965517238 | AD18: 0
A20: RICHMOND | C20: 0 | D20: 1 | E20: =C20*6+D20 -> 1 | G20: 1 | H20: 4 | I20: =G20*6+H20 -> 10 | K20: 2 | L20: 6 | M20: =K20*6+L20 -> 18 | O20: 5 | P20: 8 | Q20: =O20*6+P20 -> 38 | S20: MCG | W20: BRUNSWICK | X20: 0 | Y20: 1 | Z20: 0 | AA20: 15 | AB20: 38 | AC20: 39.473684210526315 | AD20: 0
A21: BRUNSWICK | C21: 0 | D21: 2 | E21: =C21*6+D21 -> 2 | G21: 1 | H21: 2 | I21: =G21*6+H21 -> 8 | K21: 2 | L21: 3 | M21: =K21*6+L21 -> 15 | O21: 2 | P21: 3 | Q21: =O21*6+P21 -> 15 | S21: CARRIS | W21: NORTH MELBOURNE | X21: 0 | Y21: 1 | Z21: 0 | AA21: 18 | AB21: 67 | AC21: 26.865671641791046 | AD21: 0
A22: BEST PLAYERS
A23: RICHMOND | C23: BACKHOUSE | F23: PARKER | I23: ELDER | L23: RYAN | O23: WATSON | R23: HARRIS
A24: BRUNSWICK | C24: JOHNSON | F24: O'LOUGHLIN | I24: SAMPSON | L24: HARRIS | O24: McNAMARA | R24: McDONALD
A25: GOALKICKERS
A26: RICHMOND | C26: ELDER 2 | G26: DE FEU 2 | K26: RYAN
A27: BRUNSWICK | C27: McCORMACK | G27: KELLY
A29: FOOTSCRAY | C29: 1 | D29: 0 | E29: =C29*6+D29 -> 6 | G29: 4 | H29: 2 | I29: =G29*6+H29 -> 26 | K29: 4 | L29: 5 | M29: =K29*6+L29 -> 29 | O29: 4 | P29: 5 | Q29: =O29*6+P29 -> 29 | S29: WILLIAMSTOWN
A30: WILLIAMSTOWN | C30: 2 | D30: 3 | E30: =C30*6+D30 -> 15 | G30: 3 | H30: 3 | I30: =G30*6+H30 -> 21 | K30: 3 | L30: 4 | M30: =K30*6+L30 -> 22 | O30: 3 | P30: 4 | Q30: =O30*6+P30 -> 22 | S30: SHAW
A31: BEST PLAYERS
A32: FOOTSCRAY | C32: DREW | F32: DICK | I32: MOLYNEAUX | L32: ARMSTRONG | O32: HOUGHTON | R32: HARRIS
A33: WILLIAMSTOWN | C33: WARREN | F33: FITZPATRICK | I33: BRISTOW | L33: FAGAN | O33: GUTHRIE
A34: GOALKICKERS
A35: FOOTSCRAY | C35: DREW | F35: KRUSE | I35: ARMSTRONG | L35: BARRASS
A36: WILLIAMSTOWN | C36: WARREN | F36: FITZPATRICK | J36: ROCHE
A39: ROUND 2 | E39: 8TH MAY | I39: WEATHER | M39: FINE
D41: 1ST QTR | H41: 2ND QTR | L41: 3RD QTR | P41: FINAL | S41: AT
S42: PORT MELB
A43: PORT MELBOURNE | C43: 2 | D43: 3 | E43: =C43*6+D43 -> 15 | G43: 6 | H43: 5 | I43: =G43*6+H43 -> 41 | K43: 8 | L43: 12 | M43: =K43*6+L43 -> 60 | O43: 10 | P43: 12 | Q43: =O43*6+P43 -> 72 | S43: UMPIRE | W43: LADDER | AB43: ROUND | AD43: 2
A44: RICHMOND | C44: 0 | D44: 1 | E44: =C44*6+D44 -> 1 | G44: 0 | H44: 3 | I44: =G44*6+H44 -> 3 | K44: 0 | L44: 3 | M44: =K44*6+L44 -> 3 | O44: 3 | P44: 5 | Q44: =O44*6+P44 -> 23 | S44: SHAW
A45: BEST PLAYERS | W45: TEAM | X45: W | Y45: L | Z45: D | AA45: FOR | AB45: AGST | AC45: % | AD45: PTS
A46: PORT MELBOURNE | C46: W . MONAGLE | F46: O'BRIEN | I46: JOHNSON | L46: HENDERSON | O46: KNOX | Q46: DALY
A47: RICHMOND | C47: PARKER | F47: BACKHOUSE | I47: PITCHER | L47: WATSON | O47: RYAN | W47: PORT MELB | X47: 2 | Y47: 0 | Z47: 0 | AA47: 139 | AB47: 41 | AC47: 339.02439024390242 | AD47: 8
A48: GOALKICKERS | W48: FOOTSCRAY | X48: 2 | Y48: 0 | Z48: 0 | AA48: 77 | AB48: 44 | AC48: 175 | AD48: 8
A49: PORT MELBOURNE | C49: DALY 5 | F49: ROWAN 2 | I49: POWELL | L49: HENDERSON | O49: MORGAN | W49: RICHMOND | X49: 1 | Y49: 1 | Z49: 0 | AA49: 61 | AB49: 87 | AC49: 70.114942528735625 | AD49: 4
A50: RICHMOND | W50: NORTH MELBOURNE | X50: 1 | Y50: 1 | Z50: 0 | AA50: 51 | AB50: 97 | AC50: 52.577319587628864 | AD50: 4
A52: NORTH MELBOURNE | C52: 1 | D52: 1 | E52: =C52*6+D52 -> 7 | G52: 3 | H52: 4 | I52: =G52*6+H52 -> 22 | K52: 4 | L52: 7 | M52: =K52*6+L52 -> 31 | O52: 4 | P52: 9 | Q52: =O52*6+P52 -> 33 | S52: WILLIAMSTOWN | W52: WILLIAMSTOWN | X52: 0 | Y52: 2 | Z52: 0 | AA52: 52 | AB52: 62 | AC52: 83.870967741935488 | AD52: 0
A53: WILLIAMSTOWN | C53: 1 | D53: 4 | E53: =C53*6+D53 -> 10 | G53: 3 | H53: 4 | I53: =G53*6+H53 -> 22 | K53: 3 | L53: 5 | M53: =K53*6+L53 -> 23 | O53: 4 | P53: 6 | Q53: =O53*6+P53 -> 30 | S53: CARRIS | W53: BRUNSWICK | X53: 0 | Y53: 2 | Z53: 0 | AA53: 37 | AB53: 86 | AC53: 43.02325581395349 | AD53: 0
A54: BEST PLAYERS
A55: NORTH MELBOURNE | C55: H .LAUNDER | F55: E. LAUNDER | I55: TUCKWELL | L55: MONTGOMERIE | O55: QUILLIGAN | R55: GRIERSON
A56: WILLIAMSTOWN | C56: WARREN | F56: WORRALL | I56: ROACH | L56: KENNERSON | O56: BARNES | R56: HALL
A57: GOALKICKERS
A58: NORTH MELBOURNE | C58: BARTY 2 | F58: WOODHAM | I58: TORPEY
A59: WILLIAMSTOWN | C59: WARREN | F59: BRISTOW | I59: WORRALL | L59: FITZPATRICK
A61: FOOTSCRAY | C61: 2 | D61: 2 | E61: =C61*6+D61 -> 14 | G61: 5 | H61: 4 | I61: =G61*6+H61 -> 34 | K61: 6 | L61: 9 | M61: =K61*6+L61 -> 45 | O61: 6 | P61: 12 | Q61: =O61*6+P61 -> 48 | S61: FOOTSCRAY
A62: BRUNSWICK | C62: 0 | D62: 0 | E62: =C62*6+D62 -> 0 | G62: 0 | H62: 4 | I62: =G62*6+H62 -> 4 | K62: 3 | L62: 4 | M62: =K62*6+L62 -> 22 | O62: 3 | P62: 4 | Q62: =O62*6+P62 -> 22 | S62: MOLYNEAUX
A63: BEST PLAYERS
A64: FOOTSCRAY | C64: POWELL | F64: MOLYNEUX | I64: McCARROLL | L64: KENNEDY | O64: PALMER | R64: RUTLEY
A65: BRUNSWICK | C65: JOHNSON | F65: O'LOUGHLIN | I65: GORDON | L65: SAMPSON | O65: McCORMACK | R65: McNAMARA
A66: GOALKICKERS
A67: FOOTSCRAY | C67: RUTLEY 3 | G67: KENNEDY | J67: PALMER | M67: GRUNDEN
A68: BRUNSWICK | C68: BOYLE 2 | G68: KENNEDY
A71: ROUND 3 | E71: 15TH MAY | I71: WEATHER | M71: FINE S.E. BREEZE
D73: 1ST QTR | H73: 2ND QTR | L73: 3RD QTR | P73: FINAL | S73: AT
S74: WILLIAMSTOWN
A75: PORT MELBOURNE | C75: 0 | D75: 2 | E75: =C75*6+D75 -> 2 | G75: 0 | H75: 2 | I75: =G75*6+H75 -> 2 | K75: 3 | L75: 8 | M75: =K75*6+L75 -> 26 | O75: 4 | P75: 8 | Q75: =O75*6+P75 -> 32 | S75: UMPIRE | W75: LADDER | AB75: ROUND | AD75: 3
A76: WILLIAMSTOWN | C76: 0 | D76: 0 | E76: =C76*6+D76 -> 0 | G76: 2 | H76: 0 | I76: =G76*6+H76 -> 12 | K76: 2 | L76: 0 | M76: =K76*6+L76 -> 12 | O76: 2 | P76: 3 | Q76: =O76*6+P76 -> 15 | S76: TIERNAN
A77: BEST PLAYERS | W77: TEAM | X77: W | Y77: L | Z77: D | AA77: FOR | AB77: AGST | AC77: % | AD77: PTS
A78: PORT MELBOURNE | C78: JOHNSTON | F78: W. MONAGLE | I78: O'BRIEN | L78: SULLIVAN | O78: HICKEY | R78: POLLACK
A79: WILLIAMSTOWN | C79: WARREN | F79: SCOTT | I79: McWILLIAMS | L79: SPRINTALL | O79: THOMPSON | R79: ROACH | W79: PORT MELBOURNE | X79: 3 | Y79: 0 | Z79: 0 | AA79: 171 | AB79: 56 | AC79: 305.35714285714283 | AD79: 12
A80: GOALKICKERS | W80: FOOTSCRAY | X80: 3 | Y80: 0 | Z80: 0 | AA80: 152 | AB80: 84 | AC80: 180.95238095238096 | AD80: 12
A81: PORT MELBOURNE | C81: ROWAN 2 | W81: RICHMOND | X81: 1 | Y81: 2 | Z81: 0 | AA81: 101 | AB81: 162 | AC81: 62.345679012345677 | AD81: 4
A82: WILLIAMSTOWN | W82: BRUNSWICK | X82: 1 | Y82: 2 | Z82: 0 | AA82: 58 | AB82: 102 | AC82: 56.862745098039213 | AD82: 4
A84: FOOTSCRAY | C84: 5 | D84: 5 | E84: =C84*6+D84 -> 35 | G84: 6 | H84: 5 | I84: =G84*6+H84 -> 41 | K84: 8 | L84: 11 | M84: =K84*6+L84 -> 59 | O84: 10 | P84: 15 | Q84: =O84*6+P84 -> 75 | S84: RICHMOND | W84: NORTH MELBOURNE | X84: 1 | Y84: 2 | Z84: 0 | AA84: 67 | AB84: 118 | AC84: 56.779661016949156 | AD84: 4
A85: RICHMOND | C85: 0 | D85: 1 | E85: =C85*6+D85 -> 1 | G85: 3 | H85: 6 | I85: =G85*6+H85 -> 24 | K85: 3 | L85: 8 | M85: =K85*6+L85 -> 26 | O85: 5 | P85: 10 | Q85: =O85*6+P85 -> 40 | S85: CARRIS | W85: WILLIAMSTOWN | X85: 0 | Y85: 3 | Z85: 0 | AA85: 67 | AB85: 94 | AC85: 71.276595744680847 | AD85: 0
A86: BEST PLAYERS
A87: FOOTSCRAY | C87: BROCKWELL | F87: EVANS | I87: RUTLEY | L87: R.DICK | O87: MOLYNEAUX | R87: WILLIAMS
A88: RICHMOND | C88: BACKHOUSE | F88: ELDER | I88: BRENNAN | L88: PARKER | O88: HARRIS | R88: RYAN
A89: GOALKICKERS
A90: FOOTSCRAY | C90: RUTLEY 3 | F90: GREGORY 2
A91: RICHMOND | C91: RYAN 2 | F91: ELDER | I91: HAYES
A93: BRUNSWICK | C93: 0 | D93: 0 | E93: =C93*6+D93 -> 0 | G93: 0 | H93: 1 | I93: =G93*6+H93 -> 1 | K93: 0 | L93: 1 | M93: =K93*6+L93 -> 1 | O93: 3 | P93: 3 | Q93: =O93*6+P93 -> 21 | S93: BRUNSWICK
A94: NORTH MELBOURNE | C94: 0 | D94: 5 | E94: =C94*6+D94 -> 5 | G94: 0 | H94: 7 | I94: =G94*6+H94 -> 7 | K94: 0 | L94: 10 | M94: =K94*6+L94 -> 10 | O94: 1 | P94: 10 | Q94: =O94*6+P94 -> 16 | S94: SHAW
A95: BEST PLAYERS
A96: BRUNSWICK | C96: O'LOUGHLIN | F96: JOHNSON | I96: DALTON | L96: MUDGE | O96: HOCKING
A97: NORTH MELBOURNE | C97: ROLENT | F97: E .LAUNDER | I97: QUILLIGAN | L97: MONTGOMERIE | O97: CALDWELL | R97: H LAUNDER
A98: GOALKICKERS
A99: BRUNSWICK | C99: ROBERTSON 2 | H99: FILER
A100: NORTH MELBOURNE | C100: O'LOUGHLEN
A103: ROUND 4 | E103: 22ND MAY | I103: WEATHER | M103: FINE S.E. BREEZE
D105: 1ST QTR | H105: 2ND QTR | L105: 3RD QTR | P105: FINAL | S105: AT
S106: PORT MELB
A107: PORT MELBOURNE | C107: 3 | D107: 5 | E107: =C107*6+D107 -> 23 | G107: 6 | H107: 8 | I107: =G107*6+H107 -> 44 | K107: 12 | L107: 13 | M107: =K107*6+L107 -> 85 | O107: 17 | P107: 18 | Q107: =O107*6+P107 -> 120 | S107: UMPIRE | W107: LADDER | AB107: ROUND | AD107: 4
A108: BRUNSWICK | C108: 0 | D108: 0 | E108: =C108*6+D108 -> 0 | G108: 1 | H108: 0 | I108: =G108*6+H108 -> 6 | K108: 2 | L108: 0 | M108: =K108*6+L108 -> 12 | O108: 2 | P108: 1 | Q108: =O108*6+P108 -> 13
A109: BEST PLAYERS | W109: TEAM | X109: W | Y109: L | Z109: D | AA109: FOR | AB109: AGST | AC109: % | AD109: PTS
A110: PORT MELBOURNE | C110: DALY | F110: ANDERSON | I110: HENDERSON | L110: JOHNSON | O110: O'BRIEN | R110: MORTON
A111: BRUNSWICK | C111: O'LOUGHLIN | F111: McNAMARA | I111: HOCKING | L111: ROBERTSON | O111: JOHNSON | R111: GORDON | W111: PORT MELBOURNE | X111: 4 | Y111: 0 | Z111: 0 | AA111: 291 | AB111: 69 | AC111: 421.73913043478262 | AD111: 16
A112: GOALKICKERS | W112: FOOTSCRAY | X112: 4 | Y112: 0 | Z112: 0 | AA112: 214 | AB112: 139 | AC112: 153.9568345323741 | AD112: 16
A113: PORT MELBOURNE | C113: DALY 7 | F113: ROWAN 6 | W113: RICHMOND | X113: 1 | Y113: 2 | Z113: 1 | AA113: 153 | AB113: 214 | AC113: 71.495327102803742 | AD113: 6
A114: BRUNSWICK | W114: NORTH MELBOURNE | X114: 1 | Y114: 3 | Z114: 0 | AA114: 122 | AB114: 180 | AC114: 67.777777777777771 | AD114: 4
A116: FOOTSCRAY | C116: 2 | D116: 3 | E116: =C116*6+D116 -> 15 | G116: 5 | H116: 5 | I116: =G116*6+H116 -> 35 | K116: 7 | L116: 5 | M116: =K116*6+L116 -> 47 | O116: 9 | P116: 8 | Q116: =O116*6+P116 -> 62 | S116: EAST MELB | W116: BRUNSWICK | X116: 1 | Y116: 3 | Z116: 0 | AA116: 71 | AB116: 222 | AC116: 31.981981981981981 | AD116: 4
A117: NORTH MELBOURNE | C117: 4 | D117: 4 | E117: =C117*6+D117 -> 28 | G117: 6 | H117: 6 | I117: =G117*6+H117 -> 42 | K117: 8 | L117: 6 | M117: =K117*6+L117 -> 54 | O117: 8 | P117: 7 | Q117: =O117*6+P117 -> 55 | S117: MOLYNEAUX | W117: WILLIAMSTOWN | X117: 0 | Y117: 3 | Z117: 1 | AA117: 119 | AB117: 146 | AC117: 81.506849315068493 | AD117: 2
A118: BEST PLAYERS
A119: FOOTSCRAY | C119: ARMSTRONG | F119: BROCKWELL | I119: WILSON | L119: EVANS | O119: GREGORY | R119: HARRIS
A120: NORTH MELBOURNE | C120: TORPEY | F120: GRIERSON | I120: H LAUNDER | L120: E LAUNDER | O120: TUCKWELL | R120: CALDWELL
A121: GOALKICKERS
A122: FOOTSCRAY | C122: GRUNDEN 3 | F122: PRICE | H122: DREW | J122: EVANS | L122: DICKENS | N122: BROCKWELL | Q122: RUTLEY
A123: NORTH MELBOURNE | C123: SNOW 2 | F123: TORPEY 2 | I123: TAYLOR | K123: ROLENT | M123: DAVIS | O123: RUTLEY
A125: RICHMOND | C125: 1 | D125: 2 | E125: =C125*6+D125 -> 8 | G125: 4 | H125: 5 | I125: =G125*6+H125 -> 29 | K125: 6 | L125: 8 | M125: =K125*6+L125 -> 44 | O125: 7 | P125: 10 | Q125: =O125*6+P125 -> 52
A126: WILLIAMSTOWN | C126: 0 | D126: 2 | E126: =C126*6+D126 -> 2 | G126: 4 | H126: 2 | I126: =G126*6+H126 -> 26 | K126: 6 | L126: 4 | M126: =K126*6+L126 -> 40 | O126: 8 | P126: 4 | Q126: =O126*6+P126 -> 52
A127: BEST PLAYERS
A128: RICHMOND | C128: RYAN | F128: PARKER | I128: PITCHER | L128: BACKHOUSE | O128: WILKINS | R128: CLARKE
A129: WILLIAMSTOWN | C129: WORRALL | F129: WARREN | I129: HALL | L129: BARNES | O129: FAGAN | R129: RILEY
A130: GOALKICKERS
A131: RICHMOND | C131: PITCHER 4 | F131: ELDER | I131: DOBSON | L131: RYAN
A132: WILLIAMSTOWN | C132: WILSON 3 | F132: CHARLES 3 | I132: SCOTT 2
A135: ROUND 5 | B135: QUEENS BIRTHDAY | G135: 24TH MAY | J135: WEATHER | M135: NORTH BREEZE | Q135: GAMES PLAYED IN MORNING
D137: 1ST QTR | H137: 2ND QTR | L137: 3RD QTR | P137: FINAL | S137: AT
S138: FOOTSCRAY
A139: PORT MELBOURNE | C139: 0 | D139: 1 | E139: =C139*6+D139 -> 1 | G139: 3 | H139: 5 | I139: =G139*6+H139 -> 23 | K139: 3 | L139: 5 | M139: =K139*6+L139 -> 23 | O139: 7 | P139: 9 | Q139: =O139*6+P139 -> 51 | S139: UMPIRE | W139: LADDER | AB139: ROUND | AD139: 5
A140: FOOTSCRAY | C140: 1 | D140: 3 | E140: =C140*6+D140 -> 9 | G140: 1 | H140: 3 | I140: =G140*6+H140 -> 9 | K140: 2 | L140: 5 | M140: =K140*6+L140 -> 17 | O140: 2 | P140: 5 | Q140: =O140*6+P140 -> 17 | S140: SHAW
A141: BEST PLAYERS | W141: TEAM | X141: W | Y141: L | Z141: D | AA141: FOR | AB141: AGST | AC141: % | AD141: PTS
A142: PORT MELBOURNE | C142: JOHNSTON | F142: HENDERSON | I142: SHANNON | L142: McGREGOR | O142: ROWAN | R142: McGEE
A143: FOOTSCRAY | C143: DEANE | F143: DREW | I143: BROCKWELL | L143: MOLYNEAUX | O143: McCARTHY | R143: GRUNDEN | W143: PORT MELBOURNE | X143: 5 | Y143: 0 | Z143: 0 | AA143: 342 | AB143: 86 | AC143: 397.67441860465118 | AD143: 20
A144: GOALKICKERS | W144: FOOTSCRAY | X144: 4 | Y144: 1 | Z144: 0 | AA144: 231 | AB144: 190 | AC144: 121.57894736842105 | AD144: 16
A145: PORT MELBOURNE | C145: ROWAN 3 | F145: SHANNON 3 | J145: DALY | W145: NORTH MELBOURNE | X145: 2 | Y145: 3 | Z145: 0 | AA145: 165 | AB145: 222 | AC145: 74.324324324324323 | AD145: 8
A146: FOOTSCRAY | C146: RUTLEY | F146: GREGORY | W146: WILLIAMSTOWN | X146: 1 | Y146: 3 | Z146: 1 | AA146: 189 | AB146: 172 | AC146: 109.88372093023256 | AD146: 6
A148: NORTH MELBOURNE | C148: 1 | D148: 2 | E148: =C148*6+D148 -> 8 | G148: 4 | H148: 6 | I148: =G148*6+H148 -> 30 | K148: 4 | L148: 9 | M148: =K148*6+L148 -> 33 | O148: 5 | P148: 13 | Q148: =O148*6+P148 -> 43 | S148: EAST MELB | W148: RICHMOND | X148: 1 | Y148: 3 | Z148: 1 | AA148: 195 | AB148: 257 | AC148: 75.875486381322958 | AD148: 6
A149: RICHMOND | C149: 2 | D149: 2 | E149: =C149*6+D149 -> 14 | G149: 2 | H149: 4 | I149: =G149*6+H149 -> 16 | K149: 5 | L149: 6 | M149: =K149*6+L149 -> 36 | O149: 6 | P149: 6 | Q149: =O149*6+P149 -> 42 | S149: MOLYNEAUX | W149: BRUNSWICK | X149: 1 | Y149: 4 | Z149: 0 | AA149: 97 | AB149: 292 | AC149: 33.219178082191782 | AD149: 4
A150: BEST PLAYERS
A151: NORTH MELBOURNE | C151: E LAUNDER | F151: STUCKEY | I151: CALDWELL | L151: QUILLIGAN | O151: GRIERSON | R151: TORPEY
A152: RICHMOND | C152: RYAN | F152: PARKER | I152: CLARKE | L152: KELLY | O152: BACKHOUSE | R152: ELDER
A153: GOALKICKERS
A154: NORTH MELBOURNE | C154: E LAUNDER 2 | G154: GRIERSON | J154: LIVINGSTONE | N154: TORPEY
A155: RICHMOND | C155: PITCHER 2 | G155: ELDER 2 | J155: DOBSON | M155: RYAN | O155: SMITH
A157: WILLIAMSTOWN | C157: 1 | D157: 3 | E157: =C157*6+D157 -> 9 | G157: 3 | H157: 9 | I157: =G157*6+H157 -> 27 | K157: 5 | L157: 13 | M157: =K157*6+L157 -> 43 | O157: 9 | P157: 16 | Q157: =O157*6+P157 -> 70 | S157: WILLIAMSTOWN
A158: BRUNSWICK | C158: 0 | D158: 2 | E158: =C158*6+D158 -> 2 | G158: 1 | H158: 2 | I158: =G158*6+H158 -> 8 | K158: 4 | L158: 2 | M158: =K158*6+L158 -> 26 | O158: 4 | P158: 2 | Q158: =O158*6+P158 -> 26 | S158: CARRIS
A159: BEST PLAYERS
A160: WILLIAMSTOWN | C160: ROCHE | F160: GUTHRIE | J160: WORROLL
A161: BRUNSWICK
A162: GOALKICKERS
A163: WILLIAMSTOWN | C163: KENNISON 3 | F163: GUTHRIE 3 | I163: WILKINS | K163: SCOTT | M163: WORROLL
A164: BRUNSWICK | C164: HELLYER 2 | F164: McNAMARA | I164: BARRASS
A167: ROUND 6 | E167: 29TH MAY | I167: WEATHER | M167: N.W. WIND
D169: 1ST QTR | H169: 2ND QTR | L169: 3RD QTR | P169: FINAL | S169: AT
S170: EAST MELB
A171: NORTH MELBOURNE | C171: 0 | D171: 2 | E171: =C171*6+D171 -> 2 | G171: 2 | H171: 2 | I171: =G171*6+H171 -> 14 | K171: 2 | L171: 4 | M171: =K171*6+L171 -> 16 | O171: 6 | P171: 5 | Q171: =O171*6+P171 -> 41 | S171: UMPIRE | W171: LADDER | AB171: ROUND | AD171: 6
A172: PORT MELBOURNE | C172: 1 | D172: 0 | E172: =C172*6+D172 -> 6 | G172: 2 | H172: 2 | I172: =G172*6+H172 -> 14 | K172: 2 | L172: 5 | M172: =K172*6+L172 -> 17 | O172: 2 | P172: 8 | Q172: =O172*6+P172 -> 20 | S172: CARRIS
A173: BEST PLAYERS | W173: TEAM | X173: W | Y173: L | Z173: D | AA173: FOR | AB173: AGST | AC173: % | AD173: PTS
A174: NORTH MELBOURNE | C174: CALDWELL | F174: E LAUNDER | I174: H LAUNDER | L174: TORPEY | O174: RUTLEY | R174: OATES
A175: PORT MELBOURNE | C175: W .MONAGLE | F175: DALY | I175: SHANNON | L175: POWELL | O175: HICKEY | R175: FREAME | W175: PORT MELBOURNE | X175: 5 | Y175: 1 | Z175: 0 | AA175: 362 | AB175: 127 | AC175: 285.03937007874015 | AD175: 20
A176: GOALKICKERS | W176: FOOTSCRAY | X176: 5 | Y176: 1 | Z176: 0 | AA176: 253 | AB176: 194 | AC176: 130.41237113402062 | AD176: 20
A177: NORTH MELBOURNE | C177: BARTY 3 | F177: HOUSTON 2 | I177: TAYLOR | W177: NORTH MELBOURNE | X177: 3 | Y177: 3 | Z177: 0 | AA177: 206 | AB177: 242 | AC177: 85.123966942148755 | AD177: 12
A178: PORT MELBOURNE | W178: BRUNSWICK | X178: 2 | Y178: 4 | Z178: 0 | AA178: 151 | AB178: 331 | AC178: 45.619335347432028 | AD178: 8
A180: FOOTSCRAY | C180: 2 | D180: 1 | E180: =C180*6+D180 -> 13 | G180: 2 | H180: 4 | I180: =G180*6+H180 -> 16 | K180: 2 | L180: 8 | M180: =K180*6+L180 -> 20 | O180: 2 | P180: 10 | Q180: =O180*6+P180 -> 22 | S180: FOOTSCRAY | W180: WILLIAMSTOWN | X180: 1 | Y180: 4 | Z180: 1 | AA180: 193 | AB180: 194 | AC180: 99.484536082474222 | AD180: 6
A181: WILLIAMSTOWN | C181: 0 | D181: 2 | E181: =C181*6+D181 -> 2 | G181: 0 | H181: 2 | I181: =G181*6+H181 -> 2 | K181: 0 | L181: 3 | M181: =K181*6+L181 -> 3 | O181: 0 | P181: 4 | Q181: =O181*6+P181 -> 4 | S181: SHAW | W181: RICHMOND | X181: 1 | Y181: 4 | Z181: 1 | AA181: 234 | AB181: 311 | AC181: 75.241157556270096 | AD181: 6
A182: BEST PLAYERS
A183: FOOTSCRAY | C183: WILLIAMS | F183: McCARTHY | I183: DICK | L183: GRUNDEN | O183: GREGORY | R183: DICKENS
A184: WILLIAMSTOWN | C184: McCALLUM | F184: DYSON | I184: McWILLIAMS | L184: RILEY | O184: WARREN | R184: HALL
A185: GOALKICKERS
A186: FOOTSCRAY | C186: GREGORY | F186: RUTLEY
A187: WILLIAMSTOWN | C187: NIL
A189: BRUNSWICK | C189: 4 | D189: 1 | E189: =C189*6+D189 -> 25 | G189: 5 | H189: 1 | I189: =G189*6+H189 -> 31 | K189: 6 | L189: 3 | M189: =K189*6+L189 -> 39 | O189: 8 | P189: 6 | Q189: =O189*6+P189 -> 54 | S189: BRUNSWICK
A190: RICHMOND | C190: 0 | D190: 2 | E190: =C190*6+D190 -> 2 | G190: 2 | H190: 8 | I190: =G190*6+H190 -> 20 | K190: 3 | L190: 12 | M190: =K190*6+L190 -> 30 | O190: 4 | P190: 15 | Q190: =O190*6+P190 -> 39 | S190: MOLYNEAUX
A191: BEST PLAYERS
A192: BRUNSWICK | C192: JOHNSON | F192: O'LOUGHLIN | I192: McNAMARA | L192: McCORMACK | O192: McDONALD | R192: WHELAN
A193: RICHMOND | C193: PARKER | F193: BACKHOUSE | I193: HARRIS | L193: CLARKE | O193: ELDER | R193: HAYES
A194: GOALKICKERS
A195: BRUNSWICK | C195: HELLYER 3
A196: RICHMOND | C196: ELDER 2 | F196: HOWARD | I196: HAYES
A198: ROUND 7 | E198: 5TH JUNE | I198: WEATHER | M198: NORTH WIND SHOWERS
D199: 1ST QTR | H199: 2ND QTR | L199: 3RD QTR | P199: FINAL | S199: AT
S200: RICHMOND
A201: PORT MELBOURNE | C201: 4 | D201: 5 | E201: =C201*6+D201 -> 29 | G201: 6 | H201: 8 | I201: =G201*6+H201 -> 44 | K201: 7 | L201: 11 | M201: =K201*6+L201 -> 53 | O201: 8 | P201: 12 | Q201: =O201*6+P201 -> 60 | S201: UMPIRE | W201: LADDER | AB201: ROUND | AD201: 7
A202: RICHMOND | C202: 0 | D202: 1 | E202: =C202*6+D202 -> 1 | G202: 3 | H202: 1 | I202: =G202*6+H202 -> 19 | K202: 6 | L202: 1 | M202: =K202*6+L202 -> 37 | O202: 8 | P202: 1 | Q202: =O202*6+P202 -> 49 | S202: TIERNAN
A203: BEST PLAYERS | W203: TEAM | X203: W | Y203: L | Z203: D | AA203: FOR | AB203: AGST | AC203: % | AD203: PTS
A204: PORT MELBOURNE | C204: JOHNSON | F204: POLLACK | I204: McGREGOR | L204: KNOX | O204: W MONAGLE | R204: HENDERSON
A205: RICHMOND | C205: PARKER | F205: HARRIS | I205: CLARKE | L205: RYAN | O205: HAYES | R205: WATSON | W205: PORT MELBOURNE | X205: 6 | Y205: 1 | Z205: 0 | AA205: 422 | AB205: 176 | AC205: 239.77272727272728 | AD205: 24
A206: GOALKICKERS | W206: FOOTSCRAY | X206: 6 | Y206: 1 | Z206: 0 | AA206: 309 | AB206: 222 | AC206: 139.18918918918919 | AD206: 24
A207: PORT MELBOURNE | W207: NORTH MELBOURNE | X207: 4 | Y207: 3 | Z207: 0 | AA207: 244 | AB207: 265 | AC207: 92.075471698113205 | AD207: 16
A208: RICHMOND | C208: PATERNOSTER 2 | G208: KELLY 2 | J208: RYAN 2 | M208: ELDER 2 | W208: BRUNSWICK | X208: 2 | Y208: 5 | Z208: 0 | AA208: 179 | AB208: 387 | AC208: 46.253229974160206 | AD208: 8
A210: FOOTSCRAY | C210: 2 | D210: 5 | E210: =C210*6+D210 -> 17 | G210: 4 | H210: 5 | I210: =G210*6+H210 -> 29 | K210: 8 | L210: 6 | M210: =K210*6+L210 -> 54 | O210: 8 | P210: 8 | Q210: =O210*6+P210 -> 56 | S210: BRUNSWICK | W210: WILLIAMSTOWN | X210: 1 | Y210: 5 | Z210: 1 | AA210: 216 | AB210: 232 | AC210: 93.103448275862064 | AD210: 6
A211: BRUNSWICK | C211: 2 | D211: 1 | E211: =C211*6+D211 -> 13 | G211: 2 | H211: 1 | I211: =G211*6+H211 -> 13 | K211: 2 | L211: 1 | M211: =K211*6+L211 -> 13 | O211: 4 | P211: 4 | Q211: =O211*6+P211 -> 28 | S211: CARRIS | W211: RICHMOND | X211: 1 | Y211: 5 | Z211: 1 | AA211: 283 | AB211: 371 | AC211: 76.280323450134773 | AD211: 6
A212: BEST PLAYERS
A213: FOOTSCRAY | C213: RUTLEY | F213: EVANS | I213: DICK | L213: GRUNDEN | O213: WILLIAMS | R213: POWELL
A214: BRUNSWICK | C214: JOHNSON | F214: O'LOUGHLIN | I214: WHELAN | L214: McNAMARA | O214: SAMPSON
A215: GOALKICKERS
A216: FOOTSCRAY | C216: RUTLEY 4 | F216: DICKENS | I216: ARMSTRONG | L216: SHANAHAN | O216: DEAN
A217: BRUNSWICK | C217: JOHNSON 2 | F217: M O'LOUGHLIN | J217: HELLYER
A219: NORTH MELBOURNE | C219: 2 | D219: 3 | E219: =C219*6+D219 -> 15 | G219: 4 | H219: 4 | I219: =G219*6+H219 -> 28 | K219: 5 | L219: 8 | M219: =K219*6+L219 -> 38 | O219: 5 | P219: 8 | Q219: =O219*6+P219 -> 38 | S219: EAST MELB
A220: WILLIAMSTOWN | C220: 0 | D220: 3 | E220: =C220*6+D220 -> 3 | G220: 0 | H220: 4 | I220: =G220*6+H220 -> 4 | K220: 2 | L220: 4 | M220: =K220*6+L220 -> 16 | O220: 3 | P220: 5 | Q220: =O220*6+P220 -> 23 | S220: SHAW
A221: BEST PLAYERS
A222: NORTH MELBOURNE | C222: STUCKEY | F222: CALDWELL | I222: RUTLEY | L222: MONTGOMERIE | O222: TORPEY | R222: GRIERSON
A223: WILLIAMSTOWN | C223: McWILLIAMS | F223: RILEY | I223: FAGAN | L223: BARNES | O223: THOMPSON | R223: WORRALL
A224: GOALKICKERS
A225: NORTH MELBOURNE | C225: H LAUNDER 2 | G225: TUCKWELL | J225: BARTY | M225: HOUSTEN
A226: WILLIAMSTOWN | C226: SCOTT | F226: WARREN | I226: DAWKIN
A229: ROUND 8 | E229: 12TH JUNE | I229: WEATHER | M229: FINE
D231: 1ST QTR | H231: 2ND QTR | L231: 3RD QTR | P231: FINAL | S231: AT
S232: PORT MELBOURNE
A233: PORT MELBOURNE | C233: 1 | D233: 1 | E233: =C233*6+D233 -> 7 | G233: 3 | H233: 2 | I233: =G233*6+H233 -> 20 | K233: 3 | L233: 6 | M233: =K233*6+L233 -> 24 | O233: 4 | P233: 10 | Q233: =O233*6+P233 -> 34 | S233: UMPIRE | W233: LADDER | AB233: ROUND | AD233: 8
A234: WILLIAMSTOWN | C234: 0 | D234: 2 | E234: =C234*6+D234 -> 2 | G234: 0 | H234: 4 | I234: =G234*6+H234 -> 4 | K234: 4 | L234: 5 | M234: =K234*6+L234 -> 29 | O234: 4 | P234: 5 | Q234: =O234*6+P234 -> 29 | S234: CARRIS
A235: BEST PLAYERS | W235: TEAM | X235: W | Y235: L | Z235: D | AA235: FOR | AB235: AGST | AC235: % | AD235: PTS
A236: PORT MELBOURNE | C236: HENDERSON | F236: RYAN | I236: FREAME | L236: JOHNSON | O236: McGREGOR | R236: HICKEY
A237: WILLIAMSTOWN | C237: RILEY | F237: WARREN | I237: WORRALL | L237: FAGAN | O237: GUTHRIE | R237: HALL | W237: PORT MELBOURNE | X237: 7 | Y237: 1 | Z237: 0 | AA237: 456 | AB237: 205 | AC237: 222.4390243902439 | AD237: 28
A238: GOALKICKERS | W238: FOOTSCRAY | X238: 7 | Y238: 1 | Z238: 0 | AA238: 370 | AB238: 266 | AC238: 139.09774436090225 | AD238: 28
A239: PORT MELBOURNE | W239: NORTH MELBOURNE | X239: 5 | Y239: 3 | Z239: 0 | AA239: 301 | AB239: 286 | AC239: 105.24475524475524 | AD239: 20
A240: WILLIAMSTOWN | C240: KENNISON | F240: WARREN | I240: FAGAN | L240: HALL | W240: BRUNSWICK | X240: 2 | Y240: 6 | Z240: 0 | AA240: 200 | AB240: 444 | AC240: 45.045045045045043 | AD240: 8
A242: NORTH MELBOURNE | C242: 1 | D242: 1 | E242: =C242*6+D242 -> 7 | G242: 4 | H242: 3 | I242: =G242*6+H242 -> 27 | K242: 4 | L242: 6 | M242: =K242*6+L242 -> 30 | O242: 8 | P242: 9 | Q242: =O242*6+P242 -> 57 | S242: BRUNSWICK | W242: WILLIAMSTOWN | X242: 1 | Y242: 6 | Z242: 1 | AA242: 245 | AB242: 266 | AC242: 92.10526315789474 | AD242: 6
A243: BRUNSWICK | C243: 0 | D243: 2 | E243: =C243*6+D243 -> 2 | G243: 0 | H243: 3 | I243: =G243*6+H243 -> 3 | K243: 2 | L243: 5 | M243: =K243*6+L243 -> 17 | O243: 2 | P243: 9 | Q243: =O243*6+P243 -> 21 | S243: MOLYNEAUX | W243: RICHMOND | X243: 1 | Y243: 6 | Z243: 1 | AA243: 327 | AB243: 432 | AC243: 75.694444444444443 | AD243: 6
A244: BEST PLAYERS
A245: NORTH MELBOURNE | C245: E LAUNDER | F245: STUCKEY | I245: CALDWELL | L245: QUILLIGAN | O245: O'LOGHLEN | R245: TORPEY
A246: BRUNSWICK | C246: O'LOUGHLIN | F246: JOHNSON | I246: MUDGE | L246: ELDER | O246: THOMPSON | R246: McCORMACK
A247: GOALKICKERS
A248: NORTH MELBOURNE | C248: H LAUNDER 2 | F248: TAYLOR 2 | I248: MURRAY 2 | L248: GRAHAM | O248: CARLTON
A249: BRUNSWICK
A251: FOOTSCRAY | C251: 1 | D251: 5 | E251: =C251*6+D251 -> 11 | G251: 6 | H251: 10 | I251: =G251*6+H251 -> 46 | K251: 7 | L251: 13 | M251: =K251*6+L251 -> 55 | O251: 8 | P251: 13 | Q251: =O251*6+P251 -> 61 | S251: FOOTSCRAY
A252: RICHMOND | C252: 1 | D252: 3 | E252: =C252*6+D252 -> 9 | G252: 1 | H252: 6 | I252: =G252*6+H252 -> 12 | K252: 2 | L252: 6 | M252: =K252*6+L252 -> 18 | O252: 6 | P252: 8 | Q252: =O252*6+P252 -> 44 | S252: SHAW
A253: BEST PLAYERS
A254: FOOTSCRAY | C254: MOLYNEUX | F254: EVANS | I254: DICK | L254: ARMSTRONG | O254: DEAN | R254: McCARROLL
A255: RICHMOND | C255: PARKER | F255: CLARKE | I255: ELDER | L255: BAHEN | O255: BACKHOUSE | R255: POWELL
A256: GOALKICKERS
A257: FOOTSCRAY | C257: CLAYTON 2 | F257: CABELL 2 | I257: GREGORY 2 | L257: GRUNDEN | O257: RUTLEY
A258: RICHMOND | C258: ELDER 3 | F258: RYAN 2 | I258: SNOW
A261: ROUND 9 | E261: 19TH JUNE | I261: WEATHER | M261: WEST WIND RAIN
D263: 1ST QTR | H263: 2ND QTR | L263: 3RD QTR | P263: FINAL | S263: AT
S264: BRUNSWICK
A265: PORT MELBOURNE | C265: 1 | D265: 4 | E265: =C265*6+D265 -> 10 | G265: 3 | H265: 8 | I265: =G265*6+H265 -> 26 | K265: 4 | L265: 8 | M265: =K265*6+L265 -> 32 | O265: 6 | P265: 9 | Q265: =O265*6+P265 -> 45 | S265: UMPIRE | W265: LADDER | AB265: ROUND | AD265: 9
A266: BRUNSWICK | C266: 1 | D266: 1 | E266: =C266*6+D266 -> 7 | G266: 1 | H266: 1 | I266: =G266*6+H266 -> 7 | K266: 1 | L266: 1 | M266: =K266*6+L266 -> 7 | O266: 1 | P266: 1 | Q266: =O266*6+P266 -> 7 | S266: SHAW
A267: BEST PLAYERS | W267: TEAM | X267: W | Y267: L | Z267: D | AA267: FOR | AB267: AGST | AC267: % | AD267: PTS
A268: PORT MELBOURNE | C268: W MONAGLE | F268: JOHNSON | I268: HICKEY | L268: FREAME | O268: SHANNON | R268: FLEMMING
A269: BRUNSWICK | C269: JOHNSON | F269: WALSH | I269: O'LOUGHLIN | L269: SNELL | O269: MUDGE | W269: PORT MELBOURNE | X269: 8 | Y269: 1 | Z269: 0 | AA269: 501 | AB269: 212 | AC269: 236.32075471698113 | AD269: 32
A270: GOALKICKERS | W270: FOOTSCRAY | X270: 7 | Y270: 2 | Z270: 0 | AA270: 386 | AB270: 296 | AC270: 130.40540540540542 | AD270: 28
A271: PORT MELBOURNE | W271: NORTH MELBOURNE | X271: 6 | Y271: 3 | Z271: 0 | AA271: 331 | AB271: 302 | AC271: 109.60264900662251 | AD271: 24
A272: BRUNSWICK | C272: M O'LOUGHLIN | W272: WILLIAMSTOWN | X272: 2 | Y272: 6 | Z272: 1 | AA272: 308 | AB272: 287 | AC272: 107.3170731707317 | AD272: 10
A274: NORTH MELBOURNE | C274: 1 | D274: 2 | E274: =C274*6+D274 -> 8 | G274: 2 | H274: 5 | I274: =G274*6+H274 -> 17 | K274: 2 | L274: 10 | M274: =K274*6+L274 -> 22 | O274: 3 | P274: 12 | Q274: =O274*6+P274 -> 30 | S274: EAST MELB | W274: BRUNSWICK | X274: 2 | Y274: 7 | Z274: 0 | AA274: 207 | AB274: 489 | AC274: 42.331288343558285 | AD274: 8
A275: FOOTSCRAY | C275: 0 | D275: 1 | E275: =C275*6+D275 -> 1 | G275: 1 | H275: 3 | I275: =G275*6+H275 -> 9 | K275: 1 | L275: 3 | M275: =K275*6+L275 -> 9 | O275: 2 | P275: 4 | Q275: =O275*6+P275 -> 16 | S275: CARRIS | W275: RICHMOND | X275: 1 | Y275: 7 | Z275: 1 | AA275: 348 | AB275: 495 | AC275: 70.303030303030297 | AD275: 6
A276: BEST PLAYERS
A277: NORTH MELBOURNE | C277: QUILLIGAN | F277: TUCKWELL | I277: CALDWELL | L277: E LAUNDER | O277: H LAUNDER | R277: W CARLTON
A278: FOOTSCRAY | C278: BROCKWELL | F278: ARMSTRONG | I278: WILLIAMS | L278: POWELL | O278: GREGORY | R278: EVANS
A279: GOALKICKERS
A280: NORTH MELBOURNE | C280: GRAHAM | F280: O'LOUGHLEN | J280: H LAUNDER
A281: FOOTSCRAY | C281: HOUGHTON | F281: BROCKWELL
A283: WILLIAMSTOWN | C283: 3 | D283: 4 | E283: =C283*6+D283 -> 22 | G283: 3 | H283: 5 | I283: =G283*6+H283 -> 23 | K283: 5 | L283: 7 | M283: =K283*6+L283 -> 37 | O283: 8 | P283: 15 | Q283: =O283*6+P283 -> 63 | S283: WILLIAMSTOWN
A284: RICHMOND | C284: 1 | D284: 1 | E284: =C284*6+D284 -> 7 | G284: 2 | H284: 3 | I284: =G284*6+H284 -> 15 | K284: 3 | L284: 3 | M284: =K284*6+L284 -> 21 | O284: 3 | P284: 3 | Q284: =O284*6+P284 -> 21 | S284: MOLYNEAUX
A285: BEST PLAYERS
A286: WILLIAMSTOWN | C286: GOBLE | F286: W WARREN | I286: FAGAN | L286: WORROLL | O286: McCALLUM | R286: BRISTOW
A287: RICHMOND | C287: PARKER | F287: ELDER | I287: BRENNAN | L287: PATERNOSTER | O287: CLARKE
A288: GOALKICKERS
A289: WILLIAMSTOWN | C289: GOBLE 4
A290: RICHMOND | C290: ELDER 2 | F290: S PITCHER
A292: ROUND 10 | E292: 26TH JUNE | I292: WEATHER | M292: GROUNDS HEAVY AFTER RAIN
D293: 1ST QTR | H293: 2ND QTR | L293: 3RD QTR | P293: FINAL | S293: AT
S294: P.M.
A295: PORT MELBOURNE | C295: 2 | D295: 2 | E295: =C295*6+D295 -> 14 | G295: 2 | H295: 7 | I295: =G295*6+H295 -> 19 | K295: 3 | L295: 9 | M295: =K295*6+L295 -> 27 | O295: 3 | P295: 11 | Q295: =O295*6+P295 -> 29 | S295: UMPIRE | W295: LADDER | AB295: ROUND | AD295: 10
A296: FOOTSCRAY | C296: 0 | D296: 1 | E296: =C296*6+D296 -> 1 | G296: 0 | H296: 3 | I296: =G296*6+H296 -> 3 | K296: 2 | L296: 4 | M296: =K296*6+L296 -> 16 | O296: 3 | P296: 6 | Q296: =O296*6+P296 -> 24 | S296: MOLYNEAUX
A297: BEST PLAYERS | W297: TEAM | X297: W | Y297: L | Z297: D | AA297: FOR | AB297: AGST | AC297: % | AD297: PTS
A298: PORT MELBOURNE | C298: KNOX | F298: HARRIS | I298: W MONAGLE | L298: JOHNSON | O298: HICKEY | R298: O'BRIEN
A299: FOOTSCRAY | C299: R DICK | F299: HINCH | I299: DEANE | L299: POWELL | O299: WILLIAMS | R299: HARRIS | W299: PORT MELBOURNE | X299: 9 | Y299: 1 | Z299: 0 | AA299: 530 | AB299: 236 | AC299: 224.57627118644066 | AD299: 36
A300: GOALKICKERS | W300: FOOTSCRAY | X300: 7 | Y300: 3 | Z300: 0 | AA300: 410 | AB300: 325 | AC300: 126.15384615384616 | AD300: 28
A301: PORT MELBOURNE | W301: NORTH MELBOURNE | X301: 7 | Y301: 3 | Z301: 0 | AA301: 381 | AB301: 316 | AC301: 120.56962025316456 | AD301: 28
A302: FOOTSCRAY | C302: GREGORY 2 | G302: RUTLEY | W302: WILLIAMSTOWN | X302: 3 | Y302: 6 | Z302: 1 | AA302: 351 | AB302: 288 | AC302: 121.875 | AD302: 14
A304: NORTH MELBOURNE | C304: 2 | D304: 1 | E304: =C304*6+D304 -> 13 | G304: 4 | H304: 5 | I304: =G304*6+H304 -> 29 | K304: 4 | L304: 6 | M304: =K304*6+L304 -> 30 | O304: 7 | P304: 8 | Q304: =O304*6+P304 -> 50 | S304: RICHMOND | W304: BRUNSWICK | X304: 2 | Y304: 8 | Z304: 0 | AA304: 208 | AB304: 532 | AC304: 39.097744360902254 | AD304: 8
A305: RICHMOND | C305: 1 | D305: 0 | E305: =C305*6+D305 -> 6 | G305: 2 | H305: 1 | I305: =G305*6+H305 -> 13 | K305: 2 | L305: 1 | M305: =K305*6+L305 -> 13 | O305: 2 | P305: 2 | Q305: =O305*6+P305 -> 14 | S305: SHAW | W305: RICHMOND | X305: 1 | Y305: 8 | Z305: 1 | AA305: 362 | AB305: 545 | AC305: 66.422018348623851 | AD305: 6
A306: BEST PLAYERS
A307: NORTH MELBOURNE | C307: HOUSTON | F307: CALDWELL | I307: E LAUNDER | L307: CARLTON | O307: QUILLIGAN | R307: SNOW
A308: RICHMOND | C308: PARKER | F308: LEVIEN | I308: STEVENSON | L308: HARRIS | O308: PATERNOSTER | R308: CLARKE
A309: GOALKICKERS
A310: NORTH MELBOURNE | C310: TAYLOR 2 | F310: MURRAY 2 | I310: BARTY | K310: O'LOUGHLEN | N310: SNOW
A311: RICHMOND | C311: ELDER 2
A313: WILLIAMSTOWN | C313: 1 | D313: 2 | E313: =C313*6+D313 -> 8 | G313: 4 | H313: 4 | I313: =G313*6+H313 -> 28 | K313: 4 | L313: 5 | M313: =K313*6+L313 -> 29 | O313: 6 | P313: 7 | Q313: =O313*6+P313 -> 43 | S313: BRUNSWICK
A314: BRUNSWICK | C314: 0 | D314: 1 | E314: =C314*6+D314 -> 1 | G314: 0 | H314: 1 | I314: =G314*6+H314 -> 1 | K314: 0 | L314: 1 | M314: =K314*6+L314 -> 1 | O314: 0 | P314: 1 | Q314: =O314*6+P314 -> 1 | S314: CARRIS
A315: BEST PLAYERS
A316: WILLIAMSTOWN | C316: WARREN | F316: WORRALL | I316: GOBLE | L316: THOMPSON | O316: McCALLUM | R316: BRISTOW
A317: BRUNSWICK | C317: M O'LOUGHLIN | F317: MUDGE | I317: SAMPSON | L317: CLOUGH | O317: SNELL
A318: GOALKICKERS
A319: WILLIAMSTOWN | C319: GOBLE 2 | F319: McKINLEY | I319: KENNISON | L319: WARREN | O319: DYSON
A320: BRUNSWICK | C320: NIL
A323: ROUND 11 | E323: 3RD JULY | I323: WEATHER | M323: N.W. WIND
D325: 1ST QTR | H325: 2ND QTR | L325: 3RD QTR | P325: FINAL | S325: AT
S326: EAST MELB
A327: PORT MELBOURNE | C327: 4 | D327: 1 | E327: =C327*6+D327 -> 25 | G327: 5 | H327: 2 | I327: =G327*6+H327 -> 32 | K327: 6 | L327: 3 | M327: =K327*6+L327 -> 39 | O327: 7 | P327: 4 | Q327: =O327*6+P327 -> 46 | S327: UMPIRE | W327: LADDER | AB327: ROUND | AD327: 11
A328: NORTH MELBOURNE | C328: 0 | D328: 0 | E328: =C328*6+D328 -> 0 | G328: 2 | H328: 6 | I328: =G328*6+H328 -> 18 | K328: 3 | L328: 8 | M328: =K328*6+L328 -> 26 | O328: 3 | P328: 10 | Q328: =O328*6+P328 -> 28 | S328: CARRIS
A329: BEST PLAYERS | W329: TEAM | X329: W | Y329: L | Z329: D | AA329: FOR | AB329: AGST | AC329: % | AD329: PTS
A330: PORT MELBOURNE | C330: FREAME | F330: ROBERTSON | I330: HENDERSON | L330: W MONAGLE | O330: McGEE | R330: JOHNSON
A331: NORTH MELBOURNE | C331: CARLTON | F331: GRIERSON | I331: E LAUNDER | L331: CALDWELL | O331: RUTLEY | R331: NOONAN | W331: PORT MELBOURNE | X331: 10 | Y331: 1 | Z331: 0 | AA331: 576 | AB331: 264 | AC331: 218.18181818181819 | AD331: 40
A332: GOALKICKERS | W332: FOOTSCRAY | X332: 7 | Y332: 4 | Z332: 0 | AA332: 431 | AB332: 348 | AC332: 123.85057471264368 | AD332: 28
A333: PORT MELBOURNE | W333: NORTH MELBOURNE | X333: 7 | Y333: 4 | Z333: 0 | AA333: 409 | AB333: 362 | AC333: 112.98342541436465 | AD333: 28
A334: NORTH MELBOURNE | C334: GRIERSON | F334: MORLEY | I334: BARTY | W334: WILLIAMSTOWN | X334: 4 | Y334: 6 | Z334: 1 | AA334: 374 | AB334: 309 | AC334: 121.03559870550161 | AD334: 18
A336: WILLIAMSTOWN | C336: 1 | D336: 1 | E336: =C336*6+D336 -> 7 | G336: 2 | H336: 1 | I336: =G336*6+H336 -> 13 | K336: 2 | L336: 4 | M336: =K336*6+L336 -> 16 | O336: 3 | P336: 5 | Q336: =O336*6+P336 -> 23 | S336: WILLIAMSTOWN | W336: BRUNSWICK | X336: 3 | Y336: 8 | Z336: 0 | AA336: 252 | AB336: 564 | AC336: 44.680851063829785 | AD336: 12
A337: FOOTSCRAY | C337: 0 | D337: 2 | E337: =C337*6+D337 -> 2 | G337: 0 | H337: 6 | I337: =G337*6+H337 -> 6 | K337: 0 | L337: 6 | M337: =K337*6+L337 -> 6 | O337: 2 | P337: 9 | Q337: =O337*6+P337 -> 21 | S337: TIERNAN | W337: RICHMOND | X337: 1 | Y337: 9 | Z337: 1 | AA337: 394 | AB337: 589 | AC337: 66.893039049235995 | AD337: 6
A338: BEST PLAYERS
A339: WILLIAMSTOWN | C339: SPRINTHALL | G339: WARREN | J339: RILEY | M339: R HALL | P339: BARNES | R339: DYSON
A340: FOOTSCRAY | C340: DICK | G340: DEAN | J340: DICKENS | M340: ARMSTRONG | P340: MOLYNEUX
A341: GOALKICKERS
A342: WILLIAMSTOWN | C342: DYSON 3
A343: FOOTSCRAY | C343: ARMSTRONG 2
A345: BRUNSWICK | C345: 0 | D345: 2 | E345: =C345*6+D345 -> 2 | G345: 2 | H345: 4 | I345: =G345*6+H345 -> 16 | K345: 5 | L345: 5 | M345: =K345*6+L345 -> 35 | O345: 6 | P345: 8 | Q345: =O345*6+P345 -> 44 | S345: BRUNSWICK
A346: RICHMOND | C346: 1 | D346: 2 | E346: =C346*6+D346 -> 8 | G346: 2 | H346: 3 | I346: =G346*6+H346 -> 15 | K346: 3 | L346: 5 | M346: =K346*6+L346 -> 23 | O346: 4 | P346: 8 | Q346: =O346*6+P346 -> 32 | S346: SHAW
A347: BEST PLAYERS
A348: BRUNSWICK | C348: O'LOUGHLIN | F348: JOHNSON | I348: GORDON | L348: SAMPSON | O348: SNELL
A349: RICHMOND | C349: BACKHOUSE | F349: PARKER | I349: RYAN | L349: CLARKE | O349: STEVENSON | R349: WALTON
A350: GOALKICKERS
A351: BRUNSWICK | C351: SAMPSON 2 | F351: CLOUGH | I351: MUDGE | L351: JOHNSON | O351: T O'LOUGHLIN
A352: RICHMOND | C352: RYAN | F352: S PITCHER | I352: ELDER
A355: ROUND 12 | E355: 10TH JULY | I355: WEATHER | M355: NO WIND RAIN
D357: 1ST QTR | H357: 2ND QTR | L357: 3RD QTR | P357: FINAL | S357: AT
S358: RICHMOND
A359: PORT MELBOURNE | C359: 2 | D359: 4 | E359: =C359*6+D359 -> 16 | G359: 4 | H359: 4 | I359: =G359*6+H359 -> 28 | K359: 4 | L359: 5 | M359: =K359*6+L359 -> 29 | O359: 5 | P359: 6 | Q359: =O359*6+P359 -> 36 | S359: UMPIRE | W359: LADDER | AB359: ROUND | AD359: 12
A360: RICHMOND | C360: 0 | D360: 2 | E360: =C360*6+D360 -> 2 | G360: 2 | H360: 4 | I360: =G360*6+H360 -> 16 | K360: 2 | L360: 6 | M360: =K360*6+L360 -> 18 | O360: 3 | P360: 6 | Q360: =O360*6+P360 -> 24 | S360: SHAW
A361: BEST PLAYERS | W361: TEAM | X361: W | Y361: L | Z361: D | AA361: FOR | AB361: AGST | AC361: % | AD361: PTS
A362: PORT MELBOURNE | C362: JOHNSON | F362: KNOX | I362: W MONAGLE | L362: DALY | O362: MORTON | R362: ROBERTSON
A363: RICHMOND | C363: BACKHOUSE | F363: CLARKE | I363: PARKER | L363: LEVIEN | O363: WATSON | R363: RYAN | W363: PORT MELBOURNE | X363: 11 | Y363: 1 | Z363: 0 | AA363: 612 | AB363: 288 | AC363: 212.5 | AD363: 44
A364: GOALKICKERS | W364: FOOTSCRAY | X364: 8 | Y364: 4 | Z364: 0 | AA364: 504 | AB364: 374 | AC364: 134.75935828877004 | AD364: 32
A365: PORT MELBOURNE | W365: NORTH MELBOURNE | X365: 8 | Y365: 4 | Z365: 0 | AA365: 441 | AB365: 393 | AC365: 112.21374045801527 | AD365: 32
A366: RICHMOND | C366: ELDER 2 | F366: BACKHOUSE | W366: WILLIAMSTOWN | X366: 4 | Y366: 7 | Z366: 1 | AA366: 405 | AB366: 341 | AC366: 118.7683284457478 | AD366: 18
A368: NORTH MELBOURNE | C368: 2 | D368: 1 | E368: =C368*6+D368 -> 13 | G368: 4 | H368: 1 | I368: =G368*6+H368 -> 25 | K368: 5 | L368: 1 | M368: =K368*6+L368 -> 31 | O368: 5 | P368: 2 | Q368: =O368*6+P368 -> 32 | S368: EAST MELB | W368: BRUNSWICK | X368: 3 | Y368: 9 | Z368: 0 | AA368: 278 | AB368: 637 | AC368: 43.642072213500782 | AD368: 12
A369: WILLIAMSTOWN | C369: 0 | D369: 2 | E369: =C369*6+D369 -> 2 | G369: 3 | H369: 4 | I369: =G369*6+H369 -> 22 | K369: 3 | L369: 5 | M369: =K369*6+L369 -> 23 | O369: 4 | P369: 7 | Q369: =O369*6+P369 -> 31 | S369: CARRIS | W369: RICHMOND | X369: 1 | Y369: 10 | Z369: 1 | AA369: 418 | AB369: 625 | AC369: 66.88 | AD369: 6
A370: BEST PLAYERS
A371: NORTH MELBOURNE | C371: H LAUNDER | F371: ROLENT | I371: GRAHAM | L371: E LAUNDER | O371: RUTLEY | R371: CARLTON
A372: WILLIAMSTOWN | C372: SPRINTALL | F372: WARREN | I372: McKINLEY | L372: FAGAN | O372: W HALL | R372: H HALL
A373: GOALKICKERS
A374: NORTH MELBOURNE | C374: SNOW | F374: HOUSTEN | I374: GRIERSON | L374: O'LOUGHLEN
A375: WILLIAMSTOWN | C375: GOBLE
A377: FOOTSCRAY | C377: 4 | D377: 4 | E377: =C377*6+D377 -> 28 | G377: 7 | H377: 8 | I377: =G377*6+H377 -> 50 | K377: 9 | L377: 10 | M377: =K377*6+L377 -> 64 | O377: 10 | P377: 13 | Q377: =O377*6+P377 -> 73 | S377: BRUNSWICK
A378: BRUNSWICK | C378: 0 | D378: 1 | E378: =C378*6+D378 -> 1 | G378: 2 | H378: 1 | I378: =G378*6+H378 -> 13 | K378: 2 | L378: 1 | M378: =K378*6+L378 -> 13 | O378: 3 | P378: 8 | Q378: =O378*6+P378 -> 26 | S378: TIERNAN
A379: BEST PLAYERS
A380: FOOTSCRAY | C380: DICK | E380: DREW | H380: HOUGHTON | L380: DEANE | O380: DICKENS | R380: MOLYNEAUX
A381: BRUNSWICK | C381: SNELL | E381: JOHNSON | H381: T O'LOUGHLIN | L381: MUDGE | O381: ROBERTSON | R381: M O'LOUGHLIN
A382: GOALKICKERS
A383: FOOTSCRAY | C383: GAYLARD 4 | F383: MITCHELL 3 | I383: DREW 2
A384: BRUNSWICK | C384: LANDELLS | F384: MUDGE | I384: ROBERTSON
A387: ROUND 13 | E387: 17TH JULY | I387: WEATHER | M387: WEST WIND HEAVY RAIN
D389: 1ST QTR | H389: 2ND QTR | L389: 3RD QTR | P389: FINAL | S389: AT
S390: PORT MELB
A391: PORT MELBOURNE | C391: 2 | D391: 1 | E391: =C391*6+D391 -> 13 | G391: 5 | H391: 3 | I391: =G391*6+H391 -> 33 | K391: 8 | L391: 7 | M391: =K391*6+L391 -> 55 | O391: 9 | P391: 14 | Q391: =O391*6+P391 -> 68 | S391: UMPIRE | W391: LADDER | AB391: ROUND | AD391: 13
A392: WILLIAMSTOWN | C392: 0 | D392: 2 | E392: =C392*6+D392 -> 2 | G392: 0 | H392: 3 | I392: =G392*6+H392 -> 3 | K392: 2 | L392: 4 | M392: =K392*6+L392 -> 16 | O392: 2 | P392: 4 | Q392: =O392*6+P392 -> 16 | S392: SHAW
A393: BEST PLAYERS | W393: TEAM | X393: W | Y393: L | Z393: D | AA393: FOR | AB393: AGST | AC393: % | AD393: PTS
A394: PORT MELBOURNE | C394: W MONAGLE | F394: HENDERSON | I394: JOHNSON | L394: McGEE | O394: DALY | R394: POWELL
A395: WILLIAMSTOWN | C395: FAGAN | F395: WARREN | I395: WORRALL | L395: KENNERSON | O395: W HALL | R395: McWILLIAMS | W395: PORT MELBOURNE | X395: 12 | Y395: 1 | Z395: 0 | AA395: 680 | AB395: 304 | AC395: 223.68421052631578 | AD395: 48
A396: GOALKICKERS | W396: FOOTSCRAY | X396: 9 | Y396: 4 | Z396: 0 | AA396: 563 | AB396: 379 | AC396: 148.54881266490764 | AD396: 36
A397: PORT MELBOURNE | C397: DALY 4 | W397: NORTH MELBOURNE | X397: 9 | Y397: 4 | Z397: 0 | AA397: 478 | AB397: 418 | AC397: 114.35406698564593 | AD397: 36
A398: WILLIAMSTOWN | C398: DYSON 2 | W398: WILLIAMSTOWN | X398: 4 | Y398: 8 | Z398: 1 | AA398: 421 | AB398: 409 | AC398: 102.93398533007336 | AD398: 18
A400: NORTH MELBOURNE | C400: 1 | D400: 1 | E400: =C400*6+D400 -> 7 | G400: 3 | H400: 6 | I400: =G400*6+H400 -> 24 | K400: 5 | L400: 6 | M400: =K400*6+L400 -> 36 | O400: 5 | P400: 7 | Q400: =O400*6+P400 -> 37 | S400: BRUNSWICK | W400: BRUNSWICK | X400: 3 | Y400: 10 | Z400: 0 | AA400: 303 | AB400: 674 | AC400: 44.955489614243326 | AD400: 12
A401: BRUNSWICK | C401: 1 | D401: 4 | E401: =C401*6+D401 -> 10 | G401: 1 | H401: 5 | I401: =G401*6+H401 -> 11 | K401: 3 | L401: 6 | M401: =K401*6+L401 -> 24 | O401: 3 | P401: 7 | Q401: =O401*6+P401 -> 25 | S401: TIERNAN | W401: RICHMOND | X401: 1 | Y401: 11 | Z401: 1 | AA401: 423 | AB401: 684 | AC401: 61.842105263157897 | AD401: 6
A402: BEST PLAYERS
A403: NORTH MELBOURNE | C403: H LAUNDER | F403: E LAUNDER | J403: NOONAN | L403: CARLTON | O403: TORPEY | R403: GRIERSON
A404: BRUNSWICK | C404: CLOUGH | F404: T O'LOUGHLIN | J404: DALTON | L404: COBURN | O404: M O'LOUGHLIN | R404: ROBERTSON
A405: GOALKICKERS
A406: NORTH MELBOURNE | C406: SNOW | F406: TORPEY | I406: MURRAY | L406: GRIERSON | O406: CARLTON
A407: BRUNSWICK
A409: FOOTSCRAY | C409: 1 | D409: 6 | E409: =C409*6+D409 -> 12 | G409: 3 | H409: 12 | I409: =G409*6+H409 -> 30 | K409: 6 | L409: 15 | M409: =K409*6+L409 -> 51 | O409: 7 | P409: 17 | Q409: =O409*6+P409 -> 59 | S409: FOOTSCRAY
A410: RICHMOND | C410: 0 | D410: 0 | E410: =C410*6+D410 -> 0 | G410: 0 | H410: 1 | I410: =G410*6+H410 -> 1 | K410: 0 | L410: 3 | M410: =K410*6+L410 -> 3 | O410: 0 | P410: 5 | Q410: =O410*6+P410 -> 5 | S410: CARRIS
A411: BEST PLAYERS
A412: FOOTSCRAY | C412: McCARTHY | F412: BROCKWELL | I412: DICK | L412: GRUNDEN | O412: WILLIAMS | R412: DICKENS
A413: RICHMOND | C413: CLARKE | F413: WILSON | I413: WARTSON | L413: HAYES | O413: BAHEN | R413: BACKHOUSE
A414: GOALKICKERS
A415: FOOTSCRAY | C415: GAYLARD 3 | F415: MITCHELL 2 | I415: CABELL | L415: MOLYNEUX
A416: RICHMOND | C416: NIL
A419: ROUND 14 | E419: 24TH JULY | I419: WEATHER | M419: FINE GROUNDS GOOD
D421: 1ST QTR | H421: 2ND QTR | L421: 3RD QTR | P421: FINAL | S421: AT
S422: BRUNSWICK
A423: PORT MELBOURNE | C423: 5 | D423: 7 | E423: =C423*6+D423 -> 37 | G423: 8 | H423: 11 | I423: =G423*6+H423 -> 59 | K423: 10 | L423: 12 | M423: =K423*6+L423 -> 72 | O423: 14 | P423: 15 | Q423: =O423*6+P423 -> 99 | S423: UMPIRE | W423: LADDER | AB423: ROUND | AD423: 14
A424: BRUNSWICK | C424: 1 | D424: 2 | E424: =C424*6+D424 -> 8 | G424: 2 | H424: 2 | I424: =G424*6+H424 -> 14 | K424: 4 | L424: 12 | M424: =K424*6+L424 -> 36 | O424: 6 | P424: 2 | Q424: =O424*6+P424 -> 38 | S424: MOLYNEAUX
A425: BEST PLAYERS | W425: TEAM | X425: W | Y425: L | Z425: D | AA425: FOR | AB425: AGST | AC425: % | AD425: PTS
A426: PORT MELBOURNE | C426: HENDERSON | G426: FREAME | J426: W MONAGLE
A427: BRUNSWICK | C427: SAMPSON | G427: M O'LOUGHLIN | J427: DALTON | M427: SNELL | O427: CLOUGH | Q427: COBAIN | W427: PORT MELBOURNE | X427: 13 | Y427: 1 | Z427: 0 | AA427: 779 | AB427: 342 | AC427: 227.77777777777777 | AD427: 52
A428: GOALKICKERS | W428: FOOTSCRAY | X428: 10 | Y428: 4 | Z428: 0 | AA428: 591 | AB428: 389 | AC428: 151.92802056555269 | AD428: 40
A429: PORT MELBOURNE | W429: NORTH MELBOURNE | X429: 9 | Y429: 5 | Z429: 0 | AA429: 488 | AB429: 446 | AC429: 109.4170403587444 | AD429: 36
A430: BRUNSWICK | W430: WILLIAMSTOWN | X430: 5 | Y430: 8 | Z430: 1 | AA430: 490 | AB430: 442 | AC430: 110.85972850678733 | AD430: 22
A432: FOOTSCRAY | C432: 1 | D432: 0 | E432: =C432*6+D432 -> 6 | G432: 1 | H432: 1 | I432: =G432*6+H432 -> 7 | K432: 3 | L432: 3 | M432: =K432*6+L432 -> 21 | O432: 4 | P432: 4 | Q432: =O432*6+P432 -> 28 | S432: FOOTSCRAY | W432: BRUNSWICK | X432: 3 | Y432: 11 | Z432: 0 | AA432: 341 | AB432: 773 | AC432: 44.113842173350584 | AD432: 12
A433: NORTH MELBOURNE | C433: 0 | D433: 3 | E433: =C433*6+D433 -> 3 | G433: 0 | H433: 3 | I433: =G433*6+H433 -> 3 | K433: 1 | L433: 3 | M433: =K433*6+L433 -> 9 | O433: 1 | P433: 4 | Q433: =O433*6+P433 -> 10 | S433: SHAW | W433: RICHMOND | X433: 1 | Y433: 12 | Z433: 1 | AA433: 456 | AB433: 753 | AC433: 60.557768924302792 | AD433: 6
A434: BEST PLAYERS
A435: FOOTSCRAY | C435: DICKENS | F435: BROCKWELL | I435: DICK | L435: EVANS | O435: MOLYNEAUX | R435: DREW
A436: NORTH MELBOURNE | C436: CALDWELL | F436: QUILLIGAN | I436: ROLENT | L436: NOONAN | O436: MURRAY | R436: O'LOUGHLEN
A437: GOALKICKERS
A438: FOOTSCRAY | C438: GAYLARD | F438: GREGORY | I438: KRUSE | L438: DICKENS
A439: NORTH MELBOURNE | C439: TORPEY
A441: WILLIAMSTOWN | C441: 2 | D441: 0 | E441: =C441*6+D441 -> 12 | G441: 4 | H441: 5 | I441: =G441*6+H441 -> 29 | K441: 6 | L441: 8 | M441: =K441*6+L441 -> 44 | O441: 9 | P441: 15 | Q441: =O441*6+P441 -> 69 | S441: WILLIAMSTOWN
A442: RICHMOND | C442: 2 | D442: 1 | E442: =C442*6+D442 -> 13 | G442: 2 | H442: 1 | I442: =G442*6+H442 -> 13 | K442: 4 | L442: 1 | M442: =K442*6+L442 -> 25 | O442: 5 | P442: 3 | Q442: =O442*6+P442 -> 33 | S442: CARRIS
A443: BEST PLAYERS
A444: WILLIAMSTOWN | C444: WARREN | F444: THOMPSON | I444: RILEY | L444: W HALL | O444: McKINLEY | R444: R HALL
A445: RICHMOND
A446: GOALKICKERS
A447: WILLIAMSTOWN | C447: McKINLEY 2
A448: RICHMOND | C448: ELDER 2 | F448: PARKER | I448: BACKHOUSE | L448: STEWART
A451: ROUND 15 | E451: 7TH AUGUST | I451: WEATHER | M451: FINE LIGHT NORTH BREEZE
D453: 1ST QTR | H453: 2ND QTR | L453: 3RD QTR | P453: FINAL | S453: AT
S454: PORT MELB
A455: PORT MELBOURNE | C455: 0 | D455: 2 | E455: =C455*6+D455 -> 2 | G455: 0 | H455: 6 | I455: =G455*6+H455 -> 6 | K455: 0 | L455: 7 | M455: =K455*6+L455 -> 7 | O455: 1 | P455: 10 | Q455: =O455*6+P455 -> 16 | S455: UMPIRE | W455: LADDER | AB455: ROUND | AD455: 15
A456: FOOTSCRAY | C456: 0 | D456: 2 | E456: =C456*6+D456 -> 2 | G456: 0 | H456: 3 | I456: =G456*6+H456 -> 3 | K456: 1 | L456: 7 | M456: =K456*6+L456 -> 13 | O456: 1 | P456: 7 | Q456: =O456*6+P456 -> 13 | S456: SHAW
A457: BEST PLAYERS | W457: TEAM | X457: W | Y457: L | Z457: D | AA457: FOR | AB457: AGST | AC457: % | AD457: PTS
A458: PORT MELBOURNE | C458: W .MONAGLE | F458: POLLACK | I458: HENDERSON | L458: KNOX | O458: JOHNSON | R458: McGEE
A459: FOOTSCRAY | C459: BROCKWELL | F459: ARMSTRONG (UNTIL INJURED) | L459: DICK | N459: WILLIAMS | Q459: POWELL | S459: HARRIS | W459: PORT MELBOURNE | X459: 14 | Y459: 1 | Z459: 0 | AA459: 795 | AB459: 355 | AC459: 223.94366197183098 | AD459: 56
A460: GOALKICKERS | W460: FOOTSCRAY | X460: 10 | Y460: 5 | Z460: 0 | AA460: 604 | AB460: 405 | AC460: 149.1358024691358 | AD460: 40
A461: PORT MELBOURNE | W461: NORTH MELBOURNE | X461: 10 | Y461: 5 | Z461: 0 | AA461: 556 | AB461: 491 | AC461: 113.23828920570264 | AD461: 40
A462: FOOTSCRAY | C462: RUTLEY | W462: WILLIAMSTOWN | X462: 6 | Y462: 8 | Z462: 1 | AA462: 556 | AB462: 462 | AC462: 120.34632034632034 | AD462: 26
A464: WILLIAMSTOWN | C464: 3 | D464: 6 | E464: =C464*6+D464 -> 24 | G464: 6 | H464: 8 | I464: =G464*6+H464 -> 44 | K464: 8 | L464: 8 | M464: =K464*6+L464 -> 56 | O464: 9 | P464: 12 | Q464: =O464*6+P464 -> 66 | S464: WILLIAMSTOWN | W464: BRUNSWICK | X464: 3 | Y464: 12 | Z464: 0 | AA464: 361 | AB464: 839 | AC464: 43.027413587604293 | AD464: 12
A465: BRUNSWICK | C465: 0 | D465: 1 | E465: =C465*6+D465 -> 1 | G465: 1 | H465: 3 | I465: =G465*6+H465 -> 9 | K465: 2 | L465: 8 | M465: =K465*6+L465 -> 20 | O465: 2 | P465: 8 | Q465: =O465*6+P465 -> 20 | S465: TIERNAN | W465: RICHMOND | X465: 1 | Y465: 13 | Z465: 1 | AA465: 501 | AB465: 821 | AC465: 61.023142509135198 | AD465: 6
A466: BEST PLAYERS
A467: WILLIAMSTOWN | C467: WARREN | F467: McKINLEY | I467: SPRINTALL | L467: BARNES | O467: GUTHRIE
A468: BRUNSWICK | C468: M O'LOUGHLIN | F468: SAMPSON | I468: LEEDS | L468: T O'LOUGHLIN | O468: JOHNSON | R468: WHELAN
A469: GOALKICKERS
A470: WILLIAMSTOWN | C470: KENNY 2 | F470: DYSON 2
A471: BRUNSWICK
A473: NORTH MELBOURNE | C473: 4 | D473: 3 | E473: =C473*6+D473 -> 27 | G473: 4 | H473: 5 | I473: =G473*6+H473 -> 29 | K473: 7 | L473: 9 | M473: =K473*6+L473 -> 51 | O473: 9 | P473: 14 | Q473: =O473*6+P473 -> 68 | S473: EAST MELB
A474: RICHMOND | C474: 0 | D474: 0 | E474: =C474*6+D474 -> 0 | G474: 1 | H474: 8 | I474: =G474*6+H474 -> 14 | K474: 2 | L474: 9 | M474: =K474*6+L474 -> 21 | O474: 5 | P474: 15 | Q474: =O474*6+P474 -> 45 | S474: MOLYNEAUX
A475: BEST PLAYERS
A476: NORTH MELBOURNE | C476: E LAUNDER | F476: CALDWELL | I476: NOONAN | L476: MONTGOMERIE | O476: QUILLIGAN | R476: MORLEY
A477: RICHMOND | C477: BACKHOUSE | F477: PARKER | I477: CLARKE | L477: ELDER | O477: RYAN
A478: GOALKICKERS
A479: NORTH MELBOURNE | C479: MORLEY 3 | F479: O'REILLY 2 | I479: GRAHAM | L479: TANKARD | O479: E LAUNDER | R479: CARLTON
A480: RICHMOND | C480: PITCHER 2 | F480: ELDER 2 | I480: BACKHOUSE
A483: ROUND 16 | E483: 14TH AUGUST | I483: WEATHER | L483: WEST WIND SHOWERS OVERNIGHT RAIN
D485: 1ST QTR | H485: 2ND QTR | L485: 3RD QTR | P485: FINAL | S485: AT
S486: PORT MELB
A487: NORTH MELBOURNE | C487: 2 | D487: 3 | E487: =C487*6+D487 -> 15 | G487: 2 | H487: 4 | I487: =G487*6+H487 -> 16 | K487: 2 | L487: 5 | M487: =K487*6+L487 -> 17 | O487: 4 | P487: 5 | Q487: =O487*6+P487 -> 29 | S487: UMPIRE | W487: LADDER | AB487: ROUND | AD487: 16
A488: PORT MELBOURNE | C488: 0 | D488: 2 | E488: =C488*6+D488 -> 2 | G488: 2 | H488: 5 | I488: =G488*6+H488 -> 17 | K488: 2 | L488: 8 | M488: =K488*6+L488 -> 20 | O488: 2 | P488: 11 | Q488: =O488*6+P488 -> 23 | S488: CHAPMAN
A489: BEST PLAYERS | W489: TEAM | X489: W | Y489: L | Z489: D | AA489: FOR | AB489: AGST | AC489: % | AD489: PTS
A490: NORTH MELBOURNE | C490: H LAUNDER | F490: BARTY | I490: E LAUNDER | L490: GRAHAM | O490: QUILLIGAN | R490: ROLENT
A491: PORT MELBOURNE | C491: W MONAGLE | F491: POLLOCK | I491: HENDERSON | L491: ROBERTSON | O491: McGREGOR | R491: McGEE | W491: PORT MELBOURNE | X491: 14 | Y491: 2 | Z491: 0 | AA491: 818 | AB491: 384 | AC491: 213.02083333333334 | AD491: 56
A492: GOALKICKERS | W492: NORTH MELBOURNE | X492: 11 | Y492: 5 | Z492: 0 | AA492: 585 | AB492: 514 | AC492: 113.81322957198444 | AD492: 44
A493: NORTH MELBOURNE | C493: O'REILLY 2 | G493: ROLENT | J493: TORPEY | W493: FOOTSCRAY | X493: 10 | Y493: 6 | Z493: 0 | AA493: 628 | AB493: 430 | AC493: 146.04651162790697 | AD493: 40
A494: PORT MELBOURNE | W494: WILLIAMSTOWN | X494: 7 | Y494: 8 | Z494: 1 | AA494: 581 | AB494: 486 | AC494: 119.54732510288066 | AD494: 30
A496: WILLIAMSTOWN | C496: 2 | D496: 2 | E496: =C496*6+D496 -> 14 | G496: 2 | H496: 2 | I496: =G496*6+H496 -> 14 | K496: 3 | L496: 7 | M496: =K496*6+L496 -> 25 | O496: 3 | P496: 7 | Q496: =O496*6+P496 -> 25 | S496: FOOTSCRAY | W496: BRUNSWICK | X496: 3 | Y496: 13 | Z496: 0 | AA496: 395 | AB496: 890 | AC496: 44.382022471910112 | AD496: 12
A497: FOOTSCRAY | C497: 0 | D497: 0 | E497: =C497*6+D497 -> 0 | G497: 0 | H497: 4 | I497: =G497*6+H497 -> 4 | K497: 1 | L497: 5 | M497: =K497*6+L497 -> 11 | O497: 3 | P497: 6 | Q497: =O497*6+P497 -> 24 | S497: TIERNAN | W497: RICHMOND | X497: 2 | Y497: 13 | Z497: 1 | AA497: 552 | AB497: 855 | AC497: 64.561403508771932 | AD497: 10
A498: BEST PLAYERS
A499: WILLIAMSTOWN | C499: SCOTT | F499: RILEY | I499: SPRINTALL | L499: KENNERSON | O499: McKINLAY | R499: WARREN
A500: FOOTSCRAY | C500: DEANE | F500: GREGORY | I500: HARRIS | L500: MOLYNEUX | O500: KRUSE | R500: KETTLE
A501: GOALKICKERS
A502: WILLIAMSTOWN | C502: WARREN | F502: WORROLL | I502: R HALL
A503: FOOTSCRAY
A505: RICHMOND | C505: 1 | D505: 3 | E505: =C505*6+D505 -> 9 | G505: 1 | H505: 12 | I505: =G505*6+H505 -> 18 | K505: 4 | L505: 15 | M505: =K505*6+L505 -> 39 | O505: 5 | P505: 21 | Q505: =O505*6+P505 -> 51 | S505: RICHMOND
A506: BRUNSWICK | C506: 3 | D506: 3 | E506: =C506*6+D506 -> 21 | G506: 3 | H506: 3 | I506: =G506*6+H506 -> 21 | K506: 4 | L506: 4 | M506: =K506*6+L506 -> 28 | O506: 5 | P506: 4 | Q506: =O506*6+P506 -> 34 | S506: SHAW
A507: BEST PLAYERS
A508: RICHMOND | C508: PARKER | F508: BACKHOUSE | I508: CLARKE | L508: WATSON | O508: BAHEN | R508: RYAN
A509: BRUNSWICK | C509: McNAMARA | F509: M O'LOUGHLIN | I509: LEEDS | L509: T O'LOUGHLIN | O509: SNELL | R509: JOHNSON
A510: GOALKICKERS
A511: RICHMOND | C511: DALY 2 | F511: ELDER 2 | I511: PITCHER
A512: BRUNSWICK | C512: LEEDS 2 | F512: McNAMARA | I512: SNELL | K512: HELLYER
A515: ROUND 17 | E515: 21ST AUGUST | I515: WEATHER | M515: NORTH-WEST WIND
D517: 1ST QTR | H517: 2ND QTR | L517: 3RD QTR | P517: FINAL | S517: AT
S518: PORT MELB
A519: PORT MELBOURNE | C519: 2 | D519: 4 | E519: =C519*6+D519 -> 16 | G519: 5 | H519: 4 | I519: =G519*6+H519 -> 34 | K519: 8 | L519: 7 | M519: =K519*6+L519 -> 55 | O519: 13 | P519: 9 | Q519: =O519*6+P519 -> 87 | S519: UMPIRE | W519: LADDER | AB519: ROUND | AD519: 17
A520: RICHMOND | C520: 2 | D520: 1 | E520: =C520*6+D520 -> 13 | G520: 3 | H520: 2 | I520: =G520*6+H520 -> 20 | K520: 3 | L520: 3 | M520: =K520*6+L520 -> 21 | O520: 3 | P520: 3 | Q520: =O520*6+P520 -> 21 | S520: SHAW
A521: BEST PLAYERS | W521: TEAM | X521: W | Y521: L | Z521: D | AA521: FOR | AB521: AGST | AC521: % | AD521: PTS
A522: PORT MELBOURNE | C522: MORTON | F522: McGEE | I522: HENDERSON | L522: RYAN | O522: FREAME | R522: CULLEN
A523: RICHMOND | C523: BAHEN | F523: CLARKE | I523: WATSON | L523: BACKHOUSE | O523: RYAN | W523: PORT MELBOURNE | X523: 15 | Y523: 2 | Z523: 0 | AA523: 905 | AB523: 405 | AC523: 223.45679012345678 | AD523: 60
A524: GOALKICKERS | W524: FOOTSCRAY | X524: 11 | Y524: 6 | Z524: 0 | AA524: 656 | AB524: 450 | AC524: 145.77777777777777 | AD524: 44
A525: PORT MELBOURNE | C525: MORTON 6 | W525: NORTH MELBOURNE | X525: 11 | Y525: 6 | Z525: 0 | AA525: 602 | AB525: 575 | AC525: 104.69565217391305 | AD525: 44
A526: RICHMOND | C526: PARKERE | F526: McFARLANE | J526: RYAN | W526: WILLIAMSTOWN | X526: 8 | Y526: 8 | Z526: 1 | AA526: 642 | AB526: 503 | AC526: 127.63419483101391 | AD526: 34
A528: WILLIAMSTOWN | C528: 4 | D528: 3 | E528: =C528*6+D528 -> 27 | G528: 5 | H528: 4 | I528: =G528*6+H528 -> 34 | K528: 9 | L528: 6 | M528: =K528*6+L528 -> 60 | O528: 9 | P528: 7 | Q528: =O528*6+P528 -> 61 | S528: WILLIAMSTOWN | W528: BRUNSWICK | X528: 3 | Y528: 14 | Z528: 0 | AA528: 415 | AB528: 918 | AC528: 45.206971677559913 | AD528: 12
A529: NORTH MELBOURNE | C529: 0 | D529: 0 | E529: =C529*6+D529 -> 0 | G529: 0 | H529: 2 | I529: =G529*6+H529 -> 2 | K529: 1 | L529: 2 | M529: =K529*6+L529 -> 8 | O529: 2 | P529: 5 | Q529: =O529*6+P529 -> 17 | S529: TIERNAN | W529: RICHMOND | X529: 2 | Y529: 14 | Z529: 1 | AA529: 573 | AB529: 942 | AC529: 60.828025477707008 | AD529: 10
A530: BEST PLAYERS
A531: WILLIAMSTOWN | C531: WORRALL | F531: TAYLOR | I531: SCOTT | L531: WARREN | O531: RILEY | R531: HALL
A532: NORTH MELBOURNE | C532: H LAUNDER | F532: WILLIAMS | I532: E LAUNDER | L532: QUILLIGAN | O532: MONTGOMERIE | R532: ROLENT
A533: GOALKICKERS
A534: WILLIAMSTOWN | C534: GIBBS 3 | F534: DYSON 2 | I534: WORROLL | L534: FAGAN
A535: NORTH MELBOURNE
A537: FOOTSCRAY | C537: 0 | D537: 1 | E537: =C537*6+D537 -> 1 | G537: 0 | H537: 4 | I537: =G537*6+H537 -> 4 | K537: 1 | L537: 6 | M537: =K537*6+L537 -> 12 | O537: 3 | P537: 10 | Q537: =O537*6+P537 -> 28 | S537: FOOTSCRAY
A538: BRUNSWICK | C538: 0 | D538: 4 | E538: =C538*6+D538 -> 4 | G538: 1 | H538: 5 | I538: =G538*6+H538 -> 11 | K538: 1 | L538: 7 | M538: =K538*6+L538 -> 13 | O538: 2 | P538: 8 | Q538: =O538*6+P538 -> 20 | S538: CHAPMAN
A539: BEST PLAYERS
A540: FOOTSCRAY | C540: DICK | F540: HARRIS | I540: McCARROLL | L540: DUMBLETON | P540: MITCHELL | S540: KRUSE
A541: BRUNSWICK | C541: JOHNSON | F541: SAMPSON | I541: SNELL | L541: TUCKER | P541: GORMAN | S541: M O'LOUGHLIN
A542: GOALKICKERS
A543: FOOTSCRAY | C543: GAYLARD | F543: RUTLEY | I543: POWELL
A544: BRUNSWICK | C544: SNELL | F544: TUCKER
A547: ROUND 18 | E547: 28TH AUGUST | I547: WEATHER | M547: STRONG NORTH-WEST WIND
D549: 1ST QTR | H549: 2ND QTR | L549: 3RD QTR | P549: FINAL | S549: AT
S550: WILLIAMSTOWN
A551: PORT MELBOURNE | C551: 3 | D551: 4 | E551: =C551*6+D551 -> 22 | G551: 3 | H551: 4 | I551: =G551*6+H551 -> 22 | K551: 3 | L551: 5 | M551: =K551*6+L551 -> 23 | O551: 4 | P551: 6 | Q551: =O551*6+P551 -> 30 | S551: UMPIRE | W551: LADDER | AB551: ROUND | AD551: 18
A552: WILLIAMSTOWN | C552: 0 | D552: 0 | E552: =C552*6+D552 -> 0 | G552: 2 | H552: 6 | I552: =G552*6+H552 -> 18 | K552: 2 | L552: 6 | M552: =K552*6+L552 -> 18 | O552: 3 | P552: 9 | Q552: =O552*6+P552 -> 27 | S552: SHAW
A553: BEST PLAYERS | W553: TEAM | X553: W | Y553: L | Z553: D | AA553: FOR | AB553: AGST | AC553: % | AD553: PTS
A554: PORT MELBOURNE | C554: JOHNSON | F554: MONAGLE | I554: HENDERSON | L554: FREAME | O554: DALY | R554: POWELL
A555: WILLIAMSTOWN | C555: WORRALL | F555: WARREN | I555: SPRINTALL | L555: McWILLIAMS | O555: HALL | R555: McKINLEY | W555: PORT MELBOURNE | X555: 16 | Y555: 2 | Z555: 0 | AA555: 935 | AB555: 432 | AC555: 216.43518518518519 | AD555: 64
A556: GOALKICKERS | W556: FOOTSCRAY | X556: 12 | Y556: 6 | Z556: 0 | AA556: 722 | AB556: 490 | AC556: 147.34693877551021 | AD556: 48
A557: PORT MELBOURNE | W557: NORTH MELBOURNE | X557: 12 | Y557: 6 | Z557: 0 | AA557: 670 | AB557: 608 | AC557: 110.19736842105263 | AD557: 48
A558: WILLIAMSTOWN | C558: DYSON | F558: WORROLL | I558: WARREN | W558: WILLIAMSTOWN | X558: 8 | Y558: 9 | Z558: 1 | AA558: 669 | AB558: 533 | AC558: 125.51594746716698 | AD558: 34
A560: NORTH MELBOURNE | C560: 0 | D560: 0 | E560: =C560*6+D560 -> 0 | G560: 5 | H560: 2 | I560: =G560*6+H560 -> 32 | K560: 5 | L560: 3 | M560: =K560*6+L560 -> 33 | O560: 10 | P560: 8 | Q560: =O560*6+P560 -> 68 | S560: FOOTSCRAY | W560: BRUNSWICK | X560: 3 | Y560: 15 | Z560: 0 | AA560: 448 | AB560: 986 | AC560: 45.436105476673426 | AD560: 12
A561: BRUNSWICK | C561: 1 | D561: 5 | E561: =C561*6+D561 -> 11 | G561: 1 | H561: 5 | I561: =G561*6+H561 -> 11 | K561: 3 | L561: 15 | M561: =K561*6+L561 -> 33 | O561: 3 | P561: 15 | Q561: =O561*6+P561 -> 33 | S561: CARRIS | W561: RICHMOND | X561: 2 | Y561: 15 | Z561: 1 | AA561: 613 | AB561: 1008 | AC561: 60.813492063492063 | AD561: 10
A562: BEST PLAYERS
A563: NORTH MELBOURNE | C563: WILLIAMS | F563: E LAUNDER | I563: NOONAN | L563: QUILLIGAN | O563: MONTGOMERIE | R563: SNOW
A564: BRUNSWICK | C564: LEEDS | F564: JOHNSON | I564: SNELL | L564: EDWARDS | O564: McNAMARA | R564: M & T O'LOUGHLIN
A565: GOALKICKERS
A566: NORTH MELBOURNE | C566: E LAUNDER 2 | F566: WILLIAMS 2 | I566: MONTGOMERY | L566: NOONAN | N566: GRIERSON | P566: CARLTON | R566: TAYLOR | T566: BARTY
A567: BRUNSWICK
A569: FOOTSCRAY | C569: 0 | D569: 2 | E569: =C569*6+D569 -> 2 | G569: 6 | H569: 6 | I569: =G569*6+H569 -> 42 | K569: 6 | L569: 7 | M569: =K569*6+L569 -> 43 | O569: 9 | P569: 12 | Q569: =O569*6+P569 -> 66 | S569: RICHMOND
A570: RICHMOND | C570: 1 | D570: 2 | E570: =C570*6+D570 -> 8 | G570: 2 | H570: 3 | I570: =G570*6+H570 -> 15 | K570: 4 | L570: 8 | M570: =K570*6+L570 -> 32 | O570: 5 | P570: 10 | Q570: =O570*6+P570 -> 40 | S570: TIERNAN
A571: BEST PLAYERS
A572: FOOTSCRAY | C572: DICK | F572: MITCHELL | I572: HARRIS | L572: KRUSE | O572: MOLYNEAUX | R572: EVANS
A573: RICHMOND | C573: PARKER | F573: BACKHOUSE | I573: RYAN | L573: BAHEN | O573: WATSON | R573: CLARKE
A574: GOALKICKERS
A575: FOOTSCRAY | C575: RUTLEY 2 | F575: KRUSE | I575: MOLYNEUX | L575: CABELL | N575: EVANS | P575: WILLIAMS
A576: RICHMOND
A579: ROUND 19 | C579: 4TH SEPTEMBER | G579: WEATHER | K579: STRONG NORTH WIND
D581: 1ST QTR | H581: 2ND QTR | L581: 3RD QTR | P581: FINAL | S581: AT
S582: PORT MELB
A583: PORT MELBOURNE | C583: 2 | D583: 5 | E583: =C583*6+D583 -> 17 | G583: 2 | H583: 12 | I583: =G583*6+H583 -> 24 | K583: 7 | L583: 15 | M583: =K583*6+L583 -> 57 | O583: 9 | P583: 17 | Q583: =O583*6+P583 -> 71 | S583: UMPIRE | W583: LADDER | AB583: ROUND | AD583: 19
A584: BRUNSWICK | C584: 0 | D584: 0 | E584: =C584*6+D584 -> 0 | G584: 0 | H584: 3 | I584: =G584*6+H584 -> 3 | K584: 0 | L584: 3 | M584: =K584*6+L584 -> 3 | O584: 2 | P584: 6 | Q584: =O584*6+P584 -> 18 | S584: TIERNAN
A585: BEST PLAYERS | W585: TEAM | X585: W | Y585: L | Z585: D | AA585: FOR | AB585: AGST | AC585: % | AD585: PTS
A586: PORT MELBOURNE | C586: FITZPATRICK | F586: JOHNSON | I586: W MONAGLE | L586: FREAME | O586: HYAMS
A587: BRUNSWICK | C587: T O'LOUGHLIN | F587: SNELL | I587: M O'LOUGHLIN | L587: RYAN | O587: McNAMARA | R587: JOHNSON | W587: PORT MELBOURNE | X587: 17 | Y587: 2 | Z587: 0 | AA587: 1006 | AB587: 450 | AC587: 223.55555555555554 | AD587: 68
A588: GOALKICKERS | W588: NORTH MELBOURNE | X588: 13 | Y588: 6 | Z588: 0 | AA588: 717 | AB588: 638 | AC588: 112.38244514106583 | AD588: 52
A589: PORT MELBOURNE | W589: FOOTSCRAY | X589: 12 | Y589: 7 | Z589: 0 | AA589: 752 | AB589: 537 | AC589: 140.03724394785849 | AD589: 48
A590: BRUNSWICK | C590: JOHNSON | W590: WILLIAMSTOWN | X590: 9 | Y590: 9 | Z590: 1 | AA590: 702 | AB590: 562 | AC590: 124.91103202846975 | AD590: 38
A592: NORTH MELBOURNE | C592: 3 | D592: 2 | E592: =C592*6+D592 -> 20 | G592: 3 | H592: 2 | I592: =G592*6+H592 -> 20 | K592: 7 | L592: 5 | M592: =K592*6+L592 -> 47 | O592: 7 | P592: 5 | Q592: =O592*6+P592 -> 47 | S592: FOOTSCRAY | W592: BRUNSWICK | X592: 3 | Y592: 16 | Z592: 0 | AA592: 466 | AB592: 1057 | AC592: 44.087038789025542 | AD592: 12
A593: FOOTSCRAY | C593: 0 | D593: 0 | E593: =C593*6+D593 -> 0 | G593: 2 | H593: 3 | I593: =G593*6+H593 -> 15 | K593: 2 | L593: 3 | M593: =K593*6+L593 -> 15 | O593: 4 | P593: 6 | Q593: =O593*6+P593 -> 30 | S593: SHAW | W593: RICHMOND | X593: 2 | Y593: 16 | Z593: 1 | AA593: 642 | AB593: 1041 | AC593: 61.671469740634002 | AD593: 10
A594: BEST PLAYERS
A595: NORTH MELBOURNE | C595: SMITH | F595: WELSH | I595: WILLIAMS | L595: GRAHAM | O595: ROLENT | R595: GRIERSON
A596: FOOTSCRAY | C596: WILLIAMS | F596: BROCKWELL | I596: GREGORY | L596: ARMSTRONG | O596: EVANS | R596: KETTLE
A597: GOALKICKERS
A598: NORTH MELBOURNE | C598: WILLIAMS 2 | F598: E LAUNDER 2 | I598: NOONAN | L598: HOUSTEN | O598: CARLTON
A599: FOOTSCRAY | C599: RUTLEY 3
A601: WILLIAMSTOWN | C601: 2 | D601: 3 | E601: =C601*6+D601 -> 15 | G601: 2 | H601: 3 | I601: =G601*6+H601 -> 15 | K601: 4 | L601: 8 | M601: =K601*6+L601 -> 32 | O601: 4 | P601: 9 | Q601: =O601*6+P601 -> 33 | S601: RICHMOND
A602: RICHMOND | C602: 0 | D602: 1 | E602: =C602*6+D602 -> 1 | G602: 2 | H602: 4 | I602: =G602*6+H602 -> 16 | K602: 2 | L602: 6 | M602: =K602*6+L602 -> 18 | O602: 3 | P602: 11 | Q602: =O602*6+P602 -> 29 | S602: CARRIS
A603: BEST PLAYERS
A604: WILLIAMSTOWN | C604: WARREN | F604: FAGAN | I604: WORRALL | L604: McKINLEY | O604: HALL | R604: SPRINTALL
A605: RICHMOND | C605: WATSON | F605: BAHEN | I605: PARKER | L605: HAYES | O605: RYAN | R605: BACKHOUSE
A606: GOALKICKERS
A607: WILLIAMSTOWN
A608: RICHMOND | C608: PARKER | F608: RYAN | I608: BRENNAN
A611: ROUND 20 | E611: 11TH SEPTEMBER | I611: WEATHER | M611: SOUTH-WEST BREEZE
D613: 1ST QTR | H613: 2ND QTR | L613: 3RD QTR | P613: FINAL | S613: AT
S614: FOOTSCRAY
A615: FOOTSCRAY | C615: 1 | D615: 2 | E615: =C615*6+D615 -> 8 | G615: 2 | H615: 7 | I615: =G615*6+H615 -> 19 | K615: 6 | L615: 8 | M615: =K615*6+L615 -> 44 | O615: 7 | P615: 12 | Q615: =O615*6+P615 -> 54 | S615: UMPIRE | W615: LADDER | AB615: ROUND | AD615: 20
A616: PORT MELBOURNE | C616: 0 | D616: 3 | E616: =C616*6+D616 -> 3 | G616: 2 | H616: 3 | I616: =G616*6+H616 -> 15 | K616: 3 | L616: 4 | M616: =K616*6+L616 -> 22 | O616: 3 | P616: 6 | Q616: =O616*6+P616 -> 24 | S616: CARRIS
A617: BEST PLAYERS | W617: TEAM | X617: W | Y617: L | Z617: D | AA617: FOR | AB617: AGST | AC617: % | AD617: PTS
A618: FOOTSCRAY | C618: DICKENS | F618: HARRIS | I618: POWELL | K618: EVANS | N618: KRUSE | Q618: BROCKWELL
A619: PORT MELBOURNE | C619: MONAGLE | F619: FREAME | I619: KNOX | K619: ROBERTSON | N619: POLLOCK | Q619: JOHNSON | W619: PORT MELBOURNE | X619: 17 | Y619: 3 | Z619: 0 | AA619: 1030 | AB619: 504 | AC619: 204.36507936507937 | AD619: 68
A620: GOALKICKERS | W620: NORTH MELBOURNE | X620: 14 | Y620: 6 | Z620: 0 | AA620: 769 | AB620: 682 | AC620: 112.7565982404692 | AD620: 56
A621: FOOTSCRAY | C621: MITCHELL 3 | F621: FITZELL 2 | I621: KETTLE | K621: BARRASS | W621: FOOTSCRAY | X621: 13 | Y621: 7 | Z621: 0 | AA621: 806 | AB621: 561 | AC621: 143.67201426024957 | AD621: 52
A622: PORT MELBOURNE | W622: WILLIAMSTOWN | X622: 10 | Y622: 9 | Z622: 1 | AA622: 795 | AB622: 605 | AC622: 131.40495867768595 | AD622: 42
A624: NORTH MELBOURNE | C624: 0 | D624: 2 | E624: =C624*6+D624 -> 2 | G624: 2 | H624: 9 | I624: =G624*6+H624 -> 21 | K624: 5 | L624: 13 | M624: =K624*6+L624 -> 43 | O624: 6 | P624: 16 | Q624: =O624*6+P624 -> 52 | S624: RICHMOND | W624: BRUNSWICK | X624: 3 | Y624: 17 | Z624: 0 | AA624: 509 | AB624: 1150 | AC624: 44.260869565217391 | AD624: 12
A625: RICHMOND | C625: 2 | D625: 2 | E625: =C625*6+D625 -> 14 | G625: 3 | H625: 3 | I625: =G625*6+H625 -> 21 | K625: 5 | L625: 3 | M625: =K625*6+L625 -> 33 | O625: 6 | P625: 8 | Q625: =O625*6+P625 -> 44 | S625: SHAW | W625: RICHMOND | X625: 2 | Y625: 17 | Z625: 1 | AA625: 686 | AB625: 1093 | AC625: 62.763037511436416 | AD625: 10
A626: BEST PLAYERS
A627: NORTH MELBOURNE | C627: GRIERSON | F627: E LAUNDER | I627: H LAUNDER | L627: WILLIAMS | O627: ROLENT | R627: QUILLIGAN
A628: RICHMOND | C628: PARKER | F628: BACKHOUSE | I628: BAHEN | L628: WATSON | O628: CLARKE | R628: RYAN
A629: GOALKICKERS
A630: NORTH MELBOURNE | C630: ROLENT 2 | F630: H LAUNDER | I630: E LAUNDER | L630: TAYLOR | O630: O'REILLY
A631: RICHMOND | C631: BAHEN | F631: ELDER | I631: WILSON | L631: HAYES | N631: WISEMAN | Q631: RYAN
A633: WILLAMSTOWN | C633: 4 | D633: 3 | E633: =C633*6+D633 -> 27 | G633: 7 | H633: 9 | I633: =G633*6+H633 -> 51 | K633: 9 | L633: 14 | M633: =K633*6+L633 -> 68 | O633: 13 | P633: 15 | Q633: =O633*6+P633 -> 93 | S633: WILLIAMSTOWN
A634: BRUNSWICK | C634: 1 | D634: 3 | E634: =C634*6+D634 -> 9 | G634: 1 | H634: 3 | I634: =G634*6+H634 -> 9 | K634: 2 | L634: 4 | M634: =K634*6+L634 -> 16 | O634: 6 | P634: 7 | Q634: =O634*6+P634 -> 43 | S634: TIERNAN
A635: BEST PLAYERS
A636: WILLIAMSTOWN
A637: BRUNSWICK | C637: JOHNSON | F637: SAMPSON | I637: SNELL | L637: GORDON | O637: GORMAN | R637: EDWARDS
A638: GOALKICKERS
A639: WILLIAMSTOWN
A640: BRUNSWICK | C640: T O'LOUGHLIN
A643: REPRESENTATIVE GAME
A645: PLAYED | C645: 31ST JULY | F645: AT | G645: BALLARAT | J645: WEATHER | M645: NORTH WIND
A646: UMPIRE | C646: SHAW | K646: V.F.A. SQUAD
C648: V.F.A | F648: V | G648: BALLARAT | K648: BRUNSWICK: | O648: M. O'LOUGHLIN | S648: JOHNSON
K649: FOOTSCRAY: | O649: DICK | Q649: DREW | S649: BROCKWELL | V649: WILLIAMS
A650: 1ST QTR | C650: 2 | D650: 1 | E650: =C652*6+D652 -> 13 | G650: 0 | H650: 4 | I650: =G652*6+H652 -> 4 | K650: NORTH MELB: | O650: E. & H. LAUNDER | S650: ROLENT | V650: QUILLIGAN
A651: 2ND QTR | C651: 6 | D651: 4 | E651: =C653*6+D653 -> 40 | G651: 3 | H651: 7 | I651: =G653*6+H653 -> 25 | K651: PORT MELB: | O651: POWELL | Q651: MONAGLE | T651: FREAME | W651: HENDERSON
A652: 3RD QTR | C652: 6 | D652: 6 | E652: =C654*6+D654 -> 42 | G652: 5 | H652: 8 | I652: =G654*6+H654 -> 38 | K652: RICHMOND: | O652: CLARKE | R652: BACKHOUSE | U652: PARKER
A653: FINAL | C653: 7 | D653: 8 | E653: =C655*6+D655 -> 50 | G653: 6 | H653: 11 | I653: =G655*6+H655 -> 47 | K653: WILLIAMSTOWN: | O653: WORRALL | R653: McWILLIAMS | U653: W HALL