A1: Victorian Football Association
A2: Season 1898
A3: © Copyright Wal Williams | F3: First created: 2 August 2014
A4: Contact: joywalwi at gmail dot com | F4: Last updated: 30 July 2017 | V4: VFA Results and tables - Link to the main index page
A5: You are free to copy this document in whole or part provided that proper acknowledgement is given to the author. All rights reserved.
A7: ROUND 1 | C7: 14TH MAY | H7: WEATHER | L7: FINE
C9: 1ST QTR | G9: 2ND QTR | K9: 3RD QTR | O9: FINAL | S9: AT
S10: FOOTSCRAY
A11: FOOTSCRAY | B11: 1 | C11: 1 | D11: =B11*6+C11 -> 7 | F11: 3 | G11: 3 | H11: =F11*6+G11 -> 21 | J11: 3 | K11: 4 | L11: =J11*6+K11 -> 22 | N11: 3 | O11: 8 | P11: =N11*6+O11 -> 26 | S11: UMPIRE | V11: LADDER | AA11: ROUND | AC11: 1
A12: PORT MELBOURNE | B12: 2 | C12: 1 | D12: =B12*6+C12 -> 13 | F12: 2 | G12: 1 | H12: =F12*6+G12 -> 13 | J12: 2 | K12: 6 | L12: =J12*6+K12 -> 18 | N12: 2 | O12: 6 | P12: =N12*6+O12 -> 18 | S12: MOLYNEUX
A13: BEST PLAYERS | V13: TEAM | W13: W | X13: L | Y13: D | Z13: FOR | AA13: AGST | AB13: % | AC13: PTS
A14: FOOTSCRAY | B14: BROCKWELL | E14: DICKENS | H14: DEANE | K14: KRUSE | N14: ARMSTRONG | Q14: ROBINSON
A15: PORT MELBOURNE | B15: RYAN | E15: ROBERTSON | H15: GARBUTT | K15: JOHNSTON | N15: McGEE | V15: WILLIAMSTOWN | W15: 1 | X15: 0 | Y15: 0 | Z15: 59 | AA15: 7 | AB15: 842.85714285714289 | AC15: 4
A16: GOALKICKERS | V16: FOOTSCRAY | W16: 1 | X16: 0 | Y16: 0 | Z16: 26 | AA16: 18 | AB16: 144.44444444444446 | AC16: 4
A17: FOOTSCRAY | B17: MITCHELL | E17: DREW | G17: ROBINSON | V17: NORTH MELBOURNE | W17: 1 | X17: 0 | Y17: 0 | Z17: 59 | AA17: 43 | AB17: 137.2093023255814 | AC17: 4
A18: PORT MELBOURNE | B18: JOHNSON | E18: RYAN | V18: RICHMOND | W18: 0 | X18: 1 | Y18: 0 | Z18: 43 | AA18: 59 | AB18: 72.881355932203391 | AC18: 0
A20: NORTH MELBOURNE | B20: 1 | C20: 2 | D20: =B20*6+C20 -> 8 | F20: 2 | G20: 10 | H20: =F20*6+G20 -> 22 | J20: 3 | K20: 15 | L20: =J20*6+K20 -> 33 | N20: 7 | O20: 17 | P20: =N20*6+O20 -> 59 | S20: RICHMOND | V20: PORT MELBOURNE | W20: 0 | X20: 1 | Y20: 0 | Z20: 18 | AA20: 26 | AB20: 69.230769230769226 | AC20: 0
A21: RICHMOND | B21: 2 | C21: 4 | D21: =B21*6+C21 -> 16 | F21: 3 | G21: 5 | H21: =F21*6+G21 -> 23 | J21: 5 | K21: 6 | L21: =J21*6+K21 -> 36 | N21: 6 | O21: 7 | P21: =N21*6+O21 -> 43 | S21: SHAW | V21: BRUNSWICK | W21: 0 | X21: 1 | Y21: 0 | Z21: 7 | AA21: 59 | AB21: 11.864406779661017 | AC21: 0
A22: BEST PLAYERS
A23: NORTH MELBOURNE | B23: HOUSTEN | E23: E LAUNDER | H23: QUILLIGAN | K23: GRAHAM | N23: McCLUMPA | Q23: CARLTON
A24: RICHMOND | B24: T WATSON | E24: HARDIMAN | H24: WILLIAMS | K24: BAHEN | N24: BACKHOUSE | Q24: PATERNOSTER
A25: GOALKICKERS
A26: NORTH MELBOURNE | B26: PATON 2 | E26: SMITH 2 | H26: J TAYLOR | K26: SARSFIELD | N26: GRAHAM
A27: RICHMOND | B27: SNOW 2 | E27: RILEY 2 | H27: ELDER | K27: BAHEN
A29: WILLIAMSTOWN | B29: 2 | C29: 1 | D29: =B29*6+C29 -> 13 | F29: 7 | G29: 6 | H29: =F29*6+G29 -> 48 | J29: 7 | K29: 7 | L29: =J29*6+K29 -> 49 | N29: 8 | O29: 11 | P29: =N29*6+O29 -> 59 | S29: BRUNSWICK
A30: BRUNSWICK | B30: 1 | C30: 0 | D30: =B30*6+C30 -> 6 | F30: 1 | G30: 0 | H30: =F30*6+G30 -> 6 | J30: 1 | K30: 1 | L30: =J30*6+K30 -> 7 | N30: 1 | O30: 1 | P30: =N30*6+O30 -> 7 | S30: CARRIS
A31: BEST PLAYERS
A32: WILLIAMSTOWN | B32: KENNISON | E32: WARREN | H32: W HALL
A33: BRUNSWICK | B33: LEEDS | E33: M O'LOUGHLIN | I33: GORDON | K33: RYAN
A34: GOALKICKERS
A35: WILLIAMSTOWN | B35: KENNISON 3 | F35: WARREN 2 | I35: THOMAS 2 | L35: W HALL
A36: BRUNSWICK | B36: WHITE
A38: ROUND 2 | C38: 21ST MAY | G38: WEATHER | K38: NORTH-WEST WIND
C40: 1ST QTR | G40: 2ND QTR | K40: 3RD QTR | O40: FINAL | S40: AT
S41: PORT MELB
A42: PORT MELBOURNE | B42: 1 | C42: 0 | D42: =B42*6+C42 -> 6 | F42: 5 | G42: 7 | H42: =F42*6+G42 -> 37 | J42: 5 | K42: 11 | L42: =J42*6+K42 -> 41 | N42: 9 | O42: 15 | P42: =N42*6+O42 -> 69 | S42: UMPIRE | V42: LADDER | AA42: ROUND | AC42: 2
A43: RICHMOND | B43: 1 | C43: 6 | D43: =B43*6+C43 -> 12 | F43: 1 | G43: 6 | H43: =F43*6+G43 -> 12 | J43: 2 | K43: 12 | L43: =J43*6+K43 -> 24 | N43: 2 | O43: 13 | P43: =N43*6+O43 -> 25 | S43: CARRIS
A44: BEST PLAYERS | V44: TEAM | W44: W | X44: L | Y44: D | Z44: FOR | AA44: AGST | AB44: % | AC44: PTS
A45: PORT MELBOURNE
A46: RICHMOND | V46: NORTH MELBOURNE | W46: 2 | X46: 0 | Y46: 0 | Z46: 139 | AA46: 56 | AB46: 248.21428571428572 | AC46: 8
A47: GOALKICKERS | V47: FOOTSCRAY | W47: 2 | X47: 0 | Y47: 0 | Z47: 65 | AA47: 46 | AB47: 141.30434782608697 | AC47: 8
A48: PORT MELBOURNE | B48: RYAN 2 | E48: DALY 2 | G48: ROWAN | I48: SULLIVAN | L48: NICKELL | N48: POWELL | P48: A JOHNSON | V48: WILLIAMSTOWN | W48: 1 | X48: 1 | Y48: 0 | Z48: 87 | AA48: 46 | AB48: 189.13043478260869 | AC48: 4
A49: RICHMOND | B49: ELDER | E49: WILLIAMS | V49: PORT MELBOURNE | W49: 1 | X49: 1 | Y49: 0 | Z49: 87 | AA49: 51 | AB49: 170.58823529411765 | AC49: 4
A51: FOOTSCRAY | B51: 0 | C51: 1 | D51: =B51*6+C51 -> 1 | F51: 4 | G51: 2 | H51: =F51*6+G51 -> 26 | J51: 4 | K51: 2 | L51: =J51*6+K51 -> 26 | N51: 6 | O51: 3 | P51: =N51*6+O51 -> 39 | S51: WILLIAMSTOWN | V51: RICHMOND | W51: 0 | X51: 2 | Y51: 0 | Z51: 68 | AA51: 128 | AB51: 53.125 | AC51: 0
A52: WILLIAMSTOWN | B52: 1 | C52: 5 | D52: =B52*6+C52 -> 11 | F52: 1 | G52: 5 | H52: =F52*6+G52 -> 11 | J52: 3 | K52: 7 | L52: =J52*6+K52 -> 25 | N52: 3 | O52: 10 | P52: =N52*6+O52 -> 28 | S52: SHAW | V52: BRUNSWICK | W52: 0 | X52: 2 | Y52: 0 | Z52: 20 | AA52: 139 | AB52: 14.388489208633093 | AC52: 0
A53: BEST PLAYERS
A54: FOOTSCRAY | B54: BROCKWELL | F54: DICKENS | I54: CHADWICK | M54: McCARTHY | Q54: DICK
A55: WILLIAMSTOWN | B55: FAGAN | F55: BARNES | I55: W HALL | M55: HALL
A56: GOALKICKERS
A57: FOOTSCRAY | B57: CHADWICK 3 | F57: MITCHELL | I57: DECOIT | L57: DREW
A58: WILLIAMSTOWN | B58: FAGAN | F58: KENNY | I58: WARREN
A60: NORTH MELBOURNE | B60: 2 | C60: 1 | D60: =B60*6+C60 -> 13 | F60: 5 | G60: 4 | H60: =F60*6+G60 -> 34 | J60: 7 | K60: 9 | L60: =J60*6+K60 -> 51 | N60: 11 | O60: 14 | P60: =N60*6+O60 -> 80 | S60: BRUNSWICK
A61: BRUNSWICK | B61: 2 | C61: 0 | D61: =B61*6+C61 -> 12 | F61: 2 | G61: 0 | H61: =F61*6+G61 -> 12 | J61: 2 | K61: 0 | L61: =J61*6+K61 -> 12 | N61: 2 | O61: 1 | P61: =N61*6+O61 -> 13 | S61: MOLYNEUX
A62: BEST PLAYERS
A63: NORTH MELBOURNE | B63: E.LAUNDER | E63: TORPEY | H63: DAVIDSON | K63: CARLTON | N63: QUILLIGAN | Q63: McGUINESS
A64: BRUNSWICK | B64: PARKER | E64: EDWARDS | H64: EDWARDS | K64: WHELAN | N64: M O'LOUGHLIN | Q64: JOHNSTON
A65: GOALKICKERS
A66: NORTH MELBOURNE | B66: RYAN 4 | E66: SARSFIELD 2 | I66: DAVIDSON 2 | M66: TORPEY 2 | P66: TUCKER
A67: BRUNSWICK | B67: MCCABE | E67: HELLYER
A69: ROUND 3 | C69: 28TH MAY | H69: WEATHER | L69: NORTH WIND
C71: 1ST QTR | G71: 2ND QTR | K71: 3RD QTR | O71: FINAL | S71: AT
S72: BRUNSWICK
A73: PORT MELBOURNE | B73: 3 | C73: 5 | D73: =B73*6+C73 -> 23 | F73: 7 | G73: 6 | H73: =F73*6+G73 -> 48 | J73: 10 | K73: 9 | L73: =J73*6+K73 -> 69 | N73: 16 | O73: 12 | P73: =N73*6+O73 -> 108 | S73: UMPIRE | V73: LADDER | AA73: ROUND | AC73: 3
A74: BRUNSWICK | B74: 0 | C74: 0 | D74: =B74*6+C74 -> 0 | F74: 1 | G74: 4 | H74: =F74*6+G74 -> 10 | J74: 2 | K74: 4 | L74: =J74*6+K74 -> 16 | N74: 3 | O74: 4 | P74: =N74*6+O74 -> 22 | S74: CARRIS
A75: BEST PLAYERS | V75: TEAM | W75: W | X75: L | Y75: D | Z75: FOR | AA75: AGST | AB75: % | AC75: PTS
A76: PORT MELBOURNE | B76: MORGAN | E76: ROBERTSON | H76: G. JOHNSON | K76: McGEE | N76: A .JOHNSTON | Q76: DALY
A77: BRUNSWICK | B77: M.O'LOUGHLIN | E77: O'BRIEN | H77: JOHNSTON | K77: WHELAN | N77: DUDLEY | Q77: McGEE | V77: NORTH MELBOURNE | W77: 3 | X77: 0 | Y77: 0 | Z77: 184 | AA77: 86 | AB77: 213.95348837209303 | AC77: 12
A78: GOALKICKERS | V78: FOOTSCRAY | W78: 3 | X78: 0 | Y78: 0 | Z78: 117 | AA78: 92 | AB78: 127.17391304347827 | AC78: 12
A79: PORT MELBOURNE | B79: MORGAN 4 | E79: RYAN 3 | G79: DALY 2 | I79: O'BRIEN 2 | K79: PEARS | M79: SULLIVAN | O79: HICKEY | Q79: McGEE | S79: POWELL | V79: PORT MELBOURNE | W79: 2 | X79: 1 | Y79: 0 | Z79: 195 | AA79: 73 | AB79: 267.1232876712329 | AC79: 8
A80: BRUNSWICK | B80: DUDLEY | E80: DILLON | V80: WILLIAMSTOWN | W80: 1 | X80: 2 | Y80: 0 | Z80: 117 | AA80: 91 | AB80: 128.57142857142858 | AC80: 4
A82: NORTH MELBOURNE | B82: 1 | C82: 0 | D82: =B82*6+C82 -> 6 | F82: 3 | G82: 4 | H82: =F82*6+G82 -> 22 | J82: 4 | K82: 4 | L82: =J82*6+K82 -> 28 | N82: 6 | O82: 9 | P82: =N82*6+O82 -> 45 | S82: WILLIAMSTOWN | V82: RICHMOND | W82: 0 | X82: 3 | Y82: 0 | Z82: 114 | AA82: 180 | AB82: 63.333333333333336 | AC82: 0
A83: WILLIAMSTOWN | B83: 2 | C83: 1 | D83: =B83*6+C83 -> 13 | F83: 2 | G83: 1 | H83: =F83*6+G83 -> 13 | J83: 4 | K83: 5 | L83: =J83*6+K83 -> 29 | N83: 4 | O83: 6 | P83: =N83*6+O83 -> 30 | S83: MOLYNEUX | V83: BRUNSWICK | W83: 0 | X83: 3 | Y83: 0 | Z83: 42 | AA83: 247 | AB83: 17.004048582995953 | AC83: 0
A84: BEST PLAYERS
A85: NORTH MELBOURNE | B85: HOUSTEN | E85: CARLTON | H85: E .LAUNDER | K85: TORPEY | N85: MONTGOMERIE | Q85: McGUINESS
A86: WILLIAMSTOWN | B86: FAGAN | E86: W .WARREN | H86: BARNES | K86: REILLY | N86: W .HALL | Q86: McKINLEY
A87: GOALKICKERS
A88: NORTH MELBOURNE | B88: LYONS | E88: SMITH | G88: SARSFIELD | J88: H LAUNDER | M88: GREENLAND | P88: TORPEY
A89: WILLIAMSTOWN | B89: FAGAN | E89: WARREN | G89: DYSON | J89: KENNISON
A91: FOOTSCRAY | B91: 4 | C91: 6 | D91: =B91*6+C91 -> 30 | F91: 5 | G91: 9 | H91: =F91*6+G91 -> 39 | J91: 7 | K91: 10 | L91: =J91*6+K91 -> 52 | N91: 7 | O91: 10 | P91: =N91*6+O91 -> 52 | S91: RICHMOND
A92: RICHMOND | B92: 0 | C92: 2 | D92: =B92*6+C92 -> 2 | F92: 0 | G92: 6 | H92: =F92*6+G92 -> 6 | J92: 2 | K92: 8 | L92: =J92*6+K92 -> 20 | N92: 6 | O92: 10 | P92: =N92*6+O92 -> 46 | S92: SHAW
A93: BEST PLAYERS
A94: FOOTSCRAY | B94: BROCKWELL | E94: DREW | H94: McCARTHY | K94: KRUSE | N94: DICKSON | Q94: ROBINSON
A95: RICHMOND | B95: PARKER | E95: WATSON | H95: RUDD | K95: ELDER | N95: WILSON | Q95: PRINCE
A96: GOALKICKERS
A97: FOOTSCRAY | B97: ROBINSON 3 | F97: POWELL | I97: MITCHELL | L97: BROCKWELL | O97: DECOIT
A98: RICHMOND | B98: QUINN 4 | F98: WILLIAMS | I98: LEWIS
A100: ROUND 4 | C100: 4TH JUNE | H100: WEATHER | L100: RAIN BEFORE PLAY
C102: 1ST QTR | G102: 2ND QTR | K102: 3RD QTR | O102: FINAL | S102: AT
S103: PORT MELB
A104: PORT MELBOURNE | B104: 0 | C104: 4 | D104: =B104*6+C104 -> 4 | F104: 3 | G104: 8 | H104: =F104*6+G104 -> 26 | J104: 4 | K104: 9 | L104: =J104*6+K104 -> 33 | N104: 8 | O104: 12 | P104: =N104*6+O104 -> 60 | S104: UMPIRE | V104: LADDER | AA104: ROUND | AC104: 4
A105: NORTH MELBOURNE | B105: 0 | C105: 2 | D105: =B105*6+C105 -> 2 | F105: 1 | G105: 3 | H105: =F105*6+G105 -> 9 | J105: 1 | K105: 6 | L105: =J105*6+K105 -> 12 | N105: 2 | O105: 7 | P105: =N105*6+O105 -> 19 | S105: CARRIS
A106: BEST PLAYERS | V106: TEAM | W106: W | X106: L | Y106: D | Z106: FOR | AA106: AGST | AB106: % | AC106: PTS
A107: PORT MELBOURNE | B107: PEARS | E107: SHANNON | H107: BLAIR | K107: HICKEY | N107: JOHNSTON | Q107: DALY
A108: NORTH MELBOURNE | B108: E. LAUNDER | E108: NOONAN | H108: HOUSTEN | K108: McCLUMPA | N108: GRAHAM | Q108: TORPEY | V108: FOOTSCRAY | W108: 4 | X108: 0 | Y108: 0 | Z108: 192 | AA108: 127 | AB108: 151.18110236220471 | AC108: 16
A109: GOALKICKERS | V109: PORT MELBOURNE | W109: 3 | X109: 1 | Y109: 0 | Z109: 255 | AA109: 92 | AB109: 277.17391304347825 | AC109: 12
A110: PORT MELBOURNE | B110: DALY 4 | E110: McGEE | H110: PEARS | K110: POWELL | N110: O'BRIEN | V110: NORTH MELBOURNE | W110: 3 | X110: 1 | Y110: 0 | Z110: 203 | AA110: 146 | AB110: 139.04109589041096 | AC110: 12
A111: NORTH MELBOURNE | B111: MORRIS | E111: HOUSTON | V111: WILLIAMSTOWN | W111: 2 | X111: 2 | Y111: 0 | Z111: 150 | AA111: 106 | AB111: 141.50943396226415 | AC111: 8
A113: FOOTSCRAY | B113: 4 | C113: 2 | D113: =B113*6+C113 -> 26 | F113: 8 | G113: 7 | H113: =F113*6+G113 -> 55 | J113: 9 | K113: 9 | L113: =J113*6+K113 -> 63 | N113: 11 | O113: 9 | P113: =N113*6+O113 -> 75 | S113: FOOTSCRAY | V113: RICHMOND | W113: 0 | X113: 4 | Y113: 0 | Z113: 129 | AA113: 213 | AB113: 60.563380281690144 | AC113: 0
A114: BRUNSWICK | B114: 1 | C114: 0 | D114: =B114*6+C114 -> 6 | F114: 1 | G114: 0 | H114: =F114*6+G114 -> 6 | J114: 3 | K114: 1 | L114: =J114*6+K114 -> 19 | N114: 5 | O114: 5 | P114: =N114*6+O114 -> 35 | S114: MOLYNEUX | V114: BRUNSWICK | W114: 0 | X114: 4 | Y114: 0 | Z114: 77 | AA114: 322 | AB114: 23.913043478260871 | AC114: 0
A115: BEST PLAYERS
A116: FOOTSCRAY | B116: DREW | E116: McCARTHY | H116: WILLIAMS | K116: DICKENS | N116: GRUNDEN | Q116: KRUSE
A117: BRUNSWICK | B117: M.O'LOUGHLIN | F117: BUTWELL | I117: PARKER | K117: EDWARDS | N117: LEEDS | Q117: WHELAN
A118: GOALKICKERS
A119: FOOTSCRAY | B119: GRUNDEN 3 | E119: KRUSE 2 | H119: MITCHELL 2 | K119: ROBERTSON 2 | O119: BROCKWELL | R119: DREW
A120: BRUNSWICK | B120: GORHAM | E120: BUTWELL | H120: RAMSAY | K120: LEE | M120: HELLYER
A122: WILLIAMSTOWN | B122: 1 | C122: 0 | D122: =B122*6+C122 -> 6 | F122: 1 | G122: 1 | H122: =F122*6+G122 -> 7 | J122: 4 | K122: 6 | L122: =J122*6+K122 -> 30 | N122: 4 | O122: 9 | P122: =N122*6+O122 -> 33 | S122: WILLIAMSTOWN
A123: RICHMOND | B123: 1 | C123: 4 | D123: =B123*6+C123 -> 10 | F123: 1 | G123: 6 | H123: =F123*6+G123 -> 12 | J123: 1 | K123: 8 | L123: =J123*6+K123 -> 14 | N123: 1 | O123: 9 | P123: =N123*6+O123 -> 15 | S123: SHAW
A124: BEST PLAYERS
A125: WILLIAMSTOWN
A126: RICHMOND
A127: GOALKICKERS
A128: WILLIAMSTOWN | B128: WARREN 2 | F128: A THOMPSON | J128: McNAMARA
A129: RICHMOND | B129: C BACKHOUSE
A131: ROUND 5 | C131: 11TH JUNE | H131: WEATHER | L131: SOUTH-WEST WIND RAIN
C133: 1ST QTR | G133: 2ND QTR | K133: 3RD QTR | O133: FINAL | S133: AT
S134: PORT MELB
A135: PORT MELBOURNE | B135: 1 | C135: 0 | D135: =B135*6+C135 -> 6 | F135: 7 | G135: 1 | H135: =F135*6+G135 -> 43 | J135: 7 | K135: 1 | L135: =J135*6+K135 -> 43 | N135: 9 | O135: 8 | P135: =N135*6+O135 -> 62 | S135: UMPIRE | V135: LADDER | AA135: ROUND | AC135: 5
A136: FOOTSCRAY | B136: 3 | C136: 3 | D136: =B136*6+C136 -> 21 | F136: 3 | G136: 3 | H136: =F136*6+G136 -> 21 | J136: 3 | K136: 6 | L136: =J136*6+K136 -> 24 | N136: 3 | O136: 6 | P136: =N136*6+O136 -> 24 | S136: SHAW
A137: BEST PLAYERS | V137: TEAM | W137: W | X137: L | Y137: D | Z137: FOR | AA137: AGST | AB137: % | AC137: PTS
A138: PORT MELBOURNE | B138: McGEE | E138: RYAN | H138: ROBERTSON | K138: HENDERSON | N138: SULLIVAN | Q138: DALY
A139: FOOTSCRAY | B139: WILSON | E139: MOLYNEUX | H139: McCARTHY | K139: DICKENS | N139: DREW | Q139: GRUNDEN | V139: PORT MELBOURNE | W139: 4 | X139: 1 | Y139: 0 | Z139: 317 | AA139: 116 | AB139: 273.27586206896552 | AC139: 16
A140: GOALKICKERS | V140: FOOTSCRAY | W140: 4 | X140: 1 | Y140: 0 | Z140: 216 | AA140: 189 | AB140: 114.28571428571429 | AC140: 16
A141: PORT MELBOURNE | B141: DALY 4 | E141: SULLIVAN 2 | I141: O'BRIEN | L141: MORTON | N141: SHANNON | V141: WILLIAMSTOWN | W141: 3 | X141: 2 | Y141: 0 | Z141: 179 | AA141: 116 | AB141: 154.31034482758622 | AC141: 12
A142: FOOTSCRAY | B142: ROBINSON | E142: DREW | H142: DECOIT | V142: NORTH MELBOURNE | W142: 3 | X142: 2 | Y142: 0 | Z142: 242 | AA142: 221 | AB142: 109.50226244343891 | AC142: 12
A144: WILLIAMSTOWN | B144: 1 | C144: 4 | D144: =B144*6+C144 -> 10 | F144: 3 | G144: 4 | H144: =F144*6+G144 -> 22 | J144: 4 | K144: 4 | L144: =J144*6+K144 -> 28 | N144: 4 | O144: 5 | P144: =N144*6+O144 -> 29 | S144: BRUNSWICK | V144: RICHMOND | W144: 1 | X144: 4 | Y144: 0 | Z144: 204 | AA144: 252 | AB144: 80.952380952380949 | AC144: 4
A145: BRUNSWICK | B145: 0 | C145: 0 | D145: =B145*6+C145 -> 0 | F145: 0 | G145: 0 | H145: =F145*6+G145 -> 0 | J145: 0 | K145: 2 | L145: =J145*6+K145 -> 2 | N145: 1 | O145: 4 | P145: =N145*6+O145 -> 10 | S145: HARDING | V145: BRUNSWICK | W145: 0 | X145: 5 | Y145: 0 | Z145: 87 | AA145: 351 | AB145: 24.786324786324787 | AC145: 0
A146: BEST PLAYERS
A147: WILLIAMSTOWN | B147: BREMNER | E147: McWILLIAMS | H147: WORRALL | K147: KENNY | N147: J. THOMPSON | Q147: McKINLEY
A148: BRUNSWICK | B148: LEEDS | E148: M.O'LOUGHLIN | H148: ROSS | K148: WHELAN | N148: GORDON | Q148: DALTON
A149: GOALKICKERS
A150: WILLIAMSTOWN | B150: SPRINGTHALL | F150: McNAMARA | I150: THOMAS | L150: McKINLEY
A151: BRUNSWICK | B151: DALTON
A153: RICHMOND | B153: 1 | C153: 5 | D153: =B153*6+C153 -> 11 | F153: 5 | G153: 10 | H153: =F153*6+G153 -> 40 | J153: 5 | K153: 11 | L153: =J153*6+K153 -> 41 | N153: 10 | O153: 15 | P153: =N153*6+O153 -> 75 | S153: RICHMOND
A154: NORTH MELBOURNE | B154: 3 | C154: 1 | D154: =B154*6+C154 -> 19 | F154: 4 | G154: 2 | H154: =F154*6+G154 -> 26 | J154: 6 | K154: 3 | L154: =J154*6+K154 -> 39 | N154: 6 | O154: 3 | P154: =N154*6+O154 -> 39 | S154: MOLYNEUX
A155: BEST PLAYERS
A156: RICHMOND | B156: HARDIMAN | E156: PARKER | H156: WILLIAMS | K156: LEWIS | N156: CLARKE | Q156: WATSON
A157: NORTH MELBOURNE | B157: GRAHAM | E157: TORPEY | H157: E. LAUNDER | K157: McCLUMPA | N157: MONTGOMERIE | Q157: HOUSTEN
A158: GOALKICKERS
A159: RICHMOND | B159: ELDER 3 | E159: PATTERSON 2 | I159: LEWIS 2 | L159: C BACKHOUSE | O159: T WILLIAMS | R159: HARDIMAN
A160: NORTH MELBOURNE | B160: PATON 2 | E160: RYAN | G160: HOUSTON | J160: MONTGOMERY | N160: SMITH
A162: ROUND 6 | C162: 18TH JUNE | H162: WEATHER | L162: WEST WIND RAIN
C164: 1ST QTR | G164: 2ND QTR | K164: 3RD QTR | O164: FINAL | S164: AT
S165: RICHMOND
A166: RICHMOND | B166: 0 | C166: 3 | D166: =B166*6+C166 -> 3 | F166: 1 | G166: 6 | H166: =F166*6+G166 -> 12 | J166: 1 | K166: 13 | L166: =J166*6+K166 -> 19 | N166: 2 | O166: 16 | P166: =N166*6+O166 -> 28 | S166: UMPIRE | V166: LADDER | AA166: ROUND | AC166: 6
A167: PORT MELBOURNE | B167: 1 | C167: 1 | D167: =B167*6+C167 -> 7 | F167: 1 | G167: 1 | H167: =F167*6+G167 -> 7 | J167: 1 | K167: 1 | L167: =J167*6+K167 -> 7 | N167: 2 | O167: 5 | P167: =N167*6+O167 -> 17 | S167: SHAW
A168: BEST PLAYERS | V168: TEAM | W168: W | X168: L | Y168: D | Z168: FOR | AA168: AGST | AB168: % | AC168: PTS
A169: RICHMOND | B169: T. WATSON | E169: D .WATSON | H169: RUDD | J169: CLARKE | M169: BACKHOUSE | P169: PARKER
A170: PORT MELBOURNE | B170: ROBERTSON | E170: RYAN | H170: POWELL | J170: A. JOHNSTON | M170: O'BRIEN | P170: J. JOHNSTON | V170: FOOTSCRAY | W170: 5 | X170: 1 | Y170: 0 | Z170: 243 | AA170: 208 | AB170: 116.82692307692308 | AC170: 20
A171: GOALKICKERS | V171: PORT MELBOURNE | W171: 4 | X171: 2 | Y171: 0 | Z171: 334 | AA171: 144 | AB171: 231.94444444444446 | AC171: 16
A172: RICHMOND | B172: ELDER | E172: PARKER | V172: NORTH MELBOURNE | W172: 4 | X172: 2 | Y172: 0 | Z172: 312 | AA172: 259 | AB172: 120.46332046332046 | AC172: 16
A173: PORT MELBOURNE | B173: DALY | E173: PEARS | V173: WILLIAMSTOWN | W173: 3 | X173: 3 | Y173: 0 | Z173: 198 | AA173: 143 | AB173: 138.46153846153845 | AC173: 12
A175: FOOTSCRAY | B175: 0 | C175: 2 | D175: =B175*6+C175 -> 2 | F175: 2 | G175: 3 | H175: =F175*6+G175 -> 15 | J175: 2 | K175: 3 | L175: =J175*6+K175 -> 15 | N175: 4 | O175: 3 | P175: =N175*6+O175 -> 27 | S175: FOOTSCRAY | V175: RICHMOND | W175: 2 | X175: 4 | Y175: 0 | Z175: 232 | AA175: 269 | AB175: 86.245353159851305 | AC175: 8
A176: WILLIAMSTOWN | B176: 0 | C176: 4 | D176: =B176*6+C176 -> 4 | F176: 1 | G176: 4 | H176: =F176*6+G176 -> 10 | J176: 2 | K176: 7 | L176: =J176*6+K176 -> 19 | N176: 2 | O176: 7 | P176: =N176*6+O176 -> 19 | S176: CARRIS | V176: BRUNSWICK | W176: 0 | X176: 6 | Y176: 0 | Z176: 125 | AA176: 421 | AB176: 29.691211401425178 | AC176: 0
A177: BEST PLAYERS
A178: FOOTSCRAY | B178: JAMES | E178: HARRIS | G178: MOLYNEUX | J178: WILSON | M178: DICK | P178: WILLIAMS
A179: WILLIAMSTOWN | B179: HALL | E179: RILEY | G179: KENNERSON | J179: WARREN | M179: GUTHRIE | P179: McKINLEY
A180: GOALKICKERS
A181: FOOTSCRAY | B181: DECOIT | E181: KRUSE | H181: WILLIAMS | K181: MONTGARRETT
A182: WILLIAMSTOWN | B182: WARREN 2
A184: NORTH MELBOURNE | B184: 3 | C184: 3 | D184: =R240*6+S240 -> 0 | F184: 5 | G184: 4 | H184: =R241*6+S241 -> 0 | J184: 9 | K184: 4 | L184: =R245*6+S245 -> 0 | N184: 10 | O184: 10 | P184: =N184*6+O184 -> 70 | S184: E.MELB
A185: BRUNSWICK | B185: 2 | C185: 0 | D185: =#VALUE!*6+#VALUE! -> #### | F185: 4 | G185: 3 | H185: =#VALUE!*6+#VALUE! -> #### | J185: 4 | K185: 5 | L185: =V245*6+W245 -> 0 | N185: 5 | O185: 8 | P185: =N185*6+O185 -> 38 | S185: TIERNAN
A186: BEST PLAYERS
A187: NORTH MELBOURNE | B187: E .LAUNDER | E187: CLUMPTON | H187: GRAHAM | K187: SICILY | N187: TORPEY | Q187: LEISH
A188: BRUNSWICK | B188: BUTWELL | E188: McKENZIE | H188: DALTON | K188: M.O'LOUGHLIN | N188: LEEDS | Q188: DE FEU
A189: GOALKICKERS
A190: NORTH MELBOURNE | B190: SICILY 5 | E190: McLEISH 2 | H190: TORPEY | K190: DAVIS | M190: LAWSON
A191: BRUNSWICK | B191: DE FUE 3 | E191: O'BRIEN | H191: McKENNA
A193: ROUND 7 | C193: 25TH JUNE | H193: WEATHER | L193: STRONG NORTH WEST WIND
C195: 1ST QTR | G195: 2ND QTR | K195: 3RD QTR | O195: FINAL | S195: AT
S196: WILLIAMSTOWN
A197: PORT MELBOURNE | B197: 3 | C197: 6 | D197: =B197*6+C197 -> 24 | F197: 3 | G197: 6 | H197: =F197*6+G197 -> 24 | J197: 4 | K197: 10 | L197: =J197*6+K197 -> 34 | N197: 4 | O197: 10 | P197: =N197*6+O197 -> 34 | S197: UMPIRE | V197: LADDER | AA197: ROUND | AC197: 7
A198: WILLIAMSTOWN | B198: 0 | C198: 0 | D198: =B198*6+C198 -> 0 | F198: 2 | G198: 4 | H198: =F198*6+G198 -> 16 | J198: 2 | K198: 4 | L198: =J198*6+K198 -> 16 | N198: 2 | O198: 6 | P198: =N198*6+O198 -> 18 | S198: SHAW
A199: BEST PLAYERS | V199: TEAM | W199: W | X199: L | Y199: D | Z199: FOR | AA199: AGST | AB199: % | AC199: PTS
A200: PORT MELBOURNE | B200: G .JOHNSTON | E200: D. JOHNSTON | H200: PEARS | K200: RYAN | N200: ROBERTSON
A201: WILLIAMSTOWN | B201: W .WARREN | E201: WORRALL | H201: GUTHRIE | K201: R .HALL | N201: KENNERSON | Q201: REILLY | V201: FOOTSCRAY | W201: 6 | X201: 1 | Y201: 0 | Z201: 285 | AA201: 222 | AB201: 128.37837837837839 | AC201: 24
A202: GOALKICKERS | V202: PORT MELBOURNE | W202: 5 | X202: 2 | Y202: 0 | Z202: 368 | AA202: 162 | AB202: 227.16049382716051 | AC202: 20
A203: PORT MELBOURNE | B203: SHANNON | E203: O'BRIEN | H203: NICKELL | K203: HENDERSON | V203: NORTH MELBOURNE | W203: 4 | X203: 3 | Y203: 0 | Z203: 326 | AA203: 301 | AB203: 108.30564784053156 | AC203: 16
A204: WILLIAMSTOWN | B204: GIBBS | E204: McKINLEY | V204: WILLIAMSTOWN | W204: 3 | X204: 4 | Y204: 0 | Z204: 216 | AA204: 177 | AB204: 122.03389830508475 | AC204: 12
A206: FOOTSCRAY | B206: 2 | C206: 7 | D206: =B206*6+C206 -> 19 | F206: 2 | G206: 7 | H206: =F206*6+G206 -> 19 | J206: 4 | K206: 7 | L206: =J206*6+K206 -> 31 | N206: 5 | O206: 12 | P206: =N206*6+O206 -> 42 | S206: FOOTSCRAY | V206: RICHMOND | W206: 3 | X206: 4 | Y206: 0 | Z206: 281 | AA206: 289 | AB206: 97.231833910034595 | AC206: 12
A207: NORTH MELBOURNE | B207: 0 | C207: 0 | D207: =B207*6+C207 -> 0 | F207: 2 | G207: 1 | H207: =F207*6+G207 -> 13 | J207: 2 | K207: 1 | L207: =J207*6+K207 -> 13 | N207: 2 | O207: 2 | P207: =N207*6+O207 -> 14 | S207: FREAME | V207: BRUNSWICK | W207: 0 | X207: 7 | Y207: 0 | Z207: 145 | AA207: 470 | AB207: 30.851063829787233 | AC207: 0
A208: BEST PLAYERS
A209: FOOTSCRAY | B209: McCARTHY | E209: HINCH | H209: KRUSE | K209: DICKSON | N209: SUFFOLK | Q209: BROCKWELL
A210: NORTH MELBOURNE | B210: TORPEY | E210: GRAHAM | H210: SICILY | K210: CARLTON | N210: E.LAUNDER | Q210: MONTGOMERIE
A211: GOALKICKERS
A212: FOOTSCRAY | B212: SUFFOLK 2 | F212: DREW | I212: MOLYNEUX | L212: MONTGARRETT
A213: NORTH MELBOURNE | B213: MORIS | E213: CRAWFORD
A215: RICHMOND | B215: 2 | C215: 0 | D215: =B215*6+C215 -> 12 | F215: 3 | G215: 2 | H215: =F215*6+G215 -> 20 | J215: 6 | K215: 2 | L215: =J215*6+K215 -> 38 | N215: 7 | O215: 7 | P215: =N215*6+O215 -> 49 | S215: BRUNSWICK
A216: BRUNSWICK | B216: 0 | C216: 6 | D216: =B216*6+C216 -> 6 | F216: 0 | G216: 6 | H216: =F216*6+G216 -> 6 | J216: 1 | K216: 8 | L216: =J216*6+K216 -> 14 | N216: 2 | O216: 8 | P216: =N216*6+O216 -> 20 | S216: CARRIS
A217: BEST PLAYERS
A218: RICHMOND | B218: C .BACKHOUSE | F218: RUDD | H218: PARKER | K218: G .BACKHOUSE | N218: HARDING | Q218: ELDER
A219: BRUNSWICK | B219: M .O'LOUGHLIN | F219: MUDGE | H219: EDWARDS | K219: DE FEU | N219: BULWELL
A220: GOALKICKERS
A221: RICHMOND | B221: C BACKHOUSE 2 | F221: QUINN 2 | I221: ELDER 2 | L221: G BACKHOUSE
A222: BRUNSWICK | B222: DE FUE 2
A224: ROUND 8 | C224: 2ND JULY | H224: WEATHER | L224: NORTH WEST WIND
C226: 1ST QTR | G226: 2ND QTR | K226: 3RD QTR | O226: FINAL | S226: AT
S227: PORT MELB
A228: PORT MELBOURNE | B228: 2 | C228: 3 | D228: =B228*6+C228 -> 15 | F228: 7 | G228: 5 | H228: =F228*6+G228 -> 47 | J228: 9 | K228: 7 | L228: =J228*6+K228 -> 61 | N228: 14 | O228: 11 | P228: =N228*6+O228 -> 95 | S228: UMPIRE | V228: LADDER | AA228: ROUND | AC228: 8
A229: BRUNSWICK | B229: 1 | C229: 3 | D229: =B229*6+C229 -> 9 | F229: 3 | G229: 4 | H229: =F229*6+G229 -> 22 | J229: 3 | K229: 5 | L229: =J229*6+K229 -> 23 | N229: 4 | O229: 8 | P229: =N229*6+O229 -> 32 | S229: SCHAEFER
A230: BEST PLAYERS | V230: TEAM | W230: W | X230: L | Y230: D | Z230: FOR | AA230: AGST | AB230: % | AC230: PTS
A231: PORT MELBOURNE | B231: PEARS | E231: A .JOHNSTON | H231: SULLIVAN | K231: RYAN | M231: McGEE | P231: HICKEY
A232: BRUNSWICK | B232: FOLETTA | E232: BUTWELL | H232: McKENNA | K232: ROSS | M232: WHELAN | P232: McKENZIE | V232: FOOTSCRAY | W232: 7 | X232: 1 | Y232: 0 | Z232: 314 | AA232: 235 | AB232: 133.61702127659575 | AC232: 28
A233: GOALKICKERS | V233: PORT MELBOURNE | W233: 6 | X233: 2 | Y233: 0 | Z233: 463 | AA233: 194 | AB233: 238.65979381443299 | AC233: 24
A234: PORT MELBOURNE | B234: SULLIVAN 5 | E234: DALY 2 | G234: McGEE 2 | I234: POWELL | K234: FLEMING | M234: PEARS | O234: SHANNON | Q234: KNOX | V234: NORTH MELBOURNE | W234: 5 | X234: 3 | Y234: 0 | Z234: 377 | AA234: 349 | AB234: 108.02292263610315 | AC234: 20
A235: BRUNSWICK | B235: BUTWELL | E235: RAMSAY | H235: O'BRIEN | K235: LEEDS | V235: WILLIAMSTOWN | W235: 3 | X235: 5 | Y235: 0 | Z235: 264 | AA235: 228 | AB235: 115.78947368421052 | AC235: 12
A237: FOOTSCRAY | B237: 0 | C237: 2 | D237: =B237*6+C237 -> 2 | F237: 1 | G237: 4 | H237: =F237*6+G237 -> 10 | J237: 2 | K237: 4 | L237: =J237*6+K237 -> 16 | N237: 4 | O237: 5 | P237: =N237*6+O237 -> 29 | S237: FOOTSCRAY | V237: RICHMOND | W237: 3 | X237: 5 | Y237: 0 | Z237: 294 | AA237: 318 | AB237: 92.452830188679243 | AC237: 12
A238: RICHMOND | B238: 0 | C238: 4 | D238: =B238*6+C238 -> 4 | F238: 0 | G238: 4 | H238: =F238*6+G238 -> 4 | J238: 1 | K238: 5 | L238: =J238*6+K238 -> 11 | N238: 1 | O238: 7 | P238: =N238*6+O238 -> 13 | S238: CARRIS | V238: BRUNSWICK | W238: 0 | X238: 8 | Y238: 0 | Z238: 177 | AA238: 565 | AB238: 31.327433628318584 | AC238: 0
A239: BEST PLAYERS
A240: FOOTSCRAY | B240: DECOIT | E240: MOLYNEUX | H240: BROCKWELL | K240: DREW | N240: KRUSE | Q240: WILSON
A241: RICHMOND | B241: T .WATSON | E241: LEVIEN | H241: RUDD | K241: BACKHOUSE | N241: PARKER | Q241: T. WILLIAMS
A242: GOALKICKERS
A243: FOOTSCRAY | B243: MONTGARRETT 2 | G243: DECOIT | J243: GRUNDEN
A244: RICHMOND | B244: ELDER
A246: NORTH MELBOURNE | B246: 0 | C246: 2 | D246: =B246*6+C246 -> 2 | F246: 2 | G246: 4 | H246: =F246*6+G246 -> 16 | J246: 3 | K246: 7 | L246: =J246*6+K246 -> 25 | N246: 7 | O246: 9 | P246: =N246*6+O246 -> 51 | S246: WILLIAMSTOWN
A247: WILLIAMSTOWN | B247: 3 | C247: 3 | D247: =B247*6+C247 -> 21 | F247: 3 | G247: 5 | H247: =F247*6+G247 -> 23 | J247: 5 | K247: 5 | L247: =J247*6+K247 -> 35 | N247: 7 | O247: 6 | P247: =N247*6+O247 -> 48 | S247: SHAW
A248: BEST PLAYERS
A249: NORTH MELBOURNE | B249: TORPEY | E249: GRAHAM | H249: E .LAUNDER | K249: NOONAN | N249: MONTGOMERIE | Q249: SMITH
A250: WILLIAMSTOWN | B250: WORRALL | E250: WARREN | H250: R .HALL | K250: SPRINTALL | N250: THOMAS | Q250: McNAMARA
A251: GOALKICKERS
A252: NORTH MELBOURNE | B252: NOONAN 4 | F252: SMITH 2 | J252: MORRIS
A253: WILLIAMSTOWN | B253: McNAMARA 4 | F253: WARREN 3
A255: ROUND 9 | C255: 9TH JULY | H255: WEATHER | L255: NORTH WIND
C257: 1ST QTR | G257: 2ND QTR | K257: 3RD QTR | O257: FINAL | S257: AT
S258: PORT MELB
A259: PORT MELBOURNE | B259: 2 | C259: 2 | D259: =B259*6+C259 -> 14 | F259: 2 | G259: 7 | H259: =F259*6+G259 -> 19 | J259: 4 | K259: 7 | L259: =J259*6+K259 -> 31 | N259: 6 | O259: 9 | P259: =N259*6+O259 -> 45 | S259: UMPIRE | V259: LADDER | AA259: ROUND | AC259: 9
A260: WILLIAMSTOWN | B260: 0 | C260: 2 | D260: =B260*6+C260 -> 2 | F260: 1 | G260: 4 | H260: =F260*6+G260 -> 10 | J260: 1 | K260: 4 | L260: =J260*6+K260 -> 10 | N260: 1 | O260: 5 | P260: =N260*6+O260 -> 11 | S260: CARRIS
A261: BEST PLAYERS | V261: TEAM | W261: W | X261: L | Y261: D | Z261: FOR | AA261: AGST | AB261: % | AC261: PTS
A262: PORT MELBOURNE | B262: SULLIVAN | E262: RYAN | H262: HENDERSON | K262: HICKEY | M262: A .JOHNSTON | P262: PEARS
A263: WILLIAMSTOWN | B263: CALDWELL | E263: SPRINTALL | H263: ROACH | K263: R.HALL | M263: WORRALL | P263: FLYNN | V263: FOOTSCRAY | W263: 8 | X263: 1 | Y263: 0 | Z263: 341 | AA263: 261 | AB263: 130.65134099616859 | AC263: 32
A264: GOALKICKERS | V264: PORT MELBOURNE | W264: 7 | X264: 2 | Y264: 0 | Z264: 508 | AA264: 205 | AB264: 247.80487804878049 | AC264: 28
A265: PORT MELBOURNE | B265: SULLIVAN 3 | F265: SHANNON | I265: FLEMING | L265: KNOX | V265: NORTH MELBOURNE | W265: 5 | X265: 4 | Y265: 0 | Z265: 403 | AA265: 376 | AB265: 107.18085106382979 | AC265: 20
A266: WILLIAMSTOWN | B266: MCNAMARA | V266: RICHMOND | W266: 4 | X266: 5 | Y266: 0 | Z266: 367 | AA266: 330 | AB266: 111.21212121212122 | AC266: 16
A268: FOOTSCRAY | B268: 1 | C268: 2 | D268: =B268*6+C268 -> 8 | F268: 3 | G268: 3 | H268: =F268*6+G268 -> 21 | J268: 4 | K268: 3 | L268: =J268*6+K268 -> 27 | N268: 4 | O268: 3 | P268: =N268*6+O268 -> 27 | S268: FOOTSCRAY | V268: WILLIAMSTOWN | W268: 3 | X268: 6 | Y268: 0 | Z268: 275 | AA268: 273 | AB268: 100.73260073260073 | AC268: 12
A269: NORTH MELBOURNE | B269: 1 | C269: 2 | D269: =B269*6+C269 -> 8 | F269: 1 | G269: 2 | H269: =F269*6+G269 -> 8 | J269: 1 | K269: 6 | L269: =J269*6+K269 -> 12 | N269: 3 | O269: 8 | P269: =N269*6+O269 -> 26 | S269: SCHAEFER | V269: BRUNSWICK | W269: 0 | X269: 9 | Y269: 0 | Z269: 189 | AA269: 638 | AB269: 29.623824451410659 | AC269: 0
A270: BEST PLAYERS
A271: FOOTSCRAY | B271: MOLYNEUX | E271: HINCH | H271: KRUSE | K271: MONTGARRETS | N271: ARMSTRONG | Q271: DICKENS
A272: NORTH MELBOURNE | B272: SICILY | E272: TORPEY | H272: E .LAUNDER | K272: CARLTON | N272: PATON | Q272: QUILLIGAN
A273: GOALKICKERS
A274: FOOTSCRAY | B274: MONTGARRETT 2 | G274: BYRNES | J274: DECOIT
A275: NORTH MELBOURNE | B275: SICILY 2 | F275: NOONAN
A277: RICHMOND | B277: 2 | C277: 1 | D277: =B277*6+C277 -> 13 | F277: 7 | G277: 5 | H277: =F277*6+G277 -> 47 | J277: 9 | K277: 9 | L277: =J277*6+K277 -> 63 | N277: 10 | O277: 13 | P277: =N277*6+O277 -> 73 | S277: RICHMOND
A278: BRUNSWICK | B278: 0 | C278: 0 | D278: =B278*6+C278 -> 0 | F278: 0 | G278: 1 | H278: =F278*6+G278 -> 1 | J278: 1 | K278: 5 | L278: =J278*6+K278 -> 11 | N278: 1 | O278: 6 | P278: =N278*6+O278 -> 12 | S278: SHAW
A279: BEST PLAYERS
A280: RICHMOND | B280: O'HALLORAN | E280: T .WATSON | H280: LEVIEN | K280: RUDD | N280: ELDER | Q280: PARKER
A281: BRUNSWICK | B281: MUDGE | E281: FOLETTA | H281: McKENZIE | K281: LOGAN
A282: GOALKICKERS
A283: RICHMOND | B283: McGUIRE 3 | E283: C BACKHOUSE 2 | I283: ELDER | K283: PARKER | M283: T WILLIAMS | P283: LEWIS | R283: BAHEN
A284: BRUNSWICK | B284: DE FEU
A286: ROUND 10 | C286: 16TH JULY | H286: WEATHER | L286: WEST WIND RAIN
C288: 1ST QTR | G288: 2ND QTR | K288: 3RD QTR | O288: FINAL | S288: AT
S289: BRUNSWICK
A290: FOOTSCRAY | B290: 1 | C290: 1 | D290: =B290*6+C290 -> 7 | F290: 5 | G290: 5 | H290: =F290*6+G290 -> 35 | J290: 6 | K290: 6 | L290: =J290*6+K290 -> 42 | N290: 12 | O290: 7 | P290: =N290*6+O290 -> 79 | S290: UMPIRE | V290: LADDER | AA290: ROUND | AC290: 10
A291: BRUNSWICK | B291: 0 | C291: 4 | D291: =B291*6+C291 -> 4 | F291: 0 | G291: 4 | H291: =F291*6+G291 -> 4 | J291: 1 | K291: 5 | L291: =J291*6+K291 -> 11 | N291: 3 | O291: 10 | P291: =N291*6+O291 -> 28 | S291: CARRIS
A292: BEST PLAYERS | V292: TEAM | W292: W | X292: L | Y292: D | Z292: FOR | AA292: AGST | AB292: % | AC292: PTS
A293: FOOTSCRAY | B293: MITCHELL | E293: BROCKWELL | H293: SUFFOLK | K293: ARMSTRONG | N293: DICKENS | Q293: WILSON
A294: BRUNSWICK | B294: PARKER | E294: MUDGE | H294: O'BRIEN | K294: DE FEU | N294: MYERS | V294: FOOTSCRAY | W294: 9 | X294: 1 | Y294: 0 | Z294: 420 | AA294: 289 | AB294: 145.32871972318338 | AC294: 36
A295: GOALKICKERS | V295: PORT MELBOURNE | W295: 7 | X295: 3 | Y295: 0 | Z295: 560 | AA295: 260 | AB295: 215.38461538461539 | AC295: 28
A296: FOOTSCRAY | B296: MITCHELL 4 | E296: BROCKWELL 2 | H296: MONTGARRETT 2 | K296: SUFFOLK 2 | N296: GREGORY | P296: ROBINSON | V296: NORTH MELBOURNE | W296: 6 | X296: 4 | Y296: 0 | Z296: 458 | AA296: 428 | AB296: 107.00934579439253 | AC296: 24
A297: BRUNSWICK | B297: EDWARDS 2 | F297: LEEDS | V297: RICHMOND | W297: 5 | X297: 5 | Y297: 0 | Z297: 412 | AA297: 338 | AB297: 121.89349112426035 | AC297: 20
A299: RICHMOND | B299: 2 | C299: 7 | D299: =B299*6+C299 -> 19 | F299: 4 | G299: 8 | H299: =F299*6+G299 -> 32 | J299: 4 | K299: 14 | L299: =J299*6+K299 -> 38 | N299: 5 | O299: 15 | P299: =N299*6+O299 -> 45 | S299: RICHMOND | V299: WILLIAMSTOWN | W299: 3 | X299: 7 | Y299: 0 | Z299: 283 | AA299: 318 | AB299: 88.993710691823892 | AC299: 12
A300: WILLIAMSTOWN | B300: 0 | C300: 0 | D300: =B300*6+C300 -> 0 | F300: 0 | G300: 0 | H300: =F300*6+G300 -> 0 | J300: 0 | K300: 0 | L300: =J300*6+K300 -> 0 | N300: 1 | O300: 2 | P300: =N300*6+O300 -> 8 | S300: FREAME | V300: BRUNSWICK | W300: 0 | X300: 10 | Y300: 0 | Z300: 217 | AA300: 717 | AB300: 30.264993026499301 | AC300: 0
A301: BEST PLAYERS
A302: RICHMOND | B302: PARKER | E302: HARDIMAN | H302: CLARKE | K302: C. BACKHOUSE | N302: T .WATSON | Q302: D .WATSON
A303: WILLIAMSTOWN | B303: WORRALL | E303: WARREN | H303: SPRINTALL | K303: GRAHAM | N303: KENNY | Q303: THOMPSON
A304: GOALKICKERS
A305: RICHMOND | B305: ELDER 3 | E305: C BACKHOUSE | I305: McGUIRE
A306: WILLIAMSTOWN | B306: THOMPSON
A308: * NORTH MELB | B308: 2 | C308: 5 | D308: =B308*6+C308 -> 17 | F308: 4 | G308: 5 | H308: =F308*6+G308 -> 29 | J308: 8 | K308: 7 | L308: =J308*6+K308 -> 55 | N308: 8 | O308: 7 | P308: =N308*6+O308 -> 55 | S308: NORTH MELB | V308: * TRANSFERRED TO AUG 27 DUE TO
A309: PORT MELBOURNE | B309: 1 | C309: 1 | D309: =B309*6+C309 -> 7 | F309: 2 | G309: 2 | H309: =F309*6+G309 -> 14 | J309: 4 | K309: 4 | L309: =J309*6+K309 -> 28 | N309: 7 | O309: 10 | P309: =N309*6+O309 -> 52 | S309: SHAW | V309: GROUND UNFIT TO PLAY
A310: BEST PLAYERS
A311: NORTH MELBOURNE | B311: GRAHAM | E311: HOUSTEN | H311: McSWEENEY | K311: MONTGOMERIE | N311: KNEE | Q311: TAYLOR
A312: PORT MELBOURNE | B312: O'BRIEN | E312: A .JOHNSTON | H312: RYAN | K312: PEARS | N312: ROBERTSON | Q312: McGEE
A313: GOALKICKERS
A314: NORTH MELBOURNE | B314: SICILY 2 | E314: NOONAN 2 | H314: HOUSTON | J314: KNEE | L314: SMITH | N314: DIXON
A315: PORT MELBOURNE | B315: PEARS 3 | E315: O'BRIEN 2 | I315: SULLIVAN | L315: MONAGLE
A317: ROUND 11 | C317: 23RD JULY | H317: WEATHER | L317: SOUTH WIND GROUNDS SOFT
C319: 1ST QTR | G319: 2ND QTR | K319: 3RD QTR | O319: FINAL | S319: AT
S320: FOOTSCRAY
A321: FOOTSCRAY | B321: 3 | C321: 4 | D321: =B321*6+C321 -> 22 | F321: 3 | G321: 5 | H321: =F321*6+G321 -> 23 | J321: 5 | K321: 7 | L321: =J321*6+K321 -> 37 | N321: 5 | O321: 7 | P321: =N321*6+O321 -> 37 | S321: UMPIRE | V321: LADDER | AA321: ROUND | AC321: 11
A322: PORT MELBOURNE | B322: 1 | C322: 0 | D322: =B322*6+C322 -> 6 | F322: 3 | G322: 2 | H322: =F322*6+G322 -> 20 | J322: 3 | K322: 2 | L322: =J322*6+K322 -> 20 | N322: 3 | O322: 3 | P322: =N322*6+O322 -> 21 | S322: SCHAEFER
A323: BEST PLAYERS | V323: TEAM | W323: W | X323: L | Y323: D | Z323: FOR | AA323: AGST | AB323: % | AC323: PTS
A324: FOOTSCRAY | B324: ARMSTRONG | E324: KRUSE | H324: DREW | K324: GRUNDEN | N324: McCARTHY | Q324: WILSON
A325: PORT MELBOURNE | B325: A .JOHNSTON | E325: RYAN | H325: HENDERSON | K325: MORTON | N325: POWELL | Q325: McGEE | V325: FOOTSCRAY | W325: 10 | X325: 1 | Y325: 0 | Z325: 457 | AA325: 310 | AB325: 147.41935483870967 | AC325: 40
A326: GOALKICKERS | V326: PORT MELBOURNE | W326: 7 | X326: 4 | Y326: 0 | Z326: 581 | AA326: 297 | AB326: 195.62289562289561 | AC326: 28
A327: FOOTSCRAY | B327: DREW 3 | E327: MITCHELL | H327: ROBINSON | V327: NORTH MELBOURNE | W327: 7 | X327: 4 | Y327: 0 | Z327: 496 | AA327: 452 | AB327: 109.73451327433628 | AC327: 28
A328: PORT MELBOURNE | B328: McGEE | E328: O'BRIEN | H328: G JOHNSON | V328: RICHMOND | W328: 5 | X328: 6 | Y328: 0 | Z328: 436 | AA328: 376 | AB328: 115.95744680851064 | AC328: 20
A330: WILLIAMSTOWN | B330: 3 | C330: 6 | D330: =B330*6+C330 -> 24 | F330: 4 | G330: 7 | H330: =F330*6+G330 -> 31 | J330: 7 | K330: 11 | L330: =J330*6+K330 -> 53 | N330: 7 | O330: 18 | P330: =N330*6+O330 -> 60 | S330: BRUNSWICK | V330: WILLIAMSTOWN | W330: 4 | X330: 7 | Y330: 0 | Z330: 343 | AA330: 336 | AB330: 102.08333333333333 | AC330: 16
A331: BRUNSWICK | B331: 0 | C331: 0 | D331: =B331*6+C331 -> 0 | F331: 1 | G331: 0 | H331: =F331*6+G331 -> 6 | J331: 2 | K331: 0 | L331: =J331*6+K331 -> 12 | N331: 3 | O331: 0 | P331: =N331*6+O331 -> 18 | S331: JOHNSON | V331: BRUNSWICK | W331: 0 | X331: 11 | Y331: 0 | Z331: 235 | AA331: 777 | AB331: 30.244530244530246 | AC331: 0
A332: BEST PLAYERS
A333: WILLIAMSTOWN
A334: BRUNSWICK
A335: GOALKICKERS
A336: WILLIAMSTOWN | B336: McKINLEY 2 | E336: ORANGE 2 | H336: HALL | J336: ROSS | L336: WARREN
A337: BRUNSWICK | B337: O'LEARY | E337: DE FEU | H337: DORAIN
A339: NORTH MELBOURNE | B339: 2 | C339: 3 | D339: =B339*6+C339 -> 15 | F339: 2 | G339: 5 | H339: =F339*6+G339 -> 17 | J339: 5 | K339: 7 | L339: =J339*6+K339 -> 37 | N339: 5 | O339: 8 | P339: =N339*6+O339 -> 38 | S339: NORTH MELB
A340: RICHMOND | B340: 0 | C340: 1 | D340: =B340*6+C340 -> 1 | F340: 1 | G340: 2 | H340: =F340*6+G340 -> 8 | J340: 2 | K340: 2 | L340: =J340*6+K340 -> 14 | N340: 3 | O340: 6 | P340: =N340*6+O340 -> 24 | S340: CARRIS
A341: BEST PLAYERS
A342: NORTH MELBOURNE | B342: TORPEY | E342: SICILY | H342: H .LAUNDER | K342: McCLUMPA | N342: QUILLIGAN | Q342: GRAHAM (UNTIL INJ.)
A343: RICHMOND | B343: PARKER | E343: CLARKE | H343: T. WATSON | K343: BAHEN | N343: HARDIMAN | Q343: WILLIAMS
A344: GOALKICKERS
A345: NORTH MELBOURNE | B345: NOONAN 2 | E345: SICILY | H345: McLEISH | K345: DAVIDSON
A346: RICHMOND | B346: G BACKHOUSE | F346: McGUIRE | I346: LEWIS
A348: ROUND 12 | C348: 30TH JULY | H348: WEATHER | L348: FINE
C350: 1ST QTR | G350: 2ND QTR | K350: 3RD QTR | O350: FINAL | S350: AT
S351: RICHMOND
A352: RICHMOND | B352: 3 | C352: 0 | D352: =B352*6+C352 -> 18 | F352: 4 | G352: 6 | H352: =F352*6+G352 -> 30 | J352: 5 | K352: 9 | L352: =J352*6+K352 -> 39 | N352: 6 | O352: 9 | P352: =N352*6+O352 -> 45 | S352: UMPIRE | V352: LADDER | AA352: ROUND | AC352: 12
A353: PORT MELBOURNE | B353: 2 | C353: 1 | D353: =B353*6+C353 -> 13 | F353: 3 | G353: 2 | H353: =F353*6+G353 -> 20 | J353: 5 | K353: 4 | L353: =J353*6+K353 -> 34 | N353: 6 | O353: 7 | P353: =N353*6+O353 -> 43 | S353: CARRIS
A354: BEST PLAYERS | V354: TEAM | W354: W | X354: L | Y354: D | Z354: FOR | AA354: AGST | AB354: % | AC354: PTS
A355: RICHMOND | B355: CLARKE | E355: PARKER | G355: D. WATSON | J355: PRINCE | M355: T .WATSON | P355: RUDD
A356: PORT MELBOURNE | B356: POWELL | E356: RYAN | G356: HENDERSON | J356: A.JOHNSTON | M356: SHANNON | P356: DALY | V356: FOOTSCRAY | W356: 10 | X356: 2 | Y356: 0 | Z356: 479 | AA356: 346 | AB356: 138.43930635838151 | AC356: 40
A357: GOALKICKERS | V357: NORTH MELBOURNE | W357: 8 | X357: 4 | Y357: 0 | Z357: 586 | AA357: 486 | AB357: 120.57613168724279 | AC357: 32
A358: RICHMOND | B358: PARKER 2 | E358: McGUIRE 2 | I358: QUINN | L358: RUDD | V358: PORT MELBOURNE | W358: 7 | X358: 5 | Y358: 0 | Z358: 624 | AA358: 342 | AB358: 182.45614035087721 | AC358: 28
A359: PORT MELBOURNE | B359: PEARS 2 | E359: SULLIVAN 2 | I359: MONAGLE | L359: MOLYNEUX | V359: RICHMOND | W359: 6 | X359: 6 | Y359: 0 | Z359: 481 | AA359: 419 | AB359: 114.79713603818615 | AC359: 24
A361: NORTH MELBOURNE | B361: 2 | C361: 6 | D361: =B361*6+C361 -> 18 | F361: 5 | G361: 12 | H361: =F361*6+G361 -> 42 | J361: 10 | K361: 19 | L361: =J361*6+K361 -> 79 | N361: 11 | O361: 24 | P361: =N361*6+O361 -> 90 | S361: NORTH MELB | V361: WILLIAMSTOWN | W361: 5 | X361: 7 | Y361: 0 | Z361: 379 | AA361: 358 | AB361: 105.8659217877095 | AC361: 20
A362: BRUNSWICK | B362: 2 | C362: 1 | D362: =B362*6+C362 -> 13 | F362: 2 | G362: 2 | H362: =F362*6+G362 -> 14 | J362: 3 | K362: 2 | L362: =J362*6+K362 -> 20 | N362: 5 | O362: 4 | P362: =N362*6+O362 -> 34 | S362: FREAME | V362: BRUNSWICK | W362: 0 | X362: 12 | Y362: 0 | Z362: 269 | AA362: 867 | AB362: 31.02652825836217 | AC362: 0
A363: BEST PLAYERS
A364: NORTH MELBOURNE | B364: TORPEY | E364: H .LAUNDER | H364: SICILY | J364: CARLTON | M364: MONTGOMERIE | P364: McSWEENEY
A365: BRUNSWICK | B365: SULLIVAN | E365: MUDGE | H365: DE FEU | J365: WHELAN | M365: WATSON | P365: ROSS
A366: GOALKICKERS
A367: NORTH MELBOURNE | B367: H LAUNDER 2 | E367: CARLTON 2 | H367: DIXON 2 | J367: TAYLOR 2 | M367: SMITH | O367: McLEISH | Q367: SARSFIELD
A368: BRUNSWICK | B368: McKENZIE 2 | E368: DE FEU | H368: MEYERS | K368: SCOTT
A370: WILLIAMSTOWN | B370: 1 | C370: 1 | D370: =B370*6+C370 -> 7 | F370: 2 | G370: 2 | H370: =F370*6+G370 -> 14 | J370: 5 | K370: 6 | L370: =J370*6+K370 -> 36 | N370: 5 | O370: 6 | P370: =N370*6+O370 -> 36 | S370: WILLIAMSTOWN
A371: FOOTSCRAY | B371: 0 | C371: 1 | D371: =B371*6+C371 -> 1 | F371: 2 | G371: 2 | H371: =F371*6+G371 -> 14 | J371: 2 | K371: 2 | L371: =J371*6+K371 -> 14 | N371: 3 | O371: 4 | P371: =N371*6+O371 -> 22 | S371: SHAW
A372: BEST PLAYERS
A373: WILLIAMSTOWN | B373: MCWILLIAMS | E373: McKINLEY | H373: W .HALL | K373: R .HALL | N373: GUTHRIE | Q373: WARREN
A374: FOOTSCRAY | B374: MOLYNEUX | E374: WILSON | H374: ARMSTRONG | K374: GRUNDEN | N374: DREW | Q374: DICKENS
A375: GOALKICKERS
A376: WILLIAMSTOWN | B376: WARREN 3 | F376: GIBBS | I376: McWILLIAMS
A377: FOOTSCRAY | B377: DREW | E377: ARMSTRONG | I377: MITCHELL
A379: ROUND 13 | C379: 6TH AUGUST | H379: WEATHER | L379: NORTH WIND
C381: 1ST QTR | G381: 2ND QTR | K381: 3RD QTR | O381: FINAL | S381: AT
S382: PORT MELB
A383: PORT MELBOURNE | B383: 0 | C383: 2 | D383: =B383*6+C383 -> 2 | F383: 4 | G383: 3 | H383: =F383*6+G383 -> 27 | J383: 5 | K383: 3 | L383: =J383*6+K383 -> 33 | N383: 7 | O383: 10 | P383: =N383*6+O383 -> 52 | S383: UMPIRE | V383: LADDER | AA383: ROUND | AC383: 13
A384: WILLIAMSTOWN | B384: 0 | C384: 0 | D384: =B384*6+C384 -> 0 | F384: 0 | G384: 1 | H384: =F384*6+G384 -> 1 | J384: 0 | K384: 5 | L384: =J384*6+K384 -> 5 | N384: 1 | O384: 7 | P384: =N384*6+O384 -> 13 | S384: CARRIS
A385: BEST PLAYERS | V385: TEAM | W385: W | X385: L | Y385: D | Z385: FOR | AA385: AGST | AB385: % | AC385: PTS
A386: PORT MELBOURNE | B386: POWELL | E386: A .JOHNSTON | H386: O'BRIEN | J386: PEARS | M386: DALY | P386: BLAIR
A387: WILLIAMSTOWN | B387: W .HALL | E387: ROACH | H387: WARREN | J387: WORRALL | M387: KENNY | P387: THOMPSON | V387: FOOTSCRAY | W387: 10 | X387: 3 | Y387: 0 | Z387: 510 | AA387: 392 | AB387: 130.10204081632654 | AC387: 40
A388: GOALKICKERS | V388: NORTH MELBOURNE | W388: 9 | X388: 4 | Y388: 0 | Z388: 632 | AA388: 517 | AB388: 122.24371373307544 | AC388: 36
A389: PORT MELBOURNE | B389: DALY 3 | E389: SULLVAN 2 | I389: O'BRIEN | L389: MONAGLE | V389: PORT MELBOURNE | W389: 8 | X389: 5 | Y389: 0 | Z389: 676 | AA389: 355 | AB389: 190.42253521126761 | AC389: 32
A390: WILLIAMSTOWN | B390: BARNES | V390: RICHMOND | W390: 7 | X390: 6 | Y390: 0 | Z390: 576 | AA390: 433 | AB390: 133.02540415704388 | AC390: 28
A392: RICHMOND | B392: 8 | C392: 5 | D392: =B392*6+C392 -> 53 | F392: 9 | G392: 8 | H392: =F392*6+G392 -> 62 | J392: 10 | K392: 13 | L392: =J392*6+K392 -> 73 | N392: 13 | O392: 17 | P392: =N392*6+O392 -> 95 | S392: RICHMOND | V392: WILLIAMSTOWN | W392: 5 | X392: 8 | Y392: 0 | Z392: 392 | AA392: 410 | AB392: 95.609756097560975 | AC392: 20
A393: BRUNSWICK | B393: 0 | C393: 0 | D393: =B393*6+C393 -> 0 | F393: 0 | G393: 1 | H393: =F393*6+G393 -> 1 | J393: 2 | K393: 1 | L393: =J393*6+K393 -> 13 | N393: 2 | O393: 2 | P393: =N393*6+O393 -> 14 | S393: FREAME | V393: BRUNSWICK | W393: 0 | X393: 13 | Y393: 0 | Z393: 283 | AA393: 962 | AB393: 29.417879417879419 | AC393: 0
A394: BEST PLAYERS
A395: RICHMOND | B395: D. WATSON | E395: LEVIEN | H395: LEWIS | K395: HARDIMAN | N395: BACKHOUSE | Q395: ELDER
A396: BRUNSWICK | B396: O'LOUGHLIN | E396: WHELAN | H396: LEEDS | K396: MUDGE | N396: McKENZIE
A397: GOALKICKERS
A398: RICHMOND | B398: G BACKHOUSE 3 | F398: ELDER 3 | H398: HAYES 2 | J398: QUINN | L398: RUDD | N398: PARKER | P398: McGUIRE | R398: P WILLIAMS
A399: BRUNSWICK | B399: SCOTT | E399: LEEDS
A401: NORTH MELBOURNE | B401: 1 | C401: 5 | D401: =B401*6+C401 -> 11 | F401: 1 | G401: 5 | H401: =F401*6+G401 -> 11 | J401: 3 | K401: 7 | L401: =J401*6+K401 -> 25 | N401: 6 | O401: 10 | P401: =N401*6+O401 -> 46 | S401: NORTH MELB
A402: FOOTSCRAY | B402: 1 | C402: 0 | D402: =B402*6+C402 -> 6 | F402: 4 | G402: 4 | H402: =F402*6+G402 -> 28 | J402: 4 | K402: 5 | L402: =J402*6+K402 -> 29 | N402: 4 | O402: 7 | P402: =N402*6+O402 -> 31 | S402: SCHAEFER
A403: BEST PLAYERS
A404: NORTH MELBOURNE | B404: HOUSTEN | E404: TORPEY | H404: GRAHAM | K404: McSWEENEY | N404: TAYLOR | Q404: QUILLIGAN
A405: FOOTSCRAY | B405: ARMSTRONG | E405: GRUNDEN | H405: DREW | K405: SUFFOLK | N405: MONTGOMERIE | Q405: MOLYNEUX
A406: GOALKICKERS
A407: NORTH MELBOURNE | B407: TORPEY 3 | F407: SMITH | I407: HOUSTON | L407: GRAHAM
A408: FOOTSCRAY | B408: GRUNDEN | E408: KRUSE | H408: DECOIT | K408: ARMSTRONG
A410: ROUND 14 | C410: 13TH AUGUST | H410: WEATHER | L410: NORTH WEST WIND
C412: 1ST QTR | G412: 2ND QTR | K412: 3RD QTR | O412: FINAL | S412: AT
S413: PORT MELB
A414: PORT MELBOURNE | B414: 1 | C414: 4 | D414: =B414*6+C414 -> 10 | F414: 3 | G414: 5 | H414: =F414*6+G414 -> 23 | J414: 5 | K414: 6 | L414: =J414*6+K414 -> 36 | N414: 9 | O414: 8 | P414: =N414*6+O414 -> 62 | S414: UMPIRE | V414: LADDER | AA414: ROUND | AC414: 14
A415: BRUNSWICK | B415: 1 | C415: 1 | D415: =B415*6+C415 -> 7 | F415: 1 | G415: 5 | H415: =F415*6+G415 -> 11 | J415: 3 | K415: 6 | L415: =J415*6+K415 -> 24 | N415: 3 | O415: 7 | P415: =N415*6+O415 -> 25 | S415: CARRIS
A416: BEST PLAYERS | V416: TEAM | W416: W | X416: L | Y416: D | Z416: FOR | AA416: AGST | AB416: % | AC416: PTS
A417: PORT MELBOURNE
A418: BRUNSWICK | V418: FOOTSCRAY | W418: 11 | X418: 3 | Y418: 0 | Z418: 544 | AA418: 417 | AB418: 130.45563549160673 | AC418: 44
A419: GOALKICKERS | V419: NORTH MELBOURNE | W419: 10 | X419: 4 | Y419: 0 | Z419: 685 | AA419: 551 | AB419: 124.31941923774954 | AC419: 40
A420: PORT MELBOURNE | B420: POWELL 3 | E420: SULLIVAN 2 | I420: MONAGLE 2 | M420: SHANNON | V420: PORT MELBOURNE | W420: 9 | X420: 5 | Y420: 0 | Z420: 738 | AA420: 380 | AB420: 194.21052631578948 | AC420: 36
A421: BRUNSWICK | B421: TAYLOR | E421: MEYERS | H421: BUTWELL | V421: RICHMOND | W421: 7 | X421: 7 | Y421: 0 | Z421: 601 | AA421: 467 | AB421: 128.69379014989295 | AC421: 28
A423: NORTH MELBOURNE | B423: 1 | C423: 3 | D423: =J462*6+K462 -> 0 | F423: 5 | G423: 4 | H423: =N462*6+O462 -> 0 | J423: 6 | K423: 6 | L423: =R462*6+S462 -> 0 | N423: 7 | O423: 11 | P423: =N423*6+O423 -> 53 | S423: NORTH MELB | V423: WILLIAMSTOWN | W423: 5 | X423: 9 | Y423: 0 | Z423: 426 | AA423: 463 | AB423: 92.008639308855294 | AC423: 20
A424: WILLIAMSTOWN | B424: 1 | C424: 3 | D424: =N462*6+O462 -> 0 | F424: 2 | G424: 3 | H424: =R462*6+S462 -> 0 | J424: 2 | K424: 3 | L424: =V462*6+W462 -> 0 | N424: 5 | O424: 4 | P424: =N424*6+O424 -> 34 | S424: FREAME | V424: BRUNSWICK | W424: 0 | X424: 14 | Y424: 0 | Z424: 308 | AA424: 1024 | AB424: 30.078125 | AC424: 0
A425: BEST PLAYERS
A426: NORTH MELBOURNE | B426: SICILY | E426: GRAHAM | H426: TAYLOR | K426: CARLTON | N426: NOONAN | Q426: KELLY
A427: WILLIAMSTOWN | B427: WARREN | E427: WORRALL | H427: McKINLEY | K427: ROACH | N427: GUTHRIE | Q427: CALDWELL
A428: GOALKICKERS
A429: NORTH MELBOURNE | B429: NOONAN 2 | E429: KNEE 2 | H429: TORPEY | K429: SMITH | N429: KELLY
A430: WILLIAMSTOWN | B430: POWELL 2 | E430: GUTHRIE | H430: WARREN | K430: McKINLEY
A432: FOOTSCRAY | B432: 2 | C432: 0 | D432: =B432*6+C432 -> 12 | F432: 2 | G432: 4 | H432: =F432*6+G432 -> 16 | J432: 3 | K432: 4 | L432: =J432*6+K432 -> 22 | N432: 4 | O432: 10 | P432: =N432*6+O432 -> 34 | S432: RICHMOND
A433: RICHMOND | B433: 1 | C433: 3 | D433: =B433*6+C433 -> 9 | F433: 1 | G433: 7 | H433: =F433*6+G433 -> 13 | J433: 3 | K433: 7 | L433: =J433*6+K433 -> 25 | N433: 3 | O433: 7 | P433: =N433*6+O433 -> 25 | S433: SCHAEFER
A434: BEST PLAYERS
A435: FOOTSCRAY | B435: GRUNDEN | E435: MOLYNEUX | H435: DE COIT | K435: DICKENS | N435: BROCKWELL | Q435: DREW
A436: RICHMOND | B436: O'HALLORAN | E436: TAYLOR | H436: BAHEN | K436: BACKHOUSE | N436: WILLIAMS | Q436: HARDIMAN
A437: GOALKICKERS
A438: FOOTSCRAY | B438: MONTGARRETT 2 | G438: JAMES | J438: MITCHELL
A439: RICHMOND | B439: HAYES | E439: McGUIRE | H439: LEWIS
A441: ROUND 15 | C441: 20TH AUGUST | H441: WEATHER | L441: FINE GROUNDS GOOD
C443: 1ST QTR | G443: 2ND QTR | K443: 3RD QTR | O443: FINAL | S443: AT
S444: NORTH MELB
A445: NORTH MELBOURNE | B445: 3 | C445: 2 | D445: =B445*6+C445 -> 20 | F445: 5 | G445: 5 | H445: =F445*6+G445 -> 35 | J445: 8 | K445: 8 | L445: =J445*6+K445 -> 56 | N445: 10 | O445: 12 | P445: =N445*6+O445 -> 72 | S445: UMPIRE | V445: LADDER | AA445: ROUND | AC445: 15
A446: PORT MELBOURNE | B446: 2 | C446: 2 | D446: =B446*6+C446 -> 14 | F446: 5 | G446: 2 | H446: =F446*6+G446 -> 32 | J446: 6 | K446: 3 | L446: =J446*6+K446 -> 39 | N446: 7 | O446: 5 | P446: =N446*6+O446 -> 47 | S446: SCHAEFER
A447: BEST PLAYERS | V447: TEAM | W447: W | X447: L | Y447: D | Z447: FOR | AA447: AGST | AB447: % | AC447: PTS
A448: NORTH MELBOURNE | B448: SICILY | E448: GRAHAM | H448: KNEE | K448: HOUSTEN | N448: E .LAUNDER | Q448: MONTGOMERIE
A449: PORT MELBOURNE | B449: A .JOHNSTON | E449: HICKEY | H449: RYAN | K449: ROBERTSON | N449: MORTON | Q449: SULLIVAN | V449: FOOTSCRAY | W449: 12 | X449: 3 | Y449: 0 | Z449: 606 | AA449: 427 | AB449: 141.92037470725995 | AC449: 48
A450: GOALKICKERS | V450: NORTH MELBOURNE | W450: 11 | X450: 4 | Y450: 0 | Z450: 757 | AA450: 598 | AB450: 126.5886287625418 | AC450: 44
A451: NORTH MELBOURNE | B451: KNEE 4 | E451: SMITH 2 | H451: KELLY | J451: PATON | M451: H LAUNDER | P451: SICILY | V451: PORT MELBOURNE | W451: 9 | X451: 6 | Y451: 0 | Z451: 785 | AA451: 452 | AB451: 173.67256637168143 | AC451: 36
A452: PORT MELBOURNE | B452: MONAGLE 2 | E452: SULLIVAN 2 | H452: DALY | J452: JOHNSON | M452: McGEE | V452: RICHMOND | W452: 8 | X452: 7 | Y452: 0 | Z452: 663 | AA452: 499 | AB452: 132.86573146292585 | AC452: 32
A454: FOOTSCRAY | B454: 2 | C454: 7 | D454: =B454*6+C454 -> 19 | F454: 3 | G454: 9 | H454: =F454*6+G454 -> 27 | J454: 6 | K454: 12 | L454: =J454*6+K454 -> 48 | N454: 8 | O454: 14 | P454: =N454*6+O454 -> 62 | S454: FOOTSCRAY | V454: WILLIAMSTOWN | W454: 5 | X454: 10 | Y454: 0 | Z454: 458 | AA454: 525 | AB454: 87.238095238095241 | AC454: 20
A455: BRUNSWICK | B455: 1 | C455: 1 | D455: =B455*6+C455 -> 7 | F455: 1 | G455: 1 | H455: =F455*6+G455 -> 7 | J455: 1 | K455: 1 | L455: =J455*6+K455 -> 7 | N455: 1 | O455: 4 | P455: =N455*6+O455 -> 10 | S455: CARRIS | V455: BRUNSWICK | W455: 0 | X455: 15 | Y455: 0 | Z455: 318 | AA455: 1086 | AB455: 29.281767955801104 | AC455: 0
A456: BEST PLAYERS
A457: FOOTSCRAY
A458: BRUNSWICK
A459: GOALKICKERS
A460: FOOTSCRAY | B460: GREGORY 4 | E460: F MITCHELL | H460: ARMSTRONG | K460: DICKENS | M460: SHANAHAN
A461: BRUNSWICK | B461: PARKER
A463: RICHMOND | B463: 2 | C463: 4 | D463: =B463*6+C463 -> 16 | F463: 6 | G463: 4 | H463: =F463*6+G463 -> 40 | J463: 7 | K463: 7 | L463: =J463*6+K463 -> 49 | N463: 9 | O463: 8 | P463: =N463*6+O463 -> 62 | S463: RICHMOND
A464: WILLIAMSTOWN | B464: 1 | C464: 5 | D464: =B464*6+C464 -> 11 | F464: 1 | G464: 6 | H464: =F464*6+G464 -> 12 | J464: 3 | K464: 8 | L464: =J464*6+K464 -> 26 | N464: 4 | O464: 8 | P464: =N464*6+O464 -> 32 | S464: SHAW
A465: BEST PLAYERS
A466: RICHMOND | B466: T. WATSON | E466: D .WATSON | H466: BAHEN | K466: LEWIS | N466: PARKER | Q466: TAYLOR
A467: WILLIAMSTOWN | B467: ROACH | E467: CALDWELL | H467: GIBBS | K467: W .WARREN | N467: R. HALL | Q467: WORRALL
A468: GOALKICKERS
A469: RICHMOND | B469: HAYES 3 | E469: ELDER 3 | H469: LEWIS | J469: PARKER | M469: G BACKHOUSE
A470: WILLIAMSTOWN | B470: HEALEY 2 | E470: WARREN | H470: WORRALL
A472: ROUNDS 16 & 17 WERE PLAYED BETWEEN THE TOP FOUR SIDES ONLY
A474: ROUND 16 | C474: 3RD SEPTEMBER | H474: WEATHER | L474: SOUTH WIND SHOWERS
C476: 1ST QTR | G476: 2ND QTR | K476: 3RD QTR | O476: FINAL | S476: AT
S477: PORT MELB
A478: PORT MELB | B478: 1 | C478: 0 | D478: =B478*6+C478 -> 6 | F478: 5 | G478: 1 | H478: =F478*6+G478 -> 31 | J478: 14 | K478: 10 | L478: =J478*6+K478 -> 94 | N478: 14 | O478: 10 | P478: =N478*6+O478 -> 94 | S478: UMPIRE | V478: LADDER | AA478: ROUND | AC478: 16
A479: RICHMOND | B479: 2 | C479: 0 | D479: =B479*6+C479 -> 12 | F479: 3 | G479: 0 | H479: =F479*6+G479 -> 18 | J479: 4 | K479: 0 | L479: =J479*6+K479 -> 24 | N479: 4 | O479: 0 | P479: =N479*6+O479 -> 24 | S479: CARRIS
A480: BEST PLAYERS | V480: TEAM | W480: W | X480: L | Y480: D | Z480: FOR | AA480: AGST | AB480: % | AC480: PTS
A481: PORT MELB
A482: RICHMOND | V482: FOOTSCRAY | W482: 13 | X482: 3 | Y482: 0 | Z482: 654 | AA482: 450 | AB482: 145.33 | AC482: 52
A483: GOALKICKERS | V483: NORTH MELBOURNE | W483: 11 | X483: 5 | Y483: 0 | Z483: 780 | AA483: 646 | AB483: 120.75 | AC483: 44
A484: PORT MELB | V484: PORT MELBOURNE | W484: 10 | X484: 6 | Y484: 0 | Z484: 879 | AA484: 476 | AB484: 184.66 | AC484: 40
A485: RICHMOND | V485: RICHMOND | W485: 8 | X485: 8 | Y485: 0 | Z485: 687 | AA485: 593 | AB485: 115.85 | AC485: 32
A487: RICHMOND WERE UPSET AT THE TREATMENT THEY RECEIVED FROM THE PORT PLAYERS | V487: WILLIAMSTOWN | W487: 5 | X487: 10 | Y487: 0 | Z487: 458 | AA487: 525 | AB487: 87.238095238095241 | AC487: 20
A488: AND RETIRED FROM THE GAME AT 1/2 TIME. SIX PLAYERS RETURNED TO PLAY ON | V488: BRUNSWICK | W488: 0 | X488: 15 | Y488: 0 | Z488: 318 | AA488: 1086 | AB488: 29.281767955801104 | AC488: 0
A489: BUT THEY TOO LEFT THE GROUND AT 3/4 TIME.
A491: FOOTSCRAY | B491: 2 | C491: 2 | D491: =B491*6+C491 -> 14 | F491: 3 | G491: 4 | H491: =F491*6+G491 -> 22 | J491: 6 | K491: 10 | L491: =J491*6+K491 -> 46 | N491: 6 | O491: 12 | P491: =N491*6+O491 -> 48 | S491: NORTH MELB
A492: NORTH MELBOURNE | B492: 0 | C492: 1 | D492: =B492*6+C492 -> 1 | F492: 0 | G492: 4 | H492: =F492*6+G492 -> 4 | J492: 1 | K492: 4 | L492: =J492*6+K492 -> 10 | N492: 3 | O492: 5 | P492: =N492*6+O492 -> 23 | S492: SCHAEFER
A493: BEST PLAYERS
A494: FOOTSCRAY | B494: DECOIT | E494: ARMSTRONG | H494: BROCKWELL | K494: HINCH | N494: GRUNDEN | Q494: DICKENS
A495: NORTH MELBOURNE | B495: GRAHAM | E495: LONERGAN | H495: TAYLOR | K495: ROLENT | N495: KELLY | Q495: NOONAN
A496: GOALKICKERS
A497: FOOTSCRAY | B497: MITCHELL | E497: KRUSE | H497: MONTGARRETT | K497: DECOIT | N497: DREW | P497: WILLIAMS
A498: NORTH MELBOURNE | B498: KELLY 2 | E498: H LAUNDER
A500: ROUND 17 | C500: 10TH SEPTEMBER | H500: WEATHER | L500: RAIN GROUNDS HEAVY
C502: 1ST QTR | G502: 2ND QTR | K502: 3RD QTR | O502: FINAL | S502: AT
S503: PORT MELB
A504: PORT MELBOURNE | B504: 2 | C504: 5 | D504: =B504*6+C504 -> 17 | F504: 4 | G504: 6 | H504: =F504*6+G504 -> 30 | J504: 6 | K504: 6 | L504: =J504*6+K504 -> 42 | N504: 7 | O504: 10 | P504: =N504*6+O504 -> 52 | S504: UMPIRE | V504: LADDER | AA504: ROUND | AC504: 17
A505: FOOTSCRAY | B505: 0 | C505: 0 | D505: =B505*6+C505 -> 0 | F505: 0 | G505: 1 | H505: =F505*6+G505 -> 1 | J505: 0 | K505: 3 | L505: =J505*6+K505 -> 3 | N505: 2 | O505: 4 | P505: =N505*6+O505 -> 16 | S505: FREAME
A506: BEST PLAYERS | V506: TEAM | W506: W | X506: L | Y506: D | Z506: FOR | AA506: AGST | AB506: % | AC506: PTS
A507: PORT MELBOURNE | B507: McGEE | E507: RYAN | H507: SULLIVAN | K507: A .JOHNSTON | N507: BLAIR | Q507: PEARS
A508: FOOTSCRAY | B508: BROCKWELL | E508: MOLYNEUX | H508: DECOIT | K508: ARMSTRONG | N508: DREW | Q508: DICKENS | V508: FOOTSCRAY | W508: 13 | X508: 4 | Y508: 0 | Z508: 670 | AA508: 502 | AB508: 133.47 | AC508: 52
A509: GOALKICKERS | V509: NORTH MELBOURNE | W509: 12 | X509: 5 | Y509: 0 | Z509: 826 | AA509: 686 | AB509: 120.41 | AC509: 48
A510: PORT MELBOURNE | B510: SULLIVAN 2 | E510: RYAN 2 | H510: PEARS | K510: DALY | M510: NICKELL | V510: PORT MELBOURNE | W510: 11 | X510: 6 | Y510: 0 | Z510: 931 | AA510: 492 | AB510: 189.23 | AC510: 44
A511: FOOTSCRAY | B511: SUFFOLK 2 | V511: RICHMOND | W511: 8 | X511: 9 | Y511: 0 | Z511: 727 | AA511: 639 | AB511: 113.77 | AC511: 32
A513: NORTH MELBOURNE | B513: 2 | C513: 1 | D513: =B513*6+C513 -> 13 | F513: 3 | G513: 2 | H513: =F513*6+G513 -> 20 | J513: 5 | K513: 3 | L513: =J513*6+K513 -> 33 | N513: 7 | O513: 4 | P513: =N513*6+O513 -> 46 | S513: RICHMOND | V513: WILLIAMSTOWN | W513: 5 | X513: 10 | Y513: 0 | Z513: 458 | AA513: 525 | AB513: 87.238095238095241 | AC513: 20
A514: RICHMOND | B514: 1 | C514: 8 | D514: =B514*6+C514 -> 14 | F514: 3 | G514: 13 | H514: =F514*6+G514 -> 31 | J514: 3 | K514: 14 | L514: =J514*6+K514 -> 32 | N514: 4 | O514: 16 | P514: =N514*6+O514 -> 40 | S514: SHAW | V514: BRUNSWICK | W514: 0 | X514: 15 | Y514: 0 | Z514: 318 | AA514: 1086 | AB514: 29.281767955801104 | AC514: 0
A515: BEST PLAYERS
A516: NORTH MELBOURNE | B516: SICILY | E516: KNEE | H516: H. LAUNDER | K516: ROLENT | N516: QUILLIGAN | Q516: TAYLOR
A517: RICHMOND | B517: PARKER | E517: HARDIMAN | H517: RUDD | K517: CLARKE | N517: KNEE | Q517: NOONAN
A518: GOALKICKERS
A519: NORTH MELBOURNE | B519: NOONAN 2 | E519: KNEE 2 | H519: KELLY 2 | J519: H LAUNDER
A520: RICHMOND | B520: C WILLIAMS | E520: HARDIMAN | H520: LYONS | J520: ELDER