A2: Victorian Football Association
A3: Season 1899
A4: © Copyright Wal Williams | F4: First created: 2 August 2014
A5: Contact: joywalwi at gmail dot com | F5: Last updated: 30 July 2017 | W5: VFA Results and tables - Link to the main index page
A6: You are free to copy this document in whole or part provided that proper acknowledgement is given to the author. All rights reserved.
A8: ROUND 1 | E8: 6TH MAY | I8: WEATHER | M8: FINE SOUTH WEST WIND | W8: TEAM | X8: W | Y8: L | Z8: D | AA8: FOR | AB8: AGST | AC8: % | AD8: PTS
D10: 1ST QTR | H10: 2ND QTR | L10: 3RD QTR | P10: FINAL | S10: AT | X10: LADDER | AA10: ROUND | AC10: 1
S11: PORT MELB
A12: PORT MELBOURNE | C12: 2 | D12: 7 | E12: =C11*6+D11 -> 19 | G12: 2 | H12: 7 | I12: =G11*6+H11 -> 19 | K12: 3 | L12: 11 | M12: =K11*6+L11 -> 29 | O12: 3 | P12: 12 | Q12: =O11*6+P11 -> 30 | S12: UMPIRE | W12: WEST MELBOURNE | X12: 1 | Y12: 0 | Z12: 0 | AA12: 100 | AB12: 7 | AC12: 1428.5714285714287 | AD12: 4
A13: FOOTSCRAY | C13: 0 | D13: 0 | E13: =C12*6+D12 -> 0 | G13: 3 | H13: 2 | I13: =G12*6+H12 -> 20 | K13: 3 | L13: 2 | M13: =K12*6+L12 -> 20 | O13: 3 | P13: 8 | Q13: =O12*6+P12 -> 26 | S13: SCHAEFER | W13: NORTH MELBOURNE | X13: 1 | Y13: 0 | Z13: 0 | AA13: 44 | AB13: 29 | AC13: 151.72413793103448 | AD13: 4
A14: BEST PLAYERS | W14: RICHMOND | X14: 1 | Y14: 0 | Z14: 0 | AA14: 42 | AB14: 36 | AC14: 116.66666666666667 | AD14: 4
A15: PORT MELBOURNE | C15: ROBERTSON | F15: BLAIR | I15: HICKEY | K15: PEARS | N15: O'BRIEN | Q15: SHANNON | W15: PORT MELBOURNE | X15: 1 | Y15: 0 | Z15: 0 | AA15: 30 | AB15: 26 | AC15: 115.38461538461539 | AD15: 4
A16: FOOTSCRAY | C16: WILLIAMS | F16: MARMO | I16: HARRIS | K16: DICKENS | N16: KRUSE | Q16: GRUNDEN
A17: GOALKICKERS | W17: FOOTSCRAY | X17: 0 | Y17: 1 | Z17: 0 | AA17: 26 | AB17: 30 | AC17: 86.666666666666671 | AD17: 0
A18: PORT MELBOURNE | C18: NICKELL | F18: SHANNON | I18: HENDERSON | W18: PRAHRAN | X18: 0 | Y18: 1 | Z18: 0 | AA18: 36 | AB18: 42 | AC18: 85.714285714285708 | AD18: 0
A19: FOOTSCRAY | C19: HOUGHTON | F19: MOLYNEUX | I19: WILLIAMS | W19: WILLIAMSTOWN | X19: 0 | Y19: 1 | Z19: 0 | AA19: 29 | AB19: 44 | AC19: 65.909090909090907 | AD19: 0
W20: BRUNSWICK | X20: 0 | Y20: 1 | Z20: 0 | AA20: 7 | AB20: 100 | AC20: 7 | AD20: 0
A21: NORTH MELBOURNE | C21: 2 | D21: 4 | E21: =C20*6+D20 -> 16 | G21: 2 | H21: 4 | I21: =G20*6+H20 -> 16 | K21: 4 | L21: 5 | M21: =K20*6+L20 -> 29 | O21: 6 | P21: 8 | Q21: =O20*6+P20 -> 44 | S21: NORTH MELB
A22: WILLIAMSTOWN | C22: 0 | D22: 2 | E22: =C21*6+D21 -> 2 | G22: 1 | H22: 7 | I22: =G21*6+H21 -> 13 | K22: 1 | L22: 10 | M22: =K21*6+L21 -> 16 | O22: 3 | P22: 11 | Q22: =O21*6+P21 -> 29 | S22: FREAME
A23: BEST PLAYERS
A24: NORTH MELBOURNE | C24: SICILY | F24: H GRAHAM | I24: LAUNDER | L24: KNEE | O24: RUTLEY | R24: SMITH
A25: WILLIAMSTOWN | C25: HEDLEY | F25: W HALL | I25: WARREN | L25: SPRINTHALL | O25: R HALL | R25: CALDWELL
A26: GOALKICKERS
A27: NORTH MELBOURNE | C27: KNEE 2 | F27: RUTLEY 2 | I27: LAUNDER
A28: WILLIAMSTOWN | C28: McCALLUM | F28: WOOLFE | I28: WARREN
A30: RICHMOND | C30: 0 | D30: 3 | E30: =C29*6+D29 -> 3 | G30: 2 | H30: 4 | I30: =G29*6+H29 -> 16 | K30: 6 | L30: 4 | M30: =K29*6+L29 -> 40 | O30: 6 | P30: 6 | Q30: =O29*6+P29 -> 42 | S30: TOORAK PARK
A31: PRAHRAN | C31: 1 | D31: 0 | E31: =C30*6+D30 -> 6 | G31: 3 | H31: 3 | I31: =G30*6+H30 -> 21 | K31: 5 | L31: 5 | M31: =K30*6+L30 -> 35 | O31: 5 | P31: 6 | Q31: =O30*6+P30 -> 36 | S31: DICK
A32: BEST PLAYERS
A33: RICHMOND | C33: PARKER | F33: WILLIAMS | I33: CLARKE | K33: T .WATSON | N33: BAHEN | Q33: ELDER
A34: PRAHRAN | C34: LYONS | F34: JOHNSON | I34: LOWENTHAL | L34: RUST | N34: KRUGER | Q34: BALL
A35: GOALKICKERS
A36: RICHMOND | C36: McGUIRE 2 | F36: BACKHOUSE | I36: CARKEEK | L36: ELDER | N36: CLARKE
A37: PRAHRAN | C37: LYONS | F37: DOWNES | I37: WEATHERLEY | L37: KRUGER | N37: LOWENTHAL
A39: WEST MELBOURNE | C39: 1 | D39: 5 | E39: =C38*6+D38 -> 11 | G39: 3 | H39: 7 | I39: =G38*6+H38 -> 25 | K39: 9 | L39: 12 | M39: =K38*6+L38 -> 66 | O39: 14 | P39: 16 | Q39: =O38*6+P38 -> 100 | S39: BRUNWICK
A40: BRUNSWICK | C40: 1 | D40: 1 | E40: =C39*6+D39 -> 7 | G40: 1 | H40: 1 | I40: =G39*6+H39 -> 7 | K40: 1 | L40: 1 | M40: =K39*6+L39 -> 7 | O40: 1 | P40: 1 | Q40: =O39*6+P39 -> 7 | S40: MURPHY
A41: BEST PLAYERS
A42: WEST MELBOURNE | C42: TWITCHETT | F42: STONE | H42: A SNELL | K42: McHARG | N42: MOON | P42: PHILLIPS
A43: BRUNSWICK
A44: GOALKICKERS
A45: WEST MELBOURNE | C45: STONE 6 | F45: FITZELL 3 | I45: MORGAN 2 | L45: MURRAY | N45: CLANCY | P45: GOURLEY
A46: BRUNSWICK | C46: DUDLEY
A50: ROUND 2 | E50: 13TH MAY | K50: WEATHER | Q50: FINE | W50: TEAM | X50: W | Y50: L | Z50: D | AA50: FOR | AB50: AGST | AC50: % | AD50: PTS
D52: 1ST QTR | H52: 2ND QTR | L52: 3RD QTR | P52: FINAL | S52: AT | X52: LADDER | AA52: ROUND | AC52: 2
S53: RICHMOND
A54: PORT MELBOURNE | C54: 3 | D54: 0 | E54: =C53*6+D53 -> 18 | G54: 4 | H54: 7 | I54: =G53*6+H53 -> 31 | K54: 5 | L54: 8 | M54: =K53*6+L53 -> 38 | O54: 6 | P54: 10 | Q54: =O53*6+P53 -> 46 | S54: UMPIRE | W54: PORT MELBOURNE | X54: 2 | Y54: 0 | Z54: 0 | AA54: 76 | AB54: 51 | AC54: 149.01960784313727 | AD54: 8
A55: RICHMOND | C55: 1 | D55: 0 | E55: =C54*6+D54 -> 6 | G55: 2 | H55: 2 | I55: =G54*6+H54 -> 14 | K55: 3 | L55: 5 | M55: =K54*6+L54 -> 23 | O55: 3 | P55: 7 | Q55: =O54*6+P54 -> 25 | S55: STRANGER | W55: NORTH MELBOURNE | X55: 2 | Y55: 0 | Z55: 0 | AA55: 85 | AB55: 59 | AC55: 144.06779661016949 | AD55: 8
A56: BEST PLAYERS | W56: WEST MELBOURNE | X56: 1 | Y56: 1 | Z56: 0 | AA56: 130 | AB56: 48 | AC56: 270.83333333333331 | AD56: 4
A57: PORT MELBOURNE | C57: MAGEE | F57: KNOX | H57: POWELL | K57: SHANNON | N57: HASSETT | Q57: ROBERTSON | W57: FOOTSCRAY | X57: 1 | Y57: 1 | Z57: 0 | AA57: 96 | AB57: 58 | AC57: 165.51724137931035 | AD57: 4
A58: RICHMOND | C58: PARKER | F58: BAHEN | H58: BACKHOUSE | K58: CARKEEK | N58: T. WATSON | Q58: TAYLOR
A59: GOALKICKERS | W59: WILLIAMSTOWN | X59: 1 | Y59: 1 | Z59: 0 | AA59: 76 | AB59: 58 | AC59: 131.0344827586207 | AD59: 4
A60: PORT MELBOURNE | C60: PEARS 2 | F60: WOODS 2 | I60: WARD | K60: JACKSON | W60: RICHMOND | X60: 1 | Y60: 1 | Z60: 0 | AA60: 67 | AB60: 82 | AC60: 81.707317073170728 | AD60: 4
A61: RICHMOND | C61: CARKEEK | F61: ELDER | H61: PARKER | W61: PRAHRAN | X61: 0 | Y61: 2 | Z61: 0 | AA61: 64 | AB61: 112 | AC61: 57.142857142857146 | AD61: 0
W62: BRUNSWICK | X62: 0 | Y62: 2 | Z62: 0 | AA62: 21 | AB62: 147 | AC62: 14.285714285714286 | AD62: 0
A63: FOOTSCRAY | C63: 3 | D63: 1 | E63: =C62*6+D62 -> 19 | G63: 6 | H63: 3 | I63: =G62*6+H62 -> 39 | K63: 7 | L63: 4 | M63: =K62*6+L62 -> 46 | O63: 10 | P63: 10 | Q63: =O62*6+P62 -> 70 | S63: FOOTSCRAY
A64: PRAHRAN | C64: 0 | D64: 2 | E64: =C63*6+D63 -> 2 | G64: 0 | H64: 2 | I64: =G63*6+H63 -> 2 | K64: 4 | L64: 4 | M64: =K63*6+L63 -> 28 | O64: 4 | P64: 4 | Q64: =O63*6+P63 -> 28 | S64: FREAME
A65: BEST PLAYERS
A66: FOOTSCRAY | C66: DECOIT | F66: WILLIAMS | I66: MARMO | K66: HARRIS | N66: ROBINSON | Q66: GRUNDEN
A67: PRAHRAN | C67: RUST | F67: KRUGER | H67: JOHNSON | K67: GREENLAND | N67: LYONS | Q67: WEATHERLEY
A68: GOALKICKERS
A69: FOOTSCRAY | C69: DALY 4 | F69: DECOIT 3 | I69: DICKENS 2 | L69: HOUGHTON
A70: PRAHRAN | C70: WAINWRIGHT 2 | G70: LYONS | I70: DOWNES
A72: NORTH MELBOURNE | C72: 1 | D72: 4 | E72: =C71*6+D71 -> 10 | G72: 3 | H72: 9 | I72: =G71*6+H71 -> 27 | K72: 3 | L72: 14 | M72: =K71*6+L71 -> 32 | O72: 4 | P72: 17 | Q72: =O71*6+P71 -> 41 | S72: NORTH MELB
A73: WEST MELBOURNE | C73: 0 | D73: 3 | E73: =C72*6+D72 -> 3 | G73: 2 | H73: 3 | I73: =G72*6+H72 -> 15 | K73: 2 | L73: 5 | M73: =K72*6+L72 -> 17 | O73: 4 | P73: 6 | Q73: =O72*6+P72 -> 30 | S73: SCHAEFER
A74: BEST PLAYERS
A75: NORTH MELBOURNE | C75: H. LAUNDER | F75: GRAHAM | I75: SICILY | K75: KELLY | N75: BOGLE | Q75: McCLUMPA
A76: WEST MELBOURNE | C76: TWITCHETT | F76: JOHNSON | I76: A .SNELL | K76: PAGE | N76: KENNEDY | Q76: McKAY
A77: GOALKICKERS
A78: NORTH MELBOURNE | C78: KNEE 2 | F78: H. LAUNDER | I78: RUTLEY
A79: WEST MELBOURNE | C79: STONE 2 | F79: TWITCHETT | I79: BROWN
A81: WILLIAMSTOWN | C81: 0 | D81: 4 | E81: =C80*6+D80 -> 4 | G81: 3 | H81: 7 | I81: =G80*6+H80 -> 25 | K81: 5 | L81: 11 | M81: =K80*6+L80 -> 41 | O81: 6 | P81: 11 | Q81: =O80*6+P80 -> 47 | S81: W.TOWN
A82: BRUNSWICK | C82: 0 | D82: 0 | E82: =C81*6+D81 -> 0 | G82: 0 | H82: 0 | I82: =G81*6+H81 -> 0 | K82: 0 | L82: 0 | M82: =K81*6+L81 -> 0 | O82: 2 | P82: 2 | Q82: =O81*6+P81 -> 14 | S82: CUNNINGHAM
A83: BEST PLAYERS
A84: WILLIAMSTOWN | C84: WARREN | F84: POWELL | H84: W.HALL | K84: J .THOMPSON | N84: WARD | Q84: WOODS
A85: BRUNSWICK | C85: JOHNSON | F85: O'LOUGHLAN | J85: MUDGE
A86: GOALKICKERS
A87: WILLIAMSTOWN | C87: THURGOOD 2 | G87: R .HALL | I87: HEDLEY | K87: BARR | M87: BARTY
A88: BRUNSWICK | C88: McKENZIE 2
A90: ROUND 3 | E90: 20TH MAY | I90: WEATHER | O90: SOUTH EAST WIND | W90: TEAM | X90: W | Y90: L | Z90: D | AA90: FOR | AB90: AGST | AC90: % | AD90: PTS
D92: 1ST QTR | H92: 2ND QTR | L92: 3RD QTR | P92: FINAL | S92: AT | X92: LADDER | AA92: ROUND | AC92: 3
S93: PORT MELB
A94: PORT MELBOURNE | C94: 1 | D94: 0 | E94: =C93*6+D93 -> 6 | G94: 3 | H94: 0 | I94: =G93*6+H93 -> 18 | K94: 3 | L94: 5 | M94: =K93*6+L93 -> 23 | O94: 3 | P94: 7 | Q94: =O93*6+P93 -> 25 | S94: UMPIRE | W94: NORTH MELBOURNE | X94: 3 | Y94: 0 | Z94: 0 | AA94: 145 | AB94: 82 | AC94: 176.82926829268294 | AD94: 12
A95: WILLIAMSTOWN | C95: 1 | D95: 0 | E95: =C94*6+D94 -> 6 | G95: 3 | H95: 0 | I95: =G94*6+H94 -> 18 | K95: 3 | L95: 2 | M95: =K94*6+L94 -> 20 | O95: 3 | P95: 4 | Q95: =O94*6+P94 -> 22 | S95: SCHAEFER | W95: PORT MELBOURNE | X95: 3 | Y95: 0 | Z95: 0 | AA95: 101 | AB95: 73 | AC95: 138.35616438356163 | AD95: 12
A96: BEST PLAYERS | W96: FOOTSCRAY | X96: 2 | Y96: 1 | Z96: 0 | AA96: 147 | AB96: 93 | AC96: 158.06451612903226 | AD96: 8
A97: PORT MELBOURNE | C97: KNOX | F97: McGEE | H97: HICKEY | K97: PEARS | N97: O'BRIEN | Q97: SHANNON | W97: WEST MELBOURNE | X97: 1 | Y97: 2 | Z97: 0 | AA97: 188 | AB97: 125 | AC97: 150.4 | AD97: 4
A98: WILLIAMSTOWN | C98: WARREN | F98: HEDLEY | H98: R.HALL | K98: SPRINTALL | N98: BARNES | Q98: WARD
A99: GOALKICKERS | W99: WILLIAMSTOWN | X99: 1 | Y99: 2 | Z99: 0 | AA99: 98 | AB99: 83 | AC99: 118.07228915662651 | AD99: 4
A100: PORT MELBOURNE | C100: HASSETT | F100: WAGLAND | I100: WOODS | W100: PRAHRAN | X100: 1 | Y100: 2 | Z100: 0 | AA100: 141 | AB100: 170 | AC100: 82.941176470588232 | AD100: 4
A101: WILLIAMSTOWN | C101: CASE 2 | F101: GUTHRIE | W101: RICHMOND | X101: 1 | Y101: 2 | Z101: 0 | AA101: 90 | AB101: 142 | AC101: 63.380281690140848 | AD101: 4
W102: BRUNSWICK | X102: 0 | Y102: 3 | Z102: 0 | AA102: 56 | AB102: 198 | AC102: 28.282828282828284 | AD102: 0
A103: NORTH MELBOURNE | C103: 4 | D103: 5 | E103: =C102*6+D102 -> 29 | G103: 6 | H103: 7 | I103: =G102*6+H102 -> 43 | K103: 8 | L103: 12 | M103: =K102*6+L102 -> 60 | O103: 8 | P103: 12 | Q103: =O102*6+P102 -> 60 | S103: NORTH MELB
A104: RICHMOND | C104: 0 | D104: 0 | E104: =C103*6+D103 -> 0 | G104: 1 | H104: 2 | I104: =G103*6+H103 -> 8 | K104: 1 | L104: 2 | M104: =K103*6+L103 -> 8 | O104: 2 | P104: 11 | Q104: =O103*6+P103 -> 23 | S104: HARRISON
A105: BEST PLAYERS
A106: NORTH MELBOURNE | C106: SICILY | F106: H .LAUNDER | I106: GRAHAM | K106: TORPEY | N106: KINMAN | Q106: LONDERIGAN
A107: RICHMOND | C107: PARKER | F107: BACKHOUSE | I107: CARKEEK | K107: McGUIRE | N107: T .WATSON | Q107: HARDIMAN
A108: GOALKICKERS
A109: NORTH MELBOURNE | C109: SICILY 2 | F109: KNEE 2 | I109: KINMAN | K109: T .SMITH | N109: McLEAN | Q109: E .LAUNDER
A110: RICHMOND | C110: BACKHOUSE | F110: MAYNE
A112: FOOTSCRAY | C112: 4 | D112: 4 | E112: =C111*6+D111 -> 28 | G112: 4 | H112: 6 | I112: =G111*6+H111 -> 30 | K112: 7 | L112: 9 | M112: =K111*6+L111 -> 51 | O112: 7 | P112: 9 | Q112: =O111*6+P111 -> 51 | S112: B.WICK
A113: BRUNSWICK | C113: 1 | D113: 0 | E113: =C112*6+D112 -> 6 | G113: 4 | H113: 3 | I113: =G112*6+H112 -> 27 | K113: 4 | L113: 3 | M113: =K112*6+L112 -> 27 | O113: 5 | P113: 5 | Q113: =O112*6+P112 -> 35 | S113: BREMNER
A114: BEST PLAYERS
A115: FOOTSCRAY | C115: MARMO | F115: DICKENS | I115: DALY | K115: DECOIT | N115: MITCHELL | Q115: HOUGHTON
A116: BRUNSWICK | C116: O'LOUGHLAN | F116: PARKER | I116: JOHNSON | K116: HEGARTY | N116: MUDGE | Q116: DELAHUNTY
A117: GOALKICKERS
A118: FOOTSCRAY | C118: DALY 3 | F118: DECOIT | I118: DREW | K118: HOUGHTON | N118: MITCHELL
A119: BRUNSWICK | C119: ROBERTSON | F119: JOHNSTON | I119: O'LOUGHLAN | L119: DELAHUNTY | O119: WATSON
A121: PRAHRAN | C121: 2 | D121: 8 | E121: =C120*6+D120 -> 20 | G121: 3 | H121: 11 | I121: =G120*6+H120 -> 29 | K121: 5 | L121: 16 | M121: =K120*6+L120 -> 46 | O121: 10 | P121: 17 | Q121: =O120*6+P120 -> 77 | S121: TOORAK PARK
A122: WEST MELBOURNE | C122: 0 | D122: 1 | E122: =C121*6+D121 -> 1 | G122: 2 | H122: 5 | I122: =G121*6+H121 -> 17 | K122: 7 | L122: 6 | M122: =K121*6+L121 -> 48 | O122: 8 | P122: 10 | Q122: =O121*6+P121 -> 58 | S122: FREAME
A123: BEST PLAYERS
A124: PRAHRAN | C124: ABRAHAMS | F124: LYONS | I124: JOHNSTON | K124: RUST | N124: WESTBROOK | Q124: HOWELL
A125: WEST MELBOURNE | C125: STONE | F125: MORGAN | I125: MEAD | K125: FERGUSON | N125: TWITCHETT | Q125: LAWSON
A126: GOALKICKERS
A127: PRAHRAN | C127: ABRAHAMS 4 | G127: DOWNES 2 | J127: RYAN 2 | M127: CULLEN | O127: WAINWRIGHT
A128: WEST MELBOURNE | C128: LAWSON 2 | F128: A. SNELL 2 | I128: MORGAN | K128: PULLAR | N128: STONE | P128: TWITCHETT
A130: ROUND 4 | C130: 24TH MAY (QUEENS BIRTHDAY) | L130: WEATHER | O130: SOUTH WIND RAIN | W130: TEAM | X130: W | Y130: L | Z130: D | AA130: FOR | AB130: AGST | AC130: % | AD130: PTS
D132: 1ST QTR | H132: 2ND QTR | L132: 3RD QTR | P132: FINAL | S132: AT | X132: LADDER | AA132: ROUND | AC132: 4
A133: AT 3.00 P.M. | S133: NORTH MELB
A134: PORT MELBOURNE | C134: 2 | D134: 4 | E134: =C133*6+D133 -> 16 | G134: 2 | H134: 6 | I134: =G133*6+H133 -> 18 | K134: 3 | L134: 9 | M134: =K133*6+L133 -> 27 | O134: 5 | P134: 12 | Q134: =O133*6+P133 -> 42 | S134: UMPIRE | W134: PORT MELBOURNE | X134: 4 | Y134: 0 | Z134: 0 | AA134: 143 | AB134: 90 | AC134: 158.88888888888889 | AD134: 16
A135: WEST MELBOURNE | C135: 0 | D135: 3 | E135: =C134*6+D134 -> 3 | G135: 2 | H135: 4 | I135: =G134*6+H134 -> 16 | K135: 2 | L135: 5 | M135: =K134*6+L134 -> 17 | O135: 2 | P135: 5 | Q135: =O134*6+P134 -> 17 | S135: STRANGER | W135: NORTH MELBOURNE | X135: 3 | Y135: 1 | Z135: 0 | AA135: 171 | AB135: 112 | AC135: 152.67857142857142 | AD135: 12
A136: BEST PLAYERS | W136: FOOTSCRAY | X136: 3 | Y136: 1 | Z136: 0 | AA136: 177 | AB136: 119 | AC136: 148.73949579831933 | AD136: 12
A137: PORT MELBOURNE | C137: HASSETT | F137: KNOX | I137: SHANNON | K137: PEARS | N137: POWELL | Q137: ROBERTSON | W137: WILLIAMSTOWN | X137: 2 | Y137: 2 | Z137: 0 | AA137: 132 | AB137: 98 | AC137: 134.69387755102042 | AD137: 8
A138: WEST MELBOURNE | C138: FERGUSON | F138: PAGE | I138: A .SNELL | K138: MACKEY | N138: FINN | Q138: BROWN
A139: GOALKICKERS | W139: RICHMOND | X139: 2 | Y139: 2 | Z139: 0 | AA139: 160 | AB139: 153 | AC139: 104.57516339869281 | AD139: 8
A140: PORT MELBOURNE | C140: SHANNON 2 | F140: NICKELL | I140: McGEE | K140: WAGLAND | W140: WEST MELBOURNE | X140: 1 | Y140: 3 | Z140: 0 | AA140: 205 | AB140: 167 | AC140: 122.75449101796407 | AD140: 4
A141: WEST MELBOURNE | C141: KENNEDY | F141: STONE | W141: PRAHRAN | X141: 1 | Y141: 3 | Z141: 0 | AA141: 156 | AB141: 204 | AC141: 76.470588235294116 | AD141: 4
A142: AT 10.30 A.M. | W142: BRUNSWICK | X142: 0 | Y142: 4 | Z142: 0 | AA142: 67 | AB142: 268 | AC142: 25 | AD142: 0
A143: RICHMOND | C143: 1 | D143: 1 | E143: =C142*6+D142 -> 7 | G143: 4 | H143: 4 | I143: =G142*6+H142 -> 28 | K143: 8 | L143: 5 | M143: =K345*6+L345 -> 0 | O143: 10 | P143: 10 | Q143: =O142*6+P142 -> 70 | S143: RICHMOND
A144: BRUNSWICK | C144: 1 | D144: 1 | E144: =C143*6+D143 -> 7 | G144: 1 | H144: 1 | I144: =G143*6+H143 -> 7 | K144: 1 | L144: 1 | M144: =O345*6+P345 -> 0 | O144: 1 | P144: 5 | Q144: =O143*6+P143 -> 11 | S144: POPE
A145: BEST PLAYERS
A146: RICHMOND | C146: CLARKE | F146: PARKER | I146: RUDD | K146: CARKEEK | N146: ELDER | Q146: McGUIRE
A147: BRUNSWICK | C147: MUDGE | F147: O'LOUGHLIN | I147: JOHNSON | K147: CASEY
A148: GOALKICKERS
A149: RICHMOND | C149: McGUIRE 2 | F149: CARKEEK 2 | I149: PARKER | K149: ELDER | M149: O'SHANNASSY | P149: CLARKE | S149: RUDD | U149: CURTAIN
A150: BRUNSWICK | C150: McKENZIE
A151: AT 10.30 A.M.
A152: FOOTSCRAY | C152: 1 | D152: 0 | E152: =C151*6+D151 -> 6 | G152: 3 | H152: 0 | I152: =G151*6+H151 -> 18 | K152: 4 | L152: 5 | M152: =K151*6+L151 -> 29 | O152: 4 | P152: 6 | Q152: =O151*6+P151 -> 30 | S152: FOOTSCRAY
A153: NORTH MELBOURNE | C153: 1 | D153: 0 | E153: =C152*6+D152 -> 6 | G153: 2 | H153: 2 | I153: =G152*6+H152 -> 14 | K153: 3 | L153: 2 | M153: =K152*6+L152 -> 20 | O153: 4 | P153: 2 | Q153: =O152*6+P152 -> 26 | S153: FREAME
A154: BEST PLAYERS
A155: FOOTSCRAY | C155: McCARTHY | F155: GRUNDEN | I155: MARMO | K155: MOLYNEUX | N155: DICKENS | Q155: DECOIT
A156: NORTH MELBOURNE | C156: H. LAUNDER | F156: E. LAUNDER | I156: McSWEENEY | L156: MONTGOMERIE | O156: QUILLIGAN | S156: NOONAN
A157: GOALKICKERS
A158: FOOTSCRAY | C158: ARMSTRONG | F158: HOUGHTON | I158: MITCHELL | K158: DALY
A159: NORTH MELBOURNE | C159: KNEE 3 | F159: RUTLEY
A160: AT 11.00 A.M.
A161: WILLIAMSTOWN | C161: 0 | D161: 5 | E161: =C160*6+D160 -> 5 | G161: 2 | H161: 8 | I161: =G160*6+H160 -> 20 | K161: 3 | L161: 10 | M161: =K160*6+L160 -> 28 | O161: 3 | P161: 16 | Q161: =O160*6+P160 -> 34 | S161: TOORAK PARK
A162: PRAHRAN | C162: 0 | D162: 0 | E162: =C161*6+D161 -> 0 | G162: 0 | H162: 0 | I162: =G161*6+H161 -> 0 | K162: 1 | L162: 3 | M162: =K161*6+L161 -> 9 | O162: 2 | P162: 3 | Q162: =O161*6+P161 -> 15 | S162: EMMERSON
A163: BEST PLAYERS
A164: WILLIAMSTOWN | C164: SPRINTALL | F164: R .HALL | I164: HEDLEY | K164: WORROLL | N164: McKINLEY | Q164: GUTHRIE
A165: PRAHRAN | C165: JOHNSTON | F165: GREENLAND | I165: DEANE | K165: WATKINS | N165: WESTBROOK | Q165: DENHOLM
A166: GOALKICKERS
A167: WILLIAMSTOWN | C167: McKINLEY | F167: BARTY | I167: WORROLL
A168: PRAHRAN | C168: M. ABRAHAMS 2
A170: ROUND 5 | E170: 27TH MAY | J170: WEATHER | O170: NORTH WIND RAIN | W170: TEAM | X170: W | Y170: L | Z170: D | AA170: FOR | AB170: AGST | AC170: % | AD170: PTS
D172: 1ST QTR | H172: 2ND QTR | L172: 3RD QTR | P172: FINAL | S172: AT | X172: LADDER | AA172: ROUND | AC172: 5
S173: BRUNSWICK
A174: PORT MELBOURNE | C174: 2 | D174: 0 | E174: =C174*6+D174 -> 12 | G174: 7 | H174: 2 | I174: =G174*6+H174 -> 44 | K174: 8 | L174: 4 | M174: =K174*6+L174 -> 52 | O174: 8 | P174: 4 | Q174: =O174*6+P174 -> 52 | S174: UMPIRE | W174: PORT MELBOURNE | X174: 5 | Y174: 0 | Z174: 0 | AA174: 195 | AB174: 117 | AC174: 166.66666666666666 | AD174: 20
A175: BRUNSWICK | C175: 0 | D175: 1 | E175: =C175*6+D175 -> 1 | G175: 1 | H175: 3 | I175: =G175*6+H175 -> 9 | K175: 1 | L175: 3 | M175: =K175*6+L175 -> 9 | O175: 3 | P175: 9 | Q175: =O175*6+P175 -> 27 | S175: DICK | W175: FOOTSCRAY | X175: 4 | Y175: 1 | Z175: 0 | AA175: 229 | AB175: 122 | AC175: 187.70491803278688 | AD175: 16
A176: BEST PLAYERS | W176: NORTH MELBOURNE | X176: 4 | Y176: 1 | Z176: 0 | AA176: 234 | AB176: 135 | AC176: 173.33333333333334 | AD176: 16
A177: PORT MELBOURNE | C177: KNOX | F177: McGEE | I177: HASSETT | K177: ROBERTSON | N177: PEARS | Q177: WARD | W177: RICHMOND | X177: 3 | Y177: 2 | Z177: 0 | AA177: 195 | AB177: 174 | AC177: 112.06896551724138 | AD177: 12
A178: BRUNSWICK | C178: TOUGH | F178: PARKER | I178: JOHNSON | K178: ROBINSON | N178: McKENZIE | Q178: MUDGE
A179: GOALKICKERS | W179: WILLIAMSTOWN | X179: 2 | Y179: 3 | Z179: 0 | AA179: 135 | AB179: 150 | AC179: 90 | AD179: 8
A180: PORT MELBOURNE | C180: WOODS 2 | F180: WARD 2 | H180: POWELL | J180: McGEE | L180: PEARS | N180: MARSHALL | W180: WEST MELBOURNE | X180: 1 | Y180: 4 | Z180: 0 | AA180: 226 | AB180: 202 | AC180: 111.88118811881188 | AD180: 4
A181: BRUNSWICK | C181: PARKER 2 | F181: MUDGE | W181: PRAHRAN | X181: 1 | Y181: 4 | Z181: 0 | AA181: 179 | AB181: 267 | AC181: 67.041198501872657 | AD181: 4
W182: BRUNSWICK | X182: 0 | Y182: 5 | Z182: 0 | AA182: 94 | AB182: 320 | AC182: 29.375 | AD182: 0
A183: FOOTSCRAY | C183: 1 | D183: 0 | E183: =C183*6+D183 -> 6 | G183: 4 | H183: 2 | I183: =G183*6+H183 -> 26 | K183: 6 | L183: 3 | M183: =K183*6+L183 -> 39 | O183: 8 | P183: 4 | Q183: =O183*6+P183 -> 52 | S183: FOOTSCRAY
A184: WILLIAMSTOWN | C184: 0 | D184: 1 | E184: =C184*6+D184 -> 1 | G184: 0 | H184: 1 | I184: =G184*6+H184 -> 1 | K184: 0 | L184: 1 | M184: =K184*6+L184 -> 1 | O184: 0 | P184: 3 | Q184: =O184*6+P184 -> 3 | S184: SCHAEFER
A185: BEST PLAYERS
A186: FOOTSCRAY | C186: DICKENS | F186: GRUNDEN | I186: HINCH | K186: MARMO | N186: McCARTHY | Q186: GREGORY
A187: WILLIAMSTOWN | C187: WORROLL | F187: HEDLEY | I187: R .HALL | K187: THOMPSON | N187: CALDWELL | Q187: RILEY
A188: GOALKICKERS
A189: FOOTSCRAY | C189: DECOIT 3 | F189: MITCHELL 2 | I189: CUNNINGHAM | L189: ARMSTRONG | O189: DREW
A190: WILLIAMSTOWN | C190: NIL
A192: NORTH MELBOURNE | C192: 3 | D192: 2 | E192: =C192*6+D192 -> 20 | G192: 5 | H192: 3 | I192: =G192*6+H192 -> 33 | K192: 7 | L192: 7 | M192: =K192*6+L192 -> 49 | O192: 9 | P192: 9 | Q192: =O192*6+P192 -> 63 | S192: NORTH MELB
A193: PRAHRAN | C193: 1 | D193: 1 | E193: =C193*6+D193 -> 7 | G193: 2 | H193: 5 | I193: =G193*6+H193 -> 17 | K193: 2 | L193: 5 | M193: =K193*6+L193 -> 17 | O193: 3 | P193: 5 | Q193: =O193*6+P193 -> 23 | S193: STRANGER
A194: BEST PLAYERS
A195: NORTH MELBOURNE | C195: GRAHAM | F195: SICILY | I195: H .LAUNDER | L195: McSWEENEY | O195: C .SMITH | R195: McDERMOTT
A196: PRAHRAN | C196: LYONS | F196: WATKINS | I196: DEANE | K196: LEVIEN | N196: JOHNSTON | Q196: WESTBROOKE
A197: GOALKICKERS
A198: NORTH MELBOURNE | C198: RUTLEY 3 | F198: KNEE 2 | I198: McCLUMPA 2 | L198: NOONAN | O198: GRAHAM
A199: PRAHRAN | C199: TAYLOR | F199: LYONS | I199: DOWNES
A201: RICHMOND | C201: 0 | D201: 1 | E201: =C201*6+D201 -> 1 | G201: 1 | H201: 5 | I201: =G201*6+H201 -> 11 | K201: 3 | L201: 10 | M201: =K201*6+L201 -> 28 | O201: 4 | P201: 11 | Q201: =O201*6+P201 -> 35 | S201: RICHMOND
A202: WEST MELBOURNE | C202: 0 | D202: 5 | E202: =C202*6+D202 -> 5 | G202: 0 | H202: 5 | I202: =G202*6+H202 -> 5 | K202: 1 | L202: 7 | M202: =K202*6+L202 -> 13 | O202: 2 | P202: 9 | Q202: =O202*6+P202 -> 21 | S202: MURPHY
A203: BEST PLAYERS
A204: RICHMOND | C204: T .WATSON | F204: PARKER | I204: RUDD | K204: T .WILLIAMS | N204: ELDER | Q204: C .BACKHOUSE
A205: WEST MELBOURNE | C205: FERGUSON | F205: McMURRAY | I205: STONE | K205: MORGAN | N205: SNELL | Q205: TWITCETT
A206: GOALKICKERS
A207: RICHMOND | C207: CARKEEK 2 | F207: McGUIRE 2
A208: WEST MELBOURNE | C208: STONE | F208: LAWSON
A210: ROUND 6 | E210: 3RD JUNE | J210: WEATHER | O210: NORTH WIND RAIN | W210: TEAM | X210: W | Y210: L | Z210: D | AA210: FOR | AB210: AGST | AC210: % | AD210: PTS
D212: 1ST QTR | H212: 2ND QTR | L212: 3RD QTR | P212: FINAL | S212: AT | X212: LADDER | AA212: ROUND | AC212: 6
S213: PORT MELB
A214: NORTH MELBOURNE | C214: 1 | D214: 1 | E214: =C214*6+D214 -> 7 | G214: 4 | H214: 3 | I214: =G214*6+H214 -> 27 | K214: 4 | L214: 4 | M214: =K214*6+L214 -> 28 | O214: 5 | P214: 6 | Q214: =O214*6+P214 -> 36 | S214: UMPIRE | W214: FOOTSCRAY | X214: 5 | Y214: 1 | Z214: 0 | AA214: 292 | AB214: 138 | AC214: 211.59420289855072 | AD214: 20
A215: PORT MELBOURNE | C215: 1 | D215: 3 | E215: =C215*6+D215 -> 9 | G215: 1 | H215: 4 | I215: =G215*6+H215 -> 10 | K215: 2 | L215: 6 | M215: =K215*6+L215 -> 18 | O215: 2 | P215: 6 | Q215: =O215*6+P215 -> 18 | S215: MURPHY | W215: NORTH MELBOURNE | X215: 5 | Y215: 1 | Z215: 0 | AA215: 270 | AB215: 153 | AC215: 176.47058823529412 | AD215: 20
A216: BEST PLAYERS | W216: PORT MELBOURNE | X216: 5 | Y216: 1 | Z216: 0 | AA216: 213 | AB216: 153 | AC216: 139.21568627450981 | AD216: 20
A217: NORTH MELBOURNE | C217: ROLENT | F217: SICILY | H217: H. LAUNDER | K217: E. LAUNDER | N217: KNEE | Q217: McCLUMPA | W217: WILLIAMSTOWN | X217: 3 | Y217: 3 | Z217: 0 | AA217: 189 | AB217: 174 | AC217: 108.62068965517241 | AD217: 12
A218: PORT MELBOURNE | C218: KNOX | F218: McGEE | H218: O'BRIEN | K218: JOHNSTON | N218: HASSETT | Q218: SHANNON
A219: GOALKICKERS | W219: RICHMOND | X219: 3 | Y219: 3 | Z219: 0 | AA219: 219 | AB219: 228 | AC219: 96.05263157894737 | AD219: 12
A220: NORTH MELBOURNE | C220: KNEE 3 | F220: McCLUMPA | I220: RUTLEY | W220: PRAHRAN | X220: 2 | Y220: 4 | Z220: 0 | AA220: 245 | AB220: 310 | AC220: 79.032258064516128 | AD220: 8
A221: PORT MELBOURNE | C221: SHANNON | F221: POWELL | W221: WEST MELBOURNE | X221: 1 | Y221: 5 | Z221: 0 | AA221: 242 | AB221: 265 | AC221: 91.320754716981128 | AD221: 4
W222: BRUNSWICK | X222: 0 | Y222: 6 | Z222: 0 | AA222: 137 | AB222: 386 | AC222: 35.49222797927461 | AD222: 0
A223: FOOTSCRAY | C223: 0 | D223: 2 | E223: =C223*6+D223 -> 2 | G223: 2 | H223: 7 | I223: =G223*6+H223 -> 19 | K223: 5 | L223: 8 | M223: =K223*6+L223 -> 38 | O223: 9 | P223: 9 | Q223: =O223*6+P223 -> 63 | S223: NORTH MELB
A224: WEST MELBOURNE | C224: 1 | D224: 0 | E224: =C224*6+D224 -> 6 | G224: 1 | H224: 3 | I224: =G224*6+H224 -> 9 | K224: 1 | L224: 4 | M224: =K224*6+L224 -> 10 | O224: 2 | P224: 4 | Q224: =O224*6+P224 -> 16 | S224: EMMERSON
A225: BEST PLAYERS
A226: FOOTSCRAY | C226: MARMO | F226: EASTON | I226: DECOIT | K226: ARMSTRONG | N226: BROCKWELL | Q226: DICKENS
A227: WEST MELBOURNE | C227: SNELL | F227: TWITCHETT | I227: MEAD | K227: McMURRAY | N227: KENNEDY
A228: GOALKICKERS
A229: FOOTSCRAY | C229: McCARTHY 3 | F229: DALY 2 | H229: CUNNINGHAM 2 | L229: MOLYNEUX | O229: MITCHELL
A230: WEST MELBOURNE | C230: ROBERTSON | F230: FITZELL
A232: WILLIAMSTOWN | C232: 1 | D232: 2 | E232: =C232*6+D232 -> 8 | G232: 5 | H232: 4 | I232: =G232*6+H232 -> 34 | K232: 6 | L232: 4 | M232: =K232*6+L232 -> 40 | O232: 8 | P232: 6 | Q232: =O232*6+P232 -> 54 | S232: W.TOWN
A233: RICHMOND | C233: 3 | D233: 1 | E233: =C233*6+D233 -> 19 | G233: 3 | H233: 1 | I233: =G233*6+H233 -> 19 | K233: 3 | L233: 4 | M233: =K233*6+L233 -> 22 | O233: 3 | P233: 6 | Q233: =O233*6+P233 -> 24 | S233: FREAME
A234: BEST PLAYERS
A235: WILLIAMSTOWN | C235: WORROLL | F235: R .HALL | I235: HEDLEY | L235: SHAW | N235: CALDWELL | Q235: RILEY
A236: RICHMOND | C236: T .WATSON | F236: CARKEEK | I236: D .WATSON | L236: GILES | N236: C .BACKHOUSE | Q236: RUDD
A237: GOALKICKERS
A238: WILLIAMSTOWN | C238: BOND 2 | F238: WARREN 2 | I238: WORROLL 2 | L238: THURGOOD | O238: R .HALL
A239: RICHMOND | C239: O'SHANNESSY 2 | G239: McGUIRE
A241: PRAHRAN | C241: 2 | D241: 2 | E241: =C241*6+D241 -> 14 | G241: 5 | H241: 4 | I241: =G241*6+H241 -> 34 | K241: 7 | L241: 6 | M241: =K241*6+L241 -> 48 | O241: 10 | P241: 6 | Q241: =O241*6+P241 -> 66 | S241: TOORAK PARK
A242: BRUNSWICK | C242: 2 | D242: 4 | E242: =C242*6+D242 -> 16 | G242: 2 | H242: 7 | I242: =G242*6+H242 -> 19 | K242: 3 | L242: 7 | M242: =K242*6+L242 -> 25 | O242: 5 | P242: 13 | Q242: =O242*6+P242 -> 43 | S242: SCHAEFER
A243: BEST PLAYERS
A244: PRAHRAN | C244: JOHNSTON | F244: LEVIEN | I244: WATKINS | K244: WEATHERLEY | O244: RUST | Q244: WESTBROOKE
A245: BRUNSWICK | C245: LANDELLS | F245: ROSS | I245: McKENZIE | K245: DELAHUNTY | O245: TOUGH | Q245: CASEY
A246: GOALKICKERS
A247: PRAHRAN | C247: LYONS 3 | F247: ABRAHAMS 2 | I247: MORTON 2 | L247: DEAN | N247: DENHOLM | Q247: TAYLOR
A248: BRUNSWICK | C248: LANDELLS 2 | F248: DELAHUNTY | I248: McKENZIE | K248: ROSS
A250: ROUND 7 | E250: 10TH JUNE | I250: WEATHER | M250: NORTH WIND GROUNDS HEAVY | W250: TEAM | X250: W | Y250: L | Z250: D | AA250: FOR | AB250: AGST | AC250: % | AD250: PTS
D252: 1ST QTR | H252: 2ND QTR | L252: 3RD QTR | P252: FINAL | S252: AT | X252: LADDER | AA252: ROUND | AC252: 7
S253: PORT MELB
A254: PORT MELBOURNE | C254: 3 | D254: 2 | E254: =C254*6+D254 -> 20 | G254: 4 | H254: 4 | I254: =G254*6+H254 -> 28 | K254: 5 | L254: 7 | M254: =K254*6+L254 -> 37 | O254: 8 | P254: 9 | Q254: =O254*6+P254 -> 57 | S254: UMPIRE | W254: FOOTSCRAY | X254: 6 | Y254: 1 | Z254: 0 | AA254: 334 | AB254: 156 | AC254: 214.10256410256412 | AD254: 24
A255: PRAHRAN | C255: 0 | D255: 0 | E255: =C255*6+D255 -> 0 | G255: 1 | H255: 4 | I255: =G255*6+H255 -> 10 | K255: 1 | L255: 5 | M255: =K255*6+L255 -> 11 | O255: 1 | P255: 8 | Q255: =O255*6+P255 -> 14 | S255: SCHAEFER | W255: NORTH MELBOURNE | X255: 6 | Y255: 1 | Z255: 0 | AA255: 350 | AB255: 169 | AC255: 207.10059171597632 | AD255: 24
A256: BEST PLAYERS | W256: PORT MELBOURNE | X256: 6 | Y256: 1 | Z256: 0 | AA256: 270 | AB256: 167 | AC256: 161.67664670658684 | AD256: 24
A257: PORT MELBOURNE | C257: KNOX | F257: McGEE | H257: A .JOHNSTON | K257: PEARS | N257: O'BRIEN | Q257: SHANNON | W257: WILLIAMSTOWN | X257: 4 | Y257: 3 | Z257: 0 | AA257: 218 | AB257: 187 | AC257: 116.57754010695187 | AD257: 16
A258: PRAHRAN | C258: LYONS | F258: BALL | H258: WESTBROOKE | K258: McINERNEY | N258: RUST | Q258: GREENLAND
A259: GOALKICKERS | W259: RICHMOND | X259: 3 | Y259: 4 | Z259: 0 | AA259: 237 | AB259: 270 | AC259: 87.777777777777771 | AD259: 12
A260: PORT MELBOURNE | C260: KNOX 3 | F260: ROBERTSON | I260: O'BRIEN | K260: PEARS | N260: SWANNIE | Q260: MONAGLE | W260: PRAHRAN | X260: 2 | Y260: 5 | Z260: 0 | AA260: 259 | AB260: 367 | AC260: 70.572207084468658 | AD260: 8
A261: PRAHRAN | C261: TAYLOR | W261: WEST MELBOURNE | X261: 1 | Y261: 6 | Z261: 0 | AA261: 255 | AB261: 294 | AC261: 86.734693877551024 | AD261: 4
W262: BRUNSWICK | X262: 0 | Y262: 7 | Z262: 0 | AA262: 153 | AB262: 466 | AC262: 32.832618025751074 | AD262: 0
A263: NORTH MELBOURNE | C263: 3 | D263: 7 | E263: =C263*6+D263 -> 25 | G263: 5 | H263: 9 | I263: =G263*6+H263 -> 39 | K263: 8 | L263: 11 | M263: =K263*6+L263 -> 59 | O263: 11 | P263: 14 | Q263: =O263*6+P263 -> 80 | S263: NORTH MELB
A264: BRUNSWICK | C264: 0 | D264: 0 | E264: =C264*6+D264 -> 0 | G264: 1 | H264: 2 | I264: =G264*6+H264 -> 8 | K264: 1 | L264: 2 | M264: =K264*6+L264 -> 8 | O264: 2 | P264: 4 | Q264: =O264*6+P264 -> 16 | S264: CUNNINGHAM
A265: BEST PLAYERS
A266: NORTH MELBOURNE | C266: SICILY | F266: GRAHAM | I266: H. LAUNDER | L266: LONDERIGAN | O266: SMITH | R266: McSWEENEY
A267: BRUNSWICK | C267: STRANGER | F267: JOHNSON | I267: TOUGH | L267: CASEY | O267: LANDELLS | R267: TUCKER
A268: GOALKICKERS
A269: NORTH MELBOURNE | C269: KNEE 3 | F269: KINMAN 3 | I269: RUTLEY | K269: SICILY | M269: LAUNDER | O269: GRAHAM | R269: McLEAN
A270: BRUNSWICK | C270: TUCKER | F270: LANDELLS
A272: FOOTSCRAY | C272: 0 | D272: 0 | E272: =C272*6+D272 -> 0 | G272: 3 | H272: 3 | I272: =G272*6+H272 -> 21 | K272: 5 | L272: 3 | M272: =K272*6+L272 -> 33 | O272: 6 | P272: 6 | Q272: =O272*6+P272 -> 42 | S272: FOOTSCRAY
A273: RICHMOND | C273: 0 | D273: 4 | E273: =C273*6+D273 -> 4 | G273: 0 | H273: 4 | I273: =G273*6+H273 -> 4 | K273: 0 | L273: 4 | M273: =K273*6+L273 -> 4 | O273: 2 | P273: 6 | Q273: =O273*6+P273 -> 18 | S273: BREMNER
A274: BEST PLAYERS
A275: FOOTSCRAY | C275: DECOIT | F275: MARMO | I275: ARMSTRONG | L275: HARRIS | N275: DALY | Q275: MOLYNEUX
A276: RICHMOND | C276: TAYLOR | F276: T .WATSON | I276: RUDD | K276: D .WATSON | N276: PARKER | Q276: CARKEEK
A277: GOALKICKERS
A278: FOOTSCRAY | C278: DALY 3 | F278: MITCHELL 2 | I278: DREW
A279: RICHMOND | C279: RUDD | F279: T .WILLIAMS
A281: WILLIAMSTOWN | C281: 0 | D281: 2 | E281: =C281*6+D281 -> 2 | G281: 1 | H281: 2 | I281: =G281*6+H281 -> 8 | K281: 1 | L281: 4 | M281: =K281*6+L281 -> 10 | O281: 4 | P281: 5 | Q281: =O281*6+P281 -> 29 | S281: WILLIAMSTOWN
A282: WEST MELBOURNE | C282: 1 | D282: 2 | E282: =C282*6+D282 -> 8 | G282: 1 | H282: 6 | I282: =G282*6+H282 -> 12 | K282: 1 | L282: 6 | M282: =K282*6+L282 -> 12 | O282: 1 | P282: 7 | Q282: =O282*6+P282 -> 13 | S282: FREAME
A283: BEST PLAYERS
A284: WILLIAMSTOWN | C284: THOMPSON | F284: CALDWELL | I284: WARREN | K284: HEDLEY | N284: R .HALL | Q284: W .HALL
A285: WEST MELBOURNE | C285: FERGUSON | F285: PAGE | I285: McMURRAY | L285: STONE | N285: STEVENSON | Q285: A .J. SNELL
A286: GOALKICKERS
A287: WILLIAMSTOWN | C287: E .HALL 2 | F287: R.HALL | I287: THURGOOD
A288: WEST MELBOURNE | C288: STONE
A290: ROUND 8 | E290: 17TH JUNE | J290: WEATHER | O290: FINE GROUNDS GOOD | W290: TEAM | X290: W | Y290: L | Z290: D | AA290: FOR | AB290: AGST | AC290: % | AD290: PTS
D292: 1ST QTR | H292: 2ND QTR | L292: 3RD QTR | P292: FINAL | X292: LADDER | AA292: ROUND | AC292: 8
S293: AT
A294: FOOTSCRAY | C294: 2 | D294: 7 | E294: =C294*6+D294 -> 19 | G294: 3 | H294: 9 | I294: =G294*6+H294 -> 27 | K294: 3 | L294: 14 | M294: =K294*6+L294 -> 32 | O294: 4 | P294: 18 | Q294: =O294*6+P294 -> 42 | S294: FOOTSCRAY | W294: FOOTSCRAY | X294: 7 | Y294: 1 | Z294: 0 | AA294: 376 | AB294: 165 | AC294: 227.87878787878788 | AD294: 28
A295: PORT MELBOURNE | C295: 1 | D295: 0 | E295: =C295*6+D295 -> 6 | G295: 1 | H295: 1 | I295: =G295*6+H295 -> 7 | K295: 1 | L295: 1 | M295: =K295*6+L295 -> 7 | O295: 1 | P295: 3 | Q295: =O295*6+P295 -> 9 | S295: UMPIRE | W295: NORTH MELBOURNE | X295: 7 | Y295: 1 | Z295: 0 | AA295: 384 | AB295: 193 | AC295: 198.96373056994818 | AD295: 28
A296: BEST PLAYERS | S296: BREMNER | W296: PORT MELBOURNE | X296: 6 | Y296: 2 | Z296: 0 | AA296: 279 | AB296: 209 | AC296: 133.49282296650719 | AD296: 24
A297: FOOTSCRAY | C297: DICKENS | F297: GRUNDEN | I297: McCARTHY | L297: DREW | N297: MITCHELL | Q297: KRUSE | W297: WILLIAMSTOWN | X297: 4 | Y297: 4 | Z297: 0 | AA297: 242 | AB297: 221 | AC297: 109.50226244343891 | AD297: 16
A298: PORT MELBOURNE | C298: HASSETT | F298: ROBERTSON | I298: WARD | K298: A .JOHNSTON | N298: SWANNIE | Q298: POLLACK
A299: GOALKICKERS | W299: RICHMOND | X299: 4 | Y299: 4 | Z299: 0 | AA299: 264 | AB299: 295 | AC299: 89.491525423728817 | AD299: 16
A300: FOOTSCRAY | C300: MITCHELL 2 | G300: DREW | I300: MOLYNEUX | W300: WEST MELBOURNE | X300: 2 | Y300: 6 | Z300: 0 | AA300: 298 | AB300: 323 | AC300: 92.260061919504651 | AD300: 8
A301: PORT MELBOURNE | C301: PEARS | W301: PRAHRAN | X301: 2 | Y301: 6 | Z301: 0 | AA301: 284 | AB301: 394 | AC301: 72.081218274111677 | AD301: 8
W302: BRUNSWICK | X302: 0 | Y302: 8 | Z302: 0 | AA302: 182 | AB302: 509 | AC302: 35.756385068762278 | AD302: 0
A303: NORTH MELBOURNE | C303: 3 | D303: 0 | E303: =C303*6+D303 -> 18 | G303: 3 | H303: 2 | I303: =G303*6+H303 -> 20 | K303: 3 | L303: 8 | M303: =K303*6+L303 -> 26 | O303: 4 | P303: 10 | Q303: =O303*6+P303 -> 34 | S303: WILLIAMSTOWN
A304: WILLIAMSTOWN | C304: 1 | D304: 2 | E304: =C304*6+D304 -> 8 | G304: 3 | H304: 3 | I304: =G304*6+H304 -> 21 | K304: 3 | L304: 5 | M304: =K304*6+L304 -> 23 | O304: 3 | P304: 6 | Q304: =O304*6+P304 -> 24 | S304: SCHAEFER
A305: BEST PLAYERS
A306: NORTH MELBOURNE | C306: McSWEENEY | F306: P .SMITH | I306: McDERMOTT | L306: QUILLIGAN | O306: LONDERIGAN | R306: GRAHAM
A307: WILLIAMSTOWN | C307: WORRALL | F307: WARREN | I307: R .HALL | K307: KENNERSON | N307: W .HALL | Q307: McKINLEY
A308: GOALKICKERS
A309: NORTH MELBOURNE | C309: NOONAN 2 | F309: KNEE | I309: SICILY
A310: WILLIAMSTOWN | C310: GUTHRIE | F310: WARREN | I310: BARTY
A312: RICHMOND | C312: 0 | D312: 2 | E312: =C312*6+D312 -> 2 | G312: 0 | H312: 7 | I312: =G312*6+H312 -> 7 | K312: 1 | L312: 9 | M312: =K312*6+L312 -> 15 | O312: 2 | P312: 15 | Q312: =O312*6+P312 -> 27 | S312: RICHMOND
A313: PRAHRAN | C313: 0 | D313: 1 | E313: =C313*6+D313 -> 1 | G313: 1 | H313: 2 | I313: =G313*6+H313 -> 8 | K313: 3 | L313: 6 | M313: =K313*6+L313 -> 24 | O313: 3 | P313: 7 | Q313: =O313*6+P313 -> 25 | S313: FREAME
A314: BEST PLAYERS
A315: RICHMOND | C315: PARKER | F315: RUDD | I315: CURTAIN | K315: D. WATSON | N315: McGUIRE | Q315: T .WATSON
A316: PRAHRAN | C316: LYONS | F316: JOHNSON | I316: WEATHERLEY | L316: BALL | N316: McINERNEY | Q316: ABRAHAMS
A317: GOALKICKERS
A318: RICHMOND | C318: McGUIRE | F318: PRICE
A319: PRAHRAN | C319: MORTON | F319: ABRAHAMS | I319: GREENLANDS
A321: WEST MELBOURNE | C321: 0 | D321: 4 | E321: =C321*6+D321 -> 4 | G321: 2 | H321: 5 | I321: =G321*6+H321 -> 17 | K321: 4 | L321: 6 | M321: =K321*6+L321 -> 30 | O321: 6 | P321: 7 | Q321: =O321*6+P321 -> 43 | S321: NORTH MELB
A322: BRUNSWICK | C322: 0 | D322: 3 | E322: =C322*6+D322 -> 3 | G322: 1 | H322: 4 | I322: =G322*6+H322 -> 10 | K322: 3 | L322: 5 | M322: =K322*6+L322 -> 23 | O322: 4 | P322: 5 | Q322: =O322*6+P322 -> 29 | S322: DICK
A323: BEST PLAYERS
A324: WEST MELBOURNE | C324: FERGUSON | F324: MACKEY | H324: A .SNELL | K324: TWITCHETT | N324: PULLAR | Q324: PAGE
A325: BRUNSWICK | C325: PARKER | F325: ROSS | H325: JOHNSTON | K325: STRANGER | N325: CLEMENS | Q325: LANDELLS
A326: GOALKICKERS
A327: WEST MELBOURNE | C327: FITZELL 2 | F327: STONE | H327: A .SNELL | K327: STEVENSON | N327: McMURRAY
A328: BRUNSWICK | C328: LANDELLS 3 | F328: McKENZIE
A330: ROUND 9 | E330: 24TH JUNE | I330: WEATHER | M330: NORTH WEST WIND SHOWERS | W330: TEAM | X330: W | Y330: L | Z330: D | AA330: FOR | AB330: AGST | AC330: % | AD330: PTS
D332: 1ST QTR | H332: 2ND QTR | L332: 3RD QTR | P332: FINAL | S332: AT | X332: LADDER | AA332: ROUND | AC332: 9
S333: PORT MELB
A334: PORT MELBOURNE | C334: 1 | D334: 8 | E334: =C334*6+D334 -> 14 | G334: 2 | H334: 12 | I334: =G334*6+H334 -> 24 | K334: 4 | L334: 15 | M334: =K334*6+L334 -> 39 | O334: 8 | P334: 18 | Q334: =O334*6+P334 -> 66 | S334: UMPIRE | W334: FOOTSCRAY | X334: 8 | Y334: 1 | Z334: 0 | AA334: 431 | AB334: 179 | AC334: 240.78212290502793 | AD334: 32
A335: RICHMOND | C335: 1 | D335: 1 | E335: =C335*6+D335 -> 7 | G335: 1 | H335: 1 | I335: =G335*6+H335 -> 7 | K335: 2 | L335: 2 | M335: =K335*6+L335 -> 14 | O335: 3 | P335: 7 | Q335: =O335*6+P335 -> 25 | S335: STRANGER | W335: NORTH MELBOURNE | X335: 8 | Y335: 1 | Z335: 0 | AA335: 446 | AB335: 220 | AC335: 202.72727272727272 | AD335: 32
A336: BEST PLAYERS | W336: PORT MELBOURNE | X336: 7 | Y336: 2 | Z336: 0 | AA336: 345 | AB336: 234 | AC336: 147.43589743589743 | AD336: 28
A337: PORT MELBOURNE | C337: POWELL | F337: SWANNIE | I337: O'BRIEN | K337: KNOX | N337: McGEE | Q337: RYAN | W337: WILLIAMSTOWN | X337: 4 | Y337: 5 | Z337: 0 | AA337: 287 | AB337: 277 | AC337: 103.61010830324909 | AD337: 16
A338: RICHMOND | C338: TAYLOR | F338: PARKER | I338: CARKEEK | K338: BACKHOUSE | N338: RUDD | Q338: D. WATSON
A339: GOALKICKERS | W339: RICHMOND | X339: 4 | Y339: 5 | Z339: 0 | AA339: 289 | AB339: 361 | AC339: 80.05540166204986 | AD339: 16
A340: PORT MELBOURNE | C340: POWELL 2 | F340: WOODS 2 | I340: HASSETT | K340: LEFEVRE | N340: G .JOHNSTON | Q340: SWANNIE | W340: WEST MELBOURNE | X340: 2 | Y340: 7 | Z340: 0 | AA340: 325 | AB340: 385 | AC340: 84.415584415584419 | AD340: 8
A341: RICHMOND | C341: C .BACKHOUSE 2 | G341: PARKER | W341: PRAHRAN | X341: 2 | Y341: 7 | Z341: 0 | AA341: 298 | AB341: 449 | AC341: 66.369710467706014 | AD341: 8
W342: BRUNSWICK | X342: 1 | Y342: 8 | Z342: 0 | AA342: 238 | AB342: 554 | AC342: 42.960288808664259 | AD342: 4
A343: BRUNSWICK | C343: 4 | D343: 5 | E343: =C343*6+D343 -> 29 | G343: 5 | H343: 5 | I343: =G343*6+H343 -> 35 | K343: 8 | L343: 8 | M343: =K343*6+L343 -> 56 | O343: 8 | P343: 8 | Q343: =O343*6+P343 -> 56 | S343: BRUNSWICK
A344: WILLIAMSTOWN | C344: 0 | D344: 0 | E344: =C344*6+D344 -> 0 | G344: 4 | H344: 1 | I344: =G344*6+H344 -> 25 | K344: 5 | L344: 1 | M344: =K344*6+L344 -> 31 | O344: 7 | P344: 3 | Q344: =O344*6+P344 -> 45 | S344: FREAME
A345: BEST PLAYERS
A346: BRUNSWICK | C346: TOUGH | F346: STRANGER | I346: CASEY | K346: LANDELLS | N346: O'LOUGHLIN | Q346: JOHNSTON
A347: WILLIAMSTOWN | C347: WORROLL | F347: BARTY | I347: WARREN | K347: KENNISON | N347: BARNES | Q347: McKINLEY
A348: GOALKICKERS
A349: BRUNSWICK | C349: LANDELLS 4 | G349: JOHNSTON | J349: McKENZIE | M349: ROBERTSON | P349: O'LOUGHLIN
A350: WILLIAMSTOWN | C350: BARTY 2 | F350: THURGOOD | I350: BOND | K350: WORROLL | N350: THOMPSON | Q350: HARDING
A352: FOOTSCRAY | C352: 2 | D352: 4 | E352: =C352*6+D352 -> 16 | G352: 5 | H352: 5 | I352: =G352*6+H352 -> 35 | K352: 5 | L352: 16 | M352: =K352*6+L352 -> 46 | O352: 6 | P352: 19 | Q352: =O352*6+P352 -> 55 | S352: TOORAK PARK
A353: PRAHRAN | C353: 0 | D353: 0 | E353: =C353*6+D353 -> 0 | G353: 0 | H353: 1 | I353: =G353*6+H353 -> 1 | K353: 0 | L353: 1 | M353: =K353*6+L353 -> 1 | O353: 2 | P353: 2 | Q353: =O353*6+P353 -> 14 | S353: SCHAEFER
A354: BEST PLAYERS
A355: FOOTSCRAY | C355: DALY | F355: BROCKWELL | I355: GRUNDEN | K355: DICKENS | N355: DECOIT | Q355: MITCHELL
A356: PRAHRAN | C356: LYONS | F356: McINERNEY | I356: RUST | K356: JOHNSTON | N356: WESTBROOKE | Q356: DOWNES
A357: GOALKICKERS
A358: FOOTSCRAY | C358: DALY 3 | F358: A .MITCHELL 2 | J358: KRUSE
A359: PRAHRAN | C359: RUST | F359: A .JOHNSTON
A361: NORTH MELBOURNE | C361: 2 | D361: 3 | E361: =C361*6+D361 -> 15 | G361: 2 | H361: 3 | I361: =G361*6+H361 -> 15 | K361: 7 | L361: 6 | M361: =K361*6+L361 -> 48 | O361: 9 | P361: 8 | Q361: =O361*6+P361 -> 62 | S361: NORTH MELB
A362: WEST MELBOURNE | C362: 0 | D362: 1 | E362: =C362*6+D362 -> 1 | G362: 2 | H362: 2 | I362: =G362*6+H362 -> 14 | K362: 2 | L362: 2 | M362: =K362*6+L362 -> 14 | O362: 4 | P362: 3 | Q362: =O362*6+P362 -> 27 | S362: BREMNER
A363: BEST PLAYERS
A364: NORTH MELBOURNE | C364: SMITH | F364: CARLTON | I364: LONDERIGAN | L364: RUTLEY | O364: H .LAUNDER | R364: SICILY
A365: WEST MELBOURNE | C365: PAGE | F365: HOWARD | I365: FERGUSON | L365: MEAGHAN | O365: PULLAR | R365: STONE
A366: GOALKICKERS
A367: NORTH MELBOURNE | C367: KNEE 3 | F367: RUTLEY 2 | I367: McCLUMPA | L367: GRAHAM | O367: H .LAUNDER | R367: SICILY
A368: WEST MELBOURNE | C368: McMURRAY | F368: STONE | I368: STEVENSON | L368: HOCKING
A370: ROUND 10 | E370: 1ST JULY | I370: WEATHER | M370: RAIN GROUNDS HEAVY | W370: TEAM | X370: W | Y370: L | Z370: D | AA370: FOR | AB370: AGST | AC370: % | AD370: PTS
D372: 1ST QTR | H372: 2ND QTR | L372: 3RD QTR | P372: FINAL | S372: AT | X372: LADDER | AA372: ROUND | AC372: 10
S373: WILLIAMSTOWN
A374: WILLIAMSTOWN | C374: 0 | D374: 0 | E374: =C374*6+D374 -> 0 | G374: 4 | H374: 2 | I374: =G374*6+H374 -> 26 | K374: 4 | L374: 2 | M374: =K374*6+L374 -> 26 | O374: 4 | P374: 7 | Q374: =O374*6+P374 -> 31 | S374: UMPIRE | W374: FOOTSCRAY | X374: 9 | Y374: 1 | Z374: 0 | AA374: 454 | AB374: 180 | AC374: 252.22222222222223 | AD374: 36
A375: PORT MELBOURNE | C375: 0 | D375: 3 | E375: =C375*6+D375 -> 3 | G375: 0 | H375: 3 | I375: =G375*6+H375 -> 3 | K375: 0 | L375: 5 | M375: =K375*6+L375 -> 5 | O375: 0 | P375: 5 | Q375: =O375*6+P375 -> 5 | S375: STRANGER | W375: NORTH MELBOURNE | X375: 9 | Y375: 1 | Z375: 0 | AA375: 470 | AB375: 237 | AC375: 198.31223628691984 | AD375: 36
A376: BEST PLAYERS | W376: PORT MELBOURNE | X376: 7 | Y376: 3 | Z376: 0 | AA376: 350 | AB376: 265 | AC376: 132.0754716981132 | AD376: 28
A377: WILLIAMSTOWN | C377: WORROLL | F377: WARREN | I377: CALDWELL | L377: MCKINLEY | O377: W .HALL | R377: BOND | W377: WILLIAMSTOWN | X377: 5 | Y377: 5 | Z377: 0 | AA377: 318 | AB377: 282 | AC377: 112.76595744680851 | AD377: 20
A378: PORT MELBOURNE | C378: SWANNIE | F378: NICKELL | I378: A .JOHNSTON | L378: KNOX | O378: MCGEE | R378: POWELL
A379: GOALKICKERS | W379: RICHMOND | X379: 4 | Y379: 6 | Z379: 0 | AA379: 306 | AB379: 385 | AC379: 79.480519480519476 | AD379: 16
A380: WILLIAMSTOWN | C380: WORROLL | F380: BARTY | I380: BOND | K380: THOMPSON | W380: WEST MELBOURNE | X380: 3 | Y380: 7 | Z380: 0 | AA380: 370 | AB380: 394 | AC380: 93.90862944162437 | AD380: 12
A381: PORT MELBOURNE | C381: NIL | W381: PRAHRAN | X381: 2 | Y381: 8 | Z381: 0 | AA381: 307 | AB381: 494 | AC381: 62.145748987854248 | AD381: 8
W382: BRUNSWICK | X382: 1 | Y382: 9 | Z382: 0 | AA382: 239 | AB382: 577 | AC382: 41.421143847487002 | AD382: 4
A383: NORTH MELBOURNE | C383: 1 | D383: 1 | E383: =C383*6+D383 -> 7 | G383: 2 | H383: 5 | I383: =G383*6+H383 -> 17 | K383: 2 | L383: 5 | M383: =K383*6+L383 -> 17 | O383: 3 | P383: 6 | Q383: =O383*6+P383 -> 24 | S383: RICHMOND
A384: RICHMOND | C384: 0 | D384: 2 | E384: =C384*6+D384 -> 2 | G384: 1 | H384: 4 | I384: =G384*6+H384 -> 10 | K384: 1 | L384: 4 | M384: =K384*6+L384 -> 10 | O384: 2 | P384: 5 | Q384: =O384*6+P384 -> 17 | S384: BREMNER
A385: BEST PLAYERS
A386: NORTH MELBOURNE | C386: SICILY | F386: NOONAN | I386: McSWEENEY | L386: MONTGOMERIE | P386: LONDERIGAN | T386: KINMAN
A387: RICHMOND | C387: T .WATSON | F387: D .WATSON | I387: PARKER | K387: CARKEEK | N387: HARDIMAN | Q387: TAYLOR
A388: GOALKICKERS
A389: NORTH MELBOURNE | C389: McLEAN | F389: KINMAN | I389: RUTLEY
A390: RICHMOND | C390: MILNE | F390: CARKEEK
A392: WEST MELBOURNE | C392: 2 | D392: 2 | E392: =C392*6+D392 -> 14 | G392: 4 | H392: 6 | I392: =G392*6+H392 -> 30 | K392: 6 | L392: 9 | M392: =K392*6+L392 -> 45 | O392: 6 | P392: 9 | Q392: =O392*6+P392 -> 45 | S392: NORTH MELB
A393: PRAHRAN | C393: 0 | D393: 0 | E393: =C393*6+D393 -> 0 | G393: 0 | H393: 0 | I393: =G393*6+H393 -> 0 | K393: 0 | L393: 1 | M393: =K393*6+L393 -> 1 | O393: 1 | P393: 3 | Q393: =O393*6+P393 -> 9 | S393: SCHAEFER
A394: BEST PLAYERS
A395: WEST MELBOURNE | C395: STEVENSON | F395: FERGUSON | I395: HONEY | K395: MEAGHAN | N395: STONE | Q395: McMURRAY
A396: PRAHRAN | C396: JOHNSON | F396: LEVIEN | I396: RUST | K396: BALL | N396: LYONS | Q396: McINERNEY
A397: GOALKICKERS
A398: WEST MELBOURNE | C398: HOCKING 2 | F398: STEVENSON | I398: FITZELL | K398: TWITCHETT | N398: MORGAN
A399: PRAHRAN | C399: GREENLANDS
A401: FOOTSCRAY | C401: 2 | D401: 0 | E401: =C401*6+D401 -> 12 | G401: 3 | H401: 5 | I401: =G401*6+H401 -> 23 | M401: =AA439*6+AB439 -> 0 | O401: 3 | P401: 5 | Q401: =O401*6+P401 -> 23 | S401: FOOTSCRAY
A402: BRUNSWICK | C402: 0 | D402: 1 | E402: =C402*6+D402 -> 1 | G402: 0 | H402: 1 | I402: =G402*6+H402 -> 1 | M402: =AE306*6+AF306 -> 0 | O402: 0 | P402: 1 | Q402: =O402*6+P402 -> 1 | S402: FREAME
A403: BEST PLAYERS
A404: FOOTSCRAY | C404: MARMO | F404: WILLIAMS | I404: GRUNDEN | L404: DREW | N404: KRUSE | Q404: McCARTHY
A405: BRUNSWICK | C405: JOHNSON | F405: LANDELLS | I405: STRANGER | L405: ROSS | N405: T .O'LOUGHLIN
A406: GOALKICKERS
A407: FOOTSCRAY | C407: KRUSE | F407: McCARTHY | I407: A.MITCHELL
A408: BRUNSWICK | C408: NIL
A409: BRUNSWICK THINKING THEIR CASE WAS HOPELESS RETIRED FROM THE GAME AT 1/2 TIME
A412: ROUND 11 | E412: 8TH JULY | I412: WEATHER | M412: SOUTH WEST WIND RAIN | W412: TEAM | X412: W | Y412: L | Z412: D | AA412: FOR | AB412: AGST | AC412: % | AD412: PTS
D414: 1ST QTR | H414: 2ND QTR | L414: 3RD QTR | P414: FINAL | S414: AT | X414: LADDER | AA414: ROUND | AC414: 11
S415: PORT MELB
A416: PORT MELBOURNE | C416: 0 | D416: 1 | E416: =C416*6+D416 -> 1 | G416: 1 | H416: 5 | I416: =G416*6+H416 -> 11 | K416: 2 | L416: 7 | M416: =K416*6+L416 -> 19 | O416: 4 | P416: 8 | Q416: =O416*6+P416 -> 32 | S416: UMPIRE | W416: FOOTSCRAY | X416: 10 | Y416: 1 | Z416: 0 | AA416: 493 | AB416: 214 | AC416: 230.37383177570092 | AD416: 40
A417: WEST MELBOURNE | C417: 3 | D417: 4 | E417: =C417*6+D417 -> 22 | G417: 3 | H417: 6 | I417: =G417*6+H417 -> 24 | K417: 4 | L417: 7 | M417: =K417*6+L417 -> 31 | O417: 4 | P417: 7 | Q417: =O417*6+P417 -> 31 | S417: EMMERSON | W417: NORTH MELBOURNE | X417: 9 | Y417: 2 | Z417: 0 | AA417: 504 | AB417: 276 | AC417: 182.60869565217391 | AD417: 36
A418: BEST PLAYERS | W418: PORT MELBOURNE | X418: 8 | Y418: 3 | Z418: 0 | AA418: 382 | AB418: 296 | AC418: 129.05405405405406 | AD418: 32
A419: PORT MELBOURNE | C419: G. JOHNSTON | F419: SWANNIE | I419: O'BRIEN | K419: POLLACK | N419: HICKEY | W419: WILLIAMSTOWN | X419: 6 | Y419: 5 | Z419: 0 | AA419: 347 | AB419: 291 | AC419: 119.24398625429554 | AD419: 24
A420: WEST MELBOURNE | C420: PAGE | F420: MANSON | H420: LIVINGSTONE | K420: McMURRAY | N420: FERGUSON
A421: GOALKICKERS | W421: RICHMOND | X421: 5 | Y421: 6 | Z421: 0 | AA421: 335 | AB421: 408 | AC421: 82.107843137254903 | AD421: 20
A422: PORT MELBOURNE | C422: POWELL | F422: RYAN | I422: McGEE | K422: KNOX | W422: WEST MELBOURNE | X422: 3 | Y422: 8 | Z422: 0 | AA422: 401 | AB422: 426 | AC422: 94.131455399061039 | AD422: 12
A423: WEST MELBOURNE | C423: PULLAR | F423: STONE | I423: A .SNELL | K423: HOCKING | W423: PRAHRAN | X423: 2 | Y423: 9 | Z423: 0 | AA423: 316 | AB423: 523 | AC423: 60.420650095602298 | AD423: 8
W424: BRUNSWICK | X424: 1 | Y424: 10 | Z424: 0 | AA424: 262 | AB424: 606 | AC424: 43.234323432343231 | AD424: 4
A425: FOOTSCRAY | C425: 0 | D425: 3 | E425: =C425*6+D425 -> 3 | G425: 5 | H425: 7 | I425: =G425*6+H425 -> 37 | K425: 5 | L425: 7 | M425: =K425*6+L425 -> 37 | O425: 5 | P425: 9 | Q425: =O425*6+P425 -> 39 | S425: NORTH MELB
A426: NORTH MELBOURNE | C426: 2 | D426: 1 | E426: =C426*6+D426 -> 13 | G426: 2 | H426: 1 | I426: =G426*6+H426 -> 13 | K426: 4 | L426: 3 | M426: =K426*6+L426 -> 27 | O426: 5 | P426: 4 | Q426: =O426*6+P426 -> 34 | S426: BREMNER
A427: BEST PLAYERS
A428: FOOTSCRAY | C428: MARMO | F428: DREW | I428: ARMSTRONG | L428: McCARTHY | O428: MOLYNEUX | R428: DALY
A429: NORTH MELBOURNE | C429: H .LAUNDER | F429: SICILY | I429: E. LAUNDER | L429: McDERMOTT | O429: QUILLIGAN | R429: NOONAN
A430: GOALKICKERS
A431: FOOTSCRAY | C431: DREW 2 | F431: DECOIT | I431: DALY | K431: ROBERTSON
A432: NORTH MELBOURNE | C432: KNEE | F432: McLEAN | I432: RUTLEY | K432: NOONAN | N432: LONDERIGAN
A434: WILLIAMSTOWN | C434: 4 | D434: 3 | E434: =C434*6+D434 -> 27 | G434: 4 | H434: 4 | I434: =G434*6+H434 -> 28 | K434: 4 | L434: 4 | M434: =K434*6+L434 -> 28 | O434: 4 | P434: 5 | Q434: =O434*6+P434 -> 29 | S434: W.TOWN
A435: PRAHRAN | C435: 0 | D435: 0 | E435: =C435*6+D435 -> 0 | G435: 1 | H435: 1 | I435: =G435*6+H435 -> 7 | K435: 1 | L435: 1 | M435: =K435*6+L435 -> 7 | O435: 1 | P435: 3 | Q435: =O435*6+P435 -> 9 | S435: STRANGER
A436: BEST PLAYERS
A437: WILLIAMSTOWN | C437: BARTY | F437: WORROLL | I437: McKINLEY | L437: BOND | N437: G .HALL | Q437: BARNES
A438: PRAHRAN | C438: McINERNEY | F438: LEVIEN | I438: WESTBROOKE | L438: RUST | N438: MORTON | Q438: DOWNES
A439: GOALKICKERS
A440: WILLIAMSTOWN | C440: BOND 2 | F440: WARREN | I440: BARNES
A441: PRAHRAN | C441: DOWNES
A443: RICHMOND | C443: 2 | D443: 2 | E443: =C443*6+D443 -> 14 | G443: 3 | H443: 4 | I443: =G443*6+H443 -> 22 | K443: 4 | L443: 4 | M443: =K443*6+L443 -> 28 | O443: 4 | P443: 5 | Q443: =O443*6+P443 -> 29 | S443: BRUNSWICK
A444: BRUNSWICK | C444: 0 | D444: 1 | E444: =C444*6+D444 -> 1 | G444: 2 | H444: 2 | I444: =G444*6+H444 -> 14 | K444: 2 | L444: 4 | M444: =K444*6+L444 -> 16 | O444: 3 | P444: 5 | Q444: =O444*6+P444 -> 23 | S444: FREAME
A445: BEST PLAYERS
A446: RICHMOND | C446: PARKER | F446: T .WATSON | I446: C. TAYLOR | L446: MILNE | N446: O'SHANNASSY | R446: BACKHOUSE
A447: BRUNSWICK | C447: CASEY | F447: O'LOUGHLIN | I447: ROBERTSON | L447: McKENZIE | O447: LANDELLS | R447: ROSS
A448: GOALKICKERS
A449: RICHMOND | C449: MILNE 3 | F449: PARKER
A450: BRUNSWICK | C450: McKENZIE | F450: STRANGER | I450: LANDELLS
A453: ROUND 12 | E453: 15TH JULY | K453: WEATHER | Q453: FINE | W453: TEAM | X453: W | Y453: L | Z453: D | AA453: FOR | AB453: AGST | AC453: % | AD453: PTS
D455: 1ST QTR | H455: 2ND QTR | L455: 3RD QTR | P455: FINAL | S455: AT | X455: LADDER | AA455: ROUND | AC455: 12
S456: PORT MELB
A457: PORT MELBOURNE | C457: 3 | D457: 3 | E457: =C457*6+D457 -> 21 | G457: 7 | H457: 3 | I457: =G457*6+H457 -> 45 | K457: 13 | L457: 8 | M457: =K457*6+L457 -> 86 | O457: 17 | P457: 12 | Q457: =O457*6+P457 -> 114 | S457: UMPIRE | W457: FOOTSCRAY | X457: 10 | Y457: 2 | Z457: 0 | AA457: 517 | AB457: 241 | AC457: 214.52282157676348 | AD457: 40
A458: BRUNSWICK | C458: 0 | D458: 0 | E458: =C458*6+D458 -> 0 | G458: 3 | H458: 2 | I458: =G458*6+H458 -> 20 | K458: 3 | L458: 5 | M458: =K458*6+L458 -> 23 | O458: 4 | P458: 7 | Q458: =O458*6+P458 -> 31 | S458: SCHAEFER | W458: NORTH MELBOURNE | X458: 10 | Y458: 2 | Z458: 0 | AA458: 552 | AB458: 321 | AC458: 171.96261682242991 | AD458: 40
A459: BEST PLAYERS | W459: PORT MELBOURNE | X459: 9 | Y459: 3 | Z459: 0 | AA459: 496 | AB459: 327 | AC459: 151.68195718654434 | AD459: 36
A460: PORT MELBOURNE | C460: KNOX | F460: POWELL | H460: A .JOHNSTON | K460: G. JOHNSTON | N460: BLAIR | P460: RYAN | W460: WILLIAMSTOWN | X460: 7 | Y460: 5 | Z460: 0 | AA460: 374 | AB460: 315 | AC460: 118.73015873015873 | AD460: 28
A461: BRUNSWICK | C461: JOHNSTON | F461: WHELAN | H461: COBURN | K461: LANDELLS | N461: ANDREWS | P461: TUCKER
A462: GOALKICKERS | W462: RICHMOND | X462: 5 | Y462: 7 | Z462: 0 | AA462: 348 | AB462: 450 | AC462: 77.333333333333329 | AD462: 20
A463: PORT MELBOURNE | C463: HUTCHINSON 6 | F463: HASSETT 4 | I463: SWANNIE 2 | K463: PEARS 2 | M463: WARD | O463: McCONCHIE | R463: KNOX | W463: WEST MELBOURNE | X463: 4 | Y463: 8 | Z463: 0 | AA463: 443 | AB463: 439 | AC463: 100.91116173120729 | AD463: 16
A464: BRUNSWICK | C464: WATSON | F464: LANDELLS | I464: ROBERTSON | L464: McKENZIE | W464: PRAHRAN | X464: 2 | Y464: 10 | Z464: 0 | AA464: 361 | AB464: 571 | AC464: 63.22241681260946 | AD464: 8
W465: BRUNSWICK | X465: 1 | Y465: 11 | Z465: 0 | AA465: 293 | AB465: 720 | AC465: 40.694444444444443 | AD465: 4
A466: WILLIAMSTOWN | C466: 3 | D466: 2 | E466: =C466*6+D466 -> 20 | G466: 4 | H466: 2 | I466: =G466*6+H466 -> 26 | K466: 4 | L466: 2 | M466: =K466*6+L466 -> 26 | O466: 4 | P466: 3 | Q466: =O466*6+P466 -> 27 | S466: WILLIAMSTOWN
A467: FOOTSCRAY | C467: 1 | D467: 0 | E467: =C467*6+D467 -> 6 | G467: 1 | H467: 3 | I467: =G467*6+H467 -> 9 | K467: 2 | L467: 6 | M467: =K467*6+L467 -> 18 | O467: 3 | P467: 6 | Q467: =O467*6+P467 -> 24 | S467: FREAME
A468: BEST PLAYERS
A469: WILLIAMSTOWN | C469: WORROLL | F469: R. HALL | H469: BARNES | K469: SPRINTALL | N469: BARTY | Q469: W .HALL
A470: FOOTSCRAY | C470: McCARTHY | F470: HARRIS | H470: MARMO | K470: DALY | N470: KRUSE | Q470: ARMSTRONG
A471: GOALKICKERS
A472: WILLIAMSTOWN | C472: WARREN 2
A473: FOOTSCRAY | C473: DALY 2 | F473: DREW
A475: NORTH MELBOURNE | C475: 1 | D475: 1 | E475: =C475*6+D475 -> 7 | G475: 2 | H475: 6 | I475: =G475*6+H475 -> 18 | K475: 3 | L475: 9 | M475: =K475*6+L475 -> 27 | O475: 6 | P475: 12 | Q475: =O475*6+P475 -> 48 | S475: TOORAK PARK
A476: PRAHRAN | C476: 1 | D476: 5 | E476: =C476*6+D476 -> 11 | G476: 2 | H476: 6 | I476: =G476*6+H476 -> 18 | K476: 5 | L476: 9 | M476: =K476*6+L476 -> 39 | O476: 6 | P476: 9 | Q476: =O476*6+P476 -> 45 | S476: DICK
A477: BEST PLAYERS
A478: NORTH MELBOURNE | C478: P .SMITH | F478: C .SMITH | I478: LONDERIGAN | L478: McSWEENEY | O478: QUILLIGAN | R478: ROLENT
A479: PRAHRAN | C479: LYONS | F479: BALL | I479: McINERNEY | L479: DEAN | O479: JOHNSTON | R479: LEVIEN
A480: GOALKICKERS
A481: NORTH MELBOURNE | C481: SICILY 2 | F481: McCAUSLAND 2 | J481: McCLUMPA | M481: BOYLE
A482: PRAHRAN | C482: LYONS 2 | F482: DOWNES | I482: HORNIDGE | L482: MORTON | N482: G. BROWN
A484: WEST MELBOURNE | C484: 1 | D484: 1 | E484: =C484*6+D484 -> 7 | G484: 2 | H484: 7 | I484: =G484*6+H484 -> 19 | K484: 3 | L484: 9 | M484: =K484*6+L484 -> 27 | O484: 5 | P484: 12 | Q484: =O484*6+P484 -> 42 | S484: NORTH MELB
A485: RICHMOND | C485: 0 | D485: 2 | E485: =C485*6+D485 -> 2 | G485: 1 | H485: 2 | I485: =G485*6+H485 -> 8 | K485: 1 | L485: 5 | M485: =K485*6+L485 -> 11 | O485: 1 | P485: 7 | Q485: =O485*6+P485 -> 13 | S485: MURPHY
A486: BEST PLAYERS
A487: WEST MELBOURNE | C487: A .SNELL | F487: A .J .SNELL | I487: TWITCHETT | L487: MEAGHAN | O487: HOWARD | R487: PAGE
A488: RICHMOND | C488: C. TAYLOR | F488: HARDIMAN | I488: BACKHOUSE | L488: POPE | O488: W .CLARKE | R488: RUDD
A489: GOALKICKERS
A490: WEST MELBOURNE | C490: A SNELL 2 | F490: PULLAR | I490: HOCKING | L490: A J SNELL
A491: RICHMOND | C491: McGUIRE
A493: ROUND 13 | E493: 22ND JULY | I493: WEATHER | M493: FINE | W493: TEAM | X493: W | Y493: L | Z493: D | AA493: FOR | AB493: AGST | AC493: % | AD493: PTS
D495: 1ST QTR | H495: 2ND QTR | L495: 3RD QTR | P495: FINAL | S495: AT | X495: LADDER | AA495: ROUND | AC495: 13
S496: NORTH MELB
A497: NORTH MELBOURNE | C497: 6 | D497: 3 | E497: =C497*6+D497 -> 39 | G497: 7 | H497: 5 | I497: =G497*6+H497 -> 47 | K497: 8 | L497: 7 | M497: =K497*6+L497 -> 55 | O497: 12 | P497: 10 | Q497: =O497*6+P497 -> 82 | S497: UMPIRE | W497: FOOTSCRAY | X497: 11 | Y497: 2 | Z497: 0 | AA497: 559 | AB497: 281 | AC497: 198.932384341637 | AD497: 44
A498: PORT MELBOURNE | C498: 2 | D498: 3 | E498: =C498*6+D498 -> 15 | G498: 3 | H498: 8 | I498: =G498*6+H498 -> 26 | K498: 4 | L498: 10 | M498: =K498*6+L498 -> 34 | O498: 4 | P498: 12 | Q498: =O498*6+P498 -> 36 | S498: SCHAEFER | W498: NORTH MELBOURNE | X498: 11 | Y498: 2 | Z498: 0 | AA498: 634 | AB498: 357 | AC498: 177.59103641456582 | AD498: 44
A499: BEST PLAYERS | W499: PORT MELBOURNE | X499: 9 | Y499: 4 | Z499: 0 | AA499: 532 | AB499: 409 | AC499: 130.07334963325184 | AD499: 36
A500: NORTH MELBOURNE | C500: GRAHAM | F500: SICILY | H500: H .LAUNDER | K500: E. LAUNDER | N500: McDERMOTT | Q500: TORPEY | W500: WILLIAMSTOWN | X500: 7 | Y500: 6 | Z500: 0 | AA500: 411 | AB500: 361 | AC500: 113.85041551246537 | AD500: 28
A501: PORT MELBOURNE | C501: McGEE | F501: O'BRIEN | H501: SWANNIE | K501: HASSETT | N501: WARD | Q501: KNOX
A502: GOALKICKERS | W502: RICHMOND | X502: 6 | Y502: 7 | Z502: 0 | AA502: 394 | AB502: 487 | AC502: 80.903490759753595 | AD502: 24
A503: NORTH MELBOURNE | C503: RUTLEY 5 | F503: KINMAN 2 | I503: KNEE 2 | K503: H .LAUNDER | N503: NOONAN | Q503: McCAUSLAND | W503: WEST MELBOURNE | X503: 4 | Y503: 9 | Z503: 0 | AA503: 483 | AB503: 481 | AC503: 100.41580041580042 | AD503: 16
A504: PORT MELBOURNE | C504: RYAN | F504: SWANNIE | I504: HASSETT | K504: McCONACHIE | W504: PRAHRAN | X504: 3 | Y504: 10 | Z504: 0 | AA504: 400 | AB504: 601 | AC504: 66.555740432612311 | AD504: 12
W505: BRUNSWICK | X505: 1 | Y505: 12 | Z505: 0 | AA505: 323 | AB505: 759 | AC505: 42.555994729907773 | AD505: 4
A506: FOOTSCRAY | C506: 3 | D506: 1 | E506: =C506*6+D506 -> 19 | G506: 5 | H506: 2 | I506: =G506*6+H506 -> 32 | K506: 6 | L506: 3 | M506: =K506*6+L506 -> 39 | O506: 6 | P506: 6 | Q506: =O506*6+P506 -> 42 | S506: FOOTSCRAY
A507: WEST MELBOURNE | C507: 0 | D507: 3 | E507: =C507*6+D507 -> 3 | G507: 1 | H507: 8 | I507: =G507*6+H507 -> 14 | K507: 4 | L507: 9 | M507: =K507*6+L507 -> 33 | O507: 5 | P507: 10 | Q507: =O507*6+P507 -> 40 | S507: FREAME
A508: BEST PLAYERS
A509: FOOTSCRAY | C509: DALY | F509: MARMO | I509: HARRIS | K509: McCARTHY | N509: CUNNINGHAM | Q509: MOLYNEUX
A510: WEST MELBOURNE | C510: MANSON | F510: BARKER | I510: MACKEY | K510: STONE | N510: A .SNELL | Q510: FERGUSON
A511: GOALKICKERS
A512: FOOTSCRAY | C512: DALY 4 | F512: CARNEY | I512: WILLIAMS
A513: WEST MELBOURNE | C513: HOCKING 2 | F513: STONE 2 | I513: STEVENSON
A515: RICHMOND | C515: 5 | D515: 1 | E515: =C515*6+D515 -> 31 | G515: 6 | H515: 2 | I515: =G515*6+H515 -> 38 | K515: 6 | L515: 3 | M515: =K515*6+L515 -> 39 | O515: 7 | P515: 4 | Q515: =O515*6+P515 -> 46 | S515: RICHMOND
A516: WILLIAMSTOWN | C516: 1 | D516: 2 | E516: =C516*6+D516 -> 8 | G516: 3 | H516: 8 | I516: =G516*6+H516 -> 26 | K516: 4 | L516: 11 | M516: =K516*6+L516 -> 35 | O516: 4 | P516: 13 | Q516: =O516*6+P516 -> 37 | S516: STRANGER
A517: BEST PLAYERS
A518: RICHMOND | C518: T .WATSON | F518: D. WATSON | I518: McGUIRE | K518: BACKHOUSE | N518: TAYLOR | Q518: MILNE
A519: WILLIAMSTOWN | C519: WORROLL | F519: WARREN | I519: CALDWELL | K519: McWILLIAMS | N519: W .HALL | Q519: RILEY
A520: GOALKICKERS
A521: RICHMOND | C521: McGUIRE 3 | F521: BACKHOUSE 2 | J521: MILNE | L521: SEARLE
A522: WILLIAMSTOWN | C522: WORROLL 2 | F522: BOND 2
A524: PRAHRAN | C524: 1 | D524: 2 | E524: =C524*6+D524 -> 8 | G524: 2 | H524: 3 | I524: =G524*6+H524 -> 15 | K524: 3 | L524: 6 | M524: =K524*6+L524 -> 24 | O524: 5 | P524: 9 | Q524: =O524*6+P524 -> 39 | S524: B.WICK
A525: BRUNSWICK | C525: 2 | D525: 2 | E525: =C525*6+D525 -> 14 | G525: 3 | H525: 2 | I525: =G525*6+H525 -> 20 | K525: 3 | L525: 6 | M525: =K525*6+L525 -> 24 | O525: 4 | P525: 6 | Q525: =O525*6+P525 -> 30 | S525: EMMERSON
A526: BEST PLAYERS
A527: PRAHRAN | C527: LYONS | F527: G .BROWN | I527: HORNIDGE | L527: RUST | N527: WAINWRIGHT | Q527: KRUG
A528: BRUNSWICK | C528: ANDREWS | F528: O'LOUGHLIN | I528: CASEY | L528: TOUGH | N528: LANDELLS | Q528: McKENZIE
A529: GOALKICKERS
A530: PRAHRAN | C530: HORNIDGE 2 | G530: G .BROWN 2 | J530: DOWNES
A531: BRUNSWICK | C531: LANDELLS 3 | G531: McKENZIE
A533: ROUND 14 | E533: 29TH JULY | I533: WEATHER | M533: STRONG NORTH WEST WIND | W533: TEAM | X533: W | Y533: L | Z533: D | AA533: FOR | AB533: AGST | AC533: % | AD533: PTS
D535: 1ST QTR | H535: 2ND QTR | L535: 3RD QTR | P535: FINAL | S535: AT | X535: LADDER | AA535: ROUND | AC535: 14
S536: TOORAK PARK
A537: PRAHRAN | C537: 2 | D537: 1 | E537: =C537*6+D537 -> 13 | G537: 7 | H537: 5 | I537: =G537*6+H537 -> 47 | K537: 7 | L537: 6 | M537: =K537*6+L537 -> 48 | O537: 9 | P537: 10 | Q537: =O537*6+P537 -> 64 | S537: UMPIRE | W537: FOOTSCRAY | X537: 12 | Y537: 2 | Z537: 0 | AA537: 617 | AB537: 302 | AC537: 204.3046357615894 | AD537: 48
A538: PORT MELBOURNE | C538: 1 | D538: 3 | E538: =C538*6+D538 -> 9 | G538: 3 | H538: 3 | I538: =G538*6+H538 -> 21 | K538: 7 | L538: 6 | M538: =K538*6+L538 -> 48 | O538: 7 | P538: 8 | Q538: =O538*6+P538 -> 50 | S538: SCHAEFER | W538: NORTH MELBOURNE | X538: 12 | Y538: 2 | Z538: 0 | AA538: 741 | AB538: 367 | AC538: 201.90735694822888 | AD538: 48
A539: BEST PLAYERS | W539: PORT MELBOURNE | X539: 9 | Y539: 5 | Z539: 0 | AA539: 582 | AB539: 473 | AC539: 123.04439746300211 | AD539: 36
A540: PRAHRAN | C540: LYONS | F540: McINERNEY | I540: TAYLOR | K540: LEVIEN | N540: GREENLANDS | Q540: MORTON | W540: WILLIAMSTOWN | X540: 8 | Y540: 6 | Z540: 0 | AA540: 451 | AB540: 388 | AC540: 116.23711340206185 | AD540: 32
A541: PORT MELBOURNE | C541: POWELL | F541: BLAIR | I541: McGEE | K541: WARD | N541: HASSETT | Q541: HICKEY
A542: GOALKICKERS | W542: RICHMOND | X542: 6 | Y542: 8 | Z542: 0 | AA542: 415 | AB542: 545 | AC542: 76.146788990825684 | AD542: 24
A543: PRAHRAN | C543: MORTON 4 | F543: BROWN 2 | I543: BALL | K543: GREENLANDS | N543: DOWNES | W543: WEST MELBOURNE | X543: 4 | Y543: 10 | Z543: 0 | AA543: 510 | AB543: 521 | AC543: 97.888675623800381 | AD543: 16
A544: PORT MELBOURNE | C544: RYAN 3 | F544: HASSETT | I544: McGEE | K544: HUTCHINSON | N544: KISSANE | W544: PRAHRAN | X544: 4 | Y544: 10 | Z544: 0 | AA544: 464 | AB544: 651 | AC544: 71.274961597542244 | AD544: 16
W545: BRUNSWICK | X545: 1 | Y545: 13 | Z545: 0 | AA545: 333 | AB545: 866 | AC545: 38.452655889145497 | AD545: 4
A546: WILLIAMSTOWN | C546: 0 | D546: 0 | E546: =C546*6+D546 -> 0 | G546: 3 | H546: 10 | I546: =G546*6+H546 -> 28 | K546: 3 | L546: 13 | M546: =K546*6+L546 -> 31 | O546: 4 | P546: 16 | Q546: =O546*6+P546 -> 40 | S546: NORTH MELB
A547: WEST MELBOURNE | C547: 1 | D547: 2 | E547: =C547*6+D547 -> 8 | G547: 1 | H547: 2 | I547: =G547*6+H547 -> 8 | K547: 2 | L547: 5 | M547: =K547*6+L547 -> 17 | O547: 3 | P547: 9 | Q547: =O547*6+P547 -> 27 | S547: MURPHY
A548: BEST PLAYERS
A549: WILLIAMSTOWN | C549: WARREN | F549: WORROLL | I549: BARTY | K549: R. HALL | N549: BARNES | Q549: SPRINTALL
A550: WEST MELBOURNE | C550: MACKEY | F550: FERGUSSON | I550: TWITCHETT | K550: PAGE | N550: A .SNELL | Q550: A .J .SNELL
A551: GOALKICKERS
A552: WILLIAMSTOWN | C552: WARREN 3 | F552: THURGOOD
A553: WEST MELBOURNE | C553: A SNELL 2 | F553: PULLAR
A555: NORTH MELBOURNE | C555: 2 | D555: 5 | E555: =C555*6+D555 -> 17 | G555: 6 | H555: 12 | I555: =G555*6+H555 -> 48 | K555: 8 | L555: 13 | M555: =K555*6+L555 -> 61 | O555: 15 | P555: 17 | Q555: =O555*6+P555 -> 107 | S555: BRUNSWICK
A556: BRUNSWICK | C556: 0 | D556: 0 | E556: =C556*6+D556 -> 0 | G556: 0 | H556: 1 | I556: =G556*6+H556 -> 1 | K556: 0 | L556: 4 | M556: =K556*6+L556 -> 4 | O556: 1 | P556: 4 | Q556: =O556*6+P556 -> 10 | S556: STRANGER
A557: BEST PLAYERS
A558: NORTH MELBOURNE | C558: SMITH | F558: McSWEENEY | I558: LAUNDER | L558: GRAHAM | O558: SICILY | R558: NOONAN
A559: BRUNSWICK | C559: O'LOUGHLIN | F559: McKENZIE | I559: GORDON | L559: McKENNA | O559: LANDELLS | R559: TUCKER
A560: GOALKICKERS
A561: NORTH MELBOURNE | C561: KNEE 5 | E561: NOONAN 2 | G561: RUTLEY 2 | J561: SICILY 2 | L561: KINMAN | N561: ROLENT | P561: CARLTON | S561: McCAUSLAND
A562: BRUNSWICK | C562: McKENZIE
A564: FOOTSCRAY | C564: 1 | D564: 6 | E564: =C564*6+D564 -> 12 | G564: 2 | H564: 7 | I564: =G564*6+H564 -> 19 | K564: 6 | L564: 8 | M564: =K564*6+L564 -> 44 | O564: 8 | P564: 10 | Q564: =O564*6+P564 -> 58 | S564: RICHMOND
A565: RICHMOND | C565: 0 | D565: 1 | E565: =C565*6+D565 -> 1 | G565: 0 | H565: 1 | I565: =G565*6+H565 -> 1 | K565: 1 | L565: 2 | M565: =K565*6+L565 -> 8 | O565: 3 | P565: 3 | Q565: =O565*6+P565 -> 21 | S565: FREAME
A566: BEST PLAYERS
A567: FOOTSCRAY | C567: DECOIT | F567: BROCKWELL | I567: MARMO | K567: HARRIS | N567: DALY | Q567: KRUSE
A568: RICHMOND | C568: BACKHOUSE | F568: PARKER | H568: T .WATSON | K568: TAYLOR | N568: CARKEEK | Q568: HARDIMAN
A569: GOALKICKERS
A570: FOOTSCRAY | C570: MITCHELL 3 | G570: DALY 3 | J570: DECOIT 2
A571: RICHMOND | C571: BACKHOUSE | G571: PARKER | J571: SWIFT
A573: ROUND 15 | E573: 5TH AUGUST | K573: WEATHER | Q573: NORTH WIND | W573: TEAM | X573: W | Y573: L | Z573: D | AA573: FOR | AB573: AGST | AC573: % | AD573: PTS
D575: 1ST QTR | H575: 2ND QTR | L575: 3RD QTR | P575: FINAL | S575: AT | X575: LADDER | AA575: ROUND | AC575: 15
S576: PORT MELB
A577: PORT MELBOURNE | C577: 2 | D577: 1 | E577: =C577*6+D577 -> 13 | G577: 4 | H577: 1 | I577: =G577*6+H577 -> 25 | K577: 4 | L577: 3 | M577: =K577*6+L577 -> 27 | O577: 5 | P577: 4 | Q577: =O577*6+P577 -> 34 | S577: UMPIRE | W577: NORTH MELBOURNE | X577: 12 | Y577: 3 | Z577: 0 | AA577: 774 | AB577: 401 | AC577: 193.01745635910225 | AD577: 48
A578: FOOTSCRAY | C578: 0 | D578: 2 | E578: =C578*6+D578 -> 2 | G578: 2 | H578: 4 | I578: =G578*6+H578 -> 16 | K578: 3 | L578: 4 | M578: =K578*6+L578 -> 22 | O578: 4 | P578: 5 | Q578: =O578*6+P578 -> 29 | S578: BREMNER | W578: FOOTSCRAY | X578: 12 | Y578: 3 | Z578: 0 | AA578: 646 | AB578: 336 | AC578: 192.26190476190476 | AD578: 48
A579: BEST PLAYERS | W579: PORT MELBOURNE | X579: 10 | Y579: 5 | Z579: 0 | AA579: 616 | AB579: 502 | AC579: 122.70916334661355 | AD579: 40
A580: PORT MELBOURNE | C580: O'BRIEN | F580: McGEE | I580: NICKELL | K580: SWANNIE | N580: MILLER | Q580: G .JOHNSTON | W580: WILLIAMSTOWN | X580: 9 | Y580: 6 | Z580: 0 | AA580: 485 | AB580: 421 | AC580: 115.20190023752969 | AD580: 36
A581: FOOTSCRAY | C581: MARMO | F581: ARMSTRONG | I581: ROBINSON | K581: JAMES | N581: DALY | Q581: MITCHELL
A582: GOALKICKERS | W582: RICHMOND | X582: 6 | Y582: 9 | Z582: 0 | AA582: 436 | AB582: 581 | AC582: 75.043029259896727 | AD582: 24
A583: PORT MELBOURNE | C583: MILLER 2 | F583: O'BRIEN 2 | I583: HASSETT | W583: WEST MELBOURNE | X583: 5 | Y583: 10 | Z583: 0 | AA583: 543 | AB583: 545 | AC583: 99.633027522935777 | AD583: 20
A584: FOOTSCRAY | C584: DALY 2 | F584: ARMSTRONG | I584: MITCHELL | W584: PRAHRAN | X584: 5 | Y584: 10 | Z584: 0 | AA584: 500 | AB584: 672 | AC584: 74.404761904761898 | AD584: 20
W585: BRUNSWICK | X585: 1 | Y585: 14 | Z585: 0 | AA585: 357 | AB585: 899 | AC585: 39.710789766407117 | AD585: 4
A586: WILLIAMSTOWN | C586: 2 | D586: 6 | E586: =C586*6+D586 -> 18 | G586: 2 | H586: 7 | I586: =G586*6+H586 -> 19 | K586: 3 | L586: 10 | M586: =K586*6+L586 -> 28 | O586: 4 | P586: 10 | Q586: =O586*6+P586 -> 34 | S586: WILLIAMSTOWN
A587: NORTH MELBOURNE | C587: 0 | D587: 1 | E587: =C587*6+D587 -> 1 | G587: 0 | H587: 8 | I587: =G587*6+H587 -> 8 | K587: 0 | L587: 9 | M587: =K587*6+L587 -> 9 | O587: 3 | P587: 15 | Q587: =O587*6+P587 -> 33 | S587: STRANGER
A588: BEST PLAYERS
A589: WILLIAMSTOWN | C589: WORROLL | F589: WARREN | I589: SPRINTALL | L589: CALDWELL | O589: E .HALL | R589: HEDLEY
A590: NORTH MELBOURNE | C590: H.LAUNDER | F590: LONDERIGAN | I590: QUILLIGAN | L590: C. SMITH | O590: P .SMITH | R590: NOONAN
A591: GOALKICKERS
A592: WILLIAMSTOWN | C592: R. HALL 2 | F592: BARTY | I592: THOMPSON
A593: NORTH MELBOURNE | C593: SICILY 2 | F593: RUTLEY
A595: PRAHRAN | C595: 1 | D595: 2 | E595: =C595*6+D595 -> 8 | G595: 1 | H595: 3 | I595: =G595*6+H595 -> 9 | K595: 4 | L595: 5 | M595: =K595*6+L595 -> 29 | O595: 5 | P595: 6 | Q595: =O595*6+P595 -> 36 | S595: TOORAK PARK
A596: RICHMOND | C596: 0 | D596: 1 | E596: =C596*6+D596 -> 1 | G596: 1 | H596: 4 | I596: =G596*6+H596 -> 10 | K596: 1 | L596: 5 | M596: =K596*6+L596 -> 11 | O596: 2 | P596: 9 | Q596: =O596*6+P596 -> 21 | S596: EMMERSON
A597: BEST PLAYERS
A598: PRAHRAN | C598: LYONS | F598: HORNIDGE | I598: McINERNEY | L598: LEVIEN | O598: WEATHERLEY | S598: BALL
A599: RICHMOND | C599: T .WATSON | F599: D. WATSON | I599: C .BACKHOUSE | L599: PARKER | O599: RUDD | R599: MILNE
A600: GOALKICKERS
A601: PRAHRAN | C601: DAWSON 2 | F601: ROBERTS | I601: HORNIDGE | L601: MORTON
A602: RICHMOND | C602: TAYLOR | F602: MILNE
A604: WEST MELBOURNE | C604: 1 | D604: 1 | E604: =C604*6+D604 -> 7 | G604: 3 | H604: 5 | I604: =G604*6+H604 -> 23 | K604: 3 | L604: 7 | M604: =K604*6+L604 -> 25 | O604: 3 | P604: 15 | Q604: =O604*6+P604 -> 33 | S604: NORTH MELB
A605: BRUNSWICK | C605: 0 | D605: 3 | E605: =C605*6+D605 -> 3 | G605: 1 | H605: 4 | I605: =G605*6+H605 -> 10 | K605: 3 | L605: 6 | M605: =K605*6+L605 -> 24 | O605: 3 | P605: 6 | Q605: =O605*6+P605 -> 24 | S605: FREAME
A606: BEST PLAYERS
A607: WEST MELBOURNE | C607: PULLAR | F607: PAGE | H607: FERGUSSON | K607: MACKEY | N607: McMURRAY | Q607: MEAGHAN
A608: BRUNSWICK | C608: MUDGE | F608: CLEMENTS | H608: LANDELLS | K608: RYAN | N608: McKENZIE | Q608: JOHNSON
A609: GOALKICKERS
A610: WEST MELBOURNE | C610: STONE 2 | F610: BOWMAN
A611: BRUNSWICK | C611: LANDELLS | F611: RYAN | H611: LUCAS
A613: ROUND 16 | E613: 12TH AUGUST | K613: WEATHER | Q613: FINE | W613: TEAM | X613: W | Y613: L | Z613: D | AA613: FOR | AB613: AGST | AC613: % | AD613: PTS
D615: 1ST QTR | H615: 2ND QTR | L615: 3RD QTR | P615: FINAL | S615: AT | X615: LADDER | AA615: ROUND | AC615: 16
S616: RICHMOND
A617: PORT MELBOURNE | C617: 2 | D617: 2 | E617: =C617*6+D617 -> 14 | G617: 3 | H617: 5 | I617: =G617*6+H617 -> 23 | K617: 4 | L617: 6 | M617: =K617*6+L617 -> 30 | O617: 6 | P617: 9 | Q617: =O617*6+P617 -> 45 | S617: UMPIRE | W617: NORTH MELBOURNE | X617: 13 | Y617: 3 | Z617: 0 | AA617: 850 | AB617: 421 | AC617: 201.90023752969122 | AD617: 52
A618: RICHMOND | C618: 3 | D618: 3 | E618: =C618*6+D618 -> 21 | G618: 4 | H618: 5 | I618: =G618*6+H618 -> 29 | K618: 6 | L618: 5 | M618: =K618*6+L618 -> 41 | O618: 6 | P618: 5 | Q618: =O618*6+P618 -> 41 | S618: STRANGER | W618: FOOTSCRAY | X618: 13 | Y618: 3 | Z618: 0 | AA618: 713 | AB618: 359 | AC618: 198.60724233983288 | AD618: 52
A619: BEST PLAYERS | W619: PORT MELBOURNE | X619: 11 | Y619: 5 | Z619: 0 | AA619: 661 | AB619: 543 | AC619: 121.73112338858195 | AD619: 44
A620: PORT MELBOURNE | C620: POLLACK | F620: RYAN | I620: O'BRIEN | L620: SWANNIE | N620: PEARS | Q620: HICKEY | W620: WILLIAMSTOWN | X620: 10 | Y620: 6 | Z620: 0 | AA620: 531 | AB620: 440 | AC620: 120.68181818181819 | AD620: 40
A621: RICHMOND | C621: PARKER | F621: C. BACKHOUSE | I621: T. WATSON | L621: RUDD | N621: BAHEN | Q621: TAYLOR
A622: GOALKICKERS | W622: RICHMOND | X622: 6 | Y622: 10 | Z622: 0 | AA622: 477 | AB622: 626 | AC622: 76.198083067092654 | AD622: 24
A623: PORT MELBOURNE | C623: PEARS 3 | F623: HUTCHINSON 2 | J623: SWANNIE | W623: WEST MELBOURNE | X623: 5 | Y623: 11 | Z623: 0 | AA623: 563 | AB623: 621 | AC623: 90.660225442834133 | AD623: 20
A624: RICHMOND | C624: MILNE 3 | F624: O'SHANNASSEY | J624: MITCHELL | M624: DONNELLY | W624: PRAHRAN | X624: 5 | Y624: 11 | Z624: 0 | AA624: 523 | AB624: 739 | AC624: 70.771312584573749 | AD624: 20
W625: BRUNSWICK | X625: 1 | Y625: 15 | Z625: 0 | AA625: 376 | AB625: 945 | AC625: 39.788359788359791 | AD625: 4
A626: WILLIAMSTOWN | C626: 0 | D626: 1 | E626: =C626*6+D626 -> 1 | G626: 3 | H626: 1 | I626: =G626*6+H626 -> 19 | K626: 4 | L626: 1 | M626: =K626*6+L626 -> 25 | O626: 7 | P626: 4 | Q626: =O626*6+P626 -> 46 | S626: BRUNSWICK
A627: BRUNSWICK | C627: 1 | D627: 2 | E627: =C627*6+D627 -> 8 | G627: 2 | H627: 5 | I627: =G627*6+H627 -> 17 | K627: 2 | L627: 6 | M627: =K627*6+L627 -> 18 | O627: 2 | P627: 7 | Q627: =O627*6+P627 -> 19 | S627: FREAME
A628: BEST PLAYERS
A629: WILLIAMSTOWN | C629: BARR | F629: OUTEN | H629: WORROLL | K629: HEDLEY | N629: WARREN | Q629: McKINLEY
A630: BRUNSWICK | C630: LANDELLS | F630: GOODWIN | H630: CASEY | K630: O'LOUGHLIN | N630: JOHNSON | Q630: McKENZIE
A631: GOALKICKERS
A632: WILLIAMSTOWN | C632: OUTEN 2 | F632: McKINLEY | I632: BARR | K632: WARREN | N632: HEDLEY | P632: BOND
A633: BRUNSWICK | C633: LANDELLS 2
A635: NORTH MELBOURNE | C635: 3 | D635: 1 | E635: =C635*6+D635 -> 19 | G635: 6 | H635: 5 | I635: =G635*6+H635 -> 41 | K635: 9 | L635: 9 | M635: =K635*6+L635 -> 63 | O635: 11 | P635: 10 | Q635: =O635*6+P635 -> 76 | S635: NORTH MELB
A636: WEST MELBOURNE | C636: 0 | D636: 1 | E636: =C636*6+D636 -> 1 | G636: 1 | H636: 3 | I636: =G636*6+H636 -> 9 | K636: 2 | L636: 4 | M636: =K636*6+L636 -> 16 | O636: 2 | P636: 8 | Q636: =O636*6+P636 -> 20 | S636: EMMERSON
A637: BEST PLAYERS
A638: NORTH MELBOURNE | C638: ROLENT | F638: H .LAUNDER | I638: E. LAUNDER | L638: SICILY | O638: GRAHAM | R638: McCAUSLAND
A639: WEST MELBOURNE | C639: HOWARD | F639: HARRY | I639: MANSON | L639: MACKEY | O639: McMURRAY | R639: MONTGOMERY
A640: GOALKICKERS
A641: NORTH MELBOURNE | C641: RUTLEY 3 | F641: NOONAN 2 | I641: KINMAN | K641: C .SMITH | M641: H .LAUNDER | P641: E .LAUNDER | S641: KNEE | U641: GRAHAM
A642: WEST MELBOURNE | C642: KENNEDY | F642: STONE
A644: FOOTSCRAY | C644: 5 | D644: 5 | E644: =C644*6+D644 -> 35 | G644: 5 | H644: 7 | I644: =G644*6+H644 -> 37 | K644: 8 | L644: 9 | M644: =K644*6+L644 -> 57 | O644: 9 | P644: 13 | Q644: =O644*6+P644 -> 67 | S644: FOOTSCRAY
A645: PRAHRAN | C645: 0 | D645: 0 | E645: =C645*6+D645 -> 0 | G645: 2 | H645: 3 | I645: =G645*6+H645 -> 15 | K645: 2 | L645: 3 | M645: =K645*6+L645 -> 15 | O645: 3 | P645: 5 | Q645: =O645*6+P645 -> 23 | S645: MURPHY
A646: BEST PLAYERS
A647: FOOTSCRAY | C647: McCARTHY | F647: MARMO | I647: DECOIT | K647: DREW | N647: BROCKWELL | Q647: ARMSTRONG
A648: PRAHRAN | C648: WESTBROOK | F648: TAYLOR | I648: DEAN | K648: JOHNSON | N648: HORNIDGE | Q648: LYONS
A649: GOALKICKERS
A650: FOOTSCRAY | C650: DECOIT 3 | F650: McCARTHY 2 | J650: MITCHELL 2 | M650: BROCKWELL | P650: DALY
A651: PRAHRAN | C651: DOWNES 2 | F651: DEAN
A654: ROUND 17 | E654: 19TH AUGUST | I654: WEATHER | M654: FINE WEST WIND | W654: TEAM | X654: W | Y654: L | Z654: D | AA654: FOR | AB654: AGST | AC654: % | AD654: PTS
D656: 1ST QTR | H656: 2ND QTR | L656: 3RD QTR | P656: FINAL | S656: AT | X656: LADDER | AA656: ROUND | AC656: 17
S657: PORT MELB
A658: PORT MELBOURNE | C658: 3 | D658: 1 | E658: =C658*6+D658 -> 19 | G658: 3 | H658: 1 | I658: =G658*6+H658 -> 19 | K658: 7 | L658: 3 | M658: =K658*6+L658 -> 45 | O658: 7 | P658: 3 | Q658: =O658*6+P658 -> 45 | S658: UMPIRE | W658: FOOTSCRAY | X658: 14 | Y658: 3 | Z658: 0 | AA658: 805 | AB658: 377 | AC658: 213.52785145888595 | AD658: 56
A659: WILLIAMSTOWN | C659: 0 | D659: 4 | E659: =C659*6+D659 -> 4 | G659: 3 | H659: 7 | I659: =G659*6+H659 -> 25 | K659: 3 | L659: 7 | M659: =K659*6+L659 -> 25 | O659: 4 | P659: 10 | Q659: =O659*6+P659 -> 34 | S659: STRANGER | W659: NORTH MELBOURNE | X659: 14 | Y659: 3 | Z659: 0 | AA659: 940 | AB659: 457 | AC659: 205.68927789934355 | AD659: 56
A660: BEST PLAYERS | W660: PORT MELBOURNE | X660: 12 | Y660: 5 | Z660: 0 | AA660: 706 | AB660: 577 | AC660: 122.35701906412478 | AD660: 48
A661: PORT MELBOURNE | C661: G .JOHNSTON | F661: A .JOHNSTON | I661: KNOX | K661: McGEE | N661: HICKEY | P661: POWELL | W661: WILLIAMSTOWN | X661: 10 | Y661: 7 | Z661: 0 | AA661: 565 | AB661: 485 | AC661: 116.49484536082474 | AD661: 40
A662: WILLIAMSTOWN | C662: WORROLL | F662: WARREN | I662: GUTHRIE | K662: OUTEN | N662: RILEY | P662: BARTY
A663: GOALKICKERS | W663: PRAHRAN | X663: 6 | Y663: 11 | Z663: 0 | AA663: 555 | AB663: 766 | AC663: 72.45 | AD663: 24
A664: PORT MELBOURNE | C664: HUTCHINSON 2 | G664: POWELL 2 | J664: SWANNIE | L664: MILLER | N664: PEARS | W664: RICHMOND | X664: 6 | Y664: 11 | Z664: 0 | AA664: 513 | AB664: 716 | AC664: 71.648044692737429 | AD664: 24
A665: WILLIAMSTOWN | C665: McKINLEY | F665: BARTY | I665: OUTEN | K665: GUTHRIE | W665: WEST MELBOURNE | X665: 5 | Y665: 12 | Z665: 0 | AA665: 590 | AB665: 653 | AC665: 90.35 | AD665: 20
W666: BRUNSWICK | X666: 1 | Y666: 16 | Z666: 0 | AA666: 394 | AB666: 1037 | AC666: 37.994214079074254 | AD666: 4
A667: WEST MELBOURNE | C667: 0 | D667: 3 | E667: =C667*6+D667 -> 3 | G667: 1 | H667: 5 | I667: =G667*6+H667 -> 11 | K667: 1 | L667: 8 | M667: =K667*6+L667 -> 14 | O667: 3 | P667: 9 | Q667: =O667*6+P667 -> 27 | S667: TOORAK PARK
A668: PRAHRAN | C668: 1 | D668: 3 | E668: =C668*6+D668 -> 9 | G668: 2 | H668: 10 | I668: =G668*6+H668 -> 22 | K668: 2 | L668: 13 | M668: =K668*6+L668 -> 25 | O668: 3 | P668: 14 | Q668: =O668*6+P668 -> 32 | S668: FREAME
A669: BEST PLAYERS
A670: WEST MELBOURNE | C670: A .SNELL | F670: FITZELL | I670: HONEY | K670: MORGAN | N670: STONE | P670: A .J .SNELL
A671: PRAHRAN | C671: T .BROWN | F671: LYONS | I671: G .BROWN | K671: WESTBROOK | N671: DOWNES | P671: McINERNEY
A672: GOALKICKERS
A673: WEST MELBOURNE | C673: DAWSON | F673: DOWNES | I673: ROBERTSON
A674: PRAHRAN | C674: A .SNELL | F674: STONE | I674: FITZELL
A675: Prahran protested against a goal scored by West Melbourne. It appears the protest was upheld as this is reflected in the final ladders published in contemporary news sources.
A676: The ladders for Round 17 onwards reflect the adjusted result for this game.
A678: FOOTSCRAY | C678: 0 | D678: 0 | E678: =C678*6+D678 -> 0 | G678: 7 | H678: 4 | I678: =G678*6+H678 -> 46 | K678: 9 | L678: 5 | M678: =K678*6+L678 -> 59 | O678: 13 | P678: 14 | Q678: =O678*6+P678 -> 92 | S678: BRUNSWICK
A679: BRUNSWICK | C679: 1 | D679: 1 | E679: =C679*6+D679 -> 7 | G679: 1 | H679: 2 | I679: =G679*6+H679 -> 8 | K679: 2 | L679: 5 | M679: =K679*6+L679 -> 17 | O679: 2 | P679: 6 | Q679: =O679*6+P679 -> 18 | S679: MURPHY
A680: BEST PLAYERS
A681: FOOTSCRAY
A682: BRUNSWICK
A683: GOALKICKERS
A684: FOOTSCRAY | C684: McCARTHY 5 | F684: DECOIT 2 | H684: GRUNDEN | J684: DALY | K684: MITCHELL | M684: GREGORY | O684: DICKENS | Q684: ARMSTRONG
A685: BRUNSWICK | C685: McKENZIE 2
A687: NORTH MELBOURNE | C687: 1 | D687: 4 | E687: =C687*6+D687 -> 10 | G687: 6 | H687: 13 | I687: =G687*6+H687 -> 49 | K687: 6 | L687: 14 | M687: =K687*6+L687 -> 50 | O687: 12 | P687: 18 | Q687: =O687*6+P687 -> 90 | S687: NORTH MELB
A688: RICHMOND | C688: 0 | D688: 1 | E688: =C688*6+D688 -> 1 | G688: 0 | H688: 2 | I688: =G688*6+H688 -> 2 | K688: 5 | L688: 4 | M688: =K688*6+L688 -> 34 | O688: 5 | P688: 6 | Q688: =O688*6+P688 -> 36 | S688: DICK
A689: BEST PLAYERS
A690: NORTH MELBOURNE | C690: H .LAUNDER | F690: ROLENT | I690: CARLTON | K690: RUTLEY | N690: E .LAUNDER | Q690: TORPEY
A691: RICHMOND | C691: PARKER | F691: C .BACKHOUSE | I691: T .WATSON | K691: BAHEN | N691: TATE | Q691: GILES
A692: GOALKICKERS
A693: NORTH MELBOURNE | C693: SICILY 2 | E693: NOONAN 2 | G693: KNEE 2 | I693: CARLTON 2 | K693: KINMAN | M693: TORPEY | O693: E. LAUNDER | R693: RUTLEY
A694: RICHMOND | C694: MARTIN 2 | F694: G. BACKHOUSE 2 | J694: MILNE
A696: ROUND 18 | E696: 26TH AUGUST | K696: WEATHER | Q696: FINE | W696: TEAM | X696: W | Y696: L | Z696: D | AA696: FOR | AB696: AGST | AC696: % | AD696: PTS
D698: 1ST QTR | H698: 2ND QTR | L698: 3RD QTR | P698: FINAL | S698: AT | X698: LADDER | AA698: ROUND | AC698: 18
S699: NORTH MELB
A700: WEST MELBOURNE | C700: 1 | D700: 3 | E700: =C700*6+D700 -> 9 | G700: 6 | H700: 5 | I700: =G700*6+H700 -> 41 | K700: 7 | L700: 8 | M700: =K700*6+L700 -> 50 | O700: 9 | P700: 8 | Q700: =O700*6+P700 -> 62 | S700: UMPIRE | W700: FOOTSCRAY | X700: 15 | Y700: 3 | Z700: 0 | AA700: 905 | AB700: 400 | AC700: 226.25 | AD700: 60
A701: PORT MELBOURNE | C701: 3 | D701: 2 | E701: =C701*6+D701 -> 20 | G701: 3 | H701: 4 | I701: =G701*6+H701 -> 22 | K701: 7 | L701: 5 | M701: =K701*6+L701 -> 47 | O701: 9 | P701: 5 | Q701: =O701*6+P701 -> 59 | S701: POPE | W701: NORTH MELBOURNE | X701: 14 | Y701: 4 | Z701: 0 | AA701: 963 | AB701: 557 | AC701: 172.89048473967685 | AD701: 56
A702: BEST PLAYERS | W702: PORT MELBOURNE | X702: 12 | Y702: 6 | Z702: 0 | AA702: 765 | AB702: 639 | AC702: 119.71830985915493 | AD702: 48
A703: WEST MELBOURNE | C703: HONEY | F703: MACKEY | H703: MONTGOMERY | K703: PULLAR | N703: A .SNELL | Q703: MILLER | W703: WILLIAMSTOWN | X703: 10 | Y703: 8 | Z703: 0 | AA703: 596 | AB703: 517 | AC703: 115.28046421663443 | AD703: 40
A704: PORT MELBOURNE | C704: POWELL | F704: BLAIR | H704: POLLARD | K704: KNOX | N704: HICKEY | Q704: HUTCHINSON
A705: GOALKICKERS | W705: PRAHRAN | X705: 7 | Y705: 11 | Z705: 0 | AA705: 587 | AB705: 797 | AC705: 73.65 | AD705: 28
A706: WEST MELBOURNE | C706: STONE 5 | F706: PULLAR 2 | I706: FERGUSSON | L706: LINQUIST | W706: WEST MELBOURNE | X706: 6 | Y706: 12 | Z706: 0 | AA706: 652 | AB706: 712 | AC706: 91.57 | AD706: 24
A707: PORT MELBOURNE | C707: PEARS 2 | E707: SWANNIE | G707: MILLER | I707: A .JOHNSTON | K707: GRIMSHAW | N707: WARD | O707: HUTCHINSON | R707: McDONALD | W707: RICHMOND | X707: 6 | Y707: 12 | Z707: 0 | AA707: 553 | AB707: 763 | AC707: 72.477064220183493 | AD707: 24
W708: BRUNSWICK | X708: 2 | Y708: 16 | Z708: 0 | AA708: 441 | AB708: 1077 | AC708: 40.947075208913652 | AD708: 8
A709: FOOTSCRAY | C709: 2 | D709: 3 | E709: =C709*6+D709 -> 15 | G709: 6 | H709: 7 | I709: =G709*6+H709 -> 43 | K709: 12 | L709: 7 | M709: =K709*6+L709 -> 79 | O709: 15 | P709: 10 | Q709: =O709*6+P709 -> 100 | S709: FOOTSCRAY
A710: NORTH MELBOURNE | C710: 1 | D710: 0 | E710: =C710*6+D710 -> 6 | G710: 1 | H710: 2 | I710: =G710*6+H710 -> 8 | K710: 2 | L710: 5 | M710: =K710*6+L710 -> 17 | O710: 3 | P710: 5 | Q710: =O710*6+P710 -> 23 | S710: SCHAEFER
A711: BEST PLAYERS
A712: FOOTSCRAY | C712: JAMES | F712: DECOIT | I712: DREW | K712: WILLIAMS | N712: GREGORY | Q712: MITCHELL
A713: NORTH MELBOURNE | C713: LONDERIGAN | F713: QUILLIGAN | I713: TORPEY | K713: McDERMOTT | N713: E .LAUNDER | Q713: GRAHAM
A714: GOALKICKERS
A715: FOOTSCRAY | C715: DECOIT 6 | F715: GREGORY 5 | I715: MITCHELL 2 | L715: DREW | N715: BROCKWELL
A716: NORTH MELBOURNE | C716: KNEE | F716: KINMAN | I716: RUTLEY
A718: PRAHRAN | C718: 1 | D718: 1 | E718: =C718*6+D718 -> 7 | G718: 2 | H718: 3 | I718: =G718*6+H718 -> 15 | K718: 3 | L718: 7 | M718: =K718*6+L718 -> 25 | O718: 4 | P718: 8 | Q718: =O718*6+P718 -> 32 | S718: WILLIAMSTOWN
A719: WILLIAMSTOWN | C719: 2 | D719: 1 | E719: =C719*6+D719 -> 13 | G719: 3 | H719: 2 | I719: =G719*6+H719 -> 20 | K719: 3 | L719: 3 | M719: =K719*6+L719 -> 21 | O719: 4 | P719: 7 | Q719: =O719*6+P719 -> 31 | S719: FREAME
A720: BEST PLAYERS
A721: PRAHRAN | C721: T .BROWN | F721: HORNIDGE | I721: WESTBROOK | L721: JOHNSON | O721: LYONS | Q721: McINERNEY
A722: WILLIAMSTOWN | C722: WORROLL | F722: WARREN | I722: BARNES | L722: THOMPSON | O722: BARR | Q722: McKINLEY
A723: GOALKICKERS
A724: PRAHRAN | C724: MORTON 2 | F724: LYONS | I724: ROBERTS
A725: WILLIAMSTOWN | C725: WORROLL 2 | F725: WARREN | I725: OUTEN
A727: BRUNSWICK | C727: 0 | D727: 1 | E727: =C727*6+D727 -> 1 | G727: 3 | H727: 2 | I727: =G727*6+H727 -> 20 | K727: 7 | L727: 5 | M727: =K727*6+L727 -> 47 | O727: 7 | P727: 5 | Q727: =O727*6+P727 -> 47 | S727: RICHMOND
A728: RICHMOND | C728: 3 | D728: 1 | E728: =C728*6+D728 -> 19 | G728: 5 | H728: 1 | I728: =G728*6+H728 -> 31 | K728: 6 | L728: 1 | M728: =K728*6+L728 -> 37 | O728: 6 | P728: 4 | Q728: =O728*6+P728 -> 40 | S728: DICK
A729: BEST PLAYERS
A730: BRUNSWICK | C730: T .O'LOUGHLIN | F730: MUDGE | I730: JOHNSON | K730: LANDELLS | N730: McKENZIE | Q730: ROSS
A731: RICHMOND | C731: PARKER | F731: T .WATSON | I731: D. WATSON | K731: EDMUNDS | N731: TATE | Q731: BAHEN
A732: GOALKICKERS
A733: BRUNSWICK | C733: LANDELLS 3 | G733: McKENZIE 3 | K733: JOHNSON
A734: RICHMOND | C734: MILNE 3 | F734: RUDD | H734: DUFF | J734: PARKER
A736: ROUND 19 | E736: 2ND SEPTEMBER | K736: WEATHER | Q736: SHOWERS | W736: TEAM | X736: W | Y736: L | Z736: D | AA736: FOR | AB736: AGST | AC736: % | AD736: PTS
D738: 1ST QTR | H738: 2ND QTR | L738: 3RD QTR | P738: FINAL | S738: AT | X738: LADDER | AA738: ROUND | AC738: 19
S739: PORT MELB
A740: PORT MELBOURNE | C740: 1 | D740: 2 | E740: =C740*6+D740 -> 8 | G740: 2 | H740: 3 | I740: =G740*6+H740 -> 15 | K740: 5 | L740: 4 | M740: =K740*6+L740 -> 34 | O740: 7 | P740: 4 | Q740: =O740*6+P740 -> 46 | S740: UMPIRE | W740: FOOTSCRAY | X740: 16 | Y740: 3 | Z740: 0 | AA740: 963 | AB740: 425 | AC740: 226.58823529411765 | AD740: 64
A741: BRUNSWICK | C741: 2 | D741: 2 | E741: =C741*6+D741 -> 14 | G741: 2 | H741: 2 | I741: =G741*6+H741 -> 14 | K741: 3 | L741: 2 | M741: =K741*6+L741 -> 20 | O741: 4 | P741: 4 | Q741: =O741*6+P741 -> 28 | S741: STRANGER | W741: NORTH MELBOURNE | X741: 15 | Y741: 4 | Z741: 0 | AA741: 1018 | AB741: 607 | AC741: 167.71004942339374 | AD741: 60
A742: BEST PLAYERS | W742: PORT MELBOURNE | X742: 13 | Y742: 6 | Z742: 0 | AA742: 811 | AB742: 667 | AC742: 121.58920539730136 | AD742: 52
A743: PORT MELBOURNE | C743: HICKEY | F743: POWELL | I743: SHEEHAN | K743: MACONACHIE | N743: McDONALD | Q743: McGEE | W743: WILLIAMSTOWN | X743: 10 | Y743: 9 | Z743: 0 | AA743: 621 | AB743: 575 | AC743: 108 | AD743: 40
A744: BRUNSWICK | C744: ROBERTSON | F744: W. ANDREWS | I744: TUCKER | K744: JOHNSTON | N744: McKENZIE | Q744: F.ANDREWS
A745: GOALKICKERS | W745: RICHMOND | X745: 7 | Y745: 12 | Z745: 0 | AA745: 616 | AB745: 807 | AC745: 76.33209417596035 | AD745: 28
A746: PORT MELBOURNE | C746: POWELL 2 | F746: HUTCHINSON | I746: McGEE | K746: PEARS | M746: WARD | O746: KISSACK | W746: PRAHRAN | X746: 7 | Y746: 12 | Z746: 0 | AA746: 637 | AB746: 852 | AC746: 74.77 | AD746: 28
A747: BRUNSWICK | C747: McKENZIE 3 | F747: TUCKER | W747: WEST MELBOURNE | X747: 6 | Y747: 13 | Z747: 0 | AA747: 696 | AB747: 775 | AC747: 89.81 | AD747: 24
W748: BRUNSWICK | X748: 2 | Y748: 17 | Z748: 0 | AA748: 469 | AB748: 1123 | AC748: 41.763134461264471 | AD748: 8
A749: FOOTSCRAY | C749: 6 | D749: 4 | E749: =C749*6+D749 -> 40 | G749: 6 | H749: 6 | I749: =G749*6+H749 -> 42 | K749: 8 | L749: 9 | M749: =K749*6+L749 -> 57 | O749: 8 | P749: 10 | Q749: =O749*6+P749 -> 58 | S749: FOOTSCRAY
A750: WILLIAMSTOWN | C750: 1 | D750: 0 | E750: =C750*6+D750 -> 6 | G750: 2 | H750: 2 | I750: =G750*6+H750 -> 14 | K750: 2 | L750: 2 | M750: =K750*6+L750 -> 14 | O750: 3 | P750: 7 | Q750: =O750*6+P750 -> 25 | S750: FREAME
A751: BEST PLAYERS
A752: FOOTSCRAY | C752: HARRIS | F752: HINCH | H752: DICKENS | K752: ARMSTRONG | N752: GREGORY | Q752: MOLYNEUX
A753: WILLIAMSTOWN | C753: WORROLL | F753: R .HALL | H753: SPRINTALL | K753: RILEY | N753: THOMPSON | Q753: CALDWELL
A754: GOALKICKERS
A755: FOOTSCRAY | C755: GREGORY (3) | F755: DALY | H755: DECOIT | J755: ARMSTRONG | M755: WILLIAMS | O755: MITCHELL
A756: WILLIAMSTOWN | C756: E .HALL (2) | F756: WORROLL
A758: NORTH MELBOURNE | C758: 2 | D758: 3 | E758: =C758*6+D758 -> 15 | G758: 5 | H758: 5 | I758: =G758*6+H758 -> 35 | K758: 7 | L758: 5 | M758: =K758*6+L758 -> 47 | O758: 8 | P758: 7 | Q758: =O758*6+P758 -> 55 | S758: TOORAK PARK
A759: PRAHRAN | C759: 0 | D759: 1 | E759: =C759*6+D759 -> 1 | G759: 1 | H759: 4 | I759: =G759*6+H759 -> 10 | K759: 3 | L759: 6 | M759: =K759*6+L759 -> 24 | O759: 7 | P759: 8 | Q759: =O759*6+P759 -> 50 | S759: POPE
A760: BEST PLAYERS
A761: NORTH MELBOURNE | C761: E .LAUNDER | F761: H .LAUNDER | I761: RUTLEY | K761: KNEE | M761: SICILY | O761: LONDERIGAN
A762: PRAHRAN | C762: LYONS | F762: T .BROWN | I762: G .BROWN | K762: KRUG | M762: WILLISON | O762: DOWNES
A763: GOALKICKERS
A764: NORTH MELBOURNE | C764: MORAN 2 | F764: KNEE 2 | H764: ROLENT | J764: NOONAN | L764: BOYLE | N764: SMITH
A765: PRAHRAN | C765: LYONS 2 | F765: BALL 2 | H765: DOWNES 2 | K765: KRUG
A767: RICHMOND | C767: 4 | D767: 2 | E767: =C767*6+D767 -> 26 | G767: 5 | H767: 5 | I767: =G767*6+H767 -> 35 | K767: 6 | L767: 10 | M767: =K767*6+L767 -> 46 | O767: 8 | P767: 15 | Q767: =O767*6+P767 -> 63 | S767: RICHMOND
A768: WEST MELBOURNE | C768: 1 | D768: 2 | E768: =C768*6+D768 -> 8 | G768: 4 | H768: 6 | I768: =G768*6+H768 -> 30 | K768: 4 | L768: 8 | M768: =K768*6+L768 -> 32 | O768: 6 | P768: 8 | Q768: =O768*6+P768 -> 44 | S768: MURPHY
A769: BEST PLAYERS
A770: RICHMOND | C770: PARKER | F770: RUDD | H770: G. BACKHOUSE | K770: T .WATSON | O770: MILNE | R770: CLARKE
A771: WEST MELBOURNE | C771: FARNAN | F771: BAKER | H771: MANSON | K771: W .MONTGOMERY | O771: MEAGHAN | R771: LINQUIST
A772: GOALKICKERS
A773: RICHMOND | C773: G.BACKHOUSE 4 | G773: MILNE 2 | J773: RUDD | L773: DAVIDSON
A774: WEST MELBOURNE | C774: MILLER 2 | F774: LINQUIST 2 | I774: MORGAN | K774: STONE
A776: ROUND 20 | E776: 9TH SEPTEMBER | I776: WEATHER | W776: TEAM | X776: W | Y776: L | Z776: D | AA776: FOR | AB776: AGST | AC776: % | AD776: PTS
I777: MORNING RAIN FINE AFTERNOON WEST WIND
D778: 1ST QTR | H778: 2ND QTR | L778: 3RD QTR | P778: FINAL | S778: AT | X778: LADDER | AA778: ROUND | AC778: 20
S779: PORT MELB
A780: NORTH MELBOURNE | C780: 5 | D780: 10 | E780: =C780*6+D780 -> 40 | G780: 6 | H780: 12 | I780: =G780*6+H780 -> 48 | K780: 8 | L780: 18 | M780: =K780*6+L780 -> 66 | O780: 11 | P780: 23 | Q780: =O780*6+P780 -> 89 | S780: UMPIRE | W780: FOOTSCRAY | X780: 17 | Y780: 3 | Z780: 0 | AA780: 1005 | AB780: 444 | AC780: 226.35135135135135 | AD780: 68
A781: PORT MELBOURNE | C781: 0 | D781: 1 | E781: =C781*6+D781 -> 1 | G781: 3 | H781: 2 | I781: =G781*6+H781 -> 20 | K781: 3 | L781: 3 | M781: =K781*6+L781 -> 21 | O781: 6 | P781: 7 | Q781: =O781*6+P781 -> 43 | S781: SCHAEFER | W781: NORTH MELBOURNE | X781: 16 | Y781: 4 | Z781: 0 | AA781: 1107 | AB781: 650 | AC781: 170.30769230769232 | AD781: 64
A782: BEST PLAYERS | W782: PORT MELBOURNE | X782: 13 | Y782: 7 | Z782: 0 | AA782: 854 | AB782: 756 | AC782: 112.96296296296296 | AD782: 52
A783: NORTH MELBOURNE | C783: C. SMITH | F783: LONDERIGAN | I783: SICILY | K783: GRAHAM | N783: H .LAUNDER | Q783: ROLENT | W783: WILLIAMSTOWN | X783: 10 | Y783: 10 | Z783: 0 | AA783: 650 | AB783: 609 | AC783: 106.73234811165845 | AD783: 40
A784: PORT MELBOURNE | C784: O'BRIEN | F784: POWELL | I784: SWANNIE | K784: BLAIR | N784: POLLACK | Q784: HICKEY
A785: GOALKICKERS | W785: RICHMOND | X785: 8 | Y785: 12 | Z785: 0 | AA785: 650 | AB785: 836 | AC785: 77.751196172248797 | AD785: 32
A786: NORTH MELBOURNE | C786: KNEE 4 | F786: NOONAN 2 | I786: MORAN 2 | K786: SICILY | N786: RUTLEY | Q786: H .LAUNDER | W786: PRAHRAN | X786: 7 | Y786: 13 | Z786: 0 | AA786: 654 | AB786: 876 | AC786: 74.66 | AD786: 28
A787: PORT MELBOURNE | C787: KISSANE | F787: FRASER | I787: GRIMSHAW | K787: POWELL | N787: McGEE | Q787: WARD | W787: WEST MELBOURNE | X787: 6 | Y787: 14 | Z787: 0 | AA787: 715 | AB787: 817 | AC787: 87.52 | AD787: 24
W788: BRUNSWICK | X788: 3 | Y788: 17 | Z788: 0 | AA788: 493 | AB788: 1140 | AC788: 43.245614035087719 | AD788: 12
A789: FOOTSCRAY | C789: 2 | D789: 5 | E789: =C789*6+D789 -> 17 | G789: 3 | H789: 6 | I789: =G789*6+H789 -> 24 | K789: 5 | L789: 9 | M789: =K789*6+L789 -> 39 | O789: 5 | P789: 12 | Q789: =O789*6+P789 -> 42 | S789: NORTH MELB
A790: WEST MELBOURNE | C790: 1 | D790: 0 | E790: =C790*6+D790 -> 6 | G790: 2 | H790: 1 | I790: =G790*6+H790 -> 13 | K790: 3 | L790: 1 | M790: =K790*6+L790 -> 19 | O790: 3 | P790: 1 | Q790: =O790*6+P790 -> 19 | S790: DICK
A791: BEST PLAYERS
A792: FOOTSCRAY | C792: DICKENS | F792: MARMO | I792: McCARTHY | L792: DALY | N792: GRUNDEN | Q792: ARMSTRONG
A793: WEST MELBOURNE | C793: A .J .SNELL | F793: MILLER | I793: FITZELL | L793: PAGE | N793: HONEY | Q793: KENNEDY
A794: GOALKICKERS
A795: FOOTSCRAY | C795: DALY 3 | F795: DECOIT | I795: GREGORY
A796: WEST MELBOURNE | C796: A .J. SNELL | F796: A .SNELL | I796: FITZELL
A798: RICHMOND | C798: 0 | D798: 3 | E798: =C798*6+D798 -> 3 | G798: 2 | H798: 3 | I798: =G798*6+H798 -> 15 | K798: 4 | L798: 8 | M798: =K798*6+L798 -> 32 | O798: 4 | P798: 10 | Q798: =O798*6+P798 -> 34 | S798: W.TOWN
A799: WILLIAMSTOWN | C799: 1 | D799: 0 | E799: =C799*6+D799 -> 6 | G799: 4 | H799: 1 | I799: =G799*6+H799 -> 25 | K799: 4 | L799: 2 | M799: =K799*6+L799 -> 26 | O799: 4 | P799: 5 | Q799: =O799*6+P799 -> 29 | S799: FREAME
A800: BEST PLAYERS
A801: RICHMOND | C801: TAYLOR | F801: PARKER | I801: T. WATSON | L801: EDMUNDS | O801: GILES | R801: BAHEN
A802: WILLIAMSTOWN | C802: WORROLL | F802: KENNY | I802: ROACH | L802: McKINLEY | O802: R .HALL | R802: McWILLIAMS
A803: GOALKICKERS
A804: RICHMOND | C804: PARKER 2 | F804: SEARLE | I804: C. BACKHOUSE
A805: WILLIAMSTOWN | C805: VINEY 2 | F805: McKINLEY | I805: R .HALL
A807: BRUNSWICK | C807: 0 | D807: 0 | E807: =C807*6+D807 -> 0 | G807: 1 | H807: 5 | I807: =G807*6+H807 -> 11 | K807: 2 | L807: 4 | M807: =K807*6+L807 -> 16 | O807: 3 | P807: 6 | Q807: =O807*6+P807 -> 24 | S807: BRUNSWICK
A808: PRAHRAN | C808: 2 | D808: 3 | E808: =C808*6+D808 -> 15 | G808: 2 | H808: 4 | I808: =G808*6+H808 -> 16 | K808: 2 | L808: 5 | M808: =K808*6+L808 -> 17 | O808: 2 | P808: 5 | Q808: =O808*6+P808 -> 17 | S808: STRANGER
A809: BEST PLAYERS
A810: BRUNSWICK | C810: O'LOUGHLIN | F810: HEGARTY | I810: McKENZIE | K810: COBURN | N810: LANDELLS | Q810: ROBERTSON
A811: PRAHRAN | C811: McINERNEY | F811: DOWDING | I811: G. BROWN | K811: LYONS | N811: JOHNSTON | Q811: WESTBROOK
A812: GOALKICKERS
A813: BRUNSWICK | C813: LANDELLS 2 | G813: ROBERTSON
A814: PRAHRAN | C814: ROBERTS | F814: JAMES
A816: ROUND 21 | E816: 16TH SEPTEMBER | J816: WEATHER | N816: WEST WIND RAIN | W816: TEAM | X816: W | Y816: L | Z816: D | AA816: FOR | AB816: AGST | AC816: % | AD816: PTS
D818: 1ST QTR | H818: 2ND QTR | L818: 3RD QTR | P818: FINAL | S818: AT | X818: LADDER | AA818: ROUND | AC818: 21
S819: TOORAK PARK
A820: PRAHRAN | C820: 2 | D820: 3 | E820: =C820*6+D820 -> 15 | G820: 2 | H820: 3 | I820: =G820*6+H820 -> 15 | K820: 3 | L820: 3 | M820: =K820*6+L820 -> 21 | O820: 3 | P820: 6 | Q820: =O820*6+P820 -> 24 | S820: UMPIRE | W820: FOOTSCRAY | X820: 18 | Y820: 3 | Z820: 0 | AA820: 1078 | AB820: 448 | AC820: 240.625 | AD820: 72
A821: PORT MELBOURNE | C821: 0 | D821: 0 | E821: =C821*6+D821 -> 0 | G821: 1 | H821: 1 | I821: =G821*6+H821 -> 7 | K821: 1 | L821: 1 | M821: =K821*6+L821 -> 7 | O821: 2 | P821: 3 | Q821: =O821*6+P821 -> 15 | S821: DICK | W821: NORTH MELBOURNE | X821: 17 | Y821: 4 | Z821: 0 | AA821: 1140 | AB821: 664 | AC821: 171.68674698795181 | AD821: 68
A822: BEST PLAYERS | W822: PORT MELBOURNE | X822: 13 | Y822: 8 | Z822: 0 | AA822: 869 | AB822: 780 | AC822: 111.41025641025641 | AD822: 52
A823: PRAHRAN | C823: LYONS | F823: McINERNEY | I823: CONQUEST | K823: DOWDING | N823: T .BROWN | Q823: LEVIEN | W823: WILLIAMSTOWN | X823: 11 | Y823: 10 | Z823: 0 | AA823: 694 | AB823: 647 | AC823: 107.26429675425038 | AD823: 44
A824: PORT MELBOURNE | C824: POLLACK | F824: BLAIR | I824: RYAN | K824: SHEEHAN | N824: SWANNIE | Q824: O'BRIEN
A825: GOALKICKERS | W825: PRAHRAN | X825: 8 | Y825: 13 | Z825: 0 | AA825: 678 | AB825: 891 | AC825: 76.09 | AD825: 32
A826: PRAHRAN | C826: ROBERTS 2 | F826: DOWNES | W826: RICHMOND | X826: 8 | Y826: 13 | Z826: 0 | AA826: 654 | AB826: 909 | AC826: 71.947194719471952 | AD826: 32
A827: PORT MELBOURNE | C827: MILLER | F827: RYAN | W827: WEST MELBOURNE | X827: 6 | Y827: 15 | Z827: 0 | AA827: 753 | AB827: 861 | AC827: 87.46 | AD827: 24
W828: BRUNSWICK | X828: 3 | Y828: 18 | Z828: 0 | AA828: 507 | AB828: 1173 | AC828: 43.222506393861892 | AD828: 12
A829: FOOTSCRAY | C829: 2 | D829: 7 | E829: =C829*6+D829 -> 19 | G829: 3 | H829: 11 | I829: =G829*6+H829 -> 29 | K829: 5 | L829: 16 | M829: =K829*6+L829 -> 46 | O829: 9 | P829: 19 | Q829: =O829*6+P829 -> 73 | S829: RICHMOND
A830: RICHMOND | C830: 0 | D830: 0 | E830: =C830*6+D830 -> 0 | G830: 0 | H830: 3 | I830: =G830*6+H830 -> 3 | K830: 0 | L830: 3 | M830: =K830*6+L830 -> 3 | O830: 0 | P830: 4 | Q830: =O830*6+P830 -> 4 | S830: FREAME
A831: BEST PLAYERS
A832: FOOTSCRAY | C832: BROCKWELL | F832: HARRIS | I832: MARMO | K832: GRUNDEN | N832: DICKENS | Q832: GREGORY
A833: RICHMOND | C833: BACKHOUSE | F833: PARKER | I833: TAYLOR | K833: RUDD | N833: T .WATSON | Q833: MILNE
A834: GOALKICKERS
A835: FOOTSCRAY | C835: DALY 3 | F835: DECOIT 3 | I835: MITCHELL 3
A836: RICHMOND | C836: NIL
A838: NORTH MELBOURNE | C838: 1 | D838: 3 | E838: =C838*6+D838 -> 9 | G838: 2 | H838: 4 | I838: =G838*6+H838 -> 16 | K838: 4 | L838: 8 | M838: =K838*6+L838 -> 32 | O838: 4 | P838: 9 | Q838: =O838*6+P838 -> 33 | S838: BRUNSWICK
A839: BRUNSWICK | C839: 1 | D839: 0 | E839: =C839*6+D839 -> 6 | G839: 2 | H839: 2 | I839: =G839*6+H839 -> 14 | K839: 2 | L839: 2 | M839: =K839*6+L839 -> 14 | O839: 2 | P839: 2 | Q839: =O839*6+P839 -> 14 | S839: MURPHY
A840: BEST PLAYERS
A841: NORTH MELBOURNE | C841: KNEE | F841: GRAHAM | H841: SICILY | K841: LONDERIGAN | N841: QUILLIGAN | Q841: NOONAN
A842: BRUNSWICK | C842: ROBERTSON | F842: ROSS | H842: O'LOUGHLIN | K842: McKENZIE | N842: WHELAN | Q842: COBURN
A843: GOALKICKERS
A844: NORTH MELBOURNE | C844: McCAUSLAND | G844: MORAN | J844: KNEE | L844: ROSS
A845: BRUNSWICK | C845: ROSS | F845: McKENZIE | I845: BOWER
A847: WILLIAMSTOWN | C847: 4 | D847: 2 | E847: =C847*6+D847 -> 26 | G847: 4 | H847: 2 | I847: =G847*6+H847 -> 26 | K847: 6 | L847: 8 | M847: =K847*6+L847 -> 44 | O847: 6 | P847: 8 | Q847: =O847*6+P847 -> 44 | S847: WILLIAMSTOWN
A848: WEST MELBOURNE | C848: 0 | D848: 0 | E848: =C848*6+D848 -> 0 | G848: 3 | H848: 5 | I848: =G848*6+H848 -> 23 | K848: 3 | L848: 5 | M848: =K848*6+L848 -> 23 | O848: 5 | P848: 8 | Q848: =O848*6+P848 -> 38 | S848: STRANGER
A849: BEST PLAYERS
A850: WILLIAMSTOWN | C850: WORROLL | F850: WARREN | I850: CALDWELL | K850: THOMPSON | N850: BARNES | Q850: SPRINTALL
A851: WEST MELBOURNE | C851: LINQUIST | F851: MANSON | I851: PAGE | K851: A .J .SNELL | N851: TWITCHETT | Q851: FERGUSSON
A852: GOALKICKERS
A853: WILLIAMSTOWN | C853: WARREN 2 | F853: SPRINTHALL | I853: OUTEN | K853: THOMPSON | N853: WORROLL
A854: WEST MELBOURNE | C854: PAGE 2 | F854: McMURRAY | I854: STONE