A1: Victorian Football Association
A2: Season 1900
A3: © Copyright Wal Williams | F3: First created: 2 August 2014
A4: Contact: joywalwi at gmail dot com | F4: Last updated: 30 July 2017 | W4: VFA Results and tables - Link to the main index page
A5: You are free to copy this document in whole or part provided that proper acknowledgement is given to the author. All rights reserved.
A7: ROUND 1 | E7: 5TH MAY | J7: WEATHER | M7: NORTH WIND
C8: 1ST QTR | G8: 2ND QTR | K8: 3RD QTR | O8: FINAL | S8: AT
A9: FOOTSCRAY | C9: 2 | D9: 1 | E9: =C9*6+D9 -> 13 | G9: 3 | H9: 4 | I9: =G9*6+H9 -> 22 | K9: 7 | L9: 10 | M9: =K9*6+L9 -> 52 | O9: 8 | P9: 11 | Q9: =O9*6+P9 -> 59 | S9: ESSENDON
A10: ESSENDON TOWN | C10: 0 | D10: 3 | E10: =C10*6+D10 -> 3 | G10: 1 | H10: 5 | I10: =G10*6+H10 -> 11 | K10: 1 | L10: 5 | M10: =K10*6+L10 -> 11 | O10: 1 | P10: 6 | Q10: =O10*6+P10 -> 12 | S10: MURPHY | W10: LADDER | AB10: ROUND | AD10: 1
A11: BEST PLAYERS
A12: FOOTSCRAY | D12: DREW | G12: DALY | J12: TODD | M12: MARMO | O12: ROBINSON | R12: McCANCE | W12: TEAM | X12: W | Y12: L | Z12: D | AA12: FOR | AB12: AGST | AC12: % | AD12: PTS
A13: ESSENDON TOWN | D13: BARR | G13: MARTIN | J13: CORCORAN | M13: YOUNG | O13: SHAW | R13: KENNEDY
A14: GOALKICKERS | W14: FOOTSCRAY | X14: 1 | Y14: 0 | Z14: 0 | AA14: 59 | AB14: 12 | AC14: 491.67 | AD14: 4
A15: FOOTSCRAY | D15: DECOIT 3 | G15: DALY 2 | J15: LEIGH | L15: TODD | N15: GREGORY | W15: WILLIAMSTOWN | X15: 1 | Y15: 0 | Z15: 0 | AA15: 34 | AB15: 20 | AC15: 170 | AD15: 4
A16: ESSENDON TOWN | D16: MARTIN | W16: PORT MELBOURNE | X16: 1 | Y16: 0 | Z16: 0 | AA16: 46 | AB16: 33 | AC16: 139.39 | AD16: 4
W17: RICHMOND | X17: 1 | Y17: 0 | Z17: 0 | AA17: 54 | AB17: 47 | AC17: 114.89 | AD17: 4
A18: WILLIAMSTOWN | C18: 1 | D18: 2 | E18: =C18*6+D18 -> 8 | G18: 3 | H18: 5 | I18: =G18*6+H18 -> 23 | K18: 4 | L18: 9 | M18: =K18*6+L18 -> 33 | O18: 4 | P18: 10 | Q18: =O18*6+P18 -> 34 | S18: BRUNSWICK
A19: BRUNSWICK | C19: 1 | D19: 4 | E19: =C19*6+D19 -> 10 | G19: 1 | H19: 6 | I19: =G19*6+H19 -> 12 | K19: 1 | L19: 7 | M19: =K19*6+L19 -> 13 | O19: 2 | P19: 8 | Q19: =O19*6+P19 -> 20 | S19: McWHINNEY | W19: NORTH MELBOURNE | X19: 0 | Y19: 1 | Z19: 0 | AA19: 47 | AB19: 54 | AC19: 87.04 | AD19: 0
A20: BEST PLAYERS | W20: PRAHRAN | X20: 0 | Y20: 1 | Z20: 0 | AA20: 33 | AB20: 46 | AC20: 71.74 | AD20: 0
A21: WILLIAMSTOWN | D21: WHELAN | G21: LEEDS | J21: McKENZIE | M21: TUCKER | O21: ROBERTSON | W21: BRUNSWICK | X21: 0 | Y21: 1 | Z21: 0 | AA21: 20 | AB21: 34 | AC21: 58.82 | AD21: 0
A22: BRUNSWICK | D22: R HALL | G22: HEDLEY | J22: McKINLEY | M22: OUTEN | O22: BARTY | R22: HOUGHTON | W22: ESSENDON TOWN | X22: 0 | Y22: 1 | Z22: 0 | AA22: 12 | AB22: 59 | AC22: 20.34 | AD22: 0
A23: GOALKICKERS | W23: WEST MELBOURNE | X23: 0 | Y23: 0 | Z23: 0 | AA23: 0 | AB23: 0 | AC23: 0 | AD23: 0
A24: WILLIAMSTOWN | D24: GRIMSHAW | G24: HEDLEY | J24: BOND | L24: E HALL
A25: BRUNSWICK | D25: McKENZIE | G25: LANDELLS
A27: PORT MELBOURNE | C27: 2 | D27: 3 | E27: =C27*6+D27 -> 15 | G27: 3 | H27: 3 | I27: =G27*6+H27 -> 21 | K27: 6 | L27: 4 | M27: =K27*6+L27 -> 40 | O27: 7 | P27: 4 | Q27: =O27*6+P27 -> 46 | S27: PORT MELB
A28: PRAHRAN | C28: 1 | D28: 1 | E28: =C28*6+D28 -> 7 | G28: 2 | H28: 2 | I28: =G28*6+H28 -> 14 | K28: 4 | L28: 2 | M28: =K28*6+L28 -> 26 | O28: 5 | P28: 3 | Q28: =O28*6+P28 -> 33 | S28: ARMSTRONG
A29: BEST PLAYERS
A30: PORT MELBOURNE | D30: McGEE | G30: GARBUTT | J30: POLLOCK | M30: PEARS | O30: PENNINGTON | R30: MILLER
A31: PRAHRAN | D31: McINERNEY | G31: T BROWN | J31: G BROWN | M31: CONQUEST | O31: LYONS | R31: DUNN
A32: GOALKICKERS
A33: PORT MELBOURNE | D33: WOODS 2 | G33: MILLER 2 | J33: PENDLETON | M33: McGEE | O33: HUTCHINSON
A34: PRAHRAN | D34: CONQUEST 2 | G34: CUMMINGS | J34: G BROWN | M34: ROBERTS
A36: RICHMOND | C36: 1 | D36: 1 | E36: =C36*6+D36 -> 7 | G36: 4 | H36: 5 | I36: =G36*6+H36 -> 29 | K36: 4 | L36: 5 | M36: =K36*6+L36 -> 29 | O36: 8 | P36: 6 | Q36: =O36*6+P36 -> 54 | S36: NORTH MELB
A37: NORTH MELBOURNE | C37: 3 | D37: 4 | E37: =C37*6+D37 -> 22 | G37: 3 | H37: 4 | I37: =G37*6+H37 -> 22 | K37: 5 | L37: 10 | M37: =K37*6+L37 -> 40 | O37: 6 | P37: 11 | Q37: =O37*6+P37 -> 47 | S37: DEVINE
A38: BEST PLAYERS
A39: RICHMOND | D39: PARKER | G39: RUDD | J39: BAHEN | M39: BACKHOUSE
A40: NORTH MELBOURNE | D40: LEGGE | G40: NOONAN | J40: SMITH | M40: McSWEENEY | P40: RUTLEY
A41: GOALKICKERS
A42: RICHMOND | D42: G BACKHOUSE 3 | H42: BAHEN 2 | K42: LOTT 2 | N42: C BACKHOUSE
A43: NORTH MELBOURNE | D43: RUTLEY 3 | H43: C SMITH | K43: GEGGIE | N43: WHITFIELD
A45: BYE | C45: WEST MELBOURNE
A47: ROUND 2 | E47: 12TH MAY | J47: WEATHER | M47: NORTH WIND GROUNDS WET
C48: 1ST QTR | G48: 2ND QTR | K48: 3RD QTR | O48: FINAL | S48: AT
A49: WILLIAMSTOWN | C49: 1 | D49: 2 | E49: =C49*6+D49 -> 8 | G49: 2 | H49: 3 | I49: =G49*6+H49 -> 15 | K49: 4 | L49: 7 | M49: =K49*6+L49 -> 31 | O49: 5 | P49: 8 | Q49: =O49*6+P49 -> 38 | S49: WILLIAMSTOWN
A50: NORTH MELBOURNE | C50: 0 | D50: 1 | E50: =C50*6+D50 -> 1 | G50: 3 | H50: 2 | I50: =G50*6+H50 -> 20 | K50: 3 | L50: 4 | M50: =K50*6+L50 -> 22 | O50: 3 | P50: 6 | Q50: =O50*6+P50 -> 24 | S50: ARMSTRONG
A51: BEST PLAYERS | W51: LADDER | AB51: ROUND | AD51: 2
A52: WILLIAMSTOWN | D52: HEDLEY | G52: W HALL | J52: R HALL | L52: BARTY | N52: RILEY | Q52: HOUGHTON
A53: NORTH MELBOURNE | D53: NOONAN | G53: McDERMOTT | J53: SICILY | L53: GRAHAM | N53: P SMITH | Q53: J SMITH | W53: TEAM | X53: W | Y53: L | Z53: D | AA53: FOR | AB53: AGST | AC53: % | AD53: PTS
A54: GOALKICKERS
A55: WILLIAMSTOWN | D55: GRIMSHAW | G55: HOUGHTON | J55: BARTY | L55: GUTHRIE | O55: McKINLEY | W55: FOOTSCRAY | X55: 2 | Y55: 0 | Z55: 0 | AA55: 129 | AB55: 25 | AC55: 516 | AD55: 8
A56: NORTH MELBOURNE | D56: GRAHAM | G56: SICILY | J56: COVE | W56: WILLIAMSTOWN | X56: 2 | Y56: 0 | Z56: 0 | AA56: 72 | AB56: 44 | AC56: 163.64 | AD56: 8
W57: RICHMOND | X57: 2 | Y57: 0 | Z57: 0 | AA57: 74 | AB57: 63 | AC57: 117.46 | AD57: 8
A58: RICHMOND | C58: 1 | D58: 2 | E58: =C58*6+D58 -> 8 | G58: 1 | H58: 3 | I58: =G58*6+H58 -> 9 | K58: 1 | L58: 7 | M58: =K58*6+L58 -> 13 | O58: 2 | P58: 8 | Q58: =O58*6+P58 -> 20 | S58: RICHMOND | W58: BRUNSWICK | X58: 1 | Y58: 1 | Z58: 0 | AA58: 45 | AB58: 48 | AC58: 93.75 | AD58: 4
A59: ESSENDON TOWN | C59: 1 | D59: 7 | E59: =C59*6+D59 -> 13 | G59: 1 | H59: 8 | I59: =G59*6+H59 -> 14 | K59: 1 | L59: 8 | M59: =K59*6+L59 -> 14 | O59: 1 | P59: 10 | Q59: =O59*6+P59 -> 16 | S59: KENNISON
A60: BEST PLAYERS | W60: PORT MELBOURNE | X60: 1 | Y60: 1 | Z60: 0 | AA60: 59 | AB60: 103 | AC60: 57.28 | AD60: 4
A61: RICHMOND | D61: T WATSON | G61: D WATSON | J61: BAHEN | M61: MILNE | O61: C BACKHOUSE | R61: GILES | W61: NORTH MELBOURNE | X61: 0 | Y61: 2 | Z61: 0 | AA61: 71 | AB61: 92 | AC61: 77.17 | AD61: 4
A62: ESSENDON TOWN | D62: SWEETMAN | G62: ARCHER | J62: BREESE | M62: DOWNIE | O62: KENNEDY | R62: BARR | W62: PRAHRAN | X62: 0 | Y62: 1 | Z62: 0 | AA62: 33 | AB62: 46 | AC62: 71.74 | AD62: 0
A63: GOALKICKERS | W63: WEST MELBOURNE | X63: 0 | Y63: 1 | Z63: 0 | AA63: 14 | AB63: 25 | AC63: 56 | AD63: 0
A64: RICHMOND | D64: C BACKHOUSE | G64: PARKER | W64: ESSENDON TOWN | X64: 0 | Y64: 2 | Z64: 0 | AA64: 28 | AB64: 79 | AC64: 35.44 | AD64: 0
A65: ESSENDON TOWN | D65: BREESE
A67: BRUNSWICK | C67: 0 | D67: 2 | E67: =C67*6+D67 -> 2 | G67: 1 | H67: 6 | I67: =G67*6+H67 -> 12 | K67: 3 | L67: 7 | M67: =K67*6+L67 -> 25 | O67: 3 | P67: 7 | Q67: =O67*6+P67 -> 25 | S67: W.M.
A68: WEST MELBOURNE | C68: 0 | D68: 6 | E68: =C68*6+D68 -> 6 | G68: 0 | H68: 6 | I68: =G68*6+H68 -> 6 | K68: 0 | L68: 7 | M68: =K68*6+L68 -> 7 | O68: 1 | P68: 8 | Q68: =O68*6+P68 -> 14 | S68: STRANGER
A69: BEST PLAYERS
A70: BRUNSWICK | D70: ROBERTSON | G70: VILLAINE | J70: LOGAN | M70: LANDELLS | P70: HARRIS | S70: FRANKLYN
A71: WEST MELBOURNE | D71: PAGE | G71: LIVINGSTONE | J71: MANSON | M71: MONTGOMERY | P71: WILLIAMS | S71: JACKSON
A72: GOALKICKERS
A73: BRUNSWICK | D73: LANDELLS 2 | G73: TEMPLE
A74: WEST MELBOURNE | D74: ROOKE
A76: FOOTSCRAY | C76: 2 | D76: 1 | E76: =C76*6+D76 -> 13 | G76: 4 | H76: 5 | I76: =G76*6+H76 -> 29 | K76: 7 | L76: 9 | M76: =K76*6+L76 -> 51 | O76: 10 | P76: 10 | Q76: =O76*6+P76 -> 70 | S76: FOOTSCRAY
A77: PORT MELBOURNE | C77: 0 | D77: 0 | E77: =C77*6+D77 -> 0 | G77: 0 | H77: 0 | I77: =G77*6+H77 -> 0 | K77: 0 | L77: 0 | M77: =K77*6+L77 -> 0 | O77: 2 | P77: 1 | Q77: =O77*6+P77 -> 13 | S77: DICK
A78: BEST PLAYERS
A79: FOOTSCRAY | D79: DREW | G79: ROBINSON | J79: MARMO | M79: HINCH | P79: McCARTHY | S79: GRUNDEN
A80: PORT MELBOURNE | D80: POLLOCK | G80: SWANNIE | J80: HASSETT | M80: PEARS | P80: FAYLE | S80: McCONACHIE
A81: GOALKICKERS
A82: FOOTSCRAY | D82: GREGORY 4 | G82: KRUSE 2 | J82: DE COIT 2 | M82: DALY | O82: MOLYNEUX
A83: PORT MELBOURNE | D83: MILLER | G83: HASSETT
A85: BYE | C85: PRAHRAN
A87: ROUND 3 | E87: 19TH MAY | J87: WEATHER | M87: RAIN
C88: 1ST QTR | G88: 2ND QTR | K88: 3RD QTR | O88: FINAL | S88: AT
A89: WILLIAMSTOWN | C89: 1 | D89: 2 | E89: =C89*6+D89 -> 8 | G89: 2 | H89: 9 | I89: =G89*6+H89 -> 21 | K89: 3 | L89: 9 | M89: =K89*6+L89 -> 27 | O89: 4 | P89: 15 | Q89: =O89*6+P89 -> 39 | S89: RICHMOND
A90: RICHMOND | C90: 0 | D90: 0 | E90: =C90*6+D90 -> 0 | G90: 0 | H90: 0 | I90: =G90*6+H90 -> 0 | K90: 2 | L90: 2 | M90: =K90*6+L90 -> 14 | O90: 3 | P90: 2 | Q90: =O90*6+P90 -> 20 | S90: DEVINE
A91: BEST PLAYERS
A92: WILLIAMSTOWN | D92: CALDWELL | G92: OUTEN | I92: SPRINTHALL | L92: BARTY | N92: R HALL | Q92: BARNES | W92: LADDER | AB92: ROUND | AD92: 3
A93: RICHMOND | D93: PARKER | G93: RUDD | I93: C BACKHOUSE | L93: KEARNES | N93: D WATSON | Q93: T WATSON
A94: GOALKICKERS | W94: TEAM | X94: W | Y94: L | Z94: D | AA94: FOR | AB94: AGST | AC94: % | AD94: PTS
A95: WILLIAMSTOWN | D95: McKINLEY | G95: BOND | J95: HOUGHTON
A96: RICHMOND | D96: McNAIR | G96: SLOSS | J96: MILNE | W96: FOOTSCRAY | X96: 3 | Y96: 0 | Z96: 0 | AA96: 155 | AB96: 30 | AC96: 516.67 | AD96: 12
W97: WILLIAMSTOWN | X97: 3 | Y97: 0 | Z97: 0 | AA97: 111 | AB97: 64 | AC97: 173.44 | AD97: 12
A98: PRAHRAN | C98: 1 | D98: 1 | E98: =C98*6+D98 -> 7 | G98: 2 | H98: 7 | I98: =G98*6+H98 -> 19 | K98: 3 | L98: 9 | M98: =K98*6+L98 -> 27 | O98: 4 | P98: 10 | Q98: =O98*6+P98 -> 34 | S98: TOORAK PK | W98: RICHMOND | X98: 2 | Y98: 1 | Z98: 0 | AA98: 94 | AB98: 102 | AC98: 92.16 | AD98: 8
A99: ESSENDON TOWN | C99: 1 | D99: 0 | E99: =C99*6+D99 -> 6 | G99: 1 | H99: 0 | I99: =G99*6+H99 -> 6 | K99: 2 | L99: 2 | M99: =K99*6+L99 -> 14 | O99: 2 | P99: 4 | Q99: =O99*6+P99 -> 16 | S99: MURPHY | W99: PORT MELBOURNE | X99: 2 | Y99: 1 | Z99: 0 | AA99: 87 | AB99: 121 | AC99: 71.9 | AD99: 8
A100: BEST PLAYERS
A101: PRAHRAN | D101: CONQUEST | G101: T BROWN | J101: DUNNE | M101: McINERNEY | O101: JAMES | R101: WILLISON | W101: PRAHRAN | X101: 1 | Y101: 1 | Z101: 0 | AA101: 67 | AB101: 62 | AC101: 108.06 | AD101: 4
A102: ESSENDON TOWN | D102: BARR | G102: G SMITH | J102: G SHAW | M102: FLEMING | O102: SHELDON | R102: WILLIAMS | W102: BRUNSWICK | X102: 1 | Y102: 1 | Z102: 0 | AA102: 45 | AB102: 48 | AC102: 93.75 | AD102: 4
A103: GOALKICKERS | W103: NORTH MELBOURNE | X103: 0 | Y103: 3 | Z103: 0 | AA103: 76 | AB103: 118 | AC103: 64.41 | AD103: 0
A104: PRAHRAN | D104: ROBERTS 2 | G104: CONQUEST | J104: JAMES | W104: WEST MELBOURNE | X104: 0 | Y104: 2 | Z104: 0 | AA104: 32 | AB104: 53 | AC104: 60.38 | AD104: 0
A105: ESSENDON TOWN | D105: SHELDON | G105: CORCORAN | W105: ESSENDON TOWN | X105: 0 | Y105: 3 | Z105: 0 | AA105: 44 | AB105: 113 | AC105: 38.94 | AD105: 0
A107: FOOTSCRAY | C107: 0 | D107: 0 | E107: =C107*6+D107 -> 0 | G107: 1 | H107: 3 | I107: =G107*6+H107 -> 9 | K107: 3 | L107: 6 | M107: =K107*6+L107 -> 24 | O107: 3 | P107: 8 | Q107: =O107*6+P107 -> 26 | S107: NORTH MELB
A108: NORTH MELBOURNE | C108: 0 | D108: 2 | E108: =C108*6+D108 -> 2 | G108: 0 | H108: 3 | I108: =G108*6+H108 -> 3 | K108: 0 | L108: 3 | M108: =K108*6+L108 -> 3 | O108: 0 | P108: 5 | Q108: =O108*6+P108 -> 5 | S108: McWHINNEY
A109: BEST PLAYERS
A110: FOOTSCRAY | D110: MARMO | G110: KRUSE | J110: DREW | L110: SERBY | O110: ROBINSON | R110: McCARTHY
A111: NORTH MELBOURNE | D111: NOONAN | G111: SICILY | J111: GEGGIE | L111: ROLENT | O111: LONERGAN | R111: McSWEENEY
A112: GOALKICKERS
A113: FOOTSCRAY | D113: McCANCE | G113: DREW | J113: MONTGARRETT
A114: NORTH MELBOURNE | D114: NIL
A116: PORT MELBOURNE | C116: 1 | D116: 1 | E116: =C116*6+D116 -> 7 | G116: 2 | H116: 2 | I116: =G116*6+H116 -> 14 | K116: 3 | L116: 2 | M116: =K116*6+L116 -> 20 | O116: 4 | P116: 4 | Q116: =O116*6+P116 -> 28 | S116: PORT MELB
A117: WEST MELBOURNE | C117: 0 | D117: 2 | E117: =C117*6+D117 -> 2 | G117: 1 | H117: 3 | I117: =G117*6+H117 -> 9 | K117: 2 | L117: 6 | M117: =K117*6+L117 -> 18 | O117: 2 | P117: 6 | Q117: =O117*6+P117 -> 18 | S117: KENNISON
A118: BEST PLAYERS
A119: PORT MELBOURNE | D119: McGEE | G119: HICKEY | J119: POLLOCK | L119: POWELL | O119: NICKEL | R119: O'BRIEN
A120: WEST MELBOURNE | D120: PAGE | G120: MANSON | J120: WILLIAMS | L120: STONE | O120: DOUGLAS | R120: KENNEDY
A121: GOALKICKERS
A122: PORT MELBOURNE | D122: HUTCHINSON | G122: WOODS | J122: HEALY | L122: MILLER
A123: WEST MELBOURNE | D123: WILLIAMS | G123: STONE
A125: BYE | C125: BRUNSWICK
A127: ROUND 4 | E127: 24TH MAY | H127: QUEENS BIRTHDAY | L127: WEATHER | O127: RAIN
C128: 1ST QTR | G128: 2ND QTR | K128: 3RD QTR | O128: FINAL | S128: AT
A129: FOOTSCRAY | C129: 4 | D129: 1 | E129: =C129*6+D129 -> 25 | G129: 8 | H129: 6 | I129: =G129*6+H129 -> 54 | K129: 11 | L129: 8 | M129: =K129*6+L129 -> 74 | O129: 16 | P129: 12 | Q129: =O129*6+P129 -> 108 | S129: FOOTSCRAY | W129: LADDER | AB129: ROUND | AD129: 4
A130: WEST MELBOURNE | C130: 0 | D130: 0 | E130: =C130*6+D130 -> 0 | G130: 1 | H130: 0 | I130: =G130*6+H130 -> 6 | K130: 1 | L130: 1 | M130: =K130*6+L130 -> 7 | O130: 1 | P130: 5 | Q130: =O130*6+P130 -> 11 | S130: DEVINE
A131: BEST PLAYERS | W131: TEAM | X131: W | Y131: L | Z131: D | AA131: FOR | AB131: AGST | AC131: % | AD131: PTS
A132: FOOTSCRAY | D132: DREW | F132: SERBY | I132: TODD | K132: KRUSE | N132: DALY | P132: MITCHELL
A133: WEST MELBOURNE | D133: PAGE | F133: LIVINGSTONE | I133: KENNEDY | K133: MANSON | N133: ROOKE | P133: MONTGOMERY | W133: FOOTSCRAY | X133: 4 | Y133: 0 | Z133: 0 | AA133: 263 | AB133: 41 | AC133: 641.46 | AD133: 16
A134: GOALKICKERS | Q134: MOLYNEUX | W134: WILLIAMSTOWN | X134: 4 | Y134: 0 | Z134: 0 | AA134: 134 | AB134: 86 | AC134: 155.81 | AD134: 16
A135: FOOTSCRAY | D135: DALY 4 | F135: MITCHELL 3 | I135: DECOIT 2 | K135: GREGORY 2 | N135: HOOD 2 | P135: GRUNDEN | R135: DICKENS | W135: RICHMOND | X135: 3 | Y135: 1 | Z135: 0 | AA135: 129 | AB135: 135 | AC135: 95.56 | AD135: 12
A136: WEST MELBOURNE | D136: WILLIAMS | W136: PORT MELBOURNE | X136: 2 | Y136: 1 | Z136: 0 | AA136: 87 | AB136: 121 | AC136: 71.9 | AD136: 8
A138: WILLIAMSTOWN | C138: 0 | D138: 1 | E138: =C138*6+D138 -> 1 | G138: 2 | H138: 3 | I138: =G138*6+H138 -> 15 | K138: 2 | L138: 5 | M138: =K138*6+L138 -> 17 | O138: 3 | P138: 5 | Q138: =O138*6+P138 -> 23 | S138: ESSENDON | W138: BRUNSWICK | X138: 1 | Y138: 2 | Z138: 0 | AA138: 78 | AB138: 83 | AC138: 93.98 | AD138: 4
A139: ESSENDON TOWN | C139: 0 | D139: 0 | E139: =C139*6+D139 -> 0 | G139: 1 | H139: 0 | I139: =G139*6+H139 -> 6 | K139: 3 | L139: 2 | M139: =K139*6+L139 -> 20 | O139: 3 | P139: 4 | Q139: =O139*6+P139 -> 22 | S139: STRANGER | W139: NORTH MELBOURNE | X139: 1 | Y139: 3 | Z139: 0 | AA139: 133 | AB139: 145 | AC139: 91.72 | AD139: 4
A140: BEST PLAYERS | W140: PRAHRAN | X140: 1 | Y140: 2 | Z140: 0 | AA140: 94 | AB140: 119 | AC140: 78.99 | AD140: 4
A141: WILLIAMSTOWN | D141: WARREN | G141: VINEY | J141: R HALL | L141: W HALL | N141: BARTY | Q141: CALDWELL | W141: ESSENDON TOWN | X141: 0 | Y141: 4 | Z141: 0 | AA141: 66 | AB141: 136 | AC141: 48.33 | AD141: 0
A142: ESSENDON TOWN | D142: FLEMING | G142: DOWNING | J142: G SHAW | L142: BARR | N142: SWEATMAN | Q142: WILLIAMS | W142: WEST MELBOURNE | X142: 0 | Y142: 3 | Z142: 0 | AA142: 43 | AB142: 161 | AC142: 26.71 | AD142: 0
A143: GOALKICKERS
A144: WILLIAMSTOWN | D144: BARTY 2 | G144: HOUSTEN
A145: ESSENDON TOWN | D145: BREESE | G145: MARTIN | J145: RAMSAY
A147: NORTH MELBOURNE | C147: 2 | D147: 2 | E147: =C147*6+D147 -> 14 | G147: 5 | H147: 4 | I147: =G147*6+H147 -> 34 | K147: 7 | L147: 5 | M147: =K147*6+L147 -> 47 | O147: 8 | P147: 9 | Q147: =O147*6+P147 -> 57 | S147: TOORAK PK
A148: PRAHRAN | C148: 1 | D148: 4 | E148: =C148*6+D148 -> 10 | G148: 1 | H148: 4 | I148: =G148*6+H148 -> 10 | K148: 3 | L148: 7 | M148: =K148*6+L148 -> 25 | O148: 3 | P148: 9 | Q148: =O148*6+P148 -> 27 | S148: ARMSTRONG
A149: BEST PLAYERS
A150: NORTH MELBOURNE | D150: NOONAN | G150: SICILY | J150: GEGGIE | M150: ETHEL | O150: McCAUSLAND | R150: RUTLEY
A151: PRAHRAN | D151: CONQUEST | G151: McINERNEY | J151: LYONS | M151: DOWDING | O151: T BROWN | R151: WILLIAMS
A152: GOALKICKERS
A153: NORTH MELBOURNE | D153: RUTLEY 3 | G153: KNEE 2 | J153: SICILY | L153: GEGGIE | N153: NOONAN
A154: PRAHRAN | D154: ROBERTS | G154: G BROWN | J154: LYONS
A156: RICHMOND | C156: 1 | D156: 3 | E156: =C156*6+D156 -> 9 | G156: 3 | H156: 5 | I156: =G156*6+H156 -> 23 | K156: 4 | L156: 7 | M156: =K156*6+L156 -> 31 | O156: 4 | P156: 11 | Q156: =O156*6+P156 -> 35 | S156: BRUNSWICK
A157: BRUNSWICK | C157: 2 | D157: 2 | E157: =C157*6+D157 -> 14 | G157: 2 | H157: 3 | I157: =G157*6+H157 -> 15 | K157: 3 | L157: 8 | M157: =K157*6+L157 -> 26 | O157: 4 | P157: 9 | Q157: =O157*6+P157 -> 33 | S157: DICK
A158: BEST PLAYERS
A159: RICHMOND | D159: PARKER | G159: RUDD | J159: T WATSON | L159: C BACKHOUSE | O159: BAHEN | R159: McNAIR
A160: BRUNSWICK | D160: O'LOUGHLIN | G160: ROBERTSON | J160: TEMPLE | L160: McKENZIE | O160: ANDREWS | R160: TOUGH
A161: GOALKICKERS
A162: RICHMOND | D162: McNAIR | G162: PARKER | J162: G BACKHOUSE | M162: SWIFT
A163: BRUNSWICK | D163: ROBERTSON | G163: TEMPLE | J163: LEEDS
A165: BYE | C165: PORT MELBOURNE
A167: ROUND 5 | E167: 26TH MAY | I167: WEATHER | L167: CLOUDY BUT FINE
C168: 1ST QTR | G168: 2ND QTR | K168: 3RD QTR | O168: FINAL | S168: AT
A169: WILLIAMSTOWN | C169: 1 | D169: 2 | E169: =C169*6+D169 -> 8 | G169: 2 | H169: 5 | I169: =G169*6+H169 -> 17 | K169: 3 | L169: 11 | M169: =K169*6+L169 -> 29 | O169: 3 | P169: 14 | Q169: =O169*6+P169 -> 32 | S169: WILLIAMSTOWN | W169: LADDER | AB169: ROUND | AD169: 5
A170: PORT MELBOURNE | C170: 2 | D170: 2 | E170: =C170*6+D170 -> 14 | G170: 2 | H170: 3 | I170: =G170*6+H170 -> 15 | K170: 2 | L170: 3 | M170: =K170*6+L170 -> 15 | O170: 3 | P170: 5 | Q170: =O170*6+P170 -> 23 | S170: ARMSTRONG
A171: BEST PLAYERS | W171: TEAM | X171: W | Y171: L | Z171: D | AA171: FOR | AB171: AGST | AC171: % | AD171: PTS
A172: WILLIAMSTOWN | D172: WARREN | G172: W HALL | J172: R HALL | L172: CALDWELL | O172: RILEY | Q172: HOUGHTON
A173: PORT MELBOURNE | D173: HASSETT | G173: PEARS | J173: POLLOCK | L173: NICKELL | O173: O'BRIEN | Q173: GARBUTT | W173: WILLIAMSTOWN | X173: 5 | Y173: 0 | Z173: 0 | AA173: 166 | AB173: 109 | AC173: 152.29 | AD173: 20
A174: GOALKICKERS | W174: FOOTSCRAY | X174: 4 | Y174: 0 | Z174: 0 | AA174: 263 | AB174: 41 | AC174: 641.46 | AD174: 16
A175: WILLIAMSTOWN | D175: WARREN 2 | G175: HOUGHTON | W175: RICHMOND | X175: 4 | Y175: 1 | Z175: 0 | AA175: 167 | AB175: 162 | AC175: 103.09 | AD175: 16
A176: PORT MELBOURNE | D176: PEARS 3 | W176: BRUNSWICK | X176: 2 | Y176: 2 | Z176: 0 | AA176: 108 | AB176: 99 | AC176: 109.09 | AD176: 8
A178: WEST MELBOURNE | C178: 0 | D178: 0 | E178: =C178*6+D178 -> 0 | G178: 1 | H178: 2 | I178: =G178*6+H178 -> 8 | K178: 2 | L178: 4 | M178: =K178*6+L178 -> 16 | O178: 4 | P178: 6 | Q178: =O178*6+P178 -> 30 | S178: NORTH MELB | W178: PORT MELBOURNE | X178: 2 | Y178: 2 | Z178: 0 | AA178: 110 | AB178: 153 | AC178: 71.9 | AD178: 8
A179: ESSENDON TOWN | C179: 3 | D179: 3 | E179: =C179*6+D179 -> 21 | G179: 3 | H179: 4 | I179: =G179*6+H179 -> 22 | K179: 3 | L179: 5 | M179: =K179*6+L179 -> 23 | O179: 3 | P179: 7 | Q179: =O179*6+P179 -> 25 | S179: MURPHY | W179: NORTH MELBOURNE | X179: 1 | Y179: 4 | Z179: 0 | AA179: 149 | AB179: 175 | AC179: 85.14 | AD179: 4
A180: BEST PLAYERS | W180: PRAHRAN | X180: 1 | Y180: 3 | Z180: 0 | AA180: 121 | AB180: 157 | AC180: 77.07 | AD180: 4
A181: WEST MELBOURNE | D181: PAGE | F181: LIVINGSTONE | I181: MANSON | L181: MEAGHAN | O181: MONTGOMERY | R181: HIGGINS | W181: WEST MELBOURNE | X181: 1 | Y181: 3 | Z181: 0 | AA181: 73 | AB181: 186 | AC181: 39.25 | AD181: 4
A182: ESSENDON TOWN | D182: BARR | F182: ARMSTRONG | I182: CORCORAN | L182: SWEATMAN | O182: FLEMING | R182: ARCHER | W182: ESSENDON TOWN | X182: 0 | Y182: 5 | Z182: 0 | AA182: 91 | AB182: 166 | AC182: 54.82 | AD182: 0
A183: GOALKICKERS
A184: WEST MELBOURNE | D184: STONE 2 | G184: TWITCHETT | J184: MORGAN
A185: ESSENDON TOWN | D185: CORCORAN 2 | G185: RAMSAY
A187: RICHMOND | C187: 2 | D187: 3 | E187: =C187*6+D187 -> 15 | G187: 4 | H187: 5 | I187: =G187*6+H187 -> 29 | K187: 5 | L187: 6 | M187: =K187*6+L187 -> 36 | O187: 5 | P187: 8 | Q187: =O187*6+P187 -> 38 | S187: RICHMOND
A188: PRAHRAN | C188: 2 | D188: 2 | E188: =C188*6+D188 -> 14 | G188: 3 | H188: 4 | I188: =G188*6+H188 -> 22 | K188: 3 | L188: 6 | M188: =K188*6+L188 -> 24 | O188: 3 | P188: 9 | Q188: =O188*6+P188 -> 27 | S188: FINNIGAN
A189: BEST PLAYERS
A190: RICHMOND | D190: McNAIR | G190: O'NEILL | J190: PARKER | M190: LOTT | O190: DAVIDSON | R190: BACKHOUSE
A191: PRAHRAN | D191: LYONS | G191: DUNNE | J191: CONQUEST | M191: McINERNEY | O191: JAMES | R191: ROBERTS
A192: GOALKICKERS
A193: RICHMOND | D193: LOTT 3 | G193: G BACKHOUSE 2
A194: PRAHRAN | D194: ROBERTS 2 | G194: McINERNEY
A196: BRUNSWICK | C196: 0 | D196: 4 | E196: =C196*6+D196 -> 4 | G196: 1 | H196: 9 | I196: =G196*6+H196 -> 15 | K196: 2 | L196: 10 | M196: =K196*6+L196 -> 22 | O196: 3 | P196: 12 | Q196: =O196*6+P196 -> 30 | S196: BRUNSWICK
A197: NORTH MELBOURNE | C197: 1 | D197: 1 | E197: =C197*6+D197 -> 7 | G197: 2 | H197: 2 | I197: =G197*6+H197 -> 14 | K197: 2 | L197: 4 | M197: =K197*6+L197 -> 16 | O197: 2 | P197: 4 | Q197: =O197*6+P197 -> 16 | S197: McWHINNEY
A198: BEST PLAYERS
A199: BRUNSWICK | D199: O'LOUGHLIN | G199: WHELAN | J199: McKENZIE | M199: GOUGH | O199: CASEY | R199: ROBERTSON
A200: NORTH MELBOURNE | D200: NOONAN | G200: McCAUSLAND | J200: SICILY | M200: REEKIE | O200: P SMITH | R200: SMITH
A201: GOALKICKERS
A202: BRUNSWICK | D202: CASEY 2 | G202: WHELAN
A203: NORTH MELBOURNE | D203: GARVAN | G203: SICILY
A205: BYE | C205: FOOTSCRAY
A207: ROUND 6 | E207: 2ND JUNE | I207: WEATHER | L207: RAIN A.M. THEN SHOWERS
C208: 1ST QTR | G208: 2ND QTR | K208: 3RD QTR | O208: FINAL | S208: AT
A209: WILLIAMSTOWN | C209: 1 | D209: 4 | E209: =C209*6+D209 -> 10 | G209: 2 | H209: 4 | I209: =G209*6+H209 -> 16 | K209: 4 | L209: 4 | M209: =K209*6+L209 -> 28 | O209: 5 | P209: 5 | Q209: =O209*6+P209 -> 35 | S209: NORTH MELB | W209: LADDER | AB209: ROUND | AD209: 6
A210: WEST MELBOURNE | C210: 0 | D210: 2 | E210: =C210*6+D210 -> 2 | G210: 0 | H210: 5 | I210: =G210*6+H210 -> 5 | K210: 0 | L210: 8 | M210: =K210*6+L210 -> 8 | O210: 1 | P210: 10 | Q210: =O210*6+P210 -> 16 | S210: DICK
A211: BEST PLAYERS | W211: TEAM | X211: W | Y211: L | Z211: D | AA211: FOR | AB211: AGST | AC211: % | AD211: PTS
A212: WILLIAMSTOWN | D212: BREMNER | F212: W HALL | I212: R HALL | K212: CALDWELL | N212: WARREN | Q212: HOUSTEN
A213: WEST MELBOURNE | D213: PAGE | F213: LIVINGSTONE | I213: CLANCIE | K213: LINQUIST | N213: WILLIAMS | Q213: KENNEDY | W213: WILLIAMSTOWN | X213: 6 | Y213: 0 | Z213: 0 | AA213: 201 | AB213: 125 | AC213: 160.8 | AD213: 24
A214: GOALKICKERS | W214: FOOTSCRAY | X214: 5 | Y214: 0 | Z214: 0 | AA214: 318 | AB214: 67 | AC214: 474.63 | AD214: 20
A215: WILLIAMSTOWN | D215: ROWAN 4 | G215: HAY | W215: RICHMOND | X215: 5 | Y215: 1 | Z215: 0 | AA215: 211 | AB215: 190 | AC215: 111.05 | AD215: 20
A216: WEST MELBOURNE | D216: TWITCHETT | W216: BRUNSWICK | X216: 2 | Y216: 3 | Z216: 0 | AA216: 125 | AB216: 141 | AC216: 88.65 | AD216: 8
A218: ESSENDON TOWN | C218: 2 | D218: 1 | E218: =C218*6+D218 -> 13 | G218: 4 | H218: 4 | I218: =G218*6+H218 -> 28 | K218: 4 | L218: 6 | M218: =K218*6+L218 -> 30 | O218: 6 | P218: 6 | Q218: =O218*6+P218 -> 42 | S218: ESSENDON | W218: PORT MELBOURNE | X218: 2 | Y218: 3 | Z218: 0 | AA218: 138 | AB218: 197 | AC218: 70.05 | AD218: 8
A219: BRUNSWICK | C219: 1 | D219: 0 | E219: =C219*6+D219 -> 6 | G219: 1 | H219: 5 | I219: =G219*6+H219 -> 11 | K219: 1 | L219: 5 | M219: =K219*6+L219 -> 11 | O219: 2 | P219: 5 | Q219: =O219*6+P219 -> 17 | S219: STRANGER | W219: NORTH MELBOURNE | X219: 1 | Y219: 4 | Z219: 0 | AA219: 149 | AB219: 175 | AC219: 85.14 | AD219: 4
A220: BEST PLAYERS | W220: ESSENDON TOWN | X220: 1 | Y220: 5 | Z220: 0 | AA220: 133 | AB220: 183 | AC220: 72.68 | AD220: 4
A221: ESSENDON TOWN | D221: WILLIAMS | G221: TESTER | J221: FLEMING | M221: BROWN | O221: CHARLES | R221: WATTS | W221: PRAHRAN | X221: 1 | Y221: 4 | Z221: 0 | AA221: 147 | AB221: 212 | AC221: 69.34 | AD221: 4
A222: BRUNSWICK | D222: CRAVEN | G222: O'LOUGHLIN | J222: WHELAN | M222: MCKENZIE | O222: LEEDS | R222: ROBERTSON | W222: WEST MELBOURNE | X222: 1 | Y222: 4 | Z222: 0 | AA222: 89 | AB222: 221 | AC222: 40.27 | AD222: 4
A223: GOALKICKERS
A224: ESSENDON TOWN | D224: WATTS 2 | G224: ROBERTSON | J224: ARMSTRONG | M224: MARTIN | O224: WILLIAMS
A225: BRUNSWICK | D225: LOGAN | G225: MCKENZIE
A227: RICHMOND | C227: 1 | D227: 3 | E227: =C227*6+D227 -> 9 | G227: 4 | H227: 5 | I227: =G227*6+H227 -> 29 | K227: 5 | L227: 6 | M227: =K227*6+L227 -> 36 | O227: 6 | P227: 8 | Q227: =O227*6+P227 -> 44 | S227: PORT MELB
A228: PORT MELBOURNE | C228: 1 | D228: 1 | E228: =C228*6+D228 -> 7 | G228: 2 | H228: 2 | I228: =G228*6+H228 -> 14 | K228: 3 | L228: 3 | M228: =K228*6+L228 -> 21 | O228: 4 | P228: 4 | Q228: =O228*6+P228 -> 28 | S228: DEVINE
A229: BEST PLAYERS
A230: RICHMOND | D230: McNAIR | G230: PONTIN | J230: BAHEN | M230: RUDD | O230: LOTT | R230: MILNE
A231: PORT MELBOURNE | D231: O'BRIEN | G231: PEARS | J231: POWELL | M231: McNAMARA | O231: HASSETT | R231: WOODS
A232: GOALKICKERS
A233: RICHMOND | D233: MILNE 2 | G233: BAHEN 2 | J233: DAVIDSON | M233: G BACKHOUSE
A234: PORT MELBOURNE | D234: HUTCHINSON 2 | H234: WARD | J234: WOODS
A236: FOOTSCRAY | C236: 2 | D236: 4 | E236: =C236*6+D236 -> 16 | G236: 3 | H236: 6 | I236: =G236*6+H236 -> 24 | K236: 6 | L236: 7 | M236: =K236*6+L236 -> 43 | O236: 8 | P236: 7 | Q236: =O236*6+P236 -> 55 | S236: FOOTSCRAY
A237: PRAHRAN | C237: 0 | D237: 0 | E237: =C237*6+D237 -> 0 | G237: 1 | H237: 1 | I237: =G237*6+H237 -> 7 | K237: 2 | L237: 1 | M237: =K237*6+L237 -> 13 | O237: 4 | P237: 2 | Q237: =O237*6+P237 -> 26 | S237: MURPHY
A238: BEST PLAYERS
A239: FOOTSCRAY | D239: McCARTHY | G239: GRUNDEN | J239: DECOIT | M239: DALY | O239: GREGORY | R239: HINCH
A240: PRAHRAN | D240: HERBERT | G240: WILLISON | J240: ATKINSON | M240: JAMES | O240: BROWN | R240: DUNNE
A241: GOALKICKERS
A242: FOOTSCRAY | D242: DALY 3 | G242: DECOIT 2 | J242: MITCHELL | M242: MOLYNEUX | O242: DREW
A243: PRAHRAN | D243: DENHOLM 2 | G243: HOWELL 2
A245: BYE | C245: NORTH MELBOURNE
A247: ROUND 7 | E247: 9TH JUNE | I247: WEATHER | L247: NORTH WIND
C248: 1ST QTR | G248: 2ND QTR | K248: 3RD QTR | O248: FINAL | S248: AT
A249: WILLIAMSTOWN | C249: 0 | D249: 3 | E249: =C249*6+D249 -> 3 | G249: 0 | H249: 4 | I249: =G249*6+H249 -> 4 | K249: 1 | L249: 7 | M249: =K249*6+L249 -> 13 | O249: 2 | P249: 8 | Q249: =O249*6+P249 -> 20 | S249: WILLIAMSTOWN | W249: LADDER | AB249: ROUND | AD249: 7
A250: FOOTSCRAY | C250: 1 | D250: 1 | E250: =C250*6+D250 -> 7 | G250: 1 | H250: 2 | I250: =G250*6+H250 -> 8 | K250: 2 | L250: 2 | M250: =K250*6+L250 -> 14 | O250: 2 | P250: 3 | Q250: =O250*6+P250 -> 15 | S250: MURPHY
A251: BEST PLAYERS | W251: TEAM | X251: W | Y251: L | Z251: D | AA251: FOR | AB251: AGST | AC251: % | AD251: PTS
A252: WILLIAMSTOWN | D252: WARREN | G252: BREMNER | J252: OUTEN | L252: HOUGHTON | O252: R HALL | Q252: BARNES
A253: FOOTSCRAY | D253: McCARTHY | G253: ROBINSON | J253: DREW | L253: GRUNDEN | O253: GREGORY | Q253: SERBY | W253: WILLIAMSTOWN | X253: 7 | Y253: 0 | Z253: 0 | AA253: 221 | AB253: 140 | AC253: 157.86 | AD253: 28
A254: GOALKICKERS | W254: FOOTSCRAY | X254: 5 | Y254: 1 | Z254: 0 | AA254: 333 | AB254: 87 | AC254: 382.76 | AD254: 20
A255: WILLIAMSTOWN | D255: ROWAN | G255: WARREN | W255: RICHMOND | X255: 5 | Y255: 1 | Z255: 0 | AA255: 211 | AB255: 190 | AC255: 111.05 | AD255: 20
A256: FOOTSCRAY | D256: DALY 2 | W256: BRUNSWICK | X256: 3 | Y256: 3 | Z256: 0 | AA256: 165 | AB256: 171 | AC256: 96.49 | AD256: 12
A258: NORTH MELBOURNE | C258: 0 | D258: 2 | E258: =C258*6+D258 -> 2 | G258: 7 | H258: 5 | I258: =G258*6+H258 -> 47 | K258: 8 | L258: 5 | M258: =K258*6+L258 -> 53 | O258: 11 | P258: 10 | Q258: =O258*6+P258 -> 76 | S258: NORTH MELB | W258: NORTH MELBOURNE | X258: 2 | Y258: 4 | Z258: 0 | AA258: 225 | AB258: 218 | AC258: 103.21 | AD258: 8
A259: ESSENDON TOWN | C259: 3 | D259: 1 | E259: =C259*6+D259 -> 19 | G259: 3 | H259: 1 | I259: =G259*6+H259 -> 19 | K259: 6 | L259: 5 | M259: =K259*6+L259 -> 41 | O259: 6 | P259: 7 | Q259: =O259*6+P259 -> 43 | S259: ARMSTRONG | W259: PRAHRAN | X259: 2 | Y259: 4 | Z259: 0 | AA259: 231 | AB259: 251 | AC259: 92.03 | AD259: 8
A260: BEST PLAYERS | W260: PORT MELBOURNE | X260: 2 | Y260: 4 | Z260: 0 | AA260: 168 | AB260: 237 | AC260: 70.89 | AD260: 8
A261: NORTH MELBOURNE | D261: LONERGAN | G261: SICILY | J261: NOONAN | L261: McSWEENEY | O261: J SMITH | R261: COBAIN | W261: ESSENDON TOWN | X261: 1 | Y261: 6 | Z261: 0 | AA261: 176 | AB261: 259 | AC261: 67.95 | AD261: 4
A262: ESSENDON TOWN | D262: TESTER | G262: WILLIAMS | J262: CHARLES | L262: RAMSAY | O262: ARMSTRONG | R262: FLEMING | W262: WEST MELBOURNE | X262: 1 | Y262: 5 | Z262: 0 | AA262: 128 | AB262: 305 | AC262: 41.97 | AD262: 4
A263: GOALKICKERS
A264: NORTH MELBOURNE | D264: KNEE 3 | G264: RUTLEY 2 | J264: DOUGLAS | L264: NOONAN | N264: MONTGOMERIE | Q264: BOYLE | S264: GEGGIE | U264: SMITH
A265: ESSENDON TOWN | D265: WATTS 3 | G265: BARR | J265: RAMSAY | L265: BREESE
A267: BRUNSWICK | C267: 2 | D267: 5 | E267: =C267*6+D267 -> 17 | G267: 2 | H267: 5 | I267: =G267*6+H267 -> 17 | K267: 5 | L267: 9 | M267: =K267*6+L267 -> 39 | O267: 5 | P267: 10 | Q267: =O267*6+P267 -> 40 | S267: PORT MELBOURNE
A268: PORT MELBOURNE | C268: 0 | D268: 1 | E268: =C268*6+D268 -> 1 | G268: 2 | H268: 5 | I268: =G268*6+H268 -> 17 | K268: 2 | L268: 5 | M268: =K268*6+L268 -> 17 | O268: 4 | P268: 6 | Q268: =O268*6+P268 -> 30 | S268: McWHINNEY
A269: BEST PLAYERS
A270: BRUNSWICK | D270: O'LOUGHLIN | G270: WHELAN | J270: TOUGH | M270: COBURN | O270: W ANDREWS | R270: LANDELLS
A271: PORT MELBOURNE | D271: McCONACHIE | G271: POLLOCK | J271: McDONALD | M271: HUTCHINSON | O271: WARDLE | R271: POWELL
A272: GOALKICKERS
A273: BRUNSWICK | D273: TEMPLE | G273: McKENZIE | J273: LEEDS | L273: LANDELLS | O273: COBURN
A274: PORT MELBOURNE | D274: A HUTCHINSON 2 | H274: POWELL | J274: McGEE
A276: PRAHRAN | C276: 1 | D276: 5 | E276: =C276*6+D276 -> 11 | G276: 5 | H276: 8 | I276: =G276*6+H276 -> 38 | K276: 7 | L276: 13 | M276: =K276*6+L276 -> 55 | O276: 11 | P276: 18 | Q276: =O276*6+P276 -> 84 | S276: TOORAK PK
A277: WEST MELBOURNE | C277: 2 | D277: 0 | E277: =C277*6+D277 -> 12 | G277: 5 | H277: 2 | I277: =G277*6+H277 -> 32 | K277: 6 | L277: 2 | M277: =K277*6+L277 -> 38 | O277: 6 | P277: 3 | Q277: =O277*6+P277 -> 39 | S277: KENNISON
A278: BEST PLAYERS
A279: PRAHRAN | D279: DUNNE | G279: LYONS | J279: McINERNEY | M279: CUMMINGS | O279: HORNIDGE | R279: CONQUEST
A280: WEST MELBOURNE | D280: LIVINGSTONE | G280: PAGE | J280: MONTGOMERY | M280: KENDALL | O280: POOLE | R280: WILLIAMS
A281: GOALKICKERS
A282: PRAHRAN | D282: DUNNE 3 | G282: CUMMINGS 3 | J282: T BROWN | M282: WESTBROOKE | P282: ROBERTS | R282: LYONS | T282: HORNIDGE
A283: WEST MELBOURNE | D283: O KELLY 3 | G283: B KELLY 2 | J283: KENDALL
A285: BYE | C285: RICHMOND
A287: ROUND 8 | E287: 16TH JUNE | I287: WEATHER | L287: FOGGY CALM
C288: 1ST QTR | G288: 2ND QTR | K288: 3RD QTR | O288: FINAL | S288: AT
A289: WILLIAMSTOWN | C289: 2 | D289: 5 | E289: =C289*6+D289 -> 17 | G289: 2 | H289: 7 | I289: =G289*6+H289 -> 19 | K289: 5 | L289: 13 | M289: =K289*6+L289 -> 43 | O289: 5 | P289: 13 | Q289: =O289*6+P289 -> 43 | S289: WILLIAMSTOWN | W289: LADDER | AB289: ROUND | AD289: 8
A290: PRAHRAN | C290: 1 | D290: 0 | E290: =C290*6+D290 -> 6 | G290: 2 | H290: 2 | I290: =G290*6+H290 -> 14 | K290: 2 | L290: 2 | M290: =K290*6+L290 -> 14 | O290: 3 | P290: 4 | Q290: =O290*6+P290 -> 22 | S290: DICK
A291: BEST PLAYERS | W291: TEAM | X291: W | Y291: L | Z291: D | AA291: FOR | AB291: AGST | AC291: % | AD291: PTS
A292: WILLIAMSTOWN | D292: WARREN | G292: CALDWELL | J292: OUTEN | M292: VINEY | O292: BARNES | R292: BOND
A293: PRAHRAN | D293: McINERNEY | G293: LYONS | J293: McCLUMPA | M293: G BROWN | O293: T BROWN | R293: CONQUEST | W293: WILLIAMSTOWN | X293: 8 | Y293: 0 | Z293: 0 | AA293: 264 | AB293: 162 | AC293: 162.96 | AD293: 32
A294: GOALKICKERS | W294: FOOTSCRAY | X294: 6 | Y294: 1 | Z294: 0 | AA294: 387 | AB294: 123 | AC294: 314.63 | AD294: 24
A295: WILLIAMSTOWN | D295: STANILAND 2 | H295: BOND | J295: WARREN | L295: OUTEN | W295: RICHMOND | X295: 6 | Y295: 1 | Z295: 0 | AA295: 261 | AB295: 222 | AC295: 117.57 | AD295: 24
A296: PRAHRAN | D296: CUMMING | H296: LYONS | J296: HORNIDGE | W296: BRUNSWICK | X296: 3 | Y296: 4 | Z296: 0 | AA296: 201 | AB296: 225 | AC296: 89.33 | AD296: 12
A298: RICHMOND | C298: 0 | D298: 5 | E298: =C298*6+D298 -> 5 | G298: 4 | H298: 10 | I298: =G298*6+H298 -> 34 | K298: 6 | L298: 12 | M298: =K298*6+L298 -> 48 | O298: 6 | P298: 14 | Q298: =O298*6+P298 -> 50 | S298: RICHMOND | W298: PORT MELBOURNE | X298: 3 | Y298: 4 | Z298: 0 | AA298: 207 | AB298: 259 | AC298: 79.92 | AD298: 12
A299: WEST MELBOURNE | C299: 4 | D299: 1 | E299: =C299*6+D299 -> 25 | G299: 4 | H299: 2 | I299: =G299*6+H299 -> 26 | K299: 4 | L299: 2 | M299: =K299*6+L299 -> 26 | O299: 5 | P299: 2 | Q299: =O299*6+P299 -> 32 | S299: STRANGER | W299: NORTH MELBOURNE | X299: 2 | Y299: 5 | Z299: 0 | AA299: 247 | AB299: 257 | AC299: 96.11 | AD299: 8
A300: BEST PLAYERS | W300: PRAHRAN | X300: 2 | Y300: 5 | Z300: 0 | AA300: 253 | AB300: 294 | AC300: 86.05 | AD300: 8
A301: RICHMOND | D301: CLARKE | F301: GILES | H301: EDMONDS | K301: C BACKHOUSE | N301: BAHEN | Q301: PARKER | W301: ESSENDON TOWN | X301: 1 | Y301: 6 | Z301: 0 | AA301: 176 | AB301: 259 | AC301: 67.95 | AD301: 4
A302: WEST MELBOURNE | D302: ROOKE | F302: HOOPER | H302: O KELLY | K302: MORGAN | N302: LIVINGSTONE | Q302: TWITCHETT | W302: WEST MELBOURNE | X302: 1 | Y302: 6 | Z302: 0 | AA302: 160 | AB302: 355 | AC302: 45.07 | AD302: 4
A303: GOALKICKERS
A304: RICHMOND | D304: McNAIR 2 | G304: DAVIDSON 2 | J304: MILNE | L304: PARKER
A305: WEST MELBOURNE | D305: WILLIAMS 2 | G305: O KELLY | J305: B KELLY | L305: TWITCHETT
A307: PORT MELBOURNE | C307: 0 | D307: 0 | E307: =C307*6+D307 -> 0 | G307: 1 | H307: 1 | I307: =G307*6+H307 -> 7 | K307: 3 | L307: 2 | M307: =K307*6+L307 -> 20 | O307: 6 | P307: 3 | Q307: =O307*6+P307 -> 39 | S307: NORTH MELB
A308: NORTH MELBOURNE | C308: 1 | D308: 5 | E308: =C308*6+D308 -> 11 | G308: 1 | H308: 7 | I308: =G308*6+H308 -> 13 | K308: 2 | L308: 9 | M308: =K308*6+L308 -> 21 | O308: 2 | P308: 10 | Q308: =O308*6+P308 -> 22 | S308: ARMSTRONG
A309: BEST PLAYERS
A310: PORT MELBOURNE | D310: SWANNIE | G310: WOODS | J310: O'BRIEN | M310: POLLOCK | O310: BROMLEY | R310: McGEE
A311: NORTH MELBOURNE | D311: NOONAN | G311: SICILY | J311: P SMITH | M311: GEGGIE | O311: C SMITH | R311: QUILLIGAN
A312: GOALKICKERS
A313: PORT MELBOURNE | D313: WOODS 3 | G313: HUTCHINSON 2 | K313: SWANNIE
A314: NORTH MELBOURNE | D314: SICILY | G314: BOYLE
A316: FOOTSCRAY | C316: 3 | D316: 5 | E316: =C316*6+D316 -> 23 | G316: 3 | H316: 5 | I316: =G316*6+H316 -> 23 | K316: 6 | L316: 12 | M316: =K316*6+L316 -> 48 | O316: 7 | P316: 12 | Q316: =O316*6+P316 -> 54 | S316: BRUNSWICK
A317: BRUNSWICK | C317: 0 | D317: 0 | E317: =C317*6+D317 -> 0 | G317: 4 | H317: 5 | I317: =G317*6+H317 -> 29 | K317: 4 | L317: 5 | M317: =K317*6+L317 -> 29 | O317: 5 | P317: 6 | Q317: =O317*6+P317 -> 36 | S317: DEVINE
A318: BEST PLAYERS
A319: FOOTSCRAY | D319: SERBY | G319: HARRIS | J319: GRUNDEN | M319: MITCHELL | O319: KRUSE | R319: TODD
A320: BRUNSWICK | D320: M O'LOUGHLIN | G320: ANDREWS | J320: JOHNSTON | M320: McKENZIE | O320: LANDELLS | R320: HARRIS
A321: GOALKICKERS
A322: FOOTSCRAY | D322: MITCHELL 6 | G322: DECOIT
A323: BRUNSWICK | D323: LANDELLS 3 | G323: CRAVEN | J323: LEEDS
A325: BYE | C325: ESSENDON TOWN
A327: ROUND 9 | E327: 23RD JUNE | I327: WEATHER | L327: NORTH WIND GROUNDS BAD
C328: 1ST QTR | G328: 2ND QTR | K328: 3RD QTR | O328: FINAL | S328: AT
A329: FOOTSCRAY | C329: 1 | D329: 1 | E329: =C329*6+D329 -> 7 | G329: 2 | H329: 6 | I329: =G329*6+H329 -> 18 | K329: 2 | L329: 6 | M329: =K329*6+L329 -> 18 | O329: 5 | P329: 14 | Q329: =O329*6+P329 -> 44 | S329: FOOTSCRAY | W329: LADDER | AB329: ROUND | AD329: 9
A330: RICHMOND | C330: 1 | D330: 2 | E330: =C330*6+D330 -> 8 | G330: 1 | H330: 2 | I330: =G330*6+H330 -> 8 | K330: 3 | L330: 4 | M330: =K330*6+L330 -> 22 | O330: 3 | P330: 4 | Q330: =O330*6+P330 -> 22 | S330: MURPHY
A331: BEST PLAYERS | W331: TEAM | X331: W | Y331: L | Z331: D | AA331: FOR | AB331: AGST | AC331: % | AD331: PTS
A332: FOOTSCRAY | D332: McCARTHY | G332: HARRIS | I332: DALY | K332: DECOIT | N332: TODD | P332: ROBINSON
A333: RICHMOND | D333: MILNE | G333: McNAIR | I333: GILES | K333: EDMUNDS | N333: TAYLOR | P333: C BACKHOUSE | W333: WILLIAMSTOWN | X333: 8 | Y333: 0 | Z333: 0 | AA333: 264 | AB333: 162 | AC333: 162.96 | AD333: 32
A334: GOALKICKERS | W334: FOOTSCRAY | X334: 7 | Y334: 1 | Z334: 0 | AA334: 431 | AB334: 145 | AC334: 297.24 | AD334: 28
A335: FOOTSCRAY | D335: MONTGARRETT 2 | H335: DECOIT | K335: McCANN | N335: DALY | W335: RICHMOND | X335: 6 | Y335: 2 | Z335: 0 | AA335: 283 | AB335: 266 | AC335: 106.39 | AD335: 24
A336: RICHMOND | D336: MILNE | G336: DAVIDSON | J336: C BACKHOUSE | W336: PORT MELBOURNE | X336: 4 | Y336: 4 | Z336: 0 | AA336: 239 | AB336: 269 | AC336: 88.85 | AD336: 16
A338: PORT MELBOURNE | C338: 1 | D338: 1 | E338: =C338*6+D338 -> 7 | G338: 3 | H338: 1 | I338: =G338*6+H338 -> 19 | K338: 4 | L338: 5 | M338: =K338*6+L338 -> 29 | O338: 4 | P338: 8 | Q338: =O338*6+P338 -> 32 | S338: ESSENDON | W338: NORTH MELBOURNE | X338: 3 | Y338: 5 | Z338: 0 | AA338: 282 | AB338: 280 | AC338: 100.71 | AD338: 12
A339: ESSENDON TOWN | C339: 0 | D339: 0 | E339: =C339*6+D339 -> 0 | G339: 0 | H339: 0 | I339: =G339*6+H339 -> 0 | K339: 0 | L339: 0 | M339: =K339*6+L339 -> 0 | O339: 1 | P339: 4 | Q339: =O339*6+P339 -> 10 | S339: DICK | W339: PRAHRAN | X339: 3 | Y339: 5 | Z339: 0 | AA339: 303 | AB339: 335 | AC339: 90.45 | AD339: 12
A340: BEST PLAYERS | W340: BRUNSWICK | X340: 3 | Y340: 5 | Z340: 0 | AA340: 242 | AB340: 275 | AC340: 88 | AD340: 12
A341: PORT MELBOURNE | D341: O'BRIEN | G341: SWANNIE | J341: WILLIAMSON | M341: GARBUTT | O341: McGEE | Q341: HUTCHINSON | W341: ESSENDON TOWN | X341: 1 | Y341: 7 | Z341: 0 | AA341: 186 | AB341: 291 | AC341: 63.92 | AD341: 4
A342: ESSENDON TOWN | D342: BARR | G342: JONES | J342: TESTER | M342: BYERS | O342: FLEMING | Q342: SHELDON | W342: WEST MELBOURNE | X342: 1 | Y342: 7 | Z342: 0 | AA342: 183 | AB342: 390 | AC342: 46.92 | AD342: 4
A343: GOALKICKERS
A344: PORT MELBOURNE | D344: HUTCHINSON 2 | H344: WOODS | J344: SHEEHAN
A345: ESSENDON TOWN | D345: WATTS
A347: PRAHRAN | C347: 3 | D347: 3 | E347: =C347*6+D347 -> 21 | G347: 3 | H347: 5 | I347: =G347*6+H347 -> 23 | K347: 5 | L347: 14 | M347: =K347*6+L347 -> 44 | O347: 6 | P347: 14 | Q347: =O347*6+P347 -> 50 | S347: TOORAK PK
A348: BRUNSWICK | C348: 1 | D348: 0 | E348: =C348*6+D348 -> 6 | G348: 3 | H348: 5 | I348: =G348*6+H348 -> 23 | K348: 3 | L348: 5 | M348: =K348*6+L348 -> 23 | O348: 5 | P348: 11 | Q348: =O348*6+P348 -> 41 | S348: STRANGER
A349: BEST PLAYERS
A350: PRAHRAN | D350: CONQUEST | G350: JAMES | J350: McCLUMPA | M350: DUNNE | P350: ROBERTS | S350: KRUGER
A351: BRUNSWICK | D351: McKENZIE | G351: W ANDREWS | J351: F ANDREWS | M351: J LANDELLS | P351: TOUGH | S351: ROBERTSON
A352: GOALKICKERS
A353: PRAHRAN | D353: LYONS 2 | G353: G BROWN 2 | J353: HERBERT | M353: McINERNEY
A354: BRUNSWICK | D354: ROBERTSON | G354: JOHNSON | J354: H LANDELLS | M354: McKENZIE | P354: LEEDS
A356: NORTH MELBOURNE | C356: 1 | D356: 0 | E356: =C356*6+D356 -> 6 | G356: 3 | H356: 1 | I356: =G356*6+H356 -> 19 | K356: 3 | L356: 2 | M356: =K356*6+L356 -> 20 | O356: 5 | P356: 5 | Q356: =O356*6+P356 -> 35 | S356: NORTH MELB
A357: WEST MELBOURNE | C357: 2 | D357: 3 | E357: =C357*6+D357 -> 15 | G357: 2 | H357: 5 | I357: =G357*6+H357 -> 17 | K357: 3 | L357: 5 | M357: =K357*6+L357 -> 23 | O357: 3 | P357: 5 | Q357: =O357*6+P357 -> 23 | S357: McWHINNEY
A358: BEST PLAYERS
A359: NORTH MELBOURNE | D359: ETHELL | G359: NOONAN | J359: SICILY | M359: COVE | P359: GEGGIE | S359: QUILLIGAN
A360: WEST MELBOURNE | D360: PAGE | G360: LIVINGSTONE | J360: GREGORY | M360: MORGAN | P360: HOOPER | S360: MEAGHAN
A361: GOALKICKERS
A362: NORTH MELBOURNE | D362: QUILLIGAN 3 | G362: SICILY | J362: C SMITH
A363: WEST MELBOURNE | D363: WILLIAMS | G363: TWITCHETT | J363: POOLE
A365: BYE | C365: WILLIAMSTOWN
A367: ROUND 10 | E367: 30TH JUNE | I367: WEATHER | L367: SOUTH WIND RAIN
C368: 1ST QTR | G368: 2ND QTR | K368: 3RD QTR | O368: FINAL | S368: AT
A369: WILLIAMSTOWN | E369: =C369*6+D369 -> 0 | I369: =G369*6+H369 -> 0 | M369: =K369*6+L369 -> 0 | Q369: =O369*6+P369 -> 0 | S369: WILLIAMSTOWN | W369: LADDER | AB369: ROUND | AD369: 10
A370: BRUNSWICK | E370: =C370*6+D370 -> 0 | I370: =G370*6+H370 -> 0 | M370: =K370*6+L370 -> 0 | Q370: =O370*6+P370 -> 0
A371: BEST PLAYERS | W371: TEAM | X371: W | Y371: L | Z371: D | AA371: FOR | AB371: AGST | AC371: % | AD371: PTS
A372: WILLIAMSTOWN | E372: BRUNSWICK FORFEITED TO WILLIAMSTOWN
A373: BRUNSWICK | E373: BRUNSWICK JUMPERS DID NOT ARRIVE | W373: WILLIAMSTOWN | X373: 9 | Y373: 0 | Z373: 0 | AA373: 264 | AB373: 162 | AC373: 162.96 | AD373: 36
A374: GOALKICKERS | W374: FOOTSCRAY | X374: 8 | Y374: 1 | Z374: 0 | AA374: 490 | AB374: 164 | AC374: 298.78 | AD374: 32
A375: WILLIAMSTOWN | W375: RICHMOND | X375: 7 | Y375: 2 | Z375: 0 | AA375: 319 | AB375: 298 | AC375: 107.05 | AD375: 28
A376: BRUNSWICK | W376: PORT MELBOURNE | X376: 5 | Y376: 4 | Z376: 0 | AA376: 286 | AB376: 306 | AC376: 93.46 | AD376: 20
A378: FOOTSCRAY | C378: 2 | D378: 0 | E378: =C378*6+D378 -> 12 | G378: 5 | H378: 5 | I378: =G378*6+H378 -> 35 | K378: 6 | L378: 7 | M378: =K378*6+L378 -> 43 | O378: 8 | P378: 11 | Q378: =O378*6+P378 -> 59 | S378: FOOTSCRAY | W378: NORTH MELBOURNE | X378: 3 | Y378: 6 | Z378: 0 | AA378: 314 | AB378: 316 | AC378: 99.37 | AD378: 12
A379: ESSENDON TOWN | C379: 1 | D379: 1 | E379: =C379*6+D379 -> 7 | G379: 1 | H379: 1 | I379: =G379*6+H379 -> 7 | K379: 1 | L379: 4 | M379: =K379*6+L379 -> 10 | O379: 2 | P379: 7 | Q379: =O379*6+P379 -> 19 | S379: DEVINE | W379: PRAHRAN | X379: 3 | Y379: 6 | Z379: 0 | AA379: 340 | AB379: 382 | AC379: 89.01 | AD379: 12
A380: BEST PLAYERS | W380: BRUNSWICK | X380: 3 | Y380: 6 | Z380: 0 | AA380: 242 | AB380: 275 | AC380: 88 | AD380: 12
A381: FOOTSCRAY | D381: HARRIS | G381: McCARTHY | J381: GRUNDEN | M381: DECOIT | O381: DALY | Q381: MITCHELL | W381: ESSENDON TOWN | X381: 1 | Y381: 8 | Z381: 0 | AA381: 205 | AB381: 350 | AC381: 58.57 | AD381: 4
A382: ESSENDON TOWN | D382: CORCORAN | G382: SWEATMAN | J382: CARLTON | M382: FLEMING | O382: TESTER | Q382: KENNEDY | W382: WEST MELBOURNE | X382: 1 | Y382: 7 | Z382: 0 | AA382: 183 | AB382: 390 | AC382: 46.92 | AD382: 4
A383: GOALKICKERS
A384: FOOTSCRAY | D384: MITCHELL 2 | G384: DECOIT 2 | J384: DALY 2 | M384: McGLYNN | O384: WILLIAMS
A385: ESSENDON TOWN | D385: BARR 2
A387: RICHMOND | C387: 0 | D387: 4 | E387: =C387*6+D387 -> 4 | G387: 1 | H387: 7 | I387: =G387*6+H387 -> 13 | K387: 3 | L387: 10 | M387: =K387*6+L387 -> 28 | O387: 4 | P387: 12 | Q387: =O387*6+P387 -> 36 | S387: RICHMOND
A388: NORTH MELBOURNE | C388: 1 | D388: 1 | E388: =C388*6+D388 -> 7 | G388: 4 | H388: 2 | I388: =G388*6+H388 -> 26 | K388: 4 | L388: 2 | M388: =K388*6+L388 -> 26 | O388: 5 | P388: 2 | Q388: =O388*6+P388 -> 32 | S388: ARMSTRONG
A389: BEST PLAYERS
A390: RICHMOND | D390: CATHIE | G390: C BACKHOUSE | J390: GAULT | L390: McNAIR | O390: EDMUNDS | R390: DAVIDSON
A391: NORTH MELBOURNE | D391: McSWEENEY | G391: MONTGOMERIE | J391: REEKIE | L391: SICILY | O391: GRAHAM | R391: GEGGIE
A392: GOALKICKERS
A393: RICHMOND | D393: MILNE | G393: CATHIE | J393: O'NEILL | M393: EDMUNDS
A394: NORTH MELBOURNE | D394: RUTLEY 2 | G394: A REEKIE | J394: GRAHAM | M394: SICILY
A396: PORT MELBOURNE | C396: 2 | D396: 0 | E396: =C396*6+D396 -> 12 | G396: 4 | H396: 4 | I396: =G396*6+H396 -> 28 | K396: 6 | L396: 5 | M396: =K396*6+L396 -> 41 | O396: 7 | P396: 5 | Q396: =O396*6+P396 -> 47
A397: PRAHRAN | C397: 1 | D397: 3 | E397: =C397*6+D397 -> 9 | G397: 3 | H397: 4 | I397: =G397*6+H397 -> 22 | K397: 4 | L397: 4 | M397: =K397*6+L397 -> 28 | O397: 5 | P397: 7 | Q397: =O397*6+P397 -> 37
A398: BEST PLAYERS
A399: PORT MELBOURNE | D399: O'BRIEN | G399: SWANNIE | J399: GARBUTT | L399: WILLIAMSON | O399: McGEE | R399: WOODS
A400: PRAHRAN | D400: KRUGER | G400: HERBERT | J400: T BROWN | L400: G BROWN | O400: DOWNES | R400: McINERNEY
A401: GOALKICKERS
A402: PORT MELBOURNE | D402: HUTCHINSON 3 | G402: WOODS 3 | J402: NICKELL
A403: PRAHRAN | D403: G BROWN 2 | G403: ROBERTS | J403: CUMMING | M403: ATKINSON
A405: BYE | C405: WEST MELBOURNE
A407: ROUND 11 | E407: 7TH JULY | I407: WEATHER | L407: FINE S.E. BREEZE
C408: 1ST QTR | G408: 2ND QTR | K408: 3RD QTR | O408: FINAL | S408: AT
A409: NORTH MELBOURNE | C409: 2 | D409: 4 | E409: =C409*6+D409 -> 16 | G409: 3 | H409: 4 | I409: =G409*6+H409 -> 22 | K409: 3 | L409: 5 | M409: =K409*6+L409 -> 23 | O409: 3 | P409: 6 | Q409: =O409*6+P409 -> 24 | S409: NORTH MELB | W409: LADDER | AB409: ROUND | AD409: 11
A410: WILLIAMSTOWN | C410: 0 | D410: 1 | E410: =C410*6+D410 -> 1 | G410: 0 | H410: 2 | I410: =G410*6+H410 -> 2 | K410: 0 | L410: 3 | M410: =K410*6+L410 -> 3 | O410: 1 | P410: 12 | Q410: =O410*6+P410 -> 18 | S410: McWHINNEY
A411: BEST PLAYERS | W411: TEAM | X411: W | Y411: L | Z411: D | AA411: FOR | AB411: AGST | AC411: % | AD411: PTS
A412: NORTH MELBOURNE | D412: MONTGOMERIE | G412: GEGGIE | I412: GRAHAM | L412: SICILY | N412: NOONAN | Q412: ETHELL
A413: WILLIAMSTOWN | D413: BREMNER | G413: RILEY | I413: CALDWELL | L413: OUTEN | N413: McWILLIAMS | Q413: STANILAND | W413: FOOTSCRAY | X413: 9 | Y413: 1 | Z413: 0 | AA413: 517 | AB413: 190 | AC413: 272.11 | AD413: 36
A414: GOALKICKERS | W414: WILLIAMSTOWN | X414: 9 | Y414: 1 | Z414: 0 | AA414: 282 | AB414: 186 | AC414: 151.61 | AD414: 36
A415: NORTH MELBOURNE | D415: GEGGIE 2 | G415: CAVE | W415: RICHMOND | X415: 7 | Y415: 3 | Z415: 0 | AA415: 351 | AB415: 349 | AC415: 100.57 | AD415: 28
A416: WILLIAMSTOWN | D416: OGILVIE | W416: PORT MELBOURNE | X416: 5 | Y416: 5 | Z416: 0 | AA416: 312 | AB416: 333 | AC416: 93.69 | AD416: 20
A418: ESSENDON TOWN | C418: 2 | D418: 1 | E418: =C418*6+D418 -> 13 | G418: 4 | H418: 1 | I418: =G418*6+H418 -> 25 | K418: 6 | L418: 3 | M418: =K418*6+L418 -> 39 | O418: 8 | P418: 3 | Q418: =O418*6+P418 -> 51 | S418: ESSENDON | W418: NORTH MELBOURNE | X418: 4 | Y418: 6 | Z418: 0 | AA418: 338 | AB418: 334 | AC418: 101.2 | AD418: 16
A419: RICHMOND | C419: 0 | D419: 5 | E419: =C419*6+D419 -> 5 | G419: 3 | H419: 10 | I419: =G419*6+H419 -> 28 | K419: 3 | L419: 12 | M419: =K419*6+L419 -> 30 | O419: 3 | P419: 14 | Q419: =O419*6+P419 -> 32 | S419: MURPHY | W419: BRUNSWICK | X419: 4 | Y419: 6 | Z419: 0 | AA419: 296 | AB419: 302 | AC419: 98.01 | AD419: 16
A420: BEST PLAYERS | W420: PRAHRAN | X420: 3 | Y420: 6 | Z420: 0 | AA420: 340 | AB420: 382 | AC420: 89.01 | AD420: 12
A421: ESSENDON TOWN | D421: ARMSTRONG | G421: CHARLES | J421: BREESE | L421: KENNEDY | N421: BARR | Q421: FLEMING | W421: ESSENDON TOWN | X421: 2 | Y421: 8 | Z421: 0 | AA421: 256 | AB421: 382 | AC421: 67.02 | AD421: 8
A422: RICHMOND | D422: CATHIE | G422: C BACKHOUSE | J422: RUDD | L422: DAVIDSON | N422: McNAIR | Q422: T WATSON | W422: WEST MELBOURNE | X422: 1 | Y422: 8 | Z422: 0 | AA422: 210 | AB422: 444 | AC422: 47.3 | AD422: 4
A423: GOALKICKERS
A424: ESSENDON TOWN | D424: CARLTON 2 | G424: WATTS 2 | J424: BARR | L424: SHELDON | O424: KENNEDY | R424: BREESE
A425: RICHMOND | D425: LOTT | G425: O'NEILL | J425: PARKER
A427: BRUNSWICK | C427: 2 | D427: 3 | E427: =C427*6+D427 -> 15 | G427: 5 | H427: 5 | I427: =G427*6+H427 -> 35 | K427: 7 | L427: 8 | M427: =K427*6+L427 -> 50 | O427: 7 | P427: 12 | Q427: =O427*6+P427 -> 54 | S427: BRUNSWICK
A428: WEST MELBOURNE | C428: 1 | D428: 2 | E428: =C428*6+D428 -> 8 | G428: 2 | H428: 4 | I428: =G428*6+H428 -> 16 | K428: 2 | L428: 6 | M428: =K428*6+L428 -> 18 | O428: 3 | P428: 9 | Q428: =O428*6+P428 -> 27 | S428: STRANGER
A429: BEST PLAYERS
A430: BRUNSWICK | D430: McKENZIE | G430: CASEY | J430: H LANDELLS | M430: CLEMENTS | P430: COBURN | S430: TEMPLE
A431: WEST MELBOURNE | D431: ROOKE | G431: KENNEDY | J431: MORGAN | M431: HOOPER | P431: McINNES | S431: POOLE
A432: GOALKICKERS
A433: BRUNSWICK | D433: McKENZIE 3 | G433: H LANDELLS 3 | K433: CASEY
A434: WEST MELBOURNE | D434: ROOKE | G434: LINQUIST | J434: MORGAN | M434: KELLY
A436: FOOTSCRAY | C436: 0 | D436: 4 | E436: =C436*6+D436 -> 4 | G436: 1 | H436: 5 | I436: =G436*6+H436 -> 11 | K436: 2 | L436: 7 | M436: =K436*6+L436 -> 19 | O436: 3 | P436: 9 | Q436: =O436*6+P436 -> 27 | S436: PORT MELB
A437: PORT MELBOURNE | C437: 0 | D437: 0 | E437: =C437*6+D437 -> 0 | G437: 1 | H437: 3 | I437: =G437*6+H437 -> 9 | K437: 1 | L437: 6 | M437: =K437*6+L437 -> 12 | O437: 3 | P437: 8 | Q437: =O437*6+P437 -> 26 | S437: ARMSTRONG
A438: BEST PLAYERS
A439: FOOTSCRAY | D439: ROBINSON | G439: MARMO | J439: TODD | M439: McCANCE | P439: DREW | S439: GRUNDEN
A440: PORT MELBOURNE | D440: McGEE | G440: SWANNIE | J440: POWELL | M440: KNOX | P440: WOODS | S440: O'BRIEN
A441: GOALKICKERS
A442: FOOTSCRAY | D442: McGLYNN | G442: DECOIT | J442: MITCHELL
A443: PORT MELBOURNE | D443: POWELL | G443: HUTCHINSON | J443: WOODS
A445: BYE | C445: PRAHRAN
A447: ROUND 12 | E447: 21ST JULY | I447: WEATHER | L447: CLOUDY BUT FINE
C448: 1ST QTR | G448: 2ND QTR | K448: 3RD QTR | O448: FINAL | S448: AT
A449: WILLIAMSTOWN | C449: 0 | D449: 2 | E449: =C449*6+D449 -> 2 | G449: 2 | H449: 5 | I449: =G449*6+H449 -> 17 | K449: 4 | L449: 7 | M449: =K449*6+L449 -> 31 | O449: 5 | P449: 11 | Q449: =O449*6+P449 -> 41 | S449: WILLIAMSTOWN | W449: LADDER | AB449: ROUND | AD449: 12
A450: RICHMOND | C450: 0 | D450: 2 | E450: =C450*6+D450 -> 2 | G450: 0 | H450: 2 | I450: =G450*6+H450 -> 2 | K450: 2 | L450: 5 | M450: =K450*6+L450 -> 17 | O450: 2 | P450: 6 | Q450: =O450*6+P450 -> 18 | S450: ARMSTRONG
A451: BEST PLAYERS | W451: TEAM | X451: W | Y451: L | Z451: D | AA451: FOR | AB451: AGST | AC451: % | AD451: PTS
A452: WILLIAMSTOWN | D452: McWILLIAMS | G452: SPRINTHALL | J452: CALDWELL | M452: W HALL | O452: OGILVIE | R452: WARDEN
A453: RICHMOND | D453: T WATSON | G453: D WATSON | J453: SLOSS | M453: BAHEN | O453: McNAIR | R453: MILNE | W453: FOOTSCRAY | X453: 10 | Y453: 1 | Z453: 0 | AA453: 567 | AB453: 220 | AC453: 257.73 | AD453: 40
A454: GOALKICKERS | W454: WILLIAMSTOWN | X454: 10 | Y454: 1 | Z454: 0 | AA454: 323 | AB454: 204 | AC454: 158.33 | AD454: 40
A455: WILLIAMSTOWN | D455: STANILAND 2 | G455: WARREN | J455: McKINLEY | M455: BARTY | W455: RICHMOND | X455: 7 | Y455: 4 | Z455: 0 | AA455: 369 | AB455: 390 | AC455: 94.62 | AD455: 28
A456: RICHMOND | D456: G BACKHOUSE | G456: CARKEEK | W456: PORT MELBOURNE | X456: 6 | Y456: 5 | Z456: 0 | AA456: 381 | AB456: 383 | AC456: 99.48 | AD456: 24
A458: PRAHRAN | C458: 1 | D458: 4 | E458: =C458*6+D458 -> 10 | G458: 4 | H458: 6 | I458: =G458*6+H458 -> 30 | K458: 6 | L458: 9 | M458: =K458*6+L458 -> 45 | O458: 7 | P458: 10 | Q458: =O458*6+P458 -> 52 | S458: ESSENDON | W458: BRUNSWICK | X458: 4 | Y458: 6 | Z458: 0 | AA458: 296 | AB458: 302 | AC458: 98.01 | AD458: 16
A459: ESSENDON TOWN | C459: 2 | D459: 2 | E459: =C459*6+D459 -> 14 | G459: 4 | H459: 5 | I459: =G459*6+H459 -> 29 | K459: 5 | L459: 5 | M459: =K459*6+L459 -> 35 | O459: 5 | P459: 8 | Q459: =O459*6+P459 -> 38 | S459: DEVINE | W459: NORTH MELBOURNE | X459: 4 | Y459: 7 | Z459: 0 | AA459: 368 | AB459: 384 | AC459: 95.83 | AD459: 16
A460: BEST PLAYERS | W460: PRAHRAN | X460: 4 | Y460: 6 | Z460: 0 | AA460: 392 | AB460: 420 | AC460: 93.33 | AD460: 16
A461: PRAHRAN | D461: LYONS | F461: McINERNEY | I461: DOWNES | L461: McCLUMPA | O461: HERBERT | R461: BROWN | W461: ESSENDON TOWN | X461: 2 | Y461: 9 | Z461: 0 | AA461: 294 | AB461: 434 | AC461: 67.74 | AD461: 8
A462: ESSENDON TOWN | D462: BYERS | F462: BARR | I462: WILLIAMS | L462: FLEMING | O462: CHARLES | R462: WITHERIDGE | W462: WEST MELBOURNE | X462: 1 | Y462: 9 | Z462: 0 | AA462: 260 | AB462: 513 | AC462: 50.68 | AD462: 4
A463: GOALKICKERS
A464: PRAHRAN | D464: CUMMINGS 3 | G464: DOWNES 2 | J464: LYONS 2
A465: ESSENDON TOWN | D465: WATTS | G465: ARMSTRONG | J465: BYERS | M465: KENNEDY | O465: WILLIAMS
A467: FOOTSCRAY | C467: 1 | D467: 2 | E467: =C467*6+D467 -> 8 | G467: 3 | H467: 7 | I467: =G467*6+H467 -> 25 | K467: 6 | L467: 8 | M467: =K467*6+L467 -> 44 | O467: 7 | P467: 8 | Q467: =O467*6+P467 -> 50 | S467: FOOTSCRAY
A468: NORTH MELBOURNE | C468: 1 | D468: 1 | E468: =C468*6+D468 -> 7 | G468: 1 | H468: 4 | I468: =G468*6+H468 -> 10 | K468: 3 | L468: 4 | M468: =K468*6+L468 -> 22 | O468: 4 | P468: 6 | Q468: =O468*6+P468 -> 30 | S468: McWHINNEY
A469: BEST PLAYERS
A470: FOOTSCRAY | D470: ROBINSON | G470: MARMO | J470: HINCH | M470: TODD | P470: GREGORY | S470: MOLYNEUX
A471: NORTH MELBOURNE | D471: SICILY | G471: LONERGEN | J471: McSWEENEY | M471: P SMITH | P471: ETHELL | S471: GEGGIE
A472: GOALKICKERS
A473: FOOTSCRAY | D473: DALY 3 | G473: DECOIT 2 | J473: GREGORY 2
A474: NORTH MELBOURNE | D474: QUILLIGAN 2 | G474: LONDERIGON | J474: SICILY
A476: PORT MELBOURNE | C476: 4 | D476: 5 | E476: =C476*6+D476 -> 29 | G476: 6 | H476: 5 | I476: =G476*6+H476 -> 41 | K476: 6 | L476: 7 | M476: =K476*6+L476 -> 43 | O476: 10 | P476: 9 | Q476: =O476*6+P476 -> 69 | S476: NORTH MELB
A477: WEST MELBOURNE | C477: 1 | D477: 1 | E477: =C477*6+D477 -> 7 | G477: 4 | H477: 4 | I477: =G477*6+H477 -> 28 | K477: 6 | L477: 6 | M477: =K477*6+L477 -> 42 | O477: 7 | P477: 8 | Q477: =O477*6+P477 -> 50 | S477: STRANGER
A478: BEST PLAYERS
A479: PORT MELBOURNE | D479: KNOX | G479: McDONNELL | J479: McGEE | M479: HUTCHINSON | P479: WILLIAMSON | S479: PENDLETON
A480: WEST MELBOURNE | D480: ROOKE | G480: POOLE | J480: MONTGOMERY | M480: LINQUIST | P480: TWITCHETT | S480: RYAN
A481: GOALKICKERS
A482: PORT MELBOURNE | D482: WOODS 6 | G482: HUTCHINSON 2 | K482: POWELL | N482: PILLAR
A483: WEST MELBOURNE | D483: RYAN 2 | G483: POOLE 2 | J483: WILLIAMS | M483: STONE | O483: ROOKE
A485: BYE | C485: BRUNSWICK
A487: ROUND 13 | E487: 21ST JULY | I487: WEATHER | L487: CLOUDY BUT FINE
C488: 1ST QTR | G488: 2ND QTR | K488: 3RD QTR | O488: FINAL | S488: AT
A489: WILLIAMSTOWN | C489: 0 | D489: 0 | E489: =C489*6+D489 -> 0 | G489: 3 | H489: 1 | I489: =G489*6+H489 -> 19 | K489: 5 | L489: 3 | M489: =K489*6+L489 -> 33 | O489: 7 | P489: 5 | Q489: =O489*6+P489 -> 47 | S489: WILLIAMSTOWN | W489: LADDER | AB489: ROUND | AD489: 13
A490: ESSENDON TOWN | C490: 1 | D490: 3 | E490: =C490*6+D490 -> 9 | G490: 2 | H490: 5 | I490: =G490*6+H490 -> 17 | K490: 4 | L490: 6 | M490: =K490*6+L490 -> 30 | O490: 4 | P490: 7 | Q490: =O490*6+P490 -> 31 | S490: MURPHY
A491: BEST PLAYERS | W491: TEAM | X491: W | Y491: L | Z491: D | AA491: FOR | AB491: AGST | AC491: % | AD491: PTS
A492: WILLIAMSTOWN | D492: BREMNER | G492: BARNES | J492: WARREN | L492: BARTY | N492: VINEY | Q492: HOUGHTON
A493: ESSENDON TOWN | D493: TESTER | G493: BARR | J493: WATSON | L493: HINDS | N493: WATTS | Q493: SHELDON | W493: FOOTSCRAY | X493: 11 | Y493: 1 | Z493: 0 | AA493: 607 | AB493: 237 | AC493: 256.12 | AD493: 44
A494: GOALKICKERS | W494: WILLIAMSTOWN | X494: 11 | Y494: 1 | Z494: 0 | AA494: 370 | AB494: 235 | AC494: 157.45 | AD494: 44
A495: WILLIAMSTOWN | D495: STANILAND 2 | G495: WARREN 2 | J495: OGILVIE 2 | M495: McKINLEY | W495: RICHMOND | X495: 8 | Y495: 4 | Z495: 0 | AA495: 394 | AB495: 413 | AC495: 95.4 | AD495: 32
A496: ESSENDON TOWN | D496: WATTS 2 | G496: KENNEDY 2 | W496: PORT MELBOURNE | X496: 6 | Y496: 5 | Z496: 0 | AA496: 381 | AB496: 383 | AC496: 99.48 | AD496: 24
A498: RICHMOND | C498: 0 | D498: 1 | E498: =C498*6+D498 -> 1 | G498: 0 | H498: 1 | I498: =G498*6+H498 -> 1 | K498: 3 | L498: 4 | M498: =K498*6+L498 -> 22 | O498: 3 | P498: 7 | Q498: =O498*6+P498 -> 25 | S498: RICHMOND | W498: PRAHRAN | X498: 5 | Y498: 6 | Z498: 0 | AA498: 453 | AB498: 444 | AC498: 102.03 | AD498: 20
A499: BRUNSWICK | C499: 0 | D499: 0 | E499: =C499*6+D499 -> 0 | G499: 3 | H499: 3 | I499: =G499*6+H499 -> 21 | K499: 3 | L499: 3 | M499: =K499*6+L499 -> 21 | O499: 3 | P499: 5 | Q499: =O499*6+P499 -> 23 | S499: STRANGER | W499: BRUNSWICK | X499: 4 | Y499: 7 | Z499: 0 | AA499: 319 | AB499: 327 | AC499: 97.55 | AD499: 16
A500: BEST PLAYERS | W500: NORTH MELBOURNE | X500: 4 | Y500: 8 | Z500: 0 | AA500: 392 | AB500: 445 | AC500: 88.09 | AD500: 16
A501: RICHMOND | D501: TAYLOR | G501: McNAIR | J501: C BACKHOUSE | M501: EDMUNDS | O501: O'NEILL | R501: ANDERSON | W501: ESSENDON TOWN | X501: 2 | Y501: 10 | Z501: 0 | AA501: 325 | AB501: 481 | AC501: 67.57 | AD501: 8
A502: BRUNSWICK | D502: SHELLNACK | G502: McKENZIE | J502: TEMPLE | M502: CASEY | O502: F ANDREWS | R502: H LANDELLS | W502: WEST MELBOURNE | X502: 1 | Y502: 10 | Z502: 0 | AA502: 277 | AB502: 553 | AC502: 50.09 | AD502: 4
A503: GOALKICKERS
A504: RICHMOND | D504: C BACKHOUSE | G504: PARKER | J504: TAYLOR
A505: BRUNSWICK | D505: H LANDELLS 2 | G505: TUCKER
A507: PRAHRAN | C507: 3 | D507: 8 | E507: =C507*6+D507 -> 26 | G507: 4 | H507: 8 | I507: =G507*6+H507 -> 32 | K507: 7 | L507: 13 | M507: =K507*6+L507 -> 55 | O507: 8 | P507: 13 | Q507: =O507*6+P507 -> 61 | S507: NORTH MELB
A508: NORTH MELBOURNE | C508: 0 | D508: 0 | E508: =C508*6+D508 -> 0 | G508: 1 | H508: 1 | I508: =G508*6+H508 -> 7 | K508: 1 | L508: 1 | M508: =K508*6+L508 -> 7 | O508: 3 | P508: 6 | Q508: =O508*6+P508 -> 24 | S508: ARMSTRONG
A509: BEST PLAYERS
A510: PRAHRAN | D510: G BROWN | G510: McINERNEY | J510: LYONS | M510: DOWLING | P510: DUNNE | R510: WILLISON
A511: NORTH MELBOURNE | D511: TORPEY | G511: GRAHAM | J511: SMITH | M511: LONERGEN | P511: ETHELL | R511: COVE
A512: GOALKICKERS
A513: PRAHRAN | D513: PHILLIPS 3 | G513: DOWNES 2 | J513: HERBERT | L513: CUMMINGS | O513: G BROWN
A514: NORTH MELBOURNE | D514: TORPEY 2 | G514: GEGGIE
A516: FOOTSCRAY | C516: 0 | D516: 5 | E516: =C516*6+D516 -> 5 | G516: 0 | H516: 8 | I516: =G516*6+H516 -> 8 | K516: 2 | L516: 15 | M516: =K516*6+L516 -> 27 | O516: 4 | P516: 16 | Q516: =O516*6+P516 -> 40 | S516: FOOTSCRAY
A517: WEST MELBOURNE | C517: 0 | D517: 0 | E517: =C517*6+D517 -> 0 | G517: 2 | H517: 2 | I517: =G517*6+H517 -> 14 | K517: 2 | L517: 2 | M517: =K517*6+L517 -> 14 | O517: 2 | P517: 5 | Q517: =O517*6+P517 -> 17 | S517: HOWELL
A518: BEST PLAYERS
A519: FOOTSCRAY | D519: HINCH | G519: MARMO | J519: McCARTHY | M519: DALY | P519: DECOIT | R519: MITCHELL
A520: WEST MELBOURNE | D520: WILLIAMS | G520: STONE | J520: TWITCHETT | M520: PAGE
A521: GOALKICKERS
A522: FOOTSCRAY | D522: DALY 3 | G522: GREGORY
A523: WEST MELBOURNE | D523: MORGAN | G523: WILLIAMS | J523: TWITCHETT
A525: BYE | C525: PORT MELBOURNE
A527: ROUND 14 | E527: 4TH AUGUST | I527: WEATHER | L527: NORTH WIND
C528: 1ST QTR | G528: 2ND QTR | K528: 3RD QTR | O528: FINAL | S528: AT
A529: WILLIAMSTOWN | C529: 1 | D529: 1 | E529: =C529*6+D529 -> 7 | G529: 1 | H529: 8 | I529: =G529*6+H529 -> 14 | K529: 1 | L529: 14 | M529: =K529*6+L529 -> 20 | O529: 2 | P529: 17 | Q529: =O529*6+P529 -> 29 | S529: PORT MELB | W529: LADDER | AB529: ROUND | AD529: 14
A530: PORT MELBOURNE | C530: 1 | D530: 3 | E530: =C530*6+D530 -> 9 | G530: 1 | H530: 3 | I530: =G530*6+H530 -> 9 | K530: 2 | L530: 4 | M530: =K530*6+L530 -> 16 | O530: 2 | P530: 4 | Q530: =O530*6+P530 -> 16 | S530: ARMSTRONG
A531: BEST PLAYERS | W531: TEAM | X531: W | Y531: L | Z531: D | AA531: FOR | AB531: AGST | AC531: % | AD531: PTS
A532: WILLIAMSTOWN | D532: W HALL | F532: SPRINTHALL | I532: HOUGHTON | L532: REILLY | O532: CALDWELL | R532: EGAN
A533: PORT MELBOURNE | D533: POLLOCK | F533: HICKEY | I533: KNOX | L533: PENDLETON | O533: GARBUTT | R533: McNAMARA | W533: WILLIAMSTOWN | X533: 12 | Y533: 1 | Z533: 0 | AA533: 399 | AB533: 251 | AC533: 158.96 | AD533: 48
A534: GOALKICKERS | W534: FOOTSCRAY | X534: 11 | Y534: 1 | Z534: 0 | AA534: 607 | AB534: 237 | AC534: 256.12 | AD534: 44
A535: WILLIAMSTOWN | D535: STANILAND 2 | W535: RICHMOND | X535: 8 | Y535: 5 | Z535: 0 | AA535: 437 | AB535: 470 | AC535: 92.98 | AD535: 32
A536: PORT MELBOURNE | D536: WOODS 2 | W536: PRAHRAN | X536: 6 | Y536: 6 | Z536: 0 | AA536: 510 | AB536: 487 | AC536: 104.72 | AD536: 24
A538: ESSENDON TOWN | C538: 2 | D538: 0 | E538: =C538*6+D538 -> 12 | G538: 2 | H538: 2 | I538: =G538*6+H538 -> 14 | K538: 6 | L538: 4 | M538: =K538*6+L538 -> 40 | O538: 7 | P538: 5 | Q538: =O538*6+P538 -> 47 | S538: ESSENDON | W538: PORT MELBOURNE | X538: 6 | Y538: 6 | Z538: 0 | AA538: 397 | AB538: 412 | AC538: 96.36 | AD538: 24
A539: WEST MELBOURNE | C539: 2 | D539: 3 | E539: =C539*6+D539 -> 15 | G539: 3 | H539: 6 | I539: =G539*6+H539 -> 24 | K539: 3 | L539: 12 | M539: =K539*6+L539 -> 30 | O539: 4 | P539: 14 | Q539: =O539*6+P539 -> 38 | S539: STRANGER | W539: NORTH MELBOURNE | X539: 5 | Y539: 8 | Z539: 0 | AA539: 453 | AB539: 470 | AC539: 96.38 | AD539: 20
A540: BEST PLAYERS | W540: BRUNSWICK | X540: 4 | Y540: 8 | Z540: 0 | AA540: 344 | AB540: 388 | AC540: 88.66 | AD540: 16
A541: ESSENDON TOWN | D541: FLEMING | G541: CHARLES | J541: HINDS | L541: SHAW | N541: TESTER | Q541: KENNEDY | W541: ESSENDON TOWN | X541: 3 | Y541: 10 | Z541: 0 | AA541: 372 | AB541: 519 | AC541: 71.68 | AD541: 12
A542: WEST MELBOURNE | D542: LINQUIST | G542: MONTGOMERY | J542: RYAN | L542: GREGORY | N542: GREGORY | Q542: ROOKE | W542: WEST MELBOURNE | X542: 1 | Y542: 11 | Z542: 0 | AA542: 315 | AB542: 600 | AC542: 52.5 | AD542: 4
A543: GOALKICKERS
A544: ESSENDON TOWN | D544: KENNEDY 3 | G544: WATTS 2 | J544: J SHAW 2
A545: WEST MELBOURNE | D545: WILLIAMS 2 | G545: RYAN 2
A547: PRAHRAN | C547: 0 | D547: 0 | E547: =C547*6+D547 -> 0 | G547: 2 | H547: 1 | I547: =G547*6+H547 -> 13 | K547: 4 | L547: 2 | M547: =K547*6+L547 -> 26 | O547: 9 | P547: 3 | Q547: =O547*6+P547 -> 57 | S547: TOORAK PK
A548: RICHMOND | C548: 0 | D548: 1 | E548: =C548*6+D548 -> 1 | G548: 1 | H548: 2 | I548: =G548*6+H548 -> 8 | K548: 4 | L548: 6 | M548: =K548*6+L548 -> 30 | O548: 6 | P548: 7 | Q548: =O548*6+P548 -> 43 | S548: McWHINNEY
A549: BEST PLAYERS
A550: PRAHRAN | D550: WESTBROOKE | G550: G CBROWN | J550: WILLISON | M550: DOWLING | P550: LYONS | S550: McINERNEY
A551: RICHMOND | D551: EDMUNDS | G551: T WATSON | J551: RUDD | M551: G BACKHOUSE | P551: BAHEN | S551: McNAIR
A552: GOALKICKERS
A553: PRAHRAN | D553: WESTBROOKE 2 | G553: DUNNE 2 | J553: G BROWN 2 | M553: DOWNES | O553: CUMMINGS | R553: MccLUMPA
A554: RICHMOND | D554: G BACKHOUSE 4 | H554: McCOLL | K554: BAHEN
A556: NORTH MELBOURNE | C556: 2 | D556: 4 | E556: =C556*6+D556 -> 16 | G556: 6 | H556: 5 | I556: =G556*6+H556 -> 41 | K556: 8 | L556: 6 | M556: =K556*6+L556 -> 54 | O556: 9 | P556: 7 | Q556: =O556*6+P556 -> 61 | S556: NORTH MELB
A557: BRUNSWICK | C557: 2 | D557: 1 | E557: =C557*6+D557 -> 13 | G557: 2 | H557: 1 | I557: =G557*6+H557 -> 13 | K557: 4 | L557: 1 | M557: =K557*6+L557 -> 25 | O557: 4 | P557: 1 | Q557: =O557*6+P557 -> 25 | S557: HOWELL
A558: BEST PLAYERS
A559: NORTH MELBOURNE | D559: NOONAN | G559: BOYLE | J559: GEGGIE | M559: LONERGEN | P559: SMITH | S559: GRAHAM
A560: BRUNSWICK | D560: McKENZIE | G560: W ANDREWS | J560: COBURN | M560: GOWERS | P560: SHELLNACK | S560: GRAVINO
A561: GOALKICKERS
A562: NORTH MELBOURNE | D562: QUILLIGAN 3 | G562: TORPEY 3 | J562: SICILY 2 | M562: GRAHAM
A563: BRUNSWICK | D563: McKENZIE 4
A565: BYE | C565: FOOTSCRAY
A567: ROUND 15 | E567: 11TH AUGUST | I567: WEATHER | L567: FINE LIGHT N WIND
C568: 1ST QTR | G568: 2ND QTR | K568: 3RD QTR | O568: FINAL | S568: AT
A569: WILLIAMSTOWN | C569: 0 | D569: 1 | E569: =C569*6+D569 -> 1 | G569: 6 | H569: 4 | I569: =G569*6+H569 -> 40 | K569: 9 | L569: 9 | M569: =K569*6+L569 -> 63 | O569: 13 | P569: 13 | Q569: =O569*6+P569 -> 91 | S569: WILLIAMSTOWN | W569: LADDER | AB569: ROUND | AD569: 15
A570: WEST MELBOURNE | C570: 2 | D570: 4 | E570: =C570*6+D570 -> 16 | G570: 4 | H570: 4 | I570: =G570*6+H570 -> 28 | K570: 5 | L570: 5 | M570: =K570*6+L570 -> 35 | O570: 5 | P570: 5 | Q570: =O570*6+P570 -> 35 | S570: DEVINE
A571: BEST PLAYERS | W571: TEAM | X571: W | Y571: L | Z571: D | AA571: FOR | AB571: AGST | AC571: % | AD571: PTS
A572: WILLIAMSTOWN | D572: McWILLIAMS | G572: BREMNER | J572: SPRINTHALL | M572: EGAN | O572: HALL | Q572: CALDWELL
A573: WEST MELBOURNE | D573: ROBERTS | G573: LAXTON | J573: ROOKE | M573: POOLE | O573: GOURLEY | Q573: WILLIAMS | W573: WILLIAMSTOWN | X573: 13 | Y573: 1 | Z573: 0 | AA573: 490 | AB573: 286 | AC573: 171.33 | AD573: 52
A574: GOALKICKERS | W574: FOOTSCRAY | X574: 12 | Y574: 1 | Z574: 0 | AA574: 653 | AB574: 259 | AC574: 252.12 | AD574: 48
A575: WILLIAMSTOWN | D575: STANILAND 6 | G575: BARTY 3 | J575: WARREN | L575: CARTER | N575: BARNES | P575: HOUSTEN | W575: RICHMOND | X575: 9 | Y575: 5 | Z575: 0 | AA575: 491 | AB575: 497 | AC575: 98.79 | AD575: 36
A576: WEST MELBOURNE | D576: MORGAN 2 | G576: RYAN | J576: McGUINNESS | M576: WILLIAMS | W576: PRAHRAN | X576: 6 | Y576: 7 | Z576: 0 | AA576: 532 | AB576: 533 | AC576: 99.81 | AD576: 24
A578: BRUNSWICK | C578: 0 | D578: 0 | E578: =C578*6+D578 -> 0 | G578: 3 | H578: 7 | I578: =G578*6+H578 -> 25 | K578: 4 | L578: 9 | M578: =K578*6+L578 -> 33 | O578: 5 | P578: 12 | Q578: =O578*6+P578 -> 42 | S578: BRUNSWICK | W578: PORT MELBOURNE | X578: 6 | Y578: 6 | Z578: 0 | AA578: 424 | AB578: 466 | AC578: 90.99 | AD578: 24
A579: ESSENDON TOWN | C579: 1 | D579: 0 | E579: =C579*6+D579 -> 6 | G579: 1 | H579: 0 | I579: =G579*6+H579 -> 6 | K579: 2 | L579: 2 | M579: =K579*6+L579 -> 14 | O579: 2 | P579: 4 | Q579: =O579*6+P579 -> 16 | S579: MURPHY | W579: NORTH MELBOURNE | X579: 5 | Y579: 8 | Z579: 0 | AA579: 453 | AB579: 470 | AC579: 96.38 | AD579: 20
A580: BEST PLAYERS | W580: BRUNSWICK | X580: 5 | Y580: 8 | Z580: 0 | AA580: 386 | AB580: 404 | AC580: 95.54 | AD580: 20
A581: BRUNSWICK | D581: McKENZIE | G581: LANDELLS | J581: JOHNSON | M581: ROBERTSON | O581: CLEMENTS | R581: CASEY | W581: ESSENDON TOWN | X581: 3 | Y581: 11 | Z581: 0 | AA581: 388 | AB581: 561 | AC581: 69.16 | AD581: 12
A582: ESSENDON TOWN | D582: BARR | G582: KENNEDY | J582: WILLIAMS | M582: MARTIN | O582: SHAW | R582: FLEMING | W582: WEST MELBOURNE | X582: 1 | Y582: 12 | Z582: 0 | AA582: 350 | AB582: 691 | AC582: 50.65 | AD582: 4
A583: GOALKICKERS
A584: BRUNSWICK | D584: TUCKER 2 | G584: McKENZIE | J584: ROBERTSON | M584: LANDELLS
A585: ESSENDON TOWN | D585: SWEATMAN | G585: MARTIN
A587: RICHMOND | C587: 1 | D587: 9 | E587: =C587*6+D587 -> 15 | G587: 3 | H587: 13 | I587: =G587*6+H587 -> 31 | K587: 4 | L587: 15 | M587: =K587*6+L587 -> 39 | O587: 6 | P587: 18 | Q587: =O587*6+P587 -> 54 | S587: RICHMOND
A588: PORT MELBOURNE | C588: 1 | D588: 1 | E588: =C588*6+D588 -> 7 | G588: 1 | H588: 1 | I588: =G588*6+H588 -> 7 | K588: 3 | L588: 1 | M588: =K588*6+L588 -> 19 | O588: 4 | P588: 3 | Q588: =O588*6+P588 -> 27 | S588: HOOD
A589: BEST PLAYERS
A590: RICHMOND | D590: PARKER | G590: McNAIR | J590: DAVIDSON | M590: C BACKHOUSE | P590: MILNE | S590: T WATSON
A591: PORT MELBOURNE | D591: McGEE | G591: McDONALD | J591: POLLOCK | M591: McCONACHIE | P591: HUTCHINSON | S591: SWANNIE
A592: GOALKICKERS
A593: RICHMOND | D593: BACKHOUSE 2 | G593: MILNE 2 | J593: McCOLL | M593: DAVIDSON
A594: PORT MELBOURNE | D594: SWANNIE | G594: HUTCHINSON | J594: PILLAR | M594: WOODS
A596: FOOTSCRAY | C596: 1 | D596: 3 | E596: =C596*6+D596 -> 9 | G596: 3 | H596: 7 | I596: =G596*6+H596 -> 25 | K596: 4 | L596: 8 | M596: =K596*6+L596 -> 32 | O596: 6 | P596: 10 | Q596: =O596*6+P596 -> 46 | S596: TOORAK PK
A597: PRAHRAN | C597: 0 | D597: 3 | E597: =C597*6+D597 -> 3 | G597: 0 | H597: 4 | I597: =G597*6+H597 -> 4 | K597: 2 | L597: 10 | M597: =K597*6+L597 -> 22 | O597: 2 | P597: 10 | Q597: =O597*6+P597 -> 22 | S597: ARMSTRONG
A598: BEST PLAYERS
A599: FOOTSCRAY | D599: DALY | G599: DECOIT | J599: MARMO | M599: HARRIS | P599: TODD | S599: KRUSE
A600: PRAHRAN | D600: LYONS | G600: T BROWN | J600: G BROWN | M600: McINERNEY | P600: DUNNE | S600: WILLISON
A601: GOALKICKERS
A602: FOOTSCRAY | D602: DALY 4 | G602: MITCHELL 2
A603: PRAHRAN | D603: CUMMINGS | G603: JOHNSON
A605: BYE | C605: NORTH MELBOURNE
A607: ROUND 16 | E607: 18TH AUGUST | I607: WEATHER | L607: STRONG WEST WIND RAIN
C608: 1ST QTR | G608: 2ND QTR | K608: 3RD QTR | O608: FINAL | S608: AT
A609: FOOTSCRAY | C609: 3 | D609: 7 | E609: =C609*6+D609 -> 25 | G609: 4 | H609: 9 | I609: =G609*6+H609 -> 33 | K609: 6 | L609: 14 | M609: =K609*6+L609 -> 50 | O609: 8 | P609: 15 | Q609: =O609*6+P609 -> 63 | S609: FOOTSCRAY | W609: LADDER | AB609: ROUND | AD609: 16
A610: WILLIAMSTOWN | C610: 0 | D610: 1 | E610: =C610*6+D610 -> 1 | G610: 1 | H610: 3 | I610: =G610*6+H610 -> 9 | K610: 2 | L610: 4 | M610: =K610*6+L610 -> 16 | O610: 3 | P610: 5 | Q610: =O610*6+P610 -> 23 | S610: MURPHY
A611: BEST PLAYERS | W611: TEAM | X611: W | Y611: L | Z611: D | AA611: FOR | AB611: AGST | AC611: % | AD611: PTS
A612: FOOTSCRAY | D612: HINCH | G612: ROBINSON | J612: MARMO | L612: DREW | N612: TODD | Q612: WILLIAMS
A613: WILLIAMSTOWN | D613: BREMNER | G613: VINEY | J613: OUTEN | L613: WARREN | N613: HOUGHTON | Q613: McWILLIAMS | W613: FOOTSCRAY | X613: 13 | Y613: 1 | Z613: 0 | AA613: 716 | AB613: 282 | AC613: 253.9 | AD613: 52
A614: GOALKICKERS | W614: WILLIAMSTOWN | X614: 13 | Y614: 2 | Z614: 0 | AA614: 513 | AB614: 349 | AC614: 146.99 | AD614: 52
A615: FOOTSCRAY | D615: MITCHELL 2 | G615: DECOIT 2 | J615: GREGORY 2 | M615: WILLIAMS | O615: MONTGARRETT | W615: RICHMOND | X615: 9 | Y615: 5 | Z615: 0 | AA615: 491 | AB615: 497 | AC615: 98.79 | AD615: 36
A616: WILLIAMSTOWN | D616: WARREN 2 | G616: WORROLL | W616: PRAHRAN | X616: 7 | Y616: 7 | Z616: 0 | AA616: 578 | AB616: 549 | AC616: 105.28 | AD616: 28
A618: NORTH MELBOURNE | C618: 3 | D618: 4 | E618: =C618*6+D618 -> 22 | G618: 3 | H618: 4 | I618: =G618*6+H618 -> 22 | K618: 6 | L618: 7 | M618: =K618*6+L618 -> 43 | O618: 6 | P618: 9 | Q618: =O618*6+P618 -> 45 | S618: ESSENDON | W618: BRUNSWICK | X618: 6 | Y618: 8 | Z618: 0 | AA618: 427 | AB618: 426 | AC618: 100.23 | AD618: 24
A619: ESSENDON TOWN | C619: 0 | D619: 0 | E619: =C619*6+D619 -> 0 | G619: 2 | H619: 2 | I619: =G619*6+H619 -> 14 | K619: 3 | L619: 4 | M619: =K619*6+L619 -> 22 | O619: 5 | P619: 8 | Q619: =O619*6+P619 -> 38 | S619: McWHINNEY | W619: NORTH MELBOURNE | X619: 6 | Y619: 8 | Z619: 0 | AA619: 498 | AB619: 508 | AC619: 98.03 | AD619: 24
A620: BEST PLAYERS | W620: PORT MELBOURNE | X620: 6 | Y620: 8 | Z620: 0 | AA620: 446 | AB620: 507 | AC620: 87.97 | AD620: 24
A621: NORTH MELBOURNE | D621: SICILY | G621: NOONAN | J621: MONTGOMERIE | M621: BOYLE | O621: GRAHAM | R621: SYKES | W621: ESSENDON TOWN | X621: 3 | Y621: 12 | Z621: 0 | AA621: 426 | AB621: 606 | AC621: 70.3 | AD621: 12
A622: ESSENDON TOWN | D622: KENNEDY | G622: BARR | J622: FLEMING | M622: HINDS | O622: SWEATMAN | R622: CHARLES | W622: WEST MELBOURNE | X622: 1 | Y622: 13 | Z622: 0 | AA622: 366 | AB622: 737 | AC622: 49.66 | AD622: 4
A623: GOALKICKERS
A624: NORTH MELBOURNE | D624: TORPEY 2 | G624: RECKIE | J624: NOONAN | M624: SICILY | O624: GEGGIE
A625: ESSENDON TOWN | D625: WATTS 2 | G625: CARTON | J625: DOWNIE | M625: MARTIN
A627: BRUNSWICK | C627: 0 | D627: 1 | E627: =C627*6+D627 -> 1 | G627: 3 | H627: 2 | I627: =G627*6+H627 -> 20 | K627: 5 | L627: 3 | M627: =K627*6+L627 -> 33 | O627: 6 | P627: 5 | Q627: =O627*6+P627 -> 41 | S627: BRUNSWICK
A628: PORT MELBOURNE | C628: 1 | D628: 1 | E628: =C628*6+D628 -> 7 | G628: 1 | H628: 1 | I628: =G628*6+H628 -> 7 | K628: 2 | L628: 3 | M628: =K628*6+L628 -> 15 | O628: 3 | P628: 4 | Q628: =O628*6+P628 -> 22 | S628: DEVINE
A629: BEST PLAYERS
A630: BRUNSWICK | D630: H LANDELLS | G630: W ANDREWS | J630: HARRIS | M630: CASEY | P630: CLEMENTS | S630: JOHNSON
A631: PORT MELBOURNE | D631: McDONALD | G631: GARBUTT | J631: WARD | M631: O'BRIEN | P631: PILLAR | S631: McGEE
A632: GOALKICKERS
A633: BRUNSWICK | D633: LANDELLS 2 | G633: CLEMENTS | J633: TEMPLE | M633: JOHNSON | P633: McKENZIE
A634: PORT MELBOURNE | D634: HUTCHINSON | G634: LAWSON | J634: O'BRIEN
A636: PRAHRAN | C636: 2 | D636: 5 | E636: =C636*6+D636 -> 17 | G636: 2 | H636: 5 | I636: =G636*6+H636 -> 17 | K636: 5 | L636: 10 | M636: =K636*6+L636 -> 40 | O636: 6 | P636: 10 | Q636: =O636*6+P636 -> 46 | S636: NORTH MELB
A637: WEST MELBOURNE | C637: 0 | D637: 0 | E637: =C637*6+D637 -> 0 | G637: 2 | H637: 2 | I637: =G637*6+H637 -> 14 | K637: 2 | L637: 2 | M637: =K637*6+L637 -> 14 | O637: 2 | P637: 4 | Q637: =O637*6+P637 -> 16 | S637: HOWELL
A638: BEST PLAYERS
A639: PRAHRAN
A640: WEST MELBOURNE
A641: GOALKICKERS
A642: PRAHRAN | D642: CUMMINGS 2 | G642: PHILLIPS | J642: McINERNEY | M642: DUNNE | O642: LYONS
A643: WEST MELBOURNE | D643: STONE 2
A645: BYE | C645: RICHMOND
A647: ROUND 17 | E647: 25TH AUGUST | I647: WEATHER | L647: STRONG NORTH WIND CLOUDY
C648: 1ST QTR | G648: 2ND QTR | K648: 3RD QTR | O648: FINAL | S648: AT
A649: PRAHRAN | C649: 1 | D649: 0 | E649: =C649*6+D649 -> 6 | G649: 6 | H649: 4 | I649: =G649*6+H649 -> 40 | K649: 7 | L649: 4 | M649: =K649*6+L649 -> 46 | O649: 9 | P649: 9 | Q649: =O649*6+P649 -> 63 | S649: TOORAK PK | W649: LADDER | AB649: ROUND | AD649: 17
A650: WILLIAMSTOWN | C650: 1 | D650: 6 | E650: =C650*6+D650 -> 12 | G650: 2 | H650: 6 | I650: =G650*6+H650 -> 18 | K650: 6 | L650: 12 | M650: =K650*6+L650 -> 48 | O650: 7 | P650: 13 | Q650: =O650*6+P650 -> 55 | S650: McWHINNEY
A651: BEST PLAYERS | W651: TEAM | X651: W | Y651: L | Z651: D | AA651: FOR | AB651: AGST | AC651: % | AD651: PTS
A652: PRAHRAN | D652: LYONS | F652: DUNNE | H652: McINERNEY | K652: G BROWN | N652: JAMES | Q652: WILLISON
A653: WILLIAMSTOWN | D653: RILEY | F653: VINEY | H653: OUTEN | K653: WARREN | N653: STANILAND | Q653: BARNES | W653: FOOTSCRAY | X653: 14 | Y653: 1 | Z653: 0 | AA653: 799 | AB653: 315 | AC653: 253.65 | AD653: 56
A654: GOALKICKERS | W654: WILLIAMSTOWN | X654: 13 | Y654: 3 | Z654: 0 | AA654: 568 | AB654: 412 | AC654: 137.86 | AD654: 52
A655: PRAHRAN | D655: CUMMINGS 2 | G655: G BROWN 2 | J655: HERBERT | M655: McCLUMPA | O655: LYONS | Q655: KRUGER | S655: LAXTON | W655: RICHMOND | X655: 10 | Y655: 5 | Z655: 0 | AA655: 514 | AB655: 515 | AC655: 99.81 | AD655: 40
A656: WILLIAMSTOWN | D656: STANILAND 3 | G656: GUTHRIE | J656: WARREN | M656: OUTEN | O656: RILEY | W656: PRAHRAN | X656: 8 | Y656: 7 | Z656: 0 | AA656: 641 | AB656: 604 | AC656: 106.13 | AD656: 32
A658: RICHMOND | C658: 0 | D658: 0 | E658: =C658*6+D658 -> 0 | G658: 1 | H658: 3 | I658: =G658*6+H658 -> 9 | K658: 2 | L658: 4 | M658: =K658*6+L658 -> 16 | O658: 3 | P658: 5 | Q658: =O658*6+P658 -> 23 | S658: NORTH MELB | W658: PORT MELBOURNE | X658: 7 | Y658: 8 | Z658: 0 | AA658: 473 | AB658: 531 | AC658: 89.08 | AD658: 28
A659: WEST MELBOURNE | C659: 2 | D659: 1 | E659: =C659*6+D659 -> 13 | G659: 2 | H659: 1 | I659: =G659*6+H659 -> 13 | K659: 2 | L659: 5 | M659: =K659*6+L659 -> 17 | O659: 2 | P659: 6 | Q659: =O659*6+P659 -> 18 | S659: HOOD | W659: NORTH MELBOURNE | X659: 6 | Y659: 9 | Z659: 0 | AA659: 522 | AB659: 535 | AC659: 97.57 | AD659: 24
A660: BEST PLAYERS | W660: BRUNSWICK | X660: 6 | Y660: 9 | Z660: 0 | AA660: 460 | AB660: 509 | AC660: 90.37 | AD660: 24
A661: RICHMOND | D661: C BACKHOUSE | G661: McNAIR | J661: D WATSON | M661: HARDIMAN | O661: TAYLOR | R661: PARKER | W661: ESSENDON TOWN | X661: 3 | Y661: 12 | Z661: 0 | AA661: 426 | AB661: 606 | AC661: 70.3 | AD661: 12
A662: WEST MELBOURNE | D662: D GREGORY | G662: F GREGORY | J662: TWITCHETT | M662: ROOKE | O662: POOLE | R662: HOOPER | W662: WEST MELBOURNE | X662: 1 | Y662: 14 | Z662: 0 | AA662: 384 | AB662: 760 | AC662: 50.53 | AD662: 4
A663: GOALKICKERS
A664: RICHMOND | D664: G BACKHOUSE | G664: McNAIR | J664: DAVIDSON
A665: WEST MELBOURNE | D665: RYAN | G665: GOURLAY
A667: FOOTSCRAY | C667: 0 | D667: 3 | E667: =C667*6+D667 -> 3 | G667: 5 | H667: 10 | I667: =G667*6+H667 -> 40 | K667: 6 | L667: 10 | M667: =K667*6+L667 -> 46 | O667: 11 | P667: 17 | Q667: =O667*6+P667 -> 83 | S667: FOOTSCRAY
A668: BRUNSWICK | C668: 1 | D668: 3 | E668: =C668*6+D668 -> 9 | G668: 1 | H668: 3 | I668: =G668*6+H668 -> 9 | K668: 5 | L668: 3 | M668: =K668*6+L668 -> 33 | O668: 5 | P668: 3 | Q668: =O668*6+P668 -> 33 | S668: STRANGER
A669: BEST PLAYERS
A670: FOOTSCRAY | D670: McCARTHY | G670: WILLIAMS | J670: McCANCE | M670: ROBINSON | P670: TODD
A671: BRUNSWICK | D671: ROBERTSON | G671: WHELAN | J671: McKENZIE | M671: LANDELLS | P671: SHELLNACK | S671: CLEMENTS
A672: GOALKICKERS
A673: FOOTSCRAY | D673: DALY 4 | G673: DECOIT 2 | J673: GRUNDEN | L673: MOLYNEUX | O673: McCARTHY | R673: MITCHELL | U673: ROBINSON
A674: BRUNSWICK | D674: CLEMENTS 2 | G674: McKENZIE 2 | K674: H LANDELLS
A676: PORT MELBOURNE | C676: 0 | D676: 1 | E676: =C676*6+D676 -> 1 | G676: 1 | H676: 2 | I676: =G676*6+H676 -> 8 | K676: 3 | L676: 2 | M676: =K676*6+L676 -> 20 | O676: 4 | P676: 3 | Q676: =O676*6+P676 -> 27 | S676: PORT MELB
A677: NORTH MELBOURNE | C677: 1 | D677: 3 | E677: =C677*6+D677 -> 9 | G677: 1 | H677: 4 | I677: =G677*6+H677 -> 10 | K677: 2 | L677: 6 | M677: =K677*6+L677 -> 18 | O677: 3 | P677: 6 | Q677: =O677*6+P677 -> 24 | S677: ARMSTRONG
A678: BEST PLAYERS
A679: PORT MELBOURNE | D679: SWANNIE | G679: McGEE | J679: WILLIAMSON | M679: PILLAR | P679: McCONACHIE | S679: WOODS
A680: NORTH MELBOURNE | D680: NOONAN | G680: ETHELL | J680: A RECKIE | M680: GRAHAM | P680: SICILY | S680: TORPEY
A681: GOALKICKERS
A682: PORT MELBOURNE | D682: PILLAR 2 | G682: COOMBS | J682: HUTCHINSON
A683: NORTH MELBOURNE | D683: A RECKIE | G683: C SMITH | J683: GORRY???
A685: BYE | C685: ESSENDON TOWN
A687: ROUND 18 | E687: 1ST SEPTEMBER | I687: WEATHER | L687: SOUTH WIND SHOWERS
C688: 1ST QTR | G688: 2ND QTR | K688: 3RD QTR | O688: FINAL | S688: AT
A689: PORT MELBOURNE | C689: 3 | D689: 6 | E689: =C689*6+D689 -> 24 | G689: 4 | H689: 10 | I689: =G689*6+H689 -> 34 | K689: 5 | L689: 12 | M689: =K689*6+L689 -> 42 | O689: 8 | P689: 15 | Q689: =O689*6+P689 -> 63 | S689: PORT MELBOURNE
A690: ESSENDON TOWN | C690: 0 | D690: 0 | E690: =C690*6+D690 -> 0 | G690: 1 | H690: 2 | I690: =G690*6+H690 -> 8 | K690: 2 | L690: 3 | M690: =K690*6+L690 -> 15 | O690: 2 | P690: 4 | Q690: =O690*6+P690 -> 16 | S690: MURPHY | W690: LADDER | AB690: ROUND | AD690: 18
A691: BEST PLAYERS
A692: PORT MELBOURNE | D692: GARBUTT | F692: WILLIAMSON | J692: O'BRIEN | M692: MILLER | O692: SWANNIE | R692: McGEE | W692: TEAM | X692: W | Y692: L | Z692: D | AA692: FOR | AB692: AGST | AC692: % | AD692: PTS
A693: ESSENDON TOWN | D693: BARR | F693: FLEMING | J693: GORMAN
A694: GOALKICKERS | W694: FOOTSCRAY | X694: 15 | Y694: 1 | Z694: 0 | AA694: 848 | AB694: 351 | AC694: 241.6 | AD694: 60
A695: PORT MELBOURNE | D695: HUTCHINSON 3 | G695: SWANNIE 2 | J695: WOODS 2 | M695: WARD | W695: WILLIAMSTOWN | X695: 13 | Y695: 3 | Z695: 0 | AA695: 568 | AB695: 412 | AC695: 137.86 | AD695: 52
A696: ESSENDON TOWN | D696: CHARLES | G696: TAYLOR | W696: RICHMOND | X696: 10 | Y696: 6 | Z696: 0 | AA696: 550 | AB696: 564 | AC696: 97.52 | AD696: 40
W697: PRAHRAN | X697: 9 | Y697: 7 | Z697: 0 | AA697: 689 | AB697: 637 | AC697: 108.16 | AD697: 36
A698: FOOTSCRAY | C698: 0 | D698: 2 | E698: =C698*6+D698 -> 2 | G698: 2 | H698: 7 | I698: =G698*6+H698 -> 19 | K698: 2 | L698: 8 | M698: =K698*6+L698 -> 20 | O698: 6 | P698: 13 | Q698: =O698*6+P698 -> 49 | S698: RICHMOND
A699: RICHMOND | C699: 2 | D699: 1 | E699: =C699*6+D699 -> 13 | G699: 4 | H699: 1 | I699: =G699*6+H699 -> 25 | K699: 5 | L699: 6 | M699: =K699*6+L699 -> 36 | O699: 5 | P699: 6 | Q699: =O699*6+P699 -> 36 | S699: DEVINE | W699: PORT MELBOURNE | X699: 8 | Y699: 8 | Z699: 0 | AA699: 536 | AB699: 547 | AC699: 97.99 | AD699: 32
A700: BEST PLAYERS | W700: NORTH MELBOURNE | X700: 7 | Y700: 9 | Z700: 0 | AA700: 582 | AB700: 560 | AC700: 103.93 | AD700: 28
A701: FOOTSCRAY | D701: TODD | F701: KRUSE | I701: ROBINSON | L701: DREW | N701: McCARTHY | Q701: MONTGARRETT | W701: BRUNSWICK | X701: 6 | Y701: 10 | Z701: 0 | AA701: 493 | AB701: 557 | AC701: 88.51 | AD701: 24
A702: RICHMOND | D702: McNAIR | F702: T WATSON | I702: C BACKHOUSE | L702: TAYLOR | N702: MILNE | Q702: PARKER | W702: ESSENDON TOWN | X702: 3 | Y702: 13 | Z702: 0 | AA702: 442 | AB702: 669 | AC702: 66.07 | AD702: 12
A703: GOALKICKERS | W703: WEST MELBOURNE | X703: 1 | Y703: 15 | Z703: 0 | AA703: 409 | AB703: 820 | AC703: 49.88 | AD703: 4
A704: FOOTSCRAY | D704: DALY 3 | G704: MONTGARRETT 2 | K704: DECOIT
A705: RICHMOND | D705: MILNE 2 | G705: PARKER 2 | K705: BAKER
A707: PRAHRAN | C707: 3 | D707: 2 | E707: =C707*6+D707 -> 20 | G707: 5 | H707: 2 | I707: =G707*6+H707 -> 32 | K707: 7 | L707: 6 | M707: =K707*6+L707 -> 48 | O707: 7 | P707: 6 | Q707: =O707*6+P707 -> 48 | S707: BRUNSWICK
A708: BRUNSWICK | C708: 0 | D708: 0 | E708: =C708*6+D708 -> 0 | G708: 1 | H708: 2 | I708: =G708*6+H708 -> 8 | K708: 1 | L708: 3 | M708: =K708*6+L708 -> 9 | O708: 4 | P708: 9 | Q708: =O708*6+P708 -> 33 | S708: HOWELL
A709: BEST PLAYERS
A710: PRAHRAN | D710: LYONS | G710: DUNNE | J710: G BROWN | M710: McINERNEY | P710: DOWDING | S710: JAMES
A711: BRUNSWICK | D711: McKENZIE | G711: CASEY | J711: FRANKLIN | M711: ROBERTSON | P711: TEMPLE | S711: JAMIESON
A712: GOALKICKERS
A713: PRAHRAN | D713: ROBERTS 3 | G713: CUMMINGS 2 | J713: LYONS | L713: McINERNEY
A714: BRUNSWICK | D714: JAMIESON 2 | G714: CLEMENTS | J714: McKENZIE
A716: NORTH MELBOURNE | C716: 0 | D716: 1 | E716: =C716*6+D716 -> 1 | G716: 3 | H716: 3 | I716: =G716*6+H716 -> 21 | K716: 5 | L716: 4 | M716: =K716*6+L716 -> 34 | O716: 9 | P716: 6 | Q716: =O716*6+P716 -> 60 | S716: NORTH MELB
A717: WEST MELBOURNE | C717: 2 | D717: 4 | E717: =C717*6+D717 -> 16 | G717: 3 | H717: 4 | I717: =G717*6+H717 -> 22 | K717: 3 | L717: 5 | M717: =K717*6+L717 -> 23 | O717: 3 | P717: 7 | Q717: =O717*6+P717 -> 25 | S717: HOOD
A718: BEST PLAYERS
A719: NORTH MELBOURNE | D719: NOONAN | G719: GRAHAM | J719: SICILY | L719: TORPEY | O719: MONTGOMERIE | S719: GORRY
A720: WEST MELBOURNE | D720: ROOKE | G720: McINNES | J720: POOLE | L720: TWITCHETT | O720: STONE | S720: D GREGORY
A721: GOALKICKERS
A722: NORTH MELBOURNE | D722: MONTGOMERIE 4 | H722: GORRY 2 | K722: SICILY | M722: C SMITH | O722: GRAHAM
A723: WEST MELBOURNE | D723: TWITCHETT | G723: STONE | J723: MORGAN
A725: BYE | C725: WILLIAMSTOWN
A727: CHARITY MATCH | E727: 15TH SEPTEMBER
A728: COMBINED V.F.A. | C728: 2 | D728: 6 | E728: =C728*6+D728 -> 18 | G728: 3 | H728: 7 | I728: =G728*6+H728 -> 25 | K728: 7 | L728: 10 | M728: =K728*6+L728 -> 52 | O728: 8 | P728: 13 | Q728: =O728*6+P728 -> 61 | S728: NORTH MELB
A729: FOOTSCRAY | C729: 0 | D729: 0 | E729: =C729*6+D729 -> 0 | G729: 3 | H729: 2 | I729: =G729*6+H729 -> 20 | K729: 3 | L729: 3 | M729: =K729*6+L729 -> 21 | O729: 3 | P729: 6 | Q729: =O729*6+P729 -> 24 | S729: ARMSTRONG | V729: 1ST HALF
S730: MURPHY | V730: 2ND HALF