A1: Victorian Football Association
A2: Season 1901
A3: © Copyright Wal Williams | F3: First created: 2 August 2014
A4: Contact: joywalwi at gmail dot com | F4: Last updated: 2 August 2014 | W4: VFA Results and tables - Link to the main index page
A5: You are free to copy this document in whole or part provided that proper acknowledgement is given to the author. All rights reserved.
A7: ROUND 1 | E7: 4TH MAY | J7: WEATHER | M7: DULL OVERCAST LIGHT RAIN
C9: 1ST QTR | G9: 2ND QTR | K9: 3RD QTR | O9: FINAL | S9: AT
S10: P. M.
A11: PORT MELB | C11: 2 | D11: 0 | E11: =C11*6+D11 -> 12 | G11: 5 | H11: 4 | I11: =G11*6+H11 -> 34 | K11: 5 | L11: 4 | M11: =K11*6+L11 -> 34 | O11: 6 | P11: 6 | Q11: =O11*6+P11 -> 42 | S11: UMPIRE | W11: LADDER | AB11: ROUND | AD11: 1
A12: ESSENDON TOWN | C12: 1 | D12: 1 | E12: =C12*6+D12 -> 7 | G12: 2 | H12: 4 | I12: =G12*6+H12 -> 16 | K12: 4 | L12: 7 | M12: =K12*6+L12 -> 31 | O12: 4 | P12: 8 | Q12: =O12*6+P12 -> 32 | S12: ARMSTRONG
A13: BEST PLAYERS | W13: TEAM | X13: W | Y13: L | Z13: D | AA13: FOR | AB13: AGST | AC13: % | AD13: PTS
A14: PORT MELB | C14: POLLOCK | F14: AYLWIN | I14: HUTCHINSON | L14: PILLAR | O14: WARD | R14: MORGAN
A15: ESSENDON TOWN | W15: FOOTSCRAY | X15: 1 | Y15: 0 | Z15: 0 | AA15: 39 | AB15: 18 | AC15: 216.66666666666666 | AD15: 4
A16: GOALKICKERS | W16: PORT MELB | X16: 1 | Y16: 0 | Z16: 0 | AA16: 42 | AB16: 32 | AC16: 131.25 | AD16: 4
A17: PORT MELB | C17: HUTCHINSON 2 | G17: O'BRIEN | J17: WARD | L17: MORGAN | O17: PILLAR | W17: BRUNSWICK | X17: 1 | Y17: 0 | Z17: 0 | AA17: 53 | AB17: 41 | AC17: 129.26829268292684 | AD17: 4
A18: ESSENDON TOWN | C18: KEATING 2 | G18: WATT | I18: RAMSAY | W18: NORTH MELB | X18: 1 | Y18: 0 | Z18: 0 | AA18: 40 | AB18: 34 | AC18: 117.64705882352941 | AD18: 4
A20: BRUNSWICK | C20: 0 | D20: 0 | E20: =C20*6+D20 -> 0 | G20: 4 | H20: 6 | I20: =G20*6+H20 -> 30 | K20: 6 | L20: 8 | M20: =K20*6+L20 -> 44 | O20: 7 | P20: 11 | Q20: =O20*6+P20 -> 53 | S20: B'WICK | W20: PRAHRAN | X20: 0 | Y20: 1 | Z20: 0 | AA20: 41 | AB20: 53 | AC20: 77.35849056603773 | AD20: 0
A21: PRAHRAN | C21: 1 | D21: 7 | E21: =C21*6+D21 -> 13 | G21: 2 | H21: 8 | I21: =G21*6+H21 -> 20 | K21: 3 | L21: 10 | M21: =K21*6+L21 -> 28 | O21: 5 | P21: 11 | Q21: =O21*6+P21 -> 41 | S21: TODD | W21: ESSENDON TOWN | X21: 0 | Y21: 1 | Z21: 0 | AA21: 32 | AB21: 42 | AC21: 76.19047619047619 | AD21: 0
A22: BEST PLAYERS | W22: WEST MELB | X22: 0 | Y22: 1 | Z22: 0 | AA22: 24 | AB22: 40 | AC22: 60 | AD22: 0
A23: BRUNSWICK | W23: RICHMOND | X23: 0 | Y23: 1 | Z23: 0 | AA23: 18 | AB23: 39 | AC23: 46.153846153846153 | AD23: 0
A24: PRAHRAN | W24: WILLIAMSTOWN | X24: 0 | Y24: 0 | Z24: 0 | AA24: 0 | AB24: 0 | AC24: 0 | AD24: 0
A25: GOALKICKERS
A26: BRUNSWICK | C26: LANDELLS 2 | G26: WOODS 2 | J26: ANDREWS | M26: LEEDS | O26: DYKE
A27: PRAHRAN | C27: CUMMINGS 2 | G27: BROWN | J27: WESTBROOK | M27: SMITH
A29: FOOTSCRAY | C29: 0 | D29: 3 | E29: =C29*6+D29 -> 3 | G29: 1 | H29: 6 | I29: =G29*6+H29 -> 12 | K29: 3 | L29: 8 | M29: =K29*6+L29 -> 26 | O29: 5 | P29: 9 | Q29: =O29*6+P29 -> 39 | S29: RICH
A30: RICHMOND | C30: 1 | D30: 0 | E30: =C30*6+D30 -> 6 | G30: 2 | H30: 0 | I30: =G30*6+H30 -> 12 | K30: 2 | L30: 4 | M30: =K30*6+L30 -> 16 | O30: 2 | P30: 6 | Q30: =O30*6+P30 -> 18 | S30: SOUTAR
A31: BEST PLAYERS
A32: FOOTSCRAY | C32: McCANCE | F32: WILLIAMS | I32: KRUSE | K32: MITCHELL | N32: MOLYNEUX | Q32: MARMO C
A33: RICHMOND | C33: CURTIS | F33: CATHIE | I33: McNAIR | K33: BAHEN | N33: WATSON T | Q33: WATSON D
A34: GOALKICKERS
A35: FOOTSCRAY | C35: DECOIT 2 | F35: MITCHELL | I35: GRUNDEN | K35: GROVES
A36: RICHMOND | C36: BAHEN | F36: BACKHOUSE
A38: NORTH MELB | C38: 0 | D38: 4 | E38: =C38*6+D38 -> 4 | G38: 1 | H38: 10 | I38: =G38*6+H38 -> 16 | K38: 2 | L38: 11 | M38: =K38*6+L38 -> 23 | O38: 4 | P38: 16 | Q38: =O38*6+P38 -> 40 | S38: N. M.
A39: WEST MELB | C39: 1 | D39: 5 | E39: =C39*6+D39 -> 11 | G39: 2 | H39: 7 | I39: =G39*6+H39 -> 19 | K39: 4 | L39: 8 | M39: =K39*6+L39 -> 32 | O39: 4 | P39: 10 | Q39: =O39*6+P39 -> 34 | S39: MURPHY
A40: BEST PLAYERS
A41: NORTH MELB | C41: JACOBS | F41: NOONAN | I41: GRAHAM | L41: MORRIS | O41: ETHELL | R41: WHITFIELD
A42: WEST MELB | C42: ROURKE | F42: WILLIAMS | I42: TWITCHETT | L42: GREGORY | O42: FERGUSON
A43: GOALKICKERS
A44: NORTH MELB | C44: BOYLE | F44: BRISTOW | I44: JACOBS | L44: RECKIE A
A45: WEST MELB | C45: RYAN 2 | F45: WILLIAMS 2
A47: BYE | E47: WILLIAMSTOWN
A49: ROUND 2 | E49: 11TH MAY | J49: WEATHER | M49: FINE SOUTH WEST WIND
C51: 1ST QTR | G51: 2ND QTR | K51: 3RD QTR | O51: FINAL | S51: AT
S52: P. M.
A53: PORT MELB | C53: 4 | D53: 7 | E53: =C53*6+D53 -> 31 | G53: 4 | H53: 7 | I53: =G53*6+H53 -> 31 | K53: 4 | L53: 14 | M53: =K53*6+L53 -> 38 | O53: 5 | P53: 15 | Q53: =O53*6+P53 -> 45 | S53: UMPIRE | W53: LADDER | AB53: ROUND | AD53: 2
A54: NORTH MELB | C54: 0 | D54: 0 | E54: =C54*6+D54 -> 0 | G54: 1 | H54: 8 | I54: =G54*6+H54 -> 14 | K54: 3 | L54: 8 | M54: =K54*6+L54 -> 26 | O54: 4 | P54: 8 | Q54: =O54*6+P54 -> 32 | S54: HOOD
A55: BEST PLAYERS | W55: TEAM | X55: W | Y55: L | Z55: D | AA55: FOR | AB55: AGST | AC55: % | AD55: PTS
A56: PORT MELB | C56: McCONACHIE | G56: MAYLIN | J56: DUGGAN | M56: McGEE | O56: GARBUTT | R56: POLLOCK
A57: NORTH MELB | C57: NOONAN | G57: BRISTOW | J57: GARDINER | M57: MORRIS | O57: McSHANE | R57: TORPEY | W57: FOOTSCRAY | X57: 2 | Y57: 0 | Z57: 0 | AA57: 72 | AB57: 31 | AC57: 232.25806451612902 | AD57: 8
A58: GOALKICKERS | W58: PORT MELB | X58: 2 | Y58: 0 | Z58: 0 | AA58: 87 | AB58: 64 | AC58: 135.9375 | AD58: 8
A59: PORT MELB | C59: HUTCHINSON 3 | G59: STONE | J59: BROMLEY | N59: McGEE | W59: RICHMOND | X59: 1 | Y59: 1 | Z59: 0 | AA59: 64 | AB59: 48 | AC59: 133.33333333333334 | AD59: 4
A60: NORTH MELB | C60: SHAW 2 | G60: MORRIS | J60: BOYLE | W60: PRAHRAN | X60: 1 | Y60: 1 | Z60: 0 | AA60: 101 | AB60: 89 | AC60: 113.48314606741573 | AD60: 4
A62: FOOTSCRAY | C62: 1 | D62: 5 | E62: =C62*6+D62 -> 11 | G62: 2 | H62: 6 | I62: =G62*6+H62 -> 18 | K62: 3 | L62: 7 | M62: =K62*6+L62 -> 25 | O62: 4 | P62: 9 | Q62: =O62*6+P62 -> 33 | S62: FOOTS | W62: NORTH MELB | X62: 1 | Y62: 1 | Z62: 0 | AA62: 72 | AB62: 79 | AC62: 91.139240506329116 | AD62: 4
A63: BRUNSWICK | C63: 0 | D63: 0 | E63: =C63*6+D63 -> 0 | G63: 0 | H63: 1 | I63: =G63*6+H63 -> 1 | K63: 0 | L63: 5 | M63: =K63*6+L63 -> 5 | O63: 1 | P63: 7 | Q63: =O63*6+P63 -> 13 | S63: HOWELL | W63: BRUNSWICK | X63: 1 | Y63: 1 | Z63: 0 | AA63: 66 | AB63: 74 | AC63: 89.189189189189193 | AD63: 4
A64: BEST PLAYERS | W64: ESSENDON TOWN | X64: 0 | Y64: 1 | Z64: 0 | AA64: 32 | AB64: 42 | AC64: 76.19047619047619 | AD64: 0
A65: FOOTSCRAY | C65: HARRIS | F65: HINCH | H65: MARMO J | K65: MARMO C | N65: KRUSE | P65: WILLIAMS | W65: WILLIAMSTOWN | X65: 0 | Y65: 1 | Z65: 0 | AA65: 36 | AB65: 60 | AC65: 60 | AD65: 0
A66: BRUNSWICK | C66: LEEDS | F66: SHELLNACK | I66: JAMIESON | L66: HEGARTY | O66: CRAVENO | R66: CASEY | W66: WEST MELB | X66: 0 | Y66: 2 | Z66: 0 | AA66: 33 | AB66: 86 | AC66: 38.372093023255815 | AD66: 0
A67: GOALKICKERS
A68: FOOTSCRAY | C68: DECOIT | F68: KRUSE | H68: GREGORY | K68: MOLYNEUX
A69: BRUNSWICK | C69: JOHNSON
A71: PRAHRAN | C71: 1 | D71: 1 | E71: =C71*6+D71 -> 7 | G71: 3 | H71: 6 | I71: =G71*6+H71 -> 24 | K71: 6 | L71: 10 | M71: =K71*6+L71 -> 46 | O71: 8 | P71: 12 | Q71: =O71*6+P71 -> 60 | S71: TOORAK PARK
A72: WILLIAMSTOWN | C72: 3 | D72: 3 | E72: =C72*6+D72 -> 21 | G72: 4 | H72: 3 | I72: =G72*6+H72 -> 27 | K72: 4 | L72: 4 | M72: =K72*6+L72 -> 28 | O72: 5 | P72: 6 | Q72: =O72*6+P72 -> 36 | S72: MURPHY
A73: BEST PLAYERS
A74: PRAHRAN | C74: LYONS | F74: McINERNEY | I74: BROWN T | L74: WILLISON | O74: DOWDING | R74: McCLUMPA
A75: WILLIAMSTOWN | C75: VINEY | F75: WARREN | I75: OUTEN | L75: DICKS | O75: HEDLEY | R75: HALL
A76: GOALKICKERS
A77: PRAHRAN | C77: HORNIDGE 3 | G77: WHITFIELD 2 | K77: DUNNE | N77: McCLUMPA | Q77: LOWRY
A78: WILLIAMSTOWN | C78: COLLINS 2 | G78: GRIMSHAW 2 | K78: DICKS
A80: RICHMOND | C80: 1 | D80: 3 | E80: =C80*6+D80 -> 9 | G80: 3 | H80: 5 | I80: =G80*6+H80 -> 23 | K80: 4 | L80: 6 | M80: =K80*6+L80 -> 30 | O80: 6 | P80: 10 | Q80: =O80*6+P80 -> 46 | S80: N. M.
A81: WEST MELB | C81: 0 | D81: 0 | E81: =C81*6+D81 -> 0 | G81: 1 | H81: 1 | I81: =G81*6+H81 -> 7 | K81: 1 | L81: 1 | M81: =K81*6+L81 -> 7 | O81: 1 | P81: 3 | Q81: =O81*6+P81 -> 9 | S81: STRANGER
A82: BEST PLAYERS
A83: RICHMOND | C83: TAYLOR | F83: JOHNSTONE | I83: WRIGHT | L83: VOLLUGI | O83: CURTIS | R83: McGUIRE
A84: WEST MELB | C84: ROURKE | F84: POOLE | I84: TWITCHETT | L84: GREGORY | O84: LINQUIST | R84: WILLIAMS
A85: GOALKICKERS
A86: RICHMOND | C86: McGUIRE 3 | G86: DOUGLAS | J86: BACKHOUSE | M86: HUGHES
A87: WEST MELB | C87: TWITCHETT
A89: BYE | F89: ESSENDON TOWN
A91: ROUND 3 | E91: 18TH MAY | J91: WEATHER | M91: CLOUDY NORTH WIND
C93: 1ST QTR | G93: 2ND QTR | K93: 3RD QTR | O93: FINAL | S93: AT
S94: B'WICK
A95: BRUNSWICK | C95: 0 | D95: 0 | E95: =C95*6+D95 -> 0 | G95: 4 | H95: 4 | I95: =G95*6+H95 -> 28 | K95: 4 | L95: 4 | M95: =K95*6+L95 -> 28 | O95: 10 | P95: 6 | Q95: =O95*6+P95 -> 66 | S95: UMPIRE | W95: LADDER | AB95: ROUND | AD95: 3
A96: PORT MELB | C96: 3 | D96: 2 | E96: =C96*6+D96 -> 20 | G96: 5 | H96: 2 | I96: =G96*6+H96 -> 32 | K96: 9 | L96: 3 | M96: =K96*6+L96 -> 57 | O96: 9 | P96: 3 | Q96: =O96*6+P96 -> 57 | S96: STRANGER
A97: BEST PLAYERS | W97: TEAM | X97: W | Y97: L | Z97: D | AA97: FOR | AB97: AGST | AC97: % | AD97: PTS
A98: BRUNSWICK | C98: JOHNSON G | F98: LEEDS | H98: MELLOR | K98: HARRIS | N98: ANDREWS F | Q98: ANDREWS W
A99: PORT MELB | C99: HERON | F99: SWANNIE | I99: SHEAHAN | L99: POLLOCK | O99: BROMLEY | R99: GORDON | W99: FOOTSCRAY | X99: 3 | Y99: 0 | Z99: 0 | AA99: 110 | AB99: 57 | AC99: 192.98245614035088 | AD99: 12
A100: GOALKICKERS | W100: PRAHRAN | X100: 2 | Y100: 1 | Z100: 0 | AA100: 133 | AB100: 109 | AC100: 122.01834862385321 | AD100: 8
A101: BRUNSWICK | C101: CLEMENTS 4 | G101: LANDELLS 2 | K101: LEEDS 2 | N101: MELLOR 2 | W101: PORT MELB | X101: 2 | Y101: 1 | Z101: 0 | AA101: 144 | AB101: 130 | AC101: 110.76923076923077 | AD101: 8
A102: PORT MELB | C102: HERON 2 | F102: WARD 2 | I102: STONE | K102: BROMLEY | N102: HUTCHINSON | Q102: McGEE | T102: RYAN | W102: NORTH MELB | X102: 2 | Y102: 1 | Z102: 0 | AA102: 107 | AB102: 100 | AC102: 107 | AD102: 8
A104: FOOTSCRAY | C104: 3 | D104: 4 | E104: =C104*6+D104 -> 22 | G104: 3 | H104: 4 | I104: =G104*6+H104 -> 22 | K104: 5 | L104: 8 | M104: =K104*6+L104 -> 38 | O104: 5 | P104: 8 | Q104: =O104*6+P104 -> 38 | S104: FOOTS | W104: BRUNSWICK | X104: 2 | Y104: 1 | Z104: 0 | AA104: 132 | AB104: 131 | AC104: 100.76335877862596 | AD104: 8
A105: WILLIAMSTOWN | C105: 0 | D105: 0 | E105: =C105*6+D105 -> 0 | G105: 2 | H105: 5 | I105: =G105*6+H105 -> 17 | K105: 2 | L105: 5 | M105: =K105*6+L105 -> 17 | O105: 3 | P105: 8 | Q105: =O105*6+P105 -> 26 | S105: SOUTAR | W105: RICHMOND | X105: 1 | Y105: 1 | Z105: 0 | AA105: 64 | AB105: 48 | AC105: 133.33333333333334 | AD105: 4
A106: BEST PLAYERS | W106: ESSENDON TOWN | X106: 0 | Y106: 2 | Z106: 0 | AA106: 53 | AB106: 77 | AC106: 68.831168831168824 | AD106: 0
A107: FOOTSCRAY | C107: SERBY | F107: DREW | H107: MOLYNEUX | K107: HINCH | M107: WILLIAMS | P107: GRUNDEN | W107: WILLIAMSTOWN | X107: 0 | Y107: 2 | Z107: 0 | AA107: 62 | AB107: 98 | AC107: 63.265306122448976 | AD107: 0
A108: WILLIAMSTOWN | C108: HOUGHTON | F108: OUTEN | H108: SPENCE | K108: McKINLEY | N108: McCARROLL | Q108: DICK | W108: WEST MELB | X108: 0 | Y108: 3 | Z108: 0 | AA108: 53 | AB108: 118 | AC108: 44.915254237288138 | AD108: 0
A109: GOALKICKERS
A110: FOOTSCRAY | C110: DECOIT | F110: MOLYNEUX | I110: BLAIR | K110: GREGORY | N110: GROVES
A111: WILLIAMSTOWN | C111: GRIMSHAW 2 | G111: MANDERSON
A113: PRAHRAN | C113: 2 | D113: 3 | E113: =C113*6+D113 -> 15 | G113: 2 | H113: 11 | I113: =G113*6+H113 -> 23 | K113: 2 | L113: 12 | M113: =K113*6+L113 -> 24 | O113: 3 | P113: 14 | Q113: =O113*6+P113 -> 32 | S113: N. M.
A114: WEST MELB | C114: 1 | D114: 1 | E114: =C114*6+D114 -> 7 | G114: 1 | H114: 1 | I114: =G114*6+H114 -> 7 | K114: 2 | L114: 2 | M114: =K114*6+L114 -> 14 | O114: 3 | P114: 2 | Q114: =O114*6+P114 -> 20 | S114: TODD
A115: BEST PLAYERS
A116: PRAHRAN | C116: LYONS | F116: BROWN | I116: WILLIAMS | L116: DOWDING | O116: McCLUMPA | R116: HORNIDGE
A117: WEST MELB | C117: ROURKE | F117: McCARTHY | I117: GREGORY | L117: LAXTON | O117: HOGAN | R117: TWITCHETT
A118: GOALKICKERS
A119: PRAHRAN | C119: WHITFIELD 2 | G119: LYONS
A120: WEST MELB | C120: POOLE | F120: BAXTER | H120: McGUINESS
A122: NORTH MELB | C122: 0 | D122: 1 | E122: =C122*6+D122 -> 1 | G122: 2 | H122: 2 | I122: =G122*6+H122 -> 14 | K122: 2 | L122: 3 | M122: =K122*6+L122 -> 15 | O122: 5 | P122: 5 | Q122: =O122*6+P122 -> 35 | S122: ESS
A123: ESSENDON TOWN | C123: 1 | D123: 1 | E123: =C123*6+D123 -> 7 | G123: 1 | H123: 1 | I123: =G123*6+H123 -> 7 | K123: 3 | L123: 1 | M123: =K123*6+L123 -> 19 | O123: 3 | P123: 3 | Q123: =O123*6+P123 -> 21 | S123: ARMSTRONG
A124: BEST PLAYERS
A125: NORTH MELB | C125: McDERMOTT | F125: NOONAN | H125: WHITFIELD | K125: A RECKIE | N125: JACOBS | P125: TORPEY
A126: ESSENDON TOWN | C126: BARR | F126: KENNEDY | I126: NIXON | K126: SWEATMAN
A127: GOALKICKERS
A128: NORTH MELB | C128: RECKIE A 3 | G128: QUILLIGAN 2
A129: ESSENDON TOWN | C129: KEATING | F129: KENNEDY | I129: TESTER
A131: BYE | F131: RICHMOND
A133: ROUND 4 | E133: 25TH MAY | J133: WEATHER | M133: OVERCAST STRONG NORTH WIND
C135: 1ST QTR | G135: 2ND QTR | K135: 3RD QTR | O135: FINAL | S135: AT
S136: TOORAK PARK
A137: PRAHRAN | C137: 6 | D137: 3 | E137: =C137*6+D137 -> 39 | G137: 7 | H137: 5 | I137: =G137*6+H137 -> 47 | K137: 7 | L137: 11 | M137: =K137*6+L137 -> 53 | O137: 8 | P137: 11 | Q137: =O137*6+P137 -> 59 | S137: UMPIRE | W137: LADDER | AB137: ROUND | AD137: 4
A138: FOOTSCRAY | C138: 0 | D138: 0 | E138: =C138*6+D138 -> 0 | G138: 2 | H138: 5 | I138: =G138*6+H138 -> 17 | K138: 3 | L138: 5 | M138: =K138*6+L138 -> 23 | O138: 6 | P138: 8 | Q138: =O138*6+P138 -> 44 | S138: MURPHY
A139: BEST PLAYERS | W139: TEAM | X139: W | Y139: L | Z139: D | AA139: FOR | AB139: AGST | AC139: % | AD139: PTS
A140: PRAHRAN | C140: BROWN T | F140: LOWRY | H140: LYONS | J140: PARKER | M140: DUNN | O140: WHITFIELD
A141: FOOTSCRAY | C141: MARMO J | F141: HARRIS | H141: McCARTHY | K141: GREGORY | N141: GRUNDEN | Q141: DECOIT | W141: FOOTSCRAY | X141: 3 | Y141: 1 | Z141: 0 | AA141: 154 | AB141: 116 | AC141: 132.75862068965517 | AD141: 12
A142: GOALKICKERS | W142: BRUNSWICK | X142: 3 | Y142: 1 | Z142: 0 | AA142: 196 | AB142: 154 | AC142: 127.27272727272727 | AD142: 12
A143: PRAHRAN | C143: HORNIDGE 4 | G143: PARKER 2 | J143: DUNNE | L143: WHITFIELD | W143: PRAHRAN | X143: 3 | Y143: 1 | Z143: 0 | AA143: 192 | AB143: 153 | AC143: 125.49019607843137 | AD143: 12
A144: FOOTSCRAY | C144: DECOIT 2 | F144: MARMO J | H144: GREGORY | K144: DREW | M144: McGLYNN | W144: RICHMOND | X144: 2 | Y144: 1 | Z144: 0 | AA144: 107 | AB144: 78 | AC144: 137.17948717948718 | AD144: 8
A146: RICHMOND | C146: 0 | D146: 6 | E146: =C146*6+D146 -> 6 | G146: 1 | H146: 10 | I146: =G146*6+H146 -> 16 | K146: 5 | L146: 13 | M146: =K146*6+L146 -> 43 | O146: 5 | P146: 13 | Q146: =O146*6+P146 -> 43 | S146: RICH | W146: NORTH MELB | X146: 2 | Y146: 1 | Z146: 0 | AA146: 107 | AB146: 100 | AC146: 107 | AD146: 8
A147: PORT MELB | C147: 0 | D147: 0 | E147: =C147*6+D147 -> 0 | G147: 1 | H147: 4 | I147: =G147*6+H147 -> 10 | K147: 3 | L147: 5 | M147: =K147*6+L147 -> 23 | O147: 4 | P147: 6 | Q147: =O147*6+P147 -> 30 | S147: ARMSTRONG | W147: PORT MELB | X147: 2 | Y147: 2 | Z147: 0 | AA147: 174 | AB147: 173 | AC147: 100.57803468208093 | AD147: 8
A148: BEST PLAYERS | W148: WILLIAMSTOWN | X148: 1 | Y148: 2 | Z148: 0 | AA148: 104 | AB148: 122 | AC148: 85.245901639344268 | AD148: 4
A149: RICHMOND | C149: JOHNSON | F149: TAYLOR | H149: EDMUNDS | K149: CURTIS | N149: RUDD | P149: BACKHOUSE | W149: ESSENDON TOWN | X149: 0 | Y149: 3 | Z149: 0 | AA149: 76 | AB149: 141 | AC149: 53.900709219858157 | AD149: 0
A150: PORT MELB | C150: BLISS | F150: POLLOCK | I150: McDONALD | L150: HUTCHINSON | O150: PILLAR | Q150: AYLING | W150: WEST MELB | X150: 0 | Y150: 4 | Z150: 0 | AA150: 77 | AB150: 160 | AC150: 48.125 | AD150: 0
A151: GOALKICKERS
A152: RICHMOND | C152: BAHEN | F152: BACKHOUSE | I152: CATHIE | L152: MANDERSON | O152: McGUIRE
A153: PORT MELB | C153: McGEE | F153: BROMLEY | I153: HERON | L153: McDONALD
A155: BRUNSWICK | C155: 5 | D155: 3 | E155: =C155*6+D155 -> 33 | G155: 6 | H155: 3 | I155: =G155*6+H155 -> 39 | K155: 9 | L155: 10 | M155: =K155*6+L155 -> 64 | O155: 9 | P155: 10 | Q155: =O155*6+P155 -> 64 | S155: B'WICK
A156: ESSENDON TOWN | C156: 0 | D156: 0 | E156: =C156*6+D156 -> 0 | G156: 1 | H156: 2 | I156: =G156*6+H156 -> 8 | K156: 1 | L156: 3 | M156: =K156*6+L156 -> 9 | O156: 3 | P156: 5 | Q156: =O156*6+P156 -> 23 | S156: HOOD
A157: BEST PLAYERS
A158: BRUNSWICK | C158: CLEMENTS | F158: JOHNSON G | I158: ANDREWS W | L158: ANDREWS F | O158: WOODS | R158: STOTT
A159: ESSENDON TOWN | C159: BARR | F159: FLEMING | I159: TESTER | L159: BYERS | O159: SHELDON | R159: SHAW
A160: GOALKICKERS
A161: BRUNSWICK | C161: CLEMENTS 4 | G161: LANDELLS 3 | K161: JOHNSON G | N161: STOTT
A162: ESSENDON TOWN | C162: BYERS | F162: McCABE | I162: KEATING
A164: WILLIAMSTOWN | C164: 2 | D164: 4 | E164: =C164*6+D164 -> 16 | G164: 3 | H164: 6 | I164: =G164*6+H164 -> 24 | K164: 5 | L164: 9 | M164: =K164*6+L164 -> 39 | O164: 5 | P164: 12 | Q164: =O164*6+P164 -> 42 | S164: WILLIAMSTOWN
A165: WEST MELB | C165: 0 | D165: 0 | E165: =C165*6+D165 -> 0 | G165: 1 | H165: 2 | I165: =G165*6+H165 -> 8 | K165: 1 | L165: 3 | M165: =K165*6+L165 -> 9 | O165: 3 | P165: 6 | Q165: =O165*6+P165 -> 24 | S165: HOWELL
A166: BEST PLAYERS
A167: WILLIAMSTOWN | C167: HALL | F167: CALDWELL | I167: SPRINTHALL | L167: OUTEN | N167: KENNEDY | P167: STANILAND
A168: WEST MELB | C168: GREGORY | F168: HOGAN | I168: McCARTHY | L168: STEVENS | O168: McGUINNESS | R168: ROURKE
A169: GOALKICKERS
A170: WILLIAMSTOWN | C170: STANILAND 3 | G170: HALL | I170: GRIMSHAW
A171: WEST MELB | C171: GOURLAY 2 | G171: RYAN
A173: BYE | E173: NORTH MELBOURNE
A175: ROUND 5 | E175: 1ST JUNE | J175: WEATHER | M175: CLOUDY FINE
C177: 1ST QTR | G177: 2ND QTR | K177: 3RD QTR | O177: FINAL | S177: AT
S178: P.M.
A179: WILLIAMSTOWN | C179: 1 | D179: 1 | E179: =C179*6+D179 -> 7 | G179: 4 | H179: 3 | I179: =G179*6+H179 -> 27 | K179: 4 | L179: 5 | M179: =K179*6+L179 -> 29 | O179: 6 | P179: 5 | Q179: =O179*6+P179 -> 41 | S179: UMPIRE | W179: LADDER | AB179: ROUND | AD179: 5
A180: PORT MELB | C180: 2 | D180: 2 | E180: =C180*6+D180 -> 14 | G180: 4 | H180: 3 | I180: =G180*6+H180 -> 27 | K180: 4 | L180: 4 | M180: =K180*6+L180 -> 28 | O180: 4 | P180: 5 | Q180: =O180*6+P180 -> 29 | S180: ARMSTRONG
A181: BEST PLAYERS | W181: TEAM | X181: W | Y181: L | Z181: D | AA181: FOR | AB181: AGST | AC181: % | AD181: PTS
A182: WILLIAMSTOWN | C182: KNOX | E182: HOUGHTON | H182: OATEN | J182: GRIMSHAW | M182: STANILAND | P182: WARREN
A183: PORT MELB | C183: WILLIAMSON | G183: POLLOCK | J183: GORDON | M183: McGEE | O183: WAUGH | Q183: KEENAN | W183: RICHMOND | X183: 3 | Y183: 1 | Z183: 0 | AA183: 142 | AB183: 104 | AC183: 136.53846153846155 | AD183: 12
A184: GOALKICKERS | W184: NORTH MELB | X184: 3 | Y184: 1 | Z184: 0 | AA184: 144 | AB184: 108 | AC184: 133.33333333333334 | AD184: 12
A185: WILLIAMSTOWN | C185: WARREN 3 | F185: STANILAND | I185: GRIMSHAW | L185: McKINLEY | W185: FOOTSCRAY | X185: 3 | Y185: 1 | Z185: 0 | AA185: 154 | AB185: 116 | AC185: 132.75862068965517 | AD185: 12
A186: PORT MELB | C186: DUGGAN | F186: PILLAR | H186: WARD | J186: HUTCHINSON | W186: PRAHRAN | X186: 3 | Y186: 2 | Z186: 0 | AA186: 218 | AB186: 188 | AC186: 115.95744680851064 | AD186: 12
A188: RICHMOND | C188: 0 | D188: 2 | E188: =C188*6+D188 -> 2 | G188: 0 | H188: 4 | I188: =G188*6+H188 -> 4 | K188: 2 | L188: 10 | M188: =K188*6+L188 -> 22 | O188: 4 | P188: 11 | Q188: =O188*6+P188 -> 35 | S188: TOORAK PARK | W188: BRUNSWICK | X188: 3 | Y188: 2 | Z188: 0 | AA188: 204 | AB188: 191 | AC188: 106.80628272251309 | AD188: 12
A189: PRAHRAN | C189: 1 | D189: 0 | E189: =C189*6+D189 -> 6 | G189: 1 | H189: 4 | I189: =G189*6+H189 -> 10 | K189: 3 | L189: 5 | M189: =K189*6+L189 -> 23 | O189: 3 | P189: 8 | Q189: =O189*6+P189 -> 26 | S189: STRANGER | W189: WILLIAMSTOWN | X189: 2 | Y189: 2 | Z189: 0 | AA189: 145 | AB189: 151 | AC189: 96.026490066225165 | AD189: 8
A190: BEST PLAYERS | W190: PORT MELB | X190: 2 | Y190: 3 | Z190: 0 | AA190: 203 | AB190: 214 | AC190: 94.859813084112147 | AD190: 8
A191: RICHMOND | C191: McNAIR | F191: CATHIE | H191: DOUGLAS | K191: RUDD | M191: EDMUNDS | P191: TAYLOR | W191: ESSENDON TOWN | X191: 1 | Y191: 3 | Z191: 0 | AA191: 117 | AB191: 165 | AC191: 70.909090909090907 | AD191: 4
A192: PRAHRAN | C192: LYONS | E192: SEALEY | G192: G.BROWN | J192: McINERNEY | M192: DOWDING | P192: WILLISON | W192: WEST MELB | X192: 0 | Y192: 5 | Z192: 0 | AA192: 101 | AB192: 201 | AC192: 50.24875621890547 | AD192: 0
A193: GOALKICKERS
A194: RICHMOND | C194: CATHIE 2 | F194: LOTT | H194: DOUGLAS
A195: PRAHRAN | C195: LYONS | E195: HORNIDGE | H195: McINERNEY
A197: NORTH MELB | C197: 2 | D197: 0 | E197: =C197*6+D197 -> 12 | G197: 3 | H197: 4 | I197: =G197*6+H197 -> 22 | K197: 3 | L197: 10 | M197: =K197*6+L197 -> 28 | O197: 4 | P197: 13 | Q197: =O197*6+P197 -> 37 | S197: N.M.
A198: BRUNSWICK | C198: 0 | D198: 0 | E198: =C198*6+D198 -> 0 | G198: 0 | H198: 0 | I198: =G198*6+H198 -> 0 | K198: 0 | L198: 0 | M198: =K198*6+L198 -> 0 | O198: 1 | P198: 2 | Q198: =O198*6+P198 -> 8 | S198: SOUTAR
A199: BEST PLAYERS
A200: NORTH MELB | C200: ROLENT | F200: WHITFIELD | I200: D.NOONAN | L200: GRAHAM | O200: TORPEY | Q200: LONERGREN
A201: BRUNSWICK | C201: JOHNSON | F201: CLEMENTS | I201: MILLER | K201: JAMIESON | N201: H.ANDREWS
A202: GOALKICKERS
A203: NORTH MELB | C203: CAREY | E203: GRAHAM | G203: TORPEY | J203: QUILLIGAN
A204: BRUNSWICK | C204: CLEMENTS
A206: ESSENDON TOWN | C206: 3 | D206: 1 | E206: =C206*6+D206 -> 19 | G206: 5 | H206: 1 | I206: =G206*6+H206 -> 31 | K206: 5 | L206: 3 | M206: =K206*6+L206 -> 33 | O206: 6 | P206: 5 | Q206: =O206*6+P206 -> 41 | S206: ESS
A207: WEST MELB | C207: 1 | D207: 1 | E207: =C207*6+D207 -> 7 | G207: 1 | H207: 2 | I207: =G207*6+H207 -> 8 | K207: 2 | L207: 2 | M207: =K207*6+L207 -> 14 | O207: 3 | P207: 6 | Q207: =O207*6+P207 -> 24 | S207: HOWELL
A208: BEST PLAYERS
A209: ESSENDON TOWN | C209: McCABE | F209: TESTER | I209: BARR | L209: KING | N209: WATT | P209: G.SHAW
A210: WEST MELB | C210: ROURKE | F210: POOLE | I210: GREGORY | L210: PAGE | N210: McGREGOR | Q210: LAXTON
A211: GOALKICKERS
A212: ESSENDON TOWN | C212: WATT 2 | F212: KING | H212: McCABE | K212: BARR | M212: SWEATMAN
A213: WEST MELB | C213: S.GREGORY 2 | G213: POOLE
A215: BYE | E215: FOOTSCRAY
A217: ROUND 6 | E217: 8TH JUNE | J217: WEATHER | N217: DULL CLOUDY FRESH NORTH WIND
C219: 1ST QTR | G219: 2ND QTR | K219: 3RD QTR | O219: FINAL | S219: AT
S220: WILLIAMSTOWN
A221: WILLIAMSTOWN | C221: 1 | D221: 3 | E221: =C221*6+D221 -> 9 | G221: 7 | H221: 6 | I221: =G221*6+H221 -> 48 | K221: 7 | L221: 8 | M221: =K221*6+L221 -> 50 | O221: 10 | P221: 9 | Q221: =O221*6+P221 -> 69 | S221: UMPIRE | W221: LADDER | AB221: ROUND | AD221: 6
A222: ESSENDON TOWN | C222: 0 | D222: 2 | E222: =C222*6+D222 -> 2 | G222: 0 | H222: 2 | I222: =G222*6+H222 -> 2 | K222: 0 | L222: 2 | M222: =K222*6+L222 -> 2 | O222: 1 | P222: 8 | Q222: =O222*6+P222 -> 14 | S222: STRANGER
A223: BEST PLAYERS | W223: TEAM | X223: W | Y223: L | Z223: D | AA223: FOR | AB223: AGST | AC223: % | AD223: PTS
A224: WILLIAMSTOWN | C224: OUTEN | F224: KNOX | H224: SPRINTHALL | K224: WARREN | N224: GRIMSHAW | Q224: STANILAND
A225: ESSENDON TOWN | C225: STEPHENSON | F225: DONALDSON | I225: KING | K225: SHAW | N225: TESTER | Q225: BARR | W225: RICHMOND | X225: 4 | Y225: 1 | Z225: 0 | AA225: 224 | AB225: 125 | AC225: 179.2 | AD225: 16
A226: GOALKICKERS | W226: FOOTSCRAY | X226: 4 | Y226: 1 | Z226: 0 | AA226: 191 | AB226: 145 | AC226: 131.72413793103448 | AD226: 16
A227: WILLIAMSTOWN | C227: STANILAND 5 | G227: DICK 2 | J227: GRIMSHAW 2 | N227: WARREN | W227: NORTH MELB | X227: 4 | Y227: 1 | Z227: 0 | AA227: 186 | AB227: 144 | AC227: 129.16666666666666 | AD227: 16
A228: ESSENDON TOWN | C228: WATT | W228: WILLIAMSTOWN | X228: 3 | Y228: 2 | Z228: 0 | AA228: 214 | AB228: 165 | AC228: 129.69696969696969 | AD228: 12
A230: RICHMOND | C230: 2 | D230: 5 | E230: =C230*6+D230 -> 17 | G230: 5 | H230: 10 | I230: =G230*6+H230 -> 40 | K230: 8 | L230: 14 | M230: =K230*6+L230 -> 62 | O230: 11 | P230: 16 | Q230: =O230*6+P230 -> 82 | S230: RICH | W230: PRAHRAN | X230: 3 | Y230: 3 | Z230: 0 | AA230: 254 | AB230: 230 | AC230: 110.43478260869566 | AD230: 12
A231: BRUNSWICK | C231: 1 | D231: 1 | E231: =C231*6+D231 -> 7 | G231: 1 | H231: 2 | I231: =G231*6+H231 -> 8 | K231: 2 | L231: 3 | M231: =K231*6+L231 -> 15 | O231: 3 | P231: 3 | Q231: =O231*6+P231 -> 21 | S231: HOOD | W231: BRUNSWICK | X231: 3 | Y231: 3 | Z231: 0 | AA231: 225 | AB231: 273 | AC231: 82.417582417582423 | AD231: 12
A232: BEST PLAYERS | W232: PORT MELB | X232: 2 | Y232: 3 | Z232: 0 | AA232: 203 | AB232: 214 | AC232: 94.859813084112147 | AD232: 8
A233: RICHMOND | C233: JOHNSON | F233: PIRRIE | H233: BAHEN | J233: LOTT | L233: CATHIE | O233: RUDD | W233: ESSENDON TOWN | X233: 1 | Y233: 4 | Z233: 0 | AA233: 131 | AB233: 234 | AC233: 55.982905982905983 | AD233: 4
A234: BRUNSWICK | C234: HEGARTY | F234: LEEDS | H234: CLEMENT | J234: CASEY | L234: JOHNSON | O234: COBURN | W234: WEST MELB | X234: 0 | Y234: 6 | Z234: 0 | AA234: 130 | AB234: 238 | AC234: 54.621848739495796 | AD234: 0
A235: GOALKICKERS
A236: RICHMOND | C236: PIRRIE 3 | F236: BAHEN 2 | I236: BACKHOUSE | L236: LOTT | N236: CATHIE | P236: McNAIR | R236: JOHNSON | U236: ALVES
A237: BRUNSWICK | C237: LANDELLS 2 | G237: TWOMEY
A239: NORTH MELB | C239: 1 | D239: 3 | E239: =C239*6+D239 -> 9 | G239: 1 | H239: 5 | I239: =G239*6+H239 -> 11 | K239: 2 | L239: 12 | M239: =K239*6+L239 -> 24 | O239: 5 | P239: 12 | Q239: =O239*6+P239 -> 42 | S239: N.M.
A240: PRAHRAN | C240: 2 | D240: 0 | E240: =C240*6+D240 -> 12 | G240: 4 | H240: 4 | I240: =G240*6+H240 -> 28 | K240: 4 | L240: 6 | M240: =K240*6+L240 -> 30 | O240: 5 | P240: 6 | Q240: =O240*6+P240 -> 36 | S240: MURPHY
A241: BEST PLAYERS
A242: NORTH MELB | C242: ETHELL | F242: NOONAN | I242: WHITFIELD | L242: ROWLANDS | O242: LONERGREN | S242: F.HALL
A243: PRAHRAN | C243: LYONS | F243: ROBERTS | I243: T.BROWN | L243: FUNGE | O243: WILLISON | S243: SMITH
A244: GOALKICKERS
A245: NORTH MELB | C245: CAREY 2 | F245: BOYLE | H245: J.SMITH | K245: QUILLIGAN
A246: PRAHRAN | C246: WHITFIELD 3 | G246: HORNIDGE | J246: G.BROWN
A248: FOOTSCRAY | C248: 3 | D248: 4 | E248: =C248*6+D248 -> 22 | G248: 3 | H248: 4 | I248: =G248*6+H248 -> 22 | K248: 5 | L248: 6 | M248: =K248*6+L248 -> 36 | O248: 5 | P248: 7 | Q248: =O248*6+P248 -> 37 | S248: W.M.
A249: WEST MELB | C249: 0 | D249: 1 | E249: =C249*6+D249 -> 1 | G249: 4 | H249: 3 | I249: =G249*6+H249 -> 27 | K249: 4 | L249: 3 | M249: =K249*6+L249 -> 27 | O249: 4 | P249: 5 | Q249: =O249*6+P249 -> 29 | S249: ARMSTRONG
A250: BEST PLAYERS
A251: FOOTSCRAY | C251: HARRIS | F251: GRUNDEN | I251: SERBY | K251: DECOIT | N251: McGLYNN | Q251: N.WILLIAMS
A252: WEST MELB | C252: MONTGOMEREY | G252: ROURKE | I252: McGREGOR | L252: POOLE | N252: RYAN | P252: HOGAN
A253: GOALKICKERS
A254: FOOTSCRAY | C254: MITCHELL 2 | G254: SERBY | I254: GREGORY | L254: DECOIT
A255: WEST MELB | C255: POOLE 2 | F255: RYAN 2
A257: BYE | E257: PORT MELBOURNE
A259: ROUND 7 | E259: 15TH JUNE | J259: WEATHER | N259: DULL OVERCAST STRONG N WIND
C261: 1ST QTR | G261: 2ND QTR | K261: 3RD QTR | O261: FINAL | S261: AT
S262: N.M.
A263: PORT MELB | C263: 2 | D263: 2 | E263: =C263*6+D263 -> 14 | G263: 2 | H263: 4 | I263: =G263*6+H263 -> 16 | K263: 3 | L263: 7 | M263: =K263*6+L263 -> 25 | O263: 3 | P263: 7 | Q263: =O263*6+P263 -> 25 | S263: UMPIRE | W263: LADDER | AB263: ROUND | AD263: 7
A264: WEST MELB | C264: 0 | D264: 0 | E264: =C264*6+D264 -> 0 | G264: 0 | H264: 0 | I264: =G264*6+H264 -> 0 | K264: 0 | L264: 1 | M264: =K264*6+L264 -> 1 | O264: 0 | P264: 4 | Q264: =O264*6+P264 -> 4 | S264: HOWELL
A265: BEST PLAYERS | W265: TEAM | X265: W | Y265: L | Z265: D | AA265: FOR | AB265: AGST | AC265: % | AD265: PTS
A266: PORT MELB | C266: KEENAN | F266: McGEE | H266: SWANNIE | K266: O'BREIN | N266: BROWN | P266: HUTCHINSON
A267: WEST MELB | C267: ROURKE | F267: MANSON | I267: W.GREGORY | L267: MONTGOMERY | O267: McGREGOR | R267: POOLE | W267: RICHMOND | X267: 5 | Y267: 1 | Z267: 0 | AA267: 256 | AB267: 154 | AC267: 166.23376623376623 | AD267: 20
A268: GOALKICKERS | W268: NORTH MELB | X268: 5 | Y268: 1 | Z268: 0 | AA268: 228 | AB268: 182 | AC268: 125.27472527472527 | AD268: 20
A269: PORT MELB | C269: O'BRIEN | F269: HUTCHINSON | J269: SMITHERS | W269: FOOTSCRAY | X269: 4 | Y269: 2 | Z269: 0 | AA269: 229 | AB269: 187 | AC269: 122.45989304812834 | AD269: 16
A270: WEST MELB | W270: PRAHRAN | X270: 4 | Y270: 3 | Z270: 0 | AA270: 266 | AB270: 239 | AC270: 111.29707112970711 | AD270: 16
A272: RICHMOND | C272: 0 | D272: 1 | E272: =C272*6+D272 -> 1 | G272: 3 | H272: 4 | I272: =G272*6+H272 -> 22 | K272: 3 | L272: 4 | M272: =K272*6+L272 -> 22 | O272: 4 | P272: 8 | Q272: =O272*6+P272 -> 32 | S272: WILLIAMSTOWN | W272: WILLIAMSTOWN | X272: 3 | Y272: 3 | Z272: 0 | AA272: 243 | AB272: 197 | AC272: 123.3502538071066 | AD272: 12
A273: WILLIAMSTOWN | C273: 3 | D273: 3 | E273: =C273*6+D273 -> 21 | G273: 3 | H273: 3 | I273: =G273*6+H273 -> 21 | K273: 3 | L273: 5 | M273: =K273*6+L273 -> 23 | O273: 4 | P273: 5 | Q273: =O273*6+P273 -> 29 | S273: ARMSTRONG | W273: PORT MELB | X273: 3 | Y273: 3 | Z273: 0 | AA273: 228 | AB273: 218 | AC273: 104.58715596330275 | AD273: 12
A274: BEST PLAYERS | W274: BRUNSWICK | X274: 3 | Y274: 3 | Z274: 0 | AA274: 225 | AB274: 273 | AC274: 82.417582417582423 | AD274: 12
A275: RICHMOND | C275: JOHNSTON | F275: McNAIR | H275: TAYLOR | K275: PIRRIE | N275: CATHIE | P275: McGUIRE | W275: ESSENDON TOWN | X275: 1 | Y275: 5 | Z275: 0 | AA275: 140 | AB275: 246 | AC275: 56.91056910569106 | AD275: 4
A276: WILLIAMSTOWN | C276: LEANY | F276: OUTEN | H276: SPRINTHALL | K276: KNOX | N276: HOUGHTON | Q276: BARTY | W276: WEST MELB | X276: 0 | Y276: 7 | Z276: 0 | AA276: 134 | AB276: 263 | AC276: 50.950570342205324 | AD276: 0
A277: GOALKICKERS
A278: RICHMOND | C278: ALVES (2) | F278: McGUIRE | I278: DAVIDSON
A279: WILLIAMSTOWN | C279: STANILAND (2) | G279: DICK (2)
A281: PRAHRAN | C281: 0 | D281: 0 | E281: =C281*6+D281 -> 0 | G281: 0 | H281: 2 | I281: =G281*6+H281 -> 2 | K281: 1 | L281: 4 | M281: =K281*6+L281 -> 10 | O281: 1 | P281: 6 | Q281: =O281*6+P281 -> 12 | S281: ESS
A282: ESSENDON TOWN | C282: 0 | D282: 0 | E282: =C282*6+D282 -> 0 | G282: 1 | H282: 3 | I282: =G282*6+H282 -> 9 | K282: 1 | L282: 3 | M282: =K282*6+L282 -> 9 | O282: 1 | P282: 3 | Q282: =O282*6+P282 -> 9 | S282: SOUTAR
A283: BEST PLAYERS
A284: PRAHRAN | C284: LYONS | F284: G.BROWN | I284: PARKER | L284: McCLUMPA | O284: T.BROWN | R284: ROBERTS
A285: ESSENDON TOWN | C285: NIXON | F285: SWEATMAN | I285: ARMSTRONG | L285: DENT | O285: GORMAN | R285: STEVENSON
A286: GOALKICKERS
A287: PRAHRAN | C287: ROBERTS
A288: ESSENDON TOWN | C288: TAYLOR
A290: NORTH MELB | C290: 0 | D290: 0 | E290: =C290*6+D290 -> 0 | G290: 2 | H290: 10 | I290: =G290*6+H290 -> 22 | K290: 2 | L290: 10 | M290: =K290*6+L290 -> 22 | O290: 5 | P290: 12 | Q290: =O290*6+P290 -> 42 | S290: FOOTS
A291: FOOTSCRAY | C291: 3 | D291: 4 | E291: =C291*6+D291 -> 22 | G291: 3 | H291: 4 | I291: =G291*6+H291 -> 22 | K291: 5 | L291: 8 | M291: =K291*6+L291 -> 38 | O291: 5 | P291: 8 | Q291: =O291*6+P291 -> 38 | S291: MURPHY
A292: BEST PLAYERS
A293: NORTH MELB | C293: ROLENT | F293: LONERGREN | I293: JACOBS | L293: TORPEY | O293: McSWEENEY | R293: NOONAN
A294: FOOTSCRAY | C294: McCARTHY | F294: HARRIS | I294: HINCH | L294: SERBY | O294: DREW | R294: MOLYNEUX
A295: GOALKICKERS
A296: NORTH MELB | C296: NOONAN | F296: HALL | I296: ROLENT | K296: TORPEY | N296: E.HALL
A297: FOOTSCRAY | C297: DECOIT (2) | F297: WILLIAMS | I297: DREW | K297: MITCHELL
A299: BYE BRUNSWICK
A300: ROUND 8 | E300: 22ND JUNE | J300: WEATHER | N300: FINE CLOUDY
C302: 1ST QTR | G302: 2ND QTR | K302: 3RD QTR | O302: FINAL | S302: AT
S303: P.M.
A304: PORT MELB | C304: 4 | D304: 2 | E304: =C304*6+D304 -> 26 | G304: 6 | H304: 6 | I304: =G304*6+H304 -> 42 | K304: 6 | L304: 10 | M304: =K304*6+L304 -> 46 | O304: 7 | P304: 12 | Q304: =O304*6+P304 -> 54 | S304: UMPIRE | W304: LADDER | AB304: ROUND | AD304: 8
A305: FOOTSCRAY | C305: 1 | D305: 4 | E305: =C305*6+D305 -> 10 | G305: 2 | H305: 4 | I305: =G305*6+H305 -> 16 | K305: 2 | L305: 4 | M305: =K305*6+L305 -> 16 | O305: 4 | P305: 4 | Q305: =O305*6+P305 -> 28 | S305: MURPHY
A306: BEST PLAYERS | W306: TEAM | X306: W | Y306: L | Z306: D | AA306: FOR | AB306: AGST | AC306: % | AD306: PTS
A307: PORT MELB | C307: McGEE | F307: BILES | H307: KEENAN | J307: SWANNIE | M307: JOHNSON | O307: GORDON
A308: FOOTSCRAY | C308: KRUSE | F308: McCARTHY | I308: HINCH | K308: DECOIT | N308: WILLIAMS | Q308: DREW | W308: RICHMOND | X308: 6 | Y308: 1 | Z308: 0 | AA308: 315 | AB308: 181 | AC308: 174.03314917127071 | AD308: 24
A309: GOALKICKERS | W309: NORTH MELB | X309: 5 | Y309: 1 | Z309: 1 | AA309: 257 | AB309: 211 | AC309: 121.80094786729858 | AD309: 22
A310: PORT MELB | C310: HUTCHINSON (3) | G310: KEENAN | J310: COOKE | L310: McDONALD | O310: MORGAN | W310: PORT MELB | X310: 4 | Y310: 3 | Z310: 0 | AA310: 282 | AB310: 246 | AC310: 114.63414634146342 | AD310: 16
A311: FOOTSCRAY | C311: DECOIT (2) | G311: KRUSE | J311: DREW | W311: PRAHRAN | X311: 4 | Y311: 3 | Z311: 0 | AA311: 266 | AB311: 239 | AC311: 111.29707112970711 | AD311: 16
A313: NORTH MELB | C313: 0 | D313: 0 | E313: =C313*6+D313 -> 0 | G313: 3 | H313: 1 | I313: =G313*6+H313 -> 19 | K313: 4 | L313: 1 | M313: =K313*6+L313 -> 25 | O313: 4 | P313: 5 | Q313: =O313*6+P313 -> 29 | S313: N.M. | W313: FOOTSCRAY | X313: 4 | Y313: 3 | Z313: 0 | AA313: 257 | AB313: 241 | AC313: 106.6390041493776 | AD313: 16
A314: WILLIAMSTOWN | C314: 2 | D314: 1 | E314: =C314*6+D314 -> 13 | G314: 2 | H314: 2 | I314: =G314*6+H314 -> 14 | K314: 3 | L314: 4 | M314: =K314*6+L314 -> 22 | O314: 4 | P314: 5 | Q314: =O314*6+P314 -> 29 | S314: HOWELL | W314: WILLIAMSTOWN | X314: 3 | Y314: 3 | Z314: 1 | AA314: 272 | AB314: 226 | AC314: 120.35398230088495 | AD314: 14
A315: BEST PLAYERS | W315: BRUNSWICK | X315: 3 | Y315: 4 | Z315: 0 | AA315: 255 | AB315: 307 | AC315: 83.061889250814332 | AD315: 12
A316: NORTH MELB | C316: GRAHAM | F316: JACOBS | H316: McSWEENEY | K316: WHITFIELD | N316: ROLENT | P316: HALL | W316: WEST MELB | X316: 1 | Y316: 7 | Z316: 0 | AA316: 168 | AB316: 293 | AC316: 57.337883959044369 | AD316: 4
A317: WILLIAMSTOWN | C317: DAVIS | F317: KNOX | H317: OUTEN | K317: WARREN | N317: DICK | P317: HOUGHTON | W317: ESSENDON TOWN | X317: 1 | Y317: 6 | Z317: 0 | AA317: 167 | AB317: 305 | AC317: 54.754098360655739 | AD317: 4
A318: GOALKICKERS
A319: NORTH MELB | C319: QUILLIGAN | F319: NOONAN | I319: TORPEY | L319: CAREY
A320: WILLIAMSTOWN | C320: HEDLEY | F320: McKINLEY | I320: STANILAND | L320: WARREN
A322: RICHMOND | C322: 1 | D322: 2 | E322: =C322*6+D322 -> 8 | G322: 3 | H322: 6 | I322: =G322*6+H322 -> 24 | K322: 7 | L322: 10 | M322: =K322*6+L322 -> 52 | O322: 8 | P322: 11 | Q322: =O322*6+P322 -> 59 | S322: ESS
A323: ESSENDON TOWN | C323: 0 | D323: 2 | E323: =C323*6+D323 -> 2 | G323: 1 | H323: 2 | I323: =G323*6+H323 -> 8 | K323: 1 | L323: 3 | M323: =K323*6+L323 -> 9 | O323: 4 | P323: 3 | Q323: =O323*6+P323 -> 27 | S323: ARMSTRONG
A324: BEST PLAYERS
A325: RICHMOND | C325: JOHNSON | F325: McNAIR | H325: DOUGLASS | K325: TAYLOR | N325: PIRRIE | Q325: CATHIE
A326: ESSENDON TOWN | C326: GORMAN | F326: McCABE | H326: GENT | K326: REID | N326: ARMSTRONG | Q326: TESTER
A327: GOALKICKERS
A328: RICHMOND | C328: McNAIR (2) | F328: PIRRIE (2) | I328: BAHEN | K328: DOUGLASS | N328: JOHNSON | P328: CATHIE
A329: ESSENDON TOWN | C329: TESTER (2) | F329: REID | H329: GORMAN
A331: WEST MELB | C331: 1 | D331: 0 | E331: =C331*6+D331 -> 6 | G331: 2 | H331: 0 | I331: =G331*6+H331 -> 12 | K331: 4 | L331: 2 | M331: =K331*6+L331 -> 26 | O331: 5 | P331: 4 | Q331: =O331*6+P331 -> 34 | S331: B'WICK
A332: BRUNSWICK | C332: 3 | D332: 1 | E332: =C332*6+D332 -> 19 | G332: 3 | H332: 2 | I332: =G332*6+H332 -> 20 | K332: 3 | L332: 5 | M332: =K332*6+L332 -> 23 | O332: 4 | P332: 6 | Q332: =O332*6+P332 -> 30 | S332: HOOD
A333: BEST PLAYERS
A334: WEST MELB | C334: D GREGORY | F334: LAXTON | H334: F GREGORY | K334: GOURLEY | N334: FITZELL | Q334: POOLE
A335: BRUNSWICK
A336: GOALKICKERS
A337: WEST MELB | C337: WILLIAMS | F337: ROURKE | H337: POOLE | J337: RYAN | L337: FITZELL
A338: BRUNSWICK | C338: LANDELLS (3) | G338: LEEDS
A340: BYE PRAHRAN
A341: ROUND 9 | E341: 29TH JUNE | J341: WEATHER | N341: FINE EARLY FOG
C343: 1ST QTR | G343: 2ND QTR | K343: 3RD QTR | O343: FINAL | S343: AT
S344: TOORAK PARK
A345: PORT MELB | C345: 2 | D345: 4 | E345: =C345*6+D345 -> 16 | G345: 2 | H345: 7 | I345: =G345*6+H345 -> 19 | K345: 3 | L345: 9 | M345: =K345*6+L345 -> 27 | O345: 4 | P345: 12 | Q345: =O345*6+P345 -> 36 | S345: UMPIRE | W345: LADDER | AB345: ROUND | AD345: 9
A346: PRAHRAN | C346: 0 | D346: 0 | E346: =C346*6+D346 -> 0 | G346: 3 | H346: 2 | I346: =G346*6+H346 -> 20 | K346: 4 | L346: 4 | M346: =K346*6+L346 -> 28 | O346: 4 | P346: 6 | Q346: =O346*6+P346 -> 30 | S346: ARMSTRONG
A347: BEST PLAYERS | W347: TEAM | X347: W | Y347: L | Z347: D | AA347: FOR | AB347: AGST | AC347: % | AD347: PTS
A348: PORT MELB | C348: McGEE | F348: BLISS | H348: WARD | J348: POLLOCK | M348: KEENAN | O348: HUTCHINSON
A349: PRAHRAN | C349: LYONS | F349: McINERNEY | I349: T.BROWN | L349: DOWDING | O349: LOWRY | Q349: RALEIGH | W349: RICHMOND | X349: 7 | Y349: 1 | Z349: 0 | AA349: 351 | AB349: 199 | AC349: 176.3819095477387 | AD349: 28
A350: GOALKICKERS | W350: NORTH MELB | X350: 5 | Y350: 2 | Z350: 1 | AA350: 275 | AB350: 247 | AC350: 111.33603238866397 | AD350: 22
A351: PORT MELB | W351: PORT MELB | X351: 5 | Y351: 3 | Z351: 0 | AA351: 318 | AB351: 276 | AC351: 115.21739130434783 | AD351: 20
A352: PRAHRAN | W352: FOOTSCRAY | X352: 5 | Y352: 3 | Z352: 0 | AA352: 300 | AB352: 262 | AC352: 114.50381679389314 | AD352: 20
A354: RICHMOND | C354: 1 | D354: 2 | E354: =C354*6+D354 -> 8 | G354: 4 | H354: 4 | I354: =G354*6+H354 -> 28 | K354: 4 | L354: 8 | M354: =K354*6+L354 -> 32 | O354: 4 | P354: 12 | Q354: =O354*6+P354 -> 36 | S354: RICH | W354: WILLIAMSTOWN | X354: 4 | Y354: 3 | Z354: 1 | AA354: 328 | AB354: 272 | AC354: 120.58823529411765 | AD354: 18
A355: NORTH MELB | C355: 1 | D355: 2 | E355: =C355*6+D355 -> 8 | G355: 1 | H355: 4 | I355: =G355*6+H355 -> 10 | K355: 2 | L355: 6 | M355: =K355*6+L355 -> 18 | O355: 2 | P355: 6 | Q355: =O355*6+P355 -> 18 | S355: MURPHY | W355: PRAHRAN | X355: 4 | Y355: 4 | Z355: 0 | AA355: 296 | AB355: 275 | AC355: 107.63636363636364 | AD355: 16
A356: BEST PLAYERS | W356: BRUNSWICK | X356: 3 | Y356: 5 | Z356: 0 | AA356: 301 | AB356: 363 | AC356: 82.92011019283747 | AD356: 12
A357: RICHMOND | C357: RUDD | E357: PIRRIE | G357: DOUGLASS | J357: McNAIR | L357: T.WATSON | O357: TAYLOR | W357: WEST MELB | X357: 1 | Y357: 7 | Z357: 0 | AA357: 168 | AB357: 293 | AC357: 57.337883959044369 | AD357: 4
A358: NORTH MELB | C358: McDERMOTT | F358: CARLTON | I358: LONERGREN | L358: HALL | N358: QUILLIGAN | Q358: TORPEY | W358: ESSENDON TOWN | X358: 1 | Y358: 7 | Z358: 0 | AA358: 188 | AB358: 348 | AC358: 54.022988505747129 | AD358: 4
A359: GOALKICKERS
A360: RICHMOND | C360: DOUGLASS (2) | G360: PIRRIE | J360: DAVIDSON
A361: NORTH MELB | C361: FOX | E361: QUILLIGAN
A363: WILLIAMSTOWN | C363: 2 | D363: 2 | E363: =C363*6+D363 -> 14 | G363: 5 | H363: 6 | I363: =G363*6+H363 -> 36 | K363: 7 | L363: 8 | M363: =K363*6+L363 -> 50 | O363: 8 | P363: 8 | Q363: =O363*6+P363 -> 56 | S363: WILLIAMSTOWN
A364: BRUNSWICK | C364: 1 | D364: 1 | E364: =C364*6+D364 -> 7 | G364: 1 | H364: 3 | I364: =G364*6+H364 -> 9 | K364: 5 | L364: 2 | M364: =K364*6+L364 -> 32 | O364: 7 | P364: 4 | Q364: =O364*6+P364 -> 46 | S364: STRANGER
A365: BEST PLAYERS
A366: WILLIAMSTOWN | C366: VINEY | F366: BARNES | I366: SPRINTHALL | M366: WARREN | P366: KENNEDY | S366: DICK
A367: BRUNSWICK | C367: F ANDREWS | F367: McNAMARA | I367: COBURN | M367: LANDELLS | P367: DUGGAN | S367: JOHNSON
A368: GOALKICKERS
A369: WILLIAMSTOWN | C369: HOUGHTON (2) | F369: WARREN (2) | I369: STANILAND | L369: HEDLEY | O369: KENNEDY | R369: GRIMSHAW
A370: BRUNSWICK | C370: LEEDS (2) | F370: STOTT (2) | I370: JONES (2) | L370: CLEMENTS
A372: FOOTSCRAY | C372: 1 | D372: 3 | E372: =C372*6+D372 -> 9 | G372: 2 | H372: 5 | I372: =G372*6+H372 -> 17 | K372: 4 | L372: 6 | M372: =K372*6+L372 -> 30 | O372: 5 | P372: 13 | Q372: =O372*6+P372 -> 43 | S372: FOOTS
A373: ESSENDON TOWN | C373: 1 | D373: 0 | E373: =C373*6+D373 -> 6 | G373: 1 | H373: 1 | I373: =G373*6+H373 -> 7 | K373: 2 | L373: 1 | M373: =K373*6+L373 -> 13 | O373: 3 | P373: 3 | Q373: =O373*6+P373 -> 21 | S373: HOOD
A374: BEST PLAYERS
A375: FOOTSCRAY | C375: HINCH | F375: HARRIS | H375: McCARTHY | K375: GROVES | N375: DECOIT | P375: DREW
A376: ESSENDON TOWN | C376: G SHAW | F376: SHELDON | I376: GORMAN | L376: FLEMING | O376: WATTS | Q376: ARMSTRONG
A377: GOALKICKERS
A378: FOOTSCRAY | C378: DECOIT (2) | F378: DREW | H378: C.MARMO | K378: SERBY
A379: ESSENDON TOWN | C379: BARR | F379: C.SHAW | H379: SWEATMAN
A381: BYE WEST MELB
A382: ROUND 10 | E382: 6TH JULY | J382: WEATHER | N382: FINE DENSE FOG
C384: 1ST QTR | G384: 2ND QTR | K384: 3RD QTR | O384: FINAL | S384: AT
S385: ESS
A386: PORT MELB | C386: 1 | D386: 0 | E386: =C386*6+D386 -> 6 | G386: 3 | H386: 1 | I386: =G386*6+H386 -> 19 | K386: 5 | L386: 2 | M386: =K386*6+L386 -> 32 | O386: 5 | P386: 3 | Q386: =O386*6+P386 -> 33 | S386: UMPIRE | W386: LADDER | AB386: ROUND | AD386: 10
A387: ESSENDON TOWN | C387: 1 | D387: 0 | E387: =C387*6+D387 -> 6 | G387: 2 | H387: 5 | I387: =G387*6+H387 -> 17 | K387: 2 | L387: 7 | M387: =K387*6+L387 -> 19 | O387: 3 | P387: 7 | Q387: =O387*6+P387 -> 25 | S387: HOWELL
A388: BEST PLAYERS | W388: TEAM | X388: W | Y388: L | Z388: D | AA388: FOR | AB388: AGST | AC388: % | AD388: PTS
A389: PORT MELB | C389: McGEE | F389: MORGAN | I389: HUTCHINSON | L389: WOODS | N389: BROMLEY | Q389: POLLOCK
A390: ESSENDON TOWN | C390: BARR | F390: KENNEDY | I390: TESTER | K390: GORMAN | N390: STEVENSON | Q390: GENT | W390: RICHMOND | X390: 8 | Y390: 1 | Z390: 0 | AA390: 393 | AB390: 227 | AC390: 173.12775330396477 | AD390: 32
A391: GOALKICKERS | W391: NORTH MELB | X391: 6 | Y391: 2 | Z391: 1 | AA391: 331 | AB391: 265 | AC391: 124.90566037735849 | AD391: 26
A392: PORT MELB | C392: McDONALD | F392: WOODS | H392: McGEE | J392: BLISS | L392: BROWN | W392: PORT MELB | X392: 6 | Y392: 3 | Z392: 0 | AA392: 351 | AB392: 301 | AC392: 116.61129568106313 | AD392: 24
A393: ESSENDON TOWN | C393: BARR (2) | F393: TESTER | W393: PRAHRAN | X393: 5 | Y393: 4 | Z393: 0 | AA393: 359 | AB393: 322 | AC393: 111.49068322981367 | AD393: 20
A395: PRAHRAN | C395: 2 | D395: 1 | E395: =C395*6+D395 -> 13 | G395: 3 | H395: 5 | I395: =G395*6+H395 -> 23 | K395: 6 | L395: 10 | M395: =K395*6+L395 -> 46 | O395: 8 | P395: 15 | Q395: =O395*6+P395 -> 63 | S395: TOORAK PARK | W395: FOOTSCRAY | X395: 5 | Y395: 4 | Z395: 0 | AA395: 328 | AB395: 304 | AC395: 107.89473684210526 | AD395: 20
A396: BRUNSWICK | C396: 1 | D396: 1 | E396: =C396*6+D396 -> 7 | G396: 5 | H396: 3 | I396: =G396*6+H396 -> 33 | K396: 6 | L396: 5 | M396: =K396*6+L396 -> 41 | O396: 7 | P396: 5 | Q396: =O396*6+P396 -> 47 | S396: MURPHY | W396: WILLIAMSTOWN | X396: 4 | Y396: 3 | Z396: 1 | AA396: 328 | AB396: 272 | AC396: 120.58823529411765 | AD396: 18
A397: BEST PLAYERS | W397: BRUNSWICK | X397: 3 | Y397: 6 | Z397: 0 | AA397: 348 | AB397: 426 | AC397: 81.690140845070417 | AD397: 12
A398: PRAHRAN | C398: O'BRIEN | F398: T.BROWN | I398: ROBERTS | L398: LYONS | N398: G.BROWN | Q398: DOWDING | W398: ESSENDON TOWN | X398: 1 | Y398: 8 | Z398: 0 | AA398: 213 | AB398: 381 | AC398: 55.905511811023622 | AD398: 4
A399: BRUNSWICK | C399: CAREY | F399: HEGARTY | I399: T.ANDREWS | L399: McNAMARA | O399: KELLETT | R399: W.ANDREWS | W399: WEST MELB | X399: 1 | Y399: 8 | Z399: 0 | AA399: 186 | AB399: 349 | AC399: 53.295128939828082 | AD399: 4
A400: GOALKICKERS
A401: PRAHRAN | C401: HORNIDGE (3) | G401: LOWRY (2) | J401: LYONS (2) | M401: REILLY
A402: BRUNSWICK | C402: JONES (2) | F402: LEEDS (2) | I402: LANDELLS | L402: CLEMENTS | O402: SHELLNACK
A404: RICHMOND | C404: 1 | D404: 8 | E404: =C404*6+D404 -> 14 | G404: 3 | H404: 9 | I404: =G404*6+H404 -> 27 | K404: 4 | L404: 11 | M404: =K404*6+L404 -> 35 | O404: 5 | P404: 12 | Q404: =O404*6+P404 -> 42 | S404: FOOTS
A405: FOOTSCRAY | C405: 0 | D405: 1 | E405: =C405*6+D405 -> 1 | G405: 1 | H405: 3 | I405: =G405*6+H405 -> 9 | K405: 1 | L405: 4 | M405: =K405*6+L405 -> 10 | O405: 4 | P405: 4 | Q405: =O405*6+P405 -> 28 | S405: ARMSTRONG
A406: BEST PLAYERS
A407: RICHMOND | C407: RUDD | F407: VOLLUGI | I407: EDMONDS | L407: T.WATSON | O407: McNAIR | R407: TAYLOR
A408: FOOTSCRAY | C408: SERBY | F408: HARRIS | I408: MARMO | L408: HINCH | O408: KRUSE | R408: GRUNDEN
A409: GOALKICKERS
A410: RICHMOND | C410: DAVIDSON | F410: PIRRIE | H410: BAHEN | K410: TAYLOR | N410: McNAIR
A411: FOOTSCRAY | C411: DREW | F411: DECOIT | H411: SERBY | K411: KRUSE
A413: NORTH MELB | C413: 2 | D413: 3 | E413: =C413*6+D413 -> 15 | G413: 5 | H413: 3 | I413: =G413*6+H413 -> 33 | K413: 6 | L413: 3 | M413: =K413*6+L413 -> 39 | O413: 8 | P413: 8 | Q413: =O413*6+P413 -> 56 | S413: N.M.
A414: WEST MELB | C414: 0 | D414: 2 | E414: =C414*6+D414 -> 2 | G414: 0 | H414: 2 | I414: =G414*6+H414 -> 2 | K414: 1 | L414: 4 | M414: =K414*6+L414 -> 10 | O414: 2 | P414: 6 | Q414: =O414*6+P414 -> 18 | S414: SOUTAR
A415: BEST PLAYERS
A416: NORTH MELB | C416: ROLENT | F416: LONERGREN | I416: TORPEY | K416: JACOBS | N416: GRAHAM | Q416: McDERMOTT
A417: WEST MELB | C417: ROURKE | F417: GREGORY | I417: WILLIAMS | L417: POOLE | O417: TWITCHETT
A418: GOALKICKERS
A419: NORTH MELB | C419: FOX (3) | F419: MONTGOMERIE (2) | K419: ELLIOT | M419: GARDINER | P419: BILLOW
A420: WEST MELB | C420: MURPHY | F420: SCOTT
A422: BYE WILLIAMSTOWN
A423: ROUND 11 | E423: 13TH JULY | J423: WEATHER | N423: FINE CLOUDY LIGHT N WIND
C425: 1ST QTR | G425: 2ND QTR | K425: 3RD QTR | O425: FINAL | S425: AT
S426: N.M.
A427: PORT MELB | C427: 2 | D427: 3 | E427: =C427*6+D427 -> 15 | G427: 5 | H427: 3 | I427: =G427*6+H427 -> 33 | K427: 7 | L427: 9 | M427: =K427*6+L427 -> 51 | O427: 8 | P427: 12 | Q427: =O427*6+P427 -> 60 | S427: UMPIRE | W427: LADDER | AB427: ROUND | AD427: 11
A428: NORTH MELB | C428: 1 | D428: 1 | E428: =C428*6+D428 -> 7 | G428: 3 | H428: 4 | I428: =G428*6+H428 -> 22 | K428: 4 | L428: 5 | M428: =K428*6+L428 -> 29 | O428: 6 | P428: 7 | Q428: =O428*6+P428 -> 43 | S428: ARMSTRONG
A429: BEST PLAYERS | W429: TEAM | X429: W | Y429: L | Z429: D | AA429: FOR | AB429: AGST | AC429: % | AD429: PTS
A430: PORT MELB | C430: KEENAN | F430: PEARS | H430: BROMLEY | K430: GARBUTT | N430: BLISS | P430: SWANNIE
A431: NORTH MELB | C431: GRAHAM | F431: TORPEY | H431: LONERGREN | K431: ROLENT | N431: NOONAN | W431: RICHMOND | X431: 9 | Y431: 1 | Z431: 0 | AA431: 467 | AB431: 237 | AC431: 197.04641350210971 | AD431: 36
A432: GOALKICKERS | W432: PORT MELB | X432: 7 | Y432: 3 | Z432: 0 | AA432: 411 | AB432: 344 | AC432: 119.47674418604652 | AD432: 28
A433: PORT MELB | C433: HUTCHINSON (6) | G433: SMITHSON | J433: PEARS | W433: NORTH MELB | X433: 6 | Y433: 3 | Z433: 1 | AA433: 374 | AB433: 325 | AC433: 115.07692307692308 | AD433: 26
A434: NORTH MELB | C434: CAREY (3) | F434: GRAHAM | I434: BILLOW | K434: SMITH | W434: WILLIAMSTOWN | X434: 5 | Y434: 3 | Z434: 1 | AA434: 385 | AB434: 301 | AC434: 127.90697674418605 | AD434: 22
A436: WILLIAMSTOWN | C436: 1 | D436: 3 | E436: =C436*6+D436 -> 9 | G436: 2 | H436: 5 | I436: =G436*6+H436 -> 17 | K436: 5 | L436: 8 | M436: =K436*6+L436 -> 38 | O436: 8 | P436: 9 | Q436: =O436*6+P436 -> 57 | S436: WILLIAMSTOWN | W436: FOOTSCRAY | X436: 5 | Y436: 5 | Z436: 0 | AA436: 373 | AB436: 350 | AC436: 106.57142857142857 | AD436: 20
A437: PRAHRAN | C437: 1 | D437: 2 | E437: =C437*6+D437 -> 8 | G437: 2 | H437: 2 | I437: =G437*6+H437 -> 14 | K437: 2 | L437: 3 | M437: =K437*6+L437 -> 15 | O437: 4 | P437: 5 | Q437: =O437*6+P437 -> 29 | S437: MURPHY | W437: PRAHRAN | X437: 5 | Y437: 5 | Z437: 0 | AA437: 388 | AB437: 379 | AC437: 102.37467018469657 | AD437: 20
A438: BEST PLAYERS | W438: BRUNSWICK | X438: 4 | Y438: 6 | Z438: 0 | AA438: 394 | AB438: 471 | AC438: 83.651804670912952 | AD438: 16
A439: WILLIAMSTOWN | C439: VINEY | F439: BARNES | I439: McKINLEY | L439: McCARROLL | O439: CALDWELL | R439: WARREN | W439: ESSENDON TOWN | X439: 1 | Y439: 8 | Z439: 0 | AA439: 213 | AB439: 381 | AC439: 55.905511811023622 | AD439: 4
A440: PRAHRAN | C440: T.BROWN | F440: CROSSTELL | I440: WILLISON | L440: FUNGE | O440: DOWDING | R440: HORNIDGE | W440: WEST MELB | X440: 1 | Y440: 9 | Z440: 0 | AA440: 196 | AB440: 423 | AC440: 46.335697399527184 | AD440: 4
A441: GOALKICKERS
A442: WILLIAMSTOWN | C442: STANILAND (3) | G442: GRIMSHAW (2) | K442: KEMP | N442: HOUGHTON | Q442: McKINLEY
A443: PRAHRAN | C443: LYONS (2) | F443: LOWRY | H443: RALEIGH
A445: RICHMOND | C445: 0 | D445: 8 | E445: =C445*6+D445 -> 8 | G445: 2 | H445: 13 | I445: =G445*6+H445 -> 25 | K445: 3 | L445: 16 | M445: =K445*6+L445 -> 34 | O445: 9 | P445: 20 | Q445: =O445*6+P445 -> 74 | S445: RICH
A446: WEST MELB | C446: 0 | D446: 1 | E446: =C446*6+D446 -> 1 | G446: 1 | H446: 1 | I446: =G446*6+H446 -> 7 | K446: 1 | L446: 3 | M446: =K446*6+L446 -> 9 | O446: 1 | P446: 4 | Q446: =O446*6+P446 -> 10 | S446: HOOD
A447: BEST PLAYERS
A448: RICHMOND | C448: CATHIE | F448: McNAIR | H448: TAYLOR | K448: EDMONDS | N448: T.WATSON | Q448: CURTIS
A449: WEST MELB | C449: ROURKE | F449: POOLE | H449: MANSON | K449: McGREGOR | N449: GREGORY | Q449: MERRITT
A450: GOALKICKERS
A451: RICHMOND | C451: LOTT (2) | F451: SNOW (2) | H451: BAKER | J451: TAYLOR | L451: ALVES | N451: CATHIE | P451: BACKHOUSE
A452: WEST MELB | C452: RYAN
A454: BRUNSWICK | C454: 1 | D454: 3 | E454: =C454*6+D454 -> 9 | G454: 3 | H454: 6 | I454: =G454*6+H454 -> 24 | K454: 5 | L454: 8 | M454: =K454*6+L454 -> 38 | O454: 6 | P454: 10 | Q454: =O454*6+P454 -> 46 | S454: B'WICK
A455: FOOTSCRAY | C455: 4 | D455: 1 | E455: =C455*6+D455 -> 25 | G455: 4 | H455: 2 | I455: =G455*6+H455 -> 26 | K455: 7 | L455: 3 | M455: =K455*6+L455 -> 45 | O455: 7 | P455: 3 | Q455: =O455*6+P455 -> 45 | S455: McWHINNEY
A456: BEST PLAYERS
A457: BRUNSWICK | C457: LEEDS | F457: COBURN | I457: W.ANDREWS | L457: F.ANDREWS | O457: JOHNSON | R457: CASEY
A458: FOOTSCRAY | C458: DECOIT | F458: HINCH | H458: MARMO | K458: HARRIS | N458: SERBY | P458: GROVES
A459: GOALKICKERS
A460: BRUNSWICK | C460: LANDELLS (3) | G460: STOTT | I460: JOHNSON | L460: COBURN
A461: FOOTSCRAY | C461: McGLYNN (2) | G461: DREW (2) | J461: MITCHELL | M461: DECOIT | O461: GRUNDEN
A463: BYE ESSENDON TOWN
A464: ROUND 12 | E464: 20TH JULY | J464: WEATHER | N464: OVERCAST STRONG N WIND
C466: 1ST QTR | G466: 2ND QTR | K466: 3RD QTR | O466: FINAL | S466: AT
S467: P.M.
A468: PORT MELB | C468: 4 | D468: 4 | E468: =C468*6+D468 -> 28 | G468: 6 | H468: 5 | I468: =G468*6+H468 -> 41 | K468: 7 | L468: 7 | M468: =K468*6+L468 -> 49 | O468: 8 | P468: 8 | Q468: =O468*6+P468 -> 56 | S468: UMPIRE | W468: LADDER | AB468: ROUND | AD468: 12
A469: BRUNSWICK | C469: 0 | D469: 0 | E469: =C469*6+D469 -> 0 | G469: 1 | H469: 1 | I469: =G469*6+H469 -> 7 | K469: 1 | L469: 1 | M469: =K469*6+L469 -> 7 | O469: 4 | P469: 1 | Q469: =O469*6+P469 -> 25 | S469: HOOD
A470: BEST PLAYERS | W470: TEAM | X470: W | Y470: L | Z470: D | AA470: FOR | AB470: AGST | AC470: % | AD470: PTS
A471: PORT MELB | C471: WARD | F471: McGEE | H471: PILLAR | K471: DUGGAN | N471: HUTCHINSON | R471: SWANNIE
A472: BRUNSWICK | C472: HEGARTY | F472: COBURN | H472: CLEMENTS | K472: CASEY | N472: MULVANEY | R472: LANDELLS | W472: RICHMOND | X472: 9 | Y472: 1 | Z472: 0 | AA472: 467 | AB472: 237 | AC472: 197.04641350210971 | AD472: 36
A473: GOALKICKERS | W473: PORT MELB | X473: 8 | Y473: 3 | Z473: 0 | AA473: 467 | AB473: 369 | AC473: 126.55826558265582 | AD473: 32
A474: PORT MELB | C474: DUGGAN (3) | F474: HUTCHINSON (2) | J474: SMITHERS (2) | N474: McDONALD | W474: NORTH MELB | X474: 7 | Y474: 3 | Z474: 1 | AA474: 419 | AB474: 354 | AC474: 118.36158192090396 | AD474: 30
A475: BRUNSWICK | C475: MULVANEY (2) | G475: CLEMENTS (2) | W475: WILLIAMSTOWN | X475: 6 | Y475: 3 | Z475: 1 | AA475: 435 | AB475: 317 | AC475: 137.22397476340694 | AD475: 26
A477: WILLIAMSTOWN | C477: 3 | D477: 5 | E477: =C477*6+D477 -> 23 | G477: 5 | H477: 8 | I477: =G477*6+H477 -> 38 | K477: 6 | L477: 14 | M477: =K477*6+L477 -> 50 | O477: 6 | P477: 14 | Q477: =O477*6+P477 -> 50 | S477: WILLIAMSTOWN | W477: PRAHRAN | X477: 6 | Y477: 5 | Z477: 0 | AA477: 481 | AB477: 415 | AC477: 115.90361445783132 | AD477: 24
A478: FOOTSCRAY | C478: 0 | D478: 0 | E478: =C478*6+D478 -> 0 | G478: 1 | H478: 0 | I478: =G478*6+H478 -> 6 | K478: 2 | L478: 2 | M478: =K478*6+L478 -> 14 | O478: 2 | P478: 4 | Q478: =O478*6+P478 -> 16 | S478: MURPHY | W478: FOOTSCRAY | X478: 5 | Y478: 6 | Z478: 0 | AA478: 389 | AB478: 400 | AC478: 97.25 | AD478: 20
A479: BEST PLAYERS | W479: BRUNSWICK | X479: 4 | Y479: 7 | Z479: 0 | AA479: 419 | AB479: 527 | AC479: 79.506641366223903 | AD479: 16
A480: WILLIAMSTOWN | C480: KNOX | F480: DAVIS | H480: McKINLEY | K480: SPRINTHALL | O480: HICKEY | R480: HOUGHTON | W480: ESSENDON TOWN | X480: 1 | Y480: 9 | Z480: 0 | AA480: 242 | AB480: 426 | AC480: 56.8075117370892 | AD480: 4
A481: FOOTSCRAY | C481: MARMO | F481: HINCH | H481: KRUSE | K481: SERBY | N481: DREW | P481: MOLYNEUX | W481: WEST MELB | X481: 1 | Y481: 10 | Z481: 0 | AA481: 232 | AB481: 516 | AC481: 44.961240310077521 | AD481: 4
A482: GOALKICKERS
A483: WILLIAMSTOWN | C483: BARTY (2) | F483: KNOX | H483: SPRINTHALL | K483: GRIMSHAW | N483: MANDERSON
A484: FOOTSCRAY | C484: McCANCE | F484: MITCHELL
A486: NORTH MELB | C486: 2 | D486: 3 | E486: =C486*6+D486 -> 15 | G486: 2 | H486: 3 | I486: =G486*6+H486 -> 15 | K486: 5 | L486: 8 | M486: =K486*6+L486 -> 38 | O486: 6 | P486: 9 | Q486: =O486*6+P486 -> 45 | S486: N.M.
A487: ESSENDON TOWN | C487: 0 | D487: 1 | E487: =C487*6+D487 -> 1 | G487: 0 | H487: 3 | I487: =G487*6+H487 -> 3 | K487: 1 | L487: 4 | M487: =K487*6+L487 -> 10 | O487: 4 | P487: 5 | Q487: =O487*6+P487 -> 29 | S487: SOUTAR
A488: BEST PLAYERS
A489: NORTH MELB | C489: TORPEY | F489: SINCLAIR | I489: HALL | K489: NOONAN | N489: KENMAN | Q489: LONERGREN
A490: ESSENDON TOWN | C490: ARMSTRONG | F490: GENT | H490: SWEATMAN | K490: GORMAN | N490: FLEMING | Q490: MARTIN
A491: GOALKICKERS
A492: NORTH MELB | C492: KENMAN (4) | F492: GARDINER | I492: MONTGOMERIE
A493: ESSENDON TOWN | C493: WATTS (2) | F493: KING | I493: ARMSTRONG
A495: PRAHRAN | C495: 1 | D495: 2 | E495: =C495*6+D495 -> 8 | G495: 5 | H495: 8 | I495: =G495*6+H495 -> 38 | K495: 8 | L495: 9 | M495: =K495*6+L495 -> 57 | O495: 13 | P495: 15 | Q495: =O495*6+P495 -> 93 | S495: TOORAK PARK
A496: WEST MELB | C496: 2 | D496: 2 | E496: =C496*6+D496 -> 14 | G496: 2 | H496: 3 | I496: =G496*6+H496 -> 15 | K496: 5 | L496: 4 | M496: =K496*6+L496 -> 34 | O496: 5 | P496: 6 | Q496: =O496*6+P496 -> 36 | S496: HOWELL
A497: BEST PLAYERS
A498: PRAHRAN | C498: LYONS | F498: G.BROWN | I498: T.BROWN | K498: ROBERTS | N498: FUNGE | P498: McCLUMPA
A499: WEST MELB | C499: D.GREGORY | F499: F.GREGORY | I499: BATTY | K499: McDONALD | N499: MONTGOMERY | R499: GOURLEY
A500: GOALKICKERS
A501: PRAHRAN
A502: WEST MELB
A504: BYE RICHMOND
A505: ROUND 13 | E505: 27TH JULY | J505: WEATHER | M505: DULL W WIND LIGHT RAIN GROUNDS WET
C507: 1ST QTR | G507: 2ND QTR | K507: 3RD QTR | O507: FINAL | S507: AT
S508: P.M.
A509: PORT MELB | C509: 1 | D509: 2 | E509: =C509*6+D509 -> 8 | G509: 3 | H509: 3 | I509: =G509*6+H509 -> 21 | K509: 3 | L509: 5 | M509: =K509*6+L509 -> 23 | O509: 3 | P509: 8 | Q509: =O509*6+P509 -> 26 | S509: UMPIRE | W509: LADDER | AB509: ROUND | AD509: 13
A510: RICHMOND | C510: 0 | D510: 3 | E510: =C510*6+D510 -> 3 | G510: 0 | H510: 3 | I510: =G510*6+H510 -> 3 | K510: 1 | L510: 3 | M510: =K510*6+L510 -> 9 | O510: 2 | P510: 3 | Q510: =O510*6+P510 -> 15 | S510: McWHINNEY
A511: BEST PLAYERS | W511: TEAM | X511: W | Y511: L | Z511: D | AA511: FOR | AB511: AGST | AC511: % | AD511: PTS
A512: PORT MELB | C512: McGEE | F512: PILLAR | H512: SWANNIE | K512: POLLOCK | N512: GARBUTT | Q512: SHEEHAN
A513: RICHMOND | C513: RUDD | F513: TAYLOR | H513: EDMUNDS | K513: T.WATSON | N513: D.WATSON | Q513: CURTIS | W513: RICHMOND | X513: 9 | Y513: 2 | Z513: 0 | AA513: 482 | AB513: 263 | AC513: 183.26996197718631 | AD513: 36
A514: GOALKICKERS | W514: PORT MELB | X514: 9 | Y514: 3 | Z514: 0 | AA514: 493 | AB514: 384 | AC514: 128.38541666666666 | AD514: 36
A515: PORT MELB | C515: SMITHERS | F515: KEENAN | H515: HUTCHINSON | W515: WILLIAMSTOWN | X515: 7 | Y515: 3 | Z515: 1 | AA515: 479 | AB515: 345 | AC515: 138.84057971014494 | AD515: 30
A516: RICHMOND | C516: PIRRIE | F516: LOTT | W516: NORTH MELB | X516: 7 | Y516: 3 | Z516: 1 | AA516: 419 | AB516: 354 | AC516: 118.36158192090396 | AD516: 30
A518: FOOTSCRAY | C518: 1 | D518: 5 | E518: =C518*6+D518 -> 11 | G518: 2 | H518: 5 | I518: =G518*6+H518 -> 17 | K518: 5 | L518: 8 | M518: =K518*6+L518 -> 38 | O518: 5 | P518: 8 | Q518: =O518*6+P518 -> 38 | S518: FOOTS | W518: PRAHRAN | X518: 6 | Y518: 6 | Z518: 0 | AA518: 508 | AB518: 453 | AC518: 112.14128035320088 | AD518: 24
A519: PRAHRAN | C519: 0 | D519: 0 | E519: =C519*6+D519 -> 0 | G519: 1 | H519: 8 | I519: =G519*6+H519 -> 14 | K519: 1 | L519: 8 | M519: =K519*6+L519 -> 14 | O519: 3 | P519: 9 | Q519: =O519*6+P519 -> 27 | S519: MURPHY | W519: FOOTSCRAY | X519: 6 | Y519: 6 | Z519: 0 | AA519: 427 | AB519: 427 | AC519: 100 | AD519: 24
A520: BEST PLAYERS | W520: BRUNSWICK | X520: 4 | Y520: 8 | Z520: 0 | AA520: 450 | AB520: 561 | AC520: 80.213903743315512 | AD520: 16
A521: FOOTSCRAY | C521: O'BRIEN | F521: HARRIS | H521: HINCH | J521: MARMO | L521: KRUSE | N521: McCARTHY | W521: ESSENDON TOWN | X521: 2 | Y521: 9 | Z521: 0 | AA521: 276 | AB521: 457 | AC521: 60.393873085339166 | AD521: 8
A522: PRAHRAN | C522: LYONS | F522: T.BROWN | I522: CROSTELL | L522: DOWDING | O522: HORNIDGE | R522: WILLISON | W522: WEST MELB | X522: 1 | Y522: 11 | Z522: 0 | AA522: 260 | AB522: 560 | AC522: 46.428571428571431 | AD522: 4
A523: GOALKICKERS
A524: FOOTSCRAY | C524: DECOIT (3) | F524: HODGSON | I524: MONTGARRETT
A525: PRAHRAN
A527: WILLIAMSTOWN | C527: 3 | D527: 2 | E527: =C527*6+D527 -> 20 | G527: 5 | H527: 3 | I527: =G527*6+H527 -> 33 | K527: 6 | L527: 5 | M527: =K527*6+L527 -> 41 | O527: 6 | P527: 8 | Q527: =O527*6+P527 -> 44 | S527: N.M.
A528: WEST MELB | C528: 2 | D528: 1 | E528: =C528*6+D528 -> 13 | G528: 3 | H528: 3 | I528: =G528*6+H528 -> 21 | K528: 4 | L528: 3 | M528: =K528*6+L528 -> 27 | O528: 4 | P528: 4 | Q528: =O528*6+P528 -> 28 | S528: SOUTAR
A529: BEST PLAYERS
A530: WILLIAMSTOWN | C530: D GREGORY | F530: MONTGOMERY | I530: MERRITT | K530: WILLIAMS | N530: McLEISH | Q530: ROURKE
A531: WEST MELB | C531: VINEY | F531: McCARROLL | I531: GRIMSHAW | K531: STANILAND | N531: BARTY | Q531: HEALEY
A532: GOALKICKERS
A533: WILLIAMSTOWN | C533: GRIMSHAW (2) | G533: STANILAND | J533: BARTY | L533: HEDLEY
A534: WEST MELB | C534: RYAN | F534: MERRETT | I534: WILLIAMS | L534: BATTY
A536: ESSENDON TOWN | C536: 1 | D536: 2 | E536: =C536*6+D536 -> 8 | G536: 4 | H536: 2 | I536: =G536*6+H536 -> 26 | K536: 5 | L536: 3 | M536: =K536*6+L536 -> 33 | O536: 5 | P536: 4 | Q536: =O536*6+P536 -> 34 | S536: ESS
A537: BRUNSWICK | C537: 1 | D537: 0 | E537: =C537*6+D537 -> 6 | G537: 1 | H537: 2 | I537: =G537*6+H537 -> 8 | K537: 2 | L537: 3 | M537: =K537*6+L537 -> 15 | O537: 4 | P537: 7 | Q537: =O537*6+P537 -> 31 | S537: ARMSTRONG
A538: BEST PLAYERS
A539: ESSENDON TOWN | C539: FLEMING | F539: McCABE | I539: DOUGLAS | L539: ARMSTRONG | O539: GORMAN | R539: HARRIS
A540: BRUNSWICK | C540: SHELLNACK | F540: JOHNSON | I540: CLEMENTS | L540: CASEY | O540: W.ANDREWS | R540: F.ANDREWS
A541: GOALKICKERS
A542: ESSENDON TOWN | C542: WATTS (2) | F542: NUMA | H542: BARR | J542: STEVENSON
A543: BRUNSWICK | C543: JAMIESON | F543: MULVANEY | I543: CLEMENTS | L543: CASEY
A545: BYE NORTH MELB
A546: ROUND 14 | E546: 3RD AUGUST | J546: WEATHER | N546: FINE CLOUDY N WIND
C548: 1ST QTR | G548: 2ND QTR | K548: 3RD QTR | O548: FINAL | S548: AT
S549: WILLIAMSTOWN
A550: PORT MELB | C550: 2 | D550: 1 | E550: =C550*6+D550 -> 13 | G550: 2 | H550: 3 | I550: =G550*6+H550 -> 15 | K550: 4 | L550: 7 | M550: =K550*6+L550 -> 31 | O550: 5 | P550: 9 | Q550: =O550*6+P550 -> 39 | S550: UMPIRE | W550: LADDER | AB550: ROUND | AD550: 14
A551: WILLIAMSTOWN | C551: 0 | D551: 1 | E551: =C551*6+D551 -> 1 | G551: 1 | H551: 2 | I551: =G551*6+H551 -> 8 | K551: 1 | L551: 2 | M551: =K551*6+L551 -> 8 | O551: 2 | P551: 2 | Q551: =O551*6+P551 -> 14 | S551: MURPHY
A552: BEST PLAYERS | W552: TEAM | X552: W | Y552: L | Z552: D | AA552: FOR | AB552: AGST | AC552: % | AD552: PTS
A553: PORT MELB | C553: McGEE | F553: KEENAN | I553: FREAME | L553: POLLOCK | O553: GARBUTT | R553: AYLING
A554: WILLIAMSTOWN | C554: DAVIS | F554: McKINLEY | I554: McCARROLL | L554: SPRINTHALL | O554: KNOX | Q554: CALDWELL | W554: RICHMOND | X554: 10 | Y554: 2 | Z554: 0 | AA554: 546 | AB554: 305 | AC554: 179.01639344262296 | AD554: 40
A555: GOALKICKERS | W555: PORT MELB | X555: 10 | Y555: 3 | Z555: 0 | AA555: 532 | AB555: 398 | AC555: 133.66834170854273 | AD555: 40
A556: PORT MELB | C556: McDONALD (2) | G556: DUGGAN | J556: HUTCHINSON | N556: McCONACHIE | W556: NORTH MELB | X556: 8 | Y556: 3 | Z556: 1 | AA556: 476 | AB556: 392 | AC556: 121.42857142857143 | AD556: 34
A557: WILLIAMSTOWN | C557: STANILAND | F557: KNOX | W557: WILLIAMSTOWN | X557: 7 | Y557: 4 | Z557: 1 | AA557: 493 | AB557: 384 | AC557: 128.38541666666666 | AD557: 30
A559: RICHMOND | C559: 1 | D559: 2 | E559: =C559*6+D559 -> 8 | G559: 3 | H559: 11 | I559: =G559*6+H559 -> 29 | K559: 4 | L559: 18 | M559: =K559*6+L559 -> 42 | O559: 7 | P559: 22 | Q559: =O559*6+P559 -> 64 | S559: RICH | W559: PRAHRAN | X559: 6 | Y559: 7 | Z559: 0 | AA559: 550 | AB559: 517 | AC559: 106.38297872340425 | AD559: 24
A560: PRAHRAN | C560: 2 | D560: 5 | E560: =C560*6+D560 -> 17 | G560: 2 | H560: 7 | I560: =G560*6+H560 -> 19 | K560: 4 | L560: 10 | M560: =K560*6+L560 -> 34 | O560: 5 | P560: 12 | Q560: =O560*6+P560 -> 42 | S560: HOOD | W560: FOOTSCRAY | X560: 6 | Y560: 6 | Z560: 0 | AA560: 427 | AB560: 427 | AC560: 100 | AD560: 24
A561: BEST PLAYERS | W561: BRUNSWICK | X561: 4 | Y561: 9 | Z561: 0 | AA561: 488 | AB561: 618 | AC561: 78.964401294498387 | AD561: 16
A562: RICHMOND | C562: TAYLOR | F562: RUDD | H562: DOUGLAS | K562: KANE | M562: PIRRIE | O562: CURTIS | W562: ESSENDON TOWN | X562: 3 | Y562: 9 | Z562: 0 | AA562: 321 | AB562: 482 | AC562: 66.597510373443981 | AD562: 12
A563: PRAHRAN | C563: DOWDING | F563: McCLUMPA | I563: McINERNEY | L563: LYONS | N563: T.BROWN | Q563: HORNIDGE | W563: WEST MELB | X563: 1 | Y563: 12 | Z563: 0 | AA563: 285 | AB563: 605 | AC563: 47.107438016528924 | AD563: 4
A564: GOALKICKERS
A565: RICHMOND | C565: DOUGLAS (2) | F565: TAYLOR (2) | I565: KANE | K565: DAVIDSON | N565: WARMAN
A566: PRAHRAN | C566: RAHILLY | F566: DOWDING | I566: WHITFIELD | L566: HORNIDGE
A568: NORTH MELB | C568: 2 | D568: 1 | E568: =C568*6+D568 -> 13 | G568: 4 | H568: 2 | I568: =G568*6+H568 -> 26 | K568: 8 | L568: 3 | M568: =K568*6+L568 -> 51 | O568: 9 | P568: 3 | Q568: =O568*6+P568 -> 57 | S568: B'WICK
A569: BRUNSWICK | C569: 1 | D569: 0 | E569: =C569*6+D569 -> 6 | G569: 4 | H569: 3 | I569: =G569*6+H569 -> 27 | K569: 4 | L569: 3 | M569: =K569*6+L569 -> 27 | O569: 5 | P569: 8 | Q569: =O569*6+P569 -> 38 | S569: McWHINNEY
A570: BEST PLAYERS
A571: NORTH MELB | C571: BOYLE | F571: GRAHAM | I571: JACOBS | K571: TORPEY | N571: J.SMITH | P571: QUILLIGAN
A572: BRUNSWICK | C572: LANDELLS | F572: McKINNON | I572: CASEY | K572: JOHNSON | N572: LEEDS | P572: SHELLNACK
A573: GOALKICKERS
A574: NORTH MELB | C574: KENNISON (3) | G574: FOX (3) | J574: SMITH (2) | M574: GARDNER
A575: BRUNSWICK | C575: LANDELLS (3) | G575: MULVANEY | J575: CLEMENTS
A577: ESSENDON TOWN | C577: 0 | D577: 0 | E577: =C577*6+D577 -> 0 | G577: 4 | H577: 1 | I577: =G577*6+H577 -> 25 | K577: 4 | L577: 2 | M577: =K577*6+L577 -> 26 | O577: 7 | P577: 3 | Q577: =O577*6+P577 -> 45 | S577: N.M.
A578: WEST MELB | C578: 1 | D578: 0 | E578: =C578*6+D578 -> 6 | G578: 1 | H578: 0 | I578: =G578*6+H578 -> 6 | K578: 1 | L578: 1 | M578: =K578*6+L578 -> 7 | O578: 4 | P578: 1 | Q578: =O578*6+P578 -> 25 | S578: ARMSTRONG
A579: BEST PLAYERS
A580: ESSENDON TOWN | C580: RAMSEY | F580: SHELDON | I580: SWEATMAN | L580: GIRDWOOD | O580: SHAW | R580: HARRIS
A581: WEST MELB | C581: POOLE | F581: ROOKE | I581: FLYNN | L581: WILLIAMS | O581: GOURLEY | R581: GREGORY
A582: GOALKICKERS
A583: ESSENDON TOWN | C583: BARR (2) | F583: WATTS (2) | I583: STEVENSON | L583: HARRIS | N583: ARMSTRONG
A584: WEST MELB | C584: GOURLEY (2) | F584: FLYNN | I584: POOLE
A586: BYE FOOTSCRAY
A587: ROUND 15 | E587: 10TH AUGUST | J587: WEATHER | M587: FINE CLOUDY LIGHT W WIND
C589: 1ST QTR | G589: 2ND QTR | K589: 3RD QTR | O589: FINAL | S589: AT
S590: TOORAK PARK
A591: PRAHRAN | C591: 1 | D591: 3 | E591: =C591*6+D591 -> 9 | G591: 5 | H591: 3 | I591: =G591*6+H591 -> 33 | K591: 6 | L591: 5 | M591: =K591*6+L591 -> 41 | O591: 7 | P591: 8 | Q591: =O591*6+P591 -> 50 | S591: UMPIRE | W591: LADDER | AB591: ROUND | AD591: 15
A592: NORTH MELB | C592: 1 | D592: 4 | E592: =C592*6+D592 -> 10 | G592: 1 | H592: 7 | I592: =G592*6+H592 -> 13 | K592: 4 | L592: 9 | M592: =K592*6+L592 -> 33 | O592: 5 | P592: 11 | Q592: =O592*6+P592 -> 41 | S592: MURPHY
A593: BEST PLAYERS | W593: TEAM | X593: W | Y593: L | Z593: D | AA593: FOR | AB593: AGST | AC593: % | AD593: PTS
A594: PRAHRAN | C594: T.BROWN | F594: O'BRIEN | I594: DOWDING | L594: McCLUMPA | O594: HORNIDGE | R594: BRAMAN
A595: NORTH MELB | C595: SMITH | F595: McDERMOTT | J595: PRATT | L595: NOONAN | O595: ROLENT | R595: LONERGREN | W595: RICHMOND | X595: 11 | Y595: 2 | Z595: 0 | AA595: 584 | AB595: 324 | AC595: 180.24691358024691 | AD595: 44
A596: GOALKICKERS | W596: PORT MELB | X596: 10 | Y596: 3 | Z596: 0 | AA596: 532 | AB596: 398 | AC596: 133.66834170854273 | AD596: 40
A597: PRAHRAN | C597: HORNIDGE (2) | G597: T.BROWN (2) | J597: DOWDING | M597: LYONS | O597: WHITFIELD | W597: NORTH MELB | X597: 8 | Y597: 4 | Z597: 1 | AA597: 517 | AB597: 442 | AC597: 116.96832579185521 | AD597: 34
A598: NORTH MELB | C598: MONTGOMERIE (2) | G598: HALL | I598: ROLENT | K598: JACOBS | W598: WILLIAMSTOWN | X598: 7 | Y598: 5 | Z598: 1 | AA598: 520 | AB598: 424 | AC598: 122.64150943396227 | AD598: 30
A600: RICHMOND | C600: 1 | D600: 1 | E600: =C600*6+D600 -> 7 | G600: 3 | H600: 2 | I600: =G600*6+H600 -> 20 | K600: 3 | L600: 4 | M600: =K600*6+L600 -> 22 | O600: 5 | P600: 8 | Q600: =O600*6+P600 -> 38 | S600: B'WICK | W600: FOOTSCRAY | X600: 7 | Y600: 6 | Z600: 0 | AA600: 514 | AB600: 459 | AC600: 111.98257080610021 | AD600: 28
A601: BRUNSWICK | C601: 1 | D601: 1 | E601: =C601*6+D601 -> 7 | G601: 1 | H601: 2 | I601: =G601*6+H601 -> 8 | K601: 2 | L601: 7 | M601: =K601*6+L601 -> 19 | O601: 2 | P601: 7 | Q601: =O601*6+P601 -> 19 | S601: ARMSTRONG | W601: PRAHRAN | X601: 7 | Y601: 7 | Z601: 0 | AA601: 600 | AB601: 558 | AC601: 107.52688172043011 | AD601: 28
A602: BEST PLAYERS | W602: BRUNSWICK | X602: 4 | Y602: 10 | Z602: 0 | AA602: 507 | AB602: 656 | AC602: 77.286585365853654 | AD602: 16
A603: RICHMOND | C603: EDMUND | F603: CLARK | H603: KING | J603: BAHEN | L603: CURTIS | O603: DOUGLAS | W603: ESSENDON TOWN | X603: 4 | Y603: 9 | Z603: 0 | AA603: 361 | AB603: 509 | AC603: 70.923379174852656 | AD603: 16
A604: BRUNSWICK | C604: COBURN | F604: HARRIS | H604: CASEY | J604: W.ANDREWS | N604: CLEMENTS | Q604: JOHNSON | W604: WEST MELB | X604: 1 | Y604: 13 | Z604: 0 | AA604: 317 | AB604: 692 | AC604: 45.809248554913296 | AD604: 4
A605: GOALKICKERS
A606: RICHMOND | C606: DOUGLAS (2) | F606: McNAIR | H606: WARMAN | K606: JOHNSON
A607: BRUNSWICK | C607: LANDELLS | F607: CLEMENTS
A609: FOOTSCRAY | C609: 6 | D609: 2 | E609: =C609*6+D609 -> 38 | G609: 7 | H609: 3 | I609: =G609*6+H609 -> 45 | K609: 8 | L609: 5 | M609: =K609*6+L609 -> 53 | O609: 13 | P609: 9 | Q609: =O609*6+P609 -> 87 | S609: FOOTS
A610: WEST MELB | C610: 0 | D610: 1 | E610: =C610*6+D610 -> 1 | G610: 1 | H610: 4 | I610: =G610*6+H610 -> 10 | K610: 2 | L610: 4 | M610: =K610*6+L610 -> 16 | O610: 4 | P610: 8 | Q610: =O610*6+P610 -> 32 | S610: SOUTAR
A611: BEST PLAYERS
A612: FOOTSCRAY | C612: DECOIT | F612: KRUSE | H612: SERBY | J612: HARRIS | L612: O'BRIEN | O612: GROVES
A613: WEST MELB | C613: ROURKE | F613: POOLE | H613: CLINN | J613: GREGORY | M613: MONTGOMERY | Q613: RYAN
A614: GOALKICKERS
A615: FOOTSCRAY | C615: DECOIT (7) | F615: GREGORY (3) | J615: SERBY | L615: MONTGARRETT | P615: HARRIS
A616: WEST MELB | C616: RYAN (2) | F616: WILLIAMS | I616: FLYNN
A618: ESSENDON TOWN | C618: 0 | D618: 2 | E618: =C618*6+D618 -> 2 | G618: 2 | H618: 7 | I618: =G618*6+H618 -> 19 | K618: 5 | L618: 10 | M618: =K618*6+L618 -> 40 | O618: 5 | P618: 10 | Q618: =O618*6+P618 -> 40 | S618: ESS
A619: WILLIAMSTOWN | C619: 1 | D619: 2 | E619: =C619*6+D619 -> 8 | G619: 2 | H619: 4 | I619: =G619*6+H619 -> 16 | K619: 3 | L619: 5 | M619: =K619*6+L619 -> 23 | O619: 3 | P619: 9 | Q619: =O619*6+P619 -> 27 | S619: HOOD
A620: BEST PLAYERS
A621: ESSENDON TOWN | C621: RAMSEY | F621: GORMAN | I621: DOUGLAS | L621: ARMSTRONG | O621: McCABE | R621: GENT
A622: WILLIAMSTOWN | C622: GRIMSHAW | F622: CALDWELL | I622: MANDERSON | L622: STANILAND | O622: VINEY | R622: McCARROLL
A623: GOALKICKERS
A624: ESSENDON TOWN | C624: BARR (2) | F624: WAITE | I624: McCABE | L624: GENT
A625: WILLIAMSTOWN | C625: STANILAND (2) | G625: VINEY
A627: BYE PORT MELB
A628: ROUND 16 | E628: 17TH AUGUST | J628: WEATHER | M628: CLOUDY DULL LATE RAIN
C630: 1ST QTR | G630: 2ND QTR | K630: 3RD QTR | O630: FINAL | S630: AT
S631: P.M.
A632: PORT MELB | C632: 2 | D632: 3 | E632: =C632*6+D632 -> 15 | G632: 4 | H632: 5 | I632: =G632*6+H632 -> 29 | K632: 4 | L632: 6 | M632: =K632*6+L632 -> 30 | O632: 6 | P632: 10 | Q632: =O632*6+P632 -> 46 | S632: UMPIRE | W632: LADDER | AB632: ROUND | AD632: 16
A633: WEST MELB | C633: 1 | D633: 2 | E633: =C633*6+D633 -> 8 | G633: 4 | H633: 8 | I633: =G633*6+H633 -> 32 | K633: 4 | L633: 8 | M633: =K633*6+L633 -> 32 | O633: 4 | P633: 11 | Q633: =O633*6+P633 -> 35 | S633: HOWELL
A634: BEST PLAYERS | W634: TEAM | X634: W | Y634: L | Z634: D | AA634: FOR | AB634: AGST | AC634: % | AD634: PTS
A635: PORT MELB | C635: PILLAR | F635: DUGGAN | I635: McCARTHY | L635: BLISS | N635: KEENAN | P635: SHEEHAN
A636: WEST MELB | C636: GOURLAY | F636: ROURKE | I636: WILLIAMS | L636: CLANCY | N636: MANSON | P636: McCCARTHY | W636: RICHMOND | X636: 12 | Y636: 2 | Z636: 0 | AA636: 635 | AB636: 356 | AC636: 178.37078651685394 | AD636: 48
A637: GOALKICKERS | W637: PORT MELB | X637: 11 | Y637: 3 | Z637: 0 | AA637: 578 | AB637: 433 | AC637: 133.48729792147807 | AD637: 44
A638: PORT MELB | C638: DUGGAN (2) | F638: PILLAR | H638: McCARTHY | K638: BLISS | N638: HUTCHINSON | W638: NORTH MELB | X638: 9 | Y638: 4 | Z638: 1 | AA638: 605 | AB638: 483 | AC638: 125.25879917184265 | AD638: 38
A639: WEST MELB | C639: GOURLEY (2) | G639: WILLIAMS | J639: POOLE | W639: WILLIAMSTOWN | X639: 7 | Y639: 6 | Z639: 1 | AA639: 552 | AB639: 475 | AC639: 116.21052631578948 | AD639: 30
A641: RICHMOND | C641: 3 | D641: 2 | E641: =C641*6+D641 -> 20 | G641: 3 | H641: 2 | I641: =G641*6+H641 -> 20 | K641: 6 | L641: 7 | M641: =K641*6+L641 -> 43 | O641: 7 | P641: 9 | Q641: =O641*6+P641 -> 51 | S641: RICH | W641: PRAHRAN | X641: 7 | Y641: 8 | Z641: 0 | AA641: 642 | AB641: 605 | AC641: 106.11570247933884 | AD641: 28
A642: WILLIAMSTOWN | C642: 2 | D642: 3 | E642: =C642*6+D642 -> 15 | G642: 3 | H642: 4 | I642: =G642*6+H642 -> 22 | K642: 3 | L642: 5 | M642: =K642*6+L642 -> 23 | O642: 4 | P642: 8 | Q642: =O642*6+P642 -> 32 | S642: MURPHY | W642: FOOTSCRAY | X642: 7 | Y642: 7 | Z642: 0 | AA642: 555 | AB642: 547 | AC642: 101.46252285191956 | AD642: 28
A643: BEST PLAYERS | W643: ESSENDON TOWN | X643: 5 | Y643: 9 | Z643: 0 | AA643: 408 | AB643: 551 | AC643: 74.047186932849371 | AD643: 20
A644: RICHMOND | C644: WARMAN | F644: RUDD | H644: PIRRIE | K644: BAHEN | N644: CATHIE | W644: BRUNSWICK | X644: 4 | Y644: 10 | Z644: 0 | AA644: 507 | AB644: 656 | AC644: 77.286585365853654 | AD644: 16
A645: WILLIAMSTOWN | C645: VINEY | F645: OUTEN | H645: KNOX | K645: W.WARREN | N645: BARTY | P645: STANILAND | W645: WEST MELB | X645: 1 | Y645: 14 | Z645: 0 | AA645: 352 | AB645: 738 | AC645: 47.696476964769644 | AD645: 4
A646: GOALKICKERS
A647: RICHMOND | C647: DAVIDSON (3) | G647: DOUGLAS (3) | K647: BAHEN
A648: WILLIAMSTOWN | C648: STANILAND (3) | G648: GRIMSHAW
A650: NORTH MELB | C650: 6 | D650: 2 | E650: =C650*6+D650 -> 38 | G650: 8 | H650: 5 | I650: =G650*6+H650 -> 53 | K650: 11 | L650: 8 | M650: =K650*6+L650 -> 74 | O650: 13 | P650: 10 | Q650: =O650*6+P650 -> 88 | S650: N.M.
A651: FOOTSCRAY | C651: 0 | D651: 1 | E651: =C651*6+D651 -> 1 | G651: 3 | H651: 4 | I651: =G651*6+H651 -> 22 | K651: 4 | L651: 6 | M651: =K651*6+L651 -> 30 | O651: 5 | P651: 11 | Q651: =O651*6+P651 -> 41 | S651: McWHINNEY
A652: BEST PLAYERS
A653: NORTH MELB | C653: ETHELL | F653: SINCLAIR | I653: LONERGREN | L653: J.SMITH | O653: TORPEY | R653: ROLENT
A654: FOOTSCRAY | C654: MARMO | F654: McCARTHY | I654: GROVES | L654: GRUNDEN | O654: WOODWARD | R654: RICHARDSON
A655: GOALKICKERS
A656: NORTH MELB | C656: KNEE (3) | F656: TORPEY (2) | I656: MONTGOMERIE (2) | M656: GRAHAM (2) | P656: GARDINER | S656: HALL | U656: KINMAN
A657: FOOTSCRAY | C657: SERBY (2) | F657: HARRIS | I657: GRUNDEN | L657: KRUSE
A659: ESSENDON TOWN | C659: 3 | D659: 1 | E659: =C659*6+D659 -> 19 | G659: 5 | H659: 3 | I659: =G659*6+H659 -> 33 | K659: 6 | L659: 3 | M659: =K659*6+L659 -> 39 | O659: 7 | P659: 5 | Q659: =O659*6+P659 -> 47 | S659: TOORAK PARK
A660: PRAHRAN | C660: 2 | D660: 1 | E660: =C660*6+D660 -> 13 | G660: 4 | H660: 1 | I660: =G660*6+H660 -> 25 | K660: 5 | L660: 5 | M660: =K660*6+L660 -> 35 | O660: 6 | P660: 6 | Q660: =O660*6+P660 -> 42 | S660: ARMSTRONG
A661: BEST PLAYERS
A662: ESSENDON TOWN | C662: SHELDON | F662: RAMSEY | I662: HARRIS | L662: GORMAN | O662: FLEMING | R662: FORD
A663: PRAHRAN | C663: LYONS | F663: McINERNEY | I663: T.BROWN | L663: WILLISON | O663: HORNIDGE | R663: WHITFIELD
A664: GOALKICKERS
A665: ESSENDON TOWN | C665: GIRDWOOD (3) | G665: WATTS (3) | J665: RAMSEY
A666: PRAHRAN | C666: RAHILLY (3)
A668: BYE BRUNSWICK
A669: ROUND 17 | E669: 24TH AUGUST | J669: WEATHER | M669: CALM FOGGY
C671: 1ST QTR | G671: 2ND QTR | K671: 3RD QTR | O671: FINAL | S671: AT
S672: FOOTS
A673: PORT MELB | C673: 1 | D673: 1 | E673: =C673*6+D673 -> 7 | G673: 4 | H673: 4 | I673: =G673*6+H673 -> 28 | K673: 5 | L673: 7 | M673: =K673*6+L673 -> 37 | O673: 6 | P673: 8 | Q673: =O673*6+P673 -> 44 | S673: UMPIRE | W673: LADDER | AB673: ROUND | AD673: 17
A674: FOOTSCRAY | C674: 3 | D674: 2 | E674: =C674*6+D674 -> 20 | G674: 4 | H674: 3 | I674: =G674*6+H674 -> 27 | K674: 4 | L674: 3 | M674: =K674*6+L674 -> 27 | O674: 5 | P674: 3 | Q674: =O674*6+P674 -> 33 | S674: MURPHY
A675: BEST PLAYERS | W675: TEAM | X675: W | Y675: L | Z675: D | AA675: FOR | AB675: AGST | AC675: % | AD675: PTS
A676: PORT MELB | C676: McGEE | F676: GARBUTT | I676: AYLING | K676: FREAME | N676: WARD | P676: DUGGAN
A677: FOOTSCRAY | C677: MARMO | F677: KRUSE | I677: SERBY | K677: McCANCE | N677: WOODWARD | Q677: O'BRIEN | W677: RICHMOND | X677: 12 | Y677: 3 | Z677: 0 | AA677: 667 | AB677: 396 | AC677: 168.43434343434345 | AD677: 48
A678: GOALKICKERS | W678: PORT MELB | X678: 12 | Y678: 3 | Z678: 0 | AA678: 622 | AB678: 466 | AC678: 133.47639484978541 | AD678: 48
A679: PORT MELB | C679: HUTCHINSON (2) | G679: McGEE | J679: BROWN | L679: McDONALD | O679: SWANNIE | W679: NORTH MELB | X679: 10 | Y679: 4 | Z679: 1 | AA679: 653 | AB679: 511 | AC679: 127.78864970645793 | AD679: 42
A680: FOOTSCRAY | C680: MONTGARRETT (2) | G680: CAIRNS (2) | K680: GRUNDEN | W680: WILLIAMSTOWN | X680: 7 | Y680: 7 | Z680: 1 | AA680: 580 | AB680: 523 | AC680: 110.89866156787762 | AD680: 30
A682: NORTH MELB | C682: 2 | D682: 1 | E682: =C682*6+D682 -> 13 | G682: 5 | H682: 3 | I682: =G682*6+H682 -> 33 | K682: 6 | L682: 5 | M682: =K682*6+L682 -> 41 | O682: 7 | P682: 6 | Q682: =O682*6+P682 -> 48 | S682: WILLIAMSTOWN | W682: PRAHRAN | X682: 7 | Y682: 8 | Z682: 0 | AA682: 642 | AB682: 605 | AC682: 106.11570247933884 | AD682: 28
A683: WILLIAMSTOWN | C683: 2 | D683: 1 | E683: =C683*6+D683 -> 13 | G683: 2 | H683: 1 | I683: =G683*6+H683 -> 13 | K683: 4 | L683: 2 | M683: =K683*6+L683 -> 26 | O683: 4 | P683: 4 | Q683: =O683*6+P683 -> 28 | S683: McWHINNEY | W683: FOOTSCRAY | X683: 7 | Y683: 8 | Z683: 0 | AA683: 588 | AB683: 591 | AC683: 99.492385786802032 | AD683: 28
A684: BEST PLAYERS | W684: ESSENDON TOWN | X684: 6 | Y684: 9 | Z684: 0 | AA684: 448 | AB684: 583 | AC684: 76.843910806174961 | AD684: 24
A685: NORTH MELB | C685: PRATT | F685: TORPEY | I685: HALL | K685: NOONAN | N685: QUILLIGAN | Q685: KNEE | W685: BRUNSWICK | X685: 5 | Y685: 10 | Z685: 0 | AA685: 547 | AB685: 665 | AC685: 82.255639097744364 | AD685: 20
A686: WILLIAMSTOWN | C686: HEDLEY | F686: WARREN | I686: HOUGHTON | L686: STANILAND | O686: CALDWELL | R686: SPRINTHALL | W686: WEST MELB | X686: 1 | Y686: 15 | Z686: 0 | AA686: 361 | AB686: 778 | AC686: 46.401028277634964 | AD686: 4
A687: GOALKICKERS
A688: NORTH MELB | C688: KNEE (3) | F688: MONTGOMERIE (2)
A689: WILLIAMSTOWN | C689: HICKEY | F689: STANILAND | J689: MORRISON | M689: ROBERTSON
A691: ESSENDON TOWN | C691: 1 | D691: 2 | E691: =C691*6+D691 -> 8 | G691: 1 | H691: 3 | I691: =G691*6+H691 -> 9 | K691: 6 | L691: 4 | M691: =K691*6+L691 -> 40 | O691: 6 | P691: 4 | Q691: =O691*6+P691 -> 40 | S691: RICH
A692: RICHMOND | C692: 1 | D692: 0 | E692: =C692*6+D692 -> 6 | G692: 2 | H692: 7 | I692: =G692*6+H692 -> 19 | K692: 2 | L692: 7 | M692: =K692*6+L692 -> 19 | O692: 3 | P692: 14 | Q692: =O692*6+P692 -> 32 | S692: ARMSTRONG
A693: BEST PLAYERS
A694: ESSENDON TOWN | C694: McCABE | F694: ARMSRTRONG | J694: SHELDON | M694: GORMAN | P694: DOUGLAS | S694: FLEMING
A695: RICHMOND | C695: WARMAN | F695: KING | I695: EDMUNDS | L695: WATSON | O695: BACKHOUSE | R695: SIBLEY
A696: GOALKICKERS
A697: ESSENDON TOWN | C697: WATTS (3) | F697: GRAHAM | I697: GIRDWOOD | L697: NUMA
A698: RICHMOND | C698: JOHNSON | F698: BAHEN | H698: DOUGLAS
A700: BRUNSWICK | C700: 4 | D700: 1 | E700: =C700*6+D700 -> 25 | G700: 4 | H700: 7 | I700: =G700*6+H700 -> 31 | K700: 5 | L700: 7 | M700: =K700*6+L700 -> 37 | O700: 5 | P700: 10 | Q700: =O700*6+P700 -> 40 | S700: N.M.
A701: WEST MELB | C701: 0 | D701: 2 | E701: =C701*6+D701 -> 2 | G701: 0 | H701: 2 | I701: =G701*6+H701 -> 2 | K701: 1 | L701: 3 | M701: =K701*6+L701 -> 9 | O701: 1 | P701: 3 | Q701: =O701*6+P701 -> 9 | S701: SOUTAR
A702: BEST PLAYERS
A703: BRUNSWICK | C703: G JOHNSTON | G703: BATT | J703: HEALEY | L703: DOWLING | O703: CASEY | R703: KENNETT
A704: WEST MELB | C704: MCCARTHY | G704: MANSON | J704: STEVENS | L704: SMITH | O704: ROBERTS | R704: WILLIAMS
A705: GOALKICKERS
A706: BRUNSWICK | C706: CLEMENTS (3) | G706: SHELLNACK | J706: CROWE
A707: WEST MELB | C707: ROURKE
A709: BYE PRAHRAN
A710: ROUND 18 | E710: 31ST AUGUST | J710: WEATHER | N710: FINE CLOUDY N WIND
C712: 1ST QTR | G712: 2ND QTR | K712: 3RD QTR | O712: FINAL | S712: AT
S713: P.M.
A714: PORT MELB | C714: 1 | D714: 2 | E714: =C714*6+D714 -> 8 | G714: 3 | H714: 6 | I714: =G714*6+H714 -> 24 | K714: 6 | L714: 10 | M714: =K714*6+L714 -> 46 | O714: 7 | P714: 12 | Q714: =O714*6+P714 -> 54 | S714: UMPIRE | W714: LADDER | AB714: ROUND | AD714: 18
A715: PRAHRAN | C715: 0 | D715: 0 | E715: =C715*6+D715 -> 0 | G715: 2 | H715: 1 | I715: =G715*6+H715 -> 13 | K715: 2 | L715: 1 | M715: =K715*6+L715 -> 13 | O715: 3 | P715: 5 | Q715: =O715*6+P715 -> 23 | S715: SOUTAR
A716: BEST PLAYERS | W716: TEAM | X716: W | Y716: L | Z716: D | AA716: FOR | AB716: AGST | AC716: % | AD716: PTS
A717: PORT MELB | C717: PILLAR | F717: BROMLEY | I717: POLLOCK | L717: WARD | O717: FREAME | R717: KEENAN
A718: PRAHRAN | C718: T.BROWN | F718: ROBERTS | I718: CROSKELL | L718: DOWDING | O718: WILLISON | R718: CUMMING | W718: PORT MELB | X718: 13 | Y718: 3 | Z718: 0 | AA718: 676 | AB718: 489 | AC718: 138.24130879345603 | AD718: 52
A719: GOALKICKERS | W719: RICHMOND | X719: 12 | Y719: 4 | Z719: 0 | AA719: 681 | AB719: 428 | AC719: 159.11214953271028 | AD719: 48
A720: PORT MELB | C720: HUTCHINSON (2) | G720: McDONALD (2) | K720: FREAME | N720: KEENAN | P720: SMITHERS | W720: NORTH MELB | X720: 11 | Y720: 4 | Z720: 1 | AA720: 685 | AB720: 525 | AC720: 130.47619047619048 | AD720: 46
A721: PRAHRAN | C721: WHITFIELD | G721: HORNIDGE | K721: CUMMINGS | W721: WILLIAMSTOWN | X721: 7 | Y721: 8 | Z721: 1 | AA721: 621 | AB721: 595 | AC721: 104.36974789915966 | AD721: 30
A723: NORTH MELB | C723: 0 | D723: 0 | E723: =C723*6+D723 -> 0 | G723: 0 | H723: 2 | I723: =G723*6+H723 -> 2 | K723: 1 | L723: 4 | M723: =K723*6+L723 -> 10 | O723: 4 | P723: 8 | Q723: =O723*6+P723 -> 32 | S723: N.M. | W723: PRAHRAN | X723: 7 | Y723: 9 | Z723: 0 | AA723: 665 | AB723: 659 | AC723: 100.91047040971168 | AD723: 28
A724: RICHMOND | C724: 0 | D724: 1 | E724: =C724*6+D724 -> 1 | G724: 0 | H724: 2 | I724: =G724*6+H724 -> 2 | K724: 2 | L724: 2 | M724: =K724*6+L724 -> 14 | O724: 2 | P724: 2 | Q724: =O724*6+P724 -> 14 | S724: McWHINNEY | W724: FOOTSCRAY | X724: 7 | Y724: 9 | Z724: 0 | AA724: 611 | AB724: 622 | AC724: 98.231511254019296 | AD724: 28
A725: BEST PLAYERS | W725: ESSENDON TOWN | X725: 7 | Y725: 9 | Z725: 0 | AA725: 479 | AB725: 606 | AC725: 79.04290429042905 | AD725: 28
A726: NORTH MELB | C726: TORPEY | F726: HALL | H726: NOONAN | K726: ETHELL | N726: McDERMOTT | R726: LONERGREN | W726: BRUNSWICK | X726: 6 | Y726: 10 | Z726: 0 | AA726: 619 | AB726: 706 | AC726: 87.677053824362602 | AD726: 24
A727: RICHMOND | C727: McNAIR | F727: JOHNSON | I727: TAYLOR | L727: CATHIE | O727: EDMUNDS | R727: WATSON | W727: WEST MELB | X727: 1 | Y727: 15 | Z727: 0 | AA727: 361 | AB727: 778 | AC727: 46.401028277634964 | AD727: 4
A728: GOALKICKERS
A729: NORTH MELB | C729: KNEE (2) | F729: KINMAN (2)
A730: RICHMOND | C730: DOUGLAS | F730: LOTT
A732: ESSENDON TOWN | C732: 0 | D732: 0 | E732: =C732*6+D732 -> 0 | G732: 2 | H732: 4 | I732: =G732*6+H732 -> 16 | K732: 3 | L732: 5 | M732: =K732*6+L732 -> 23 | O732: 4 | P732: 7 | Q732: =O732*6+P732 -> 31 | S732: ESS
A733: FOOTSCRAY | C733: 1 | D733: 2 | E733: =C733*6+D733 -> 8 | G733: 1 | H733: 2 | I733: =G733*6+H733 -> 8 | K733: 1 | L733: 3 | M733: =K733*6+L733 -> 9 | O733: 3 | P733: 5 | Q733: =O733*6+P733 -> 23 | S733: HOWELL
A734: BEST PLAYERS
A735: ESSENDON TOWN | C735: McCABE | F735: ARMSTRONG | I735: GENT | K735: WATT | N735: GORMAN | Q735: NIXON
A736: FOOTSCRAY | C736: HARRIS | F736: McCANCE | I736: MARMO | K736: KRUSE | N736: GROVES | Q736: O'BRIEN
A737: GOALKICKERS
A738: ESSENDON TOWN | C738: WATTS (2) | F738: GENT (2)
A739: FOOTSCRAY | C739: RICHARDSON | G739: SERBY | J739: McCARTHY
A741: BRUNSWICK | C741: 0 | D741: 0 | E741: =C741*6+D741 -> 0 | G741: 4 | H741: 1 | I741: =G741*6+H741 -> 25 | K741: 6 | L741: 4 | M741: =K741*6+L741 -> 40 | O741: 10 | P741: 12 | Q741: =O741*6+P741 -> 72 | S741: B'WICK
A742: WILLIAMSTOWN | C742: 2 | D742: 3 | E742: =C742*6+D742 -> 15 | G742: 2 | H742: 3 | I742: =G742*6+H742 -> 15 | K742: 5 | L742: 3 | M742: =K742*6+L742 -> 33 | O742: 6 | P742: 5 | Q742: =O742*6+P742 -> 41 | S742: MURPHY
A743: BEST PLAYERS
A744: BRUNSWICK | C744: CLEMENTS | F744: SHELLNACK | I744: CROWE | K744: COBURN | N744: DOWLING | Q744: CASEY
A745: WILLIAMSTOWN | C745: SPRINTHALL | F745: CALDWELL | I745: VINEY | K745: McKINLEY | N745: GRIMSHAW | Q745: STANILAND
A746: GOALKICKERS
A747: BRUNSWICK | C747: CLEMENTS (2) | G747: WOODS (2) | J747: LANDELLS (2) | M747: CASEY | O747: DOWLING | R747: COX | T747: CROWE
A748: WILLIAMSTOWN
A750: BYE WEST MELB