A1: Victorian Football Association
A2: Season 1902
A3: © Copyright Wal Williams | F3: First created: 2 August 2014
A4: Contact: joywalwi at gmail dot com | F4: Last updated: 30 July 2017 | W4: VFA Results and tables - Link to the main index page
A5: You are free to copy this document in whole or part provided that proper acknowledgement is given to the author. All rights reserved.
A7: ROUND 1 | E7: 3RD MAY | K7: WEATHER | Q7: FINE
C9: 1ST QTR | G9: 2ND QTR | K9: 3RD QTR | O9: FINAL | S9: PLAYED AT | X9: LADDER | AB9: ROUND | AD9: 1
S10: RICHMOND
A11: RICHMOND | C11: 1 | D11: 7 | E11: =C11*6+D11 -> 13 | G11: 3 | H11: 10 | I11: =G11*6+H11 -> 28 | K11: 5 | L11: 12 | M11: =K11*6+L11 -> 42 | O11: 6 | P11: 13 | Q11: =O11*6+P11 -> 49 | S11: UMPIRE | W11: TEAM | X11: W | Y11: L | Z11: D | AA11: FOR | AB11: AGST | AC11: % | AD11: PTS
A12: PORT MELBOURNE | C12: 0 | D12: 1 | E12: =C12*6+D12 -> 1 | G12: 1 | H12: 4 | I12: =G12*6+H12 -> 10 | K12: 3 | L12: 6 | M12: =K12*6+L12 -> 24 | O12: 4 | P12: 6 | Q12: =O12*6+P12 -> 30 | S12: ARMSTRONG
A13: BEST PLAYERS | W13: FOOTSCRAY | X13: 1 | Y13: 0 | Z13: 0 | AA13: 90 | AB13: 18 | AC13: 500 | AD13: 4
A14: RICHMOND | D14: C. BACKHOUSE | G14: MANNING | J14: EDMONDS | L14: RICHARDSON | O14: DUNCAN | Q14: JUSTINS | W14: WILLIAMSTOWN | X14: 1 | Y14: 0 | Z14: 0 | AA14: 67 | AB14: 30 | AC14: 223.33333333333334 | AD14: 4
A15: PORT MELBOURNE | D15: McGEE | G15: HEGARTY | J15: POLLOCK | L15: SHEEHAN | O15: AYLIN | Q15: KEENAN | W15: ESSENDON TOWN | X15: 1 | Y15: 0 | Z15: 0 | AA15: 65 | AB15: 33 | AC15: 196.96969696969697 | AD15: 4
A16: GOALKICKERS | W16: RICHMOND | X16: 1 | Y16: 0 | Z16: 0 | AA16: 49 | AB16: 30 | AC16: 163.33333333333334 | AD16: 4
A17: RICHMOND | D17: RICHARDSON 2 | G17: C. BACKHOUSE | J17: McNAIR | L17: CATHIE | N17: MANNING
A18: PORT MELBOURNE | D18: HUTCHINSON 3 | G18: HERRON | W18: PORT MELBOURNE | X18: 0 | Y18: 1 | Z18: 0 | AA18: 30 | AB18: 49 | AC18: 61.224489795918366 | AD18: 0
W19: BRUNSWICK | X19: 0 | Y19: 1 | Z19: 0 | AA19: 33 | AB19: 65 | AC19: 50.769230769230766 | AD19: 0
A20: FOOTSCRAY | C20: 4 | D20: 5 | E20: =C20*6+D20 -> 29 | G20: 7 | H20: 9 | I20: =G20*6+H20 -> 51 | K20: 10 | L20: 15 | M20: =K20*6+L20 -> 75 | O20: 12 | P20: 18 | Q20: =O20*6+P20 -> 90 | S20: FOOTSCRAY | W20: WEST MELBOURNE | X20: 0 | Y20: 1 | Z20: 0 | AA20: 30 | AB20: 67 | AC20: 44.776119402985074 | AD20: 0
A21: PRAHRAN | C21: 0 | D21: 0 | E21: =C21*6+D21 -> 0 | G21: 0 | H21: 2 | I21: =G21*6+H21 -> 2 | K21: 1 | L21: 4 | M21: =K21*6+L21 -> 10 | O21: 2 | P21: 6 | Q21: =O21*6+P21 -> 18 | S21: WATERS | W21: PRAHRAN | X21: 0 | Y21: 1 | Z21: 0 | AA21: 18 | AB21: 90 | AC21: 20 | AD21: 0
A22: BEST PLAYERS | W22: NORTH MELBOURNE | X22: 0 | Y22: 0 | Z22: 0 | AA22: 0 | AB22: 0 | AC22: 0 | AD22: 0
A23: FOOTSCRAY | D23: DECOIT | G23: MARTIN | J23: MARMO | L23: HARRIS | O23: HINCH | R23: KRUSE
A24: PRAHRAN | D24: ROBERTS | G24: WILLISON | J24: T. BROWN | L24: McCLUMPA | O24: SMITH | R24: JONES
A25: GOALKICKERS
A26: FOOTSCRAY | D26: DECOIT 4 | G26: MARTIN 2 | J26: HARRIS 2 | L26: WILLIAMS | O26: SERBY | Q26: McGLYNN | S26: KRUSE
A27: PRAHRAN | D27: HORNIDGE | G27: REYNOLDS
A29: WILLIAMSTOWN | C29: 3 | D29: 3 | E29: =C29*6+D29 -> 21 | G29: 5 | H29: 4 | I29: =G29*6+H29 -> 34 | K29: 5 | L29: 6 | M29: =K29*6+L29 -> 36 | O29: 9 | P29: 13 | Q29: =O29*6+P29 -> 67 | S29: NORTH MELBOURNE
A30: WEST MELBOURNE | C30: 1 | D30: 0 | E30: =C30*6+D30 -> 6 | G30: 4 | H30: 5 | I30: =G30*6+H30 -> 29 | K30: 4 | L30: 6 | M30: =K30*6+L30 -> 30 | O30: 4 | P30: 6 | Q30: =O30*6+P30 -> 30 | S30: MURPHY
A31: BEST PLAYERS
A32: WILLIAMSTOWN | D32: KNOX | F32: McCARROLL | I32: CALDWELL | L32: HEDLEY | O32: HOUGHTON | R32: DICK
A33: WEST MELBOURNE | D33: ROOKE | F33: POOLE | H33: D. GREGORY | L33: DAVIS | O33: B. WILLIAMS | R33: SARSFIELD
A34: GOALKICKERS
A35: WILLIAMSTOWN | D35: STANILAND 2 | G35: GRIMSHAW 2 | J35: BAKER | L35: HEDLEY | N35: LEGGE | P35: GRAHAM | R35: WARREN
A36: WEST MELBOURNE | D36: WILLIAMS 2 | G36: GOURLAY | J36: ROOKE
A38: ESSENDON TOWN | C38: 2 | D38: 3 | E38: =C38*6+D38 -> 15 | G38: 4 | H38: 4 | I38: =G38*6+H38 -> 28 | K38: 5 | L38: 5 | M38: =K38*6+L38 -> 35 | O38: 9 | P38: 11 | Q38: =O38*6+P38 -> 65 | S38: ESSENDON
A39: BRUNSWICK | C39: 1 | D39: 2 | E39: =C39*6+D39 -> 8 | G39: 3 | H39: 5 | I39: =G39*6+H39 -> 23 | K39: 3 | L39: 8 | M39: =K39*6+L39 -> 26 | O39: 4 | P39: 9 | Q39: =O39*6+P39 -> 33 | S39: TYRER
A40: BEST PLAYERS
A41: ESSENDON TOWN | D41: GENT | F41: RAMSAY | H41: GRIFFITHS | K41: DRYBURGH | N41: TESTER | Q41: SHELDON
A42: BRUNSWICK | D42: JOHNSON | F42: LEEDS | H42: ANDREWS | K42: SHELLNACK | N42: CROWE | Q42: COBURN
A43: GOALKICKERS
A44: ESSENDON TOWN | D44: GENT 3 | F44: NUMA 2 | H44: WATTS | J44: GRAHAM | L44: BUSBRIDGE | O44: FEAVER
A45: BRUNSWICK | D45: LEEDS 2 | F45: CLEMENTS | H45: MULVANEY
A47: BYE | F47: NORTH MELBOURNEOURNE
A50: ROUND 2 | E50: 10TH MAY | K50: WEATHER | P50: DULL CLOUDY SOUTH WIND
C52: 1ST QTR | G52: 2ND QTR | K52: 3RD QTR | O52: FINAL | S52: PLAYED AT | X52: LADDER | AB52: ROUND | AD52: 2
S53: WILLIAMSTOWN
A54: WILLIAMSTOWN | C54: 0 | D54: 4 | E54: =C54*6+D54 -> 4 | G54: 2 | H54: 9 | I54: =G54*6+H54 -> 21 | K54: 2 | L54: 9 | M54: =K54*6+L54 -> 21 | O54: 4 | P54: 12 | Q54: =O54*6+P54 -> 36 | S54: UMPIRE | W54: TEAM | X54: W | Y54: L | Z54: D | AA54: FOR | AB54: AGST | AC54: % | AD54: PTS
A55: FOOTSCRAY | C55: 2 | D55: 1 | E55: =C55*6+D55 -> 13 | G55: 3 | H55: 4 | I55: =G55*6+H55 -> 22 | K55: 4 | L55: 9 | M55: =K55*6+L55 -> 33 | O55: 4 | P55: 10 | Q55: =O55*6+P55 -> 34 | S55: TIPTON
A56: BEST PLAYERS | W56: WILLIAMSTOWN | X56: 2 | Y56: 0 | Z56: 0 | AA56: 103 | AB56: 64 | AC56: 160.9375 | AD56: 8
A57: WILLIAMSTOWN | D57: HEDLEY | G57: HOUGHTON | J57: DICK | L57: BARTY | N57: BAKER | Q57: SPRINTHALL | W57: ESSENDON TOWN | X57: 1 | Y57: 0 | Z57: 1 | AA57: 107 | AB57: 75 | AC57: 142.66666666666666 | AD57: 6
A58: FOOTSCRAY | D58: SERBY | G58: HARRIS | J58: DECOIT | L58: PYMM | N58: WILLIAMS | Q58: GROVES | W58: FOOTSCRAY | X58: 1 | Y58: 1 | Z58: 0 | AA58: 124 | AB58: 54 | AC58: 229.62962962962962 | AD58: 4
A59: GOALKICKERS | W59: RICHMOND | X59: 1 | Y59: 0 | Z59: 0 | AA59: 49 | AB59: 30 | AC59: 163.33333333333334 | AD59: 4
A60: WILLIAMSTOWN | D60: STANILAND 2 | H60: WARREN | K60: ROBERTSON
A61: FOOTSCRAY | D61: HARRIS | F61: MARTIN | H61: WILLIAMS | K61: SERBY | W61: PORT MELBOURNE | X61: 1 | Y61: 1 | Z61: 0 | AA61: 91 | AB61: 91 | AC61: 100 | AD61: 4
W62: WEST MELBOURNE | X62: 1 | Y62: 1 | Z62: 0 | AA62: 59 | AB62: 91 | AC62: 64.835164835164832 | AD62: 4
A63: PORT MELBOURNE | C63: 3 | D63: 2 | E63: =L523*6+M523 -> 0 | G63: 3 | H63: 5 | I63: =K524*6+L524 -> 0 | K63: 6 | L63: 7 | M63: =K63*6+L63 -> 43 | O63: 9 | P63: 7 | Q63: =O63*6+P63 -> 61 | S63: BRUNSWICK | W63: NORTH MELBOURNE | X63: 0 | Y63: 0 | Z63: 1 | AA63: 42 | AB63: 42 | AC63: 100 | AD63: 2
A64: BRUNSWICK | C64: 1 | D64: 1 | E64: =P523*6+Q523 -> 0 | G64: 4 | H64: 4 | I64: =O524*6+P524 -> 0 | K64: 5 | L64: 4 | M64: =K64*6+L64 -> 34 | O64: 6 | P64: 6 | Q64: =O64*6+P64 -> 42 | S64: HOLMES | W64: BRUNSWICK | X64: 0 | Y64: 2 | Z64: 0 | AA64: 75 | AB64: 126 | AC64: 59.52 | AD64: 0
A65: BEST PLAYERS | W65: PRAHRAN | X65: 0 | Y65: 2 | Z65: 0 | AA65: 42 | AB65: 119 | AC65: 35.294117647058826 | AD65: 0
A66: PORT MELBOURNE | D66: HUTCHINSON | G66: PILLAR | J66: DANIELS | L66: McGEE | N66: AYLIN | Q66: SHEEHAN
A67: BRUNSWICK | D67: JOHNSON | G67: LANDELLS | J67: LEEDS | L67: ANDREWS | N67: CLEMENTS | Q67: SHELLNACK
A68: GOALKICKERS
A69: PORT MELBOURNE | D69: HUTCHINSON 4 | G69: O'BRIEN | I69: HOUGH | K69: RYAN | M69: McGEE | O69: PILLAR
A70: BRUNSWICK | D70: LANDELLS 3 | G70: ROBINS | I70: GOWERS | K70: CROWE
A72: WEST MELBOURNE | C72: 1 | D72: 3 | E72: =C72*6+D72 -> 9 | G72: 2 | H72: 5 | I72: =G72*6+H72 -> 17 | K72: 4 | L72: 5 | M72: =K72*6+L72 -> 29 | O72: 4 | P72: 5 | Q72: =O72*6+P72 -> 29 | S72: TOORAK PARK
A73: PRAHRAN | C73: 1 | D73: 1 | E73: =C73*6+D73 -> 7 | G73: 1 | H73: 6 | I73: =G73*6+H73 -> 12 | K73: 2 | L73: 11 | M73: =K73*6+L73 -> 23 | O73: 2 | P73: 12 | Q73: =O73*6+P73 -> 24 | S73: SMITH
A74: BEST PLAYERS
A75: WEST MELBOURNE | D75: GREGORY | G75: HOWARD | J75: BATTY | L75: LAXTON | O75: ROOKE | R75: FEAVER
A76: PRAHRAN | D76: DUNN | G76: ROBERTS | J76: JAMIESON | L76: McCLUMPA | O76: REYNOLDS | R76: DUPE
A77: GOALKICKERS
A78: WEST MELBOURNE | D78: ROOKE
A79: PRAHRAN
A81: ESSENDON TOWN | C81: 2 | D81: 3 | E81: =C81*6+D81 -> 15 | G81: 4 | H81: 4 | I81: =G81*6+H81 -> 28 | K81: 5 | L81: 5 | M81: =K81*6+L81 -> 35 | O81: 6 | P81: 6 | Q81: =O81*6+P81 -> 42 | S81: NORTH MELBOURNE
A82: NTH MELB | C82: 0 | D82: 1 | E82: =C82*6+D82 -> 1 | G82: 2 | H82: 4 | I82: =G82*6+H82 -> 16 | K82: 4 | L82: 5 | M82: =K82*6+L82 -> 29 | O82: 6 | P82: 6 | Q82: =O82*6+P82 -> 42 | S82: O'LOUGHLIN
A83: BEST PLAYERS
A84: ESSENDON TOWN | D84: FORD | G84: RAMSAY | J84: GRIFFITHS | M84: DRYBURGH | P84: GORMAN | S84: TESTER
A85: NTH MELB | D85: JAMIESON | G85: QUILLIGAN | J85: MONTGOMERIE | M85: KNEE | P85: ROLENT | S85: J. SMITH
A86: GOALKICKERS
A87: ESSENDON TOWN | D87: FORD 2 | G87: BARR | I87: FEAVER | K87: PAYNE | M87: WATTS
A88: NTH MELB | D88: KNEE 2 | G88: WHITFIELD 2 | K88: ROLENT | M88: KINMAN
A90: BYE | F90: RICHMOND
A92: ROUND 3 | E92: 17TH MAY | K92: WEATHER | P92: DULL OVERCAST SHOWERS SOUTH WEST WIND
C94: 1ST QTR | G94: 2ND QTR | K94: 3RD QTR | O94: FINAL | S94: PLAYED AT | X94: LADDER | AB94: ROUND | AD94: 3
S95: N. MELBOURNE
A96: RICHMOND | C96: 1 | D96: 0 | E96: =C96*6+D96 -> 6 | G96: 3 | H96: 7 | I96: =G96*6+H96 -> 25 | K96: 4 | L96: 9 | M96: =K96*6+L96 -> 33 | O96: 6 | P96: 14 | Q96: =O96*6+P96 -> 50 | S96: UMPIRE | W96: TEAM | X96: W | Y96: L | Z96: D | AA96: FOR | AB96: AGST | AC96: % | AD96: PTS
A97: WEST MELBOURNE | C97: 0 | D97: 2 | E97: =C97*6+D97 -> 2 | G97: 0 | H97: 2 | I97: =G97*6+H97 -> 2 | K97: 2 | L97: 2 | M97: =K97*6+L97 -> 14 | O97: 2 | P97: 2 | Q97: =O97*6+P97 -> 14 | S97: TYRER
A98: BEST PLAYERS | W98: WILLIAMSTOWN | X98: 3 | Y98: 0 | Z98: 0 | AA98: 176 | AB98: 99 | AC98: 177.77777777777777 | AD98: 12
A99: RICHMOND | D99: C. BACKHOUSE | G99: GIBB | J99: WILLIAMS | L99: RICHARDSON | O99: EDMONDS | R99: DUNCAN | W99: FOOTSCRAY | X99: 2 | Y99: 1 | Z99: 0 | AA99: 250 | AB99: 68 | AC99: 367.64705882352939 | AD99: 8
A100: WEST MELBOURNE | D100: ROOKE | G100: GLOMASKI | J100: LAXTON | L100: GREGORY | O100: POOLE | R100: FEAVER | W100: RICHMOND | X100: 2 | Y100: 0 | Z100: 0 | AA100: 99 | AB100: 44 | AC100: 225 | AD100: 8
A101: GOALKICKERS | W101: PORT MELBOURNE | X101: 2 | Y101: 1 | Z101: 0 | AA101: 135 | AB101: 126 | AC101: 107.14 | AD101: 8
A102: RICHMOND | D102: DUNCAN 2 | G102: McNAIR | I102: DAVIDSON | K102: McDONALD | N102: HARDIMAN
A103: WEST MELBOURNE | D103: ROOKE | G103: WILLIAMS | W103: ESSENDON TOWN | X103: 1 | Y103: 0 | Z103: 1 | AA103: 107 | AB103: 75 | AC103: 142.66666666666666 | AD103: 6
W104: WEST MELBOURNE | X104: 1 | Y104: 2 | Z104: 0 | AA104: 73 | AB104: 141 | AC104: 51.773049645390074 | AD104: 4
A105: PORT MELBOURNE | C105: 2 | D105: 1 | E105: =C105*6+D105 -> 13 | G105: 3 | H105: 1 | I105: =G105*6+H105 -> 19 | K105: 5 | L105: 1 | M105: =K105*6+L105 -> 31 | O105: 6 | P105: 8 | Q105: =O105*6+P105 -> 44 | S105: P.M. | W105: NORTH MELBOURNE | X105: 0 | Y105: 1 | Z105: 1 | AA105: 77 | AB105: 86 | AC105: 89.534883720930239 | AD105: 2
A106: NTH MELB | C106: 0 | D106: 1 | E106: =C106*6+D106 -> 1 | G106: 2 | H106: 3 | I106: =G106*6+H106 -> 15 | K106: 4 | L106: 4 | M106: =K106*6+L106 -> 28 | O106: 5 | P106: 5 | Q106: =O106*6+P106 -> 35 | S106: WATERS | W106: PRAHRAN | X106: 0 | Y106: 3 | Z106: 0 | AA106: 77 | AB106: 192 | AC106: 40.104166666666664 | AD106: 0
A107: BEST PLAYERS | W107: BRUNSWICK | X107: 0 | Y107: 3 | Z107: 0 | AA107: 89 | AB107: 252 | AC107: 35.32 | AD107: 0
A108: PORT MELBOURNE | D108: WARD | G108: McGOWAN | J108: POLLOCK | L108: SHEEHAN | N108: BROMLEY | Q108: HARDIMAN
A109: NTH MELB | D109: JAMIESON | G109: CARLTON | J109: TORPEY | L109: NOONAN | N109: KNEE | Q109: HALL
A110: GOALKICKERS
A111: PORT MELBOURNE | D111: HUTCHINSON 3 | G111: McGOWAN | J111: CAMPBELL | M111: O'BRIEN
A112: NTH MELB | D112: MILNE 2 | G112: WHITFIELD | J112: GRAHAM | M112: KNEE
A114: FOOTSCRAY | C114: 4 | D114: 5 | E114: =C114*6+D114 -> 29 | G114: 9 | H114: 8 | I114: =G114*6+H114 -> 62 | K114: 15 | L114: 10 | M114: =K114*6+L114 -> 100 | O114: 19 | P114: 12 | Q114: =O114*6+P114 -> 126 | S114: FOOTSCRAY
A115: BRUNSWICK | C115: 0 | D115: 0 | E115: =C115*6+D115 -> 0 | G115: 1 | H115: 0 | I115: =G115*6+H115 -> 6 | K115: 1 | L115: 0 | M115: =K115*6+L115 -> 6 | O115: 2 | P115: 2 | Q115: =O115*6+P115 -> 14 | S115: ARMSTRONG
A116: BEST PLAYERS
A117: FOOTSCRAY | D117: DECOIT | G117: MARMO | J117: GROVES | M117: PYNN
A118: BRUNSWICK | D118: LEEDS | G118: JOHNSON | J118: STEVENSON | M118: CLEMENTS
A119: GOALKICKERS
A120: FOOTSCRAY | D120: DECOIT 4 | F120: MITCHELL 3 | I120: HARRIS 3 | K120: MONTGARRETT 3 | O120: W.STEPHENSON 2 | S120: WILLIAMS | V120: MARTIN | X120: GROVES | Z120: KRUSE
A121: BRUNSWICK | D121: LEEDS | G121: DAWSON
A123: WILLIAMSTOWN | C123: 1 | D123: 4 | E123: =C123*6+D123 -> 10 | G123: 6 | H123: 5 | I123: =G123*6+H123 -> 41 | K123: 7 | L123: 8 | M123: =K123*6+L123 -> 50 | O123: 10 | P123: 13 | Q123: =O123*6+P123 -> 73 | S123: WILLIAMSTOWN
A124: PRAHRAN | C124: 2 | D124: 2 | E124: =C124*6+D124 -> 14 | G124: 2 | H124: 2 | I124: =G124*6+H124 -> 14 | K124: 5 | L124: 4 | M124: =K124*6+L124 -> 34 | O124: 5 | P124: 5 | Q124: =O124*6+P124 -> 35 | S124: MURPHY
A125: BEST PLAYERS
A126: WILLIAMSTOWN | D126: VINEY | G126: WILLIAMS | J126: HEDLEY | L126: KNOX | N126: CHRISTIANSON | Q126: BARNES
A127: PRAHRAN | D127: T. BROWN | G127: REYNOLDS | J127: DUNNE | L127: JAMIESON | N127: SMITH | Q127: DUPE
A128: GOALKICKERS
A129: WILLIAMSTOWN | D129: ROBERTSON 2 | G129: STANILAND 2 | J129: HEDLEY | L129: LEGGE | N129: DICK | O129: WARREN | Q129: BARTY | S129: SPRINTHALL
A130: PRAHRAN | D130: DOWLING 2 | G130: BIRD | I130: DUPE | K130: WALSH
A132: BYE | F132: ESSENDON TOWN
A134: ROUND 4 | E134: 24TH MAY | K134: WEATHER | O134: FINE | Q134: HAZY
C136: 1ST QTR | G136: 2ND QTR | K136: 3RD QTR | O136: FINAL | S136: PLAYED AT | X136: LADDER | AB136: ROUND | AD136: 4
S137: RICHMOND
A138: RICHMOND | C138: 0 | D138: 2 | E138: =C138*6+D138 -> 2 | G138: 3 | H138: 12 | I138: =G138*6+H138 -> 30 | K138: 3 | L138: 14 | M138: =K138*6+L138 -> 32 | O138: 3 | P138: 20 | Q138: =O138*6+P138 -> 38 | S138: UMPIRE
A139: FOOTSCRAY | C139: 2 | D139: 3 | E139: =C139*6+D139 -> 15 | G139: 2 | H139: 4 | I139: =G139*6+H139 -> 16 | K139: 4 | L139: 6 | M139: =K139*6+L139 -> 30 | O139: 5 | P139: 7 | Q139: =O139*6+P139 -> 37 | S139: TYRER
A140: BEST PLAYERS | W140: WILLIAMSTOWN | X140: 3 | Y140: 0 | Z140: 0 | AA140: 176 | AB140: 99 | AC140: 177.77777777777777 | AD140: 12
A141: RICHMOND | D141: C. BACKHOUSE | G141: RICHARDSON | J141: EDMONDS | L141: WILLIAMS | N141: MANNING | Q141: J. JUSTINS | W141: RICHMOND | X141: 3 | Y141: 0 | Z141: 0 | AA141: 137 | AB141: 81 | AC141: 169.1358024691358 | AD141: 12
A142: FOOTSCRAY | D142: HINCH | G142: KRUSE | J142: WILLIAMS | L142: HARVEY | N142: SERBY | Q142: MARMO | W142: PORT MELBOURNE | X142: 3 | Y142: 1 | Z142: 0 | AA142: 168 | AB142: 155 | AC142: 108.39 | AD142: 12
A143: GOALKICKERS | W143: FOOTSCRAY | X143: 2 | Y143: 2 | Z143: 0 | AA143: 287 | AB143: 106 | AC143: 270.75471698113205 | AD143: 8
A144: RICHMOND | D144: GAULT | F144: DUNCAN | H144: DOUGLAS
A145: FOOTSCRAY | D145: STEPHENSON 2 | H145: MONTGARRET | K145: WOODS | M145: MITCHELL | W145: NORTH MELBOURNE | X145: 1 | Y145: 1 | Z145: 1 | AA145: 160 | AB145: 111 | AC145: 144.14414414414415 | AD145: 6
W146: ESSENDON TOWN | X146: 1 | Y146: 1 | Z146: 1 | AA146: 136 | AB146: 108 | AC146: 125.92592592592592 | AD146: 6
A147: PORT MELBOURNE | C147: 0 | D147: 3 | E147: =C147*6+D147 -> 3 | G147: 1 | H147: 5 | I147: =G147*6+H147 -> 11 | K147: 2 | L147: 8 | M147: =K147*6+L147 -> 20 | O147: 4 | P147: 9 | Q147: =O147*6+P147 -> 33 | S147: ESSENDON | W147: PRAHRAN | X147: 1 | Y147: 3 | Z147: 0 | AA147: 159 | AB147: 218 | AC147: 72.935779816513758 | AD147: 4
A148: ESSENDON TOWN | C148: 2 | D148: 2 | E148: =C148*6+D148 -> 14 | G148: 2 | H148: 3 | I148: =G148*6+H148 -> 15 | K148: 4 | L148: 5 | M148: =K148*6+L148 -> 29 | O148: 4 | P148: 5 | Q148: =O148*6+P148 -> 29 | S148: WATERS | W148: WEST MELBOURNE | X148: 1 | Y148: 3 | Z148: 0 | AA148: 98 | AB148: 224 | AC148: 43.75 | AD148: 4
A149: BEST PLAYERS | W149: BRUNSWICK | X149: 0 | Y149: 4 | Z149: 0 | AA149: 115 | AB149: 334 | AC149: 34.43 | AD149: 0
A150: PORT MELBOURNE | D150: BLISS | G150: HEGARTY | J150: STRAHAN | M150: McGREGOR | O150: POLLOCK | S150: BROWN
A151: ESSENDON TOWN | D151: DRYBURGH | G151: FLEMING | J151: BUSBRIDGE | M151: BROWN | O151: RAMSEY | R151: SWEATMAN
A152: GOALKICKERS
A153: PORT MELBOURNE | D153: HARDIMAN 2 | H153: HUTCHINSON | L153: WARD
A154: ESSENDON TOWN | D154: BUSBRIDGE 2 | H154: PAIN | K154: THORPE
A156: NTH MELB | C156: 1 | D156: 3 | E156: =C156*6+D156 -> 9 | G156: 4 | H156: 8 | I156: =G156*6+H156 -> 32 | K156: 8 | L156: 11 | M156: =K156*6+L156 -> 59 | O156: 11 | P156: 17 | Q156: =O156*6+P156 -> 83 | S156: NORTH MELBOURNE
A157: WEST MELBOURNE | C157: 0 | D157: 3 | E157: =C157*6+D157 -> 3 | G157: 1 | H157: 3 | I157: =G157*6+H157 -> 9 | K157: 2 | L157: 6 | M157: =K157*6+L157 -> 18 | O157: 3 | P157: 7 | Q157: =O157*6+P157 -> 25 | S157: HOLMES
A158: BEST PLAYERS
A159: NTH MELB | D159: NOONAN | G159: ROLENT | J159: KENNEDY | L159: GRAHAM | N159: HALL | Q159: BARNES
A160: WEST MELBOURNE | D160: ROOKE | G160: POOLE | J160: GREGORY | L160: LAXTON | N160: WILLIAMS | Q160: LITTLE
A161: GOALKICKERS
A162: NTH MELB | D162: KNEE 4 | F162: CONSIDINE 3 | I162: WHITFIELD | K162: MILNE | M162: GARDINER
A163: WEST MELBOURNE | D163: GOURLEY | F163: LITTLE | H163: WILLIAMS
A165: PRAHRAN | C165: 2 | D165: 1 | E165: =C165*6+D165 -> 13 | G165: 6 | H165: 3 | I165: =G165*6+H165 -> 39 | K165: 9 | L165: 4 | M165: =K165*6+L165 -> 58 | O165: 13 | P165: 4 | Q165: =O165*6+P165 -> 82 | S165: TOORAK PARK
A166: BRUNSWICK | C166: 1 | D166: 3 | E166: =C166*6+D166 -> 9 | G166: 1 | H166: 5 | I166: =G166*6+H166 -> 11 | K166: 2 | L166: 7 | M166: =K166*6+L166 -> 19 | O166: 3 | P166: 8 | Q166: =O166*6+P166 -> 26 | S166: TIPTON
A167: BEST PLAYERS
A168: PRAHRAN | D168: LYONS | G168: G .BROWN | J168: T .BROWN | M168: ROBERTS | P168: WILLISON | S168: DOWDING
A169: BRUNSWICK | D169: MULVANEY | G169: CLEMENTS | J169: STEVENSON | M169: DOWLING | P169: CASEY | S169: HEGARTY
A170: GOALKICKERS
A171: PRAHRAN | D171: DOWDING 3 | G171: LYONS 2 | I171: BIRD 2 | K171: WALSH 2 | M171: WILLISON 2 | P171: DUPE | R171: G . BROWN
A172: BRUNSWICK | D172: LANDELLS 2 | G172: JOHNSON
A174: BYE | F174: WILLIAMSTOWN
A176: ROUND 5 | E176: 31ST MAY | K176: WEATHER | P176: FINE | S176: NORTH WIND
C178: 1ST QTR | G178: 2ND QTR | K178: 3RD QTR | O178: FINAL | S178: PLAYED AT | X178: LADDER | AB178: ROUND | AD178: 5
S179: N. MELBOURNE
A180: RICHMOND | C180: 1 | D180: 1 | E180: =C180*6+D180 -> 7 | G180: 2 | H180: 5 | I180: =G180*6+H180 -> 17 | K180: 2 | L180: 5 | M180: =K180*6+L180 -> 17 | O180: 3 | P180: 7 | Q180: =O180*6+P180 -> 25 | S180: UMPIRE | W180: TEAM | X180: W | Y180: L | Z180: D | AA180: FOR | AB180: AGST | AC180: % | AD180: PTS
A181: NTH MELB | C181: 0 | D181: 0 | E181: =C181*6+D181 -> 0 | G181: 0 | H181: 0 | I181: =G181*6+H181 -> 0 | K181: 0 | L181: 6 | M181: =K181*6+L181 -> 6 | O181: 0 | P181: 7 | Q181: =O181*6+P181 -> 7 | S181: ARMSTRONG
A182: BEST PLAYERS | W182: RICHMOND | X182: 4 | Y182: 0 | Z182: 0 | AA182: 162 | AB182: 88 | AC182: 184.09 | AD182: 16
A183: RICHMOND | D183: WILLIAMS | G183: J. JUSTINS | J183: EDMONDS | M183: WATSON | O183: GIBB | R183: DUNCAN | W183: PORT MELBOURNE | X183: 4 | Y183: 1 | Z183: 0 | AA183: 234 | AB183: 169 | AC183: 138.46 | AD183: 16
A184: NTH MELB | D184: ROLENT | G184: SMITH | J184: BARNES | M184: NOONAN | O184: QUILLIGAN | R184: MILNE | W184: FOOTSCRAY | X184: 3 | Y184: 2 | Z184: 0 | AA184: 334 | AB184: 127 | AC184: 262.99212598425197 | AD184: 12
A185: GOALKICKERS | W185: WILLIAMSTOWN | X185: 3 | Y185: 1 | Z185: 0 | AA185: 216 | AB185: 147 | AC185: 146.9387755102041 | AD185: 12
A186: RICHMOND | D186: CARKEEK | G186: DOUGLAS | J186: DUNCAN
A187: NTH MELB | W187: NORTH MELBOURNE | X187: 1 | Y187: 2 | Z187: 1 | AA187: 167 | AB187: 136 | AC187: 122.79 | AD187: 6
W188: ESSENDON TOWN | X188: 1 | Y188: 2 | Z188: 1 | AA188: 157 | AB188: 155 | AC188: 101.29032258064517 | AD188: 6
A189: FOOTSCRAY | C189: 4 | D189: 2 | E189: =C189*6+D189 -> 26 | G189: 5 | H189: 2 | I189: =G189*6+H189 -> 32 | K189: 6 | L189: 5 | M189: =K189*6+L189 -> 41 | O189: 7 | P189: 5 | Q189: =O189*6+P189 -> 47 | S189: FOOTSCRAY | W189: PRAHRAN | X189: 1 | Y189: 4 | Z189: 0 | AA189: 173 | AB189: 284 | AC189: 60.91549295774648 | AD189: 4
A190: ESSENDON TOWN | C190: 0 | D190: 0 | E190: =C190*6+D190 -> 0 | G190: 0 | H190: 6 | I190: =G190*6+H190 -> 6 | K190: 1 | L190: 7 | M190: =K190*6+L190 -> 13 | O190: 2 | P190: 9 | Q190: =O190*6+P190 -> 21 | S190: MURPHY | W190: WEST MELBOURNE | X190: 1 | Y190: 3 | Z190: 0 | AA190: 98 | AB190: 224 | AC190: 43.75 | AD190: 4
A191: BEST PLAYERS | W191: BRUNSWICK | X191: 1 | Y191: 4 | Z191: 0 | AA191: 163 | AB191: 374 | AC191: 43.58 | AD191: 4
A192: FOOTSCRAY | D192: MONTGARRETT | G192: MARMO | J192: PYMM | L192: SICILY | N192: E. STEPHENSON | Q192: W. STEPHENSON
A193: ESSENDON TOWN | D193: GRIFFITHS | G193: RAMSEY | J193: FORD | L193: SWEATMAN | O193: SHELDON | Q193: GORMAN
A194: GOALKICKERS
A195: FOOTSCRAY | D195: MONTGARRETT 2 | H195: DECOIT 2 | J195: SERBY | L195: WILIAMS | N195: KRUSE
A196: ESSENDON TOWN | D196: NUMA | G196: FORD
A198: PORT MELBOURNE | C198: 1 | D198: 2 | E198: =C198*6+D198 -> 8 | G198: 4 | H198: 5 | I198: =G198*6+H198 -> 29 | K198: 5 | L198: 9 | M198: =K198*6+L198 -> 39 | O198: 8 | P198: 18 | Q198: =O198*6+P198 -> 66 | S198: P.M.
A199: PRAHRAN | C199: 0 | D199: 0 | E199: =C199*6+D199 -> 0 | G199: 0 | H199: 0 | I199: =G199*6+H199 -> 0 | K199: 2 | L199: 0 | M199: =K199*6+L199 -> 12 | O199: 2 | P199: 2 | Q199: =O199*6+P199 -> 14 | S199: TYRER
A200: BEST PLAYERS
A201: PORT MELBOURNE | D201: KEENAN | G201: HUTCHINSON | J201: WARD | L201: DANIELS | O201: PILLAR | R201: HEGARTY
A202: PRAHRAN | D202: CONQUEST | G202: DUPE | J202: LYONS | L202: G.BROWN | O202: R.SMITH | R202: ROBERTS
A203: GOALKICKERS
A204: PORT MELBOURNE | D204: HUTCHINSON 7 | H204: McGOWAN
A205: PRAHRAN | D205: LYONS | G205: JONES
A207: BRUNSWICK | C207: 0 | D207: 0 | E207: =C207*6+D207 -> 0 | G207: 3 | H207: 1 | I207: =G207*6+H207 -> 19 | K207: 3 | L207: 1 | M207: =K207*6+L207 -> 19 | O207: 7 | P207: 6 | Q207: =O207*6+P207 -> 48 | S207: BRUNSWICK
A208: WILLIAMSTOWN | C208: 1 | D208: 6 | E208: =C208*6+D208 -> 12 | G208: 1 | H208: 9 | I208: =G208*6+H208 -> 15 | K208: 3 | L208: 14 | M208: =K208*6+L208 -> 32 | O208: 4 | P208: 16 | Q208: =O208*6+P208 -> 40 | S208: TIPTON
A209: BEST PLAYERS
A210: BRUNSWICK | D210: CLEMENTS
A211: WILLIAMSTOWN
A212: GOALKICKERS
A213: BRUNSWICK | D213: CLEMENTS 5 | G213: WOODS | J213: MULVANEY
A214: WILLIAMSTOWN | D214: HEDLEY 2 | G214: GRAHAM | J214: KNOX
A216: BYE | F216: WEST MELBOURNEOURNE
A218: ROUND 6 | E218: 7TH JUNE | K218: WEATHER | O218: NORTH WIND RAIN
C220: 1ST QTR | G220: 2ND QTR | K220: 3RD QTR | O220: FINAL | S220: PLAYED AT | X220: LADDER | AB220: ROUND | AD220: 6
S221: FOOTSCRAY
A222: PORT MELBOURNE | C222: 3 | D222: 0 | E222: =C222*6+D222 -> 18 | G222: 5 | H222: 2 | I222: =G222*6+H222 -> 32 | K222: 7 | L222: 9 | M222: =K222*6+L222 -> 51 | O222: 8 | P222: 9 | Q222: =O222*6+P222 -> 57 | S222: UMPIRE | W222: TEAM | X222: W | Y222: L | Z222: D | AA222: FOR | AB222: AGST | AC222: % | AD222: PTS
A223: FOOTSCRAY | C223: 1 | D223: 1 | E223: =C223*6+D223 -> 7 | G223: 3 | H223: 3 | I223: =G223*6+H223 -> 21 | K223: 3 | L223: 3 | M223: =K223*6+L223 -> 21 | O223: 6 | P223: 4 | Q223: =O223*6+P223 -> 40 | S223: TIPTON
A224: BEST PLAYERS | W224: RICHMOND | X224: 5 | Y224: 0 | Z224: 0 | AA224: 196 | AB224: 98 | AC224: 200 | AD224: 20
A225: PORT MELBOURNE | D225: BROMLEY | G225: WARD | I225: McGEE | K225: HUTCHINSON | N225: McGOWAN | Q225: O'BRIEN | W225: PORT MELBOURNE | X225: 5 | Y225: 1 | Z225: 0 | AA225: 291 | AB225: 209 | AC225: 139.23 | AD225: 20
A226: FOOTSCRAY | D226: HINCH | G226: KRUSE | I226: SERBY | K226: HARRIS | N226: E. STEPHENSON | Q226: W. STEPHENSON | W226: FOOTSCRAY | X226: 3 | Y226: 3 | Z226: 0 | AA226: 374 | AB226: 184 | AC226: 203.2608695652174 | AD226: 12
A227: GOALKICKERS | W227: WILLIAMSTOWN | X227: 3 | Y227: 2 | Z227: 0 | AA227: 242 | AB227: 183 | AC227: 132.24043715846994 | AD227: 12
A228: PORT MELBOURNE | D228: HUTCHINSON 3 | G228: McGOWAN 2 | J228: McGEE | L228: SMITHERS | O228: O'BRIEN
A229: FOOTSCRAY | D229: MITCHELL 2 | G229: HARRIS | J229: DECOIT | L229: MARMO | N229: MONTGARRETT | W229: NORTH MELBOURNE | X229: 2 | Y229: 2 | Z229: 1 | AA229: 203 | AB229: 162 | AC229: 125.31 | AD229: 10
W230: WEST MELBOURNE | X230: 2 | Y230: 3 | Z230: 0 | AA230: 125 | AB230: 240 | AC230: 52.083333333333336 | AD230: 8
A231: NTH MELB | C231: 0 | D231: 0 | E231: =C231*6+D231 -> 0 | G231: 2 | H231: 1 | I231: =G231*6+H231 -> 13 | K231: 3 | L231: 7 | M231: =K231*6+L231 -> 25 | O231: 5 | P231: 6 | Q231: =O231*6+P231 -> 36 | S231: WILLIAMSTOWN | W231: ESSENDON TOWN | X231: 1 | Y231: 3 | Z231: 1 | AA231: 167 | AB231: 189 | AC231: 88.359788359788354 | AD231: 6
A232: WILLIAMSTOWN | C232: 0 | D232: 1 | E232: =C232*6+D232 -> 1 | G232: 0 | H232: 2 | I232: =G232*6+H232 -> 2 | K232: 2 | L232: 2 | M232: =K232*6+L232 -> 14 | O232: 3 | P232: 8 | Q232: =O232*6+P232 -> 26 | S232: WATERS | W232: PRAHRAN | X232: 1 | Y232: 4 | Z232: 0 | AA232: 173 | AB232: 284 | AC232: 60.91549295774648 | AD232: 4
A233: BEST PLAYERS | W233: BRUNSWICK | X233: 1 | Y233: 5 | Z233: 0 | AA233: 179 | AB233: 401 | AC233: 44.64 | AD233: 4
A234: NTH MELB | D234: QUILLIGAN | G234: CONSIDINE | J234: BARNES | L234: JAMIESON | O234: NOONAN | R234: J. SMITH
A235: WILLIAMSTOWN | D235: HEDLEY | G235: HOUGHTON | J235: WARREN | L235: SPRINTHALL | O235: BREMNER | R235: KNOX
A236: GOALKICKERS
A237: NTH MELB | D237: WHITFIELD 2 | G237: CONSIDINE | J237: BOYLE | L237: KNEE
A238: WILLIAMSTOWN | D238: WARREN | G238: HEALEY | J238: KNOX
A240: RICHMOND | C240: 0 | D240: 2 | E240: =C240*6+D240 -> 2 | G240: 1 | H240: 5 | I240: =G240*6+H240 -> 11 | K240: 3 | L240: 5 | M240: =K240*6+L240 -> 23 | O240: 4 | P240: 10 | Q240: =O240*6+P240 -> 34 | S240: ESSENDON
A241: ESSENDON TOWN | C241: 1 | D241: 2 | E241: =C241*6+D241 -> 8 | G241: 1 | H241: 4 | I241: =G241*6+H241 -> 10 | K241: 1 | L241: 4 | M241: =K241*6+L241 -> 10 | O241: 1 | P241: 4 | Q241: =O241*6+P241 -> 10 | S241: TYRER
A242: BEST PLAYERS
A243: RICHMOND | D243: CARKEEK | G243: TAYLOR | J243: MANNING | M243: E. JUSTINS | P243: J. JUSTINS | S243: BOWNAS
A244: ESSENDON TOWN | D244: BUSBRIDGE | G244: CHARLES | J244: WILLIAMSON | M244: GRIFFITHS | P244: FORD | S244: GENT
A245: GOALKICKERS
A246: RICHMOND | D246: DUNCAN 2 | G246: PIRRIE | J246: DAVIDSON
A247: ESSENDON TOWN | D247: GENT
A249: WEST MELBOURNE | C249: 1 | D249: 2 | E249: =C249*6+D249 -> 8 | G249: 2 | H249: 3 | I249: =G249*6+H249 -> 15 | K249: 2 | L249: 5 | M249: =K249*6+L249 -> 17 | O249: 3 | P249: 9 | Q249: =O249*6+P249 -> 27 | S249: NORTH MELBOURNE
A250: BRUNSWICK | C250: 0 | D250: 2 | E250: =C250*6+D250 -> 2 | G250: 1 | H250: 3 | I250: =G250*6+H250 -> 9 | K250: 1 | L250: 3 | M250: =K250*6+L250 -> 9 | O250: 2 | P250: 4 | Q250: =O250*6+P250 -> 16 | S250: OWENS
A251: BEST PLAYERS
A252: WEST MELBOURNE
A253: BRUNSWICK
A254: GOALKICKERS
A255: WEST MELBOURNE | D255: WILLIAMS | G255: KENNEDY | J255: GREGORY
A256: BRUNSWICK | D256: HENLEY | G256: LANDELLS
A258: BYE | F258: PRAHRAN
A260: ROUND 7 | E260: 14TH JUNE | K260: WEATHER | O260: NORTH WIND LATE RAIN
C262: 1ST QTR | G262: 2ND QTR | K262: 3RD QTR | O262: FINAL | S262: PLAYED AT | X262: LADDER | AB262: ROUND | AD262: 7
S263: RICHMOND
A264: RICHMOND | C264: 1 | D264: 2 | E264: =C264*6+D264 -> 8 | G264: 2 | H264: 6 | I264: =G264*6+H264 -> 18 | K264: 4 | L264: 10 | M264: =K264*6+L264 -> 34 | O264: 5 | P264: 13 | Q264: =O264*6+P264 -> 43 | S264: UMPIRE | W264: TEAM | X264: W | Y264: L | Z264: D | AA264: FOR | AB264: AGST | AC264: % | AD264: PTS
A265: WILLIAMSTOWN | C265: 2 | D265: 3 | E265: =C265*6+D265 -> 15 | G265: 3 | H265: 5 | I265: =G265*6+H265 -> 23 | K265: 3 | L265: 7 | M265: =K265*6+L265 -> 25 | O265: 4 | P265: 7 | Q265: =O265*6+P265 -> 31 | S265: MURPHY
A266: BEST PLAYERS | W266: RICHMOND | X266: 6 | Y266: 0 | Z266: 0 | AA266: 239 | AB266: 119 | AC266: 200.84 | AD266: 24
A267: RICHMOND | D267: MANNING | G267: E. JUSTINS | J267: EDMONDS | L267: WILLIAMS | O267: GIBBS | R267: RICHARDSON | W267: PORT MELBOURNE | X267: 6 | Y267: 1 | Z267: 0 | AA267: 331 | AB267: 236 | AC267: 140.25 | AD267: 24
A268: WILLIAMSTOWN | D268: SPRINTHALL | G268: BREMNER | J268: VINEY | L268: KNOX | O268: CALDWELL | R268: McKINLEY | W268: NORTH MELBOURNE | X268: 3 | Y268: 2 | Z268: 1 | AA268: 239 | AB268: 196 | AC268: 121.94 | AD268: 14
A269: GOALKICKERS | W269: FOOTSCRAY | X269: 3 | Y269: 4 | Z269: 0 | AA269: 408 | AB269: 220 | AC269: 185.45454545454547 | AD269: 12
A270: RICHMOND | D270: McDONALD | G270: CARKEEK | J270: RUDD | L270: DAVIDSON | O270: GAULT
A271: WILLIAMSTOWN | D271: STANILAND 2 | G271: ROBERTSON | J271: KNOX | W271: WILLIAMSTOWN | X271: 3 | Y271: 3 | Z271: 0 | AA271: 263 | AB271: 226 | AC271: 116.3716814159292 | AD271: 12
W272: ESSENDON TOWN | X272: 2 | Y272: 3 | Z272: 1 | AA272: 226 | AB272: 239 | AC272: 94.560669456066947 | AD272: 10
A273: NTH MELB | C273: 3 | D273: 4 | E273: =C273*6+D273 -> 22 | G273: 4 | H273: 5 | I273: =G273*6+H273 -> 29 | K273: 5 | L273: 6 | M273: =K273*6+L273 -> 36 | O273: 5 | P273: 6 | Q273: =O273*6+P273 -> 36 | S273: N. MELBOURNE | W273: WEST MELBOURNE | X273: 2 | Y273: 4 | Z273: 0 | AA273: 152 | AB273: 280 | AC273: 54.285714285714285 | AD273: 8
A274: FOOTSCRAY | C274: 0 | D274: 0 | E274: =C274*6+D274 -> 0 | G274: 2 | H274: 1 | I274: =G274*6+H274 -> 13 | K274: 2 | L274: 4 | M274: =K274*6+L274 -> 16 | O274: 5 | P274: 4 | Q274: =O274*6+P274 -> 34 | S274: WATERS | W274: PRAHRAN | X274: 1 | Y274: 5 | Z274: 0 | AA274: 223 | AB274: 343 | AC274: 65.014577259475217 | AD274: 4
A275: BEST PLAYERS | W275: BRUNSWICK | X275: 1 | Y275: 5 | Z275: 0 | AA275: 179 | AB275: 401 | AC275: 44.64 | AD275: 4
A276: NTH MELB | D276: LONERGREN | G276: CARLTON | J276: JAMIESON | M276: BARNES | O276: MORAN | R276: GRAHAM
A277: FOOTSCRAY | D277: MARMO | G277: MONTGARRETT | J277: GROVES | M277: DECOIT | O277: HINCH | R277: KRUSE
A278: GOALKICKERS
A279: NTH MELB | D279: GARDINER | G279: KENNEDY | J279: WHITFIELD | M279: KNEE | O279: CONSIDINE
A280: FOOTSCRAY | D280: DECOIT 3 | G280: MONTGARRETT | K280: WOODS
A282: PORT MELBOURNE | C282: 1 | D282: 3 | E282: =C282*6+D282 -> 9 | G282: 3 | H282: 4 | I282: =G282*6+H282 -> 22 | K282: 5 | L282: 6 | M282: =K282*6+L282 -> 36 | O282: 5 | P282: 10 | Q282: =O282*6+P282 -> 40 | S282: P.M.
A283: WEST MELBOURNE | C283: 0 | D283: 0 | E283: =C283*6+D283 -> 0 | G283: 3 | H283: 0 | I283: =G283*6+H283 -> 18 | K283: 3 | L283: 0 | M283: =K283*6+L283 -> 18 | O283: 4 | P283: 3 | Q283: =O283*6+P283 -> 27 | S283: ARMSRTONG
A284: BEST PLAYERS
A285: PORT MELBOURNE | D285: HEGARTY | G285: AYLIN | J285: T. WARD | L285: BROMLEY | O285: SHEEHAN | R285: PILLAR
A286: WEST MELBOURNE | D286: ROOKE | G286: HOOPER | J286: POOLE | L286: D. GREGORY | O286: WILLIAMS | R286: MADDEN
A287: GOALKICKERS
A288: PORT MELBOURNE | D288: HUTCHINSON 3 | H288: HARDIMAN | K288: O'BRIEN
A289: WEST MELBOURNE | D289: RYAN | F289: MCVEE | I289: WILLIAMS | L289: FOX
A291: ESSENDON TOWN | C291: 1 | D291: 2 | E291: =C291*6+D291 -> 8 | G291: 3 | H291: 9 | I291: =G291*6+H291 -> 27 | K291: 6 | L291: 10 | M291: =K291*6+L291 -> 46 | O291: 8 | P291: 11 | Q291: =O291*6+P291 -> 59 | S291: TOORAK PARK
A292: PRAHRAN | C292: 3 | D292: 3 | E292: =C292*6+D292 -> 21 | G292: 5 | H292: 4 | I292: =G292*6+H292 -> 34 | K292: 6 | L292: 4 | M292: =K292*6+L292 -> 40 | O292: 7 | P292: 8 | Q292: =O292*6+P292 -> 50 | S292: HOLMES
A293: BEST PLAYERS
A294: ESSENDON TOWN | D294: GENT | G294: FORD | I294: CAREY | K294: GIRDWOOD | N294: NIXON | P294: GEARY
A295: PRAHRAN | D295: LYONS | G295: PARKER | I295: DOWDING | K295: CONQUEST | N295: SMITH | P295: HORNIDGE
A296: GOALKICKERS
A297: ESSENDON TOWN | D297: CAREY 2 | G297: WATTS 2 | J297: PAIN | K297: HARRIS | M297: GENT | O297: NUMA
A298: PRAHRAN | D298: SMITH 2 | G298: BROWN | J298: DOWLING | M298: DUPE | O298: HORNIDGE
A300: BYE | F300: BRUNSWICK
A302: ROUND 8 | E302: 21ST JUNE | K302: WEATHER | O302: STRONG WEST WIND SHOWERS
C304: 1ST QTR | G304: 2ND QTR | K304: 3RD QTR | O304: FINAL | S304: PLAYED AT | X304: LADDER | AB304: ROUND | AD304: 8
S305: WILLIAMSTOWN
A306: WILLIAMSTOWN | C306: 0 | D306: 1 | E306: =C306*6+D306 -> 1 | G306: 3 | H306: 10 | I306: =G306*6+H306 -> 28 | K306: 4 | L306: 11 | M306: =K306*6+L306 -> 35 | O306: 5 | P306: 16 | Q306: =O306*6+P306 -> 46 | S306: UMPIRE | W306: TEAM | X306: W | Y306: L | Z306: D | AA306: FOR | AB306: AGST | AC306: % | AD306: PTS
A307: ESSENDON TOWN | C307: 3 | D307: 5 | E307: =C307*6+D307 -> 23 | G307: 3 | H307: 5 | I307: =G307*6+H307 -> 23 | K307: 5 | L307: 6 | M307: =K307*6+L307 -> 36 | O307: 5 | P307: 7 | Q307: =O307*6+P307 -> 37 | S307: TYRER
A308: BEST PLAYERS | W308: RICHMOND | X308: 7 | Y308: 0 | Z308: 0 | AA308: 282 | AB308: 145 | AC308: 194.48 | AD308: 28
A309: WILLIAMSTOWN | D309: KNOX | F309: SPRINTHALL | I309: CALDWELL | K309: LEGGE | N309: BARLING | Q309: McKINLEY | W309: PORT MELBOURNE | X309: 6 | Y309: 1 | Z309: 0 | AA309: 331 | AB309: 236 | AC309: 140.25 | AD309: 24
A310: ESSENDON TOWN | D310: FORD | F310: GEARING | I310: SHELDON | K310: SWEATMAN | N310: CHARLES | Q310: NUMA | W310: NORTH MELBOURNE | X310: 4 | Y310: 2 | Z310: 1 | AA310: 285 | AB310: 227 | AC310: 125.55 | AD310: 18
A311: GOALKICKERS | W311: FOOTSCRAY | X311: 4 | Y311: 4 | Z311: 0 | AA311: 440 | AB311: 249 | AC311: 176.70682730923696 | AD311: 16
A312: WILLIAMSTOWN | D312: KNOX | F312: STANILAND | I312: LEGGE | K312: CALDWELL | N312: MANDERSON
A313: ESSENDON TOWN | D313: GENT 2 | F313: GRAHAM | I313: PAIN | K313: JAMES | W313: WILLIAMSTOWN | X313: 4 | Y313: 3 | Z313: 0 | AA313: 309 | AB313: 263 | AC313: 117.49049429657795 | AD313: 16
W314: ESSENDON TOWN | X314: 2 | Y314: 4 | Z314: 1 | AA314: 263 | AB314: 285 | AC314: 92.280701754385959 | AD314: 10
A315: FOOTSCRAY | C315: 0 | D315: 1 | E315: =C315*6+D315 -> 1 | G315: 2 | H315: 1 | I315: =G315*6+H315 -> 13 | K315: 3 | L315: 5 | M315: =K315*6+L315 -> 23 | O315: 4 | P315: 8 | Q315: =O315*6+P315 -> 32 | S315: N. MELBOURNE | W315: WEST MELBOURNE | X315: 2 | Y315: 5 | Z315: 0 | AA315: 181 | AB315: 312 | AC315: 58.012820512820511 | AD315: 8
A316: WEST MELBOURNE | C316: 2 | D316: 5 | E316: =C316*6+D316 -> 17 | G316: 3 | H316: 5 | I316: =G316*6+H316 -> 23 | K316: 4 | L316: 5 | M316: =K316*6+L316 -> 29 | O316: 4 | P316: 5 | Q316: =O316*6+P316 -> 29 | S316: HOLMES | W316: PRAHRAN | X316: 1 | Y316: 6 | Z316: 0 | AA316: 254 | AB316: 389 | AC316: 65.295629820051417 | AD316: 4
A317: BEST PLAYERS | W317: BRUNSWICK | X317: 1 | Y317: 6 | Z317: 0 | AA317: 205 | AB317: 444 | AC317: 46.17 | AD317: 4
A318: FOOTSCRAY | D318: MONTGARRETT | G318: MARMO | J318: HARRIS | L318: PYMM | N318: MITCHELL | P318: E. STEPHENSON
A319: WEST MELBOURNE | D319: D. GREGORY | G319: KENNEDY | J319: BATTY | L319: H. LAXTON | N319: HOOPER | P319: H. GREGORY
A320: GOALKICKERS
A321: FOOTSCRAY | D321: HARRIS | G321: DECOIT | I321: SERBY | K321: MITCHELL
A322: WEST MELBOURNE | D322: WILLIAMS | G322: RYAN | I322: FOX | K322: McBETH
A324: NTH MELB | C324: 3 | D324: 3 | E324: =C324*6+D324 -> 21 | G324: 5 | H324: 7 | I324: =G324*6+H324 -> 37 | K324: 5 | L324: 9 | M324: =K324*6+L324 -> 39 | O324: 6 | P324: 10 | Q324: =O324*6+P324 -> 46 | S324: TOORAK PARK
A325: PRAHRAN | C325: 2 | D325: 2 | E325: =C325*6+D325 -> 14 | G325: 3 | H325: 3 | I325: =G325*6+H325 -> 21 | K325: 4 | L325: 4 | M325: =K325*6+L325 -> 28 | O325: 4 | P325: 7 | Q325: =O325*6+P325 -> 31 | S325: TIPTON
A326: BEST PLAYERS
A327: NTH MELB | D327: CONSIDINE | G327: MORRISON | J327: WHITFIELD | M327: MILNE | O327: JAMIESON | R327: GRAHAM
A328: PRAHRAN | D328: ROBERTS | G328: WESTBROOK | J328: G. BROWN | M328: SMITH | O328: DUPE | R328: T. BROWN
A329: GOALKICKERS
A330: NTH MELB | D330: WHITFIELD 2 | G330: KINMAN 2 | J330: MILNE | L330: CONSIDINE
A331: PRAHRAN | D331: CROFT | F331: JONES | H331: BIRD | J331: DOWLING
A333: RICHMOND | C333: 2 | D333: 6 | E333: =C333*6+D333 -> 18 | G333: 2 | H333: 8 | I333: =G333*6+H333 -> 20 | K333: 4 | L333: 10 | M333: =K333*6+L333 -> 34 | O333: 5 | P333: 13 | Q333: =O333*6+P333 -> 43 | S333: BRUNSWICK
A334: BRUNSWICK | C334: 1 | D334: 1 | E334: =C334*6+D334 -> 7 | G334: 3 | H334: 2 | I334: =G334*6+H334 -> 20 | K334: 3 | L334: 2 | M334: =K334*6+L334 -> 20 | O334: 4 | P334: 2 | Q334: =O334*6+P334 -> 26 | S334: WATERS
A335: BEST PLAYERS
A336: RICHMOND
A337: BRUNSWICK
A338: GOALKICKERS
A339: RICHMOND | D339: DAVIDSON 4 | H339: TAYLOR
A340: BRUNSWICK | D340: CASEY 3 | G340: LANDELLS
A342: BYE | F342: PORT MELBOURNE
A344: ROUND 9 | E344: 28TH JUNE | K344: WEATHER | O344: NORTH WIND CLOUDY
C346: 1ST QTR | G346: 2ND QTR | K346: 3RD QTR | O346: FINAL | S346: PLAYED AT | X346: LADDER | AB346: ROUND | AD346: 9
S347: P.M.
A348: PORT MELBOURNE | C348: 0 | D348: 5 | E348: =C348*6+D348 -> 5 | G348: 0 | H348: 10 | I348: =G348*6+H348 -> 10 | K348: 4 | L348: 11 | M348: =K348*6+L348 -> 35 | O348: 6 | P348: 13 | Q348: =O348*6+P348 -> 49 | S348: UMPIRE | W348: TEAM | X348: W | Y348: L | Z348: D | AA348: FOR | AB348: AGST | AC348: % | AD348: PTS
A349: WILLIAMSTOWN | C349: 1 | D349: 0 | E349: =C349*6+D349 -> 6 | G349: 2 | H349: 1 | I349: =G349*6+H349 -> 13 | K349: 3 | L349: 2 | M349: =K349*6+L349 -> 20 | O349: 3 | P349: 2 | Q349: =O349*6+P349 -> 20 | S349: WATERS
A350: BEST PLAYERS | W350: RICHMOND | X350: 8 | Y350: 0 | Z350: 0 | AA350: 376 | AB350: 187 | AC350: 201.07 | AD350: 32
A351: PORT MELBOURNE | D351: JOHNSON | F351: SHEEHAN | I351: GOTZ | L351: McGEE | N351: J. WARD | Q351: DANIELLS | W351: PORT MELBOURNE | X351: 7 | Y351: 1 | Z351: 0 | AA351: 380 | AB351: 256 | AC351: 148.44 | AD351: 28
A352: WILLIAMSTOWN | D352: KNOX | F352: CALDWELL | I352: MANDERSON | L352: BARLING | N352: LEGGE | Q352: HOUGHTON | W352: NORTH MELBOURNE | X352: 5 | Y352: 2 | Z352: 1 | AA352: 349 | AB352: 257 | AC352: 135.8 | AD352: 22
A353: GOALKICKERS | W353: FOOTSCRAY | X353: 4 | Y353: 4 | Z353: 0 | AA353: 440 | AB353: 249 | AC353: 176.70682730923696 | AD353: 16
A354: PORT MELBOURNE | D354: HUTCHINSON 3 | G354: McGEE | I354: HARDIMAN | L354: SMITHERS
A355: WILLIAMSTOWN | D355: STANILANDS | G355: WISE | I355: MANDERSON | W355: WILLIAMSTOWN | X355: 4 | Y355: 4 | Z355: 0 | AA355: 329 | AB355: 312 | AC355: 105.44871794871794 | AD355: 16
W356: ESSENDON TOWN | X356: 3 | Y356: 4 | Z356: 1 | AA356: 299 | AB356: 318 | AC356: 94.025157232704402 | AD356: 14
A357: ESSENDON TOWN | C357: 0 | D357: 0 | E357: =C357*6+D357 -> 0 | G357: 1 | H357: 3 | I357: =G357*6+H357 -> 9 | K357: 4 | L357: 6 | M357: =K357*6+L357 -> 30 | O357: 5 | P357: 6 | Q357: =O357*6+P357 -> 36 | S357: ESSENDON | W357: WEST MELBOURNE | X357: 2 | Y357: 6 | Z357: 0 | AA357: 214 | AB357: 348 | AC357: 61.494252873563219 | AD357: 8
A358: WEST MELBOURNE | C358: 2 | D358: 1 | E358: =C358*6+D358 -> 13 | G358: 3 | H358: 2 | I358: =G358*6+H358 -> 20 | K358: 3 | L358: 8 | M358: =K358*6+L358 -> 26 | O358: 4 | P358: 9 | Q358: =O358*6+P358 -> 33 | S358: TIPTON | W358: PRAHRAN | X358: 1 | Y358: 7 | Z358: 0 | AA358: 296 | AB358: 483 | AC358: 61.283643892339548 | AD358: 4
A359: BEST PLAYERS | W359: BRUNSWICK | X359: 1 | Y359: 7 | Z359: 0 | AA359: 235 | AB359: 508 | AC359: 46.26 | AD359: 4
A360: ESSENDON TOWN | D360: GENT | F360: GIRDWOOD | I360: GEARING | L360: NUMA | N360: SHELDON | Q360: NIXON
A361: WEST MELBOURNE | D361: POOLE | F361: McVEE | I361: H. LAXTON | L361: FOX | N361: WILLIAMS | Q361: HOGAN
A362: GOALKICKERS
A363: ESSENDON TOWN | D363: GENT 3 | G363: CAREY | I363: BUSBRIDGE
A364: WEST MELBOURNE | D364: F. GREGORY | G364: WILLIAMS | J364: ROOKE | L364: H .GREGORY
A366: NTH MELB | C366: 5 | D366: 1 | E366: =C366*6+D366 -> 31 | G366: 6 | H366: 2 | I366: =G366*6+H366 -> 38 | K366: 6 | L366: 5 | M366: =K366*6+L366 -> 41 | O366: 9 | P366: 10 | Q366: =O366*6+P366 -> 64 | S366: BRUNSWICK
A367: BRUNSWICK | C367: 1 | D367: 0 | E367: =C367*6+D367 -> 6 | G367: 2 | H367: 4 | I367: =G367*6+H367 -> 16 | K367: 3 | L367: 4 | M367: =K367*6+L367 -> 22 | O367: 4 | P367: 6 | Q367: =O367*6+P367 -> 30 | S367: TYRER
A368: BEST PLAYERS
A369: NTH MELB | D369: BARNES | G369: HALL | I369: NOONAN | L369: LONDERIGON | O369: CARLTON | R369: CONSIDINE
A370: BRUNSWICK | D370: CLEMENTS | G370: LEEDS | I370: SMITH | L370: CROWW | O370: HENLEY | R370: CASEY
A371: GOALKICKERS
A372: NTH MELB | D372: ENGLISH 4 | G372: KNEE 2 | J372: BOYLE | L372: KENNEDY | O372: SMITH
A373: BRUNSWICK | D373: GOWERS | G373: McHALE | J373: MULVANEY | M373: CLEMENTS
A375: RICHMOND | C375: 5 | D375: 5 | E375: =C375*6+D375 -> 35 | G375: 5 | H375: 6 | I375: =G375*6+H375 -> 36 | K375: 10 | L375: 10 | M375: =K375*6+L375 -> 70 | O375: 13 | P375: 16 | Q375: =O375*6+P375 -> 94 | S375: RICHMOND
A376: PRAHRAN | C376: 1 | D376: 1 | E376: =C376*6+D376 -> 7 | G376: 4 | H376: 5 | I376: =G376*6+H376 -> 29 | K376: 4 | L376: 5 | M376: =K376*6+L376 -> 29 | O376: 6 | P376: 6 | Q376: =O376*6+P376 -> 42 | S376: HOLMES
A377: BEST PLAYERS
A378: RICHMOND | D378: CARKEEK | G378: McCANCE | J378: WILLIAMS | M378: E. JUSTINS | P378: J. JUSTINS | S378: MAINE
A379: PRAHRAN | D379: DOWDING | G379: PONTIN | J379: ROBERTS | M379: SHAW | P379: DUPE | S379: LYONS
A380: GOALKICKERS
A381: RICHMOND | D381: DUNCAN 2 | G381: PIRRIE 2 | I381: DAVIDSON 2 | L381: CARKEEK 2 | O381: GAULT 2 | Q381: McDONALD | T381: BACKHOUSE
A382: PRAHRAN | D382: CROFT | F382: LYONS | H382: SMIYH | J382: SHAW | L382: DOWDING | O382: DUPE
A384: BYE | F384: FOOTSCRAY
A386: ROUND 10 | E386: 5TH JULY | K386: WEATHER | O386: NORTH WEST WIND CLOUDY
C388: 1ST QTR | G388: 2ND QTR | K388: 3RD QTR | O388: FINAL | S388: PLAYED AT | X388: LADDER | AB388: ROUND | AD388: 10
S389: P.M.
A390: PORT MELBOURNE | C390: 1 | D390: 3 | E390: =C390*6+D390 -> 9 | G390: 1 | H390: 3 | I390: =G390*6+H390 -> 9 | K390: 3 | L390: 4 | M390: =K390*6+L390 -> 22 | O390: 3 | P390: 4 | Q390: =O390*6+P390 -> 22 | S390: UMPIRE | W390: TEAM | X390: W | Y390: L | Z390: D | AA390: FOR | AB390: AGST | AC390: % | AD390: PTS
A391: RICHMOND | C391: 0 | D391: 1 | E391: =C391*6+D391 -> 1 | G391: 1 | H391: 3 | I391: =G391*6+H391 -> 9 | K391: 1 | L391: 4 | M391: =K391*6+L391 -> 10 | O391: 1 | P391: 8 | Q391: =O391*6+P391 -> 14 | S391: TYRER
A392: BEST PLAYERS | W392: RICHMOND | X392: 8 | Y392: 1 | Z392: 0 | AA392: 390 | AB392: 209 | AC392: 186.6 | AD392: 32
A393: PORT MELBOURNE | D393: F. WARD | G393: KEENAN | I393: JOHNSON | L393: GARBUTT | N393: HUTCHINSON | Q393: AYLIN | W393: PORT MELBOURNE | X393: 8 | Y393: 1 | Z393: 0 | AA393: 402 | AB393: 270 | AC393: 148.89 | AD393: 32
A394: RICHMOND | D394: CARKEEK | G394: McNAIR | I394: C. BACKHOUSE | L394: PIRRIE | N394: E. JUSTINS | Q394: J. JUSTINS | W394: NORTH MELBOURNE | X394: 5 | Y394: 2 | Z394: 1 | AA394: 349 | AB394: 257 | AC394: 135.8 | AD394: 22
A395: GOALKICKERS | W395: FOOTSCRAY | X395: 5 | Y395: 4 | Z395: 0 | AA395: 503 | AB395: 295 | AC395: 170.5084745762712 | AD395: 20
A396: PORT MELBOURNE | D396: HUTCHINSON 3
A397: RICHMOND | D397: GAULT | W397: WILLIAMSTOWN | X397: 5 | Y397: 4 | Z397: 0 | AA397: 388 | AB397: 328 | AC397: 118.29268292682927 | AD397: 20
W398: ESSENDON TOWN | X398: 4 | Y398: 4 | Z398: 1 | AA398: 333 | AB398: 351 | AC398: 94.871794871794876 | AD398: 18
A399: WILLIAMSTOWN | C399: 1 | D399: 2 | E399: =C399*6+D399 -> 8 | G399: 2 | H399: 10 | I399: =G399*6+H399 -> 22 | K399: 4 | L399: 12 | M399: =K399*6+L399 -> 36 | O399: 7 | P399: 17 | Q399: =O399*6+P399 -> 59 | S399: WILLIAMSTOWN | W399: WEST MELBOURNE | X399: 2 | Y399: 7 | Z399: 0 | AA399: 230 | AB399: 407 | AC399: 56.511056511056509 | AD399: 8
A400: WEST MELBOURNE | C400: 1 | D400: 3 | E400: =C400*6+D400 -> 9 | G400: 1 | H400: 3 | I400: =G400*6+H400 -> 9 | K400: 1 | L400: 3 | M400: =K400*6+L400 -> 9 | O400: 2 | P400: 4 | Q400: =O400*6+P400 -> 16 | S400: HOLMES | W400: PRAHRAN | X400: 1 | Y400: 8 | Z400: 0 | AA400: 342 | AB400: 546 | AC400: 62.637362637362635 | AD400: 4
A401: BEST PLAYERS | W401: BRUNSWICK | X401: 1 | Y401: 8 | Z401: 0 | AA401: 268 | AB401: 542 | AC401: 49.45 | AD401: 4
A402: WILLIAMSTOWN | D402: LEGGE | F402: BARTY | I402: McKINLEY | L402: HOUGHTON | O402: DICK | Q402: BREMNER
A403: WEST MELBOURNE | D403: BATTY | F403: HOOPER | I403: McVEE | L403: POOLE | O403: GREGORY | Q403: WILLIAMS
A404: GOALKICKERS
A405: WILLIAMSTOWN | D405: LEGGE 2 | F405: BARTY 2 | H405: McSHANE | J405: ROBINSON | L405: WILTSHIRE
A406: WEST MELBOURNE | D406: FOX | F406: WILLIAMS
A408: ESSENDON TOWN | C408: 0 | D408: 5 | E408: =C408*6+D408 -> 5 | G408: 1 | H408: 8 | I408: =G408*6+H408 -> 14 | K408: 3 | L408: 10 | M408: =K408*6+L408 -> 28 | O408: 4 | P408: 10 | Q408: =O408*6+P408 -> 34 | S408: BRUNSWICK
A409: BRUNSWICK | C409: 3 | D409: 0 | E409: =C409*6+D409 -> 18 | G409: 3 | H409: 0 | I409: =G409*6+H409 -> 18 | K409: 4 | L409: 1 | M409: =K409*6+L409 -> 25 | O409: 5 | P409: 3 | Q409: =O409*6+P409 -> 33 | S409: TIPTON
A410: BEST PLAYERS
A411: ESSENDON TOWN | D411: SHELDON | G411: RAMSEY | J411: SWEATMAN | M411: TESTER | P411: CHARLES | S411: FLEMING
A412: BRUNSWICK | D412: SHELLNACK | G412: JOHNSON | J412: LEEDS | M412: CLEMENTS | P412: COBURN | S412: LANDELLS
A413: GOALKICKERS
A414: ESSENDON TOWN | D414: HUGHES 2 | G414: CAREY | J414: NICOLL
A415: BRUNSWICK | D415: LEEDS 2 | G415: LANDELLS | J415: MULVANEY | M415: R. CASEY
A417: FOOTSCRAY | C417: 2 | D417: 4 | E417: =C417*6+D417 -> 16 | G417: 5 | H417: 7 | I417: =G417*6+H417 -> 37 | K417: 7 | L417: 9 | M417: =K417*6+L417 -> 51 | O417: 9 | P417: 9 | Q417: =O417*6+P417 -> 63 | S417: TOORAK PARK
A418: PRAHRAN | C418: 2 | D418: 0 | E418: =C418*6+D418 -> 12 | G418: 2 | H418: 0 | I418: =G418*6+H418 -> 12 | K418: 5 | L418: 2 | M418: =K418*6+L418 -> 32 | O418: 7 | P418: 4 | Q418: =O418*6+P418 -> 46 | S418: WATERS
A419: BEST PLAYERS
A420: FOOTSCRAY | D420: SERBY | G420: HARRIS | J420: SWANNELL | M420: PYMM | O420: E. STEPHENSON | R420: DECOIT
A421: PRAHRAN | D421: ROBERTS | G421: T. BROWN | J421: TRUSCOTT | M421: PONTIN | O421: DOWDING | R421: CONQUEST
A422: GOALKICKERS
A423: FOOTSCRAY | D423: DECOIT 2 | G423: MONTGARRETT | J423: SERBY | L423: STEPHENSON | O423: DUNCAN | Q423: CAIRNS | S423: PYMM | U423: MITCHELL
A424: PRAHRAN | D424: G. BROWN 4 | G424: CROFT | J424: DOWLING | L424: CONQUEST
A426: BYE | F426: NORTH MELBOURNEOURNE
A428: ROUND 11 | E428: 12TH JULY | J428: WEATHER | N428: SOUTH EAST BREEZE FINE BUT FOGGY
D430: 1ST QTR | H430: 2ND QTR | L430: 3RD QTR | P430: FINAL | S430: PLAYED AT | X430: LADDER | AB430: ROUND | AD430: 11
S431: FOOTSCRAY
A432: FOOTSCRAY | C432: 2 | D432: 2 | E432: =C432*6+D432 -> 14 | G432: 3 | H432: 3 | I432: =G432*6+H432 -> 21 | K432: 4 | L432: 5 | M432: =K432*6+L432 -> 29 | O432: 4 | P432: 6 | Q432: =O432*6+P432 -> 30 | S432: UMPIRE | W432: TEAM | X432: W | Y432: L | Z432: D | AA432: FOR | AB432: AGST | AC432: % | AD432: PTS
A433: WILLIAMSTOWN | C433: 0 | D433: 2 | E433: =C433*6+D433 -> 2 | G433: 1 | H433: 7 | I433: =G433*6+H433 -> 13 | K433: 1 | L433: 9 | M433: =K433*6+L433 -> 15 | O433: 1 | P433: 11 | Q433: =O433*6+P433 -> 17 | S433: WATERS
A434: BEST PLAYERS | W434: PORT MELBOURNE | X434: 9 | Y434: 1 | Z434: 0 | AA434: 468 | AB434: 293 | AC434: 159.73 | AD434: 36
A435: FOOTSCRAY | D435: HINCH | G435: DECOIT | J435: MARMO | L435: SERBY | N435: STEPHENSON | Q435: KRUSE | W435: RICHMOND | X435: 8 | Y435: 1 | Z435: 0 | AA435: 390 | AB435: 209 | AC435: 186.6 | AD435: 32
A436: WILLIAMSTOWN | D436: BREMNER | G436: CALDWELL | J436: KNOX | L436: McKINLEY | N436: HOUGHTON | Q436: LEGGE | W436: NORTH MELBOURNE | X436: 6 | Y436: 2 | Z436: 1 | AA436: 400 | AB436: 274 | AC436: 145.99 | AD436: 26
A437: GOALKICKERS | W437: FOOTSCRAY | X437: 6 | Y437: 4 | Z437: 0 | AA437: 533 | AB437: 312 | AC437: 170.83333333333334 | AD437: 24
A438: FOOTSCRAY | D438: DECOIT 3 | G438: STEPHENSON
A439: WILLIAMSTOWN | D439: LEGGE | W439: WILLIAMSTOWN | X439: 5 | Y439: 5 | Z439: 0 | AA439: 405 | AB439: 358 | AC439: 113.12849162011173 | AD439: 20
W440: ESSENDON TOWN | X440: 4 | Y440: 5 | Z440: 1 | AA440: 350 | AB440: 402 | AC440: 87.06467661691542 | AD440: 18
A441: NTH MELB | C441: 1 | D441: 3 | E441: =C441*6+D441 -> 9 | G441: 2 | H441: 9 | I441: =G441*6+H441 -> 21 | K441: 4 | L441: 12 | M441: =K441*6+L441 -> 36 | O441: 6 | P441: 15 | Q441: =O441*6+P441 -> 51 | S441: ESSENDON | W441: PRAHRAN | X441: 2 | Y441: 8 | Z441: 0 | AA441: 405 | AB441: 593 | AC441: 68.29679595278246 | AD441: 8
A442: ESSENDON TOWN | C442: 1 | D442: 2 | E442: =C442*6+D442 -> 8 | G442: 1 | H442: 4 | I442: =G442*6+H442 -> 10 | K442: 2 | L442: 5 | M442: =K442*6+L442 -> 17 | O442: 2 | P442: 5 | Q442: =O442*6+P442 -> 17 | S442: TYRER | W442: WEST MELBOURNE | X442: 2 | Y442: 8 | Z442: 0 | AA442: 277 | AB442: 470 | AC442: 58.936170212765958 | AD442: 8
A443: BEST PLAYERS | W443: BRUNSWICK | X443: 1 | Y443: 9 | Z443: 0 | AA443: 291 | AB443: 608 | AC443: 47.86 | AD443: 4
A444: NTH MELB | D444: CARLTON | G444: LONERGREN | J444: BARNES | L444: JAMIESON | O444: HALL | Q444: ROLENT
A445: ESSENDON TOWN | D445: SWEATMAN | G445: KENNA | J445: RAMSEY | L445: GIRDWOOD | O445: GENT | Q445: BARR
A446: GOALKICKERS
A447: NTH MELB | D447: KNEE 3 | G447: MILNE | I447: SMITH | K447: WHITFIELD
A448: ESSENDON TOWN | D448: BARR | G448: GENT
A450: PRAHRAN | C450: 4 | D450: 5 | E450: =C450*6+D450 -> 29 | G450: 4 | H450: 6 | I450: =G450*6+H450 -> 30 | K450: 7 | L450: 8 | M450: =K450*6+L450 -> 50 | O450: 9 | P450: 9 | Q450: =O450*6+P450 -> 63 | S450: NORTH MELBOURNE
A451: WEST MELBOURNE | C451: 1 | D451: 0 | E451: =C451*6+D451 -> 6 | G451: 5 | H451: 2 | I451: =G451*6+H451 -> 32 | K451: 6 | L451: 3 | M451: =K451*6+L451 -> 39 | O451: 7 | P451: 5 | Q451: =O451*6+P451 -> 47 | S451: O'LOUGHLIN
A452: BEST PLAYERS
A453: PRAHRAN | D453: ROBERTS | G453: PONTIN | J453: DOWDING | M453: KNELL | P453: DUNN | S453: NUTTALL
A454: WEST MELBOURNE | D454: CHEFFERS | G454: BATTY | J454: H. LAXTON | M454: F. GREGORY | P454: MADDEN | S454: ROOKE
A455: GOALKICKERS
A456: PRAHRAN | D456: DUPE 3 | G456: NUTTALL 2 | J456: CROFT 2 | M456: LYONS | O456: G. BROWN
A457: WEST MELBOURNE | D457: MADDEN 2 | G457: CHEFFERS 2 | J457: MANSON | M457: GOURLAY | O457: ROOKE
A459: PORT MELBOURNE | C459: 1 | D459: 3 | E459: =C459*6+D459 -> 9 | G459: 4 | H459: 10 | I459: =G459*6+H459 -> 34 | K459: 6 | L459: 10 | M459: =K459*6+L459 -> 46 | O459: 9 | P459: 12 | Q459: =O459*6+P459 -> 66 | S459: P.M.
A460: BRUNSWICK | C460: 1 | D460: 0 | E460: =C460*6+D460 -> 6 | G460: 1 | H460: 3 | I460: =G460*6+H460 -> 9 | K460: 2 | L460: 5 | M460: =K460*6+L460 -> 17 | O460: 3 | P460: 5 | Q460: =O460*6+P460 -> 23 | S460: CARTER
A461: BEST PLAYERS
A462: PORT MELBOURNE | D462: KEENAN | F462: F. WARD | I462: HUTCHINSON | L462: BROWN | N462: O'BRIEN | Q462: HEGARTY
A463: BRUNSWICK | D463: LEEDS | F463: CLEMENTS | I463: CASEY | L463: CROWE | N463: HENLEY | Q463: LANDELLS
A464: GOALKICKERS
A465: PORT MELBOURNE | D465: HUTCHINSON 5 | G465: O'BRIEN 2 | J465: KEENAN | M465: BROWN
A466: BRUNSWICK | D466: HENLEY | G466: LANDELLS | J466: JOHNSON
A468: BYE | F468: RICHMOND
A470: ROUND 12 | E470: 19TH JULY | J470: WEATHER | N470: LIGHT NORTH WEST BREEZE OVERCAST DULL
C472: 1ST QTR | G472: 2ND QTR | K472: 3RD QTR | O472: FINAL | S472: PLAYED AT | X472: LADDER | AB472: ROUND | AD472: 12
S473: N. MELBOURNE
A474: PORT MELBOURNE | C474: 4 | D474: 1 | E474: =C474*6+D474 -> 25 | G474: 6 | H474: 2 | I474: =G474*6+H474 -> 38 | K474: 7 | L474: 3 | M474: =K474*6+L474 -> 45 | O474: 9 | P474: 5 | Q474: =O474*6+P474 -> 59 | S474: UMPIRE | W474: TEAM | X474: W | Y474: L | Z474: D | AA474: FOR | AB474: AGST | AC474: % | AD474: PTS
A475: NTH MELB | C475: 1 | D475: 1 | E475: =C475*6+D475 -> 7 | G475: 2 | H475: 4 | I475: =G475*6+H475 -> 16 | K475: 5 | L475: 7 | M475: =K475*6+L475 -> 37 | O475: 5 | P475: 8 | Q475: =O475*6+P475 -> 38 | S475: WATERS
A476: BEST PLAYERS | W476: PORT MELBOURNE | X476: 10 | Y476: 1 | Z476: 0 | AA476: 527 | AB476: 331 | AC476: 159.21 | AD476: 40
A477: PORT MELBOURNE | D477: KEENAN | G477: F. WARD | J477: AYLIN | L477: A. WARD | O477: GOTZ | R477: SICILY | W477: RICHMOND | X477: 9 | Y477: 1 | Z477: 0 | AA477: 476 | AB477: 219 | AC477: 217.35 | AD477: 36
A478: NTH MELB | D478: LONERGREN | G478: BARNES | J478: NOONAN | L478: CARLTON | O478: McDERMOTT | R478: HALL | W478: FOOTSCRAY | X478: 7 | Y478: 4 | Z478: 0 | AA478: 580 | AB478: 342 | AC478: 169.59064327485379 | AD478: 28
A479: GOALKICKERS | W479: NORTH MELBOURNE | X479: 6 | Y479: 3 | Z479: 1 | AA479: 438 | AB479: 333 | AC479: 131.53 | AD479: 26
A480: PORT MELBOURNE | D480: HUTCHINSON 2 | G480: HARDIMAN 2 | J480: O'BRIEN | L480: SICILY | N480: BROWN
A481: NTH MELB | D481: QUILLIGAN 2 | G481: SMITH 2 | J481: TORPEY | W481: WILLIAMSTOWN | X481: 5 | Y481: 6 | Z481: 0 | AA481: 453 | AB481: 414 | AC481: 109.42028985507247 | AD481: 20
W482: ESSENDON TOWN | X482: 4 | Y482: 5 | Z482: 1 | AA482: 350 | AB482: 402 | AC482: 87.06467661691542 | AD482: 18
A483: PRAHRAN | C483: 2 | D483: 1 | E483: =C483*6+D483 -> 13 | G483: 5 | H483: 8 | I483: =G483*6+H483 -> 38 | K483: 7 | L483: 11 | M483: =K483*6+L483 -> 53 | O483: 7 | P483: 14 | Q483: =O483*6+P483 -> 56 | S483: TOORAK PARK | W483: PRAHRAN | X483: 3 | Y483: 8 | Z483: 0 | AA483: 461 | AB483: 641 | AC483: 71.918876755070201 | AD483: 12
A484: WILLIAMSTOWN | C484: 3 | D484: 1 | E484: =C484*6+D484 -> 19 | G484: 4 | H484: 1 | I484: =G484*6+H484 -> 25 | K484: 5 | L484: 3 | M484: =K484*6+L484 -> 33 | O484: 7 | P484: 6 | Q484: =O484*6+P484 -> 48 | S484: McWHINNEY | W484: WEST MELBOURNE | X484: 2 | Y484: 9 | Z484: 0 | AA484: 287 | AB484: 556 | AC484: 51.618705035971225 | AD484: 8
A485: BEST PLAYERS | W485: BRUNSWICK | X485: 1 | Y485: 10 | Z485: 0 | AA485: 321 | AB485: 655 | AC485: 49.01 | AD485: 4
A486: PRAHRAN | D486: ROBERTS | G486: PONTIN | J486: SHAW | L486: DOWDING | O486: McCLUMPA | R486: DUNN
A487: WILLIAMSTOWN | D487: DICK | G487: LEGGE | J487: SPRINTHALL | M487: KNOX | O487: McCARROLL | R487: HOUGHTON
A488: GOALKICKERS
A489: PRAHRAN | D489: G. BACKHOUSE 4 | H489: BROWN | J489: DUPE | L489: JONES
A490: WILLIAMSTOWN | D490: STANILAND 2 | H490: DICK 2 | J490: HOUGHTON | L490: SHEEHAN | N490: McKINLEY
A492: RICHMOND | C492: 3 | D492: 5 | E492: =C492*6+D492 -> 23 | G492: 3 | H492: 8 | I492: =G492*6+H492 -> 26 | K492: 6 | L492: 14 | M492: =K492*6+L492 -> 50 | O492: 11 | P492: 20 | Q492: =O492*6+P492 -> 86 | S492: RICHMOND
A493: WEST MELBOURNE | C493: 1 | D493: 2 | E493: =C493*6+D493 -> 8 | G493: 1 | H493: 3 | I493: =G493*6+H493 -> 9 | K493: 1 | L493: 3 | M493: =K493*6+L493 -> 9 | O493: 1 | P493: 4 | Q493: =O493*6+P493 -> 10 | S493: RAVENHALL
A494: BEST PLAYERS
A495: RICHMOND | D495: CATHIE | G495: McDONALD | J495: MAINE | M495: PIRRIE | P495: WILLIAMS | S495: McNAIR
A496: WEST MELBOURNE | D496: FEAVER | G496: D. GREGORY | J496: WILLIAMS | M496: H. LAXTON | P496: HOOPER | S496: CHEFFERS
A497: GOALKICKERS
A498: RICHMOND | D498: McDONALD 3 | G498: DUNCAN 3 | J498: BAHEN 2 | M498: CARKEEK | P498: DOUGLAS | S498: GAULT
A499: WEST MELBOURNE | D499: GOURLAY
A501: FOOTSCRAY | C501: 0 | D501: 3 | E501: =C501*6+D501 -> 3 | G501: 3 | H501: 5 | I501: =G501*6+H501 -> 23 | K501: 3 | L501: 8 | M501: =K501*6+L501 -> 26 | O501: 6 | P501: 11 | Q501: =O501*6+P501 -> 47 | S501: BRUNSWICK
A502: BRUNSWICK | C502: 0 | D502: 3 | E502: =C502*6+D502 -> 3 | G502: 0 | H502: 4 | I502: =G502*6+H502 -> 4 | K502: 3 | L502: 6 | M502: =K502*6+L502 -> 24 | O502: 4 | P502: 6 | Q502: =O502*6+P502 -> 30 | S502: FRENCH
A503: BEST PLAYERS
A504: FOOTSCRAY | D504: DECOIT | G504: MONTGARRETT | J504: HARRIS | L504: HINCH | O504: GROVES | R504: KRUSE
A505: BRUNSWICK | D505: CLEMENTS | G505: CASEY | J505: LEEDS | L505: LANDELLS | O505: JOHNSON | R505: LAIDLAW
A506: GOALKICKERS
A507: FOOTSCRAY | D507: DECOIT 2 | G507: MONTGARRETT 2 | K507: KRUSE | M507: LAKE
A508: BRUNSWICK | D508: SMITH | G508: LANDELLS | J508: COBURN | L508: CROWE
A510: BYE | E510: ESSENDON TOWN
A512: ROUND 13 | E512: 26TH JULY | K512: WEATHER | O512: SOUTH WIND RAIN
C514: 1ST QTR | G514: 2ND QTR | K514: 3RD QTR | O514: FINAL | S514: PLAYED AT | X514: LADDER | AB514: ROUND | AD514: 13
S515: FOOTSCRAY
A516: RICHMOND | C516: 0 | D516: 3 | E516: =C516*6+D516 -> 3 | G516: 1 | H516: 5 | I516: =G516*6+H516 -> 11 | K516: 2 | L516: 6 | M516: =K516*6+L516 -> 18 | O516: 3 | P516: 9 | Q516: =O516*6+P516 -> 27 | S516: UMPIRE | W516: TEAM | X516: W | Y516: L | Z516: D | AA516: FOR | AB516: AGST | AC516: % | AD516: PTS
A517: FOOTSCRAY | C517: 0 | D517: 1 | E517: =C517*6+D517 -> 1 | G517: 0 | H517: 1 | I517: =G517*6+H517 -> 1 | K517: 0 | L517: 3 | M517: =K517*6+L517 -> 3 | O517: 1 | P517: 4 | Q517: =O517*6+P517 -> 10 | S517: WATERS
A518: BEST PLAYERS | W518: PORT MELBOURNE | X518: 11 | Y518: 1 | Z518: 0 | AA518: 602 | AB518: 351 | AC518: 171.51 | AD518: 44
A519: RICHMOND | D519: CARKEEK | F519: E. JUSTINS | I519: EDMONDS | K519: C. BACKHOUSE | N519: RICHARDSON | Q519: DUNCAN | W519: RICHMOND | X519: 10 | Y519: 1 | Z519: 0 | AA519: 503 | AB519: 229 | AC519: 219.65 | AD519: 40
A520: FOOTSCRAY | D520: MARMO | F520: HARRIS | I520: GROVES | K520: SERBY | N520: MONTGARRETT | Q520: HINCH | W520: FOOTSCRAY | X520: 7 | Y520: 5 | Z520: 0 | AA520: 590 | AB520: 369 | AC520: 159.89159891598916 | AD520: 28
A521: GOALKICKERS | W521: NORTH MELBOURNE | X521: 6 | Y521: 4 | Z521: 1 | AA521: 462 | AB521: 375 | AC521: 123.2 | AD521: 26
A522: RICHMOND | D522: McNAIR | F522: GAULT | H522: MILNE
A523: FOOTSCRAY | D523: CAIRNS | W523: WILLIAMSTOWN | X523: 5 | Y523: 6 | Z523: 0 | AA523: 453 | AB523: 414 | AC523: 109.42028985507247 | AD523: 20
W524: ESSENDON TOWN | X524: 4 | Y524: 6 | Z524: 1 | AA524: 370 | AB524: 477 | AC524: 77.568134171907758 | AD524: 18
A525: PORT MELBOURNE | C525: 3 | D525: 2 | E525: =C525*6+D525 -> 20 | G525: 3 | H525: 7 | I525: =G525*6+H525 -> 25 | K525: 4 | L525: 9 | M525: =K525*6+L525 -> 33 | O525: 10 | P525: 15 | Q525: =O525*6+P525 -> 75 | S525: P.M. | W525: PRAHRAN | X525: 4 | Y525: 8 | Z525: 0 | AA525: 511 | AB525: 681 | AC525: 75.036710719530106 | AD525: 16
A526: ESSENDON TOWN | C526: 2 | D526: 1 | E526: =C526*6+D526 -> 13 | G526: 2 | H526: 1 | I526: =G526*6+H526 -> 13 | K526: 3 | L526: 2 | M526: =K526*6+L526 -> 20 | O526: 3 | P526: 2 | Q526: =O526*6+P526 -> 20 | S526: McWHINNEY | W526: WEST MELBOURNE | X526: 3 | Y526: 9 | Z526: 0 | AA526: 329 | AB526: 580 | AC526: 56.724137931034484 | AD526: 12
A527: BEST PLAYERS | W527: BRUNSWICK | X527: 1 | Y527: 11 | Z527: 0 | AA527: 361 | AB527: 705 | AC527: 51.21 | AD527: 4
A528: PORT MELBOURNE | D528: BLISS | G528: McGEE | J528: KEENAN | L528: SICILY | O528: F. WARD | Q528: GARBUTT
A529: ESSENDON TOWN | D529: SWEATMAN | G529: RAMSEY | J529: TESTER | L529: BENNETTS | O529: CHARLES | Q529: SHELDON
A530: GOALKICKERS
A531: PORT MELBOURNE | D531: HUTCHINSON 2 | G531: HARDIMAN 2 | J531: O'BRIEN | L531: McGOWAN | N531: GARBUTT | P531: JOHNSON | R531: McGEE
A532: ESSENDON TOWN | D532: PAIN | F532: BUSBRIDGE | I532: KEATING
A534: PRAHRAN | C534: 1 | D534: 0 | E534: =C534*6+D534 -> 6 | G534: 6 | H534: 1 | I534: =G534*6+H534 -> 37 | K534: 7 | L534: 2 | M534: =K534*6+L534 -> 44 | O534: 8 | P534: 2 | Q534: =O534*6+P534 -> 50 | S534: BRUNSWICK
A535: BRUNSWICK | C535: 3 | D535: 1 | E535: =C535*6+D535 -> 19 | G535: 3 | H535: 2 | I535: =G535*6+H535 -> 20 | K535: 6 | L535: 2 | M535: =K535*6+L535 -> 38 | O535: 6 | P535: 4 | Q535: =O535*6+P535 -> 40 | S535: RAVENHALL
A536: BEST PLAYERS
A537: PRAHRAN | C537: TRUSCOTT | F537: ROBERTS | H537: TOOTELL | K537: DUNN | N537: NUTTALL | P537: DUPE
A538: BRUNSWICK | C538: LEEDS | F538: CLEMENTS | H538: LANDELLS | K538: STEVENSON | N538: COBURN | P538: COWLEY
A539: GOALKICKERS
A540: PRAHRAN | C540: LYONS 3 | F540: DUPE 2 | H540: G. BACKHOUSE | K540: DOWLING | N540: JONES
A541: BRUNSWICK | C541: CLEMENTS 3 | F541: LANDELLS 2 | I541: COBURN
A543: WEST MELBOURNE | C543: 3 | D543: 3 | E543: =C543*6+D543 -> 21 | G543: 5 | H543: 4 | I543: =G543*6+H543 -> 34 | K543: 6 | L543: 5 | M543: =K543*6+L543 -> 41 | O543: 6 | P543: 6 | Q543: =O543*6+P543 -> 42 | S543: NORTH MELBOURNE
A544: NORTH MELBOURNE | C544: 3 | D544: 1 | E544: =C544*6+D544 -> 19 | G544: 3 | H544: 1 | I544: =G544*6+H544 -> 19 | K544: 3 | L544: 3 | M544: =K544*6+L544 -> 21 | O544: 3 | P544: 6 | Q544: =O544*6+P544 -> 24 | S544: TYRER
A545: BEST PLAYERS
A546: WEST MELBOURNE | C546: FEAVER | F546: BATTY | I546: WILLIAMS | K546: H. LAXTON | N546: H .GREGORY | Q546: HOOPER
A547: NORTH MELBOURNE | C547: NOONAN | F547: McDERMOTT | I547: JAMIESON | K547: LONERGREN | N547: KNEE | Q547: MORRISON
A548: GOALKICKERS
A549: WEST MELBOURNE | C549: RYAN 2 | F549: FOX 2 | H549: POOLE | J549: DEAN
A550: NORTH MELBOURNE | C550: KNEE 2 | F550: NEEDHAM
A552: BYE | E552: WILLIAMSTOWN
A554: ROUND 14 | E554: 2ND AUGUST | I554: WEATHER | N554: NORTH WIND
C556: 1ST QTR | G556: 2ND QTR | K556: 3RD QTR | O556: FINAL | S556: PLAYED AT | X556: LADDER | AB556: ROUND | AD556: 14
S557: RICHMOND
A558: RICHMOND | C558: 1 | D558: 0 | E558: =C558*6+D558 -> 6 | G558: 2 | H558: 7 | I558: =G558*6+H558 -> 19 | K558: 4 | L558: 9 | M558: =K558*6+L558 -> 33 | O558: 6 | P558: 10 | Q558: =O558*6+P558 -> 46 | S558: UMPIRE | W558: TEAM | X558: W | Y558: L | Z558: D | AA558: FOR | AB558: AGST | AC558: % | AD558: PTS
A559: NORTH MELBOURNE | C559: 1 | D559: 2 | E559: =C559*6+D559 -> 8 | G559: 2 | H559: 2 | I559: =G559*6+H559 -> 14 | K559: 3 | L559: 3 | M559: =K559*6+L559 -> 21 | O559: 4 | P559: 3 | Q559: =O559*6+P559 -> 27 | S559: RAVENHALL
A560: BEST PLAYERS | W560: PORT MELBOURNE | X560: 12 | Y560: 1 | Z560: 0 | AA560: 637 | AB560: 381 | AC560: 167.19 | AD560: 48
A561: RICHMOND | C561: E. JUSTINS | F561: EDMONDS | I561: C. BACKHOUSE | L561: CARKEEK | O561: CATHIE | R561: McNAIR | W561: RICHMOND | X561: 11 | Y561: 1 | Z561: 0 | AA561: 549 | AB561: 256 | AC561: 214.45 | AD561: 44
A562: NORTH MELBOURNE | C562: NOONAN | F562: CARLTON | I562: LONERGREN | L562: CONSIDINE | O562: MORRISON | R562: GRAHAM | W562: FOOTSCRAY | X562: 7 | Y562: 6 | Z562: 0 | AA562: 605 | AB562: 414 | AC562: 146.1352657004831 | AD562: 28
A563: GOALKICKERS | W563: NORTH MELBOURNE | X563: 6 | Y563: 5 | Z563: 1 | AA563: 489 | AB563: 421 | AC563: 116.15 | AD563: 26
A564: RICHMOND | C564: DOUGLAS | F564: DUNCAN | H564: McNAIR | J564: CATHIE | L564: BAHEN | N564: C. BACKHOUSE
A565: NORTH MELBOURNE | C565: WHITFIELD | F565: CONSIDINE | I565: KNEE | K565: SMITH | W565: WILLIAMSTOWN | X565: 6 | Y565: 6 | Z565: 0 | AA565: 487 | AB565: 442 | AC565: 110.18099547511312 | AD565: 24
W566: ESSENDON TOWN | X566: 5 | Y566: 6 | Z566: 1 | AA566: 415 | AB566: 492 | AC566: 84.349593495934954 | AD566: 22
A567: ESSENDON TOWN | C567: 2 | D567: 2 | E567: =C567*6+D567 -> 14 | G567: 3 | H567: 7 | I567: =G567*6+H567 -> 25 | K567: 4 | L567: 7 | M567: =K567*6+L567 -> 31 | O567: 6 | P567: 9 | Q567: =O567*6+P567 -> 45 | S567: ESSENDON | W567: PRAHRAN | X567: 4 | Y567: 9 | Z567: 0 | AA567: 541 | AB567: 716 | AC567: 75.558659217877093 | AD567: 16
A568: FOOTSCRAY | C568: 0 | D568: 1 | E568: =C568*6+D568 -> 1 | G568: 0 | H568: 3 | I568: =G568*6+H568 -> 3 | K568: 1 | L568: 8 | M568: =K568*6+L568 -> 14 | O568: 1 | P568: 9 | Q568: =O568*6+P568 -> 15 | S568: WATERS | W568: WEST MELBOURNE | X568: 3 | Y568: 9 | Z568: 0 | AA568: 329 | AB568: 580 | AC568: 56.724137931034484 | AD568: 12
A569: BEST PLAYERS | W569: BRUNSWICK | X569: 1 | Y569: 12 | Z569: 0 | AA569: 389 | AB569: 739 | AC569: 52.64 | AD569: 4
A570: ESSENDON TOWN | C570: SWEATMAN | F570: RAMSEY | I570: SHELDON | K570: GIRDWOOD | N570: BUSBRIDGE | Q570: JAMES
A571: FOOTSCRAY | C571: HARRIS | F571: W. STEPHENSON | I571: GROVES | K571: PYMM | N571: DECOIT | Q571: SERBY
A572: GOALKICKERS
A573: ESSENDON TOWN | C573: HUGHES 3 | F573: GRAHAM | H573: BUSBRIDGE | K573: RAMSEY
A574: FOOTSCRAY | C574: DECOIT
A576: PORT MELBOURNE | C576: 1 | D576: 6 | E576: =C576*6+D576 -> 12 | G576: 2 | H576: 7 | I576: =G576*6+H576 -> 19 | K576: 3 | L576: 10 | M576: =K576*6+L576 -> 28 | O576: 4 | P576: 11 | Q576: =O576*6+P576 -> 35 | S576: TOORAK PARK
A577: PRAHRAN | C577: 0 | D577: 1 | E577: =C577*6+D577 -> 1 | G577: 1 | H577: 3 | I577: =G577*6+H577 -> 9 | K577: 2 | L577: 5 | M577: =K577*6+L577 -> 17 | O577: 4 | P577: 6 | Q577: =O577*6+P577 -> 30 | S577: CARTER
A578: BEST PLAYERS
A579: PORT MELBOURNE | C579: McGEE | F579: J. WARD | I579: F. WARD | K579: SHEEHAN | N579: BROMLEY | Q579: SICILY
A580: PRAHRAN | C580: LYONS | F580: PONTIN | I580: TRUSCOTT | K580: DUPE | N580: PANNAM | Q580: McCLUMPA
A581: GOALKICKERS
A582: PORT MELBOURNE | C582: McGEE 2 | F582: HUTCHINSON | I582: HARDIMAN
A583: PRAHRAN | C583: DUPE 2 | F583: G. BACKHOUSE | I583: LYONS
A585: WILLIAMSTOWN | C585: 0 | D585: 3 | E585: =C585*6+D585 -> 3 | G585: 1 | H585: 3 | I585: =G585*6+H585 -> 9 | K585: 3 | L585: 7 | M585: =K585*6+L585 -> 25 | O585: 4 | P585: 10 | Q585: =O585*6+P585 -> 34 | S585: WILLIAMSTOWN
A586: BRUNSWICK | C586: 0 | D586: 0 | E586: =C586*6+D586 -> 0 | G586: 0 | H586: 2 | I586: =G586*6+H586 -> 2 | K586: 2 | L586: 4 | M586: =K586*6+L586 -> 16 | O586: 4 | P586: 4 | Q586: =O586*6+P586 -> 28 | S586: TYRER
A587: BEST PLAYERS
A588: WILLIAMSTOWN | C588: LEGGE | F588: BARLING | I588: PRESCOTT | K588: MANDERSON | N588: DICK | Q588: HOUGHTON
A589: BRUNSWICK | C589: JOHNSON | F589: COBURN | I589: LEEDS | K589: GOURLEY | N589: SHELLNACK | Q589: LAIDLAW
A590: GOALKICKERS
A591: WILLIAMSTOWN | C591: STANILAND 2 | F591: BARLING | I591: PRESCOTT
A592: BRUNSWICK | C592: COBURN | F592: GORMSTON | I592: COWLEY | K592: SHELLNACK
A594: BYE | E594: WEST MELBOURNEOURNE
A596: ROUND 15 | E596: 9TH AUGUST | I596: WEATHER | O596: FINE
C598: 1ST QTR | G598: 2ND QTR | K598: 3RD QTR | O598: FINAL | S598: PLAYED AT | X598: LADDER | AB598: ROUND | AD598: 15
S599: P.M.
A600: PORT MELBOURNE | C600: 1 | D600: 6 | E600: =C600*6+D600 -> 12 | G600: 2 | H600: 16 | I600: =G600*6+H600 -> 28 | K600: 3 | L600: 20 | M600: =K600*6+L600 -> 38 | O600: 9 | P600: 22 | Q600: =O600*6+P600 -> 76 | S600: UMPIRE | W600: TEAM | X600: W | Y600: L | Z600: D | AA600: FOR | AB600: AGST | AC600: % | AD600: PTS
A601: FOOTSCRAY | C601: 0 | D601: 0 | E601: =C601*6+D601 -> 0 | G601: 0 | H601: 0 | I601: =G601*6+H601 -> 0 | K601: 0 | L601: 0 | M601: =K601*6+L601 -> 0 | O601: 0 | P601: 0 | Q601: =O601*6+P601 -> 0 | S601: O'LOUGHLIN
A602: BEST PLAYERS | W602: PORT MELBOURNE | X602: 13 | Y602: 1 | Z602: 0 | AA602: 713 | AB602: 381 | AC602: 187.14 | AD602: 52
A603: PORT MELBOURNE | C603: SICILY | F603: McGEE | I603: HUTCHINSON | W603: RICHMOND | X603: 12 | Y603: 1 | Z603: 0 | AA603: 632 | AB603: 273 | AC603: 231.5 | AD603: 48
A604: FOOTSCRAY | C604: HINCH | F604: C. HOOD | I604: MONTGARRETT | W604: NORTH MELBOURNE | X604: 7 | Y604: 5 | Z604: 1 | AA604: 532 | AB604: 461 | AC604: 115.4 | AD604: 30
A605: GOALKICKERS | W605: FOOTSCRAY | X605: 7 | Y605: 7 | Z605: 0 | AA605: 605 | AB605: 490 | AC605: 123.47 | AD605: 28
A606: PORT MELBOURNE | C606: HUTCHINSON 3 | F606: DANIELS 2 | I606: McGEE 2 | K606: JOHNSON | N606: BROMLEY
A607: FOOTSCRAY | C607: NIL | W607: WILLIAMSTOWN | X607: 6 | Y607: 7 | Z607: 0 | AA607: 527 | AB607: 485 | AC607: 108.65979381443299 | AD607: 24
W608: ESSENDON TOWN | X608: 5 | Y608: 7 | Z608: 1 | AA608: 432 | AB608: 575 | AC608: 75.130434782608702 | AD608: 22
A609: NORTH MELBOURNE | C609: 0 | D609: 2 | E609: =C609*6+D609 -> 2 | G609: 1 | H609: 8 | I609: =G609*6+H609 -> 14 | K609: 3 | L609: 10 | M609: =K609*6+L609 -> 28 | O609: 5 | P609: 13 | Q609: =O609*6+P609 -> 43 | S609: N. MELBOURNE | W609: PRAHRAN | X609: 4 | Y609: 9 | Z609: 0 | AA609: 541 | AB609: 716 | AC609: 75.558659217877093 | AD609: 16
A610: WILLIAMSTOWN | C610: 1 | D610: 2 | E610: =C610*6+D610 -> 8 | G610: 1 | H610: 2 | I610: =G610*6+H610 -> 8 | K610: 6 | L610: 4 | M610: =K610*6+L610 -> 40 | O610: 6 | P610: 4 | Q610: =O610*6+P610 -> 40 | S610: WATERS | W610: WEST MELBOURNE | X610: 3 | Y610: 10 | Z610: 0 | AA610: 367 | AB610: 628 | AC610: 58.439490445859875 | AD610: 12
A611: BEST PLAYERS | W611: BRUNSWICK | X611: 2 | Y611: 12 | Z611: 0 | AA611: 437 | AB611: 777 | AC611: 56.24 | AD611: 8
A612: NORTH MELBOURNE | C612: LONERGREN | F612: ROLENT | I612: CARLTON | K612: NOONAN | N612: MILNE | P612: McDERMOTT
A613: WILLIAMSTOWN | C613: MANDERSON | F613: SPRINTHALL | I613: McCARROLL | K613: KNOX | N613: LEGGE | P613: HOUGHTON
A614: GOALKICKERS
A615: NORTH MELBOURNE | C615: WHITFIELD 2 | F615: GARDINER 2 | I615: BARNES
A616: WILLIAMSTOWN | C616: STANILAND | F616: LEGGE | H616: WISE | J616: PRESCOTT | L616: DICK | N616: SHEEHAN
A618: RICHMOND | C618: 3 | D618: 3 | E618: =C618*6+D618 -> 21 | G618: 5 | H618: 6 | I618: =G618*6+H618 -> 36 | K618: 8 | L618: 9 | M618: =K618*6+L618 -> 57 | O618: 12 | P618: 11 | Q618: =O618*6+P618 -> 83 | S618: RICHMOND
A619: ESSENDON TOWN | C619: 1 | D619: 3 | E619: =C619*6+D619 -> 9 | G619: 1 | H619: 3 | I619: =G619*6+H619 -> 9 | K619: 1 | L619: 3 | M619: =K619*6+L619 -> 9 | O619: 2 | P619: 5 | Q619: =O619*6+P619 -> 17 | S619: FRENCH
A620: BEST PLAYERS
A621: RICHMOND | C621: JOHNSTONE | F621: McDONALD | I621: WILLIAMS | L621: EDMONDS | O621: E. JUSTINS | R621: RICHARDSON
A622: ESSENDON TOWN | C622: SWEATMAN | F622: CHARLES | I622: BUSBRIDGE | L622: CAREY | O622: BARR | R622: DOUGLAS
A623: GOALKICKERS
A624: RICHMOND | C624: JOHNSTONE 4 | F624: CATHIE 2 | H624: DUNCAN 2 | K624: BOWNAS 2 | N624: McDONALD | P624: CARKEEK
A625: ESSENDON TOWN | C625: BARR | F625: RAMSEY
A627: BRUNSWICK | C627: 0 | D627: 2 | E627: =C627*6+D627 -> 2 | G627: 4 | H627: 5 | I627: =G627*6+H627 -> 29 | K627: 4 | L627: 5 | M627: =K627*6+L627 -> 29 | O627: 6 | P627: 12 | Q627: =O627*6+P627 -> 48 | S627: B.WICK
A628: WEST MELBOURNE | C628: 0 | D628: 2 | E628: =C628*6+D628 -> 2 | G628: 0 | H628: 4 | I628: =G628*6+H628 -> 4 | K628: 4 | L628: 6 | M628: =K628*6+L628 -> 30 | O628: 5 | P628: 8 | Q628: =O628*6+P628 -> 38 | S628: McWHINNEY
A629: BEST PLAYERS
A630: BRUNSWICK | C630: CLEMENTS | F630: SMITH | H630: CROWE | K630: JOHNSON | N630: MULVANEY | P630: LANDELLS
A631: WEST MELBOURNE | C631: BATTY | F631: WILLIAMS | H631: H. LAXTON | K631: HOOPER | N631: GOURLEY | Q631: DEANE
A632: GOALKICKERS
A633: BRUNSWICK | C633: CLEMENTS 4 | F633: STOTT | H633: COBURN
A634: WEST MELBOURNE | C634: WILLIAMS 2 | F634: LYONS | H634: DEANE | J634: GOURLEY
A636: BYE | E636: PRAHRAN
A638: ROUND 16 | E638: 16TH AUGUST | I638: WEATHER | M638: FINE CLOUDY
C640: 1ST QTR | G640: 2ND QTR | K640: 3RD QTR | O640: FINAL | S640: PLAYED AT | X640: LADDER | AB640: ROUND | AD640: 16
S641: FOOTSCRAY
A642: NORTH MELBOURNE | C642: 2 | D642: 3 | E642: =C642*6+D642 -> 15 | G642: 6 | H642: 5 | I642: =G642*6+H642 -> 41 | K642: 7 | L642: 6 | M642: =K642*6+L642 -> 48 | O642: 9 | P642: 8 | Q642: =O642*6+P642 -> 62 | S642: UMPIRE | W642: TEAM | X642: W | Y642: L | Z642: D | AA642: FOR | AB642: AGST | AC642: % | AD642: PTS
A643: FOOTSCRAY | C643: 0 | D643: 1 | E643: =C643*6+D643 -> 1 | G643: 3 | H643: 3 | I643: =G643*6+H643 -> 21 | K643: 4 | L643: 6 | M643: =K643*6+L643 -> 30 | O643: 5 | P643: 8 | Q643: =O643*6+P643 -> 38 | S643: O'LOUGHLIN
A644: BEST PLAYERS | W644: PORT MELBOURNE | X644: 14 | Y644: 1 | Z644: 0 | AA644: 747 | AB644: 411 | AC644: 181.75 | AD644: 56
A645: NORTH MELBOURNE | C645: ROLENT | F645: LONERGREN | I645: CARLTON | K645: NOONAN | N645: HALL | Q645: GRAHAM | W645: RICHMOND | X645: 13 | Y645: 1 | Z645: 0 | AA645: 675 | AB645: 296 | AC645: 228.04 | AD645: 52
A646: FOOTSCRAY | C646: SERBY | F646: DECOIT | I646: MARMO | K646: HARRIS | N646: W. STEPHENSON | Q646: McGLYNN | W646: NORTH MELBOURNE | X646: 8 | Y646: 5 | Z646: 1 | AA646: 594 | AB646: 499 | AC646: 119.04 | AD646: 34
A647: GOALKICKERS | W647: FOOTSCRAY | X647: 7 | Y647: 8 | Z647: 0 | AA647: 643 | AB647: 552 | AC647: 116.49 | AD647: 28
A648: NORTH MELBOURNE | C648: KNEE 3 | F648: MILNE 2 | H648: MORRISON 2 | K648: QUILLIGAN | N648: CONSIDINE
A649: FOOTSCRAY | C649: CAIRNS 2 | F649: DECOIT | H649: WYATT | K649: McGLYNN | W649: WILLIAMSTOWN | X649: 6 | Y649: 8 | Z649: 0 | AA649: 550 | AB649: 528 | AC649: 104.16666666666667 | AD649: 24
W650: ESSENDON TOWN | X650: 5 | Y650: 8 | Z650: 1 | AA650: 440 | AB650: 600 | AC650: 73.333333333333329 | AD650: 22
A651: RICHMOND | C651: 1 | D651: 0 | E651: =C651*6+D651 -> 6 | G651: 2 | H651: 3 | I651: =G651*6+H651 -> 15 | K651: 6 | L651: 4 | M651: =K651*6+L651 -> 40 | O651: 6 | P651: 7 | Q651: =O651*6+P651 -> 43 | S651: WILLIAMSTOWN | W651: PRAHRAN | X651: 5 | Y651: 9 | Z651: 0 | AA651: 566 | AB651: 724 | AC651: 78.176795580110493 | AD651: 20
A652: WILLIAMSTOWN | C652: 1 | D652: 4 | E652: =C652*6+D652 -> 10 | G652: 3 | H652: 4 | I652: =G652*6+H652 -> 22 | K652: 3 | L652: 4 | M652: =K652*6+L652 -> 22 | O652: 3 | P652: 5 | Q652: =O652*6+P652 -> 23 | S652: WATERS | W652: WEST MELBOURNE | X652: 3 | Y652: 11 | Z652: 0 | AA652: 397 | AB652: 662 | AC652: 59.969788519637461 | AD652: 12
A653: BEST PLAYERS | W653: BRUNSWICK | X653: 2 | Y653: 12 | Z653: 0 | AA653: 437 | AB653: 777 | AC653: 56.24 | AD653: 8
A654: RICHMOND
A655: WILLIAMSTOWN
A656: GOALKICKERS
A657: RICHMOND | C657: JOHNSTONE 3 | F657: DUNCAN 2 | I657: KIDD
A658: WILLIAMSTOWN | C658: STANILAND | F658: LEGGE | H658: PRESCOTT
A660: PRAHRAN | C660: 1 | D660: 0 | E660: =C660*6+D660 -> 6 | G660: 1 | H660: 3 | I660: =G660*6+H660 -> 9 | K660: 2 | L660: 5 | M660: =K660*6+L660 -> 17 | O660: 3 | P660: 7 | Q660: =O660*6+P660 -> 25 | S660: ESSENDON
A661: ESSENDON TOWN | C661: 0 | D661: 3 | E661: =C661*6+D661 -> 3 | G661: 0 | H661: 5 | I661: =G661*6+H661 -> 5 | K661: 0 | L661: 7 | M661: =K661*6+L661 -> 7 | O661: 0 | P661: 8 | Q661: =O661*6+P661 -> 8 | S661: FRENCH
A662: BEST PLAYERS
A663: PRAHRAN | C663: TRUSCOTT | F663: PANNAM | I663: DOWDING | K663: LYONS | N663: JONES | Q663: CROFT
A664: ESSENDON TOWN | C664: GRAHAM | F664: SWEATMAN | I664: SHELDON | K664: WEIR | N664: NUMA | Q664: BUSBRIDGE
A665: GOALKICKERS
A666: PRAHRAN | C666: CROFT | F666: G. BACKHOUSE | J666: LYONS
A667: ESSENDON TOWN | C667: NIL
A669: PORT MELBOURNE | C669: 1 | D669: 2 | E669: =C669*6+D669 -> 8 | G669: 2 | H669: 2 | I669: =G669*6+H669 -> 14 | K669: 4 | L669: 4 | M669: =K669*6+L669 -> 28 | O669: 5 | P669: 4 | Q669: =O669*6+P669 -> 34 | S669: NORTH MELBOURNE
A670: WEST MELBOURNE | C670: 0 | D670: 1 | E670: =C670*6+D670 -> 1 | G670: 2 | H670: 3 | I670: =G670*6+H670 -> 15 | K670: 2 | L670: 3 | M670: =K670*6+L670 -> 15 | O670: 4 | P670: 6 | Q670: =O670*6+P670 -> 30 | S670: TYRER
A671: BEST PLAYERS
A672: PORT MELBOURNE | C672: F. WARD | F672: J. GARBUTT | I672: SHEEHAN | K672: KEENAN | N672: J. WARD | Q672: McGEE
A673: WEST MELBOURNE | C673: D. GREGORY | F673: F. GREGORY | I673: POOLE | K673: DEANE | N673: MANSON | Q673: WILLIAMS
A674: GOALKICKERS
A675: PORT MELBOURNE | C675: HUTCHINSON 2 | G675: CROCKETT | J675: SICILY | L675: HILDEBRAND
A676: WEST MELBOURNE | C676: RYAN 2 | F676: DEANE | H676: F. GREGORY
A678: BYE | E678: BRUNSWICK
A680: ROUND 17 | E680: 23RD AUGUST | K680: WEATHER | Q680: NORTH WIND
C682: 1ST QTR | G682: 2ND QTR | K682: 3RD QTR | O682: FINAL | S682: PLAYED AT | X682: LADDER | AB682: ROUND | AD682: 17
S683: ESSENDON
A684: WILLIAMSTOWN | C684: 3 | D684: 3 | E684: =C684*6+D684 -> 21 | G684: 5 | H684: 8 | I684: =G684*6+H684 -> 38 | K684: 8 | L684: 11 | M684: =K684*6+L684 -> 59 | O684: 9 | P684: 15 | Q684: =O684*6+P684 -> 69 | S684: UMPIRE | W684: TEAM | X684: W | Y684: L | Z684: D | AA684: FOR | AB684: AGST | AC684: % | AD684: PTS
A685: ESSENDON TOWN | C685: 0 | D685: 0 | E685: =C685*6+D685 -> 0 | G685: 0 | H685: 2 | I685: =G685*6+H685 -> 2 | K685: 2 | L685: 4 | M685: =K685*6+L685 -> 16 | O685: 4 | P685: 8 | Q685: =O685*6+P685 -> 32 | S685: McWHINNEY
A686: BEST PLAYERS | W686: RICHMOND | X686: 14 | Y686: 1 | Z686: 0 | AA686: 764 | AB686: 310 | AC686: 246.45 | AD686: 56
A687: WILLIAMSTOWN | C687: KNOX | F687: DICK | I687: HOUGHTON | L687: BREMNER | N687: WISE | Q687: CALDWELL | W687: PORT MELBOURNE | X687: 14 | Y687: 1 | Z687: 0 | AA687: 747 | AB687: 411 | AC687: 181.75 | AD687: 56
A688: ESSENDON TOWN | C688: SHELDON | F688: GIRDWOOD | I688: RAMSEY | L688: NUMA | N688: CONNELL | Q688: GENT | W688: NORTH MELBOURNE | X688: 9 | Y688: 5 | Z688: 1 | AA688: 637 | AB688: 510 | AC688: 124.9 | AD688: 38
A689: GOALKICKERS | W689: FOOTSCRAY | X689: 7 | Y689: 9 | Z689: 0 | AA689: 671 | AB689: 583 | AC689: 115.09 | AD689: 28
A690: WILLIAMSTOWN | C690: WISE 4 | F690: HOUGHTON 3 | I690: KNOX | K690: SHEEHAN
A691: ESSENDON TOWN | C691: SHELDON | F691: BUSBRIDGE | I691: KEATING | K691: CAREY | W691: WILLIAMSTOWN | X691: 7 | Y691: 8 | Z691: 0 | AA691: 619 | AB691: 560 | AC691: 110.53571428571429 | AD691: 28
W692: ESSENDON TOWN | X692: 5 | Y692: 9 | Z692: 1 | AA692: 472 | AB692: 669 | AC692: 70.553064275037372 | AD692: 22
A693: NORTH MELBOURNE | C693: 1 | D693: 3 | E693: =C693*6+D693 -> 9 | G693: 1 | H693: 8 | I693: =G693*6+H693 -> 14 | K693: 2 | L693: 13 | M693: =K693*6+L693 -> 25 | O693: 4 | P693: 19 | Q693: =O693*6+P693 -> 43 | S693: N. MELBOURNE | W693: PRAHRAN | X693: 5 | Y693: 10 | Z693: 0 | AA693: 577 | AB693: 767 | AC693: 75.228161668839633 | AD693: 20
A694: PRAHRAN | C694: 0 | D694: 2 | E694: =C694*6+D694 -> 2 | G694: 1 | H694: 4 | I694: =G694*6+H694 -> 10 | K694: 1 | L694: 4 | M694: =K694*6+L694 -> 10 | O694: 1 | P694: 5 | Q694: =O694*6+P694 -> 11 | S694: WATERS | W694: WEST MELBOURNE | X694: 4 | Y694: 11 | Z694: 0 | AA694: 428 | AB694: 690 | AC694: 62.03 | AD694: 16
A695: BEST PLAYERS | W695: BRUNSWICK | X695: 2 | Y695: 13 | Z695: 0 | AA695: 450 | AB695: 866 | AC695: 51.96 | AD695: 8
A696: NORTH MELBOURNE | C696: JAMIESON | F696: MILNE | I696: NOONAN | L696: CONSIDINE | O696: BARNES | R696: ROLENT
A697: PRAHRAN | C697: TRUSCOTT | F697: T. BROWN | I697: PONTIN | L697: WILLISON | O697: CROFT | R697: LYONS
A698: GOALKICKERS
A699: NORTH MELBOURNE | C699: GARDINER | F699: CONSIDINE | I699: KNEE | K699: WHITFIELD
A700: PRAHRAN | C700: CROFT
A702: WEST MELBOURNE | C702: 3 | D702: 2 | E702: =C702*6+D702 -> 20 | G702: 3 | H702: 3 | I702: =G702*6+H702 -> 21 | K702: 4 | L702: 7 | M702: =K702*6+L702 -> 31 | O702: 4 | P702: 7 | Q702: =O702*6+P702 -> 31 | S702: FOOTS
A703: FOOTSCRAY | C703: 0 | D703: 1 | E703: =C703*6+D703 -> 1 | G703: 2 | H703: 7 | I703: =G703*6+H703 -> 19 | K703: 3 | L703: 9 | M703: =K703*6+L703 -> 27 | O703: 3 | P703: 10 | Q703: =O703*6+P703 -> 28 | S703: O'LOUGHLIN
A704: BEST PLAYERS
A705: WEST MELBOURNE | C705: POOLE | F705: ROOKE | I705: WILLIAMS | L705: MADDEN | O705: GREGORY | R705: H. LAXTON
A706: FOOTSCRAY | C706: MARMO | F706: HINCH | I706: HARRIS | L706: McGLYNN | O706: McGARRY | R706: C. HOOD
A707: GOALKICKERS
A708: WEST MELBOURNE | C708: DEANE 2 | F708: ROOKE | H708: RYAN
A709: FOOTSCRAY | C709: E. STEPHENSON | F709: McGLYNN | H709: STRANGER
A711: RICHMOND | C711: 1 | D711: 2 | E711: =C711*6+D711 -> 8 | G711: 5 | H711: 8 | I711: =G711*6+H711 -> 38 | K711: 9 | L711: 14 | M711: =K711*6+L711 -> 68 | O711: 12 | P711: 17 | Q711: =O711*6+P711 -> 89 | S711: RICHMOND
A712: BRUNSWICK | C712: 0 | D712: 3 | E712: =C712*6+D712 -> 3 | G712: 1 | H712: 5 | I712: =G712*6+H712 -> 11 | K712: 1 | L712: 5 | M712: =K712*6+L712 -> 11 | O712: 1 | P712: 7 | Q712: =O712*6+P712 -> 13 | S712: CARTER
A713: BEST PLAYERS
A714: RICHMOND | C714: McCANCE | F714: WILLIAMS | I714: J. JUSTINS | L714: McNAIR | O714: RICHARDSON | R714: EDMONDS
A715: BRUNSWICK | C715: CLEMENTS | F715: McNAMARA | I715: CROWE | L715: COBURN | O715: CROWLEY | R715: CASEY
A716: GOALKICKERS
A717: RICHMOND | C717: McDONALD 5 | F717: JOHNSTONE 3 | I717: CARKEEK 2 | L717: MAINE | N717: EDMONDS
A718: BRUNSWICK | C718: LANDELLS
A720: BYE | E720: PORT MELBOURNE
A722: ROUND 18 | E722: 30TH AUGUST | I722: WEATHER | M722: FINE HAZY
C724: 1ST QTR | G724: 2ND QTR | K724: 3RD QTR | O724: FINAL | S724: PLAYED AT | X724: LADDER | AB724: ROUND | AD724: 18
S725: W'TON
A726: WILLIAMSTOWN | C726: 2 | D726: 1 | E726: =C726*6+D726 -> 13 | G726: 3 | H726: 1 | I726: =G726*6+H726 -> 19 | K726: 6 | L726: 2 | M726: =K726*6+L726 -> 38 | O726: 7 | P726: 3 | Q726: =O726*6+P726 -> 45 | S726: UMPIRE | W726: TEAM | X726: W | Y726: L | Z726: D | AA726: FOR | AB726: AGST | AC726: % | AD726: PTS
A727: PORT MELBOURNE | C727: 0 | D727: 5 | E727: =C727*6+D727 -> 5 | G727: 0 | H727: 5 | I727: =G727*6+H727 -> 5 | K727: 1 | L727: 7 | M727: =K727*6+L727 -> 13 | O727: 3 | P727: 9 | Q727: =O727*6+P727 -> 27 | S727: WATERS
A728: BEST PLAYERS | W728: RICHMOND | X728: 15 | Y728: 1 | Z728: 0 | AA728: 816 | AB728: 336 | AC728: 242.86 | AD728: 60
A729: WILLIAMSTOWN | C729: SPRINTHALL | F729: BREMNER | I729: LEGGE | K729: PRESCOTT | N729: MANDERSON | Q729: McKINLEY | W729: PORT MELBOURNE | X729: 14 | Y729: 2 | Z729: 0 | AA729: 774 | AB729: 456 | AC729: 169.74 | AD729: 56
A730: PORT MELBOURNE | C730: McGEE | F730: KEENAN | I730: JOHNSON | K730: GOTZ | N730: GARBUTT | Q730: BLISS | W730: NORTH MELBOURNE | X730: 10 | Y730: 5 | Z730: 1 | AA730: 683 | AB730: 544 | AC730: 125.55 | AD730: 42
A731: GOALKICKERS | W731: WILLIAMSTOWN | X731: 8 | Y731: 8 | Z731: 0 | AA731: 664 | AB731: 587 | AC731: 113.11754684838161 | AD731: 32
A732: WILLIAMSTOWN | C732: DICK 3 | F732: PRESCOTT 2 | I732: STANILAND | L732: WARREN
A733: PORT MELBOURNE | C733: McGEE | F733: BLISS | I733: HUTCHINSON | W733: FOOTSCRAY | X733: 7 | Y733: 9 | Z733: 0 | AA733: 671 | AB733: 583 | AC733: 115.09 | AD733: 28
W734: ESSENDON TOWN | X734: 5 | Y734: 10 | Z734: 1 | AA734: 485 | AB734: 722 | AC734: 67.174515235457065 | AD734: 22
A735: WEST MELBOURNE | C735: 2 | D735: 2 | E735: =C735*6+D735 -> 14 | G735: 4 | H735: 5 | I735: =G735*6+H735 -> 29 | K735: 7 | L735: 5 | M735: =K735*6+L735 -> 47 | O735: 8 | P735: 5 | Q735: =O735*6+P735 -> 53 | S735: EMCG | W735: PRAHRAN | X735: 5 | Y735: 11 | Z735: 0 | AA735: 604 | AB735: 819 | AC735: 73.748473748473742 | AD735: 20
A736: ESSENDON TOWN | C736: 0 | D736: 0 | E736: =C736*6+D736 -> 0 | G736: 0 | H736: 0 | I736: =G736*6+H736 -> 0 | K736: 0 | L736: 1 | M736: =K736*6+L736 -> 1 | O736: 2 | P736: 1 | Q736: =O736*6+P736 -> 13 | S736: CARTER | W736: WEST MELBOURNE | X736: 5 | Y736: 11 | Z736: 0 | AA736: 481 | AB736: 703 | AC736: 68.421052631578945 | AD736: 20
A737: BEST PLAYERS | W737: BRUNSWICK | X737: 2 | Y737: 14 | Z737: 0 | AA737: 484 | AB737: 912 | AC737: 53.07 | AD737: 8
A738: WEST MELBOURNE | C738: D. GREGORY | F738: MANSON | I738: H. GREGORY | K738: WILLIAMS | N738: H. LAXTON | Q738: F. GREGORY
A739: ESSENDON TOWN | C739: SWEATMAN | F739: RAMSEY | I739: GIRDWOOD | K739: BUSBRIDGE | N739: PAINE | Q739: SHELDON
A740: GOALKICKERS
A741: WEST MELBOURNE | C741: GOURLEY 3 | F741: RYAN 3 | I741: F. GREGORY | L741: DEANE
A742: ESSENDON TOWN | C742: BUSBRIDGE | F742: PAINE
A744: RICHMOND | C744: 1 | D744: 3 | E744: =C744*6+D744 -> 9 | G744: 3 | H744: 6 | I744: =G744*6+H744 -> 24 | K744: 7 | L744: 8 | M744: =K744*6+L744 -> 50 | O744: 7 | P744: 10 | Q744: =O744*6+P744 -> 52 | S744: TOORAK PARK
A745: PRAHRAN | C745: 2 | D745: 2 | E745: =C745*6+D745 -> 14 | G745: 2 | H745: 4 | I745: =G745*6+H745 -> 16 | K745: 2 | L745: 5 | M745: =K745*6+L745 -> 17 | O745: 3 | P745: 9 | Q745: =O745*6+P745 -> 27 | S745: McWHINNEY
A746: BEST PLAYERS
A747: RICHMOND | C747: CATHIE | F747: E. JUSTINS | I747: EDMONDS | K747: RICHARDSON | N747: GIBB | Q747: PIRRIE
A748: PRAHRAN | C748: PONTIN | F748: TRUSCOTT | I748: DUNNE | K748: G. BROWN | N748: T. BROWN | Q748: JONES
A749: GOALKICKERS
A750: RICHMOND | C750: JOHNSTONE 3 | G750: DUNCAN 2 | J750: CARKEEK | L750: McNAIR
A751: PRAHRAN | C751: G. BACKHOUSE 2 | G751: CROFT
A753: NORTH MELBOURNE | C753: 1 | D753: 1 | E753: =C753*6+D753 -> 7 | G753: 2 | H753: 5 | I753: =G753*6+H753 -> 17 | K753: 4 | L753: 6 | M753: =K753*6+L753 -> 30 | O753: 6 | P753: 10 | Q753: =O753*6+P753 -> 46 | S753: NORTH MELBOURNE
A754: BRUNSWICK | C754: 3 | D754: 1 | E754: =C754*6+D754 -> 19 | G754: 4 | H754: 2 | I754: =G754*6+H754 -> 26 | K754: 5 | L754: 3 | M754: =K754*6+L754 -> 33 | O754: 5 | P754: 4 | Q754: =O754*6+P754 -> 34 | S754: FRENCH
A755: BEST PLAYERS
A756: NORTH MELBOURNE | C756: JAMIESON | F756: NOONAN | I756: LONERGREN | L756: QUILLIGAN | O756: SYKES | R756: SMITH
A757: BRUNSWICK | C757: CLEMENTS | F757: McNAMARA | I757: J. JOHNSON | L757: G. JOHNSON | O757: LEEDS | R757: MULVANEY
A758: GOALKICKERS
A759: NORTH MELBOURNE | C759: KNEE 2 | F759: SMITH 2 | H759: KENNEDY | J759: ROLENT
A760: BRUNSWICK | C760: CLEMENTS 2 | F760: BLAINEY | H760: LEEDS | J760: MITCHELL
A762: BYE | E762: FOOTSCRAY
A764: REPRESENTATIVE GAME
H766: V F L | L766: V F A
C768: 1ST QTR | G768: 1 | H768: 3 | I768: =G769*6+H769 -> 9 | K768: 0 | L768: 3 | M768: =K769*6+L769 -> 3
C769: 2ND QTR | G769: 2 | H769: 6 | I769: =G770*6+H770 -> 18 | K769: 2 | L769: 3 | M769: =K770*6+L770 -> 15
C770: 3RD QTR | G770: 6 | H770: 11 | I770: =G771*6+H771 -> 47 | K770: 3 | L770: 3 | M770: =K771*6+L771 -> 21
C771: FINAL | G771: 9 | H771: 17 | I771: =G772*6+H772 -> 71 | K771: 4 | L771: 3 | M771: =K772*6+L772 -> 27