A1: Victorian Football Association
A2: Season 1903
A3: © Copyright Wal Williams | F3: First created: 2 August 2014
A4: Contact: joywalwi at gmail dot com | F4: Last updated: 2 August 2014 | W4: VFA Results and tables - Link to the main index page
A5: You are free to copy this document in whole or part provided that proper acknowledgement is given to the author. All rights reserved.
A7: ROUND 1 | E7: 2ND MAY | J7: WEATHER | S7: PLAYED AT
D8: 1ST QTR | H8: 2ND QTR | L8: 3RD QTR | P8: FINAL | S8: BRUNSWICK
A9: BRUNSWICK | C9: 2 | D9: 3 | E9: =C9*6+D9 -> 15 | G9: 6 | H9: 6 | I9: =G9*6+H9 -> 42 | K9: 7 | L9: 7 | M9: =K9*6+L9 -> 49 | O9: 8 | P9: 11 | Q9: =O9*6+P9 -> 59 | S9: UMPIRE | X9: LADDER | AB9: ROUND | AD9: 1
A10: PORT MELBOURNE | C10: 0 | D10: 3 | E10: =C10*6+D10 -> 3 | G10: 1 | H10: 5 | I10: =G10*6+H10 -> 11 | K10: 3 | L10: 12 | M10: =K10*6+L10 -> 30 | O10: 4 | P10: 12 | Q10: =O10*6+P10 -> 36 | S10: PYMM
A11: BEST PLAYERS | W11: TEAM | X11: W | Y11: L | Z11: D | AA11: FOR | AB11: AGST | AC11: % | AD11: PTS
A12: BRUNSWICK | C12: CROWE | F12: CLEMENTS | I12: ANDREWS | L12: BURKE | N12: STEVENSON
A13: PORT MELBOURNE | C13: CROCKETT | F13: P. GARBUTT | I13: J. GARBUTT | L13: O'BRIEN | N13: SICILY | Q13: DANIELS | W13: NORTH MELBOURNE | X13: 1 | Y13: 0 | Z13: 0 | AA13: 68 | AB13: 17 | AC13: 400 | AD13: 4
A14: GOALKICKERS | W14: WEST MELBOURNE | X14: 1 | Y14: 0 | Z14: 0 | AA14: 57 | AB14: 26 | AC14: 219.23076923076923 | AD14: 4
A15: BRUNSWICK | C15: CROWE 4 | F15: CLEMENTS 3 | I15: WALSH | W15: RICHMOND | X15: 1 | Y15: 0 | Z15: 0 | AA15: 43 | AB15: 25 | AC15: 172 | AD15: 4
A16: PORT MELBOURNE | C16: HARDEN | F16: CROCKETT | I16: HURLEY | W16: BRUNSWICK | X16: 1 | Y16: 0 | Z16: 0 | AA16: 59 | AB16: 36 | AC16: 163.88888888888889 | AD16: 4
A18: WEST MELBOURNE | C18: 3 | D18: 3 | E18: =C18*6+D18 -> 21 | G18: 3 | H18: 4 | I18: =G18*6+H18 -> 22 | K18: 7 | L18: 5 | M18: =K18*6+L18 -> 47 | O18: 8 | P18: 9 | Q18: =O18*6+P18 -> 57 | S18: TOORAK PARK | W18: FOOTSCRAY | X18: 1 | Y18: 0 | Z18: 0 | AA18: 58 | AB18: 41 | AC18: 141.46 | AD18: 4
A19: PRAHRAN | C19: 0 | D19: 2 | E19: =C19*6+D19 -> 2 | G19: 0 | H19: 5 | I19: =G19*6+H19 -> 5 | K19: 0 | L19: 6 | M19: =K19*6+L19 -> 6 | O19: 3 | P19: 8 | Q19: =O19*6+P19 -> 26 | S19: VICKERY | W19: WILLIAMSTOWN | X19: 0 | Y19: 1 | Z19: 0 | AA19: 41 | AB19: 58 | AC19: 70.69 | AD19: 0
A20: BEST PLAYERS | W20: PORT MELBOURNE | X20: 0 | Y20: 1 | Z20: 0 | AA20: 36 | AB20: 59 | AC20: 61.016949152542374 | AD20: 0
A21: WEST MELBOURNE | C21: PAGE | F21: D. GREGORY | I21: MINTO | K21: MADDEN | N21: RYAN | Q21: ROOKE | W21: PRESTON | X21: 0 | Y21: 1 | Z21: 0 | AA21: 25 | AB21: 43 | AC21: 58.139534883720927 | AD21: 0
A22: PRAHRAN | C22: DRAPER | F22: TRUSCOTT | I22: CHALMERS | K22: T. BROWN | N22: G. BROWN | Q22: ROBERTS | W22: PRAHRAN | X22: 0 | Y22: 1 | Z22: 0 | AA22: 26 | AB22: 57 | AC22: 45.614035087719301 | AD22: 0
A23: GOALKICKERS | W23: ESSENDON TOWN | X23: 0 | Y23: 1 | Z23: 0 | AA23: 17 | AB23: 68 | AC23: 25 | AD23: 0
A24: WEST MELBOURNE | C24: RYAN 4 | F24: MADDEN | H24: FEAVER | J24: FOX | K24: ROOKE
A25: PRAHRAN | C25: BACKHOUSE 2 | G25: ROWAN
A27: NORTH MELBOURNE | C27: 2 | D27: 2 | E27: =C27*6+D27 -> 14 | G27: 4 | H27: 4 | I27: =G27*6+H27 -> 28 | K27: 7 | L27: 5 | M27: =K27*6+L27 -> 47 | O27: 10 | P27: 8 | Q27: =O27*6+P27 -> 68 | S27: NORTH MELB
A28: ESSENDON TOWN | C28: 0 | D28: 0 | E28: =C28*6+D28 -> 0 | G28: 0 | H28: 1 | I28: =G28*6+H28 -> 1 | K28: 0 | L28: 4 | M28: =K28*6+L28 -> 4 | O28: 2 | P28: 5 | Q28: =O28*6+P28 -> 17 | S28: KENISON
A29: BEST PLAYERS
A30: NORTH MELBOURNE | C30: STEWART | F30: P. NOONAN | I30: D. NOONAN | L30: CARLTON | O30: GRAHAM | Q30: CONSIDINE
A31: ESSENDON TOWN | C31: BUSBRIDGE | F31: STANWORTH | I31: HUGHES | L31: CARROLL | O31: DAVIS | Q31: McCABE
A32: GOALKICKERS
A33: NORTH MELBOURNE | C33: P. NOONAN 2 | F33: CONSIDINE 2 | I33: KNEE | K33: ENGLISH | M33: MORRISON | O33: WHITFIELD | R33: KENNEDY | U33: BOYLE
A34: ESSENDON TOWN | C34: HUGHES | F34: BUSBRIDGE
A36: RICHMOND | C36: 1 | D36: 4 | E36: =C36*6+D36 -> 10 | G36: 2 | H36: 11 | I36: =G36*6+H36 -> 23 | K36: 3 | L36: 12 | M36: =K36*6+L36 -> 30 | O36: 5 | P36: 13 | Q36: =O36*6+P36 -> 43 | S36: RICHMOND
A37: PRESTON | C37: 0 | D37: 0 | E37: =C37*6+D37 -> 0 | G37: 0 | H37: 1 | I37: =G37*6+H37 -> 1 | K37: 2 | L37: 4 | M37: =K37*6+L37 -> 16 | O37: 3 | P37: 7 | Q37: =O37*6+P37 -> 25 | S37: O'LOUGHLIN
A38: BEST PLAYERS
A39: RICHMOND | C39: WILLIAMS | F39: E. JUSTINS | I39: EDMONDS | K39: T. WATSON | N39: GIBB | Q39: MAINE
A40: PRESTON | C40: S. HALL | F40: GATES | I40: P. HALL | K40: O'COCK | N40: RICHARDSON | Q40: DICKENS
A41: GOALKICKERS
A42: RICHMOND | C42: MAINE 2 | F42: CATHIE | H42: DUNCAN | K42: DAVEY
A43: PRESTON | C43: O'COCK | F43: PRATT | H43: CONNORS
A45: FOOTSCRAY | C45: 2 | D45: 2 | E45: =C45*6+D45 -> 14 | G45: 3 | H45: 5 | I45: =G45*6+H45 -> 23 | K45: 5 | L45: 10 | M45: =K45*6+L45 -> 40 | O45: 7 | P45: 16 | Q45: =O45*6+P45 -> 58 | S45: W'TOWN
A46: WILLIAMSTOWN | C46: 1 | D46: 3 | E46: =C46*6+D46 -> 9 | G46: 4 | H46: 4 | I46: =G46*6+H46 -> 28 | K46: 6 | L46: 4 | M46: =K46*6+L46 -> 40 | O46: 6 | P46: 5 | Q46: =O46*6+P46 -> 41 | S46: MURPHY
A47: BEST PLAYERS
A48: FOOTSCRAY | C48: E STEPHENSON | F48: GROVES | I48: WILLIAMS | L48: SERBY | N48: MARMO | Q48: DECOIT
A49: WILLIAMSTOWN | C49: LAWSON | F49: DICK | I49: HOUGHTON | L49: LEGGE | N49: VINEY | Q49: BAKER
A50: GOALKICKERS
A51: FOOTSCRAY | C51: E. STEPHENSON 3 | G51: W. STEPHENSON | K51: G. KRUSE
A52: WILLIAMSTOWN | C52: PRESCOTT 2 | F52: DICK 2 | H52: HOUGHTON | K52: MANDERSON
A54: ROUND 2 | E54: 9TH MAY | J54: WEATHER | N54: WINDY | S54: PLAYED AT
D55: 1ST QTR | H55: 2ND QTR | L55: 3RD QTR | P55: FINAL | S55: P'TON
A56: PRESTON | C56: 2 | D56: 4 | E56: =C56*6+D56 -> 16 | G56: 4 | H56: 5 | I56: =G56*6+H56 -> 29 | K56: 5 | L56: 5 | M56: =K56*6+L56 -> 35 | O56: 6 | P56: 7 | Q56: =O56*6+P56 -> 43 | S56: UMPIRE | X56: LADDER | AB56: ROUND | AD56: 2
A57: BRUNSWICK | C57: 1 | D57: 1 | E57: =C57*6+D57 -> 7 | G57: 3 | H57: 3 | I57: =G57*6+H57 -> 21 | K57: 4 | L57: 7 | M57: =K57*6+L57 -> 31 | O57: 5 | P57: 8 | Q57: =O57*6+P57 -> 38 | S57: KENNISON
A58: BEST PLAYERS | W58: TEAM | X58: W | Y58: L | Z58: D | AA58: FOR | AB58: AGST | AC58: % | AD58: PTS
A59: PRESTON | C59: RAFF | F59: HEWSON | I59: O'COCK | K59: PRATT | N59: P. HALL | Q59: GILBERT
A60: BRUNSWICK | C60: SHELLNACK | F60: CASEY | I60: CROWE | K60: CLEMENTS | N60: JOHNSON | Q60: BURKE | W60: NORTH MELBOURNE | X60: 2 | Y60: 0 | Z60: 0 | AA60: 114 | AB60: 48 | AC60: 237.5 | AD60: 8
A61: GOALKICKERS | W61: WEST MELBOURNE | X61: 2 | Y61: 0 | Z61: 0 | AA61: 116 | AB61: 51 | AC61: 227.45098039215685 | AD61: 8
A62: PRESTON | C62: P. HALL | F62: GILBERT | I62: PRATT | K62: O'COCK | N62: RAFF | W62: RICHMOND | X62: 1 | Y62: 1 | Z62: 0 | AA62: 68 | AB62: 50 | AC62: =AA62/AB62*100 -> 136 | AD62: 4
A63: BRUNSWICK | C63: CLEMENTS | F63: SHELLNACK | I63: WALSH | K63: JOHNSON | W63: BRUNSWICK | X63: 1 | Y63: 1 | Z63: 0 | AA63: 97 | AB63: 79 | AC63: 122.78481012658227 | AD63: 4
A65: NORTH MELBOURNE | C65: 1 | D65: 1 | E65: =C65*6+D65 -> 7 | G65: 3 | H65: 3 | I65: =G65*6+H65 -> 21 | K65: 5 | L65: 4 | M65: =K65*6+L65 -> 34 | O65: 7 | P65: 4 | Q65: =O65*6+P65 -> 46 | S65: FOOTSCRAY | W65: FOOTSCRAY | X65: 1 | Y65: 1 | Z65: 0 | AA65: 89 | AB65: 87 | AC65: 102.3 | AD65: 4
A66: FOOTSCRAY | C66: 1 | D66: 3 | E66: =C66*6+D66 -> 9 | G66: 1 | H66: 5 | I66: =G66*6+H66 -> 11 | K66: 2 | L66: 6 | M66: =K66*6+L66 -> 18 | O66: 4 | P66: 7 | Q66: =O66*6+P66 -> 31 | S66: BAIN | W66: PRESTON | X66: 1 | Y66: 1 | Z66: 0 | AA66: 60 | AB66: 74 | AC66: =AA66/AB66*100 -> 81.081081081081081 | AD66: 4
A67: BEST PLAYERS | W67: WILLIAMSTOWN | X67: 1 | Y67: 1 | Z67: 0 | AA67: 66 | AB67: 82 | AC67: 80.49 | AD67: 4
A68: NORTH MELBOURNE | C68: JAMIESON | F68: STEWART | I68: CONSIDINE | K68: GRAHAM | N68: P. NOONAN | Q68: CARLTON | W68: PRAHRAN | X68: 1 | Y68: 1 | Z68: 0 | AA68: 59 | AB68: 84 | AC68: 70.238095238095241 | AD68: 4
A69: FOOTSCRAY | C69: HINCH | F69: MARMO | I69: HARRIS | K69: DECOIT | N69: SERBY | Q69: HUGHES | W69: PORT MELBOURNE | X69: 0 | Y69: 2 | Z69: 0 | AA69: 61 | AB69: 118 | AC69: 51.694915254237287 | AD69: 0
A70: GOALKICKERS | W70: ESSENDON TOWN | X70: 0 | Y70: 2 | Z70: 0 | AA70: 44 | AB70: 101 | AC70: 43.564356435643568 | AD70: 0
A71: NORTH MELBOURNE | C71: CONSIDINE 2 | F71: P. NOONAN | I71: GRAHAM | K71: KENNEDY | N71: ENGLISH | P71: WHITFIELD
A72: FOOTSCRAY | C72: DECOIT 2 | F72: E. STEPHENSON | I72: HUGHES
A74: WEST MELBOURNE | C74: 2 | D74: 1 | E74: =C74*6+D74 -> 13 | G74: 3 | H74: 3 | I74: =G74*6+H74 -> 21 | K74: 4 | L74: 5 | M74: =K74*6+L74 -> 29 | O74: 8 | P74: 11 | Q74: =O74*6+P74 -> 59 | S74: NORTH MELB
A75: PORT MELBOURNE | C75: 0 | D75: 1 | E75: =C75*6+D75 -> 1 | G75: 0 | H75: 5 | I75: =G75*6+H75 -> 5 | K75: 3 | L75: 5 | M75: =K75*6+L75 -> 23 | O75: 3 | P75: 7 | Q75: =O75*6+P75 -> 25 | S75: MURPHY
A76: BEST PLAYERS
A77: WEST MELBOURNE | C77: PAGE | F77: WILLIAMS | I77: DEAN | K77: H. LAXTON | N77: H. GREGORY | Q77: ROOKE
A78: PORT MELBOURNE | C78: DANIELS | F78: O'BRIEN | I78: McGOWAN | K78: P. GARBUTT | N78: FENTON | Q78: J. GARBUTT
A79: GOALKICKERS
A80: WEST MELBOURNE | C80: RYAN 3 | F80: A. GREGORY 2 | I80: GOURLEY | K80: ROOKE | M80: BATTY
A81: PORT MELBOURNE | C81: McGOWN | F81: FENTON | I81: SICILY
A83: PRAHRAN | C83: 1 | D83: 2 | E83: =C83*6+D83 -> 8 | G83: 1 | H83: 7 | I83: =G83*6+H83 -> 13 | K83: 2 | L83: 7 | M83: =K83*6+L83 -> 19 | O83: 4 | P83: 9 | Q83: =O83*6+P83 -> 33 | S83: ESS
A84: ESSENDON TOWN | C84: 1 | D84: 0 | E84: =C84*6+D84 -> 6 | G84: 2 | H84: 1 | I84: =G84*6+H84 -> 13 | K84: 4 | L84: 1 | M84: =K84*6+L84 -> 25 | O84: 4 | P84: 3 | Q84: =O84*6+P84 -> 27 | S84: HARRISON
A85: BEST PLAYERS
A86: PRAHRAN | C86: ROBERTS | F86: T. BROWN | I86: G. BROWN | L86: CHALMERS | O86: DUPE | Q86: JONES
A87: ESSENDON TOWN | C87: BUSBRIDGE | F87: TESTER | I87: NIXON | L87: McCABE
A88: GOALKICKERS
A89: PRAHRAN | C89: G. BROWN 2 | F89: CROFT | H89: BACKHOUSE
A90: ESSENDON TOWN | C90: McCABE | F90: PAIN | H90: MARTIN | K90: HUGHES
A92: WILLIAMSTOWN | C92: 2 | D92: 5 | E92: =C92*6+D92 -> 17 | G92: 2 | H92: 5 | I92: =G92*6+H92 -> 17 | K92: 3 | L92: 7 | M92: =K92*6+L92 -> 25 | O92: 3 | P92: 7 | Q92: =O92*6+P92 -> 25 | S92: W'TOWN
A93: RICHMOND | C93: 0 | D93: 0 | E93: =C93*6+D93 -> 0 | G93: 1 | H93: 4 | I93: =G93*6+H93 -> 10 | K93: 1 | L93: 4 | M93: =K93*6+L93 -> 10 | O93: 3 | P93: 6 | Q93: =O93*6+P93 -> 24 | S93: TAYLOR
A94: BEST PLAYERS
A95: WILLIAMSTOWN | C95: HOUGHTON | F95: LEGGE | H95: WILLIAMS | K95: WILSHER | N95: MANDERSON | Q95: CALDWELL
A96: RICHMOND | C96: T. WATSON | F96: WILLIAMS | H96: ROBSON | K96: EDMONDS | N96: RUDD | Q96: JOHNSTON
A97: GOALKICKERS
A98: WILLIAMSTOWN | C98: HOUGHTON | F98: STANILAND | I98: LAWSON
A99: RICHMOND | C99: WADE
A101: ROUND 3 | E101: 16TH MAY | K101: WEATHER | P101: FINE | S101: PLAYED AT
D102: 1ST QTR | H102: 2ND QTR | L102: 3RD QTR | P102: FINAL | S102: NORTH MELB
A103: NORTH MELBOURNE | C103: 2 | D103: 2 | E103: =C103*6+D103 -> 14 | G103: 3 | H103: 3 | I103: =G103*6+H103 -> 21 | K103: 6 | L103: 6 | M103: =K103*6+L103 -> 42 | O103: 10 | P103: 9 | Q103: =O103*6+P103 -> 69 | S103: UMPIRE | X103: LADDER | AB103: ROUND | AD103: 3
A104: WEST MELBOURNE | C104: 1 | D104: 0 | E104: =C104*6+D104 -> 6 | G104: 4 | H104: 4 | I104: =G104*6+H104 -> 28 | K104: 6 | L104: 6 | M104: =K104*6+L104 -> 42 | O104: 7 | P104: 6 | Q104: =O104*6+P104 -> 48 | S104: KENNISON
A105: BEST PLAYERS | W105: TEAM | X105: W | Y105: L | Z105: D | AA105: FOR | AB105: AGST | AC105: % | AD105: PTS
A106: NORTH MELBOURNE | C106: CONSIDINE | F106: JAMIESON | I106: D. NOONAN | L106: MARTIN | N106: GRAHAM | Q106: P. NOONAN
A107: WEST MELBOURNE | C107: RIGBY | F107: H. LAXTON | I107: RYAN | L107: ROOKE | N107: DEAN | Q107: ARMSTRONG | W107: NORTH MELBOURNE | X107: 3 | Y107: 0 | Z107: 0 | AA107: 183 | AB107: 96 | AC107: 190.625 | AD107: 12
A108: GOALKICKERS | W108: RICHMOND | X108: 2 | Y108: 1 | Z108: 0 | AA108: 126 | AB108: 83 | AC108: =AA108/AB108*100 -> 151.80722891566265 | AD108: 8
A109: NORTH MELBOURNE | C109: CONSIDINE 3 | F109: WHITFIELD 3 | I109: WALSH 2 | K109: P. NOONAN | N109: KENNEDY | W109: BRUNSWICK | X109: 2 | Y109: 1 | Z109: 0 | AA109: 158 | AB109: 108 | AC109: 146.2962962962963 | AD109: 8
A110: WEST MELBOURNE | C110: RYAN 4 | F110: A. LAXTON | I110: POLLOCK | K110: ARMSTRONG | W110: WEST MELBOURNE | X110: 2 | Y110: 1 | Z110: 0 | AA110: 164 | AB110: 120 | AC110: 136.66666666666666 | AD110: 8
A112: PRESTON | C112: 0 | D112: 4 | E112: =C112*6+D112 -> 4 | G112: 2 | H112: 6 | I112: =G112*6+H112 -> 18 | K112: 3 | L112: 6 | M112: =K112*6+L112 -> 24 | O112: 5 | P112: 8 | Q112: =O112*6+P112 -> 38 | S112: P'TON | W112: PRESTON | X112: 2 | Y112: 1 | Z112: 0 | AA112: 98 | AB112: 100 | AC112: =AA112/AB112*100 -> 98 | AD112: 8
A113: WILLIAMSTOWN | C113: 0 | D113: 2 | E113: =C113*6+D113 -> 2 | G113: 0 | H113: 5 | I113: =G113*6+H113 -> 5 | K113: 1 | L113: 8 | M113: =K113*6+L113 -> 14 | O113: 3 | P113: 8 | Q113: =O113*6+P113 -> 26 | S113: PYNN | W113: PORT MELBOURNE | X113: 1 | Y113: 2 | Z113: 0 | AA113: 122 | AB113: 141 | AC113: 86.524822695035468 | AD113: 4
A114: BEST PLAYERS | W114: FOOTSCRAY | X114: 1 | Y114: 2 | Z114: 0 | AA114: 122 | AB114: 145 | AC114: 84.14 | AD114: 4
A115: PRESTON | C115: S. HALL | F115: DOULL | I115: DICKENS | K115: P.HALL | N115: GATES | Q115: RICHARDSON | W115: WILLIAMSTOWN | X115: 1 | Y115: 2 | Z115: 0 | AA115: 92 | AB115: 120 | AC115: 76.67 | AD115: 4
A116: WILLIAMSTOWN | C116: ROCHE | F116: MATTHEWS | I116: DAVIS | K116: BLEASBY | N116: VINEY | Q116: SPRINTHALL | W116: PRAHRAN | X116: 1 | Y116: 2 | Z116: 0 | AA116: 88 | AB116: 145 | AC116: 60.689655172413794 | AD116: 4
A117: GOALKICKERS | W117: ESSENDON TOWN | X117: 0 | Y117: 3 | Z117: 0 | AA117: 67 | AB117: 162 | AC117: 41.358024691358025 | AD117: 0
A118: PRESTON | C118: WHITE 2 | F118: GATES | H118: RICHARDSON | K118: GILBERT
A119: WILLIAMSTOWN | C119: MATTHEWS
A121: BRUNSWICK | C121: 2 | D121: 4 | E121: =C121*6+D121 -> 16 | G121: 3 | H121: 5 | I121: =G121*6+H121 -> 23 | K121: 7 | L121: 11 | M121: =K121*6+L121 -> 53 | O121: 8 | P121: 13 | Q121: =O121*6+P121 -> 61 | S121: BRUNSWICK
A122: PRAHRAN | C122: 0 | D122: 1 | E122: =C122*6+D122 -> 1 | G122: 3 | H122: 4 | I122: =G122*6+H122 -> 22 | K122: 4 | L122: 5 | M122: =K122*6+L122 -> 29 | O122: 4 | P122: 5 | Q122: =O122*6+P122 -> 29 | S122: BAIN
A123: BEST PLAYERS
A124: BRUNSWICK | C124: CLEMENTS | F124: MUDGE | I124: SHELLNACK | K124: CROWE | N124: CASEY | Q124: MULVANEY
A125: PRAHRAN | C125: ROBERTS | F125: CHALMERS | I125: DUPE | K125: JAMIESON | N125: G.BROWN | Q125: JONES
A126: GOALKICKERS
A127: BRUNSWICK | C127: WALSH 2 | F127: CLEMENTS 2 | I127: CROWE 2 | K127: MULVANEY | N127: HOLDEN
A128: PRAHRAN | C128: SMITH 2 | F128: DUPE | H128: JONES
A130: RICHMOND | C130: 1 | D130: 1 | E130: =C130*6+D130 -> 7 | G130: 4 | H130: 3 | I130: =G130*6+H130 -> 27 | K130: 6 | L130: 3 | M130: =K130*6+L130 -> 39 | O130: 9 | P130: 4 | Q130: =O130*6+P130 -> 58 | S130: RICHMOND
A131: FOOTSCRAY | C131: 2 | D131: 0 | E131: =C131*6+D131 -> 12 | G131: 3 | H131: 0 | I131: =G131*6+H131 -> 18 | K131: 4 | L131: 1 | M131: =K131*6+L131 -> 25 | O131: 5 | P131: 3 | Q131: =O131*6+P131 -> 33 | S131: MURPHY
A132: BEST PLAYERS
A133: RICHMOND | C133: GIBB | F133: WILLIAMS | I133: BOWNAS | L133: T.WATSON | O133: McCANCE | R133: RUDD
A134: FOOTSCRAY | C134: MARMO | F134: GRAHAM | I134: HOOD | L134: GROVES | O134: KRUSE | R134: W. STEPHENSON
A135: GOALKICKERS
A136: RICHMOND | C136: LYONS 2 | F136: MAINE 2 | H136: CATLIN | J136: RUDD | L136: DUNCAN | N136: GIBB | O136: ROBSON
A137: FOOTSCRAY | C137: W. STEPHENSON | G137: DECOIT | I137: SERBY | K137: MONTGARRETT | O137: BEAMISH
A139: PORT MELBOURNE | C139: 1 | D139: 3 | E139: =C139*6+D139 -> 9 | G139: 7 | H139: 4 | I139: =G139*6+H139 -> 46 | K139: 8 | L139: 4 | M139: =K139*6+L139 -> 52 | O139: 9 | P139: 7 | Q139: =O139*6+P139 -> 61 | S139: PORT MELB
A140: ESSENDON TOWN | C140: 1 | D140: 2 | E140: =C140*6+D140 -> 8 | G140: 1 | H140: 3 | I140: =G140*6+H140 -> 9 | K140: 2 | L140: 8 | M140: =K140*6+L140 -> 20 | O140: 2 | P140: 11 | Q140: =O140*6+P140 -> 23 | S140: O'LOUGHLIN
A141: BEST PLAYERS
A142: PORT MELBOURNE | C142: WILLIAMS | G142: PETTIT | J142: McGOWAN | M142: JOHNSON | O142: KENNEDY | R142: CURRIE
A143: ESSENDON TOWN | C143: W BUSBRIDGE | G143: DAVIES | J143: MARTIN
A144: GOALKICKERS
A145: PORT MELBOURNE | C145: KENNEDY 3 | G145: PETTIT 2 | J145: JOHNSON 2 | N145: O'BRIEN | Q145: HURLEY
A146: ESSENDON TOWN | C146: O'KEEFE | F146: MARTIN
A148: ROUND 4 | E148: 23RD MAY | J148: WEATHER | N148: STRONG NORTH WEST WIND CLOUDY
D149: 1ST QTR | H149: 2ND QTR | L149: 3RD QTR | P149: FINAL | S149: PLAYED AT
A150: NORTH MELBOURNE | C150: 3 | D150: 3 | E150: =C150*6+D150 -> 21 | G150: 3 | H150: 5 | I150: =G150*6+H150 -> 23 | K150: 5 | L150: 9 | M150: =K150*6+L150 -> 39 | O150: 5 | P150: 13 | Q150: =O150*6+P150 -> 43 | S150: NORTH MELB | X150: LADDER | AB150: ROUND | AD150: 4
A151: BRUNSWICK | C151: 0 | D151: 0 | E151: =C151*6+D151 -> 0 | G151: 0 | H151: 0 | I151: =G151*6+H151 -> 0 | K151: 0 | L151: 0 | M151: =K151*6+L151 -> 0 | O151: 1 | P151: 0 | Q151: =O151*6+P151 -> 6 | S151: UMPIRE
A152: BEST PLAYERS | S152: TAYLOR | W152: TEAM | X152: W | Y152: L | Z152: D | AA152: FOR | AB152: AGST | AC152: % | AD152: PTS
A153: NORTH MELBOURNE | C153: CONSIDINE | F153: KENNEDY | H153: HYNES | J153: BARNES | L153: D. NOONAN | O153: STEWART
A154: BRUNSWICK | C154: CLEMENTS | F154: TEMPLE | H154: STEVENSON | K154: CROWE | W154: NORTH MELBOURNE | X154: 4 | Y154: 0 | Z154: 0 | AA154: 226 | AB154: 102 | AC154: 221.56862745098039 | AD154: 16
A155: GOALKICKERS | W155: WEST MELBOURNE | X155: 3 | Y155: 1 | Z155: 0 | AA155: 244 | AB155: 128 | AC155: 190.625 | AD155: 12
A156: NORTH MELBOURNE | C156: CONSIDINE 2 | F156: KENNEDY | H156: WALSH | J156: ARBLASTER | W156: RICHMOND | X156: 3 | Y156: 1 | Z156: 0 | AA156: 155 | AB156: 99 | AC156: =AA156/AB156*100 -> 156.56565656565658 | AD156: 12
A157: BRUNSWICK | C157: CROWE | W157: FOOTSCRAY | X157: 2 | Y157: 2 | Z157: 0 | AA157: 171 | AB157: 158 | AC157: 108.23 | AD157: 8
A159: FOOTSCRAY | C159: 1 | D159: 2 | E159: =C159*6+D159 -> 8 | G159: 2 | H159: 3 | I159: =G159*6+H159 -> 15 | K159: 5 | L159: 5 | M159: =K159*6+L159 -> 35 | O159: 7 | P159: 7 | Q159: =O159*6+P159 -> 49 | S159: FOOTSCRAY | W159: BRUNSWICK | X159: 2 | Y159: 2 | Z159: 0 | AA159: 164 | AB159: 151 | AC159: 108.6092715231788 | AD159: 8
A160: PRESTON | C160: 0 | D160: 1 | E160: =C160*6+D160 -> 1 | G160: 0 | H160: 1 | I160: =G160*6+H160 -> 1 | K160: 0 | L160: 3 | M160: =K160*6+L160 -> 3 | O160: 1 | P160: 7 | Q160: =O160*6+P160 -> 13 | S160: HARRISON | W160: WILLIAMSTOWN | X160: 2 | Y160: 2 | Z160: 0 | AA160: 142 | AB160: 138 | AC160: 102.9 | AD160: 8
A161: BEST PLAYERS | W161: PRESTON | X161: 2 | Y161: 2 | Z161: 0 | AA161: 111 | AB161: 149 | AC161: =AA161/AB161*100 -> 74.496644295302019 | AD161: 8
A162: FOOTSCRAY | C162: HOOD | F162: MARMO | H162: HARRIS | J162: HINCH | M162: FLEWELLYN | P162: ACREMAN | W162: PORT MELBOURNE | X162: 1 | Y162: 3 | Z162: 0 | AA162: 140 | AB162: 191 | AC162: 73.298429319371721 | AD162: 4
A163: PRESTON | C163: DICKENS | F163: S.HALL | H163: GATES | J163: RICHARDSON | M163: PRATT | P163: GILBERT | W163: PRAHRAN | X163: 1 | Y163: 3 | Z163: 0 | AA163: 104 | AB163: 174 | AC163: 59.770114942528735 | AD163: 4
A164: GOALKICKERS | W164: ESSENDON TOWN | X164: 0 | Y164: 4 | Z164: 0 | AA164: 75 | AB164: 242 | AC164: 30.991735537190081 | AD164: 0
A165: FOOTSCRAY | C165: HUGHES 3 | F165: FLEWELLYN | I165: DREW | K165: MARMO | N165: MONTGARRETT
A166: PRESTON | C166: CLARKE
A168: WILLIAMSTOWN | C168: 4 | D168: 6 | E168: =C168*6+D168 -> 30 | G168: 5 | H168: 7 | I168: =G168*6+H168 -> 37 | K168: 5 | L168: 8 | M168: =K168*6+L168 -> 38 | O168: 7 | P168: 8 | Q168: =O168*6+P168 -> 50 | S168: PORT MELB
A169: PORT MELBOURNE | C169: 0 | D169: 0 | E169: =C169*6+D169 -> 0 | G169: 0 | H169: 2 | I169: =G169*6+H169 -> 2 | K169: 2 | L169: 2 | M169: =K169*6+L169 -> 14 | O169: 2 | P169: 6 | Q169: =O169*6+P169 -> 18 | S169: FRENCH
A170: BEST PLAYERS
A171: WILLIAMSTOWN | C171: DICK | F171: HOUGHTON | I171: SHEEHAN | L171: SPRINTHALL | O171: DONALDSON | R171: VINEY
A172: PORT MELBOURNE | C172: KNOX | F172: O'BRIEN | I172: WILLIAMS | L172: WARD | O172: KENNEDY | R172: SIEVERS
A173: GOALKICKERS
A174: WILLIAMSTOWN | C174: STANILAND 2 | F174: WILSHER | I174: DICK | K174: VINEY | M174: SHEEHAN | O174: HOUGHTON
A175: PORT MELBOURNE | C175: GARBUTT | F175: SIEVERS
A177: RICHMOND | C177: 1 | D177: 2 | E177: =C177*6+D177 -> 8 | G177: 2 | H177: 5 | I177: =G177*6+H177 -> 17 | K177: 3 | L177: 8 | M177: =K177*6+L177 -> 26 | O177: 3 | P177: 11 | Q177: =O177*6+P177 -> 29 | S177: TOORAK PARK
A178: PRAHRAN | C178: 0 | D178: 2 | E178: =C178*6+D178 -> 2 | G178: 1 | H178: 3 | I178: =G178*6+H178 -> 9 | K178: 2 | L178: 4 | M178: =K178*6+L178 -> 16 | O178: 2 | P178: 4 | Q178: =O178*6+P178 -> 16 | S178: VICARY
A179: BEST PLAYERS
A180: RICHMOND | C180: GIBB | F180: WILLIAMS | I180: VOLLUGI | L180: EDMONDS | O180: E. JUSTINS | R180: J. JUSTINS
A181: PRAHRAN | C181: ROBERTS | F181: T. BROWN | I181: G. BROWN | L181: DRAPER | O181: CHALMERS | R181: CROFT
A182: GOALKICKERS
A183: RICHMOND | C183: GAULT | F183: McCANCE | I183: GIBB
A184: PRAHRAN | C184: DUPE | F184: SMITH
A186: WEST MELBOURNE | C186: 4 | D186: 7 | E186: =C186*6+D186 -> 31 | G186: 5 | H186: 7 | I186: =G186*6+H186 -> 37 | K186: 10 | L186: 8 | M186: =K186*6+L186 -> 68 | O186: 12 | P186: 8 | Q186: =O186*6+P186 -> 80 | S186: ESS
A187: ESSENDON TOWN | C187: 0 | D187: 0 | E187: =C187*6+D187 -> 0 | G187: 2 | H187: 0 | I187: =G187*6+H187 -> 12 | K187: 2 | L187: 0 | M187: =K187*6+L187 -> 12 | O187: 2 | P187: 2 | Q187: =O187*6+P187 -> 14 | S187: BAIN
A188: BEST PLAYERS
A189: WEST MELBOURNE | C189: H. GREGORY | F189: ROOKE | I189: POOLE | L189: A. LAXTON | P189: DEAN | S189: F. GREGORY
A190: ESSENDON TOWN | C190: BUSBRIDGE | F190: KENNEDY | I190: PAINE | L190: STANWORTH | P190: SWEATMAN | S190: MARTIN
A191: GOALKICKERS
A192: WEST MELBOURNE | C192: RYAN 4 | F192: ROOKE 2 | H192: F. GREGORY 2 | K192: A. LAXTON | N192: ARMSTRONG | Q192: DEAN | S192: POOLE
A193: ESSENDON TOWN | C193: BUSBRIDGE | F193: PAINE
A195: ROUND 5 | E195: 30TH MAY | J195: WEATHER | N195: FINE
D196: 1ST QTR | H196: 2ND QTR | L196: 3RD QTR | P196: FINAL | S196: PLAYED AT
A197: WEST MELBOURNE | C197: 2 | D197: 2 | E197: =C197*6+D197 -> 14 | G197: 5 | H197: 2 | I197: =G197*6+H197 -> 32 | K197: 6 | L197: 3 | M197: =K197*6+L197 -> 39 | O197: 7 | P197: 4 | Q197: =O197*6+P197 -> 46 | S197: NORTH MELB | X197: LADDER | AB197: ROUND | AD197: 5
A198: BRUNSWICK | C198: 0 | D198: 2 | E198: =C198*6+D198 -> 2 | G198: 3 | H198: 4 | I198: =G198*6+H198 -> 22 | K198: 5 | L198: 6 | M198: =K198*6+L198 -> 36 | O198: 6 | P198: 6 | Q198: =O198*6+P198 -> 42 | S198: UMPIRE
A199: BEST PLAYERS | S199: FRANCIS | W199: TEAM | X199: W | Y199: L | Z199: D | AA199: FOR | AB199: AGST | AC199: % | AD199: PTS
A200: WEST MELBOURNE | C200: RYAN | F200: MADDEN | H200: D. GREGORY | K200: H. LAXTON | N200: ROLENT | Q200: GOURLEY
A201: BRUNSWICK | C201: CLEMENTS | F201: JOHNSON | H201: STEVENSON | K201: TEMPLE | N201: COWLEY | Q201: MULVANEY | W201: NORTH MELBOURNE | X201: 4 | Y201: 0 | Z201: 1 | AA201: 271 | AB201: 147 | AC201: 184.35374149659864 | AD201: 18
A202: GOALKICKERS | W202: RICHMOND | X202: 4 | Y202: 1 | Z202: 0 | AA202: 228 | AB202: 105 | AC202: =AA202/AB202*100 -> 217.14285714285714 | AD202: 16
A203: WEST MELBOURNE | C203: RYAN 4 | F203: ARMSTRONG 2 | I203: A. LAXTON | W203: WEST MELBOURNE | X203: 4 | Y203: 1 | Z203: 0 | AA203: 290 | AB203: 176 | AC203: 164.77 | AD203: 16
A204: BRUNSWICK | C204: CLEMENTS 2 | F204: TEMPLE | H204: CROWE | J204: JOHNSON | W204: FOOTSCRAY | X204: 3 | Y204: 2 | Z204: 0 | AA204: 261 | AB204: 176 | AC204: 148.3 | AD204: 12
A206: WILLIAMSTOWN | C206: 3 | D206: 3 | E206: =C206*6+D206 -> 21 | G206: 3 | H206: 5 | I206: =G206*6+H206 -> 23 | K206: 5 | L206: 8 | M206: =K206*6+L206 -> 38 | O206: 6 | P206: 9 | Q206: =O206*6+P206 -> 45 | S206: W'TOWN | W206: PRESTON | X206: 3 | Y206: 2 | Z206: 0 | AA206: 170 | AB206: 185 | AC206: =AA206/AB206*100 -> 91.891891891891902 | AD206: 12
A207: NORTH MELBOURNE | C207: 1 | D207: 2 | E207: =C207*6+D207 -> 8 | G207: 2 | H207: 7 | I207: =G207*6+H207 -> 19 | K207: 5 | L207: 8 | M207: =K207*6+L207 -> 38 | O207: 6 | P207: 9 | Q207: =O207*6+P207 -> 45 | S207: BAIN | W207: WILLIAMSTOWN | X207: 2 | Y207: 2 | Z207: 1 | AA207: 187 | AB207: 183 | AC207: 102.19 | AD207: 10
A208: BEST PLAYERS | W208: BRUNSWICK | X208: 2 | Y208: 3 | Z208: 0 | AA208: 206 | AB208: 197 | AC208: 104.56852791878173 | AD208: 8
A209: WILLIAMSTOWN | C209: McKINLEY | F209: LAWSON | I209: LEGGE | K209: SHEEHAN | N209: WILSHER | Q209: VINEY | W209: PRAHRAN | X209: 1 | Y209: 4 | Z209: 0 | AA209: 140 | AB209: 243 | AC209: 57.613168724279838 | AD209: 4
A210: NORTH MELBOURNE | C210: D. NOONAN | F210: P. NOONAN | I210: KENNEDY | K210: GRAHAM | N210: LONDERGREN | Q210: MORRISON | W210: PORT MELBOURNE | X210: 1 | Y210: 4 | Z210: 0 | AA210: 158 | AB210: 281 | AC210: 56.227758007117437 | AD210: 4
A211: GOALKICKERS | W211: ESSENDON TOWN | X211: 0 | Y211: 5 | Z211: 0 | AA211: 87 | AB211: 315 | AC211: 27.62 | AD211: 0
A212: WILLIAMSTOWN | C212: PRESCOTT 2 | F212: STANILAND 2 | I212: SHEEHAN 2
A213: NORTH MELBOURNE | C213: MILNE 2 | F213: WHITFIELD | I213: HALL | K213: P. NOONAN | N213: CONSIDINE
A215: FOOTSCRAY | C215: 3 | D215: 1 | E215: =C215*6+D215 -> 19 | G215: 7 | H215: 5 | I215: =G215*6+H215 -> 47 | K215: 9 | L215: 7 | M215: =K215*6+L215 -> 61 | O215: 13 | P215: 12 | Q215: =O215*6+P215 -> 90 | S215: FOOTSCRAY
A216: PORT MELBOURNE | C216: 0 | D216: 1 | E216: =C216*6+D216 -> 1 | G216: 1 | H216: 3 | I216: =G216*6+H216 -> 9 | K216: 1 | L216: 5 | M216: =K216*6+L216 -> 11 | O216: 2 | P216: 6 | Q216: =O216*6+P216 -> 18 | S216: KENNISON
A217: BEST PLAYERS
A218: FOOTSCRAY | C218: HINCH | F218: MONTGARRETT | I218: MARMO | K218: WILLIAMS | N218: GRAHAM | Q218: KRUSE
A219: PORT MELBOURNE | C219: MALONEY | F219: YATES | I219: P. GARBUTT | K219: KNOX | N219: BARTLETT | Q219: KENNEDY
A220: GOALKICKERS
A221: FOOTSCRAY | C221: E. STEPHENSON 7 | G221: HUGHES 3 | J221: WILLIAMS 2 | M221: ACREMAN
A222: PORT MELBOURNE | C222: McGOWAN 2
A224: PRESTON | C224: 2 | D224: 3 | E224: =C224*6+D224 -> 15 | G224: 4 | H224: 4 | I224: =G224*6+H224 -> 28 | K224: 4 | L224: 8 | M224: =K224*6+L224 -> 32 | O224: 9 | P224: 15 | Q224: =O224*6+P224 -> 69 | S224: P'TON
A225: PRAHRAN | C225: 1 | D225: 0 | E225: =C225*6+D225 -> 6 | G225: 4 | H225: 3 | I225: =G225*6+H225 -> 27 | K225: 4 | L225: 4 | M225: =K225*6+L225 -> 28 | O225: 5 | P225: 6 | Q225: =O225*6+P225 -> 36 | S225: TAYLOR
A226: BEST PLAYERS
A227: PRESTON | C227: COOPER | F227: GILBERT | I227: PRATT | K227: J. KNELL | N227: S. HALL | P227: RICHARDSON
A228: PRAHRAN | C228: T. BROWN | F228: G. BROWN | I228: CROFT | K228: JAMIESON | N228: RUDD | P228: DRAPER
A229: GOALKICKERS
A230: PRESTON | C230: RICHARDSON 3 | G230: COOPER 2 | J230: CLARKE | L230: INWORTH | N230: PRATT | P230: GILBERT
A231: PRAHRAN | C231: G. BROWN 3 | F231: BACKHOUSE | I231: TENBRICK
A233: RICHMOND | C233: 3 | D233: 3 | E233: =C233*6+D233 -> 21 | G233: 6 | H233: 6 | I233: =G233*6+H233 -> 42 | K233: 6 | L233: 10 | M233: =K233*6+L233 -> 46 | O233: 10 | P233: 13 | Q233: =O233*6+P233 -> 73 | S233: RICHMOND
A234: ESSENDON TOWN | C234: 0 | D234: 2 | E234: =C234*6+D234 -> 2 | G234: 0 | H234: 3 | I234: =G234*6+H234 -> 3 | K234: 0 | L234: 5 | M234: =K234*6+L234 -> 5 | O234: 0 | P234: 6 | Q234: =O234*6+P234 -> 6 | S234: O'LOUGHLIN
A235: BEST PLAYERS
A236: RICHMOND | C236: VOLLUGI | F236: WILLIAMS | I236: BOWNAS | L236: T. WATSON | O236: HALL | Q236: ROBSON
A237: ESSENDON TOWN | C237: SWEATMAN | F237: GIRDWOOD | I237: BUSBRIDGE | L237: McCABE | O237: CARROLL | Q237: O'KEEFE
A238: GOALKICKERS
A239: RICHMOND | C239: MAINE 3 | F239: CATLIN 2 | I239: JOHNSON 2 | L239: LYONS | N239: WADE | P239: VOLLUGI
A240: ESSENDON TOWN
A242: ROUND 6 | E242: 6TH JUNE | J242: WEATHER | N242: LIGHT NORTH WIND OVERCAST
D243: 1ST QTR | H243: 2ND QTR | L243: 3RD QTR | P243: FINAL | S243: PLAYED AT
A244: NORTH MELBOURNE | C244: 0 | D244: 3 | E244: =C244*6+D244 -> 3 | G244: 3 | H244: 7 | I244: =G244*6+H244 -> 25 | K244: 4 | L244: 9 | M244: =K244*6+L244 -> 33 | O244: 7 | P244: 10 | Q244: =O244*6+P244 -> 52 | S244: P'TON | X244: LADDER | AB244: ROUND | AD244: 6
A245: PRESTON | C245: 2 | D245: 5 | E245: =C245*6+D245 -> 17 | G245: 3 | H245: 5 | I245: =G245*6+H245 -> 23 | K245: 3 | L245: 6 | M245: =K245*6+L245 -> 24 | O245: 5 | P245: 10 | Q245: =O245*6+P245 -> 40 | S245: UMPIRE
A246: BEST PLAYERS | S246: FRENCH | W246: TEAM | X246: W | Y246: L | Z246: D | AA246: FOR | AB246: AGST | AC246: % | AD246: PTS
A247: NORTH MELBOURNE | C247: LONDERGREN | F247: P. NOONAN | I247: D. NOONAN | K247: KENNEDY | N247: MILNE | Q247: MORRISON
A248: PRESTON | C248: S. HALL | F248: GILBERT | I248: COOPER | K248: J. KNELL | N248: DICKENS | Q248: DOULL | W248: NORTH MELBOURNE | X248: 5 | Y248: 0 | Z248: 1 | AA248: 323 | AB248: 187 | AC248: 172.72727272727272 | AD248: 22
A249: GOALKICKERS | W249: RICHMOND | X249: 5 | Y249: 1 | Z249: 0 | AA249: 275 | AB249: 135 | AC249: =AA249/AB249*100 -> 203.70370370370372 | AD249: 20
A250: NORTH MELBOURNE | C250: KENNEDY 2 | F250: MILNE 2 | H250: MORRISON | K250: GRAHAM | N250: LONDERGREN | W250: WEST MELBOURNE | X250: 5 | Y250: 1 | Z250: 0 | AA250: 316 | AB250: 193 | AC250: 163.73 | AD250: 20
A251: PRESTON | C251: CLARKE | F251: RICHARDSON | I251: COOPER | K251: GATES | N251: PRATT | W251: FOOTSCRAY | X251: 4 | Y251: 2 | Z251: 0 | AA251: 337 | AB251: 228 | AC251: 147.81 | AD251: 16
A253: WEST MELBOURNE | C253: 2 | D253: 2 | E253: =C253*6+D253 -> 14 | G253: 2 | H253: 3 | I253: =G253*6+H253 -> 15 | K253: 3 | L253: 7 | M253: =K253*6+L253 -> 25 | O253: 3 | P253: 8 | Q253: =O253*6+P253 -> 26 | S253: NORTH MELB | W253: BRUNSWICK | X253: 3 | Y253: 3 | Z253: 0 | AA253: 270 | AB253: 220 | AC253: 122.72727272727273 | AD253: 12
A254: WILLIAMSTOWN | C254: 1 | D254: 0 | E254: =C254*6+D254 -> 6 | G254: 1 | H254: 2 | I254: =G254*6+H254 -> 8 | K254: 1 | L254: 5 | M254: =K254*6+L254 -> 11 | O254: 2 | P254: 5 | Q254: =O254*6+P254 -> 17 | S254: MURPHY | W254: PRESTON | X254: 3 | Y254: 3 | Z254: 0 | AA254: 210 | AB254: 237 | AC254: =AA254/AB254*100 -> 88.60759493670885 | AD254: 12
A255: BEST PLAYERS | W255: WILLIAMSTOWN | X255: 2 | Y255: 3 | Z255: 1 | AA255: 204 | AB255: 209 | AC255: 97.61 | AD255: 10
A256: WEST MELBOURNE | C256: MADDEN | F256: ROLENT | I256: H. LAXTON | K256: H. GREGORY | N256: WILLIAMS | Q256: GOURLEY | W256: PRAHRAN | X256: 1 | Y256: 5 | Z256: 0 | AA256: 192 | AB256: 319 | AC256: 60.188087774294672 | AD256: 4
A257: WILLIAMSTOWN | C257: WILSHER | F257: SPRINTHALL | I257: DAVIS | K257: WILLIAMS | N257: LEGGE | Q257: MANDERSON | W257: PORT MELBOURNE | X257: 1 | Y257: 5 | Z257: 0 | AA257: 188 | AB257: 328 | AC257: 57.31707317073171 | AD257: 4
A258: GOALKICKERS | W258: ESSENDON TOWN | X258: 0 | Y258: 6 | Z258: 0 | AA258: 110 | AB258: 379 | AC258: 29.02 | AD258: 0
A259: WEST MELBOURNE | C259: WILLIAMS | F259: RYAN | I259: A. LAXTON
A260: WILLIAMSTOWN | C260: DICK | F260: McKINLEY
A262: FOOTSCRAY | C262: 3 | D262: 3 | E262: =C262*6+D262 -> 21 | G262: 5 | H262: 5 | I262: =G262*6+H262 -> 35 | K262: 10 | L262: 9 | M262: =K262*6+L262 -> 69 | O262: 11 | P262: 10 | Q262: =O262*6+P262 -> 76 | S262: TOORAK PARK
A263: PRAHRAN | C263: 0 | D263: 0 | E263: =C263*6+D263 -> 0 | G263: 3 | H263: 3 | I263: =G263*6+H263 -> 21 | K263: 5 | L263: 4 | M263: =K263*6+L263 -> 34 | O263: 7 | P263: 10 | Q263: =O263*6+P263 -> 52 | S263: TAYLOR
A264: BEST PLAYERS
A265: FOOTSCRAY | C265: MONTGARRETT | F265: MARMO | I265: JACKSON | L265: E. STEPHENSON | O265: FLEWELLYN | R265: GROVES
A266: PRAHRAN | C266: WESTBROOK | F266: T. BROWN | I266: G. BROWN | L266: ROBERTS | O266: CHALMERS | R266: RUDD
A267: GOALKICKERS
A268: FOOTSCRAY | C268: FLEWELLYN 4 | F268: E. STEPHENSON 2 | J268: DECOIT 2 | L268: MCCARROLL | O268: MONTGARRETT | S268: HUGHES
A269: PRAHRAN | C269: BACKHOUSE 2 | G269: CROFT 2 | J269: JONES 2 | L269: G. BROWN
A271: RICHMOND | C271: 3 | D271: 2 | E271: =C271*6+D271 -> 20 | G271: 6 | H271: 3 | I271: =G271*6+H271 -> 39 | K271: 7 | L271: 5 | M271: =K271*6+L271 -> 47 | O271: 7 | P271: 5 | Q271: =O271*6+P271 -> 47 | S271: P.M.
A272: PORT MELBOURNE | C272: 2 | D272: 0 | E272: =C272*6+D272 -> 12 | G272: 2 | H272: 1 | I272: =G272*6+H272 -> 13 | K272: 4 | L272: 3 | M272: =K272*6+L272 -> 27 | O272: 4 | P272: 6 | Q272: =O272*6+P272 -> 30 | S272: BAIN
A273: BEST PLAYERS
A274: RICHMOND | C274: BOWNAS | F274: EDMONDS | I274: T. WATSON | L274: GIBB | O274: LYONS | R274: ROBSON
A275: PORT MELBOURNE | C275: DANIELS | F275: P. GARBUTT | I275: BARTLETT | L275: McGOWAN | O275: McDONALD | R275: PETTIT
A276: GOALKICKERS
A277: RICHMOND | C277: MAINE 3 | F277: RUDD 2 | I277: HALL | K277: LYONS
A278: PORT MELBOURNE | C278: CROFT | F278: McDONALD | J278: BARTLETT
A280: BRUNSWICK | C280: 2 | D280: 2 | E280: =C280*6+D280 -> 14 | G280: 3 | H280: 4 | I280: =G280*6+H280 -> 22 | K280: 5 | L280: 8 | M280: =K280*6+L280 -> 38 | O280: 9 | P280: 10 | Q280: =O280*6+P280 -> 64 | S280: ESS
A281: ESSENDON TOWN | C281: 1 | D281: 2 | E281: =C281*6+D281 -> 8 | G281: 1 | H281: 4 | I281: =G281*6+H281 -> 10 | K281: 1 | L281: 5 | M281: =K281*6+L281 -> 11 | O281: 3 | P281: 5 | Q281: =O281*6+P281 -> 23 | S281: KENNISON
A282: BEST PLAYERS
A283: BRUNSWICK | C283: CLEMENTS | F283: SHELLNACK | I283: ROBERTSON | M283: WALSH | P283: CROWE | S283: BRAID
A284: ESSENDON TOWN | C284: SHELDON | F284: SWEATMAN | I284: BUSBRIDGE | M284: CARROLL | P284: MARTIN
A285: GOALKICKERS
A286: BRUNSWICK | C286: CLEMENTS 4 | F286: BRAID 3 | I286: ROBERTSON
A287: ESSENDON TOWN | C287: MARTIN | F287: BUSBRIDGE | I287: DAVIS
A289: ROUND 7 | E289: 13TH JUNE | J289: WEATHER | N289: CALM CLOUDY | S289: PLAYED AT
D290: 1ST QTR | H290: 2ND QTR | L290: 3RD QTR | P290: FINAL | S290: FOOTSCRAY
A291: FOOTSCRAY | C291: 1 | D291: 3 | E291: =C291*6+D291 -> 9 | G291: 1 | H291: 4 | I291: =G291*6+H291 -> 10 | K291: 3 | L291: 7 | M291: =K291*6+L291 -> 25 | O291: 3 | P291: 7 | Q291: =O291*6+P291 -> 25 | S291: UMPIRE | X291: LADDER | AB291: ROUND | AD291: 7
A292: WEST MELBOURNE | C292: 0 | D292: 0 | E292: =C292*6+D292 -> 0 | G292: 0 | H292: 1 | I292: =G292*6+H292 -> 1 | K292: 0 | L292: 3 | M292: =K292*6+L292 -> 3 | O292: 3 | P292: 4 | Q292: =O292*6+P292 -> 22 | S292: BAIN
A293: BEST PLAYERS | W293: TEAM | X293: W | Y293: L | Z293: D | AA293: FOR | AB293: AGST | AC293: % | AD293: PTS
A294: FOOTSCRAY | C294: MARMO | F294: HINCH | H294: HARRIS | J294: CALDWELL | M294: WILLIAMS | P294: HUGHES
A295: WEST MELBOURNE | C295: ARMSTRONG | F295: RYAN | H295: RIGBY | J295: ROLENT | M295: QUILLIGAN | P295: POOLE | W295: NORTH MELBOURNE | X295: 6 | Y295: 0 | Z295: 1 | AA295: 353 | AB295: 206 | AC295: 171.35922330097088 | AD295: 26
A296: GOALKICKERS | W296: RICHMOND | X296: 6 | Y296: 1 | Z296: 0 | AA296: 297 | AB296: 147 | AC296: =AA296/AB296*100 -> 202.0408163265306 | AD296: 24
A297: FOOTSCRAY | C297: MONTGARRETT | G297: DECOIT | J297: E. STEPHENSON | W297: WEST MELBOURNE | X297: 5 | Y297: 2 | Z297: 0 | AA297: 338 | AB297: 218 | AC297: 155.05 | AD297: 20
A298: WEST MELBOURNE | C298: F. GREGORY | G298: ARMSTRONG | J298: RYAN | W298: FOOTSCRAY | X298: 5 | Y298: 2 | Z298: 0 | AA298: 362 | AB298: 250 | AC298: 144.8 | AD298: 20
A300: RICHMOND | C300: 1 | D300: 1 | E300: =C300*6+D300 -> 7 | G300: 2 | H300: 2 | I300: =G300*6+H300 -> 14 | K300: 3 | L300: 3 | M300: =K300*6+L300 -> 21 | O300: 3 | P300: 4 | Q300: =O300*6+P300 -> 22 | S300: BRUNSWICK | W300: WILLIAMSTOWN | X300: 3 | Y300: 3 | Z300: 1 | AA300: 270 | AB300: 227 | AC300: 118.94 | AD300: 14
A301: BRUNSWICK | C301: 0 | D301: 2 | E301: =C301*6+D301 -> 2 | G301: 1 | H301: 4 | I301: =G301*6+H301 -> 10 | K301: 1 | L301: 4 | M301: =K301*6+L301 -> 10 | O301: 1 | P301: 6 | Q301: =O301*6+P301 -> 12 | S301: MURPHY | W301: BRUNSWICK | X301: 3 | Y301: 4 | Z301: 0 | AA301: 282 | AB301: 242 | AC301: 116.52892561983471 | AD301: 12
A302: BEST PLAYERS | W302: PRESTON | X302: 3 | Y302: 4 | Z302: 0 | AA302: 239 | AB302: 289 | AC302: =AA302/AB302*100 -> 82.698961937716263 | AD302: 12
A303: RICHMOND | C303: BOWNAS | F303: E. JUSTINS | I303: EDMONDS | K303: WILLIAMS | N303: T. WATSON | Q303: VOLLUGI | W303: PORT MELBOURNE | X303: 2 | Y303: 5 | Z303: 0 | AA303: 240 | AB303: 357 | AC303: 67.226890756302524 | AD303: 8
A304: BRUNSWICK | C304: CASEY | F304: COWLEY | I304: CLEMENTS | K304: BRAID | N304: ROBERTSON | Q304: SHELLNACK | W304: PRAHRAN | X304: 1 | Y304: 6 | Z304: 0 | AA304: 211 | AB304: 349 | AC304: 60.458452722063036 | AD304: 4
A305: GOALKICKERS | W305: ESSENDON TOWN | X305: 0 | Y305: 7 | Z305: 0 | AA305: 128 | AB305: 445 | AC305: 28.76 | AD305: 0
A306: RICHMOND | C306: MAINE 2 | F306: CATLIN
A307: BRUNSWICK | C307: ROBERTSON
A309: NORTH MELBOURNE | C309: 0 | D309: 4 | E309: =C309*6+D309 -> 4 | G309: 0 | H309: 7 | I309: =G309*6+H309 -> 7 | K309: 2 | L309: 9 | M309: =K309*6+L309 -> 21 | O309: 3 | P309: 12 | Q309: =O309*6+P309 -> 30 | S309: NORTH MELB
A310: PRAHRAN | C310: 0 | D310: 0 | E310: =C310*6+D310 -> 0 | G310: 1 | H310: 3 | I310: =G310*6+H310 -> 9 | K310: 2 | L310: 6 | M310: =K310*6+L310 -> 18 | O310: 2 | P310: 7 | Q310: =O310*6+P310 -> 19 | S310: O'LOUGHLIN
A311: BEST PLAYERS
A312: NORTH MELBOURNE | C312: LONDERGREN | F312: CARLTON | I312: P. NOONAN | L312: O'BRIEN | O312: WHITFIELD | R312: STEWART
A313: PRAHRAN | C313: T. BROWN | F313: TRUSCOTT | I313: WESTBROOK | L313: G. BROWN | O313: DUPE | R313: FLYNN
A314: GOALKICKERS
A315: NORTH MELBOURNE | C315: KENNEDY 2 | F315: O'BRIEN
A316: PRAHRAN | C316: G. BROWN | F316: JONES
A318: PORT MELBOURNE | C318: 2 | D318: 2 | E318: =C318*6+D318 -> 14 | G318: 5 | H318: 4 | I318: =G318*6+H318 -> 34 | K318: 6 | L318: 4 | M318: =K318*6+L318 -> 40 | O318: 8 | P318: 4 | Q318: =O318*6+P318 -> 52 | S318: PORT MELB
A319: PRESTON | C319: 1 | D319: 4 | E319: =C319*6+D319 -> 10 | G319: 1 | H319: 4 | I319: =G319*6+H319 -> 10 | K319: 4 | L319: 4 | M319: =K319*6+L319 -> 28 | O319: 4 | P319: 5 | Q319: =O319*6+P319 -> 29 | S319: KENNISON
A320: BEST PLAYERS
A321: PORT MELBOURNE | C321: WARD | F321: YATES | I321: BARTLETT | L321: KNOX | O321: WILLLIAMS | R321: McDONALD
A322: PRESTON | C322: J. KNELL | F322: S. HALL | I322: PRATT | L322: WHITEOAK | O322: GILBERT | R322: WHITE
A323: GOALKICKERS
A324: PORT MELBOURNE | C324: CROFT 5 | F324: STIVEY 2 | I324: KENNEDY
A325: PRESTON | C325: S. HALL | F325: HEWSON | I325: RAFF | K325: RICHARDSON
A327: WILLIAMSTOWN | C327: 2 | D327: 2 | E327: =C327*6+D327 -> 14 | G327: 5 | H327: 7 | I327: =G327*6+H327 -> 37 | K327: 8 | L327: 8 | M327: =K327*6+L327 -> 56 | O327: 9 | P327: 12 | Q327: =O327*6+P327 -> 66 | S327: W'TOWN
A328: ESSENDON TOWN | C328: 0 | D328: 2 | E328: =C328*6+D328 -> 2 | G328: 1 | H328: 2 | I328: =G328*6+H328 -> 8 | K328: 2 | L328: 4 | M328: =K328*6+L328 -> 16 | O328: 2 | P328: 6 | Q328: =O328*6+P328 -> 18 | S328: PYMM
A329: BEST PLAYERS
A330: WILLIAMSTOWN | C330: SPRINTHALL | G330: McKINLEY | J330: LAWSON | M330: DICK | O330: HOUGHTON | R330: LEGGE
A331: ESSENDON TOWN | C331: STANWORTH | G331: BUSBRIDGE | J331: SWEATMAN | M331: GIRDWOOD | O331: SHELDON | R331: WATSON
A332: GOALKICKERS
A333: WILLIAMSTOWN | C333: PRESCOTT 3 | F333: MATHEWS 2 | I333: SPRINTHALL 2 | L333: DICK | N333: LEGGE
A334: ESSENDON TOWN | C334: MARTIN | F334: PAINE
A336: ROUND 8 | E336: 20TH JUNE | J336: WEATHER | M336: WEST WIND DULL OVERCAST
D337: 1ST QTR | H337: 2ND QTR | L337: 3RD QTR | P337: FINAL | S337: PLAYED AT
A338: RICHMOND | C338: 1 | D338: 2 | E338: =C338*6+D338 -> 8 | G338: 4 | H338: 8 | I338: =G338*6+H338 -> 32 | K338: 6 | L338: 9 | M338: =K338*6+L338 -> 45 | O338: 12 | P338: 11 | Q338: =O338*6+P338 -> 83 | S338: RICHMOND | X338: LADDER | AB338: ROUND | AD338: 8
A339: WEST MELBOURNE | C339: 1 | D339: 0 | E339: =C339*6+D339 -> 6 | G339: 1 | H339: 0 | I339: =G339*6+H339 -> 6 | K339: 2 | L339: 1 | M339: =K339*6+L339 -> 13 | O339: 2 | P339: 1 | Q339: =O339*6+P339 -> 13 | S339: UMPIRE
A340: BEST PLAYERS | S340: KENNISON | W340: TEAM | X340: W | Y340: L | Z340: D | AA340: FOR | AB340: AGST | AC340: % | AD340: PTS
A341: RICHMOND | C341: WADE | F341: WILLIAMS | I341: MATTHEWS | L341: JOHNSON | N341: CATLIN | Q341: WILMOTT
A342: WEST MELBOURNE | C342: WILLIAMS | F342: ROLENT | I342: H. GREGORY | L342: DEAN | N342: ARMSTRONG | Q342: FOX | W342: NORTH MELBOURNE | X342: 7 | Y342: 0 | Z342: 1 | AA342: 436 | AB342: 221 | AC342: 197.28506787330318 | AD342: 30
A343: GOALKICKERS | W343: RICHMOND | X343: 7 | Y343: 1 | Z343: 0 | AA343: 380 | AB343: 160 | AC343: =AA343/AB343*100 -> 237.5 | AD343: 28
A344: RICHMOND | C344: CATLIN 5 | F344: MAINE 3 | H344: HALL 3 | J344: MATTHEWS | W344: FOOTSCRAY | X344: 6 | Y344: 2 | Z344: 0 | AA344: 423 | AB344: 258 | AC344: 163.95 | AD344: 24
A345: WEST MELBOURNE | C345: RYAN 2 | W345: WEST MELBOURNE | X345: 5 | Y345: 3 | Z345: 0 | AA345: 351 | AB345: 301 | AC345: 116.61 | AD345: 20
A347: FOOTSCRAY | C347: 2 | D347: 2 | E347: =C347*6+D347 -> 14 | G347: 5 | H347: 2 | I347: =G347*6+H347 -> 32 | K347: 8 | L347: 6 | M347: =K347*6+L347 -> 54 | O347: 9 | P347: 7 | Q347: =O347*6+P347 -> 61 | S347: FOOTSCRAY | W347: WILLIAMSTOWN | X347: 4 | Y347: 3 | Z347: 1 | AA347: 318 | AB347: 266 | AC347: 119.55 | AD347: 18
A348: BRUNSWICK | C348: 0 | D348: 0 | E348: =C348*6+D348 -> 0 | G348: 0 | H348: 0 | I348: =G348*6+H348 -> 0 | K348: 0 | L348: 0 | M348: =K348*6+L348 -> 0 | O348: 1 | P348: 2 | Q348: =O348*6+P348 -> 8 | S348: TAYLOR | W348: PRESTON | X348: 4 | Y348: 4 | Z348: 0 | AA348: 302 | AB348: 320 | AC348: =AA348/AB348*100 -> 94.375 | AD348: 16
A349: BEST PLAYERS | W349: BRUNSWICK | X349: 3 | Y349: 5 | Z349: 0 | AA349: 290 | AB349: 303 | AC349: 95.709570957095707 | AD349: 12
A350: FOOTSCRAY | C350: MONTGARRETT | G350: MARMO | I350: O'SHEA | K350: SWANNELL | N350: McCARTHY | Q350: WILLIAMS | W350: PORT MELBOURNE | X350: 2 | Y350: 6 | Z350: 0 | AA350: 255 | AB350: 440 | AC350: 57.954545454545453 | AD350: 8
A351: BRUNSWICK | C351: SHELLNACK | G351: COWLEY | I351: CHASE | K351: SMITH | N351: DAWSON | Q351: CROWE | W351: PRAHRAN | X351: 1 | Y351: 7 | Z351: 0 | AA351: 250 | AB351: 397 | AC351: 62.97229219143577 | AD351: 4
A352: GOALKICKERS | W352: ESSENDON TOWN | X352: 0 | Y352: 8 | Z352: 0 | AA352: 159 | AB352: 508 | AC352: 31.3 | AD352: 0
A353: FOOTSCRAY | C353: MCCARTHY 3 | F353: E. STEPHENSON 2 | J353: DECOIT 2 | M353: HARRIS | O353: MONTGARRETT
A354: BRUNSWICK | C354: CROWE
A356: WILLIAMSTOWN | C356: 2 | D356: 2 | E356: =C356*6+D356 -> 14 | G356: 3 | H356: 5 | I356: =G356*6+H356 -> 23 | K356: 6 | L356: 5 | M356: =K356*6+L356 -> 41 | O356: 7 | P356: 6 | Q356: =O356*6+P356 -> 48 | S356: TOORAK PARK
A357: PRAHRAN | C357: 1 | D357: 3 | E357: =C357*6+D357 -> 9 | G357: 1 | H357: 9 | I357: =G357*6+H357 -> 15 | K357: 3 | L357: 11 | M357: =K357*6+L357 -> 29 | O357: 4 | P357: 15 | Q357: =O357*6+P357 -> 39 | S357: O'LOUGHLIN
A358: BEST PLAYERS
A359: WILLIAMSTOWN | C359: MCKINLEY | F359: WILSHER | I359: PRESCOTT | L359: HOUGHTON | O359: WILLIAMS | R359: DICK
A360: PRAHRAN | C360: FLYNN | F360: TODD | I360: T. BROWN | L360: G. BROWN | O360: HINTON | R360: WESTBROOK
A361: GOALKICKERS
A362: WILLIAMSTOWN | C362: DICK 4 | F362: PRESCOTT 2 | I362: PARKER
A363: PRAHRAN | C363: FLYNN 2 | F363: TENBRICK | I363: WESTBROOK
A365: PRESTON | C365: 1 | D365: 5 | E365: =C365*6+D365 -> 11 | G365: 3 | H365: 6 | I365: =G365*6+H365 -> 24 | K365: 8 | L365: 8 | M365: =K365*6+L365 -> 56 | O365: 9 | P365: 9 | Q365: =O365*6+P365 -> 63 | S365: ESS
A366: ESSENDON TOWN | C366: 1 | D366: 1 | E366: =C366*6+D366 -> 7 | G366: 2 | H366: 3 | I366: =G366*6+H366 -> 15 | K366: 3 | L366: 4 | M366: =K366*6+L366 -> 22 | O366: 4 | P366: 7 | Q366: =O366*6+P366 -> 31 | S366: MURPHY
A367: BEST PLAYERS
A368: PRESTON | C368: GILBERT | F368: PRATT | I368: WHITE | L368: S. HALL | O368: P. HALL | R368: COOPER
A369: ESSENDON TOWN | C369: SHELDON | F369: SWEATMAN | I369: O'KEEFE | L369: GORMAN | O369: GIRDWOOD | R369: GRIFFITHS
A370: GOALKICKERS
A371: PRESTON | C371: R. KNELL 3 | F371: P. HALL 2 | I371: WHITE 2 | K371: PRATT | M371: GILBERT | O371: GATES
A372: ESSENDON TOWN | C372: INCOLL 2 | F372: GRIFFITHS | I372: MARTIN
A374: NORTH MELBOURNE | C374: 4 | D374: 3 | E374: =C374*6+D374 -> 27 | G374: 7 | H374: 7 | I374: =G374*6+H374 -> 49 | K374: 9 | L374: 9 | M374: =K374*6+L374 -> 63 | O374: 12 | P374: 11 | Q374: =O374*6+P374 -> 83 | S374: NORTH MELB
A375: PORT MELBOURNE | C375: 0 | D375: 0 | E375: =C375*6+D375 -> 0 | G375: 0 | H375: 0 | I375: =G375*6+H375 -> 0 | K375: 0 | L375: 2 | M375: =K375*6+L375 -> 2 | O375: 2 | P375: 3 | Q375: =O375*6+P375 -> 15 | S375: BAIN
A376: BEST PLAYERS
A377: NORTH MELBOURNE | C377: KENNEDY | F377: ENGLISH | I377: ARMSTRONG | M377: MORRISON | P377: MILNE | S377: O'BRIEN
A378: PORT MELBOURNE | C378: KEENAN | F378: HURLEY | I378: PETTIT | M378: McGOWAN | P378: HILL | S378: GRAY
A379: GOALKICKERS
A380: NORTH MELBOURNE | C380: KENNEDY 4 | F380: ENGLISH 3 | I380: ARMSTRONG 2 | L380: MORRISON | O380: BOYLE | Q380: O'BRIEN
A381: PORT MELBOURNE | C381: CROFT | F381: McGOWAN
A383: ROUND 9 | D383: 27TH JUNE | J383: WEATHER | M383: NORTH WEST BREEZE FINE
D384: 1ST QTR | H384: 2ND QTR | L384: 3RD QTR | P384: FINAL | S384: PLAYED AT | X384: LADDER | AB384: ROUND | AD384: 9
A385: RICHMOND | C385: 2 | D385: 2 | E385: =C385*6+D385 -> 14 | G385: 4 | H385: 2 | I385: =G385*6+H385 -> 26 | K385: 7 | L385: 4 | M385: =K385*6+L385 -> 46 | O385: 8 | P385: 6 | Q385: =O385*6+P385 -> 54 | S385: RICHMOND
A386: NORTH MELBOURNE | C386: 0 | D386: 3 | E386: =C386*6+D386 -> 3 | G386: 3 | H386: 6 | I386: =G386*6+H386 -> 24 | K386: 4 | L386: 8 | M386: =K386*6+L386 -> 32 | O386: 5 | P386: 12 | Q386: =O386*6+P386 -> 42 | S386: UMPIRE | W386: TEAM | X386: W | Y386: L | Z386: D | AA386: FOR | AB386: AGST | AC386: % | AD386: PTS
A387: BEST PLAYERS | S387: O'LOUGHLIN
A388: RICHMOND | C388: LYONS | F388: EDMONDS | H388: McNAIR | K388: T.WATSON | N388: JOHNSTON | Q388: WILLLIAMS
A389: NORTH MELBOURNE | C389: JAMIESON | F389: BOYLE | H389: CONSIDINE | K389: ARMSTRONG | N389: MILNE | Q389: O'BRIEN | W389: RICHMOND | X389: 8 | Y389: 1 | Z389: 0 | AA389: 434 | AB389: 202 | AC389: =AA389/AB389*100 -> 214.85148514851485 | AD389: 32
A390: GOALKICKERS | W390: NORTH MELBOURNE | X390: 7 | Y390: 1 | Z390: 1 | AA390: 478 | AB390: 275 | AC390: 173.81818181818181 | AD390: 30
A391: RICHMOND | C391: LYONS 2 | F391: MAINE 2 | H391: E. JUSTIN | J391: BACKHOUSE | M391: CATLIN | O391: McNAIR | W391: FOOTSCRAY | X391: 7 | Y391: 2 | Z391: 0 | AA391: 517 | AB391: 283 | AC391: 182.69 | AD391: 28
A392: NORTH MELBOURNE | C392: O'BRIEN 3 | F392: ARMSTRONG | I392: MILNE | W392: WEST MELBOURNE | X392: 6 | Y392: 3 | Z392: 0 | AA392: 401 | AB392: 316 | AC392: 126.9 | AD392: 24
A394: WEST MELBOURNE | C394: 3 | D394: 2 | E394: =C394*6+D394 -> 20 | G394: 3 | H394: 5 | I394: =G394*6+H394 -> 23 | K394: 5 | L394: 9 | M394: =K394*6+L394 -> 39 | O394: 6 | P394: 14 | Q394: =O394*6+P394 -> 50 | S394: NORTH MELB | W394: WILLIAMSTOWN | X394: 4 | Y394: 4 | Z394: 1 | AA394: 349 | AB394: 299 | AC394: 116.72 | AD394: 18
A395: PRESTON | C395: 0 | D395: 2 | E395: =C395*6+D395 -> 2 | G395: 0 | H395: 4 | I395: =G395*6+H395 -> 4 | K395: 1 | L395: 8 | M395: =K395*6+L395 -> 14 | O395: 1 | P395: 9 | Q395: =O395*6+P395 -> 15 | S395: MURPHY | W395: BRUNSWICK | X395: 4 | Y395: 5 | Z395: 0 | AA395: 323 | AB395: 334 | AC395: 96.706586826347305 | AD395: 16
A396: BEST PLAYERS | W396: PRESTON | X396: 5 | Y396: 4 | Z396: 0 | AA396: 317 | AB396: 370 | AC396: =AA396/AB396*100 -> 85.675675675675677 | AD396: 16
A397: WEST MELBOURNE | C397: MADDEN | F397: RIGBY | H397: WILLIAMS | K397: H. LAXTON | N397: A. LAXTON | Q397: DEAN | W397: PORT MELBOURNE | X397: 3 | Y397: 6 | Z397: 0 | AA397: 293 | AB397: 465 | AC397: 63.01075268817204 | AD397: 12
A398: PRESTON | C398: S. HALL | F398: P. HALL | H398: WHITEOAK | K398: RAFF | N398: DOULL | Q398: GIBSON | W398: PRAHRAN | X398: 1 | Y398: 8 | Z398: 0 | AA398: 275 | AB398: 435 | AC398: 63.218390804597703 | AD398: 4
A399: GOALKICKERS | W399: ESSENDON TOWN | X399: 0 | Y399: 9 | Z399: 0 | AA399: 184 | AB399: 602 | AC399: 30.56 | AD399: 0
A400: WEST MELBOURNE | C400: ARMSTRONG 2 | F400: RYAN 2 | H400: H. LAXTON | K400: F. GREGORY
A401: PRESTON | C401: ROBERTSON
A403: BRUNSWICK | C403: 0 | D403: 0 | E403: =C403*6+D403 -> 0 | G403: 3 | H403: 4 | I403: =G403*6+H403 -> 22 | K403: 3 | L403: 4 | M403: =K403*6+L403 -> 22 | O403: 4 | P403: 9 | Q403: =O403*6+P403 -> 33 | S403: BRUNSWICK
A404: WILLIAMSTOWN | C404: 2 | D404: 3 | E404: =C404*6+D404 -> 15 | G404: 2 | H404: 4 | I404: =G404*6+H404 -> 16 | K404: 3 | L404: 4 | M404: =K404*6+L404 -> 22 | O404: 4 | P404: 7 | Q404: =O404*6+P404 -> 31 | S404: PYMM
A405: BEST PLAYERS
A406: BRUNSWICK | C406: CLEMENTS | F406: CASEY | I406: TEMPLE | L406: MULVANEY | O406: STEVENSON | R406: COWLEY
A407: WILLIAMSTOWN | C407: LAWSON | F407: McKINLEY | I407: MANDERSON | L407: SHEEHAN | O407: HOUGHTON | R407: LEGGE
A408: GOALKICKERS
A409: BRUNSWICK | C409: CLEMENTS 2 | F409: CASEY | I409: CROWE
A410: WILLIAMSTOWN | C410: SHEEHAN 3 | F410: PRESCOTT
A412: PORT MELBOURNE | C412: 2 | D412: 3 | E412: =C412*6+D412 -> 15 | G412: 2 | H412: 3 | I412: =G412*6+H412 -> 15 | K412: 5 | L412: 3 | M412: =K412*6+L412 -> 33 | O412: 5 | P412: 8 | Q412: =O412*6+P412 -> 38 | S412: PORT MELB
A413: PRAHRAN | C413: 1 | D413: 2 | E413: =C413*6+D413 -> 8 | G413: 3 | H413: 4 | I413: =G413*6+H413 -> 22 | K413: 3 | L413: 5 | M413: =K413*6+L413 -> 23 | O413: 3 | P413: 7 | Q413: =O413*6+P413 -> 25 | S413: BAIN
A414: BEST PLAYERS
A415: PORT MELBOURNE | C415: HILL | F415: P. GARBUTT | I415: SIEVERS | L415: KEENAN | O415: HURLEY | R415: McDONALD
A416: PRAHRAN | C416: T. BROWN | F416: G. BROWN | I416: TRUSCOTT | L416: WESTBROOK | O416: WILLLIAMS | R416: HUDD
A417: GOALKICKERS
A418: PORT MELBOURNE | C418: WARD 2 | F418: J. McDONALD | I418: PETTIT | K418: CROFT
A419: PRAHRAN | C419: JONES | F419: CROFT | H419: DUPE
A421: FOOTSCRAY | C421: 4 | D421: 4 | E421: =C421*6+D421 -> 28 | G421: 7 | H421: 8 | I421: =G421*6+H421 -> 50 | K421: 9 | L421: 14 | M421: =K421*6+L421 -> 68 | O421: 13 | P421: 16 | Q421: =O421*6+P421 -> 94 | S421: ESS
A422: ESSENDON TOWN | C422: 0 | D422: 0 | E422: =C422*6+D422 -> 0 | G422: 1 | H422: 0 | I422: =G422*6+H422 -> 6 | K422: 2 | L422: 0 | M422: =K422*6+L422 -> 12 | O422: 4 | P422: 1 | Q422: =O422*6+P422 -> 25 | S422: KENNISON
A423: BEST PLAYERS
A424: FOOTSCRAY | C424: MARMO | F424: E. STEPHENSON | I424: DECOIT | K424: HINCH | N424: HARRIS | Q424: MONTGARRETT
A425: ESSENDON TOWN | C425: SWEATMAN | F425: SHELDON | I425: HUGHES | K425: WATSON | N425: JOLLY | Q425: WARRY
A426: GOALKICKERS
A427: FOOTSCRAY | C427: DECOIT 4 | F427: GROVES 2 | H427: HUGHES | J427: FLEWELLYN | M427: MONTGARRETT | P427: McCARTHY | S427: E. STEPHENSON | W427: MARMO
A428: ESSENDON TOWN | C428: BUSBRIDGE 2 | F428: PAINE | H428: GRIFFITHS
A430: ROUND 10 | E430: 4TH JULY | J430: WEATHER | N430: SOUTH WEST WIND SHOWERS
D431: 1ST QTR | H431: 2ND QTR | L431: 3RD QTR | P431: FINAL | S431: PLAYED AT
A432: RICHMOND | C432: 3 | D432: 1 | E432: =C432*6+D432 -> 19 | G432: 3 | H432: 6 | I432: =G432*6+H432 -> 24 | K432: 4 | L432: 9 | M432: =K432*6+L432 -> 33 | O432: 6 | P432: 9 | Q432: =O432*6+P432 -> 45 | S432: P'TON | X432: LADDER | AB432: ROUND | AD432: 10
A433: PRESTON | C433: 2 | D433: 2 | E433: =C433*6+D433 -> 14 | G433: 2 | H433: 3 | I433: =G433*6+H433 -> 15 | K433: 3 | L433: 3 | M433: =K433*6+L433 -> 21 | O433: 3 | P433: 5 | Q433: =O433*6+P433 -> 23 | S433: UMPIRE
A434: BEST PLAYERS | S434: BAIN | W434: TEAM | X434: W | Y434: L | Z434: D | AA434: FOR | AB434: AGST | AC434: % | AD434: PTS
A435: RICHMOND | C435: JOHNSTON | F435: LYONS | H435: GEGGIE | K435: WILLIAMS | N435: BOWNAS | Q435: T. WATSON
A436: PRESTON | C436: GILBERT | F436: S. HALL | H436: E. HALL | K436: DICKENS | N436: PRATT | Q436: WHITE | W436: RICHMOND | X436: 9 | Y436: 1 | Z436: 0 | AA436: 479 | AB436: 225 | AC436: =AA436/AB436*100 -> 212.88888888888891 | AD436: 36
A437: GOALKICKERS | W437: NORTH MELBOURNE | X437: 8 | Y437: 1 | Z437: 1 | AA437: 542 | AB437: 291 | AC437: 186.25429553264604 | AD437: 34
A438: RICHMOND | C438: LYONS 3 | F438: WADE | H438: McNAIR | J438: MAINE | W438: FOOTSCRAY | X438: 8 | Y438: 2 | Z438: 0 | AA438: 561 | AB438: 306 | AC438: 183.33 | AD438: 32
A439: PRESTON | C439: O'COCK | F439: GIBSON | H439: P. HALL | W439: WEST MELBOURNE | X439: 7 | Y439: 3 | Z439: 0 | AA439: 477 | AB439: 353 | AC439: 135.13 | AD439: 28
A441: FOOTSCRAY | C441: 1 | D441: 4 | E441: =C441*6+D441 -> 10 | G441: 2 | H441: 5 | I441: =G441*6+H441 -> 17 | K441: 5 | L441: 6 | M441: =K441*6+L441 -> 36 | O441: 6 | P441: 8 | Q441: =O441*6+P441 -> 44 | S441: FOOTSCRAY | W441: WILLIAMSTOWN | X441: 4 | Y441: 5 | Z441: 1 | AA441: 372 | AB441: 343 | AC441: 108.45 | AD441: 18
A442: WILLIAMSTOWN | C442: 1 | D442: 0 | E442: =C442*6+D442 -> 6 | G442: 2 | H442: 2 | I442: =G442*6+H442 -> 14 | K442: 2 | L442: 3 | M442: =K442*6+L442 -> 15 | O442: 3 | P442: 5 | Q442: =O442*6+P442 -> 23 | S442: MURPHY | W442: BRUNSWICK | X442: 4 | Y442: 6 | Z442: 0 | AA442: 343 | AB442: 357 | AC442: 96.078431372549019 | AD442: 16
A443: BEST PLAYERS | W443: PRESTON | X443: 4 | Y443: 6 | Z443: 0 | AA443: 340 | AB443: 415 | AC443: =AA443/AB443*100 -> 81.92771084337349 | AD443: 16
A444: FOOTSCRAY | C444: McCARTHY | F444: McCARROLL | I444: GRAHAM | L444: HINCH | N444: DECOIT | Q444: KRUSE | W444: PORT MELBOURNE | X444: 4 | Y444: 6 | Z444: 0 | AA444: 316 | AB444: 485 | AC444: 65.154639175257728 | AD444: 16
A445: WILLIAMSTOWN | C445: MCKINLEY | F445: BAKER | I445: CALDWELL | L445: BLEASBY | N445: BRITT | Q445: SHEEHAN | W445: PRAHRAN | X445: 1 | Y445: 9 | Z445: 0 | AA445: 312 | AB445: 511 | AC445: 61.05675146771037 | AD445: 4
A446: GOALKICKERS | W446: ESSENDON TOWN | X446: 0 | Y446: 10 | Z446: 0 | AA446: 200 | AB446: 666 | AC446: 30.03 | AD446: 0
A447: FOOTSCRAY | C447: DECOIT 5 | F447: HUGHES
A448: WILLIAMSTOWN | C448: HOUGHTON | F448: PRESCOTT | I448: SHEEHAN
A450: PORT MELBOURNE | C450: 0 | D450: 4 | E450: =C450*6+D450 -> 4 | G450: 0 | H450: 5 | I450: =G450*6+H450 -> 5 | K450: 1 | L450: 8 | M450: =K450*6+L450 -> 14 | O450: 2 | P450: 11 | Q450: =O450*6+P450 -> 23 | S450: PORT MELB
A451: BRUNSWICK | C451: 0 | D451: 2 | E451: =C451*6+D451 -> 2 | G451: 1 | H451: 2 | I451: =G451*6+H451 -> 8 | K451: 1 | L451: 2 | M451: =K451*6+L451 -> 8 | O451: 3 | P451: 2 | Q451: =O451*6+P451 -> 20 | S451: KENNISON
A452: BEST PLAYERS
A453: PORT MELBOURNE | C453: McDONALD | F453: WILLIAMS | I453: McGOWAN | L453: HILL | N453: PETTIT | Q453: MOLONEY
A454: BRUNSWICK | C454: CLEMENTS | F454: ROBERTSON
A455: GOALKICKERS
A456: PORT MELBOURNE | C456: HURLEY | F456: McGOWAN
A457: BRUNSWICK | C457: CLEMENTS 2 | F457: CHASE
A459: WEST MELBOURNE | C459: 2 | D459: 1 | E459: =C459*6+D459 -> 13 | G459: 6 | H459: 6 | I459: =G459*6+H459 -> 42 | K459: 9 | L459: 7 | M459: =K459*6+L459 -> 61 | O459: 11 | P459: 10 | Q459: =O459*6+P459 -> 76 | S459: NORTH MELB
A460: PRAHRAN | C460: 2 | D460: 0 | E460: =C460*6+D460 -> 12 | G460: 2 | H460: 1 | I460: =G460*6+H460 -> 13 | K460: 3 | L460: 1 | M460: =K460*6+L460 -> 19 | O460: 6 | P460: 1 | Q460: =O460*6+P460 -> 37 | S460: O'LOUGHLIN
A461: BEST PLAYERS
A462: WEST MELBOURNE | C462: MADDEN | F462: ROLENT | I462: WILLLIAMS | L462: H. LAXTON | O462: A. LAXTON | R462: ROOKE
A463: PRAHRAN | C463: ROBERTS | F463: GOETZ | I463: KEWISH | L463: HUDD | O463: FLYNN | R463: DRAPER
A464: GOALKICKERS
A465: WEST MELBOURNE | C465: ARMSTRONG 3 | G465: RYAN 3 | I465: A. GREGORY 2 | L465: F. GREGORY | O465: POOLE | Q465: GOURLEY
A466: PRAHRAN | C466: G. BROWN 2 | G466: BACKHOUSE 2 | J466: TODD | L466: CROFT
A468: NORTH MELBOURNE | C468: 3 | D468: 3 | E468: =C468*6+D468 -> 21 | G468: 3 | H468: 9 | I468: =G468*6+H468 -> 27 | K468: 6 | L468: 13 | M468: =K468*6+L468 -> 49 | O468: 8 | P468: 16 | Q468: =O468*6+P468 -> 64 | S468: ESS
A469: ESSENDON TOWN | C469: 1 | D469: 0 | E469: =C469*6+D469 -> 6 | G469: 2 | H469: 2 | I469: =G469*6+H469 -> 14 | K469: 2 | L469: 3 | M469: =K469*6+L469 -> 15 | O469: 2 | P469: 4 | Q469: =O469*6+P469 -> 16 | S469: PYMM
A470: BEST PLAYERS
A471: NORTH MELBOURNE | C471: JAMIESON | F471: W. CARLTON | I471: STEWART | L471: P. NOONAN | O471: DALTON | R471: ARMSTRONG
A472: ESSENDON TOWN | C472: CHEFFERS | F472: GRIFFITHS | I472: SHELDON | L472: HUGHES | O472: COWAN | R472: O'KEEFE
A473: GOALKICKERS
A474: NORTH MELBOURNE | C474: CHRISFIELD 4 | F474: O'BRIEN 2 | I474: ARMSTRONG | L474: MARTIN
A475: ESSENDON TOWN | C475: BUSBRIDGE | F475: GRIFFITHS
A477: ROUND 11 | E477: 11TH JULY | J477: WEATHER | N477: FINE COLD | S477: PLAYED AT
D478: 1ST QTR | H478: 2ND QTR | L478: 3RD QTR | P478: FINAL | S478: NORTH MELB
A479: FOOTSCRAY | C479: 2 | D479: 5 | E479: =C479*6+D479 -> 17 | G479: 5 | H479: 10 | I479: =G479*6+H479 -> 40 | K479: 7 | L479: 11 | M479: =K479*6+L479 -> 53 | O479: 8 | P479: 11 | Q479: =O479*6+P479 -> 59 | S479: UMPIRE | X479: LADDER | AB479: ROUND | AD479: 11
A480: NORTH MELBOURNE | C480: 0 | D480: 0 | E480: =C480*6+D480 -> 0 | G480: 2 | H480: 1 | I480: =G480*6+H480 -> 13 | K480: 3 | L480: 2 | M480: =K480*6+L480 -> 20 | O480: 6 | P480: 3 | Q480: =O480*6+P480 -> 39 | S480: O'LOUGHLIN
A481: BEST PLAYERS | W481: TEAM | X481: W | Y481: L | Z481: D | AA481: FOR | AB481: AGST | AC481: % | AD481: PTS
A482: FOOTSCRAY | C482: KRUSE | F482: MARMO | I482: DECOIT | K482: GRAHAM | N482: HARRIS | Q482: GROVES
A483: NORTH MELBOURNE | C483: McDERMOTT | F483: JAMIESON | I483: CARLTON | K483: LONDERGREN | N483: BOYLE | Q483: CONSIDINE | W483: RICHMOND | X483: 10 | Y483: 1 | Z483: 0 | AA483: 522 | AB483: 259 | AC483: =AA483/AB483*100 -> 201.54440154440155 | AD483: 40
A484: GOALKICKERS | W484: FOOTSCRAY | X484: 9 | Y484: 2 | Z484: 0 | AA484: 620 | AB484: 345 | AC484: 179.71 | AD484: 36
A485: FOOTSCRAY | C485: FLEWELLYN 3 | F485: HUGHES 2 | I485: McCARTHY | L485: GROVES | N485: DECOIT | W485: NORTH MELBOURNE | X485: 8 | Y485: 2 | Z485: 1 | AA485: 581 | AB485: 350 | AC485: 166 | AD485: 34
A486: NORTH MELBOURNE | C486: KENNEDY 3 | F486: CONSIDINE 2 | I486: O'BRIEN | W486: WEST MELBOURNE | X486: 8 | Y486: 3 | Z486: 0 | AA486: 517 | AB486: 386 | AC486: 133.93 | AD486: 32
A488: BRUNSWICK | C488: 4 | D488: 7 | E488: =C488*6+D488 -> 31 | G488: 6 | H488: 9 | I488: =G488*6+H488 -> 45 | K488: 6 | L488: 13 | M488: =K488*6+L488 -> 49 | O488: 8 | P488: 17 | Q488: =O488*6+P488 -> 65 | S488: BRUNSWICK | W488: BRUNSWICK | X488: 5 | Y488: 6 | Z488: 0 | AA488: 408 | AB488: 399 | AC488: 102.25563909774436 | AD488: 20
A489: PRESTON | C489: 0 | D489: 0 | E489: =C489*6+D489 -> 0 | G489: 2 | H489: 4 | I489: =G489*6+H489 -> 16 | K489: 3 | L489: 5 | M489: =K489*6+L489 -> 23 | O489: 6 | P489: 6 | Q489: =O489*6+P489 -> 42 | S489: PYMM | W489: WILLIAMSTOWN | X489: 4 | Y489: 6 | Z489: 1 | AA489: 406 | AB489: 386 | AC489: 105.18 | AD489: 18
A490: BEST PLAYERS | W490: PRESTON | X490: 4 | Y490: 7 | Z490: 0 | AA490: 382 | AB490: 480 | AC490: =AA490/AB490*100 -> 79.583333333333329 | AD490: 16
A491: BRUNSWICK | C491: ROBERTSON | F491: BURKE | H491: MULVANEY | K491: CASEY | N491: BRAID | Q491: SHELLNACK | W491: PORT MELBOURNE | X491: 4 | Y491: 7 | Z491: 0 | AA491: 349 | AB491: 525 | AC491: 66.476190476190482 | AD491: 16
A492: PRESTON | C492: S. HALL | F492: E. HALL | H492: P. HALL | K492: COOPER | N492: RICHARDSON | Q492: GATES | W492: PRAHRAN | X492: 2 | Y492: 9 | Z492: 0 | AA492: 375 | AB492: 533 | AC492: 70.356472795497183 | AD492: 8
A493: GOALKICKERS | W493: ESSENDON TOWN | X493: 0 | Y493: 11 | Z493: 0 | AA493: 222 | AB493: 729 | AC493: 30.45 | AD493: 0
A494: BRUNSWICK | C494: CLEMENTS 2 | F494: ROBERTSON | I494: SHELLNACK | K494: WALSH | M494: CASEY | O494: CHASE | Q494: BRAID
A495: PRESTON | C495: E. HALL 2 | F495: DICKENS | H495: R. KNELL | J495: WHITEOAK | M495: COOPER
A497: RICHMOND | C497: 0 | D497: 0 | E497: =C497*6+D497 -> 0 | G497: 3 | H497: 0 | I497: =G497*6+H497 -> 18 | K497: 6 | L497: 0 | M497: =K497*6+L497 -> 36 | O497: 7 | P497: 1 | Q497: =O497*6+P497 -> 43 | S497: RICHMOND
A498: WILLIAMSTOWN | C498: 1 | D498: 3 | E498: =C498*6+D498 -> 9 | G498: 1 | H498: 5 | I498: =G498*6+H498 -> 11 | K498: 2 | L498: 7 | M498: =K498*6+L498 -> 19 | O498: 4 | P498: 10 | Q498: =O498*6+P498 -> 34 | S498: MURPHY
A499: BEST PLAYERS
A500: RICHMOND | C500: LYONS | F500: WILLIAMS | I500: BOWNAS | L500: T. WATSON | O500: EDMONDS | R500: BACKHOUSE
A501: WILLIAMSTOWN | C501: BAKER | F501: SPRINTHALL | I501: CALDWELL | L501: LEGGE | O501: MANDERSON | R501: HOUGHTON
A502: GOALKICKERS
A503: RICHMOND | C503: MAINE 3 | F503: McDONALD 2 | I503: LYONS | K503: HALL
A504: WILLIAMSTOWN | C504: PRESCOTT 2 | F504: HOUGHTON | I504: BRITT
A506: WEST MELBOURNE | C506: 1 | D506: 3 | E506: =C506*6+D506 -> 9 | G506: 1 | H506: 5 | I506: =G506*6+H506 -> 11 | K506: 4 | L506: 14 | M506: =K506*6+L506 -> 38 | O506: 4 | P506: 16 | Q506: =O506*6+P506 -> 40 | S506: PORT MELB
A507: PORT MELBOURNE | C507: 2 | D507: 3 | E507: =C507*6+D507 -> 15 | G507: 2 | H507: 6 | I507: =G507*6+H507 -> 18 | K507: 3 | L507: 7 | M507: =K507*6+L507 -> 25 | O507: 4 | P507: 9 | Q507: =O507*6+P507 -> 33 | S507: TAYLOR
A508: BEST PLAYERS
A509: WEST MELBOURNE | C509: ROLENT | F509: H. LAXTON | I509: ROOKE | K509: POOLE | M509: QUILLIGAN | P509: RYAN
A510: PORT MELBOURNE | C510: McGOWAN | F510: JOHNSON | I510: PETTIT | K510: STIVEY | M510: HURLEY | P510: WILLIAMS
A511: GOALKICKERS
A512: WEST MELBOURNE | C512: QUILLIGAN 2 | G512: GOURLEY 2
A513: PORT MELBOURNE | C513: J. McDONALD 2 | G513: CROFT 2
A515: PRAHRAN | C515: 2 | D515: 3 | E515: =C515*6+D515 -> 15 | G515: 5 | H515: 5 | I515: =G515*6+H515 -> 35 | K515: 8 | L515: 7 | M515: =K515*6+L515 -> 55 | O515: 9 | P515: 9 | Q515: =O515*6+P515 -> 63 | S515: TOORAK PARK
A516: ESSENDON TOWN | C516: 0 | D516: 2 | E516: =C516*6+D516 -> 2 | G516: 1 | H516: 5 | I516: =G516*6+H516 -> 11 | K516: 1 | L516: 6 | M516: =K516*6+L516 -> 12 | O516: 2 | P516: 10 | Q516: =O516*6+P516 -> 22 | S516: BAIN
A517: BEST PLAYERS
A518: PRAHRAN | C518: G. BROWN | F518: ROBERTS | I518: T. BROWN | L518: KEWISH | O518: WILLIAMS | R518: CHALMERS
A519: ESSENDON TOWN | C519: COWAN | F519: SHELDON | I519: JOLLY | L519: CARROLL | O519: WARRY | R519: DAWSON
A520: GOALKICKERS
A521: PRAHRAN | C521: JONES 4 | F521: FLYNN 2 | I521: WAINWRIGHT | L521: BACKHOUSE | O521: DUPE
A522: ESSENDON TOWN | C522: WARRY | F522: BUSBRIDGE
A524: ROUND 12 | E524: 18TH JULY | J524: WEATHER | N524: STRONG NORTH WIND OVERCAST DULL
D525: 1ST QTR | H525: 2ND QTR | L525: 3RD QTR | P525: FINAL | S525: PLAYED AT
A526: RICHMOND | C526: 0 | D526: 0 | E526: =C526*6+D526 -> 0 | G526: 3 | H526: 4 | I526: =G526*6+H526 -> 22 | K526: 3 | L526: 4 | M526: =K526*6+L526 -> 22 | O526: 5 | P526: 6 | Q526: =O526*6+P526 -> 36 | S526: FOOTSCRAY | X526: LADDER | AB526: ROUND | AD526: 12
A527: FOOTSCRAY | C527: 1 | D527: 7 | E527: =C527*6+D527 -> 13 | G527: 1 | H527: 7 | I527: =G527*6+H527 -> 13 | K527: 3 | L527: 9 | M527: =K527*6+L527 -> 27 | O527: 3 | P527: 9 | Q527: =O527*6+P527 -> 27 | S527: UMPIRE
A528: BEST PLAYERS | S528: BAIN | W528: TEAM | X528: W | Y528: L | Z528: D | AA528: FOR | AB528: AGST | AC528: % | AD528: PTS
A529: RICHMOND | C529: McNAIR | F529: JOHNSTON | I529: BACKHOUSE | L529: CATLIN | O529: EDMONDS | R529: McCANCE
A530: FOOTSCRAY | C530: MARMO | F530: GROVES | I530: HARRIS | L530: McCARHTY | O530: KRUSE | R530: DECOIT | W530: RICHMOND | X530: 11 | Y530: 1 | Z530: 0 | AA530: 558 | AB530: 286 | AC530: =AA530/AB530*100 -> 195.10489510489509 | AD530: 44
A531: GOALKICKERS | W531: NORTH MELBOURNE | X531: 9 | Y531: 2 | Z531: 1 | AA531: 620 | AB531: 367 | AC531: 168.93732970027247 | AD531: 38
A532: RICHMOND | C532: CATLIN 2 | F532: LYONS | I532: JOHNSTON | L532: GIBB | W532: FOOTSCRAY | X532: 9 | Y532: 3 | Z532: 0 | AA532: 647 | AB532: 381 | AC532: 169.82 | AD532: 36
A533: FOOTSCRAY | C533: MCCARTHY | F533: HUGHES | I533: DECOIT | W533: WEST MELBOURNE | X533: 8 | Y533: 4 | Z533: 0 | AA533: 534 | AB533: 425 | AC533: 125.65 | AD533: 32
A535: NORTH MELBOURNE | C535: 0 | D535: 0 | E535: =C535*6+D535 -> 0 | G535: 4 | H535: 0 | I535: =G535*6+H535 -> 24 | K535: 4 | L535: 1 | M535: =K535*6+L535 -> 25 | O535: 6 | P535: 3 | Q535: =O535*6+P535 -> 39 | S535: NORTH MELB | W535: BRUNSWICK | X535: 6 | Y535: 6 | Z535: 0 | AA535: 465 | AB535: 447 | AC535: 104.02684563758389 | AD535: 24
A536: WEST MELBOURNE | C536: 0 | D536: 2 | E536: =C536*6+D536 -> 2 | G536: 0 | H536: 3 | I536: =G536*6+H536 -> 3 | K536: 1 | L536: 4 | M536: =K536*6+L536 -> 10 | O536: 2 | P536: 5 | Q536: =O536*6+P536 -> 17 | S536: PYMM | W536: WILLIAMSTOWN | X536: 5 | Y536: 6 | Z536: 1 | AA536: 466 | AB536: 411 | AC536: 113.39 | AD536: 22
A537: BEST PLAYERS | W537: PORT MELBOURNE | X537: 5 | Y537: 7 | Z537: 0 | AA537: 369 | AB537: 543 | AC537: 67.95580110497238 | AD537: 20
A538: NORTH MELBOURNE | C538: P. NOONAN | F538: BARNES | I538: JAMIESON | K538: BOYLE | N538: CARLTON | Q538: CONSIDINE | W538: PRESTON | X538: 4 | Y538: 8 | Z538: 0 | AA538: 407 | AB538: 540 | AC538: =AA538/AB538*100 -> 75.370370370370367 | AD538: 16
A539: WEST MELBOURNE | C539: WILLIAMS | F539: MADDEN | I539: DEAN | K539: A. LAXTON | N539: ROLENT | Q539: ARMSTRONG | W539: PRAHRAN | X539: 2 | Y539: 10 | Z539: 0 | AA539: 423 | AB539: 590 | AC539: 71.694915254237287 | AD539: 8
A540: GOALKICKERS | W540: ESSENDON TOWN | X540: 0 | Y540: 12 | Z540: 0 | AA540: 240 | AB540: 749 | AC540: 32.04 | AD540: 0
A541: NORTH MELBOURNE | C541: CONSIDINE 2 | F541: KENNEDY 2 | I541: ARMSTRONG | L541: P. NOONAN
A542: WEST MELBOURNE | C542: RYAN 2
A544: WILLIAMSTOWN | C544: 3 | D544: 5 | E544: =C544*6+D544 -> 23 | G544: 4 | H544: 10 | I544: =G544*6+H544 -> 34 | K544: 6 | L544: 16 | M544: =K544*6+L544 -> 52 | O544: 7 | P544: 18 | Q544: =O544*6+P544 -> 60 | S544: W'TOWN
A545: PRESTON | C545: 0 | D545: 0 | E545: =C545*6+D545 -> 0 | G545: 3 | H545: 2 | I545: =G545*6+H545 -> 20 | K545: 3 | L545: 5 | M545: =K545*6+L545 -> 23 | O545: 3 | P545: 7 | Q545: =O545*6+P545 -> 25 | S545: O'LOUGHLIN
A546: BEST PLAYERS
A547: WILLIAMSTOWN | C547: HOUGHTON | F547: MANDERSON | I547: SPRINTHALL | L547: DAVIS | N547: LEGGE | P547: WILLIAMS
A548: PRESTON | C548: PRATT | F548: COOPER | I548: S. HALL | L548: J. KNELL | N548: DOULL | P548: P. HALL
A549: GOALKICKERS
A550: WILLIAMSTOWN | C550: HOUGHTON 3 | F550: PRESCOTT 2 | I550: MANDERSON | L550: MATTHEWS
A551: PRESTON | C551: WHITEOAK | F551: J. KNELL | I551: R. KNELL
A553: BRUNSWICK | C553: 0 | D553: 0 | E553: =C553*6+D553 -> 0 | G553: 4 | H553: 6 | I553: =G553*6+H553 -> 30 | K553: 6 | L553: 9 | M553: =K553*6+L553 -> 45 | O553: 8 | P553: 9 | Q553: =O553*6+P553 -> 57 | S553: TOORAK PARK
A554: PRAHRAN | C554: 4 | D554: 3 | E554: =C554*6+D554 -> 27 | G554: 5 | H554: 4 | I554: =G554*6+H554 -> 34 | K554: 6 | L554: 6 | M554: =K554*6+L554 -> 42 | O554: 7 | P554: 6 | Q554: =O554*6+P554 -> 48 | S554: MURPHY
A555: BEST PLAYERS
A556: BRUNSWICK | C556: CLEMENTS | F556: SHELLNACK | I556: SHAW | K556: MULVANEY | N556: GIBSON | Q556: GREVEY
A557: PRAHRAN | C557: ROBERTS | F557: T. BROWN | I557: G. BROWN | K557: CHALMERS | N557: FLYNN | Q557: DRAPER
A558: GOALKICKERS
A559: BRUNSWICK | C559: CLEMENTS 5 | F559: GREVEY 2 | I559: CASEY
A560: PRAHRAN | C560: BACKHOUSE 3 | F560: DUPE 2 | I560: WILLISON | L560: SHAW
A562: PORT MELBOURNE | C562: 0 | D562: 1 | E562: =C562*6+D562 -> 1 | G562: 0 | H562: 4 | I562: =G562*6+H562 -> 4 | K562: 0 | L562: 6 | M562: =K562*6+L562 -> 6 | O562: 2 | P562: 8 | Q562: =O562*6+P562 -> 20 | S562: ESS
A563: ESSENDON TOWN | C563: 0 | D563: 0 | E563: =C563*6+D563 -> 0 | G563: 1 | H563: 2 | I563: =G563*6+H563 -> 8 | K563: 1 | L563: 6 | M563: =K563*6+L563 -> 12 | O563: 2 | P563: 6 | Q563: =O563*6+P563 -> 18 | S563: KENNISON
A564: BEST PLAYERS
A565: PORT MELBOURNE | C565: JOHNSON | F565: STIVEY | I565: PETTIT | K565: ROBERTSON | N565: CROFT | Q565: KEENAN
A566: ESSENDON TOWN | C566: PAINE | F566: HUGHES | I566: SHELDON | K566: SWEATMAN | N566: HAWKINS | Q566: COWAN
A567: GOALKICKERS
A568: PORT MELBOURNE | C568: CROFT | F568: JOHNSON
A569: ESSENDON TOWN | C569: BUSBRIDGE | F569: STANWORTH
A571: ROUND 13 | E571: 25TH JULY | J571: WEATHER | N571: LIGHT NORTH EAST BREEZE FINE
D572: 1ST QTR | H572: 2ND QTR | L572: 3RD QTR | P572: FINAL | S572: PLAYED AT
A573: NORTH MELBOURNE | C573: 2 | D573: 2 | E573: =C573*6+D573 -> 14 | G573: 4 | H573: 5 | I573: =G573*6+H573 -> 29 | K573: 9 | L573: 8 | M573: =K573*6+L573 -> 62 | O573: 10 | P573: 9 | Q573: =O573*6+P573 -> 69 | S573: BRUNSWICK | X573: LADDER | AB573: ROUND | AD573: 13
A574: BRUNSWICK | C574: 1 | D574: 0 | E574: =C574*6+D574 -> 6 | G574: 4 | H574: 1 | I574: =G574*6+H574 -> 25 | K574: 4 | L574: 2 | M574: =K574*6+L574 -> 26 | O574: 6 | P574: 5 | Q574: =O574*6+P574 -> 41 | S574: UMPIRE
A575: BEST PLAYERS | S575: O'LOUGHLIN | W575: TEAM | X575: W | Y575: L | Z575: D | AA575: FOR | AB575: AGST | AC575: % | AD575: PTS
A576: NORTH MELBOURNE | C576: D. NOONAN | F576: GRAHAM | H576: STEWART | J576: CONSIDINE | M576: MORRISON | Q576: DALTON
A577: BRUNSWICK | C577: CLEMENTS | F577: CASEY | H577: SMITH | J577: MULVANEY | M577: ROBERTSON | Q577: GREEVES | W577: RICHMOND | X577: 12 | Y577: 1 | Z577: 0 | AA577: 619 | AB577: 309 | AC577: =AA577/AB577*100 -> 200.32362459546925 | AD577: 48
A578: GOALKICKERS | W578: NORTH MELBOURNE | X578: 10 | Y578: 2 | Z578: 1 | AA578: 689 | AB578: 408 | AC578: 168.87254901960785 | AD578: 42
A579: NORTH MELBOURNE | C579: KENNEDY 2 | F579: ARMSTRONG 2 | I579: SMITH 2 | K579: ARBLASTER | N579: O'BRIEN | P579: P NOONAN | R579: CONSIDINE | W579: FOOTSCRAY | X579: 10 | Y579: 3 | Z579: 0 | AA579: 695 | AB579: 408 | AC579: 170.34 | AD579: 40
A580: BRUNSWICK | C580: CLEMENTS 2 | F580: BRAID | I580: ROBERTSON | K580: SMITH | N580: BURKE | W580: WEST MELBOURNE | X580: 9 | Y580: 4 | Z580: 0 | AA580: 607 | AB580: 441 | AC580: 137.64 | AD580: 36
A582: FOOTSCRAY | C582: 2 | D582: 2 | E582: =C582*6+D582 -> 14 | G582: 4 | H582: 8 | I582: =G582*6+H582 -> 32 | K582: 5 | L582: 8 | M582: =K582*6+L582 -> 38 | O582: 6 | P582: 12 | Q582: =O582*6+P582 -> 48 | S582: P'TON | W582: WILLIAMSTOWN | X582: 6 | Y582: 6 | Z582: 1 | AA582: 537 | AB582: 433 | AC582: 124.02 | AD582: 26
A583: PRESTON | C583: 0 | D583: 3 | E583: =C583*6+D583 -> 3 | G583: 1 | H583: 7 | I583: =G583*6+H583 -> 13 | K583: 3 | L583: 7 | M583: =K583*6+L583 -> 25 | O583: 3 | P583: 9 | Q583: =O583*6+P583 -> 27 | S583: TAYLOR | W583: BRUNSWICK | X583: 6 | Y583: 7 | Z583: 0 | AA583: 506 | AB583: 516 | AC583: 98.062015503875969 | AD583: 24
A584: BEST PLAYERS | W584: PORT MELBOURNE | X584: 5 | Y584: 8 | Z584: 0 | AA584: 391 | AB584: 614 | AC584: 63.680781758957657 | AD584: 20
A585: FOOTSCRAY | C585: McCARTHY | F585: MARMO | I585: KRUSE | K585: GROVES | N585: DECOIT | Q585: HUGHES | W585: PRESTON | X585: 4 | Y585: 9 | Z585: 0 | AA585: 434 | AB585: 588 | AC585: =AA585/AB585*100 -> 73.80952380952381 | AD585: 16
A586: PRESTON | C586: LAZARUS | F586: GATES | I586: J .KNELL | K586: MCCLUMPA | N586: WARNE | Q586: P. HALL | W586: PRAHRAN | X586: 2 | Y586: 11 | Z586: 0 | AA586: 446 | AB586: 651 | AC586: 68.509984639016892 | AD586: 8
A587: GOALKICKERS | W587: ESSENDON TOWN | X587: 0 | Y587: 13 | Z587: 0 | AA587: 256 | AB587: 822 | AC587: 31.14 | AD587: 0
A588: FOOTSCRAY | C588: FLWELLYN 2 | F588: DECOIT 2 | I588: WHITFIELD | K588: WILLIAMS
A589: PRESTON | C589: WAWN 2 | F589: R KNELL
A591: WILLIAMSTOWN | C591: 2 | D591: 5 | E591: =C591*6+D591 -> 17 | G591: 4 | H591: 9 | I591: =G591*6+H591 -> 33 | K591: 6 | L591: 13 | M591: =K591*6+L591 -> 49 | O591: 9 | P591: 17 | Q591: =O591*6+P591 -> 71 | S591: W'TOWN
A592: PORT MELBOURNE | C592: 1 | D592: 1 | E592: =C592*6+D592 -> 7 | G592: 2 | H592: 1 | I592: =G592*6+H592 -> 13 | K592: 2 | L592: 3 | M592: =K592*6+L592 -> 15 | O592: 3 | P592: 4 | Q592: =O592*6+P592 -> 22 | S592: BAIN
A593: BEST PLAYERS
A594: WILLIAMSTOWN | C594: LAWSON | F594: LEGGE | I594: DAVIS | K594: DICK | N594: SPRINTHALL | Q594: MANDERSON
A595: PORT MELBOURNE | C595: KEENAN | F595: MOLONEY | I595: JOHNSON | K595: GARBUTT | N595: ABBOTT | Q595: PETTIT
A596: GOALKICKERS
A597: WILLIAMSTOWN | C597: PRESCOTT 2 | F597: MATTHEWS 2 | I597: McKINLEY 2
A598: PORT MELBOURNE | C598: YATES 2 | F598: CROFT
A600: WEST MELBOURNE | C600: 2 | D600: 5 | E600: =C600*6+D600 -> 17 | G600: 4 | H600: 6 | I600: =G600*6+H600 -> 30 | K600: 7 | L600: 13 | M600: =K600*6+L600 -> 55 | O600: 10 | P600: 13 | Q600: =O600*6+P600 -> 73 | S600: NORTH MELB
A601: ESSENDON TOWN | C601: 1 | D601: 0 | E601: =C601*6+D601 -> 6 | G601: 2 | H601: 2 | I601: =G601*6+H601 -> 14 | K601: 2 | L601: 2 | M601: =K601*6+L601 -> 14 | O601: 2 | P601: 4 | Q601: =O601*6+P601 -> 16 | S601: MURPHY
A602: BEST PLAYERS
A603: WEST MELBOURNE | C603: RYAN | F603: McVEE | I603: ARMSTRONG | L603: J .WILLIAMS | O603: DEAN | R603: QUILLIGAN
A604: ESSENDON TOWN | C604: STANWORTH | F604: BUSBRIDGE | I604: HAWKINS | L604: GRIFFITHS | O604: SHELDON | R604: PAINE
A605: GOALKICKERS
A606: WEST MELBOURNE | C606: RYAN 3
A607: ESSENDON TOWN
A609: RICHMOND | C609: 2 | D609: 3 | E609: =C609*6+D609 -> 15 | G609: 7 | H609: 7 | I609: =G609*6+H609 -> 49 | K609: 7 | L609: 10 | M609: =K609*6+L609 -> 52 | O609: 8 | P609: 13 | Q609: =O609*6+P609 -> 61 | S609: RICHMOND
A610: PRAHRAN | C610: 1 | D610: 1 | E610: =C610*6+D610 -> 7 | G610: 1 | H610: 1 | I610: =G610*6+H610 -> 7 | K610: 2 | L610: 2 | M610: =K610*6+L610 -> 14 | O610: 3 | P610: 5 | Q610: =O610*6+P610 -> 23 | S610: KENNISON
A611: BEST PLAYERS
A612: RICHMOND | C612: JOHNSTON | F612: WILLIAMS | I612: BOWNAS | L612: EDMONDS | O612: E. JUSTINS | R612: BACKHOUSE
A613: PRAHRAN | C613: T. BROWN | F613: G. BROWN | I613: CHALMERS | L613: WESTBROOK | O613: JAMIESON | R613: DUPE
A614: GOALKICKERS
A615: RICHMOND | C615: HALL 2 | F615: JOHNSTON 2 | I615: MAINE | K615: McDONALD | N615: DUNCAN | P615: LYONS
A616: PRAHRAN | C616: FLYNN 2 | F616: G BACKHOUSE
A618: ROUND 14 | E618: 1ST AUGUST | J618: WEATHER | N618: SOUTH EAST BREEZE OVERCAST DULL
D619: 1ST QTR | H619: 2ND QTR | L619: 3RD QTR | P619: FINAL | S619: PLAYED AT
A620: NORTH MELBOURNE | C620: 1 | D620: 8 | E620: =C620*6+D620 -> 14 | G620: 1 | H620: 14 | I620: =G620*6+H620 -> 20 | K620: 7 | L620: 15 | M620: =K620*6+L620 -> 57 | O620: 9 | P620: 18 | Q620: =O620*6+P620 -> 72 | S620: NORTH MELB | X620: LADDER | AB620: ROUND | AD620: 14
A621: WILLIAMSTOWN | C621: 0 | D621: 0 | E621: =C621*6+D621 -> 0 | G621: 4 | H621: 1 | I621: =G621*6+H621 -> 25 | K621: 5 | L621: 4 | M621: =K621*6+L621 -> 34 | O621: 6 | P621: 7 | Q621: =O621*6+P621 -> 43 | S621: UMPIRE
A622: BEST PLAYERS | S622: O'LOUGHLIN | W622: TEAM | X622: W | Y622: L | Z622: D | AA622: FOR | AB622: AGST | AC622: % | AD622: PTS
A623: NORTH MELBOURNE | C623: P. NOONAN | F623: MORRISON | I623: BOYLE | K623: BROTHERTON | N623: DALTON | Q623: JAMIESON
A624: WILLIAMSTOWN | C624: LEGGE | F624: DICK | I624: CALDWELL | K624: HOUGHTON | N624: MANDERSON | Q624: SHEEHAN | W624: RICHMOND | X624: 13 | Y624: 1 | Z624: 0 | AA624: 727 | AB624: 325 | AC624: =AA624/AB624*100 -> 223.69230769230768 | AD624: 52
A625: GOALKICKERS | W625: NORTH MELBOURNE | X625: 11 | Y625: 2 | Z625: 1 | AA625: 761 | AB625: 451 | AC625: 168.73614190687363 | AD625: 46
A626: NORTH MELBOURNE | C626: O'BRIEN 3 | F626: KENNEDY 2 | I626: SMITH | K626: ARBLASTER | N626: P. NOONAN | Q626: MORRISON | W626: FOOTSCRAY | X626: 11 | Y626: 3 | Z626: 0 | AA626: 740 | AB626: 447 | AC626: 165.55 | AD626: 44
A627: WILLIAMSTOWN | C627: MANDERSON | F627: SHEEHAN | I627: BRITT | K627: McKENZIE | N627: McKINLEY | Q627: PRESCOTT | W627: WEST MELBOURNE | X627: 9 | Y627: 5 | Z627: 0 | AA627: 639 | AB627: 476 | AC627: 134.24 | AD627: 36
A629: BRUNSWICK | C629: 0 | D629: 1 | E629: =C629*6+D629 -> 1 | G629: 1 | H629: 6 | I629: =G629*6+H629 -> 12 | K629: 2 | L629: 9 | M629: =K629*6+L629 -> 21 | O629: 4 | P629: 11 | Q629: =O629*6+P629 -> 35 | S629: BRUNSWICK | W629: BRUNSWICK | X629: 7 | Y629: 7 | Z629: 0 | AA629: 541 | AB629: 548 | AC629: 98.722627737226276 | AD629: 28
A630: WEST MELBOURNE | C630: 3 | D630: 2 | E630: =C630*6+D630 -> 20 | G630: 4 | H630: 2 | I630: =G630*6+H630 -> 26 | K630: 5 | L630: 2 | M630: =K630*6+L630 -> 32 | O630: 5 | P630: 2 | Q630: =O630*6+P630 -> 32 | S630: PYMM | W630: WILLIAMSTOWN | X630: 6 | Y630: 7 | Z630: 1 | AA630: 580 | AB630: 505 | AC630: 114.85 | AD630: 26
A631: BEST PLAYERS | W631: PORT MELBOURNE | X631: 5 | Y631: 9 | Z631: 0 | AA631: 430 | AB631: 659 | AC631: 65.250379362670714 | AD631: 20
A632: BRUNSWICK | C632: CLEMENTS | F632: CHASE | H632: SHELLNACK | K632: McNAMARA | N632: ANDREWS | Q632: BURKE | W632: PRESTON | X632: 4 | Y632: 10 | Z632: 0 | AA632: 480 | AB632: 645 | AC632: =AA632/AB632*100 -> 74.418604651162795 | AD632: 16
A633: WEST MELBOURNE | C633: J. WILLIAMS | F633: DEAN | H633: MADDEN | K633: H. LAXTON | N633: ROOKE | Q633: QUILLIGAN | W633: PRAHRAN | X633: 3 | Y633: 11 | Z633: 0 | AA633: 501 | AB633: 697 | AC633: 71.879483500717356 | AD633: 12
A634: GOALKICKERS | W634: ESSENDON TOWN | X634: 0 | Y634: 14 | Z634: 0 | AA634: 272 | AB634: 930 | AC634: 29.25 | AD634: 0
A635: BRUNSWICK | C635: CLEMENTS 4
A636: WEST MELBOURNE | C636: QUILLIGAN 2 | F636: PRIDEAUX 2 | I636: WILLIAMS
A638: FOOTSCRAY | C638: 2 | D638: 2 | E638: =C638*6+D638 -> 14 | G638: 4 | H638: 3 | I638: =G638*6+H638 -> 27 | K638: 4 | L638: 6 | M638: =K638*6+L638 -> 30 | O638: 6 | P638: 9 | Q638: =O638*6+P638 -> 45 | S638: PORT MELB
A639: PORT MELBOURNE | C639: 1 | D639: 4 | E639: =C639*6+D639 -> 10 | G639: 2 | H639: 8 | I639: =G639*6+H639 -> 20 | K639: 2 | L639: 14 | M639: =K639*6+L639 -> 26 | O639: 4 | P639: 15 | Q639: =O639*6+P639 -> 39 | S639: KENNISON
A640: BEST PLAYERS
A641: FOOTSCRAY | C641: HARRIS | F641: MARMO | I641: DECOIT | K641: HOOD | N641: HUGHES | Q641: MONTGARRETT
A642: PORT MELBOURNE | C642: STIVEY | F642: P.GARBUTT | I642: JOHNSON | K642: ABBOTT | N642: WILLIAMS | Q642: PETTIT
A643: GOALKICKERS
A644: FOOTSCRAY | C644: DECOIT 2 | F644: FLEWELLYN 2 | I644: HUGHES | L644: WHITFIELD
A645: PORT MELBOURNE | C645: P. GARBUTT 2 | F645: PETTIT | I645: McDONALD
A647: PRAHRAN | C647: 2 | D647: 4 | E647: =C647*6+D647 -> 16 | G647: 3 | H647: 6 | I647: =G647*6+H647 -> 24 | K647: 4 | L647: 7 | M647: =K647*6+L647 -> 31 | O647: 7 | P647: 13 | Q647: =O647*6+P647 -> 55 | S647: TOORAK PARK
A648: PRESTON | C648: 2 | D648: 4 | E648: =C648*6+D648 -> 16 | G648: 4 | H648: 6 | I648: =G648*6+H648 -> 30 | K648: 6 | L648: 9 | M648: =K648*6+L648 -> 45 | O648: 6 | P648: 10 | Q648: =O648*6+P648 -> 46 | S648: MURPHY
A649: BEST PLAYERS
A650: PRAHRAN | C650: WILLISON | F650: ROBERTS | I650: WESTBROOK | L650: DUPE | N650: BACKHOUSE | R650: G. BROWN
A651: PRESTON | C651: S. HALL | F651: COOPER | I651: McCLUMPA | L651: R. KNELL | N651: WHITEOAK | R651: RAFF
A652: GOALKICKERS
A653: PRAHRAN | C653: CHALMERS 2 | F653: DUPE | H653: FLYNN | J653: CROFT | L653: BACKHOUSE
A654: PRESTON | C654: R. KNELL 3 | F654: COOPER 2 | I654: WHITEOAK
A656: RICHMOND | C656: 4 | D656: 5 | E656: =C656*6+D656 -> 29 | G656: 9 | H656: 8 | I656: =G656*6+H656 -> 62 | K656: 11 | L656: 13 | M656: =K656*6+L656 -> 79 | O656: 15 | P656: 18 | Q656: =O656*6+P656 -> 108 | S656: ESS
A657: ESSENDON TOWN | C657: 0 | D657: 1 | E657: =C657*6+D657 -> 1 | G657: 1 | H657: 2 | I657: =G657*6+H657 -> 8 | K657: 2 | L657: 3 | M657: =K657*6+L657 -> 15 | O657: 2 | P657: 4 | Q657: =O657*6+P657 -> 16 | S657: TAYLOR
A658: BEST PLAYERS
A659: RICHMOND | C659: MAINE | F659: LYONS | I659: GAULT | K659: GEGGIE | N659: E. JUSTINS | Q659: T. WATSON
A660: ESSENDON TOWN | C660: BUSBRIDGE | F660: SWEATMAN | I660: HAWKINS | K660: GIRDWOOD | N660: O'KEEFE | Q660: HILTON
A661: GOALKICKERS
A662: RICHMOND | C662: MAINE 4 | F662: McCANCE 2 | I662: HALL 2 | K662: GAULT | M662: LYONS | O662: WILMOTT | R662: GEGGIE | U662: BACKHOUSE
A663: ESSENDON TOWN | C663: O'KEEFE
A665: ROUND 15 | E665: 8TH AUGUST | J665: WEATHER | M665: SOUTH EAST BREEZE FINE
D666: 1ST QTR | H666: 2ND QTR | L666: 3RD QTR | P666: FINAL | S666: PLAYED AT
A667: WILLIAMSTOWN | C667: 0 | D667: 8 | E667: =C667*6+D667 -> 8 | G667: 4 | H667: 10 | I667: =G667*6+H667 -> 34 | K667: 4 | L667: 14 | M667: =K667*6+L667 -> 38 | O667: 7 | P667: 20 | Q667: =O667*6+P667 -> 62 | S667: W'TOWN | X667: LADDER | AB667: ROUND | AD667: 15
A668: WEST MELBOURNE | C668: 1 | D668: 0 | E668: =C668*6+D668 -> 6 | G668: 3 | H668: 2 | I668: =G668*6+H668 -> 20 | K668: 4 | L668: 3 | M668: =K668*6+L668 -> 27 | O668: 4 | P668: 5 | Q668: =O668*6+P668 -> 29 | S668: UMPIRE
A669: BEST PLAYERS | S669: MURPHY | W669: TEAM | X669: W | Y669: L | Z669: D | AA669: FOR | AB669: AGST | AC669: % | AD669: PTS
A670: WILLIAMSTOWN | C670: SPRINTHALL | F670: LAWSON | I670: WILSHER | L670: DAVIS | N670: BRITT | Q670: HOLLIGAN
A671: WEST MELBOURNE | C671: D. GREGORY | F671: J. WILLIAMS | I671: H. LAXTON | L671: ROLENT | N671: PRIDEAUX | Q671: QUILLIGAN | W671: RICHMOND | X671: 14 | Y671: 1 | Z671: 0 | AA671: 801 | AB671: 361 | AC671: =AA671/AB671*100 -> 221.88365650969527 | AD671: 56
A672: GOALKICKERS | W672: NORTH MELBOURNE | X672: 12 | Y672: 2 | Z672: 1 | AA672: 845 | AB672: 471 | AC672: 179.40552016985137 | AD672: 50
A673: WILLIAMSTOWN | C673: HOLLIGAN 2 | F673: McKENZIE 2 | I673: PRESCOTT | L673: MATTHEWS | W673: FOOTSCRAY | X673: 12 | Y673: 3 | Z673: 0 | AA673: 816 | AB673: 454 | AC673: 179.74 | AD673: 48
A674: WEST MELBOURNE | C674: ARMSTRONG 2 | F674: DEAN | I674: PRIDEAUX | W674: WEST MELBOURNE | X674: 9 | Y674: 6 | Z674: 0 | AA674: 668 | AB674: 538 | AC674: 124.16 | AD674: 36
A676: NORTH MELBOURNE | C676: 2 | D676: 4 | E676: =C676*6+D676 -> 16 | G676: 5 | H676: 7 | I676: =G676*6+H676 -> 37 | K676: 11 | L676: 11 | M676: =K676*6+L676 -> 77 | O676: 12 | P676: 12 | Q676: =O676*6+P676 -> 84 | S676: NORTH MELB | W676: BRUNSWICK | X676: 8 | Y676: 7 | Z676: 0 | AA676: 644 | AB676: 569 | AC676: 113.18101933216168 | AD676: 32
A677: PRESTON | C677: 2 | D677: 0 | E677: =C677*6+D677 -> 12 | G677: 2 | H677: 0 | I677: =G677*6+H677 -> 12 | K677: 2 | L677: 1 | M677: =K677*6+L677 -> 13 | O677: 2 | P677: 8 | Q677: =O677*6+P677 -> 20 | S677: PYMM | W677: WILLIAMSTOWN | X677: 7 | Y677: 7 | Z677: 1 | AA677: 642 | AB677: 534 | AC677: 120.22 | AD677: 30
A678: BEST PLAYERS | W678: PORT MELBOURNE | X678: 5 | Y678: 10 | Z678: 0 | AA678: 466 | AB678: 733 | AC678: 63.574351978171897 | AD678: 20
A679: NORTH MELBOURNE | C679: BOYLE | F679: P. NOONAN | I679: WHELAN | L679: STEWART | O679: McDERMOTT | R679: McCANN | W679: PRESTON | X679: 4 | Y679: 11 | Z679: 0 | AA679: 500 | AB679: 729 | AC679: =AA679/AB679*100 -> 68.587105624142666 | AD679: 16
A680: PRESTON | C680: S. HALL | F680: P. HALL | I680: McCLUMPA | L680: COOPER | O680: DICKENS | R680: PRATT | W680: PRAHRAN | X680: 3 | Y680: 12 | Z680: 0 | AA680: 508 | AB680: 773 | AC680: 65.717981888745143 | AD680: 12
A681: GOALKICKERS | W681: ESSENDON TOWN | X681: 0 | Y681: 15 | Z681: 0 | AA681: 293 | AB681: 1033 | AC681: 28.36 | AD681: 0
A682: NORTH MELBOURNE | C682: McCANN 3 | F682: SMITH 2 | H682: MILNE 2 | J682: GRAHAM | L682: STEWART | N682: WHELAN | P682: CONSIDINE | S682: O'BRIEN
A683: PRESTON | C683: MARTIN | F683: R. KNELL
A685: RICHMOND | C685: 2 | D685: 4 | E685: =C685*6+D685 -> 16 | G685: 6 | H685: 6 | I685: =G685*6+H685 -> 42 | K685: 9 | L685: 8 | M685: =K685*6+L685 -> 62 | O685: 11 | P685: 8 | Q685: =O685*6+P685 -> 74 | S685: RICHMOND
A686: PORT MELBOURNE | C686: 1 | D686: 1 | E686: =C686*6+D686 -> 7 | G686: 3 | H686: 4 | I686: =G686*6+H686 -> 22 | K686: 3 | L686: 5 | M686: =K686*6+L686 -> 23 | O686: 5 | P686: 6 | Q686: =O686*6+P686 -> 36 | S686: O'LOUGHLIN
A687: BEST PLAYERS
A688: RICHMOND | C688: EDMONDS | F688: T. WATSON | I688: McCANCE | K688: VOLLUGI | N688: RICHARDSON | Q688: BACKHOUSE
A689: PORT MELBOURNE | C689: PETTIT | F689: STIVEY | I689: YATES | K689: KEENAN | N689: CROFT | Q689: JOHNSON
A690: GOALKICKERS
A691: RICHMOND | C691: WADE 4 | F691: McDONALD 3 | I691: MAINE 2 | K691: LYONS 2
A692: PORT MELBOURNE | C692: J. McDONALD 2 | G692: PETTIT | I692: KEENAN | K692: STIVEY
A694: FOOTSCRAY | C694: 3 | D694: 4 | E694: =C694*6+D694 -> 22 | G694: 3 | H694: 5 | I694: =G694*6+H694 -> 23 | K694: 6 | L694: 9 | M694: =K694*6+L694 -> 45 | O694: 10 | P694: 16 | Q694: =O694*6+P694 -> 76 | S694: FOOTSCRAY
A695: PRAHRAN | C695: 0 | D695: 1 | E695: =C695*6+D695 -> 1 | G695: 0 | H695: 1 | I695: =G695*6+H695 -> 1 | K695: 1 | L695: 1 | M695: =K695*6+L695 -> 7 | O695: 1 | P695: 1 | Q695: =O695*6+P695 -> 7 | S695: CLARK
A696: BEST PLAYERS
A697: FOOTSCRAY | C697: MONTGARRETT | F697: GROVES | I697: KRUSE | K697: MARMO | N697: GRAHAM | Q697: O'SHEA
A698: PRAHRAN | C698: G. BROWN | F698: ROBERTS | I698: T. BROWN | K698: DRAPER | N698: MCDONALD | Q698: DUPE
A699: GOALKICKERS
A700: FOOTSCRAY | C700: E. STEPHENSON 4 | G700: FLEWELLYN 3 | J700: DECOIT 2 | L700: GROVES
A701: PRAHRAN | C701: McDONALD
A703: BRUNSWICK | C703: 2 | D703: 5 | E703: =C703*6+D703 -> 17 | G703: 6 | H703: 9 | I703: =G703*6+H703 -> 45 | K703: 9 | L703: 15 | M703: =K703*6+L703 -> 69 | O703: 14 | P703: 19 | Q703: =O703*6+P703 -> 103 | S703: BRUNSWICK
A704: ESSENDON TOWN | C704: 3 | D704: 2 | E704: =C704*6+D704 -> 20 | G704: 3 | H704: 3 | I704: =G704*6+H704 -> 21 | K704: 3 | L704: 3 | M704: =K704*6+L704 -> 21 | O704: 3 | P704: 3 | Q704: =O704*6+P704 -> 21 | S704: BAIN
A705: BEST PLAYERS
A706: BRUNSWICK | C706: CLEMENTS | F706: CASEY | H706: SHELLNACK | K706: CHASE | N706: BRAID | Q706: JOHNSON
A707: ESSENDON TOWN | C707: DAVIS | F707: O'KEEFE | H707: WARRY | K707: GRAHAM | N707: GIRDWOOD | Q707: PAINE
A708: GOALKICKERS
A709: BRUNSWICK | C709: CLEMENTS 11 | F709: SHELLNACK 2 | I709: BRAID
A710: ESSENDON TOWN | C710: DAVIS 2 | F710: WARRY
A712: ROUND 16 | E712: 15TH AUGUST | K712: WEATHER | N712: RAIN STRONG NORTH WIND
D713: 1ST QTR | H713: 2ND QTR | L713: 3RD QTR | P713: FINAL | S713: PLAYED AT
A714: WEST MELBOURNE | C714: 3 | D714: 2 | E714: =C714*6+D714 -> 20 | G714: 3 | H714: 3 | I714: =G714*6+H714 -> 21 | K714: 4 | L714: 4 | M714: =K714*6+L714 -> 28 | O714: 4 | P714: 5 | Q714: =O714*6+P714 -> 29 | S714: NORTH MELB | X714: LADDER | AB714: ROUND | AD714: 16
A715: FOOTSCRAY | C715: 0 | D715: 0 | E715: =C715*6+D715 -> 0 | G715: 1 | H715: 1 | I715: =G715*6+H715 -> 7 | K715: 1 | L715: 1 | M715: =K715*6+L715 -> 7 | O715: 1 | P715: 2 | Q715: =O715*6+P715 -> 8 | S715: UMPIRE
A716: BEST PLAYERS | S716: O'LOUGHLIN | W716: TEAM | X716: W | Y716: L | Z716: D | AA716: FOR | AB716: AGST | AC716: % | AD716: PTS
A717: WEST MELBOURNE | C717: RYAN | F717: H. LAXTON | I717: J. WILLIAMS | L717: DEAN | N717: MADDEN | Q717: ROLENT
A718: FOOTSCRAY | C718: GRAHAM | F718: MONTGARRETT | I718: DOUPE | L718: PAYNE | W718: RICHMOND | X718: 15 | Y718: 1 | Z718: 0 | AA718: 881 | AB718: 386 | AC718: 228.24 | AD718: 60
A719: GOALKICKERS | W719: NORTH MELBOURNE | X719: 13 | Y719: 2 | Z719: 1 | AA719: 931 | AB719: 503 | AC719: 185.08946322067595 | AD719: 54
A720: WEST MELBOURNE | C720: RYAN 2 | F720: CURROW | I720: PRIDEAUX | W720: FOOTSCRAY | X720: 12 | Y720: 4 | Z720: 0 | AA720: 824 | AB720: 483 | AC720: 170.6 | AD720: 48
A721: FOOTSCRAY | C721: HUGHES | W721: WEST MELBOURNE | X721: 10 | Y721: 6 | Z721: 0 | AA721: 697 | AB721: 546 | AC721: 127.66 | AD721: 40
A723: RICHMOND | C723: 2 | D723: 3 | E723: =C723*6+D723 -> 15 | G723: 5 | H723: 8 | I723: =G723*6+H723 -> 38 | K723: 8 | L723: 11 | M723: =K723*6+L723 -> 59 | O723: 10 | P723: 20 | Q723: =O723*6+P723 -> 80 | S723: RICHMOND | W723: WILLIAMSTOWN | X723: 8 | Y723: 7 | Z723: 1 | AA723: 697 | AB723: 553 | AC723: 126.04 | AD723: 34
A724: BRUNSWICK | C724: 0 | D724: 4 | E724: =C724*6+D724 -> 4 | G724: 0 | H724: 4 | I724: =G724*6+H724 -> 4 | K724: 2 | L724: 4 | M724: =K724*6+L724 -> 16 | O724: 3 | P724: 7 | Q724: =O724*6+P724 -> 25 | S724: MURPHY | W724: BRUNSWICK | X724: 8 | Y724: 8 | Z724: 0 | AA724: 669 | AB724: 649 | AC724: 103.08 | AD724: 32
A725: BEST PLAYERS | W725: PRESTON | X725: 5 | Y725: 11 | Z725: 0 | AA725: 544 | AB725: 754 | AC725: =AA725/AB725*100 -> 72.148541114058347 | AD725: 20
A726: RICHMOND | C726: BOWNAS | F726: EDMONDS | I726: T. WATSON | L726: VOLLUGI | N726: GIBB | Q726: McDONALD | W726: PORT MELBOURNE | X726: 5 | Y726: 11 | Z726: 0 | AA726: 491 | AB726: 777 | AC726: 63.19 | AD726: 20
A727: BRUNSWICK | C727: CHASE | F727: BURKE | I727: CLEMENTS | L727: CASEY | N727: SHELLNACK | Q727: STEVENSON | W727: PRAHRAN | X727: 3 | Y727: 13 | Z727: 0 | AA727: 540 | AB727: 859 | AC727: 62.86 | AD727: 12
A728: GOALKICKERS | W728: ESSENDON TOWN | X728: 0 | Y728: 16 | Z728: 0 | AA728: 312 | AB728: 1088 | AC728: 28.68 | AD728: 0
A729: RICHMOND | C729: EDMONDS 3 | F729: McDONALD 3 | I729: MAINE | K729: HALL | M729: McNAIR | O729: LYONS
A730: BRUNSWICK | C730: STEVENSON 2 | F730: CLEMENTS
A732: PRESTON | C732: 1 | D732: 8 | E732: =C732*6+D732 -> 14 | G732: 1 | H732: 9 | I732: =G732*6+H732 -> 15 | K732: 3 | L732: 12 | M732: =K732*6+L732 -> 30 | O732: 5 | P732: 14 | Q732: =O732*6+P732 -> 44 | S732: P'TON
A733: PORT MELBOURNE | C733: 0 | D733: 0 | E733: =C733*6+D733 -> 0 | G733: 0 | H733: 5 | I733: =G733*6+H733 -> 5 | K733: 0 | L733: 0 | M733: =K733*6+L733 -> 0 | O733: 4 | P733: 1 | Q733: =O733*6+P733 -> 25 | S733: CLARKE | U733: PORT MELBOURNE HAD 19 MEN ON FIELD. GAME STOPPED IN 3RD QTR
A734: BEST PLAYERS | U734: FOR COUNT. P.M. SCORE OF 0 - 6 WAS FORFEITED
A735: PRESTON
A736: PORT MELBOURNE | C736: PETTIT | F736: STIVEY | I736: HILL | K736: ROBERTSON | N736: JOHNSON | Q736: McDONALD
A737: GOALKICKERS
A738: PRESTON | C738: GIBSON 2 | F738: J. KNELL | I738: GILBERT | L738: COOPER
A739: PORT MELBOURNE | C739: PETTIT | F739: STIVEY | I739: JOHNSON | L739: MALONEY
A741: WILLIAMSTOWN | C741: 1 | D741: 0 | E741: =C741*6+D741 -> 6 | G741: 5 | H741: 6 | I741: =G741*6+H741 -> 36 | K741: 6 | L741: 7 | M741: =K741*6+L741 -> 43 | O741: 7 | P741: 13 | Q741: =O741*6+P741 -> 55 | S741: ESS
A742: ESSENDON TOWN | C742: 1 | D742: 3 | E742: =C742*6+D742 -> 9 | G742: 1 | H742: 4 | I742: =G742*6+H742 -> 10 | K742: 1 | L742: 6 | M742: =K742*6+L742 -> 12 | O742: 2 | P742: 7 | Q742: =O742*6+P742 -> 19 | S742: PYMM
A743: BEST PLAYERS
A744: WILLIAMSTOWN | C744: DICK | F744: HOUGHTON | I744: LEGGE | K744: MANDERSON | N744: DAVIS | Q744: SPRINTHALL
A745: ESSENDON TOWN | C745: GIRDWOOD | F745: BUSBRIDGE | I745: NUMA | K745: PAINE | N745: DAVIS | Q745: SHELDON
A746: GOALKICKERS
A747: WILLIAMSTOWN | C747: PRESCOTT 2 | F747: MATTHEWS | I747: MANDERSON | L747: BLAIR | N747: McKENZIE | Q747: HOLLIGAN
A748: ESSENDON TOWN | C748: NUMA | F748: HILTON
A750: NORTH MELBOURNE | C750: 1 | D750: 2 | E750: =C750*6+D750 -> 8 | G750: 4 | H750: 8 | I750: =G750*6+H750 -> 32 | K750: 8 | L750: 12 | M750: =K750*6+L750 -> 60 | O750: 11 | P750: 20 | Q750: =O750*6+P750 -> 86 | S750: TOORAK PARK
A751: PRAHRAN | C751: 2 | D751: 3 | E751: =C751*6+D751 -> 15 | G751: 2 | H751: 3 | I751: =G751*6+H751 -> 15 | K751: 4 | L751: 8 | M751: =K751*6+L751 -> 32 | O751: 4 | P751: 8 | Q751: =O751*6+P751 -> 32 | S751: KENNISON
A752: BEST PLAYERS
A753: NORTH MELBOURNE | C753: LONDERGREN | F753: BOYLE | I753: P. NOONAN | K753: CARLTON | N753: CONSIDINE | R753: MORRISON
A754: PRAHRAN | C754: G. BROWN | F754: T. BROWN | I754: TRUSCOTT | K754: ROBERTS | N754: WESTBROOK | R754: FLYNN
A755: GOALKICKERS
A756: NORTH MELBOURNE | C756: CONSIDINE 5 | F756: McCANN 2 | I756: WOODHAM 2 | L756: KENNEDY | N756: MORRISON
A757: PRAHRAN | C757: FLYNN 2 | F757: G. BROWN | I757: JONES
A759: ROUND 17 | E759: 22ND AUGUST | K759: WEATHER | O759: NORTH WIND
D760: 1ST QTR | H760: 2ND QTR | L760: 3RD QTR | P760: FINAL | S760: PLAYED AT
A761: RICHMOND | C761: 0 | D761: 1 | E761: =C761*6+D761 -> 1 | G761: 2 | H761: 5 | I761: =G761*6+H761 -> 17 | K761: 3 | L761: 5 | M761: =K761*6+L761 -> 23 | O761: 5 | P761: 8 | Q761: =O761*6+P761 -> 38 | S761: NORTH MELB | X761: LADDER | AB761: ROUND | AD761: 17
A762: WEST MELBOURNE | C762: 2 | D762: 0 | E762: =C762*6+D762 -> 12 | G762: 2 | H762: 0 | I762: =G762*6+H762 -> 12 | K762: 2 | L762: 1 | M762: =K762*6+L762 -> 13 | O762: 2 | P762: 2 | Q762: =O762*6+P762 -> 14 | S762: UMPIRE
A763: BEST PLAYERS | S763: CLARKE | W763: TEAM | X763: W | Y763: L | Z763: D | AA763: FOR | AB763: AGST | AC763: % | AD763: PTS
A764: RICHMOND | C764: LYONS | E764: T. WATSON | H764: EDMONDS | K764: WILLIAMS | N764: RICHARDSON | Q764: BACKHOUSE
A765: WEST MELBOURNE | C765: POOLE | E765: H. LAXTON | H765: A. LAXTON | K765: HOGAN | N765: RYAN | Q765: FOX | W765: RICHMOND | X765: 16 | Y765: 1 | Z765: 0 | AA765: 919 | AB765: 400 | AC765: 229.75 | AD765: 64
A766: GOALKICKERS | W766: NORTH MELBOURNE | X766: 14 | Y766: 2 | Z766: 1 | AA766: 973 | AB766: 531 | AC766: 183.2391713747646 | AD766: 58
A767: RICHMOND | C767: WADE | E767: MAINE | H767: LYONS | J767: T. WATSON | M767: McNAIR | W767: FOOTSCRAY | X767: 13 | Y767: 4 | Z767: 0 | AA767: 870 | AB767: 507 | AC767: 171.6 | AD767: 52
A768: WEST MELBOURNE | C768: RYAN 2 | W768: WEST MELBOURNE | X768: 10 | Y768: 7 | Z768: 0 | AA768: 711 | AB768: 584 | AC768: 121.75 | AD768: 40
A770: FOOTSCRAY | C770: 0 | D770: 1 | E770: =C770*6+D770 -> 1 | G770: 2 | H770: 6 | I770: =G770*6+H770 -> 18 | K770: 4 | L770: 8 | M770: =K770*6+L770 -> 32 | O770: 6 | P770: 10 | Q770: =O770*6+P770 -> 46 | S770: BRUNSWICK | W770: WILLIAMSTOWN | X770: 9 | Y770: 7 | Z770: 1 | AA770: 781 | AB770: 586 | AC770: 133.28 | AD770: 38
A771: BRUNSWICK | C771: 0 | D771: 1 | E771: =C771*6+D771 -> 1 | G771: 1 | H771: 2 | I771: =G771*6+H771 -> 8 | K771: 2 | L771: 3 | M771: =K771*6+L771 -> 15 | O771: 3 | P771: 6 | Q771: =O771*6+P771 -> 24 | S771: BAIN | W771: BRUNSWICK | X771: 8 | Y771: 9 | Z771: 0 | AA771: 693 | AB771: 695 | AC771: 99.71 | AD771: 32
A772: BEST PLAYERS | W772: PRESTON | X772: 6 | Y772: 11 | Z772: 0 | AA772: 605 | AB772: 769 | AC772: =AA772/AB772*100 -> 78.673602080624178 | AD772: 24
A773: FOOTSCRAY | C773: WILLIAMS | F773: SWANNELL | I773: McCARTHY | L773: PAYNE | N773: MARMO | Q773: McCARROLL | W773: PORT MELBOURNE | X773: 5 | Y773: 12 | Z773: 0 | AA773: 519 | AB773: 819 | AC773: 63.369963369963372 | AD773: 20
A774: BRUNSWICK | C774: SHELLNACK | F774: LIVINGSTONE | I774: McNAMARA | L774: CASEY | N774: CLEMENTS | Q774: ANDREWS | W774: PRAHRAN | X774: 3 | Y774: 14 | Z774: 0 | AA774: 573 | AB774: 943 | AC774: 60.763520678685047 | AD774: 12
A775: GOALKICKERS | W775: ESSENDON TOWN | X775: 0 | Y775: 17 | Z775: 0 | AA775: 327 | AB775: 1149 | AC775: 28.46 | AD775: 0
A776: FOOTSCRAY | C776: FLEWELLYN | F776: HUGHES | I776: KEESHAN | L776: E. STEPHENSON
A777: BRUNSWICK | C777: SHELLNACK | F777: McINTOSH
A779: NORTH MELBOURNE | C779: 3 | D779: 4 | E779: =C779*6+D779 -> 22 | G779: 3 | H779: 4 | I779: =G779*6+H779 -> 22 | K779: 5 | L779: 12 | M779: =K779*6+L779 -> 42 | O779: 5 | P779: 12 | Q779: =O779*6+P779 -> 42 | S779: PORT MELB
A780: PORT MELBOURNE | C780: 0 | D780: 0 | E780: =C780*6+D780 -> 0 | G780: 1 | H780: 9 | I780: =G780*6+H780 -> 15 | K780: 1 | L780: 10 | M780: =K780*6+L780 -> 16 | O780: 2 | P780: 16 | Q780: =O780*6+P780 -> 28 | S780: O'LOUGHLIN
A781: BEST PLAYERS
A782: NORTH MELBOURNE | C782: P. NOONAN | F782: McDERMOTT | I782: JAMIESON | L782: CARLTON | O782: BOYLE | R782: LONDERGREN
A783: PORT MELBOURNE | C783: PETTIT | F783: YATES | I783: KEENAN | L783: BRODRIBB | O783: INGRAM | R783: STIVEY
A784: GOALKICKERS
A785: NORTH MELBOURNE | C785: CONSIDINE | F785: McCANN | H785: DALTON | K785: KENNEDY | N785: BROTHERTON
A786: PORT MELBOURNE | C786: J. McDONALD | G786: TREGLOWAN
A788: WILLIAMSTOWN | C788: 3 | D788: 8 | E788: =C788*6+D788 -> 26 | G788: 4 | H788: 8 | I788: =G788*6+H788 -> 32 | K788: 9 | L788: 12 | M788: =K788*6+L788 -> 66 | O788: 11 | P788: 18 | Q788: =O788*6+P788 -> 84 | S788: W'TON
A789: PRAHRAN | C789: 0 | D789: 0 | E789: =C789*6+D789 -> 0 | G789: 2 | H789: 5 | I789: =G789*6+H789 -> 17 | K789: 3 | L789: 6 | M789: =K789*6+L789 -> 24 | O789: 4 | P789: 9 | Q789: =O789*6+P789 -> 33 | S789: PYMM
A790: BEST PLAYERS
A791: WILLIAMSTOWN | C791: SHEEHAN | F791: WILSHER | H791: MANDERSON | K791: DICK | N791: PRESCOTT | Q791: HOUGHTON
A792: PRAHRAN | C792: JONES | F792: DRAPER | H792: G. BROWN | K792: ROBERTS | N792: JAMIESON | Q792: WESTBROOK
A793: GOALKICKERS
A794: WILLIAMSTOWN | C794: SHEEHAN 4 | F794: PRESCOTT 3 | I794: McKINLEY | L794: HOLLIGAN | O794: MANDERSON | R794: GIBSON
A795: PRAHRAN | C795: McDONALD | F795: JONES | I795: CHALMERS | L795: BACKHOUSE
A797: PRESTON | C797: 2 | D797: 5 | E797: =C797*6+D797 -> 17 | G797: 5 | H797: 6 | I797: =G797*6+H797 -> 36 | K797: 7 | L797: 9 | M797: =K797*6+L797 -> 51 | O797: 8 | P797: 13 | Q797: =O797*6+P797 -> 61 | S797: P'TON
A798: ESSENDON TOWN | C798: 0 | D798: 2 | E798: =C798*6+D798 -> 2 | G798: 1 | H798: 2 | I798: =G798*6+H798 -> 8 | K798: 2 | L798: 2 | M798: =K798*6+L798 -> 14 | O798: 2 | P798: 3 | Q798: =O798*6+P798 -> 15 | S798: MURPHY
A799: BEST PLAYERS
A800: PRESTON | C800: DICKENS | F800: LAZARUS | I800: J. KNELL | L800: GILBERT | O800: GIBSON | R800: McCLUMPA
A801: ESSENDON TOWN | C801: NUMA | F801: DAVIS | I801: STANWORTH | L801: GIRDWOOD | O801: AMBRIDGE | R801: COWAN
A802: GOALKICKERS
A803: PRESTON | C803: GIBSON 3 | F803: R. KNELL 2 | I803: GILBERT | L803: RICHARDSON | O803: DICKENS
A804: ESSENDON TOWN | C804: AMBRIDGE | F804: STANWORTH
A806: ROUND 18 | E806: 29TH AUGUST | J806: WEATHER | S806: PLAYED AT
D807: 1ST QTR | H807: 2ND QTR | L807: 3RD QTR | P807: FINAL | S807: NORTH MELB
A808: NORTH MELBOURNE | C808: 0 | D808: 0 | E808: =C808*6+D808 -> 0 | G808: 3 | H808: 2 | I808: =G808*6+H808 -> 20 | K808: 5 | L808: 3 | M808: =K808*6+L808 -> 33 | O808: 7 | P808: 4 | Q808: =O808*6+P808 -> 46 | S808: UMPIRE | X808: LADDER | AB808: ROUND | AD808: 18
A809: RICHMOND | C809: 1 | D809: 6 | E809: =C809*6+D809 -> 12 | G809: 1 | H809: 6 | I809: =G809*6+H809 -> 12 | K809: 2 | L809: 7 | M809: =K809*6+L809 -> 19 | O809: 2 | P809: 7 | Q809: =O809*6+P809 -> 19 | S809: O'LOUGHLIN
A810: BEST PLAYERS | W810: TEAM | X810: W | Y810: L | Z810: D | AA810: FOR | AB810: AGST | AC810: % | AD810: PTS
A811: NORTH MELBOURNE | C811: KENNEDY | F811: WHELAN | H811: McCARROLL | K811: CONSIDINE | N811: W. CARLTON | Q811: JAMIESON
A812: RICHMOND | C812: BOWNAS | F812: E. JUSTINS | H812: KENNY | K812: GIBB | N812: BACKHOUSE | Q812: McCANCE | W812: RICHMOND | X812: 16 | Y812: 2 | Z812: 0 | AA812: 938 | AB812: 446 | AC812: 210.31 | AD812: 64
A813: GOALKICKERS | W813: NORTH MELBOURNE | X813: 15 | Y813: 2 | Z813: 1 | AA813: 1019 | AB813: 550 | AC813: =AA813/AB813*100 -> 185.27272727272728 | AD813: 62
A814: NORTH MELBOURNE | C814: KENNEDY 3 | F814: P. NOONAN 2 | I814: O'BRIEN | K814: ENGLISH | W814: FOOTSCRAY | X814: 14 | Y814: 4 | Z814: 0 | AA814: 954 | AB814: 514 | AC814: 185.6 | AD814: 56
A815: RICHMOND | C815: MAINE | F815: VOLLUGI | W815: WEST MELBOURNE | X815: 11 | Y815: 7 | Z815: 0 | AA815: 765 | AB815: 622 | AC815: 122.99 | AD815: 44
A817: WILLIAMSTOWN | C817: 4 | D817: 4 | E817: =C817*6+D817 -> 28 | G817: 6 | H817: 4 | I817: =G817*6+H817 -> 40 | K817: 8 | L817: 11 | M817: =K817*6+L817 -> 59 | O817: 10 | P817: 12 | Q817: =O817*6+P817 -> 72 | S817: W'TOWN | W817: WILLIAMSTOWN | X817: 10 | Y817: 7 | Z817: 1 | AA817: 853 | AB817: 620 | AC817: 137.59 | AD817: 42
A818: BRUNSWICK | C818: 0 | D818: 0 | E818: =C818*6+D818 -> 0 | G818: 1 | H818: 0 | I818: =G818*6+H818 -> 6 | K818: 1 | L818: 1 | M818: =K818*6+L818 -> 7 | O818: 5 | P818: 4 | Q818: =O818*6+P818 -> 34 | S818: MURPHY | W818: BRUNSWICK | X818: 8 | Y818: 10 | Z818: 0 | AA818: 727 | AB818: 767 | AC818: 94.78 | AD818: 32
A819: BEST PLAYERS | W819: PRESTON | X819: 6 | Y819: 12 | Z819: 0 | AA819: 643 | AB819: 824 | AC819: =AA819/AB819*100 -> 78.033980582524279 | AD819: 24
A820: WILLIAMSTOWN | C820: MANDERSON | F820: McNEILAGE | I820: PRESCOTT | L820: DICK | N820: MATTHEWS | Q820: HOUGHTON | W820: PORT MELBOURNE | X820: 6 | Y820: 12 | Z820: 0 | AA820: 555 | AB820: 842 | AC820: 65.914489311163891 | AD820: 24
A821: BRUNSWICK | C821: MCNAMARA | F821: JOHNSON | I821: CHASE | L821: CASEY | N821: BURKE | Q821: MATHIESON | W821: PRAHRAN | X821: 3 | Y821: 15 | Z821: 0 | AA821: 596 | AB821: 979 | AC821: 60.878447395301329 | AD821: 12
A822: GOALKICKERS | W822: ESSENDON TOWN | X822: 0 | Y822: 18 | Z822: 0 | AA822: 334 | AB822: 1233 | AC822: 27.09 | AD822: 0
A823: WILLIAMSTOWN | C823: PRESCOTT 2 | F823: MATTHEWS 2 | I823: HOLLIGAN | L823: MANDERSON | O823: MCKINLEY | R823: LAWSON
A824: BRUNSWICK | C824: McKINLAY 2 | F824: CHASE | I824: CLEMENTS | L824: MATHIESON
A826: WEST MELBOURNE | C826: 3 | D826: 2 | E826: =C826*6+D826 -> 20 | G826: 3 | H826: 4 | I826: =G826*6+H826 -> 22 | K826: 6 | L826: 6 | M826: =K826*6+L826 -> 42 | O826: 8 | P826: 6 | Q826: =O826*6+P826 -> 54 | S826: P'TON
A827: PRESTON | C827: 1 | D827: 1 | E827: =C827*6+D827 -> 7 | G827: 4 | H827: 2 | I827: =G827*6+H827 -> 26 | K827: 4 | L827: 2 | M827: =K827*6+L827 -> 26 | O827: 6 | P827: 2 | Q827: =O827*6+P827 -> 38 | S827: PYMM
A828: BEST PLAYERS
A829: WEST MELBOURNE | C829: QUILLIGAN | F829: A. LAXTON | I829: H. LAXTON | L829: HAYES | O829: WILLIAMS | R829: MADDEN
A830: PRESTON | C830: WHITEOAK | F830: S. HALL | I830: DOULL | L830: J. KNELL | O830: GATES | R830: COOPER
A831: GOALKICKERS
A832: WEST MELBOURNE | C832: RYAN 6 | F832: ROOKE | I832: FOX
A833: PRESTON | C833: R. KNELL 2 | F833: GILBERT | I833: WAWN | L833: RICHARDSON | P833: HALL
A835: FOOTSCRAY | C835: 6 | D835: 4 | E835: =C835*6+D835 -> 40 | G835: 6 | H835: 5 | I835: =G835*6+H835 -> 41 | K835: 11 | L835: 8 | M835: =K835*6+L835 -> 74 | O835: 12 | P835: 12 | Q835: =O835*6+P835 -> 84 | S835: FOOTSCRAY
A836: ESSENDON TOWN | C836: 0 | D836: 0 | E836: =C836*6+D836 -> 0 | G836: 1 | H836: 0 | I836: =G836*6+H836 -> 6 | K836: 1 | L836: 0 | M836: =K836*6+L836 -> 6 | O836: 1 | P836: 1 | Q836: =O836*6+P836 -> 7 | S836: KENNISON
A837: BEST PLAYERS
A838: FOOTSCRAY | C838: E. STEPHENSON | G838: MONTGARRETT | K838: WILLIAMS | N838: KRUSE | P838: McCARROLL | S838: O'SHEA
A839: ESSENDON TOWN | C839: JOLLY | F839: DAVIS | H839: O'KEEFE | K839: GIRDWOOD | N839: NUMA | P839: BUSBRIDGE
A840: GOALKICKERS
A841: FOOTSCRAY | C841: E. STEPHENSON 10 | H841: McVEE | J841: PAYNE
A842: ESSENDON TOWN | C842: O'KEEFE
A844: PORT MELBOURNE | C844: 0 | D844: 2 | E844: =C844*6+D844 -> 2 | G844: 2 | H844: 3 | I844: =G844*6+H844 -> 15 | K844: 4 | L844: 4 | M844: =K844*6+L844 -> 28 | O844: 5 | P844: 6 | Q844: =O844*6+P844 -> 36 | S844: TOORAK PARK
A845: PRAHRAN | C845: 1 | D845: 4 | E845: =C845*6+D845 -> 10 | G845: 1 | H845: 5 | I845: =G845*6+H845 -> 11 | K845: 1 | L845: 8 | M845: =K845*6+L845 -> 14 | O845: 2 | P845: 11 | Q845: =O845*6+P845 -> 23 | S845: BAIN
A846: BEST PLAYERS
A847: PORT MELBOURNE | C847: YATES | F847: STIVEY | I847: KEENAN | K847: J. MCDONALD | N847: W. MCDONALD | Q847: WILLIAMS
A848: PRAHRAN | C848: T. BROWN | F848: G. BROWN | I848: CHALMERS | K848: WESTBROOK | N848: DUPE | Q848: JONES
A849: GOALKICKERS
A850: PORT MELBOURNE | C850: CROFT 3 | F850: W. McDONALD | J850: J. McDONALD
A851: PRAHRAN | C851: LAYTON | F851: BACKHOUSE
A853: FINALS
A855: 1ST SEMI | E855: 5TH SEPTEMBER | J855: WEATHER | N855: STRONG NORTH WEST WIND OVERCAST
D857: 1ST QTR | H857: 2ND QTR | L857: 3RD QTR | P857: FINAL
S858: PLAYED AT
A859: NORTH MELBOURNE | C859: 0 | D859: 0 | E859: =C859*6+D859 -> 0 | G859: 3 | H859: 5 | I859: =G859*6+H859 -> 23 | K859: 4 | L859: 6 | M859: =K859*6+L859 -> 30 | O859: 9 | P859: 10 | Q859: =O859*6+P859 -> 64 | S859: PORT MELB
A860: WEST MELBOURNE | C860: 0 | D860: 0 | E860: =C860*6+D860 -> 0 | G860: 0 | H860: 0 | I860: =G860*6+H860 -> 0 | K860: 3 | L860: 4 | M860: =K860*6+L860 -> 22 | O860: 4 | P860: 4 | Q860: =O860*6+P860 -> 28 | S860: UMPIRE
A861: BEST PLAYERS | S861: O'LOUGHLIN
A862: NORTH MELBOURNE | D862: LONDERGREN | G862: W. CARLTON | J862: P. NOONAN | L862: CONSIDINE | O862: MORRISON | S862: KENNEDY
A863: WEST MELBOURNE | D863: DEAN | G863: MADDEN | J863: RYAN | L863: ROLENT | O863: B. WILLIAMS | S863: A. LAXTON
A864: GOALKICKERS
A865: NORTH MELBOURNE | D865: ARMSTRONG 2 | G865: O'BRIEN 2 | J865: GRAHAM | L865: LONDERIGEN | O865: W. CARLTON | R865: CONSIDINE
A866: WEST MELBOURNE | D866: RYAN | G866: J.WILLIAMS | J866: POOLE | L866: RANKIN
A868: TEAMS
F869: NORTH MELBOURNE | S869: WEST MELBOURNE
A871: BACKS | C871: MARTIN | F871: McDERMOTT | J871: KENNEDY | O871: T. WILLIAMS | S871: D. GREGORY | W871: BATTY
A872: H-BACKS | C872: CARLTON | F872: D. JAMIESON | J872: BOYLE | O872: MADDEN | S872: J. WILLIAMS | W872: DEAN
A873: CENTRES | C873: STEWART | F873: LONDERGREN | J873: BROTHERTON | O873: H. LAXTON | S873: ROLENT | W873: QUILLIGAN
A874: H-FORWARDS | C874: O'BRIEN | F874: O'MARA | J874: DALTON | O874: A. LAXTON | S874: CURROW | W874: RYAN
A875: FORWARDS | C875: ENGLISH | F875: McCANN | J875: ARMSTRONG | O875: FOX | S875: PRIDEAUX | W875: RANKIN
A876: RUCKS | C876: MORRISON | F876: GRAHAM | J876: P. NOONAN | O876: McVEA | S876: ARMSTRONG | W876: POOLE
A878: 2ND SEMI | E878: 5TH SEPTEMBER | J878: WEATHER | N878: STRONG NORTH WEST WIND OVERCAST
A880: FOOTSCRAY | C880: 2 | D880: 3 | E880: =C880*6+D880 -> 15 | G880: 3 | H880: 4 | I880: =G880*6+H880 -> 22 | K880: 7 | L880: 8 | M880: =K880*6+L880 -> 50 | O880: 8 | P880: 8 | Q880: =O880*6+P880 -> 56 | S880: NORTH MELB
A881: RICHMOND | C881: 0 | D881: 1 | E881: =C881*6+D881 -> 1 | G881: 3 | H881: 4 | I881: =G881*6+H881 -> 22 | K881: 3 | L881: 4 | M881: =K881*6+L881 -> 22 | O881: 5 | P881: 10 | Q881: =O881*6+P881 -> 40 | S881: MURPHY
A882: BEST PLAYERS
A883: FOOTSCRAY | C883: MONTGARRETT | F883: MARMO | I883: PAYNE | L883: O'SHEA | N883: KRUSE | R883: HUGHES
A884: RICHMOND | C884: BOWNAS | F884: WADE | I884: KENNY | L884: HALL | N884: McDONALD | R884: E.JUSTINS
A885: GOALKICKERS
A886: FOOTSCRAY | C886: FLEWELLYN 2 | F886: E. STEPHENSON 2 | J886: WILLIAMS | M886: DECOIT | O886: KRUSE | Q886: HUGHES
A887: RICHMOND | C887: HALL 4 | F887: MCDONALD
A889: TEAMS
F890: FOOTSCRAY | S890: RICHMOND
A892: BACKS | C892: SWANNELL | F892: McCARTHY | J892: PAYNE | O892: BOWNAS | S892: WILLIAMS | W892: E.JUSTIN
A893: H-BACKS | C893: O'SHEA | F893: MARMO | J893: GRAHAM | O893: EDMONDS | S893: T.WATSON | W893: McCANCE
A894: CENTRES | C894: HOOD | F894: W. KRUSE | J894: McCARROLL | O894: GIBB | S894: BACKHOUSE | W894: RICHARDSON
A895: H-FORWARDS | C895: GROVES | F895: E. STEPHENSON | J895: WILLIAMS | O895: McDONALD | S895: CATLIN | W895: MURPHY
A896: FORWARDS | C896: FLEWELLYN | F896: DECOIT | J896: JACKSON | O896: MAINE | S896: HALL | W896: KENNY
A897: RUCKS | C897: HUGHES | F897: OWENS | J897: MONTGARRETT | O897: LYONS | S897: JOHNSTON | W897: WADE
A899: FINAL | D899: 12TH SEPTEMBER | J899: WEATHER | N899: NORTH WIND SOUTHERLY CHANGE AT 1/2 TIME
A901: NORTH MELBOURNE | C901: 0 | D901: 0 | E901: =C901*6+D901 -> 0 | G901: 4 | H901: 7 | I901: =G901*6+H901 -> 31 | K901: 5 | L901: 9 | M901: =K901*6+L901 -> 39 | O901: 7 | P901: 11 | Q901: =O901*6+P901 -> 53 | S901: EAST MELB
A902: FOOTSCRAY | C902: 3 | D902: 4 | E902: =C902*6+D902 -> 22 | G902: 3 | H902: 5 | I902: =G902*6+H902 -> 23 | K902: 3 | L902: 6 | M902: =K902*6+L902 -> 24 | O902: 4 | P902: 9 | Q902: =O902*6+P902 -> 33 | S902: O'LOUGHLIN
A903: BEST PLAYERS
A904: NORTH MELBOURNE | D904: LONDERGREN | G904: BOYLE | J904: STEWART | M904: CONSIDINE | P904: W. CARLTON | T904: MORRISON
A905: FOOTSCRAY | D905: DECOIT | G905: MONTGARRETT | J905: MARMO | M905: HUGHES | P905: PAYNE | T905: GROVES
A906: GOALKICKERS
A907: NORTH MELBOURNE | D907: ARMSTRONG 2 | G907: McCANN | J907: GRAHAM
A908: FOOTSCRAY | D908: FLEWELLYN | G908: JACKSON | J908: McCARTHY
A910: TEAMS
F911: NORTH MELBOURNE | S911: FOOTSCRAY
A913: BACKS | C913: BARNES | F913: SMITH | J913: McDERMOTT | O913: SWANNELL | S913: McCARTHY | W913: PAYNE
A914: H-BACKS | C914: CARLTON | F914: D. JAMIESON | J914: BOYLE | O914: O'SHEA | S914: MARMO | W914: GRAHAM
A915: CENTRES | C915: STEWART | F915: LONDERGREN | J915: BROTHERTON | O915: HOOD | S915: W.KRUSE | W915: McCARROLL
A916: H-FORWARDS | C916: O'BRIEN | F916: KENNEDY | J916: O'MARA | O916: GROVES | S916: E. STEPHENSON | W916: WILLIAMS
A917: FORWARDS | C917: McCANN | F917: ARMSTRONG | J917: MARTIN | O917: DECOIT | S917: FLEWELLYN | W917: JACKSON
A918: RUCKS | C918: MORRISON | F918: GRAHAM | J918: CONSIDINE | O918: HUGHES | S918: OWENS | W918: MONTGARRETT
A920: GRAND FINAL | E920: 19TH SEPTEMBER | K920: WEATHER | N920: STRONG SOUTH EAST WIND OCCASIONAL SHOWERS
A922: NORTH MELBOURNE | C922: 3 | D922: 4 | E922: =C922*6+D922 -> 22 | G922: 3 | H922: 4 | I922: =G922*6+H922 -> 22 | K922: 7 | L922: 6 | M922: =K922*6+L922 -> 48 | O922: 7 | P922: 6 | Q922: =O922*6+P922 -> 48 | S922: EAST MELB
A923: RICHMOND | C923: 0 | D923: 0 | E923: =C923*6+D923 -> 0 | G923: 1 | H923: 4 | I923: =G923*6+H923 -> 10 | K923: 1 | L923: 4 | M923: =K923*6+L923 -> 10 | O923: 3 | P923: 9 | Q923: =O923*6+P923 -> 27 | S923: O'LOUGHLIN
A924: BEST PLAYERS
A925: NORTH MELBOURNE | D925: LONDERGREN | G925: GRAHAM | J925: STEWART | M925: W. CARLTON | P925: CONSIDINE | S925: P.NOONAN
A926: RICHMOND | D926: LYONS | G926: BOWNAS | J926: BACKHOUSE | M926: GIBB | P926: J. JUSTINS | S926: E. JUSTINS
A927: GOALKICKERS
A928: NORTH MELBOURNE | D928: CONSIDINE 3 | G928: O'BRIEN | J928: LONDERIGEN | M928: P. NOONAN | P928: McCANN
A929: RICHMOND | D929: JOHNSTON | G929: MAINE | J929: T. WATSON
A931: TEAMS
F932: NORTH MELBOURNE | S932: RICHMOND
A934: BACKS | C934: BARNES | F934: McDERMOTT | J934: KENNEDY | O934: VOLLUGI | S934: BOWNAS | W934: E. JUSTIN
A935: H-BACKS | C935: CARLTON | F935: D. JAMIESON | J935: BOYLE | O935: EDMONDS | S935: T. WATSON | W935: KENNY
A936: CENTRES | C936: STEWART | F936: LONDERGREN | J936: BROTHERTON | O936: GIBB | S936: BACKHOUSE | W936: RICHARDSON
A937: H-FORWARDS | C937: O'BRIEN | F937: O'MARA | J937: DALTON | O937: LYONS | S937: HALL | W937: McDONALD
A938: FORWARDS | C938: SMITH | F938: McCANN | J938: CONSIDINE | O938: WADE | S938: MAINE | W938: J. JUSTIN
A939: RUCKS | C939: MORRISON | F939: GRAHAM | J939: P. NOONAN | O939: JOHNSTON | S939: GAULT | W939: GEGGIE