A1: Victorian Football Association
A2: Season 1904
A3: © Copyright Wal Williams | F3: First created: 2 August 2014
A4: Contact: joywalwi at gmail dot com | F4: Last updated: 30 July 2017 | W4: VFA Results and tables - Link to the main index page
A5: You are free to copy this document in whole or part provided that proper acknowledgement is given to the author. All rights reserved.
A7: YEAR 1904
A8: ROUND 1 | E8: 7TH MAY | J8: WEATHER | N8: NORTH WIND
D9: 1ST QTR | H9: 2ND QTR | L9: 3RD QTR | P9: FINAL | S9: PLAYED AT
A10: FOOTSCRAY | C10: 1 | D10: 2 | E10: =C10*6+D10 -> 8 | G10: 9 | H10: 5 | I10: =G10*6+H10 -> 59 | K10: 13 | L10: 5 | M10: =K10*6+L10 -> 83 | O10: 16 | P10: 8 | Q10: =O10*6+P10 -> 104 | S10: FOOTSCRAY | X10: LADDER | AB10: ROUND | AD10: 1
A11: PRESTON | C11: 3 | D11: 2 | E11: =C11*6+D11 -> 20 | G11: 3 | H11: 2 | I11: =G11*6+H11 -> 20 | K11: 6 | L11: 5 | M11: =K11*6+L11 -> 41 | O11: 6 | P11: 5 | Q11: =O11*6+P11 -> 41 | S11: UMPIRE
A12: BEST PLAYERS | S12: FREAME | W12: TEAM | X12: W | Y12: L | Z12: D | AA12: FOR | AB12: AGST | AC12: % | AD12: PTS
A13: FOOTSCRAY | C13: DECOIT | F13: HARRIS | I13: HOLLIS | L13: O'SHEA | O13: MARMO | R13: WAGLAND
A14: PRESTON | C14: DICKENS | F14: DAVIDSON | I14: HALL | L14: McCLUMPA | O14: J KNELL | R14: R KNELL | W14: NORTH MELBOURNE | X14: 1 | Y14: 0 | Z14: 0 | AA14: 77 | AB14: 15 | AC14: 513.33333333333337 | AD14: 4
A15: GOALKICKERS | W15: WEST MELBOURNE | X15: 1 | Y15: 0 | Z15: 0 | AA15: 62 | AB15: 21 | AC15: 295.23809523809524 | AD15: 4
A16: FOOTSCRAY | C16: DECOIT 5 | F16: MORAN 3 | I16: HUGHES 3 | L16: MARMO 2 | N16: WAGLAND | Q16: FLEWELLYN | T16: HARRIS | W16: FOOTSCRAY | X16: 1 | Y16: 0 | Z16: 0 | AA16: 104 | AB16: 41 | AC16: 253.65853658536585 | AD16: 4
A17: PRESTON | C17: ROFF 2 | F17: MORGAN 2 | I17: WARNE | L17: LAWSON | W17: RICHMOND | X17: 1 | Y17: 0 | Z17: 0 | AA17: 59 | AB17: 30 | AC17: 196.66666666666666 | AD17: 4
A19: NORTH MELBOURNE | C19: 0 | D19: 0 | E19: =C19*6+D19 -> 0 | G19: 6 | H19: 3 | I19: =G19*6+H19 -> 39 | K19: 8 | L19: 4 | M19: =K19*6+L19 -> 52 | O19: 12 | P19: 5 | Q19: =O19*6+P19 -> 77 | S19: NORTH MELB | W19: PORT MELBOURNE | X19: 1 | Y19: 0 | Z19: 0 | AA19: 57 | AB19: 48 | AC19: 118.75 | AD19: 4
A20: BRUNSWICK | C20: 1 | D20: 1 | E20: =C20*6+D20 -> 7 | G20: 1 | H20: 1 | I20: =G20*6+H20 -> 7 | K20: 1 | L20: 1 | M20: =K20*6+L20 -> 7 | O20: 2 | P20: 3 | Q20: =O20*6+P20 -> 15 | S20: BAIN | W20: WILLIAMSTOWN | X20: 0 | Y20: 1 | Z20: 0 | AA20: 48 | AB20: 57 | AC20: 84.21052631578948 | AD20: 0
A21: BEST PLAYERS | W21: PRAHRAN | X21: 0 | Y21: 1 | Z21: 0 | AA21: 30 | AB21: 59 | AC21: 50.847457627118644 | AD21: 0
A22: NORTH MELBOURNE | D22: McCANN | G22: BARNES | J22: JAMIESON | M22: KNEE | P22: STEWART | S22: CONSIDINE | W22: PRESTON | X22: 0 | Y22: 1 | Z22: 0 | AA22: 41 | AB22: 104 | AC22: 39.42307692307692 | AD22: 0
A23: BRUNSWICK | D23: JOHNSON | G23: STANWAY | J23: BURKE | M23: McNAMARA | P23: SMITH | S23: WOODS | W23: ESSENDON TOWN | X23: 0 | Y23: 1 | Z23: 0 | AA23: 21 | AB23: 62 | AC23: 33.87096774193548 | AD23: 0
A24: GOALKICKERS | W24: BRUNSWICK | X24: 0 | Y24: 1 | Z24: 0 | AA24: 15 | AB24: 77 | AC24: 19.480519480519479 | AD24: 0
A25: NORTH MELBOURNE | D25: McCANN 4 | G25: ARMSTRONG 2 | K25: KNEE 2 | N25: P NOONAN | Q25: HOLLAND | T25: MORRISON
A26: BRUNSWICK | D26: KENNEDY | G26: JOHNSON
A28: RICHMOND | C28: 3 | D28: 6 | E28: =C28*6+D28 -> 24 | G28: 6 | H28: 7 | I28: =G28*6+H28 -> 43 | K28: 6 | L28: 11 | M28: =K28*6+L28 -> 47 | O28: 8 | P28: 11 | Q28: =O28*6+P28 -> 59 | S28: TOORAK PARK
A29: PRAHRAN | C29: 0 | D29: 1 | E29: =C29*6+D29 -> 1 | G29: 1 | H29: 5 | I29: =G29*6+H29 -> 11 | K29: 1 | L29: 5 | M29: =K29*6+L29 -> 11 | O29: 4 | P29: 6 | Q29: =O29*6+P29 -> 30 | S29: PRITCHARD
A30: BEST PLAYERS
A31: RICHMOND | D31: BRENNAN | G31: BOWNAS | J31: EDMONDS | M31: BACKHOUSE | P31: McDONALD | S31: MANZIE
A32: PRAHRAN | D32: LYONS | G32: ROBERTS | J32: WILLISON | M32: BOWERS | P32: FLYNN | S32: HAMMOND
A33: GOALKICKERS
A34: RICHMOND | D34: HUTCHINSON 4 | H34: BARLING | K34: McDONALD | N34: BRENNAN | Q34: MANZIE
A35: PRAHRAN | D35: HAMMOND 2 | H35: LYONS | K35: G BROWN
A37: PORT MELBOURNE | C37: 1 | D37: 5 | E37: =C37*6+D37 -> 11 | G37: 4 | H37: 8 | I37: =G37*6+H37 -> 32 | K37: 4 | L37: 12 | M37: =K37*6+L37 -> 36 | O37: 7 | P37: 15 | Q37: =O37*6+P37 -> 57 | S37: WILLIAMSTOWN
A38: WILLIAMSTOWN | C38: 0 | D38: 2 | E38: =C38*6+D38 -> 2 | G38: 3 | H38: 3 | I38: =G38*6+H38 -> 21 | K38: 6 | L38: 5 | M38: =K38*6+L38 -> 41 | O38: 7 | P38: 6 | Q38: =O38*6+P38 -> 48 | S38: GROGAN
A39: BEST PLAYERS
A40: PORT MELBOURNE | D40: BORTHWICK | G40: JOHNSON | J40: McDONALD | M40: CROFT | P40: McGOWAN | S40: MEAGHAN
A41: WILLIAMSTOWN | D41: DAVIES | G41: DICK | J41: McNEILAGE | M41: MANDERSON | P41: SHEEHAN | S41: MORTIMER
A42: GOALKICKERS
A43: PORT MELBOURNE | D43: McDONALD 3 | H43: CROFT 2 | K43: MEAGHAN | N43: JOHNSON
A44: WILLIAMSTOWN | D44: SMITH 2 | G44: SHEEHAN 2 | K44: EUSTICE | N44: DICK | P44: GEORGE
A46: WEST MELBOURNE | C46: 1 | D46: 5 | E46: =C46*6+D46 -> 11 | G46: 3 | H46: 7 | I46: =G46*6+H46 -> 25 | K46: 4 | L46: 13 | M46: =K46*6+L46 -> 37 | O46: 8 | P46: 14 | Q46: =O46*6+P46 -> 62 | S46: ESSENDON
A47: ESS TOWN | C47: 0 | D47: 0 | E47: =C47*6+D47 -> 0 | G47: 1 | H47: 0 | I47: =G47*6+H47 -> 6 | K47: 2 | L47: 1 | M47: =K47*6+L47 -> 13 | O47: 3 | P47: 3 | Q47: =O47*6+P47 -> 21 | S47: WOOLFE
A48: BEST PLAYERS
A49: WEST MELBOURNE | D49: H GREGORY | G49: MADDEN | J49: QUILLIGAN | N49: F GREGORY | R49: ARMSTRONG | U49: RYAN
A50: ESS TOWN | D50: SHELDON | G50: SWEATMAN | J50: GIRDWOOD | N50: STANWORTH | R50: BARR
A51: GOALKICKERS
A52: WEST MELBOURNE | D52: RYAN 2 | G52: PRIDEAUX 2 | K52: J WILLIAMS | N52: HALL | P52: ARMSTRONG
A53: ESS TOWN | D53: STANWORTH 2 | H53: W GORDON
A55: ROUND 2 | E55: 14TH MAY | J55: WEATHER | N55: FINE LIGHT NORTH WIND
D56: 1ST QTR | H56: 2ND QTR | L56: 3RD QTR | P56: FINAL | S56: PLAYED AT
A57: PORT MELBOURNE | C57: 1 | D57: 7 | E57: =C57*6+D57 -> 13 | G57: 6 | H57: 8 | I57: =G57*6+H57 -> 44 | K57: 7 | L57: 12 | M57: =K57*6+L57 -> 54 | O57: 7 | P57: 13 | Q57: =O57*6+P57 -> 55 | S57: PORT MELB | X57: LADDER | AB57: ROUND | AD57: 2
A58: FOOTSCRAY | C58: 0 | D58: 0 | E58: =C58*6+D58 -> 0 | G58: 0 | H58: 1 | I58: =G58*6+H58 -> 1 | K58: 1 | L58: 4 | M58: =K58*6+L58 -> 10 | O58: 3 | P58: 6 | Q58: =O58*6+P58 -> 24 | S58: UMPIRE
A59: BEST PLAYERS | S59: KENNISON | W59: TEAM | X59: W | Y59: L | Z59: D | AA59: FOR | AB59: AGST | AC59: % | AD59: PTS
A60: PORT MELBOURNE | D60: JOHNSON | G60: YATES | J60: CROFT | M60: BROWN | P60: PETTIT | S60: McGOWAN
A61: FOOTSCRAY | D61: HINCH | G61: HUGHES | J61: JACKSON | M61: HOLLIS | P61: MARMO | S61: SWALIWELL | W61: NORTH MELBOURNE | X61: 2 | Y61: 0 | Z61: 0 | AA61: 111 | AB61: 48 | AC61: 231.25 | AD61: 8
A62: GOALKICKERS | W62: RICHMOND | X62: 2 | Y62: 0 | Z62: 0 | AA62: 112 | AB62: 53 | AC62: 211.32075471698113 | AD62: 8
A63: PORT MELBOURNE | D63: CROFT 4 | G63: McDONALD | J63: McGOWAN | M63: TREGLOWAN | W63: PORT MELBOURNE | X63: 2 | Y63: 0 | Z63: 0 | AA63: 112 | AB63: 72 | AC63: 155.55555555555554 | AD63: 8
A64: FOOTSCRAY | D64: McCARTHY | G64: HUGHES | J64: DECOIT | W64: WEST MELBOURNE | X64: 1 | Y64: 1 | Z64: 0 | AA64: 88 | AB64: 51 | AC64: 172.54901960784315 | AD64: 4
A66: NORTH MELBOURNE | C66: 1 | D66: 1 | E66: =C66*6+D66 -> 7 | G66: 2 | H66: 6 | I66: =G66*6+H66 -> 18 | K66: 2 | L66: 7 | M66: =K66*6+L66 -> 19 | O66: 4 | P66: 10 | Q66: =O66*6+P66 -> 34 | S66: NORTH MELB | W66: FOOTSCRAY | X66: 1 | Y66: 1 | Z66: 0 | AA66: 128 | AB66: 96 | AC66: 133.33333333333334 | AD66: 4
A67: WILLIAMSTOWN | C67: 0 | D67: 2 | E67: =C67*6+D67 -> 2 | G67: 0 | H67: 3 | I67: =G67*6+H67 -> 3 | K67: 3 | L67: 9 | M67: =K67*6+L67 -> 27 | O67: 4 | P67: 9 | Q67: =O67*6+P67 -> 33 | S67: FREAME | W67: PRAHRAN | X67: 1 | Y67: 1 | Z67: 0 | AA67: 111 | AB67: 88 | AC67: 126.13636363636364 | AD67: 4
A68: BEST PLAYERS | W68: BRUNSWICK | X68: 1 | Y68: 1 | Z68: 0 | AA68: 45 | AB68: 103 | AC68: 43.689320388349515 | AD68: 4
A69: NORTH MELBOURNE | D69: JAMIESON | G69: BARNES | J69: GRAHAM | M69: MORRISON | P69: ARMSTRONG | S69: BROTHERTON | W69: WILLIAMSTOWN | X69: 0 | Y69: 2 | Z69: 0 | AA69: 81 | AB69: 91 | AC69: 89.010989010989007 | AD69: 0
A70: WILLIAMSTOWN | D70: McKINLEY | G70: DICK | J70: MANDERSON | M70: JONES | P70: CALDWELL | S70: GIBSON | W70: ESSENDON TOWN | X70: 0 | Y70: 2 | Z70: 0 | AA70: 44 | AB70: 115 | AC70: 38.260869565217391 | AD70: 0
A71: GOALKICKERS | W71: PRESTON | X71: 0 | Y71: 2 | Z71: 0 | AA71: 74 | AB71: 185 | AC71: 40 | AD71: 0
A72: NORTH MELBOURNE | D72: ARMSTRONG 2 | H72: McCANN | K72: KENNY
A73: WILLIAMSTOWN | D73: DICK 2 | G73: EUSTACE | J73: McKENZIE
A75: PRAHRAN | C75: 1 | D75: 2 | E75: =C75*6+D75 -> 8 | G75: 6 | H75: 8 | I75: =G75*6+H75 -> 44 | K75: 10 | L75: 10 | M75: =K75*6+L75 -> 70 | O75: 11 | P75: 15 | Q75: =O75*6+P75 -> 81 | S75: PRESTON
A76: PRESTON | C76: 4 | D76: 6 | E76: =C76*6+D76 -> 30 | G76: 4 | H76: 6 | I76: =G76*6+H76 -> 30 | K76: 4 | L76: 8 | M76: =K76*6+L76 -> 32 | O76: 4 | P76: 9 | Q76: =O76*6+P76 -> 33 | S76: O'LOUGHLIN
A77: BEST PLAYERS
A78: PRAHRAN | D78: TORPEY | G78: T BROWN | J78: ROBERTS | M78: LYONS | P78: G BROWN | S78: BOWER
A79: PRESTON | D79: S HALL | G79: NANKERVIS | J79: LAZARUS | M79: McCLUMPA | P79: STANLAKE | S79: GIBSON
A80: GOALKICKERS
A81: PRAHRAN | D81: HAMMOND 3 | G81: LYONS 2 | J81: DOWNES 2 | M81: SMITH 2 | P81: FLYNN
A82: PRESTON | D82: MORGAN | G82: WHITE | J82: CLARK | M82: WARNE
A84: RICHMOND | C84: 1 | D84: 5 | E84: =C84*6+D84 -> 11 | G84: 1 | H84: 7 | I84: =G84*6+H84 -> 13 | K84: 2 | L84: 13 | M84: =K84*6+L84 -> 25 | O84: 6 | P84: 17 | Q84: =O84*6+P84 -> 53 | S84: ESSENDON
A85: ESS TOWN | C85: 2 | D85: 1 | E85: =C85*6+D85 -> 13 | G85: 2 | H85: 3 | I85: =G85*6+H85 -> 15 | K85: 2 | L85: 3 | M85: =K85*6+L85 -> 15 | O85: 3 | P85: 5 | Q85: =O85*6+P85 -> 23 | S85: MORGAN
A86: BEST PLAYERS
A87: RICHMOND | D87: RICHARDSON | G87: TOOTELL | J87: EDMONDS | M87: BRENNAN | P87: RICKETTS | S87: HUTCHINSON
A88: ESS TOWN | D88: SWEATMAN | G88: PAIN | J88: DAVIS | M88: GEORGE | P88: CHEFFERS | S88: HALL
A89: GOALKICKERS
A90: RICHMOND | D90: HUTCHINSON | H90: DUNCAN | K90: BARLING | N90: RUDD | P90: FAYLE | R90: HASSETT
A91: ESS TOWN | D91: HUGHES | G91: CHEFFERS | J91: HIGGINS
A93: BRUNSWICK | C93: 1 | D93: 4 | E93: =C93*6+D93 -> 10 | G93: 3 | H93: 5 | I93: =G93*6+H93 -> 23 | K93: 4 | L93: 6 | M93: =K93*6+L93 -> 30 | O93: 4 | P93: 6 | Q93: =O93*6+P93 -> 30 | S93: BRUNSWICK
A94: WEST MELBOURNE | C94: 2 | D94: 1 | E94: =C94*6+D94 -> 13 | G94: 2 | H94: 3 | I94: =G94*6+H94 -> 15 | K94: 3 | L94: 4 | M94: =K94*6+L94 -> 22 | O94: 3 | P94: 8 | Q94: =O94*6+P94 -> 26 | S94: GROGAN
A95: BEST PLAYERS
A96: BRUNSWICK | D96: CHASE | G96: HARRIS | J96: HENLEY | M96: PALMER | P96: CASEY | S96: JOHNSON
A97: WEST MELBOURNE | D97: J WILLIAMS | G97: P WILLIAMS | J97: McVEE | M97: ASHTON | P97: MADDEN | S97: D GREGORY
A98: GOALKICKERS
A99: BRUNSWICK | D99: BURKE | G99: BALL | J99: STANWAY | M99: STEVENSON
A100: WEST MELBOURNE | D100: RYAN | G100: PRIDEAUX | J100: WYLIE
A102: ROUND 3 | E102: 21ST MAY | J102: WEATHER | N102: NORTH WEST WIND RAIN 2ND HALF
D103: 1ST QTR | H103: 2ND QTR | L103: 3RD QTR | P103: FINAL | S103: PLAYED AT
A104: WEST MELBOURNE | C104: 2 | D104: 5 | E104: =C104*6+D104 -> 17 | G104: 4 | H104: 10 | I104: =G104*6+H104 -> 34 | K104: 6 | L104: 17 | M104: =K104*6+L104 -> 53 | O104: 6 | P104: 20 | Q104: =O104*6+P104 -> 56 | S104: TOORAK PARK | X104: LADDER | AB104: ROUND | AD104: 3
A105: PRAHRAN | C105: 0 | D105: 5 | E105: =C105*6+D105 -> 5 | G105: 0 | H105: 8 | I105: =G105*6+H105 -> 8 | K105: 1 | L105: 9 | M105: =K105*6+L105 -> 15 | O105: 3 | P105: 11 | Q105: =O105*6+P105 -> 29 | S105: UMPIRE
A106: BEST PLAYERS | S106: J O'LOUGHLIN | W106: TEAM | X106: W | Y106: L | Z106: D | AA106: FOR | AB106: AGST | AC106: % | AD106: PTS
A107: WEST MELBOURNE | D107: POOLE | G107: ROOKE | J107: MADDEN | M107: LAXTON | P107: J WILLIAMS | S107: DEAN
A108: PRAHRAN | D108: G BROWN | G108: PONTIN | J108: WILLISON | M108: FLYNN | P108: HAMMOND | S108: LYONS | W108: RICHMOND | X108: 3 | Y108: 0 | Z108: 0 | AA108: 188 | AB108: 66 | AC108: 284.84848484848487 | AD108: 12
A109: GOALKICKERS | W109: NORTH MELBOURNE | X109: 3 | Y109: 0 | Z109: 0 | AA109: 166 | AB109: 61 | AC109: 272.13114754098359 | AD109: 12
A110: WEST MELBOURNE | D110: RYAN 4 | W110: PORT MELBOURNE | X110: 3 | Y110: 0 | Z110: 0 | AA110: 169 | AB110: 113 | AC110: 149.55752212389382 | AD110: 12
A111: PRAHRAN | W111: WEST MELBOURNE | X111: 2 | Y111: 1 | Z111: 0 | AA111: 144 | AB111: 80 | AC111: 180 | AD111: 8
A113: PORT MELBOURNE | C113: 3 | D113: 2 | E113: =C113*6+D113 -> 20 | G113: 6 | H113: 8 | I113: =G113*6+H113 -> 44 | K113: 6 | L113: 14 | M113: =K113*6+L113 -> 50 | O113: 7 | P113: 15 | Q113: =O113*6+P113 -> 57 | S113: BRUNSWICK | W113: FOOTSCRAY | X113: 2 | Y113: 1 | Z113: 0 | AA113: 149 | AB113: 113 | AC113: 131.85840707964601 | AD113: 8
A114: BRUNSWICK | C114: 1 | D114: 1 | E114: =C114*6+D114 -> 7 | G114: 1 | H114: 2 | I114: =G114*6+H114 -> 8 | K114: 2 | L114: 5 | M114: =K114*6+L114 -> 17 | O114: 6 | P114: 5 | Q114: =O114*6+P114 -> 41 | S114: WOOLFE | W114: PRAHRAN | X114: 1 | Y114: 2 | Z114: 0 | AA114: 140 | AB114: 144 | AC114: 97.222222222222229 | AD114: 4
A115: BEST PLAYERS | W115: BRUNSWICK | X115: 1 | Y115: 2 | Z115: 0 | AA115: 86 | AB115: 160 | AC115: 53.75 | AD115: 4
A116: PORT MELBOURNE | D116: PETTIT | G116: J WARD | J116: DANIELS | M116: McGOWAN | P116: McDONALD | S116: CROFT | W116: WILLIAMSTOWN | X116: 0 | Y116: 3 | Z116: 0 | AA116: 98 | AB116: 112 | AC116: 87.5 | AD116: 0
A117: BRUNSWICK | D117: HARRIS | G117: ANDREWS | J117: CHASE | M117: BURKE | P117: CASEY | S117: JOHNSON | W117: ESSENDON TOWN | X117: 0 | Y117: 3 | Z117: 0 | AA117: 57 | AB117: 170 | AC117: 33.529411764705884 | AD117: 0
A118: GOALKICKERS | W118: PRESTON | X118: 0 | Y118: 3 | Z118: 0 | AA118: 87 | AB118: 261 | AC118: 33.33 | AD118: 0
A119: PORT MELBOURNE | D119: McDONALD 4 | H119: CROFT 2 | K119: BROWN
A120: BRUNSWICK | D120: BURKE 2 | G120: STANWAY | J120: SMITH | L120: WOODS | N120: WALSH
A122: FOOTSCRAY | C122: 0 | D122: 3 | E122: =C122*6+D122 -> 3 | G122: 0 | H122: 5 | I122: =G122*6+H122 -> 5 | K122: 2 | L122: 9 | M122: =K122*6+L122 -> 21 | O122: 2 | P122: 9 | Q122: =O122*6+P122 -> 21 | S122: WILLIAMSTOWN
A123: WILLIAMSTOWN | C123: 0 | D123: 1 | E123: =C123*6+D123 -> 1 | G123: 2 | H123: 3 | I123: =G123*6+H123 -> 15 | K123: 2 | L123: 4 | M123: =K123*6+L123 -> 16 | O123: 2 | P123: 5 | Q123: =O123*6+P123 -> 17 | S123: BAIN
A124: BEST PLAYERS
A125: FOOTSCRAY | D125: MORAN | G125: MARMO | J125: E STEPHENSON | N125: FLEWELLYN | R125: HUGHES | U125: JACKSON
A126: WILLIAMSTOWN | D126: McKINLEY | G126: BAKER | J126: WILTSHIRE | N126: CALDWELL | R126: McKENZIE | U126: DICK
A127: GOALKICKERS
A128: FOOTSCRAY | D128: E STEPHENSON | H128: HARRIS
A129: WILLIAMSTOWN | D129: DAW | G129: SHEEHAN
A131: NORTH MELBOURNE | C131: 3 | D131: 3 | E131: =C131*6+D131 -> 21 | G131: 5 | H131: 3 | I131: =G131*6+H131 -> 33 | K131: 6 | L131: 4 | M131: =K131*6+L131 -> 40 | O131: 8 | P131: 7 | Q131: =O131*6+P131 -> 55 | S131: N.M
A132: ESS TOWN | C132: 0 | D132: 1 | E132: =C132*6+D132 -> 1 | G132: 1 | H132: 2 | I132: =G132*6+H132 -> 8 | K132: 1 | L132: 6 | M132: =K132*6+L132 -> 12 | O132: 1 | P132: 7 | Q132: =O132*6+P132 -> 13 | S132: P O'LOUGHLIN
A133: BEST PLAYERS
A134: NORTH MELBOURNE | D134: KENNEDY | G134: GRAHAM | J134: BARNES | M134: BROTHERTON | Q134: MORRISON | T134: D NOONAN
A135: ESS TOWN | D135: HALL | G135: PAIN | J135: NIXON | M135: SWEATMAN | Q135: HAMBRIDGE | T135: MARTIN
A136: GOALKICKERS
A137: NORTH MELBOURNE | D137: McCANN 4 | G137: P NOONAN | J137: MORRISON | M137: ARMSTRONG
A138: ESS TOWN | D138: MARTIN
A140: RICHMOND | C140: 2 | D140: 5 | E140: =C140*6+D140 -> 17 | G140: 5 | H140: 9 | I140: =G140*6+H140 -> 39 | K140: 8 | L140: 13 | M140: =K140*6+L140 -> 61 | O140: 10 | P140: 16 | Q140: =O140*6+P140 -> 76 | S140: PRESTON
A141: PRESTON | C141: 0 | D141: 0 | E141: =C141*6+D141 -> 0 | G141: 1 | H141: 0 | I141: =G141*6+H141 -> 6 | K141: 1 | L141: 1 | M141: =K141*6+L141 -> 7 | O141: 2 | P141: 1 | Q141: =O141*6+P141 -> 13 | S141: HARROD
A142: BEST PLAYERS
A143: RICHMOND | D143: RUDDOCK | G143: T WILLIAMS | K143: McNAIR | N143: JOHNSTON | Q143: TOOTELL | T143: RUDD
A144: PRESTON | D144: NANKERVIS | G144: S HALL | K144: WHITE | N144: STANLAKE | Q144: McCLUMPA | T144: WARNE
A145: GOALKICKERS
A146: RICHMOND | D146: FAYLE 3 | G146: HUTCHINSON 2
A147: PRESTON
A149: ROUND 4 | E149: 28TH MAY | J149: WEATHER | N149: WEST WIND CLOUDY
D150: 1ST QTR | H150: 2ND QTR | L150: 3RD QTR | P150: FINAL | S150: PLAYED AT
A151: RICHMOND | C151: 3 | D151: 4 | E151: =C151*6+D151 -> 22 | G151: 4 | H151: 6 | I151: =G151*6+H151 -> 30 | K151: 5 | L151: 11 | M151: =K151*6+L151 -> 41 | O151: 8 | P151: 12 | Q151: =O151*6+P151 -> 60 | S151: RICHMOND | X151: LADDER | AB151: ROUND | AD151: 4
A152: NORTH MELBOURNE | C152: 1 | D152: 3 | E152: =C152*6+D152 -> 9 | G152: 3 | H152: 6 | I152: =G152*6+H152 -> 24 | K152: 3 | L152: 8 | M152: =K152*6+L152 -> 26 | O152: 6 | P152: 9 | Q152: =O152*6+P152 -> 45 | S152: UMPIRE
A153: BEST PLAYERS | S153: BAIN | W153: TEAM | X153: W | Y153: L | Z153: D | AA153: FOR | AB153: AGST | AC153: % | AD153: PTS
A154: RICHMOND | D154: JOHNSTON | G154: RUDDOCK | J154: RICHARDSON | N154: EDMONDS | Q154: RICKETTS | T154: HASSETT
A155: NORTH MELBOURNE | D155: P NOONAN | G155: CONSIDINE | J155: MORRISON | N155: D NOONAN | Q155: KENNEDY | T155: DALTON | W155: RICHMOND | X155: 4 | Y155: 0 | Z155: 0 | AA155: 248 | AB155: 111 | AC155: 223.42342342342343 | AD155: 16
A156: GOALKICKERS | W156: PORT MELBOURNE | X156: 4 | Y156: 0 | Z156: 0 | AA156: 259 | AB156: 142 | AC156: 182.3943661971831 | AD156: 16
A157: RICHMOND | D157: HUTCHINSON 4 | H157: RUDD 2 | K157: RUDDOCK | N157: McDONALD | W157: WEST MELBOURNE | X157: 3 | Y157: 1 | Z157: 0 | AA157: 231 | AB157: 89 | AC157: 259.55056179775283 | AD157: 12
A158: NORTH MELBOURNE | D158: CONSIDINE 2 | H158: McCANN 2 | K158: SMITH | N158: P NOONAN | W158: NORTH MELBOURNE | X158: 3 | Y158: 1 | Z158: 0 | AA158: 211 | AB158: 121 | AC158: 174.38016528925621 | AD158: 12
A160: PORT MELBOURNE | C160: 3 | D160: 2 | E160: =C160*6+D160 -> 20 | G160: 4 | H160: 6 | I160: =G160*6+H160 -> 30 | K160: 7 | L160: 10 | M160: =K160*6+L160 -> 52 | O160: 13 | P160: 12 | Q160: =O160*6+P160 -> 90 | S160: TOORAK PARK | W160: FOOTSCRAY | X160: 3 | Y160: 1 | Z160: 0 | AA160: 211 | AB160: 142 | AC160: 148.59154929577466 | AD160: 12
A161: PRAHRAN | C161: 1 | D161: 1 | E161: =C161*6+D161 -> 7 | G161: 2 | H161: 8 | I161: =G161*6+H161 -> 20 | K161: 2 | L161: 12 | M161: =K161*6+L161 -> 24 | O161: 2 | P161: 17 | Q161: =O161*6+P161 -> 29 | S161: GROGAN | W161: BRUNSWICK | X161: 2 | Y161: 2 | Z161: 0 | AA161: 146 | AB161: 214 | AC161: 68.224299065420567 | AD161: 8
A162: BEST PLAYERS | W162: PRAHRAN | X162: 1 | Y162: 3 | Z162: 0 | AA162: 169 | AB162: 234 | AC162: 72.222222222222229 | AD162: 4
A163: PORT MELBOURNE | D163: J GARBUTT | G163: YATES | J163: KEENAN | M163: McGOWAN | P163: JOHNSON | S163: BROWN | W163: WILLIAMSTOWN | X163: 0 | Y163: 4 | Z163: 0 | AA163: 152 | AB163: 172 | AC163: 88.372093023255815 | AD163: 0
A164: PRAHRAN | D164: PONTIN | G164: LYONS | J164: TORPEY | M164: DRAPER | P164: JONES | S164: HAMMOND | W164: ESSENDON TOWN | X164: 0 | Y164: 4 | Z164: 0 | AA164: 86 | AB164: 232 | AC164: 37.068965517241381 | AD164: 0
A165: GOALKICKERS | W165: PRESTON | X165: 0 | Y165: 4 | Z165: 0 | AA165: 96 | AB165: 348 | AC165: 27.59 | AD165: 0
A166: PORT MELBOURNE | D166: CROFT 4 | G166: McDONALD 4 | J166: KEENAN | L166: WARD | N166: JOHNSON | P166: DANIELS | R166: ALLAN
A167: PRAHRAN | D167: SMITH | G167: LYONS
A169: BRUNSWICK | C169: 2 | D169: 4 | E169: =C169*6+D169 -> 16 | G169: 5 | H169: 8 | I169: =G169*6+H169 -> 38 | K169: 7 | L169: 9 | M169: =K169*6+L169 -> 51 | O169: 8 | P169: 12 | Q169: =O169*6+P169 -> 60 | S169: BRUNSWICK
A170: WILLIAMSTOWN | C170: 1 | D170: 3 | E170: =C170*6+D170 -> 9 | G170: 3 | H170: 7 | I170: =G170*6+H170 -> 25 | K170: 4 | L170: 9 | M170: =K170*6+L170 -> 33 | O170: 7 | P170: 12 | Q170: =O170*6+P170 -> 54 | S170: FREAME
A171: BEST PLAYERS
A172: BRUNSWICK | D172: STANWAY | G172: McNAMARA | J172: MULVANEY | N172: BURKE | P172: WHITFIELD | S172: LOGAN
A173: WILLIAMSTOWN | D173: McKINLEY | G173: DICK | J173: SPRINTHALL | N173: BRITT
A174: GOALKICKERS
A175: BRUNSWICK | D175: ROBBINS 4 | G175: MULVANEY 2
A176: WILLIAMSTOWN | D176: SPRINTHALL 2
A178: FOOTSCRAY | C178: 2 | D178: 2 | E178: =C178*6+D178 -> 14 | G178: 4 | H178: 3 | I178: =G178*6+H178 -> 27 | K178: 5 | L178: 5 | M178: =K178*6+L178 -> 35 | O178: 9 | P178: 8 | Q178: =O178*6+P178 -> 62 | S178: FOOTSCRAY
A179: ESS TOWN | C179: 1 | D179: 3 | E179: =C179*6+D179 -> 9 | G179: 1 | H179: 7 | I179: =G179*6+H179 -> 13 | K179: 2 | L179: 11 | M179: =K179*6+L179 -> 23 | O179: 3 | P179: 11 | Q179: =O179*6+P179 -> 29 | S179: WOOLFE
A180: BEST PLAYERS
A181: FOOTSCRAY | D181: JACKSON | G181: HINCH | J181: HARRIS | M181: MARMO | P181: SWALIWELL | S181: HUGHES
A182: ESS TOWN | D182: DAVIS | G182: GEORGE | J182: BARR | M182: HALL | P182: PAIN | S182: HAMBRIDGE
A183: GOALKICKERS
A184: FOOTSCRAY | D184: FLEWELLYN 4 | G184: DE COIT 2 | J184: HUGHES | M184: MORAN | O184: JACKSON
A185: ESS TOWN
A187: WEST MELBOURNE | C187: 5 | D187: 4 | E187: =C187*6+D187 -> 34 | G187: 6 | H187: 6 | I187: =G187*6+H187 -> 42 | K187: 9 | L187: 11 | M187: =K187*6+L187 -> 65 | O187: 12 | P187: 15 | Q187: =O187*6+P187 -> 87 | S187: NORTH MELB
A188: PRESTON | C188: 0 | D188: 1 | E188: =C188*6+D188 -> 1 | G188: 0 | H188: 2 | I188: =G188*6+H188 -> 2 | K188: 0 | L188: 2 | M188: =K188*6+L188 -> 2 | O188: 1 | P188: 3 | Q188: =O188*6+P188 -> 9 | S188: KENNISON
A189: BEST PLAYERS
A190: WEST MELBOURNE | D190: RYAN | G190: ARMSTRONG | J190: ROOKE | M190: McVEE | P190: ASHTON | S190: POOLE
A191: PRESTON | D191: NANKERVIS | G191: S HALL | J191: WHITE | M191: STANLAKE | P191: McCLUMPA | S191: WARNE
A192: GOALKICKERS
A193: WEST MELBOURNE | D193: RYAN 4 | G193: ASHTON 2 | J193: POOLE 2
A194: PRESTON
A196: ROUND 5 | E196: 4TH JUNE | J196: WEATHER | N196: NORTH BREEZE
D197: 1ST QTR | H197: 2ND QTR | L197: 3RD QTR | P197: FINAL | S197: PLAYED AT
A198: WEST MELBOURNE | C198: 2 | D198: 2 | E198: =C198*6+D198 -> 14 | G198: 5 | H198: 5 | I198: =G198*6+H198 -> 35 | K198: 6 | L198: 7 | M198: =K198*6+L198 -> 43 | O198: 7 | P198: 7 | Q198: =O198*6+P198 -> 49 | S198: NORTH MELB | X198: LADDER | AB198: ROUND | AD198: 5
A199: PORT MELBOURNE | C199: 2 | D199: 1 | E199: =C199*6+D199 -> 13 | G199: 4 | H199: 1 | I199: =G199*6+H199 -> 25 | K199: 5 | L199: 3 | M199: =K199*6+L199 -> 33 | O199: 6 | P199: 3 | Q199: =O199*6+P199 -> 39 | S199: UMPIRE
A200: BEST PLAYERS | S200: J O'LOUGHLIN | W200: TEAM | X200: W | Y200: L | Z200: D | AA200: FOR | AB200: AGST | AC200: % | AD200: PTS
A201: WEST MELBOURNE | D201: MCVEE | G201: ROOKE | J201: POOLE | M201: RYAN | P201: P WILLIAMS | S201: JONES
A202: PORT MELBOURNE | D202: P GARBUTT | G202: HILL | J202: J WARD | M202: J GARBUTT | P202: JOHNSON | S202: McDONALD | W202: WEST MELBOURNE | X202: 4 | Y202: 1 | Z202: 0 | AA202: 280 | AB202: 128 | AC202: 218.75 | AD202: 16
A203: GOALKICKERS | W203: RICHMOND | X203: 4 | Y203: 1 | Z203: 0 | AA203: 284 | AB203: 148 | AC203: 191.8918918918919 | AD203: 16
A204: WEST MELBOURNE | D204: RYAN 4 | G204: ROURKE | J204: ARMSTRONG | M204: J WILLIAMS | W204: PORT MELBOURNE | X204: 4 | Y204: 1 | Z204: 0 | AA204: 298 | AB204: 191 | AC204: 156.02094240837695 | AD204: 16
A205: PORT MELBOURNE | D205: CROFT 2 | G205: McHARG | J205: McDONALD | M205: TREGLOWN | W205: FOOTSCRAY | X205: 4 | Y205: 1 | Z205: 0 | AA205: 270 | AB205: 178 | AC205: 151.68539325842696 | AD205: 16
A207: FOOTSCRAY | C207: 7 | D207: 0 | E207: =C207*6+D207 -> 42 | G207: 7 | H207: 1 | I207: =G207*6+H207 -> 43 | K207: 9 | L207: 4 | M207: =K207*6+L207 -> 58 | O207: 9 | P207: 5 | Q207: =O207*6+P207 -> 59 | S207: FOOTSCRAY | W207: NORTH MELBOURNE | X207: 3 | Y207: 2 | Z207: 0 | AA207: 247 | AB207: 180 | AC207: 137.22222222222223 | AD207: 12
A208: NORTH MELBOURNE | C208: 0 | D208: 0 | E208: =C208*6+D208 -> 0 | G208: 3 | H208: 4 | I208: =G208*6+H208 -> 22 | K208: 4 | L208: 6 | M208: =K208*6+L208 -> 30 | O208: 5 | P208: 6 | Q208: =O208*6+P208 -> 36 | S208: GROGAN | W208: BRUNSWICK | X208: 3 | Y208: 2 | Z208: 0 | AA208: 188 | AB208: 236 | AC208: 79.66101694915254 | AD208: 12
A209: BEST PLAYERS | W209: PRAHRAN | X209: 2 | Y209: 3 | Z209: 0 | AA209: 229 | AB209: 282 | AC209: 81.205673758865245 | AD209: 8
A210: FOOTSCRAY | D210: DECOIT | G210: MARMO | J210: HUGHES | M210: HINCH | P210: HARRIS | S210: McCARTHY | W210: WILLIAMSTOWN | X210: 1 | Y210: 4 | Z210: 0 | AA210: 189 | AB210: 208 | AC210: 90.865384615384613 | AD210: 4
A211: NORTH MELBOURNE | D211: P NOONAN | G211: D NOONAN | J211: MORRISON | M211: STEWART | P211: MARTIN | S211: KENNY | W211: ESSENDON TOWN | X211: 0 | Y211: 5 | Z211: 0 | AA211: 134 | AB211: 292 | AC211: 45.890410958904113 | AD211: 0
A212: GOALKICKERS | W212: PRESTON | X212: 0 | Y212: 5 | Z212: 0 | AA212: 118 | AB212: 390 | AC212: 30.26 | AD212: 0
A213: FOOTSCRAY | D213: WAGLAND 3 | G213: McCARTHY 3 | J213: STEVENSON | M213: FLEWELLYN | P213: DE COIT
A214: NORTH MELBOURNE | D214: CONSIDINE 2 | H214: KENNY | J214: MORRISON | M214: D NOONAN
A216: BRUNSWICK | C216: 0 | D216: 3 | E216: =C216*6+D216 -> 3 | G216: 2 | H216: 9 | I216: =G216*6+H216 -> 21 | K216: 2 | L216: 15 | M216: =K216*6+L216 -> 27 | O216: 4 | P216: 18 | Q216: =O216*6+P216 -> 42 | S216: PRESTON
A217: PRESTON | C217: 1 | D217: 2 | E217: =C217*6+D217 -> 8 | G217: 2 | H217: 2 | I217: =G217*6+H217 -> 14 | K217: 2 | L217: 2 | M217: =K217*6+L217 -> 14 | O217: 3 | P217: 4 | Q217: =O217*6+P217 -> 22 | S217: FREAME
A218: BEST PLAYERS
A219: BRUNSWICK
A220: PRESTON
A221: GOALKICKERS
A222: BRUNSWICK
A223: PRESTON | D223: WAWN 2 | G223: SHEFFIELD
A225: PRAHRAN | C225: 1 | D225: 1 | E225: =C225*6+D225 -> 7 | G225: 4 | H225: 2 | I225: =G225*6+H225 -> 26 | K225: 7 | L225: 2 | M225: =K225*6+L225 -> 44 | O225: 9 | P225: 6 | Q225: =O225*6+P225 -> 60 | S225: ESSENDON
A226: ESS TOWN | C226: 2 | D226: 1 | E226: =C226*6+D226 -> 13 | G226: 3 | H226: 1 | I226: =G226*6+H226 -> 19 | K226: 6 | L226: 4 | M226: =K226*6+L226 -> 40 | O226: 7 | P226: 6 | Q226: =O226*6+P226 -> 48 | S226: P O'LOUGHLIN
A227: BEST PLAYERS
A228: PRAHRAN | D228: PONTIN | G228: ROBERTS | J228: FLYNN | M228: DRAPER | P228: HAMMOND | S228: LYONS
A229: ESS TOWN | D229: NIXON | G229: SHELDON | J229: SWEATMAN | M229: GIRDWOOD | P229: HALL | S229: STANWORTH
A230: GOALKICKERS
A231: PRAHRAN | D231: FLYNN 3 | G231: SMITH | I231: LYONS | K231: TORPEY | M231: CUMMINGS | O231: DUPE | Q231: JACKSON
A232: ESS TOWN | D232: STANWORTH 3 | G232: DAVIS
A234: WILLIAMSTOWN | C234: 0 | D234: 2 | E234: =C234*6+D234 -> 2 | G234: 1 | H234: 9 | I234: =G234*6+H234 -> 15 | K234: 4 | L234: 10 | M234: =K234*6+L234 -> 34 | O234: 4 | P234: 13 | Q234: =O234*6+P234 -> 37 | S234: WILLIAMSTOWN
A235: RICHMOND | C235: 2 | D235: 6 | E235: =C235*6+D235 -> 18 | G235: 3 | H235: 6 | I235: =G235*6+H235 -> 24 | K235: 3 | L235: 11 | M235: =K235*6+L235 -> 29 | O235: 4 | P235: 12 | Q235: =O235*6+P235 -> 36 | S235: HARROD
A236: BEST PLAYERS
A237: WILLIAMSTOWN | D237: DICK | G237: SPRINTHALL | J237: HOUGHTON | M237: MANDERSON | P237: McKINLEY | S237: BRITT
A238: RICHMOND | D238: BOWNAS | G238: EDMONDS | J238: RICHARDSON | M238: BACKHOUSE | P238: HASSETT | S238: McDONALD
A239: GOALKICKERS
A240: WILLIAMSTOWN
A241: RICHMOND
A243: ROUND 6 | E243: 11TH JUNE | J243: WEATHER | N243: NORTH WEST BREEZE OVERCAST
D244: 1ST QTR | H244: 2ND QTR | L244: 3RD QTR | P244: FINAL | S244: PLAYED AT
A245: RICHMOND | C245: 1 | D245: 1 | E245: =C245*6+D245 -> 7 | G245: 1 | H245: 4 | I245: =G245*6+H245 -> 10 | K245: 2 | L245: 6 | M245: =K245*6+L245 -> 18 | O245: 4 | P245: 8 | Q245: =O245*6+P245 -> 32 | S245: RICHMOND | X245: LADDER | AB245: ROUND | AD245: 6
A246: WEST MELBOURNE | C246: 1 | D246: 2 | E246: =C246*6+D246 -> 8 | G246: 1 | H246: 2 | I246: =G246*6+H246 -> 8 | K246: 4 | L246: 3 | M246: =K246*6+L246 -> 27 | O246: 4 | P246: 5 | Q246: =O246*6+P246 -> 29 | S246: UMPIRE
A247: BEST PLAYERS | S247: GROGAN | W247: TEAM | X247: W | Y247: L | Z247: D | AA247: FOR | AB247: AGST | AC247: % | AD247: PTS
A248: RICHMOND | D248: McNAIR | G248: BACKHOUSE | K248: RUDD | N248: FAYLE | Q248: CATLIN | S248: EDMONDS
A249: WEST MELBOURNE | D249: LIVINGSTONE | H249: MADDEN | K249: McVEE | N249: ROOKE | Q249: RYAN | S249: LAXTON | W249: RICHMOND | X249: 5 | Y249: 1 | Z249: 0 | AA249: 316 | AB249: 177 | AC249: 178.5310734463277 | AD249: 20
A250: GOALKICKERS | W250: FOOTSCRAY | X250: 5 | Y250: 1 | Z250: 0 | AA250: 329 | AB250: 193 | AC250: 170.46632124352331 | AD250: 20
A251: RICHMOND | D251: HUTCHINSON 2 | H251: O'FLAHERTY 2 | W251: WEST MELBOURNE | X251: 4 | Y251: 2 | Z251: 0 | AA251: 309 | AB251: 160 | AC251: 193.125 | AD251: 16
A252: WEST MELBOURNE | D252: RYAN 2 | G252: HALL | I252: ASHTON | W252: PORT MELBOURNE | X252: 4 | Y252: 2 | Z252: 0 | AA252: 327 | AB252: 223 | AC252: 146.63677130044843 | AD252: 16
A254: NORTH MELBOURNE | C254: 0 | D254: 1 | E254: =C254*6+D254 -> 1 | G254: 2 | H254: 6 | I254: =G254*6+H254 -> 18 | K254: 3 | L254: 8 | M254: =K254*6+L254 -> 26 | O254: 4 | P254: 8 | Q254: =O254*6+P254 -> 32 | S254: NORTH MELB | W254: NORTH MELBOURNE | X254: 4 | Y254: 2 | Z254: 0 | AA254: 279 | AB254: 209 | AC254: 133.49282296650719 | AD254: 16
A255: PORT MELBOURNE | C255: 2 | D255: 2 | E255: =C255*6+D255 -> 14 | G255: 2 | H255: 2 | I255: =G255*6+H255 -> 14 | K255: 3 | L255: 5 | M255: =K255*6+L255 -> 23 | O255: 4 | P255: 5 | Q255: =O255*6+P255 -> 29 | S255: WOOLFE | W255: BRUNSWICK | X255: 3 | Y255: 3 | Z255: 0 | AA255: 203 | AB255: 295 | AC255: 68.813559322033896 | AD255: 12
A256: BEST PLAYERS | W256: WILLIAMSTOWN | X256: 2 | Y256: 4 | Z256: 0 | AA256: 262 | AB256: 261 | AC256: 100.38314176245211 | AD256: 8
A257: NORTH MELBOURNE | D257: CONSIDINE | G257: STEWART | J257: D NOONAN | M257: DALTON | P257: GRAHAM | S257: MORRISON | W257: PRAHRAN | X257: 2 | Y257: 4 | Z257: 0 | AA257: 282 | AB257: 355 | AC257: 79.436619718309856 | AD257: 8
A258: PORT MELBOURNE | D258: INGHAM | G258: CROFT | J258: J GARBUTT | M258: KEENAN | P258: McGOWAN | S258: ALLAN | W258: ESSENDON TOWN | X258: 1 | Y258: 5 | Z258: 0 | AA258: 193 | AB258: 330 | AC258: 58.484848484848484 | AD258: 4
A259: GOALKICKERS | W259: PRESTON | X259: 0 | Y259: 6 | Z259: 0 | AA259: 156 | AB259: 449 | AC259: 34.74 | AD259: 0
A260: NORTH MELBOURNE | D260: D NOONAN | G260: GROVES | J260: CONSIDINE | M260: SMITH
A261: PORT MELBOURNE | D261: CROFT 2 | G261: HILDEBRAND | K261: J GARBUTT
A263: FOOTSCRAY | C263: 3 | D263: 3 | E263: =C263*6+D263 -> 21 | G263: 4 | H263: 3 | I263: =G263*6+H263 -> 27 | K263: 8 | L263: 10 | M263: =K263*6+L263 -> 58 | O263: 8 | P263: 11 | Q263: =O263*6+P263 -> 59 | S263: FOOTSCRAY
A264: BRUNSWICK | C264: 0 | D264: 0 | E264: =C264*6+D264 -> 0 | G264: 0 | H264: 3 | I264: =G264*6+H264 -> 3 | K264: 0 | L264: 3 | M264: =K264*6+L264 -> 3 | O264: 1 | P264: 9 | Q264: =O264*6+P264 -> 15 | S264: FREAME
A265: BEST PLAYERS
A266: FOOTSCRAY | D266: JACKSON | G266: HARRIS | J266: HINCH | M266: O'SHEA | P266: GRAHAM | S266: McCARROLL
A267: BRUNSWICK | D267: CHASE | G267: CASEY | J267: STEVENSON | M267: STANWAY
A268: GOALKICKERS
A269: FOOTSCRAY | D269: JACKSON 2 | G269: O'SHEA | J269: SERBY | L269: HUGHES | N269: FLEWELLYN | Q269: McCARROLL | T269: E STEPHENSON
A270: BRUNSWICK | D270: WOODS
A272: WILLIAMSTOWN | C272: 1 | D272: 1 | E272: =C272*6+D272 -> 7 | G272: 6 | H272: 3 | I272: =G272*6+H272 -> 39 | K272: 8 | L272: 5 | M272: =K272*6+L272 -> 53 | O272: 11 | P272: 7 | Q272: =O272*6+P272 -> 73 | S272: TOORAK PARK
A273: PRAHRAN | C273: 2 | D273: 1 | E273: =C273*6+D273 -> 13 | G273: 2 | H273: 2 | I273: =G273*6+H273 -> 14 | K273: 7 | L273: 5 | M273: =K273*6+L273 -> 47 | O273: 8 | P273: 5 | Q273: =O273*6+P273 -> 53 | S273: KENNISON
A274: BEST PLAYERS
A275: WILLIAMSTOWN | D275: JONES | G275: McKINLEY | J275: HALL | M275: WALTERS | P275: MANDERSON | S275: DAVIES
A276: PRAHRAN | D276: PONTIN | G276: ROBERTS | J276: BROWN | M276: BOWERS | P276: DRAPER | S276: DUPE
A277: GOALKICKERS
A278: WILLIAMSTOWN | D278: MORTIMER 3 | G278: EUSTACE | J278: GEORGE | L278: GRIMSHAW | O278: HOUGHTON | R278: DICK | T278: SHEEHAN | W278: BRITT
A279: PRAHRAN | D279: FLYNN 3 | G279: DUPE 3 | J279: LYONS | L279: HAMMOND
A281: ESS TOWN | C281: 3 | D281: 2 | E281: =C281*6+D281 -> 20 | G281: 6 | H281: 2 | I281: =G281*6+H281 -> 38 | K281: 7 | L281: 5 | M281: =K281*6+L281 -> 47 | O281: 9 | P281: 5 | Q281: =O281*6+P281 -> 59 | S281: ESSENDON
A282: PRESTON | C282: 0 | D282: 10 | E282: =C282*6+D282 -> 10 | G282: 3 | H282: 12 | I282: =G282*6+H282 -> 30 | K282: 3 | L282: 14 | M282: =K282*6+L282 -> 32 | O282: 4 | P282: 14 | Q282: =O282*6+P282 -> 38 | S282: BAIN
A283: BEST PLAYERS
A284: ESS TOWN | D284: STEEL | G284: GIRDWOOD | J284: NIXON | M284: SWEATMAN | P284: CHEFFERS | S284: DAVIS
A285: PRESTON | D285: NANKERVIS | G285: WHITE | J285: DICKENS | M285: McCLUMPA | P285: S HALL
A286: GOALKICKERS
A287: ESS TOWN | D287: CUMMING 2 | G287: BARR 2 | J287: SWEATMAN | M287: PAIN | O287: MARTIN | R287: C GORDON | U287: GIRDWOOD
A288: PRESTON | D288: WAWN 2 | G288: STANLAKE 2
A290: ROUND 7 | E290: 18TH JUNE | J290: WEATHER | N290: NORTH BREEZE
D291: 1ST QTR | H291: 2ND QTR | L291: 3RD QTR | P291: FINAL | S291: PLAYED AT
A292: RICHMOND | C292: 1 | D292: 1 | E292: =C292*6+D292 -> 7 | G292: 3 | H292: 3 | I292: =G292*6+H292 -> 21 | K292: 4 | L292: 6 | M292: =K292*6+L292 -> 30 | O292: 5 | P292: 7 | Q292: =O292*6+P292 -> 37 | S292: RICHMOND | X292: LADDER | AB292: ROUND | AD292: 7
A293: FOOTSCRAY | C293: 2 | D293: 1 | E293: =C293*6+D293 -> 13 | G293: 2 | H293: 6 | I293: =G293*6+H293 -> 18 | K293: 3 | L293: 7 | M293: =K293*6+L293 -> 25 | O293: 5 | P293: 7 | Q293: =O293*6+P293 -> 37 | S293: UMPIRE
A294: BEST PLAYERS | S294: BAIN | W294: TEAM | X294: W | Y294: L | Z294: D | AA294: FOR | AB294: AGST | AC294: % | AD294: PTS
A295: RICHMOND | D295: JOHNSTON | G295: HASSETT | J295: FAYLE | M295: BRENNAN | P295: McNAIR | S295: JUSTINS
A296: FOOTSCRAY | D296: HINCH | G296: DECOIT | J296: MARMO | M296: OWENS | P296: HARRIS | S296: KRUSE | W296: RICHMOND | X296: 5 | Y296: 1 | Z296: 1 | AA296: 353 | AB296: 214 | AC296: 164.95327102803739 | AD296: 22
A297: GOALKICKERS | W297: FOOTSCRAY | X297: 5 | Y297: 1 | Z297: 1 | AA297: 366 | AB297: 230 | AC297: 159.13043478260869 | AD297: 22
A298: RICHMOND | D298: FAYLE 2 | G298: McNAIR | J298: McDONALD | M298: CLEGHORN | W298: PORT MELBOURNE | X298: 5 | Y298: 2 | Z298: 0 | AA298: 383 | AB298: 255 | AC298: 150.19607843137254 | AD298: 20
A299: FOOTSCRAY | D299: DECOIT 3 | G299: MORAN | J299: FLEWELLYN | W299: NORTH MELBOURNE | X299: 5 | Y299: 2 | Z299: 0 | AA299: 329 | AB299: 225 | AC299: 146.22222222222223 | AD299: 20
A301: NORTH MELBOURNE | C301: 1 | D301: 1 | E301: =C301*6+D301 -> 7 | G301: 4 | H301: 7 | I301: =G301*6+H301 -> 31 | K301: 5 | L301: 10 | M301: =K301*6+L301 -> 40 | O301: 6 | P301: 14 | Q301: =O301*6+P301 -> 50 | S301: NORTH MELB | W301: WEST MELBOURNE | X301: 4 | Y301: 3 | Z301: 0 | AA301: 325 | AB301: 210 | AC301: 154.76190476190476 | AD301: 16
A302: WEST MELBOURNE | C302: 0 | D302: 3 | E302: =C302*6+D302 -> 3 | G302: 0 | H302: 3 | I302: =G302*6+H302 -> 3 | K302: 1 | L302: 4 | M302: =K302*6+L302 -> 10 | O302: 2 | P302: 4 | Q302: =O302*6+P302 -> 16 | S302: J O'LOUGHLIN | W302: BRUNSWICK | X302: 4 | Y302: 3 | Z302: 0 | AA302: 255 | AB302: 340 | AC302: 75 | AD302: 16
A303: BEST PLAYERS | W303: WILLIAMSTOWN | X303: 3 | Y303: 4 | Z303: 0 | AA303: 330 | AB303: 299 | AC303: 110.36789297658864 | AD303: 12
A304: NORTH MELBOURNE | D304: SMITH | G304: BARNES | J304: D NOONAN | M304: KENNEDY | P304: McCANN | S304: MORRISON | W304: PRAHRAN | X304: 2 | Y304: 5 | Z304: 0 | AA304: 327 | AB304: 407 | AC304: 80.343980343980348 | AD304: 8
A305: WEST MELBOURNE | D305: MADDEN | G305: ROOKE | J305: McVEE | M305: POOLE | P305: LAXTON | S305: QUILLIGAN | W305: ESSENDON TOWN | X305: 1 | Y305: 6 | Z305: 0 | AA305: 225 | AB305: 386 | AC305: 58.290155440414509 | AD305: 4
A306: GOALKICKERS | W306: PRESTON | X306: 0 | Y306: 7 | Z306: 0 | AA306: 194 | AB306: 517 | AC306: 37.52 | AD306: 0
A307: NORTH MELBOURNE | D307: McCANN 3 | G307: KENNEDY | J307: MARTIN | M307: MARSHALL
A308: WEST MELBOURNE | D308: RYAN | G308: ARMSTRONG
A310: BRUNSWICK | C310: 2 | D310: 2 | E310: =C310*6+D310 -> 14 | G310: 3 | H310: 3 | I310: =G310*6+H310 -> 21 | K310: 5 | L310: 8 | M310: =K310*6+L310 -> 38 | O310: 7 | P310: 10 | Q310: =O310*6+P310 -> 52 | S310: BRUNSWICK
A311: PRAHRAN | C311: 1 | D311: 1 | E311: =C311*6+D311 -> 7 | G311: 2 | H311: 3 | I311: =G311*6+H311 -> 15 | K311: 3 | L311: 4 | M311: =K311*6+L311 -> 22 | O311: 6 | P311: 9 | Q311: =O311*6+P311 -> 45 | S311: WOOLFE
A312: BEST PLAYERS
A313: BRUNSWICK | D313: HARRIS | G313: STANWAY | J313: CHASE | M313: STEVENSON
A314: PRAHRAN | D314: TORPEY | G314: PONTIN | J314: DRAPER | M314: BOWER
A315: GOALKICKERS
A316: BRUNSWICK | D316: O'BRIEN | G316: ROBINS | J316: WHITFIELD | M316: STANWAY | P316: BURKE
A317: PRAHRAN | D317: JACKSON | G317: DUPE | J317: HAMMOND
A319: PORT MELBOURNE | C319: 0 | D319: 1 | E319: =C319*6+D319 -> 1 | G319: 2 | H319: 12 | I319: =G319*6+H319 -> 24 | K319: 4 | L319: 15 | M319: =K319*6+L319 -> 39 | O319: 6 | P319: 20 | Q319: =O319*6+P319 -> 56 | S319: PORT MELB
A320: ESS TOWN | C320: 1 | D320: 2 | E320: =C320*6+D320 -> 8 | G320: 1 | H320: 2 | I320: =G320*6+H320 -> 8 | K320: 3 | L320: 2 | M320: =K320*6+L320 -> 20 | O320: 5 | P320: 2 | Q320: =O320*6+P320 -> 32 | S320: KENNISON
A321: BEST PLAYERS
A322: PORT MELBOURNE | D322: JOHNSON | G322: ALLAN | J322: KEENAN | M322: PETTIT | P322: TREGLOWAN | T322: BROWN
A323: ESS TOWN | D323: HALL | G323: DAVIS | J323: BARR | M323: STEEL | P323: CHEFFERS | T323: NIXON
A324: GOALKICKERS
A325: PORT MELBOURNE | D325: CROFT 3 | G325: TREGLOWN | J325: ALLEN | L325: J GARBUTT
A326: ESS TOWN | D326: HILTON | G326: STANWORTH | J326: CHEFFERS | M326: HALL | O326: MARTIN
A328: WILLIAMSTOWN | C328: 1 | D328: 5 | E328: =C328*6+D328 -> 11 | G328: 3 | H328: 7 | I328: =G328*6+H328 -> 25 | K328: 4 | L328: 9 | M328: =K328*6+L328 -> 33 | O328: 9 | P328: 14 | Q328: =O328*6+P328 -> 68 | S328: PRESTON
A329: PRESTON | C329: 1 | D329: 1 | E329: =C329*6+D329 -> 7 | G329: 4 | H329: 2 | I329: =G329*6+H329 -> 26 | K329: 5 | L329: 2 | M329: =K329*6+L329 -> 32 | O329: 6 | P329: 2 | Q329: =O329*6+P329 -> 38 | S329: FREAME
A330: BEST PLAYERS
A331: WILLIAMSTOWN | D331: MORTIMER | G331: GRIMSHAW | J331: DICK | L331: WILSCHER | O331: McKINLEY | R331: HOUGHTON
A332: PRESTON
A333: GOALKICKERS
A334: WILLIAMSTOWN | D334: GRIMSHAW 2 | H334: GIBSON 2 | K334: MORTIMER 2 | O334: DICK
A335: PRESTON | D335: GILBERT 2 | H335: WHITE 2 | K335: GIBSON 2
A337: ROUND 8 | E337: 25TH JUNE | J337: WEATHER | N337: SOUTH WIND OVERCAST LIGHT RAIN
D338: 1ST QTR | H338: 2ND QTR | L338: 3RD QTR | P338: FINAL | S338: PLAYED AT
A339: FOOTSCRAY | C339: 0 | D339: 1 | E339: =C339*6+D339 -> 1 | G339: 4 | H339: 7 | I339: =G339*6+H339 -> 31 | K339: 6 | L339: 8 | M339: =K339*6+L339 -> 44 | O339: 8 | P339: 9 | Q339: =O339*6+P339 -> 57 | S339: NORTH MELB | X339: LADDER | AB339: ROUND | AD339: 8
A340: WEST MELBOURNE | C340: 2 | D340: 2 | E340: =C340*6+D340 -> 14 | G340: 3 | H340: 5 | I340: =G340*6+H340 -> 23 | K340: 3 | L340: 5 | M340: =K340*6+L340 -> 23 | O340: 3 | P340: 6 | Q340: =O340*6+P340 -> 24 | S340: UMPIRE
A341: BEST PLAYERS | S341: BAIN | W341: TEAM | X341: W | Y341: L | Z341: D | AA341: FOR | AB341: AGST | AC341: % | AD341: PTS
A342: FOOTSCRAY | D342: HOLLIS | G342: KRUSE | J342: SWALIWELL | M342: E STEPHENSON | Q342: DECOIT | T342: HARRIS
A343: WEST MELBOURNE | D343: ROOKE | G343: POOLE | J343: McVEE | M343: JONES | Q343: GREGORY | T343: HALL | W343: RICHMOND | X343: 6 | Y343: 1 | Z343: 1 | AA343: 438 | AB343: 260 | AC343: 168.46153846153845 | AD343: 26
A344: GOALKICKERS | W344: FOOTSCRAY | X344: 6 | Y344: 1 | Z344: 1 | AA344: 423 | AB344: 254 | AC344: 166.53543307086613 | AD344: 26
A345: FOOTSCRAY | D345: E STEPHENSON 4 | I345: DECOIT 2 | L345: WAGLAND | O345: HOLLIS | W345: PORT MELBOURNE | X345: 6 | Y345: 2 | Z345: 0 | AA345: 431 | AB345: 279 | AC345: 154.48028673835125 | AD345: 24
A346: WEST MELBOURNE | W346: NORTH MELBOURNE | X346: 6 | Y346: 2 | Z346: 0 | AA346: 373 | AB346: 261 | AC346: 142.91187739463601 | AD346: 24
A348: RICHMOND | C348: 0 | D348: 0 | E348: =C348*6+D348 -> 0 | G348: 7 | H348: 4 | I348: =G348*6+H348 -> 46 | K348: 9 | L348: 5 | M348: =K717*6+L717 -> 0 | O348: 13 | P348: 7 | Q348: =O348*6+P348 -> 85 | S348: BRUNSWICK | W348: WEST MELBOURNE | X348: 4 | Y348: 4 | Z348: 0 | AA348: 349 | AB348: 267 | AC348: 130.71161048689137 | AD348: 16
A349: BRUNSWICK | C349: 2 | D349: 3 | E349: =C349*6+D349 -> 15 | G349: 2 | H349: 3 | I349: =G349*6+H349 -> 15 | K349: 4 | L349: 8 | M349: =O717*6+P717 -> 0 | O349: 6 | P349: 10 | Q349: =O349*6+P349 -> 46 | S349: J O'LOUGHLIN | W349: WILLIAMSTOWN | X349: 4 | Y349: 4 | Z349: 0 | AA349: 384 | AB349: 321 | AC349: 119.62616822429906 | AD349: 16
A350: BEST PLAYERS | W350: BRUNSWICK | X350: 4 | Y350: 4 | Z350: 0 | AA350: 301 | AB350: 425 | AC350: 70.82352941176471 | AD350: 16
A351: RICHMOND | D351: CLEGHORN | G351: C WILLIAMS | J351: RUDDOCK | M351: RICKETTS | P351: RICHARDSON | S351: EDMONDS | W351: PRAHRAN | X351: 2 | Y351: 6 | Z351: 0 | AA351: 363 | AB351: 451 | AC351: 80.487804878048777 | AD351: 8
A352: BRUNSWICK | D352: SCOTT | G352: CHASE | J352: CASEY | M352: STANWAY | P352: STEVENSON | S352: HARRIS | W352: ESSENDON TOWN | X352: 1 | Y352: 7 | Z352: 0 | AA352: 247 | AB352: 440 | AC352: 56.136363636363633 | AD352: 4
A353: GOALKICKERS | W353: PRESTON | X353: 0 | Y353: 8 | Z353: 0 | AA353: 218 | AB353: 565 | AC353: 38.58 | AD353: 0
A354: RICHMOND | D354: HUTCHINSON 7 | H354: McDONALD 3 | L354: FAYLE 2
A355: BRUNSWICK
A357: WILLIAMSTOWN | C357: 1 | D357: 4 | E357: =C357*6+D357 -> 10 | G357: 4 | H357: 10 | I357: =G357*6+H357 -> 34 | K357: 4 | L357: 10 | M357: =K357*6+L357 -> 34 | O357: 7 | P357: 12 | Q357: =O357*6+P357 -> 54 | S357: WILLIAMSTOWN
A358: ESS TOWN | C358: 2 | D358: 1 | E358: =C358*6+D358 -> 13 | G358: 2 | H358: 1 | I358: =G358*6+H358 -> 13 | K358: 2 | L358: 3 | M358: =K358*6+L358 -> 15 | O358: 3 | P358: 4 | Q358: =O358*6+P358 -> 22 | S358: GROGAN
A359: BEST PLAYERS
A360: WILLIAMSTOWN | D360: DAVIS | G360: McNEILAGE | K360: BYERS | N360: DICK | Q360: HOUGHTON | T360: HEWITT
A361: ESS TOWN | D361: GIRDWOOD | G361: HALL | K361: SWEATMAN | N361: NIXON | Q361: DAVIS | T361: BARR
A362: GOALKICKERS
A363: WILLIAMSTOWN | D363: HOUGHTON 2 | H363: BRITT 2 | K363: MORTIMER | N363: GRIMSHAW | Q363: SHEEHAN
A364: ESS TOWN
A366: NORTH MELBOURNE | C366: 2 | D366: 2 | E366: =C366*6+D366 -> 14 | G366: 2 | H366: 4 | I366: =G366*6+H366 -> 16 | K366: 3 | L366: 9 | M366: =K366*6+L366 -> 27 | O366: 5 | P366: 14 | Q366: =O366*6+P366 -> 44 | S366: TOORAK PARK
A367: PRAHRAN | C367: 1 | D367: 2 | E367: =C367*6+D367 -> 8 | G367: 3 | H367: 2 | I367: =G367*6+H367 -> 20 | K367: 4 | L367: 5 | M367: =K367*6+L367 -> 29 | O367: 5 | P367: 6 | Q367: =O367*6+P367 -> 36 | S367: FREAME
A368: BEST PLAYERS
A369: NORTH MELBOURNE | D369: BARNES | G369: STEWART | J369: SCOTT | M369: FLYNN | P369: D NOONAN | S369: McCANN
A370: PRAHRAN | D370: PONTIN | G370: ROBERTS | J370: DRAPER | M370: G BROWN | P370: JACKSON | S370: BRUNTON
A371: GOALKICKERS
A372: NORTH MELBOURNE | D372: McCANN 2 | G372: KENNEDY | J372: MARSHALL | M372: D NOONAN
A373: PRAHRAN | D373: WILLISON 2 | G373: G BROWN 2
A375: PORT MELBOURNE | C375: 1 | D375: 4 | E375: =C375*6+D375 -> 10 | G375: 2 | H375: 6 | I375: =G375*6+H375 -> 18 | K375: 5 | L375: 9 | M375: =K375*6+L375 -> 39 | O375: 6 | P375: 12 | Q375: =O375*6+P375 -> 48 | S375: PORT MELB
A376: PRESTON | C376: 1 | D376: 1 | E376: =C376*6+D376 -> 7 | G376: 1 | H376: 4 | I376: =G376*6+H376 -> 10 | K376: 2 | L376: 5 | M376: =K376*6+L376 -> 17 | O376: 3 | P376: 6 | Q376: =O376*6+P376 -> 24 | S376: WOOLFE
A377: BEST PLAYERS
A378: PORT MELBOURNE | D378: YATES | G378: BORTHWICK | J378: KEENAN | M378: CROFT | O378: T WARD | R378: TREGLOWN
A379: PRESTON | D379: STANLAKE | G379: GILBERT | J379: McCLUMPA | M379: S HALL | O379: WAWN | R379: DICKENS
A380: GOALKICKERS
A381: PORT MELBOURNE | D381: CROFT 3 | G381: ALLEN | J381: BROWN | L381: BRENNAN
A382: PRESTON | D382: GILBERT | G382: GIBSON | J382: WAWN
A384: ROUND 9 | E384: 2ND JULY | J384: WEATHER | N384: NORTH WIND RAIN
D385: 1ST QTR | H385: 2ND QTR | L385: 3RD QTR | P385: FINAL | S385: PLAYED AT
A386: RICHMOND | C386: 3 | D386: 1 | E386: =C386*6+D386 -> 19 | G386: 4 | H386: 3 | I386: =G386*6+H386 -> 27 | K386: 7 | L386: 6 | M386: =K386*6+L386 -> 48 | O386: 8 | P386: 8 | Q386: =O386*6+P386 -> 56 | S386: RICHMOND | X386: LADDER | AB386: ROUND | AD386: 9
A387: PORT MELBOURNE | C387: 0 | D387: 2 | E387: =C387*6+D387 -> 2 | G387: 1 | H387: 5 | I387: =G387*6+H387 -> 11 | K387: 2 | L387: 7 | M387: =K387*6+L387 -> 19 | O387: 5 | P387: 9 | Q387: =O387*6+P387 -> 39 | S387: UMPIRE
A388: BEST PLAYERS | S388: GROGAN | W388: TEAM | X388: W | Y388: L | Z388: D | AA388: FOR | AB388: AGST | AC388: % | AD388: PTS
A389: RICHMOND | D389: GEDDES | G389: C WILLIAMS | J389: BOWNAS | M389: RICHARDSON | P389: EDMONDS | S389: JUSTINS
A390: PORT MELBOURNE | D390: WILLIAMS | G390: J GARBUTT | J390: KEENAN | M390: McGOWAN | P390: DANIELS | S390: BROWN | W390: FOOTSCRAY | X390: 7 | Y390: 1 | Z390: 1 | AA390: 472 | AB390: 279 | AC390: 169.17562724014337 | AD390: 30
A391: GOALKICKERS | W391: RICHMOND | X391: 7 | Y391: 1 | Z391: 1 | AA391: 494 | AB391: 299 | AC391: 165.21739130434781 | AD391: 30
A392: RICHMOND | D392: HUTCHINSON 3 | H392: FAYLE 2 | K392: CLEGHORN 2 | N392: McDONALD | W392: NORTH MELBOURNE | X392: 7 | Y392: 2 | Z392: 0 | AA392: 483 | AB392: 280 | AC392: 172.5 | AD392: 28
A393: PORT MELBOURNE | D393: DANIELS 2 | G393: BORTHWICK | J393: CROFT | L393: ALLEN | W393: PORT MELBOURNE | X393: 6 | Y393: 3 | Z393: 0 | AA393: 470 | AB393: 335 | AC393: 140.29850746268656 | AD393: 24
A395: WILLIAMSTOWN | C395: 1 | D395: 4 | E395: =C395*6+D395 -> 10 | G395: 1 | H395: 6 | I395: =G395*6+H395 -> 12 | K395: 3 | L395: 11 | M395: =K395*6+L395 -> 29 | O395: 4 | P395: 13 | Q395: =O395*6+P395 -> 37 | S395: WILLIAMSTOWN | W395: WILLIAMSTOWN | X395: 5 | Y395: 4 | Z395: 0 | AA395: 421 | AB395: 347 | AC395: 121.32564841498559 | AD395: 20
A396: WEST MELBOURNE | C396: 0 | D396: 0 | E396: =C396*6+D396 -> 0 | G396: 3 | H396: 1 | I396: =G396*6+H396 -> 19 | K396: 3 | L396: 2 | M396: =K396*6+L396 -> 20 | O396: 4 | P396: 2 | Q396: =O396*6+P396 -> 26 | S396: J O'LOUGHLIN | W396: BRUNSWICK | X396: 5 | Y396: 4 | Z396: 0 | AA396: 352 | AB396: 453 | AC396: 77.70419426048565 | AD396: 20
A397: BEST PLAYERS | W397: WEST MELBOURNE | X397: 4 | Y397: 5 | Z397: 0 | AA397: 375 | AB397: 304 | AC397: 123.35526315789474 | AD397: 16
A398: WILLIAMSTOWN | D398: JONES | G398: HOUGHTON | J398: DICK | L398: DONALDSON | P398: McNEILAGE | S398: SPRINTHALL | W398: PRAHRAN | X398: 2 | Y398: 7 | Z398: 0 | AA398: 388 | AB398: 500 | AC398: 77.6 | AD398: 8
A399: WEST MELBOURNE | D399: ROOKE | G399: POOLE | J399: T WILLIAMS | M399: FEAVER | P399: D GREGORY | S399: H GREGORY | W399: ESSENDON TOWN | X399: 1 | Y399: 8 | Z399: 0 | AA399: 275 | AB399: 491 | AC399: 56.008146639511203 | AD399: 4
A400: GOALKICKERS | W400: PRESTON | X400: 0 | Y400: 9 | Z400: 0 | AA400: 237 | AB400: 675 | AC400: 35.11 | AD400: 0
A401: WILLIAMSTOWN | D401: MORTIMER | G401: HOUGHTON | J401: SPRINTHALL | M401: MANDERSON
A402: WEST MELBOURNE
A404: BRUNSWICK | C404: 2 | D404: 3 | E404: =C404*6+D404 -> 15 | G404: 4 | H404: 6 | I404: =G404*6+H404 -> 30 | K404: 6 | L404: 7 | M404: =K404*6+L404 -> 43 | O404: 7 | P404: 9 | Q404: =O404*6+P404 -> 51 | S404: ESSENDON
A405: ESS TOWN | C405: 0 | D405: 2 | E405: =C405*6+D405 -> 2 | G405: 0 | H405: 4 | I405: =G405*6+H405 -> 4 | K405: 2 | L405: 9 | M405: =K405*6+L405 -> 21 | O405: 3 | P405: 10 | Q405: =O405*6+P405 -> 28 | S405: KENNISON
A406: BEST PLAYERS
A407: BRUNSWICK
A408: ESS TOWN
A409: GOALKICKERS
A410: BRUNSWICK | D410: TOUGH
A411: ESS TOWN | D411: MARTIN
A413: NORTH MELBOURNE | C413: 1 | D413: 7 | E413: =C413*6+D413 -> 13 | G413: 5 | H413: 16 | I413: =G413*6+H413 -> 46 | K413: 9 | L413: 17 | M413: =K413*6+L413 -> 71 | O413: 15 | P413: 20 | Q413: =O413*6+P413 -> 110 | S413: NORTH MELB
A414: PRESTON | C414: 0 | D414: 2 | E414: =C414*6+D414 -> 2 | G414: 0 | H414: 3 | I414: =G414*6+H414 -> 3 | K414: 2 | L414: 4 | M414: =K414*6+L414 -> 16 | O414: 2 | P414: 7 | Q414: =O414*6+P414 -> 19 | S414: BAIN
A415: BEST PLAYERS
A416: NORTH MELBOURNE | D416: STEWART | G416: MARTIN | J416: GROVES | M416: MORRISON | P416: DALTON | S416: CONSIDINE
A417: PRESTON | D417: S HALL | G417: DAVIDSON | J417: DICKENS | M417: NANKERVIS | P417: McCLUMPA | S417: STANLAKE
A418: GOALKICKERS
A419: NORTH MELBOURNE | D419: KENNY 4 | G419: LONDERIGAN 2 | K419: McCANN 2 | N419: ROGERS | P419: GROVES | R419: D NOONAN | T419: WATSON | W419: MARTIN | X419: STEWART | AB419: MORRISON
A420: PRESTON
A422: FOOTSCRAY | C422: 2 | D422: 4 | E422: =C422*6+D422 -> 16 | G422: 3 | H422: 4 | I422: =G422*6+H422 -> 22 | K422: 5 | L422: 5 | M422: =K422*6+L422 -> 35 | O422: 7 | P422: 7 | Q422: =O422*6+P422 -> 49 | S422: TOORAK PARK
A423: PRAHRAN | C423: 0 | D423: 2 | E423: =C423*6+D423 -> 2 | G423: 1 | H423: 7 | I423: =G423*6+H423 -> 13 | K423: 1 | L423: 9 | M423: =K423*6+L423 -> 15 | O423: 2 | P423: 13 | Q423: =O423*6+P423 -> 25 | S423: FREAME
A424: BEST PLAYERS
A425: FOOTSCRAY | D425: HARRIS | G425: MARMO | J425: GRAHAM | M425: SWALIWELL | P425: DECOIT | S425: E STEPHENSON
A426: PRAHRAN | D426: ROBERTS | G426: DRAPER | J426: HAMMOND | M426: G BROWN | P426: DUPE | S426: BRUNTON
A427: GOALKICKERS
A428: FOOTSCRAY | D428: DECOIT 2 | G428: FLEWELLYN 2 | K428: SERBY | M428: McINNES | O428: E STEVENSON
A429: PRAHRAN | D429: HAMMOND | G429: STEWART
A431: ROUND 10 | E431: 9TH JULY | J431: WEATHER | N431: SOUTH EAST WIND
D432: 1ST QTR | H432: 2ND QTR | L432: 3RD QTR | P432: FINAL | S432: PLAYED AT
A433: PORT MELBOURNE | C433: 2 | D433: 3 | E433: =C433*6+D433 -> 15 | G433: 3 | H433: 3 | I433: =G433*6+H433 -> 21 | K433: 5 | L433: 6 | M433: =K433*6+L433 -> 36 | O433: 6 | P433: 9 | Q433: =O433*6+P433 -> 45 | S433: PORT MELB | X433: LADDER | AB433: ROUND | AD433: 10
A434: WILLIAMSTOWN | C434: 0 | D434: 3 | E434: =C434*6+D434 -> 3 | G434: 2 | H434: 4 | I434: =G434*6+H434 -> 16 | K434: 2 | L434: 4 | M434: =K434*6+L434 -> 16 | O434: 2 | P434: 7 | Q434: =O434*6+P434 -> 19 | S434: UMPIRE
A435: BEST PLAYERS | S435: GROGAN | W435: TEAM | X435: W | Y435: L | Z435: D | AA435: FOR | AB435: AGST | AC435: % | AD435: PTS
A436: PORT MELBOURNE | D436: McGOWAN | G436: ALLEN | I436: YATES | L436: CROFT | O436: BROWN | R436: TREGLOWN
A437: WILLIAMSTOWN | D437: HOUGHTON | G437: DICK | I437: W JONES | L437: McNEILAGE | O437: WILLIAMS | R437: McKENZIE | W437: FOOTSCRAY | X437: 8 | Y437: 1 | Z437: 1 | AA437: 547 | AB437: 301 | AC437: 181.72757475083057 | AD437: 34
A438: GOALKICKERS | W438: RICHMOND | X438: 8 | Y438: 1 | Z438: 1 | AA438: 563 | AB438: 334 | AC438: 168.56287425149699 | AD438: 34
A439: PORT MELBOURNE | D439: CROFT 3 | G439: TREGLOWN | J439: ALLEN | L439: McGOWAN | W439: NORTH MELBOURNE | X439: 8 | Y439: 2 | Z439: 0 | AA439: 553 | AB439: 300 | AC439: 184.33333333333334 | AD439: 32
A440: WILLIAMSTOWN | D440: SHEEHAN | G440: HOUGHTON | W440: PORT MELBOURNE | X440: 7 | Y440: 3 | Z440: 0 | AA440: 515 | AB440: 354 | AC440: 145.48022598870057 | AD440: 28
A442: NORTH MELBOURNE | C442: 0 | D442: 0 | E442: =C442*6+D442 -> 0 | G442: 5 | H442: 3 | I442: =G442*6+H442 -> 33 | K442: 6 | L442: 6 | M442: =K442*6+L442 -> 42 | O442: 10 | P442: 10 | Q442: =O442*6+P442 -> 70 | S442: BRUNSWICK | W442: WEST MELBOURNE | X442: 5 | Y442: 5 | Z442: 0 | AA442: 429 | AB442: 339 | AC442: 126.54867256637168 | AD442: 20
A443: BRUNSWICK | C443: 2 | D443: 1 | E443: =C443*6+D443 -> 13 | G443: 2 | H443: 1 | I443: =G443*6+H443 -> 13 | K443: 3 | L443: 2 | M443: =K443*6+L443 -> 20 | O443: 3 | P443: 2 | Q443: =O443*6+P443 -> 20 | S443: BAIN | W443: WILLIAMSTOWN | X443: 5 | Y443: 5 | Z443: 0 | AA443: 440 | AB443: 392 | AC443: 112.24489795918367 | AD443: 20
A444: BEST PLAYERS | W444: BRUNSWICK | X444: 5 | Y444: 5 | Z444: 0 | AA444: 372 | AB444: 523 | AC444: 71.128107074569783 | AD444: 20
A445: NORTH MELBOURNE | D445: LONDERGREN | G445: WATSON | J445: JAMIESON | M445: STEWART | P445: BARNES | S445: KENNY | W445: PRAHRAN | X445: 2 | Y445: 8 | Z445: 0 | AA445: 423 | AB445: 569 | AC445: 74.340949033391922 | AD445: 8
A446: BRUNSWICK | D446: CASEY | G446: SCOTT | J446: TOUGH | M446: ROBERTSON | P446: JACKSON | S446: LOGAN | W446: ESSENDON TOWN | X446: 1 | Y446: 9 | Z446: 0 | AA446: 310 | AB446: 545 | AC446: 56.88073394495413 | AD446: 4
A447: GOALKICKERS | W447: PRESTON | X447: 0 | Y447: 10 | Z447: 0 | AA447: 259 | AB447: 750 | AC447: 34.53 | AD447: 0
A448: NORTH MELBOURNE | D448: MARSHALL 3 | G448: SMITH 2 | J448: KENNY | L448: DALTON | N448: GROVES | P448: CONSIDINE | S448: McCANN
A449: BRUNSWICK
A451: WEST MELBOURNE | C451: 4 | D451: 4 | E451: =C451*6+D451 -> 28 | G451: 4 | H451: 5 | I451: =G451*6+H451 -> 29 | K451: 7 | L451: 5 | M451: =K451*6+L451 -> 47 | O451: 8 | P451: 6 | Q451: =O451*6+P451 -> 54 | S451: NORTH MELB
A452: ESS TOWN | C452: 0 | D452: 1 | E452: =C452*6+D452 -> 1 | G452: 1 | H452: 6 | I452: =G452*6+H452 -> 12 | K452: 3 | L452: 6 | M452: =K452*6+L452 -> 24 | O452: 4 | P452: 11 | Q452: =O452*6+P452 -> 35 | S452: FREAME
A453: BEST PLAYERS
A454: WEST MELBOURNE | D454: RYAN | G454: P WILLIAMS | K454: J WILLIAMS | N454: FEAVER | Q454: MADDEN | T454: LAXTON
A455: ESS TOWN | D455: McGREGOR | G455: GIRDWOOD | K455: HAMBRIDGE | N455: G MARTIN | Q455: BALL | T455: DAVIS
A456: GOALKICKERS
A457: WEST MELBOURNE | D457: RYAN 3
A458: ESS TOWN
A460: RICHMOND | C460: 4 | D460: 7 | E460: =C460*6+D460 -> 31 | G460: 5 | H460: 8 | I460: =G460*6+H460 -> 38 | K460: 8 | L460: 12 | M460: =K460*6+L460 -> 60 | O460: 9 | P460: 15 | Q460: =O460*6+P460 -> 69 | S460: RICHMOND
A461: PRAHRAN | C461: 0 | D461: 0 | E461: =C461*6+D461 -> 0 | G461: 3 | H461: 2 | I461: =G461*6+H461 -> 20 | K461: 3 | L461: 2 | M461: =K461*6+L461 -> 20 | O461: 5 | P461: 5 | Q461: =O461*6+P461 -> 35 | S461: WOOLFE
A462: BEST PLAYERS
A463: RICHMOND | D463: BOWNAS | G463: GEDDES | J463: BACKHOUSE | N463: HUTCHINSON | R463: RUDD | T463: RICKETTS
A464: PRAHRAN | D464: PONTIN | G464: ROBERTS | J464: JONES | N464: HAMMOND | R464: DUPE | T464: BRUNTON
A465: GOALKICKERS
A466: RICHMOND | D466: GEDDES 2 | G466: EDMONDS 2 | J466: HUTCHINSON | M466: RUDD | O466: CLEGHORN | R466: BRENNAN | T466: RICKETTS
A467: PRAHRAN
A469: FOOTSCRAY | C469: 6 | D469: 2 | E469: =C469*6+D469 -> 38 | G469: 8 | H469: 3 | I469: =G469*6+H469 -> 51 | K469: 9 | L469: 12 | M469: =K469*6+L469 -> 66 | O469: 10 | P469: 15 | Q469: =O469*6+P469 -> 75 | S469: PRESTON
A470: PRESTON | C470: 0 | D470: 0 | E470: =C470*6+D470 -> 0 | G470: 3 | H470: 3 | I470: =G470*6+H470 -> 21 | K470: 3 | L470: 3 | M470: =K470*6+L470 -> 21 | O470: 3 | P470: 4 | Q470: =O470*6+P470 -> 22 | S470: P O'LOUGHLIN
A471: BEST PLAYERS
A472: FOOTSCRAY | D472: FLEWELLYN | G472: DE COIT | J472: JACKSON | M472: HUGHEWS | O472: J STEVENSON | S472: MORAN
A473: PRESTON
A474: GOALKICKERS
A475: FOOTSCRAY | D475: FLEWELLYN 4 | H475: DECOIT 2 | K475: MORAN 2 | N475: HUGHES | P475: E STEVENSON
A476: PRESTON | D476: PRIDEAUX 2 | H476: WAWN
A478: ROUND 11 | E478: 16TH JULY | J478: WEATHER | N478: NORTH WEST WIND RAIN
D479: 1ST QTR | H479: 2ND QTR | L479: 3RD QTR | P479: FINAL | S479: PLAYED AT
A480: FOOTSCRAY | C480: 3 | D480: 2 | E480: =C480*6+D480 -> 20 | G480: 3 | H480: 3 | I480: =G480*6+H480 -> 21 | K480: 4 | L480: 5 | M480: =K480*6+L480 -> 29 | O480: 6 | P480: 8 | Q480: =O480*6+P480 -> 44 | S480: FOOTSCRAY | X480: LADDER | AB480: ROUND | AD480: 11
A481: PORT MELBOURNE | C481: 0 | D481: 1 | E481: =C481*6+D481 -> 1 | G481: 2 | H481: 4 | I481: =G481*6+H481 -> 16 | K481: 3 | L481: 7 | M481: =K481*6+L481 -> 25 | O481: 4 | P481: 7 | Q481: =O481*6+P481 -> 31 | S481: UMPIRE
A482: BEST PLAYERS | S482: WOOLFE | W482: TEAM | X482: W | Y482: L | Z482: D | AA482: FOR | AB482: AGST | AC482: % | AD482: PTS
A483: FOOTSCRAY | D483: MARMO | G483: SWALIWELL | J483: KRUSE | M483: E STEPHENSON | Q483: McINNES | T483: DECOIT
A484: PORT MELBOURNE | D484: TREGLOWAN | G484: J GARBUTT | J484: J WARD | M484: BORTHWICK | Q484: DANIELS | T484: ALLAN | W484: FOOTSCRAY | X484: 9 | Y484: 1 | Z484: 1 | AA484: 591 | AB484: 332 | AC484: 178.01204819277109 | AD484: 38
A485: GOALKICKERS | W485: RICHMOND | X485: 9 | Y485: 1 | Z485: 1 | AA485: 609 | AB485: 344 | AC485: 177.03488372093022 | AD485: 38
A486: FOOTSCRAY | D486: DECOIT 2 | G486: McCARROLL 2 | K486: E STEPHENSON | O486: HUGHES | W486: NORTH MELBOURNE | X486: 8 | Y486: 3 | Z486: 0 | AA486: 581 | AB486: 334 | AC486: 173.95209580838323 | AD486: 32
A487: PORT MELBOURNE | D487: ALLAN 2 | G487: DANIELS | J487: MEAGHAN | W487: PORT MELBOURNE | X487: 7 | Y487: 4 | Z487: 0 | AA487: 546 | AB487: 398 | AC487: 137.1859296482412 | AD487: 28
A489: WILLIAMSTOWN | C489: 2 | D489: 1 | E489: =C489*6+D489 -> 13 | G489: 2 | H489: 1 | I489: =G489*6+H489 -> 13 | K489: 4 | L489: 3 | M489: =K489*6+L489 -> 27 | O489: 5 | P489: 4 | Q489: =O489*6+P489 -> 34 | S489: WILLIAMSTOWN | W489: WEST MELBOURNE | X489: 6 | Y489: 5 | Z489: 0 | AA489: 491 | AB489: 341 | AC489: 143.98826979472142 | AD489: 24
A490: NORTH MELBOURNE | C490: 0 | D490: 0 | E490: =C490*6+D490 -> 0 | G490: 2 | H490: 4 | I490: =G490*6+H490 -> 16 | K490: 2 | L490: 6 | M490: =K490*6+L490 -> 18 | O490: 3 | P490: 10 | Q490: =O490*6+P490 -> 28 | S490: J O'LOUGHLIN | W490: WILLIAMSTOWN | X490: 6 | Y490: 5 | Z490: 0 | AA490: 474 | AB490: 420 | AC490: 112.85714285714286 | AD490: 24
A491: BEST PLAYERS | W491: BRUNSWICK | X491: 5 | Y491: 6 | Z491: 0 | AA491: 374 | AB491: 585 | AC491: 63.931623931623932 | AD491: 20
A492: WILLIAMSTOWN | D492: BAKER | G492: DICK | J492: HOUGHTON | M492: McNEILAGE | P492: McKINLEY | S492: BRITT | W492: PRAHRAN | X492: 3 | Y492: 8 | Z492: 0 | AA492: 481 | AB492: 574 | AC492: 83.7979094076655 | AD492: 12
A493: NORTH MELBOURNE | D493: MORRISON | G493: WATSON | J493: JAMIESON | M493: BARNES | P493: STEWART | S493: LONDERGREN | W493: ESSENDON TOWN | X493: 1 | Y493: 10 | Z493: 0 | AA493: 320 | AB493: 591 | AC493: 54.145516074450086 | AD493: 4
A494: GOALKICKERS | W494: PRESTON | X494: 0 | Y494: 11 | Z494: 0 | AA494: 264 | AB494: 808 | AC494: 32.67 | AD494: 0
A495: WILLIAMSTOWN | D495: MORTIMER 2 | H495: BRITT | K495: CALDWELL | N495: DICK
A496: NORTH MELBOURNE | D496: SMITH | G496: McCANN | J496: MORRISON
A498: WEST MELBOURNE | C498: 3 | D498: 7 | E498: =C498*6+D498 -> 25 | G498: 4 | H498: 11 | I498: =G498*6+H498 -> 35 | K498: 4 | L498: 17 | M498: =K498*6+L498 -> 41 | O498: 7 | P498: 20 | Q498: =O498*6+P498 -> 62 | S498: NORTH MELB
A499: BRUNSWICK | C499: 0 | D499: 0 | E499: =C499*6+D499 -> 0 | G499: 0 | H499: 1 | I499: =G499*6+H499 -> 1 | K499: 0 | L499: 2 | M499: =K499*6+L499 -> 2 | O499: 0 | P499: 2 | Q499: =O499*6+P499 -> 2 | S499: BAIN
A500: BEST PLAYERS
A501: WEST MELBOURNE | D501: POOLE | G501: ROOKE | J501: McVEE | M501: MADDEN | P501: FEAVER | S501: D GREGORY
A502: BRUNSWICK | D502: HARRIS | G502: CHASE | J502: TOUGH | M502: McNAMARA | P502: SCOTT | S502: STEVENSON
A503: GOALKICKERS
A504: WEST MELBOURNE | D504: RYAN 3 | G504: HALL | I504: McVEE | K504: H GREGORY | N504: J WILLIAMS
A505: BRUNSWICK | D505: NIL
A507: RICHMOND | C507: 2 | D507: 3 | E507: =C507*6+D507 -> 15 | G507: 3 | H507: 5 | I507: =G507*6+H507 -> 23 | K507: 3 | L507: 8 | M507: =K507*6+L507 -> 26 | O507: 5 | P507: 16 | Q507: =O507*6+P507 -> 46 | S507: RICHMOND
A508: ESS TOWN | C508: 0 | D508: 0 | E508: =C508*6+D508 -> 0 | G508: 0 | H508: 1 | I508: =G508*6+H508 -> 1 | K508: 1 | L508: 3 | M508: =K508*6+L508 -> 9 | O508: 1 | P508: 4 | Q508: =O508*6+P508 -> 10 | S508: FREAME
A509: BEST PLAYERS
A510: RICHMOND | D510: BOWNAS | G510: YOUNG | J510: JUSTINS | N510: GEDDES | Q510: HORE | T510: RICKETTS
A511: ESS TOWN | D511: STANWORTH | G511: HORDERN | J511: SWEATMAN | N511: SHELDON | Q511: MARTIN | T511: CHEFFERS
A512: GOALKICKERS
A513: RICHMOND | D513: C FAYLE 3 | G513: GEDDES | J513: EDMONDS
A514: ESS TOWN | D514: MARTIN
A516: PRAHRAN | C516: 2 | D516: 3 | E516: =C516*6+D516 -> 15 | G516: 3 | H516: 7 | I516: =G516*6+H516 -> 25 | K516: 6 | L516: 10 | M516: =K516*6+L516 -> 46 | O516: 7 | P516: 16 | Q516: =O516*6+P516 -> 58 | S516: TOORAK PARK
A517: PRESTON | C517: 0 | D517: 0 | E517: =C517*6+D517 -> 0 | G517: 0 | H517: 1 | I517: =G517*6+H517 -> 1 | K517: 0 | L517: 2 | M517: =K517*6+L517 -> 2 | O517: 0 | P517: 5 | Q517: =O517*6+P517 -> 5 | S517: ALLEN
A518: BEST PLAYERS
A519: PRAHRAN | D519: BRITTINGHAM | H519: HAMMOND | K519: AYLING | N519: PONTIN | Q519: JAMES | S519: BRUNTON
A520: PRESTON | D520: S HALL | G520: McCLUMPA | J520: P HALL | M520: NANKERVIS | P520: D HALL | S520: STANLAKE
A521: GOALKICKERS
A522: PRAHRAN | D522: HAMMOND 4 | H522: SYKES 2 | K522: STEWART
A523: PRESTON | D523: NIL
A525: ROUND 12 | E525: 23RD JULY | J525: WEATHER | N525: FINE
D526: 1ST QTR | H526: 2ND QTR | L526: 3RD QTR | P526: FINAL | S526: PLAYED AT
A527: FOOTSCRAY | C527: 1 | D527: 4 | E527: =C527*6+D527 -> 10 | G527: 3 | H527: 8 | I527: =G527*6+H527 -> 26 | K527: 3 | L527: 8 | M527: =K527*6+L527 -> 26 | O527: 3 | P527: 8 | Q527: =O527*6+P527 -> 26 | S527: FOOTSCRAY | X527: LADDER | AB527: ROUND | AD527: 12
A528: WILLIAMSTOWN | C528: 1 | D528: 1 | E528: =C528*6+D528 -> 7 | G528: 2 | H528: 3 | I528: =G528*6+H528 -> 15 | K528: 2 | L528: 5 | M528: =K528*6+L528 -> 17 | O528: 2 | P528: 8 | Q528: =O528*6+P528 -> 20 | S528: UMPIRE
A529: BEST PLAYERS | S529: ALLEN | W529: TEAM | X529: W | Y529: L | Z529: D | AA529: FOR | AB529: AGST | AC529: % | AD529: PTS
A530: FOOTSCRAY | D530: MARMO | G530: HARRIS | J530: HINCH | M530: SWALIWELL | P530: KRUSE | S530: J STEPHENSON
A531: WILLIAMSTOWN | D531: BAKER | G531: WILTSHIRE | J531: HALL | M531: JONES | P531: McNEILAGE | S531: SHEEHAN | W531: RICHMOND | X531: 10 | Y531: 1 | Z531: 1 | AA531: 715 | AB531: 371 | AC531: 192.72237196765499 | AD531: 42
A532: GOALKICKERS | W532: FOOTSCRAY | X532: 10 | Y532: 1 | Z532: 1 | AA532: 617 | AB532: 352 | AC532: 175.28409090909091 | AD532: 42
A533: FOOTSCRAY | D533: FLEWELLYN 2 | H533: HUGHES | W533: NORTH MELBOURNE | X533: 9 | Y533: 3 | Z533: 0 | AA533: 654 | AB533: 372 | AC533: 175.80645161290323 | AD533: 36
A534: WILLIAMSTOWN | D534: MORTIMER 2 | W534: PORT MELBOURNE | X534: 8 | Y534: 4 | Z534: 0 | AA534: 651 | AB534: 440 | AC534: 147.95454545454547 | AD534: 32
A536: PORT MELBOURNE | C536: 6 | D536: 1 | E536: =C536*6+D536 -> 37 | G536: 10 | H536: 7 | I536: =G536*6+H536 -> 67 | K536: 12 | L536: 13 | M536: =K536*6+L536 -> 85 | O536: 15 | P536: 15 | Q536: =O536*6+P536 -> 105 | S536: P.M | W536: WEST MELBOURNE | X536: 7 | Y536: 5 | Z536: 0 | AA536: 564 | AB536: 392 | AC536: 143.87755102040816 | AD536: 28
A537: BRUNSWICK | C537: 2 | D537: 1 | E537: =C537*6+D537 -> 13 | G537: 3 | H537: 3 | I537: =G537*6+H537 -> 21 | K537: 3 | L537: 3 | M537: =K537*6+L537 -> 21 | O537: 6 | P537: 6 | Q537: =O537*6+P537 -> 42 | W537: WILLIAMSTOWN | X537: 6 | Y537: 6 | Z537: 0 | AA537: 494 | AB537: 446 | AC537: 110.76233183856502 | AD537: 24
A538: BEST PLAYERS | W538: BRUNSWICK | X538: 5 | Y538: 7 | Z538: 0 | AA538: 416 | AB538: 690 | AC538: 60.289855072463766 | AD538: 20
A539: PORT MELBOURNE | D539: CROFT | G539: JOHNSON | J539: BORTHWICK | M539: J WARD | P539: CROFT | S539: ALLEN | W539: PRAHRAN | X539: 3 | Y539: 9 | Z539: 0 | AA539: 532 | AB539: 647 | AC539: 82.22565687789799 | AD539: 12
A540: BRUNSWICK | D540: SCOTT | G540: WALSH | J540: D HARRIS | M540: STANWAY | P540: McNAMARA | S540: WHITFIELD | W540: ESSENDON TOWN | X540: 1 | Y540: 11 | Z540: 0 | AA540: 358 | AB540: 664 | AC540: 53.915662650602407 | AD540: 4
A541: GOALKICKERS | W541: PRESTON | X541: 0 | Y541: 12 | Z541: 0 | AA541: 291 | AB541: 914 | AC541: 31.84 | AD541: 0
A542: PORT MELBOURNE | D542: CROFT 8 | G542: JOHNSON 2 | J542: TREGLOWAN 2 | N542: BROWN | P542: DANIELS | S542: ALLAN
A543: BRUNSWICK | D543: WHITFIELD 3 | H543: STANWAY 2 | K543: ALLAN
A545: WEST MELBOURNE | C545: 3 | D545: 3 | E545: =C545*6+D545 -> 21 | G545: 6 | H545: 6 | I545: =G545*6+H545 -> 42 | K545: 9 | L545: 6 | M545: =K545*6+L545 -> 60 | O545: 11 | P545: 7 | Q545: =O545*6+P545 -> 73 | S545: NORTH MELB
A546: PRAHRAN | C546: 1 | D546: 2 | E546: =C546*6+D546 -> 8 | G546: 2 | H546: 4 | I546: =G546*6+H546 -> 16 | K546: 5 | L546: 6 | M546: =K546*6+L546 -> 36 | O546: 7 | P546: 9 | Q546: =O546*6+P546 -> 51
A547: BEST PLAYERS
A548: WEST MELBOURNE
A549: PRAHRAN
A550: GOALKICKERS
A551: WEST MELBOURNE | D551: RYAN 4 | G551: HALL 2 | J551: CATANARICH 2 | N551: ARMSTRONG | R551: COTTER | T551: POOLE
A552: PRAHRAN | D552: SMITH 4 | G552: SYKES 2 | J552: T BROWN
A554: NORTH MELBOURNE | C554: 1 | D554: 2 | E554: =C554*6+D554 -> 8 | G554: 4 | H554: 5 | I554: =G554*6+H554 -> 29 | K554: 5 | L554: 10 | M554: =K554*6+L554 -> 40 | O554: 10 | P554: 13 | Q554: =O554*6+P554 -> 73 | S554: ESSENDON
A555: ESS TOWN | C555: 2 | D555: 3 | E555: =C555*6+D555 -> 15 | G555: 5 | H555: 5 | I555: =G555*6+H555 -> 35 | K555: 5 | L555: 7 | M555: =K555*6+L555 -> 37 | O555: 5 | P555: 8 | Q555: =O555*6+P555 -> 38
A556: BEST PLAYERS
A557: NORTH MELBOURNE | D557: GROVES | G557: STEWART | J557: LONDERGREN | N557: MORRISON | R557: DALTON | T557: CONSIDINE
A558: ESS TOWN | D558: HAMBRIDGE | G558: McGREGOR | J558: GIRDWOOD | N558: SWEATMAN | R558: STEEL | T558: GORDON
A559: GOALKICKERS
A560: NORTH MELBOURNE | D560: GROVES 2 | G560: KENNY 2 | J560: CONSIDINE | M560: STEWART | P560: MARSHALL | S560: ENGLISH | V560: P NOONAN | X560: MORRISON
A561: ESS TOWN | D561: HAMBRIDGE 2 | H561: GORDON 2 | K561: MARTIN
A563: RICHMOND | C563: 8 | D563: 4 | E563: =C563*6+D563 -> 52 | G563: 10 | H563: 7 | I563: =G563*6+H563 -> 67 | K563: 14 | L563: 12 | M563: =K563*6+L563 -> 96 | O563: 15 | P563: 16 | Q563: =O563*6+P563 -> 106 | S563: RICHMOND
A564: PRESTON | C564: 0 | D564: 0 | E564: =C564*6+D564 -> 0 | G564: 2 | H564: 0 | I564: =G564*6+H564 -> 12 | K564: 3 | L564: 0 | M564: =K564*6+L564 -> 18 | O564: 4 | P564: 3 | Q564: =O564*6+P564 -> 27
A565: BEST PLAYERS
A566: RICHMOND | D566: CLEGHORN | G566: T WILLIAMS | J566: C WILLIAMS | N566: BACKHOUSE | R566: RUDD | T566: McDONALD
A567: PRESTON | D567: STANLAKE | G567: S HALL | J567: BROADHURST | N567: DICKENS
A568: GOALKICKERS
A569: RICHMOND | D569: CLEGHORN 5 | H569: T WILLIAMS 3 | L569: HUTCHINSON 3 | P569: McDONALD 2 | T569: FAYLE | W569: EDMONDS
A570: PRESTON | D570: DOWLING 2 | H570: PRIDEAUX | K570: ROBERTS
A572: ROUND 13 | E572: 30TH JULY | J572: WEATHER | N572: SOUTH WEST WIND SHOWERS
D573: 1ST QTR | H573: 2ND QTR | L573: 3RD QTR | P573: FINAL | S573: PLAYED AT
A574: NORTH MELBOURNE | C574: 0 | D574: 3 | E574: =C574*6+D574 -> 3 | G574: 3 | H574: 4 | I574: =G574*6+H574 -> 22 | K574: 5 | L574: 4 | M574: =K574*6+L574 -> 34 | O574: 8 | P574: 4 | Q574: =O574*6+P574 -> 52 | S574: NORTH MELB | X574: LADDER | AB574: ROUND | AD574: 13
A575: RICHMOND | C575: 3 | D575: 1 | E575: =C575*6+D575 -> 19 | G575: 3 | H575: 1 | I575: =G575*6+H575 -> 19 | K575: 4 | L575: 4 | M575: =K575*6+L575 -> 28 | O575: 6 | P575: 6 | Q575: =O575*6+P575 -> 42 | S575: UMPIRE
A576: BEST PLAYERS | S576: ALLEN | W576: TEAM | X576: W | Y576: L | Z576: D | AA576: FOR | AB576: AGST | AC576: % | AD576: PTS
A577: NORTH MELBOURNE | D577: P NOONAN | G577: D NOONAN | J577: MORRISON | M577: CONSIDINE | P577: STEWART | S577: WATSON
A578: RICHMOND | D578: CLEGHORN | G578: T WILLIAMS | J578: C WILLIAMS | M578: GEDDES | P578: JUSTINS | S578: BRENNAN | W578: FOOTSCRAY | X578: 11 | Y578: 1 | Z578: 1 | AA578: 677 | AB578: 392 | AC578: 172.70408163265307 | AD578: 46
A579: GOALKICKERS | W579: RICHMOND | X579: 10 | Y579: 2 | Z579: 1 | AA579: 757 | AB579: 423 | AC579: 178.95981087470449 | AD579: 42
A580: NORTH MELBOURNE | D580: HOLLAND 3 | G580: GROVES | J580: CONSIDINE | M580: McCANN | O580: DALTON | R580: D NOONAN | W580: NORTH MELBOURNE | X580: 10 | Y580: 3 | Z580: 0 | AA580: 706 | AB580: 414 | AC580: 170.53140096618358 | AD580: 40
A581: RICHMOND | W581: PORT MELBOURNE | X581: 9 | Y581: 4 | Z581: 0 | AA581: 709 | AB581: 473 | AC581: 149.89429175475686 | AD581: 36
A583: WILLIAMSTOWN | C583: 4 | D583: 7 | E583: =C583*6+D583 -> 31 | G583: 5 | H583: 10 | I583: =G583*6+H583 -> 40 | K583: 6 | L583: 15 | M583: =K583*6+L583 -> 51 | O583: 8 | P583: 17 | Q583: =O583*6+P583 -> 65 | S583: WILLIAMSTOWN | W583: WEST MELBOURNE | X583: 8 | Y583: 5 | Z583: 0 | AA583: 663 | AB583: 418 | AC583: 158.61244019138755 | AD583: 32
A584: BRUNSWICK | C584: 1 | D584: 0 | E584: =C584*6+D584 -> 6 | G584: 3 | H584: 0 | I584: =G584*6+H584 -> 18 | K584: 4 | L584: 0 | M584: =K584*6+L584 -> 24 | O584: 5 | P584: 4 | Q584: =O584*6+P584 -> 34 | S584: GROGAN | W584: WILLIAMSTOWN | X584: 7 | Y584: 6 | Z584: 0 | AA584: 559 | AB584: 480 | AC584: 116.45833333333333 | AD584: 28
A585: BEST PLAYERS | W585: BRUNSWICK | X585: 5 | Y585: 8 | Z585: 0 | AA585: 450 | AB585: 755 | AC585: 59.602649006622514 | AD585: 20
A586: WILLIAMSTOWN | D586: BAKER | G586: C JONES | J586: McKENZIE | M586: DAVIS | P586: W JONES | S586: McNEILAGE | W586: PRAHRAN | X586: 3 | Y586: 10 | Z586: 0 | AA586: 565 | AB586: 705 | AC586: 80.141843971631204 | AD586: 12
A587: BRUNSWICK | D587: SCOTT | G587: CASEY | J587: KENNETT | M587: STEVENSON | P587: TOUGH | W587: ESSENDON TOWN | X587: 1 | Y587: 12 | Z587: 0 | AA587: 398 | AB587: 724 | AC587: 54.972375690607734 | AD587: 4
A588: GOALKICKERS | W588: PRESTON | X588: 0 | Y588: 13 | Z588: 0 | AA588: 317 | AB588: 1013 | AC588: 31.29 | AD588: 0
A589: WILLIAMSTOWN | D589: BRITT 2 | G589: SHEEHAN 2 | J589: MORTIMER 2 | M589: DICK | O589: HOUGHTON
A590: BRUNSWICK | D590: WHITFIELD 2 | H590: BURKE 2 | K590: ANDREWS
A592: PORT MELBOURNE | C592: 3 | D592: 2 | E592: =C592*6+D592 -> 20 | G592: 5 | H592: 6 | I592: =G592*6+H592 -> 36 | K592: 7 | L592: 8 | M592: =K592*6+L592 -> 50 | O592: 8 | P592: 10 | Q592: =O592*6+P592 -> 58 | S592: PORT MELB
A593: PRAHRAN | C593: 2 | D593: 2 | E593: =C593*6+D593 -> 14 | G593: 2 | H593: 4 | I593: =G593*6+H593 -> 16 | K593: 4 | L593: 7 | M593: =K593*6+L593 -> 31 | O593: 4 | P593: 9 | Q593: =O593*6+P593 -> 33 | S593: FREAME
A594: BEST PLAYERS
A595: PORT MELBOURNE | D595: J GARBUTT | H595: McGOWAN | K595: KEENAN | N595: P GARBUTT | Q595: CROFT | T595: JACKSON
A596: PRAHRAN | D596: AYLING | H596: G BROWN | K596: ROBERTS | N596: BRUNTON | Q596: HAMMOND | T596: TORPEY
A597: GOALKICKERS
A598: PORT MELBOURNE | D598: CROFT 3 | G598: JACKSON 2 | J598: PETTIT | L598: ALLEN | N598: KEENAN
A599: PRAHRAN | D599: HAMMOND 2 | G599: R JACKSON | K599: BRUNTON
A601: WEST MELBOURNE | C601: 0 | D601: 2 | E601: =C601*6+D601 -> 2 | G601: 6 | H601: 9 | I601: =G601*6+H601 -> 45 | K601: 9 | L601: 12 | M601: =K601*6+L601 -> 66 | O601: 14 | P601: 15 | Q601: =O601*6+P601 -> 99 | S601: PRESTON
A602: PRESTON | C602: 2 | D602: 2 | E602: =C602*6+D602 -> 14 | G602: 3 | H602: 2 | I602: =G602*6+H602 -> 20 | K602: 3 | L602: 2 | M602: =K602*6+L602 -> 20 | O602: 4 | P602: 2 | Q602: =O602*6+P602 -> 26 | S602: WOOLFE
A603: BEST PLAYERS
A604: WEST MELBOURNE | D604: RYAN | G604: MADDEN | J604: ROLENT | M604: LAXTON | P604: COTTER | S604: ROOKE
A605: PRESTON | D605: S HALL | G605: NANKERVIS | J605: DICKENS | M605: STANLAKE | P605: WARNE | S605: PRIDEAUX
A606: GOALKICKERS
A607: WEST MELBOURNE | D607: RYAN 8
A608: PRESTON | D608: PRIDEAUX 3 | G608: WAWN
A610: FOOTSCRAY | C610: 3 | D610: 2 | E610: =C610*6+D610 -> 20 | G610: 5 | H610: 3 | I610: =G610*6+H610 -> 33 | K610: 8 | L610: 4 | M610: =K610*6+L610 -> 52 | O610: 9 | P610: 6 | Q610: =O610*6+P610 -> 60 | S610: ESSENDON
A611: ESS TOWN | C611: 0 | D611: 3 | E611: =C611*6+D611 -> 3 | G611: 2 | H611: 5 | I611: =G611*6+H611 -> 17 | K611: 4 | L611: 8 | M611: =K611*6+L611 -> 32 | O611: 5 | P611: 10 | Q611: =O611*6+P611 -> 40 | S611: J O'LOUGHLIN
A612: BEST PLAYERS
A613: FOOTSCRAY | D613: MCCARTHY | G613: HARRIS | J613: O'SHEA | M613: MARMO | P613: GRAHAM | S613: E STEPHENSON
A614: ESS TOWN | D614: SWEATMAN | G614: SHELDON | J614: STEEL | M614: GIRDWOOD | P614: HAMBRIDGE | S614: MARTIN
A615: GOALKICKERS
A616: FOOTSCRAY | D616: McCARROLL 2 | H616: MORAN 2 | K616: WAGLAND 2 | N616: SERBY | P616: E STEVENSON | S616: McCARROLL
A617: ESS TOWN | D617: BARLOW 3
A619: ROUND 14 | E619: 6TH AUGUST | J619: WEATHER | N619: NORTH WIND FINE
D620: 1ST QTR | H620: 2ND QTR | L620: 3RD QTR | P620: FINAL | S620: PLAYED AT
A621: NORTH MELBOURNE | C621: 1 | D621: 4 | E621: =C621*6+D621 -> 10 | G621: 1 | H621: 4 | I621: =G621*6+H621 -> 10 | K621: 2 | L621: 6 | M621: =K621*6+L621 -> 18 | O621: 2 | P621: 6 | Q621: =O621*6+P621 -> 18 | S621: NORTH MELB | X621: LADDER | AB621: ROUND | AD621: 14
A622: FOOTSCRAY | C622: 0 | D622: 0 | E622: =C622*6+D622 -> 0 | G622: 1 | H622: 1 | I622: =G622*6+H622 -> 7 | K622: 1 | L622: 1 | M622: =K622*6+L622 -> 7 | O622: 1 | P622: 2 | Q622: =O622*6+P622 -> 8 | S622: UMPIRE
A623: BEST PLAYERS | S623: ALLEN | W623: TEAM | X623: W | Y623: L | Z623: D | AA623: FOR | AB623: AGST | AC623: % | AD623: PTS
A624: NORTH MELBOURNE | D624: D NOONAN | G624: P NOONAN | J624: STEWART | L624: WATSON | O624: LONDERGREN | S624: CONSIDINE
A625: FOOTSCRAY | D625: HARRIS | G625: HINCH | J625: O'SHEA | L625: JACKSON | O625: McCARTHY | S625: McINNES | W625: RICHMOND | X625: 11 | Y625: 2 | Z625: 1 | AA625: 816 | AB625: 459 | AC625: 177.77777777777777 | AD625: 46
A626: GOALKICKERS | W626: FOOTSCRAY | X626: 11 | Y626: 2 | Z626: 1 | AA626: 685 | AB626: 410 | AC626: 167.07317073170731 | AD626: 46
A627: NORTH MELBOURNE | D627: KENNEDY | G627: HOLLAND | W627: NORTH MELBOURNE | X627: 11 | Y627: 3 | Z627: 0 | AA627: 724 | AB627: 422 | AC627: 171.56398104265404 | AD627: 44
A628: FOOTSCRAY | D628: FLEWELLYN | W628: PORT MELBOURNE | X628: 10 | Y628: 4 | Z628: 0 | AA628: 731 | AB628: 494 | AC628: 147.9757085020243 | AD628: 40
A630: PORT MELBOURNE | C630: 1 | D630: 2 | E630: =C630*6+D630 -> 8 | G630: 2 | H630: 4 | I630: =G630*6+H630 -> 16 | K630: 2 | L630: 10 | M630: =K630*6+L630 -> 22 | O630: 2 | P630: 10 | Q630: =O630*6+P630 -> 22 | S630: PORT MELB | W630: WEST MELBOURNE | X630: 8 | Y630: 6 | Z630: 0 | AA630: 684 | AB630: 440 | AC630: 155.45454545454547 | AD630: 32
A631: WEST MELBOURNE | C631: 1 | D631: 1 | E631: =C631*6+D631 -> 7 | G631: 1 | H631: 3 | I631: =G631*6+H631 -> 9 | K631: 1 | L631: 3 | M631: =K631*6+L631 -> 9 | O631: 3 | P631: 3 | Q631: =O631*6+P631 -> 21 | S631: BAIN | W631: WILLIAMSTOWN | X631: 7 | Y631: 7 | Z631: 0 | AA631: 595 | AB631: 539 | AC631: 110.3896103896104 | AD631: 28
A632: BEST PLAYERS | W632: BRUNSWICK | X632: 6 | Y632: 8 | Z632: 0 | AA632: 512 | AB632: 795 | AC632: 64.40251572327044 | AD632: 24
A633: PORT MELBOURNE | D633: TREGLOWAN | G633: KEENAN | J633: BROWN | M633: J WARD | P633: PETTIT | S633: J GARBUTT | W633: PRAHRAN | X633: 3 | Y633: 11 | Z633: 0 | AA633: 619 | AB633: 768 | AC633: 80.598958333333329 | AD633: 12
A634: WEST MELBOURNE | D634: ROLENT | G634: MADDEN | J634: LIVINGSTONE | M634: LAXTON | P634: McVEE | S634: ROOKE | W634: ESSENDON TOWN | X634: 2 | Y634: 12 | Z634: 0 | AA634: 461 | AB634: 778 | AC634: 59.254498714652954 | AD634: 8
A635: GOALKICKERS | W635: PRESTON | X635: 0 | Y635: 14 | Z635: 0 | AA635: 357 | AB635: 1075 | AC635: 33.21 | AD635: 0
A636: PORT MELBOURNE | D636: CROFT | G636: ALLEN
A637: WEST MELBOURNE | D637: COTTER 2 | G637: H GREGORY
A639: RICHMOND | C639: 1 | D639: 1 | E639: =C639*6+D639 -> 7 | G639: 5 | H639: 7 | I639: =G639*6+H639 -> 37 | K639: 5 | L639: 9 | M639: =K639*6+L639 -> 39 | O639: 8 | P639: 11 | Q639: =O639*6+P639 -> 59 | S639: RICHMOND
A640: WILLIAMSTOWN | C640: 1 | D640: 5 | E640: =C640*6+D640 -> 11 | G640: 2 | H640: 6 | I640: =G640*6+H640 -> 18 | K640: 4 | L640: 11 | M640: =K640*6+L640 -> 35 | O640: 4 | P640: 12 | Q640: =O640*6+P640 -> 36 | S640: J O'LOUGHLIN
A641: BEST PLAYERS
A642: RICHMOND | D642: C WILLIAMS | G642: T WILLIAMS | J642: BACKHOUSE | N642: GEDDES | Q642: RUDDOCK | T642: HASSETT
A643: WILLIAMSTOWN | D643: HOUGHTON | G643: DICK | J643: MANDERSON | N643: McKINLEY | Q643: CALDWELL | T643: DAVIS
A644: GOALKICKERS
A645: RICHMOND | D645: HUTCHINSON 3 | H645: NORMAN
A646: WILLIAMSTOWN | D646: MORTIMER 2 | G646: BRITT | J646: DICK
A648: ESS TOWN | C648: 2 | D648: 5 | E648: =C648*6+D648 -> 17 | G648: 2 | H648: 8 | I648: =G648*6+H648 -> 20 | K648: 6 | L648: 19 | M648: =K648*6+L648 -> 55 | O648: 7 | P648: 21 | Q648: =O648*6+P648 -> 63 | S648: TOORAK PARK
A649: PRAHRAN | C649: 1 | D649: 0 | E649: =C649*6+D649 -> 6 | G649: 6 | H649: 3 | I649: =G649*6+H649 -> 39 | K649: 6 | L649: 3 | M649: =K649*6+L649 -> 39 | O649: 8 | P649: 6 | Q649: =O649*6+P649 -> 54 | S649: GROGAN
A650: BEST PLAYERS
A651: ESS TOWN | D651: GIRDWOOD | G651: McGREGOR | J651: NUMA | M651: MARTIN | P651: PAIN | S651: GRIFFITHS
A652: PRAHRAN
A653: GOALKICKERS
A654: ESS TOWN | D654: GIRDWOOD 2 | H654: GORDON 2
A655: PRAHRAN | D655: BENTLEY 2 | G655: G BROWN | J655: SYKES | L655: TORPEY | O655: L SMITH | R655: PONTIN
A657: BRUNSWICK | C657: 1 | D657: 1 | E657: =C657*6+D657 -> 7 | G657: 6 | H657: 7 | I657: =G657*6+H657 -> 43 | K657: 6 | L657: 8 | M657: =K657*6+L657 -> 44 | O657: 8 | P657: 14 | Q657: =O657*6+P657 -> 62 | S657: BRUNSWICK
A658: PRESTON | C658: 3 | D658: 2 | E658: =C658*6+D658 -> 20 | G658: 3 | H658: 2 | I658: =G658*6+H658 -> 20 | K658: 6 | L658: 4 | M658: =K658*6+L658 -> 40 | O658: 6 | P658: 4 | Q658: =O658*6+P658 -> 40 | S658: WOOLFE
A659: BEST PLAYERS
A660: BRUNSWICK | D660: CASEY | G660: HARRIS | J660: SCOTT | N660: C TOUGH | Q660: HENLEY | T660: LOGAN
A661: PRESTON | D661: PRIDEAUX | G661: S HALL | J661: INGLEMAN | N661: STANLAKE | Q661: D HALL | T661: WARNE
A662: GOALKICKERS
A663: BRUNSWICK | D663: TRIPLETT 3 | G663: MULVANEY 2 | K663: TOUGH 2 | N663: ANDREWS
A664: PRESTON | D664: PRIDEAUX 3 | G664: DAVIS | J664: DAVIDSON | M664: INGLEMAN
A666: ROUND 15 | E666: 13TH AUGUST | J666: WEATHER | N666: LIGHT SOUTH WEST WIND FINE BUT CLOUDY
D667: 1ST QTR | H667: 2ND QTR | L667: 3RD QTR | P667: FINAL | S667: PLAYED AT
A668: PORT MELBOURNE | C668: 0 | D668: 4 | E668: =C668*6+D668 -> 4 | G668: 5 | H668: 6 | I668: =G668*6+H668 -> 36 | K668: 5 | L668: 8 | M668: =K668*6+L668 -> 38 | O668: 5 | P668: 10 | Q668: =O668*6+P668 -> 40 | S668: PORT MELB | X668: LADDER | AB668: ROUND | AD668: 15
A669: NORTH MELBOURNE | C669: 1 | D669: 2 | E669: =C669*6+D669 -> 8 | G669: 1 | H669: 3 | I669: =G669*6+H669 -> 9 | K669: 2 | L669: 5 | M669: =K669*6+L669 -> 17 | O669: 3 | P669: 5 | Q669: =O669*6+P669 -> 23 | S669: UMPIRE
A670: BEST PLAYERS | S670: J O'LOUGHLIN | W670: TEAM | X670: W | Y670: L | Z670: D | AA670: FOR | AB670: AGST | AC670: % | AD670: PTS
A671: PORT MELBOURNE | D671: J GARBUTT | G671: TREGLOWAN | J671: McGOWAN | M671: ALLAN | P671: KEENAN | S671: JACKSON
A672: NORTH MELBOURNE | D672: WATSON | G672: D NOONAN | J672: P NOONAN | M672: STEWART | P672: LONDERGREN | S672: MORRISON | W672: RICHMOND | X672: 12 | Y672: 2 | Z672: 1 | AA672: 865 | AB672: 489 | AC672: 176.89161554192228 | AD672: 50
A673: GOALKICKERS | W673: FOOTSCRAY | X673: 12 | Y673: 2 | Z673: 1 | AA673: 732 | AB673: 447 | AC673: 163.75838926174498 | AD673: 50
A674: PORT MELBOURNE | D674: DANIELS 3 | G674: ALLEN 2 | J674: J GARBUTT | W674: NORTH MELBOURNE | X674: 11 | Y674: 4 | Z674: 0 | AA674: 747 | AB674: 462 | AC674: 161.6883116883117 | AD674: 44
A675: NORTH MELBOURNE | D675: GROVES | G675: MARSHALL | J675: D NOONAN | W675: PORT MELBOURNE | X675: 11 | Y675: 4 | Z675: 0 | AA675: 771 | AB675: 517 | AC675: 149.12959381044487 | AD675: 44
A677: RICHMOND | C677: 1 | D677: 2 | E677: =C677*6+D677 -> 8 | G677: 4 | H677: 2 | I677: =G677*6+H677 -> 26 | K677: 6 | L677: 7 | M677: =K677*6+L677 -> 43 | O677: 7 | P677: 7 | Q677: =O677*6+P677 -> 49 | S677: NORTH MELB | W677: WEST MELBOURNE | X677: 8 | Y677: 7 | Z677: 0 | AA677: 714 | AB677: 489 | AC677: 146.01226993865032 | AD677: 32
A678: WEST MELBOURNE | C678: 3 | D678: 1 | E678: =C678*6+D678 -> 19 | G678: 3 | H678: 4 | I678: =G678*6+H678 -> 22 | K678: 3 | L678: 4 | M678: =K678*6+L678 -> 22 | O678: 4 | P678: 6 | Q678: =O678*6+P678 -> 30 | S678: ALLEN | W678: WILLIAMSTOWN | X678: 8 | Y678: 7 | Z678: 0 | AA678: 648 | AB678: 568 | AC678: 114.08450704225352 | AD678: 32
A679: BEST PLAYERS | W679: BRUNSWICK | X679: 6 | Y679: 9 | Z679: 0 | AA679: 549 | AB679: 842 | AC679: 65.201900237529685 | AD679: 24
A680: RICHMOND | D680: T WILLIAMS | G680: C WILLIAMS | J680: BACKHOUSE | M680: RUDDOCK | P680: EDMONDS | S680: RICHARDSON | W680: PRAHRAN | X680: 3 | Y680: 12 | Z680: 0 | AA680: 648 | AB680: 821 | AC680: 78.92813641900122 | AD680: 12
A681: WEST MELBOURNE | D681: RYAN | G681: McVEE | J681: LAXTON | M681: KANE | W681: ESSENDON TOWN | X681: 3 | Y681: 12 | Z681: 0 | AA681: 524 | AB681: 806 | AC681: 65.012406947890824 | AD681: 12
A682: GOALKICKERS | W682: PRESTON | X682: 0 | Y682: 15 | Z682: 0 | AA682: 385 | AB682: 1138 | AC682: 33.83 | AD682: 0
A683: RICHMOND | D683: J FAYLE | G683: B EDMONDS
A684: WEST MELBOURNE
A686: WILLIAMSTOWN | C686: 0 | D686: 2 | E686: =C686*6+D686 -> 2 | G686: 4 | H686: 5 | I686: =G686*6+H686 -> 29 | K686: 4 | L686: 6 | M686: =K686*6+L686 -> 30 | O686: 7 | P686: 11 | Q686: =O686*6+P686 -> 53 | S686: WILLIAMSTOWN
A687: PRAHRAN | C687: 4 | D687: 3 | E687: =C687*6+D687 -> 27 | G687: 4 | H687: 3 | I687: =G687*6+H687 -> 27 | K687: 4 | L687: 4 | M687: =K687*6+L687 -> 28 | O687: 4 | P687: 5 | Q687: =O687*6+P687 -> 29 | S687: BAIN
A688: BEST PLAYERS
A689: WILLIAMSTOWN | D689: McKENZIE | G689: McNEILAGE | J689: W HALL | M689: MORTIMER | P689: BRITT | R689: HOUGHTON
A690: PRAHRAN | D690: ROBERTS | G690: PONTIN | J690: DRAPER | M690: G BROWN | P690: SYKES | R690: JACKSON
A691: GOALKICKERS
A692: WILLIAMSTOWN | D692: MORTIMER 3 | H692: BRITT 2 | K692: DICK | M692: EUSTACE
A693: PRAHRAN
A695: FOOTSCRAY | C695: 3 | D695: 5 | E695: =C695*6+D695 -> 23 | G695: 3 | H695: 8 | I695: =G695*6+H695 -> 26 | K695: 6 | L695: 9 | M695: =K695*6+L695 -> 45 | O695: 6 | P695: 11 | Q695: =O695*6+P695 -> 47 | S695: BRUNSWICK
A696: BRUNSWICK | C696: 0 | D696: 1 | E696: =C696*6+D696 -> 1 | G696: 3 | H696: 6 | I696: =G696*6+H696 -> 24 | K696: 4 | L696: 6 | M696: =K696*6+L696 -> 30 | O696: 5 | P696: 7 | Q696: =O696*6+P696 -> 37 | S696: GROGAN
A697: BEST PLAYERS
A698: FOOTSCRAY | D698: JACKSON | G698: KRUSE | J698: NIELSON | M698: HUGHES | P698: O'SHEA | S698: HINCH
A699: BRUNSWICK | D699: SCOTT | G699: STEVENSON | J699: ANDREWS | M699: WHITFIELD
A700: GOALKICKERS
A701: FOOTSCRAY | D701: HUGHES 2 | G701: GOWER | J701: NEILSON | L701: FLEWELLYN | O701: McCARTHY
A702: BRUNSWICK | D702: WALSH 2 | G702: MATHIESON | J702: SCOTT | L702: STANWAY
A704: ESS TOWN | C704: 3 | D704: 2 | E704: =C704*6+D704 -> 20 | G704: 4 | H704: 4 | I704: =G704*6+H704 -> 28 | K704: 7 | L704: 6 | M704: =K704*6+L704 -> 48 | O704: 9 | P704: 9 | Q704: =O704*6+P704 -> 63 | S704: PRESTON
A705: PRESTON | C705: 1 | D705: 0 | E705: =C705*6+D705 -> 6 | G705: 1 | H705: 1 | I705: =G705*6+H705 -> 7 | K705: 2 | L705: 2 | M705: =K705*6+L705 -> 14 | O705: 4 | P705: 4 | Q705: =O705*6+P705 -> 28 | S705: FREAME
A706: BEST PLAYERS
A707: ESS TOWN | D707: HALL | G707: STANWORTH | J707: STEEL | M707: GORDON | P707: GIRDWOOD | S707: PAIN
A708: PRESTON | D708: S HALL | G708: DOWLING | J708: PRIDEAUX | M708: NANKERVIS | P708: GIBSON
A709: GOALKICKERS
A710: ESS TOWN | D710: SULLIVAN 2
A711: PRESTON | D711: WAWN | G711: STANLAKE | J711: E HALL | M711: TOPPING
A713: ROUND 16 | E713: 20TH AUGUST | J713: WEATHER | N713: WEST WIND OVERCAST
D714: 1ST QTR | H714: 2ND QTR | L714: 3RD QTR | P714: FINAL | S714: PLAYED AT
A715: RICHMOND | C715: 3 | D715: 4 | E715: =C715*6+D715 -> 22 | G715: 3 | H715: 5 | I715: =G715*6+H715 -> 23 | K715: 3 | L715: 6 | M715: =K715*6+L715 -> 24 | O715: 3 | P715: 11 | Q715: =O715*6+P715 -> 29 | S715: FOOTSCRAY | X715: LADDER | AB715: ROUND | AD715: 16
A716: FOOTSCRAY | C716: 1 | D716: 1 | E716: =C716*6+D716 -> 7 | G716: 3 | H716: 2 | I716: =G716*6+H716 -> 20 | K716: 3 | L716: 4 | M716: =K716*6+L716 -> 22 | O716: 3 | P716: 5 | Q716: =O716*6+P716 -> 23 | S716: UMPIRE
A717: BEST PLAYERS | S717: FREAME | W717: TEAM | X717: W | Y717: L | Z717: D | AA717: FOR | AB717: AGST | AC717: % | AD717: PTS
A718: RICHMOND | D718: GEDDES | G718: BACKHOUSE | J718: HASSETT | M718: RUDDOCK | P718: McDONALD | T718: BRENNAN
A719: FOOTSCRAY | D719: HARRIS | G719: HINCH | J719: SWALIWELL | M719: MARMO | P719: E STEPHENSON | T719: KRUSE | W719: RICHMOND | X719: 13 | Y719: 2 | Z719: 1 | AA719: 894 | AB719: 512 | AC719: 174.609375 | AD719: 54
A720: GOALKICKERS | W720: FOOTSCRAY | X720: 12 | Y720: 3 | Z720: 1 | AA720: 755 | AB720: 476 | AC720: 158.61344537815125 | AD720: 50
A721: RICHMOND | D721: T WILLIAMS 2 | H721: JOHNSTONE | W721: PORT MELBOURNE | X721: 12 | Y721: 4 | Z721: 0 | AA721: 813 | AB721: 547 | AC721: 148.62888482632542 | AD721: 48
A722: FOOTSCRAY | D722: HUGHES 3 | W722: NORTH MELBOURNE | X722: 11 | Y722: 5 | Z722: 0 | AA722: 780 | AB722: 505 | AC722: 154.45544554455446 | AD722: 44
A724: WEST MELBOURNE | C724: 1 | D724: 2 | E724: =C724*6+D724 -> 8 | G724: 2 | H724: 6 | I724: =G724*6+H724 -> 18 | K724: 3 | L724: 6 | M724: =K724*6+L724 -> 24 | O724: 6 | P724: 7 | Q724: =O724*6+P724 -> 43 | S724: NORTH MELB | W724: WEST MELBOURNE | X724: 9 | Y724: 7 | Z724: 0 | AA724: 757 | AB724: 522 | AC724: 145.0191570881226 | AD724: 36
A725: NORTH MELBOURNE | C725: 2 | D725: 3 | E725: =C725*6+D725 -> 15 | G725: 2 | H725: 5 | I725: =G725*6+H725 -> 17 | K725: 4 | L725: 7 | M725: =K725*6+L725 -> 31 | O725: 4 | P725: 9 | Q725: =O725*6+P725 -> 33 | S725: BAIN | W725: WILLIAMSTOWN | X725: 9 | Y725: 7 | Z725: 0 | AA725: 707 | AB725: 593 | AC725: 119.22428330522766 | AD725: 36
A726: BEST PLAYERS | W726: BRUNSWICK | X726: 6 | Y726: 10 | Z726: 0 | AA726: 593 | AB726: 908 | AC726: 65.308370044052865 | AD726: 24
A727: WEST MELBOURNE | D727: RYAN | G727: CATARANICH | K727: McVEE | N727: POOLE | Q727: LAXTON | T727: ROLENT | W727: PRAHRAN | X727: 4 | Y727: 12 | Z727: 0 | AA727: 714 | AB727: 865 | AC727: 82.543352601156073 | AD727: 16
A728: NORTH MELBOURNE | D728: STEWART | G728: GRAHAM | K728: WATSON | N728: JAMIESON | Q728: McDERMOTT | T728: DALTON | W728: ESSENDON TOWN | X728: 3 | Y728: 13 | Z728: 0 | AA728: 554 | AB728: 848 | AC728: 65.330188679245282 | AD728: 12
A729: GOALKICKERS | W729: PRESTON | X729: 0 | Y729: 16 | Z729: 0 | AA729: 410 | AB729: 1197 | AC729: 34.25 | AD729: 0
A730: WEST MELBOURNE | D730: RYAN
A731: NORTH MELBOURNE | D731: LONDERIGAN 2 | H731: STEWART
A733: PRAHRAN | C733: 4 | D733: 7 | E733: =C733*6+D733 -> 31 | G733: 6 | H733: 8 | I733: =G733*6+H733 -> 44 | K733: 9 | L733: 10 | M733: =K733*6+L733 -> 64 | O733: 9 | P733: 12 | Q733: =O733*6+P733 -> 66 | S733: TOORAK PARK
A734: BRUNSWICK | C734: 0 | D734: 0 | E734: =C734*6+D734 -> 0 | G734: 2 | H734: 7 | I734: =G734*6+H734 -> 19 | K734: 2 | L734: 7 | M734: =K734*6+L734 -> 19 | O734: 6 | P734: 8 | Q734: =O734*6+P734 -> 44 | S734: J O'LOUGHLIN
A735: BEST PLAYERS
A736: PRAHRAN | D736: AYLING | G736: PONTIN | K736: SYKES | N736: ROBERTS | Q736: T BROWN | T736: STEWART
A737: BRUNSWICK | D737: JACKSON | G737: SCOTT | K737: CASEY | N737: WHITFIELD | Q737: STANWAY | T737: ROBERTSON
A738: GOALKICKERS
A739: PRAHRAN | D739: SYKES 5 | G739: MILLER | J739: ROBERTS | M739: KEVILLE | P739: BENTLEY
A740: BRUNSWICK | D740: SCOTT 2 | G740: JOHNSON | J740: STANWAY | M740: BURKE | P740: WHITFIELD
A742: WILLIAMSTOWN | C742: 2 | D742: 4 | E742: =C742*6+D742 -> 16 | G742: 5 | H742: 6 | I742: =G742*6+H742 -> 36 | K742: 8 | L742: 9 | M742: =K742*6+L742 -> 57 | O742: 8 | P742: 11 | Q742: =O742*6+P742 -> 59 | S742: WILLIAMSTOWN
A743: PRESTON | C743: 1 | D743: 2 | E743: =C743*6+D743 -> 8 | G743: 1 | H743: 4 | I743: =G743*6+H743 -> 10 | K743: 2 | L743: 6 | M743: =K743*6+L743 -> 18 | O743: 2 | P743: 13 | Q743: =O743*6+P743 -> 25 | S743: GROGAN
A744: BEST PLAYERS
A745: WILLIAMSTOWN | D745: BAKER | G745: CALDWELL | K745: McNEILAGE | N745: McKINLEY | Q745: HOUGHTON | T745: MANDERSON
A746: PRESTON | D746: S HALL | G746: NANKERVIS | K746: DOWLING | N746: WHITE | Q746: GIBSON | T746: WARNE
A747: GOALKICKERS
A748: WILLIAMSTOWN | D748: MORTIMER 6 | G748: MANDERSON | J748: DICK
A749: PRESTON
A751: PORT MELBOURNE | C751: 1 | D751: 3 | E751: =C751*6+D751 -> 9 | G751: 2 | H751: 6 | I751: =G751*6+H751 -> 18 | K751: 3 | L751: 10 | M751: =K751*6+L751 -> 28 | O751: 5 | P751: 12 | Q751: =O751*6+P751 -> 42 | S751: ESSENDON
A752: ESS TOWN | C752: 1 | D752: 3 | E752: =C752*6+D752 -> 9 | G752: 3 | H752: 3 | I752: =G752*6+H752 -> 21 | K752: 3 | L752: 5 | M752: =K752*6+L752 -> 23 | O752: 4 | P752: 6 | Q752: =O752*6+P752 -> 30 | S752: ALLEN
A753: BEST PLAYERS
A754: PORT MELBOURNE | D754: KEENAN | G754: McGOWAN | K754: TREGLOWAN | N754: J WARD | Q754: ALLAN | T754: BORTHWICK
A755: ESS TOWN | D755: STANWORTH | G755: SULLIVAN | K755: MARIN | N755: GIRDWOOD | Q755: PAIN | T755: NUMA
A756: GOALKICKERS
A757: PORT MELBOURNE | D757: ALLEN 2 | G757: PETTIT 2 | J757: BROWN
A758: ESS TOWN | D758: NUMA | G758: BARLOW | J758: SULLIVAN | M758: CHEFFERS
A760: ROUND 17 | E760: 27TH AUGUST | J760: WEATHER | N760: STRONG NORTH WIND
D761: 1ST QTR | H761: 2ND QTR | L761: 3RD QTR | P761: FINAL | S761: PLAYED AT
A762: FOOTSCRAY | C762: 3 | D762: 8 | E762: =C762*6+D762 -> 26 | G762: 3 | H762: 8 | I762: =G762*6+H762 -> 26 | K762: 9 | L762: 12 | M762: =K762*6+L762 -> 66 | O762: 9 | P762: 12 | Q762: =O762*6+P762 -> 66 | S762: FOOTSCRAY | X762: LADDER | AB762: ROUND | AD762: 17
A763: WEST MELBOURNE | C763: 0 | D763: 0 | E763: =C763*6+D763 -> 0 | G763: 1 | H763: 4 | I763: =G763*6+H763 -> 10 | K763: 1 | L763: 4 | M763: =K763*6+L763 -> 10 | O763: 5 | P763: 9 | Q763: =O763*6+P763 -> 39 | S763: UMPIRE
A764: BEST PLAYERS | S764: BAIN | W764: TEAM | X764: W | Y764: L | Z764: D | AA764: FOR | AB764: AGST | AC764: % | AD764: PTS
A765: FOOTSCRAY | D765: HUGHES | G765: McCARTHY | J765: GOWER | M765: HARRIS | P765: WAGLAND | S765: SERBY
A766: WEST MELBOURNE | D766: H GREGORY | G766: FRANCIS | J766: MADDEN | M766: LAXTON | P766: ARMSTRONG | S766: ROOKE | W766: RICHMOND | X766: 14 | Y766: 2 | Z766: 1 | AA766: 981 | AB766: 551 | AC766: 178.0399274047187 | AD766: 58
A767: GOALKICKERS | W767: FOOTSCRAY | X767: 13 | Y767: 3 | Z767: 1 | AA767: 821 | AB767: 515 | AC767: 159.41747572815535 | AD767: 54
A768: FOOTSCRAY | D768: MITCHELL 3 | H768: HUGHES 2 | K768: FLEWELLYN 2 | O768: HARRIS | R768: DE COIT | W768: PORT MELBOURNE | X768: 13 | Y768: 4 | Z768: 0 | AA768: 859 | AB768: 566 | AC768: 151.76678445229683 | AD768: 52
A769: WEST MELBOURNE | W769: NORTH MELBOURNE | X769: 12 | Y769: 5 | Z769: 0 | AA769: 853 | AB769: 537 | AC769: 158.84543761638733 | AD769: 48
A771: RICHMOND | C771: 6 | D771: 5 | E771: =C771*6+D771 -> 41 | G771: 8 | H771: 6 | I771: =G771*6+H771 -> 54 | K771: 11 | L771: 13 | M771: =K771*6+L771 -> 79 | O771: 12 | P771: 15 | Q771: =O771*6+P771 -> 87 | S771: RICHMOND | W771: WILLIAMSTOWN | X771: 10 | Y771: 7 | Z771: 0 | AA771: 735 | AB771: 616 | AC771: 119.31818181818181 | AD771: 40
A772: BRUNSWICK | C772: 0 | D772: 0 | E772: =C772*6+D772 -> 0 | G772: 1 | H772: 4 | I772: =G772*6+H772 -> 10 | K772: 1 | L772: 6 | M772: =K772*6+L772 -> 12 | O772: 5 | P772: 9 | Q772: =O772*6+P772 -> 39 | S772: ALLEN | W772: WEST MELBOURNE | X772: 9 | Y772: 8 | Z772: 0 | AA772: 796 | AB772: 588 | AC772: 135.37414965986395 | AD772: 36
A773: BEST PLAYERS | W773: BRUNSWICK | X773: 6 | Y773: 11 | Z773: 0 | AA773: 632 | AB773: 995 | AC773: 63.517587939698494 | AD773: 24
A774: RICHMOND | D774: HORE | G774: BOWNAS | J774: HUTCHINSON | M774: C WILLIAMS | P774: T WILLIAMS | S774: GEDDES | W774: PRAHRAN | X774: 4 | Y774: 13 | Z774: 0 | AA774: 746 | AB774: 938 | AC774: 79.530916844349676 | AD774: 16
A775: BRUNSWICK | D775: JACKSON | G775: SCOTT | J775: HARRIS | M775: WHITFIELD | P775: MULVANEY | S775: ANDREWS | W775: ESSENDON TOWN | X775: 3 | Y775: 14 | Z775: 0 | AA775: 577 | AB775: 876 | AC775: 65.867579908675793 | AD775: 12
A776: GOALKICKERS | W776: PRESTON | X776: 0 | Y776: 17 | Z776: 0 | AA776: 429 | AB776: 1243 | AC776: 34.51 | AD776: 0
A777: RICHMOND | D777: HUTCHINSON 5 | H777: HORE 2 | K777: JOHNSTONE | N777: McDONALD | P777: T WILLIAMS | S777: WESTON
A778: BRUNSWICK | D778: R WALSH | G778: STANWAY | J778: MULVANEY | M778: SCOTT | O778: WHITFIELD
A780: WILLIAMSTOWN | C780: 0 | D780: 4 | E780: =C780*6+D780 -> 4 | G780: 0 | H780: 6 | I780: =G780*6+H780 -> 6 | K780: 2 | L780: 10 | M780: =K780*6+L780 -> 22 | O780: 2 | P780: 16 | Q780: =O780*6+P780 -> 28 | S780: ESSENDON
A781: ESS TOWN | C781: 2 | D781: 0 | E781: =C781*6+D781 -> 12 | G781: 2 | H781: 5 | I781: =G781*6+H781 -> 17 | K781: 3 | L781: 5 | M781: =K781*6+L781 -> 23 | O781: 3 | P781: 5 | Q781: =O781*6+P781 -> 23 | S781: WOOLFE
A782: BEST PLAYERS
A783: WILLIAMSTOWN | D783: DAVIS | G783: HOUGHTON | J783: McKINLEY | M783: DICK | P783: BAKER | S783: HALL
A784: ESS TOWN | D784: STEEL | G784: SHELDON | J784: STANWORTH | M784: McGREGOR | P784: NUMA | S784: HALL
A785: GOALKICKERS
A786: WILLIAMSTOWN | D786: MARR | G786: MORTIMER
A787: ESS TOWN
A789: NORTH MELBOURNE | C789: 2 | D789: 1 | E789: =C789*6+D789 -> 13 | G789: 8 | H789: 7 | I789: =G789*6+H789 -> 55 | K789: 8 | L789: 7 | M789: =K789*6+L789 -> 55 | O789: 10 | P789: 13 | Q789: =O789*6+P789 -> 73 | S789: NORTH MELB
A790: PRAHRAN | C790: 1 | D790: 4 | E790: =C790*6+D790 -> 10 | G790: 1 | H790: 7 | I790: =G790*6+H790 -> 13 | K790: 2 | L790: 9 | M790: =K790*6+L790 -> 21 | O790: 3 | P790: 14 | Q790: =O790*6+P790 -> 32 | S790: FREAME
A791: BEST PLAYERS
A792: NORTH MELBOURNE | D792: P NOONAN | G792: LONDERGREN | J792: D NOONAN | M792: STEWART | P792: GRAHAM | S792: WATSON
A793: PRAHRAN | D793: PONTIN | G793: SYKES | J793: TORPEY | M793: JACKSON | P793: DRAPER | S793: STEWART
A794: GOALKICKERS
A795: NORTH MELBOURNE | D795: McDERMOTT | G795: JAMIESON
A796: PRAHRAN | D796: SYKES 2 | G796: MILLER
A798: PORT MELBOURNE | C798: 0 | D798: 1 | E798: =C798*6+D798 -> 1 | G798: 2 | H798: 6 | I798: =G798*6+H798 -> 18 | K798: 3 | L798: 6 | M798: =K798*6+L798 -> 24 | O798: 6 | P798: 10 | Q798: =O798*6+P798 -> 46 | S798: PRESTON
A799: PRESTON | C799: 1 | D799: 7 | E799: =C799*6+D799 -> 13 | G799: 1 | H799: 7 | I799: =G799*6+H799 -> 13 | K799: 1 | L799: 12 | M799: =K799*6+L799 -> 18 | O799: 1 | P799: 13 | Q799: =O799*6+P799 -> 19 | S799: J O'LOUGHLIN
A800: BEST PLAYERS
A801: PORT MELBOURNE | D801: KEENAN | G801: YATES | J801: PETTIT | M801: BROWN | P801: TRGLOWAN | S801: J WARD
A802: PRESTON | D802: S HALL | G802: STANLAKE | J802: NANKERVIS | M802: PRIDEAUX | P802: HOWES | S802: WHITE
A803: GOALKICKERS
A804: PORT MELBOURNE | D804: DANIELS 2 | G804: BORTHWICK | J804: McGOWAN | M804: WILLIAMS | P804: ALLEN
A805: PRESTON | D805: S HALL
A807: ROUND 18 | E807: 3RD SEPTEMBER | J807: WEATHER | N807: SOUTH WEST WIND
D808: 1ST QTR | H808: 2ND QTR | L808: 3RD QTR | P808: FINAL | S808: PLAYED AT
A809: RICHMOND | C809: 0 | D809: 0 | E809: =C809*6+D809 -> 0 | G809: 2 | H809: 3 | I809: =G809*6+H809 -> 15 | K809: 2 | L809: 3 | M809: =K809*6+L809 -> 15 | O809: 3 | P809: 9 | Q809: =O809*6+P809 -> 27 | S809: PORT MELB | X809: LADDER | AB809: ROUND | AD809: 18
A810: PORT MELBOURNE | C810: 2 | D810: 5 | E810: =C810*6+D810 -> 17 | G810: 2 | H810: 5 | I810: =G810*6+H810 -> 17 | K810: 2 | L810: 10 | M810: =K810*6+L810 -> 22 | O810: 2 | P810: 10 | Q810: =O810*6+P810 -> 22 | S810: UMPIRE
A811: BEST PLAYERS | S811: ALLEN | W811: TEAM | X811: W | Y811: L | Z811: D | AA811: FOR | AB811: AGST | AC811: % | AD811: PTS
A812: RICHMOND | D812: BACKHOUSE | G812: C WILLIAMS | J812: T WILLIAMS | M812: BRENNAN | P812: JOHNSTON | S812: RUDDOCK
A813: PORT MELBOURNE | D813: J WARD | G813: YATES | J813: J GARBUTT | M813: McGOWAN | P813: KEENAN | S813: DANIELS | W813: RICHMOND | X813: 15 | Y813: 2 | Z813: 1 | AA813: 1008 | AB813: 573 | AC813: 175.91623036649216 | AD813: 62
A814: GOALKICKERS | W814: FOOTSCRAY | X814: 14 | Y814: 3 | Z814: 1 | AA814: 864 | AB814: 547 | AC814: 157.9524680073126 | AD814: 58
A815: RICHMOND | D815: MAKIN | G815: T WILLIAMS | J815: BACKHOUSE | W815: NORTH MELBOURNE | X815: 13 | Y815: 5 | Z815: 0 | AA815: 927 | AB815: 545 | AC815: 170.09174311926606 | AD815: 52
A816: PORT MELBOURNE | D816: KEENAN | G816: WILLIAMS | W816: PORT MELBOURNE | X816: 13 | Y816: 5 | Z816: 0 | AA816: 881 | AB816: 593 | AC816: 148.56661045531197 | AD816: 52
A818: WEST MELBOURNE | C818: 2 | D818: 0 | E818: =C818*6+D818 -> 12 | G818: 5 | H818: 4 | I818: =G818*6+H818 -> 34 | K818: 5 | L818: 6 | M818: =K818*6+L818 -> 36 | O818: 5 | P818: 9 | Q818: =O818*6+P818 -> 39 | S818: NORTH MELB | W818: WEST MELBOURNE | X818: 10 | Y818: 8 | Z818: 0 | AA818: 835 | AB818: 616 | AC818: 135.55194805194805 | AD818: 40
A819: WILLIAMSTOWN | C819: 1 | D819: 4 | E819: =C819*6+D819 -> 10 | G819: 2 | H819: 5 | I819: =G819*6+H819 -> 17 | K819: 3 | L819: 8 | M819: =K819*6+L819 -> 26 | O819: 3 | P819: 10 | Q819: =O819*6+P819 -> 28 | S819: BAIN | W819: WILLIAMSTOWN | X819: 10 | Y819: 8 | Z819: 0 | AA819: 763 | AB819: 655 | AC819: 116.4885496183206 | AD819: 40
A820: BEST PLAYERS | W820: BRUNSWICK | X820: 7 | Y820: 11 | Z820: 0 | AA820: 681 | AB820: 1031 | AC820: 66.052376333656639 | AD820: 28
A821: WEST MELBOURNE | W821: PRAHRAN | X821: 4 | Y821: 14 | Z821: 0 | AA821: 778 | AB821: 981 | AC821: 79.306829765545359 | AD821: 16
A822: WILLIAMSTOWN | W822: ESSENDON TOWN | X822: 3 | Y822: 15 | Z822: 0 | AA822: 613 | AB822: 925 | AC822: 66.270270270270274 | AD822: 12
A823: GOALKICKERS | W823: PRESTON | X823: 0 | Y823: 18 | Z823: 0 | AA823: 437 | AB823: 1317 | AC823: 33.18 | AD823: 0
A824: WEST MELBOURNE
A825: WILLIAMSTOWN
A827: BRUNSWICK | C827: 2 | D827: 4 | E827: =C827*6+D827 -> 16 | G827: 3 | H827: 6 | I827: =G827*6+H827 -> 24 | K827: 5 | L827: 11 | M827: =K827*6+L827 -> 41 | O827: 6 | P827: 13 | Q827: =O827*6+P827 -> 49 | S827: BRUNSWICK
A828: ESS TOWN | C828: 2 | D828: 0 | E828: =C828*6+D828 -> 12 | G828: 4 | H828: 2 | I828: =G828*6+H828 -> 26 | K828: 4 | L828: 3 | M828: =K828*6+L828 -> 27 | O828: 5 | P828: 6 | Q828: =O828*6+P828 -> 36 | S828: FREAME
A829: BEST PLAYERS
A830: BRUNSWICK
A831: ESS TOWN
A832: GOALKICKERS
A833: BRUNSWICK | D833: CHASE 2 | G833: SCOTT 2 | J833: WHITFIELD | M833: STANWAY
A834: ESS TOWN | D834: NUMA 2 | G834: SULLIVAN
A836: FOOTSCRAY | C836: 0 | D836: 2 | E836: =C836*6+D836 -> 2 | G836: 5 | H836: 5 | I836: =G836*6+H836 -> 35 | K836: 6 | L836: 7 | M836: =K836*6+L836 -> 43 | O836: 6 | P836: 7 | Q836: =O836*6+P836 -> 43 | S836: FOOTSCRAY
A837: PRAHRAN | C837: 1 | D837: 1 | E837: =C837*6+D837 -> 7 | G837: 1 | H837: 1 | I837: =G837*6+H837 -> 7 | K837: 5 | L837: 2 | M837: =K837*6+L837 -> 32 | O837: 5 | P837: 2 | Q837: =O837*6+P837 -> 32 | S837: GROGAN
A838: BEST PLAYERS
A839: FOOTSCRAY | D839: HARRIS | G839: GRAHAM | J839: E STEPHENSON | N839: JACKSON | Q839: NIELSON | T839: HOOD
A840: PRAHRAN | D840: TORPEY | G840: PONTIN | J840: G BROWN | N840: JACKSON
A841: GOALKICKERS
A842: FOOTSCRAY | D842: MITCHELL 3 | G842: HUGHES 2 | J842: FLEWELLYN 2 | N842: NEILSON | Q842: GOWER
A843: PRAHRAN
A845: NORTH MELBOURNE | C845: 1 | D845: 2 | E845: =C845*6+D845 -> 8 | G845: 5 | H845: 4 | I845: =G845*6+H845 -> 34 | K845: 8 | L845: 5 | M845: =K845*6+L845 -> 53 | O845: 10 | P845: 14 | Q845: =O845*6+P845 -> 74 | S845: PRESTON
A846: PRESTON | C846: 0 | D846: 1 | E846: =C846*6+D846 -> 1 | G846: 0 | H846: 2 | I846: =G846*6+H846 -> 2 | K846: 1 | L846: 2 | M846: =K846*6+L846 -> 8 | O846: 1 | P846: 2 | Q846: =O846*6+P846 -> 8 | S846: J O'LOUGHLIN
A847: BEST PLAYERS
A848: NORTH MELBOURNE | D848: KENNY | G848: GROVES | J848: D NOONAN | N848: WATSON | Q848: STEWART | T848: JAMIESON
A849: PRESTON | D849: GIBSON | G849: S HALL | J849: NANKERVIS | N849: TOPPING | Q849: ADAMS | T849: McCLUMPA
A850: GOALKICKERS
A851: NORTH MELBOURNE | D851: KENNEDY 2 | G851: KENNY 2 | J851: McCANN 2 | M851: GRAHAM | O851: GROVES | Q851: HOLLAND | S851: STEWART
A852: PRESTON
A854: FINALS
A855: 1ST SEMI | E855: 10TH SEPTEMBER | K855: WEATHER | O855: WEST WIND FINE
D856: 1ST QTR | H856: 2ND QTR | L856: 3RD QTR | P856: FINAL
A857: NORTH MELBOURNE | C857: 1 | D857: 5 | E857: =C857*6+D857 -> 11 | G857: 1 | H857: 7 | I857: =G857*6+H857 -> 13 | K857: 4 | L857: 8 | M857: =K857*6+L857 -> 32 | O857: 5 | P857: 11 | Q857: =O857*6+P857 -> 41 | S857: PLAYED AT | V857: EMCG
A858: RICHMOND | C858: 2 | D858: 2 | E858: =C858*6+D858 -> 14 | G858: 2 | H858: 11 | I858: =G858*6+H858 -> 23 | K858: 3 | L858: 13 | M858: =K858*6+L858 -> 31 | O858: 4 | P858: 15 | Q858: =O858*6+P858 -> 39 | S858: UMPIRE | V858: ALLEN
A859: BEST PLAYERS
A860: NORTH MELBOURNE | E860: STEWART | H860: KENNY | K860: D NOONAN | N860: DALTON | Q860: SMITH | T860: McDERMOTT
A861: RICHMOND | E861: JOHNSTON | H861: RUDDOCK | K861: BOWNAS | N861: CLEGHORN | Q861: HASSETT | T861: BACKHOUSE
A862: GOALKICKERS
A863: NORTH MELBOURNE | E863: STEWART 2 | H863: KENNY | K863: KENNEDY | N863: McCANN
A864: RICHMOND | E864: HUTCHINSON | H864: JOHNSTON | K864: C WILLIAMS | N864: CLEGHORN
A866: 2ND SEMI | E866: 17TH SEPTEMBER | K866: WEATHER | O866: STRONG NORTH WIND
A868: FOOTSCRAY | C868: 2 | D868: 2 | E868: =C868*6+D868 -> 14 | G868: 4 | H868: 4 | I868: =G868*6+H868 -> 28 | K868: 4 | L868: 5 | M868: =K868*6+L868 -> 29 | O868: 5 | P868: 12 | Q868: =O868*6+P868 -> 42 | S868: PLAYED AT | V868: EMCG
A869: PORT MELBOURNE | C869: 4 | D869: 2 | E869: =C869*6+D869 -> 26 | G869: 4 | H869: 3 | I869: =G869*6+H869 -> 27 | K869: 4 | L869: 6 | M869: =K869*6+L869 -> 30 | O869: 5 | P869: 7 | Q869: =O869*6+P869 -> 37 | S869: UMPIRE | V869: ALLEN
A870: BEST PLAYERS
A871: FOOTSCRAY | E871: HARRIS | H871: JINKS | K871: JACKSON | N871: SERBY | Q871: McCARROLL | T871: MARMO
A872: PORT MELBOURNE | E872: KEENAN | H872: PETTIT | K872: TREGLOWAN | N872: BROWN | Q872: YATES | T872: DOYLE
A873: GOALKICKERS
A874: FOOTSCRAY | E874: HOLLIS | H874: JONES
A875: PORT MELBOURNE | E875: PETTIT 2 | H875: CROFT | K875: DANIELS
A877: FINAL | E877: 24TH SEPTEMBER | K877: WEATHER | O877: NORTH WEST WIND
A879: NORTH MELBOURNE | C879: 2 | D879: 3 | E879: =C879*6+D879 -> 15 | G879: 2 | H879: 3 | I879: =G879*6+H879 -> 15 | K879: 5 | L879: 10 | M879: =K879*6+L879 -> 40 | O879: 6 | P879: 13 | Q879: =O879*6+P879 -> 49 | S879: PLAYED AT | V879: EMCG
A880: FOOTSCRAY | C880: 1 | D880: 0 | E880: =C880*6+D880 -> 6 | G880: 3 | H880: 2 | I880: =G880*6+H880 -> 20 | K880: 4 | L880: 2 | M880: =K880*6+L880 -> 26 | O880: 5 | P880: 2 | Q880: =O880*6+P880 -> 32 | S880: UMPIRE | V880: ALLEN
A881: BEST PLAYERS
A882: NORTH MELBOURNE | E882: LONDERGREN | H882: STEWART | K882: GROVES | N882: WATSON | Q882: KENNY | T882: McDERMOTT
A883: FOOTSCRAY | E883: HARRIS | H883: SWALIWELL | K883: MARMO | N883: NIELSON | Q883: DECOIT | T883: HUGHES
A884: GOALKICKERS
A885: NORTH MELBOURNE | E885: D NOONAN 2 | H885: KENNY 2 | K885: HOLLAND | N885: SMITH
A886: FOOTSCRAY | E886: HUGHES 2 | H886: HOLLIS | K886: MARMO | N886: DECOIT
A888: GRAND FINAL
D890: RICHMOND FORFEITED TO NORTH MELBOURNE
D892: DID NOT AGREE TO UMPIRE APPOINTMENT