A1: Victorian Football Association
A2: Season 1905
A3: © Copyright Wal Williams | F3: First created: 2 August 2014
A4: Contact: joywalwi at gmail dot com | F4: Last updated: 2 August 2014 | W4: VFA Results and tables - Link to the main index page
A5: You are free to copy this document in whole or part provided that proper acknowledgement is given to the author. All rights reserved.
A7: YEAR 1905
A8: ROUND 1 | E8: 6TH MAY | J8: WEATHER | M8: FINE NORTH WIND | S8: PLAYED AT
C9: 1ST QTR | G9: 2ND QTR | K9: 3RD QTR | O9: FINAL | S9: PORT MELB
A10: PORT MELBOURNE | C10: 0 | D10: 1 | E10: =C10*6+D10 -> 1 | G10: 2 | H10: 1 | I10: =G10*6+H10 -> 13 | K10: 3 | L10: 4 | M10: =K10*6+L10 -> 22 | O10: 7 | P10: 13 | Q10: =O10*6+P10 -> 55 | S10: UMPIRE | X10: LADDER | AB10: ROUND | AD10: 1
A11: NORTH MELBOURNE | C11: 2 | D11: 3 | E11: =C11*6+D11 -> 15 | G11: 5 | H11: 7 | I11: =G11*6+H11 -> 37 | K11: 5 | L11: 9 | M11: =K11*6+L11 -> 39 | O11: 5 | P11: 9 | Q11: =O11*6+P11 -> 39 | S11: BAIN
A12: BEST PLAYERS | W12: TEAM | X12: W | Y12: L | Z12: D | AA12: FOR | AB12: AGST | AC12: % | AD12: PTS
A13: PORT MELBOURNE | D13: GARBUTT | G13: HILL | J13: KNOX | M13: JAMES | P13: CROFT | S13: McDONALD
A14: NORTH MELBOURNE | W14: ESSENDON | X14: 1 | Y14: 0 | Z14: 0 | AA14: 51 | AB14: 16 | AC14: 318.75 | AD14: 4
A15: GOALKICKERS | W15: WILLIAMSTOWN | X15: 1 | Y15: 0 | Z15: 0 | AA15: 70 | AB15: 35 | AC15: 200 | AD15: 4
A16: PORT MELBOURNE | D16: CROFT 2 | G16: McDONALD | J16: GARBUTT | W16: FOOTSCRAY | X16: 1 | Y16: 0 | Z16: 0 | AA16: 70 | AB16: 45 | AC16: 155.55555555555554 | AD16: 4
A17: NORTH MELBOURNE | D17: McCANN 3 | G17: BROYLAN | J17: MARTIN | W17: PORT MELBOURNE | X17: 1 | Y17: 0 | Z17: 0 | AA17: 55 | AB17: 39 | AC17: 141.02564102564102 | AD17: 4
A19: ESSENDON | C19: 3 | D19: 4 | E19: =C19*6+D19 -> 22 | G19: 3 | H19: 5 | I19: =G19*6+H19 -> 23 | K19: 6 | L19: 7 | M19: =K19*6+L19 -> 43 | O19: 7 | P19: 9 | Q19: =O19*6+P19 -> 51 | S19: ESSENDON | W19: WEST MELBOURNE | X19: 1 | Y19: 0 | Z19: 0 | AA19: 56 | AB19: 40 | AC19: 140 | AD19: 4
A20: PRESTON | C20: 1 | D20: 3 | E20: =C20*6+D20 -> 9 | G20: 1 | H20: 7 | I20: =G20*6+H20 -> 13 | K20: 1 | L20: 9 | M20: =K20*6+L20 -> 15 | O20: 1 | P20: 10 | Q20: =O20*6+P20 -> 16 | S20: ASPINALL | W20: RICHMOND | X20: 0 | Y20: 1 | Z20: 0 | AA20: 40 | AB20: 56 | AC20: 71.428571428571431 | AD20: 0
A21: BEST PLAYERS | W21: NORTH MELBOURNE | X21: 0 | Y21: 1 | Z21: 0 | AA21: 39 | AB21: 55 | AC21: 70.909090909090907 | AD21: 0
A22: ESSENDON | D22: DUFF | G22: PAIN | J22: STEEL | M22: GAVIN | P22: G MARTIN | S22: DICK | W22: BRUNSWICK | X22: 0 | Y22: 1 | Z22: 0 | AA22: 45 | AB22: 70 | AC22: 64.285714285714292 | AD22: 0
A23: PRESTON | D23: S HALL | G23: P HALL | J23: WHITE | M23: ROBBINS | P23: BROWN | S23: GIBSON | W23: PRAHRAN | X23: 0 | Y23: 1 | Z23: 0 | AA23: 35 | AB23: 70 | AC23: 50 | AD23: 0
A24: GOALKICKERS | W24: PRESTON | X24: 0 | Y24: 1 | Z24: 0 | AA24: 16 | AB24: 51 | AC24: 31.372549019607842 | AD24: 0
A25: ESSENDON | D25: STEELE | G25: CHEFFERS
A26: PRESTON
A28: WEST MELBOURNE | C28: 1 | D28: 1 | E28: =C28*6+D28 -> 7 | G28: 4 | H28: 3 | I28: =G28*6+H28 -> 27 | K28: 5 | L28: 7 | M28: =K28*6+L28 -> 37 | O28: 8 | P28: 8 | Q28: =O28*6+P28 -> 56 | S28: NORTH MELB
A29: RICHMOND | C29: 1 | D29: 1 | E29: =C29*6+D29 -> 7 | G29: 2 | H29: 1 | I29: =G29*6+H29 -> 13 | K29: 3 | L29: 1 | M29: =K29*6+L29 -> 19 | O29: 6 | P29: 4 | Q29: =O29*6+P29 -> 40 | S29: O'LOUGHLIN
A30: BEST PLAYERS
A31: WEST MELBOURNE | D31: ROURKE | G31: POOLE | J31: LAXTON | M31: McCANN | P31: WILLIAMSON | S31: RYAN
A32: RICHMOND | D32: RUDDOCK | G32: EDMONDS | J32: RIGBY | M32: SMITH | P32: RICKETTS | S32: HUTCHINSON
A33: GOALKICKERS
A34: WEST MELBOURNE | D34: McCANN 5 | G34: RYAN | I34: WILLIAMSON | M34: RANKIN
A35: RICHMOND | D35: HUTCHINSON 5
A37: WILLIAMSTOWN | C37: 1 | D37: 3 | E37: =C37*6+D37 -> 9 | G37: 4 | H37: 8 | I37: =G37*6+H37 -> 32 | K37: 5 | L37: 12 | M37: =K37*6+L37 -> 42 | O37: 9 | P37: 16 | Q37: =O37*6+P37 -> 70 | S37: WILLIAMSTOWN
A38: PRAHRAN | C38: 4 | D38: 2 | E38: =C38*6+D38 -> 26 | G38: 4 | H38: 2 | I38: =G38*6+H38 -> 26 | K38: 5 | L38: 3 | M38: =K38*6+L38 -> 33 | O38: 5 | P38: 5 | Q38: =O38*6+P38 -> 35 | S38: ALLEN
A39: BEST PLAYERS
A40: WILLIAMSTOWN | D40: ALLEY | G40: BAKER | J40: McKINLEY | M40: DAVIS | P40: DICK | S40: L MORTIMER
A41: PRAHRAN | D41: TORPEY | G41: HAIGBLOOM | J41: ROBERTS | M41: PONTIN | P41: G BROWN | S41: MILLER
A42: GOALKICKERS
A43: WILLIAMSTOWN | D43: BRITT 3 | G43: L MORTIMER 2 | K43: MATTHEWS | N43: DICK | P43: ROBERTSON
A44: PRAHRAN | D44: TORPEY 3 | G44: DOLETTE | J44: DUPE
A46: FOOTSCRAY | C46: 2 | D46: 1 | E46: =C46*6+D46 -> 13 | G46: 6 | H46: 7 | I46: =G46*6+H46 -> 43 | K46: 7 | L46: 9 | M46: =K46*6+L46 -> 51 | O46: 10 | P46: 10 | Q46: =O46*6+P46 -> 70 | S46: FOOTSCRAY
A47: BRUNSWICK | C47: 0 | D47: 7 | E47: =C47*6+D47 -> 7 | G47: 1 | H47: 8 | I47: =G47*6+H47 -> 14 | K47: 2 | L47: 13 | M47: =K47*6+L47 -> 25 | O47: 5 | P47: 15 | Q47: =O47*6+P47 -> 45 | S47: LAIDLAW
A48: BEST PLAYERS
A49: FOOTSCRAY | D49: MARMO | G49: FRIEND | J49: HEDLEY | M49: E STEPHENSON | P49: NEILSON | S49: FLEWELLYN
A50: BRUNSWICK | D50: BELCHER | G50: PRATT | J50: NEILSON | M50: COLLISON | P50: BRAID | S50: LOGAN
A51: GOALKICKERS
A52: FOOTSCRAY | D52: FLEWELLYN 2 | H52: HUGHES 2 | K52: SERGEANT 2 | N52: SERBY | P52: FRIEND | R52: CURRIE | T52: COLLINS
A53: BRUNSWICK
A55: ROUND 2 | E55: 13TH MAY | J55: WEATHER | N55: CLOUDY BUT FINE SOUTH WEST BREEZE
C56: 1ST QTR | G56: 2ND QTR | K56: 3RD QTR | O56: FINAL | S56: PLAYED AT
A57: FOOTSCRAY | C57: 1 | D57: 0 | E57: =C57*6+D57 -> 6 | G57: 3 | H57: 3 | I57: =G57*6+H57 -> 21 | K57: 4 | L57: 6 | M57: =K57*6+L57 -> 30 | O57: 6 | P57: 9 | Q57: =O57*6+P57 -> 45 | S57: FOOTSCRAY | X57: LADDER | AB57: ROUND | AD57: 2
A58: ESSENDON | C58: 0 | D58: 2 | E58: =C58*6+D58 -> 2 | G58: 1 | H58: 4 | I58: =G58*6+H58 -> 10 | K58: 3 | L58: 7 | M58: =K58*6+L58 -> 25 | O58: 3 | P58: 9 | Q58: =O58*6+P58 -> 27 | S58: UMPIRE
A59: BEST PLAYERS | W59: TEAM | X59: W | Y59: L | Z59: D | AA59: FOR | AB59: AGST | AC59: % | AD59: PTS
A60: FOOTSCRAY | D60: HINCH | G60: MARMO | J60: KRUSE | L60: PATTERSON | O60: E STEPHENSON | S60: HOLLIS
A61: ESSENDON | D61: O'SHEA | G61: GAVIN | J61: McINTYRE | L61: PAIN | O61: CHURCHMAN | S61: HAMBRIDGE | W61: WEST MELBOURNE | X61: 2 | Y61: 0 | Z61: 0 | AA61: 154 | AB61: 65 | AC61: 236.92307692307693 | AD61: 8
A62: GOALKICKERS | W62: WILLIAMSTOWN | X62: 2 | Y62: 0 | Z62: 0 | AA62: 136 | AB62: 66 | AC62: 206.06 | AD62: 8
A63: FOOTSCRAY | D63: COLLINS 3 | H63: HUGHES 2 | K63: E STEPHENSON | W63: PORT MELBOURNE | X63: 2 | Y63: 0 | Z63: 0 | AA63: 119 | AB63: 68 | AC63: 175 | AD63: 8
A64: ESSENDON | D64: CHURCHMAN | H64: MARTIN | K64: DUFF | W64: FOOTSCRAY | X64: 2 | Y64: 0 | Z64: 0 | AA64: 115 | AB64: 72 | AC64: 159.72222222222223 | AD64: 8
A66: RICHMOND | C66: 1 | D66: 3 | E66: =C66*6+D66 -> 9 | G66: 1 | H66: 4 | I66: =G66*6+H66 -> 10 | K66: 2 | L66: 7 | M66: =K66*6+L66 -> 19 | O66: 6 | P66: 8 | Q66: =O66*6+P66 -> 44 | S66: RICHMOND | W66: ESSENDON | X66: 1 | Y66: 1 | Z66: 0 | AA66: 78 | AB66: 61 | AC66: 127.8688524590164 | AD66: 4
A67: NORTH MELBOURNE | C67: 1 | D67: 1 | E67: =C67*6+D67 -> 7 | G67: 2 | H67: 3 | I67: =G67*6+H67 -> 15 | K67: 3 | L67: 6 | M67: =K67*6+L67 -> 24 | O67: 3 | P67: 6 | Q67: =O67*6+P67 -> 24 | S67: GROGAN | W67: RICHMOND | X67: 1 | Y67: 1 | Z67: 0 | AA67: 84 | AB67: 80 | AC67: 105 | AD67: 4
A68: BEST PLAYERS | W68: NORTH MELBOURNE | X68: 0 | Y68: 2 | Z68: 0 | AA68: 63 | AB68: 99 | AC68: 63.636363636363633 | AD68: 0
A69: RICHMOND | D69: SMITH | G69: EDMONDS | J69: BACKHOUSE | M69: RUDDOCK | P69: RICKETTS | S69: CLEGHORN | W69: BRUNSWICK | X69: 0 | Y69: 2 | Z69: 0 | AA69: 76 | AB69: 136 | AC69: 55.882352941176471 | AD69: 0
A70: NORTH MELBOURNE | D70: SMITH | G70: C LONDERIGAN | J70: M LONDERIGAN | M70: WATSON | P70: MARTIN | S70: GROVES | W70: PRAHRAN | X70: 0 | Y70: 2 | Z70: 0 | AA70: 64 | AB70: 134 | AC70: 46.04 | AD70: 0
A71: GOALKICKERS | W71: PRESTON | X71: 0 | Y71: 2 | Z71: 0 | AA71: 41 | AB71: 149 | AC71: 27.516778523489933 | AD71: 0
A72: RICHMOND | D72: HUTCHINSON | H72: KNELL | K72: GUEST
A73: NORTH MELBOURNE | D73: SMITH | G73: M LONDERIGAN | K73: KENNY
A75: WILLIAMSTOWN | C75: 4 | D75: 9 | E75: =C75*6+D75 -> 33 | G75: 4 | H75: 10 | I75: =G75*6+H75 -> 34 | K75: 7 | L75: 11 | M75: =K75*6+L75 -> 53 | O75: 9 | P75: 12 | Q75: =O75*6+P75 -> 66 | S75: BRUNSWICK
A76: BRUNSWICK | C76: 0 | D76: 1 | E76: =C76*6+D76 -> 1 | G76: 3 | H76: 6 | I76: =G76*6+H76 -> 24 | K76: 4 | L76: 6 | M76: =K76*6+L76 -> 30 | O76: 4 | P76: 7 | Q76: =O76*6+P76 -> 31
A77: BEST PLAYERS
A78: WILLIAMSTOWN | D78: MATTHEWS | G78: W JONES | J78: OUTEN | M78: ROBERTSON | P78: BAKER | S78: CALDWELL
A79: BRUNSWICK | D79: HARRIS | G79: COLLISON | J79: WHITEHEAD | M79: WAGLAND | P79: BELCHER | S79: STANWAY
A80: GOALKICKERS
A81: WILLIAMSTOWN | D81: MORTIMER 3 | H81: MATTHEWS 2 | L81: ROBERTSON 2 | P81: W JONES | S81: HALL
A82: BRUNSWICK | D82: WILSON | G82: BELCHER | J82: WALSH | M82: WAGLAND
A84: PORT MELBOURNE | C84: 5 | D84: 1 | E84: =C84*6+D84 -> 31 | G84: 6 | H84: 4 | I84: =G84*6+H84 -> 40 | K84: 9 | L84: 10 | M84: =K84*6+L84 -> 64 | O84: 9 | P84: 10 | Q84: =O84*6+P84 -> 64 | S84: TOORAK PARK
A85: PRAHRAN | C85: 1 | D85: 2 | E85: =C85*6+D85 -> 8 | G85: 3 | H85: 7 | I85: =G85*6+H85 -> 25 | K85: 3 | L85: 7 | M85: =K85*6+L85 -> 25 | O85: 3 | P85: 11 | Q85: =O85*6+P85 -> 29 | S85: FREAME
A86: BEST PLAYERS
A87: PORT MELBOURNE | D87: COPE | G87: HILL | J87: YATES | M87: CROFT | P87: KNOX | S87: TREGLOWAN
A88: PRAHRAN | D88: PONTIN | G88: MILLER | J88: G BROWN | M88: AYLING | P88: TORPEY | S88: LETHBRIDGE
A89: GOALKICKERS
A90: PORT MELBOURNE | D90: CROFT 5 | G90: READ 2 | J90: PHILLIPS | M90: McDONALD
A91: PRAHRAN | D91: MILLER | G91: MARSHALL | J91: G BROWN
A93: WEST MELBOURNE | C93: 3 | D93: 2 | E93: =C93*6+D93 -> 20 | G93: 5 | H93: 4 | I93: =G93*6+H93 -> 34 | K93: 11 | L93: 8 | M93: =K93*6+L93 -> 74 | O93: 15 | P93: 8 | Q93: =O93*6+P93 -> 98 | S93: NORTH MELB
A94: PRESTON | C94: 1 | D94: 0 | E94: =C94*6+D94 -> 6 | G94: 3 | H94: 1 | I94: =G94*6+H94 -> 19 | K94: 4 | L94: 1 | M94: =K94*6+L94 -> 25 | O94: 4 | P94: 1 | Q94: =O94*6+P94 -> 25
A95: BEST PLAYERS
A96: WEST MELBOURNE | D96: ROURKE | G96: MADDEN | J96: LAXTON | M96: JOHNSTON | P96: RYAN | S96: SMITH
A97: PRESTON | D97: S HALL | G97: DAVIS | J97: ROBBINS | M97: LANDELLS | P97: NANKERVIS
A98: GOALKICKERS
A99: WEST MELBOURNE | D99: RYAN 5 | G99: SMITH 3 | J99: McCANN 2 | M99: RANKIN 2 | P99: A GREGORY | S99: ROURKE | V99: LAXTON
A100: PRESTON | D100: WARNE | G100: ROBBINS | J100: LANDELLS | M100: BROWN
A102: ROUND 3 | E102: 20TH MAY | J102: WEATHER | N102: FINE OVERCAST SOUTH EAST WIND
C103: 1ST QTR | G103: 2ND QTR | K103: 3RD QTR | O103: FINAL | S103: PLAYED AT
A104: WILLIAMSTOWN | C104: 1 | D104: 4 | E104: =C104*6+D104 -> 10 | G104: 2 | H104: 9 | I104: =G104*6+H104 -> 21 | K104: 4 | L104: 12 | M104: =K104*6+L104 -> 36 | O104: 6 | P104: 20 | Q104: =O104*6+P104 -> 56 | S104: WILLIAMSTOWN | X104: LADDER | AB104: ROUND | AD104: 3
A105: FOOTSCRAY | C105: 0 | D105: 1 | E105: =C105*6+D105 -> 1 | G105: 0 | H105: 4 | I105: =G105*6+H105 -> 4 | K105: 1 | L105: 6 | M105: =K105*6+L105 -> 12 | O105: 1 | P105: 9 | Q105: =O105*6+P105 -> 15 | S105: UMPIRE
A106: BEST PLAYERS | S106: ASPINALL | W106: TEAM | X106: W | Y106: L | Z106: D | AA106: FOR | AB106: AGST | AC106: % | AD106: PTS
A107: WILLIAMSTOWN | D107: DAVIS | G107: DICK | I107: MORTIMER | L107: MANDERSON | O107: MATTHEWS | S107: W JONES
A108: FOOTSCRAY | D108: E STEPHENSON | G108: HEDLEY | I108: KRUSE | L108: FLEWELLYN | O108: HINCH | S108: MARMO | W108: WILLIAMSTOWN | X108: 3 | Y108: 0 | Z108: 0 | AA108: 192 | AB108: 81 | AC108: 237.04 | AD108: 12
A109: GOALKICKERS | W109: WEST MELBOURNE | X109: 3 | Y109: 0 | Z109: 0 | AA109: 207 | AB109: 92 | AC109: 225 | AD109: 12
A110: WILLIAMSTOWN | D110: MORTIMER 4 | H110: MATTHEWS | W110: PORT MELBOURNE | X110: 3 | Y110: 0 | Z110: 0 | AA110: 163 | AB110: 103 | AC110: 158.25242718446603 | AD110: 12
A111: FOOTSCRAY | D111: FLEWELLYN | W111: RICHMOND | X111: 2 | Y111: 1 | Z111: 0 | AA111: 165 | AB111: 109 | AC111: 151.37614678899084 | AD111: 8
A113: NORTH MELBOURNE | C113: 0 | D113: 1 | E113: =C113*6+D113 -> 1 | G113: 5 | H113: 6 | I113: =G113*6+H113 -> 36 | K113: 6 | L113: 8 | M113: =K113*6+L113 -> 44 | O113: 12 | P113: 10 | Q113: =O113*6+P113 -> 82 | S113: NORTH MELB | W113: FOOTSCRAY | X113: 2 | Y113: 1 | Z113: 0 | AA113: 130 | AB113: 128 | AC113: 101.5625 | AD113: 8
A114: ESSENDON | C114: 4 | D114: 3 | E114: =C114*6+D114 -> 27 | G114: 4 | H114: 3 | I114: =G114*6+H114 -> 27 | K114: 5 | L114: 9 | M114: =K114*6+L114 -> 39 | O114: 5 | P114: 11 | Q114: =O114*6+P114 -> 41 | S114: ALLEN | W114: NORTH MELBOURNE | X114: 1 | Y114: 2 | Z114: 0 | AA114: 145 | AB114: 140 | AC114: 103.57142857142857 | AD114: 4
A115: BEST PLAYERS | W115: ESSENDON TOWN | X115: 1 | Y115: 2 | Z115: 0 | AA115: 119 | AB115: 143 | AC115: 83.216783216783213 | AD115: 4
A116: NORTH MELBOURNE | D116: M LONDERIGAN | G116: C LONDERIGAN | K116: CONSIDINE | N116: KENNY | P116: MARTIN | S116: WATSON | W116: BRUNSWICK | X116: 0 | Y116: 3 | Z116: 0 | AA116: 111 | AB116: 180 | AC116: 61.666666666666664 | AD116: 0
A117: ESSENDON | D117: GAVIN | G117: McINTYRE | K117: DUFF | N117: PAIN | P117: HAMBRIDGE | S117: O'SHEA | W117: PRAHRAN | X117: 0 | Y117: 3 | Z117: 0 | AA117: 91 | AB117: 187 | AC117: 48.66 | AD117: 0
A118: GOALKICKERS | W118: PRESTON | X118: 0 | Y118: 3 | Z118: 0 | AA118: 70 | AB118: 230 | AC118: 30.434782608695652 | AD118: 0
A119: NORTH MELBOURNE | D119: KENNY 5 | G119: M LONDERIGAN 3 | L119: McCANN 2 | O119: PRESCOTT | R119: RAPP
A120: ESSENDON | D120: CHURCHMAN | H120: DUFF | J120: BARLOW | M120: GODING | P120: HAMBRIDGE
A122: PORT MELBOURNE | C122: 3 | D122: 4 | E122: =C122*6+D122 -> 22 | G122: 4 | H122: 5 | I122: =G122*6+H122 -> 29 | K122: 5 | L122: 7 | M122: =K122*6+L122 -> 37 | O122: 6 | P122: 8 | Q122: =O122*6+P122 -> 44 | S122: BRUNSWICK
A123: BRUNSWICK | C123: 0 | D123: 0 | E123: =C123*6+D123 -> 0 | G123: 4 | H123: 3 | I123: =G123*6+H123 -> 27 | K123: 4 | L123: 3 | M123: =K123*6+L123 -> 27 | O123: 5 | P123: 5 | Q123: =O123*6+P123 -> 35 | S123: BAIN
A124: BEST PLAYERS
A125: PORT MELBOURNE | D125: McDONALD | G125: GARBUTT | J125: GAULT | M125: DOYLE | P125: SULLIVAN | S125: CROFT
A126: BRUNSWICK | D126: McNAMARA | G126: STANWAY | J126: WAGLAND | M126: BRAID | P126: O'BRIEN | S126: WILSON
A127: GOALKICKERS
A128: PORT MELBOURNE | D128: McDONALD 4 | H128: CROFT | K128: TREGLOWAN
A129: BRUNSWICK | D129: PRATT 2 | G129: WILSON | J129: WAGLAND | N129: JOHNSON
A131: RICHMOND | C131: 4 | D131: 5 | E131: =C131*6+D131 -> 29 | G131: 5 | H131: 8 | I131: =G131*6+H131 -> 38 | K131: 6 | L131: 9 | M131: =K131*6+L131 -> 45 | O131: 11 | P131: 15 | Q131: =O131*6+P131 -> 81 | S131: PRESTON
A132: PRESTON | C132: 0 | D132: 0 | E132: =C132*6+D132 -> 0 | G132: 0 | H132: 0 | I132: =G132*6+H132 -> 0 | K132: 2 | L132: 4 | M132: =K132*6+L132 -> 16 | O132: 4 | P132: 5 | Q132: =O132*6+P132 -> 29 | S132: O'LOUGHLIN
A133: BEST PLAYERS
A134: RICHMOND | D134: HUTCHINSON | H134: KNELL | K134: LEACH | N134: BRENNAN | Q134: SYKES | T134: MEGSON
A135: PRESTON | D135: S HALL | H135: ROBBINS | K135: WHITE | N135: HUTTON | Q135: BENNETT | T135: LANDELLS
A136: GOALKICKERS
A137: RICHMOND | D137: HUTCHINSON 3 | H137: LEACH 2 | K137: KNELL 2 | N137: BRENNAN | Q137: GUEST | S137: MEGSON | V137: MURRAY
A138: PRESTON | D138: WARNE | G138: YEOMANS | J138: ROBBINS | M138: LANDELLS
A140: WEST MELBOURNE | C140: 2 | D140: 4 | E140: =C140*6+D140 -> 16 | G140: 4 | H140: 6 | I140: =G140*6+H140 -> 30 | K140: 5 | L140: 6 | M140: =K140*6+L140 -> 36 | O140: 7 | P140: 11 | Q140: =O140*6+P140 -> 53 | S140: TOORAK PARK
A141: PRAHRAN | C141: 2 | D141: 3 | E141: =C141*6+D141 -> 15 | G141: 2 | H141: 5 | I141: =G141*6+H141 -> 17 | K141: 3 | L141: 6 | M141: =K141*6+L141 -> 24 | O141: 3 | P141: 9 | Q141: =O141*6+P141 -> 27 | S141: LAIDLAW
A142: BEST PLAYERS
A143: WEST MELBOURNE | D143: JOHNSON | G143: LAXTON | J143: CULLEN | M143: RYAN | O143: POOLE | R143: FRASER
A144: PRAHRAN | D144: ROBERTS | G144: DRAPER | J144: LETHBRIDGE | M144: HAYSOM | O144: SAW
A145: GOALKICKERS
A146: WEST MELBOURNE | D146: RYAN 4 | G146: McCANN | J146: TOBIN | L146: JOHNSON
A147: PRAHRAN | D147: MILLER | G147: LETHBRIDGE | K147: TORPEY
A149: ROUND 4 | E149: 27TH MAY | J149: WEATHER | N149: FINE OVERCAST LIGHT NORTH WEST WIND
C150: 1ST QTR | G150: 2ND QTR | K150: 3RD QTR | O150: FINAL | S150: PLAYED AT
A151: WEST MELBOURNE | C151: 1 | D151: 2 | E151: =C151*6+D151 -> 8 | G151: 1 | H151: 4 | I151: =G151*6+H151 -> 10 | K151: 5 | L151: 6 | M151: =K151*6+L151 -> 36 | O151: 7 | P151: 8 | Q151: =O151*6+P151 -> 50 | S151: FOOTSCRAY | X151: LADDER | AB151: ROUND | AD151: 4
A152: FOOTSCRAY | C152: 0 | D152: 1 | E152: =C152*6+D152 -> 1 | G152: 0 | H152: 3 | I152: =G152*6+H152 -> 3 | K152: 0 | L152: 4 | M152: =K152*6+L152 -> 4 | O152: 1 | P152: 6 | Q152: =O152*6+P152 -> 12 | S152: UMPIRE
A153: BEST PLAYERS | S153: ALLEN | W153: TEAM | X153: W | Y153: L | Z153: D | AA153: FOR | AB153: AGST | AC153: % | AD153: PTS
A154: WEST MELBOURNE | D154: ROURKE | G154: RYAN | J154: LAXTON | M154: JOHNSON | P154: HALL | S154: JONES
A155: FOOTSCRAY | D155: HEDLEY | G155: MARMO | J155: HINCH | M155: HUGHES | P155: HOLLIS | S155: SERBY | W155: WILLIAMSTOWN | X155: 4 | Y155: 0 | Z155: 0 | AA155: 286 | AB155: 97 | AC155: 294.85 | AD155: 16
A156: GOALKICKERS | W156: WEST MELBOURNE | X156: 4 | Y156: 0 | Z156: 0 | AA156: 257 | AB156: 104 | AC156: 247.11538461538461 | AD156: 16
A157: WEST MELBOURNE | D157: RYAN 2 | G157: McCANN | J157: ROURKE | M157: POOLE | O157: RANKIN | R157: FRASER | W157: PORT MELBOURNE | X157: 4 | Y157: 0 | Z157: 0 | AA157: 237 | AB157: 121 | AC157: 195.86776859504133 | AD157: 16
A158: FOOTSCRAY | D158: HUGHES | W158: RICHMOND | X158: 3 | Y158: 1 | Z158: 0 | AA158: 283 | AB158: 158 | AC158: 179.1139240506329 | AD158: 12
A160: WILLIAMSTOWN | C160: 2 | D160: 2 | E160: =C160*6+D160 -> 14 | G160: 8 | H160: 5 | I160: =G160*6+H160 -> 53 | K160: 8 | L160: 14 | M160: =K160*6+L160 -> 62 | O160: 13 | P160: 16 | Q160: =O160*6+P160 -> 94 | S160: ESSENDON | W160: NORTH MELBOURNE | X160: 2 | Y160: 2 | Z160: 0 | AA160: 229 | AB160: 179 | AC160: 127.93296089385476 | AD160: 8
A161: ESSENDON | C161: 1 | D161: 2 | E161: =C161*6+D161 -> 8 | G161: 2 | H161: 2 | I161: =G161*6+H161 -> 14 | K161: 2 | L161: 3 | M161: =K161*6+L161 -> 15 | O161: 2 | P161: 4 | Q161: =O161*6+P161 -> 16 | S161: ARMSTRONG | W161: FOOTSCRAY | X161: 2 | Y161: 2 | Z161: 0 | AA161: 142 | AB161: 178 | AC161: 79.775280898876403 | AD161: 8
A162: BEST PLAYERS | W162: ESSENDON | X162: 1 | Y162: 3 | Z162: 0 | AA162: 135 | AB162: 237 | AC162: 56.962025316455694 | AD162: 4
A163: WILLIAMSTOWN | D163: MORTIMER | H163: OUTEN | K163: DAVIS | N163: HOUGHTON | Q163: ALLEY | T163: BAKER | W163: BRUNSWICK | X163: 0 | Y163: 4 | Z163: 0 | AA163: 160 | AB163: 298 | AC163: 53.691275167785236 | AD163: 0
A164: ESSENDON | D164: McINTYRE | H164: O'SHEA | K164: STEEL | N164: PAIN | Q164: CHEFFERS | T164: MARTIN | W164: PRAHRAN | X164: 0 | Y164: 4 | Z164: 0 | AA164: 130 | AB164: 271 | AC164: 47.97 | AD164: 0
A165: GOALKICKERS | W165: PRESTON | X165: 0 | Y165: 4 | Z165: 0 | AA165: 88 | AB165: 304 | AC165: 28.94736842105263 | AD165: 0
A166: WILLIAMSTOWN | D166: MORTIMER 8 | H166: HALL 2 | K166: ALLEY | M166: BRITT | O166: LEWIS
A167: ESSENDON | D167: CHURCHMAN | H167: HAMBRIDGE
A169: RICHMOND | C169: 4 | D169: 7 | E169: =C169*6+D169 -> 31 | G169: 9 | H169: 10 | I169: =G169*6+H169 -> 64 | K169: 14 | L169: 14 | M169: =K169*6+L169 -> 98 | O169: 16 | P169: 22 | Q169: =O169*6+P169 -> 118 | S169: RICHMOND
A170: BRUNSWICK | C170: 2 | D170: 0 | E170: =C170*6+D170 -> 12 | G170: 5 | H170: 1 | I170: =G170*6+H170 -> 31 | K170: 6 | L170: 5 | M170: =K170*6+L170 -> 41 | O170: 7 | P170: 7 | Q170: =O170*6+P170 -> 49 | S170: FREAME
A171: BEST PLAYERS
A172: RICHMOND | D172: LEACH | G172: T WILLIAMS | K172: KNELL | N172: C WILLIAMS | Q172: McDONALD | T172: RICKETTS
A173: BRUNSWICK | D173: HARRIS | G173: COLLISON | K173: CHASE | N173: WHITFIELD | Q173: McNANARA | T173: BRAID
A174: GOALKICKERS
A175: RICHMOND | D175: KNELL 5 | G175: HUTCHINSON 3 | K175: GUEST 2 | N175: LEACH 2 | Q175: BRENNAN 2 | T175: LANG | V175: OWENS
A176: BRUNSWICK | D176: BRAID | G176: R WALSH | J176: STANWAY | M176: PRATT | O176: WILSON | R176: WAGLAND
A178: NORTH MELBOURNE | C178: 2 | D178: 5 | E178: =C178*6+D178 -> 17 | G178: 3 | H178: 7 | I178: =G178*6+H178 -> 25 | K178: 8 | L178: 7 | M178: =K178*6+L178 -> 55 | O178: 12 | P178: 12 | Q178: =O178*6+P178 -> 84 | S178: NORTH MELB
A179: PRAHRAN | C179: 3 | D179: 0 | E179: =C179*6+D179 -> 18 | G179: 3 | H179: 0 | I179: =G179*6+H179 -> 18 | K179: 5 | L179: 1 | M179: =K179*6+L179 -> 31 | O179: 6 | P179: 3 | Q179: =O179*6+P179 -> 39 | S179: WOOLFE
A180: BEST PLAYERS
A181: NORTH MELBOURNE | D181: C LONDERIGAN | H181: RAPP | K181: SMITH | N181: MARTIN | Q181: M LONDERIGAN | U181: GROVES
A182: PRAHRAN | D182: TORPEY | H182: JACKSON | K182: SAW | N182: HAYSOM | Q182: G BROWN | U182: ROBERTYS
A183: GOALKICKERS
A184: NORTH MELBOURNE | D184: MARTIN 2 | G184: KENNY 2 | J184: M LONDERIGAN 2 | N184: C LONDERIGAN | Q184: FAGAN | S184: McCANN | V184: SMITH | X184: PRESCOTT | AA184: MORRISON
A185: PRAHRAN | D185: MARSHALL 2 | H185: LETHBRIDGE 2 | L185: MILLER 2
A187: PORT MELBOURNE | C187: 3 | D187: 3 | E187: =C187*6+D187 -> 21 | G187: 4 | H187: 4 | I187: =G187*6+H187 -> 28 | K187: 8 | L187: 8 | M187: =K187*6+L187 -> 56 | O187: 10 | P187: 14 | Q187: =O187*6+P187 -> 74 | S187: PORT MELB
A188: PRESTON | C188: 0 | D188: 2 | E188: =C188*6+D188 -> 2 | G188: 0 | H188: 4 | I188: =G188*6+H188 -> 4 | K188: 0 | L188: 5 | M188: =K188*6+L188 -> 5 | O188: 2 | P188: 6 | Q188: =O188*6+P188 -> 18 | S188: GROGAN
A189: BEST PLAYERS
A190: PORT MELBOURNE | D190: KNOX | G190: BORTHWICK | K190: HILL | N190: PETTIT | Q190: PHILLIPS | T190: CROFT
A191: PRESTON | D191: S HALL | G191: GILLESPIE | K191: ROBBINS | N191: BROWN | Q191: PAGE | T191: LANDELLS
A192: GOALKICKERS
A193: PORT MELBOURNE | D193: CROFT 4 | G193: McDONALD 4 | K193: PETTIT | N193: PHILLIPS
A194: PRESTON | D194: D HALL | G194: BROWN
A196: ROUND 5 | E196: 3RD JUNE | I196: WEATHER | M196: OVERCAST LIGHT NORTH WEST WIND GROUNDS HEAVY AFTER RAIN
C197: 1ST QTR | G197: 2ND QTR | K197: 3RD QTR | O197: FINAL | S197: PLAYED AT
A198: WEST MELBOURNE | C198: 1 | D198: 2 | E198: =C198*6+D198 -> 8 | G198: 2 | H198: 2 | I198: =G198*6+H198 -> 14 | K198: 3 | L198: 2 | M198: =K198*6+L198 -> 20 | O198: 5 | P198: 2 | Q198: =O198*6+P198 -> 32 | S198: NORTH MELB | X198: LADDER | AB198: ROUND | AD198: 5
A199: PORT MELBOURNE | C199: 0 | D199: 1 | E199: =C199*6+D199 -> 1 | G199: 1 | H199: 1 | I199: =G199*6+H199 -> 7 | K199: 2 | L199: 2 | M199: =K199*6+L199 -> 14 | O199: 2 | P199: 2 | Q199: =O199*6+P199 -> 14 | S199: UMPIRE
A200: BEST PLAYERS | S200: ALLEN | W200: TEAM | X200: W | Y200: L | Z200: D | AA200: FOR | AB200: AGST | AC200: % | AD200: PTS
A201: WEST MELBOURNE | D201: JOHNSON | G201: MADDEN | J201: A GREGORY | M201: ROURKE | P201: POOLE | R201: McCANN
A202: PORT MELBOURNE | D202: PETTIT | G202: TREGLOWAN | J202: WARD | M202: HILL | P202: COPE | R202: SULLIVAN | W202: WILLIAMSTOWN | X202: 5 | Y202: 0 | Z202: 0 | AA202: 359 | AB202: 135 | AC202: 265.93 | AD202: 20
A203: GOALKICKERS | W203: WEST MELBOURNE | X203: 5 | Y203: 0 | Z203: 0 | AA203: 289 | AB203: 118 | AC203: 244.91525423728814 | AD203: 20
A204: WEST MELBOURNE | D204: McCANN 2 | G204: COTTER 2 | J204: ROURKE | W204: PORT MELBOURNE | X204: 4 | Y204: 1 | Z204: 0 | AA204: 251 | AB204: 153 | AC204: 164.05228758169935 | AD204: 16
A205: PORT MELBOURNE | D205: SULLIVAN | G205: McDONALD | W205: RICHMOND | X205: 3 | Y205: 2 | Z205: 0 | AA205: 321 | AB205: 231 | AC205: 138.96103896103895 | AD205: 12
A207: WILLIAMSTOWN | C207: 1 | D207: 6 | E207: =C207*6+D207 -> 12 | G207: 7 | H207: 9 | I207: =G207*6+H207 -> 51 | K207: 9 | L207: 10 | M207: =K207*6+L207 -> 64 | O207: 10 | P207: 13 | Q207: =O207*6+P207 -> 73 | S207: WILLIAMSTOWN | W207: NORTH MELBOURNE | X207: 3 | Y207: 2 | Z207: 0 | AA207: 269 | AB207: 212 | AC207: 126.88679245283019 | AD207: 12
A208: RICHMOND | C208: 1 | D208: 1 | E208: =C208*6+D208 -> 7 | G208: 1 | H208: 4 | I208: =G208*6+H208 -> 10 | K208: 4 | L208: 6 | M208: =K208*6+L208 -> 30 | O208: 5 | P208: 8 | Q208: =O208*6+P208 -> 38 | S208: O'LOUGHLIN | W208: FOOTSCRAY | X208: 2 | Y208: 3 | Z208: 0 | AA208: 175 | AB208: 218 | AC208: 80.275229357798167 | AD208: 8
A209: BEST PLAYERS | W209: ESSENDON | X209: 2 | Y209: 3 | Z209: 0 | AA209: 172 | AB209: 247 | AC209: 69.635627530364374 | AD209: 8
A210: WILLIAMSTOWN | D210: DAVIS | G210: DICK | J210: OUTEN | M210: HOUGHTON | P210: ALLEY | S210: MORTIMER | W210: BRUNSWICK | X210: 1 | Y210: 4 | Z210: 0 | AA210: 251 | AB210: 328 | AC210: 76.524390243902445 | AD210: 4
A211: RICHMOND | D211: CLEGHORN | G211: T WILLIAMS | J211: BOWNAS | M211: BROWN | P211: McDONALD | S211: EDMONDS | W211: PRAHRAN | X211: 0 | Y211: 5 | Z211: 0 | AA211: 140 | AB211: 308 | AC211: 45.45 | AD211: 0
A212: GOALKICKERS | W212: PRESTON | X212: 0 | Y212: 5 | Z212: 0 | AA212: 118 | AB212: 395 | AC212: 29.873417721518987 | AD212: 0
A213: WILLIAMSTOWN | D213: MATTHEWS 4 | H213: BRITT 2 | K213: MORTIMER 2 | O213: HALL | Q213: DAVIS
A214: RICHMOND | D214: KNELL 2 | G214: T WILLIAMS | K214: HUTCHINSON | O214: McDONALD
A216: NORTH MELBOURNE | C216: 1 | D216: 1 | E216: =C216*6+D216 -> 7 | G216: 2 | H216: 5 | I216: =G216*6+H216 -> 17 | K216: 5 | L216: 9 | M216: =K216*6+L216 -> 39 | O216: 5 | P216: 10 | Q216: =O216*6+P216 -> 40 | S216: FOOTSCRAY
A217: FOOTSCRAY | C217: 2 | D217: 1 | E217: =C217*6+D217 -> 13 | G217: 3 | H217: 2 | I217: =G217*6+H217 -> 20 | K217: 3 | L217: 2 | M217: =K217*6+L217 -> 20 | O217: 5 | P217: 3 | Q217: =O217*6+P217 -> 33 | S217: FREAME
A218: BEST PLAYERS
A219: NORTH MELBOURNE | D219: WATSON | G219: KENNY | J219: M LONDERIGAN | M219: MORRISON | P219: SMITH | S219: MARTIN
A220: FOOTSCRAY | D220: COLLINS | G220: HINCH | J220: MARMO | M220: KRUSE | P220: NEILSON | S220: A CATTANACH
A221: GOALKICKERS
A222: NORTH MELBOURNE | D222: KENNY 3 | G222: M LONDERIGAN | L222: FAGAN
A223: FOOTSCRAY | D223: J CATTANACH 2 | I223: COLLINS | L223: J STEPHENSON | P223: GIPPS
A225: ESSENDON | C225: 0 | D225: 3 | E225: =C225*6+D225 -> 3 | G225: 0 | H225: 7 | I225: =G225*6+H225 -> 7 | K225: 3 | L225: 10 | M225: =K225*6+L225 -> 28 | O225: 4 | P225: 13 | Q225: =O225*6+P225 -> 37 | S225: ESSENDON
A226: PRAHRAN | C226: 0 | D226: 0 | E226: =C226*6+D226 -> 0 | G226: 0 | H226: 1 | I226: =G226*6+H226 -> 1 | K226: 0 | L226: 2 | M226: =K226*6+L226 -> 2 | O226: 1 | P226: 4 | Q226: =O226*6+P226 -> 10 | S226: ASPINALL
A227: BEST PLAYERS
A228: ESSENDON | D228: HAMBRIDGE | G228: HORDERN | J228: GODING | M228: O'SHEA | P228: GIRDWOOD | S228: MARTIN
A229: PRAHRAN | D229: T BROWN | G229: G BROWN | J229: ROBERTS | M229: JACKSON | P229: TORPEY | S229: SAW
A230: GOALKICKERS
A231: ESSENDON | D231: GODING | G231: BARLOW | J231: CHURCHMAN | N231: BOWEN
A232: PRAHRAN | D232: PONTIN
A234: BRUNSWICK | C234: 2 | D234: 3 | E234: =C234*6+D234 -> 15 | G234: 3 | H234: 9 | I234: =G234*6+H234 -> 27 | K234: 5 | L234: 11 | M234: =K234*6+L234 -> 41 | O234: 13 | P234: 13 | Q234: =O234*6+P234 -> 91 | S234: PRESTON
A235: PRESTON | C235: 1 | D235: 4 | E235: =C235*6+D235 -> 10 | G235: 2 | H235: 4 | I235: =G235*6+H235 -> 16 | K235: 3 | L235: 5 | M235: =K235*6+L235 -> 23 | O235: 4 | P235: 6 | Q235: =O235*6+P235 -> 30 | S235: BAIN
A236: BEST PLAYERS
A237: BRUNSWICK | D237: RYAN | G237: COLLISON | J237: CHASE | M237: WILSON | P237: PRATT | S237: WAGLAND
A238: PRESTON | D238: KENYON | G238: S HALL | J238: P HALL | M238: WHITE | P238: TOPPING | S238: LANDELLS
A239: GOALKICKERS
A240: BRUNSWICK | D240: RYAN 9 | G240: WAGLAND 2 | K240: WILSON | N240: BELCHER
A241: PRESTON | D241: LANDELLS 2 | H241: TOPPING | K241: ROBBINS
A243: ROUND 6 | E243: 10TH JUNE | J243: WEATHER | N243: STRONG NORTH WIND
C244: 1ST QTR | G244: 2ND QTR | K244: 3RD QTR | O244: FINAL | S244: PLAYED AT
A245: WEST MELBOURNE | C245: 0 | D245: 5 | E245: =C245*6+D245 -> 5 | G245: 1 | H245: 10 | I245: =G245*6+H245 -> 16 | K245: 2 | L245: 12 | M245: =K245*6+L245 -> 24 | O245: 2 | P245: 14 | Q245: =O245*6+P245 -> 26 | S245: WILLIAMSTOWN | X245: LADDER | AB245: ROUND | AD245: 6
A246: WILLIAMSTOWN | C246: 0 | D246: 0 | E246: =C246*6+D246 -> 0 | G246: 2 | H246: 2 | I246: =G246*6+H246 -> 14 | K246: 2 | L246: 2 | M246: =K246*6+L246 -> 14 | O246: 2 | P246: 4 | Q246: =O246*6+P246 -> 16 | S246: UMPIRE
A247: BEST PLAYERS | S247: ALLEN | W247: TEAM | X247: W | Y247: L | Z247: D | AA247: FOR | AB247: AGST | AC247: % | AD247: PTS
A248: WEST MELBOURNE | D248: LAXTON | H248: JOHNSON | K248: ROURKE | N248: FRASER | P248: POOLE | R248: MADDEN
A249: WILLIAMSTOWN | D249: WILLIAMSON | H249: McCANN | K249: LEWIS | N249: ALLEY | P249: OUTEN | R249: HOUGHTON | W249: WEST MELBOURNE | X249: 6 | Y249: 0 | Z249: 0 | AA249: 315 | AB249: 134 | AC249: 235.07462686567163 | AD249: 24
A250: GOALKICKERS | W250: WILLIAMSTOWN | X250: 5 | Y250: 1 | Z250: 0 | AA250: 375 | AB250: 161 | AC250: 232.92 | AD250: 20
A251: WEST MELBOURNE | D251: LLOYD | G251: McCANN | W251: PORT MELBOURNE | X251: 5 | Y251: 1 | Z251: 0 | AA251: 280 | AB251: 180 | AC251: 155.55555555555554 | AD251: 20
A252: WILLIAMSTOWN | D252: HALL | G252: HOUGHTON | W252: NORTH MELBOURNE | X252: 4 | Y252: 2 | Z252: 0 | AA252: 313 | AB252: 238 | AC252: 131.51260504201682 | AD252: 16
A254: PORT MELBOURNE | C254: 0 | D254: 3 | E254: =C254*6+D254 -> 3 | G254: 0 | H254: 3 | I254: =G254*6+H254 -> 3 | K254: 3 | L254: 5 | M254: =K254*6+L254 -> 23 | O254: 4 | P254: 5 | Q254: =O254*6+P254 -> 29 | S254: PORT MELB | W254: RICHMOND | X254: 3 | Y254: 3 | Z254: 0 | AA254: 348 | AB254: 260 | AC254: 133.84615384615384 | AD254: 12
A255: RICHMOND | C255: 2 | D255: 0 | E255: =C255*6+D255 -> 12 | G255: 4 | H255: 2 | I255: =G255*6+H255 -> 26 | K255: 4 | L255: 3 | M255: =K255*6+L255 -> 27 | O255: 4 | P255: 3 | Q255: =O255*6+P255 -> 27 | S255: O'LOUGHLIN | W255: FOOTSCRAY | X255: 3 | Y255: 3 | Z255: 0 | AA255: 239 | AB255: 236 | AC255: 101.27118644067797 | AD255: 12
A256: BEST PLAYERS | W256: ESSENDON | X256: 3 | Y256: 3 | Z256: 0 | AA256: 226 | AB256: 291 | AC256: 77.663230240549822 | AD256: 12
A257: PORT MELBOURNE | D257: CROFT | G257: SULLIVAN | K257: GAULT | N257: TREGLOWAN | Q257: HILL | S257: COPE | W257: BRUNSWICK | X257: 1 | Y257: 5 | Z257: 0 | AA257: 295 | AB257: 382 | AC257: 77.225130890052355 | AD257: 4
A258: RICHMOND | D258: LEACH | G258: T WILLIAMS | K258: CLEGHORN | N258: RIGBY | Q258: SMITH | S258: SYKES | W258: PRAHRAN | X258: 0 | Y258: 6 | Z258: 0 | AA258: 158 | AB258: 372 | AC258: 42.47 | AD258: 0
A259: GOALKICKERS | W259: PRESTON | X259: 0 | Y259: 6 | Z259: 0 | AA259: 144 | AB259: 439 | AC259: 32.801822323462417 | AD259: 0
A260: PORT MELBOURNE | D260: McDONALD 2 | H260: CROFT | K260: SULLIVAN
A261: RICHMOND | D261: GUEST | G261: CLEGHORN | J261: LEACH | M261: CHESWASS
A263: ESSENDON | C263: 3 | D263: 2 | E263: =C263*6+D263 -> 20 | G263: 7 | H263: 2 | I263: =G263*6+H263 -> 44 | K263: 8 | L263: 4 | M263: =K263*6+L263 -> 52 | O263: 8 | P263: 6 | Q263: =O263*6+P263 -> 54 | S263: BRUNSWICK
A264: BRUNSWICK | C264: 0 | D264: 2 | E264: =C264*6+D264 -> 2 | G264: 3 | H264: 6 | I264: =G264*6+H264 -> 24 | K264: 4 | L264: 6 | M264: =K264*6+L264 -> 30 | O264: 6 | P264: 8 | Q264: =O264*6+P264 -> 44 | S264: WOOLFE
A265: BEST PLAYERS
A266: ESSENDON | D266: GIRDWOOD | G266: HAMBRIDGE | J266: GODING | M266: BOWEN | P266: GAVIN | S266: MARTIN
A267: BRUNSWICK | D267: BRAID | G267: COLLISON | J267: WHITFIELD | M267: STANWAY | P267: BELCHER | S267: WAGLAND
A268: GOALKICKERS
A269: ESSENDON | D269: BOWEN 3 | G269: GODING 2 | J269: MARTIN | M269: GRAHAM | P269: CHURCHMAN
A270: BRUNSWICK | D270: WAGLAND 2 | H270: RYAN | J270: BRAID | L270: STANWAY | O270: COLLISON
A272: FOOTSCRAY | C272: 0 | D272: 2 | E272: =C272*6+D272 -> 2 | G272: 4 | H272: 5 | I272: =G272*6+H272 -> 29 | K272: 5 | L272: 6 | M272: =K272*6+L272 -> 36 | O272: 9 | P272: 10 | Q272: =O272*6+P272 -> 64 | S272: TOORAK PARK
A273: PRAHRAN | C273: 1 | D273: 3 | E273: =C273*6+D273 -> 9 | G273: 1 | H273: 6 | I273: =G273*6+H273 -> 12 | K273: 1 | L273: 11 | M273: =K273*6+L273 -> 17 | O273: 1 | P273: 12 | Q273: =O273*6+P273 -> 18 | S273: FREAME
A274: BEST PLAYERS
A275: FOOTSCRAY | D275: A CATTANACH | H275: HUGHES | K275: HINCH | N275: MARMO | P275: HEDLEY | S275: SERGEANT
A276: PRAHRAN | D276: T BROWN | H276: ROBERTS | K276: HAYSOM | N276: TORPEY | P276: G BROWN | S276: SWIFT
A277: GOALKICKERS
A278: FOOTSCRAY | D278: HUGHES 3 | G278: J CATTANACH 2 | K278: FLEWELLYN | N278: J STEPHENSON | R278: SERBY | T278: A CATTANACH
A279: PRAHRAN | D279: RYAN
A281: NORTH MELBOURNE | C281: 2 | D281: 2 | E281: =C281*6+D281 -> 14 | G281: 3 | H281: 3 | I281: =G281*6+H281 -> 21 | K281: 5 | L281: 12 | M281: =K281*6+L281 -> 42 | O281: 5 | P281: 14 | Q281: =O281*6+P281 -> 44 | S281: NORTH MELB
A282: PRESTON | C282: 1 | D282: 1 | E282: =C282*6+D282 -> 7 | G282: 3 | H282: 1 | I282: =G282*6+H282 -> 19 | K282: 3 | L282: 1 | M282: =K282*6+L282 -> 19 | O282: 4 | P282: 2 | Q282: =O282*6+P282 -> 26 | S282: GROGAN
A283: BEST PLAYERS
A284: NORTH MELBOURNE | D284: WATSON | G284: THORPE | J284: KENNY | M284: CONSIDINE | P284: PRESCOTT | S284: McCANN
A285: PRESTON | D285: S HALL | G285: LANDELLS | J285: BROWN | M285: YEOMANS | P285: BARKER | S285: P HALL
A286: GOALKICKERS
A287: NORTH MELBOURNE | D287: KENNY 2 | G287: CONSIDINE | J287: MORRISON | M287: PRESCOTT
A288: PRESTON | D288: LANDELLS 3
A290: ROUND 7 | E290: 17TH JUNE | J290: WEATHER | N290: STRONG NORTH WEST WIND CLOUDY DULL
C291: 1ST QTR | G291: 2ND QTR | K291: 3RD QTR | O291: FINAL | S291: PLAYED AT
A292: NORTH MELBOURNE | C292: 2 | D292: 3 | E292: =C292*6+D292 -> 15 | G292: 2 | H292: 3 | I292: =G292*6+H292 -> 15 | K292: 4 | L292: 6 | M292: =K292*6+L292 -> 30 | O292: 5 | P292: 11 | Q292: =O292*6+P292 -> 41 | S292: NORTH MELB | X292: LADDER | AB292: ROUND | AD292: 7
A293: WILLIAMSTOWN | C293: 1 | D293: 0 | E293: =C293*6+D293 -> 6 | G293: 2 | H293: 3 | I293: =G293*6+H293 -> 15 | K293: 2 | L293: 4 | M293: =K293*6+L293 -> 16 | O293: 3 | P293: 5 | Q293: =O293*6+P293 -> 23 | S293: UMPIRE
A294: BEST PLAYERS | S294: BAIN | W294: TEAM | X294: W | Y294: L | Z294: D | AA294: FOR | AB294: AGST | AC294: % | AD294: PTS
A295: NORTH MELBOURNE | D295: M LONDERIGAN | G295: SMITH | J295: WATSON | M295: RAPP | P295: CONSIDINE | S295: MORRISON
A296: WILLIAMSTOWN | D296: LEWIS | G296: ALLEY | J296: HALL | M296: HOUGHTON | P296: DICK | S296: BUTTERFIELD | W296: WEST MELBOURNE | X296: 7 | Y296: 0 | Z296: 0 | AA296: 342 | AB296: 144 | AC296: 237.5 | AD296: 28
A297: GOALKICKERS | W297: WILLIAMSTOWN | X297: 5 | Y297: 2 | Z297: 0 | AA297: 398 | AB297: 202 | AC297: 197.03 | AD297: 20
A298: NORTH MELBOURNE | D298: McCANN 3 | H298: C LONDERIGAN 2 | W298: PORT MELBOURNE | X298: 5 | Y298: 2 | Z298: 0 | AA298: 308 | AB298: 223 | AC298: 138.11659192825113 | AD298: 20
A299: WILLIAMSTOWN | D299: MATTHEWS | H299: MORTIMER | L299: SHEAHAN | W299: NORTH MELBOURNE | X299: 5 | Y299: 2 | Z299: 0 | AA299: 354 | AB299: 261 | AC299: 135.63218390804599 | AD299: 20
A301: FOOTSCRAY | C301: 5 | D301: 1 | E301: =C301*6+D301 -> 31 | G301: 6 | H301: 1 | I301: =G301*6+H301 -> 37 | K301: 7 | L301: 1 | M301: =K301*6+L301 -> 43 | O301: 7 | P301: 1 | Q301: =O301*6+P301 -> 43 | S301: FOOTSCRAY | W301: RICHMOND | X301: 4 | Y301: 3 | Z301: 0 | AA301: 421 | AB301: 285 | AC301: 147.71929824561403 | AD301: 16
A302: PORT MELBOURNE | C302: 0 | D302: 2 | E302: =C302*6+D302 -> 2 | G302: 2 | H302: 5 | I302: =G302*6+H302 -> 17 | K302: 2 | L302: 8 | M302: =K302*6+L302 -> 20 | O302: 3 | P302: 10 | Q302: =O302*6+P302 -> 28 | S302: WOOLFE | W302: FOOTSCRAY | X302: 4 | Y302: 3 | Z302: 0 | AA302: 282 | AB302: 264 | AC302: 106.81818181818181 | AD302: 16
A303: BEST PLAYERS | W303: ESSENDON | X303: 3 | Y303: 4 | Z303: 0 | AA303: 251 | AB303: 364 | AC303: 68.956043956043956 | AD303: 12
A304: FOOTSCRAY | D304: MARMO | G304: HINCH | J304: HOOD | M304: HUGHES | P304: ANDERSON | S304: McKINLEY | W304: BRUNSWICK | X304: 1 | Y304: 6 | Z304: 0 | AA304: 305 | AB304: 409 | AC304: 74.572127139364298 | AD304: 4
A305: PORT MELBOURNE | D305: WARD | G305: HILL | I305: BORTHWICK | M305: TREGLOWAN | P305: GAULT | S305: PETTIT | W305: PRAHRAN | X305: 1 | Y305: 6 | Z305: 0 | AA305: 178 | AB305: 387 | AC305: 45.99 | AD305: 4
A306: GOALKICKERS | W306: PRESTON | X306: 0 | Y306: 7 | Z306: 0 | AA306: 159 | AB306: 459 | AC306: 34.640522875816991 | AD306: 0
A307: FOOTSCRAY | D307: MITCHELL 2 | H307: J STEPHENSON 2 | M307: HUGHES | P307: HOOD | R307: A CATTANACH
A308: PORT MELBOURNE | D308: GAULT | G308: CROFT | J308: McCOLL
A310: RICHMOND | C310: 2 | D310: 4 | E310: =C310*6+D310 -> 16 | G310: 3 | H310: 9 | I310: =G310*6+H310 -> 27 | K310: 6 | L310: 14 | M310: =K310*6+L310 -> 50 | O310: 9 | P310: 19 | Q310: =O310*6+P310 -> 73 | S310: RICHMOND
A311: ESSENDON | C311: 1 | D311: 0 | E311: =C311*6+D311 -> 6 | G311: 4 | H311: 0 | I311: =G311*6+H311 -> 24 | K311: 4 | L311: 0 | M311: =K311*6+L311 -> 24 | O311: 4 | P311: 1 | Q311: =O311*6+P311 -> 25 | S311: ALLEN
A312: BEST PLAYERS
A313: RICHMOND | D313: BRENNAN | G313: LEACH | J313: RICKETTS | M313: RIGBY | P313: C WILLIAMS | S313: EDMONDS
A314: ESSENDON | D314: GIRDWOOD | G314: GAVIN | J314: GODING | M314: DUFF | P314: HAMBRIDGE | S314: ALVES
A315: GOALKICKERS
A316: RICHMOND | D316: KNELL 3 | G316: HUTCHINSON 2 | K316: LANG | M316: BRENNAN | P316: CHESWASS | S316: MEGSON
A317: ESSENDON | D317: GODING 3 | G317: BOWEN
A319: PRESTON | C319: 1 | D319: 2 | E319: =C319*6+D319 -> 8 | G319: 1 | H319: 3 | I319: =G319*6+H319 -> 9 | K319: 2 | L319: 3 | M319: =K319*6+L319 -> 15 | O319: 2 | P319: 3 | Q319: =O319*6+P319 -> 15 | S319: PRESTON
A320: PRAHRAN | C320: 0 | D320: 2 | E320: =C320*6+D320 -> 2 | G320: 0 | H320: 3 | I320: =G320*6+H320 -> 3 | K320: 0 | L320: 4 | M320: =K320*6+L320 -> 4 | O320: 2 | P320: 8 | Q320: =O320*6+P320 -> 20 | S320: ASPINALL
A321: BEST PLAYERS
A322: PRESTON
A323: PRAHRAN
A324: GOALKICKERS
A325: PRESTON | D325: ROBBINS | G325: WHITE
A326: PRAHRAN | D326: TORPEY 2
A328: WEST MELBOURNE | C328: 0 | D328: 3 | E328: =C328*6+D328 -> 3 | G328: 3 | H328: 5 | I328: =G328*6+H328 -> 23 | K328: 3 | L328: 9 | M328: =K328*6+L328 -> 27 | O328: 3 | P328: 9 | Q328: =O328*6+P328 -> 27 | S328: BRUNSWICK
A329: BRUNSWICK | C329: 1 | D329: 1 | E329: =C329*6+D329 -> 7 | G329: 1 | H329: 2 | I329: =G329*6+H329 -> 8 | K329: 1 | L329: 3 | M329: =K329*6+L329 -> 9 | O329: 1 | P329: 4 | Q329: =O329*6+P329 -> 10 | S329: GROGAN
A330: BEST PLAYERS
A331: WEST MELBOURNE | D331: ROURKE | G331: LAXTON | J331: JOHNSON | M331: CULLEN | P331: H GREGORY | S331: McCANN
A332: BRUNSWICK | D332: BELCHER | G332: ROBERTSON | J332: WILSON | M332: WAGLAND | P332: STANWAY | S332: MULVANEY
A333: GOALKICKERS
A334: WEST MELBOURNE | D334: A GREGORY 2 | H334: RYAN
A335: BRUNSWICK | D335: WILSON
A337: ROUND 8 | E337: 1ST JULY | J337: WEATHER | N337: NORTH WEST WIND CLOUDY DULL
C338: 1ST QTR | G338: 2ND QTR | K338: 3RD QTR | O338: FINAL | S338: PLAYED AT
A339: NORTH MELBOURNE | C339: 0 | D339: 0 | E339: =C339*6+D339 -> 0 | G339: 1 | H339: 5 | I339: =G339*6+H339 -> 11 | K339: 2 | L339: 5 | M339: =K339*6+L339 -> 17 | O339: 3 | P339: 8 | Q339: =O339*6+P339 -> 26 | S339: NORTH MELB | X339: LADDER | AB339: ROUND | AD339: 8
A340: WEST MELBOURNE | C340: 2 | D340: 3 | E340: =C340*6+D340 -> 15 | G340: 2 | H340: 4 | I340: =G340*6+H340 -> 16 | K340: 3 | L340: 4 | M340: =K340*6+L340 -> 22 | O340: 3 | P340: 4 | Q340: =O340*6+P340 -> 22 | S340: UMPIRE
A341: BEST PLAYERS | S341: ASPINALL | W341: TEAM | X341: W | Y341: L | Z341: D | AA341: FOR | AB341: AGST | AC341: % | AD341: PTS
A342: NORTH MELBOURNE | D342: MORRISON | G342: CONSIDINE | J342: PRESCOTT | M342: SMITH | O342: McDERMOTT | R342: KENNEDY
A343: WEST MELBOURNE | D343: H GREGORY | G343: A GREGORY | J343: MADDEN | M343: CULLEN | O343: RYAN | R343: LAXTON | W343: WEST MELBOURNE | X343: 7 | Y343: 1 | Z343: 0 | AA343: 364 | AB343: 170 | AC343: 214.11764705882354 | AD343: 28
A344: GOALKICKERS | W344: WILLIAMSTOWN | X344: 6 | Y344: 2 | Z344: 0 | AA344: 448 | AB344: 246 | AC344: 182.11 | AD344: 24
A345: NORTH MELBOURNE | D345: GROVES | G345: C LONDERIGAN | W345: PORT MELBOURNE | X345: 6 | Y345: 2 | Z345: 0 | AA345: 349 | AB345: 258 | AC345: 135.27131782945736 | AD345: 24
A346: WEST MELBOURNE | D346: RYAN 2 | G346: FRASER | W346: NORTH MELBOURNE | X346: 6 | Y346: 2 | Z346: 0 | AA346: 380 | AB346: 283 | AC346: 134.27561837455829 | AD346: 24
A348: RICHMOND | C348: 3 | D348: 1 | E348: =C348*6+D348 -> 19 | G348: 6 | H348: 5 | I348: =G348*6+H348 -> 41 | K348: 9 | L348: 8 | M348: =K348*6+L348 -> 62 | O348: 15 | P348: 15 | Q348: =O348*6+P348 -> 105 | S348: RICHMOND | W348: RICHMOND | X348: 5 | Y348: 3 | Z348: 0 | AA348: 526 | AB348: 304 | AC348: 173.02631578947367 | AD348: 20
A349: FOOTSCRAY | C349: 0 | D349: 4 | E349: =C349*6+D349 -> 4 | G349: 0 | H349: 8 | I349: =G349*6+H349 -> 8 | K349: 0 | L349: 13 | M349: =K349*6+L349 -> 13 | O349: 1 | P349: 13 | Q349: =O349*6+P349 -> 19 | S349: FREAME | W349: FOOTSCRAY | X349: 4 | Y349: 4 | Z349: 0 | AA349: 301 | AB349: 369 | AC349: 81.571815718157183 | AD349: 16
A350: BEST PLAYERS | W350: ESSENDON | X350: 3 | Y350: 5 | Z350: 0 | AA350: 286 | AB350: 405 | AC350: 70.617283950617278 | AD350: 12
A351: RICHMOND | D351: SYKES | G351: RICKETTS | J351: BROWN | M351: MEGSON | O351: LEACH | R351: RIGBY | W351: BRUNSWICK | X351: 2 | Y351: 6 | Z351: 0 | AA351: 357 | AB351: 449 | AC351: 79.510022271714917 | AD351: 8
A352: FOOTSCRAY | D352: HEDLEY | G352: NIELSON | J352: HOOD | L352: A CATTANACH | O352: E STEPHENSON | R352: McKINLEY | W352: PRAHRAN | X352: 1 | Y352: 7 | Z352: 0 | AA352: 218 | AB352: 439 | AC352: 49.66 | AD352: 4
A353: GOALKICKERS | W353: PRESTON | X353: 0 | Y353: 8 | Z353: 0 | AA353: 203 | AB353: 509 | AC353: 39.882121807465616 | AD353: 0
A354: RICHMOND | D354: KNELL 6 | G354: LANG 3 | J354: HUTCHINSON 2 | N354: RICKETTS 2 | Q354: SYKES | S354: MEGSON
A355: FOOTSCRAY
A357: PORT MELBOURNE | C357: 2 | D357: 4 | E357: =C357*6+D357 -> 16 | G357: 3 | H357: 5 | I357: =G357*6+H357 -> 23 | K357: 3 | L357: 9 | M357: =K357*6+L357 -> 27 | O357: 5 | P357: 11 | Q357: =O357*6+P357 -> 41 | S357: ESSENDON
A358: ESSENDON | C358: 2 | D358: 1 | E358: =C358*6+D358 -> 13 | G358: 2 | H358: 2 | I358: =G358*6+H358 -> 14 | K358: 3 | L358: 4 | M358: =K358*6+L358 -> 22 | O358: 5 | P358: 5 | Q358: =O358*6+P358 -> 35 | S358: O'LOUGHLIN
A359: BEST PLAYERS
A360: PORT MELBOURNE | D360: SULLIVAN | G360: CROFT | J360: JACKSON | M360: O'KEEFE | O360: McDONALD | R360: TREGLOWAN
A361: ESSENDON | D361: GIRDWOOD | G361: CHEFFERS | J361: HAMBRIDGE | M361: MARTIN | O361: DUFF | R361: GAVIN
A362: GOALKICKERS
A363: PORT MELBOURNE | D363: CROFT 3 | G363: McDONALD
A364: ESSENDON | D364: DUFF 2 | G364: CHEFFERS
A366: BRUNSWICK | C366: 2 | D366: 2 | E366: =C366*6+D366 -> 14 | G366: 4 | H366: 8 | I366: =G366*6+H366 -> 32 | K366: 4 | L366: 8 | M366: =K366*6+L366 -> 32 | O366: 7 | P366: 10 | Q366: =O366*6+P366 -> 52 | S366: BRUNSWICK
A367: PRAHRAN | C367: 2 | D367: 3 | E367: =C367*6+D367 -> 15 | G367: 3 | H367: 3 | I367: =G367*6+H367 -> 21 | K367: 3 | L367: 9 | M367: =K367*6+L367 -> 27 | O367: 5 | P367: 10 | Q367: =O367*6+P367 -> 40 | S367: ALLEN
A368: BEST PLAYERS
A369: BRUNSWICK | D369: HARRIS | G369: CHASE | J369: WHITFIELD | M369: MULVANEY | O369: STANWAY | R369: ANDREWS
A370: PRAHRAN | D370: G BROWN | G370: PONTIN | J370: LETHBRIDGE | M370: DUPE | O370: TORPEY
A371: GOALKICKERS
A372: BRUNSWICK | D372: BELCHER | G372: RYAN | J372: MULVANEY | N372: COLLISON | Q372: ROBERTSON
A373: PRAHRAN | D373: TORPEY | G373: HEARN | J373: JACKSON
A375: WILLIAMSTOWN | C375: 1 | D375: 1 | E375: =C375*6+D375 -> 7 | G375: 2 | H375: 5 | I375: =G375*6+H375 -> 17 | K375: 3 | L375: 5 | M375: =K375*6+L375 -> 23 | O375: 7 | P375: 8 | Q375: =O375*6+P375 -> 50 | S375: PRESTON
A376: PRESTON | C376: 3 | D376: 6 | E376: =C376*6+D376 -> 24 | G376: 3 | H376: 6 | I376: =G376*6+H376 -> 24 | K376: 6 | L376: 8 | M376: =K376*6+L376 -> 44 | O376: 6 | P376: 8 | Q376: =O376*6+P376 -> 44 | S376: GROGAN
A377: BEST PLAYERS
A378: WILLIAMSTOWN | D378: McKENZIE | G378: LEWIS | J378: BAKER | M378: DAVIS | O378: HALL | R378: HOUGHTON
A379: PRESTON | D379: LANDELLS | G379: S HALL | J379: McCLUMPA | M379: NANKERVIS | O379: BROWN | R379: FLOWERS
A380: GOALKICKERS
A381: WILLIAMSTOWN | D381: OUTEN 3 | G381: McKENZIE 2 | K381: BRITT 2
A382: PRESTON | D382: LANDELLS 3 | H382: WHITE
A384: ROUND 9 | E384: 8TH JULY | J384: WEATHER | N384: STRONG NORTH WEST WIND
C385: 1ST QTR | G385: 2ND QTR | K385: 3RD QTR | O385: FINAL | S385: PLAYED AT
A386: WILLIAMSTOWN | C386: 2 | D386: 0 | E386: =C386*6+D386 -> 12 | G386: 2 | H386: 1 | I386: =G386*6+H386 -> 13 | K386: 3 | L386: 4 | M386: =K386*6+L386 -> 22 | O386: 5 | P386: 6 | Q386: =O386*6+P386 -> 36 | S386: PORT MELB | X386: LADDER | AB386: ROUND | AD386: 9
A387: PORT MELBOURNE | C387: 0 | D387: 1 | E387: =C387*6+D387 -> 1 | G387: 1 | H387: 3 | I387: =G387*6+H387 -> 9 | K387: 3 | L387: 4 | M387: =K387*6+L387 -> 22 | O387: 3 | P387: 6 | Q387: =O387*6+P387 -> 24 | S387: UMPIRE
A388: BEST PLAYERS | S388: ALLEN | W388: TEAM | X388: W | Y388: L | Z388: D | AA388: FOR | AB388: AGST | AC388: % | AD388: PTS
A389: WILLIAMSTOWN | D389: ALLEY | G389: HALL | J389: DAVIS | M389: HOUGHTON | P389: GRAHAM | S389: MATTHEWS
A390: PORT MELBOURNE | D390: J WARD | G390: SULLIVAN | J390: BRENNAN | M390: TREGLOWAN | P390: KNOX | S390: ALLAN | W390: WEST MELBOURNE | X390: 8 | Y390: 1 | Z390: 0 | AA390: 412 | AB390: 204 | AC390: 201.9607843137255 | AD390: 32
A391: GOALKICKERS | W391: WILLIAMSTOWN | X391: 7 | Y391: 2 | Z391: 0 | AA391: 484 | AB391: 270 | AC391: 179.26 | AD391: 28
A392: WILLIAMSTOWN | D392: MATTHEWS | G392: HOUGHTON | J392: JONES | L392: OUTEN | O392: MORTIMER | W392: NORTH MELBOURNE | X392: 7 | Y392: 2 | Z392: 0 | AA392: 429 | AB392: 305 | AC392: 140.65573770491804 | AD392: 28
A393: PORT MELBOURNE | D393: CROFT | G393: COPE | J393: McDONALD | W393: RICHMOND | X393: 6 | Y393: 3 | Z393: 0 | AA393: 611 | AB393: 324 | AC393: 188.58024691358025 | AD393: 24
A395: NORTH MELBOURNE | C395: 0 | D395: 0 | E395: =C395*6+D395 -> 0 | G395: 4 | H395: 3 | I395: =G395*6+H395 -> 27 | K395: 5 | L395: 3 | M395: =K395*6+L395 -> 33 | O395: 7 | P395: 7 | Q395: =O395*6+P395 -> 49 | S395: NORTH MELB | W395: PORT MELBOURNE | X395: 6 | Y395: 3 | Z395: 0 | AA395: 373 | AB395: 294 | AC395: 126.87074829931973 | AD395: 24
A396: BRUNSWICK | C396: 0 | D396: 3 | E396: =C396*6+D396 -> 3 | G396: 1 | H396: 3 | I396: =G396*6+H396 -> 9 | K396: 3 | L396: 4 | M396: =K396*6+L396 -> 22 | O396: 3 | P396: 4 | Q396: =O396*6+P396 -> 22 | S396: ASPINALL | W396: FOOTSCRAY | X396: 4 | Y396: 5 | Z396: 0 | AA396: 338 | AB396: 425 | AC396: 79.529411764705884 | AD396: 16
A397: BEST PLAYERS | W397: ESSENDON | X397: 3 | Y397: 6 | Z397: 0 | AA397: 320 | AB397: 453 | AC397: 70.640176600441507 | AD397: 12
A398: NORTH MELBOURNE | D398: WATSON | G398: M LONDERIGAN | K398: C LONDERIGAN | N398: RAPP | Q398: McCANN | S398: KENNY | W398: BRUNSWICK | X398: 2 | Y398: 7 | Z398: 0 | AA398: 379 | AB398: 498 | AC398: 76.104417670682736 | AD398: 8
A399: BRUNSWICK | D399: CHASE | G399: KENNETT | K399: WILSON | N399: ROBERTSON | Q399: BRAID | S399: LOGAN | W399: PRESTON | X399: 1 | Y399: 8 | Z399: 0 | AA399: 259 | AB399: 546 | AC399: 47.435897435897438 | AD399: 4
A400: GOALKICKERS | W400: PRAHRAN | X400: 1 | Y400: 8 | Z400: 0 | AA400: 238 | AB400: 524 | AC400: 45.42 | AD400: 4
A401: NORTH MELBOURNE | D401: KENNY 2 | G401: CONSIDINE | J401: PRESCOTT | M401: C LONDERIGAN | Q401: WATSON | S401: THORPE
A402: BRUNSWICK | D402: WAGLAND | G402: JACKSON | J402: RYAN
A404: WEST MELBOURNE | C404: 2 | D404: 2 | E404: =C404*6+D404 -> 14 | G404: 4 | H404: 5 | I404: =G404*6+H404 -> 29 | K404: 5 | L404: 7 | M404: =K404*6+L404 -> 37 | O404: 6 | P404: 12 | Q404: =O404*6+P404 -> 48 | S404: ESSENDON
A405: ESSENDON | C405: 0 | D405: 2 | E405: =C405*6+D405 -> 2 | G405: 3 | H405: 4 | I405: =G405*6+H405 -> 22 | K405: 3 | L405: 9 | M405: =K405*6+L405 -> 27 | O405: 4 | P405: 10 | Q405: =O405*6+P405 -> 34 | S405: FREAME
A406: BEST PLAYERS
A407: WEST MELBOURNE | D407: CULLEN | G407: ROURKE | J407: McNAMARA | M407: H GREGORY | P407: NEYLON | S407: FITCHETT
A408: ESSENDON | D408: PAIN | G408: HAMBRIDGE | J408: DUFF | M408: PORTINGALE | P408: GODING | S408: SHELDON
A409: GOALKICKERS
A410: WEST MELBOURNE | D410: NEYLAN 2 | G410: McNAMARA | J410: McCANN | M410: WILLIAMSON | Q410: ROURKE
A411: ESSENDON | D411: GORDON | G411: BOWEN | J411: PAIN | L411: GODING
A413: PRESTON | C413: 5 | D413: 5 | E413: =C413*6+D413 -> 35 | G413: 6 | H413: 5 | I413: =G413*6+H413 -> 41 | K413: 8 | L413: 6 | M413: =K413*6+L413 -> 54 | O413: 8 | P413: 8 | Q413: =O413*6+P413 -> 56 | S413: PRESTON
A414: FOOTSCRAY | C414: 0 | D414: 0 | E414: =C414*6+D414 -> 0 | G414: 3 | H414: 5 | I414: =G414*6+H414 -> 23 | K414: 4 | L414: 5 | M414: =K414*6+L414 -> 29 | O414: 5 | P414: 7 | Q414: =O414*6+P414 -> 37 | S414: WOOLFE
A415: BEST PLAYERS
A416: PRESTON | D416: LANDELLS | G416: S HALL | J416: BROWN | M416: DAVIS | P416: YEOMANS | S416: VICKERY
A417: FOOTSCRAY | D417: MARMO | G417: SCHRAEDER | J417: HOOD | M417: HUGHES | P417: McCARTHY
A418: GOALKICKERS
A419: PRESTON | D419: LANDELLS 4 | H419: STANLAKE | K419: S HALL | N419: WHITE | Q419: D HALL
A420: FOOTSCRAY | D420: MORTIMER | G420: HUGHES | J420: A CATTANACH | N420: SCHRAEDER | R420: LAVER
A422: RICHMOND | C422: 3 | D422: 3 | E422: =C422*6+D422 -> 21 | G422: 5 | H422: 6 | I422: =G422*6+H422 -> 36 | K422: 7 | L422: 7 | M422: =K422*6+L422 -> 49 | O422: 12 | P422: 13 | Q422: =O422*6+P422 -> 85 | S422: TOORAK PARK
A423: PRAHRAN | C423: 2 | D423: 0 | E423: =C423*6+D423 -> 12 | G423: 2 | H423: 0 | I423: =G423*6+H423 -> 12 | K423: 3 | L423: 2 | M423: =K423*6+L423 -> 20 | O423: 3 | P423: 2 | Q423: =O423*6+P423 -> 20 | S423: BAIN
A424: BEST PLAYERS
A425: RICHMOND | D425: EDMONDS | G425: C WILLIAMS | J425: BROWN | M425: LEACH | P425: RICKETTS | S425: CARKEEK
A426: PRAHRAN | D426: TORPEY | G426: DUPE | J426: FRASER | M426: LETHBRIDGE
A427: GOALKICKERS
A428: RICHMOND | D428: KNELL 4 | G428: CARKEEK 3 | J428: HUTCHINSON 2 | N428: LEACH | P428: RICKETTS
A429: PRAHRAN | D429: TORPEY | G429: DUPE | I429: FRASER
A431: ROUND 10 | E431: 15TH JULY | J431: WEATHER | N431: FINE
C432: 1ST QTR | G432: 2ND QTR | K432: 3RD QTR | O432: FINAL | S432: PLAYED AT
A433: RICHMOND | C433: 2 | D433: 3 | E433: =C433*6+D433 -> 15 | G433: 4 | H433: 8 | I433: =G433*6+H433 -> 32 | K433: 7 | L433: 10 | M433: =K433*6+L433 -> 52 | O433: 10 | P433: 15 | Q433: =O433*6+P433 -> 75 | S433: RICHMOND | X433: LADDER | AB433: ROUND | AD433: 10
A434: WEST MELBOURNE | C434: 1 | D434: 2 | E434: =C434*6+D434 -> 8 | G434: 2 | H434: 3 | I434: =G434*6+H434 -> 15 | K434: 2 | L434: 6 | M434: =K434*6+L434 -> 18 | O434: 4 | P434: 9 | Q434: =O434*6+P434 -> 33 | S434: UMPIRE
A435: BEST PLAYERS | S435: ALLEN | W435: TEAM | X435: W | Y435: L | Z435: D | AA435: FOR | AB435: AGST | AC435: % | AD435: PTS
A436: RICHMOND | D436: LEACH | G436: LANG | J436: BROWN | M436: RICKETTS | P436: CLEGHORN | S436: CARKEEK
A437: WEST MELBOURNE | D437: A GREGORY | G437: FRASER | J437: LAXTON | M437: RYAN | P437: McCANN | S437: CULLEN | W437: WILLIAMSTOWN | X437: 8 | Y437: 2 | Z437: 0 | AA437: 544 | AB437: 291 | AC437: 186.94 | AD437: 32
A438: GOALKICKERS | W438: WEST MELBOURNE | X438: 8 | Y438: 2 | Z438: 0 | AA438: 445 | AB438: 279 | AC438: 159.49820788530465 | AD438: 32
A439: RICHMOND | D439: KNELL 3 | G439: LITHGOW 3 | J439: LEACH | L439: CHESWASS | O439: RICKETTS | R439: CLEGHORN | W439: NORTH MELBOURNE | X439: 8 | Y439: 2 | Z439: 0 | AA439: 483 | AB439: 334 | AC439: 144.61077844311376 | AD439: 32
A440: WEST MELBOURNE | D440: McCANN 2 | G440: A GREGORY | K440: RYAN | W440: RICHMOND | X440: 7 | Y440: 3 | Z440: 0 | AA440: 686 | AB440: 357 | AC440: 192.15686274509804 | AD440: 28
A442: NORTH MELBOURNE | C442: 4 | D442: 2 | E442: =C442*6+D442 -> 26 | G442: 4 | H442: 4 | I442: =G442*6+H442 -> 28 | K442: 6 | L442: 11 | M442: =K442*6+L442 -> 47 | O442: 7 | P442: 12 | Q442: =O442*6+P442 -> 54 | S442: NORTH MELB | W442: PORT MELBOURNE | X442: 6 | Y442: 4 | Z442: 0 | AA442: 402 | AB442: 348 | AC442: 115.51724137931035 | AD442: 24
A443: PORT MELBOURNE | C443: 1 | D443: 1 | E443: =C443*6+D443 -> 7 | G443: 3 | H443: 3 | I443: =G443*6+H443 -> 21 | K443: 4 | L443: 4 | M443: =K443*6+L443 -> 28 | O443: 4 | P443: 5 | Q443: =O443*6+P443 -> 29 | S443: WOOLFE | W443: ESSENDON | X443: 4 | Y443: 6 | Z443: 0 | AA443: 400 | AB443: 476 | AC443: 84.033613445378151 | AD443: 16
A444: BEST PLAYERS | W444: FOOTSCRAY | X444: 4 | Y444: 6 | Z444: 0 | AA444: 366 | AB444: 465 | AC444: 78.709677419354833 | AD444: 16
A445: NORTH MELBOURNE | D445: MORRISON | G445: M LONDERIGAN | J445: C LONDERIGAN | N445: WATSON | P445: GROVES | R445: PRESCOTT | W445: BRUNSWICK | X445: 3 | Y445: 7 | Z445: 0 | AA445: 419 | AB445: 526 | AC445: 79.657794676806077 | AD445: 12
A446: PORT MELBOURNE | D446: KNOX | G446: WARD | J446: COPE | M446: O'KEEFE | P446: SULLIVAN | R446: TREGLOWAN | W446: PRESTON | X446: 1 | Y446: 9 | Z446: 0 | AA446: 282 | AB446: 626 | AC446: 45.047923322683708 | AD446: 4
A447: GOALKICKERS | W447: PRAHRAN | X447: 1 | Y447: 9 | Z447: 0 | AA447: 259 | AB447: 584 | AC447: 44.35 | AD447: 4
A448: NORTH MELBOURNE | D448: PRESCOTT 5 | H448: McCANN 2
A449: PORT MELBOURNE | D449: READ | F449: McDONALD | J449: CROFT | M449: YATES
A451: ESSENDON | C451: 2 | D451: 2 | E451: =C451*6+D451 -> 14 | G451: 5 | H451: 6 | I451: =G451*6+H451 -> 36 | K451: 11 | L451: 8 | M451: =K451*6+L451 -> 74 | O451: 12 | P451: 8 | Q451: =O451*6+P451 -> 80 | S451: PRESTON
A452: PRESTON | C452: 2 | D452: 2 | E452: =C452*6+D452 -> 14 | G452: 2 | H452: 2 | I452: =G452*6+H452 -> 14 | K452: 3 | L452: 4 | M452: =K452*6+L452 -> 22 | O452: 3 | P452: 5 | Q452: =O452*6+P452 -> 23 | S452: ASPINALL
A453: BEST PLAYERS
A454: ESSENDON | D454: HORDERN | G454: HAMBRIDGE | J454: SHELDON | M454: GAVIN | P454: GORDON | S454: MARTIN
A455: PRESTON | D455: D HALL | G455: WHITE | J455: VICKERY | M455: YEOMANS | P455: BARKER | S455: McCLUMPA
A456: GOALKICKERS
A457: ESSENDON | D457: MAKIN 3 | G457: GORDON 3 | J457: GODING 2 | M457: SHELDON 2 | P457: HORDERN | S457: STEVENS
A458: PRESTON | D458: LANDELLS 2 | H458: WARNE
A460: BRUNSWICK | C460: 1 | D460: 3 | E460: =C460*6+D460 -> 9 | G460: 3 | H460: 6 | I460: =G460*6+H460 -> 24 | K460: 3 | L460: 9 | M460: =K460*6+L460 -> 27 | O460: 5 | P460: 10 | Q460: =O460*6+P460 -> 40 | S460: BRUNSWICK
A461: FOOTSCRAY | C461: 2 | D461: 1 | E461: =C461*6+D461 -> 13 | G461: 3 | H461: 1 | I461: =G461*6+H461 -> 19 | K461: 3 | L461: 5 | M461: =K461*6+L461 -> 23 | O461: 3 | P461: 10 | Q461: =O461*6+P461 -> 28 | S461: FREAME
A462: BEST PLAYERS
A463: BRUNSWICK | D463: CHASE | G463: COBURN | J463: KENNETT | M463: LONGMUIR | P463: WHITFIELD | S463: BELCHER
A464: FOOTSCRAY | D464: MARMO | G464: HUGHES | J464: SERGEANT | M464: MORTIMER | P464: SCHRAEDER | S464: HEDLEY
A465: GOALKICKERS
A466: BRUNSWICK | D466: RYAN 2 | G466: WAGLAND | J466: McNAMARA | M466: BELCHER
A467: FOOTSCRAY | D467: SERGEANT | G467: SCHRAEDER | J467: HUGHES
A469: WILLIAMSTOWN | C469: 1 | D469: 4 | E469: =C469*6+D469 -> 10 | G469: 3 | H469: 5 | I469: =G469*6+H469 -> 23 | K469: 7 | L469: 7 | M469: =K469*6+L469 -> 49 | O469: 8 | P469: 12 | Q469: =O469*6+P469 -> 60 | S469: TOORAK PARK
A470: PRAHRAN | C470: 0 | D470: 2 | E470: =C470*6+D470 -> 2 | G470: 2 | H470: 3 | I470: =G470*6+H470 -> 15 | K470: 2 | L470: 5 | M470: =K470*6+L470 -> 17 | O470: 2 | P470: 9 | Q470: =O470*6+P470 -> 21 | S470: GROGAN
A471: BEST PLAYERS
A472: WILLIAMSTOWN | D472: BUTTERFIELD | G472: JONES | J472: DICK | M472: HALL | P472: MATTHEWS | S472: KENNEDY
A473: PRAHRAN | D473: TORPEY | G473: PONTIN | J473: G BROWN | M473: T BROWN | P473: LETHBRIDGE | S473: SWIFT
A474: GOALKICKERS
A475: WILLIAMSTOWN | D475: MORTIMER 2 | H475: KENNEDY 2 | K475: MATTHEWS | N475: HALL | P475: JONES | R475: BUTTERFIELD
A476: PRAHRAN | D476: TAYLOR | G476: TORPEY
A478: ROUND 11 | E478: 22ND JULY | J478: WEATHER | N478: NORTH WIND HEAVY RAIN AFTER 1/2 TIME
C479: 1ST QTR | G479: 2ND QTR | K479: 3RD QTR | O479: FINAL | S479: PLAYED AT
A480: NORTH MELBOURNE | C480: 3 | D480: 6 | E480: =C480*6+D480 -> 24 | G480: 3 | H480: 7 | I480: =G480*6+H480 -> 25 | K480: 5 | L480: 11 | M480: =K480*6+L480 -> 41 | O480: 5 | P480: 12 | Q480: =O480*6+P480 -> 42 | S480: NORTH MELB | X480: LADDER | AB480: ROUND | AD480: 11
A481: RICHMOND | C481: 0 | D481: 1 | E481: =C481*6+D481 -> 1 | G481: 2 | H481: 4 | I481: =G481*6+H481 -> 16 | K481: 2 | L481: 4 | M481: =K481*6+L481 -> 16 | O481: 4 | P481: 7 | Q481: =O481*6+P481 -> 31 | S481: UMPIRE
A482: BEST PLAYERS | S482: FREAME | W482: TEAM | X482: W | Y482: L | Z482: D | AA482: FOR | AB482: AGST | AC482: % | AD482: PTS
A483: NORTH MELBOURNE | D483: MCDERMOTT | G483: GROVES | J483: RAPP | M483: CONSIDINE | P483: CARLTON | S483: SMITH
A484: RICHMOND | D484: LANG | G484: LEACH | J484: BROWN | M484: C WILLIAMS | P484: RICKETTS | S484: CARKEEK | W484: WILLIAMSTOWN | X484: 9 | Y484: 2 | Z484: 0 | AA484: 621 | AB484: 316 | AC484: 196.52 | AD484: 36
A485: GOALKICKERS | W485: WEST MELBOURNE | X485: 9 | Y485: 2 | Z485: 0 | AA485: 523 | AB485: 308 | AC485: 169.80519480519482 | AD485: 36
A486: NORTH MELBOURNE | D486: PRESCOTT | G486: GROVES | J486: MCCANN | M486: RAPP | O486: CONSIDINE | W486: NORTH MELBOURNE | X486: 9 | Y486: 2 | Z486: 0 | AA486: 525 | AB486: 365 | AC486: 143.83561643835617 | AD486: 36
A487: RICHMOND | D487: LANG 2 | G487: KNELL | J487: MEGSON | W487: RICHMOND | X487: 7 | Y487: 4 | Z487: 0 | AA487: 717 | AB487: 399 | AC487: 179.69924812030075 | AD487: 28
A489: ESSENDON | C489: 0 | D489: 1 | E489: =C489*6+D489 -> 1 | G489: 3 | H489: 5 | I489: =G489*6+H489 -> 23 | K489: 3 | L489: 6 | M489: =K489*6+L489 -> 24 | O489: 6 | P489: 16 | Q489: =O489*6+P489 -> 52 | S489: ESSENDON | W489: PORT MELBOURNE | X489: 7 | Y489: 4 | Z489: 0 | AA489: 432 | AB489: 360 | AC489: 120 | AD489: 28
A490: FOOTSCRAY | C490: 1 | D490: 3 | E490: =C490*6+D490 -> 9 | G490: 1 | H490: 3 | I490: =G490*6+H490 -> 9 | K490: 4 | L490: 8 | M490: =K490*6+L490 -> 32 | O490: 4 | P490: 8 | Q490: =O490*6+P490 -> 32 | S490: GROGAN | W490: ESSENDON | X490: 5 | Y490: 6 | Z490: 0 | AA490: 452 | AB490: 508 | AC490: 88.976377952755911 | AD490: 20
A491: BEST PLAYERS | W491: FOOTSCRAY | X491: 4 | Y491: 7 | Z491: 0 | AA491: 398 | AB491: 517 | AC491: 76.9825918762089 | AD491: 16
A492: ESSENDON | D492: ALVES | G492: GAVIN | J492: HORDERN | M492: HAMBRIDGE | P492: GIRDWOOD | S492: MARTIN | W492: BRUNSWICK | X492: 3 | Y492: 8 | Z492: 0 | AA492: 444 | AB492: 603 | AC492: 73.631840796019901 | AD492: 12
A493: FOOTSCRAY | D493: HUGHES | G493: SCHRAEDER | J493: MITCHELL | M493: E STEPHENSON | P493: McKINLEY | S493: MORTIMER | W493: PRESTON | X493: 1 | Y493: 10 | Z493: 0 | AA493: 311 | AB493: 704 | AC493: 44.176136363636367 | AD493: 4
A494: GOALKICKERS | W494: PRAHRAN | X494: 1 | Y494: 10 | Z494: 0 | AA494: 271 | AB494: 614 | AC494: 44.14 | AD494: 4
A495: ESSENDON | D495: STEVENS 3 | H495: MAKIN 2 | K495: PAIN
A496: FOOTSCRAY | D496: MITCHELL 2 | H496: J STEPHENSON 2
A498: PORT MELBOURNE | C498: 2 | D498: 5 | E498: =C498*6+D498 -> 17 | G498: 2 | H498: 6 | I498: =G498*6+H498 -> 18 | K498: 3 | L498: 11 | M498: =K498*6+L498 -> 29 | O498: 3 | P498: 12 | Q498: =O498*6+P498 -> 30 | S498: PORT MELB
A499: PRAHRAN | C499: 0 | D499: 0 | E499: =C499*6+D499 -> 0 | G499: 1 | H499: 3 | I499: =G499*6+H499 -> 9 | K499: 1 | L499: 4 | M499: =K499*6+L499 -> 10 | O499: 1 | P499: 6 | Q499: =O499*6+P499 -> 12 | S499: ASPINALL
A500: BEST PLAYERS
A501: PORT MELBOURNE | D501: SULLIVAN | G501: INGHAM | J501: KNOX | M501: TREGLOWAN | P501: McCOLL | S501: COPE
A502: PRAHRAN | D502: ROBERTS | G502: TORPEY | J502: MAHER | M502: BROWN | P502: SWIFT | S502: NEILL
A503: GOALKICKERS
A504: PORT MELBOURNE | D504: CROFT | G504: TREGLOWAN | K504: CURTIS
A505: PRAHRAN | D505: FRASER
A507: WILLIAMSTOWN | C507: 2 | D507: 2 | E507: =C507*6+D507 -> 14 | G507: 5 | H507: 4 | I507: =G507*6+H507 -> 34 | K507: 9 | L507: 5 | M507: =K507*6+L507 -> 59 | O507: 12 | P507: 5 | Q507: =O507*6+P507 -> 77 | S507: WILLIAMSTOWN
A508: BRUNSWICK | C508: 0 | D508: 3 | E508: =C508*6+D508 -> 3 | G508: 1 | H508: 6 | I508: =G508*6+H508 -> 12 | K508: 2 | L508: 6 | M508: =K508*6+L508 -> 18 | O508: 3 | P508: 7 | Q508: =O508*6+P508 -> 25 | S508: WOOLFE
A509: BEST PLAYERS
A510: WILLIAMSTOWN | D510: MORTIMER | G510: ALLEY | J510: HALL | M510: DAVIS | P510: DICK | S510: MANDERSON
A511: BRUNSWICK | D511: BELCHER | G511: ANDREWS | J511: LONGMUIR | M511: MULVANEY | P511: CHASE | S511: KENNETT
A512: GOALKICKERS
A513: WILLIAMSTOWN | D513: MORTIMER 9 | H513: MATTHEWS 2 | L513: JONES
A514: BRUNSWICK | D514: MULVANEY | H514: BELCHER | L514: LONGMUIR
A516: WEST MELBOURNE | C516: 4 | D516: 2 | E516: =C516*6+D516 -> 26 | G516: 7 | H516: 3 | I516: =G516*6+H516 -> 45 | K516: 12 | L516: 4 | M516: =K516*6+L516 -> 76 | O516: 12 | P516: 6 | Q516: =O516*6+P516 -> 78 | S516: PRESTON
A517: PRESTON | C517: 1 | D517: 0 | E517: =C517*6+D517 -> 6 | G517: 2 | H517: 1 | I517: =G517*6+H517 -> 13 | K517: 2 | L517: 2 | M517: =K517*6+L517 -> 14 | O517: 4 | P517: 5 | Q517: =O517*6+P517 -> 29 | S517: O'LOUGHLIN
A518: BEST PLAYERS
A519: WEST MELBOURNE | D519: H GREGORY | G519: A GREGORY | J519: MADDEN | M519: CULLEN | P519: LAXTON | S519: ROURKE
A520: PRESTON | D520: YEOMANS | G520: S HALL | J520: HOWES | M520: STANLAKE | P520: LANDELLS | S520: WHITE
A521: GOALKICKERS
A522: WEST MELBOURNE | D522: RYAN 4 | G522: McCANN 4 | K522: McNAMARA 2 | O522: GUEST | R522: FRASER
A523: PRESTON | D523: LANDELLS | G523: BOOTH | K523: ROBBINS | O523: WHITE
A525: ROUND 12 | E525: 29TH JULY | J525: WEATHER | N525: SOUTH WEST WIND RAIN
C526: 1ST QTR | G526: 2ND QTR | K526: 3RD QTR | O526: FINAL | S526: PLAYED AT
A527: NORTH MELBOURNE | C527: 1 | D527: 0 | E527: =C527*6+D527 -> 6 | G527: 1 | H527: 1 | I527: =G527*6+H527 -> 7 | K527: 2 | L527: 5 | M527: =K527*6+L527 -> 17 | O527: 2 | P527: 7 | Q527: =O527*6+P527 -> 19 | S527: ESSENDON | X527: LADDER | AB527: ROUND | AD527: 12
A528: ESSENDON | C528: 1 | D528: 3 | E528: =C528*6+D528 -> 9 | G528: 1 | H528: 3 | I528: =G528*6+H528 -> 9 | K528: 1 | L528: 5 | M528: =K528*6+L528 -> 11 | O528: 1 | P528: 5 | Q528: =O528*6+P528 -> 11 | S528: UMPIRE
A529: BEST PLAYERS | S529: O'LOUGHLIN | W529: TEAM | X529: W | Y529: L | Z529: D | AA529: FOR | AB529: AGST | AC529: % | AD529: PTS
A530: NORTH MELBOURNE | D530: GROVES | G530: CARLTON | J530: CONSIDINE | M530: C LONDERIGAN | P530: McCANN | S530: McDERMOTT
A531: ESSENDON | D531: GAVIN | G531: PAIN | J531: DUFF | M531: HAMBRIDGE | P531: GIRDWOOD | S531: MARTIN | W531: WEST MELBOURNE | X531: 10 | Y531: 2 | Z531: 0 | AA531: 561 | AB531: 324 | AC531: 173.14814814814815 | AD531: 40
A532: GOALKICKERS | W532: NORTH MELBOURNE | X532: 10 | Y532: 2 | Z532: 0 | AA532: 544 | AB532: 376 | AC532: 144.68085106382978 | AD532: 40
A533: NORTH MELBOURNE | D533: McCANN 2 | W533: WILLIAMSTOWN | X533: 9 | Y533: 3 | Z533: 0 | AA533: 639 | AB533: 347 | AC533: 184.15 | AD533: 36
A534: ESSENDON | D534: MAKIN | W534: RICHMOND | X534: 8 | Y534: 4 | Z534: 0 | AA534: 776 | AB534: 413 | AC534: 187.89346246973366 | AD534: 32
A536: FOOTSCRAY | C536: 3 | D536: 6 | E536: =C536*6+D536 -> 24 | G536: 3 | H536: 6 | I536: =G536*6+H536 -> 24 | K536: 4 | L536: 7 | M536: =K536*6+L536 -> 31 | O536: 4 | P536: 7 | Q536: =O536*6+P536 -> 31 | S536: FOOTSCRAY | W536: PORT MELBOURNE | X536: 8 | Y536: 4 | Z536: 0 | AA536: 530 | AB536: 376 | AC536: 140.95744680851064 | AD536: 32
A537: WILLIAMSTOWN | C537: 0 | D537: 0 | E537: =C537*6+D537 -> 0 | G537: 1 | H537: 6 | I537: =G537*6+H537 -> 12 | K537: 1 | L537: 6 | M537: =K537*6+L537 -> 12 | O537: 2 | P537: 6 | Q537: =O537*6+P537 -> 18 | S537: FREAME | W537: ESSENDON | X537: 5 | Y537: 7 | Z537: 0 | AA537: 463 | AB537: 527 | AC537: 87.855787476280838 | AD537: 20
A538: BEST PLAYERS | W538: FOOTSCRAY | X538: 5 | Y538: 7 | Z538: 0 | AA538: 429 | AB538: 535 | AC538: 80.186915887850461 | AD538: 20
A539: FOOTSCRAY | D539: HUGHES | G539: MARMO | J539: HEDLEY | M539: HINCH | P539: McCARHTY | S539: McKINLEY | W539: BRUNSWICK | X539: 3 | Y539: 9 | Z539: 0 | AA539: 460 | AB539: 701 | AC539: 65.62054208273895 | AD539: 12
A540: WILLIAMSTOWN | D540: ALLEY | G540: DAVIS | J540: HOUGHTON | M540: BAKER | P540: HALL | S540: JONES | W540: PRAHRAN | X540: 1 | Y540: 11 | Z540: 0 | AA540: 287 | AB540: 652 | AC540: 44.02 | AD540: 4
A541: GOALKICKERS | W541: PRESTON | X541: 1 | Y541: 11 | Z541: 0 | AA541: 325 | AB541: 763 | AC541: 42.595019659239846 | AD541: 4
A542: FOOTSCRAY | D542: HUGHES 2 | G542: J STEPHENSON | K542: A CATTANACH
A543: WILLIAMSTOWN | D543: MORTIMER 2
A545: PORT MELB | C545: 5 | D545: 3 | E545: =C545*6+D545 -> 33 | G545: 6 | H545: 6 | I545: =G545*6+H545 -> 42 | K545: 10 | L545: 11 | M545: =K545*6+L545 -> 71 | O545: 14 | P545: 14 | Q545: =O545*6+P545 -> 98 | S545: PORT MELB
A546: BRUNSWICK | C546: 1 | D546: 0 | E546: =C546*6+D546 -> 6 | G546: 2 | H546: 4 | I546: =G546*6+H546 -> 16 | K546: 2 | L546: 4 | M546: =K546*6+L546 -> 16 | O546: 2 | P546: 4 | Q546: =O546*6+P546 -> 16 | S546: ALLEN
A547: BEST PLAYERS
A548: PORT MELB | D548: YATES | G548: CURTIS | J548: KNOX | L548: COPE | O548: CROFT | R548: BRENNAN
A549: BRUNSWICK | D549: McNAMARA | G549: SIMMONDS | J549: KENNETT | L549: BRAID | O549: CHASE | R549: BELCHER
A550: GOALKICKERS
A551: PORT MELB | D551: CROFT 7 | G551: McDONALD 2 | K551: YATES | M551: GARBUTT | P551: BRENNAN | S551: O'KEEFE | V551: HILL
A552: BRUNSWICK | D552: SIMMONDS | G552: WAGLAND
A554: RICHMOND | C554: 4 | D554: 3 | E554: =C554*6+D554 -> 27 | G554: 4 | H554: 5 | I554: =G554*6+H554 -> 29 | K554: 7 | L554: 11 | M554: =K554*6+L554 -> 53 | O554: 8 | P554: 11 | Q554: =O554*6+P554 -> 59 | S554: RICHMOND
A555: PRESTON | C555: 1 | D555: 1 | E555: =C555*6+D555 -> 7 | G555: 1 | H555: 4 | I555: =G555*6+H555 -> 10 | K555: 1 | L555: 4 | M555: =K555*6+L555 -> 10 | O555: 1 | P555: 8 | Q555: =O555*6+P555 -> 14 | S555: WOOLFE
A556: BEST PLAYERS
A557: RICHMOND | D557: CARKEEK | G557: LEACH | J557: MEGSON | M557: SYKES | O557: CLEGHORN | R557: RICKETTS
A558: PRESTON | D558: S HALL | G558: P HALL | J558: GILBERT | M558: WHITE | O558: YEOMANS | R558: BROWN
A559: GOALKICKERS
A560: RICHMOND | D560: KNELL 2 | G560: McDONALD 2 | K560: LITHGOW 2 | O560: LEACH | Q560: MEGSON
A561: PRESTON | D561: WHITE
A563: WEST MELBOURNE | C563: 1 | D563: 5 | E563: =C563*6+D563 -> 11 | G563: 1 | H563: 5 | I563: =G563*6+H563 -> 11 | K563: 4 | L563: 6 | M563: =K563*6+L563 -> 30 | O563: 5 | P563: 8 | Q563: =O563*6+P563 -> 38 | S563: NORTH MELB
A564: PRAHRAN | C564: 1 | D564: 0 | E564: =C564*6+D564 -> 6 | G564: 1 | H564: 1 | I564: =G564*6+H564 -> 7 | K564: 1 | L564: 2 | M564: =K564*6+L564 -> 8 | O564: 2 | P564: 4 | Q564: =O564*6+P564 -> 16 | S564: ASPINALL
A565: BEST PLAYERS
A566: WEST MELBOURNE | D566: ROURKE | G566: ARMSTRONG | J566: A GREGORY | M566: McCANN | O566: H GREGORY | R566: RANKIN
A567: PRAHRAN | D567: PONTIN | G567: LETHBRIDGE | J567: TORPEY | M567: G BROWN | O567: NEILL | R567: ROBERTS
A568: GOALKICKERS
A569: WEST MELBOURNE | D569: McCANN 3 | H569: MINTO | K569: NEYLEN
A570: PRAHRAN | D570: AYLING | H570: TAYLOR
A572: ROUND 13 | E572: 5TH AUGUST | J572: WEATHER | N572: SOUTH BREEZE SHOWERS
C573: 1ST QTR | G573: 2ND QTR | K573: 3RD QTR | O573: FINAL | S573: PLAYED AT
A574: WILLIAMSTOWN | C574: 1 | D574: 5 | E574: =C574*6+D574 -> 11 | G574: 2 | H574: 5 | I574: =G574*6+H574 -> 17 | K574: 6 | L574: 11 | M574: =K574*6+L574 -> 47 | O574: 6 | P574: 11 | Q574: =O574*6+P574 -> 47 | S574: WILLIAMSTOWN | X574: LADDER | AB574: ROUND | AD574: 13
A575: ESSENDON | C575: 0 | D575: 1 | E575: =C575*6+D575 -> 1 | G575: 3 | H575: 4 | I575: =G575*6+H575 -> 22 | K575: 3 | L575: 4 | M575: =K575*6+L575 -> 22 | O575: 5 | P575: 8 | Q575: =O575*6+P575 -> 38 | S575: UMPIRE
A576: BEST PLAYERS | S576: ALLEN | W576: TEAM | X576: W | Y576: L | Z576: D | AA576: FOR | AB576: AGST | AC576: % | AD576: PTS
A577: WILLIAMSTOWN | D577: DICK | G577: McKENZIE | J577: OUTEN | M577: KENNEDY | P577: MATTHEWS | S577: WOODS
A578: ESSENDON | D578: BARLOW | G578: CALLANAN | J578: MARTIN | M578: McNAMARA | P578: O'SHEA | S578: SHELDON | W578: NORTH MELBOURNE | X578: 12 | Y578: 2 | Z578: 0 | AA578: 683 | AB578: 408 | AC578: 167.40196078431373 | AD578: 48
A579: GOALKICKERS | W579: WEST MELBOURNE | X579: 11 | Y579: 3 | Z579: 0 | AA579: 620 | AB579: 396 | AC579: 156.56565656565655 | AD579: 44
A580: WILLIAMSTOWN | D580: LEWIS 2 | G580: JONES 2 | J580: KENNEDY | M580: HALL | W580: RICHMOND | X580: 10 | Y580: 4 | Z580: 0 | AA580: 918 | AB580: 475 | AC580: 193.26315789473685 | AD580: 40
A581: ESSENDON | D581: MAKIN | G581: STEVENS | J581: SHELDON | M581: GIRDWOOD | P581: GRAHAM | W581: WILLIAMSTOWN | X581: 10 | Y581: 4 | Z581: 0 | AA581: 719 | AB581: 449 | AC581: 160.13 | AD581: 40
A583: WEST MELBOURNE | C583: 0 | D583: 0 | E583: =C583*6+D583 -> 0 | G583: 2 | H583: 4 | I583: =G583*6+H583 -> 16 | K583: 3 | L583: 4 | M583: =K583*6+L583 -> 22 | O583: 6 | P583: 5 | Q583: =O583*6+P583 -> 41 | S583: NORTH MELB | W583: PORT MELBOURNE | X583: 10 | Y583: 4 | Z583: 0 | AA583: 650 | AB583: 424 | AC583: 153.30188679245282 | AD583: 40
A584: FOOTSCRAY | C584: 1 | D584: 3 | E584: =C584*6+D584 -> 9 | G584: 1 | H584: 4 | I584: =G584*6+H584 -> 10 | K584: 2 | L584: 5 | M584: =K584*6+L584 -> 17 | O584: 3 | P584: 5 | Q584: =O584*6+P584 -> 23 | S584: GROGAN | W584: ESSENDON | X584: 6 | Y584: 8 | Z584: 0 | AA584: 582 | AB584: 616 | AC584: 94.480519480519476 | AD584: 24
A585: BEST PLAYERS | W585: FOOTSCRAY | X585: 5 | Y585: 9 | Z585: 0 | AA585: 465 | AB585: 652 | AC585: 71.319018404907979 | AD585: 20
A586: WEST MELBOURNE | D586: ARMSTRONG | G586: A GREGORY | J586: RANKIN | M586: MINTO | P586: McNAMARA | S586: MCCANN | W586: BRUNSWICK | X586: 4 | Y586: 10 | Z586: 0 | AA586: 554 | AB586: 783 | AC586: 70.753512132822479 | AD586: 16
A587: FOOTSCRAY | D587: MCCARTHY | G587: CLARKE | J587: E STEPHENSON | M587: A CATTANACH | P587: MCKINLEY | S587: HEDLEY | W587: PRAHRAN | X587: 1 | Y587: 13 | Z587: 0 | AA587: 348 | AB587: 796 | AC587: 43.72 | AD587: 4
A588: GOALKICKERS | W588: PRESTON | X588: 1 | Y588: 13 | Z588: 0 | AA588: 359 | AB588: 899 | AC588: 39.933259176863181 | AD588: 4
A589: WEST MELBOURNE | D589: MCCANN 2 | G589: RYAN 2 | J589: McNAMARA | N589: ARMSTRONG
A590: FOOTSCRAY | D590: HOOD | G590: MOORE | J590: A CATTANACH
A592: RICHMOND | C592: 4 | D592: 11 | E592: =C592*6+D592 -> 35 | G592: 4 | H592: 12 | I592: =G592*6+H592 -> 36 | K592: 9 | L592: 18 | M592: =K592*6+L592 -> 72 | O592: 10 | P592: 18 | Q592: =O592*6+P592 -> 78 | S592: BRUNSWICK
A593: BRUNSWICK | C593: 0 | D593: 0 | E593: =C593*6+D593 -> 0 | G593: 1 | H593: 3 | I593: =G593*6+H593 -> 9 | K593: 1 | L593: 3 | M593: =K593*6+L593 -> 9 | O593: 4 | P593: 5 | Q593: =O593*6+P593 -> 29 | S593: ASPINALL
A594: BEST PLAYERS
A595: RICHMOND | D595: LUFF | G595: EDMONDS | J595: SMITH | M595: BOWNAS | P595: LITHGOW | S595: HUTCHINSON
A596: BRUNSWICK | D596: STANWAY | G596: COBURN | J596: ANDREWS | M596: BRAID | P596: HARRIS | S596: MULVANEY
A597: GOALKICKERS
A598: RICHMOND | D598: McDONALD 4 | H598: LANG 3 | K598: SULLIVAN | N598: BROWN | Q598: HUTCHINSON
A599: BRUNSWICK | D599: STANWAY (2) | H599: BRAID | K599: PRATT
A601: PORT MELBOURNE | C601: 5 | D601: 4 | E601: =C601*6+D601 -> 34 | G601: 5 | H601: 4 | I601: =G601*6+H601 -> 34 | K601: 9 | L601: 11 | M601: =K601*6+L601 -> 65 | O601: 10 | P601: 11 | Q601: =O601*6+P601 -> 71 | S601: PRESTON
A602: PRESTON | C602: 0 | D602: 0 | E602: =C602*6+D602 -> 0 | G602: 2 | H602: 1 | I602: =G602*6+H602 -> 13 | K602: 2 | L602: 1 | M602: =K602*6+L602 -> 13 | O602: 4 | P602: 6 | Q602: =O602*6+P602 -> 30 | S602: O'LOUGHLIN
A603: BEST PLAYERS
A604: PORT MELBOURNE | D604: HEENEY | G604: YATES | J604: McCOLL | M604: CROFT | P604: BRENNAN | S604: JACKSON
A605: PRESTON | D605: McCLUMPA | G605: ROBBINS | J605: HOWES | M605: S HALL | P605: P HALL | S605: STANLAKE
A606: GOALKICKERS
A607: PORT MELBOURNE | D607: CROFT 3 | G607: McDONALD 3 | K607: TREGLOWAN 2 | O607: READ | Q607: GARBUTT
A608: PRESTON | D608: LANDELLS | G608: McCLUMPA | J608: P HALL | M608: D HALL
A610: NORTH MELBOURNE | C610: 1 | D610: 0 | E610: =C610*6+D610 -> 6 | G610: 2 | H610: 8 | I610: =G610*6+H610 -> 20 | K610: 2 | L610: 10 | M610: =K610*6+L610 -> 22 | O610: 8 | P610: 15 | Q610: =O610*6+P610 -> 63 | S610: TOORAK PARK
A611: PRAHRAN | C611: 1 | D611: 3 | E611: =C611*6+D611 -> 9 | G611: 1 | H611: 3 | I611: =G611*6+H611 -> 9 | K611: 2 | L611: 7 | M611: =K611*6+L611 -> 19 | O611: 2 | P611: 7 | Q611: =O611*6+P611 -> 19 | S611: WOOLFE
A612: BEST PLAYERS
A613: NORTH MELBOURNE | D613: SMITH | G613: M LONDERIGAN | J613: JOHNSTON | M613: GROVES | P613: McCANN | S613: RAPP
A614: PRAHRAN | D614: PONTIN | G614: DUPE | J614: G BROWN | M614: AYLING | P614: HAYSOM | S614: NEILL
A615: GOALKICKERS
A616: NORTH MELBOURNE | D616: KENNY 2 | G616: M LONDERIGAN | K616: ROLENT | N616: KEATING | Q616: PRESCOTT | T616: McCANN | W616: GROVES
A617: PRAHRAN | D617: HAYSOM | G617: McRITCHIE
A619: ROUND 14 | E619: 12TH AUGUST | J619: WEATHER | N619: NORTH WEST WIND
C620: 1ST QTR | G620: 2ND QTR | K620: 3RD QTR | O620: FINAL | S620: PLAYED AT
A621: RICHMOND | C621: 1 | D621: 3 | E621: =C621*6+D621 -> 9 | G621: 3 | H621: 5 | I621: =G621*6+H621 -> 23 | K621: 6 | L621: 10 | M621: =K621*6+L621 -> 46 | O621: 9 | P621: 10 | Q621: =O621*6+P621 -> 64 | S621: RICHMOND | X621: LADDER | AB621: ROUND | AD621: 14
A622: WILLIAMSTOWN | C622: 2 | D622: 2 | E622: =C622*6+D622 -> 14 | G622: 3 | H622: 2 | I622: =G622*6+H622 -> 20 | K622: 3 | L622: 2 | M622: =K622*6+L622 -> 20 | O622: 5 | P622: 3 | Q622: =O622*6+P622 -> 33 | S622: UMPIRE
A623: BEST PLAYERS | S623: ALLEN | W623: TEAM | X623: W | Y623: L | Z623: D | AA623: FOR | AB623: AGST | AC623: % | AD623: PTS
A624: RICHMOND | D624: MEGSON | G624: LEACH | J624: C WILLIAMS | M624: CARKEEK | P624: LUFF | R624: RUDDOCK
A625: WILLIAMSTOWN | D625: McKENZIE | G625: DAVIS | J625: KENNEDY | M625: ALLEY | P625: HALL | R625: JONES | W625: NORTH MELBOURNE | X625: 11 | Y625: 2 | Z625: 0 | AA625: 620 | AB625: 389 | AC625: 159.38 | AD625: 44
A626: GOALKICKERS | W626: WEST MELBOURNE | X626: 10 | Y626: 3 | Z626: 0 | AA626: 579 | AB626: 373 | AC626: 155.23 | AD626: 40
A627: RICHMOND | D627: CARKEEK 3 | H627: HUTCHINSON 2 | L627: RIGBY | N627: RICKETTS | Q627: BROWN | S627: KNELL | W627: RICHMOND | X627: 9 | Y627: 4 | Z627: 0 | AA627: 840 | AB627: 446 | AC627: 188.34 | AD627: 36
A628: WILLIAMSTOWN | D628: MORTIMER 2 | H628: KENNEDY 2 | L628: ALLEY | W628: WILLIAMSTOWN | X628: 9 | Y628: 4 | Z628: 0 | AA628: 672 | AB628: 411 | AC628: 163.5 | AD628: 36
A630: PORT MELBOURNE | C630: 1 | D630: 4 | E630: =C630*6+D630 -> 10 | G630: 2 | H630: 5 | I630: =G630*6+H630 -> 17 | K630: 5 | L630: 6 | M630: =K630*6+L630 -> 36 | O630: 7 | P630: 7 | Q630: =O630*6+P630 -> 49 | S630: PORT MELB | W630: PORT MELBOURNE | X630: 9 | Y630: 4 | Z630: 0 | AA630: 579 | AB630: 394 | AC630: 146.95 | AD630: 36
A631: WEST MELBOURNE | C631: 1 | D631: 2 | E631: =C631*6+D631 -> 8 | G631: 1 | H631: 4 | I631: =G631*6+H631 -> 10 | K631: 1 | L631: 5 | M631: =K631*6+L631 -> 11 | O631: 2 | P631: 6 | Q631: =O631*6+P631 -> 18 | S631: FREAME | W631: ESSENDON TOWN | X631: 6 | Y631: 7 | Z631: 0 | AA631: 544 | AB631: 569 | AC631: 95.61 | AD631: 24
A632: BEST PLAYERS | W632: FOOTSCRAY | X632: 5 | Y632: 8 | Z632: 0 | AA632: 442 | AB632: 611 | AC632: 72.34 | AD632: 20
A633: PORT MELBOURNE | D633: JACKSON | G633: McCOLL | J633: SULLIVAN | M633: BRENNAN | O633: YATES | R633: PETTIT | W633: BRUNSWICK | X633: 4 | Y633: 9 | Z633: 0 | AA633: 525 | AB633: 705 | AC633: 74.57 | AD633: 16
A634: WEST MELBOURNE | D634: LAXTON | G634: ROURKE | J634: POOLE | M634: McCANN | O634: NEYLAN | R634: CULLEN | W634: PRAHRAN | X634: 1 | Y634: 12 | Z634: 0 | AA634: 329 | AB634: 733 | AC634: 44.88 | AD634: 4
A635: GOALKICKERS | W635: PRESTON | X635: 1 | Y635: 12 | Z635: 0 | AA635: 329 | AB635: 828 | AC635: 39.73 | AD635: 4
A636: PORT MELBOURNE | D636: SULLIVAN 3 | H636: CROFT 2 | K636: GARBUTT | N636: WARD
A637: WEST MELBOURNE | D637: McCANN | G637: MINTO
A639: BRUNSWICK | C639: 1 | D639: 2 | E639: =C639*6+D639 -> 8 | G639: 4 | H639: 5 | I639: =G639*6+H639 -> 29 | K639: 8 | L639: 5 | M639: =K639*6+L639 -> 53 | O639: 9 | P639: 11 | Q639: =O639*6+P639 -> 65 | S639: BRUNSWICK
A640: PRESTON | C640: 0 | D640: 3 | E640: =C640*6+D640 -> 3 | G640: 0 | H640: 4 | I640: =G640*6+H640 -> 4 | K640: 0 | L640: 4 | M640: =K640*6+L640 -> 4 | O640: 0 | P640: 4 | Q640: =O640*6+P640 -> 4 | S640: WOOLFE
A641: BEST PLAYERS
A642: BRUNSWICK | D642: KENNETT | G642: BRAID | J642: LOGAN | M642: WAGLAND | P642: BELCHER | S642: STANWAY
A643: PRESTON | D643: LANDELLS | G643: S HALL | J643: YEOMANS | M643: WHITE
A644: GOALKICKERS
A645: BRUNSWICK | D645: WAGLAND 3 | H645: STANWAY 3 | K645: CHASE | N645: MULVANEY | Q645: BELCHER
A646: PRESTON | D646: NIL
A648: NORTH MELBOURNE | C648: 1 | D648: 7 | E648: =C648*6+D648 -> 13 | G648: 3 | H648: 7 | I648: =G648*6+H648 -> 25 | K648: 7 | L648: 10 | M648: =K648*6+L648 -> 52 | O648: 11 | P648: 10 | Q648: =O648*6+P648 -> 76 | S648: NORTH MELB
A649: FOOTSCRAY | C649: 1 | D649: 3 | E649: =C649*6+D649 -> 9 | G649: 1 | H649: 4 | I649: =G649*6+H649 -> 10 | K649: 1 | L649: 4 | M649: =K649*6+L649 -> 10 | O649: 1 | P649: 7 | Q649: =O649*6+P649 -> 13 | S649: O'LOUGHLIN
A650: BEST PLAYERS
A651: NORTH MELBOURNE | D651: GROVES | G651: M LONDERIGAN | K651: CARLTON | N651: CONSIDINE | Q651: MORRISON | T651: RAPP
A652: FOOTSCRAY
A653: GOALKICKERS
A654: NORTH MELBOURNE | D654: McCANN 5 | G654: CONSIDINE 2 | K654: GROVES 2 | N654: MORRISON
A655: FOOTSCRAY | D655: HUGHES
A657: ESSENDON | C657: 3 | D657: 3 | E657: =C657*6+D657 -> 21 | G657: 5 | H657: 4 | I657: =G657*6+H657 -> 34 | K657: 8 | L657: 5 | M657: =K657*6+L657 -> 53 | O657: 12 | P657: 9 | Q657: =O657*6+P657 -> 81 | S657: TOORAK PARK
A658: PRAHRAN | C658: 1 | D658: 3 | E658: =C658*6+D658 -> 9 | G658: 4 | H658: 3 | I658: =G658*6+H658 -> 27 | K658: 5 | L658: 6 | M658: =K658*6+L658 -> 36 | O658: 6 | P658: 6 | Q658: =O658*6+P658 -> 42 | S658: GROGAN
A659: BEST PLAYERS
A660: ESSENDON | D660: MAKIN | G660: DUFF | J660: O'SHEA | M660: McNAMARA | P660: PORTINGALE | S660: GORDON
A661: PRAHRAN | D661: TORPEY | G661: ROBERTS | J661: McRITCHIE | M661: SWIFT | P661: G BROWN
A662: GOALKICKERS
A663: ESSENDON | D663: MAKIN 6 | G663: STEVENS 2 | K663: CALLANAN | N663: GRAHAM | Q663: DUFF | S663: GORDON
A664: PRAHRAN | D664: McRITCHIE 3 | H664: TAYLOR | K664: SWIFT | M664: TORPEY
A666: ROUND 15 | E666: 19TH AUGUST | J666: WEATHER | N666: STRONG NORTH WEST WIND CLOUDY
C667: 1ST QTR | G667: 2ND QTR | K667: 3RD QTR | O667: FINAL | S667: PLAYED AT
A668: WILLIAMSTOWN | C668: 2 | D668: 3 | E668: =C668*6+D668 -> 15 | G668: 3 | H668: 3 | I668: =G668*6+H668 -> 21 | K668: 6 | L668: 9 | M668: =K668*6+L668 -> 45 | O668: 7 | P668: 10 | Q668: =O668*6+P668 -> 52 | S668: NORTH MELB | X668: LADDER | AB668: ROUND | AD668: 15
A669: WEST MELBOURNE | C669: 1 | D669: 0 | E669: =C669*6+D669 -> 6 | G669: 3 | H669: 3 | I669: =G669*6+H669 -> 21 | K669: 3 | L669: 3 | M669: =K669*6+L669 -> 21 | O669: 5 | P669: 4 | Q669: =O669*6+P669 -> 34 | S669: UMPIRE
A670: BEST PLAYERS | S670: FREAME | W670: TEAM | X670: W | Y670: L | Z670: D | AA670: FOR | AB670: AGST | AC670: % | AD670: PTS
A671: WILLIAMSTOWN | D671: BRITT | G671: ALLEY | J671: GRAHAM | M671: McKENZIE | P671: DAVIS | S671: HALL
A672: WEST MELBOURNE | D672: POOLE | G672: ROURKE | J672: FRASER | M672: McCANN | P672: CULLEN | S672: MINTO | W672: NORTH MELBOURNE | X672: 13 | Y672: 2 | Z672: 0 | AA672: 751 | AB672: 424 | AC672: 177.12264150943398 | AD672: 52
A673: GOALKICKERS | W673: RICHMOND | X673: 11 | Y673: 4 | Z673: 0 | AA673: 959 | AB673: 513 | AC673: 186.93957115009746 | AD673: 44
A674: WILLIAMSTOWN | D674: MORTIMER 3 | H674: MATTHEWS | K674: KENNEDY | N674: McKENZIE | Q674: JONES | W674: WILLIAMSTOWN | X674: 11 | Y674: 4 | Z674: 0 | AA674: 771 | AB674: 483 | AC674: 159.63 | AD674: 44
A675: WEST MELBOURNE | D675: ARMSTRONG 2 | H675: McCANN | K675: RANKIN | N675: RYAN | W675: WEST MELBOURNE | X675: 11 | Y675: 4 | Z675: 0 | AA675: 654 | AB675: 448 | AC675: 145.98214285714286 | AD675: 44
A677: RICHMOND | C677: 1 | D677: 3 | E677: =C677*6+D677 -> 9 | G677: 2 | H677: 8 | I677: =G677*6+H677 -> 20 | K677: 3 | L677: 8 | M677: =K677*6+L677 -> 26 | O677: 5 | P677: 11 | Q677: =O677*6+P677 -> 41 | S677: RICHMOND | W677: PORT MELBOURNE | X677: 10 | Y677: 5 | Z677: 0 | AA677: 688 | AB677: 465 | AC677: 147.95698924731184 | AD677: 40
A678: PORT MELBOURNE | C678: 2 | D678: 2 | E678: =C678*6+D678 -> 14 | G678: 2 | H678: 2 | I678: =G678*6+H678 -> 14 | K678: 6 | L678: 2 | M678: =K678*6+L678 -> 38 | O678: 6 | P678: 2 | Q678: =O678*6+P678 -> 38 | S678: GROGAN | W678: ESSENDON | X678: 7 | Y678: 8 | Z678: 0 | AA678: 658 | AB678: 662 | AC678: 99.395770392749242 | AD678: 28
A679: BEST PLAYERS | W679: FOOTSCRAY | X679: 5 | Y679: 10 | Z679: 0 | AA679: 484 | AB679: 684 | AC679: 70.760233918128648 | AD679: 20
A680: RICHMOND | D680: BROWN | G680: LANG | J680: LEACH | M680: HUTCHINSON | P680: RICKETTS | S680: RIGBY | W680: BRUNSWICK | X680: 4 | Y680: 11 | Z680: 0 | AA680: 600 | AB680: 859 | AC680: 69.848661233993013 | AD680: 16
A681: PORT MELBOURNE | D681: O'KEEFE | G681: BRENNAN | J681: GAULT | M681: WARD | P681: COPE | S681: KNOX | W681: PRAHRAN | X681: 2 | Y681: 13 | Z681: 0 | AA681: 380 | AB681: 815 | AC681: 46.63 | AD681: 8
A682: GOALKICKERS | W682: PRESTON | X682: 1 | Y682: 14 | Z682: 0 | AA682: 375 | AB682: 967 | AC682: 38.779731127197515 | AD682: 4
A683: RICHMOND | D683: HUTCHINSON 2 | H683: BROWN | K683: LANG | N683: LEACH
A684: PORT MELBOURNE | D684: CROFT 2 | H684: GARBUTT 2
A686: ESSENDON | C686: 3 | D686: 0 | E686: =C686*6+D686 -> 18 | G686: 4 | H686: 5 | I686: =G686*6+H686 -> 29 | K686: 9 | L686: 10 | M686: =K686*6+L686 -> 64 | O686: 11 | P686: 10 | Q686: =O686*6+P686 -> 76 | S686: ESSENDON
A687: BRUNSWICK | C687: 2 | D687: 2 | E687: =C687*6+D687 -> 14 | G687: 3 | H687: 3 | I687: =G687*6+H687 -> 21 | K687: 3 | L687: 4 | M687: =K687*6+L687 -> 22 | O687: 6 | P687: 10 | Q687: =O687*6+P687 -> 46 | S687: ALLEN
A688: BEST PLAYERS
A689: ESSENDON
A690: BRUNSWICK
A691: GOALKICKERS
A692: ESSENDON | D692: STEVENS 4 | H692: MAKIN 2 | K692: BARLOW 2 | N692: HORDERN | Q692: MARTIN
A693: BRUNSWICK | D693: MULVANEY | G693: STANWAY | J693: ROBSON | M693: WAGLAND
A695: PRAHRAN | C695: 2 | D695: 2 | E695: =C695*6+D695 -> 14 | G695: 2 | H695: 3 | I695: =G695*6+H695 -> 15 | K695: 3 | L695: 8 | M695: =K695*6+L695 -> 26 | O695: 4 | P695: 8 | Q695: =O695*6+P695 -> 32 | S695: FOOTSCRAY
A696: FOOTSCRAY | C696: 0 | D696: 0 | E696: =C696*6+D696 -> 0 | G696: 2 | H696: 3 | I696: =G696*6+H696 -> 15 | K696: 2 | L696: 4 | M696: =K696*6+L696 -> 16 | O696: 2 | P696: 7 | Q696: =O696*6+P696 -> 19 | S696: O'LOUGHLIN
A697: BEST PLAYERS
A698: PRAHRAN
A699: FOOTSCRAY
A700: GOALKICKERS
A701: PRAHRAN | D701: McRITCHIE | G701: ALLEN | J701: HAUGHTON | N701: TAYLOR
A702: FOOTSCRAY | D702: MOORE | G702: LIVERWIDGE
A704: NORTH MELBOURNE | C704: 2 | D704: 5 | E704: =C704*6+D704 -> 17 | G704: 2 | H704: 6 | I704: =G704*6+H704 -> 18 | K704: 7 | L704: 12 | M704: =K704*6+L704 -> 54 | O704: 9 | P704: 14 | Q704: =O704*6+P704 -> 68 | S704: PRESTON
A705: PRESTON | C705: 1 | D705: 0 | E705: =C705*6+D705 -> 6 | G705: 2 | H705: 1 | I705: =G705*6+H705 -> 13 | K705: 2 | L705: 2 | M705: =K705*6+L705 -> 14 | O705: 2 | P705: 4 | Q705: =O705*6+P705 -> 16 | S705: ASPINALL
A706: BEST PLAYERS
A707: NORTH MELBOURNE | D707: M LONDERIGAN | G707: RAPP | J707: MORRISON | M707: MARTIN | O707: McCANN | R707: GROVES
A708: PRESTON | D708: McCLUMPA | G708: STANLAKE | J708: S HALL | M708: P HALL | O708: YEOMANS | R708: WARNE
A709: GOALKICKERS
A710: NORTH MELBOURNE
A711: PRESTON
A713: ROUND 16 | E713: 26TH AUGUST | J713: WEATHER | N713: WEST WIND RAIN AFTER 1/2 TIME
C714: 1ST QTR | G714: 2ND QTR | K714: 3RD QTR | O714: FINAL | S714: PLAYED AT
A715: WILLIAMSTOWN | C715: 0 | D715: 0 | E715: =C715*6+D715 -> 0 | G715: 2 | H715: 4 | I715: =G715*6+H715 -> 16 | K715: 3 | L715: 5 | M715: =K715*6+L715 -> 23 | O715: 5 | P715: 5 | Q715: =O715*6+P715 -> 35 | S715: WILLIAMSTOWN | X715: LADDER | AB715: ROUND | AD715: 16
A716: NORTH MELBOURNE | C716: 2 | D716: 5 | E716: =C716*6+D716 -> 17 | G716: 2 | H716: 5 | I716: =G716*6+H716 -> 17 | K716: 4 | L716: 5 | M716: =K716*6+L716 -> 29 | O716: 4 | P716: 5 | Q716: =O716*6+P716 -> 29 | S716: UMPIRE
A717: BEST PLAYERS | S717: FREAME | W717: TEAM | X717: W | Y717: L | Z717: D | AA717: FOR | AB717: AGST | AC717: % | AD717: PTS
A718: WILLIAMSTOWN | D718: ALLEY | G718: OUTEN | J718: BRITT | M718: MANDERSON | P718: MATTHEWS | S718: DAVIS
A719: NORTH MELBOURNE | D719: McDERMOTT | G719: RAPP | J719: C LONDERIGAN | M719: CARLTON | P719: CONSIDINE | S719: SMITH | W719: NORTH MELBOURNE | X719: 13 | Y719: 3 | Z719: 0 | AA719: 780 | AB719: 459 | AC719: 169.93464052287581 | AD719: 52
A720: GOALKICKERS | W720: RICHMOND | X720: 12 | Y720: 4 | Z720: 0 | AA720: 989 | AB720: 529 | AC720: 186.95652173913044 | AD720: 48
A721: WILLIAMSTOWN | D721: OUTEN 3 | G721: MORTIMER | J721: DICK | W721: WILLIAMSTOWN | X721: 12 | Y721: 4 | Z721: 0 | AA721: 806 | AB721: 512 | AC721: 157.42 | AD721: 48
A722: NORTH MELBOURNE | D722: SMITH 2 | G722: MORRISON | J722: CONSIDINE | W722: PORT MELBOURNE | X722: 11 | Y722: 5 | Z722: 0 | AA722: 777 | AB722: 486 | AC722: 159.87654320987653 | AD722: 44
A724: RICHMOND | C724: 2 | D724: 6 | E724: =C724*6+D724 -> 18 | G724: 2 | H724: 6 | I724: =G724*6+H724 -> 18 | K724: 3 | L724: 11 | M724: =K724*6+L724 -> 29 | O724: 3 | P724: 12 | Q724: =O724*6+P724 -> 30 | S724: ESSENDON | W724: WEST MELBOURNE | X724: 11 | Y724: 5 | Z724: 0 | AA724: 707 | AB724: 510 | AC724: 138.62745098039215 | AD724: 44
A725: ESSENDON | C725: 1 | D725: 2 | E725: =C725*6+D725 -> 8 | G725: 1 | H725: 4 | I725: =G725*6+H725 -> 10 | K725: 1 | L725: 8 | M725: =K725*6+L725 -> 14 | O725: 1 | P725: 10 | Q725: =O725*6+P725 -> 16 | S725: O'LOUGHLIN | W725: ESSENDON | X725: 7 | Y725: 9 | Z725: 0 | AA725: 674 | AB725: 692 | AC725: 97.398843930635834 | AD725: 28
A726: BEST PLAYERS | W726: BRUNSWICK | X726: 5 | Y726: 11 | Z726: 0 | AA726: 662 | AB726: 912 | AC726: 72.587719298245617 | AD726: 20
A727: RICHMOND | D727: BROWN | G727: CARKEEK | J727: BOWNAS | M727: RIGBY | P727: LUFF | S727: KNELL | W727: FOOTSCRAY | X727: 5 | Y727: 11 | Z727: 0 | AA727: 505 | AB727: 773 | AC727: 65.329883570504535 | AD727: 20
A728: ESSENDON | D728: GAVIN | G728: WILSON | J728: BARLOW | M728: McINTYRE | P728: SHELDON | S728: O'SHEA | W728: PRAHRAN | X728: 3 | Y728: 13 | Z728: 0 | AA728: 432 | AB728: 840 | AC728: 51.43 | AD728: 12
A729: GOALKICKERS | W729: PRESTON | X729: 1 | Y729: 15 | Z729: 0 | AA729: 400 | AB729: 1019 | AC729: 39.254170755642789 | AD729: 4
A730: RICHMOND | D730: KNELL 2 | G730: HUTCHINSON
A731: ESSENDON | D731: STEVENS
A733: PORT MELBOURNE | C733: 3 | D733: 2 | E733: =C733*6+D733 -> 20 | G733: 8 | H733: 4 | I733: =G733*6+H733 -> 52 | K733: 9 | L733: 10 | M733: =K733*6+L733 -> 64 | O733: 12 | P733: 17 | Q733: =O733*6+P733 -> 89 | S733: PORT MELB
A734: FOOTSCRAY | C734: 0 | D734: 0 | E734: =C734*6+D734 -> 0 | G734: 1 | H734: 2 | I734: =G734*6+H734 -> 8 | K734: 3 | L734: 2 | M734: =K734*6+L734 -> 20 | O734: 3 | P734: 3 | Q734: =O734*6+P734 -> 21 | S734: ASPINALL
A735: BEST PLAYERS
A736: PORT MELBOURNE | D736: KNOX | G736: CROFT | J736: JACKSON | M736: TREGLOWAN | P736: BRENNAN | S736: MCDONALD
A737: FOOTSCRAY | D737: MARMO | G737: E STEPHENSON | K737: NIELSON | N737: MOORE | P737: CLARKE | S737: HUGHES
A738: GOALKICKERS
A739: PORT MELBOURNE | D739: McDONALD 4 | H739: CROFT 3 | K739: TREGLOWAN 2 | O739: KNOX | Q739: GAULT | S739: READ
A740: FOOTSCRAY | D740: MCCARTHY | H740: MOORE | K740: BRAIN
A742: PRAHRAN | C742: 2 | D742: 5 | E742: =C742*6+D742 -> 17 | G742: 4 | H742: 8 | I742: =G742*6+H742 -> 32 | K742: 6 | L742: 9 | M742: =K742*6+L742 -> 45 | O742: 7 | P742: 10 | Q742: =O742*6+P742 -> 52 | S742: TOORAK PARK
A743: PRESTON | C743: 1 | D743: 2 | E743: =C743*6+D743 -> 8 | G743: 2 | H743: 6 | I743: =G743*6+H743 -> 18 | K743: 2 | L743: 6 | M743: =K743*6+L743 -> 18 | O743: 3 | P743: 7 | Q743: =O743*6+P743 -> 25 | S743: ALLEN
A744: BEST PLAYERS
A745: PRAHRAN | D745: LETHBRIDGE | H745: SCOTT | K745: McRITCHIE | N745: TORPEY
A746: PRESTON | D746: S HALL | H746: WARNE | K746: LANDELLS | N746: YEOMANS
A747: GOALKICKERS
A748: PRAHRAN | D748: TORPEY 2 | H748: AYLING | K748: SCOTT | N748: McRITCHIE | Q748: ELLIOTT | T748: LONIE
A749: PRESTON | D749: COOPER | G749: BARKER | J749: STANLAKE
A751: BRUNSWICK | C751: 2 | D751: 2 | E751: =C751*6+D751 -> 14 | G751: 9 | H751: 2 | I751: =G751*6+H751 -> 56 | K751: 9 | L751: 2 | M751: =K751*6+L751 -> 56 | O751: 9 | P751: 8 | Q751: =O751*6+P751 -> 62 | S751: NORTH MELB
A752: WEST MELBOURNE | C752: 5 | D752: 1 | E752: =C752*6+D752 -> 31 | G752: 6 | H752: 2 | I752: =G752*6+H752 -> 38 | K752: 8 | L752: 5 | M752: =K752*6+L752 -> 53 | O752: 8 | P752: 5 | Q752: =O752*6+P752 -> 53 | S752: GROGAN
A753: BEST PLAYERS
A754: BRUNSWICK | D754: ANDREWS | H754: STANWAY | K754: CHASE | N754: WILSON | Q754: COBURN | T754: HARRIS
A755: WEST MELBOURNE | D755: ROURKE | H755: FRASER | K755: A GREGORY | N755: H GREGORY | Q755: RYAN | T755: RANKIN
A756: GOALKICKERS
A757: BRUNSWICK | D757: MULVANEY 4 | H757: WAGLAND 2 | L757: A BELCHER | O757: WILSON | R757: CAIN
A758: WEST MELBOURNE | D758: McCANN 2 | H758: H GREGORY 2 | L758: A RYAN | O758: A GREGORY | R758: RANKIN | V758: ROURKE
A760: ROUND 17 | E760: 2ND SEPTEMBER | J760: WEATHER | N760: STRONG NORTH WIND LATE RAIN
C761: 1ST QTR | G761: 2ND QTR | K761: 3RD QTR | O761: FINAL | S761: PLAYED AT
A762: NORTH MELBOURNE | C762: 4 | D762: 0 | E762: =C762*6+D762 -> 24 | G762: 6 | H762: 0 | I762: =G762*6+H762 -> 36 | K762: 9 | L762: 4 | M762: =K762*6+L762 -> 58 | O762: 9 | P762: 6 | Q762: =O762*6+P762 -> 60 | S762: NORTH MELB | X762: LADDER | AB762: ROUND | AD762: 17
A763: WEST MELBOURNE | C763: 0 | D763: 3 | E763: =C763*6+D763 -> 3 | G763: 1 | H763: 8 | I763: =G763*6+H763 -> 14 | K763: 1 | L763: 8 | M763: =K763*6+L763 -> 14 | O763: 2 | P763: 11 | Q763: =O763*6+P763 -> 23 | S763: UMPIRE
A764: BEST PLAYERS | S764: O'LOUGHLIN | W764: TEAM | X764: W | Y764: L | Z764: D | AA764: FOR | AB764: AGST | AC764: % | AD764: PTS
A765: NORTH MELBOURNE | D765: SMITH | G765: M LONDERIGAN | K765: KEATING | N765: JOHNSON | P765: BARNES | S765: RAPP
A766: WEST MELBOURNE | D766: NEYLAN | G766: ROURKE | J766: MADDEN | M766: A GREGORY | P766: H GREGORY | S766: MINTO | W766: NORTH MELBOURNE | X766: 14 | Y766: 3 | Z766: 0 | AA766: 840 | AB766: 482 | AC766: 174.27385892116183 | AD766: 56
A767: GOALKICKERS | W767: RICHMOND | X767: 13 | Y767: 4 | Z767: 0 | AA767: 1041 | AB767: 543 | AC767: 191.71270718232043 | AD767: 52
A768: NORTH MELBOURNE | D768: GROVES 3 | G768: CONSIDINE 3 | K768: KENNY | N768: RAPP | P768: McCANN | W768: WILLIAMSTOWN | X768: 13 | Y768: 4 | Z768: 0 | AA768: 881 | AB768: 519 | AC768: 169.75 | AD768: 52
A769: WEST MELBOURNE | D769: MINTO | G769: MADDEN | W769: PORT MELBOURNE | X769: 12 | Y769: 5 | Z769: 0 | AA769: 856 | AB769: 512 | AC769: 167.1875 | AD769: 48
A771: PORT MELBOURNE | C771: 2 | D771: 6 | E771: =C771*6+D771 -> 18 | G771: 5 | H771: 8 | I771: =G771*6+H771 -> 38 | K771: 9 | L771: 12 | M771: =K771*6+L771 -> 66 | O771: 11 | P771: 13 | Q771: =O771*6+P771 -> 79 | S771: PORT MELB | W771: WEST MELBOURNE | X771: 11 | Y771: 6 | Z771: 0 | AA771: 730 | AB771: 570 | AC771: 128.07017543859649 | AD771: 44
A772: ESSENDON | C772: 0 | D772: 0 | E772: =C772*6+D772 -> 0 | G772: 2 | H772: 0 | I772: =G772*6+H772 -> 12 | K772: 2 | L772: 4 | M772: =K772*6+L772 -> 16 | O772: 3 | P772: 8 | Q772: =O772*6+P772 -> 26 | S772: FREAME | W772: ESSENDON | X772: 7 | Y772: 10 | Z772: 0 | AA772: 700 | AB772: 771 | AC772: 90.791180285343714 | AD772: 28
A773: BEST PLAYERS | W773: BRUNSWICK | X773: 6 | Y773: 11 | Z773: 0 | AA773: 708 | AB773: 929 | AC773: 76.210979547900962 | AD773: 24
A774: PORT MELBOURNE | D774: McDONALD | G774: YATES | J774: KNOX | M774: CROFT | O774: BRENNAN | R774: HILL | W774: FOOTSCRAY | X774: 5 | Y774: 12 | Z774: 0 | AA774: 519 | AB774: 825 | AC774: 62.909090909090907 | AD774: 20
A775: ESSENDON | D775: MARTIN | G775: DUFF | J775: GAVIN | M775: ALLEN | O775: NEWTON | R775: BARLOW | W775: PRAHRAN | X775: 3 | Y775: 14 | Z775: 0 | AA775: 449 | AB775: 886 | AC775: 50.68 | AD775: 12
A776: GOALKICKERS | W776: PRESTON | X776: 1 | Y776: 16 | Z776: 0 | AA776: 407 | AB776: 1094 | AC776: 37.202925045703836 | AD776: 4
A777: PORT MELBOURNE | D777: McDONALD 6 | H777: CROFT 3 | K777: CUTRIS | N777: PETTIT
A778: ESSENDON | D778: DUFF | G778: STEVENS | J778: MARTIN
A780: BRUNSWICK | C780: 1 | D780: 3 | E780: =C780*6+D780 -> 9 | G780: 3 | H780: 7 | I780: =G780*6+H780 -> 25 | K780: 3 | L780: 8 | M780: =K780*6+L780 -> 26 | O780: 6 | P780: 10 | Q780: =O780*6+P780 -> 46 | S780: TOORAK PARK
A781: PRAHRAN | C781: 0 | D781: 1 | E781: =C781*6+D781 -> 1 | G781: 1 | H781: 2 | I781: =G781*6+H781 -> 8 | K781: 2 | L781: 4 | M781: =K781*6+L781 -> 16 | O781: 2 | P781: 5 | Q781: =O781*6+P781 -> 17 | S781: GROGAN
A782: BEST PLAYERS
A783: BRUNSWICK | D783: A BELCHER | G783: BRAID | J783: MULVANEY | M783: WAGLAND | O783: CHASE | R783: HARRIS
A784: PRAHRAN | D784: TORPEY | G784: McRITCHIE | J784: G BROWN | M784: LAXTON | O784: SWIFT
A785: GOALKICKERS
A786: BRUNSWICK | D786: MULVANEY 2 | H786: A BELCHER | K786: BRAID | N786: WHITFIELD | R786: JACKSON
A787: PRAHRAN | D787: ROCHE | H787: McRITCHIE
A789: RICHMOND | C789: 4 | D789: 4 | E789: =C789*6+D789 -> 28 | G789: 5 | H789: 5 | I789: =G789*6+H789 -> 35 | K789: 6 | L789: 9 | M789: =K789*6+L789 -> 45 | O789: 7 | P789: 10 | Q789: =O789*6+P789 -> 52 | S789: FOOTSCRAY
A790: FOOTSCRAY | C790: 1 | D790: 0 | E790: =C790*6+D790 -> 6 | G790: 2 | H790: 0 | I790: =G790*6+H790 -> 12 | K790: 2 | L790: 0 | M790: =K790*6+L790 -> 12 | O790: 2 | P790: 2 | Q790: =O790*6+P790 -> 14 | S790: WOOLFE
A791: BEST PLAYERS
A792: RICHMOND | D792: CARKEEK | G792: RICKETTS | J792: T WILLIAMS | M792: C WILLIAMS | P792: BOWNAS | S792: HUESKER
A793: FOOTSCRAY | D793: SERBY | G793: HUGHES | J793: E STEPHENSON | M793: NEILSON | P793: MARMO | S793: McKINLEY
A794: GOALKICKERS
A795: RICHMOND | D795: MARTIN 2 | H795: McDONALD | K795: CARKEEK | N795: BROWN | Q795: HUTCHINSON | U795: KNELL
A796: FOOTSCRAY | D796: NEILSON | H796: GREENWOOD
A798: WILLIAMSTOWN | C798: 3 | D798: 4 | E798: =C798*6+D798 -> 22 | G798: 7 | H798: 8 | I798: =G798*6+H798 -> 50 | K798: 9 | L798: 10 | M798: =K798*6+L798 -> 64 | O798: 10 | P798: 15 | Q798: =O798*6+P798 -> 75 | S798: WILLIAMSTOWN
A799: PRESTON | C799: 0 | D799: 1 | E799: =C799*6+D799 -> 1 | G799: 0 | H799: 1 | I799: =G799*6+H799 -> 1 | K799: 1 | L799: 1 | M799: =K799*6+L799 -> 7 | O799: 1 | P799: 1 | Q799: =O799*6+P799 -> 7 | S799: ASPINALL
A800: BEST PLAYERS
A801: WILLIAMSTOWN | D801: ALLEY | G801: MORTIMER | J801: JONES | M801: DAVIS | O801: MATTHEWS | R801: HOUGHTON
A802: PRESTON | D802: S HALL | G802: STANLAKE | J802: McCLUMPA | M802: WARNE | O802: YEOMANS
A803: GOALKICKERS
A804: WILLIAMSTOWN | D804: MORTIMER 4 | H804: KENNEDY 2 | K804: BURNS | N804: JONES | P804: HEFFEY | S804: MATTHEWS
A805: PRESTON | D805: RALSTON
A807: ROUND 18 | E807: 9TH SEPTEMBER | J807: WEATHER | N807: FINE LIGHT SOUTH WEST BREEZE
C808: 1ST QTR | G808: 2ND QTR | K808: 3RD QTR | O808: FINAL | S808: PLAYED AT
A809: WILLIAMSTOWN | C809: 0 | D809: 3 | E809: =C809*6+D809 -> 3 | G809: 2 | H809: 6 | I809: =G809*6+H809 -> 18 | K809: 4 | L809: 8 | M809: =K809*6+L809 -> 32 | O809: 6 | P809: 11 | Q809: =O809*6+P809 -> 47 | S809: WILLIAMSTOWN | X809: LADDER | AB809: ROUND | AD809: 18
A810: PORT MELBOURNE | C810: 1 | D810: 3 | E810: =C810*6+D810 -> 9 | G810: 2 | H810: 4 | I810: =G810*6+H810 -> 16 | K810: 2 | L810: 6 | M810: =K810*6+L810 -> 18 | O810: 2 | P810: 10 | Q810: =O810*6+P810 -> 22 | S810: UMPIRE
A811: BEST PLAYERS | S811: FREAME | W811: TEAM | X811: W | Y811: L | Z811: D | AA811: FOR | AB811: AGST | AC811: % | AD811: PTS
A812: WILLIAMSTOWN | D812: DAVIS | G812: DICK | J812: BRITT | M812: McKENZIE | O812: MANDERSON | R812: HALL
A813: PORT MELBOURNE | D813: SULLIVAN | G813: JACKSON | J813: BRENNAN | M813: COPE | O813: MOLONEY | R813: McCOLL | W813: NORTH MELBOURNE | X813: 15 | Y813: 3 | Z813: 0 | AA813: 895 | AB813: 515 | AC813: 173.78640776699029 | AD813: 60
A814: GOALKICKERS | W814: RICHMOND | X814: 14 | Y814: 4 | Z814: 0 | AA814: 1130 | AB814: 570 | AC814: 198.24561403508773 | AD814: 56
A815: WILLIAMSTOWN | W815: WILLIAMSTOWN | X815: 14 | Y815: 4 | Z815: 0 | AA815: 928 | AB815: 541 | AC815: 171.53 | AD815: 56
A816: PORT MELBOURNE | W816: PORT MELBOURNE | X816: 12 | Y816: 6 | Z816: 0 | AA816: 878 | AB816: 559 | AC816: 157.06618962432916 | AD816: 48
A818: WEST MELBOURNE | C818: 3 | D818: 6 | E818: =C818*6+D818 -> 24 | G818: 4 | H818: 6 | I818: =G818*6+H818 -> 30 | K818: 4 | L818: 9 | M818: =K818*6+L818 -> 33 | O818: 8 | P818: 14 | Q818: =O818*6+P818 -> 62 | S818: NORTH MELB | W818: WEST MELBOURNE | X818: 12 | Y818: 6 | Z818: 0 | AA818: 792 | AB818: 605 | AC818: 130.90909090909091 | AD818: 48
A819: ESSENDON | C819: 1 | D819: 0 | E819: =C819*6+D819 -> 6 | G819: 2 | H819: 1 | I819: =G819*6+H819 -> 13 | K819: 5 | L819: 5 | M819: =K819*6+L819 -> 35 | O819: 5 | P819: 5 | Q819: =O819*6+P819 -> 35 | S819: O'LOUGHLIN | W819: ESSENDON | X819: 7 | Y819: 11 | Z819: 0 | AA819: 735 | AB819: 833 | AC819: 88.235294117647058 | AD819: 28
A820: BEST PLAYERS | W820: BRUNSWICK | X820: 6 | Y820: 12 | Z820: 0 | AA820: 741 | AB820: 984 | AC820: 75.304878048780495 | AD820: 24
A821: WEST MELBOURNE | D821: MADDEN | G821: CULLEN | J821: LAXTON | M821: JOHNSON | O821: RYAN | R821: POOLE | W821: FOOTSCRAY | X821: 6 | Y821: 12 | Z821: 0 | AA821: 574 | AB821: 833 | AC821: 68.907563025210081 | AD821: 24
A822: ESSENDON | D822: GIRDWOOD | G822: MARTIN | J822: McNAMARA | M822: GAVIN | O822: McINTYRE | R822: STEVENS | W822: PRAHRAN | X822: 3 | Y822: 15 | Z822: 0 | AA822: 476 | AB822: 975 | AC822: 48.82 | AD822: 12
A823: GOALKICKERS | W823: PRESTON | X823: 1 | Y823: 17 | Z823: 0 | AA823: 415 | AB823: 1149 | AC823: 36.118363794604001 | AD823: 4
A824: WEST MELBOURNE
A825: ESSENDON | D825: STEVENS 3
A827: FOOTSCRAY | C827: 0 | D827: 0 | E827: =C827*6+D827 -> 0 | G827: 2 | H827: 1 | I827: =G827*6+H827 -> 13 | K827: 8 | L827: 1 | M827: =K827*6+L827 -> 49 | O827: 9 | P827: 1 | Q827: =O827*6+P827 -> 55 | S827: FOOTSCRAY
A828: PRESTON | C828: 0 | D828: 2 | E828: =C828*6+D828 -> 2 | G828: 0 | H828: 4 | I828: =G828*6+H828 -> 4 | K828: 0 | L828: 5 | M828: =K828*6+L828 -> 5 | O828: 0 | P828: 8 | Q828: =O828*6+P828 -> 8 | S828: GROGAN
A829: BEST PLAYERS
A830: FOOTSCRAY
A831: PRESTON
A832: GOALKICKERS
A833: FOOTSCRAY | D833: HUGHES 5 | H833: MITCHELL 2 | L833: MARMO | O833: HOOD
A834: PRESTON
A836: NORTH MELBOURNE | C836: 2 | D836: 2 | E836: =C836*6+D836 -> 14 | G836: 3 | H836: 6 | I836: =G836*6+H836 -> 24 | K836: 6 | L836: 6 | M836: =K836*6+L836 -> 42 | O836: 8 | P836: 7 | Q836: =O836*6+P836 -> 55 | S836: BRUNSWICK
A837: BRUNSWICK | C837: 2 | D837: 0 | E837: =C837*6+D837 -> 12 | G837: 4 | H837: 1 | I837: =G837*6+H837 -> 25 | K837: 4 | L837: 1 | M837: =K837*6+L837 -> 25 | O837: 5 | P837: 3 | Q837: =O837*6+P837 -> 33 | S837: WOOLFE
A838: BEST PLAYERS
A839: NORTH MELBOURNE | D839: WATSON | G839: JOHNSON | J839: SMITH | M839: MORRISON | O839: McCANN | R839: RAPP
A840: BRUNSWICK | D840: HARRIS | G840: WHITFIELD | J840: MULVANEY | M840: BELCHER | O840: ANDREWS
A841: GOALKICKERS
A842: NORTH MELBOURNE
A843: BRUNSWICK
A845: RICHMOND | C845: 5 | D845: 0 | E845: =C845*6+D845 -> 30 | G845: 5 | H845: 6 | I845: =G845*6+H845 -> 36 | K845: 9 | L845: 10 | M845: =K845*6+L845 -> 64 | O845: 12 | P845: 17 | Q845: =O845*6+P845 -> 89 | S845: RICHMOND
A846: PRAHRAN | C846: 1 | D846: 1 | E846: =C846*6+D846 -> 7 | G846: 3 | H846: 2 | I846: =G846*6+H846 -> 20 | K846: 3 | L846: 3 | M846: =K846*6+L846 -> 21 | O846: 4 | P846: 3 | Q846: =O846*6+P846 -> 27 | S846: MARTIN
A847: BEST PLAYERS
A848: RICHMOND | D848: C WILLIAMS | H848: EDMONDS | K848: LANG | N848: RUDDOCK | Q848: LEACH | T848: CLEGHORN
A849: PRAHRAN | D849: NEILL | H849: G BROWN | K849: ELLIOTT | N849: McRITCHIE | Q849: LETHBRIDGE | T849: SWIFT
A850: GOALKICKERS
A851: RICHMOND | D851: KNELL 5 | H851: HUTCHINSON 4
A852: PRAHRAN
A854: FINALS
A855: 1ST SEMI | E855: 16TH SEPTEMBER | J855: WEATHER | N855: WEST WIND SHOWERS
C856: 1ST QTR | G856: 2ND QTR | K856: 3RD QTR | O856: FINAL | S856: PLAYED AT
A857: NORTH MELBOURNE | C857: 1 | D857: 0 | E857: =C857*6+D857 -> 6 | G857: 2 | H857: 3 | I857: =G857*6+H857 -> 15 | K857: 4 | L857: 5 | M857: =K857*6+L857 -> 29 | O857: 5 | P857: 5 | Q857: =O857*6+P857 -> 35 | S857: EAST MELB
A858: WILLIAMSTOWN | C858: 1 | D858: 2 | E858: =C858*6+D858 -> 8 | G858: 2 | H858: 2 | I858: =G858*6+H858 -> 14 | K858: 2 | L858: 5 | M858: =K858*6+L858 -> 17 | O858: 3 | P858: 8 | Q858: =O858*6+P858 -> 26 | S858: UMPIRE
A859: BEST PLAYERS | S859: FREAME
A860: NORTH MELBOURNE | D860: SMITH | G860: M LONDERIGAN | K860: PRESCOTT | N860: ROLENT | Q860: RAPP | S860: WATSON
A861: WILLIAMSTOWN | D861: GRAHAM | G861: BRITT | K861: McKENZIE | N861: KENNEDY | Q861: HALL | S861: WILLIAMS
A862: GOALKICKERS
A863: NORTH MELBOURNE | D863: KENNY 3 | G863: PRESCOTT 2 | K863: GROVES
A864: WILLIAMSTOWN | D864: DICK | G864: KENNEDY | K864: McKENZIE
A866: TEAMS | I866: NORTH MELBOURNE | V866: WILLIAMSTOWN
A868: BACKS | E868: BARNES | I868: McDERMOTT | M868: RAPP | S868: WOODS | W868: BAKER | Y868: McINTYRE
A869: HALF-BACKS | E869: HALL | I869: WATSON | M869: JOHNSON | S869: ALLEY | W869: GRAHAM | Y869: BUTTERFIELD
A870: CENTRES | E870: MARTIN | I870: ROLENT | M870: C LONDERIGAN | S870: DAVIS | W870: JONES | Y870: HALL
A871: HALF-FORWARDS | E871: GROVES | I871: PRESCOTT | M871: M LONDERIGAN | S871: LEWIS | W871: KENNEDY | Y871: DICK
A872: FORWARDS | E872: THORPE | I872: McCANN | M872: KENNY | S872: MATTHEWS | W872: MORTIMER | Y872: WILLIAMS
A873: RUCKS | E873: MORRISON | I873: KEATING | M873: SMITH | S873: HOUGHTON | W873: MANDERSON | Y873: BRITT
A875: 2ND SEMI | E875: 23RD SEPTEMBER | J875: WEATHER | N875: NORTH WEST WIND OVERCAST
A876: RICHMOND | C876: 5 | D876: 5 | E876: =C876*6+D876 -> 35 | G876: 6 | H876: 6 | I876: =G876*6+H876 -> 42 | K876: 10 | L876: 7 | M876: =K876*6+L876 -> 67 | O876: 11 | P876: 8 | Q876: =O876*6+P876 -> 74 | S876: EAST MELB
A877: PORT MELBOURNE | C877: 0 | D877: 0 | E877: =C877*6+D877 -> 0 | G877: 4 | H877: 2 | I877: =G877*6+H877 -> 26 | K877: 5 | L877: 3 | M877: =K877*6+L877 -> 33 | O877: 7 | P877: 6 | Q877: =O877*6+P877 -> 48 | S877: ALLEN
A878: BEST PLAYERS
A879: RICHMOND | D879: SYKES | G879: RIGBY | J879: RICKETTS | N879: CARKEEK | Q879: C WILLIAMS | U879: LEACH
A880: PORT MELBOURNE | D880: WARD | G880: O'KEEFE | J880: COPE | N880: HEENEY | Q880: YATES | U880: JAMES
A881: GOALKICKERS
A882: RICHMOND | D882: KNELL 3 | G882: HUTCHINSON 2 | K882: LUFF | M882: T WILLIAMS | P882: CARKEEK | S882: BROWN | U882: RICKETTS | W882: LANG
A883: PORT MELBOURNE | D883: HILL 2 | G883: WARD | I883: YATES | K883: MCDONALD | N883: CROFT | P883: JACKSON
A885: TEAMS | I885: RICHMOND | W885: PORT MELBOURNE
A887: BACKS | E887: C WILLIAMS | I887: BOWNAS | M887: HUESKER | S887: WARD | W887: JAMES | Y887: YATES
A888: HALF-BACKS | E888: RUDDOCK | I888: LA FRANCHIE | M888: EDMONDS | S888: O'KEEFE | W888: HEENEY | Y888: CURTIS
A889: CENTRES | E889: RIGBY | I889: SYKES | M889: LITHGOW | S889: COPE | W889: KNOX | Y889: McCOLL
A890: HALF-FORWARDS | E890: MEGSON | I890: KNELL | M890: CARKEEK | S890: McDONALD | W890: SULLIVAN | Y890: JACKSON
A891: FORWARDS | E891: T WILLIAMS | I891: HUTCHINSON | M891: LUFF | S891: HILL | W891: CROFT | Y891: READ
A892: RUCKS | E892: LEACH | I892: McDONALD | M892: RICKETTS | S892: BRENNAN | W892: PETTIT | Y892: TREGLOWAN
A894: FINAL | E894: 30TH SEPTEMBER | J894: WEATHER | M894: SOUTH WIND HEAVY RAIN EARLY
A895: RICHMOND | C895: 3 | D895: 3 | E895: =C895*6+D895 -> 21 | G895: 4 | H895: 3 | I895: =G895*6+H895 -> 27 | K895: 6 | L895: 5 | M895: =K895*6+L895 -> 41 | O895: 7 | P895: 6 | Q895: =O895*6+P895 -> 48 | S895: EAST MELB
A896: NORTH MELBOURNE | C896: 0 | D896: 0 | E896: =C896*6+D896 -> 0 | G896: 0 | H896: 6 | I896: =G896*6+H896 -> 6 | K896: 2 | L896: 9 | M896: =K896*6+L896 -> 21 | O896: 3 | P896: 10 | Q896: =O896*6+P896 -> 28 | S896: FREAME
A897: BEST PLAYERS
A898: RICHMOND | D898: RICKETTS | G898: RUDDOCK | J898: C WILLIAMS | N898: SYKES | Q898: HUTCHINSON | U898: T WILLIAMS
A899: NORTH MELBOURNE | D899: JOHNSON | G899: M LONDERIGAN | K899: MCCANN | N899: MORRISON | Q899: SMITH | T899: THORPE
A900: GOALKICKERS
A901: RICHMOND | D901: HUTCHINSON 5 | H901: LEACH | K901: CARKEEK
A902: NORTH MELBOURNE | D902: PRESCOTT | H902: M LONDERIGAN | M902: RAPP
A904: TEAMS | I904: RICHMOND | W904: NORTH MELBOURNE
A906: BACKS | E906: C WILLIAMS | I906: BOWNAS | M906: HUESKER | S906: THORPE | W906: BARNES | Y906: HALL
A907: HALF-BACKS | E907: RUDDOCK | I907: LA FRANCHIE | M907: EDMONDS | S907: RAPP | W907: WATSON | Y907: JOHNSON
A908: CENTRES | E908: RIGBY | I908: SYKES | M908: LITHGOW | S908: MARTIN | W908: ROLENT | Y908: CARLTON
A909: HALF-FORWARDS | E909: MEGSON | I909: LUFF | M909: CARKEEK | S909: PRESCOTT | W909: GROVES | Y909: M LONDERIGAN
A910: FORWARDS | E910: T WILLIAMS | I910: HUTCHINSON | M910: BACKHOUSE | S910: CONSIDINE | W910: McCANN | Y910: KENNY
A911: RUCKS | E911: LEACH | I911: McDONALD | M911: RICKETTS | S911: MORRISON | W911: KEATING | Y911: SMITH
A913: GRAND FINAL | E913: 7TH OCTOBER | J913: WEATHER | N913: SOUTH WIND WARM SUNNY
A914: RICHMOND | C914: 2 | D914: 2 | E914: 14 | G914: 3 | H914: 3 | I914: 21 | K914: 8 | L914: 6 | M914: 54 | O914: 9 | P914: 7 | Q914: =O914*6+P914 -> 61 | S914: EMCG
A915: NORTH MELBOURNE | C915: 0 | D915: 2 | E915: 2 | G915: 3 | H915: 3 | I915: 21 | K915: 3 | L915: 3 | M915: 21 | O915: 5 | P915: 6 | Q915: =O915*6+P915 -> 36 | S915: FREAME
A916: BEST PLAYERS
A917: RICHMOND | D917: RICKETTS | H917: MEGSON | K917: RUDDOCK | N917: KNELL | Q917: SYKES | T917: EDMONDS
A918: NORTH MELBOURNE | D918: M LONDERIGAN | H918: JOHNSON | K918: ROLENT | N918: SMITH | Q918: CONSIDINE | T918: BARNES
A919: GOALKICKERS
A920: RICHMOND | D920: KNELL 3 | G920: RICKETTS 2 | K920: SYKES 2 | N920: MEGSON | Q920: McDONALD
A921: NORTH MELBOURNE | D921: CONSIDINE 2 | H921: C LONDERIGAN | L921: M LONDERIGAN | P921: GROVES
A923: TEAMS | I923: RICHMOND | W923: NORTH MELBOURNE | Y923: (PROBABLE)
A925: BACKS | E925: SMITH | I925: BOWNAS | M925: LANG | S925: THORPE | W925: McDERMOTT | Y925: BARNES
A926: HALF-BACKS | E926: RUDDOCK | I926: C WILLIAMS | M926: EDMONDS | S926: JAMIESON | W926: JOHNSON | Y926: RAPP
A927: CENTRES | E927: RIGBY | I927: SYKES | M927: LITHGOW | S927: C LONDERIGAN | W927: ROLENT | Y927: CARLTON
A928: HALF-FORWARDS | E928: CLEGHORN | I928: KNELL | M928: CARKEEK | S928: PRESCOTT | W928: GROVES | Y928: M LONDERIGAN
A929: FORWARDS | E929: MCDONALD | I929: HUTCHINSON | M929: MEGSON | S929: CONSIDINE | W929: McCANN | Y929: KENNY
A930: RUCKS | E930: LEACH | I930: T WILLIAMS | M930: RICKETTS | S930: MORRISON | W930: KEATING | Y930: SMITH
A932: REPRESENTATIVE GAME | H932: 24TH JUNE | L932: WEATHER | O932: FINE
C933: 1ST QTR | G933: 2ND QTR | K933: 3RD QTR | O933: FINAL
A934: SOUTH AUSTRALIA | C934: 1 | D934: 5 | E934: =C934*6+D934 -> 11 | G934: 4 | H934: 10 | I934: =G934*6+H934 -> 34 | K934: 7 | L934: 13 | M934: =K934*6+L934 -> 55 | O934: 8 | P934: 14 | Q934: =O934*6+P934 -> 62 | S934: RICHMOND
A935: V F A | C935: 1 | D935: 4 | E935: =C935*6+D935 -> 10 | G935: 4 | H935: 9 | I935: =G935*6+H935 -> 33 | K935: 4 | L935: 13 | M935: =K935*6+L935 -> 37 | O935: 6 | P935: 19 | Q935: =O935*6+P935 -> 55
A936: BEST PLAYERS
A937: SOUTH AUST | D937: REES | H937: MILLER | K937: JOHNS | N937: J DALY | Q937: TREDREA | T937: BAHR
A938: V F A | D938: RICKETTS | H938: KNOX | K938: ROURKE | N938: S HALL | Q938: CHASE | T938: DAVIS
A939: GOALKICKERS
A940: SOUTH AUST | D940: WAYE 2 | G940: McGAVISH | J940: DAVIS | L940: BAHR | N940: STRAUSS | Q940: J DALY | S940: JOHNS
A941: V F A | D941: CROFT 3 | G941: RICKETTS 2 | K941: TORPEY
A943: TEAMS | H943: SOUTH AUSTRALIA | W943: V.F.A.
A945: BACKS | E945: TIERNEY | I945: EWERS | M945: JAMES | S945: ANDREWS | W945: HALL | Y945: CHASE
A946: HALF-BACKS | E946: MACKENZIE | I946: GOALLING | M946: McKENNA | S946: WATSON | W946: GAVIN | Y946: MARMO
A947: CENTRES | E947: ALDERSLEY | I947: FLETCHER | M947: REES | S947: LAXTON | W947: KNOX | Y947: DAVIS
A948: HALF-FORWARDS | E948: BAHR | I948: WAYE | M948: TREDREA | S948: LEACH | W948: LETHBRIDGE | Y948: GIRDWOOD
A949: FORWARDS | E949: JOHNS | I949: DALY | M949: MILLER | S949: RICKETTS | W949: CROFT | Y949: M LONDERIGAN
A950: RUCKS | E950: DAVIS | I950: McGAVISH | M950: STRAWNS | S950: HEDLEY | W950: ROURKE | Y950: TORPEY
A952: REPRESENTATIVE GAME | I952: 5TH AUGUST
A954: SOUTH AUSTRALIA | C954: 2 | D954: 6 | E954: =C954*6+D954 -> 18 | G954: 5 | H954: 7 | I954: =G954*6+H954 -> 37 | K954: 6 | L954: 12 | M954: =K954*6+L954 -> 48 | O954: 7 | P954: 12 | Q954: =O954*6+P954 -> 54 | S954: ADEL
A955: V F A | C955: 1 | D955: 1 | E955: =C955*6+D955 -> 7 | G955: 4 | H955: 4 | I955: =G955*6+H955 -> 28 | K955: 6 | L955: 6 | M955: =K955*6+L955 -> 42 | O955: 7 | P955: 9 | Q955: =O955*6+P955 -> 51
A956: BEST PLAYERS
A957: SOUTH AUST
A958: V F A
A959: GOALKICKERS
A960: SOUTH AUST
A961: V F A
A963: TEAM SQUADS | H963: SOUTH AUSTRALIA | W963: V.F.A.
E965: BAKER | I965: CORSTEN | M965: DALY | S965: ALLEY | W965: CHASE | Y965: CONSIDINE
E966: DAVIS | I966: DEMPSTER | M966: EWERS | S966: DAVIS | W966: GAVIN | Y966: HALL
E967: GOSLING | I967: GOSSE | M967: JOHNS | S967: HUGHES | W967: KNELL | Y967: KNOX
E968: LUGG | I968: McGAVISH | M968: MACKENZIE | S968: LAXTON | W968: MARMO | Y968: PAIN
E969: H MILLER | I969: MILLER | M969: REES | S969: RICKETTS | W969: ROURKE | Y969: SULLIVAN
E970: STRAWNS | I970: TREDREA | M970: WAYE | S970: TORPEY | W970: WATSON | Y970: WHITE
A972: CHARITY MATCH | G972: 14TH OCTOBER
A974: COLLINGWOOD | C974: 4 | D974: 4 | E974: =C974*6+D974 -> 28 | G974: 7 | H974: 8 | I974: =G974*6+H974 -> 50 | K974: 9 | L974: 9 | M974: =K974*6+L974 -> 63 | O974: 12 | P974: 9 | Q974: =O974*6+P974 -> 81
A975: RICHMOND | C975: 0 | D975: 0 | E975: =C975*6+D975 -> 0 | G975: 2 | H975: 2 | I975: =G975*6+H975 -> 14 | K975: 4 | L975: 10 | M975: =K975*6+L975 -> 34 | O975: 10 | P975: 11 | Q975: =O975*6+P975 -> 71
A976: BEST PLAYERS
A977: COLLINGWOOD
A978: RICHMOND
A979: GOALKICKERS
A980: COLLINGWOOD | D980: LEE 4 | G980: NASH 3 | J980: OGDEN 3 | M980: ROWELL | P980: KIERNAN
A981: RICHMOND | D981: McDONALD 4 | H981: ALLEY | J981: SYKES | L981: EDMONDS | O981: MEGSON | R981: LUFF | T981: CLEGHORN
A983: TEAMS | I983: COLLINGWOOD | W983: RICHMOND
A985: BACKS | E985: BENNETT | I985: PROUDFOOT | M985: JACOBS | S985: C WILLIAMS | W985: HUESKER | Y985: BOWNAS
A986: HALF-BACKS | E986: RUSA | I986: MONOHAN | M986: DUMMETT | S986: MARMO | W986: BACKHOUSE | Y986: RUDDOCK
A987: CENTRES | E987: GREEN | I987: McHALE | M987: PANNAM | S987: LITHGOW | W987: CLEGHORN | Y987: RUDD
A988: HALF-FORWARDS | E988: ROWELL | I988: NASH | M988: DRINNAN | S988: ALLEY | W988: LUFF | Y988: EDMONDS
A989: FORWARDS | E989: KEIRNAN | I989: LEE | M989: OGDEN | S989: McDONALD | W989: SULLIVAN | Y989: MEGSON
A990: RUCKS | E990: STRACHAN | I990: CROSS | M990: MARSH | S990: SPEARS | W990: BROWN | Y990: SYKES