A1: Victorian Football Association
A2: Season 1906
A3: © Copyright Wal Williams | F3: First created: 2 August 2014
A4: Contact: joywalwi at gmail dot com | F4: Last updated: 30 July 2017 | W4: VFA Results and tables - Link to the main index page
A5: You are free to copy this document in whole or part provided that proper acknowledgement is given to the author. All rights reserved.
A7: YEAR 1906
A8: ROUND 1 | D8: 5TH MAY | J8: WEATHER | M8: NORTH WEST WIND CLOUDY BUT FINE
D9: 1ST QTR | H9: 2ND QTR | L9: 3RD QTR | P9: FINAL | S9: PLAYED AT
A10: WILLIAMSTOWN | C10: 2 | D10: 0 | E10: =C10*6+D10 -> 12 | G10: 7 | H10: 8 | I10: =G10*6+H10 -> 50 | K10: 9 | L10: 14 | M10: =K10*6+L10 -> 68 | O10: 10 | P10: 16 | Q10: =O10*6+P10 -> 76 | S10: PORT MELBOURNE | Y10: LADDER | AB10: ROUND | AD10: 1
A11: PORT MELBOURNE | C11: 3 | D11: 2 | E11: =C11*6+D11 -> 20 | G11: 3 | H11: 2 | I11: =G11*6+H11 -> 20 | K11: 4 | L11: 4 | M11: =K11*6+L11 -> 28 | O11: 4 | P11: 6 | Q11: =O11*6+P11 -> 30 | S11: UMPIRE
A12: BEST PLAYERS | S12: KRUSE | W12: TEAM | X12: W | Y12: L | Z12: D | AA12: FOR | AB12: AGST | AC12: % | AD12: PTS
A13: WILLIAMSTOWN | C13: MATTHEWS | F13: JONES | I13: LAMBERT | L13: DICK | N13: McKENZIE | Q13: GRAHAM
A14: PORT MELBOURNE | C14: DOYLE | F14: FRANKLIN | I14: LAVER | L14: CURTIS | N14: GILCHRIST | Q14: BRENNAN | W14: WEST MELBOURNE | X14: 1 | Y14: 0 | Z14: 0 | AA14: 65 | AB14: 6 | AC14: 1083.3333333333333 | AD14: 4
A15: GOALKICKERS | W15: RICHMOND | X15: 1 | Y15: 0 | Z15: 0 | AA15: 132 | AB15: 41 | AC15: 321.95121951219511 | AD15: 4
A16: WILLIAMSTOWN | C16: MATTHEWS 7 | W16: WILLIAMSTOWN | X16: 1 | Y16: 0 | Z16: 0 | AA16: 76 | AB16: 30 | AC16: 253.33333333333334 | AD16: 4
A17: PORT MELBOURNE | W17: NORTH MELBOURNE | X17: 1 | Y17: 0 | Z17: 0 | AA17: 45 | AB17: 27 | AC17: 166.66666666666666 | AD17: 4
A19: FOOTSCRAY | C19: 0 | D19: 2 | E19: =C19*6+D19 -> 2 | G19: 3 | H19: 7 | I19: =G19*6+H19 -> 25 | K19: 5 | L19: 10 | M19: =K19*6+L19 -> 40 | O19: 7 | P19: 16 | Q19: =O19*6+P19 -> 58 | S19: PRESTON | W19: FOOTSCRAY | X19: 1 | Y19: 0 | Z19: 0 | AA19: 58 | AB19: 38 | AC19: 152.63157894736841 | AD19: 4
A20: PRESTON | C20: 0 | D20: 1 | E20: =C20*6+D20 -> 1 | G20: 1 | H20: 6 | I20: =G20*6+H20 -> 12 | K20: 4 | L20: 8 | M20: =K20*6+L20 -> 32 | O20: 5 | P20: 8 | Q20: =O20*6+P20 -> 38 | S20: WOOLFE | W20: PRESTON | X20: 0 | Y20: 1 | Z20: 0 | AA20: 38 | AB20: 58 | AC20: 65.517241379310349 | AD20: 0
A21: BEST PLAYERS | W21: BRUNSWICK | X21: 0 | Y21: 1 | Z21: 0 | AA21: 27 | AB21: 45 | AC21: 60 | AD21: 0
A22: FOOTSCRAY | C22: HARRIS | F22: MARMO | I22: HEDLEY | L22: NEILSON | O22: RAVENHALL | R22: HUGHES | W22: PORT MELBOURNE | X22: 0 | Y22: 1 | Z22: 0 | AA22: 30 | AB22: 76 | AC22: 39.473684210526315 | AD22: 0
A23: PRESTON | C23: COLLINS | F23: OGDEN | I23: FLYNN | L23: S HALL | O23: BROWN | R23: TORPEY | W23: PRAHRAN | X23: 0 | Y23: 1 | Z23: 0 | AA23: 41 | AB23: 132 | AC23: 31.060606060606062 | AD23: 0
A24: GOALKICKERS | W24: ESSENDON | X24: 0 | Y24: 1 | Z24: 0 | AA24: 6 | AB24: 65 | AC24: 9.2307692307692299 | AD24: 0
A25: FOOTSCRAY
A26: PRESTON
A28: RICHMOND | C28: 5 | D28: 1 | E28: =C28*6+D28 -> 31 | G28: 9 | H28: 4 | I28: =G28*6+H28 -> 58 | K28: 15 | L28: 7 | M28: =K28*6+L28 -> 97 | O28: 20 | P28: 12 | Q28: =O28*6+P28 -> 132 | S28: TOORAK PARK
A29: PRAHRAN | C29: 1 | D29: 1 | E29: =C29*6+D29 -> 7 | G29: 1 | H29: 7 | I29: =G29*6+H29 -> 13 | K29: 3 | L29: 11 | M29: =K29*6+L29 -> 29 | O29: 5 | P29: 11 | Q29: =O29*6+P29 -> 41 | S29: ARMSTRONG
A30: BEST PLAYERS
A31: RICHMOND | C31: RUDDOCK | F31: LUFF | I31: LANG | L31: HILL | O31: TALBOT | R31: HENDRY
A32: PRAHRAN | C32: NEILL | F32: ROBERTS | I32: FRASER | L32: SWIFT | O32: HAUGHTON | R32: PENGLASE
A33: GOALKICKERS
A34: RICHMOND | C34: HUTCHINSON 7 | G34: KNELL 6 | J34: MILLS 3
A35: PRAHRAN
A37: NORTH MELBOURNE | C37: 2 | D37: 2 | E37: =C37*6+D37 -> 14 | G37: 3 | H37: 3 | I37: =G37*6+H37 -> 21 | K37: 4 | L37: 15 | M37: =K37*6+L37 -> 39 | O37: 5 | P37: 15 | Q37: =O37*6+P37 -> 45 | S37: NORTH MELB
A38: BRUNSWICK | C38: 0 | D38: 3 | E38: =C38*6+D38 -> 3 | G38: 1 | H38: 8 | I38: =G38*6+H38 -> 14 | K38: 1 | L38: 8 | M38: =K38*6+L38 -> 14 | O38: 3 | P38: 9 | Q38: =O38*6+P38 -> 27 | S38: ASPINALL
A39: BEST PLAYERS
A40: NORTH MELBOURNE | C40: LINEHAN | F40: M LONDERIGAN | J40: SMITH | M40: GROVES | P40: BROYLAN | S40: MARTIN
A41: BRUNSWICK | C41: CHASE | F41: COLLISON | J41: WHITFIELD | M41: BELCHER | P41: SERGEANT | S41: SMITH
A42: GOALKICKERS
A43: NORTH MELBOURNE
A44: BRUNSWICK
A46: WEST MELBOURNE | C46: 1 | D46: 2 | E46: =C46*6+D46 -> 8 | G46: 4 | H46: 5 | I46: =G46*6+H46 -> 29 | K46: 5 | L46: 6 | M46: =K46*6+L46 -> 36 | O46: 9 | P46: 11 | Q46: =O46*6+P46 -> 65 | S46: ESSENDON
A47: ESSENDON | C47: 0 | D47: 2 | E47: =C47*6+D47 -> 2 | G47: 0 | H47: 2 | I47: =G47*6+H47 -> 2 | K47: 0 | L47: 5 | M47: =K47*6+L47 -> 5 | O47: 0 | P47: 6 | Q47: =O47*6+P47 -> 6 | S47: FREAME
A48: BEST PLAYERS
A49: WEST MELBOURNE | C49: ARMSTRONG | F49: A GREGORY | J49: ANDREWS | M49: CLARKE | P49: JOHNSON | S49: HANNAFORD
A50: ESSENDON | C50: McINTYRE | F50: PAIN | J50: HORDERN | M50: MAKIN | P50: MARTIN | S50: MONTGOMERY
A51: GOALKICKERS
A52: WEST MELBOURNE
A53: ESSENDON
A55: ROUND 2 | D55: 12TH MAY | J55: WEATHER | M55: NORTH WIND OVERCAST DULL
D56: 1ST QTR | H56: 2ND QTR | L56: 3RD QTR | P56: FINAL | S56: PLAYED AT
A57: WEST MELBOURNE | C57: 0 | D57: 2 | E57: =C57*6+D57 -> 2 | G57: 5 | H57: 7 | I57: =G57*6+H57 -> 37 | K57: 5 | L57: 8 | M57: =K57*6+L57 -> 38 | O57: 10 | P57: 13 | Q57: =O57*6+P57 -> 73 | S57: NORTH MELB | Y57: LADDER | AB57: ROUND | AD57: 2
A58: NORTH MELBOURNE | C58: 5 | D58: 0 | E58: =C58*6+D58 -> 30 | G58: 5 | H58: 0 | I58: =G58*6+H58 -> 30 | K58: 8 | L58: 0 | M58: =K58*6+L58 -> 48 | O58: 8 | P58: 1 | Q58: =O58*6+P58 -> 49 | S58: UMPIRE
A59: BEST PLAYERS | S59: KRUSE | W59: TEAM | X59: W | Y59: L | Z59: D | AA59: FOR | AB59: AGST | AC59: % | AD59: PTS
A60: WEST MELBOURNE | C60: JOHNSON | F60: ARMSTRONG | I60: McCANN | L60: LIVINGSTONE | O60: RYAN | Q60: LAXTON
A61: NORTH MELBOURNE | C61: SMITH | F61: McVEIGH | I61: KEATING | L61: GROVES | O61: THORPE | Q61: LINEHAN | W61: WEST MELBOURNE | X61: 2 | Y61: 0 | Z61: 0 | AA61: 138 | AB61: 55 | AC61: 250.90909090909091 | AD61: 8
A62: GOALKICKERS | W62: RICHMOND | X62: 2 | Y62: 0 | Z62: 0 | AA62: 160 | AB62: 68 | AC62: 235.29411764705881 | AD62: 8
A63: WEST MELBOURNE | C63: McCANN 4 | F63: A GREGORY 2 | W63: WILLIAMSTOWN | X63: 2 | Y63: 0 | Z63: 0 | AA63: 168 | AB63: 86 | AC63: 195.34883720930233 | AD63: 8
A64: NORTH MELBOURNE | C64: KENNY 3 | F64: McVEIGH 2 | J64: M LONDERIGAN 2 | W64: FOOTSCRAY | X64: 1 | Y64: 1 | Z64: 0 | AA64: 85 | AB64: 66 | AC64: 128.78787878787878 | AD64: 4
A66: RICHMOND | C66: 0 | D66: 3 | E66: =C66*6+D66 -> 3 | G66: 0 | H66: 5 | I66: =G66*6+H66 -> 5 | K66: 2 | L66: 9 | M66: =K66*6+L66 -> 21 | O66: 3 | P66: 10 | Q66: =O66*6+P66 -> 28 | S66: FOOTSCRAY | W66: BRUNSWICK | X66: 1 | Y66: 1 | Z66: 0 | AA66: 74 | AB66: 76 | AC66: 97.368421052631575 | AD66: 4
A67: FOOTSCRAY | C67: 1 | D67: 4 | E67: =C67*6+D67 -> 10 | G67: 1 | H67: 5 | I67: =G67*6+H67 -> 11 | K67: 2 | L67: 7 | M67: =K67*6+L67 -> 19 | O67: 3 | P67: 9 | Q67: =O67*6+P67 -> 27 | S67: FREAME | W67: NORTH MELBOURNE | X67: 1 | Y67: 1 | Z67: 0 | AA67: 94 | AB67: 100 | AC67: 94 | AD67: 4
A68: BEST PLAYERS | W68: PORT MELBOURNE | X68: 1 | Y68: 1 | Z68: 0 | AA68: 67 | AB68: 106 | AC68: 63.20754716981132 | AD68: 4
A69: RICHMOND | C69: HILL | F69: KEENAN | I69: EDMONDS | L69: GEGGIE | N69: C WILLIAMS | Q69: HEANEY | W69: PRESTON | X69: 0 | Y69: 2 | Z69: 0 | AA69: 94 | AB69: 150 | AC69: 62.666666666666664 | AD69: 0
A70: FOOTSCRAY | C70: HARRIS | F70: NEILSON | I70: GLENISTER | L70: HEDLEY | N70: HUGHES | Q70: WILLIAMS | W70: PRAHRAN | X70: 0 | Y70: 2 | Z70: 0 | AA70: 72 | AB70: 179 | AC70: 40.22346368715084 | AD70: 0
A71: GOALKICKERS | W71: ESSENDON | X71: 0 | Y71: 2 | Z71: 0 | AA71: 36 | AB71: 102 | AC71: 35.294117647058826 | AD71: 0
A72: RICHMOND | C72: HUTCHINSON 2
A73: FOOTSCRAY
A75: WILLIAMSTOWN | C75: 3 | D75: 5 | E75: =C75*6+D75 -> 23 | G75: 6 | H75: 8 | I75: =G75*6+H75 -> 44 | K75: 13 | L75: 12 | M75: =K75*6+L75 -> 90 | O75: 13 | P75: 14 | Q75: =O75*6+P75 -> 92 | S75: WILLIAMSTOWN
A76: PRESTON | C76: 3 | D76: 0 | E76: =C76*6+D76 -> 18 | G76: 6 | H76: 1 | I76: =G76*6+H76 -> 37 | K76: 6 | L76: 1 | M76: =K76*6+L76 -> 37 | O76: 9 | P76: 2 | Q76: =O76*6+P76 -> 56 | S76: ARMSTRONG
A77: BEST PLAYERS
A78: WILLIAMSTOWN | C78: JONES | F78: BRITT | I78: ALLEY | K78: FLETCHER | N78: WOODS | Q78: LAMBERT
A79: PRESTON | C79: LANDELLS | F79: TORPEY | I79: COLLINS | K79: P HALL | N79: BROWN | Q79: OGDEN
A80: GOALKICKERS
A81: WILLIAMSTOWN | C81: MATTHEWS 6
A82: PRESTON | C82: LANDELLS 4 | G82: P HALL 2
A84: BRUNSWICK | C84: 2 | D84: 8 | E84: =C84*6+D84 -> 20 | G84: 2 | H84: 12 | I84: =G84*6+H84 -> 24 | K84: 4 | L84: 16 | M84: =K84*6+L84 -> 40 | O84: 5 | P84: 17 | Q84: =O84*6+P84 -> 47 | S84: BRUNSWICK
A85: PRAHRAN | C85: 1 | D85: 0 | E85: =C85*6+D85 -> 6 | G85: 2 | H85: 1 | I85: =G85*6+H85 -> 13 | K85: 3 | L85: 1 | M85: =K85*6+L85 -> 19 | O85: 5 | P85: 1 | Q85: =O85*6+P85 -> 31 | S85: KENNEDY
A86: BEST PLAYERS
A87: BRUNSWICK
A88: PRAHRAN
A89: GOALKICKERS
A90: BRUNSWICK | C90: MULVANEY 2 | G90: ROLFE 2
A91: PRAHRAN | C91: ELLIS 2 | F91: CROSS 2
A93: PORT MELBOURNE | C93: 0 | D93: 3 | E93: =C93*6+D93 -> 3 | G93: 1 | H93: 8 | I93: =G93*6+H93 -> 14 | K93: 1 | L93: 10 | M93: =K93*6+L93 -> 16 | O93: 4 | P93: 13 | Q93: =O93*6+P93 -> 37 | S93: ESSENDON
A94: ESSENDON | C94: 1 | D94: 5 | E94: =C94*6+D94 -> 11 | G94: 1 | H94: 6 | I94: =G94*6+H94 -> 12 | K94: 3 | L94: 12 | M94: =K94*6+L94 -> 30 | O94: 3 | P94: 12 | Q94: =O94*6+P94 -> 30 | S94: O'LOUGHLIN
A95: BEST PLAYERS
A96: PORT MELBOURNE
A97: ESSENDON
A98: GOALKICKERS
A99: PORT MELBOURNE | C99: LAVER
A100: ESSENDON
A102: ROUND 3 | D102: 19TH MAY | J102: WEATHER | M102: LIGHT NORTH WIND OVERCAST
D103: 1ST QTR | H103: 2ND QTR | L103: 3RD QTR | P103: FINAL | S103: PLAYED AT
A104: WEST MELBOURNE | C104: 4 | D104: 0 | E104: =C104*6+D104 -> 24 | G104: 4 | H104: 5 | I104: =G104*6+H104 -> 29 | K104: 5 | L104: 5 | M104: =K104*6+L104 -> 35 | O104: 5 | P104: 7 | Q104: =O104*6+P104 -> 37 | S104: NORTH MELB | Y104: LADDER | AB104: ROUND | AD104: 3
A105: FOOTSCRAY | C105: 1 | D105: 2 | E105: =C105*6+D105 -> 8 | G105: 2 | H105: 2 | I105: =G105*6+H105 -> 14 | K105: 3 | L105: 5 | M105: =K105*6+L105 -> 23 | O105: 5 | P105: 7 | Q105: =O105*6+P105 -> 37 | S105: UMPIRE
A106: BEST PLAYERS | S106: ARMSTRONG | W106: TEAM | X106: W | Y106: L | Z106: D | AA106: FOR | AB106: AGST | AC106: % | AD106: PTS
A107: WEST MELBOURNE | C107: H GREGORY | F107: A GREGORY | I107: LIVINGSTONE | L107: ARMSTRONG | O107: LAXTON | Q107: JOHNSON
A108: FOOTSCRAY | C108: MARMO | F108: WROUT | I108: HINCH | L108: JACOBSEN | O108: HUGHES | Q108: HEDLEY | W108: RICHMOND | X108: 3 | Y108: 0 | Z108: 0 | AA108: 210 | AB108: 86 | AC108: 244.18604651162789 | AD108: 12
A109: GOALKICKERS | W109: WILLIAMSTOWN | X109: 3 | Y109: 0 | Z109: 0 | AA109: 263 | AB109: 114 | AC109: 230.7017543859649 | AD109: 12
A110: WEST MELBOURNE | W110: WEST MELBOURNE | X110: 2 | Y110: 0 | Z110: 1 | AA110: 175 | AB110: 92 | AC110: 190.21739130434781 | AD110: 10
A111: FOOTSCRAY | C111: McCOLL 3 | W111: NORTH MELBOURNE | X111: 2 | Y111: 1 | Z111: 0 | AA111: 139 | AB111: 124 | AC111: 112.09677419354838 | AD111: 8
A113: RICHMOND | C113: 1 | D113: 6 | E113: =C113*6+D113 -> 12 | G113: 2 | H113: 10 | I113: =G113*6+H113 -> 22 | K113: 4 | L113: 14 | M113: =K113*6+L113 -> 38 | O113: 5 | P113: 20 | Q113: =O113*6+P113 -> 50 | S113: RICHMOND | W113: FOOTSCRAY | X113: 1 | Y113: 1 | Z113: 1 | AA113: 122 | AB113: 103 | AC113: 118.44660194174757 | AD113: 6
A114: BRUNSWICK | C114: 0 | D114: 1 | E114: =C114*6+D114 -> 1 | G114: 1 | H114: 2 | I114: =G114*6+H114 -> 8 | K114: 2 | L114: 4 | M114: =K114*6+L114 -> 16 | O114: 2 | P114: 6 | Q114: =O114*6+P114 -> 18 | S114: KRUSE | W114: PRESTON | X114: 1 | Y114: 2 | Z114: 0 | AA114: 183 | AB114: 196 | AC114: 93.367346938775512 | AD114: 4
A115: BEST PLAYERS | W115: BRUNSWICK | X115: 1 | Y115: 2 | Z115: 0 | AA115: 92 | AB115: 126 | AC115: 73.015873015873012 | AD115: 4
A116: RICHMOND | C116: HANNAN | F116: HEANEY | I116: KEENAN | L116: C WILLIAMS | O116: BENNISON | R116: FILDES | W116: PORT MELBOURNE | X116: 1 | Y116: 2 | Z116: 0 | AA116: 113 | AB116: 195 | AC116: 57.948717948717949 | AD116: 4
A117: BRUNSWICK | C117: CHASE | F117: BRAID | I117: CRINNION | L117: COLLISON | O117: CARMAN | R117: ANDREWS | W117: PRAHRAN | X117: 0 | Y117: 3 | Z117: 0 | AA117: 96 | AB117: 224 | AC117: 42.857142857142854 | AD117: 0
A118: GOALKICKERS | W118: ESSENDON | X118: 0 | Y118: 3 | Z118: 0 | AA118: 64 | AB118: 197 | AC118: 32.487309644670049 | AD118: 0
A119: RICHMOND
A120: BRUNSWICK
A122: PRESTON | C122: 4 | D122: 6 | E122: =C122*6+D122 -> 30 | G122: 8 | H122: 6 | I122: =G122*6+H122 -> 54 | K122: 12 | L122: 7 | M122: =K122*6+L122 -> 79 | O122: 13 | P122: 11 | Q122: =O122*6+P122 -> 89 | S122: PRESTON
A123: PORT MELBOURNE | C123: 0 | D123: 1 | E123: =C123*6+D123 -> 1 | G123: 2 | H123: 5 | I123: =G123*6+H123 -> 17 | K123: 4 | L123: 6 | M123: =K123*6+L123 -> 30 | O123: 6 | P123: 10 | Q123: =O123*6+P123 -> 46 | S123: KENNEDY
A124: BEST PLAYERS
A125: PRESTON | C125: COLLINS | F125: S HALL | I125: TORPEY | K125: MASON | N125: HARRINGTON | Q125: LANDELLS
A126: PORT MELBOURNE | C126: WOOD | F126: FRANKLIN | I126: COPE | K126: READ | N126: LAVER | Q126: McDONALD
A127: GOALKICKERS
A128: PRESTON | C128: GILBERT 4 | F128: LANDELLS 3 | J128: P HALL 3
A129: PORT MELBOURNE
A131: NORTH MELBOURNE | C131: 2 | D131: 4 | E131: =C131*6+D131 -> 16 | G131: 2 | H131: 6 | I131: =G131*6+H131 -> 18 | K131: 5 | L131: 7 | M131: =K131*6+L131 -> 37 | O131: 5 | P131: 9 | Q131: =O131*6+P131 -> 39 | S131: TOORAK PARK
A132: PRAHRAN | C132: 0 | D132: 4 | E132: =C132*6+D132 -> 4 | G132: 1 | H132: 5 | I132: =G132*6+H132 -> 11 | K132: 1 | L132: 8 | M132: =K132*6+L132 -> 14 | O132: 2 | P132: 12 | Q132: =O132*6+P132 -> 24 | S132: FREAME
A133: BEST PLAYERS
A134: NORTH MELBOURNE | C134: BOYLE | F134: McVEIGH | I134: PITT | K134: RAPP | M134: M LONDERIGAN | Q134: WATSON
A135: PRAHRAN | C135: HAIGHBLOOM | F135: TRUSCOTT | I135: CROSS | K135: ELLIS | M135: ROBERTS | Q135: SMITH
A136: GOALKICKERS
A137: NORTH MELBOURNE
A138: PRAHRAN
A140: WILLIAMSTOWN | C140: 2 | D140: 2 | E140: =C140*6+D140 -> 14 | G140: 6 | H140: 5 | I140: =G140*6+H140 -> 41 | K140: 8 | L140: 10 | M140: =K140*6+L140 -> 58 | O140: 14 | P140: 11 | Q140: =O140*6+P140 -> 95 | S140: WILLIAMSTOWN
A141: ESSENDON | C141: 1 | D141: 1 | E141: =C141*6+D141 -> 7 | G141: 2 | H141: 2 | I141: =G141*6+H141 -> 14 | K141: 3 | L141: 3 | M141: =K141*6+L141 -> 21 | O141: 4 | P141: 4 | Q141: =O141*6+P141 -> 28 | S141: ASPINALL
A142: BEST PLAYERS
A143: WILLIAMSTOWN | C143: MATTHEWS | F143: KERR | I143: JONES | K143: ALLEY | N143: McKENZIE | Q143: LAMBERT
A144: ESSENDON | C144: BENNETT | F144: MONCUR | I144: PAIN | K144: McINTYRE | N144: CHEFFERS | Q144: WILLIAMS
A145: GOALKICKERS
A146: WILLIAMSTOWN | C146: MATTHEWS 8
A147: ESSENDON | C147: MAKIN 3
A149: ROUND 4 | D149: 26TH MAY | J149: WEATHER | M149: STRONG NORTH WEST WIND RAIN
D150: 1ST QTR | H150: 2ND QTR | L150: 3RD QTR | P150: FINAL | S150: PLAYED AT
A151: WEST MELBOURNE | C151: 0 | D151: 2 | E151: =C151*6+D151 -> 2 | G151: 1 | H151: 5 | I151: =G151*6+H151 -> 11 | K151: 2 | L151: 6 | M151: =K151*6+L151 -> 18 | O151: 4 | P151: 7 | Q151: =O151*6+P151 -> 31 | S151: NORTH MELB | Y151: LADDER | AB151: ROUND | AD151: 4
A152: WILLIAMSTOWN | C152: 0 | D152: 4 | E152: =C152*6+D152 -> 4 | G152: 0 | H152: 7 | I152: =G152*6+H152 -> 7 | K152: 2 | L152: 7 | M152: =K152*6+L152 -> 19 | O152: 3 | P152: 9 | Q152: =O152*6+P152 -> 27 | S152: UMPIRE
A153: BEST PLAYERS | S153: KRUSE | W153: TEAM | X153: W | Y153: L | Z153: D | AA153: FOR | AB153: AGST | AC153: % | AD153: PTS
A154: WEST MELBOURNE | C154: ARMSTRONG | F154: A GREGORY | I154: ROURKE | K154: MINTO | M154: WILLIAMSON | P154: LAXTON
A155: WILLIAMSTOWN | C155: JONES | F155: GRAHAM | I155: McKENZIE | K155: WOODS | M155: LEWIS | P155: ALLEY | W155: RICHMOND | X155: 4 | Y155: 0 | Z155: 0 | AA155: 245 | AB155: 96 | AC155: 255.20833333333334 | AD155: 16
A156: GOALKICKERS | W156: WEST MELBOURNE | X156: 3 | Y156: 0 | Z156: 1 | AA156: 206 | AB156: 119 | AC156: 173.109243697479 | AD156: 14
A157: WEST MELBOURNE | C157: McCANN 3 | W157: WILLIAMSTOWN | X157: 3 | Y157: 1 | Z157: 0 | AA157: 290 | AB157: 145 | AC157: 200 | AD157: 12
A158: WILLIAMSTOWN | C158: MATTHEWS 2 | W158: NORTH MELBOURNE | X158: 3 | Y158: 1 | Z158: 0 | AA158: 200 | AB158: 163 | AC158: 122.69938650306749 | AD158: 12
A160: NORTH MELBOURNE | C160: 1 | D160: 1 | E160: =C160*6+D160 -> 7 | G160: 4 | H160: 13 | I160: =G160*6+H160 -> 37 | K160: 5 | L160: 13 | M160: =K160*6+L160 -> 43 | O160: 7 | P160: 19 | Q160: =O160*6+P160 -> 61 | S160: PRESTON | W160: FOOTSCRAY | X160: 2 | Y160: 1 | Z160: 1 | AA160: 202 | AB160: 126 | AC160: 160.31746031746033 | AD160: 10
A161: PRESTON | C161: 2 | D161: 6 | E161: =C161*6+D161 -> 18 | G161: 3 | H161: 6 | I161: =G161*6+H161 -> 24 | K161: 5 | L161: 9 | M161: =K161*6+L161 -> 39 | O161: 5 | P161: 9 | Q161: =O161*6+P161 -> 39 | S161: PYMM | W161: BRUNSWICK | X161: 2 | Y161: 2 | Z161: 0 | AA161: 175 | AB161: 153 | AC161: 114.37908496732027 | AD161: 8
A162: BEST PLAYERS | W162: PRESTON | X162: 1 | Y162: 3 | Z162: 0 | AA162: 222 | AB162: 257 | AC162: 86.381322957198449 | AD162: 4
A163: NORTH MELBOURNE | C163: BOYLE | E163: LINEHAN | H163: M LONDERIGAN | K163: McVEIGH | M163: KEATING | O163: WATSON | W163: PORT MELBOURNE | X163: 1 | Y163: 3 | Z163: 0 | AA163: 123 | AB163: 230 | AC163: 53.478260869565219 | AD163: 4
A164: PRESTON | C164: S HALL | E164: LANDELLS | H164: OGDEN | K164: FLYNN | M164: GILBERT | O164: HARRINGTON | W164: PRAHRAN | X164: 0 | Y164: 4 | Z164: 0 | AA164: 119 | AB164: 304 | AC164: 39.14473684210526 | AD164: 0
A165: GOALKICKERS | W165: ESSENDON | X165: 0 | Y165: 4 | Z165: 0 | AA165: 91 | AB165: 280 | AC165: 32.5 | AD165: 0
A166: NORTH MELBOURNE | C166: KENNY 4 | F166: LINEHAN
A167: PRESTON
A169: FOOTSCRAY | C169: 3 | D169: 7 | E169: =C169*6+D169 -> 25 | G169: 4 | H169: 7 | I169: =G169*6+H169 -> 31 | K169: 10 | L169: 14 | M169: =K169*6+L169 -> 74 | O169: 11 | P169: 14 | Q169: =O169*6+P169 -> 80 | S169: FOOTSCRAY
A170: PRAHRAN | C170: 0 | D170: 0 | E170: =C170*6+D170 -> 0 | G170: 1 | H170: 4 | I170: =G170*6+H170 -> 10 | K170: 1 | L170: 4 | M170: =K170*6+L170 -> 10 | O170: 3 | P170: 5 | Q170: =O170*6+P170 -> 23 | S170: O'LOUGHLIN
A171: BEST PLAYERS
A172: FOOTSCRAY | C172: HEDLEY | F172: HUGHES | I172: NEILSON | L172: HINCH | N172: HARRIS | Q172: GREENWOOD
A173: PRAHRAN | C173: DOWDING | F173: HAIGHBLOOM | I173: TRUSCOTT | L173: ROBERTS | N173: PENGLASE | Q173: DENHOLM
A174: GOALKICKERS
A175: FOOTSCRAY | C175: McCOLL 3 | F175: GLENISTER 2 | J175: HEDLEY 2
A176: PRAHRAN
A178: BRUNSWICK | C178: 2 | D178: 5 | E178: =C178*6+D178 -> 17 | G178: 6 | H178: 10 | I178: =G178*6+H178 -> 46 | K178: 8 | L178: 12 | M178: =K178*6+L178 -> 60 | O178: 11 | P178: 17 | Q178: =O178*6+P178 -> 83 | S178: BRUNSWICK
A179: ESSENDON | C179: 2 | D179: 1 | E179: =C179*6+D179 -> 13 | G179: 2 | H179: 2 | I179: =G179*6+H179 -> 14 | K179: 3 | L179: 7 | M179: =K179*6+L179 -> 25 | O179: 3 | P179: 9 | Q179: =O179*6+P179 -> 27 | S179: FREAME
A180: BEST PLAYERS
A181: BRUNSWICK | C181: L SMITH | F181: H SMITH | I181: WHITFIELD | L181: ANDREWS | N181: COLLISON | Q181: BELCHER
A182: ESSENDON | C182: DYSON | F182: DUFF | I182: McNAMARA | L182: PAIN | N182: SHELDON | Q182: BARLOW
A183: GOALKICKERS
A184: BRUNSWICK | C184: L SMITH 4 | F184: CHASE 2 | I184: SERGEANT 2 | M184: WAGLAND 2
A185: ESSENDON | C185: MAKIN 3
A187: RICHMOND | C187: 0 | D187: 3 | E187: =C187*6+D187 -> 3 | G187: 0 | H187: 6 | I187: =G187*6+H187 -> 6 | K187: 2 | L187: 6 | M187: =K187*6+L187 -> 18 | O187: 4 | P187: 11 | Q187: =O187*6+P187 -> 35 | S187: PORT MELB
A188: PORT MELBOURNE | C188: 1 | D188: 1 | E188: =C188*6+D188 -> 7 | G188: 1 | H188: 1 | I188: =G188*6+H188 -> 7 | K188: 1 | L188: 4 | M188: =K188*6+L188 -> 10 | O188: 1 | P188: 4 | Q188: =O188*6+P188 -> 10 | S188: ARMSTRONG
A189: BEST PLAYERS
A190: RICHMOND | C190: BENNISON | F190: HARDIMAN | I190: GEGGIE | L190: EDMONDS | N190: HILL | P190: HUTCHINSON
A191: PORT MELBOURNE | C191: COPE | F191: THAW | I191: TREGLOWAN | L191: LAVER | N191: WARD | P191: BAIRD
A192: GOALKICKERS
A193: RICHMOND
A194: PORT MELBOURNE
A196: ROUND 5 | D196: 2ND JUNE | J196: WEATHER | M196: NORTH BREEZE
D197: 1ST QTR | H197: 2ND QTR | L197: 3RD QTR | P197: FINAL | S197: PLAYED AT
A198: WILLIAMSTOWN | C198: 0 | D198: 3 | E198: =C198*6+D198 -> 3 | G198: 5 | H198: 9 | I198: =G198*6+H198 -> 39 | K198: 6 | L198: 9 | M198: =K198*6+L198 -> 45 | O198: 10 | P198: 11 | Q198: =O198*6+P198 -> 71 | S198: RICHMOND | Y198: LADDER | AB198: ROUND | AD198: 5
A199: RICHMOND | C199: 1 | D199: 3 | E199: =C199*6+D199 -> 9 | G199: 1 | H199: 3 | I199: =G199*6+H199 -> 9 | K199: 5 | L199: 7 | M199: =K199*6+L199 -> 37 | O199: 6 | P199: 8 | Q199: =O199*6+P199 -> 44 | S199: UMPIRE
A200: BEST PLAYERS | S200: PYMM | W200: TEAM | X200: W | Y200: L | Z200: D | AA200: FOR | AB200: AGST | AC200: % | AD200: PTS
A201: WILLIAMSTOWN | C201: GRAHAM | F201: FLETCHER | I201: JONES | K201: KERR | M201: GARBUTT | P201: WOODS
A202: RICHMOND | C202: C WILLIAMS | F202: BOWNAS | I202: HILL | K202: GEGGIE | M202: SYKES | P202: CARKEEK | W202: WEST MELBOURNE | X202: 4 | Y202: 0 | Z202: 1 | AA202: 275 | AB202: 130 | AC202: 211.53846153846155 | AD202: 18
A203: GOALKICKERS | W203: WILLIAMSTOWN | X203: 4 | Y203: 1 | Z203: 0 | AA203: 361 | AB203: 189 | AC203: 191.00529100529101 | AD203: 16
A204: WILLIAMSTOWN | C204: JONES 4 | F204: MATTHEWS 3 | W204: RICHMOND | X204: 4 | Y204: 1 | Z204: 0 | AA204: 289 | AB204: 167 | AC204: 173.05389221556885 | AD204: 16
A205: RICHMOND | W205: NORTH MELBOURNE | X205: 4 | Y205: 1 | Z205: 0 | AA205: 235 | AB205: 185 | AC205: 127.02702702702703 | AD205: 16
A207: NORTH MELBOURNE | C207: 4 | D207: 2 | E207: =C207*6+D207 -> 26 | G207: 4 | H207: 4 | I207: =G207*6+H207 -> 28 | K207: 5 | L207: 4 | M207: =K207*6+L207 -> 34 | O207: 5 | P207: 5 | Q207: =O207*6+P207 -> 35 | S207: NORTH MELB | W207: BRUNSWICK | X207: 3 | Y207: 2 | Z207: 0 | AA207: 235 | AB207: 195 | AC207: 120.51282051282051 | AD207: 12
A208: FOOTSCRAY | C208: 0 | D208: 0 | E208: =C208*6+D208 -> 0 | G208: 1 | H208: 4 | I208: =G208*6+H208 -> 10 | K208: 1 | L208: 4 | M208: =K208*6+L208 -> 10 | O208: 3 | P208: 4 | Q208: =O208*6+P208 -> 22 | S208: FREAME | W208: FOOTSCRAY | X208: 2 | Y208: 2 | Z208: 1 | AA208: 224 | AB208: 161 | AC208: 139.13043478260869 | AD208: 10
A209: BEST PLAYERS | W209: PRESTON | X209: 1 | Y209: 4 | Z209: 0 | AA209: 264 | AB209: 317 | AC209: 83.280757097791792 | AD209: 4
A210: NORTH MELBOURNE | C210: M LONDERIGAN | F210: BOYLE | H210: LINEHAN | K210: KENNY | M210: McVEIGH | P210: SMITH | W210: PRAHRAN | X210: 1 | Y210: 4 | Z210: 0 | AA210: 163 | AB210: 338 | AC210: 48.22485207100592 | AD210: 4
A211: FOOTSCRAY | C211: MARMO | F211: NEILSON | H211: JACOBSEN | K211: McKINLEY | M211: HUGHES | P211: HINCH | W211: PORT MELBOURNE | X211: 1 | Y211: 4 | Z211: 0 | AA211: 134 | AB211: 299 | AC211: 44.816053511705682 | AD211: 4
A212: GOALKICKERS | W212: ESSENDON | X212: 0 | Y212: 5 | Z212: 0 | AA212: 125 | AB212: 324 | AC212: 38.580246913580247 | AD212: 0
A213: NORTH MELBOURNE | C213: KENNY 3
A214: FOOTSCRAY
A216: BRUNSWICK | C216: 2 | D216: 1 | E216: =C216*6+D216 -> 13 | G216: 4 | H216: 8 | I216: =G216*6+H216 -> 32 | K216: 5 | L216: 8 | M216: =K216*6+L216 -> 38 | O216: 8 | P216: 12 | Q216: =O216*6+P216 -> 60 | S216: BRUNSWICK
A217: PRESTON | C217: 3 | D217: 3 | E217: =C217*6+D217 -> 21 | G217: 4 | H217: 3 | I217: =G217*6+H217 -> 27 | K217: 5 | L217: 5 | M217: =K217*6+L217 -> 35 | O217: 6 | P217: 6 | Q217: =O217*6+P217 -> 42 | S217: ASPINALL
A218: BEST PLAYERS
A219: BRUNSWICK | C219: CHASE | F219: ANDREWS | I219: ROLFE | L219: LOGAN | N219: BELCHER | Q219: L SMITH
A220: PRESTON | C220: HANSEN | F220: WHITE | I220: HARRINGTON | L220: OGDEN | N220: LANDELLS | Q220: S HALL
A221: GOALKICKERS
A222: BRUNSWICK | C222: L SMITH 3 | G222: OGDEN 2 | J222: BALFE 2
A223: PRESTON | C223: LANDELLS 3 | G223: GILBERT 2
A225: PRAHRAN | C225: 1 | D225: 1 | E225: =C225*6+D225 -> 7 | G225: 2 | H225: 8 | I225: =G225*6+H225 -> 20 | K225: 4 | L225: 12 | M225: =K225*6+L225 -> 36 | O225: 5 | P225: 14 | Q225: =O225*6+P225 -> 44 | S225: ESSENDON
A226: ESSENDON | C226: 1 | D226: 2 | E226: =C226*6+D226 -> 8 | G226: 3 | H226: 3 | I226: =G226*6+H226 -> 21 | K226: 4 | L226: 4 | M226: =K226*6+L226 -> 28 | O226: 5 | P226: 4 | Q226: =O226*6+P226 -> 34 | S226: KRUSE
A227: BEST PLAYERS
A228: PRAHRAN | C228: G BROWN | F228: LETHBRIDGE | I228: CROSS | K228: HAIGHBLOOM | N228: DOWDING | Q228: ROCHE
A229: ESSENDON | C229: PAIN | F229: BENNETT | I229: DYSON | K229: MONTGOMERY
A230: GOALKICKERS
A231: PRAHRAN | C231: CROSS 4
A232: ESSENDON
A234: WEST MELBOURNE | C234: 3 | D234: 2 | E234: =C234*6+D234 -> 20 | G234: 3 | H234: 5 | I234: =G234*6+H234 -> 23 | K234: 8 | L234: 8 | M234: =K234*6+L234 -> 56 | O234: 10 | P234: 9 | Q234: =O234*6+P234 -> 69 | S234: PORT MELB
A235: PORT MELBOURNE | C235: 0 | D235: 4 | E235: =C235*6+D235 -> 4 | G235: 0 | H235: 4 | I235: =G235*6+H235 -> 4 | K235: 1 | L235: 5 | M235: =K235*6+L235 -> 11 | O235: 1 | P235: 5 | Q235: =O235*6+P235 -> 11 | S235: ARMSTRONG
A236: BEST PLAYERS
A237: WEST MELBOURNE | C237: HALL | E237: McCANN | G237: LAXTON | I237: H GREGORY | L237: MADDEN | O237: RANKIN
A238: PORT MELBOURNE | C238: WARD | E238: BAIRD | G238: JACKSON | I238: COPE | L238: ROBINSON | O238: INGHAM
A239: GOALKICKERS
A240: WEST MELBOURNE | C240: McCANN 3 | F240: ARMSTRONG 2 | J240: A GREGORY 2
A241: PORT MELBOURNE
A243: ROUND 6 | D243: 9TH JUNE | J243: WEATHER | M243: STRONG NORTH WIND
D244: 1ST QTR | H244: 2ND QTR | L244: 3RD QTR | P244: FINAL | S244: PLAYED AT
A245: NORTH MELBOURNE | C245: 4 | D245: 4 | E245: =C245*6+D245 -> 28 | G245: 4 | H245: 5 | I245: =G245*6+H245 -> 29 | K245: 10 | L245: 8 | M245: =K245*6+L245 -> 68 | O245: 10 | P245: 8 | Q245: =O245*6+P245 -> 68 | S245: RICHMOND | Y245: LADDER | AB245: ROUND | AD245: 6
A246: RICHMOND | C246: 2 | D246: 1 | E246: =C246*6+D246 -> 13 | G246: 2 | H246: 10 | I246: =G246*6+H246 -> 22 | K246: 2 | L246: 11 | M246: =K246*6+L246 -> 23 | O246: 4 | P246: 15 | Q246: =O246*6+P246 -> 39 | S246: UMPIRE
A247: BEST PLAYERS | S247: PYMM | W247: TEAM | X247: W | Y247: L | Z247: D | AA247: FOR | AB247: AGST | AC247: % | AD247: PTS
A248: NORTH MELBOURNE | C248: HOLDEN | F248: McVEIGH | I248: KEATING | L248: ROWE | O248: BARNES | R248: RAPP
A249: RICHMOND | C249: FILDES | F249: HILL | I249: C WILLIAMS | L249: BOWNAS | O249: HARDIMAN | R249: LANG | W249: WEST MELBOURNE | X249: 5 | Y249: 0 | Z249: 1 | AA249: 305 | AB249: 156 | AC249: 195.51282051282053 | AD249: 22
A250: GOALKICKERS | W250: WILLIAMSTOWN | X250: 5 | Y250: 1 | Z250: 0 | AA250: 428 | AB250: 229 | AC250: 186.8995633187773 | AD250: 20
A251: NORTH MELBOURNE | C251: HOLDEN 5 | F251: KENNY 2 | W251: NORTH MELBOURNE | X251: 5 | Y251: 1 | Z251: 0 | AA251: 303 | AB251: 224 | AC251: 135.26785714285714 | AD251: 20
A252: RICHMOND | W252: RICHMOND | X252: 4 | Y252: 2 | Z252: 0 | AA252: 328 | AB252: 235 | AC252: 139.57446808510639 | AD252: 16
A254: WILLIAMSTOWN | C254: 4 | D254: 2 | E254: =C254*6+D254 -> 26 | G254: 7 | H254: 4 | I254: =G254*6+H254 -> 46 | K254: 10 | L254: 5 | M254: =K254*6+L254 -> 65 | O254: 10 | P254: 7 | Q254: =O254*6+P254 -> 67 | S254: WILLIAMSTOWN | W254: FOOTSCRAY | X254: 3 | Y254: 2 | Z254: 1 | AA254: 314 | AB254: 191 | AC254: 164.39790575916231 | AD254: 14
A255: BRUNSWICK | C255: 1 | D255: 1 | E255: =C255*6+D255 -> 7 | G255: 2 | H255: 4 | I255: =G255*6+H255 -> 16 | K255: 3 | L255: 5 | M255: =K255*6+L255 -> 23 | O255: 5 | P255: 10 | Q255: =O255*6+P255 -> 40 | S255: O'LOUGHLIN | W255: BRUNSWICK | X255: 3 | Y255: 3 | Z255: 0 | AA255: 275 | AB255: 262 | AC255: 104.96183206106871 | AD255: 12
A256: BEST PLAYERS | W256: PRAHRAN | X256: 2 | Y256: 4 | Z256: 0 | AA256: 193 | AB256: 340 | AC256: 56.764705882352942 | AD256: 8
A257: WILLIAMSTOWN | C257: ALLEY | F257: DICK | I257: JONES | K257: FLETCHER | N257: LAMBERT | Q257: McNEILAGE | W257: PRESTON | X257: 1 | Y257: 5 | Z257: 0 | AA257: 290 | AB257: 347 | AC257: 83.573487031700282 | AD257: 4
A258: BRUNSWICK | C258: CHASE | F258: CARMAN | I258: BELCHER | K258: SERGEANT | N258: BRAID | Q258: KENNETT | W258: PORT MELBOURNE | X258: 1 | Y258: 5 | Z258: 0 | AA258: 136 | AB258: 329 | AC258: 41.337386018237083 | AD258: 4
A259: GOALKICKERS | W259: ESSENDON | X259: 0 | Y259: 6 | Z259: 0 | AA259: 155 | AB259: 414 | AC259: 37.439613526570049 | AD259: 0
A260: WILLIAMSTOWN | C260: JONES 5 | F260: GARBUTT 2
A261: BRUNSWICK | C261: SCOTT 2
A263: PRAHRAN | C263: 1 | D263: 5 | E263: =C263*6+D263 -> 11 | G263: 1 | H263: 6 | I263: =G263*6+H263 -> 12 | K263: 2 | L263: 12 | M263: =K263*6+L263 -> 24 | O263: 3 | P263: 12 | Q263: =O263*6+P263 -> 30 | S263: PORT MELB
A264: PORT MELBOURNE | C264: 0 | D264: 1 | E264: =C264*6+D264 -> 1 | G264: 0 | H264: 1 | I264: =G264*6+H264 -> 1 | K264: 0 | L264: 1 | M264: =K264*6+L264 -> 1 | O264: 0 | P264: 2 | Q264: =O264*6+P264 -> 2 | S264: ASPINALL
A265: BEST PLAYERS
A266: PRAHRAN | C266: ALLEN | F266: BULLEN | I266: HAIGHBLOOM | L266: BROWN | O266: CROWE | R266: ROCHE
A267: PORT MELBOURNE | C267: CURTIS | F267: COPE | I267: WARD | L267: READ | O267: GAULT | R267: McGOWAN
A268: GOALKICKERS
A269: PRAHRAN
A270: PORT MELBOURNE
A272: WEST MELBOURNE | C272: 1 | D272: 8 | E272: =C272*6+D272 -> 14 | G272: 1 | H272: 9 | I272: =G272*6+H272 -> 15 | K272: 3 | L272: 11 | M272: =K272*6+L272 -> 29 | O272: 3 | P272: 12 | Q272: =O272*6+P272 -> 30 | S272: NORTH MELB
A273: PRESTON | C273: 0 | D273: 0 | E273: =C273*6+D273 -> 0 | G273: 4 | H273: 0 | I273: =G273*6+H273 -> 24 | K273: 4 | L273: 0 | M273: =K273*6+L273 -> 24 | O273: 4 | P273: 2 | Q273: =O273*6+P273 -> 26 | S273: WOOLFE
A274: BEST PLAYERS
A275: WEST MELBOURNE | C275: H GREGORY | F275: A GREGORY | I275: ROURKE | L275: McDONALD | O275: JOHNSON | R275: MINTO
A276: PRESTON | C276: WHITE | F276: TORPEY | I276: OGDEN | L276: S HALL | O276: LANDELLS | R276: WAWN
A277: GOALKICKERS
A278: WEST MELBOURNE
A279: PRESTON | C279: STANLAKE 2
A281: FOOTSCRAY | C281: 5 | D281: 6 | E281: =C281*6+D281 -> 36 | G281: 6 | H281: 7 | I281: =G281*6+H281 -> 43 | K281: 13 | L281: 12 | M281: =K281*6+L281 -> 90 | O281: 13 | P281: 12 | Q281: =O281*6+P281 -> 90 | S281: FOOTSCRAY
A282: ESSENDON | C282: 0 | D282: 0 | E282: =C282*6+D282 -> 0 | G282: 1 | H282: 2 | I282: =G282*6+H282 -> 8 | K282: 1 | L282: 3 | M282: =K282*6+L282 -> 9 | O282: 4 | P282: 6 | Q282: =O282*6+P282 -> 30 | S282: FREAME
A283: BEST PLAYERS
A284: FOOTSCRAY | C284: MARMO | F284: HINCH | I284: HEDLEY | L284: HARRIS | O284: GREENWOOD | R284: CLARKE
A285: ESSENDON | C285: SHELDON | F285: BENNETT | I285: FITZGERALD | L285: CHEFFERS | O285: DYSON
A286: GOALKICKERS
A287: FOOTSCRAY | I287: HINCH
A288: ESSENDON
A290: ROUND 7 | D290: 16TH JUNE | J290: WEATHER | M290: NORTH WEST WIND
D291: 1ST QTR | H291: 2ND QTR | L291: 3RD QTR | P291: FINAL | S291: PLAYED AT
A292: WEST MELBOURNE | C292: 1 | D292: 0 | E292: =C292*6+D292 -> 6 | G292: 4 | H292: 8 | I292: =G292*6+H292 -> 32 | K292: 7 | L292: 9 | M292: =K292*6+L292 -> 51 | O292: 8 | P292: 11 | Q292: =O292*6+P292 -> 59 | S292: RICHMOND | Y292: LADDER | AB292: ROUND | AD292: 7
A293: RICHMOND | C293: 3 | D293: 3 | E293: =C293*6+D293 -> 21 | G293: 4 | H293: 3 | I293: =G293*6+H293 -> 27 | K293: 6 | L293: 8 | M293: =K293*6+L293 -> 44 | O293: 8 | P293: 8 | Q293: =O293*6+P293 -> 56 | S293: UMPIRE
A294: BEST PLAYERS | S294: O'LOUGHLIN | W294: TEAM | X294: W | Y294: L | Z294: D | AA294: FOR | AB294: AGST | AC294: % | AD294: PTS
A295: WEST MELBOURNE | C295: ARMSTRONG | G295: H GREGORY | J295: HILL | L295: RANKIN | O295: McCANN | Q295: MINTO
A296: RICHMOND | C296: C WILLIAMS | G296: BOWNAS | J296: LANG | L296: HEANEY | O296: HILL | Q296: GEGGIE | W296: WEST MELBOURNE | X296: 6 | Y296: 0 | Z296: 1 | AA296: 364 | AB296: 212 | AC296: 171.69811320754718 | AD296: 26
A297: GOALKICKERS | W297: WILLIAMSTOWN | X297: 6 | Y297: 1 | Z297: 0 | AA297: 482 | AB297: 275 | AC297: 175.27272727272728 | AD297: 24
A298: WEST MELBOURNE | W298: NORTH MELBOURNE | X298: 6 | Y298: 1 | Z298: 0 | AA298: 356 | AB298: 245 | AC298: 145.30612244897958 | AD298: 24
A299: RICHMOND | C299: BENNISON 3 | W299: FOOTSCRAY | X299: 4 | Y299: 2 | Z299: 1 | AA299: 364 | AB299: 232 | AC299: 156.89655172413794 | AD299: 18
A301: FOOTSCRAY | C301: 0 | D301: 0 | E301: =C301*6+D301 -> 0 | G301: 1 | H301: 3 | I301: =G301*6+H301 -> 9 | K301: 2 | L301: 8 | M301: =K301*6+L301 -> 20 | O301: 6 | P301: 14 | Q301: =O301*6+P301 -> 50 | S301: FOOTSCRAY | W301: RICHMOND | X301: 4 | Y301: 3 | Z301: 0 | AA301: 384 | AB301: 294 | AC301: 130.61224489795919 | AD301: 16
A302: BRUNSWICK | C302: 2 | D302: 6 | E302: =C302*6+D302 -> 18 | G302: 5 | H302: 8 | I302: =G302*6+H302 -> 38 | K302: 5 | L302: 11 | M302: =K302*6+L302 -> 41 | O302: 5 | P302: 11 | Q302: =O302*6+P302 -> 41 | S302: PYMM | W302: BRUNSWICK | X302: 3 | Y302: 4 | Z302: 0 | AA302: 316 | AB302: 312 | AC302: 101.28205128205128 | AD302: 12
A303: BEST PLAYERS | W303: PRESTON | X303: 2 | Y303: 5 | Z303: 0 | AA303: 338 | AB303: 379 | AC303: 89.182058047493399 | AD303: 8
A304: FOOTSCRAY | C304: MARMO | F304: GREENWOOD | I304: HEDLEY | L304: CLARKE | N304: GLENISTER | Q304: McKINLEY | W304: PRAHRAN | X304: 2 | Y304: 5 | Z304: 0 | AA304: 239 | AB304: 394 | AC304: 60.659898477157363 | AD304: 8
A305: BRUNSWICK | C305: CARMAN | F305: CHASE | I305: CRINNION | L305: SCOTT | N305: LEEDS | Q305: BRAID | W305: PORT MELBOURNE | X305: 1 | Y305: 6 | Z305: 0 | AA305: 157 | AB305: 382 | AC305: 41.099476439790578 | AD305: 4
A306: GOALKICKERS | W306: ESSENDON | X306: 0 | Y306: 7 | Z306: 0 | AA306: 187 | AB306: 462 | AC306: 40.476190476190474 | AD306: 0
A307: FOOTSCRAY | C307: HEDLEY 2 | F307: CLARKE 2
A308: BRUNSWICK
A310: PRESTON | C310: 2 | D310: 2 | E310: =C310*6+D310 -> 14 | G310: 4 | H310: 3 | I310: =G310*6+H310 -> 27 | K310: 6 | L310: 3 | M310: =K310*6+L310 -> 39 | O310: 7 | P310: 6 | Q310: =O310*6+P310 -> 48 | S310: ESSENDON
A311: ESSENDON | C311: 0 | D311: 4 | E311: =C311*6+D311 -> 4 | G311: 1 | H311: 7 | I311: =G311*6+H311 -> 13 | K311: 1 | L311: 8 | M311: =K311*6+L311 -> 14 | O311: 4 | P311: 8 | Q311: =O311*6+P311 -> 32 | S311: ARMSTRONG
A312: BEST PLAYERS
A313: PRESTON | C313: S HALL | F313: P HALL | I313: MASON | L313: DOHERTY | O313: OGDEN | Q313: STANLAKE
A314: ESSENDON | C314: PAIN | F314: CHEFFERS | I314: GRAHAM | L314: MONTGOMERY | O314: DYSON | Q314: McINTYRE
A315: GOALKICKERS
A316: PRESTON | C316: LANDELLS 3 | G316: HOLLIGAN 2
A317: ESSENDON
A319: WILLIAMSTOWN | C319: 0 | D319: 2 | E319: =C319*6+D319 -> 2 | G319: 4 | H319: 11 | I319: =G319*6+H319 -> 35 | K319: 5 | L319: 13 | M319: =K319*6+L319 -> 43 | O319: 6 | P319: 18 | Q319: =O319*6+P319 -> 54 | S319: TOORAK PARK
A320: PRAHRAN | C320: 2 | D320: 6 | E320: =C320*6+D320 -> 18 | G320: 3 | H320: 6 | I320: =G320*6+H320 -> 24 | K320: 6 | L320: 9 | M320: =K320*6+L320 -> 45 | O320: 6 | P320: 10 | Q320: =O320*6+P320 -> 46 | S320: FREAME
A321: BEST PLAYERS
A322: WILLIAMSTOWN | C322: ERRINGTON | F322: H DICK | I322: ALLEY | L322: MCNEILAGE | O322: GARBUTT | R322: KERR
A323: PRAHRAN | C323: G ALLAN | F323: HAIGHBLOOM | I323: DOWDING | L323: ROBERTS | O323: LETHBRIDGE | R323: SWIFT
A324: GOALKICKERS
A325: WILLIAMSTOWN | C325: HAIGHBLOOM 3
A326: PRAHRAN
A328: NORTH MELBOURNE | C328: 3 | D328: 6 | E328: =C328*6+D328 -> 24 | G328: 4 | H328: 6 | I328: =G328*6+H328 -> 30 | K328: 5 | L328: 10 | M328: =K328*6+L328 -> 40 | O328: 7 | P328: 11 | Q328: =O328*6+P328 -> 53 | S328: NORTH MELBOURNE
A329: PORT MELBOURNE | C329: 0 | D329: 2 | E329: =C329*6+D329 -> 2 | G329: 0 | H329: 3 | I329: =G329*6+H329 -> 3 | K329: 2 | L329: 6 | M329: =K329*6+L329 -> 18 | O329: 2 | P329: 9 | Q329: =O329*6+P329 -> 21 | S329: KRUSE
A330: BEST PLAYERS
A331: NORTH MELBOURNE | C331: BOYLE | F331: KENNY | I331: SMITH | L331: DALTON | O331: MARTIN | Q331: M LONDERIGAN
A332: PORT MELBOURNE | C332: READ | F332: MCDONALD | I332: DEAN | L332: WARD | O332: COPE | Q332: SULLIVAN
A333: GOALKICKERS
A334: NORTH MELBOURNE | C334: KENNY 3 | F334: HOLDEN 2
A335: PORT MELBOURNE
A337: ROUND 8 | D337: 23RD JUNE | J337: WEATHER | M337: SOUTH WIND
D338: 1ST QTR | H338: 2ND QTR | L338: 3RD QTR | P338: FINAL | S338: PLAYED AT
A339: NORTH MELBOURNE | C339: 1 | D339: 1 | E339: =C339*6+D339 -> 7 | G339: 1 | H339: 4 | I339: =G339*6+H339 -> 10 | K339: 3 | L339: 7 | M339: =K339*6+L339 -> 25 | O339: 4 | P339: 8 | Q339: =O339*6+P339 -> 32 | S339: NORTH MELB | Y339: LADDER | AB339: ROUND | AD339: 8
A340: WILLIAMSTOWN | C340: 1 | D340: 0 | E340: =C340*6+D340 -> 6 | G340: 1 | H340: 1 | I340: =G340*6+H340 -> 7 | K340: 2 | L340: 3 | M340: =K340*6+L340 -> 15 | O340: 4 | P340: 7 | Q340: =O340*6+P340 -> 31 | S340: UMPIRE
A341: BEST PLAYERS | S341: ASPINALL | W341: TEAM | X341: W | Y341: L | Z341: D | AA341: FOR | AB341: AGST | AC341: % | AD341: PTS
A342: NORTH MELBOURNE | C342: BARNES | F342: WATSON | I342: THORPE | L342: LINEHAN | O342: MARTIN | Q342: McVEIGH
A343: WILLIAMSTOWN | C343: McKENZIE | F343: OUTEN | I343: WOODS | L343: GRAHAM | O343: DICK | Q343: KERR | W343: WEST MELBOURNE | X343: 7 | Y343: 0 | Z343: 1 | AA343: 440 | AB343: 230 | AC343: 191.30434782608697 | AD343: 30
A344: GOALKICKERS | W344: NORTH MELBOURNE | X344: 7 | Y344: 1 | Z344: 0 | AA344: 388 | AB344: 276 | AC344: 140.57971014492753 | AD344: 28
A345: NORTH MELBOURNE | C345: LITTLE 2 | F345: KENNY 2 | W345: WILLIAMSTOWN | X345: 6 | Y345: 2 | Z345: 0 | AA345: 513 | AB345: 307 | AC345: 167.10097719869708 | AD345: 24
A346: WILLIAMSTOWN | C346: ERRINGTON 2 | G346: GARBUTT 2 | W346: FOOTSCRAY | X346: 5 | Y346: 2 | Z346: 1 | AA346: 427 | AB346: 273 | AC346: 156.41025641025641 | AD346: 22
A348: WEST MELBOURNE | C348: 1 | D348: 2 | E348: =C348*6+D348 -> 8 | G348: 6 | H348: 7 | I348: =G348*6+H348 -> 43 | K348: 7 | L348: 9 | M348: =K348*6+L348 -> 51 | O348: 11 | P348: 10 | Q348: =O348*6+P348 -> 76 | S348: BRUNSWICK | W348: RICHMOND | X348: 5 | Y348: 3 | Z348: 0 | AA348: 469 | AB348: 331 | AC348: 141.69184290030211 | AD348: 20
A349: BRUNSWICK | C349: 0 | D349: 1 | E349: =C349*6+D349 -> 1 | G349: 0 | H349: 2 | I349: =G349*6+H349 -> 2 | K349: 1 | L349: 5 | M349: =K349*6+L349 -> 11 | O349: 2 | P349: 6 | Q349: =O349*6+P349 -> 18 | S349: KRUSE | W349: PRESTON | X349: 3 | Y349: 5 | Z349: 0 | AA349: 375 | AB349: 398 | AC349: 94.221105527638187 | AD349: 12
A350: BEST PLAYERS | W350: BRUNSWICK | X350: 3 | Y350: 5 | Z350: 0 | AA350: 334 | AB350: 388 | AC350: 86.082474226804123 | AD350: 12
A351: WEST MELBOURNE | C351: MADDEN | F351: RANKIN | I351: CLARKE | K351: H GREGORY | N351: JOHNSON | Q351: WILLIAMSON | W351: PRAHRAN | X351: 2 | Y351: 6 | Z351: 0 | AA351: 258 | AB351: 431 | AC351: 59.86078886310905 | AD351: 8
A352: BRUNSWICK | C352: BRAID | F352: KENNETT | I352: COLLISON | K352: BELCHER | N352: CRINNION | Q352: SERGEANT | W352: PORT MELBOURNE | X352: 1 | Y352: 7 | Z352: 0 | AA352: 198 | AB352: 445 | AC352: 44.49438202247191 | AD352: 4
A353: GOALKICKERS | W353: ESSENDON | X353: 0 | Y353: 8 | Z353: 0 | AA353: 224 | AB353: 547 | AC353: 40.950639853747717 | AD353: 0
A354: WEST MELBOURNE | C354: CLARKE 3 | F354: McCANN 3 | I354: RYAN 2 | L354: DAWSON | N354: RANKIN
A355: BRUNSWICK
A357: PRESTON | C357: 3 | D357: 0 | E357: =C357*6+D357 -> 18 | G357: 3 | H357: 5 | I357: =G357*6+H357 -> 23 | K357: 3 | L357: 7 | M357: =K357*6+L357 -> 25 | O357: 4 | P357: 13 | Q357: =O357*6+P357 -> 37 | S357: PRESTON
A358: PRAHRAN | C358: 0 | D358: 1 | E358: =C358*6+D358 -> 1 | G358: 1 | H358: 1 | I358: =G358*6+H358 -> 7 | K358: 3 | L358: 1 | M358: =K358*6+L358 -> 19 | O358: 3 | P358: 1 | Q358: =O358*6+P358 -> 19 | S358: FREAME
A359: BEST PLAYERS
A360: PRESTON | C360: HARRINGTON | F360: BROWN | I360: HOLLIS | L360: MASON | N360: S HALL | Q360: WAWN
A361: PRAHRAN | C361: BULLEN | F361: HAIGHBLOOM | I361: LETHBRIDGE | L361: HAUGHTON | N361: TRUSCOTT
A362: GOALKICKERS
A363: PRESTON
A364: PRAHRAN
A366: FOOTSCRAY | C366: 3 | D366: 3 | E366: =C366*6+D366 -> 21 | G366: 5 | H366: 6 | I366: =G366*6+H366 -> 36 | K366: 7 | L366: 8 | M366: =K366*6+L366 -> 50 | O366: 9 | P366: 9 | Q366: =O366*6+P366 -> 63 | S366: PORT MELB
A367: PORT MELBOURNE | C367: 1 | D367: 0 | E367: =C367*6+D367 -> 6 | G367: 2 | H367: 1 | I367: =G367*6+H367 -> 13 | K367: 4 | L367: 3 | M367: =K367*6+L367 -> 27 | O367: 6 | P367: 5 | Q367: =O367*6+P367 -> 41 | S367: PYMM
A368: BEST PLAYERS
A369: FOOTSCRAY | C369: GREENWOOD | F369: JACOBSEN | I369: MARMO | L369: HUGHES | N369: CLARKE | Q369: GIBSON
A370: PORT MELBOURNE | C370: SULLIVAN | F370: McGOWAN | I370: GILCHRIST | L370: DEAN | N370: LAVER | Q370: BRENNAN
A371: GOALKICKERS
A372: FOOTSCRAY
A373: PORT MELBOURNE
A375: RICHMOND | C375: 5 | D375: 4 | E375: =C375*6+D375 -> 34 | G375: 6 | H375: 7 | I375: =G375*6+H375 -> 43 | K375: 9 | L375: 10 | M375: =K375*6+L375 -> 64 | O375: 12 | P375: 13 | Q375: =O375*6+P375 -> 85 | S375: RICHMOND
A376: ESSENDON | C376: 1 | D376: 1 | E376: =C376*6+D376 -> 7 | G376: 2 | H376: 3 | I376: =G376*6+H376 -> 15 | K376: 3 | L376: 3 | M376: =K376*6+L376 -> 21 | O376: 5 | P376: 7 | Q376: =O376*6+P376 -> 37 | S376: SOUTAR
A377: BEST PLAYERS
A378: RICHMOND | C378: FILDES | F378: SYKES | I378: EDMONDS | L378: BENNISON | N378: LANG | P378: CARKEEK
A379: ESSENDON | C379: CHEFFERS | F379: DUFF | I379: BENNETT | L379: GRAHAM | N379: MAKIN | P379: WILLIAMS
A380: GOALKICKERS
A381: RICHMOND | C381: CARKEEK 3
A382: ESSENDON | C382: MAKIN 2
A384: ROUND 9 | D384: 30TH JUNE | J384: WEATHER | M384: STRONG NORTH WIND
D385: 1ST QTR | H385: 2ND QTR | L385: 3RD QTR | P385: FINAL | S385: PLAYED AT
A386: FOOTSCRAY | C386: 2 | D386: 1 | E386: =C386*6+D386 -> 13 | G386: 4 | H386: 3 | I386: =G386*6+H386 -> 27 | K386: 8 | L386: 4 | M386: =K386*6+L386 -> 52 | O386: 8 | P386: 8 | Q386: =O386*6+P386 -> 56 | S386: WILLIAMSTOWN | Y386: LADDER | AB386: ROUND | AD386: 9
A387: WILLIAMSTOWN | C387: 0 | D387: 1 | E387: =C387*6+D387 -> 1 | G387: 1 | H387: 3 | I387: =G387*6+H387 -> 9 | K387: 1 | L387: 4 | M387: =K387*6+L387 -> 10 | O387: 4 | P387: 6 | Q387: =O387*6+P387 -> 30 | S387: UMPIRE
A388: BEST PLAYERS | S388: SOUTAR | W388: TEAM | X388: W | Y388: L | Z388: D | AA388: FOR | AB388: AGST | AC388: % | AD388: PTS
A389: FOOTSCRAY | C389: HEDLEY | F389: GREENWOOD | I389: BORTHWICK | L389: HUGHES | N389: GIBSON | P389: McKINLEY
A390: WILLIAMSTOWN | C390: FLETCHER | F390: JONES | I390: MCNEILAGE | L390: GRAHAM | N390: OUTEN | P390: KERR | W390: WEST MELBOURNE | X390: 8 | Y390: 0 | Z390: 1 | AA390: 552 | AB390: 269 | AC390: 205.20446096654274 | AD390: 34
A391: GOALKICKERS | W391: NORTH MELBOURNE | X391: 8 | Y391: 1 | Z391: 0 | AA391: 463 | AB391: 313 | AC391: 147.92332268370606 | AD391: 32
A392: FOOTSCRAY | C392: GLENISTER 5 | W392: FOOTSCRAY | X392: 6 | Y392: 2 | Z392: 1 | AA392: 483 | AB392: 303 | AC392: 159.40594059405942 | AD392: 26
A393: WILLIAMSTOWN | W393: WILLIAMSTOWN | X393: 6 | Y393: 3 | Z393: 0 | AA393: 543 | AB393: 363 | AC393: 149.58677685950414 | AD393: 24
A395: RICHMOND | C395: 2 | D395: 1 | E395: =C395*6+D395 -> 13 | G395: 7 | H395: 5 | I395: =G395*6+H395 -> 47 | K395: 8 | L395: 7 | M395: =K395*6+L395 -> 55 | O395: 10 | P395: 12 | Q395: =O395*6+P395 -> 72 | S395: PRESTON | W395: RICHMOND | X395: 6 | Y395: 3 | Z395: 0 | AA395: 541 | AB395: 367 | AC395: 147.41144414168937 | AD395: 24
A396: PRESTON | C396: 1 | D396: 3 | E396: =C396*6+D396 -> 9 | G396: 2 | H396: 7 | I396: =G396*6+H396 -> 19 | K396: 4 | L396: 10 | M396: =K396*6+L396 -> 34 | O396: 4 | P396: 12 | Q396: =O396*6+P396 -> 36 | S396: KRUSE | W396: BRUNSWICK | X396: 4 | Y396: 5 | Z396: 0 | AA396: 403 | AB396: 427 | AC396: 94.379391100702577 | AD396: 16
A397: BEST PLAYERS | W397: PRESTON | X397: 3 | Y397: 6 | Z397: 0 | AA397: 411 | AB397: 470 | AC397: 87.446808510638292 | AD397: 12
A398: RICHMOND | C398: MAHONEY | F398: BOWNAS | I398: BENNISON | L398: SYKES | N398: HILL | P398: MEGSON | W398: PRAHRAN | X398: 2 | Y398: 7 | Z398: 0 | AA398: 297 | AB398: 543 | AC398: 54.696132596685082 | AD398: 8
A399: PRESTON | C399: BROWN | F399: WAWN | I399: S HALL | L399: P HALL | N399: BRIGHT | P399: HOLLIS | W399: PORT MELBOURNE | X399: 1 | Y399: 8 | Z399: 0 | AA399: 237 | AB399: 514 | AC399: 46.108949416342412 | AD399: 4
A400: GOALKICKERS | W400: ESSENDON | X400: 0 | Y400: 9 | Z400: 0 | AA400: 261 | AB400: 622 | AC400: 41.961414790996784 | AD400: 0
A401: RICHMOND | C401: HEANEY 3 | F401: BENNISON 2 | J401: HUTCHINSON 2
A402: PRESTON | C402: WAWN 2
A404: BRUNSWICK | C404: 4 | D404: 1 | E404: =C404*6+D404 -> 25 | G404: 7 | H404: 3 | I404: =G404*6+H404 -> 45 | K404: 7 | L404: 5 | M404: =K404*6+L404 -> 47 | O404: 10 | P404: 9 | Q404: =O404*6+P404 -> 69 | S404: BRUNSWICK
A405: PORT MELBOURNE | C405: 1 | D405: 1 | E405: =C405*6+D405 -> 7 | G405: 1 | H405: 2 | I405: =G405*6+H405 -> 8 | K405: 3 | L405: 5 | M405: =K405*6+L405 -> 23 | O405: 5 | P405: 9 | Q405: =O405*6+P405 -> 39 | S405: ARMSTRONG
A406: BEST PLAYERS
A407: BRUNSWICK | C407: CHASE | F407: BRAID | I407: LOGAN | K407: BALFE | M407: CRINNION | P407: MULVANEY
A408: PORT MELBOURNE | C408: AYLES | F408: JACKSON | I408: LAVER | K408: COPE | M408: McGOWAN | P408: HUESKER
A409: GOALKICKERS
A410: BRUNSWICK
A411: PORT MELBOURNE
A413: WEST MELBOURNE | C413: 4 | D413: 0 | E413: =C413*6+D413 -> 24 | G413: 9 | H413: 8 | I413: =G413*6+H413 -> 62 | K413: 14 | L413: 8 | M413: =K413*6+L413 -> 92 | O413: 17 | P413: 10 | Q413: =O413*6+P413 -> 112 | S413: NORTH MELB
A414: PRAHRAN | C414: 3 | D414: 2 | E414: =C414*6+D414 -> 20 | G414: 3 | H414: 2 | I414: =G414*6+H414 -> 20 | K414: 5 | L414: 6 | M414: =K414*6+L414 -> 36 | O414: 5 | P414: 9 | Q414: =O414*6+P414 -> 39 | S414: PYMM
A415: BEST PLAYERS
A416: WEST MELBOURNE | C416: ARMSTRONG | F416: McDONALD | I416: A GREGORY | L416: H GREGORY | N416: ROURKE | Q416: WILSON
A417: PRAHRAN | C417: CROSS | F417: SMITH | I417: CARLTON | L417: SYKES | N417: ROBERTS | Q417: TRUSCOTT
A418: GOALKICKERS
A419: WEST MELBOURNE | C419: ARMSTRONG 9 | G419: McCANN 3
A420: PRAHRAN
A422: NORTH MELBOURNE | C422: 3 | D422: 4 | E422: =C422*6+D422 -> 22 | G422: 6 | H422: 6 | I422: =G422*6+H422 -> 42 | K422: 8 | L422: 7 | M422: =K422*6+L422 -> 55 | O422: 10 | P422: 15 | Q422: =O422*6+P422 -> 75 | S422: ESSENDON
A423: ESSENDON | C423: 0 | D423: 2 | E423: =C423*6+D423 -> 2 | G423: 1 | H423: 4 | I423: =G423*6+H423 -> 10 | K423: 3 | L423: 7 | M423: =K423*6+L423 -> 25 | O423: 5 | P423: 7 | Q423: =O423*6+P423 -> 37 | S423: FREAME
A424: BEST PLAYERS
A425: NORTH MELBOURNE | C425: KENNY | F425: McVEIGH | I425: HOLDEN | L425: BOYLE | N425: THORPE | Q425: WATSON
A426: ESSENDON | C426: CHEFFERS | F426: DUFF | I426: BUSBRIDGE | L426: WHITEHEAD | N426: HOBDEN | Q426: MONTGOMERY
A427: GOALKICKERS
A428: NORTH MELBOURNE | C428: KENNY 4 | F428: PITT 2
A429: ESSENDON
A431: ROUND 10 | D431: 7TH JULY | J431: WEATHER | M431: NORTH WIND
D432: 1ST QTR | H432: 2ND QTR | L432: 3RD QTR | P432: FINAL | S432: PLAYED AT
A433: NORTH MELBOURNE | C433: 3 | D433: 3 | E433: =C433*6+D433 -> 21 | G433: 9 | H433: 6 | I433: =G433*6+H433 -> 60 | K433: 9 | L433: 9 | M433: =K433*6+L433 -> 63 | O433: 11 | P433: 13 | Q433: =O433*6+P433 -> 79 | S433: BRUNSWICK | Y433: LADDER | AB433: ROUND | AD433: 10
A434: BRUNSWICK | C434: 1 | D434: 2 | E434: =C434*6+D434 -> 8 | G434: 2 | H434: 3 | I434: =G434*6+H434 -> 15 | K434: 4 | L434: 5 | M434: =K434*6+L434 -> 29 | O434: 5 | P434: 6 | Q434: =O434*6+P434 -> 36 | S434: UMPIRE
A435: BEST PLAYERS | S435: KRUSE | W435: TEAM | X435: W | Y435: L | Z435: D | AA435: FOR | AB435: AGST | AC435: % | AD435: PTS
A436: NORTH MELBOURNE | C436: M LONDERIGAN | F436: LINEHAN | I436: McVEIGH | L436: KEATING | O436: SMITH | Q436: MARTIN
A437: BRUNSWICK | C437: CHASE | F437: ANDREWS | I437: SERGEANT | L437: BELCHER | O437: BALFE | Q437: LEEDS | W437: WEST MELBOURNE | X437: 9 | Y437: 0 | Z437: 1 | AA437: 689 | AB437: 297 | AC437: 231.98653198653199 | AD437: 38
A438: GOALKICKERS | W438: NORTH MELBOURNE | X438: 9 | Y438: 1 | Z438: 0 | AA438: 542 | AB438: 349 | AC438: 155.30085959885386 | AD438: 36
A439: NORTH MELBOURNE | C439: M LONDERIGAN 4 | G439: McCANN 2 | J439: KENNY 2 | M439: GROVES | O439: LINEHAN | R439: RAHILLY | W439: FOOTSCRAY | X439: 7 | Y439: 2 | Z439: 1 | AA439: 533 | AB439: 345 | AC439: 154.49275362318841 | AD439: 30
A440: BRUNSWICK | C440: CRINNION 2 | G440: ROBERTSON | J440: ANDREWS | M440: S BALFE | W440: RICHMOND | X440: 7 | Y440: 3 | Z440: 0 | AA440: 631 | AB440: 421 | AC440: 149.88123515439429 | AD440: 28
A442: FOOTSCRAY | C442: 2 | D442: 2 | E442: =C442*6+D442 -> 14 | G442: 4 | H442: 5 | I442: =G442*6+H442 -> 29 | K442: 7 | L442: 7 | M442: =K442*6+L442 -> 49 | O442: 7 | P442: 8 | Q442: =O442*6+P442 -> 50 | S442: FOOTSCRAY | W442: WILLIAMSTOWN | X442: 6 | Y442: 4 | Z442: 0 | AA442: 587 | AB442: 417 | AC442: 140.76738609112709 | AD442: 24
A443: PRESTON | C443: 0 | D443: 3 | E443: =C443*6+D443 -> 3 | G443: 2 | H443: 6 | I443: =G443*6+H443 -> 18 | K443: 3 | L443: 8 | M443: =K443*6+L443 -> 26 | O443: 5 | P443: 12 | Q443: =O443*6+P443 -> 42 | S443: FREAME | W443: BRUNSWICK | X443: 4 | Y443: 6 | Z443: 0 | AA443: 439 | AB443: 506 | AC443: 86.758893280632407 | AD443: 16
A444: BEST PLAYERS | W444: PRESTON | X444: 3 | Y444: 7 | Z444: 0 | AA444: 453 | AB444: 520 | AC444: 87.115384615384613 | AD444: 12
A445: FOOTSCRAY | C445: BORTHWICK | F445: MARMO | H445: GREENWOOD | K445: CLARKE | N445: JACOBSEN | Q445: HUGHES | W445: PRAHRAN | X445: 2 | Y445: 8 | Z445: 0 | AA445: 351 | AB445: 633 | AC445: 55.450236966824647 | AD445: 8
A446: PRESTON | C446: HARRINGTON | F446: OGDEN | H446: S YEOMANS | K446: HOLLIS | N446: MASON | Q446: WAWN | W446: PORT MELBOURNE | X446: 2 | Y446: 8 | Z446: 0 | AA446: 291 | AB446: 558 | AC446: 52.1505376344086 | AD446: 8
A447: GOALKICKERS | W447: ESSENDON | X447: 0 | Y447: 10 | Z447: 0 | AA447: 289 | AB447: 759 | AC447: 38.076416337285906 | AD447: 0
A448: FOOTSCRAY | C448: JACOBSEN 2 | F448: BORTHWICK 2 | J448: GREENWOOD | N448: HUGHES | Q448: McCARTHY
A449: PRESTON | C449: S YEOMANS | F449: HOLLIGAN | I449: LANDELLS | L449: BRIGHT | N449: E YEOMANS
A451: RICHMOND | C451: 3 | D451: 4 | E451: =C451*6+D451 -> 22 | G451: 5 | H451: 13 | I451: =G451*6+H451 -> 43 | K451: 10 | L451: 16 | M451: =K451*6+L451 -> 76 | O451: 12 | P451: 18 | Q451: =O451*6+P451 -> 90 | S451: RICHMOND
A452: PRAHRAN | C452: 4 | D452: 2 | E452: =C452*6+D452 -> 26 | G452: 6 | H452: 3 | I452: =G452*6+H452 -> 39 | K452: 6 | L452: 4 | M452: =K452*6+L452 -> 40 | O452: 8 | P452: 6 | Q452: =O452*6+P452 -> 54 | S452: SOUTAR
A453: BEST PLAYERS
A454: RICHMOND | C454: BENNISON | F454: LEACH | I454: FILDES | L454: HARDIMAN | O454: MAHONEY | R454: SYKES
A455: PRAHRAN | C455: DOWDING | F455: HAIGHBLOOM | I455: PENGLASE | L455: CROSS | O455: ALLAN | R455: TRUSCOTT
A456: GOALKICKERS
A457: RICHMOND | C457: HUTCHINSON 5 | F457: LEACH 2 | I457: MAHONEY | L457: HEANEY | N457: CARKEEK | Q457: BOWDEN | T457: MEGSON
A458: PRAHRAN | C458: CROSS 4 | F458: SYKES 2 | I458: SMITH | K458: TAYLOR
A460: PORT MELBOURNE | C460: 4 | D460: 4 | E460: =C460*6+D460 -> 28 | G460: 6 | H460: 6 | I460: =G460*6+H460 -> 42 | K460: 7 | L460: 11 | M460: =K460*6+L460 -> 53 | O460: 7 | P460: 12 | Q460: =O460*6+P460 -> 54 | S460: WILLIAMSTOWN
A461: WILLIAMSTOWN | C461: 2 | D461: 2 | E461: =C461*6+D461 -> 14 | G461: 4 | H461: 4 | I461: =G461*6+H461 -> 28 | K461: 5 | L461: 7 | M461: =K461*6+L461 -> 37 | O461: 6 | P461: 8 | Q461: =O461*6+P461 -> 44 | S461: ARMSTRONG
A462: BEST PLAYERS
A463: PORT MELBOURNE | C463: TREGLOWAN | F463: SULLIVAN | I463: BRENNAN | L463: CROFT | O463: HUESKER | R463: JACKSON
A464: WILIAMSTOWN | C464: DICK | F464: FLETCHER | I464: OUTEN | L464: JONES | O464: MANDERSON | R464: GARBUTT
A465: GOALKICKERS
A466: PORT MELBOURNE | C466: JACKSON 3 | F466: CROFT 2 | I466: HILL | K466: AYLES
A467: WILIAMSTOWN | C467: MATTHEWS 2 | G467: GARBUTT 2 | J467: FRASER | M467: ERRINGTON
A469: WEST MELBOURNE | C469: 4 | D469: 3 | E469: =C469*6+D469 -> 27 | G469: 14 | H469: 3 | I469: =G469*6+H469 -> 87 | K469: 17 | L469: 4 | M469: =K469*6+L469 -> 106 | O469: 21 | P469: 11 | Q469: =O469*6+P469 -> 137 | S469: NORTH MELB
A470: ESSENDON | C470: 0 | D470: 2 | E470: =C470*6+D470 -> 2 | G470: 0 | H470: 4 | I470: =G470*6+H470 -> 4 | K470: 1 | L470: 9 | M470: =K470*6+L470 -> 15 | O470: 3 | P470: 10 | Q470: =O470*6+P470 -> 28 | S470: ASPINALL
A471: BEST PLAYERS
A472: WEST MELBOURNE | C472: ARMSTRONG | F472: ROURKE | I472: A GREGORY | L472: McDONALD | O472: MADDEN | R472: WILLIAMSON
A473: ESSENDON | C473: CHEFFERS | F473: McINTYRE | I473: BUSBRIDGE | L473: WILLIAMS | O473: McNAMARA
A474: GOALKICKERS
A475: WEST MELBOURNE | C475: ARMSTRONG 7 | F475: RYAN 4 | H475: McCANN 4 | J475: HANNAFORD | M475: WILLIAMSON | P475: CLARKE | R475: NEYLAN | U475: ROURKE | W475: McCART
A476: ESSENDON | C476: BUSBRIDGE | F476: McCOLL | I476: CHEFFERS
A478: ROUND 11 | D478: 14TH JULY | J478: WEATHER | M478: FINE NORTH WIND
D479: 1ST QTR | H479: 2ND QTR | L479: 3RD QTR | P479: FINAL | S479: PLAYED AT
A480: WEST MELBOURNE | C480: 1 | D480: 6 | E480: =C480*6+D480 -> 12 | G480: 3 | H480: 7 | I480: =G480*6+H480 -> 25 | K480: 4 | L480: 7 | M480: =K480*6+L480 -> 31 | O480: 5 | P480: 7 | Q480: =O480*6+P480 -> 37 | S480: NORTH MELB | Y480: LADDER | AB480: ROUND | AD480: 11
A481: NORTH MELBOURNE | C481: 0 | D481: 1 | E481: =C481*6+D481 -> 1 | G481: 1 | H481: 3 | I481: =G481*6+H481 -> 9 | K481: 1 | L481: 5 | M481: =K481*6+L481 -> 11 | O481: 3 | P481: 8 | Q481: =O481*6+P481 -> 26 | S481: UMPIRE
A482: BEST PLAYERS | S482: ARMSTRONG | W482: TEAM | X482: W | Y482: L | Z482: D | AA482: FOR | AB482: AGST | AC482: % | AD482: PTS
A483: WEST MELBOURNE | C483: MADDEN | F483: H GREGORY | I483: ARMSTRONG | L483: ROURKE | N483: A GREGORY | Q483: McDONALD
A484: NORTH MELBOURNE | C484: BROYLAN | F484: M LONDERIGAN | I484: KEATING | L484: SMITH | N484: WATSON | Q484: MARTIN | W484: WEST MELBOURNE | X484: 10 | Y484: 0 | Z484: 1 | AA484: 726 | AB484: 323 | AC484: 224.76780185758514 | AD484: 42
A485: GOALKICKERS | W485: NORTH MELBOURNE | X485: 9 | Y485: 2 | Z485: 0 | AA485: 568 | AB485: 386 | AC485: 147.15025906735752 | AD485: 36
A486: WEST MELBOURNE | C486: A GREGORY 2 | G486: WILLIAMSON | J486: RYAN | L486: McCANN | W486: RICHMOND | X486: 8 | Y486: 3 | Z486: 0 | AA486: 713 | AB486: 456 | AC486: 156.35964912280701 | AD486: 32
A487: NORTH MELBOURNE | C487: RAHILLY | F487: SMITH | I487: THORPE | W487: FOOTSCRAY | X487: 7 | Y487: 3 | Z487: 1 | AA487: 568 | AB487: 427 | AC487: 133.02107728337236 | AD487: 30
A489: RICHMOND | C489: 3 | D489: 2 | E489: =C489*6+D489 -> 20 | G489: 7 | H489: 7 | I489: =G489*6+H489 -> 49 | K489: 7 | L489: 11 | M489: =K489*6+L489 -> 53 | O489: 11 | P489: 16 | Q489: =O489*6+P489 -> 82 | S489: RICHMOND | W489: WILLIAMSTOWN | X489: 7 | Y489: 4 | Z489: 0 | AA489: 639 | AB489: 459 | AC489: 139.21568627450981 | AD489: 28
A490: FOOTSCRAY | C490: 2 | D490: 0 | E490: =C490*6+D490 -> 12 | G490: 3 | H490: 0 | I490: =G490*6+H490 -> 18 | K490: 4 | L490: 0 | M490: =K490*6+L490 -> 24 | O490: 5 | P490: 5 | Q490: =O490*6+P490 -> 35 | S490: FREAME | W490: BRUNSWICK | X490: 5 | Y490: 6 | Z490: 0 | AA490: 471 | AB490: 529 | AC490: 89.03591682419659 | AD490: 20
A491: BEST PLAYERS | W491: PRESTON | X491: 3 | Y491: 8 | Z491: 0 | AA491: 495 | AB491: 572 | AC491: 86.538461538461533 | AD491: 12
A492: RICHMOND | C492: HEANEY | F492: BENNISON | I492: HARDIMAN | L492: LANG | O492: LEACH | Q492: MAHONEY | W492: PORT MELBOURNE | X492: 3 | Y492: 8 | Z492: 0 | AA492: 351 | AB492: 599 | AC492: 58.597662771285478 | AD492: 12
A493: FOOTSCRAY | C493: HEDLEY | F493: McKINLEY | I493: HARRIS | L493: GREENWOOD | O493: HUGHES | Q493: BORTHWICK | W493: PRAHRAN | X493: 2 | Y493: 9 | Z493: 0 | AA493: 374 | AB493: 665 | AC493: 56.2406015037594 | AD493: 8
A494: GOALKICKERS | W494: ESSENDON | X494: 0 | Y494: 11 | Z494: 0 | AA494: 330 | AB494: 819 | AC494: 40.293040293040292 | AD494: 0
A495: RICHMOND | C495: HUTCHINSON 5 | G495: HEANEY 2 | J495: HARDIMAN | M495: CARKEEK | P495: LANG | R495: BENNISON
A496: FOOTSCRAY | C496: HEDLEY 2 | F496: WAGNER | I496: GREENWOOD | M496: McCARTHY
A498: WILLIAMSTOWN | C498: 1 | D498: 0 | E498: =C498*6+D498 -> 6 | G498: 3 | H498: 4 | I498: =G498*6+H498 -> 22 | K498: 5 | L498: 6 | M498: =K498*6+L498 -> 36 | O498: 7 | P498: 10 | Q498: =O498*6+P498 -> 52 | S498: PRESTON
A499: PRESTON | C499: 1 | D499: 5 | E499: =C499*6+D499 -> 11 | G499: 1 | H499: 8 | I499: =G499*6+H499 -> 14 | K499: 4 | L499: 10 | M499: =K499*6+L499 -> 34 | O499: 5 | P499: 12 | Q499: =O499*6+P499 -> 42 | S499: FLYNN
A500: BEST PLAYERS
A501: WILLIAMSTOWN | C501: BILES | F501: WHIGHT | I501: WOODS | L501: JONES | N501: FLETCHER | Q501: DICK
A502: PRESTON | C502: BROWN | F502: TORPEY | I502: S HALL | L502: OGDEN | N502: MASON | Q502: HARRINGTON
A503: GOALKICKERS
A504: WILLIAMSTOWN | C504: DICK 2 | F504: MATTHEWS 2 | J504: KENNEDY | M504: JONES | O504: OUTEN
A505: PRESTON | C505: TORPEY 2 | F505: LANDELLS | I505: HOLLIGAN
A507: BRUNSWICK | C507: 0 | D507: 2 | E507: =C507*6+D507 -> 2 | G507: 1 | H507: 4 | I507: =G507*6+H507 -> 10 | K507: 1 | L507: 6 | M507: =K507*6+L507 -> 12 | O507: 4 | P507: 8 | Q507: =O507*6+P507 -> 32 | S507: TOORAK PARK
A508: PRAHRAN | C508: 1 | D508: 5 | E508: =C508*6+D508 -> 11 | G508: 2 | H508: 5 | I508: =G508*6+H508 -> 17 | K508: 2 | L508: 8 | M508: =K508*6+L508 -> 20 | O508: 2 | P508: 11 | Q508: =O508*6+P508 -> 23 | S508: SOUTAR
A509: BEST PLAYERS
A510: BRUNSWICK
A511: PRAHRAN
A512: GOALKICKERS
A513: BRUNSWICK | C513: W LEEDS 2 | F513: MULVANEY | I513: SMITH
A514: PRAHRAN | C514: CARLSON | F514: SYKES
A516: PORT MELBOURNE | C516: 1 | D516: 0 | E516: =C516*6+D516 -> 6 | G516: 3 | H516: 2 | I516: =G516*6+H516 -> 20 | K516: 5 | L516: 4 | M516: =K516*6+L516 -> 34 | O516: 9 | P516: 6 | Q516: =O516*6+P516 -> 60 | S516: PORT MELB
A517: ESSENDON | C517: 1 | D517: 2 | E517: =C517*6+D517 -> 8 | G517: 3 | H517: 7 | I517: =G517*6+H517 -> 25 | K517: 4 | L517: 9 | M517: =K517*6+L517 -> 33 | O517: 5 | P517: 11 | Q517: =O517*6+P517 -> 41 | S517: KRUSE
A518: BEST PLAYERS
A519: PORT MELBOURNE | C519: JACKSON | F519: WARD | H519: MALONEY | K519: HUESKER | N519: TREGLOWAN | Q519: CROFT
A520: ESSENDON | C520: DARBY | F520: ORR | H520: CHEFFERS | K520: GRAHAM | N520: DUFF | Q520: MITCHELL
A521: GOALKICKERS
A522: PORT MELBOURNE | C522: CROFT 5 | F522: BRENNAN | I522: HILL | K522: AYLES | M522: McDONALD
A523: ESSENDON | C523: LAURIE | F523: DUFF | I523: GRAHAM | L523: FITZGERALD | O523: MITCHELL
A525: ROUND 12 | D525: 21ST JULY | J525: WEATHER | M525: NORTH BREEZE RAIN
D526: 1ST QTR | H526: 2ND QTR | L526: 3RD QTR | P526: FINAL | S526: PLAYED AT
A527: FOOTSCRAY | C527: 0 | D527: 4 | E527: =C527*6+D527 -> 4 | G527: 1 | H527: 4 | I527: =G527*6+H527 -> 10 | K527: 2 | L527: 7 | M527: =K527*6+L527 -> 19 | O527: 2 | P527: 7 | Q527: =O527*6+P527 -> 19 | S527: FOOTSCRAY | Y527: LADDER | AB527: ROUND | AD527: 12
A528: WEST MELBOURNE | C528: 0 | D528: 0 | E528: =C528*6+D528 -> 0 | G528: 1 | H528: 0 | I528: =G528*6+H528 -> 6 | K528: 2 | L528: 0 | M528: =K528*6+L528 -> 12 | O528: 2 | P528: 1 | Q528: =O528*6+P528 -> 13 | S528: UMPIRE
A529: BEST PLAYERS | S529: SOUTAR | W529: TEAM | X529: W | Y529: L | Z529: D | AA529: FOR | AB529: AGST | AC529: % | AD529: PTS
A530: FOOTSCRAY | C530: JACKSON | F530: CLARKE | I530: JACOBSEN | K530: STEPHENSON | N530: MCKINLEY | Q530: GREENWOOD
A531: WEST MELBOURNE | C531: ARMSTRONG | F531: ROURKE | I531: WILSON | K531: MCDONALD | N531: A GREGORY | Q531: H GREGORY | W531: WEST MELBOURNE | X531: 10 | Y531: 1 | Z531: 1 | AA531: 739 | AB531: 342 | AC531: 216.08187134502924 | AD531: 42
A532: GOALKICKERS | W532: NORTH MELBOURNE | X532: 10 | Y532: 2 | Z532: 0 | AA532: 599 | AB532: 398 | AC532: 150.50251256281408 | AD532: 40
A533: FOOTSCRAY | C533: JACOBSEN | F533: GREENWOOD | W533: RICHMOND | X533: 9 | Y533: 3 | Z533: 0 | AA533: 776 | AB533: 472 | AC533: 164.40677966101694 | AD533: 36
A534: WEST MELBOURNE | C534: ARMSTRONG | F534: McCART | W534: FOOTSCRAY | X534: 8 | Y534: 3 | Z534: 1 | AA534: 587 | AB534: 440 | AC534: 133.40909090909091 | AD534: 34
A536: RICHMOND | C536: 5 | D536: 3 | E536: =C536*6+D536 -> 33 | G536: 6 | H536: 6 | I536: =G536*6+H536 -> 42 | K536: 7 | L536: 12 | M536: =K536*6+L536 -> 54 | O536: 8 | P536: 15 | Q536: =O536*6+P536 -> 63 | S536: BRUNSWICK | W536: WILLIAMSTOWN | X536: 8 | Y536: 4 | Z536: 0 | AA536: 693 | AB536: 511 | AC536: 135.61643835616439 | AD536: 32
A537: BRUNSWICK | C537: 0 | D537: 1 | E537: =C537*6+D537 -> 1 | G537: 0 | H537: 5 | I537: =G537*6+H537 -> 5 | K537: 0 | L537: 6 | M537: =K537*6+L537 -> 6 | O537: 1 | P537: 10 | Q537: =O537*6+P537 -> 16 | S537: ARMSTRONG | W537: BRUNSWICK | X537: 5 | Y537: 7 | Z537: 0 | AA537: 487 | AB537: 592 | AC537: 82.263513513513516 | AD537: 20
A538: BEST PLAYERS | W538: PORT MELBOURNE | X538: 4 | Y538: 8 | Z538: 0 | AA538: 387 | AB538: 624 | AC538: 62.019230769230766 | AD538: 16
A539: RICHMOND | C539: LEACH | F539: HARDIMAN | I539: LUFF | K539: RUDDOCK | N539: MAHONEY | Q539: FILDES | W539: PRESTON | X539: 3 | Y539: 9 | Z539: 0 | AA539: 520 | AB539: 608 | AC539: 85.526315789473685 | AD539: 12
A540: BRUNSWICK | C540: KENNETT | F540: BELCHER | I540: CAMERON | K540: WHITFIELD | N540: CHASE | Q540: BROWN | W540: PRAHRAN | X540: 2 | Y540: 10 | Z540: 0 | AA540: 386 | AB540: 696 | AC540: 55.459770114942529 | AD540: 8
A541: GOALKICKERS | W541: ESSENDON | X541: 0 | Y541: 12 | Z541: 0 | AA541: 382 | AB541: 873 | AC541: 43.757159221076748 | AD541: 0
A542: RICHMOND | C542: HUTCHINSON 3 | F542: HARDIMAN | I542: LEACH | K542: O'KEEFE | N542: LANG | P542: EDMONDS
A543: BRUNSWICK | C543: L LEEDS
A545: PORT MELBOURNE | C545: 1 | D545: 1 | E545: =C545*6+D545 -> 7 | G545: 1 | H545: 7 | I545: =G545*6+H545 -> 13 | K545: 2 | L545: 8 | M545: =K545*6+L545 -> 20 | O545: 3 | P545: 18 | Q545: =O545*6+P545 -> 36 | S545: PORT MELB
A546: PRESTON | C546: 0 | D546: 4 | E546: =C546*6+D546 -> 4 | G546: 1 | H546: 4 | I546: =G546*6+H546 -> 10 | K546: 3 | L546: 5 | M546: =K546*6+L546 -> 23 | O546: 3 | P546: 7 | Q546: =O546*6+P546 -> 25 | S546: PYMM
A547: BEST PLAYERS
A548: PORT MELBOURNE | C548: CURTIS | F548: JACKSON | I548: COPE | K548: McGOWAN | N548: SULLIVAN | Q548: COHEN
A549: PRESTON | C549: HOLLIS | F549: BRIGHT | I549: GILBERT | K549: BROWN | N549: BARKER | Q549: MASON
A550: GOALKICKERS
A551: PORT MELBOURNE | C551: CURTIS | F551: HILL | I551: McGOWAN
A552: PRESTON | C552: HOLLIGAN 2 | G552: BARKER
A554: NORTH MELBOURNE | C554: 2 | D554: 3 | E554: =C554*6+D554 -> 15 | G554: 2 | H554: 5 | I554: =G554*6+H554 -> 17 | K554: 3 | L554: 12 | M554: =K554*6+L554 -> 30 | O554: 3 | P554: 13 | Q554: =O554*6+P554 -> 31 | S554: NORTH MELB
A555: PRAHRAN | C555: 0 | D555: 0 | E555: =C555*6+D555 -> 0 | G555: 0 | H555: 1 | I555: =G555*6+H555 -> 1 | K555: 0 | L555: 1 | M555: =K555*6+L555 -> 1 | O555: 1 | P555: 6 | Q555: =O555*6+P555 -> 12 | S555: KRUSE
A556: BEST PLAYERS
A557: NORTH MELBOURNE | C557: BROYLAN | F557: M LONDERIGAN | I557: SMITH | K557: LINEHAN | N557: THORPE | Q557: JAMIESON
A558: PRAHRAN | C558: SWIFT | F558: CARLTON | I558: LAZARUS | K558: DOWDING | N558: PENGLASE | Q558: LYNCH
A559: GOALKICKERS
A560: NORTH MELBOURNE | C560: HOLDEN | F560: McVEIGH | I560: M LONDERIGAN
A561: PRAHRAN | C561: DOWDING
A563: WILLIAMSTOWN | C563: 4 | D563: 5 | E563: =C563*6+D563 -> 29 | G563: 5 | H563: 8 | I563: =G563*6+H563 -> 38 | K563: 6 | L563: 11 | M563: =K563*6+L563 -> 47 | O563: 7 | P563: 12 | Q563: =O563*6+P563 -> 54 | S563: ESSENDON
A564: ESSENDON | C564: 0 | D564: 0 | E564: =C564*6+D564 -> 0 | G564: 1 | H564: 2 | I564: =G564*6+H564 -> 8 | K564: 4 | L564: 4 | M564: =K564*6+L564 -> 28 | O564: 7 | P564: 10 | Q564: =O564*6+P564 -> 52 | S564: ASPINALL
A565: BEST PLAYERS
A566: WILLIAMSTOWN | C566: DICK | F566: JONES | H566: FLETCHER | K566: WHIGHT | N566: WOODS | Q566: BILES
A567: ESSENDON | C567: CHEFFERS | F567: DUFF | H567: MAKIN | K567: FITZGERALD | N567: GRAHAM | Q567: WILLIAMS
A568: GOALKICKERS
A569: WILLIAMSTOWN | C569: MATTHEWS 3 | G569: JONES 2 | J569: BUTTERFIELD | N569: BILES
A570: ESSENDON | C570: ORR 2 | F570: FITZGERALD | J570: LAURIE | M570: GRAHAM | P570: D MAKIN | S570: MITCHELL
A572: ROUND 13 | D572: 28TH JULY | J572: WEATHER | M572: SOUTH BREEZE
D573: 1ST QTR | H573: 2ND QTR | L573: 3RD QTR | P573: FINAL | S573: PLAYED AT
A574: WILLIAMSTOWN | C574: 5 | D574: 3 | E574: =C574*6+D574 -> 33 | G574: 5 | H574: 3 | I574: =G574*6+H574 -> 33 | K574: 7 | L574: 6 | M574: =K574*6+L574 -> 48 | O574: 9 | P574: 8 | Q574: =O574*6+P574 -> 62 | S574: WILLIAMSTOWN | Y574: LADDER | AB574: ROUND | AD574: 13
A575: WEST MELBOURNE | C575: 1 | D575: 1 | E575: =C575*6+D575 -> 7 | G575: 3 | H575: 10 | I575: =G575*6+H575 -> 28 | K575: 5 | L575: 13 | M575: =K575*6+L575 -> 43 | O575: 6 | P575: 16 | Q575: =O575*6+P575 -> 52 | S575: UMPIRE
A576: BEST PLAYERS | S576: KRUSE | W576: TEAM | X576: W | Y576: L | Z576: D | AA576: FOR | AB576: AGST | AC576: % | AD576: PTS
A577: WILLIAMSTOWN | C577: JONES | F577: CALDWELL | I577: LAMBERT | L577: BILES | N577: LEWIS | Q577: WOODS
A578: WEST MELBOURNE | C578: ARMSTRONG | F578: H GREGORY | I578: A GREGORY | L578: ROURKE | N578: McDONALD | Q578: RYAN | W578: NORTH MELBOURNE | X578: 11 | Y578: 2 | Z578: 0 | AA578: 651 | AB578: 427 | AC578: 152.45901639344262 | AD578: 44
A579: GOALKICKERS | W579: WEST MELBOURNE | X579: 10 | Y579: 2 | Z579: 1 | AA579: 791 | AB579: 404 | AC579: 195.79207920792078 | AD579: 42
A580: WILLIAMSTOWN | C580: MATTHEWS 2 | G580: GARBUTT 2 | J580: JONES 2 | M580: BILES | O580: DICK | Q580: KENNEDY | W580: RICHMOND | X580: 10 | Y580: 3 | Z580: 0 | AA580: 848 | AB580: 517 | AC580: 164.02321083172146 | AD580: 40
A581: WEST MELBOURNE | C581: ARMSTRONG 2 | G581: RYAN | I581: CLARKE | L581: McCANN | N581: H GREGORY | W581: FOOTSCRAY | X581: 9 | Y581: 3 | Z581: 1 | AA581: 643 | AB581: 476 | AC581: 135.08403361344537 | AD581: 38
A583: RICHMOND | C583: 5 | D583: 2 | E583: =C583*6+D583 -> 32 | G583: 7 | H583: 2 | I583: =G583*6+H583 -> 44 | K583: 7 | L583: 8 | M583: =K583*6+L583 -> 50 | O583: 10 | P583: 12 | Q583: =O583*6+P583 -> 72 | S583: RICHMOND | W583: WILLIAMSTOWN | X583: 9 | Y583: 4 | Z583: 0 | AA583: 755 | AB583: 563 | AC583: 134.10301953818828 | AD583: 36
A584: PORT MELBOURNE | C584: 0 | D584: 2 | E584: =C584*6+D584 -> 2 | G584: 2 | H584: 3 | I584: =G584*6+H584 -> 15 | K584: 5 | L584: 8 | M584: =K584*6+L584 -> 38 | O584: 6 | P584: 9 | Q584: =O584*6+P584 -> 45 | S584: FREAME | W584: BRUNSWICK | X584: 5 | Y584: 8 | Z584: 0 | AA584: 497 | AB584: 648 | AC584: 76.697530864197532 | AD584: 20
A585: BEST PLAYERS | W585: PORT MELBOURNE | X585: 4 | Y585: 9 | Z585: 0 | AA585: 432 | AB585: 696 | AC585: 62.068965517241381 | AD585: 16
A586: RICHMOND | C586: LEACH | F586: HARDIMAN | I586: MAHONEY | L586: FILDES | N586: EDMONDS | Q586: HILL | W586: PRESTON | X586: 3 | Y586: 10 | Z586: 0 | AA586: 549 | AB586: 660 | AC586: 83.181818181818187 | AD586: 12
A587: PORT MELBOURNE | C587: CURTIS | F587: WARD | I587: PETTIT | L587: JACKSON | N587: TREGLOWAN | Q587: SULLIVAN | W587: PRAHRAN | X587: 2 | Y587: 11 | Z587: 0 | AA587: 422 | AB587: 752 | AC587: 56.117021276595743 | AD587: 8
A588: GOALKICKERS | W588: ESSENDON | X588: 1 | Y588: 12 | Z588: 0 | AA588: 408 | AB588: 883 | AC588: 46.206115515288786 | AD588: 4
A589: RICHMOND | C589: HUTCHINSON 3 | F589: CARKEEK | I589: THOM | J589: BOWDEN | L589: FILDES | N589: LEACH | P589: EDMONDS | S589: MAHONEY
A590: PORT MELBOURNE | C590: CROFT 3 | F590: PETTIT 2 | I590: LAVER
A592: ESSENDON | C592: 0 | D592: 8 | E592: =C592*6+D592 -> 8 | G592: 1 | H592: 8 | I592: =G592*6+H592 -> 14 | K592: 2 | L592: 12 | M592: =K592*6+L592 -> 24 | O592: 2 | P592: 14 | Q592: =O592*6+P592 -> 26 | S592: ESSENDON
A593: BRUNSWICK | C593: 0 | D593: 1 | E593: =C593*6+D593 -> 1 | G593: 0 | H593: 4 | I593: =G593*6+H593 -> 4 | K593: 0 | L593: 10 | M593: =K593*6+L593 -> 10 | O593: 0 | P593: 10 | Q593: =O593*6+P593 -> 10 | S593: ARMSTRONG
A594: BEST PLAYERS
A595: ESSENDON | C595: BENNETT | F595: DUFF | H595: DYSON | K595: FITZGERALD | N595: MITCHELL | Q595: JONES
A596: BRUNSWICK | C596: CHASE | F596: LEEDS | H596: WHITFIELD | K596: HIGHETT | N596: BELCHER | Q596: BROWN
A597: GOALKICKERS
A598: ESSENDON | C598: MONTGOMERY 2
A599: BRUNSWICK | C599: NIL
A601: FOOTSCRAY | C601: 2 | D601: 3 | E601: =C601*6+D601 -> 15 | G601: 2 | H601: 4 | I601: =G601*6+H601 -> 16 | K601: 6 | L601: 8 | M601: =K601*6+L601 -> 44 | O601: 8 | P601: 8 | Q601: =O601*6+P601 -> 56 | S601: TOORAK PARK
A602: PRAHRAN | C602: 1 | D602: 0 | E602: =C602*6+D602 -> 6 | G602: 5 | H602: 4 | I602: =G602*6+H602 -> 34 | K602: 5 | L602: 4 | M602: =K602*6+L602 -> 34 | O602: 5 | P602: 6 | Q602: =O602*6+P602 -> 36 | S602: PYMM
A603: BEST PLAYERS
A604: FOOTSCRAY | C604: HEDLEY | F604: HUGHES | I604: GREENWOOD | L604: WILLIAMS | O604: MARMO | Q604: HINCH
A605: PRAHRAN | C605: HAIGHBLOOM | F605: LAZARUS | I605: SYKES | L605: DOWDING | O605: CROSS | Q605: GOODYEAR
A606: GOALKICKERS
A607: FOOTSCRAY | C607: WAGNER 2 | F607: HUGHES 2 | I607: GLENISTER 2 | M607: JACOBSEN | P607: GREEN
A608: PRAHRAN | C608: HAIGHBLOOM | G608: CARLSON | J608: LYNCH | L608: SYKES | N608: CROSS
A610: NORTH MELBOURNE | C610: 1 | D610: 2 | E610: =C610*6+D610 -> 8 | G610: 3 | H610: 6 | I610: =G610*6+H610 -> 24 | K610: 3 | L610: 7 | M610: =K610*6+L610 -> 25 | O610: 7 | P610: 10 | Q610: =O610*6+P610 -> 52 | S610: NORTH MELBOURNE
A611: PRESTON | C611: 2 | D611: 1 | E611: =C611*6+D611 -> 13 | G611: 2 | H611: 1 | I611: =G611*6+H611 -> 13 | K611: 3 | L611: 2 | M611: =K611*6+L611 -> 20 | O611: 4 | P611: 5 | Q611: =O611*6+P611 -> 29 | S611: SOUTAR
A612: BEST PLAYERS
A613: NORTH MELBOURNE | C613: HOLDEN | E613: M LONDERIGAN | H613: BARNES | J613: BOYLE | M613: RAHILLY | P613: KENNY
A614: PRESTON | C614: BRIGHT | E614: OGDEN | H614: BROWN | J614: MASON | M614: P HALL | P614: DOHERTY
A615: GOALKICKERS
A616: NORTH MELBOURNE | C616: HOLDEN 2 | F616: RAHILLY | I616: WATSON | L616: M LONDERIGAN | P616: McVEIGH | S616: KEATING
A617: PRESTON | C617: P HALL | F617: BARKER | I617: BEER | K617: HOLLIGAN
A619: ROUND 14 | D619: 4TH AUGUST | J619: WEATHER | M619: NORTH WIND
D620: 1ST QTR | H620: 2ND QTR | L620: 3RD QTR | P620: FINAL | S620: PLAYED AT
A621: NORTH MELBOURNE | C621: 1 | D621: 4 | E621: =C621*6+D621 -> 10 | G621: 1 | H621: 4 | I621: =G621*6+H621 -> 10 | K621: 2 | L621: 4 | M621: =K621*6+L621 -> 16 | O621: 4 | P621: 7 | Q621: =O621*6+P621 -> 31 | S621: FOOTSCRAY | Y621: LADDER | AB621: ROUND | AD621: 14
A622: FOOTSCRAY | C622: 2 | D622: 1 | E622: =C622*6+D622 -> 13 | G622: 3 | H622: 2 | I622: =G622*6+H622 -> 20 | K622: 3 | L622: 3 | M622: =K622*6+L622 -> 21 | O622: 4 | P622: 3 | Q622: =O622*6+P622 -> 27 | S622: UMPIRE
A623: BEST PLAYERS | S623: SOUTAR | W623: TEAM | X623: W | Y623: L | Z623: D | AA623: FOR | AB623: AGST | AC623: % | AD623: PTS
A624: NORTH MELBOURNE | C624: BROYLAN | F624: ROWE | I624: WATSON | L624: BARNES | N624: BOYLE | Q624: LINEHAN
A625: FOOTSCRAY | C625: GREENWOOD | F625: McKINLEY | I625: NEILSON | L625: JACOBSEN | N625: HEDLEY | Q625: WILLIAMS | W625: NORTH MELBOURNE | X625: 12 | Y625: 2 | Z625: 0 | AA625: 682 | AB625: 454 | AC625: 150.22026431718061 | AD625: 48
A626: GOALKICKERS | W626: WEST MELBOURNE | X626: 11 | Y626: 2 | Z626: 1 | AA626: 923 | AB626: 431 | AC626: 214.15313225058006 | AD626: 46
A627: NORTH MELBOURNE | C627: LINEHAN 2 | F627: RAHILLY | I627: HOLDEN | W627: RICHMOND | X627: 11 | Y627: 3 | Z627: 0 | AA627: 885 | AB627: 542 | AC627: 163.28413284132841 | AD627: 44
A628: FOOTSCRAY | C628: HUGHES | F628: JACOBSEN | I628: GREENWOOD | M628: McCOLL | W628: FOOTSCRAY | X628: 9 | Y628: 4 | Z628: 1 | AA628: 670 | AB628: 507 | AC628: 132.1499013806706 | AD628: 38
A630: RICHMOND | C630: 2 | D630: 1 | E630: =C630*6+D630 -> 13 | G630: 3 | H630: 4 | I630: =G630*6+H630 -> 22 | K630: 3 | L630: 4 | M630: =K630*6+L630 -> 22 | O630: 5 | P630: 7 | Q630: =O630*6+P630 -> 37 | S630: WILLIAMSTOWN | W630: WILLIAMSTOWN | X630: 9 | Y630: 5 | Z630: 0 | AA630: 780 | AB630: 600 | AC630: 130 | AD630: 36
A631: WILLIAMSTOWN | C631: 1 | D631: 1 | E631: =C631*6+D631 -> 7 | G631: 1 | H631: 1 | I631: =G631*6+H631 -> 7 | K631: 3 | L631: 7 | M631: =K631*6+L631 -> 25 | O631: 3 | P631: 7 | Q631: =O631*6+P631 -> 25 | S631: ARMSTRONG | W631: BRUNSWICK | X631: 5 | Y631: 9 | Z631: 0 | AA631: 541 | AB631: 698 | AC631: 77.507163323782237 | AD631: 20
A632: BEST PLAYERS | W632: PRESTON | X632: 4 | Y632: 10 | Z632: 0 | AA632: 599 | AB632: 704 | AC632: 85.085227272727266 | AD632: 16
A633: RICHMOND | C633: BOWNAS | F633: C WILLIAMS | I633: RUDDOCK | L633: O'KEEFE | N633: GEGGIE | Q633: MEGSON | W633: PORT MELBOURNE | X633: 4 | Y633: 10 | Z633: 0 | AA633: 459 | AB633: 828 | AC633: 55.434782608695649 | AD633: 16
A634: WILLIAMSTOWN | C634: JONES | F634: BILES | I634: LEWIS | L634: FLETCHER | N634: DICK | Q634: GRAHAM | W634: PRAHRAN | X634: 3 | Y634: 11 | Z634: 0 | AA634: 508 | AB634: 789 | AC634: 64.385297845373884 | AD634: 12
A635: GOALKICKERS | W635: ESSENDON | X635: 1 | Y635: 13 | Z635: 0 | AA635: 445 | AB635: 969 | AC635: 45.923632610939116 | AD635: 4
A636: RICHMOND | C636: HUTCHINSON 3 | G636: SYKES | I636: FILDES
A637: WILLIAMSTOWN | C637: DICK | E637: McKENZIE | H637: MATTHEWS
A639: WEST MELBOURNE | C639: 7 | D639: 10 | E639: =C639*6+D639 -> 52 | G639: 8 | H639: 11 | I639: =G639*6+H639 -> 59 | K639: 11 | L639: 21 | M639: =K639*6+L639 -> 87 | O639: 18 | P639: 24 | Q639: =O639*6+P639 -> 132 | S639: NORTH MELB
A640: PORT MELBOURNE | C640: 0 | D640: 0 | E640: =C640*6+D640 -> 0 | G640: 1 | H640: 3 | I640: =G640*6+H640 -> 9 | K640: 1 | L640: 3 | M640: =K640*6+L640 -> 9 | O640: 4 | P640: 3 | Q640: =O640*6+P640 -> 27 | S640: PYMM
A641: BEST PLAYERS
A642: WEST MELBOURNE | C642: ARMSTRONG | F642: LAXTON | I642: ROURKE | K642: H GREGORY | N642: MADDEN | Q642: CULLEN
A643: PORT MELBOURNE | C643: WARD | F643: CURTIS | I643: AYLES | K643: CROFT | N643: JACKSON | Q643: PRIDEAUX
A644: GOALKICKERS
A645: WEST MELBOURNE | C645: ARMSTRONG 6 | G645: McCANN 4 | J645: RYAN 2 | M645: RANKIN 2 | P645: CLARKE 2 | S645: WILLIAMSON | W645: MINTO
A646: PORT MELBOURNE | C646: HILL | E646: HUESKER | H646: AYLES | J646: PRIDEAUX
A648: PRESTON | C648: 1 | D648: 1 | E648: =C648*6+D648 -> 7 | G648: 4 | H648: 7 | I648: =G648*6+H648 -> 31 | K648: 5 | L648: 8 | M648: =K648*6+L648 -> 38 | O648: 7 | P648: 8 | Q648: =O648*6+P648 -> 50 | S648: PRESTON
A649: BRUNSWICK | C649: 1 | D649: 4 | E649: =C649*6+D649 -> 10 | G649: 3 | H649: 5 | I649: =G649*6+H649 -> 23 | K649: 5 | L649: 7 | M649: =K649*6+L649 -> 37 | O649: 6 | P649: 8 | Q649: =O649*6+P649 -> 44 | S649: FREAME
A650: BEST PLAYERS
A651: PRESTON | C651: HOLLIGAN | F651: TORPEY | I651: MEGSON | K651: STANLAKE | N651: OGDEN | Q651: S HALL
A652: BRUNSWICK | C652: CHASE | F652: W LEEDS | I652: ANDREWS | K652: KENNETT | N652: S BALFE | Q652: SERGEANT
A653: GOALKICKERS
A654: PRESTON | C654: HOLLIGAN 2 | G654: TORPEY | J654: GILBERT | M654: HARRINGTON | Q654: WAWN | S654: BEER
A655: BRUNSWICK | C655: W LEEDS | F655: TEMPLE | I655: BALFE | L655: SCOTT | N655: SERGEANT | Q655: ANDREWS
A657: PRAHRAN | C657: 1 | D657: 6 | E657: =C657*6+D657 -> 12 | G657: 5 | H657: 7 | I657: =G657*6+H657 -> 37 | K657: 7 | L657: 8 | M657: =K657*6+L657 -> 50 | O657: 12 | P657: 14 | Q657: =O657*6+P657 -> 86 | S657: TOORAK PARK
A658: ESSENDON | C658: 2 | D658: 2 | E658: =C658*6+D658 -> 14 | G658: 3 | H658: 6 | I658: =G658*6+H658 -> 24 | K658: 3 | L658: 12 | M658: =K658*6+L658 -> 30 | O658: 4 | P658: 13 | Q658: =O658*6+P658 -> 37 | S658: KRUSE
A659: BEST PLAYERS
A660: PRAHRAN | C660: ROBERTS | F660: PENGLASE | I660: ALLAN | K660: LAZARUS | N660: DOWDING | Q660: SYKES
A661: ESSENDON | C661: WILLIAMS | F661: CHEFFERS | I661: DUFF | K661: MITCHELL | N661: MAKIN | Q661: DARBY
A662: GOALKICKERS
A663: PRAHRAN | C663: ROBERTS 5 | F663: LAZARUS 2 | I663: SMITH 2 | L663: SYKES | N663: DOWDING | Q663: LYNCH
A664: ESSENDON | C664: MITCHELL 2 | G664: FITZGERALD | K664: D MAKIN
A666: ROUND 15 | D666: 18TH AUGUST | J666: WEATHER | M666: NORTH WIND
D667: 1ST QTR | H667: 2ND QTR | L667: 3RD QTR | P667: FINAL | S667: PLAYED AT
A668: RICHMOND | C668: 2 | D668: 2 | E668: =C668*6+D668 -> 14 | G668: 4 | H668: 3 | I668: =G668*6+H668 -> 27 | K668: 7 | L668: 6 | M668: =K668*6+L668 -> 48 | O668: 7 | P668: 9 | Q668: =O668*6+P668 -> 51 | S668: NORTH MELB | Y668: LADDER | AB668: ROUND | AD668: 15
A669: NORTH MELBOURNE | C669: 1 | D669: 2 | E669: =C669*6+D669 -> 8 | G669: 3 | H669: 6 | I669: =G669*6+H669 -> 24 | K669: 3 | L669: 7 | M669: =K669*6+L669 -> 25 | O669: 5 | P669: 11 | Q669: =O669*6+P669 -> 41 | S669: UMPIRE
A670: BEST PLAYERS | S670: SOUTAR | W670: TEAM | X670: W | Y670: L | Z670: D | AA670: FOR | AB670: AGST | AC670: % | AD670: PTS
A671: RICHMOND | C671: LANG | F671: LEACH | I671: MAHONEY | L671: SYKES | O671: MEGSON | R671: HILL
A672: NORTH MELBOURNE | C672: BOYLE | F672: SMITH | I672: KEATING | L672: MARTIN | O672: WATSON | R672: RAPP | W672: WEST MELBOURNE | X672: 12 | Y672: 2 | Z672: 1 | AA672: 1004 | AB672: 480 | AC672: 209.16666666666666 | AD672: 50
A673: GOALKICKERS | W673: RICHMOND | X673: 12 | Y673: 3 | Z673: 0 | AA673: 936 | AB673: 583 | AC673: 160.54888507718695 | AD673: 48
A674: RICHMOND | C674: HUTCHINSON 3 | G674: SYKES | I674: MAHONEY | L674: C WILLIAMS | O674: HEANEY | W674: NORTH MELBOURNE | X674: 12 | Y674: 3 | Z674: 0 | AA674: 723 | AB674: 505 | AC674: 143.16831683168317 | AD674: 48
A675: NORTH MELBOURNE | C675: KENNY 3 | F675: LINEHAN | I675: SMITH | W675: FOOTSCRAY | X675: 10 | Y675: 4 | Z675: 1 | AA675: 732 | AB675: 540 | AC675: 135.55555555555554 | AD675: 42
A677: WILLIAMSTOWN | C677: 4 | D677: 4 | E677: =C677*6+D677 -> 28 | G677: 4 | H677: 7 | I677: =G677*6+H677 -> 31 | K677: 9 | L677: 10 | M677: =K677*6+L677 -> 64 | O677: 12 | P677: 10 | Q677: =O677*6+P677 -> 82 | S677: BRUNSWICK | W677: WILLIAMSTOWN | X677: 10 | Y677: 5 | Z677: 0 | AA677: 862 | AB677: 638 | AC677: 135.10971786833855 | AD677: 40
A678: BRUNSWICK | C678: 1 | D678: 1 | E678: =C678*6+D678 -> 7 | G678: 3 | H678: 5 | I678: =G678*6+H678 -> 23 | K678: 4 | L678: 6 | M678: =K678*6+L678 -> 30 | O678: 5 | P678: 8 | Q678: =O678*6+P678 -> 38 | S678: ASPINALL | W678: BRUNSWICK | X678: 5 | Y678: 10 | Z678: 0 | AA678: 579 | AB678: 780 | AC678: 74.230769230769226 | AD678: 20
A679: BEST PLAYERS | W679: PRESTON | X679: 4 | Y679: 11 | Z679: 0 | AA679: 648 | AB679: 785 | AC679: 82.547770700636946 | AD679: 16
A680: WILLIAMSTOWN | C680: JONES | F680: KENNEDY | I680: FLETCHER | L680: LEWIS | N680: CALDWELL | R680: GARBUTT | W680: PRAHRAN | X680: 4 | Y680: 11 | Z680: 0 | AA680: 581 | AB680: 813 | AC680: 71.463714637146367 | AD680: 16
A681: BRUNSWICK | C681: CHASE | F681: BELCHER | I681: McNAMARA | L681: TAME | N681: CARMAN | R681: KENNETT | W681: PORT MELBOURNE | X681: 4 | Y681: 11 | Z681: 0 | AA681: 483 | AB681: 901 | AC681: 53.607103218645946 | AD681: 16
A682: GOALKICKERS | W682: ESSENDON | X682: 1 | Y682: 14 | Z682: 0 | AA682: 478 | AB682: 1031 | AC682: 46.3627546071775 | AD682: 4
A683: WILLIAMSTOWN | C683: McNEILAGE 3 | F683: FLETCHER 2 | I683: MATTHEWS 2 | L683: HALL | M683: GARBUTT | O683: KENNEDY | Q683: DICK | S683: McKENZIE
A684: BRUNSWICK | C684: SCOTT | E684: SMITH | G684: CRINNION | J684: TEMPLE | M684: BELCHER
A686: WEST MELBOURNE | C686: 3 | D686: 2 | E686: =C686*6+D686 -> 20 | G686: 6 | H686: 7 | I686: =G686*6+H686 -> 43 | K686: 8 | L686: 11 | M686: =K686*6+L686 -> 59 | O686: 11 | P686: 15 | Q686: =O686*6+P686 -> 81 | S686: PRESTON
A687: PRESTON | C687: 2 | D687: 6 | E687: =C687*6+D687 -> 18 | G687: 2 | H687: 7 | I687: =G687*6+H687 -> 19 | K687: 5 | L687: 12 | M687: =K687*6+L687 -> 42 | O687: 6 | P687: 13 | Q687: =O687*6+P687 -> 49 | S687: FREAME
A688: BEST PLAYERS
A689: WEST MELBOURNE | C689: ROURKE | F689: H GREGORY | I689: A GREGORY | L689: MINTO | O689: JOHNSON | R689: WILSON
A690: PRESTON | C690: TORPEY | F690: HOLLIS | I690: OGDEN | L690: HOLLIGAN | O690: S HALL | R690: GILBERT
A691: GOALKICKERS
A692: WEST MELBOURNE | C692: ARMSTRONG 3 | F692: RYAN 2 | H692: McCANN 2 | K692: A GREGORY | N692: ROURKE | P692: CLARKE | R692: McCART
A693: PRESTON | C693: GILBERT 2 | F693: HARRINGTON | J693: TORPEY | M693: PEARMAN | P693: HOLLIGAN
A695: PRAHRAN | C695: 2 | D695: 2 | E695: =C695*6+D695 -> 14 | G695: 5 | H695: 6 | I695: =G695*6+H695 -> 36 | K695: 5 | L695: 7 | M695: =K695*6+L695 -> 37 | O695: 10 | P695: 13 | Q695: =O695*6+P695 -> 73 | S695: TOORAK PARK
A696: PORT MELBOURNE | C696: 1 | D696: 2 | E696: =C696*6+D696 -> 8 | G696: 2 | H696: 4 | I696: =G696*6+H696 -> 16 | K696: 3 | L696: 5 | M696: =K696*6+L696 -> 23 | O696: 3 | P696: 6 | Q696: =O696*6+P696 -> 24 | S696: ARMSTRONG
A697: BEST PLAYERS
A698: PRAHRAN | C698: HAIGHBLOOM | F698: LAZARUS | I698: ROCHE | L698: NEILL | N698: BROWN | Q698: DOWDING
A699: PORT MELBOURNE | C699: CURTIS | F699: JACKSON | I699: AYLES | L699: WARD | N699: McGOWAN | Q699: SULLIVAN
A700: GOALKICKERS
A701: PRAHRAN | C701: ROBERTS 3 | F701: HAIGHBLOOM 3 | J701: SMITH 2 | M701: SYKES | O701: PENGLASE
A702: PORT MELBOURNE | C702: COOPER | F702: SULLIVAN | I702: COHEN
A704: FOOTSCRAY | C704: 1 | D704: 6 | E704: =C704*6+D704 -> 12 | G704: 5 | H704: 8 | I704: =G704*6+H704 -> 38 | K704: 7 | L704: 8 | M704: =K704*6+L704 -> 50 | O704: 8 | P704: 14 | Q704: =O704*6+P704 -> 62 | S704: ESSENDON
A705: ESSENDON | C705: 0 | D705: 1 | E705: =C705*6+D705 -> 1 | G705: 1 | H705: 1 | I705: =G705*6+H705 -> 7 | K705: 1 | L705: 6 | M705: =K705*6+L705 -> 12 | O705: 4 | P705: 9 | Q705: =O705*6+P705 -> 33 | S705: KRUSE
A706: BEST PLAYERS
A707: FOOTSCRAY | C707: HARRIS | F707: McKINLEY | I707: JACOBSEN | M707: D McCARTHY | Q707: WAGNER
A708: ESSENDON | C708: BUSBRIDGE | F708: BENNETT | I708: CHEFFERS | M708: DUFF | Q708: MAKIN
A709: GOALKICKERS
A710: FOOTSCRAY | C710: WAGNER 3 | F710: McCOLL 2 | I710: ANSTEY | L710: W McCARTHY | P710: JACOBSEN
A711: ESSENDON | C711: D MAKIN | F711: McNAMARA | I711: CHURCHMAN | M711: ORR
A713: ROUND 16 | D713: 25TH AUGUST | J713: WEATHER | M713: WEST WIND RAIN BLEAK DAY
D714: 1ST QTR | H714: 2ND QTR | L714: 3RD QTR | P714: FINAL | S714: PLAYED AT
A715: WEST MELBOURNE | C715: 0 | D715: 5 | E715: =C715*6+D715 -> 5 | G715: 0 | H715: 6 | I715: =G715*6+H715 -> 6 | K715: 3 | L715: 10 | M715: =K715*6+L715 -> 28 | O715: 4 | P715: 11 | Q715: =O715*6+P715 -> 35 | S715: NORTH MELB | Y715: LADDER | AB715: ROUND | AD715: 16
A716: RICHMOND | C716: 0 | D716: 1 | E716: =C716*6+D716 -> 1 | G716: 1 | H716: 3 | I716: =G716*6+H716 -> 9 | K716: 3 | L716: 7 | M716: =K716*6+L716 -> 25 | O716: 3 | P716: 9 | Q716: =O716*6+P716 -> 27 | S716: UMPIRE
A717: BEST PLAYERS | S717: ARMSTRONG | W717: TEAM | X717: W | Y717: L | Z717: D | AA717: FOR | AB717: AGST | AC717: % | AD717: PTS
A718: WEST MELBOURNE | C718: RANKIN | F718: MADDEN | I718: WILSON | K718: ARMSTRONG | N718: H GREGORY | Q718: WILLIAMSON
A719: RICHMOND | C719: SYKES | F719: MAHONEY | I719: MEGSON | K719: EDMONDS | N719: RUDDOCK | Q719: C WILLIAMS | W719: WEST MELBOURNE | X719: 13 | Y719: 2 | Z719: 1 | AA719: 1039 | AB719: 507 | AC719: 204.930966469428 | AD719: 54
A720: GOALKICKERS | W720: RICHMOND | X720: 12 | Y720: 4 | Z720: 0 | AA720: 963 | AB720: 618 | AC720: 155.82524271844659 | AD720: 48
A721: WEST MELBOURNE | W721: NORTH MELBOURNE | X721: 12 | Y721: 4 | Z721: 0 | AA721: 743 | AB721: 552 | AC721: 134.60144927536231 | AD721: 48
A722: RICHMOND | C722: EDMONDS | W722: WILLIAMSTOWN | X722: 11 | Y722: 5 | Z722: 0 | AA722: 944 | AB722: 671 | AC722: 140.68554396423249 | AD722: 44
A724: BRUNSWICK | C724: 2 | D724: 5 | E724: =C724*6+D724 -> 17 | G724: 4 | H724: 10 | I724: =G724*6+H724 -> 34 | K724: 4 | L724: 13 | M724: =K724*6+L724 -> 37 | O724: 5 | P724: 13 | Q724: =O724*6+P724 -> 43 | S724: BRUNSWICK | W724: FOOTSCRAY | X724: 10 | Y724: 5 | Z724: 1 | AA724: 771 | AB724: 583 | AC724: 132.24699828473413 | AD724: 42
A725: FOOTSCRAY | C725: 0 | D725: 2 | E725: =C725*6+D725 -> 2 | G725: 1 | H725: 7 | I725: =G725*6+H725 -> 13 | K725: 1 | L725: 10 | M725: =K725*6+L725 -> 16 | O725: 4 | P725: 15 | Q725: =O725*6+P725 -> 39 | S725: SOUTAR | W725: BRUNSWICK | X725: 6 | Y725: 10 | Z725: 0 | AA725: 622 | AB725: 819 | AC725: 75.946275946275946 | AD725: 24
A726: BEST PLAYERS | W726: PRESTON | X726: 5 | Y726: 11 | Z726: 0 | AA726: 714 | AB726: 811 | AC726: 88.039457459926012 | AD726: 20
A727: BRUNSWICK | C727: CHASE | F727: SCOTT | I727: BROWN | L727: BRAID | O727: TAME | R727: BELCHER | W727: PORT MELBOURNE | X727: 5 | Y727: 11 | Z727: 0 | AA727: 530 | AB727: 921 | AC727: 57.546145494028231 | AD727: 20
A728: FOOTSCRAY | C728: MCKINLEY | F728: HEDLEY | I728: JACOBSEN | L728: GIBSON | O728: HARRIS | W728: PRAHRAN | X728: 4 | Y728: 12 | Z728: 0 | AA728: 614 | AB728: 895 | AC728: 68.603351955307261 | AD728: 16
A729: GOALKICKERS | W729: ESSENDON | X729: 1 | Y729: 15 | Z729: 0 | AA729: 504 | AB729: 1097 | AC729: 45.943482224247951 | AD729: 4
A730: BRUNSWICK | C730: CHASE 2 | F730: S BALFE | I730: H BALFE | L730: SERGEANT
A731: FOOTSCRAY | C731: JACOBSEN | F731: HEDLEY | I731: ANSTEY | L731: McKINLEY
A733: WILLIAMSTOWN | C733: 4 | D733: 5 | E733: =C733*6+D733 -> 29 | G733: 8 | H733: 7 | I733: =G733*6+H733 -> 55 | K733: 12 | L733: 10 | M733: =K733*6+L733 -> 82 | O733: 12 | P733: 10 | Q733: =O733*6+P733 -> 82 | S733: WILLIAMSTOWN
A734: PRAHRAN | C734: 0 | D734: 0 | E734: =C734*6+D734 -> 0 | G734: 1 | H734: 3 | I734: =G734*6+H734 -> 9 | K734: 1 | L734: 4 | M734: =K734*6+L734 -> 10 | O734: 4 | P734: 9 | Q734: =O734*6+P734 -> 33 | S734: PYMM
A735: BEST PLAYERS
A736: WILLIAMSTOWN | C736: JONES | F736: MAGUIRE | I736: ALLEY | L736: CALDWELL | O736: DICK | R736: KENNEDY
A737: PRAHRAN | C737: LAZARUS | F737: EVANS | I737: SWIFT | L737: ALLAN | O737: DOWDING | R737: LEWIS
A738: GOALKICKERS
A739: WILLIAMSTOWN | C739: MATTHEWS 3 | F739: KERR 2 | H739: LAMBERT 2 | K739: JONES 2 | N739: DICK | O739: KENNEDY | R739: McNEILAGE
A740: PRAHRAN | C740: SYKES
A742: PRESTON | C742: 1 | D742: 3 | E742: =C742*6+D742 -> 9 | G742: 3 | H742: 7 | I742: =G742*6+H742 -> 25 | K742: 7 | L742: 9 | M742: =K742*6+L742 -> 51 | O742: 9 | P742: 12 | Q742: =O742*6+P742 -> 66 | S742: PRESTON
A743: ESSENDON | C743: 2 | D743: 4 | E743: =C743*6+D743 -> 16 | G743: 2 | H743: 4 | I743: =G743*6+H743 -> 16 | K743: 3 | L743: 7 | M743: =K743*6+L743 -> 25 | O743: 3 | P743: 8 | Q743: =O743*6+P743 -> 26 | S743: FREAME
A744: BEST PLAYERS
A745: PRESTON | C745: S HALL | F745: STANLAKE | I745: LANDELLS | L745: OGDEN | N745: TORPEY | Q745: HOLLIGAN
A746: ESSENDON | C746: CHEFFERS | F746: BUSBRIDGE | I746: DUFF | L746: BENNETT | N746: FITZGERALD | Q746: WILLIAMS
A747: GOALKICKERS
A748: PRESTON | C748: LANDELLS 5 | G748: OGDEN
A749: ESSENDON | C749: WILLIAMS
A751: PORT MELBOURNE | C751: 0 | D751: 0 | E751: =C751*6+D751 -> 0 | G751: 2 | H751: 5 | I751: =G751*6+H751 -> 17 | K751: 2 | L751: 7 | M751: =K751*6+L751 -> 19 | O751: 6 | P751: 11 | Q751: =O751*6+P751 -> 47 | S751: PORT MELB
A752: NORTH MELBOURNE | C752: 1 | D752: 1 | E752: =C752*6+D752 -> 7 | G752: 2 | H752: 2 | I752: =G752*6+H752 -> 14 | K752: 2 | L752: 6 | M752: =K752*6+L752 -> 18 | O752: 2 | P752: 8 | Q752: =O752*6+P752 -> 20 | S752: ASPINALL
A753: BEST PLAYERS
A754: PORT MELBOURNE | C754: SULLIVAN | F754: HILL | I754: JACKSON | L754: CURTIS | O754: McGOWAN | R754: WARD
A755: NORTH MELBOURNE | C755: SMIYH | F755: LINEHAN | I755: BOYLE | L755: BROYLAN | O755: RAPP | R755: MARTIN
A756: GOALKICKERS
A757: PORT MELBOURNE | C757: PRIDEAUX | F757: BRENNAN
A758: NORTH MELBOURNE | C758: HOLDEN | F758: CARTER
A760: ROUND 17 | D760: 1ST SEPTEMBER | J760: WEATHER | M760: DRIZZLING RAIN
D761: 1ST QTR | H761: 2ND QTR | L761: 3RD QTR | P761: FINAL | S761: PLAYED AT
A762: WILLIAMSTOWN | C762: 2 | D762: 5 | E762: =C762*6+D762 -> 17 | G762: 3 | H762: 7 | I762: =G762*6+H762 -> 25 | K762: 5 | L762: 7 | M762: =K762*6+L762 -> 37 | O762: 5 | P762: 9 | Q762: =O762*6+P762 -> 39 | S762: WILLIAMSTOWN | Y762: LADDER | AB762: ROUND | AD762: 17
A763: NORTH MELBOURNE | C763: 1 | D763: 0 | E763: =C763*6+D763 -> 6 | G763: 1 | H763: 4 | I763: =G763*6+H763 -> 10 | K763: 2 | L763: 8 | M763: =K763*6+L763 -> 20 | O763: 4 | P763: 9 | Q763: =O763*6+P763 -> 33 | S763: UMPIRE
A764: BEST PLAYERS | S764: SOUTAR | W764: TEAM | X764: W | Y764: L | Z764: D | AA764: FOR | AB764: AGST | AC764: % | AD764: PTS
A765: WILLIAMSTOWN | C765: ALLEY | F765: WHIGHT | I765: HALL | L765: CALDWELL | O765: McGUIRE | R765: KERR
A766: NORTH MELBOURNE | C766: BOYLE | F766: CARTER | I766: MARTIN | L766: KEATING | O766: JAMIESON | R766: WATSON | W766: WEST MELBOURNE | X766: 14 | Y766: 2 | Z766: 1 | AA766: 1095 | AB766: 524 | AC766: 208.96946564885496 | AD766: 58
A767: GOALKICKERS | W767: RICHMOND | X767: 13 | Y767: 4 | Z767: 0 | AA767: 1034 | AB767: 649 | AC767: 159.32203389830508 | AD767: 52
A768: WILLIAMSTOWN | C768: FLETCHER | F768: MATTHEWS | I768: KENNEDY | L768: GARBUTT | O768: LAMBERT | W768: WILLIAMSTOWN | X768: 12 | Y768: 5 | Z768: 0 | AA768: 983 | AB768: 704 | AC768: 139.63068181818181 | AD768: 48
A769: NORTH MELBOURNE | C769: LINEHAN | F769: KENNY | I769: BROYLAN | L769: RYAN | W769: NORTH MELBOURNE | X769: 12 | Y769: 5 | Z769: 0 | AA769: 776 | AB769: 591 | AC769: 131.30287648054144 | AD769: 48
A771: WEST MELBOURNE | C771: 3 | D771: 6 | E771: =C771*6+D771 -> 24 | G771: 4 | H771: 9 | I771: =G771*6+H771 -> 33 | K771: 5 | L771: 17 | M771: =K771*6+L771 -> 47 | O771: 6 | P771: 20 | Q771: =O771*6+P771 -> 56 | S771: NORTH MELB | W771: FOOTSCRAY | X771: 11 | Y771: 5 | Z771: 1 | AA771: 852 | AB771: 610 | AC771: 139.67213114754099 | AD771: 46
A772: BRUNSWICK | C772: 1 | D772: 1 | E772: =C772*6+D772 -> 7 | G772: 1 | H772: 5 | I772: =G772*6+H772 -> 11 | K772: 1 | L772: 7 | M772: =K772*6+L772 -> 13 | O772: 1 | P772: 11 | Q772: =O772*6+P772 -> 17 | S772: FREAME | W772: BRUNSWICK | X772: 6 | Y772: 11 | Z772: 0 | AA772: 639 | AB772: 875 | AC772: 73.028571428571425 | AD772: 24
A773: BEST PLAYERS | W773: PRESTON | X773: 5 | Y773: 12 | Z773: 0 | AA773: 752 | AB773: 852 | AC773: 88.262910798122064 | AD773: 20
A774: WEST MELBOURNE | C774: ROURKE | F774: ARMSTRONG | I774: LAXTON | L774: JOHNSON | N774: MINTO | Q774: H GREGORY | W774: PRAHRAN | X774: 5 | Y774: 12 | Z774: 0 | AA774: 655 | AB774: 933 | AC774: 70.20364415862808 | AD774: 20
A775: BRUNSWICK | C775: CHASE | F775: BELCHER | I775: CARMAN | L775: BRAID | N775: LEEDS | W775: PORT MELBOURNE | X775: 5 | Y775: 12 | Z775: 0 | AA775: 557 | AB775: 1002 | AC775: 55.588822355289423 | AD775: 20
A776: GOALKICKERS | W776: ESSENDON | X776: 1 | Y776: 16 | Z776: 0 | AA776: 535 | AB776: 1168 | AC776: 45.804794520547944 | AD776: 4
A777: WEST MELBOURNE | C777: RYAN 3 | F777: ARMSTRONG 2 | J777: RANKIN
A778: BRUNSWICK | C778: TEMPLE
A780: FOOTSCRAY | C780: 1 | D780: 6 | E780: =C780*6+D780 -> 12 | G780: 3 | H780: 10 | I780: =G780*6+H780 -> 28 | K780: 7 | L780: 13 | M780: =K780*6+L780 -> 55 | O780: 11 | P780: 15 | Q780: =O780*6+P780 -> 81 | S780: FOOTSCRAY
A781: PORT MELBOURNE | C781: 0 | D781: 0 | E781: =C781*6+D781 -> 0 | G781: 0 | H781: 0 | I781: =G781*6+H781 -> 0 | K781: 0 | L781: 1 | M781: =K781*6+L781 -> 1 | O781: 4 | P781: 3 | Q781: =O781*6+P781 -> 27 | S781: ASPINALL
A782: BEST PLAYERS
A783: FOOTSCRAY | C783: McKINLEY | F783: HUGHES | I783: NEILSON | K783: D McCARTHY | N783: BROWN | Q783: GREENWOOD
A784: PORT MELBOURNE | C784: McGOWAN | F784: JACKSON | I784: LAVER | K784: SULLIVAN | N784: INGHAM | Q784: HALL
A785: GOALKICKERS
A786: FOOTSCRAY | C786: WAGNER 5 | F786: W McCARTHY 3 | J786: McCOLL | M786: BORTHWICK | P786: GLENISTER
A787: PORT MELBOURNE | C787: HALL 2 | F787: McDONALD | I787: McGOWAN
A789: PRAHRAN | C789: 1 | D789: 3 | E789: =C789*6+D789 -> 9 | G789: 3 | H789: 5 | I789: =G789*6+H789 -> 23 | K789: 5 | L789: 9 | M789: =K789*6+L789 -> 39 | O789: 5 | P789: 11 | Q789: =O789*6+P789 -> 41 | S789: TOORAK PARK
A790: PRESTON | C790: 2 | D790: 3 | E790: =C790*6+D790 -> 15 | G790: 3 | H790: 4 | I790: =G790*6+H790 -> 22 | K790: 3 | L790: 7 | M790: =K790*6+L790 -> 25 | O790: 5 | P790: 8 | Q790: =O790*6+P790 -> 38 | S790: KRUSE
A791: BEST PLAYERS
A792: PRAHRAN | C792: ALLAN | F792: SMITH | I792: ROCHE | K792: LEWIS | N792: LAZARUS | Q792: NEILL
A793: PRESTON | C793: HOLLIGAN | F793: BROWN | I793: OGDEN | K793: GILBERT | N793: S HALL | Q793: MASON
A794: GOALKICKERS
A795: PRAHRAN | C795: CARLSON 2 | F795: HAUGHTON 2 | J795: ROBERTS
A796: PRESTON | C796: HOLLIGAN 2 | G796: LANDELLS | J796: GILBERT | M796: LOVELACE
A798: RICHMOND | C798: 3 | D798: 4 | E798: =C798*6+D798 -> 22 | G798: 4 | H798: 10 | I798: =G798*6+H798 -> 34 | K798: 8 | L798: 18 | M798: =K798*6+L798 -> 66 | O798: 8 | P798: 23 | Q798: =O798*6+P798 -> 71 | S798: ESSENDON
A799: ESSENDON | C799: 0 | D799: 2 | E799: =C799*6+D799 -> 2 | G799: 1 | H799: 4 | I799: =G799*6+H799 -> 10 | K799: 2 | L799: 5 | M799: =K799*6+L799 -> 17 | O799: 4 | P799: 7 | Q799: =O799*6+P799 -> 31 | S799: ARMSTRONG
A800: BEST PLAYERS
A801: RICHMOND | C801: EDMONDS | F801: LANG | I801: SYKES | K801: GEGGIE | N801: HUTCHINSON | Q801: RUDDOCK
A802: ESSENDON | C802: CHEFFERS | F802: DARBY | I802: PAIN | K802: ORR | N802: DYSON
A803: GOALKICKERS
A804: RICHMOND | C804: HUTCHINSON 5 | G804: EDMONDS 2 | K804: FILDES
A805: ESSENDON | C805: DARBY 2 | F805: CHURCHMAN | J805: CHEFFERS
A807: ROUND 18 | D807: 8TH SEPTEMBER | J807: WEATHER | M807: SOUTH BREEZE
D808: 1ST QTR | H808: 2ND QTR | L808: 3RD QTR | P808: FINAL | S808: PLAYED AT
A809: FOOTSCRAY | C809: 0 | D809: 1 | E809: =C809*6+D809 -> 1 | G809: 1 | H809: 6 | I809: =G809*6+H809 -> 12 | K809: 6 | L809: 10 | M809: =K809*6+L809 -> 46 | O809: 9 | P809: 10 | Q809: =O809*6+P809 -> 64 | S809: FOOTSCRAY | Y809: LADDER | AB809: ROUND | AD809: 18
A810: WILLIAMSTOWN | C810: 0 | D810: 1 | E810: =C810*6+D810 -> 1 | G810: 1 | H810: 3 | I810: =G810*6+H810 -> 9 | K810: 2 | L810: 3 | M810: =K810*6+L810 -> 15 | O810: 5 | P810: 4 | Q810: =O810*6+P810 -> 34 | S810: UMPIRE
A811: BEST PLAYERS | S811: SOUTAR | W811: TEAM | X811: W | Y811: L | Z811: D | AA811: FOR | AB811: AGST | AC811: % | AD811: PTS
A812: FOOTSCRAY | C812: HEDLEY | F812: COTTON | H812: HUGHES | J812: THOMAS | M812: CLARKE | O812: JACKSON
A813: WILLIAMSTOWN | C813: McGUIRE | F813: JONES | H813: DICK | J813: McKENZIE | M813: ALLEY | O813: KENNEDY | W813: WEST MELBOURNE | X813: 14 | Y813: 3 | Z813: 1 | AA813: 1162 | AB813: 595 | AC813: 195.29411764705881 | AD813: 58
A814: GOALKICKERS | W814: RICHMOND | X814: 14 | Y814: 4 | Z814: 0 | AA814: 1135 | AB814: 693 | AC814: 163.78066378066379 | AD814: 56
A815: FOOTSCRAY | C815: COTTON 3 | F815: W McCARTHY 2 | J815: WAGNER | M815: BORTHWICK | P815: THOMAS | R815: HEDLEY | W815: NORTH MELBOURNE | X815: 13 | Y815: 5 | Z815: 0 | AA815: 853 | AB815: 624 | AC815: 136.69871794871796 | AD815: 52
A816: WILLIAMSTOWN | C816: McNEILAGE | F816: LAMBERT | I816: FLETCHER | L816: McGUIRE | O816: JONES | W816: FOOTSCRAY | X816: 12 | Y816: 5 | Z816: 1 | AA816: 916 | AB816: 644 | AC816: 142.2360248447205 | AD816: 50
A818: RICHMOND | C818: 2 | D818: 5 | E818: =C818*6+D818 -> 17 | G818: 9 | H818: 6 | I818: =G818*6+H818 -> 60 | K818: 12 | L818: 7 | M818: =K818*6+L818 -> 79 | O818: 15 | P818: 11 | Q818: =O818*6+P818 -> 101 | S818: RICHMOND | W818: WILLIAMSTOWN | X818: 12 | Y818: 6 | Z818: 0 | AA818: 1017 | AB818: 768 | AC818: 132.421875 | AD818: 48
A819: PRESTON | C819: 2 | D819: 1 | E819: =C819*6+D819 -> 13 | G819: 3 | H819: 2 | I819: =G819*6+H819 -> 20 | K819: 4 | L819: 5 | M819: =K819*6+L819 -> 29 | O819: 6 | P819: 8 | Q819: =O819*6+P819 -> 44 | S819: ASPINALL | W819: BRUNSWICK | X819: 6 | Y819: 12 | Z819: 0 | AA819: 705 | AB819: 947 | AC819: 74.445617740232308 | AD819: 24
A820: BEST PLAYERS | W820: PRAHRAN | X820: 6 | Y820: 12 | Z820: 0 | AA820: 726 | AB820: 1000 | AC820: 72.6 | AD820: 24
A821: RICHMOND | C821: LEACH | F821: EDWARDS | I821: MAHONEY | K821: HUTCHINSON | N821: O'KEEFE | P821: RUDDOCK | W821: PORT MELBOURNE | X821: 6 | Y821: 12 | Z821: 0 | AA821: 629 | AB821: 1068 | AC821: 58.895131086142321 | AD821: 24
A822: PRESTON | C822: WAWN | F822: OGDEN | I822: HOLLIGAN | K822: TORPEY | N822: S HALL | P822: GILBERT | W822: PRESTON | X822: 5 | Y822: 13 | Z822: 0 | AA822: 796 | AB822: 953 | AC822: 83.525708289611757 | AD822: 20
A823: GOALKICKERS | W823: ESSENDON | X823: 1 | Y823: 17 | Z823: 0 | AA823: 568 | AB823: 1245 | AC823: 45.622489959839356 | AD823: 4
A824: RICHMOND | C824: HUTCHINSON 6 | F824: MAHONEY 2 | I824: FAYLE 2 | K824: BOWDEN | M824: SYKES | O824: MEGSON | Q824: EDMONDS | T824: HILL
A825: PRESTON | C825: LANDELLS 3 | F825: TORPEY | I825: BARKER | K825: GILBERT
A827: PORT MELBOURNE | C827: 1 | D827: 2 | E827: =C827*6+D827 -> 8 | G827: 6 | H827: 3 | I827: =G827*6+H827 -> 39 | K827: 6 | L827: 7 | M827: =K827*6+L827 -> 43 | O827: 10 | P827: 12 | Q827: =O827*6+P827 -> 72 | S827: PORT MELB
A828: BRUNSWICK | C828: 2 | D828: 3 | E828: =C828*6+D828 -> 15 | G828: 6 | H828: 7 | I828: =G828*6+H828 -> 43 | K828: 8 | L828: 12 | M828: =K828*6+L828 -> 60 | O828: 9 | P828: 12 | Q828: =O828*6+P828 -> 66 | S828: KRUSE
A829: BEST PLAYERS
A830: PORT MELBOURNE | C830: PETTIT | F830: CURTIS | I830: AYLES | K830: McDONALD | N830: SULLIVAN | Q830: WARD
A831: BRUNSWICK | C831: WHITFIELD | F831: LEEDS | I831: BRAID | K831: BELCHER | N831: McNAMARA | Q831: JACKSON
A832: GOALKICKERS
A833: PORT MELBOURNE | C833: CROFT 2 | F833: CURTIS 2 | I833: McKENZIE | K833: HALL | M833: McEWAN
A834: BRUNSWICK | C834: SCOTT 3 | F834: S BALFE 2 | J834: TEMPLE | M834: McNAMARA | P834: W JACKSON
A836: NORTH MELBOURNE | C836: 6 | D836: 3 | E836: =C836*6+D836 -> 39 | G836: 7 | H836: 5 | I836: =G836*6+H836 -> 47 | K836: 9 | L836: 10 | M836: =K836*6+L836 -> 64 | O836: 11 | P836: 11 | Q836: =O836*6+P836 -> 77 | S836: NORTH MELB
A837: ESSENDON | C837: 0 | D837: 0 | E837: =C837*6+D837 -> 0 | G837: 1 | H837: 3 | I837: =G837*6+H837 -> 9 | K837: 3 | L837: 4 | M837: =K837*6+L837 -> 22 | O837: 4 | P837: 9 | Q837: =O837*6+P837 -> 33 | S837: PYMM
A838: BEST PLAYERS
A839: NORTH MELBOURNE | C839: SMITH | F839: BOYLE | I839: RAHILLY | L839: McVEIGH | O839: KEATING | R839: JAMIESON
A840: ESSENDON | C840: ORR | F840: DYSON | I840: CHEFFERS | L840: MONTGOMERY | O840: BENNETT | R840: BUSBRIDGE
A841: GOALKICKERS
A842: NORTH MELBOURNE | C842: HOLDEN 4 | F842: KENNY 4 | I842: LEWIS | K842: RAHILLY | N842: BROYLAN
A843: ESSENDON | C843: CHEFFERS | F843: H DARBY | I843: HIDDLESTON | M843: DYSON
A845: PRAHRAN | C845: 5 | D845: 2 | E845: =C845*6+D845 -> 32 | G845: 7 | H845: 3 | I845: =G845*6+H845 -> 45 | K845: 8 | L845: 13 | M845: =K845*6+L845 -> 61 | O845: 9 | P845: 17 | Q845: =O845*6+P845 -> 71 | S845: TOORAK PARK
A846: WEST MELBOURNE | C846: 4 | D846: 3 | E846: =C846*6+D846 -> 27 | G846: 7 | H846: 10 | I846: =G846*6+H846 -> 52 | K846: 9 | L846: 12 | M846: =K846*6+L846 -> 66 | O846: 9 | P846: 13 | Q846: =O846*6+P846 -> 67 | S846: ARMSTRONG
A847: BEST PLAYERS
A848: PRAHRAN | C848: DOWDING | F848: ALLAN | I848: SYKES | L848: LAZARUS | O848: LEWIS | R848: ROCHE
A849: WEST MELBOURNE | C849: ROURKE | F849: WILSON | I849: MADDEN | L849: ARMSTRONG | O849: LAXTON | R849: MINTO
A850: GOALKICKERS
A851: PRAHRAN | C851: SYKES 4 | F851: CARLSON 2
A852: WEST MELBOURNE | C852: RYAN 3 | F852: ARMSTRONG 3 | J852: McCANN 2
A854: FINALS
A855: 1ST SEMI | D855: 15TH SEPTEMBER | J855: WEATHER | M855: LIGHT SOUTH WEST BREEZE OVERCAST
D856: 1ST QTR | H856: 2ND QTR | L856: 3RD QTR | P856: FINAL | S856: PLAYED AT
A857: WEST MELBOURNE | C857: 1 | D857: 3 | E857: =C857*6+D857 -> 9 | G857: 6 | H857: 8 | I857: =G857*6+H857 -> 44 | K857: 6 | L857: 13 | M857: =K857*6+L857 -> 49 | O857: 9 | P857: 18 | Q857: =O857*6+P857 -> 72 | S857: EAST MELB
A858: NORTH MELBOURNE | C858: 1 | D858: 1 | E858: =C858*6+D858 -> 7 | G858: 1 | H858: 1 | I858: =G858*6+H858 -> 7 | K858: 4 | L858: 4 | M858: =K858*6+L858 -> 28 | O858: 4 | P858: 4 | Q858: =O858*6+P858 -> 28 | S858: UMPIRE
A859: BEST PLAYERS | S859: SOUTAR
A860: WEST MELBOURNE | C860: ROURKE | F860: RANKIN | I860: NEYLAN | L860: MCCART | O860: HARRISON | R860: H GREGORY
A861: NORTH MELBOURNE | C861: SMITH | F861: MARTIN | I861: MEAGHAN | L861: LINEHAN | O861: BARNES | R861: KEATING
A862: GOALKICKERS
A863: WEST MELBOURNE | C863: RYAN 3 | F863: ARMSTRONG 2 | J863: A GREGORY | M863: McCANN | P863: WILLIAMSON | S863: NEYLAN
A864: NORTH MELBOURNE | C864: MEAGHAN | F864: McCANN | I864: KENNY | K864: HOLDEN
A866: TEAMS
G867: WEST MELBOURNE | T867: NORTH MELBOURNE
A868: BACKS | D868: RANKIN | H868: DAWSON | L868: WILSON | R868: THORPE | V868: BARNES | X868: KEATING
A869: H-BACKS | D869: CULLEN | H869: MADDEN | L869: H GREGORY | R869: HOLLAND | V869: WATSON | X869: JAMIESON
A870: CENTRES | D870: LAXTON | H870: JOHNSON | L870: MINTO | R870: MARTIN | V870: BOYLE | X870: LEWIS
A871: H-FORWARDS | D871: NEYLAN | H871: RYAN | L871: HARRISON | R871: KENNY | V871: LINEHAN | X871: HOLDEN
A872: FORWARDS | D872: WILLIAMSON | H872: McCANN | L872: McCART | R872: MEAGHAN | V872: McCANN | X872: CARTER
A873: RUCKS | D873: ROURKE | H873: A GREGORY | L873: ARMSTRONG | R873: McVEIGH | V873: RAPP | X873: SMITH
A875: 2ND SEMI | E875: 22ND SEPTEMBER | J875: WEATHER | M875: NORTH WEST WIND LIGHT STEADY RAIN
A876: FOOTSCRAY | C876: 1 | D876: 2 | E876: =C876*6+D876 -> 8 | G876: 4 | H876: 5 | I876: =G876*6+H876 -> 29 | K876: 4 | L876: 6 | M876: =K876*6+L876 -> 30 | O876: 6 | P876: 14 | Q876: =O876*6+P876 -> 50 | S876: EAST MELB
A877: RICHMOND | C877: 2 | D877: 0 | E877: =C877*6+D877 -> 12 | G877: 2 | H877: 1 | I877: =G877*6+H877 -> 13 | K877: 5 | L877: 5 | M877: =K877*6+L877 -> 35 | O877: 6 | P877: 5 | Q877: =O877*6+P877 -> 41 | S877: SOUTAR
A878: BEST PLAYERS
A879: FOOTSCRAY | C879: HARRIS | F879: McCARTHY | I879: McKINLEY | L879: JACKSON | O879: HUGHES | R879: WAGNER
A880: RICHMOND | C880: MAHONEY | F880: SYKES | I880: GEGGIE | L880: CARKEEK | O880: LEACH | R880: HEANEY
A881: GOALKICKERS
A882: FOOTSCRAY | C882: WAGNER 2 | F882: GREENWOOD | J882: WILLIAMS | M882: HUGHES | P882: COTTON
A883: RICHMOND | C883: HUTCHINSON 3 | G883: MAHONEY | J883: HEANEY | M883: MEGSON
A885: TEAMS
G886: FOOTSCRAY | V886: RICHMOND
A887: BACKS | D887: GIBSON | H887: HARRIS | L887: McCOLL | R887: C WILLIAMS | V887: BOWNAS | X887: EDWARDS
A888: H-BACKS | D888: S McCARTHY | H888: MARMO | L888: McKENZIE | R888: RUDDOCK | V888: GEGGIE | X888: O'KEEFE
A889: CENTRES | D889: NEILSON | H889: CLARKE | L889: McKINLEY | R889: HILL | V889: SYKES | X889: MEGSON
A890: H-FORWARDS | D890: BORTHWICK | H890: JACOBSEN | L890: JACKSON | R890: CARKEEK | V890: HEANEY | X890: RIGBY
A891: FORWARDS | D891: WAGNER | H891: COTTON | L891: WILLIAMS | R891: EDMONDS | V891: HUTCHINSON | X891: FILDES
A892: RUCKS | D892: HEDLEY | H892: HUGHES | L892: GREENWOOD | R892: LANG | V892: LEACH | X892: MAHONEY
A894: FINAL | D894: 29TH SEPTEMBER | J894: WEATHER | M894: FINE LIGHT SOUTH WIND
D895: 1ST QTR | H895: 2ND QTR | L895: 3RD QTR | P895: FINAL | S895: PLAYED AT
A896: WEST MELBOURNE | C896: 0 | D896: 0 | E896: 0 | G896: 3 | H896: 4 | I896: 22 | K896: 4 | L896: 7 | M896: 31 | O896: 7 | P896: 8 | Q896: =O896*6+P896 -> 50 | S896: EAST MELB
A897: FOOTSCRAY | C897: 3 | D897: 2 | E897: 20 | G897: 3 | H897: 5 | I897: 23 | K897: 5 | L897: 8 | M897: 38 | O897: 5 | P897: 9 | Q897: =O897*6+P897 -> 39 | S897: UMPIRE
A898: BEST PLAYERS | S898: SOUTAR
A899: WEST MELBOURNE | C899: ARMSTRONG | F899: A GREGORY | J899: ROURKE | M899: LAXTON | P899: H GREGORY | S899: WILLIAMSON
A900: FOOTSCRAY | C900: HEDLEY | F900: STEPHENSON | J900: HARRIS | M900: CLARKE | P900: JACOBSEN | S900: HUGHES
A901: GOALKICKERS
A902: WEST MELBOURNE | C902: WILLIAMSON (3) | G902: ARMSTRONG (2) | K902: McCANN (2)
A903: FOOTSCRAY | C903: JACOBSEN (2) | G903: HEDLEY | I903: McCARTHY | L903: HUGHES
A905: TEAMS
H906: WEST MELBOURNE
A907: BACKS | D907: RANKIN | H907: LIVINGSTONE | L907: AITKEN
A908: H-BACKS | D908: CULLEN | H908: MADDEN | L908: H GREGORY
A909: CENTRES | D909: LAXTON | H909: JOHNSON | L909: MINTO
A910: H-FORWARDS | D910: NEYLAN | H910: RYAN | L910: HARRISON
A911: FORWARDS | D911: WILLIAMSON | H911: McCANN | L911: McCART
A912: RUCKS | D912: ROURKE | H912: A GREGORY | L912: ARMSTRONG
A914: INTERSTATE MATCH | F914: 11TH AUGUST | J914: WEATHER | M914: SOUTH WIND SHOWERS
A915: V. F. A. | C915: 6 | D915: 11 | E915: =C915*6+D915 -> 47 | G915: 9 | H915: 13 | I915: =G915*6+H915 -> 67 | K915: 13 | L915: 18 | M915: =K915*6+L915 -> 96 | O915: 14 | P915: 19 | Q915: =O915*6+P915 -> 103
A916: S. A. | C916: 0 | D916: 1 | E916: =C916*6+D916 -> 1 | G916: 4 | H916: 3 | I916: =G916*6+H916 -> 27 | K916: 6 | L916: 4 | M916: =K916*6+L916 -> 40 | O916: 13 | P916: 9 | Q916: =O916*6+P916 -> 87 | S916: SOUTAR
A917: BEST PLAYERS
A918: V. F. A. | C918: CHASE | F918: HARRIS | I918: GEGGIE | L918: GREGORY | O918: JONES | R918: MATTHEWS
A919: S. A. | C919: JESSOP | F919: WAYE | I919: ALDERSEY | L919: LINLY | O919: CARTER | R919: MATHIESON
A920: GOALKICKERS
A921: V. F. A. | C921: MATTHEWS (4) | G921: JONES (3) | J921: HUTCHINSON (2) | N921: ARMSTRONG (2) | R921: HAIGHBLOOM (2) | V921: HEDLEY
A922: S. A. | C922: MATHIESON (4) | G922: TREDREA (3) | J922: EDGAR (3) | M922: LEAHY | P922: JESSOP
A924: TEAMS
I925: V.F.A. | X925: S.A.
A926: BACKS | C926: WARD (P.M.) | I926: HARRIS (FOOTS) | O926: KENNETT (B'WICK) | V926: CAMERON | X926: DEMPSTER | AB926: CARTER
A927: H-BACKS | C927: CHEFFERS (ESS) | I927: GEGGIE (RICH) | O927: OGDEN (P'TON) | V927: BARR | X927: FLETCHER | AB927: SMITH
A928: CENTRES | C928: ALLAN (P'HAN) | I928: CHASE (B'WICK) | O928: NEYLAN (W.M.) | V928: ANGWIN | X928: WINDSOR | AB928: ALDERSEY
A929: H-FORWARDS | C929: JONES (W'TOWN) | I929: HUTCHINSON (RICH) | O929: SMITH (N.M.) | V929: JESSOP | X929: WAYE | AB929: EDGAR
A930: FORWARDS | C930: HAIGHBLOOM (P'HAN) | I930: MATTHEWS (W'TOWN) | O930: DUFF (ESS) | V930: PASH | X930: MATHIESON | AB930: LEAHY
A931: RUCKS | C931: HEDLEY (FOOTS) | I931: A GREGORY (W.M.) | O931: ARMSTRONG (W.M.) | V931: DAVIS | X931: TREDREA | AB931: STRAWNS