A1: Victorian Football Association
A2: Season 1907
A3: © Copyright Wal Williams | F3: First created: 2 August 2014
A4: Contact: joywalwi at gmail dot com | F4: Last updated: 30 July 2017 | W4: VFA Results and tables - Link to the main index page
A5: You are free to copy this document in whole or part provided that proper acknowledgement is given to the author. All rights reserved.
A7: YEAR 1907
A8: ROUND 1 | E8: 4TH MAY | J8: WEATHER | N8: RAIN | S8: PLAYED AT | Y8: LADDER | AC8: ROUND | AD8: 1
D9: 1ST QTR | H9: 2ND QTR | L9: 3RD QTR | P9: FINAL | S9: BRUNSWICK
A10: PORT MELBOURNE | C10: 2 | D10: 2 | E10: =C10*6+D10 -> 14 | G10: 6 | H10: 4 | I10: =G10*6+H10 -> 40 | K10: 8 | L10: 8 | M10: =K10*6+L10 -> 56 | O10: 10 | P10: 11 | Q10: =O10*6+P10 -> 71 | S10: UMPIRE | W10: TEAM | X10: W | Y10: L | Z10: D | AA10: FOR | AB10: AGST | AC10: % | AD10: PTS
A11: BRUNSWICK | C11: 0 | D11: 2 | E11: =C11*6+D11 -> 2 | G11: 2 | H11: 2 | I11: =G11*6+H11 -> 14 | K11: 4 | L11: 7 | M11: =K11*6+L11 -> 31 | O11: 7 | P11: 10 | Q11: =O11*6+P11 -> 52 | S11: McKENRY
A12: BEST PLAYERS | W12: RICHMOND | X12: 1 | Y12: 0 | Z12: 0 | AA12: 107 | AB12: 30 | AC12: 356.66666666666669 | AD12: 4
A13: PORT MELBOURNE | C13: McGEE | F13: KNOX | I13: HUESKER | L13: CURTIS | O13: TREGLOWN | R13: J GARBUTT | W13: WILLIAMSTOWN | X13: 1 | Y13: 0 | Z13: 0 | AA13: 45 | AB13: 25 | AC13: 180 | AD13: 4
A14: BRUNSWICK | C14: H BRAID | F14: MORRISON | I14: R BALFE | L14: S BALFE | O14: DORIAN | R14: CHASE | W14: ESSENDON TOWN | X14: 1 | Y14: 0 | Z14: 0 | AA14: 60 | AB14: 36 | AC14: 166.66666666666666 | AD14: 4
A15: GOALKICKERS | W15: WEST MELBOURNE | X15: 1 | Y15: 0 | Z15: 0 | AA15: 71 | AB15: 44 | AC15: 161.36363636363637 | AD15: 4
A16: PORT MELBOURNE | C16: BRERETON 4 | G16: McGEE 2 | I16: CURTIS | K16: FRANKLIN | N16: PASH | P16: CROFT
A17: BRUNSWICK | C17: CLEMENTS 3 | G17: LEEDS | I17: H BRAID | K17: DORIAN | N17: S BALFE | W17: PORT MELBOURNE | X17: 1 | Y17: 0 | Z17: 0 | AA17: 71 | AB17: 52 | AC17: 136.53846153846155 | AD17: 4
W18: BRUNSWICK | X18: 0 | Y18: 1 | Z18: 0 | AA18: 52 | AB18: 71 | AC18: 73.239436619718305 | AD18: 0
A19: RICHMOND | C19: 3 | D19: 2 | E19: =C19*6+D19 -> 20 | G19: 8 | H19: 10 | I19: =G19*6+H19 -> 58 | K19: 12 | L19: 11 | M19: =K19*6+L19 -> 83 | O19: 14 | P19: 23 | Q19: =O19*6+P19 -> 107 | S19: RICHMOND | W19: PRAHRAN | X19: 0 | Y19: 1 | Z19: 0 | AA19: 44 | AB19: 71 | AC19: 61.971830985915496 | AD19: 0
A20: PRESTON | C20: 1 | D20: 2 | E20: =C20*6+D20 -> 8 | G20: 1 | H20: 4 | I20: =G20*6+H20 -> 10 | K20: 3 | L20: 4 | M20: =K20*6+L20 -> 22 | O20: 4 | P20: 6 | Q20: =O20*6+P20 -> 30 | S20: KRUSE | W20: NORTH MELBOURNE | X20: 0 | Y20: 1 | Z20: 0 | AA20: 36 | AB20: 60 | AC20: 60 | AD20: 0
A21: BEST PLAYERS | W21: FOOTSCRAY | X21: 0 | Y21: 1 | Z21: 0 | AA21: 25 | AB21: 45 | AC21: 55.555555555555557 | AD21: 0
A22: RICHMOND | C22: BENNION | F22: HARDIMAN | I22: BOWDEN | L22: LANG | O22: BROWN | Q22: BECK | W22: PRESTON | X22: 0 | Y22: 1 | Z22: 0 | AA22: 30 | AB22: 107 | AC22: 28.037383177570092 | AD22: 0
A23: PRESTON | C23: S HALL | F23: LOVELACE | I23: TOMKINS | L23: E YEOMANS | O23: OGDEN | Q23: HARRINGTON
A24: GOALKICKERS
A25: RICHMOND | C25: HUTCHINSON 6 | G25: BOWDEN 2 | J25: GIBSON 2 | M25: BECK | O25: EDMONDS | Q25: LANG | S25: MAHONEY
A26: PRESTON | C26: PEARMAN | F26: LOVELACE | I26: TOMKINS | L26: OGDEN
A28: WEST MELBOURNE | C28: 2 | D28: 2 | E28: =C28*6+D28 -> 14 | G28: 4 | H28: 6 | I28: =G28*6+H28 -> 30 | K28: 8 | L28: 9 | M28: =K28*6+L28 -> 57 | O28: 10 | P28: 11 | Q28: =O28*6+P28 -> 71 | S28: EAST MELB
A29: PRAHRAN | C29: 2 | D29: 4 | E29: =C29*6+D29 -> 16 | G29: 2 | H29: 5 | I29: =G29*6+H29 -> 17 | K29: 4 | L29: 7 | M29: =K29*6+L29 -> 31 | O29: 6 | P29: 8 | Q29: =O29*6+P29 -> 44 | S29: SCHUNKE
A30: BEST PLAYERS
A31: WEST MELBOURNE | C31: JENKINS | F31: CROSS | I31: HAYSOM | K31: A GREGORY | N31: ARMSTRONG | Q31: JOHNSON
A32: PRAHRAN | C32: ROBERTS | F32: CARDEN | I32: JOHNSON | K32: TREVILLIAN | N32: DOWDING | Q32: SYKES
A33: GOALKICKERS
A34: WEST MELBOURNE | C34: ARMSTRONG 3 | G34: RYAN 3 | J34: HAYSOM 2 | M34: ROURKE | O34: CROSS
A35: PRAHRAN | C35: ROBERTS 5 | G35: HAIGHBLOOM
A37: WILLIAMSTOWN | C37: 2 | D37: 1 | E37: =C37*6+D37 -> 13 | G37: 3 | H37: 1 | I37: =G37*6+H37 -> 19 | K37: 5 | L37: 2 | M37: =K37*6+L37 -> 32 | O37: 7 | P37: 3 | Q37: =O37*6+P37 -> 45 | S37: FOOTSCRAY
A38: FOOTSCRAY | C38: 0 | D38: 1 | E38: =C38*6+D38 -> 1 | G38: 0 | H38: 4 | I38: =G38*6+H38 -> 4 | K38: 1 | L38: 5 | M38: =K38*6+L38 -> 11 | O38: 3 | P38: 7 | Q38: =O38*6+P38 -> 25 | S38: KENDALL
A39: BEST PLAYERS
A40: WILLIAMSTOWN | C40: P NOONAN | F40: GIBBS | I40: JONES | K40: ALLEY | N40: J CALDWELL | Q40: HALL
A41: FOOTSCRAY | C41: SMITH | F41: McCARTHY | I41: McKINLEY | K41: HEDLEY | N41: HUGHES | Q41: HARRIS
A42: GOALKICKERS
A43: WILLIAMSTOWN | C43: J CALDWELL 3 | G43: M OUTEN | J43: JONES | L43: MONAR | O43: BLISS
A44: FOOTSCRAY | C44: PANNELL | F44: COTTON | I44: GLENISTER
A46: ESSENDON TOWN | C46: 3 | D46: 0 | E46: =C46*6+D46 -> 18 | G46: 5 | H46: 5 | I46: =G46*6+H46 -> 35 | K46: 7 | L46: 8 | M46: =K46*6+L46 -> 50 | O46: 8 | P46: 12 | Q46: =O46*6+P46 -> 60 | S46: NORTH MELB
A47: NORTH MELBOURNE | C47: 4 | D47: 3 | E47: =C47*6+D47 -> 27 | G47: 4 | H47: 4 | I47: =G47*6+H47 -> 28 | K47: 5 | L47: 6 | M47: =K47*6+L47 -> 36 | O47: 5 | P47: 6 | Q47: =O47*6+P47 -> 36 | S47: LANE
A48: BEST PLAYERS
A49: ESSENDON TOWN | C49: M MADDEN | F49: J WRIGHT | I49: McINTYRE | L49: DYSON | O49: DUFF | Q49: JACOBS
A50: NORTH MELBOURNE | C50: T WATSON | F50: BRANKIN | I50: McKENZIE | L50: McCANN | O50: MORAN | Q50: CARTER
A51: GOALKICKERS
A52: ESSENDON TOWN | C52: F DARBY 5 | G52: PAIN 2 | J52: P WILLIAMS
A53: NORTH MELBOURNE | C53: GROVES 2 | F53: MORAN | H53: KENNEDY | K53: CARTER
A55: ROUND 2 | E55: 11TH MAY | J55: WEATHER | N55: SOUTH BREEZE | S55: PLAYED AT | Y55: LADDER | AB55: ROUND | AD55: 2
D56: 1ST QTR | H56: 2ND QTR | L56: 3RD QTR | P56: FINAL | S56: ESSENDON
A57: ESSENDON TOWN | C57: 3 | D57: 0 | E57: =C57*6+D57 -> 18 | G57: 7 | H57: 3 | I57: =G57*6+H57 -> 45 | K57: 8 | L57: 3 | M57: =K57*6+L57 -> 51 | O57: 12 | P57: 6 | Q57: =O57*6+P57 -> 78 | S57: UMPIRE | W57: TEAM | X57: W | Y57: L | Z57: D | AA57: FOR | AB57: AGST | AC57: % | AD57: PTS
A58: RICHMOND | C58: 5 | D58: 3 | E58: =C58*6+D58 -> 33 | G58: 5 | H58: 6 | I58: =G58*6+H58 -> 36 | K58: 8 | L58: 8 | M58: =K58*6+L58 -> 56 | O58: 8 | P58: 13 | Q58: =O58*6+P58 -> 61 | S58: KENDALL
A59: BEST PLAYERS | W59: WEST MELBOURNE | X59: 2 | Y59: 0 | Z59: 0 | AA59: 169 | AB59: 55 | AC59: 307.27272727272725 | AD59: 8
A60: ESSENDON TOWN | C60: TROTTER | F60: M MADDEN | I60: J WRIGHT | L60: McKENZIE | O60: GOSLING | R60: MUNDAY | W60: WILLIAMSTOWN | X60: 2 | Y60: 0 | Z60: 0 | AA60: 80 | AB60: 51 | AC60: 156.86274509803923 | AD60: 8
A61: RICHMOND | C61: O'KEEFE | F61: BECK | I61: McDONALD | L61: HILL | O61: HEANEY | R61: MEGSON | W61: PORT MELBOURNE | X61: 2 | Y61: 0 | Z61: 0 | AA61: 103 | AB61: 70 | AC61: 147.14285714285714 | AD61: 8
A62: GOALKICKERS | W62: ESSENDON TOWN | X62: 2 | Y62: 0 | Z62: 0 | AA62: 138 | AB62: 97 | AC62: 142.26804123711341 | AD62: 8
A63: ESSENDON TOWN | C63: TROTTER 6 | G63: BARKER 2 | J63: F DARBY | L63: DUFF | N63: WILLIAMS | Q63: H DARBY
A64: RICHMOND | C64: HUTCHINSON 2 | G64: HARDIMAN 2 | K64: MAHONEY | N64: CARKEEK | P64: HEANEY | R64: MEGSON | W64: PRAHRAN | X64: 1 | Y64: 1 | Z64: 0 | AA64: 165 | AB64: 96 | AC64: 171.875 | AD64: 4
W65: RICHMOND | X65: 1 | Y65: 1 | Z65: 0 | AA65: 168 | AB65: 108 | AC65: 155.55555555555554 | AD65: 4
A66: WEST MELBOURNE | C66: 2 | D66: 4 | E66: =C66*6+D66 -> 16 | G66: 4 | H66: 7 | I66: =G66*6+H66 -> 31 | K66: 10 | L66: 10 | M66: =K66*6+L66 -> 70 | O66: 14 | P66: 14 | Q66: =O66*6+P66 -> 98 | S66: EAST MELB | W66: NORTH MELBOURNE | X66: 0 | Y66: 2 | Z66: 0 | AA66: 62 | AB66: 95 | AC66: 65.263157894736835 | AD66: 0
A67: BRUNSWICK | C67: 0 | D67: 1 | E67: =C67*6+D67 -> 1 | G67: 0 | H67: 3 | I67: =G67*6+H67 -> 3 | K67: 0 | L67: 4 | M67: =K67*6+L67 -> 4 | O67: 1 | P67: 5 | Q67: =O67*6+P67 -> 11 | S67: LANE | W67: FOOTSCRAY | X67: 0 | Y67: 2 | Z67: 0 | AA67: 43 | AB67: 77 | AC67: 55.844155844155843 | AD67: 0
A68: BEST PLAYERS | W68: BRUNSWICK | X68: 0 | Y68: 2 | Z68: 0 | AA68: 63 | AB68: 169 | AC68: 37.278106508875737 | AD68: 0
A69: WEST MELBOURNE | C69: P WILLIAMSON | G69: JOHNSON | J69: ARMSTRONG | M69: RYAN | O69: HAYSOM | R69: H GREGORY
A70: BRUNSWICK | C70: CHASE | G70: DEVLIN | J70: H BRAID | M70: SCOTT | O70: TAME | R70: MORRISON
A71: GOALKICKERS
A72: WEST MELBOURNE | C72: RYAN 3 | F72: HAYSOM 3 | I72: ARMSTRONG 2 | L72: A GREGORY 2 | O72: P WILLIAMSON | S72: MCDONALD | W72: BULLEN
A73: BRUNSWICK | C73: SCOTT
A75: PRAHRAN | C75: 3 | D75: 3 | E75: =C75*6+D75 -> 21 | G75: 9 | H75: 6 | I75: =G75*6+H75 -> 60 | K75: 13 | L75: 10 | M75: =K75*6+L75 -> 88 | O75: 18 | P75: 13 | Q75: =O75*6+P75 -> 121 | S75: PRESTON
A76: PRESTON | C76: 1 | D76: 0 | E76: =C76*6+D76 -> 6 | G76: 2 | H76: 2 | I76: =G76*6+H76 -> 14 | K76: 2 | L76: 4 | M76: =K76*6+L76 -> 16 | O76: 3 | P76: 7 | Q76: =O76*6+P76 -> 25 | S76: KRUSE
A77: BEST PLAYERS
A78: PRAHRAN | C78: WOODS | F78: TREVILLIAN | J78: A FERGUSON | M78: SYKES | O78: BOYLAND | R78: W CARLSON
A79: PRESTON | C79: OGDEN | F79: S HALL | J79: TOMKINS | M79: KNELL | O79: BROWN | R79: WAWN
A80: GOALKICKERS
A81: PRAHRAN | C81: WOODS 6 | F81: SYKES 6 | I81: ROBERTS 2 | L81: W CARLSON 2 | P81: BOYLAND
A82: PRESTON | C82: WAWN | F82: LANDELLS | I82: TOMKINS
A84: PORT MELBOURNE | C84: 2 | D84: 1 | E84: =C84*6+D84 -> 13 | G84: 2 | H84: 3 | I84: =G84*6+H84 -> 15 | K84: 2 | L84: 4 | M84: =K84*6+L84 -> 16 | O84: 4 | P84: 8 | Q84: =O84*6+P84 -> 32 | S84: PORT MELB
A85: FOOTSCRAY | C85: 0 | D85: 2 | E85: =C85*6+D85 -> 2 | G85: 0 | H85: 2 | I85: =G85*6+H85 -> 2 | K85: 0 | L85: 11 | M85: =K85*6+L85 -> 11 | O85: 1 | P85: 12 | Q85: =O85*6+P85 -> 18 | S85: SOUTAR
A86: BEST PLAYERS
A87: PORT MELBOURNE | C87: TREGLOWN | G87: PAMPERIN | J87: McGOWAN | M87: GARBUTT | P87: HUESKER | S87: BRERETON
A88: FOOTSCRAY | C88: HARRIS | G88: McKINLEY | J88: HUGHES | M88: WILLIAMS | P88: McCARTHY | S88: COTTON
A89: GOALKICKERS
A90: PORT MELBOURNE | C90: PASH 2 | F90: BRERETON | I90: PAMPERIN
A91: FOOTSCRAY | C91: COTTON
A93: WILLIAMSTOWN | C93: 1 | D93: 4 | E93: =C93*6+D93 -> 10 | G93: 2 | H93: 6 | I93: =G93*6+H93 -> 18 | K93: 4 | L93: 11 | M93: =K93*6+L93 -> 35 | O93: 4 | P93: 11 | Q93: =O93*6+P93 -> 35 | S93: WILLIAMSTOWN
A94: NORTH MELBOURNE | C94: 0 | D94: 1 | E94: =C94*6+D94 -> 1 | G94: 2 | H94: 5 | I94: =G94*6+H94 -> 17 | K94: 2 | L94: 5 | M94: =K94*6+L94 -> 17 | O94: 3 | P94: 8 | Q94: =O94*6+P94 -> 26 | S94: CRANSTON
A95: BEST PLAYERS
A96: WILLIAMSTOWN | C96: W JONES | F96: PILKINGTON | J96: LAMBERT | M96: BLISS | O96: MONAR | R96: ADDISON
A97: NORTH MELBOURNE | C97: LITTLE | F97: JAMIESON | J97: McVEIGH | M97: CARTER | O97: LINEHAN | R97: KEATING
A98: GOALKICKERS
A99: WILLIAMSTOWN | C99: W JONES 2 | G99: LAMBERT 2
A100: NORTH MELBOURNE | C100: HOLDEN 2 | G100: CARTER
A102: ROUND 3 | E102: 18TH MAY | J102: WEATHER | M102: FINE NORTH WIND
D103: 1ST QTR | H103: 2ND QTR | L103: 3RD QTR | P103: FINAL | S103: PLAYED AT | X103: LADDER | AB103: ROUND | AD103: 3
A104: WEST MELBOURNE | C104: 3 | D104: 5 | E104: =C104*6+D104 -> 23 | G104: 3 | H104: 9 | I104: =G104*6+H104 -> 27 | K104: 4 | L104: 11 | M104: =K104*6+L104 -> 35 | O104: 8 | P104: 12 | Q104: =O104*6+P104 -> 60 | S104: PORT MELB
A105: PORT MELBOURNE | C105: 0 | D105: 0 | E105: =C105*6+D105 -> 0 | G105: 2 | H105: 1 | I105: =G105*6+H105 -> 13 | K105: 2 | L105: 3 | M105: =K105*6+L105 -> 15 | O105: 3 | P105: 6 | Q105: =O105*6+P105 -> 24 | S105: UMPIRE | W105: TEAM | X105: W | Y105: L | Z105: D | AA105: FOR | AB105: AGST | AC105: % | AD105: PTS
A106: BEST PLAYERS | S106: SOUTAR
A107: WEST MELBOURNE | C107: McCANN | F107: P WILLIAMSON | J107: A GREGORY | M107: H GREGORY | P107: ROURKE | S107: MADDEN | W107: WEST MELBOURNE | X107: 3 | Y107: 0 | Z107: 0 | AA107: 229 | AB107: 79 | AC107: 289.87341772151899 | AD107: 12
A108: PORT MELBOURNE | C108: WARD | F108: HUESKER | J108: WEATE | M108: COEN | P108: KNOX | S108: McGOWAN | W108: WILLIAMSTOWN | X108: 3 | Y108: 0 | Z108: 0 | AA108: 141 | AB108: 78 | AC108: 180.76923076923077 | AD108: 12
A109: GOALKICKERS | W109: ESSENDON TOWN | X109: 3 | Y109: 0 | Z109: 0 | AA109: 188 | AB109: 142 | AC109: 132.3943661971831 | AD109: 12
A110: WEST MELBOURNE | C110: McCANN 4 | G110: CLARKE 2 | K110: RYAN 2 | W110: PORT MELBOURNE | X110: 2 | Y110: 1 | Z110: 0 | AA110: 127 | AB110: 130 | AC110: 97.692307692307693 | AD110: 8
A111: PORT MELBOURNE | C111: BRERETON | G111: PAMPERIN | K111: PASH
W112: PRAHRAN | X112: 1 | Y112: 2 | Z112: 0 | AA112: 210 | AB112: 146 | AC112: 143.83561643835617 | AD112: 4
A113: ESSENDON TOWN | C113: 2 | D113: 2 | E113: =C113*6+D113 -> 14 | G113: 3 | H113: 2 | I113: =G113*6+H113 -> 20 | K113: 4 | L113: 4 | M113: =K113*6+L113 -> 28 | O113: 7 | P113: 8 | Q113: =O113*6+P113 -> 50 | S113: TOORAK PARK | W113: RICHMOND | X113: 1 | Y113: 2 | Z113: 0 | AA113: 195 | AB113: 169 | AC113: 115.38461538461539 | AD113: 4
A114: PRAHRAN | C114: 3 | D114: 1 | E114: =C114*6+D114 -> 19 | G114: 4 | H114: 5 | I114: =G114*6+H114 -> 29 | K114: 5 | L114: 8 | M114: =K114*6+L114 -> 38 | O114: 6 | P114: 9 | Q114: =O114*6+P114 -> 45 | S114: SCHUNKE | W114: FOOTSCRAY | X114: 1 | Y114: 2 | Z114: 0 | AA114: 105 | AB114: 107 | AC114: 98.130841121495322 | AD114: 4
A115: BEST PLAYERS | W115: BRUNSWICK | X115: 1 | Y115: 2 | Z115: 0 | AA115: 168 | AB115: 190 | AC115: 88.421052631578945 | AD115: 4
A116: ESSENDON TOWN | C116: M MADDEN | F116: GOSLING | J116: OAKLEY | M116: DUFF | P116: McKENZIE | S116: BARKER | W116: NORTH MELBOURNE | X116: 0 | Y116: 3 | Z116: 0 | AA116: 92 | AB116: 157 | AC116: 58.598726114649679 | AD116: 0
A117: PRAHRAN | C117: ROACH | F117: A FERGUSON | J117: DOWDING | M117: BUIST | P117: SYKES | S117: ROBERTS | W117: PRESTON | X117: 0 | Y117: 3 | Z117: 0 | AA117: 76 | AB117: 333 | AC117: 22.822822822822822 | AD117: 0
A118: GOALKICKERS
A119: ESSENDON TOWN | C119: OAKLEY 2 | F119: TROTTER | I119: HAMBRIDGE | L119: McKENZIE | O119: DUFF
A120: PRAHRAN | C120: SYKES | F120: JOHNSON | I120: A FERGUSON | L120: WOODS | N120: HAIGHBLOOM | Q120: DOWDING
A122: WILLIAMSTOWN | C122: 3 | D122: 4 | E122: =C122*6+D122 -> 22 | G122: 3 | H122: 4 | I122: =G122*6+H122 -> 22 | K122: 5 | L122: 11 | M122: =K122*6+L122 -> 41 | O122: 8 | P122: 13 | Q122: =O122*6+P122 -> 61 | S122: WILLIAMSTOWN
A123: RICHMOND | C123: 1 | D123: 2 | E123: =C123*6+D123 -> 8 | G123: 1 | H123: 7 | I123: =G123*6+H123 -> 13 | K123: 2 | L123: 7 | M123: =K123*6+L123 -> 19 | O123: 3 | P123: 9 | Q123: =O123*6+P123 -> 27 | S123: McKENDY
A124: BEST PLAYERS
A125: WILLIAMSTOWN | C125: JONES | F125: PILKINGTON | J125: M OUTEN | M125: BLISS | O125: ALLEY | R125: GIBBS
A126: RICHMOND | C126: HARDIMAN | F126: BENNION | J126: GIBSON | M126: McDONALD | O126: MEGSON | R126: O'KEEFE
A127: GOALKICKERS
A128: WILLIAMSTOWN | C128: GARBUTT 2 | F128: MONAR | H128: ADDISON | K128: LAMBERT | N128: BLISS | P128: GIBBS
A129: RICHMOND | C129: GIBSON 2 | G129: HUTCHINSON
A131: FOOTSCRAY | C131: 1 | D131: 3 | E131: =C131*6+D131 -> 9 | G131: 2 | H131: 9 | I131: =G131*6+H131 -> 21 | K131: 4 | L131: 11 | M131: =K131*6+L131 -> 35 | O131: 8 | P131: 14 | Q131: =O131*6+P131 -> 62 | S131: NORTH MELB
A132: NORTH MELBOURNE | C132: 1 | D132: 2 | E132: =C132*6+D132 -> 8 | G132: 2 | H132: 2 | I132: =G132*6+H132 -> 14 | K132: 4 | L132: 5 | M132: =K132*6+L132 -> 29 | O132: 4 | P132: 6 | Q132: =O132*6+P132 -> 30 | S132: KENDALL
A133: BEST PLAYERS
A134: FOOTSCRAY | C134: JOHNSON | F134: McKINLEY | I134: HUGHES | L134: COTTON | O134: SEVIOR | R134: CLARKE
A135: NORTH MELBOURNE | C135: LITTLE | F135: McCANN | I135: McVEIGH | L135: CARTER | O135: KENNEDY | R135: McKENZIE
A136: GOALKICKERS
A137: FOOTSCRAY | C137: GREENWOOD 3 | G137: GLENISTER 2 | K137: SMITH | N137: CLARKE | P137: SEVIOR
A138: NORTH MELBOURNE | C138: LITTLE 2 | G138: HOLDEN 2
A140: BRUNSWICK | C140: 7 | D140: 4 | E140: =C140*6+D140 -> 46 | G140: 7 | H140: 4 | I140: =G140*6+H140 -> 46 | K140: 13 | L140: 6 | M140: =K140*6+L140 -> 84 | O140: 16 | P140: 9 | Q140: =O140*6+P140 -> 105 | S140: BRUNSWICK
A141: PRESTON | C141: 0 | D141: 1 | E141: =C141*6+D141 -> 1 | G141: 1 | H141: 5 | I141: =G141*6+H141 -> 11 | K141: 1 | L141: 5 | M141: =K141*6+L141 -> 11 | O141: 2 | P141: 9 | Q141: =O141*6+P141 -> 21 | S141: LANE
A142: BEST PLAYERS
A143: BRUNSWICK | C143: H BRAID | G143: CHASE | J143: S BALFE | M143: CLEMENTS | P143: R BALFE | S143: LEEDS
A144: PRESTON | C144: OGDEN | G144: TOMKINS | J144: S HALL | M144: PEARMAN | P144: S YEOMANS | S144: GILBERT
A145: GOALKICKERS
A146: BRUNSWICK | C146: CHASE 4 | F146: CLEMENTS 3 | I146: SERGEANT 3 | L146: GRAHAM 3 | O146: LEEDS 2 | R146: R BALFE
A147: PRESTON | C147: OGDEN 2
A149: ROUND 4 | E149: 25TH MAY | J149: WEATHER | M149: FINE
D150: 1ST QTR | H150: 2ND QTR | L150: 3RD QTR | P150: FINAL | S150: PLAYED AT | X150: LADDER | AA150: ROUND | AC150: 4
A151: PORT MELBOURNE | C151: 3 | D151: 3 | E151: =C151*6+D151 -> 21 | G151: 4 | H151: 5 | I151: =G151*6+H151 -> 29 | K151: 6 | L151: 6 | M151: =K151*6+L151 -> 42 | O151: 10 | P151: 11 | Q151: =O151*6+P151 -> 71 | S151: TOORAK PARK
A152: PRAHRAN | C152: 2 | D152: 4 | E152: =C152*6+D152 -> 16 | G152: 6 | H152: 7 | I152: =G152*6+H152 -> 43 | K152: 8 | L152: 12 | M152: =K152*6+L152 -> 60 | O152: 9 | P152: 13 | Q152: =O152*6+P152 -> 67 | S152: UMPIRE | W152: TEAM | X152: W | Y152: L | Z152: D | AA152: FOR | AB152: AGST | AC152: % | AD152: PTS
A153: BEST PLAYERS | S153: NORDEN
A154: PORT MELBOURNE | C154: CROFT | F154: McGEE | I154: TREGLOWN | L154: HUESKER | O154: WARD | R154: COEN | W154: WEST MELBOURNE | X154: 4 | Y154: 0 | Z154: 0 | AA154: 280 | AB154: 123 | AC154: 227.64227642276424 | AD154: 16
A155: PRAHRAN | C155: A FERGUSON | F155: SCOTT | I155: W CARLSON | L155: CARMODY | O155: WOODS | R155: ROACH | W155: WILLIAMSTOWN | X155: 4 | Y155: 0 | Z155: 0 | AA155: 227 | AB155: 108 | AC155: 210.18518518518519 | AD155: 16
A156: GOALKICKERS | W156: ESSENDON TOWN | X156: 3 | Y156: 1 | Z156: 0 | AA156: 240 | AB156: 195 | AC156: 123.07692307692308 | AD156: 12
A157: PORT MELBOURNE | C157: BRERETON 5 | G157: CROFT 2 | J157: FRASER | M157: MCGEE | O157: PASH | W157: PORT MELBOURNE | X157: 3 | Y157: 1 | Z157: 0 | AA157: 198 | AB157: 197 | AC157: 100.50761421319797 | AD157: 12
A158: PRAHRAN | C158: SYKES 3 | F158: DOWDING 2 | I158: WOODS 2 | L158: ROBERTS | O158: WATTS
W159: RICHMOND | X159: 2 | Y159: 2 | Z159: 0 | AA159: 247 | AB159: 206 | AC159: 119.90291262135922 | AD159: 8
A160: FOOTSCRAY | C160: 0 | D160: 1 | E160: =C160*6+D160 -> 1 | G160: 3 | H160: 2 | I160: =G160*6+H160 -> 20 | K160: 5 | L160: 4 | M160: =K160*6+L160 -> 34 | O160: 8 | P160: 5 | Q160: =O160*6+P160 -> 53 | S160: FOOTSCRAY | W160: FOOTSCRAY | X160: 2 | Y160: 2 | Z160: 0 | AA160: 158 | AB160: 159 | AC160: 99.371069182389931 | AD160: 8
A161: ESSENDON TOWN | C161: 2 | D161: 0 | E161: =C161*6+D161 -> 12 | G161: 3 | H161: 1 | I161: =G161*6+H161 -> 19 | K161: 5 | L161: 3 | M161: =K161*6+L161 -> 33 | O161: 8 | P161: 4 | Q161: =O161*6+P161 -> 52 | S161: KENDALL | W161: PRAHRAN | X161: 1 | Y161: 3 | Z161: 0 | AA161: 277 | AB161: 217 | AC161: 127.64976958525345 | AD161: 4
A162: BEST PLAYERS | W162: BRUNSWICK | X162: 1 | Y162: 3 | Z162: 0 | AA162: 198 | AB162: 276 | AC162: 71.739130434782609 | AD162: 4
A163: FOOTSCRAY | C163: MCCARTHY | F163: HARRIS | I163: WILLIAMS | L163: CLARKE | O163: PROUD | R163: WALSH | W163: NORTH MELBOURNE | X163: 0 | Y163: 4 | Z163: 0 | AA163: 129 | AB163: 209 | AC163: 61.722488038277511 | AD163: 0
A164: ESSENDON TOWN | C164: MCINTYRE | F164: GOSLING | I164: J WRIGHT | L164: MCKENZIE | O164: DYSON | R164: PAIN | W164: PRESTON | X164: 0 | Y164: 4 | Z164: 0 | AA164: 120 | AB164: 384 | AC164: 31.25 | AD164: 0
A165: GOALKICKERS
A166: FOOTSCRAY | C166: BORTHWICK 2 | G166: SEVIOR 2 | J166: HUGHES 2 | M166: GREENWOOD | P166: CLARKE
A167: ESSENDON TOWN | C167: McKENZIE 3 | G167: HAMBRIDGE 2 | K167: F DARBY 2 | O167: WILLIAMS | R167: OAKLEY
A169: RICHMOND | C169: 1 | D169: 4 | E169: =C169*6+D169 -> 10 | G169: 4 | H169: 7 | I169: =G169*6+H169 -> 31 | K169: 6 | L169: 10 | M169: =K169*6+L169 -> 46 | O169: 7 | P169: 10 | Q169: =O169*6+P169 -> 52 | S169: RICHMOND
A170: NORTH MELBOURNE | C170: 0 | D170: 3 | E170: =C170*6+D170 -> 3 | G170: 2 | H170: 3 | I170: =G170*6+H170 -> 15 | K170: 3 | L170: 5 | M170: =K170*6+L170 -> 23 | O170: 5 | P170: 7 | Q170: =O170*6+P170 -> 37 | S170: KRUSE
A171: BEST PLAYERS
A172: RICHMOND | C172: McDONALD | F172: TURNBULL | I172: WILLIAMS | L172: MEGSON | O172: HILL | R172: BOWDEN
A173: NORTH MELBOURNE | C173: JAMIESON | F173: CARTER | I173: LAVER | L173: C LONDERIGAN | O173: MCKENZIE | R173: HOLDEN
A174: GOALKICKERS
A175: RICHMOND | C175: HEANEY 3 | F175: HUTCHINSON 2 | J175: CARKEEK | M175: HILL
A176: NORTH MELBOURNE | C176: SHEEHAN 2 | G176: HOLDEN | J176: McCANN | M176: JOHNSTON
A178: WILLIAMSTOWN | C178: 3 | D178: 2 | E178: =C178*6+D178 -> 20 | G178: 5 | H178: 3 | I178: =G178*6+H178 -> 33 | K178: 10 | L178: 7 | M178: =K178*6+L178 -> 67 | O178: 13 | P178: 8 | Q178: =O178*6+P178 -> 86 | S178: WILLIAMSTOWN
A179: BRUNSWICK | C179: 1 | D179: 2 | E179: =C179*6+D179 -> 8 | G179: 3 | H179: 9 | I179: =G179*6+H179 -> 27 | K179: 3 | L179: 11 | M179: =K179*6+L179 -> 29 | O179: 3 | P179: 12 | Q179: =O179*6+P179 -> 30 | S179: SOUTAR
A180: BEST PLAYERS
A181: WILLIAMSTOWN | C181: J CALDWELL | G181: LAMBERT | J181: GIBBS | M181: ADDISON | P181: JONES | R181: M OUTEN
A182: BRUNSWICK | C182: CHASE | G182: TAME | J182: ROBERTSON | M182: H BALFE | P182: H BRAID | R182: LEEDS
A183: GOALKICKERS
A184: WILLIAMSTOWN | C184: LAMBERT 4 | F184: GARBUTT 2 | I184: FLETCHER 2 | L184: ADDISON | N184: J CALDWELL | Q184: GIBBS | S184: MONAR
A185: BRUNSWICK | C185: LEEDS | F185: CHASE | I185: McNAMARA
A187: WEST MELBOURNE | C187: 0 | D187: 1 | E187: =C187*6+D187 -> 1 | G187: 3 | H187: 6 | I187: =G187*6+H187 -> 24 | K187: 6 | L187: 8 | M187: =K187*6+L187 -> 44 | O187: 7 | P187: 9 | Q187: =O187*6+P187 -> 51 | S187: PRESTON
A188: PRESTON | C188: 1 | D188: 4 | E188: =C188*6+D188 -> 10 | G188: 2 | H188: 5 | I188: =G188*6+H188 -> 17 | K188: 3 | L188: 7 | M188: =K188*6+L188 -> 25 | O188: 6 | P188: 8 | Q188: =O188*6+P188 -> 44 | S188: SCHUNKE
A189: BEST PLAYERS
A190: WEST MELBOURNE | C190: RYAN | F190: ARMSTRONG | I190: A GREGORY | L190: ROURKE | O190: P WILLIAMSON | S190: McCANN
A191: PRESTON | C191: TOMKINS | F191: S HALL | I191: HOLLIS | L191: OGDEN | O191: JONES | S191: STANLAKE
A192: GOALKICKERS
A193: WEST MELBOURNE | C193: RYAN 2 | F193: BULLEN | I193: ROURKE | K193: E WILLIAMSON | O193: McCANN | R193: ARMSTRONG
A194: PRESTON | C194: LANDELLS 3 | G194: HOLLIGAN | J194: TOMKINS | M194: JONES
A196: ROUND 5 | E196: 1ST JUNE | J196: WEATHER | M196: FINE
D197: 1ST QTR | H197: 2ND QTR | L197: 3RD QTR | P197: FINAL | S197: PLAYED AT | X197: LADDER | AA197: ROUND | AC197: 5
A198: WILLIAMSTOWN | C198: 4 | D198: 4 | E198: =C198*6+D198 -> 28 | G198: 6 | H198: 4 | I198: =G198*6+H198 -> 40 | K198: 10 | L198: 10 | M198: =K198*6+L198 -> 70 | O198: 10 | P198: 12 | Q198: =O198*6+P198 -> 72 | S198: TOORAK PARK
A199: PRAHRAN | C199: 1 | D199: 5 | E199: =C199*6+D199 -> 11 | G199: 4 | H199: 9 | I199: =G199*6+H199 -> 33 | K199: 4 | L199: 10 | M199: =K199*6+L199 -> 34 | O199: 5 | P199: 12 | Q199: =O199*6+P199 -> 42 | S199: UMPIRE | W199: TEAM | X199: W | Y199: L | Z199: D | AA199: FOR | AB199: AGST | AC199: % | AD199: PTS
A200: BEST PLAYERS | S200: McGUIRE
A201: WILLIAMSTOWN | C201: ADDISON | F201: MONAR | I201: M OUTEN | L201: JONES | O201: GIBBS | R201: GARBUTT | W201: WEST MELBOURNE | X201: 5 | Y201: 0 | Z201: 0 | AA201: 327 | AB201: 164 | AC201: 199.39024390243901 | AD201: 20
A202: PRAHRAN | C202: SWIFT | F202: WATTS | I202: HAIGHBLOOM | L202: A FGERGUSON | O202: SMITH | R202: BOYLAND | W202: WILLIAMSTOWN | X202: 5 | Y202: 0 | Z202: 0 | AA202: 299 | AB202: 150 | AC202: 199.33333333333334 | AD202: 20
A203: GOALKICKERS | W203: ESSENDON TOWN | X203: 4 | Y203: 1 | Z203: 0 | AA203: 305 | AB203: 209 | AC203: 145.93301435406698 | AD203: 16
A204: WILLIAMSTOWN | C204: WOODS 3 | F204: GIBBS 2 | I204: LAMBERT | L204: J CALDWELL | O204: JONES | Q204: ADDISON | W204: PORT MELBOURNE | X204: 4 | Y204: 1 | Z204: 0 | AA204: 273 | AB204: 243 | AC204: 112.34567901234568 | AD204: 16
A205: PRAHRAN | C205: SYKES 2 | F205: CARMODY | I205: DOWDING | L205: A FERGUSON
W206: FOOTSCRAY | X206: 3 | Y206: 2 | Z206: 0 | AA206: 219 | AB206: 210 | AC206: 104.28571428571429 | AD206: 12
A207: FOOTSCRAY | C207: 2 | D207: 5 | E207: =C207*6+D207 -> 17 | G207: 4 | H207: 6 | I207: =G207*6+H207 -> 30 | K207: 7 | L207: 11 | M207: =K207*6+L207 -> 53 | O207: 8 | P207: 13 | Q207: =O207*6+P207 -> 61 | S207: BRUNSWICK | W207: RICHMOND | X207: 2 | Y207: 3 | Z207: 0 | AA207: 288 | AB207: 253 | AC207: 113.83399209486166 | AD207: 8
A208: BRUNSWICK | C208: 0 | D208: 2 | E208: =C208*6+D208 -> 2 | G208: 5 | H208: 5 | I208: =G208*6+H208 -> 35 | K208: 5 | L208: 5 | M208: =K208*6+L208 -> 35 | O208: 7 | P208: 9 | Q208: =O208*6+P208 -> 51 | S208: KENDALL | W208: PRAHRAN | X208: 1 | Y208: 4 | Z208: 0 | AA208: 319 | AB208: 289 | AC208: 110.38062283737024 | AD208: 4
A209: BEST PLAYERS | W209: BRUNSWICK | X209: 1 | Y209: 4 | Z209: 0 | AA209: 249 | AB209: 337 | AC209: 73.887240356083083 | AD209: 4
A210: FOOTSCRAY | C210: HUGHES | F210: COTTON | I210: GREENWOOD | L210: WILLIAMS | O210: McKENZIE | R210: McKINLEY | W210: NORTH MELBOURNE | X210: 0 | Y210: 5 | Z210: 0 | AA210: 175 | AB210: 284 | AC210: 61.619718309859152 | AD210: 0
A211: BRUNSWICK | C211: TAME | F211: R BALFE | I211: CHASE | L211: H BRAID | O211: HAYES | R211: CLEMENTS | W211: PRESTON | X211: 0 | Y211: 5 | Z211: 0 | AA211: 134 | AB211: 449 | AC211: 29.844097995545656 | AD211: 0
A212: GOALKICKERS
A213: FOOTSCRAY | C213: COTTON 2 | F213: WILLIAMS | I213: HUGHES | K213: BORTHWICK | N213: CLARKE
A214: BRUNSWICK | C214: CLEMENTS 5 | G214: GRAHAM 2
A216: PORT MELBOURNE | C216: 2 | D216: 1 | E216: =C216*6+D216 -> 13 | G216: 4 | H216: 3 | I216: =G216*6+H216 -> 27 | K216: 9 | L216: 5 | M216: =K216*6+L216 -> 59 | O216: 11 | P216: 9 | Q216: =O216*6+P216 -> 75 | S216: PORT MELB
A217: NORTH MELBOURNE | C217: 1 | D217: 1 | E217: =C217*6+D217 -> 7 | G217: 4 | H217: 2 | I217: =G217*6+H217 -> 26 | K217: 5 | L217: 4 | M217: =K217*6+L217 -> 34 | O217: 7 | P217: 4 | Q217: =O217*6+P217 -> 46 | S217: McKENRY
A218: BEST PLAYERS
A219: PORT MELBOURNE | C219: McGEE | F219: CURTIS | I219: CROFT | L219: BRERETON | O219: TREGLOWN | R219: WEATE
A220: NORTH MELBOURNE | C220: M LONDERIGAN | G220: C LONDERIGAN | K220: LAVER | N220: HOLDEN | P220: MARTIN | R220: JAMIESON
A221: GOALKICKERS
A222: PORT MELBOURNE | C222: BRERETON 4 | G222: PASH 3 | J222: McGEE | L222: McGOWAN | O222: CURTIS | R222: TREGLOWN
A223: NORTH MELBOURNE | C223: LAVER 3 | F223: HOLDEN 2 | I223: M LONDERIGAN | L223: MARTIN
A225: ESSENDON TOWN | C225: 0 | D225: 1 | E225: =C225*6+D225 -> 1 | G225: 3 | H225: 5 | I225: =G225*6+H225 -> 23 | K225: 6 | L225: 11 | M225: =K225*6+L225 -> 47 | O225: 8 | P225: 17 | Q225: =O225*6+P225 -> 65 | S225: ESSENDON
A226: PRESTON | C226: 0 | D226: 0 | E226: =C226*6+D226 -> 0 | G226: 1 | H226: 2 | I226: =G226*6+H226 -> 8 | K226: 1 | L226: 2 | M226: =K226*6+L226 -> 8 | O226: 2 | P226: 2 | Q226: =O226*6+P226 -> 14 | S226: DICK
A227: BEST PLAYERS
A228: ESSENDON TOWN | C228: J WRIGHT | F228: M MADDEN | I228: McKENZIE | L228: F DARBY | O228: OAKLEY
A229: PRESTON | C229: LOVELACE | F229: HOWARD | I229: OGDEN | L229: TOMKINS | O229: LANDELLS | R229: S HALL
A230: GOALKICKERS
A231: ESSENDON TOWN | C231: McKENZIE 2 | G231: TROTTER 2 | J231: OAKLEY 2 | M231: F DARBY 2
A232: PRESTON | C232: LANDELLS | G232: STANLAKE
B233: 3RD JUNE | E233: ( PRINCE OF WALES BIRTHDAY ) | M233: WEATHER | P233: CLOUDY SHOWERS N.W. WIND
A234: WEST MELBOURNE | C234: 0 | D234: 1 | E234: =C234*6+D234 -> 1 | G234: 4 | H234: 5 | I234: =G234*6+H234 -> 29 | K234: 4 | L234: 9 | M234: =K234*6+L234 -> 33 | O234: 6 | P234: 11 | Q234: =O234*6+P234 -> 47 | S234: EAST MELB
A235: RICHMOND | C235: 1 | D235: 4 | E235: =C235*6+D235 -> 10 | G235: 3 | H235: 7 | I235: =G235*6+H235 -> 25 | K235: 5 | L235: 11 | M235: =K235*6+L235 -> 41 | O235: 5 | P235: 11 | Q235: =O235*6+P235 -> 41 | S235: LAW
A236: BEST PLAYERS
A237: WEST MELBOURNE | C237: ARMSTRONG | G237: ROURKE | J237: A GREGORY | M237: McCART | P237: MINTO | R237: RYAN
A238: RICHMOND | C238: BOWDEN | G238: McDONALD | J238: INCIGNERI | M238: HUTCHINSON | P238: BOANAS | R238: HEANEY
A239: GOALKICKERS
A240: WEST MELBOURNE | C240: A GREGORY | F240: RYAN | H240: H GREGORY | K240: McCANN | N240: P WILLIAMSON | R240: MINTO
A241: RICHMOND | C241: HUTCHINSON 3 | G241: BENNION | J241: CARKEEK
A243: ROUND 6 | E243: 15TH JUNE | J243: WEATHER | N243: FINE
D244: 1ST QTR | H244: 2ND QTR | L244: 3RD QTR | P244: FINAL | S244: PLAYED AT | X244: LADDER | AA244: ROUND | AC244: 6
A245: WILLIAMSTOWN | C245: 0 | D245: 2 | E245: =C245*6+D245 -> 2 | G245: 2 | H245: 4 | I245: =G245*6+H245 -> 16 | K245: 5 | L245: 7 | M245: =K245*6+L245 -> 37 | O245: 8 | P245: 10 | Q245: =O245*6+P245 -> 58 | S245: EAST MELB
A246: WEST MELBOURNE | C246: 1 | D246: 4 | E246: =C246*6+D246 -> 10 | G246: 2 | H246: 5 | I246: =G246*6+H246 -> 17 | K246: 6 | L246: 8 | M246: =K246*6+L246 -> 44 | O246: 6 | P246: 12 | Q246: =O246*6+P246 -> 48 | S246: UMPIRE | W246: TEAM | X246: W | Y246: L | Z246: D | AA246: FOR | AB246: AGST | AC246: % | AD246: PTS
A247: BEST PLAYERS | S247: KENDALL
A248: WILLIAMSTOWN | C248: ADDISON | G248: MONAR | J248: JONES | M248: GIBBS | O248: REITMAN | R248: ALLEY | W248: WILLIAMSTOWN | X248: 6 | Y248: 0 | Z248: 0 | AA248: 357 | AB248: 198 | AC248: 180.30303030303031 | AD248: 24
A249: WEST MELBOURNE | C249: A GREGORY | G249: CULLEN | J249: E WILLIAMSON | M249: H GREGORY | O249: A LAXTON | R249: MINTO | W249: WEST MELBOURNE | X249: 5 | Y249: 1 | Z249: 0 | AA249: 375 | AB249: 222 | AC249: 168.91891891891891 | AD249: 20
A250: GOALKICKERS | W250: ESSENDON TOWN | X250: 5 | Y250: 1 | Z250: 0 | AA250: 391 | AB250: 258 | AC250: 151.55038759689921 | AD250: 20
A251: WILLIAMSTOWN | C251: O'SHEA 2 | F251: ADDISON 2 | I251: PILKINGTON | L251: WOODS | N251: MONAR | P251: JONES | W251: FOOTSCRAY | X251: 4 | Y251: 2 | Z251: 0 | AA251: 293 | AB251: 240 | AC251: 122.08333333333333 | AD251: 16
A252: WEST MELBOURNE | C252: McCANN 2 | F252: MINTO | H252: ROURKE | K252: DASHWOOD | N252: H GREGORY
W253: PORT MELBOURNE | X253: 4 | Y253: 2 | Z253: 0 | AA253: 294 | AB253: 334 | AC253: 88.023952095808383 | AD253: 16
A254: RICHMOND | C254: 6 | D254: 2 | E254: =C254*6+D254 -> 38 | G254: 10 | H254: 6 | I254: =G254*6+H254 -> 66 | K254: 13 | L254: 6 | M254: =K254*6+L254 -> 84 | O254: 14 | P254: 7 | Q254: =O254*6+P254 -> 91 | S254: RICHMOND | W254: RICHMOND | X254: 3 | Y254: 3 | Z254: 0 | AA254: 379 | AB254: 274 | AC254: 138.32116788321167 | AD254: 12
A255: PORT MELBOURNE | C255: 1 | D255: 2 | E255: =C255*6+D255 -> 8 | G255: 1 | H255: 5 | I255: =G255*6+H255 -> 11 | K255: 1 | L255: 12 | M255: =K255*6+L255 -> 18 | O255: 1 | P255: 15 | Q255: =O255*6+P255 -> 21 | S255: SOUTAR | W255: PRAHRAN | X255: 1 | Y255: 5 | Z255: 0 | AA255: 349 | AB255: 363 | AC255: 96.143250688705237 | AD255: 4
A256: BEST PLAYERS | W256: BRUNSWICK | X256: 1 | Y256: 5 | Z256: 0 | AA256: 298 | AB256: 423 | AC256: 70.449172576832154 | AD256: 4
A257: RICHMOND | C257: C PANNAM | G257: HARDIMAN | J257: BENNION | M257: LANG | O257: LEACH | R257: GIBSON | W257: PRESTON | X257: 1 | Y257: 5 | Z257: 0 | AA257: 183 | AB257: 472 | AC257: 38.771186440677965 | AD257: 4
A258: PORT MELBOURNE | C258: WARD | G258: TREGLOWN | J258: FRANKLIN | M258: WEATE | O258: HUESKER | R258: McGOWAN | W258: NORTH MELBOURNE | X258: 0 | Y258: 6 | Z258: 0 | AA258: 198 | AB258: 333 | AC258: 59.45945945945946 | AD258: 0
A259: GOALKICKERS
A260: RICHMOND | C260: LANG 3 | F260: HUTCHINSON 3 | J260: BENNION 2 | M260: HALL 2 | O260: C PANNAM | R260: HEANEY | T260: GIBSON
A261: PORT MELBOURNE | C261: HUESKER
A263: FOOTSCRAY | C263: 4 | D263: 1 | E263: =C263*6+D263 -> 25 | G263: 5 | H263: 2 | I263: =G263*6+H263 -> 32 | K263: 8 | L263: 5 | M263: =K263*6+L263 -> 53 | O263: 11 | P263: 8 | Q263: =O263*6+P263 -> 74 | S263: FOOTSCRAY
A264: PRAHRAN | C264: 1 | D264: 0 | E264: =C264*6+D264 -> 6 | G264: 1 | H264: 2 | I264: =G264*6+H264 -> 8 | K264: 2 | L264: 2 | M264: =K264*6+L264 -> 14 | O264: 4 | P264: 6 | Q264: =O264*6+P264 -> 30 | S264: NORDEN
A265: BEST PLAYERS
A266: FOOTSCRAY | C266: GREENWOOD | G266: BORTHWICK | K266: HUGHES | N266: JOHNSTON | Q266: JACOBSEN | T266: WILLIAMS
A267: PRAHRAN | C267: HAIGHBLOOM | G267: A FERGUSON | K267: BUIST | N267: BOYLAND | Q267: SMITH | T267: W CARLSON
A268: GOALKICKERS
A269: FOOTSCRAY | C269: GREENWOOD 4 | G269: JACOBSEN 2 | K269: HUGHES 2 | N269: INCOLL | P269: O'BRIEN | R269: CLARKE
A270: PRAHRAN | C270: ROBERTS 2 | G270: W CARLSON | K270: A FERGUSON
A272: ESSENDON TOWN | C272: 2 | D272: 4 | E272: =C272*6+D272 -> 16 | G272: 5 | H272: 7 | I272: =G272*6+H272 -> 37 | K272: 8 | L272: 10 | M272: =K272*6+L272 -> 58 | O272: 12 | P272: 14 | Q272: =O272*6+P272 -> 86 | S272: ESSENDON
A273: BRUNSWICK | C273: 4 | D273: 3 | E273: =C273*6+D273 -> 27 | G273: 4 | H273: 7 | I273: =G273*6+H273 -> 31 | K273: 4 | L273: 10 | M273: =K273*6+L273 -> 34 | O273: 6 | P273: 13 | Q273: =O273*6+P273 -> 49 | S273: KRUSE
A274: BEST PLAYERS
A275: ESSENDON TOWN | C275: TROTTER | G275: BARKER | K275: McKENZIE | N275: M MADDEN
A276: BRUNSWICK | C276: O'SHEA | G276: CHASE | K276: CLEMENTS | N276: H BRAID | Q276: STANCLIFFE | T276: HAYES
A277: GOALKICKERS
A278: ESSENDON TOWN | C278: TROTTER 4 | F278: BARKER 2 | I278: TEATHER | K278: McKENZIE | N278: PURDEN | P278: BENNETT | R278: DUFF | T278: PAIN
A279: BRUNSWICK | C279: O'SHEA 3 | F279: CHASE 2 | I279: CLEMENTS
A281: PRESTON | C281: 3 | D281: 5 | E281: =C281*6+D281 -> 23 | G281: 4 | H281: 6 | I281: =G281*6+H281 -> 30 | K281: 5 | L281: 10 | M281: =K281*6+L281 -> 40 | O281: 6 | P281: 13 | Q281: =O281*6+P281 -> 49 | S281: PRESTON
A282: NORTH MELBOURNE | C282: 1 | D282: 0 | E282: =C282*6+D282 -> 6 | G282: 2 | H282: 6 | I282: =G282*6+H282 -> 18 | K282: 2 | L282: 10 | M282: =K282*6+L282 -> 22 | O282: 2 | P282: 11 | Q282: =O282*6+P282 -> 23 | S282: DICK
A283: BEST PLAYERS
A284: PRESTON | C284: S HALL | F284: TOMKINS | I284: HOWARD | L284: STANLAKE | O284: FITCHER | R284: WAWN
A285: NORTH MELBOURNE | C285: M LONDERIGAN | G285: WILSON | J285: LEWIS | L285: BAKER | O285: McVEIGH | R285: McKENZIE
A286: GOALKICKERS
A287: PRESTON | C287: LANDELLS 2 | G287: CARMAN 2 | J287: HOLLIGAN | M287: WAWN
A288: NORTH MELBOURNE | C288: M LONDERIGAN 2
A290: ROUND 7 | E290: 22ND JUNE | J290: WEATHER | N290: FINE SOUTH WIND | S290: PLAYED AT | X290: LADDER | AA290: ROUND | AC290: 7
D291: 1ST QTR | H291: 2ND QTR | L291: 3RD QTR | P291: FINAL | S291: WILLIAMSTOWN
A292: ESSENDON TOWN | C292: 2 | D292: 1 | E292: =C292*6+D292 -> 13 | G292: 2 | H292: 2 | I292: =G292*6+H292 -> 14 | K292: 3 | L292: 4 | M292: =K292*6+L292 -> 22 | O292: 6 | P292: 4 | Q292: =O292*6+P292 -> 40 | S292: UMPIRE | W292: TEAM | X292: W | Y292: L | Z292: D | AA292: FOR | AB292: AGST | AC292: % | AD292: PTS
A293: WILLIAMSTOWN | C293: 0 | D293: 1 | E293: =C293*6+D293 -> 1 | G293: 2 | H293: 6 | I293: =G293*6+H293 -> 18 | K293: 4 | L293: 11 | M293: =K293*6+L293 -> 35 | O293: 4 | P293: 13 | Q293: =O293*6+P293 -> 37 | S293: NORDEN
A294: BEST PLAYERS | W294: WILLIAMSTOWN | X294: 6 | Y294: 1 | Z294: 0 | AA294: 394 | AB294: 238 | AC294: 165.54621848739495 | AD294: 24
A295: ESSENDON TOWN | C295: MCKENZIE | F295: M MADDEN | I295: BARKER | L295: MUNDAY | O295: HAMBRIDGE | R295: DUFF | W295: ESSENDON TOWN | X295: 6 | Y295: 1 | Z295: 0 | AA295: 431 | AB295: 295 | AC295: 146.10169491525423 | AD295: 24
A296: WILLIAMSTOWN | C296: JONES | F296: McKAY | I296: A CALDWELL | L296: GURRIE | O296: ADDISON | R296: ALLEY | W296: WEST MELBOURNE | X296: 5 | Y296: 2 | Z296: 0 | AA296: 406 | AB296: 270 | AC296: 150.37037037037038 | AD296: 20
A297: GOALKICKERS | W297: FOOTSCRAY | X297: 5 | Y297: 2 | Z297: 0 | AA297: 341 | AB297: 271 | AC297: 125.83025830258302 | AD297: 20
A298: ESSENDON TOWN | C298: McKENZIE 3 | G298: TROTTER 2 | K298: F DARBY
A299: WILLIAMSTOWN | C299: LAMBERT 2 | G299: JONES | K299: O'SHEA | W299: PORT MELBOURNE | X299: 5 | Y299: 2 | Z299: 0 | AA299: 376 | AB299: 391 | AC299: 96.163682864450124 | AD299: 20
W300: RICHMOND | X300: 4 | Y300: 3 | Z300: 0 | AA300: 471 | AB300: 321 | AC300: 146.72897196261681 | AD300: 16
A301: FOOTSCRAY | C301: 1 | D301: 4 | E301: =C301*6+D301 -> 10 | G301: 1 | H301: 4 | I301: =G301*6+H301 -> 10 | K301: 5 | L301: 4 | M301: =K301*6+L301 -> 34 | O301: 7 | P301: 6 | Q301: =O301*6+P301 -> 48 | S301: EAST MELB | W301: PRAHRAN | X301: 2 | Y301: 5 | Z301: 0 | AA301: 400 | AB301: 390 | AC301: 102.56410256410257 | AD301: 8
A302: WEST MELBOURNE | C302: 1 | D302: 1 | E302: =C302*6+D302 -> 7 | G302: 1 | H302: 14 | I302: =G302*6+H302 -> 20 | K302: 1 | L302: 15 | M302: =K302*6+L302 -> 21 | O302: 2 | P302: 19 | Q302: =O302*6+P302 -> 31 | S302: SOUTAR | W302: BRUNSWICK | X302: 1 | Y302: 6 | Z302: 0 | AA302: 345 | AB302: 515 | AC302: 66.990291262135926 | AD302: 4
A303: BEST PLAYERS | W303: PRESTON | X303: 1 | Y303: 6 | Z303: 0 | AA303: 240 | AB303: 554 | AC303: 43.321299638989167 | AD303: 4
A304: FOOTSCRAY | C304: WILLIAMS | F304: HUGHES | I304: JOHNSON | L304: BORTHWICK | O304: GREENWOOD | R304: McKENZIE | W304: NORTH MELBOURNE | X304: 0 | Y304: 7 | Z304: 0 | AA304: 225 | AB304: 384 | AC304: 58.59375 | AD304: 0
A305: WEST MELBOURNE | C305: A GREGORY | F305: ROURKE | I305: McCART | L305: ARMSTRONG | O305: RYAN | R305: JENKINS
A306: GOALKICKERS
A307: FOOTSCRAY | C307: COTTER 2 | F307: HUGHES | H307: HARRIS | J307: GREENWOOD | M307: O'BRIEN | O307: WILLIAMS
A308: WEST MELBOURNE | C308: ARMSTRONG 2)
A310: RICHMOND | C310: 4 | D310: 3 | E310: =C310*6+D310 -> 27 | G310: 7 | H310: 3 | I310: =G310*6+H310 -> 45 | K310: 11 | L310: 7 | M310: =K310*6+L310 -> 73 | O310: 14 | P310: 8 | Q310: =O310*6+P310 -> 92 | S310: BRUNSWICK
A311: BRUNSWICK | C311: 1 | D311: 0 | E311: =C311*6+D311 -> 6 | G311: 4 | H311: 2 | I311: =G311*6+H311 -> 26 | K311: 4 | L311: 4 | M311: =K311*6+L311 -> 28 | O311: 7 | P311: 5 | Q311: =O311*6+P311 -> 47 | S311: DICK
A312: BEST PLAYERS
A313: RICHMOND | C313: BENNION | G313: HARDIMAN | J313: MAHONEY | M313: LANG | O313: LEACH | R313: C PANNAM
A314: BRUNSWICK | C314: STANCLIFFE | G314: CHASE | J314: KOOCHEW | M314: BARRY | O314: WHITFIELD | R314: CLEMENTS
A315: GOALKICKERS
A316: RICHMOND | C316: HUTCHINSON 8 | G316: LANG 2 | J316: C PANNAM 2 | M316: MAHONEY | O316: HALL
A317: BRUNSWICK | C317: S BALFE 2 | G317: BROMEL | J317: CHASE | L317: O'SHEA | N317: KOOCHEW | P317: STANCLIFFE
A319: PRAHRAN | C319: 2 | D319: 1 | E319: =C319*6+D319 -> 13 | G319: 2 | H319: 1 | I319: =G319*6+H319 -> 13 | K319: 5 | L319: 5 | M319: =K319*6+L319 -> 35 | O319: 7 | P319: 9 | Q319: =O319*6+P319 -> 51 | S319: NORTH MELB
A320: NORTH MELBOURNE | C320: 1 | D320: 3 | E320: =C320*6+D320 -> 9 | G320: 3 | H320: 9 | I320: =G320*6+H320 -> 27 | K320: 3 | L320: 9 | M320: =K320*6+L320 -> 27 | O320: 3 | P320: 9 | Q320: =O320*6+P320 -> 27 | S320: LANE
A321: BEST PLAYERS
A322: PRAHRAN | C322: W CARLSON | G322: LETHBRIDGE | J322: BUIST | L322: A FERGUSON | O322: SYKES | R322: SMITH
A323: NORTH MELBOURNE | C323: LEWIS | G323: LAVER | J323: CARTER | L323: LITTLE | O323: McKENZIE | R323: KEATING
A324: GOALKICKERS
A325: PRAHRAN | C325: SYKES 3 | F325: WOODS 2 | I325: CARMODY | L325: WATTS
A326: NORTH MELBOURNE | C326: MCVEIGH | F326: CARTER | I326: LITTLE
A328: PORT MELBOURNE | C328: 5 | D328: 3 | E328: =C328*6+D328 -> 33 | G328: 8 | H328: 6 | I328: =G328*6+H328 -> 54 | K328: 12 | L328: 8 | M328: =K328*6+L328 -> 80 | O328: 12 | P328: 10 | Q328: =O328*6+P328 -> 82 | S328: PRESTON
A329: PRESTON | C329: 0 | D329: 4 | E329: =C329*6+D329 -> 4 | G329: 1 | H329: 9 | I329: =G329*6+H329 -> 15 | K329: 3 | L329: 11 | M329: =K329*6+L329 -> 29 | O329: 7 | P329: 15 | Q329: =O329*6+P329 -> 57 | S329: KRUSE
A330: BEST PLAYERS
A331: PORT MELBOURNE | C331: AYLING | F331: KING | I331: CURTIS | L331: PASH | N331: McGEE | P331: TREGLOWN
A332: PRESTON | C332: BROWN | F332: S HALL | I332: JAMES | L332: TOMKINS | N332: HOLLIGAN | P332: STANCLIFFE
A333: GOALKICKERS
A334: PORT MELBOURNE | C334: WYATT 3 | F334: BRERETON 2 | I334: McGOWAN 2 | L334: PAMPERIN | O334: FRASER | Q334: HILL | S334: CROFT | U334: COEN
A335: PRESTON | C335: LANDELLS 3 | G335: BROWN | J335: OGDEN | L335: TOMKINS | O335: FITCHER
A337: ROUND 8 | E337: 29TH JUNE | J337: WEATHER | N337: NORTH WIND | S337: PLAYED AT | X337: LADDER | AA337: ROUND | AC337: 8
D338: 1ST QTR | H338: 2ND QTR | L338: 3RD QTR | P338: FINAL | S338: ESSENDON
A339: PORT MELBOURNE | C339: 2 | D339: 0 | E339: =C339*6+D339 -> 12 | G339: 5 | H339: 0 | I339: =G339*6+H339 -> 30 | K339: 6 | L339: 2 | M339: =K339*6+L339 -> 38 | O339: 7 | P339: 5 | Q339: =O339*6+P339 -> 47 | S339: UMPIRE | W339: TEAM | X339: W | Y339: L | Z339: D | AA339: FOR | AB339: AGST | AC339: % | AD339: PTS
A340: ESSENDON TOWN | C340: 1 | D340: 4 | E340: =C340*6+D340 -> 10 | G340: 2 | H340: 8 | I340: =G340*6+H340 -> 20 | K340: 3 | L340: 11 | M340: =K340*6+L340 -> 29 | O340: 5 | P340: 11 | Q340: =O340*6+P340 -> 41 | S340: LANE
A341: BEST PLAYERS | W341: WILLIAMSTOWN | X341: 7 | Y341: 1 | Z341: 0 | AA341: 479 | AB341: 267 | AC341: 179.40074906367042 | AD341: 28
A342: PORT MELBOURNE | C342: TREGLOWN | G342: BRERETON | J342: WARD | L342: WEATE | O342: AYLING | R342: McGEE | W342: WEST MELBOURNE | X342: 6 | Y342: 2 | Z342: 0 | AA342: 495 | AB342: 300 | AC342: 165 | AD342: 24
A343: ESSENDON TOWN | C343: M MADDEN | G343: McKENZIE | J343: TROTTER | L343: J WRIGHT | O343: DUFF | R343: BENNETT | W343: ESSENDON TOWN | X343: 6 | Y343: 2 | Z343: 0 | AA343: 472 | AB343: 342 | AC343: 138.01169590643275 | AD343: 24
A344: GOALKICKERS | W344: PORT MELBOURNE | X344: 6 | Y344: 2 | Z344: 0 | AA344: 423 | AB344: 432 | AC344: 97.916666666666671 | AD344: 24
A345: PORT MELBOURNE | C345: WYATT 2 | F345: PASH 2 | I345: PAMPERIN | L345: BRERETON | O345: McGEE
A346: ESSENDON TOWN | C346: TROTTER 4 | G346: DUFF | W346: RICHMOND | X346: 5 | Y346: 3 | Z346: 0 | AA346: 557 | AB346: 369 | AC346: 150.94850948509486 | AD346: 20
W347: FOOTSCRAY | X347: 5 | Y347: 3 | Z347: 0 | AA347: 389 | AB347: 357 | AC347: 108.96358543417367 | AD347: 20
A348: RICHMOND | C348: 1 | D348: 1 | E348: =C348*6+D348 -> 7 | G348: 5 | H348: 6 | I348: =G348*6+H348 -> 36 | K348: 8 | L348: 9 | M348: =K348*6+L348 -> 57 | O348: 12 | P348: 14 | Q348: =O348*6+P348 -> 86 | S348: RICHMOND | W348: PRAHRAN | X348: 3 | Y348: 5 | Z348: 0 | AA348: 460 | AB348: 440 | AC348: 104.54545454545455 | AD348: 12
A349: FOOTSCRAY | C349: 3 | D349: 7 | E349: =C349*6+D349 -> 25 | G349: 3 | H349: 7 | I349: =G349*6+H349 -> 25 | K349: 5 | L349: 12 | M349: =K349*6+L349 -> 42 | O349: 6 | P349: 12 | Q349: =O349*6+P349 -> 48 | S349: KENDALL | W349: BRUNSWICK | X349: 1 | Y349: 7 | Z349: 0 | AA349: 395 | AB349: 575 | AC349: 68.695652173913047 | AD349: 4
A350: BEST PLAYERS | W350: PRESTON | X350: 1 | Y350: 7 | Z350: 0 | AA350: 269 | AB350: 639 | AC350: 42.097026604068859 | AD350: 4
A351: RICHMOND | C351: HEANEY | F351: BENNION | I351: HUTCHINSON | L351: MAHONEY | O351: LANG | R351: GIBSON | W351: NORTH MELBOURNE | X351: 0 | Y351: 8 | Z351: 0 | AA351: 255 | AB351: 473 | AC351: 53.911205073995774 | AD351: 0
A352: FOOTSCRAY | C352: HUGHES | F352: COTTON | I352: WILLIAMS | L352: HARRIS | O352: O'BRIEN | R352: GREENWOOD
A353: GOALKICKERS
A354: RICHMOND | C354: BENNION 3 | F354: HUTCHINSON 3 | J354: HEANEY | L354: GIBSON | N354: MAHONEY | P354: HALL | R354: C PANNAM | U354: BOWDEN
A355: FOOTSCRAY | C355: O'BRIEN 3 | G355: CLARKE 2 | K355: TAYLOR
A357: PRAHRAN | C357: 0 | D357: 2 | E357: =C357*6+D357 -> 2 | G357: 4 | H357: 9 | I357: =G357*6+H357 -> 33 | K357: 6 | L357: 14 | M357: =K357*6+L357 -> 50 | O357: 7 | P357: 18 | Q357: =O357*6+P357 -> 60 | S357: TOORAK PARK
A358: BRUNSWICK | C358: 5 | D358: 4 | E358: =C358*6+D358 -> 34 | G358: 5 | H358: 5 | I358: =G358*6+H358 -> 35 | K358: 7 | L358: 7 | M358: =K358*6+L358 -> 49 | O358: 7 | P358: 8 | Q358: =O358*6+P358 -> 50 | S358: KRUSE
A359: BEST PLAYERS
A360: PRAHRAN | C360: BUIST | F360: A FERGUSON | J360: SWIFT | L360: WATTS | O360: CARDEN | R360: WOODS
A361: BRUNSWICK | C361: STANCLIFFE | F361: CHASE | J361: TAME | L361: HAYES | O361: MONOHAN | R361: S BALFE
A362: GOALKICKERS
A363: PRAHRAN | C363: TREVILLIAN 2 | G363: WOODS | I363: BOYLAND | K363: A FERGUSON | N363: SYKES | P363: SWIFT
A364: BRUNSWICK | C364: ANDERSON 2 | G364: O'SHEA | I364: STANCLIFFE | L364: S BALFE | N364: CLEMENTS | Q364: LEEDS
A366: WEST MELBOURNE | C366: 3 | D366: 7 | E366: =C366*6+D366 -> 25 | G366: 7 | H366: 9 | I366: =G366*6+H366 -> 51 | K366: 12 | L366: 10 | M366: =K366*6+L366 -> 82 | O366: 13 | P366: 11 | Q366: =O366*6+P366 -> 89 | S366: NORTH MELB
A367: NORTH MELBOURNE | C367: 0 | D367: 1 | E367: =C367*6+D367 -> 1 | G367: 1 | H367: 1 | I367: =G367*6+H367 -> 7 | K367: 1 | L367: 5 | M367: =K367*6+L367 -> 11 | O367: 4 | P367: 6 | Q367: =O367*6+P367 -> 30 | S367: NORDEN
A368: BEST PLAYERS
A369: WEST MELBOURNE | C369: ROURKE | F369: A GREGORY | J369: ARMSTRONG | M369: MINTO | O369: RANKIN | R369: H GREGORY
A370: NORTH MELBOURNE | C370: KEATING | F370: ROLENT | J370: C LONDERIGAN | M370: BARNES | O370: GROVES
A371: GOALKICKERS
A372: WEST MELBOURNE | C372: ARMSTRONG 4 | G372: RYAN 3 | J372: McCANN 2 | M372: KNELL 2 | O372: ROURKE | Q372: JAMES | S372: WILLIAMS
A373: NORTH MELBOURNE | C373: JAMIESON | G373: HOLDEN | J373: KENNEDY
A375: WILLIAMSTOWN | C375: 4 | D375: 4 | E375: =C375*6+D375 -> 28 | G375: 5 | H375: 4 | I375: =G375*6+H375 -> 34 | K375: 11 | L375: 5 | M375: =K375*6+L375 -> 71 | O375: 13 | P375: 7 | Q375: =O375*6+P375 -> 85 | S375: PRESTON
A376: PRESTON | C376: 0 | D376: 0 | E376: =C376*6+D376 -> 0 | G376: 2 | H376: 4 | I376: =G376*6+H376 -> 16 | K376: 3 | L376: 4 | M376: =K376*6+L376 -> 22 | O376: 4 | P376: 5 | Q376: =O376*6+P376 -> 29 | S376: SOUTAR
A377: BEST PLAYERS
A378: WILLIAMSTOWN | C378: MONAR | F378: M OUTEN | I378: WOODS | L378: PILKINGTON | O378: REITMAN | R378: ALLEY
A379: PRESTON | C379: BROWN | F379: S HALL | I379: HOWARD | L379: S YEOMANS | O379: PEARMAN | R379: FITCHER
A380: GOALKICKERS
A381: WILLIAMSTOWN | C381: ADDISON 5 | G381: JONES 2 | J381: LAMBERT 2 | M381: GIBBS | O381: O'SHEA | Q381: FLETCHER | S381: REITMAN
A382: PRESTON | C382: HOLLIGAN 2 | G382: LANDELLS | J382: WARRY
A384: ROUND 9 | E384: 6TH JULY | J384: WEATHER | L384: COLD SOUTH WEST WIND SHOWERS | S384: PLAYED AT | X384: LADDER | AA384: ROUND | AC384: 9
D385: 1ST QTR | H385: 2ND QTR | L385: 3RD QTR | P385: FINAL | S385: ESSENDON
A386: WEST MELBOURNE | C386: 5 | D386: 3 | E386: =C386*6+D386 -> 33 | G386: 5 | H386: 3 | I386: =G386*6+H386 -> 33 | K386: 10 | L386: 6 | M386: =K386*6+L386 -> 66 | O386: 11 | P386: 6 | Q386: =O386*6+P386 -> 72 | S386: UMPIRE | W386: TEAM | X386: W | Y386: L | Z386: D | AA386: FOR | AB386: AGST | AC386: % | AD386: PTS
A387: ESSENDON TOWN | C387: 0 | D387: 2 | E387: =C387*6+D387 -> 2 | G387: 2 | H387: 8 | I387: =G387*6+H387 -> 20 | K387: 3 | L387: 9 | M387: =K387*6+L387 -> 27 | O387: 4 | P387: 11 | Q387: =O387*6+P387 -> 35 | S387: KENDALL
A388: BEST PLAYERS | W388: WILLIAMSTOWN | X388: 7 | Y388: 2 | Z388: 0 | AA388: 511 | AB388: 301 | AC388: 169.76744186046511 | AD388: 28
A389: WEST MELBOURNE | C389: H LAXTON | G389: ROURKE | J389: ARMSTRONG | M389: H GREGORY | P389: McCANN | S389: MADDEN | W389: WEST MELBOURNE | X389: 7 | Y389: 2 | Z389: 0 | AA389: 567 | AB389: 335 | AC389: 169.25373134328359 | AD389: 28
A390: ESSENDON TOWN | C390: BENNETT | G390: McKENZIE | J390: WARREN | M390: BARKER | P390: J WRIGHT | S390: MUNDAY | W390: PORT MELBOURNE | X390: 7 | Y390: 2 | Z390: 0 | AA390: 457 | AB390: 464 | AC390: 98.491379310344826 | AD390: 28
A391: GOALKICKERS | O391: MINTO | R391: JAMES | W391: RICHMOND | X391: 6 | Y391: 3 | Z391: 0 | AA391: 643 | AB391: 424 | AC391: 151.65094339622641 | AD391: 24
A392: WEST MELBOURNE | C392: McCANN 2 | F392: KNELL 2 | H392: PUMFRIES | J392: ROURKE | L392: P WILLIAMSON | O392: A GREGORY | R392: ARMSTRONG
A393: ESSENDON TOWN | C393: McKENZIE 2 | G393: TROTTER | J393: F DARBY | W393: ESSENDON TOWN | X393: 6 | Y393: 3 | Z393: 0 | AA393: 507 | AB393: 414 | AC393: 122.46376811594203 | AD393: 24
W394: FOOTSCRAY | X394: 6 | Y394: 3 | Z394: 0 | AA394: 475 | AB394: 393 | AC394: 120.86513994910942 | AD394: 24
A395: PORT MELBOURNE | C395: 1 | D395: 6 | E395: =C395*6+D395 -> 12 | G395: 1 | H395: 7 | I395: =G395*6+H395 -> 13 | K395: 3 | L395: 10 | M395: =K395*6+L395 -> 28 | O395: 4 | P395: 10 | Q395: =O395*6+P395 -> 34 | S395: PORT MELB | W395: PRAHRAN | X395: 3 | Y395: 6 | Z395: 0 | AA395: 515 | AB395: 526 | AC395: 97.908745247148289 | AD395: 12
A396: WILLIAMSTOWN | C396: 1 | D396: 0 | E396: =C396*6+D396 -> 6 | G396: 2 | H396: 4 | I396: =G396*6+H396 -> 16 | K396: 2 | L396: 5 | M396: =K396*6+L396 -> 17 | O396: 4 | P396: 8 | Q396: =O396*6+P396 -> 32 | S396: SOUTAR | U396: ILL | W396: BRUNSWICK | X396: 2 | Y396: 7 | Z396: 0 | AA396: 430 | AB396: 605 | AC396: 71.074380165289256 | AD396: 8
A397: BEST PLAYERS | Q397: REPLACED BY MCGUIRE | W397: PRESTON | X397: 1 | Y397: 8 | Z397: 0 | AA397: 305 | AB397: 725 | AC397: 42.068965517241381 | AD397: 4
A398: PORT MELBOURNE | C398: TREGLOWN | G398: FRANKLIN | J398: RICHARDSON | M398: BRERETON | P398: WARD | R398: COEN | W398: NORTH MELBOURNE | X398: 0 | Y398: 9 | Z398: 0 | AA398: 285 | AB398: 508 | AC398: 56.102362204724407 | AD398: 0
A399: WILLIAMSTOWN | C399: McKAY | G399: PILKINGTON | J399: ALLEY | M399: REITMAN | P399: GIBBS | R399: J CALDWELL
A400: GOALKICKERS
A401: PORT MELBOURNE | C401: BRERETON 2 | G401: PAMPERIN | J401: PASH
A402: WILLIAMSTOWN | C402: JONES 2 | G402: GURRIE | J402: WOODS
A404: RICHMOND | C404: 5 | D404: 3 | E404: =C404*6+D404 -> 33 | G404: 7 | H404: 6 | I404: =G404*6+H404 -> 48 | K404: 12 | L404: 6 | M404: =K404*6+L404 -> 78 | O404: 13 | P404: 8 | Q404: =O404*6+P404 -> 86 | S404: TOORAK PARK
A405: PRAHRAN | C405: 0 | D405: 3 | E405: =C405*6+D405 -> 3 | G405: 2 | H405: 8 | I405: =G405*6+H405 -> 20 | K405: 2 | L405: 11 | M405: =K405*6+L405 -> 23 | O405: 7 | P405: 13 | Q405: =O405*6+P405 -> 55 | S405: KRUSE
A406: BEST PLAYERS
A407: RICHMOND | C407: HUTCHINSON | G407: BENNION | J407: BAYLISS | M407: HARDIMAN | P407: McDONALD | S407: INCIGNERI
A408: PRAHRAN | C408: A FERGUSON | G408: NEILL | J408: CARDEN | M408: WATTS | P408: BOYLAND | S408: TRUSCOTT
A409: GOALKICKERS
A410: RICHMOND | C410: HUTCHINSON 7 | G410: BENNION 2 | J410: BAYLISS 2 | M410: GIBSON | O410: HARDIMAN
A411: PRAHRAN | C411: SMITH 2 | F411: JONES 2 | I411: WATTS | K411: BUIST | M411: W CARLSON
A413: BRUNSWICK | C413: 0 | D413: 0 | E413: =C413*6+D413 -> 0 | G413: 3 | H413: 2 | I413: =G413*6+H413 -> 20 | K413: 3 | L413: 4 | M413: =K413*6+L413 -> 22 | O413: 5 | P413: 5 | Q413: =O413*6+P413 -> 35 | S413: NORTH MELB
A414: NORTH MELBOURNE | C414: 2 | D414: 1 | E414: =C414*6+D414 -> 13 | G414: 2 | H414: 2 | I414: =G414*6+H414 -> 14 | K414: 4 | L414: 6 | M414: =K414*6+L414 -> 30 | O414: 4 | P414: 6 | Q414: =O414*6+P414 -> 30 | S414: NORDEN
A415: BEST PLAYERS
A416: BRUNSWICK | C416: CHASE | G416: STANCLIFFE | J416: SERGEANT | M416: TAME | P416: JOHNSON | S416: H BRAID
A417: NORTH MELBOURNE | C417: KEATING | G417: LEWIS | J417: LAVER | M417: C LONDERIGAN | P417: SPEAKMAN | S417: McKENZIE
A418: GOALKICKERS
A419: BRUNSWICK | C419: CLEMENTS 2 | G419: PRIDEAUX | J419: H BRAID | M419: CHASE
A420: NORTH MELBOURNE | C420: KEATING 2 | G420: GROVES | J420: C LONDERIGAN
A422: FOOTSCRAY | C422: 3 | D422: 6 | E422: =C422*6+D422 -> 24 | G422: 6 | H422: 9 | I422: =G422*6+H422 -> 45 | K422: 10 | L422: 12 | M422: =K422*6+L422 -> 72 | O422: 12 | P422: 14 | Q422: =O422*6+P422 -> 86 | S422: FOOTSCRAY
A423: PRESTON | C423: 1 | D423: 0 | E423: =C423*6+D423 -> 6 | G423: 3 | H423: 0 | I423: =G423*6+H423 -> 18 | K423: 5 | L423: 0 | M423: =K423*6+L423 -> 30 | O423: 6 | P423: 0 | Q423: =O423*6+P423 -> 36 | S423: LANE
A424: BEST PLAYERS
A425: FOOTSCRAY | C425: COTTEN | G425: HUGHES | J425: HARRIS | M425: McKINLEY | P425: SMITH | S425: GREENWOOD
A426: PRESTON | C426: OGDEN | G426: S HALL | J426: TOMKINS | M426: EDGAR | P426: E YEOMANS | S426: HOLLIGAN
A427: GOALKICKERS
A428: FOOTSCRAY | C428: JACOBSEN 3 | F428: HARRIS 3 | I428: O'BRIEN 2 | L428: CLARKE | N428: COTTON | P428: GREENWOOD | S428: HUGHES | U428: SMITH
A429: PRESTON | C429: TOMKINS 2 | G429: E YEOMANS 2 | K429: OGDEN | M429: HOLLIGAN
A431: ROUND 10 | E431: 13TH JULY | I431: WEATHER | L431: LIGHT WIND GROUNDS SLIPPERY | S431: PLAYED AT | X431: LADDER | AA431: ROUND | AC431: 10
D432: 1ST QTR | H432: 2ND QTR | L432: 3RD QTR | P432: FINAL | S432: WILLIAMSTOWN
A433: WILLIAMSTOWN | C433: 1 | D433: 5 | E433: =C433*6+D433 -> 11 | G433: 7 | H433: 5 | I433: =G433*6+H433 -> 47 | K433: 7 | L433: 9 | M433: =K433*6+L433 -> 51 | O433: 8 | P433: 11 | Q433: =O433*6+P433 -> 59 | S433: UMPIRE | W433: TEAM | X433: W | Y433: L | Z433: D | AA433: FOR | AB433: AGST | AC433: % | AD433: PTS
A434: FOOTSCRAY | C434: 0 | D434: 5 | E434: =C434*6+D434 -> 5 | G434: 0 | H434: 7 | I434: =G434*6+H434 -> 7 | K434: 0 | L434: 9 | M434: =K434*6+L434 -> 9 | O434: 3 | P434: 10 | Q434: =O434*6+P434 -> 28 | S434: SOUTAR
A435: BEST PLAYERS | W435: WILLIAMSTOWN | X435: 8 | Y435: 2 | Z435: 0 | AA435: 570 | AB435: 329 | AC435: 173.25227963525836 | AD435: 32
A436: WILLIAMSTOWN | C436: W OUTEN | F436: M OUTEN | I436: NOONAN | L436: JONES | O436: GIBBS | Q436: PILKINGTON | W436: WEST MELBOURNE | X436: 8 | Y436: 2 | Z436: 0 | AA436: 632 | AB436: 387 | AC436: 163.30749354005167 | AD436: 32
A437: FOOTSCRAY | C437: GREENWOOD | F437: O'BRIEN | I437: STEWART | L437: McKINLEY | O437: CLARKE | Q437: McCARTHY | W437: RICHMOND | X437: 7 | Y437: 3 | Z437: 0 | AA437: 760 | AB437: 448 | AC437: 169.64285714285714 | AD437: 28
A438: GOALKICKERS | W438: ESSENDON TOWN | X438: 7 | Y438: 3 | Z438: 0 | AA438: 576 | AB438: 446 | AC438: 129.14798206278027 | AD438: 28
A439: WILLIAMSTOWN | C439: GARBUTT 2 | G439: JONES 2 | J439: WOODS 2 | M439: NOONAN | O439: GIBBS
A440: FOOTSCRAY | C440: O'BRIEN 2 | G440: WALSH | W440: PORT MELBOURNE | X440: 7 | Y440: 3 | Z440: 0 | AA440: 486 | AB440: 556 | AC440: 87.410071942446038 | AD440: 28
W441: FOOTSCRAY | X441: 6 | Y441: 4 | Z441: 0 | AA441: 503 | AB441: 452 | AC441: 111.28318584070796 | AD441: 24
A442: WEST MELBOURNE | C442: 3 | D442: 2 | E442: =C442*6+D442 -> 20 | G442: 6 | H442: 5 | I442: =G442*6+H442 -> 41 | K442: 8 | L442: 10 | M442: =K442*6+L442 -> 58 | O442: 9 | P442: 11 | Q442: =O442*6+P442 -> 65 | S442: TOORAK PARK | W442: PRAHRAN | X442: 3 | Y442: 7 | Z442: 0 | AA442: 567 | AB442: 591 | AC442: 95.939086294416242 | AD442: 12
A443: PRAHRAN | C443: 2 | D443: 2 | E443: =C443*6+D443 -> 14 | G443: 5 | H443: 3 | I443: =G443*6+H443 -> 33 | K443: 6 | L443: 5 | M443: =K443*6+L443 -> 41 | O443: 7 | P443: 11 | Q443: =O443*6+P443 -> 53 | S443: DICK | W443: BRUNSWICK | X443: 3 | Y443: 7 | Z443: 0 | AA443: 522 | AB443: 634 | AC443: 82.33438485804416 | AD443: 12
A444: BEST PLAYERS | W444: PRESTON | X444: 1 | Y444: 9 | Z444: 0 | AA444: 329 | AB444: 842 | AC444: 39.073634204275535 | AD444: 4
A445: WEST MELBOURNE | C445: JAMES | F445: A GREGORY | I445: ARMSTRONG | L445: McCANN | O445: PUMFRIES | R445: McCART | W445: NORTH MELBOURNE | X445: 0 | Y445: 10 | Z445: 0 | AA445: 317 | AB445: 577 | AC445: 54.939341421143844 | AD445: 0
A446: PRAHRAN | C446: CARDEN | F446: BOYLAND | I446: BUIST | L446: TRUSCOTT | O446: NEILL | R446: SWIFT
A447: GOALKICKERS
A448: WEST MELBOURNE | C448: McCANN 4 | F448: PUMFRIES | I448: KNELL | K448: JOHNSON | N448: A GREGORY | Q448: ARMSTRONG
A449: PRAHRAN | C449: JOHNSON | F449: ROBERTS | I449: BUIST | K449: DOWDING | N449: TREVILLIAN | Q449: SYKES | S449: BOYLAND
A451: BRUNSWICK | C451: 3 | D451: 3 | E451: =C451*6+D451 -> 21 | G451: 6 | H451: 9 | I451: =G451*6+H451 -> 45 | K451: 13 | L451: 10 | M451: =K451*6+L451 -> 88 | O451: 13 | P451: 14 | Q451: =O451*6+P451 -> 92 | S451: PORT MELB
A452: PORT MELBOURNE | C452: 1 | D452: 0 | E452: =C452*6+D452 -> 6 | G452: 2 | H452: 2 | I452: =G452*6+H452 -> 14 | K452: 4 | L452: 3 | M452: =K452*6+L452 -> 27 | O452: 4 | P452: 5 | Q452: =O452*6+P452 -> 29 | S452: KENDALL
A453: BEST PLAYERS
A454: BRUNSWICK | C454: CHASE | F454: JOHNSON | I454: STANCLIFFE | L454: MONOHAN | O454: ROBERTSON | R454: WHITFIELD
A455: PORT MELBOURNE | C455: PASH | F455: WYATT | I455: WEATE | L455: GARBUTT | O455: CROFT | R455: COEN
A456: GOALKICKERS
A457: BRUNSWICK | C457: CLEMENTS 5 | G457: S BALFE 2 | J457: O'SHEA 2 | L457: HOMEWOOD | O457: CHASE | Q457: H BRAID | S457: TAME
A458: PORT MELBOURNE | C458: PASH 2 | G458: WYATT 2
A460: ESSENDON TOWN | C460: 1 | D460: 3 | E460: =C460*6+D460 -> 9 | G460: 3 | H460: 11 | I460: =G460*6+H460 -> 29 | K460: 4 | L460: 12 | M460: =K460*6+L460 -> 36 | O460: 9 | P460: 15 | Q460: =O460*6+P460 -> 69 | S460: ESSENDON
A461: NORTH MELBOURNE | C461: 1 | D461: 2 | E461: =C461*6+D461 -> 8 | G461: 1 | H461: 4 | I461: =G461*6+H461 -> 10 | K461: 4 | L461: 8 | M461: =K461*6+L461 -> 32 | O461: 4 | P461: 8 | Q461: =O461*6+P461 -> 32 | S461: LANE
A462: BEST PLAYERS
A463: ESSENDON TOWN | C463: McKENZIE | F463: BENNETT | I463: J WRIGHT | L463: HAMBRIDGE | O463: MUNDAY | R463: DYSON
A464: NORTH MELBOURNE | C464: ROLENT | F464: LEWIS | I464: C LONDERIGAN | L464: HOLDEN | O464: KENNEDY | R464: KEATING
A465: GOALKICKERS
A466: ESSENDON TOWN | C466: McKENZIE 5 | G466: J WRIGHT | J466: HAMBRIDGE | M466: DYSON
A467: NORTH MELBOURNE | C467: KEATING 2 | G467: GROVES | J467: MORAN
A469: RICHMOND | C469: 2 | D469: 4 | E469: =C469*6+D469 -> 16 | G469: 7 | H469: 10 | I469: =G469*6+H469 -> 52 | K469: 10 | L469: 17 | M469: =K469*6+L469 -> 77 | O469: 16 | P469: 21 | Q469: =O469*6+P469 -> 117 | S469: PRESTON
A470: PRESTON | C470: 2 | D470: 0 | E470: =C470*6+D470 -> 12 | G470: 2 | H470: 0 | I470: =G470*6+H470 -> 12 | K470: 3 | L470: 0 | M470: =K470*6+L470 -> 18 | O470: 4 | P470: 0 | Q470: =O470*6+P470 -> 24 | S470: NORDEN
A471: BEST PLAYERS
A472: RICHMOND | C472: BOANAS | F472: INCIGNERI | J472: WILLIAMS | M472: MEGSON | P472: GIBBS | R472: BOWDEN
A473: PRESTON | C473: STANLAKE | F473: S HALL | J473: TOMKINS | M473: SPENCE | P473: HOWARD | R473: HORSLEY
A474: GOALKICKERS
A475: RICHMOND | C475: HUTCHINSON 4 | G475: MAHONEY 3 | J475: GIBSON 3 | M475: BENNION 2) | P475: TURNER | R475: HEANEY | T475: LANG
A476: PRESTON | C476: TOMKINS | F476: S YEOMANS | I476: MORGAN
A478: ROUND 11 | E478: 20TH JULY | J478: WEATHER | N478: NORTH WIND RAIN | S478: PLAYED AT | X478: LADDER | AA478: ROUND | AC478: 11
D479: 1ST QTR | H479: 2ND QTR | L479: 3RD QTR | P479: FINAL | S479: RICHMOND
A480: RICHMOND | C480: 2 | D480: 1 | E480: =C480*6+D480 -> 13 | G480: 6 | H480: 3 | I480: =G480*6+H480 -> 39 | K480: 6 | L480: 3 | M480: =K480*6+L480 -> 39 | O480: 8 | P480: 5 | Q480: =O480*6+P480 -> 53 | S480: UMPIRE | W480: TEAM | X480: W | Y480: L | Z480: D | AA480: FOR | AB480: AGST | AC480: % | AD480: PTS
A481: ESSENDON TOWN | C481: 2 | D481: 1 | E481: =C481*6+D481 -> 13 | G481: 4 | H481: 1 | I481: =G481*6+H481 -> 25 | K481: 6 | L481: 4 | M481: =K481*6+L481 -> 40 | O481: 7 | P481: 5 | Q481: =O481*6+P481 -> 47 | S481: LANE
A482: BEST PLAYERS | W482: WILLIAMSTOWN | X482: 9 | Y482: 2 | Z482: 0 | AA482: 599 | AB482: 344 | AC482: 174.12790697674419 | AD482: 36
A483: RICHMOND | C483: BENNION | F483: HUTCHINSON | I483: BOANAS | L483: HEANEY | N483: C PANNAM | Q483: WILLIAMS | W483: RICHMOND | X483: 8 | Y483: 3 | Z483: 0 | AA483: 813 | AB483: 495 | AC483: 164.24242424242425 | AD483: 32
A484: ESSENDON TOWN | C484: BENNETT | F484: DYSON | I484: CHEFFERS | L484: TROTTER | N484: DUFF | Q484: HAMBRIDGE | W484: WEST MELBOURNE | X484: 8 | Y484: 3 | Z484: 0 | AA484: 675 | AB484: 433 | AC484: 155.8891454965358 | AD484: 32
A485: GOALKICKERS | W485: ESSENDON TOWN | X485: 7 | Y485: 4 | Z485: 0 | AA485: 623 | AB485: 499 | AC485: 124.8496993987976 | AD485: 28
A486: RICHMOND | C486: HUTCHINSON 5 | G486: MEGSON | J486: MAHONEY | M486: HEANEY
A487: ESSENDON TOWN | C487: L WRIGHT 2 | G487: TROTTER 2 | J487: CHEFFERS | M487: H DARBY | O487: McKENZIE | W487: FOOTSCRAY | X487: 7 | Y487: 4 | Z487: 0 | AA487: 574 | AB487: 479 | AC487: 119.8329853862213 | AD487: 28
W488: PORT MELBOURNE | X488: 7 | Y488: 4 | Z488: 0 | AA488: 513 | AB488: 627 | AC488: 81.818181818181813 | AD488: 28
A489: FOOTSCRAY | C489: 4 | D489: 2 | E489: =C489*6+D489 -> 26 | G489: 4 | H489: 3 | I489: =G489*6+H489 -> 27 | K489: 8 | L489: 14 | M489: =K489*6+L489 -> 62 | O489: 9 | P489: 17 | Q489: =O489*6+P489 -> 71 | S489: FOOTSCRAY | W489: PRAHRAN | X489: 4 | Y489: 7 | Z489: 0 | AA489: 650 | AB489: 623 | AC489: 104.3338683788122 | AD489: 16
A490: PORT MELBOURNE | C490: 0 | D490: 0 | E490: =C490*6+D490 -> 0 | G490: 3 | H490: 5 | I490: =G490*6+H490 -> 23 | K490: 3 | L490: 5 | M490: =K490*6+L490 -> 23 | O490: 3 | P490: 9 | Q490: =O490*6+P490 -> 27 | S490: NUGENT | W490: BRUNSWICK | X490: 4 | Y490: 7 | Z490: 0 | AA490: 568 | AB490: 677 | AC490: 83.899556868537672 | AD490: 16
A491: BEST PLAYERS | W491: PRESTON | X491: 1 | Y491: 10 | Z491: 0 | AA491: 361 | AB491: 925 | AC491: 39.027027027027025 | AD491: 4
A492: FOOTSCRAY | C492: COTTON | F492: GREENWOOD | I492: GLUYAS | L492: WILLIAMS | O492: HARRIS | Q492: HUGHES | W492: NORTH MELBOURNE | X492: 0 | Y492: 11 | Z492: 0 | AA492: 332 | AB492: 606 | AC492: 54.785478547854787 | AD492: 0
A493: PORT MELBOURNE | C493: McGEE | F493: TREGLOWN | I493: McGOWAN | L493: PAMPERIN | O493: PASH | Q493: GARBUTT
A494: GOALKICKERS
A495: FOOTSCRAY | C495: COTTON 2 | F495: O'BRIEN 2 | I495: HUGHES 2 | L495: GLUYAS | O495: JOHNSON | R495: GREENWOOD
A496: PORT MELBOURNE | C496: BRERETON 2 | G496: PASH
A498: BRUNSWICK | C498: 1 | D498: 5 | E498: =C498*6+D498 -> 11 | G498: 1 | H498: 5 | I498: =G498*6+H498 -> 11 | K498: 3 | L498: 13 | M498: =K498*6+L498 -> 31 | O498: 5 | P498: 16 | Q498: =O498*6+P498 -> 46 | S498: BRUNSWICK
A499: WEST MELBOURNE | C499: 2 | D499: 3 | E499: =C499*6+D499 -> 15 | G499: 4 | H499: 7 | I499: =G499*6+H499 -> 31 | K499: 4 | L499: 7 | M499: =K499*6+L499 -> 31 | O499: 6 | P499: 7 | Q499: =O499*6+P499 -> 43 | S499: HOOD
A500: BEST PLAYERS
A501: BRUNSWICK | C501: JOHNSON | F501: CLEMENTS | I501: MONOHAN | L501: HOMEWOOD | O501: CHASE | R501: O'SHEA
A502: WEST MELBOURNE | C502: ARMSTRONG | F502: McCART | I502: JAMES | L502: CULLEN | O502: H GREGORY | R502: MADDEN
A503: GOALKICKERS
A504: BRUNSWICK | C504: S BALFE 2 | G504: JOHNSON | J504: SERGEANT | M504: O'SHEA
A505: WEST MELBOURNE | C505: DAY 2 | F505: JAMES | H505: MINTO | J505: ARMSTRONG | M505: A GREGORY
A507: WILLIAMSTOWN | C507: 2 | D507: 3 | E507: =C507*6+D507 -> 15 | G507: 3 | H507: 3 | I507: =G507*6+H507 -> 21 | K507: 4 | L507: 5 | M507: =K507*6+L507 -> 29 | O507: 4 | P507: 5 | Q507: =O507*6+P507 -> 29 | S507: NORTH MELB
A508: NORTH MELBOURNE | C508: 1 | D508: 0 | E508: =C508*6+D508 -> 6 | G508: 2 | H508: 3 | I508: =G508*6+H508 -> 15 | K508: 2 | L508: 3 | M508: =K508*6+L508 -> 15 | O508: 2 | P508: 3 | Q508: =O508*6+P508 -> 15 | S508: NORDEN
A509: BEST PLAYERS
A510: WILLIAMSTOWN | C510: ALLEY | F510: W OUTEN | I510: HALL | L510: PILKINGTON | O510: McKAY | R510: REITMAN
A511: NORTH MELBOURNE | C511: KENNEDY | F511: KEATING | I511: PRATT | L511: McKENZIE | O511: LEWIS | R511: GROVES
A512: GOALKICKERS
A513: WILLIAMSTOWN | C513: LAMBERT 3 | G513: BLISS
A514: NORTH MELBOURNE | C514: BRANSTON 2
A516: PRAHRAN | C516: 5 | D516: 10 | E516: =C516*6+D516 -> 40 | G516: 7 | H516: 10 | I516: =G516*6+H516 -> 52 | K516: 10 | L516: 13 | M516: =K516*6+L516 -> 73 | O516: 11 | P516: 17 | Q516: =O516*6+P516 -> 83 | S516: TOORAK PARK
A517: PRESTON | C517: 0 | D517: 0 | E517: =C517*6+D517 -> 0 | G517: 3 | H517: 9 | I517: =G517*6+H517 -> 27 | K517: 3 | L517: 11 | M517: =K517*6+L517 -> 29 | O517: 3 | P517: 14 | Q517: =O517*6+P517 -> 32 | S517: KENDALL
A518: BEST PLAYERS
A519: PRAHRAN | C519: BUIST | F519: W CARLSON | I519: A FERGUSON | L519: CARDEN | O519: SMITH | R519: MEANEY
A520: PRESTON | C520: OGDEN | F520: WAWN | I520: S YEOMANS | L520: STANALKE | O520: LANDELLS | R520: S BRADLEY
A521: GOALKICKERS
A522: PRAHRAN | C522: W CARLSON 3 | G522: SYKES 2 | J522: ROBERTS 2 | M522: WATTS | O522: SMITH | R522: DOWDING
A523: PRESTON | C523: HOLLIGAN | G523: OGDEN | J523: ASHMAN
A525: ROUND 12 | E525: 27TH JULY | J525: WEATHER | N525: STRONG NORTH WIND | S525: PLAYED AT | X525: LADDER | AA525: ROUND | AC525: 12
D526: 1ST QTR | H526: 2ND QTR | L526: 3RD QTR | P526: FINAL | S526: RICHMOND
A527: RICHMOND | C527: 3 | D527: 9 | E527: =C527*6+D527 -> 27 | G527: 5 | H527: 10 | I527: =G527*6+H527 -> 40 | K527: 6 | L527: 17 | M527: =K527*6+L527 -> 53 | O527: 8 | P527: 20 | Q527: =O527*6+P527 -> 68 | S527: UMPIRE | W527: TEAM | X527: W | Y527: L | Z527: D | AA527: FOR | AB527: AGST | AC527: % | AD527: PTS
A528: WILLIAMSTOWN | C528: 0 | D528: 1 | E528: =C528*6+D528 -> 1 | G528: 3 | H528: 7 | I528: =G528*6+H528 -> 25 | K528: 3 | L528: 7 | M528: =K528*6+L528 -> 25 | O528: 7 | P528: 11 | Q528: =O528*6+P528 -> 53 | S528: KENDALL
A529: BEST PLAYERS | W529: RICHMOND | X529: 9 | Y529: 3 | Z529: 0 | AA529: 881 | AB529: 548 | AC529: 160.76642335766422 | AD529: 36
A530: RICHMOND | C530: MEGSON | F530: HEANEY | I530: MAHONEY | L530: BOANAS | O530: KENNY | Q530: WILLIAMS | W530: WEST MELBOURNE | X530: 9 | Y530: 3 | Z530: 0 | AA530: 740 | AB530: 467 | AC530: 158.45824411134905 | AD530: 36
A531: WILLIAMSTOWN | C531: GIBBS | F531: REITMAN | I531: W OUTEN | L531: ALLEY | O531: WORROLL | Q531: MONAR | W531: WILLIAMSTOWN | X531: 9 | Y531: 3 | Z531: 0 | AA531: 652 | AB531: 412 | AC531: 158.25242718446603 | AD531: 36
A532: GOALKICKERS | W532: FOOTSCRAY | X532: 8 | Y532: 4 | Z532: 0 | AA532: 660 | AB532: 508 | AC532: 129.92125984251967 | AD532: 32
A533: RICHMOND | C533: HALL 3 | F533: CARKEEK 2 | I533: GIBSON | L533: MAHONEY | O533: FILDES
A534: WILLIAMSTOWN | C534: WORROLL 2 | F534: LAMBERT 2 | I534: GIBBS | L534: GARBUTT | O534: MONAR | W534: ESSENDON TOWN | X534: 8 | Y534: 4 | Z534: 0 | AA534: 674 | AB534: 528 | AC534: 127.65151515151516 | AD534: 32
W535: PORT MELBOURNE | X535: 7 | Y535: 5 | Z535: 0 | AA535: 547 | AB535: 692 | AC535: 79.04624277456648 | AD535: 28
A536: WEST MELBOURNE | C536: 1 | D536: 0 | E536: =C536*6+D536 -> 6 | G536: 5 | H536: 4 | I536: =G536*6+H536 -> 34 | K536: 5 | L536: 6 | M536: =K536*6+L536 -> 36 | O536: 9 | P536: 11 | Q536: =O536*6+P536 -> 65 | S536: EAST MELB | W536: BRUNSWICK | X536: 5 | Y536: 7 | Z536: 0 | AA536: 623 | AB536: 716 | AC536: 87.011173184357546 | AD536: 20
A537: PORT MELBOURNE | C537: 2 | D537: 3 | E537: =C537*6+D537 -> 15 | G537: 2 | H537: 4 | I537: =G537*6+H537 -> 16 | K537: 4 | L537: 10 | M537: =K537*6+L537 -> 34 | O537: 4 | P537: 10 | Q537: =O537*6+P537 -> 34 | S537: LANE | W537: PRAHRAN | X537: 4 | Y537: 8 | Z537: 0 | AA537: 679 | AB537: 674 | AC537: 100.74183976261128 | AD537: 16
A538: BEST PLAYERS | W538: PRESTON | X538: 1 | Y538: 11 | Z538: 0 | AA538: 400 | AB538: 980 | AC538: 40.816326530612244 | AD538: 4
A539: WEST MELBOURNE | C539: MADDEN | F539: P WILLIAMSON | J539: A LAXTON | M539: H LAXTON | O539: DAY | Q539: H GREGORY | W539: NORTH MELBOURNE | X539: 0 | Y539: 12 | Z539: 0 | AA539: 361 | AB539: 692 | AC539: 52.167630057803471 | AD539: 0
A540: PORT MELBOURNE | C540: FRASER | F540: BRENNAN | J540: JONES | M540: CURTIS | O540: PAMPERIN | R540: McGEE
A541: GOALKICKERS
A542: WEST MELBOURNE | C542: P WILLIAMSON 3 | G542: PUMFRIES 2 | K542: RANKIN | M542: ROURKE | O542: KNELL | Q542: DASHWOOD
A543: PORT MELBOURNE | C543: JONES | F543: WYATT | I543: BRENNAN | L543: PASH
A545: ESSENDON TOWN | C545: 1 | D545: 5 | E545: =C545*6+D545 -> 11 | G545: 2 | H545: 7 | I545: =G545*6+H545 -> 19 | K545: 3 | L545: 13 | M545: =K545*6+L545 -> 31 | O545: 6 | P545: 15 | Q545: =O545*6+P545 -> 51 | S545: ESSENDON
A546: PRAHRAN | C546: 2 | D546: 0 | E546: =C546*6+D546 -> 12 | G546: 2 | H546: 1 | I546: =G546*6+H546 -> 13 | K546: 4 | L546: 3 | M546: =K546*6+L546 -> 27 | O546: 4 | P546: 5 | Q546: =O546*6+P546 -> 29 | S546: KRUSE
A547: BEST PLAYERS
A548: ESSENDON TOWN | C548: DYSON | F548: PAIN | H548: BENNETT | K548: CHEFFERS | N548: GRANT | Q548: TROTTER
A549: PRAHRAN | C549: CARDEN | F549: NEILL | H549: A FERGUSON | K549: BOYLAND | N549: COLECHIN | Q549: DOWDING
A550: GOALKICKERS
A551: ESSENDON TOWN | C551: TROTTER 3 | G551: DYSON | J551: H DARBY | M551: WILLIAMS
A552: PRAHRAN | C552: SYKES 2 | G552: MEANEY | J552: ROBERTS
A554: BRUNSWICK | C554: 0 | D554: 1 | E554: =C554*6+D554 -> 1 | G554: 5 | H554: 4 | I554: =G554*6+H554 -> 34 | K554: 6 | L554: 4 | M554: =K554*6+L554 -> 40 | O554: 8 | P554: 7 | Q554: =O554*6+P554 -> 55 | S554: PRESTON
A555: PRESTON | C555: 4 | D555: 3 | E555: =C555*6+D555 -> 27 | G555: 4 | H555: 4 | I555: =G555*6+H555 -> 28 | K555: 5 | L555: 7 | M555: =K555*6+L555 -> 37 | O555: 5 | P555: 9 | Q555: =O555*6+P555 -> 39 | S555: NUGENT
A556: BEST PLAYERS
A557: BRUNSWICK | C557: MONOHAN | F557: JOHNSON | I557: S BALFE | L557: H BRAID | O557: TAME | R557: H BALFE
A558: PRESTON | C558: LANDELLS | F558: HOWARD | I558: OGDEN | L558: HOLLIGAN | O558: S YEOMANS | R558: E YEOMANS
A559: GOALKICKERS
A560: BRUNSWICK | C560: H BRAID 3 | G560: S BALFE 2 | J560: CLEMENTS | M560: HOMEWOOD | P560: O'SHEA
A561: PRESTON | C561: LANDELLS 2 | G561: S HALL | J561: PEARMAN | M561: HOLLIGAN
A563: FOOTSCRAY | C563: 0 | D563: 0 | E563: =C563*6+D563 -> 0 | G563: 3 | H563: 8 | I563: =G563*6+H563 -> 26 | K563: 4 | L563: 9 | M563: =K563*6+L563 -> 33 | O563: 12 | P563: 14 | Q563: =O563*6+P563 -> 86 | S563: FOOTSCRAY
A564: NORTH MELBOURNE | C564: 4 | D564: 2 | E564: =C564*6+D564 -> 26 | G564: 4 | H564: 2 | I564: =G564*6+H564 -> 26 | K564: 4 | L564: 5 | M564: =K564*6+L564 -> 29 | O564: 4 | P564: 5 | Q564: =O564*6+P564 -> 29 | S564: SOUTAR
A565: BEST PLAYERS
A566: FOOTSCRAY | C566: McCARTHY | F566: STEWART | I566: MARMO | L566: GREENWOOD | O566: HUGHES | R566: McKINLEY
A567: NORTH MELBOURNE | C567: CARTER | F567: KENNEDY | I567: GROVES | L567: SPEAKMAN | O567: TWOMEY | R567: LEWIS
A568: GOALKICKERS
A569: FOOTSCRAY | C569: BORTHWICK 3 | G569: CLARKE 3 | J569: GRAHAM | L569: GLUYAS | N569: STEWART | P569: DICK | R569: JACOBSEN | W569: MCCARTHY
A570: NORTH MELBOURNE | C570: MORAN | F570: LAMBERT | I570: SIMPSON | L570: GROVES
A572: ROUND 13 | E572: 3RD AUGUST | J572: WEATHER | N572: SOUTH EAST WIND | S572: PLAYED AT | X572: LADDER | AA572: ROUND | AC572: 13
D573: 1ST QTR | H573: 2ND QTR | L573: 3RD QTR | P573: FINAL | S573: ESSENDON
A574: ESSENDON TOWN | C574: 2 | D574: 4 | E574: =C574*6+D574 -> 16 | G574: 4 | H574: 5 | I574: =G574*6+H574 -> 29 | K574: 4 | L574: 8 | M574: =K574*6+L574 -> 32 | O574: 5 | P574: 13 | Q574: =O574*6+P574 -> 43 | S574: UMPIRE | W574: TEAM | X574: W | Y574: L | Z574: D | AA574: FOR | AB574: AGST | AC574: % | AD574: PTS
A575: FOOTSCRAY | C575: 0 | D575: 0 | E575: =C575*6+D575 -> 0 | G575: 0 | H575: 2 | I575: =G575*6+H575 -> 2 | K575: 1 | L575: 3 | M575: =K575*6+L575 -> 9 | O575: 1 | P575: 5 | Q575: =O575*6+P575 -> 11 | S575: KENDALL
A576: BEST PLAYERS | W576: RICHMOND | X576: 10 | Y576: 3 | Z576: 0 | AA576: 999 | AB576: 570 | AC576: 175.26315789473685 | AD576: 40
A577: ESSENDON TOWN | C577: M MADDEN | F577: DYSON | I577: P MADDEN | L577: McINTYRE | O577: GOSLING | R577: GRANT | W577: WEST MELBOURNE | X577: 10 | Y577: 3 | Z577: 0 | AA577: 783 | AB577: 492 | AC577: 159.14634146341464 | AD577: 40
A578: FOOTSCRAY | C578: JOHNSON | F578: SEVIOR | I578: DICK | L578: McCARTHY | O578: BORTHWICK | R578: STEWART | W578: WILLIAMSTOWN | X578: 10 | Y578: 3 | Z578: 0 | AA578: 691 | AB578: 443 | AC578: 155.98194130925509 | AD578: 40
A579: GOALKICKERS | W579: ESSENDON TOWN | X579: 9 | Y579: 4 | Z579: 0 | AA579: 717 | AB579: 539 | AC579: 133.02411873840444 | AD579: 36
A580: ESSENDON TOWN | C580: L WRIGHT 2 | G580: WARREN | J580: DUFF | L580: WILLIAMS
A581: FOOTSCRAY | C581: COTTON | W581: FOOTSCRAY | X581: 8 | Y581: 5 | Z581: 0 | AA581: 671 | AB581: 551 | AC581: 121.77858439201452 | AD581: 32
W582: PORT MELBOURNE | X582: 8 | Y582: 5 | Z582: 0 | AA582: 587 | AB582: 727 | AC582: 80.742778541953228 | AD582: 32
A583: WILLIAMSTOWN | C583: 0 | D583: 1 | E583: =C583*6+D583 -> 1 | G583: 4 | H583: 2 | I583: =G583*6+H583 -> 26 | K583: 4 | L583: 2 | M583: =K583*6+L583 -> 26 | O583: 6 | P583: 3 | Q583: =O583*6+P583 -> 39 | S583: BRUNSWICK | W583: BRUNSWICK | X583: 5 | Y583: 8 | Z583: 0 | AA583: 654 | AB583: 755 | AC583: 86.622516556291387 | AD583: 20
A584: BRUNSWICK | C584: 0 | D584: 5 | E584: =C584*6+D584 -> 5 | G584: 0 | H584: 6 | I584: =G584*6+H584 -> 6 | K584: 2 | L584: 12 | M584: =K584*6+L584 -> 24 | O584: 3 | P584: 13 | Q584: =O584*6+P584 -> 31 | S584: LANE | W584: PRAHRAN | X584: 4 | Y584: 9 | Z584: 0 | AA584: 714 | AB584: 714 | AC584: 100 | AD584: 16
A585: BEST PLAYERS | W585: PRESTON | X585: 1 | Y585: 12 | Z585: 0 | AA585: 425 | AB585: 1023 | AC585: 41.544477028347998 | AD585: 4
A586: WILLIAMSTOWN | C586: REITMAN | F586: ADDISON | I586: BLISS | L586: WORROLL | O586: ALLEY | R586: W OUTEN | W586: NORTH MELBOURNE | X586: 0 | Y586: 13 | Z586: 0 | AA586: 383 | AB586: 810 | AC586: 47.283950617283949 | AD586: 0
A587: BRUNSWICK | C587: STANCLIFFE | F587: TAME | I587: HOGGAN | L587: ROBERTSON | O587: H BALFE | R587: S BALFE
A588: GOALKICKERS
A589: WILLIAMSTOWN | C589: ADDISON | F589: BLISS | I589: NOONAN | L589: WOODS | N589: JONES | P589: W OUTEN
A590: BRUNSWICK | C590: JOHNSON | F590: H BRAID | I590: CLEMENTS
A592: PORT MELBOURNE | C592: 1 | D592: 1 | E592: =C592*6+D592 -> 7 | G592: 4 | H592: 3 | I592: =G592*6+H592 -> 27 | K592: 4 | L592: 5 | M592: =K592*6+L592 -> 29 | O592: 5 | P592: 10 | Q592: =O592*6+P592 -> 40 | S592: PORT MELB
A593: PRAHRAN | C593: 3 | D593: 2 | E593: =C593*6+D593 -> 20 | G593: 3 | H593: 3 | I593: =G593*6+H593 -> 21 | K593: 4 | L593: 10 | M593: =K593*6+L593 -> 34 | O593: 4 | P593: 11 | Q593: =O593*6+P593 -> 35 | S593: SOUTAR
A594: BEST PLAYERS
A595: PORT MELBOURNE | C595: McGEE | F595: TREGLOWN | I595: MCGOWAN | L595: HUESKER | O595: PASH | R595: BRERETON
A596: PRAHRAN | C596: CARDON | F596: NEILL | I596: ROBERTS | L596: BOYLAND | O596: DOWDING | R596: A FERGUSON
A597: GOALKICKERS
A598: PORT MELBOURNE | C598: WYATT 2 | F598: BRERETON 2 | J598: CURTIS
A599: PRAHRAN | C599: DRIVER 2 | F599: MEANEY | J599: DOWDING
A601: WEST MELBOURNE | C601: 3 | D601: 2 | E601: =C601*6+D601 -> 20 | G601: 4 | H601: 2 | I601: =G601*6+H601 -> 26 | K601: 6 | L601: 6 | M601: =K601*6+L601 -> 42 | O601: 6 | P601: 7 | Q601: =O601*6+P601 -> 43 | S601: PRESTON
A602: PRESTON | C602: 0 | D602: 1 | E602: =C602*6+D602 -> 1 | G602: 1 | H602: 5 | I602: =G602*6+H602 -> 11 | K602: 1 | L602: 5 | M602: =K602*6+L602 -> 11 | O602: 3 | P602: 7 | Q602: =O602*6+P602 -> 25 | S602: NUGENT
A603: BEST PLAYERS
A604: WEST MELBOURNE | C604: A GREGORY | F604: H GREGORY | I604: ARMSTRONG | L604: RYAN | O604: MADDEN | R604: CULLEN
A605: PRESTON | C605: PEARMAN | F605: OGDEN | I605: S YEOMANS | L605: S HALL | O605: HOLLIGAN | R605: TOMKINS
A606: GOALKICKERS
A607: WEST MELBOURNE | C607: KNELL 2 | F607: PUMFRIES | I607: H LAXTON | L607: ARMSTRONG | O607: A GREGORY
A608: PRESTON | C608: VICKERY
A610: RICHMOND | C610: 3 | D610: 1 | E610: =C610*6+D610 -> 19 | G610: 10 | H610: 9 | I610: =G610*6+H610 -> 69 | K610: 12 | L610: 9 | M610: =K610*6+L610 -> 81 | O610: 17 | P610: 16 | Q610: =O610*6+P610 -> 118 | S610: NORTH MELB
A611: NORTH MELBOURNE | C611: 3 | D611: 2 | E611: =C611*6+D611 -> 20 | G611: 3 | H611: 2 | I611: =G611*6+H611 -> 20 | K611: 3 | L611: 4 | M611: =K611*6+L611 -> 22 | O611: 3 | P611: 4 | Q611: =O611*6+P611 -> 22 | S611: NORDEN
A612: BEST PLAYERS
A613: RICHMOND | C613: MAHONEY | F613: HARDIMAN | I613: TURNBULL | L613: HUTCHINSON | O613: N PANNAM | R613: LUFF
A614: NORTH MELBOURNE | C614: SPEAKMAN | F614: PRATT | I614: LEWIS | L614: BRANSTON | O614: REGAN | R614: KEATING
A615: GOALKICKERS
A616: RICHMOND | C616: HUTCHINSON 8 | G616: MAHONEY 3 | J616: HEANEY 2 | M616: GIBSON | O616: LANG | Q616: HARDIMAN | T616: CARKEEK
A617: NORTH MELBOURNE | C617: KENNEDY 2 | G617: TWOMEY
A619: ROUND 14 | E619: 10TH AUGUST | J619: WEATHER | L619: NORTH WEST WIND SHOWER BEFORE PLAY | S619: PLAYED AT | X619: LADDER | AA619: ROUND | AC619: 14
D620: 1ST QTR | H620: 2ND QTR | L620: 3RD QTR | P620: FINAL | S620: RICHMOND
A621: RICHMOND | C621: 4 | D621: 2 | E621: =C621*6+D621 -> 26 | G621: 4 | H621: 2 | I621: =G621*6+H621 -> 26 | K621: 7 | L621: 7 | M621: =K621*6+L621 -> 49 | O621: 10 | P621: 11 | Q621: =O621*6+P621 -> 71 | S621: UMPIRE | W621: TEAM | X621: W | Y621: L | Z621: D | AA621: FOR | AB621: AGST | AC621: % | AD621: PTS
A622: WEST MELBOURNE | C622: 0 | D622: 2 | E622: =C622*6+D622 -> 2 | G622: 3 | H622: 6 | I622: =G622*6+H622 -> 24 | K622: 3 | L622: 6 | M622: =K622*6+L622 -> 24 | O622: 4 | P622: 11 | Q622: =O622*6+P622 -> 35 | S622: LANE
A623: BEST PLAYERS | W623: RICHMOND | X623: 11 | Y623: 3 | Z623: 0 | AA623: 1070 | AB623: 605 | AC623: 176.85950413223139 | AD623: 44
A624: RICHMOND | C624: HEANEY | F624: BOANAS | I624: WILLIAMS | L624: INCIGNERI | O624: MEGSON | R624: TURNBULL | W624: WILLIAMSTOWN | X624: 11 | Y624: 3 | Z624: 0 | AA624: 764 | AB624: 489 | AC624: 156.23721881390594 | AD624: 44
A625: WEST MELBOURNE | C625: RANKIN | F625: RYAN | I625: McCART | L625: CULLEN | O625: MADDEN | R625: A LAXTON | W625: WEST MELBOURNE | X625: 10 | Y625: 4 | Z625: 0 | AA625: 818 | AB625: 563 | AC625: 145.2930728241563 | AD625: 40
A626: GOALKICKERS | W626: ESSENDON TOWN | X626: 10 | Y626: 4 | Z626: 0 | AA626: 774 | AB626: 558 | AC626: 138.70967741935485 | AD626: 40
A627: RICHMOND | C627: HEANEY 3 | F627: HUTCHINSON 2 | J627: C PANNAM 2 | M627: HALL | O627: MAHONEY | R627: LUFF
A628: WEST MELBOURNE | C628: KNELL 2 | F628: A GREGORY | I628: JAMES | W628: FOOTSCRAY | X628: 8 | Y628: 6 | Z628: 0 | AA628: 706 | AB628: 590 | AC628: 119.66101694915254 | AD628: 32
W629: PORT MELBOURNE | X629: 8 | Y629: 6 | Z629: 0 | AA629: 606 | AB629: 765 | AC629: 79.215686274509807 | AD629: 32
A630: BRUNSWICK | C630: 3 | D630: 6 | E630: =C630*6+D630 -> 24 | G630: 3 | H630: 6 | I630: =G630*6+H630 -> 24 | K630: 5 | L630: 9 | M630: =K630*6+L630 -> 39 | O630: 5 | P630: 9 | Q630: =O630*6+P630 -> 39 | S630: FOOTSCRAY | W630: BRUNSWICK | X630: 6 | Y630: 8 | Z630: 0 | AA630: 693 | AB630: 790 | AC630: 87.721518987341767 | AD630: 24
A631: FOOTSCRAY | C631: 0 | D631: 0 | E631: =C631*6+D631 -> 0 | G631: 1 | H631: 2 | I631: =G631*6+H631 -> 8 | K631: 1 | L631: 2 | M631: =K631*6+L631 -> 8 | O631: 4 | P631: 11 | Q631: =O631*6+P631 -> 35 | S631: McCOLL | W631: PRAHRAN | X631: 4 | Y631: 10 | Z631: 0 | AA631: 760 | AB631: 787 | AC631: 96.569250317662011 | AD631: 16
A632: BEST PLAYERS | W632: NORTH MELBOURNE | X632: 1 | Y632: 13 | Z632: 0 | AA632: 421 | AB632: 829 | AC632: 50.784077201447531 | AD632: 4
A633: BRUNSWICK | C633: MONOHAN | F633: JOHNSON | I633: HOWARD | L633: ROBERTSON | O633: H BALFE | R633: CHASE | W633: PRESTON | X633: 1 | Y633: 13 | Z633: 0 | AA633: 444 | AB633: 1080 | AC633: 41.111111111111114 | AD633: 4
A634: FOOTSCRAY | C634: GREENWOOD | F634: McKINLEY | I634: STEWART | L634: HARRIS | O634: HUGHES | R634: COTTON
A635: GOALKICKERS
A636: BRUNSWICK | C636: CLEMENTS 2 | G636: A BRAID | J636: SERGEANT | M636: EVERETT
A637: FOOTSCRAY | C637: O'BRIEN | F637: McKENZIE
A639: NORTH MELBOURNE | C639: 1 | D639: 1 | E639: =C639*6+D639 -> 7 | G639: 2 | H639: 4 | I639: =G639*6+H639 -> 16 | K639: 3 | L639: 6 | M639: =K639*6+L639 -> 24 | O639: 5 | P639: 8 | Q639: =O639*6+P639 -> 38 | S639: NORTH MELBOURNE
A640: PORT MELBOURNE | C640: 0 | D640: 1 | E640: =C640*6+D640 -> 1 | G640: 0 | H640: 4 | I640: =G640*6+H640 -> 4 | K640: 2 | L640: 5 | M640: =K640*6+L640 -> 17 | O640: 2 | P640: 7 | Q640: =O640*6+P640 -> 19 | S640: NORDEN
A641: BEST PLAYERS
A642: NORTH MELBOURNE | C642: PRATT | F642: SPEAKMAN | I642: JAMIESON | L642: REGAN | O642: ROLENT | R642: GROVES
A643: PORT MELBOURNE | C643: WARD | F643: PAMPERIN | I643: CURTIS | L643: WELLINGTON | O643: FRANKLIN
A644: GOALKICKERS
A645: NORTH MELBOURNE | C645: KENNEDY | F645: TWOMEY | I645: NUGENT | L645: LAVER
A646: PORT MELBOURNE | C646: PAMPERIN | F646: MCGOWAN
A648: WILLIAMSTOWN | C648: 0 | D648: 4 | E648: =C648*6+D648 -> 4 | G648: 3 | H648: 14 | I648: =G648*6+H648 -> 32 | K648: 4 | L648: 17 | M648: =K648*6+L648 -> 41 | O648: 8 | P648: 25 | Q648: =O648*6+P648 -> 73 | S648: WILLIAMSTOWN
A649: PRAHRAN | C649: 2 | D649: 2 | E649: =C649*6+D649 -> 14 | G649: 3 | H649: 2 | I649: =G649*6+H649 -> 20 | K649: 6 | L649: 4 | M649: =K649*6+L649 -> 40 | O649: 7 | P649: 4 | Q649: =O649*6+P649 -> 46 | S649: SOUTAR
A650: BEST PLAYERS
A651: WILLIAMSTOWN | C651: McKAY | F651: WORROLL | I651: JONES | L651: W OUTEN | O651: REITMAN | R651: O'SHEA
A652: PRAHRAN | C652: BOYLAND | F652: WATTS | I652: NEILL | L652: W CARLSON | O652: DOWDING | R652: JOHNSON
A653: GOALKICKERS
A654: WILLIAMSTOWN | C654: JONES 2 | F654: BLISS 2 | I654: WORROLL 2 | L654: REID | N654: J CALDWELL
A655: PRAHRAN | C655: DOWDING 2 | G655: JOHNSON 2 | K655: BOYLAND | N655: A FERGUSON | Q655: W CARLSON
A657: ESSENDON TOWN | C657: 2 | D657: 4 | E657: =C657*6+D657 -> 16 | G657: 2 | H657: 8 | I657: =G657*6+H657 -> 20 | K657: 5 | L657: 12 | M657: =K657*6+L657 -> 42 | O657: 7 | P657: 15 | Q657: =O657*6+P657 -> 57 | S657: PRESTON
A658: PRESTON | C658: 0 | D658: 1 | E658: =C658*6+D658 -> 1 | G658: 2 | H658: 5 | I658: =G658*6+H658 -> 17 | K658: 2 | L658: 5 | M658: =K658*6+L658 -> 17 | O658: 2 | P658: 7 | Q658: =O658*6+P658 -> 19 | S658: KENDALL
A659: BEST PLAYERS
A660: ESSENDON TOWN | C660: M MADDEN | F660: MUNDAY | I660: MCKENZIE | L660: DYSON | O660: PAIN | Q660: BENNETT
A661: PRESTON | C661: S HALL | F661: TOMKINS | I661: LANDELLS | L661: HOWES | O661: OGDEN
A662: GOALKICKERS
A663: ESSENDON TOWN | C663: WILLIAMS 3 | G663: McKENZIE 2 | K663: H DARBY | N663: DYSON
A664: PRESTON | C664: VICKERY | F664: TOMKINS
A666: ROUND 15 | E666: 17TH AUGUST | J666: WEATHER | L666: STRONG NORTH WEST WIND RAIN AT FINISH | S666: PLAYED AT | X666: LADDER | AA666: ROUND | AC666: 15
D667: 1ST QTR | H667: 2ND QTR | L667: 3RD QTR | P667: FINAL | S667: WILLIAMSTOWN
A668: WILLIAMSTOWN | C668: 3 | D668: 3 | E668: =C668*6+D668 -> 21 | G668: 3 | H668: 3 | I668: =G668*6+H668 -> 21 | K668: 4 | L668: 10 | M668: =K668*6+L668 -> 34 | O668: 5 | P668: 11 | Q668: =O668*6+P668 -> 41 | S668: UMPIRE | W668: TEAM | X668: W | Y668: L | Z668: D | AA668: FOR | AB668: AGST | AC668: % | AD668: PTS
A669: WEST MELBOURNE | C669: 0 | D669: 1 | E669: =C669*6+D669 -> 1 | G669: 4 | H669: 2 | I669: =G669*6+H669 -> 26 | K669: 4 | L669: 3 | M669: =K669*6+L669 -> 27 | O669: 5 | P669: 6 | Q669: =O669*6+P669 -> 36 | S669: NORDEN
A670: BEST PLAYERS | W670: RICHMOND | X670: 12 | Y670: 3 | Z670: 0 | AA670: 1126 | AB670: 654 | AC670: 172.17125382262998 | AD670: 48
A671: WILLIAMSTOWN | C671: W OUTEN | F671: REITMAN | I671: ALLEY | L671: McKAY | N671: HALL | Q671: J CALDWELL | W671: WILLIAMSTOWN | X671: 12 | Y671: 3 | Z671: 0 | AA671: 805 | AB671: 525 | AC671: 153.33333333333334 | AD671: 48
A672: WEST MELBOURNE | C672: ARMSTRONG | F672: JAMES | I672: McCART | L672: RYAN | N672: P JOHNSON | Q672: MADDEN | W672: WEST MELBOURNE | X672: 10 | Y672: 5 | Z672: 0 | AA672: 854 | AB672: 604 | AC672: 141.39072847682118 | AD672: 40
A673: GOALKICKERS | W673: ESSENDON TOWN | X673: 10 | Y673: 5 | Z673: 0 | AA673: 804 | AB673: 612 | AC673: 131.37254901960785 | AD673: 40
A674: WILLIAMSTOWN | C674: O'SHEA 3 | G674: LAMBERT | J674: J CALDWELL
A675: WEST MELBOURNE | C675: ARMSTRONG 3 | G675: JAMES | J675: O'BRIEN | W675: FOOTSCRAY | X675: 9 | Y675: 6 | Z675: 0 | AA675: 807 | AB675: 616 | AC675: 131.00649350649351 | AD675: 36
W676: PORT MELBOURNE | X676: 8 | Y676: 7 | Z676: 0 | AA676: 655 | AB676: 821 | AC676: 79.78075517661388 | AD676: 32
A677: BRUNSWICK | C677: 3 | D677: 0 | E677: =C677*6+D677 -> 18 | G677: 4 | H677: 4 | I677: =G677*6+H677 -> 28 | K677: 5 | L677: 9 | M677: =K677*6+L677 -> 39 | O677: 7 | P677: 12 | Q677: =O677*6+P677 -> 54 | S677: BRUNSWICK | W677: BRUNSWICK | X677: 7 | Y677: 8 | Z677: 0 | AA677: 747 | AB677: 820 | AC677: 91.097560975609753 | AD677: 28
A678: ESSENDON TOWN | C678: 1 | D678: 2 | E678: =C678*6+D678 -> 8 | G678: 2 | H678: 5 | I678: =G678*6+H678 -> 17 | K678: 3 | L678: 6 | M678: =K678*6+L678 -> 24 | O678: 4 | P678: 6 | Q678: =O678*6+P678 -> 30 | S678: HURLEY | W678: PRAHRAN | X678: 4 | Y678: 11 | Z678: 0 | AA678: 786 | AB678: 888 | AC678: 88.513513513513516 | AD678: 16
A679: BEST PLAYERS | W679: NORTH MELBOURNE | X679: 2 | Y679: 13 | Z679: 0 | AA679: 464 | AB679: 869 | AC679: 53.394706559263518 | AD679: 8
A680: BRUNSWICK | C680: STANCLIFFE | G680: MONOHAN | J680: H BALFE | M680: S BALFE | O680: L BRAID | R680: HOMEWOOD | W680: PRESTON | X680: 1 | Y680: 14 | Z680: 0 | AA680: 484 | AB680: 1123 | AC680: 43.098842386464824 | AD680: 4
A681: ESSENDON TOWN | C681: GOSLING | G681: McINTYRE | J681: M MADDEN | M681: GRANT | O681: TROTTER | R681: DUFF
A682: GOALKICKERS
A683: BRUNSWICK | C683: JOHNSON 2 | G683: L BRAID | J683: CLEMENTS | M683: S BALFE | P683: HOMEWOOD
A684: ESSENDON TOWN | C684: TROTTER 3 | G684: WARREN
A686: RICHMOND | C686: 4 | D686: 8 | E686: =C686*6+D686 -> 32 | G686: 4 | H686: 10 | I686: =G686*6+H686 -> 34 | K686: 4 | L686: 18 | M686: =K686*6+L686 -> 42 | O686: 6 | P686: 20 | Q686: =O686*6+P686 -> 56 | S686: PORT MELB
A687: PORT MELBOURNE | C687: 1 | D687: 0 | E687: =C687*6+D687 -> 6 | G687: 6 | H687: 3 | I687: =G687*6+H687 -> 39 | K687: 6 | L687: 5 | M687: =K687*6+L687 -> 41 | O687: 7 | P687: 7 | Q687: =O687*6+P687 -> 49 | S687: LANE
A688: BEST PLAYERS
A689: RICHMOND | C689: HEANEY | G689: HARDIMAN | J689: TURNBULL | M689: GIBSON | P689: JONES | S689: LUFF
A690: PORT MELBOURNE | C690: WARD | G690: HUESKER | J690: TREGLOWN | M690: JONES | P690: PAMPERIN | S690: BRENNAN
A691: GOALKICKERS
A692: RICHMOND | C692: HUTCHINSON 3 | G692: HEANEY | J692: HALL | L692: JONES
A693: PORT MELBOURNE | C693: PAMPERIN 2 | G693: TREGLOWN | J693: CURTIS | L693: WYATT | N693: PASH | P693: BRERETON
A695: FOOTSCRAY | C695: 2 | D695: 4 | E695: =C695*6+D695 -> 16 | G695: 4 | H695: 11 | I695: =G695*6+H695 -> 35 | K695: 11 | L695: 13 | M695: =K695*6+L695 -> 79 | O695: 14 | P695: 17 | Q695: =O695*6+P695 -> 101 | S695: TOORAK PARK
A696: PRAHRAN | C696: 1 | D696: 4 | E696: =C696*6+D696 -> 10 | G696: 2 | H696: 5 | I696: =G696*6+H696 -> 17 | K696: 2 | L696: 6 | M696: =K696*6+L696 -> 18 | O696: 3 | P696: 8 | Q696: =O696*6+P696 -> 26 | S696: SOUTAR
A697: BEST PLAYERS
A698: FOOTSCRAY | C698: McCARTHY | G698: MARMO | J698: BORTHWICK | M698: COTTEN | P698: HEDLEY | R698: HUGHES
A699: PRAHRAN | C699: CARDEN | G699: NEILL | J699: BOYLAND | M699: DOWDING | P699: SWIFT | R699: WATTS
A700: GOALKICKERS
A701: FOOTSCRAY | C701: HUGHES 3 | F701: JACOBSEN 2 | I701: HARRIS 2 | K701: STEWART 2 | N701: GREENWOOD | Q701: COTTON | S701: CLARKE | W701: SMITH
A702: PRAHRAN | C702: SYKES | F702: ROBERTS | I702: DOWDING
A704: NORTH MELBOURNE | C704: 2 | D704: 1 | E704: =C704*6+D704 -> 13 | G704: 2 | H704: 1 | I704: =G704*6+H704 -> 13 | K704: 3 | L704: 3 | M704: =K704*6+L704 -> 21 | O704: 6 | P704: 7 | Q704: =O704*6+P704 -> 43 | S704: NORTH MELB
A705: PRESTON | C705: 0 | D705: 1 | E705: =C705*6+D705 -> 1 | G705: 3 | H705: 3 | I705: =G705*6+H705 -> 21 | K705: 4 | L705: 3 | M705: =K705*6+L705 -> 27 | O705: 6 | P705: 4 | Q705: =O705*6+P705 -> 40 | S705: KENDALL
A706: BEST PLAYERS
A707: NORTH MELBOURNE | C707: GROVES | F707: LEWIS | I707: KEATING | L707: SIMPSON
A708: PRESTON | C708: JAMES | F708: MASON | I708: S HALL | L708: BROWN | O708: HOLLIGAN | R708: OGDEN
A709: GOALKICKERS
A710: NORTH MELBOURNE | C710: TWOMEY 2 | F710: KENNEDY | I710: STEWART | K710: SPEAKMAN | N710: COONEY
A711: PRESTON | C711: LANDELLS 3 | G711: S BRADLEY 2 | K711: HOLLIGAN
A713: ROUND 16 | E713: 24TH AUGUST | J713: WEATHER | N713: NORTH WEST WIND | S713: PLAYED AT | X713: LADDER | AA713: ROUND | AC713: 16
D714: 1ST QTR | H714: 2ND QTR | L714: 3RD QTR | P714: FINAL | S714: ESSENDON
A715: WILLIAMSTOWN | C715: 1 | D715: 6 | E715: =C715*6+D715 -> 12 | G715: 2 | H715: 8 | I715: =G715*6+H715 -> 20 | K715: 5 | L715: 12 | M715: =K715*6+L715 -> 42 | O715: 6 | P715: 13 | Q715: =O715*6+P715 -> 49 | S715: UMPIRE | W715: TEAM | X715: W | Y715: L | Z715: D | AA715: FOR | AB715: AGST | AC715: % | AD715: PTS
A716: ESSENDON TOWN | C716: 0 | D716: 2 | E716: =C716*6+D716 -> 2 | G716: 1 | H716: 3 | I716: =G716*6+H716 -> 9 | K716: 2 | L716: 4 | M716: =K716*6+L716 -> 16 | O716: 5 | P716: 8 | Q716: =O716*6+P716 -> 38 | S716: KENDALL
A717: BEST PLAYERS | W717: RICHMOND | X717: 13 | Y717: 3 | Z717: 0 | AA717: 1248 | AB717: 710 | AC717: 175.77464788732394 | AD717: 52
A718: WILLIAMSTOWN | C718: W OUTEN | F718: McKAY | I718: GARBUTT | L718: ALLEY | O718: REITMAN | R718: MONAR | W718: WILLIAMSTOWN | X718: 13 | Y718: 3 | Z718: 0 | AA718: 856 | AB718: 563 | AC718: 152.04262877442272 | AD718: 52
A719: ESSENDON TOWN | C719: M MADDEN | F719: TROTTER | I719: P MADDEN | L719: McNAMARA | O719: McINTYRE | R719: GRANT | W719: FOOTSCRAY | X719: 10 | Y719: 6 | Z719: 0 | AA719: 908 | AB719: 652 | AC719: 139.2638036809816 | AD719: 40
A720: GOALKICKERS | W720: ESSENDON TOWN | X720: 10 | Y720: 6 | Z720: 0 | AA720: 842 | AB720: 663 | AC720: 126.99849170437406 | AD720: 40
A721: WILLIAMSTOWN | C721: WORROLL 2 | F721: O'SHEA 2 | I721: WOODS | K721: GIBBS
A722: ESSENDON TOWN | C722: TROTTER 3 | G722: GOSLING | J722: DUFF | W722: WEST MELBOURNE | X722: 10 | Y722: 6 | Z722: 0 | AA722: 890 | AB722: 705 | AC722: 126.24113475177305 | AD722: 40
W723: PORT MELBOURNE | X723: 9 | Y723: 7 | Z723: 0 | AA723: 721 | AB723: 850 | AC723: 84.82352941176471 | AD723: 36
A724: FOOTSCRAY | C724: 4 | D724: 3 | E724: =C724*6+D724 -> 27 | G724: 6 | H724: 5 | I724: =G724*6+H724 -> 41 | K724: 9 | L724: 9 | M724: =K724*6+L724 -> 63 | O724: 15 | P724: 11 | Q724: =O724*6+P724 -> 101 | S724: FOOTSCRAY | W724: BRUNSWICK | X724: 7 | Y724: 9 | Z724: 0 | AA724: 803 | AB724: 942 | AC724: 85.244161358811041 | AD724: 28
A725: WEST MELBOURNE | C725: 1 | D725: 1 | E725: =C725*6+D725 -> 7 | G725: 2 | H725: 2 | I725: =G725*6+H725 -> 14 | K725: 4 | L725: 4 | M725: =K725*6+L725 -> 28 | O725: 5 | P725: 6 | Q725: =O725*6+P725 -> 36 | S725: LANE | W725: PRAHRAN | X725: 5 | Y725: 11 | Z725: 0 | AA725: 875 | AB725: 931 | AC725: 93.984962406015043 | AD725: 20
A726: BEST PLAYERS | W726: NORTH MELBOURNE | X726: 2 | Y726: 14 | Z726: 0 | AA726: 507 | AB726: 958 | AC726: 52.922755741127347 | AD726: 8
A727: FOOTSCRAY | C727: HEDLEY | F727: STEWART | I727: COTTON | L727: GREENWOOD | O727: McKINLEY | R727: CLARKE | W727: PRESTON | X727: 1 | Y727: 15 | Z727: 0 | AA727: 513 | AB727: 1189 | AC727: 43.145500420521444 | AD727: 4
A728: WEST MELBOURNE | C728: A GREGORY | F728: ROURKE | I728: ARMSTRONG | L728: McCART | O728: RYAN | R728: H LAXTON
A729: GOALKICKERS
A730: FOOTSCRAY | C730: COTTON 3 | F730: BORTHWICK 3 | I730: O'BRIEN 3 | L730: JACOBSEN 2 | O730: GREENWOOD 2 | R730: HUGHES | U730: CLARKE
A731: WEST MELBOURNE | C731: ARMSTRONG 2 | G731: A GREGORY | J731: RYAN | L731: CLARKE
A733: RICHMOND | C733: 4 | D733: 4 | E733: =C733*6+D733 -> 28 | G733: 8 | H733: 8 | I733: =G733*6+H733 -> 56 | K733: 12 | L733: 12 | M733: =K733*6+L733 -> 84 | O733: 18 | P733: 14 | Q733: =O733*6+P733 -> 122 | S733: RICHMOND
A734: BRUNSWICK | C734: 2 | D734: 0 | E734: =C734*6+D734 -> 12 | G734: 3 | H734: 3 | I734: =G734*6+H734 -> 21 | K734: 6 | L734: 6 | M734: =K734*6+L734 -> 42 | O734: 8 | P734: 8 | Q734: =O734*6+P734 -> 56 | S734: SOUTAR
A735: BEST PLAYERS
A736: RICHMOND | C736: MAHONEY | F736: HEANEY | I736: C PANNAM | L736: MEGSON | O736: BOWDEN | R736: HARDIMAN
A737: BRUNSWICK | C737: STANCLIFFE | F737: CLEMENTS | I737: H BRAID | L737: L BRAID | O737: H BALFE | R737: S BALFE
A738: GOALKICKERS
A739: RICHMOND | C739: HUTCHINSON 4 | F739: C PANNAM 4 | I739: HEANEY 2 | K739: HALL 2 | M739: MAHONEY 2 | P739: MEGSON | R739: GIBSON | T739: SCHMIDT | X739: TURNBULL
A740: BRUNSWICK | C740: S BALFE 2 | G740: CLEMENTS 2 | K740: L BRAID | N740: STANCLIFFE | Q740: CHASE | S740: H BRAID
A742: PORT MELBOURNE | C742: 0 | D742: 1 | E742: =C742*6+D742 -> 1 | G742: 2 | H742: 7 | I742: =G742*6+H742 -> 19 | K742: 6 | L742: 9 | M742: =K742*6+L742 -> 45 | O742: 9 | P742: 12 | Q742: =O742*6+P742 -> 66 | S742: WILLIAMSTOWN
A743: PRESTON | C743: 1 | D743: 6 | E743: =C743*6+D743 -> 12 | G743: 2 | H743: 10 | I743: =G743*6+H743 -> 22 | K743: 3 | L743: 11 | M743: =K743*6+L743 -> 29 | O743: 3 | P743: 11 | Q743: =O743*6+P743 -> 29 | S743: HURLEY
A744: BEST PLAYERS
A745: PORT MELBOURNE | C745: WARD | F745: HUESKER | I745: BRERETON | L745: JONES | O745: McGOWAN | R745: LAVER
A746: PRESTON | C746: S HALL | F746: MASON | I746: HOLLIGAN | L746: S HALL | O746: HOWARD | R746: P HALL
A747: GOALKICKERS
A748: PORT MELBOURNE | C748: TREGLOWN 2 | G748: BRERETON 2 | K748: PAMPERIN 2 | O748: WYATT | Q748: PASH | S748: JONES
A749: PRESTON | C749: LANDELLS 2 | G749: OGDEN
A751: PRAHRAN | C751: 3 | D751: 3 | E751: =C751*6+D751 -> 21 | G751: 5 | H751: 7 | I751: =G751*6+H751 -> 37 | K751: 9 | L751: 12 | M751: =K751*6+L751 -> 66 | O751: 12 | P751: 17 | Q751: =O751*6+P751 -> 89 | S751: TOORAK PARK
A752: NORTH MELBOURNE | C752: 1 | D752: 2 | E752: =C752*6+D752 -> 8 | G752: 4 | H752: 4 | I752: =G752*6+H752 -> 28 | K752: 6 | L752: 6 | M752: =K752*6+L752 -> 42 | O752: 6 | P752: 7 | Q752: =O752*6+P752 -> 43 | S752: NORDEN
A753: BEST PLAYERS
A754: PRAHRAN | C754: SYKES
A755: NORTH MELBOURNE
A756: GOALKICKERS
A757: PRAHRAN | C757: SYKES 12
A758: NORTH MELBOURNE | C758: KEATING | F758: McCARTHY | I758: KENNEDY | K758: LAVER | N758: TWOMEY
A760: ROUND 17 | E760: 31ST AUGUST | J760: WEATHER | N760: NORTH WIND | S760: PLAYED AT | X760: LADDER | AA760: ROUND | AC760: 17
D761: 1ST QTR | H761: 2ND QTR | L761: 3RD QTR | P761: FINAL | S761: FOOTSCRAY
A762: FOOTSCRAY | C762: 1 | D762: 2 | E762: =C762*6+D762 -> 8 | G762: 4 | H762: 3 | I762: =G762*6+H762 -> 27 | K762: 4 | L762: 5 | M762: =K762*6+L762 -> 29 | O762: 8 | P762: 6 | Q762: =O762*6+P762 -> 54 | S762: UMPIRE | W762: TEAM | X762: W | Y762: L | Z762: D | AA762: FOR | AB762: AGST | AC762: % | AD762: PTS
A763: RICHMOND | C763: 1 | D763: 2 | E763: =C763*6+D763 -> 8 | G763: 1 | H763: 2 | I763: =G763*6+H763 -> 8 | K763: 1 | L763: 3 | M763: =K763*6+L763 -> 9 | O763: 3 | P763: 3 | Q763: =O763*6+P763 -> 21 | S763: HURLEY
A764: BEST PLAYERS | W764: WILLIAMSTOWN | X764: 14 | Y764: 3 | Z764: 0 | AA764: 952 | AB764: 601 | AC764: 158.40266222961731 | AD764: 56
A765: FOOTSCRAY | C765: STEWART | F765: HUGHES | I765: BORTHWICK | L765: GLUYAS | O765: DICK | R765: McCARTHY | W765: RICHMOND | X765: 13 | Y765: 4 | Z765: 0 | AA765: 1269 | AB765: 764 | AC765: 166.09947643979058 | AD765: 52
A766: RICHMOND | C766: LANG | F766: SCHMIDT | I766: C PANNAM | L766: MEANEY | O766: MAHONEY | R766: HARDIMAN | W766: FOOTSCRAY | X766: 11 | Y766: 6 | Z766: 0 | AA766: 962 | AB766: 673 | AC766: 142.94205052005944 | AD766: 44
A767: GOALKICKERS | W767: WEST MELBOURNE | X767: 11 | Y767: 6 | Z767: 0 | AA767: 990 | AB767: 756 | AC767: 130.95238095238096 | AD767: 44
A768: FOOTSCRAY | C768: STEWART 3 | G768: BORTHWICK 2 | K768: JACOBSEN | N768: JONES | P768: JOHNSON
A769: RICHMOND | C769: SCHMIDT 2 | G769: LANG | W769: ESSENDON TOWN | X769: 11 | Y769: 6 | Z769: 0 | AA769: 903 | AB769: 704 | AC769: 128.26704545454547 | AD769: 44
W770: PORT MELBOURNE | X770: 9 | Y770: 8 | Z770: 0 | AA770: 762 | AB770: 911 | AC770: 83.644346871569709 | AD770: 36
A771: ESSENDON TOWN | C771: 0 | D771: 1 | E771: =C771*6+D771 -> 1 | G771: 3 | H771: 3 | I771: =G771*6+H771 -> 21 | K771: 4 | L771: 7 | M771: =K771*6+L771 -> 31 | O771: 8 | P771: 13 | Q771: =O771*6+P771 -> 61 | S771: RICHMOND | W771: BRUNSWICK | X771: 8 | Y771: 9 | Z771: 0 | AA771: 956 | AB771: 953 | AC771: 100.31479538300106 | AD771: 32
A772: PORT MELBOURNE | C772: 2 | D772: 1 | E772: =C772*6+D772 -> 13 | G772: 3 | H772: 2 | I772: =G772*6+H772 -> 20 | K772: 4 | L772: 4 | M772: =K772*6+L772 -> 28 | O772: 6 | P772: 5 | Q772: =O772*6+P772 -> 41 | S772: LANE | W772: PRAHRAN | X772: 5 | Y772: 12 | Z772: 0 | AA772: 886 | AB772: 1084 | AC772: 81.73431734317343 | AD772: 20
A773: BEST PLAYERS | W773: NORTH MELBOURNE | X773: 2 | Y773: 15 | Z773: 0 | AA773: 558 | AB773: 1058 | AC773: 52.741020793950852 | AD773: 8
A774: ESSENDON TOWN | C774: M MADDEN | F774: TROTTER | I774: PAIN | L774: DUFF | O774: HAMBRIDGE | R774: CHEFFERS | W774: PRESTON | X774: 1 | Y774: 16 | Z774: 0 | AA774: 551 | AB774: 1285 | AC774: 42.879377431906612 | AD774: 4
A775: PORT MELBOURNE | C775: TREGLOWN | F775: WARD | I775: HUESKER | L775: McEWAN | O775: RICHARDSON | R775: McGOWAN
A776: GOALKICKERS
A777: ESSENDON TOWN | C777: TROTTER 5 | G777: DUFF | J777: WILLIAMS | M777: GIRDWOOD
A778: PORT MELBOURNE | C778: PASH 3 | F778: BRERETON 2 | J778: CURTIS
A780: WEST MELBOURNE | C780: 2 | D780: 5 | E780: =C780*6+D780 -> 17 | G780: 6 | H780: 10 | I780: =G780*6+H780 -> 46 | K780: 10 | L780: 12 | M780: =K780*6+L780 -> 72 | O780: 14 | P780: 16 | Q780: =O780*6+P780 -> 100 | S780: NORTH MELB
A781: NORTH MELBOURNE | C781: 4 | D781: 0 | E781: =C781*6+D781 -> 24 | G781: 4 | H781: 0 | I781: =G781*6+H781 -> 24 | K781: 7 | L781: 3 | M781: =K781*6+L781 -> 45 | O781: 8 | P781: 3 | Q781: =O781*6+P781 -> 51 | S781: KENDALL
A782: BEST PLAYERS
A783: WEST MELBOURNE | C783: A GREGORY | G783: JAMES | J783: ARMSTRONG | M783: P JOHNSON | P783: McCART | S783: HARRISON
A784: NORTH MELBOURNE | C784: LEWIS | G784: KEATING | J784: LAVER | M784: SPEAKMAN | P784: McKENZIE | S784: REGAN
A785: GOALKICKERS
A786: WEST MELBOURNE | C786: A GREGORY 6 | G786: ARMSTRONG 5 | K786: CLARKE | N786: CAMPBELL | Q786: DAY
A787: NORTH MELBOURNE | C787: McCARTHY 2 | G787: LAVER 2 | J787: TWOMEY | M787: JAMIESON | P787: McKENZIE
A789: BRUNSWICK | C789: 5 | D789: 2 | E789: =C789*6+D789 -> 32 | G789: 10 | H789: 9 | I789: =G789*6+H789 -> 69 | K789: 12 | L789: 16 | M789: =K789*6+L789 -> 88 | O789: 22 | P789: 21 | Q789: =O789*6+P789 -> 153 | S789: BRUNSWICK
A790: PRAHRAN | C790: 0 | D790: 2 | E790: =C790*6+D790 -> 2 | G790: 0 | H790: 2 | I790: =G790*6+H790 -> 2 | K790: 1 | L790: 4 | M790: =K790*6+L790 -> 10 | O790: 1 | P790: 5 | Q790: =O790*6+P790 -> 11 | S790: KRUSE
A791: BEST PLAYERS
A792: BRUNSWICK | C792: MONOHAN | G792: HOMEWOOD | J792: HOGGIN | M792: H BALFE | P792: WHITFIELD | S792: CHASE
A793: PRAHRAN | C793: BOYLAND | G793: McGORLICK | J793: A FERGUSON | M793: SMITH | P793: R FERGUSON
A794: GOALKICKERS
A795: BRUNSWICK | C795: CLEMENTS 7 | G795: CHASE 4 | J795: GILBERT 3 | M795: EVERETT 2 | P795: L BRAID 2 | S795: R BALFE | W795: STANCLIFFE | X795: WHITFIELD
A796: PRAHRAN | C796: ROBERTS
A798: WILLIAMSTOWN | C798: 5 | D798: 7 | E798: =C798*6+D798 -> 37 | G798: 5 | H798: 7 | I798: =G798*6+H798 -> 37 | K798: 11 | L798: 10 | M798: =K798*6+L798 -> 76 | O798: 14 | P798: 12 | Q798: =O798*6+P798 -> 96 | S798: WILLIAMSTOWN
A799: PRESTON | C799: 0 | D799: 0 | E799: =C799*6+D799 -> 0 | G799: 2 | H799: 6 | I799: =G799*6+H799 -> 18 | K799: 3 | L799: 6 | M799: =K799*6+L799 -> 24 | O799: 5 | P799: 8 | Q799: =O799*6+P799 -> 38 | S799: DICK
A800: BEST PLAYERS
A801: WILLIAMSTOWN | C801: REITMAN | F801: W OUTEN | I801: McKAY | K801: ALLEY | N801: JONES | P801: ADDISON
A802: PRESTON | C802: TOMKINS | F802: STANLAKE | I802: OGDEN | K802: HOWARD | N802: HOWES | P802: MASON
A803: GOALKICKERS
A804: WILLIAMSTOWN | C804: LAMBERT 2 | F804: ADDISON 2 | I804: BRIGGS 2 | L804: REID 2 | N804: JONES 2 | P804: HALL | R804: GIBBS | T804: REITMAN
A805: PRESTON | C805: OGDEN 2 | F805: E YEOMANS | I805: S BRADLEY | L805: PEARMAN
A807: ROUND 18 | E807: 7TH SEPTEMBER | J807: WEATHER | N807: SOUTH WEST WIND | S807: PLAYED AT | X807: LADDER | AA807: ROUND | AC807: 18
D808: 1ST QTR | H808: 2ND QTR | L808: 3RD QTR | P808: FINAL | S808: EAST MELB
A809: WEST MELBOURNE | C809: 2 | D809: 4 | E809: =C809*6+D809 -> 16 | G809: 2 | H809: 8 | I809: =G809*6+H809 -> 20 | K809: 6 | L809: 9 | M809: =K809*6+L809 -> 45 | O809: 8 | P809: 10 | Q809: =O809*6+P809 -> 58 | S809: UMPIRE | W809: TEAM | X809: W | Y809: L | Z809: D | AA809: FOR | AB809: AGST | AC809: % | AD809: PTS
A810: ESSENDON TOWN | C810: 2 | D810: 1 | E810: =C810*6+D810 -> 13 | G810: 5 | H810: 3 | I810: =G810*6+H810 -> 33 | K810: 7 | L810: 4 | M810: =K810*6+L810 -> 46 | O810: 8 | P810: 9 | Q810: =O810*6+P810 -> 57 | S810: KENDALL
A811: BEST PLAYERS | W811: WILLIAMSTOWN | X811: 15 | Y811: 3 | Z811: 0 | AA811: 1048 | AB811: 653 | AC811: 160.49004594180704 | AD811: 60
A812: WEST MELBOURNE | C812: McCART | F812: MADDEN | I812: A GREGORY | L812: RANKIN | O812: HARRISON | R812: ARMSTRONG | W812: RICHMOND | X812: 14 | Y812: 4 | Z812: 0 | AA812: 1387 | AB812: 774 | AC812: 179.19896640826875 | AD812: 56
A813: ESSENDON TOWN | C813: M MADDEN | F813: McKENZIE | I813: McINTYRE | L813: PAIN | O813: McNAMARA | R813: PURDEN | W813: FOOTSCRAY | X813: 12 | Y813: 6 | Z813: 0 | AA813: 1006 | AB813: 708 | AC813: 142.09039548022599 | AD813: 48
A814: GOALKICKERS | W814: WEST MELBOURNE | X814: 12 | Y814: 6 | Z814: 0 | AA814: 1048 | AB814: 813 | AC814: 128.90528905289054 | AD814: 48
A815: WEST MELBOURNE | C815: McCANN 2 | F815: P WILLIAMSON 2 | J815: A GREGORY | M815: ARMSTRONG | P815: CLARKE | R815: HARRISON
A816: ESSENDON TOWN | C816: McKENZIE 4 | G816: CHEFFERS | J816: J WRIGHT | M816: PURDEN | P816: TROTTER | W816: ESSENDON TOWN | X816: 11 | Y816: 7 | Z816: 0 | AA816: 960 | AB816: 762 | AC816: 125.98425196850394 | AD816: 44
W817: BRUNSWICK | X817: 9 | Y817: 9 | Z817: 0 | AA817: 1077 | AB817: 1007 | AC817: 106.95134061569017 | AD817: 36
A818: WILLIAMSTOWN | C818: 2 | D818: 2 | E818: =C818*6+D818 -> 14 | G818: 7 | H818: 8 | I818: =G818*6+H818 -> 50 | K818: 7 | L818: 10 | M818: =K818*6+L818 -> 52 | O818: 13 | P818: 18 | Q818: =O818*6+P818 -> 96 | S818: WILLIAMSTOWN | W818: PORT MELBOURNE | X818: 9 | Y818: 9 | Z818: 0 | AA818: 814 | AB818: 1007 | AC818: 80.834160873882823 | AD818: 36
A819: PORT MELBOURNE | C819: 3 | D819: 4 | E819: =C819*6+D819 -> 22 | G819: 3 | H819: 4 | I819: =G819*6+H819 -> 22 | K819: 6 | L819: 7 | M819: =K819*6+L819 -> 43 | O819: 7 | P819: 10 | Q819: =O819*6+P819 -> 52 | S819: HURLEY | W819: PRAHRAN | X819: 5 | Y819: 13 | Z819: 0 | AA819: 896 | AB819: 1202 | AC819: 74.542429284525795 | AD819: 20
A820: BEST PLAYERS | W820: NORTH MELBOURNE | X820: 2 | Y820: 16 | Z820: 0 | AA820: 612 | AB820: 1179 | AC820: 51.908396946564885 | AD820: 8
A821: WILLIAMSTOWN | C821: JONES | F821: ADDISON | I821: REITMAN | L821: McKAY | O821: GIBBS | R821: W OUTEN | W821: PRESTON | X821: 1 | Y821: 17 | Z821: 0 | AA821: 586 | AB821: 1329 | AC821: 44.093303235515428 | AD821: 4
A822: PORT MELBOURNE | C822: TREGLOWN | F822: HUESKER | I822: HILL | L822: WARD | O822: McGOWAN | R822: PASH
A823: GOALKICKERS
A824: WILLIAMSTOWN | C824: JONES 3 | F824: ADDISON 2 | I824: HALL | J824: GIBBS | L824: NOONAN | N824: BRIGGS | P824: J CALDWELL | S824: McKAY | U824: REITMAN | X824: O'SHEA
A825: PORT MELBOURNE | C825: ALLEN 2 | F825: PAMPERIN | I825: WYATT | K825: PASH | M825: TREGLOWN | P825: McGOWAN
A827: BRUNSWICK | C827: 5 | D827: 5 | E827: =C827*6+D827 -> 35 | G827: 8 | H827: 7 | I827: =G827*6+H827 -> 55 | K827: 15 | L827: 12 | M827: =K827*6+L827 -> 102 | O827: 18 | P827: 13 | Q827: =O827*6+P827 -> 121 | S827: BRUNSWICK
A828: NORTH MELBOURNE | C828: 2 | D828: 0 | E828: =C828*6+D828 -> 12 | G828: 5 | H828: 2 | I828: =G828*6+H828 -> 32 | K828: 5 | L828: 2 | M828: =K828*6+L828 -> 32 | O828: 8 | P828: 6 | Q828: =O828*6+P828 -> 54 | S828: NUGENT
A829: BEST PLAYERS
A830: BRUNSWICK
A831: NORTH MELBOURNE
A832: GOALKICKERS
A833: BRUNSWICK | C833: L BRAID 6 | F833: CLEMENTS 3 | J833: S BALFE 3 | M833: JOHNSON 2 | P833: GILBERT 2 | S833: CHASE | U833: HOMEWOOD
A834: NORTH MELBOURNE | C834: KEATING 2 | G834: LAVER 2 | J834: REGAN 2 | M834: TWOMEY | P834: LEWIS
A836: RICHMOND | C836: 4 | D836: 6 | E836: =C836*6+D836 -> 30 | G836: 7 | H836: 12 | I836: =G836*6+H836 -> 54 | K836: 12 | L836: 16 | M836: =K836*6+L836 -> 88 | O836: 16 | P836: 22 | Q836: =O836*6+P836 -> 118 | S836: RICHMOND
A837: PRAHRAN | C837: 1 | D837: 0 | E837: =C837*6+D837 -> 6 | G837: 1 | H837: 3 | I837: =G837*6+H837 -> 9 | K837: 1 | L837: 4 | M837: =K837*6+L837 -> 10 | O837: 1 | P837: 4 | Q837: =O837*6+P837 -> 10 | S837: SOUTAR
A838: BEST PLAYERS
A839: RICHMOND | C839: C PANNAM | F839: SCHMIDT | I839: MARTIN | K839: BOWDEN | N839: MEGSON | Q839: LUFF
A840: PRAHRAN | C840: ROACH | F840: JOHNSON | I840: SWIFT | K840: McGORLICK | N840: BOYLAND | Q840: DOWDING
A841: GOALKICKERS
A842: RICHMOND | C842: HUTCHINSON 5 | G842: SCHMIDT 3 | J842: MARTIN 3 | M842: TURNBULL | O842: C PANNAM | R842: MEGSON
A843: PRAHRAN | C843: ROBERTS
A845: FOOTSCRAY | C845: 2 | D845: 3 | E845: =C845*6+D845 -> 15 | G845: 2 | H845: 8 | I845: =G845*6+H845 -> 20 | K845: 4 | L845: 11 | M845: =K845*6+L845 -> 35 | O845: 5 | P845: 14 | Q845: =O845*6+P845 -> 44 | S845: PRESTON
A846: PRESTON | C846: 1 | D846: 0 | E846: =C846*6+D846 -> 6 | G846: 1 | H846: 3 | I846: =G846*6+H846 -> 9 | K846: 4 | L846: 5 | M846: =K846*6+L846 -> 29 | O846: 5 | P846: 5 | Q846: =O846*6+P846 -> 35 | S846: LANE
A847: BEST PLAYERS
A848: FOOTSCRAY | C848: DICK | F848: MARMO | I848: McCARTHY | L848: CLARKE | O848: WILLIAMS | R848: HUGHES
A849: PRESTON | C849: S HALL | F849: OGDEN | I849: HOWARD | L849: TOMKINS | O849: LANDELLS
A850: GOALKICKERS
A851: FOOTSCRAY | C851: COTTON 2 | G851: CLARKE | J851: HUGHES | M851: WILLIAMS
A852: PRESTON | C852: LANDELLS 2 | G852: OGDEN 2 | J852: S HALL
A854: FINALS
A855: 1ST SEMI | C855: 14TH SEPTEMBER | I855: WEATHER | K855: NORTH WEST WIND
A856: PLAYED AT | C856: EAST MELBOURNE | I856: UMPIRE | K856: KENDALL | N856: ( INJURED. REPLACED BY LANE AT 3/4 TIME )
D857: 1ST QTR | H857: 2ND QTR | L857: 3RD QTR | P857: FINAL
A858: WILLIAMSTOWN | C858: 0 | D858: 7 | E858: =C858*6+D858 -> 7 | G858: 1 | H858: 9 | I858: =G858*6+H858 -> 15 | K858: 5 | L858: 10 | M858: =K858*6+L858 -> 40 | O858: 5 | P858: 11 | Q858: 41
A859: FOOTSCRAY | C859: 0 | D859: 2 | E859: =C859*6+D859 -> 2 | G859: 0 | H859: 5 | I859: =G859*6+H859 -> 5 | K859: 1 | L859: 6 | M859: =K859*6+L859 -> 12 | O859: 3 | P859: 9 | Q859: 27
A860: BEST PLAYERS
A861: WILLIAMSTOWN | C861: JONES | F861: REITMAN | I861: GARBUTT | L861: J CALDWELL | O861: MONAR | R861: WORROLL
A862: FOOTSCRAY | C862: HEDLEY | F862: STEWART | I862: COTTON | L862: HUGHES | O862: DICK | R862: BORTHWICK
A863: GOALKICKERS
A864: WILLIAMSTOWN | C864: JONES 2 | F864: MONAR | I864: WORROLL | L864: O'SHEA
A865: FOOTSCRAY | C865: GREENWOOD 2 | G865: DICK
A867: 2ND SEMI | C867: 21ST SEPTEMBER | J867: WEATHER | L867: SOUTH WIND FINE
A868: PLAYED AT | C868: EAST MELBOURNE | I868: UMPIRE | K868: HURLEY
A869: WEST MELBOURNE | C869: 4 | D869: 2 | E869: =C869*6+D869 -> 26 | G869: 4 | H869: 4 | I869: =G869*6+H869 -> 28 | K869: 8 | L869: 7 | M869: =K869*6+L869 -> 55 | O869: 8 | P869: 13 | Q869: =O869*6+P869 -> 61
A870: RICHMOND | C870: 1 | D870: 1 | E870: =C870*6+D870 -> 7 | G870: 3 | H870: 4 | I870: =G870*6+H870 -> 22 | K870: 4 | L870: 5 | M870: =K870*6+L870 -> 29 | O870: 5 | P870: 7 | Q870: =O870*6+P870 -> 37
A871: BEST PLAYERS
A872: WEST MELBOURNE | D872: RYAN | G872: RANKIN | J872: H GREGORY | M872: H LAXTON | P872: HOLDEN | S872: CLARKE
A873: RICHMOND | D873: HARDIMAN | G873: MAHONEY | J873: WILLIAMS | M873: GIBSON | P873: LUFF | S873: TURNBULL
A874: GOALKICKERS
A875: WEST MELBOURNE | D875: CLARKE 5 | G875: P JOHNSON | J875: GILBERT | M875: A GREGORY
A876: RICHMOND | D876: GIBSON 2 | G876: BENNION | J876: HEANEY | M876: HUTCHINSON
A878: FINAL | C878: 28TH SEPTEMBER | J878: WEATHER | L878: NORTH BREEZE FINE
A879: PLAYED AT | C879: EAST MELBOURNE | I879: UMPIRE | K879: HURLEY
A880: WILLIAMSTOWN | C880: 4 | D880: 4 | E880: 28 | G880: 4 | H880: 5 | I880: 29 | K880: 5 | L880: 9 | M880: 39 | O880: 7 | P880: 10 | Q880: =O880*6+P880 -> 52
A881: WEST MELBOURNE | C881: 0 | D881: 2 | E881: 2 | G881: 2 | H881: 6 | I881: 18 | K881: 2 | L881: 9 | M881: 21 | O881: 3 | P881: 16 | Q881: =O881*6+P881 -> 34
A882: BEST PLAYERS
A883: WILLIAMSTOWN | D883: JONES | G883: REITMAN | J883: LEWIS | L883: BRIGGS | O883: GIBBS | R883: ALLEY
A884: WEST MELBOURNE | D884: ARMSTRONG | G884: RYAN | J884: A LAXTON | L884: P JOHNSON | O884: HARRISON | R884: JAMES
A885: GOALKICKERS
A886: WILLIAMSTOWN | D886: BRIGGS 3 | G886: GIBBS 2 | J886: ADDISON 2
A887: WEST MELBOURNE | D887: P JOHNSON 2 | H887: ARMSTRONG
A889: REPRESENTATIVE GAME | G889: 8TH JUNE | K889: WEATHER
A890: PLAYED AT | C890: EAST MELBOURNE | I890: UMPIRE | K890: NORDEN
A891: S.A. | C891: 0 | D891: 3 | E891: =C891*6+D891 -> 3 | G891: 6 | H891: 5 | I891: =G891*6+H891 -> 41 | K891: 10 | L891: 9 | M891: =K891*6+L891 -> 69 | O891: 14 | P891: 9 | Q891: =O891*6+P891 -> 93
A892: V.F.A. | C892: 3 | D892: 4 | E892: =C892*6+D892 -> 22 | G892: 7 | H892: 5 | I892: =G892*6+H892 -> 47 | K892: 9 | L892: 9 | M892: =K892*6+L892 -> 63 | O892: 13 | P892: 14 | Q892: =O892*6+P892 -> 92
A893: BEST PLAYERS
A894: S.A. | C894: WALLACE | F894: JOHNS | I894: PADMAN | L894: BAHR | N894: LEAHY | P894: McKENZIE
A895: V.F.A. | C895: HARRIS | F895: TREGLOWN | I895: CHASE | L895: HUTCHINSON | O895: A FERGUSON | R895: McKENZIE
A896: GOALKICKERS
A897: S.A. | C897: JOHNS 5 | F897: BARR 3 | I897: GIBBONS 3 | L897: WAYE 2 | O897: LEAHY
A898: V.F.A. | C898: HUTCHINSON 3 | G898: JONES 3 | J898: McKENZIE 3 | M898: ARMSTRONG 2 | P898: CARTER | R898: OGDEN
A900: TEAMS | F900: V.F.A. | M900: S.A
A901: B | B901: HARRIS | E901: McDONALD | H901: OGDEN | K901: WOOLARD | N901: EWERS | Q901: THOMPSON
A902: H.B | B902: McCARTHY | E902: MADDEN | H902: HUESKER | K902: CAMERON | N902: STODDART | Q902: McKENZIE
A903: C | B903: FERGUSON | E903: CHASE | H903: CALDWELL | K903: PADMAN | N903: TOWNSEND | Q903: ALDERSLEY
A904: H.F | B904: HAIGHBLOOM | E904: McKENZIE | H904: BRAID | K904: TREDREA | N904: WAYE | Q904: BAHR
A905: F | B905: CARTER | E905: JONES | H905: HUTCHINSON | K905: WALLACE | N905: JOHNS | Q905: GIBBONS
A906: R | B906: ROURKE | E906: ARMSTRONG | H906: TREGLOWN | K906: LEARY | N906: GWYNNE | Q906: McGAURISK
A908: REPRESENTATIVE GAME | G908: 27TH JULY | K908: WEATHER | N908: RAIN | P908: GROUND MUDDY
A909: PLAYED AT | C909: ADELAIDE
A910: V.F.A. | C910: 2 | D910: 1 | E910: =C910*6+D910 -> 13 | G910: 3 | H910: 8 | I910: =G910*6+H910 -> 26 | K910: 3 | L910: 8 | M910: =K910*6+L910 -> 26 | O910: 9 | P910: 4 | Q910: =O910*6+P910 -> 58
A911: S.A. | C911: 3 | D911: 2 | E911: =C911*6+D911 -> 20 | G911: 3 | H911: 6 | I911: =G911*6+H911 -> 24 | K911: 4 | L911: 11 | M911: =K911*6+L911 -> 35 | O911: 6 | P911: 11 | Q911: =O911*6+P911 -> 47
A912: BEST PLAYERS
A913: V.F.A.
A914: S.A.
A915: GOALKICKERS
A916: V.F.A.
A917: S.A.
A919: TEAMS
A920: V.F.A. | J920: S.A.
A921: CHASE | C921: KEATING | F921: HUTCHINSON | J921: BAHR | M921: JAMES | P921: T McKENZIE
A922: STANFIELD | C922: LAVER | F922: BOWDEN | J922: CHAMBERLAIN | M922: JESSOP | P922: PADMAN
A923: McKENZIE | C923: TREGLOWN | F923: JONES | J923: EARLE | M923: JOHNS | P923: REES
A924: MADDEN | C924: McGOWAN | F924: McKAY | J924: EWERS | M924: LEAHY | P924: STRAWNS
A925: HARRIS | C925: SMITH | F925: GREGORY | J925: GWYNNE | M925: W MILLER | P925: WAYE
A926: WILLIAMS | C926: TOMKINS | F926: ARMSTRONG | J926: HYMAN | M926: MACK | P926: WALLACE