A1: Victorian Football Association
A2: Season 1908
A3: © Copyright Wal Williams | F3: First created: 2 August 2014
A4: Contact: joywalwi at gmail dot com | F4: Last updated: 30 July 2017 | W4: VFA Results and tables - Link to the main index page
A5: You are free to copy this document in whole or part provided that proper acknowledgement is given to the author. All rights reserved.
A7: YEAR 1908 | Y7: LADDER | AC7: ROUND | AD7: 1
A8: ROUND 1 | E8: 25TH APRIL | J8: WEATHER | M8: SOUTH EAST BREEZE FINE | S8: PLAYED AT
D9: 1ST QTR | H9: 2ND QTR | L9: 3RD QTR | P9: FINAL | S9: PORT MELB | W9: TEAM | X9: W | Y9: L | Z9: D | AA9: FOR | AB9: AGST | AC9: % | AD9: PTS
A10: WILLIAMSTOWN | C10: 2 | D10: 2 | E10: =C10*6+D10 -> 14 | G10: 7 | H10: 5 | I10: =G10*6+H10 -> 47 | K10: 8 | L10: 7 | M10: =K10*6+L10 -> 55 | O10: 11 | P10: 10 | Q10: =O10*6+P10 -> 76 | S10: UMPIRE
A11: PORT MELBOURNE | C11: 0 | D11: 1 | E11: =C11*6+D11 -> 1 | G11: 0 | H11: 1 | I11: =G11*6+H11 -> 1 | K11: 1 | L11: 2 | M11: =K11*6+L11 -> 8 | O11: 1 | P11: 3 | Q11: =O11*6+P11 -> 9 | S11: KENDALL | W11: WILLIAMSTOWN | X11: 1 | Y11: 0 | Z11: 0 | AA11: 76 | AB11: 9 | AC11: 844.44444444444446 | AD11: 4
A12: BEST PLAYERS | W12: PRAHRAN | X12: 1 | Y12: 0 | Z12: 0 | AA12: 87 | AB12: 14 | AC12: 621.42857142857144 | AD12: 4
A13: WILLIAMSTOWN | C13: W OUTEN | F13: J CALDWELL | J13: McKAY | L13: GIBBS | N13: BRIGGS | P13: TYRELL | W13: BRUNSWICK | X13: 1 | Y13: 0 | Z13: 0 | AA13: 121 | AB13: 30 | AC13: 403.33333333333331 | AD13: 4
A14: PORT MELBOURNE | C14: BROWN | F14: WILLIAMSON | J14: WARD | L14: COEN | N14: WEATE | P14: BRERETON | W14: ESSENDON ASSOC. | X14: 1 | Y14: 0 | Z14: 0 | AA14: 105 | AB14: 43 | AC14: 244.18604651162789 | AD14: 4
A15: GOALKICKERS
A16: WILLIAMSTOWN | C16: ADDISON 3 | F16: BRIGGS 2 | H16: CARRIE | J16: FAIRCHILD | M16: JONES | N16: A CALDWELL | Q16: J CALDWELL | T16: GIBBS | W16: FOOTSCRAY | X16: 1 | Y16: 0 | Z16: 0 | AA16: 61 | AB16: 43 | AC16: 141.86046511627907 | AD16: 4
A17: PORT MELBOURNE | C17: CLARKE | W17: PRESTON | X17: 0 | Y17: 1 | Z17: 0 | AA17: 43 | AB17: 61 | AC17: 70.491803278688522 | AD17: 0
W18: BRIGHTON | X18: 0 | Y18: 1 | Z18: 0 | AA18: 43 | AB18: 105 | AC18: 40.952380952380949 | AD18: 0
A19: FOOTSCRAY | C19: 3 | D19: 3 | E19: =C19*6+D19 -> 21 | G19: 3 | H19: 3 | I19: =G19*6+H19 -> 21 | K19: 7 | L19: 5 | M19: =K19*6+L19 -> 47 | O19: 9 | P19: 7 | Q19: =O19*6+P19 -> 61 | S19: PRESTON | W19: NORTHCOTE | X19: 0 | Y19: 1 | Z19: 0 | AA19: 30 | AB19: 121 | AC19: 24.793388429752067 | AD19: 0
A20: PRESTON | C20: 0 | D20: 1 | E20: =C20*6+D20 -> 1 | G20: 2 | H20: 6 | I20: =G20*6+H20 -> 18 | K20: 4 | L20: 6 | M20: =K20*6+L20 -> 30 | O20: 6 | P20: 7 | Q20: =O20*6+P20 -> 43 | S20: WOOLFE | W20: NORTH MELBOURNE | X20: 0 | Y20: 1 | Z20: 0 | AA20: 14 | AB20: 87 | AC20: 16.091954022988507 | AD20: 0
A21: BEST PLAYERS | W21: PORT MELBOURNE | X21: 0 | Y21: 1 | Z21: 0 | AA21: 9 | AB21: 76 | AC21: 11.842105263157896 | AD21: 0
A22: FOOTSCRAY | D22: SEVIOR | F22: COTTON | I22: McKINLEY | L22: F GREGORY | O22: J NEYLON | R22: NEILSON
A23: PRESTON | D23: S HALL | F23: TOMKINS | I23: HENDRIE | L23: PUNCH | O23: STANLAKE | R23: WHITE
A24: GOALKICKERS
A25: FOOTSCRAY | D25: HUTCHINSON 4 | H25: LACEY | J25: COTTON | L25: ELLIOTT | O25: EGAN | Q25: NEILSON
A26: PRESTON | D26: S HALL | G26: ROWE | I26: PUNCH | K26: OGDEN | N26: WHITE | P26: TOMKINS
A28: PRAHRAN | C28: 0 | D28: 2 | E28: =C28*6+D28 -> 2 | G28: 6 | H28: 3 | I28: =G28*6+H28 -> 39 | K28: 7 | L28: 7 | M28: =K28*6+L28 -> 49 | O28: 13 | P28: 9 | Q28: =O28*6+P28 -> 87 | S28: TOORAK PARK
A29: NORTH MELBOURNE | C29: 0 | D29: 1 | E29: =C29*6+D29 -> 1 | G29: 0 | H29: 4 | I29: =G29*6+H29 -> 4 | K29: 1 | L29: 8 | M29: =K29*6+L29 -> 14 | O29: 1 | P29: 8 | Q29: =O29*6+P29 -> 14 | S29: VILLAIN
A30: BEST PLAYERS
A31: PRAHRAN | D31: BUIST | G31: BOYLAND | J31: TURNER | M31: CARLSON | P31: FARMER | R31: SMITH
A32: NORTH MELBOURNE | D32: SPEAKMAN | G32: KEATING | J32: LEWIS | M32: JAMIESON | P32: PRATT | R32: P KENNEDY
A33: GOALKICKERS
A34: PRAHRAN | D34: SYKES 7 | G34: BOYLAND 2 | J34: FARMER 2 | M34: WATTS | O34: BACKWAY
A35: NORTH MELBOURNE | D35: JACKSON
A37: BRUNSWICK | C37: 3 | D37: 7 | E37: =C37*6+D37 -> 25 | G37: 8 | H37: 9 | I37: =G37*6+H37 -> 57 | K37: 11 | L37: 13 | M37: =K37*6+L37 -> 79 | O37: 17 | P37: 19 | Q37: =O37*6+P37 -> 121 | S37: BRUNSWICK
A38: NORTHCOTE | C38: 1 | D38: 0 | E38: =C38*6+D38 -> 6 | G38: 2 | H38: 1 | I38: =G38*6+H38 -> 13 | K38: 3 | L38: 2 | M38: =K38*6+L38 -> 20 | O38: 4 | P38: 6 | Q38: =O38*6+P38 -> 30 | S38: HURLEY
A39: BEST PLAYERS
A40: BRUNSWICK | D40: CHASE | G40: STANCLIFFE | J40: L BRAID | M40: R BALFE | P40: S BALFE | S40: HUTCHINSON
A41: NORTHCOTE | D41: HOLMES | G41: HELWIG | J41: PRATT | M41: KEOGH | P41: CORLETT | S41: GRATION
A42: GOALKICKERS
A43: BRUNSWICK | D43: CLEMENTS 10 | H43: CHASE 2 | K43: THOMAS 2 | N43: L BRAID | P43: S BALFE | S43: WHITFIELD
A44: NORTHCOTE | D44: GRATION 2 | H44: CORLETT | K44: PRATT
A46: ESSENDON ASSOC. | C46: 4 | D46: 3 | E46: =C46*6+D46 -> 27 | G46: 7 | H46: 5 | I46: =G46*6+H46 -> 47 | K46: 12 | L46: 17 | M46: =K46*6+L46 -> 89 | O46: 14 | P46: 21 | Q46: =O46*6+P46 -> 105 | S46: BRIGHTON
A47: BRIGHTON | C47: 0 | D47: 0 | E47: =C47*6+D47 -> 0 | G47: 4 | H47: 2 | I47: =G47*6+H47 -> 26 | K47: 4 | L47: 2 | M47: =K47*6+L47 -> 26 | O47: 6 | P47: 7 | Q47: =O47*6+P47 -> 43 | S47: SOUTER
A48: BEST PLAYERS
A49: ESSENDON ASSOC. | D49: HAMBRIDGE | G49: McINTYRE | K49: BENNETT | N49: MONAGLE | Q49: BURDUE | T49: GOUGH
A50: BRIGHTON | D50: DANGERFIELD | G50: W ROBINSON | K50: G ROBINSON | N50: RAPP | Q50: McCLEERY | T50: JAMES
A51: GOALKICKERS
A52: ESSENDON ASSOC. | D52: GRANT 3 | G52: WILLIAMS 3 | J52: BARLOW 2 | M52: BENNETT 2 | P52: BURDUE 2 | S52: HAMBRIDGE | V52: MADDEN
A53: BRIGHTON | D53: DANGERFIELD 2 | H53: YOUNG | J53: HEWITT | M53: SCALES | O53: LAWSON
A55: ROUND 2 | E55: 2ND MAY | J55: WEATHER | N55: FINE | X55: LADDER | AB55: ROUND | AD55: 2
D56: 1ST QTR | H56: 2ND QTR | L56: 3RD QTR | P56: FINAL | S56: PLAYED AT
A57: BRUNSWICK | C57: 0 | D57: 8 | E57: =C57*6+D57 -> 8 | G57: 2 | H57: 14 | I57: =G57*6+H57 -> 26 | K57: 4 | L57: 18 | M57: =K57*6+L57 -> 42 | O57: 5 | P57: 23 | Q57: =O57*6+P57 -> 53 | S57: TOORAK PARK | W57: TEAM | X57: W | Y57: L | Z57: D | AA57: FOR | AB57: AGST | AC57: % | AD57: PTS
A58: PRAHRAN | C58: 2 | D58: 4 | E58: =C58*6+D58 -> 16 | G58: 5 | H58: 7 | I58: =G58*6+H58 -> 37 | K58: 5 | L58: 9 | M58: =K58*6+L58 -> 39 | O58: 5 | P58: 13 | Q58: =O58*6+P58 -> 43 | S58: UMPIRE
A59: BEST PLAYERS | S59: KENDALL | W59: ESSENDON ASSOC. | X59: 2 | Y59: 0 | Z59: 0 | AA59: 247 | AB59: 89 | AC59: 277.52808988764048 | AD59: 8
A60: BRUNSWICK | D60: MONOHAN | G60: TAME | J60: R BALFE | L60: JOHNSON | O60: S BALFE | R60: L BRAID | W60: WILLIAMSTOWN | X60: 2 | Y60: 0 | Z60: 0 | AA60: 136 | AB60: 54 | AC60: 251.85185185185185 | AD60: 8
A61: PRAHRAN | D61: BENNION | G61: BOYLAND | J61: NEIL | L61: CARLSON | O61: WATTS | R61: TURNER | W61: BRUNSWICK | X61: 2 | Y61: 0 | Z61: 0 | AA61: 174 | AB61: 73 | AC61: 238.35616438356163 | AD61: 8
A62: GOALKICKERS | W62: FOOTSCRAY | X62: 2 | Y62: 0 | Z62: 0 | AA62: 115 | AB62: 63 | AC62: 182.53968253968253 | AD62: 8
A63: BRUNSWICK | D63: CLEMENTS 3 | H63: L BRAID 2
A64: PRAHRAN | D64: BENNION 2 | H64: McKINLEY | K64: SYKES | N64: SMITH | W64: PRAHRAN | X64: 1 | Y64: 1 | Z64: 0 | AA64: 130 | AB64: 67 | AC64: 194.02985074626866 | AD64: 4
W65: BRIGHTON | X65: 1 | Y65: 1 | Z65: 0 | AA65: 123 | AB65: 144 | AC65: 85.416666666666671 | AD65: 4
A66: WILLIAMSTOWN | C66: 0 | D66: 0 | E66: =C66*6+D66 -> 0 | G66: 4 | H66: 7 | I66: =G66*6+H66 -> 31 | K66: 6 | L66: 7 | M66: =K66*6+L66 -> 43 | O66: 8 | P66: 12 | Q66: =O66*6+P66 -> 60 | S66: WILLIAMSTOWN | W66: PRESTON | X66: 0 | Y66: 2 | Z66: 0 | AA66: 88 | AB66: 121 | AC66: 72.727272727272734 | AD66: 0
A67: PRESTON | C67: 2 | D67: 7 | E67: =C67*6+D67 -> 19 | G67: 2 | H67: 7 | I67: =G67*6+H67 -> 19 | K67: 4 | L67: 9 | M67: =K67*6+L67 -> 33 | O67: 6 | P67: 9 | Q67: =O67*6+P67 -> 45 | S67: MURPHY | W67: NORTHCOTE | X67: 0 | Y67: 2 | Z67: 0 | AA67: 69 | AB67: 201 | AC67: 34.328358208955223 | AD67: 0
A68: BEST PLAYERS | W68: PORT MELBOURNE | X68: 0 | Y68: 2 | Z68: 0 | AA68: 55 | AB68: 218 | AC68: 25.229357798165136 | AD68: 0
A69: WILLIAMSTOWN | D69: M OUTEN | G69: A CALDWELL | J69: J CALDWELL | M69: BRIGGS | P69: PINCOTT | R69: ADDISON | W69: NORTH MELBOURNE | X69: 0 | Y69: 2 | Z69: 0 | AA69: 34 | AB69: 141 | AC69: 24.113475177304963 | AD69: 0
A70: PRESTON | D70: TOMKINS | G70: BROWN | J70: WATSON | M70: STANLAKE | P70: OGDEN | R70: WHITE
A71: GOALKICKERS
A72: WILLIAMSTOWN | D72: GIBBS 2 | G72: FAIRCHILD | J72: JONES | L72: LEWIS | N72: BRIGGS | P72: CARRIE | R72: ADDISON
A73: PRESTON | D73: S HALL | G73: TOMKINS | J73: WHITE | L73: HANNON | N73: HENDRIE | P73: PUNCH
A75: BRIGHTON | C75: 1 | D75: 1 | E75: =C75*6+D75 -> 7 | G75: 4 | H75: 4 | I75: =G75*6+H75 -> 28 | K75: 9 | L75: 4 | M75: =K75*6+L75 -> 58 | O75: 12 | P75: 8 | Q75: =O75*6+P75 -> 80 | S75: NORTHCOTE
A76: NORTHCOTE | C76: 2 | D76: 3 | E76: =C76*6+D76 -> 15 | G76: 2 | H76: 3 | I76: =G76*6+H76 -> 15 | K76: 3 | L76: 6 | M76: =K76*6+L76 -> 24 | O76: 5 | P76: 9 | Q76: =O76*6+P76 -> 39 | S76: KRUSE
A77: BEST PLAYERS
A78: BRIGHTON | D78: DANGERFIELD | G78: REID | I78: CANT | L78: W ROBINSON | O78: G ROBINSON | R78: PIERCE
A79: NORTHCOTE | D79: KEOGH | G79: PRATT | I79: CORLETT | L79: HELWIG | O79: BECK
A80: GOALKICKERS
A81: BRIGHTON | D81: CANT 4 | G81: W ROBINSON 2 | J81: DANGERFIELD | M81: REID | N81: COX | P81: PIERCE | R81: MILLS | T81: KENNEDY
A82: NORTHCOTE | D82: EDMOND 2 | G82: BECK | J82: HELWIG | L82: PRATT
A84: FOOTSCRAY | C84: 1 | D84: 6 | E84: =C84*6+D84 -> 12 | G84: 2 | H84: 10 | I84: =G84*6+H84 -> 22 | K84: 2 | L84: 14 | M84: =K84*6+L84 -> 26 | O84: 6 | P84: 18 | Q84: =O84*6+P84 -> 54 | S84: NORTH MELB
A85: NORTH MELBOURNE | C85: 1 | D85: 1 | E85: =C85*6+D85 -> 7 | G85: 1 | H85: 1 | I85: =G85*6+H85 -> 7 | K85: 2 | L85: 1 | M85: =K85*6+L85 -> 13 | O85: 3 | P85: 2 | Q85: =O85*6+P85 -> 20 | S85: WOOLFE
A86: BEST PLAYERS
A87: FOOTSCRAY | D87: HUTCHINSON | G87: SEVIOR | J87: COTTON | M87: A GREGORY | P87: McKINLEY | S87: LAUNDER
A88: NORTH MELBOURNE | D88: ROLENT | G88: STAINER | J88: JAMIESON | M88: HOLDEN | P88: LEWIS
A89: GOALKICKERS
A90: FOOTSCRAY | D90: HUTCHINSON 4 | H90: A GREGORY | K90: COTTON
A91: NORTH MELBOURNE | D91: JACKSON | H91: HOLDEN | K91: H DARBY
A93: ESSENDON ASSOC. | C93: 2 | D93: 7 | E93: =C93*6+D93 -> 19 | G93: 5 | H93: 13 | I93: =G93*6+H93 -> 43 | K93: 14 | L93: 17 | M93: =K93*6+L93 -> 101 | O93: 20 | P93: 23 | Q93: =O93*6+P93 -> 143 | S93: ESSENDON
A94: PORT MELBOURNE | C94: 0 | D94: 0 | E94: =C94*6+D94 -> 0 | G94: 3 | H94: 2 | I94: =G94*6+H94 -> 20 | K94: 4 | L94: 2 | M94: =K94*6+L94 -> 26 | O94: 7 | P94: 4 | Q94: =O94*6+P94 -> 46 | S94: HURLEY
A95: BEST PLAYERS
A96: ESSENDON ASSOC. | D96: CHISHOLM | H96: HAMBRIDGE | K96: MADDEN | N96: WRIGHT | Q96: McINTYRE | T96: BARLOW
A97: PORT MELBOURNE | D97: BROWN | H97: WEATE | K97: JOHNSON | N97: WARD | Q97: TREGLOWN | T97: BRERETON
A98: GOALKICKERS
A99: ESSENDON ASSOC. | D99: TROTTER 5 | G99: BARLOW 3 | J99: HAMBRIDGE 3 | M99: BURDUE 2 | P99: GOUGH 2 | R99: DYSON 2 | U99: GRANT | W99: BENNETT | X99: MUNDAY
A100: PORT MELBOURNE | D100: PAMPERIN 2 | H100: SIMMONDS | K100: TREGLOWN
A102: ROUND 3 | E102: 9TH MAY | J102: WEATHER | N102: SOUTH EAST BREEZE FINE | S102: PLAYED AT | X102: LADDER | AB102: ROUND | AD102: 3
D103: 1ST QTR | H103: 2ND QTR | L103: 3RD QTR | P103: FINAL | S103: ESSENDON
A104: ESSENDON ASSOC. | C104: 3 | D104: 2 | E104: =C104*6+D104 -> 20 | G104: 8 | H104: 3 | I104: =G104*6+H104 -> 51 | K104: 9 | L104: 3 | M104: =K104*6+L104 -> 57 | O104: 10 | P104: 4 | Q104: =O104*6+P104 -> 64 | S104: UMPIRE | W104: TEAM | X104: W | Y104: L | Z104: D | AA104: FOR | AB104: AGST | AC104: % | AD104: PTS
A105: WILLIAMSTOWN | C105: 2 | D105: 1 | E105: =C105*6+D105 -> 13 | G105: 2 | H105: 1 | I105: =G105*6+H105 -> 13 | K105: 4 | L105: 1 | M105: =K105*6+L105 -> 25 | O105: 9 | P105: 3 | Q105: =O105*6+P105 -> 57 | S105: KENDALL
A106: BEST PLAYERS | W106: BRUNSWICK | X106: 3 | Y106: 0 | Z106: 0 | AA106: 286 | AB106: 127 | AC106: 225.1968503937008 | AD106: 12
A107: ESSENDON ASSOC. | D107: MONAGLE | G107: McINTYRE | J107: BENNETT | M107: TROTTER | P107: BURDUE | S107: GOUGH | W107: ESSENDON ASSOC. | X107: 3 | Y107: 0 | Z107: 0 | AA107: 311 | AB107: 146 | AC107: 213.01369863013699 | AD107: 12
A108: WILLIAMSTOWN | D108: W OUTEN | G108: M OUTEN | J108: GARBUTT | M108: ALLEY | P108: McKAY | S108: JOHNSON | W108: FOOTSCRAY | X108: 3 | Y108: 0 | Z108: 0 | AA108: 178 | AB108: 112 | AC108: 158.92857142857142 | AD108: 12
A109: GOALKICKERS | W109: PRAHRAN | X109: 2 | Y109: 1 | Z109: 0 | AA109: 228 | AB109: 95 | AC109: 240 | AD109: 8
A110: ESSENDON ASSOC. | D110: BARLOW 3 | G110: TROTTER 3 | J110: MONAGLE 2 | M110: BURDUE | O110: HAMBRIDGE
A111: WILLIAMSTOWN | D111: BRIGGS 4 | G111: JOHNSON 2 | J111: FAIRCHILD | M111: ADDISON | O111: J CALDWELL | W111: WILLIAMSTOWN | X111: 2 | Y111: 1 | Z111: 0 | AA111: 193 | AB111: 118 | AC111: 163.5593220338983 | AD111: 8
W112: PRESTON | X112: 1 | Y112: 2 | Z112: 0 | AA112: 154 | AB112: 174 | AC112: 88.505747126436788 | AD112: 4
A113: FOOTSCRAY | C113: 2 | D113: 3 | E113: =C113*6+D113 -> 15 | G113: 4 | H113: 5 | I113: =G113*6+H113 -> 29 | K113: 7 | L113: 10 | M113: =K113*6+L113 -> 52 | O113: 9 | P113: 10 | Q113: =O113*6+P113 -> 64 | S113: FOOTSCRAY | W113: BRIGHTON | X113: 1 | Y113: 2 | Z113: 0 | AA113: 172 | AB113: 207 | AC113: 83.091787439613526 | AD113: 4
A114: BRIGHTON | C114: 3 | D114: 0 | E114: =C114*6+D114 -> 18 | G114: 3 | H114: 4 | I114: =G114*6+H114 -> 22 | K114: 4 | L114: 5 | M114: =K114*6+L114 -> 29 | O114: 7 | P114: 7 | Q114: =O114*6+P114 -> 49 | S114: HURLEY | W114: PORT MELBOURNE | X114: 0 | Y114: 3 | Z114: 0 | AA114: 108 | AB114: 284 | AC114: 38.028169014084504 | AD114: 0
A115: BEST PLAYERS | W115: NORTH MELBOURNE | X115: 0 | Y115: 3 | Z115: 0 | AA115: 88 | AB115: 253 | AC115: 34.782608695652172 | AD115: 0
A116: FOOTSCRAY | D116: J NEYLON | G116: HARRIS | J116: McCARTHY | M116: COTTON | P116: LAUNDER | S116: McDONALD | W116: NORTHCOTE | X116: 0 | Y116: 3 | Z116: 0 | AA116: 97 | AB116: 299 | AC116: 32.441471571906355 | AD116: 0
A117: BRIGHTON | D117: DANGERFIELD | G117: ARMSTRONG | J117: MILLS | M117: G ROBINSON | P117: W ROBINSON | S117: HEWITT
A118: GOALKICKERS
A119: FOOTSCRAY | D119: McDONALD 2 | G119: HUTCHINSON 2 | J119: LAUNDER | M119: J NEYLON | P119: GLUYAS | R119: COTTON | T119: EGAN
A120: BRIGHTON | D120: MILLS 2 | G120: DANGERFIELD | J120: ARMSTRONG | M120: CANT | O120: W ROBINSON | R120: COX
A122: PRAHRAN | C122: 2 | D122: 7 | E122: =C122*6+D122 -> 19 | G122: 4 | H122: 12 | I122: =G122*6+H122 -> 36 | K122: 9 | L122: 16 | M122: =K122*6+L122 -> 70 | O122: 13 | P122: 20 | Q122: =O122*6+P122 -> 98 | S122: NORTHCOTE
A123: NORTHCOTE | C123: 1 | D123: 0 | E123: =C123*6+D123 -> 6 | G123: 3 | H123: 3 | I123: =G123*6+H123 -> 21 | K123: 3 | L123: 3 | M123: =K123*6+L123 -> 21 | O123: 4 | P123: 4 | Q123: =O123*6+P123 -> 28 | S123: SOUTER
A124: BEST PLAYERS
A125: PRAHRAN | D125: JOHNSON | G125: FERGUSON | J125: BOYLAND | M125: BENNION | P125: WATTS | S125: BUIST
A126: NORTHCOTE | D126: CAMPBELL | G126: FLYNN | J126: VERNON | M126: HELWIG | P126: CHESSWASS | S126: MAINE
A127: GOALKICKERS
A128: PRAHRAN | D128: SYKES 4 | G128: McCONACHIE 4 | K128: WATTS 3 | N128: HAIGHBLOOM 2
A129: NORTHCOTE | D129: MAINE 2 | G129: COLE | J129: KEOGH
A131: PRESTON | C131: 4 | D131: 1 | E131: =C131*6+D131 -> 25 | G131: 6 | H131: 4 | I131: =G131*6+H131 -> 40 | K131: 7 | L131: 8 | M131: =K131*6+L131 -> 50 | O131: 9 | P131: 12 | Q131: =O131*6+P131 -> 66 | S131: PORT MELB
A132: PORT MELBOURNE | C132: 1 | D132: 2 | E132: =C132*6+D132 -> 8 | G132: 5 | H132: 3 | I132: =G132*6+H132 -> 33 | K132: 5 | L132: 5 | M132: =K132*6+L132 -> 35 | O132: 8 | P132: 5 | Q132: =O132*6+P132 -> 53 | S132: MURPHY
A133: BEST PLAYERS
A134: PRESTON | D134: PUNCH | G134: HENDRIE | J134: WHITE | M134: TOMKINS | P134: BROWN | S134: HOWARD
A135: PORT MELBOURNE | D135: PASH | G135: TREGLOWN | J135: PAMPERIN | M135: FRANKLIN | P135: CLARKE | S135: BRERETON
A136: GOALKICKERS
A137: PRESTON | D137: PUNCH 3 | G137: HENDRIE 2 | K137: ROWE 2 | N137: OGDEN | P137: BAYLISS
A138: PORT MELBOURNE | D138: CLARKE 3 | G138: SIMMONDS 2 | K138: BRERETON 2 | O138: HILL
A140: BRUNSWICK | C140: 4 | D140: 1 | E140: =C140*6+D140 -> 25 | G140: 8 | H140: 5 | I140: =G140*6+H140 -> 53 | K140: 13 | L140: 9 | M140: =K140*6+L140 -> 87 | O140: 17 | P140: 10 | Q140: =O140*6+P140 -> 112 | S140: BRUNSWICK
A141: NORTH MELBOURNE | C141: 1 | D141: 0 | E141: =C141*6+D141 -> 6 | G141: 3 | H141: 3 | I141: =G141*6+H141 -> 21 | K141: 4 | L141: 9 | M141: =K141*6+L141 -> 33 | O141: 7 | P141: 12 | Q141: =O141*6+P141 -> 54 | S141: VILLAIN
A142: BEST PLAYERS
A143: BRUNSWICK | D143: L BRAID | G143: TAME | J143: STANCLIFFE | M143: JOHNSTON | P143: CLEMENTS | S143: MONOHAN
A144: NORTH MELBOURNE | D144: HARDY | G144: STAINER | J144: McKENZIE | M144: PRATT | P144: KEATING | S144: H DARBY
A145: GOALKICKERS
A146: BRUNSWICK | D146: L BRAID 7 | G146: THOMAS 3 | J146: S BALFE 3 | M146: CLEMENTS 2 | P146: JOHNSTON 2
A147: NORTH MELBOURNE | D147: ARMSTRONG 3 | G147: HARDY 2 | J147: TWOMEY 2
A149: ROUND 4 | E149: 16TH MAY | J149: WEATHER | N149: NORTH BREEZE | S149: PLAYED AT | X149: LADDER | AB149: ROUND | AD149: 4
D150: 1ST QTR | H150: 2ND QTR | L150: 3RD QTR | P150: FINAL | S150: ESSENDON
A151: ESSENDON ASSOC. | C151: 3 | D151: 5 | E151: =C151*6+D151 -> 23 | G151: 7 | H151: 8 | I151: =G151*6+H151 -> 50 | K151: 10 | L151: 10 | M151: =K151*6+L151 -> 70 | O151: 12 | P151: 15 | Q151: =O151*6+P151 -> 87 | S151: UMPIRE | W151: TEAM | X151: W | Y151: L | Z151: D | AA151: FOR | AB151: AGST | AC151: % | AD151: PTS
A152: BRUNSWICK | C152: 3 | D152: 1 | E152: =C152*6+D152 -> 19 | G152: 4 | H152: 1 | I152: =G152*6+H152 -> 25 | K152: 5 | L152: 3 | M152: =K152*6+L152 -> 33 | O152: 8 | P152: 4 | Q152: =O152*6+P152 -> 52 | S152: LYON
A153: BEST PLAYERS | W153: ESSENDON ASSOC. | X153: 4 | Y153: 0 | Z153: 0 | AA153: 398 | AB153: 198 | AC153: 201.01010101010101 | AD153: 16
A154: ESSENDON ASSOC. | D154: MADDEN | G154: GOUGH | J154: WRIGHT | M154: WILLIAMS | P154: McINTYRE | S154: BENNETT | W154: PRAHRAN | X154: 3 | Y154: 1 | Z154: 0 | AA154: 283 | AB154: 136 | AC154: 208.08823529411765 | AD154: 12
A155: BRUNSWICK | D155: STANCLIFFE | G155: JOHNSON | J155: THOMAS | M155: MONOHAN | P155: L BRAID | S155: O'SHEA | W155: BRUNSWICK | X155: 3 | Y155: 1 | Z155: 0 | AA155: 338 | AB155: 214 | AC155: 157.94392523364485 | AD155: 12
A156: GOALKICKERS | W156: WILLIAMSTOWN | X156: 3 | Y156: 1 | Z156: 0 | AA156: 251 | AB156: 165 | AC156: 152.12121212121212 | AD156: 12
A157: ESSENDON ASSOC. | D157: TROTTER 4) | G157: BARLOW 3 | J157: HAMBRIDGE 2 | M157: MONAGLE | O157: CHEFFERS | Q157: MUNDAY
A158: BRUNSWICK | D158: CLEMENTS 3 | G158: THOMAS 3 | J158: L BRAID 2 | W158: FOOTSCRAY | X158: 3 | Y158: 1 | Z158: 0 | AA158: 219 | AB158: 167 | AC158: 131.13772455089821 | AD158: 12
W159: PRESTON | X159: 2 | Y159: 2 | Z159: 0 | AA159: 245 | AB159: 219 | AC159: 111.87214611872146 | AD159: 8
A160: PRAHRAN | C160: 2 | D160: 2 | E160: =C160*6+D160 -> 14 | G160: 3 | H160: 3 | I160: =G160*6+H160 -> 21 | K160: 5 | L160: 9 | M160: =K160*6+L160 -> 39 | O160: 7 | P160: 13 | Q160: =O160*6+P160 -> 55 | S160: TOORAK PARK | W160: BRIGHTON | X160: 1 | Y160: 3 | Z160: 0 | AA160: 219 | AB160: 265 | AC160: 82.64150943396227 | AD160: 4
A161: FOOTSCRAY | C161: 4 | D161: 1 | E161: =C161*6+D161 -> 25 | G161: 5 | H161: 4 | I161: =G161*6+H161 -> 34 | K161: 5 | L161: 4 | M161: =K161*6+L161 -> 34 | O161: 6 | P161: 5 | Q161: =O161*6+P161 -> 41 | S161: KENDALL | W161: NORTH MELBOURNE | X161: 1 | Y161: 3 | Z161: 0 | AA161: 134 | AB161: 293 | AC161: 45.733788395904433 | AD161: 4
A162: BEST PLAYERS | W162: PORT MELBOURNE | X162: 0 | Y162: 4 | Z162: 0 | AA162: 148 | AB162: 330 | AC162: 44.848484848484851 | AD162: 0
A163: PRAHRAN | D163: SHERRY | G163: BROWN | J163: RANKIN | M163: CARLSON | P163: BUIST | S163: BOYLAND | W163: NORTHCOTE | X163: 0 | Y163: 4 | Z163: 0 | AA163: 142 | AB163: 390 | AC163: 36.410256410256409 | AD163: 0
A164: FOOTSCRAY | D164: EGAN | G164: HARRIS | J164: McCARTHY | M164: MARMO | P164: BORTHWICK | S164: ELLIOTT
A165: GOALKICKERS
A166: PRAHRAN | D166: SHERRY 4 | G166: SYKES 2 | J166: BOYLAND
A167: FOOTSCRAY | D167: HUTCHINSON 2 | H167: LAUNDER | K167: NEILSON | N167: McDONALD | Q167: COTTON
A169: WILLIAMSTOWN | C169: 1 | D169: 3 | E169: =C169*6+D169 -> 9 | G169: 2 | H169: 3 | I169: =G169*6+H169 -> 15 | K169: 3 | L169: 9 | M169: =K169*6+L169 -> 27 | O169: 8 | P169: 12 | Q169: 60 | S169: BRIGHTON
A170: BRIGHTON | C170: 2 | D170: 6 | E170: =C170*6+D170 -> 18 | G170: 4 | H170: 8 | I170: =G170*6+H170 -> 32 | K170: 6 | L170: 10 | M170: =K170*6+L170 -> 46 | O170: 6 | P170: 10 | Q170: 46 | S170: VILLAIN
A171: BEST PLAYERS
A172: WILLIAMSTOWN | D172: ALLEY | G172: W OUTEN | J172: M OUTEN | M172: BRIGGS | P172: TYRELL | S172: GARBUTT
A173: BRIGHTON | D173: KENNEDY | G173: F ROBINSON | J173: DANGERFIELD | M173: W ROBINSON | P173: G ROBINSON | S173: ARMSTRONG
A174: GOALKICKERS
A175: WILLIAMSTOWN | D175: BRIGGS 4 | G175: J CALDWELL 2 | K175: TYRELL 2
A176: BRIGHTON | D176: DANGERFIELD 2 | H176: W ROBINSON | K176: CANT | M176: ARMSTRONG | P176: PIERCE
A178: NORTH MELBOURNE | C178: 1 | D178: 4 | E178: =C178*6+D178 -> 10 | G178: 2 | H178: 7 | I178: =G178*6+H178 -> 19 | K178: 4 | L178: 7 | M178: =K178*6+L178 -> 31 | O178: 6 | P178: 10 | Q178: =O178*6+P178 -> 46 | S178: NORTH MELB
A179: PORT MELBOURNE | C179: 1 | D179: 2 | E179: =C179*6+D179 -> 8 | G179: 2 | H179: 6 | I179: =G179*6+H179 -> 18 | K179: 2 | L179: 9 | M179: =K179*6+L179 -> 21 | O179: 5 | P179: 10 | Q179: =O179*6+P179 -> 40 | S179: HURLEY
A180: BEST PLAYERS
A181: NORTH MELBOURNE | D181: SPEAKMAN | G181: H DARBY | J181: F DARBY | M181: KEATING | P181: ARMSTRONG | S181: JAMIESON
A182: PORT MELBOURNE | D182: SIMMONDS | G182: CURTIS | J182: CLARKE | M182: PASH | P182: FRANKLIN | S182: BROWN
A183: GOALKICKERS
A184: NORTH MELBOURNE | D184: MORAN 2 | G184: KEATING | J184: HARDY | L184: F DARBY | O184: TWOMEY
A185: PORT MELBOURNE | D185: BRERETON 2 | H185: PAMPERIN | K185: WILLIAMSON | N185: CLARKE
A187: PRESTON | C187: 5 | D187: 5 | E187: =C187*6+D187 -> 35 | G187: 7 | H187: 7 | I187: =G187*6+H187 -> 49 | K187: 11 | L187: 12 | M187: =K187*6+L187 -> 78 | O187: 13 | P187: 13 | Q187: =O187*6+P187 -> 91 | S187: PRESTON
A188: NORTHCOTE | C188: 0 | D188: 0 | E188: =C188*6+D188 -> 0 | G188: 2 | H188: 1 | I188: =G188*6+H188 -> 13 | K188: 3 | L188: 5 | M188: =K188*6+L188 -> 23 | O188: 6 | P188: 9 | Q188: =O188*6+P188 -> 45 | S188: MURPHY
A189: BEST PLAYERS
A190: PRESTON | D190: PUNCH | G190: TOMKINS | J190: HOWARD | M190: OGDEN | O190: YEOMANS | R190: BROWN
A191: NORTHCOTE | D191: VERNON | G191: CRENNION | J191: CHESSWASS | M191: PRATT | O191: COLE | R191: ORR
A192: GOALKICKERS
A193: PRESTON | D193: PUNCH 5 | G193: OGDEN 3 | J193: LAMBERT 2 | M193: TOMKINS | O193: HENDRIE | R193: STANLAKE
A194: NORTHCOTE | D194: PRATT 2 | G194: BRENNAN | J194: FLYNN | L194: EDMONDS | O194: HOLLIS
A196: ROUND 5 | E196: 23RD MAY | J196: WEATHER | N196: NORTH BREEZE | S196: PLAYED AT | X196: LADDER | AB196: ROUND | AD196: 5
D197: 1ST QTR | H197: 2ND QTR | L197: 3RD QTR | P197: FINAL | S197: WILLIAMSTOWN
A198: WILLIAMSTOWN | C198: 2 | D198: 4 | E198: =C198*6+D198 -> 16 | G198: 3 | H198: 9 | I198: =G198*6+H198 -> 27 | K198: 5 | L198: 10 | M198: =K198*6+L198 -> 40 | O198: 5 | P198: 11 | Q198: =O198*6+P198 -> 41 | S198: UMPIRE | W198: TEAM | X198: W | Y198: L | Z198: D | AA198: FOR | AB198: AGST | AC198: % | AD198: PTS
A199: PRAHRAN | C199: 1 | D199: 1 | E199: =C199*6+D199 -> 7 | G199: 1 | H199: 1 | I199: =G199*6+H199 -> 7 | K199: 1 | L199: 2 | M199: =K199*6+L199 -> 8 | O199: 3 | P199: 8 | Q199: =O199*6+P199 -> 26 | S199: SOUTER
A200: BEST PLAYERS | W200: ESSENDON ASSOC. | X200: 5 | Y200: 0 | Z200: 0 | AA200: 498 | AB200: 251 | AC200: 198.40637450199202 | AD200: 20
A201: WILLIAMSTOWN | D201: W OUTEN | G201: ALLEY | J201: MONAR | M201: McKAY | O201: FAIRCHILD | R201: J CALDWELL | W201: WILLIAMSTOWN | X201: 4 | Y201: 1 | Z201: 0 | AA201: 292 | AB201: 191 | AC201: 152.87958115183247 | AD201: 16
A202: PRAHRAN | D202: BROWN | G202: NEIL | J202: SMITH | M202: CULLEN | O202: CARLSON | R202: BOYLAND | W202: FOOTSCRAY | X202: 4 | Y202: 1 | Z202: 0 | AA202: 269 | AB202: 194 | AC202: 138.65979381443299 | AD202: 16
A203: GOALKICKERS | W203: PRAHRAN | X203: 3 | Y203: 2 | Z203: 0 | AA203: 309 | AB203: 177 | AC203: 174.57627118644066 | AD203: 12
A204: WILLIAMSTOWN
A205: PRAHRAN | W205: BRUNSWICK | X205: 3 | Y205: 2 | Z205: 0 | AA205: 365 | AB205: 264 | AC205: 138.25757575757575 | AD205: 12
W206: PRESTON | X206: 2 | Y206: 3 | Z206: 0 | AA206: 298 | AB206: 319 | AC206: 93.416927899686527 | AD206: 8
A207: FOOTSCRAY | C207: 2 | D207: 1 | E207: =C207*6+D207 -> 13 | G207: 2 | H207: 3 | I207: =G207*6+H207 -> 15 | K207: 4 | L207: 6 | M207: =K207*6+L207 -> 30 | O207: 7 | P207: 8 | Q207: =O207*6+P207 -> 50 | S207: BRUNSWICK | W207: NORTH MELBOURNE | X207: 2 | Y207: 3 | Z207: 0 | AA207: 192 | AB207: 346 | AC207: 55.491329479768787 | AD207: 8
A208: BRUNSWICK | C208: 1 | D208: 4 | E208: =C208*6+D208 -> 10 | G208: 2 | H208: 6 | I208: =G208*6+H208 -> 18 | K208: 3 | L208: 7 | M208: =K208*6+L208 -> 25 | O208: 3 | P208: 9 | Q208: =O208*6+P208 -> 27 | S208: KENDALL | W208: BRIGHTON | X208: 1 | Y208: 4 | Z208: 0 | AA208: 272 | AB208: 323 | AC208: 84.21052631578948 | AD208: 4
A209: BEST PLAYERS | W209: NORTHCOTE | X209: 1 | Y209: 4 | Z209: 0 | AA209: 205 | AB209: 451 | AC209: 45.454545454545453 | AD209: 4
A210: FOOTSCRAY | D210: McKINLEY | G210: COTTON | J210: J NEYLAN | M210: BORTHWICK | P210: HANSEN | R210: McCARTHY | W210: PORT MELBOURNE | X210: 0 | Y210: 5 | Z210: 0 | AA210: 209 | AB210: 393 | AC210: 53.180661577608141 | AD210: 0
A211: BRUNSWICK | D211: LEEDS | G211: STANCLIFFE | J211: MONOHAN | M211: JOHNSON | P211: FISHER | R211: JOHNSTON
A212: GOALKICKERS
A213: FOOTSCRAY | D213: A GREGORY 3 | H213: HUTCHINSON 2 | L213: McKINLEY 2
A214: BRUNSWICK | D214: THOMAS | H214: L BRAID | K214: JOHNSTON
A216: ESSENDON ASSOC. | C216: 4 | D216: 5 | E216: =C216*6+D216 -> 29 | G216: 5 | H216: 8 | I216: =G216*6+H216 -> 38 | K216: 9 | L216: 14 | M216: =K216*6+L216 -> 68 | O216: 14 | P216: 16 | Q216: =O216*6+P216 -> 100 | S216: PRESTON
A217: PRESTON | C217: 2 | D217: 2 | E217: =C217*6+D217 -> 14 | G217: 4 | H217: 2 | I217: =G217*6+H217 -> 26 | K217: 5 | L217: 5 | M217: =K217*6+L217 -> 35 | O217: 8 | P217: 5 | Q217: =O217*6+P217 -> 53 | S217: HURLEY
A218: BEST PLAYERS
A219: ESSENDON ASSOC. | D219: BARLOW | G219: GOUGH | J219: MADDEN | M219: WRIGHT | P219: McINTYRE | S219: H PAIN
A220: PRESTON | D220: TOMKINS | G220: BROWN | J220: OGDEN | M220: E YEOMANS | P220: HANNAN | S220: HENDRIE
A221: GOALKICKERS
A222: ESSENDON ASSOC. | D222: TROTTER 5 | G222: BARLOW 4
A223: PRESTON
A225: NORTH MELBOURNE | C225: 3 | D225: 2 | E225: =C225*6+D225 -> 20 | G225: 3 | H225: 9 | I225: =G225*6+H225 -> 27 | K225: 3 | L225: 9 | M225: =K225*6+L225 -> 27 | O225: 8 | P225: 10 | Q225: =O225*6+P225 -> 58 | S225: BRIGHTON
A226: BRIGHTON | C226: 0 | D226: 3 | E226: =C226*6+D226 -> 3 | G226: 4 | H226: 4 | I226: =G226*6+H226 -> 28 | K226: 7 | L226: 6 | M226: =K226*6+L226 -> 48 | O226: 7 | P226: 11 | Q226: =O226*6+P226 -> 53 | S226: KRUSE
A227: BEST PLAYERS
A228: NORTH MELBOURNE | D228: KEATING | G228: HARDY | J228: H DARBY | M228: MORAN | P228: LEWIS | S228: McVEIGH
A229: BRIGHTON | D229: J KENNEDY | G229: A LAXTON | J229: W ROBINSON | M229: F ROBINSON | P229: CANT | S229: YOUNG
A230: GOALKICKERS
A231: NORTH MELBOURNE | D231: ARMSTRONG 3 | H231: MORAN 2
A232: BRIGHTON | D232: CANT 3
A234: NORTHCOTE | C234: 3 | D234: 3 | E234: =C234*6+D234 -> 21 | G234: 6 | H234: 10 | I234: =G234*6+H234 -> 46 | K234: 7 | L234: 12 | M234: =K234*6+L234 -> 54 | O234: 8 | P234: 15 | Q234: =O234*6+P234 -> 63 | S234: NORTHCOTE
A235: PORT MELBOURNE | C235: 3 | D235: 4 | E235: =C235*6+D235 -> 22 | G235: 3 | H235: 9 | I235: =G235*6+H235 -> 27 | K235: 5 | L235: 16 | M235: =K235*6+L235 -> 46 | O235: 7 | P235: 19 | Q235: =O235*6+P235 -> 61 | S235: MURPHY
A236: BEST PLAYERS
A237: NORTHCOTE | D237: VERNON | G237: CHESSWASS | K237: COLE | M237: DAVIDSON | P237: PRATT | R237: SHEAHAN
A238: PORT MELBOURNE | D238: FRANKLIN | G238: W BRENNAN | K238: SAMSON | M238: SIMMONDS | P238: CLARKE | R238: BRERETON
A239: GOALKICKERS
A240: NORTHCOTE | D240: COLE 2 | G240: CORLETT 2
A241: PORT MELBOURNE | D241: BRERETON 3 | G241: CLARKE 2
A243: ROUND 6 | E243: 30TH MAY | I243: WEATHER | L243: SOUTH WEST WIND RAIN BEFORE GAMES | S243: PLAYED AT | X243: LADDER | AB243: ROUND | AD243: 6
D244: 1ST QTR | H244: 2ND QTR | L244: 3RD QTR | P244: FINAL | S244: FOOTSCRAY
A245: FOOTSCRAY | C245: 3 | D245: 3 | E245: =C245*6+D245 -> 21 | G245: 3 | H245: 3 | I245: =G245*6+H245 -> 21 | K245: 5 | L245: 6 | M245: =K245*6+L245 -> 36 | O245: 6 | P245: 7 | Q245: =O245*6+P245 -> 43 | S245: UMPIRE | W245: TEAM | X245: W | Y245: L | Z245: D | AA245: FOR | AB245: AGST | AC245: % | AD245: PTS
A246: ESSENDON ASSOC. | C246: 0 | D246: 0 | E246: =C246*6+D246 -> 0 | G246: 1 | H246: 5 | I246: =G246*6+H246 -> 11 | K246: 2 | L246: 8 | M246: =K246*6+L246 -> 20 | O246: 4 | P246: 11 | Q246: =O246*6+P246 -> 35 | S246: KENDALL
A247: BEST PLAYERS | W247: ESSENDON ASSOC. | X247: 5 | Y247: 1 | Z247: 0 | AA247: 533 | AB247: 294 | AC247: 181.29251700680271 | AD247: 20
A248: FOOTSCRAY | D248: J NEYLAN | G248: COTTON | J248: HARRIS | M248: SEVIOR | P248: MARMO | S248: McCARTHY | W248: WILLIAMSTOWN | X248: 5 | Y248: 1 | Z248: 0 | AA248: 356 | AB248: 248 | AC248: 143.54838709677421 | AD248: 20
A249: ESSENDON ASSOC. | D249: GOUGH | G249: MADDEN | J249: W PAIN | M249: McINTYRE | P249: HAMBRIDGE | S249: WRIGHT | W249: FOOTSCRAY | X249: 5 | Y249: 1 | Z249: 0 | AA249: 312 | AB249: 229 | AC249: 136.24454148471617 | AD249: 20
A250: GOALKICKERS | W250: PRAHRAN | X250: 4 | Y250: 2 | Z250: 0 | AA250: 357 | AB250: 211 | AC250: 169.19431279620852 | AD250: 16
A251: FOOTSCRAY | D251: JACOBSEN | G251: McKINLEY | J251: HUTCHINSON | M251: J NEYLAN | P251: COTTON | R251: CLARKE
A252: ESSENDON ASSOC. | D252: GOUGH | G252: BURDUE | J252: HAMBRIDGE | M252: MUNDAY | W252: BRUNSWICK | X252: 3 | Y252: 3 | Z252: 0 | AA252: 422 | AB252: 328 | AC252: 128.65853658536585 | AD252: 12
W253: NORTH MELBOURNE | X253: 3 | Y253: 3 | Z253: 0 | AA253: 239 | AB253: 376 | AC253: 63.563829787234042 | AD253: 12
A254: WILLIAMSTOWN | C254: 1 | D254: 4 | E254: =C254*6+D254 -> 10 | G254: 4 | H254: 5 | I254: =G254*6+H254 -> 29 | K254: 9 | L254: 9 | M254: =K254*6+L254 -> 63 | O254: 9 | P254: 10 | Q254: =O254*6+P254 -> 64 | S254: WILLIAMSTOWN | W254: BRIGHTON | X254: 2 | Y254: 4 | Z254: 0 | AA254: 341 | AB254: 365 | AC254: 93.424657534246577 | AD254: 8
A255: BRUNSWICK | C255: 2 | D255: 0 | E255: =C255*6+D255 -> 12 | G255: 2 | H255: 4 | I255: =G255*6+H255 -> 16 | K255: 4 | L255: 5 | M255: =K255*6+L255 -> 29 | O255: 8 | P255: 9 | Q255: =O255*6+P255 -> 57 | S255: VILLAIN | W255: PRESTON | X255: 2 | Y255: 4 | Z255: 0 | AA255: 340 | AB255: 388 | AC255: 87.628865979381445 | AD255: 8
A256: BEST PLAYERS | W256: NORTHCOTE | X256: 1 | Y256: 5 | Z256: 0 | AA256: 235 | AB256: 498 | AC256: 47.188755020080322 | AD256: 4
A257: WILLIAMSTOWN | D257: W OUTEN | G257: ALLEY | J257: T HALL | M257: J CALDWELL | P257: REITMAN | S257: McKAY | W257: PORT MELBOURNE | X257: 0 | Y257: 6 | Z257: 0 | AA257: 243 | AB257: 441 | AC257: 55.102040816326529 | AD257: 0
A258: BRUNSWICK | D258: STANCLIFFE | G258: HOMEWOOD | J258: ROBERTSON | M258: MONOHAN | P258: FISHER | S258: THOMAS
A259: GOALKICKERS
A260: WILLIAMSTOWN | D260: BRIGGS 2 | G260: ADDISON 2 | J260: ALLEY | L260: GARBUTT | O260: W OUTEN | R260: FAIRCHILD | U260: MONAR
A261: BRUNSWICK | D261: CLEMENTS 3 | H261: THOMAS 2 | K261: TAME | M261: JOHNSTON | O261: LEEDS
A263: BRIGHTON | C263: 2 | D263: 5 | E263: =C263*6+D263 -> 17 | G263: 4 | H263: 9 | I263: =G263*6+H263 -> 33 | K263: 7 | L263: 14 | M263: =K263*6+L263 -> 56 | O263: 9 | P263: 15 | Q263: =O263*6+P263 -> 69 | S263: BRIGHTON
A264: PRESTON | C264: 2 | D264: 1 | E264: =C264*6+D264 -> 13 | G264: 4 | H264: 5 | I264: =G264*6+H264 -> 29 | K264: 6 | L264: 6 | M264: =K264*6+L264 -> 42 | O264: 6 | P264: 6 | Q264: =O264*6+P264 -> 42 | S264: HURLEY
A265: BEST PLAYERS
A266: BRIGHTON | D266: CANT | G266: W ROBINSON | K266: ARMSTRONG | N266: STAMP | Q266: STEWART | T266: A LAXTON
A267: PRESTON | D267: BROWN | G267: MASON | K267: OGDEN | N267: TOMKINS | Q267: WHITE | T267: HENDRIE
A268: GOALKICKERS
A269: BRIGHTON | D269: CANT 5 | G269: ARMSTRONG 2 | K269: TALBOT | N269: ODGERS
A270: PRESTON | D270: ROWE 2 | G270: S HALL | J270: PUNCH | M270: OGDEN | O270: TOMKINS
A272: NORTH MELBOURNE | C272: 2 | D272: 6 | E272: =C272*6+D272 -> 18 | G272: 3 | H272: 8 | I272: =G272*6+H272 -> 26 | K272: 5 | L272: 11 | M272: =K272*6+L272 -> 41 | O272: 6 | P272: 11 | Q272: =O272*6+P272 -> 47 | S272: NORTH MELB
A273: NORTHCOTE | C273: 0 | D273: 1 | E273: =C273*6+D273 -> 1 | G273: 2 | H273: 4 | I273: =G273*6+H273 -> 16 | K273: 3 | L273: 4 | M273: =K273*6+L273 -> 22 | O273: 4 | P273: 6 | Q273: =O273*6+P273 -> 30 | S273: MURPHY
A274: BEST PLAYERS
A275: NORTH MELBOURNE | D275: MORAN | G275: CONSIDINE | K275: LEWIS | N275: PRATT | Q275: HARDY | T275: KEATING
A276: NORTHCOTE | D276: VERNON | G276: PRATT | K276: BURN | N276: EDMONDS | Q276: COLE | T276: FLYNN
A277: GOALKICKERS
A278: NORTH MELBOURNE | D278: ARMSTRONG 2 | H278: TWOMEY 2 | K278: MORAN | N278: CONSIDINE
A279: NORTHCOTE | D279: FLYNN 3 | G279: COLE
A281: PRAHRAN | C281: 1 | D281: 0 | E281: =C281*6+D281 -> 6 | G281: 3 | H281: 1 | I281: =G281*6+H281 -> 19 | K281: 5 | L281: 6 | M281: =K281*6+L281 -> 36 | O281: 6 | P281: 12 | Q281: =O281*6+P281 -> 48 | S281: PORT MELB
A282: PORT MELBOURNE | C282: 2 | D282: 4 | E282: =C282*6+D282 -> 16 | G282: 2 | H282: 6 | I282: =G282*6+H282 -> 18 | K282: 3 | L282: 9 | M282: =K282*6+L282 -> 27 | O282: 4 | P282: 10 | Q282: =O282*6+P282 -> 34 | S282: KRUSE
A283: BEST PLAYERS
A284: PRAHRAN | D284: BUIST | G284: BENNION | J284: ROURKE | M284: CARLSON | P284: SYKES | S284: HAIGHBLOOM
A285: PORT MELBOURNE | D285: PASH | G285: McGOWAN | J285: TREGLOWN | M285: WARD | P285: BRERETON | S285: WEATE
A286: GOALKICKERS
A287: PRAHRAN | D287: SYKES 3 | G287: FARMER 2 | J287: BENNION
A288: PORT MELBOURNE | D288: CLARKE 2 | G288: WILLIAMSON | J288: TREGLOWN
A290: ROUND 7 | E290: 6TH JUNE | J290: WEATHER | N290: SOUTH WEST WIND | S290: PLAYED AT | X290: LADDER | AB290: ROUND | AD290: 7
D291: 1ST QTR | H291: 2ND QTR | L291: 3RD QTR | P291: FINAL | S291: TOORAK PARK
A292: ESSENDON ASSOC. | C292: 0 | D292: 4 | E292: =C292*6+D292 -> 4 | G292: 0 | H292: 7 | I292: =G292*6+H292 -> 7 | K292: 3 | L292: 8 | M292: =K292*6+L292 -> 26 | O292: 3 | P292: 10 | Q292: =O292*6+P292 -> 28 | S292: UMPIRE | W292: TEAM | X292: W | Y292: L | Z292: D | AA292: FOR | AB292: AGST | AC292: % | AD292: PTS
A293: PRAHRAN | C293: 0 | D293: 3 | E293: =C293*6+D293 -> 3 | G293: 2 | H293: 4 | I293: =G293*6+H293 -> 16 | K293: 3 | L293: 6 | M293: =K293*6+L293 -> 24 | O293: 3 | P293: 10 | Q293: =O293*6+P293 -> 28 | S293: KENDALL
A294: BEST PLAYERS | W294: WILLIAMSTOWN | X294: 6 | Y294: 1 | Z294: 0 | AA294: 479 | AB294: 284 | AC294: 168.66197183098592 | AD294: 24
A295: ESSENDON ASSOC. | D295: MADDEN | G295: HAMBRIDGE | J295: MUNDAY | M295: WRIGHT | O295: McINTYRE | R295: RICHARDS | W295: FOOTSCRAY | X295: 6 | Y295: 1 | Z295: 0 | AA295: 374 | AB295: 277 | AC295: 135.01805054151623 | AD295: 24
A296: PRAHRAN | D296: CARLSON | G296: BENNION | J296: BOYLAND | M296: BUIST | O296: FERGUSON | R296: TURNER | W296: ESSENDON ASSOC. | X296: 5 | Y296: 1 | Z296: 1 | AA296: 561 | AB296: 322 | AC296: 174.22360248447205 | AD296: 22
A297: GOALKICKERS | W297: PRAHRAN | X297: 4 | Y297: 2 | Z297: 1 | AA297: 385 | AB297: 239 | AC297: 161.08786610878661 | AD297: 18
A298: ESSENDON ASSOC. | D298: TROTTER | G298: HAMBRIDGE | K298: BURDUE
A299: PRAHRAN | D299: SYKES 2 | G299: BUIST | W299: BRUNSWICK | X299: 4 | Y299: 3 | Z299: 0 | AA299: 481 | AB299: 375 | AC299: 128.26666666666668 | AD299: 16
W300: BRIGHTON | X300: 3 | Y300: 4 | Z300: 0 | AA300: 391 | AB300: 413 | AC300: 94.673123486682812 | AD300: 12
A301: WILLIAMSTOWN | C301: 1 | D301: 4 | E301: =C301*6+D301 -> 10 | G301: 7 | H301: 9 | I301: =G301*6+H301 -> 51 | K301: 11 | L301: 14 | M301: =K301*6+L301 -> 80 | O301: 17 | P301: 21 | Q301: =O301*6+P301 -> 123 | S301: WILLIAMSTOWN | W301: NORTH MELBOURNE | X301: 3 | Y301: 4 | Z301: 0 | AA301: 275 | AB301: 499 | AC301: 55.110220440881761 | AD301: 12
A302: NORTH MELBOURNE | C302: 0 | D302: 0 | E302: =C302*6+D302 -> 0 | G302: 0 | H302: 2 | I302: =G302*6+H302 -> 2 | K302: 2 | L302: 2 | M302: =K302*6+L302 -> 14 | O302: 5 | P302: 6 | Q302: =O302*6+P302 -> 36 | S302: LYON | W302: PRESTON | X302: 2 | Y302: 5 | Z302: 0 | AA302: 387 | AB302: 447 | AC302: 86.577181208053688 | AD302: 8
A303: BEST PLAYERS | W303: NORTHCOTE | X303: 1 | Y303: 6 | Z303: 0 | AA303: 283 | AB303: 560 | AC303: 50.535714285714285 | AD303: 4
A304: WILLIAMSTOWN | D304: BARKER | G304: ALLEY | J304: W OUTEN | M304: A CALDWELL | P304: J CALDWELL | S304: BRIGGS | W304: PORT MELBOURNE | X304: 0 | Y304: 7 | Z304: 0 | AA304: 291 | AB304: 491 | AC304: 59.266802443991857 | AD304: 0
A305: NORTH MELBOURNE | D305: H DARBY | G305: DINEEN | J305: ROLENT | M305: HARDY | P305: SPEAKMAN | S305: McEVOY
A306: GOALKICKERS
A307: WILLIAMSTOWN | D307: BRIGGS 5 | G307: ELLIS 4 | J307: ADDISON 4 | M307: ALLEY | O307: GIBBS | Q307: GARBUTT | S307: McKAY
A308: NORTH MELBOURNE | D308: PENDER 2 | G308: HARDY 2 | J308: ARMSTRONG
A310: BRUNSWICK | C310: 2 | D310: 4 | E310: =C310*6+D310 -> 16 | G310: 4 | H310: 6 | I310: =G310*6+H310 -> 30 | K310: 4 | L310: 12 | M310: =K310*6+L310 -> 36 | O310: 6 | P310: 23 | Q310: =O310*6+P310 -> 59 | S310: BRUNSWICK
A311: PRESTON | C311: 2 | D311: 3 | E311: =C311*6+D311 -> 15 | G311: 3 | H311: 4 | I311: =G311*6+H311 -> 22 | K311: 6 | L311: 4 | M311: =K311*6+L311 -> 40 | O311: 7 | P311: 5 | Q311: =O311*6+P311 -> 47 | S311: LANE
A312: BEST PLAYERS
A313: BRUNSWICK | D313: STANCLIFFE | G313: EVERETT | J313: STANWAY | M313: CHASE | P313: LEEDS | S313: ROBERTSON
A314: PRESTON | D314: HENDRIE | G314: McDONALD | J314: TOMKINS | M314: BROWN | P314: BOURKE | S314: HOWE
A315: GOALKICKERS
A316: BRUNSWICK | D316: CLEMENTS 3 | H316: L BRAID 2 | L316: McKENZIE
A317: PRESTON | D317: SERGEANT 2 | H317: LANDELLS 2 | L317: O'CONNOR | O317: HENDRIE | R317: TOMKINS
A319: BRIGHTON | C319: 2 | D319: 2 | E319: =C319*6+D319 -> 14 | G319: 5 | H319: 4 | I319: =G319*6+H319 -> 34 | K319: 7 | L319: 4 | M319: =K319*6+L319 -> 46 | O319: 7 | P319: 8 | Q319: =O319*6+P319 -> 50 | S319: PORT MELB
A320: PORT MELBOURNE | C320: 1 | D320: 4 | E320: =C320*6+D320 -> 10 | G320: 4 | H320: 6 | I320: =G320*6+H320 -> 30 | K320: 6 | L320: 9 | M320: =K320*6+L320 -> 45 | O320: 6 | P320: 12 | Q320: =O320*6+P320 -> 48 | S320: HURLEY
A321: BEST PLAYERS
A322: BRIGHTON | D322: YOUNG | G322: KULPA | J322: A LAXTON | M322: JAMES | P322: ROWE | S322: KENNEDY
A323: PORT MELBOURNE | D323: FRANKLIN | G323: SAMSON | J323: SIMMONDS | M323: McGOWAN | P323: McEWAN | S323: TREGLOWN
A324: GOALKICKERS
A325: BRIGHTON | D325: JAMES 2 | G325: CANT | J325: KULPA | L325: ODGERS | O325: GILBERT | R325: ROWE
A326: PORT MELBOURNE | D326: PAMPERIN 2 | G326: CLARKE 2 | J326: MULVANEY | M326: McGOWAN | P326: CURTIS
A328: FOOTSCRAY | C328: 2 | D328: 2 | E328: =C328*6+D328 -> 14 | G328: 5 | H328: 5 | I328: =G328*6+H328 -> 35 | K328: 8 | L328: 7 | M328: =K328*6+L328 -> 55 | O328: 9 | P328: 8 | Q328: =O328*6+P328 -> 62 | S328: FOOTSCRAY
A329: NORTHCOTE | C329: 2 | D329: 2 | E329: =C329*6+D329 -> 14 | G329: 3 | H329: 3 | I329: =G329*6+H329 -> 21 | K329: 5 | L329: 4 | M329: =K329*6+L329 -> 34 | O329: 7 | P329: 6 | Q329: =O329*6+P329 -> 48 | S329: WOOLFE
A330: BEST PLAYERS
A331: FOOTSCRAY | D331: COTTON | G331: A GREGORY | K331: J NEYLON | N331: NEILSON | Q331: STEWART | T331: HANSEN
A332: NORTHCOTE | D332: VERNON | G332: COLE | K332: CRENNION | N332: DAVIDSON | Q332: CHESSWASS | T332: BECK
A333: GOALKICKERS
A334: FOOTSCRAY | D334: HUTCHINSON 4 | H334: COTTON 3 | K334: KERR | N334: A GREGORY
A335: NORTHCOTE | D335: WALSH 2 | G335: COLE | I335: VERNON | K335: CORLETT | N335: EDMONDS | Q335: DAVIDSON
A337: ROUND 8 | D337: 8TH JUNE | G337: PRINCE OF WALES BIRTHDAY | L337: WEATHER | O337: SOUTH BREEZE FINE | S337: PLAYED AT | X337: LADDER | AB337: ROUND | AD337: 8
D338: 1ST QTR | H338: 2ND QTR | L338: 3RD QTR | P338: FINAL | S338: NORTH MELB
A339: ESSENDON ASSOC. | C339: 2 | D339: 4 | E339: =C339*6+D339 -> 16 | G339: 2 | H339: 4 | I339: =G339*6+H339 -> 16 | K339: 4 | L339: 9 | M339: =K339*6+L339 -> 33 | O339: 6 | P339: 9 | Q339: =O339*6+P339 -> 45 | S339: UMPIRE | W339: TEAM | X339: W | Y339: L | Z339: D | AA339: FOR | AB339: AGST | AC339: % | AD339: PTS
A340: NORTH MELBOURNE | C340: 0 | D340: 0 | E340: =C340*6+D340 -> 0 | G340: 0 | H340: 6 | I340: =G340*6+H340 -> 6 | K340: 0 | L340: 7 | M340: =K340*6+L340 -> 7 | O340: 3 | P340: 12 | Q340: =O340*6+P340 -> 30 | S340: LANE
A341: BEST PLAYERS | W341: WILLIAMSTOWN | X341: 7 | Y341: 1 | Z341: 0 | AA341: 579 | AB341: 299 | AC341: 193.64548494983276 | AD341: 28
A342: ESSENDON ASSOC. | D342: WRIGHT | G342: HAMBRIDGE | J342: W PAIN | M342: TROTTER | P342: BENNETT | S342: GOUGH | W342: ESSENDON ASSOC. | X342: 6 | Y342: 1 | Z342: 1 | AA342: 606 | AB342: 352 | AC342: 172.15909090909091 | AD342: 26
A343: NORTH MELBOURNE | D343: H DARBY | G343: HARDY | J343: McKENZIE | M343: JOHNSON | P343: SPEAKMAN | S343: F DARBY | W343: FOOTSCRAY | X343: 6 | Y343: 1 | Z343: 1 | AA343: 413 | AB343: 316 | AC343: 130.69620253164558 | AD343: 26
A344: GOALKICKERS | W344: PRAHRAN | X344: 4 | Y344: 3 | Z344: 1 | AA344: 436 | AB344: 300 | AC344: 145.33333333333334 | AD344: 18
A345: ESSENDON ASSOC. | D345: MUNDAY 4 | H345: TROTTER | K345: ROWE
A346: NORTH MELBOURNE | D346: MORAN 3 | W346: BRUNSWICK | X346: 4 | Y346: 4 | Z346: 0 | AA346: 520 | AB346: 448 | AC346: 116.07142857142857 | AD346: 16
W347: BRIGHTON | X347: 4 | Y347: 4 | Z347: 0 | AA347: 464 | AB347: 452 | AC347: 102.65486725663717 | AD347: 16
A348: BRIGHTON | C348: 5 | D348: 5 | E348: =C348*6+D348 -> 35 | G348: 5 | H348: 8 | I348: =G348*6+H348 -> 38 | K348: 5 | L348: 15 | M348: =K348*6+L348 -> 45 | O348: 9 | P348: 16 | Q348: =O348*6+P348 -> 70 | S348: BRIGHTON | W348: PRESTON | X348: 3 | Y348: 5 | Z348: 0 | AA348: 448 | AB348: 498 | AC348: 89.959839357429715 | AD348: 12
A349: BRUNSWICK | C349: 2 | D349: 0 | E349: =C349*6+D349 -> 12 | G349: 3 | H349: 0 | I349: =G349*6+H349 -> 18 | K349: 5 | L349: 3 | M349: =K349*6+L349 -> 33 | O349: 6 | P349: 3 | Q349: =O349*6+P349 -> 39 | S349: VILLAIN | W349: NORTH MELBOURNE | X349: 3 | Y349: 5 | Z349: 0 | AA349: 305 | AB349: 544 | AC349: 56.066176470588232 | AD349: 12
A350: BEST PLAYERS | W350: NORTHCOTE | X350: 1 | Y350: 7 | Z350: 0 | AA350: 298 | AB350: 660 | AC350: 45.151515151515149 | AD350: 4
A351: BRIGHTON | D351: F ROBINSON | G351: W ROBINSON | J351: STEWART | M351: A LAXTON | P351: STAMP | R351: JAMES | W351: PORT MELBOURNE | X351: 0 | Y351: 7 | Z351: 1 | AA351: 330 | AB351: 530 | AC351: 62.264150943396224 | AD351: 2
A352: BRUNSWICK | D352: HOMEWOOD | G352: CLEMENTS | J352: LEEDS | M352: CHASE | P352: R BALFE | R352: L BRAID
A353: GOALKICKERS
A354: BRIGHTON | D354: KULPA 4 | G354: ROWE 3 | J354: W ROBINSON 2
A355: BRUNSWICK | D355: L BRAID 2 | G355: JOHNSTON 2 | K355: H BRAID | N355: THOMAS
A357: PRESTON | C357: 2 | D357: 4 | E357: =C357*6+D357 -> 16 | G357: 4 | H357: 4 | I357: =G357*6+H357 -> 28 | K357: 7 | L357: 5 | M357: =K357*6+L357 -> 47 | O357: 9 | P357: 7 | Q357: =O357*6+P357 -> 61 | S357: PRESTON
A358: PRAHRAN | C358: 1 | D358: 1 | E358: =C358*6+D358 -> 7 | G358: 4 | H358: 1 | I358: =G358*6+H358 -> 25 | K358: 7 | L358: 3 | M358: =K358*6+L358 -> 45 | O358: 7 | P358: 9 | Q358: =O358*6+P358 -> 51 | S358: KRUSE
A359: BEST PLAYERS
A360: PRESTON | D360: McDONALD | G360: HANNON | K360: BOURKE | M360: MASON | P360: HOWARD | S360: O'CONNOR
A361: PRAHRAN | D361: ROURKE | G361: HAIGHBLOOM | K361: WILSON | M361: BUIST | P361: TURNER | S361: BENNION
A362: GOALKICKERS
A363: PRESTON | D363: PUNCH 5 | G363: LANDELLS 2 | K363: OGDEN | N363: HENDRIE
A364: PRAHRAN | D364: SYKES 4 | G364: HAIGHBLOOM | K364: BOYLAND | N364: WATT
A366: PORT MELBOURNE | C366: 1 | D366: 0 | E366: =C366*6+D366 -> 6 | G366: 3 | H366: 5 | I366: =G366*6+H366 -> 23 | K366: 4 | L366: 5 | M366: =K366*6+L366 -> 29 | O366: 5 | P366: 9 | Q366: =O366*6+P366 -> 39 | S366: PORT MELB
A367: FOOTSCRAY | C367: 1 | D367: 0 | E367: =C367*6+D367 -> 6 | G367: 2 | H367: 1 | I367: =G367*6+H367 -> 13 | K367: 3 | L367: 8 | M367: =K367*6+L367 -> 26 | O367: 5 | P367: 9 | Q367: =O367*6+P367 -> 39 | S367: KENDALL
A368: BEST PLAYERS
A369: PORT MELBOURNE | D369: PASH | G369: SIMMONDS | J369: CURTIS | M369: McGOWAN | P369: PAMPERIN | S369: FRANKLIN
A370: FOOTSCRAY | D370: A GREGORY | G370: STEWART | J370: COTTON | M370: LAUNDER | P370: HUTCHINSON | S370: EGAN
A371: GOALKICKERS
A372: PORT MELBOURNE | D372: TREGLOWAN 2 | H372: CURTIS | K372: WILLIAMSON | O372: PASH
A373: FOOTSCRAY | D373: HUTCHINSON 2 | H373: CLARKE 2 | K373: GREENWOOD
A375: WILLIAMSTOWN | C375: 2 | D375: 5 | E375: =C375*6+D375 -> 17 | G375: 6 | H375: 9 | I375: =G375*6+H375 -> 45 | K375: 8 | L375: 11 | M375: =K375*6+L375 -> 59 | O375: 14 | P375: 16 | Q375: =O375*6+P375 -> 100 | S375: WILLIAMSTOWN
A376: NORTHCOTE | C376: 0 | D376: 2 | E376: =C376*6+D376 -> 2 | G376: 0 | H376: 5 | I376: =G376*6+H376 -> 5 | K376: 0 | L376: 8 | M376: =K376*6+L376 -> 8 | O376: 1 | P376: 9 | Q376: =O376*6+P376 -> 15 | S376: MURPHY
A377: BEST PLAYERS
A378: WILLIAMSTOWN | D378: BARKER | G378: J CALDWELL | K378: JOHNSON | N378: M OUTEN | Q378: HALL | S378: McKAY
A379: NORTHCOTE | D379: VERNON | G379: CHESSWASS | K379: DAVIDSON | N379: BECK | Q379: PRATT | S379: COLE
A380: GOALKICKERS
A381: WILLIAMSTOWN | D381: BRIGGS 5 | G381: ADDISON 5 | K381: ELLIS 2 | N381: ALLEY | P381: GIBBS
A382: NORTHCOTE
A384: ROUND 9 | D384: 13TH JUNE | J384: WEATHER | N384: SOUTH WIND | S384: PLAYED AT | X384: LADDER | AB384: ROUND | AD384: 9
D385: 1ST QTR | H385: 2ND QTR | L385: 3RD QTR | P385: FINAL | S385: FOOTSCRAY
A386: FOOTSCRAY | C386: 3 | D386: 2 | E386: =C386*6+D386 -> 20 | G386: 3 | H386: 2 | I386: =G386*6+H386 -> 20 | K386: 5 | L386: 6 | M386: =K386*6+L386 -> 36 | O386: 6 | P386: 7 | Q386: =O386*6+P386 -> 43 | S386: UMPIRE | W386: TEAM | X386: W | Y386: L | Z386: D | AA386: FOR | AB386: AGST | AC386: % | AD386: PTS
A387: WILLIAMSTOWN | C387: 0 | D387: 2 | E387: =C387*6+D387 -> 2 | G387: 0 | H387: 4 | I387: =G387*6+H387 -> 4 | K387: 0 | L387: 4 | M387: =K387*6+L387 -> 4 | O387: 2 | P387: 6 | Q387: =O387*6+P387 -> 18 | S387: LANE
A388: BEST PLAYERS | W388: FOOTSCRAY | X388: 7 | Y388: 1 | Z388: 1 | AA388: 456 | AB388: 334 | AC388: 136.52694610778443 | AD388: 30
A389: FOOTSCRAY | D389: HARRIS | F389: A GREGORY | I389: STEWART | L389: HANSEN | O389: COTTON | R389: EGAN | W389: WILLIAMSTOWN | X389: 7 | Y389: 2 | Z389: 0 | AA389: 597 | AB389: 342 | AC389: 174.56140350877192 | AD389: 28
A390: WILLIAMSTOWN | D390: ALLEY | F390: TYRELL | I390: GIBBS | L390: M OUTEN | O390: REITMAN | R390: JOHNSON | W390: ESSENDON ASSOC. | X390: 6 | Y390: 2 | Z390: 1 | AA390: 660 | AB390: 413 | AC390: 159.80629539951573 | AD390: 26
A391: GOALKICKERS | W391: PRAHRAN | X391: 5 | Y391: 3 | Z391: 1 | AA391: 480 | AB391: 342 | AC391: 140.35087719298247 | AD391: 22
A392: FOOTSCRAY | D392: A GREGORY 3 | H392: HUTCHINSON 3
A393: WILLIAMSTOWN | D393: ADDISON | G393: GARBUTT | W393: BRUNSWICK | X393: 4 | Y393: 5 | Z393: 0 | AA393: 564 | AB393: 497 | AC393: 113.48088531187123 | AD393: 16
W394: BRIGHTON | X394: 4 | Y394: 5 | Z394: 0 | AA394: 506 | AB394: 496 | AC394: 102.01612903225806 | AD394: 16
A395: PRAHRAN | C395: 3 | D395: 4 | E395: =C395*6+D395 -> 22 | G395: 4 | H395: 4 | I395: =G395*6+H395 -> 28 | K395: 6 | L395: 6 | M395: =K395*6+L395 -> 42 | O395: 6 | P395: 8 | Q395: =O395*6+P395 -> 44 | S395: TOORAK PARK | W395: PRESTON | X395: 4 | Y395: 5 | Z395: 0 | AA395: 550 | AB395: 542 | AC395: 101.47601476014761 | AD395: 16
A396: BRIGHTON | C396: 1 | D396: 2 | E396: =C396*6+D396 -> 8 | G396: 3 | H396: 4 | I396: =G396*6+H396 -> 22 | K396: 4 | L396: 5 | M396: =K396*6+L396 -> 29 | O396: 6 | P396: 6 | Q396: =O396*6+P396 -> 42 | S396: HURLEY | W396: NORTH MELBOURNE | X396: 3 | Y396: 6 | Z396: 0 | AA396: 349 | AB396: 646 | AC396: 54.024767801857585 | AD396: 12
A397: BEST PLAYERS | W397: NORTHCOTE | X397: 2 | Y397: 7 | Z397: 0 | AA397: 359 | AB397: 714 | AC397: 50.280112044817926 | AD397: 8
A398: PRAHRAN | D398: ROURKE | G398: BENNION | J398: CARLSON | M398: HAIGHBLOOM | P398: FARMER | R398: SYKES | W398: PORT MELBOURNE | X398: 1 | Y398: 7 | Z398: 1 | AA398: 379 | AB398: 574 | AC398: 66.027874564459935 | AD398: 6
A399: BRIGHTON | D399: JAMES | G399: YOUNG | J399: STAMP | M399: A LAXTON | P399: KULPA | R399: W ROBINSON
A400: GOALKICKERS
A401: PRAHRAN | D401: SYKES 3 | G401: BUIST 2 | J401: FERGUSON
A402: BRIGHTON | D402: KULPA 2 | G402: ROWE | J402: ODGERS | M402: W ROBINSON | P402: JAMES
A404: PRESTON | C404: 4 | D404: 7 | E404: =C404*6+D404 -> 31 | G404: 9 | H404: 13 | I404: =G404*6+H404 -> 67 | K404: 12 | L404: 18 | M404: =K404*6+L404 -> 90 | O404: 13 | P404: 24 | Q404: =O404*6+P404 -> 102 | S404: PRESTON
A405: NORTH MELBOURNE | C405: 1 | D405: 0 | E405: =C405*6+D405 -> 6 | G405: 2 | H405: 1 | I405: =G405*6+H405 -> 13 | K405: 3 | L405: 3 | M405: =K405*6+L405 -> 21 | O405: 6 | P405: 8 | Q405: =O405*6+P405 -> 44 | S405: KRUSE
A406: BEST PLAYERS
A407: PRESTON | D407: WHITE | G407: O'CONNOR | J407: HENDRIE | M407: BROWN | O407: BOURKE | R407: HANNON
A408: NORTH MELBOURNE
A409: GOALKICKERS
A410: PRESTON | D410: OGDEN 5 | G410: TOMKINS 2 | J410: PUNCH 2 | M410: LANDELLS | P410: STANLAKE | S410: WHITE | U410: O'CONNOR
A411: NORTH MELBOURNE | D411: HARDY 2 | G411: ARMSTRONG 2 | K411: PENDER | N411: TWOMEY
A413: PORT MELBOURNE | C413: 0 | D413: 0 | E413: =C413*6+D413 -> 0 | G413: 3 | H413: 4 | I413: =G413*6+H413 -> 22 | K413: 4 | L413: 4 | M413: =K413*6+L413 -> 28 | O413: 7 | P413: 7 | Q413: =O413*6+P413 -> 49 | S413: PORT MELB
A414: BRUNSWICK | C414: 4 | D414: 1 | E414: =C414*6+D414 -> 25 | G414: 4 | H414: 1 | I414: =G414*6+H414 -> 25 | K414: 5 | L414: 8 | M414: =K414*6+L414 -> 38 | O414: 6 | P414: 8 | Q414: =O414*6+P414 -> 44 | S414: KENDALL
A415: BEST PLAYERS
A416: PORT MELBOURNE | D416: SAMSON | G416: BRERETON | J416: PASH | M416: TREGLOWN | P416: McGOWAN | S416: PAMPERIN
A417: BRUNSWICK | D417: THOMAS | G417: JOHNSON | J417: L BRAID | M417: H BRAID | P417: O'BRIEN | S417: TAME
A418: GOALKICKERS
A419: PORT MELBOURNE | D419: MULVANEY 2 | H419: CURTIS | J419: CLARKE | L419: WILLIAMSON | O419: PASH | Q419: WARD
A420: BRUNSWICK | D420: THOMAS 3 | H420: JOHNSTON 2 | K420: L BRAID
A422: NORTHCOTE | C422: 4 | D422: 2 | E422: =C422*6+D422 -> 26 | G422: 5 | H422: 3 | I422: =G422*6+H422 -> 33 | K422: 8 | L422: 7 | M422: =K422*6+L422 -> 55 | O422: 9 | P422: 7 | Q422: =O422*6+P422 -> 61 | S422: ESSENDON
A423: ESSENDON ASSOC. | C423: 2 | D423: 3 | E423: =C423*6+D423 -> 15 | G423: 7 | H423: 6 | I423: =G423*6+H423 -> 48 | K423: 7 | L423: 7 | M423: =K423*6+L423 -> 49 | O423: 7 | P423: 12 | Q423: =O423*6+P423 -> 54 | S423: VILLAIN
A424: BEST PLAYERS
A425: NORTHCOTE | D425: BECK | G425: KEOGH | J425: HOUGHTON | M425: O'LOUGHLIN | P425: CHESSWASS | S425: ORR
A426: ESSENDON ASSOC. | D426: WRIGHT | G426: GOUGH | J426: HAMBRIDGE | M426: W PAIN | P426: CHEFFERS | S426: DYSON
A427: GOALKICKERS
A428: NORTHCOTE | D428: BECK 3 | G428: ORR 2 | J428: DAVIDSON 2 | M428: EDMONDS | O428: GLUYAS
A429: ESSENDON ASSOC. | D429: CHEFFERS 2 | G429: MUNDAY | J429: WINDSOR | M429: DYSON | O429: BENNETT | R429: HAMBRIDGE
A431: ROUND 10 | D431: 20TH JUNE | J431: WEATHER | N431: NORTH WEST WIND | S431: PLAYED AT | X431: LADDER | AB431: ROUND | AD431: 10
D432: 1ST QTR | H432: 2ND QTR | L432: 3RD QTR | P432: FINAL | S432: ESSENDON
A433: ESSENDON ASSOC. | C433: 1 | D433: 0 | E433: =C433*6+D433 -> 6 | G433: 3 | H433: 2 | I433: =G433*6+H433 -> 20 | K433: 5 | L433: 4 | M433: =K433*6+L433 -> 34 | O433: 6 | P433: 6 | Q433: =O433*6+P433 -> 42 | S433: UMPIRE | W433: TEAM | X433: W | Y433: L | Z433: D | AA433: FOR | AB433: AGST | AC433: % | AD433: PTS
A434: BRIGHTON | C434: 1 | D434: 3 | E434: =C434*6+D434 -> 9 | G434: 2 | H434: 4 | I434: =G434*6+H434 -> 16 | K434: 2 | L434: 7 | M434: =K434*6+L434 -> 19 | O434: 4 | P434: 9 | Q434: =O434*6+P434 -> 33 | S434: NUGENT
A435: BEST PLAYERS | W435: FOOTSCRAY | X435: 8 | Y435: 1 | Z435: 1 | AA435: 514 | AB435: 379 | AC435: 135.62005277044855 | AD435: 34
A436: ESSENDON ASSOC. | D436: GOUGH | G436: MAINE | J436: RICHARDS | M436: GREEN | O436: DAYMON | R436: McILROY | W436: ESSENDON ASSOC. | X436: 7 | Y436: 2 | Z436: 1 | AA436: 702 | AB436: 446 | AC436: 157.39910313901345 | AD436: 30
A437: BRIGHTON | D437: ARMSTRONG | G437: KENNEDY | J437: STAMP | M437: F ROBINSON | P437: W ROBINSON | S437: SCALES | W437: WILLIAMSTOWN | X437: 7 | Y437: 3 | Z437: 0 | AA437: 635 | AB437: 382 | AC437: 166.2303664921466 | AD437: 28
A438: GOALKICKERS | W438: PRAHRAN | X438: 6 | Y438: 3 | Z438: 1 | AA438: 518 | AB438: 363 | AC438: 142.69972451790633 | AD438: 26
A439: ESSENDON ASSOC. | D439: TROTTER 2 | G439: GOUGH 2 | J439: HAMBRIDGE | M439: DYSON
A440: BRIGHTON | D440: KULPA 3 | G440: SCALES | W440: BRUNSWICK | X440: 5 | Y440: 5 | Z440: 0 | AA440: 623 | AB440: 533 | AC440: 116.88555347091932 | AD440: 20
W441: BRIGHTON | X441: 4 | Y441: 6 | Z441: 0 | AA441: 539 | AB441: 538 | AC441: 100.18587360594796 | AD441: 16
A442: FOOTSCRAY | C442: 0 | D442: 0 | E442: =C442*6+D442 -> 0 | G442: 3 | H442: 4 | I442: =G442*6+H442 -> 22 | K442: 4 | L442: 4 | M442: =K442*6+L442 -> 28 | O442: 8 | P442: 10 | Q442: =O442*6+P442 -> 58 | S442: FOOTSCRAY | W442: PRESTON | X442: 4 | Y442: 6 | Z442: 0 | AA442: 595 | AB442: 600 | AC442: 99.166666666666671 | AD442: 16
A443: PRESTON | C443: 1 | D443: 6 | E443: =C443*6+D443 -> 12 | G443: 1 | H443: 7 | I443: =G443*6+H443 -> 13 | K443: 6 | L443: 9 | M443: =K443*6+L443 -> 45 | O443: 6 | P443: 9 | Q443: =O443*6+P443 -> 45 | S443: LANE | W443: NORTH MELBOURNE | X443: 3 | Y443: 7 | Z443: 0 | AA443: 370 | AB443: 684 | AC443: 54.093567251461991 | AD443: 12
A444: BEST PLAYERS | W444: PORT MELBOURNE | X444: 2 | Y444: 7 | Z444: 1 | AA444: 419 | AB444: 612 | AC444: 68.464052287581694 | AD444: 10
A445: FOOTSCRAY | D445: A GREGORY | G445: ELLIOTT | J445: HARRIS | M445: HUTCHINSON | P445: MCCARTHY | S445: SEVIOR | W445: NORTHCOTE | X445: 2 | Y445: 8 | Z445: 0 | AA445: 395 | AB445: 773 | AC445: 51.099611901681762 | AD445: 8
A446: PRESTON | D446: WAITE | G446: HENDRIE | J446: BROWN | M446: BOURKE | P446: S HALL | S446: WATSON
A447: GOALKICKERS
A448: FOOTSCRAY | D448: HUTCHINSON 4 | H448: EGAN | J448: A GREGORY | M448: ELLIOTT | P448: BORTHWICK
A449: PRESTON | D449: WHITE 2 | G449: HENDRIE 2 | K449: PUNCH | M449: O'CONNOR
A451: PRAHRAN | C451: 0 | D451: 1 | E451: =C451*6+D451 -> 1 | G451: 2 | H451: 4 | I451: =G451*6+H451 -> 16 | K451: 2 | L451: 4 | M451: =K451*6+L451 -> 16 | O451: 5 | P451: 8 | Q451: =O451*6+P451 -> 38 | S451: NORTH MELB
A452: NORTH MELBOURNE | C452: 2 | D452: 2 | E452: =C452*6+D452 -> 14 | G452: 2 | H452: 2 | I452: =G452*6+H452 -> 14 | K452: 3 | L452: 3 | M452: =K452*6+L452 -> 21 | O452: 3 | P452: 3 | Q452: =O452*6+P452 -> 21 | S452: HURLEY
A453: BEST PLAYERS
A454: PRAHRAN | D454: FARMER | G454: ADAMS | J454: ROBERTS | M454: CARLSON | P454: CULLEN | S454: ROURKE
A455: NORTH MELBOURNE | D455: H DARBY | G455: GROUNDS | J455: McNAMARA | M455: FAGAN | P455: BRANKIN | S455: McKENZIE
A456: GOALKICKERS
A457: PRAHRAN | D457: ROBERTS 2 | H457: FARMER | K457: WATTS | N457: CARLSON
A458: NORTH MELBOURNE | D458: HARDY | H458: ARMSTRONG | K458: ISAACS
A460: BRUNSWICK | C460: 1 | D460: 4 | E460: =C460*6+D460 -> 10 | G460: 3 | H460: 6 | I460: =G460*6+H460 -> 24 | K460: 6 | L460: 15 | M460: =K460*6+L460 -> 51 | O460: 7 | P460: 17 | Q460: =O460*6+P460 -> 59 | S460: NORTHCOTE
A461: NORTHCOTE | C461: 1 | D461: 0 | E461: =C461*6+D461 -> 6 | G461: 3 | H461: 2 | I461: =G461*6+H461 -> 20 | K461: 3 | L461: 2 | M461: =K461*6+L461 -> 20 | O461: 5 | P461: 6 | Q461: =O461*6+P461 -> 36 | S461: KENDALL
A462: BEST PLAYERS
A463: BRUNSWICK | D463: H BRAID | G463: STANCLIFFE | J463: O'BRIEN | M463: FISHER | O463: LEEDS | R463: MONAHAN
A464: NORTHCOTE | D464: KEOGH | G464: HOUGHTON | J464: ORR | M464: COLE | O464: DAVIDSON | R464: O'LOUGHLIN
A465: GOALKICKERS
A466: BRUNSWICK | D466: CLEMENTS 2 | H466: JAMES 2 | K466: H BRAID | N466: L BRAID | Q466: R BALFE
A467: NORTHCOTE | D467: DAVIDSON 3 | H467: PRATT | K467: WALSH
A469: PORT MELBOURNE | C469: 0 | D469: 0 | E469: =C469*6+D469 -> 0 | G469: 5 | H469: 3 | I469: =G469*6+H469 -> 33 | K469: 5 | L469: 3 | M469: =K469*6+L469 -> 33 | O469: 6 | P469: 4 | Q469: =O469*6+P469 -> 40 | S469: WILLIAMSTOWN
A470: WILLIAMSTOWN | C470: 1 | D470: 2 | E470: =C470*6+D470 -> 8 | G470: 1 | H470: 3 | I470: =G470*6+H470 -> 9 | K470: 2 | L470: 7 | M470: =K470*6+L470 -> 19 | O470: 5 | P470: 8 | Q470: =O470*6+P470 -> 38 | S470: PATTERSON
A471: BEST PLAYERS
A472: PORT MELBOURNE | D472: CURTIS | G472: WEATE | J472: PAMPERIN | M472: ROBERTS | P472: CLARKE | S472: BROWN
A473: WILLIAMSTOWN | D473: GIBBS | G473: JOHNSON | J473: MONAR | M473: TYRELL | P473: REITMAN | S473: A CALDWELL
A474: GOALKICKERS
A475: PORT MELBOURNE | D475: ROBERTS 3 | H475: CLARKE 2 | K475: WEATE
A476: WILLIAMSTOWN | D476: CARRIE | G476: GARBUTT | J476: ELLIS | L476: BRIGGS | O476: O'SHEA
A478: ROUND 11 | D478: 27TH JUNE | J478: WEATHER | N478: NORTH WIND RAIN AT FINISH | S478: PLAYED AT | X478: LADDER | AB478: ROUND | AD478: 11
D479: 1ST QTR | H479: 2ND QTR | L479: 3RD QTR | P479: FINAL | S479: BRUNSWICK
A480: BRUNSWICK | C480: 1 | D480: 1 | E480: =C480*6+D480 -> 7 | G480: 4 | H480: 5 | I480: =G480*6+H480 -> 29 | K480: 4 | L480: 10 | M480: =K480*6+L480 -> 34 | O480: 6 | P480: 13 | Q480: =O480*6+P480 -> 49 | S480: UMPIRE | W480: TEAM | X480: W | Y480: L | Z480: D | AA480: FOR | AB480: AGST | AC480: % | AD480: PTS
A481: PRAHRAN | C481: 2 | D481: 4 | E481: =C481*6+D481 -> 16 | G481: 2 | H481: 4 | I481: =G481*6+H481 -> 16 | K481: 4 | L481: 5 | M481: =K481*6+L481 -> 29 | O481: 4 | P481: 9 | Q481: =O481*6+P481 -> 33 | S481: LANE
A482: BEST PLAYERS | W482: FOOTSCRAY | X482: 9 | Y482: 1 | Z482: 1 | AA482: 702 | AB482: 407 | AC482: 172.48157248157247 | AD482: 38
A483: BRUNSWICK | D483: McKENZIE | G483: H BRAID | I483: LEEDS | L483: STANCLIFFE | O483: R BALFE | R483: S BALFE | W483: WILLIAMSTOWN | X483: 8 | Y483: 3 | Z483: 0 | AA483: 690 | AB483: 412 | AC483: 167.47572815533979 | AD483: 32
A484: PRAHRAN | D484: BROWN | G484: WILSON | I484: CARLSON | L484: STOREY | O484: FERGUSON | R484: JOHNSON | W484: ESSENDON ASSOC. | X484: 7 | Y484: 3 | Z484: 1 | AA484: 735 | AB484: 487 | AC484: 150.92402464065708 | AD484: 30
A485: GOALKICKERS | W485: PRAHRAN | X485: 6 | Y485: 4 | Z485: 1 | AA485: 551 | AB485: 412 | AC485: 133.73786407766991 | AD485: 26
A486: BRUNSWICK | D486: CLEMENTS 2 | H486: L BRAID 2 | K486: O'SHEA 2
A487: PRAHRAN | D487: FARMER 2 | H487: FERGUSON | K487: BOYLAND | W487: BRUNSWICK | X487: 6 | Y487: 5 | Z487: 0 | AA487: 672 | AB487: 566 | AC487: 118.72791519434629 | AD487: 24
W488: BRIGHTON | X488: 5 | Y488: 6 | Z488: 0 | AA488: 637 | AB488: 566 | AC488: 112.54416961130742 | AD488: 20
A489: WILLIAMSTOWN | C489: 1 | D489: 4 | E489: =C489*6+D489 -> 10 | G489: 3 | H489: 8 | I489: =G489*6+H489 -> 26 | K489: 3 | L489: 10 | M489: =K489*6+L489 -> 28 | O489: 7 | P489: 13 | Q489: =O489*6+P489 -> 55 | S489: PRESTON | W489: PRESTON | X489: 4 | Y489: 7 | Z489: 0 | AA489: 625 | AB489: 655 | AC489: 95.419847328244273 | AD489: 16
A490: PRESTON | C490: 1 | D490: 4 | E490: =C490*6+D490 -> 10 | G490: 1 | H490: 4 | I490: =G490*6+H490 -> 10 | K490: 2 | L490: 7 | M490: =K490*6+L490 -> 19 | O490: 3 | P490: 12 | Q490: =O490*6+P490 -> 30 | S490: VILLAIN | W490: PORT MELBOURNE | X490: 3 | Y490: 7 | Z490: 1 | AA490: 460 | AB490: 645 | AC490: 71.31782945736434 | AD490: 14
A491: BEST PLAYERS | W491: NORTH MELBOURNE | X491: 3 | Y491: 8 | Z491: 0 | AA491: 398 | AB491: 872 | AC491: 45.642201834862384 | AD491: 12
A492: WILLIAMSTOWN | D492: GIBBS | G492: W OUTEN | J492: BRIGGS | M492: ELLIS | P492: A CALDWELL | S492: CLANCY | W492: NORTHCOTE | X492: 2 | Y492: 9 | Z492: 0 | AA492: 423 | AB492: 871 | AC492: 48.56486796785304 | AD492: 8
A493: PRESTON | D493: OGDEN | G493: McDONALD | J493: HENDRIE | M493: HANNON | P493: BROWN | S493: BOURKE
A494: GOALKICKERS
A495: WILLIAMSTOWN | D495: BRIGGS 6 | G495: ADDISON
A496: PRESTON | D496: WOODS | G496: O'CONNOR | K496: LANDELLS
A498: BRIGHTON | C498: 4 | D498: 7 | E498: =C498*6+D498 -> 31 | G498: 5 | H498: 8 | I498: =G498*6+H498 -> 38 | K498: 8 | L498: 11 | M498: =K498*6+L498 -> 59 | O498: 14 | P498: 14 | Q498: =O498*6+P498 -> 98 | S498: BRIGHTON
A499: NORTHCOTE | C499: 0 | D499: 1 | E499: =C499*6+D499 -> 1 | G499: 1 | H499: 2 | I499: =G499*6+H499 -> 8 | K499: 2 | L499: 2 | M499: =K499*6+L499 -> 14 | O499: 4 | P499: 4 | Q499: =O499*6+P499 -> 28 | S499: KRUSE
A500: BEST PLAYERS
A501: BRIGHTON | D501: YOUNG | G501: GILBERT | J501: KENNEDY | M501: McCLEERY | P501: KULPA | S501: CANT
A502: NORTHCOTE | D502: COLE | G502: WALSH | J502: BECK | M502: ORR | P502: DAVIDSON | S502: VERNON
A503: GOALKICKERS
A504: BRIGHTON | D504: KULPA 5 | G504: CANT 4 | J504: W ROBINSON | M504: LAVER | O504: MILLS | R504: YOUNG
A505: NORTHCOTE | D505: DAVIDSON 2 | H505: CORLETT 2
A507: PORT MELBOURNE | C507: 1 | D507: 2 | E507: =C507*6+D507 -> 8 | G507: 3 | H507: 5 | I507: =G507*6+H507 -> 23 | K507: 5 | L507: 5 | M507: =K507*6+L507 -> 35 | O507: 6 | P507: 5 | Q507: =O507*6+P507 -> 41 | S507: PORT MELB
A508: ESSENDON ASSOC. | C508: 1 | D508: 2 | E508: =C508*6+D508 -> 8 | G508: 1 | H508: 3 | I508: =G508*6+H508 -> 9 | K508: 2 | L508: 6 | M508: =K508*6+L508 -> 18 | O508: 3 | P508: 9 | Q508: =O508*6+P508 -> 27 | S508: KENDALL
A509: BEST PLAYERS
A510: PORT MELBOURNE | D510: FRANKLIN | G510: PAMPERIN | J510: CLARKE | M510: WEATE | P510: MULVANEY | S510: McGOWAN
A511: ESSENDON ASSOC. | D511: RICHARDS | G511: McCART | J511: GOUGH | M511: BARLOW | P511: McINTYRE | S511: DAYMON
A512: GOALKICKERS
A513: PORT MELBOURNE | D513: CURTIS 2 | G513: CLARKE 2 | J513: WILLIAMSON | M513: SIMMONDS
A514: ESSENDON ASSOC. | D514: DYSON | G514: McILROY | J514: GREEN
A516: FOOTSCRAY | C516: 7 | D516: 5 | E516: =C516*6+D516 -> 47 | G516: 14 | H516: 12 | I516: =G516*6+H516 -> 96 | K516: 17 | L516: 17 | M516: =K516*6+L516 -> 119 | O516: 28 | P516: 20 | Q516: =O516*6+P516 -> 188 | S516: NORTH MELB
A517: NORTH MELBOURNE | C517: 0 | D517: 1 | E517: =C517*6+D517 -> 1 | G517: 1 | H517: 2 | I517: =G517*6+H517 -> 8 | K517: 3 | L517: 4 | M517: =K517*6+L517 -> 22 | O517: 4 | P517: 4 | Q517: =O517*6+P517 -> 28 | S517: HURLEY
A518: BEST PLAYERS
A519: FOOTSCRAY | D519: HUTCHINSON | G519: ELLIOTT | J519: LAUNDER | M519: JACOBSEN | P519: EGAN | S519: A GREGORY
A520: NORTH MELBOURNE
A521: GOALKICKERS
A522: FOOTSCRAY | D522: HUTCHINSON 16 | I522: A GREGORY 5 | L522: EGAN 3 | O522: LAUNDER | Q522: JACOBSEN | S522: STEWART | V522: F GREGORY
A523: NORTH MELBOURNE
A525: ROUND 12 | D525: 4TH JULY | J525: WEATHER | N525: SOUTH WIND DRIZZLING RAIN | S525: PLAYED AT | X525: LADDER | AB525: ROUND | AD525: 12
D526: 1ST QTR | H526: 2ND QTR | L526: 3RD QTR | P526: FINAL | S526: WILLIAMSTOWN
A527: WILLIAMSTOWN | C527: 2 | D527: 3 | E527: =C527*6+D527 -> 15 | G527: 2 | H527: 10 | I527: =G527*6+H527 -> 22 | K527: 3 | L527: 12 | M527: =K527*6+L527 -> 30 | O527: 5 | P527: 16 | Q527: =O527*6+P527 -> 46 | S527: UMPIRE | W527: TEAM | X527: W | Y527: L | Z527: D | AA527: FOR | AB527: AGST | AC527: % | AD527: PTS
A528: ESSENDON ASSOC. | C528: 0 | D528: 2 | E528: =C528*6+D528 -> 2 | G528: 2 | H528: 2 | I528: =G528*6+H528 -> 14 | K528: 2 | L528: 6 | M528: =K528*6+L528 -> 18 | O528: 4 | P528: 7 | Q528: =O528*6+P528 -> 31 | S528: HURLEY
A529: BEST PLAYERS | W529: FOOTSCRAY | X529: 10 | Y529: 1 | Z529: 1 | AA529: 761 | AB529: 444 | AC529: 171.3963963963964 | AD529: 42
A530: WILLIAMSTOWN | D530: W OUTEN | G530: M OUTEN | J530: REITMAN | M530: McKAY | P530: ELLIS | S530: ALLEY | W530: WILLIAMSTOWN | X530: 9 | Y530: 3 | Z530: 0 | AA530: 736 | AB530: 443 | AC530: 166.13995485327314 | AD530: 36
A531: ESSENDON ASSOC. | D531: McCART | G531: RICHARDS | J531: DYSON | M531: MUNDAY | P531: HAMBRIDGE | S531: BENNETT | W531: ESSENDON ASSOC. | X531: 7 | Y531: 4 | Z531: 1 | AA531: 766 | AB531: 533 | AC531: 143.71482176360226 | AD531: 30
A532: GOALKICKERS | W532: PRAHRAN | X532: 7 | Y532: 4 | Z532: 1 | AA532: 602 | AB532: 436 | AC532: 138.07339449541286 | AD532: 30
A533: WILLIAMSTOWN | D533: M OUTEN 2 | H533: BRIGGS 2 | K533: ADDISON
A534: ESSENDON ASSOC. | D534: HAMBRIDGE 2 | H534: BOWE | K534: McILROY | W534: BRUNSWICK | X534: 7 | Y534: 5 | Z534: 0 | AA534: 761 | AB534: 609 | AC534: 124.95894909688013 | AD534: 28
W535: BRIGHTON | X535: 5 | Y535: 7 | Z535: 0 | AA535: 674 | AB535: 625 | AC535: 107.84 | AD535: 20
A536: FOOTSCRAY | C536: 2 | D536: 3 | E536: =C536*6+D536 -> 15 | G536: 3 | H536: 7 | I536: =G536*6+H536 -> 25 | K536: 5 | L536: 8 | M536: =K536*6+L536 -> 38 | O536: 8 | P536: 11 | Q536: =O536*6+P536 -> 59 | S536: BRIGHTON | W536: PORT MELBOURNE | X536: 4 | Y536: 7 | Z536: 1 | AA536: 516 | AB536: 696 | AC536: 74.137931034482762 | AD536: 18
A537: BRIGHTON | C537: 1 | D537: 0 | E537: =C537*6+D537 -> 6 | G537: 3 | H537: 0 | I537: =G537*6+H537 -> 18 | K537: 4 | L537: 0 | M537: =K537*6+L537 -> 24 | O537: 6 | P537: 1 | Q537: =O537*6+P537 -> 37 | S537: KRUSE | W537: PRESTON | X537: 4 | Y537: 8 | Z537: 0 | AA537: 676 | AB537: 711 | AC537: 95.077355836849506 | AD537: 16
A538: BEST PLAYERS | W538: NORTH MELBOURNE | X538: 3 | Y538: 9 | Z538: 0 | AA538: 441 | AB538: 961 | AC538: 45.889698231009362 | AD538: 12
A539: FOOTSCRAY | D539: HUTCHINSON | G539: MARMO | J539: McKINLEY | M539: STEWART | P539: SEVIOR | S539: J NEYLON | W539: NORTHCOTE | X539: 2 | Y539: 10 | Z539: 0 | AA539: 447 | AB539: 922 | AC539: 48.481561822125812 | AD539: 8
A540: BRIGHTON | D540: JAMES | G540: W ROBINSON | J540: GILBERT | M540: A LAXTON | P540: KENNEDY | S540: SCALES
A541: GOALKICKERS
A542: FOOTSCRAY | D542: HUTCHINSON 5 | H542: LAUNDER | K542: F GREGORY | N542: A GREGORY
A543: BRIGHTON | D543: W ROBINSON 2 | H543: KULPA 2 | K543: ODGERS | N543: PUMPHRIES
A545: PORT MELBOURNE | C545: 1 | D545: 1 | E545: =C545*6+D545 -> 7 | G545: 2 | H545: 4 | I545: =G545*6+H545 -> 16 | K545: 4 | L545: 6 | M545: =K545*6+L545 -> 30 | O545: 8 | P545: 8 | Q545: =O545*6+P545 -> 56 | S545: PRESTON
A546: PRESTON | C546: 0 | D546: 9 | E546: =C546*6+D546 -> 9 | G546: 4 | H546: 12 | I546: =G546*6+H546 -> 36 | K546: 5 | L546: 13 | M546: =K546*6+L546 -> 43 | O546: 6 | P546: 15 | Q546: =O546*6+P546 -> 51 | S546: VILLAIN
A547: BEST PLAYERS
A548: PORT MELBOURNE | D548: BROWN | G548: SIMMONDS | J548: BRERETON | M548: PASH | P548: CLARKE | S548: JACKSON
A549: PRESTON | D549: OGDEN | G549: WATSON | J549: TOMKINS | M549: HENDRIE | P549: WHITE | S549: BROWN
A550: GOALKICKERS
A551: PORT MELBOURNE | D551: CLARKE 2 | G551: TREGLOWN | J551: PAMPERIN | M551: BATT | O551: McGOWAN | R551: JACKSON | U551: PASH
A552: PRESTON | D552: OGDEN 3 | G552: WHITE | J552: HENDRIE | M552: WOODS
A554: BRUNSWICK | C554: 5 | D554: 5 | E554: =C554*6+D554 -> 35 | G554: 9 | H554: 5 | I554: =G554*6+H554 -> 59 | K554: 11 | L554: 7 | M554: =K554*6+L554 -> 73 | O554: 13 | P554: 11 | Q554: =O554*6+P554 -> 89 | S554: NORTH MELB
A555: NORTH MELBOURNE | C555: 0 | D555: 2 | E555: =C555*6+D555 -> 2 | G555: 1 | H555: 3 | I555: =G555*6+H555 -> 9 | K555: 4 | L555: 4 | M555: =K555*6+L555 -> 28 | O555: 6 | P555: 7 | Q555: =O555*6+P555 -> 43 | S555: KENDALL
A556: BEST PLAYERS
A557: BRUNSWICK | D557: O'SHEA | G557: LEEDS | J557: ABBOTT | M557: MONOHAN | P557: STANCLIFFE | S557: H BRAID
A558: NORTH MELBOURNE | D558: KEATING | G558: H DARBY | J558: HANLEY | M558: CREE | P558: ARMSTRONG | S558: McKENZIE
A559: GOALKICKERS
A560: BRUNSWICK | D560: CLEMENTS 4 | G560: JOHNSTON 4 | K560: L BRAID 2 | O560: O'SHEA | Q560: O'BRIEN | S560: H BRAID
A561: NORTH MELBOURNE | D561: ARMSTRONG 4 | H561: H DARBY | K561: HARDY
A563: PRAHRAN | C563: 0 | D563: 3 | E563: =C563*6+D563 -> 3 | G563: 3 | H563: 3 | I563: =G563*6+H563 -> 21 | K563: 7 | L563: 6 | M563: =K563*6+L563 -> 48 | O563: 7 | P563: 9 | Q563: =O563*6+P563 -> 51 | S563: TOORAK PARK
A564: NORTHCOTE | C564: 1 | D564: 0 | E564: =C564*6+D564 -> 6 | G564: 1 | H564: 2 | I564: =G564*6+H564 -> 8 | K564: 2 | L564: 3 | M564: =K564*6+L564 -> 15 | O564: 3 | P564: 6 | Q564: =O564*6+P564 -> 24 | S564: LANE
A565: BEST PLAYERS
A566: PRAHRAN | D566: BENNION | G566: ROURKE | J566: WATTS | M566: BOYLAND | P566: FARMER | S566: SARTORI
A567: NORTHCOTE | D567: WALSH | G567: CORLETT | J567: GLUYAS | M567: EDMONDS | P567: BECK | S567: COLE
A568: GOALKICKERS
A569: PRAHRAN | D569: SYKES 2 | G569: FARMER 2 | J569: BENNION | M569: JOHNSON | P569: WATTS
A570: NORTHCOTE | D570: WALSH | G570: CORLETT | J570: EDMONDS
A572: ROUND 13 | D572: 11TH JULY | J572: WEATHER | N572: NORTH BREEZE HEAVY RAIN | S572: PLAYED AT | X572: LADDER | AB572: ROUND | AD572: 13
D573: 1ST QTR | H573: 2ND QTR | L573: 3RD QTR | P573: FINAL | S573: FOOTSCRAY
A574: FOOTSCRAY | C574: 1 | D574: 0 | E574: =C574*6+D574 -> 6 | G574: 1 | H574: 3 | I574: =G574*6+H574 -> 9 | K574: 3 | L574: 5 | M574: =K574*6+L574 -> 23 | O574: 5 | P574: 6 | Q574: =O574*6+P574 -> 36 | S574: UMPIRE | W574: TEAM | X574: W | Y574: L | Z574: D | AA574: FOR | AB574: AGST | AC574: % | AD574: PTS
A575: PRAHRAN | C575: 2 | D575: 0 | E575: =C575*6+D575 -> 12 | G575: 2 | H575: 3 | I575: =G575*6+H575 -> 15 | K575: 2 | L575: 4 | M575: =K575*6+L575 -> 16 | O575: 3 | P575: 5 | Q575: =O575*6+P575 -> 23 | S575: NUGENT
A576: BEST PLAYERS | W576: FOOTSCRAY | X576: 11 | Y576: 1 | Z576: 1 | AA576: 797 | AB576: 467 | AC576: 170.66381156316916 | AD576: 46
A577: FOOTSCRAY | D577: NEILSON | H577: STEWART | K577: COTTON | M577: HANSEN | P577: SEVIOR | R577: McCARTHY | W577: WILLIAMSTOWN | X577: 10 | Y577: 3 | Z577: 0 | AA577: 836 | AB577: 464 | AC577: 180.17241379310346 | AD577: 40
A578: PRAHRAN | D578: SARTORI | H578: FARMER | K578: SYKES | M578: HAIGHBLOOM | P578: BUIST | R578: BUSBRIDGE | W578: BRUNSWICK | X578: 8 | Y578: 5 | Z578: 0 | AA578: 810 | AB578: 650 | AC578: 124.61538461538461 | AD578: 32
A579: GOALKICKERS | W579: ESSENDON ASSOC. | X579: 7 | Y579: 5 | Z579: 1 | AA579: 807 | AB579: 582 | AC579: 138.65979381443299 | AD579: 30
A580: FOOTSCRAY | D580: HUTCHINSON 2 | H580: JAMES | J580: J NEYLON | M580: COTTON | O580: STEWART
A581: PRAHRAN | D581: SYKES 2 | G581: FARMER | W581: PRAHRAN | X581: 7 | Y581: 5 | Z581: 1 | AA581: 625 | AB581: 472 | AC581: 132.41525423728814 | AD581: 30
W582: PORT MELBOURNE | X582: 5 | Y582: 7 | Z582: 1 | AA582: 608 | AB582: 718 | AC582: 84.67966573816156 | AD582: 22
A583: BRUNSWICK | C583: 2 | D583: 3 | E583: =C583*6+D583 -> 15 | G583: 2 | H583: 4 | I583: =G583*6+H583 -> 16 | K583: 6 | L583: 6 | M583: =K583*6+L583 -> 42 | O583: 7 | P583: 7 | Q583: =O583*6+P583 -> 49 | S583: BRUNSWICK | W583: BRIGHTON | X583: 5 | Y583: 8 | Z583: 0 | AA583: 695 | AB583: 725 | AC583: 95.862068965517238 | AD583: 20
A584: ESSENDON ASSOC. | C584: 0 | D584: 1 | E584: =C584*6+D584 -> 1 | G584: 2 | H584: 5 | I584: =G584*6+H584 -> 17 | K584: 3 | L584: 10 | M584: =K584*6+L584 -> 28 | O584: 5 | P584: 11 | Q584: =O584*6+P584 -> 41 | S584: HURLEY | W584: PRESTON | X584: 4 | Y584: 8 | Z584: 1 | AA584: 719 | AB584: 754 | AC584: 95.358090185676389 | AD584: 18
A585: BEST PLAYERS | W585: NORTH MELBOURNE | X585: 3 | Y585: 10 | Z585: 0 | AA585: 463 | AB585: 1053 | AC585: 43.969610636277302 | AD585: 12
A586: BRUNSWICK | D586: McKENZIE | G586: STANCLIFFE | K586: MONOHAN | N586: LEEDS | P586: CHASE | R586: CLEMENTS | W586: NORTHCOTE | X586: 2 | Y586: 10 | Z586: 1 | AA586: 490 | AB586: 965 | AC586: 50.777202072538863 | AD586: 10
A587: ESSENDON ASSOC. | D587: BENNETT | G587: DYSON | K587: TROTTER | N587: ROLAND | P587: GREEN | R587: WRIGHT
A588: GOALKICKERS
A589: BRUNSWICK | D589: CLEMENTS 3 | H589: L BRAID 2 | K589: H BRAID | N589: STANCLIFFE
A590: ESSENDON ASSOC. | D590: GREEN 2 | G590: HAMBRIDGE | J590: GOSLING | M590: McCART
A592: WILLIAMSTOWN | C592: 4 | D592: 1 | E592: =C592*6+D592 -> 25 | G592: 5 | H592: 1 | I592: =G592*6+H592 -> 31 | K592: 10 | L592: 3 | M592: =K592*6+L592 -> 63 | O592: 16 | P592: 4 | Q592: =O592*6+P592 -> 100 | S592: WILLIAMSTOWN
A593: BRIGHTON | C593: 0 | D593: 1 | E593: =C593*6+D593 -> 1 | G593: 1 | H593: 3 | I593: =G593*6+H593 -> 9 | K593: 2 | L593: 5 | M593: =K593*6+L593 -> 17 | O593: 2 | P593: 9 | Q593: =O593*6+P593 -> 21 | S593: KRUSE
A594: BEST PLAYERS
A595: WILLIAMSTOWN | D595: McKAY | G595: ALLEY | K595: BRIGGS | N595: ELLIS | P595: ABBOTT | S595: W OUTEN
A596: BRIGHTON | D596: YOUNG | G596: McCLEERY | K596: G ROBINSON | N596: A LAXTON | Q596: KENNEDY
A597: GOALKICKERS
A598: WILLIAMSTOWN | D598: BRIGGS 6 | G598: ADDISON 4 | J598: J CALDWELL 2 | N598: M OUTEN 2 | Q598: W OUTEN | S598: GIBBS
A599: BRIGHTON | D599: G ROBINSON | G599: GILBERT
A601: PORT MELBOURNE | C601: 5 | D601: 5 | E601: =C601*6+D601 -> 35 | G601: 6 | H601: 6 | I601: =G601*6+H601 -> 42 | K601: 10 | L601: 12 | M601: =K601*6+L601 -> 72 | O601: 13 | P601: 14 | Q601: =O601*6+P601 -> 92 | S601: PORT MELB
A602: NORTH MELBOURNE | C602: 1 | D602: 0 | E602: =C602*6+D602 -> 6 | G602: 1 | H602: 4 | I602: =G602*6+H602 -> 10 | K602: 1 | L602: 4 | M602: =K602*6+L602 -> 10 | O602: 3 | P602: 4 | Q602: =O602*6+P602 -> 22 | S602: LANE
A603: BEST PLAYERS
A604: PORT MELBOURNE | D604: CLARKE | G604: CURTIS | J604: PAMPERIN | M604: BRERETON | P604: PASH | S604: WEATE
A605: NORTH MELBOURNE | D605: KEATING | G605: H DARBY | J605: ARMSTRONG | M605: HARDY | P605: NELSON | S605: HENLEY
A606: GOALKICKERS
A607: PORT MELBOURNE | D607: CLARKE 10 | G607: HANGAR | J607: JACKSON | M607: BRERETON
A608: NORTH MELBOURNE | D608: ARMSTRONG 2 | H608: PUNCHON
A610: PRESTON | C610: 3 | D610: 5 | E610: =C610*6+D610 -> 23 | G610: 5 | H610: 8 | I610: =G610*6+H610 -> 38 | K610: 5 | L610: 12 | M610: =K610*6+L610 -> 42 | O610: 5 | P610: 13 | Q610: =O610*6+P610 -> 43 | S610: NORTHCOTE
A611: NORTHCOTE | C611: 1 | D611: 0 | E611: =C611*6+D611 -> 6 | G611: 3 | H611: 4 | I611: =G611*6+H611 -> 22 | K611: 4 | L611: 7 | M611: =K611*6+L611 -> 31 | O611: 6 | P611: 7 | Q611: =O611*6+P611 -> 43 | S611: KENDALL
A612: BEST PLAYERS
A613: PRESTON | D613: YEOMANS | G613: STANLAKE | J613: WHITE | M613: S HALL | P613: WOODS | S613: MASON
A614: NORTHCOTE | D614: VERNON | G614: CHESSWASS | J614: CORLETT | M614: COLE | P614: BECK | S614: DAVIDSON
A615: GOALKICKERS
A616: PRESTON | D616: PUNCH 3 | G616: WOODS 2
A617: NORTHCOTE | D617: DAVIDSON 2 | G617: COLE | J617: GLUYAS | M617: FLYNN
A619: ROUND 14 | D619: 18TH JULY | J619: WEATHER | N619: NORTH WIND | S619: PLAYED AT | X619: LADDER | AB619: ROUND | AD619: 14
D620: 1ST QTR | H620: 2ND QTR | L620: 3RD QTR | P620: FINAL | S620: FOOTSCRAY
A621: FOOTSCRAY | C621: 1 | D621: 1 | E621: =C621*6+D621 -> 7 | G621: 4 | H621: 7 | I621: =G621*6+H621 -> 31 | K621: 5 | L621: 9 | M621: =K621*6+L621 -> 39 | O621: 8 | P621: 10 | Q621: =O621*6+P621 -> 58 | S621: UMPIRE | W621: TEAM | X621: W | Y621: L | Z621: D | AA621: FOR | AB621: AGST | AC621: % | AD621: PTS
A622: BRUNSWICK | C622: 4 | D622: 2 | E622: =C622*6+D622 -> 26 | G622: 4 | H622: 3 | I622: =G622*6+H622 -> 27 | K622: 4 | L622: 7 | M622: =K622*6+L622 -> 31 | O622: 5 | P622: 9 | Q622: =O622*6+P622 -> 39 | S622: HURLEY
A623: BEST PLAYERS | W623: FOOTSCRAY | X623: 12 | Y623: 1 | Z623: 1 | AA623: 855 | AB623: 506 | AC623: 168.97233201581028 | AD623: 50
A624: FOOTSCRAY | D624: STEWART | G624: HARRIS | J624: HANSEN | M624: MARMO | P624: COTTON | R624: JACOBSEN | W624: WILLIAMSTOWN | X624: 10 | Y624: 4 | Z624: 0 | AA624: 868 | AB624: 523 | AC624: 165.96558317399618 | AD624: 40
A625: BRUNSWICK | D625: McKENZIE | G625: H JOHNSTON | J625: ABBOTT | M625: MONOHAN | P625: FISHER | R625: CHASE | W625: ESSENDON ASSOC. | X625: 8 | Y625: 5 | Z625: 1 | AA625: 895 | AB625: 606 | AC625: 147.68976897689768 | AD625: 34
A626: GOALKICKERS | W626: PRAHRAN | X626: 8 | Y626: 5 | Z626: 1 | AA626: 684 | AB626: 504 | AC626: 135.71428571428572 | AD626: 34
A627: FOOTSCRAY | D627: A GREGORY 2 | H627: JACOBSEN 2 | K627: HUTCHINSON | N627: BRENNAN | P627: STEWART | R627: COTTON
A628: BRUNSWICK | D628: H JOJNSTON 3 | H628: CHASE | K628: McKENZIE | W628: BRUNSWICK | X628: 8 | Y628: 6 | Z628: 0 | AA628: 849 | AB628: 708 | AC628: 119.91525423728814 | AD628: 32
W629: PORT MELBOURNE | X629: 6 | Y629: 7 | Z629: 1 | AA629: 703 | AB629: 737 | AC629: 95.386702849389422 | AD629: 26
A630: PRAHRAN | C630: 2 | D630: 3 | E630: =C630*6+D630 -> 15 | G630: 4 | H630: 11 | I630: =G630*6+H630 -> 35 | K630: 5 | L630: 13 | M630: =K630*6+L630 -> 43 | O630: 7 | P630: 17 | Q630: =O630*6+P630 -> 59 | S630: TOORAK PARK | W630: BRIGHTON | X630: 6 | Y630: 8 | Z630: 0 | AA630: 758 | AB630: 738 | AC630: 102.71002710027101 | AD630: 24
A631: WILLIAMSTOWN | C631: 0 | D631: 4 | E631: =C631*6+D631 -> 4 | G631: 0 | H631: 5 | I631: =G631*6+H631 -> 5 | K631: 1 | L631: 13 | M631: =K631*6+L631 -> 19 | O631: 3 | P631: 14 | Q631: =O631*6+P631 -> 32 | S631: LANE | W631: PRESTON | X631: 4 | Y631: 9 | Z631: 1 | AA631: 743 | AB631: 842 | AC631: 88.242280285035633 | AD631: 18
A632: BEST PLAYERS | W632: NORTH MELBOURNE | X632: 3 | Y632: 11 | Z632: 0 | AA632: 476 | AB632: 1116 | AC632: 42.652329749103941 | AD632: 12
A633: PRAHRAN | D633: BENNION | G633: BUSBRIDGE | J633: WILSON | M633: BROWN | P633: ROURKE | R633: HAIGHBLOOM | W633: NORTHCOTE | X633: 2 | Y633: 11 | Z633: 1 | AA633: 509 | AB633: 1060 | AC633: 48.018867924528301 | AD633: 10
A634: WILLIAMSTOWN | D634: J CALDWELL | G634: GIBBS | J634: ALLEY | M634: A CALDWELL | P634: McKAY | R634: TYRELL
A635: GOALKICKERS
A636: PRAHRAN | D636: WATTS 3 | G636: BENNION | J636: JOHNSTON | M636: SYKES | O636: HALL
A637: WILLIAMSTOWN | D637: ADDISON 2 | G637: J CALDWELL
A639: ESSENDON ASSOC. | C639: 4 | D639: 5 | E639: =C639*6+D639 -> 29 | G639: 6 | H639: 8 | I639: =G639*6+H639 -> 44 | K639: 8 | L639: 11 | M639: =K639*6+L639 -> 59 | O639: 12 | P639: 16 | Q639: =O639*6+P639 -> 88 | S639: ESSENDON
A640: PRESTON | C640: 1 | D640: 2 | E640: =C640*6+D640 -> 8 | G640: 2 | H640: 4 | I640: =G640*6+H640 -> 16 | K640: 3 | L640: 5 | M640: =K640*6+L640 -> 23 | O640: 3 | P640: 6 | Q640: =O640*6+P640 -> 24 | S640: NUGENT
A641: BEST PLAYERS
A642: ESSENDON ASSOC. | D642: TROTTER | G642: ROLAND | J642: DYSON | M642: GREEN | P642: McCART | S642: WRIGHT
A643: PRESTON | D643: STANLAKE | G643: WHITE | J643: S HALL | M643: BOURKE | P643: HANNON | S643: MASON
A644: GOALKICKERS
A645: ESSENDON ASSOC. | D645: TROTTER 4 | G645: MADDEN 3 | J645: GREEN 2 | M645: GRANT | O645: McCART | R645: HAMBRIDGE
A646: PRESTON | D646: LANDELLS | G646: PUNCH | J646: WHITE
A648: PORT MELBOURNE | C648: 2 | D648: 5 | E648: =C648*6+D648 -> 17 | G648: 4 | H648: 6 | I648: =G648*6+H648 -> 30 | K648: 7 | L648: 10 | M648: =K648*6+L648 -> 52 | O648: 14 | P648: 11 | Q648: =O648*6+P648 -> 95 | S648: PORT MELB
A649: NORTHCOTE | C649: 0 | D649: 1 | E649: =C649*6+D649 -> 1 | G649: 2 | H649: 1 | I649: =G649*6+H649 -> 13 | K649: 2 | L649: 1 | M649: =K649*6+L649 -> 13 | O649: 3 | P649: 1 | Q649: =O649*6+P649 -> 19 | S649: KRUSE
A650: BEST PLAYERS
A651: PORT MELBOURNE | D651: TREGLOWN | G651: CURTIS | J651: SIMMONDS | M651: BRERETON | P651: PAMPERIN | S651: BROWN
A652: NORTHCOTE | D652: CHESSWASS | G652: KEOGH | J652: HOLLIS | M652: HOUGHTON | P652: MAINE | S652: FLYNN
A653: GOALKICKERS
A654: PORT MELBOURNE | D654: LACEY 4 | G654: CLARKE 3 | J654: TREGLOWN 3 | M654: MULVANEY | P654: JACKSON | R654: CURTIS
A655: NORTHCOTE | D655: DAVIDSON | G655: O'LOUGHLIN
A657: BRIGHTON | C657: 3 | D657: 3 | E657: =C657*6+D657 -> 21 | G657: 3 | H657: 9 | I657: =G657*6+H657 -> 27 | K657: 5 | L657: 12 | M657: =K657*6+L657 -> 42 | O657: 8 | P657: 15 | Q657: =O657*6+P657 -> 63 | S657: NORTH MELB
A658: NORTH MELBOURNE | C658: 1 | D658: 0 | E658: =C658*6+D658 -> 6 | G658: 1 | H658: 0 | I658: =G658*6+H658 -> 6 | K658: 2 | L658: 1 | M658: =K658*6+L658 -> 13 | O658: 2 | P658: 1 | Q658: =O658*6+P658 -> 13 | S658: KENDALL
A659: BEST PLAYERS
A660: BRIGHTON | D660: JAMES | G660: GILBERT | J660: KENNEDY | M660: HERBERT | P660: A LAXTON | S660: D ROBINSON
A661: NORTH MELBOURNE | D661: F DARBY | G661: H DARBY | J661: DICK | M661: ARMSTRONG | P661: ISAACS | S661: HARDY
A662: GOALKICKERS
A663: BRIGHTON | D663: KENNEDY 5 | G663: F ROBINSON | J663: KULPA | L663: ODGERS
A664: NORTH MELBOURNE | D664: ARMSTRONG | G664: ISAACS
A666: ROUND 15 | D666: 25TH JULY | J666: WEATHER | M666: SOUTH BREEZE GROUNDS SLIPPERY | S666: PLAYED AT | X666: LADDER | AB666: ROUND | AD666: 15
D667: 1ST QTR | H667: 2ND QTR | L667: 3RD QTR | P667: FINAL | S667: ESSENDON
A668: ESSENDON ASSOC. | C668: 3 | D668: 2 | E668: =C668*6+D668 -> 20 | G668: 4 | H668: 3 | I668: =G668*6+H668 -> 27 | K668: 7 | L668: 6 | M668: =K668*6+L668 -> 48 | O668: 8 | P668: 8 | Q668: =O668*6+P668 -> 56 | S668: UMPIRE | W668: TEAM | X668: W | Y668: L | Z668: D | AA668: FOR | AB668: AGST | AC668: % | AD668: PTS
A669: FOOTSCRAY | C669: 0 | D669: 3 | E669: =C669*6+D669 -> 3 | G669: 2 | H669: 7 | I669: =G669*6+H669 -> 19 | K669: 4 | L669: 9 | M669: =K669*6+L669 -> 33 | O669: 6 | P669: 11 | Q669: =O669*6+P669 -> 47 | S669: LANE
A670: BEST PLAYERS | W670: FOOTSCRAY | X670: 12 | Y670: 2 | Z670: 1 | AA670: 902 | AB670: 562 | AC670: 160.4982206405694 | AD670: 50
A671: ESSENDON ASSOC. | D671: TROTTER | G671: BOWE | J671: BENNETT | M671: GRANT | O671: ROLAND | R671: DYSON | W671: WILLIAMSTOWN | X671: 10 | Y671: 5 | Z671: 0 | AA671: 907 | AB671: 576 | AC671: 157.46527777777777 | AD671: 40
A672: FOOTSCRAY | D672: COTTON | G672: STEWART | J672: BRENNAN | M672: CLARK | O672: ELLIOTT | R672: HARRIS | W672: ESSENDON ASSOC. | X672: 9 | Y672: 5 | Z672: 1 | AA672: 951 | AB672: 653 | AC672: 145.635528330781 | AD672: 38
A673: GOALKICKERS | W673: PRAHRAN | X673: 9 | Y673: 5 | Z673: 1 | AA673: 750 | AB673: 521 | AC673: 143.95393474088291 | AD673: 38
A674: ESSENDON ASSOC. | D674: TROTTER 5 | G674: BOWE | J674: GOSLING | M674: ROLAND
A675: FOOTSCRAY | D675: HUTCHINSON 2 | H675: J NEYLON | K675: BRENNAN | N675: STEWART | Q675: A GREGORY | W675: BRUNSWICK | X675: 9 | Y675: 6 | Z675: 0 | AA675: 902 | AB675: 747 | AC675: 120.74966532797858 | AD675: 36
W676: BRIGHTON | X676: 7 | Y676: 8 | Z676: 0 | AA676: 828 | AB676: 743 | AC676: 111.44010767160161 | AD676: 28
A677: BRUNSWICK | C677: 2 | D677: 4 | E677: =C677*6+D677 -> 16 | G677: 3 | H677: 8 | I677: =G677*6+H677 -> 26 | K677: 5 | L677: 11 | M677: =K677*6+L677 -> 41 | O677: 7 | P677: 11 | Q677: =O677*6+P677 -> 53 | S677: BRUNSWICK | W677: PORT MELBOURNE | X677: 6 | Y677: 8 | Z677: 1 | AA677: 720 | AB677: 803 | AC677: 89.663760896637612 | AD677: 26
A678: WILLIAMSTOWN | C678: 0 | D678: 0 | E678: =C678*6+D678 -> 0 | G678: 0 | H678: 3 | I678: =G678*6+H678 -> 3 | K678: 4 | L678: 6 | M678: =K678*6+L678 -> 30 | O678: 5 | P678: 9 | Q678: =O678*6+P678 -> 39 | S678: VILLAIN | W678: PRESTON | X678: 4 | Y678: 10 | Z678: 1 | AA678: 748 | AB678: 912 | AC678: 82.017543859649123 | AD678: 18
A679: BEST PLAYERS | W679: NORTHCOTE | X679: 3 | Y679: 11 | Z679: 1 | AA679: 575 | AB679: 1096 | AC679: 52.463503649635037 | AD679: 14
A680: BRUNSWICK | D680: ABBOTT | G680: LEEDS | J680: McKENZIE | M680: R BALFE | O680: S BALFE | R680: CHASE | W680: NORTH MELBOURNE | X680: 3 | Y680: 12 | Z680: 0 | AA680: 512 | AB680: 1182 | AC680: 43.316412859560067 | AD680: 12
A681: WILLIAMSTOWN | D681: ELLIS | G681: REITMAN | J681: TYRELL | M681: ALLEY | O681: M OUTEN | R681: A CALDWELL
A682: GOALKICKERS
A683: BRUNSWICK | D683: CLEMENTS 3 | H683: L BRAID 2 | K683: H BRAID | N683: PEARS
A684: WILLIAMSTOWN | D684: FAIRCHILD | G684: BRIGGS | J684: GIBBS | M684: ELLIS | O684: ADDISON
A686: PRAHRAN | C686: 3 | D686: 0 | E686: =C686*6+D686 -> 18 | G686: 5 | H686: 4 | I686: =G686*6+H686 -> 34 | K686: 8 | L686: 4 | M686: =K686*6+L686 -> 52 | O686: 10 | P686: 6 | Q686: =O686*6+P686 -> 66 | S686: TOORAK PARK
A687: PORT MELBOURNE | C687: 0 | D687: 2 | E687: =C687*6+D687 -> 2 | G687: 1 | H687: 3 | I687: =G687*6+H687 -> 9 | K687: 1 | L687: 4 | M687: =K687*6+L687 -> 10 | O687: 2 | P687: 5 | Q687: =O687*6+P687 -> 17 | S687: KENDALL
A688: BEST PLAYERS
A689: PRAHRAN | D689: SARTORI | G689: FERGUSON | K689: HAIGHBLOOM | N689: ROURKE | Q689: BROWN | S689: WILSON
A690: PORT MELBOURNE | D690: SIMMONDS | G690: MULVANEY | K690: FRANKLIN | N690: TREGLOWN | Q690: BROWN | S690: BATT
A691: GOALKICKERS
A692: PRAHRAN | D692: SYKES 4 | G692: FARMER 2 | J692: SARTORI | M692: WATTS | O692: BENNION
A693: PORT MELBOURNE | D693: CLARKE | G693: BRERETON
A695: BRIGHTON | C695: 2 | D695: 3 | E695: =C695*6+D695 -> 15 | G695: 6 | H695: 6 | I695: =G695*6+H695 -> 42 | K695: 7 | L695: 9 | M695: =K695*6+L695 -> 51 | O695: 10 | P695: 10 | Q695: =O695*6+P695 -> 70 | S695: PRESTON
A696: PRESTON | C696: 0 | D696: 2 | E696: =C696*6+D696 -> 2 | G696: 0 | H696: 2 | I696: =G696*6+H696 -> 2 | K696: 0 | L696: 5 | M696: =K696*6+L696 -> 5 | O696: 0 | P696: 5 | Q696: =O696*6+P696 -> 5 | S696: NUGENT
A697: BEST PLAYERS
A698: BRIGHTON | D698: G ROBINSON | G698: SCALES | J698: HERBERT | M698: A LAXTON | P698: KENNEDY | S698: GILBERT
A699: PRESTON | D699: HANNAN | G699: S HALL | J699: BOURKE | M699: TOMKINS | P699: OGDEN
A700: GOALKICKERS
A701: BRIGHTON | D701: F ROBINSON 3 | H701: PUMPHREYS 2 | K701: W ROBINSON | N701: GILBERT | P701: KULPA | R701: KENNEDY | U701: JONES
A702: PRESTON | D702: NIL
A704: NORTHCOTE | C704: 1 | D704: 1 | E704: =C704*6+D704 -> 7 | G704: 4 | H704: 7 | I704: =G704*6+H704 -> 31 | K704: 6 | L704: 9 | M704: =K704*6+L704 -> 45 | O704: 9 | P704: 12 | Q704: =O704*6+P704 -> 66 | S704: NORTHCOTE
A705: NORTH MELBOURNE | C705: 1 | D705: 3 | E705: =C705*6+D705 -> 9 | G705: 1 | H705: 3 | I705: =G705*6+H705 -> 9 | K705: 3 | L705: 3 | M705: =K705*6+L705 -> 21 | O705: 5 | P705: 6 | Q705: =O705*6+P705 -> 36 | S705: HURLEY
A706: BEST PLAYERS
A707: NORTHCOTE | D707: VERNON | G707: PRATT | J707: DAVIDSON | M707: GLUYAS | P707: CHESSWASS | S707: CRENNION
A708: NORTH MELBOURNE | D708: H DARBY | G708: ISAACS | J708: KEATING | M708: DICK | P708: PETTIT | S708: TWOMEY
A709: GOALKICKERS
A710: NORTHCOTE | D710: DAVIDSON 4 | H710: EDMONDS 2 | K710: HALFPENNY | N710: CORLETT | Q710: CRENNION
A711: NORTH MELBOURNE | D711: HOLDEN 2 | H711: FAGAN | K711: WILSON | N711: ISAACS
A713: ROUND 16 | D713: 1ST AUGUST | J713: WEATHER | N713: FINE | S713: PLAYED AT | X713: LADDER | AB713: ROUND | AD713: 16
D714: 1ST QTR | H714: 2ND QTR | L714: 3RD QTR | P714: FINAL | S714: ESSENDON
A715: ESSENDON ASSOC. | C715: 1 | D715: 3 | E715: =C715*6+D715 -> 9 | G715: 1 | H715: 5 | I715: =G715*6+H715 -> 11 | K715: 2 | L715: 9 | M715: =K715*6+L715 -> 21 | O715: 3 | P715: 13 | Q715: =O715*6+P715 -> 31 | S715: UMPIRE | W715: TEAM | X715: W | Y715: L | Z715: D | AA715: FOR | AB715: AGST | AC715: % | AD715: PTS
A716: PRAHRAN | C716: 1 | D716: 1 | E716: =C716*6+D716 -> 7 | G716: 2 | H716: 8 | I716: =G716*6+H716 -> 20 | K716: 2 | L716: 9 | M716: =K716*6+L716 -> 21 | O716: 2 | P716: 12 | Q716: =O716*6+P716 -> 24 | S716: LANE
A717: BEST PLAYERS | W717: FOOTSCRAY | X717: 13 | Y717: 2 | Z717: 1 | AA717: 970 | AB717: 602 | AC717: 161.12956810631229 | AD717: 54
A718: ESSENDON ASSOC. | D718: BENNETT | G718: DYSON | J718: MADDEN | M718: MUNDAY | P718: RICHARDS | R718: WRIGHT | W718: WILLIAMSTOWN | X718: 11 | Y718: 5 | Z718: 0 | AA718: 1028 | AB718: 616 | AC718: 166.88311688311688 | AD718: 44
A719: PRAHRAN | D719: SARTORI | G719: WATTS | J719: HAIGHBLOOM | M719: ROURKE | P719: BENNION | R719: SYKES | W719: ESSENDON ASSOC. | X719: 10 | Y719: 5 | Z719: 1 | AA719: 982 | AB719: 677 | AC719: 145.05169867060562 | AD719: 42
A720: GOALKICKERS | W720: BRUNSWICK | X720: 10 | Y720: 6 | Z720: 0 | AA720: 984 | AB720: 791 | AC720: 124.39949431099873 | AD720: 40
A721: ESSENDON ASSOC. | D721: McINTYRE | G721: McCART | J721: GOSLING
A722: PRAHRAN | D722: BENNION | G722: FARMER | W722: PRAHRAN | X722: 9 | Y722: 6 | Z722: 1 | AA722: 774 | AB722: 552 | AC722: 140.21739130434781 | AD722: 38
W723: BRIGHTON | X723: 8 | Y723: 8 | Z723: 0 | AA723: 920 | AB723: 777 | AC723: 118.40411840411841 | AD723: 32
A724: BRIGHTON | C724: 2 | D724: 5 | E724: =C724*6+D724 -> 17 | G724: 6 | H724: 9 | I724: =G724*6+H724 -> 45 | K724: 7 | L724: 10 | M724: =K724*6+L724 -> 52 | O724: 13 | P724: 14 | Q724: =O724*6+P724 -> 92 | S724: BRIGHTON | W724: PORT MELBOURNE | X724: 6 | Y724: 9 | Z724: 1 | AA724: 754 | AB724: 895 | AC724: 84.245810055865917 | AD724: 26
A725: PORT MELBOURNE | C725: 3 | D725: 0 | E725: =C725*6+D725 -> 18 | G725: 3 | H725: 1 | I725: =G725*6+H725 -> 19 | K725: 5 | L725: 3 | M725: =K725*6+L725 -> 33 | O725: 5 | P725: 4 | Q725: =O725*6+P725 -> 34 | S725: NUGENT | W725: PRESTON | X725: 4 | Y725: 11 | Z725: 1 | AA725: 792 | AB725: 994 | AC725: 79.678068410462771 | AD725: 18
A726: BEST PLAYERS | W726: NORTHCOTE | X726: 3 | Y726: 12 | Z726: 1 | AA726: 615 | AB726: 1164 | AC726: 52.835051546391753 | AD726: 14
A727: BRIGHTON | D727: JAMES | G727: SCALES | J727: KULPA | M727: KENNEDY | P727: A LAXTON | S727: ROWE | W727: NORTH MELBOURNE | X727: 3 | Y727: 13 | Z727: 0 | AA727: 552 | AB727: 1303 | AC727: 42.363775901765159 | AD727: 12
A728: PORT MELBOURNE | D728: BRERETON | G728: SIMMONDS | J728: BATT | M728: BROWN | P728: TREGLOWN | S728: FRANKLIN
A729: GOALKICKERS
A730: BRIGHTON | D730: KULPA 4 | G730: KENNEDY 2 | J730: JOHNSON 2 | M730: A LAXTON | P730: W ROBINSON | S730: PUMPHREYS | V730: GILBERT | X730: G ROBINSON
A731: PORT MELBOURNE | D731: WILLIAMSON 2 | H731: BATT | J731: CURTIS | L731: BRERETON
A733: BRUNSWICK | C733: 1 | D733: 5 | E733: =C733*6+D733 -> 11 | G733: 6 | H733: 7 | I733: =G733*6+H733 -> 43 | K733: 9 | L733: 10 | M733: =K733*6+L733 -> 64 | O733: 11 | P733: 16 | Q733: =O733*6+P733 -> 82 | S733: PRESTON
A734: PRESTON | C734: 2 | D734: 2 | E734: =C734*6+D734 -> 14 | G734: 4 | H734: 5 | I734: =G734*6+H734 -> 29 | K734: 6 | L734: 7 | M734: =K734*6+L734 -> 43 | O734: 6 | P734: 8 | Q734: =O734*6+P734 -> 44 | S734: KRUSE
A735: BEST PLAYERS
A736: BRUNSWICK | D736: H BRAID | G736: FISHER | J736: CLEMENTS | M736: THOMAS | O736: H BALFE | R736: STANCLIFFE
A737: PRESTON | D737: TOMKINS | G737: OGDEN | J737: MASON | M737: BOURKE | O737: LANDELLS | R737: WHITE
A738: GOALKICKERS
A739: BRUNSWICK | D739: THOMAS 3 | G739: CLEMENTS 3 | K739: PEARS 2 | N739: O'SHEA | P739: CHASE
A740: PRESTON | D740: PUNCH 2 | G740: WHITE 2 | J740: OGDEN | L740: YEOMANS
A742: FOOTSCRAY | C742: 4 | D742: 4 | E742: =C742*6+D742 -> 28 | G742: 6 | H742: 9 | I742: =G742*6+H742 -> 45 | K742: 6 | L742: 11 | M742: =K742*6+L742 -> 47 | O742: 9 | P742: 14 | Q742: =O742*6+P742 -> 68 | S742: NORTHCOTE
A743: NORTHCOTE | C743: 0 | D743: 2 | E743: =C743*6+D743 -> 2 | G743: 2 | H743: 6 | I743: =G743*6+H743 -> 18 | K743: 4 | L743: 9 | M743: =K743*6+L743 -> 33 | O743: 5 | P743: 10 | Q743: =O743*6+P743 -> 40 | S743: VILLAIN
A744: BEST PLAYERS
A745: FOOTSCRAY | D745: HANSEN | G745: SEVIOR | J745: MARMO | M745: COTTON | O745: HUTCHINSON | R745: NEILSON
A746: NORTHCOTE | D746: COLE | G746: DAVIDSON | J746: HOUGHTON | M746: BECK | O746: HOLLIS | R746: CHESSWASS
A747: GOALKICKERS
A748: FOOTSCRAY | D748: HUTCHINSON 5 | H748: COTTON | K748: J NEYLON | N748: BRENNAN | Q748: A GREGORY
A749: NORTHCOTE | D749: EDMONDS 2 | G749: COLE | J749: DAVIDSON | M749: GLUYAS
A751: WILLIAMSTOWN | C751: 4 | D751: 6 | E751: =C751*6+D751 -> 30 | G751: 8 | H751: 12 | I751: =G751*6+H751 -> 60 | K751: 12 | L751: 16 | M751: =K751*6+L751 -> 88 | O751: 17 | P751: 19 | Q751: =O751*6+P751 -> 121 | S751: NORTH MELB
A752: NORTH MELBOURNE | C752: 1 | D752: 0 | E752: =C752*6+D752 -> 6 | G752: 3 | H752: 1 | I752: =G752*6+H752 -> 19 | K752: 5 | L752: 2 | M752: =K752*6+L752 -> 32 | O752: 6 | P752: 4 | Q752: =O752*6+P752 -> 40 | S752: KENDALL
A753: BEST PLAYERS
A754: WILLIAMSTOWN | D754: ADDISON | G754: ELLIS | J754: J CALDWELL | M754: A CALDWELL | P754: REITMAN | S754: MONAR
A755: NORTH MELBOURNE | D755: KEATING | G755: McKENZIE | J755: DICK | M755: HOLDEN | P755: H DARBY | S755: SMITH
A756: GOALKICKERS
A757: WILLIAMSTOWN | D757: BRIGGS 10 | G757: GIBBS 2) | J757: ADDISON 2 | M757: M OUTEN | O757: FAIRCHILD | R757: GARBUTT
A758: NORTH MELBOURNE | D758: TWOMEY 2 | G758: DAVIS | J758: HOLDEN | L758: PENDER | O758: PRATT
A760: ROUND 17 | D760: 8TH AUGUST | J760: WEATHER | N760: FINE | S760: PLAYED AT | X760: LADDER | AB760: ROUND | AD760: 17
D761: 1ST QTR | H761: 2ND QTR | L761: 3RD QTR | P761: FINAL | S761: BRUNSWICK
A762: BRUNSWICK | C762: 2 | D762: 3 | E762: =C762*6+D762 -> 15 | G762: 4 | H762: 8 | I762: =G762*6+H762 -> 32 | K762: 7 | L762: 10 | M762: =K762*6+L762 -> 52 | O762: 8 | P762: 14 | Q762: =O762*6+P762 -> 62 | S762: UMPIRE | W762: TEAM | X762: W | Y762: L | Z762: D | AA762: FOR | AB762: AGST | AC762: % | AD762: PTS
A763: BRIGHTON | C763: 1 | D763: 2 | E763: =C763*6+D763 -> 8 | G763: 2 | H763: 5 | I763: =G763*6+H763 -> 17 | K763: 3 | L763: 9 | M763: =K763*6+L763 -> 27 | O763: 6 | P763: 12 | Q763: =O763*6+P763 -> 48 | S763: HURLEY
A764: BEST PLAYERS | W764: FOOTSCRAY | X764: 14 | Y764: 2 | Z764: 1 | AA764: 1047 | AB764: 646 | AC764: 162.07430340557275 | AD764: 58
A765: BRUNSWICK | D765: MONOHAN | G765: ABBOTT | J765: LEEDS | M765: CHASE | O765: S BALFE | R765: R BALFE | W765: WILLIAMSTOWN | X765: 12 | Y765: 5 | Z765: 0 | AA765: 1116 | AB765: 678 | AC765: 164.60176991150442 | AD765: 48
A766: BRIGHTON | D766: JAMES | G766: G ROBINSON | J766: ELLIS | M766: SCALES | O766: A LAXTON | R766: W ROBINSON | W766: ESSENDON ASSOC. | X766: 11 | Y766: 5 | Z766: 1 | AA766: 1106 | AB766: 721 | AC766: 153.39805825242718 | AD766: 46
A767: GOALKICKERS | W767: BRUNSWICK | X767: 11 | Y767: 6 | Z767: 0 | AA767: 1046 | AB767: 839 | AC767: 124.67222884386175 | AD767: 44
A768: BRUNSWICK | D768: PEARS 3 | G768: CLEMENTS 2 | K768: JOHNSTON | N768: O'SHEA | P768: CHASE
A769: BRIGHTON | D769: JAMES 2 | G769: PUMPHRIES | K769: W ROBINSON | N769: G ROBINSON | Q769: ODGERS | W769: PRAHRAN | X769: 10 | Y769: 6 | Z769: 1 | AA769: 852 | AB769: 602 | AC769: 141.5282392026578 | AD769: 42
W770: BRIGHTON | X770: 8 | Y770: 9 | Z770: 0 | AA770: 968 | AB770: 839 | AC770: 115.37544696066746 | AD770: 32
A771: FOOTSCRAY | C771: 2 | D771: 7 | E771: =C771*6+D771 -> 19 | G771: 4 | H771: 9 | I771: =G771*6+H771 -> 33 | K771: 8 | L771: 10 | M771: =K771*6+L771 -> 58 | O771: 11 | P771: 11 | Q771: =O771*6+P771 -> 77 | S771: FOOTSCRAY | W771: PORT MELBOURNE | X771: 6 | Y771: 10 | Z771: 1 | AA771: 798 | AB771: 972 | AC771: 82.098765432098759 | AD771: 26
A772: PORT MELBOURNE | C772: 1 | D772: 1 | E772: =C772*6+D772 -> 7 | G772: 2 | H772: 1 | I772: =G772*6+H772 -> 13 | K772: 3 | L772: 2 | M772: =K772*6+L772 -> 20 | O772: 7 | P772: 2 | Q772: =O772*6+P772 -> 44 | S772: LANE | W772: PRESTON | X772: 4 | Y772: 12 | Z772: 1 | AA772: 842 | AB772: 1072 | AC772: 78.544776119402982 | AD772: 18
A773: BEST PLAYERS | W773: NORTHCOTE | X773: 3 | Y773: 13 | Z773: 1 | AA773: 677 | AB773: 1252 | AC773: 54.073482428115014 | AD773: 14
A774: FOOTSCRAY | D774: CLARK | G774: HUTCHINSON | K774: JACOBSEN | N774: HANSEN | Q774: McCARTHY | T774: SEVIOR | W774: NORTH MELBOURNE | X774: 3 | Y774: 14 | Z774: 0 | AA774: 596 | AB774: 1427 | AC774: 41.765942536790469 | AD774: 12
A775: PORT MELBOURNE | D775: BRERETON | G775: PAMPERIN | K775: FRANKLIN | N775: WEATE | Q775: BATT | T775: PASH
A776: GOALKICKERS
A777: FOOTSCRAY | D777: HUTCHINSON 6 | H777: LAUNDER | J777: GUTHRIDGE | M777: COTTON | O777: JACOBSEN | R777: ELLIOTT
A778: PORT MELBOURNE | D778: HANGER 3 | G778: MULVANEY | J778: CLARK | L778: BATT | N778: WILLIAMSON
A780: PRAHRAN | C780: 3 | D780: 5 | E780: =C780*6+D780 -> 23 | G780: 5 | H780: 7 | I780: =G780*6+H780 -> 37 | K780: 7 | L780: 14 | M780: =K780*6+L780 -> 56 | O780: 10 | P780: 18 | Q780: =O780*6+P780 -> 78 | S780: TOORAK PARK
A781: PRESTON | C781: 3 | D781: 1 | E781: =C781*6+D781 -> 19 | G781: 4 | H781: 5 | I781: =G781*6+H781 -> 29 | K781: 7 | L781: 6 | M781: =K781*6+L781 -> 48 | O781: 7 | P781: 8 | Q781: =O781*6+P781 -> 50 | S781: VILLAIN
A782: BEST PLAYERS
A783: PRAHRAN | D783: SARTORI | G783: WATTS | J783: HAIGHBLOOM | M783: SYKES | P783: BENNION | S783: BUIST
A784: PRESTON | D784: WHITE | G784: HENDRIE | J784: TOMKINS | M784: OGDEN | P784: PUNCH | S784: BOURKE
A785: GOALKICKERS
A786: PRAHRAN | D786: SYKES 4 | G786: FARMER 3 | J786: BENNION | M786: HALL | O786: WATTS
A787: PRESTON | D787: PUNCH 2 | G787: WHITE 2 | J787: BOURKE | M787: OGDEN | O787: LANDELLS
A789: ESSENDON ASSOC. | C789: 2 | D789: 4 | E789: =C789*6+D789 -> 16 | G789: 9 | H789: 6 | I789: =G789*6+H789 -> 60 | K789: 13 | L789: 12 | M789: =K789*6+L789 -> 90 | O789: 18 | P789: 16 | Q789: =O789*6+P789 -> 124 | S789: ESSENDON
A790: NORTH MELBOURNE | C790: 1 | D790: 3 | E790: =C790*6+D790 -> 9 | G790: 4 | H790: 4 | I790: =G790*6+H790 -> 28 | K790: 6 | L790: 6 | M790: =K790*6+L790 -> 42 | O790: 6 | P790: 8 | Q790: =O790*6+P790 -> 44 | S790: KENDALL
A791: BEST PLAYERS
A792: ESSENDON ASSOC. | D792: MADDEN | G792: GRANT | J792: McCART | M792: ROLAND | P792: DYSON | S792: GREEN
A793: NORTH MELBOURNE | D793: KEATING | G793: H DARBY | J793: F DARBY | M793: HOLDEN | P793: DICK | S793: DAVIS
A794: GOALKICKERS
A795: ESSENDON ASSOC. | D795: McINTYRE 4 | G795: GREEN 3 | J795: GOSLING 3 | M795: TROTTER 3 | P795: HAMBRIDGE 2 | S795: GOUGH | U795: McCART | W795: ROLAND
A796: NORTH MELBOURNE | D796: KEATING 2 | G796: HOLDEN 2 | J796: ARMSTRONG | M796: F DARBY
A798: WILLIAMSTOWN | C798: 0 | D798: 11 | E798: =C798*6+D798 -> 11 | G798: 5 | H798: 14 | I798: =G798*6+H798 -> 44 | K798: 9 | L798: 18 | M798: =K798*6+L798 -> 72 | O798: 11 | P798: 22 | Q798: =O798*6+P798 -> 88 | S798: NORTHCOTE
A799: NORTHCOTE | C799: 3 | D799: 0 | E799: =C799*6+D799 -> 18 | G799: 6 | H799: 1 | I799: =G799*6+H799 -> 37 | K799: 6 | L799: 3 | M799: =K799*6+L799 -> 39 | O799: 9 | P799: 8 | Q799: =O799*6+P799 -> 62 | S799: NUGENT
A800: BEST PLAYERS
A801: WILLIAMSTOWN | D801: LAMB | G801: TYRELL | J801: GIBBS | M801: REITMAN | P801: GARBUTT | S801: ELLIS
A802: NORTHCOTE | D802: HOUGHTON | G802: DAVIDSON | J802: FEATHERSTONE | N802: COLE | P802: CHESSWASS | S802: CORLETT
A803: GOALKICKERS
A804: WILLIAMSTOWN | D804: BRIGGS 4 | G804: ADDISON 3 | J804: GARBUTT 2 | M804: ELLIS | O804: LAMB
A805: NORTHCOTE | D805: FEATHERSTONE 3 | I805: DAVIDSON 3 | L805: PRATT | N805: EDMONDS | Q805: GLUYAS
A807: ROUND 18 | D807: 15TH AUGUST | J807: WEATHER | N807: NORTH WIND | S807: PLAYED AT | X807: LADDER | AB807: ROUND | AD807: 18
D808: 1ST QTR | H808: 2ND QTR | L808: 3RD QTR | P808: FINAL | S808: WILLIAMSTOWN
A809: FOOTSCRAY | C809: 1 | D809: 1 | E809: =C809*6+D809 -> 7 | G809: 3 | H809: 2 | I809: =G809*6+H809 -> 20 | K809: 3 | L809: 6 | M809: =K809*6+L809 -> 24 | O809: 5 | P809: 8 | Q809: =O809*6+P809 -> 38 | S809: UMPIRE | W809: TEAM | X809: W | Y809: L | Z809: D | AA809: FOR | AB809: AGST | AC809: % | AD809: PTS
A810: WILLIAMSTOWN | C810: 1 | D810: 2 | E810: =C810*6+D810 -> 8 | G810: 2 | H810: 6 | I810: =G810*6+H810 -> 18 | K810: 4 | L810: 6 | M810: =K810*6+L810 -> 30 | O810: 5 | P810: 7 | Q810: =O810*6+P810 -> 37 | S810: KENDALL
A811: BEST PLAYERS | W811: FOOTSCRAY | X811: 15 | Y811: 2 | Z811: 1 | AA811: 1085 | AB811: 683 | AC811: 158.8579795021962 | AD811: 62
A812: FOOTSCRAY | D812: COTTON | G812: STEWART | J812: HANSEN | M812: NEILSON | P812: J NEYLON | S812: CLARK | W812: ESSENDON ASSOC. | X812: 12 | Y812: 5 | Z812: 1 | AA812: 1205 | AB812: 733 | AC812: 164.39290586630287 | AD812: 50
A813: WILLIAMSTOWN | D813: J CALDWELL | G813: W OUTEN | J813: TYRELL | M813: GARBUTT | P813: REITMAN | S813: ELLIS | W813: WILLIAMSTOWN | X813: 12 | Y813: 6 | Z813: 0 | AA813: 1153 | AB813: 716 | AC813: 161.03351955307264 | AD813: 48
A814: GOALKICKERS | W814: BRUNSWICK | X814: 12 | Y814: 6 | Z814: 0 | AA814: 1151 | AB814: 887 | AC814: 129.76324689966179 | AD814: 48
A815: FOOTSCRAY | D815: EGAN | F815: LAUNDER | I815: HUTCHINSON | L815: JACOBSEN | O815: ELLIOTT
A816: WILLIAMSTOWN | D816: BRIGGS 2 | G816: CARRIE | J816: FAIRCHILD | M816: ELLIS | W816: PRAHRAN | X816: 11 | Y816: 6 | Z816: 1 | AA816: 909 | AB816: 656 | AC816: 138.5670731707317 | AD816: 46
W817: BRIGHTON | X817: 8 | Y817: 10 | Z817: 0 | AA817: 1022 | AB817: 896 | AC817: 114.0625 | AD817: 32
A818: PRAHRAN | C818: 5 | D818: 1 | E818: =C818*6+D818 -> 31 | G818: 5 | H818: 2 | I818: =G818*6+H818 -> 32 | K818: 7 | L818: 7 | M818: =K818*6+L818 -> 49 | O818: 8 | P818: 9 | Q818: =O818*6+P818 -> 57 | S818: BRIGHTON | W818: PORT MELBOURNE | X818: 6 | Y818: 11 | Z818: 1 | AA818: 846 | AB818: 1077 | AC818: 78.551532033426184 | AD818: 26
A819: BRIGHTON | C819: 2 | D819: 1 | E819: =C819*6+D819 -> 13 | G819: 5 | H819: 8 | I819: =G819*6+H819 -> 38 | K819: 5 | L819: 9 | M819: =K819*6+L819 -> 39 | O819: 7 | P819: 12 | Q819: =O819*6+P819 -> 54 | S819: NUGENT | W819: PRESTON | X819: 4 | Y819: 13 | Z819: 1 | AA819: 887 | AB819: 1120 | AC819: 79.196428571428569 | AD819: 18
A820: BEST PLAYERS | W820: NORTH MELBOURNE | X820: 4 | Y820: 14 | Z820: 0 | AA820: 644 | AB820: 1472 | AC820: 43.75 | AD820: 16
A821: PRAHRAN | D821: RANKIN | G821: WILSON | J821: CARLSON | M821: BUIST | P821: SYKES | S821: BENNION | W821: NORTHCOTE | X821: 3 | Y821: 14 | Z821: 1 | AA821: 689 | AB821: 1351 | AC821: 50.999259807549961 | AD821: 14
A822: BRIGHTON | D822: G ROBINSON | G822: SCALES | J822: YOUNG | M822: H LAXTON | P822: ODGERS | S822: W ROBINSON
A823: GOALKICKERS
A824: PRAHRAN | D824: A FARMER 2 | H824: C FARMER 2 | K824: SYKES 2 | N824: HAIGHBLOOM | Q824: BENNION
A825: BRIGHTON | D825: KULPA 4 | G825: ODGERS | J825: HEWITT | L825: W ROBINSON
A827: BRUNSWICK | C827: 1 | D827: 0 | E827: =C827*6+D827 -> 6 | G827: 5 | H827: 5 | I827: =G827*6+H827 -> 35 | K827: 9 | L827: 9 | M827: =K827*6+L827 -> 63 | O827: 15 | P827: 15 | Q827: =O827*6+P827 -> 105 | S827: BRUNSWICK
A828: PORT MELBOURNE | C828: 1 | D828: 3 | E828: =C828*6+D828 -> 9 | G828: 3 | H828: 3 | I828: =G828*6+H828 -> 21 | K828: 4 | L828: 6 | M828: =K828*6+L828 -> 30 | O828: 7 | P828: 6 | Q828: =O828*6+P828 -> 48 | S828: VILLAIN
A829: BEST PLAYERS
A830: BRUNSWICK | D830: STANCLIFFE | G830: MONOHAN | J830: McKENZIE | M830: ABBOTT | P830: R BALFE | S830: S BALFE
A831: PORT MELBOURNE | D831: BROWN | G831: MEARNS | J831: WEATE | M831: FRANKLIN | P831: BRERETON | S831: MULVANEY
A832: GOALKICKERS
A833: BRUNSWICK | D833: PEARS 4 | G833: H BRAID 4 | J833: O'SHEA 2 | M833: CLEMENTS | O833: THOMAS | Q833: S BALFE | S833: EVERETT | V833: McKENZIE
A834: PORT MELBOURNE | D834: WILLIAMSON 2 | H834: PURVIS 2 | K834: MULVANEY | N834: CLARK | P834: HANGER
A836: NORTH MELBOURNE | C836: 0 | D836: 1 | E836: =C836*6+D836 -> 1 | G836: 3 | H836: 6 | I836: =G836*6+H836 -> 24 | K836: 3 | L836: 7 | M836: =K836*6+L836 -> 25 | O836: 6 | P836: 12 | Q836: =O836*6+P836 -> 48 | S836: NORTH MELB
A837: PRESTON | C837: 3 | D837: 4 | E837: =C837*6+D837 -> 22 | G837: 3 | H837: 4 | I837: =G837*6+H837 -> 22 | K837: 5 | L837: 12 | M837: =K837*6+L837 -> 42 | O837: 5 | P837: 15 | Q837: =O837*6+P837 -> 45 | S837: KRUSE
A838: BEST PLAYERS
A839: NORTH MELBOURNE | D839: KEATING | G839: HARDY | J839: PRATT | M839: FAGAN | P839: McSHERRY | S839: H DARBY
A840: PRESTON | D840: BOURKE | G840: S HALL | J840: STANLAKE | M840: OGDEN | P840: PUNCH | S840: HENDRIE
A841: GOALKICKERS
A842: NORTH MELBOURNE | D842: FAGAN 2 | G842: KEATING | J842: HARDY | M842: DICK
A843: PRESTON | D843: PUNCH 2 | G843: OGDEN | J843: TOMKINS | M843: E HALL
A845: ESSENDON ASSOC. | C845: 5 | D845: 4 | E845: =C845*6+D845 -> 34 | G845: 7 | H845: 9 | I845: =G845*6+H845 -> 51 | K845: 10 | L845: 12 | M845: =K845*6+L845 -> 72 | O845: 14 | P845: 15 | Q845: =O845*6+P845 -> 99 | S845: NORTHCOTE
A846: NORTHCOTE | C846: 0 | D846: 1 | E846: =C846*6+D846 -> 1 | G846: 0 | H846: 6 | I846: =G846*6+H846 -> 6 | K846: 0 | L846: 6 | M846: =K846*6+L846 -> 6 | O846: 1 | P846: 6 | Q846: =O846*6+P846 -> 12 | S846: LANE
A847: BEST PLAYERS
A848: ESSENDON ASSOC. | D848: W PAIN | G848: BENNETT | J848: MAINE | M848: GRANT | P848: DYSON | R848: McCART
A849: NORTHCOTE | D849: VERNON | G849: DAVIDSON | J849: HOUGHTON | M849: COLE | P849: BECK | R849: KEOGH
A850: GOALKICKERS
A851: ESSENDON ASSOC. | D851: McINTYRE 2 | G851: TROTTER 2 | J851: DYSON 2 | M851: GREEN 2 | O851: GOUGH | Q851: HAMBRIDGE | T851: McCART | V851: W PAIN | X851: GRANT | Z851: GOSLING
A852: NORTHCOTE | D852: DAVIDSON
A854: FINALS
A855: 1ST SEMI | D855: 22ND AUGUST | J855: WEATHER | M855: SOUTH WIND SHOWERS | S855: PLAYED AT
D856: 1ST QTR | H856: 2ND QTR | L856: 3RD QTR | P856: FINAL | S856: NORTH MELB
A857: FOOTSCRAY | C857: 3 | D857: 2 | E857: =C857*6+D857 -> 20 | G857: 3 | H857: 5 | I857: =G857*6+H857 -> 23 | K857: 5 | L857: 8 | M857: =K857*6+L857 -> 38 | O857: 6 | P857: 9 | Q857: =O857*6+P857 -> 45 | S857: UMPIRE
A858: WILLIAMSTOWN | C858: 0 | D858: 1 | E858: =C858*6+D858 -> 1 | G858: 2 | H858: 5 | I858: =G858*6+H858 -> 17 | K858: 3 | L858: 5 | M858: =K858*6+L858 -> 23 | O858: 4 | P858: 6 | Q858: =O858*6+P858 -> 30 | S858: LANE
A859: BEST PLAYERS
A860: FOOTSCRAY | D860: HANSEN | G860: STEWART | J860: EGAN | L860: COTTON | O860: HUTCHINSON | S860: SEVIOR
A861: WILLIAMSTOWN | D861: AMY | G861: MONAR | J861: ADDISON | L861: J CALDWELL | O861: ELLIS | S861: TYRELL
A862: GOALKICKERS
A863: FOOTSCRAY | D863: HUTCHINSON 4 | H863: BRENNAN | K863: McKINLEY
A864: WILLIAMSTOWN | D864: SHELLEY | G864: ADDISON | J864: BRIGGS | M864: GIBBS
A866: 2ND SEMI | D866: 22ND AUGUST | J866: WEATHER | M866: SOUTH WIND SHOWERS
A867: BRUNSWICK | C867: 0 | D867: 4 | E867: =C867*6+D867 -> 4 | G867: 2 | H867: 8 | I867: =G867*6+H867 -> 20 | K867: 3 | L867: 11 | M867: =K867*6+L867 -> 29 | O867: 5 | P867: 16 | Q867: =O867*6+P867 -> 46 | S867: PRINCES PK
A868: ESSENDON ASSOC. | C868: 1 | D868: 1 | E868: =C868*6+D868 -> 7 | G868: 3 | H868: 1 | I868: =G868*6+H868 -> 19 | K868: 4 | L868: 5 | M868: =K868*6+L868 -> 29 | O868: 5 | P868: 7 | Q868: =O868*6+P868 -> 37 | S868: KENDALL
A869: BEST PLAYERS
A870: BRUNSWICK | D870: PEARS | G870: MONOHAN | J870: CHASE | M870: JOHNSTON | P870: CLEMENTS | S870: H BRAID
A871: ESSENDON ASSOC. | D871: GOUGH | G871: BENNETT | J871: W PAIN | M871: ROLAND | P871: DYSON | S871: McCART
A872: GOALKICKERS
A873: BRUNSWICK | D873: CHASE 2 | G873: L BRAID | J873: H BRAID | M873: CLEMENTS
A874: ESSENDON ASSOC. | D874: McCART 2 | G874: BENNETT | J874: GOSLING | M874: DYSON
A876: FINAL | D876: 31ST AUGUST | J876: WEATHER | M876: FINE
A877: FOOTSCRAY | C877: 1 | D877: 2 | E877: 8 | G877: 3 | H877: 4 | I877: 22 | K877: 6 | L877: 5 | M877: 41 | O877: 9 | P877: 10 | Q877: =O877*6+P877 -> 64 | S877: M.C.G.
A878: BRUNSWICK | C878: 2 | D878: 0 | E878: 12 | G878: 4 | H878: 0 | I878: 24 | K878: 5 | L878: 3 | M878: 33 | O878: 6 | P878: 4 | Q878: =O878*6+P878 -> 40 | S878: LANE
A879: BEST PLAYERS
A880: FOOTSCRAY | D880: COTTON | G880: STEWART | J880: NEILSON | M880: LAUNDER | P880: J NEYLON | S880: HANSEN
A881: BRUNSWICK | D881: McKENZIE | G881: STANCLIFFE | J881: LEEDS | M881: THOMAS | P881: PEARS | S881: H BRAID
A882: GOALKICKERS
A883: FOOTSCRAY | D883: LAUNDER 3 | G883: COTTON 2 | J883: ELLIOTT 2 | M883: STEWART | O883: SEVIOR
A884: BRUNSWICK | D884: THOMAS 2 | G884: PEARS | J884: EVERETT | M884: CHASE | O884: JOHNSTON
A886: INTERSTATE MATCH | F886: 27TH JUNE | J886: WEATHER | M886: RAIN GROUND SOFT
A887: STH AUST | C887: 2 | D887: 5 | E887: =C887*6+D887 -> 17 | G887: 5 | H887: 8 | I887: =G887*6+H887 -> 38 | K887: 5 | L887: 8 | M887: =K887*6+L887 -> 38 | O887: 9 | P887: 10 | Q887: =O887*6+P887 -> 64 | S887: ADELAIDE
A888: V.F.A. | C888: 1 | D888: 1 | E888: =C888*6+D888 -> 7 | G888: 3 | H888: 2 | I888: =G888*6+H888 -> 20 | K888: 7 | L888: 8 | M888: =K888*6+L888 -> 50 | O888: 8 | P888: 9 | Q888: =O888*6+P888 -> 57 | S888: NORDEN
A889: BEST PLAYERS
A890: STH AUST | D890: MCKENZIE | G890: LEAHY | J890: TIERNEY | M890: STODDART | P890: ADCOCK | S890: CHAMBERLAIN
A891: V.F.A. | D891: COTTON | G891: ALLEY | J891: CHASE | M891: MUNDAY | P891: WRIGHT | S891: SYKES
A892: GOALKICKERS
A893: STH AUST | D893: JOHNS 3 | G893: CHAMBERLAIN 3 | K893: LEAHY | M893: TIERNEY | P893: JESSOP
A894: V.F.A. | D894: SYKES 2 | G894: J NEYLON | J894: ALLEY | L894: HARDY | N894: PASH | P894: BUIST | R894: CHASE
F896: 1ST JULY
A897: BROKEN HILL | C897: 3 | D897: 2 | E897: =C897*6+D897 -> 20 | G897: 5 | H897: 6 | I897: =G897*6+H897 -> 36 | K897: 6 | L897: 9 | M897: =K897*6+L897 -> 45 | O897: 7 | P897: 14 | Q897: =O897*6+P897 -> 56 | S897: BROKEN HILL
A898: V.F.A. | C898: 2 | D898: 1 | E898: =C898*6+D898 -> 13 | G898: 3 | H898: 6 | I898: =G898*6+H898 -> 24 | K898: 4 | L898: 9 | M898: =K898*6+L898 -> 33 | O898: 5 | P898: 11 | Q898: =O898*6+P898 -> 41
A899: BEST PLAYERS
A900: BROKEN HILL | D900: RENFREY | G900: CONLIN | J900: MEADOWS | M900: McGRATH | P900: TONKIN | S900: HILL
A901: V.F.A. | D901: COTTON | G901: BENNETT | J901: JOHNSON | M901: BUIST | P901: WRIGHT | S901: SYKES
A902: GOALKICKERS
A903: BROKEN HILL
A904: V.F.A. | D904: SYKES 3 | G904: TOMKINS | J904: CHASE
F906: 4TH JULY
A907: V.F.A. | C907: 2 | D907: 0 | E907: =C907*6+D907 -> 12 | G907: 4 | H907: 4 | I907: =G907*6+H907 -> 28 | K907: 5 | L907: 7 | M907: =K907*6+L907 -> 37 | O907: 5 | P907: 12 | Q907: =O907*6+P907 -> 42 | S907: BROKEN HILL
A908: BROKEN HILL | C908: 4 | D908: 2 | E908: =C908*6+D908 -> 26 | G908: 5 | H908: 2 | I908: =G908*6+H908 -> 32 | K908: 6 | L908: 2 | M908: =K908*6+L908 -> 38 | O908: 6 | P908: 5 | Q908: =O908*6+P908 -> 41
A909: BEST PLAYERS
A910: V.F.A. | D910: CHASE | G910: WRIGHT | J910: TREGLOWN | M910: BUIST | P910: BENNETT | S910: JOHNSON
A911: BROKEN HILL | D911: RENFREY | G911: MEADOWS | J911: HUNTER | M911: TUOHY | P911: CONLIN | S911: GLUYAS
A912: GOALKICKERS
A913: V.F.A.
A914: BROKEN HILL