A1: Victorian Football Association
A2: Season 1909
A3: © Copyright Wal Williams | F3: First created: 2 August 2014
A4: Contact: joywalwi at gmail dot com | F4: Last updated: 2 August 2014 | W4: VFA Results and tables - Link to the main index page
A5: You are free to copy this document in whole or part provided that proper acknowledgement is given to the author. All rights reserved.
A7: YEAR 1909 | X7: LADDER | AB7: ROUND | AD7: 1
A8: ROUND 1 | E8: 1ST MAY | J8: WEATHER | N8: NORTH WIND | S8: PLAYED AT
D9: 1ST QTR | H9: 2ND QTR | L9: 3RD QTR | P9: FINAL | S9: FOOTSCRAY | W9: TEAM | X9: W | Y9: L | Z9: D | AA9: FOR | AB9: AGST | AC9: % | AD9: PTS
A10: PRAHRAN | C10: 0 | D10: 1 | E10: =C10*6+D10 -> 1 | G10: 0 | H10: 4 | I10: =G10*6+H10 -> 4 | K10: 4 | L10: 7 | M10: =K10*6+L10 -> 31 | O10: 6 | P10: 13 | Q10: =O10*6+P10 -> 49 | S10: UMPIRE
A11: FOOTSCRAY | C11: 1 | D11: 4 | E11: =C11*6+D11 -> 10 | G11: 4 | H11: 4 | I11: =G11*6+H11 -> 28 | K11: 6 | L11: 6 | M11: =K11*6+L11 -> 42 | O11: 6 | P11: 6 | Q11: =O11*6+P11 -> 42 | S11: H GREGORY
A12: BEST PLAYERS | W12: ESSENDON ASSOC. | X12: 1 | Y12: 0 | Z12: 0 | AA12: 88 | AB12: 51 | AC12: 172.54901960784315 | AD12: 4
A13: PRAHRAN | D13: CARLSON | G13: ROURKE | J13: BACKWAY | M13: DOWSING | O13: HAIGHBLOOM | R13: BENNION | W13: PRESTON | X13: 1 | Y13: 0 | Z13: 0 | AA13: 77 | AB13: 51 | AC13: 150.98039215686273 | AD13: 4
A14: FOOTSCRAY | D14: T SEVIOR | G14: A GREGORY | J14: OGILVIE | M14: BOLGER | O14: JACOBSEN | R14: DUANE | W14: BRIGHTON | X14: 1 | Y14: 0 | Z14: 0 | AA14: 37 | AB14: 27 | AC14: 137.03703703703704 | AD14: 4
A15: GOALKICKERS | W15: PRAHRAN | X15: 1 | Y15: 0 | Z15: 0 | AA15: 49 | AB15: 42 | AC15: 116.66666666666667 | AD15: 4
A16: PRAHRAN | D16: FARMER 2 | G16: BENNION | J16: SYKES
A17: FOOTSCRAY | D17: DUANE 2 | G17: BOLGER | J17: HUTCHINSON | M17: A GREGORY | P17: OGILVIE | W17: PORT MELBOURNE | X17: 1 | Y17: 0 | Z17: 0 | AA17: 60 | AB17: 59 | AC17: 101.69491525423729 | AD17: 4
W18: NORTH MELBOURNE | X18: 0 | Y18: 1 | Z18: 0 | AA18: 59 | AB18: 60 | AC18: 98.333333333333329 | AD18: 0
A19: ESSENDON ASSOC. | C19: 4 | D19: 2 | E19: =C19*6+D19 -> 26 | G19: 8 | H19: 4 | I19: =G19*6+H19 -> 52 | K19: 10 | L19: 7 | M19: =K19*6+L19 -> 67 | O19: 13 | P19: 10 | Q19: =O19*6+P19 -> 88 | S19: ESSENDON | W19: FOOTSCRAY | X19: 0 | Y19: 1 | Z19: 0 | AA19: 42 | AB19: 49 | AC19: 85.714285714285708 | AD19: 0
A20: BRUNSWICK | C20: 3 | D20: 2 | E20: =C20*6+D20 -> 20 | G20: 3 | H20: 6 | I20: =G20*6+H20 -> 24 | K20: 5 | L20: 7 | M20: =K20*6+L20 -> 37 | O20: 7 | P20: 9 | Q20: =O20*6+P20 -> 51 | S20: HURLEY | W20: WILLIAMSTOWN | X20: 0 | Y20: 1 | Z20: 0 | AA20: 27 | AB20: 37 | AC20: 72.972972972972968 | AD20: 0
A21: BEST PLAYERS | W21: NORTHCOTE | X21: 0 | Y21: 1 | Z21: 0 | AA21: 51 | AB21: 77 | AC21: 66.233766233766232 | AD21: 0
A22: ESSENDON ASSOC. | D22: MADDEN | G22: HAMBRIDGE | J22: MONAGLE | M22: W PAIN | O22: GIBSON | R22: ATKINS | W22: BRUNSWICK | X22: 0 | Y22: 1 | Z22: 0 | AA22: 51 | AB22: 88 | AC22: 57.954545454545453 | AD22: 0
A23: BRUNSWICK | D23: H BRAID | G23: McKENZIE | J23: T WORLE | M23: FULLARTON | O23: J JOHNSON | R23: LEEDS
A24: GOALKICKERS
A25: ESSENDON ASSOC. | D25: HAMBRIDGE 6 | H25: GIBSON 2 | K25: DUFF 2 | N25: BARLOW 2 | Q25: MADDEN
A26: BRUNSWICK | D26: T WORLE 3 | H26: L BRAID 2 | K26: McKENZIE | N26: C ABBOTT
A28: PORT MELBOURNE | C28: 3 | D28: 0 | E28: =C28*6+D28 -> 18 | G28: 7 | H28: 3 | I28: =G28*6+H28 -> 45 | K28: 8 | L28: 3 | M28: =K28*6+L28 -> 51 | O28: 9 | P28: 6 | Q28: =O28*6+P28 -> 60 | S28: NORTH MELB
A29: NORTH MELBOURNE | C29: 2 | D29: 1 | E29: =C29*6+D29 -> 13 | G29: 3 | H29: 3 | I29: =G29*6+H29 -> 21 | K29: 6 | L29: 9 | M29: =K29*6+L29 -> 45 | O29: 8 | P29: 11 | Q29: =O29*6+P29 -> 59 | S29: VILLAIN
A30: BEST PLAYERS
A31: PORT MELBOURNE | D31: SIMMONDS | G31: FITZGERALD | J31: WILLIAMSON | M31: JOOLEN | P31: BROWN | S31: PAMPERIN
A32: NORTH MELBOURNE | D32: JOHNSON | G32: GETSON | J32: GIBNEY | M32: MORAN | P32: KENNEDY | S32: McKENZIE
A33: GOALKICKERS
A34: PORT MELBOURNE | D34: McCANN 3 | G34: WARD 2 | J34: PURVIS 2 | M34: PAMPERIN | P34: BATT
A35: NORTH MELBOURNE | D35: GETSON 3 | G35: GIBNEY 2 | J35: ARMSTRONG | M35: H DARBY | P35: JOHNSON
A37: PRESTON | C37: 2 | D37: 9 | E37: =C37*6+D37 -> 21 | G37: 2 | H37: 12 | I37: =G37*6+H37 -> 24 | K37: 5 | L37: 15 | M37: =K37*6+L37 -> 45 | O37: 10 | P37: 17 | Q37: =O37*6+P37 -> 77 | S37: NORTHCOTE
A38: NORTHCOTE | C38: 0 | D38: 2 | E38: =C38*6+D38 -> 2 | G38: 2 | H38: 8 | I38: =G38*6+H38 -> 20 | K38: 4 | L38: 9 | M38: =K38*6+L38 -> 33 | O38: 7 | P38: 9 | Q38: =O38*6+P38 -> 51 | S38: MARTIN
A39: BEST PLAYERS
A40: PRESTON | D40: YEOMANS | G40: BECK | J40: BASSETT | M40: PUNCH | P40: BILLINGS | S40: GIBSON
A41: NORTHCOTE | D41: BECK | G41: FEATHERSTONE | J41: MAY | M41: PRATT | P41: MILLS | S41: CRENNION
A42: GOALKICKERS
A43: PRESTON | D43: PUNCH 2 | G43: MASON 2 | J43: OGDEN 2 | M43: WHITE 2 | P43: GIBSON | S43: BECK
A44: NORTHCOTE | D44: L SMITH 4 | G44: CRENNION 2 | J44: ROBINSON
A46: BRIGHTON | C46: 2 | D46: 3 | E46: =C46*6+D46 -> 15 | G46: 2 | H46: 5 | I46: =G46*6+H46 -> 17 | K46: 3 | L46: 12 | M46: =K46*6+L46 -> 30 | O46: 4 | P46: 13 | Q46: =O46*6+P46 -> 37 | S46: WILLIAMSTOWN
A47: WILLIAMSTOWN | C47: 0 | D47: 3 | E47: =C47*6+D47 -> 3 | G47: 2 | H47: 5 | I47: =G47*6+H47 -> 17 | K47: 3 | L47: 7 | M47: =K47*6+L47 -> 25 | O47: 3 | P47: 9 | Q47: =O47*6+P47 -> 27 | S47: KENDALL
A48: BEST PLAYERS
A49: BRIGHTON | D49: G ROBINSON | G49: RYAN | J49: W ROBINSON | M49: WENBORN | P49: JAMES | S49: KENNEDY
A50: WILLIAMSTOWN | D50: WEIDNER | G50: W OUTEN | J50: LAWSON | M50: AMY | P50: ADDISON | S50: REITMAN
A51: GOALKICKERS
A52: BRIGHTON | D52: RYAN | G52: PLAISTED | J52: KULPA | L52: A LAXTON
A53: WILLIAMSTOWN | D53: ADDISON 2 | G53: MATTHEWS
A55: ROUND 2 | E55: 8TH MAY | J55: WEATHER | N55: RAIN GROUNDS BAD | S55: PLAYED AT | X55: LADDER | AB55: ROUND | AD55: 2
D56: 1ST QTR | H56: 2ND QTR | L56: 3RD QTR | P56: FINAL | S56: PRESTON
A57: PRESTON | C57: 2 | D57: 4 | E57: =C57*6+D57 -> 16 | G57: 4 | H57: 7 | I57: =G57*6+H57 -> 31 | K57: 5 | L57: 9 | M57: =K57*6+L57 -> 39 | O57: 6 | P57: 16 | Q57: =O57*6+P57 -> 52 | S57: UMPIRE | W57: TEAM | X57: W | Y57: L | Z57: D | AA57: FOR | AB57: AGST | AC57: % | AD57: PTS
A58: ESSENDON ASSOC. | C58: 0 | D58: 1 | E58: =C58*6+D58 -> 1 | G58: 1 | H58: 2 | I58: =G58*6+H58 -> 8 | K58: 2 | L58: 6 | M58: =K58*6+L58 -> 18 | O58: 5 | P58: 8 | Q58: =O58*6+P58 -> 38 | S58: KENDALL
A59: BEST PLAYERS | W59: PRESTON | X59: 2 | Y59: 0 | Z59: 0 | AA59: 129 | AB59: 89 | AC59: 144.9438202247191 | AD59: 8
A60: PRESTON | D60: OGDEN | F60: HENDRIE | I60: WHITE | L60: PUNCH | N60: BASSETT | Q60: YEOMANS | W60: BRIGHTON | X60: 2 | Y60: 0 | Z60: 0 | AA60: 81 | AB60: 59 | AC60: 137.28813559322035 | AD60: 8
A61: ESSENDON ASSOC. | D61: ABBOTT | F61: HOARE | I61: MAINE | L61: BARLOW | N61: MADDEN | Q61: BENNETT | W61: PRAHRAN | X61: 2 | Y61: 0 | Z61: 0 | AA61: 105 | AB61: 94 | AC61: 111.70212765957447 | AD61: 8
A62: GOALKICKERS | W62: ESSENDON ASSOC. | X62: 1 | Y62: 1 | Z62: 0 | AA62: 126 | AB62: 103 | AC62: 122.33009708737865 | AD62: 4
A63: PRESTON | D63: GIBSON 2 | G63: HENDRIE | J63: WHITE | M63: PANNAM | O63: SULLIVAN
A64: ESSENDON ASSOC. | D64: HOARE 2 | G64: ABBOTT 2 | K64: DUFF | W64: FOOTSCRAY | X64: 1 | Y64: 1 | Z64: 0 | AA64: 100 | AB64: 99 | AC64: 101.01010101010101 | AD64: 4
W65: NORTHCOTE | X65: 1 | Y65: 1 | Z65: 0 | AA65: 87 | AB65: 89 | AC65: 97.752808988764045 | AD65: 4
A66: BRIGHTON | C66: 1 | D66: 1 | E66: =C66*6+D66 -> 7 | G66: 3 | H66: 4 | I66: =G66*6+H66 -> 22 | K66: 4 | L66: 7 | M66: =K66*6+L66 -> 31 | O66: 6 | P66: 8 | Q66: =O66*6+P66 -> 44 | S66: BRIGHTON | W66: PORT MELBOURNE | X66: 1 | Y66: 1 | Z66: 0 | AA66: 72 | AB66: 95 | AC66: 75.78947368421052 | AD66: 4
A67: NORTH MELBOURNE | C67: 1 | D67: 1 | E67: =C67*6+D67 -> 7 | G67: 1 | H67: 6 | I67: =G67*6+H67 -> 12 | K67: 2 | L67: 7 | M67: =K67*6+L67 -> 19 | O67: 4 | P67: 8 | Q67: =O67*6+P67 -> 32 | S67: McDOWELL | W67: NORTH MELBOURNE | X67: 0 | Y67: 2 | Z67: 0 | AA67: 91 | AB67: 104 | AC67: 87.5 | AD67: 0
A68: BEST PLAYERS | W68: WILLIAMSTOWN | X68: 0 | Y68: 2 | Z68: 0 | AA68: 79 | AB68: 93 | AC68: 84.946236559139791 | AD68: 0
A69: BRIGHTON | D69: WENBORN | G69: PLAISTED | I69: HARDIMAN | K69: W ROBINSON | N69: A LAXTON | Q69: W KENNEDY | W69: BRUNSWICK | X69: 0 | Y69: 2 | Z69: 0 | AA69: 101 | AB69: 146 | AC69: 69.178082191780817 | AD69: 0
A70: NORTH MELBOURNE | D70: JOHNSON | G70: SYKES | I70: DICK | K70: McKENZIE | N70: SPEAKMAN | Q70: ARMSTRONG
A71: GOALKICKERS
A72: BRIGHTON | D72: KULPA 2 | G72: JOHNSON | J72: HARDIMAN | M72: W ROBINSON | P72: RYAN
A73: NORTH MELBOURNE | D73: ARMSTRONG 3 | H73: HARDY
A75: PRAHRAN | C75: 1 | D75: 2 | E75: =C75*6+D75 -> 8 | G75: 4 | H75: 3 | I75: =G75*6+H75 -> 27 | K75: 5 | L75: 5 | M75: =K75*6+L75 -> 35 | O75: 8 | P75: 8 | Q75: =O75*6+P75 -> 56 | S75: TOORAK PARK
A76: WILLIAMSTOWN | C76: 2 | D76: 3 | E76: =C76*6+D76 -> 15 | G76: 2 | H76: 6 | I76: =G76*6+H76 -> 18 | K76: 4 | L76: 7 | M76: =K76*6+L76 -> 31 | O76: 7 | P76: 10 | Q76: =O76*6+P76 -> 52 | S76: PYE
A77: BEST PLAYERS
A78: PRAHRAN | D78: ROURKE | G78: BACKWAY | J78: DOWSING | M78: CARLSON | P78: WOODS | S78: WILSON
A79: WILLIAMSTOWN | D79: ALLEY | G79: HARTSHORN | J79: M OUTEN | M79: REITMAN | P79: ADDISON | S79: MONAR
A80: GOALKICKERS
A81: PRAHRAN | D81: SYKES 3 | G81: WATTS 2 | J81: BENNION | M81: H FARMER | P81: HALL
A82: WILLIAMSTOWN | D82: GARBUTT 2 | G82: ADDISON 2 | J82: MONAR | M82: GELL | P82: AMY
A84: NORTHCOTE | C84: 0 | D84: 4 | E84: =C84*6+D84 -> 4 | G84: 2 | H84: 4 | I84: =G84*6+H84 -> 16 | K84: 2 | L84: 4 | M84: =K84*6+L84 -> 16 | O84: 5 | P84: 6 | Q84: =O84*6+P84 -> 36 | S84: PORT MELB
A85: PORT MELBOURNE | C85: 0 | D85: 1 | E85: =C85*6+D85 -> 1 | G85: 0 | H85: 3 | I85: =G85*6+H85 -> 3 | K85: 1 | L85: 5 | M85: =K85*6+L85 -> 11 | O85: 1 | P85: 6 | Q85: =O85*6+P85 -> 12 | S85: NOONAN
A86: BEST PLAYERS
A87: NORTHCOTE | D87: FEATHERSTONE | G87: CRENNION | J87: BECK | M87: CHESSWASS | P87: FAIRBANK | S87: PRATT
A88: PORT MELBOURNE | D88: ANDERSON | G88: WATT | J88: SIMMONDS | M88: FITZGERALD | P88: PURVIS | S88: ROBERTS
A89: GOALKICKERS
A90: NORTHCOTE | D90: L SMITH | G90: BECK | J90: PRATT | L90: CRENNION | O90: THOMAS
A91: PORT MELBOURNE | D91: MENZIES
A93: FOOTSCRAY | C93: 1 | D93: 2 | E93: =C93*6+D93 -> 8 | G93: 4 | H93: 6 | I93: =G93*6+H93 -> 30 | K93: 6 | L93: 9 | M93: =K93*6+L93 -> 45 | O93: 8 | P93: 10 | Q93: =O93*6+P93 -> 58 | S93: BRUNSWICK
A94: BRUNSWICK | C94: 3 | D94: 1 | E94: =C94*6+D94 -> 19 | G94: 4 | H94: 2 | I94: =G94*6+H94 -> 26 | K94: 6 | L94: 5 | M94: =K94*6+L94 -> 41 | O94: 7 | P94: 8 | Q94: =O94*6+P94 -> 50 | S94: HURLEY
A95: BEST PLAYERS
A96: FOOTSCRAY | D96: OGILVIE | F96: COTTON | I96: A GREGORY | L96: BORTHWICK | O96: W McCARTHY | S96: O'CONNELL
A97: BRUNSWICK | D97: O'SHEA | F97: CHASE | I97: FULLARTON | L97: L WORLE | O97: GILLESPIE | S97: TURNBULL
A98: GOALKICKERS
A99: FOOTSCRAY | D99: HUTCHINSON 4 | H99: McKINLEY | K99: LAUNDER | N99: BORTHWICK | Q99: COTTON
A100: BRUNSWICK | D100: BLACK 3 | G100: L BRAID | J100: CHASE | M100: H BRAID | P100: FULLARTON
A102: ROUND 3 | E102: 15TH MAY | J102: WEATHER | M102: NORTH BREEZE RAIN IN MORNING | S102: PLAYED AT | X102: LADDER | AB102: ROUND | AD102: 3
D103: 1ST QTR | H103: 2ND QTR | L103: 3RD QTR | P103: FINAL | S103: ESSENDON
A104: ESSENDON ASSOC. | C104: 0 | D104: 0 | E104: =C104*6+D104 -> 0 | G104: 2 | H104: 3 | I104: =G104*6+H104 -> 15 | K104: 4 | L104: 6 | M104: =K104*6+L104 -> 30 | O104: 7 | P104: 9 | Q104: =O104*6+P104 -> 51 | S104: UMPIRE | W104: TEAM | X104: W | Y104: L | Z104: D | AA104: FOR | AB104: AGST | AC104: % | AD104: PTS
A105: BRIGHTON | C105: 3 | D105: 1 | E105: =C105*6+D105 -> 19 | G105: 4 | H105: 2 | I105: =G105*6+H105 -> 26 | K105: 4 | L105: 3 | M105: =K105*6+L105 -> 27 | O105: 5 | P105: 3 | Q105: =O105*6+P105 -> 33 | S105: KENDALL
A106: BEST PLAYERS | W106: PRAHRAN | X106: 3 | Y106: 0 | Z106: 0 | AA106: 180 | AB106: 108 | AC106: 166.66666666666666 | AD106: 12
A107: ESSENDON ASSOC. | D107: HOARE | F107: W PAIN | H107: TURNER | K107: ABBOTT | N107: MAINE | Q107: MADDEN | W107: ESSENDON ASSOC. | X107: 2 | Y107: 1 | Z107: 0 | AA107: 177 | AB107: 136 | AC107: 130.14705882352942 | AD107: 8
A108: BRIGHTON | D108: McCLEERY | F108: BROWN | H108: WENBORN | K108: KUSCHART | N108: KULPA | Q108: KENNEDY | W108: FOOTSCRAY | X108: 2 | Y108: 1 | Z108: 0 | AA108: 167 | AB108: 133 | AC108: 125.56390977443608 | AD108: 8
A109: GOALKICKERS | W109: PRESTON | X109: 2 | Y109: 1 | Z109: 0 | AA109: 163 | AB109: 156 | AC109: 104.48717948717949 | AD109: 8
A110: ESSENDON ASSOC. | D110: HAMBRIDGE 2 | H110: GOUGH 2 | K110: MADDEN | N110: ABBOTT | P110: ATKINS
A111: BRIGHTON | D111: RYAN 2 | H111: PLAISTED | K111: SCALES | N111: G ROBINSON | W111: BRIGHTON | X111: 2 | Y111: 1 | Z111: 0 | AA111: 114 | AB111: 110 | AC111: 103.63636363636364 | AD111: 8
W112: WILLIAMSTOWN | X112: 1 | Y112: 2 | Z112: 0 | AA112: 158 | AB112: 116 | AC112: 136.20689655172413 | AD112: 4
A113: FOOTSCRAY | C113: 5 | D113: 5 | E113: =C113*6+D113 -> 35 | G113: 5 | H113: 5 | I113: =G113*6+H113 -> 35 | K113: 8 | L113: 13 | M113: =K113*6+L113 -> 61 | O113: 9 | P113: 13 | Q113: =O113*6+P113 -> 67 | S113: FOOTSCRAY | W113: NORTHCOTE | X113: 1 | Y113: 2 | Z113: 0 | AA113: 135 | AB113: 151 | AC113: 89.403973509933778 | AD113: 4
A114: PRESTON | C114: 0 | D114: 0 | E114: =C114*6+D114 -> 0 | G114: 1 | H114: 6 | I114: =G114*6+H114 -> 12 | K114: 1 | L114: 6 | M114: =K114*6+L114 -> 12 | O114: 4 | P114: 10 | Q114: =O114*6+P114 -> 34 | S114: GROVES | W114: BRUNSWICK | X114: 1 | Y114: 2 | Z114: 0 | AA114: 163 | AB114: 194 | AC114: 84.020618556701038 | AD114: 4
A115: BEST PLAYERS | W115: PORT MELBOURNE | X115: 1 | Y115: 2 | Z115: 0 | AA115: 95 | AB115: 174 | AC115: 54.597701149425291 | AD115: 4
A116: FOOTSCRAY | D116: T SEVIOR | F116: COTTON | I116: CLARKE | L116: HANSEN | N116: OGILVIE | Q116: BORTHWICK | W116: NORTH MELBOURNE | X116: 0 | Y116: 3 | Z116: 0 | AA116: 105 | AB116: 179 | AC116: 58.659217877094974 | AD116: 0
A117: PRESTON | D117: BILLINGS | F117: PUNCH | I117: TOMKINS | L117: OGDEN | N117: HENDRIE | Q117: WHITE
A118: GOALKICKERS
A119: FOOTSCRAY | D119: COTTON 2 | G119: CLARKE 2 | J119: HUTCHINSON 2 | N119: GREGORY | Q119: HANSON | T119: T SEVIOR
A120: PRESTON | D120: PUNCH 2 | G120: TOMKINS 2
A122: PRAHRAN | C122: 2 | D122: 2 | E122: =C122*6+D122 -> 14 | G122: 4 | H122: 5 | I122: =G122*6+H122 -> 29 | K122: 6 | L122: 9 | M122: =K122*6+L122 -> 45 | O122: 11 | P122: 9 | Q122: =O122*6+P122 -> 75 | S122: NORTH MELB
A123: NORTH MELBOURNE | C123: 0 | D123: 0 | E123: =C123*6+D123 -> 0 | G123: 1 | H123: 1 | I123: =G123*6+H123 -> 7 | K123: 2 | L123: 1 | M123: =K123*6+L123 -> 13 | O123: 2 | P123: 2 | Q123: =O123*6+P123 -> 14 | S123: HURLEY
A124: BEST PLAYERS
A125: PRAHRAN | D125: WOODS | G125: DOWSING | J125: ROURKE | M125: SYKES | P125: WRIGHT | S125: CARLSON
A126: NORTH MELBOURNE | D126: JOHNSON | G126: GIBNEY | J126: MORAN | M126: SYKES | P126: KEATING | S126: TRELOAR
A127: GOALKICKERS
A128: PRAHRAN | D128: SYKES 7 | G128: HALL 2 | J128: WATTS | M128: FARMER
A129: NORTH MELBOURNE | D129: KEATING | G129: SYKES
A131: WILLIAMSTOWN | C131: 3 | D131: 5 | E131: =C131*6+D131 -> 23 | G131: 3 | H131: 6 | I131: =G131*6+H131 -> 24 | K131: 9 | L131: 13 | M131: =K131*6+L131 -> 67 | O131: 11 | P131: 13 | Q131: =O131*6+P131 -> 79 | S131: WILLIAMSTOWN
A132: PORT MELBOURNE | C132: 0 | D132: 0 | E132: =C132*6+D132 -> 0 | G132: 1 | H132: 3 | I132: =G132*6+H132 -> 9 | K132: 1 | L132: 3 | M132: =K132*6+L132 -> 9 | O132: 3 | P132: 5 | Q132: =O132*6+P132 -> 23 | S132: PYE
A133: BEST PLAYERS
A134: WILLIAMSTOWN | D134: WEIDNER | G134: HARTSHORN | J134: ALLEY | M134: M OUTEN | P134: ADDISON | S134: SCOTT
A135: PORT MELBOURNE | D135: FRANKLIN | G135: FITZGERALD | J135: JACKSON | M135: MONOGHAN | P135: WEATE | S135: ANDERSON
A136: GOALKICKERS
A137: WILLIAMSTOWN | D137: MATTHEWS 4 | H137: GARBUTT 3 | K137: AMY | M137: ADDISON | P137: MONAR | R137: ALLEY
A138: PORT MELBOURNE | D138: MONOGHAN | H138: ANDERSON | K138: PARTRIDGE
A140: BRUNSWICK | C140: 3 | D140: 3 | E140: =C140*6+D140 -> 21 | G140: 3 | H140: 7 | I140: =G140*6+H140 -> 25 | K140: 6 | L140: 11 | M140: =K140*6+L140 -> 47 | O140: 8 | P140: 14 | Q140: =O140*6+P140 -> 62 | S140: NORTHCOTE
A141: NORTHCOTE | C141: 2 | D141: 2 | E141: =C141*6+D141 -> 14 | G141: 2 | H141: 2 | I141: =G141*6+H141 -> 14 | K141: 3 | L141: 5 | M141: =K141*6+L141 -> 23 | O141: 7 | P141: 6 | Q141: =O141*6+P141 -> 48 | S141: VILLAIN
A142: BEST PLAYERS
A143: BRUNSWICK | D143: McKENZIE | G143: O'SHEA | J143: CHASE | M143: FULLARTON
A144: NORTHCOTE | D144: BECK | G144: THOMAS | J144: PRATT | M144: FAIRBANK | P144: FEATHERSTONE | T144: McCONCHIE
A145: GOALKICKERS
A146: BRUNSWICK | D146: BLACK 2 | G146: McKENZIE | J146: L BRAID | M146: CHASE | O146: H BRAID | Q146: SMITH
A147: NORTHCOTE | D147: McCONCHIE 3 | G147: L SMITH | J147: THOMAS | M147: PRATT | O147: O'LOUGHLIN
A149: ROUND 4 | E149: 22ND MAY | J149: WEATHER | N149: FINE | S149: PLAYED AT | X149: LADDER | AB149: ROUND | AD149: 4
D150: 1ST QTR | H150: 2ND QTR | L150: 3RD QTR | P150: FINAL | S150: BRIGHTON
A151: BRIGHTON | C151: 3 | D151: 5 | E151: =C151*6+D151 -> 23 | G151: 5 | H151: 7 | I151: =G151*6+H151 -> 37 | K151: 7 | L151: 10 | M151: =K151*6+L151 -> 52 | O151: 12 | P151: 10 | Q151: =O151*6+P151 -> 82 | S151: UMPIRE | W151: TEAM | X151: W | Y151: L | Z151: D | AA151: FOR | AB151: AGST | AC151: % | AD151: PTS
A152: FOOTSCRAY | C152: 2 | D152: 1 | E152: =C152*6+D152 -> 13 | G152: 6 | H152: 4 | I152: =G152*6+H152 -> 40 | K152: 8 | L152: 6 | M152: =K152*6+L152 -> 54 | O152: 9 | P152: 11 | Q152: =O152*6+P152 -> 65 | S152: McDOWELL
A153: BEST PLAYERS | W153: PRAHRAN | X153: 4 | Y153: 0 | Z153: 0 | AA153: 266 | AB153: 163 | AC153: 163.19018404907976 | AD153: 16
A154: BRIGHTON | D154: KENNEDY | F154: A LAXTON | I154: KULPA | L154: W ROBINSON | O154: ABERCROMBE | R154: GILBERT | W154: ESSENDON ASSOC. | X154: 3 | Y154: 1 | Z154: 0 | AA154: 228 | AB154: 180 | AC154: 126.66666666666667 | AD154: 12
A155: FOOTSCRAY | D155: OGILVIE | F155: O'CONNELL | I155: COTTON | L155: DUANE | O155: W McCARTHY | R155: CLARKE | W155: BRIGHTON | X155: 3 | Y155: 1 | Z155: 0 | AA155: 196 | AB155: 175 | AC155: 112 | AD155: 12
A156: GOALKICKERS | W156: FOOTSCRAY | X156: 2 | Y156: 2 | Z156: 0 | AA156: 232 | AB156: 215 | AC156: 107.90697674418605 | AD156: 8
A157: BRIGHTON | D157: HARDIMAN 4 | G157: RYAN 2 | I157: KULPA 2 | K157: W ROBINSON 2 | N157: PLAISTED | Q157: SLOSS
A158: FOOTSCRAY | D158: COTTON 2 | F158: HUTCHINSON | I158: O'CONNELL | K158: OGILVIE | M158: A GREGORY | O158: LAUNDER | Q158: DUANE | S158: KNIGHT | W158: PRESTON | X158: 2 | Y158: 2 | Z158: 0 | AA158: 206 | AB158: 202 | AC158: 101.98019801980197 | AD158: 8
W159: BRUNSWICK | X159: 2 | Y159: 2 | Z159: 0 | AA159: 228 | AB159: 232 | AC159: 98.275862068965523 | AD159: 8
A160: ESSENDON ASSOC. | C160: 2 | D160: 1 | E160: =C160*6+D160 -> 13 | G160: 4 | H160: 2 | I160: =G160*6+H160 -> 26 | K160: 6 | L160: 6 | M160: =K160*6+L160 -> 42 | O160: 7 | P160: 9 | Q160: =O160*6+P160 -> 51 | S160: ESSENDON | W160: PORT MELBOURNE | X160: 2 | Y160: 2 | Z160: 0 | AA160: 141 | AB160: 217 | AC160: 64.976958525345623 | AD160: 8
A161: WILLIAMSTOWN | C161: 2 | D161: 3 | E161: =C161*6+D161 -> 15 | G161: 4 | H161: 5 | I161: =G161*6+H161 -> 29 | K161: 4 | L161: 6 | M161: =K161*6+L161 -> 30 | O161: 6 | P161: 8 | Q161: =O161*6+P161 -> 44 | S161: HURLEY | W161: WILLIAMSTOWN | X161: 1 | Y161: 3 | Z161: 0 | AA161: 202 | AB161: 167 | AC161: 120.95808383233533 | AD161: 4
A162: BEST PLAYERS | W162: NORTHCOTE | X162: 1 | Y162: 3 | Z162: 0 | AA162: 190 | AB162: 237 | AC162: 80.168776371308013 | AD162: 4
A163: ESSENDON ASSOC. | D163: W PAIN | G163: TURNER | J163: ATKINS | M163: MADDEN | P163: ABBOTT | R163: GRANT | W163: NORTH MELBOURNE | X163: 0 | Y163: 4 | Z163: 0 | AA163: 143 | AB163: 244 | AC163: 58.606557377049178 | AD163: 0
A164: WILLIAMSTOWN | D164: ALLEY | G164: W OUTEN | J164: M OUTEN | M164: REITMAN | P164: ELDRIDGE | R164: HARTSHORN
A165: GOALKICKERS
A166: ESSENDON ASSOC. | D166: LANIGAN 2 | G166: ABBOTT 2 | J166: BARLOW | L166: HOARE | N166: GRIFFITHS
A167: WILLIAMSTOWN | D167: ADDISON 3 | G167: MATTHEWS 2 | K167: GELL
A169: PORT MELBOURNE | C169: 2 | D169: 3 | E169: =C169*6+D169 -> 15 | G169: 5 | H169: 5 | I169: =G169*6+H169 -> 35 | K169: 5 | L169: 8 | M169: =K169*6+L169 -> 38 | O169: 6 | P169: 10 | Q169: =O169*6+P169 -> 46 | S169: PORT MELB
A170: PRESTON | C170: 0 | D170: 1 | E170: =C170*6+D170 -> 1 | G170: 3 | H170: 2 | I170: =G170*6+H170 -> 20 | K170: 4 | L170: 6 | M170: =K170*6+L170 -> 30 | O170: 6 | P170: 7 | Q170: =O170*6+P170 -> 43 | S170: MARTIN
A171: BEST PLAYERS
A172: PORT MELBOURNE | D172: WEATE | G172: McKAY | J172: SIMMONDS | M172: ANDERSON | P172: FITZGERALD | S172: BROWN
A173: PRESTON | D173: TOMKINS | G173: OGDEN | J173: YEOMANS | M173: S HALL | P173: BILLINGS | S173: MASON
A174: GOALKICKERS
A175: PORT MELBOURNE | D175: SIMMONDS 4 | H175: PURVIS | J175: WILLIAMSON
A176: PRESTON | D176: CANT 2 | G176: YEOMANS 2 | K176: PUNCH | N176: HENDRIE
A178: PRAHRAN | C178: 1 | D178: 5 | E178: =C178*6+D178 -> 11 | G178: 4 | H178: 9 | I178: =G178*6+H178 -> 33 | K178: 8 | L178: 10 | M178: =K178*6+L178 -> 58 | O178: 12 | P178: 14 | Q178: =O178*6+P178 -> 86 | S178: TOORAK PARK
A179: NORTHCOTE | C179: 2 | D179: 2 | E179: =C179*6+D179 -> 14 | G179: 4 | H179: 2 | I179: =G179*6+H179 -> 26 | K179: 5 | L179: 2 | M179: =K179*6+L179 -> 32 | O179: 8 | P179: 7 | Q179: =O179*6+P179 -> 55 | S179: NOONAN
A180: BEST PLAYERS
A181: PRAHRAN | D181: CARLSON | G181: JULIAN | J181: WOODS | M181: BENNION | P181: WATTS | S181: ROURKE
A182: NORTHCOTE | D182: MONOHAN | G182: FAIRBANK | J182: THOMAS | M182: COLE | P182: FEATHERSTONE | S182: CHESSWASS
A183: GOALKICKERS
A184: PRAHRAN | D184: WATTS 3 | G184: BENNION 3 | J184: FARMER 2 | L184: WOODS | N184: SYKES | P184: JOHNSTON | S184: BOURKE
A185: NORTHCOTE | D185: L SMITH 4 | G185: THOMAS 2 | J185: McCONCHIE | M185: WALKER
A187: BRUNSWICK | C187: 2 | D187: 5 | E187: =C187*6+D187 -> 17 | G187: 4 | H187: 7 | I187: =G187*6+H187 -> 31 | K187: 6 | L187: 7 | M187: =K187*6+L187 -> 43 | O187: 9 | P187: 11 | Q187: =O187*6+P187 -> 65 | S187: BRUNSWICK
A188: NORTH MELBOURNE | C188: 0 | D188: 2 | E188: =C188*6+D188 -> 2 | G188: 1 | H188: 6 | I188: =G188*6+H188 -> 12 | K188: 3 | L188: 13 | M188: =K188*6+L188 -> 31 | O188: 4 | P188: 14 | Q188: =O188*6+P188 -> 38 | S188: KENDALL
A189: BEST PLAYERS
A190: BRUNSWICK | D190: McKENZIE | G190: CHASE | J190: L BRAID | M190: LEEDS | O190: O'SHEA | R190: McIVOR
A191: NORTH MELBOURNE | D191: HOPKINS | G191: GIBNEY | J191: MARCHBANKS | M191: SPEAKMAN | O191: JOHNSON | R191: TRELOAR
A192: GOALKICKERS
A193: BRUNSWICK | D193: CHASE 3 | G193: THOMAS 2 | J193: JOHNSON | M193: STANCLIFFE | P193: T WORLE | R193: McIVOR
A194: NORTH MELBOURNE | D194: GIBNEY | G194: BARKER | J194: ARMSTRONG | M194: TRELOAR
A196: ROUND 5 | E196: 29TH MAY | J196: WEATHER | N196: FINE | S196: PLAYED AT | X196: LADDER | AB196: ROUND | AD196: 5
D197: 1ST QTR | H197: 2ND QTR | L197: 3RD QTR | P197: FINAL | S197: BRIGHTON
A198: PRAHRAN | C198: 1 | D198: 0 | E198: =C198*6+D198 -> 6 | G198: 5 | H198: 5 | I198: =G198*6+H198 -> 35 | K198: 6 | L198: 10 | M198: =K198*6+L198 -> 46 | O198: 10 | P198: 12 | Q198: =O198*6+P198 -> 72 | S198: UMPIRE | W198: TEAM | X198: W | Y198: L | Z198: D | AA198: FOR | AB198: AGST | AC198: % | AD198: PTS
A199: BRIGHTON | C199: 2 | D199: 2 | E199: =C199*6+D199 -> 14 | G199: 3 | H199: 4 | I199: =G199*6+H199 -> 22 | K199: 6 | L199: 4 | M199: =K199*6+L199 -> 40 | O199: 6 | P199: 5 | Q199: =O199*6+P199 -> 41 | S199: HURLEY
A200: BEST PLAYERS | W200: PRAHRAN | X200: 5 | Y200: 0 | Z200: 0 | AA200: 338 | AB200: 204 | AC200: 165.68627450980392 | AD200: 20
A201: PRAHRAN | D201: WOODS | G201: CARLSON | I201: HAIGHBLOOM | L201: ROURKE | O201: JULIAN | Q201: DOWSING | W201: ESSENDON ASSOC. | X201: 4 | Y201: 1 | Z201: 0 | AA201: 308 | AB201: 201 | AC201: 153.23383084577114 | AD201: 16
A202: BRIGHTON | D202: HARDIMAN | G202: SLOSS | I202: LAWLOR | L202: A LAXTON | O202: RENNOLDS | Q202: KUSCHART | W202: BRUNSWICK | X202: 3 | Y202: 2 | Z202: 0 | AA202: 258 | AB202: 248 | AC202: 104.03225806451613 | AD202: 12
A203: GOALKICKERS | W203: BRIGHTON | X203: 3 | Y203: 2 | Z203: 0 | AA203: 237 | AB203: 247 | AC203: 95.951417004048579 | AD203: 12
A204: PRAHRAN | D204: WATTS 3 | G204: H FARMER 2 | J204: HALL 2 | M204: ROURKE | O204: BENNION | Q204: HAIGHBLOOM
A205: BRIGHTON | D205: PLAISTED | G205: A LAXTON | J205: PLOWMAN | M205: RYAN | O205: W ROBINSON | R205: KULPA | W205: WILLIAMSTOWN | X205: 2 | Y205: 3 | Z205: 0 | AA205: 241 | AB205: 200 | AC205: 120.5 | AD205: 8
W206: FOOTSCRAY | X206: 2 | Y206: 3 | Z206: 0 | AA206: 265 | AB206: 254 | AC206: 104.33070866141732 | AD206: 8
A207: BRUNSWICK | C207: 3 | D207: 2 | E207: =C207*6+D207 -> 20 | G207: 4 | H207: 4 | I207: =G207*6+H207 -> 28 | K207: 4 | L207: 4 | M207: =K207*6+L207 -> 28 | O207: 4 | P207: 6 | Q207: =O207*6+P207 -> 30 | S207: BRUNSWICK | W207: PRESTON | X207: 2 | Y207: 3 | Z207: 0 | AA207: 258 | AB207: 262 | AC207: 98.473282442748086 | AD207: 8
A208: PORT MELBOURNE | C208: 0 | D208: 1 | E208: =C208*6+D208 -> 1 | G208: 0 | H208: 7 | I208: =G208*6+H208 -> 7 | K208: 0 | L208: 8 | M208: =K208*6+L208 -> 8 | O208: 1 | P208: 10 | Q208: =O208*6+P208 -> 16 | S208: NOONAN | W208: PORT MELBOURNE | X208: 2 | Y208: 3 | Z208: 0 | AA208: 157 | AB208: 247 | AC208: 63.56275303643725 | AD208: 8
A209: BEST PLAYERS | W209: NORTH MELBOURNE | X209: 1 | Y209: 4 | Z209: 0 | AA209: 203 | AB209: 296 | AC209: 68.581081081081081 | AD209: 4
A210: BRUNSWICK | D210: WATTS | G210: O'SHEA | J210: WALKER | L210: ABBOTT | O210: LEEDS | R210: FISHER | W210: NORTHCOTE | X210: 1 | Y210: 4 | Z210: 0 | AA210: 211 | AB210: 317 | AC210: 66.561514195583598 | AD210: 4
A211: PORT MELBOURNE | D211: WATTS | G211: ANDERSON | J211: BATT | L211: WILLIAMSON | O211: McKAY | R211: McCANN
A212: GOALKICKERS
A213: BRUNSWICK | D213: H BRAID | G213: BLACK | J213: O'SHEA | M213: JOHNSON
A214: PORT MELBOURNE | D214: McCANN
A216: WILLIAMSTOWN | C216: 1 | D216: 3 | E216: =C216*6+D216 -> 9 | G216: 1 | H216: 6 | I216: =G216*6+H216 -> 12 | K216: 2 | L216: 12 | M216: =K216*6+L216 -> 24 | O216: 4 | P216: 15 | Q216: =O216*6+P216 -> 39 | S216: WILLIAMSTOWN
A217: FOOTSCRAY | C217: 1 | D217: 2 | E217: =C217*6+D217 -> 8 | G217: 1 | H217: 3 | I217: =G217*6+H217 -> 9 | K217: 2 | L217: 5 | M217: =K217*6+L217 -> 17 | O217: 4 | P217: 9 | Q217: =O217*6+P217 -> 33 | S217: VILLAIN
A218: BEST PLAYERS
A219: WILLIAMSTOWN | D219: SCOTT | G219: MONAR | J219: HARTSHORN | M219: ELDRIDGE | P219: ELLIS | S219: MATTHEWS
A220: FOOTSCRAY | D220: OGILVIE | G220: COTTON | J220: CLARKE | M220: T SEVIOR | P220: W McCARTHY | S220: DUANE
A221: GOALKICKERS
A222: WILLIAMSTOWN | D222: GARBUTT 2 | G222: M OUTEN | J222: MATTHEWS
A223: FOOTSCRAY | D223: LAUNDER 2 | G223: KNIGHT 2
A225: NORTH MELBOURNE | C225: 3 | D225: 3 | E225: =C225*6+D225 -> 21 | G225: 5 | H225: 3 | I225: =G225*6+H225 -> 33 | K225: 7 | L225: 8 | M225: =K225*6+L225 -> 50 | O225: 8 | P225: 12 | Q225: =O225*6+P225 -> 60 | S225: PRESTON
A226: PRESTON | C226: 1 | D226: 0 | E226: =C226*6+D226 -> 6 | G226: 4 | H226: 5 | I226: =G226*6+H226 -> 29 | K226: 5 | L226: 6 | M226: =K226*6+L226 -> 36 | O226: 7 | P226: 10 | Q226: =O226*6+P226 -> 52 | S226: KENDALL
A227: BEST PLAYERS
A228: NORTH MELBOURNE | D228: JOHNSON | G228: SPEAKMAN | J228: PEMBERTON | M228: GIBNEY | P228: HOPKINS | S228: HARDY
A229: PRESTON | D229: TOMKINS | G229: DUNCAN | J229: HENDRIE | M229: YEOMANS | P229: BASSETT | S229: PUNCH
A230: GOALKICKERS
A231: NORTH MELBOURNE | D231: ARMSTRONG 4 | G231: SPEAKMAN 2 | J231: HARDY | L231: HOMANN
A232: PRESTON | D232: PRINCE 2 | G232: BROWN 2 | J232: PUNCH | L232: PANNAM | O232: TOMKINS
A234: ESSENDON ASSOC. | C234: 3 | D234: 2 | E234: =C234*6+D234 -> 20 | G234: 6 | H234: 5 | I234: =G234*6+H234 -> 41 | K234: 8 | L234: 9 | M234: =K234*6+L234 -> 57 | O234: 11 | P234: 14 | Q234: =O234*6+P234 -> 80 | S234: NORTHCOTE
A235: NORTHCOTE | C235: 0 | D235: 2 | E235: =C235*6+D235 -> 2 | G235: 1 | H235: 3 | I235: =G235*6+H235 -> 9 | K235: 1 | L235: 3 | M235: =K235*6+L235 -> 9 | O235: 3 | P235: 3 | Q235: =O235*6+P235 -> 21 | S235: PYE
A236: BEST PLAYERS
A237: ESSENDON ASSOC. | D237: ATKINS | G237: MADDEN | J237: HAMBRIDGE | M237: REEVES | P237: TURNER | S237: GRANT
A238: NORTHCOTE | D238: FEATHERSTONE | G238: PETTIT | J238: HAUGHTON | M238: BECK | P238: COLE | S238: FAIRBANK
A239: GOALKICKERS
A240: ESSENDON ASSOC. | D240: HAMBRIDGE 4 | H240: HOARE 3 | J240: ABBOTT | L240: TURNER | N240: LANIGAN | Q240: BARLOW
A241: NORTHCOTE | D241: BECK 2 | G241: FEATHERSTONE
A243: ROUND 6 | E243: 5TH JUNE | J243: WEATHER | N243: RAIN GROUNDS BAD | S243: PLAYED AT | X243: LADDER | AB243: ROUND | AD243: 6
D244: 1ST QTR | H244: 2ND QTR | L244: 3RD QTR | P244: FINAL | S244: TOORAK PARK
A245: ESSENDON ASSOC. | C245: 4 | D245: 2 | E245: =C245*6+D245 -> 26 | G245: 7 | H245: 4 | I245: =G245*6+H245 -> 46 | K245: 10 | L245: 6 | M245: =K245*6+L245 -> 66 | O245: 11 | P245: 10 | Q245: =O245*6+P245 -> 76 | S245: UMPIRE | W245: TEAM | X245: W | Y245: L | Z245: D | AA245: FOR | AB245: AGST | AC245: % | AD245: PTS
A246: PRAHRAN | C246: 1 | D246: 0 | E246: =C246*6+D246 -> 6 | G246: 2 | H246: 6 | I246: =G246*6+H246 -> 18 | K246: 5 | L246: 8 | M246: =K246*6+L246 -> 38 | O246: 8 | P246: 10 | Q246: =O246*6+P246 -> 58 | S246: KENDALL
A247: BEST PLAYERS | W247: ESSENDON ASSOC. | X247: 5 | Y247: 1 | Z247: 0 | AA247: 384 | AB247: 259 | AC247: 148.26254826254825 | AD247: 20
A248: ESSENDON ASSOC. | D248: REEVES | G248: HAORE | I248: MONAGLE | L248: DYSON | N248: W PAIN | Q248: MAINE | W248: PRAHRAN | X248: 5 | Y248: 1 | Z248: 0 | AA248: 396 | AB248: 280 | AC248: 141.42857142857142 | AD248: 20
A249: PRAHRAN | D249: DOWSING | G249: BENNION | I249: PARSONS | L249: CARLSON | N249: H FARMER | Q249: HAIGHBLOOM | W249: BRUNSWICK | X249: 4 | Y249: 2 | Z249: 0 | AA249: 312 | AB249: 264 | AC249: 118.18181818181819 | AD249: 16
A250: GOALKICKERS | W250: BRIGHTON | X250: 4 | Y250: 2 | Z250: 0 | AA250: 284 | AB250: 270 | AC250: 105.18518518518519 | AD250: 16
A251: ESSENDON ASSOC. | D251: BARLOW 4 | G251: HAMBRIDGE 3 | J251: GOUGH | L251: MONAGLE | O251: ABBOTT | Q251: ATKINS
A252: PRAHRAN | D252: CARLSON 2 | G252: BENNION | I252: WATTS | K252: JULIAN | M252: HAIGHBLOOM | P252: H FARMER | R252: HALL | W252: WILLIAMSTOWN | X252: 3 | Y252: 3 | Z252: 0 | AA252: 324 | AB252: 247 | AC252: 131.17408906882591 | AD252: 12
W253: FOOTSCRAY | X253: 3 | Y253: 3 | Z253: 0 | AA253: 344 | AB253: 289 | AC253: 119.03114186851211 | AD253: 12
A254: BRUNSWICK | C254: 1 | D254: 2 | E254: =C254*6+D254 -> 8 | G254: 2 | H254: 5 | I254: =G254*6+H254 -> 17 | K254: 5 | L254: 10 | M254: =K254*6+L254 -> 40 | O254: 7 | P254: 12 | Q254: =O254*6+P254 -> 54 | S254: PRESTON | W254: PRESTON | X254: 2 | Y254: 4 | Z254: 0 | AA254: 274 | AB254: 316 | AC254: 86.708860759493675 | AD254: 8
A255: PRESTON | C255: 1 | D255: 6 | E255: =C255*6+D255 -> 12 | G255: 1 | H255: 7 | I255: =G255*6+H255 -> 13 | K255: 1 | L255: 10 | M255: =K255*6+L255 -> 16 | O255: 1 | P255: 10 | Q255: =O255*6+P255 -> 16 | S255: NOONAN | W255: PORT MELBOURNE | X255: 2 | Y255: 4 | Z255: 0 | AA255: 180 | AB255: 294 | AC255: 61.224489795918366 | AD255: 8
A256: BEST PLAYERS | W256: NORTH MELBOURNE | X256: 1 | Y256: 5 | Z256: 0 | AA256: 250 | AB256: 379 | AC256: 65.963060686015837 | AD256: 4
A257: BRUNSWICK | D257: McKENZIE | G257: O'SHEA | J257: L BRAID | L257: GILLESPIE | O257: PEARS | R257: CHASE | W257: NORTHCOTE | X257: 1 | Y257: 5 | Z257: 0 | AA257: 246 | AB257: 396 | AC257: 62.121212121212125 | AD257: 4
A258: PRESTON | D258: BROWN | G258: TOMKINS | J258: OGDEN | L258: BILLINGS | O258: HOLLIGAN | R258: DUNCAN
A259: GOALKICKERS
A260: BRUNSWICK | D260: FISHER 3 | G260: CHASE 3 | J260: TURNBULL
A261: PRESTON | D261: HENDRIE
A263: BRIGHTON | C263: 1 | D263: 5 | E263: =C263*6+D263 -> 11 | G263: 2 | H263: 7 | I263: =G263*6+H263 -> 19 | K263: 4 | L263: 14 | M263: =K263*6+L263 -> 38 | O263: 5 | P263: 17 | Q263: =O263*6+P263 -> 47 | S263: PORT MELB
A264: PORT MELBOURNE | C264: 1 | D264: 0 | E264: =C264*6+D264 -> 6 | G264: 1 | H264: 3 | I264: =G264*6+H264 -> 9 | K264: 1 | L264: 3 | M264: =K264*6+L264 -> 9 | O264: 3 | P264: 5 | Q264: =O264*6+P264 -> 23 | S264: VILLAIN
A265: BEST PLAYERS
A266: BRIGHTON | D266: WENBORN | G266: PLAISTED | J266: HARDIMAN | M266: W ROBINSON | P266: BOYLAND | S266: McCLEERY
A267: PORT MELBOURNE | D267: TREGLOWN | G267: SIMMONDS | J267: McCANN | M267: FRANKLIN | P267: FITZGERALD | S267: WEATE
A268: GOALKICKERS
A269: BRIGHTON | D269: HARDIMAN 3 | G269: RYAN | I269: KULPA
A270: PORT MELBOURNE | D270: McCANN 2 | G270: ST JOHN
A272: FOOTSCRAY | C272: 2 | D272: 2 | E272: =C272*6+D272 -> 14 | G272: 6 | H272: 6 | I272: =G272*6+H272 -> 42 | K272: 9 | L272: 11 | M272: =K272*6+L272 -> 65 | O272: 11 | P272: 13 | Q272: =O272*6+P272 -> 79 | S272: FOOTSCRAY
A273: NORTHCOTE | C273: 0 | D273: 0 | E273: =C273*6+D273 -> 0 | G273: 2 | H273: 1 | I273: =G273*6+H273 -> 13 | K273: 2 | L273: 3 | M273: =K273*6+L273 -> 15 | O273: 5 | P273: 5 | Q273: =O273*6+P273 -> 35 | S273: MARTIN
A274: BEST PLAYERS
A275: FOOTSCRAY | D275: OGILVIE | G275: CLARKE | J275: DUANE | M275: A GREGORY | P275: NEILSON | S275: COTTON
A276: NORTHCOTE | D276: BECK | G276: HAUGHTON | J276: HASSETT | M276: O'LOUGHLIN | P276: DANIELS | S276: FAIRBANK
A277: GOALKICKERS
A278: FOOTSCRAY | D278: COTTON 4 | G278: KNIGHT 2 | J278: OGILVIE | L278: LAUNDER | N278: GARTON | Q278: CLARKE | T278: EGAN
A279: NORTHCOTE | D279: O'LOUGHLIN 3 | G279: PETTIT
A281: WILLIAMSTOWN | C281: 3 | D281: 1 | E281: =C281*6+D281 -> 19 | G281: 6 | H281: 4 | I281: =G281*6+H281 -> 40 | K281: 10 | L281: 7 | M281: =K281*6+L281 -> 67 | O281: 12 | P281: 11 | Q281: =O281*6+P281 -> 83 | S281: NORTH MELB
A282: NORTH MELBOURNE | C282: 1 | D282: 5 | E282: =C282*6+D282 -> 11 | G282: 3 | H282: 8 | I282: =G282*6+H282 -> 26 | K282: 5 | L282: 8 | M282: =K282*6+L282 -> 38 | O282: 6 | P282: 11 | Q282: =O282*6+P282 -> 47 | S282: HURLEY
A283: BEST PLAYERS
A284: WILLIAMSTOWN | D284: ALLEY | G284: SCOTT | J284: GIBBS | M284: GARBUTT | P284: MATTHEWS | S284: HARTSHORN
A285: NORTH MELBOURNE | D285: ARMSTRONG | G285: HARDY | J285: GIBNEY | M285: MORAN | P285: SPEAKMAN | S285: LAVER
A286: GOALKICKERS
A287: WILLIAMSTOWN | D287: GARBUTT 5 | G287: MATTHEWS 3 | K287: GIBBS 2 | N287: ALLEY | P287: ADDISON
A288: NORTH MELBOURNE | D288: ARMSTRONG 5 | H288: HOPKINS
A290: ROUND 7 | D290: 7TH JUNE | F290: PRINCE OF WALES BIRTHDAY | K290: WEATHER | N290: FINE & SUNNY AFTER FOG | S290: PLAYED AT | X290: LADDER | AB290: ROUND | AD290: 7
D291: 1ST QTR | H291: 2ND QTR | L291: 3RD QTR | P291: FINAL | S291: WILLIAMSTOWN
A292: WILLIAMSTOWN | C292: 3 | D292: 2 | E292: =C292*6+D292 -> 20 | G292: 5 | H292: 6 | I292: =G292*6+H292 -> 36 | K292: 7 | L292: 7 | M292: =K292*6+L292 -> 49 | O292: 8 | P292: 9 | Q292: =O292*6+P292 -> 57 | S292: UMPIRE | W292: TEAM | X292: W | Y292: L | Z292: D | AA292: FOR | AB292: AGST | AC292: % | AD292: PTS
A293: BRUNSWICK | C293: 2 | D293: 1 | E293: =C293*6+D293 -> 13 | G293: 3 | H293: 2 | I293: =G293*6+H293 -> 20 | K293: 4 | L293: 3 | M293: =K293*6+L293 -> 27 | O293: 6 | P293: 4 | Q293: =O293*6+P293 -> 40 | S293: MARTIN
A294: BEST PLAYERS | W294: ESSENDON ASSOC. | X294: 6 | Y294: 1 | Z294: 0 | AA294: 430 | AB294: 283 | AC294: 151.9434628975265 | AD294: 24
A295: WILLIAMSTOWN | D295: MONAR | G295: HARTSHORN | J295: W OUTEN | M295: M OUTEN | O295: ALLEY | Q295: REITMAN | W295: PRAHRAN | X295: 6 | Y295: 1 | Z295: 0 | AA295: 455 | AB295: 320 | AC295: 142.1875 | AD295: 24
A296: BRUNSWICK | D296: McKENZIE | G296: GILLESPIE | J296: ABBOTT | M296: PEARS | O296: O'SHEA | Q296: JOHNSON | W296: BRIGHTON | X296: 5 | Y296: 2 | Z296: 0 | AA296: 341 | AB296: 298 | AC296: 114.42953020134229 | AD296: 20
A297: GOALKICKERS | W297: WILLIAMSTOWN | X297: 4 | Y297: 3 | Z297: 0 | AA297: 381 | AB297: 287 | AC297: 132.75261324041813 | AD297: 16
A298: WILLIAMSTOWN | D298: GARBUTT 3 | G298: ADDISON 2 | J298: MATTHEWS 2 | N298: WEIDNER
A299: BRUNSWICK | D299: CLEMENTS 2 | G299: JOHNSON | J299: FISHER | M299: L WORLE | O299: WILLIAMS | W299: BRUNSWICK | X299: 4 | Y299: 3 | Z299: 0 | AA299: 352 | AB299: 321 | AC299: 109.65732087227414 | AD299: 16
W300: FOOTSCRAY | X300: 3 | Y300: 4 | Z300: 0 | AA300: 368 | AB300: 335 | AC300: 109.85074626865672 | AD300: 12
A301: BRIGHTON | C301: 3 | D301: 1 | E301: =C301*6+D301 -> 19 | G301: 5 | H301: 1 | I301: =G301*6+H301 -> 31 | K301: 5 | L301: 5 | M301: =K301*6+L301 -> 35 | O301: 8 | P301: 9 | Q301: =O301*6+P301 -> 57 | S301: BRIGHTON | W301: PRESTON | X301: 2 | Y301: 5 | Z301: 0 | AA301: 302 | AB301: 373 | AC301: 80.965147453083105 | AD301: 8
A302: PRESTON | C302: 1 | D302: 1 | E302: =C302*6+D302 -> 7 | G302: 3 | H302: 5 | I302: =G302*6+H302 -> 23 | K302: 3 | L302: 5 | M302: =K302*6+L302 -> 23 | O302: 3 | P302: 10 | Q302: =O302*6+P302 -> 28 | S302: NOONAN | W302: NORTHCOTE | X302: 2 | Y302: 5 | Z302: 0 | AA302: 312 | AB302: 457 | AC302: 68.271334792122545 | AD302: 8
A303: BEST PLAYERS | W303: PORT MELBOURNE | X303: 2 | Y303: 5 | Z303: 0 | AA303: 220 | AB303: 353 | AC303: 62.322946175637391 | AD303: 8
A304: BRIGHTON | D304: SLOSS | G304: LAWLOR | J304: HYETT | M304: WENBORN | O304: PLAISTED | Q304: A LAXTON | W304: NORTH MELBOURNE | X304: 1 | Y304: 6 | Z304: 0 | AA304: 311 | AB304: 445 | AC304: 69.887640449438209 | AD304: 4
A305: PRESTON | D305: TOMKINS | G305: DUNCAN | J305: OGDEN | M305: BILLINGS | O305: S HALL | Q305: HENDRIE
A306: GOALKICKERS
A307: BRIGHTON | D307: PLAISTED 3 | H307: RYAN 3 | K307: HARDIMAN | N307: W ROBINSON
A308: PRESTON | D308: HOLLIGAN | G308: OGDEN | J308: PANNAM
A310: ESSENDON ASSOC. | C310: 0 | D310: 3 | E310: =C310*6+D310 -> 3 | G310: 2 | H310: 9 | I310: =G310*6+H310 -> 21 | K310: 4 | L310: 10 | M310: =K310*6+L310 -> 34 | O310: 5 | P310: 16 | Q310: =O310*6+P310 -> 46 | S310: ESSENDON
A311: FOOTSCRAY | C311: 1 | D311: 1 | E311: =C311*6+D311 -> 7 | G311: 1 | H311: 4 | I311: =G311*6+H311 -> 10 | K311: 1 | L311: 5 | M311: =K311*6+L311 -> 11 | O311: 3 | P311: 6 | Q311: =O311*6+P311 -> 24 | S311: KENDALL
A312: BEST PLAYERS
A313: ESSENDON ASSOC. | D313: MADDEN | G313: GRANT | J313: McINTYRE | M313: W PAIN | P313: HOARE | S313: ERRINGTON
A314: FOOTSCRAY | D314: OGILVIE | G314: COTTON | J314: NEILSON | M314: T SEVIOR | P314: W McCARTHY | S314: BORTHWICK
A315: GOALKICKERS
A316: ESSENDON ASSOC. | D316: REEVES 2 | G316: ERRINGTON | J316: BARLOW | M316: HAMBRIDGE
A317: FOOTSCRAY | D317: BORTHWICK | G317: KNIGHT | J317: COTTON
A319: PRAHRAN | C319: 1 | D319: 2 | E319: =C319*6+D319 -> 8 | G319: 4 | H319: 7 | I319: =G319*6+H319 -> 31 | K319: 4 | L319: 8 | M319: =K319*6+L319 -> 32 | O319: 8 | P319: 11 | Q319: =O319*6+P319 -> 59 | S319: PORT MELB
A320: PORT MELBOURNE | C320: 1 | D320: 1 | E320: =C320*6+D320 -> 7 | G320: 2 | H320: 3 | I320: =G320*6+H320 -> 15 | K320: 5 | L320: 8 | M320: =K320*6+L320 -> 38 | O320: 5 | P320: 10 | Q320: =O320*6+P320 -> 40 | S320: VILLAIN
A321: BEST PLAYERS
A322: PRAHRAN | D322: DOWSING | G322: WOODS | J322: CARLSON | M322: BENNION | P322: H FARMER | S322: PARSONS
A323: PORT MELBOURNE | D323: FRANKLIN | G323: WEATE | J323: PASH | M323: JACKSON | P323: SIMMONDS | S323: ST JOHN
A324: GOALKICKERS
A325: PRAHRAN | D325: C FARMER 2 | H325: HALL | J325: H FARMER | M325: WATTS | O325: BENNION
A326: PORT MELBOURNE | D326: ST JOHN 3 | H326: McGEE 2
A328: NORTHCOTE | C328: 1 | D328: 1 | E328: =C328*6+D328 -> 7 | G328: 3 | H328: 8 | I328: =G328*6+H328 -> 26 | K328: 8 | L328: 11 | M328: =K328*6+L328 -> 59 | O328: 9 | P328: 12 | Q328: =O328*6+P328 -> 66 | S328: CROXTON PK
A329: NORTH MELBOURNE | C329: 2 | D329: 2 | E329: =C329*6+D329 -> 14 | G329: 7 | H329: 2 | I329: =G329*6+H329 -> 44 | K329: 7 | L329: 4 | M329: =K329*6+L329 -> 46 | O329: 9 | P329: 7 | Q329: =O329*6+P329 -> 61 | S329: HURLEY
A330: BEST PLAYERS
A331: NORTHCOTE | D331: MONOHAN | G331: PRATT | J331: BECK | M331: CHESSWASS | P331: COLE | R331: FEATHERSTONE
A332: NORTH MELBOURNE | D332: KEATING | G332: MORAN | J332: H DARBY | M332: HOMAN | P332: ARMSTRONG | S332: HARDY
A333: GOALKICKERS
A334: NORTHCOTE | D334: O'LOUGHLIN 4 | H334: McCONCHIE 2 | K334: CHESSWASS | N334: FEATHERSTONE
A335: NORTH MELBOURNE | D335: ARMSTRONG 4 | H335: BARKER 2 | K335: HARDY | M335: GIBNEY | O335: HOPKINS
A337: ROUND 8 | E337: 12TH JUNE | J337: WEATHER | N337: NORTH WIND RAIN | S337: PLAYED AT | X337: LADDER | AB337: ROUND | AD337: 8
D338: 1ST QTR | H338: 2ND QTR | L338: 3RD QTR | P338: FINAL | S338: BRUNSWICK
A339: BRIGHTON | C339: 3 | D339: 3 | E339: =C339*6+D339 -> 21 | G339: 5 | H339: 5 | I339: =G339*6+H339 -> 35 | K339: 6 | L339: 6 | M339: =K339*6+L339 -> 42 | O339: 6 | P339: 8 | Q339: =O339*6+P339 -> 44 | S339: UMPIRE | W339: TEAM | X339: W | Y339: L | Z339: D | AA339: FOR | AB339: AGST | AC339: % | AD339: PTS
A340: BRUNSWICK | C340: 0 | D340: 3 | E340: =C340*6+D340 -> 3 | G340: 0 | H340: 5 | I340: =G340*6+H340 -> 5 | K340: 2 | L340: 8 | M340: =K340*6+L340 -> 20 | O340: 4 | P340: 11 | Q340: =O340*6+P340 -> 35 | S340: VILLAIN
A341: BEST PLAYERS | W341: ESSENDON ASSOC. | X341: 7 | Y341: 1 | Z341: 0 | AA341: 456 | AB341: 301 | AC341: 151.49501661129568 | AD341: 28
A342: BRIGHTON | D342: SLOSS | G342: W ROBINSON | J342: DUNCAN | M342: A LAXTON | O342: HARDIMAN | R342: KULPA | W342: PRAHRAN | X342: 7 | Y342: 1 | Z342: 0 | AA342: 539 | AB342: 361 | AC342: 149.30747922437672 | AD342: 28
A343: BRUNSWICK | D343: McKENZIE | G343: MILLS | J343: DUNSTAN | M343: WILLIAMS | O343: JOHNSON | R343: CHASE | W343: BRIGHTON | X343: 6 | Y343: 2 | Z343: 0 | AA343: 385 | AB343: 333 | AC343: 115.61561561561561 | AD343: 24
A344: GOALKICKERS | W344: WILLIAMSTOWN | X344: 5 | Y344: 3 | Z344: 0 | AA344: 464 | AB344: 329 | AC344: 141.03343465045592 | AD344: 20
A345: BRIGHTON | D345: RYAN 3 | G345: HARDIMAN | J345: PLAISTED | M345: SLOSS
A346: BRUNSWICK | D346: MILLS | G346: McKENZIE | J346: JOHNSON | M346: GILLESPIE | W346: FOOTSCRAY | X346: 4 | Y346: 4 | Z346: 0 | AA346: 447 | AB346: 368 | AC346: 121.46739130434783 | AD346: 16
W347: BRUNSWICK | X347: 4 | Y347: 4 | Z347: 0 | AA347: 387 | AB347: 365 | AC347: 106.02739726027397 | AD347: 16
A348: PRAHRAN | C348: 4 | D348: 2 | E348: =C348*6+D348 -> 26 | G348: 4 | H348: 4 | I348: =G348*6+H348 -> 28 | K348: 8 | L348: 12 | M348: =K348*6+L348 -> 60 | O348: 12 | P348: 12 | Q348: =O348*6+P348 -> 84 | S348: PRESTON | W348: PRESTON | X348: 2 | Y348: 6 | Z348: 0 | AA348: 343 | AB348: 457 | AC348: 75.054704595185996 | AD348: 8
A349: PRESTON | C349: 1 | D349: 1 | E349: =C349*6+D349 -> 7 | G349: 2 | H349: 8 | I349: =G349*6+H349 -> 20 | K349: 2 | L349: 8 | M349: =K349*6+L349 -> 20 | O349: 5 | P349: 11 | Q349: =O349*6+P349 -> 41 | S349: MARTIN | W349: NORTHCOTE | X349: 2 | Y349: 6 | Z349: 0 | AA349: 354 | AB349: 540 | AC349: 65.555555555555557 | AD349: 8
A350: BEST PLAYERS | W350: PORT MELBOURNE | X350: 2 | Y350: 6 | Z350: 0 | AA350: 253 | AB350: 432 | AC350: 58.564814814814817 | AD350: 8
A351: PRAHRAN | D351: DOWSING | G351: CULLEN | J351: WILSON | M351: ALLEN | O351: JULIAN | R351: ROURKE | W351: NORTH MELBOURNE | X351: 1 | Y351: 7 | Z351: 0 | AA351: 329 | AB351: 471 | AC351: 69.85138004246285 | AD351: 4
A352: PRESTON | D352: HENDRIE | G352: WHITE | J352: BASSETT | M352: OGDEN | O352: PANNAM | R352: DUNCAN
A353: GOALKICKERS
A354: PRAHRAN | D354: HALL 5 | G354: WATTS 4 | J354: WRIGHT 2 | M354: BENNION
A355: PRESTON | D355: PUNCH | F355: HENDRIE | I355: CANT | K355: PANNAM | N355: WHITE
A357: WILLIAMSTOWN | C357: 1 | D357: 7 | E357: =C357*6+D357 -> 13 | G357: 5 | H357: 11 | I357: =G357*6+H357 -> 41 | K357: 8 | L357: 13 | M357: =K357*6+L357 -> 61 | O357: 11 | P357: 17 | Q357: =O357*6+P357 -> 83 | S357: WILLIAMSTOWN
A358: NORTHCOTE | C358: 1 | D358: 1 | E358: =C358*6+D358 -> 7 | G358: 2 | H358: 4 | I358: =G358*6+H358 -> 16 | K358: 4 | L358: 6 | M358: =K358*6+L358 -> 30 | O358: 6 | P358: 6 | Q358: =O358*6+P358 -> 42 | S358: HURLEY
A359: BEST PLAYERS
A360: WILLIAMSTOWN | D360: ALLEY | G360: REITMAN | J360: MONAR | M360: ELLIS | P360: HARTSHORN | S360: ELDRIDGE
A361: NORTHCOTE | D361: MONOHAN | G361: COLE | J361: CHESSWASS | M361: FAIRBANK | P361: PETTIT | S361: PRATT
A362: GOALKICKERS
A363: WILLIAMSTOWN | D363: ADDISON 4 | H363: MATTHEWS 4 | L363: McNEILAGE 2 | P363: AMY
A364: NORTHCOTE | D364: O'LOUGHLIN 2 | H364: BECK 2 | K364: FEATHERSTONE | O364: PRATT
A366: FOOTSCRAY | C366: 6 | D366: 1 | E366: =C366*6+D366 -> 37 | G366: 7 | H366: 1 | I366: =G366*6+H366 -> 43 | K366: 11 | L366: 4 | M366: =K366*6+L366 -> 70 | O366: 12 | P366: 7 | Q366: =O366*6+P366 -> 79 | S366: FOOTSCRAY
A367: PORT MELBOURNE | C367: 0 | D367: 0 | E367: =C367*6+D367 -> 0 | G367: 2 | H367: 2 | I367: =G367*6+H367 -> 14 | K367: 4 | L367: 3 | M367: =K367*6+L367 -> 27 | O367: 4 | P367: 9 | Q367: =O367*6+P367 -> 33 | S367: KENDALL
A368: BEST PLAYERS
A369: FOOTSCRAY | D369: COTTON | G369: OGILVIE | J369: MARMO | M369: DUANE | P369: T SEVIOR | S369: W McCARTHY
A370: PORT MELBOURNE | D370: ST JOHN | G370: ANDERSON | J370: BROWN | M370: JACKSON | P370: FRANKLIN | S370: McKAY
A371: GOALKICKERS
A372: FOOTSCRAY | D372: DUANE 5 | G372: HARRIS 3 | J372: W McCARTHY 2 | N372: McKINLEY | Q372: GREGORY
A373: PORT MELBOURNE | D373: ST JOHN 3 | G373: JACKSON
A375: ESSENDON ASSOC. | C375: 0 | D375: 4 | E375: =C375*6+D375 -> 4 | G375: 3 | H375: 6 | I375: =G375*6+H375 -> 24 | K375: 3 | L375: 6 | M375: =K375*6+L375 -> 24 | O375: 3 | P375: 8 | Q375: =O375*6+P375 -> 26 | S375: NORTH MELB
A376: NORTH MELBOURNE | C376: 0 | D376: 2 | E376: =C376*6+D376 -> 2 | G376: 1 | H376: 3 | I376: =G376*6+H376 -> 9 | K376: 1 | L376: 6 | M376: =K376*6+L376 -> 12 | O376: 2 | P376: 6 | Q376: =O376*6+P376 -> 18 | S376: CHEFFERS
A377: BEST PLAYERS
A378: ESSENDON ASSOC. | D378: HOARE | G378: DYSON | J378: GIBSON | M378: GOUGH | P378: MONAGLE | S378: REEVES
A379: NORTH MELBOURNE | D379: H DARBY | G379: HOPKINS | J379: HOMAN | M379: GIBNEY | P379: PEMBERTON | S379: McKINLEY
A380: GOALKICKERS
A381: ESSENDON ASSOC. | D381: HAMBRIDGE | G381: REEVES | J381: ABBOTT
A382: NORTH MELBOURNE | D382: HARDY | G382: GIBNEY
A384: ROUND 9 | E384: 19TH JUNE | J384: WEATHER | N384: NORTH WIND | S384: PLAYED AT | X384: LADDER | AB384: ROUND | AD384: 9
D385: 1ST QTR | H385: 2ND QTR | L385: 3RD QTR | P385: FINAL | S385: TOORAK PARK
A386: PRAHRAN | C386: 2 | D386: 5 | E386: =C386*6+D386 -> 17 | G386: 5 | H386: 11 | I386: =G386*6+H386 -> 41 | K386: 5 | L386: 15 | M386: =K386*6+L386 -> 45 | O386: 7 | P386: 19 | Q386: =O386*6+P386 -> 61 | S386: UMPIRE | W386: TEAM | X386: W | Y386: L | Z386: D | AA386: FOR | AB386: AGST | AC386: % | AD386: PTS
A387: BRUNSWICK | C387: 1 | D387: 1 | E387: =C387*6+D387 -> 7 | G387: 2 | H387: 1 | I387: =G387*6+H387 -> 13 | K387: 2 | L387: 6 | M387: =K387*6+L387 -> 18 | O387: 2 | P387: 9 | Q387: =O387*6+P387 -> 21 | S387: MARTIN
A388: BEST PLAYERS | W388: ESSENDON ASSOC. | X388: 8 | Y388: 1 | Z388: 0 | AA388: 542 | AB388: 306 | AC388: 177.12418300653596 | AD388: 32
A389: PRAHRAN | D389: DOWSING | G389: CONQUEST | J389: PARSONS | M389: WOODS | O389: HAIGHBLOOM | R389: ROURKE | W389: PRAHRAN | X389: 8 | Y389: 1 | Z389: 0 | AA389: 600 | AB389: 382 | AC389: 157.06806282722513 | AD389: 32
A390: BRUNSWICK | D390: JOHNSON | G390: L BRAID | J390: MILLS | L390: STANCLIFFE | O390: DUNSTAN | R390: WILLIAMS | W390: BRIGHTON | X390: 7 | Y390: 2 | Z390: 0 | AA390: 448 | AB390: 370 | AC390: 121.08108108108108 | AD390: 28
A391: GOALKICKERS | W391: FOOTSCRAY | X391: 5 | Y391: 4 | Z391: 0 | AA391: 518 | AB391: 389 | AC391: 133.16195372750641 | AD391: 20
A392: PRAHRAN | D392: FARMER 3 | G392: WATTS 2
A393: BRUNSWICK | W393: WILLIAMSTOWN | X393: 5 | Y393: 4 | Z393: 0 | AA393: 490 | AB393: 384 | AC393: 127.60416666666667 | AD393: 20
W394: BRUNSWICK | X394: 4 | Y394: 5 | Z394: 0 | AA394: 408 | AB394: 426 | AC394: 95.774647887323937 | AD394: 16
A395: PRESTON | C395: 0 | D395: 3 | E395: =C395*6+D395 -> 3 | G395: 2 | H395: 11 | I395: =G395*6+H395 -> 23 | K395: 4 | L395: 12 | M395: =K395*6+L395 -> 36 | O395: 7 | P395: 13 | Q395: =O395*6+P395 -> 55 | S395: PRESTON | W395: PRESTON | X395: 3 | Y395: 6 | Z395: 0 | AA395: 398 | AB395: 483 | AC395: 82.401656314699792 | AD395: 12
A396: WILLIAMSTOWN | C396: 2 | D396: 0 | E396: =C396*6+D396 -> 12 | G396: 2 | H396: 0 | I396: =G396*6+H396 -> 12 | K396: 3 | L396: 1 | M396: =K396*6+L396 -> 19 | O396: 4 | P396: 2 | Q396: =O396*6+P396 -> 26 | S396: VILLAIN | W396: NORTHCOTE | X396: 2 | Y396: 7 | Z396: 0 | AA396: 391 | AB396: 603 | AC396: 64.842454394693206 | AD396: 8
A397: BEST PLAYERS | W397: PORT MELBOURNE | X397: 2 | Y397: 7 | Z397: 0 | AA397: 258 | AB397: 518 | AC397: 49.80694980694981 | AD397: 8
A398: PRESTON | D398: OGDEN | G398: WHITE | J398: S HALL | M398: PRINCE | O398: PANNAM | R398: WOODS | W398: NORTH MELBOURNE | X398: 1 | Y398: 8 | Z398: 0 | AA398: 350 | AB398: 542 | AC398: 64.575645756457561 | AD398: 4
A399: WILLIAMSTOWN | D399: AMY | G399: SCULLION | J399: HARTSHORN | M399: KENNEDY | O399: ELDRIDGE | R399: ELLIS
A400: GOALKICKERS
A401: PRESTON | D401: OGDEN 4 | G401: PUNCH 2 | J401: PANNAM
A402: WILLIAMSTOWN | D402: ADDISON 3 | G402: GARBUTT
A404: FOOTSCRAY | C404: 3 | D404: 5 | E404: =C404*6+D404 -> 23 | G404: 6 | H404: 9 | I404: =G404*6+H404 -> 45 | K404: 9 | L404: 10 | M404: =K404*6+L404 -> 64 | O404: 10 | P404: 11 | Q404: =O404*6+P404 -> 71 | S404: FOOTSCRAY
A405: NORTH MELBOURNE | C405: 1 | D405: 0 | E405: =C405*6+D405 -> 6 | G405: 2 | H405: 0 | I405: =G405*6+H405 -> 12 | K405: 3 | L405: 1 | M405: =K405*6+L405 -> 19 | O405: 3 | P405: 3 | Q405: =O405*6+P405 -> 21 | S405: HURLEY
A406: BEST PLAYERS
A407: FOOTSCRAY | D407: COTTON | G407: A GREGORY | K407: OGILVIE | N407: DUANE | Q407: HANSEN | T407: McKINLEY
A408: NORTH MELBOURNE | D408: H DARBY | G408: ARMSTRONG | K408: BARKER | N408: SPEAKMAN | Q408: HOMAN | T408: GIBNEY
A409: GOALKICKERS
A410: FOOTSCRAY | D410: A GREGORY 3 | G410: COTTON 2 | J410: LAUNDER 2 | M410: McKINLEY | P410: W McCARTHY | T410: A JOHNSTON
A411: NORTH MELBOURNE | D411: ARMSTRONG 2 | H411: GIBNEY
A413: BRIGHTON | C413: 3 | D413: 0 | E413: =C413*6+D413 -> 18 | G413: 6 | H413: 4 | I413: =G413*6+H413 -> 40 | K413: 8 | L413: 4 | M413: =K413*6+L413 -> 52 | O413: 9 | P413: 9 | Q413: =O413*6+P413 -> 63 | S413: BRIGHTON
A414: NORTHCOTE | C414: 1 | D414: 4 | E414: =C414*6+D414 -> 10 | G414: 1 | H414: 5 | I414: =G414*6+H414 -> 11 | K414: 4 | L414: 7 | M414: =K414*6+L414 -> 31 | O414: 5 | P414: 7 | Q414: =O414*6+P414 -> 37 | S414: ALLEY
A415: BEST PLAYERS
A416: BRIGHTON | D416: W ROBINSON | G416: H LAXTON | J416: HARDIMAN | M416: PLAISTED | P416: KUSCHERT | S416: GIBNEY
A417: NORTHCOTE | D417: COLE | G417: DANIELS | J417: O'LOUGHLIN | M417: CHESSWASS | P417: COLE | S417: HUTTON
A418: GOALKICKERS
A419: BRIGHTON | D419: HARDIMAN 3 | H419: H LAXTON 2 | K419: KULPA | M419: BAILES | O419: BOYLAND | Q419: PLAISTED
A420: NORTHCOTE | D420: O'LOUGHLIN | G420: HASSETT | J420: PETTIT | L420: McCONCHIE | O420: DANIELS
A422: ESSENDON ASSOC. | C422: 1 | D422: 1 | E422: =C422*6+D422 -> 7 | G422: 4 | H422: 1 | I422: =G422*6+H422 -> 25 | K422: 6 | L422: 6 | M422: =K422*6+L422 -> 42 | O422: 13 | P422: 8 | Q422: =O422*6+P422 -> 86 | S422: ESSENDON
A423: PORT MELBOURNE | C423: 0 | D423: 3 | E423: =C423*6+D423 -> 3 | G423: 0 | H423: 3 | I423: =G423*6+H423 -> 3 | K423: 0 | L423: 4 | M423: =K423*6+L423 -> 4 | O423: 0 | P423: 5 | Q423: =O423*6+P423 -> 5 | S423: KENDALL
A424: BEST PLAYERS
A425: ESSENDON ASSOC. | D425: ABBOTT | G425: HOARE | J425: BENNETT | M425: DYSON | P425: RENWICK | S425: McINTYRE
A426: PORT MELBOURNE | D426: FITZGERALD | G426: JACKSON | J426: BROWN | M426: PAMPERIN | P426: SIMMONDS | S426: McCANN
A427: GOALKICKERS
A428: ESSENDON ASSOC. | D428: ABBOTT 7 | G428: LANIGAN 2 | J428: BARLOW 2 | M428: RENWICK | P428: MONAGLE
A429: PORT MELBOURNE | D429: NIL
A431: ROUND 10 | E431: 26TH JUNE | J431: WEATHER | N431: RAIN GROUNDS BAD | S431: PLAYED AT | X431: LADDER | AB431: ROUND | AD431: 10
D432: 1ST QTR | H432: 2ND QTR | L432: 3RD QTR | P432: FINAL | S432: TOORAK PARK
A433: PRAHRAN | C433: 2 | D433: 2 | E433: =C433*6+D433 -> 14 | G433: 3 | H433: 5 | I433: =G433*6+H433 -> 23 | K433: 4 | L433: 8 | M433: =K433*6+L433 -> 32 | O433: 8 | P433: 9 | Q433: =O433*6+P433 -> 57 | S433: UMPIRE | W433: TEAM | X433: W | Y433: L | Z433: D | AA433: FOR | AB433: AGST | AC433: % | AD433: PTS
A434: FOOTSCRAY | C434: 0 | D434: 4 | E434: =C434*6+D434 -> 4 | G434: 0 | H434: 5 | I434: =G434*6+H434 -> 5 | K434: 3 | L434: 7 | M434: =K434*6+L434 -> 25 | O434: 4 | P434: 7 | Q434: =O434*6+P434 -> 31 | S434: HURLEY
A435: BEST PLAYERS | W435: PRAHRAN | X435: 9 | Y435: 1 | Z435: 0 | AA435: 657 | AB435: 413 | AC435: 159.07990314769975 | AD435: 36
A436: PRAHRAN | D436: HAIGHBLOOM | G436: WILSON | J436: WOODS | L436: CARLSON | O436: BENNION | Q436: CONQUEST | W436: ESSENDON ASSOC. | X436: 8 | Y436: 2 | Z436: 0 | AA436: 558 | AB436: 349 | AC436: 159.88538681948424 | AD436: 32
A437: FOOTSCRAY | D437: OGILVIE | G437: A GREGORY | J437: T SEVIOR | L437: MINTO | O437: CLARKE | Q437: DUANE | W437: BRIGHTON | X437: 7 | Y437: 3 | Z437: 0 | AA437: 481 | AB437: 415 | AC437: 115.90361445783132 | AD437: 28
A438: GOALKICKERS | W438: WILLIAMSTOWN | X438: 6 | Y438: 4 | Z438: 0 | AA438: 535 | AB438: 417 | AC438: 128.29736211031175 | AD438: 24
A439: PRAHRAN | D439: SYKES 2 | G439: H FARMER 2 | K439: ROURKE | N439: CONQUEST | Q439: WATTS | S439: ALLEN
A440: FOOTSCRAY | D440: A GREGORY 2 | H440: LAUNDER | K440: COTTON | W440: FOOTSCRAY | X440: 5 | Y440: 5 | Z440: 0 | AA440: 549 | AB440: 446 | AC440: 123.09417040358744 | AD440: 20
W441: BRUNSWICK | X441: 5 | Y441: 5 | Z441: 0 | AA441: 451 | AB441: 442 | AC441: 102.03619909502262 | AD441: 20
A442: WILLIAMSTOWN | C442: 1 | D442: 1 | E442: =C442*6+D442 -> 7 | G442: 4 | H442: 7 | I442: =G442*6+H442 -> 31 | K442: 4 | L442: 7 | M442: =K442*6+L442 -> 31 | O442: 5 | P442: 15 | Q442: =O442*6+P442 -> 45 | S442: BRIGHTON | W442: PRESTON | X442: 4 | Y442: 6 | Z442: 0 | AA442: 473 | AB442: 517 | AC442: 91.489361702127653 | AD442: 16
A443: BRIGHTON | C443: 2 | D443: 2 | E443: =C443*6+D443 -> 14 | G443: 2 | H443: 2 | I443: =G443*6+H443 -> 14 | K443: 4 | L443: 9 | M443: =K443*6+L443 -> 33 | O443: 4 | P443: 9 | Q443: =O443*6+P443 -> 33 | S443: VILLAIN | W443: NORTH MELBOURNE | X443: 2 | Y443: 8 | Z443: 0 | AA443: 412 | AB443: 572 | AC443: 72.027972027972027 | AD443: 8
A444: BEST PLAYERS | W444: NORTHCOTE | X444: 2 | Y444: 8 | Z444: 0 | AA444: 425 | AB444: 678 | AC444: 62.684365781710916 | AD444: 8
A445: WILLIAMSTOWN | D445: W OUTEN | G445: ADDISON | J445: MONAR | M445: GARBUTT | P445: ELLIS | R445: AMY | W445: PORT MELBOURNE | X445: 2 | Y445: 8 | Z445: 0 | AA445: 288 | AB445: 580 | AC445: 49.655172413793103 | AD445: 8
A446: BRIGHTON | D446: SLOSS | G446: KENNEDY | J446: McCLEERY | M446: HARRISON | P446: BAILES | R446: PLOWMAN
A447: GOALKICKERS
A448: WILLIAMSTOWN | D448: AMY 3 | G448: GARBUTT 2
A449: BRIGHTON | D449: RYAN 3 | G449: PLAISTED | K449: GORMAN
A451: BRUNSWICK | C451: 0 | D451: 4 | E451: =C451*6+D451 -> 4 | G451: 3 | H451: 7 | I451: =G451*6+H451 -> 25 | K451: 4 | L451: 9 | M451: =K451*6+L451 -> 33 | O451: 5 | P451: 13 | Q451: =O451*6+P451 -> 43 | S451: BRUNSWICK
A452: ESSENDON ASSOC. | C452: 0 | D452: 1 | E452: =C452*6+D452 -> 1 | G452: 0 | H452: 2 | I452: =G452*6+H452 -> 2 | K452: 0 | L452: 5 | M452: =K452*6+L452 -> 5 | O452: 1 | P452: 10 | Q452: =O452*6+P452 -> 16 | S452: MARTIN
A453: BEST PLAYERS
A454: BRUNSWICK | D454: McKENZIE | G454: O'SHEA | J454: PEARS | M454: GILLESPIE | P454: JOHNSON | S454: ABBOTT
A455: ESSENDON ASSOC. | D455: W PAIN | G455: BENNETT | J455: McINTYRE | M455: HAMBRIDGE | P455: RENWICK | S455: MONAGLE
A456: GOALKICKERS
A457: BRUNSWICK | D457: THOMAS | G457: CLEMENTS | J457: STANCLIFFE | M457: DUNSTAN | O457: MAY
A458: ESSENDON ASSOC. | D458: ABBOTT
A460: PRESTON | C460: 1 | D460: 4 | E460: =C460*6+D460 -> 10 | G460: 5 | H460: 10 | I460: =G460*6+H460 -> 40 | K460: 7 | L460: 13 | M460: =K460*6+L460 -> 55 | O460: 10 | P460: 15 | Q460: =O460*6+P460 -> 75 | S460: PRESTON
A461: NORTHCOTE | C461: 1 | D461: 2 | E461: =C461*6+D461 -> 8 | G461: 3 | H461: 2 | I461: =G461*6+H461 -> 20 | K461: 4 | L461: 2 | M461: =K461*6+L461 -> 26 | O461: 5 | P461: 4 | Q461: =O461*6+P461 -> 34 | S461: KENDALL
A462: BEST PLAYERS
A463: PRESTON | D463: WOODS | G463: WHITE | J463: DUNCAN | M463: BASSETT | P463: TOMKINS | S463: CARROLL
A464: NORTHCOTE | D464: LINEHAN | G464: MONOHAN | J464: FEATHERSTONE | M464: CHESSWASS | P464: COLE | S464: HUTTON
A465: GOALKICKERS
A466: PRESTON | D466: OGDEN 3 | G466: PANNAM 3 | J466: PUNCH | L466: HENDRIE | N466: WOODS | P466: BECK
A467: NORTHCOTE | D467: O'LOUGHLIN | G467: WALKER | J467: HUTTON | L467: BECK
A469: NORTH MELBOURNE | C469: 4 | D469: 4 | E469: =C469*6+D469 -> 28 | G469: 5 | H469: 10 | I469: =G469*6+H469 -> 40 | K469: 5 | L469: 14 | M469: =K469*6+L469 -> 44 | O469: 8 | P469: 14 | Q469: =O469*6+P469 -> 62 | S469: PORT MELB
A470: PORT MELBOURNE | C470: 1 | D470: 0 | E470: =C470*6+D470 -> 6 | G470: 2 | H470: 0 | I470: =G470*6+H470 -> 12 | K470: 2 | L470: 3 | M470: =K470*6+L470 -> 15 | O470: 4 | P470: 6 | Q470: =O470*6+P470 -> 30 | S470: ALLEY
A471: BEST PLAYERS
A472: NORTH MELBOURNE | D472: JOHNSON | G472: HOPKINS | J472: HARDY | M472: KEATING | P472: NOONAN | S472: HOMAN
A473: PORT MELBOURNE | D473: FRANKLIN | G473: ANDERSON | J473: McKAY | M473: JACKSON | P473: MCCANN | S473: PAMPERIN
A474: GOALKICKERS
A475: NORTH MELBOURNE | D475: HERON 3 | G475: ARMSTRONG 2 | K475: GIBNEY 2 | N475: HOMAN
A476: PORT MELBOURNE | D476: SIMMONDS | G476: McCANN | J476: CLEELAND | M476: ST JOHN
A478: ROUND 11 | E478: 3RD JULY | J478: WEATHER | N478: FINE | S478: PLAYED AT | X478: LADDER | AB478: ROUND | AD478: 11
D479: 1ST QTR | H479: 2ND QTR | L479: 3RD QTR | P479: FINAL | S479: WILLIAMSTOWN
A480: PRAHRAN | C480: 0 | D480: 4 | E480: =C480*6+D480 -> 4 | G480: 3 | H480: 5 | I480: =G480*6+H480 -> 23 | K480: 5 | L480: 10 | M480: =K480*6+L480 -> 40 | O480: 6 | P480: 10 | Q480: =O480*6+P480 -> 46 | S480: UMPIRE | W480: TEAM | X480: W | Y480: L | Z480: D | AA480: FOR | AB480: AGST | AC480: % | AD480: PTS
A481: WILLIAMSTOWN | C481: 0 | D481: 1 | E481: =C481*6+D481 -> 1 | G481: 0 | H481: 5 | I481: =G481*6+H481 -> 5 | K481: 0 | L481: 7 | M481: =K481*6+L481 -> 7 | O481: 4 | P481: 10 | Q481: =O481*6+P481 -> 34 | S481: MARTIN
A482: BEST PLAYERS | W482: PRAHRAN | X482: 10 | Y482: 1 | Z482: 0 | AA482: 703 | AB482: 447 | AC482: 157.27069351230426 | AD482: 40
A483: PRAHRAN | D483: SYKES | G483: ROURKE | I483: DOWDING | L483: HAIGHBLOOM | O483: JULIAN | R483: BENNION | W483: ESSENDON ASSOC. | X483: 9 | Y483: 2 | Z483: 0 | AA483: 649 | AB483: 385 | AC483: 168.57142857142858 | AD483: 36
A484: WILLIAMSTOWN | D484: HARTSHORN | G484: MONAR | I484: AMY | L484: W OUTEN | O484: REITMAN | R484: ELDRIDGE | W484: BRIGHTON | X484: 8 | Y484: 3 | Z484: 0 | AA484: 528 | AB484: 438 | AC484: 120.54794520547945 | AD484: 32
A485: GOALKICKERS | W485: FOOTSCRAY | X485: 6 | Y485: 5 | Z485: 0 | AA485: 608 | AB485: 492 | AC485: 123.57723577235772 | AD485: 24
A486: PRAHRAN | D486: SYKES 2 | G486: H FARMER 2 | K486: HALL | N486: HAIGHBLOOM
A487: WILLIAMSTOWN | D487: GARBUTT 2 | G487: ADDISON | J487: HARTSHORN | W487: WILLIAMSTOWN | X487: 6 | Y487: 5 | Z487: 0 | AA487: 569 | AB487: 463 | AC487: 122.89416846652267 | AD487: 24
W488: BRUNSWICK | X488: 5 | Y488: 6 | Z488: 0 | AA488: 497 | AB488: 501 | AC488: 99.201596806387229 | AD488: 20
A489: FOOTSCRAY | C489: 1 | D489: 1 | E489: =C489*6+D489 -> 7 | G489: 3 | H489: 4 | I489: =G489*6+H489 -> 22 | K489: 7 | L489: 7 | M489: =K489*6+L489 -> 49 | O489: 8 | P489: 11 | Q489: =O489*6+P489 -> 59 | S489: FOOTSCRAY | W489: PRESTON | X489: 4 | Y489: 7 | Z489: 0 | AA489: 509 | AB489: 608 | AC489: 83.71710526315789 | AD489: 16
A490: BRUNSWICK | C490: 3 | D490: 3 | E490: =C490*6+D490 -> 21 | G490: 3 | H490: 3 | I490: =G490*6+H490 -> 21 | K490: 6 | L490: 3 | M490: =K490*6+L490 -> 39 | O490: 7 | P490: 4 | Q490: =O490*6+P490 -> 46 | S490: ALLEY | W490: NORTHCOTE | X490: 3 | Y490: 8 | Z490: 0 | AA490: 457 | AB490: 709 | AC490: 64.456981664315933 | AD490: 12
A491: BEST PLAYERS | W491: NORTH MELBOURNE | X491: 2 | Y491: 9 | Z491: 0 | AA491: 435 | AB491: 619 | AC491: 70.274636510500812 | AD491: 8
A492: FOOTSCRAY | D492: T SEVIOR | G492: NEILSON | I492: RYAN | L492: BORTHWICK | O492: W McCARTHY | R492: GILBERT | W492: PORT MELBOURNE | X492: 2 | Y492: 9 | Z492: 0 | AA492: 319 | AB492: 612 | AC492: 52.124183006535951 | AD492: 8
A493: BRUNSWICK | D493: L BRAID | G493: ABBOTT | I493: LEEDS | L493: MILLS | O493: O'SHEA | R493: McKENZIE
A494: GOALKICKERS
A495: FOOTSCRAY | D495: LAUNDER 2 | G495: A GREGORY 2 | K495: T SEVIOR 2 | O495: W McCARTHY | R495: GILBERT
A496: BRUNSWICK | D496: McKENZIE 3 | G496: CLEMENTS 2 | K496: O'SHEA | N496: STANCLIFFE
A498: ESSENDON ASSOC. | C498: 2 | D498: 4 | E498: =C498*6+D498 -> 16 | G498: 7 | H498: 10 | I498: =G498*6+H498 -> 52 | K498: 9 | L498: 14 | M498: =K498*6+L498 -> 68 | O498: 12 | P498: 19 | Q498: =O498*6+P498 -> 91 | S498: ESSENDON
A499: PRESTON | C499: 2 | D499: 1 | E499: =C499*6+D499 -> 13 | G499: 2 | H499: 3 | I499: =G499*6+H499 -> 15 | K499: 4 | L499: 4 | M499: =K499*6+L499 -> 28 | O499: 5 | P499: 6 | Q499: =O499*6+P499 -> 36 | S499: KENDALL
A500: BEST PLAYERS
A501: ESSENDON ASSOC. | D501: GOUGH | G501: ABBOTT | J501: BENNETT | M501: McNAMARA | P501: HOARE | S501: W PAIN
A502: PRESTON | D502: BASSETT | G502: TOMKINS | J502: WHITE | M502: HENDRIE | P502: PRINCE | S502: PUNCH
A503: GOALKICKERS
A504: ESSENDON ASSOC. | D504: ABBOTT 6 | G504: McNAMARA 3 | K504: DYSON 3
A505: PRESTON | D505: PUNCH 3 | G505: HENDRIE | J505: OGDEN
A507: BRIGHTON | C507: 0 | D507: 2 | E507: =C507*6+D507 -> 2 | G507: 4 | H507: 3 | I507: =G507*6+H507 -> 27 | K507: 5 | L507: 4 | M507: =K507*6+L507 -> 34 | O507: 7 | P507: 5 | Q507: =O507*6+P507 -> 47 | S507: NORTH MELB
A508: NORTH MELBOURNE | C508: 1 | D508: 0 | E508: =C508*6+D508 -> 6 | G508: 1 | H508: 3 | I508: =G508*6+H508 -> 9 | K508: 2 | L508: 3 | M508: =K508*6+L508 -> 15 | O508: 3 | P508: 5 | Q508: =O508*6+P508 -> 23 | S508: HURLEY
A509: BEST PLAYERS
A510: BRIGHTON | D510: A LAXTON | G510: GORMAN | J510: BAILES | M510: KENNEDY | P510: HARDIMAN | S510: SLOSS
A511: NORTH MELBOURNE | D511: TRELOAR | G511: HERON | J511: NOONAN | M511: HARDY | P511: ARMSTRONG | S511: JOHNSON
A512: GOALKICKERS
A513: BRIGHTON | D513: SLOSS 2 | G513: KULPA 2 | J513: RYAN 2 | M513: HARDIMAN
A514: NORTH MELBOURNE | D514: HARDY 2 | G514: ARMSTRONG
A516: NORTHCOTE | C516: 1 | D516: 3 | E516: =C516*6+D516 -> 9 | G516: 2 | H516: 8 | I516: =G516*6+H516 -> 20 | K516: 3 | L516: 8 | M516: =K516*6+L516 -> 26 | O516: 3 | P516: 14 | Q516: =O516*6+P516 -> 32 | S516: CROXTON PK
A517: PORT MELBOURNE | C517: 2 | D517: 0 | E517: =C517*6+D517 -> 12 | G517: 2 | H517: 4 | I517: =G517*6+H517 -> 16 | K517: 3 | L517: 6 | M517: =K517*6+L517 -> 24 | O517: 4 | P517: 7 | Q517: =O517*6+P517 -> 31 | S517: VILLAIN
A518: BEST PLAYERS
A519: NORTHCOTE | D519: COLE | G519: FAIRBANK | J519: MONOHAN | M519: PRATT | P519: CHESSWASS | S519: FEATHERSTONE
A520: PORT MELBOURNE | D520: WOODFORD | G520: ANDERSON | J520: McKAY | M520: FRANKLIN | P520: FITZGERALD | S520: McCANN
A521: GOALKICKERS
A522: NORTHCOTE | D522: FAIRBANK | G522: WALKER | J522: CHESSWASS
A523: PORT MELBOURNE | D523: ANDERSON | G523: BROWN | J523: TREGLOWN | M523: CLEELAND
A525: ROUND 12 | E525: 10TH JULY | J525: WEATHER | N525: FINE | S525: PLAYED AT | X525: LADDER | AB525: ROUND | AD525: 12
D526: 1ST QTR | H526: 2ND QTR | L526: 3RD QTR | P526: FINAL | S526: BRIGHTON
A527: ESSENDON ASSOC. | C527: 3 | D527: 2 | E527: =C527*6+D527 -> 20 | G527: 3 | H527: 8 | I527: =G527*6+H527 -> 26 | K527: 5 | L527: 9 | M527: =K527*6+L527 -> 39 | O527: 8 | P527: 9 | Q527: =O527*6+P527 -> 57 | S527: UMPIRE | W527: TEAM | X527: W | Y527: L | Z527: D | AA527: FOR | AB527: AGST | AC527: % | AD527: PTS
A528: BRIGHTON | C528: 3 | D528: 1 | E528: =C528*6+D528 -> 19 | G528: 4 | H528: 2 | I528: =G528*6+H528 -> 26 | K528: 6 | L528: 4 | M528: =K528*6+L528 -> 40 | O528: 6 | P528: 6 | Q528: =O528*6+P528 -> 42 | S528: ALLEY
A529: BEST PLAYERS | W529: PRAHRAN | X529: 11 | Y529: 1 | Z529: 0 | AA529: 795 | AB529: 517 | AC529: 153.77176015473887 | AD529: 44
A530: ESSENDON ASSOC. | D530: HOARE | G530: W PAIN | J530: HAMBRIDGE | M530: MAINE | O530: LANIGAN | Q530: McNAMARA | W530: ESSENDON ASSOC. | X530: 10 | Y530: 2 | Z530: 0 | AA530: 706 | AB530: 427 | AC530: 165.33957845433255 | AD530: 40
A531: BRIGHTON | D531: G ROBINSON | G531: WENBORN | J531: BAILES | M531: PLOWMAN | O531: A LAXTON | Q531: HARDIMAN | W531: BRIGHTON | X531: 8 | Y531: 4 | Z531: 0 | AA531: 570 | AB531: 495 | AC531: 115.15151515151516 | AD531: 32
A532: GOALKICKERS | W532: FOOTSCRAY | X532: 7 | Y532: 5 | Z532: 0 | AA532: 679 | AB532: 531 | AC532: 127.87193973634652 | AD532: 28
A533: ESSENDON ASSOC. | D533: McNAMARA 2 | G533: ABBOTT 2 | J533: DYSON 2 | M533: TURNER | P533: RENWICK
A534: BRIGHTON | D534: HARDIMAN 2 | G534: A LAXTON | J534: HARRISON | M534: BAILES | P534: PLAISTED | W534: WILLIAMSTOWN | X534: 7 | Y534: 5 | Z534: 0 | AA534: 606 | AB534: 497 | AC534: 121.93158953722335 | AD534: 28
W535: BRUNSWICK | X535: 6 | Y535: 6 | Z535: 0 | AA535: 585 | AB535: 525 | AC535: 111.42857142857143 | AD535: 24
A536: FOOTSCRAY | C536: 1 | D536: 3 | E536: =C536*6+D536 -> 9 | G536: 3 | H536: 12 | I536: =G536*6+H536 -> 30 | K536: 5 | L536: 12 | M536: =K536*6+L536 -> 42 | O536: 9 | P536: 17 | Q536: =O536*6+P536 -> 71 | S536: PRESTON | W536: PRESTON | X536: 4 | Y536: 8 | Z536: 0 | AA536: 548 | AB536: 679 | AC536: 80.706921944035344 | AD536: 16
A537: PRESTON | C537: 2 | D537: 3 | E537: =C537*6+D537 -> 15 | G537: 2 | H537: 4 | I537: =G537*6+H537 -> 16 | K537: 4 | L537: 9 | M537: =K537*6+L537 -> 33 | O537: 5 | P537: 9 | Q537: =O537*6+P537 -> 39 | S537: HURLEY | W537: NORTHCOTE | X537: 3 | Y537: 9 | Z537: 0 | AA537: 481 | AB537: 797 | AC537: 60.351317440401509 | AD537: 12
A538: BEST PLAYERS | W538: NORTH MELBOURNE | X538: 2 | Y538: 10 | Z538: 0 | AA538: 505 | AB538: 711 | AC538: 71.026722925457108 | AD538: 8
A539: FOOTSCRAY | D539: O'CONNELL | G539: DUANE | J539: OGILVIE | M539: HARRIS | O539: A GREGORY | R539: MARMO | W539: PORT MELBOURNE | X539: 2 | Y539: 10 | Z539: 0 | AA539: 353 | AB539: 649 | AC539: 54.391371340523882 | AD539: 8
A540: PRESTON | D540: PRINCE | G540: PANNAM | J540: S HALL | M540: HENDRIE | O540: WOODS | R540: DUNCAN
A541: GOALKICKERS
A542: FOOTSCRAY | D542: O'CONNELL 4 | H542: A GREGORY 3 | L542: BARRETT | O542: LAUNDER
A543: PRESTON | D543: PUNCH 3 | G543: CROFT 2
A545: BRUNSWICK | C545: 2 | D545: 5 | E545: =C545*6+D545 -> 17 | G545: 5 | H545: 11 | I545: =G545*6+H545 -> 41 | K545: 8 | L545: 16 | M545: =K545*6+L545 -> 64 | O545: 11 | P545: 22 | Q545: =O545*6+P545 -> 88 | S545: BRUNSWICK
A546: NORTHCOTE | C546: 2 | D546: 0 | E546: =C546*6+D546 -> 12 | G546: 4 | H546: 0 | I546: =G546*6+H546 -> 24 | K546: 4 | L546: 0 | M546: =K546*6+L546 -> 24 | O546: 4 | P546: 0 | Q546: =O546*6+P546 -> 24 | S546: JOHNSON
A547: BEST PLAYERS
A548: BRUNSWICK | D548: JOHNSON | G548: McKENZIE | K548: HEAPHY | N548: CHASE | Q548: TURNBULL | T548: THOMAS
A549: NORTHCOTE | D549: FAIRBANK | G549: BECK | K549: HUTTON | N549: DANIELS | Q549: PRATT | T549: MONOHAN
A550: GOALKICKERS
A551: BRUNSWICK | D551: CHASE 4 | G551: McKENZIE 2 | K551: DUNSTAN 2 | N551: MILLS | P551: FULLARTON | S551: TURNBULL
A552: NORTHCOTE | D552: PRATT | G552: FAIRBANK | K552: BECK | N552: WALKER
A554: WILLIAMSTOWN | C554: 1 | D554: 2 | E554: =C554*6+D554 -> 8 | G554: 1 | H554: 3 | I554: =G554*6+H554 -> 9 | K554: 4 | L554: 7 | M554: =K554*6+L554 -> 31 | O554: 5 | P554: 7 | Q554: =O554*6+P554 -> 37 | S554: PORT MELB
A555: PORT MELBOURNE | C555: 1 | D555: 2 | E555: =C555*6+D555 -> 8 | G555: 1 | H555: 7 | I555: =G555*6+H555 -> 13 | K555: 3 | L555: 8 | M555: =K555*6+L555 -> 26 | O555: 4 | P555: 10 | Q555: =O555*6+P555 -> 34 | S555: MARTIN
A556: BEST PLAYERS
A557: WILLIAMSTOWN | D557: ELLIS | G557: WEIDNER | K557: MONAR | N557: McNEILAGE | Q557: SCULLION | T557: KENNEDY
A558: PORT MELBOURNE | D558: JACKSON | G558: WOODFORD | K558: McCANN | N558: FRANKLIN | Q558: BROWN | T558: POOLE
A559: GOALKICKERS
A560: WILLIAMSTOWN | D560: GIBBS | G560: McKENZIE | J560: GARBUTT | M560: HARTSHORN | P560: MONAR
A561: PORT MELBOURNE | D561: POOLE 3 | G561: TREGLOWN
A563: PRAHRAN | C563: 4 | D563: 4 | E563: =C563*6+D563 -> 28 | G563: 9 | H563: 6 | I563: =G563*6+H563 -> 60 | K563: 10 | L563: 11 | M563: =K563*6+L563 -> 71 | O563: 13 | P563: 14 | Q563: =O563*6+P563 -> 92 | S563: TOORAK PARK
A564: NORTH MELBOURNE | C564: 2 | D564: 2 | E564: =C564*6+D564 -> 14 | G564: 5 | H564: 4 | I564: =G564*6+H564 -> 34 | K564: 8 | L564: 7 | M564: =K564*6+L564 -> 55 | O564: 10 | P564: 10 | Q564: =O564*6+P564 -> 70 | S564: KENDALL
A565: BEST PLAYERS
A566: PRAHRAN | D566: ALLEN | G566: W STEWART | K566: DOWSING | N566: WILSON | Q566: BENNION | T566: HAIGHBLOOM
A567: NORTH MELBOURNE | D567: GIBNEY | G567: HARDY | K567: PRIOR | N567: HERON | Q567: HOPKINS | T567: BARKER
A568: GOALKICKERS
A569: PRAHRAN | D569: H FARMER 4 | G569: HAIGHBLOOM 2 | J569: W STEWART 2 | M569: SYKES 2 | O569: BENNION 2 | R569: DOWDING
A570: NORTH MELBOURNE | D570: PRIOR 2 | G570: HERON 2 | I570: HOPKINS 2 | K570: WILLIAMSON | N570: HARDY | P570: GIBNEY | R570: ARMSTRONG
A572: ROUND 13 | E572: 17TH JULY | J572: WEATHER | N572: SHOWERS | S572: PLAYED AT | X572: LADDER | AB572: ROUND | AD572: 13
D573: 1ST QTR | H573: 2ND QTR | L573: 3RD QTR | P573: FINAL | S573: FOOTSCRAY
A574: FOOTSCRAY | C574: 2 | D574: 3 | E574: =C574*6+D574 -> 15 | G574: 4 | H574: 4 | I574: =G574*6+H574 -> 28 | K574: 4 | L574: 7 | M574: =K574*6+L574 -> 31 | O574: 7 | P574: 10 | Q574: =O574*6+P574 -> 52 | S574: UMPIRE | W574: TEAM | X574: W | Y574: L | Z574: D | AA574: FOR | AB574: AGST | AC574: % | AD574: PTS
A575: BRIGHTON | C575: 0 | D575: 0 | E575: =C575*6+D575 -> 0 | G575: 0 | H575: 0 | I575: =G575*6+H575 -> 0 | K575: 0 | L575: 0 | M575: =K575*6+L575 -> 0 | O575: 0 | P575: 3 | Q575: =O575*6+P575 -> 3 | S575: MARTIN
A576: BEST PLAYERS | W576: PRAHRAN | X576: 12 | Y576: 1 | Z576: 0 | AA576: 875 | AB576: 544 | AC576: 160.84558823529412 | AD576: 48
A577: FOOTSCRAY | D577: COTTON | G577: T SEVIOR | J577: O'CONNELL | M577: NEILSON | O577: OGILVIE | Q577: HANSEN | W577: ESSENDON ASSOC. | X577: 10 | Y577: 3 | Z577: 0 | AA577: 738 | AB577: 460 | AC577: 160.43478260869566 | AD577: 40
A578: BRIGHTON | D578: G ROBINSON | G578: A LAXTON | J578: McCLEERY | M578: KUSCHERT | O578: WENBORN | Q578: DUNCAN | W578: FOOTSCRAY | X578: 8 | Y578: 5 | Z578: 0 | AA578: 731 | AB578: 534 | AC578: 136.89138576779027 | AD578: 32
A579: GOALKICKERS | W579: WILLIAMSTOWN | X579: 8 | Y579: 5 | Z579: 0 | AA579: 639 | AB579: 529 | AC579: 120.79395085066163 | AD579: 32
A580: FOOTSCRAY | D580: COTTON 3 | G580: LAUNDER 2 | J580: CLARKE | M580: A GREGORY
A581: BRIGHTON | D581: NIL | W581: BRIGHTON | X581: 8 | Y581: 5 | Z581: 0 | AA581: 573 | AB581: 547 | AC581: 104.75319926873857 | AD581: 32
W582: BRUNSWICK | X582: 7 | Y582: 6 | Z582: 0 | AA582: 645 | AB582: 573 | AC582: 112.56544502617801 | AD582: 28
A583: WILLIAMSTOWN | C583: 1 | D583: 2 | E583: =C583*6+D583 -> 8 | G583: 4 | H583: 2 | I583: =G583*6+H583 -> 26 | K583: 4 | L583: 3 | M583: =K583*6+L583 -> 27 | O583: 5 | P583: 3 | Q583: =O583*6+P583 -> 33 | S583: WILLIAMSTOWN | W583: PRESTON | X583: 5 | Y583: 8 | Z583: 0 | AA583: 612 | AB583: 704 | AC583: 86.931818181818187 | AD583: 20
A584: ESSENDON ASSOC. | C584: 1 | D584: 3 | E584: =C584*6+D584 -> 9 | G584: 2 | H584: 7 | I584: =G584*6+H584 -> 19 | K584: 4 | L584: 7 | M584: =K584*6+L584 -> 31 | O584: 4 | P584: 8 | Q584: =O584*6+P584 -> 32 | S584: ALLEY | W584: NORTHCOTE | X584: 3 | Y584: 10 | Z584: 0 | AA584: 508 | AB584: 877 | AC584: 57.924743443557581 | AD584: 12
A585: BEST PLAYERS | W585: NORTH MELBOURNE | X585: 2 | Y585: 11 | Z585: 0 | AA585: 553 | AB585: 771 | AC585: 71.725032425421531 | AD585: 8
A586: WILLIAMSTOWN | D586: HARTSHORN | G586: McKENZIE | J586: W OUTEN | M586: McNEILAGE | O586: AMY | R586: ALLEY | W586: PORT MELBOURNE | X586: 2 | Y586: 11 | Z586: 0 | AA586: 378 | AB586: 713 | AC586: 53.015427769985976 | AD586: 8
A587: ESSENDON ASSOC. | D587: HOARE | G587: BENNETT | J587: MAINE | M587: GIBSON | O587: McNAMARA | R587: GRANT
A588: GOALKICKERS
A589: WILLIAMSTOWN | D589: HARTSHORN 2 | H589: M OUTEN | K589: AMY | M589: GARBUTT
A590: ESSENDON ASSOC. | D590: W PAIN | G590: LANIGAN | J590: HOARE | M590: DYSON
A592: BRUNSWICK | C592: 2 | D592: 0 | E592: =C592*6+D592 -> 12 | G592: 5 | H592: 3 | I592: =G592*6+H592 -> 33 | K592: 7 | L592: 5 | M592: =K592*6+L592 -> 47 | O592: 9 | P592: 6 | Q592: =O592*6+P592 -> 60 | S592: NORTH MELB
A593: NORTH MELBOURNE | C593: 3 | D593: 4 | E593: =C593*6+D593 -> 22 | G593: 5 | H593: 4 | I593: =G593*6+H593 -> 34 | K593: 7 | L593: 6 | M593: =K593*6+L593 -> 48 | O593: 7 | P593: 6 | Q593: =O593*6+P593 -> 48 | S593: VILLAIN
A594: BEST PLAYERS
A595: BRUNSWICK | D595: CHASE | G595: MILLS | J595: O'SHEA | M595: McKENZIE | Q595: LEEDS | T595: L BRAID
A596: NORTH MELBOURNE | D596: HARDY | G596: GIBNEY | J596: JOHNSON | M596: WILLIAMSON | Q596: TRELOAR | T596: PEMBERTON
A597: GOALKICKERS
A598: BRUNSWICK | D598: CHASE 4 | G598: H BRAID 2 | J598: EVERETT | M598: DUNSTAN | O598: TURNBULL
A599: NORTH MELBOURNE | D599: ARMSTRONG 2 | H599: PRIOR 2 | K599: HARDY | N599: HOPKINS
A601: PRESTON | C601: 2 | D601: 1 | E601: =C601*6+D601 -> 13 | G601: 5 | H601: 6 | I601: =G601*6+H601 -> 36 | K601: 7 | L601: 11 | M601: =K601*6+L601 -> 53 | O601: 8 | P601: 16 | Q601: =O601*6+P601 -> 64 | S601: PRESTON
A602: PORT MELBOURNE | C602: 1 | D602: 1 | E602: =C602*6+D602 -> 7 | G602: 1 | H602: 4 | I602: =G602*6+H602 -> 10 | K602: 2 | L602: 5 | M602: =K602*6+L602 -> 17 | O602: 3 | P602: 7 | Q602: =O602*6+P602 -> 25 | S602: KENDALL
A603: BEST PLAYERS
A604: PRESTON | D604: PANNAM | G604: DUNCAN | J604: S HALL | M604: PRINCE | P604: BASSETT | S604: PUNCH
A605: PORT MELBOURNE | D605: JACKSON | G605: ANDERSON | J605: MAINE | M605: FRANKLIN | P605: McKAY | S605: SIMMNDS
A606: GOALKICKERS
A607: PRESTON | D607: PUNCH 2 | G607: TOMKINS 2 | J607: PRINCE | M607: PANNAM | O607: WHITE | Q607: OGDEN
A608: PORT MELBOURNE | D608: SIMMONDS | G608: FITZGERALD | K608: ANDERSON
A610: PRAHRAN | C610: 2 | D610: 2 | E610: =C610*6+D610 -> 14 | G610: 4 | H610: 7 | I610: =G610*6+H610 -> 31 | K610: 9 | L610: 12 | M610: =K610*6+L610 -> 66 | O610: 11 | P610: 14 | Q610: =O610*6+P610 -> 80 | S610: CROXTON PK
A611: NORTHCOTE | C611: 0 | D611: 1 | E611: =C611*6+D611 -> 1 | G611: 0 | H611: 2 | I611: =G611*6+H611 -> 2 | K611: 1 | L611: 6 | M611: =K611*6+L611 -> 12 | O611: 3 | P611: 9 | Q611: =O611*6+P611 -> 27 | S611: HURLEY
A612: BEST PLAYERS
A613: PRAHRAN | D613: ALLEN | G613: DOWSING | J613: W STEWART | M613: SYKES | P613: JULIAN | S613: HAIGHBLOOM
A614: NORTHCOTE | D614: MONTEITH | G614: COLE | J614: LANGDON | M614: CHESSWASS | P614: PETTIT | S614: McINTOSH
A615: GOALKICKERS
A616: PRAHRAN | D616: SYKES 6 | G616: JULIAN 4 | K616: WATTS
A617: NORTHCOTE | D617: BECK | G617: PETTIT | J617: DANIELS
A619: ROUND 14 | E619: 24TH JULY | J619: WEATHER | N619: STRONG NORTH WIND | S619: PLAYED AT | X619: LADDER | AB619: ROUND | AD619: 14
D620: 1ST QTR | H620: 2ND QTR | L620: 3RD QTR | P620: FINAL | S620: FOOTSCRAY
A621: FOOTSCRAY | C621: 0 | D621: 0 | E621: =C621*6+D621 -> 0 | G621: 2 | H621: 5 | I621: =G621*6+H621 -> 17 | K621: 2 | L621: 7 | M621: =K621*6+L621 -> 19 | O621: 5 | P621: 11 | Q621: =O621*6+P621 -> 41 | S621: UMPIRE | W621: TEAM | X621: W | Y621: L | Z621: D | AA621: FOR | AB621: AGST | AC621: % | AD621: PTS
A622: WILLIAMSTOWN | C622: 2 | D622: 6 | E622: =C622*6+D622 -> 18 | G622: 2 | H622: 6 | I622: =G622*6+H622 -> 18 | K622: 3 | L622: 11 | M622: =K622*6+L622 -> 29 | O622: 3 | P622: 13 | Q622: =O622*6+P622 -> 31 | S622: KENDALL
A623: BEST PLAYERS | W623: PRAHRAN | X623: 13 | Y623: 1 | Z623: 0 | AA623: 954 | AB623: 597 | AC623: 159.79899497487438 | AD623: 52
A624: FOOTSCRAY | D624: T SEVIOR | G624: OGILVIE | J624: COTTON | M624: GILBERT | O624: BORTHWICK | R624: HARRIS | W624: ESSENDON ASSOC. | X624: 11 | Y624: 3 | Z624: 0 | AA624: 794 | AB624: 486 | AC624: 163.37448559670781 | AD624: 44
A625: WILLIAMSTOWN | D625: MONAR | G625: HARTSHORN | J625: WEIDNER | M625: ELLIS | O625: ELDRIDGE | R625: AMY | W625: FOOTSCRAY | X625: 9 | Y625: 5 | Z625: 0 | AA625: 772 | AB625: 565 | AC625: 136.63716814159292 | AD625: 36
A626: GOALKICKERS | W626: BRUNSWICK | X626: 8 | Y626: 6 | Z626: 0 | AA626: 738 | AB626: 590 | AC626: 125.08474576271186 | AD626: 32
A627: FOOTSCRAY | D627: T SEVIOR 2 | G627: GILBERT | J627: DUANE | M627: LAUNDER
A628: WILLIAMSTOWN | D628: HARTSHORN | G628: MONAR | J628: ELDRIDGE | W628: WILLIAMSTOWN | X628: 8 | Y628: 6 | Z628: 0 | AA628: 670 | AB628: 570 | AC628: 117.54385964912281 | AD628: 32
W629: BRIGHTON | X629: 8 | Y629: 6 | Z629: 0 | AA629: 626 | AB629: 626 | AC629: 100 | AD629: 32
A630: PRAHRAN | C630: 4 | D630: 1 | E630: =C630*6+D630 -> 25 | G630: 6 | H630: 7 | I630: =G630*6+H630 -> 43 | K630: 8 | L630: 10 | M630: =K630*6+L630 -> 58 | O630: 11 | P630: 13 | Q630: =O630*6+P630 -> 79 | S630: TOORAK PARK | W630: PRESTON | X630: 5 | Y630: 9 | Z630: 0 | AA630: 651 | AB630: 767 | AC630: 84.876140808344203 | AD630: 20
A631: BRIGHTON | C631: 2 | D631: 1 | E631: =C631*6+D631 -> 13 | G631: 3 | H631: 2 | I631: =G631*6+H631 -> 20 | K631: 3 | L631: 9 | M631: =K631*6+L631 -> 27 | O631: 7 | P631: 11 | Q631: =O631*6+P631 -> 53 | S631: ALLEY | W631: NORTH MELBOURNE | X631: 3 | Y631: 11 | Z631: 0 | AA631: 616 | AB631: 810 | AC631: 76.049382716049379 | AD631: 12
A632: BEST PLAYERS | W632: NORTHCOTE | X632: 3 | Y632: 11 | Z632: 0 | AA632: 534 | AB632: 933 | AC632: 57.234726688102896 | AD632: 12
A633: PRAHRAN | D633: BENNION | G633: HALL | J633: WILSON | M633: HOMAN | O633: DOWDING | R633: CONQUEST | W633: PORT MELBOURNE | X633: 2 | Y633: 12 | Z633: 0 | AA633: 395 | AB633: 806 | AC633: 49.007444168734494 | AD633: 8
A634: BRIGHTON | D634: DUNCAN | G634: CONLAN | J634: G ROBINSON | M634: McCLEERY | O634: PLOWMAN | R634: WENBORN
A635: GOALKICKERS
A636: PRAHRAN | D636: HALL 4 | F636: W STEWART | I636: CONQUEST | L636: DOWSING | N636: H FARMER | Q636: BENNION | T636: WATTS | W636: SYKES
A637: BRIGHTON | D637: G ROBINSON 3 | H637: RENNOLDS | K637: HARDIMAN | N637: HARRISON | Q637: KULPA
A639: NORTH MELBOURNE | C639: 4 | D639: 6 | E639: =C639*6+D639 -> 30 | G639: 6 | H639: 7 | I639: =G639*6+H639 -> 43 | K639: 6 | L639: 12 | M639: =K639*6+L639 -> 48 | O639: 8 | P639: 15 | Q639: =O639*6+P639 -> 63 | S639: NORTH MELB
A640: PRESTON | C640: 1 | D640: 0 | E640: =C640*6+D640 -> 6 | G640: 2 | H640: 4 | I640: =G640*6+H640 -> 16 | K640: 4 | L640: 6 | M640: =K640*6+L640 -> 30 | O640: 5 | P640: 9 | Q640: =O640*6+P640 -> 39 | S640: JOHNSON
A641: BEST PLAYERS
A642: NORTH MELBOURNE | D642: HARDY | G642: HOPKINS | J642: GIBNEY | M642: PEMBERTON | P642: TRELOAR | S642: HOMAN
A643: PRESTON | D643: J WHITE | G643: PUNCH | J643: DUNCAN | M643: TOMKINS | P643: PRINCE | S643: MAUDE
A644: GOALKICKERS
A645: NORTH MELBOURNE | D645: PRIOR 3 | G645: BICKFORD | J645: WILLIAMSON | M645: TRELOAR | O645: ARMSTRONG | R645: HARDY | U645: GIBNEY
A646: PRESTON | D646: PUNCH 3 | G646: WHITE | J646: WOODS
A648: ESSENDON ASSOC. | C648: 0 | D648: 7 | E648: =C648*6+D648 -> 7 | G648: 3 | H648: 10 | I648: =G648*6+H648 -> 28 | K648: 3 | L648: 13 | M648: =K648*6+L648 -> 31 | O648: 7 | P648: 14 | Q648: =O648*6+P648 -> 56 | S648: ESSENDON
A649: NORTHCOTE | C649: 1 | D649: 1 | E649: =C649*6+D649 -> 7 | G649: 3 | H649: 3 | I649: =G649*6+H649 -> 21 | K649: 3 | L649: 6 | M649: =K649*6+L649 -> 24 | O649: 3 | P649: 8 | Q649: =O649*6+P649 -> 26 | S649: MARTIN
A650: BEST PLAYERS
A651: ESSENDON ASSOC. | D651: MADDEN | G651: McNAMARA | J651: BOWE | M651: RENWICK | P651: ABBOTT | S651: MAINE
A652: NORTHCOTE | D652: COLE | G652: LUMSDEN | J652: PETTIT | M652: CHESSWASS | P652: PORTER | S652: REARDON
A653: GOALKICKERS
A654: ESSENDON ASSOC. | C654: ??? | D654: BARLOW/DYSON 3 | H654: HAMBRIDGE 2 | L654: ABBOTT | O654: McNAMARA | R654: GOUGH
A655: NORTHCOTE | D655: DANIELS | G655: BECK | J655: REARDON
A657: BRUNSWICK | C657: 3 | D657: 2 | E657: =C657*6+D657 -> 20 | G657: 5 | H657: 5 | I657: =G657*6+H657 -> 35 | K657: 8 | L657: 8 | M657: =K657*6+L657 -> 56 | O657: 14 | P657: 9 | Q657: =O657*6+P657 -> 93 | S657: PORT MELB
A658: PORT MELBOURNE | C658: 1 | D658: 0 | E658: =C658*6+D658 -> 6 | G658: 1 | H658: 3 | I658: =G658*6+H658 -> 9 | K658: 1 | L658: 3 | M658: =K658*6+L658 -> 9 | O658: 2 | P658: 5 | Q658: =O658*6+P658 -> 17 | S658: HURLEY
A659: BEST PLAYERS
A660: BRUNSWICK | D660: McKENZIE | G660: O'SHEA | J660: CHASE | M660: HEAPHY | P660: L BRAID | S660: JOHNSON
A661: PORT MELBOURNE | D661: WEATE | G661: PASH | J661: ANDERSON | M661: McKAY | P661: BROWN | S661: FITZGERALD
A662: GOALKICKERS
A663: BRUNSWICK | D663: CHASE 4 | G663: H BRAID 4 | J663: FULLARTON 3 | N663: HEAPHY 2 | Q663: STANCLIFFE
A664: PORT MELBOURNE | D664: ANDERSON 2 | H664: ST JOHN
A666: ROUND 15 | E666: 31ST JULY | J666: WEATHER | N666: FINE STRONG N.E. WIND | S666: PLAYED AT | X666: LADDER | AB666: ROUND | AD666: 15
D667: 1ST QTR | H667: 2ND QTR | L667: 3RD QTR | P667: FINAL | S667: ESSENDON
A668: ESSENDON ASSOC. | C668: 0 | D668: 4 | E668: =C668*6+D668 -> 4 | G668: 0 | H668: 8 | I668: =G668*6+H668 -> 8 | K668: 0 | L668: 12 | M668: =K668*6+L668 -> 12 | O668: 2 | P668: 16 | Q668: =O668*6+P668 -> 28 | S668: UMPIRE | W668: TEAM | X668: W | Y668: L | Z668: D | AA668: FOR | AB668: AGST | AC668: % | AD668: PTS
A669: PRAHRAN | C669: 1 | D669: 0 | E669: =C669*6+D669 -> 6 | G669: 1 | H669: 4 | I669: =G669*6+H669 -> 10 | K669: 1 | L669: 6 | M669: =K669*6+L669 -> 12 | O669: 2 | P669: 7 | Q669: =O669*6+P669 -> 19 | S669: HURLEY
A670: BEST PLAYERS | W670: PRAHRAN | X670: 13 | Y670: 2 | Z670: 0 | AA670: 973 | AB670: 625 | AC670: 155.68 | AD670: 52
A671: ESSENDON ASSOC. | D671: MADDEN | G671: MAINE | I671: W PAIN | K671: HOARE | N671: ABBOTT | Q671: GOUGH | W671: ESSENDON ASSOC. | X671: 12 | Y671: 3 | Z671: 0 | AA671: 822 | AB671: 505 | AC671: 162.77227722772278 | AD671: 48
A672: PRAHRAN | D672: BENNION | G672: ROURKE | I672: CARLSON | K672: WOODS | N672: ALLEN | Q672: W STEWART | W672: FOOTSCRAY | X672: 10 | Y672: 5 | Z672: 0 | AA672: 836 | AB672: 589 | AC672: 141.93548387096774 | AD672: 40
A673: GOALKICKERS | W673: BRUNSWICK | X673: 9 | Y673: 6 | Z673: 0 | AA673: 835 | AB673: 608 | AC673: 137.33552631578948 | AD673: 36
A674: ESSENDON ASSOC. | D674: HAMBRIDGE | G674: DYSON
A675: PRAHRAN | D675: WATTS | G675: SYKES | W675: WILLIAMSTOWN | X675: 9 | Y675: 6 | Z675: 0 | AA675: 699 | AB675: 577 | AC675: 121.14384748700174 | AD675: 36
W676: BRIGHTON | X676: 9 | Y676: 6 | Z676: 0 | AA676: 697 | AB676: 664 | AC676: 104.96987951807229 | AD676: 36
A677: BRUNSWICK | C677: 2 | D677: 5 | E677: =C677*6+D677 -> 17 | G677: 8 | H677: 8 | I677: =G677*6+H677 -> 56 | K677: 11 | L677: 11 | M677: =K677*6+L677 -> 77 | O677: 14 | P677: 13 | Q677: =O677*6+P677 -> 97 | S677: BRUNSWICK | W677: PRESTON | X677: 5 | Y677: 10 | Z677: 0 | AA677: 669 | AB677: 864 | AC677: 77.430555555555557 | AD677: 20
A678: PRESTON | C678: 0 | D678: 0 | E678: =C678*6+D678 -> 0 | G678: 1 | H678: 3 | I678: =G678*6+H678 -> 9 | K678: 2 | L678: 6 | M678: =K678*6+L678 -> 18 | O678: 2 | P678: 6 | Q678: =O678*6+P678 -> 18 | S678: ALLEY | W678: NORTH MELBOURNE | X678: 3 | Y678: 12 | Z678: 0 | AA678: 623 | AB678: 839 | AC678: 74.255065554231223 | AD678: 12
A679: BEST PLAYERS | W679: NORTHCOTE | X679: 3 | Y679: 12 | Z679: 0 | AA679: 558 | AB679: 997 | AC679: 55.967903711133403 | AD679: 12
A680: BRUNSWICK | D680: CHASE | G680: ABBOTT | I680: STANCLIFFE | L680: THOMAS | N680: McKENZIE | Q680: JOHNSON | W680: PORT MELBOURNE | X680: 2 | Y680: 13 | Z680: 0 | AA680: 433 | AB680: 877 | AC680: 49.372862029646519 | AD680: 8
A681: PRESTON | D681: WOODS | G681: WHITE | I681: PUNCH | L681: PRINCE | N681: S HALL | Q681: OGDEN
A682: GOALKICKERS
A683: BRUNSWICK | D683: CHASE 8 | G683: FULLARTON 2 | J683: EVERETT 2 | M683: MARSH | O683: McKENZIE
A684: PRESTON | D684: PUCH | G684: OGDEN
A686: WILLIAMSTOWN | C686: 0 | D686: 4 | E686: =C686*6+D686 -> 4 | G686: 0 | H686: 6 | I686: =G686*6+H686 -> 6 | K686: 1 | L686: 8 | M686: =K686*6+L686 -> 14 | O686: 3 | P686: 11 | Q686: =O686*6+P686 -> 29 | S686: WILLIAMSTOWN
A687: NORTH MELBOURNE | C687: 0 | D687: 1 | E687: =C687*6+D687 -> 1 | G687: 0 | H687: 6 | I687: =G687*6+H687 -> 6 | K687: 0 | L687: 6 | M687: =K687*6+L687 -> 6 | O687: 0 | P687: 7 | Q687: =O687*6+P687 -> 7 | S687: MARTIN
A688: BEST PLAYERS
A689: WILLIAMSTOWN | D689: M OUTEN | G689: McKENZIE | J689: AMY | M689: JOY | O689: ELDRIDGE | R689: WEIDNER
A690: NORTH MELBOURNE | D690: KEATING | G690: NELSON | J690: HOMAN | M690: JOHNSON | O690: BARKER | R690: GIBNEY
A691: GOALKICKERS
A692: WILLIAMSTOWN | D692: HARTSHORN | G692: AMY | J692: McNEILAGE
A693: NORTH MELBOURNE | D693: NIL
A695: BRIGHTON | C695: 2 | D695: 2 | E695: =C695*6+D695 -> 14 | G695: 5 | H695: 8 | I695: =G695*6+H695 -> 38 | K695: 7 | L695: 11 | M695: =K695*6+L695 -> 53 | O695: 9 | P695: 17 | Q695: =O695*6+P695 -> 71 | S695: BRIGHTON
A696: PORT MELBOURNE | C696: 3 | D696: 0 | E696: =C696*6+D696 -> 18 | G696: 4 | H696: 0 | I696: =G696*6+H696 -> 24 | K696: 5 | L696: 0 | M696: =K696*6+L696 -> 30 | O696: 6 | P696: 2 | Q696: =O696*6+P696 -> 38 | S696: KENDALL
A697: BEST PLAYERS
A698: BRIGHTON | D698: HARDIMAN | G698: A LAXTON | J698: McCLEERY | M698: KULPA | P698: DUNCAN | S698: KUSCHART
A699: PORT MELBOURNE | D699: McKAY | G699: ANDERSON | J699: PASH | M699: FITZGERALD | P699: FRANKLIN | S699: RANKIN
A700: GOALKICKERS
A701: BRIGHTON | D701: HARDIMAN 3 | G701: KULPA 3 | J701: KUSCHART | M701: CHRISTIAN | P701: RYAN
A702: PORT MELBOURNE | D702: ST JOHN 2 | H702: RANKIN 2 | K702: ANDERSON | N702: SIMMONDS
A704: FOOTSCRAY | C704: 0 | D704: 3 | E704: =C704*6+D704 -> 3 | G704: 3 | H704: 5 | I704: =G704*6+H704 -> 23 | K704: 6 | L704: 9 | M704: =K704*6+L704 -> 45 | O704: 8 | P704: 16 | Q704: =O704*6+P704 -> 64 | S704: CROXTON PK
A705: NORTHCOTE | C705: 0 | D705: 2 | E705: =C705*6+D705 -> 2 | G705: 1 | H705: 4 | I705: =G705*6+H705 -> 10 | K705: 2 | L705: 6 | M705: =K705*6+L705 -> 18 | O705: 3 | P705: 6 | Q705: =O705*6+P705 -> 24 | S705: VILLAIN
A706: BEST PLAYERS
A707: FOOTSCRAY | D707: COTTON | G707: CLARKE | J707: T SEVIOR | M707: HARRIS | P707: DE CHENE | S707: OGILVIE
A708: NORTHCOTE | D708: PRATT | G708: BECK | J708: REARDON | M708: COLE | P708: FAIRBANK | S708: WALKER
A709: GOALKICKERS
A710: FOOTSCRAY | D710: W McCARTHY 2 | H710: HARRIS 2 | K710: T SEVIOR 2 | O710: DUANE | Q710: LAUNDER
A711: NORTHCOTE | D711: BECK | G711: WALKER | J711: DANIELS
A713: ROUND 16 | E713: 14TH AUGUST | J713: WEATHER | N713: NORTH WIND | S713: PLAYED AT | X713: LADDER | AB713: ROUND | AD713: 16
D714: 1ST QTR | H714: 2ND QTR | L714: 3RD QTR | P714: FINAL | S714: FOOTSCRAY
A715: ESSENDON ASSOC. | C715: 1 | D715: 3 | E715: =C715*6+D715 -> 9 | G715: 2 | H715: 6 | I715: =G715*6+H715 -> 18 | K715: 4 | L715: 10 | M715: =K715*6+L715 -> 34 | O715: 11 | P715: 11 | Q715: =O715*6+P715 -> 77 | S715: UMPIRE | W715: TEAM | X715: W | Y715: L | Z715: D | AA715: FOR | AB715: AGST | AC715: % | AD715: PTS
A716: FOOTSCRAY | C716: 0 | D716: 1 | E716: =C716*6+D716 -> 1 | G716: 0 | H716: 6 | I716: =G716*6+H716 -> 6 | K716: 0 | L716: 7 | M716: =K716*6+L716 -> 7 | O716: 0 | P716: 8 | Q716: =O716*6+P716 -> 8 | S716: HURLEY
A717: BEST PLAYERS | W717: PRAHRAN | X717: 14 | Y717: 2 | Z717: 0 | AA717: 1034 | AB717: 667 | AC717: 155.02248875562219 | AD717: 56
A718: ESSENDON ASSOC. | D718: MADDEN | G718: MAINE | I718: McINTYRE | K718: RENWICK | N718: W PAIN | Q718: HOARE | W718: ESSENDON ASSOC. | X718: 13 | Y718: 3 | Z718: 0 | AA718: 899 | AB718: 513 | AC718: 175.24366471734893 | AD718: 52
A719: FOOTSCRAY | D719: CLARKE | G719: NEILSON | I719: HARRIS | K719: MARMO | N719: OGILVIE | Q719: T SEVIOR | W719: BRUNSWICK | X719: 10 | Y719: 6 | Z719: 0 | AA719: 874 | AB719: 628 | AC719: 139.171974522293 | AD719: 40
A720: GOALKICKERS | W720: FOOTSCRAY | X720: 10 | Y720: 6 | Z720: 0 | AA720: 844 | AB720: 666 | AC720: 126.72672672672672 | AD720: 40
A721: ESSENDON ASSOC. | D721: McNAMARA 5 | H721: DYSON 3 | K721: HOARE | M721: ABBOTT | O721: BOWE
A722: FOOTSCRAY | D722: NIL | W722: BRIGHTON | X722: 10 | Y722: 6 | Z722: 0 | AA722: 761 | AB722: 687 | AC722: 110.77147016011645 | AD722: 40
W723: WILLIAMSTOWN | X723: 9 | Y723: 7 | Z723: 0 | AA723: 719 | AB723: 616 | AC723: 116.72077922077922 | AD723: 36
A724: BRUNSWICK | C724: 0 | D724: 3 | E724: =C724*6+D724 -> 3 | G724: 3 | H724: 5 | I724: =G724*6+H724 -> 23 | K724: 4 | L724: 6 | M724: =K724*6+L724 -> 30 | O724: 5 | P724: 9 | Q724: =O724*6+P724 -> 39 | S724: BRUNSWICK | W724: PRESTON | X724: 5 | Y724: 11 | Z724: 0 | AA724: 692 | AB724: 928 | AC724: 74.568965517241381 | AD724: 20
A725: WILLIAMSTOWN | C725: 0 | D725: 3 | E725: =C725*6+D725 -> 3 | G725: 1 | H725: 3 | I725: =G725*6+H725 -> 9 | K725: 2 | L725: 5 | M725: =K725*6+L725 -> 17 | O725: 2 | P725: 8 | Q725: =O725*6+P725 -> 20 | S725: KENDALL | W725: NORTH MELBOURNE | X725: 4 | Y725: 12 | Z725: 0 | AA725: 713 | AB725: 864 | AC725: 82.523148148148152 | AD725: 16
A726: BEST PLAYERS | W726: NORTHCOTE | X726: 3 | Y726: 13 | Z726: 0 | AA726: 583 | AB726: 1087 | AC726: 53.633854645814168 | AD726: 12
A727: BRUNSWICK | D727: McKENZIE | G727: JOHNSON | I727: O'SHEA | K727: GILLESPIE | N727: FULLARTON | Q727: PEARS | W727: PORT MELBOURNE | X727: 2 | Y727: 14 | Z727: 0 | AA727: 475 | AB727: 938 | AC727: 50.639658848614076 | AD727: 8
A728: WILLIAMSTOWN | D728: MONAR | G728: KENNEDY | I728: REITMAN | K728: ELLIS | N728: JOY | Q728: ELDRIDGE
A729: GOALKICKERS
A730: BRUNSWICK | D730: FULLARTON 2 | H730: STANCLIFFE | K730: HEAPHY | N730: McKENZIE
A731: WILLIAMSTOWN | D731: HARTSHORN | G731: ADDISON
A733: BRIGHTON | C733: 0 | D733: 0 | E733: =C733*6+D733 -> 0 | G733: 3 | H733: 5 | I733: =G733*6+H733 -> 23 | K733: 6 | L733: 8 | M733: =K733*6+L733 -> 44 | O733: 9 | P733: 10 | Q733: =O733*6+P733 -> 64 | S733: PRESTON
A734: PRESTON | C734: 0 | D734: 4 | E734: =C734*6+D734 -> 4 | G734: 0 | H734: 4 | I734: =G734*6+H734 -> 4 | K734: 1 | L734: 4 | M734: =K734*6+L734 -> 10 | O734: 3 | P734: 5 | Q734: =O734*6+P734 -> 23 | S734: VILLAIN
A735: BEST PLAYERS
A736: BRIGHTON | D736: DUNCAN | G736: HARDIMAN | K736: KENNEDY | N736: A LAXTON | Q736: BAILES | T736: PLOWMAN
A737: PRESTON | D737: BILLINGS | G737: S HALL | K737: PRINCE | N737: OGDEN | Q737: DUNCAN | T737: WHITE
A738: GOALKICKERS
A739: BRIGHTON | D739: BAILES 3 | G739: KULPA 2 | J739: HARDIMAN | M739: PLAISTED | P739: GILBERT | S739: RENNOLDS
A740: PRESTON | D740: HENDRIE | G740: PUNCH | J740: DICKIE
A742: NORTH MELBOURNE | C742: 3 | D742: 7 | E742: =C742*6+D742 -> 25 | G742: 4 | H742: 11 | I742: =G742*6+H742 -> 35 | K742: 10 | L742: 14 | M742: =K742*6+L742 -> 74 | O742: 12 | P742: 18 | Q742: =O742*6+P742 -> 90 | S742: NORTH MELB
A743: NORTHCOTE | C743: 0 | D743: 2 | E743: =C743*6+D743 -> 2 | G743: 0 | H743: 4 | I743: =G743*6+H743 -> 4 | K743: 1 | L743: 6 | M743: =K743*6+L743 -> 12 | O743: 3 | P743: 7 | Q743: =O743*6+P743 -> 25 | S743: MARTIN
A744: BEST PLAYERS
A745: NORTH MELBOURNE | D745: HARDY | G745: PATTISON | K745: LAVER | N745: BARKER | Q745: McCANN | T745: ARMSTRONG
A746: NORTHCOTE | D746: PRATT | G746: PETTIT | K746: BECK | N746: LUMSDEN | Q746: COLE
A747: GOALKICKERS
A748: NORTH MELBOURNE | D748: ARMSTRONG 6 | H748: HARDY 3 | K748: McCANN 2 | N748: HOMAN
A749: NORTHCOTE | D749: MONTEITH | G749: SMITH | J749: PRATT
A751: PRAHRAN | C751: 1 | D751: 6 | E751: =C751*6+D751 -> 12 | G751: 5 | H751: 10 | I751: =G751*6+H751 -> 40 | K751: 6 | L751: 12 | M751: =K751*6+L751 -> 48 | O751: 7 | P751: 19 | Q751: =O751*6+P751 -> 61 | S751: TOORAK PARK
A752: PORT MELBOURNE | C752: 4 | D752: 0 | E752: =C752*6+D752 -> 24 | G752: 4 | H752: 1 | I752: =G752*6+H752 -> 25 | K752: 6 | L752: 2 | M752: =K752*6+L752 -> 38 | O752: 6 | P752: 6 | Q752: =O752*6+P752 -> 42 | S752: ALLEY
A753: BEST PLAYERS
A754: PRAHRAN | D754: BENNION | G754: ROURKE | J754: DOWSING | M754: WATTS | P754: HAIGHBLOOM | S754: DOWDING
A755: PORT MELBOURNE | D755: FITZGERALD | G755: SIMMONDS | J755: SUMMERS | M755: MAINE | P755: BROWN | S755: JACKSON
A756: GOALKICKERS
A757: PRAHRAN | D757: SYKES 2 | G757: WATTS 2 | J757: WOODS | L757: HAIGHBLOOM | O757: WRIGHT
A758: PORT MELBOURNE | D758: MAINE 2 | G758: McCANN 2 | J758: BROWN | L758: ST JOHN
A760: ROUND 17 | E760: 21ST AUGUST | J760: WEATHER | N760: SOUTH WEST BREEZE | S760: PLAYED AT | X760: LADDER | AB760: ROUND | AD760: 17
D761: 1ST QTR | H761: 2ND QTR | L761: 3RD QTR | P761: FINAL | S761: BRIGHTON
A762: BRUNSWICK | C762: 2 | D762: 5 | E762: =C762*6+D762 -> 17 | G762: 3 | H762: 7 | I762: =G762*6+H762 -> 25 | K762: 9 | L762: 10 | M762: =K762*6+L762 -> 64 | O762: 12 | P762: 10 | Q762: =O762*6+P762 -> 82 | S762: UMPIRE | W762: TEAM | X762: W | Y762: L | Z762: D | AA762: FOR | AB762: AGST | AC762: % | AD762: PTS
A763: BRIGHTON | C763: 0 | D763: 0 | E763: =C763*6+D763 -> 0 | G763: 1 | H763: 1 | I763: =G763*6+H763 -> 7 | K763: 2 | L763: 2 | M763: =K763*6+L763 -> 14 | O763: 8 | P763: 4 | Q763: =O763*6+P763 -> 52 | S763: KENDALL
A764: BEST PLAYERS | W764: PRAHRAN | X764: 15 | Y764: 2 | Z764: 0 | AA764: 1097 | AB764: 702 | AC764: 156.26780626780626 | AD764: 60
A765: BRUNSWICK | D765: JOHNSON | G765: GILLESPIE | J765: ABBOTT | M765: LEEDS | O765: O'SHEA | Q765: STANCLIFFE | W765: ESSENDON ASSOC. | X765: 14 | Y765: 3 | Z765: 0 | AA765: 1012 | AB765: 525 | AC765: 192.76190476190476 | AD765: 56
A766: BRIGHTON | D766: KENNEDY | G766: WENBORN | J766: A LAXTON | M766: H LAXTON | O766: GILBERT | Q766: PLAISTED | W766: BRUNSWICK | X766: 11 | Y766: 6 | Z766: 0 | AA766: 956 | AB766: 680 | AC766: 140.58823529411765 | AD766: 44
A767: GOALKICKERS | W767: FOOTSCRAY | X767: 11 | Y767: 6 | Z767: 0 | AA767: 896 | AB767: 704 | AC767: 127.27272727272727 | AD767: 44
A768: BRUNSWICK | D768: CHASE 4 | F768: FULLARTON 3 | I768: HEAPHY | K768: MARSH | M768: STANCLIFFE | O768: H BRAID | Q768: TURNBULL
A769: BRIGHTON | D769: KULPA 2 | G769: GORMAN 2 | J769: BOYLAND | L769: H LAXTON | N769: HARDIMAN | Q769: GILBERT | W769: WILLIAMSTOWN | X769: 10 | Y769: 7 | Z769: 0 | AA769: 776 | AB769: 668 | AC769: 116.16766467065868 | AD769: 40
W770: BRIGHTON | X770: 10 | Y770: 7 | Z770: 0 | AA770: 813 | AB770: 769 | AC770: 105.72171651495448 | AD770: 40
A771: PRAHRAN | C771: 2 | D771: 7 | E771: =C771*6+D771 -> 19 | G771: 4 | H771: 11 | I771: =G771*6+H771 -> 35 | K771: 7 | L771: 15 | M771: =K771*6+L771 -> 57 | O771: 7 | P771: 21 | Q771: =O771*6+P771 -> 63 | S771: TOORAK PARK | W771: PRESTON | X771: 5 | Y771: 12 | Z771: 0 | AA771: 727 | AB771: 991 | AC771: 73.360242179616549 | AD771: 20
A772: PRESTON | C772: 0 | D772: 1 | E772: =C772*6+D772 -> 1 | G772: 4 | H772: 4 | I772: =G772*6+H772 -> 28 | K772: 4 | L772: 5 | M772: =K772*6+L772 -> 29 | O772: 5 | P772: 5 | Q772: =O772*6+P772 -> 35 | S772: ALLEY | W772: NORTH MELBOURNE | X772: 4 | Y772: 13 | Z772: 0 | AA772: 725 | AB772: 977 | AC772: 74.206755373592628 | AD772: 16
A773: BEST PLAYERS | W773: NORTHCOTE | X773: 3 | Y773: 14 | Z773: 0 | AA773: 635 | AB773: 1144 | AC773: 55.506993006993007 | AD773: 12
A774: PRAHRAN | D774: SYKES | G774: W STEWART | J774: ROURKE | M774: WOOD | P774: PARSONS | R774: CARLSON | W774: PORT MELBOURNE | X774: 2 | Y774: 15 | Z774: 0 | AA774: 513 | AB774: 990 | AC774: 51.81818181818182 | AD774: 8
A775: PRESTON | D775: HENDRIE | G775: CARROLL | J775: BASSETT | M775: DUNCAN | P775: PRINCE | R775: PANNAM
A776: GOALKICKERS
A777: PRAHRAN | D777: SYKES 4 | G777: STEWART | J777: WATTS | M777: BENNION
A778: PRESTON | D778: PANNAM 3 | G778: PUNCH
A780: ESSENDON ASSOC. | C780: 3 | D780: 5 | E780: =C780*6+D780 -> 23 | G780: 7 | H780: 10 | I780: =G780*6+H780 -> 52 | K780: 12 | L780: 16 | M780: =K780*6+L780 -> 88 | O780: 16 | P780: 17 | Q780: =O780*6+P780 -> 113 | S780: ESSENDON
A781: NORTH MELBOURNE | C781: 0 | D781: 1 | E781: =C781*6+D781 -> 1 | G781: 0 | H781: 3 | I781: =G781*6+H781 -> 3 | K781: 1 | L781: 4 | M781: =K781*6+L781 -> 10 | O781: 1 | P781: 6 | Q781: =O781*6+P781 -> 12 | S781: HURLEY
A782: BEST PLAYERS
A783: ESSENDON ASSOC. | D783: MADDEN | G783: ATKINS | J783: HAMBRIDGE | M783: GOUGH | P783: HOARE | S783: MAINE
A784: NORTH MELBOURNE | D784: HARDY | G784: JOHNSON | J784: SPEAKMAN | M784: KEATING | P784: PEMBERTON | S784: BARKER
A785: GOALKICKERS
A786: ESSENDON ASSOC. | D786: ATKINS 6 | G786: McNAMARA 4 | K786: ABBOTT 4 | N786: HOARE | P786: MONAGLE
A787: NORTH MELBOURNE | D787: BARKER
A789: WILLIAMSTOWN | C789: 2 | D789: 1 | E789: =C789*6+D789 -> 13 | G789: 4 | H789: 3 | I789: =G789*6+H789 -> 27 | K789: 7 | L789: 7 | M789: =K789*6+L789 -> 49 | O789: 8 | P789: 9 | Q789: =O789*6+P789 -> 57 | S789: CROXTON PK
A790: NORTHCOTE | C790: 3 | D790: 5 | E790: =C790*6+D790 -> 23 | G790: 3 | H790: 7 | I790: =G790*6+H790 -> 25 | K790: 4 | L790: 8 | M790: =K790*6+L790 -> 32 | O790: 7 | P790: 10 | Q790: =O790*6+P790 -> 52 | S790: GREGORY
A791: BEST PLAYERS
A792: WILLIAMSTOWN | D792: ELLIS | G792: ELDRIDGE | J792: WEIDNER | M792: HORNER | P792: JOY | R792: A CALDWELL
A793: NORTHCOTE | D793: BECK | G793: CHESSWASS | J793: SMITH | M793: REARDON | P793: WALKER | R793: FAIRBANK
A794: GOALKICKERS
A795: WILLIAMSTOWN | D795: MATTHEWS 3 | G795: McNEILAGE 2 | K795: ADDISON 2 | N795: MONAR
A796: NORTHCOTE | D796: BECK 2 | G796: REARDON 2 | K796: SMITH 2 | N796: DANIELS
A798: FOOTSCRAY | C798: 2 | D798: 5 | E798: =C798*6+D798 -> 17 | G798: 2 | H798: 7 | I798: =G798*6+H798 -> 19 | K798: 5 | L798: 8 | M798: =K798*6+L798 -> 38 | O798: 7 | P798: 10 | Q798: =O798*6+P798 -> 52 | S798: PORT MELB
A799: PORT MELBOURNE | C799: 1 | D799: 1 | E799: =C799*6+D799 -> 7 | G799: 2 | H799: 2 | I799: =G799*6+H799 -> 14 | K799: 3 | L799: 4 | M799: =K799*6+L799 -> 22 | O799: 5 | P799: 8 | Q799: =O799*6+P799 -> 38 | S799: MARTIN
A800: BEST PLAYERS
A801: FOOTSCRAY | D801: OGILVIE | G801: W McCARTHY | J801: D McCARTHY | M801: HANSEN | P801: O'CONNELL | S801: MARMO
A802: PORT MELBOURNE | D802: ANDERSON | G802: FITZGERALD | J802: McMURRAY | M802: McKAY | P802: RANKIN | S802: PAMPERIN
A803: GOALKICKERS
A804: FOOTSCRAY | D804: CASSIDY 2 | G804: W McCARTHY | J804: GUTHRIDGE | M804: MARMO | O804: COTTON | Q804: T SEVIOR
A805: PORT MELBOURNE | D805: PAMPERIN 2 | G805: ST JOHN | J805: FITZGERALD | M805: TREGLOWN
A807: ROUND 18 | E807: 28TH AUGUST | J807: WEATHER | N807: NORTH WIND RAIN | S807: PLAYED AT | X807: LADDER | AB807: ROUND | AD807: 18
D808: 1ST QTR | H808: 2ND QTR | L808: 3RD QTR | P808: FINAL | S808: BRUNSWICK
A809: PRAHRAN | C809: 2 | D809: 3 | E809: =C809*6+D809 -> 15 | G809: 2 | H809: 7 | I809: =G809*6+H809 -> 19 | K809: 5 | L809: 10 | M809: =K809*6+L809 -> 40 | O809: 6 | P809: 12 | Q809: =O809*6+P809 -> 48 | S809: UMPIRE | W809: TEAM | X809: W | Y809: L | Z809: D | AA809: FOR | AB809: AGST | AC809: % | AD809: PTS
A810: BRUNSWICK | C810: 4 | D810: 3 | E810: =C810*6+D810 -> 27 | G810: 4 | H810: 7 | I810: =G810*6+H810 -> 31 | K810: 4 | L810: 11 | M810: =K810*6+L810 -> 35 | O810: 4 | P810: 14 | Q810: =O810*6+P810 -> 38 | S810: HURLEY
A811: BEST PLAYERS | W811: PRAHRAN | X811: 16 | Y811: 2 | Z811: 0 | AA811: 1145 | AB811: 740 | AC811: 154.72972972972974 | AD811: 64
A812: PRAHRAN | D812: ROURKE | G812: HAIGHBLOOM | J812: W STEWART | M812: BENNION | O812: CARLSON | Q812: WOODS | W812: ESSENDON ASSOC. | X812: 15 | Y812: 3 | Z812: 0 | AA812: 1067 | AB812: 557 | AC812: 191.56193895870737 | AD812: 60
A813: BRUNSWICK | D813: McKENZIE | G813: JOHNSON | J813: CHASE | M813: MARSH | O813: O'SHEA | Q813: THOMAS | W813: BRUNSWICK | X813: 11 | Y813: 7 | Z813: 0 | AA813: 994 | AB813: 728 | AC813: 136.53846153846155 | AD813: 44
A814: GOALKICKERS | W814: FOOTSCRAY | X814: 11 | Y814: 7 | Z814: 0 | AA814: 928 | AB814: 737 | AC814: 125.91587516960651 | AD814: 44
A815: PRAHRAN | D815: PANNAM 3 | G815: SYKES 2 | J815: W STEWART
A816: BRUNSWICK | D816: MARSH | G816: CHASE | J816: STANCLIFFE | N816: HEAPHY | W816: WILLIAMSTOWN | X816: 11 | Y816: 7 | Z816: 0 | AA816: 847 | AB816: 694 | AC816: 122.04610951008645 | AD816: 44
W817: BRIGHTON | X817: 11 | Y817: 7 | Z817: 0 | AA817: 871 | AB817: 801 | AC817: 108.7390761548065 | AD817: 44
A818: WILLIAMSTOWN | C818: 2 | D818: 4 | E818: =C818*6+D818 -> 16 | G818: 3 | H818: 6 | I818: =G818*6+H818 -> 24 | K818: 8 | L818: 8 | M818: =K818*6+L818 -> 56 | O818: 9 | P818: 17 | Q818: =O818*6+P818 -> 71 | S818: WILLIAMSTOWN | W818: NORTH MELBOURNE | X818: 5 | Y818: 13 | Z818: 0 | AA818: 758 | AB818: 1009 | AC818: 75.123885034687817 | AD818: 20
A819: PRESTON | C819: 1 | D819: 1 | E819: =C819*6+D819 -> 7 | G819: 2 | H819: 2 | I819: =G819*6+H819 -> 14 | K819: 3 | L819: 2 | M819: =K819*6+L819 -> 20 | O819: 4 | P819: 2 | Q819: =O819*6+P819 -> 26 | S819: JOHNSON | W819: PRESTON | X819: 5 | Y819: 13 | Z819: 0 | AA819: 753 | AB819: 1062 | AC819: 70.903954802259889 | AD819: 20
A820: BEST PLAYERS | W820: NORTHCOTE | X820: 3 | Y820: 15 | Z820: 0 | AA820: 667 | AB820: 1202 | AC820: 55.490848585690514 | AD820: 12
A821: WILLIAMSTOWN | D821: HORNER | G821: REITMAN | J821: JOY | M821: ELDRIDGE | O821: GIBBS | Q821: ELLIS | W821: PORT MELBOURNE | X821: 2 | Y821: 16 | Z821: 0 | AA821: 545 | AB821: 1045 | AC821: 52.153110047846887 | AD821: 8
A822: PRESTON | D822: PRINCE | G822: DUNCAN | J822: TOMKIN | M822: WHITE | O822: HENDRIE | Q822: BASSETT
A823: GOALKICKERS
A824: WILLIAMSTOWN | D824: ADDISON 4 | G824: MATTHEWS 2 | K824: JONES | M824: A CALDWELL | P824: REITMAN
A825: PRESTON | D825: PUNCH 2 | G825: WOODS | J825: PANNAM
A827: NORTH MELBOURNE | C827: 0 | D827: 1 | E827: =C827*6+D827 -> 1 | G827: 2 | H827: 5 | I827: =G827*6+H827 -> 17 | K827: 4 | L827: 8 | M827: =K827*6+L827 -> 32 | O827: 4 | P827: 9 | Q827: =O827*6+P827 -> 33 | S827: NORTH MELB
A828: FOOTSCRAY | C828: 3 | D828: 1 | E828: =C828*6+D828 -> 19 | G828: 4 | H828: 1 | I828: =G828*6+H828 -> 25 | K828: 4 | L828: 1 | M828: =K828*6+L828 -> 25 | O828: 5 | P828: 2 | Q828: =O828*6+P828 -> 32 | S828: KENDALL
A829: BEST PLAYERS
A830: NORTH MELBOURNE | D830: MORAN | G830: JOHNSON | J830: GIBNEY | M830: LAVER | O830: O'SHEA | R830: MARCHBANK
A831: FOOTSCRAY | D831: T SEVIOR | G831: HANSEN | J831: RYAN | M831: COTTON | O831: O'CONNELL | R831: DE CHENE
A832: GOALKICKERS
A833: NORTH MELBOURNE | D833: MORAN 4
A834: FOOTSCRAY | D834: COTTON 2 | G834: BORTHWICK | J834: O'CONNELL | M834: DE CHENE
A836: BRIGHTON | C836: 0 | D836: 3 | E836: =C836*6+D836 -> 3 | G836: 1 | H836: 8 | I836: =G836*6+H836 -> 14 | K836: 3 | L836: 8 | M836: =K836*6+L836 -> 26 | O836: 8 | P836: 10 | Q836: =O836*6+P836 -> 58 | S836: CROXTON PK
A837: NORTHCOTE | C837: 0 | D837: 1 | E837: =C837*6+D837 -> 1 | G837: 1 | H837: 2 | I837: =G837*6+H837 -> 8 | K837: 3 | L837: 5 | M837: =K837*6+L837 -> 23 | O837: 4 | P837: 8 | Q837: =O837*6+P837 -> 32 | S837: ALLEY
A838: BEST PLAYERS
A839: BRIGHTON | D839: HARDIMAN | G839: KENNEDY | J839: A LAXTON | M839: H LAXTON | P839: GORMAN | S839: GILBERT
A840: NORTHCOTE | D840: COLE | G840: BECK | J840: PRATT | M840: FAIRBANK | P840: CHESSWASS | S840: PETTIT
A841: GOALKICKERS
A842: BRIGHTON | D842: HARDIMAN 4 | H842: RYAN 2 | K842: SLOSS | M842: RENNOLDS
A843: NORTHCOTE | D843: FLYNN 2 | G843: REARDON | J843: WALKER
A845: ESSENDON ASSOC. | C845: 2 | D845: 0 | E845: =C845*6+D845 -> 12 | G845: 4 | H845: 4 | I845: =G845*6+H845 -> 28 | K845: 6 | L845: 10 | M845: =K845*6+L845 -> 46 | O845: 7 | P845: 13 | Q845: =O845*6+P845 -> 55 | S845: PORT MELB
A846: PORT MELBOURNE | C846: 2 | D846: 2 | E846: =C846*6+D846 -> 14 | G846: 3 | H846: 2 | I846: =G846*6+H846 -> 20 | K846: 3 | L846: 2 | M846: =K846*6+L846 -> 20 | O846: 5 | P846: 2 | Q846: =O846*6+P846 -> 32 | S846: GREGORY
A847: BEST PLAYERS
A848: ESSENDON ASSOC. | D848: BENNETT | G848: W PAIN | J848: DYSON | M848: MAINE | P848: MADDEN | S848: GIBSON
A849: PORT MELBOURNE | D849: ANDERSON | G849: JACKSON | J849: McCANN | M849: RANKIN | P849: ROBERTS | S849: McKAY
A850: GOALKICKERS
A851: ESSENDON ASSOC. | D851: DYSON 4 | G851: ABBOTT 2 | J851: McNAMARA
A852: PORT MELBOURNE | D852: TREGLOWN 2 | G852: McCANN | J852: BROWN | L852: EICHORN
A854: FINALS
A855: 1ST SEMI | E855: 4TH SEPTEMBER | K855: WEATHER | O855: FINE
D856: 1ST QTR | H856: 2ND QTR | L856: 3RD QTR | P856: FINAL
A857: BRUNSWICK | C857: 2 | D857: 1 | E857: =C857*6+D857 -> 13 | G857: 4 | H857: 1 | I857: =G857*6+H857 -> 25 | K857: 5 | L857: 3 | M857: =K857*6+L857 -> 33 | O857: 8 | P857: 6 | Q857: =O857*6+P857 -> 54 | S857: M.C.G.
A858: PRAHRAN | C858: 1 | D858: 1 | E858: =C858*6+D858 -> 7 | G858: 4 | H858: 5 | I858: =G858*6+H858 -> 29 | K858: 4 | L858: 6 | M858: =K858*6+L858 -> 30 | O858: 5 | P858: 6 | Q858: =O858*6+P858 -> 36 | S858: KENDALL
A859: BEST PLAYERS
A860: BRUNSWICK | D860: McKENZIE | G860: STANCLIFFE | K860: HEAPHY | N860: O'SHEA | Q860: TURNBULL | T860: CHASE
A861: PRAHRAN | D861: WOODS | G861: WRIGHT | K861: CARLSON | N861: CONQUEST | Q861: PANNAM | T861: WHITE
A862: GOALKICKERS
A863: BRUNSWICK | D863: H BRAID 2 | G863: HEAPHY 2 | J863: EVERETT | L863: FULLARTON | O863: CHASE | Q863: STANCLIFFE
A864: PRAHRAN | D864: WHITE | G864: SYKES | J864: CONQUEST | L864: H FARMER | O864: WOODS
A866: 2ND SEMI | E866: 11TH SEPTEMBER | K866: WEATHER | M866: NORTH WIND FINE & SUNNY
A867: ESSENDON ASSOC. | C867: 1 | D867: 2 | E867: =C867*6+D867 -> 8 | G867: 5 | H867: 7 | I867: =G867*6+H867 -> 37 | K867: 5 | L867: 11 | M867: =K867*6+L867 -> 41 | O867: 11 | P867: 13 | Q867: =O867*6+P867 -> 79 | S867: NORTH MELB
A868: FOOTSCRAY | C868: 2 | D868: 3 | E868: =C868*6+D868 -> 15 | G868: 2 | H868: 3 | I868: =G868*6+H868 -> 15 | K868: 4 | L868: 5 | M868: =K868*6+L868 -> 29 | O868: 5 | P868: 7 | Q868: =O868*6+P868 -> 37 | S868: KENDALL
A869: BEST PLAYERS
A870: ESSENDON ASSOC. | D870: HOARE | G870: BENNETT | J870: GOUGH | M870: GRANT | P870: MADDEN | S870: W PAIN
A871: FOOTSCRAY | D871: T SEVIOR | G871: HARRIS | J871: CLARKE | M871: COTTON | P871: W McCARTHY | S871: BORTHWICK
A872: GOALKICKERS
A873: ESSENDON ASSOC. | D873: ABBOTT 4 | G873: ATKINS 2 | J873: GOUGH | L873: BOWE | N873: DYSON | P873: McNAMARA | S873: MADDEN
A874: FOOTSCRAY | D874: W McCARTHY 4 | H874: DUANE
A876: FINAL | C876: 18TH SEPTEMBER | K876: WEATHER | M876: SOUTH WEST WIND
A877: BRUNSWICK | C877: 2 | D877: 4 | E877: =C877*6+D877 -> 16 | G877: 3 | H877: 10 | I877: =G877*6+H877 -> 28 | K877: 6 | L877: 11 | M877: =K877*6+L877 -> 47 | O877: 7 | P877: 12 | Q877: =O877*6+P877 -> 54 | S877: NORTH MELB
A878: ESSENDON ASSOC. | C878: 1 | D878: 0 | E878: =C878*6+D878 -> 6 | G878: 3 | H878: 3 | I878: =G878*6+H878 -> 21 | K878: 3 | L878: 4 | M878: =K878*6+L878 -> 22 | O878: 6 | P878: 8 | Q878: =O878*6+P878 -> 44 | S878: KENDALL
A879: BEST PLAYERS
A880: BRUNSWICK | D880: STANCLIFFE | H880: CHASE | J880: TURNBULL | M880: MARSH | P880: DUNSTAN | R880: H BRAID
A881: ESSENDON ASSOC. | D881: MADDEN | H881: MAINE | J881: RENWICK | M881: McNAMARA | P881: HOARE | R881: McINTYRE
A882: GOALKICKERS
A883: BRUNSWICK | D883: CHASE 4 | G883: DUNSTAN 2 | K883: H BRAID
A884: ESSENDON ASSOC. | D884: GOUGH 2 | G884: BENNETT | J884: HOARE | L884: MONAGLE | N884: ABBOTT
A886: GRAND FINAL | E886: 25TH SEPTEMBER | K886: WEATHER | O886: SOUTH WEST WIND
A887: BRUNSWICK | C887: 0 | D887: 1 | E887: 1 | G887: 3 | H887: 7 | I887: 25 | K887: 5 | L887: 10 | M887: 40 | O887: 10 | P887: 12 | Q887: =O887*6+P887 -> 72 | S887: NORTH MELB
A888: PRAHRAN | C888: 4 | D888: 2 | E888: 26 | G888: 6 | H888: 4 | I888: 40 | K888: 8 | L888: 4 | M888: 52 | O888: 8 | P888: 7 | Q888: =O888*6+P888 -> 55 | S888: KENDALL
A889: BEST PLAYERS
A890: BRUNSWICK | D890: JOHNSON | H890: STANCLIFFE | K890: O'SHEA | N890: THOMPSON | Q890: LEEDS | T890: MILLS
A891: PRAHRAN | D891: WOODS | H891: CONQUEST | K891: DOWDING | N891: DOWSING | Q891: HALL | T891: WHITE
A892: GOALKICKERS
A893: BRUNSWICK | D893: MARSH 2 | G893: O'SHEA 2 | J893: H BRAID 2 | M893: EVERETT | O893: HEAPHY | Q893: STANCLIFFE | U893: CHASE
A894: PRAHRAN | D894: H FARMER 3 | H894: WHITE 2 | K894: HALL | M894: WILSON | O894: SYKES
A896: REPRESENTATIVE GAME | F896: 19TH JUNE | J896: WEATHER | M896: RAIN BEFORE MATCH GROUND WET
A897: S.A | C897: 3 | D897: 3 | E897: =C897*6+D897 -> 21 | G897: 4 | H897: 4 | I897: =G897*6+H897 -> 28 | K897: 5 | L897: 8 | M897: =K897*6+L897 -> 38 | O897: 7 | P897: 8 | Q897: =O897*6+P897 -> 50 | T897: ADEL
A898: V.F.A | C898: 2 | D898: 1 | E898: =C898*6+D898 -> 13 | G898: 6 | H898: 3 | I898: =G898*6+H898 -> 39 | K898: 6 | L898: 3 | M898: =K898*6+L898 -> 39 | O898: 4 | P898: 7 | Q898: =O898*6+P898 -> 31 | T898: KNEEBONE
A899: BEST PLAYERS
A900: S.A | D900: TREDREA | G900: McCARTHY | K900: JOHNS | N900: CUMBERLAND | Q900: LEAHY | S900: HILL
A901: V.F.A | D901: HARDY | G901: McKENZIE | K901: W PAIN | N901: HENDRIE | Q901: SEVIOR | S901: RENNOLDS
A902: GOALKICKERS
A903: S.A | D903: JOHNS 3 | G903: CUMBERLAND 2 | K903: TREDREA | N903: A RENFREY
A904: V.F.A | D904: HAMBRIDGE 2 | G904: HARDY | J904: O'SHEA
A906: TEAMS
G907: S.A. | R907: V.F.A.
A908: BACKS | D908: DREW | G908: DEMPSTER | J908: MATSON | O908: CARLSON | R908: RENNOLDS | W908: JULIAN
A909: H-BACKS | D909: McKENZIE | G909: B LEAHY | J909: E L RENFREY | O909: SEVIOR | R909: McKENZIE | W909: REITMAN
A910: CENTRES | D910: KLOSE | G910: HEAD | J910: McCARTHY | O910: ANDERSON | R910: CLARKE | W910: PAIN
A911: H-FORWARDS | D911: DICKSON | G911: L HILL | J911: TREDREA | O911: O'SHEA | R911: SLOSS | W911: JOHNSON
A912: FORWARDS | D912: T LEAHY | G912: JOHNS | J912: A RENFREY | O912: BECK | R912: HAMBRIDGE | W912: HARDY
A913: RUCKS | D913: CUMBERLAND | G913: DUNNE | J913: McGLAVISH | O913: HENDRIE | R913: ALLEY | W913: TOMKINS
F915: 7TH AUGUST | J915: WEATHER | L915: NORTH WIND FINE SUNNY
A916: V.F.A | C916: 2 | D916: 1 | E916: =C916*6+D916 -> 13 | G916: 6 | H916: 3 | I916: =G916*6+H916 -> 39 | K916: 6 | L916: 3 | M916: =K916*6+L916 -> 39 | O916: 9 | P916: 11 | Q916: =O916*6+P916 -> 65 | T916: NORTH MELB
A917: S.A | C917: 3 | D917: 3 | E917: =C917*6+D917 -> 21 | G917: 4 | H917: 4 | I917: =G917*6+H917 -> 28 | K917: 5 | L917: 8 | M917: =K917*6+L917 -> 38 | O917: 5 | P917: 8 | Q917: =O917*6+P917 -> 38 | T917: KENDALL
A918: BEST PLAYERS
A919: V.F.A | D919: COTTON | G919: WOODS | J919: W PAIN | M919: SEVIOR | P919: MADDEN | S919: McKENZIE
A920: S.A | D920: MATSON | G920: McKENZIE | J920: RENFREY | M920: JOHNS | P920: WALLACE | S920: McGARRISH
A921: GOALKICKERS
A922: V.F.A | D922: COTTON 2 | G922: McKENZIE 2 | K922: SYKES 2 | N922: BECK | P922: BORTHWICK | S922: CHASE
A923: S.A | D923: JOHNS 4 | G923: TREDREA
A925: TEAMS
G926: S.A. | R926: V.F.A.
A927: BACKS | D927: McGLAVISH | G927: DEMPSTER | J927: SUGG | O927: WOODS | R927: RENNOLDS | W927: REITMAN
A928: H-BACKS | D928: E L RENFREY | G928: B LEAHY | J928: MATSON | O928: STEWART | R928: MADDEN | W928: SEVIOR
A929: CENTRES | D929: KLOSE | G929: HEAD | J929: McCARTHY | O929: BORTHWICK | R929: DOWSING | W929: PAIN
A930: H-FORWARDS | D930: DICKSON | G930: TREDREA | J930: DALY | O930: CHASE | R930: McKENZIE | W930: ANDERSON
A931: FORWARDS | D931: T LEAHY | G931: JOHNS | J931: WALLACE | O931: BECK | R931: SYKES | W931: HARDY
A932: RUCKS | D932: CUMBERLAND | G932: GEDDES | J932: McKENZIE | O932: STANCLIFFE | R932: BENNETT | W932: COTTON