A1: Victorian Football Association
A2: Season 1910
A3: © Copyright Wal Williams | F3: First created: 2 August 2014
A4: Contact: joywalwi at gmail dot com | F4: Last updated: 2 August 2014 | W4: VFA Results and tables - Link to the main index page
A5: You are free to copy this document in whole or part provided that proper acknowledgement is given to the author. All rights reserved.
A7: YEAR 1910 | X7: LADDER | AB7: ROUND | AD7: 1
A8: ROUND 1 | E8: 30TH APRIL | J8: WEATHER | M8: NORTH WIND | S8: PLAYED AT
D9: 1ST QTR | H9: 2ND QTR | L9: 3RD QTR | P9: FINAL | S9: CROXTON PK | W9: TEAM | X9: W | Y9: L | Z9: D | AA9: FOR | AB9: AGST | AC9: % | AD9: PTS
A10: NORTH MELBOURNE | C10: 3 | D10: 3 | E10: =C10*6+D10 -> 21 | G10: 10 | H10: 8 | I10: =G10*6+H10 -> 68 | K10: 10 | L10: 10 | M10: =K10*6+L10 -> 70 | O10: 14 | P10: 13 | Q10: =O10*6+P10 -> 97 | S10: UMPIRE
A11: NORTHCOTE | C11: 0 | D11: 3 | E11: =C11*6+D11 -> 3 | G11: 0 | H11: 3 | I11: =G11*6+H11 -> 3 | K11: 2 | L11: 6 | M11: =K11*6+L11 -> 18 | O11: 4 | P11: 7 | Q11: =O11*6+P11 -> 31 | S11: HOOD | W11: BRIGHTON | X11: 1 | Y11: 0 | Z11: 0 | AA11: 79 | AB11: 21 | AC11: 376.1904761904762 | AD11: 4
A12: BEST PLAYERS | W12: NORTH MELBOURNE | X12: 1 | Y12: 0 | Z12: 0 | AA12: 97 | AB12: 31 | AC12: 312.90322580645159 | AD12: 4
A13: NORTH MELBOURNE | C13: JINKS | F13: GIBNEY | I13: McCANN | L13: LAWSON | N13: HAMMOND | Q13: J JOHNSON | W13: BRUNSWICK | X13: 1 | Y13: 0 | Z13: 0 | AA13: 65 | AB13: 33 | AC13: 196.96969696969697 | AD13: 4
A14: NORTHCOTE | C14: FEATHERSTONE | F14: LUMSDEN | I14: NORWOOD | L14: BECK | N14: REARDON | Q14: HOMEWOOD | W14: PORT MELBOURNE | X14: 1 | Y14: 0 | Z14: 0 | AA14: 70 | AB14: 56 | AC14: 125 | AD14: 4
A15: GOALKICKERS
A16: NORTH MELBOURNE | C16: WILLIAMSON 3 | F16: ELLIOTT 3 | I16: HAMMOND 3 | L16: J JOHNSON 2 | O16: BARKER 2 | Q16: LAWSON | W16: FOOTSCRAY | X16: 1 | Y16: 0 | Z16: 0 | AA16: 28 | AB16: 27 | AC16: 103.70370370370371 | AD16: 4
A17: NORTHCOTE | C17: BECK | F17: REARDON | I17: FEATHERSTONE | L17: HOMEWOOD | W17: ESSENDON ASSOC. | X17: 0 | Y17: 1 | Z17: 0 | AA17: 27 | AB17: 28 | AC17: 96.428571428571431 | AD17: 0
W18: PRAHRAN | X18: 0 | Y18: 1 | Z18: 0 | AA18: 56 | AB18: 70 | AC18: 80 | AD18: 0
A19: BRIGHTON | C19: 3 | D19: 2 | E19: =C19*6+D19 -> 20 | G19: 7 | H19: 6 | I19: =G19*6+H19 -> 48 | K19: 9 | L19: 9 | M19: =K19*6+L19 -> 63 | O19: 11 | P19: 13 | Q19: =O19*6+P19 -> 79 | S19: PRESTON | W19: WILLIAMSTOWN | X19: 0 | Y19: 1 | Z19: 0 | AA19: 33 | AB19: 65 | AC19: 50.769230769230766 | AD19: 0
A20: PRESTON | C20: 2 | D20: 2 | E20: =C20*6+D20 -> 14 | G20: 3 | H20: 3 | I20: =G20*6+H20 -> 21 | K20: 3 | L20: 3 | M20: =K20*6+L20 -> 21 | O20: 3 | P20: 3 | Q20: =O20*6+P20 -> 21 | S20: ALLEY | W20: NORTHCOTE | X20: 0 | Y20: 1 | Z20: 0 | AA20: 31 | AB20: 97 | AC20: 31.958762886597938 | AD20: 0
A21: BEST PLAYERS | W21: PRESTON | X21: 0 | Y21: 1 | Z21: 0 | AA21: 21 | AB21: 79 | AC21: 26.582278481012658 | AD21: 0
A22: BRIGHTON | C22: OAKLEY | F22: G ROBINSON | I22: A LAXTON | L22: SLOSS | N22: HARDIMAN | Q22: KENNEDY
A23: PRESTON | C23: FAWCETT | F23: ENRIGHT | I23: BASSETT | L23: S HALL | N23: HOWES | Q23: W PUNCH
A24: GOALKICKERS
A25: BRIGHTON | C25: HARDIMAN 4 | G25: OAKLEY 3 | J25: G ROBINSON | M25: CUMMING | O25: SLOSS | Q25: KYLIE
A26: PRESTON | C26: WHITE | F26: HOLLIGAN | I26: RANKIN
A28: BRUNSWICK | C28: 0 | D28: 1 | E28: =C28*6+D28 -> 1 | G28: 5 | H28: 3 | I28: =G28*6+H28 -> 33 | K28: 6 | L28: 4 | M28: =K28*6+L28 -> 40 | O28: 9 | P28: 11 | Q28: =O28*6+P28 -> 65 | S28: BRUNSWICK
A29: WILLIAMSTOWN | C29: 2 | D29: 4 | E29: =C29*6+D29 -> 16 | G29: 3 | H29: 4 | I29: =G29*6+H29 -> 22 | K29: 4 | L29: 8 | M29: =K29*6+L29 -> 32 | O29: 4 | P29: 9 | Q29: =O29*6+P29 -> 33 | S29: HUME
A30: BEST PLAYERS
A31: BRUNSWICK | C31: STANCLIFFE | F31: JOHNSON | I31: CHASE | L31: GILLESPIE | O31: L BRAID | R31: MARSH
A32: WILLIAMSTOWN | C32: JOY | F32: HARTSHORN | I32: WEIDNER | L32: McKENZIE | O32: MATTHEWS | R32: BENNETT
A33: GOALKICKERS
A34: BRUNSWICK | C34: CHASE 5 | F34: LAUNDER | I34: THOMSON | L34: MILLS | O34: MARSH
A35: WILLIAMSTOWN | C35: ADDISON 3 | G35: MATTHEWS
A37: PORT MELBOURNE | C37: 4 | D37: 5 | E37: =C37*6+D37 -> 29 | G37: 4 | H37: 5 | I37: =G37*6+H37 -> 29 | K37: 7 | L37: 15 | M37: =K37*6+L37 -> 57 | O37: 9 | P37: 16 | Q37: =O37*6+P37 -> 70 | S37: PORT MELB
A38: PRAHRAN | C38: 0 | D38: 1 | E38: =C38*6+D38 -> 1 | G38: 4 | H38: 4 | I38: =G38*6+H38 -> 28 | K38: 5 | L38: 4 | M38: =K38*6+L38 -> 34 | O38: 8 | P38: 8 | Q38: =O38*6+P38 -> 56 | S38: HURLEY
A39: BEST PLAYERS
A40: PORT MELBOURNE | C40: ANDERSON | G40: DANKS | J40: McDONALD | M40: HILL | O40: TREGLOWN | R40: PAMPERIN
A41: PRAHRAN | C41: H WILSON | G41: WOODS | J41: CARLSON | M41: DARBY | O41: BECK | R41: MORONEY
A42: GOALKICKERS
A43: PORT MELBOURNE | C43: TREGLOWN 2 | G43: HUTCHINSON 2 | J43: PAMPERIN | M43: DANKS | O43: BROWN | Q43: KNOX | S43: MURDOCH
A44: PRAHRAN | C44: HALL 2 | F44: SYKES 2 | I44: H WILSON | K44: DOWSING | N44: WOODS | P44: DOWDING
A46: FOOTSCRAY | C46: 1 | D46: 2 | E46: =C46*6+D46 -> 8 | G46: 1 | H46: 2 | I46: =G46*6+H46 -> 8 | K46: 4 | L46: 4 | M46: =K46*6+L46 -> 28 | O46: 4 | P46: 4 | Q46: =O46*6+P46 -> 28 | S46: FOOTSCRAY
A47: ESSENDON ASSOC. | C47: 0 | D47: 0 | E47: =C47*6+D47 -> 0 | G47: 2 | H47: 4 | I47: =G47*6+H47 -> 16 | K47: 2 | L47: 5 | M47: =K47*6+L47 -> 17 | O47: 3 | P47: 9 | Q47: =O47*6+P47 -> 27 | S47: KENDALL
A48: BEST PLAYERS
A49: FOOTSCRAY | C49: HARRIS | F49: NASH | I49: COTTON | L49: CAVE | O49: G STEWART | R49: A GREGORY
A50: ESSENDON ASSOC. | C50: McNAMARA | F50: F ABBOTT | I50: MAINE | L50: ATKINS | O50: MADDEN | R50: TILSON
A51: GOALKICKERS
A52: FOOTSCRAY | C52: A GREGORY 2 | G52: KNIGHT 2
A53: ESSENDON ASSOC. | C53: F ABBOTT | F53: McNAMARA | I53: HOARE
A55: ROUND 2 | E55: 14TH MAY | J55: WEATHER | M55: FINE | S55: PLAYED AT | X55: LADDER | AB55: ROUND | AD55: 2
D56: 1ST QTR | H56: 2ND QTR | L56: 3RD QTR | P56: FINAL | S56: NORTH MELB
A57: NORTH MELBOURNE | C57: 2 | D57: 1 | E57: =C57*6+D57 -> 13 | G57: 5 | H57: 4 | I57: =G57*6+H57 -> 34 | K57: 6 | L57: 4 | M57: =K57*6+L57 -> 40 | O57: 9 | P57: 5 | Q57: =O57*6+P57 -> 59 | S57: UMPIRE | W57: TEAM | X57: W | Y57: L | Z57: D | AA57: FOR | AB57: AGST | AC57: % | AD57: PTS
A58: FOOTSCRAY | C58: 1 | D58: 3 | E58: =C58*6+D58 -> 9 | G58: 3 | H58: 5 | I58: =G58*6+H58 -> 23 | K58: 5 | L58: 8 | M58: =K58*6+L58 -> 38 | O58: 5 | P58: 12 | Q58: =O58*6+P58 -> 42 | S58: HERBERT
A59: BEST PLAYERS | W59: BRIGHTON | X59: 2 | Y59: 0 | Z59: 0 | AA59: 171 | AB59: 65 | AC59: 263.07692307692309 | AD59: 8
A60: NORTH MELBOURNE | C60: G JOHNSON | F60: J JOHNSON | I60: LAVER | K60: LAWSON | N60: JINKS | Q60: HARDY | W60: NORTH MELBOURNE | X60: 2 | Y60: 0 | Z60: 0 | AA60: 156 | AB60: 73 | AC60: 213.69863013698631 | AD60: 8
A61: FOOTSCRAY | C61: STEWART | F61: CAVE | I61: CROUCH | K61: NASH | N61: KNIGHT | Q61: MITCHELL | W61: PORT MELBOURNE | X61: 2 | Y61: 0 | Z61: 0 | AA61: 133 | AB61: 111 | AC61: 119.81981981981981 | AD61: 8
A62: GOALKICKERS | W62: WILLIAMSTOWN | X62: 1 | Y62: 1 | Z62: 0 | AA62: 155 | AB62: 72 | AC62: 215.27777777777777 | AD62: 4
A63: NORTH MELBOURNE | C63: CAINE 5 | F63: ELLIOTT 3 | J63: HARDY
A64: FOOTSCRAY | C64: KNIGHT 3 | F64: A GREGORY | J64: O'CONNELL | W64: PRAHRAN | X64: 1 | Y64: 1 | Z64: 0 | AA64: 124 | AB64: 104 | AC64: 119.23076923076923 | AD64: 4
W65: BRUNSWICK | X65: 1 | Y65: 1 | Z65: 0 | AA65: 99 | AB65: 101 | AC65: 98.019801980198025 | AD65: 4
A66: PORT MELBOURNE | C66: 3 | D66: 0 | E66: =C66*6+D66 -> 18 | G66: 4 | H66: 4 | I66: =G66*6+H66 -> 28 | K66: 6 | L66: 6 | M66: =K66*6+L66 -> 42 | O66: 9 | P66: 9 | Q66: =O66*6+P66 -> 63 | S66: ESSENDON | W66: FOOTSCRAY | X66: 1 | Y66: 1 | Z66: 0 | AA66: 70 | AB66: 86 | AC66: 81.395348837209298 | AD66: 4
A67: ESSENDON ASSOC. | C67: 2 | D67: 2 | E67: =C67*6+D67 -> 14 | G67: 4 | H67: 8 | I67: =G67*6+H67 -> 32 | K67: 6 | L67: 9 | M67: =K67*6+L67 -> 45 | O67: 7 | P67: 13 | Q67: =O67*6+P67 -> 55 | S67: HURLEY | W67: ESSENDON ASSOC. | X67: 0 | Y67: 2 | Z67: 0 | AA67: 82 | AB67: 91 | AC67: 90.109890109890117 | AD67: 0
A68: BEST PLAYERS | W68: NORTHCOTE | X68: 0 | Y68: 2 | Z68: 0 | AA68: 75 | AB68: 189 | AC68: 39.682539682539684 | AD68: 0
A69: PORT MELBOURNE | C69: ANDERSON | F69: HILL | I69: MURDOCH | L69: McGEE | N69: PAMPERIN | Q69: L BECK | W69: PRESTON | X69: 0 | Y69: 2 | Z69: 0 | AA69: 28 | AB69: 201 | AC69: 13.930348258706468 | AD69: 0
A70: ESSENDON ASSOC. | C70: HOARE | F70: ATKINS | I70: CHAPMAN | L70: GOUGH | N70: McNAMARA | Q70: MADDEN
A71: GOALKICKERS
A72: PORT MELBOURNE | C72: HUTCHINSON 2 | G72: McGEE 2 | J72: HAIGHBLOOM 2 | N72: CLEELAND | Q72: TREGLOWN | T72: KNOX
A73: ESSENDON ASSOC. | C73: McNAMARA 4 | G73: PAIN | J73: HOARE | L73: GORDON
A75: PRAHRAN | C75: 3 | D75: 3 | E75: =C75*6+D75 -> 21 | G75: 7 | H75: 4 | I75: =G75*6+H75 -> 46 | K75: 8 | L75: 5 | M75: =K75*6+L75 -> 53 | O75: 10 | P75: 8 | Q75: =O75*6+P75 -> 68 | S75: TOORAK PARK
A76: BRUNSWICK | C76: 0 | D76: 0 | E76: =C76*6+D76 -> 0 | G76: 2 | H76: 1 | I76: =G76*6+H76 -> 13 | K76: 4 | L76: 2 | M76: =K76*6+L76 -> 26 | O76: 5 | P76: 4 | Q76: =O76*6+P76 -> 34 | S76: KENDALL
A77: BEST PLAYERS
A78: PRAHRAN | C78: WOODS | F78: STEWART | I78: WATTS | L78: PANNAM | O78: NORMAN | R78: KIRSCHNER
A79: BRUNSWICK | C79: GILLESPIE | F79: MILLS | I79: WALKER | L79: CHASE | O79: L BRAID | R79: H BRAID
A80: GOALKICKERS
A81: PRAHRAN | C81: SYKES 4 | F81: STEWART 2 | I81: PANNAM | K81: NORMAN | N81: MARONEY | Q81: DOWDING
A82: BRUNSWICK | C82: THOMSON | F82: LAUNDER | I82: JOHNSON | K82: CHASE | N82: H BRAID
A84: WILLIAMSTOWN | C84: 4 | D84: 6 | E84: =C84*6+D84 -> 30 | G84: 12 | H84: 10 | I84: =G84*6+H84 -> 82 | K84: 16 | L84: 13 | M84: =K84*6+L84 -> 109 | O84: 18 | P84: 14 | Q84: =O84*6+P84 -> 122 | S84: WILLIAMSTOWN
A85: PRESTON | C85: 0 | D85: 0 | E85: =C85*6+D85 -> 0 | G85: 1 | H85: 0 | I85: =G85*6+H85 -> 6 | K85: 1 | L85: 0 | M85: =K85*6+L85 -> 6 | O85: 1 | P85: 1 | Q85: =O85*6+P85 -> 7 | S85: ALLEY
A86: BEST PLAYERS
A87: WILLIAMSTOWN | C87: HARTSHORN | G87: ADDISON | J87: JULIAN | M87: REITMAN | P87: JOY | R87: GIBBONS
A88: PRESTON | C88: W PUNCH | G88: HAMILL | J88: CALLAWAY | M88: ENRIGHT | P88: PATERSON | S88: S HALL
A89: GOALKICKERS
A90: WILLIAMSTOWN | C90: AMY 5 | E90: ADDISON 4 | H90: LEONARD 4 | J90: GIBBONS 2 | M90: ROURKE | O90: HARTSHORN | R90: JOY
A91: PRESTON | C91: L SMITH
A93: BRIGHTON | C93: 2 | D93: 6 | E93: =C93*6+D93 -> 18 | G93: 5 | H93: 8 | I93: =G93*6+H93 -> 38 | K93: 11 | L93: 13 | M93: =K93*6+L93 -> 79 | O93: 13 | P93: 14 | Q93: =O93*6+P93 -> 92 | S93: BRIGHTON
A94: NORTHCOTE | C94: 0 | D94: 3 | E94: =C94*6+D94 -> 3 | G94: 2 | H94: 6 | I94: =G94*6+H94 -> 18 | K94: 2 | L94: 7 | M94: =K94*6+L94 -> 19 | O94: 6 | P94: 8 | Q94: =O94*6+P94 -> 44 | S94: FRENCH
A95: BEST PLAYERS
A96: BRIGHTON | C96: SLOSS | F96: G ROBINSON | J96: B BAILES | M96: E BAILES | P96: KULPA | R96: MASTERS
A97: NORTHCOTE | C97: LUMSDEN | F97: HAUGHTON | J97: BECK | M97: FEATHERSTONE | P97: WALSH | R97: COLES
A98: GOALKICKERS
A99: BRIGHTON | C99: G ROBINSON 3 | F99: KULPA 2 | H99: PLAISTED 2 | K99: BARWICK | N99: SLOSS | P99: RICHARDSON | S99: B BAILES
A100: NORTHCOTE | C100: BECK 2 | F100: COLE | H100: WALKER | K100: REARDON
A102: ROUND 3 | E102: 21ST MAY | J102: WEATHER | M102: FINE | S102: PLAYED AT | X102: LADDER | AB102: ROUND | AD102: 3
D103: 1ST QTR | H103: 2ND QTR | L103: 3RD QTR | P103: FINAL | S103: NORTH MELB
A104: NORTH MELBOURNE | C104: 4 | D104: 1 | E104: =C104*6+D104 -> 25 | G104: 6 | H104: 10 | I104: =G104*6+H104 -> 46 | K104: 9 | L104: 15 | M104: =K104*6+L104 -> 69 | O104: 10 | P104: 16 | Q104: =O104*6+P104 -> 76 | S104: UMPIRE | W104: TEAM | X104: W | Y104: L | Z104: D | AA104: FOR | AB104: AGST | AC104: % | AD104: PTS
A105: PORT MELBOURNE | C105: 1 | D105: 0 | E105: =C105*6+D105 -> 6 | G105: 2 | H105: 1 | I105: =G105*6+H105 -> 13 | K105: 3 | L105: 2 | M105: =K105*6+L105 -> 20 | O105: 3 | P105: 4 | Q105: =O105*6+P105 -> 22 | S105: KENDALL
A106: BEST PLAYERS | W106: NORTH MELBOURNE | X106: 3 | Y106: 0 | Z106: 0 | AA106: 232 | AB106: 95 | AC106: 244.21052631578948 | AD106: 12
A107: NORTH MELBOURNE | C107: HARDY | F107: MCCANN | I107: HOPKINS | L107: CAINE | N107: LAWSON | Q107: SHEA | W107: WILLIAMSTOWN | X107: 2 | Y107: 1 | Z107: 0 | AA107: 212 | AB107: 109 | AC107: 194.49541284403671 | AD107: 8
A108: PORT MELBOURNE | C108: ANDERSON | F108: McKAY | I108: HAIGHBLOOM | L108: PAMPERIN | N108: TREGLOWN | Q108: BROWN | W108: BRIGHTON | X108: 2 | Y108: 1 | Z108: 0 | AA108: 208 | AB108: 122 | AC108: 170.49180327868854 | AD108: 8
A109: GOALKICKERS | W109: PRAHRAN | X109: 2 | Y109: 1 | Z109: 0 | AA109: 176 | AB109: 142 | AC109: 123.94366197183099 | AD109: 8
A110: NORTH MELBOURNE | C110: CAINE 5 | F110: HARDY 2 | I110: ELLIOTT 2 | L110: JINKS
A111: PORT MELBOURNE | C111: KNOX 2 | F111: TREGLOWN | W111: PORT MELBOURNE | X111: 2 | Y111: 1 | Z111: 0 | AA111: 155 | AB111: 187 | AC111: 82.887700534759361 | AD111: 8
W112: ESSENDON ASSOC. | X112: 1 | Y112: 2 | Z112: 0 | AA112: 158 | AB112: 131 | AC112: 120.61068702290076 | AD112: 4
A113: WILLIAMSTOWN | C113: 1 | D113: 6 | E113: =C113*6+D113 -> 12 | G113: 3 | H113: 11 | I113: =G113*6+H113 -> 29 | K113: 5 | L113: 18 | M113: =K113*6+L113 -> 48 | O113: 6 | P113: 21 | Q113: =O113*6+P113 -> 57 | S113: BRIGHTON | W113: BRUNSWICK | X113: 1 | Y113: 2 | Z113: 0 | AA113: 139 | AB113: 177 | AC113: 78.531073446327682 | AD113: 4
A114: BRIGHTON | C114: 0 | D114: 3 | E114: =C114*6+D114 -> 3 | G114: 1 | H114: 4 | I114: =G114*6+H114 -> 10 | K114: 2 | L114: 5 | M114: =K114*6+L114 -> 17 | O114: 5 | P114: 7 | Q114: =O114*6+P114 -> 37 | S114: NORDEN | W114: FOOTSCRAY | X114: 1 | Y114: 2 | Z114: 0 | AA114: 108 | AB114: 138 | AC114: 78.260869565217391 | AD114: 4
A115: BEST PLAYERS | W115: NORTHCOTE | X115: 1 | Y115: 2 | Z115: 0 | AA115: 156 | AB115: 239 | AC115: 65.271966527196653 | AD115: 4
A116: WILLIAMSTOWN | C116: HARTSHORN | F116: McKENZIE | I116: McNEILAGE | L116: WEIDNER | O116: A CALDWELL | R116: JOY | W116: PRESTON | X116: 0 | Y116: 3 | Z116: 0 | AA116: 78 | AB116: 282 | AC116: 27.659574468085108 | AD116: 0
A117: BRIGHTON | C117: PURSE | F117: WENBORN | I117: BRIDGEFORD | L117: W KUSCHERT | O117: MASTERS | R117: A LAXTON
A118: GOALKICKERS
A119: WILLIAMSTOWN | C119: MATTHEWS 2 | G119: AMY | J119: LEONARD | M119: HARTSHORN | P119: BENNION
A120: BRIGHTON | C120: BARWICK 2 | G120: B BAILES 2 | K120: RICHARDSON
A122: PRAHRAN | C122: 0 | D122: 2 | E122: =C122*6+D122 -> 2 | G122: 5 | H122: 7 | I122: =G122*6+H122 -> 37 | K122: 5 | L122: 8 | M122: =K122*6+L122 -> 38 | O122: 7 | P122: 10 | Q122: =O122*6+P122 -> 52 | S122: FOOTSCRAY
A123: FOOTSCRAY | C123: 2 | D123: 1 | E123: =C123*6+D123 -> 13 | G123: 2 | H123: 2 | I123: =G123*6+H123 -> 14 | K123: 4 | L123: 8 | M123: =K123*6+L123 -> 32 | O123: 5 | P123: 8 | Q123: =O123*6+P123 -> 38 | S123: ROWE
A124: BEST PLAYERS
A125: PRAHRAN | C125: STEWART | G125: W WILSON | J125: DARBY | M125: SYKES | P125: TUENBULL | S125: NORMAN
A126: FOOTSCRAY | C126: STEWART | G126: COTTON | J126: WHITE | M126: A GREGORY | P126: HARRIS | S126: GREENWOOD
A127: GOALKICKERS
A128: PRAHRAN | C128: SYKES 2 | F128: STEWART 2 | I128: PANNAM | K128: WATTS | M128: H WILSON
A129: FOOTSCRAY | C129: KNIGHT 3 | F129: MADDEN 2
A131: ESSENDON ASSOC. | C131: 4 | D131: 0 | E131: =C131*6+D131 -> 24 | G131: 6 | H131: 2 | I131: =G131*6+H131 -> 38 | K131: 10 | L131: 6 | M131: =K131*6+L131 -> 66 | O131: 11 | P131: 10 | Q131: =O131*6+P131 -> 76 | S131: BRUNSWICK
A132: BRUNSWICK | C132: 1 | D132: 1 | E132: =C132*6+D132 -> 7 | G132: 2 | H132: 5 | I132: =G132*6+H132 -> 17 | K132: 3 | L132: 6 | M132: =K132*6+L132 -> 24 | O132: 5 | P132: 10 | Q132: =O132*6+P132 -> 40 | S132: ALLEY
A133: BEST PLAYERS
A134: ESSENDON ASSOC. | C134: MADDEN | F134: McNAMARA | I134: HOARE | L134: F ABBOTT | O134: ATKINS | R134: GIBSON
A135: BRUNSWICK | C135: MILLS | F135: L BRAID | I135: MCKENZIE | L135: JOHNSON | O135: THOMSON | R135: STANCLIFFE
A136: GOALKICKERS
A137: ESSENDON ASSOC. | C137: McNAMARA 5 | G137: F ABBOTT 4 | K137: CAMPBELL | N137: C ABBOTT
A138: BRUNSWICK | C138: JOHNSON 3 | G138: CAZALY | J138: CHASE
A140: NORTHCOTE | C140: 2 | D140: 2 | E140: =C140*6+D140 -> 14 | G140: 5 | H140: 5 | I140: =G140*6+H140 -> 35 | K140: 11 | L140: 7 | M140: =K140*6+L140 -> 73 | O140: 12 | P140: 9 | Q140: =O140*6+P140 -> 81 | S140: CROXTON PK
A141: PRESTON | C141: 2 | D141: 0 | E141: =C141*6+D141 -> 12 | G141: 4 | H141: 5 | I141: =G141*6+H141 -> 29 | K141: 5 | L141: 6 | M141: =K141*6+L141 -> 36 | O141: 7 | P141: 8 | Q141: =O141*6+P141 -> 50 | S141: HURLEY
A142: BEST PLAYERS
A143: NORTHCOTE | C143: LUMSDEN | F143: MONOHAN | I143: HAUGHTON | L143: COLE | O143: SALVADO | R143: FEATHERSTONE
A144: PRESTON | C144: BILLINGS | F144: W PUNCH | I144: DUNCAN | L144: S HALL | O144: PATTERSON | R144: WHITE
A145: GOALKICKERS
A146: NORTHCOTE | C146: G WALKER 3 | F146: SALVADO 3 | I146: CHESSWASS 2 | M146: ARBUTHNOT 2 | P146: DAWSON | S146: FEATHERSTONE
A147: PRESTON | C147: L SMITH 3 | F147: WHITE 2 | I147: S HALL | K147: PATTERSON
A149: ROUND 4 | E149: 28TH MAY | J149: WEATHER | M149: STRONG NORTH WIND | S149: PLAYED AT | X149: LADDER | AB149: ROUND | AD149: 4
D150: 1ST QTR | H150: 2ND QTR | L150: 3RD QTR | P150: FINAL | S150: TOORAK PARK
A151: NORTH MELBOURNE | C151: 2 | D151: 4 | E151: =C151*6+D151 -> 16 | G151: 3 | H151: 4 | I151: =G151*6+H151 -> 22 | K151: 5 | L151: 7 | M151: =K151*6+L151 -> 37 | O151: 8 | P151: 8 | Q151: =O151*6+P151 -> 56 | S151: UMPIRE | W151: TEAM | X151: W | Y151: L | Z151: D | AA151: FOR | AB151: AGST | AC151: % | AD151: PTS
A152: PRAHRAN | C152: 0 | D152: 0 | E152: =C152*6+D152 -> 0 | G152: 4 | H152: 7 | I152: =G152*6+H152 -> 31 | K152: 4 | L152: 10 | M152: =K152*6+L152 -> 34 | O152: 6 | P152: 14 | Q152: =O152*6+P152 -> 50 | S152: LANE
A153: BEST PLAYERS | W153: NORTH MELBOURNE | X153: 4 | Y153: 0 | Z153: 0 | AA153: 288 | AB153: 145 | AC153: 198.62068965517241 | AD153: 16
A154: NORTH MELBOURNE | C154: HAMMOND | F154: WILLIAMSON | I154: BARKER | L154: HOPKINS | O154: SPEAKMAN | R154: LAWSON | W154: PORT MELBOURNE | X154: 3 | Y154: 1 | Z154: 0 | AA154: 199 | AB154: 222 | AC154: 89.63963963963964 | AD154: 12
A155: PRAHRAN | C155: STEWART | F155: MARONEY | I155: TURNBULL | L155: H WILSON | O155: DARBY | R155: SYKES | W155: WILLIAMSTOWN | X155: 2 | Y155: 2 | Z155: 0 | AA155: 247 | AB155: 153 | AC155: 161.43790849673204 | AD155: 8
A156: GOALKICKERS | W156: BRIGHTON | X156: 2 | Y156: 2 | Z156: 0 | AA156: 256 | AB156: 180 | AC156: 142.22222222222223 | AD156: 8
A157: NORTH MELBOURNE | C157: WILLIAMSON 2 | G157: ELLIOTT 2 | J157: LAVER 2 | M157: BARKER | O157: CAINE
A158: PRAHRAN | C158: SYKES 4 | G158: FARMER | J158: DOWSING | W158: FOOTSCRAY | X158: 2 | Y158: 2 | Z158: 0 | AA158: 222 | AB158: 174 | AC158: 127.58620689655173 | AD158: 8
W159: ESSENDON ASSOC. | X159: 2 | Y159: 2 | Z159: 0 | AA159: 216 | AB159: 179 | AC159: 120.67039106145252 | AD159: 8
A160: PORT MELBOURNE | C160: 0 | D160: 5 | E160: =C160*6+D160 -> 5 | G160: 0 | H160: 5 | I160: =G160*6+H160 -> 5 | K160: 5 | L160: 5 | M160: =K160*6+L160 -> 35 | O160: 6 | P160: 8 | Q160: =O160*6+P160 -> 44 | S160: PORT MELB | W160: PRAHRAN | X160: 2 | Y160: 2 | Z160: 0 | AA160: 226 | AB160: 198 | AC160: 114.14141414141415 | AD160: 8
A161: WILLIAMSTOWN | C161: 0 | D161: 0 | E161: =C161*6+D161 -> 0 | G161: 4 | H161: 1 | I161: =G161*6+H161 -> 25 | K161: 4 | L161: 3 | M161: =K161*6+L161 -> 27 | O161: 5 | P161: 5 | Q161: =O161*6+P161 -> 35 | S161: HERBERT | W161: BRUNSWICK | X161: 2 | Y161: 2 | Z161: 0 | AA161: 179 | AB161: 198 | AC161: 90.404040404040401 | AD161: 8
A162: BEST PLAYERS | W162: NORTHCOTE | X162: 1 | Y162: 3 | Z162: 0 | AA162: 177 | AB162: 279 | AC162: 63.44086021505376 | AD162: 4
A163: PORT MELBOURNE | C163: ANDERSON | F163: CURTIS | I163: TREGLOWN | L163: HILL | O163: JACKSON | R163: PAMPERIN | W163: PRESTON | X163: 0 | Y163: 4 | Z163: 0 | AA163: 114 | AB163: 396 | AC163: 28.787878787878789 | AD163: 0
A164: WILLIAMSTOWN | C164: McKENZIE | F164: McNEILAGE | I164: HARTSHORN | L164: REITMAN | O164: WEIDNER | R164: LITCHFIELD
A165: GOALKICKERS
A166: PORT MELBOURNE | C166: PASH 2 | F166: CLARKE | I166: ANDERSON | L166: McGEE | N166: HILL
A167: WILLIAMSTOWN | C167: LITCHFIELD 2 | G167: MATTHEWS | J167: GIBBS | L167: AMY
A169: ESSENDON ASSOC. | C169: 4 | D169: 2 | E169: =C169*6+D169 -> 26 | G169: 6 | H169: 4 | I169: =G169*6+H169 -> 40 | K169: 6 | L169: 8 | M169: =K169*6+L169 -> 44 | O169: 7 | P169: 16 | Q169: =O169*6+P169 -> 58 | S169: ESSENDON
A170: BRIGHTON | C170: 1 | D170: 2 | E170: =C170*6+D170 -> 8 | G170: 2 | H170: 7 | I170: =G170*6+H170 -> 19 | K170: 4 | L170: 11 | M170: =K170*6+L170 -> 35 | O170: 6 | P170: 12 | Q170: =O170*6+P170 -> 48 | S170: HOOD
A171: BEST PLAYERS
A172: ESSENDON ASSOC. | C172: MADDEN | F172: HOARE | I172: LEWIS | L172: PAIN | O172: GIBSON | R172: ATKINS
A173: BRIGHTON | C173: PLOWMAN | F173: HARDIMAN | I173: BRIDGEFORD | L173: WENBORN | O173: BACHLI | R173: B BAILES
A174: GOALKICKERS
A175: ESSENDON ASSOC. | C175: F ABBOTT 4 | G175: McCANN 2 | K175: HOARE
A176: BRIGHTON | C176: HARDIMAN 4 | G176: JAMES | J176: BACHLI
A178: BRUNSWICK | C178: 1 | D178: 3 | E178: =C178*6+D178 -> 9 | G178: 2 | H178: 5 | I178: =G178*6+H178 -> 17 | K178: 3 | L178: 9 | M178: =K178*6+L178 -> 27 | O178: 4 | P178: 16 | Q178: =O178*6+P178 -> 40 | S178: BRUNSWICK
A179: NORTHCOTE | C179: 1 | D179: 0 | E179: =C179*6+D179 -> 6 | G179: 2 | H179: 2 | I179: =G179*6+H179 -> 14 | K179: 2 | L179: 3 | M179: =K179*6+L179 -> 15 | O179: 3 | P179: 3 | Q179: =O179*6+P179 -> 21 | S179: KENDALL
A180: BEST PLAYERS
A181: BRUNSWICK | C181: MILLS | F181: McKENZIE | I181: CHASE | L181: STANCLIFFE | O181: STEVENSON | R181: L BRAID
A182: NORTHCOTE | C182: COLE | F182: MORRIS | I182: LANNIGAN | L182: FEATHERSTONE | O182: EARSMAN | R182: MONOHAN
A183: GOALKICKERS
A184: BRUNSWICK | C184: CHASE | F184: CORRIGAN | I184: MILLS | L184: JOHNSON
A185: NORTHCOTE | C185: MORRIS | F185: DAVIDSON
A187: FOOTSCRAY | C187: 6 | D187: 4 | E187: =C187*6+D187 -> 40 | G187: 7 | H187: 10 | I187: =G187*6+H187 -> 52 | K187: 13 | L187: 14 | M187: =K187*6+L187 -> 92 | O187: 16 | P187: 18 | Q187: =O187*6+P187 -> 114 | S187: PRESTON
A188: PRESTON | C188: 0 | D188: 0 | E188: =C188*6+D188 -> 0 | G188: 0 | H188: 4 | I188: =G188*6+H188 -> 4 | K188: 0 | L188: 5 | M188: =K188*6+L188 -> 5 | O188: 5 | P188: 6 | Q188: =O188*6+P188 -> 36 | S188: HURLEY
A189: BEST PLAYERS
A190: FOOTSCRAY | C190: NASH | F190: COTTON | I190: DUANE | L190: HANSON | O190: MARMO | R190: A GREGORY
A191: PRESTON | C191: BASSETT | F191: W PUNCH | I191: J STEPHENS | L191: WHITE | O191: ENRIGHT | R191: BROWN
A192: GOALKICKERS
A193: FOOTSCRAY | C193: DUANE 4 | E193: A GREGORY 3 | H193: COTTON 2 | J193: MADDEN 2 | M193: CLARKE 2 | O193: KNIGHT 2 | Q193: NASH
A194: PRESTON | C194: L SMITH 3 | F194: MOORE 2
A196: ROUND 5 | E196: 4TH JUNE | J196: WEATHER | M196: SOUTH WEST WIND | S196: PLAYED AT | X196: LADDER | AB196: ROUND | AD196: 5
D197: 1ST QTR | H197: 2ND QTR | L197: 3RD QTR | P197: FINAL | S197: FOOTSCRAY
A198: BRUNSWICK | C198: 4 | D198: 4 | E198: =C198*6+D198 -> 28 | G198: 4 | H198: 5 | I198: =G198*6+H198 -> 29 | K198: 6 | L198: 7 | M198: =K198*6+L198 -> 43 | O198: 8 | P198: 8 | Q198: =O198*6+P198 -> 56 | S198: UMPIRE | W198: TEAM | X198: W | Y198: L | Z198: D | AA198: FOR | AB198: AGST | AC198: % | AD198: PTS
A199: FOOTSCRAY | C199: 0 | D199: 1 | E199: =C199*6+D199 -> 1 | G199: 4 | H199: 4 | I199: =G199*6+H199 -> 28 | K199: 5 | L199: 4 | M199: =K199*6+L199 -> 34 | O199: 6 | P199: 9 | Q199: =O199*6+P199 -> 45 | S199: ALLEY
A200: BEST PLAYERS | W200: NORTH MELBOURNE | X200: 5 | Y200: 0 | Z200: 0 | AA200: 351 | AB200: 162 | AC200: 216.66666666666666 | AD200: 20
A201: BRUNSWICK | C201: MCKENZIE | F201: CHASE | I201: L BRAID | K201: GILLESPIE | N201: JOHNSON | Q201: STANCLIFFE | W201: PORT MELBOURNE | X201: 4 | Y201: 1 | Z201: 0 | AA201: 253 | AB201: 263 | AC201: 96.197718631178702 | AD201: 16
A202: FOOTSCRAY | C202: COTTON | F202: KNIGHT | I202: STEWART | K202: HANSON | N202: WHITE | Q202: SPENCE | W202: WILLIAMSTOWN | X202: 3 | Y202: 2 | Z202: 0 | AA202: 303 | AB202: 183 | AC202: 165.57377049180329 | AD202: 12
A203: GOALKICKERS | W203: ESSENDON ASSOC. | X203: 3 | Y203: 2 | Z203: 0 | AA203: 285 | AB203: 192 | AC203: 148.4375 | AD203: 12
A204: BRUNSWICK | C204: McKENZIE 3 | G204: H BRAID 2 | J204: MILLS | L204: PRICE | N204: CHASE
A205: FOOTSCRAY | C205: KNIGHT 3 | F205: MADDEN | I205: A GREGORY | L205: NASH | W205: BRUNSWICK | X205: 3 | Y205: 2 | Z205: 0 | AA205: 235 | AB205: 243 | AC205: 96.707818930041157 | AD205: 12
W206: FOOTSCRAY | X206: 2 | Y206: 3 | Z206: 0 | AA206: 267 | AB206: 230 | AC206: 116.08695652173913 | AD206: 8
A207: NORTH MELBOURNE | C207: 4 | D207: 8 | E207: =C207*6+D207 -> 32 | G207: 4 | H207: 9 | I207: =G207*6+H207 -> 33 | K207: 6 | L207: 12 | M207: =K207*6+L207 -> 48 | O207: 8 | P207: 15 | Q207: =O207*6+P207 -> 63 | S207: NORTH MELB | W207: BRIGHTON | X207: 2 | Y207: 3 | Z207: 0 | AA207: 273 | AB207: 243 | AC207: 112.34567901234568 | AD207: 8
A208: BRIGHTON | C208: 0 | D208: 0 | E208: =C208*6+D208 -> 0 | G208: 1 | H208: 4 | I208: =G208*6+H208 -> 10 | K208: 1 | L208: 5 | M208: =K208*6+L208 -> 11 | O208: 2 | P208: 5 | Q208: =O208*6+P208 -> 17 | S208: HURLEY | W208: PRAHRAN | X208: 2 | Y208: 3 | Z208: 0 | AA208: 256 | AB208: 254 | AC208: 100.78740157480316 | AD208: 8
A209: BEST PLAYERS | W209: NORTHCOTE | X209: 1 | Y209: 4 | Z209: 0 | AA209: 218 | AB209: 333 | AC209: 65.465465465465471 | AD209: 4
A210: NORTH MELBOURNE | C210: HARDY | F210: WILLIAMSON | I210: HOPKINS | K210: CAINE | N210: HAMMOND | Q210: LONDERIGAN | W210: PRESTON | X210: 0 | Y210: 5 | Z210: 0 | AA210: 127 | AB210: 465 | AC210: 27.311827956989248 | AD210: 0
A211: BRIGHTON | C211: WENBORN | F211: W KUSCHERT | I211: MANN | K211: A LAXTON | N211: FEEHAN | Q211: PURSE
A212: GOALKICKERS
A213: NORTH MELBOURNE | C213: ELLIOTT 5 | G213: CAINE 2 | J213: LAVER
A214: BRIGHTON | C214: RICHARDSON | G214: MANN
A216: WILLIAMSTOWN | C216: 2 | D216: 2 | E216: =C216*6+D216 -> 14 | G216: 3 | H216: 3 | I216: =G216*6+H216 -> 21 | K216: 6 | L216: 5 | M216: =K216*6+L216 -> 41 | O216: 8 | P216: 8 | Q216: =O216*6+P216 -> 56 | S216: WILLIAMSTOWN
A217: PRAHRAN | C217: 0 | D217: 2 | E217: =C217*6+D217 -> 2 | G217: 1 | H217: 3 | I217: =G217*6+H217 -> 9 | K217: 2 | L217: 3 | M217: =K217*6+L217 -> 15 | O217: 4 | P217: 6 | Q217: =O217*6+P217 -> 30 | S217: HOOD
A218: BEST PLAYERS
A219: WILLIAMSTOWN | C219: GIBBS | F219: McKENZIE | J219: REITMAN | M219: JOY | P219: McNEILAGE | S219: AMY
A220: PRAHRAN | C220: WOODS | F220: MARONEY | J220: CARLSON | M220: FARMER | P220: TURNBULL | S220: SYKES
A221: GOALKICKERS
A222: WILLIAMSTOWN | C222: AMY 3 | F222: MATTHEWS 3 | J222: LEONARD 2
A223: PRAHRAN | C223: STEWART 2 | G223: SYKES | J223: FARMER
A225: ESSENDON ASSOC. | C225: 0 | D225: 3 | E225: =C225*6+D225 -> 3 | G225: 3 | H225: 6 | I225: =G225*6+H225 -> 24 | K225: 4 | L225: 10 | M225: =K225*6+L225 -> 34 | O225: 9 | P225: 15 | Q225: =O225*6+P225 -> 69 | S225: ESSENDON
A226: PRESTON | C226: 0 | D226: 0 | E226: =C226*6+D226 -> 0 | G226: 0 | H226: 0 | I226: =G226*6+H226 -> 0 | K226: 2 | L226: 1 | M226: =K226*6+L226 -> 13 | O226: 2 | P226: 1 | Q226: =O226*6+P226 -> 13 | S226: HUME
A227: BEST PLAYERS
A228: ESSENDON ASSOC. | C228: PAIN | F228: MAINE | I228: LEWIS | K228: ATKINS | N228: CHAPMAN | Q228: MADDEN
A229: PRESTON | C229: ENRIGHT | F229: W PUNCH | I229: J STEPHENS | L229: DUNCAN | N229: BASSETT | Q229: BILLINGS
A230: GOALKICKERS
A231: ESSENDON ASSOC. | C231: HOARE 2 | F231: F ABBOTT 2 | I231: HAMBRIDGE 2 | L231: GIBSON | N231: WHITTLE | P231: CHAPMAN
A232: PRESTON | C232: PATTERSON | G232: BASSETT
A234: PORT MELBOURNE | C234: 4 | D234: 3 | E234: =C234*6+D234 -> 27 | G234: 5 | H234: 5 | I234: =G234*6+H234 -> 35 | K234: 5 | L234: 9 | M234: =K234*6+L234 -> 39 | O234: 7 | P234: 12 | Q234: =O234*6+P234 -> 54 | S234: CROXTON PK
A235: NORTHCOTE | C235: 0 | D235: 2 | E235: =C235*6+D235 -> 2 | G235: 2 | H235: 5 | I235: =G235*6+H235 -> 17 | K235: 4 | L235: 8 | M235: =K235*6+L235 -> 32 | O235: 5 | P235: 11 | Q235: =O235*6+P235 -> 41 | S235: KENDALL
A236: BEST PLAYERS
A237: PORT MELBOURNE | C237: ANDERSON | F237: HAIGHBLOOM | J237: CURTIS | M237: McGEE | O237: HARPER | R237: TREGLOWN
A238: NORTHCOTE | C238: BECK | F238: COLE | J238: HAUGHTON | M238: MORRIS | O238: CHESSWASS | R238: FEATHERSTONE
A239: GOALKICKERS
A240: PORT MELBOURNE | C240: HAIGHBLOOM 3 | G240: ST JOHN 2 | K240: McNAUGHT | N240: JACKSON
A241: NORTHCOTE | C241: FEATHERSTONE 2 | H241: CHESSWASS | K241: DAVIDSON | N241: FREEMAN
A243: ROUND 6 | E243: 6TH JUNE | I243: KINGS BIRTHDAY | M243: WEATHER | P243: NORTH BREEZE | S243: PLAYED AT | X243: LADDER | AB243: ROUND | AD243: 6
D244: 1ST QTR | H244: 2ND QTR | L244: 3RD QTR | P244: FINAL | S244: WILLIAMSTOWN
A245: NORTH MELBOURNE | C245: 2 | D245: 4 | E245: =C245*6+D245 -> 16 | G245: 4 | H245: 5 | I245: =G245*6+H245 -> 29 | K245: 7 | L245: 13 | M245: =K245*6+L245 -> 55 | O245: 8 | P245: 15 | Q245: =O245*6+P245 -> 63 | S245: UMPIRE | W245: TEAM | X245: W | Y245: L | Z245: D | AA245: FOR | AB245: AGST | AC245: % | AD245: PTS
A246: WILLIAMSTOWN | C246: 2 | D246: 1 | E246: =C246*6+D246 -> 13 | G246: 5 | H246: 8 | I246: =G246*6+H246 -> 38 | K246: 5 | L246: 9 | M246: =K246*6+L246 -> 39 | O246: 8 | P246: 14 | Q246: =O246*6+P246 -> 62 | S246: ALLEY
A247: BEST PLAYERS | W247: NORTH MELBOURNE | X247: 6 | Y247: 0 | Z247: 0 | AA247: 414 | AB247: 224 | AC247: 184.82142857142858 | AD247: 24
A248: NORTH MELBOURNE | C248: HAMMOND | F248: GIBNEY | I248: LAVER | L248: JINKS | O248: HARDY | Q248: BARKER | W248: PORT MELBOURNE | X248: 5 | Y248: 1 | Z248: 0 | AA248: 335 | AB248: 312 | AC248: 107.37179487179488 | AD248: 20
A249: WILLIAMSTOWN | C249: REITMAN | F249: WEIDNER | I249: McKENZIE | L249: GIBBS | O249: BENNETT | Q249: ROURKE | W249: ESSENDON ASSOC. | X249: 4 | Y249: 2 | Z249: 0 | AA249: 349 | AB249: 241 | AC249: 144.81327800829877 | AD249: 16
A250: GOALKICKERS | W250: BRUNSWICK | X250: 4 | Y250: 2 | Z250: 0 | AA250: 359 | AB250: 302 | AC250: 118.87417218543047 | AD250: 16
A251: NORTH MELBOURNE | C251: CAINE 4 | F251: HARDY | I251: BARKER | K251: GIBNEY | N251: ELLIOTT
A252: WILLIAMSTOWN | C252: MATTHEWS 2 | G252: GIBBS 2 | I252: AMY 2 | L252: LEONARD | O252: MONAR | W252: WILLIAMSTOWN | X252: 3 | Y252: 3 | Z252: 0 | AA252: 365 | AB252: 246 | AC252: 148.3739837398374 | AD252: 12
W253: FOOTSCRAY | X253: 3 | Y253: 3 | Z253: 0 | AA253: 320 | AB253: 277 | AC253: 115.52346570397111 | AD253: 12
A254: ESSENDON ASSOC. | C254: 3 | D254: 4 | E254: =C254*6+D254 -> 22 | G254: 7 | H254: 8 | I254: =G254*6+H254 -> 50 | K254: 7 | L254: 11 | M254: =K254*6+L254 -> 53 | O254: 8 | P254: 16 | Q254: =O254*6+P254 -> 64 | S254: TOORAK PARK | W254: BRIGHTON | X254: 2 | Y254: 4 | Z254: 0 | AA254: 322 | AB254: 325 | AC254: 99.07692307692308 | AD254: 8
A255: PRAHRAN | C255: 1 | D255: 1 | E255: =C255*6+D255 -> 7 | G255: 5 | H255: 2 | I255: =G255*6+H255 -> 32 | K255: 6 | L255: 6 | M255: =K255*6+L255 -> 42 | O255: 7 | P255: 7 | Q255: =O255*6+P255 -> 49 | S255: HUME | W255: PRAHRAN | X255: 2 | Y255: 4 | Z255: 0 | AA255: 305 | AB255: 318 | AC255: 95.911949685534594 | AD255: 8
A256: BEST PLAYERS | W256: NORTHCOTE | X256: 1 | Y256: 5 | Z256: 0 | AA256: 265 | AB256: 386 | AC256: 68.652849740932638 | AD256: 4
A257: ESSENDON ASSOC. | C257: MADDEN | F257: CHAPMAN | I257: GOUGH | L257: McNAMARA | O257: HAMBRIDGE | R257: GIBSON | W257: PRESTON | X257: 0 | Y257: 6 | Z257: 0 | AA257: 186 | AB257: 589 | AC257: 31.578947368421051 | AD257: 0
A258: PRAHRAN | C258: WOODS | F258: DOWSING | I258: KIRSCHNER | L258: TURNBULL | O258: MARONEY | R258: DOWDING
A259: GOALKICKERS
A260: ESSENDON ASSOC. | C260: CHAPMAN 3 | G260: McCANN | J260: HOARE | L260: HAMBRIDGE | O260: GOUGH | Q260: F ABBOTT
A261: PRAHRAN | C261: DOWDING 3 | G261: FARMER 2 | J261: KIRSCHNER | M261: MARONEY
A263: PORT MELBOURNE | C263: 3 | D263: 3 | E263: =C263*6+D263 -> 21 | G263: 5 | H263: 7 | I263: =G263*6+H263 -> 37 | K263: 8 | L263: 9 | M263: =K263*6+L263 -> 57 | O263: 12 | P263: 10 | Q263: =O263*6+P263 -> 82 | S263: BRIGHTON
A264: BRIGHTON | C264: 1 | D264: 4 | E264: =C264*6+D264 -> 10 | G264: 3 | H264: 8 | I264: =G264*6+H264 -> 26 | K264: 5 | L264: 10 | M264: =K264*6+L264 -> 40 | O264: 6 | P264: 13 | Q264: =O264*6+P264 -> 49 | S264: HURLEY
A265: BEST PLAYERS
A266: PORT MELBOURNE | C266: PASH | F266: FRANKLIN | I266: HAIGHBLOOM | L266: PAMPERIN | O266: McGEE | R266: McDONALD
A267: BRIGHTON | C267: E BAILES | F267: B BAILES | I267: A LAXTON | L267: BRIDGEFORD | O267: DUNCAN | R267: G ROBINSON
A268: GOALKICKERS
A269: PORT MELBOURNE | C269: PASH 3 | E269: HAIGHMAN 2 | H269: HUTCHINSON 2 | K269: McGEE | M269: BROWN | O269: CLARKE | Q269: JACKSON | T269: HILL
A270: BRIGHTON | C270: BACCLI 3 | F270: JONES 2 | I270: FEEHAN
A272: FOOTSCRAY | C272: 1 | D272: 0 | E272: =C272*6+D272 -> 6 | G272: 5 | H272: 6 | I272: =G272*6+H272 -> 36 | K272: 5 | L272: 7 | M272: =K272*6+L272 -> 37 | O272: 7 | P272: 11 | Q272: =O272*6+P272 -> 53 | S272: FOOTSCRAY
A273: NORTHCOTE | C273: 2 | D273: 6 | E273: =C273*6+D273 -> 18 | G273: 2 | H273: 6 | I273: =G273*6+H273 -> 18 | K273: 4 | L273: 8 | M273: =K273*6+L273 -> 32 | O273: 6 | P273: 11 | Q273: =O273*6+P273 -> 47 | S273: KENDALL
A274: BEST PLAYERS
A275: FOOTSCRAY | C275: HANSON | F275: WHITE | I275: OGILVIE | L275: MADDEN | O275: COTTON | R275: W McCARTHY
A276: NORTHCOTE | C276: LUMSDEN | F276: BECK | I276: COLE | L276: DANIELS | O276: HAUGHTON | R276: CHESSWASS
A277: GOALKICKERS
A278: FOOTSCRAY | C278: MADDEN 4 | G278: KNIGHT | J278: A GREGORY | M278: GREENWOOD
A279: NORTHCOTE | C279: DANIELS 2 | G279: THOMSON | J279: HAUGHTON | M279: EARSMAN | P279: ARBUTHNOT
A281: BRUNSWICK | C281: 7 | D281: 8 | E281: =C281*6+D281 -> 50 | G281: 12 | H281: 11 | I281: =G281*6+H281 -> 83 | K281: 16 | L281: 12 | M281: =K281*6+L281 -> 108 | O281: 18 | P281: 16 | Q281: =O281*6+P281 -> 124 | S281: PRESTON
A282: PRESTON | C282: 0 | D282: 0 | E282: =C282*6+D282 -> 0 | G282: 3 | H282: 1 | I282: =G282*6+H282 -> 19 | K282: 6 | L282: 3 | M282: =K282*6+L282 -> 39 | O282: 9 | P282: 5 | Q282: =O282*6+P282 -> 59 | S282: HOOD
A283: BEST PLAYERS
A284: BRUNSWICK | C284: H BRAID | G284: MCKENZIE | J284: GILLESPIE | M284: LEEDS | P284: CHASE | S284: JOHNSON
A285: PRESTON | C285: J STEPHENS | G285: W PUNCH | J285: DUNCAN | M285: ENRIGHT | P285: WHITTLE | S285: BILLINGS
A286: GOALKICKERS
A287: BRUNSWICK | C287: H BRAID 7 | F287: CHASE 3 | I287: MILLS 3 | L287: PRICE 2 | N287: MARSH | P287: GILLESPIE | R287: L BRAID
A288: PRESTON | C288: L SMITH 3 | G288: FAWCETT 2 | J288: J STEPHENS | M288: MOORE | O288: ENRIGHT | R288: PATTERSON
A290: ROUND 7 | E290: 11TH JUNE | J290: WEATHER | M290: FINE | S290: PLAYED AT | X290: LADDER | AB290: ROUND | AD290: 7
D291: 1ST QTR | H291: 2ND QTR | L291: 3RD QTR | P291: FINAL | S291: BRUNSWICK
A292: NORTH MELBOURNE | C292: 2 | D292: 4 | E292: =C292*6+D292 -> 16 | G292: 2 | H292: 7 | I292: =G292*6+H292 -> 19 | K292: 5 | L292: 11 | M292: =K292*6+L292 -> 41 | O292: 7 | P292: 13 | Q292: =O292*6+P292 -> 55 | S292: UMPIRE | W292: TEAM | X292: W | Y292: L | Z292: D | AA292: FOR | AB292: AGST | AC292: % | AD292: PTS
A293: BRUNSWICK | C293: 0 | D293: 0 | E293: =C293*6+D293 -> 0 | G293: 3 | H293: 7 | I293: =G293*6+H293 -> 25 | K293: 3 | L293: 10 | M293: =K293*6+L293 -> 28 | O293: 3 | P293: 14 | Q293: =O293*6+P293 -> 32 | S293: HUME
A294: BEST PLAYERS | W294: NORTH MELBOURNE | X294: 7 | Y294: 0 | Z294: 0 | AA294: 469 | AB294: 256 | AC294: 183.203125 | AD294: 28
A295: NORTH MELBOURNE | C295: HOPKINS | F295: HARDY | I295: LAVER | K295: JINKS | M295: GIBSON | P295: McCANN | W295: PORT MELBOURNE | X295: 6 | Y295: 1 | Z295: 0 | AA295: 481 | AB295: 376 | AC295: 127.92553191489361 | AD295: 24
A296: BRUNSWICK | C296: McKENZIE | F296: PEARS | I296: CHASE | K296: J JOHNSON | N296: STEPHENSON | Q296: GILLESPIE | W296: ESSENDON ASSOC. | X296: 5 | Y296: 2 | Z296: 0 | AA296: 439 | AB296: 293 | AC296: 149.82935153583617 | AD296: 20
A297: GOALKICKERS | W297: BRUNSWICK | X297: 4 | Y297: 3 | Z297: 0 | AA297: 391 | AB297: 357 | AC297: 109.52380952380952 | AD297: 16
A298: NORTH MELBOURNE | C298: CAINE 2 | F298: JINKS | H298: HAMMOND | K298: WILLIAMSON | N298: LONDERIGAN | Q298: ELLIOTT
A299: BRUNSWICK | C299: PRICE | F299: J JOHNSON | I299: CHASE | W299: WILLIAMSTOWN | X299: 3 | Y299: 4 | Z299: 0 | AA299: 417 | AB299: 336 | AC299: 124.10714285714286 | AD299: 12
W300: FOOTSCRAY | X300: 3 | Y300: 4 | Z300: 0 | AA300: 370 | AB300: 337 | AC300: 109.79228486646885 | AD300: 12
A301: ESSENDON ASSOC. | C301: 5 | D301: 6 | E301: =C301*6+D301 -> 36 | G301: 8 | H301: 8 | I301: =G301*6+H301 -> 56 | K301: 11 | L301: 11 | M301: =K301*6+L301 -> 77 | O301: 13 | P301: 12 | Q301: =O301*6+P301 -> 90 | S301: ESSENDON | W301: PRAHRAN | X301: 3 | Y301: 4 | Z301: 0 | AA301: 367 | AB301: 358 | AC301: 102.51396648044692 | AD301: 12
A302: WILLIAMSTOWN | C302: 2 | D302: 0 | E302: =C302*6+D302 -> 12 | G302: 5 | H302: 4 | I302: =G302*6+H302 -> 34 | K302: 5 | L302: 5 | M302: =K302*6+L302 -> 35 | O302: 6 | P302: 16 | Q302: =O302*6+P302 -> 52 | S302: ALLEY | W302: BRIGHTON | X302: 3 | Y302: 4 | Z302: 0 | AA302: 382 | AB302: 375 | AC302: 101.86666666666666 | AD302: 12
A303: BEST PLAYERS | W303: NORTHCOTE | X303: 1 | Y303: 6 | Z303: 0 | AA303: 305 | AB303: 448 | AC303: 68.080357142857139 | AD303: 4
A304: ESSENDON ASSOC. | C304: MAINE | F304: PAIN | I304: GOUGH | L304: McNAMARA | O304: F ABBOTT | Q304: HOARE | W304: PRESTON | X304: 0 | Y304: 7 | Z304: 0 | AA304: 250 | AB304: 735 | AC304: 34.013605442176868 | AD304: 0
A305: WILLIAMSTOWN | C305: JOY | F305: GIBBONS | I305: A CALDWELL | L305: AMY | O305: JULIAN | Q305: McKENZIE
A306: GOALKICKERS
A307: ESSENDON ASSOC. | C307: F ABBOTT 4 | G307: HOARE 4 | J307: McNAMARA 2 | M307: McCANN | O307: GOUGH | Q307: HAMBRIDGE
A308: WILLIAMSTOWN | C308: ADDISON 3 | G308: MATTHEWS | J308: GIBBONS | M308: BENNION
A310: BRIGHTON | C310: 0 | D310: 2 | E310: =C310*6+D310 -> 2 | G310: 2 | H310: 5 | I310: =G310*6+H310 -> 17 | K310: 5 | L310: 11 | M310: =K310*6+L310 -> 41 | O310: 8 | P310: 12 | Q310: =O310*6+P310 -> 60 | S310: BRIGHTON
A311: FOOTSCRAY | C311: 1 | D311: 2 | E311: =C311*6+D311 -> 8 | G311: 5 | H311: 6 | I311: =G311*6+H311 -> 36 | K311: 6 | L311: 9 | M311: =K311*6+L311 -> 45 | O311: 6 | P311: 14 | Q311: =O311*6+P311 -> 50 | S311: KENDALL
A312: BEST PLAYERS
A313: BRIGHTON | C313: B BAILES | F313: W KUSCHERT | I313: A LAXTON | L313: PURSE | O313: RICHARDSON | S313: WENBORN
A314: FOOTSCRAY | C314: OGILVIE | F314: WHITE | I314: W McCARTHY | L314: HANSON | O314: LAMPRELL | S314: NASH
A315: GOALKICKERS
A316: BRIGHTON | C316: SLOSS 4 | F316: M KUSCHERT 2 | J316: HARDIMAN | M316: KENNEDY
A317: FOOTSCRAY | C317: LAMPRELL 2 | G317: KNIGHT 2 | J317: DUANE | L317: STEWART
A319: PRAHRAN | C319: 3 | D319: 3 | E319: =C319*6+D319 -> 21 | G319: 4 | H319: 4 | I319: =G319*6+H319 -> 28 | K319: 7 | L319: 6 | M319: =K319*6+L319 -> 48 | O319: 9 | P319: 8 | Q319: =O319*6+P319 -> 62 | S319: CROXTON PK
A320: NORTHCOTE | C320: 1 | D320: 2 | E320: =C320*6+D320 -> 8 | G320: 2 | H320: 2 | I320: =G320*6+H320 -> 14 | K320: 3 | L320: 3 | M320: =K320*6+L320 -> 21 | O320: 6 | P320: 4 | Q320: =O320*6+P320 -> 40 | S320: HURLEY
A321: BEST PLAYERS
A322: PRAHRAN | C322: DOWSING | F322: CROMIE | I322: STEWART | L322: SYKES | O322: DOWDING | R322: DARBY
A323: NORTHCOTE | C323: BECK | F323: MONOHAN | I323: COLE | L323: FEATHERSTONE
A324: GOALKICKERS
A325: PRAHRAN | C325: SYKES 5 | F325: DOWDING 4
A326: NORTHCOTE | C326: FEATHERSTONE 5 | H326: HAUGHTON
A328: PORT MELBOURNE | C328: 3 | D328: 1 | E328: =C328*6+D328 -> 19 | G328: 11 | H328: 5 | I328: =G328*6+H328 -> 71 | K328: 17 | L328: 7 | M328: =K328*6+L328 -> 109 | O328: 22 | P328: 14 | Q328: =O328*6+P328 -> 146 | S328: PORT MELB
A329: PRESTON | C329: 2 | D329: 1 | E329: =C329*6+D329 -> 13 | G329: 4 | H329: 2 | I329: =G329*6+H329 -> 26 | K329: 9 | L329: 3 | M329: =K329*6+L329 -> 57 | O329: 10 | P329: 4 | Q329: =O329*6+P329 -> 64 | S329: LANE
A330: BEST PLAYERS
A331: PORT MELBOURNE | C331: BROWN | F331: CLEELAND | I331: McGEE | L331: MURRAY | O331: HUTCHINSON | R331: ANDERSON
A332: PRESTON | C332: J STEPHENS | F332: S STEPHENS | I332: HAMILL | L332: BASSETT | O332: WAITE | R332: W PUNCH
A333: GOALKICKERS
A334: PORT MELBOURNE | C334: HUTCHINSON 9 | F334: PASH 3 | H334: CLEELAND 2 | K334: McGEE 2 | M334: HAIGHBLOOM 2 | P334: ANDERSON 2 | S334: JACKSON | W334: McNAUGHT
A335: PRESTON | C335: J STEPHENS 4 | G335: S STEPHENS 2 | J335: ENRIGHT | L335: BASSETT | N335: DUNCAN | P335: V PUNCH
A337: ROUND 8 | E337: 25TH JUNE | J337: WEATHER | M337: NORTH WIND | S337: PLAYED AT | X337: LADDER | AB337: ROUND | AD337: 8
D338: 1ST QTR | H338: 2ND QTR | L338: 3RD QTR | P338: FINAL | S338: PORT MELB
A339: BRUNSWICK | C339: 1 | D339: 1 | E339: =C339*6+D339 -> 7 | G339: 2 | H339: 7 | I339: =G339*6+H339 -> 19 | K339: 4 | L339: 9 | M339: =K339*6+L339 -> 33 | O339: 9 | P339: 13 | Q339: =O339*6+P339 -> 67 | S339: UMPIRE | W339: TEAM | X339: W | Y339: L | Z339: D | AA339: FOR | AB339: AGST | AC339: % | AD339: PTS
A340: PORT MELBOURNE | C340: 4 | D340: 6 | E340: =C340*6+D340 -> 30 | G340: 4 | H340: 6 | I340: =G340*6+H340 -> 30 | K340: 5 | L340: 9 | M340: =K340*6+L340 -> 39 | O340: 5 | P340: 10 | Q340: =O340*6+P340 -> 40 | S340: KENDALL
A341: BEST PLAYERS | W341: NORTH MELBOURNE | X341: 8 | Y341: 0 | Z341: 0 | AA341: 603 | AB341: 281 | AC341: 214.59074733096085 | AD341: 32
A342: BRUNSWICK | C342: McKENZIE | F342: CHASE | I342: J JOHNSON | L342: GILLESPIE | O342: THOMSON | Q342: STEPHENSON | W342: ESSENDON ASSOC. | X342: 6 | Y342: 2 | Z342: 0 | AA342: 539 | AB342: 352 | AC342: 153.125 | AD342: 24
A343: PORT MELBOURNE | C343: BROWN | F343: HAIGHBLOOM | I343: FITZGERALD | L343: FRANKLIN | O343: PAMPERIN | Q343: PASH | W343: PORT MELBOURNE | X343: 6 | Y343: 2 | Z343: 0 | AA343: 521 | AB343: 443 | AC343: 117.60722347629797 | AD343: 24
A344: GOALKICKERS | W344: BRUNSWICK | X344: 5 | Y344: 3 | Z344: 0 | AA344: 458 | AB344: 397 | AC344: 115.36523929471032 | AD344: 20
A345: BRUNSWICK | C345: CHASE 4 | F345: STANCLIFFE | I345: BOURKE | K345: J JOHNSON | N345: MARSH | P345: PEARS
A346: PORT MELBOURNE | C346: HUTCHINSON 2 | G346: LEWIS | J346: PASH | L346: McGEE | W346: FOOTSCRAY | X346: 4 | Y346: 4 | Z346: 0 | AA346: 470 | AB346: 364 | AC346: 129.12087912087912 | AD346: 16
W347: PRAHRAN | X347: 4 | Y347: 4 | Z347: 0 | AA347: 446 | AB347: 406 | AC347: 109.85221674876847 | AD347: 16
A348: FOOTSCRAY | C348: 2 | D348: 4 | E348: =C348*6+D348 -> 16 | G348: 6 | H348: 7 | I348: =G348*6+H348 -> 43 | K348: 10 | L348: 16 | M348: =K348*6+L348 -> 76 | O348: 14 | P348: 16 | Q348: =O348*6+P348 -> 100 | S348: WILLIAMSTOWN | W348: WILLIAMSTOWN | X348: 3 | Y348: 5 | Z348: 0 | AA348: 444 | AB348: 436 | AC348: 101.8348623853211 | AD348: 12
A349: WILLIAMSTOWN | C349: 0 | D349: 2 | E349: =C349*6+D349 -> 2 | G349: 1 | H349: 5 | I349: =G349*6+H349 -> 11 | K349: 1 | L349: 7 | M349: =K349*6+L349 -> 13 | O349: 3 | P349: 9 | Q349: =O349*6+P349 -> 27 | S349: HUME | W349: BRIGHTON | X349: 3 | Y349: 5 | Z349: 0 | AA349: 430 | AB349: 454 | AC349: 94.713656387665196 | AD349: 12
A350: BEST PLAYERS | W350: NORTHCOTE | X350: 1 | Y350: 7 | Z350: 0 | AA350: 364 | AB350: 548 | AC350: 66.423357664233578 | AD350: 4
A351: FOOTSCRAY | C351: OGILVIE | F351: COTTON | I351: BAXTER | L351: SPENCE | O351: NASH | Q351: BANBURY | W351: PRESTON | X351: 0 | Y351: 8 | Z351: 0 | AA351: 275 | AB351: 869 | AC351: 31.645569620253166 | AD351: 0
A352: WILLIAMSTOWN | C352: GIBBS | F352: McNEILAGE | I352: ELDRIDGE | L352: JULIAN | O352: GIBBONS | Q352: KERR
A353: GOALKICKERS
A354: FOOTSCRAY | C354: BAXTER 3 | F354: KNIGHT 3 | I354: LAMPRELL 2 | L354: COTTON 2 | N354: PATTINSON 2 | Q354: MADDEN | T354: BORTHWICK
A355: WILLIAMSTOWN | C355: AMY | F355: KERR | I355: ROURKE
A357: PRAHRAN | C357: 2 | D357: 3 | E357: =C357*6+D357 -> 15 | G357: 2 | H357: 8 | I357: =G357*6+H357 -> 20 | K357: 9 | L357: 10 | M357: =K357*6+L357 -> 64 | O357: 11 | P357: 13 | Q357: =O357*6+P357 -> 79 | S357: TOORAK PARK
A358: BRIGHTON | C358: 0 | D358: 0 | E358: =C358*6+D358 -> 0 | G358: 4 | H358: 1 | I358: =G358*6+H358 -> 25 | K358: 4 | L358: 2 | M358: =K358*6+L358 -> 26 | O358: 7 | P358: 6 | Q358: =O358*6+P358 -> 48 | S358: ALLEY
A359: BEST PLAYERS
A360: PRAHRAN | C360: DOWDING | G360: PANNAM | J360: NORMAN | M360: H WILSON | P360: SYKES | S360: DOWSING
A361: BRIGHTON | C361: SLOSS | G361: WENBORN | J361: BRIDGEFORD | M361: E BAILES | P361: KENNEDY | S361: NORMAN
A362: GOALKICKERS
A363: PRAHRAN | C363: DOWDING 4 | G363: SYKES 4 | J363: TURNBULL | M363: DOWSING | P363: FARMER
A364: BRIGHTON | C364: M KUSCHERT 4 | G364: FEEHAN 2 | J364: NEYLAN
A366: ESSENDON ASSOC. | C366: 3 | D366: 1 | E366: =C366*6+D366 -> 19 | G366: 8 | H366: 3 | I366: =G366*6+H366 -> 51 | K366: 12 | L366: 3 | M366: =K366*6+L366 -> 75 | O366: 16 | P366: 4 | Q366: =O366*6+P366 -> 100 | S366: CROXTON PK
A367: NORTHCOTE | C367: 0 | D367: 2 | E367: =C367*6+D367 -> 2 | G367: 0 | H367: 5 | I367: =G367*6+H367 -> 5 | K367: 1 | L367: 8 | M367: =K367*6+L367 -> 14 | O367: 8 | P367: 11 | Q367: =O367*6+P367 -> 59 | S367: HURLEY
A368: BEST PLAYERS
A369: ESSENDON ASSOC. | C369: HOARE | F369: LEWIS | I369: GIBSON | L369: HAMBRIDGE | O369: MAINE | R369: ATKINS
A370: NORTHCOTE | C370: BECK | F370: PIKE | I370: MONOHAN | L370: CHESSWASS | O370: REARDON | R370: PORTER
A371: GOALKICKERS
A372: ESSENDON ASSOC. | C372: HOARE 3 | E372: McNAMARA 3 | H372: HAMBRIDGE 2 | K372: WHITTLE 2 | N372: ATKINS 2 | Q372: MCCANN | S372: GIBSON | W372: GOUGH | X372: CHAPMAN
A373: NORTHCOTE | C373: FREEMAN 2 | F373: CHESSWASS | I373: MINTO | K373: DANIELS | M373: HAUGHTON | P373: EARSMAN | R373: MORRIS
A375: NORTH MELBOURNE | C375: 4 | D375: 1 | E375: =C375*6+D375 -> 25 | G375: 7 | H375: 14 | I375: =G375*6+H375 -> 56 | K375: 11 | L375: 23 | M375: =K375*6+L375 -> 89 | O375: 17 | P375: 32 | Q375: =O375*6+P375 -> 134 | S375: NORTH MELB
A376: PRESTON | C376: 2 | D376: 1 | E376: =C376*6+D376 -> 13 | G376: 2 | H376: 1 | I376: =G376*6+H376 -> 13 | K376: 3 | L376: 1 | M376: =K376*6+L376 -> 19 | O376: 4 | P376: 1 | Q376: =O376*6+P376 -> 25 | S376: HHOD
A377: BEST PLAYERS
A378: NORTH MELBOURNE | C378: CAINE | F378: ELLIOTT | I378: HARDY | K378: JINKS | N378: LAVER | Q378: HOPKINS
A379: PRESTON | C379: HAMILL | F379: ENRIGHT | I379: V PUNCH | K379: W PUNCH | N379: DUNCAN | Q379: ROBINSON
A380: GOALKICKERS
A381: NORTH MELBOURNE | C381: CAINE 6 | F381: ELLIOTT 5 | I381: WILLIAMSON 2 | M381: LAWSON 2 | P381: HOPKINS | S381: HARDY
A382: PRESTON | C382: V PUNCH 2 | G382: FAWCETT 2
A384: ROUND 9 | E384: 2ND JULY | S384: PLAYED AT | X384: LADDER | AB384: ROUND | AD384: 9
D385: 1ST QTR | H385: 2ND QTR | L385: 3RD QTR | P385: FINAL | S385: ESSENDON
A386: NORTH MELBOURNE | C386: 1 | D386: 2 | E386: =C386*6+D386 -> 8 | G386: 1 | H386: 6 | I386: =G386*6+H386 -> 12 | K386: 3 | L386: 7 | M386: =K386*6+L386 -> 25 | O386: 5 | P386: 11 | Q386: =O386*6+P386 -> 41 | S386: UMPIRE | W386: TEAM | X386: W | Y386: L | Z386: D | AA386: FOR | AB386: AGST | AC386: % | AD386: PTS
A387: ESSENDON ASSOC. | C387: 2 | D387: 1 | E387: =C387*6+D387 -> 13 | G387: 3 | H387: 1 | I387: =G387*6+H387 -> 19 | K387: 4 | L387: 3 | M387: =K387*6+L387 -> 27 | O387: 6 | P387: 5 | Q387: =O387*6+P387 -> 41 | S387: HUME
A388: BEST PLAYERS | W388: NORTH MELBOURNE | X388: 8 | Y388: 0 | Z388: 1 | AA388: 644 | AB388: 322 | AC388: 200 | AD388: 34
A389: NORTH MELBOURNE | C389: HARDY | F389: WILLIAMSON | I389: HAMMOND | L389: BARKER | N389: SPEAKMAN | Q389: LAVER | W389: ESSENDON ASSOC. | X389: 6 | Y389: 2 | Z389: 1 | AA389: 580 | AB389: 393 | AC389: 147.58269720101782 | AD389: 26
A390: ESSENDON ASSOC. | C390: MAINE | F390: HOARE | I390: GOUGH | L390: CHAPMAN | N390: ATKINS | Q390: HAMBRIDGE | W390: BRUNSWICK | X390: 6 | Y390: 3 | Z390: 0 | AA390: 554 | AB390: 436 | AC390: 127.06422018348624 | AD390: 24
A391: GOALKICKERS | W391: PORT MELBOURNE | X391: 6 | Y391: 3 | Z391: 0 | AA391: 561 | AB391: 498 | AC391: 112.65060240963855 | AD391: 24
A392: NORTH MELBOURNE | C392: WILLIAMSON 2 | G392: ELLIOTT | J392: CAINE | M392: LAWSON
A393: ESSENDON ASSOC. | C393: HAMBRIDGE 2 | G393: CHAPMAN | J393: GIBSON | M393: MORRISON | P393: McNAMARA | W393: PRAHRAN | X393: 5 | Y393: 4 | Z393: 0 | AA393: 606 | AB393: 433 | AC393: 139.95381062355659 | AD393: 20
W394: FOOTSCRAY | X394: 5 | Y394: 4 | Z394: 0 | AA394: 525 | AB394: 404 | AC394: 129.95049504950495 | AD394: 20
A395: FOOTSCRAY | C395: 1 | D395: 6 | E395: =C395*6+D395 -> 12 | G395: 4 | H395: 6 | I395: =G395*6+H395 -> 30 | K395: 6 | L395: 9 | M395: =K395*6+L395 -> 45 | O395: 7 | P395: 13 | Q395: =O395*6+P395 -> 55 | S395: FOOTSCRAY | W395: WILLIAMSTOWN | X395: 4 | Y395: 5 | Z395: 0 | AA395: 536 | AB395: 473 | AC395: 113.31923890063425 | AD395: 16
A396: PORT MELBOURNE | C396: 1 | D396: 0 | E396: =C396*6+D396 -> 6 | G396: 2 | H396: 2 | I396: =G396*6+H396 -> 14 | K396: 3 | L396: 2 | M396: =K396*6+L396 -> 20 | O396: 6 | P396: 4 | Q396: =O396*6+P396 -> 40 | S396: KENDALL | W396: BRIGHTON | X396: 3 | Y396: 6 | Z396: 0 | AA396: 469 | AB396: 550 | AC396: 85.272727272727266 | AD396: 12
A397: BEST PLAYERS | W397: NORTHCOTE | X397: 1 | Y397: 8 | Z397: 0 | AA397: 401 | AB397: 640 | AC397: 62.65625 | AD397: 4
A398: FOOTSCRAY | C398: SPENCE | F398: OGILVIE | I398: COTTON | L398: BAXTER | N398: BORTHWICK | Q398: NASH | W398: PRESTON | X398: 0 | Y398: 9 | Z398: 0 | AA398: 302 | AB398: 1029 | AC398: 29.348882410106899 | AD398: 0
A399: PORT MELBOURNE | C399: JACKSON | F399: BROWN | I399: FRANKLIN | L399: ANDERSON | N399: PAMPERIN | Q399: CLEELAND
A400: GOALKICKERS
A401: FOOTSCRAY | C401: KNIGHT 3 | F401: LAMPRELL 2 | I401: BORTHWICK | L401: A GREGORY
A402: PORT MELBOURNE | C402: HUTCHINSON 2 | G402: SHEEHAN | J402: PASH | L402: CLEELAND | O402: ANDERSON
A404: BRUNSWICK | C404: 2 | D404: 1 | E404: =C404*6+D404 -> 13 | G404: 8 | H404: 2 | I404: =G404*6+H404 -> 50 | K404: 10 | L404: 2 | M404: =K404*6+L404 -> 62 | O404: 15 | P404: 6 | Q404: =O404*6+P404 -> 96 | S404: BRUNSWICK
A405: BRIGHTON | C405: 4 | D405: 1 | E405: =C405*6+D405 -> 25 | G405: 4 | H405: 2 | I405: =G405*6+H405 -> 26 | K405: 4 | L405: 3 | M405: =K405*6+L405 -> 27 | O405: 5 | P405: 9 | Q405: =O405*6+P405 -> 39 | S405: HURLEY
A406: BEST PLAYERS
A407: BRUNSWICK | C407: PRICE | F407: MARSH | I407: STANCLIFFE | L407: CHASE | N407: PEARS | Q407: JOHNSON
A408: BRIGHTON | C408: BRIDGFORD | F408: JOHNSTON | I408: M KUSCHERT | L408: KENNEDY | N408: NEYLAN | Q408: A LAXTON
A409: GOALKICKERS
A410: BRUNSWICK | C410: CHASE 6 | E410: STEPHENSON 2 | H410: PRICE 2 | J410: CARRIE | L410: JOHNSON | O410: MARSH | Q410: ROSS | S410: PEARS
A411: BRIGHTON | C411: HART 2 | F411: MANN 2 | I411: PLAISTED
A413: WILLIAMSTOWN | C413: 1 | D413: 5 | E413: =C413*6+D413 -> 11 | G413: 3 | H413: 12 | I413: =G413*6+H413 -> 30 | K413: 7 | L413: 16 | M413: =K413*6+L413 -> 58 | O413: 12 | P413: 20 | Q413: =O413*6+P413 -> 92 | S413: WILLIAMSTOWN
A414: NORTHCOTE | C414: 0 | D414: 1 | E414: =C414*6+D414 -> 1 | G414: 3 | H414: 4 | I414: =G414*6+H414 -> 22 | K414: 3 | L414: 6 | M414: =K414*6+L414 -> 24 | O414: 5 | P414: 7 | Q414: =O414*6+P414 -> 37 | S414: HOOD
A415: BEST PLAYERS
A416: WILLIAMSTOWN | C416: GIBBS | F416: WEIDNER | I416: JOY | K416: McKENZIE | O416: ALLEY | R416: DAVIES
A417: NORTHCOTE | C417: SCOTT | F417: REARDON | I417: BECK | K417: ARBUTHNOT | O417: COLE | R417: HAUGHTON
A418: GOALKICKERS
A419: WILLIAMSTOWN | C419: MATTHEWS 4 | G419: LITCHFIELD 2 | K419: GIBBS 2 | M419: BOURKE | O419: LEONARD | Q419: AMY | S419: SALVIS
A420: NORTHCOTE | C420: HAUGHTON | F420: ARBUTHNOT | I420: BARTLETT | L420: PIKE | N420: SCOTT
A422: PRAHRAN | C422: 4 | D422: 3 | E422: =C422*6+D422 -> 27 | G422: 10 | H422: 14 | I422: =G422*6+H422 -> 74 | K422: 17 | L422: 16 | M422: =K422*6+L422 -> 118 | O422: 23 | P422: 22 | Q422: =O422*6+P422 -> 160 | S422: PRESTON
A423: PRESTON | C423: 3 | D423: 1 | E423: =C423*6+D423 -> 19 | G423: 4 | H423: 1 | I423: =G423*6+H423 -> 25 | K423: 4 | L423: 3 | M423: =K423*6+L423 -> 27 | O423: 4 | P423: 3 | Q423: =O423*6+P423 -> 27 | S423: ALLEY
A424: BEST PLAYERS
A425: PRAHRAN | C425: DOWSING | F425: DOWDING | I425: H WILSON | L425: SYKES | N425: STEWART | Q425: GUTHRIDGE
A426: PRESTON | C426: W PUNCH | F426: ROBINSON | I426: S STEPHENS | L426: SMITH | N426: J STEPHENS
A427: GOALKICKERS
A428: PRAHRAN | C428: DOWDING 6 | F428: SYKES 5 | H428: FARMER 4 | J428: NORMAN 2 | M428: DOWSING 2 | P428: GUTHRIDGE | R428: WOODS | U428: STEWART | X428: HALL
A429: PRESTON | C429: W PUNCH | F429: ROBINSON | I429: J STEPHENS | L429: MOORE
A431: ROUND 10 | E431: 9TH JULY | S431: PLAYED AT | X431: LADDER | AB431: ROUND | AD431: 10
D432: 1ST QTR | H432: 2ND QTR | L432: 3RD QTR | P432: FINAL | S432: TOORAK PARK
A433: PRAHRAN | C433: 4 | D433: 4 | E433: =C433*6+D433 -> 28 | G433: 7 | H433: 8 | I433: =G433*6+H433 -> 50 | K433: 14 | L433: 11 | M433: =K433*6+L433 -> 95 | O433: 18 | P433: 17 | Q433: =O433*6+P433 -> 125 | S433: UMPIRE | W433: TEAM | X433: W | Y433: L | Z433: D | AA433: FOR | AB433: AGST | AC433: % | AD433: PTS
A434: PORT MELBOURNE | C434: 4 | D434: 4 | E434: =C434*6+D434 -> 28 | G434: 5 | H434: 7 | I434: =G434*6+H434 -> 37 | K434: 6 | L434: 10 | M434: =K434*6+L434 -> 46 | O434: 7 | P434: 12 | Q434: =O434*6+P434 -> 54 | S434: HURLEY
A435: BEST PLAYERS | W435: NORTH MELBOURNE | X435: 9 | Y435: 0 | Z435: 1 | AA435: 769 | AB435: 357 | AC435: 215.40616246498598 | AD435: 38
A436: PRAHRAN | C436: DOWSING | F436: NORMAN | I436: STEWART | L436: FARMER | O436: DOWDING | Q436: H WILSON | W436: ESSENDON ASSOC. | X436: 7 | Y436: 2 | Z436: 1 | AA436: 650 | AB436: 445 | AC436: 146.06741573033707 | AD436: 30
A437: PORT MELBOURNE | C437: TREGLOWN | F437: ANDERSON | I437: PAMPERIN | L437: HUTCHINSON | O437: McGEE | Q437: ABBOTT | W437: BRUNSWICK | X437: 7 | Y437: 3 | Z437: 0 | AA437: 606 | AB437: 473 | AC437: 128.11839323467231 | AD437: 28
A438: GOALKICKERS | W438: PRAHRAN | X438: 6 | Y438: 4 | Z438: 0 | AA438: 731 | AB438: 487 | AC438: 150.10266940451746 | AD438: 24
A439: PRAHRAN | C439: DOWDING 5 | F439: FARMER 4 | I439: SYKES 3 | K439: HALL 2 | M439: NORMAN 2 | P439: DOWSING | R439: TURNBULL
A440: PORT MELBOURNE | C440: HUTCHINSON 3 | G440: HAIGHBLOOM 3 | K440: BROWN | W440: PORT MELBOURNE | X440: 6 | Y440: 4 | Z440: 0 | AA440: 615 | AB440: 623 | AC440: 98.715890850722317 | AD440: 24
W441: FOOTSCRAY | X441: 5 | Y441: 5 | Z441: 0 | AA441: 577 | AB441: 474 | AC441: 121.72995780590718 | AD441: 20
A442: ESSENDON ASSOC. | C442: 4 | D442: 2 | E442: =C442*6+D442 -> 26 | G442: 6 | H442: 4 | I442: =G442*6+H442 -> 40 | K442: 8 | L442: 7 | M442: =K442*6+L442 -> 55 | O442: 10 | P442: 10 | Q442: =O442*6+P442 -> 70 | S442: ESSENDON | W442: WILLIAMSTOWN | X442: 4 | Y442: 6 | Z442: 0 | AA442: 573 | AB442: 525 | AC442: 109.14285714285714 | AD442: 16
A443: FOOTSCRAY | C443: 2 | D443: 2 | E443: =C443*6+D443 -> 14 | G443: 4 | H443: 3 | I443: =G443*6+H443 -> 27 | K443: 8 | L443: 3 | M443: =K443*6+L443 -> 51 | O443: 8 | P443: 4 | Q443: =O443*6+P443 -> 52 | S443: ALLEY | W443: BRIGHTON | X443: 4 | Y443: 6 | Z443: 0 | AA443: 565 | AB443: 594 | AC443: 95.117845117845121 | AD443: 16
A444: BEST PLAYERS | W444: NORTHCOTE | X444: 1 | Y444: 9 | Z444: 0 | AA444: 436 | AB444: 765 | AC444: 56.993464052287578 | AD444: 4
A445: ESSENDON ASSOC. | C445: HAMBRIDGE | F445: HOARE | H445: McNAMARA | K445: WALKER | N445: F ABBOTT | Q445: MADDEN | W445: PRESTON | X445: 0 | Y445: 10 | Z445: 0 | AA445: 346 | AB445: 1125 | AC445: 30.755555555555556 | AD445: 0
A446: FOOTSCRAY | C446: COTTON | F446: OGILVIE | H446: W McCARTHY | K446: BORTHWICK | N446: BANBURY | Q446: PATTINSON
A447: GOALKICKERS
A448: ESSENDON ASSOC. | C448: F ABBOTT 4 | G448: HOARE 2 | J448: GOUGH | L448: HAMBRIDGE | O448: LEWIS | Q448: PAIN
A449: FOOTSCRAY | C449: BULGER 3 | F449: SPENCE | I449: COTTON | K449: KNIGHT | M449: PATTINSON | P449: MADDEN
A451: BRUNSWICK | C451: 1 | D451: 3 | E451: =C451*6+D451 -> 9 | G451: 1 | H451: 5 | I451: =G451*6+H451 -> 11 | K451: 5 | L451: 7 | M451: =K451*6+L451 -> 37 | O451: 7 | P451: 10 | Q451: =O451*6+P451 -> 52 | S451: WILLIAMSTOWN
A452: WILLIAMSTOWN | C452: 3 | D452: 3 | E452: =C452*6+D452 -> 21 | G452: 4 | H452: 6 | I452: =G452*6+H452 -> 30 | K452: 5 | L452: 7 | M452: =K452*6+L452 -> 37 | O452: 5 | P452: 7 | Q452: =O452*6+P452 -> 37 | S452: HUME
A453: BEST PLAYERS
A454: BRUNSWICK | C454: McKENZIE | G454: STANCLIFFE | K454: CHASE | N454: L BRAID | Q454: PRICE | T454: MILLS
A455: WILLIAMSTOWN | C455: ELDRIDGE | G455: REITMAN | K455: AMY | N455: GIBBS | Q455: McKENZIE | T455: ROURKE
A456: GOALKICKERS
A457: BRUNSWICK | C457: BOURKE 3 | G457: CHASE | J457: STEPHENSON | M457: MARSH | O457: McKENZIE
A458: WILLIAMSTOWN | C458: MATTHEWS 2 | G458: LITCHFIELD 2 | K458: KERR
A460: BRIGHTON | C460: 1 | D460: 3 | E460: =C460*6+D460 -> 9 | G460: 6 | H460: 9 | I460: =G460*6+H460 -> 45 | K460: 9 | L460: 11 | M460: =K460*6+L460 -> 65 | O460: 14 | P460: 12 | Q460: =O460*6+P460 -> 96 | S460: BRIGHTON
A461: PRESTON | C461: 0 | D461: 0 | E461: =C461*6+D461 -> 0 | G461: 0 | H461: 0 | I461: =G461*6+H461 -> 0 | K461: 1 | L461: 7 | M461: =K461*6+L461 -> 13 | O461: 6 | P461: 8 | Q461: =O461*6+P461 -> 44 | S461: HOOD
A462: BEST PLAYERS
A463: BRIGHTON | C463: DUNCAN | G463: NEYLAN | J463: HOSKINGS | M463: JOHNSON | P463: BACHLI | R463: E BAILES
A464: PRESTON | C464: BILLINGS | G464: SMITH | J464: HOWLETT | M464: W PUNCH | P464: ENRIGHT | R464: ROBINSON
A465: GOALKICKERS
A466: BRIGHTON | C466: BACHLI 5 | G466: PLAISTED 5 | K466: E BAILES 3 | O466: JOHNSON
A467: PRESTON | C467: SMITH 2 | G467: BASSETT | J467: ENRIGHT | M467: MOORE | O467: V PUNCH
A469: NORTH MELBOURNE | C469: 4 | D469: 4 | E469: =C469*6+D469 -> 28 | G469: 9 | H469: 5 | I469: =G469*6+H469 -> 59 | K469: 12 | L469: 8 | M469: =K469*6+L469 -> 80 | O469: 19 | P469: 13 | Q469: =O469*6+P469 -> 127 | S469: NORTH MELB
A470: NORTHCOTE | C470: 2 | D470: 2 | E470: =C470*6+D470 -> 14 | G470: 3 | H470: 3 | I470: =G470*6+H470 -> 21 | K470: 4 | L470: 4 | M470: =K470*6+L470 -> 28 | O470: 5 | P470: 6 | Q470: =O470*6+P470 -> 36 | S470: KENDALL
A471: BEST PLAYERS
A472: NORTH MELBOURNE | C472: HARDY | F472: JINKS | I472: HAMMOND | L472: O'SHEA | O472: HOPKINS | R472: TRELOAR
A473: NORTHCOTE | C473: SCOTT | F473: RYAN | I473: COLE | L473: DANIELS | O473: REARDON | R473: BECK
A474: GOALKICKERS
A475: NORTH MELBOURNE | C475: CAINE 9 | F475: ELLIOTT 3 | I475: WILLIAMSON 2 | L475: HARDY | N475: HAMMOND | Q475: JINKS | S475: NORMAN | W475: TRELOAR
A476: NORTHCOTE | C476: RYAN 3 | F476: MINTO | I476: CHESSWASS
A478: ROUND 11 | E478: 16TH JULY | J478: WEATHER | M478: RAIN EARLY | S478: PLAYED AT | X478: LADDER | AB478: ROUND | AD478: 11
D479: 1ST QTR | H479: 2ND QTR | L479: 3RD QTR | P479: FINAL | S479: BRUNSWICK
A480: BRUNSWICK | C480: 1 | D480: 3 | E480: =C480*6+D480 -> 9 | G480: 2 | H480: 7 | I480: =G480*6+H480 -> 19 | K480: 2 | L480: 10 | M480: =K480*6+L480 -> 22 | O480: 5 | P480: 13 | Q480: =O480*6+P480 -> 43 | S480: UMPIRE | W480: TEAM | X480: W | Y480: L | Z480: D | AA480: FOR | AB480: AGST | AC480: % | AD480: PTS
A481: PRAHRAN | C481: 1 | D481: 4 | E481: =C481*6+D481 -> 10 | G481: 3 | H481: 6 | I481: =G481*6+H481 -> 24 | K481: 3 | L481: 7 | M481: =K481*6+L481 -> 25 | O481: 4 | P481: 8 | Q481: =O481*6+P481 -> 32 | S481: HUME
A482: BEST PLAYERS | W482: NORTH MELBOURNE | X482: 10 | Y482: 0 | Z482: 1 | AA482: 830 | AB482: 386 | AC482: 215.02590673575131 | AD482: 42
A483: BRUNSWICK | C483: PRICE | F483: McKENZIE | I483: JOHNSON | L483: CHASE | O483: BOURKE | Q483: KYME | W483: ESSENDON ASSOC. | X483: 8 | Y483: 2 | Z483: 1 | AA483: 676 | AB483: 467 | AC483: 144.75374732334046 | AD483: 34
A484: PRAHRAN | C484: STEWART | F484: WOODS | I484: DARBY | L484: DOWSING | O484: DOWDING | Q484: NORMAN | W484: BRUNSWICK | X484: 8 | Y484: 3 | Z484: 0 | AA484: 649 | AB484: 505 | AC484: 128.51485148514851 | AD484: 32
A485: GOALKICKERS | W485: PRAHRAN | X485: 6 | Y485: 5 | Z485: 0 | AA485: 763 | AB485: 530 | AC485: 143.96226415094338 | AD485: 24
A486: BRUNSWICK | C486: BOURKE 2 | G486: CHASE | J486: MARSH | M486: STEPHENSON
A487: PRAHRAN | C487: DOWDING 2 | G487: SYKES | J487: FARMER | W487: PORT MELBOURNE | X487: 6 | Y487: 5 | Z487: 0 | AA487: 637 | AB487: 649 | AC487: 98.151001540832056 | AD487: 24
W488: WILLIAMSTOWN | X488: 5 | Y488: 6 | Z488: 0 | AA488: 696 | AB488: 573 | AC488: 121.46596858638743 | AD488: 20
A489: ESSENDON ASSOC. | C489: 1 | D489: 2 | E489: =C489*6+D489 -> 8 | G489: 1 | H489: 7 | I489: =G489*6+H489 -> 13 | K489: 1 | L489: 8 | M489: =K489*6+L489 -> 14 | O489: 2 | P489: 14 | Q489: =O489*6+P489 -> 26 | S489: PORT MELB | W489: FOOTSCRAY | X489: 5 | Y489: 6 | Z489: 0 | AA489: 606 | AB489: 535 | AC489: 113.27102803738318 | AD489: 20
A490: PORT MELBOURNE | C490: 1 | D490: 1 | E490: =C490*6+D490 -> 7 | G490: 3 | H490: 3 | I490: =G490*6+H490 -> 21 | K490: 3 | L490: 4 | M490: =K490*6+L490 -> 22 | O490: 3 | P490: 4 | Q490: =O490*6+P490 -> 22 | S490: ALLEY | W490: BRIGHTON | X490: 4 | Y490: 7 | Z490: 0 | AA490: 617 | AB490: 647 | AC490: 95.363214837712519 | AD490: 16
A491: BEST PLAYERS | W491: NORTHCOTE | X491: 2 | Y491: 9 | Z491: 0 | AA491: 489 | AB491: 817 | AC491: 59.853121175030601 | AD491: 8
A492: ESSENDON ASSOC. | C492: GOUGH | F492: HOARE | I492: MAINE | L492: BUSBRIDGE | O492: WALKER | R492: MADDEN | W492: PRESTON | X492: 0 | Y492: 11 | Z492: 0 | AA492: 394 | AB492: 1248 | AC492: 31.570512820512821 | AD492: 0
A493: PORT MELBOURNE | C493: CLEELAND | F493: PASH | I493: McDONALD | L493: BROWN | O493: ANDERSON | R493: McGEE
A494: GOALKICKERS
A495: ESSENDON ASSOC. | C495: GIBSON | F495: BUSBRIDGE
A496: PORT MELBOURNE | C496: McGEE | F496: ANDERSON | J496: HAIGHBLOOM
A498: NORTH MELBOURNE | C498: 3 | D498: 1 | E498: =C498*6+D498 -> 19 | G498: 4 | H498: 5 | I498: =G498*6+H498 -> 29 | K498: 6 | L498: 6 | M498: =K498*6+L498 -> 42 | O498: 9 | P498: 7 | Q498: =O498*6+P498 -> 61 | S498: FOOTSCRAY
A499: FOOTSCRAY | C499: 0 | D499: 0 | E499: =C499*6+D499 -> 0 | G499: 2 | H499: 3 | I499: =G499*6+H499 -> 15 | K499: 3 | L499: 4 | M499: =K499*6+L499 -> 22 | O499: 4 | P499: 5 | Q499: =O499*6+P499 -> 29 | S499: KENDALL
A500: BEST PLAYERS
A501: NORTH MELBOURNE | C501: McCANN | G501: LAVER | J501: HARDY | M501: HOPKINS | P501: SPEAKMAN | S501: TRELOAR
A502: FOOTSCRAY | C502: COTTON | G502: OGILVIE | J502: STEWART | M502: WHITE | P502: BANBURY | S502: W McCARTHY
A503: GOALKICKERS
A504: NORTH MELBOURNE | C504: ELLIOTT 2 | F504: CAINE 2 | I504: HAMMOND | K504: HARDY | M504: HOMAN | O504: WILLIAMSON | S504: G JOHNSON
A505: FOOTSCRAY | C505: KNIGHT 3 | G505: COTTON
A507: NORTHCOTE | C507: 3 | D507: 6 | E507: =C507*6+D507 -> 24 | G507: 3 | H507: 6 | I507: =G507*6+H507 -> 24 | K507: 3 | L507: 8 | M507: =K507*6+L507 -> 26 | O507: 7 | P507: 11 | Q507: =O507*6+P507 -> 53 | S507: CROXTON PK
A508: BRIGHTON | C508: 1 | D508: 3 | E508: =C508*6+D508 -> 9 | G508: 3 | H508: 6 | I508: =G508*6+H508 -> 24 | K508: 4 | L508: 9 | M508: =K508*6+L508 -> 33 | O508: 7 | P508: 10 | Q508: =O508*6+P508 -> 52 | S508: HOOD
A509: BEST PLAYERS
A510: NORTHCOTE | C510: SCOTT | G510: PIKE | J510: COLE | L510: BECK | O510: WHITMORE | R510: REARDON
A511: BRIGHTON | C511: BARWICK | G511: RICHARDSON | J511: PLAISTED | L511: B BAILES | O511: JOHNSON | R511: G ROBINSON
A512: GOALKICKERS
A513: NORTHCOTE | C513: CHESSWASS 2 | G513: REARDON 2 | K513: RYAN | N513: WALKER | Q513: DANIELS
A514: BRIGHTON | C514: RICHARDSON 2 | G514: JOHNSON 2 | K514: BACHLI 2 | N514: PLAISTED
A516: WILLIAMSTOWN | C516: 3 | D516: 9 | E516: =C516*6+D516 -> 27 | G516: 7 | H516: 13 | I516: =G516*6+H516 -> 55 | K516: 10 | L516: 16 | M516: =K516*6+L516 -> 76 | O516: 17 | P516: 21 | Q516: =O516*6+P516 -> 123 | S516: PRESTON
A517: PRESTON | C517: 2 | D517: 1 | E517: =C517*6+D517 -> 13 | G517: 4 | H517: 5 | I517: =G517*6+H517 -> 29 | K517: 5 | L517: 9 | M517: =K517*6+L517 -> 39 | O517: 6 | P517: 12 | Q517: =O517*6+P517 -> 48 | S517: HURLEY
A518: BEST PLAYERS
A519: WILLIAMSTOWN | C519: KERR | F519: GIBBS | I519: McKENZIE | L519: MATTHEWS | O519: REITMAN | R519: JULIAN
A520: PRESTON | C520: W PUNCH | F520: ENRIGHT | I520: BILLINGS | L520: WILLIAMS | O520: MOORE | R520: J STEPHENS
A521: GOALKICKERS
A522: WILLIAMSTOWN | C522: KERR 5 | F522: MATTHEWS 4 | I522: AMY 3 | K522: LEONARD 3 | N522: LITCHFIELD | Q522: SALVIS
A523: PRESTON | C523: SMITH 2 | F523: J STEPHENS | I523: MOORE | K523: V PUNCH | N523: ENRIGHT
A525: ROUND 12 | E525: 23RD JULY | J525: WEATHER | M525: RAIN THROUGHOUT | S525: PLAYED AT | X525: LADDER | AB525: ROUND | AD525: 12
D526: 1ST QTR | H526: 2ND QTR | L526: 3RD QTR | P526: FINAL | S526: ESSENDON
A527: ESSENDON ASSOC. | C527: 0 | D527: 1 | E527: =C527*6+D527 -> 1 | G527: 3 | H527: 1 | I527: =G527*6+H527 -> 19 | K527: 4 | L527: 4 | M527: =K527*6+L527 -> 28 | O527: 5 | P527: 6 | Q527: =O527*6+P527 -> 36 | S527: UMPIRE | W527: TEAM | X527: W | Y527: L | Z527: D | AA527: FOR | AB527: AGST | AC527: % | AD527: PTS
A528: BRUNSWICK | C528: 1 | D528: 2 | E528: =C528*6+D528 -> 8 | G528: 2 | H528: 5 | I528: =G528*6+H528 -> 17 | K528: 3 | L528: 6 | M528: =K528*6+L528 -> 24 | O528: 4 | P528: 8 | Q528: =O528*6+P528 -> 32 | S528: KENDALL
A529: BEST PLAYERS | W529: NORTH MELBOURNE | X529: 11 | Y529: 0 | Z529: 1 | AA529: 878 | AB529: 414 | AC529: 212.07729468599032 | AD529: 46
A530: ESSENDON ASSOC. | C530: McNAMARA | F530: WALKER | I530: MAINE | L530: MADDEN | O530: PAIN | Q530: CHAPMAN | W530: ESSENDON ASSOC. | X530: 9 | Y530: 2 | Z530: 1 | AA530: 712 | AB530: 499 | AC530: 142.68537074148296 | AD530: 38
A531: BRUNSWICK | C531: McKENZIE | F531: PRICE | I531: CHASE | L531: L BRAID | O531: ROSS | Q531: THOMSON | W531: BRUNSWICK | X531: 8 | Y531: 4 | Z531: 0 | AA531: 681 | AB531: 541 | AC531: 125.87800369685768 | AD531: 32
A532: GOALKICKERS | W532: PRAHRAN | X532: 7 | Y532: 5 | Z532: 0 | AA532: 789 | AB532: 553 | AC532: 142.6763110307414 | AD532: 28
A533: ESSENDON ASSOC. | C533: F ABBOTT 2 | G533: LEWIS | J533: McNAMARA | M533: WALKER
A534: BRUNSWICK | C534: McKENZIE 2 | G534: BOURKE | J534: MILLS | W534: WILLIAMSTOWN | X534: 6 | Y534: 6 | Z534: 0 | AA534: 742 | AB534: 602 | AC534: 123.25581395348837 | AD534: 24
W535: PORT MELBOURNE | X535: 6 | Y535: 6 | Z535: 0 | AA535: 665 | AB535: 697 | AC535: 95.40889526542324 | AD535: 24
A536: NORTH MELBOURNE | C536: 3 | D536: 4 | E536: =C536*6+D536 -> 22 | G536: 4 | H536: 7 | I536: =G536*6+H536 -> 31 | K536: 5 | L536: 9 | M536: =K536*6+L536 -> 39 | O536: 6 | P536: 12 | Q536: =O536*6+P536 -> 48 | S536: PORT MELB | W536: FOOTSCRAY | X536: 5 | Y536: 7 | Z536: 0 | AA536: 629 | AB536: 561 | AC536: 112.12121212121212 | AD536: 20
A537: PORT MELBOURNE | C537: 1 | D537: 0 | E537: =C537*6+D537 -> 6 | G537: 2 | H537: 2 | I537: =G537*6+H537 -> 14 | K537: 2 | L537: 3 | M537: =K537*6+L537 -> 15 | O537: 4 | P537: 4 | Q537: =O537*6+P537 -> 28 | S537: HUME | W537: BRIGHTON | X537: 4 | Y537: 8 | Z537: 0 | AA537: 646 | AB537: 693 | AC537: 93.21789321789322 | AD537: 16
A538: BEST PLAYERS | W538: NORTHCOTE | X538: 3 | Y538: 9 | Z538: 0 | AA538: 549 | AB538: 846 | AC538: 64.893617021276597 | AD538: 12
A539: NORTH MELBOURNE | C539: McCANN | F539: LAVER | I539: HAMMOND | L539: JINKS | O539: HOPKINS | R539: HARDY | W539: PRESTON | X539: 0 | Y539: 12 | Z539: 0 | AA539: 423 | AB539: 1308 | AC539: 32.339449541284402 | AD539: 0
A540: PORT MELBOURNE | C540: PAASH | F540: FRANKLIN | I540: SAMPSON | L540: PAMPERIN | O540: HUTCHINSON | R540: BENNION
A541: GOALKICKERS
A542: NORTH MELBOURNE | C542: CAINE 3 | F542: WILLIAMSON | J542: ELLIOTT | M542: HAMMOND
A543: PORT MELBOURNE | C543: HUTCHINSON 3 | F543: KEATING
A545: PRAHRAN | C545: 2 | D545: 3 | E545: =C545*6+D545 -> 15 | G545: 3 | H545: 4 | I545: =G545*6+H545 -> 22 | K545: 3 | L545: 8 | M545: =K545*6+L545 -> 26 | O545: 3 | P545: 8 | Q545: =O545*6+P545 -> 26 | S545: TOORAK PARK
A546: FOOTSCRAY | C546: 1 | D546: 0 | E546: =C546*6+D546 -> 6 | G546: 1 | H546: 1 | I546: =G546*6+H546 -> 7 | K546: 2 | L546: 2 | M546: =K546*6+L546 -> 14 | O546: 3 | P546: 5 | Q546: =O546*6+P546 -> 23 | S546: ALLEY
A547: BEST PLAYERS
A548: PRAHRAN | C548: STEWART | G548: WOODS | J548: SYKES | L548: DOWSING | O548: DOWDING | R548: JOHNSON
A549: FOOTSCRAY | C549: BORTHWICK | G549: OGILVIE | J549: COTTON | L549: WHITE | O549: W McCARTHY | R549: SPENCE
A550: GOALKICKERS
A551: PRAHRAN | C551: DOWDING 2 | G551: SYKES
A552: FOOTSCRAY | C552: BANBURY | G552: SHARP | J552: KNIGHT
A554: WILLIAMSTOWN | C554: 2 | D554: 1 | E554: =C554*6+D554 -> 13 | G554: 4 | H554: 5 | I554: =G554*6+H554 -> 29 | K554: 5 | L554: 7 | M554: =K554*6+L554 -> 37 | O554: 6 | P554: 10 | Q554: =O554*6+P554 -> 46 | S554: WILLIAMSTOWN
A555: BRIGHTON | C555: 1 | D555: 1 | E555: =C555*6+D555 -> 7 | G555: 1 | H555: 1 | I555: =G555*6+H555 -> 7 | K555: 2 | L555: 2 | M555: =K555*6+L555 -> 14 | O555: 4 | P555: 5 | Q555: =O555*6+P555 -> 29 | S555: HOOD
A556: BEST PLAYERS
A557: WILLIAMSTOWN | C557: ALLEY | G557: JULIAN | I557: WEIDNER | L557: ROURKE | O557: DAVIES | R557: AMY
A558: BRIGHTON | C558: BARWICK | G558: MANN | I558: PLAISTED | L558: M KUSCHERT | O558: KENNEDY | R558: E BAILES
A559: GOALKICKERS
A560: WILLIAMSTOWN | C560: KERR 4 | F560: MATTHEWS 2
A561: BRIGHTON | C561: B BAILES | F561: M KUSCHERT | I561: BARWICK | L561: PLAISTED
A563: NORTHCOTE | C563: 4 | D563: 5 | E563: =C563*6+D563 -> 29 | G563: 5 | H563: 12 | I563: =G563*6+H563 -> 42 | K563: 6 | L563: 13 | M563: =K563*6+L563 -> 49 | O563: 7 | P563: 18 | Q563: =O563*6+P563 -> 60 | S563: PRESTON
A564: PRESTON | C564: 0 | D564: 1 | E564: =C564*6+D564 -> 1 | G564: 1 | H564: 3 | I564: =G564*6+H564 -> 9 | K564: 2 | L564: 5 | M564: =K564*6+L564 -> 17 | O564: 4 | P564: 5 | Q564: =O564*6+P564 -> 29 | S564: HURLEY
A565: BEST PLAYERS
A566: NORTHCOTE
A567: PRESTON
A568: GOALKICKERS
A569: NORTHCOTE | C569: CHESSWASS 2 | G569: RYAN 2
A570: PRESTON
A572: ROUND 13 | E572: 30TH JULY | J572: WEATHER | M572: GROUNDS SLIPPERY | S572: PLAYED AT | X572: LADDER | AB572: ROUND | AD572: 13
D573: 1ST QTR | H573: 2ND QTR | L573: 3RD QTR | P573: FINAL | S573: NORTH MELB
A574: NORTH MELBOURNE | C574: 2 | D574: 2 | E574: =C574*6+D574 -> 14 | G574: 4 | H574: 3 | I574: =G574*6+H574 -> 27 | K574: 4 | L574: 8 | M574: =K574*6+L574 -> 32 | O574: 7 | P574: 10 | Q574: =O574*6+P574 -> 52 | S574: UMPIRE | W574: TEAM | X574: W | Y574: L | Z574: D | AA574: FOR | AB574: AGST | AC574: % | AD574: PTS
A575: PRAHRAN | C575: 0 | D575: 4 | E575: =C575*6+D575 -> 4 | G575: 1 | H575: 4 | I575: =G575*6+H575 -> 10 | K575: 3 | L575: 6 | M575: =K575*6+L575 -> 24 | O575: 3 | P575: 11 | Q575: =O575*6+P575 -> 29 | S575: HUME
A576: BEST PLAYERS | W576: NORTH MELBOURNE | X576: 12 | Y576: 0 | Z576: 1 | AA576: 930 | AB576: 443 | AC576: 209.93227990970655 | AD576: 50
A577: NORTH MELBOURNE | C577: J JOHNSON | F577: HAMMOND | I577: JINKS | K577: G JOHNSON | N577: PEMBERTON | Q577: HOPKINS | W577: ESSENDON ASSOC. | X577: 10 | Y577: 2 | Z577: 1 | AA577: 818 | AB577: 537 | AC577: 152.32774674115456 | AD577: 42
A578: PRAHRAN | C578: W STEWART | F578: WOODS | I578: PANNAM | K578: NORMAN | N578: TURNBULL | Q578: MARONEY | W578: BRUNSWICK | X578: 9 | Y578: 4 | Z578: 0 | AA578: 799 | AB578: 584 | AC578: 136.81506849315068 | AD578: 36
A579: GOALKICKERS | W579: PRAHRAN | X579: 7 | Y579: 6 | Z579: 0 | AA579: 818 | AB579: 605 | AC579: 135.20661157024793 | AD579: 28
A580: NORTH MELBOURNE | C580: ELLIOTT 3 | G580: CAINE 3 | J580: J JOHNSON
A581: PRAHRAN | C581: ALLEN | G581: JOHNSON | J581: BLUNDELL | W581: WILLIAMSTOWN | X581: 7 | Y581: 6 | Z581: 0 | AA581: 806 | AB581: 644 | AC581: 125.15527950310559 | AD581: 28
W582: FOOTSCRAY | X582: 6 | Y582: 7 | Z582: 0 | AA582: 756 | AB582: 581 | AC582: 130.12048192771084 | AD582: 24
A583: WILLIAMSTOWN | C583: 5 | D583: 3 | E583: =C583*6+D583 -> 33 | G583: 6 | H583: 6 | I583: =G583*6+H583 -> 42 | K583: 6 | L583: 8 | M583: =K583*6+L583 -> 44 | O583: 9 | P583: 10 | Q583: =O583*6+P583 -> 64 | S583: WILLIAMSTOWN | W583: PORT MELBOURNE | X583: 6 | Y583: 7 | Z583: 0 | AA583: 707 | AB583: 761 | AC583: 92.904073587385014 | AD583: 24
A584: PORT MELBOURNE | C584: 0 | D584: 5 | E584: =C584*6+D584 -> 5 | G584: 0 | H584: 9 | I584: =G584*6+H584 -> 9 | K584: 2 | L584: 10 | M584: =K584*6+L584 -> 22 | O584: 5 | P584: 12 | Q584: =O584*6+P584 -> 42 | S584: HOOD | W584: BRIGHTON | X584: 4 | Y584: 9 | Z584: 0 | AA584: 684 | AB584: 799 | AC584: 85.607008760951189 | AD584: 16
A585: BEST PLAYERS | W585: NORTHCOTE | X585: 3 | Y585: 10 | Z585: 0 | AA585: 592 | AB585: 964 | AC585: 61.410788381742741 | AD585: 12
A586: WILLIAMSTOWN | C586: GIBBS | F586: JULIAN | I586: LITCHFIELD | L586: ALLEY | N586: McKENZIE | Q586: McNEILAGE | W586: PRESTON | X586: 0 | Y586: 13 | Z586: 0 | AA586: 443 | AB586: 1435 | AC586: 30.871080139372822 | AD586: 0
A587: PORT MELBOURNE | C587: TREGLOWN | F587: SAMPSON | I587: DANKS | L587: BROWN | N587: McGEE | Q587: PASH
A588: GOALKICKERS
A589: WILLIAMSTOWN | C589: MATTHEWS 2 | G589: KERR 2 | J589: AMY 2 | L589: LITCHFIELD 2 | P589: McINTYRE
A590: PORT MELBOURNE | C590: BENNION 2 | G590: McGEE | J590: HUTCHINSON | M590: PASH
A592: FOOTSCRAY | C592: 5 | D592: 5 | E592: =C592*6+D592 -> 35 | G592: 10 | H592: 9 | I592: =G592*6+H592 -> 69 | K592: 12 | L592: 12 | M592: =K592*6+L592 -> 84 | O592: 17 | P592: 25 | Q592: =O592*6+P592 -> 127 | S592: FOOTSCRAY
A593: PRESTON | C593: 2 | D593: 0 | E593: =C593*6+D593 -> 12 | G593: 2 | H593: 1 | I593: =G593*6+H593 -> 13 | K593: 3 | L593: 2 | M593: =K593*6+L593 -> 20 | O593: 3 | P593: 2 | Q593: =O593*6+P593 -> 20 | S593: JOHNSON
A594: BEST PLAYERS
A595: FOOTSCRAY | C595: OGILVIE | G595: BAXTER | J595: BANBURY | M595: WHITE | P595: LAMPRELL | S595: MADDEN
A596: PRESTON | C596: SPENCE | G596: SMITH | J596: ENRIGHT | M596: FAWCETT | P596: DANIELS | S596: J STEPHENS
A597: GOALKICKERS
A598: FOOTSCRAY | C598: LAMPRELL 5 | F598: MADDEN 4 | I598: HANSON 3 | L598: OGILVIE 2 | O598: BAXTER | Q598: KNIGHT | S598: BORTHWICK
A599: PRESTON | C599: SMITH | F599: J STEPHENS | J599: FAWCETT
A601: ESSENDON ASSOC. | C601: 2 | D601: 4 | E601: =C601*6+D601 -> 16 | G601: 7 | H601: 5 | I601: =G601*6+H601 -> 47 | K601: 10 | L601: 5 | M601: =K601*6+L601 -> 65 | O601: 16 | P601: 10 | Q601: =O601*6+P601 -> 106 | S601: BRIGHTON
A602: BRIGHTON | C602: 0 | D602: 1 | E602: =C602*6+D602 -> 1 | G602: 1 | H602: 2 | I602: =G602*6+H602 -> 8 | K602: 2 | L602: 4 | M602: =K602*6+L602 -> 16 | O602: 5 | P602: 8 | Q602: =O602*6+P602 -> 38 | S602: KENDALL
A603: BEST PLAYERS
A604: ESSENDON ASSOC. | C604: PAIN | F604: GIBSON | I604: WALKER | L604: McNAMARA | O604: McCANN | R604: MADDEN
A605: BRIGHTON | C605: BRIDGEFORD | F605: BARWICK | I605: B BAILES | L605: JOHNSON | O605: MANN
A606: GOALKICKERS
A607: ESSENDON ASSOC. | C607: McCANN 4 | F607: McNAMARA 3 | J607: CLARKE 3 | M607: WALKER 2 | P607: F ABBOTT 2 | S607: WARBURTON 2
A608: BRIGHTON | C608: PLAISTED 2 | G608: B BAILES | J608: M KUSCHERT
A610: BRUNSWICK | C610: 3 | D610: 4 | E610: =C610*6+D610 -> 22 | G610: 9 | H610: 8 | I610: =G610*6+H610 -> 62 | K610: 12 | L610: 10 | M610: =K610*6+L610 -> 82 | O610: 17 | P610: 16 | Q610: =O610*6+P610 -> 118 | S610: CROXTON PK
A611: NORTHCOTE | C611: 1 | D611: 3 | E611: =C611*6+D611 -> 9 | G611: 1 | H611: 7 | I611: =G611*6+H611 -> 13 | K611: 3 | L611: 12 | M611: =K611*6+L611 -> 30 | O611: 5 | P611: 13 | Q611: =O611*6+P611 -> 43 | S611: HURLEY
A612: BEST PLAYERS
A613: BRUNSWICK | C613: PRICE | F613: L BRAID | I613: MILLS | L613: THOMSON | O613: ROSS | R613: STEPHENSON
A614: NORTHCOTE | C614: G WALKER | F614: DANIELS | I614: CHESSWASS | L614: HOMEWOOD | O614: MONOHAN
A615: GOALKICKERS
A616: BRUNSWICK | C616: CORRIGAN 5 | F616: STEPHENSON 4 | I616: MARSH 2 | K616: MILLS | M616: PRICE | O616: BOURKE | Q616: KYME | S616: THOMSON | W616: McLEAN
A617: NORTHCOTE | C617: DANIELS 3 | G617: WHITMORE | J617: RYAN
A619: ROUND 14 | E619: 6TH AUGUST | J619: WEATHER | M619: FINE | S619: PLAYED AT | X619: LADDER | AB619: ROUND | AD619: 14
D620: 1ST QTR | H620: 2ND QTR | L620: 3RD QTR | P620: FINAL | S620: TOORAK PARK
A621: PRAHRAN | C621: 1 | D621: 1 | E621: =C621*6+D621 -> 7 | G621: 5 | H621: 5 | I621: =G621*6+H621 -> 35 | K621: 7 | L621: 6 | M621: =K621*6+L621 -> 48 | O621: 10 | P621: 9 | Q621: =O621*6+P621 -> 69 | S621: UMPIRE | W621: TEAM | X621: W | Y621: L | Z621: D | AA621: FOR | AB621: AGST | AC621: % | AD621: PTS
A622: WILLIAMSTOWN | C622: 3 | D622: 2 | E622: =C622*6+D622 -> 20 | G622: 4 | H622: 3 | I622: =G622*6+H622 -> 27 | K622: 7 | L622: 6 | M622: =K622*6+L622 -> 48 | O622: 8 | P622: 7 | Q622: =O622*6+P622 -> 55 | S622: KENDALL
A623: BEST PLAYERS | W623: NORTH MELBOURNE | X623: 13 | Y623: 0 | Z623: 1 | AA623: 1022 | AB623: 479 | AC623: 213.36116910229646 | AD623: 54
A624: PRAHRAN | C624: STEWART | F624: WOODS | I624: HALL | L624: DARBY | O624: NEILL | Q624: MARONEY | W624: ESSENDON ASSOC. | X624: 11 | Y624: 2 | Z624: 1 | AA624: 955 | AB624: 558 | AC624: 171.14695340501791 | AD624: 46
A625: WILLIAMSTOWN | C625: ROURKE | F625: JULIAN | I625: GIBBS | L625: DAVIES | O625: ALLEY | Q625: AMY | W625: BRUNSWICK | X625: 10 | Y625: 4 | Z625: 0 | AA625: 926 | AB625: 645 | AC625: 143.56589147286823 | AD625: 40
A626: GOALKICKERS | W626: PRAHRAN | X626: 8 | Y626: 6 | Z626: 0 | AA626: 887 | AB626: 660 | AC626: 134.39393939393941 | AD626: 32
A627: PRAHRAN | C627: NORMAN 3 | F627: SYKES 3 | I627: PANNAM | K627: DARBY | M627: DOWDING | O627: NEILL
A628: WILLIAMSTOWN | C628: KERR 3 | F628: GIBBS 2 | I628: McINTYRE | L628: ROURKE | O628: MATTHEWS | W628: WILLIAMSTOWN | X628: 7 | Y628: 7 | Z628: 0 | AA628: 861 | AB628: 713 | AC628: 120.75736325385694 | AD628: 28
W629: PORT MELBOURNE | X629: 7 | Y629: 7 | Z629: 0 | AA629: 799 | AB629: 818 | AC629: 97.677261613691925 | AD629: 28
A630: BRUNSWICK | C630: 2 | D630: 5 | E630: =C630*6+D630 -> 17 | G630: 9 | H630: 8 | I630: =G630*6+H630 -> 62 | K630: 12 | L630: 10 | M630: =K630*6+L630 -> 82 | O630: 19 | P630: 13 | Q630: =O630*6+P630 -> 127 | S630: BRUNSWICK | W630: FOOTSCRAY | X630: 6 | Y630: 8 | Z630: 0 | AA630: 817 | AB630: 708 | AC630: 115.39548022598871 | AD630: 24
A631: FOOTSCRAY | C631: 2 | D631: 1 | E631: =C631*6+D631 -> 13 | G631: 2 | H631: 6 | I631: =G631*6+H631 -> 18 | K631: 6 | L631: 12 | M631: =K631*6+L631 -> 48 | O631: 8 | P631: 13 | Q631: =O631*6+P631 -> 61 | S631: HURLEY | W631: BRIGHTON | X631: 4 | Y631: 10 | Z631: 0 | AA631: 720 | AB631: 891 | AC631: 80.808080808080803 | AD631: 16
A632: BEST PLAYERS | W632: NORTHCOTE | X632: 3 | Y632: 11 | Z632: 0 | AA632: 649 | AB632: 1056 | AC632: 61.458333333333336 | AD632: 12
A633: BRUNSWICK | C633: CHASE | F633: CORRIGAN | I633: BOURKE | L633: JOHNSON | O633: KYME | Q633: STEPHENSON | W633: PRESTON | X633: 0 | Y633: 14 | Z633: 0 | AA633: 464 | AB633: 1572 | AC633: 29.516539440203562 | AD633: 0
A634: FOOTSCRAY | C634: PATTINSON | F634: BORTHWICK | I634: BATTY | L634: OGILVIE | O634: HANSON | Q634: KNIGHT
A635: GOALKICKERS
A636: BRUNSWICK | C636: CHASE 5 | E636: BOURKE 3 | G636: McKENZIE 2 | J636: THOMSON 2 | M636: STEPHENSON 2 | P636: PRICE 2 | R636: MARSH | U636: JOHNSON | X636: CORRIGAN
A637: FOOTSCRAY | C637: LAMPRELL 2 | F637: BANBURY 2 | I637: BAXTER | K637: MADDEN | M637: KNIGHT | O637: COTTON
A639: PORT MELBOURNE | C639: 4 | D639: 2 | E639: =C639*6+D639 -> 26 | G639: 7 | H639: 5 | I639: =G639*6+H639 -> 47 | K639: 10 | L639: 9 | M639: =K639*6+L639 -> 69 | O639: 13 | P639: 14 | Q639: =O639*6+P639 -> 92 | S639: PORT MELB
A640: NORTHCOTE | C640: 1 | D640: 4 | E640: =C640*6+D640 -> 10 | G640: 3 | H640: 6 | I640: =G640*6+H640 -> 24 | K640: 5 | L640: 7 | M640: =K640*6+L640 -> 37 | O640: 8 | P640: 9 | Q640: =O640*6+P640 -> 57 | S640: HOOD
A641: BEST PLAYERS
A642: PORT MELBOURNE | C642: CLEELAND | F642: SAMPSON | I642: McDONALD | L642: NEWLING | O642: BENNION | R642: HUTCHINSON
A643: NORTHCOTE | C643: G WALKER | F643: COLE | I643: BECK | L643: RYAN | O643: DANIELS | R643: CHESSWASS
A644: GOALKICKERS
A645: PORT MELBOURNE | C645: HUTCHINSON 7 | G645: BENNION 2 | J645: CLARKE 2 | M645: TREGLOWN | P645: BROWN
A646: NORTHCOTE | C646: RYAN 3 | F646: CHESSWASS | I646: BECK | K646: ARBUTHNOT | N646: MINTO | P646: HOMEWOOD
A648: NORTH MELBOURNE | C648: 2 | D648: 5 | E648: =C648*6+D648 -> 17 | G648: 6 | H648: 8 | I648: =G648*6+H648 -> 44 | K648: 7 | L648: 15 | M648: =K648*6+L648 -> 57 | O648: 12 | P648: 20 | Q648: =O648*6+P648 -> 92 | S648: BRIGHTON
A649: BRIGHTON | C649: 3 | D649: 1 | E649: =C649*6+D649 -> 19 | G649: 4 | H649: 3 | I649: =G649*6+H649 -> 27 | K649: 5 | L649: 5 | M649: =K649*6+L649 -> 35 | O649: 5 | P649: 6 | Q649: =O649*6+P649 -> 36 | S649: ALLEY
A650: BEST PLAYERS
A651: NORTH MELBOURNE | C651: J JOHNSON | F651: ELLIOTT | I651: JINKS | L651: CAINE | O651: HAMMOND | R651: BARKER
A652: BRIGHTON | C652: E BAILES | F652: A LAXTON | I652: KENNEDY | L652: NEYLON | O652: WENBORN | R652: B BAILES
A653: GOALKICKERS
A654: NORTH MELBOURNE | C654: CAINE 4 | F654: ELLIOTT 3 | I654: J JOHNSON | L654: HOMAN | N654: SHEA | P654: GIBNEY
A655: BRIGHTON | C655: PLAISTED 2 | F655: GORMAN | I655: M KUSCHERT | L655: B BAILES
A657: ESSENDON ASSOC. | C657: 2 | D657: 4 | E657: =C657*6+D657 -> 16 | G657: 9 | H657: 7 | I657: =G657*6+H657 -> 61 | K657: 12 | L657: 12 | M657: =K657*6+L657 -> 84 | O657: 20 | P657: 17 | Q657: =O657*6+P657 -> 137 | S657: PRESTON
A658: PRESTON | C658: 0 | D658: 0 | E658: =C658*6+D658 -> 0 | G658: 1 | H658: 1 | I658: =G658*6+H658 -> 7 | K658: 3 | L658: 3 | M658: =K658*6+L658 -> 21 | O658: 3 | P658: 3 | Q658: =O658*6+P658 -> 21 | S658: CURWOOD
A659: BEST PLAYERS
A660: ESSENDON ASSOC. | C660: GIBSON | F660: McNAMARA | I660: HOARE | L660: MADDEN | O660: MAINE | R660: ATKINS
A661: PRESTON | C661: J STEPHENS | F661: S HALL | I661: BILLINGS | L661: W PUNCH | O661: ENRIGHT | R661: WARD
A662: GOALKICKERS
A663: ESSENDON ASSOC. | C663: F ABBOTT 6 | F663: McNAMARA 3 | I663: CLARKE 3 | K663: HOARE 2 | M663: GIBSON 2 | O663: GOUGH 2 | Q663: McCANN | S663: MORRISON
A664: PRESTON | C664: HAMILL | F664: J STEPHENS | I664: V PUNCH
A666: ROUND 15 | E666: 13TH AUGUST | J666: WEATHER | M666: FINE | S666: PLAYED AT | X666: LADDER | AB666: ROUND | AD666: 15
D667: 1ST QTR | H667: 2ND QTR | L667: 3RD QTR | P667: FINAL | S667: ESSENDON
A668: ESSENDON ASSOC. | C668: 4 | D668: 4 | E668: =C668*6+D668 -> 28 | G668: 7 | H668: 5 | I668: =G668*6+H668 -> 47 | K668: 11 | L668: 6 | M668: =K668*6+L668 -> 72 | O668: 14 | P668: 8 | Q668: =O668*6+P668 -> 92 | S668: UMPIRE | W668: TEAM | X668: W | Y668: L | Z668: D | AA668: FOR | AB668: AGST | AC668: % | AD668: PTS
A669: PRAHRAN | C669: 2 | D669: 1 | E669: =C669*6+D669 -> 13 | G669: 4 | H669: 3 | I669: =G669*6+H669 -> 27 | K669: 5 | L669: 7 | M669: =K669*6+L669 -> 37 | O669: 5 | P669: 11 | Q669: =O669*6+P669 -> 41 | S669: HURLEY
A670: BEST PLAYERS | W670: NORTH MELBOURNE | X670: 14 | Y670: 0 | Z670: 1 | AA670: 1108 | AB670: 523 | AC670: 211.85468451242829 | AD670: 58
A671: ESSENDON ASSOC. | C671: MCNAMARA | F671: MADDEN | I671: LEWIS | K671: HAMBRIDGE | N671: GOUGH | Q671: PAIN | W671: ESSENDON ASSOC. | X671: 12 | Y671: 2 | Z671: 1 | AA671: 1047 | AB671: 599 | AC671: 174.79131886477464 | AD671: 50
A672: PRAHRAN | C672: CARLSON | F672: DARBY | I672: DOWSING | K672: NORMAN | N672: MARONEY | Q672: H WILSON | W672: BRUNSWICK | X672: 11 | Y672: 4 | Z672: 0 | AA672: 1048 | AB672: 676 | AC672: 155.02958579881656 | AD672: 44
A673: GOALKICKERS | W673: PRAHRAN | X673: 8 | Y673: 7 | Z673: 0 | AA673: 928 | AB673: 752 | AC673: 123.40425531914893 | AD673: 32
A674: ESSENDON ASSOC. | C674: McNAMARA 9 | G674: GOUGH 2 | J674: CLARKE 2 | M674: HOARE
A675: PRAHRAN | C675: FARMER 2 | G675: DOWDING 2 | K675: NORMAN | W675: PORT MELBOURNE | X675: 8 | Y675: 7 | Z675: 0 | AA675: 857 | AB675: 869 | AC675: 98.619102416570769 | AD675: 32
W676: FOOTSCRAY | X676: 7 | Y676: 8 | Z676: 0 | AA676: 903 | AB676: 775 | AC676: 116.51612903225806 | AD676: 28
A677: NORTH MELBOURNE | C677: 4 | D677: 4 | E677: =C677*6+D677 -> 28 | G677: 7 | H677: 4 | I677: =G677*6+H677 -> 46 | K677: 10 | L677: 6 | M677: =K677*6+L677 -> 66 | O677: 13 | P677: 8 | Q677: =O677*6+P677 -> 86 | S677: NORTH MELB | W677: WILLIAMSTOWN | X677: 7 | Y677: 8 | Z677: 0 | AA677: 905 | AB677: 799 | AC677: 113.2665832290363 | AD677: 28
A678: WILLIAMSTOWN | C678: 0 | D678: 1 | E678: =C678*6+D678 -> 1 | G678: 4 | H678: 3 | I678: =G678*6+H678 -> 27 | K678: 6 | L678: 5 | M678: =K678*6+L678 -> 41 | O678: 6 | P678: 8 | Q678: =O678*6+P678 -> 44 | S678: KENDALL | W678: BRIGHTON | X678: 4 | Y678: 11 | Z678: 0 | AA678: 771 | AB678: 949 | AC678: 81.243414120126445 | AD678: 16
A679: BEST PLAYERS | W679: NORTHCOTE | X679: 3 | Y679: 12 | Z679: 0 | AA679: 716 | AB679: 1142 | AC679: 62.697022767075303 | AD679: 12
A680: NORTH MELBOURNE | C680: CAINE | F680: G JOHNSON | I680: HAMMOND | L680: HARDY | O680: HOPKINS | Q680: BARKER | W680: PRESTON | X680: 0 | Y680: 15 | Z680: 0 | AA680: 495 | AB680: 1694 | AC680: 29.220779220779221 | AD680: 0
A681: WILLIAMSTOWN | C681: BENNETT | F681: ROURKE | I681: ALLEY | L681: REITMAN | O681: JULIAN | Q681: ELDRIEGE
A682: GOALKICKERS
A683: NORTH MELBOURNE | C683: CAINE 6 | F683: ELLIOTT 3 | J683: HANSEN | L683: HAMMOND | O683: BARKER | R683: JINKS
A684: WILLIAMSTOWN | C684: LEONARD | F684: ELDRIEDGE | J684: AMY | L684: GIBBS | O684: BENNETT | R684: McINTYRE
A686: PORT MELBOURNE | C686: 2 | D686: 2 | E686: =C686*6+D686 -> 14 | G686: 4 | H686: 5 | I686: =G686*6+H686 -> 29 | K686: 5 | L686: 7 | M686: =K686*6+L686 -> 37 | O686: 8 | P686: 10 | Q686: =O686*6+P686 -> 58 | S686: PORT MELB
A687: BRIGHTON | C687: 1 | D687: 2 | E687: =C687*6+D687 -> 8 | G687: 3 | H687: 2 | I687: =G687*6+H687 -> 20 | K687: 6 | L687: 8 | M687: =K687*6+L687 -> 44 | O687: 7 | P687: 9 | Q687: =O687*6+P687 -> 51 | S687: CURWOOD
A688: BEST PLAYERS
A689: PORT MELBOURNE | C689: BENNION | F689: MAYNARD | I689: MALLETT | L689: TREGLOWN | O689: HUTCHINSON | R689: NEWLING
A690: BRIGHTON | C690: BARWICK | F690: WENBORN | I690: RICHARDSON | L690: PLAISTED | O690: GORMAN | R690: A LAXTON
A691: GOALKICKERS
A692: PORT MELBOURNE | C692: HUTCHINSON 3 | G692: BENNION 2 | J692: BROWN | M692: McMURRAY | P692: TREGLOWN
A693: BRIGHTON | C693: BARWICK 2 | G693: E BAILES 2 | K693: GORMAN | N693: McMEIKAN | Q693: PLAISTED
A695: FOOTSCRAY | C695: 3 | D695: 2 | E695: =C695*6+D695 -> 20 | G695: 6 | H695: 3 | I695: =G695*6+H695 -> 39 | K695: 9 | L695: 4 | M695: =K695*6+L695 -> 58 | O695: 13 | P695: 8 | Q695: =O695*6+P695 -> 86 | S695: CROXTON PK
A696: NORTHCOTE | C696: 1 | D696: 5 | E696: =C696*6+D696 -> 11 | G696: 6 | H696: 10 | I696: =G696*6+H696 -> 46 | K696: 6 | L696: 10 | M696: =K696*6+L696 -> 46 | O696: 9 | P696: 13 | Q696: =O696*6+P696 -> 67 | S696: HUME
A697: BEST PLAYERS
A698: FOOTSCRAY | C698: COTTON | F698: OGILVIE | I698: BAXTER | L698: NASH | O698: KNIGHT | R698: HARRIS
A699: NORTHCOTE | C699: DANIELS | F699: COLE | I699: BECK | L699: SCOTT | O699: CHESSWASS | R699: G WALKER
A700: GOALKICKERS
A701: FOOTSCRAY | C701: KNIGHT 4 | E701: LAMPRELL 3 | H701: COTTON 2 | K701: BAXTER 2 | N701: BANBURY | Q701: W McCARTHY
A702: NORTHCOTE | C702: CHESSWASS 3 | G702: RYAN 3 | J702: BECK 2 | M702: SCOTT
A704: BRUNSWICK | C704: 2 | D704: 8 | E704: =C704*6+D704 -> 20 | G704: 5 | H704: 13 | I704: =G704*6+H704 -> 43 | K704: 14 | L704: 17 | M704: =K704*6+L704 -> 101 | O704: 17 | P704: 20 | Q704: =O704*6+P704 -> 122 | S704: BRUNSWICK
A705: PRESTON | C705: 0 | D705: 0 | E705: =C705*6+D705 -> 0 | G705: 0 | H705: 2 | I705: =G705*6+H705 -> 2 | K705: 1 | L705: 4 | M705: =K705*6+L705 -> 10 | O705: 4 | P705: 7 | Q705: =O705*6+P705 -> 31 | S705: HOOD
A706: BEST PLAYERS
A707: BRUNSWICK | C707: STANCLIFFE | F707: McKENZIE | I707: CHASE | L707: MARSH | O707: BOURKE | R707: JOHNSON
A708: PRESTON | C708: S HALL | F708: SPENCE | I708: WHITE | L708: DUNCAN | O708: BASSETT | R708: ENRIGHT
A709: GOALKICKERS
A710: BRUNSWICK | C710: CHASE 7 | F710: BOURKE 5 | I710: STEPHENSON 2 | M710: McLEAN | O710: THOMSON | R710: McKENZIE
A711: PRESTON | C711: BASSETT | F711: SMITH | I711: V PUNCH | L711: WHITE
A713: ROUND 16 | E713: 20TH AUGUST | J713: WEATHER | M713: STRONG NORTH WIND | S713: PLAYED AT | X713: LADDER | AB713: ROUND | AD713: 16
D714: 1ST QTR | H714: 2ND QTR | L714: 3RD QTR | P714: FINAL | S714: NORTH MELB
A715: BRUNSWICK | C715: 0 | D715: 0 | E715: =C715*6+D715 -> 0 | G715: 2 | H715: 6 | I715: =G715*6+H715 -> 18 | K715: 2 | L715: 6 | M715: =K715*6+L715 -> 18 | O715: 6 | P715: 11 | Q715: =O715*6+P715 -> 47 | S715: UMPIRE | W715: TEAM | X715: W | Y715: L | Z715: D | AA715: FOR | AB715: AGST | AC715: % | AD715: PTS
A716: NORTH MELBOURNE | C716: 3 | D716: 1 | E716: =C716*6+D716 -> 19 | G716: 3 | H716: 2 | I716: =G716*6+H716 -> 20 | K716: 7 | L716: 3 | M716: =K716*6+L716 -> 45 | O716: 7 | P716: 4 | Q716: =O716*6+P716 -> 46 | S716: KENDALL
A717: BEST PLAYERS | W717: NORTH MELBOURNE | X717: 14 | Y717: 1 | Z717: 1 | AA717: 1154 | AB717: 570 | AC717: 202.45614035087721 | AD717: 58
A718: BRUNSWICK | C718: McKENZIE | F718: CHASE | I718: JOHNSON | L718: CARRIE | O718: PRICE | Q718: THOMSON | W718: ESSENDON ASSOC. | X718: 13 | Y718: 2 | Z718: 1 | AA718: 1072 | AB718: 622 | AC718: 172.34726688102893 | AD718: 54
A719: NORTH MELBOURNE | C719: G JOHNSON | F719: HARDY | I719: HAMMOND | L719: MARSH | O719: JINKS | Q719: TRELOAR | W719: BRUNSWICK | X719: 12 | Y719: 4 | Z719: 0 | AA719: 1095 | AB719: 722 | AC719: 151.66204986149583 | AD719: 48
A720: GOALKICKERS | W720: PRAHRAN | X720: 9 | Y720: 7 | Z720: 0 | AA720: 1011 | AB720: 799 | AC720: 126.53316645807259 | AD720: 36
A721: BRUNSWICK | C721: CORRIGAN | F721: PRICE | I721: THOMSON | L721: CHASE | N721: STEPHENSON | Q721: McKENZIE
A722: NORTH MELBOURNE | C722: CAINE 3 | F722: HAMMOND 2 | J722: WILLIAMSON | M722: HOPKINS | W722: PORT MELBOURNE | X722: 9 | Y722: 7 | Z722: 0 | AA722: 950 | AB722: 918 | AC722: 103.48583877995642 | AD722: 36
W723: FOOTSCRAY | X723: 8 | Y723: 8 | Z723: 0 | AA723: 959 | AB723: 813 | AC723: 117.95817958179582 | AD723: 32
A724: ESSENDON ASSOC. | C724: 1 | D724: 0 | E724: =C724*6+D724 -> 6 | G724: 3 | H724: 4 | I724: =G724*6+H724 -> 22 | K724: 3 | L724: 4 | M724: =K724*6+L724 -> 22 | O724: 3 | P724: 7 | Q724: =O724*6+P724 -> 25 | S724: WILLIAMSTOWN | W724: WILLIAMSTOWN | X724: 7 | Y724: 9 | Z724: 0 | AA724: 928 | AB724: 824 | AC724: 112.62135922330097 | AD724: 28
A725: WILLIAMSTOWN | C725: 2 | D725: 2 | E725: =C725*6+D725 -> 14 | G725: 2 | H725: 3 | I725: =G725*6+H725 -> 15 | K725: 2 | L725: 9 | M725: =K725*6+L725 -> 21 | O725: 2 | P725: 11 | Q725: =O725*6+P725 -> 23 | S725: HURLEY | W725: BRIGHTON | X725: 4 | Y725: 12 | Z725: 0 | AA725: 809 | AB725: 1005 | AC725: 80.49751243781094 | AD725: 16
A726: BEST PLAYERS | W726: NORTHCOTE | X726: 3 | Y726: 13 | Z726: 0 | AA726: 763 | AB726: 1225 | AC726: 62.285714285714285 | AD726: 12
A727: ESSENDON ASSOC. | C727: MAINE | F727: MADDEN | I727: ANDREWS | L727: LEWIS | O727: PAIN | Q727: GIBSON | W727: PRESTON | X727: 0 | Y727: 16 | Z727: 0 | AA727: 544 | AB727: 1787 | AC727: 30.442081701175155 | AD727: 0
A728: WILLIAMSTOWN | C728: REITMAN | F728: GIBBS | I728: BENNETT | L728: ROURKE | O728: ELDRIDGE | Q728: DAVIES
A729: GOALKICKERS
A730: ESSENDON ASSOC. | C730: HAMBRIDGE | G730: CLARKE | J730: FORMBY
A731: WILLIAMSTOWN | C731: DAVIES | G731: MATTHEWS
A733: FOOTSCRAY | C733: 4 | D733: 8 | E733: =C733*6+D733 -> 32 | G733: 4 | H733: 9 | I733: =G733*6+H733 -> 33 | K733: 6 | L733: 13 | M733: =K733*6+L733 -> 49 | O733: 7 | P733: 14 | Q733: =O733*6+P733 -> 56 | S733: FOOTSCRAY
A734: BRIGHTON | C734: 0 | D734: 1 | E734: =C734*6+D734 -> 1 | G734: 3 | H734: 5 | I734: =G734*6+H734 -> 23 | K734: 3 | L734: 6 | M734: =K734*6+L734 -> 24 | O734: 5 | P734: 8 | Q734: =O734*6+P734 -> 38 | S734: HUME
A735: BEST PLAYERS
A736: FOOTSCRAY | C736: OGILVIE | F736: COTTON | I736: HANSON | L736: BORTHWICK | O736: A GREGORY | R736: DUANE
A737: BRIGHTON | C737: W KUSCHERT | F737: B BAILES | I737: KENNEDY | L737: A LAXTON | O737: WENBORN | R737: GORMAN
A738: GOALKICKERS
A739: FOOTSCRAY | C739: COTTON 2 | G739: KNIGHT 2 | J739: LAMPRELL | M739: DUANE | P739: OGILVIE
A740: BRIGHTON | C740: B BAILES 2 | G740: GORMAN | J740: G ROBINSON | M740: McMEIKAN
A742: PORT MELBOURNE | C742: 3 | D742: 0 | E742: =C742*6+D742 -> 18 | G742: 8 | H742: 5 | I742: =G742*6+H742 -> 53 | K742: 8 | L742: 5 | M742: =K742*6+L742 -> 53 | O742: 14 | P742: 9 | Q742: =O742*6+P742 -> 93 | S742: PRESTON
A743: PRESTON | C743: 3 | D743: 3 | E743: =C743*6+D743 -> 21 | G743: 3 | H743: 3 | I743: =G743*6+H743 -> 21 | K743: 7 | L743: 7 | M743: =K743*6+L743 -> 49 | O743: 7 | P743: 7 | Q743: =O743*6+P743 -> 49 | S743: ALLEY
A744: BEST PLAYERS
A745: PORT MELBOURNE | C745: BROWN | F745: MALLETT | I745: ANDERSON | L745: HUTCHINSON | O745: LEWIS | R745: McGEE
A746: PRESTON | C746: S HALL | F746: DUNACAN | I746: WOOLEY | L746: HAMILL | O746: W PUNCH | R746: ENRIGHT
A747: GOALKICKERS
A748: PORT MELBOURNE | C748: HUTCHINSON 11 | G748: BENNION | J748: JACKSON | M748: MALLETT
A749: PRESTON | C749: V PUNCH 2 | F749: SMITH | H749: MOORE | J749: J STEPHENS | M749: HAMILL | O749: ENRIGHT
A751: PRAHRAN | C751: 1 | D751: 2 | E751: =C751*6+D751 -> 8 | G751: 6 | H751: 6 | I751: =G751*6+H751 -> 42 | K751: 8 | L751: 10 | M751: =K751*6+L751 -> 58 | O751: 11 | P751: 17 | Q751: =O751*6+P751 -> 83 | S751: TOORAK PARK
A752: NORTHCOTE | C752: 1 | D752: 2 | E752: =C752*6+D752 -> 8 | G752: 3 | H752: 4 | I752: =G752*6+H752 -> 22 | K752: 5 | L752: 5 | M752: =K752*6+L752 -> 35 | O752: 7 | P752: 5 | Q752: =O752*6+P752 -> 47 | S752: HOOD
A753: BEST PLAYERS
A754: PRAHRAN | C754: NORMAN | F754: TURNBULL | I754: STEWART | L754: DOWSING | O754: WARD | R754: H WILSON
A755: NORTHCOTE | C755: G WALKER | F755: COLE | I755: BARTLETT | L755: MINTO | O755: SCOTT | R755: DANIELS
A756: GOALKICKERS
A757: PRAHRAN | C757: DOWDING 3 | F757: SYKES 3 | H757: STUBBS | J757: PANNAM | L757: H WILSON | N757: TURNBULL | Q757: STEWART
A758: NORTHCOTE | C758: RYAN 2 | F758: COLE | H758: CHESSWASS | K758: BECK | M758: SMITH | O758: G WALKER
A760: ROUND 17 | E760: 27TH AUGUST | J760: WEATHER | M760: FINE | S760: PLAYED AT | X760: LADDER | AB760: ROUND | AD760: 17
D761: 1ST QTR | H761: 2ND QTR | L761: 3RD QTR | P761: FINAL | S761: BRUNSWICK
A762: BRUNSWICK | C762: 2 | D762: 10 | E762: =C762*6+D762 -> 22 | G762: 7 | H762: 10 | I762: =G762*6+H762 -> 52 | K762: 13 | L762: 14 | M762: =K762*6+L762 -> 92 | O762: 14 | P762: 16 | Q762: =O762*6+P762 -> 100 | S762: UMPIRE | W762: TEAM | X762: W | Y762: L | Z762: D | AA762: FOR | AB762: AGST | AC762: % | AD762: PTS
A763: PORT MELBOURNE | C763: 1 | D763: 1 | E763: =C763*6+D763 -> 7 | G763: 1 | H763: 7 | I763: =G763*6+H763 -> 13 | K763: 5 | L763: 10 | M763: =K763*6+L763 -> 40 | O763: 6 | P763: 14 | Q763: =O763*6+P763 -> 50 | S763: HURLEY
A764: BEST PLAYERS | W764: NORTH MELBOURNE | X764: 15 | Y764: 1 | Z764: 1 | AA764: 1313 | AB764: 577 | AC764: 227.55632582322357 | AD764: 62
A765: BRUNSWICK | C765: McKENZIE | F765: J JOHNSON | I765: STANCLIFFE | L765: KYME | O765: MILLS | Q765: CARRIE | W765: ESSENDON ASSOC. | X765: 14 | Y765: 2 | Z765: 1 | AA765: 1214 | AB765: 645 | AC765: 188.2170542635659 | AD765: 58
A766: PORT MELBOURNE | C766: FRANKLIN | F766: PASH | I766: TREGLOWN | L766: CLARKE | O766: MURDOCK | Q766: SAMPSON | W766: BRUNSWICK | X766: 13 | Y766: 4 | Z766: 0 | AA766: 1195 | AB766: 772 | AC766: 154.79274611398964 | AD766: 52
A767: GOALKICKERS | W767: PRAHRAN | X767: 10 | Y767: 7 | Z767: 0 | AA767: 1099 | AB767: 838 | AC767: 131.14558472553699 | AD767: 40
A768: BRUNSWICK | C768: BOURKE 3 | E768: McKENZIE 3 | H768: ROSS 2 | J768: J JOHNSON 2 | M768: McLEAN 2 | O768: MARSH | Q768: CORRIGAN
A769: PORT MELBOURNE | C769: HUTCHINSON 3 | H769: PASH 2 | K769: CLARKE | W769: FOOTSCRAY | X769: 9 | Y769: 8 | Z769: 0 | AA769: 1013 | AB769: 857 | AC769: 118.20303383897316 | AD769: 36
W770: PORT MELBOURNE | X770: 9 | Y770: 8 | Z770: 0 | AA770: 1000 | AB770: 1018 | AC770: 98.231827111984288 | AD770: 36
A771: FOOTSCRAY | C771: 2 | D771: 4 | E771: =C771*6+D771 -> 16 | G771: 3 | H771: 5 | I771: =G771*6+H771 -> 23 | K771: 4 | L771: 7 | M771: =K771*6+L771 -> 31 | O771: 7 | P771: 12 | Q771: =O771*6+P771 -> 54 | S771: FOOTSCRAY | W771: WILLIAMSTOWN | X771: 7 | Y771: 10 | Z771: 0 | AA771: 972 | AB771: 878 | AC771: 110.70615034168564 | AD771: 28
A772: WILLIAMSTOWN | C772: 1 | D772: 3 | E772: =C772*6+D772 -> 9 | G772: 3 | H772: 4 | I772: =G772*6+H772 -> 22 | K772: 4 | L772: 7 | M772: =K772*6+L772 -> 31 | O772: 6 | P772: 8 | Q772: =O772*6+P772 -> 44 | S772: KENDALL | W772: BRIGHTON | X772: 4 | Y772: 13 | Z772: 0 | AA772: 848 | AB772: 1093 | AC772: 77.584629460201285 | AD772: 16
A773: BEST PLAYERS | W773: NORTHCOTE | X773: 3 | Y773: 14 | Z773: 0 | AA773: 786 | AB773: 1367 | AC773: 57.49817117776152 | AD773: 12
A774: FOOTSCRAY | C774: COTTON | F774: NASH | I774: BAXTER | K774: OGILVIE | N774: BANBURY | Q774: STEWART | W774: PRESTON | X774: 0 | Y774: 17 | Z774: 0 | AA774: 551 | AB774: 1946 | AC774: 28.314491264131551 | AD774: 0
A775: WILLIAMSTOWN | C775: REITMAN | F775: ELDRIDGE | I775: ALLEY | K775: JULIAN | N775: McNEILAGE | Q775: ROURKE
A776: GOALKICKERS
A777: FOOTSCRAY | C777: LAMPRELL 2 | G777: KNIGHT 2 | J777: BAXTER | M777: NASH | O777: COTTON
A778: WILLIAMSTOWN | C778: MATTHEWS 2 | G778: AMY 2 | J778: GIBBS | M778: McNEILAGE
A780: PRAHRAN | C780: 3 | D780: 3 | E780: =C780*6+D780 -> 21 | G780: 4 | H780: 5 | I780: =G780*6+H780 -> 29 | K780: 8 | L780: 9 | M780: =K780*6+L780 -> 57 | O780: 13 | P780: 10 | Q780: =O780*6+P780 -> 88 | S780: BRIGHTON
A781: BRIGHTON | C781: 0 | D781: 1 | E781: =C781*6+D781 -> 1 | G781: 3 | H781: 2 | I781: =G781*6+H781 -> 20 | K781: 4 | L781: 6 | M781: =K781*6+L781 -> 30 | O781: 5 | P781: 9 | Q781: =O781*6+P781 -> 39 | S781: HOOD
A782: BEST PLAYERS
A783: PRAHRAN | C783: CARLSON | F783: WOODS | I783: STEWART | L783: NORMAN | O783: PANNAM | R783: DOWSING
A784: BRIGHTON | C784: B BAILES | F784: A LAXTON | I784: NEYLAN | L784: G ROBINSON | O784: PLAISTED | R784: BRIDGEFORD
A785: GOALKICKERS
A786: PRAHRAN | C786: DOWDING 7 | G786: CONQUEST | J786: H WILSON | M786: FARMER | O786: MARONEY | Q786: PANNAM | T786: SYKES
A787: BRIGHTON | C787: G ROBINSON 2 | G787: RICHARDSON 2 | K787: PLAISTED
A789: ESSENDON ASSOC. | C789: 4 | D789: 5 | E789: =C789*6+D789 -> 29 | G789: 9 | H789: 13 | I789: =G789*6+H789 -> 67 | K789: 15 | L789: 20 | M789: =K789*6+L789 -> 110 | O789: 19 | P789: 28 | Q789: =O789*6+P789 -> 142 | S789: ESSENDON
A790: NORTHCOTE | C790: 1 | D790: 3 | E790: =C790*6+D790 -> 9 | G790: 1 | H790: 6 | I790: =G790*6+H790 -> 12 | K790: 2 | L790: 7 | M790: =K790*6+L790 -> 19 | O790: 2 | P790: 11 | Q790: =O790*6+P790 -> 23 | S790: HUME
A791: BEST PLAYERS
A792: ESSENDON ASSOC. | C792: McNAMARA | F792: MAINE | I792: MADDEN | L792: CLARKE | O792: FRENCH | Q792: BARTHOLEMEW
A793: NORTHCOTE | C793: SCOTT | F793: COLE | I793: G WALKER | L793: BECK | O793: RYAN | Q793: DANIELS
A794: GOALKICKERS
A795: ESSENDON ASSOC. | C795: CLARKE 8 | G795: McNAMARA 5 | K795: McCANN 5 | N795: HOARE
A796: NORTHCOTE | C796: SCOTT | F796: CHESSWASS
A798: NORTH MELBOURNE | C798: 7 | D798: 7 | E798: =C798*6+D798 -> 49 | G798: 11 | H798: 12 | I798: =G798*6+H798 -> 78 | K798: 19 | L798: 17 | M798: =K798*6+L798 -> 131 | O798: 23 | P798: 21 | Q798: =O798*6+P798 -> 159 | S798: PRESTON
A799: PRESTON | C799: 0 | D799: 0 | E799: =C799*6+D799 -> 0 | G799: 0 | H799: 0 | I799: =G799*6+H799 -> 0 | K799: 0 | L799: 0 | M799: =K799*6+L799 -> 0 | O799: 1 | P799: 1 | Q799: =O799*6+P799 -> 7 | S799: CURWOOD
A800: BEST PLAYERS
A801: NORTH MELBOURNE | C801: LAVER | F801: G JOHNSON | I801: McCANN | L801: J JOHNSON | O801: JINKS | Q801: BARKER
A802: PRESTON | C802: S HALL | F802: BILLINGS | I802: DUNCAN | L802: W PUNCH | O802: WHITE | Q802: ENRIGHT
A803: GOALKICKERS
A804: NORTH MELBOURNE | C804: CAINE 12 | G804: ELLIOTT 5 | J804: WILLIAMSON 2 | M804: JINKS | O804: LAVER | Q804: HOMAN | S804: J JOHNSON
A805: PRESTON | C805: ENRIGHT
A807: ROUND 18 | E807: 3RD SEPTEMBER | I807: WEATHER | L807: RAIN THROUGHOUT STRONG N WIND | S807: PLAYED AT | X807: LADDER | AB807: ROUND | AD807: 18
D808: 1ST QTR | H808: 2ND QTR | L808: 3RD QTR | P808: FINAL | S808: NORTH MELB
A809: ESSENDON ASSOC. | C809: 0 | D809: 1 | E809: =C809*6+D809 -> 1 | G809: 3 | H809: 3 | I809: =G809*6+H809 -> 21 | K809: 6 | L809: 3 | M809: =K809*6+L809 -> 39 | O809: 8 | P809: 4 | Q809: =O809*6+P809 -> 52 | S809: UMPIRE | W809: TEAM | X809: W | Y809: L | Z809: D | AA809: FOR | AB809: AGST | AC809: % | AD809: PTS
A810: NORTH MELBOURNE | C810: 2 | D810: 1 | E810: =C810*6+D810 -> 13 | G810: 3 | H810: 2 | I810: =G810*6+H810 -> 20 | K810: 4 | L810: 3 | M810: =K810*6+L810 -> 27 | O810: 4 | P810: 5 | Q810: =O810*6+P810 -> 29 | S810: KENDALL
A811: BEST PLAYERS | W811: NORTH MELBOURNE | X811: 15 | Y811: 2 | Z811: 1 | AA811: 1342 | AB811: 629 | AC811: 213.35453100158983 | AD811: 62
A812: ESSENDON ASSOC. | C812: MADDEN | F812: MAINE | I812: BUSBRIDGE | L812: GIBSON | N812: GOUGH | Q812: CHAPMAN | W812: ESSENDON ASSOC. | X812: 15 | Y812: 2 | Z812: 1 | AA812: 1266 | AB812: 674 | AC812: 187.83382789317508 | AD812: 62
A813: NORTH MELBOURNE | C813: GIBNEY | F813: HOMAN | I813: SPEAKMAN | L813: JINKS | N813: PEMBERTON | Q813: HERON | W813: BRUNSWICK | X813: 14 | Y813: 4 | Z813: 0 | AA813: 1254 | AB813: 800 | AC813: 156.75 | AD813: 56
A814: GOALKICKERS | W814: PRAHRAN | X814: 11 | Y814: 7 | Z814: 0 | AA814: 1272 | AB814: 865 | AC814: 147.05202312138729 | AD814: 44
A815: ESSENDON ASSOC. | C815: CLARKE 3 | F815: BUSBRIDGE 2 | J815: HOARE | M815: CHAPMAN | P815: HAMBRIDGE
A816: NORTH MELBOURNE | C816: CAINE 2 | F816: JINKS | I816: WILLIAMSON | W816: PORT MELBOURNE | X816: 10 | Y816: 8 | Z816: 0 | AA816: 1037 | AB816: 1049 | AC816: 98.856053384175411 | AD816: 40
W817: FOOTSCRAY | X817: 9 | Y817: 9 | Z817: 0 | AA817: 1044 | AB817: 894 | AC817: 116.77852348993288 | AD817: 36
A818: PORT MELBOURNE | C818: 0 | D818: 1 | E818: =C818*6+D818 -> 1 | G818: 0 | H818: 2 | I818: =G818*6+H818 -> 2 | K818: 3 | L818: 5 | M818: =K818*6+L818 -> 23 | O818: 5 | P818: 7 | Q818: =O818*6+P818 -> 37 | S818: PORT MELB | W818: WILLIAMSTOWN | X818: 8 | Y818: 10 | Z818: 0 | AA818: 1018 | AB818: 922 | AC818: 110.41214750542299 | AD818: 32
A819: FOOTSCRAY | C819: 3 | D819: 2 | E819: =C819*6+D819 -> 20 | G819: 4 | H819: 2 | I819: =G819*6+H819 -> 26 | K819: 4 | L819: 5 | M819: =K819*6+L819 -> 29 | O819: 4 | P819: 7 | Q819: =O819*6+P819 -> 31 | S819: HUME | W819: BRIGHTON | X819: 4 | Y819: 14 | Z819: 0 | AA819: 876 | AB819: 1152 | AC819: 76.041666666666671 | AD819: 16
A820: BEST PLAYERS | W820: NORTHCOTE | X820: 3 | Y820: 15 | Z820: 0 | AA820: 830 | AB820: 1413 | AC820: 58.740268931351736 | AD820: 12
A821: PORT MELBOURNE | C821: GEDDES | F821: FRANKLIN | I821: McDONALD | L821: MURDOCK | O821: McGEE | Q821: TREGLOWN | W821: PRESTON | X821: 0 | Y821: 18 | Z821: 0 | AA821: 578 | AB821: 2119 | AC821: 27.277017461066542 | AD821: 0
A822: FOOTSCRAY | C822: ANSH | F822: HANSON | I822: OGILVIE | L822: TIPPETT | O822: COTTON | Q822: A GREGORY
A823: GOALKICKERS
A824: PORT MELBOURNE | C824: HUTCHINSON 3 | H824: GEDDES 2
A825: FOOTSCRAY | C825: KNIGHT 2 | G825: A GREGORY | K825: LAMPRELL
A827: WILLIAMSTOWN | C827: 1 | D827: 4 | E827: =C827*6+D827 -> 10 | G827: 2 | H827: 4 | I827: =G827*6+H827 -> 16 | K827: 6 | L827: 8 | M827: =K827*6+L827 -> 44 | O827: 6 | P827: 10 | Q827: =O827*6+P827 -> 46 | S827: CROXTON PK
A828: NORTHCOTE | C828: 1 | D828: 2 | E828: =C828*6+D828 -> 8 | G828: 3 | H828: 5 | I828: =G828*6+H828 -> 23 | K828: 5 | L828: 7 | M828: =K828*6+L828 -> 37 | O828: 6 | P828: 8 | Q828: =O828*6+P828 -> 44 | S828: ALLEY
A829: BEST PLAYERS
A830: WILLIAMSTOWN | C830: WEIDNER | F830: ELDRIDGE | I830: ROURKE | L830: McNEILAGE | O830: JULIAN | Q830: LITCHFIELD
A831: NORTHCOTE | C831: G WALKER | F831: BECK | I831: ARBUTHNOT | L831: DANIELS | O831: COLE | Q831: RYAN
A832: GOALKICKERS
A833: WILLIAMSTOWN | C833: MATTHEWS 2 | G833: AMY 2 | J833: ALLEY | M833: McINTYRE
A834: NORTHCOTE | C834: RYAN 2 | F834: BECK 2 | I834: ARBUTHNOT | L834: REARDON
A836: BRUNSWICK | C836: 1 | D836: 5 | E836: =C836*6+D836 -> 11 | G836: 2 | H836: 6 | I836: =G836*6+H836 -> 18 | K836: 5 | L836: 8 | M836: =K836*6+L836 -> 38 | O836: 7 | P836: 17 | Q836: =O836*6+P836 -> 59 | S836: BRIGHTON
A837: BRIGHTON | C837: 0 | D837: 0 | E837: =C837*6+D837 -> 0 | G837: 2 | H837: 6 | I837: =G837*6+H837 -> 18 | K837: 2 | L837: 8 | M837: =K837*6+L837 -> 20 | O837: 3 | P837: 10 | Q837: =O837*6+P837 -> 28 | S837: HURLEY
A838: BEST PLAYERS
A839: BRUNSWICK | C839: MILLS | F839: THOMSON | I839: L BRAID | L839: JOHNSON | O839: STANCLIFFE | R839: GILLESPIE
A840: BRIGHTON | C840: W KUSCHERT | F840: KENNEDY | I840: E BAILES | L840: M KUSCHERT | O840: WENBORN | R840: G ROBINSON
A841: GOALKICKERS
A842: BRUNSWICK | C842: BOURKE 3 | G842: JOHNSON 2 | K842: CORRIGAN | N842: KING | P842: STEPHENSON
A843: BRIGHTON | C843: W KUSCHERT | G843: M KUSCHERT | K843: NEYLAN
A845: PRAHRAN | C845: 5 | D845: 13 | E845: =C845*6+D845 -> 43 | G845: 10 | H845: 15 | I845: =G845*6+H845 -> 75 | K845: 14 | L845: 24 | M845: =K845*6+L845 -> 108 | O845: 24 | P845: 29 | Q845: =O845*6+P845 -> 173 | S845: TOORAK PARK
A846: PRESTON | C846: 0 | D846: 2 | E846: =C846*6+D846 -> 2 | G846: 3 | H846: 7 | I846: =G846*6+H846 -> 25 | K846: 3 | L846: 8 | M846: =K846*6+L846 -> 26 | O846: 3 | P846: 9 | Q846: =O846*6+P846 -> 27 | S846: CURWOOD
A847: BEST PLAYERS
A848: PRAHRAN | C848: DOWDING | F848: CARLSON | I848: DARBY | L848: F TURNBULL | O848: DOWSING | R848: SYKES
A849: PRESTON | C849: BILLINGS | F849: SPENCE | I849: W PUNCH | L849: WILLIAMS | O849: DUNCAN | R849: MOORE
A850: GOALKICKERS
A851: PRAHRAN | C851: DOWDING 6 | F851: SYKES 6 | H851: FARMER 3 | J851: DARBY 2 | L851: NORMAN 2 | N851: F TURNBULL | Q851: STUBBS | S851: WINTER | W851: WOODS | X851: H WILSON
A852: PRESTON | C852: SPRATLING | G852: FAWCETT | J852: BILLINGS
A854: FINALS
A855: 1ST SEMI | E855: 17TH SEPTEMBER | J855: WEATHER | M855: STRONG NORTH WIND
A856: ORIGINALLY DUE TO BE | E856: PLAYED 10TH SEPTEMBER | J856: BUT POSTPONED DUE TO | O856: BAD WEATHER
D857: 1ST QTR | H857: 2ND QTR | L857: 3RD QTR | P857: FINAL
A858: ESSENDON ASSOC. | C858: 0 | D858: 0 | E858: =C858*6+D858 -> 0 | G858: 2 | H858: 2 | I858: =G858*6+H858 -> 14 | K858: 2 | L858: 3 | M858: =K858*6+L858 -> 15 | O858: 5 | P858: 9 | Q858: =O858*6+P858 -> 39 | S858: NORTH MELB
A859: PRAHRAN | C859: 1 | D859: 3 | E859: =C859*6+D859 -> 9 | G859: 1 | H859: 4 | I859: =G859*6+H859 -> 10 | K859: 1 | L859: 7 | M859: =K859*6+L859 -> 13 | O859: 2 | P859: 7 | Q859: =O859*6+P859 -> 19 | S859: KENDALL
A860: BEST PLAYERS
A861: ESSENDON ASSOC. | C861: McNAMARA | F861: PAIN | I861: MADDEN | L861: MAINE | O861: GIBSON | R861: HOARE
A862: PRAHRAN | C862: F TURNBULL | F862: MARONEY | I862: H WILSON | L862: STEWART | O862: NORMAN | R862: W TURNBULL
A863: GOALKICKERS
A864: ESSENDON ASSOC. | C864: McNAMARA 2 | G864: HAMBRIDGE | J864: CLARKE | M864: BARTHOLEMEW
A865: PRAHRAN | C865: SYKES | F865: FARMER
A867: 2ND SEMI | E867: 24TH SEPTEMBER | J867: WEATHER | M867: FINE N.E. BREEZE
A868: BRUNSWICK | C868: 2 | D868: 2 | E868: =C868*6+D868 -> 14 | G868: 2 | H868: 5 | I868: =G868*6+H868 -> 17 | K868: 5 | L868: 7 | M868: =K868*6+L868 -> 37 | O868: 7 | P868: 8 | Q868: =O868*6+P868 -> 50 | S868: NORTH MELB
A869: NTH MELBOURNE | C869: 1 | D869: 3 | E869: =C869*6+D869 -> 9 | G869: 2 | H869: 7 | I869: =G869*6+H869 -> 19 | K869: 3 | L869: 7 | M869: =K869*6+L869 -> 25 | O869: 6 | P869: 8 | Q869: =O869*6+P869 -> 44 | S869: KENDALL
A870: BEST PLAYERS
A871: BRUNSWICK | D871: JOHNSON | G871: CHASE | I871: PRICE | K871: McKENZIE | N871: STEPHENSON | R871: KYME
A872: NORTH MELBOURNE | D872: HOMAN | G872: HARDY | I872: G JOHNSON | L872: JINKS | N872: HAMMOND | R872: SPEAKMAN
A873: GOALKICKERS
A874: BRUNSWICK | D874: CHASE 4 | G874: STANCLIFFE | K874: STEPHENSON | O874: KYME
A875: NORTH MELBOURNE | D875: ELLIOTT 4 | G875: HARDY 2
A877: FINAL | E877: 1ST OCTOBER | J877: WEATHER
A878: BRUNSWICK | C878: 0 | D878: 1 | E878: =C878*6+D878 -> 1 | G878: 4 | H878: 3 | I878: =G878*6+H878 -> 27 | K878: 6 | L878: 3 | M878: =K878*6+L878 -> 39 | O878: 8 | P878: 4 | Q878: =O878*6+P878 -> 52 | S878: NORTH MELB
A879: ESSENDON ASSOC. | C879: 2 | D879: 1 | E879: =C879*6+D879 -> 13 | G879: 3 | H879: 5 | I879: =G879*6+H879 -> 23 | K879: 4 | L879: 8 | M879: =K879*6+L879 -> 32 | O879: 6 | P879: 11 | Q879: =O879*6+P879 -> 47 | S879: KENDALL
A880: BEST PLAYERS
A881: BRUNSWICK | C881: McKENZIE | G881: CHASE | I881: JOHNSON | L881: PRICE | N881: ROSS | Q881: LEEDS
A882: ESSENDON ASSOC. | C882: MCNAMARA | G882: MAINE | I882: GIBSON | L882: ATKINS | N882: MADDEN | Q882: CLARKE
A883: GOALKICKERS
A884: BRUNSWICK | C884: CHASE 4 | F884: CORRIGAN | I884: BOURKE | L884: STEPHENSON | O884: CARRIE
A885: ESSENDON ASSOC. | C885: CLARKE 2 | F885: MAINE 2 | I885: McNAMARA | L885: GIBSON
A887: GRAND FINAL | E887: 8TH OCTOBER | J887: WEATHER
A888: NTH MELBOURNE | C888: 1 | D888: 1 | E888: 7 | G888: 5 | H888: 6 | I888: 36 | K888: 6 | L888: 10 | M888: 46 | O888: 9 | P888: 14 | Q888: =O888*6+P888 -> 68 | S888: NORTH MELB
A889: BRUNSWICK | C889: 4 | D889: 3 | E889: 27 | G889: 4 | H889: 3 | I889: 27 | K889: 5 | L889: 8 | M889: 38 | O889: 5 | P889: 9 | Q889: =O889*6+P889 -> 39 | S889: KENDALL
A890: BEST PLAYERS
A891: NTH MELBOURNE | D891: BARKER | G891: HAMMOND | J891: PEMBERTON | M891: HARDY | O891: HOMAN | Q891: CAINE
A892: BRUNSWICK | D892: JOHNSON | G892: L BRAID | J892: McKENZIE | M892: MILLS | O892: GILLESPIE | Q892: PRICE
A893: GOALKICKERS
A894: NTH MELBOURNE | D894: CAINE 5 | G894: BARKER | J894: HARDY | M894: ELLIOTT | O894: TRELOAR
A895: BRUNSWICK | D895: McKENZIE 2 | H895: CHASE | K895: CORRIGAN | N895: STEPHENSON
A897: RERESENTATIVE GAME | F897: 18TH JUNE | J897: WEATHER | M897: NORTH WIND
A898: V.F.A | C898: 3 | D898: 4 | E898: =C898*6+D898 -> 22 | G898: 4 | H898: 6 | I898: =G898*6+H898 -> 30 | K898: 8 | L898: 11 | M898: =K898*6+L898 -> 59 | O898: 9 | P898: 12 | Q898: =O898*6+P898 -> 66 | S898: NORTH MELB
A899: S.A | C899: 2 | D899: 1 | E899: =C899*6+D899 -> 13 | G899: 5 | H899: 3 | I899: =G899*6+H899 -> 33 | K899: 6 | L899: 3 | M899: =K899*6+L899 -> 39 | O899: 8 | P899: 6 | Q899: =O899*6+P899 -> 54 | S899: KENDALL
A900: BEST PLAYERS
A901: V.F.A | C901: McKENZIE | G901: DOWSING | J901: BECK | M901: HARDY | P901: WOODS | R901: SLOSS
A902: S.A | C902: CUMBERLAND | G902: MATSON | J902: TREDREA | M902: T LEAHY | P902: CONGEAR | R902: LEWIS
A903: GOALKICKERS
A904: V.F.A | C904: CAINE 2 | F904: BECK | H904: HAIGHBLOOM | K904: CHASE | M904: McNAMARA | P904: HARDY | R904: McKENZIE
A905: S.A | C905: CONGEAR 4 | G905: DOWLING | J905: HEINRICKS
A907: TEAMS | G907: V.F.A. | Q907: S.A.
A908: BACKS | C908: L BRAID | G908: BILLINGS | J908: WEIDNER | N908: McKENZIE | Q908: TAYLOR | T908: B LEAHY
A909: H-BACKS | C909: McKENZIE | G909: WOODS | J909: ANDERSON | N909: RENFREY | Q909: COCKS | T909: MATSON
A910: CENTRES | C910: HANSEN | G910: DOWSING | J910: JOY | N910: McCARTHY | Q910: HEAD | T910: TREDREA
A911: H-FORWARDS | C911: CHASE | G911: NcNAMARA | J911: BECK | N911: KIMBER | Q911: TOWNSEND | T911: HENRICKS
A912: FORWARDS | C912: CAINE | G912: HAIGHBLOOM | J912: GOUGH | N912: T LEAHY | Q912: DOWLING | T912: CONGEAR
A913: RUCKS | C913: SLOSS | G913: HAMMOND | J913: HARDY | N913: CUMBERLAND | Q913: LEWIS | T913: McGAVISK
A915: RERESENTATIVE GAME | F915: 18TH JUNE | J915: WEATHER | M915: NORTH WIND | P915: GROUND HEAVY
A916: S.A | C916: 1 | D916: 3 | E916: =C916*6+D916 -> 9 | G916: 4 | H916: 10 | I916: =G916*6+H916 -> 34 | K916: 8 | L916: 13 | M916: =K916*6+L916 -> 61 | O916: 10 | P916: 16 | Q916: =O916*6+P916 -> 76 | S916: ADELAIDE
A917: V.F.A | C917: 3 | D917: 1 | E917: =C917*6+D917 -> 19 | G917: 5 | H917: 2 | I917: =G917*6+H917 -> 32 | K917: 8 | L917: 4 | M917: =K917*6+L917 -> 52 | O917: 11 | P917: 8 | Q917: =O917*6+P917 -> 74 | S917: BOLLMAN
A918: BEST PLAYERS
A919: S.A | C919: HEAD | F919: CUMBERLAND | J919: GOLDING | M919: McGAVISH | P919: HEINRICKS | S919: TREDREA
A920: V.F.A | C920: CHASE | F920: HARDY | J920: COTTON | M920: CARLSON | P920: BECK | S920: NASH
A921: GOALKICKERS
A922: S.A | C922: DOWLING 4 | G922: GOLDING 3 | K922: LAMB 2 | N922: DICKSON
A923: V.F.A | C923: HOARE 4 | F923: CHASE 3 | I923: COTTON 2 | L923: BECK 2