A1: Victorian Football Association
A2: Season 1911
A3: © Copyright Wal Williams | F3: First created: 2 August 2014
A4: Contact: joywalwi at gmail dot com | F4: Last updated: 30 July 2017 | W4: VFA Results and tables - Link to the main index page
A5: You are free to copy this document in whole or part provided that proper acknowledgement is given to the author. All rights reserved.
A7: YEAR 1911 | X7: LADDER | AB7: ROUND | AD7: 1
A8: ROUND 1 | E8: 29TH APRIL | J8: WEATHER | M8: FINE | S8: PLAYED AT
D9: 1ST QTR | H9: 2ND QTR | L9: 3RD QTR | P9: FINAL | S9: NORTH MELB | W9: TEAM | X9: W | Y9: L | Z9: D | AA9: FOR | AB9: AGST | AC9: % | AD9: PTS
A10: NORTH MELBOURNE | C10: 4 | D10: 6 | E10: =C10*6+D10 -> 30 | G10: 12 | H10: 10 | I10: =G10*6+H10 -> 82 | K10: 18 | L10: 15 | M10: =K10*6+L10 -> 123 | O10: 22 | P10: 16 | Q10: =O10*6+P10 -> 148 | S10: UMPIRE
A11: PRESTON | C11: 2 | D11: 0 | E11: =C11*6+D11 -> 12 | G11: 3 | H11: 0 | I11: =G11*6+H11 -> 18 | K11: 5 | L11: 1 | M11: =K11*6+L11 -> 31 | O11: 8 | P11: 2 | Q11: =O11*6+P11 -> 50 | S11: WREGG | W11: ESSENDON ASSOC. | X11: 1 | Y11: 0 | Z11: 0 | AA11: 118 | AB11: 18 | AC11: 655.55555555555554 | AD11: 4
A12: BEST PLAYERS | W12: PRAHRAN | X12: 1 | Y12: 0 | Z12: 0 | AA12: 107 | AB12: 32 | AC12: 334.375 | AD12: 4
A13: NORTH MELBOURNE | C13: G JOHNSON | F13: BARKER | I13: HARDY | L13: ELLIOTT | O13: WILLIAMSON | R13: LANG | W13: NORTH MELBOURNE | X13: 1 | Y13: 0 | Z13: 0 | AA13: 148 | AB13: 50 | AC13: 296 | AD13: 4
A14: PRESTON | C14: PUNCH | F14: DUNCAN | I14: ENRIGHT | L14: EICHORN | O14: H DARBY | R14: ALLAN | W14: FOOTSCRAY | X14: 1 | Y14: 0 | Z14: 0 | AA14: 50 | AB14: 21 | AC14: 238.0952380952381 | AD14: 4
A15: GOALKICKERS
A16: NORTH MELBOURNE | C16: ELLIOTT 7 | E16: WILLIAMSON 6 | H16: LANG 4 | J16: JONES 2 | L16: RIACH | N16: J JOHNSON | Q16: HARDY | W16: PORT MELBOURNE | X16: 1 | Y16: 0 | Z16: 0 | AA16: 62 | AB16: 48 | AC16: 129.16666666666666 | AD16: 4
A17: PRESTON | C17: TOZER 3 | F17: HOWLETT 2 | I17: PUNCH | K17: ENRIGHT | N17: FAWCETT | W17: BRUNSWICK | X17: 0 | Y17: 1 | Z17: 0 | AA17: 48 | AB17: 62 | AC17: 77.41935483870968 | AD17: 0
W18: WILLIAMSTOWN | X18: 0 | Y18: 1 | Z18: 0 | AA18: 21 | AB18: 50 | AC18: 42 | AD18: 0
A19: PORT MELBOURNE | C19: 4 | D19: 1 | E19: =C19*6+D19 -> 25 | G19: 6 | H19: 3 | I19: =G19*6+H19 -> 39 | K19: 7 | L19: 5 | M19: =K19*6+L19 -> 47 | O19: 9 | P19: 8 | Q19: =O19*6+P19 -> 62 | S19: BRUNSWICK | W19: PRESTON | X19: 0 | Y19: 1 | Z19: 0 | AA19: 50 | AB19: 148 | AC19: 33.783783783783782 | AD19: 0
A20: BRUNSWICK | C20: 1 | D20: 4 | E20: =C20*6+D20 -> 10 | G20: 3 | H20: 6 | I20: =G20*6+H20 -> 24 | K20: 4 | L20: 11 | M20: =K20*6+L20 -> 35 | O20: 6 | P20: 12 | Q20: =O20*6+P20 -> 48 | S20: KENDALL | W20: BRIGHTON | X20: 0 | Y20: 1 | Z20: 0 | AA20: 32 | AB20: 107 | AC20: 29.906542056074766 | AD20: 0
A21: BEST PLAYERS | W21: NORTHCOTE | X21: 0 | Y21: 1 | Z21: 0 | AA21: 18 | AB21: 118 | AC21: 15.254237288135593 | AD21: 0
A22: PORT MELBOURNE | C22: TREGLOWN | F22: JINKS | H22: MALLETT | K22: HUTCHINSON | N22: ANDERSON | Q22: CLELAND
A23: BRUNSWICK | C23: McKENZIE | F23: PRICE | H23: L BRAID | K23: STANCLIFFE | N23: CHASE | Q23: AMESS
A24: GOALKICKERS
A25: PORT MELBOURNE | C25: HUTCHINSON 4 | G25: PASH 3 | J25: FITZGERALD 2
A26: BRUNSWICK | C26: CHASE | F26: BOURKE | I26: ROSS | K26: MILLS | N26: KULPA | P26: McKENZIE
A28: PRAHRAN | C28: 4 | D28: 3 | E28: =C28*6+D28 -> 27 | G28: 7 | H28: 4 | I28: =G28*6+H28 -> 46 | K28: 14 | L28: 6 | M28: =K28*6+L28 -> 90 | O28: 16 | P28: 11 | Q28: =O28*6+P28 -> 107 | S28: BRIGHTON
A29: BRIGHTON | C29: 1 | D29: 1 | E29: =C29*6+D29 -> 7 | G29: 1 | H29: 2 | I29: =G29*6+H29 -> 8 | K29: 1 | L29: 4 | M29: =K29*6+L29 -> 10 | O29: 4 | P29: 8 | Q29: =O29*6+P29 -> 32 | S29: HURLEY
A30: BEST PLAYERS
A31: PRAHRAN | C31: STEWART | F31: MORONEY | I31: WOODS | L31: W TURNBULL | O31: FARMER | R31: PANNAM
A32: BRIGHTON | C32: BRIDGEFORD | F32: MANN | I32: WENBORN | L32: GORMAN | O32: SMITH | R32: NEYLAN
A33: GOALKICKERS
A34: PRAHRAN | C34: STEWART 5 | G34: SYKES 4 | J34: DOWDING 3 | M34: PANNAM 2 | P34: FARMER | R34: CARLSON
A35: BRIGHTON | C35: ROBINSON 2 | G35: HANNAFORD | J35: SMITH
A37: FOOTSCRAY | C37: 1 | D37: 6 | E37: =C37*6+D37 -> 12 | G37: 2 | H37: 8 | I37: =G37*6+H37 -> 20 | K37: 5 | L37: 12 | M37: =K37*6+L37 -> 42 | O37: 6 | P37: 14 | Q37: =O37*6+P37 -> 50 | S37: WILLIAMSTOWN
A38: WILLIAMSTOWN | C38: 0 | D38: 0 | E38: =C38*6+D38 -> 0 | G38: 1 | H38: 1 | I38: =G38*6+H38 -> 7 | K38: 1 | L38: 1 | M38: =K38*6+L38 -> 7 | O38: 3 | P38: 3 | Q38: =O38*6+P38 -> 21 | S38: HOOD
A39: BEST PLAYERS
A40: FOOTSCRAY | C40: DUANE | F40: OGILVIE | I40: BAXTER | L40: MADDEN | O40: NASH | R40: SPENCE
A41: WILLIAMSTOWN | C41: ELDRIDGE | F41: REITMAN | I41: GIBBS | L41: ALLEY | O41: LITTLE | R41: REYNOLDS
A42: GOALKICKERS
A43: FOOTSCRAY | C43: STEWART 2 | G43: BAXTER | J43: LAMPRELL | M43: CROUCH | P43: LONDERIGAN
A44: WILLIAMSTOWN | C44: LITTLE 2 | G44: CLYDESDALE
A46: ESSENDON ASSOC. | C46: 4 | D46: 5 | E46: =C46*6+D46 -> 29 | G46: 4 | H46: 11 | I46: =G46*6+H46 -> 35 | K46: 9 | L46: 14 | M46: =K46*6+L46 -> 68 | O46: 16 | P46: 22 | Q46: =O46*6+P46 -> 118 | S46: ESSENDON
A47: NORTHCOTE | C47: 0 | D47: 2 | E47: =C47*6+D47 -> 2 | G47: 1 | H47: 2 | I47: =G47*6+H47 -> 8 | K47: 1 | L47: 4 | M47: =K47*6+L47 -> 10 | O47: 2 | P47: 6 | Q47: =O47*6+P47 -> 18 | S47: HUME
A48: BEST PLAYERS
A49: ESSENDON ASSOC. | C49: GOUGH | F49: MADDEN | I49: LEWIS | L49: BUSBRIDGE | O49: HOARE | R49: SEVIOR
A50: NORTHCOTE | C50: SCOTT | F50: BOURKE | I50: ARBUTHNOT | L50: TURNER | O50: SALVADO | R50: COLE
A51: GOALKICKERS
A52: ESSENDON ASSOC. | C52: CLARKE 4 | F52: McNAMARA 3 | I52: BUSBRIDGE 3 | L52: McCANN 3 | O52: SEVIOR 2 | R52: GIBSON
A53: NORTHCOTE | C53: RYAN | F53: WILLIAMS
A55: ROUND 2 | E55: 6TH MAY | J55: WEATHER | M55: STRONG NORTH WIND | S55: PLAYED AT | X55: LADDER | AB55: ROUND | AD55: 2
D56: 1ST QTR | H56: 2ND QTR | L56: 3RD QTR | P56: FINAL | S56: FOOTSCRAY
A57: NORTH MELBOURNE | C57: 0 | D57: 0 | E57: =C57*6+D57 -> 0 | G57: 5 | H57: 4 | I57: =G57*6+H57 -> 34 | K57: 5 | L57: 6 | M57: =K57*6+L57 -> 36 | O57: 7 | P57: 12 | Q57: =O57*6+P57 -> 54 | S57: UMPIRE | W57: TEAM | X57: W | Y57: L | Z57: D | AA57: FOR | AB57: AGST | AC57: % | AD57: PTS
A58: FOOTSCRAY | C58: 4 | D58: 9 | E58: =C58*6+D58 -> 33 | G58: 4 | H58: 9 | I58: =G58*6+H58 -> 33 | K58: 7 | L58: 10 | M58: =K58*6+L58 -> 52 | O58: 7 | P58: 10 | Q58: =O58*6+P58 -> 52 | S58: BEAUMONT
A59: BEST PLAYERS | W59: ESSENDON ASSOC. | X59: 2 | Y59: 0 | Z59: 0 | AA59: 167 | AB59: 48 | AC59: 347.91666666666669 | AD59: 8
A60: NORTH MELBOURNE | C60: SPEAKMAN | F60: WILLIAMSON | I60: ELLIOTT | K60: BARKER | N60: G JOHNSON | Q60: HAMMOND | W60: NORTH MELBOURNE | X60: 2 | Y60: 0 | Z60: 0 | AA60: 202 | AB60: 102 | AC60: 198.0392156862745 | AD60: 8
A61: FOOTSCRAY | C61: OGILVIE | F61: STEWART | I61: HANSON | K61: CRADDOCK | N61: BAXTER | Q61: CROUCH | W61: PRAHRAN | X61: 2 | Y61: 0 | Z61: 0 | AA61: 190 | AB61: 96 | AC61: 197.91666666666666 | AD61: 8
A62: GOALKICKERS | W62: WILLIAMSTOWN | X62: 1 | Y62: 1 | Z62: 0 | AA62: 119 | AB62: 84 | AC62: 141.66666666666666 | AD62: 4
A63: NORTH MELBOURNE | C63: WILLIAMSON 2 | G63: J JOHNSON | J63: HARDY | L63: ELLIOTT | O63: LANG | Q63: TRELOAR
A64: FOOTSCRAY | C64: OGILVIE 2 | G64: BANBURY 2 | K64: KNIGHT | N64: COTTON | P64: MADDEN | W64: FOOTSCRAY | X64: 1 | Y64: 1 | Z64: 0 | AA64: 102 | AB64: 75 | AC64: 136 | AD64: 4
W65: PORT MELBOURNE | X65: 1 | Y65: 1 | Z65: 0 | AA65: 92 | AB65: 97 | AC65: 94.845360824742272 | AD65: 4
A66: ESSENDON ASSOC. | C66: 2 | D66: 2 | E66: =C66*6+D66 -> 14 | G66: 3 | H66: 4 | I66: =G66*6+H66 -> 22 | K66: 4 | L66: 6 | M66: =K66*6+L66 -> 30 | O66: 7 | P66: 7 | Q66: =O66*6+P66 -> 49 | S66: PORT MELB | W66: BRIGHTON | X66: 1 | Y66: 1 | Z66: 0 | AA66: 62 | AB66: 135 | AC66: 45.925925925925924 | AD66: 4
A67: PORT MELBOURNE | C67: 0 | D67: 1 | E67: =C67*6+D67 -> 1 | G67: 1 | H67: 3 | I67: =G67*6+H67 -> 9 | K67: 2 | L67: 4 | M67: =K67*6+L67 -> 16 | O67: 4 | P67: 6 | Q67: =O67*6+P67 -> 30 | S67: HOOD | W67: BRUNSWICK | X67: 0 | Y67: 2 | Z67: 0 | AA67: 112 | AB67: 145 | AC67: 77.241379310344826 | AD67: 0
A68: BEST PLAYERS | W68: PRESTON | X68: 0 | Y68: 2 | Z68: 0 | AA68: 84 | AB68: 246 | AC68: 34.146341463414636 | AD68: 0
A69: ESSENDON ASSOC. | C69: McNAMARA | F69: ATKINS | I69: MAINE | L69: QUINN | O69: CLARKE | R69: FRENCH | W69: NORTHCOTE | X69: 0 | Y69: 2 | Z69: 0 | AA69: 46 | AB69: 148 | AC69: 31.081081081081081 | AD69: 0
A70: PORT MELBOURNE | C70: CLELAND | F70: WILMOTT | I70: TREGLOWN | L70: MOXHAM | O70: DANKS | R70: FRANKLIN
A71: GOALKICKERS
A72: ESSENDON ASSOC. | C72: McNAMARA 2 | G72: CLARKE 2 | J72: MAINE | L72: McCANN | O72: QUINN
A73: PORT MELBOURNE | C73: HUTCHINSON 2 | G73: JACKSON | J73: TAYLOR
A75: PRAHRAN | C75: 4 | D75: 5 | E75: =C75*6+D75 -> 29 | G75: 6 | H75: 6 | I75: =G75*6+H75 -> 42 | K75: 10 | L75: 11 | M75: =K75*6+L75 -> 71 | O75: 12 | P75: 11 | Q75: =O75*6+P75 -> 83 | S75: TOORAK PARK
A76: BRUNSWICK | C76: 0 | D76: 1 | E76: =C76*6+D76 -> 1 | G76: 3 | H76: 6 | I76: =G76*6+H76 -> 24 | K76: 3 | L76: 9 | M76: =K76*6+L76 -> 27 | O76: 8 | P76: 16 | Q76: =O76*6+P76 -> 64 | S76: KENDALL
A77: BEST PLAYERS
A78: PRAHRAN | C78: DOWSING | F78: WILSON | I78: CARLSON | L78: STEWART | O78: FARMER | R78: SYKES
A79: BRUNSWICK | C79: CHASE | F79: JOHNSON | I79: DAVE GILLESPIE | L79: LEEDS | O79: STANCLIFFE | R79: CARRIE
A80: GOALKICKERS
A81: PRAHRAN | C81: FARMER 3 | F81: SYKES 2 | H81: DOWDING 2 | K81: DOWSING | M81: HASSETT | P81: PANNAM | R81: MORONEY | W81: WILSON
A82: BRUNSWICK | C82: PRICE 3 | F82: STANCLIFFE 2 | J82: STEVENSON 2 | N82: L BRAID
A84: WILLIAMSTOWN | C84: 1 | D84: 1 | E84: =C84*6+D84 -> 7 | G84: 8 | H84: 8 | I84: =G84*6+H84 -> 56 | K84: 10 | L84: 10 | M84: =K84*6+L84 -> 70 | O84: 13 | P84: 20 | Q84: =O84*6+P84 -> 98 | S84: PRESTON
A85: PRESTON | C85: 2 | D85: 3 | E85: =C85*6+D85 -> 15 | G85: 3 | H85: 4 | I85: =G85*6+H85 -> 22 | K85: 3 | L85: 4 | M85: =K85*6+L85 -> 22 | O85: 5 | P85: 4 | Q85: =O85*6+P85 -> 34 | S85: HURLEY
A86: BEST PLAYERS
A87: WILLIAMSTOWN | C87: LITCHFIELD | F87: AMY | I87: JOY | L87: ELDRIDGE | O87: McSHANE | R87: WEIDNER
A88: PRESTON | C88: RITCHIE | F88: PUNCH | I88: ALLLAN | L88: ENRIGHT | O88: DICKENSON | R88: DUNCAN
A89: GOALKICKERS
A90: WILLIAMSTOWN | C90: LITCHFIELD 4 | F90: LEONARD 3 | I90: AMY
A91: PRESTON | C91: TOWNER 2 | F91: HOWLETT
A93: BRIGHTON | C93: 1 | D93: 1 | E93: =C93*6+D93 -> 7 | G93: 1 | H93: 2 | I93: =G93*6+H93 -> 8 | K93: 2 | L93: 4 | M93: =K93*6+L93 -> 16 | O93: 4 | P93: 6 | Q93: =O93*6+P93 -> 30 | S93: CROXTON PK
A94: NORTHCOTE | C94: 2 | D94: 3 | E94: =C94*6+D94 -> 15 | G94: 2 | H94: 8 | I94: =G94*6+H94 -> 20 | K94: 3 | L94: 10 | M94: =K94*6+L94 -> 28 | O94: 3 | P94: 10 | Q94: =O94*6+P94 -> 28 | S94: HERBERT
A95: BEST PLAYERS
A96: BRIGHTON | C96: B BAILES | F96: ROBINSON | I96: MANN | L96: WENBORN | O96: HOSKINGS | R96: RICHARDSON
A97: NORTHCOTE | C97: LAWSON | F97: ROURKE | I97: SCOTT | L97: SWIFT | O97: COLE | R97: BECK
A98: GOALKICKERS
A99: BRIGHTON | C99: DOWNES | F99: JAMES | I99: G KNIGHT | L99: RICHARDSON
A100: NORTHCOTE | C100: BECK | F100: RYAN | I100: C FARMER
A102: ROUND 3 | E102: 13TH MAY | S102: PLAYED AT | X102: LADDER | AB102: ROUND | AD102: 3
D103: 1ST QTR | H103: 2ND QTR | L103: 3RD QTR | P103: FINAL | S103: WILLIAMSTOWN
A104: ESSENDON ASSOC. | C104: 2 | D104: 3 | E104: =C104*6+D104 -> 15 | G104: 4 | H104: 6 | I104: =G104*6+H104 -> 30 | K104: 7 | L104: 10 | M104: =K104*6+L104 -> 52 | O104: 8 | P104: 12 | Q104: =O104*6+P104 -> 60 | S104: UMPIRE | W104: TEAM | X104: W | Y104: L | Z104: D | AA104: FOR | AB104: AGST | AC104: % | AD104: PTS
A105: WILLIAMSTOWN | C105: 1 | D105: 0 | E105: =C105*6+D105 -> 6 | G105: 1 | H105: 2 | I105: =G105*6+H105 -> 8 | K105: 3 | L105: 3 | M105: =K105*6+L105 -> 21 | O105: 5 | P105: 6 | Q105: =O105*6+P105 -> 36 | S105: KENDALL
A106: BEST PLAYERS | W106: ESSENDON ASSOC. | X106: 3 | Y106: 0 | Z106: 0 | AA106: 227 | AB106: 84 | AC106: 270.23809523809524 | AD106: 12
A107: ESSENDON ASSOC. | C107: WALKER | F107: McNAMARA | I107: BUSBRIDGE | L107: MAINE | O107: HOARE | R107: CLARKE | W107: PRAHRAN | X107: 3 | Y107: 0 | Z107: 0 | AA107: 331 | AB107: 140 | AC107: 236.42857142857142 | AD107: 12
A108: WILLIAMSTOWN | C108: ELDRIDGE | F108: LITTLE | I108: REITMAN | L108: LITCHFIELD | O108: McTAGGART | R108: WALTERS | W108: NORTH MELBOURNE | X108: 2 | Y108: 1 | Z108: 0 | AA108: 242 | AB108: 146 | AC108: 165.75342465753425 | AD108: 8
A109: GOALKICKERS | W109: PORT MELBOURNE | X109: 2 | Y109: 1 | Z109: 0 | AA109: 222 | AB109: 138 | AC109: 160.86956521739131 | AD109: 8
A110: ESSENDON ASSOC. | C110: HOARE 2 | F110: CHAPMAN 2 | I110: McNAMARA 2 | L110: WILKINSON | O110: GIBSON
A111: WILLIAMSTOWN | C111: COLLINS 2 | F111: GIBBS | H111: FERGUSON | J111: AMY | W111: FOOTSCRAY | X111: 2 | Y111: 1 | Z111: 0 | AA111: 171 | AB111: 108 | AC111: 158.33333333333334 | AD111: 8
W112: WILLIAMSTOWN | X112: 1 | Y112: 2 | Z112: 0 | AA112: 155 | AB112: 144 | AC112: 107.63888888888889 | AD112: 4
A113: FOOTSCRAY | C113: 2 | D113: 1 | E113: =C113*6+D113 -> 13 | G113: 4 | H113: 4 | I113: =G113*6+H113 -> 28 | K113: 7 | L113: 7 | M113: =K113*6+L113 -> 49 | O113: 10 | P113: 9 | Q113: =O113*6+P113 -> 69 | S113: BRIGHTON | W113: BRUNSWICK | X113: 1 | Y113: 2 | Z113: 0 | AA113: 156 | AB113: 185 | AC113: 84.324324324324323 | AD113: 4
A114: BRIGHTON | C114: 2 | D114: 0 | E114: =C114*6+D114 -> 12 | G114: 3 | H114: 0 | I114: =G114*6+H114 -> 18 | K114: 5 | L114: 0 | M114: =K114*6+L114 -> 30 | O114: 5 | P114: 3 | Q114: =O114*6+P114 -> 33 | S114: WREGG | W114: BRIGHTON | X114: 1 | Y114: 2 | Z114: 0 | AA114: 95 | AB114: 204 | AC114: 46.568627450980394 | AD114: 4
A115: BEST PLAYERS | W115: PRESTON | X115: 0 | Y115: 3 | Z115: 0 | AA115: 125 | AB115: 376 | AC115: 33.244680851063826 | AD115: 0
A116: FOOTSCRAY | C116: CRADDOCK | F116: BAXTER | I116: LONDERIGAN | L116: HANSON | O116: SPENCE | R116: OGILVIE | W116: NORTHCOTE | X116: 0 | Y116: 3 | Z116: 0 | AA116: 90 | AB116: 289 | AC116: 31.141868512110726 | AD116: 0
A117: BRIGHTON | C117: RICHARDSON | F117: BACHLI | I117: BRIDGEFORD | L117: TAYLOR | O117: B BAILES | R117: ROBINSON
A118: GOALKICKERS
A119: FOOTSCRAY | C119: KNIGHT 2 | F119: BAXTER 2 | I119: CRADDOCK | K119: CROUCH | M119: LONDERIGAN | P119: WHITE | R119: STEWART | V119: COTTER
A120: BRIGHTON | C120: RICHARDSON 2 | G120: BACHLI | I120: ROBINSON | L120: HANNAFORD
A122: PORT MELBOURNE | C122: 2 | D122: 4 | E122: =C122*6+D122 -> 16 | G122: 8 | H122: 11 | I122: =G122*6+H122 -> 59 | K122: 15 | L122: 15 | M122: =K122*6+L122 -> 105 | O122: 18 | P122: 22 | Q122: =O122*6+P122 -> 130 | S122: PORT MELB
A123: PRESTON | C123: 2 | D123: 3 | E123: =C123*6+D123 -> 15 | G123: 4 | H123: 3 | I123: =G123*6+H123 -> 27 | K123: 5 | L123: 4 | M123: =K123*6+L123 -> 34 | O123: 6 | P123: 5 | Q123: =O123*6+P123 -> 41 | S123: HUME
A124: BEST PLAYERS
A125: PORT MELBOURNE | C125: PASH | F125: JINKS | I125: HUTCHINSON | M125: TAYLOR | P125: FRANKLIN | S125: MOXHAM
A126: PRESTON | C126: MUNRO | F126: O'CONNOR | I126: BILLETT | M126: DARBY | P126: ENRIGHT | S126: DUNCAN
A127: GOALKICKERS
A128: PORT MELBOURNE | C128: TAYLOR 5 | F128: HUTCHINSON 4 | I128: PASH 4 | K128: FITZGERALD 2 | N128: TREGLOWN | Q128: MOXHAM | T128: DANKS
A129: PRESTON | C129: LONIE 2 | F129: MUNRO | H129: LEADER | K129: O'CONNOR | N129: BAKER
A131: BRUNSWICK | C131: 0 | D131: 3 | E131: =C131*6+D131 -> 3 | G131: 2 | H131: 7 | I131: =G131*6+H131 -> 19 | K131: 2 | L131: 12 | M131: =K131*6+L131 -> 24 | O131: 5 | P131: 14 | Q131: =O131*6+P131 -> 44 | S131: NORTH MELB
A132: NORTH MELBOURNE | C132: 1 | D132: 0 | E132: =C132*6+D132 -> 6 | G132: 3 | H132: 2 | I132: =G132*6+H132 -> 20 | K132: 5 | L132: 3 | M132: =K132*6+L132 -> 33 | O132: 6 | P132: 4 | Q132: =O132*6+P132 -> 40 | S132: BEAUMONT
A133: BEST PLAYERS
A134: BRUNSWICK | C134: McKENZIE | F134: CHASE | I134: JOHNSON | K134: L BRAID | N134: MILLS | Q134: THOMPSON
A135: NORTH MELBOURNE | C135: HAMMOND | F135: PEMBERTON | I135: PARKER | K135: RIACH | N135: HARDY | Q135: WILLIAMSON
A136: GOALKICKERS
A137: BRUNSWICK | C137: CHASE | F137: GILBERT | I137: MARSH | L137: PRICE | O137: JOHNSON
A138: NORTH MELBOURNE | C138: ELLIOTT 2 | G138: MITCHELL 2 | K138: WILLIAMSON | O138: LANG
A140: PRAHRAN | C140: 3 | D140: 3 | E140: =C140*6+D140 -> 21 | G140: 9 | H140: 6 | I140: =G140*6+H140 -> 60 | K140: 16 | L140: 11 | M140: =K140*6+L140 -> 107 | O140: 21 | P140: 15 | Q140: =O140*6+P140 -> 141 | S140: CROXTON PK
A141: NORTHCOTE | C141: 1 | D141: 1 | E141: =C141*6+D141 -> 7 | G141: 2 | H141: 4 | I141: =G141*6+H141 -> 16 | K141: 3 | L141: 5 | M141: =K141*6+L141 -> 23 | O141: 6 | P141: 8 | Q141: =O141*6+P141 -> 44 | S141: HURLEY
A142: BEST PLAYERS
A143: PRAHRAN | C143: DOWSING | F143: STEWART | I143: MORONEY | L143: DOWDING | O143: SYKES | R143: FARMER
A144: NORTHCOTE | C144: BURDOE | F144: ARBUTHNOT | I144: BILLINGS | L144: COLE | O144: EARSMAN | R144: ROURKE
A145: GOALKICKERS
A146: PRAHRAN | C146: SYKES 6 | F146: DOWDING 5 | I146: FARMER 4 | K146: NORMAN | M146: MORONEY | O146: CARLSON | Q146: HASSETT | T146: WOODS | V146: DARBY
A147: NORTHCOTE | C147: RYAN 3
A149: ROUND 4 | E149: 20TH MAY | S149: PLAYED AT | X149: LADDER | AB149: ROUND | AD149: 3
D150: 1ST QTR | H150: 2ND QTR | L150: 3RD QTR | P150: FINAL | S150: TOORAK PARK
A151: PRAHRAN | C151: 2 | D151: 4 | E151: =C151*6+D151 -> 16 | G151: 5 | H151: 7 | I151: =G151*6+H151 -> 37 | K151: 6 | L151: 9 | M151: =K151*6+L151 -> 45 | O151: 6 | P151: 18 | Q151: =O151*6+P151 -> 54 | S151: UMPIRE | W151: TEAM | X151: W | Y151: L | Z151: D | AA151: FOR | AB151: AGST | AC151: % | AD151: PTS
A152: PORT MELBOURNE | C152: 3 | D152: 4 | E152: =C152*6+D152 -> 22 | G152: 5 | H152: 5 | I152: =G152*6+H152 -> 35 | K152: 6 | L152: 13 | M152: =K152*6+L152 -> 49 | O152: 6 | P152: 15 | Q152: =O152*6+P152 -> 51 | S152: HOOD
A153: BEST PLAYERS | W153: ESSENDON ASSOC. | X153: 4 | Y153: 0 | Z153: 0 | AA153: 276 | AB153: 125 | AC153: 220.8 | AD153: 16
A154: PRAHRAN | C154: STEWART | F154: DOWDING | I154: MORONEY | K154: WILSON | N154: WOODS | Q154: DOWSING | W154: PRAHRAN | X154: 4 | Y154: 0 | Z154: 0 | AA154: 385 | AB154: 191 | AC154: 201.57068062827224 | AD154: 16
A155: PORT MELBOURNE | C155: DANKS | F155: ANDERSON | I155: TAYLOR | K155: McDONALD | N155: SAMPSON | Q155: HENDRIE | W155: NORTH MELBOURNE | X155: 3 | Y155: 1 | Z155: 0 | AA155: 346 | AB155: 207 | AC155: 167.14975845410629 | AD155: 12
A156: GOALKICKERS | W156: PORT MELBOURNE | X156: 2 | Y156: 2 | Z156: 0 | AA156: 273 | AB156: 192 | AC156: 142.1875 | AD156: 8
A157: PRAHRAN | C157: FARMER 2 | F157: DOWDING 2 | I157: CARLSON | L157: SYKES
A158: PORT MELBOURNE | C158: PASH 2 | F158: DANKS | H158: TAYLOR | J158: MAYNARD | M158: HUTCHINSON | W158: FOOTSCRAY | X158: 2 | Y158: 2 | Z158: 0 | AA158: 212 | AB158: 157 | AC158: 135.03184713375796 | AD158: 8
W159: BRUNSWICK | X159: 2 | Y159: 2 | Z159: 0 | AA159: 224 | AB159: 238 | AC159: 94.117647058823536 | AD159: 8
A160: ESSENDON ASSOC. | C160: 3 | D160: 3 | E160: =C160*6+D160 -> 21 | G160: 5 | H160: 3 | I160: =G160*6+H160 -> 33 | K160: 5 | L160: 10 | M160: =K160*6+L160 -> 40 | O160: 6 | P160: 13 | Q160: =O160*6+P160 -> 49 | S160: ESSENDON | W160: BRIGHTON | X160: 2 | Y160: 2 | Z160: 0 | AA160: 163 | AB160: 247 | AC160: 65.991902834008101 | AD160: 8
A161: FOOTSCRAY | C161: 2 | D161: 1 | E161: =C161*6+D161 -> 13 | G161: 4 | H161: 3 | I161: =G161*6+H161 -> 27 | K161: 5 | L161: 3 | M161: =K161*6+L161 -> 33 | O161: 6 | P161: 5 | Q161: =O161*6+P161 -> 41 | S161: KENDALL | W161: WILLIAMSTOWN | X161: 1 | Y161: 3 | Z161: 0 | AA161: 208 | AB161: 212 | AC161: 98.113207547169807 | AD161: 4
A162: BEST PLAYERS | W162: NORTHCOTE | X162: 0 | Y162: 4 | Z162: 0 | AA162: 151 | AB162: 393 | AC162: 38.422391857506362 | AD162: 0
A163: ESSENDON ASSOC. | C163: McNAMARA | F163: MADDEN | I163: BUSBRIDGE | L163: MAINE | N163: HOARE | Q163: CLARKE | W163: PRESTON | X163: 0 | Y163: 4 | Z163: 0 | AA163: 168 | AB163: 444 | AC163: 37.837837837837839 | AD163: 0
A164: FOOTSCRAY | C164: OGILVIE | F164: HANSON | I164: DUANE | L164: BAXTER | N164: SPENCE | Q164: LONDERIGAN
A165: GOALKICKERS
A166: ESSENDON ASSOC. | C166: CLARKE 3 | F166: HAMBRIDGE | I166: McNAMARA | L166: HOUSE
A167: FOOTSCRAY | C167: KNIGHT 3 | F167: LONDERIGAN | I167: STEWART | K167: COTTON
A169: BRUNSWICK | C169: 5 | D169: 2 | E169: =C169*6+D169 -> 32 | G169: 7 | H169: 6 | I169: =G169*6+H169 -> 48 | K169: 9 | L169: 9 | M169: =K169*6+L169 -> 63 | O169: 9 | P169: 14 | Q169: =O169*6+P169 -> 68 | S169: BRUNSWICK
A170: WILLIAMSTOWN | C170: 1 | D170: 3 | E170: =C170*6+D170 -> 9 | G170: 3 | H170: 6 | I170: =G170*6+H170 -> 24 | K170: 6 | L170: 7 | M170: =K170*6+L170 -> 43 | O170: 7 | P170: 11 | Q170: =O170*6+P170 -> 53 | S170: ALLEY
A171: BEST PLAYERS
A172: BRUNSWICK | C172: CHASE | F172: McKENZIE | I172: JOHNSON | L172: STANCLIFFE | O172: CORRIGAN | S172: L BRAID
A173: WILLIAMSTOWN | C173: ALLEY | F173: JOY | I173: TREWARTHA | L173: REITMAN | O173: WALTERS | S173: McTAGGART
A174: GOALKICKERS
A175: BRUNSWICK | C175: MARSH 3 | F175: PRICE 2 | I175: CONLEY | K175: CORRIGAN | N175: JOHNSON | Q175: McKENZIE
A176: WILLIAMSTOWN | C176: ALLEY 3 | F176: COLLINS 3 | I176: GIBBS
A178: BRIGHTON | C178: 1 | D178: 3 | E178: =C178*6+D178 -> 9 | G178: 5 | H178: 6 | I178: =G178*6+H178 -> 36 | K178: 6 | L178: 11 | M178: =K178*6+L178 -> 47 | O178: 9 | P178: 14 | Q178: =O178*6+P178 -> 68 | S178: PRESTON
A179: PRESTON | C179: 0 | D179: 4 | E179: =C179*6+D179 -> 4 | G179: 3 | H179: 8 | I179: =G179*6+H179 -> 26 | K179: 4 | L179: 8 | M179: =K179*6+L179 -> 32 | O179: 5 | P179: 13 | Q179: =O179*6+P179 -> 43 | S179: HURLEY
A180: BEST PLAYERS
A181: BRIGHTON | C181: SMITH | F181: KNIGHT | I181: NEIL | L181: WENBORN | O181: TAYLOR | S181: HANNAFORD
A182: PRESTON | C182: PUNCH | F182: BILLETT | I182: DUNCAN | L182: LEADER | O182: ENRIGHT | S182: BROWN
A183: GOALKICKERS
A184: BRIGHTON | C184: HANNAFORD 2 | G184: TAYLOR 2 | J184: LANDEMANN 2 | N184: WENBORN | Q184: ROBINSON | T184: RICHARDSON
A185: PRESTON
A187: NORTH MELBOURNE | C187: 5 | D187: 3 | E187: =C187*6+D187 -> 33 | G187: 9 | H187: 5 | I187: =G187*6+H187 -> 59 | K187: 14 | L187: 7 | M187: =K187*6+L187 -> 91 | O187: 16 | P187: 8 | Q187: =O187*6+P187 -> 104 | S187: NORTH MELB
A188: NORTHCOTE | C188: 1 | D188: 2 | E188: =C188*6+D188 -> 8 | G188: 3 | H188: 3 | I188: =G188*6+H188 -> 21 | K188: 4 | L188: 4 | M188: =K188*6+L188 -> 28 | O188: 9 | P188: 7 | Q188: =O188*6+P188 -> 61 | S188: HERBERT
A189: BEST PLAYERS
A190: NORTH MELBOURNE | C190: HARDY | F190: SPEAKMAN | I190: G JOHNSON | L190: BOURKE | O190: ELLIOTT | R190: WILLIAMSON
A191: NORTHCOTE | C191: PYKE | F191: COLE | I191: LAWSON | L191: ROURKE | O191: HARRISON | R191: SALVADO
A192: GOALKICKERS
A193: NORTH MELBOURNE | C193: ELLIOTT 5 | F193: HARDY 3 | H193: DWYER 2 | J193: SPEAKMAN 2 | M193: ROACH | O193: WILLIAMSON | R193: RIACH | U193: G BARKER
A194: NORTHCOTE | C194: RYAN 3 | F194: C FARMER 3 | J194: LAWSON 2
A196: ROUND 5 | E196: 27TH MAY | J196: WEATHER | M196: SOUTH WIND RAIN | S196: PLAYED AT | X196: LADDER | AB196: ROUND | AD196: 5
D197: 1ST QTR | H197: 2ND QTR | L197: 3RD QTR | P197: FINAL | S197: TOORAK PARK
A198: NORTH MELBOURNE | C198: 2 | D198: 2 | E198: =C198*6+D198 -> 14 | G198: 6 | H198: 2 | I198: =G198*6+H198 -> 38 | K198: 7 | L198: 6 | M198: =K198*6+L198 -> 48 | O198: 10 | P198: 7 | Q198: =O198*6+P198 -> 67 | S198: UMPIRE | W198: TEAM | X198: W | Y198: L | Z198: D | AA198: FOR | AB198: AGST | AC198: % | AD198: PTS
A199: PRAHRAN | C199: 2 | D199: 0 | E199: =C199*6+D199 -> 12 | G199: 4 | H199: 1 | I199: =G199*6+H199 -> 25 | K199: 10 | L199: 3 | M199: =K199*6+L199 -> 63 | O199: 10 | P199: 5 | Q199: =O199*6+P199 -> 65 | S199: HERBERT
A200: BEST PLAYERS | W200: ESSENDON ASSOC. | X200: 5 | Y200: 0 | Z200: 0 | AA200: 322 | AB200: 166 | AC200: 193.97590361445782 | AD200: 20
A201: NORTH MELBOURNE | C201: J JOHNSON | F201: ELLIOTT | I201: G JOHNSON | K201: S BARKER | N201: ROACH | Q201: LAVER | W201: PRAHRAN | X201: 4 | Y201: 1 | Z201: 0 | AA201: 450 | AB201: 258 | AC201: 174.41860465116278 | AD201: 16
A202: PRAHRAN | C202: MORONEY | F202: DOWDING | I202: SYKES | K202: CARLSON | N202: DOWSING | Q202: WILLIAMSON | W202: NORTH MELBOURNE | X202: 4 | Y202: 1 | Z202: 0 | AA202: 413 | AB202: 272 | AC202: 151.83823529411765 | AD202: 16
A203: GOALKICKERS | W203: FOOTSCRAY | X203: 3 | Y203: 2 | Z203: 0 | AA203: 349 | AB203: 204 | AC203: 171.07843137254903 | AD203: 12
A204: NORTH MELBOURNE | C204: ELLIOTT 6 | G204: WILLIAMSON | J204: G JOHNSON | M204: LAVER | O204: J JOHNSON
A205: PRAHRAN | C205: DOWDING 5 | G205: MORONEY 2 | J205: NORMAN | M205: SYKES | O205: WINTER | W205: PORT MELBOURNE | X205: 3 | Y205: 2 | Z205: 0 | AA205: 348 | AB205: 236 | AC205: 147.45762711864407 | AD205: 12
W206: BRUNSWICK | X206: 3 | Y206: 2 | Z206: 0 | AA206: 288 | AB206: 276 | AC206: 104.34782608695652 | AD206: 12
A207: PORT MELBOURNE | C207: 2 | D207: 0 | E207: =C207*6+D207 -> 12 | G207: 7 | H207: 2 | I207: =G207*6+H207 -> 44 | K207: 7 | L207: 4 | M207: =K207*6+L207 -> 46 | O207: 11 | P207: 9 | Q207: =O207*6+P207 -> 75 | S207: WILLIAMSTOWN | W207: BRIGHTON | X207: 2 | Y207: 3 | Z207: 0 | AA207: 204 | AB207: 293 | AC207: 69.624573378839585 | AD207: 8
A208: WILLIAMSTOWN | C208: 2 | D208: 4 | E208: =C208*6+D208 -> 16 | G208: 6 | H208: 5 | I208: =G208*6+H208 -> 41 | K208: 6 | L208: 8 | M208: =K208*6+L208 -> 44 | O208: 6 | P208: 8 | Q208: =O208*6+P208 -> 44 | S208: HOOD | W208: WILLIAMSTOWN | X208: 1 | Y208: 4 | Z208: 0 | AA208: 252 | AB208: 287 | AC208: 87.804878048780495 | AD208: 4
A209: BEST PLAYERS | W209: NORTHCOTE | X209: 0 | Y209: 5 | Z209: 0 | AA209: 189 | AB209: 457 | AC209: 41.356673960612689 | AD209: 0
A210: PORT MELBOURNE | C210: CRITCH | F210: SAMPSON | I210: FRANKLIN | L210: TAYLOR | O210: DANKS | Q210: TREGLOWN | W210: PRESTON | X210: 0 | Y210: 5 | Z210: 0 | AA210: 215 | AB210: 581 | AC210: 37.005163511187611 | AD210: 0
A211: WILLIAMSTOWN | C211: WALTERS | F211: LITTLE | I211: JOY | L211: ALLEY | O211: AMY | Q211: DAVIES
A212: GOALKICKERS
A213: PORT MELBOURNE | C213: DANKS 3 | E213: BROWN | G213: HUTCHINSON | J213: WILMOTT | L213: TAYLOR | N213: PASH | P213: MOXHAM | R213: MCDONALD | V213: CLELAND
A214: WILLIAMSTOWN | C214: AMY 3 | F214: ALLEY | I214: HARTSHORN | L214: GIBBS
A216: ESSENDON ASSOC. | C216: 3 | D216: 0 | E216: =C216*6+D216 -> 18 | G216: 4 | H216: 4 | I216: =G216*6+H216 -> 28 | K216: 4 | L216: 8 | M216: =K216*6+L216 -> 32 | O216: 6 | P216: 10 | Q216: =O216*6+P216 -> 46 | S216: ESSENDON
A217: BRIGHTON | C217: 1 | D217: 0 | E217: =C217*6+D217 -> 6 | G217: 3 | H217: 1 | I217: =G217*6+H217 -> 19 | K217: 5 | L217: 3 | M217: =K217*6+L217 -> 33 | O217: 6 | P217: 5 | Q217: =O217*6+P217 -> 41 | S217: KENDALL
A218: BEST PLAYERS
A219: ESSENDON ASSOC. | C219: McNAMARA | F219: PAIN | I219: BUSBRIDGE | L219: SEVIOR | O219: MADDEN | R219: ANDERSON
A220: BRIGHTON | C220: B BAILES | F220: NEIL | I220: A LAXTON | L220: TAYLOR | O220: SMITH | R220: NEYLAN
A221: GOALKICKERS
A222: ESSENDON ASSOC. | C222: McNAMARA 5 | F222: HOARE
A223: BRIGHTON | C223: TAYLOR | F223: B BAILES | I223: W ROBINSON | L223: RICHARDSON | O223: HANNAFORD
A225: BRUNSWICK | C225: 2 | D225: 3 | E225: =C225*6+D225 -> 15 | G225: 2 | H225: 6 | I225: =G225*6+H225 -> 18 | K225: 4 | L225: 16 | M225: =K225*6+L225 -> 40 | O225: 7 | P225: 22 | Q225: =O225*6+P225 -> 64 | S225: CROXTON PK
A226: NORTHCOTE | C226: 1 | D226: 0 | E226: =C226*6+D226 -> 6 | G226: 2 | H226: 3 | I226: =G226*6+H226 -> 15 | K226: 4 | L226: 4 | M226: =K226*6+L226 -> 28 | O226: 5 | P226: 8 | Q226: =O226*6+P226 -> 38 | S226: HURLEY
A227: BEST PLAYERS
A228: BRUNSWICK | C228: CHASE | F228: MCKENZIE | I228: L BRAID | L228: MILLS | O228: BRITTEN | R228: PRICE
A229: NORTHCOTE | C229: HAUGHTON | F229: S BILLINGS | I229: SALVADO | L229: PYKE | O229: COLE | R229: EARSMAN
A230: GOALKICKERS
A231: BRUNSWICK
A232: NORTHCOTE | C232: LEES 2
A234: FOOTSCRAY | C234: 7 | D234: 4 | E234: =C234*6+D234 -> 46 | G234: 10 | H234: 6 | I234: =G234*6+H234 -> 66 | K234: 15 | L234: 12 | M234: =K234*6+L234 -> 102 | O234: 20 | P234: 17 | Q234: =O234*6+P234 -> 137 | S234: FOOTSCRAY
A235: PRESTON | C235: 0 | D235: 1 | E235: =C235*6+D235 -> 1 | G235: 3 | H235: 4 | I235: =G235*6+H235 -> 22 | K235: 5 | L235: 5 | M235: =K235*6+L235 -> 35 | O235: 7 | P235: 5 | Q235: =O235*6+P235 -> 47 | S235: KENDALL
A236: BEST PLAYERS
A237: FOOTSCRAY | C237: CROUCH | F237: LONDERIGAN | I237: OGILVIE | L237: COTTON | O237: KNIGHT | R237: DUANE
A238: PRESTON | C238: BENNETT | F238: GIBBONS | I238: DUNCAN | L238: BROWN | O238: PUNCH | R238: WHITE
A239: GOALKICKERS
A240: FOOTSCRAY | C240: KNIGHT 6 | E240: DUANE 2 | G240: LONDERIGAN 2 | J240: MADDEN 2 | L240: STEWART 2 | N240: COTTON | P240: CROUCH | R240: A CLARKE | V240: EDWARDS | X240: OGILVIE | Z240: BAXTER
A241: PRESTON | C241: PRINCE 4
A243: ROUND 6 | E243: 3RD JUNE | S243: PLAYED AT | X243: LADDER | AB243: ROUND | AD243: 6
D244: 1ST QTR | H244: 2ND QTR | L244: 3RD QTR | P244: FINAL | S244: PORT MELB
A245: PORT MELBOURNE | C245: 0 | D245: 2 | E245: =C245*6+D245 -> 2 | G245: 3 | H245: 7 | I245: =G245*6+H245 -> 25 | K245: 6 | L245: 10 | M245: =K245*6+L245 -> 46 | O245: 8 | P245: 12 | Q245: =O245*6+P245 -> 60 | S245: UMPIRE | W245: TEAM | X245: W | Y245: L | Z245: D | AA245: FOR | AB245: AGST | AC245: % | AD245: PTS
A246: NORTHCOTE | C246: 1 | D246: 5 | E246: =C246*6+D246 -> 11 | G246: 4 | H246: 5 | I246: =G246*6+H246 -> 29 | K246: 5 | L246: 6 | M246: =K246*6+L246 -> 36 | O246: 6 | P246: 6 | Q246: =O246*6+P246 -> 42 | S246: HURLEY
A247: BEST PLAYERS | W247: ESSENDON ASSOC. | X247: 6 | Y247: 0 | Z247: 0 | AA247: 450 | AB247: 193 | AC247: 233.16062176165804 | AD247: 24
A248: PORT MELBOURNE | C248: CLELAND | F248: PASH | H248: HUTCHINSON | K248: JINKS | N248: ANDERSON | Q248: DANKS | W248: PRAHRAN | X248: 5 | Y248: 1 | Z248: 0 | AA248: 503 | AB248: 301 | AC248: 167.10963455149502 | AD248: 20
A249: NORTHCOTE | C249: SWIFT | F249: COLE | H249: SCOTT | K249: BECK | N249: FOLMES | Q249: BILLINGS | W249: NORTH MELBOURNE | X249: 5 | Y249: 1 | Z249: 0 | AA249: 508 | AB249: 312 | AC249: 162.82051282051282 | AD249: 20
A250: GOALKICKERS | W250: PORT MELBOURNE | X250: 4 | Y250: 2 | Z250: 0 | AA250: 408 | AB250: 278 | AC250: 146.76258992805757 | AD250: 16
A251: PORT MELBOURNE | C251: HUTCHINSON 4 | G251: PASH 2 | J251: TREGLOWN | M251: TAYLOR
A252: NORTHCOTE | C252: LAWSON 3 | G252: RYAN 2 | J252: LEES | W252: BRUNSWICK | X252: 4 | Y252: 2 | Z252: 0 | AA252: 349 | AB252: 325 | AC252: 107.38461538461539 | AD252: 16
W253: FOOTSCRAY | X253: 3 | Y253: 3 | Z253: 0 | AA253: 398 | AB253: 265 | AC253: 150.18867924528303 | AD253: 12
A254: BRUNSWICK | C254: 2 | D254: 5 | E254: =C254*6+D254 -> 17 | G254: 3 | H254: 7 | I254: =G254*6+H254 -> 25 | K254: 6 | L254: 13 | M254: =K254*6+L254 -> 49 | O254: 8 | P254: 13 | Q254: =O254*6+P254 -> 61 | S254: FOOTSCRAY | W254: BRIGHTON | X254: 2 | Y254: 4 | Z254: 0 | AA254: 244 | AB254: 388 | AC254: 62.886597938144327 | AD254: 8
A255: FOOTSCRAY | C255: 0 | D255: 0 | E255: =C255*6+D255 -> 0 | G255: 5 | H255: 3 | I255: =G255*6+H255 -> 33 | K255: 5 | L255: 4 | M255: =K255*6+L255 -> 34 | O255: 7 | P255: 7 | Q255: =O255*6+P255 -> 49 | S255: ALLEY | W255: WILLIAMSTOWN | X255: 1 | Y255: 5 | Z255: 0 | AA255: 295 | AB255: 340 | AC255: 86.764705882352942 | AD255: 4
A256: BEST PLAYERS | W256: NORTHCOTE | X256: 0 | Y256: 6 | Z256: 0 | AA256: 231 | AB256: 517 | AC256: 44.680851063829785 | AD256: 0
A257: BRUNSWICK | C257: MCKENZIE | F257: L BRAID | I257: PRICE | K257: STANCLIFFE | N257: MILLS | Q257: DOUG GILLESPIE | W257: PRESTON | X257: 0 | Y257: 6 | Z257: 0 | AA257: 242 | AB257: 709 | AC257: 34.132581100141046 | AD257: 0
A258: FOOTSCRAY | C258: SPENCE | F258: McCARTHY | I258: WHITE | K258: CROUCH | N258: COTTON | Q258: BAXTER
A259: GOALKICKERS
A260: BRUNSWICK | C260: McKENZIE 4 | G260: CONLEY
A261: FOOTSCRAY | C261: KNIGHT 4 | G261: BAXTER | J261: CRADDOCK | M261: SPENCE
A263: NORTH MELBOURNE | C263: 1 | D263: 1 | E263: =C263*6+D263 -> 7 | G263: 6 | H263: 5 | I263: =G263*6+H263 -> 41 | K263: 10 | L263: 5 | M263: =K263*6+L263 -> 65 | O263: 14 | P263: 11 | Q263: =O263*6+P263 -> 95 | S263: BRIGHTON
A264: BRIGHTON | C264: 2 | D264: 4 | E264: =C264*6+D264 -> 16 | G264: 2 | H264: 5 | I264: =G264*6+H264 -> 17 | K264: 4 | L264: 9 | M264: =K264*6+L264 -> 33 | O264: 5 | P264: 10 | Q264: =O264*6+P264 -> 40 | S264: HOOD
A265: BEST PLAYERS
A266: NORTH MELBOURNE | C266: WILLIAMSON | G266: HAMMOND | J266: ELLIOTT | M266: LAVER | P266: TRELOAR | S266: S BARKER
A267: BRIGHTON | C267: W ROBINSON | G267: B BAILES | J267: NEYLAN | M267: MANN | P267: A LAXTON | S267: TAYLOR
A268: GOALKICKERS
A269: NORTH MELBOURNE | C269: WILLIAMSON 3 | G269: HAMMOND 3 | J269: ELLIOTT 3 | M269: HARDY 2 | O269: S BARKER | Q269: G BARKER | T269: RIACH
A270: BRIGHTON | C270: F ROBINSON 2 | G270: W ROBINSON | J270: TURNBULL | M270: B BAILES
A272: PRAHRAN | C272: 2 | D272: 4 | E272: =C272*6+D272 -> 16 | G272: 4 | H272: 6 | I272: =G272*6+H272 -> 30 | K272: 7 | L272: 10 | M272: =K272*6+L272 -> 52 | O272: 7 | P272: 11 | Q272: =O272*6+P272 -> 53 | S272: WILLIAMSTOWN
A273: WILLIAMSTOWN | C273: 0 | D273: 0 | E273: =C273*6+D273 -> 0 | G273: 5 | H273: 1 | I273: =G273*6+H273 -> 31 | K273: 5 | L273: 3 | M273: =K273*6+L273 -> 33 | O273: 6 | P273: 7 | Q273: =O273*6+P273 -> 43 | S273: HERBERT
A274: BEST PLAYERS
A275: PRAHRAN | C275: MORONEY | G275: WOODS | J275: STEWART | M275: SYKES | P275: DOWDING | S275: CARLSON
A276: WILLIAMSTOWN | C276: AMY | G276: McTAGGART | J276: ELDRIDGE | M276: LITTLE | P276: TREWARTHA | S276: PONTON
A277: GOALKICKERS
A278: PRAHRAN | C278: SYKES 4 | G278: DOWDING | J278: FARMER | M278: WILSON
A279: WILLIAMSTOWN | C279: TREWARTHA | F279: McTAGGART | I279: FULLARTON | L279: ELDRIDGE | O279: LITTLE | R279: AMY
A281: ESSENDON ASSOC. | C281: 3 | D281: 6 | E281: =C281*6+D281 -> 24 | G281: 6 | H281: 6 | I281: =G281*6+H281 -> 42 | K281: 14 | L281: 13 | M281: =K281*6+L281 -> 97 | O281: 18 | P281: 20 | Q281: =O281*6+P281 -> 128 | S281: PRESTON
A282: PRESTON | C282: 0 | D282: 1 | E282: =C282*6+D282 -> 1 | G282: 1 | H282: 2 | I282: =G282*6+H282 -> 8 | K282: 2 | L282: 2 | M282: =K282*6+L282 -> 14 | O282: 4 | P282: 3 | Q282: =O282*6+P282 -> 27 | S282: KENDALL
A283: BEST PLAYERS
A284: ESSENDON ASSOC. | C284: McNAMARA | G284: HOARE | J284: GOUGH | M284: ATKINS | P284: BUSBRIDGE | S284: SEVIOR
A285: PRESTON | C285: McGEE | G285: WHITE | J285: MOORE | M285: BILLETT | P285: PUNCH | S285: PEARSON
A286: GOALKICKERS
A287: ESSENDON ASSOC. | C287: McNAMARA 9 | G287: HOARE 4 | J287: GOUGH 2 | M287: WILKINSON | P287: LEWIS | R287: McINTYRE
A288: PRESTON | C288: PUNCH 2 | G288: ENRIGHT | J288: ALLAN
A290: ROUND 7 | D290: 5TH JUNE | H290: KINGS BIRTHDAY | K290: WEATHER | O290: SOUTH WIND RAIN | S290: PLAYED AT | X290: LADDER | AB290: ROUND | AD290: 7
D291: 1ST QTR | H291: 2ND QTR | L291: 3RD QTR | P291: FINAL | S291: NORTH MELB
A292: PORT MELBOURNE | C292: 0 | D292: 2 | E292: =C292*6+D292 -> 2 | G292: 1 | H292: 3 | I292: =G292*6+H292 -> 9 | K292: 2 | L292: 4 | M292: =K292*6+L292 -> 16 | O292: 4 | P292: 5 | Q292: =O292*6+P292 -> 29 | S292: UMPIRE | W292: TEAM | X292: W | Y292: L | Z292: D | AA292: FOR | AB292: AGST | AC292: % | AD292: PTS
A293: NORTH MELBOURNE | C293: 1 | D293: 2 | E293: =C293*6+D293 -> 8 | G293: 1 | H293: 4 | I293: =G293*6+H293 -> 10 | K293: 2 | L293: 4 | M293: =K293*6+L293 -> 16 | O293: 2 | P293: 7 | Q293: =O293*6+P293 -> 19 | S293: HUME
A294: BEST PLAYERS | W294: ESSENDON ASSOC. | X294: 7 | Y294: 0 | Z294: 0 | AA294: 528 | AB294: 233 | AC294: 226.60944206008583 | AD294: 28
A295: PORT MELBOURNE | C295: JINKS | F295: HENDRIE | I295: ANDERSON | L295: PASH | N295: BROWN | Q295: TREGLOWN | W295: PRAHRAN | X295: 6 | Y295: 1 | Z295: 0 | AA295: 566 | AB295: 347 | AC295: 163.11239193083574 | AD295: 24
A296: NORTH MELBOURNE | C296: ROACH | F296: PEMBERTON | I296: S BARKER | L296: G BARKER | N296: HARDY | Q296: JONES | W296: NORTH MELBOURNE | X296: 5 | Y296: 2 | Z296: 0 | AA296: 527 | AB296: 341 | AC296: 154.54545454545453 | AD296: 20
A297: GOALKICKERS | W297: PORT MELBOURNE | X297: 5 | Y297: 2 | Z297: 0 | AA297: 437 | AB297: 297 | AC297: 147.13804713804714 | AD297: 20
A298: PORT MELBOURNE | C298: PASH 2 | F298: MCDONALD | I298: HUTCHINSON
A299: NORTH MELBOURNE | C299: ROACH | F299: HARDY | W299: BRUNSWICK | X299: 4 | Y299: 3 | Z299: 0 | AA299: 389 | AB299: 403 | AC299: 96.526054590570723 | AD299: 16
W300: FOOTSCRAY | X300: 3 | Y300: 4 | Z300: 0 | AA300: 444 | AB300: 328 | AC300: 135.36585365853659 | AD300: 12
A301: ESSENDON ASSOC. | C301: 4 | D301: 4 | E301: =C301*6+D301 -> 28 | G301: 6 | H301: 6 | I301: =G301*6+H301 -> 42 | K301: 9 | L301: 10 | M301: =K301*6+L301 -> 64 | O301: 11 | P301: 12 | Q301: =O301*6+P301 -> 78 | S301: ESSENDON | W301: WILLIAMSTOWN | X301: 2 | Y301: 5 | Z301: 0 | AA301: 327 | AB301: 371 | AC301: 88.140161725067387 | AD301: 8
A302: BRUNSWICK | C302: 0 | D302: 1 | E302: =C302*6+D302 -> 1 | G302: 2 | H302: 3 | I302: =G302*6+H302 -> 15 | K302: 4 | L302: 7 | M302: =K302*6+L302 -> 31 | O302: 5 | P302: 10 | Q302: =O302*6+P302 -> 40 | S302: ALLEY | W302: BRIGHTON | X302: 2 | Y302: 5 | Z302: 0 | AA302: 275 | AB302: 420 | AC302: 65.476190476190482 | AD302: 8
A303: BEST PLAYERS | W303: PRESTON | X303: 1 | Y303: 6 | Z303: 0 | AA303: 297 | AB303: 742 | AC303: 40.026954177897572 | AD303: 4
A304: ESSENDON ASSOC. | C304: McNAMARA | F304: MADDEN | I304: ATKINS | K304: WALKER | N304: GOUGH | Q304: SEVIOR | W304: NORTHCOTE | X304: 0 | Y304: 7 | Z304: 0 | AA304: 264 | AB304: 572 | AC304: 46.153846153846153 | AD304: 0
A305: BRUNSWICK | C305: L BRAID | F305: CHASE | I305: MILLS | K305: CARRIE | N305: PRICE | Q305: CONLEY
A306: GOALKICKERS
A307: ESSENDON ASSOC. | C307: McNAMARA 3 | F307: CLARKE 2 | H307: HOARE | J307: PAIN | L307: CHAPMAN | N307: GIBSON | P307: MADDEN | R307: SEVIOR
A308: BRUNSWICK | C308: CONLEY | F308: PRICE | H308: MILLS | J308: CHASE | L308: BRITTEN
A310: PRAHRAN | C310: 0 | D310: 4 | E310: =C310*6+D310 -> 4 | G310: 2 | H310: 7 | I310: =G310*6+H310 -> 19 | K310: 5 | L310: 9 | M310: =K310*6+L310 -> 39 | O310: 8 | P310: 15 | Q310: =O310*6+P310 -> 63 | S310: FOOTSCRAY
A311: FOOTSCRAY | C311: 2 | D311: 0 | E311: =C311*6+D311 -> 12 | G311: 3 | H311: 0 | I311: =G311*6+H311 -> 18 | K311: 7 | L311: 4 | M311: =K311*6+L311 -> 46 | O311: 7 | P311: 4 | Q311: =O311*6+P311 -> 46 | S311: KENDALL
A312: BEST PLAYERS
A313: PRAHRAN | C313: MORONEY | F313: CARLSON | I313: WOODS | L313: PANNAM | O313: DOWDING | R313: SYKES
A314: FOOTSCRAY | C314: HANSON | F314: CROUCH | I314: SPENCE | L314: A CLARKE | O314: CRADDOCK | R314: KNIGHT
A315: GOALKICKERS
A316: PRAHRAN | C316: SYKES 5 | F316: DOWDING | I316: FARMER | L316: STEWART
A317: FOOTSCRAY | C317: KNIGHT 3 | F317: COTTON 3 | I317: NASH
A319: WILLIAMSTOWN | C319: 1 | D319: 1 | E319: =C319*6+D319 -> 7 | G319: 2 | H319: 3 | I319: =G319*6+H319 -> 15 | K319: 3 | L319: 3 | M319: =K319*6+L319 -> 21 | O319: 4 | P319: 8 | Q319: =O319*6+P319 -> 32 | S319: BRIGHTON
A320: BRIGHTON | C320: 0 | D320: 6 | E320: =C320*6+D320 -> 6 | G320: 1 | H320: 7 | I320: =G320*6+H320 -> 13 | K320: 3 | L320: 7 | M320: =K320*6+L320 -> 25 | O320: 4 | P320: 7 | Q320: =O320*6+P320 -> 31 | S320: HERBERT
A321: BEST PLAYERS
A322: WILLIAMSTOWN | C322: AMY | F322: LITCHFIELD | I322: FULLARTON | L322: REITMAN | O322: ELDRIDGE | R322: JOY
A323: BRIGHTON | C323: B BAILES | F323: W ROBINSON | I323: NEYLAN | L323: DOWNES | O323: A LAXTON | R323: BRIDGEFORD
A324: GOALKICKERS
A325: WILLIAMSTOWN
A326: BRIGHTON | C326: DOWNES 2 | G326: NEIL | J326: W ROBINSON
A328: PRESTON | C328: 3 | D328: 1 | E328: =C328*6+D328 -> 19 | G328: 4 | H328: 7 | I328: =G328*6+H328 -> 31 | K328: 7 | L328: 7 | M328: =K328*6+L328 -> 49 | O328: 8 | P328: 7 | Q328: =O328*6+P328 -> 55 | S328: PRESTON
A329: NORTHCOTE | C329: 0 | D329: 4 | E329: =C329*6+D329 -> 4 | G329: 1 | H329: 6 | I329: =G329*6+H329 -> 12 | K329: 3 | L329: 8 | M329: =K329*6+L329 -> 26 | O329: 4 | P329: 9 | Q329: =O329*6+P329 -> 33 | S329: WREGG
A330: BEST PLAYERS
A331: PRESTON | C331: PUNCH | F331: ENRIGHT | I331: McGEE | L331: WOOLLEY | O331: DUNCAN | R331: BASSETT
A332: NORTHCOTE | C332: HAUGHTON | F332: COLE | I332: RYAN | L332: BECK | O332: SWIFT | R332: ROURKE
A333: GOALKICKERS
A334: PRESTON | C334: PUNCH 4
A335: NORTHCOTE
A337: ROUND 8 | E337: 17TH JUNE | J337: WEATHER | S337: PLAYED AT | X337: LADDER | AB337: ROUND | AD337: 8
D338: 1ST QTR | H338: 2ND QTR | L338: 3RD QTR | P338: FINAL | S338: ESSENDON
A339: ESSENDON ASSOC. | C339: 1 | D339: 2 | E339: =C339*6+D339 -> 8 | G339: 4 | H339: 3 | I339: =G339*6+H339 -> 27 | K339: 8 | L339: 5 | M339: =K339*6+L339 -> 53 | O339: 11 | P339: 6 | Q339: =O339*6+P339 -> 72 | S339: UMPIRE | W339: TEAM | X339: W | Y339: L | Z339: D | AA339: FOR | AB339: AGST | AC339: % | AD339: PTS
A340: NORTH MELBOURNE | C340: 1 | D340: 2 | E340: =C340*6+D340 -> 8 | G340: 4 | H340: 4 | I340: =G340*6+H340 -> 28 | K340: 6 | L340: 7 | M340: =K340*6+L340 -> 43 | O340: 6 | P340: 8 | Q340: =O340*6+P340 -> 44 | S340: ALLEY
A341: BEST PLAYERS | W341: ESSENDON ASSOC. | X341: 8 | Y341: 0 | Z341: 0 | AA341: 600 | AB341: 277 | AC341: 216.60649819494586 | AD341: 32
A342: ESSENDON ASSOC. | C342: WALKER | F342: McNAMARA | I342: MAINE | K342: CHAPMAN | N342: SEVIOR | Q342: HOARE | W342: PRAHRAN | X342: 7 | Y342: 1 | Z342: 0 | AA342: 674 | AB342: 395 | AC342: 170.63291139240508 | AD342: 28
A343: NORTH MELBOURNE | C343: PEMBERTON | F343: HARDY | I343: TRELOAR | K343: DWYER | N343: HAMMOND | Q343: J JOHNSON | W343: NORTH MELBOURNE | X343: 5 | Y343: 3 | Z343: 0 | AA343: 571 | AB343: 413 | AC343: 138.25665859564165 | AD343: 20
A344: GOALKICKERS | W344: PORT MELBOURNE | X344: 5 | Y344: 3 | Z344: 0 | AA344: 470 | AB344: 351 | AC344: 133.90313390313389 | AD344: 20
A345: ESSENDON ASSOC. | C345: McNAMARA 4 | G345: CHAPMAN 2 | J345: HOARE 2 | M345: CLARKE 2 | P345: WILKINSON
A346: NORTH MELBOURNE | C346: HARDY 2 | G346: DWYER 2 | J346: ELLIOTT | M346: HAMMOND | W346: BRUNSWICK | X346: 5 | Y346: 3 | Z346: 0 | AA346: 466 | AB346: 414 | AC346: 112.56038647342996 | AD346: 20
W347: FOOTSCRAY | X347: 4 | Y347: 4 | Z347: 0 | AA347: 498 | AB347: 361 | AC347: 137.95013850415512 | AD347: 16
A348: FOOTSCRAY | C348: 2 | D348: 1 | E348: =C348*6+D348 -> 13 | G348: 3 | H348: 2 | I348: =G348*6+H348 -> 20 | K348: 7 | L348: 3 | M348: =K348*6+L348 -> 45 | O348: 8 | P348: 6 | Q348: =O348*6+P348 -> 54 | S348: PORT MELB | W348: WILLIAMSTOWN | X348: 2 | Y348: 6 | Z348: 0 | AA348: 359 | AB348: 419 | AC348: 85.680190930787589 | AD348: 8
A349: PORT MELBOURNE | C349: 1 | D349: 5 | E349: =C349*6+D349 -> 11 | G349: 3 | H349: 7 | I349: =G349*6+H349 -> 25 | K349: 3 | L349: 8 | M349: =K349*6+L349 -> 26 | O349: 4 | P349: 9 | Q349: =O349*6+P349 -> 33 | S349: KENDALL | W349: BRIGHTON | X349: 2 | Y349: 6 | Z349: 0 | AA349: 286 | AB349: 497 | AC349: 57.545271629778675 | AD349: 8
A350: BEST PLAYERS | W350: NORTHCOTE | X350: 1 | Y350: 7 | Z350: 0 | AA350: 312 | AB350: 604 | AC350: 51.65562913907285 | AD350: 4
A351: FOOTSCRAY | C351: COTTON | F351: CROUCH | I351: STEWART | L351: OGILVIE | O351: BAXTER | Q351: HARRIS | W351: PRESTON | X351: 1 | Y351: 7 | Z351: 0 | AA351: 345 | AB351: 850 | AC351: 40.588235294117645 | AD351: 4
A352: PORT MELBOURNE | C352: CLELAND | F352: ANDERSON | I352: SAMPSON | L352: PAMPERIN | O352: JINKS | Q352: HENDRIE
A353: GOALKICKERS
A354: FOOTSCRAY | C354: McDONALD 3 | G354: STEWART 2 | J354: SPENCE | L354: OGILVIE | N354: KNIGHT
A355: PORT MELBOURNE | C355: TREGLOWN | G355: JONES | J355: BROWN | L355: PASH
A357: BRUNSWICK | C357: 1 | D357: 5 | E357: =C357*6+D357 -> 11 | G357: 3 | H357: 9 | I357: =G357*6+H357 -> 27 | K357: 6 | L357: 11 | M357: =K357*6+L357 -> 47 | O357: 10 | P357: 17 | Q357: =O357*6+P357 -> 77 | S357: BRUNSWICK
A358: BRIGHTON | C358: 0 | D358: 1 | E358: =C358*6+D358 -> 1 | G358: 1 | H358: 3 | I358: =G358*6+H358 -> 9 | K358: 1 | L358: 5 | M358: =K358*6+L358 -> 11 | O358: 1 | P358: 5 | Q358: =O358*6+P358 -> 11 | S358: HURLEY
A359: BEST PLAYERS
A360: BRUNSWICK | C360: CHASE | F360: McKENZIE | I360: L BRAID | L360: MILLS | N360: CARRIE | Q360: STANCLIFFE
A361: BRIGHTON | C361: B BAILES | F361: TAYLOR | I361: TURNBULL | L361: WRIGHT | N361: MANN | Q361: W ROBINSON
A362: GOALKICKERS
A363: BRUNSWICK | C363: CHASE 6 | F363: STEVENSON 2 | J363: McKENZIE | M363: STANCLIFFE
A364: BRIGHTON | C364: W ROBINSON
A366: NORTHCOTE | C366: 1 | D366: 4 | E366: =C366*6+D366 -> 10 | G366: 3 | H366: 7 | I366: =G366*6+H366 -> 25 | K366: 5 | L366: 8 | M366: =K366*6+L366 -> 38 | O366: 6 | P366: 12 | Q366: =O366*6+P366 -> 48 | S366: CROXTON PK
A367: WILLIAMSTOWN | C367: 1 | D367: 2 | E367: =C367*6+D367 -> 8 | G367: 3 | H367: 3 | I367: =G367*6+H367 -> 21 | K367: 3 | L367: 4 | M367: =K367*6+L367 -> 22 | O367: 4 | P367: 8 | Q367: =O367*6+P367 -> 32 | S367: WREGG
A368: BEST PLAYERS
A369: NORTHCOTE | C369: HAUGHTON | F369: ROBERTS | I369: HOLMES | L369: SWIFT | N369: EARSMAN | Q369: COLE
A370: WILLIAMSTOWN | C370: ALLEY | F370: DAVIES | I370: FULLARTON | L370: HARDEN | N370: WEIDNER | Q370: AMY
A371: GOALKICKERS
A372: NORTHCOTE | C372: RYAN 2 | F372: BRISCOE | I372: ROURKE | L372: ROBERTS | O372: SCOTT
A373: WILLIAMSTOWN | C373: WEIDNER 2
A375: PRAHRAN | C375: 5 | D375: 6 | E375: =C375*6+D375 -> 36 | G375: 10 | H375: 9 | I375: =G375*6+H375 -> 69 | K375: 12 | L375: 10 | M375: =K375*6+L375 -> 82 | O375: 15 | P375: 18 | Q375: =O375*6+P375 -> 108 | S375: TOORAK PARK
A376: PRESTON | C376: 2 | D376: 2 | E376: =C376*6+D376 -> 14 | G376: 5 | H376: 2 | I376: =G376*6+H376 -> 32 | K376: 7 | L376: 4 | M376: =K376*6+L376 -> 46 | O376: 7 | P376: 6 | Q376: =O376*6+P376 -> 48 | S376: HUME
A377: BEST PLAYERS
A378: PRAHRAN | C378: DOWSING | F378: WOODS | I378: TURNBULL | L378: MORONEY | O378: WILSON | Q378: DOWDING
A379: PRESTON | C379: PUNCH | F379: ENRIGHT | I379: WOOLLEY | L379: BROWN | O379: McGEE | Q379: WHITE
A380: GOALKICKERS
A381: PRAHRAN | C381: DOWDING 4 | F381: HALL 4 | H381: SYKES 2 | J381: STEWART 2 | M381: FARMER | O381: DOWSING | Q381: WILSON | S381: CARLSON
A382: PRESTON | C382: BILLETT 2 | G382: ENRIGHT 2
A384: ROUND 9 | E384: 24TH JUNE | J384: WEATHER | M384: NORTH WEST WIND | S384: PLAYED AT | X384: LADDER | AB384: ROUND | AD384: 9
D385: 1ST QTR | H385: 2ND QTR | L385: 3RD QTR | P385: FINAL | S385: TOORAK PARK
A386: ESSENDON ASSOC. | C386: 1 | D386: 2 | E386: =C386*6+D386 -> 8 | G386: 2 | H386: 5 | I386: =G386*6+H386 -> 17 | K386: 2 | L386: 5 | M386: =K386*6+L386 -> 17 | O386: 7 | P386: 6 | Q386: =O386*6+P386 -> 48 | S386: UMPIRE | W386: TEAM | X386: W | Y386: L | Z386: D | AA386: FOR | AB386: AGST | AC386: % | AD386: PTS
A387: PRAHRAN | C387: 1 | D387: 2 | E387: =C387*6+D387 -> 8 | G387: 2 | H387: 3 | I387: =G387*6+H387 -> 15 | K387: 7 | L387: 5 | M387: =K387*6+L387 -> 47 | O387: 7 | P387: 5 | Q387: =O387*6+P387 -> 47 | S387: KENDALL
A388: BEST PLAYERS | W388: ESSENDON ASSOC. | X388: 9 | Y388: 0 | Z388: 0 | AA388: 648 | AB388: 324 | AC388: 200 | AD388: 36
A389: ESSENDON ASSOC. | C389: McNAMARA | F389: MAINE | I389: MADDEN | L389: CHAPMAN | O389: SEVIOR | Q389: HOARE | W389: PRAHRAN | X389: 7 | Y389: 2 | Z389: 0 | AA389: 721 | AB389: 443 | AC389: 162.75395033860045 | AD389: 28
A390: PRAHRAN | C390: MORONEY | F390: NORMAN | I390: STEWART | L390: CARLSON | O390: HALL | Q390: WOODS | W390: NORTH MELBOURNE | X390: 6 | Y390: 3 | Z390: 0 | AA390: 627 | AB390: 430 | AC390: 145.81395348837211 | AD390: 24
A391: GOALKICKERS | W391: PORT MELBOURNE | X391: 6 | Y391: 3 | Z391: 0 | AA391: 528 | AB391: 374 | AC391: 141.1764705882353 | AD391: 24
A392: ESSENDON ASSOC. | C392: CHAPMAN 2 | G392: CLARKE 2 | J392: WILKINSON | M392: BUSBRIDGE | P392: PAIN
A393: PRAHRAN | C393: SYKES 2 | F393: FARMER | I393: DOWSING | L393: ELLIN | N393: STEWART | Q393: MORONEY | W393: BRUNSWICK | X393: 6 | Y393: 3 | Z393: 0 | AA393: 558 | AB393: 453 | AC393: 123.17880794701986 | AD393: 24
W394: FOOTSCRAY | X394: 4 | Y394: 5 | Z394: 0 | AA394: 539 | AB394: 403 | AC394: 133.7468982630273 | AD394: 16
A395: PORT MELBOURNE | C395: 3 | D395: 3 | E395: =C395*6+D395 -> 21 | G395: 5 | H395: 6 | I395: =G395*6+H395 -> 36 | K395: 8 | L395: 9 | M395: =K395*6+L395 -> 57 | O395: 8 | P395: 10 | Q395: =O395*6+P395 -> 58 | S395: PORT MELB | W395: WILLIAMSTOWN | X395: 2 | Y395: 7 | Z395: 0 | AA395: 376 | AB395: 475 | AC395: 79.15789473684211 | AD395: 8
A396: BRIGHTON | C396: 0 | D396: 1 | E396: =C396*6+D396 -> 1 | G396: 1 | H396: 1 | I396: =G396*6+H396 -> 7 | K396: 1 | L396: 3 | M396: =K396*6+L396 -> 9 | O396: 3 | P396: 5 | Q396: =O396*6+P396 -> 23 | S396: HOOD | W396: BRIGHTON | X396: 2 | Y396: 7 | Z396: 0 | AA396: 309 | AB396: 555 | AC396: 55.675675675675677 | AD396: 8
A397: BEST PLAYERS | W397: NORTHCOTE | X397: 2 | Y397: 7 | Z397: 0 | AA397: 354 | AB397: 645 | AC397: 54.883720930232556 | AD397: 8
A398: PORT MELBOURNE | C398: TREGLOWN | F398: ANDERSON | I398: SAMPSON | L398: BACHLI | O398: CLELAND | Q398: PAMPERIN | W398: PRESTON | X398: 1 | Y398: 8 | Z398: 0 | AA398: 384 | AB398: 942 | AC398: 40.764331210191081 | AD398: 4
A399: BRIGHTON | C399: BELLER | F399: TURNER | I399: TAYLOR | L399: GIBNEY | O399: NEIL | Q399: KNIGHT
A400: GOALKICKERS
A401: PORT MELBOURNE | C401: HUTCHINSON 3 | G401: WILMOTT 2 | J401: TREGLOWN | M401: CLELAND | P401: PASH
A402: BRIGHTON | C402: STEWART | F402: HANNAFORD | I402: W ROBINSON
A404: NORTH MELBOURNE | C404: 1 | D404: 3 | E404: =C404*6+D404 -> 9 | G404: 5 | H404: 7 | I404: =G404*6+H404 -> 37 | K404: 5 | L404: 7 | M404: =K404*6+L404 -> 37 | O404: 7 | P404: 14 | Q404: =O404*6+P404 -> 56 | S404: WILLIAMSTOWN
A405: WILLIAMSTOWN | C405: 1 | D405: 2 | E405: =C405*6+D405 -> 8 | G405: 2 | H405: 2 | I405: =G405*6+H405 -> 14 | K405: 2 | L405: 4 | M405: =K405*6+L405 -> 16 | O405: 2 | P405: 5 | Q405: =O405*6+P405 -> 17 | S405: HERBERT
A406: BEST PLAYERS
A407: NORTH MELBOURNE | C407: PEMBERTON | F407: G JOHNSON | I407: LAVER | L407: J JOHNSON | O407: S BARKER | R407: HARDY
A408: WILLIAMSTOWN | C408: ALLEY | F408: JOY | I408: STRCKFUSS | L408: WEIDNER | O408: COLLINS | R408: HARDEN
A409: GOALKICKERS
A410: NORTH MELBOURNE | C410: CAINE 2 | F410: HAMMOND | I410: ELLIOTT | K410: HERON | N410: G JOHNSON | Q410: HARDY
A411: WILLIAMSTOWN | C411: STRECKFUSS | G411: REYNOLDS
A413: NORTHCOTE | C413: 1 | D413: 1 | E413: =C413*6+D413 -> 7 | G413: 5 | H413: 5 | I413: =G413*6+H413 -> 35 | K413: 5 | L413: 5 | M413: =K413*6+L413 -> 35 | O413: 6 | P413: 6 | Q413: =O413*6+P413 -> 42 | S413: CROXTON PK
A414: FOOTSCRAY | C414: 5 | D414: 2 | E414: =C414*6+D414 -> 32 | G414: 5 | H414: 4 | I414: =G414*6+H414 -> 34 | K414: 6 | L414: 4 | M414: =K414*6+L414 -> 40 | O414: 6 | P414: 5 | Q414: =O414*6+P414 -> 41 | S414: ALLEY
A415: BEST PLAYERS
A416: NORTHCOTE | C416: HAUGHTON | F416: SWIFT | I416: COLE | L416: BECK | O416: HOLMES | R416: WALKER
A417: FOOTSCRAY | C417: BAXTER | F417: CROUCH | I417: COTTON | L417: OGILVIE | O417: HANSON
A418: GOALKICKERS
A419: NORTHCOTE | C419: HAUGHTON 2
A420: FOOTSCRAY | C420: KNIGHT 2 | F420: COTTON | I420: CROUCH | L420: OGILVIE | O420: STEWART
A422: BRUNSWICK | C422: 1 | D422: 2 | E422: =C422*6+D422 -> 8 | G422: 7 | H422: 7 | I422: =G422*6+H422 -> 49 | K422: 9 | L422: 7 | M422: =K422*6+L422 -> 61 | O422: 13 | P422: 14 | Q422: =O422*6+P422 -> 92 | S422: PRESTON
A423: PRESTON | C423: 2 | D423: 4 | E423: =C423*6+D423 -> 16 | G423: 2 | H423: 4 | I423: =G423*6+H423 -> 16 | K423: 5 | L423: 8 | M423: =K423*6+L423 -> 38 | O423: 5 | P423: 9 | Q423: =O423*6+P423 -> 39 | S423: HURLEY
A424: BEST PLAYERS
A425: BRUNSWICK | C425: McLEAN | F425: LEEDS | I425: L BRAID | L425: STANCLIFFE | O425: CHASE | R425: McKENZIE
A426: PRESTON | C426: DUNCAN | F426: PUNCH | I426: McGEE | L426: WHITE | O426: ENRIGHT | R426: GILBERT
A427: GOALKICKERS
A428: BRUNSWICK | C428: McKENZIE 3 | G428: CHASE 2 | J428: CONLEY 2 | M428: L BRAID 2 | P428: MILLS 2
A429: PRESTON
A431: ROUND 10 | E431: 1ST JULY | S431: PLAYED AT | X431: LADDER | AB431: ROUND | AD431: 10
D432: 1ST QTR | H432: 2ND QTR | L432: 3RD QTR | P432: FINAL | S432: PORT MELB
A433: PORT MELBOURNE | C433: 2 | D433: 1 | E433: =C433*6+D433 -> 13 | G433: 3 | H433: 3 | I433: =G433*6+H433 -> 21 | K433: 5 | L433: 6 | M433: =K433*6+L433 -> 36 | O433: 6 | P433: 9 | Q433: =O433*6+P433 -> 45 | S433: UMPIRE | W433: TEAM | X433: W | Y433: L | Z433: D | AA433: FOR | AB433: AGST | AC433: % | AD433: PTS
A434: BRUNSWICK | C434: 0 | D434: 2 | E434: =C434*6+D434 -> 2 | G434: 4 | H434: 7 | I434: =G434*6+H434 -> 31 | K434: 5 | L434: 11 | M434: =K434*6+L434 -> 41 | O434: 5 | P434: 12 | Q434: =O434*6+P434 -> 42 | S434: HERBERT
A435: BEST PLAYERS | W435: ESSENDON ASSOC. | X435: 10 | Y435: 0 | Z435: 0 | AA435: 748 | AB435: 371 | AC435: 201.61725067385444 | AD435: 40
A436: PORT MELBOURNE | C436: JINKS | F436: ANDERSON | I436: TREGLOWN | L436: HENDRIE | N436: CLELAND | Q436: BACHLI | W436: PRAHRAN | X436: 8 | Y436: 2 | Z436: 0 | AA436: 789 | AB436: 493 | AC436: 160.04056795131845 | AD436: 32
A437: BRUNSWICK | C437: CONLEY | F437: STEVENSON | I437: STANCLIFFE | L437: McLEAN | N437: L BRAID | Q437: McKENZIE | W437: NORTH MELBOURNE | X437: 7 | Y437: 3 | Z437: 0 | AA437: 696 | AB437: 478 | AC437: 145.60669456066947 | AD437: 28
A438: GOALKICKERS | W438: PORT MELBOURNE | X438: 7 | Y438: 3 | Z438: 0 | AA438: 573 | AB438: 416 | AC438: 137.74038461538461 | AD438: 28
A439: PORT MELBOURNE | C439: TREGLOWN 3 | G439: PASH | J439: BACHLI | M439: HUTCHINSON
A440: BRUNSWICK | C440: McKENZIE | G440: JOHNSON | J440: MILLS | M440: CONLEY | P440: CARRIE | W440: BRUNSWICK | X440: 6 | Y440: 4 | Z440: 0 | AA440: 600 | AB440: 498 | AC440: 120.48192771084338 | AD440: 24
W441: FOOTSCRAY | X441: 5 | Y441: 5 | Z441: 0 | AA441: 601 | AB441: 438 | AC441: 137.21461187214612 | AD441: 20
A442: FOOTSCRAY | C442: 2 | D442: 2 | E442: =C442*6+D442 -> 14 | G442: 6 | H442: 11 | I442: =G442*6+H442 -> 47 | K442: 6 | L442: 11 | M442: =K442*6+L442 -> 47 | O442: 8 | P442: 14 | Q442: =O442*6+P442 -> 62 | S442: FOOTSCRAY | W442: WILLIAMSTOWN | X442: 2 | Y442: 8 | Z442: 0 | AA442: 411 | AB442: 537 | AC442: 76.536312849162016 | AD442: 8
A443: WILLIAMSTOWN | C443: 2 | D443: 2 | E443: =C443*6+D443 -> 14 | G443: 2 | H443: 2 | I443: =G443*6+H443 -> 14 | K443: 5 | L443: 4 | M443: =K443*6+L443 -> 34 | O443: 5 | P443: 5 | Q443: =O443*6+P443 -> 35 | S443: HURLEY | W443: BRIGHTON | X443: 2 | Y443: 8 | Z443: 0 | AA443: 359 | AB443: 623 | AC443: 57.624398073836275 | AD443: 8
A444: BEST PLAYERS | W444: NORTHCOTE | X444: 2 | Y444: 8 | Z444: 0 | AA444: 401 | AB444: 745 | AC444: 53.825503355704697 | AD444: 8
A445: FOOTSCRAY | C445: COTTON | F445: DUANE | I445: OGILVIE | L445: BANBURY | N445: BAXTER | Q445: McCARTHY | W445: PRESTON | X445: 1 | Y445: 9 | Z445: 0 | AA445: 432 | AB445: 1011 | AC445: 42.729970326409493 | AD445: 4
A446: WILLIAMSTOWN | C446: HARDEN | F446: LITCHFIELD | I446: LAMPRELL | L446: REITMAN | N446: WEIDNER | Q446: ALLEY
A447: GOALKICKERS
A448: FOOTSCRAY | C448: KNIGHT 4 | F448: STEWART | I448: McDONALD | L448: NASH | N448: COTTON
A449: WILLIAMSTOWN | C449: LITCHFIELD 2 | G449: DANKS | J449: COLLINS | M449: DAVIES
A451: PRAHRAN | C451: 1 | D451: 2 | E451: =C451*6+D451 -> 8 | G451: 4 | H451: 9 | I451: =G451*6+H451 -> 33 | K451: 8 | L451: 11 | M451: =K451*6+L451 -> 59 | O451: 8 | P451: 20 | Q451: =O451*6+P451 -> 68 | S451: TOORAK PARK
A452: BRIGHTON | C452: 1 | D452: 0 | E452: =C452*6+D452 -> 6 | G452: 2 | H452: 1 | I452: =G452*6+H452 -> 13 | K452: 6 | L452: 7 | M452: =K452*6+L452 -> 43 | O452: 7 | P452: 8 | Q452: =O452*6+P452 -> 50 | S452: KENDALL
A453: BEST PLAYERS
A454: PRAHRAN | C454: WILSON | F454: WOODS | I454: MORONEY | L454: STEWART | O454: FARMER | R454: SYKES
A455: BRIGHTON | C455: B BAILES | F455: McGREGOR | I455: NEIL | L455: EDMONDS | O455: HANNAFORD
A456: GOALKICKERS
A457: PRAHRAN | C457: STEWART 3 | G457: SYKES 3 | J457: FARMER
A458: BRIGHTON | C458: EDMONDS 4 | G458: HANNAFORD | J458: McGREGOR | M458: W ROBINSON
A460: NORTH MELBOURNE | C460: 0 | D460: 0 | E460: =C460*6+D460 -> 0 | G460: 4 | H460: 3 | I460: =G460*6+H460 -> 27 | K460: 7 | L460: 6 | M460: =K460*6+L460 -> 48 | O460: 10 | P460: 9 | Q460: =O460*6+P460 -> 69 | S460: PRESTON | W460: NM HAD SCORED 7-5 WHEN A
A461: PRESTON | C461: 2 | D461: 1 | E461: =C461*6+D461 -> 13 | G461: 3 | H461: 2 | I461: =G461*6+H461 -> 20 | K461: 5 | L461: 5 | M461: =K461*6+L461 -> 35 | O461: 7 | P461: 6 | Q461: =O461*6+P461 -> 48 | S461: HUME | W461: COUNT PROVED TOO MANY PLAYERS
A462: BEST PLAYERS | W462: N.M. HAD SCORE DISQUALIFIED
A463: NORTH MELBOURNE | C463: G JOHNSON | F463: LAVER | I463: S BARKER | L463: J JOHNSON | O463: CAINE | R463: HOLT | W463: AND STARTED AGAIN AT 0-0
A464: PRESTON | C464: PUNCH | F464: BROWN | I464: McGEE | L464: WOOLEY | O464: ENRIGHT
A465: GOALKICKERS
A466: NORTH MELBOURNE | C466: ELLIOTT 4 | G466: CAINE 2 | J466: WILLIAMSON 2 | N466: G BARKER 2 | R466: (DISQ SCORERS) | W466: CAINE 4 | X466: G BARKER 2 | AA466: CORRIGAN
A467: PRESTON | C467: PUNCH 2 | F467: LEADER | I467: McGEE | K467: DUNCAN | N467: WHITE
A469: ESSENDON ASSOC. | C469: 2 | D469: 2 | E469: =C469*6+D469 -> 14 | G469: 4 | H469: 9 | I469: =G469*6+H469 -> 33 | K469: 9 | L469: 14 | M469: =K469*6+L469 -> 68 | O469: 14 | P469: 16 | Q469: =O469*6+P469 -> 100 | S469: CROXTON PK
A470: NORTHCOTE | C470: 3 | D470: 4 | E470: =C470*6+D470 -> 22 | G470: 4 | H470: 7 | I470: =G470*6+H470 -> 31 | K470: 4 | L470: 10 | M470: =K470*6+L470 -> 34 | O470: 6 | P470: 11 | Q470: =O470*6+P470 -> 47 | S470: HURLEY
A471: BEST PLAYERS
A472: ESSENDON ASSOC. | C472: McNAMARA | F472: SEVIOR | I472: MADDEN | L472: MAINE | O472: WILKINSON | R472: HOARE
A473: NORTHCOTE | C473: COLE | F473: ROURKE | I473: BECK | L473: LAWSON | O473: RYAN | R473: HOLMES
A474: GOALKICKERS
A475: ESSENDON ASSOC. | C475: McNAMARA 6 | G475: HOARE 3 | J475: McCANN 2 | M475: CHAPMAN | P475: WILKINSON | S475: CLARKE
A476: NORTHCOTE | C476: LAWSON 3 | G476: ROBERTS 2 | J476: RYAN
A478: ROUND 11 | E478: 8TH JULY | S478: PLAYED AT | X478: LADDER | AB478: ROUND | AD478: 11
D479: 1ST QTR | H479: 2ND QTR | L479: 3RD QTR | P479: FINAL | S479: ESSENDON
A480: ESSENDON ASSOC. | C480: 4 | D480: 5 | E480: =C480*6+D480 -> 29 | G480: 4 | H480: 10 | I480: =G480*6+H480 -> 34 | K480: 6 | L480: 16 | M480: =K480*6+L480 -> 52 | O480: 10 | P480: 17 | Q480: =O480*6+P480 -> 77 | S480: UMPIRE | W480: TEAM | X480: W | Y480: L | Z480: D | AA480: FOR | AB480: AGST | AC480: % | AD480: PTS
A481: PORT MELBOURNE | C481: 2 | D481: 0 | E481: =C481*6+D481 -> 12 | G481: 3 | H481: 5 | I481: =G481*6+H481 -> 23 | K481: 4 | L481: 7 | M481: =K481*6+L481 -> 31 | O481: 7 | P481: 7 | Q481: =O481*6+P481 -> 49 | S481: HOOD
A482: BEST PLAYERS | W482: ESSENDON ASSOC. | X482: 11 | Y482: 0 | Z482: 0 | AA482: 825 | AB482: 420 | AC482: 196.42857142857142 | AD482: 44
A483: ESSENDON ASSOC. | C483: CHAPMAN | F483: WALKER | I483: HOARE | L483: WILKINSON | O483: PAIN | Q483: GOUGH | W483: PRAHRAN | X483: 8 | Y483: 3 | Z483: 0 | AA483: 831 | AB483: 542 | AC483: 153.3210332103321 | AD483: 32
A484: PORT MELBOURNE | C484: DANKS | F484: McDONALD | I484: TREGLOWN | L484: JINKS | O484: MOXHAM | Q484: MAYNARD | W484: NORTH MELBOURNE | X484: 8 | Y484: 3 | Z484: 0 | AA484: 737 | AB484: 506 | AC484: 145.65217391304347 | AD484: 32
A485: GOALKICKERS | W485: PORT MELBOURNE | X485: 7 | Y485: 4 | Z485: 0 | AA485: 622 | AB485: 493 | AC485: 126.16632860040568 | AD485: 28
A486: ESSENDON ASSOC. | C486: HOARE 2 | E486: CLARKE 2 | G486: GOUGH | I486: FRENCH | K486: McCANN | M486: WALKER | O486: CHAPMAN | Q486: McNAMARA
A487: PORT MELBOURNE | C487: DANKS 2 | F487: HUTCHINSON 2 | J487: PASH 2 | M487: TREGLOWN | W487: BRUNSWICK | X487: 7 | Y487: 4 | Z487: 0 | AA487: 649 | AB487: 540 | AC487: 120.18518518518519 | AD487: 28
W488: FOOTSCRAY | X488: 5 | Y488: 6 | Z488: 0 | AA488: 629 | AB488: 479 | AC488: 131.31524008350732 | AD488: 20
A489: BRUNSWICK | C489: 1 | D489: 3 | E489: =C489*6+D489 -> 9 | G489: 3 | H489: 4 | I489: =G489*6+H489 -> 22 | K489: 3 | L489: 9 | M489: =K489*6+L489 -> 27 | O489: 6 | P489: 13 | Q489: =O489*6+P489 -> 49 | S489: BRUNSWICK | W489: WILLIAMSTOWN | X489: 3 | Y489: 8 | Z489: 0 | AA489: 461 | AB489: 566 | AC489: 81.448763250883388 | AD489: 12
A490: PRAHRAN | C490: 1 | D490: 3 | E490: =C490*6+D490 -> 9 | G490: 2 | H490: 8 | I490: =G490*6+H490 -> 20 | K490: 4 | L490: 11 | M490: =K490*6+L490 -> 35 | O490: 5 | P490: 12 | Q490: =O490*6+P490 -> 42 | S490: HURLEY | W490: NORTHCOTE | X490: 3 | Y490: 8 | Z490: 0 | AA490: 463 | AB490: 792 | AC490: 58.459595959595958 | AD490: 12
A491: BEST PLAYERS | W491: BRIGHTON | X491: 2 | Y491: 9 | Z491: 0 | AA491: 406 | AB491: 685 | AC491: 59.270072992700733 | AD491: 8
A492: BRUNSWICK | C492: JOHNSON | F492: CONLEY | H492: THOMPSON | K492: STANCLIFFE | N492: STEVENSON | Q492: GILLESPIE | W492: PRESTON | X492: 1 | Y492: 10 | Z492: 0 | AA492: 461 | AB492: 1061 | AC492: 43.449575871819036 | AD492: 4
A493: PRAHRAN | C493: NORMAN | F493: DOWSING | H493: MOLONEY | K493: PANNAM | N493: FARMER | Q493: WILSON
A494: GOALKICKERS
A495: BRUNSWICK | C495: CONLEY 2 | G495: STANCLIFFE 2 | K495: MILLS | M495: PRICE
A496: PRAHRAN | C496: NORMAN | F496: FARMER | I496: WINTER
A498: NORTH MELBOURNE | C498: 1 | D498: 2 | E498: =C498*6+D498 -> 8 | G498: 3 | H498: 7 | I498: =G498*6+H498 -> 25 | K498: 3 | L498: 11 | M498: =K498*6+L498 -> 29 | O498: 5 | P498: 11 | Q498: =O498*6+P498 -> 41 | S498: NORTH MELB
A499: FOOTSCRAY | C499: 2 | D499: 2 | E499: =C499*6+D499 -> 14 | G499: 2 | H499: 5 | I499: =G499*6+H499 -> 17 | K499: 2 | L499: 8 | M499: =K499*6+L499 -> 20 | O499: 3 | P499: 10 | Q499: =O499*6+P499 -> 28 | S499: ALLEY
A500: BEST PLAYERS
A501: NORTH MELBOURNE | C501: J JOHNSON | F501: HAMMOND | I501: TRELOAR | L501: G JOHNSON | O501: PEMBERTON | R501: WILLIAMSON
A502: FOOTSCRAY | C502: COTTON | F502: HART | I502: WHITE | L502: McCARTHY | O502: HANSON | R502: SPENCE
A503: GOALKICKERS
A504: NORTH MELBOURNE | C504: CAINE 2 | F504: S BARKER | I504: WILLIAMSON | L504: G BARKER
A505: FOOTSCRAY | C505: BANBURY 2 | G505: STEWART
A507: NORTHCOTE | C507: 1 | D507: 2 | E507: =C507*6+D507 -> 8 | G507: 5 | H507: 3 | I507: =G507*6+H507 -> 33 | K507: 7 | L507: 4 | M507: =K507*6+L507 -> 46 | O507: 9 | P507: 8 | Q507: =O507*6+P507 -> 62 | S507: BRIGHTON
A508: BRIGHTON | C508: 3 | D508: 2 | E508: =C508*6+D508 -> 20 | G508: 5 | H508: 3 | I508: =G508*6+H508 -> 33 | K508: 6 | L508: 5 | M508: =K508*6+L508 -> 41 | O508: 7 | P508: 5 | Q508: =O508*6+P508 -> 47 | S508: KENDALL
A509: BEST PLAYERS
A510: NORTHCOTE | C510: HAUGHTON | F510: BECK | I510: DANIELS | L510: HOLMES | O510: PYKE | Q510: BRISCOE
A511: BRIGHTON | C511: BRIDGEFORD | F511: E BAILES | I511: W ROBINSON | L511: BELLER | O511: TURNBULL | Q511: TAYLOR
A512: GOALKICKERS
A513: NORTHCOTE | C513: LAWSON 3 | G513: DANIELS 2
A514: BRIGHTON | C514: EDMONDS 3 | G514: W ROBINSON 2 | K514: BELLER | N514: TURNBULL
A516: WILLIAMSTOWN | C516: 1 | D516: 0 | E516: =C516*6+D516 -> 6 | G516: 3 | H516: 1 | I516: =G516*6+H516 -> 19 | K516: 5 | L516: 7 | M516: =K516*6+L516 -> 37 | O516: 7 | P516: 8 | Q516: =O516*6+P516 -> 50 | S516: WILLIAMSTOWN
A517: PRESTON | C517: 1 | D517: 3 | E517: =C517*6+D517 -> 9 | G517: 2 | H517: 4 | I517: =G517*6+H517 -> 16 | K517: 3 | L517: 5 | M517: =K517*6+L517 -> 23 | O517: 4 | P517: 5 | Q517: =O517*6+P517 -> 29 | S517: HERBERT
A518: BEST PLAYERS
A519: WILLIAMSTOWN
A520: PRESTON
A521: GOALKICKERS
A522: WILLIAMSTOWN
A523: PRESTON
A525: ROUND 12 | E525: 15TH JULY | J525: WEATHER | M525: STRONG NORTH WIND | S525: PLAYED AT | X525: LADDER | AB525: ROUND | AD525: 12
D526: 1ST QTR | H526: 2ND QTR | L526: 3RD QTR | P526: FINAL | S526: BRUNSWICK
A527: BRUNSWICK | C527: 1 | D527: 0 | E527: =C527*6+D527 -> 6 | G527: 2 | H527: 2 | I527: =G527*6+H527 -> 14 | K527: 4 | L527: 4 | M527: =K527*6+L527 -> 28 | O527: 7 | P527: 6 | Q527: =O527*6+P527 -> 48 | S527: UMPIRE | W527: TEAM | X527: W | Y527: L | Z527: D | AA527: FOR | AB527: AGST | AC527: % | AD527: PTS
A528: NORTH MELBOURNE | C528: 1 | D528: 4 | E528: =C528*6+D528 -> 10 | G528: 2 | H528: 5 | I528: =G528*6+H528 -> 17 | K528: 3 | L528: 8 | M528: =K528*6+L528 -> 26 | O528: 4 | P528: 9 | Q528: =O528*6+P528 -> 33 | S528: BEAUMONT
A529: BEST PLAYERS | W529: ESSENDON ASSOC. | X529: 12 | Y529: 0 | Z529: 0 | AA529: 896 | AB529: 448 | AC529: 200 | AD529: 48
A530: BRUNSWICK | C530: JOHNSON | F530: MILLS | I530: STANCLIFFE | L530: STEVENSON | O530: McLEAN | R530: CARRIE | W530: PRAHRAN | X530: 9 | Y530: 3 | Z530: 0 | AA530: 919 | AB530: 574 | AC530: 160.10452961672473 | AD530: 36
A531: NORTH MELBOURNE | C531: HAMMOND | F531: S BARKER | I531: G JOHNSON | L531: J JOHNSON | O531: WILLIAMSON | R531: RAWLE | W531: NORTH MELBOURNE | X531: 8 | Y531: 4 | Z531: 0 | AA531: 770 | AB531: 554 | AC531: 138.98916967509027 | AD531: 32
A532: GOALKICKERS | W532: PORT MELBOURNE | X532: 8 | Y532: 4 | Z532: 0 | AA532: 699 | AB532: 523 | AC532: 133.65200764818357 | AD532: 32
A533: BRUNSWICK | C533: CONLEY 3 | G533: STEVENSON 2 | K533: PRICE | N533: BRITTON
A534: NORTH MELBOURNE | C534: HERON | F534: G BARKER | I534: CORRIGAN | L534: ELLIOTT | W534: BRUNSWICK | X534: 8 | Y534: 4 | Z534: 0 | AA534: 697 | AB534: 573 | AC534: 121.64048865619546 | AD534: 32
W535: FOOTSCRAY | X535: 6 | Y535: 6 | Z535: 0 | AA535: 679 | AB535: 516 | AC535: 131.58914728682171 | AD535: 24
A536: ESSENDON ASSOC. | C536: 1 | D536: 2 | E536: =C536*6+D536 -> 8 | G536: 3 | H536: 5 | I536: =G536*6+H536 -> 23 | K536: 8 | L536: 8 | M536: =K536*6+L536 -> 56 | O536: 10 | P536: 11 | Q536: =O536*6+P536 -> 71 | S536: ESSENDON | W536: WILLIAMSTOWN | X536: 3 | Y536: 9 | Z536: 0 | AA536: 489 | AB536: 637 | AC536: 76.766091051805333 | AD536: 12
A537: WILLIAMSTOWN | C537: 1 | D537: 1 | E537: =C537*6+D537 -> 7 | G537: 1 | H537: 4 | I537: =G537*6+H537 -> 10 | K537: 1 | L537: 5 | M537: =K537*6+L537 -> 11 | O537: 3 | P537: 10 | Q537: =O537*6+P537 -> 28 | S537: HURLEY | W537: NORTHCOTE | X537: 3 | Y537: 9 | Z537: 0 | AA537: 495 | AB537: 880 | AC537: 56.25 | AD537: 12
A538: BEST PLAYERS | W538: BRIGHTON | X538: 2 | Y538: 10 | Z538: 0 | AA538: 443 | AB538: 735 | AC538: 60.272108843537417 | AD538: 8
A539: ESSENDON ASSOC. | C539: WALKER | F539: McNAMARA | I539: PAIN | L539: McINTYRE | O539: WILKINSON | R539: HAMBRIDGE | W539: PRESTON | X539: 1 | Y539: 11 | Z539: 0 | AA539: 491 | AB539: 1138 | AC539: 43.145869947275919 | AD539: 4
A540: WILLIAMSTOWN | C540: FERGUSON | F540: DAVIES | I540: ELDRIDGE | L540: STRECKFUSS | O540: LITTLE | R540: GIBBS
A541: GOALKICKERS
A542: ESSENDON ASSOC. | C542: McNAMARA 3 | G542: WALKER 2 | J542: FRENCH 2 | M542: WILKINSON 2 | P542: HAMBRIDGE
A543: WILLIAMSTOWN | C543: LAMPRELL | G543: HALL | J543: ELDRIDGE
A545: FOOTSCRAY | C545: 0 | D545: 1 | E545: =C545*6+D545 -> 1 | G545: 3 | H545: 9 | I545: =G545*6+H545 -> 27 | K545: 3 | L545: 12 | M545: =K545*6+L545 -> 30 | O545: 5 | P545: 20 | Q545: =O545*6+P545 -> 50 | S545: FOOTSCRAY
A546: BRIGHTON | C546: 2 | D546: 2 | E546: =C546*6+D546 -> 14 | G546: 2 | H546: 3 | I546: =G546*6+H546 -> 15 | K546: 5 | L546: 7 | M546: =K546*6+L546 -> 37 | O546: 5 | P546: 7 | Q546: =O546*6+P546 -> 37 | S546: WREGG
A547: BEST PLAYERS
A548: FOOTSCRAY | C548: BAXTER | F548: SPENCE | I548: McCARTHY | L548: DUANE | O548: WHITE | R548: HANSON
A549: BRIGHTON | C549: BELLER | F549: BRIDGEFORD | I549: E BAILES | L549: GIBNEY | O549: TAYLOR | R549: NEIL
A550: GOALKICKERS
A551: FOOTSCRAY | C551: BAXTER | F551: BANBURY | I551: W KUSCHERT | L551: SPENCE | O551: HARRIS
A552: BRIGHTON | C552: BELLER | F552: TURNBULL | I552: EDMONDS | L552: NEIL | O552: GIBNEY
A554: PORT MELBOURNE | C554: 4 | D554: 9 | E554: =C554*6+D554 -> 33 | G554: 4 | H554: 9 | I554: =G554*6+H554 -> 33 | K554: 9 | L554: 18 | M554: =K554*6+L554 -> 72 | O554: 9 | P554: 23 | Q554: =O554*6+P554 -> 77 | S554: PRESTON
A555: PRESTON | C555: 0 | D555: 1 | E555: =C555*6+D555 -> 1 | G555: 2 | H555: 4 | I555: =G555*6+H555 -> 16 | K555: 2 | L555: 4 | M555: =K555*6+L555 -> 16 | O555: 4 | P555: 6 | Q555: =O555*6+P555 -> 30 | S555: ALLEY
A556: BEST PLAYERS
A557: PORT MELBOURNE | C557: HENDRIE | F557: JINKS | I557: MAYNARD | L557: McDONALD | O557: DANKS | R557: CRITCH
A558: PRESTON | C558: A BROWN | F558: PUNCH | I558: WHITE | L558: ENRIGHT | O558: DUNCAN | R558: McGEE
A559: GOALKICKERS
A560: PORT MELBOURNE | C560: TAYLOR 3 | F560: BENNION 2 | I560: PASH 2 | K560: HUTCHINSON | N560: BACHLI
A561: PRESTON | C561: McGEE | F561: LEADER | I561: MOORE | K561: DUNCAN
A563: PRAHRAN | C563: 0 | D563: 1 | E563: =C563*6+D563 -> 1 | G563: 4 | H563: 9 | I563: =G563*6+H563 -> 33 | K563: 5 | L563: 12 | M563: =K563*6+L563 -> 42 | O563: 12 | P563: 16 | Q563: =O563*6+P563 -> 88 | S563: TOORAK PARK
A564: NORTHCOTE | C564: 2 | D564: 4 | E564: =C564*6+D564 -> 16 | G564: 2 | H564: 4 | I564: =G564*6+H564 -> 16 | K564: 4 | L564: 7 | M564: =K564*6+L564 -> 31 | O564: 4 | P564: 8 | Q564: =O564*6+P564 -> 32 | S564: KENDALL
A565: BEST PLAYERS
A566: PRAHRAN | C566: STEWART | G566: MORONEY | J566: DOWSING | M566: JONES | O566: SYKES | R566: FARMER
A567: NORTHCOTE | C567: HAUGHTON | G567: DANIELS | J567: SCOTT | M567: PYKE | O567: BECK | R567: BRISCOE
A568: GOALKICKERS
A569: PRAHRAN | C569: SYKES 3 | F569: WINTER 2 | I569: STEWART 2 | L569: MORONEY | N569: SMITH | P569: FARMER | R569: DOWSING | V569: NORMAN
A570: NORTHCOTE | C570: LAWSON | F570: ARBUTHNOT
A572: ROUND 13 | E572: 22ND JULY | J572: WEATHER | M572: SHOWERS | S572: PLAYED AT | X572: LADDER | AB572: ROUND | AD572: 13
D573: 1ST QTR | H573: 2ND QTR | L573: 3RD QTR | P573: FINAL | S573: PORT MELB
A574: PRAHRAN | C574: 0 | D574: 4 | E574: =C574*6+D574 -> 4 | G574: 5 | H574: 5 | I574: =G574*6+H574 -> 35 | K574: 7 | L574: 7 | M574: =K574*6+L574 -> 49 | O574: 8 | P574: 8 | Q574: =O574*6+P574 -> 56 | S574: UMPIRE | W574: TEAM | X574: W | Y574: L | Z574: D | AA574: FOR | AB574: AGST | AC574: % | AD574: PTS
A575: PORT MELBOURNE | C575: 3 | D575: 2 | E575: =C575*6+D575 -> 20 | G575: 5 | H575: 3 | I575: =G575*6+H575 -> 33 | K575: 6 | L575: 4 | M575: =K575*6+L575 -> 40 | O575: 7 | P575: 6 | Q575: =O575*6+P575 -> 48 | S575: HURLEY
A576: BEST PLAYERS | W576: ESSENDON ASSOC. | X576: 12 | Y576: 1 | Z576: 0 | AA576: 931 | AB576: 488 | AC576: 190.77868852459017 | AD576: 48
A577: PRAHRAN | C577: MORONEY | F577: DARBY | I577: FARMER | L577: CARLSON | O577: DOWSING | R577: NORMAN | W577: PRAHRAN | X577: 10 | Y577: 3 | Z577: 0 | AA577: 975 | AB577: 622 | AC577: 156.75241157556269 | AD577: 40
A578: PORT MELBOURNE | C578: JINKS | F578: CLELAND | I578: MOXHAM | L578: ANDERSON | O578: TREGLOWN | R578: DANKS | W578: NORTH MELBOURNE | X578: 9 | Y578: 4 | Z578: 0 | AA578: 843 | AB578: 581 | AC578: 145.09466437177281 | AD578: 36
A579: GOALKICKERS | W579: PORT MELBOURNE | X579: 8 | Y579: 5 | Z579: 0 | AA579: 747 | AB579: 579 | AC579: 129.01554404145077 | AD579: 32
A580: PRAHRAN | C580: JONES 2 | F580: HANNAFORD 2 | J580: CARLSON | M580: FARMER | O580: NORMAN | Q580: SYKES
A581: PORT MELBOURNE | C581: TREGLOWN 2 | F581: PASH 2 | H581: DANKS | K581: MAYNARD | N581: HUTCHINSON | W581: BRUNSWICK | X581: 8 | Y581: 5 | Z581: 0 | AA581: 736 | AB581: 618 | AC581: 119.09385113268608 | AD581: 32
W582: FOOTSCRAY | X582: 7 | Y582: 6 | Z582: 0 | AA582: 719 | AB582: 551 | AC582: 130.49001814882033 | AD582: 28
A583: FOOTSCRAY | C583: 4 | D583: 2 | E583: =C583*6+D583 -> 26 | G583: 4 | H583: 5 | I583: =G583*6+H583 -> 29 | K583: 5 | L583: 10 | M583: =K583*6+L583 -> 40 | O583: 5 | P583: 10 | Q583: =O583*6+P583 -> 40 | S583: FOOTSCRAY | W583: WILLIAMSTOWN | X583: 4 | Y583: 9 | Z583: 0 | AA583: 534 | AB583: 676 | AC583: 78.994082840236686 | AD583: 16
A584: ESSENDON ASSOC. | C584: 1 | D584: 0 | E584: =C584*6+D584 -> 6 | G584: 5 | H584: 1 | I584: =G584*6+H584 -> 31 | K584: 5 | L584: 4 | M584: =K584*6+L584 -> 34 | O584: 5 | P584: 5 | Q584: =O584*6+P584 -> 35 | S584: HERBERT | W584: BRIGHTON | X584: 3 | Y584: 10 | Z584: 0 | AA584: 482 | AB584: 769 | AC584: 62.67880364109233 | AD584: 12
A585: BEST PLAYERS | W585: NORTHCOTE | X585: 3 | Y585: 10 | Z585: 0 | AA585: 522 | AB585: 953 | AC585: 54.77439664218258 | AD585: 12
A586: FOOTSCRAY | C586: SPENCE | F586: BAXTER | I586: WHITE | L586: HANSON | O586: OGILVIE | R586: BANBURY | W586: PRESTON | X586: 1 | Y586: 12 | Z586: 0 | AA586: 525 | AB586: 1177 | AC586: 44.604927782497874 | AD586: 4
A587: ESSENDON ASSOC. | C587: HOARE | F587: PAIN | I587: MAINE | L587: ATKINS | O587: GIBSON | R587: WILKINSON
A588: GOALKICKERS
A589: FOOTSCRAY | C589: KNIGHT | F589: CROUCH | I589: BAXTER | L589: BANBURY | O589: OGILVIE
A590: ESSENDON ASSOC. | C590: HOARE 2 | F590: CLARKE 2 | I590: CHAPMAN
A592: WILLIAMSTOWN | C592: 2 | D592: 4 | E592: =C592*6+D592 -> 16 | G592: 3 | H592: 5 | I592: =G592*6+H592 -> 23 | K592: 5 | L592: 13 | M592: =K592*6+L592 -> 43 | O592: 5 | P592: 15 | Q592: =O592*6+P592 -> 45 | S592: WILLIAMSTOWN
A593: BRUNSWICK | C593: 1 | D593: 1 | E593: =C593*6+D593 -> 7 | G593: 3 | H593: 7 | I593: =G593*6+H593 -> 25 | K593: 3 | L593: 7 | M593: =K593*6+L593 -> 25 | O593: 5 | P593: 9 | Q593: =O593*6+P593 -> 39 | S593: HOOD
A594: BEST PLAYERS
A595: WILLIAMSTOWN | C595: ALLEY | F595: ELDRIDGE | J595: REITMAN | M595: LITCHFIELD | P595: HARDEN | S595: GIBBS
A596: BRUNSWICK | C596: GILLESPIE | F596: STEVENSON | J596: THOMPSON | M596: MARSH | P596: STANCLIFFE | S596: MILLS
A597: GOALKICKERS
A598: WILLIAMSTOWN | C598: GIBBS 2 | F598: TREWARTHA | J598: LITCHFIELD
A599: BRUNSWICK | C599: STEVENSON | F599: MILLS | H599: PRICE | J599: McKENZIE | M599: ANDREWS
A601: BRIGHTON | C601: 1 | D601: 8 | E601: =C601*6+D601 -> 14 | G601: 2 | H601: 9 | I601: =G601*6+H601 -> 21 | K601: 4 | L601: 13 | M601: =K601*6+L601 -> 37 | O601: 4 | P601: 15 | Q601: =O601*6+P601 -> 39 | S601: BRIGHTON
A602: PRESTON | C602: 1 | D602: 1 | E602: =C602*6+D602 -> 7 | G602: 3 | H602: 6 | I602: =G602*6+H602 -> 24 | K602: 3 | L602: 7 | M602: =K602*6+L602 -> 25 | O602: 4 | P602: 10 | Q602: =O602*6+P602 -> 34 | S602: KENDALL
A603: BEST PLAYERS
A604: BRIGHTON | C604: A LAXTON | G604: SMITH | J604: BELLER | M604: GIBNEY
A605: PRESTON | C605: DUNCAN | G605: WHITE | J605: LEADER | M605: ENRIGHT | P605: PUNCH
A606: GOALKICKERS
A607: BRIGHTON | C607: STEWART | F607: BELLER | I607: TAYLOR | L607: EDMONDS
A608: PRESTON | C608: PUNCH 3 | F608: WHITE
A610: NORTH MELBOURNE | C610: 2 | D610: 5 | E610: =C610*6+D610 -> 17 | G610: 6 | H610: 8 | I610: =G610*6+H610 -> 44 | K610: 8 | L610: 9 | M610: =K610*6+L610 -> 57 | O610: 10 | P610: 13 | Q610: =O610*6+P610 -> 73 | S610: CROXTON PK
A611: NORTHCOTE | C611: 0 | D611: 4 | E611: =C611*6+D611 -> 4 | G611: 2 | H611: 7 | I611: =G611*6+H611 -> 19 | K611: 3 | L611: 8 | M611: =K611*6+L611 -> 26 | O611: 3 | P611: 9 | Q611: =O611*6+P611 -> 27 | S611: ALLEY
A612: BEST PLAYERS
A613: NORTH MELBOURNE | C613: HARDY | F613: J JOHNSON | J613: CORRIGAN | M613: ELLIOTT | P613: S BARKER | S613: ROACH
A614: NORTHCOTE | C614: BECK | F614: BILLINGS | J614: PYKE | M614: SALVADO | P614: COLE | S614: EARSMAN
A615: GOALKICKERS
A616: NORTH MELBOURNE | C616: CAINE 2 | F616: ELLIOTT 2 | I616: J JOHNSON 2 | M616: HARDY 2 | P616: CORRIGAN | S616: CARROLL
A617: NORTHCOTE | C617: BECK | F617: LAWSON | I617: RYAN
A619: ROUND 14 | E619: 28TH JULY | S619: PLAYED AT | X619: LADDER | AB619: ROUND | AD619: 14
D620: 1ST QTR | H620: 2ND QTR | L620: 3RD QTR | P620: FINAL | S620: NORTH MELB
A621: NORTH MELBOURNE | C621: 3 | D621: 2 | E621: =C621*6+D621 -> 20 | G621: 3 | H621: 3 | I621: =G621*6+H621 -> 21 | K621: 5 | L621: 7 | M621: =K621*6+L621 -> 37 | O621: 7 | P621: 10 | Q621: =O621*6+P621 -> 52 | S621: UMPIRE | W621: TEAM | X621: W | Y621: L | Z621: D | AA621: FOR | AB621: AGST | AC621: % | AD621: PTS
A622: PRAHRAN | C622: 0 | D622: 1 | E622: =C622*6+D622 -> 1 | G622: 2 | H622: 6 | I622: =G622*6+H622 -> 18 | K622: 2 | L622: 6 | M622: =K622*6+L622 -> 18 | O622: 3 | P622: 11 | Q622: =O622*6+P622 -> 29 | S622: HURLEY
A623: BEST PLAYERS | W623: ESSENDON ASSOC. | X623: 13 | Y623: 1 | Z623: 0 | AA623: 987 | AB623: 519 | AC623: 190.17341040462426 | AD623: 52
A624: NORTH MELBOURNE | C624: HARDY | F624: S BARKER | I624: WILLIAMSON | L624: HERON | N624: JONES | Q624: PEMBERTON | W624: PRAHRAN | X624: 10 | Y624: 4 | Z624: 0 | AA624: 1004 | AB624: 674 | AC624: 148.96142433234422 | AD624: 40
A625: PRAHRAN | C625: STEWART | F625: MORONEY | I625: CARLSON | L625: DOWSING | N625: PANNAM | Q625: WILSON | W625: NORTH MELBOURNE | X625: 10 | Y625: 4 | Z625: 0 | AA625: 895 | AB625: 610 | AC625: 146.72131147540983 | AD625: 40
A626: GOALKICKERS | W626: PORT MELBOURNE | X626: 9 | Y626: 5 | Z626: 0 | AA626: 793 | AB626: 607 | AC626: 130.64250411861613 | AD626: 36
A627: NORTH MELBOURNE | C627: WILLIAMSON 4 | H627: CAINE | K627: S BARKER | N627: G BARKER
A628: PRAHRAN | C628: FARMER 2 | G628: STEWART | W628: BRUNSWICK | X628: 9 | Y628: 5 | Z628: 0 | AA628: 839 | AB628: 659 | AC628: 127.31411229135053 | AD628: 36
W629: FOOTSCRAY | X629: 8 | Y629: 6 | Z629: 0 | AA629: 865 | AB629: 567 | AC629: 152.5573192239859 | AD629: 32
A630: PORT MELBOURNE | C630: 0 | D630: 2 | E630: =C630*6+D630 -> 2 | G630: 1 | H630: 5 | I630: =G630*6+H630 -> 11 | K630: 6 | L630: 10 | M630: =K630*6+L630 -> 46 | O630: 6 | P630: 10 | Q630: =O630*6+P630 -> 46 | S630: PORT MELB | W630: WILLIAMSTOWN | X630: 4 | Y630: 10 | Z630: 0 | AA630: 562 | AB630: 722 | AC630: 77.8393351800554 | AD630: 16
A631: WILLIAMSTOWN | C631: 1 | D631: 5 | E631: =C631*6+D631 -> 11 | G631: 1 | H631: 6 | I631: =G631*6+H631 -> 12 | K631: 1 | L631: 6 | M631: =K631*6+L631 -> 12 | O631: 3 | P631: 10 | Q631: =O631*6+P631 -> 28 | S631: ALLEY | W631: BRIGHTON | X631: 3 | Y631: 11 | Z631: 0 | AA631: 513 | AB631: 825 | AC631: 62.18181818181818 | AD631: 12
A632: BEST PLAYERS | W632: NORTHCOTE | X632: 3 | Y632: 11 | Z632: 0 | AA632: 563 | AB632: 1056 | AC632: 53.314393939393938 | AD632: 12
A633: PORT MELBOURNE | C633: JINKS | F633: TREGLOWN | I633: TAYLOR | K633: ANDERSON | N633: MAYNARD | Q633: CLELAND | W633: PRESTON | X633: 1 | Y633: 13 | Z633: 0 | AA633: 541 | AB633: 1323 | AC633: 40.891912320483748 | AD633: 4
A634: WILLIAMSTOWN | C634: ELDRIDGE | F634: JOY | I634: GIBBS | K634: REITMAN | N634: AMY | Q634: WEIDNER
A635: GOALKICKERS
A636: PORT MELBOURNE | C636: TAYLOR 3 | G636: PASH | I636: HUTCHINSON | L636: MAYNARD | O636: JINKS
A637: WILLIAMSTOWN | C637: AMY 2 | F637: McDONALD
A639: BRUNSWICK | C639: 4 | D639: 2 | E639: =C639*6+D639 -> 26 | G639: 7 | H639: 3 | I639: =G639*6+H639 -> 45 | K639: 11 | L639: 9 | M639: =K639*6+L639 -> 75 | O639: 15 | P639: 13 | Q639: =O639*6+P639 -> 103 | S639: BRUNSWICK
A640: NORTHCOTE | C640: 0 | D640: 2 | E640: =C640*6+D640 -> 2 | G640: 3 | H640: 3 | I640: =G640*6+H640 -> 21 | K640: 5 | L640: 4 | M640: =K640*6+L640 -> 34 | O640: 6 | P640: 5 | Q640: =O640*6+P640 -> 41 | S640: WREGG
A641: BEST PLAYERS
A642: BRUNSWICK | C642: McKENZIE | F642: JOHNSON | I642: MILLS | L642: CHASE | N642: GILLESPIE | Q642: CARRIE
A643: NORTHCOTE | C643: PYKE | F643: HAUGHTON | I643: BECK | L643: ROURKE | N643: RYAN | Q643: SWIFT
A644: GOALKICKERS
A645: BRUNSWICK | C645: McKENZIE 6 | G645: JOHNSON 3 | J645: PRICE 2 | L645: THOMPSON | N645: STEVENSON | Q645: ROSS | S645: MARSH
A646: NORTHCOTE | C646: RYAN 4 | G646: BECK | J646: LAWSON
A648: ESSENDON ASSOC. | C648: 3 | D648: 4 | E648: =C648*6+D648 -> 22 | G648: 3 | H648: 4 | I648: =G648*6+H648 -> 22 | K648: 5 | L648: 11 | M648: =K648*6+L648 -> 41 | O648: 7 | P648: 14 | Q648: =O648*6+P648 -> 56 | S648: BRIGHTON
A649: BRIGHTON | C649: 1 | D649: 1 | E649: =C649*6+D649 -> 7 | G649: 1 | H649: 10 | I649: =G649*6+H649 -> 16 | K649: 2 | L649: 10 | M649: =K649*6+L649 -> 22 | O649: 3 | P649: 13 | Q649: =O649*6+P649 -> 31 | S649: KENDALL
A650: BEST PLAYERS
A651: ESSENDON ASSOC. | C651: JONES | F651: PAIN | I651: ATKINS | L651: GIBSON | N651: GOUGH | Q651: McNAMARA
A652: BRIGHTON | C652: B BAILES | F652: E BAILES | I652: BRIDGEFORD | L652: GIBNEY | N652: TAYLOR | Q652: A LAXTON
A653: GOALKICKERS
A654: ESSENDON ASSOC. | C654: McNAMARA 5 | G654: FRENCH 2
A655: BRIGHTON | C655: EDMONDS 2 | G655: WENBORN
A657: FOOTSCRAY | C657: 5 | D657: 4 | E657: =C657*6+D657 -> 34 | G657: 12 | H657: 11 | I657: =G657*6+H657 -> 83 | K657: 15 | L657: 17 | M657: =K657*6+L657 -> 107 | O657: 21 | P657: 20 | Q657: =O657*6+P657 -> 146 | S657: PRESTON
A658: PRESTON | C658: 1 | D658: 3 | E658: =C658*6+D658 -> 9 | G658: 1 | H658: 4 | I658: =G658*6+H658 -> 10 | K658: 1 | L658: 8 | M658: =K658*6+L658 -> 14 | O658: 1 | P658: 10 | Q658: =O658*6+P658 -> 16 | S658: HERBERT
A659: BEST PLAYERS
A660: FOOTSCRAY | C660: CROUCH | F660: OGILVIE | I660: COTTON | L660: KNIGHT | O660: SPENCE
A661: PRESTON | C661: PUNCH | F661: MOORE | I661: WHITE | L661: WOOLEY | O661: BILLETT
A662: GOALKICKERS
A663: FOOTSCRAY | C663: CROUCH 7 | F663: KNIGHT 4 | H663: BANBURY 2 | J663: SPENCE 2 | L663: COTTON 2 | N663: OGILVIE | P663: T CLARKE | R663: HARRIS | U663: BAXTER
A664: PRESTON
A666: ROUND 15 | E666: 5TH AUGUST | S666: PLAYED AT | X666: LADDER | AB666: ROUND | AD666: 15
D667: 1ST QTR | H667: 2ND QTR | L667: 3RD QTR | P667: FINAL | S667: M.C.G.
A668: BRUNSWICK | C668: 5 | D668: 2 | E668: =C668*6+D668 -> 32 | G668: 7 | H668: 9 | I668: =G668*6+H668 -> 51 | K668: 10 | L668: 14 | M668: =K668*6+L668 -> 74 | O668: 12 | P668: 18 | Q668: =O668*6+P668 -> 90 | S668: UMPIRE | W668: TEAM | X668: W | Y668: L | Z668: D | AA668: FOR | AB668: AGST | AC668: % | AD668: PTS
A669: FOOTSCRAY | C669: 5 | D669: 4 | E669: =C669*6+D669 -> 34 | G669: 7 | H669: 6 | I669: =G669*6+H669 -> 48 | K669: 7 | L669: 9 | M669: =K669*6+L669 -> 51 | O669: 7 | P669: 11 | Q669: =O669*6+P669 -> 53 | S669: HURLEY
A670: BEST PLAYERS | W670: ESSENDON ASSOC. | X670: 14 | Y670: 1 | Z670: 0 | AA670: 1119 | AB670: 562 | AC670: 199.11032028469751 | AD670: 56
A671: BRUNSWICK | C671: MILLS | F671: CHASE | H671: McKENZIE | K671: STEVENSON | N671: STANCLIFFE | Q671: PRICE | W671: PRAHRAN | X671: 11 | Y671: 4 | Z671: 0 | AA671: 1070 | AB671: 713 | AC671: 150.07012622720899 | AD671: 44
A672: FOOTSCRAY | C672: WHITE | F672: HART | H672: BAXTER | K672: CRADDOCK | N672: OGILVIE | Q672: BANBURY | W672: NORTH MELBOURNE | X672: 11 | Y672: 4 | Z672: 0 | AA672: 951 | AB672: 644 | AC672: 147.67080745341616 | AD672: 44
A673: GOALKICKERS | W673: PORT MELBOURNE | X673: 10 | Y673: 5 | Z673: 0 | AA673: 876 | AB673: 638 | AC673: 137.30407523510971 | AD673: 40
A674: BRUNSWICK | C674: STEVENSON 3 | F674: PRICE 2 | H674: GILBERT 2 | J674: JOHNSON 2 | M674: McKENZIE | O674: ROSS | Q674: STANCLIFFE
A675: FOOTSCRAY | C675: BANBURY 2 | F675: COTTON | H675: BORTHWICK | K675: CROUCH | M675: CRADDOCK | P675: SPENCE | W675: BRUNSWICK | X675: 10 | Y675: 5 | Z675: 0 | AA675: 929 | AB675: 712 | AC675: 130.47752808988764 | AD675: 40
W676: FOOTSCRAY | X676: 8 | Y676: 7 | Z676: 0 | AA676: 918 | AB676: 657 | AC676: 139.72602739726028 | AD676: 32
A677: PRAHRAN | C677: 0 | D677: 3 | E677: =C677*6+D677 -> 3 | G677: 3 | H677: 8 | I677: =G677*6+H677 -> 26 | K677: 5 | L677: 12 | M677: =K677*6+L677 -> 42 | O677: 8 | P677: 18 | Q677: =O677*6+P677 -> 66 | S677: TOORAK PARK | W677: WILLIAMSTOWN | X677: 4 | Y677: 11 | Z677: 0 | AA677: 601 | AB677: 788 | AC677: 76.26903553299492 | AD677: 16
A678: WILLIAMSTOWN | C678: 2 | D678: 4 | E678: =C678*6+D678 -> 16 | G678: 2 | H678: 6 | I678: =G678*6+H678 -> 18 | K678: 3 | L678: 7 | M678: =K678*6+L678 -> 25 | O678: 5 | P678: 9 | Q678: =O678*6+P678 -> 39 | S678: KENDALL | W678: BRIGHTON | X678: 3 | Y678: 12 | Z678: 0 | AA678: 547 | AB678: 881 | AC678: 62.088535754824065 | AD678: 12
A679: BEST PLAYERS | W679: NORTHCOTE | X679: 3 | Y679: 12 | Z679: 0 | AA679: 594 | AB679: 1139 | AC679: 52.151009657594379 | AD679: 12
A680: PRAHRAN | C680: STEWART | F680: MORONEY | I680: PANNAM | L680: BROWN | N680: WILSON | Q680: SYKES | W680: PRESTON | X680: 1 | Y680: 14 | Z680: 0 | AA680: 584 | AB680: 1455 | AC680: 40.137457044673539 | AD680: 4
A681: WILLIAMSTOWN | C681: HARDEN | F681: GIBBS | I681: LITCHFIELD | L681: LITTLE | N681: AMY | Q681: ELDRIDGE
A682: GOALKICKERS
A683: PRAHRAN | C683: BROWN 3
A684: WILLIAMSTOWN
A686: NORTH MELBOURNE | C686: 0 | D686: 4 | E686: =C686*6+D686 -> 4 | G686: 2 | H686: 9 | I686: =G686*6+H686 -> 21 | K686: 3 | L686: 11 | M686: =K686*6+L686 -> 29 | O686: 6 | P686: 20 | Q686: =O686*6+P686 -> 56 | S686: NORTH MELB
A687: BRIGHTON | C687: 2 | D687: 1 | E687: =C687*6+D687 -> 13 | G687: 5 | H687: 1 | I687: =G687*6+H687 -> 31 | K687: 5 | L687: 4 | M687: =K687*6+L687 -> 34 | O687: 5 | P687: 4 | Q687: =O687*6+P687 -> 34 | S687: WREGG
A688: BEST PLAYERS
A689: NORTH MELBOURNE | C689: SPEAKMAN | F689: TRELOAR | I689: S BARKER | L689: HARDY | O689: WILLIAMSON | R689: PEMBERTON
A690: BRIGHTON | C690: BELLER | F690: TAYLOR | I690: TURNBULL | L690: B BAILES | O690: BRIDGEFORD | R690: EDMONDS
A691: GOALKICKERS
A692: NORTH MELBOURNE | C692: HARDY 2 | F692: WILLIAMSON | I692: J JOHNSON | L692: ELLIOTT | O692: HAMMOND
A693: BRIGHTON | C693: EDMONDS 3 | G693: TAYLOR | J693: THOMPSON
A695: PORT MELBOURNE | C695: 3 | D695: 2 | E695: =C695*6+D695 -> 20 | G695: 6 | H695: 8 | I695: =G695*6+H695 -> 44 | K695: 8 | L695: 14 | M695: =K695*6+L695 -> 62 | O695: 11 | P695: 17 | Q695: =O695*6+P695 -> 83 | S695: CROXTON PK
A696: NORTHCOTE | C696: 1 | D696: 1 | E696: =C696*6+D696 -> 7 | G696: 3 | H696: 2 | I696: =G696*6+H696 -> 20 | K696: 3 | L696: 3 | M696: =K696*6+L696 -> 21 | O696: 4 | P696: 7 | Q696: =O696*6+P696 -> 31 | S696: HERBERT
A697: BEST PLAYERS
A698: PORT MELBOURNE | C698: MAYNARD | F698: STEELE | I698: CLELAND | L698: ANDERSON | O698: JINKS | R698: MOXHAM
A699: NORTHCOTE | C699: RYAN | F699: PYKE | I699: WALKER | L699: BECK | O699: SWIFT | R699: HAUGHTON
A700: GOALKICKERS
A701: PORT MELBOURNE | C701: STEELE 6 | G701: HUTCHINSON 2 | K701: TAYLOR | N701: PASH | P701: JONES
A702: NORTHCOTE | C702: RYAN | F702: BECK | H702: PYKE | J702: DANIELS
A704: ESSENDON ASSOC. | C704: 6 | D704: 5 | E704: =C704*6+D704 -> 41 | G704: 9 | H704: 7 | I704: =G704*6+H704 -> 61 | K704: 12 | L704: 10 | M704: =K704*6+L704 -> 82 | O704: 19 | P704: 18 | Q704: =O704*6+P704 -> 132 | S704: ESSENDON
A705: PRESTON | C705: 1 | D705: 0 | E705: =C705*6+D705 -> 6 | G705: 1 | H705: 4 | I705: =G705*6+H705 -> 10 | K705: 3 | L705: 4 | M705: =K705*6+L705 -> 22 | O705: 6 | P705: 7 | Q705: =O705*6+P705 -> 43 | S705: ALLEN
A706: BEST PLAYERS
A707: ESSENDON ASSOC. | C707: MCNAMARA | G707: SEVIOR | J707: KING | M707: WILKINSON | P707: GOUGH | S707: ATKINS
A708: PRESTON | C708: DUNCAN | G708: PUNCH | J708: WHITE | M708: BILLETT | P708: DARBY | S708: BROWN
A709: GOALKICKERS
A710: ESSENDON ASSOC. | C710: McNAMARA 14 | G710: CLARKE 2 | J710: RENWICK | M710: TOPHAM | P710: FRENCH
A711: PRESTON | C711: McGEE 2 | G711: BILLETT | J711: WHITE | M711: DARBY | P711: BROWN
A713: ROUND 16 | E713: 12TH AUGUST | J713: WEATHER | M713: NORTH WIND | S713: PLAYED AT | X713: LADDER | AB713: ROUND | AD713: 16
D714: 1ST QTR | H714: 2ND QTR | L714: 3RD QTR | P714: FINAL | S714: PORT MELB
A715: NORTH MELBOURNE | C715: 2 | D715: 1 | E715: =C715*6+D715 -> 13 | G715: 4 | H715: 4 | I715: =G715*6+H715 -> 28 | K715: 8 | L715: 4 | M715: =K715*6+L715 -> 52 | O715: 12 | P715: 10 | Q715: =O715*6+P715 -> 82 | S715: UMPIRE | W715: TEAM | X715: W | Y715: L | Z715: D | AA715: FOR | AB715: AGST | AC715: % | AD715: PTS
A716: PORT MELBOURNE | C716: 2 | D716: 0 | E716: =C716*6+D716 -> 12 | G716: 2 | H716: 1 | I716: =G716*6+H716 -> 13 | K716: 5 | L716: 3 | M716: =K716*6+L716 -> 33 | O716: 5 | P716: 5 | Q716: =O716*6+P716 -> 35 | S716: KENDALL
A717: BEST PLAYERS | W717: ESSENDON ASSOC. | X717: 15 | Y717: 1 | Z717: 0 | AA717: 1169 | AB717: 605 | AC717: 193.22314049586777 | AD717: 60
A718: NORTH MELBOURNE | C718: HERON | F718: JONES | I718: S BARKER | L718: HARDY | N718: TRELOAR | Q718: J JOHNSON | W718: NORTH MELBOURNE | X718: 12 | Y718: 4 | Z718: 0 | AA718: 1033 | AB718: 679 | AC718: 152.13549337260679 | AD718: 48
A719: PORT MELBOURNE | C719: JINKS | F719: ANDERSON | I719: TREGLOWN | L719: DANKS | N719: HENDRIE | Q719: FRANKLIN | W719: PRAHRAN | X719: 12 | Y719: 4 | Z719: 0 | AA719: 1155 | AB719: 772 | AC719: 149.61139896373058 | AD719: 48
A720: GOALKICKERS | W720: BRUNSWICK | X720: 10 | Y720: 6 | Z720: 0 | AA720: 972 | AB720: 762 | AC720: 127.55905511811024 | AD720: 40
A721: NORTH MELBOURNE | C721: WILLIAMSON 4 | F721: CAINE 2 | H721: ELLIOTT 2 | J721: HAMMOND 2 | M721: J JOHNSON | O721: G BARKER
A722: PORT MELBOURNE | C722: STEELE 3 | G722: MAYNARD | J722: JINKS | W722: PORT MELBOURNE | X722: 10 | Y722: 6 | Z722: 0 | AA722: 911 | AB722: 720 | AC722: 126.52777777777777 | AD722: 40
W723: FOOTSCRAY | X723: 8 | Y723: 8 | Z723: 0 | AA723: 977 | AB723: 742 | AC723: 131.6711590296496 | AD723: 32
A724: ESSENDON ASSOC. | C724: 3 | D724: 3 | E724: =C724*6+D724 -> 21 | G724: 5 | H724: 5 | I724: =G724*6+H724 -> 35 | K724: 6 | L724: 7 | M724: =K724*6+L724 -> 43 | O724: 7 | P724: 8 | Q724: =O724*6+P724 -> 50 | S724: BRUNSWICK | W724: WILLIAMSTOWN | X724: 4 | Y724: 12 | Z724: 0 | AA724: 638 | AB724: 846 | AC724: 75.413711583924353 | AD724: 16
A725: BRUNSWICK | C725: 0 | D725: 2 | E725: =C725*6+D725 -> 2 | G725: 3 | H725: 5 | I725: =G725*6+H725 -> 23 | K725: 3 | L725: 10 | M725: =K725*6+L725 -> 28 | O725: 5 | P725: 13 | Q725: =O725*6+P725 -> 43 | S725: HURLEY | W725: BRIGHTON | X725: 4 | Y725: 12 | Z725: 0 | AA725: 605 | AB725: 918 | AC725: 65.904139433551194 | AD725: 16
A726: BEST PLAYERS | W726: NORTHCOTE | X726: 4 | Y726: 12 | Z726: 0 | AA726: 660 | AB726: 1169 | AC726: 56.458511548331906 | AD726: 16
A727: ESSENDON ASSOC. | C727: McNAMARA | F727: WALKER | I727: MAINE | L727: PAIN | N727: GIBSON | Q727: ATKINS | W727: PRESTON | X727: 1 | Y727: 15 | Z727: 0 | AA727: 614 | AB727: 1521 | AC727: 40.368178829717294 | AD727: 4
A728: BRUNSWICK | C728: CHASE | F728: JOHNSON | I728: STANCLIFFE | L728: CARRIE | N728: PRICE | Q728: MARSH
A729: GOALKICKERS
A730: ESSENDON ASSOC. | C730: McNAMARA 3 | G730: FRENCH 2 | J730: CLARKE | M730: HOARE
A731: BRUNSWICK | C731: PRICE 3 | F731: STEVENSON | I731: PITCHER
A733: PRAHRAN | C733: 0 | D733: 6 | E733: =C733*6+D733 -> 6 | G733: 4 | H733: 13 | I733: =G733*6+H733 -> 37 | K733: 8 | L733: 20 | M733: =K733*6+L733 -> 68 | O733: 10 | P733: 25 | Q733: =O733*6+P733 -> 85 | S733: TOORAK PARK
A734: FOOTSCRAY | C734: 2 | D734: 6 | E734: =C734*6+D734 -> 18 | G734: 2 | H734: 9 | I734: =G734*6+H734 -> 21 | K734: 4 | L734: 14 | M734: =K734*6+L734 -> 38 | O734: 7 | P734: 17 | Q734: =O734*6+P734 -> 59 | S734: ALLEY
A735: BEST PLAYERS
A736: PRAHRAN | C736: STEWART | F736: MORONEY | I736: WILSON | L736: NORMAN | O736: HALL | Q736: FARMER
A737: FOOTSCRAY | C737: BAXTER | F737: CRADDOCK | I737: WHITE | L737: McCARTHY | O737: BORTHWICK | R737: CROUCH
A738: GOALKICKERS
A739: PRAHRAN | C739: WOODS 3 | F739: HALL 2 | I739: BROWN 2
A740: FOOTSCRAY | C740: CROUCH 3 | F740: DUANE 2 | I740: BANBURY | L740: KNIGHT
A742: BRIGHTON | C742: 2 | D742: 1 | E742: =C742*6+D742 -> 13 | G742: 6 | H742: 7 | I742: =G742*6+H742 -> 43 | K742: 7 | L742: 9 | M742: =K742*6+L742 -> 51 | O742: 8 | P742: 10 | Q742: =O742*6+P742 -> 58 | S742: WILLIAMSTOWN
A743: WILLIAMSTOWN | C743: 2 | D743: 4 | E743: =C743*6+D743 -> 16 | G743: 3 | H743: 4 | I743: =G743*6+H743 -> 22 | K743: 5 | L743: 5 | M743: =K743*6+L743 -> 35 | O743: 5 | P743: 7 | Q743: =O743*6+P743 -> 37 | S743: WREGG
A744: BEST PLAYERS
A745: BRIGHTON | C745: WENBORN | F745: B BAILES | I745: BRIDGEFORD | L745: E BAILES | O745: TAYLOR | R745: BELLER
A746: WILLIAMSTOWN | C746: DAVIES | F746: REITMAN | I746: ELDRIDGE | L746: GIBBS | O746: FERGUSON | R746: LITTLE
A747: GOALKICKERS
A748: BRIGHTON | C748: GIBBS 3 | F748: EDMONDS 2 | I748: TAYLOR | K748: B BAILES | N748: THOMPSON
A749: WILLIAMSTOWN | C749: COLLINS 2
A751: NORTHCOTE | C751: 2 | D751: 3 | E751: =C751*6+D751 -> 15 | G751: 4 | H751: 5 | I751: =G751*6+H751 -> 29 | K751: 5 | L751: 9 | M751: =K751*6+L751 -> 39 | O751: 9 | P751: 12 | Q751: =O751*6+P751 -> 66 | S751: CROXTON PK
A752: PRESTON | C752: 2 | D752: 2 | E752: =C752*6+D752 -> 14 | G752: 3 | H752: 3 | I752: =G752*6+H752 -> 21 | K752: 4 | L752: 5 | M752: =K752*6+L752 -> 29 | O752: 4 | P752: 6 | Q752: =O752*6+P752 -> 30 | S752: ALLEN
A753: BEST PLAYERS
A754: NORTHCOTE | C754: HAUGHTON | F754: BECK | I754: HOLMES | L754: EARSMAN | O754: COLE | R754: RYAN
A755: PRESTON | C755: ENRIGHT | F755: WHITE | I755: MOOORE | L755: BROWN | O755: DUNCAN | R755: GILBERT
A756: GOALKICKERS
A757: NORTHCOTE | C757: RYAN 4 | F757: LAWSON 3
A758: PRESTON | C758: PUNCH 2
A760: ROUND 17 | E760: 19TH AUGUST | J760: WEATHER | M760: FINE | S760: PLAYED AT | X760: LADDER | AB760: ROUND | AD760: 17
D761: 1ST QTR | H761: 2ND QTR | L761: 3RD QTR | P761: FINAL | S761: NORTH MELB
A762: NORTH MELBOURNE | C762: 3 | D762: 8 | E762: =C762*6+D762 -> 26 | G762: 4 | H762: 11 | I762: =G762*6+H762 -> 35 | K762: 7 | L762: 15 | M762: =K762*6+L762 -> 57 | O762: 7 | P762: 18 | Q762: =O762*6+P762 -> 60 | S762: UMPIRE | W762: TEAM | X762: W | Y762: L | Z762: D | AA762: FOR | AB762: AGST | AC762: % | AD762: PTS
A763: ESSENDON ASSOC. | C763: 0 | D763: 0 | E763: =C763*6+D763 -> 0 | G763: 1 | H763: 5 | I763: =G763*6+H763 -> 11 | K763: 1 | L763: 7 | M763: =K763*6+L763 -> 13 | O763: 4 | P763: 10 | Q763: =O763*6+P763 -> 34 | S763: HURLEY
A764: BEST PLAYERS | W764: ESSENDON ASSOC. | X764: 15 | Y764: 2 | Z764: 0 | AA764: 1203 | AB764: 665 | AC764: 180.90225563909775 | AD764: 60
A765: NORTH MELBOURNE | C765: J JOHNSON | F765: HAMMOND | I765: TRELOAR | L765: JONES | N765: HERON | P765: RAWLE | W765: NORTH MELBOURNE | X765: 13 | Y765: 4 | Z765: 0 | AA765: 1093 | AB765: 713 | AC765: 153.29593267882188 | AD765: 52
A766: ESSENDON ASSOC. | C766: McNAMARA | F766: PAIN | I766: GIBSON | L766: SEVIOR | N766: GOUGH | P766: ANDERSON | W766: PRAHRAN | X766: 13 | Y766: 4 | Z766: 0 | AA766: 1217 | AB766: 801 | AC766: 151.93508114856431 | AD766: 52
A767: GOALKICKERS | W767: BRUNSWICK | X767: 11 | Y767: 6 | Z767: 0 | AA767: 1047 | AB767: 807 | AC767: 129.73977695167287 | AD767: 44
A768: NORTH MELBOURNE | C768: WILLIAMSON 2 | G768: J JOHNSON | J768: HAMMOND | L768: RAWLE | N768: GARDINER | Q768: CAINE
A769: ESSENDON ASSOC. | C769: McNAMARA 3 | G769: HOARE | W769: PORT MELBOURNE | X769: 11 | Y769: 6 | Z769: 0 | AA769: 969 | AB769: 763 | AC769: 126.99868938401049 | AD769: 44
W770: FOOTSCRAY | X770: 8 | Y770: 9 | Z770: 0 | AA770: 1020 | AB770: 800 | AC770: 127.5 | AD770: 32
A771: PORT MELBOURNE | C771: 0 | D771: 1 | E771: =C771*6+D771 -> 1 | G771: 4 | H771: 4 | I771: =G771*6+H771 -> 28 | K771: 4 | L771: 6 | M771: =K771*6+L771 -> 30 | O771: 8 | P771: 10 | Q771: =O771*6+P771 -> 58 | S771: FOOTSCRAY | W771: WILLIAMSTOWN | X771: 5 | Y771: 12 | Z771: 0 | AA771: 683 | AB771: 889 | AC771: 76.82789651293588 | AD771: 20
A772: FOOTSCRAY | C772: 3 | D772: 5 | E772: =C772*6+D772 -> 23 | G772: 3 | H772: 6 | I772: =G772*6+H772 -> 24 | K772: 5 | L772: 6 | M772: =K772*6+L772 -> 36 | O772: 6 | P772: 7 | Q772: =O772*6+P772 -> 43 | S772: ALLEY | W772: BRIGHTON | X772: 4 | Y772: 13 | Z772: 0 | AA772: 650 | AB772: 993 | AC772: 65.458207452165155 | AD772: 16
A773: BEST PLAYERS | W773: NORTHCOTE | X773: 4 | Y773: 13 | Z773: 0 | AA773: 703 | AB773: 1214 | AC773: 57.907742998352553 | AD773: 16
A774: PORT MELBOURNE | C774: JINKS | F774: TAYLOR | I774: BROWN | L774: HENDRIE | N774: SAMPSON | Q774: STEELE | W774: PRESTON | X774: 1 | Y774: 16 | Z774: 0 | AA774: 643 | AB774: 1583 | AC774: 40.619077700568539 | AD774: 4
A775: FOOTSCRAY | C775: OGILVIE | F775: HANSON | I775: CRADDOCK | L775: BAXTER | N775: CROUCH | Q775: DUANE
A776: GOALKICKERS
A777: PORT MELBOURNE | C777: TAYLOR 4 | G777: JINKS 2 | J777: PASH | L777: STEELE
A778: FOOTSCRAY | C778: CROUCH 2 | G778: DUANE | J778: KNIGHT | L778: BAXTER | O778: T CLARKE
A780: BRUNSWICK | C780: 4 | D780: 3 | E780: =C780*6+D780 -> 27 | G780: 4 | H780: 8 | I780: =G780*6+H780 -> 32 | K780: 9 | L780: 8 | M780: =K780*6+L780 -> 62 | O780: 11 | P780: 9 | Q780: =O780*6+P780 -> 75 | S780: BRIGHTON
A781: BRIGHTON | C781: 1 | D781: 2 | E781: =C781*6+D781 -> 8 | G781: 4 | H781: 5 | I781: =G781*6+H781 -> 29 | K781: 4 | L781: 8 | M781: =K781*6+L781 -> 32 | O781: 5 | P781: 15 | Q781: =O781*6+P781 -> 45 | S781: KENDALL
A782: BEST PLAYERS
A783: BRUNSWICK | C783: MILLS | F783: STANCLIFFE | I783: CONLEY | L783: CHASE | O783: STEVENSON | R783: McLEAN
A784: BRIGHTON | C784: WENBORN | F784: GIBNEY | I784: BELLER | L784: EDMONDS | O784: B BAILES | R784: NEGRO
A785: GOALKICKERS
A786: BRUNSWICK | C786: STEVENSON 3 | G786: CHASE 3 | J786: PITCHER 3
A787: BRIGHTON | C787: EDMONDS 2 | G787: GIBBS | J787: HANNAFORD | M787: NEGRO
A789: WILLIAMSTOWN | C789: 0 | D789: 1 | E789: =C789*6+D789 -> 1 | G789: 3 | H789: 4 | I789: =G789*6+H789 -> 22 | K789: 3 | L789: 6 | M789: =K789*6+L789 -> 24 | O789: 6 | P789: 9 | Q789: =O789*6+P789 -> 45 | S789: WILLIAMSTOWN
A790: NORTHCOTE | C790: 0 | D790: 2 | E790: =C790*6+D790 -> 2 | G790: 0 | H790: 5 | I790: =G790*6+H790 -> 5 | K790: 4 | L790: 5 | M790: =K790*6+L790 -> 29 | O790: 6 | P790: 7 | Q790: =O790*6+P790 -> 43 | S790: ALLEN
A791: BEST PLAYERS
A792: WILLIAMSTOWN | C792: REITMAN | F792: ROBERTS | I792: DAVIES | L792: COLLINS | O792: ELDRIDGE | R792: REYNOLDS
A793: NORTHCOTE | C793: WALKER | F793: EARSMAN | I793: LAWSON | L793: HAUGHTON | O793: SCOTT | R793: SALVADO
A794: GOALKICKERS
A795: WILLIAMSTOWN
A796: NORTHCOTE
A798: PRAHRAN | C798: 1 | D798: 4 | E798: =C798*6+D798 -> 10 | G798: 3 | H798: 6 | I798: =G798*6+H798 -> 24 | K798: 7 | L798: 13 | M798: =K798*6+L798 -> 55 | O798: 8 | P798: 14 | Q798: =O798*6+P798 -> 62 | S798: TOORAK PARK
A799: PRESTON | C799: 1 | D799: 0 | E799: =C799*6+D799 -> 6 | G799: 3 | H799: 1 | I799: =G799*6+H799 -> 19 | K799: 3 | L799: 1 | M799: =K799*6+L799 -> 19 | O799: 4 | P799: 5 | Q799: =O799*6+P799 -> 29 | S799: HERBERT
A800: BEST PLAYERS
A801: PRAHRAN | C801: MORONEY | F801: WOODS | I801: DARBY | L801: PANNAM | O801: DOWSING | R801: SYKES
A802: PRESTON | C802: DUNCAN | F802: PUNCH | I802: McGEE | L802: BILLETT | O802: MURRAY | R802: S HALL
A803: GOALKICKERS
A804: PRAHRAN | C804: WOODS 3 | G804: SYKES 2
A805: PRESTON | C805: PUNCH 3
A807: ROUND 18 | E807: 26TH AUGUST | J807: WEATHER | M807: FINE | S807: PLAYED AT | X807: LADDER | AB807: ROUND | AD807: 18
D808: 1ST QTR | H808: 2ND QTR | L808: 3RD QTR | P808: FINAL | S808: ESSENDON
A809: ESSENDON ASSOC. | C809: 1 | D809: 4 | E809: =C809*6+D809 -> 10 | G809: 3 | H809: 7 | I809: =G809*6+H809 -> 25 | K809: 7 | L809: 10 | M809: =K809*6+L809 -> 52 | O809: 13 | P809: 11 | Q809: =O809*6+P809 -> 89 | S809: UMPIRE | W809: TEAM | X809: W | Y809: L | Z809: D | AA809: FOR | AB809: AGST | AC809: % | AD809: PTS
A810: PRAHRAN | C810: 2 | D810: 3 | E810: =C810*6+D810 -> 15 | G810: 2 | H810: 7 | I810: =G810*6+H810 -> 19 | K810: 4 | L810: 8 | M810: =K810*6+L810 -> 32 | O810: 9 | P810: 13 | Q810: =O810*6+P810 -> 67 | S810: HURLEY
A811: BEST PLAYERS | W811: ESSENDON ASSOC. | X811: 16 | Y811: 2 | Z811: 0 | AA811: 1292 | AB811: 732 | AC811: 176.50273224043715 | AD811: 64
A812: ESSENDON ASSOC. | C812: McNAMARA | F812: MAINE | I812: PAIN | L812: GOUGH | N812: CHAPMAN | Q812: GIBSON | W812: NORTH MELBOURNE | X812: 14 | Y812: 4 | Z812: 0 | AA812: 1179 | AB812: 749 | AC812: 157.40987983978638 | AD812: 56
A813: PRAHRAN | C813: MORONEY | F813: WOODS | I813: NORMAN | L813: ELLIN | N813: WILSON | Q813: CARLSON | W813: PRAHRAN | X813: 13 | Y813: 5 | Z813: 0 | AA813: 1284 | AB813: 890 | AC813: 144.26966292134833 | AD813: 52
A814: GOALKICKERS | W814: BRUNSWICK | X814: 12 | Y814: 6 | Z814: 0 | AA814: 1225 | AB814: 825 | AC814: 148.4848484848485 | AD814: 48
A815: ESSENDON ASSOC. | C815: McNAMARA 6 | F815: GOUGH 2 | I815: TOPHAM | K815: McCANN | M815: SEVIOR | O815: BARTHOLEMEW | R815: CLARKE
A816: PRAHRAN | C816: SYKES 2 | F816: BROWN 2 | I816: ELLIN 2 | L816: FARMER | O816: DOWSING | R816: NORMAN | W816: PORT MELBOURNE | X816: 12 | Y816: 6 | Z816: 0 | AA816: 1044 | AB816: 797 | AC816: 130.99121706398995 | AD816: 48
W817: FOOTSCRAY | X817: 9 | Y817: 9 | Z817: 0 | AA817: 1098 | AB817: 865 | AC817: 126.93641618497109 | AD817: 36
A818: NORTH MELBOURNE | C818: 3 | D818: 6 | E818: =C818*6+D818 -> 24 | G818: 6 | H818: 8 | I818: =G818*6+H818 -> 44 | K818: 9 | L818: 10 | M818: =K818*6+L818 -> 64 | O818: 12 | P818: 14 | Q818: =O818*6+P818 -> 86 | S818: NORTH MELB | W818: WILLIAMSTOWN | X818: 5 | Y818: 13 | Z818: 0 | AA818: 719 | AB818: 975 | AC818: 73.743589743589737 | AD818: 20
A819: WILLIAMSTOWN | C819: 1 | D819: 1 | E819: =C819*6+D819 -> 7 | G819: 2 | H819: 6 | I819: =G819*6+H819 -> 18 | K819: 2 | L819: 6 | M819: =K819*6+L819 -> 18 | O819: 4 | P819: 12 | Q819: =O819*6+P819 -> 36 | S819: WREGG | W819: BRIGHTON | X819: 4 | Y819: 14 | Z819: 0 | AA819: 684 | AB819: 1068 | AC819: 64.044943820224717 | AD819: 16
A820: BEST PLAYERS | W820: NORTHCOTE | X820: 4 | Y820: 14 | Z820: 0 | AA820: 768 | AB820: 1292 | AC820: 59.442724458204331 | AD820: 16
A821: NORTH MELBOURNE | C821: HARDY | F821: S BARKER | I821: RAWLE | L821: J JOHNSON | O821: JONES | Q821: CAINE | W821: PRESTON | X821: 1 | Y821: 17 | Z821: 0 | AA821: 661 | AB821: 1761 | AC821: 37.535491198182854 | AD821: 4
A822: WILLIAMSTOWN | C822: AMY | F822: BLISS | I822: ELDRIDGE | L822: DAVIES | O822: REITMAN | Q822: REYNOLDS
A823: GOALKICKERS
A824: NORTH MELBOURNE | C824: CAINE 6 | F824: HARDY 3 | I824: G BARKER 2 | L824: ELLIOTT
A825: WILLIAMSTOWN | C825: COLLINS | F825: AMY | I825: REYNOLDS | L825: LAMPRELL
A827: PORT MELBOURNE | C827: 1 | D827: 5 | E827: =C827*6+D827 -> 11 | G827: 4 | H827: 7 | I827: =G827*6+H827 -> 31 | K827: 5 | L827: 10 | M827: =K827*6+L827 -> 40 | O827: 10 | P827: 15 | Q827: =O827*6+P827 -> 75 | S827: BRIGHTON
A828: BRIGHTON | C828: 1 | D828: 2 | E828: =C828*6+D828 -> 8 | G828: 1 | H828: 4 | I828: =G828*6+H828 -> 10 | K828: 3 | L828: 7 | M828: =K828*6+L828 -> 25 | O828: 4 | P828: 10 | Q828: =O828*6+P828 -> 34 | S828: HERBERT
A829: BEST PLAYERS
A830: PORT MELBOURNE | C830: JINKS | F830: BROWN | I830: TREGLOWN | L830: CLELAND | N830: ANDERSON | Q830: MAYNARD
A831: BRIGHTON | C831: B BAILES | F831: GIBBS | I831: NEGRO | L831: BELLER | N831: A LAXTON | Q831: EDMONDS
A832: GOALKICKERS
A833: PORT MELBOURNE | C833: PASH 4 | F833: HUTCHINSON 3 | J833: BACHLI 2 | M833: LITTLE
A834: BRIGHTON | C834: WEATE 2 | F834: NEGRO | I834: EDMONDS
A836: FOOTSCRAY | C836: 2 | D836: 2 | E836: =C836*6+D836 -> 14 | G836: 5 | H836: 3 | I836: =G836*6+H836 -> 33 | K836: 8 | L836: 5 | M836: =K836*6+L836 -> 53 | O836: 12 | P836: 6 | Q836: =O836*6+P836 -> 78 | S836: FOOTSCRAY
A837: NORTHCOTE | C837: 3 | D837: 3 | E837: =C837*6+D837 -> 21 | G837: 4 | H837: 8 | I837: =G837*6+H837 -> 32 | K837: 7 | L837: 9 | M837: =K837*6+L837 -> 51 | O837: 9 | P837: 11 | Q837: =O837*6+P837 -> 65 | S837: BEAUMONT
A838: BEST PLAYERS
A839: FOOTSCRAY | C839: OGILVIE | F839: BAXTER | I839: SPENCE | L839: HANSON | O839: BANBURY | R839: COTTON
A840: NORTHCOTE | C840: BECK | F840: HAUGHTON | I840: HOLMES | L840: BRISCOE | O840: COLE | R840: RYAN
A841: GOALKICKERS
A842: FOOTSCRAY | C842: COTTON 3 | F842: CROUCH 2 | I842: SHEPHERD 2 | M842: BANBURY 2 | P842: SPENCE | R842: REID | T842: CEADDOCK
A843: NORTHCOTE | C843: RYAN 3
A845: BRUNSWICK | C845: 2 | D845: 9 | E845: =C845*6+D845 -> 21 | G845: 10 | H845: 17 | I845: =G845*6+H845 -> 77 | K845: 18 | L845: 22 | M845: =K845*6+L845 -> 130 | O845: 24 | P845: 34 | Q845: =O845*6+P845 -> 178 | S845: BRUNSWICK
A846: PRESTON | C846: 1 | D846: 0 | E846: =C846*6+D846 -> 6 | G846: 1 | H846: 2 | I846: =G846*6+H846 -> 8 | K846: 1 | L846: 6 | M846: =K846*6+L846 -> 12 | O846: 2 | P846: 6 | Q846: =O846*6+P846 -> 18 | S846: ALLEY
A847: BEST PLAYERS
A848: BRUNSWICK | C848: L BRAID | F848: TEMPLE | I848: NUTTALL | L848: STEVENSON | O848: CHASE | Q848: STANCLIFFE
A849: PRESTON
A850: GOALKICKERS
A851: BRUNSWICK | C851: TEMPLE 7 | E851: STEVENSON 4 | H851: L BRAID 4 | J851: MILLS 2 | L851: PRICE 2 | N851: NUTTALL | P851: CHASE | R851: ROSS | T851: GILLESPIE | W851: STANCLIFFE
A852: PRESTON | C852: GILBERT | F852: DARBY
A854: FINALS
A855: 1ST SEMI | E855: 2ND SEPTEMBER | J855: WEATHER | L855: SOUTH WIND SHOWERS
D856: 1ST QTR | H856: 2ND QTR | L856: 3RD QTR | P856: FINAL
A857: BRUNSWICK | C857: 0 | D857: 1 | E857: =C857*6+D857 -> 1 | G857: 0 | H857: 5 | I857: =G857*6+H857 -> 5 | K857: 1 | L857: 8 | M857: =K857*6+L857 -> 14 | O857: 5 | P857: 10 | Q857: =O857*6+P857 -> 40 | S857: NORTH MELB
A858: NORTH MELBOURNE | C858: 0 | D858: 2 | E858: =C858*6+D858 -> 2 | G858: 1 | H858: 4 | I858: =G858*6+H858 -> 10 | K858: 2 | L858: 4 | M858: =K858*6+L858 -> 16 | O858: 3 | P858: 7 | Q858: =O858*6+P858 -> 25 | S858: KENDALL
A859: BEST PLAYERS
A860: BRUNSWICK | C860: L BRAID | F860: CHASE | I860: J JOHNSON | M860: PRICE | P860: THOMPSON | S860: LEEDS
A861: NORTH MELBOURNE | C861: HERON | F861: G JOHNSON | I861: S BARKER | M861: RAWLE | P861: JONES | S861: PEMBERTON
A862: GOALKICKERS
A863: BRUNSWICK | C863: PITCHER 3 | G863: STEVENSON 2
A864: NORTH MELBOURNE | C864: G BARKER | G864: ELLIOTT | J864: CAINE
A866: 2ND SEMI | E866: 9TH SEPTEMBER | J866: WEATHER
A867: ESSENDON ASSOC. | C867: 4 | D867: 2 | E867: =C867*6+D867 -> 26 | G867: 7 | H867: 6 | I867: =G867*6+H867 -> 48 | K867: 7 | L867: 7 | M867: =K867*6+L867 -> 49 | O867: 8 | P867: 9 | Q867: =O867*6+P867 -> 57 | S867: NORTH MELB
A868: PRAHRAN | C868: 2 | D868: 0 | E868: =C868*6+D868 -> 12 | G868: 4 | H868: 1 | I868: =G868*6+H868 -> 25 | K868: 7 | L868: 5 | M868: =K868*6+L868 -> 47 | O868: 7 | P868: 8 | Q868: =O868*6+P868 -> 50 | S868: KENDALL
A869: BEST PLAYERS
A870: ESSENDON ASSOC. | C870: McNAMARA | G870: PAIN | J870: SEVIOR | M870: McCANN | P870: McINTYRE | S870: WALKER
A871: PRAHRAN | C871: MORONEY | G871: NORMAN | J871: PANNAM | M871: DOWSING | P871: HANNAFORD | S871: WOODS
A872: GOALKICKERS
A873: ESSENDON ASSOC. | C873: McNAMARA 3 | G873: McCANN 2 | J873: GIBSON 2 | M873: CLARKE
A874: PRAHRAN | C874: SYKES 2 | F874: MORONEY | I874: PANNAM | L874: FARMER | O874: NORMAN | R874: DOWSING
A876: PRELIMINARY FINAL | F876: 16TH SEPTEMBER | J876: WEATHER
A877: BRUNSWICK | C877: 3 | D877: 3 | E877: =C877*6+D877 -> 21 | G877: 7 | H877: 4 | I877: =G877*6+H877 -> 46 | K877: 8 | L877: 4 | M877: =K877*6+L877 -> 52 | O877: 10 | P877: 5 | Q877: =O877*6+P877 -> 65 | S877: NORTH MELB
A878: ESSENDON ASSOC. | C878: 2 | D878: 2 | E878: =C878*6+D878 -> 14 | G878: 5 | H878: 4 | I878: =G878*6+H878 -> 34 | K878: 7 | L878: 6 | M878: =K878*6+L878 -> 48 | O878: 9 | P878: 9 | Q878: =O878*6+P878 -> 63 | S878: KENDALL
A879: BEST PLAYERS
A880: BRUNSWICK | C880: JOHNSON | G880: STEVENSON | K880: L BRAID | N880: STANCLIFFE | Q880: CHASE | S880: PRICE
A881: ESSENDON ASSOC. | C881: McNAMARA | G881: PAIN | K881: GOUGH | N881: MAINE | Q881: SEVIOR | S881: WALKER
A882: GOALKICKERS
A883: BRUNSWICK | C883: PRICE 4 | F883: STEVENSON 2 | J883: McKENZIE | M883: JOHNSON | O883: L BRAID | R883: NUTTALL
A884: ESSENDON ASSOC. | C884: McNAMARA 5 | G884: CLARKE | J884: McCANN | M884: SEVIOR | O884: GIBSON
A886: GRAND FINAL | E886: 23RD SEPTEMBER | J886: WEATHER
A887: ESSENDON ASSOC. | C887: 1 | D887: 3 | E887: 9 | G887: 2 | H887: 5 | I887: 17 | K887: 4 | L887: 10 | M887: 34 | O887: 4 | P887: 10 | Q887: =O887*6+P887 -> 34 | S887: NORTH MELB
A888: BRUNSWICK | C888: 0 | D888: 1 | E888: 1 | G888: 1 | H888: 3 | I888: 9 | K888: 1 | L888: 4 | M888: 10 | O888: 3 | P888: 8 | Q888: =O888*6+P888 -> 26 | S888: KENDALL
A889: BEST PLAYERS
A890: ESSENDON ASSOC. | C890: PAIN | F890: GOUGH | I890: HOARE | L890: MAINE | O890: McINTYRE | S890: McCANN
A891: BRUNSWICK | C891: L BRAID | F891: JOHNSON | I891: MARSH | L891: MILLS | O891: CHASE | S891: STANCLIFFE
A892: GOALKICKERS
A893: ESSENDON ASSOC. | C893: McNAMARA 2 | G893: GOUGH | J893: McCANN
A894: BRUNSWICK | C894: CHASE 2 | G894: McKENZIE
A896: RERESENTATIVE GAME | F896: 10TH JUNE | J896: WEATHER | M896: RAIN | O896: GROUND BAD
A897: S.A. | C897: 3 | D897: 2 | E897: =C897*6+D897 -> 20 | G897: 3 | H897: 4 | I897: =G897*6+H897 -> 22 | K897: 7 | L897: 6 | M897: =K897*6+L897 -> 48 | O897: 9 | P897: 7 | Q897: =O897*6+P897 -> 61 | S897: NORTH MELB
A898: V.F.A. | C898: 0 | D898: 2 | E898: =C898*6+D898 -> 2 | G898: 3 | H898: 7 | I898: =G898*6+H898 -> 25 | K898: 3 | L898: 10 | M898: =K898*6+L898 -> 28 | O898: 7 | P898: 10 | Q898: =O898*6+P898 -> 52 | S898: KENDALL
A899: BEST PLAYERS
A900: S.A. | C900: ROBIN | F900: T LEAHY | I900: OLIVER | L900: HOSKING | O900: DOWLING | R900: CONGEAR
A901: V.F.A. | C901: OGILVIE | F901: MADDEN | I901: STEWART | L901: CLELAND | O901: HARDY | R901: MORONEY
A902: GOALKICKERS
A903: S.A. | C903: HANSEN 3 | G903: CONGEAR 2 | J903: HOSKING 2 | N903: TREDREA | Q903: DOWLING
A904: V.F.A. | C904: HARDY 2 | G904: McNAMARA 2 | K904: LITTLE | N904: McKENZIE | Q904: HOARE
A906: TEAMS | G906: V.F.A. | Q906: S.A.
A907: BACKS | D907: REITMAN | G907: SPEAKMAN | J907: L BRAID | N907: TREDREA | Q907: TAYLOR | T907: B LEAHY
A908: H-BACKS | D908: CARLSON | G908: MADDEN | J908: FRANKLIN | N908: LOW | Q908: RENFREY | T908: OAKLEY
A909: CENTRES | D909: HANSEN | G909: CLELAND | J909: B BAILES | N909: ROBIN | Q909: HEAD | T909: McCARTHY
A910: H-FORWARDS | D910: CHASE | G910: McNAMARA | J910: STEWART | N910: LEWIS | Q910: OLIVER | T910: CUMBERLAND
A911: FORWARDS | D911: HOARE | G911: McKENZIE | J911: OGILVIE | N911: HOSKING | Q911: HANSEN | T911: CONGEAR
A912: RUCKS | D912: MARONEY | G912: S BARKER | J912: HARDY | N912: T LEAHY | Q912: JONES | T912: DOWLING
A914: RERESENTATIVE GAME | F914: 8TH JULY | J914: WEATHER | M914: FINE AFTER MORNING RAIN GROUND SLIPPERY
A915: V.F.A. | C915: 2 | D915: 2 | E915: =C915*6+D915 -> 14 | G915: 3 | H915: 8 | I915: =G915*6+H915 -> 26 | K915: 4 | L915: 11 | M915: =K915*6+L915 -> 35 | O915: 6 | P915: 12 | Q915: =O915*6+P915 -> 48 | S915: ADELAIDE
A916: S.A. | C916: 1 | D916: 2 | E916: =C916*6+D916 -> 8 | G916: 2 | H916: 3 | I916: =G916*6+H916 -> 15 | K916: 5 | L916: 5 | M916: =K916*6+L916 -> 35 | O916: 5 | P916: 5 | Q916: =O916*6+P916 -> 35 | S916: CARTER
A917: BEST PLAYERS
A918: V.F.A. | C918: SEVIOR | G918: CHASE | J918: MAINE | M918: HARDY | P918: McKENZIE | S918: COLE
A919: S.A. | C919: ROBIN | G919: HEAD | J919: B LEAHY | M919: CONLIN | P919: HANSEN
A920: GOALKICKERS
A921: V.F.A. | C921: McKENZIE 2 | G921: CHASE 2 | J921: CLELAND | M921: KNIGHT
A922: S.A. | C922: CONGEAR 3 | G922: CONGEAR | J922: OLIVER
A924: SQUADS | G924: V.F.A. | Q924: S.A.
C925: McKENZIE | G925: CHASE | J925: B BAILES | N925: E L RENFREY | Q925: B LEAHY | T925: CONLIN
C926: WENBORN | G926: SEVIOR | J926: L MAINE | N926: HEAD | Q926: DOWLING | T926: HANSEN
C927: KNIGHT | G927: OGILVIE | J927: HARDY | N927: CONGEAR | Q927: OLIVER | T927: KLOSE
C928: SPEAKMAN | G928: COLE | J928: SWIFT | N928: LEWIS | Q928: ROBIN | T928: TOWNSEND
C929: WOODS | G929: CARLSON | J929: SANDERSON | N929: LOW | Q929: TAYLOR | T929: JONES
C930: CLELAND | G930: WOOLLEY | J930: GILBERT | N930: COCKS | Q930: CALLINAN | T930: GLUYAS
C931: REITMAN | G931: WEIDNER