A1: Victorian Football Association
A2: Season 1912
A3: © Copyright Wal Williams | F3: First created: 2 August 2014
A4: Contact: joywalwi at gmail dot com | F4: Last updated: 30 July 2017 | W4: VFA Results and tables - Link to the main index page
A5: You are free to copy this document in whole or part provided that proper acknowledgement is given to the author. All rights reserved.
A7: YEAR 1912 | X7: LADDER | AB7: ROUND | AD7: 1
A8: ROUND 1 | E8: 27TH APRIL | J8: WEATHER | M8: COOL CLOUDY | S8: PLAYED AT
D9: 1ST QTR | H9: 2ND QTR | L9: 3RD QTR | P9: FINAL | S9: WILLIAMSTOWN | W9: TEAM | X9: W | Y9: L | Z9: D | AA9: FOR | AB9: AGST | AC9: % | AD9: PTS
A10: WILLIAMSTOWN | C10: 2 | D10: 3 | E10: =C10*6+D10 -> 15 | G10: 3 | H10: 6 | I10: =G10*6+H10 -> 24 | K10: 7 | L10: 8 | M10: =K10*6+L10 -> 50 | O10: 9 | P10: 16 | Q10: =O10*6+P10 -> 70 | S10: UMPIRE
A11: PORT MELBOURNE | C11: 4 | D11: 1 | E11: =C11*6+D11 -> 25 | G11: 6 | H11: 1 | I11: =G11*6+H11 -> 37 | K11: 8 | L11: 3 | M11: =K11*6+L11 -> 51 | O11: 10 | P11: 3 | Q11: =O11*6+P11 -> 63 | S11: KENDALL | W11: FOOTSCRAY | X11: 1 | Y11: 0 | Z11: 0 | AA11: 134 | AB11: 21 | AC11: 638.09523809523807 | AD11: 4
A12: BEST PLAYERS | W12: ESSENDON ASSOC. | X12: 1 | Y12: 0 | Z12: 0 | AA12: 83 | AB12: 40 | AC12: 207.5 | AD12: 4
A13: WILLIAMSTOWN | C13: HOLMES | F13: McDONALD | I13: WALLACE | L13: ANGUS | O13: ELDRIDGE | R13: AMY | W13: NORTH MELBOURNE | X13: 1 | Y13: 0 | Z13: 0 | AA13: 74 | AB13: 58 | AC13: 127.58620689655173 | AD13: 4
A14: PORT MELBOURNE | C14: GOTZ | F14: McDONALD | I14: CONTIE | L14: MERRICK | O14: FRANKLIN | R14: TREGLOWN | W14: WILLIAMSTOWN | X14: 1 | Y14: 0 | Z14: 0 | AA14: 70 | AB14: 63 | AC14: 111.11111111111111 | AD14: 4
A15: GOALKICKERS
A16: WILLIAMSTOWN | C16: ROBINSON 3 | F16: LAMPRELL | I16: PHILLIPS | K16: MATTHEWS | N16: McTAGGART | Q16: McDONALD | T16: ANGUS | W16: NORTHCOTE | X16: 1 | Y16: 0 | Z16: 0 | AA16: 52 | AB16: 51 | AC16: 101.96078431372548 | AD16: 4
A17: PORT MELBOURNE | C17: STEELE 3 | F17: HUTCHINSON 3 | J17: WHEELER | M17: MAYNARD | P17: MERRICK | R17: HENDRIE | W17: BRUNSWICK | X17: 0 | Y17: 1 | Z17: 0 | AA17: 51 | AB17: 52 | AC17: 98.07692307692308 | AD17: 0
W18: PORT MELBOURNE | X18: 0 | Y18: 1 | Z18: 0 | AA18: 63 | AB18: 70 | AC18: 90 | AD18: 0
A19: FOOTSCRAY | C19: 2 | D19: 7 | E19: =C19*6+D19 -> 19 | G19: 10 | H19: 10 | I19: =G19*6+H19 -> 70 | K19: 12 | L19: 15 | M19: =K19*6+L19 -> 87 | O19: 19 | P19: 20 | Q19: =O19*6+P19 -> 134 | S19: FOOTSCRAY | W19: PRAHRAN | X19: 0 | Y19: 1 | Z19: 0 | AA19: 58 | AB19: 74 | AC19: 78.378378378378372 | AD19: 0
A20: MELBOURNE CITY | C20: 1 | D20: 1 | E20: =C20*6+D20 -> 7 | G20: 1 | H20: 1 | I20: =G20*6+H20 -> 7 | K20: 3 | L20: 1 | M20: =K20*6+L20 -> 19 | O20: 3 | P20: 3 | Q20: =O20*6+P20 -> 21 | S20: WREGG | W20: BRIGHTON | X20: 0 | Y20: 1 | Z20: 0 | AA20: 40 | AB20: 83 | AC20: 48.192771084337352 | AD20: 0
A21: BEST PLAYERS | W21: MELBOURNE CITY | X21: 0 | Y21: 1 | Z21: 0 | AA21: 21 | AB21: 134 | AC21: 15.671641791044776 | AD21: 0
A22: FOOTSCRAY | C22: CROUCH | F22: BANBURY | I22: BAXTER | L22: BRIGGS | O22: DOUGLAS | R22: COTTON
A23: MELBOURNE CITY | C23: MONOGHAN | F23: BECK | I23: KIKER | L23: ROBINSON | O23: TURNER | R23: O'CONNOR
A24: GOALKICKERS
A25: FOOTSCRAY | C25: BANBURY 5 | F25: BAXTER 5 | I25: COTTON 3 | L25: BRIESE 3 | N25: DOUGLAS | Q25: CROUCH | S25: SAMSON
A26: MELBOURNE CITY | C26: CLARK 2 | G26: O'CONNOR
A28: NORTH MELBOURNE | C28: 1 | D28: 2 | E28: =C28*6+D28 -> 8 | G28: 3 | H28: 6 | I28: =G28*6+H28 -> 24 | K28: 4 | L28: 8 | M28: =K28*6+L28 -> 32 | O28: 10 | P28: 14 | Q28: =O28*6+P28 -> 74 | S28: TOORAK PARK
A29: PRAHRAN | C29: 3 | D29: 1 | E29: =C29*6+D29 -> 19 | G29: 6 | H29: 3 | I29: =G29*6+H29 -> 39 | K29: 8 | L29: 3 | M29: =K29*6+L29 -> 51 | O29: 9 | P29: 4 | Q29: =O29*6+P29 -> 58 | S29: HURLEY
A30: BEST PLAYERS
A31: NORTH MELBOURNE | C31: HARDY | F31: S BARKER | I31: TRELOAR | L31: PEMBERTON | O31: ROACH | R31: JONES
A32: PRAHRAN | C32: ELLIN | F32: CARLSON | I32: SYKES | L32: MARONEY | O32: HANNAFORD | R32: WATERS
A33: GOALKICKERS
A34: NORTH MELBOURNE | C34: ELLIOTT 3 | F34: WILLIAMSON 3 | J34: McKAY | L34: HARDY | N34: G BARKER | Q34: ROACH
A35: PRAHRAN | C35: SYKES 4 | F35: MARONEY 2 | J35: DOWSING | M35: STOTT | O35: DOWDING
A37: ESSENDON ASSOC. | C37: 3 | D37: 2 | E37: =C37*6+D37 -> 20 | G37: 4 | H37: 5 | I37: =G37*6+H37 -> 29 | K37: 9 | L37: 7 | M37: =K37*6+L37 -> 61 | O37: 12 | P37: 11 | Q37: =O37*6+P37 -> 83 | S37: ESSENDON
A38: BRIGHTON | C38: 3 | D38: 0 | E38: =C38*6+D38 -> 18 | G38: 4 | H38: 3 | I38: =G38*6+H38 -> 27 | K38: 4 | L38: 5 | M38: =K38*6+L38 -> 29 | O38: 5 | P38: 10 | Q38: =O38*6+P38 -> 40 | S38: ALLEN
A39: BEST PLAYERS
A40: ESSENDON ASSOC. | C40: McINTYRE | F40: SEVIOR | I40: PAIN | L40: GIBSON | O40: McNAMARA | R40: CLARKE
A41: BRIGHTON | C41: SNOOK | F41: BELLER | I41: KNIGHTON | L41: GRAHAM | O41: E BAILES | R41: OLIVE
A42: GOALKICKERS
A43: ESSENDON ASSOC. | C43: CLARKE 4 | F43: McNAMARA 3 | J43: HOARE 2 | M43: CHAPMAN 2 | Q43: BUSBRIDGE
A44: BRIGHTON | C44: SNOOK 3 | F44: OLIVE | I44: ROBINSON
A46: NORTHCOTE | C46: 1 | D46: 5 | E46: =C46*6+D46 -> 11 | G46: 4 | H46: 7 | I46: =G46*6+H46 -> 31 | K46: 4 | L46: 8 | M46: =K46*6+L46 -> 32 | O46: 7 | P46: 10 | Q46: =O46*6+P46 -> 52 | S46: CROXTON PK
A47: BRUNSWICK | C47: 1 | D47: 1 | E47: =C47*6+D47 -> 7 | G47: 3 | H47: 3 | I47: =G47*6+H47 -> 21 | K47: 6 | L47: 7 | M47: =K47*6+L47 -> 43 | O47: 7 | P47: 9 | Q47: =O47*6+P47 -> 51 | S47: HUME
A48: BEST PLAYERS
A49: NORTHCOTE | C49: COLE | F49: BIGGINS | I49: BECK | L49: SWIFT | O49: BARRETT | R49: DUNCAN
A50: BRUNSWICK | C50: STANCLIFFE | F50: LEEDS | I50: BRAID | L50: MILLS | O50: PRICE | R50: MARSH
A51: GOALKICKERS
A52: NORTHCOTE | C52: JOHNSON 4 | G52: SWIFT | I52: DAWSON | L52: BECK
A53: BRUNSWICK | C53: PRICE 2 | F53: O'BRIEN | I53: PITCHER | L53: STANCLIFFE | O53: TEMPLE | Q53: MARSH
A55: ROUND 2 | E55: 4TH MAY | J55: WEATHER | M55: FINE SOUTH EAST WIND | S55: PLAYED AT | X55: LADDER | AB55: ROUND | AD55: 2
D56: 1ST QTR | H56: 2ND QTR | L56: 3RD QTR | P56: FINAL | S56: NORTH MELB
A57: NORTH MELBOURNE | C57: 6 | D57: 4 | E57: =C57*6+D57 -> 40 | G57: 8 | H57: 7 | I57: =G57*6+H57 -> 55 | K57: 12 | L57: 9 | M57: =K57*6+L57 -> 81 | O57: 14 | P57: 11 | Q57: =O57*6+P57 -> 95 | S57: UMPIRE | W57: TEAM | X57: W | Y57: L | Z57: D | AA57: FOR | AB57: AGST | AC57: % | AD57: PTS
A58: FOOTSCRAY | C58: 0 | D58: 2 | E58: =C58*6+D58 -> 2 | G58: 8 | H58: 5 | I58: =G58*6+H58 -> 53 | K58: 9 | L58: 8 | M58: =K58*6+L58 -> 62 | O58: 10 | P58: 12 | Q58: =O58*6+P58 -> 72 | S58: DARBY
A59: BEST PLAYERS | W59: WILLIAMSTOWN | X59: 2 | Y59: 0 | Z59: 0 | AA59: 132 | AB59: 96 | AC59: 137.5 | AD59: 8
A60: NORTH MELBOURNE | C60: ROACH | F60: G BARKER | I60: ELLIOTT | L60: WILLIAMSON | O60: HARDY | W60: NORTH MELBOURNE | X60: 2 | Y60: 0 | Z60: 0 | AA60: 169 | AB60: 130 | AC60: 130 | AD60: 8
A61: FOOTSCRAY | C61: CROUCH | F61: COTTON | I61: McCLUSKY | L61: BAXTER | O61: WHITE | R61: BRIESE | W61: FOOTSCRAY | X61: 1 | Y61: 1 | Z61: 0 | AA61: 206 | AB61: 116 | AC61: 177.58620689655172 | AD61: 4
A62: GOALKICKERS | W62: ESSENDON ASSOC. | X62: 1 | Y62: 1 | Z62: 0 | AA62: 140 | AB62: 101 | AC62: 138.61386138613861 | AD62: 4
A63: NORTH MELBOURNE | C63: G BARKER 7 | G63: ELLIOTT 3 | J63: WILLIAMSON 3 | N63: HARDY
A64: FOOTSCRAY | C64: COTTON 2 | F64: KNIGHT 2 | I64: BRIESE 2 | L64: BAXTER 2 | O64: SPENCE | Q64: SAMSON | W64: BRUNSWICK | X64: 1 | Y64: 1 | Z64: 0 | AA64: 159 | AB64: 124 | AC64: 128.2258064516129 | AD64: 4
W65: PORT MELBOURNE | X65: 1 | Y65: 1 | Z65: 0 | AA65: 124 | AB65: 127 | AC65: 97.637795275590548 | AD65: 4
A66: BRUNSWICK | C66: 4 | D66: 5 | E66: =C66*6+D66 -> 29 | G66: 6 | H66: 7 | I66: =G66*6+H66 -> 43 | K66: 13 | L66: 14 | M66: =K66*6+L66 -> 92 | O66: 15 | P66: 18 | Q66: =O66*6+P66 -> 108 | S66: BRUNSWICK | W66: NORTHCOTE | X66: 1 | Y66: 1 | Z66: 0 | AA66: 104 | AB66: 110 | AC66: 94.545454545454547 | AD66: 4
A67: PRAHRAN | C67: 4 | D67: 2 | E67: =C67*6+D67 -> 26 | G67: 5 | H67: 13 | I67: =G67*6+H67 -> 43 | K67: 5 | L67: 14 | M67: =K67*6+L67 -> 44 | O67: 9 | P67: 18 | Q67: =O67*6+P67 -> 72 | S67: TRUSCOTT | W67: BRIGHTON | X67: 1 | Y67: 1 | Z67: 0 | AA67: 99 | AB67: 135 | AC67: 73.333333333333329 | AD67: 4
A68: BEST PLAYERS | W68: PRAHRAN | X68: 0 | Y68: 2 | Z68: 0 | AA68: 130 | AB68: 182 | AC68: 71.428571428571431 | AD68: 0
A69: BRUNSWICK | C69: CONNOR | F69: STANCLIFFE | I69: ROWE | L69: BRAID | O69: PRICE | R69: LEEDS | W69: MELBOURNE CITY | X69: 0 | Y69: 2 | Z69: 0 | AA69: 54 | AB69: 196 | AC69: 27.551020408163264 | AD69: 0
A70: PRAHRAN | C70: MARONEY | F70: CARLSON | I70: McKENZIE | L70: WILSON | O70: DOWSING | R70: SYKES
A71: GOALKICKERS
A72: BRUNSWICK | C72: H BRAID 4 | F72: PRICE 4 | H72: STANCLIFFE 2 | K72: ROWE 2 | M72: STAHL | O72: CARRIE | Q72: PITCHER
A73: PRAHRAN | C73: SYKES 4 | F73: MARONEY 2 | I73: DOWDING 2 | L73: McKENZIE
A75: PORT MELBOURNE | C75: 2 | D75: 1 | E75: =C75*6+D75 -> 13 | G75: 5 | H75: 2 | I75: =G75*6+H75 -> 32 | K75: 5 | L75: 3 | M75: =K75*6+L75 -> 33 | O75: 9 | P75: 7 | Q75: =O75*6+P75 -> 61 | S75: PORT MELB
A76: ESSENDON ASSOC. | C76: 1 | D76: 2 | E76: =C76*6+D76 -> 8 | G76: 4 | H76: 6 | I76: =G76*6+H76 -> 30 | K76: 7 | L76: 9 | M76: =K76*6+L76 -> 51 | O76: 8 | P76: 9 | Q76: =O76*6+P76 -> 57 | S76: KENDALL
A77: BEST PLAYERS
A78: PORT MELBOURNE | C78: TREGLOWN | F78: MERRICK | I78: STEELE | L78: ANDERSON | O78: CLELAND | R78: FRANKLIN
A79: ESSENDON ASSOC. | C79: McNAMARA | F79: REDFERN | I79: CHAPMAN | L79: SEVIOR | O79: HOARE | R79: WALKER
A80: GOALKICKERS
A81: PORT MELBOURNE | C81: TREGLOWN 2 | G81: MERRICK 2 | J81: JINKS 2 | L81: MAYNARD | O81: HUTCHINSON | R81: STEELE
A82: ESSENDON ASSOC. | C82: McNAMARA 3 | G82: CLARKE 2 | J82: LEWIS | L82: GIBSON | O82: CHAPMAN
A84: BRIGHTON | C84: 2 | D84: 1 | E84: =C84*6+D84 -> 13 | G84: 4 | H84: 6 | I84: =G84*6+H84 -> 30 | K84: 6 | L84: 10 | M84: =K84*6+L84 -> 46 | O84: 8 | P84: 11 | Q84: =O84*6+P84 -> 59 | S84: BRIGHTON BEACH
A85: NORTHCOTE | C85: 2 | D85: 6 | E85: =C85*6+D85 -> 18 | G85: 4 | H85: 9 | I85: =G85*6+H85 -> 33 | K85: 4 | L85: 9 | M85: =K85*6+L85 -> 33 | O85: 7 | P85: 10 | Q85: =O85*6+P85 -> 52 | S85: HURLEY
A86: BEST PLAYERS
A87: BRIGHTON | C87: B BAILES | F87: NEGRO | I87: OLIVE | L87: BELLER | O87: GRAHAM | R87: KNIGHTON
A88: NORTHCOTE | C88: S HALL | F88: MINTO | I88: JOHNSON | L88: BECK | O88: BILLETT | R88: RYAN
A89: GOALKICKERS
A90: BRIGHTON | C90: OLIVE 2 | F90: SNOOK 2 | I90: BELLER | L90: TAYLOR | O90: FREEMAN | R90: KNIGHTON
A91: NORTHCOTE | C91: RYAN 4 | F91: SWIFT 2 | I91: MINTO
A93: WILLIAMSTOWN | C93: 3 | D93: 7 | E93: =C93*6+D93 -> 25 | G93: 4 | H93: 10 | I93: =G93*6+H93 -> 34 | K93: 7 | L93: 11 | M93: =K93*6+L93 -> 53 | O93: 8 | P93: 14 | Q93: =O93*6+P93 -> 62 | S93: EAST MELB
A94: MELBOURNE CITY | C94: 2 | D94: 1 | E94: =C94*6+D94 -> 13 | G94: 3 | H94: 4 | I94: =G94*6+H94 -> 22 | K94: 3 | L94: 6 | M94: =K94*6+L94 -> 24 | O94: 4 | P94: 9 | Q94: =O94*6+P94 -> 33 | S94: HOUSTEN
A95: BEST PLAYERS
A96: WILLIAMSTOWN | C96: ALLEY | F96: RIGALDI | I96: McTAGGART | L96: ANGUS | O96: HOLMES | R96: ANDERSON
A97: MELBOURNE CITY
A98: GOALKICKERS
A99: WILLIAMSTOWN | C99: MATTHEWS 2 | G99: AMY 2 | J99: LAMPRELL 2 | N99: HOLMES | Q99: ANGUS
A100: MELBOURNE CITY | C100: PASH 2 | G100: BOLGER | J100: BRIGGS
A102: ROUND 3 | E102: 11TH MAY | K102: WEATHER | N102: FINE SOUTH WEST BREEZE | S102: PLAYED AT
D103: 1ST QTR | H103: 2ND QTR | L103: 3RD QTR | P103: FINAL | S103: ESSENDON | X103: LADDER | AB103: ROUND | AD103: 3
A104: ESSENDON ASSOC. | C104: 1 | D104: 3 | E104: =C104*6+D104 -> 9 | G104: 2 | H104: 3 | I104: =G104*6+H104 -> 15 | K104: 7 | L104: 5 | M104: =K104*6+L104 -> 47 | O104: 9 | P104: 6 | Q104: =O104*6+P104 -> 60 | S104: UMPIRE
A105: WILLIAMSTOWN | C105: 0 | D105: 3 | E105: =C105*6+D105 -> 3 | G105: 1 | H105: 6 | I105: =G105*6+H105 -> 12 | K105: 1 | L105: 8 | M105: =K105*6+L105 -> 14 | O105: 4 | P105: 10 | Q105: =O105*6+P105 -> 34 | S105: KENDALL | W105: TEAM | X105: W | Y105: L | Z105: D | AA105: FOR | AB105: AGST | AC105: % | AD105: PTS
A106: BEST PLAYERS
A107: ESSENDON ASSOC. | C107: GIBSON | F107: J MADDEN | I107: SEVIOR | K107: McNAMARA | N107: E BUSBRIDGE | Q107: HUNTINGTON | W107: NORTH MELBOURNE | X107: 3 | Y107: 0 | Z107: 0 | AA107: 238 | AB107: 173 | AC107: 137.57225433526011 | AD107: 12
A108: WILLIAMSTOWN | C108: LAMPRELL | F108: HARDEN | I108: WALLIS | K108: MATTHEWS | N108: ROSE | Q108: McTAGGART | W108: FOOTSCRAY | X108: 2 | Y108: 1 | Z108: 0 | AA108: 275 | AB108: 160 | AC108: 171.875 | AD108: 8
A109: GOALKICKERS | W109: ESSENDON ASSOC. | X109: 2 | Y109: 1 | Z109: 0 | AA109: 200 | AB109: 135 | AC109: 148.14814814814815 | AD109: 8
A110: ESSENDON ASSOC. | C110: McNAMARA 3 | G110: CLARKE 3 | J110: HOARE 2 | M110: HUNTINGTON | W110: PORT MELBOURNE | X110: 2 | Y110: 1 | Z110: 0 | AA110: 205 | AB110: 163 | AC110: 125.76687116564418 | AD110: 8
A111: WILLIAMSTOWN | C111: MATTHEWS | F111: AMY | H111: LAMPRELL | K111: HARDEN
W112: WILLIAMSTOWN | X112: 2 | Y112: 1 | Z112: 0 | AA112: 166 | AB112: 156 | AC112: 106.41025641025641 | AD112: 8
A113: NORTH MELBOURNE | C113: 1 | D113: 3 | E113: =C113*6+D113 -> 9 | G113: 5 | H113: 4 | I113: =G113*6+H113 -> 34 | K113: 6 | L113: 7 | M113: =K113*6+L113 -> 43 | O113: 10 | P113: 9 | Q113: =O113*6+P113 -> 69 | S113: BRUNSWICK | W113: NORTHCOTE | X113: 2 | Y113: 1 | Z113: 0 | AA113: 159 | AB113: 154 | AC113: 103.24675324675324 | AD113: 8
A114: BRUNSWICK | C114: 1 | D114: 2 | E114: =C114*6+D114 -> 8 | G114: 2 | H114: 5 | I114: =G114*6+H114 -> 17 | K114: 5 | L114: 5 | M114: =K114*6+L114 -> 35 | O114: 6 | P114: 7 | Q114: =O114*6+P114 -> 43 | S114: HURLEY | W114: BRUNSWICK | X114: 1 | Y114: 2 | Z114: 0 | AA114: 202 | AB114: 193 | AC114: 104.66321243523316 | AD114: 4
A115: BEST PLAYERS | W115: BRIGHTON | X115: 1 | Y115: 2 | Z115: 0 | AA115: 143 | AB115: 204 | AC115: 70.098039215686271 | AD115: 4
A116: NORTH MELBOURNE | C116: HARDY | F116: S BARKER | I116: SPEAKMAN | L116: McKAY | N116: CORRIGAN | Q116: ROACH | W116: PRAHRAN | X116: 0 | Y116: 3 | Z116: 0 | AA116: 174 | AB116: 237 | AC116: 73.417721518987335 | AD116: 0
A117: BRUNSWICK | C117: STAHL | F117: STANCLIFFE | I117: O'CONNOR | L117: MARSH | N117: GEORGE | Q117: GILLESPIE | W117: MELBOURNE CITY | X117: 0 | Y117: 3 | Z117: 0 | AA117: 90 | AB117: 277 | AC117: 32.490974729241877 | AD117: 0
A118: GOALKICKERS
A119: NORTH MELBOURNE | C119: G BARKER 3 | G119: HARDY 3 | J119: ELLIOTT 2 | M119: McKAY 2
A120: BRUNSWICK | C120: MARSH 2 | F120: O'CONNOR | I120: GILLESPIE | K120: STANCLIFFE | N120: KYME
A122: NORTHCOTE | C122: 1 | D122: 3 | E122: =C122*6+D122 -> 9 | G122: 5 | H122: 5 | I122: =G122*6+H122 -> 35 | K122: 6 | L122: 6 | M122: =K122*6+L122 -> 42 | O122: 8 | P122: 7 | Q122: =O122*6+P122 -> 55 | S122: CROXTON PK
A123: PRAHRAN | C123: 1 | D123: 2 | E123: =C123*6+D123 -> 8 | G123: 3 | H123: 4 | I123: =G123*6+H123 -> 22 | K123: 4 | L123: 6 | M123: =K123*6+L123 -> 30 | O123: 6 | P123: 8 | Q123: =O123*6+P123 -> 44 | S123: HERBERT
A124: BEST PLAYERS
A125: NORTHCOTE | C125: BILLETT | F125: S HALL | I125: COLE | L125: SWIFT | N125: J JOHNSON | Q125: SCOTT
A126: PRAHRAN | C126: MARONEY | F126: WEIDNER | I126: CARLSON | L126: HALL | N126: DARBY | Q126: WATERS
A127: GOALKICKERS
A128: NORTHCOTE | C128: SWIFT 2 | F128: RYAN 2 | I128: BECK | K128: DAWSON | N128: DUNCAN | Q128: JOHNSON
A129: PRAHRAN | C129: FARMER 2 | F129: SYKES | I129: DARBY | K129: HAY | M129: MARONEY
A131: FOOTSCRAY | C131: 3 | D131: 10 | E131: =C131*6+D131 -> 28 | G131: 3 | H131: 14 | I131: =G131*6+H131 -> 32 | K131: 7 | L131: 21 | M131: =K131*6+L131 -> 63 | O131: 8 | P131: 21 | Q131: =O131*6+P131 -> 69 | S131: FOOTSCRAY
A132: BRIGHTON | C132: 1 | D132: 0 | E132: =C132*6+D132 -> 6 | G132: 2 | H132: 2 | I132: =G132*6+H132 -> 14 | K132: 3 | L132: 2 | M132: =K132*6+L132 -> 20 | O132: 6 | P132: 8 | Q132: =O132*6+P132 -> 44 | S132: TRUSCOTT
A133: BEST PLAYERS
A134: FOOTSCRAY | C134: CROUCH | F134: CRADDOCK | I134: BAXTER | L134: GREGORY | N134: McCLUSKY | Q134: CLARK
A135: BRIGHTON | C135: B BAILES | F135: BELLER | I135: GRAHAM | L135: HEATLEY
A136: GOALKICKERS
A137: FOOTSCRAY | C137: BANBURY 2 | F137: CRADDOCK | I137: DOUGLAS | L137: BRIGGS | N137: CROUCH | P137: SAMSON | R137: BAXTER
A138: BRIGHTON | C138: GRAHAM | F138: HEATLEY | I138: OLIVE | L138: FREEMAN | O138: BELLER | Q138: BUTLER
A140: PORT MELBOURNE | C140: 2 | D140: 4 | E140: =C140*6+D140 -> 16 | G140: 3 | H140: 9 | I140: =G140*6+H140 -> 27 | K140: 9 | L140: 10 | M140: =K140*6+L140 -> 64 | O140: 11 | P140: 15 | Q140: =O140*6+P140 -> 81 | S140: PORT MELB
A141: MELBOURNE CITY | C141: 2 | D141: 2 | E141: =C141*6+D141 -> 14 | G141: 3 | H141: 2 | I141: =G141*6+H141 -> 20 | K141: 5 | L141: 4 | M141: =K141*6+L141 -> 34 | O141: 5 | P141: 6 | Q141: =O141*6+P141 -> 36 | S141: CARTER
A142: BEST PLAYERS
A143: PORT MELBOURNE | C143: MERRICK | F143: TREGLOWN | I143: CARDEN | L143: HAYES | N143: GOTZ | Q143: McDONALD
A144: MELBOURNE CITY | C144: TURNER | F144: JAMES | I144: JOHNSON | L144: DANIELS | N144: ROBINSON | Q144: GRANT
A145: GOALKICKERS
A146: PORT MELBOURNE | C146: STEELE 5 | G146: HUTCHINSON 3 | L146: MERRICK 3
A147: MELBOURNE CITY | C147: PASH 2 | F147: CLARKE 2 | J147: BRIGGS
A149: ROUND 4 | E149: 18TH MAY | K149: WEATHER | N149: CLOUDY LATE LIGHT RAIN | S149: PLAYED AT | X149: LADDER | AB149: ROUND | AD149: 4
D150: 1ST QTR | H150: 2ND QTR | L150: 3RD QTR | P150: FINAL | S150: FOOTSCRAY
A151: FOOTSCRAY | C151: 3 | D151: 4 | E151: =C151*6+D151 -> 22 | G151: 7 | H151: 5 | I151: =G151*6+H151 -> 47 | K151: 8 | L151: 7 | M151: =K151*6+L151 -> 55 | O151: 10 | P151: 11 | Q151: =O151*6+P151 -> 71 | S151: UMPIRE | W151: TEAM | X151: W | Y151: L | Z151: D | AA151: FOR | AB151: AGST | AC151: % | AD151: PTS
A152: ESSENDON ASSOC. | C152: 2 | D152: 3 | E152: =C152*6+D152 -> 15 | G152: 3 | H152: 5 | I152: =G152*6+H152 -> 23 | K152: 6 | L152: 6 | M152: =K152*6+L152 -> 42 | O152: 7 | P152: 7 | Q152: =O152*6+P152 -> 49 | S152: HUME
A153: BEST PLAYERS | W153: NORTH MELBOURNE | X153: 4 | Y153: 0 | Z153: 0 | AA153: 344 | AB153: 190 | AC153: 181.05263157894737 | AD153: 16
A154: FOOTSCRAY | C154: BANBURY | F154: BAXTER | I154: CLARK | L154: BORTHWICK | O154: CROUCH | Q154: McCARTHY | W154: FOOTSCRAY | X154: 3 | Y154: 1 | Z154: 0 | AA154: 346 | AB154: 209 | AC154: 165.55023923444975 | AD154: 12
A155: ESSENDON ASSOC. | C155: LEWIS | F155: HOARE | I155: SEVIOR | L155: HUNTINGTON | O155: CHRISTIE | Q155: ATKINS | W155: PORT MELBOURNE | X155: 3 | Y155: 1 | Z155: 0 | AA155: 280 | AB155: 227 | AC155: 123.34801762114537 | AD155: 12
A156: GOALKICKERS | W156: ESSENDON ASSOC. | X156: 2 | Y156: 2 | Z156: 0 | AA156: 249 | AB156: 206 | AC156: 120.87378640776699 | AD156: 8
A157: FOOTSCRAY | C157: BANBURY 6 | G157: McCARTHY 2 | K157: BAXTER | N157: CRADDOCK
A158: ESSENDON ASSOC. | C158: McNAMARA 3 | G158: HOARE | J158: CLARKE | M158: STEWART | P158: CHAPMAN | W158: BRUNSWICK | X158: 2 | Y158: 2 | Z158: 0 | AA158: 255 | AB158: 225 | AC158: 113.33333333333333 | AD158: 8
W159: WILLIAMSTOWN | X159: 2 | Y159: 2 | Z159: 0 | AA159: 198 | AB159: 209 | AC159: 94.736842105263165 | AD159: 8
A160: NORTH MELBOURNE | C160: 6 | D160: 5 | E160: =C160*6+D160 -> 41 | G160: 7 | H160: 10 | I160: =G160*6+H160 -> 52 | K160: 9 | L160: 15 | M160: =K160*6+L160 -> 69 | O160: 14 | P160: 22 | Q160: =O160*6+P160 -> 106 | S160: NORTH MELB | W160: BRIGHTON | X160: 2 | Y160: 2 | Z160: 0 | AA160: 228 | AB160: 263 | AC160: 86.692015209125472 | AD160: 8
A161: NORTHCOTE | C161: 1 | D161: 0 | E161: =C161*6+D161 -> 6 | G161: 1 | H161: 2 | I161: =G161*6+H161 -> 8 | K161: 2 | L161: 3 | M161: =K161*6+L161 -> 15 | O161: 2 | P161: 5 | Q161: =O161*6+P161 -> 17 | S161: HURLEY | W161: NORTHCOTE | X161: 2 | Y161: 2 | Z161: 0 | AA161: 176 | AB161: 260 | AC161: 67.692307692307693 | AD161: 8
A162: BEST PLAYERS | W162: PRAHRAN | X162: 0 | Y162: 4 | Z162: 0 | AA162: 238 | AB162: 312 | AC162: 76.282051282051285 | AD162: 0
A163: NORTH MELBOURNE | C163: PEMBERTON | F163: ROACH | I163: J JOHNSON | L163: CORRIGAN | O163: JONES | R163: HERON | W163: MELBOURNE CITY | X163: 0 | Y163: 4 | Z163: 0 | AA163: 149 | AB163: 362 | AC163: 41.160220994475139 | AD163: 0
A164: NORTHCOTE | C164: MOORE | F164: WILSON | I164: HALL | L164: G JOHNSON | O164: BECK | R164: SWIFT
A165: GOALKICKERS
A166: NORTH MELBOURNE | C166: HARDY 3 | F166: WILLIAMSON 3 | J166: G BARKER 3 | M166: RAWLE | O166: GRIERSON | Q166: JOHNSON | S166: ROACH | U166: CORRIGAN
A167: NORTHCOTE | C167: MOORE | F167: SWIFT
A169: BRUNSWICK | C169: 0 | D169: 0 | E169: =C169*6+D169 -> 0 | G169: 4 | H169: 4 | I169: =G169*6+H169 -> 28 | K169: 4 | L169: 4 | M169: =K169*6+L169 -> 28 | O169: 7 | P169: 11 | Q169: =O169*6+P169 -> 53 | S169: WILLIAMSTOWN
A170: WILLIAMSTOWN | C170: 1 | D170: 4 | E170: =C170*6+D170 -> 10 | G170: 1 | H170: 4 | I170: =G170*6+H170 -> 10 | K170: 4 | L170: 8 | M170: =K170*6+L170 -> 32 | O170: 4 | P170: 8 | Q170: =O170*6+P170 -> 32 | S170: HERBERT
A171: BEST PLAYERS
A172: BRUNSWICK | C172: MILLS | F172: KYME | I172: McKENZIE | L172: STANCLIFFE | O172: SULLIVAN | R172: L BRAID
A173: WILLIAMSTOWN | C173: AMY | F173: ELDRIDGE | I173: McTAGGART | L173: ANDERSON | O173: HARDEN | R173: O'HALLORAN
A174: GOALKICKERS
A175: BRUNSWICK | C175: McKENZIE 2 | G175: MILLS | I175: ROWE | K175: SULLIVAN | N175: STANCLIFFE | Q175: O'CONNOR
A176: WILLIAMSTOWN | C176: WALLIS 2 | G176: AMY | I176: McDONALD
A178: BRIGHTON | C178: 5 | D178: 5 | E178: =C178*6+D178 -> 35 | G178: 8 | H178: 7 | I178: =G178*6+H178 -> 55 | K178: 10 | L178: 10 | M178: =K178*6+L178 -> 70 | O178: 12 | P178: 13 | Q178: =O178*6+P178 -> 85 | S178: EMCG
A179: MELBOURNE CITY | C179: 3 | D179: 0 | E179: =C179*6+D179 -> 18 | G179: 5 | H179: 6 | I179: =G179*6+H179 -> 36 | K179: 7 | L179: 9 | M179: =K179*6+L179 -> 51 | O179: 8 | P179: 11 | Q179: =O179*6+P179 -> 59 | S179: WREGG
A180: BEST PLAYERS
A181: BRIGHTON | C181: B BAILES | F181: SMITH | I181: E BAILES | L181: A LAXTON | O181: FREEMAN | R181: TAYLOR
A182: MELBOURNE CITY | C182: TURNER | F182: DANIELS | I182: MONOGHAN | L182: WILSON | O182: ROBINSON | R182: KIKER
A183: GOALKICKERS
A184: BRIGHTON | C184: EDMONDS 3 | F184: SNOOK 2 | I184: FREEMAN 2 | L184: E BAILES | N184: B BAILES | P184: GRAHAM | R184: BELLER | T184: MANN
A185: MELBOURNE CITY
A187: PORT MELBOURNE | C187: 1 | D187: 2 | E187: =C187*6+D187 -> 8 | G187: 5 | H187: 7 | I187: =G187*6+H187 -> 37 | K187: 7 | L187: 11 | M187: =K187*6+L187 -> 53 | O187: 10 | P187: 15 | Q187: =O187*6+P187 -> 75 | S187: TOORAK PARK
A188: PRAHRAN | C188: 1 | D188: 6 | E188: =C188*6+D188 -> 12 | G188: 4 | H188: 6 | I188: =G188*6+H188 -> 30 | K188: 9 | L188: 8 | M188: =K188*6+L188 -> 62 | O188: 9 | P188: 10 | Q188: =O188*6+P188 -> 64 | S188: CARTER
A189: BEST PLAYERS
A190: PORT MELBOURNE | C190: JINKS | F190: MERRICK | I190: MULROSS | L190: ANDERSON | O190: FRANKLIN | R190: STEELE
A191: PRAHRAN | C191: McKENZIE | F191: HAY | I191: ELLIN | L191: MARONEY | O191: WEIDNER | R191: TYSON
A192: GOALKICKERS
A193: PORT MELBOURNE | C193: STEELE 3 | F193: HUTCHINSON 2 | J193: JINKS 2 | M193: MERRICK | P193: BROWN | R193: CLELAND
A194: PRAHRAN | C194: SYKES 3 | F194: HAY 2 | I194: McKENZIE | L194: MARONEY | O194: HALL | Q194: FARMER
A196: ROUND 5 | E196: 25TH MAY | H196: WEATHER | J196: RAIN WIND NORTH VEERING WEST THEN SOUTH | S196: PLAYED AT | X196: LADDER | AB196: ROUND | AD196: 5
D197: 1ST QTR | H197: 2ND QTR | L197: 3RD QTR | P197: FINAL | S197: BRUNSWICK
A198: BRUNSWICK | C198: 1 | D198: 1 | E198: =C198*6+D198 -> 7 | G198: 3 | H198: 5 | I198: =G198*6+H198 -> 23 | K198: 5 | L198: 7 | M198: =K198*6+L198 -> 37 | O198: 6 | P198: 9 | Q198: =O198*6+P198 -> 45 | S198: UMPIRE | W198: TEAM | X198: W | Y198: L | Z198: D | AA198: FOR | AB198: AGST | AC198: % | AD198: PTS
A199: FOOTSCRAY | C199: 0 | D199: 4 | E199: =C199*6+D199 -> 4 | G199: 2 | H199: 5 | I199: =G199*6+H199 -> 17 | K199: 4 | L199: 8 | M199: =K199*6+L199 -> 32 | O199: 5 | P199: 14 | Q199: =O199*6+P199 -> 44 | S199: HURLEY
A200: BEST PLAYERS | W200: NORTH MELBOURNE | X200: 5 | Y200: 0 | Z200: 0 | AA200: 414 | AB200: 235 | AC200: 176.17021276595744 | AD200: 20
A201: BRUNSWICK | C201: LEEDS | F201: CHANDLER | I201: McKENZIE | L201: ROSS | O201: MARSH | Q201: O'CONNOR | W201: PORT MELBOURNE | X201: 4 | Y201: 1 | Z201: 0 | AA201: 355 | AB201: 272 | AC201: 130.51470588235293 | AD201: 16
A202: FOOTSCRAY | C202: HARRIS | F202: COTTON | I202: CROUCH | L202: BORTHWICK | O202: BRIESE | Q202: McCLUSKY | W202: FOOTSCRAY | X202: 3 | Y202: 2 | Z202: 0 | AA202: 390 | AB202: 254 | AC202: 153.54330708661416 | AD202: 12
A203: GOALKICKERS | W203: ESSENDON ASSOC. | X203: 3 | Y203: 2 | Z203: 0 | AA203: 326 | AB203: 231 | AC203: 141.12554112554113 | AD203: 12
A204: BRUNSWICK | C204: CHANDLER 2 | G204: McKENZIE 2 | K204: D McCARTHY | O204: GILLESPIE
A205: FOOTSCRAY | C205: BRIESE 2 | G205: COTTON | J205: BANBURY | M205: SPENCE | W205: BRUNSWICK | X205: 3 | Y205: 2 | Z205: 0 | AA205: 300 | AB205: 269 | AC205: 111.52416356877323 | AD205: 12
W206: WILLIAMSTOWN | X206: 2 | Y206: 3 | Z206: 0 | AA206: 236 | AB206: 253 | AC206: 93.280632411067188 | AD206: 8
A207: NORTH MELBOURNE | C207: 3 | D207: 1 | E207: =C207*6+D207 -> 19 | G207: 5 | H207: 4 | I207: =G207*6+H207 -> 34 | K207: 9 | L207: 8 | M207: =K207*6+L207 -> 62 | O207: 10 | P207: 10 | Q207: =O207*6+P207 -> 70 | S207: BRIGHTON BEACH | W207: BRIGHTON | X207: 2 | Y207: 3 | Z207: 0 | AA207: 273 | AB207: 333 | AC207: 81.981981981981988 | AD207: 8
A208: BRIGHTON | C208: 0 | D208: 3 | E208: =C208*6+D208 -> 3 | G208: 2 | H208: 3 | I208: =G208*6+H208 -> 15 | K208: 3 | L208: 5 | M208: =K208*6+L208 -> 23 | O208: 6 | P208: 9 | Q208: =O208*6+P208 -> 45 | S208: HERBERT | W208: NORTHCOTE | X208: 2 | Y208: 3 | Z208: 0 | AA208: 221 | AB208: 335 | AC208: 65.97014925373135 | AD208: 8
A209: BEST PLAYERS | W209: PRAHRAN | X209: 1 | Y209: 4 | Z209: 0 | AA209: 282 | AB209: 350 | AC209: 80.571428571428569 | AD209: 4
A210: NORTH MELBOURNE | C210: HARDY | F210: ROACH | I210: SPEAKMAN | L210: HERON | O210: JONES | Q210: CORRIGAN | W210: MELBOURNE CITY | X210: 0 | Y210: 5 | Z210: 0 | AA210: 174 | AB210: 439 | AC210: 39.635535307517081 | AD210: 0
A211: BRIGHTON | C211: DALL | F211: I SMITH | I211: E BAILES | L211: BELLER | O211: GRAHAM | Q211: BRIDGER
A212: GOALKICKERS
A213: NORTH MELBOURNE | C213: HARDY 5 | F213: WILLIAMSON 2 | J213: ELLIOTT 2 | M213: TRELOAR
A214: BRIGHTON | C214: DALL 2 | F214: FREEMAN 2 | J214: SMITH | M214: NEGRO
A216: PRAHRAN | C216: 1 | D216: 5 | E216: =C216*6+D216 -> 11 | G216: 3 | H216: 7 | I216: =G216*6+H216 -> 25 | K216: 4 | L216: 7 | M216: =K216*6+L216 -> 31 | O216: 6 | P216: 8 | Q216: =O216*6+P216 -> 44 | S216: WILLIAMSTOWN
A217: WILLIAMSTOWN | C217: 2 | D217: 0 | E217: =C217*6+D217 -> 12 | G217: 3 | H217: 2 | I217: =G217*6+H217 -> 20 | K217: 4 | L217: 6 | M217: =K217*6+L217 -> 30 | O217: 5 | P217: 8 | Q217: =O217*6+P217 -> 38 | S217: ALLEN
A218: BEST PLAYERS
A219: PRAHRAN | C219: McKENZIE | F219: SYKES | I219: TYSON | L219: OLIVE | O219: RYAN | Q219: FEWSTER
A220: WILLIAMSTOWN | C220: ALLEY | F220: AMY | I220: HARDEN | L220: WALLIS | O220: McTAGGART | R220: ELDRIDGE
A221: GOALKICKERS
A222: PRAHRAN | C222: SYKES 2 | F222: TYSON 2 | I222: NORMAN | L222: McKENZIE
A223: WILLIAMSTOWN | C223: HOWARTH | F223: McDONALD | I223: AMY | L223: WALLIS | O223: ROSE
A225: PORT MELBOURNE | C225: 2 | D225: 1 | E225: =C225*6+D225 -> 13 | G225: 6 | H225: 2 | I225: =G225*6+H225 -> 38 | K225: 9 | L225: 5 | M225: =K225*6+L225 -> 59 | O225: 11 | P225: 9 | Q225: =O225*6+P225 -> 75 | S225: PORT MELB
A226: NORTHCOTE | C226: 0 | D226: 1 | E226: =C226*6+D226 -> 1 | G226: 3 | H226: 2 | I226: =G226*6+H226 -> 20 | K226: 4 | L226: 3 | M226: =K226*6+L226 -> 27 | O226: 7 | P226: 3 | Q226: =O226*6+P226 -> 45 | S226: WREGG
A227: BEST PLAYERS
A228: PORT MELBOURNE | C228: STEELE | F228: HUTCHINSON | I228: MERRICK | L228: JINKS | O228: BROWN | R228: GOTZ
A229: NORTHCOTE | C229: BILLETT | F229: HALL | I229: HAMMOND | L229: SWIFT | O229: MOORE | R229: BECK
A230: GOALKICKERS
A231: PORT MELBOURNE | C231: STEELE 3 | F231: HUTCHINSON 2 | J231: MULROSS | M231: TREGLOWN | P231: JINKS | R231: CARDEN | T231: GOTZ | V231: BROWN
A232: NORTHCOTE | C232: RYAN 3 | F232: JOHNSON 2 | J232: SALVADO | M232: HAMMOND
A234: ESSENDON ASSOC. | C234: 4 | D234: 6 | E234: =C234*6+D234 -> 30 | G234: 6 | H234: 12 | I234: =G234*6+H234 -> 48 | K234: 9 | L234: 16 | M234: =K234*6+L234 -> 70 | O234: 10 | P234: 17 | Q234: =O234*6+P234 -> 77 | S234: ESSENDON
A235: MELBOURNE CITY | C235: 0 | D235: 2 | E235: =C235*6+D235 -> 2 | G235: 1 | H235: 3 | I235: =G235*6+H235 -> 9 | K235: 1 | L235: 4 | M235: =K235*6+L235 -> 10 | O235: 3 | P235: 7 | Q235: =O235*6+P235 -> 25 | S235: KENDALL
A236: BEST PLAYERS
A237: ESSENDON ASSOC. | C237: McNAMARA | F237: CHAPMAN | I237: HOARE | L237: CHRISTIE | O237: HUNTINGTON | R237: WALL
A238: MELBOURNE CITY | C238: PHILLIPS | F238: TURNER | I238: JONES | L238: O'CONNOR | O238: ROBINSON | R238: KIKER
A239: GOALKICKERS
A240: ESSENDON ASSOC. | C240: McNAMARA 6 | G240: SEVIOR | J240: CHAPMAN | M240: TOPHAM | P240: LINANE
A241: MELBOURNE CITY | C241: CLARKE | F241: KILGOUR | I241: DANIELS
A243: ROUND 6 | E243: 1ST JUNE | I243: WEATHER | L243: CLOUDY LIGHT SHOWERS SOUTH BREEZE | S243: PLAYED AT | X243: LADDER | AB243: ROUND | AD243: 6
D244: 1ST QTR | H244: 2ND QTR | L244: 3RD QTR | P244: FINAL | S244: PORT MELB
A245: NORTH MELBOURNE | C245: 2 | D245: 1 | E245: =C245*6+D245 -> 13 | G245: 4 | H245: 4 | I245: =G245*6+H245 -> 28 | K245: 6 | L245: 6 | M245: =K245*6+L245 -> 42 | O245: 8 | P245: 8 | Q245: =O245*6+P245 -> 56 | S245: UMPIRE | W245: TEAM | X245: W | Y245: L | Z245: D | AA245: FOR | AB245: AGST | AC245: % | AD245: PTS
A246: PORT MELBOURNE | C246: 1 | D246: 3 | E246: =C246*6+D246 -> 9 | G246: 4 | H246: 6 | I246: =G246*6+H246 -> 30 | K246: 4 | L246: 9 | M246: =K246*6+L246 -> 33 | O246: 5 | P246: 13 | Q246: =O246*6+P246 -> 43 | S246: HURLEY
A247: BEST PLAYERS | W247: NORTH MELBOURNE | X247: 6 | Y247: 0 | Z247: 0 | AA247: 470 | AB247: 278 | AC247: 169.06474820143885 | AD247: 24
A248: NORTH MELBOURNE | C248: HARDY | F248: CORRIGAN | I248: ELLIOTT | L248: S BARKER | O248: RAWLE | R248: TRELOAR | W248: FOOTSCRAY | X248: 4 | Y248: 2 | Z248: 0 | AA248: 477 | AB248: 301 | AC248: 158.4717607973422 | AD248: 16
A249: PORT MELBOURNE | C249: JINKS | F249: ANDERSON | I249: GOTZ | L249: CONLEN | O249: McDONALD | R249: FRANKLIN | W249: PORT MELBOURNE | X249: 4 | Y249: 2 | Z249: 0 | AA249: 398 | AB249: 328 | AC249: 121.34146341463415 | AD249: 16
A250: GOALKICKERS | W250: BRUNSWICK | X250: 4 | Y250: 2 | Z250: 0 | AA250: 349 | AB250: 313 | AC250: 111.50159744408946 | AD250: 16
A251: NORTH MELBOURNE | C251: ROACH 2 | F251: HARDY 2 | I251: ELLIOTT 2 | M251: JOHNSON | P251: WILLIAMSON
A252: PORT MELBOURNE | C252: HUTCHINSON | F252: MERRICK | I252: STEELE | L252: JINKS | N252: CLELAND | W252: ESSENDON ASSOC. | X252: 3 | Y252: 3 | Z252: 0 | AA252: 370 | AB252: 280 | AC252: 132.14285714285714 | AD252: 12
W253: BRIGHTON | X253: 3 | Y253: 3 | Z253: 0 | AA253: 341 | AB253: 399 | AC253: 85.463659147869677 | AD253: 12
A254: BRUNSWICK | C254: 1 | D254: 3 | E254: =C254*6+D254 -> 9 | G254: 3 | H254: 8 | I254: =G254*6+H254 -> 26 | K254: 4 | L254: 12 | M254: =K254*6+L254 -> 36 | O254: 5 | P254: 19 | Q254: =O254*6+P254 -> 49 | S254: BRUNSWICK | W254: NORTHCOTE | X254: 3 | Y254: 3 | Z254: 0 | AA254: 285 | AB254: 382 | AC254: 74.607329842931932 | AD254: 12
A255: ESSENDON ASSOC. | C255: 5 | D255: 6 | E255: =C255*6+D255 -> 36 | G255: 5 | H255: 6 | I255: =G255*6+H255 -> 36 | K255: 6 | L255: 6 | M255: =K255*6+L255 -> 42 | O255: 6 | P255: 8 | Q255: =O255*6+P255 -> 44 | S255: CARTER | W255: WILLIAMSTOWN | X255: 2 | Y255: 4 | Z255: 0 | AA255: 302 | AB255: 321 | AC255: 94.0809968847352 | AD255: 8
A256: BEST PLAYERS | W256: PRAHRAN | X256: 1 | Y256: 5 | Z256: 0 | AA256: 329 | AB256: 437 | AC256: 75.286041189931353 | AD256: 4
A257: BRUNSWICK | C257: O'CONNOR | F257: McKENZIE | I257: STANCLIFFE | L257: L BRAID | O257: ROSS | R257: MILLS | W257: MELBOURNE CITY | X257: 0 | Y257: 6 | Z257: 0 | AA257: 221 | AB257: 503 | AC257: 43.936381709741553 | AD257: 0
A258: ESSENDON ASSOC. | C258: McNAMARA | F258: MAINE | I258: SEVIOR | L258: ATKINS | O258: CHAPMAN | R258: GIBSON
A259: GOALKICKERS
A260: BRUNSWICK | C260: PRICE 2 | F260: KYME | I260: MARSH | L260: CHANDLER
A261: ESSENDON ASSOC. | C261: CLARKE 4 | G261: MCNAMARA | J261: HUNTINGTON
A263: BRIGHTON | C263: 2 | D263: 5 | E263: =C263*6+D263 -> 17 | G263: 4 | H263: 6 | I263: =G263*6+H263 -> 30 | K263: 7 | L263: 12 | M263: =K263*6+L263 -> 54 | O263: 9 | P263: 14 | Q263: =O263*6+P263 -> 68 | S263: WILLIAMSTOWN
A264: WILLIAMSTOWN | C264: 4 | D264: 4 | E264: =C264*6+D264 -> 28 | G264: 6 | H264: 9 | I264: =G264*6+H264 -> 45 | K264: 7 | L264: 11 | M264: =K264*6+L264 -> 53 | O264: 9 | P264: 12 | Q264: =O264*6+P264 -> 66 | S264: KENDALL
A265: BEST PLAYERS
A266: BRIGHTON | C266: B BAILES | F266: BELLER | I266: E BAILES | L266: SMITH | O266: A LAXTON | R266: HEATLEY
A267: WILLIAMSTOWN | C267: MCDONALD | F267: ALLEY | I267: ANGUS | L267: AMY | O267: HARDEN | R267: McTAGGART
A268: GOALKICKERS
A269: BRIGHTON | C269: SMITH 2 | F269: DALL 2 | I269: DOWDING 2 | L269: GRAHAM | O269: EDMONDS | R269: FREEMAN
A270: WILLIAMSTOWN | C270: HOWARTH 3 | F270: AMY 2 | I270: O'HALLORAN | L270: BUSBRIDGE | O270: MAY | Q270: HOLMES
A272: NORTHCOTE | C272: 2 | D272: 3 | E272: =C272*6+D272 -> 15 | G272: 3 | H272: 8 | I272: =G272*6+H272 -> 26 | K272: 7 | L272: 11 | M272: =K272*6+L272 -> 53 | O272: 8 | P272: 16 | Q272: =O272*6+P272 -> 64 | S272: EMCG
A273: MELBOURNE CITY | C273: 1 | D273: 2 | E273: =C273*6+D273 -> 8 | G273: 2 | H273: 4 | I273: =G273*6+H273 -> 16 | K273: 4 | L273: 4 | M273: =K273*6+L273 -> 28 | O273: 6 | P273: 11 | Q273: =O273*6+P273 -> 47 | S273: ALLEN
A274: BEST PLAYERS
A275: NORTHCOTE | C275: HAMMOND | F275: MOORE | I275: BECK | L275: BILLETT | O275: HALL | R275: COLE
A276: MELBOURNE CITY | C276: PHILLIPS | F276: TURNER | I276: DANIELS | L276: JONES | O276: O'CONNOR | R276: KIKER
A277: GOALKICKERS
A278: NORTHCOTE | C278: RYAN 3 | F278: MOORE | H278: PUNCH | J278: JOHNSON | M278: BILLETT | P278: HAMMOND
A279: MELBOURNE CITY | C279: KIKER 2 | F279: CLARKE 2 | I279: DANIELS | L279: WILSON
A281: FOOTSCRAY | C281: 5 | D281: 0 | E281: =C281*6+D281 -> 30 | G281: 8 | H281: 2 | I281: =G281*6+H281 -> 50 | K281: 11 | L281: 7 | M281: =K281*6+L281 -> 73 | O281: 13 | P281: 9 | Q281: =O281*6+P281 -> 87 | S281: TOORAK PARK
A282: PRAHRAN | C282: 0 | D282: 3 | E282: =C282*6+D282 -> 3 | G282: 2 | H282: 6 | I282: =G282*6+H282 -> 18 | K282: 4 | L282: 7 | M282: =K282*6+L282 -> 31 | O282: 6 | P282: 11 | Q282: =O282*6+P282 -> 47 | S282: WREGG
A283: BEST PLAYERS
A284: FOOTSCRAY | C284: COTTON | F284: NASH | I284: SPENCE | L284: CROUCH | O284: BORTHWICK | R284: McCLUSKY
A285: PRAHRAN | C285: MARONEY | F285: McKENZIE | I285: HAY | L285: RYAN | O285: WILSON | R285: DOWSING
A286: GOALKICKERS
A287: FOOTSCRAY | C287: NASH 4 | F287: BAXTER 4 | I287: BANBURY 2 | M287: COTTON | O287: BRIESE | Q287: CLARK
A288: PRAHRAN | C288: SYKES 2 | F288: FARMER 2 | I288: TYSON 2
A290: ROUND 7 | E290: 3RD JUNE | G290: KINGS BIRTHDAY | K290: WEATHER | N290: CLOUDY LIGHT SHOWERS | S290: PLAYED AT | X290: LADDER | AB290: ROUND | AD290: 7
D291: 1ST QTR | H291: 2ND QTR | L291: 3RD QTR | P291: FINAL | S291: BRIGHTON BEACH
A292: PORT MELBOURNE | C292: 1 | D292: 5 | E292: =C292*6+D292 -> 11 | G292: 5 | H292: 8 | I292: =G292*6+H292 -> 38 | K292: 6 | L292: 10 | M292: =K292*6+L292 -> 46 | O292: 7 | P292: 12 | Q292: =O292*6+P292 -> 54 | S292: UMPIRE | W292: TEAM | X292: W | Y292: L | Z292: D | AA292: FOR | AB292: AGST | AC292: % | AD292: PTS
A293: BRIGHTON | C293: 1 | D293: 2 | E293: =C293*6+D293 -> 8 | G293: 1 | H293: 8 | I293: =G293*6+H293 -> 14 | K293: 1 | L293: 11 | M293: =K293*6+L293 -> 17 | O293: 4 | P293: 15 | Q293: =O293*6+P293 -> 39 | S293: KENDALL
A294: BEST PLAYERS | W294: NORTH MELBOURNE | X294: 7 | Y294: 0 | Z294: 0 | AA294: 547 | AB294: 333 | AC294: 164.26426426426426 | AD294: 28
A295: PORT MELBOURNE | C295: COUTIE | F295: MULROSS | I295: CARDEN | L295: JOHNSON | O295: HENDRIE | R295: HAYES | W295: FOOTSCRAY | X295: 5 | Y295: 2 | Z295: 0 | AA295: 557 | AB295: 377 | AC295: 147.74535809018568 | AD295: 20
A296: BRIGHTON | C296: B BAILES | F296: A LAXTON | I296: BELLER | L296: DALL | O296: E SMITH | R296: E BAILES | W296: PORT MELBOURNE | X296: 5 | Y296: 2 | Z296: 0 | AA296: 452 | AB296: 367 | AC296: 123.16076294277929 | AD296: 20
A297: GOALKICKERS | W297: BRUNSWICK | X297: 5 | Y297: 2 | Z297: 0 | AA297: 425 | AB297: 355 | AC297: 119.71830985915493 | AD297: 20
A298: PORT MELBOURNE | C298: JINKS 3 | F298: HUTCHINSON 2 | J298: MERRICK | M298: ROBERTS
A299: BRIGHTON | C299: DALL | F299: J SMITH | I299: NEGRO | L299: DOWDING | W299: ESSENDON ASSOC. | X299: 4 | Y299: 3 | Z299: 0 | AA299: 448 | AB299: 323 | AC299: 138.69969040247679 | AD299: 16
W300: BRIGHTON | X300: 3 | Y300: 4 | Z300: 0 | AA300: 380 | AB300: 453 | AC300: 83.885209713024281 | AD300: 12
A301: FOOTSCRAY | C301: 3 | D301: 5 | E301: =C301*6+D301 -> 23 | G301: 5 | H301: 7 | I301: =G301*6+H301 -> 37 | K301: 9 | L301: 8 | M301: =K301*6+L301 -> 62 | O301: 11 | P301: 14 | Q301: =O301*6+P301 -> 80 | S301: CROXTON PK | W301: NORTHCOTE | X301: 3 | Y301: 4 | Z301: 0 | AA301: 361 | AB301: 462 | AC301: 78.138528138528144 | AD301: 12
A302: NORTHCOTE | C302: 3 | D302: 5 | E302: =C302*6+D302 -> 23 | G302: 8 | H302: 7 | I302: =G302*6+H302 -> 55 | K302: 10 | L302: 9 | M302: =K302*6+L302 -> 69 | O302: 11 | P302: 10 | Q302: =O302*6+P302 -> 76 | S302: HURLEY | W302: WILLIAMSTOWN | X302: 2 | Y302: 5 | Z302: 0 | AA302: 357 | AB302: 398 | AC302: 89.698492462311563 | AD302: 8
A303: BEST PLAYERS | W303: PRAHRAN | X303: 1 | Y303: 6 | Z303: 0 | AA303: 372 | AB303: 515 | AC303: 72.233009708737868 | AD303: 4
A304: FOOTSCRAY | C304: BANBURY | F304: COTTON | I304: CROUCH | L304: CRADDOCK | O304: SAMSON | R304: CLARK | W304: MELBOURNE CITY | X304: 0 | Y304: 7 | Z304: 0 | AA304: 263 | AB304: 579 | AC304: 45.423143350604491 | AD304: 0
A305: NORTHCOTE | C305: HAMMOND | F305: SCOTT | I305: BECK | L305: RYAN | O305: SWIFT | R305: BILLETT
A306: GOALKICKERS
A307: FOOTSCRAY | C307: BAXTER 3 | F307: CROUCH 3 | I307: COTTON 2 | M307: BANBURY 2 | Q307: BORTHWICK
A308: NORTHCOTE | C308: RYAN 4 | F308: MOORE 2 | I308: JOHNSON 2 | M308: BECK | O308: PUNCH | Q308: DAWSON
A310: NORTH MELBOURNE | C310: 3 | D310: 1 | E310: =C310*6+D310 -> 19 | G310: 4 | H310: 2 | I310: =G310*6+H310 -> 26 | K310: 6 | L310: 3 | M310: =K310*6+L310 -> 39 | O310: 12 | P310: 5 | Q310: =O310*6+P310 -> 77 | S310: NORTH MELB
A311: WILLIAMSTOWN | C311: 1 | D311: 2 | E311: =C311*6+D311 -> 8 | G311: 4 | H311: 6 | I311: =G311*6+H311 -> 30 | K311: 5 | L311: 12 | M311: =K311*6+L311 -> 42 | O311: 7 | P311: 13 | Q311: =O311*6+P311 -> 55 | S311: TRUSCOTT
A312: BEST PLAYERS
A313: NORTH MELBOURNE | C313: S BARKER | F313: HERON | I313: JOHNSON | L313: ROACH | O313: McKAY | R313: TRELOAR
A314: WILLIAMSTOWN | C314: McDONALD | F314: ALLEY | I314: REITMAN | L314: HOLMES | O314: ROBERTSON | R314: BUSBRIDGE
A315: GOALKICKERS
A316: NORTH MELBOURNE | C316: WILLIAMSON 5 | G316: ROACH 3 | J316: ELLIOTT 2 | M316: HARDY | P316: S BARKER
A317: WILLIAMSTOWN | C317: 37742 | F317: HOWARTH | I317: AMY | K317: ALLEY | M317: COLLINS
A319: ESSENDON ASSOC. | C319: 3 | D319: 4 | E319: =C319*6+D319 -> 22 | G319: 5 | H319: 10 | I319: =G319*6+H319 -> 40 | K319: 6 | L319: 13 | M319: =K319*6+L319 -> 49 | O319: 10 | P319: 18 | Q319: =O319*6+P319 -> 78 | S319: ESSENDON
A320: PRAHRAN | C320: 3 | D320: 0 | E320: =C320*6+D320 -> 18 | G320: 3 | H320: 1 | I320: =G320*6+H320 -> 19 | K320: 6 | L320: 4 | M320: =K320*6+L320 -> 40 | O320: 6 | P320: 7 | Q320: =O320*6+P320 -> 43 | S320: HOUSTEN
A321: BEST PLAYERS
A322: ESSENDON ASSOC. | C322: MCNAMARA | F322: WILKINSON | I322: J MADDEN | L322: HOARE | O322: McINTYRE | R322: GIBSON
A323: PRAHRAN | C323: MARONEY | F323: CARLSON | I323: FEWSTER | L323: KELLY | O323: WILSON | R323: FARMER
A324: GOALKICKERS
A325: ESSENDON ASSOC. | C325: McNAMARA 6 | G325: HOARE 2 | J325: CHAPMAN | M325: WALL
A326: PRAHRAN | C326: SYKES 2 | F326: WILSON 2 | J326: FARMER | M326: CARLSON
A328: BRUNSWICK | C328: 1 | D328: 2 | E328: =C328*6+D328 -> 8 | G328: 7 | H328: 9 | I328: =G328*6+H328 -> 51 | K328: 9 | L328: 12 | M328: =K328*6+L328 -> 66 | O328: 10 | P328: 16 | Q328: =O328*6+P328 -> 76 | S328: EAST MELB
A329: MELBOURNE CITY | C329: 2 | D329: 2 | E329: =C329*6+D329 -> 14 | G329: 2 | H329: 4 | I329: =G329*6+H329 -> 16 | K329: 3 | L329: 7 | M329: =K329*6+L329 -> 25 | O329: 5 | P329: 12 | Q329: =O329*6+P329 -> 42 | S329: HERBERT
A330: BEST PLAYERS
A331: BRUNSWICK | C331: McKENZIE | F331: PRICE | I331: GILLESPIE | L331: LEEDS | O331: ROSS | R331: MILLS
A332: MELBOURNE CITY | C332: WRIGHT | F332: TURNER | I332: PHILLIPS | L332: WILSON | O332: FARRELL | R332: MONOGHAN
A333: GOALKICKERS
A334: BRUNSWICK | C334: McKENZIE 5 | G334: PRICE 3 | J334: STAHL | M334: WILLIS
A335: MELBOURNE CITY | C335: WRIGHT 2 | G335: TURNER | J335: PHILLIPS
A337: ROUND 8 | E337: 8TH JUNE | K337: WEATHER | N337: FINE N.E. BREEZE | S337: PLAYED AT | X337: LADDER | AB337: ROUND | AD337: 8
D338: 1ST QTR | H338: 2ND QTR | L338: 3RD QTR | P338: FINAL | S338: FOOTSCRAY
A339: FOOTSCRAY | C339: 6 | D339: 3 | E339: =C339*6+D339 -> 39 | G339: 6 | H339: 9 | I339: =G339*6+H339 -> 45 | K339: 11 | L339: 13 | M339: =K339*6+L339 -> 79 | O339: 13 | P339: 25 | Q339: =O339*6+P339 -> 103 | S339: UMPIRE | W339: TEAM | X339: W | Y339: L | Z339: D | AA339: FOR | AB339: AGST | AC339: % | AD339: PTS
A340: PORT MELBOURNE | C340: 0 | D340: 1 | E340: =C340*6+D340 -> 1 | G340: 3 | H340: 4 | I340: =G340*6+H340 -> 22 | K340: 4 | L340: 5 | M340: =K340*6+L340 -> 29 | O340: 5 | P340: 5 | Q340: =O340*6+P340 -> 35 | S340: HURLEY
A341: BEST PLAYERS | W341: NORTH MELBOURNE | X341: 8 | Y341: 0 | Z341: 0 | AA341: 629 | AB341: 411 | AC341: 153.04136253041364 | AD341: 32
A342: FOOTSCRAY | C342: BORTHWICK | F342: BANBURY | I342: COTTON | L342: CLARK | O342: CROUCH | R342: SAMSON | W342: FOOTSCRAY | X342: 6 | Y342: 2 | Z342: 0 | AA342: 660 | AB342: 412 | AC342: 160.19417475728156 | AD342: 24
A343: PORT MELBOURNE | C343: SAMSON | F343: GOTZ | I343: MCDONALD | L343: ANDERSON | O343: HAYES | R343: JINKS | W343: BRUNSWICK | X343: 6 | Y343: 2 | Z343: 0 | AA343: 483 | AB343: 399 | AC343: 121.05263157894737 | AD343: 24
A344: GOALKICKERS | W344: PORT MELBOURNE | X344: 5 | Y344: 3 | Z344: 0 | AA344: 487 | AB344: 470 | AC344: 103.61702127659575 | AD344: 20
A345: FOOTSCRAY | C345: BANBURY 6 | G345: COTTON 4 | J345: CROUCH 2 | M345: BAXTER
A346: PORT MELBOURNE | C346: STEELE 2 | G346: MERRICK 2 | J346: CARDEN | W346: ESSENDON ASSOC. | X346: 4 | Y346: 4 | Z346: 0 | AA346: 526 | AB346: 405 | AC346: 129.87654320987653 | AD346: 16
W347: NORTHCOTE | X347: 4 | Y347: 4 | Z347: 0 | AA347: 412 | AB347: 496 | AC347: 83.064516129032256 | AD347: 16
A348: NORTH MELBOURNE | C348: 4 | D348: 5 | E348: =C348*6+D348 -> 29 | G348: 7 | H348: 11 | I348: =G348*6+H348 -> 53 | K348: 9 | L348: 13 | M348: =K348*6+L348 -> 67 | O348: 11 | P348: 16 | Q348: =O348*6+P348 -> 82 | S348: ESSENDON | W348: BRIGHTON | X348: 3 | Y348: 5 | Z348: 0 | AA348: 424 | AB348: 511 | AC348: 82.974559686888455 | AD348: 12
A349: ESSENDON ASSOC. | C349: 4 | D349: 0 | E349: =C349*6+D349 -> 24 | G349: 5 | H349: 2 | I349: =G349*6+H349 -> 32 | K349: 10 | L349: 4 | M349: =K349*6+L349 -> 64 | O349: 12 | P349: 6 | Q349: =O349*6+P349 -> 78 | S349: KENDALL | W349: WILLIAMSTOWN | X349: 2 | Y349: 6 | Z349: 0 | AA349: 391 | AB349: 449 | AC349: 87.082405345211583 | AD349: 8
A350: BEST PLAYERS | W350: PRAHRAN | X350: 2 | Y350: 6 | Z350: 0 | AA350: 465 | AB350: 555 | AC350: 83.78378378378379 | AD350: 8
A351: NORTH MELBOURNE | C351: JOHNSON | F351: ELLIOTT | I351: HARDY | L351: S BARKER | O351: JONES | R351: SPEAKMAN | W351: MELBOURNE CITY | X351: 0 | Y351: 8 | Z351: 0 | AA351: 303 | AB351: 672 | AC351: 45.089285714285715 | AD351: 0
A352: ESSENDON ASSOC. | C352: McNAMARA | F352: HOARE | I352: WILKINSON | L352: HUNTINGTON | O352: SEVIOR | R352: CHAPMAN
A353: GOALKICKERS
A354: NORTH MELBOURNE | C354: ELLIOTT 5 | G354: G BARKER 2 | K354: WILLIAMSON | N354: ROACH | P354: JONES | R354: JOHNSON
A355: ESSENDON ASSOC. | C355: McNAMARA 5 | G355: CLARKE 3 | J355: CHAPMAN | M355: HUNTINGTON | P355: REDFERN | R355: HOARE
A357: BRUNSWICK | C357: 1 | D357: 3 | E357: =C357*6+D357 -> 9 | G357: 3 | H357: 7 | I357: =G357*6+H357 -> 25 | K357: 3 | L357: 11 | M357: =K357*6+L357 -> 29 | O357: 7 | P357: 16 | Q357: =O357*6+P357 -> 58 | S357: BRIGHTON BEACH
A358: BRIGHTON | C358: 2 | D358: 4 | E358: =C358*6+D358 -> 16 | G358: 2 | H358: 4 | I358: =G358*6+H358 -> 16 | K358: 3 | L358: 12 | M358: =K358*6+L358 -> 30 | O358: 5 | P358: 14 | Q358: =O358*6+P358 -> 44 | S358: CARTER
A359: BEST PLAYERS
A360: BRUNSWICK | C360: STANCLIFFE | F360: ROSS | I360: SULLIVAN | L360: PITCHER | O360: MILLS | R360: L BRAID
A361: BRIGHTON | C361: BELLER | F361: J SMITH | I361: GRAHAM | L361: DALL | O361: NEGRO | R361: E BAILES
A362: GOALKICKERS
A363: BRUNSWICK | C363: SULLIVAN 2 | G363: STANCLIFFE | J363: PRICE | L363: MILLS | N363: PITCHER | Q363: CHANDLER
A364: BRIGHTON | C364: DALL 3 | G364: DOWDING | J364: BELLER
A366: NORTHCOTE | C366: 1 | D366: 2 | E366: =C366*6+D366 -> 8 | G366: 1 | H366: 6 | I366: =G366*6+H366 -> 12 | K366: 4 | L366: 7 | M366: =K366*6+L366 -> 31 | O366: 6 | P366: 15 | Q366: =O366*6+P366 -> 51 | S366: WILLIAMSTOWN
A367: WILLIAMSTOWN | C367: 1 | D367: 2 | E367: =C367*6+D367 -> 8 | G367: 2 | H367: 4 | I367: =G367*6+H367 -> 16 | K367: 3 | L367: 8 | M367: =K367*6+L367 -> 26 | O367: 4 | P367: 10 | Q367: =O367*6+P367 -> 34 | S367: ALLEN
A368: BEST PLAYERS
A369: NORTHCOTE | C369: SMITH | F369: MOORE | I369: JOHNSON | L369: EARSMAN | O369: GLUYAS | Q369: HAMMOND
A370: WILLIAMSTOWN | C370: ALLEY | F370: REITMAN | I370: WALLIS | L370: HOLMES | O370: HARDEN | Q370: McTAGGART
A371: GOALKICKERS
A372: NORTHCOTE | C372: EARSMAN 2 | F372: BECK 2 | I372: MOORE | L372: RYAN
A373: WILLIAMSTOWN | C373: ROBERTSON | F373: MAY | H373: ANDERSON | K373: HOWARTH
A375: PRAHRAN | C375: 5 | D375: 4 | E375: =C375*6+D375 -> 34 | G375: 8 | H375: 8 | I375: =G375*6+H375 -> 56 | K375: 10 | L375: 11 | M375: =K375*6+L375 -> 71 | O375: 13 | P375: 15 | Q375: =O375*6+P375 -> 93 | S375: TOORAK PARK
A376: MELBOURNE CITY | C376: 1 | D376: 3 | E376: =C376*6+D376 -> 9 | G376: 3 | H376: 5 | I376: =G376*6+H376 -> 23 | K376: 4 | L376: 8 | M376: =K376*6+L376 -> 32 | O376: 5 | P376: 10 | Q376: =O376*6+P376 -> 40 | S376: WREGG
A377: BEST PLAYERS
A378: PRAHRAN | C378: CARLSON | F378: MARONEY | I378: HALL | L378: WILSON | O378: FARMER | R378: KELLY
A379: MELBOURNE CITY | C379: KIKER | F379: DANIELS | I379: MONOGHAN | L379: QUINN | O379: CLARKE | R379: GRANT
A380: GOALKICKERS
A381: PRAHRAN | C381: KELLY 4 | F381: HALL 3 | I381: SYKES 3 | L381: FARMER 2 | O381: TYSON
A382: MELBOURNE CITY | C382: PHILLIPS 2 | G382: KIKER | J382: DANIELS | M382: RANKIN
A384: ROUND 9 | E384: 15TH JUNE | K384: WEATHER | N384: SHOWERS SOUTH WIND | S384: PLAYED AT | X384: LADDER | AB384: ROUND | AD384: 9
D385: 1ST QTR | H385: 2ND QTR | L385: 3RD QTR | P385: FINAL | S385: BRUNSWICK
A386: BRUNSWICK | C386: 1 | D386: 2 | E386: =C386*6+D386 -> 8 | G386: 2 | H386: 10 | I386: =G386*6+H386 -> 22 | K386: 4 | L386: 17 | M386: =K386*6+L386 -> 41 | O386: 5 | P386: 23 | Q386: =O386*6+P386 -> 53 | S386: UMPIRE | W386: TEAM | X386: W | Y386: L | Z386: D | AA386: FOR | AB386: AGST | AC386: % | AD386: PTS
A387: PORT MELBOURNE | C387: 2 | D387: 3 | E387: =C387*6+D387 -> 15 | G387: 2 | H387: 5 | I387: =G387*6+H387 -> 17 | K387: 5 | L387: 8 | M387: =K387*6+L387 -> 38 | O387: 7 | P387: 9 | Q387: =O387*6+P387 -> 51 | S387: KENDALL
A388: BEST PLAYERS | W388: NORTH MELBOURNE | X388: 9 | Y388: 0 | Z388: 0 | AA388: 718 | AB388: 434 | AC388: 165.43778801843317 | AD388: 36
A389: BRUNSWICK | C389: McKENZIE | F389: STANCLIFFE | I389: KYME | L389: MARSH | O389: PRICE | R389: SULLIVAN | W389: FOOTSCRAY | X389: 7 | Y389: 2 | Z389: 0 | AA389: 762 | AB389: 435 | AC389: 175.17241379310346 | AD389: 28
A390: PORT MELBOURNE | C390: TREGLOWN | F390: MERRICK | I390: JINKS | L390: A McDONALD | O390: ANDERSON | R390: SAMSON | W390: BRUNSWICK | X390: 7 | Y390: 2 | Z390: 0 | AA390: 536 | AB390: 450 | AC390: 119.11111111111111 | AD390: 28
A391: GOALKICKERS | W391: ESSENDON ASSOC. | X391: 5 | Y391: 4 | Z391: 0 | AA391: 596 | AB391: 470 | AC391: 126.80851063829788 | AD391: 20
A392: BRUNSWICK | C392: McKENZIE 2 | G392: STANCLIFFE | J392: GILLESPIE | M392: PRICE
A393: PORT MELBOURNE | C393: MERRICK 2 | G393: TREGLOWN 2 | K393: STEELE | M393: ANG McDONALD | Q393: MULROSS | W393: PORT MELBOURNE | X393: 5 | Y393: 4 | Z393: 0 | AA393: 538 | AB393: 523 | AC393: 102.868068833652 | AD393: 20
W394: BRIGHTON | X394: 4 | Y394: 5 | Z394: 0 | AA394: 463 | AB394: 545 | AC394: 84.954128440366972 | AD394: 16
A395: ESSENDON ASSOC. | C395: 2 | D395: 1 | E395: =C395*6+D395 -> 13 | G395: 4 | H395: 4 | I395: =G395*6+H395 -> 28 | K395: 6 | L395: 6 | M395: =K395*6+L395 -> 42 | O395: 10 | P395: 10 | Q395: =O395*6+P395 -> 70 | S395: CROXTON PK | W395: NORTHCOTE | X395: 4 | Y395: 5 | Z395: 0 | AA395: 477 | AB395: 566 | AC395: 84.275618374558306 | AD395: 16
A396: NORTHCOTE | C396: 2 | D396: 2 | E396: =C396*6+D396 -> 14 | G396: 4 | H396: 5 | I396: =G396*6+H396 -> 29 | K396: 8 | L396: 9 | M396: =K396*6+L396 -> 57 | O396: 9 | P396: 11 | Q396: =O396*6+P396 -> 65 | S396: HUME | W396: PRAHRAN | X396: 2 | Y396: 7 | Z396: 0 | AA396: 499 | AB396: 594 | AC396: 84.006734006734007 | AD396: 8
A397: BEST PLAYERS | W397: WILLIAMSTOWN | X397: 2 | Y397: 7 | Z397: 0 | AA397: 414 | AB397: 551 | AC397: 75.136116152450086 | AD397: 8
A398: ESSENDON ASSOC. | C398: McNAMARA | F398: PAIN | I398: HUNTINGTON | L398: WALKER | O398: CHAPMAN | R398: SEVIOR | W398: MELBOURNE CITY | X398: 0 | Y398: 9 | Z398: 0 | AA398: 326 | AB398: 761 | AC398: 42.838370565045992 | AD398: 0
A399: NORTHCOTE | C399: JOHNSON | F399: SWIFT | I399: COLE | L399: BECK | O399: HAMMOND | R399: HALL
A400: GOALKICKERS
A401: ESSENDON ASSOC. | C401: MCNAMARA 5 | G401: CHRISTIE | J401: HUNTINGTON | N401: TOPHAM | Q401: HOARE | S401: CHAPMAN
A402: NORTHCOTE | C402: RYAN 4 | F402: NORMAN 3 | J402: JOHNSON | M402: SCOTT
A404: BRIGHTON | C404: 0 | D404: 1 | E404: =C404*6+D404 -> 1 | G404: 0 | H404: 6 | I404: =G404*6+H404 -> 6 | K404: 2 | L404: 8 | M404: =K404*6+L404 -> 20 | O404: 4 | P404: 15 | Q404: =O404*6+P404 -> 39 | S404: BRIGHTON BEACH
A405: PRAHRAN | C405: 1 | D405: 5 | E405: =C405*6+D405 -> 11 | G405: 3 | H405: 7 | I405: =G405*6+H405 -> 25 | K405: 4 | L405: 9 | M405: =K405*6+L405 -> 33 | O405: 4 | P405: 10 | Q405: =O405*6+P405 -> 34 | S405: HURLEY
A406: BEST PLAYERS
A407: BRIGHTON | C407: KNIGHTON | F407: B BAILES | I407: BUTLER | L407: E SMITH | O407: E BAILES | R407: GRAHAM
A408: PRAHRAN | C408: DOWSING | F408: McKENZIE | I408: WEIDNER | L408: H WILSON | O408: TYSON | R408: ELLIN
A409: GOALKICKERS
A410: BRIGHTON | C410: GRAHAM | F410: DOWDING | I410: DALL | L410: EDMONDS
A411: PRAHRAN | C411: RYAN | F411: WILSON | I411: McKENZIE | L411: DEVONPORT
A413: FOOTSCRAY | C413: 3 | D413: 3 | E413: =C413*6+D413 -> 21 | G413: 7 | H413: 5 | I413: =G413*6+H413 -> 47 | K413: 12 | L413: 9 | M413: =K413*6+L413 -> 81 | O413: 15 | P413: 12 | Q413: =O413*6+P413 -> 102 | S413: FOOTSCRAY
A414: WILLIAMSTOWN | C414: 2 | D414: 2 | E414: =C414*6+D414 -> 14 | G414: 3 | H414: 2 | I414: =G414*6+H414 -> 20 | K414: 3 | L414: 5 | M414: =K414*6+L414 -> 23 | O414: 3 | P414: 5 | Q414: =O414*6+P414 -> 23 | S414: TRUSCOTT
A415: BEST PLAYERS
A416: FOOTSCRAY | C416: OGILVIE | F416: BAXTER | I416: McCLUSKY | L416: COTTON | O416: CRADDOCK | R416: BRIESE
A417: WILLIAMSTOWN | C417: ALLEY | F417: REITMAN | I417: AMY | L417: McTAGGART | O417: HOLMES | R417: HARDEN
A418: GOALKICKERS
A419: FOOTSCRAY | C419: BANBURY 4 | F419: BRIESE 4 | I419: BAXTER 2 | L419: COTTON 2 | O419: BORTHWICK | R419: CROUCH | U419: NASH
A420: WILLIAMSTOWN | C420: MATTHEWS | F420: AMY | I420: HARDEN
A422: NORTH MELBOURNE | C422: 5 | D422: 3 | E422: =C422*6+D422 -> 33 | G422: 8 | H422: 12 | I422: =G422*6+H422 -> 60 | K422: 12 | L422: 15 | M422: =K422*6+L422 -> 87 | O422: 12 | P422: 17 | Q422: =O422*6+P422 -> 89 | S422: EAST MELB
A423: MELBOURNE CITY | C423: 1 | D423: 1 | E423: =C423*6+D423 -> 7 | G423: 2 | H423: 2 | I423: =G423*6+H423 -> 14 | K423: 2 | L423: 4 | M423: =K423*6+L423 -> 16 | O423: 3 | P423: 5 | Q423: =O423*6+P423 -> 23 | S423: WREGG
A424: BEST PLAYERS
A425: NORTH MELBOURNE | C425: S BARKER | F425: HARDY | I425: WILLIAMSON | L425: GERON | O425: JONES | R425: TRELOAR
A426: MELBOURNE CITY | C426: MARRIOTT | F426: PHILLIPS | I426: DANIELS | L426: FARRELL | O426: O'CONNOR | R426: QUINN
A427: GOALKICKERS
A428: NORTH MELBOURNE | C428: WILLIAMSON 4 | G428: G BARKER 2 | K428: ELLIOTT 2 | N428: HERON | P428: HARDY | R428: JOHNSON | U428: HOGAN
A429: MELBOURNE CITY | C429: FURLONG | G429: LARKINS | J429: MARRIOTT
A431: ROUND 10 | E431: 22ND JUNE | K431: WEATHER | N431: FINE N.E. BREEZE | S431: PLAYED AT | X431: LADDER | AB431: ROUND | AD431: 10
D432: 1ST QTR | H432: 2ND QTR | L432: 3RD QTR | P432: FINAL | S432: BRIGHTON BEACH
A433: BRIGHTON | C433: 1 | D433: 3 | E433: =C433*6+D433 -> 9 | G433: 2 | H433: 7 | I433: =G433*6+H433 -> 19 | K433: 5 | L433: 11 | M433: =K433*6+L433 -> 41 | O433: 8 | P433: 18 | Q433: =O433*6+P433 -> 66 | S433: UMPIRE | W433: TEAM | X433: W | Y433: L | Z433: D | AA433: FOR | AB433: AGST | AC433: % | AD433: PTS
A434: ESSENDON ASSOC. | C434: 2 | D434: 1 | E434: =C434*6+D434 -> 13 | G434: 3 | H434: 4 | I434: =G434*6+H434 -> 22 | K434: 6 | L434: 6 | M434: =K434*6+L434 -> 42 | O434: 8 | P434: 7 | Q434: =O434*6+P434 -> 55 | S434: TRUSCOTT
A435: BEST PLAYERS | W435: NORTH MELBOURNE | X435: 10 | Y435: 0 | Z435: 0 | AA435: 790 | AB435: 479 | AC435: 164.93 | AD435: 40
A436: BRIGHTON | C436: B BAILES | F436: E BAILES | I436: PALMER | L436: E SMITH | P436: DALL | R436: GRAHAM | W436: FOOTSCRAY | X436: 8 | Y436: 2 | Z436: 0 | AA436: 911 | AB436: 485 | AC436: 187.83505154639175 | AD436: 32
A437: ESSENDON ASSOC. | C437: HOARE | F437: SEVIOR | I437: CLARKE | L437: HUNTINGTON | P437: J MADDEN | R437: ATKINS | W437: BRUNSWICK | X437: 8 | Y437: 2 | Z437: 0 | AA437: 634 | AB437: 508 | AC437: 124.80314960629921 | AD437: 32
A438: GOALKICKERS | W438: ESSENDON ASSOC. | X438: 5 | Y438: 5 | Z438: 0 | AA438: 651 | AB438: 536 | AC438: 121.45522388059702 | AD438: 20
A439: BRIGHTON | C439: MANN 3 | F439: DOWDING 2 | J439: NEGRO | M439: EDMONDS | P439: DALL
A440: ESSENDON ASSOC. | C440: CLARKE 4 | F440: LINAY 3 | I440: CHAPMAN | W440: PORT MELBOURNE | X440: 5 | Y440: 5 | Z440: 0 | AA440: 586 | AB440: 574 | AC440: 102.09059233449477 | AD440: 20
W441: BRIGHTON | X441: 5 | Y441: 5 | Z441: 0 | AA441: 529 | AB441: 600 | AC441: 88.166666666666671 | AD441: 20
A442: BRUNSWICK | C442: 2 | D442: 5 | E442: =C442*6+D442 -> 17 | G442: 5 | H442: 8 | I442: =G442*6+H442 -> 38 | K442: 6 | L442: 10 | M442: =K442*6+L442 -> 46 | O442: 14 | P442: 14 | Q442: =O442*6+P442 -> 98 | S442: BRUNSWICK | W442: NORTHCOTE | X442: 4 | Y442: 6 | Z442: 0 | AA442: 535 | AB442: 664 | AC442: 80.57228915662651 | AD442: 16
A443: NORTHCOTE | C443: 1 | D443: 6 | E443: =C443*6+D443 -> 12 | G443: 2 | H443: 8 | I443: =G443*6+H443 -> 20 | K443: 6 | L443: 13 | M443: =K443*6+L443 -> 49 | O443: 7 | P443: 16 | Q443: =O443*6+P443 -> 58 | S443: HURLEY | W443: WILLIAMSTOWN | X443: 3 | Y443: 7 | Z443: 0 | AA443: 465 | AB443: 599 | AC443: 77.629382303839733 | AD443: 12
A444: BEST PLAYERS | W444: PRAHRAN | X444: 2 | Y444: 8 | Z444: 0 | AA444: 544 | AB444: 666 | AC444: 81.68 | AD444: 8
A445: BRUNSWICK | C445: McKENZIE | F445: GILLESPIE | I445: ROSS | L445: CARRIE | O445: MILLS | R445: PRICE | W445: MELBOURNE CITY | X445: 0 | Y445: 10 | Z445: 0 | AA445: 376 | AB445: 910 | AC445: 41.318681318681321 | AD445: 0
A446: NORTHCOTE | C446: BILLETT | F446: BECK | I446: SWIFT | L446: COLE | O446: O'CONNOR | R446: NORMAN
A447: GOALKICKERS
A448: BRUNSWICK | C448: McKENZIE 3 | G448: PITCHER 3 | J448: CARRIE 2 | M448: PRICE 2 | P448: STANCLIFFE 2 | T448: McLEAN | W448: CHANDLER
A449: NORTHCOTE | C449: BILLETT 3 | G449: RYAN 2 | J449: SWIFT | M449: DAWSON
A451: WILLIAMSTOWN | C451: 0 | D451: 6 | E451: =C451*6+D451 -> 6 | G451: 3 | H451: 8 | I451: =G451*6+H451 -> 26 | K451: 6 | L451: 9 | M451: =K451*6+L451 -> 45 | O451: 7 | P451: 9 | Q451: =O451*6+P451 -> 51 | S451: PORT MELB
A452: PORT MELBOURNE | C452: 1 | D452: 3 | E452: =C452*6+D452 -> 9 | G452: 3 | H452: 4 | I452: =G452*6+H452 -> 22 | K452: 5 | L452: 6 | M452: =K452*6+L452 -> 36 | O452: 6 | P452: 12 | Q452: =O452*6+P452 -> 48 | S452: KENDALL
A453: BEST PLAYERS
A454: WILLIAMSTOWN | C454: HARDEN | F454: AMY | I454: ANGUS | L454: PRIMROSE | O454: REITMAN | R454: ALLEY
A455: PORT MELBOURNE | C455: ANDERSON | F455: MULROSS | I455: FRANKLIN | L455: JINKS | O455: HUTCHINSON | R455: MERRICK
A456: GOALKICKERS
A457: WILLIAMSTOWN | C457: AMY 3 | F457: LITCHFIELD | J457: ALLEY | M457: ROSE | P457: HARDEN
A458: PORT MELBOURNE | C458: JINKS 3 | F458: HUTCHINSON 2 | K458: MERRICK
A460: NORTH MELBOURNE | C460: 0 | D460: 1 | E460: =C460*6+D460 -> 1 | G460: 5 | H460: 3 | I460: =G460*6+H460 -> 33 | K460: 6 | L460: 5 | M460: =K460*6+L460 -> 41 | O460: 11 | P460: 6 | Q460: =O460*6+P460 -> 72 | S460: NORTH MELB
A461: PRAHRAN | C461: 3 | D461: 1 | E461: =C461*6+D461 -> 19 | G461: 3 | H461: 4 | I461: =G461*6+H461 -> 22 | K461: 4 | L461: 7 | M461: =K461*6+L461 -> 31 | O461: 6 | P461: 9 | Q461: =O461*6+P461 -> 45 | S461: WREGG
A462: BEST PLAYERS
A463: NORTH MELBOURNE | C463: S BARKER | F463: HOPKINS | I463: HARDY | L463: JOHNSON | O463: RAWLE | R463: TRELOAR
A464: PRAHRAN | C464: DOWSING | F464: McKENZIE | I464: WEIDNER | L464: RYAN | O464: ELLIN | R464: HANNAFORD
A465: GOALKICKERS
A466: NORTH MELBOURNE | C466: G BARKER 4 | F466: ELLIOTT 2 | I466: HARDY 2 | L466: TRELOAR | O466: WILLIAMSON | R466: S BARKER
A467: PRAHRAN | C467: SYKES 2 | F467: DOWSING | I467: WEIDNER | L467: FARMER | O467: MARONEY
A469: FOOTSCRAY | C469: 5 | D469: 4 | E469: =C469*6+D469 -> 34 | G469: 9 | H469: 8 | I469: =G469*6+H469 -> 62 | K469: 16 | L469: 15 | M469: =K469*6+L469 -> 111 | O469: 22 | P469: 17 | Q469: =O469*6+P469 -> 149 | S469: EAST MELB
A470: MELBOURNE CITY | C470: 4 | D470: 3 | E470: =C470*6+D470 -> 27 | G470: 6 | H470: 6 | I470: =G470*6+H470 -> 42 | K470: 6 | L470: 7 | M470: =K470*6+L470 -> 43 | O470: 7 | P470: 8 | Q470: =O470*6+P470 -> 50 | S470: HUME
A471: BEST PLAYERS
A472: FOOTSCRAY | C472: COTTON | F472: CLARK | I472: KNIGHT | L472: W KUSCHERT | P472: CRADDOCK | S472: McCLUSKY
A473: MELBOURNE CITY | C473: KIKER | F473: C GREGORY | I473: O'CONNOR | L473: PHILLIPS | P473: DANIELS
A474: GOALKICKERS
A475: FOOTSCRAY | C475: COTTON 6 | F475: KNIGHT 5 | I475: CLARK 4 | L475: BRIESE 3 | O475: BANBURY 2 | R475: BAXTER | U475: NASH
A476: MELBOURNE CITY | C476: C GREGORY 5 | H476: KIKER 2
A478: ROUND 11 | E478: 29TH JUNE | K478: WEATHER | O478: FINE | S478: PLAYED AT | X478: LADDER | AB478: ROUND | AD478: 11
D479: 1ST QTR | H479: 2ND QTR | L479: 3RD QTR | P479: FINAL | S479: FOOTSCRAY
A480: FOOTSCRAY | C480: 3 | D480: 3 | E480: =C480*6+D480 -> 21 | G480: 9 | H480: 10 | I480: =G480*6+H480 -> 64 | K480: 12 | L480: 10 | M480: =K480*6+L480 -> 82 | O480: 17 | P480: 13 | Q480: =O480*6+P480 -> 115 | S480: UMPIRE | W480: TEAM | X480: W | Y480: L | Z480: D | AA480: FOR | AB480: AGST | AC480: % | AD480: PTS
A481: NORTH MELBOURNE | C481: 1 | D481: 3 | E481: =C481*6+D481 -> 9 | G481: 1 | H481: 5 | I481: =G481*6+H481 -> 11 | K481: 4 | L481: 7 | M481: =K481*6+L481 -> 31 | O481: 4 | P481: 8 | Q481: =O481*6+P481 -> 32 | S481: HURLEY
A482: BEST PLAYERS | W482: NORTH MELBOURNE | X482: 10 | Y482: 1 | Z482: 0 | AA482: 822 | AB482: 594 | AC482: 138.38 | AD482: 40
A483: FOOTSCRAY | C483: CRADDOCK | F483: COTTON | I483: JOHNSON | L483: McCLUSKY | P483: CLARK | S483: HARRIS | W483: FOOTSCRAY | X483: 9 | Y483: 2 | Z483: 0 | AA483: 1026 | AB483: 517 | AC483: 198.45261121856868 | AD483: 36
A484: NORTH MELBOURNE | C484: J JOHNSON | F484: NELSON | I484: HERON | L484: HOPKINS | P484: RAWLE | S484: HARDY | W484: BRUNSWICK | X484: 8 | Y484: 3 | Z484: 0 | AA484: 694 | AB484: 573 | AC484: 121.11692844677138 | AD484: 32
A485: GOALKICKERS | W485: ESSENDON ASSOC. | X485: 6 | Y485: 5 | Z485: 0 | AA485: 741 | AB485: 581 | AC485: 127.53872633390705 | AD485: 24
A486: FOOTSCRAY | C486: JOHNSTON 5 | F486: BANBURY 3 | I486: KNIGHT 3 | K486: COTTON 2 | N486: BAXTER | P486: SAMSON | R486: GREGORY | U486: CROUCH
A487: NORTH MELBOURNE | C487: McKAY 2 | G487: WILLIAMSON | K487: RAWLE | W487: BRIGHTON | X487: 6 | Y487: 5 | Z487: 0 | AA487: 593 | AB487: 653 | AC487: 90.811638591117912 | AD487: 24
W488: PORT MELBOURNE | X488: 5 | Y488: 6 | Z488: 0 | AA488: 631 | AB488: 664 | AC488: 95.03012048192771 | AD488: 20
A489: ESSENDON ASSOC. | C489: 1 | D489: 2 | E489: =C489*6+D489 -> 8 | G489: 8 | H489: 6 | I489: =G489*6+H489 -> 54 | K489: 9 | L489: 9 | M489: =K489*6+L489 -> 63 | O489: 13 | P489: 12 | Q489: =O489*6+P489 -> 90 | S489: ESSENDON | W489: WILLIAMSTOWN | X489: 4 | Y489: 7 | Z489: 0 | AA489: 606 | AB489: 613 | AC489: 98.858075040783035 | AD489: 16
A490: PORT MELBOURNE | C490: 2 | D490: 5 | E490: =C490*6+D490 -> 17 | G490: 2 | H490: 9 | I490: =G490*6+H490 -> 21 | K490: 3 | L490: 12 | M490: =K490*6+L490 -> 30 | O490: 5 | P490: 15 | Q490: =O490*6+P490 -> 45 | S490: ALLEN | W490: NORTHCOTE | X490: 4 | Y490: 7 | Z490: 0 | AA490: 588 | AB490: 728 | AC490: 80.769230769230774 | AD490: 16
A491: BEST PLAYERS | W491: PRAHRAN | X491: 3 | Y491: 8 | Z491: 0 | AA491: 609 | AB491: 726 | AC491: 83.88 | AD491: 12
A492: ESSENDON ASSOC. | C492: CHAPMAN | F492: SEVIOR | I492: J MADDEN | L492: CLARKE | P492: HOARE | R492: MAINE | W492: MELBOURNE CITY | X492: 0 | Y492: 11 | Z492: 0 | AA492: 390 | AB492: 1051 | AC492: 37.107516650808755 | AD492: 0
A493: PORT MELBOURNE | C493: ANDERSON | F493: TREGLOWN | I493: HAYES | L493: SCHRAPPE | P493: MERRICK | R493: STEELE
A494: GOALKICKERS
A495: ESSENDON ASSOC. | C495: HOARE 3 | F495: McNAMARA 3 | I495: CHAPMAN 2) | L495: CLARKE 2 | O495: WALL | Q495: LINAY | S495: LEWIS
A496: PORT MELBOURNE | C496: STEELE | F496: MERRICK | I496: ROBERTS | L496: ANDERSON | O496: HUTCHINSON
A498: BRIGHTON | C498: 4 | D498: 3 | E498: =C498*6+D498 -> 27 | G498: 6 | H498: 8 | I498: =G498*6+H498 -> 44 | K498: 8 | L498: 10 | M498: =K498*6+L498 -> 58 | O498: 9 | P498: 10 | Q498: =O498*6+P498 -> 64 | S498: CROXTON PK
A499: NORTHCOTE | C499: 0 | D499: 3 | E499: =C499*6+D499 -> 3 | G499: 2 | H499: 8 | I499: =G499*6+H499 -> 20 | K499: 3 | L499: 14 | M499: =K499*6+L499 -> 32 | O499: 6 | P499: 17 | Q499: =O499*6+P499 -> 53 | S499: WREGG
A500: BEST PLAYERS
A501: BRIGHTON | C501: B BAILES | F501: A LAXTON | I501: NEGRO | L501: HAZEL | O501: BRIDGFORD | R501: BUTLER
A502: NORTHCOTE | C502: THOMAS | F502: SMITH | I502: DUNCAN | L502: GLUYAS | O502: RYAN | R502: MOORE
A503: GOALKICKERS
A504: BRIGHTON | C504: NEGRO 3 | F504: DOWDING 2 | J504: HAZEL 2 | M504: GRAHAM | P504: BELLER
A505: NORTHCOTE | C505: RYAN 4 | F505: MOORE | I505: HUNT
A507: WILLIAMSTOWN | C507: 4 | D507: 3 | E507: =C507*6+D507 -> 27 | G507: 10 | H507: 9 | I507: =G507*6+H507 -> 69 | K507: 14 | L507: 11 | M507: =K507*6+L507 -> 95 | O507: 21 | P507: 15 | Q507: =O507*6+P507 -> 141 | S507: WILLIAMSTOWN
A508: MELBOURNE CITY | C508: 0 | D508: 4 | E508: =C508*6+D508 -> 4 | G508: 0 | H508: 5 | I508: =G508*6+H508 -> 5 | K508: 1 | L508: 6 | M508: =K508*6+L508 -> 12 | O508: 1 | P508: 8 | Q508: =O508*6+P508 -> 14 | S508: KENDALL
A509: BEST PLAYERS
A510: WILLIAMSTOWN | C510: E BUSBRIDGE | F510: ALLEY | I510: MAY | L510: ANGUS | O510: REITMAN | R510: FERGUSON
A511: MELBOURNE CITY
A512: GOALKICKERS
A513: WILLIAMSTOWN | C513: E BUSBRIDGE 6 | G513: ANGUS 5 | J513: HOWARTH 3 | M513: LITCHFIELD 2 | P513: ALLEY 2 | R513: HOLMES 2 | V513: MAY
A514: MELBOURNE CITY | C514: DANIELS
A516: PRAHRAN | C516: 1 | D516: 6 | E516: =C516*6+D516 -> 12 | G516: 5 | H516: 7 | I516: =G516*6+H516 -> 37 | K516: 7 | L516: 8 | M516: =K516*6+L516 -> 50 | O516: 9 | P516: 11 | Q516: =O516*6+P516 -> 65 | S516: TOORAK PARK
A517: BRUNSWICK | C517: 1 | D517: 1 | E517: =C517*6+D517 -> 7 | G517: 3 | H517: 7 | I517: =G517*6+H517 -> 25 | K517: 3 | L517: 13 | M517: =K517*6+L517 -> 31 | O517: 7 | P517: 18 | Q517: =O517*6+P517 -> 60 | S517: HERBERT
A518: BEST PLAYERS
A519: PRAHRAN | C519: FARMER | F519: WILSON | I519: WEIDNER | M519: McKENZIE | P519: PUNCH | R519: CARLSON
A520: BRUNSWICK | C520: PRICE | F520: CHANDLER | I520: STANCLIFFE | M520: CARRIE | P520: MILLS | R520: L BRAID
A521: GOALKICKERS
A522: PRAHRAN | C522: FARMER 4 | F522: RYAN 2 | I522: KELLY 2 | L522: McKENZIE
A523: BRUNSWICK | C523: McLEAN 3 | F523: PRICE 2 | I523: L BRAID | L523: GILLESPIE
A525: ROUND 12 | E525: 6TH JULY | H525: WEATHER | K525: DULL COL CLOUDY STRONG NORTH WIND | S525: PLAYED AT | X525: LADDER | AB525: ROUND | AD525: 12
D526: 1ST QTR | H526: 2ND QTR | L526: 3RD QTR | P526: FINAL | S526: NORTH MELB
A527: NORTH MELBOURNE | C527: 1 | D527: 0 | E527: =C527*6+D527 -> 6 | G527: 6 | H527: 1 | I527: =G527*6+H527 -> 37 | K527: 6 | L527: 1 | M527: =K527*6+L527 -> 37 | O527: 9 | P527: 7 | Q527: =O527*6+P527 -> 61 | S527: UMPIRE | W527: TEAM | X527: W | Y527: L | Z527: D | AA527: FOR | AB527: AGST | AC527: % | AD527: PTS
A528: BRUNSWICK | C528: 1 | D528: 4 | E528: =C528*6+D528 -> 10 | G528: 1 | H528: 5 | I528: =G528*6+H528 -> 11 | K528: 4 | L528: 12 | M528: =K528*6+L528 -> 36 | O528: 5 | P528: 13 | Q528: =O528*6+P528 -> 43 | S528: KENDALL
A529: BEST PLAYERS | W529: NORTH MELBOURNE | X529: 11 | Y529: 1 | Z529: 0 | AA529: 883 | AB529: 637 | AC529: 138.62 | AD529: 44
A530: NORTH MELBOURNE | C530: HOPKINS | F530: TRELOAR | I530: HERON | L530: S BARKER | O530: TEAGUE | R530: HARDY | W530: FOOTSCRAY | X530: 10 | Y530: 2 | Z530: 0 | AA530: 1110 | AB530: 589 | AC530: 188.45500848896435 | AD530: 40
A531: BRUNSWICK | C531: L BRAID | F531: McKENZIE | I531: ROSS | L531: CHANDLER | O531: O'COONOR | R531: MILLS | W531: BRUNSWICK | X531: 8 | Y531: 4 | Z531: 0 | AA531: 737 | AB531: 634 | AC531: 116.24605678233438 | AD531: 32
A532: GOALKICKERS | W532: ESSENDON ASSOC. | X532: 7 | Y532: 5 | Z532: 0 | AA532: 802 | AB532: 628 | AC532: 127.70700636942675 | AD532: 28
A533: NORTH MELBOURNE | C533: HARDY 3 | F533: ELLIOTT 3 | J533: TRELOAR | M533: ROACH | P533: HOPKINS
A534: BRUNSWICK | C534: CHANDLER 4 | G534: STANCLIFFE | W534: PORT MELBOURNE | X534: 6 | Y534: 6 | Z534: 0 | AA534: 745 | AB534: 723 | AC534: 103.04287690179807 | AD534: 24
W535: BRIGHTON | X535: 6 | Y535: 6 | Z535: 0 | AA535: 665 | AB535: 737 | AC535: 90.230664857530527 | AD535: 24
A536: FOOTSCRAY | C536: 5 | D536: 2 | E536: =C536*6+D536 -> 32 | G536: 8 | H536: 3 | I536: =G536*6+H536 -> 51 | K536: 10 | L536: 11 | M536: =K536*6+L536 -> 71 | O536: 12 | P536: 12 | Q536: =O536*6+P536 -> 84 | S536: BRIGHTON BEACH | W536: WILLIAMSTOWN | X536: 4 | Y536: 8 | Z536: 0 | AA536: 653 | AB536: 674 | AC536: 96.884272997032639 | AD536: 16
A537: BRIGHTON | C537: 1 | D537: 5 | E537: =C537*6+D537 -> 11 | G537: 4 | H537: 7 | I537: =G537*6+H537 -> 31 | K537: 9 | L537: 8 | M537: =K537*6+L537 -> 62 | O537: 10 | P537: 12 | Q537: =O537*6+P537 -> 72 | S537: ALLEN | W537: PRAHRAN | X537: 4 | Y537: 8 | Z537: 0 | AA537: 704 | AB537: 790 | AC537: 89.11 | AD537: 16
A538: BEST PLAYERS | W538: NORTHCOTE | X538: 4 | Y538: 8 | Z538: 0 | AA538: 652 | AB538: 823 | AC538: 79.222357229647628 | AD538: 16
A539: FOOTSCRAY | C539: A GREGORY | F539: COTTON | I539: OGILVIE | L539: SAMSON | O539: BRIESE | R539: KNIGHT | W539: MELBOURNE CITY | X539: 0 | Y539: 12 | Z539: 0 | AA539: 449 | AB539: 1165 | AC539: 38.540772532188839 | AD539: 0
A540: BRIGHTON | C540: DALL | F540: DOWDING | I540: TURNBULL | L540: MONTEITH | O540: B BAILES | R540: GRAHAM
A541: GOALKICKERS
A542: FOOTSCRAY | C542: KNIGHT 5 | F542: CROUCH 2 | I542: COTTON 2 | L542: GREGORY | O542: BANBURY | R542: JOHNSON
A543: BRIGHTON | C543: DALL 4 | F543: DOWDING 2 | J543: TURNBULL | M543: GRAHAM | P543: J SMITH | R543: BELLER
A545: ESSENDON ASSOC. | C545: 2 | D545: 1 | E545: =C545*6+D545 -> 13 | G545: 4 | H545: 5 | I545: =G545*6+H545 -> 29 | K545: 5 | L545: 5 | M545: =K545*6+L545 -> 35 | O545: 9 | P545: 7 | Q545: =O545*6+P545 -> 61 | S545: WILLIAMSTOWN
A546: WILLIAMSTOWN | C546: 3 | D546: 3 | E546: =C546*6+D546 -> 21 | G546: 3 | H546: 5 | I546: =G546*6+H546 -> 23 | K546: 5 | L546: 9 | M546: =K546*6+L546 -> 39 | O546: 6 | P546: 11 | Q546: =O546*6+P546 -> 47 | S546: HURLEY
A547: BEST PLAYERS
A548: ESSENDON ASSOC. | C548: SEVIOR | F548: HOARE | I548: J MADDEN | L548: M MADDEN | O548: ATKINS | R548: LEWIS
A549: WILLIAMSTOWN | C549: AMY | F549: ALLEY | I549: REITMAN | L549: GIBBS | O549: McDONALD | R549: ANDERSON
A550: GOALKICKERS
A551: ESSENDON ASSOC. | C551: McNAMARA 3 | G551: CLARKE 2 | J551: SEVIOR | M551: CHAPMAN | P551: WALL | R551: DIGGLE
A552: WILLIAMSTOWN | C552: ANDERSON 2 | G552: AMY | J552: LITCHFIELD | M552: E BUSBRIDGE | Q552: REITMAN
A554: PRAHRAN | C554: 2 | D554: 2 | E554: =C554*6+D554 -> 14 | G554: 9 | H554: 6 | I554: =G554*6+H554 -> 60 | K554: 11 | L554: 6 | M554: =K554*6+L554 -> 72 | O554: 14 | P554: 11 | Q554: =O554*6+P554 -> 95 | S554: TOORAK PARK
A555: NORTHCOTE | C555: 2 | D555: 2 | E555: =C555*6+D555 -> 14 | G555: 2 | H555: 3 | I555: =G555*6+H555 -> 15 | K555: 8 | L555: 8 | M555: =K555*6+L555 -> 56 | O555: 9 | P555: 10 | Q555: =O555*6+P555 -> 64 | S555: HUME
A556: BEST PLAYERS
A557: PRAHRAN | C557: WEIDNER | F557: CARLSON | I557: McKENZIE | L557: FARMER | O557: DOWSING | R557: PUNCH
A558: NORTHCOTE | C558: SWIFT | F558: COLE | I558: JOHNSON | L558: HAMMOND | O558: DUNCAN | R558: HALL
A559: GOALKICKERS
A560: PRAHRAN | C560: McKENZIE 3 | F560: FARMER 2 | I560: DOWSING 2 | L560: PUNCH 2 | N560: COMER 2 | P560: WEIDNER | R560: WILSON | T560: SYKES
A561: NORTHCOTE | C561: HUNT 2 | F561: RYAN | H561: HAMMOND | K561: NORMAN | N561: JOHNSON | Q561: MOORE
A563: PORT MELBOURNE | C563: 6 | D563: 4 | E563: =C563*6+D563 -> 40 | G563: 8 | H563: 7 | I563: =G563*6+H563 -> 55 | K563: 12 | L563: 10 | M563: =K563*6+L563 -> 82 | O563: 17 | P563: 12 | Q563: =O563*6+P563 -> 114 | S563: EAST MELB
A564: MELBOURNE CITY | C564: 0 | D564: 1 | E564: =C564*6+D564 -> 1 | G564: 4 | H564: 6 | I564: =G564*6+H564 -> 30 | K564: 4 | L564: 8 | M564: =K564*6+L564 -> 32 | O564: 8 | P564: 11 | Q564: =O564*6+P564 -> 59 | S564: WREGG
A565: BEST PLAYERS
A566: PORT MELBOURNE | C566: MERRICK | F566: STEELE | I566: ANDERSON | L566: CLELAND | O566: TREGLOWN | R566: GOTZ
A567: MELBOURNE CITY | C567: KIKER | F567: C GREGORY | I567: MONOGHAN | L567: PULLEN | O567: PHILLIPS | R567: DANIELS
A568: GOALKICKERS
A569: PORT MELBOURNE | C569: MERRICK 6 | F569: STEELE 3 | H569: BROWN 2 | J569: CLELAND 2 | M569: GOTZ | N569: AL McDONALD | R569: ANDERSON | U569: TREGLOWN
A570: MELBOURNE CITY | C570: C GREGORY 4 | H570: KIKER 2 | K570: PULLEN 2
A572: ROUND 13 | E572: 13TH JULY | H572: WEATHER | K572: CLOUDY COLD WEST WIND RAIN A.M. | S572: PLAYED AT | X572: LADDER | AB572: ROUND | AD572: 13
D573: 1ST QTR | H573: 2ND QTR | L573: 3RD QTR | P573: FINAL | S573: ESSENDON
A574: ESSENDON ASSOC. | C574: 2 | D574: 5 | E574: =C574*6+D574 -> 17 | G574: 7 | H574: 9 | I574: =G574*6+H574 -> 51 | K574: 11 | L574: 15 | M574: =K574*6+L574 -> 81 | O574: 13 | P574: 21 | Q574: =O574*6+P574 -> 99 | S574: UMPIRE | W574: TEAM | X574: W | Y574: L | Z574: D | AA574: FOR | AB574: AGST | AC574: % | AD574: PTS
A575: FOOTSCRAY | C575: 0 | D575: 5 | E575: =C575*6+D575 -> 5 | G575: 1 | H575: 10 | I575: =G575*6+H575 -> 16 | K575: 1 | L575: 13 | M575: =K575*6+L575 -> 19 | O575: 5 | P575: 17 | Q575: =O575*6+P575 -> 47 | S575: ALLEN
A576: BEST PLAYERS | W576: NORTH MELBOURNE | X576: 12 | Y576: 1 | Z576: 0 | AA576: 949 | AB576: 690 | AC576: 137.54 | AD576: 48
A577: ESSENDON ASSOC. | C577: SEVIOR | F577: McNAMARA | I577: CHAPMAN | L577: WALKER | N577: ATKINS | Q577: HUNTINGTON | W577: FOOTSCRAY | X577: 10 | Y577: 3 | Z577: 0 | AA577: 1157 | AB577: 688 | AC577: 168.16860465116278 | AD577: 40
A578: FOOTSCRAY | C578: McCLUSKY | F578: BORTHWICK | I578: HARRIS | L578: OGILVIE | N578: COTTON | Q578: CROUCH | W578: BRUNSWICK | X578: 9 | Y578: 4 | Z578: 0 | AA578: 821 | AB578: 698 | AC578: 117.621776504298 | AD578: 36
A579: GOALKICKERS | W579: ESSENDON ASSOC. | X579: 8 | Y579: 5 | Z579: 0 | AA579: 901 | AB579: 675 | AC579: 133.4814814814815 | AD579: 32
A580: ESSENDON ASSOC. | C580: McNAMARA 6 | G580: CHAPMAN 3 | K580: CLARKE 3 | O580: SEVIOR
A581: FOOTSCRAY | C581: JOHNSON 2 | G581: BRIESE | J581: BAXTER | M581: COTTON | W581: PORT MELBOURNE | X581: 7 | Y581: 6 | Z581: 0 | AA581: 823 | AB581: 792 | AC581: 103.91414141414141 | AD581: 28
W582: BRIGHTON | X582: 7 | Y582: 6 | Z582: 0 | AA582: 747 | AB582: 790 | AC582: 94.556962025316452 | AD582: 28
A583: BRUNSWICK | C583: 4 | D583: 2 | E583: =C583*6+D583 -> 26 | G583: 7 | H583: 4 | I583: =G583*6+H583 -> 46 | K583: 8 | L583: 9 | M583: =K583*6+L583 -> 57 | O583: 12 | P583: 12 | Q583: =O583*6+P583 -> 84 | S583: BRUNSWICK | W583: WILLIAMSTOWN | X583: 4 | Y583: 9 | Z583: 0 | AA583: 717 | AB583: 758 | AC583: 94.5910290237467 | AD583: 16
A584: WILLIAMSTOWN | C584: 1 | D584: 7 | E584: =C584*6+D584 -> 13 | G584: 4 | H584: 11 | I584: =G584*6+H584 -> 35 | K584: 5 | L584: 11 | M584: =K584*6+L584 -> 41 | O584: 8 | P584: 16 | Q584: =O584*6+P584 -> 64 | S584: HURLEY | W584: PRAHRAN | X584: 4 | Y584: 9 | Z584: 0 | AA584: 773 | AB584: 868 | AC584: 89.06 | AD584: 16
A585: BEST PLAYERS | W585: NORTHCOTE | X585: 4 | Y585: 9 | Z585: 0 | AA585: 705 | AB585: 889 | AC585: 79.302587176602927 | AD585: 16
A586: BRUNSWICK | C586: ROSS | F586: O'CONNOR | I586: McKENZIE | L586: L BRAID | N586: PITCHER | Q586: CHANDLER | W586: MELBOURNE CITY | X586: 0 | Y586: 13 | Z586: 0 | AA586: 502 | AB586: 1247 | AC586: 40.256615878107461 | AD586: 0
A587: WILLIAMSTOWN | C587: REITMAN | F587: HOLMES | I587: GIBBS | L587: AMY | N587: BUSBRIDGE | Q587: LITCHFIELD
A588: GOALKICKERS
A589: BRUNSWICK | C589: McKENZIE 3 | G589: MARSH 3 | J589: PITCHER 3 | M589: PRICE 2 | O589: STANCLIFFE
A590: WILLIAMSTOWN | C590: LITCHFIELD 2 | G590: PRIMROSE 2 | K590: ALLEY | M590: AMY | O590: BUSBRIDGE | R590: ANGUS
A592: PORT MELBOURNE | C592: 2 | D592: 4 | E592: =C592*6+D592 -> 16 | G592: 4 | H592: 6 | I592: =G592*6+H592 -> 30 | K592: 8 | L592: 8 | M592: =K592*6+L592 -> 56 | O592: 11 | P592: 12 | Q592: =O592*6+P592 -> 78 | S592: PORT MELB
A593: PRAHRAN | C593: 3 | D593: 2 | E593: =C593*6+D593 -> 20 | G593: 5 | H593: 5 | I593: =G593*6+H593 -> 35 | K593: 6 | L593: 11 | M593: =K593*6+L593 -> 47 | O593: 9 | P593: 15 | Q593: =O593*6+P593 -> 69 | S593: CARTER
A594: BEST PLAYERS
A595: PORT MELBOURNE | C595: FRANKLIN | F595: ANDERSON | I595: HENDRIE | L595: TREGLOWN | O595: BROWN | R595: CARDEN
A596: PRAHRAN | C596: WILSON | F596: RYAN | I596: SYKES | L596: CARLSON | O596: WEIDNER | R596: ELLIN
A597: GOALKICKERS
A598: PORT MELBOURNE | C598: MERRICK 4 | G598: ANG McDONALD 3 | L598: JINKS 2 | O598: MULROSS | R598: ANDERSON
A599: PRAHRAN | C599: SYKES 4 | G599: COMER 3 | K599: PUNCH 2 | O599: CARLSON
A601: BRIGHTON | C601: 2 | D601: 3 | E601: =C601*6+D601 -> 15 | G601: 5 | H601: 7 | I601: =G601*6+H601 -> 37 | K601: 10 | L601: 13 | M601: =K601*6+L601 -> 73 | O601: 11 | P601: 16 | Q601: =O601*6+P601 -> 82 | S601: BRIGHTON BEACH
A602: MELBOURNE CITY | C602: 1 | D602: 1 | E602: =C602*6+D602 -> 7 | G602: 2 | H602: 2 | I602: =G602*6+H602 -> 14 | K602: 4 | L602: 4 | M602: =K602*6+L602 -> 28 | O602: 8 | P602: 5 | Q602: =O602*6+P602 -> 53 | S602: HUME
A603: BEST PLAYERS
A604: BRIGHTON | C604: DOWDING | F604: DALL | I604: BELLER | L604: GRAHAM | O604: BRIDGFORD | R604: J SMITH
A605: MELBOURNE CITY | C605: PRATT | F605: SMITH | I605: SAMUELS | L605: C GREGORY | O605: PHILLIPS | R605: COUCHIN
A606: GOALKICKERS
A607: BRIGHTON | C607: DOWDING 4 | G607: DALL 3 | I607: SNOOK | K607: NEGRO | M607: BELLER | O607: TURNBULL
A608: MELBOURNE CITY | C608: KIKER 3 | G608: C GREGORY 3
A610: NORTH MELBOURNE | C610: 2 | D610: 3 | E610: =C610*6+D610 -> 15 | G610: 2 | H610: 9 | I610: =G610*6+H610 -> 21 | K610: 5 | L610: 11 | M610: =K610*6+L610 -> 41 | O610: 8 | P610: 18 | Q610: =O610*6+P610 -> 66 | S610: CROXTON PK
A611: NORTHCOTE | C611: 1 | D611: 2 | E611: =C611*6+D611 -> 8 | G611: 5 | H611: 6 | I611: =G611*6+H611 -> 36 | K611: 6 | L611: 10 | M611: =K611*6+L611 -> 46 | O611: 7 | P611: 11 | Q611: =O611*6+P611 -> 53 | S611: KENDALL
A612: BEST PLAYERS
A613: NORTH MELBOURNE | C613: TRELOAR | F613: J JOHNSON | I613: S BARKER | L613: HAWKINS | O613: ELLIOTT | R613: HOPKINS
A614: NORTHCOTE | C614: J JOHNSON | F614: HAMMOND | I614: MOORE | L614: COLE | O614: HALL | R614: RYAN
A615: GOALKICKERS
A616: NORTH MELBOURNE | C616: HARDY 2 | F616: ELLIOTT 2 | J616: HOPKINS 2 | N616: HAWKINS | Q616: HANNA
A617: NORTHCOTE | C617: RYAN 5 | F617: SWIFT | I617: BECK
A619: ROUND 14 | E619: 20TH JULY | J619: WEATHER | M619: SOUTH WIND RAIN | S619: PLAYED AT | X619: LADDER | AB619: ROUND | AD619: 14
D620: 1ST QTR | H620: 2ND QTR | L620: 3RD QTR | P620: FINAL | S620: FOOTSCRAY
A621: FOOTSCRAY | C621: 6 | D621: 1 | E621: =C621*6+D621 -> 37 | G621: 7 | H621: 1 | I621: =G621*6+H621 -> 43 | K621: 13 | L621: 3 | M621: =K621*6+L621 -> 81 | O621: 14 | P621: 3 | Q621: =O621*6+P621 -> 87 | S621: UMPIRE | W621: TEAM | X621: W | Y621: L | Z621: D | AA621: FOR | AB621: AGST | AC621: % | AD621: PTS
A622: BRUNSWICK | C622: 1 | D622: 7 | E622: =C622*6+D622 -> 13 | G622: 1 | H622: 7 | I622: =G622*6+H622 -> 13 | K622: 2 | L622: 7 | M622: =K622*6+L622 -> 19 | O622: 3 | P622: 8 | Q622: =O622*6+P622 -> 26 | S622: WREGG
A623: BEST PLAYERS | W623: NORTH MELBOURNE | X623: 13 | Y623: 1 | Z623: 0 | AA623: 1002 | AB623: 737 | AC623: 135.96 | AD623: 52
A624: FOOTSCRAY | C624: McCLUSKY | F624: BANBURY | I624: CRADDOCK | L624: COTTON | O624: GREGORY | R624: W KUSCHERT | W624: FOOTSCRAY | X624: 11 | Y624: 3 | Z624: 0 | AA624: 1244 | AB624: 714 | AC624: 174.22969187675071 | AD624: 44
A625: BRUNSWICK | C625: ROSS | F625: McLEAN | I625: PITCHER | L625: PRINCE | O625: MILLS | R625: O'CONNOR | W625: ESSENDON ASSOC. | X625: 9 | Y625: 5 | Z625: 0 | AA625: 1073 | AB625: 706 | AC625: 151.98300283286119 | AD625: 36
A626: GOALKICKERS | W626: BRUNSWICK | X626: 9 | Y626: 5 | Z626: 0 | AA626: 847 | AB626: 785 | AC626: 107.89808917197452 | AD626: 36
A627: FOOTSCRAY | C627: BANBURY 4 | G627: KNIGHT 4 | J627: JOHNSON 3 | M627: BORTHWICK | P627: CROUCH
A628: BRUNSWICK | C628: PRICE 2 | G628: McKENZIE | W628: PORT MELBOURNE | X628: 7 | Y628: 7 | Z628: 0 | AA628: 850 | AB628: 841 | AC628: 101.07015457788347 | AD628: 28
W629: BRIGHTON | X629: 7 | Y629: 7 | Z629: 0 | AA629: 794 | AB629: 843 | AC629: 94.187425860023723 | AD629: 28
A630: NORTH MELBOURNE | C630: 2 | D630: 2 | E630: =C630*6+D630 -> 14 | G630: 3 | H630: 2 | I630: =G630*6+H630 -> 20 | K630: 6 | L630: 5 | M630: =K630*6+L630 -> 41 | O630: 8 | P630: 5 | Q630: =O630*6+P630 -> 53 | S630: NORTH MELB | W630: WILLIAMSTOWN | X630: 5 | Y630: 9 | Z630: 0 | AA630: 795 | AB630: 820 | AC630: 96.951219512195124 | AD630: 20
A631: BRIGHTON | C631: 3 | D631: 3 | E631: =C631*6+D631 -> 21 | G631: 4 | H631: 6 | I631: =G631*6+H631 -> 30 | K631: 4 | L631: 9 | M631: =K631*6+L631 -> 33 | O631: 6 | P631: 11 | Q631: =O631*6+P631 -> 47 | S631: HUME | W631: NORTHCOTE | X631: 5 | Y631: 9 | Z631: 0 | AA631: 754 | AB631: 916 | AC631: 82.314410480349352 | AD631: 20
A632: BEST PLAYERS | W632: PRAHRAN | X632: 4 | Y632: 10 | Z632: 0 | AA632: 835 | AB632: 946 | AC632: 88.27 | AD632: 16
A633: NORTH MELBOURNE | C633: J JOHNSON | F633: HOPKINS | I633: HAWKINS | L633: RAWLE | O633: JONES | R633: TEAGUE | W633: MELBOURNE CITY | X633: 0 | Y633: 14 | Z633: 0 | AA633: 533 | AB633: 1419 | AC633: 37.561663143058489 | AD633: 0
A634: BRIGHTON | C634: B BAILES | F634: KNIGHTON | I634: E SMITH | L634: A LAXTON | O634: TURNBULL | R634: E BAILES
A635: GOALKICKERS
A636: NORTH MELBOURNE | C636: ELLIOTT 3 | G636: WILSON 2 | J636: RAWLE 2 | M636: HOMAN
A637: BRIGHTON | C637: DOWDING 3 | G637: HAZEL 2 | J637: TURNBULL
A639: WILLIAMSTOWN | C639: 3 | D639: 2 | E639: =C639*6+D639 -> 20 | G639: 7 | H639: 5 | I639: =G639*6+H639 -> 47 | K639: 9 | L639: 9 | M639: =K639*6+L639 -> 63 | O639: 11 | P639: 12 | Q639: =O639*6+P639 -> 78 | S639: TOORAK PARK
A640: PRAHRAN | C640: 1 | D640: 1 | E640: =C640*6+D640 -> 7 | G640: 4 | H640: 4 | I640: =G640*6+H640 -> 28 | K640: 6 | L640: 5 | M640: =K640*6+L640 -> 41 | O640: 9 | P640: 8 | Q640: =O640*6+P640 -> 62 | S640: KENDALL
A641: BEST PLAYERS
A642: WILLIAMSTOWN | C642: REITMAN | F642: GIBBS | I642: FERGUSON | L642: AMY | N642: N BUSBRIDGE | R642: HOLMES
A643: PRAHRAN | C643: WEIDNER | F643: WILSON | I643: MARONEY | L643: McKENZIE | O643: DOWSING | R643: CARLSON
A644: GOALKICKERS
A645: WILLIAMSTOWN | C645: ANGUS 3 | F645: HOWARTH 3 | J645: E BUSBRIDGE 2 | N645: AMY 2 | Q645: HARDEN
A646: PRAHRAN | C646: MARONEY 3 | F646: PUNCH 2 | I646: ELLIN 2 | L646: COMER
A648: NORTHCOTE | C648: 2 | D648: 5 | E648: =C648*6+D648 -> 17 | G648: 2 | H648: 9 | I648: =G648*6+H648 -> 21 | K648: 4 | L648: 11 | M648: =K648*6+L648 -> 35 | O648: 6 | P648: 13 | Q648: =O648*6+P648 -> 49 | S648: CROXTON PK
A649: PORT MELBOURNE | C649: 1 | D649: 2 | E649: =C649*6+D649 -> 8 | G649: 1 | H649: 3 | I649: =G649*6+H649 -> 9 | K649: 2 | L649: 8 | M649: =K649*6+L649 -> 20 | O649: 3 | P649: 9 | Q649: =O649*6+P649 -> 27
A650: BEST PLAYERS
A651: NORTHCOTE | C651: JOHNSON | F651: HAMMOND | I651: THOMAS | L651: SMITH | O651: NORMAN | R651: SWIFT
A652: PORT MELBOURNE | C652: JINKS | F652: TREGLOWN | I652: MONK | L652: SCHNAPE | O652: E BROWN | R652: ANDERSON
A653: GOALKICKERS
A654: NORTHCOTE | C654: RYAN 2 | F654: SCOTT | I654: SWIFT | L654: JOHNSON | O654: BECK
A655: PORT MELBOURNE | C655: STEELE 2 | H655: MULROSS
A657: ESSENDON ASSOC. | C657: 6 | D657: 7 | E657: =C657*6+D657 -> 43 | G657: 14 | H657: 12 | I657: =G657*6+H657 -> 96 | K657: 16 | L657: 16 | M657: =K657*6+L657 -> 112 | O657: 25 | P657: 22 | Q657: =O657*6+P657 -> 172 | S657: ESSENDON
A658: MELBOURNE CITY | C658: 0 | D658: 1 | E658: =C658*6+D658 -> 1 | G658: 0 | H658: 3 | I658: =G658*6+H658 -> 3 | K658: 0 | L658: 5 | M658: =K658*6+L658 -> 5 | O658: 4 | P658: 7 | Q658: =O658*6+P658 -> 31
A659: BEST PLAYERS
A660: ESSENDON ASSOC. | C660: McNAMARA | F660: DIGGLE | I660: HOARE | L660: ATKINS | O660: YOUNG | Q660: REDFERN
A661: MELBOURNE CITY | C661: WILSON | F661: PORTER | I661: KILLEN | L661: DANIELS | O661: PRICE | Q661: PHILLIPS
A662: GOALKICKERS
A663: ESSENDON ASSOC. | C663: MCNAMARA 18 | G663: HUNTINGTON 3 | K663: REDFERN 2 | O663: CLARKE | Q663: SEVIOR
A664: MELBOURNE CITY | C664: CULLEN | F664: KIKER | I664: PHILLIPS | L664: CUSHEN
A666: ROUND 15 | E666: 27TH JULY | J666: WEATHER | L666: CLOUDY DULL LIGHT SOUTH BREEZE | S666: PLAYED AT | X666: LADDER | AB666: ROUND | AD666: 15
D667: 1ST QTR | H667: 2ND QTR | L667: 3RD QTR | P667: FINAL | S667: ESSENDON
A668: ESSENDON ASSOC. | C668: 1 | D668: 3 | E668: =C668*6+D668 -> 9 | G668: 4 | H668: 3 | I668: =G668*6+H668 -> 27 | K668: 7 | L668: 6 | M668: =K668*6+L668 -> 48 | O668: 12 | P668: 11 | Q668: =O668*6+P668 -> 83 | S668: UMPIRE | W668: TEAM | X668: W | Y668: L | Z668: D | AA668: FOR | AB668: AGST | AC668: % | AD668: PTS
A669: BRUNSWICK | C669: 0 | D669: 1 | E669: =C669*6+D669 -> 1 | G669: 0 | H669: 3 | I669: =G669*6+H669 -> 3 | K669: 0 | L669: 5 | M669: =K669*6+L669 -> 5 | O669: 0 | P669: 6 | Q669: =O669*6+P669 -> 6 | S669: HUME
A670: BEST PLAYERS | W670: NORTH MELBOURNE | X670: 14 | Y670: 1 | Z670: 0 | AA670: 1072 | AB670: 767 | AC670: 139.77 | AD670: 56
A671: ESSENDON ASSOC. | C671: McNAMARA | F671: CHAPMAN | I671: REDFERN | L671: M MADDEN | O671: WALKER | R671: ATKINS | W671: FOOTSCRAY | X671: 12 | Y671: 3 | Z671: 0 | AA671: 1317 | AB671: 762 | AC671: 172.83464566929135 | AD671: 48
A672: BRUNSWICK | C672: ROSS | F672: SULLIVAN | I672: CHAPMAN | L672: MILLS | O672: CARRIE | R672: GILLESPIE | W672: ESSENDON ASSOC. | X672: 10 | Y672: 5 | Z672: 0 | AA672: 1156 | AB672: 712 | AC672: 162.35955056179776 | AD672: 40
A673: GOALKICKERS | W673: BRUNSWICK | X673: 9 | Y673: 6 | Z673: 0 | AA673: 853 | AB673: 868 | AC673: 98.271889400921665 | AD673: 36
A674: ESSENDON ASSOC. | C674: McNAMARA 6 | F674: CLARKE 2 | I674: CHAPMAN | L674: HOARE | N674: HUNTINGTON | Q674: WALKER
A675: BRUNSWICK | E675: NIL | W675: BRIGHTON | X675: 8 | Y675: 7 | Z675: 0 | AA675: 908 | AB675: 873 | AC675: 104.00916380297824 | AD675: 32
W676: PORT MELBOURNE | X676: 7 | Y676: 8 | Z676: 0 | AA676: 880 | AB676: 911 | AC676: 96.597145993413832 | AD676: 28
A677: NORTH MELBOURNE | C677: 1 | D677: 1 | E677: =C677*6+D677 -> 7 | G677: 4 | H677: 4 | I677: =G677*6+H677 -> 28 | K677: 6 | L677: 10 | M677: =K677*6+L677 -> 46 | O677: 9 | P677: 16 | Q677: =O677*6+P677 -> 70 | S677: NORTH MELB | W677: NORTHCOTE | X677: 6 | Y677: 9 | Z677: 0 | AA677: 870 | AB677: 958 | AC677: 90.814196242171192 | AD677: 24
A678: PORT MELBOURNE | C678: 1 | D678: 1 | E678: =C678*6+D678 -> 7 | G678: 2 | H678: 2 | I678: =G678*6+H678 -> 14 | K678: 3 | L678: 5 | M678: =K678*6+L678 -> 23 | O678: 4 | P678: 6 | Q678: =O678*6+P678 -> 30 | S678: KENDALL | W678: WILLIAMSTOWN | X678: 5 | Y678: 10 | Z678: 0 | AA678: 825 | AB678: 934 | AC678: 88.329764453961459 | AD678: 20
A679: BEST PLAYERS | W679: PRAHRAN | X679: 4 | Y679: 11 | Z679: 0 | AA679: 883 | AB679: 1019 | AC679: 86.65 | AD679: 16
A680: NORTH MELBOURNE | C680: RAWLE | F680: WILSON | I680: JONES | L680: GRIERSON | O680: S BARKER | R680: HOPKINS | W680: MELBOURNE CITY | X680: 0 | Y680: 15 | Z680: 0 | AA680: 575 | AB680: 1535 | AC680: 37.45928338762215 | AD680: 0
A681: PORT MELBOURNE | C681: ANDERSON | F681: JINKS | I681: FRANKLIN | L681: BROWN | O681: TREGLOWN | R681: CLELAND
A682: GOALKICKERS
A683: NORTH MELBOURNE | C683: ELLIOT 3 | G683: HARDY 2 | J683: WILSON 2 | M683: GRIERSON | P683: RAWLE
A684: PORT MELBOURNE | C684: MERRICK 2 | G684: ANDERSON | J684: JINKS
A686: BRIGHTON | C686: 4 | D686: 1 | E686: =C686*6+D686 -> 25 | G686: 7 | H686: 9 | I686: =G686*6+H686 -> 51 | K686: 11 | L686: 14 | M686: =K686*6+L686 -> 80 | O686: 16 | P686: 18 | Q686: =O686*6+P686 -> 114 | S686: BRIGHTON BEACH
A687: WILLIAMSTOWN | C687: 2 | D687: 5 | E687: =C687*6+D687 -> 17 | G687: 4 | H687: 2 | I687: =G687*6+H687 -> 26 | K687: 4 | L687: 4 | M687: =K687*6+L687 -> 28 | O687: 4 | P687: 6 | Q687: =O687*6+P687 -> 30 | S687: ALLEN
A688: BEST PLAYERS
A689: BRIGHTON | C689: B BAILES | F689: DOWDING | I689: NEGRO | L689: A LAXTON | O689: GRAHAM | R689: E BAILES
A690: WILLIAMSTOWN | C690: AMY | F690: HARDEN | I690: McTAGGART | L690: ANDERSON | O690: HOLMES | R690: REITMAN
A691: GOALKICKERS
A692: BRIGHTON | C692: DOWDING 4 | F692: B BAILES 4 | I692: MANN 3 | L692: DALL 2 | N692: SNOOK 2 | Q692: NEGRO
A693: WILLIAMSTOWN | C693: HARDEN 2 | G693: AMY | J693: McTAGGART
A695: NORTHCOTE | C695: 5 | D695: 1 | E695: =C695*6+D695 -> 31 | G695: 9 | H695: 4 | I695: =G695*6+H695 -> 58 | K695: 15 | L695: 8 | M695: =K695*6+L695 -> 98 | O695: 17 | P695: 14 | Q695: =O695*6+P695 -> 116 | S695: CROXTON PK
A696: MELBOURNE CITY | C696: 0 | D696: 1 | E696: =C696*6+D696 -> 1 | G696: 2 | H696: 2 | I696: =G696*6+H696 -> 14 | K696: 5 | L696: 4 | M696: =K696*6+L696 -> 34 | O696: 6 | P696: 6 | Q696: =O696*6+P696 -> 42 | S696: HURLEY
A697: BEST PLAYERS
A698: NORTHCOTE | C698: RYAN | F698: COLE | I698: DUNCAN | L698: BILLETT | O698: MOORE | R698: SMITH
A699: MELBOURNE CITY | C699: KIKER | F699: PHILLIPS | I699: PRATT | L699: DANIELS | O699: GREGORY | R699: WILSON
A700: GOALKICKERS
A701: NORTHCOTE | C701: RYAN 12 | G701: HUNT
A702: MELBOURNE CITY | C702: KIKER 2 | G702: GREGORY 2
A704: FOOTSCRAY | C704: 2 | D704: 2 | E704: =C704*6+D704 -> 14 | G704: 6 | H704: 8 | I704: =G704*6+H704 -> 44 | K704: 8 | L704: 9 | M704: =K704*6+L704 -> 57 | O704: 10 | P704: 13 | Q704: =O704*6+P704 -> 73 | S704: FOOTSCRAY
A705: PRAHRAN | C705: 2 | D705: 2 | E705: =C705*6+D705 -> 14 | G705: 4 | H705: 3 | I705: =G705*6+H705 -> 27 | K705: 6 | L705: 6 | M705: =K705*6+L705 -> 42 | O705: 7 | P705: 6 | Q705: =O705*6+P705 -> 48 | S705: WREGG
A706: BEST PLAYERS
A707: FOOTSCRAY | C707: W KUSCHERT | G707: COTTON | J707: KNIGHT | M707: SAMSON | P707: GREGROY | S707: OGILVIE
A708: PRAHRAN | C708: WEIDNER | G708: MARONEY | J708: DOWSING | M708: CARLSON | P708: McKENZIE | S708: COMER
A709: GOALKICKERS
A710: FOOTSCRAY | C710: KNIGHT 5 | F710: SAMSON 2 | I710: COTTON | L710: CRADDOCK | O710: GREGORY
A711: PRAHRAN | C711: SYKES 2 | F711: ELLIN | I711: MARONEY | L711: COMER
A713: ROUND 16 | E713: 3RD AUGUST | J713: WEATHER | N713: CLOUDY DULL | S713: PLAYED AT | X713: LADDER | AB713: ROUND | AD713: 16
D714: 1ST QTR | H714: 2ND QTR | L714: 3RD QTR | P714: FINAL | S714: PORT MELB
A715: BRIGHTON | C715: 2 | D715: 0 | E715: =C715*6+D715 -> 12 | G715: 4 | H715: 5 | I715: =G715*6+H715 -> 29 | K715: 4 | L715: 11 | M715: =K715*6+L715 -> 35 | O715: 6 | P715: 16 | Q715: =O715*6+P715 -> 52 | S715: UMPIRE | W715: TEAM | X715: W | Y715: L | Z715: D | AA715: FOR | AB715: AGST | AC715: % | AD715: PTS
A716: PORT MELBOURNE | C716: 0 | D716: 3 | E716: =C716*6+D716 -> 3 | G716: 0 | H716: 7 | I716: =G716*6+H716 -> 7 | K716: 0 | L716: 8 | M716: =K716*6+L716 -> 8 | O716: 1 | P716: 11 | Q716: =O716*6+P716 -> 17 | S716: KENDALL
A717: BEST PLAYERS | W717: NORTH MELBOURNE | X717: 14 | Y717: 2 | Z717: 0 | AA717: 1118 | AB717: 838 | AC717: 133.41 | AD717: 56
A718: BRIGHTON | C718: B BAILES | F718: E SMITH | J718: BRIDGFORD | M718: NEGRO | P718: BELLER | S718: E BAILES | W718: FOOTSCRAY | X718: 13 | Y718: 3 | Z718: 0 | AA718: 1409 | AB718: 811 | AC718: 173.73612823674475 | AD718: 52
A719: PORT MELBOURNE | C719: ANDERSON | F719: CLELAND | J719: BROWN | M719: FRANKLIN | P719: TREGLOWN | S719: HAYES | W719: ESSENDON ASSOC. | X719: 11 | Y719: 5 | Z719: 0 | AA719: 1295 | AB719: 785 | AC719: 164.96815286624204 | AD719: 44
A720: GOALKICKERS | W720: BRUNSWICK | X720: 10 | Y720: 6 | Z720: 0 | AA720: 980 | AB720: 946 | AC720: 103.59408033826638 | AD720: 40
A721: BRIGHTON | C721: DOWDING 3 | G721: E BAILES | J721: DALL | M721: SNOOK
A722: PORT MELBOURNE | C722: MERRICK | W722: BRIGHTON | X722: 9 | Y722: 7 | Z722: 0 | AA722: 960 | AB722: 890 | AC722: 107.86516853932584 | AD722: 36
W723: PORT MELBOURNE | X723: 7 | Y723: 9 | Z723: 0 | AA723: 897 | AB723: 963 | AC723: 93.146417445482868 | AD723: 28
A724: FOOTSCRAY | C724: 0 | D724: 2 | E724: =C724*6+D724 -> 2 | G724: 9 | H724: 5 | I724: =G724*6+H724 -> 59 | K724: 10 | L724: 7 | M724: =K724*6+L724 -> 67 | O724: 14 | P724: 8 | Q724: =O724*6+P724 -> 92 | S724: FOOTSCRAY | W724: WILLIAMSTOWN | X724: 6 | Y724: 10 | Z724: 0 | AA724: 896 | AB724: 980 | AC724: 91.428571428571431 | AD724: 24
A725: NORTHCOTE | C725: 2 | D725: 6 | E725: =C725*6+D725 -> 18 | G725: 3 | H725: 7 | I725: =G725*6+H725 -> 25 | K725: 5 | L725: 9 | M725: =K725*6+L725 -> 39 | O725: 6 | P725: 13 | Q725: =O725*6+P725 -> 49 | S725: HERBERT | W725: NORTHCOTE | X725: 6 | Y725: 10 | Z725: 0 | AA725: 919 | AB725: 1050 | AC725: 87.523809523809518 | AD725: 24
A726: BEST PLAYERS | W726: PRAHRAN | X726: 4 | Y726: 12 | Z726: 0 | AA726: 956 | AB726: 1158 | AC726: 82.56 | AD726: 16
A727: FOOTSCRAY | C727: COTTON | F727: CROUCH | J727: CLARKE | M727: CRADDOCK | P727: BORTHWICK | S727: KNIGHT | W727: MELBOURNE CITY | X727: 0 | Y727: 16 | Z727: 0 | AA727: 653 | AB727: 1662 | AC727: 39.290012033694346 | AD727: 0
A728: NORTHCOTE | C728: J JOHNSON | F728: COLE | J728: MOORE | M728: HAMMOND | P728: SWIFT | S728: DUNCAN
A729: GOALKICKERS
A730: FOOTSCRAY | C730: BANBURY 5 | G730: KNIGHT 4 | J730: CLARKE | M730: CRADDOCK | P730: COTTON | R730: SAMSON | U730: CROUCH
A731: NORTHCOTE | C731: RYAN 3 | G731: GLUYAS | J731: BILLETT | M731: MOORE
A733: WILLIAMSTOWN | C733: 2 | D733: 3 | E733: =C733*6+D733 -> 15 | G733: 6 | H733: 8 | I733: =G733*6+H733 -> 44 | K733: 7 | L733: 12 | M733: =K733*6+L733 -> 54 | O733: 9 | P733: 17 | Q733: =O733*6+P733 -> 71 | S733: WILLIAMSTOWN
A734: NORTH MELBOURNE | C734: 2 | D734: 2 | E734: =C734*6+D734 -> 14 | G734: 3 | H734: 3 | I734: =G734*6+H734 -> 21 | K734: 4 | L734: 7 | M734: =K734*6+L734 -> 31 | O734: 6 | P734: 10 | Q734: =O734*6+P734 -> 46 | S734: WREGG
A735: BEST PLAYERS
A736: WILLIAMSTOWN | C736: N BUSBRIDGE | G736: REITMAN | J736: FERGUSON | M736: ALLEY | P736: McTAGGART | S736: HARDEN
A737: NORTH MELBOURNE | C737: TRELOAR | G737: PEMBERTON | J737: RAWLE | M737: CORRIGAN | P737: GRIERSON | S737: ELLIOTT
A738: GOALKICKERS
A739: WILLIAMSTOWN | C739: HARDEN 3 | G739: GIBBS 2 | J739: AMY 2 | M739: HOLMES 2
A740: NORTH MELBOURNE | C740: ELLIOTT 3 | G740: McKAY 2 | J740: WILSON
A742: BRUNSWICK | C742: 8 | D742: 4 | E742: =C742*6+D742 -> 52 | G742: 13 | H742: 8 | I742: =G742*6+H742 -> 86 | K742: 15 | L742: 14 | M742: =K742*6+L742 -> 104 | O742: 17 | P742: 25 | Q742: =O742*6+P742 -> 127 | S742: BRUNSWICK
A743: MELBOURNE CITY | C743: 2 | D743: 1 | E743: =C743*6+D743 -> 13 | G743: 5 | H743: 4 | I743: =G743*6+H743 -> 34 | K743: 9 | L743: 6 | M743: =K743*6+L743 -> 60 | O743: 12 | P743: 6 | Q743: =O743*6+P743 -> 78 | S743: ALLEN
A744: BEST PLAYERS
A745: BRUNSWICK | C745: McKENZIE | G745: ROSS | J745: H BRAID | M745: NEWSOME | P745: CARRIE | S745: STANCLIFFE
A746: MELBOURNE CITY | C746: PRATT | G746: PHILLIPS | J746: GREGOEY | M746: KIKER | P746: SMITH | S746: DANIELS
A747: GOALKICKERS
A748: BRUNSWICK | C748: McKENZIE 8 | F748: WARBURTON 3 | J748: WILLIS 2 | L748: H BRAID | N748: MILLS | P748: McLEAN | R748: CARRIE | T748: MARSH
A749: MELBOURNE CITY | C749: GREGORY 4 | G749: SMITH 2 | J749: BOLGER 2 | M749: J KIKER 2 | O749: O'CONNOR | R749: T KIKER
A751: ESSENDON ASSOC. | C751: 2 | D751: 3 | E751: =C751*6+D751 -> 15 | G751: 7 | H751: 8 | I751: =G751*6+H751 -> 50 | K751: 15 | L751: 10 | M751: =K751*6+L751 -> 100 | O751: 21 | P751: 13 | Q751: =O751*6+P751 -> 139 | S751: TOORAK PARK
A752: PRAHRAN | C752: 5 | D752: 4 | E752: =C752*6+D752 -> 34 | G752: 6 | H752: 5 | I752: =G752*6+H752 -> 41 | K752: 7 | L752: 9 | M752: =K752*6+L752 -> 51 | O752: 10 | P752: 13 | Q752: =O752*6+P752 -> 73 | S752: HURLEY
A753: BEST PLAYERS
A754: ESSENDON ASSOC. | C754: McNAMARA | G754: SEVIOR | J754: GIBSON | M754: HOARE | P754: ATKINS | S754: M MADDEN
A755: PRAHRAN | C755: DOWSING | G755: WOODHEAD | J755: RYAN | M755: McKENZIE | P755: WEIDNER | S755: MARONEY
A756: GOALKICKERS
A757: ESSENDON ASSOC. | C757: McNAMARA 12 | G757: CLARKE 4 | J757: HOARE 2 | M757: CHAPMAN 2 | Q757: WALKER
A758: PRAHRAN | C758: ELLIN 3 | F758: COMER 3 | I758: SYKES 2 | K758: PUNCH | M758: McKENZIE
A760: ROUND 17 | E760: 10TH AUGUST | J760: WEATHER | M760: FINE MILD LIGHT NORTH BREEZE | S760: PLAYED AT | X760: LADDER | AB760: ROUND | AD760: 17
D761: 1ST QTR | H761: 2ND QTR | L761: 3RD QTR | P761: FINAL | S761: NORTH MELB
A762: ESSENDON ASSOC. | C762: 2 | D762: 4 | E762: =C762*6+D762 -> 16 | G762: 2 | H762: 8 | I762: =G762*6+H762 -> 20 | K762: 3 | L762: 12 | M762: =K762*6+L762 -> 30 | O762: 5 | P762: 15 | Q762: =O762*6+P762 -> 45 | S762: UMPIRE | W762: TEAM | X762: W | Y762: L | Z762: D | AA762: FOR | AB762: AGST | AC762: % | AD762: PTS
A763: NORTH MELBOURNE | C763: 3 | D763: 4 | E763: =C763*6+D763 -> 22 | G763: 3 | H763: 4 | I763: =G763*6+H763 -> 22 | K763: 5 | L763: 10 | M763: =K763*6+L763 -> 40 | O763: 5 | P763: 11 | Q763: =O763*6+P763 -> 41 | S763: ALLEN
A764: BEST PLAYERS | W764: FOOTSCRAY | X764: 14 | Y764: 3 | Z764: 0 | AA764: 1485 | AB764: 831 | AC764: 178.70036101083033 | AD764: 56
A765: ESSENDON ASSOC. | C765: M MADDEN | G765: HOARE | J765: J MADDEN | M765: WALKER | P765: LEVIN | R765: DIGGLE | W765: NORTH MELBOURNE | X765: 14 | Y765: 3 | Z765: 0 | AA765: 1159 | AB765: 883 | AC765: 131.26 | AD765: 56
A766: NORTH MELBOURNE | C766: HARDY | G766: HOPKINS | J766: JONES | M766: S BARKER | P766: CORRIGAN | R766: PEMBERTON | W766: ESSENDON ASSOC. | X766: 12 | Y766: 5 | Z766: 0 | AA766: 1340 | AB766: 826 | AC766: 162.227602905569 | AD766: 48
A767: GOALKICKERS | W767: BRUNSWICK | X767: 11 | Y767: 6 | Z767: 0 | AA767: 1093 | AB767: 1013 | AC767: 107.89733464955577 | AD767: 44
A768: ESSENDON ASSOC. | C768: McNAMARA 2 | G768: ATKINS 2 | J768: M MADDEN
A769: NORTH MELBOURNE | C769: WILSON 2 | G769: RAWLE | J769: ELLIOTT | M769: GRIERSON | W769: BRIGHTON | X769: 9 | Y769: 8 | Z769: 0 | AA769: 1027 | AB769: 1003 | AC769: 102.39282153539382 | AD769: 36
W770: WILLIAMSTOWN | X770: 7 | Y770: 10 | Z770: 0 | AA770: 958 | AB770: 1041 | AC770: 92.026897214217101 | AD770: 28
A771: BRUNSWICK | C771: 2 | D771: 2 | E771: =C771*6+D771 -> 14 | G771: 7 | H771: 5 | I771: =G771*6+H771 -> 47 | K771: 11 | L771: 9 | M771: =K771*6+L771 -> 75 | O771: 17 | P771: 11 | Q771: =O771*6+P771 -> 113 | S771: BRUNSWICK | W771: PORT MELBOURNE | X771: 7 | Y771: 10 | Z771: 0 | AA771: 917 | AB771: 1039 | AC771: 88.257940327237733 | AD771: 28
A772: BRIGHTON | C772: 2 | D772: 2 | E772: =C772*6+D772 -> 14 | G772: 3 | H772: 6 | I772: =G772*6+H772 -> 24 | K772: 5 | L772: 8 | M772: =K772*6+L772 -> 38 | O772: 9 | P772: 13 | Q772: =O772*6+P772 -> 67 | S772: HURLEY | W772: NORTHCOTE | X772: 6 | Y772: 11 | Z772: 0 | AA772: 980 | AB772: 1112 | AC772: 88.129496402877692 | AD772: 24
A773: BEST PLAYERS | W773: PRAHRAN | X773: 5 | Y773: 12 | Z773: 0 | AA773: 1050 | AB773: 1243 | AC773: 84.47 | AD773: 20
A774: BRUNSWICK | C774: O'CONNOR | G774: L BRAID | J774: MARSH | M774: PRICE | O774: CHANDLER | R774: WARBURTON | W774: MELBOURNE CITY | X774: 0 | Y774: 17 | Z774: 0 | AA774: 738 | AB774: 1756 | AC774: 42.03 | AD774: 0
A775: BRIGHTON | C775: KNIGHTON | G775: B BAILES | J775: DOWDING | M775: E SMITH | O775: BELLER | R775: A LAXTON
A776: GOALKICKERS
A777: BRUNSWICK | C777: McKENZIE 6 | G777: WARBURTON 3 | K777: CHASE 3 | M777: CHANDLER 2 | P777: MARSH | R777: SULLIVAN | U777: PRICE
A778: BRIGHTON | C778: DALL 3 | F778: DOWDING 2 | J778: GRAHAM | M778: BELLER | P778: E SMITH | R778: NEGRO
A780: FOOTSCRAY | C780: 1 | D780: 2 | E780: =C780*6+D780 -> 8 | G780: 3 | H780: 3 | I780: =G780*6+H780 -> 21 | K780: 5 | L780: 7 | M780: =K780*6+L780 -> 37 | O780: 10 | P780: 16 | Q780: =O780*6+P780 -> 76 | S780: PORT MELB
A781: PORT MELBOURNE | C781: 0 | D781: 3 | E781: =C781*6+D781 -> 3 | G781: 0 | H781: 6 | I781: =G781*6+H781 -> 6 | K781: 2 | L781: 7 | M781: =K781*6+L781 -> 19 | O781: 2 | P781: 8 | Q781: =O781*6+P781 -> 20 | S781: HERBERT
A782: BEST PLAYERS
A783: FOOTSCRAY | C783: COTTON | F783: CRADDOCK | J783: CLARK | M783: GREGORY | P783: HARRIS | R783: SAMSON
A784: PORT MELBOURNE | C784: ANDERSON | F784: ANG McDONALD | J784: STEELE | M784: CARDEN | P784: HENDRIE | R784: MERRICK
A785: GOALKICKERS
A786: FOOTSCRAY | C786: COTTON 3 | F786: BANBURY 2 | I786: CLARK 2 | L786: CRADDOCK | O786: OGILVIE | R786: KNIGHT
A787: PORT MELBOURNE | C787: ROBERTS | F787: HAYES
A789: WILLIAMSTOWN | C789: 0 | D789: 4 | E789: =C789*6+D789 -> 4 | G789: 2 | H789: 11 | I789: =G789*6+H789 -> 23 | K789: 5 | L789: 16 | M789: =K789*6+L789 -> 46 | O789: 7 | P789: 20 | Q789: =O789*6+P789 -> 62 | S789: CROXTON PK
A790: NORTHCOTE | C790: 4 | D790: 3 | E790: =C790*6+D790 -> 27 | G790: 6 | H790: 4 | I790: =G790*6+H790 -> 40 | K790: 8 | L790: 6 | M790: =K790*6+L790 -> 54 | O790: 9 | P790: 7 | Q790: =O790*6+P790 -> 61 | S790: KENDALL
A791: BEST PLAYERS
A792: WILLIAMSTOWN | C792: REITMAN | F792: ALLEY | I792: HOLMES | L792: N BUSBRIDGE | P792: WALLIS | R792: AMY
A793: NORTHCOTE | C793: J JOHNSON | F793: DUNCAN | I793: HALL | L793: THOMAS | P793: NORMAN | R793: HAMMOND
A794: GOALKICKERS
A795: WILLIAMSTOWN | C795: AMY 2
A796: NORTHCOTE | C796: RYAN 2
A798: PRAHRAN | C798: 4 | D798: 2 | E798: =C798*6+D798 -> 26 | G798: 9 | H798: 6 | I798: =G798*6+H798 -> 60 | K798: 10 | L798: 7 | M798: =K798*6+L798 -> 67 | O798: 14 | P798: 10 | Q798: =O798*6+P798 -> 94 | S798: EAST MELB
A799: MELBOURNE CITY | C799: 4 | D799: 4 | E799: =C799*6+D799 -> 28 | G799: 4 | H799: 6 | I799: =G799*6+H799 -> 30 | K799: 8 | L799: 11 | M799: =K799*6+L799 -> 59 | O799: 12 | P799: 13 | Q799: =O799*6+P799 -> 85 | S799: WREGG
A800: BEST PLAYERS
A801: PRAHRAN
A802: MELBOURNE CITY
A803: GOALKICKERS
A804: PRAHRAN | D804: ELLIN 4 | F804: DOWSING 3 | I804: CARLSON 2 | L804: FARMER | N804: McKENZIE | Q804: POWELL | S804: MARONEY | V804: KELLY
A805: MELBOURNE CITY | D805: GREGORY 5 | G805: CLARKE 3 | J805: BOLGER | L805: O'CONNOR | N805: WOODS | P805: PRATT
A807: ROUND 18 | E807: 17TH AUGUST | J807: WEATHER | M807: CLOUDY LIGHT RAIN NOON | S807: PLAYED AT | X807: LADDER | AB807: ROUND | AD807: 18
D808: 1ST QTR | H808: 2ND QTR | L808: 3RD QTR | P808: FINAL | S808: WILLIAMSTOWN
A809: FOOTSCRAY | C809: 0 | D809: 1 | E809: =C809*6+D809 -> 1 | G809: 5 | H809: 9 | I809: =G809*6+H809 -> 39 | K809: 8 | L809: 12 | M809: =K809*6+L809 -> 60 | O809: 10 | P809: 14 | Q809: =O809*6+P809 -> 74 | S809: UMPIRE | W809: TEAM | X809: W | Y809: L | Z809: D | AA809: FOR | AB809: AGST | AC809: % | AD809: PTS
A810: WILLIAMSTOWN | C810: 3 | D810: 5 | E810: =C810*6+D810 -> 23 | G810: 3 | H810: 5 | I810: =G810*6+H810 -> 23 | K810: 6 | L810: 9 | M810: =K810*6+L810 -> 45 | O810: 9 | P810: 15 | Q810: =O810*6+P810 -> 69 | S810: KENDALL
A811: BEST PLAYERS | W811: FOOTSCRAY | X811: 15 | Y811: 3 | Z811: 0 | AA811: 1559 | AB811: 900 | AC811: 173.22222222222223 | AD811: 60
A812: FOOTSCRAY | C812: COTTON | F812: SAMSON | I812: CRADDOCK | L812: McCLUSKY | O812: BRIESE | Q812: BANBURY | W812: NORTH MELBOURNE | X812: 15 | Y812: 3 | Z812: 0 | AA812: 1269 | AB812: 907 | AC812: 139.91 | AD812: 60
A813: WILLIAMSTOWN | C813: REITMAN | F813: McTAGGART | I813: HARDEN | L813: HOLMES | O813: AMY | Q813: ROBINSON | W813: ESSENDON ASSOC. | X813: 13 | Y813: 5 | Z813: 0 | AA813: 1458 | AB813: 875 | AC813: 166.62857142857143 | AD813: 52
A814: GOALKICKERS | W814: BRUNSWICK | X814: 11 | Y814: 7 | Z814: 0 | AA814: 1140 | AB814: 1081 | AC814: 105.45790934320074 | AD814: 44
A815: FOOTSCRAY | C815: KNIGHT 3 | F815: COTTON 2 | I815: BANBURY | K815: GREGORY | M815: McCARTHY | P815: CRADDOCK | S815: SPENCE
A816: WILLIAMSTOWN | C816: AMY 3 | F816: McTAGGART 2 | I816: ALLEY | K816: HARDEN | M816: REITMAN | O816: E BUSBRIDGE | W816: BRIGHTON | X816: 10 | Y816: 8 | Z816: 0 | AA816: 1111 | AB816: 1085 | AC816: 102.3963133640553 | AD816: 40
W817: PORT MELBOURNE | X817: 8 | Y817: 10 | Z817: 0 | AA817: 985 | AB817: 1086 | AC817: 90.699815837937379 | AD817: 32
A818: PORT MELBOURNE | C818: 2 | D818: 6 | E818: =C818*6+D818 -> 18 | G818: 2 | H818: 7 | I818: =G818*6+H818 -> 19 | K818: 8 | L818: 14 | M818: =K818*6+L818 -> 62 | O818: 9 | P818: 14 | Q818: =O818*6+P818 -> 68 | S818: PORT MELB | W818: WILLIAMSTOWN | X818: 7 | Y818: 11 | Z818: 0 | AA818: 1027 | AB818: 1115 | AC818: 92.107623318385649 | AD818: 28
A819: BRUNSWICK | C819: 1 | D819: 0 | E819: =C819*6+D819 -> 6 | G819: 3 | H819: 7 | I819: =G819*6+H819 -> 25 | K819: 3 | L819: 8 | M819: =K819*6+L819 -> 26 | O819: 6 | P819: 11 | Q819: =O819*6+P819 -> 47 | S819: HERBERT | W819: NORTHCOTE | X819: 6 | Y819: 12 | Z819: 0 | AA819: 1029 | AB819: 1230 | AC819: 83.658536585365852 | AD819: 24
A820: BEST PLAYERS | W820: PRAHRAN | X820: 5 | Y820: 13 | Z820: 0 | AA820: 1132 | AB820: 1327 | AC820: 85.31 | AD820: 20
A821: PORT MELBOURNE | C821: ANDERSON | F821: CLELAND | I821: MERRICK | L821: HENDRIE | O821: TREGLOWN | R821: HAYES | W821: MELBOURNE CITY | X821: 0 | Y821: 18 | Z821: 0 | AA821: 762 | AB821: 1866 | AC821: 40.84 | AD821: 0
A822: BRUNSWICK | C822: ROSS | F822: McKENZIE | I822: GILLESPIE | L822: WARBURTON | O822: SULLIVAN | R822: WILLIS
A823: GOALKICKERS
A824: PORT MELBOURNE | C824: MERRICK 4 | G824: HAYES 2 | J824: AL McDONALD | N824: CLELAND | Q824: SAMSON
A825: BRUNSWICK | C825: SULLIVAN 3 | G825: McKENZIE 2 | K825: WARBURTON
A827: ESSENDON ASSOC. | C827: 3 | D827: 10 | E827: =C827*6+D827 -> 28 | G827: 5 | H827: 13 | I827: =G827*6+H827 -> 43 | K827: 14 | L827: 19 | M827: =K827*6+L827 -> 103 | O827: 16 | P827: 22 | Q827: =O827*6+P827 -> 118 | S827: ESSENDON
A828: NORTHCOTE | C828: 1 | D828: 2 | E828: =C828*6+D828 -> 8 | G828: 3 | H828: 8 | I828: =G828*6+H828 -> 26 | K828: 3 | L828: 10 | M828: =K828*6+L828 -> 28 | O828: 6 | P828: 13 | Q828: =O828*6+P828 -> 49 | S828: WREGG
A829: BEST PLAYERS
A830: ESSENDON ASSOC. | C830: PAIN | F830: WALKER | I830: CHAPMAN | L830: McNAMARA | O830: GIBSON | R830: ANDERSON
A831: NORTHCOTE | C831: HAMMOND | F831: DUNCAN | I831: RYAN | L831: GLUYAS | O831: O'KEEFE | R831: BILLETT
A832: GOALKICKERS
A833: ESSENDON ASSOC. | C833: MCNAMARA 7 | G833: REDFERN 3 | J833: HOARE 2 | M833: CHRISTIE | O833: LEWIS | Q833: PAIN | R833: M MADDEN
A834: NORTHCOTE | C834: RYAN 4 | G834: CLARKE | J834: COLE
A836: BRIGHTON | C836: 2 | D836: 4 | E836: =C836*6+D836 -> 16 | G836: 5 | H836: 7 | I836: =G836*6+H836 -> 37 | K836: 12 | L836: 11 | M836: =K836*6+L836 -> 83 | O836: 12 | P836: 12 | Q836: =O836*6+P836 -> 84 | S836: TOORAK PARK
A837: PRAHRAN | C837: 1 | D837: 5 | E837: =C837*6+D837 -> 11 | G837: 4 | H837: 10 | I837: =G837*6+H837 -> 34 | K837: 7 | L837: 14 | M837: =K837*6+L837 -> 56 | O837: 10 | P837: 22 | Q837: =O837*6+P837 -> 82 | S837: HURLEY
A838: BEST PLAYERS
A839: BRIGHTON | C839: E SMITH | F839: A LAXTON | I839: BUTLER | L839: E BAILES | O839: B BAILES | R839: PATERSON
A840: PRAHRAN | C840: ELLIN | F840: DOWSING | I840: WEIDNER | L840: MARONEY | O840: WILSON
A841: GOALKICKERS
A842: BRIGHTON | C842: PATERSON 4 | G842: EDMONDS 2 | J842: ROBINSON 2 | M842: E SMITH | O842: B BAILES | Q842: BROWN | S842: DOWDING
A843: PRAHRAN | C843: ELLIN 5 | F843: MARONEY 2 | J843: POWELL | M843: WOODHEAD | P843: SYKES
A845: NORTH MELBOURNE | C845: 3 | D845: 6 | E845: =C845*6+D845 -> 24 | G845: 5 | H845: 12 | I845: =G845*6+H845 -> 42 | K845: 12 | L845: 18 | M845: =K845*6+L845 -> 90 | O845: 15 | P845: 20 | Q845: =O845*6+P845 -> 110 | S845: NORTH MELB
A846: MELBOURNE CITY | C846: 0 | D846: 1 | E846: =C846*6+D846 -> 1 | G846: 0 | H846: 5 | I846: =G846*6+H846 -> 5 | K846: 0 | L846: 7 | M846: =K846*6+L846 -> 7 | O846: 2 | P846: 12 | Q846: =O846*6+P846 -> 24 | S846: ALLEN
A847: BEST PLAYERS
A848: NORTH MELBOURNE | C848: ELLIOTT | F848: HARDY | I848: S BARKER | L848: J JOHNSON | O848: RAWLE | R848: J STEWART
A849: MELBOURNE CITY | C849: DANIELS | F849: PHILLIPS | I849: KIKER | L849: WILSON | O849: QUINN | R849: PRATT
A850: GOALKICKERS
A851: NORTH MELBOURNE | C851: ELLIOTT 7 | F851: HOPKINS 2 | I851: HARDY 2 | K851: S BARKER 2 | N851: GRIERSON | Q851: WILSON
A852: MELBOURNE CITY | C852: DANIELS | G852: QUINN
A854: FINALS
A855: 1ST SEMI | E855: 24TH AUGUST | J855: WEATHER
D856: 1ST QTR | H856: 2ND QTR | L856: 3RD QTR | P856: FINAL
A857: NORTH MELBOURNE | C857: 2 | D857: 2 | E857: =C857*6+D857 -> 14 | G857: 5 | H857: 2 | I857: =G857*6+H857 -> 32 | K857: 7 | L857: 2 | M857: =K857*6+L857 -> 44 | O857: 9 | P857: 6 | Q857: =O857*6+P857 -> 60 | S857: NORTH MELB
A858: BRUNSWICK | C858: 2 | D858: 1 | E858: =C858*6+D858 -> 13 | G858: 5 | H858: 2 | I858: =G858*6+H858 -> 32 | K858: 9 | L858: 4 | M858: =K858*6+L858 -> 58 | O858: 9 | P858: 6 | Q858: =O858*6+P858 -> 60 | S858: KENDALL
A859: BEST PLAYERS
A860: NORTH MELBOURNE | C860: HERON | F860: ROACH | I860: S BARKER | L860: HARDY | O860: J STEWART | R860: HAWKINS
A861: BRUNSWICK | C861: O'CONNOR | F861: ROSS | I861: GILLESPIE | L861: MARSH | O861: STANCLIFFE | R861: WARBURTON
A862: GOALKICKERS
A863: NORTH MELBOURNE | C863: WILSON 3 | F863: HAWKINS 2 | I863: S BARKER | L863: HARDY | N863: HOPKINS | Q863: McKAY
A864: BRUNSWICK | C864: WARBURTON 3 | G864: CHASE 2 | J864: CARRIE | L864: CHANDLER | O864: SULLIVAN | R864: GILLESPIE
A866: 1ST SEMI 1ST REPLAY | F866: 7TH SEPTEMBER | J866: WEATHER | L866: SOUTH WIND RAIN
A867: NORTH MELBOURNE | C867: 2 | D867: 5 | E867: =C867*6+D867 -> 17 | G867: 4 | H867: 8 | I867: =G867*6+H867 -> 32 | K867: 5 | L867: 9 | M867: =K867*6+L867 -> 39 | O867: 6 | P867: 12 | Q867: =O867*6+P867 -> 48 | S867: NORTH MELB
A868: BRUNSWICK | C868: 1 | D868: 2 | E868: =C868*6+D868 -> 8 | G868: 2 | H868: 6 | I868: =G868*6+H868 -> 18 | K868: 5 | L868: 11 | M868: =K868*6+L868 -> 41 | O868: 6 | P868: 12 | Q868: =O868*6+P868 -> 48 | S868: KENDALL
A869: BEST PLAYERS
A870: NORTH MELBOURNE | C870: HARDY | F870: TRELOAR | I870: S BARKER | L870: JONES | O870: RAWLE | R870: HERON
A871: BRUNSWICK | C871: ROSS | F871: L BRAID | I871: PRICE | L871: O'CONNOR | O871: McKENZIE | R871: CHANDLER
A872: GOALKICKERS
A873: NORTH MELBOURNE | C873: HARDY 2 | F873: HAWKINS | I873: RAWLE | L873: McKAY | O873: ELLIOTT
A874: BRUNSWICK | C874: McKENZIE 2 | G874: CHANDLER 2 | K874: CHASE | M874: L BRAID
A876: 1ST SEMI 2ND REPLAY | F876: 14TH SEPTEMBER | J876: WEATHER | L876: SOUTH WIND HEAVY RAIN
A877: NORTH MELBOURNE | C877: 5 | D877: 6 | E877: =C877*6+D877 -> 36 | G877: 8 | H877: 7 | I877: =G877*6+H877 -> 55 | K877: 12 | L877: 11 | M877: =K877*6+L877 -> 83 | O877: 12 | P877: 11 | Q877: =O877*6+P877 -> 83 | S877: NORTH MELB
A878: BRUNSWICK | C878: 0 | D878: 2 | E878: =C878*6+D878 -> 2 | G878: 4 | H878: 5 | I878: =G878*6+H878 -> 29 | K878: 6 | L878: 6 | M878: =K878*6+L878 -> 42 | O878: 9 | P878: 14 | Q878: =O878*6+P878 -> 68 | S878: KENDALL
A879: BEST PLAYERS
A880: NORTH MELBOURNE | C880: HARDY | F880: S BARKER | I880: HOPKINS | L880: HERON | O880: RAWLE | R880: HAWKINS
A881: BRUNSWICK | C881: McKENZIE | F881: ROSS | I881: O'CONNOR | L881: PRICE | O881: CHANDLER | R881: STANCLIFFE
A882: GOALKICKERS
A883: NORTH MELBOURNE | C883: WILLIAMSON 5 | G883: ELLIOTT 3 | J883: HAWKINS 2 | M883: RAWLE | P883: STEWART
A884: BRUNSWICK | C884: McKENZIE 5 | G884: CHANDLER 2 | K884: HARKER | M884: PRICE
A886: 2ND SEMI | F886: 31ST AUGUST | J886: WEATHER | N886: FINE SOUTH WIND
A887: ESSENDON ASSOC. | C887: 2 | D887: 4 | E887: =C887*6+D887 -> 16 | G887: 6 | H887: 8 | I887: =G887*6+H887 -> 44 | K887: 7 | L887: 8 | M887: =K887*6+L887 -> 50 | O887: 10 | P887: 10 | Q887: =O887*6+P887 -> 70 | S887: NORTH MELB
A888: FOOTSCRAY | C888: 3 | D888: 3 | E888: =C888*6+D888 -> 21 | G888: 4 | H888: 3 | I888: =G888*6+H888 -> 27 | K888: 6 | L888: 11 | M888: =K888*6+L888 -> 47 | O888: 6 | P888: 12 | Q888: =O888*6+P888 -> 48 | S888: KENDALL
A889: BEST PLAYERS
A890: ESSENDON ASSOC. | C890: McNAMARA | G890: J MADDEN | J890: M MADDEN | M890: SEVIOR | P890: HOARE | R890: LEWIS
A891: FOOTSCRAY | C891: CRADDOCK | G891: BAXTER | J891: BORTHWICK | M891: HARRIS | P891: SAMSON | R891: BRIESE
A892: GOALKICKERS
A893: ESSENDON ASSOC. | C893: McNAMARA 6 | G893: CLARKE 2 | J893: CHANDLER | M893: LEWIS
A894: FOOTSCRAY | C894: KNIGHT 3 | G894: BORTHWICK 2 | K894: BANBURY
A896: FINAL | E896: 21ST SEPTEMBER | J896: WEATHER | N896: FINE LIGHT SOUTH BREEZE GROUND DAMP
A898: ESSENDON ASSOC. | C898: 2 | D898: 1 | E898: =C898*6+D898 -> 13 | G898: 9 | H898: 2 | I898: =G898*6+H898 -> 56 | K898: 10 | L898: 2 | M898: =K898*6+L898 -> 62 | O898: 16 | P898: 6 | Q898: =O898*6+P898 -> 102 | S898: NORTH MELB
A899: NORTH MELBOURNE | C899: 3 | D899: 5 | E899: =C899*6+D899 -> 23 | G899: 5 | H899: 5 | I899: =G899*6+H899 -> 35 | K899: 11 | L899: 13 | M899: =K899*6+L899 -> 79 | O899: 14 | P899: 14 | Q899: =O899*6+P899 -> 98 | S899: KENDALL
A900: BEST PLAYERS
A901: ESSENDON ASSOC. | C901: McNAMARA | G901: GOUGH | J901: SEVIOR | M901: J MADDEN | P901: CLARKE | S901: M MADDEN
A902: NORTH MELBOURNE | C902: HARDY | G902: S BARKER | J902: RAWLE | M902: PEMBERTON | P902: GRIERSON | S902: STEWART
A903: GOALKICKERS
A904: ESSENDON ASSOC. | C904: CLARKE 6 | F904: McNAMARA 5 | J904: HOARE 2 | M904: SEVIOR 2 | P904: J MADDEN
A905: NORTH MELBOURNE | C905: WILLIAMSON 5 | G905: HARDY 4 | J905: HAWKINS 2 | M905: S BARKER | P905: ELLIOTT | S905: GRIERSON
A907: GRAND FINAL | E907: 28TH SEPTEMBER | J907: WEATHER | N907: NORTH WIND FINE AND SUNNY
A908: ESSENDON ASSOC. | C908: 2 | D908: 3 | E908: =C908*6+D908 -> 15 | G908: 3 | H908: 6 | I908: =G908*6+H908 -> 24 | K908: 7 | L908: 8 | M908: =K908*6+L908 -> 50 | O908: 9 | P908: 8 | Q908: =O908*6+P908 -> 62 | S908: NORTH MELB
A909: FOOTSCRAY | C909: 1 | D909: 2 | E909: =C909*6+D909 -> 8 | G909: 2 | H909: 7 | I909: =G909*6+H909 -> 19 | K909: 2 | L909: 9 | M909: =K909*6+L909 -> 21 | O909: 5 | P909: 11 | Q909: =O909*6+P909 -> 41 | S909: KENDALL
A910: BEST PLAYERS
A911: ESSENDON ASSOC. | C911: HOARE | G911: SEVIOR | J911: MAINE | M911: DIGGLE | P911: McINTYRE | S911: McNAMARA
A912: FOOTSCRAY | C912: CRADDOCK | G912: McCLUSKY | J912: COTTON | M912: BANBURY | P912: SAMSON | S912: BORTHWICK
A913: GOALKICKERS
A914: ESSENDON ASSOC. | C914: McNAMARA 3 | G914: CLARKE 3 | J914: LEWIS | M914: HOARE | P914: SEVIOR
A915: FOOTSCRAY | C915: CRADDOCK 2 | G915: KNIGHT | J915: BANBURY | M915: COTTON