A1: Victorian Football Association
A2: Season 1913
A3: © Copyright Wal Williams | F3: First created: 2 August 2014
A4: Contact: joywalwi at gmail dot com | F4: Last updated: 2 August 2014 | W4: VFA Results and tables - Link to the main index page
A5: You are free to copy this document in whole or part provided that proper acknowledgement is given to the author. All rights reserved.
A7: YEAR 1913 | X7: LADDER | AB7: ROUND | AD7: 1
A8: ROUND 1 | E8: 26TH APRIL | J8: WEATHER | M8: NORTH WIND FINE | S8: PLAYED AT
D9: 1ST QTR | H9: 2ND QTR | L9: 3RD QTR | P9: FINAL | S9: BRUNSWICK | W9: TEAM | X9: W | Y9: L | Z9: D | AA9: FOR | AB9: AGST | AC9: % | AD9: PTS
A10: BRUNSWICK | C10: 1 | D10: 7 | E10: =C10*6+D10 -> 13 | G10: 6 | H10: 16 | I10: =G10*6+H10 -> 52 | K10: 7 | L10: 23 | M10: =K10*6+L10 -> 65 | O10: 11 | P10: 32 | Q10: =O10*6+P10 -> 98 | S10: UMPIRE
A11: PORT MELBOURNE | C11: 3 | D11: 3 | E11: =C11*6+D11 -> 21 | G11: 3 | H11: 4 | I11: =G11*6+H11 -> 22 | K11: 3 | L11: 8 | M11: =K11*6+L11 -> 26 | O11: 5 | P11: 10 | Q11: =O11*6+P11 -> 40 | S11: HURLEY | W11: BRUNSWICK | X11: 1 | Y11: 0 | Z11: 0 | AA11: 98 | AB11: 40 | AC11: 245.00 | AD11: 4
A12: BEST PLAYERS | W12: NORTH MELBOURNE | X12: 1 | Y12: 0 | Z12: 0 | AA12: 75 | AB12: 31 | AC12: 241.93548387096774 | AD12: 4
A13: BRUNSWICK | C13: McKENZIE | F13: CHANDLER | I13: STANCLIFFE | L13: O'CONNOR | O13: PRICE | Q13: SULLIVAN | W13: PRAHRAN | X13: 1 | Y13: 0 | Z13: 0 | AA13: 105 | AB13: 45 | AC13: 233.33333333333334 | AD13: 4
A14: PORT MELBOURNE | C14: MERRICK | F14: BARFOOT | I14: ANDERSON | L14: CLELAND | O14: TAYLOR | Q14: HAIGHBLOOM | W14: ESSENDON ASSOC. | X14: 1 | Y14: 0 | Z14: 0 | AA14: 60 | AB14: 35 | AC14: 171.42857142857142 | AD14: 4
A15: GOALKICKERS
A16: BRUNSWICK | C16: PRICE 4 | F16: McKENZIE 3 | I16: STEVENSON 2 | L16: STANCLIFFE | O16: PITCHER | W16: FOOTSCRAY | X16: 1 | Y16: 0 | Z16: 0 | AA16: 54 | AB16: 35 | AC16: 154.28571428571428 | AD16: 4
A17: PORT MELBOURNE | C17: TAYLOR 2 | F17: MERRICK 2 | I17: REARDON | W17: WILLIAMSTOWN | X17: 0 | Y17: 1 | Z17: 0 | AA17: 35 | AB17: 54 | AC17: 64.81481481481481 | AD17: 0
W18: NORTHCOTE | X18: 0 | Y18: 1 | Z18: 0 | AA18: 35 | AB18: 60 | AC18: 58.333333333333336 | AD18: 0
A19: ESSENDON ASSOC. | C19: 2 | D19: 5 | E19: =C19*6+D19 -> 17 | G19: 4 | H19: 5 | I19: =G19*6+H19 -> 29 | K19: 7 | L19: 10 | M19: =K19*6+L19 -> 52 | O19: 8 | P19: 12 | Q19: =O19*6+P19 -> 60 | S19: CROXTON PK | W19: BRIGHTON | X19: 0 | Y19: 1 | Z19: 0 | AA19: 45 | AB19: 105 | AC19: 42.857142857142854 | AD19: 0
A20: NORTHCOTE | C20: 0 | D20: 0 | E20: =C20*6+D20 -> 0 | G20: 2 | H20: 5 | I20: =G20*6+H20 -> 17 | K20: 2 | L20: 6 | M20: =K20*6+L20 -> 18 | O20: 4 | P20: 11 | Q20: =O20*6+P20 -> 35 | S20: McMURRAY | W20: MELBOURNE CITY | X20: 0 | Y20: 1 | Z20: 0 | AA20: 31 | AB20: 75 | AC20: 41.333333333333336 | AD20: 0
A21: BEST PLAYERS | W21: PORT MELBOURNE | X21: 0 | Y21: 1 | Z21: 0 | AA21: 40 | AB21: 98 | AC21: 40.816326530612244 | AD21: 0
A22: ESSENDON ASSOC. | C22: HOARE | F22: MAINE | I22: GIBSON | L22: HUNTINGTON | O22: CLARKE | Q22: GOUGH
A23: NORTHCOTE | C23: JACKSON | F23: MOORE | I23: BECK | L23: SWIFT | O23: WHITE
A24: GOALKICKERS
A25: ESSENDON ASSOC. | C25: GOUGH 3 | F25: DIGGLE | H25: HUNTINGTON | K25: J WALKER | N25: WALL | P25: GODDARD
A26: NORTHCOTE | C26: RYAN | F26: JOHNSON | I26: NORMAN | K26: BECK
A28: NORTH MELBOURNE | C28: 0 | D28: 4 | E28: =C28*6+D28 -> 4 | G28: 3 | H28: 12 | I28: =G28*6+H28 -> 30 | K28: 3 | L28: 12 | M28: =K28*6+L28 -> 30 | O28: 10 | P28: 15 | Q28: =O28*6+P28 -> 75 | S28: NORTH MELB
A29: MELBOURNE CITY | C29: 0 | D29: 2 | E29: =C29*6+D29 -> 2 | G29: 2 | H29: 4 | I29: =G29*6+H29 -> 16 | K29: 3 | L29: 5 | M29: =K29*6+L29 -> 23 | O29: 4 | P29: 7 | Q29: =O29*6+P29 -> 31 | S29: KENDALL
A30: BEST PLAYERS
A31: NORTH MELBOURNE | C31: S BARKER | G31: HARDY | I31: RAWLE | L31: DEAN | N31: K JOHNSON | Q31: J JOHNSON
A32: MELBOURNE CITY | C32: GREENHILL | G32: WALKER | I32: PRATT | L32: KIKER | N32: BYRNE | Q32: QUINN
A33: GOALKICKERS
A34: NORTH MELBOURNE | C34: HARDY 3 | F34: K JOHNSON 3 | J34: BARKER 2 | M34: J JOHNSON | P34: DEAN
A35: MELBOURNE CITY | C35: PRATT 2 | F35: F GREGORY | I35: YORSTEN
A37: FOOTSCRAY | C37: 3 | D37: 3 | E37: =C37*6+D37 -> 21 | G37: 4 | H37: 4 | I37: =G37*6+H37 -> 28 | K37: 6 | L37: 6 | M37: =K37*6+L37 -> 42 | O37: 8 | P37: 6 | Q37: =O37*6+P37 -> 54 | S37: FOOTSCRAY
A38: WILLIAMSTOWN | C38: 0 | D38: 1 | E38: =C38*6+D38 -> 1 | G38: 1 | H38: 4 | I38: =G38*6+H38 -> 10 | K38: 3 | L38: 4 | M38: =K38*6+L38 -> 22 | O38: 5 | P38: 5 | Q38: =O38*6+P38 -> 35 | S38: CHISHOLM
A39: BEST PLAYERS
A40: FOOTSCRAY | C40: BANBURY | G40: LAWSON | J40: COTTON | L40: CRADDOCK | O40: MIDDLETON | R40: McCLUSKY
A41: WILLIAMSTOWN | C41: N BUSBRIDGE | G41: ANDERSON | J41: FERGUSON | M41: GIBBS | O41: AMY | R41: ADAMS
A42: GOALKICKERS
A43: FOOTSCRAY | C43: OGILVIE 2 | F43: COTTON 2 | I43: CROUCH | K43: SPENCE | M43: LAWSON | P43: BAXTER
A44: WILLIAMSTOWN | C44: GIBBS 2 | F44: COWARD | I44: ALLEY
A46: PRAHRAN | C46: 2 | D46: 3 | E46: =C46*6+D46 -> 15 | G46: 6 | H46: 6 | I46: =G46*6+H46 -> 42 | K46: 12 | L46: 11 | M46: =K46*6+L46 -> 83 | O46: 15 | P46: 15 | Q46: =O46*6+P46 -> 105 | S46: TOORAK PARK
A47: BRIGHTON | C47: 1 | D47: 3 | E47: =C47*6+D47 -> 9 | G47: 3 | H47: 7 | I47: =G47*6+H47 -> 25 | K47: 4 | L47: 11 | M47: =K47*6+L47 -> 35 | O47: 5 | P47: 15 | Q47: =O47*6+P47 -> 45 | S47: HERBERT
A48: BEST PLAYERS
A49: PRAHRAN | C49: McKENZIE | F49: DOWSING | I49: FANNING | L49: CARLSON | O49: MARONEY | R49: SYKES
A50: BRIGHTON | C50: DAWSON | F50: B BAILES | I50: DOWDING | L50: NEGRO | O50: TURNBULL | R50: SMITH
A51: GOALKICKERS
A52: PRAHRAN | C52: SYKES 5 | F52: McKENZIE 4 | I52: MARONEY 2 | L52: DAVIES 2 | O52: WOODHEAD | R52: FARMER
A53: BRIGHTON | C53: DOWDING 4 | G53: DAWSON
A55: ROUND 2 | E55: 3RD MAY | J55: WEATHER | M55: STRONG NORTH WEST WIND | S55: PLAYED AT | X55: LADDER | AB55: ROUND | AD55: 2
D56: 1ST QTR | H56: 2ND QTR | L56: 3RD QTR | P56: FINAL | S56: ESSENDON
A57: NORTH MELBOURNE | C57: 1 | D57: 3 | E57: =C57*6+D57 -> 9 | G57: 5 | H57: 7 | I57: =G57*6+H57 -> 37 | K57: 8 | L57: 9 | M57: =K57*6+L57 -> 57 | O57: 11 | P57: 12 | Q57: =O57*6+P57 -> 78 | S57: UMPIRE | W57: TEAM | X57: W | Y57: L | Z57: D | AA57: FOR | AB57: AGST | AC57: % | AD57: PTS
A58: ESSENDON ASSOC. | C58: 1 | D58: 3 | E58: =C58*6+D58 -> 9 | G58: 2 | H58: 4 | I58: =G58*6+H58 -> 16 | K58: 6 | L58: 6 | M58: =K58*6+L58 -> 42 | O58: 9 | P58: 8 | Q58: =O58*6+P58 -> 62 | S58: DEAN
A59: BEST PLAYERS | W59: PRAHRAN | X59: 2 | Y59: 0 | Z59: 0 | AA59: 205 | AB59: 90 | AC59: 227.77777777777777 | AD59: 8
A60: NORTH MELBOURNE | C60: ELLIOTT | F60: HARDY | H60: JONES | K60: S BARKER | N60: TRELOAR | Q60: SHEEHAN | W60: FOOTSCRAY | X60: 2 | Y60: 0 | Z60: 0 | AA60: 131 | AB60: 68 | AC60: 192.64705882352942 | AD60: 8
A61: ESSENDON ASSOC. | C61: J MADDEN | F61: DIGGLE | H61: COCKRAM | K61: P WALKER | N61: M MADDEN | Q61: J WALKER | W61: NORTH MELBOURNE | X61: 2 | Y61: 0 | Z61: 0 | AA61: 153 | AB61: 93 | AC61: 164.51612903225808 | AD61: 8
A62: GOALKICKERS | W62: BRUNSWICK | X62: 2 | Y62: 0 | Z62: 0 | AA62: 166 | AB62: 101 | AC62: 164.35643564356437 | AD62: 8
A63: NORTH MELBOURNE | C63: ELLIOTT 6 | F63: HARDY 3 | I63: HAWKINS | L63: TRELOAR
A64: ESSENDON ASSOC. | C64: CLARKE 3 | F64: SEVIOR 2 | I64: COCKRAM 2 | L64: DIGGLE | N64: WALL | W64: ESSENDON ASSOC. | X64: 1 | Y64: 1 | Z64: 0 | AA64: 122 | AB64: 113 | AC64: 107.96460176991151 | AD64: 4
W65: WILLIAMSTOWN | X65: 1 | Y65: 1 | Z65: 0 | AA65: 95 | AB65: 91 | AC65: 104.39560439560439 | AD65: 4
A66: WILLIAMSTOWN | C66: 2 | D66: 3 | E66: =C66*6+D66 -> 15 | G66: 3 | H66: 8 | I66: =G66*6+H66 -> 26 | K66: 4 | L66: 9 | M66: =K66*6+L66 -> 33 | O66: 7 | P66: 18 | Q66: =O66*6+P66 -> 60 | S66: WILLIAMSTOWN | W66: BRIGHTON | X66: 0 | Y66: 2 | Z66: 0 | AA66: 106 | AB66: 173 | AC66: 61.271676300578036 | AD66: 0
A67: NORTHCOTE | C67: 1 | D67: 0 | E67: =C67*6+D67 -> 6 | G67: 2 | H67: 4 | I67: =G67*6+H67 -> 16 | K67: 4 | L67: 6 | M67: =K67*6+L67 -> 30 | O67: 5 | P67: 7 | Q67: =O67*6+P67 -> 37 | S67: RAWLE | W67: NORTHCOTE | X67: 0 | Y67: 2 | Z67: 0 | AA67: 72 | AB67: 120 | AC67: 60 | AD67: 0
A68: BEST PLAYERS | W68: MELBOURNE CITY | X68: 0 | Y68: 2 | Z68: 0 | AA68: 76 | AB68: 175 | AC68: 43.428571428571431 | AD68: 0
A69: WILLIAMSTOWN | C69: REITMAN | F69: AMY | H69: GIBBS | K69: DOUGLAS | N69: HARRISON | Q69: McDONALD | W69: PORT MELBOURNE | X69: 0 | Y69: 2 | Z69: 0 | AA69: 73 | AB69: 175 | AC69: 41.714285714285715 | AD69: 0
A70: NORTHCOTE | C70: CHARGE | F70: WHITE | H70: BECK | K70: SWIFT | N70: MOORE | Q70: COLE
A71: GOALKICKERS
A72: WILLIAMSTOWN | C72: SINCLAIR 2 | F72: AMY 2 | I72: HARDEN | K72: GIBBS | M72: ADAMS
A73: NORTHCOTE | C73: CHARGE | F73: SWIFT | I73: MOORE | L73: BECK | N73: BRAID
A75: PRAHRAN | C75: 5 | D75: 2 | E75: =C75*6+D75 -> 32 | G75: 9 | H75: 4 | I75: =G75*6+H75 -> 58 | K75: 13 | L75: 9 | M75: =K75*6+L75 -> 87 | O75: 14 | P75: 16 | Q75: =O75*6+P75 -> 100 | S75: EMCG
A76: MELBOURNE CITY | C76: 0 | D76: 0 | E76: =C76*6+D76 -> 0 | G76: 3 | H76: 0 | I76: =G76*6+H76 -> 18 | K76: 5 | L76: 1 | M76: =K76*6+L76 -> 31 | O76: 7 | P76: 3 | Q76: =O76*6+P76 -> 45 | S76: KUMM
A77: BEST PLAYERS
A78: PRAHRAN | C78: BANT | F78: FARMER | I78: CAIN | K78: KERR | M78: SIMS | O78: SYKES
A79: MELBOURNE CITY | C79: PORTER | F79: QUINN | I79: KIKER | K79: BYRNE | M79: YATES | O79: PHILLIPS
A80: GOALKICKERS
A81: PRAHRAN | C81: SYKES 5 | E81: KERR 2 | G81: RYAN 2 | I81: CAIN | K81: WILSON | M81: DAVIS | O81: DOWSING | Q81: McKENZIE
A82: MELBOURNE CITY | C82: YATES 4 | F82: DANIELS | I82: KIKER | K82: GREENHILL
A84: FOOTSCRAY | C84: 2 | D84: 5 | E84: =C84*6+D84 -> 17 | G84: 4 | H84: 9 | I84: =G84*6+H84 -> 33 | K84: 6 | L84: 15 | M84: =K84*6+L84 -> 51 | O84: 10 | P84: 17 | Q84: =O84*6+P84 -> 77 | S84: PORT MELB
A85: PORT MELBOURNE | C85: 1 | D85: 3 | E85: =C85*6+D85 -> 9 | G85: 3 | H85: 5 | I85: =G85*6+H85 -> 23 | K85: 4 | L85: 7 | M85: =K85*6+L85 -> 31 | O85: 4 | P85: 9 | Q85: =O85*6+P85 -> 33 | S85: HURLEY
A86: BEST PLAYERS
A87: FOOTSCRAY | C87: McCLUSKY | F87: BAXTER | I87: GREGORY | L87: HOLMES | O87: COTTON | Q87: SPENCE
A88: PORT MELBOURNE | C88: ANDERSON | F88: BARFOOT | I88: FRANKLIN | L88: HENDRIE | O88: MERRICK | Q88: BROWN
A89: GOALKICKERS
A90: FOOTSCRAY | C90: BANBURY 4 | F90: BAXTER 3 | I90: SPENCE 2 | L90: CROUCH
A91: PORT MELBOURNE | C91: MERRICK 3 | F91: SMITH
A93: BRUNSWICK | C93: 0 | D93: 4 | E93: =C93*6+D93 -> 4 | G93: 5 | H93: 6 | I93: =G93*6+H93 -> 36 | K93: 8 | L93: 14 | M93: =K93*6+L93 -> 62 | O93: 8 | P93: 20 | Q93: =O93*6+P93 -> 68 | S93: BRIGHTON BEACH
A94: BRIGHTON | C94: 3 | D94: 2 | E94: =C94*6+D94 -> 20 | G94: 5 | H94: 4 | I94: =G94*6+H94 -> 34 | K94: 8 | L94: 4 | M94: =K94*6+L94 -> 52 | O94: 9 | P94: 7 | Q94: =O94*6+P94 -> 61 | S94: KENDALL
A95: BEST PLAYERS
A96: BRUNSWICK | C96: O'CONNOR | F96: CHANDLER | I96: STANCLIFFE | L96: HARKER | O96: GILLESPIE | R96: PARSONS
A97: BRIGHTON | C97: DAWSON | F97: GRAHAM | I97: B BAILES | L97: TURNBULL | O97: BURLEY | R97: HENDERSON
A98: GOALKICKERS
A99: BRUNSWICK | C99: HARKER 4 | F99: O'CONNOR 2 | J99: SULLIVAN | M99: ROSS
A100: BRIGHTON | C100: MARRIOTT 2 | F100: HENDERSON 2 | J100: DAWSON 2 | M100: HAZELL | O100: GRAHAM
A102: ROUND 3 | E102: 10TH MAY | J102: WEATHER | M102: WEST BREEZE FINE | S102: PLAYED AT | X102: LADDER | AB102: ROUND | AD102: 3
D103: 1ST QTR | H103: 2ND QTR | L103: 3RD QTR | P103: FINAL | S103: TOORAK PARK
A104: PRAHRAN | C104: 0 | D104: 3 | E104: =C104*6+D104 -> 3 | G104: 5 | H104: 6 | I104: =G104*6+H104 -> 36 | K104: 7 | L104: 10 | M104: =K104*6+L104 -> 52 | O104: 9 | P104: 15 | Q104: =O104*6+P104 -> 69 | S104: UMPIRE | W104: TEAM | X104: W | Y104: L | Z104: D | AA104: FOR | AB104: AGST | AC104: % | AD104: PTS
A105: ESSENDON ASSOC. | C105: 4 | D105: 6 | E105: =C105*6+D105 -> 30 | G105: 7 | H105: 6 | I105: =G105*6+H105 -> 48 | K105: 7 | L105: 6 | M105: =K105*6+L105 -> 48 | O105: 7 | P105: 8 | Q105: =O105*6+P105 -> 50 | S105: HURLEY
A106: BEST PLAYERS | W106: FOOTSCRAY | X106: 3 | Y106: 0 | Z106: 0 | AA106: 219 | AB106: 95 | AC106: 230.52631578947367 | AD106: 12
A107: PRAHRAN | C107: McKENZIE | F107: DOWSING | I107: MARONEY | L107: WOODHEAD | O107: KERR | Q107: CAIN | W107: PRAHRAN | X107: 3 | Y107: 0 | Z107: 0 | AA107: 274 | AB107: 140 | AC107: 195.71428571428572 | AD107: 12
A108: ESSENDON ASSOC. | C108: P WALKER | F108: GOUGH | I108: DIGGLE | L108: M MADDEN | O108: CLARKE | Q108: COCKRAM | W108: BRUNSWICK | X108: 3 | Y108: 0 | Z108: 0 | AA108: 255 | AB108: 140 | AC108: 182.14285714285714 | AD108: 12
A109: GOALKICKERS | W109: NORTH MELBOURNE | X109: 3 | Y109: 0 | Z109: 0 | AA109: 207 | AB109: 132 | AC109: 156.81818181818181 | AD109: 12
A110: PRAHRAN | C110: DAVIS 2 | F110: CAIN 2 | I110: WILSON 2 | L110: WEIDNER | O110: DOWSING | R110: SYKES
A111: ESSENDON ASSOC. | C111: CLARKE 3 | F111: GOUGH | I111: DIGGLE | L111: ORAM | N111: COCKRAM | W111: ESSENDON ASSOC. | X111: 1 | Y111: 2 | Z111: 0 | AA111: 172 | AB111: 182 | AC111: 94.505494505494511 | AD111: 4
W112: WILLIAMSTOWN | X112: 1 | Y112: 2 | Z112: 0 | AA112: 134 | AB112: 145 | AC112: 92.41379310344827 | AD112: 4
A113: NORTH MELBOURNE | C113: 2 | D113: 4 | E113: =C113*6+D113 -> 16 | G113: 4 | H113: 8 | I113: =G113*6+H113 -> 32 | K113: 4 | L113: 11 | M113: =K113*6+L113 -> 35 | O113: 6 | P113: 18 | Q113: =O113*6+P113 -> 54 | S113: NORTH MELB | W113: PORT MELBOURNE | X113: 1 | Y113: 2 | Z113: 0 | AA113: 147 | AB113: 246 | AC113: 59.756097560975611 | AD113: 4
A114: WILLIAMSTOWN | C114: 3 | D114: 2 | E114: =C114*6+D114 -> 20 | G114: 4 | H114: 2 | I114: =G114*6+H114 -> 26 | K114: 5 | L114: 3 | M114: =K114*6+L114 -> 33 | O114: 6 | P114: 3 | Q114: =O114*6+P114 -> 39 | S114: HERBERT | W114: BRIGHTON | X114: 0 | Y114: 3 | Z114: 0 | AA114: 177 | AB114: 247 | AC114: 71.659919028340084 | AD114: 0
A115: BEST PLAYERS | W115: NORTHCOTE | X115: 0 | Y115: 3 | Z115: 0 | AA115: 99 | AB115: 208 | AC115: 47.596153846153847 | AD115: 0
A116: NORTH MELBOURNE | C116: S BARKER | F116: HARDY | I116: HOPKINS | L116: HERON | N116: J JOHNSON | Q116: K JOHNSON | W116: MELBOURNE CITY | X116: 0 | Y116: 3 | Z116: 0 | AA116: 115 | AB116: 264 | AC116: 43.560606060606062 | AD116: 0
A117: WILLIAMSTOWN | C117: ALLEY | F117: HARDEN | I117: BARNES | L117: FERGUSON | O117: GIBBS | Q117: O'HALLORAN
A118: GOALKICKERS
A119: NORTH MELBOURNE | C119: ELLIOTT 2 | G119: KELLY 2 | K119: K JOHNSON
A120: WILLIAMSTOWN | C120: AMY 2 | F120: HARDN | I120: E BUSBRIDGE | L120: COWARD | O120: BARNES
A122: PORT MELBOURNE | C122: 0 | D122: 4 | E122: =C122*6+D122 -> 4 | G122: 4 | H122: 10 | I122: =G122*6+H122 -> 34 | K122: 6 | L122: 11 | M122: =K122*6+L122 -> 47 | O122: 10 | P122: 14 | Q122: =O122*6+P122 -> 74 | S122: BRIGHTON BEACH
A123: BRIGHTON | C123: 2 | D123: 3 | E123: =C123*6+D123 -> 15 | G123: 3 | H123: 4 | I123: =G123*6+H123 -> 22 | K123: 9 | L123: 8 | M123: =K123*6+L123 -> 62 | O123: 10 | P123: 11 | Q123: =O123*6+P123 -> 71 | S123: KENDALL
A124: BEST PLAYERS
A125: PORT MELBOURNE | C125: BROWN | F125: CLELAND | I125: ANDERSON | L125: COEN | N125: TREGLOWN | Q125: MERRICK
A126: BRIGHTON | C126: GRAHAM | F126: B BAILES | I126: E BAILES | L126: PEDDLE | N126: DAWSON | Q126: HAZELL
A127: GOALKICKERS
A128: PORT MELBOURNE | C128: BROWN 2 | E128: BARFOOT 2 | H128: ANDERSON | J128: CARDWELL | M128: HAIGHBLOOM | P128: TAYLOR | R128: MERRICK | U128: TREGLOWN
A129: BRIGHTON | C129: PEDDLE 2 | E129: HAZELL 2 | H129: TURNBULL | J129: DOWDING | M129: DAWSON | O129: B BAILES | Q129: E BAILES | T129: GRAHAM
A131: BRUNSWICK | C131: 4 | D131: 5 | E131: =C131*6+D131 -> 29 | G131: 6 | H131: 14 | I131: =G131*6+H131 -> 50 | K131: 8 | L131: 18 | M131: =K131*6+L131 -> 66 | O131: 11 | P131: 23 | Q131: =O131*6+P131 -> 89 | S131: BRUNSWICK
A132: MELBOURNE CITY | C132: 1 | D132: 3 | E132: =C132*6+D132 -> 9 | G132: 1 | H132: 5 | I132: =G132*6+H132 -> 11 | K132: 5 | L132: 3 | M132: =K132*6+L132 -> 33 | O132: 6 | P132: 3 | Q132: =O132*6+P132 -> 39 | S132: PAIN
A133: BEST PLAYERS
A134: BRUNSWICK | C134: O'CONNOR | F134: PARSONS | I134: PRICE | L134: STANCLIFFE | O134: McKENZIE | R134: SULLIVAN
A135: MELBOURNE CITY | C135: KIKER | F135: PORTER | I135: PHILLIPS | L135: RYAN | O135: W SMITH | R135: BIGNELL
A136: GOALKICKERS
A137: BRUNSWICK | C137: FREEMAN 2 | F137: STEVENSON 2 | I137: PRICE | K137: STANCLIFFE | N137: HARKER | P137: McKENZIE | R137: O'CONNOR | W137: WILLIS | X137: SULLIVAN
A138: MELBOURNE CITY | C138: PRATT 3 | F138: YORTSON 2 | J138: KIKER
A140: FOOTSCRAY | C140: 4 | D140: 6 | E140: =C140*6+D140 -> 30 | G140: 7 | H140: 7 | I140: =G140*6+H140 -> 49 | K140: 10 | L140: 15 | M140: =K140*6+L140 -> 75 | O140: 12 | P140: 16 | Q140: =O140*6+P140 -> 88 | S140: FOOTSCRAY
A141: NORTHCOTE | C141: 1 | D141: 0 | E141: =C141*6+D141 -> 6 | G141: 3 | H141: 0 | I141: =G141*6+H141 -> 18 | K141: 3 | L141: 0 | M141: =K141*6+L141 -> 18 | O141: 4 | P141: 3 | Q141: =O141*6+P141 -> 27 | S141: CHISHOLM
A142: BEST PLAYERS
A143: FOOTSCRAY | C143: MIDDLETON | F143: LAWSON | I143: COTTON | L143: CROUCH | O143: McCLUSKY | R143: SAMSON
A144: NORTHCOTE | C144: H THOMAS | F144: BASSETT | I144: SMITH | L144: JOHNSON | O144: COLE | R144: RIDD
A145: GOALKICKERS
A146: FOOTSCRAY | C146: COTTON 3 | F146: BAXTER 2 | I146: GREGORY 2 | L146: BANBURY 2 | O146: HOLMES | Q146: LAWSON | S146: CROUCH
A147: NORTHCOTE | C147: RIDD 2 | F147: WHITE | I147: JOHNSON
A149: ROUND 4 | E149: 17TH MAY | J149: WEATHER | M149: SOUTH BREEZE FINE | S149: PLAYED AT | X149: LADDER | AB149: ROUND | AD149: 4
D150: 1ST QTR | H150: 2ND QTR | L150: 3RD QTR | P150: FINAL | S150: TOORAK PARK
A151: PRAHRAN | C151: 2 | D151: 0 | E151: =C151*6+D151 -> 12 | G151: 4 | H151: 3 | I151: =G151*6+H151 -> 27 | K151: 5 | L151: 7 | M151: =K151*6+L151 -> 37 | O151: 6 | P151: 9 | Q151: =O151*6+P151 -> 45 | S151: UMPIRE | W151: TEAM | X151: W | Y151: L | Z151: D | AA151: FOR | AB151: AGST | AC151: % | AD151: PTS
A152: BRUNSWICK | C152: 1 | D152: 3 | E152: =C152*6+D152 -> 9 | G152: 2 | H152: 5 | I152: =G152*6+H152 -> 17 | K152: 3 | L152: 10 | M152: =K152*6+L152 -> 28 | O152: 5 | P152: 12 | Q152: =O152*6+P152 -> 42 | S152: RAWLE
A153: BEST PLAYERS | W153: FOOTSCRAY | X153: 4 | Y153: 0 | Z153: 0 | AA153: 281 | AB153: 146 | AC153: 192.46575342465752 | AD153: 16
A154: PRAHRAN | C154: BANT | F154: SYKES | I154: WEIDNER | L154: MARONEY | O154: DOWSING | Q154: WOODHEAD | W154: PRAHRAN | X154: 4 | Y154: 0 | Z154: 0 | AA154: 319 | AB154: 182 | AC154: 175.27472527472528 | AD154: 16
A155: BRUNSWICK | C155: McKENZIE | F155: CHANDLER | I155: WILLIS | L155: BRAID | O155: MILLS | Q155: ROSS | W155: BRUNSWICK | X155: 3 | Y155: 1 | Z155: 0 | AA155: 297 | AB155: 185 | AC155: 160.54054054054055 | AD155: 12
A156: GOALKICKERS | W156: NORTH MELBOURNE | X156: 3 | Y156: 1 | Z156: 0 | AA156: 258 | AB156: 194 | AC156: 132.98969072164948 | AD156: 12
A157: PRAHRAN | C157: McKENZIE 2 | F157: SYKES 2 | I157: CAIN | K157: FARMER
A158: BRUNSWICK | C158: STEVENSON 3 | G158: HARKER | J158: BRAID | W158: WILLIAMSTOWN | X158: 2 | Y158: 2 | Z158: 0 | AA158: 227 | AB158: 195 | AC158: 116.41025641025641 | AD158: 8
W159: ESSENDON ASSOC. | X159: 2 | Y159: 2 | Z159: 0 | AA159: 244 | AB159: 238 | AC159: 102.52100840336135 | AD159: 8
A160: FOOTSCRAY | C160: 2 | D160: 1 | E160: =C160*6+D160 -> 13 | G160: 4 | H160: 6 | I160: =G160*6+H160 -> 30 | K160: 7 | L160: 6 | M160: =K160*6+L160 -> 48 | O160: 8 | P160: 14 | Q160: =O160*6+P160 -> 62 | S160: FOOTSCRAY | W160: BRIGHTON | X160: 1 | Y160: 3 | Z160: 0 | AA160: 258 | AB160: 316 | AC160: 81.64556962025317 | AD160: 4
A161: NORTH MELBOURNE | C161: 3 | D161: 3 | E161: =C161*6+D161 -> 21 | G161: 4 | H161: 3 | I161: =G161*6+H161 -> 27 | K161: 7 | L161: 6 | M161: =K161*6+L161 -> 48 | O161: 7 | P161: 9 | Q161: =O161*6+P161 -> 51 | S161: PORTEOUS | W161: PORT MELBOURNE | X161: 1 | Y161: 3 | Z161: 0 | AA161: 203 | AB161: 318 | AC161: 63.836477987421382 | AD161: 4
A162: BEST PLAYERS | W162: NORTHCOTE | X162: 0 | Y162: 4 | Z162: 0 | AA162: 168 | AB162: 289 | AC162: 58.131487889273359 | AD162: 0
A163: FOOTSCRAY | C163: SAMSON | F163: McCLUSKY | I163: BRIESE | L163: CRADDOCK | O163: GREGORY | Q163: HOLMES | W163: MELBOURNE CITY | X163: 0 | Y163: 4 | Z163: 0 | AA163: 165 | AB163: 357 | AC163: 46.218487394957982 | AD163: 0
A164: NORTH MELBOURNE | C164: HARDY | F164: BARKER | I164: HOPKINS | L164: JONES | O164: RAWLE | Q164: PEMBERTON
A165: GOALKICKERS
A166: FOOTSCRAY | C166: GREGORY 2 | F166: BANBURY 2 | I166: BAXTER | K166: HOLMES | M166: CROUCH | O166: BRIESE
A167: NORTH MELBOURNE | C167: BARKER 2 | F167: JOHNSON 2 | I167: ELLIOTT | K167: HARDY | M167: WOODINGTON
A169: ESSENDON ASSOC. | C169: 2 | D169: 8 | E169: =C169*6+D169 -> 20 | G169: 3 | H169: 11 | I169: =G169*6+H169 -> 29 | K169: 5 | L169: 13 | M169: =K169*6+L169 -> 43 | O169: 9 | P169: 18 | Q169: =O169*6+P169 -> 72 | S169: ESSENDON
A170: PORT MELBOURNE | C170: 0 | D170: 2 | E170: =C170*6+D170 -> 2 | G170: 1 | H170: 5 | I170: =G170*6+H170 -> 11 | K170: 3 | L170: 7 | M170: =K170*6+L170 -> 25 | O170: 8 | P170: 8 | Q170: =O170*6+P170 -> 56 | S170: KENDALL
A171: BEST PLAYERS
A172: ESSENDON ASSOC. | C172: ATKINS | F172: SEVIOR | I172: GIBSON | K172: HOARE | M172: McINTYRE | P172: DIGGLE
A173: PORT MELBOURNE | C173: FRANKLIN | F173: BROWN | I173: BARFOOT | K173: HAIGHBLOOM | N173: ANDERSON | Q173: TREGLOWN
A174: GOALKICKERS
A175: ESSENDON ASSOC. | C175: CLARKE 7 | F175: SEVIOR | I175: HARRIS
A176: PORT MELBOURNE | C176: HEALY 2 | F176: TREGLOWN | I176: WORKMAN | L176: TAYLOR | N176: HAYES | P176: ANDERSON
A178: BRIGHTON | C178: 6 | D178: 5 | E178: =C178*6+D178 -> 41 | G178: 9 | H178: 9 | I178: =G178*6+H178 -> 63 | K178: 9 | L178: 11 | M178: =K178*6+L178 -> 65 | O178: 11 | P178: 15 | Q178: =O178*6+P178 -> 81 | S178: CROXTON PK
A179: NORTHCOTE | C179: 2 | D179: 2 | E179: =C179*6+D179 -> 14 | G179: 5 | H179: 5 | I179: =G179*6+H179 -> 35 | K179: 9 | L179: 7 | M179: =K179*6+L179 -> 61 | O179: 10 | P179: 9 | Q179: =O179*6+P179 -> 69 | S179: HURLEY
A180: BEST PLAYERS
A181: BRIGHTON | C181: DAWSON | F181: B BAILES | I181: NEGRO | K181: TURNBULL | N181: BELLER | Q181: DOWDING
A182: NORTHCOTE | C182: RYAN | F182: RIDD | I182: SWIFT | K182: MOORE | N182: PAYNTER | Q182: BRAID
A183: GOALKICKERS
A184: BRIGHTON | C184: DAWSON 3 | F184: PEDDLE 2 | I184: PLAYLE | K184: DOWDING | M184: GREGSON | O184: BELLER | Q184: HENDERSON | T184: TURNBULL
A185: NORTHCOTE | C185: RIDD 5
A187: WILLIAMSTOWN | C187: 5 | D187: 1 | E187: =C187*6+D187 -> 31 | G187: 9 | H187: 6 | I187: =G187*6+H187 -> 60 | K187: 12 | L187: 8 | M187: =K187*6+L187 -> 80 | O187: 14 | P187: 9 | Q187: =O187*6+P187 -> 93 | S187: WILLIAMSTOWN
A188: MELBOURNE CITY | C188: 0 | D188: 1 | E188: =C188*6+D188 -> 1 | G188: 3 | H188: 2 | I188: =G188*6+H188 -> 20 | K188: 4 | L188: 3 | M188: =K188*6+L188 -> 27 | O188: 7 | P188: 8 | Q188: =O188*6+P188 -> 50 | S188: HERBERT
A189: BEST PLAYERS
A190: WILLIAMSTOWN | C190: COWARD | F190: AMY | H190: GIBBS | J190: McTAGGART | M190: N BUSBRIDGE | Q190: WALLIS
A191: MELBOURNE CITY | C191: DANIELS | F191: BYRNE | H191: PHILLIPS | J191: BIGNELL | M191: PORTER | Q191: WALLACE
A192: GOALKICKERS
A193: WILLIAMSTOWN | C193: COWARD 5 | F193: BARNES 3
A194: MELBOURNE CITY | C194: DANIELS 3 | F194: TEAGUE 2
A196: ROUND 5 | E196: 24TH MAY | J196: WEATHER | M196: NORTH WEST WIND | S196: PLAYED AT | X196: LADDER | AB196: ROUND | AD196: 5
D197: 1ST QTR | H197: 2ND QTR | L197: 3RD QTR | P197: FINAL | S197: BRUNSWICK
A198: FOOTSCRAY | C198: 1 | D198: 5 | E198: =C198*6+D198 -> 11 | G198: 3 | H198: 7 | I198: =G198*6+H198 -> 25 | K198: 9 | L198: 13 | M198: =K198*6+L198 -> 67 | O198: 9 | P198: 18 | Q198: =O198*6+P198 -> 72 | S198: UMPIRE | W198: TEAM | X198: W | Y198: L | Z198: D | AA198: FOR | AB198: AGST | AC198: % | AD198: PTS
A199: BRUNSWICK | C199: 1 | D199: 3 | E199: =C199*6+D199 -> 9 | G199: 3 | H199: 9 | I199: =G199*6+H199 -> 27 | K199: 5 | L199: 9 | M199: =K199*6+L199 -> 39 | O199: 5 | P199: 11 | Q199: =O199*6+P199 -> 41 | S199: KENDALL
A200: BEST PLAYERS | W200: FOOTSCRAY | X200: 5 | Y200: 0 | Z200: 0 | AA200: 353 | AB200: 187 | AC200: 188.77005347593584 | AD200: 20
A201: FOOTSCRAY | C201: McCLUSKY | F201: CRADDOCK | I201: SPENCE | K201: BAXTER | N201: NEILSON | Q201: BANBURY | W201: PRAHRAN | X201: 5 | Y201: 0 | Z201: 0 | AA201: 407 | AB201: 238 | AC201: 171.00840336134453 | AD201: 20
A202: BRUNSWICK | C202: ROSS | F202: GIBSON | I202: BRAID | K202: HARKER | N202: CHANDLER | Q202: O'CONNOR | W202: NORTH MELBOURNE | X202: 4 | Y202: 1 | Z202: 0 | AA202: 333 | AB202: 251 | AC202: 132.66932270916334 | AD202: 16
A203: GOALKICKERS | W203: BRUNSWICK | X203: 3 | Y203: 2 | Z203: 0 | AA203: 338 | AB203: 257 | AC203: 131.51750972762645 | AD203: 12
A204: FOOTSCRAY | C204: BAXTER 2 | F204: BANBURY 2 | I204: GREGORY | K204: CLARK | M204: LAWSON | O204: BRIESE | Q204: HOLMES
A205: BRUNSWICK | C205: HARKER 2 | F205: CHANDLER | I205: BENNIE | K205: STEVENSON | W205: ESSENDON ASSOC. | X205: 3 | Y205: 2 | Z205: 0 | AA205: 308 | AB205: 278 | AC205: 110.79136690647482 | AD205: 12
W206: WILLIAMSTOWN | X206: 2 | Y206: 3 | Z206: 0 | AA206: 283 | AB206: 283 | AC206: 100 | AD206: 8
A207: PRAHRAN | C207: 2 | D207: 0 | E207: =C207*6+D207 -> 12 | G207: 4 | H207: 6 | I207: =G207*6+H207 -> 30 | K207: 7 | L207: 8 | M207: =K207*6+L207 -> 50 | O207: 13 | P207: 10 | Q207: =O207*6+P207 -> 88 | S207: TOORAK PARK | W207: BRIGHTON | X207: 1 | Y207: 4 | Z207: 0 | AA207: 315 | AB207: 391 | AC207: 80.562659846547319 | AD207: 4
A208: WILLIAMSTOWN | C208: 4 | D208: 3 | E208: =C208*6+D208 -> 27 | G208: 6 | H208: 4 | I208: =G208*6+H208 -> 40 | K208: 6 | L208: 7 | M208: =K208*6+L208 -> 43 | O208: 8 | P208: 8 | Q208: =O208*6+P208 -> 56 | S208: HURLEY | W208: PORT MELBOURNE | X208: 1 | Y208: 4 | Z208: 0 | AA208: 256 | AB208: 374 | AC208: 68.44919786096257 | AD208: 4
A209: BEST PLAYERS | W209: NORTHCOTE | X209: 1 | Y209: 4 | Z209: 0 | AA209: 224 | AB209: 342 | AC209: 65.497076023391813 | AD209: 4
A210: PRAHRAN | C210: MARONEY | F210: WEIDNER | I210: FARMER | K210: CARLSON | N210: SYKES | Q210: KERR | W210: MELBOURNE CITY | X210: 0 | Y210: 5 | Z210: 0 | AA210: 205 | AB210: 421 | AC210: 48.693586698337292 | AD210: 0
A211: WILLIAMSTOWN | C211: GIBBS | F211: REITMAN | I211: ANDERSON | K211: N BUSBRIDGE | N211: COWARD | Q211: McTAGGART
A212: GOALKICKERS
A213: PRAHRAN | C213: SYKES 3 | F213: DOWSING 2 | I213: KERR 2 | K213: FARMER 2 | N213: WILSON | P213: WEIDNER | R213: MARONEY | U213: DAVIS
A214: WILLIAMSTOWN | C214: GIBBS 4 | F214: COWARD 2 | I214: AMY | K214: McTAGGART
A216: NORTH MELBOURNE | C216: 4 | D216: 4 | E216: =C216*6+D216 -> 28 | G216: 6 | H216: 6 | I216: =G216*6+H216 -> 42 | K216: 8 | L216: 8 | M216: =K216*6+L216 -> 56 | O216: 11 | P216: 9 | Q216: =O216*6+P216 -> 75 | S216: NORTH MELB
A217: BRIGHTON | C217: 2 | D217: 3 | E217: =C217*6+D217 -> 15 | G217: 2 | H217: 8 | I217: =G217*6+H217 -> 20 | K217: 2 | L217: 12 | M217: =K217*6+L217 -> 24 | O217: 7 | P217: 15 | Q217: =O217*6+P217 -> 57 | S217: PAIN
A218: BEST PLAYERS
A219: NORTH MELBOURNE | C219: HARDY | F219: HOPKINS | I219: BARKER | L219: K JOHNSON | O219: TRELOAR | R219: LAVER
A220: BRIGHTON | C220: PEDDLE | F220: B BAILES | I220: DAWSON | L220: PATTERSON | O220: CLARKE | R220: TURNBULL
A221: GOALKICKERS
A222: NORTH MELBOURNE | C222: ELLIOTT 4 | F222: ROACH 3 | I222: HARDY 2 | L222: K JOHNSON | O222: WILLIAMSON
A223: BRIGHTON | C223: DOWDING 2 | F223: PEDDLE | I223: B BAILES | L223: DAWSON | O223: GREGSON
A225: NORTHCOTE | C225: 0 | D225: 2 | E225: =C225*6+D225 -> 2 | G225: 3 | H225: 10 | I225: =G225*6+H225 -> 28 | K225: 5 | L225: 13 | M225: =K225*6+L225 -> 43 | O225: 7 | P225: 14 | Q225: =O225*6+P225 -> 56 | S225: PORT MELB
A226: PORT MELBOURNE | C226: 4 | D226: 6 | E226: =C226*6+D226 -> 30 | G226: 6 | H226: 6 | I226: =G226*6+H226 -> 42 | K226: 6 | L226: 10 | M226: =K226*6+L226 -> 46 | O226: 7 | P226: 11 | Q226: =O226*6+P226 -> 53 | S226: McMURRAY
A227: BEST PLAYERS
A228: NORTHCOTE | C228: SWIFT | F228: H THOMAS | I228: BASSETT | L228: S HALL | O228: CLEMENTS | R228: MOORE
A229: PORT MELBOURNE | C229: FRANKLIN | F229: SAMSON | I229: HAIGHBLOOM | L229: CARDEN | O229: MERRICK | R229: ANDERSON
A230: GOALKICKERS
A231: NORTHCOTE | C231: RIDD 2 | F231: CLEMENTS 2 | I231: BRAID | K231: SWIFT | M231: NEWBOULD
A232: PORT MELBOURNE | C232: STEELE 2 | F232: MERRICK | I232: TREGLOWN | L232: HEWLETT | N232: HAIGHBLOOM | Q232: HEALY
A234: ESSENDON ASSOC. | C234: 2 | D234: 2 | E234: =C234*6+D234 -> 14 | G234: 5 | H234: 9 | I234: =G234*6+H234 -> 39 | K234: 7 | L234: 13 | M234: =K234*6+L234 -> 55 | O234: 8 | P234: 16 | Q234: =O234*6+P234 -> 64 | S234: EMCG
A235: MELBOURNE CITY | C235: 0 | D235: 5 | E235: =C235*6+D235 -> 5 | G235: 1 | H235: 6 | I235: =G235*6+H235 -> 12 | K235: 3 | L235: 8 | M235: =K235*6+L235 -> 26 | O235: 5 | P235: 10 | Q235: =O235*6+P235 -> 40 | S235: DEANE
A236: BEST PLAYERS
A237: ESSENDON ASSOC. | C237: DIGGLE | F237: CLARKE | I237: GIBSON | K237: COCKRAM | N237: HARRIS | Q237: M MADDEN
A238: MELBOURNE CITY | C238: PHILLIPS | F238: KIKER | I238: SMITH | K238: PRATT | N238: BIGNELL | Q238: WALLACE
A239: GOALKICKERS
A240: ESSENDON ASSOC. | C240: CLARKE 5 | F240: HOARE 2 | I240: DIGGLE
A241: MELBOURNE CITY | C241: CLARKE 2 | F241: N SMITH | I241: DANIELS | L241: PRATT
A243: ROUND 6 | E243: 31ST MAY | G243: WEATHER | J243: SOUTH WIND HEAVY RAIN GROUNDS WATERLOGGED | S243: PLAYED AT | X243: LADDER | AB243: ROUND | AD243: 6
D244: 1ST QTR | H244: 2ND QTR | L244: 3RD QTR | P244: FINAL | S244: WILLIAMSTOWN
A245: WILLIAMSTOWN | C245: 0 | D245: 1 | E245: =C245*6+D245 -> 1 | G245: 2 | H245: 3 | I245: =G245*6+H245 -> 15 | K245: 2 | L245: 3 | M245: =K245*6+L245 -> 15 | O245: 5 | P245: 3 | Q245: =O245*6+P245 -> 33 | S245: UMPIRE | W245: TEAM | X245: W | Y245: L | Z245: D | AA245: FOR | AB245: AGST | AC245: % | AD245: PTS
A246: BRUNSWICK | C246: 2 | D246: 3 | E246: =C246*6+D246 -> 15 | G246: 2 | H246: 3 | I246: =G246*6+H246 -> 15 | K246: 4 | L246: 6 | M246: =K246*6+L246 -> 30 | O246: 4 | P246: 6 | Q246: =O246*6+P246 -> 30 | S246: KENDALL
A247: BEST PLAYERS | W247: PRAHRAN | X247: 6 | Y247: 0 | Z247: 0 | AA247: 454 | AB247: 266 | AC247: 170.6766917293233 | AD247: 24
A248: WILLIAMSTOWN | C248: ALLEY | F248: REITMAN | I248: McDONALD | L248: O'HALLORAN | O248: FERGUSON | Q248: E BUSBRIDGE | W248: FOOTSCRAY | X248: 5 | Y248: 1 | Z248: 0 | AA248: 378 | AB248: 216 | AC248: 175 | AD248: 20
A249: BRUNSWICK | C249: McKENZIE | F249: L BRAID | I249: HARKER | L249: CARRIE | O249: O'CONNOR | Q249: GILLESPIE | W249: NORTH MELBOURNE | X249: 5 | Y249: 1 | Z249: 0 | AA249: 391 | AB249: 276 | AC249: 141.66666666666666 | AD249: 20
A250: GOALKICKERS | W250: ESSENDON ASSOC. | X250: 4 | Y250: 2 | Z250: 0 | AA250: 337 | AB250: 303 | AC250: 111.22112211221122 | AD250: 16
A251: WILLIAMSTOWN | C251: E BUSBRIDGE 2 | G251: COWARD | I251: AMY | K251: O'HALLORAN
A252: BRUNSWICK | C252: HARKER 2 | F252: L BRAID | I252: STEVENSON | W252: BRUNSWICK | X252: 3 | Y252: 3 | Z252: 0 | AA252: 368 | AB252: 290 | AC252: 126.89655172413794 | AD252: 12
W253: WILLIAMSTOWN | X253: 3 | Y253: 3 | Z253: 0 | AA253: 316 | AB253: 313 | AC253: 100.95846645367412 | AD253: 12
A254: ESSENDON ASSOC. | C254: 1 | D254: 2 | E254: =C254*6+D254 -> 8 | G254: 3 | H254: 3 | I254: =G254*6+H254 -> 21 | K254: 3 | L254: 3 | M254: =K254*6+L254 -> 21 | O254: 4 | P254: 5 | Q254: =O254*6+P254 -> 29 | S254: ESSENDON | W254: BRIGHTON | X254: 2 | Y254: 4 | Z254: 0 | AA254: 356 | AB254: 405 | AC254: 87.901234567901241 | AD254: 8
A255: FOOTSCRAY | C255: 0 | D255: 1 | E255: =C255*6+D255 -> 1 | G255: 1 | H255: 3 | I255: =G255*6+H255 -> 9 | K255: 3 | L255: 6 | M255: =K255*6+L255 -> 24 | O255: 3 | P255: 7 | Q255: =O255*6+P255 -> 25 | S255: KAMM | W255: PORT MELBOURNE | X255: 1 | Y255: 5 | Z255: 0 | AA255: 284 | AB255: 421 | AC255: 67.458432304037999 | AD255: 4
A256: BEST PLAYERS | W256: NORTHCOTE | X256: 1 | Y256: 5 | Z256: 0 | AA256: 249 | AB256: 400 | AC256: 62.25 | AD256: 4
A257: ESSENDON ASSOC. | C257: M MADDEN | F257: DIGLLE | I257: HOARE | L257: J MADDEN | O257: ATKINS | R257: CLARKE | W257: MELBOURNE CITY | X257: 0 | Y257: 6 | Z257: 0 | AA257: 219 | AB257: 462 | AC257: 47.402597402597401 | AD257: 0
A258: FOOTSCRAY | C258: COTTON | F258: BAXTER | I258: WEBB | L258: CLARK | O258: CRADDOCK | R258: HARRIS
A259: GOALKICKERS
A260: ESSENDON ASSOC. | C260: CLARKE 2 | F260: HOARE | I260: SEVIOR
A261: FOOTSCRAY | C261: BANBURY | F261: HOLMES | I261: SPENCE
A263: PRAHRAN | C263: 4 | D263: 1 | E263: =C263*6+D263 -> 25 | G263: 5 | H263: 2 | I263: =G263*6+H263 -> 32 | K263: 7 | L263: 4 | M263: =K263*6+L263 -> 46 | O263: 7 | P263: 5 | Q263: =O263*6+P263 -> 47 | S263: PORT MELB
A264: PORT MELBOURNE | C264: 0 | D264: 1 | E264: =C264*6+D264 -> 1 | G264: 1 | H264: 1 | I264: =G264*6+H264 -> 7 | K264: 1 | L264: 1 | M264: =K264*6+L264 -> 7 | O264: 4 | P264: 4 | Q264: =O264*6+P264 -> 28 | S264: HURLEY
A265: BEST PLAYERS
A266: PRAHRAN | C266: MARONEY | F266: WEIDNER | I266: DOWSING | L266: D RYAN | O266: WILSON | R266: WOODHEAD
A267: PORT MELBOURNE | C267: BROWN | F267: BARFOOT | I267: SAMSON | L267: MERRICK | O267: ANDERSON | R267: HAIGHBLOOM
A268: GOALKICKERS
A269: PRAHRAN | C269: H WILSON 2 | F269: MARONEY 2 | I269: D RYAN 2 | L269: SYKES
A270: PORT MELBOURNE | C270: BROWN 2 | F270: WORKMAN | I270: HAIGHBLOOM
A272: NORTH MELBOURNE | C272: 1 | D272: 1 | E272: =C272*6+D272 -> 7 | G272: 4 | H272: 3 | I272: =G272*6+H272 -> 27 | K272: 7 | L272: 6 | M272: =K272*6+L272 -> 48 | O272: 8 | P272: 10 | Q272: =O272*6+P272 -> 58 | S272: CROXTON PK
A273: NORTHCOTE | C273: 0 | D273: 1 | E273: =C273*6+D273 -> 1 | G273: 0 | H273: 2 | I273: =G273*6+H273 -> 2 | K273: 2 | L273: 3 | M273: =K273*6+L273 -> 15 | O273: 3 | P273: 7 | Q273: =O273*6+P273 -> 25 | S273: CHISHOLM
A274: BEST PLAYERS
A275: NORTH MELBOURNE | C275: HOPKINS | F275: BARKER | I275: NALDER | L275: HARDY | O275: PEMBERTON | R275: JONES
A276: NORTHCOTE | C276: NEWBOULD | F276: COLE | I276: HALL | L276: SMITH | O276: SWIFT | R276: MOORE
A277: GOALKICKERS
A278: NORTH MELBOURNE | C278: ELLIOTT 4 | F278: SHEEHAN | I278: BARKER | K278: K JOHNSON | N278: WILLIAMSON
A279: NORTHCOTE | C279: BASSETT | F279: NEWBOULD | I279: COLE
A281: BRIGHTON | C281: 2 | D281: 3 | E281: =C281*6+D281 -> 15 | G281: 5 | H281: 11 | I281: =G281*6+H281 -> 41 | M281: =J693*6+K693 -> 0 | O281: 5 | P281: 11 | Q281: =O281*6+P281 -> 41 | S281: BRIGHTON BEACH | W281: * MATCH ABANDONED 1/2 TIME
A282: MELBOURNE CITY | C282: 2 | D282: 2 | E282: =C282*6+D282 -> 14 | G282: 2 | H282: 2 | I282: =G282*6+H282 -> 14 | M282: =N693*6+O693 -> 0 | O282: 2 | P282: 2 | Q282: =O282*6+P282 -> 14 | S282: RAWLE | W282: MELBOURNE CITY RETIRED
A283: BEST PLAYERS | W283: ON ACCOUNT OF BAD CONDITIONS
A284: BRIGHTON | C284: B BAILES | F284: TURNBULL | I284: HENDERSON | L284: NEGRO | O284: PATTERSON | R284: BELLER | W284: MATCH AWARDED TO BRIGHTON
A285: MELBOURNE CITY | C285: WILSON | F285: PHILLIPS | I285: PORTER | L285: GREENHILL | O285: WALLACE | R285: PRATT
A286: GOALKICKERS
A287: BRIGHTON | C287: TURNBULL 2 | F287: DOWDING | I287: BELLER | L287: COMER
A288: MELBOURNE CITY | C288: PHILLIPS | F288: WILSON
A290: ROUND 7 | E290: 7TH JUNE | S290: PLAYED AT | X290: LADDER | AB290: ROUND | AD290: 7
D291: 1ST QTR | H291: 2ND QTR | L291: 3RD QTR | P291: FINAL | S291: TOORAK PARK
A292: NORTH MELBOURNE | C292: 2 | D292: 7 | E292: =C292*6+D292 -> 19 | G292: 5 | H292: 13 | I292: =G292*6+H292 -> 43 | K292: 9 | L292: 16 | M292: =K292*6+L292 -> 70 | O292: 11 | P292: 18 | Q292: =O292*6+P292 -> 84 | S292: UMPIRE | W292: TEAM | X292: W | Y292: L | Z292: D | AA292: FOR | AB292: AGST | AC292: % | AD292: PTS
A293: PRAHRAN | C293: 2 | D293: 0 | E293: =C293*6+D293 -> 12 | G293: 3 | H293: 2 | I293: =G293*6+H293 -> 20 | K293: 4 | L293: 3 | M293: =K293*6+L293 -> 27 | O293: 7 | P293: 9 | Q293: =O293*6+P293 -> 51 | S293: PORTEOUS
A294: BEST PLAYERS | W294: FOOTSCRAY | X294: 6 | Y294: 1 | Z294: 0 | AA294: 487 | AB294: 254 | AC294: 191.73228346456693 | AD294: 24
A295: NORTH MELBOURNE | C295: BARKER | F295: HOPKINS | I295: HARDY | K295: K JOHNSON | N295: RAWLE | Q295: PEMBERTON | W295: NORTH MELBOURNE | X295: 6 | Y295: 1 | Z295: 0 | AA295: 475 | AB295: 327 | AC295: 145.25993883792049 | AD295: 24
A296: PRAHRAN | C296: FARMER | F296: G JOHNSON | I296: W RYAN | K296: BANT | N296: WEIDNER | Q296: KERR | W296: PRAHRAN | X296: 6 | Y296: 1 | Z296: 0 | AA296: 505 | AB296: 350 | AC296: 144.28571428571428 | AD296: 24
A297: GOALKICKERS | W297: ESSENDON ASSOC. | X297: 5 | Y297: 2 | Z297: 0 | AA297: 390 | AB297: 354 | AC297: 110.16949152542372 | AD297: 20
A298: NORTH MELBOURNE | C298: ELLIOTT 4 | F298: BARKER 3 | I298: HARDY 2 | L298: RAWLE | N298: K JOHNSON
A299: PRAHRAN | C299: SYKES 2 | F299: MARONEY | I299: CAIN | K299: WILSON | M299: DOWSING | O299: WOODHEAD | W299: BRUNSWICK | X299: 4 | Y299: 3 | Z299: 0 | AA299: 468 | AB299: 350 | AC299: 133.71428571428572 | AD299: 16
W300: WILLIAMSTOWN | X300: 4 | Y300: 3 | Z300: 0 | AA300: 413 | AB300: 344 | AC300: 120.05813953488372 | AD300: 16
A301: ESSENDON ASSOC. | C301: 0 | D301: 5 | E301: =C301*6+D301 -> 5 | G301: 1 | H301: 8 | I301: =G301*6+H301 -> 14 | K301: 4 | L301: 15 | M301: =K301*6+L301 -> 39 | O301: 6 | P301: 17 | Q301: =O301*6+P301 -> 53 | S301: BRIGHTON BEACH | W301: BRIGHTON | X301: 2 | Y301: 5 | Z301: 0 | AA301: 407 | AB301: 458 | AC301: 88.864628820960704 | AD301: 8
A302: BRIGHTON | C302: 4 | D302: 1 | E302: =C302*6+D302 -> 25 | G302: 5 | H302: 4 | I302: =G302*6+H302 -> 34 | K302: 5 | L302: 6 | M302: =K302*6+L302 -> 36 | O302: 7 | P302: 9 | Q302: =O302*6+P302 -> 51 | S302: KENDALL | W302: NORTHCOTE | X302: 1 | Y302: 6 | Z302: 0 | AA302: 309 | AB302: 500 | AC302: 61.8 | AD302: 4
A303: BEST PLAYERS | W303: PORT MELBOURNE | X303: 1 | Y303: 6 | Z303: 0 | AA303: 315 | AB303: 518 | AC303: 60.810810810810814 | AD303: 4
A304: ESSENDON ASSOC. | C304: GOUGH | F304: ATKINS | I304: McPHILLIPS | L304: M MADDEN | O304: SCOTT | Q304: HOARE | W304: MELBOURNE CITY | X304: 0 | Y304: 7 | Z304: 0 | AA304: 257 | AB304: 571 | AC304: 45.008756567425571 | AD304: 0
A305: BRIGHTON | C305: CLARKE | F305: GRAHAM | I305: DAWSON | L305: B BAILES | O305: DOWDING | Q305: COLVIN
A306: GOALKICKERS
A307: ESSENDON ASSOC. | C307: GOUGH 3 | F307: ATKINS 2 | I307: CLARKE
A308: BRIGHTON | C308: PEDDLE 2 | F308: PLAYLE 2 | I308: DAWSON | K308: BELLER | M308: COMER
A310: WILLIAMSTOWN | C310: 0 | D310: 4 | E310: =C310*6+D310 -> 4 | G310: 6 | H310: 6 | I310: =G310*6+H310 -> 42 | K310: 7 | L310: 8 | M310: =K310*6+L310 -> 50 | O310: 14 | P310: 13 | Q310: =O310*6+P310 -> 97 | S310: WILLIAMSTOWN
A311: PORT MELBOURNE | C311: 1 | D311: 4 | E311: =C311*6+D311 -> 10 | G311: 2 | H311: 5 | I311: =G311*6+H311 -> 17 | K311: 4 | L311: 7 | M311: =K311*6+L311 -> 31 | O311: 4 | P311: 7 | Q311: =O311*6+P311 -> 31 | S311: McMURRAY
A312: BEST PLAYERS
A313: WILLIAMSTOWN | C313: GIBBS | F313: GRANT | H313: ALLEY | K313: ANDERSON | N313: AMY | Q313: McTAGGART
A314: PORT MELBOURNE | C314: MERRICK | F314: BROWN | H314: FRANKLIN | K314: SAMSON | N314: CLELAND | Q314: BARFOOT
A315: GOALKICKERS
A316: WILLIAMSTOWN | C316: COWARD 4 | F316: McTAGGART 3 | J316: E BUSBRIDGE 3 | N316: GIBBS 2 | Q316: REITMAN | T316: AMY
A317: PORT MELBOURNE | C317: BROWN | F317: MERRICK | I317: WORKMAN | L317: PARR
A319: BRUNSWICK | C319: 4 | D319: 3 | E319: =C319*6+D319 -> 27 | G319: 5 | H319: 7 | I319: =G319*6+H319 -> 37 | K319: 9 | L319: 14 | M319: =K319*6+L319 -> 68 | O319: 14 | P319: 16 | Q319: =O319*6+P319 -> 100 | S319: BRUNSWICK
A320: NORTHCOTE | C320: 1 | D320: 2 | E320: =C320*6+D320 -> 8 | G320: 3 | H320: 3 | I320: =G320*6+H320 -> 21 | K320: 3 | L320: 4 | M320: =K320*6+L320 -> 22 | O320: 9 | P320: 6 | Q320: =O320*6+P320 -> 60 | S320: HURLEY
A321: BEST PLAYERS
A322: BRUNSWICK | C322: McKENZIE | F322: CHASE | I322: L BRAID | L322: O'CONNOR | O322: ROSS | Q322: CHANDLER
A323: NORTHCOTE | C323: BASSETT | F323: MOORE | I323: COLE | L323: THOMAS | O323: H BRAID | Q323: SWIFT
A324: GOALKICKERS
A325: BRUNSWICK | C325: SULLIVAN 4 | F325: CHASE 4 | I325: McKENZIE 3 | L325: HARKER 2 | O325: STEVENSON
A326: NORTHCOTE | C326: CLEMENTS 3 | F326: MOORE 2 | I326: SWIFT | K326: H BRAID | M326: WHITE | O326: RIDD
A328: FOOTSCRAY | C328: 2 | D328: 5 | E328: =C328*6+D328 -> 17 | G328: 7 | H328: 11 | I328: =G328*6+H328 -> 53 | K328: 13 | L328: 14 | M328: =K328*6+L328 -> 92 | O328: 15 | P328: 19 | Q328: =O328*6+P328 -> 109 | S328: FOOTSCRAY
A329: MELBOURNE CITY | C329: 2 | D329: 2 | E329: =C329*6+D329 -> 14 | G329: 2 | H329: 4 | I329: =G329*6+H329 -> 16 | K329: 4 | L329: 6 | M329: =K329*6+L329 -> 30 | O329: 5 | P329: 8 | Q329: =O329*6+P329 -> 38 | S329: HERBERT
A330: BEST PLAYERS
A331: FOOTSCRAY | C331: OGILVIE | F331: CLARK | I331: WEBB | L331: BAXTER | O331: CRADDOCK | R331: SPENCE
A332: MELBOURNE CITY | C332: PHILLIPS | F332: YORSTEN | I332: CLARKE | L332: PRATT | O332: W SMITH | R332: RIGNELL
A333: GOALKICKERS
A334: FOOTSCRAY | C334: GREGORY 4 | F334: WEBB 2 | I334: COTTON 2 | L334: CROUCH 2 | N334: SAMSON 2 | Q334: BAXTER | S334: WEBB | U334: OGILVIE
A335: MELBOURNE CITY | C335: PRATT 2 | F335: CLARKE 2 | I335: YORTSEN
A337: ROUND 8 | D337: 9TH JUNE | H337: KINGS BIRTHDAY | M337: WEATHER | O337: SOUTH WEST BREEZE | S337: PLAYED AT | X337: LADDER | AB337: ROUND | AD337: 8
D338: 1ST QTR | H338: 2ND QTR | L338: 3RD QTR | P338: FINAL | S338: BRUNSWICK
A339: NORTH MELBOURNE | C339: 1 | D339: 2 | E339: =C339*6+D339 -> 8 | G339: 4 | H339: 6 | I339: =G339*6+H339 -> 30 | K339: 5 | L339: 7 | M339: =K339*6+L339 -> 37 | O339: 6 | P339: 7 | Q339: =O339*6+P339 -> 43 | S339: UMPIRE | W339: TEAM | X339: W | Y339: L | Z339: D | AA339: FOR | AB339: AGST | AC339: % | AD339: PTS
A340: BRUNSWICK | C340: 2 | D340: 2 | E340: =C340*6+D340 -> 14 | G340: 2 | H340: 3 | I340: =G340*6+H340 -> 15 | K340: 5 | L340: 6 | M340: =K340*6+L340 -> 36 | O340: 6 | P340: 7 | Q340: =O340*6+P340 -> 43 | S340: RAWLE
A341: BEST PLAYERS | W341: FOOTSCRAY | X341: 7 | Y341: 1 | Z341: 0 | AA341: 564 | AB341: 312 | AC341: 180.76923076923077 | AD341: 28
A342: NORTH MELBOURNE | C342: PEMBERTON | F342: HARDY | H342: HOPKINS | K342: SHEEHAN | N342: K JOHNSON | Q342: J JOHNSON | W342: PRAHRAN | X342: 7 | Y342: 1 | Z342: 0 | AA342: 600 | AB342: 402 | AC342: 149.25373134328359 | AD342: 28
A343: BRUNSWICK | C343: L BRAID | F343: ROSS | H343: GILLESPIE | K343: O'CONNOR | N343: McKENZIE | Q343: PARSONS | W343: NORTH MELBOURNE | X343: 6 | Y343: 1 | Z343: 1 | AA343: 518 | AB343: 370 | AC343: 140 | AD343: 26
A344: GOALKICKERS | W344: ESSENDON ASSOC. | X344: 6 | Y344: 2 | Z344: 0 | AA344: 445 | AB344: 407 | AC344: 109.33660933660934 | AD344: 24
A345: NORTH MELBOURNE | C345: ELLIOTT 2 | F345: K JOHNSON 2 | J345: CARPENTER | M345: HERON
A346: BRUNSWICK | C346: HARKER 2 | F346: PRICE 2 | I346: CHASE | K346: GEORGE | W346: BRUNSWICK | X346: 4 | Y346: 3 | Z346: 1 | AA346: 511 | AB346: 393 | AC346: 130.02544529262087 | AD346: 18
W347: WILLIAMSTOWN | X347: 4 | Y347: 4 | Z347: 0 | AA347: 466 | AB347: 399 | AC347: 116.79197994987469 | AD347: 16
A348: ESSENDON ASSOC. | C348: 3 | D348: 3 | E348: =C348*6+D348 -> 21 | G348: 7 | H348: 4 | I348: =G348*6+H348 -> 46 | K348: 7 | L348: 6 | M348: =K348*6+L348 -> 48 | O348: 8 | P348: 7 | Q348: =O348*6+P348 -> 55 | S348: ESSENDON | W348: BRIGHTON | X348: 2 | Y348: 6 | Z348: 0 | AA348: 465 | AB348: 535 | AC348: 86.915887850467286 | AD348: 8
A349: WILLIAMSTOWN | C349: 1 | D349: 1 | E349: =C349*6+D349 -> 7 | G349: 1 | H349: 5 | I349: =G349*6+H349 -> 11 | K349: 4 | L349: 9 | M349: =K349*6+L349 -> 33 | O349: 6 | P349: 17 | Q349: =O349*6+P349 -> 53 | S349: CHISHOLM | W349: PORT MELBOURNE | X349: 2 | Y349: 6 | Z349: 0 | AA349: 370 | AB349: 566 | AC349: 65.371024734982328 | AD349: 8
A350: BEST PLAYERS | W350: NORTHCOTE | X350: 1 | Y350: 7 | Z350: 0 | AA350: 361 | AB350: 595 | AC350: 60.672268907563023 | AD350: 4
A351: ESSENDON ASSOC. | C351: ATKINS | F351: M MADDEN | I351: J MADDEN | L351: GIBSON | O351: P WALKER | R351: CLARKE | W351: MELBOURNE CITY | X351: 0 | Y351: 8 | Z351: 0 | AA351: 305 | AB351: 626 | AC351: 48.722044728434504 | AD351: 0
A352: WILLIAMSTOWN | C352: GIBBS | F352: ANDERSON | I352: REITMAN | L352: McTAGGART | O352: ALLEY | R352: GRANT
A353: GOALKICKERS
A354: ESSENDON ASSOC. | C354: CLARKE 6 | F354: McPHILLIPS | I354: HOARE
A355: WILLIAMSTOWN | C355: GRANT 2 | F355: 37377 | I355: COWARD | K355: FERGUSON
A357: FOOTSCRAY | C357: 1 | D357: 0 | E357: =C357*6+D357 -> 6 | G357: 5 | H357: 1 | I357: =G357*6+H357 -> 31 | K357: 6 | L357: 6 | M357: =K357*6+L357 -> 42 | O357: 11 | P357: 11 | Q357: =O357*6+P357 -> 77 | S357: BRIGHTON BEACH
A358: BRIGHTON | C358: 4 | D358: 8 | E358: =C358*6+D358 -> 32 | G358: 6 | H358: 9 | I358: =G358*6+H358 -> 45 | K358: 7 | L358: 16 | M358: =K358*6+L358 -> 58 | O358: 7 | P358: 16 | Q358: =O358*6+P358 -> 58 | S358: HURLEY
A359: BEST PLAYERS
A360: FOOTSCRAY | C360: McCLUSKY | F360: HARRIS | I360: CLARK | L360: CRADDOCK | O360: HOLMES | R360: SPENCE
A361: BRIGHTON | C361: HENDERSON | F361: GRAHAM | I361: PEDDLE | L361: NEGRO | O361: E BAILES | R361: TURNBULL
A362: GOALKICKERS
A363: FOOTSCRAY | C363: GREGORY 3 | F363: HOLMES 2 | I363: BANBURY 2 | L363: BAXTER | N363: COTTON | Q363: OGILVIE | S363: SPENCE
A364: BRIGHTON | C364: PEDDLE 2 | F364: GRAHAM 2 | I364: COMER | K364: DAWSON | N364: B BAILES
A366: PORT MELBOURNE | C366: 0 | D366: 1 | E366: =C366*6+D366 -> 1 | G366: 5 | H366: 3 | I366: =G366*6+H366 -> 33 | K366: 5 | L366: 5 | M366: =K366*6+L366 -> 35 | O366: 8 | P366: 7 | Q366: =O366*6+P366 -> 55 | S366: PORT MELB
A367: MELBOURNE CITY | C367: 3 | D367: 9 | E367: =C367*6+D367 -> 27 | G367: 3 | H367: 17 | I367: =G367*6+H367 -> 35 | K367: 4 | L367: 20 | M367: =K367*6+L367 -> 44 | O367: 4 | P367: 24 | Q367: =O367*6+P367 -> 48 | S367: KAMM
A368: BEST PLAYERS
A369: PORT MELBOURNE | C369: BARFOOT | F369: MERRICK | I369: CARDEN | L369: FRANKLIN | O369: JOHNSON | R369: CLELAND
A370: MELBOURNE CITY | C370: PHILLIPS | F370: QUINN | I370: J SMITH | L370: GREENHILL | O370: WALLACE | R370: BIGNELL
A371: GOALKICKERS
A372: PORT MELBOURNE | C372: PARR 3 | F372: HEALY 2 | I372: HAIGHBLOOM 2 | M372: CLELAND
A373: MELBOURNE CITY | C373: DANIELS | F373: YORSTEN | I373: PHILLIPS | L373: QUINN
A375: PRAHRAN | C375: 3 | D375: 5 | E375: =C375*6+D375 -> 23 | G375: 7 | H375: 8 | I375: =G375*6+H375 -> 50 | K375: 12 | L375: 13 | M375: =K375*6+L375 -> 85 | O375: 13 | P375: 17 | Q375: =O375*6+P375 -> 95 | S375: TOORAK PARK
A376: NORTHCOTE | C376: 1 | D376: 2 | E376: =C376*6+D376 -> 8 | G376: 1 | H376: 2 | I376: =G376*6+H376 -> 8 | K376: 4 | L376: 5 | M376: =K376*6+L376 -> 29 | O376: 7 | P376: 10 | Q376: =O376*6+P376 -> 52 | S376: KENDALL
A377: BEST PLAYERS
A378: PRAHRAN | C378: G JOHNSON | F378: CARLSON | I378: SIMS | L378: DOWSING | O378: WILSON | R378: McKENZIE
A379: NORTHCOTE | C379: BIGGINS | F379: SMITH | I379: HALL | L379: BILLETT | O379: WHITE | R379: BASSETT
A380: GOALKICKERS
A381: PRAHRAN
A382: NORTHCOTE | C382: RYAN 4
A384: ROUND 9 | E384: 14TH JUNE | S384: PLAYED AT | X384: LADDER | AA384: ROUND | AD384: 9
D385: 1ST QTR | H385: 2ND QTR | L385: 3RD QTR | P385: FINAL | S385: FOOTSCRAY
A386: FOOTSCRAY | C386: 0 | D386: 1 | E386: =C386*6+D386 -> 1 | G386: 3 | H386: 4 | I386: =G386*6+H386 -> 22 | K386: 4 | L386: 7 | M386: =K386*6+L386 -> 31 | O386: 8 | P386: 13 | Q386: =O386*6+P386 -> 61 | S386: UMPIRE | W386: TEAM | X386: W | Y386: L | Z386: D | AA386: FOR | AB386: AGST | AC386: % | AD386: PTS
A387: PRAHRAN | C387: 1 | D387: 4 | E387: =C387*6+D387 -> 10 | G387: 4 | H387: 6 | I387: =G387*6+H387 -> 30 | K387: 4 | L387: 10 | M387: =K387*6+L387 -> 34 | O387: 6 | P387: 11 | Q387: =O387*6+P387 -> 47 | S387: HURLEY
A388: BEST PLAYERS | W388: FOOTSCRAY | X388: 8 | Y388: 1 | Z388: 0 | AA388: 625 | AB388: 359 | AC388: 174.09470752089138 | AD388: 32
A389: FOOTSCRAY | C389: CLARK | F389: SAMSON | I389: CRADDOCK | L389: HOLMES | O389: BAXTER | R389: SPENCE | W389: NORTH MELBOURNE | X389: 7 | Y389: 1 | Z389: 1 | AA389: 613 | AB389: 396 | AC389: 154.79797979797979 | AD389: 30
A390: PRAHRAN | C390: WEIDNER | F390: WILSON | I390: CARLSON | L390: WOODHEAD | O390: W RYAN | R390: CAIN | W390: PRAHRAN | X390: 7 | Y390: 2 | Z390: 0 | AA390: 647 | AB390: 463 | AC390: 139.74082073434124 | AD390: 28
A391: GOALKICKERS | W391: ESSENDON ASSOC. | X391: 6 | Y391: 3 | Z391: 0 | AA391: 485 | AB391: 462 | AC391: 104.97835497835497 | AD391: 24
A392: FOOTSCRAY | C392: SPENCE 2 | F392: CLARK 2 | I392: HOLMES | K392: BANBURY | N392: COTTON | Q392: GREGORY
A393: PRAHRAN | C393: WEIDNER 2 | F393: SYKES 2 | I393: ELLIN | K393: D RYAN | W393: BRUNSWICK | X393: 5 | Y393: 3 | Z393: 1 | AA393: 566 | AB393: 433 | AC393: 130.71593533487297 | AD393: 22
W394: WILLIAMSTOWN | X394: 5 | Y394: 4 | Z394: 0 | AA394: 557 | AB394: 420 | AC394: 132.61904761904762 | AD394: 20
A395: BRUNSWICK | C395: 1 | D395: 2 | E395: =C395*6+D395 -> 8 | G395: 5 | H395: 6 | I395: =G395*6+H395 -> 36 | K395: 7 | L395: 10 | M395: =K395*6+L395 -> 52 | O395: 7 | P395: 13 | Q395: =O395*6+P395 -> 55 | S395: ESSENDON | W395: BRIGHTON | X395: 2 | Y395: 7 | Z395: 0 | AA395: 486 | AB395: 626 | AC395: 77.635782747603841 | AD395: 8
A396: ESSENDON ASSOC. | C396: 1 | D396: 1 | E396: =C396*6+D396 -> 7 | G396: 3 | H396: 4 | I396: =G396*6+H396 -> 22 | K396: 4 | L396: 7 | M396: =K396*6+L396 -> 31 | O396: 5 | P396: 10 | Q396: =O396*6+P396 -> 40 | S396: KENDALL | W396: NORTHCOTE | X396: 2 | Y396: 7 | Z396: 0 | AA396: 421 | AB396: 630 | AC396: 66.825396825396822 | AD396: 8
A397: BEST PLAYERS | W397: PORT MELBOURNE | X397: 2 | Y397: 7 | Z397: 0 | AA397: 396 | AB397: 661 | AC397: 59.909228441754919 | AD397: 8
A398: BRUNSWICK | C398: STANCLIFFE | F398: MILLS | I398: PRICE | L398: GEORGE | O398: SULLIVAN | Q398: MCKENZIE | W398: MELBOURNE CITY | X398: 0 | Y398: 9 | Z398: 0 | AA398: 340 | AB398: 686 | AC398: 49.562682215743443 | AD398: 0
A399: ESSENDON ASSOC. | C399: M MADDEN | F399: J MADDEN | I399: ATKINS | L399: CROWE | O399: SEVIOR | Q399: DIGGLE
A400: GOALKICKERS
A401: BRUNSWICK | C401: HARKER 2 | F401: SULLIVAN | I401: L BRAID | L401: CARRIE | N401: MCKENZIE | Q401: O'CONNOR
A402: ESSENDON ASSOC. | C402: DIGGLE 3 | F402: CLARKE | I402: M MADDEN
A404: WILLIAMSTOWN | C404: 2 | D404: 3 | E404: =C404*6+D404 -> 15 | G404: 7 | H404: 8 | I404: =G404*6+H404 -> 50 | K404: 8 | L404: 14 | M404: =K404*6+L404 -> 62 | O404: 12 | P404: 19 | Q404: =O404*6+P404 -> 91 | S404: WILLIAMSTOWN
A405: BRIGHTON | C405: 1 | D405: 4 | E405: =C405*6+D405 -> 10 | G405: 1 | H405: 5 | I405: =G405*6+H405 -> 11 | K405: 1 | L405: 9 | M405: =K405*6+L405 -> 15 | O405: 2 | P405: 9 | Q405: =O405*6+P405 -> 21 | S405: RAWLE
A406: BEST PLAYERS
A407: WILLIAMSTOWN | C407: FERGUSON | F407: GIBBS | I407: McDONALD | L407: ANDERSON | O407: REITMAN
A408: BRIGHTON | C408: CLARKE | F408: DOWDING | I408: B BAILES | L408: PALMER | O408: NEGRO
A409: GOALKICKERS
A410: WILLIAMSTOWN | C410: COWARD 3 | F410: 37742 | I410: GIBBS 2 | L410: GRANT 2 | O410: E BUSBRIDGE 2
A411: BRIGHTON | C411: PALMER | F411: DOWDING
A413: NORTHCOTE | C413: 3 | D413: 1 | E413: =C413*6+D413 -> 19 | G413: 3 | H413: 5 | I413: =G413*6+H413 -> 23 | K413: 6 | L413: 11 | M413: =K413*6+L413 -> 47 | O413: 8 | P413: 12 | Q413: =O413*6+P413 -> 60 | S413: CROXTON PK
A414: MELBOURNE CITY | C414: 3 | D414: 3 | E414: =C414*6+D414 -> 21 | G414: 3 | H414: 8 | I414: =G414*6+H414 -> 26 | K414: 3 | L414: 8 | M414: =K414*6+L414 -> 26 | O414: 4 | P414: 11 | Q414: =O414*6+P414 -> 35 | S414: McMURRAY
A415: BEST PLAYERS
A416: NORTHCOTE | C416: S HALL | F416: BASSETT | I416: SMITH | L416: NEWBOUND | O416: WHITE | R416: H BRAID
A417: MELBOURNE CITY | C417: PHILLIPS | F417: MONOGHAN | I417: WOODS | L417: GILBERT | O417: SMITH | R417: W GREENHILL
A418: GOALKICKERS
A419: NORTHCOTE | C419: H BRAID 3 | F419: CLEMENTS 3 | J419: RIDD | L419: SWIFT
A420: MELBOURNE CITY | C420: YATES | F420: PHILLIPS | I420: GILBERT | L420: GREENHILL
A422: NORTH MELBOURNE | C422: 4 | D422: 5 | E422: =C422*6+D422 -> 29 | G422: 6 | H422: 10 | I422: =G422*6+H422 -> 46 | K422: 11 | L422: 15 | M422: =K422*6+L422 -> 81 | O422: 13 | P422: 17 | Q422: =O422*6+P422 -> 95 | S422: NORTH MELB
A423: PORT MELBOURNE | C423: 0 | D423: 0 | E423: =C423*6+D423 -> 0 | G423: 0 | H423: 4 | I423: =G423*6+H423 -> 4 | K423: 0 | L423: 6 | M423: =K423*6+L423 -> 6 | O423: 3 | P423: 8 | Q423: =O423*6+P423 -> 26 | S423: HERBERT
A424: BEST PLAYERS
A425: NORTH MELBOURNE | C425: CARPENTER | F425: K JOHNSON | J425: HARDY | M425: SHEEHAN | P425: TRELOAR | R425: LAVER
A426: PORT MELBOURNE | C426: FRANKLIN | F426: HAIGHBLOOM | J426: STEELE | M426: MERRICK | P426: BARFOOT | R426: WALTON
A427: GOALKICKERS
A428: NORTH MELBOURNE | C428: CARPENTER 6 | G428: K JOHNSON 4 | J428: HARDY | L428: HAWKINS | N428: ROACH
A429: PORT MELBOURNE | C429: MERRICK | F429: DALY | I429: BARFOOT
A431: ROUND 10 | E431: 21ST JUNE | J431: WEATHER | M431: FINE AFTER RAIN | S431: PLAYED AT | X431: LADDER | AA431: ROUND | AD431: 10
D432: 1ST QTR | H432: 2ND QTR | L432: 3RD QTR | P432: FINAL | S432: WILLIAMSTOWN
A433: WILLIAMSTOWN | C433: 0 | D433: 4 | E433: =C433*6+D433 -> 4 | G433: 3 | H433: 6 | I433: =G433*6+H433 -> 24 | K433: 5 | L433: 10 | M433: =K433*6+L433 -> 40 | O433: 5 | P433: 12 | Q433: =O433*6+P433 -> 42 | S433: UMPIRE | W433: TEAM | X433: W | Y433: L | Z433: D | AA433: FOR | AB433: AGST | AC433: % | AD433: PTS
A434: FOOTSCRAY | C434: 0 | D434: 5 | E434: =C434*6+D434 -> 5 | G434: 2 | H434: 8 | I434: =G434*6+H434 -> 20 | K434: 3 | L434: 9 | M434: =K434*6+L434 -> 27 | O434: 4 | P434: 12 | Q434: =O434*6+P434 -> 36 | S434: McMURRAY
A435: BEST PLAYERS | W435: NORTH MELBOURNE | X435: 8 | Y435: 1 | Z435: 1 | AA435: 724 | AB435: 445 | AC435: 162.69662921348313 | AD435: 34
A436: WILLIAMSTOWN | C436: GIBBS | F436: AMY | H436: FERGUSON | K436: REITMAN | N436: McDONALD | Q436: GRANT | W436: FOOTSCRAY | X436: 8 | Y436: 2 | Z436: 0 | AA436: 661 | AB436: 401 | AC436: 164.83790523690774 | AD436: 32
A437: FOOTSCRAY | C437: SAMSON | F437: COTTON | H437: SPENCE | K437: GRIMSHAW | N437: CLARK | Q437: NEILSON | W437: PRAHRAN | X437: 7 | Y437: 3 | Z437: 0 | AA437: 699 | AB437: 518 | AC437: 134.94208494208493 | AD437: 28
A438: GOALKICKERS | W438: ESSENDON ASSOC. | X438: 7 | Y438: 3 | Z438: 0 | AA438: 580 | AB438: 547 | AC438: 106.03290676416819 | AD438: 28
A439: WILLIAMSTOWN | C439: AMY 2 | F439: COWARD | I439: McTAGGART | L439: N BUSBRIDGE
A440: FOOTSCRAY | C440: GREGORY | F440: HARRIS | I440: CROUCH | L440: COTTON | W440: BRUNSWICK | X440: 6 | Y440: 3 | Z440: 1 | AA440: 626 | AB440: 487 | AC440: 128.54209445585215 | AD440: 26
W441: WILLIAMSTOWN | X441: 6 | Y441: 4 | Z441: 0 | AA441: 599 | AB441: 456 | AC441: 131.35964912280701 | AD441: 24
A442: BRIGHTON | C442: 1 | D442: 2 | E442: =C442*6+D442 -> 8 | G442: 1 | H442: 6 | I442: =G442*6+H442 -> 12 | K442: 3 | L442: 8 | M442: =K442*6+L442 -> 26 | O442: 7 | P442: 13 | Q442: =O442*6+P442 -> 55 | S442: BRIGHTON BEACH | W442: BRIGHTON | X442: 3 | Y442: 7 | Z442: 0 | AA442: 541 | AB442: 678 | AC442: 79.793510324483776 | AD442: 12
A443: PRAHRAN | C443: 3 | D443: 1 | E443: =C443*6+D443 -> 19 | G443: 3 | H443: 2 | I443: =G443*6+H443 -> 20 | K443: 6 | L443: 3 | M443: =K443*6+L443 -> 39 | O443: 8 | P443: 4 | Q443: =O443*6+P443 -> 52 | S443: CHISHOLM | W443: NORTHCOTE | X443: 2 | Y443: 8 | Z443: 0 | AA443: 506 | AB443: 725 | AC443: 69.793103448275858 | AD443: 8
A444: BEST PLAYERS | W444: PORT MELBOURNE | X444: 2 | Y444: 8 | Z444: 0 | AA444: 450 | AB444: 721 | AC444: 62.413314840499304 | AD444: 8
A445: BRIGHTON | C445: E BAILES | F445: B BAILES | I445: TURNBULL | L445: GRAHAM | O445: NEGRO | Q445: DOWDING | W445: MELBOURNE CITY | X445: 0 | Y445: 10 | Z445: 0 | AA445: 389 | AB445: 797 | AC445: 48.808030112923461 | AD445: 0
A446: PRAHRAN | C446: CARLSON | F446: W RYAN | I446: MCKENZIE | L446: KERR | O446: WEIDNER | Q446: MARONEY
A447: GOALKICKERS
A448: BRIGHTON | C448: BELLER | E448: COLVIN | G448: PALMER | I448: PEDDLE | K448: GRAHAM | M448: PATTERSON | P448: DAWSON
A449: PRAHRAN | C449: McKENZIE 3 | G449: DOWSING | J449: WILSON | M449: D RYAN | O449: KERR
A451: ESSENDON ASSOC. | C451: 3 | D451: 2 | E451: =C451*6+D451 -> 20 | G451: 7 | H451: 6 | I451: =G451*6+H451 -> 48 | K451: 10 | L451: 9 | M451: =K451*6+L451 -> 69 | O451: 13 | P451: 17 | Q451: =O451*6+P451 -> 95 | S451: ESSENDON
A452: NORTHCOTE | C452: 1 | D452: 3 | E452: =C452*6+D452 -> 9 | G452: 5 | H452: 6 | I452: =G452*6+H452 -> 36 | K452: 9 | L452: 9 | M452: =K452*6+L452 -> 63 | O452: 12 | P452: 13 | Q452: =O452*6+P452 -> 85 | S452: PORTEOUS
A453: BEST PLAYERS
A454: ESSENDON ASSOC. | C454: M MADDEN | F454: HOARE | I454: DIGGLE | L454: CLARKE | N454: HUNTINGTON | Q454: SEVIOR
A455: NORTHCOTE | C455: H BRAID | F455: BASSETT | I455: BILLETT | L455: S HALL | N455: COLE | Q455: NEWBOUND
A456: GOALKICKERS
A457: ESSENDON ASSOC. | C457: CLARKE 4 | F457: HUNTINGTON 4 | J457: GOUGH 2 | M457: HOARE | O457: J MADDEN | R457: DIGGLE
A458: NORTHCOTE | C458: H BRAID 5 | F458: RIDD 2 | I458: SWIFT 2 | L458: MOORE | N458: RYAN | P458: NEWBOUND
A460: BRUNSWICK | C460: 2 | D460: 1 | E460: =C460*6+D460 -> 13 | G460: 4 | H460: 4 | I460: =G460*6+H460 -> 28 | K460: 6 | L460: 8 | M460: =K460*6+L460 -> 44 | O460: 8 | P460: 12 | Q460: =O460*6+P460 -> 60 | S460: PORT MELB
A461: PORT MELBOURNE | C461: 3 | D461: 7 | E461: =C461*6+D461 -> 25 | G461: 6 | H461: 9 | I461: =G461*6+H461 -> 45 | K461: 7 | L461: 12 | M461: =K461*6+L461 -> 54 | O461: 7 | P461: 12 | Q461: =O461*6+P461 -> 54 | S461: KENDALL
A462: BEST PLAYERS
A463: BRUNSWICK | C463: L BRAID | F463: LEEDS | I463: PARSONS | L463: SULLIVAN | O463: McKENZIE | R463: CHANDLER
A464: PORT MELBOURNE | C464: CLELAND | F464: MERRICK | I464: BARFOOT | L464: WORKMAN | O464: FRANKLIN | R464: ANDERSON
A465: GOALKICKERS
A466: BRUNSWICK | C466: McKENZIE 4 | F466: HARKER 3 | I466: CHANDLER
A467: PORT MELBOURNE | C467: WORKMAN 2 | F467: MERRICK | I467: BARFOOT | K467: PARR | M467: WALTON | O467: HAIGHBLOOM
A469: NORTH MELBOURNE | C469: 4 | D469: 7 | E469: =C469*6+D469 -> 31 | G469: 8 | H469: 10 | I469: =G469*6+H469 -> 58 | K469: 9 | L469: 17 | M469: =K469*6+L469 -> 71 | O469: 15 | P469: 21 | Q469: =O469*6+P469 -> 111 | S469: EMCG
A470: MELBOURNE CITY | C470: 2 | D470: 1 | E470: =C470*6+D470 -> 13 | G470: 4 | H470: 2 | I470: =G470*6+H470 -> 26 | K470: 6 | L470: 4 | M470: =K470*6+L470 -> 40 | O470: 7 | P470: 7 | Q470: =O470*6+P470 -> 49 | S470: HURLEY
A471: BEST PLAYERS
A472: NORTH MELBOURNE | C472: BARKER | F472: HARDY | I472: ROACH | L472: FREEMAN | O472: McKAY | R472: K JOHNSON
A473: MELBOURNE CITY | C473: WOODS | F473: J SMITH | I473: W MONOGHAN | L473: BIGNELL | O473: DANIELS | R473: PHILLIPS
A474: GOALKICKERS
A475: NORTH MELBOURNE | C475: HARDY 4 | F475: K JOHNSON 4 | J475: ROACH 2 | M475: BARKER | O475: McKAY | Q475: CARPENTER | T475: LAVER
A476: MELBOURNE CITY | C476: PHILLIPS 2 | F476: YORSTEN 2 | I476: QUINN | K476: GILBERT | M476: DONNELLY
A478: ROUND 11 | E478: 28TH JUNE | J478: WEATHER | M478: FINE | S478: PLAYED AT | X478: LADDER | AA478: ROUND | AD478: 11
D479: 1ST QTR | H479: 2ND QTR | L479: 3RD QTR | P479: FINAL | S479: NORTH MELB
A480: NORTH MELBOURNE | C480: 4 | D480: 2 | E480: =C480*6+D480 -> 26 | G480: 5 | H480: 5 | I480: =G480*6+H480 -> 35 | K480: 9 | L480: 9 | M480: =K480*6+L480 -> 63 | O480: 11 | P480: 10 | Q480: =O480*6+P480 -> 76 | S480: UMPIRE | W480: TEAM | X480: W | Y480: L | Z480: D | AA480: FOR | AB480: AGST | AC480: % | AD480: PTS
A481: ESSENDON ASSOC. | C481: 1 | D481: 1 | E481: =C481*6+D481 -> 7 | G481: 2 | H481: 3 | I481: =G481*6+H481 -> 15 | K481: 5 | L481: 4 | M481: =K481*6+L481 -> 34 | O481: 7 | P481: 11 | Q481: =O481*6+P481 -> 53 | S481: HURLEY
A482: BEST PLAYERS | W482: NORTH MELBOURNE | X482: 9 | Y482: 1 | Z482: 1 | AA482: 800 | AB482: 498 | AC482: 160.64257028112451 | AD482: 38
A483: NORTH MELBOURNE | C483: PEMBERTON | F483: HARDY | I483: BARKER | L483: SHEEHAN | O483: HERON | Q483: CARPENTER | W483: FOOTSCRAY | X483: 9 | Y483: 2 | Z483: 0 | AA483: 736 | AB483: 461 | AC483: 159.65292841648591 | AD483: 36
A484: ESSENDON ASSOC. | C484: P WALKER | F484: DIGGLE | I484: M MADDEN | L484: ATKINS | O484: PAIN | Q484: LEWIS | W484: PRAHRAN | X484: 8 | Y484: 3 | Z484: 0 | AA484: 796 | AB484: 561 | AC484: 141.88948306595364 | AD484: 32
A485: GOALKICKERS | W485: BRUNSWICK | X485: 7 | Y485: 3 | Z485: 1 | AA485: 702 | AB485: 549 | AC485: 127.8688524590164 | AD485: 30
A486: NORTH MELBOURNE | C486: ELLIOTT 4 | F486: CARPENTER 4 | J486: HAWKINS | M486: K JOHNSON | P486: McKAY
A487: ESSENDON ASSOC. | C487: DIGGLE 3 | F487: CLARKE 2 | I487: HUNTINGTON | L487: ERICKSON | W487: ESSENDON ASSOC. | X487: 7 | Y487: 4 | Z487: 0 | AA487: 633 | AB487: 623 | AC487: 101.60513643659711 | AD487: 28
W488: WILLIAMSTOWN | X488: 6 | Y488: 5 | Z488: 0 | AA488: 640 | AB488: 504 | AC488: 126.98412698412699 | AD488: 24
A489: BRUNSWICK | C489: 1 | D489: 5 | E489: =C489*6+D489 -> 11 | G489: 4 | H489: 8 | I489: =G489*6+H489 -> 32 | K489: 7 | L489: 12 | M489: =K489*6+L489 -> 54 | O489: 10 | P489: 16 | Q489: =O489*6+P489 -> 76 | S489: BRUNSWICK | W489: BRIGHTON | X489: 3 | Y489: 8 | Z489: 0 | AA489: 603 | AB489: 754 | AC489: 79.973474801061002 | AD489: 12
A490: BRIGHTON | C490: 2 | D490: 2 | E490: =C490*6+D490 -> 14 | G490: 4 | H490: 4 | I490: =G490*6+H490 -> 28 | K490: 4 | L490: 10 | M490: =K490*6+L490 -> 34 | O490: 8 | P490: 14 | Q490: =O490*6+P490 -> 62 | S490: RAWLE | W490: NORTHCOTE | X490: 3 | Y490: 8 | Z490: 0 | AA490: 554 | AB490: 766 | AC490: 72.323759791122711 | AD490: 12
A491: BEST PLAYERS | W491: PORT MELBOURNE | X491: 2 | Y491: 9 | Z491: 0 | AA491: 510 | AB491: 796 | AC491: 64.070351758793976 | AD491: 8
A492: BRUNSWICK | C492: McKENZIE | F492: CHASE | I492: SULLIVAN | L492: LEEDS | O492: L BRAID | Q492: HARKER | W492: MELBOURNE CITY | X492: 0 | Y492: 11 | Z492: 0 | AA492: 432 | AB492: 894 | AC492: 48.322147651006709 | AD492: 0
A493: BRIGHTON | C493: CLARK | F493: DAWSON | I493: PEDDLE | L493: B BAILES | O493: GRAHAM | Q493: BELLER
A494: GOALKICKERS
A495: BRUNSWICK | C495: McKENZIE 4 | F495: SULLIVAN 2 | I495: PRICE | K495: GEORGE | M495: HARKER | O495: CHANDLER
A496: BRIGHTON | C496: CLARK 2 | F496: GRAHAM 2 | I496: DAWSON | K496: PEDDLE | M496: COMER | O496: BELLER
A498: NORTHCOTE | C498: 1 | D498: 5 | E498: =C498*6+D498 -> 11 | G498: 2 | H498: 5 | I498: =G498*6+H498 -> 17 | K498: 3 | L498: 11 | M498: =K498*6+L498 -> 29 | O498: 6 | P498: 12 | Q498: =O498*6+P498 -> 48 | S498: CROXTON PK
A499: WILLIAMSTOWN | C499: 1 | D499: 4 | E499: =C499*6+D499 -> 10 | G499: 1 | H499: 9 | I499: =G499*6+H499 -> 15 | K499: 2 | L499: 13 | M499: =K499*6+L499 -> 25 | O499: 4 | P499: 17 | Q499: =O499*6+P499 -> 41 | S499: KENDALL
A500: BEST PLAYERS
A501: NORTHCOTE | C501: SWIFT | F501: H THOMAS | I501: BILLETT | L501: SMITH | N501: NEWBOUND | Q501: WHITE
A502: WILLIAMSTOWN | C502: ALLEY | F502: ANDERSON | I502: McDONALD | L502: N BUSBRIDGE | O502: GRANT | Q502: MATTHEWS
A503: GOALKICKERS
A504: NORTHCOTE | C504: RYAN 2 | F504: CLEMENTS | I504: SWIFT | K504: MOORE | M504: COLE
A505: WILLIAMSTOWN | C505: MATTHEWS 2 | F505: GIBBS | I505: COWARD
A507: FOOTSCRAY | C507: 5 | D507: 3 | E507: =C507*6+D507 -> 33 | G507: 6 | H507: 3 | I507: =G507*6+H507 -> 39 | K507: 9 | L507: 9 | M507: =K507*6+L507 -> 63 | O507: 11 | P507: 9 | Q507: =O507*6+P507 -> 75 | S507: FOOTSCRAY
A508: PORT MELBOURNE | C508: 1 | D508: 3 | E508: =C508*6+D508 -> 9 | G508: 5 | H508: 3 | I508: =G508*6+H508 -> 33 | K508: 6 | L508: 5 | M508: =K508*6+L508 -> 41 | O508: 9 | P508: 6 | Q508: =O508*6+P508 -> 60 | S508: CHISHOM
A509: BEST PLAYERS
A510: FOOTSCRAY | C510: BAXTER | F510: CLARK | I510: COTTON | L510: SPENCE | O510: HOLMES | R510: GRIMSHAW
A511: PORT MELBOURNE | C511: ANDERSON | F511: BARFOOT | I511: CLELAND | L511: STEELE | O511: WORKMAN | R511: PARR
A512: GOALKICKERS
A513: FOOTSCRAY | C513: SCHADE 3 | F513: SAMSON 3 | I513: CROUCH 3 | L513: GREGORY | O513: BAXTER
A514: PORT MELBOURNE | C514: PARR 3 | F514: MERRICK 3 | I514: WALTON | L514: BARFOOT | O514: ANDERSON
A516: PRAHRAN | C516: 1 | D516: 4 | E516: =C516*6+D516 -> 10 | G516: 3 | H516: 6 | I516: =G516*6+H516 -> 24 | K516: 8 | L516: 12 | M516: =K516*6+L516 -> 60 | O516: 14 | P516: 13 | Q516: =O516*6+P516 -> 97 | S516: TOORAK PARK
A517: MELBOURNE CITY | C517: 1 | D517: 1 | E517: =C517*6+D517 -> 7 | G517: 5 | H517: 5 | I517: =G517*6+H517 -> 35 | K517: 5 | L517: 7 | M517: =K517*6+L517 -> 37 | O517: 6 | P517: 7 | Q517: =O517*6+P517 -> 43 | S517: HERBERT
A518: BEST PLAYERS
A519: PRAHRAN | C519: MARONEY | F519: WEIDNER | I519: KERR | L519: FAIRBAIRN | O519: DALY | R519: SIMS
A520: MELBOURNE CITY | C520: PHILLIPS | F520: MONOGHAN | I520: WOODS | L520: QUINN | O520: YORSTEN | R520: W SMITH
A521: GOALKICKERS
A522: PRAHRAN | C522: WEIDNER 4 | F522: MARONEY 3 | I522: DALY 3 | K522: KERR | M522: McKENZIE | P522: FAIRBAIRN | R522: SIMS
A523: MELBOURNE CITY | C523: YORSTEN 4 | F523: PHILLIPS | I523: DANIELS
A525: ROUND 12 | E525: 5TH JULY | J525: WEATHER | M525: GROUND SLIPPERY AFTER RAIN | S525: PLAYED AT | X525: LADDER | AA525: ROUND | AD525: 12
D526: 1ST QTR | H526: 2ND QTR | L526: 3RD QTR | P526: FINAL | S526: ESSENDON
A527: ESSENDON ASSOC. | C527: 1 | D527: 2 | E527: =C527*6+D527 -> 8 | G527: 2 | H527: 6 | I527: =G527*6+H527 -> 18 | K527: 6 | L527: 8 | M527: =K527*6+L527 -> 44 | O527: 9 | P527: 10 | Q527: =O527*6+P527 -> 64 | S527: UMPIRE | W527: TEAM | X527: W | Y527: L | Z527: D | AA527: FOR | AB527: AGST | AC527: % | AD527: PTS
A528: PRAHRAN | C528: 3 | D528: 4 | E528: =C528*6+D528 -> 22 | G528: 4 | H528: 5 | I528: =G528*6+H528 -> 29 | K528: 7 | L528: 10 | M528: =K528*6+L528 -> 52 | O528: 8 | P528: 15 | Q528: =O528*6+P528 -> 63 | S528: HURLEY
A529: BEST PLAYERS | W529: FOOTSCRAY | X529: 10 | Y529: 2 | Z529: 0 | AA529: 824 | AB529: 498 | AC529: 165.46184738955824 | AD529: 40
A530: ESSENDON ASSOC. | C530: M MADDEN | F530: PAIN | I530: ATKINS | L530: P WALKER | O530: HOARE | Q530: DIGGLE | W530: NORTH MELBOURNE | X530: 9 | Y530: 2 | Z530: 1 | AA530: 866 | AB530: 565 | AC530: 153.27433628318585 | AD530: 38
A531: PRAHRAN | C531: SIMS | F531: GILCHRIST | I531: BANT | L531: DOWSING | O531: WILSON | Q531: MARONEY | W531: BRUNSWICK | X531: 8 | Y531: 3 | Z531: 1 | AA531: 814 | AB531: 588 | AC531: 138.43537414965985 | AD531: 34
A532: GOALKICKERS | W532: PRAHRAN | X532: 8 | Y532: 4 | Z532: 0 | AA532: 859 | AB532: 625 | AC532: 137.44 | AD532: 32
A533: ESSENDON ASSOC. | C533: CLARKE 3 | F533: ATKINS | I533: DIGGLE | K533: SEVIOR | M533: TURNER | P533: HUNTINGTON
A534: PRAHRAN | C534: KERR 2 | F534: GILCHRIST 2 | I534: FAIRBAIRN | L534: DOWSING | O534: WEIDNER | Q534: DALY | W534: ESSENDON ASSOC. | X534: 8 | Y534: 4 | Z534: 0 | AA534: 697 | AB534: 686 | AC534: 101.60349854227405 | AD534: 32
W535: WILLIAMSTOWN | X535: 7 | Y535: 5 | Z535: 0 | AA535: 707 | AB535: 570 | AC535: 124.03508771929825 | AD535: 28
A536: WILLIAMSTOWN | C536: 2 | D536: 1 | E536: =C536*6+D536 -> 13 | G536: 8 | H536: 6 | I536: =G536*6+H536 -> 54 | K536: 8 | L536: 6 | M536: =K536*6+L536 -> 54 | O536: 10 | P536: 7 | Q536: =O536*6+P536 -> 67 | S536: WILLIAMSTOWN | W536: BRIGHTON | X536: 3 | Y536: 9 | Z536: 0 | AA536: 662 | AB536: 824 | AC536: 80.339805825242721 | AD536: 12
A537: NORTH MELBOURNE | C537: 4 | D537: 5 | E537: =C537*6+D537 -> 29 | G537: 5 | H537: 7 | I537: =G537*6+H537 -> 37 | K537: 6 | L537: 11 | M537: =K537*6+L537 -> 47 | O537: 8 | P537: 18 | Q537: =O537*6+P537 -> 66 | S537: PORTEOUS | W537: NORTHCOTE | X537: 3 | Y537: 9 | Z537: 0 | AA537: 591 | AB537: 854 | AC537: 69.203747072599526 | AD537: 12
A538: BEST PLAYERS | W538: PORT MELBOURNE | X538: 3 | Y538: 9 | Z538: 0 | AA538: 580 | AB538: 855 | AC538: 67.836257309941516 | AD538: 12
A539: WILLIAMSTOWN | C539: GIBBS | F539: ALLEY | I539: McTAGGART | L539: BROOKER | O539: REITMAN | Q539: McDONALD | W539: MELBOURNE CITY | X539: 0 | Y539: 12 | Z539: 0 | AA539: 471 | AB539: 1006 | AC539: 46.819085487077537 | AD539: 0
A540: NORTH MELBOURNE | C540: HARDY | F540: BARKER | I540: PEMBERTON | L540: CARPENTER | O540: HERON | Q540: WALSH
A541: GOALKICKERS
A542: WILLIAMSTOWN | C542: GIBBS 3 | F542: AMY 3 | I542: NICHOLS 2 | L542: N BUSBRIDGE 2
A543: NORTH MELBOURNE | C543: CARPENTER 3 | F543: HARDY 2 | I543: K JOHNSON | L543: MATTHEWS | O543: ELLIOTT
A545: PORT MELBOURNE | C545: 5 | D545: 3 | E545: =C545*6+D545 -> 33 | G545: 5 | H545: 6 | I545: =G545*6+H545 -> 36 | K545: 7 | L545: 11 | M545: =K545*6+L545 -> 53 | O545: 9 | P545: 16 | Q545: =O545*6+P545 -> 70 | S545: PORT MELB
A546: BRIGHTON | C546: 3 | D546: 1 | E546: =C546*6+D546 -> 19 | G546: 5 | H546: 6 | I546: =G546*6+H546 -> 36 | K546: 7 | L546: 8 | M546: =K546*6+L546 -> 50 | O546: 8 | P546: 11 | Q546: =O546*6+P546 -> 59 | S546: KENDALL
A547: BEST PLAYERS
A548: PORT MELBOURNE | C548: BARFOOT | F548: MERRICK | I548: CARDEN | L548: WORKMAN | O548: ANDERSON | R548: SAMSON
A549: BRIGHTON | C549: E BAILES | F549: NEGRO | I549: B BAILES | L549: BELLER | O549: GRAHAM | R549: HENDERSON
A550: GOALKICKERS
A551: PORT MELBOURNE | C551: BARFOOT 2 | F551: MERRICK 2 | I551: HAYES 2 | L551: HAIGHBLOOM | O551: PARR | Q551: ANDERSON
A552: BRIGHTON | C552: CLARK 2 | F552: COMER 2 | I552: BELLER 2 | L552: DAWSON | N552: COWELL
A554: FOOTSCRAY | C554: 4 | D554: 4 | E554: =C554*6+D554 -> 28 | G554: 8 | H554: 6 | I554: =G554*6+H554 -> 54 | K554: 11 | L554: 10 | M554: =K554*6+L554 -> 76 | O554: 12 | P554: 16 | Q554: =O554*6+P554 -> 88 | S554: CROXTON PK
A555: NORTHCOTE | C555: 2 | D555: 2 | E555: =C555*6+D555 -> 14 | G555: 4 | H555: 3 | I555: =G555*6+H555 -> 27 | K555: 5 | L555: 5 | M555: =K555*6+L555 -> 35 | O555: 5 | P555: 7 | Q555: =O555*6+P555 -> 37 | S555: McMURRAY
A556: BEST PLAYERS
A557: FOOTSCRAY | C557: BAXTER | F557: SPENCE | I557: GREGORY | L557: LAWSON | O557: SAMSON | R557: LEVER
A558: NORTHCOTE | C558: H THOMAS | F558: COLE | I558: NEWBOUND | L558: MOORE | O558: RUSSELL | R558: SWIFT
A559: GOALKICKERS
A560: FOOTSCRAY | C560: SPENCE 4 | F560: GREGORY 3 | I560: LAWSON 2 | L560: SCHADE 2 | O560: BAXTER
A561: NORTHCOTE | C561: MOORE | F561: WHITE | I561: H BRAID | L561: SOUTHERN | O561: CLEMENTS
A563: BRUNSWICK | C563: 2 | D563: 1 | E563: =C563*6+D563 -> 13 | G563: 6 | H563: 7 | I563: =G563*6+H563 -> 43 | K563: 12 | L563: 10 | M563: =K563*6+L563 -> 82 | O563: 16 | P563: 16 | Q563: =O563*6+P563 -> 112 | S563: EMCG
A564: MELBOURNE CITY | C564: 1 | D564: 6 | E564: =C564*6+D564 -> 12 | G564: 3 | H564: 8 | I564: =G564*6+H564 -> 26 | K564: 3 | L564: 11 | M564: =K564*6+L564 -> 29 | O564: 4 | P564: 15 | Q564: =O564*6+P564 -> 39 | S564: HERBERT
A565: BEST PLAYERS
A566: BRUNSWICK | C566: GIBSON | F566: STEVENSON | J566: HARKER | M566: CHANDLER | P566: CHASE | R566: McKENZIE
A567: MELBOURNE CITY | C567: PHILLIPS | F567: PRATT | J567: WILSON | M567: WHITE | P567: QUINN | R567: RUSSELL
A568: GOALKICKERS
A569: BRUNSWICK | C569: HARKER 5 | F569: CHANDLER 4 | I569: CHASE 3 | K569: ROSS | M569: McLEOD | O569: McKENZIE | Q569: GILLESPIE
A570: MELBOURNE CITY | C570: WILSON 2 | F570: QUINN | I570: PHILLIPS
A572: ROUND 13 | E572: 12TH JULY | J572: WEATHER | M572: NORTH WEST WIND | S572: PLAYED AT | X572: LADDER | AB572: ROUND | AD572: 13
D573: 1ST QTR | H573: 2ND QTR | L573: 3RD QTR | P573: FINAL | S573: NORTH MELB
A574: FOOTSCRAY | C574: 5 | D574: 1 | E574: =C574*6+D574 -> 31 | G574: 8 | H574: 1 | I574: =G574*6+H574 -> 49 | K574: 11 | L574: 8 | M574: =K574*6+L574 -> 74 | O574: 13 | P574: 11 | Q574: =O574*6+P574 -> 89 | S574: UMPIRE | W574: TEAM | X574: W | Y574: L | Z574: D | AA574: FOR | AB574: AGST | AC574: % | AD574: PTS
A575: NORTH MELBOURNE | C575: 1 | D575: 2 | E575: =C575*6+D575 -> 8 | G575: 1 | H575: 8 | I575: =G575*6+H575 -> 14 | K575: 3 | L575: 8 | M575: =K575*6+L575 -> 26 | O575: 6 | P575: 10 | Q575: =O575*6+P575 -> 46 | S575: KENDALL
A576: BEST PLAYERS | W576: FOOTSCRAY | X576: 11 | Y576: 2 | Z576: 0 | AA576: 913 | AB576: 544 | AC576: 167.83088235294119 | AD576: 44
A577: FOOTSCRAY | C577: COTTON | E577: BANBURY | H577: CRADDOCK | K577: CLARK | N577: LEVER | Q577: McCLUSKY | W577: NORTH MELBOURNE | X577: 9 | Y577: 3 | Z577: 1 | AA577: 912 | AB577: 654 | AC577: 139.44954128440367 | AD577: 38
A578: NORTH MELBOURNE | C578: HARDY | E578: BARKER | H578: J JOHNSON | K578: K JOHNSON | N578: PEMBERTON | Q578: CARPENTER | W578: PRAHRAN | X578: 9 | Y578: 4 | Z578: 0 | AA578: 932 | AB578: 688 | AC578: 135.46511627906978 | AD578: 36
A579: GOALKICKERS | W579: ESSENDON ASSOC. | X579: 9 | Y579: 4 | Z579: 0 | AA579: 770 | AB579: 727 | AC579: 105.91471801925722 | AD579: 36
A580: FOOTSCRAY | C580: COTTON 6 | F580: BANBURY 2 | I580: LEVER | K580: BAXTER | M580: GREGORY | O580: SPENCE | Q580: SAMSON
A581: NORTH MELBOURNE | C581: HAWKINS 2 | F581: HARDY 2 | I581: CARPENTER | L581: ELLIOTT | W581: BRUNSWICK | X581: 8 | Y581: 4 | Z581: 1 | AA581: 877 | AB581: 661 | AC581: 132.67776096822996 | AD581: 34
W582: WILLIAMSTOWN | X582: 8 | Y582: 5 | Z582: 0 | AA582: 804 | AB582: 619 | AC582: 129.88691437802908 | AD582: 32
A583: PRAHRAN | C583: 1 | D583: 1 | E583: =C583*6+D583 -> 7 | G583: 5 | H583: 7 | I583: =G583*6+H583 -> 37 | K583: 6 | L583: 11 | M583: =K583*6+L583 -> 47 | O583: 9 | P583: 19 | Q583: =O583*6+P583 -> 73 | S583: BRUNSWICK | W583: BRIGHTON | X583: 4 | Y583: 9 | Z583: 0 | AA583: 741 | AB583: 887 | AC583: 83.540022547914319 | AD583: 16
A584: BRUNSWICK | C584: 4 | D584: 5 | E584: =C584*6+D584 -> 29 | G584: 6 | H584: 5 | I584: =G584*6+H584 -> 41 | K584: 8 | L584: 8 | M584: =K584*6+L584 -> 56 | O584: 8 | P584: 9 | Q584: =O584*6+P584 -> 57 | S584: HURLEY | W584: NORTHCOTE | X584: 3 | Y584: 10 | Z584: 0 | AA584: 654 | AB584: 933 | AC584: 70.096463022508033 | AD584: 12
A585: BEST PLAYERS | W585: PORT MELBOURNE | X585: 3 | Y585: 10 | Z585: 0 | AA585: 621 | AB585: 928 | AC585: 66.918103448275858 | AD585: 12
A586: PRAHRAN | C586: GILCHRIST | F586: SIMS | I586: BANT | L586: DOWSING | O586: KERR | Q586: H WILSON | W586: MELBOURNE CITY | X586: 0 | Y586: 13 | Z586: 0 | AA586: 520 | AB586: 1103 | AC586: 47.144152311876702 | AD586: 0
A587: BRUNSWICK | C587: CHANDLER | F587: BRAID | I587: O'CONNOR | L587: McKENZIE | O587: PRICE | Q587: ROSS
A588: GOALKICKERS
A589: PRAHRAN | C589: MARONEY 2 | F589: WEIDNER 2 | I589: FAIRBAIRN | L589: BANT | N589: McKENZIE | P589: WILSON | R589: GILCHRIST
A590: BRUNSWICK | C590: PRICE 3 | F590: CHASE 3 | I590: McKENZIE | L590: HARKER
A592: BRIGHTON | C592: 1 | D592: 1 | E592: =C592*6+D592 -> 7 | G592: 6 | H592: 6 | I592: =G592*6+H592 -> 42 | K592: 7 | L592: 14 | M592: =K592*6+L592 -> 56 | O592: 10 | P592: 19 | Q592: =O592*6+P592 -> 79 | S592: BRIGHTON BEACH
A593: NORTHCOTE | C593: 2 | D593: 6 | E593: =C593*6+D593 -> 18 | G593: 4 | H593: 6 | I593: =G593*6+H593 -> 30 | K593: 8 | L593: 12 | M593: =K593*6+L593 -> 60 | O593: 8 | P593: 15 | Q593: =O593*6+P593 -> 63 | S593: McMURRAY
A594: BEST PLAYERS
A595: BRIGHTON | C595: DAWSON | F595: BELLER | I595: HENDERSON | L595: ESPIE | O595: NEGRO | R595: CLARK
A596: NORTHCOTE | C596: BASSETT | F596: O'KEEFE | I596: COLE | L596: NEWBOUND | O596: HALL | R596: DUNCAN
A597: GOALKICKERS
A598: BRIGHTON | C598: CLARK 3 | F598: GRAHAM 2 | I598: HENDERSON | L598: TURNBULL | O598: DAWSON | Q598: COMER | S598: POWELL
A599: NORTHCOTE | C599: RYAN 3 | F599: RIDD 2 | I599: BASSETT | L599: CLEMENTS | O599: NEWBOUND
A601: ESSENDON ASSOC. | C601: 1 | D601: 3 | E601: =C601*6+D601 -> 9 | G601: 4 | H601: 8 | I601: =G601*6+H601 -> 32 | K601: 6 | L601: 10 | M601: =K601*6+L601 -> 46 | O601: 10 | P601: 13 | Q601: =O601*6+P601 -> 73 | S601: PORT MELB
A602: PORT MELBOURNE | C602: 3 | D602: 2 | E602: =C602*6+D602 -> 20 | G602: 3 | H602: 6 | I602: =G602*6+H602 -> 24 | K602: 4 | L602: 11 | M602: =K602*6+L602 -> 35 | O602: 5 | P602: 11 | Q602: =O602*6+P602 -> 41 | S602: HERBERT
A603: BEST PLAYERS
A604: ESSENDON ASSOC. | C604: COCKRAM | F604: PAIN | I604: ATKINS | L604: DIGGLE | O604: M MADDEN | R604: TURNER
A605: PORT MELBOURNE | C605: CLELAND | F605: BARFOOT | I605: MERRICK | L605: GODDARD | O605: BROWN | R605: COOK
A606: GOALKICKERS
A607: ESSENDON ASSOC. | C607: ERICKSON 2 | F607: TURNER 2 | I607: DIGGLE 2 | L607: CLARKE 2 | O607: ATKINS | Q607: HOARE
A608: PORT MELBOURNE | C608: MERRICK 2 | F608: BARFOOT | I608: WORKMAN | L608: CARDEN
A610: WILLIAMSTOWN | C610: 5 | D610: 4 | E610: =C610*6+D610 -> 34 | G610: 7 | H610: 6 | I610: =G610*6+H610 -> 48 | K610: 12 | L610: 16 | M610: =K610*6+L610 -> 88 | O610: 13 | P610: 19 | Q610: =O610*6+P610 -> 97 | S610: EMCG
A611: MELBOURNE CITY | C611: 1 | D611: 2 | E611: =C611*6+D611 -> 8 | G611: 4 | H611: 2 | I611: =G611*6+H611 -> 26 | K611: 4 | L611: 6 | M611: =K611*6+L611 -> 30 | O611: 7 | P611: 7 | Q611: =O611*6+P611 -> 49 | S611: PORTEOUS
A612: BEST PLAYERS
A613: WILLIAMSTOWN | C613: O'HALLORAN | F613: GRANT | I613: ALLEY | L613: AMY | O613: MATTHEWS | R613: McTAGGART
A614: MELBOURNE CITY | C614: WHITE | F614: DONNELLY | I614: PRATT | L614: PHILLIPS | O614: GILBERT | R614: GREENHILL
A615: GOALKICKERS
A616: WILLIAMSTOWN | C616: MATTHEWS 4 | F616: COWARD 2 | I616: AMY 2 | K616: GIBBS 2 | M616: O'HALLORAN 2 | P616: GRANT
A617: MELBOURNE CITY | C617: QUINN 2 | F617: MONOGHAN 2 | J617: DONNELLY | M617: WILSON | P617: PRATT
A619: ROUND 14 | E619: 19TH JULY | J619: WEATHER | M619: WEST WIND | S619: PLAYED AT | X619: LADDER | AB619: ROUND | AD619: 14
D620: 1ST QTR | H620: 2ND QTR | L620: 3RD QTR | P620: FINAL | S620: FOOTSCRAY
A621: BRUNSWICK | C621: 3 | D621: 1 | E621: =C621*6+D621 -> 19 | G621: 6 | H621: 2 | I621: =G621*6+H621 -> 38 | K621: 8 | L621: 3 | M621: =K621*6+L621 -> 51 | O621: 12 | P621: 8 | Q621: =O621*6+P621 -> 80 | S621: UMPIRE | W621: TEAM | X621: W | Y621: L | Z621: D | AA621: FOR | AB621: AGST | AC621: % | AD621: PTS
A622: FOOTSCRAY | C622: 1 | D622: 0 | E622: =C622*6+D622 -> 6 | G622: 3 | H622: 2 | I622: =G622*6+H622 -> 20 | K622: 5 | L622: 5 | M622: =K622*6+L622 -> 35 | O622: 6 | P622: 7 | Q622: =O622*6+P622 -> 43 | S622: KENDALL
A623: BEST PLAYERS | W623: FOOTSCRAY | X623: 11 | Y623: 3 | Z623: 0 | AA623: 956 | AB623: 624 | AC623: 153.2051282051282 | AD623: 44
A624: BRUNSWICK | C624: ROSS | F624: MCKENZIE | I624: O'CONNOR | L624: SULLIVAN | O624: CHANDLER | R624: BRAID | W624: NORTH MELBOURNE | X624: 10 | Y624: 3 | Z624: 1 | AA624: 983 | AB624: 713 | AC624: 137.86816269284714 | AD624: 42
A625: FOOTSCRAY | C625: McCLUSKY | F625: BRIESE | I625: COTTON | L625: GRIERSON | O625: LEVER | R625: SAMSON | W625: ESSENDON ASSOC. | X625: 10 | Y625: 4 | Z625: 0 | AA625: 876 | AB625: 754 | AC625: 116.18037135278514 | AD625: 40
A626: GOALKICKERS | W626: BRUNSWICK | X626: 9 | Y626: 4 | Z626: 1 | AA626: 957 | AB626: 704 | AC626: 135.9375 | AD626: 38
A627: BRUNSWICK | C627: HARKER 4 | F627: PRICE 3 | I627: McKENZIE 2 | L627: SULLIVAN | O627: O'CONNOR | R627: CARRIE
A628: FOOTSCRAY | C628: COTTON 2 | F628: GRIERSON 2 | J628: HOLMES | M628: SCHADE | W628: PRAHRAN | X628: 9 | Y628: 5 | Z628: 0 | AA628: 970 | AB628: 734 | AC628: 132.1525885558583 | AD628: 36
W629: WILLIAMSTOWN | X629: 9 | Y629: 5 | Z629: 0 | AA629: 850 | AB629: 657 | AC629: 129.3759512937595 | AD629: 36
A630: WILLIAMSTOWN | C630: 5 | D630: 0 | E630: =C630*6+D630 -> 30 | G630: 5 | H630: 1 | I630: =G630*6+H630 -> 31 | K630: 6 | L630: 10 | M630: =K630*6+L630 -> 46 | O630: 6 | P630: 10 | Q630: =O630*6+P630 -> 46 | S630: WILLIAMSTOWN | W630: BRIGHTON | X630: 4 | Y630: 10 | Z630: 0 | AA630: 800 | AB630: 958 | AC630: 83.507306889352819 | AD630: 16
A631: PRAHRAN | C631: 0 | D631: 2 | E631: =C631*6+D631 -> 2 | G631: 1 | H631: 10 | I631: =G631*6+H631 -> 16 | K631: 2 | L631: 11 | M631: =K631*6+L631 -> 23 | O631: 4 | P631: 14 | Q631: =O631*6+P631 -> 38 | S631: RAWLE | W631: PORT MELBOURNE | X631: 4 | Y631: 10 | Z631: 0 | AA631: 697 | AB631: 963 | AC631: 72.377985462097612 | AD631: 16
A632: BEST PLAYERS | W632: NORTHCOTE | X632: 3 | Y632: 11 | Z632: 0 | AA632: 689 | AB632: 1009 | AC632: 68.285431119920716 | AD632: 12
A633: WILLIAMSTOWN | C633: GIBBS | F633: REITMAN | I633: WALLIS | L633: ALLEY | N633: E BUSBRIDGE | Q633: N BUSBRIDGE | W633: MELBOURNE CITY | X633: 0 | Y633: 14 | Z633: 0 | AA633: 547 | AB633: 1209 | AC633: 45.244003308519439 | AD633: 0
A634: PRAHRAN | C634: GILCHRIST | F634: H WILSON | I634: W RYAN | L634: BANT | N634: WEIDNER | Q634: DOWSING
A635: GOALKICKERS
A636: WILLIAMSTOWN | C636: McTAGGART | F636: COWARD | I636: E BUSBRIDGE | L636: GIBBS | N636: GRIEVES | Q636: REITMAN
A637: PRAHRAN | C637: SYKES 2 | F637: SIMS | I637: KERR
A639: NORTH MELBOURNE | C639: 3 | D639: 7 | E639: =C639*6+D639 -> 25 | G639: 3 | H639: 9 | I639: =G639*6+H639 -> 27 | K639: 6 | L639: 10 | M639: =K639*6+L639 -> 46 | O639: 10 | P639: 11 | Q639: =O639*6+P639 -> 71 | S639: BRIGHTON BEACH
A640: BRIGHTON | C640: 0 | D640: 2 | E640: =C640*6+D640 -> 2 | G640: 3 | H640: 9 | I640: =G640*6+H640 -> 27 | K640: 4 | L640: 12 | M640: =K640*6+L640 -> 36 | O640: 7 | P640: 17 | Q640: =O640*6+P640 -> 59 | S640: PORTEOUS
A641: BEST PLAYERS
A642: NORTH MELBOURNE | C642: BARKER | F642: CARPENTER | J642: ELLIOTT | M642: J JOHNSON | P642: McKAY | R642: HAWKINS
A643: BRIGHTON | C643: HENDERSON | F643: DOWDING | J643: CLARK | M643: DAWSON | P643: PEDDLE | R643: BELLER
A644: GOALKICKERS
A645: NORTH MELBOURNE | C645: WILLIAMSON 3 | G645: MATTHEWS 3 | J645: ELLIOTT 2 | M645: K JOHNSON | P645: BARKER
A646: BRIGHTON | C646: BELLER 4 | F646: CLARKE 2 | I646: HENDERSON
A648: PORT MELBOURNE | C648: 0 | D648: 3 | E648: =C648*6+D648 -> 3 | G648: 4 | H648: 8 | I648: =G648*6+H648 -> 32 | K648: 5 | L648: 13 | M648: =K648*6+L648 -> 43 | O648: 10 | P648: 16 | Q648: =O648*6+P648 -> 76 | S648: CROXTON PK
A649: NORTHCOTE | C649: 3 | D649: 4 | E649: =C649*6+D649 -> 22 | G649: 4 | H649: 7 | I649: =G649*6+H649 -> 31 | K649: 4 | L649: 10 | M649: =K649*6+L649 -> 34 | O649: 4 | P649: 11 | Q649: =O649*6+P649 -> 35 | S649: HERBERT
A650: BEST PLAYERS
A651: PORT MELBOURNE | C651: BROWN | F651: BARFOOT | I651: CLELAND | L651: MERRICK | O651: FRANKLIN | R651: WILTON
A652: NORTHCOTE | C652: H THOMAS | F652: HALL | I652: WHITE | L652: RYAN | O652: E THOMAS | R652: O'KEEFE
A653: GOALKICKERS
A654: PORT MELBOURNE | C654: MERRICK 3 | F654: BROWN 2 | I654: BARFOOT 2 | L654: VURTIS | N654: COOK | P654: STEELE
A655: NORTHCOTE | C655: CLEMENTS 2 | F655: H BRAID | I655: RYAN
A657: ESSENDON ASSOC. | C657: 2 | D657: 4 | E657: =C657*6+D657 -> 16 | G657: 6 | H657: 9 | I657: =G657*6+H657 -> 45 | K657: 9 | L657: 13 | M657: =K657*6+L657 -> 67 | O657: 14 | P657: 22 | Q657: =O657*6+P657 -> 106 | S657: ESSENDON
A658: MELBOURNE CITY | C658: 2 | D658: 2 | E658: =C658*6+D658 -> 14 | G658: 3 | H658: 2 | I658: =G658*6+H658 -> 20 | K658: 4 | L658: 3 | M658: =K658*6+L658 -> 27 | O658: 4 | P658: 3 | Q658: =O658*6+P658 -> 27 | S658: McMURRAY
A659: BEST PLAYERS
A660: ESSENDON ASSOC. | C660: J MADDEN | F660: M MADDEN | I660: SEVIOR | L660: COCKRAM | O660: WALKER | R660: DIGGLE
A661: MELBOURNE CITY | C661: WOODS | F661: W SMITH | I661: WALLACE | L661: DONNELLY | O661: PRATT
A662: GOALKICKERS
A663: ESSENDON ASSOC. | C663: J MADDEN 3 | F663: HOARE 2 | I663: GIBSON 2 | K663: ERICKSON 2 | N663: DIGGLE 2 | P663: BICKFORD | R663: WALKER | U663: GOUGH
A664: MELBOURNE CITY | C664: YORSTEN | F664: PRATT | I664: J SMITH | L664: GILBERT
A666: ROUND 15 | E666: 26TH JULY | S666: PLAYED AT | X666: LADDER | AB666: ROUND | AD666: 15
D667: 1ST QTR | H667: 2ND QTR | L667: 3RD QTR | P667: FINAL | S667: FOOTSCRAY
A668: ESSENDON ASSOC. | C668: 3 | D668: 2 | E668: =C668*6+D668 -> 20 | G668: 3 | H668: 5 | I668: =G668*6+H668 -> 23 | K668: 6 | L668: 9 | M668: =K668*6+L668 -> 45 | O668: 7 | P668: 10 | Q668: =O668*6+P668 -> 52 | S668: UMPIRE | W668: TEAM | X668: W | Y668: L | Z668: D | AA668: FOR | AB668: AGST | AC668: % | AD668: PTS
A669: FOOTSCRAY | C669: 0 | D669: 2 | E669: =C669*6+D669 -> 2 | G669: 3 | H669: 4 | I669: =G669*6+H669 -> 22 | K669: 5 | L669: 6 | M669: =K669*6+L669 -> 36 | O669: 7 | P669: 9 | Q669: =O669*6+P669 -> 51 | S669: HURLEY
A670: BEST PLAYERS | W670: NORTH MELBOURNE | X670: 11 | Y670: 3 | Z670: 1 | AA670: 1113 | AB670: 764 | AC670: 145.68062827225131 | AD670: 46
A671: ESSENDON ASSOC. | C671: M MADDEN | F671: ATKINS | I671: DIGGLE | L671: J HOARE | O671: SEVIOR | R671: GOUGH | W671: FOOTSCRAY | X671: 11 | Y671: 4 | Z671: 0 | AA671: 1007 | AB671: 676 | AC671: 148.96449704142012 | AD671: 44
A672: FOOTSCRAY | C672: HOLMES | F672: NEILSON | I672: CLARK | L672: COTTON | O672: GREGORY | R672: McCLUSKY | W672: ESSENDON ASSOC. | X672: 11 | Y672: 4 | Z672: 0 | AA672: 928 | AB672: 805 | AC672: 115.27950310559007 | AD672: 44
A673: GOALKICKERS | W673: BRUNSWICK | X673: 10 | Y673: 4 | Z673: 1 | AA673: 1025 | AB673: 743 | AC673: 137.95423956931359 | AD673: 42
A674: ESSENDON ASSOC. | C674: HOARE 2 | F674: ATKINS | I674: DIGGLE | K674: TURNER | N674: GIBSON | P674: GOUGH
A675: FOOTSCRAY | C675: GREGORY 3 | F675: BAXTER 2 | I675: LEVER | K675: HOLMES | W675: PRAHRAN | X675: 10 | Y675: 5 | Z675: 0 | AA675: 1085 | AB675: 807 | AC675: 134.44857496902105 | AD675: 40
W676: WILLIAMSTOWN | X676: 9 | Y676: 6 | Z676: 0 | AA676: 889 | AB676: 725 | AC676: 122.62068965517241 | AD676: 36
A677: BRUNSWICK | C677: 2 | D677: 2 | E677: =C677*6+D677 -> 14 | G677: 3 | H677: 7 | I677: =G677*6+H677 -> 25 | K677: 6 | L677: 11 | M677: =K677*6+L677 -> 47 | O677: 9 | P677: 14 | Q677: =O677*6+P677 -> 68 | S677: BRUNSWICK | W677: BRIGHTON | X677: 5 | Y677: 10 | Z677: 0 | AA677: 889 | AB677: 1013 | AC677: 87.759131293188545 | AD677: 20
A678: WILLIAMSTOWN | C678: 1 | D678: 2 | E678: =C678*6+D678 -> 8 | G678: 3 | H678: 4 | I678: =G678*6+H678 -> 22 | K678: 4 | L678: 5 | M678: =K678*6+L678 -> 29 | O678: 5 | P678: 9 | Q678: =O678*6+P678 -> 39 | S678: CHISHOLM | W678: PORT MELBOURNE | X678: 4 | Y678: 11 | Z678: 0 | AA678: 770 | AB678: 1078 | AC678: 71.428571428571431 | AD678: 16
A679: BEST PLAYERS | W679: NORTHCOTE | X679: 3 | Y679: 12 | Z679: 0 | AA679: 740 | AB679: 1139 | AC679: 64.969271290605789 | AD679: 12
A680: BRUNSWICK | C680: McKENZIE | F680: CHASE | I680: O'CONNOR | L680: CHANDLER | O680: McLEOD | R680: ROSS | W680: MELBOURNE CITY | X680: 0 | Y680: 15 | Z680: 0 | AA680: 602 | AB680: 1298 | AC680: 46.379044684129433 | AD680: 0
A681: WILLIAMSTOWN | C681: REITMAN | F681: McDONALD | I681: O'HALLORAN | L681: McTAGGART | O681: GRANT | R681: ALLEY
A682: GOALKICKERS
A683: BRUNSWICK | C683: McKENZIE 4 | F683: STEVENSON 2 | J683: HARKER 2 | M683: CARRIE
A684: WILLIAMSTOWN | C684: McTAGGART 2 | G684: AMY 2 | J684: E BUSBRIDGE
A686: PRAHRAN | C686: 4 | D686: 0 | E686: =C686*6+D686 -> 24 | G686: 11 | H686: 6 | I686: =G686*6+H686 -> 72 | K686: 14 | L686: 6 | M686: =K686*6+L686 -> 90 | O686: 18 | P686: 7 | Q686: =O686*6+P686 -> 115 | S686: TOORAK PARK
A687: PORT MELBOURNE | C687: 6 | D687: 2 | E687: =C687*6+D687 -> 38 | G687: 6 | H687: 4 | I687: =G687*6+H687 -> 40 | K687: 8 | L687: 12 | M687: =K687*6+L687 -> 60 | O687: 9 | P687: 19 | Q687: =O687*6+P687 -> 73 | S687: McMURRAY
A688: BEST PLAYERS
A689: PRAHRAN | C689: GILCHRIST | F689: RYAN | I689: CARLSON | L689: BANT | O689: WEIDNER | R689: H WILSON
A690: PORT MELBOURNE | C690: BARFOOT | F690: ANDERSON | I690: MERRICK | L690: BROWN | O690: SAMSON | R690: CLELAND
A691: GOALKICKERS
A692: PRAHRAN | C692: KERR 3 | E692: WILSON 3 | H692: FAIRBAIRN 2 | K692: GILCHRIST 2 | N692: SYKES 2 | P692: MARONEY 2 | S692: DOWSING | W692: WOODHEAD
A693: PORT MELBOURNE | C693: BARFOOT 3 | F693: PARR 2 | I693: STEELE 2 | L693: MERRICK 2
A695: BRIGHTON | C695: 2 | D695: 3 | E695: =C695*6+D695 -> 15 | G695: 5 | H695: 10 | I695: =G695*6+H695 -> 40 | K695: 8 | L695: 13 | M695: =K695*6+L695 -> 61 | O695: 12 | P695: 17 | Q695: =O695*6+P695 -> 89 | S695: BRIGHTON BEACH
A696: MELBOURNE CITY | C696: 2 | D696: 6 | E696: =C696*6+D696 -> 18 | G696: 4 | H696: 6 | I696: =G696*6+H696 -> 30 | K696: 8 | L696: 7 | M696: =K696*6+L696 -> 55 | O696: 8 | P696: 7 | Q696: =O696*6+P696 -> 55 | S696: HERBERT
A697: BEST PLAYERS
A698: BRIGHTON | C698: TURNBULL | F698: BELLER | I698: NEGRO | L698: DAWSON | O698: POWELL | R698: DOWDING
A699: MELBOURNE CITY | C699: DONNELLY | F699: WOODS | I699: WALLACE | L699: W SMITH | O699: GREENHILL | R699: WHITE
A700: GOALKICKERS
A701: BRIGHTON | C701: POWELL 4 | F701: DAWSON 4 | I701: BELLER 2 | L701: TURNBULL | O701: CLARKE
A702: MELBOURNE CITY | C702: WILTON 4 | F702: PHILLIPS | I702: DANIELS | L702: MUMFORD | O702: QUINN
A704: NORTH MELBOURNE | C704: 6 | D704: 4 | E704: =C704*6+D704 -> 40 | G704: 9 | H704: 6 | I704: =G704*6+H704 -> 60 | K704: 16 | L704: 8 | M704: =K704*6+L704 -> 104 | O704: 20 | P704: 10 | Q704: =O704*6+P704 -> 130 | S704: NORTH MELB
A705: NORTHCOTE | C705: 0 | D705: 2 | E705: =C705*6+D705 -> 2 | G705: 3 | H705: 4 | I705: =G705*6+H705 -> 22 | K705: 4 | L705: 5 | M705: =K705*6+L705 -> 29 | O705: 7 | P705: 9 | Q705: =O705*6+P705 -> 51 | S705: KENDALL
A706: BEST PLAYERS
A707: NORTH MELBOURNE | C707: BARKER | F707: PEMBERTON | I707: NELSON | L707: CARPENTER | O707: MATTHEWS | R707: McKAY
A708: NORTHCOTE | C708: SWIFT | F708: HALL | I708: COLE | L708: O'LOUGHLEN | O708: NEWBOUND | R708: RYAN
A709: GOALKICKERS
A710: NORTH MELBOURNE | C710: WILLIAMSON 11 | G710: CARPENTER 6 | K710: K JOHNSON 2 | O710: ROACH
A711: NORTHCOTE | C711: RYAN 4 | F711: O'LOUGHLEN | J711: O'KEEFE
A713: ROUND 16 | E713: 2ND AUGUST | J713: WEATHER | M713: NORTH WIND RAIN | S713: PLAYED AT | X713: LADDER | AB713: ROUND | AD713: 16
D714: 1ST QTR | H714: 2ND QTR | L714: 3RD QTR | P714: FINAL | S714: NORTH MELB
A715: NORTH MELBOURNE | C715: 6 | D715: 3 | E715: =C715*6+D715 -> 39 | G715: 6 | H715: 4 | I715: =G715*6+H715 -> 40 | K715: 7 | L715: 8 | M715: =K715*6+L715 -> 50 | O715: 7 | P715: 12 | Q715: =O715*6+P715 -> 54 | S715: UMPIRE | W715: TEAM | X715: W | Y715: L | Z715: D | AA715: FOR | AB715: AGST | AC715: % | AD715: PTS
A716: PRAHRAN | C716: 0 | D716: 0 | E716: =C716*6+D716 -> 0 | G716: 1 | H716: 4 | I716: =G716*6+H716 -> 10 | K716: 2 | L716: 5 | M716: =K716*6+L716 -> 17 | O716: 6 | P716: 8 | Q716: =O716*6+P716 -> 44 | S716: HERBERT
A717: BEST PLAYERS | W717: NORTH MELBOURNE | X717: 12 | Y717: 3 | Z717: 1 | AA717: 1167 | AB717: 808 | AC717: 144.43069306930693 | AD717: 50
A718: NORTH MELBOURNE | C718: HARDY | F718: SHEEHAN | I718: McKAY | L718: BARKER | O718: LAVER | Q718: CARPENTER | W718: FOOTSCRAY | X718: 12 | Y718: 4 | Z718: 0 | AA718: 1061 | AB718: 696 | AC718: 152.44252873563218 | AD718: 48
A719: PRAHRAN | C719: MARONEY | F719: BANT | I719: SIMS | L719: GILCHRIST | O719: ELLIN | Q719: CARLSON | W719: ESSENDON ASSOC. | X719: 12 | Y719: 4 | Z719: 0 | AA719: 1014 | AB719: 857 | AC719: 118.31971995332556 | AD719: 48
A720: GOALKICKERS | W720: BRUNSWICK | X720: 11 | Y720: 4 | Z720: 1 | AA720: 1141 | AB720: 817 | AC720: 139.65728274173807 | AD720: 46
A721: NORTH MELBOURNE | C721: ELLIOTT 2 | F721: HARDY 2 | I721: BARKER | K721: McKAY | M721: LAVER
A722: PRAHRAN | C722: BANT 2 | F722: MARONEY 2 | I722: WEIDNER | L722: SYKES | W722: PRAHRAN | X722: 10 | Y722: 6 | Z722: 0 | AA722: 1129 | AB722: 861 | AC722: 131.12659698025553 | AD722: 40
W723: WILLIAMSTOWN | X723: 10 | Y723: 6 | Z723: 0 | AA723: 943 | AB723: 773 | AC723: 121.99223803363519 | AD723: 40
A724: ESSENDON ASSOC. | C724: 5 | D724: 2 | E724: =C724*6+D724 -> 32 | G724: 6 | H724: 2 | I724: =G724*6+H724 -> 38 | K724: 10 | L724: 12 | M724: =K724*6+L724 -> 72 | O724: 12 | P724: 14 | Q724: =O724*6+P724 -> 86 | S724: ESSENDON | W724: BRIGHTON | X724: 5 | Y724: 11 | Z724: 0 | AA724: 941 | AB724: 1099 | AC724: 85.623293903548685 | AD724: 20
A725: BRIGHTON | C725: 1 | D725: 2 | E725: =C725*6+D725 -> 8 | G725: 5 | H725: 6 | I725: =G725*6+H725 -> 36 | K725: 5 | L725: 8 | M725: =K725*6+L725 -> 38 | O725: 6 | P725: 16 | Q725: =O725*6+P725 -> 52 | S725: PORTEOUS | W725: PORT MELBOURNE | X725: 4 | Y725: 12 | Z725: 0 | AA725: 818 | AB725: 1132 | AC725: 72.261484098939931 | AD725: 16
A726: BEST PLAYERS | W726: NORTHCOTE | X726: 3 | Y726: 13 | Z726: 0 | AA726: 814 | AB726: 1255 | AC726: 64.860557768924309 | AD726: 12
A727: ESSENDON ASSOC. | C727: WALKER | F727: CLARKE | I727: M MADDEN | L727: DIGGLE | O727: SEVIOR | W727: MELBOURNE CITY | X727: 0 | Y727: 16 | Z727: 0 | AA727: 622 | AB727: 1352 | AC727: 46.005917159763314 | AD727: 0
A728: BRIGHTON | C728: CLARKE | F728: PATTERSON | I728: BELLER | L728: GRAHAM | O728: HENDERSON | R728: DOWDING
A729: GOALKICKERS
A730: ESSENDON ASSOC. | C730: DIGGLE 4 | F730: TURNER 2 | I730: HARRIS 2 | L730: CLARKE 2 | O730: PAIN | Q730: SEVIOR | S730: HOARE
A731: BRIGHTON | C731: DOWDING 2 | F731: GRAHAM 2 | I731: BELLER | K731: HENDERSON
A733: WILLIAMSTOWN | C733: 0 | D733: 0 | E733: =C733*6+D733 -> 0 | G733: 4 | H733: 4 | I733: =G733*6+H733 -> 28 | K733: 5 | L733: 5 | M733: =K733*6+L733 -> 35 | O733: 8 | P733: 6 | Q733: =O733*6+P733 -> 54 | S733: PORT MELB
A734: PORT MELBOURNE | C734: 2 | D734: 5 | E734: =C734*6+D734 -> 17 | G734: 2 | H734: 6 | I734: =G734*6+H734 -> 18 | K734: 5 | L734: 7 | M734: =K734*6+L734 -> 37 | O734: 6 | P734: 12 | Q734: =O734*6+P734 -> 48 | S734: McMURRAY
A735: BEST PLAYERS
A736: WILLIAMSTOWN | C736: GIBBS | F736: HOEY | I736: REITMAN | L736: E BUSBRIDGE | P736: WALLIS
A737: PORT MELBOURNE | C737: HAIGHBLOOM | F737: ANDERSON | I737: BARFOOT | L737: FRANKLIN | P737: MERRICK | S737: CARDEN
A738: GOALKICKERS
A739: WILLIAMSTOWN | C739: GIBBS 2 | F739: E BUSBRIDGE 2 | J739: ANDERSON | M739: MAY | O739: McDONALD | R739: WALLIS
A740: PORT MELBOURNE | C740: HAIGHBLOOM 2 | G740: ANDERSON | J740: WALTON | M740: BULL | O740: HEALY
A742: BRUNSWICK | C742: 5 | D742: 5 | E742: =C742*6+D742 -> 35 | G742: 7 | H742: 5 | I742: =G742*6+H742 -> 47 | K742: 12 | L742: 11 | M742: =K742*6+L742 -> 83 | O742: 17 | P742: 14 | Q742: =O742*6+P742 -> 116 | S742: CROXTON PK
A743: NORTHCOTE | C743: 1 | D743: 0 | E743: =C743*6+D743 -> 6 | G743: 5 | H743: 8 | I743: =G743*6+H743 -> 38 | K743: 5 | L743: 11 | M743: =K743*6+L743 -> 41 | O743: 10 | P743: 14 | Q743: =O743*6+P743 -> 74 | S743: KENDALL
A744: BEST PLAYERS
A745: BRUNSWICK | C745: CHASE | F745: MILLS | I745: CARRIE | L745: PRICE | O745: MCKENZIE | R745: SULLIVAN
A746: NORTHCOTE | C746: H THOMAS | F746: E THOMAS | I746: BASSETT | L746: SMITH | O746: BILLETT | R746: COLE
A747: GOALKICKERS
A748: BRUNSWICK | C748: HARKER 3 | F748: ROSS 3 | H748: SULLIVAN 3 | K748: PRICE 2 | M748: STEVENSON 2 | P748: McKENZIE 2 | S748: MILLS | U748: CHANDLER
A749: NORTHCOTE | C749: RYAN 4 | F749: O'LOUGHLEN 2 | J749: BRAID | L749: BILLETT | N749: BASSETT | Q749: MOORE
A751: FOOTSCRAY | C751: 3 | D751: 7 | E751: =C751*6+D751 -> 25 | G751: 3 | H751: 10 | I751: =G751*6+H751 -> 28 | K751: 6 | L751: 10 | M751: =K751*6+L751 -> 46 | O751: 7 | P751: 12 | Q751: =O751*6+P751 -> 54 | S751: EMCG
A752: MELBOURNE CITY | C752: 0 | D752: 1 | E752: =C752*6+D752 -> 1 | G752: 1 | H752: 2 | I752: =G752*6+H752 -> 8 | K752: 1 | L752: 5 | M752: =K752*6+L752 -> 11 | O752: 2 | P752: 8 | Q752: =O752*6+P752 -> 20 | S752: RAWLE
A753: BEST PLAYERS
A754: FOOTSCRAY | C754: LEVER | F754: HARRIS | I754: BAXTER | L754: HOLMES | O754: CLARK | R754: NEILSON
A755: MELBOURNE CITY | C755: PRATT | F755: DONNELLY | I755: WOODS | L755: SMITH | O755: WALLACE | R755: MONOGHAN
A756: GOALKICKERS
A757: FOOTSCRAY | C757: COUCH 2 | F757: HOLMES 2 | I757: SMITH | K757: CLARK | M757: GRIERSON
A758: MELBOURNE CITY | C758: MOUNTFORD | F758: TAMBLYN
A760: ROUND 17 | E760: 9TH AUGUST | J760: WEATHER | M760: STRONG NORTH WEST WIND | S760: PLAYED AT | X760: LADDER | AB760: ROUND | AD760: 17
D761: 1ST QTR | H761: 2ND QTR | L761: 3RD QTR | P761: FINAL | S761: NORTH MELB
A762: BRUNSWICK | C762: 5 | D762: 1 | E762: =C762*6+D762 -> 31 | G762: 7 | H762: 3 | I762: =G762*6+H762 -> 45 | K762: 7 | L762: 9 | M762: =K762*6+L762 -> 51 | O762: 10 | P762: 14 | Q762: =O762*6+P762 -> 74 | S762: UMPIRE | W762: TEAM | X762: W | Y762: L | Z762: D | AA762: FOR | AB762: AGST | AC762: % | AD762: PTS
A763: NORTH MELBOURNE | C763: 1 | D763: 3 | E763: =C763*6+D763 -> 9 | G763: 5 | H763: 6 | I763: =G763*6+H763 -> 36 | K763: 6 | L763: 10 | M763: =K763*6+L763 -> 46 | O763: 7 | P763: 10 | Q763: =O763*6+P763 -> 52 | S763: HURLEY
A764: BEST PLAYERS | W764: FOOTSCRAY | X764: 13 | Y764: 4 | Z764: 0 | AA764: 1150 | AB764: 739 | AC764: 155.61569688768606 | AD764: 52
A765: BRUNSWICK | C765: McKENZIE | F765: BRAID | I765: CHANDLER | L765: HARKER | O765: SULLIVAN | R765: McLEOD | W765: BRUNSWICK | X765: 12 | Y765: 4 | Z765: 1 | AA765: 1215 | AB765: 869 | AC765: 139.81588032220944 | AD765: 50
A766: NORTH MELBOURNE | C766: SHEEHAN | F766: JONES | I766: K JOHNSON | L766: CARPENTER | O766: HARDY | R766: WALSH | W766: NORTH MELBOURNE | X766: 12 | Y766: 4 | Z766: 1 | AA766: 1219 | AB766: 882 | AC766: 138.20861678004536 | AD766: 50
A767: GOALKICKERS | W767: ESSENDON ASSOC. | X767: 12 | Y767: 5 | Z767: 0 | AA767: 1059 | AB767: 911 | AC767: 116.24588364434688 | AD767: 48
A768: BRUNSWICK | C768: SULLIVAN 4 | F768: PRICE 2 | I768: HARKER | K768: STEVENSON | N768: McKENZIE | Q768: O'CONNOR
A769: NORTH MELBOURNE | C769: CARPENTER 3 | G769: ELLIOTT | I769: K JOHNSON | L769: HARDY | N769: McKAY | W769: WILLIAMSTOWN | X769: 11 | Y769: 6 | Z769: 0 | AA769: 997 | AB769: 818 | AC769: 121.88264058679707 | AD769: 44
W770: PRAHRAN | X770: 10 | Y770: 7 | Z770: 0 | AA770: 1174 | AB770: 910 | AC770: 129.01 | AD770: 40
A771: WILLIAMSTOWN | C771: 1 | D771: 2 | E771: =C771*6+D771 -> 8 | G771: 1 | H771: 4 | I771: =G771*6+H771 -> 10 | K771: 6 | L771: 11 | M771: =K771*6+L771 -> 47 | O771: 7 | P771: 12 | Q771: =O771*6+P771 -> 54 | S771: WILLIAMSTOWN | W771: BRIGHTON | X771: 5 | Y771: 12 | Z771: 0 | AA771: 984 | AB771: 1188 | AC771: 82.83 | AD771: 20
A772: ESSENDON ASSOC. | C772: 1 | D772: 5 | E772: =C772*6+D772 -> 11 | G772: 3 | H772: 6 | I772: =G772*6+H772 -> 24 | K772: 4 | L772: 7 | M772: =K772*6+L772 -> 31 | O772: 6 | P772: 9 | Q772: =O772*6+P772 -> 45 | S772: PORTEOUS | W772: PORT MELBOURNE | X772: 5 | Y772: 12 | Z772: 0 | AA772: 924 | AB772: 1162 | AC772: 79.52 | AD772: 20
A773: BEST PLAYERS | W773: NORTHCOTE | X773: 4 | Y773: 13 | Z773: 0 | AA773: 863 | AB773: 1300 | AC773: 66.38 | AD773: 16
A774: WILLIAMSTOWN | C774: GIBBS | F774: O'HALLORAN | I774: REITMAN | L774: N BUSBRIDGE | O774: ALLEY | Q774: McTAGGART | W774: MELBOURNE CITY | X774: 0 | Y774: 17 | Z774: 0 | AA774: 652 | AB774: 1458 | AC774: 44.72 | AD774: 0
A775: ESSENDON ASSOC. | C775: PAIN | F775: HOARE | I775: M MADDEN | L775: McINTYRE | O775: J MADDEN | R775: SEVIOR
A776: GOALKICKERS
A777: WILLIAMSTOWN | C777: AMY 2 | F777: McTAGGART 2 | J777: GRANT | M777: GIBBS | O777: McDONALD
A778: ESSENDON ASSOC. | C778: CLARKE 4 | F778: ATKINS | I778: BICKFORD
A780: FOOTSCRAY | C780: 4 | D780: 6 | E780: =C780*6+D780 -> 30 | G780: 4 | H780: 10 | I780: =G780*6+H780 -> 34 | K780: 9 | L780: 17 | M780: =K780*6+L780 -> 71 | O780: 11 | P780: 23 | Q780: =O780*6+P780 -> 89 | S780: FOOTSCRAY
A781: BRIGHTON | C781: 1 | D781: 0 | E781: =C781*6+D781 -> 6 | G781: 5 | H781: 5 | I781: =G781*6+H781 -> 35 | K781: 5 | L781: 5 | M781: =K781*6+L781 -> 35 | O781: 6 | P781: 7 | Q781: =O781*6+P781 -> 43 | S781: HERBERT
A782: BEST PLAYERS
A783: FOOTSCRAY | C783: A CLARK | F783: COTTON | I783: BANBURY | L783: BAXTER | O783: McCLUSKY | R783: NEILSON
A784: BRIGHTON | C784: COMER | F784: BELLER | I784: GRAHAM | L784: DOWDING | O784: TURNBULL | R784: BUCKLEY
A785: GOALKICKERS
A786: FOOTSCRAY | C786: CROUCH 2 | F786: HOLMES 2 | I786: SMITH | K786: BANBURY | M786: BAXTER | O786: COTTON | Q786: SPENCE | S786: CLARK | U786: GREGORY
A787: BRIGHTON | C787: COMER 3 | F787: PATTERSON | I787: HENDERSON | L787: RYAN
A789: PORT MELBOURNE | C789: 2 | D789: 1 | E789: =C789*6+D789 -> 13 | G789: 5 | H789: 6 | I789: =G789*6+H789 -> 36 | K789: 10 | L789: 9 | M789: =K789*6+L789 -> 69 | O789: 16 | P789: 10 | Q789: =O789*6+P789 -> 106 | S789: PORT MELB
A790: MELBOURNE CITY | C790: 2 | D790: 2 | E790: =C790*6+D790 -> 14 | G790: 2 | H790: 3 | I790: =G790*6+H790 -> 15 | K790: 3 | L790: 9 | M790: =K790*6+L790 -> 27 | O790: 3 | P790: 12 | Q790: =O790*6+P790 -> 30 | S790: KENDALL
A791: BEST PLAYERS
A792: PORT MELBOURNE | C792: MERRICK | F792: BROWN | I792: ANDERSON | L792: WATSON | O792: CLELAND | R792: PARR
A793: MELBOURNE CITY | C793: PHILLIPS | F793: SMITH | I793: DONNELLY
A794: GOALKICKERS
A795: PORT MELBOURNE | C795: PARR 4 | F795: MERRICK 4 | I795: WATSON 3 | L795: ANDERSON 2 | O795: ELLIOT | Q795: BROWN | S795: CLELAND
A796: MELBOURNE CITY | C796: DONNELLY | F796: MOUNTFORD | I796: DANIELS
A798: NORTHCOTE | C798: 3 | D798: 3 | E798: =C798*6+D798 -> 21 | G798: 4 | H798: 5 | I798: =G798*6+H798 -> 29 | K798: 7 | L798: 6 | M798: =K798*6+L798 -> 48 | O798: 7 | P798: 7 | Q798: =O798*6+P798 -> 49 | S798: CROXTON PK
A799: PRAHRAN | C799: 2 | D799: 1 | E799: =C799*6+D799 -> 13 | G799: 2 | H799: 4 | I799: =G799*6+H799 -> 16 | K799: 2 | L799: 8 | M799: =K799*6+L799 -> 20 | O799: 5 | P799: 15 | Q799: =O799*6+P799 -> 45 | S799: RAWLE
A800: BEST PLAYERS
A801: NORTHCOTE | C801: H THOMAS | F801: COLE | I801: DUNCAN | L801: E THOMAS | O801: MOORE | R801: BASSETT
A802: PRAHRAN | C802: BANT | F802: ELLIN | I802: MAYNARD | L802: WEIDNER | O802: CARLSON | R802: GILCHRIST
A803: GOALKICKERS
A804: NORTHCOTE | C804: RYAN 2 | F804: CATON | I804: CLEMENTS | L804: DUNCAN | O804: KRUGER | Q804: O'LOUGHLEN
A805: PRAHRAN | C805: BANT 2 | F805: DALY | I805: CARLSON | L805: KERR
A807: ROUND 18 | E807: 16TH AUGUST | J807: WEATHER | M807: NORTH WIND SHOWERS | S807: PLAYED AT | X807: LADDER | AB807: ROUND | AD807: 18
D808: 1ST QTR | H808: 2ND QTR | L808: 3RD QTR | P808: FINAL | S808: BRUNSWICK
A809: ESSENDON ASSOC. | C809: 2 | D809: 5 | E809: =C809*6+D809 -> 17 | G809: 6 | H809: 8 | I809: =G809*6+H809 -> 44 | K809: 7 | L809: 10 | M809: =K809*6+L809 -> 52 | O809: 14 | P809: 11 | Q809: =O809*6+P809 -> 95 | S809: UMPIRE | W809: TEAM | X809: W | Y809: L | Z809: D | AA809: FOR | AB809: AGST | AC809: % | AD809: PTS
A810: BRUNSWICK | C810: 1 | D810: 3 | E810: =C810*6+D810 -> 9 | G810: 2 | H810: 6 | I810: =G810*6+H810 -> 18 | K810: 6 | L810: 11 | M810: =K810*6+L810 -> 47 | O810: 7 | P810: 12 | Q810: =O810*6+P810 -> 54 | S810: KENDALL
A811: BEST PLAYERS | W811: FOOTSCRAY | X811: 14 | Y811: 4 | Z811: 0 | AA811: 1208 | AB811: 779 | AC811: 155.07060333761231 | AD811: 56
A812: ESSENDON ASSOC. | C812: HOARE | F812: PAIN | I812: M MADDEN | L812: GIBSON | O812: DIGGLE | R812: CLARKE | W812: NORTH MELBOURNE | X812: 13 | Y812: 4 | Z812: 1 | AA812: 1317 | AB812: 942 | AC812: 139.80891719745222 | AD812: 54
A813: BRUNSWICK | C813: McLEOD | F813: McKENZIE | I813: ROSS | L813: SULLIVAN | O813: GEORGE | R813: GIBSON | W813: ESSENDON ASSOC. | X813: 13 | Y813: 5 | Z813: 0 | AA813: 1154 | AB813: 965 | AC813: 119.58549222797927 | AD813: 52
A814: GOALKICKERS | W814: BRUNSWICK | X814: 12 | Y814: 5 | Z814: 1 | AA814: 1269 | AB814: 964 | AC814: 131.6390041493776 | AD814: 50
A815: ESSENDON ASSOC. | C815: CLARKE 8 | F815: DIGGLE 3 | I815: WALKER | L815: J MADDEN | O815: PAIN
A816: BRUNSWICK | C816: McKENZIE 2 | F816: BRAID | I816: STANCLIFFE | L816: HARKER | N816: STEVENSON | W816: WILLIAMSTOWN | X816: 12 | Y816: 6 | Z816: 0 | AA816: 1082 | AB816: 876 | AC816: 123.51598173515981 | AD816: 48
W817: PRAHRAN | X817: 10 | Y817: 8 | Z817: 0 | AA817: 1214 | AB817: 968 | AC817: 125.41322314049587 | AD817: 40
A818: FOOTSCRAY | C818: 1 | D818: 3 | E818: =C818*6+D818 -> 9 | G818: 1 | H818: 5 | I818: =G818*6+H818 -> 11 | K818: 3 | L818: 9 | M818: =K818*6+L818 -> 27 | O818: 7 | P818: 16 | Q818: =O818*6+P818 -> 58 | S818: TOORAK PARK | W818: BRIGHTON | X818: 5 | Y818: 13 | Z818: 0 | AA818: 1042 | AB818: 1273 | AC818: 81.853888452474465 | AD818: 20
A819: PRAHRAN | C819: 1 | D819: 7 | E819: =C819*6+D819 -> 13 | G819: 2 | H819: 8 | I819: =G819*6+H819 -> 20 | K819: 4 | L819: 9 | M819: =K819*6+L819 -> 33 | O819: 5 | P819: 10 | Q819: =O819*6+P819 -> 40 | S819: McMURRAY | W819: PORT MELBOURNE | X819: 5 | Y819: 13 | Z819: 0 | AA819: 984 | AB819: 1260 | AC819: 78.095238095238102 | AD819: 20
A820: BEST PLAYERS | W820: NORTHCOTE | X820: 5 | Y820: 13 | Z820: 0 | AA820: 957 | AB820: 1328 | AC820: 72.063253012048193 | AD820: 20
A821: FOOTSCRAY | C821: CLARK | F821: LAVER | I821: SPENCE | L821: CRADDOCK | O821: COTTON | Q821: BANBURY | W821: MELBOURNE CITY | X821: 0 | Y821: 18 | Z821: 0 | AA821: 680 | AB821: 1552 | AC821: 43.814432989690722 | AD821: 0
A822: PRAHRAN | C822: BANT | F822: GILCHRIST | I822: WEIDNER | L822: MARONEY | O822: SIMS | Q822: WOODHEAD
A823: GOALKICKERS
A824: FOOTSCRAY | C824: BANBURY 3 | F824: SPENCE 2 | I824: SMITH | K824: BAXTER
A825: PRAHRAN | C825: MAYNARD 2 | F825: CARLSON | I825: WILSON | K825: MARONEY
A827: WILLIAMSTOWN | C827: 1 | D827: 5 | E827: =C827*6+D827 -> 11 | G827: 5 | H827: 8 | I827: =G827*6+H827 -> 38 | K827: 9 | L827: 11 | M827: =K827*6+L827 -> 65 | O827: 11 | P827: 19 | Q827: =O827*6+P827 -> 85 | S827: BRIGHTON BEACH
A828: BRIGHTON | C828: 1 | D828: 4 | E828: =C828*6+D828 -> 10 | G828: 2 | H828: 7 | I828: =G828*6+H828 -> 19 | K828: 8 | L828: 8 | M828: =K828*6+L828 -> 56 | O828: 8 | P828: 10 | Q828: =O828*6+P828 -> 58 | S828: HERBERT
A829: BEST PLAYERS
A830: WILLIAMSTOWN | C830: REITMAN | F830: GIBBS | I830: HOEY | L830: McTAGGART | O830: ALLEY | R830: ANDERSON
A831: BRIGHTON | C831: CLARK | F831: TURNBULL | I831: GRAHAM | L831: HENDERSON | O831: BELLER | R831: DOWDING
A832: GOALKICKERS
A833: WILLIAMSTOWN | C833: HOEY 3 | F833: AMY 2 | I833: E BUSBRIDGE 2 | M833: McTAGGART 2 | Q833: GRANT | S833: GIBBS
A834: BRIGHTON | C834: DOWDING 4 | F834: COMER 3 | I834: INGLIS
A836: NORTH MELBOURNE | C836: 3 | D836: 4 | E836: =C836*6+D836 -> 22 | G836: 8 | H836: 11 | I836: =G836*6+H836 -> 59 | K836: 10 | L836: 13 | M836: =K836*6+L836 -> 73 | O836: 13 | P836: 20 | Q836: =O836*6+P836 -> 98 | S836: PORT MELB
A837: PORT MELBOURNE | C837: 4 | D837: 3 | E837: =C837*6+D837 -> 27 | G837: 6 | H837: 4 | I837: =G837*6+H837 -> 40 | K837: 8 | L837: 6 | M837: =K837*6+L837 -> 54 | O837: 9 | P837: 6 | Q837: =O837*6+P837 -> 60 | S837: PORTEOUS
A838: BEST PLAYERS
A839: NORTH MELBOURNE | C839: J JOHNSON | F839: K JOHNSON | I839: TRELOAR | L839: HARDY | O839: T JONES | R839: GARDINER
A840: PORT MELBOURNE | C840: BARFOOT | F840: MERRICK | I840: ANDERSON | L840: FRANKLIN | O840: CLELAND | R840: WORKMAN
A841: GOALKICKERS
A842: NORTH MELBOURNE | C842: ROACH 3 | F842: CARPENTER 2 | I842: K JOHNSON 2 | L842: HARDY 2 | N842: GARDINER | Q842: J JOHNSON | T842: HAWKINS | W842: WALSH
A843: PORT MELBOURNE | C843: WALTON 2 | F843: ANDERSON 2 | J843: BARFOOT | M843: MERRICK | O843: BULL | Q843: PARR
A845: NORTHCOTE | C845: 4 | D845: 5 | E845: =C845*6+D845 -> 29 | G845: 6 | H845: 5 | I845: =G845*6+H845 -> 41 | K845: 10 | L845: 9 | M845: =K845*6+L845 -> 69 | O845: 14 | P845: 10 | Q845: =O845*6+P845 -> 94 | S845: EMCG
A846: MELBOURNE CITY | C846: 0 | D846: 1 | E846: =C846*6+D846 -> 1 | G846: 2 | H846: 3 | I846: =G846*6+H846 -> 15 | K846: 3 | L846: 3 | M846: =K846*6+L846 -> 21 | O846: 4 | P846: 4 | Q846: =O846*6+P846 -> 28 | S846: HURLEY
A847: BEST PLAYERS
A848: NORTHCOTE | D848: BASSETT | G848: MOORE | J848: DUNCAN | M848: NEWBOUND | P848: BRAID | S848: COLE
A849: MELBOURNE CITY | D849: PHILLIPS | G849: W SMITH | J849: QUINN | M849: BIGNELL | P849: PRATT | S849: DONNELLY
A850: GOALKICKERS
A851: NORTHCOTE | D851: BRAID 8 | G851: RYAN 3 | J851: CLEMENTS 2 | M851: SWIFT
A852: MELBOURNE CITY | D852: GILBERT 2 | G852: PHILLIPS | J852: BIGNELL
A854: FINALS
A855: 1ST SEMI | E855: 23RD AUGUST | J855: WEATHER | L855: NORTH WIND SLIPPERY AFTER RAIN
D856: 1ST QTR | H856: 2ND QTR | L856: 3RD QTR | P856: FINAL
A857: FOOTSCRAY | C857: 3 | D857: 5 | E857: =C857*6+D857 -> 23 | G857: 4 | H857: 9 | I857: =G857*6+H857 -> 33 | K857: 5 | L857: 11 | M857: =K857*6+L857 -> 41 | O857: 7 | P857: 13 | Q857: =O857*6+P857 -> 55 | S857: M.C.G.
A858: ESSENDON ASSOC. | C858: 0 | D858: 1 | E858: =C858*6+D858 -> 1 | G858: 2 | H858: 3 | I858: =G858*6+H858 -> 15 | K858: 6 | L858: 3 | M858: =K858*6+L858 -> 39 | O858: 8 | P858: 5 | Q858: =O858*6+P858 -> 53 | S858: HURLEY
A859: BEST PLAYERS
A860: FOOTSCRAY | D860: BAXTER | G860: A CLARK | J860: GREGORY | M860: COTTON | P860: CRADDOCK | S860: NEILSON
A861: ESSENDON ASSOC. | D861: DIGGLE | G861: HOARE | J861: GOUGH | M861: PAIN | P861: GIBSON | S861: ATKINS
A862: GOALKICKERS
A863: FOOTSCRAY | D863: BANBURY 2 | G863: GREGORY 2 | J863: GRIERSON | M863: LAWSON | P863: BAXTER
A864: ESSENDON ASSOC. | D864: CLARKE 5 | G864: HOARE | J864: WALKER | M864: DIGGLE
A866: 2ND SEMI | E866: 30TH AUGUST | J866: WEATHER | L866: SOUTH WIND RAIN
A867: NORTH MELBOURNE | C867: 1 | D867: 4 | E867: =C867*6+D867 -> 10 | G867: 3 | H867: 8 | I867: =G867*6+H867 -> 26 | K867: 5 | L867: 12 | M867: =K867*6+L867 -> 42 | O867: 8 | P867: 16 | Q867: =O867*6+P867 -> 64 | S867: EMCG
A868: BRUNSWICK | C868: 1 | D868: 1 | E868: =C868*6+D868 -> 7 | G868: 3 | H868: 2 | I868: =G868*6+H868 -> 20 | K868: 4 | L868: 2 | M868: =K868*6+L868 -> 26 | O868: 4 | P868: 2 | Q868: =O868*6+P868 -> 26 | S868: KENDALL
A869: BEST PLAYERS
A870: NORTH MELBOURNE | D870: SHEEHAN | G870: T JONES | J870: LAVER | M870: HARDY | O870: CARPENTER | S870: K JOHNSON
A871: BRUNSWICK | D871: SULLIVAN | G871: O'CONNOR | J871: McKENZIE | M871: McLEOD | O871: ROSS | S871: BRAID
A872: GOALKICKERS
A873: NORTH MELBOURNE | D873: K JOHNSON 3 | H873: CARPENTER 2 | L873: TRELOAR 2
A874: BRUNSWICK | D874: PRICE | G874: SULLIVAN | J874: HARKER | M874: CHANDLER
A876: FINAL | E876: 6TH SEPTEMBER | J876: WEATHER | M876: WEST WIND FINE
A877: FOOTSCRAY | C877: 4 | D877: 2 | E877: 26 | G877: 7 | H877: 10 | I877: 52 | K877: 8 | L877: 13 | M877: 61 | O877: 10 | P877: 14 | Q877: =O877*6+P877 -> 74 | S877: EMCG
A878: NORTH MELBOURNE | C878: 3 | D878: 4 | E878: 22 | G878: 6 | H878: 4 | I878: 40 | K878: 10 | L878: 6 | M878: 66 | O878: 11 | P878: 7 | Q878: =O878*6+P878 -> 73 | S878: HURLEY
A879: BEST PLAYERS
A880: FOOTSCRAY | D880: GREGORY | G880: McCLUSKY | J880: CLARK | M880: BAXTER | P880: HOLMES | S880: BANBURY
A881: NORTH MELBOURNE | D881: HARDY | G881: HERON | J881: CARPENTER | M881: SHEEHAN | P881: MILES | S881: TRELOAR
A882: GOALKICKERS
A883: FOOTSCRAY | D883: BANBURY 3 | G883: GRIERSON 2 | J883: LAWSON | L883: BAXTER | N883: COTTON | P883: HOLMES | R883: GREGORY
A884: NORTH MELBOURNE | D884: HAWKINS 2 | G884: HARDY 2 | I884: CARPENTER 2 | L884: SHEEHAN | N884: K JOHNSON | Q884: TRELOAR | T884: FREEMAN | W884: McKAY