A1: Victorian Football Association
A2: Season 1914
A3: © Copyright Wal Williams | F3: First created: 2 August 2014
A4: Contact: joywalwi at gmail dot com | F4: Last updated: 2 August 2014 | W4: VFA Results and tables - Link to the main index page
A5: You are free to copy this document in whole or part provided that proper acknowledgement is given to the author. All rights reserved.
A7: YEAR 1914
A8: ROUND 1 | E8: 13TH APRIL | I8: EASTER MONDAY | M8: WEATHER | P8: WARM | S8: PLAYED AT | X8: LADDER | AB8: ROUND | AD8: 1
D9: 1ST QTR | H9: 2ND QTR | L9: 3RD QTR | P9: FINAL | S9: WILLIAMSTOWN
A10: WILLIAMSTOWN | C10: 3 | D10: 3 | E10: =C10*6+D10 -> 21 | G10: 3 | H10: 7 | I10: =G10*6+H10 -> 25 | K10: 6 | L10: 11 | M10: =K10*6+L10 -> 47 | O10: 7 | P10: 11 | Q10: =O10*6+P10 -> 53 | S10: UMPIRE | W10: TEAM | X10: W | Y10: L | Z10: D | AA10: FOR | AB10: AGST | AC10: % | AD10: PTS
A11: ESSENDON ASSOC. | C11: 0 | D11: 2 | E11: =C11*6+D11 -> 2 | G11: 2 | H11: 4 | I11: =G11*6+H11 -> 16 | K11: 4 | L11: 4 | M11: =K11*6+L11 -> 28 | O11: 4 | P11: 10 | Q11: =O11*6+P11 -> 34 | S11: PORTEOUS
A12: BEST PLAYERS | W12: FOOTSCRAY | X12: 1 | Y12: 0 | Z12: 0 | AA12: 43 | AB12: 19 | AC12: 226.31578947368422 | AD12: 4
A13: WILLIAMSTOWN | D13: GIBBS | G13: AMY | J13: McDONALD | M13: REITMAN | O13: ALLEY | Q13: HOEY | W13: NORTH MELBOURNE | X13: 1 | Y13: 0 | Z13: 0 | AA13: 102 | AB13: 49 | AC13: 208.16 | AD13: 4
A14: ESSENDON ASSOC. | D14: McINTYRE | G14: M MADDEN | J14: GIBSON | M14: PAIN | O14: WALKER | Q14: EBBOTT | W14: PORT MELBOURNE | X14: 1 | Y14: 0 | Z14: 0 | AA14: 104 | AB14: 63 | AC14: 165.07936507936509 | AD14: 4
A15: GOALKICKERS | W15: WILLIAMSTOWN | X15: 1 | Y15: 0 | Z15: 0 | AA15: 53 | AB15: 34 | AC15: 155.88235294117646 | AD15: 4
A16: WILLIAMSTOWN | D16: HOEY 3 | G16: REITMAN | J16: GIBBS | M16: AMY | O16: McTAGGART
A17: ESSENDON ASSOC. | D17: KEMP | G17: CLARKE | J17: HOARE | M17: WALKER | W17: PRAHRAN | X17: 1 | Y17: 0 | Z17: 0 | AA17: 60 | AB17: 58 | AC17: 103.44827586206897 | AD17: 4
W18: NORTHCOTE | X18: 0 | Y18: 1 | Z18: 0 | AA18: 58 | AB18: 60 | AC18: 96.666666666666671 | AD18: 0
A19: PORT MELBOURNE | C19: 1 | D19: 1 | E19: =C19*6+D19 -> 7 | G19: 4 | H19: 2 | I19: =G19*6+H19 -> 26 | K19: 9 | L19: 6 | M19: =K19*6+L19 -> 60 | O19: 16 | P19: 8 | Q19: =O19*6+P19 -> 104 | S19: PORT MELB | W19: ESSENDON ASSOC. | X19: 0 | Y19: 1 | Z19: 0 | AA19: 34 | AB19: 53 | AC19: 64.15094339622641 | AD19: 0
A20: HAWTHORN | C20: 1 | D20: 0 | E20: =C20*6+D20 -> 6 | G20: 1 | H20: 6 | I20: =G20*6+H20 -> 12 | K20: 5 | L20: 8 | M20: =K20*6+L20 -> 38 | O20: 9 | P20: 9 | Q20: =O20*6+P20 -> 63 | S20: KENDALL | W20: HAWTHORN | X20: 0 | Y20: 1 | Z20: 0 | AA20: 63 | AB20: 104 | AC20: 60.57692307692308 | AD20: 0
A21: BEST PLAYERS | W21: BRUNSWICK | X21: 0 | Y21: 1 | Z21: 0 | AA21: 49 | AB21: 102 | AC21: 48.04 | AD21: 0
A22: PORT MELBOURNE | D22: MERRICK | F22: BARFOOT | I22: McCONVILLE | L22: COOK | N22: TREGLOWN | Q22: FRANKLIN | W22: BRIGHTON | X22: 0 | Y22: 1 | Z22: 0 | AA22: 19 | AB22: 43 | AC22: 44.186046511627907 | AD22: 0
A23: HAWTHORN | D23: McCANN | F23: CHAPMAN | I23: CLARKE | L23: ROBINSON | N23: GOUGH | Q23: WILKINSON
A24: GOALKICKERS
A25: PORT MELBOURNE | D25: MERRICK 8 | G25: BARFOOT 3 | J25: HAYES 2 | M25: WALTON | O25: TREGLOWN | R25: McCONVILLE
A26: HAWTHORN | D26: McCANN 2 | G26: CHAPMAN 2 | J26: CLARKE 2 | M26: STEWART 2 | P26: NEILSON
A28: NORTH MELBOURNE | C28: 3 | D28: 3 | E28: =C28*6+D28 -> 21 | G28: 4 | H28: 6 | I28: =G28*6+H28 -> 30 | K28: 8 | L28: 8 | M28: =K28*6+L28 -> 56 | O28: 15 | P28: 12 | Q28: =O28*6+P28 -> 102 | S28: BRUNSWICK
A29: BRUNSWICK | C29: 0 | D29: 1 | E29: =C29*6+D29 -> 1 | G29: 2 | H29: 5 | I29: =G29*6+H29 -> 17 | K29: 3 | L29: 7 | M29: =K29*6+L29 -> 25 | O29: 7 | P29: 7 | Q29: =O29*6+P29 -> 49 | S29: HURLEY
A30: BEST PLAYERS
A31: NORTH MELBOURNE | D31: MORAN | G31: CARPENTER | J31: T JONES | M31: PEMBERTON | P31: CAVE | R31: RAWLE
A32: BRUNSWICK | D32: PRICE | G32: SULLIVAN | J32: O'CONNOR | M32: MOXON | P32: THOMAS | R32: MCLEOD
A33: GOALKICKERS
A34: NORTH MELBOURNE | D34: MILES 4 | G34: K JOHNSON 3 | J34: CARPENTER 2 | M34: MORAN 2 | O34: HAWKINS 2 | R34: RAWLE | T34: HARDY
A35: BRUNSWICK | D35: SULLIVAN 3 | G35: GASKELL | J35: PRICE | L35: THOMAS | O35: HARKER
A37: FOOTSCRAY | C37: 2 | D37: 1 | E37: =C37*6+D37 -> 13 | G37: 3 | H37: 2 | I37: =G37*6+H37 -> 20 | K37: 5 | L37: 4 | M37: =K37*6+L37 -> 34 | O37: 6 | P37: 7 | Q37: =O37*6+P37 -> 43 | S37: FOOTSCRAY
A38: BRIGHTON | C38: 1 | D38: 0 | E38: =C38*6+D38 -> 6 | G38: 1 | H38: 3 | I38: =G38*6+H38 -> 9 | K38: 1 | L38: 5 | M38: =K38*6+L38 -> 11 | O38: 2 | P38: 7 | Q38: =O38*6+P38 -> 19 | S38: HERBERT
A39: BEST PLAYERS
A40: FOOTSCRAY | D40: COTTON | G40: McCLUSKY | J40: SAMSON | M40: BANBURY | P40: BAXTER | S40: CRADDOCK
A41: BRIGHTON | D41: COMER | G41: DOWDING | J41: B BAILES | M41: KNIGHTON | P41: NEGRO | S41: WALLACE
A42: GOALKICKERS
A43: FOOTSCRAY | D43: COTTON 3 | G43: BAXTER 2 | J43: CLARK
A44: BRIGHTON | D44: R DAWSON | G44: DUGGAN
A46: PRAHRAN | C46: 2 | D46: 6 | E46: =C46*6+D46 -> 18 | G46: 3 | H46: 7 | I46: =G46*6+H46 -> 25 | K46: 7 | L46: 12 | M46: =K46*6+L46 -> 54 | O46: 8 | P46: 12 | Q46: =O46*6+P46 -> 60 | S46: CROXTON PK
A47: NORTHCOTE | C47: 2 | D47: 1 | E47: =C47*6+D47 -> 13 | G47: 3 | H47: 3 | I47: =G47*6+H47 -> 21 | K47: 4 | L47: 5 | M47: =K47*6+L47 -> 29 | O47: 8 | P47: 10 | Q47: =O47*6+P47 -> 58 | S47: McMURRAY
A48: BEST PLAYERS
A49: PRAHRAN | D49: WOODS | G49: GALWAY | J49: McKENZIE | M49: WEIDNER | P49: KERR | S49: WILSON
A50: NORTHCOTE | D50: VEITCH | G50: E THOMAS | J50: DUNCAN | M50: H THOMAS | P50: COLE | S50: SMITH
A51: GOALKICKERS
A52: PRAHRAN | D52: GALWAY 3 | G52: WEIDNER | J52: FOSTER | M52: McKENZIE | P52: DALY | R52: WOODS
A53: NORTHCOTE | D53: RIDD 3 | G53: MOORE 2 | J53: BRAID 2 | M53: NOBLE
A55: ROUND 2 | E55: 18TH APRIL | J55: WEATHER | M55: FINE | S55: PLAYED AT | X55: LADDER | AB55: ROUND | AD55: 2
D56: 1ST QTR | H56: 2ND QTR | L56: 3RD QTR | P56: FINAL | S56: WILLIAMSTOWN
A57: WILLIAMSTOWN | C57: 1 | D57: 3 | E57: =C57*6+D57 -> 9 | G57: 3 | H57: 4 | I57: =G57*6+H57 -> 22 | K57: 4 | L57: 8 | M57: =K57*6+L57 -> 32 | O57: 6 | P57: 12 | Q57: =O57*6+P57 -> 48 | S57: UMPIRE | W57: TEAM | X57: W | Y57: L | Z57: D | AA57: FOR | AB57: AGST | AC57: % | AD57: PTS
A58: PRAHRAN | C58: 1 | D58: 0 | E58: =C58*6+D58 -> 6 | G58: 1 | H58: 2 | I58: =G58*6+H58 -> 8 | K58: 2 | L58: 2 | M58: =K58*6+L58 -> 14 | O58: 4 | P58: 5 | Q58: =O58*6+P58 -> 29 | S58: PORTEOUS
A59: BEST PLAYERS | W59: PORT MELBOURNE | X59: 2 | Y59: 0 | Z59: 0 | AA59: 169 | AB59: 102 | AC59: 165.68627450980392 | AD59: 8
A60: WILLIAMSTOWN | D60: GIBBS | F60: ALLEY | I60: REITMAN | L60: AMY | N60: GRANT | Q60: McDONALD | W60: WILLIAMSTOWN | X60: 2 | Y60: 0 | Z60: 0 | AA60: 101 | AB60: 63 | AC60: 160.31746031746033 | AD60: 8
A61: PRAHRAN | D61: WEIDNER | F61: CARLSON | I61: KERR | L61: DAVIS | N61: DOWSING | Q61: MARONEY | W61: FOOTSCRAY | X61: 2 | Y61: 0 | Z61: 0 | AA61: 98 | AB61: 69 | AC61: 142.02898550724638 | AD61: 8
A62: GOALKICKERS | W62: NORTH MELBOURNE | X62: 1 | Y62: 1 | Z62: 0 | AA62: 138 | AB62: 97 | AC62: 142.27 | AD62: 4
A63: WILLIAMSTOWN | D63: GIBBS | F63: MITCHELL | I63: CAMERON | K63: E BUSBRIDGE | N63: O'HALLORAN | Q63: McTAGGART
A64: PRAHRAN | D64: MARONEY 2 | G64: GILL | I64: KERR | W64: ESSENDON ASSOC. | X64: 1 | Y64: 1 | Z64: 0 | AA64: 130 | AB64: 125 | AC64: 104 | AD64: 4
W65: BRIGHTON | X65: 1 | Y65: 1 | Z65: 0 | AA65: 67 | AB65: 79 | AC65: 84.810126582278485 | AD65: 4
A66: PORT MELBOURNE | C66: 2 | D66: 3 | E66: =C66*6+D66 -> 15 | G66: 3 | H66: 9 | I66: =G66*6+H66 -> 27 | K66: 4 | L66: 16 | M66: =K66*6+L66 -> 40 | O66: 7 | P66: 23 | Q66: =O66*6+P66 -> 65 | S66: PORT MELB | W66: PRAHRAN | X66: 1 | Y66: 1 | Z66: 0 | AA66: 89 | AB66: 106 | AC66: 83.962264150943398 | AD66: 4
A67: NORTHCOTE | C67: 0 | D67: 4 | E67: =C67*6+D67 -> 4 | G67: 2 | H67: 4 | I67: =G67*6+H67 -> 16 | K67: 3 | L67: 8 | M67: =K67*6+L67 -> 26 | O67: 5 | P67: 9 | Q67: =O67*6+P67 -> 39 | S67: ROPER | W67: NORTHCOTE | X67: 0 | Y67: 2 | Z67: 0 | AA67: 97 | AB67: 125 | AC67: 77.6 | AD67: 0
A68: BEST PLAYERS | W68: HAWTHORN | X68: 0 | Y68: 2 | Z68: 0 | AA68: 135 | AB68: 200 | AC68: 67.5 | AD68: 0
A69: PORT MELBOURNE | D69: MERRICK | G69: SAMSON | J69: CLELAND | M69: McCONVILLE | P69: DEAS | R69: BAILEY | W69: BRUNSWICK | X69: 0 | Y69: 2 | Z69: 0 | AA69: 99 | AB69: 157 | AC69: 63.06 | AD69: 0
A70: NORTHCOTE | D70: E THOMAS | G70: H THOMAS | J70: BLACKMAN | M70: H SMITH | P70: RIDD | R70: MOORE
A71: GOALKICKERS
A72: PORT MELBOURNE | D72: MERRICK 4 | G72: MARSHALL 2 | K72: TREGLOWN
A73: NORTHCOTE | D73: RIDD 4 | G73: BASSETT
A75: ESSENDON ASSOC. | C75: 5 | D75: 3 | E75: =C75*6+D75 -> 33 | G75: 10 | H75: 5 | I75: =G75*6+H75 -> 65 | K75: 13 | L75: 6 | M75: =K75*6+L75 -> 84 | O75: 14 | P75: 12 | Q75: =O75*6+P75 -> 96 | S75: HAW
A76: HAWTHORN | C76: 3 | D76: 3 | E76: =C76*6+D76 -> 21 | G76: 5 | H76: 6 | I76: =G76*6+H76 -> 36 | K76: 8 | L76: 10 | M76: =K76*6+L76 -> 58 | O76: 10 | P76: 12 | Q76: =O76*6+P76 -> 72 | S76: PRITCHARD
A77: BEST PLAYERS
A78: ESSENDON ASSOC. | D78: M MADDEN | G78: DIGGLE | J78: HOARE | M78: KEMP | P78: EBBOTT | S78: SEVIOR
A79: HAWTHORN | D79: McCONVILLE | G79: MORRIS | J79: FEWSTER | M79: CHAPMAN | P79: WILKINSON | S79: McDONALD
A80: GOALKICKERS
A81: ESSENDON ASSOC. | D81: KEMP 3 | G81: SEVIOR 3 | J81: DIGGLE 3 | M81: CLARKE 2 | P81: ATKINS | R81: BROCK | T81: PAIN
A82: HAWTHORN | D82: FEWSTER 4 | G82: HAY 2 | J82: CHAPMAN 2 | M82: KIKER | O82: WILKINSON
A84: FOOTSCRAY | C84: 1 | D84: 2 | E84: =C84*6+D84 -> 8 | G84: 5 | H84: 5 | I84: =G84*6+H84 -> 35 | K84: 6 | L84: 8 | M84: =K84*6+L84 -> 44 | O84: 7 | P84: 13 | Q84: =O84*6+P84 -> 55 | S84: BRUNSWICK
A85: BRUNSWICK | C85: 2 | D85: 2 | E85: =C85*6+D85 -> 14 | G85: 4 | H85: 3 | I85: =G85*6+H85 -> 27 | K85: 5 | L85: 7 | M85: =K85*6+L85 -> 37 | O85: 7 | P85: 8 | Q85: =O85*6+P85 -> 50 | S85: HURLEY
A86: BEST PLAYERS
A87: FOOTSCRAY | D87: SPENCE | G87: COTTON | J87: GRIMSHAW | M87: CLARK | P87: SAMSON | S87: NEILSON
A88: BRUNSWICK | D88: McLEAN | G88: TOPHAM | J88: O'CONNOR | M88: SWIFT | P88: STEVENSON | S88: PRICE
A89: GOALKICKERS
A90: FOOTSCRAY | D90: SPENCE 3 | G90: COTTON 2 | J90: GRIERSON | M90: SAMSON
A91: BRUNSWICK | D91: THOMAS 3 | G91: STEVENSON 2 | K91: GASKELL | N91: HARKER
A93: BRIGHTON | C93: 2 | D93: 0 | E93: =C93*6+D93 -> 12 | G93: 3 | H93: 2 | I93: =G93*6+H93 -> 20 | K93: 5 | L93: 4 | M93: =K93*6+L93 -> 34 | O93: 7 | P93: 6 | Q93: =O93*6+P93 -> 48 | S93: NORTH MELB
A94: NORTH MELBOURNE | C94: 1 | D94: 5 | E94: =C94*6+D94 -> 11 | G94: 4 | H94: 6 | I94: =G94*6+H94 -> 30 | K94: 4 | L94: 6 | M94: =K94*6+L94 -> 30 | O94: 5 | P94: 6 | Q94: =O94*6+P94 -> 36 | S94: KENDALL
A95: BEST PLAYERS
A96: BRIGHTON | D96: B BAILES | G96: TEESE | J96: PATTERSON | M96: GRAHAM | P96: DUGGAN | S96: NEGRO
A97: NORTH MELBOURNE | D97: RAWLE | G97: SPEAKMAN | J97: CAVE | M97: MORAN | P97: JONES | S97: HARDY
A98: GOALKICKERS
A99: BRIGHTON | D99: TEESE 2 | G99: DUGGAN | I99: COMER | K99: TAYLOR | M99: PEDDLE | O99: W PATTERSON
A100: NORTH MELBOURNE | D100: HARDY 3
A102: ROUND 3 | E102: 25TH APRIL | J102: WEATHER | M102: NORTH BREEZE FINE | S102: PLAYED AT | X102: LADDER | AB102: ROUND | AD102: 3
D103: 1ST QTR | H103: 2ND QTR | L103: 3RD QTR | P103: FINAL | S103: FOOTSCRAY
A104: FOOTSCRAY | C104: 3 | D104: 5 | E104: =C104*6+D104 -> 23 | G104: 5 | H104: 8 | I104: =G104*6+H104 -> 38 | K104: 10 | L104: 11 | M104: =K104*6+L104 -> 71 | O104: 13 | P104: 11 | Q104: =O104*6+P104 -> 89 | S104: UMPIRE | W104: TEAM | X104: W | Y104: L | Z104: D | AA104: FOR | AB104: AGST | AC104: % | AD104: PTS
A105: PORT MELBOURNE | C105: 2 | D105: 2 | E105: =C105*6+D105 -> 14 | G105: 3 | H105: 3 | I105: =G105*6+H105 -> 21 | K105: 4 | L105: 5 | M105: =K105*6+L105 -> 29 | O105: 7 | P105: 8 | Q105: =O105*6+P105 -> 50 | S105: KENDALL
A106: BEST PLAYERS | W106: WILLIAMSTOWN | X106: 3 | Y106: 0 | Z106: 0 | AA106: 188 | AB106: 87 | AC106: 216.09195402298852 | AD106: 12
A107: FOOTSCRAY | D107: SAMSON | G107: COTTON | I107: LAWSON | L107: DUANE | O107: BANBURY | Q107: GRIERSON | W107: FOOTSCRAY | X107: 3 | Y107: 0 | Z107: 0 | AA107: 187 | AB107: 119 | AC107: 157.14285714285714 | AD107: 12
A108: PORT MELBOURNE | D108: HOWLETT | G108: MERRICK | I108: BAILEY | L108: MARSHALL | O108: CARDEN | Q108: WALTON | W108: NORTH MELBOURNE | X108: 2 | Y108: 1 | Z108: 0 | AA108: 201 | AB108: 156 | AC108: 128.85 | AD108: 8
A109: GOALKICKERS | W109: PORT MELBOURNE | X109: 2 | Y109: 1 | Z109: 0 | AA109: 219 | AB109: 191 | AC109: 114.65968586387434 | AD109: 8
A110: FOOTSCRAY | D110: LAWSON 5 | G110: BANBURY 3 | J110: BAXTER 2 | M110: SAMSON | O110: GRIERSON | Q110: COTTON
A111: PORT MELBOURNE | D111: MERRICK 2 | G111: DEAS 2 | J111: HAYES 2 | M111: CARDEN | W111: PRAHRAN | X111: 2 | Y111: 1 | Z111: 0 | AA111: 173 | AB111: 162 | AC111: 106.79012345679013 | AD111: 8
W112: ESSENDON ASSOC. | X112: 1 | Y112: 2 | Z112: 0 | AA112: 189 | AB112: 188 | AC112: 100.53191489361703 | AD112: 4
A113: NORTH MELBOURNE | C113: 2 | D113: 5 | E113: =C113*6+D113 -> 17 | G113: 5 | H113: 8 | I113: =G113*6+H113 -> 38 | K113: 8 | L113: 7 | M113: =K113*6+L113 -> 55 | O113: 9 | P113: 9 | Q113: =O113*6+P113 -> 63 | S113: ESSENDON | W113: BRUNSWICK | X113: 1 | Y113: 2 | Z113: 0 | AA113: 189 | AB113: 209 | AC113: 90.43 | AD113: 4
A114: ESSENDON ASSOC. | C114: 1 | D114: 7 | E114: =C114*6+D114 -> 13 | G114: 3 | H114: 10 | I114: =G114*6+H114 -> 28 | K114: 6 | L114: 14 | M114: =K114*6+L114 -> 50 | O114: 7 | P114: 17 | Q114: =O114*6+P114 -> 59 | S114: C PRITCHARD | W114: BRIGHTON | X114: 1 | Y114: 2 | Z114: 0 | AA114: 119 | AB114: 169 | AC114: 70.414201183431956 | AD114: 4
A115: BEST PLAYERS | W115: HAWTHORN | X115: 0 | Y115: 3 | Z115: 0 | AA115: 191 | AB115: 284 | AC115: 67.25352112676056 | AD115: 0
A116: NORTH MELBOURNE | D116: CAVE | G116: CONDON | I116: K JOHNSON | L116: MORAN | O116: FRANKS | Q116: WOODINGTON | W116: NORTHCOTE | X116: 0 | Y116: 3 | Z116: 0 | AA116: 121 | AB116: 212 | AC116: 57.075471698113205 | AD116: 0
A117: ESSENDON ASSOC. | D117: HOARE | G117: DIGGLE | I117: WALKER | L117: J MADDEN | O117: EBBOTT | Q117: KEMP
A118: GOALKICKERS
A119: NORTH MELBOURNE | D119: K JOHNSON 4 | H119: MORAN 3 | K119: HAWKINS 2
A120: ESSENDON ASSOC. | D120: CLARKE 3 | G120: EBBOTT 2 | J120: TURNER | L120: DIGGLE
A122: PRAHRAN | C122: 3 | D122: 1 | E122: =C122*6+D122 -> 19 | G122: 6 | H122: 9 | I122: =G122*6+H122 -> 45 | K122: 10 | L122: 10 | M122: =K122*6+L122 -> 70 | O122: 12 | P122: 12 | Q122: =O122*6+P122 -> 84 | S122: TOORAK PARK
A123: HAWTHORN | C123: 2 | D123: 1 | E123: =C123*6+D123 -> 13 | G123: 5 | H123: 4 | I123: =G123*6+H123 -> 34 | K123: 7 | L123: 7 | M123: =K123*6+L123 -> 49 | O123: 8 | P123: 8 | Q123: =O123*6+P123 -> 56 | S123: McMURRAY
A124: BEST PLAYERS
A125: PRAHRAN | D125: WOODS | G125: DOWSING | J125: KERR | M125: CARLSON | P125: MARONEY | S125: DAVIS
A126: HAWTHORN | D126: McCONVILLE | G126: CHAPMAN | J126: GOUGH | M126: LARKIN | P126: ROACH | S126: WILKINSON
A127: GOALKICKERS
A128: PRAHRAN | D128: WOODS 4 | G128: WEIDNER 3 | J128: FARMER 2 | M128: DAVIS 2 | P128: CARLSON
A129: HAWTHORN | D129: CLARKE 2 | G129: FEWSTER
A131: BRUNSWICK | C131: 3 | D131: 6 | E131: =C131*6+D131 -> 24 | G131: 5 | H131: 11 | I131: =G131*6+H131 -> 41 | K131: 10 | L131: 13 | M131: =K131*6+L131 -> 73 | O131: 12 | P131: 18 | Q131: =O131*6+P131 -> 90 | S131: BRIGHTON BEACH
A132: BRIGHTON | C132: 6 | D132: 1 | E132: =C132*6+D132 -> 37 | G132: 6 | H132: 4 | I132: =G132*6+H132 -> 40 | K132: 7 | L132: 5 | M132: =K132*6+L132 -> 47 | O132: 7 | P132: 10 | Q132: =O132*6+P132 -> 52 | S132: HERBERT
A133: BEST PLAYERS
A134: BRUNSWICK | D134: O'CONNOR | G134: CHASE | J134: ROSS | M134: SWIFT | P134: SULLIVAN | S134: HARKER
A135: BRIGHTON | D135: B BAILES | G135: TEESE | J135: NEGRO | M135: GRAHAM | P135: WALLACE | S135: TURNBULL
A136: GOALKICKERS
A137: BRUNSWICK | D137: CHASE 3 | G137: SULLIVAN 2 | J137: CROWE 2 | M137: HARKER 2 | P137: O'CONNOR | R137: SWIFT | T137: McLEOD
A138: BRIGHTON | D138: TEESE 4 | G138: PEDDLE | J138: DAWSON | M138: DUGGAN
A140: WILLIAMSTOWN | C140: 1 | D140: 4 | E140: =C140*6+D140 -> 10 | G140: 5 | H140: 10 | I140: =G140*6+H140 -> 40 | K140: 7 | L140: 10 | M140: =K140*6+L140 -> 52 | O140: 11 | P140: 21 | Q140: =O140*6+P140 -> 87 | S140: CROXTON PK
A141: NORTHCOTE | C141: 1 | D141: 2 | E141: =C141*6+D141 -> 8 | G141: 1 | H141: 2 | I141: =G141*6+H141 -> 8 | K141: 3 | L141: 6 | M141: =K141*6+L141 -> 24 | O141: 3 | P141: 6 | Q141: =O141*6+P141 -> 24 | S141: McCART
A142: BEST PLAYERS
A143: WILLIAMSTOWN | D143: MIDDLETON | G143: AMY | J143: MITCHELL | M143: ALLEY | O143: ANDERSON | R143: REITMAN
A144: NORTHCOTE | D144: H THOMAS | G144: MOORE | J144: NOBLE | M144: BASSETT | O144: E THOMAS | R144: BLACKMAN
A145: GOALKICKERS
A146: WILLIAMSTOWN | D146: AMY 4 | G146: GIBBS 2 | I146: MAY 2 | L146: MITCHELL | O146: REITMAN | R146: HARRISON
A147: NORTHCOTE | D147: CLARKE 3 | G147: GOUGH 2 | I147: FEWSTER | L147: HAY | N147: SCHAEFER
A149: ROUND 4 | E149: 2ND MAY | J149: WEATHER | M149: FINE | S149: PLAYED AT | X149: LADDER | AB149: ROUND | AD149: 4
D150: 1ST QTR | H150: 2ND QTR | L150: 3RD QTR | P150: FINAL | S150: WILLIAMSTOWN
A151: WILLIAMSTOWN | C151: 2 | D151: 3 | E151: =C151*6+D151 -> 15 | G151: 6 | H151: 6 | I151: =G151*6+H151 -> 42 | K151: 8 | L151: 10 | M151: =K151*6+L151 -> 58 | O151: 12 | P151: 13 | Q151: =O151*6+P151 -> 85 | S151: UMPIRE | W151: TEAM | X151: W | Y151: L | Z151: D | AA151: FOR | AB151: AGST | AC151: % | AD151: PTS
A152: PORT MELBOURNE | C152: 1 | D152: 8 | E152: =C152*6+D152 -> 14 | G152: 1 | H152: 10 | I152: =G152*6+H152 -> 16 | K152: 3 | L152: 13 | M152: =K152*6+L152 -> 31 | O152: 4 | P152: 13 | Q152: =O152*6+P152 -> 37 | S152: McMURRAY
A153: BEST PLAYERS | W153: WILLIAMSTOWN | X153: 4 | Y153: 0 | Z153: 0 | AA153: 273 | AB153: 124 | AC153: 220.16129032258064 | AD153: 16
A154: WILLIAMSTOWN | D154: GIBBS | G154: ALLEY | I154: McTAGGART | L154: WALLIS | N154: O'HALLORAN | Q154: McDONALD | W154: FOOTSCRAY | X154: 4 | Y154: 0 | Z154: 0 | AA154: 271 | AB154: 183 | AC154: 148.08743169398906 | AD154: 16
A155: PORT MELBOURNE | D155: McCONVILLE | G155: CLELAND | I155: HOWLETT | L155: MERRICK | N155: TREGLOWN | Q155: MARSHALL | W155: NORTH MELBOURNE | X155: 3 | Y155: 1 | Z155: 0 | AA155: 275 | AB155: 196 | AC155: 140.31 | AD155: 12
A156: GOALKICKERS | N156: GRANT | P156: O'HALLORAN | W156: ESSENDON ASSOC. | X156: 2 | Y156: 2 | Z156: 0 | AA156: 313 | AB156: 233 | AC156: 134.33476394849785 | AD156: 8
A157: WILLIAMSTOWN | D157: McTAGGART 3 | G157: AMY 2 | I157: NEWBRIDGE 2 | L157: SCHADE | N157: HARRISON | Q157: REITMAN
A158: PORT MELBOURNE | D158: MARSHALL 2 | G158: WALTON | J158: TREGLOWN | W158: BRUNSWICK | X158: 2 | Y158: 2 | Z158: 0 | AA158: 302 | AB158: 241 | AC158: 125.31 | AD158: 8
W159: PORT MELBOURNE | X159: 2 | Y159: 2 | Z159: 0 | AA159: 256 | AB159: 276 | AC159: 92.753623188405797 | AD159: 8
A160: NORTH MELBOURNE | C160: 2 | D160: 1 | E160: =C160*6+D160 -> 13 | G160: 4 | H160: 5 | I160: =G160*6+H160 -> 29 | K160: 6 | L160: 7 | M160: =K160*6+L160 -> 43 | O160: 11 | P160: 8 | Q160: =O160*6+P160 -> 74 | S160: TOORAK PARK | W160: PRAHRAN | X160: 2 | Y160: 2 | Z160: 0 | AA160: 213 | AB160: 236 | AC160: 90.254237288135599 | AD160: 8
A161: PRAHRAN | C161: 2 | D161: 5 | E161: =C161*6+D161 -> 17 | G161: 4 | H161: 6 | I161: =G161*6+H161 -> 30 | K161: 5 | L161: 9 | M161: =K161*6+L161 -> 39 | O161: 5 | P161: 10 | Q161: =O161*6+P161 -> 40 | S161: PORTEOUS | W161: BRIGHTON | X161: 1 | Y161: 3 | Z161: 0 | AA161: 164 | AB161: 293 | AC161: 55.972696245733786 | AD161: 4
A162: BEST PLAYERS | W162: HAWTHORN | X162: 0 | Y162: 4 | Z162: 0 | AA162: 255 | AB162: 368 | AC162: 69.293478260869563 | AD162: 0
A163: NORTH MELBOURNE | D163: WOODINGTON | G163: CAVE | I163: McQUEEN | L163: RAWLE | N163: MILES | Q163: HAWKINS | W163: NORTHCOTE | X163: 0 | Y163: 4 | Z163: 0 | AA163: 153 | AB163: 325 | AC163: 47.07692307692308 | AD163: 0
A164: PRAHRAN | D164: CARLSON | G164: WOODS | I164: RYAN | L164: MARONEY | N164: MAYNARD | Q164: CAIN
A165: GOALKICKERS
A166: NORTH MELBOURNE | D166: HAWKINS 4 | G166: MORAN 2 | J166: MILES 2 | M166: HART | O166: CONDON | Q166: CAVE
A167: PRAHRAN | D167: KERR 2 | G167: FARMER | J167: MAYNARD | M167: MARONEY
A169: ESSENDON ASSOC. | C169: 3 | D169: 3 | E169: =C169*6+D169 -> 21 | G169: 9 | H169: 6 | I169: =G169*6+H169 -> 60 | K169: 12 | L169: 12 | M169: =K169*6+L169 -> 84 | O169: 18 | P169: 16 | Q169: =O169*6+P169 -> 124 | S169: ESSENDON
A170: BRIGHTON | C170: 3 | D170: 3 | E170: =C170*6+D170 -> 21 | G170: 5 | H170: 3 | I170: =G170*6+H170 -> 33 | K170: 5 | L170: 5 | M170: =K170*6+L170 -> 35 | O170: 6 | P170: 9 | Q170: =O170*6+P170 -> 45 | S170: FARMER
A171: BEST PLAYERS
A172: ESSENDON ASSOC. | D172: HOARE | G172: M MADDEN | J172: DIGGLE | M172: ATKINS | P172: PAIN | R172: EBBOTT
A173: BRIGHTON | D173: ESPIE | G173: TEESE | J173: E BAILES | M173: TURNBULL | P173: MEADE | R173: DOWDING
A174: GOALKICKERS
A175: ESSENDON ASSOC. | D175: CLARKE 7 | G175: DIGGLE 4 | J175: KEMP 3 | M175: ATKINS 2 | P175: EBBOTT | R175: HARDIMAN
A176: BRIGHTON | D176: TEESE 2 | G176: TURNBULL 2 | J176: DUGGAN 2
A178: BRUNSWICK | C178: 4 | D178: 7 | E178: =C178*6+D178 -> 31 | G178: 10 | H178: 10 | I178: =G178*6+H178 -> 70 | K178: 14 | L178: 15 | M178: =K178*6+L178 -> 99 | O178: 16 | P178: 17 | Q178: =O178*6+P178 -> 113 | S178: CROXTON PK
A179: NORTHCOTE | C179: 2 | D179: 1 | E179: =C179*6+D179 -> 13 | G179: 3 | H179: 2 | I179: =G179*6+H179 -> 20 | K179: 4 | L179: 4 | M179: =K179*6+L179 -> 28 | O179: 4 | P179: 8 | Q179: =O179*6+P179 -> 32 | S179: HURLEY
A180: BEST PLAYERS
A181: BRUNSWICK | D181: GEORGE | G181: BRAID | J181: ROSS | M181: CHANDLER | P181: McLEAN | S181: CHASE
A182: NORTHCOTE | D182: H THOMAS | G182: MOORE | J182: SMITH | M182: MILLS | P182: VEITCH | S182: BILLETT
A183: GOALKICKERS
A184: BRUNSWICK | D184: CHASE 6 | G184: HARKER 3 | J184: SULLIVAN 2 | M184: PRICE 2
A185: NORTHCOTE | D185: SMITH 2
A187: FOOTSCRAY | C187: 1 | D187: 4 | E187: =C187*6+D187 -> 10 | G187: 5 | H187: 8 | I187: =G187*6+H187 -> 38 | K187: 9 | L187: 15 | M187: =K187*6+L187 -> 69 | O187: 11 | P187: 18 | Q187: =O187*6+P187 -> 84 | S187: HAW
A188: HAWTHORN | C188: 3 | D188: 6 | E188: =C188*6+D188 -> 24 | G188: 4 | H188: 7 | I188: =G188*6+H188 -> 31 | K188: 7 | L188: 8 | M188: =K188*6+L188 -> 50 | O188: 9 | P188: 10 | Q188: =O188*6+P188 -> 64 | S188: KENDALL
A189: BEST PLAYERS
A190: FOOTSCRAY | D190: COTTON | G190: LAWSON | J190: SAMSON | M190: ELDRIDGE | P190: BANBURY | S190: JACKSON
A191: HAWTHORN | D191: McCONVILLE | G191: KIKER | J191: McCANN | M191: CLARKE | P191: NEILSON | S191: FEWSTER
A192: GOALKICKERS
A193: FOOTSCRAY | D193: LAWSON 3 | G193: JACKSON 2 | J193: COTTON 2 | M193: BAXTER | O193: SPENCE | Q193: SAMSON | T193: BANBURY
A194: HAWTHORN | D194: McCANN 3 | G194: KIKER 2 | J194: NEILSON 2 | M194: WILKINSON | P194: GOUGH
A196: ROUND 5 | E196: 9TH MAY | J196: WEATHER | M196: SOUTH BREEZE FINE | S196: PLAYED AT | X196: LADDER | AB196: ROUND | AD196: 5
D197: 1ST QTR | H197: 2ND QTR | L197: 3RD QTR | P197: FINAL | S197: FOOTSCRAY
A198: ESSENDON ASSOC. | C198: 1 | D198: 2 | E198: =C198*6+D198 -> 8 | G198: 4 | H198: 4 | I198: =G198*6+H198 -> 28 | K198: 5 | L198: 8 | M198: =K198*6+L198 -> 38 | O198: 6 | P198: 9 | Q198: =O198*6+P198 -> 45 | S198: UMPIRE | W198: TEAM | X198: W | Y198: L | Z198: D | AA198: FOR | AB198: AGST | AC198: % | AD198: PTS
A199: FOOTSCRAY | C199: 2 | D199: 0 | E199: =C199*6+D199 -> 12 | G199: 3 | H199: 0 | I199: =G199*6+H199 -> 18 | K199: 3 | L199: 2 | M199: =K199*6+L199 -> 20 | O199: 5 | P199: 3 | Q199: =O199*6+P199 -> 33 | S199: PORTEOUS
A200: BEST PLAYERS | W200: NORTH MELBOURNE | X200: 4 | Y200: 1 | Z200: 0 | AA200: 400 | AB200: 212 | AC200: 188.68 | AD200: 16
A201: ESSENDON ASSOC. | D201: PAIN | F201: SEVIOR | I201: ATKINS | L201: COCKRAM | O201: EBBOTT | Q201: M MADDEN | W201: WILLIAMSTOWN | X201: 4 | Y201: 1 | Z201: 0 | AA201: 306 | AB201: 178 | AC201: 171.91011235955057 | AD201: 16
A202: FOOTSCRAY | D202: COTTON | F202: GRIMSHAW | I202: SPENCE | L202: GRIERSON | O202: FORD | Q202: SAMSON | W202: FOOTSCRAY | X202: 4 | Y202: 1 | Z202: 0 | AA202: 304 | AB202: 228 | AC202: 133.33333333333334 | AD202: 16
A203: GOALKICKERS | W203: ESSENDON ASSOC. | X203: 3 | Y203: 2 | Z203: 0 | AA203: 358 | AB203: 266 | AC203: 134.58646616541353 | AD203: 12
A204: ESSENDON ASSOC. | D204: SEVIOR 2 | G204: EBBOTT 2 | J204: CLARKE | M204: DIGGLE
A205: FOOTSCRAY | D205: SPENCE 2 | G205: GRIERSON | J205: BANBURY | M205: BAXTER | W205: BRUNSWICK | X205: 3 | Y205: 2 | Z205: 0 | AA205: 356 | AB205: 274 | AC205: 129.93 | AD205: 12
W206: PRAHRAN | X206: 3 | Y206: 2 | Z206: 0 | AA206: 275 | AB206: 270 | AC206: 101.85185185185185 | AD206: 12
A207: BRUNSWICK | C207: 1 | D207: 4 | E207: =C207*6+D207 -> 10 | G207: 2 | H207: 5 | I207: =G207*6+H207 -> 17 | K207: 5 | L207: 10 | M207: =K207*6+L207 -> 40 | O207: 6 | P207: 18 | Q207: =O207*6+P207 -> 54 | S207: BRUNSWICK | W207: PORT MELBOURNE | X207: 2 | Y207: 3 | Z207: 0 | AA207: 290 | AB207: 338 | AC207: 85.798816568047343 | AD207: 8
A208: WILLIAMSTOWN | C208: 1 | D208: 3 | E208: =C208*6+D208 -> 9 | G208: 3 | H208: 4 | I208: =G208*6+H208 -> 22 | K208: 4 | L208: 6 | M208: =K208*6+L208 -> 30 | O208: 4 | P208: 9 | Q208: =O208*6+P208 -> 33 | S208: ROPER | W208: BRIGHTON | X208: 2 | Y208: 3 | Z208: 0 | AA208: 265 | AB208: 334 | AC208: 79.341317365269461 | AD208: 8
A209: BEST PLAYERS | W209: HAWTHORN | X209: 0 | Y209: 5 | Z209: 0 | AA209: 296 | AB209: 469 | AC209: 63.113006396588489 | AD209: 0
A210: BRUNSWICK | D210: McLEOD | G210: GILLESPIE | I210: GEORGE | L210: CHANDLER | O210: STEVENSON | R210: MUNRO | W210: NORTHCOTE | X210: 0 | Y210: 5 | Z210: 0 | AA210: 169 | AB210: 450 | AC210: 37.555555555555557 | AD210: 0
A211: WILLIAMSTOWN | D211: ANDERSON | G211: ALLEY | I211: HARRISON | L211: McDONALD | O211: MIDDLETON | R211: REITMAN
A212: GOALKICKERS
A213: BRUNSWICK | D213: McLEOD | G213: PRICE | J213: CHANDLER | M213: HARKER | O213: CHASE | Q213: MUNRO
A214: WILLIAMSTOWN | D214: AMY | G214: MITCHELL | J214: McTAGGART | M214: WALLIS
A216: PRAHRAN | C216: 0 | D216: 5 | E216: =C216*6+D216 -> 5 | G216: 3 | H216: 6 | I216: =G216*6+H216 -> 24 | K216: 5 | L216: 9 | M216: =K216*6+L216 -> 39 | O216: 8 | P216: 14 | Q216: =O216*6+P216 -> 62 | S216: PORT MELB
A217: PORT MELBOURNE | C217: 0 | D217: 5 | E217: =C217*6+D217 -> 5 | G217: 2 | H217: 7 | I217: =G217*6+H217 -> 19 | K217: 3 | L217: 7 | M217: =K217*6+L217 -> 25 | O217: 4 | P217: 10 | Q217: =O217*6+P217 -> 34 | S217: F PRITCHARD
A218: BEST PLAYERS
A219: PRAHRAN | D219: DAVIS | G219: CARLSON | J219: WOODS | M219: GOLLIN | P219: MAYNARD | S219: DANIELS
A220: PORT MELBOURNE | D220: McCONVILLE | G220: BARFOOT | J220: CARDEN | M220: MERRICK | P220: CLELAND | S220: WALTON
A221: GOALKICKERS
A222: PRAHRAN | D222: DANIELS 3 | G222: MARONEY 2 | J222: KERR | L222: HOLMES | O222: RYAN
A223: PORT MELBOURNE | D223: MERRICK 2 | G223: ADAMS | J223: BARFOOT
A225: BRIGHTON | C225: 3 | D225: 8 | E225: =C225*6+D225 -> 26 | G225: 5 | H225: 14 | I225: =G225*6+H225 -> 44 | K225: 8 | L225: 19 | M225: =K225*6+L225 -> 67 | O225: 13 | P225: 23 | Q225: =O225*6+P225 -> 101 | S225: BRIGHTON BEACH
A226: HAWTHORN | C226: 1 | D226: 0 | E226: =C226*6+D226 -> 6 | G226: 1 | H226: 1 | I226: =G226*6+H226 -> 7 | K226: 4 | L226: 3 | M226: =K226*6+L226 -> 27 | O226: 6 | P226: 5 | Q226: =O226*6+P226 -> 41 | S226: HURLEY
A227: BEST PLAYERS
A228: BRIGHTON | D228: BAYLISS | G228: TEESE | J228: JOOLEN | M228: R DAWSON | P228: B BAILES | S228: HENDERSON
A229: HAWTHORN | D229: SALVADO | G229: STAGGALL | J229: LARKIN | M229: FEWSTER | P229: BRADY | S229: CROWE
A230: GOALKICKERS
A231: BRIGHTON | D231: BAYLISS 5 | G231: TEESE 4 | J231: DUGGAN 2 | M231: GRAHAM | O231: A DAWSON
A232: HAWTHORN | D232: McCONVILLE 2 | H232: CHAPMAN | K232: HOMEWOOD | N232: KIKER | P232: McCANN
A234: NORTH MELBOURNE | C234: 6 | D234: 9 | E234: =C234*6+D234 -> 45 | G234: 7 | H234: 13 | I234: =G234*6+H234 -> 55 | K234: 12 | L234: 18 | M234: =K234*6+L234 -> 90 | O234: 17 | P234: 23 | Q234: =O234*6+P234 -> 125 | S234: NORTH MELB
A235: NORTHCOTE | C235: 0 | D235: 0 | E235: =C235*6+D235 -> 0 | G235: 0 | H235: 2 | I235: =G235*6+H235 -> 2 | K235: 0 | L235: 3 | M235: =K235*6+L235 -> 3 | O235: 2 | P235: 4 | Q235: =O235*6+P235 -> 16 | S235: KENDALL
A236: BEST PLAYERS
A237: NORTH MELBOURNE | D237: SPEAKMAN | G237: BARKER | J237: FRANKS | M237: RAWLE | P237: MORAN | S237: HAWKINS
A238: NORTHCOTE | D238: VEITCH | G238: H SMITH | J238: WHITE | M238: CARROLL | P238: NOBLE | S238: BECK
A239: GOALKICKERS
A240: NORTH MELBOURNE | D240: MORAN 5 | G240: HAWKINS 4 | J240: CAVE 2 | M240: CONDON 2
A241: NORTHCOTE | D241: DUNCAN | G241: CARROLL
A243: ROUND 6 | E243: 16TH MAY | J243: WEATHER | M243: NORTH BREEZE FINE | S243: PLAYED AT | X243: LADDER | AB243: ROUND | AD243: 6
D244: 1ST QTR | H244: 2ND QTR | L244: 3RD QTR | P244: FINAL | S244: WILLIAMSTOWN
A245: FOOTSCRAY | C245: 4 | D245: 2 | E245: =C245*6+D245 -> 26 | G245: 6 | H245: 3 | I245: =G245*6+H245 -> 39 | K245: 7 | L245: 3 | M245: =K245*6+L245 -> 45 | O245: 10 | P245: 6 | Q245: =O245*6+P245 -> 66 | S245: UMPIRE | W245: TEAM | X245: W | Y245: L | Z245: D | AA245: FOR | AB245: AGST | AC245: % | AD245: PTS
A246: WILLIAMSTOWN | C246: 2 | D246: 1 | E246: =C246*6+D246 -> 13 | G246: 3 | H246: 5 | I246: =G246*6+H246 -> 23 | K246: 7 | L246: 7 | M246: =K246*6+L246 -> 49 | O246: 7 | P246: 11 | Q246: =O246*6+P246 -> 53 | S246: McMURRAY
A247: BEST PLAYERS | W247: NORTH MELBOURNE | X247: 5 | Y247: 1 | Z247: 0 | AA247: 533 | AB247: 270 | AC247: 197.41 | AD247: 20
A248: FOOTSCRAY | D248: GRIMSHAW | G248: McCLUSKY | J248: BAXTER | L248: ELDRIDGE | O248: GRIERSON | Q248: NEILSON | W248: FOOTSCRAY | X248: 5 | Y248: 1 | Z248: 0 | AA248: 370 | AB248: 281 | AC248: 131.67259786476868 | AD248: 20
A249: WILLIAMSTOWN | D249: WALLIS | G249: MIDDLETON | J249: JONES | L249: McDONALD | O249: GRANT | Q249: ANDERSON | W249: WILLIAMSTOWN | X249: 4 | Y249: 2 | Z249: 0 | AA249: 359 | AB249: 244 | AC249: 147.13114754098362 | AD249: 16
A250: GOALKICKERS | W250: ESSENDON ASSOC. | X250: 4 | Y250: 2 | Z250: 0 | AA250: 455 | AB250: 317 | AC250: 143.53312302839117 | AD250: 16
A251: FOOTSCRAY | D251: BANBURY 3 | G251: CROUCH 2 | J251: BAXTER 2 | M251: NEILSON 2 | P251: COTTON
A252: WILLIAMSTOWN | D252: E BUSBRIDGE 2 | H252: CAMERON 2 | K252: O'HALLORAN | N252: HOEY | P252: SCHADE | W252: BRUNSWICK | X252: 4 | Y252: 2 | Z252: 0 | AA252: 458 | AB252: 348 | AC252: 131.61 | AD252: 16
W253: PRAHRAN | X253: 3 | Y253: 3 | Z253: 0 | AA253: 324 | AB253: 330 | AC253: 98.181818181818187 | AD253: 12
A254: BRUNSWICK | C254: 5 | D254: 0 | E254: =C254*6+D254 -> 30 | G254: 7 | H254: 6 | I254: =G254*6+H254 -> 48 | K254: 12 | L254: 16 | M254: =K254*6+L254 -> 88 | O254: 14 | P254: 18 | Q254: =O254*6+P254 -> 102 | S254: BRUNSWICK | W254: BRIGHTON | X254: 3 | Y254: 3 | Z254: 0 | AA254: 325 | AB254: 383 | AC254: 84.856396866840726 | AD254: 12
A255: PORT MELBOURNE | C255: 5 | D255: 3 | E255: =C255*6+D255 -> 33 | G255: 7 | H255: 4 | I255: =G255*6+H255 -> 46 | K255: 8 | L255: 5 | M255: =K255*6+L255 -> 53 | O255: 11 | P255: 8 | Q255: =O255*6+P255 -> 74 | S255: C PRITCHARD | W255: PORT MELBOURNE | X255: 2 | Y255: 4 | Z255: 0 | AA255: 364 | AB255: 440 | AC255: 82.727272727272734 | AD255: 8
A256: BEST PLAYERS | W256: HAWTHORN | X256: 0 | Y256: 6 | Z256: 0 | AA256: 354 | AB256: 602 | AC256: 58.803986710963457 | AD256: 0
A257: BRUNSWICK | D257: CHASE | G257: O'CONNOR | J257: ROSS | L257: BRAID | O257: PRICE | Q257: SULLIVAN | W257: NORTHCOTE | X257: 0 | Y257: 6 | Z257: 0 | AA257: 220 | AB257: 547 | AC257: 40.219378427787937 | AD257: 0
A258: PORT MELBOURNE | D258: WALTON | G258: BARFOOT | J258: CARDEN | L258: BAILEY | O258: SAMSON | Q258: FRANKLIN
A259: GOALKICKERS
A260: BRUNSWICK | D260: TOPHAM 3 | G260: HARKER 2 | J260: CHASE 2 | L260: CLOWE | N260: McKENZIE | Q260: JOHNSON | S260: O'CONNOR | V260: McLEOD | X260: PRICE | Z260: SULLIVAN
A261: PORT MELBOURNE | D261: WALTON 4 | G261: MERRICK 3 | J261: BARFOOT | L261: BAILEY | N261: SAMSON | P261: TREGLOWN
A263: BRIGHTON | C263: 3 | D263: 1 | E263: =C263*6+D263 -> 19 | G263: 6 | H263: 2 | I263: =G263*6+H263 -> 38 | K263: 7 | L263: 5 | M263: =K263*6+L263 -> 47 | O263: 9 | P263: 6 | Q263: =O263*6+P263 -> 60 | S263: TOORAK PARK
A264: PRAHRAN | C264: 2 | D264: 3 | E264: =C264*6+D264 -> 15 | G264: 3 | H264: 4 | I264: =G264*6+H264 -> 22 | K264: 5 | L264: 5 | M264: =K264*6+L264 -> 35 | O264: 7 | P264: 7 | Q264: =O264*6+P264 -> 49 | S264: KENDALL
A265: BEST PLAYERS
A266: BRIGHTON | D266: BAYLISS | G266: HENDERSON | J266: NEGRO | L266: DAWSON | O266: TEESE | R266: KNIGHTON
A267: PRAHRAN | D267: WOODS | G267: CARLSON | J267: DANIELS | L267: MARONEY | O267: DOWSING | R267: RYAN
A268: GOALKICKERS
A269: BRIGHTON | D269: TEESE 3 | G269: BAYLISS 3 | J269: JOOLEN | L269: DUGGAN | O269: B BAILES
A270: PRAHRAN | D270: DOWSING 2 | G270: O'CONNOR | J270: McKENZIE | M270: MAYNARD | O270: HOLMES | R270: FARMER
A272: ESSENDON ASSOC. | C272: 4 | D272: 2 | E272: =C272*6+D272 -> 26 | G272: 8 | H272: 4 | I272: =G272*6+H272 -> 52 | K272: 10 | L272: 10 | M272: =K272*6+L272 -> 70 | O272: 14 | P272: 13 | Q272: =O272*6+P272 -> 97 | S272: CROXTON PK
A273: NORTHCOTE | C273: 2 | D273: 1 | E273: =C273*6+D273 -> 13 | G273: 4 | H273: 5 | I273: =G273*6+H273 -> 29 | K273: 6 | L273: 7 | M273: =K273*6+L273 -> 43 | O273: 7 | P273: 9 | Q273: =O273*6+P273 -> 51 | S273: HERBERT
A274: BEST PLAYERS
A275: ESSENDON ASSOC. | D275: M MADDEN | G275: HOARE | J275: DIGGLE | M275: COCKRAM | P275: CLARKE | S275: GIBSON
A276: NORTHCOTE | D276: SMITH | G276: BASSETT | J276: COLE | M276: CHALMERS | P276: H THOMAS | S276: HALE
A277: GOALKICKERS
A278: ESSENDON ASSOC. | D278: CLARKE 4 | G278: HOARE 3 | J278: ATKINS 3 | M278: DIGGLE 2 | P278: McPHERSON | S278: WALKER
A279: NORTHCOTE | D279: BILLETT 3 | G279: RIDD | I279: THOMAS | K279: BECK | M279: MILLS
A281: NORTH MELBOURNE | C281: 6 | D281: 3 | E281: =C281*6+D281 -> 39 | G281: 12 | H281: 8 | I281: =G281*6+H281 -> 80 | K281: 17 | L281: 13 | M281: =K281*6+L281 -> 115 | O281: 19 | P281: 19 | Q281: =O281*6+P281 -> 133 | S281: HAW
A282: HAWTHORN | C282: 1 | D282: 7 | E282: =C282*6+D282 -> 13 | G282: 4 | H282: 10 | I282: =G282*6+H282 -> 34 | K282: 6 | L282: 17 | M282: =K282*6+L282 -> 53 | O282: 6 | P282: 22 | Q282: =O282*6+P282 -> 58 | S282: HURLEY
A283: BEST PLAYERS
A284: NORTH MELBOURNE | D284: HAWKINS | G284: MORAN | J284: FRANKS | M284: BARKER | P284: RAWLE | S284: CAVE
A285: HAWTHORN | D285: BECKMAN | G285: HOLLAND | J285: GOUGH | M285: CHAPMAN | P285: FEWSTER | S285: WILKINSON
A286: GOALKICKERS
A287: NORTH MELBOURNE | D287: MORAN 4
A288: HAWTHORN | D288: BECKMAN | G288: WILKINSON
A290: ROUND 7 | E290: 23RD MAY | J290: WEATHER | M290: NORTH WEST WIND | S290: PLAYED AT | X290: LADDER | AB290: ROUND | AD290: 7
D291: 1ST QTR | H291: 2ND QTR | L291: 3RD QTR | P291: FINAL | S291: NORTH MELB
A292: NORTH MELBOURNE | C292: 4 | D292: 3 | E292: =C292*6+D292 -> 27 | G292: 7 | H292: 7 | I292: =G292*6+H292 -> 49 | K292: 8 | L292: 9 | M292: =K292*6+L292 -> 57 | O292: 11 | P292: 16 | Q292: =O292*6+P292 -> 82 | S292: UMPIRE | W292: TEAM | X292: W | Y292: L | Z292: D | AA292: FOR | AB292: AGST | AC292: % | AD292: PTS
A293: FOOTSCRAY | C293: 2 | D293: 3 | E293: =C293*6+D293 -> 15 | G293: 3 | H293: 4 | I293: =G293*6+H293 -> 22 | K293: 5 | L293: 6 | M293: =K293*6+L293 -> 36 | O293: 7 | P293: 10 | Q293: =O293*6+P293 -> 52 | S293: C PRITCHARD
A294: BEST PLAYERS | W294: NORTH MELBOURNE | X294: 6 | Y294: 1 | Z294: 0 | AA294: 615 | AB294: 322 | AC294: 190.99 | AD294: 24
A295: NORTH MELBOURNE | D295: CAVE | G295: CARPENTER | J295: RAWLE | L295: BARKER | N295: WOODINGTON | Q295: SPEAKMAN | W295: FOOTSCRAY | X295: 5 | Y295: 2 | Z295: 0 | AA295: 422 | AB295: 363 | AC295: 116.2534435261708 | AD295: 20
A296: FOOTSCRAY | D296: GRIERSON | G296: BAXTER | J296: COTTON | L296: FORD | N296: HARRIS | Q296: NEILSON | W296: BRUNSWICK | X296: 4 | Y296: 2 | Z296: 1 | AA296: 541 | AB296: 431 | AC296: 125.52 | AD296: 18
A297: GOALKICKERS | W297: ESSENDON ASSOC. | X297: 4 | Y297: 3 | Z297: 0 | AA297: 513 | AB297: 390 | AC297: 131.53846153846155 | AD297: 16
A298: NORTH MELBOURNE | D298: HAWKINS 4 | G298: CARPENTER 3 | J298: CONDON 2 | M298: MORAN | O298: GARDINER
A299: FOOTSCRAY | D299: CROUCH 2 | G299: COTTON 2 | J299: DONNELLY | M299: LAWSON | O299: BAXTER | W299: WILLIAMSTOWN | X299: 4 | Y299: 3 | Z299: 0 | AA299: 431 | AB299: 332 | AC299: 129.81927710843374 | AD299: 16
W300: BRIGHTON | X300: 4 | Y300: 3 | Z300: 0 | AA300: 416 | AB300: 415 | AC300: 100.24096385542168 | AD300: 16
A301: PRAHRAN | C301: 3 | D301: 4 | E301: =C301*6+D301 -> 22 | G301: 7 | H301: 6 | I301: =G301*6+H301 -> 48 | K301: 10 | L301: 9 | M301: =K301*6+L301 -> 69 | O301: 12 | P301: 11 | Q301: =O301*6+P301 -> 83 | S301: TOORAK PARK | W301: PRAHRAN | X301: 3 | Y301: 3 | Z301: 1 | AA301: 407 | AB301: 413 | AC301: 98.54721549636804 | AD301: 14
A302: BRUNSWICK | C302: 3 | D302: 1 | E302: =C302*6+D302 -> 19 | G302: 6 | H302: 2 | I302: =G302*6+H302 -> 38 | K302: 7 | L302: 7 | M302: =K302*6+L302 -> 49 | O302: 12 | P302: 11 | Q302: =O302*6+P302 -> 83 | S302: HURLEY | W302: PORT MELBOURNE | X302: 3 | Y302: 4 | Z302: 0 | AA302: 437 | AB302: 498 | AC302: 87.751004016064257 | AD302: 12
A303: BEST PLAYERS | W303: HAWTHORN | X303: 1 | Y303: 6 | Z303: 0 | AA303: 442 | AB303: 674 | AC303: 65.578635014836792 | AD303: 4
A304: PRAHRAN | D304: WEIDNER | G304: MARONEY | J304: DANIELS | M304: CAIN | O304: ELLIN | Q304: HOLMES | W304: NORTHCOTE | X304: 0 | Y304: 7 | Z304: 0 | AA304: 252 | AB304: 638 | AC304: 39.498432601880879 | AD304: 0
A305: BRUNSWICK | D305: CHASE | G305: GILLESPIE | J305: SWIFT | M305: ROSS | O305: McLEOD | Q305: TOPHAM
A306: GOALKICKERS
A307: PRAHRAN | D307: ELLIN 2 | F307: HOLMES 2 | I307: DOWSING 2 | L307: CAIN 2 | N307: WEIDNER 2 | Q307: McKENZIE | S307: WILSON
A308: BRUNSWICK | D308: TOPHAM 5 | G308: HARKER 2 | J308: CHASE 2 | M308: PRICE | O308: O'CONNOR | R308: GILLESPIE
A310: BRIGHTON | C310: 3 | D310: 8 | E310: =C310*6+D310 -> 26 | G310: 7 | H310: 12 | I310: =G310*6+H310 -> 54 | K310: 10 | L310: 15 | M310: =K310*6+L310 -> 75 | O310: 12 | P310: 19 | Q310: =O310*6+P310 -> 91 | S310: BRIGHTON BEACH
A311: NORTHCOTE | C311: 0 | D311: 1 | E311: =C311*6+D311 -> 1 | G311: 1 | H311: 2 | I311: =G311*6+H311 -> 8 | K311: 2 | L311: 2 | M311: =K311*6+L311 -> 14 | O311: 5 | P311: 2 | Q311: =O311*6+P311 -> 32 | S311: PORTEOUS
A312: BEST PLAYERS
A313: BRIGHTON | D313: NEGRO | G313: GRAHAM | J313: TURNBULL | M313: DAWSON | P313: BAYLISS | S313: TEESE
A314: NORTHCOTE | D314: H THOMAS | G314: BILLETT | J314: CHALMERS | M314: COLE | P314: NOBLE | S314: BASSETT
A315: GOALKICKERS
A316: BRIGHTON | D316: TEESE 4 | G316: DUGGAN 3 | J316: DAWSON 2 | M316: B BAILES | O316: WILSON | R316: DOOLAN
A317: NORTHCOTE
A319: PORT MELBOURNE | C319: 2 | D319: 2 | E319: =C319*6+D319 -> 14 | G319: 5 | H319: 4 | I319: =G319*6+H319 -> 34 | K319: 6 | L319: 5 | M319: =K319*6+L319 -> 41 | O319: 11 | P319: 7 | Q319: =O319*6+P319 -> 73 | S319: ESSENDON
A320: ESSENDON ASSOC. | C320: 2 | D320: 7 | E320: =C320*6+D320 -> 19 | G320: 4 | H320: 10 | I320: =G320*6+H320 -> 34 | K320: 6 | L320: 14 | M320: =K320*6+L320 -> 50 | O320: 7 | P320: 16 | Q320: =O320*6+P320 -> 58 | S320: McCART
A321: BEST PLAYERS
A322: PORT MELBOURNE | D322: WALTON | G322: CARDEN | J322: MACKIE | M322: HOWLETT | P322: SAMSON | S322: FRANKLIN
A323: ESSENDON ASSOC. | D323: M MADDEN | G323: J MADDEN | J323: WALKER | M323: EBBOTT | P323: GEISLER | S323: HOARE
A324: GOALKICKERS
A325: PORT MELBOURNE | D325: WALTON 6 | G325: MERRICK | J325: TREGLOWN | M325: DEAS | O325: BARFOOT | R325: HOWLETT
A326: ESSENDON ASSOC. | D326: HOARE 2 | G326: EBBOTT | J326: SEVIOR | L326: TURNER | N326: GEISLER | Q326: CLARKE
A328: HAWTHORN | C328: 2 | D328: 5 | E328: =C328*6+D328 -> 17 | G328: 7 | H328: 6 | I328: =G328*6+H328 -> 48 | K328: 10 | L328: 8 | M328: =K328*6+L328 -> 68 | O328: 13 | P328: 10 | Q328: =O328*6+P328 -> 88 | S328: HAW
A329: WILLIAMSTOWN | C329: 3 | D329: 3 | E329: =C329*6+D329 -> 21 | G329: 6 | H329: 6 | I329: =G329*6+H329 -> 42 | K329: 8 | L329: 8 | M329: =K329*6+L329 -> 56 | O329: 10 | P329: 12 | Q329: =O329*6+P329 -> 72 | S329: KENDALL
A330: BEST PLAYERS
A331: HAWTHORN | D331: McCONVILLE | G331: LARKIN | J331: WILKINSON | M331: FEWSTER | P331: CHAPMAN | S331: HOLLAND
A332: WILLIAMSTOWN | D332: AMY | G332: GRANT | J332: MITCHELL | M332: McTAGGART | P332: O'HALLORAN | S332: McLAEN
A333: GOALKICKERS
A334: HAWTHORN | D334: BECKMAN 4 | G334: FEWSTER 3 | J334: SALVADO | M334: SCHAEFER | P334: WILKINSON | S334: CHAPMAN
A335: WILLIAMSTOWN | D335: E BUSBRIDGE 4 | H335: CAMERON 2 | K335: AMY 2 | M335: McTAGGART | P335: O'HALLORAN
A337: ROUND 8 | E337: 30TH MAY | J337: WEATHER | M337: NORTH WIND | S337: PLAYED AT | X337: LADDER | AB337: ROUND | AD337: 8
D338: 1ST QTR | H338: 2ND QTR | L338: 3RD QTR | P338: FINAL | S338: WILLIAMSTOWN
A339: NORTH MELBOURNE | C339: 1 | D339: 1 | E339: =C339*6+D339 -> 7 | G339: 6 | H339: 7 | I339: =G339*6+H339 -> 43 | K339: 7 | L339: 10 | M339: =K339*6+L339 -> 52 | O339: 8 | P339: 14 | Q339: =O339*6+P339 -> 62 | S339: UMPIRE | W339: TEAM | X339: W | Y339: L | Z339: D | AA339: FOR | AB339: AGST | AC339: % | AD339: PTS
A340: WILLIAMSTOWN | C340: 4 | D340: 2 | E340: =C340*6+D340 -> 26 | G340: 4 | H340: 3 | I340: =G340*6+H340 -> 27 | K340: 6 | L340: 7 | M340: =K340*6+L340 -> 43 | O340: 8 | P340: 9 | Q340: =O340*6+P340 -> 57 | S340: C PRITCHARD
A341: BEST PLAYERS | W341: NORTH MELBOURNE | X341: 7 | Y341: 1 | Z341: 0 | AA341: 677 | AB341: 379 | AC341: 178.63 | AD341: 28
A342: NORTH MELBOURNE | D342: FRANKS | G342: WOODINGTON | J342: BARKER | M342: CARPENTER | P342: JONES | R342: HAWKINS | W342: FOOTSCRAY | X342: 6 | Y342: 2 | Z342: 0 | AA342: 500 | AB342: 383 | AC342: 130.54830287206266 | AD342: 24
A343: WILLIAMSTOWN | D343: E BUSBRIDGE | G343: N BUSBRIDGE | J343: MITCHELL | M343: ANDERSON | P343: ALLEY | R343: GRANT | W343: BRUNSWICK | X343: 5 | Y343: 2 | Z343: 1 | AA343: 657 | AB343: 491 | AC343: 133.81 | AD343: 22
A344: GOALKICKERS | W344: ESSENDON ASSOC. | X344: 5 | Y344: 3 | Z344: 0 | AA344: 576 | AB344: 447 | AC344: 128.85906040268458 | AD344: 20
A345: NORTH MELBOURNE | D345: HAWKINS 3 | G345: MORAN 2 | I345: CARPENTER
A346: WILLIAMSTOWN | D346: McLEAN 2 | F346: O'HALLORAN | I346: McDONALD | L346: AMY | M346: ELLIOTT | O346: N BUSBRIDGE | R346: E BUSBRIDGE | W346: WILLIAMSTOWN | X346: 4 | Y346: 4 | Z346: 0 | AA346: 488 | AB346: 394 | AC346: 123.85786802030456 | AD346: 16
W347: PORT MELBOURNE | X347: 4 | Y347: 4 | Z347: 0 | AA347: 511 | AB347: 542 | AC347: 94.280442804428048 | AD347: 16
A348: ESSENDON ASSOC. | C348: 2 | D348: 6 | E348: =C348*6+D348 -> 18 | G348: 5 | H348: 6 | I348: =G348*6+H348 -> 36 | K348: 9 | L348: 7 | M348: =K348*6+L348 -> 61 | O348: 9 | P348: 9 | Q348: =O348*6+P348 -> 63 | S348: ESSENDON | W348: BRIGHTON | X348: 4 | Y348: 4 | Z348: 0 | AA348: 460 | AB348: 489 | AC348: 94.069529652351733 | AD348: 16
A349: PRAHRAN | C349: 2 | D349: 1 | E349: =C349*6+D349 -> 13 | G349: 4 | H349: 4 | I349: =G349*6+H349 -> 28 | K349: 5 | L349: 7 | M349: =K349*6+L349 -> 37 | O349: 8 | P349: 9 | Q349: =O349*6+P349 -> 57 | S349: HURLEY | W349: PRAHRAN | X349: 3 | Y349: 4 | Z349: 1 | AA349: 464 | AB349: 476 | AC349: 97.47899159663865 | AD349: 14
A350: BEST PLAYERS | W350: HAWTHORN | X350: 1 | Y350: 7 | Z350: 0 | AA350: 502 | AB350: 790 | AC350: 63.544303797468352 | AD350: 4
A351: ESSENDON ASSOC. | D351: M MADDEN | G351: HOARE | I351: PAIN | L351: WALKER | O351: BICKFORD | R351: SEVIOR | W351: NORTHCOTE | X351: 0 | Y351: 8 | Z351: 0 | AA351: 272 | AB351: 716 | AC351: 37.988826815642462 | AD351: 0
A352: PRAHRAN | D352: MARONEY | G352: CAIN | I352: KERR | L352: DAVIS | O352: FARMER | R352: ELLIN
A353: GOALKICKERS
A354: ESSENDON ASSOC. | D354: CLARKE 3 | G354: SEVIOR 2 | J354: EBBOTT 2 | M354: PAIN | O354: GEISLER
A355: PRAHRAN | D355: HOLMES 2 | G355: ELLIN 2 | J355: KERR | L355: CAIN | N355: WOODS | P355: MARONEY
A357: PORT MELBOURNE | C357: 0 | D357: 1 | E357: =C357*6+D357 -> 1 | G357: 3 | H357: 9 | I357: =G357*6+H357 -> 27 | K357: 7 | L357: 9 | M357: =K357*6+L357 -> 51 | O357: 10 | P357: 14 | Q357: =O357*6+P357 -> 74 | S357: PORT MELB
A358: BRIGHTON | C358: 3 | D358: 3 | E358: =C358*6+D358 -> 21 | G358: 4 | H358: 3 | I358: =G358*6+H358 -> 27 | K358: 5 | L358: 10 | M358: =K358*6+L358 -> 40 | O358: 5 | P358: 14 | Q358: =O358*6+P358 -> 44 | S358: DWYER
A359: BEST PLAYERS
A360: PORT MELBOURNE | D360: CLELAND | G360: FRANKLIN | J360: MACKIE | M360: ANDERSON | P360: DEAS | R360: McCONVILLE
A361: BRIGHTON | D361: PATTERSON | G361: SLATER | J361: NEGRO | M361: HENDERSON | P361: TEESE | R361: E BAILES
A362: GOALKICKERS
A363: PORT MELBOURNE | D363: WALTON 4 | G363: MERRICK 3 | J363: ANDERSON | M363: McCONVILLE | P363: MENZIES
A364: BRIGHTON | D364: TEESE 2 | G364: TURNBULL | J364: GRAHAM | M364: WILSON
A366: BRUNSWICK | C366: 5 | D366: 3 | E366: =C366*6+D366 -> 33 | G366: 7 | H366: 10 | I366: =G366*6+H366 -> 52 | K366: 14 | L366: 11 | M366: =K366*6+L366 -> 95 | O366: 17 | P366: 14 | Q366: =O366*6+P366 -> 116 | S366: BRUNSWICK
A367: HAWTHORN | C367: 0 | D367: 3 | E367: =C367*6+D367 -> 3 | G367: 2 | H367: 9 | I367: =G367*6+H367 -> 21 | K367: 3 | L367: 9 | M367: =K367*6+L367 -> 27 | O367: 8 | P367: 12 | Q367: =O367*6+P367 -> 60 | S367: McMURRAY
A368: BEST PLAYERS
A369: BRUNSWICK | D369: PRICE | G369: HARKER | J369: GORMAN | M369: ROSS | O369: GILLESPIE | R369: McKENZIE
A370: HAWTHORN | D370: LARKIN | G370: BRADY | J370: HOLLAND | M370: SCHAEFER | O370: BECKMAN | R370: CHAPMAN
A371: GOALKICKERS
A372: BRUNSWICK | D372: PRICE 4 | G372: HARKER 3 | J372: TOPHAM 3 | M372: STEVENSON 3 | P372: THOMAS 2 | S372: O'CONNOR | V372: SULLIVAN
A373: HAWTHORN | D373: BECKMAN 3 | G373: CHAPMAN 2 | J373: MAY | L373: SCHAEFER | O373: WILKINSON
A375: FOOTSCRAY | C375: 4 | D375: 3 | E375: =C375*6+D375 -> 27 | G375: 6 | H375: 8 | I375: =G375*6+H375 -> 44 | K375: 8 | L375: 9 | M375: =K375*6+L375 -> 57 | O375: 10 | P375: 18 | Q375: =O375*6+P375 -> 78 | S375: FOOTSCRAY
A376: NORTHCOTE | C376: 0 | D376: 0 | E376: =C376*6+D376 -> 0 | G376: 0 | H376: 0 | I376: =G376*6+H376 -> 0 | K376: 3 | L376: 2 | M376: =K376*6+L376 -> 20 | O376: 3 | P376: 2 | Q376: =O376*6+P376 -> 20 | S376: KENDALL
A377: BEST PLAYERS
A378: FOOTSCRAY | D378: GRIERSON | G378: COTTON | J378: GREGORY | M378: SAMSON | P378: LAWSON | S378: GRIMSHAW
A379: NORTHCOTE | D379: H THOMAS | G379: BASSETT | J379: HALL | M379: PEMBERTON | P379: MILLS | S379: J JOHNSON
A380: GOALKICKERS
A381: FOOTSCRAY | D381: LAWSON 4 | G381: DODEMAIDE 4 | K381: GRIERSON | N381: GREGORY
A382: NORTHCOTE | D382: BRIDGFORD | G382: E THOMAS
A384: ROUND 9 | E384: 6TH JUNE | J384: WEATHER | M384: WEST BREEZE FINE | S384: PLAYED AT | X384: LADDER | AB384: ROUND | AD384: 9
D385: 1ST QTR | H385: 2ND QTR | L385: 3RD QTR | P385: FINAL | S385: BRUNSWICK
A386: BRUNSWICK | C386: 4 | D386: 4 | E386: =C386*6+D386 -> 28 | G386: 9 | H386: 5 | I386: =G386*6+H386 -> 59 | K386: 10 | L386: 6 | M386: =K386*6+L386 -> 66 | O386: 11 | P386: 8 | Q386: =O386*6+P386 -> 74 | S386: UMPIRE | W386: TEAM | X386: W | Y386: L | Z386: D | AA386: FOR | AB386: AGST | AC386: % | AD386: PTS
A387: ESSENDON ASSOC. | C387: 1 | D387: 1 | E387: =C387*6+D387 -> 7 | G387: 2 | H387: 7 | I387: =G387*6+H387 -> 19 | K387: 4 | L387: 12 | M387: =K387*6+L387 -> 36 | O387: 7 | P387: 14 | Q387: =O387*6+P387 -> 56 | S387: McMURRAY
A388: BEST PLAYERS | W388: NORTH MELBOURNE | X388: 7 | Y388: 2 | Z388: 0 | AA388: 734 | AB388: 451 | AC388: 612.75 | AD388: 28
A389: BRUNSWICK | D389: CHANDLER | G389: PRICE | I389: ROSS | L389: SULLIVAN | O389: McKAY | R389: CLOWE | W389: BRUNSWICK | X389: 6 | Y389: 2 | Z389: 1 | AA389: 731 | AB389: 547 | AC389: 133.64 | AD389: 26
A390: ESSENDON ASSOC. | D390: M MADDEN | G390: PAIN | I390: WALKER | L390: EBBOTT | O390: SEVIOR | R390: BICKFORD | W390: FOOTSCRAY | X390: 6 | Y390: 3 | Z390: 0 | AA390: 565 | AB390: 455 | AC390: 124.17582417582418 | AD390: 24
A391: GOALKICKERS | W391: WILLIAMSTOWN | X391: 5 | Y391: 4 | Z391: 0 | AA391: 542 | AB391: 444 | AC391: 122.07207207207207 | AD391: 20
A392: BRUNSWICK | D392: PRICE 3 | F392: CHANDLER 2 | I392: CHASE 2 | K392: McKAY | M392: HARKER | O392: SULLIVAN | Q392: TOPHAM
A393: ESSENDON ASSOC. | D393: CLARKE 3 | G393: ATKINS | J393: GEISLER | M393: SEVIOR | P393: J MADDEN | W393: ESSENDON ASSOC. | X393: 5 | Y393: 4 | Z393: 0 | AA393: 632 | AB393: 521 | AC393: 121.30518234165068 | AD393: 20
W394: PORT MELBOURNE | X394: 5 | Y394: 4 | Z394: 0 | AA394: 583 | AB394: 599 | AC394: 97.328881469115188 | AD394: 20
A395: WILLIAMSTOWN | C395: 5 | D395: 2 | E395: =C395*6+D395 -> 32 | G395: 7 | H395: 4 | I395: =G395*6+H395 -> 46 | K395: 7 | L395: 4 | M395: =K395*6+L395 -> 46 | O395: 8 | P395: 6 | Q395: =O395*6+P395 -> 54 | S395: BRIGHTON BEACH | W395: PRAHRAN | X395: 4 | Y395: 4 | Z395: 1 | AA395: 536 | AB395: 541 | AC395: 99.075785582255079 | AD395: 18
A396: BRIGHTON | C396: 1 | D396: 1 | E396: =C396*6+D396 -> 7 | G396: 3 | H396: 4 | I396: =G396*6+H396 -> 22 | K396: 5 | L396: 7 | M396: =K396*6+L396 -> 37 | O396: 7 | P396: 8 | Q396: =O396*6+P396 -> 50 | S396: HURLEY | W396: BRIGHTON | X396: 4 | Y396: 5 | Z396: 0 | AA396: 510 | AB396: 543 | AC396: 93.922651933701658 | AD396: 16
A397: BEST PLAYERS | W397: HAWTHORN | X397: 1 | Y397: 8 | Z397: 0 | AA397: 577 | AB397: 867 | AC397: 66.551326412918115 | AD397: 4
A398: WILLIAMSTOWN | D398: ALLEY | F398: MITCHELL | I398: E BUSBRIDGE | L398: GIBBS | N398: N BUSBRIDGE | Q398: AMY | W398: NORTHCOTE | X398: 1 | Y398: 8 | Z398: 0 | AA398: 349 | AB398: 791 | AC398: 44.121365360303415 | AD398: 4
A399: BRIGHTON | D399: NEGRO | F399: WALLACE | I399: PATTERSON | L399: TEESE | N399: WILSON | Q399: DAWSON
A400: GOALKICKERS
A401: WILLIAMSTOWN | D401: MITCHELL 4 | H401: E BUSBRIDGE 3 | L401: AMY
A402: BRIGHTON | D402: TEESE 4 | G402: E BAILES 2 | K402: PATTERSON
A404: PORT MELBOURNE | C404: 3 | D404: 2 | E404: =C404*6+D404 -> 20 | G404: 5 | H404: 2 | I404: =G404*6+H404 -> 32 | K404: 9 | L404: 2 | M404: =K404*6+L404 -> 56 | O404: 11 | P404: 6 | Q404: =O404*6+P404 -> 72 | S404: NORTH MELB
A405: NORTH MELBOURNE | C405: 1 | D405: 6 | E405: =C405*6+D405 -> 12 | G405: 3 | H405: 9 | I405: =G405*6+H405 -> 27 | K405: 4 | L405: 19 | M405: =K405*6+L405 -> 43 | O405: 6 | P405: 21 | Q405: =O405*6+P405 -> 57 | S405: KENDALL
A406: BEST PLAYERS
A407: PORT MELBOURNE | D407: WALTON | G407: MERRICK | J407: BARFOOT | M407: MENZIES | P407: SAMSON | S407: BRUCE
A408: NORTH MELBOURNE | D408: CAVE | G408: BARKER | J408: MILES | M408: GARDINER
A409: GOALKICKERS
A410: PORT MELBOURNE | D410: WALTON 5 | G410: QUINN 2 | J410: MENZIES | L410: CARDEN | N410: BAILEY | P410: McCONVILLE
A411: NORTH MELBOURNE | D411: GARDINER 3 | G411: MILES 2 | J411: MORAN | L411: SPEAKMAN | O411: WOODINGTON | R411: JONES
A413: NORTHCOTE | C413: 4 | D413: 0 | E413: =C413*6+D413 -> 24 | G413: 8 | H413: 2 | I413: =G413*6+H413 -> 50 | K413: 10 | L413: 5 | M413: =K413*6+L413 -> 65 | O413: 12 | P413: 5 | Q413: =O413*6+P413 -> 77 | S413: CROXTON PK
A414: HAWTHORN | C414: 3 | D414: 3 | E414: =C414*6+D414 -> 21 | G414: 5 | H414: 6 | I414: =G414*6+H414 -> 36 | K414: 7 | L414: 8 | M414: =K414*6+L414 -> 50 | O414: 11 | P414: 9 | Q414: =O414*6+P414 -> 75 | S414: PORTEOUS
A415: BEST PLAYERS
A416: NORTHCOTE | D416: RAHILLY | G416: JACKSON | J416: WILLIS | M416: BECK | P416: COLE | R416: H THOMAS
A417: HAWTHORN | D417: LARKIN | G417: HANNAH | J417: SALVADO | M417: BRADY | P417: MORRIS | R417: STAGGALL
A418: GOALKICKERS
A419: NORTHCOTE | D419: JACKSON 4 | G419: RAHILLY 3 | J419: WILLIS 2 | M419: JOHNSON | O419: COLE | Q419: GOODALL
A420: HAWTHORN | D420: CHAPMAN 2 | G420: WILKINSON 2 | K420: SALVADO 2 | N420: SCHAEFER 2 | Q420: HANNAH 2 | T420: FEWSTER
A422: PRAHRAN | C422: 1 | D422: 3 | E422: =C422*6+D422 -> 9 | G422: 4 | H422: 8 | I422: =G422*6+H422 -> 32 | K422: 8 | L422: 10 | M422: =K422*6+L422 -> 58 | O422: 10 | P422: 12 | Q422: =O422*6+P422 -> 72 | S422: TOORAK PARK
A423: FOOTSCRAY | C423: 3 | D423: 4 | E423: =C423*6+D423 -> 22 | G423: 4 | H423: 5 | I423: =G423*6+H423 -> 29 | K423: 8 | L423: 8 | M423: =K423*6+L423 -> 56 | O423: 9 | P423: 11 | Q423: =O423*6+P423 -> 65 | S423: C PRITCHARD
A424: BEST PLAYERS
A425: PRAHRAN | D425: WEIDNER | G425: FARMER | J425: JONES | M425: MARONEY | P425: RYAN | S425: CARLSON
A426: FOOTSCRAY | D426: BAXTER | G426: CROUCH | J426: FORD | M426: SAMSON | P426: CRADDOCK | S426: GRIMSHAW
A427: GOALKICKERS
A428: PRAHRAN | D428: WEIDNER 4 | G428: MARONEY | J428: HOLMES | L428: JONES | N428: KERR | P428: MAYNARD | R428: DOWSING
A429: FOOTSCRAY | D429: BANBURY 3 | G429: LAWSON 2 | J429: BAXTER | L429: WILLIS | N429: CROUCH | P429: SAMSON
A431: ROUND 10 | E431: 8TH JUNE | I431: KINGS BIRTHDAY | S431: PLAYED AT | X431: LADDER | AB431: ROUND | AD431: 10
D432: 1ST QTR | H432: 2ND QTR | L432: 3RD QTR | P432: FINAL | S432: FOOTSCRAY
A433: FOOTSCRAY | C433: 2 | D433: 4 | E433: =C433*6+D433 -> 16 | G433: 3 | H433: 8 | I433: =G433*6+H433 -> 26 | K433: 5 | L433: 10 | M433: =K433*6+L433 -> 40 | O433: 7 | P433: 13 | Q433: =O433*6+P433 -> 55 | S433: UMPIRE | W433: TEAM | X433: W | Y433: L | Z433: D | AA433: FOR | AB433: AGST | AC433: % | AD433: PTS
A434: BRUNSWICK | C434: 0 | D434: 4 | E434: =C434*6+D434 -> 4 | G434: 2 | H434: 7 | I434: =G434*6+H434 -> 19 | K434: 4 | L434: 8 | M434: =K434*6+L434 -> 32 | O434: 5 | P434: 12 | Q434: =O434*6+P434 -> 42 | S434: HERBERT
A435: BEST PLAYERS | W435: NORTH MELBOURNE | X435: 7 | Y435: 3 | Z435: 0 | AA435: 790 | AB435: 510 | AC435: 154.9 | AD435: 28
A436: FOOTSCRAY | D436: CROUCH | G436: CRADDOCK | J436: BANBURY | M436: SAMSON | P436: FORD | R436: NEILSON | W436: FOOTSCRAY | X436: 7 | Y436: 3 | Z436: 0 | AA436: 620 | AB436: 497 | AC436: 124.74849094567405 | AD436: 28
A437: BRUNSWICK | D437: CHANDLER | G437: PRICE | J437: BRAID | M437: O'CONNOR | P437: SWIFT | R437: CLOWE | W437: BRUNSWICK | X437: 6 | Y437: 3 | Z437: 1 | AA437: 773 | AB437: 602 | AC437: 128.41 | AD437: 26
A438: GOALKICKERS | W438: ESSENDON ASSOC. | X438: 6 | Y438: 4 | Z438: 0 | AA438: 734 | AB438: 561 | AC438: 130.83778966131908 | AD438: 24
A439: FOOTSCRAY | D439: BANBURY 2 | G439: LAWSON 2 | J439: CRADDOCK | M439: DODEMAIDE | P439: SPENCE
A440: BRUNSWICK | D440: TOPHAM 3 | G440: PRICE | J440: HARKER | W440: PORT MELBOURNE | X440: 6 | Y440: 4 | Z440: 0 | AA440: 665 | AB440: 648 | AC440: 102.62345679012346 | AD440: 24
W441: PRAHRAN | X441: 5 | Y441: 4 | Z441: 1 | AA441: 615 | AB441: 616 | AC441: 99.837662337662337 | AD441: 22
A442: PRAHRAN | C442: 2 | D442: 5 | E442: =C442*6+D442 -> 17 | G442: 6 | H442: 10 | I442: =G442*6+H442 -> 46 | K442: 7 | L442: 11 | M442: =K442*6+L442 -> 53 | O442: 11 | P442: 13 | Q442: =O442*6+P442 -> 79 | S442: TOORAK PARK | W442: WILLIAMSTOWN | X442: 5 | Y442: 5 | Z442: 0 | AA442: 617 | AB442: 523 | AC442: 117.97323135755258 | AD442: 20
A443: WILLIAMSTOWN | C443: 3 | D443: 4 | E443: =C443*6+D443 -> 22 | G443: 5 | H443: 5 | I443: =G443*6+H443 -> 35 | K443: 7 | L443: 8 | M443: =K443*6+L443 -> 50 | O443: 10 | P443: 15 | Q443: =O443*6+P443 -> 75 | S443: HURLEY | W443: BRIGHTON | X443: 5 | Y443: 5 | Z443: 0 | AA443: 569 | AB443: 599 | AC443: 94.991652754590987 | AD443: 20
A444: BEST PLAYERS | W444: HAWTHORN | X444: 1 | Y444: 9 | Z444: 0 | AA444: 617 | AB444: 969 | AC444: 63.673890608875126 | AD444: 4
A445: PRAHRAN | D445: MARONEY | G445: DOWSING | I445: WEIDNER | L445: FARMER | O445: WOODHEAD | R445: MAYNARD | W445: NORTHCOTE | X445: 1 | Y445: 9 | Z445: 0 | AA445: 398 | AB445: 873 | AC445: 45.589919816723942 | AD445: 4
A446: WILLIAMSTOWN | D446: GRANT | G446: AMY | I446: McDONALD | L446: McTAGGART | O446: E BUSBRIDGE | R446: O'HALLORAN
A447: GOALKICKERS
A448: PRAHRAN | D448: FARMER 2 | G448: WEIDNER 2 | J448: KERR 2 | L448: RYAN 2 | N448: DANIELS | P448: DOWSING | R448: JONES
A449: WILLIAMSTOWN | D449: ELLIOTT 3 | G449: E BUSBRIDGE 2 | K449: McTAGGART 2 | O449: MITCHELL 2 | R449: STEWART
A451: ESSENDON ASSOC. | C451: 4 | D451: 4 | E451: =C451*6+D451 -> 28 | G451: 8 | H451: 8 | I451: =G451*6+H451 -> 56 | K451: 10 | L451: 10 | M451: =K451*6+L451 -> 70 | O451: 15 | P451: 12 | Q451: =O451*6+P451 -> 102 | S451: ESSENDON
A452: HAWTHORN | C452: 1 | D452: 2 | E452: =C452*6+D452 -> 8 | G452: 2 | H452: 2 | I452: =G452*6+H452 -> 14 | K452: 5 | L452: 3 | M452: =K452*6+L452 -> 33 | O452: 6 | P452: 4 | Q452: =O452*6+P452 -> 40 | S452: DWYER
A453: BEST PLAYERS
A454: ESSENDON ASSOC. | D454: ARMSTRONG | G454: M MADDEN | J454: J MADDEN | M454: DIGGLE | P454: PAIN | R454: EBBOTT
A455: HAWTHORN | D455: HOLLAND | G455: FEWSTER | J455: GOUGH | M455: BECKMAN | P455: BRADY | R455: WILKINSON
A456: GOALKICKERS
A457: ESSENDON ASSOC. | D457: ARMSTRONG 4 | G457: EBBOTT 3 | J457: DIGGLE 3 | M457: CLARKE 2 | P457: GIBSON | R457: ATKINS | T457: SEVIOR
A458: HAWTHORN | D458: BECKMAN 3 | G458: CHAPMAN | J458: HANNAH | M458: FEWSTER
A460: BRIGHTON | C460: 4 | D460: 2 | E460: =C460*6+D460 -> 26 | G460: 6 | H460: 3 | I460: =G460*6+H460 -> 39 | K460: 8 | L460: 4 | M460: =K460*6+L460 -> 52 | O460: 9 | P460: 5 | Q460: =O460*6+P460 -> 59 | S460: BRIGHTON BEACH
A461: NORTH MELBOURNE | C461: 1 | D461: 1 | E461: =C461*6+D461 -> 7 | G461: 5 | H461: 6 | I461: =G461*6+H461 -> 36 | K461: 7 | L461: 6 | M461: =K461*6+L461 -> 48 | O461: 8 | P461: 8 | Q461: =O461*6+P461 -> 56 | S461: KENDALL
A462: BEST PLAYERS
A463: BRIGHTON | D463: GRAHAM | G463: TAYLOR | J463: DOOLAN | M463: TEESE | P463: DAWSON | S463: E BAILES
A464: NORTH MELBOURNE | D464: WOODINGTON | G464: CAVE | J464: BARKER | M464: RAWLE | P464: CARPENTER | S464: JONES
A465: GOALKICKERS
A466: BRIGHTON | D466: GRAHAM 3 | G466: TAYLOR 3 | J466: DOOLAN | L466: DAWSON | N466: TEESE
A467: NORTH MELBOURNE | D467: MORAN 2 | G467: CARPENTER 2 | K467: MILES 2 | N467: MURPHY | P467: RAWLE
A469: PORT MELBOURNE | C469: 2 | D469: 4 | E469: =C469*6+D469 -> 16 | G469: 4 | H469: 6 | I469: =G469*6+H469 -> 30 | K469: 10 | L469: 7 | M469: =K469*6+L469 -> 67 | O469: 12 | P469: 10 | Q469: =O469*6+P469 -> 82 | S469: CROXTON PK
A470: NORTHCOTE | C470: 1 | D470: 2 | E470: =C470*6+D470 -> 8 | G470: 2 | H470: 7 | I470: =G470*6+H470 -> 19 | K470: 4 | L470: 11 | M470: =K470*6+L470 -> 35 | O470: 6 | P470: 13 | Q470: =O470*6+P470 -> 49 | S470: McMURRAY
A471: BEST PLAYERS
A472: PORT MELBOURNE | D472: MERRICK | G472: WALTON | J472: FRANKLIN | M472: SAMSON | O472: BARFOOT | R472: CARDEN
A473: NORTHCOTE | D473: COLE | G473: JOHNSON | J473: BECK | M473: H THOMAS | O473: GOODALL | R473: RAHILLY
A474: GOALKICKERS
A475: PORT MELBOURNE | D475: MERRICK 8 | G475: McCONVILLE | J475: CARDEN | L475: MENZIES | O475: WALTON
A476: NORTHCOTE | D476: NOBLE 2 | G476: BILLETT 2 | J476: RAHILLY | L476: JACKSON
A478: ROUND 11 | E478: 13TH JUNE | J478: WEATHER | M478: NORTH WEST WIND | S478: PLAYED AT | X478: LADDER | AB478: ROUND | AD478: 11
D479: 1ST QTR | H479: 2ND QTR | L479: 3RD QTR | P479: FINAL | S479: NORTH MELB
A480: NORTH MELBOURNE | C480: 3 | D480: 3 | E480: =C480*6+D480 -> 21 | G480: 3 | H480: 5 | I480: =G480*6+H480 -> 23 | K480: 6 | L480: 8 | M480: =K480*6+L480 -> 44 | O480: 8 | P480: 10 | Q480: =O480*6+P480 -> 58 | S480: UMPIRE | W480: TEAM | X480: W | Y480: L | Z480: D | AA480: FOR | AB480: AGST | AC480: % | AD480: PTS
A481: ESSENDON ASSOC. | C481: 1 | D481: 1 | E481: =C481*6+D481 -> 7 | G481: 3 | H481: 4 | I481: =G481*6+H481 -> 22 | K481: 3 | L481: 4 | M481: =K481*6+L481 -> 22 | O481: 5 | P481: 6 | Q481: =O481*6+P481 -> 36 | S481: PORTEOUS
A482: BEST PLAYERS | W482: NORTH MELBOURNE | X482: 8 | Y482: 3 | Z482: 0 | AA482: 848 | AB482: 546 | AC482: 155.31 | AD482: 32
A483: NORTH MELBOURNE | D483: CORNELL | G483: RAWLE | J483: T JONES | M483: HARDY | O483: SHEEHAN | R483: CARPENTER | W483: FOOTSCRAY | X483: 8 | Y483: 3 | Z483: 0 | AA483: 691 | AB483: 546 | AC483: 126.55677655677655 | AD483: 32
A484: ESSENDON ASSOC. | D484: WALKER | G484: M MADDEN | J484: GIBSON | M484: HOARE | O484: ATKINS | R484: DIGGLE | W484: BRUNSWICK | X484: 6 | Y484: 4 | Z484: 1 | AA484: 818 | AB484: 664 | AC484: 123.19 | AD484: 26
A485: GOALKICKERS | W485: ESSENDON ASSOC. | X485: 6 | Y485: 5 | Z485: 0 | AA485: 770 | AB485: 619 | AC485: 124.39418416801293 | AD485: 24
A486: NORTH MELBOURNE | D486: HARDY 2 | G486: MORAN 2 | J486: CARPENTER | M486: MILES | O486: McQUEEN | R486: RAWLE
A487: ESSENDON ASSOC. | D487: CLARKE 3 | G487: DIGGLE 2 | W487: WILLIAMSTOWN | X487: 6 | Y487: 5 | Z487: 0 | AA487: 671 | AB487: 565 | AC487: 118.76106194690266 | AD487: 24
W488: PRAHRAN | X488: 5 | Y488: 4 | Z488: 2 | AA488: 683 | AB488: 684 | AC488: 99.853801169590639 | AD488: 24
A489: FOOTSCRAY | C489: 2 | D489: 5 | E489: =C489*6+D489 -> 17 | G489: 5 | H489: 5 | I489: =G489*6+H489 -> 35 | K489: 9 | L489: 7 | M489: =K489*6+L489 -> 61 | O489: 10 | P489: 11 | Q489: =O489*6+P489 -> 71 | S489: PORT MELB | W489: PORT MELBOURNE | X489: 6 | Y489: 5 | Z489: 0 | AA489: 714 | AB489: 719 | AC489: 99.304589707927676 | AD489: 24
A490: PORT MELBOURNE | C490: 2 | D490: 1 | E490: =C490*6+D490 -> 13 | G490: 4 | H490: 5 | I490: =G490*6+H490 -> 29 | K490: 6 | L490: 6 | M490: =K490*6+L490 -> 42 | O490: 7 | P490: 7 | Q490: =O490*6+P490 -> 49 | S490: McMURRAY | W490: BRIGHTON | X490: 6 | Y490: 5 | Z490: 0 | AA490: 631 | AB490: 644 | AC490: 97.981366459627324 | AD490: 24
A491: BEST PLAYERS | W491: HAWTHORN | X491: 1 | Y491: 9 | Z491: 1 | AA491: 685 | AB491: 1037 | AC491: 66.055930568948895 | AD491: 6
A492: FOOTSCRAY | D492: BANBURY | G492: COTTON | I492: FORD | K492: GRIMSHAW | N492: GRIERSON | Q492: CLARK | W492: NORTHCOTE | X492: 1 | Y492: 10 | Z492: 0 | AA492: 440 | AB492: 927 | AC492: 47.464940668824163 | AD492: 4
A493: PORT MELBOURNE | D493: MERRICK | G493: FRANKLIN | I493: QUINN | K493: BRUCE | N493: MACKIE | Q493: CLELAND
A494: GOALKICKERS
A495: FOOTSCRAY | D495: DODEMAIDE 3 | G495: BANBURY 2 | J495: BAXTER 2 | M495: SPENCE | O495: FORD | Q495: GRIERSON
A496: PORT MELBOURNE | D496: MERRICK 4 | G496: BAILEY | J496: McCONVILLE | M496: MENZIES
A498: BRIGHTON | C498: 2 | D498: 0 | E498: =C498*6+D498 -> 12 | G498: 3 | H498: 3 | I498: =G498*6+H498 -> 21 | K498: 6 | L498: 3 | M498: =K498*6+L498 -> 39 | O498: 9 | P498: 8 | Q498: =O498*6+P498 -> 62 | S498: BRUNSWICK
A499: BRUNSWICK | C499: 2 | D499: 2 | E499: =C499*6+D499 -> 14 | G499: 3 | H499: 4 | I499: =G499*6+H499 -> 22 | K499: 5 | L499: 5 | M499: =K499*6+L499 -> 35 | O499: 6 | P499: 9 | Q499: =O499*6+P499 -> 45 | S499: F PRITCHARD
A500: BEST PLAYERS
A501: BRIGHTON | D501: BAYLISS | G501: PATTERSON | J501: B BAILES | M501: TEESE | P501: NEGRO | R501: ESPIE
A502: BRUNSWICK | D502: McKAY | G502: GEORGE | J502: STEVENSON | M502: CHANDLER | P502: McKENZIE | R502: PRICE
A503: GOALKICKERS
A504: BRIGHTON | D504: BAYLISS 5 | G504: TEESE 2 | J504: DOOLAN | M504: B BAILES
A505: BRUNSWICK | D505: STEVENSON 3 | H505: TOPHAM 2 | K505: HARKER
A507: HAWTHORN | C507: 2 | D507: 3 | E507: =C507*6+D507 -> 15 | G507: 5 | H507: 5 | I507: =G507*6+H507 -> 35 | K507: 7 | L507: 11 | M507: =K507*6+L507 -> 53 | O507: 9 | P507: 14 | Q507: =O507*6+P507 -> 68 | S507: HAW
A508: PRAHRAN | C508: 3 | D508: 3 | E508: =C508*6+D508 -> 21 | G508: 6 | H508: 6 | I508: =G508*6+H508 -> 42 | K508: 8 | L508: 9 | M508: =K508*6+L508 -> 57 | O508: 9 | P508: 14 | Q508: =O508*6+P508 -> 68 | S508: HURLEY
A509: BEST PLAYERS
A510: HAWTHORN | D510: LARKIN | G510: ANTONIO | J510: McCONVILLE | M510: BECKMAN | P510: WILKINSON | S510: BRADY
A511: PRAHRAN | D511: JONES | G511: MARONEY | J511: WOODS | M511: DOWSING | P511: KERR | S511: TURNER
A512: GOALKICKERS
A513: HAWTHORN | D513: WILKINSON 4 | H513: BECKMAN 3 | K513: FEWSTER | N513: SCHAEFER
A514: PRAHRAN | D514: KERR 2 | F514: WOODS 2 | I514: WEIDNER | K514: TURNER | M514: HOLMES | O514: WOODHEAD | R514: JONES
A516: WILLIAMSTOWN | C516: 2 | D516: 0 | E516: =C516*6+D516 -> 12 | G516: 3 | H516: 8 | I516: =G516*6+H516 -> 26 | K516: 5 | L516: 10 | M516: =K516*6+L516 -> 40 | O516: 6 | P516: 18 | Q516: =O516*6+P516 -> 54 | S516: WILLIAMSTOWN
A517: NORTHCOTE | C517: 1 | D517: 5 | E517: =C517*6+D517 -> 11 | G517: 3 | H517: 5 | I517: =G517*6+H517 -> 23 | K517: 5 | L517: 5 | M517: =K517*6+L517 -> 35 | O517: 6 | P517: 6 | Q517: =O517*6+P517 -> 42 | S517: KENDALL
A518: BEST PLAYERS
A519: WILLIAMSTOWN | D519: McLEAN | G519: O'HALLORAN | J519: AMY | L519: McTAGGART | O519: GIBBS | Q519: MITCHELL
A520: NORTHCOTE | D520: H THOMAS | G520: BASSETT | J520: COLE | L520: BECK | O520: S HALL | Q520: JOHNSON
A521: GOALKICKERS
A522: WILLIAMSTOWN | D522: ELLIOTT 2 | G522: AMY 2 | J522: McTAGGART | M522: GIBBS
A523: NORTHCOTE | D523: JOHNSON 2 | G523: GOODALL 2 | K523: TEESDALE
A525: ROUND 12 | E525: 20TH JUNE | J525: WEATHER | M525: FINE | S525: PLAYED AT | X525: LADDER | AB525: ROUND | AD525: 12
D526: 1ST QTR | H526: 2ND QTR | L526: 3RD QTR | P526: FINAL | S526: NORTH MELB
A527: NORTH MELBOURNE | C527: 2 | D527: 2 | E527: =C527*6+D527 -> 14 | G527: 3 | H527: 2 | I527: =G527*6+H527 -> 20 | K527: 5 | L527: 3 | M527: =K527*6+L527 -> 33 | O527: 10 | P527: 8 | Q527: =O527*6+P527 -> 68 | S527: UMPIRE | W527: TEAM | X527: W | Y527: L | Z527: D | AA527: FOR | AB527: AGST | AC527: % | AD527: PTS
A528: BRUNSWICK | C528: 1 | D528: 4 | E528: =C528*6+D528 -> 10 | G528: 5 | H528: 6 | I528: =G528*6+H528 -> 36 | K528: 7 | L528: 7 | M528: =K528*6+L528 -> 49 | O528: 8 | P528: 8 | Q528: =O528*6+P528 -> 56 | S528: McMURAY
A529: BEST PLAYERS | W529: NORTH MELBOURNE | X529: 9 | Y529: 3 | Z529: 0 | AA529: 916 | AB529: 602 | AC529: 152.16 | AD529: 36
A530: NORTH MELBOURNE | D530: CARPENTER | G530: WOODINGTON | J530: CORNALL | M530: BARKER | P530: RAWLE | R530: MILES | W530: FOOTSCRAY | X530: 9 | Y530: 3 | Z530: 0 | AA530: 777 | AB530: 578 | AC530: 134.42906574394465 | AD530: 36
A531: BRUNSWICK | D531: CHANDLER | G531: McLEOD | J531: ROSS | M531: PRICE | P531: McKAY | R531: SULLIVAN | W531: WILLIAMSTOWN | X531: 7 | Y531: 5 | Z531: 0 | AA531: 741 | AB531: 625 | AC531: 118.56 | AD531: 28
A532: GOALKICKERS | W532: PRAHRAN | X532: 6 | Y532: 4 | Z532: 2 | AA532: 794 | AB532: 727 | AC532: 109.21595598349381 | AD532: 28
A533: NORTH MELBOURNE | D533: MORAN 3 | G533: W JONES 2 | J533: MILES 2 | M533: FRANKS 2 | P533: McQUEEN
A534: BRUNSWICK | D534: CHASE 2 | F534: CHANDLER | I534: PRICE | K534: HARKER | M534: SULLIVAN | O534: STEVENSON | R534: TOPHAM | W534: BRUNSWICK | X534: 6 | Y534: 5 | Z534: 1 | AA534: 874 | AB534: 732 | AC534: 119.4 | AD534: 26
W535: ESSENDON ASSOC. | X535: 6 | Y535: 6 | Z535: 0 | AA535: 830 | AB535: 689 | AC535: 120.4644412191582 | AD535: 24
A536: WILLIAMSTOWN | C536: 3 | D536: 0 | E536: =C536*6+D536 -> 18 | G536: 3 | H536: 4 | I536: =G536*6+H536 -> 22 | K536: 5 | L536: 6 | M536: =K536*6+L536 -> 36 | O536: 10 | P536: 10 | Q536: =O536*6+P536 -> 70 | S536: ESSENDON | W536: PORT MELBOURNE | X536: 6 | Y536: 6 | Z536: 0 | AA536: 789 | AB536: 808 | AC536: 97.648514851485146 | AD536: 24
A537: ESSENDON ASSOC. | C537: 2 | D537: 1 | E537: =C537*6+D537 -> 13 | G537: 4 | H537: 1 | I537: =G537*6+H537 -> 25 | K537: 8 | L537: 4 | M537: =K537*6+L537 -> 52 | O537: 9 | P537: 6 | Q537: =O537*6+P537 -> 60 | S537: HURLEY | W537: BRIGHTON | X537: 6 | Y537: 6 | Z537: 0 | AA537: 663 | AB537: 730 | AC537: 90.821917808219183 | AD537: 24
A538: BEST PLAYERS | W538: HAWTHORN | X538: 2 | Y538: 9 | Z538: 1 | AA538: 774 | AB538: 1112 | AC538: 69.60431654676259 | AD538: 10
A539: WILLIAMSTOWN | D539: REITMAN | G539: WALLIS | J539: GIBBS | M539: ELLIOTT | P539: AMY | R539: GRANT | W539: NORTHCOTE | X539: 1 | Y539: 11 | Z539: 0 | AA539: 483 | AB539: 1038 | AC539: 46.531791907514453 | AD539: 4
A540: ESSENDON ASSOC. | D540: PAIN | G540: M MADDEN | J540: ARMSTRONG | M540: SEVIOR | P540: HOARE | R540: FINCHER
A541: GOALKICKERS
A542: WILLIAMSTOWN | D542: ELLIOTT 4 | G542: MITCHELL 2 | K542: WALLIS 2 | N542: AMY | P542: GRANT
A543: ESSENDON ASSOC. | D543: ARMSTRONG 2 | G543: EBBOTT 2 | J543: CLARKE 2 | M543: FINCHER | O543: SEVIOR | Q543: HOARE
A545: HAWTHORN | C545: 4 | D545: 6 | E545: =C545*6+D545 -> 30 | G545: 7 | H545: 7 | I545: =G545*6+H545 -> 49 | K545: 11 | L545: 10 | M545: =K545*6+L545 -> 76 | O545: 13 | P545: 11 | Q545: =O545*6+P545 -> 89 | S545: HAW
A546: PORT MELBOURNE | C546: 2 | D546: 1 | E546: =C546*6+D546 -> 13 | G546: 6 | H546: 7 | I546: =G546*6+H546 -> 43 | K546: 9 | L546: 16 | M546: =K546*6+L546 -> 70 | O546: 9 | P546: 21 | Q546: =O546*6+P546 -> 75 | S546: C PRITCHARD
A547: BEST PLAYERS
A548: HAWTHORN | D548: GIBB | G548: FEWSTER | J548: McONVILLE | M548: ANTONIE | P548: PICKFORD | S548: CLOWE
A549: PORT MELBOURNE | D549: MERRICK | G549: WALTON | J549: CLELAND | M549: BARFOOT | P549: McCONVILLE | S549: SAMSON
A550: GOALKICKERS
A551: HAWTHORN | D551: GIBB 4 | G551: FEWSTER 4 | J551: WILKINSON 3 | N551: BECKMAN 2
A552: PORT MELBOURNE | D552: WALTON 4 | G552: QUINN 2 | J552: RYAN 2 | M552: McCONVILLE
A554: PRAHRAN | C554: 2 | D554: 1 | E554: =C554*6+D554 -> 13 | G554: 10 | H554: 3 | I554: =G554*6+H554 -> 63 | K554: 13 | L554: 7 | M554: =K554*6+L554 -> 85 | O554: 17 | P554: 9 | Q554: =O554*6+P554 -> 111 | S554: TOORAK PARK
A555: NORTHCOTE | C555: 0 | D555: 4 | E555: =C555*6+D555 -> 4 | G555: 2 | H555: 5 | I555: =G555*6+H555 -> 17 | K555: 3 | L555: 7 | M555: =K555*6+L555 -> 25 | O555: 5 | P555: 13 | Q555: =O555*6+P555 -> 43 | S555: DWYER
A556: BEST PLAYERS
A557: PRAHRAN | D557: WOODS | G557: MARONEY | J557: KERR | M557: WEIDNER | P557: ELLIN | S557: KENT
A558: NORTHCOTE | D558: BECK | G558: COLE | J558: TEESDALE | M558: GOODALL | P558: RAHILLY | S558: MOORE
A559: GOALKICKERS
A560: PRAHRAN | D560: WOODS 7 | G560: JONES 2 | I560: WEIDNER 2 | L560: FARMER | N560: MARONEY | Q560: WOODFORD | T560: KERR | V560: WEIDNER | X560: HOLMES
A561: NORTHCOTE | D561: GOODALL 3 | G561: JOHNSON | J561: RAHILLY
A563: FOOTSCRAY | C563: 6 | D563: 5 | E563: =C563*6+D563 -> 41 | G563: 6 | H563: 6 | I563: =G563*6+H563 -> 42 | K563: 8 | L563: 12 | M563: =K563*6+L563 -> 60 | O563: 12 | P563: 14 | Q563: =O563*6+P563 -> 86 | S563: BRIGHTON BEACH
A564: BRIGHTON | C564: 2 | D564: 2 | E564: =C564*6+D564 -> 14 | G564: 4 | H564: 7 | I564: =G564*6+H564 -> 31 | K564: 4 | L564: 7 | M564: =K564*6+L564 -> 31 | O564: 4 | P564: 8 | Q564: =O564*6+P564 -> 32 | S564: KENDALL
A565: BEST PLAYERS
A566: FOOTSCRAY | D566: GRIMSHAW | H566: BANBURY | K566: BAXTER | N566: SPENCE | Q566: COTTON | T566: SAMSON
A567: BRIGHTON | D567: PATTERSON | H567: KNIGHTON | K567: NEGRO | N567: B BAILES | Q567: WILSON | T567: TAYLOR
A568: GOALKICKERS
A569: FOOTSCRAY | D569: BANBURY 3 | G569: CROUCH 2 | J569: BAXTER 2 | M569: PAYNE 2 | P569: DODEMAIDE | S569: SAMSON | V569: SPENCE
A570: BRIGHTON | D570: BAYLISS 2 | G570: DOOLAN | J570: GRAHAM
A572: ROUND 13 | E572: 27TH JUNE | J572: WEATHER | M572: FINE | S572: PLAYED AT | X572: LADDER | AB572: ROUND | AD572: 13
D573: 1ST QTR | H573: 2ND QTR | L573: 3RD QTR | P573: FINAL | S573: NORTH MELB
A574: NORTH MELBOURNE | C574: 1 | D574: 2 | E574: =C574*6+D574 -> 8 | G574: 3 | H574: 4 | I574: =G574*6+H574 -> 22 | K574: 5 | L574: 6 | M574: =K574*6+L574 -> 36 | O574: 6 | P574: 10 | Q574: =O574*6+P574 -> 46 | S574: UMPIRE | W574: TEAM | X574: W | Y574: L | Z574: D | AA574: FOR | AB574: AGST | AC574: % | AD574: PTS
A575: PRAHRAN | C575: 1 | D575: 1 | E575: =C575*6+D575 -> 7 | G575: 3 | H575: 2 | I575: =G575*6+H575 -> 20 | K575: 4 | L575: 4 | M575: =K575*6+L575 -> 28 | O575: 5 | P575: 5 | Q575: =O575*6+P575 -> 35
A576: BEST PLAYERS | W576: NORTH MELBOURNE | X576: 10 | Y576: 3 | Z576: 0 | AA576: 962 | AB576: 637 | AC576: 151.02 | AD576: 40
A577: NORTH MELBOURNE | D577: BARKER | G577: HARDY | I577: RAWLE | L577: FRANKS | N577: WOODINGTON | Q577: CORNALL | W577: FOOTSCRAY | X577: 10 | Y577: 3 | Z577: 0 | AA577: 891 | AB577: 643 | AC577: 138.56920684292379 | AD577: 40
A578: PRAHRAN | D578: RYAN | G578: JONES | I578: MORONEY | L578: KERR | N578: WEIDNER | Q578: DOWSING | W578: WILLIAMSTOWN | X578: 8 | Y578: 5 | Z578: 0 | AA578: 818 | AB578: 686 | AC578: 119.24198250728863 | AD578: 32
A579: GOALKICKERS | W579: BRUNSWICK | X579: 7 | Y579: 5 | Z579: 1 | AA579: 933 | AB579: 784 | AC579: 119.01 | AD579: 30
A580: NORTH MELBOURNE | D580: SMITH 2 | G580: MORAN 2 | J580: MILES 2
A581: PRAHRAN | D581: JONES 2 | G581: TURNER 2 | J581: CARLSON | W581: ESSENDON ASSOC. | X581: 7 | Y581: 6 | Z581: 0 | AA581: 889 | AB581: 742 | AC581: 119.81132075471699 | AD581: 28
W582: PRAHRAN | X582: 6 | Y582: 5 | Z582: 2 | AA582: 829 | AB582: 773 | AC582: 107.24450194049159 | AD582: 28
A583: WILLIAMSTOWN | C583: 3 | D583: 1 | E583: =C583*6+D583 -> 19 | G583: 5 | H583: 2 | I583: =G583*6+H583 -> 32 | K583: 9 | L583: 5 | M583: =K583*6+L583 -> 59 | O583: 12 | P583: 5 | Q583: =O583*6+P583 -> 77 | S583: PORT MELB | W583: PORT MELBOURNE | X583: 6 | Y583: 7 | Z583: 0 | AA583: 850 | AB583: 885 | AC583: 96.045197740112997 | AD583: 24
A584: PORT MELBOURNE | C584: 1 | D584: 1 | E584: =C584*6+D584 -> 7 | G584: 7 | H584: 3 | I584: =G584*6+H584 -> 45 | K584: 7 | L584: 4 | M584: =K584*6+L584 -> 46 | O584: 9 | P584: 7 | Q584: =O584*6+P584 -> 61 | W584: BRIGHTON | X584: 6 | Y584: 7 | Z584: 0 | AA584: 716 | AB584: 789 | AC584: 90.747782002534848 | AD584: 24
A585: BEST PLAYERS | W585: HAWTHORN | X585: 2 | Y585: 10 | Z585: 1 | AA585: 839 | AB585: 1226 | AC585: 68.433931484502452 | AD585: 10
A586: WILLIAMSTOWN | D586: McDONALD | G586: JONES | I586: AMY | K586: McTAGGART | N586: E BUSBRIDGE | Q586: MITCHELL | W586: NORTHCOTE | X586: 1 | Y586: 12 | Z586: 0 | AA586: 535 | AB586: 1097 | AC586: 48.769371011850502 | AD586: 4
A587: PORT MELBOURNE | D587: BARFOOT | G587: MERRICK | I587: CLELAND | K587: QUINN | N587: FRANKLIN | Q587: McCONVILLE
A588: GOALKICKERS
A589: WILLIAMSTOWN | D589: ELLIOTT 5 | G589: AMY 3 | J589: GIBBS 2 | M589: McTAGGART | P589: N BUSBRIDGE
A590: PORT MELBOURNE | D590: WALTON 3 | G590: BARFOOT 3 | K590: MERRICK 2 | N590: McCONVILLE
A592: ESSENDON ASSOC. | C592: 2 | D592: 11 | E592: =C592*6+D592 -> 23 | G592: 3 | H592: 13 | I592: =G592*6+H592 -> 31 | K592: 5 | L592: 20 | M592: =K592*6+L592 -> 50 | O592: 6 | P592: 23 | Q592: =O592*6+P592 -> 59 | S592: BRIGHTON BEACH
A593: BRIGHTON | C593: 1 | D593: 0 | E593: =C593*6+D593 -> 6 | G593: 6 | H593: 3 | I593: =G593*6+H593 -> 39 | K593: 7 | L593: 5 | M593: =K593*6+L593 -> 47 | O593: 7 | P593: 11 | Q593: =O593*6+P593 -> 53
A594: BEST PLAYERS
A595: ESSENDON ASSOC. | D595: SEVIOR | G595: ATKINS | J595: WALKER | M595: EBBOTT | O595: STROWNIX | S595: DIGGLE
A596: BRIGHTON | D596: PHILLIPS | G596: KNIGHTON | J596: WALLACE | M596: SLATER | O596: PATTERSON | S596: COMER
A597: GOALKICKERS
A598: ESSENDON ASSOC. | D598: EBBOTT 5 | G598: DIGGLE
A599: BRIGHTON | D599: BAYLISS 3 | G599: DAWSON | J599: PHILLIPS | M599: COMER | O599: GRAHAM
A601: FOOTSCRAY | C601: 2 | D601: 2 | E601: =C601*6+D601 -> 14 | G601: 6 | H601: 12 | I601: =G601*6+H601 -> 48 | K601: 11 | L601: 14 | M601: =K601*6+L601 -> 80 | O601: 16 | P601: 18 | Q601: =O601*6+P601 -> 114 | S601: FOOTSCRAY
A602: HAWTHORN | C602: 2 | D602: 3 | E602: =C602*6+D602 -> 15 | G602: 3 | H602: 3 | I602: =G602*6+H602 -> 21 | K602: 7 | L602: 5 | M602: =K602*6+L602 -> 47 | O602: 10 | P602: 5 | Q602: =O602*6+P602 -> 65
A603: BEST PLAYERS
A604: FOOTSCRAY | D604: DODEMAIDE | G604: NEILSON | J604: CLARK | M604: BANBURY | P604: GRIMSHAW | S604: BAXTER
A605: HAWTHORN | D605: WILKINSON | G605: FEWSTER | J605: McCONVILLE | M605: HANNA | P605: ANTONIE | S605: GOUGH
A606: GOALKICKERS
A607: FOOTSCRAY | D607: DODEMAIDE 7 | G607: COTTON 2 | J607: GRIERSON 2 | M607: SAMSON 2 | P607: CROUCH | R607: GREGORY | U607: PAYNE
A608: HAWTHORN | D608: WILKINSON 5 | G608: FEWSTER 2 | J608: CORNELL | L608: SCHAEFER | O608: BECKMAN
A610: BRUNSWICK | C610: 2 | D610: 5 | E610: =C610*6+D610 -> 17 | G610: 2 | H610: 6 | I610: =G610*6+H610 -> 18 | K610: 5 | L610: 8 | M610: =K610*6+L610 -> 38 | O610: 8 | P610: 11 | Q610: =O610*6+P610 -> 59 | S610: BRUNSWICK
A611: NORTHCOTE | C611: 1 | D611: 3 | E611: =C611*6+D611 -> 9 | G611: 1 | H611: 9 | I611: =G611*6+H611 -> 15 | K611: 3 | L611: 13 | M611: =K611*6+L611 -> 31 | O611: 6 | P611: 16 | Q611: =O611*6+P611 -> 52
A612: BEST PLAYERS
A613: BRUNSWICK | D613: A SWIFT | G613: G SWIFT | J613: ROSS | M613: SULLIVAN | P613: HARKER | S613: CHASE
A614: NORTHCOTE | D614: COLE | G614: TEESDALE | J614: BASSETT | M614: MOORE | P614: JOHNSON | S614: H THOMAS
A615: GOALKICKERS
A616: BRUNSWICK | D616: TOPHAM 3 | G616: HARKER 2 | J616: STEVENSON 2 | N616: CHANDLER
A617: NORTHCOTE | D617: GOODALL 2 | G617: SUARES 2 | J617: HALL | L617: RAHILLY
A619: ROUND 14 | E619: 4TH JULY | J619: WEATHER | M619: SOUTH BREEZE | S619: PLAYED AT | X619: LADDER | AB619: ROUND | AD619: 14
D620: 1ST QTR | H620: 2ND QTR | L620: 3RD QTR | P620: FINAL | S620: WILLIAMSTOWN
A621: WILLIAMSTOWN | C621: 1 | D621: 2 | E621: =C621*6+D621 -> 8 | G621: 4 | H621: 2 | I621: =G621*6+H621 -> 26 | K621: 6 | L621: 2 | M621: =K621*6+L621 -> 38 | O621: 9 | P621: 4 | Q621: =O621*6+P621 -> 58 | S621: UMPIRE | W621: TEAM | X621: W | Y621: L | Z621: D | AA621: FOR | AB621: AGST | AC621: % | AD621: PTS
A622: BRUNSWICK | C622: 0 | D622: 3 | E622: =C622*6+D622 -> 3 | G622: 2 | H622: 4 | I622: =G622*6+H622 -> 16 | K622: 6 | L622: 4 | M622: =K622*6+L622 -> 40 | O622: 6 | P622: 4 | Q622: =O622*6+P622 -> 40 | S622: HURLEY
A623: BEST PLAYERS | W623: NORTH MELBOURNE | X623: 11 | Y623: 3 | Z623: 0 | AA623: 1056 | AB623: 695 | AC623: 151.94 | AD623: 44
A624: WILLIAMSTOWN | D624: McDONALD | G624: GIBBS | I624: JONES | L624: AMY | N624: MITCHELL | Q624: N BUSBRIDGE | W624: FOOTSCRAY | X624: 10 | Y624: 4 | Z624: 0 | AA624: 930 | AB624: 707 | AC624: 131.54172560113153 | AD624: 40
A625: BRUNSWICK | D625: BRAID | G625: GEORGE | I625: CLOWE | L625: McKAY | N625: ROSS | Q625: McLEOD | W625: WILLIAMSTOWN | X625: 9 | Y625: 5 | Z625: 0 | AA625: 876 | AB625: 726 | AC625: 120.66115702479338 | AD625: 36
A626: GOALKICKERS | W626: ESSENDON ASSOC. | X626: 8 | Y626: 6 | Z626: 0 | AA626: 953 | AB626: 781 | AC626: 122.02304737516005 | AD626: 32
A627: WILLIAMSTOWN | D627: ELLIOTT 3 | G627: SCOTT 2 | I627: AMY | K627: HARRISON | N627: N BUSBRIDGE | Q627: GIBBS
A628: BRUNSWICK | D628: McKAY | G628: A SWIFT | J628: DUGGAN | L628: TOPHAM | N628: STEVENSON | Q628: CHASE | W628: BRUNSWICK | X628: 7 | Y628: 6 | Z628: 1 | AA628: 973 | AB628: 842 | AC628: 115.56 | AD628: 30
W629: PRAHRAN | X629: 6 | Y629: 6 | Z629: 2 | AA629: 904 | AB629: 849 | AC629: 106.47820965842168 | AD629: 28
A630: ESSENDON ASSOC. | C630: 3 | D630: 3 | E630: =C630*6+D630 -> 21 | G630: 4 | H630: 5 | I630: =G630*6+H630 -> 29 | K630: 6 | L630: 8 | M630: =K630*6+L630 -> 44 | O630: 9 | P630: 10 | Q630: =O630*6+P630 -> 64 | S630: ESSENDON | W630: PORT MELBOURNE | X630: 7 | Y630: 7 | Z630: 0 | AA630: 926 | AB630: 960 | AC630: 96.458333333333329 | AD630: 28
A631: FOOTSCRAY | C631: 2 | D631: 2 | E631: =C631*6+D631 -> 14 | G631: 4 | H631: 4 | I631: =G631*6+H631 -> 28 | K631: 5 | L631: 5 | M631: =K631*6+L631 -> 35 | O631: 5 | P631: 9 | Q631: =O631*6+P631 -> 39 | S631: McMURRAY | W631: BRIGHTON | X631: 7 | Y631: 7 | Z631: 0 | AA631: 796 | AB631: 829 | AC631: 96.01930036188179 | AD631: 28
A632: BEST PLAYERS | W632: HAWTHORN | X632: 2 | Y632: 11 | Z632: 1 | AA632: 879 | AB632: 1306 | AC632: 67.304747320061253 | AD632: 10
A633: ESSENDON ASSOC. | D633: M MADDEN | G633: BICKFORD | J633: WALKER | M633: PAIN | O633: SEVIOR | Q633: STROWNIX | W633: NORTHCOTE | X633: 1 | Y633: 13 | Z633: 0 | AA633: 593 | AB633: 1191 | AC633: 49.790092359361878 | AD633: 4
A634: FOOTSCRAY | D634: CRADDOCK | G634: PAYNE | J634: COTTON | M634: SAMSON | O634: CROUCH | Q634: NIELSON
A635: GOALKICKERS
A636: ESSENDON ASSOC. | D636: EBBOTT 2 | G636: ARMSTRONG | J636: SEVIOR | L636: HOARE | N636: J MADDEN | P636: ATKINS | R636: DIGGLE | T636: FINCHER
A637: FOOTSCRAY | D637: CROUCH 2 | G637: DODEMAIDE | J637: COTTON | L637: SAMSON
A639: PORT MELBOURNE | C639: 1 | D639: 0 | E639: =C639*6+D639 -> 6 | G639: 3 | H639: 4 | I639: =G639*6+H639 -> 22 | K639: 6 | L639: 8 | M639: =K639*6+L639 -> 44 | O639: 11 | P639: 10 | Q639: =O639*6+P639 -> 76 | S639: TOORAK PARK
A640: PRAHRAN | C640: 2 | D640: 1 | E640: =C640*6+D640 -> 13 | G640: 6 | H640: 4 | I640: =G640*6+H640 -> 40 | K640: 8 | L640: 9 | M640: =K640*6+L640 -> 57 | O640: 10 | P640: 15 | Q640: =O640*6+P640 -> 75 | S640: C PRITCHARD
A641: BEST PLAYERS
A642: PORT MELBOURNE | D642: MERRICK | G642: BARFOOT | J642: CLELAND | M642: WALTON | P642: QUINN | S642: DANKS
A643: PRAHRAN | D643: MORONEY | G643: WOODS | J643: WEIDNER | M643: CARLSON | P643: ELLIN | S643: DOWSING
A644: GOALKICKERS
A645: PORT MELBOURNE | D645: MERRICK 3 | G645: BARFOOT 2 | J645: DANKS 2 | M645: CLELAND | O645: WALTON | R645: GOTZ | T645: ANGWIN
A646: PRAHRAN | D646: WOODS 3 | G646: MORONEY 3 | J646: WEIDNER | M646: JONES | O646: DOWSING | R646: DUFTY
A648: BRIGHTON | C648: 4 | D648: 2 | E648: =C648*6+D648 -> 26 | G648: 7 | H648: 4 | I648: =G648*6+H648 -> 46 | K648: 10 | L648: 10 | M648: =K648*6+L648 -> 70 | O648: 11 | P648: 14 | Q648: =O648*6+P648 -> 80 | S648: HAW
A649: HAWTHORN | C649: 1 | D649: 2 | E649: =C649*6+D649 -> 8 | G649: 1 | H649: 5 | I649: =G649*6+H649 -> 11 | K649: 2 | L649: 5 | M649: =K649*6+L649 -> 17 | O649: 5 | P649: 10 | Q649: =O649*6+P649 -> 40 | S649: HERBERT
A650: BEST PLAYERS
A651: BRIGHTON | D651: WALLACE | G651: PHILLIPS | J651: DOWDING | M651: E BAILES | P651: TEESE | S651: BAYLISS
A652: HAWTHORN | D652: HOLLAND | G652: CHAPMAN | J652: McCONVILLE | M652: CORNALL | P652: STAGGALL | S652: C BRADY
A653: GOALKICKERS
A654: BRIGHTON | D654: DOWDING 3 | G654: GRAHAM 2 | J654: BAYLISS 2 | M654: B BAILES | O654: TEESE | Q654: PATTERSON | T654: PHILLIPS
A655: HAWTHORN | D655: C BRADY 2 | G655: FEWSTER 2
A657: NORTH MELBOURNE | C657: 2 | D657: 4 | E657: =C657*6+D657 -> 16 | G657: 4 | H657: 9 | I657: =G657*6+H657 -> 33 | K657: 9 | L657: 12 | M657: =K657*6+L657 -> 66 | O657: 13 | P657: 16 | Q657: =O657*6+P657 -> 94 | S657: CROXTON PK
A658: NORTHCOTE | C658: 2 | D658: 2 | E658: =C658*6+D658 -> 14 | G658: 4 | H658: 2 | I658: =G658*6+H658 -> 26 | K658: 6 | L658: 7 | M658: =K658*6+L658 -> 43 | O658: 8 | P658: 10 | Q658: =O658*6+P658 -> 58 | S658: KENDALL
A659: BEST PLAYERS
A660: NORTH MELBOURNE | D660: BARKER | G660: HARDY | J660: WOODINGTON | M660: SHEEHAN | P660: GARDINER | S660: MORAN
A661: NORTHCOTE | D661: COLE | G661: BECK | J661: GOODALL | M661: PANNAM | P661: RAHILLY | S661: MOORE
A662: GOALKICKERS
A663: NORTH MELBOURNE | D663: SHEEHAN 2 | G663: MORAN 2 | I663: GARDINER 2 | L663: M DODEMAIDE 2 | O663: BARKER | Q663: HARDY | S663: FRANKS | V663: CARPENTER | X663: SMITH
A664: NORTHCOTE | D664: GOODALL 2 | G664: PANNAM 2 | J664: JOHNSON | L664: RAHILLY | O664: HALL | Q664: COLE
A666: ROUND 15 | E666: 11TH JULY | J666: WEATHER | M666: NORTH WEST WIND | S666: PLAYED AT | X666: LADDER | AB666: ROUND | AD666: 15
D667: 1ST QTR | H667: 2ND QTR | L667: 3RD QTR | P667: FINAL | S667: FOOTSCRAY
A668: FOOTSCRAY | C668: 2 | D668: 4 | E668: =C668*6+D668 -> 16 | G668: 2 | H668: 5 | I668: =G668*6+H668 -> 17 | K668: 5 | L668: 10 | M668: =K668*6+L668 -> 40 | O668: 6 | P668: 11 | Q668: =O668*6+P668 -> 47 | S668: UMPIRE | W668: TEAM | X668: W | Y668: L | Z668: D | AA668: FOR | AB668: AGST | AC668: % | AD668: PTS
A669: WILLIAMSTOWN | C669: 0 | D669: 1 | E669: =C669*6+D669 -> 1 | G669: 1 | H669: 4 | I669: =G669*6+H669 -> 10 | K669: 2 | L669: 4 | M669: =K669*6+L669 -> 16 | O669: 4 | P669: 5 | Q669: =O669*6+P669 -> 29 | S669: F PRITCHARD
A670: BEST PLAYERS | W670: NORTH MELBOURNE | X670: 12 | Y670: 3 | Z670: 0 | AA670: 1170 | AB670: 737 | AC670: 158.75 | AD670: 48
A671: FOOTSCRAY | D671: GRIMSHAW | G671: SPENCE | I671: HARRIS | K671: COTTON | M671: CLARK | P671: NEILSON | W671: FOOTSCRAY | X671: 11 | Y671: 4 | Z671: 0 | AA671: 977 | AB671: 736 | AC671: 132.74456521739131 | AD671: 44
A672: WILLIAMSTOWN | D672: GIBBS | G672: MITCHELL | I672: AMY | K672: WALLIS | M672: McTAGGART | P672: N BUSBRIDGE | W672: ESSENDON ASSOC. | X672: 9 | Y672: 6 | Z672: 0 | AA672: 1051 | AB672: 826 | AC672: 127.23970944309927 | AD672: 36
A673: GOALKICKERS | W673: WILLIAMSTOWN | X673: 9 | Y673: 6 | Z673: 0 | AA673: 905 | AB673: 773 | AC673: 117.07632600258732 | AD673: 36
A674: FOOTSCRAY | D674: COTTON | F674: CAMPBELL | I674: SPENCE | K674: GRIMSHAW | N674: BANBURY | Q674: CROUCH
A675: WILLIAMSTOWN | D675: JONES | F675: O'HALLORAN | I675: GIBBS | K675: N BUSBRIDGE | W675: BRUNSWICK | X675: 8 | Y675: 6 | Z675: 1 | AA675: 1025 | AB675: 892 | AC675: 114.91 | AD675: 34
W676: PRAHRAN | X676: 7 | Y676: 6 | Z676: 2 | AA676: 945 | AB676: 889 | AC676: 106.2992125984252 | AD676: 32
A677: BRUNSWICK | C677: 0 | D677: 4 | E677: =C677*6+D677 -> 4 | G677: 2 | H677: 8 | I677: =G677*6+H677 -> 20 | K677: 3 | L677: 12 | M677: =K677*6+L677 -> 30 | O677: 6 | P677: 16 | Q677: =O677*6+P677 -> 52 | S677: PORT MELB | W677: PORT MELBOURNE | X677: 7 | Y677: 8 | Z677: 0 | AA677: 976 | AB677: 1012 | AC677: 96.442687747035578 | AD677: 28
A678: PORT MELBOURNE | C678: 3 | D678: 2 | E678: =C678*6+D678 -> 20 | G678: 4 | H678: 3 | I678: =G678*6+H678 -> 27 | K678: 5 | L678: 8 | M678: =K678*6+L678 -> 38 | O678: 7 | P678: 8 | Q678: =O678*6+P678 -> 50 | S678: PORTEOUS | W678: BRIGHTON | X678: 7 | Y678: 8 | Z678: 0 | AA678: 836 | AB678: 870 | AC678: 96.091954022988503 | AD678: 28
A679: BEST PLAYERS | W679: HAWTHORN | X679: 2 | Y679: 12 | Z679: 1 | AA679: 921 | AB679: 1420 | AC679: 64.859154929577471 | AD679: 10
A680: BRUNSWICK | D680: CHASE | G680: McLEOD | I680: BRAID | K680: ROSS | M680: GEORGE | P680: PRICE | W680: NORTHCOTE | X680: 1 | Y680: 14 | Z680: 0 | AA680: 638 | AB680: 1289 | AC680: 49.495733126454617 | AD680: 4
A681: PORT MELBOURNE | D681: FRANKLIN | G681: MERRICK | I681: ANGWIN | K681: QUINN | M681: WALTON | P681: HENDRIE
A682: GOALKICKERS
A683: BRUNSWICK | D683: CHANDLER 2 | G683: SULLIVAN | J683: BRAID | L683: CHASE | N683: HARKER
A684: PORT MELBOURNE | D684: RYAN 2 | G684: MERRICK | J684: BARFOOT | L684: QUINN | N684: ANGWIN | P684: WALTON
A686: PRAHRAN | C686: 2 | D686: 0 | E686: =C686*6+D686 -> 12 | G686: 3 | H686: 1 | I686: =G686*6+H686 -> 19 | K686: 4 | L686: 1 | M686: =K686*6+L686 -> 25 | O686: 6 | P686: 5 | Q686: =O686*6+P686 -> 41 | S686: BRIGHTON BEACH
A687: BRIGHTON | C687: 3 | D687: 2 | E687: =C687*6+D687 -> 20 | G687: 3 | H687: 4 | I687: =G687*6+H687 -> 22 | K687: 5 | L687: 9 | M687: =K687*6+L687 -> 39 | O687: 5 | P687: 10 | Q687: =O687*6+P687 -> 40 | S687: KENDALL
A688: BEST PLAYERS
A689: PRAHRAN | D689: KERR | G689: MORONEY | J689: WEIDNER | M689: WILSON | P689: CARLSON | S689: MAYNARD
A690: BRIGHTON | D690: B BAILES | G690: TEESE | J690: GRAHAM | M690: DOWDING | P690: BAYLISS | S690: TURNBULL
A691: GOALKICKERS
A692: PRAHRAN | D692: WEIDNER 2 | G692: WILSON 2 | J692: DOWSING | L692: DUFTY
A693: BRIGHTON | D693: DAWSON 2 | G693: TURNBULL | J693: BAYLISS | L693: DOOLAN
A695: ESSENDON ASSOC. | C695: 4 | D695: 5 | E695: =C695*6+D695 -> 29 | G695: 8 | H695: 11 | I695: =G695*6+H695 -> 59 | K695: 12 | L695: 12 | M695: =K695*6+L695 -> 84 | O695: 14 | P695: 14 | Q695: =O695*6+P695 -> 98 | S695: ESSENDON
A696: NORTHCOTE | C696: 2 | D696: 3 | E696: =C696*6+D696 -> 15 | G696: 3 | H696: 3 | I696: =G696*6+H696 -> 21 | K696: 4 | L696: 6 | M696: =K696*6+L696 -> 30 | O696: 6 | P696: 9 | Q696: =O696*6+P696 -> 45 | S696: HURLEY
A697: BEST PLAYERS
A698: ESSENDON ASSOC. | D698: M MADDEN | G698: EBBOTT | J698: J MADDEN | M698: HOARE | P698: SEVIOR | S698: ATKINS
A699: NORTHCOTE | D699: MOORE | G699: H THOMAS | J699: E THOMAS | M699: COLE | P699: HALL | S699: WILLIS
A700: GOALKICKERS
A701: ESSENDON ASSOC. | D701: EBBOTT 5 | G701: J MADDEN 3 | J701: SEVIOR 2 | M701: DIGGLE 2 | P701: GIBSON | R701: FINCHER
A702: NORTHCOTE | D702: E THOMAS 2 | G702: HALL | I702: PANNAM | K702: MOORE | M702: JACKSON
A704: NORTH MELBOURNE | C704: 2 | D704: 2 | E704: =C704*6+D704 -> 14 | G704: 6 | H704: 6 | I704: =G704*6+H704 -> 42 | K704: 10 | L704: 9 | M704: =K704*6+L704 -> 69 | O704: 17 | P704: 12 | Q704: =O704*6+P704 -> 114 | S704: NORTH MELB
A705: HAWTHORN | C705: 4 | D705: 1 | E705: =C705*6+D705 -> 25 | G705: 4 | H705: 3 | I705: =G705*6+H705 -> 27 | K705: 5 | L705: 5 | M705: =K705*6+L705 -> 35 | O705: 6 | P705: 6 | Q705: =O705*6+P705 -> 42 | S705: McMURRAY
A706: BEST PLAYERS
A707: NORTH MELBOURNE | D707: BARKER | G707: HARDY | J707: GARDINER | M707: CAVE | O707: FRANKS | R707: HOPKINS
A708: HAWTHORN | D708: LARKIN | G708: CROWE | J708: McCONVILLE | M708: HOLLAND | O708: GIBB | R708: GOUGH
A709: GOALKICKERS
A710: NORTH MELBOURNE | D710: BARKER 3 | G710: MILES 3 | I710: GARDINER 2 | L710: HOPKINS 2 | N710: SHEEHAN 2 | Q710: RAWLE 2 | S710: M DODEMAIDE 2
A711: HAWTHORN | D711: FEWSTER 2 | G711: BICKFORD | I711: C BRADY
A713: ROUND 16 | E713: 18TH JULY | J713: WEATHER | M713: NORTH WIND | S713: PLAYED AT | X713: LADDER | AB713: ROUND | AD713: 16
D714: 1ST QTR | H714: 2ND QTR | L714: 3RD QTR | P714: FINAL | S714: FOOTSCRAY
A715: FOOTSCRAY | C715: 1 | D715: 0 | E715: =C715*6+D715 -> 6 | G715: 3 | H715: 1 | I715: =G715*6+H715 -> 19 | K715: 4 | L715: 1 | M715: =K715*6+L715 -> 25 | O715: 5 | P715: 4 | Q715: =O715*6+P715 -> 34 | S715: UMPIRE | W715: TEAM | X715: W | Y715: L | Z715: D | AA715: FOR | AB715: AGST | AC715: % | AD715: PTS
A716: NORTH MELBOURNE | C716: 2 | D716: 5 | E716: =C716*6+D716 -> 17 | G716: 2 | H716: 6 | I716: =G716*6+H716 -> 18 | K716: 3 | L716: 7 | M716: =K716*6+L716 -> 25 | O716: 4 | P716: 8 | Q716: =O716*6+P716 -> 32 | S716: McMURRAY
A717: BEST PLAYERS | W717: NORTH MELBOURNE | X717: 12 | Y717: 4 | Z717: 0 | AA717: 1202 | AB717: 771 | AC717: 155.9 | AD717: 48
A718: FOOTSCRAY | D718: GRIMSHAW | G718: SAMSON | I718: ELDRIDGE | L718: BRIESE | O718: BANBURY | Q718: SPENCE | W718: FOOTSCRAY | X718: 12 | Y718: 4 | Z718: 0 | AA718: 1011 | AB718: 768 | AC718: 131.640625 | AD718: 48
A719: NORTH MELBOURNE | D719: WOODINGTON | G719: BARKER | I719: RAWLE | L719: GARDINER | O719: HOPKINS | Q719: CORNALL | W719: ESSENDON ASSOC. | X719: 10 | Y719: 6 | Z719: 0 | AA719: 1136 | AB719: 892 | AC719: 127.35426008968609 | AD719: 40
A720: GOALKICKERS | W720: WILLIAMSTOWN | X720: 10 | Y720: 6 | Z720: 0 | AA720: 984 | AB720: 837 | AC720: 117.56272401433692 | AD720: 40
A721: FOOTSCRAY | D721: PAYNE 2 | G721: SAMSON | J721: GREGORY | M721: COTTON
A722: NORTH MELBOURNE | D722: CARPENTER 2 | H722: CONDON | K722: FRANKS | W722: PRAHRAN | X722: 8 | Y722: 6 | Z722: 2 | AA722: 990 | AB722: 926 | AC722: 106.91144708423326 | AD722: 36
W723: BRUNSWICK | X723: 8 | Y723: 7 | Z723: 1 | AA723: 1062 | AB723: 937 | AC723: 113.34 | AD723: 34
A724: PRAHRAN | C724: 0 | D724: 2 | E724: =C724*6+D724 -> 2 | G724: 2 | H724: 7 | I724: =G724*6+H724 -> 19 | K724: 4 | L724: 7 | M724: =K724*6+L724 -> 31 | O724: 6 | P724: 9 | Q724: =O724*6+P724 -> 45 | S724: BRUNSWICK | W724: BRIGHTON | X724: 8 | Y724: 8 | Z724: 0 | AA724: 901 | AB724: 915 | AC724: 98.469945355191257 | AD724: 32
A725: BRUNSWICK | C725: 0 | D725: 3 | E725: =C725*6+D725 -> 3 | G725: 3 | H725: 5 | I725: =G725*6+H725 -> 23 | K725: 3 | L725: 14 | M725: =K725*6+L725 -> 32 | O725: 3 | P725: 19 | Q725: =O725*6+P725 -> 37 | S725: HURLEY | W725: PORT MELBOURNE | X725: 7 | Y725: 9 | Z725: 0 | AA725: 1042 | AB725: 1097 | AC725: 94.986326344576113 | AD725: 28
A726: BEST PLAYERS | W726: HAWTHORN | X726: 2 | Y726: 13 | Z726: 1 | AA726: 985 | AB726: 1499 | AC726: 65.710473649099399 | AD726: 10
A727: PRAHRAN | D727: MORONEY | G727: WEIDNER | I727: KERR | L727: CARLSON | O727: ELLIN | Q727: WILSON | W727: NORTHCOTE | X727: 1 | Y727: 15 | Z727: 0 | AA727: 683 | AB727: 1354 | AC727: 50.443131462333824 | AD727: 4
A728: BRUNSWICK | D728: McLEOD | G728: PRICE | I728: ROSS | L728: CHASE | O728: CLOWE | Q728: SULLIVAN
A729: GOALKICKERS
A730: PRAHRAN | D730: DUFTY 2 | G730: KERR | J730: CARLSON | M730: WOODS | O730: WOODHEAD
A731: BRUNSWICK | D731: PRICE 2 | G731: McKAY
A733: ESSENDON ASSOC. | C733: 3 | D733: 3 | E733: =C733*6+D733 -> 21 | G733: 4 | H733: 4 | I733: =G733*6+H733 -> 28 | K733: 10 | L733: 5 | M733: =K733*6+L733 -> 65 | O733: 13 | P733: 7 | Q733: =O733*6+P733 -> 85 | S733: PORT MELB
A734: PORT MELBOURNE | C734: 1 | D734: 1 | E734: =C734*6+D734 -> 7 | G734: 7 | H734: 4 | I734: =G734*6+H734 -> 46 | K734: 9 | L734: 5 | M734: =K734*6+L734 -> 59 | O734: 10 | P734: 6 | Q734: =O734*6+P734 -> 66 | S734: KENDALL
A735: BEST PLAYERS
A736: ESSENDON ASSOC. | D736: BICKFORD | G736: M MADDEN | J736: J MADDEN | M736: WALKER | P736: FINCHER | S736: HOARE
A737: PORT MELBOURNE | D737: FRANKLIN | G737: SAMSON | J737: WALTON | M737: HOWLETT | P737: HENDRIE | S737: CLELAND
A738: GOALKICKERS
A739: ESSENDON ASSOC. | D739: PAIN 4 | G739: CLARKE 3 | J739: SEVIOR 2 | M739: FINCHER 2 | P739: DIGGLE | R739: WALKER | U739: EBBOTT
A740: PORT MELBOURNE | D740: DEAS 5 | G740: ANGWIN | J740: McCONVILLE | M740: WALTON | O740: DANKS | Q740: QUINN
A742: BRIGHTON | C742: 1 | D742: 2 | E742: =C742*6+D742 -> 8 | G742: 2 | H742: 4 | I742: =G742*6+H742 -> 16 | K742: 7 | L742: 13 | M742: =K742*6+L742 -> 55 | O742: 8 | P742: 17 | Q742: =O742*6+P742 -> 65 | S742: CROXTON PK
A743: NORTHCOTE | C743: 1 | D743: 1 | E743: =C743*6+D743 -> 7 | G743: 4 | H743: 5 | I743: =G743*6+H743 -> 29 | K743: 5 | L743: 7 | M743: =K743*6+L743 -> 37 | O743: 6 | P743: 9 | Q743: =O743*6+P743 -> 45 | S743: PORTEOUS
A744: BEST PLAYERS
A745: BRIGHTON | D745: PHILLIPS | G745: BAYLISS | J745: NEGRO | M745: DOWDING | P745: KNIGHTON | S745: SLATER
A746: NORTHCOTE | D746: JOHNSON | G746: BECK | J746: MILLS | M746: COLE | P746: NOBLE | S746: WILLIS
A747: GOALKICKERS
A748: BRIGHTON | D748: DOWDING 2 | G748: BAYLISS 2 | J748: GRAHAM | L748: TURNBULL | O748: PHILLIPS | R748: DAWSON
A749: NORTHCOTE
A751: WILLIAMSTOWN | C751: 4 | D751: 1 | E751: =C751*6+D751 -> 25 | G751: 8 | H751: 3 | I751: =G751*6+H751 -> 51 | K751: 12 | L751: 6 | M751: =K751*6+L751 -> 78 | O751: 12 | P751: 7 | Q751: =O751*6+P751 -> 79 | S751: WILLIAMSTOWN
A752: HAWTHORN | C752: 2 | D752: 3 | E752: =C752*6+D752 -> 15 | G752: 3 | H752: 10 | I752: =G752*6+H752 -> 28 | K752: 4 | L752: 13 | M752: =K752*6+L752 -> 37 | O752: 8 | P752: 16 | Q752: =O752*6+P752 -> 64 | S752: HERBERT
A753: BEST PLAYERS
A754: WILLIAMSTOWN | D754: MITCHELL | G754: REITMAN | J754: ALLEY | L754: E BUSBRIDGE | P754: ELLIOTT | S754: McDONALD
A755: HAWTHORN | D755: McCONVILLE | G755: LARKIN | J755: GOUGH | L755: L BRADY | P755: FEWSTER | S755: HOLLAND
A756: GOALKICKERS
A757: WILLIAMSTOWN | D757: E BUSBRIDGE 2 | G757: N BUSBRIDGE 2 | J757: AMY 2 | L757: ELLIOTT 2 | N757: McTAGGART 2 | Q757: GIBBS 2 | S757: MITCHELL
A758: HAWTHORN | D758: WILKINSON 2 | H758: FEWSTER 2 | K758: BICKLAND | M758: CHAPMAN
A760: ROUND 17 | E760: 25TH JULY | J760: WEATHER | M760: NORTH BREEZE FINE | S760: PLAYED AT | X760: LADDER | AB760: ROUND | AD760: 17
D761: 1ST QTR | H761: 2ND QTR | L761: 3RD QTR | P761: FINAL | S761: NORTH MELB
A762: NORTH MELBOURNE | C762: 3 | D762: 3 | E762: =C762*6+D762 -> 21 | G762: 6 | H762: 4 | I762: =G762*6+H762 -> 40 | K762: 7 | L762: 7 | M762: =K762*6+L762 -> 49 | O762: 8 | P762: 8 | Q762: =O762*6+P762 -> 56 | S762: UMPIRE | W762: TEAM | X762: W | Y762: L | Z762: D | AA762: FOR | AB762: AGST | AC762: % | AD762: PTS
A763: WILLIAMSTOWN | C763: 1 | D763: 1 | E763: =C763*6+D763 -> 7 | G763: 2 | H763: 5 | I763: =G763*6+H763 -> 17 | K763: 4 | L763: 7 | M763: =K763*6+L763 -> 31 | O763: 5 | P763: 9 | Q763: =O763*6+P763 -> 39 | S763: PORTEOUS
A764: BEST PLAYERS
A765: NORTH MELBOURNE | D765: CARPENTER | G765: BARKER | J765: GARDINER | M765: HARDY | O765: WOODINGTON | R765: CORNALL | W765: NORTH MELBOURNE | X765: 13 | Y765: 4 | Z765: 0 | AA765: 1258 | AB765: 810 | AC765: 155.31 | AD765: 52
A766: WILLIAMSTOWN | D766: McDONALD | G766: McTAGGART | J766: MITCHELL | M766: ALLEY | O766: REITMAN | R766: GRANT | W766: FOOTSCRAY | X766: 13 | Y766: 4 | Z766: 0 | AA766: 1145 | AB766: 812 | AC766: 141.00985221674875 | AD766: 52
A767: GOALKICKERS | W767: ESSENDON ASSOC. | X767: 11 | Y767: 6 | Z767: 0 | AA767: 1230 | AB767: 973 | AC767: 126.41315519013361 | AD767: 44
A768: NORTH MELBOURNE | D768: HAWKINS 2 | G768: MILES 2 | J768: HARDY 2 | M768: FRANKS | O768: BARKER | W768: WILLIAMSTOWN | X768: 10 | Y768: 7 | Z768: 0 | AA768: 1023 | AB768: 893 | AC768: 114.55767077267637 | AD768: 40
A769: WILLIAMSTOWN | D769: ELLIOTT 2 | G769: E BUSBRIDGE | J769: McTAGGART | M769: JONES
W770: BRUNSWICK | X770: 9 | Y770: 7 | Z770: 1 | AA770: 1165 | AB770: 1006 | AC770: 115.81 | AD770: 38
A771: ESSENDON ASSOC. | C771: 3 | D771: 1 | E771: =C771*6+D771 -> 19 | G771: 6 | H771: 4 | I771: =G771*6+H771 -> 40 | K771: 7 | L771: 6 | M771: =K771*6+L771 -> 48 | O771: 14 | P771: 10 | Q771: =O771*6+P771 -> 94 | S771: TOORAK PARK | W771: PRAHRAN | X771: 8 | Y771: 7 | Z771: 2 | AA771: 1071 | AB771: 1020 | AC771: 105 | AD771: 36
A772: PRAHRAN | C772: 2 | D772: 7 | E772: =C772*6+D772 -> 19 | G772: 3 | H772: 9 | I772: =G772*6+H772 -> 27 | K772: 6 | L772: 14 | M772: =K772*6+L772 -> 50 | O772: 11 | P772: 15 | Q772: =O772*6+P772 -> 81 | S772: McMURRAY | W772: BRIGHTON | X772: 9 | Y772: 8 | Z772: 0 | AA772: 985 | AB772: 976 | AC772: 100.92213114754098 | AD772: 36
A773: BEST PLAYERS | W773: PORT MELBOURNE | X773: 7 | Y773: 10 | Z773: 0 | AA773: 1103 | AB773: 1181 | AC773: 93.395427603725651 | AD773: 28
A774: ESSENDON ASSOC. | D774: MITCHELL | G774: EBBOTT | J774: FINCHER | M774: BICKFORD | P774: HOARE | R774: SEVIOR | W774: HAWTHORN | X774: 2 | Y774: 14 | Z774: 1 | AA774: 1054 | AB774: 1602 | AC774: 65.792759051186025 | AD774: 10
A775: PRAHRAN | D775: MORONEY | G775: CARLSON | J775: RYAN | M775: WOODHEAD | P775: SIMS | R775: KERR | W775: NORTHCOTE | X775: 1 | Y775: 16 | Z775: 0 | AA775: 727 | AB775: 1488 | AC775: 48.857526881720432 | AD775: 4
A776: GOALKICKERS
A777: ESSENDON ASSOC. | D777: EBBOTT 4 | G777: CLARKE 4 | J777: HOARE 2 | M777: ATKINS 2 | P777: STROWNIX | S777: GIESLER
A778: PRAHRAN | D778: WOODS 2 | G778: DUFTY 2 | I778: DOWSING 2 | L778: JONES | N778: KERR | P778: WILSON | R778: CARLSON | U778: MAYNARD
A780: BRIGHTON | C780: 4 | D780: 0 | E780: =C780*6+D780 -> 24 | G780: 9 | H780: 4 | I780: =G780*6+H780 -> 58 | K780: 11 | L780: 5 | M780: =K780*6+L780 -> 71 | O780: 12 | P780: 12 | Q780: =O780*6+P780 -> 84 | S780: BRIGHTON BEACH
A781: PORT MELBOURNE | C781: 3 | D781: 2 | E781: =C781*6+D781 -> 20 | G781: 4 | H781: 4 | I781: =G781*6+H781 -> 28 | K781: 5 | L781: 10 | M781: =K781*6+L781 -> 40 | O781: 8 | P781: 13 | Q781: =O781*6+P781 -> 61 | S781: KENDALL
A782: BEST PLAYERS
A783: BRIGHTON | D783: TEESE | G783: GRAHAM | J783: TURNBULL | M783: NEGRO | O783: BAYLISS
A784: PORT MELBOURNE | D784: BARFOOT | G784: DEAS | J784: MENZIES | M784: BAILEY | O784: HOWLETT
A785: GOALKICKERS
A786: BRIGHTON | D786: GRAHAM 4 | G786: BAYLISS 3 | J786: TEESE 2 | M786: DAWSON 2 | P786: TURNBULL
A787: PORT MELBOURNE | D787: WALTON 3 | G787: BAILEY 2 | J787: BARFOOT | M787: RYAN | O787: McCONVILLE
A789: BRUNSWICK | C789: 4 | D789: 5 | E789: =C789*6+D789 -> 29 | G789: 7 | H789: 10 | I789: =G789*6+H789 -> 52 | K789: 9 | L789: 14 | M789: =K789*6+L789 -> 68 | O789: 14 | P789: 19 | Q789: =O789*6+P789 -> 103 | S789: HAW
A790: HAWTHORN | C790: 1 | D790: 3 | E790: =C790*6+D790 -> 9 | G790: 5 | H790: 4 | I790: =G790*6+H790 -> 34 | K790: 7 | L790: 12 | M790: =K790*6+L790 -> 54 | O790: 9 | P790: 15 | Q790: =O790*6+P790 -> 69 | S790: HURLEY
A791: BEST PLAYERS
A792: BRUNSWICK | D792: McLEOD | G792: ROSS | J792: G SWIFT | M792: O'CONNOR | P792: SULLIVAN | S792: PRICE
A793: HAWTHORN | D793: HANNA | G793: McCONVILLE | J793: HOLLAND | M793: FEWSTER | P793: GOUGH | S793: WILKINSON
A794: GOALKICKERS
A795: BRUNSWICK | D795: STEVENSON 2 | G795: CHASE 2 | I795: CHANDLER 2 | L795: GEORGE 2 | N795: HARKER 2 | Q795: TOPHAM | S795: SWIFT | U795: ROSS
A796: HAWTHORN | D796: FEWSTER 3 | G796: HANNA 3 | J796: CHAPMAN 2 | M796: GOUGH
A798: FOOTSCRAY | C798: 4 | D798: 3 | E798: =C798*6+D798 -> 27 | G798: 8 | H798: 8 | I798: =G798*6+H798 -> 56 | K798: 12 | L798: 15 | M798: =K798*6+L798 -> 87 | O798: 19 | P798: 20 | Q798: =O798*6+P798 -> 134 | S798: CROXTON PK
A799: NORTHCOTE | C799: 0 | D799: 3 | E799: =C799*6+D799 -> 3 | G799: 1 | H799: 7 | I799: =G799*6+H799 -> 13 | K799: 4 | L799: 12 | M799: =K799*6+L799 -> 36 | O799: 5 | P799: 14 | Q799: =O799*6+P799 -> 44 | S799: C PRITCHARD
A800: BEST PLAYERS
A801: FOOTSCRAY | D801: BANBURY | G801: COTTON | J801: CRADDOCK | M801: SPENCE | P801: GRIERSON | S801: SAMSON
A802: NORTHCOTE | D802: H THOMAS | G802: COLE | J802: TEESDALE | M802: JOHNSON | P802: MOORE | S802: BECK
A803: GOALKICKERS
A804: FOOTSCRAY | D804: LAWSON 4 | G804: M SPENCE 4 | J804: SAMSON 4 | M804: GRIERSON 3 | P804: COTTON 3 | S804: BANBURY
A805: NORTHCOTE | D805: H THOMAS | G805: SUARES | J805: TEESDALE | M805: GOODALL | P805: WILLIS
A807: ROUND 18 | E807: 1ST AUGUST | J807: WEATHER | M807: NORTH BREEZE DULL | S807: PLAYED AT | X807: LADDER | AB807: ROUND | AD807: 18
D808: 1ST QTR | H808: 2ND QTR | L808: 3RD QTR | P808: FINAL | S808: ESSENDON
A809: ESSENDON ASSOC. | C809: 4 | D809: 3 | E809: =C809*6+D809 -> 27 | G809: 7 | H809: 10 | I809: =G809*6+H809 -> 52 | K809: 12 | L809: 14 | M809: =K809*6+L809 -> 86 | O809: 13 | P809: 22 | Q809: =O809*6+P809 -> 100 | S809: UMPIRE | W809: TEAM | X809: W | Y809: L | Z809: D | AA809: FOR | AB809: AGST | AC809: % | AD809: PTS
A810: BRUNSWICK | C810: 4 | D810: 1 | E810: =C810*6+D810 -> 25 | G810: 6 | H810: 4 | I810: =G810*6+H810 -> 40 | K810: 8 | L810: 9 | M810: =K810*6+L810 -> 57 | O810: 11 | P810: 15 | Q810: =O810*6+P810 -> 81 | S810: McMURRAY
A811: BEST PLAYERS | W811: NORTH MELBOURNE | X811: 14 | Y811: 4 | Z811: 0 | AA811: 1388 | AB811: 873 | AC811: 158.99 | AD811: 56
A812: ESSENDON ASSOC. | D812: BICKFORD | G812: COCKRAM | J812: EBBOTT | M812: DIGGLE | O812: FINCHER | Q812: HOARE | W812: FOOTSCRAY | X812: 14 | Y812: 4 | Z812: 0 | AA812: 1221 | AB812: 865 | AC812: 141.15606936416185 | AD812: 56
A813: BRUNSWICK | D813: CHANDLER | G813: O'CONNOR | J813: SUULIVAN | M813: ROSS | O813: GEORGE | Q813: PRICE | W813: ESSENDON ASSOC. | X813: 12 | Y813: 6 | Z813: 0 | AA813: 1330 | AB813: 1054 | AC813: 126.18595825426945 | AD813: 48
A814: GOALKICKERS | W814: WILLIAMSTOWN | X814: 11 | Y814: 7 | Z814: 0 | AA814: 1085 | AB814: 932 | AC814: 116.41630901287553 | AD814: 44
A815: ESSENDON ASSOC. | D815: CLARKE 4 | F815: SEVIOR 2 | H815: DIGGLE 2 | J815: HOARE 2 | L815: ATKINS | N815: FINCHER | P815: GIBSON
A816: BRUNSWICK | D816: TOPHAM 3 | F816: HARKER 2 | I816: STEVENSON 2 | L816: PRICE 2 | N816: McKAY | P816: SULLIVAN | W816: BRUNSWICK | X816: 9 | Y816: 8 | Z816: 1 | AA816: 1246 | AB816: 1106 | AC816: 112.66 | AD816: 38
W817: PRAHRAN | X817: 8 | Y817: 8 | Z817: 2 | AA817: 1124 | AB817: 1096 | AC817: 102.55474452554745 | AD817: 36
A818: WILLIAMSTOWN | C818: 1 | D818: 0 | E818: =C818*6+D818 -> 6 | G818: 4 | H818: 3 | I818: =G818*6+H818 -> 27 | K818: 5 | L818: 6 | M818: =K818*6+L818 -> 36 | O818: 9 | P818: 8 | Q818: =O818*6+P818 -> 62 | S818: WILLIAMSTOWN | W818: BRIGHTON | X818: 9 | Y818: 9 | Z818: 0 | AA818: 1024 | AB818: 1038 | AC818: 98.651252408477845 | AD818: 36
A819: BRIGHTON | C819: 3 | D819: 0 | E819: =C819*6+D819 -> 18 | G819: 5 | H819: 2 | I819: =G819*6+H819 -> 32 | K819: 6 | L819: 3 | M819: =K819*6+L819 -> 39 | O819: 6 | P819: 3 | Q819: =O819*6+P819 -> 39 | S819: PORTEOUS | W819: PORT MELBOURNE | X819: 7 | Y819: 11 | Z819: 0 | AA819: 1166 | AB819: 1311 | AC819: 88.939740655987791 | AD819: 28
A820: BEST PLAYERS | W820: HAWTHORN | X820: 3 | Y820: 14 | Z820: 1 | AA820: 1146 | AB820: 1633 | AC820: 70.17758726270668 | AD820: 14
A821: WILLIAMSTOWN | D821: MITCHELL | G821: STUART | I821: ALLEY | K821: McTAGGART | N821: N BUSBRIDGE | Q821: E BUSBRIDGE | W821: NORTHCOTE | X821: 1 | Y821: 17 | Z821: 0 | AA821: 758 | AB821: 1580 | AC821: 47.974683544303801 | AD821: 4
A822: BRIGHTON | D822: PHILLIPS | G822: KNIGHTON | I822: NEGRO | K822: WALLACE | N822: DOWDING | Q822: BAYLISS
A823: GOALKICKERS
A824: WILLIAMSTOWN | D824: N BUSBRIDGE 4 | H824: MITCHELL 2 | K824: AMY | M824: GIBBS | O824: McTAGGART
A825: BRIGHTON | D825: BAYLISS 3 | G825: GRAHAM | J825: TEESE | L825: PHILLIPS
A827: FOOTSCRAY | C827: 4 | D827: 6 | E827: =C827*6+D827 -> 30 | G827: 4 | H827: 11 | I827: =G827*6+H827 -> 35 | K827: 7 | L827: 16 | M827: =K827*6+L827 -> 58 | O827: 9 | P827: 22 | Q827: =O827*6+P827 -> 76 | S827: FOOTSCRAY
A828: PRAHRAN | C828: 0 | D828: 0 | E828: =C828*6+D828 -> 0 | G828: 4 | H828: 3 | I828: =G828*6+H828 -> 27 | K828: 5 | L828: 3 | M828: =K828*6+L828 -> 33 | O828: 8 | P828: 5 | Q828: =O828*6+P828 -> 53 | S828: KENDALL
A829: BEST PLAYERS
A830: FOOTSCRAY | D830: GRIERSON | G830: BRIESE | J830: COTTON | M830: LAWSON | P830: BANBURY | S830: CROUCH
A831: PRAHRAN | D831: WOODS | G831: MORONEY | J831: CARLSON | M831: DOWSING | P831: WILSON | S831: SIMS
A832: GOALKICKERS
A833: FOOTSCRAY | D833: LAWSON 3 | G833: COTTON 2 | J833: BAXTER 2 | M833: CROUCH | P833: NEILSON
A834: PRAHRAN | D834: WILSON 3 | G834: GREENHILL 2 | K834: DUFTY 2 | N834: WOODS
A836: NORTH MELBOURNE | C836: 5 | D836: 3 | E836: =C836*6+D836 -> 33 | G836: 11 | H836: 7 | I836: =G836*6+H836 -> 73 | K836: 16 | L836: 9 | M836: =K836*6+L836 -> 105 | O836: 20 | P836: 10 | Q836: =O836*6+P836 -> 130 | S836: PORT MELB
A837: PORT MELBOURNE | C837: 2 | D837: 1 | E837: =C837*6+D837 -> 13 | G837: 4 | H837: 4 | I837: =G837*6+H837 -> 28 | K837: 4 | L837: 7 | M837: =K837*6+L837 -> 31 | O837: 9 | P837: 9 | Q837: =O837*6+P837 -> 63 | S837: HERBERT
A838: BEST PLAYERS
A839: NORTH MELBOURNE | D839: CORNALL | G839: SHEEHAN | J839: CAVE | L839: RAWLE | N839: HARDY | P839: CARPENTER
A840: PORT MELBOURNE | D840: BARFOOT | G840: WALTON | J840: McCONVILLE
A841: GOALKICKERS
A842: NORTH MELBOURNE | D842: HAWKINS 6 | G842: CARPENTER 5 | K842: MORAN 5 | N842: MILES 3 | Q842: JONES
A843: PORT MELBOURNE | D843: WALTON 7 | G843: BARFOOT | J843: BRUCE
A845: HAWTHORN | C845: 1 | D845: 3 | E845: =C845*6+D845 -> 9 | G845: 5 | H845: 8 | I845: =G845*6+H845 -> 38 | K845: 8 | L845: 10 | M845: =K845*6+L845 -> 58 | O845: 13 | P845: 14 | Q845: =O845*6+P845 -> 92 | S845: HAW
A846: NORTHCOTE | C846: 2 | D846: 3 | E846: =C846*6+D846 -> 15 | G846: 3 | H846: 8 | I846: =G846*6+H846 -> 26 | K846: 3 | L846: 11 | M846: =K846*6+L846 -> 29 | O846: 3 | P846: 13 | Q846: =O846*6+P846 -> 31 | S846: HURLEY
A847: BEST PLAYERS
A848: HAWTHORN | D848: WILKINSON | G848: McCONVILLE | J848: LARKIN | M848: GIBB | O848: FEWSTER | R848: L BRADY
A849: NORTHCOTE | D849: TEESDALE | G849: MILLS | J849: JACKSON | M849: MOORE | O849: HOLLAND | R849: GOODALL
A850: GOALKICKERS
A851: HAWTHORN | D851: WILKINSON 6 | H851: GIBB 3 | K851: FEWSTER 2 | N851: McCONVILLE | Q851: CORNELL
A852: NORTHCOTE | D852: MOORE 2 | H852: TEESEDALE
A854: FINALS
A855: 1ST SEMI | E855: 8TH AUGUST | J855: WEATHER | N855: FINE
D856: 1ST QTR | H856: 2ND QTR | L856: 3RD QTR | P856: FINAL
A857: NORTH MELBOURNE | C857: 5 | D857: 1 | E857: =C857*6+D857 -> 31 | G857: 9 | H857: 4 | I857: =G857*6+H857 -> 58 | K857: 12 | L857: 7 | M857: =K857*6+L857 -> 79 | O857: 13 | P857: 11 | Q857: =O857*6+P857 -> 89 | S857: M.C.G.
A858: ESSENDON ASSOC. | C858: 1 | D858: 5 | E858: =C858*6+D858 -> 11 | G858: 3 | H858: 4 | I858: =G858*6+H858 -> 22 | K858: 3 | L858: 9 | M858: =K858*6+L858 -> 27 | O858: 8 | P858: 10 | Q858: =O858*6+P858 -> 58 | S858: McMURRAY
A859: BEST PLAYERS
A860: NORTH MELBOURNE | D860: CARPENTER | G860: CORNALL | J860: WOODINGTON | N860: BARKER | Q860: RAWLE | S860: HARDY
A861: ESSENDON ASSOC. | D861: WALKER | G861: PAIN | J861: STROWNIX | N861: BICKFORD | Q861: DIGGLE
A862: GOALKICKERS
A863: NORTH MELBOURNE | D863: CARPENTER 3 | H863: MORAN 3 | K863: HAWKINS 3 | N863: JONES | P863: HARDY | R863: MILES | T863: FRANKS
A864: ESSENDON ASSOC. | D864: CLARKE 4 | G864: STROWNIX | J864: GIBSON | M864: GIESLER | P864: DIGGLE
A866: 2ND SEMI | J866: WEATHER
A867: FOOTSCRAY | C867: 2 | D867: 6 | E867: =C867*6+D867 -> 18 | G867: 3 | H867: 9 | I867: =G867*6+H867 -> 27 | K867: 9 | L867: 11 | M867: =K867*6+L867 -> 65 | O867: 13 | P867: 12 | Q867: =O867*6+P867 -> 90 | S867: EMCG
A868: WILLIAMSTOWN | C868: 3 | D868: 1 | E868: =C868*6+D868 -> 19 | G868: 5 | H868: 4 | I868: =G868*6+H868 -> 34 | K868: 5 | L868: 4 | M868: =K868*6+L868 -> 34 | O868: 5 | P868: 6 | Q868: =O868*6+P868 -> 36 | S868: KENDALL
A869: BEST PLAYERS
A870: FOOTSCRAY | D870: LAWSON | G870: SPENCE | J870: COTTON | M870: HARRIS | P870: CLARK | S870: GRIERSON
A871: WILLIAMSTOWN | D871: AMY | G871: GIBBS | J871: O'HALLORAN | M871: McDONALD | P871: McTAGGART | S871: MITCHELL
A872: GOALKICKERS
A873: FOOTSCRAY | D873: BAXTER 3 | G873: LAWSON 3 | J873: SAMSON 3 | M873: COTTON 2 | P873: SPENCE 2
A874: WILLIAMSTOWN | D874: MITCHELL 2 | G874: McDONALD | J874: McTAGGART | M874: N BUSBRIDGE
A876: FINAL | D876: 22ND AUGUST | J876: WEATHER | M876: NORTH BREEZE FINE
A877: NORTH MELBOURNE | C877: 1 | D877: 3 | E877: 9 | G877: 6 | H877: 10 | I877: 46 | K877: 9 | L877: 13 | M877: 67 | O877: 12 | P877: 14 | Q877: =O877*6+P877 -> 86 | S877: EMCG
A878: FOOTSCRAY | C878: 2 | D878: 1 | E878: 13 | G878: 4 | H878: 2 | I878: 26 | K878: 5 | L878: 5 | M878: 35 | O878: 7 | P878: 9 | Q878: =O878*6+P878 -> 51 | S878: McMURRAY
A879: BEST PLAYERS
A880: NORTH MELBOURNE | D880: HARDY | G880: BARKER | J880: RAWLE | M880: MORAN | P880: GARDINER | S880: JONES
A881: FOOTSCRAY | D881: SAMSON | G881: GRIMSHAW | J881: FORD | M881: BRIESE | P881: CRADDOCK | S881: CROUCH
A882: GOALKICKERS
A883: NORTH MELBOURNE | D883: MORAN 5 | G883: HARDY 3 | J883: MILES 2 | M883: CARPENTER | P883: HAWKINS
A884: FOOTSCRAY | D884: BAXTER 2 | G884: BANBURY 2 | J884: COTTON 2 | M884: CROUCH