A1: Victorian Football Association
A2: Season 1915
A3: © Copyright Wal Williams | F3: First created: 2 August 2014
A4: Contact: joywalwi at gmail dot com | F4: Last updated: 2 August 2014 | W4: VFA Results and tables - Link to the main index page
A5: You are free to copy this document in whole or part provided that proper acknowledgement is given to the author. All rights reserved.
A7: YEAR 1915
A8: ROUND 1 | E8: 24TH APRIL | J8: WEATHER | M8: FINE NORTH WIND | S8: PLAYED AT | X8: LADDER | AB8: ROUND | AD8: 1
D9: 1ST QTR | H9: 2ND QTR | L9: 3RD QTR | P9: FINAL | S9: NORTH MELB
A10: NORTH MELBOURNE | C10: 2 | D10: 6 | E10: =C10*6+D10 -> 18 | G10: 2 | H10: 7 | I10: =G10*6+H10 -> 19 | K10: 5 | L10: 10 | M10: =K10*6+L10 -> 40 | O10: 7 | P10: 11 | Q10: =O10*6+P10 -> 53 | S10: UMPIRE | W10: TEAM | X10: W | Y10: L | Z10: D | AA10: FOR | AB10: AGST | AC10: % | AD10: PTS
A11: PORT MELBOURNE | C11: 1 | D11: 0 | E11: =C11*6+D11 -> 6 | G11: 4 | H11: 2 | I11: =G11*6+H11 -> 26 | K11: 4 | L11: 2 | M11: =K11*6+L11 -> 26 | O11: 5 | P11: 7 | Q11: =O11*6+P11 -> 37 | S11: HURLEY
A12: BEST PLAYERS | W12: PRAHRAN | X12: 1 | Y12: 0 | Z12: 0 | AA12: 38 | AB12: 18 | AC12: 211.11111111111111 | AD12: 4
A13: NORTH MELBOURNE | D13: BARKER | G13: HARDY | I13: GARDINER | L13: FRANKS | O13: CLARKE | R13: RAWLE | W13: BRUNSWICK | X13: 1 | Y13: 0 | Z13: 0 | AA13: 48 | AB13: 31 | AC13: 154.83870967741936 | AD13: 4
A14: PORT MELBOURNE | D14: MERRICK | G14: CLELAND | I14: SAMSON | L14: FRANKLIN | O14: McCONVILLE | R14: BARFOOT | W14: NORTHCOTE | X14: 1 | Y14: 0 | Z14: 0 | AA14: 72 | AB14: 47 | AC14: 153.19148936170214 | AD14: 4
A15: GOALKICKERS | W15: WILLIAMSTOWN | X15: 1 | Y15: 0 | Z15: 0 | AA15: 51 | AB15: 35 | AC15: 145.71428571428572 | AD15: 4
A16: NORTH MELBOURNE | D16: HARDY 3 | G16: RAWLE | J16: HAWKINS | M16: MILES | O16: WOOD
A17: PORT MELBOURNE | D17: MERRICK | G17: CLELAND | J17: STRECKFUSS | M17: AMBLER | O17: DEAS | W17: NORTH MELBOURNE | X17: 1 | Y17: 0 | Z17: 0 | AA17: 53 | AB17: 37 | AC17: 143.24324324324326 | AD17: 4
W18: PORT MELBOURNE | X18: 0 | Y18: 1 | Z18: 0 | AA18: 37 | AB18: 53 | AC18: 69.811320754716988 | AD18: 0
A19: BRUNSWICK | C19: 4 | D19: 8 | E19: =C19*6+D19 -> 32 | G19: 4 | H19: 13 | I19: =G19*6+H19 -> 37 | K19: 4 | L19: 14 | M19: =K19*6+L19 -> 38 | O19: 5 | P19: 18 | Q19: =O19*6+P19 -> 48 | S19: ESSENDON | W19: BRIGHTON | X19: 0 | Y19: 1 | Z19: 0 | AA19: 35 | AB19: 51 | AC19: 68.627450980392155 | AD19: 0
A20: ESSENDON ASSOC. | C20: 0 | D20: 1 | E20: =C20*6+D20 -> 1 | G20: 0 | H20: 6 | I20: =G20*6+H20 -> 6 | K20: 3 | L20: 8 | M20: =K20*6+L20 -> 26 | O20: 3 | P20: 13 | Q20: =O20*6+P20 -> 31 | S20: KENDALL | W20: HAWTHORN | X20: 0 | Y20: 1 | Z20: 0 | AA20: 47 | AB20: 72 | AC20: 65.277777777777771 | AD20: 0
A21: BEST PLAYERS | W21: ESSENDON ASSOC. | X21: 0 | Y21: 1 | Z21: 0 | AA21: 31 | AB21: 48 | AC21: 64.583333333333329 | AD21: 0
A22: BRUNSWICK | D22: WALKER | G22: O'CONNOR | J22: PRINCE | M22: GILLESPIE | O22: CHASE | R22: HARKER | W22: FOOTSCRAY | X22: 0 | Y22: 1 | Z22: 0 | AA22: 18 | AB22: 38 | AC22: 47.368421052631582 | AD22: 0
A23: ESSENDON ASSOC. | D23: STROWNIX | G23: M MADDEN | J23: EBBOTT | M23: HOARE | O23: J MADDEN | R23: MITCHELL
A24: GOALKICKERS
A25: BRUNSWICK | D25: HARKER 2 | G25: SWIFT | J25: DUGGAN | M25: SULLIVAN
A26: ESSENDON ASSOC. | D26: PAIN | G26: CLARKE | J26: STROWNIX
A28: PRAHRAN | C28: 2 | D28: 3 | E28: =C28*6+D28 -> 15 | G28: 2 | H28: 3 | I28: =G28*6+H28 -> 15 | K28: 4 | L28: 7 | M28: =K28*6+L28 -> 31 | O28: 5 | P28: 8 | Q28: =O28*6+P28 -> 38 | S28: FOOTSCRAY
A29: FOOTSCRAY | C29: 1 | D29: 0 | E29: =C29*6+D29 -> 6 | G29: 2 | H29: 4 | I29: =G29*6+H29 -> 16 | K29: 2 | L29: 5 | M29: =K29*6+L29 -> 17 | O29: 2 | P29: 6 | Q29: =O29*6+P29 -> 18 | S29: REES
A30: BEST PLAYERS
A31: PRAHRAN | D31: V JONES | G31: CARLSON | J31: MORONEY | M31: DUFTY | O31: SIMS | R31: WOODINGTON
A32: FOOTSCRAY | D32: COTTON | G32: SAMSON | J32: BRIESE | M32: FORD | O32: CRADDOCK | R32: DOUGLAS
A33: GOALKICKERS
A34: PRAHRAN | D34: DUFTY 3 | G34: MORONEY | J34: KERR
A35: FOOTSCRAY | D35: COTTON | G35: SPENCE
A37: WILLIAMSTOWN | C37: 2 | D37: 0 | E37: =C37*6+D37 -> 12 | G37: 4 | H37: 6 | I37: =G37*6+H37 -> 30 | K37: 5 | L37: 7 | M37: =K37*6+L37 -> 37 | O37: 6 | P37: 15 | Q37: =O37*6+P37 -> 51 | S37: BRIGHTON BEACH
A38: BRIGHTON | C38: 2 | D38: 3 | E38: =C38*6+D38 -> 15 | G38: 2 | H38: 3 | I38: =G38*6+H38 -> 15 | K38: 4 | L38: 5 | M38: =K38*6+L38 -> 29 | O38: 5 | P38: 5 | Q38: =O38*6+P38 -> 35 | S38: McMURRAY
A39: BEST PLAYERS
A40: WILLIAMSTOWN | D40: O'HALLORAN | G40: ALLEY | J40: GIBBS | M40: MITCHELL | P40: N BUSBRIDGE | S40: AMY
A41: BRIGHTON | D41: A DAWSON | G41: WILLIAMS | J41: GRAHAM | M41: HARBOARD | P41: DOWDING | S41: COCK
A42: GOALKICKERS
A43: WILLIAMSTOWN | D43: MITCHELL 2 | H43: GIBBS | J43: HARDEN | L43: BROWN | N43: AMY
A44: BRIGHTON | D44: A DAWSON 2 | G44: WILLIAMS 2 | K44: W BYRNE
A46: NORTHCOTE | C46: 4 | D46: 4 | E46: =C46*6+D46 -> 28 | G46: 8 | H46: 6 | I46: =G46*6+H46 -> 54 | K46: 11 | L46: 6 | M46: =K46*6+L46 -> 72 | O46: 11 | P46: 6 | Q46: =O46*6+P46 -> 72 | S46: HAW
A47: HAWTHORN | C47: 1 | D47: 2 | E47: =C47*6+D47 -> 8 | G47: 1 | H47: 4 | I47: =G47*6+H47 -> 10 | K47: 2 | L47: 8 | M47: =K47*6+L47 -> 20 | O47: 6 | P47: 11 | Q47: =O47*6+P47 -> 47 | S47: KNOWLES
A48: BEST PLAYERS
A49: NORTHCOTE | D49: CARROLL | G49: FITZGERALD | J49: CHESSWASS | M49: H THOMAS | P49: BASSETT | S49: JACKSON
A50: HAWTHORN | D50: CHAPMAN | G50: GIBB | J50: MARTIN | M50: C BRADY | P50: WELLS | S50: WOOLLEY
A51: GOALKICKERS
A52: NORTHCOTE | D52: CHESSWASS 2 | G52: CARROLL 2 | J52: JACKSON 2 | M52: FITZGERALD 2 | P52: TEESDALE 2 | S52: WELLS
A53: HAWTHORN | D53: CHAPMAN 4 | G53: BRADY | J53: FEWSTER
A55: ROUND 2 | E55: 1ST MAY | J55: WEATHER | M55: SOUTH EAST WIND FINE | S55: PLAYED AT | X55: LADDER | AB55: ROUND | AD55: 2
D56: 1ST QTR | H56: 2ND QTR | L56: 3RD QTR | P56: FINAL | S56: WILLIAMSTOWN
A57: NORTH MELBOURNE | C57: 2 | D57: 2 | E57: =C57*6+D57 -> 14 | G57: 2 | H57: 4 | I57: =G57*6+H57 -> 16 | K57: 5 | L57: 6 | M57: =K57*6+L57 -> 36 | O57: 7 | P57: 10 | Q57: =O57*6+P57 -> 52 | S57: UMPIRE | W57: TEAM | X57: W | Y57: L | Z57: D | AA57: FOR | AB57: AGST | AC57: % | AD57: PTS
A58: WILLIAMSTOWN | C58: 2 | D58: 5 | E58: =C58*6+D58 -> 17 | G58: 3 | H58: 5 | I58: =G58*6+H58 -> 23 | K58: 5 | L58: 10 | M58: =K58*6+L58 -> 40 | O58: 5 | P58: 10 | Q58: =O58*6+P58 -> 40 | S58: GEDDES
A59: BEST PLAYERS | W59: BRUNSWICK | X59: 2 | Y59: 0 | Z59: 0 | AA59: 150 | AB59: 70 | AC59: 214.28571428571428 | AD59: 8
A60: NORTH MELBOURNE | D60: HARDY | F60: RAWLE | H60: FRANKS | K60: BARKER | N60: GARDINER | Q60: CONDON | W60: PRAHRAN | X60: 2 | Y60: 0 | Z60: 0 | AA60: 119 | AB60: 72 | AC60: 165.27777777777777 | AD60: 8
A61: WILLIAMSTOWN | D61: ALLEY | F61: GIBBS | H61: MITCHELL | K61: McDONALD | N61: DUNN | Q61: MIDDLETON | W61: NORTH MELBOURNE | X61: 2 | Y61: 0 | Z61: 0 | AA61: 105 | AB61: 77 | AC61: 136.36363636363637 | AD61: 8
A62: GOALKICKERS | W62: PORT MELBOURNE | X62: 1 | Y62: 1 | Z62: 0 | AA62: 121 | AB62: 92 | AC62: 131.52173913043478 | AD62: 4
A63: NORTH MELBOURNE | D63: RAWLE 2 | G63: HARDY | I63: HAWKINS | K63: CARPENTER | N63: MILES | P63: WELLS
A64: WILLIAMSTOWN | D64: N BUSBRIDGE 2 | H64: GIBBS | J64: MITCHELL | M64: HARDEN | W64: FOOTSCRAY | X64: 1 | Y64: 1 | Z64: 0 | AA64: 85 | AB64: 70 | AC64: 121.42857142857143 | AD64: 4
W65: WILLIAMSTOWN | X65: 1 | Y65: 1 | Z65: 0 | AA65: 91 | AB65: 87 | AC65: 104.59770114942529 | AD65: 4
A66: PORT MELBOURNE | C66: 2 | D66: 4 | E66: =C66*6+D66 -> 16 | G66: 6 | H66: 8 | I66: =G66*6+H66 -> 44 | K66: 8 | L66: 15 | M66: =K66*6+L66 -> 63 | O66: 11 | P66: 18 | Q66: =O66*6+P66 -> 84 | S66: PORT MELB | W66: NORTHCOTE | X66: 1 | Y66: 1 | Z66: 0 | AA66: 104 | AB66: 114 | AC66: 91.228070175438603 | AD66: 4
A67: BRIGHTON | C67: 3 | D67: 2 | E67: =C67*6+D67 -> 20 | G67: 3 | H67: 4 | I67: =G67*6+H67 -> 22 | K67: 4 | L67: 6 | M67: =K67*6+L67 -> 30 | O67: 5 | P67: 9 | Q67: =O67*6+P67 -> 39 | S67: KENDALL | W67: ESSENDON ASSOC. | X67: 0 | Y67: 2 | Z67: 0 | AA67: 85 | AB67: 129 | AC67: 65.891472868217051 | AD67: 0
A68: BEST PLAYERS | W68: BRIGHTON | X68: 0 | Y68: 2 | Z68: 0 | AA68: 74 | AB68: 135 | AC68: 54.814814814814817 | AD68: 0
A69: PORT MELBOURNE | D69: MERRICK | G69: STRECKFUSS | J69: McCONVILLE | M69: BARFOOT | O69: GOTZ | Q69: CLELAND | W69: HAWTHORN | X69: 0 | Y69: 2 | Z69: 0 | AA69: 86 | AB69: 174 | AC69: 49.425287356321839 | AD69: 0
A70: BRIGHTON | D70: HARBOARD | G70: WALLACE | J70: TEESE | M70: B BAILES
A71: GOALKICKERS
A72: PORT MELBOURNE | D72: MERRICK 4 | G72: STRECKFUSS 3 | K72: WALTON 2 | N72: BARFOOT | Q72: DANKS
A73: BRIGHTON | D73: B BAILES 2 | G73: BURNS | J73: LAWRENCE | M73: TURNBULL
A75: BRUNSWICK | C75: 7 | D75: 6 | E75: =C75*6+D75 -> 48 | G75: 8 | H75: 9 | I75: =G75*6+H75 -> 57 | K75: 11 | L75: 16 | M75: =K75*6+L75 -> 82 | O75: 14 | P75: 18 | Q75: =O75*6+P75 -> 102 | S75: BRUNSWICK
A76: HAWTHORN | C76: 1 | D76: 3 | E76: =C76*6+D76 -> 9 | G76: 3 | H76: 6 | I76: =G76*6+H76 -> 24 | K76: 4 | L76: 6 | M76: =K76*6+L76 -> 30 | O76: 5 | P76: 9 | Q76: =O76*6+P76 -> 39 | S76: PAYNE
A77: BEST PLAYERS
A78: BRUNSWICK | D78: HARKER | G78: TOPHAM | I78: GILLESPIE | L78: CHANDLER | O78: WALKER | Q78: McLEOD
A79: HAWTHORN | D79: WILKINSON | G79: FEWSTER | I79: JOHNSON | L79: C BRADY | O79: GOUGH | Q79: L BRADY
A80: GOALKICKERS
A81: BRUNSWICK | D81: HARKER 8 | G81: TOPHAM 4 | J81: STEVENSON 2
A82: HAWTHORN | D82: BECKMAN 3 | G82: FEWSTER | J82: CORNALL
A84: PRAHRAN | C84: 2 | D84: 4 | E84: =C84*6+D84 -> 16 | G84: 3 | H84: 4 | I84: =G84*6+H84 -> 22 | K84: 10 | L84: 7 | M84: =K84*6+L84 -> 67 | O84: 12 | P84: 9 | Q84: =O84*6+P84 -> 81 | S84: TOORAK PARK
A85: ESSENDON ASSOC. | C85: 3 | D85: 0 | E85: =C85*6+D85 -> 18 | G85: 4 | H85: 3 | I85: =G85*6+H85 -> 27 | K85: 6 | L85: 3 | M85: =K85*6+L85 -> 39 | O85: 8 | P85: 6 | Q85: =O85*6+P85 -> 54 | S85: COLLINS
A86: BEST PLAYERS
A87: PRAHRAN | D87: MORONEY | G87: V JONES | I87: CARLSON | L87: SCADDEN | O87: WEIDNER | Q87: KERR
A88: ESSENDON ASSOC. | D88: M MADDEN | G88: SEVIOR | I88: WALKER | L88: HOARE | O88: CLARKE | Q88: STROWNIX
A89: GOALKICKERS
A90: PRAHRAN | D90: V JONES 3 | G90: YOUNG 3 | J90: KERR 2 | L90: WOODHEAD | O90: WEIDNER | Q90: GOWER | S90: CARLSON
A91: ESSENDON ASSOC. | D91: KEMP 3 | G91: CLARKE 3 | J91: HOARE 2
A93: FOOTSCRAY | C93: 1 | D93: 3 | E93: =C93*6+D93 -> 9 | G93: 4 | H93: 4 | I93: =G93*6+H93 -> 28 | K93: 6 | L93: 5 | M93: =K93*6+L93 -> 41 | O93: 10 | P93: 7 | Q93: =O93*6+P93 -> 67 | S93: NORTHCOTE
A94: NORTHCOTE | C94: 0 | D94: 2 | E94: =C94*6+D94 -> 2 | G94: 2 | H94: 4 | I94: =G94*6+H94 -> 16 | K94: 4 | L94: 7 | M94: =K94*6+L94 -> 31 | O94: 4 | P94: 8 | Q94: =O94*6+P94 -> 32 | S94: HURLEY
A95: BEST PLAYERS
A96: FOOTSCRAY | D96: PATTERSON | G96: COTTON | I96: DOUGLAS | L96: JONES | N96: SAMSON | Q96: SPENCE
A97: NORTHCOTE | D97: FITZGERALD | G97: JACKSON | I97: H THOMAS | L97: A THOMAS | N97: PEMBERTON | Q97: MILLS
A98: GOALKICKERS
A99: FOOTSCRAY | D99: DOUGLAS 3 | G99: THORPE 2 | I99: SAMSON | K99: GREGORY | M99: JONES | O99: COTTON | Q99: CROUCH
A100: NORTHCOTE | D100: MARTIN 2 | G100: JACKSON | J100: CARROLL
A102: ROUND 3 | E102: 8TH MAY | J102: WEATHER | M102: SOUTH EAST WIND FINE | S102: PLAYED AT | X102: LADDER | AB102: ROUND | AD102: 3
D103: 1ST QTR | H103: 2ND QTR | L103: 3RD QTR | P103: FINAL | S103: BRUNSWICK
A104: NORTH MELBOURNE | C104: 3 | D104: 3 | E104: =C104*6+D104 -> 21 | G104: 4 | H104: 5 | I104: =G104*6+H104 -> 29 | K104: 11 | L104: 9 | M104: =K104*6+L104 -> 75 | O104: 13 | P104: 15 | Q104: =O104*6+P104 -> 93 | S104: UMPIRE | W104: TEAM | X104: W | Y104: L | Z104: D | AA104: FOR | AB104: AGST | AC104: % | AD104: PTS
A105: BRUNSWICK | C105: 1 | D105: 2 | E105: =C105*6+D105 -> 8 | G105: 4 | H105: 4 | I105: =G105*6+H105 -> 28 | K105: 4 | L105: 6 | M105: =K105*6+L105 -> 30 | O105: 10 | P105: 8 | Q105: =O105*6+P105 -> 68 | S105: KENDALL
A106: BEST PLAYERS | W106: PRAHRAN | X106: 3 | Y106: 0 | Z106: 0 | AA106: 196 | AB106: 136 | AC106: 144.11764705882354 | AD106: 12
A107: NORTH MELBOURNE | D107: HAWKINS | G107: HARDY | I107: BARKER | K107: RAWLE | N107: MILES | Q107: CARPENTER | W107: NORTH MELBOURNE | X107: 3 | Y107: 0 | Z107: 0 | AA107: 198 | AB107: 145 | AC107: 136.55172413793105 | AD107: 12
A108: BRUNSWICK | D108: CHANDLER | G108: CHASE | I108: PRICE | K108: SULLIVAN | N108: STEVENSON | Q108: HARKER | W108: FOOTSCRAY | X108: 2 | Y108: 1 | Z108: 0 | AA108: 180 | AB108: 129 | AC108: 139.53488372093022 | AD108: 8
A109: GOALKICKERS | W109: WILLIAMSTOWN | X109: 2 | Y109: 1 | Z109: 0 | AA109: 176 | AB109: 130 | AC109: 135.38461538461539 | AD109: 8
A110: NORTH MELBOURNE | D110: MILES 4 | G110: HAWKINS 3 | J110: CARPENTER 3 | M110: WELLS | O110: CONDON | Q110: FRANKS
A111: BRUNSWICK | D111: HARKER 4 | G111: STEVENSON 2 | J111: PRINCE | L111: TOPHAM | N111: PRICE | P111: SWIFT | W111: BRUNSWICK | X111: 2 | Y111: 1 | Z111: 0 | AA111: 218 | AB111: 163 | AC111: 133.74233128834356 | AD111: 8
W112: PORT MELBOURNE | X112: 2 | Y112: 1 | Z112: 0 | AA112: 211 | AB112: 173 | AC112: 121.96531791907515 | AD112: 8
A113: PRAHRAN | C113: 3 | D113: 2 | E113: =C113*6+D113 -> 20 | G113: 5 | H113: 2 | I113: =G113*6+H113 -> 32 | K113: 8 | L113: 5 | M113: =K113*6+L113 -> 53 | O113: 11 | P113: 11 | Q113: =O113*6+P113 -> 77 | S113: NORTHCOTE | W113: NORTHCOTE | X113: 1 | Y113: 2 | Z113: 0 | AA113: 168 | AB113: 191 | AC113: 87.958115183246079 | AD113: 4
A114: NORTHCOTE | C114: 5 | D114: 4 | E114: =C114*6+D114 -> 34 | G114: 7 | H114: 8 | I114: =G114*6+H114 -> 50 | K114: 8 | L114: 9 | M114: =K114*6+L114 -> 57 | O114: 9 | P114: 10 | Q114: =O114*6+P114 -> 64 | S114: HERBERT | W114: HAWTHORN | X114: 0 | Y114: 3 | Z114: 0 | AA114: 167 | AB114: 264 | AC114: 63.257575757575758 | AD114: 0
A115: BEST PLAYERS | W115: ESSENDON ASSOC. | X115: 0 | Y115: 3 | Z115: 0 | AA115: 128 | AB115: 214 | AC115: 59.813084112149532 | AD115: 0
A116: PRAHRAN | D116: MORONEY | G116: WEIDNER | I116: SCADDEN | K116: DOWSING | N116: DUFTY | Q116: MAYNARD | W116: BRIGHTON | X116: 0 | Y116: 3 | Z116: 0 | AA116: 133 | AB116: 230 | AC116: 57.826086956521742 | AD116: 0
A117: NORTHCOTE | D117: TEESDALE | G117: MARTIN | I117: BASSETT | K117: FITZGERALD | N117: PEMBERTON | Q117: H THOMAS
A118: GOALKICKERS
A119: PRAHRAN | D119: DUFTY 3 | G119: DOWSING 2 | J119: V JONES 2 | M119: WEIDNER 2 | P119: CAIN | R119: MORONEY
A120: NORTHCOTE | D120: TEESDALE 2 | G120: WELLS 2 | I120: GRAY | J120: MARTIN | L120: A THOMAS | N120: CARROLL | P120: GOWER
A122: WILLIAMSTOWN | C122: 2 | D122: 2 | E122: =C122*6+D122 -> 14 | G122: 5 | H122: 6 | I122: =G122*6+H122 -> 36 | K122: 9 | L122: 10 | M122: =K122*6+L122 -> 64 | O122: 12 | P122: 13 | Q122: =O122*6+P122 -> 85 | S122: ESSENDON
A123: ESSENDON ASSOC. | C123: 0 | D123: 3 | E123: =C123*6+D123 -> 3 | G123: 2 | H123: 8 | I123: =G123*6+H123 -> 20 | K123: 3 | L123: 8 | M123: =K123*6+L123 -> 26 | O123: 5 | P123: 13 | Q123: =O123*6+P123 -> 43 | S123: GREEN
A124: BEST PLAYERS
A125: WILLIAMSTOWN | D125: ALLEY | G125: GIBBS | I125: WALLIS | L125: McDONALD | O125: BROWN | Q125: HARDEN
A126: ESSENDON ASSOC. | D126: WALKER | G126: DENSLEY | I126: LEUNIG | L126: STROWNIX | O126: HOARE | Q126: EBBOTT
A127: GOALKICKERS
A128: WILLIAMSTOWN | D128: BROWN 4 | G128: HARDEN 2 | J128: GIBBS 2 | M128: MITCHELL 2 | P128: WALLIS | R128: MILLER
A129: ESSENDON ASSOC. | D129: CLARKE 2 | G129: MATTHEWS | J129: SWIFT | L129: EBBOTT
A131: FOOTSCRAY | C131: 3 | D131: 0 | E131: =C131*6+D131 -> 18 | G131: 7 | H131: 4 | I131: =G131*6+H131 -> 46 | K131: 12 | L131: 7 | M131: =K131*6+L131 -> 79 | O131: 14 | P131: 11 | Q131: =O131*6+P131 -> 95 | S131: FOOTSCRAY
A132: BRIGHTON | C132: 2 | D132: 4 | E132: =C132*6+D132 -> 16 | G132: 3 | H132: 7 | I132: =G132*6+H132 -> 25 | K132: 4 | L132: 11 | M132: =K132*6+L132 -> 35 | O132: 7 | P132: 17 | Q132: =O132*6+P132 -> 59 | S132: HURLEY
A133: BEST PLAYERS
A134: FOOTSCRAY | D134: THORPE | G134: SAMSON | J134: COTTON | M134: CRADDOCK | P134: GRIERSON | S134: JONES
A135: BRIGHTON | D135: HARBOARD | G135: DAWSON | J135: B BAILES | M135: WALLACE | P135: BYRNE | S135: WILLIAMS
A136: GOALKICKERS
A137: FOOTSCRAY | D137: THORPE 5 | G137: CRADDOCK 3 | J137: CROUCH 2 | M137: GILCHRIST | O137: GREGORY | Q137: JONES | R137: SAMSON
A138: BRIGHTON | D138: WILLIAMS 2 | G138: TURNBULL 2 | J138: BYRNE | L138: GRAHAM | N138: DOWDING
A140: PORT MELBOURNE | C140: 3 | D140: 2 | E140: =C140*6+D140 -> 20 | G140: 6 | H140: 8 | I140: =G140*6+H140 -> 44 | K140: 11 | L140: 9 | M140: =K140*6+L140 -> 75 | O140: 13 | P140: 12 | Q140: =O140*6+P140 -> 90 | S140: HAW
A141: HAWTHORN | C141: 2 | D141: 6 | E141: =C141*6+D141 -> 18 | G141: 3 | H141: 9 | I141: =G141*6+H141 -> 27 | K141: 4 | L141: 17 | M141: =K141*6+L141 -> 41 | O141: 10 | P141: 21 | Q141: =O141*6+P141 -> 81 | S141: McMURRAY
A142: BEST PLAYERS
A143: PORT MELBOURNE | D143: MERRICK | G143: STRECKFUSS | J143: WALTON | M143: CLELAND | P143: MccONVILLE | S143: DANKS
A144: HAWTHORN | D144: WOOLLEY | G144: GOUGH | J144: CHAPMAN | M144: WILKINSON | P144: HOLLAND | S144: JOHNSON
A145: GOALKICKERS
A146: PORT MELBOURNE | D146: MERRICK 8 | G146: STRECKFUSS 3 | K146: McCONVILLE | N146: DANKS
A147: HAWTHORN | D147: FEWSTER 2 | G147: WOOLLEY 2 | J147: J MARCHBANKS 2 | N147: GOUGH 2 | Q147: GOTZ | R147: CLARKE
A149: ROUND 4 | E149: 15TH MAY | J149: WEATHER | M149: RAIN GROUNDS BAD | S149: PLAYED AT | X149: LADDER | AB149: ROUND | AD149: 4
D150: 1ST QTR | H150: 2ND QTR | L150: 3RD QTR | P150: FINAL | S150: NORTH MELB
A151: NORTH MELBOURNE | C151: 5 | D151: 2 | E151: =C151*6+D151 -> 32 | G151: 6 | H151: 2 | I151: =G151*6+H151 -> 38 | K151: 9 | L151: 3 | M151: =K151*6+L151 -> 57 | O151: 10 | P151: 6 | Q151: =O151*6+P151 -> 66 | S151: UMPIRE | W151: TEAM | X151: W | Y151: L | Z151: D | AA151: FOR | AB151: AGST | AC151: % | AD151: PTS
A152: FOOTSCRAY | C152: 1 | D152: 1 | E152: =C152*6+D152 -> 7 | G152: 2 | H152: 4 | I152: =G152*6+H152 -> 16 | K152: 3 | L152: 4 | M152: =K152*6+L152 -> 22 | O152: 7 | P152: 4 | Q152: =O152*6+P152 -> 46 | S152: GEDDES
A153: BEST PLAYERS | W153: NORTH MELBOURNE | X153: 4 | Y153: 0 | Z153: 0 | AA153: 264 | AB153: 191 | AC153: 138.21989528795811 | AD153: 16
A154: NORTH MELBOURNE | D154: BARKER | F154: CARPENTER | I154: HARDY | K154: GARDINER | N154: CORNELL | Q154: MILES | W154: PRAHRAN | X154: 3 | Y154: 1 | Z154: 0 | AA154: 232 | AB154: 176 | AC154: 131.81818181818181 | AD154: 12
A155: FOOTSCRAY | D155: GRIERSON | F155: PATTERSON | I155: COTTON | K155: CROUCH | N155: McKENZIE | Q155: SAMSON | W155: BRUNSWICK | X155: 3 | Y155: 1 | Z155: 0 | AA155: 258 | AB155: 199 | AC155: 129.64824120603015 | AD155: 12
A156: GOALKICKERS | W156: WILLIAMSTOWN | X156: 3 | Y156: 1 | Z156: 0 | AA156: 221 | AB156: 172 | AC156: 128.48837209302326 | AD156: 12
A157: NORTH MELBOURNE | D157: MILES 4 | G157: HARDY 2 | I157: CARPENTER | L157: BARKER | N157: CONDON | P157: WELLS
A158: FOOTSCRAY | D158: CROUCH 3 | G158: THORPE | I158: JONES | K158: GREGORY | M158: COTTON | W158: PORT MELBOURNE | X158: 3 | Y158: 1 | Z158: 0 | AA158: 287 | AB158: 230 | AC158: 124.78260869565217 | AD158: 12
W159: FOOTSCRAY | X159: 2 | Y159: 2 | Z159: 0 | AA159: 226 | AB159: 195 | AC159: 115.8974358974359 | AD159: 8
A160: BRUNSWICK | C160: 1 | D160: 4 | E160: =C160*6+D160 -> 10 | G160: 3 | H160: 6 | I160: =G160*6+H160 -> 24 | K160: 3 | L160: 8 | M160: =K160*6+L160 -> 26 | O160: 5 | P160: 10 | Q160: =O160*6+P160 -> 40 | S160: TOORAK PARK | W160: NORTHCOTE | X160: 1 | Y160: 2 | Z160: 1 | AA160: 244 | AB160: 267 | AC160: 91.385767790262179 | AD160: 6
A161: PRAHRAN | C161: 1 | D161: 5 | E161: =C161*6+D161 -> 11 | G161: 2 | H161: 9 | I161: =G161*6+H161 -> 21 | K161: 3 | L161: 12 | M161: =K161*6+L161 -> 30 | O161: 3 | P161: 18 | Q161: =O161*6+P161 -> 36 | S161: HURLEY | W161: BRIGHTON | X161: 0 | Y161: 3 | Z161: 1 | AA161: 209 | AB161: 306 | AC161: 68.300653594771248 | AD161: 2
A162: BEST PLAYERS | W162: HAWTHORN | X162: 0 | Y162: 4 | Z162: 0 | AA162: 209 | AB162: 309 | AC162: 67.637540453074436 | AD162: 0
A163: BRUNSWICK | D163: ROSS | G163: SWIFT | I163: CHANDLER | L163: STEVENSON | O163: HARKER | Q163: WALKER | W163: ESSENDON ASSOC. | X163: 0 | Y163: 4 | Z163: 0 | AA163: 185 | AB163: 290 | AC163: 63.793103448275865 | AD163: 0
A164: PRAHRAN | D164: MORONEY | G164: SIMS | I164: DOWSING | L164: V JONES | O164: GOWER | Q164: WEIDNER
A165: GOALKICKERS
A166: BRUNSWICK | D166: STEVENSON 2 | H166: CHASE | K166: HARKER | N166: PRICE
A167: PRAHRAN | D167: GOWER 2 | G167: DUFTY
A169: WILLIAMSTOWN | C169: 2 | D169: 1 | E169: =C169*6+D169 -> 13 | G169: 3 | H169: 5 | I169: =G169*6+H169 -> 23 | K169: 5 | L169: 7 | M169: =K169*6+L169 -> 37 | O169: 6 | P169: 9 | Q169: =O169*6+P169 -> 45 | S169: WILLIAMSTOWN
A170: HAWTHORN | C170: 2 | D170: 1 | E170: =C170*6+D170 -> 13 | G170: 2 | H170: 4 | I170: =G170*6+H170 -> 16 | K170: 6 | L170: 5 | M170: =K170*6+L170 -> 41 | O170: 6 | P170: 6 | Q170: =O170*6+P170 -> 42 | S170: COLLINS
A171: BEST PLAYERS
A172: WILLIAMSTOWN | D172: ALLEY | G172: LEE | I172: O'HALLORAN | L172: MILLS | O172: MITCHELL | Q172: HARDEN
A173: HAWTHORN | D173: HOLLAND | G173: GOUGH | I173: FEWSTER | L173: JOHNSON | O173: C BRADY | Q173: ANTONIE
A174: GOALKICKERS
A175: WILLIAMSTOWN | D175: O'HALLORAN 3 | H175: McLEAN 2 | K175: N BUSBRIDGE
A176: HAWTHORN | D176: FEWSTER 2 | G176: GOUGH | I176: HOSKING | K176: WILKINSON | N176: CHAPMAN
A178: PORT MELBOURNE | C178: 4 | D178: 3 | E178: =C178*6+D178 -> 27 | G178: 4 | H178: 6 | I178: =G178*6+H178 -> 30 | K178: 9 | L178: 12 | M178: =K178*6+L178 -> 66 | O178: 10 | P178: 16 | Q178: =O178*6+P178 -> 76 | S178: PORT MELB
A179: ESSENDON ASSOC. | C179: 0 | D179: 3 | E179: =C179*6+D179 -> 3 | G179: 4 | H179: 7 | I179: =G179*6+H179 -> 31 | K179: 4 | L179: 8 | M179: =K179*6+L179 -> 32 | O179: 8 | P179: 9 | Q179: =O179*6+P179 -> 57 | S179: HERBERT
A180: BEST PLAYERS
A181: PORT MELBOURNE | D181: WALTON | G181: MERRICK | J181: RYAN | L181: BARFOOT | O181: CLELAND | Q181: UNIACKE
A182: ESSENDON ASSOC. | D182: COCKRAM | G182: EBBOTT | J182: HOARE | L182: DENSLEY | O182: CLARKE | Q182: STROWNIX
A183: GOALKICKERS
A184: PORT MELBOURNE | D184: WALTON 3 | G184: MERRICK 3 | J184: BARFOOT 2 | M184: DANKS | O184: GOTZ
A185: ESSENDON ASSOC. | D185: GIBSON 3 | G185: MATTHEWS 2 | K185: HOARE | M185: CLARKE | O185: STROWNIX
A187: BRIGHTON | C187: 2 | D187: 0 | E187: =C187*6+D187 -> 12 | G187: 5 | H187: 5 | I187: =G187*6+H187 -> 35 | K187: 6 | L187: 8 | M187: =K187*6+L187 -> 44 | O187: 11 | P187: 10 | Q187: =O187*6+P187 -> 76 | S187: BRIGHTON BEACH
A188: NORTHCOTE | C188: 4 | D188: 3 | E188: =C188*6+D188 -> 27 | G188: 6 | H188: 6 | I188: =G188*6+H188 -> 42 | K188: 10 | L188: 8 | M188: =K188*6+L188 -> 68 | O188: 11 | P188: 10 | Q188: =O188*6+P188 -> 76 | S188: KENDALL
A189: BEST PLAYERS
A190: BRIGHTON | D190: B BAILES | G190: BAYLISS | I190: TURNBULL | L190: HARBOARD | O190: GRAHAM | R190: DAWSON
A191: NORTHCOTE | D191: DIMMICK | G191: WILSON | I191: MARTIN | L191: JACKSON | O191: A THOMAS | R191: GRAY
A192: GOALKICKERS
A193: BRIGHTON | D193: BAYLISS 5 | G193: GRAHAM | I193: HARBOARD | L193: B BAILES | N193: TURNBULL | Q193: DOWDING | T193: BYRNE
A194: NORTHCOTE | D194: JOHNSON 7 | G194: A THOMAS 2 | K194: MILLS | M194: TEESDALE
A196: ROUND 5 | E196: 22ND MAY | J196: WEATHER | M196: SOUTH WEST WIND GROUNDS BAD | S196: PLAYED AT | X196: LADDER | AB196: ROUND | AD196: 5
D197: 1ST QTR | H197: 2ND QTR | L197: 3RD QTR | P197: FINAL | S197: BRUNSWICK
A198: BRUNSWICK | C198: 3 | D198: 2 | E198: =C198*6+D198 -> 20 | G198: 5 | H198: 9 | I198: =G198*6+H198 -> 39 | K198: 7 | L198: 10 | M198: =K198*6+L198 -> 52 | O198: 9 | P198: 11 | Q198: =O198*6+P198 -> 65 | S198: UMPIRE | W198: TEAM | X198: W | Y198: L | Z198: D | AA198: FOR | AB198: AGST | AC198: % | AD198: PTS
A199: PORT MELBOURNE | C199: 5 | D199: 1 | E199: =C199*6+D199 -> 31 | G199: 5 | H199: 4 | I199: =G199*6+H199 -> 34 | K199: 6 | L199: 7 | M199: =K199*6+L199 -> 43 | O199: 8 | P199: 8 | Q199: =O199*6+P199 -> 56 | S199: GEDDES
A200: BEST PLAYERS | W200: NORTH MELBOURNE | X200: 5 | Y200: 0 | Z200: 0 | AA200: 368 | AB200: 230 | AC200: 160 | AD200: 20
A201: BRUNSWICK | D201: GRIMSTER | G201: HARKER | I201: McKENZIE | L201: BRAID | N201: ROSS | Q201: CHANDLER | W201: WILLIAMSTOWN | X201: 4 | Y201: 1 | Z201: 0 | AA201: 247 | AB201: 193 | AC201: 127.97927461139896 | AD201: 16
A202: PORT MELBOURNE | D202: MERRICK | G202: WALTON | I202: UNIACKE | L202: BIRCH | N202: FRANKLIN | Q202: PREECE | W202: BRUNSWICK | X202: 4 | Y202: 1 | Z202: 0 | AA202: 323 | AB202: 255 | AC202: 126.66666666666667 | AD202: 16
A203: GOALKICKERS | W203: PRAHRAN | X203: 4 | Y203: 1 | Z203: 0 | AA203: 284 | AB203: 227 | AC203: 125.1101321585903 | AD203: 16
A204: BRUNSWICK | D204: HARKER 3 | G204: TOPHAM 2 | J204: SWIFT | L204: BRAID | N204: CHASE | P204: LEONARD
A205: PORT MELBOURNE | D205: MERRICK 3 | G205: GOTZ 2 | I205: McCONVILLE 2 | L205: UNIACKE | W205: PORT MELBOURNE | X205: 3 | Y205: 2 | Z205: 0 | AA205: 343 | AB205: 295 | AC205: 116.27118644067797 | AD205: 12
W206: FOOTSCRAY | X206: 2 | Y206: 3 | Z206: 0 | AA206: 247 | AB206: 221 | AC206: 111.76470588235294 | AD206: 8
A207: WILLIAMSTOWN | C207: 1 | D207: 2 | E207: =C207*6+D207 -> 8 | G207: 2 | H207: 2 | I207: =G207*6+H207 -> 14 | K207: 4 | L207: 2 | M207: =K207*6+L207 -> 26 | O207: 4 | P207: 2 | Q207: =O207*6+P207 -> 26 | S207: FOOTSCRAY | W207: NORTHCOTE | X207: 1 | Y207: 3 | Z207: 1 | AA207: 272 | AB207: 315 | AC207: 86.349206349206355 | AD207: 6
A208: FOOTSCRAY | C208: 0 | D208: 0 | E208: =C208*6+D208 -> 0 | G208: 1 | H208: 3 | I208: =G208*6+H208 -> 9 | K208: 1 | L208: 4 | M208: =K208*6+L208 -> 10 | O208: 2 | P208: 9 | Q208: =O208*6+P208 -> 21 | S208: McMURRAY | W208: ESSENDON ASSOC. | X208: 1 | Y208: 4 | Z208: 0 | AA208: 233 | AB208: 318 | AC208: 73.270440251572325 | AD208: 4
A209: BEST PLAYERS | W209: BRIGHTON | X209: 0 | Y209: 4 | Z209: 1 | AA209: 260 | AB209: 358 | AC209: 72.625698324022352 | AD209: 2
A210: WILLIAMSTOWN | D210: WALLIS | G210: MITCHELL | J210: GIBBS | M210: MONK | O210: HARDEN | Q210: WOOD | W210: HAWTHORN | X210: 0 | Y210: 5 | Z210: 0 | AA210: 248 | AB210: 413 | AC210: 60.048426150121067 | AD210: 0
A211: FOOTSCRAY | D211: CROUCH | G211: CRADDOCK | J211: GREGORY | M211: SPENCE | O211: GRIERSON | Q211: CLARK
A212: GOALKICKERS
A213: WILLIAMSTOWN | D213: MILLS | G213: N BUSBRIDGE | K213: MITCHELL | N213: O'HALLORAN
A214: FOOTSCRAY | D214: DOUGLAS | G214: JONES
A216: ESSENDON ASSOC. | C216: 1 | D216: 5 | E216: =C216*6+D216 -> 11 | G216: 3 | H216: 8 | I216: =G216*6+H216 -> 26 | K216: 5 | L216: 10 | M216: =K216*6+L216 -> 40 | O216: 6 | P216: 12 | Q216: =O216*6+P216 -> 48 | S216: NORTHCOTE
A217: NORTHCOTE | C217: 1 | D217: 0 | E217: =C217*6+D217 -> 6 | G217: 1 | H217: 2 | I217: =G217*6+H217 -> 8 | K217: 2 | L217: 4 | M217: =K217*6+L217 -> 16 | O217: 4 | P217: 4 | Q217: =O217*6+P217 -> 28 | S217: KENDALL
A218: BEST PLAYERS
A219: ESSENDON ASSOC. | D219: EBBOTT | G219: PAIN | I219: COCKRAM | L219: STROWNIX | O219: MATTHEWS | R219: HOARE
A220: NORTHCOTE | D220: MILLS | G220: JACKSON | I220: GRAY | L220: DIMMICK | O220: O'KEEFE | R220: FITZGERALD
A221: GOALKICKERS
A222: ESSENDON ASSOC. | D222: CLARKE 3 | G222: MATTHEWS | J222: EBBOTT | M222: DOIG
A223: NORTHCOTE | D223: JACKSON 3 | G223: WILSON
A225: PRAHRAN | C225: 2 | D225: 5 | E225: =C225*6+D225 -> 17 | G225: 4 | H225: 6 | I225: =G225*6+H225 -> 30 | K225: 7 | L225: 9 | M225: =K225*6+L225 -> 51 | O225: 7 | P225: 10 | Q225: =O225*6+P225 -> 52 | S225: TOORAK PARK
A226: BRIGHTON | C226: 0 | D226: 3 | E226: =C226*6+D226 -> 3 | G226: 3 | H226: 5 | I226: =G226*6+H226 -> 23 | K226: 5 | L226: 8 | M226: =K226*6+L226 -> 38 | O226: 7 | P226: 9 | Q226: =O226*6+P226 -> 51 | S226: KNOWLES
A227: BEST PLAYERS
A228: PRAHRAN | D228: V JONES | G228: ELLIN | I228: QUINN | L228: DOWSING | O228: GOWER | R228: MAYNARD
A229: BRIGHTON | D229: TURNBULL | G229: GRAHAM | I229: B BAILES | L229: WALLACE | O229: BAYLISS | R229: HARBOARD
A230: GOALKICKERS
A231: PRAHRAN | D231: GOWER 3 | G231: MORONEY 2 | J231: V JONES | M231: DOWSING
A232: BRIGHTON | D232: BAYLISS 3 | G232: DAWSON 2 | J232: GRAHAM | M232: HARBOARD
A234: NORTH MELBOURNE | C234: 2 | D234: 6 | E234: =C234*6+D234 -> 18 | G234: 4 | H234: 10 | I234: =G234*6+H234 -> 34 | K234: 8 | L234: 12 | M234: =K234*6+L234 -> 60 | O234: 15 | P234: 14 | Q234: =O234*6+P234 -> 104 | S234: HAW
A235: HAWTHORN | C235: 0 | D235: 2 | E235: =C235*6+D235 -> 2 | G235: 2 | H235: 4 | I235: =G235*6+H235 -> 16 | K235: 3 | L235: 4 | M235: =K235*6+L235 -> 22 | O235: 5 | P235: 9 | Q235: =O235*6+P235 -> 39 | S235: HERBERT
A236: BEST PLAYERS
A237: NORTH MELBOURNE | D237: BARKER | G237: CORNALL | J237: CARPENTER | M237: SPEAKMAN | P237: CONDON | S237: JONES
A238: HAWTHORN | D238: FEWSTER | G238: CHAPMAN | J238: HOLLAND | M238: WILKINSON | P238: WOOLLEY | S238: LARKIN
A239: GOALKICKERS
A240: NORTH MELBOURNE | D240: CARPENTER 4 | G240: HAWKINS 3 | J240: CONDON 2 | M240: MILES 2 | O240: HARDY | Q240: WELLS | S240: FRANKS | V240: JONES
A241: HAWTHORN | D241: FEWSTER 3 | G241: ANTONIE | J241: J MARCHBANKS
A243: ROUND 6 | E243: 29TH MAY | J243: WEATHER | M243: NORTH WEST WIND | S243: PLAYED AT | X243: LADDER | AB243: ROUND | AD243: 6
D244: 1ST QTR | H244: 2ND QTR | L244: 3RD QTR | P244: FINAL | S244: BRUNSWICK
A245: BRUNSWICK | C245: 3 | D245: 3 | E245: =C245*6+D245 -> 21 | G245: 6 | H245: 6 | I245: =G245*6+H245 -> 42 | K245: 8 | L245: 8 | M245: =K245*6+L245 -> 56 | O245: 9 | P245: 11 | Q245: =O245*6+P245 -> 65 | S245: UMPIRE | W245: TEAM | X245: W | Y245: L | Z245: D | AA245: FOR | AB245: AGST | AC245: % | AD245: PTS
A246: WILLIAMSTOWN | C246: 1 | D246: 1 | E246: =C246*6+D246 -> 7 | G246: 3 | H246: 7 | I246: =G246*6+H246 -> 25 | K246: 6 | L246: 8 | M246: =K246*6+L246 -> 44 | O246: 8 | P246: 10 | Q246: =O246*6+P246 -> 58 | S246: KENDALL
A247: BEST PLAYERS | W247: NORTH MELBOURNE | X247: 6 | Y247: 0 | Z247: 0 | AA247: 425 | AB247: 273 | AC247: 155.67765567765568 | AD247: 24
A248: BRUNSWICK | D248: CHASE | G248: O'CONNOR | J248: HARKER | M248: SULLIVAN | P248: SWIFT | R248: GRIMSTER | W248: BRUNSWICK | X248: 5 | Y248: 1 | Z248: 0 | AA248: 388 | AB248: 313 | AC248: 123.96166134185303 | AD248: 20
A249: WILLIAMSTOWN | D249: ALLEY | G249: ANDERSON | J249: O'HALLORAN | M249: N BUSBRIDGE | P249: McLEAN | R249: REEVES | W249: PORT MELBOURNE | X249: 4 | Y249: 2 | Z249: 0 | AA249: 413 | AB249: 348 | AC249: 118.67816091954023 | AD249: 16
A250: GOALKICKERS | W250: WILLIAMSTOWN | X250: 4 | Y250: 2 | Z250: 0 | AA250: 305 | AB250: 258 | AC250: 118.21705426356588 | AD250: 16
A251: BRUNSWICK | D251: HARKER 3 | G251: SULLIVAN 2 | K251: SWIFT 2 | N251: WALKER | P251: PRICE
A252: WILLIAMSTOWN | D252: HARDEN 2 | G252: REEVES 2 | J252: McLEAN 2 | M252: N BUSBRIDGE | P252: WOUDA | W252: PRAHRAN | X252: 4 | Y252: 2 | Z252: 0 | AA252: 337 | AB252: 297 | AC252: 113.46801346801347 | AD252: 16
W253: FOOTSCRAY | X253: 3 | Y253: 3 | Z253: 0 | AA253: 303 | AB253: 254 | AC253: 119.29133858267717 | AD253: 12
A254: PORT MELBOURNE | C254: 0 | D254: 1 | E254: =C254*6+D254 -> 1 | G254: 5 | H254: 3 | I254: =G254*6+H254 -> 33 | K254: 8 | L254: 4 | M254: =K254*6+L254 -> 52 | O254: 10 | P254: 10 | Q254: =O254*6+P254 -> 70 | S254: PORT MELB | W254: NORTHCOTE | X254: 1 | Y254: 4 | Z254: 1 | AA254: 315 | AB254: 372 | AC254: 84.677419354838705 | AD254: 6
A255: PRAHRAN | C255: 2 | D255: 3 | E255: =C255*6+D255 -> 15 | G255: 3 | H255: 4 | I255: =G255*6+H255 -> 22 | K255: 6 | L255: 9 | M255: =K255*6+L255 -> 45 | O255: 7 | P255: 11 | Q255: =O255*6+P255 -> 53 | S255: HURLEY | W255: BRIGHTON | X255: 1 | Y255: 4 | Z255: 1 | AA255: 344 | AB255: 427 | AC255: 80.562060889929739 | AD255: 6
A256: BEST PLAYERS | W256: ESSENDON ASSOC. | X256: 1 | Y256: 5 | Z256: 0 | AA256: 266 | AB256: 374 | AC256: 71.122994652406419 | AD256: 4
A257: PORT MELBOURNE | D257: MERRICK | G257: CLELAND | J257: UNIACKE | M257: GOTZ | P257: WALTON | R257: DANKS | W257: HAWTHORN | X257: 0 | Y257: 6 | Z257: 0 | AA257: 317 | AB257: 497 | AC257: 63.782696177062377 | AD257: 0
A258: PRAHRAN | D258: MORONEY | G258: QUINN | J258: SIMS | M258: V JONES | P258: WEIDNER | R258: KERR
A259: GOALKICKERS
A260: PORT MELBOURNE | D260: MERRICK 3 | G260: BARFOOT 2 | J260: McMAHON 2 | M260: GOTZ | O260: WALTON | Q260: CLELAND
A261: PRAHRAN | D261: MORONEY 3 | G261: DUFTY | I261: JONES | K261: WEIDNER | N261: GOWER
A263: FOOTSCRAY | C263: 3 | D263: 2 | E263: =C263*6+D263 -> 20 | G263: 4 | H263: 3 | I263: =G263*6+H263 -> 27 | K263: 7 | L263: 5 | M263: =K263*6+L263 -> 47 | O263: 8 | P263: 8 | Q263: =O263*6+P263 -> 56 | S263: ESSENDON
A264: ESSENDON ASSOC. | C264: 3 | D264: 5 | E264: =C264*6+D264 -> 23 | G264: 3 | H264: 5 | I264: =G264*6+H264 -> 23 | K264: 4 | L264: 9 | M264: =K264*6+L264 -> 33 | O264: 4 | P264: 9 | Q264: =O264*6+P264 -> 33 | S264: McMURRAY
A265: BEST PLAYERS
A266: FOOTSCRAY | D266: CARMODY | G266: SAMSON | J266: CRADDOCK | M266: McKENZIE | P266: CROUCH | S266: COTTON
A267: ESSENDON ASSOC. | D267: STROWNIX | G267: WALKER | J267: HOARE | M267: MITCHELL | P267: PAIN | S267: SEVIOR
A268: GOALKICKERS
A269: FOOTSCRAY | D269: McKENZIE 2 | G269: GILCHRIST 2 | J269: CROUCH | L269: GREGORY | N269: CRADDOCK | Q269: PATTERSON
A270: ESSENDON ASSOC. | D270: SEVIOR | G270: EBBOTT | J270: STROWNIX | M270: HOARE
A272: BRIGHTON | C272: 3 | D272: 7 | E272: =C272*6+D272 -> 25 | G272: 5 | H272: 8 | I272: =G272*6+H272 -> 38 | K272: 8 | L272: 14 | M272: =K272*6+L272 -> 62 | O272: 11 | P272: 18 | Q272: =O272*6+P272 -> 84 | S272: BRIGHTON BEACH
A273: HAWTHORN | C273: 2 | D273: 2 | E273: =C273*6+D273 -> 14 | G273: 4 | H273: 6 | I273: =G273*6+H273 -> 30 | K273: 5 | L273: 8 | M273: =K273*6+L273 -> 38 | O273: 10 | P273: 9 | Q273: =O273*6+P273 -> 69 | S273: GEDDES
A274: BEST PLAYERS
A275: BRIGHTON | D275: TEESE | G275: B BAILES | J275: WALLACE | M275: BYRNE | P275: A DAWSON | S275: R DAWSON
A276: HAWTHORN | D276: LARKIN | G276: CORNELL | J276: L BRADY | M276: C BRADY | P276: WILKINSON | S276: HOLLAND
A277: GOALKICKERS
A278: BRIGHTON | D278: BYRNE 3 | G278: TEESE 2 | I278: BAYLISS 2 | L278: HARBOARD | N278: A DAWSON | Q278: B BAILES | S278: McCARTHY
A279: HAWTHORN | D279: HOSKING 3 | G279: FEWSTER 2 | J279: SANDILANDS 2 | N279: GOUGH | P279: WOOLLEY | R279: C BRADY
A281: NORTH MELBOURNE | C281: 4 | D281: 2 | E281: =C281*6+D281 -> 26 | G281: 6 | H281: 7 | I281: =G281*6+H281 -> 43 | K281: 7 | L281: 8 | M281: =K281*6+L281 -> 50 | O281: 8 | P281: 9 | Q281: =O281*6+P281 -> 57 | S281: NORTHCOTE
A282: NORTHCOTE | C282: 0 | D282: 4 | E282: =C282*6+D282 -> 4 | G282: 1 | H282: 8 | I282: =G282*6+H282 -> 14 | K282: 3 | L282: 12 | M282: =K282*6+L282 -> 30 | O282: 5 | P282: 13 | Q282: =O282*6+P282 -> 43 | S282: HERBERT
A283: BEST PLAYERS
A284: NORTH MELBOURNE | D284: BARKER | G284: JONES | J284: CARPENTER | M284: GARDINER | P284: SHEEHAN | S284: CONDON
A285: NORTHCOTE | D285: A THOMAS | G285: WILSON | J285: DIMMICK | M285: MILLS | P285: JACKSON | S285: MARTIN
A286: GOALKICKERS
A287: NORTH MELBOURNE | D287: CARPENTER 3 | H287: HAWKINS 2 | K287: HARDY | M287: BARKER | O287: SMITH
A288: NORTHCOTE | D288: JACKSON 2 | H288: WILSON | K288: GOODHALL
A290: ROUND 7 | E290: 5TH JUNE | J290: WEATHER | M290: NORTH WEST WIND | S290: PLAYED AT | X290: LADDER | AB290: ROUND | AD290: 7
D291: 1ST QTR | H291: 2ND QTR | L291: 3RD QTR | P291: FINAL | S291: FOOTSCRAY
A292: PORT MELBOURNE | C292: 1 | D292: 5 | E292: =C292*6+D292 -> 11 | G292: 1 | H292: 5 | I292: =G292*6+H292 -> 11 | K292: 5 | L292: 11 | M292: =K292*6+L292 -> 41 | O292: 5 | P292: 12 | Q292: =O292*6+P292 -> 42 | S292: UMPIRE | W292: TEAM | X292: W | Y292: L | Z292: D | AA292: FOR | AB292: AGST | AC292: % | AD292: PTS
A293: FOOTSCRAY | C293: 0 | D293: 0 | E293: =C293*6+D293 -> 0 | G293: 1 | H293: 11 | I293: =G293*6+H293 -> 17 | K293: 1 | L293: 11 | M293: =K293*6+L293 -> 17 | O293: 3 | P293: 22 | Q293: =O293*6+P293 -> 40 | S293: KENDALL
A294: BEST PLAYERS | W294: NORTH MELBOURNE | X294: 7 | Y294: 0 | Z294: 0 | AA294: 492 | AB294: 296 | AC294: 166.21621621621622 | AD294: 28
A295: PORT MELBOURNE | D295: MERRICK | G295: WALTON | I295: CLELAND | L295: SAMSON | O295: FRANKLIN | Q295: PREECE | W295: BRUNSWICK | X295: 6 | Y295: 1 | Z295: 0 | AA295: 463 | AB295: 337 | AC295: 137.38872403560831 | AD295: 24
A296: FOOTSCRAY | D296: GILCHRIST | G296: McKENZIE | I296: CLARK | L296: CRADDOCK | O296: GRIERSON | Q296: PATTERSON | W296: PRAHRAN | X296: 5 | Y296: 2 | Z296: 0 | AA296: 436 | AB296: 355 | AC296: 122.8169014084507 | AD296: 20
A297: GOALKICKERS | W297: WILLIAMSTOWN | X297: 5 | Y297: 2 | Z297: 0 | AA297: 363 | AB297: 308 | AC297: 117.85714285714286 | AD297: 20
A298: PORT MELBOURNE | D298: WALTON | G298: O'BRIEN | J298: DANKS | L298: MERRICK | O298: BARFOOT
A299: FOOTSCRAY | D299: GREGORY | G299: SAMSON | J299: CLARK | W299: PORT MELBOURNE | X299: 5 | Y299: 2 | Z299: 0 | AA299: 455 | AB299: 388 | AC299: 117.26804123711341 | AD299: 20
W300: FOOTSCRAY | X300: 3 | Y300: 4 | Z300: 0 | AA300: 343 | AB300: 296 | AC300: 115.87837837837837 | AD300: 12
A301: WILLIAMSTOWN | C301: 1 | D301: 0 | E301: =C301*6+D301 -> 6 | G301: 4 | H301: 5 | I301: =G301*6+H301 -> 29 | K301: 5 | L301: 6 | M301: =K301*6+L301 -> 36 | O301: 8 | P301: 10 | Q301: =O301*6+P301 -> 58 | S301: WILLIAMSTOWN | W301: NORTHCOTE | X301: 1 | Y301: 5 | Z301: 1 | AA301: 365 | AB301: 430 | AC301: 84.883720930232556 | AD301: 6
A302: NORTHCOTE | C302: 2 | D302: 6 | E302: =C302*6+D302 -> 18 | G302: 2 | H302: 6 | I302: =G302*6+H302 -> 18 | K302: 7 | L302: 7 | M302: =K302*6+L302 -> 49 | O302: 7 | P302: 8 | Q302: =O302*6+P302 -> 50 | S302: COLLINS | W302: BRIGHTON | X302: 1 | Y302: 5 | Z302: 1 | AA302: 368 | AB302: 502 | AC302: 73.30677290836654 | AD302: 6
A303: BEST PLAYERS | W303: ESSENDON ASSOC. | X303: 1 | Y303: 6 | Z303: 0 | AA303: 289 | AB303: 441 | AC303: 65.532879818594111 | AD303: 4
A304: WILLIAMSTOWN | D304: ALLEY | G304: WALLIS | J304: GIBBS | L304: McLEAN | N304: ANDERSON | Q304: HARDEN | W304: HAWTHORN | X304: 0 | Y304: 7 | Z304: 0 | AA304: 375 | AB304: 596 | AC304: 62.919463087248324 | AD304: 0
A305: NORTHCOTE | D305: CHESSWASS | G305: WILSON | J305: MILLS | L305: WELLS | N305: H THOMAS | Q305: A THOMAS
A306: GOALKICKERS
A307: WILLIAMSTOWN | D307: WALLIS 2 | G307: O'HALLORAN 2 | K307: HARDEN 2 | N307: WOUDA | P307: MITCHELL
A308: NORTHCOTE | D308: WILSON 2 | G308: DANIELS | I308: A THOMAS | L308: MARTIN | N308: BASSETT | P308: TEESDALE
A310: BRUNSWICK | C310: 1 | D310: 1 | E310: =C310*6+D310 -> 7 | G310: 3 | H310: 4 | I310: =G310*6+H310 -> 22 | K310: 9 | L310: 9 | M310: =K310*6+L310 -> 63 | O310: 11 | P310: 9 | Q310: =O310*6+P310 -> 75 | S310: BRUNSWICK
A311: BRIGHTON | C311: 1 | D311: 4 | E311: =C311*6+D311 -> 10 | G311: 1 | H311: 5 | I311: =G311*6+H311 -> 11 | K311: 1 | L311: 5 | M311: =K311*6+L311 -> 11 | O311: 3 | P311: 6 | Q311: =O311*6+P311 -> 24 | S311: McMURRAY
A312: BEST PLAYERS
A313: BRUNSWICK | D313: CHASE | G313: PRICE | J313: O'CONNOR | M313: CHANDLER | P313: HARKER | S313: GEORGE
A314: BRIGHTON | D314: HARBOARD | G314: TURNBULL | J314: R DAWSON | M314: WALLACE | P314: B BAILES | S314: BYRNE
A315: GOALKICKERS
A316: BRUNSWICK | D316: WOODS 2 | F316: STEVENSON 2 | I316: GEORGE 2 | K316: HARKER 2 | M316: BURMINGHAM | P316: PRICE | R316: WALKER
A317: BRIGHTON | D317: BYRNE | G317: FREEMAN | J317: BAYLISS
E319: 7TH JUNE | J319: WEATHER | M319: STRONG NORTH WIND
A320: NORTH MELBOURNE | C320: 2 | D320: 10 | E320: =C320*6+D320 -> 22 | G320: 4 | H320: 12 | I320: =G320*6+H320 -> 36 | K320: 4 | L320: 16 | M320: =K320*6+L320 -> 40 | O320: 8 | P320: 19 | Q320: =O320*6+P320 -> 67 | S320: NORTH MELB
A321: ESSENDON ASSOC. | C321: 1 | D321: 0 | E321: =C321*6+D321 -> 6 | G321: 2 | H321: 1 | I321: =G321*6+H321 -> 13 | K321: 2 | L321: 4 | M321: =K321*6+L321 -> 16 | O321: 3 | P321: 5 | Q321: =O321*6+P321 -> 23 | S321: KENDALL
A322: BEST PLAYERS
A323: NORTH MELBOURNE | D323: MILES | G323: CONDON | J323: BARKER | M323: HARDY | P323: CARPENTER | S323: CORNALL
A324: ESSENDON ASSOC. | D324: SEVIOR | G324: HOARE | J324: LEUNIG | M324: M MADDEN | P324: PAIN | S324: EBBOTT
A325: GOALKICKERS
A326: NORTH MELBOURNE | D326: MILES 4 | G326: CARPENTER 2 | K326: HARDY | M326: FRANKS
A327: ESSENDON ASSOC. | D327: CLARKE 3
A329: PRAHRAN | C329: 4 | D329: 4 | E329: =C329*6+D329 -> 28 | G329: 5 | H329: 7 | I329: =G329*6+H329 -> 37 | K329: 11 | L329: 8 | M329: =K329*6+L329 -> 74 | O329: 15 | P329: 9 | Q329: =O329*6+P329 -> 99 | S329: TOORAK PARK
A330: HAWTHORN | C330: 0 | D330: 3 | E330: =C330*6+D330 -> 3 | G330: 0 | H330: 10 | I330: =G330*6+H330 -> 10 | K330: 1 | L330: 13 | M330: =K330*6+L330 -> 19 | O330: 7 | P330: 16 | Q330: =O330*6+P330 -> 58 | S330: HURLEY
A331: BEST PLAYERS
A332: PRAHRAN | D332: V JONES | G332: WEIDNER | J332: WOODHEAD | M332: SIMS | P332: MORONEY | S332: DUFTY
A333: HAWTHORN | D333: L BRADY | G333: SORBY | J333: HOSKING | M333: WILKINSON | P333: FEWSTER | S333: GOUGH
A334: GOALKICKERS
A335: PRAHRAN | D335: V JONES 9 | G335: DOWSING 3 | J335: WOODHEAD | M335: CARLSON | P335: RYAN
A336: HAWTHORN | D336: HOSKING 4 | G336: FEWSTER 2 | J336: WILKINSON
A338: ROUND 8 | E338: 12TH JUNE | J338: WEATHER | M338: SOUTH WEST WIND SHOWERS | S338: PLAYED AT | X338: LADDER | AB338: ROUND | AD338: 8
D339: 1ST QTR | H339: 2ND QTR | L339: 3RD QTR | P339: FINAL | S339: WILLIAMSTOWN
A340: PRAHRAN | C340: 4 | D340: 4 | E340: =C340*6+D340 -> 28 | G340: 4 | H340: 4 | I340: =G340*6+H340 -> 28 | K340: 7 | L340: 9 | M340: =K340*6+L340 -> 51 | O340: 7 | P340: 9 | Q340: =O340*6+P340 -> 51 | S340: UMPIRE | W340: TEAM | X340: W | Y340: L | Z340: D | AA340: FOR | AB340: AGST | AC340: % | AD340: PTS
A341: WILLIAMSTOWN | C341: 0 | D341: 0 | E341: =C341*6+D341 -> 0 | G341: 2 | H341: 8 | I341: =G341*6+H341 -> 20 | K341: 2 | L341: 9 | M341: =K341*6+L341 -> 21 | O341: 4 | P341: 17 | Q341: =O341*6+P341 -> 41 | S341: McMURRAY
A342: BEST PLAYERS | W342: NORTH MELBOURNE | X342: 8 | Y342: 0 | Z342: 0 | AA342: 578 | AB342: 340 | AC342: 170 | AD342: 32
A343: PRAHRAN | D343: MORONEY | G343: QUINN | I343: V JONES | L343: DOWSING | O343: WEIDNER | Q343: WOODHEAD | W343: BRUNSWICK | X343: 7 | Y343: 1 | Z343: 0 | AA343: 517 | AB343: 376 | AC343: 137.5 | AD343: 28
A344: WILLIAMSTOWN | D344: AMY | G344: GIBBS | I344: MITCHELL | L344: DUNN | O344: McLEAN | Q344: MONK | W344: PRAHRAN | X344: 6 | Y344: 2 | Z344: 0 | AA344: 487 | AB344: 396 | AC344: 122.97979797979798 | AD344: 24
A345: GOALKICKERS | W345: PORT MELBOURNE | X345: 6 | Y345: 2 | Z345: 0 | AA345: 517 | AB345: 443 | AC345: 116.70428893905192 | AD345: 24
A346: PRAHRAN | D346: V JONES 4 | G346: QUINN | J346: KERR | L346: WOODS
A347: WILLIAMSTOWN | D347: GIBBS | G347: McLEAN | J347: N BUSBRIDGE | M347: AMY | W347: WILLIAMSTOWN | X347: 5 | Y347: 3 | Z347: 0 | AA347: 404 | AB347: 359 | AC347: 112.53481894150418 | AD347: 20
W348: FOOTSCRAY | X348: 3 | Y348: 5 | Z348: 0 | AA348: 382 | AB348: 350 | AC348: 109.14285714285714 | AD348: 12
A349: BRUNSWICK | C349: 3 | D349: 6 | E349: =C349*6+D349 -> 24 | G349: 4 | H349: 7 | I349: =G349*6+H349 -> 31 | K349: 7 | L349: 9 | M349: =K349*6+L349 -> 51 | O349: 7 | P349: 12 | Q349: =O349*6+P349 -> 54 | S349: FOOTSCRAY | W349: NORTHCOTE | X349: 1 | Y349: 6 | Z349: 1 | AA349: 420 | AB349: 492 | AC349: 85.365853658536579 | AD349: 6
A350: FOOTSCRAY | C350: 0 | D350: 2 | E350: =C350*6+D350 -> 2 | G350: 2 | H350: 3 | I350: =G350*6+H350 -> 15 | K350: 4 | L350: 4 | M350: =K350*6+L350 -> 28 | O350: 5 | P350: 9 | Q350: =O350*6+P350 -> 39 | S350: HURLEY | W350: BRIGHTON | X350: 1 | Y350: 6 | Z350: 1 | AA350: 412 | AB350: 588 | AC350: 70.068027210884352 | AD350: 6
A351: BEST PLAYERS | W351: ESSENDON ASSOC. | X351: 1 | Y351: 7 | Z351: 0 | AA351: 368 | AB351: 531 | AC351: 69.303201506591336 | AD351: 4
A352: BRUNSWICK | D352: GRIMSTER | G352: O'CONNOR | J352: CHASE | M352: WALKER | O352: BRAID | Q352: McLEOD | W352: HAWTHORN | X352: 1 | Y352: 7 | Z352: 0 | AA352: 465 | AB352: 675 | AC352: 68.888888888888886 | AD352: 4
A353: FOOTSCRAY | D353: CLARK | G353: COTTON | J353: CRADDOCK | M353: GILCHRIST | O353: GREGORY | Q353: PATTERSON
A354: GOALKICKERS
A355: BRUNSWICK | D355: HARKER 2 | G355: TOPHAM 2 | J355: SULLIVAN | M355: CHASE | P355: BRAID
A356: FOOTSCRAY | D356: CRADDOCK | G356: CROUCH | J356: CLARK | M356: THORPE | P356: McKENZIE
A358: PORT MELBOURNE | C358: 1 | D358: 2 | E358: =C358*6+D358 -> 8 | G358: 3 | H358: 5 | I358: =G358*6+H358 -> 23 | K358: 4 | L358: 5 | M358: =K358*6+L358 -> 29 | O358: 9 | P358: 8 | Q358: =O358*6+P358 -> 62 | S358: NORTHCOTE
A359: NORTHCOTE | C359: 5 | D359: 2 | E359: =C359*6+D359 -> 32 | G359: 8 | H359: 4 | I359: =G359*6+H359 -> 52 | K359: 8 | L359: 5 | M359: =K359*6+L359 -> 53 | O359: 8 | P359: 7 | Q359: =O359*6+P359 -> 55 | S359: KENDALL
A360: BEST PLAYERS
A361: PORT MELBOURNE | D361: CONDON | G361: BARKER | J361: HARDY | M361: FRANKS | P361: CORNALL | S361: RAWLE
A362: NORTHCOTE | D362: O'KEEFE | G362: WELLS | J362: FITZGERALD | M362: CHESSWASS | P362: GRAY | S362: BASSETT
A363: GOALKICKERS
A364: PORT MELBOURNE | D364: MERRICK 2 | G364: WALTON 2 | J364: O'BRIEN 2 | M364: UNIACKE | O364: McCONVILLE | R364: PREECE
A365: NORTHCOTE | D365: DANIELS 3 | G365: GOODALL | J365: CHESSWASS | M365: MILLS | O365: O'KEEFE | R365: JACKSON
A367: HAWTHORN | C367: 2 | D367: 2 | E367: =C367*6+D367 -> 14 | G367: 5 | H367: 8 | I367: =G367*6+H367 -> 38 | K367: 7 | L367: 8 | M367: =K367*6+L367 -> 50 | O367: 13 | P367: 12 | Q367: =O367*6+P367 -> 90 | S367: HAW
A368: ESSENDON ASSOC. | C368: 6 | D368: 3 | E368: =C368*6+D368 -> 39 | G368: 8 | H368: 4 | I368: =G368*6+H368 -> 52 | K368: 10 | L368: 14 | M368: =K368*6+L368 -> 74 | O368: 10 | P368: 19 | Q368: =O368*6+P368 -> 79 | S368: KNOWLES
A369: BEST PLAYERS
A370: HAWTHORN | D370: HOSKING | G370: GOUGH | J370: WILKINSON | M370: WOOLLEY | P370: FEWSTER | S370: DWYER
A371: ESSENDON ASSOC. | D371: GUBSON | G371: HOARE | J371: EBBOTT | M371: M MADDEN | P371: SEVIOR | S371: STROWNIX
A372: GOALKICKERS
A373: HAWTHORN | D373: HOSKING 3 | F373: FEWSTER 2 | I373: WILKINSON 2 | L373: SANDILANDS | O373: C BRADY | Q373: WOOLLEY | S373: GIESLER | V373: CHAPMAN | X373: GOUGH
A374: ESSENDON ASSOC. | D374: EBBOTT 2 | G374: WALKER 2 | J374: HOARE 2 | M374: M MADDEN 2 | P374: CLARKE | R374: GIBSON
A376: NORTH MELBOURNE | C376: 5 | D376: 3 | E376: =C376*6+D376 -> 33 | G376: 5 | H376: 7 | I376: =G376*6+H376 -> 37 | K376: 5 | L376: 13 | M376: =K376*6+L376 -> 43 | O376: 11 | P376: 20 | Q376: =O376*6+P376 -> 86 | S376: BRIGHTON BEACH
A377: BRIGHTON | C377: 2 | D377: 0 | E377: =C377*6+D377 -> 12 | G377: 2 | H377: 1 | I377: =G377*6+H377 -> 13 | K377: 6 | L377: 2 | M377: =K377*6+L377 -> 38 | O377: 7 | P377: 2 | Q377: =O377*6+P377 -> 44 | S377: HERBERT
A378: BEST PLAYERS
A379: NORTH MELBOURNE | D379: CONDON | G379: BARKER | J379: HARDY | M379: FRANKS | P379: CORNALL | S379: RAWLE
A380: BRIGHTON | D380: A DAWSON | G380: TURNBULL | J380: DOWDING | M380: BAYLISS | P380: B BAILES | S380: McCARTHY
A381: GOALKICKERS
A382: NORTH MELBOURNE | D382: CONDON 4 | G382: MILES 3 | J382: SPEAKMAN 2 | N382: JONES | P382: HAWKINS
A383: BRIGHTON | D383: TEESE | F383: TURNBULL | I383: BYRNE | K383: A DAWSON | N383: B BAILES | Q383: DOWDING | T383: KNIGHTON
A385: ROUND 9 | E385: 19TH JUNE | J385: WEATHER | M385: RAIN GROUNDS HEAVY | S385: PLAYED AT | X385: LADDER | AB385: ROUND | AD385: 9
D386: 1ST QTR | H386: 2ND QTR | L386: 3RD QTR | P386: FINAL | S386: NORTH MELB
A387: NORTH MELBOURNE | C387: 2 | D387: 6 | E387: =C387*6+D387 -> 18 | G387: 3 | H387: 9 | I387: =G387*6+H387 -> 27 | K387: 5 | L387: 14 | M387: =K387*6+L387 -> 44 | O387: 7 | P387: 15 | Q387: =O387*6+P387 -> 57 | S387: UMPIRE | W387: TEAM | X387: W | Y387: L | Z387: D | AA387: FOR | AB387: AGST | AC387: % | AD387: PTS
A388: PRAHRAN | C388: 0 | D388: 0 | E388: =C388*6+D388 -> 0 | G388: 1 | H388: 2 | I388: =G388*6+H388 -> 8 | K388: 2 | L388: 2 | M388: =K388*6+L388 -> 14 | O388: 2 | P388: 6 | Q388: =O388*6+P388 -> 18 | S388: HERBERT
A389: BEST PLAYERS | W389: NORTH MELBOURNE | X389: 9 | Y389: 0 | Z389: 0 | AA389: 635 | AB389: 358 | AC389: 177.37430167597765 | AD389: 36
A390: NORTH MELBOURNE | D390: BARKER | G390: HARDY | I390: FRANKS | L390: CORNALL | N390: CONDON | Q390: T JONES | W390: BRUNSWICK | X390: 8 | Y390: 1 | Z390: 0 | AA390: 588 | AB390: 415 | AC390: 141.68674698795181 | AD390: 32
A391: PRAHRAN | D391: MORONEY | G391: CARLSON | I391: DOWSING | L391: WOOD | N391: MAYNARD | Q391: SIMS | W391: PORT MELBOURNE | X391: 6 | Y391: 3 | Z391: 0 | AA391: 561 | AB391: 488 | AC391: 114.95901639344262 | AD391: 24
A392: GOALKICKERS | W392: PRAHRAN | X392: 6 | Y392: 3 | Z392: 0 | AA392: 505 | AB392: 453 | AC392: 111.47902869757175 | AD392: 24
A393: NORTH MELBOURNE | D393: CONDON 3 | G393: HAWKINS 2 | J393: WELLS | L393: FRANKS
A394: PRAHRAN | D394: V JONES | G394: WEIDNER | W394: WILLIAMSTOWN | X394: 6 | Y394: 3 | Z394: 0 | AA394: 449 | AB394: 403 | AC394: 111.41439205955335 | AD394: 24
W395: FOOTSCRAY | X395: 4 | Y395: 5 | Z395: 0 | AA395: 478 | AB395: 380 | AC395: 125.78947368421052 | AD395: 16
A396: WILLIAMSTOWN | C396: 1 | D396: 0 | E396: =C396*6+D396 -> 6 | G396: 3 | H396: 5 | I396: =G396*6+H396 -> 23 | K396: 5 | L396: 5 | M396: =K396*6+L396 -> 35 | O396: 6 | P396: 9 | Q396: =O396*6+P396 -> 45 | S396: PORT MELB | W396: ESSENDON ASSOC. | X396: 2 | Y396: 7 | Z396: 0 | AA396: 442 | AB396: 588 | AC396: 75.170068027210888 | AD396: 8
A397: PORT MELBOURNE | C397: 3 | D397: 3 | E397: =C397*6+D397 -> 21 | G397: 4 | H397: 4 | I397: =G397*6+H397 -> 28 | K397: 5 | L397: 7 | M397: =K397*6+L397 -> 37 | O397: 6 | P397: 8 | Q397: =O397*6+P397 -> 44 | S397: McMURRAY | W397: NORTHCOTE | X397: 1 | Y397: 7 | Z397: 1 | AA397: 459 | AB397: 563 | AC397: 81.52753108348135 | AD397: 6
A398: BEST PLAYERS | W398: BRIGHTON | X398: 1 | Y398: 7 | Z398: 1 | AA398: 469 | AB398: 662 | AC398: 70.845921450151053 | AD398: 6
A399: WILLIAMSTOWN | D399: ALLEY | G399: GIBBS | I399: MITCHELL | L399: ANDERSON | O399: DUNN | Q399: WALLIS | W399: HAWTHORN | X399: 1 | Y399: 8 | Z399: 0 | AA399: 495 | AB399: 771 | AC399: 64.202334630350194 | AD399: 4
A400: PORT MELBOURNE | D400: MERRICK | G400: WALTON | I400: BARFOOT | L400: O'BRIEN | O400: DANKS | Q400: MACKIE
A401: GOALKICKERS
A402: WILLIAMSTOWN | D402: MITCHELL 2 | G402: McLEAN | I402: HARDEN | L402: MONK | N402: LEE
A403: PORT MELBOURNE | D403: MERRICK 3 | G403: GOTZ | I403: WALTON | L403: McMAHON
A405: BRUNSWICK | C405: 3 | D405: 1 | E405: =C405*6+D405 -> 19 | G405: 5 | H405: 1 | I405: =G405*6+H405 -> 31 | K405: 10 | L405: 4 | M405: =K405*6+L405 -> 64 | O405: 11 | P405: 5 | Q405: =O405*6+P405 -> 71 | S405: BRUNSWICK
A406: NORTHCOTE | C406: 1 | D406: 3 | E406: =C406*6+D406 -> 9 | G406: 2 | H406: 3 | I406: =G406*6+H406 -> 15 | K406: 2 | L406: 6 | M406: =K406*6+L406 -> 18 | O406: 4 | P406: 15 | Q406: =O406*6+P406 -> 39 | S406: KENDALL
A407: BEST PLAYERS
A408: BRUNSWICK | D408: CHANDLER | G408: O'CONNOR | J408: SULLIVAN | M408: STEVENSON | P408: HARKER | R408: TOPHAM
A409: NORTHCOTE | D409: O'KEEFE | G409: MILLS | J409: CHESSWASS | M409: A THOMAS | P409: MARTIN | R409: BASSETT
A410: GOALKICKERS
A411: BRUNSWICK | D411: McKENZIE 2 | G411: TOPHAM 2 | J411: HARKER 2 | M411: STEVENSON | P411: CHASE | R411: SULLIVAN | V411: McLEAN | X411: BRAID
A412: NORTHCOTE | D412: A THOMAS 2 | G412: CARROLL | J412: MILLS
A414: ESSENDON ASSOC. | C414: 1 | D414: 5 | E414: =C414*6+D414 -> 11 | G414: 4 | H414: 6 | I414: =G414*6+H414 -> 30 | K414: 7 | L414: 11 | M414: =K414*6+L414 -> 53 | O414: 10 | P414: 14 | Q414: =O414*6+P414 -> 74 | S414: ESSENDON
A415: BRIGHTON | C415: 0 | D415: 1 | E415: =C415*6+D415 -> 1 | G415: 3 | H415: 4 | I415: =G415*6+H415 -> 22 | K415: 4 | L415: 4 | M415: =K415*6+L415 -> 28 | O415: 8 | P415: 9 | Q415: =O415*6+P415 -> 57 | S415: HURLEY
A416: BEST PLAYERS
A417: ESSENDON ASSOC. | D417: SEVIOR | G417: STROWNIX | J417: KEMP | M417: HOARE | O417: MATTHEWS | R417: WALKER
A418: BRIGHTON | D418: BAYLISS | G418: WILSON | J418: McCARTHY | M418: BYRNE | O418: TURNBULL | R418: B BAILES
A419: GOALKICKERS
A420: ESSENDON ASSOC. | D420: MATTHEWS 3 | G420: STROWNIX 2 | J420: SEVIOR 2 | M420: KEMP | O420: MANGAN | Q420: WALKER
A421: BRIGHTON | D421: BAYLISS 5 | G421: GRAHAM | J421: TEESE | L421: DOWDING
A423: FOOTSCRAY | C423: 2 | D423: 1 | E423: =C423*6+D423 -> 13 | G423: 6 | H423: 7 | I423: =G423*6+H423 -> 43 | K423: 9 | L423: 8 | M423: =K423*6+L423 -> 62 | O423: 14 | P423: 12 | Q423: =O423*6+P423 -> 96 | S423: HAW
A424: HAWTHORN | C424: 1 | D424: 5 | E424: =C424*6+D424 -> 11 | G424: 1 | H424: 5 | I424: =G424*6+H424 -> 11 | K424: 2 | L424: 9 | M424: =K424*6+L424 -> 21 | O424: 3 | P424: 12 | Q424: =O424*6+P424 -> 30 | S424: ALLEY
A425: BEST PLAYERS
A426: FOOTSCRAY | D426: McKENZIE | G426: CROUCH | J426: COTTON | M426: SAMSON | O426: BRIESE | R426: FORD
A427: HAWTHORN | D427: CHAPMAN | G427: GOUGH | J427: L BRADY | M427: HOLLAND | O427: CORNELL | R427: FEWSTER
A428: GOALKICKERS
A429: FOOTSCRAY | D429: McKENZIE 5 | G429: GREGORY 4 | J429: CROUCH 4 | M429: BARKER
A430: HAWTHORN | D430: DOOLAN | G430: FEWSTER | J430: HOSKING
A432: ROUND 10 | E432: 26TH JUNE | J432: WEATHER | M432: SOUTH WIND SHOWERS | S432: PLAYED AT | X432: LADDER | AB432: ROUND | AD432: 10
D433: 1ST QTR | H433: 2ND QTR | L433: 3RD QTR | P433: FINAL | S433: PORT MELB
A434: NORTH MELBOURNE | C434: 0 | D434: 1 | E434: =C434*6+D434 -> 1 | G434: 1 | H434: 7 | I434: =G434*6+H434 -> 13 | K434: 6 | L434: 10 | M434: =K434*6+L434 -> 46 | O434: 9 | P434: 13 | Q434: =O434*6+P434 -> 67 | S434: UMPIRE | W434: TEAM | X434: W | Y434: L | Z434: D | AA434: FOR | AB434: AGST | AC434: % | AD434: PTS
A435: PORT MELBOURNE | C435: 3 | D435: 1 | E435: =C435*6+D435 -> 19 | G435: 4 | H435: 2 | I435: =G435*6+H435 -> 26 | K435: 4 | L435: 4 | M435: =K435*6+L435 -> 28 | O435: 4 | P435: 5 | Q435: =O435*6+P435 -> 29 | S435: KENDALL
A436: BEST PLAYERS | W436: NORTH MELBOURNE | X436: 10 | Y436: 0 | Z436: 0 | AA436: 702 | AB436: 387 | AC436: 181.3953488372093 | AD436: 40
A437: NORTH MELBOURNE | D437: BARKER | G437: HARDY | I437: FRANKS | L437: GARDINER | O437: CARPENTER | R437: RAWLE | W437: BRUNSWICK | X437: 9 | Y437: 1 | Z437: 0 | AA437: 649 | AB437: 461 | AC437: 140.78091106290671 | AD437: 36
A438: PORT MELBOURNE | D438: BARFOOT | G438: RYAN | I438: CLELAND | L438: MERRICK | O438: FRANKLIN | R438: GOTZ | W438: WILLIAMSTOWN | X438: 7 | Y438: 3 | Z438: 0 | AA438: 543 | AB438: 433 | AC438: 125.40415704387991 | AD438: 28
A439: GOALKICKERS | W439: PORT MELBOURNE | X439: 6 | Y439: 4 | Z439: 0 | AA439: 590 | AB439: 555 | AC439: 106.30630630630631 | AD439: 24
A440: NORTH MELBOURNE | D440: HARDY 4 | G440: CARPENTER 2 | K440: WELLS | M440: MILES | O440: CONDON
A441: PORT MELBOURNE | D441: MERRICK 2 | G441: GOTZ | J441: BARFOOT | W441: PRAHRAN | X441: 6 | Y441: 4 | Z441: 0 | AA441: 564 | AB441: 536 | AC441: 105.22388059701493 | AD441: 24
W442: FOOTSCRAY | X442: 5 | Y442: 5 | Z442: 0 | AA442: 561 | AB442: 439 | AC442: 127.79043280182232 | AD442: 20
A443: FOOTSCRAY | C443: 3 | D443: 2 | E443: =C443*6+D443 -> 20 | G443: 6 | H443: 3 | I443: =G443*6+H443 -> 39 | K443: 8 | L443: 5 | M443: =K443*6+L443 -> 53 | O443: 12 | P443: 11 | Q443: =O443*6+P443 -> 83 | S443: TOORAK PARK | W443: NORTHCOTE | X443: 2 | Y443: 7 | Z443: 1 | AA443: 532 | AB443: 607 | AC443: 87.644151565074139 | AD443: 10
A444: PRAHRAN | C444: 3 | D444: 2 | E444: =C444*6+D444 -> 20 | G444: 4 | H444: 8 | I444: =G444*6+H444 -> 32 | K444: 5 | L444: 14 | M444: =K444*6+L444 -> 44 | O444: 7 | P444: 17 | Q444: =O444*6+P444 -> 59 | S444: GEDDES | W444: ESSENDON ASSOC. | X444: 2 | Y444: 8 | Z444: 0 | AA444: 488 | AB444: 649 | AC444: 75.192604006163322 | AD444: 8
A445: BEST PLAYERS | W445: BRIGHTON | X445: 1 | Y445: 8 | Z445: 1 | AA445: 499 | AB445: 756 | AC445: 66.005291005290999 | AD445: 6
A446: FOOTSCRAY | D446: PATTERSON | G446: CRADDOCK | J446: GREGROY | M446: COTTON | P446: GILCHRIST | R446: CROUCH | W446: HAWTHORN | X446: 1 | Y446: 9 | Z446: 0 | AA446: 539 | AB446: 844 | AC446: 63.862559241706158 | AD446: 4
A447: PRAHRAN | D447: V JONES | G447: MORONEY | J447: WOODS | M447: DOWSING | P447: QUINN | R447: CARLSON
A448: GOALKICKERS
A449: FOOTSCRAY | D449: CRADDOCK 3 | G449: GREGORY 3 | J449: CROUCH 3 | M449: COTTON 2 | P449: GILCHRIST
A450: PRAHRAN | D450: MORONEY 3 | G450: WOODS 2 | J450: WEIDNER | M450: SIMS
A452: NORTHCOTE | C452: 3 | D452: 4 | E452: =C452*6+D452 -> 22 | G452: 5 | H452: 6 | I452: =G452*6+H452 -> 36 | K452: 7 | L452: 10 | M452: =K452*6+L452 -> 52 | O452: 10 | P452: 13 | Q452: =O452*6+P452 -> 73 | S452: NORTHCOTE
A453: HAWTHORN | C453: 3 | D453: 1 | E453: =C453*6+D453 -> 19 | G453: 5 | H453: 2 | I453: =G453*6+H453 -> 32 | K453: 6 | L453: 6 | M453: =K453*6+L453 -> 42 | O453: 6 | P453: 8 | Q453: =O453*6+P453 -> 44 | S453: ALLEY
A454: BEST PLAYERS
A455: NORTHCOTE | D455: MARTIN | G455: DANIELS | J455: O'KEEFE | M455: A THOMAS | P455: WELLS | S455: BASSETT
A456: HAWTHORN | D456: WOOLLEY | G456: GOUGH | J456: LARKIN | M456: FEWSTER | P456: DUFF | S456: L BRADY
A457: GOALKICKERS
A458: NORTHCOTE | D458: DANIELS 3 | G458: O'KEEFE 2 | J458: MARTIN 2 | M458: JACKSON 2 | P458: A THOMAS
A459: HAWTHORN | D459: DOOLAN 2 | G459: FEWSTER | J459: DWYER | M459: HOSKING | P459: GOUGH
A461: BRUNSWICK | C461: 3 | D461: 6 | E461: =C461*6+D461 -> 24 | G461: 4 | H461: 8 | I461: =G461*6+H461 -> 32 | K461: 6 | L461: 10 | M461: =K461*6+L461 -> 46 | O461: 8 | P461: 13 | Q461: =O461*6+P461 -> 61 | S461: BRUNSWICK
A462: ESSENDON ASSOC. | C462: 1 | D462: 2 | E462: =C462*6+D462 -> 8 | G462: 2 | H462: 5 | I462: =G462*6+H462 -> 17 | K462: 4 | L462: 7 | M462: =K462*6+L462 -> 31 | O462: 6 | P462: 10 | Q462: =O462*6+P462 -> 46 | S462: HERBERT
A463: BEST PLAYERS
A464: BRUNSWICK | D464: WALKER | G464: O'CONNOR | J464: CHANDLER | M464: ROSS | P464: GEORGE | S464: SWIFT
A465: ESSENDON ASSOC. | D465: PAIN | G465: STROWNIX | J465: M MADDEN | M465: KEMP | P465: SEVIOR | S465: EBBOTT
A466: GOALKICKERS
A467: BRUNSWICK | D467: HARKER 4 | G467: SULLIVAN | J467: WOODS | L467: BURNINGHAM | O467: TOPHAM
A468: ESSENDON ASSOC. | D468: HOARE 2 | G468: EBBOTT | I468: MITCHELL | L468: MATTHEWS | O468: LATIMER
A470: WILLIAMSTOWN | C470: 5 | D470: 3 | E470: =C470*6+D470 -> 33 | G470: 6 | H470: 5 | I470: =G470*6+H470 -> 41 | K470: 11 | L470: 6 | M470: =K470*6+L470 -> 72 | O470: 14 | P470: 10 | Q470: =O470*6+P470 -> 94 | S470: WILLIAMSTOWN
A471: BRIGHTON | C471: 0 | D471: 0 | E471: =C471*6+D471 -> 0 | G471: 2 | H471: 3 | I471: =G471*6+H471 -> 15 | K471: 2 | L471: 3 | M471: =K471*6+L471 -> 15 | O471: 4 | P471: 6 | Q471: =O471*6+P471 -> 30 | S471: HURLEY
A472: BEST PLAYERS
A473: WILLIAMSTOWN | D473: LEE | G473: WALLIS | J473: MONK | M473: DUNN | P473: ANDERSON | S473: MITCHELL
A474: BRIGHTON | D474: REESE | G474: DOWDING | J474: TURNBULL | M474: GRAHAM | P474: HARBOARD | S474: WILSON
A475: GOALKICKERS
A476: WILLIAMSTOWN | D476: McLEAN 4 | G476: E BUSBRIDGE 3 | J476: ANDERSON | M476: LEE | N476: HARDEN | P476: GIBBS | R476: MITCHELL | U476: DUNN | W476: N BUSBRIDGE
A477: BRIGHTON | D477: TAYLOR | G477: HARBOARD | J477: BYRNE | L477: ELDRED
A479: ROUND 11 | E479: 3RD JULY | J479: WEATHER | M479: NORTH WEST WIND | S479: PLAYED AT | X479: LADDER | AB479: ROUND | AD479: 11
D480: 1ST QTR | H480: 2ND QTR | L480: 3RD QTR | P480: FINAL | S480: NORTH MELB
A481: NORTH MELBOURNE | C481: 2 | D481: 0 | E481: =C481*6+D481 -> 12 | G481: 3 | H481: 3 | I481: =G481*6+H481 -> 21 | K481: 5 | L481: 6 | M481: =K481*6+L481 -> 36 | O481: 7 | P481: 11 | Q481: =O481*6+P481 -> 53 | S481: UMPIRE | W481: TEAM | X481: W | Y481: L | Z481: D | AA481: FOR | AB481: AGST | AC481: % | AD481: PTS
A482: WILLIAMSTOWN | C482: 1 | D482: 2 | E482: =C482*6+D482 -> 8 | G482: 1 | H482: 3 | I482: =G482*6+H482 -> 9 | K482: 2 | L482: 5 | M482: =K482*6+L482 -> 17 | O482: 4 | P482: 5 | Q482: =O482*6+P482 -> 29 | S482: HURLEY
A483: BEST PLAYERS | W483: NORTH MELBOURNE | X483: 11 | Y483: 0 | Z483: 0 | AA483: 755 | AB483: 416 | AC483: 181.49038461538461 | AD483: 44
A484: NORTH MELBOURNE | D484: DICK | G484: BARKER | I484: CORNALL | L484: CAVE | N484: FRANKS | Q484: RAWLE | W484: BRUNSWICK | X484: 10 | Y484: 1 | Z484: 0 | AA484: 726 | AB484: 495 | AC484: 146.66666666666666 | AD484: 40
A485: WILLIAMSTOWN | D485: ALLEY | G485: DUNN | I485: HARRISON | L485: GIBBS | N485: MITCHELL | Q485: HARDEN | W485: WILLIAMSTOWN | X485: 7 | Y485: 4 | Z485: 0 | AA485: 572 | AB485: 486 | AC485: 117.6954732510288 | AD485: 28
A486: GOALKICKERS | W486: PORT MELBOURNE | X486: 7 | Y486: 4 | Z486: 0 | AA486: 690 | AB486: 608 | AC486: 113.48684210526316 | AD486: 28
A487: NORTH MELBOURNE | D487: DICK 4 | G487: HARDY | J487: HAWKINS | M487: CORNALL
A488: WILLIAMSTOWN | D488: HARDEN 2 | G488: GIBBS | J488: MONK | W488: PRAHRAN | X488: 7 | Y488: 4 | Z488: 0 | AA488: 607 | AB488: 572 | AC488: 106.11888111888112 | AD488: 28
W489: FOOTSCRAY | X489: 6 | Y489: 5 | Z489: 0 | AA489: 657 | AB489: 500 | AC489: 131.4 | AD489: 24
A490: FOOTSCRAY | C490: 2 | D490: 1 | E490: =C490*6+D490 -> 13 | G490: 7 | H490: 3 | I490: =G490*6+H490 -> 45 | K490: 10 | L490: 3 | M490: =K490*6+L490 -> 63 | O490: 14 | P490: 12 | Q490: =O490*6+P490 -> 96 | S490: FOOTSCRAY | W490: NORTHCOTE | X490: 2 | Y490: 8 | Z490: 1 | AA490: 593 | AB490: 703 | AC490: 84.352773826458034 | AD490: 10
A491: NORTHCOTE | C491: 3 | D491: 6 | E491: =C491*6+D491 -> 24 | G491: 3 | H491: 8 | I491: =G491*6+H491 -> 26 | K491: 8 | L491: 12 | M491: =K491*6+L491 -> 60 | O491: 8 | P491: 13 | Q491: =O491*6+P491 -> 61 | S491: GREEN | W491: ESSENDON ASSOC. | X491: 2 | Y491: 9 | Z491: 0 | AA491: 524 | AB491: 692 | AC491: 75.72254335260115 | AD491: 8
A492: BEST PLAYERS | W492: BRIGHTON | X492: 1 | Y492: 9 | Z492: 1 | AA492: 552 | AB492: 856 | AC492: 64.485981308411212 | AD492: 6
A493: FOOTSCRAY | D493: COTTON | G493: CROUCH | J493: GREGORY | M493: BRIESE | O493: CLARK | Q493: GILCHRIST | W493: HAWTHORN | X493: 1 | Y493: 10 | Z493: 0 | AA493: 573 | AB493: 921 | AC493: 62.214983713355046 | AD493: 4
A494: NORTHCOTE | D494: A THOMAS | G494: CHESSWASS | J494: MILLS | M494: MARTIN | O494: BASSETT | Q494: O'KEEFE
A495: GOALKICKERS
A496: FOOTSCRAY | D496: CROUCH 3 | F496: COTTON 3 | I496: GILCHRIST 2 | L496: GREGORY 2 | N496: BRIESE | P496: CLARK | R496: SPENCE | U496: PATTERSON
A497: NORTHCOTE | D497: MARTIN 2 | G497: WILSON 2 | J497: BASSETT 2 | M497: VERNON | O497: A THOMAS
A499: PRAHRAN | C499: 0 | D499: 3 | E499: =C499*6+D499 -> 3 | G499: 1 | H499: 9 | I499: =G499*6+H499 -> 15 | K499: 3 | L499: 11 | M499: =K499*6+L499 -> 29 | O499: 5 | P499: 13 | Q499: =O499*6+P499 -> 43 | S499: ESSENDON
A500: ESSENDON ASSOC. | C500: 1 | D500: 3 | E500: =C500*6+D500 -> 9 | G500: 3 | H500: 3 | I500: =G500*6+H500 -> 21 | K500: 5 | L500: 4 | M500: =K500*6+L500 -> 34 | O500: 5 | P500: 6 | Q500: =O500*6+P500 -> 36 | S500: McMURRAY
A501: BEST PLAYERS
A502: PRAHRAN | D502: WEIDNER | G502: WOODHEAD | J502: CARLSON | M502: DOWSING | P502: KERR | S502: WOODS
A503: ESSENDON ASSOC. | D503: PAIN | G503: EBBOTT | J503: MATTHEWS | M503: WALKER | P503: MITCHELL | S503: STROWNIX
A504: GOALKICKERS
A505: PRAHRAN | D505: DOWSING 2 | G505: WOODS 2 | J505: KERR
A506: ESSENDON ASSOC. | D506: LATIMER 2 | G506: HOARE | J506: PAIN | L506: WALKER
A508: PORT MELBOURNE | C508: 3 | D508: 4 | E508: =C508*6+D508 -> 22 | G508: 5 | H508: 7 | I508: =G508*6+H508 -> 37 | K508: 7 | L508: 13 | M508: =K508*6+L508 -> 55 | O508: 14 | P508: 16 | Q508: =O508*6+P508 -> 100 | S508: BRIGHTON BEACH
A509: BRIGHTON | C509: 0 | D509: 0 | E509: =C509*6+D509 -> 0 | G509: 3 | H509: 1 | I509: =G509*6+H509 -> 19 | K509: 4 | L509: 3 | M509: =K509*6+L509 -> 27 | O509: 8 | P509: 5 | Q509: =O509*6+P509 -> 53 | S509: ALLEY
A510: BEST PLAYERS
A511: PORT MELBOURNE | D511: MERRICK | G511: CLELAND | J511: DANKS | M511: FRANKLIN | P511: WALTON | S511: McNEIL
A512: BRIGHTON | D512: WALLACE | G512: WILSON | J512: BYRNE | M512: GRAHAM | P512: B BAILES | S512: TEESE
A513: GOALKICKERS
A514: PORT MELBOURNE | D514: MERRICK 10 | G514: BARFOOT 2 | J514: STRECKFUSS | M514: DANKS
A515: BRIGHTON | D515: McCARTHY 3 | G515: WALL 2 | J515: WILSON | M515: TAYLOR | P515: BYRNE
A517: BRUNSWICK | C517: 1 | D517: 2 | E517: =C517*6+D517 -> 8 | G517: 2 | H517: 8 | I517: =G517*6+H517 -> 20 | K517: 7 | L517: 12 | M517: =K517*6+L517 -> 54 | O517: 10 | P517: 17 | Q517: =O517*6+P517 -> 77 | S517: HAW
A518: HAWTHORN | C518: 1 | D518: 3 | E518: =C518*6+D518 -> 9 | G518: 2 | H518: 4 | I518: =G518*6+H518 -> 16 | K518: 3 | L518: 6 | M518: =K518*6+L518 -> 24 | O518: 4 | P518: 10 | Q518: =O518*6+P518 -> 34 | S518: KENDALL
A519: BEST PLAYERS
A520: BRUNSWICK | D520: BROOM | G520: BRAID | J520: WALKER | M520: O'CONNOR | P520: CHASE | S520: STEVENSON
A521: HAWTHORN | D521: HOLLAND | G521: LARKIN | J521: WOOLLEY | M521: GOUGH | P521: CHAPMAN | S521: ANTONIE
A522: GOALKICKERS
A523: BRUNSWICK | D523: TOPHAM 4 | G523: HARKER 3 | J523: CHASE | L523: SULLIVAN | O523: WOODS
A524: HAWTHORN | D524: HOLLAND | G524: HOSKING | J524: GIBB | L524: CHAPMAN
A526: ROUND 12 | E526: 10TH JULY | J526: WEATHER | M526: NORTH WIND RAIN | S526: PLAYED AT | X526: LADDER | AB526: ROUND | AD526: 12
D527: 1ST QTR | H527: 2ND QTR | L527: 3RD QTR | P527: FINAL | S527: NORTH MELB
A528: NORTH MELBOURNE | C528: 0 | D528: 0 | E528: =C528*6+D528 -> 0 | G528: 3 | H528: 2 | I528: =G528*6+H528 -> 20 | K528: 4 | L528: 2 | M528: =K528*6+L528 -> 26 | O528: 8 | P528: 8 | Q528: =O528*6+P528 -> 56 | S528: UMPIRE | W528: TEAM | X528: W | Y528: L | Z528: D | AA528: FOR | AB528: AGST | AC528: % | AD528: PTS
A529: BRUNSWICK | C529: 1 | D529: 3 | E529: =C529*6+D529 -> 9 | G529: 2 | H529: 6 | I529: =G529*6+H529 -> 18 | K529: 3 | L529: 10 | M529: =K529*6+L529 -> 28 | O529: 4 | P529: 12 | Q529: =O529*6+P529 -> 36 | S529: HERBERT
A530: BEST PLAYERS | W530: NORTH MELBOURNE | X530: 12 | Y530: 0 | Z530: 0 | AA530: 811 | AB530: 452 | AC530: 179.42477876106196 | AD530: 48
A531: NORTH MELBOURNE | D531: HARDY | G531: BARKER | J531: CAVE | L531: FRANKS | N531: SPEAKMAN | Q531: CARPENTER | W531: BRUNSWICK | X531: 10 | Y531: 2 | Z531: 0 | AA531: 762 | AB531: 551 | AC531: 138.2940108892922 | AD531: 40
A532: BRUNSWICK | D532: BRAID | G532: GRIMSTER | J532: CHASE | L532: PRICE | N532: O'CONNOR | Q532: SWIFT | W532: PORT MELBOURNE | X532: 8 | Y532: 4 | Z532: 0 | AA532: 823 | AB532: 647 | AC532: 127.20247295208655 | AD532: 32
A533: GOALKICKERS | W533: WILLIAMSTOWN | X533: 8 | Y533: 4 | Z533: 0 | AA533: 639 | AB533: 527 | AC533: 121.25237191650854 | AD533: 32
A534: NORTH MELBOURNE | D534: WELLS 2 | F534: HAWKINS | I534: RAWLE | K534: DICK | L534: SPEAKMAN | N534: CARPENTER | Q534: BARKER
A535: BRUNSWICK | D535: HARKER 2 | G535: PRICE | J535: BURNINGHAM | W535: PRAHRAN | X535: 7 | Y535: 4 | Z535: 1 | AA535: 665 | AB535: 630 | AC535: 105.55555555555556 | AD535: 30
W536: FOOTSCRAY | X536: 7 | Y536: 5 | Z536: 0 | AA536: 778 | AB536: 544 | AC536: 143.01470588235293 | AD536: 28
A537: PRAHRAN | C537: 3 | D537: 1 | E537: =C537*6+D537 -> 19 | G537: 5 | H537: 2 | I537: =G537*6+H537 -> 32 | K537: 7 | L537: 7 | M537: =K537*6+L537 -> 49 | O537: 8 | P537: 10 | Q537: =O537*6+P537 -> 58 | S537: TOORAK PARK | W537: NORTHCOTE | X537: 2 | Y537: 8 | Z537: 2 | AA537: 651 | AB537: 761 | AC537: 85.545335085413925 | AD537: 12
A538: NORTHCOTE | C538: 3 | D538: 3 | E538: =C538*6+D538 -> 21 | G538: 5 | H538: 5 | I538: =G538*6+H538 -> 35 | K538: 7 | L538: 6 | M538: =K538*6+L538 -> 48 | O538: 8 | P538: 10 | Q538: =O538*6+P538 -> 58 | S538: KENDALL | W538: ESSENDON ASSOC. | X538: 2 | Y538: 10 | Z538: 0 | AA538: 565 | AB538: 759 | AC538: 74.440052700922266 | AD538: 8
A539: BEST PLAYERS | W539: BRIGHTON | X539: 1 | Y539: 10 | Z539: 1 | AA539: 596 | AB539: 977 | AC539: 61.003070624360284 | AD539: 6
A540: PRAHRAN | D540: MORONEY | G540: WEIDNER | I540: KERR | L540: DOWSING | N540: CARLSON | Q540: DUFTY | W540: HAWTHORN | X540: 1 | Y540: 11 | Z540: 0 | AA540: 612 | AB540: 1054 | AC540: 58.064516129032256 | AD540: 4
A541: NORTHCOTE | D541: CHESSWASS | G541: MILLS | I541: BASSETT | L541: JACKSON | N541: VERNON | Q541: MARTIN
A542: GOALKICKERS
A543: PRAHRAN | D543: MORONEY 2 | G543: WOODS 2 | J543: V JONES | L543: KERR | N543: DOWSING | Q543: WEIDNER
A544: NORTHCOTE | D544: JACKSON 3 | G544: VERNON 2 | J544: A THOMAS | M544: WILSON | O544: BASSETT
A546: WILLIAMSTOWN | C546: 2 | D546: 0 | E546: =C546*6+D546 -> 12 | G546: 4 | H546: 3 | I546: =G546*6+H546 -> 27 | K546: 7 | L546: 5 | M546: =K546*6+L546 -> 47 | O546: 10 | P546: 7 | Q546: =O546*6+P546 -> 67 | S546: WILLIAMSTOWN
A547: ESSENDON ASSOC. | C547: 2 | D547: 2 | E547: =C547*6+D547 -> 14 | G547: 3 | H547: 6 | I547: =G547*6+H547 -> 24 | K547: 4 | L547: 7 | M547: =K547*6+L547 -> 31 | O547: 5 | P547: 11 | Q547: =O547*6+P547 -> 41 | S547: McMURRAY
A548: BEST PLAYERS
A549: WILLIAMSTOWN | D549: BROWN | G549: MITCHELL | J549: MONK | M549: ALLEY | P549: WOUDA | S549: O'HALLORAN
A550: ESSENDON ASSOC. | D550: STROWNIX | G550: SEVIOR | J550: M MADDEN | M550: WALKER | P550: EBBOTT | S550: HOARE
A551: GOALKICKERS
A552: WILLIAMSTOWN | D552: N BUSBRIDGE 3 | H552: GIBBS 2 | J552: WOUDA 2 | M552: MITCHELL | P552: ADAMS
A553: ESSENDON ASSOC. | D553: WALKER | G553: EBBOTT | J553: LATIMER | M553: GIBSON | P553: HOARE
A555: FOOTSCRAY | C555: 2 | D555: 3 | E555: =C555*6+D555 -> 15 | G555: 10 | H555: 7 | I555: =G555*6+H555 -> 67 | K555: 14 | L555: 8 | M555: =K555*6+L555 -> 92 | O555: 18 | P555: 13 | Q555: =O555*6+P555 -> 121 | S555: BRIGHTON BEACH
A556: BRIGHTON | C556: 2 | D556: 3 | E556: =C556*6+D556 -> 15 | G556: 2 | H556: 4 | I556: =G556*6+H556 -> 16 | K556: 4 | L556: 9 | M556: =K556*6+L556 -> 33 | O556: 5 | P556: 14 | Q556: =O556*6+P556 -> 44 | S556: HURLEY
A557: BEST PLAYERS
A558: FOOTSCRAY | D558: GILCHRIST | G558: PATTERSON | J558: SPENCE | M558: CLARK | P558: CROUCH | S558: COTTON
A559: BRIGHTON | D559: BYRNE | G559: WALLACE | J559: WILSON | M559: GRAHAM | P559: McCARTHY | S559: SMITH
A560: GOALKICKERS
A561: FOOTSCRAY | D561: SPENCE 6 | G561: GILCHRIST 4 | J561: CROUCH 2 | M561: COTTON 2 | P561: CLARK 2 | R561: JONES | U561: GREGORY
A562: BRIGHTON | D562: STEWART | G562: DOWDING | J562: DAWSON | L562: GRAHAM | O562: McCARTHY
A564: PORT MELBOURNE | C564: 5 | D564: 5 | E564: =C564*6+D564 -> 35 | G564: 9 | H564: 8 | I564: =G564*6+H564 -> 62 | K564: 15 | L564: 15 | M564: =K564*6+L564 -> 105 | O564: 19 | P564: 19 | Q564: =O564*6+P564 -> 133 | S564: PORT MELB
A565: HAWTHORN | C565: 2 | D565: 2 | E565: =C565*6+D565 -> 14 | G565: 2 | H565: 6 | I565: =G565*6+H565 -> 18 | K565: 2 | L565: 6 | M565: =K565*6+L565 -> 18 | O565: 5 | P565: 9 | Q565: =O565*6+P565 -> 39 | S565: ALLEY
A566: BEST PLAYERS
A567: PORT MELBOURNE | D567: WALTON | G567: MERRICK | J567: RYAN | M567: CLELAND | P567: BARFOOT | S567: STRECKFUSS
A568: HAWTHORN | D568: HOSKING | G568: WOOLLEY | J568: ANTONIE | M568: GOUGH | P568: FEWSTER
A569: GOALKICKERS
A570: PORT MELBOURNE | D570: WALTON 5 | G570: MERRICK 4 | J570: O'BRIEN 2 | M570: McCONVILLE 2 | P570: CLELAND 2 | S570: BARFOOT 2 | W570: STRECKFUSS 2
A571: HAWTHORN | D571: HOSKING 2 | G571: FEWSTER | J571: HOLLAND | M571: GOUGH
A573: ROUND 13 | E573: 17TH JULY | J573: WEATHER | M573: FINE | S573: PLAYED AT | X573: LADDER | AB573: ROUND | AD573: 13
D574: 1ST QTR | H574: 2ND QTR | L574: 3RD QTR | P574: FINAL | S574: BRUNSWICK
A575: PRAHRAN | C575: 5 | D575: 5 | E575: =C575*6+D575 -> 35 | G575: 6 | H575: 8 | I575: =G575*6+H575 -> 44 | K575: 8 | L575: 8 | M575: =K575*6+L575 -> 56 | O575: 8 | P575: 11 | Q575: =O575*6+P575 -> 59 | S575: UMPIRE | W575: TEAM | X575: W | Y575: L | Z575: D | AA575: FOR | AB575: AGST | AC575: % | AD575: PTS
A576: BRUNSWICK | C576: 2 | D576: 4 | E576: =C576*6+D576 -> 16 | G576: 5 | H576: 9 | I576: =G576*6+H576 -> 39 | K576: 6 | L576: 10 | M576: =K576*6+L576 -> 46 | O576: 7 | P576: 11 | Q576: =O576*6+P576 -> 53 | S576: HURLEY
A577: BEST PLAYERS | W577: NORTH MELBOURNE | X577: 13 | Y577: 0 | Z577: 0 | AA577: 883 | AB577: 490 | AC577: 180.20408163265307 | AD577: 52
A578: PRAHRAN | D578: WEIDNER | G578: V JONES | I578: SIMS | L578: MAYNARD | O578: ELLIN | Q578: KERR | W578: BRUNSWICK | X578: 10 | Y578: 3 | Z578: 0 | AA578: 815 | AB578: 610 | AC578: 133.60655737704917 | AD578: 40
A579: BRUNSWICK | D579: CHASE | G579: WALKER | I579: CHANDLER | L579: STEVENSON | O579: GEORGE | Q579: GRIMSTER | W579: PORT MELBOURNE | X579: 9 | Y579: 4 | Z579: 0 | AA579: 897 | AB579: 709 | AC579: 126.51622002820875 | AD579: 36
A580: GOALKICKERS | W580: WILLIAMSTOWN | X580: 9 | Y580: 4 | Z580: 0 | AA580: 737 | AB580: 593 | AC580: 124.28330522765599 | AD580: 36
A581: PRAHRAN | D581: V JONES 2 | F581: WEIDNER | H581: E JONES | J581: GRAY | L581: MAYNARD | N581: KERR | P581: DUFTY
A582: BRUNSWICK | D582: TOPHAM 3 | G582: WALKER | J582: STEVENSON | M582: HARKER | O582: CHASE | W582: PRAHRAN | X582: 8 | Y582: 4 | Z582: 1 | AA582: 724 | AB582: 683 | AC582: 106.00292825768668 | AD582: 34
W583: FOOTSCRAY | X583: 7 | Y583: 6 | Z583: 0 | AA583: 816 | AB583: 616 | AC583: 132.46753246753246 | AD583: 28
A584: NORTH MELBOURNE | C584: 2 | D584: 6 | E584: =C584*6+D584 -> 18 | G584: 2 | H584: 6 | I584: =G584*6+H584 -> 18 | K584: 7 | L584: 9 | M584: =K584*6+L584 -> 51 | O584: 10 | P584: 12 | Q584: =O584*6+P584 -> 72 | S584: FOOTSCRAY | W584: NORTHCOTE | X584: 3 | Y584: 8 | Z584: 2 | AA584: 746 | AB584: 792 | AC584: 94.191919191919197 | AD584: 16
A585: FOOTSCRAY | C585: 0 | D585: 1 | E585: =C585*6+D585 -> 1 | G585: 3 | H585: 5 | I585: =G585*6+H585 -> 23 | K585: 3 | L585: 5 | M585: =K585*6+L585 -> 23 | O585: 5 | P585: 8 | Q585: =O585*6+P585 -> 38 | S585: KENDALL | W585: ESSENDON ASSOC. | X585: 2 | Y585: 11 | Z585: 0 | AA585: 627 | AB585: 833 | AC585: 75.270108043217292 | AD585: 8
A586: BEST PLAYERS | W586: BRIGHTON | X586: 1 | Y586: 11 | Z586: 1 | AA586: 627 | AB586: 1072 | AC586: 58.488805970149251 | AD586: 6
A587: NORTH MELBOURNE | D587: HAWKINS | G587: HARDY | I587: BARKER | L587: JONES | O587: CORNALL | Q587: DICK | W587: HAWTHORN | X587: 1 | Y587: 12 | Z587: 0 | AA587: 678 | AB587: 1152 | AC587: 58.854166666666664 | AD587: 4
A588: FOOTSCRAY | D588: COTTON | G588: CROUCH | I588: PATTERSON | L588: CARMODY | O588: GRIERSON | Q588: FORD
A589: GOALKICKERS
A590: NORTH MELBOURNE | D590: HAWKINS 5 | G590: MILES 2 | J590: CONDON | M590: BARKER | P590: CARPENTER
A591: FOOTSCRAY | D591: CROUCH 2 | G591: JONES 2 | J591: BRIESE
A593: NORTHCOTE | C593: 3 | D593: 6 | E593: =C593*6+D593 -> 24 | G593: 4 | H593: 11 | I593: =G593*6+H593 -> 35 | K593: 10 | L593: 15 | M593: =K593*6+L593 -> 75 | O593: 12 | P593: 23 | Q593: =O593*6+P593 -> 95 | S593: NORTHCOTE
A594: BRIGHTON | C594: 0 | D594: 2 | E594: =C594*6+D594 -> 2 | G594: 1 | H594: 5 | I594: =G594*6+H594 -> 11 | K594: 3 | L594: 6 | M594: =K594*6+L594 -> 24 | O594: 4 | P594: 7 | Q594: =O594*6+P594 -> 31 | S594: ALLEY
A595: BEST PLAYERS
A596: NORTHCOTE | D596: MILLS | G596: CHESSWASS | J596: FITZGERALD | M596: MARTIN | P596: VERNON | S596: A THOMAS
A597: BRIGHTON | D597: KNIGHTON | G597: BYRNE | J597: McCARTHY | M597: WILSON | P597: WALLACE | S597: DOWSING
A598: GOALKICKERS
A599: NORTHCOTE | D599: A THOMAS 3 | G599: JACKSON 2 | J599: H THOMAS 2 | M599: WILSON 2 | O599: DANIELS | Q599: MARTIN | T599: BASSETT
A600: BRIGHTON | D600: WALL | G600: DAWSON | J600: ELDRED | M600: GRAHAM
A602: PORT MELBOURNE | C602: 5 | D602: 5 | E602: =C602*6+D602 -> 35 | G602: 8 | H602: 9 | I602: =G602*6+H602 -> 57 | K602: 9 | L602: 12 | M602: =K602*6+L602 -> 66 | O602: 10 | P602: 14 | Q602: =O602*6+P602 -> 74 | S602: ESSENDON
A603: ESSENDON ASSOC. | C603: 0 | D603: 1 | E603: =C603*6+D603 -> 1 | G603: 5 | H603: 4 | I603: =G603*6+H603 -> 34 | K603: 8 | L603: 7 | M603: =K603*6+L603 -> 55 | O603: 9 | P603: 8 | Q603: =O603*6+P603 -> 62 | S603: HERBERT
A604: BEST PLAYERS
A605: PORT MELBOURNE | D605: BARFOOT | G605: WALTON | J605: CLELAND | M605: UNIACKE | P605: McCONVILLE | S605: McNEIL
A606: ESSENDON ASSOC. | D606: EBBOTT | G606: GIBSON | J606: WALKER | M606: HOARE | P606: STROWNIX | S606: MITCHELL
A607: GOALKICKERS
A608: PORT MELBOURNE | D608: BARFOOT 6 | G608: WALTON | J608: STRECKFUSS | M608: MACKIE | O608: COLLINS
A609: ESSENDON ASSOC. | D609: MATTHEWS 3 | G609: STROWNIX | J609: MITCHELL | M609: GIBSON | O609: LEUNIG | Q609: LATIMER | T609: WALKER
A611: WILLIAMSTOWN | C611: 3 | D611: 9 | E611: =C611*6+D611 -> 27 | G611: 7 | H611: 15 | I611: =G611*6+H611 -> 57 | K611: 10 | L611: 18 | M611: =K611*6+L611 -> 78 | O611: 12 | P611: 26 | Q611: =O611*6+P611 -> 98 | S611: HAW
A612: HAWTHORN | C612: 0 | D612: 4 | E612: =C612*6+D612 -> 4 | G612: 4 | H612: 5 | I612: =G612*6+H612 -> 29 | K612: 4 | L612: 11 | M612: =K612*6+L612 -> 35 | O612: 8 | P612: 18 | Q612: =O612*6+P612 -> 66 | S612: McMURRAY
A613: BEST PLAYERS
A614: WILLIAMSTOWN | D614: LEE | G614: WOUDA | J614: DUNN | M614: WALLIS | P614: GIBBS | S614: MIDDLETON
A615: HAWTHORN | D615: SORBY | G615: LARKIN | J615: WOOLLEY | M615: HOSKING | P615: HANNA | S615: HOLLAND
A616: GOALKICKERS
A617: WILLIAMSTOWN | D617: WOUDA 6 | G617: GIBBS 2 | J617: LEE 2 | L617: O'HALLORAN | O617: WALLIS
A618: HAWTHORN | D618: HOSKING 2 | G618: GOUGH | I618: CORNELL | K618: DOOLAN | M618: WOOLLEY | O618: ANTONIO | R618: DUFF
A620: FINALS
A621: 1ST SEMI | E621: 24TH JULY
D622: 1ST QTR | H622: 2ND QTR | L622: 3RD QTR | P622: FINAL
A623: BRUNSWICK | C623: 2 | D623: 2 | E623: =C623*6+D623 -> 14 | G623: 5 | H623: 7 | I623: =G623*6+H623 -> 37 | K623: 7 | L623: 11 | M623: =K623*6+L623 -> 53 | O623: 10 | P623: 14 | Q623: =O623*6+P623 -> 74 | S623: NORTH MELB
A624: PORT MELBOURNE | C624: 2 | D624: 0 | E624: =C624*6+D624 -> 12 | G624: 5 | H624: 4 | I624: =G624*6+H624 -> 34 | K624: 6 | L624: 7 | M624: =K624*6+L624 -> 43 | O624: 8 | P624: 8 | Q624: =O624*6+P624 -> 56 | S624: KENDALL
A625: BEST PLAYERS
A626: BRUNSWICK | D626: CHASE | G626: O'CONNOR | J626: BRAID | M626: CHANDLER | P626: GEORGE | S626: STEVENSON
A627: PORT MELBOURNE | D627: WALTON | G627: BARFOOT | J627: FRANKLIN | M627: PUNCH | P627: McNEIL | S627: McCONVILLE
A628: GOALKICKERS
A629: BRUNSWICK | D629: HARKER 3 | G629: BURNINGHAM 2 | J629: BRAID | L629: SULLIVAN | N629: TOPHAM | P629: CHANDLER | R629: McKENZIE
A630: PORT MELBOURNE | D630: WALTON 3 | G630: BARFOOT 2 | K630: MACKIE 2 | N630: McCONVILLE
A632: 2ND SEMI | E632: 31ST JULY
A633: NORTH MELBOURNE | C633: 3 | D633: 3 | E633: =C633*6+D633 -> 21 | G633: 5 | H633: 5 | I633: =G633*6+H633 -> 35 | K633: 7 | L633: 8 | M633: =K633*6+L633 -> 50 | O633: 11 | P633: 14 | Q633: =O633*6+P633 -> 80 | S633: NORTH MELB
A634: WILLIAMSTOWN | C634: 2 | D634: 0 | E634: =C634*6+D634 -> 12 | G634: 2 | H634: 2 | I634: =G634*6+H634 -> 14 | K634: 3 | L634: 4 | M634: =K634*6+L634 -> 22 | O634: 4 | P634: 8 | Q634: =O634*6+P634 -> 32 | S634: HERBERT
A635: BEST PLAYERS
A636: NORTH MELBOURNE | D636: BARKER | G636: HARDY | J636: CAVE | M636: CORNALL | P636: SPEAKMAN | S636: CARPENTER
A637: WILLIAMSTOWN | D637: DUNN | G637: N BUSBRIDGE | J637: McDONALD | M637: MIDDLETON | P637: GIBBS | S637: MONK
A638: GOALKICKERS
A639: NORTH MELBOURNE | D639: CARPENTER 3 | H639: CONDON 2 | K639: HAWKINS 2 | N639: HARDY 2 | Q639: MILES | S639: FRANKS
A640: WILLIAMSTOWN | D640: MITCHELL 2 | H640: GIBBS | K640: HARDY
A642: FINAL | E642: 7TH AUGUST
A643: NORTH MELBOURNE | C643: 2 | D643: 6 | E643: 18 | G643: 4 | H643: 8 | I643: 32 | K643: 9 | L643: 9 | M643: 63 | O643: 11 | P643: 10 | Q643: =O643*6+P643 -> 76 | S643: NORTH MELB
A644: BRUNSWICK | C644: 0 | D644: 1 | E644: 1 | G644: 0 | H644: 7 | I644: 7 | K644: 1 | L644: 7 | M644: 13 | O644: 3 | P644: 10 | Q644: =O644*6+P644 -> 28 | S644: KENDALL
A645: BEST PLAYERS
A646: NORTH MELBOURNE | D646: BARKER | G646: RAWLE | J646: HARDY | M646: CORNALL | P646: HART | R646: MILES
A647: BRUNSWICK | D647: GRIMSTER | G647: O'CONNOR | J647: SULLIVAN | M647: BRAID | P647: PRICE | R647: SWIFT
A648: GOALKICKERS
A649: NORTH MELBOURNE | D649: MILES 4 | G649: HAWKINS 3 | J649: DODEMAIDE 2 | N649: RAWLE | P649: CLARKE
A650: BRUNSWICK | D650: CHASE | G650: O'CONNOR | J650: HARKER
A652: GAME PLAYED FOR RED CROSS PATRIOTIC FUND 14TH AUGUST
A653: NORTH MELBOURNE | C653: 2 | D653: 2 | E653: =C653*6+D653 -> 14 | G653: 5 | H653: 5 | I653: =G653*6+H653 -> 35 | K653: 7 | L653: 7 | M653: =K653*6+L653 -> 49 | O653: 8 | P653: 9 | Q653: =O653*6+P653 -> 57 | S653: N.M
A654: ST KILDA | C654: 0 | D654: 2 | E654: =C654*6+D654 -> 2 | G654: 3 | H654: 4 | I654: =G654*6+H654 -> 22 | K654: 4 | L654: 6 | M654: =K654*6+L654 -> 30 | O654: 4 | P654: 7 | Q654: =O654*6+P654 -> 31 | S654: BOYLE (V.F.L.)
A655: BEST PLAYERS | S655: HURLEY (V.F.A.)
A656: NORTH MELBOURNE | D656: BARKER | F656: HARDY | I656: JONES | L656: CAVE | N656: FRANKS | Q656: SPEAKMAN
A657: ST KILDA | D657: JAMES | F657: CUMBERLAND | I657: BALME | L657: CAZALY | N657: BOWDEN | Q657: EICKE
A658: GOALKICKERS
A659: NORTH MELBOURNE | D659: WALTON 2 | G659: DODEMAIDE | J659: FRANKS | L659: HAWKINS | N659: BARKER | P659: RAWLE | R659: HARDY
A660: ST KILDA | D660: HORSNELL 2 | G660: JAMES | J660: MOYES
O662: N.M. INCLUDED 3 RING-INS
K663: TEAMS
F664: ST KILDA | R664: NORTH MELB
A665: BACKS | C665: CUBBIN | G665: ELLIS | K665: HATTAM | O665: GARDINER | S665: SPEAKMAN | W665: SHEEHAN
A666: H-BACKS | C666: DANGERFIELD | G666: EICKE | K666: BALME | O666: HART | S666: FRANKS | W666: ALLEY (W'TOWN)
A667: CENTRES | C667: BOWDEN | G667: CAZALY | K667: COLLINS | O667: CAVE | S667: JONES | W667: CORNALL
A668: H-FORWARDS | C668: MALONEY | G668: McNAMARA | K668: GRAVESALL | O668: CONDON | S668: MILES | W668: DODEMAIDE
A669: FORWARDS | C669: CRUDDEN | G669: MOYES | K669: HORSNELL | O669: HAWKINS | S669: HOARE (ESS) | W669: WALTON (P.M.)
A670: RUCKS | C670: CUMBERLAND | G670: TURNBULL | K670: JAMES | O670: BARKER | S670: RAWLE | W670: HARDY