A1: Victorian Football Association
A2: Season 1918
A3: © Copyright Wal Williams | F3: First created: 2 August 2014
A4: Contact: joywalwi at gmail dot com | F4: Last updated: 2 August 2014 | W4: VFA Results and tables - Link to the main index page
A5: You are free to copy this document in whole or part provided that proper acknowledgement is given to the author. All rights reserved.
A7: YEAR 1918 | X7: LADDER | AB7: ROUND | AD7: 1
A8: ROUND 1 | E8: 18TH MAY | J8: WEATHER | M8: CLOUDY SHOWERS N.W. WIND | S8: PLAYED AT
D9: 1ST QTR | H9: 2ND QTR | L9: 3RD QTR | P9: FINAL | S9: PORT MELB | W9: TEAM | X9: W | Y9: L | Z9: D | AA9: FOR | AB9: AGST | AC9: % | AD9: PTS
A10: NORTH MELBOURNE | C10: 3 | D10: 0 | E10: =C10*6+D10 -> 18 | G10: 6 | H10: 0 | I10: =G10*6+H10 -> 36 | K10: 9 | L10: 7 | M10: =K10*6+L10 -> 61 | O10: 11 | P10: 7 | Q10: =O10*6+P10 -> 73 | S10: UMPIRE
A11: PORT MELBOURNE | C11: 1 | D11: 0 | E11: =C11*6+D11 -> 6 | G11: 2 | H11: 3 | I11: =G11*6+H11 -> 15 | K11: 4 | L11: 4 | M11: =K11*6+L11 -> 28 | O11: 6 | P11: 7 | Q11: =O11*6+P11 -> 43 | S11: KENDALL | W11: PRAHRAN | X11: 1 | Y11: 0 | Z11: 0 | AA11: 70 | AB11: 30 | AC11: 233.33333333333334 | AD11: 4
A12: BEST PLAYERS | W12: NORTH MELBOURNE | X12: 1 | Y12: 0 | Z12: 0 | AA12: 73 | AB12: 43 | AC12: 169.76744186046511 | AD12: 4
A13: NORTH MELBOURNE | C13: BARKER | F13: RAWLE | I13: HAWKINS | L13: HARDY | O13: MOORE | Q13: STEVENS | W13: FOOTSCRAY | X13: 1 | Y13: 0 | Z13: 0 | AA13: 57 | AB13: 39 | AC13: 146.15384615384616 | AD13: 4
A14: PORT MELBOURNE | C14: HOWARD | F14: BARFOOT | I14: G STANFORD | L14: ROBINSON | O14: AMY | Q14: NANCARROW | W14: NORTHCOTE | X14: 0 | Y14: 1 | Z14: 0 | AA14: 39 | AB14: 57 | AC14: 68.421052631578945 | AD14: 0
A15: GOALKICKERS
A16: NORTH MELBOURNE | C16: HAWKINS 3 | F16: McCARTHY 2 | I16: H JOHNSON 2 | L16: STEVENS 2 | N16: HARDY | P16: A JOHNSON | W16: PORT MELBOURNE | X16: 0 | Y16: 1 | Z16: 0 | AA16: 43 | AB16: 73 | AC16: 58.904109589041099 | AD16: 0
A17: PORT MELBOURNE | C17: BARFOOT 3 | F17: JENKINS | I17: GRAHAM | W17: BRUNSWICK | X17: 0 | Y17: 1 | Z17: 0 | AA17: 30 | AB17: 70 | AC17: 42.857142857142854 | AD17: 0
A19: PRAHRAN | C19: 5 | D19: 5 | E19: =C19*6+D19 -> 35 | G19: 6 | H19: 5 | I19: =G19*6+H19 -> 41 | K19: 10 | L19: 9 | M19: =K19*6+L19 -> 69 | O19: 10 | P19: 10 | Q19: =O19*6+P19 -> 70 | S19: TOORAK PARK
A20: BRUNSWICK | C20: 0 | D20: 0 | E20: =C20*6+D20 -> 0 | G20: 1 | H20: 7 | I20: =G20*6+H20 -> 13 | K20: 1 | L20: 7 | M20: =K20*6+L20 -> 13 | O20: 2 | P20: 18 | Q20: =O20*6+P20 -> 30 | S20: PORTEOUS
A21: BEST PLAYERS
A22: PRAHRAN | C22: MORONEY | F22: WOODHEAD | I22: LOVE | L22: CARLSON | O22: BURNS | R22: DOWSING
A23: BRUNSWICK | C23: O'CONNOR | F23: GEORGE | I23: GRIMSTER | L23: CHASE | O23: HARKER | R23: HASSETT
A24: GOALKICKERS
A25: PRAHRAN | C25: LOVE 3
A26: BRUNSWICK
A28: FOOTSCRAY | C28: 0 | D28: 5 | E28: =C28*6+D28 -> 5 | G28: 3 | H28: 9 | I28: =G28*6+H28 -> 27 | K28: 4 | L28: 10 | M28: =K28*6+L28 -> 34 | O28: 7 | P28: 15 | Q28: =O28*6+P28 -> 57 | S28: FOOTSCRAY
A29: NORTHCOTE | C29: 1 | D29: 5 | E29: =C29*6+D29 -> 11 | G29: 3 | H29: 5 | I29: =G29*6+H29 -> 23 | K29: 4 | L29: 9 | M29: =K29*6+L29 -> 33 | O29: 5 | P29: 9 | Q29: =O29*6+P29 -> 39 | S29: HURLEY
A30: BEST PLAYERS
A31: FOOTSCRAY | C31: CROUCH | F31: C GRIERSON | J31: GREGORY | M31: SAMSON | P31: CLARK | R31: LAWRENCE
A32: NORTHCOTE | C32: CHESSWASS | F32: THOMAS | J32: O'KEEFE | M32: RYAN | P32: H SMITH | R32: WILSON
A33: GOALKICKERS
A34: FOOTSCRAY | C34: HARDY 2 | F34: CROUCH | I34: C GRIERSON | L34: GREGORY | N34: COTTON | P34: FITZGERALD
A35: NORTHCOTE | C35: RYAN 3 | F35: WILKINSON | I35: BASSETT
A37: ROUND 2 | E37: 25TH MAY | J37: WEATHER | M37: CLOUDY WEST WIND | S37: PLAYED AT | X37: LADDER | AB37: ROUND | AD37: 2
D38: 1ST QTR | H38: 2ND QTR | L38: 3RD QTR | P38: FINAL | S38: NORTH MELB
A39: NORTH MELBOURNE | C39: 5 | D39: 2 | E39: =C39*6+D39 -> 32 | G39: 7 | H39: 4 | I39: =G39*6+H39 -> 46 | K39: 12 | L39: 8 | M39: =K39*6+L39 -> 80 | O39: 16 | P39: 13 | Q39: =O39*6+P39 -> 109 | S39: UMPIRE | W39: TEAM | X39: W | Y39: L | Z39: D | AA39: FOR | AB39: AGST | AC39: % | AD39: PTS
A40: FOOTSCRAY | C40: 1 | D40: 1 | E40: =C40*6+D40 -> 7 | G40: 3 | H40: 5 | I40: =G40*6+H40 -> 23 | K40: 4 | L40: 6 | M40: =K40*6+L40 -> 30 | O40: 5 | P40: 7 | Q40: =O40*6+P40 -> 37 | S40: SMITH
A41: BEST PLAYERS | W41: NORTH MELBOURNE | X41: 2 | Y41: 0 | Z41: 0 | AA41: 182 | AB41: 80 | AC41: 227.5 | AD41: 8
A42: NORTH MELBOURNE | C42: HARDY | F42: HART | I42: CAVE | L42: GARDINER | O42: RAWLE | R42: HAWKINS | W42: PRAHRAN | X42: 2 | Y42: 0 | Z42: 0 | AA42: 192 | AB42: 90 | AC42: 213.33 | AD42: 8
A43: FOOTSCRAY | C43: McKENZIE | F43: LAWRENCE | I43: HARDY | L43: C GRIERSON | O43: McGARRY | R43: A MITCHELL | W43: NORTHCOTE | X43: 1 | Y43: 1 | Z43: 0 | AA43: 105 | AB43: 101 | AC43: 103.96 | AD43: 4
A44: GOALKICKERS | W44: FOOTSCRAY | X44: 1 | Y44: 1 | Z44: 0 | AA44: 94 | AB44: 148 | AC44: 63.51 | AD44: 4
A45: NORTH MELBOURNE | C45: STEVENS 5 | F45: HARDY 3 | I45: TONKIN 2 | K45: HAWKINS 2 | N45: CAVE | P45: BROWN | R45: BARKER | T45: MOORE
A46: FOOTSCRAY | C46: McKENZIE 2 | F46: McGARRY | I46: C GRIERSON | L46: A MITCHELL | W46: BRUNSWICK | X46: 0 | Y46: 2 | Z46: 0 | AA46: 74 | AB46: 136 | AC46: 54.41 | AD46: 0
W47: PORT MELBOURNE | X47: 0 | Y47: 2 | Z47: 0 | AA47: 103 | AB47: 195 | AC47: 52.82 | AD47: 0
A48: PRAHRAN | C48: 4 | D48: 4 | E48: =C48*6+D48 -> 28 | G48: 6 | H48: 8 | I48: =G48*6+H48 -> 44 | K48: 9 | L48: 17 | M48: =K48*6+L48 -> 71 | O48: 16 | P48: 26 | Q48: =O48*6+P48 -> 122 | S48: TOORAK PARK
A49: PORT MELBOURNE | C49: 3 | D49: 2 | E49: =C49*6+D49 -> 20 | G49: 6 | H49: 6 | I49: =G49*6+H49 -> 42 | K49: 7 | L49: 5 | M49: =K49*6+L49 -> 47 | O49: 9 | P49: 6 | Q49: =O49*6+P49 -> 60 | S49: KENDALL
A50: BEST PLAYERS
A51: PRAHRAN | C51: WOODHEAD | F51: LOVE | I51: MORONEY | L51: V JONES | O51: DOWSING | R51: CARLSON
A52: PORT MELBOURNE | C52: BARFOOT | F52: GOTZ | I52: HARRISON | L52: ANDERSON | O52: ROBINSON | R52: McNEILL
A53: GOALKICKERS
A54: PRAHRAN | C54: MORONEY 4 | F54: DOWSING 2 | I54: V JONES 2 | K54: FEWSTER 2 | N54: MAYNARD 2 | Q54: LOVE | R54: E JONES | T54: COMER | W54: MASTERS
A55: PORT MELBOURNE | C55: GOTZ 4 | F55: BARFOOT | I55: G STANFORD | L55: HOWARD | N55: ROBINSON | Q55: ANDERSON
A57: NORTHCOTE | C57: 4 | D57: 1 | E57: =C57*6+D57 -> 25 | G57: 5 | H57: 4 | I57: =G57*6+H57 -> 34 | K57: 6 | L57: 5 | M57: =K57*6+L57 -> 41 | O57: 10 | P57: 6 | Q57: =O57*6+P57 -> 66 | S57: BRUNSWICK
A58: BRUNSWICK | C58: 1 | D58: 0 | E58: =C58*6+D58 -> 6 | G58: 3 | H58: 3 | I58: =G58*6+H58 -> 21 | K58: 4 | L58: 5 | M58: =K58*6+L58 -> 29 | O58: 6 | P58: 8 | Q58: =O58*6+P58 -> 44 | S58: HERBERT
A59: BEST PLAYERS
A60: NORTHCOTE | C60: H THOMAS | F60: CHESSWASS | J60: BASSETT | M60: BENNETT | P60: RYAN | R60: JOYCE
A61: BRUNSWICK | C61: HARKER | F61: BRAID | J61: HASSETT | M61: O'CONNOR | P61: SULLIVAN
A62: GOALKICKERS
A63: NORTHCOTE | C63: RYAN 4 | F63: JOYCE 3 | I63: O'KEEFE | L63: H SMITH | N63: WILSON
A64: BRUNSWICK | C64: SULLIVAN 3 | F64: HARKER 2 | I64: BRAID
A66: ROUND 3 | E66: 1ST JUNE | J66: WEATHER | M66: CLOUDY N.W. WIND | S66: PLAYED AT | X66: LADDER | AB66: ROUND | AD66: 3
D67: 1ST QTR | H67: 2ND QTR | L67: 3RD QTR | P67: FINAL | S67: NORTHCOTE
A68: NORTH MELBOURNE | C68: 2 | D68: 4 | E68: =C68*6+D68 -> 16 | G68: 5 | H68: 8 | I68: =G68*6+H68 -> 38 | K68: 6 | L68: 9 | M68: =K68*6+L68 -> 45 | O68: 12 | P68: 15 | Q68: =O68*6+P68 -> 87 | S68: UMPIRE | W68: TEAM | X68: W | Y68: L | Z68: D | AA68: FOR | AB68: AGST | AC68: % | AD68: PTS
A69: NORTHCOTE | C69: 4 | D69: 1 | E69: =C69*6+D69 -> 25 | G69: 5 | H69: 2 | I69: =G69*6+H69 -> 32 | K69: 8 | L69: 4 | M69: =K69*6+L69 -> 52 | O69: 8 | P69: 5 | Q69: =O69*6+P69 -> 53 | S69: HURLEY
A70: BEST PLAYERS | W70: NORTH MELBOURNE | X70: 3 | Y70: 0 | Z70: 0 | AA70: 269 | AB70: 133 | AC70: 202.25563909774436 | AD70: 12
A71: NORTH MELBOURNE | C71: GARDINER | F71: SHEEHAN | I71: FRANKS | L71: McCARTHY | O71: STEVENS | Q71: DONNELLY | W71: PRAHRAN | X71: 3 | Y71: 0 | Z71: 0 | AA71: 252 | AB71: 125 | AC71: 201.6 | AD71: 12
A72: NORTHCOTE | C72: H THOMAS | F72: WILSON | I72: RYAN | L72: BASSETT | O72: BENNETT | Q72: MARTIN | W72: NORTHCOTE | X72: 1 | Y72: 2 | Z72: 0 | AA72: 158 | AB72: 188 | AC72: 84.042553191489361 | AD72: 4
A73: GOALKICKERS | W73: PORT MELBOURNE | X73: 1 | Y73: 2 | Z73: 0 | AA73: 164 | AB73: 242 | AC73: 67.768595041322314 | AD73: 4
A74: NORTH MELBOURNE | C74: TONKIN 3 | F74: HAWKINS 3 | I74: STEVENS 3 | L74: McCARTHY 2 | O74: FRANKS
A75: NORTHCOTE | C75: RYAN 3 | F75: JOYCE 2 | I75: H SMITH | L75: GRAY | N75: BASSETT | W75: FOOTSCRAY | X75: 1 | Y75: 2 | Z75: 0 | AA75: 129 | AB75: 208 | AC75: 62.019230769230766 | AD75: 4
W76: BRUNSWICK | X76: 0 | Y76: 3 | Z76: 0 | AA76: 121 | AB76: 197 | AC76: 61.421319796954315 | AD76: 0
A77: PRAHRAN | C77: 2 | D77: 3 | E77: =C77*6+D77 -> 15 | G77: 6 | H77: 6 | I77: =G77*6+H77 -> 42 | K77: 7 | L77: 8 | M77: =K77*6+L77 -> 50 | O77: 8 | P77: 12 | Q77: =O77*6+P77 -> 60 | S77: FOOTSCRAY
A78: FOOTSCRAY | C78: 1 | D78: 4 | E78: =C78*6+D78 -> 10 | G78: 2 | H78: 6 | I78: =G78*6+H78 -> 18 | K78: 3 | L78: 8 | M78: =K78*6+L78 -> 26 | O78: 4 | P78: 11 | Q78: =O78*6+P78 -> 35 | S78: PORTEOUS
A79: BEST PLAYERS
A80: PRAHRAN | C80: CARLSON | F80: MORONEY | I80: DOWSING | L80: MAYNARD | O80: V JONES | Q80: LOVE
A81: FOOTSCRAY | C81: McKENZIE | F81: WALLIS | I81: S MITCHELL | L81: C GRIERSON | O81: SAMSON
A82: GOALKICKERS
A83: PRAHRAN | C83: LOVE 3 | F83: MATTHEWS | I83: DOWSING | L83: E JONES | N83: V JONES | Q83: COMER
A84: FOOTSCRAY | C84: McKENZIE | F84: CROUCH | I84: MIDDLETON | L84: F GRUNDEN
A86: PORT MELBOURNE | C86: 3 | D86: 4 | E86: =C86*6+D86 -> 22 | G86: 3 | H86: 7 | I86: =G86*6+H86 -> 25 | K86: 7 | L86: 12 | M86: =K86*6+L86 -> 54 | O86: 8 | P86: 13 | Q86: =O86*6+P86 -> 61 | S86: PORT MELB
A87: BRUNSWICK | C87: 2 | D87: 3 | E87: =C87*6+D87 -> 15 | G87: 5 | H87: 5 | I87: =G87*6+H87 -> 35 | K87: 5 | L87: 8 | M87: =K87*6+L87 -> 38 | O87: 6 | P87: 11 | Q87: =O87*6+P87 -> 47 | S87: SMITH
A88: BEST PLAYERS
A89: PORT MELBOURNE | C89: McNEILL | F89: J STANFORD | I89: BARFOOT | L89: ANDERSON | O89: NANCARROW | R89: KEAST
A90: BRUNSWICK | C90: CHRISTIE | F90: GEORGE | I90: PRINCE | L90: WOOD | O90: SULLIVAN | R90: CHASE
A91: GOALKICKERS
A92: PORT MELBOURNE | C92: ANDERSON 2 | F92: KEAST 2 | I92: HOWARD | K92: G STANFORD | N92: J STANFORD | Q92: GOTZ
A93: BRUNSWICK | C93: SULLIVAN 3 | F93: WHITE | I93: WOOD | K93: KRUSE
A95: ROUND 4 | E95: 8TH JUNE | J95: WEATHER | M95: FINE | S95: PLAYED AT | X95: LADDER | AB95: ROUND | AD95: 4
D96: 1ST QTR | H96: 2ND QTR | L96: 3RD QTR | P96: FINAL | S96: NORTH MELB
A97: NORTH MELBOURNE | C97: 1 | D97: 3 | E97: =C97*6+D97 -> 9 | G97: 5 | H97: 10 | I97: =G97*6+H97 -> 40 | K97: 9 | L97: 14 | M97: =K97*6+L97 -> 68 | O97: 14 | P97: 21 | Q97: =O97*6+P97 -> 105 | S97: UMPIRE | W97: TEAM | X97: W | Y97: L | Z97: D | AA97: FOR | AB97: AGST | AC97: % | AD97: PTS
A98: PRAHRAN | C98: 2 | D98: 4 | E98: =C98*6+D98 -> 16 | G98: 2 | H98: 5 | I98: =G98*6+H98 -> 17 | K98: 4 | L98: 10 | M98: =K98*6+L98 -> 34 | O98: 6 | P98: 12 | Q98: =O98*6+P98 -> 48 | S98: HERBERT
A99: BEST PLAYERS | W99: NORTH MELBOURNE | X99: 4 | Y99: 0 | Z99: 0 | AA99: 374 | AB99: 181 | AC99: 206.62983425414365 | AD99: 16
A100: NORTH MELBOURNE | C100: HARDY | F100: STEVENS | I100: TONKIN | L100: BARKER | O100: FRANKS | R100: DONNELLY | W100: PRAHRAN | X100: 3 | Y100: 1 | Z100: 0 | AA100: 300 | AB100: 230 | AC100: 130.43478260869566 | AD100: 12
A101: PRAHRAN | C101: FRAWLEY | F101: COMER | I101: MORONEY | L101: CARLSON | O101: DOWSING | R101: QUINN | W101: PORT MELBOURNE | X101: 2 | Y101: 2 | Z101: 0 | AA101: 230 | AB101: 287 | AC101: 80.139372822299649 | AD101: 8
A102: GOALKICKERS | W102: BRUNSWICK | X102: 1 | Y102: 3 | Z102: 0 | AA102: 191 | AB102: 233 | AC102: 81.97424892703863 | AD102: 4
A103: NORTH MELBOURNE | C103: STEVENS 6 | F103: BROWN 3 | I103: HARDY 2 | L103: HAWKINS 2 | O103: CLARKE
A104: PRAHRAN | C104: COMER 2 | F104: FRAWLEY | I104: QUINN | L104: V JONES | O104: MATHEWS | W104: NORTHCOTE | X104: 1 | Y104: 3 | Z104: 0 | AA104: 203 | AB104: 254 | AC104: 79.921259842519689 | AD104: 4
W105: FOOTSCRAY | X105: 1 | Y105: 3 | Z105: 0 | AA105: 165 | AB105: 278 | AC105: 59.352517985611513 | AD105: 4
A106: PORT MELBOURNE | C106: 2 | D106: 2 | E106: =C106*6+D106 -> 14 | G106: 2 | H106: 10 | I106: =G106*6+H106 -> 22 | K106: 6 | L106: 11 | M106: =K106*6+L106 -> 47 | O106: 9 | P106: 12 | Q106: =O106*6+P106 -> 66 | S106: NORTHCOTE
A107: NORTHCOTE | C107: 4 | D107: 1 | E107: =C107*6+D107 -> 25 | G107: 4 | H107: 3 | I107: =G107*6+H107 -> 27 | K107: 5 | L107: 6 | M107: =K107*6+L107 -> 36 | O107: 6 | P107: 9 | Q107: =O107*6+P107 -> 45 | S107: KENDALL
A108: BEST PLAYERS
A109: PORT MELBOURNE | C109: ANDERSON | F109: GOTZ | I109: AMY | L109: G STANFORD | O109: BARFOOT | R109: CUNNINGHAM
A110: NORTHCOTE | C110: WILSON | F110: BASSETT | I110: BENNETT | L110: BYRNE | O110: H SMITH | R110: CHESSWASS
A111: GOALKICKERS
A112: PORT MELBOURNE | C112: G STANFORD 3 | G112: KEAST 2 | J112: COOK 2 | M112: HOWARD | O112: GRAHAM
A113: NORTHCOTE | C113: RYAN 2 | F113: BENNETT | I113: JOYCE | K113: WILSON | N113: TWOMEY
A115: BRUNSWICK | C115: 3 | D115: 3 | E115: =C115*6+D115 -> 21 | G115: 5 | H115: 9 | I115: =G115*6+H115 -> 39 | K115: 8 | L115: 13 | M115: =K115*6+L115 -> 61 | O115: 9 | P115: 16 | Q115: =O115*6+P115 -> 70 | S115: FOOTSCRAY
A116: FOOTSCRAY | C116: 0 | D116: 1 | E116: =C116*6+D116 -> 1 | G116: 2 | H116: 2 | I116: =G116*6+H116 -> 14 | K116: 3 | L116: 3 | M116: =K116*6+L116 -> 21 | O116: 5 | P116: 6 | Q116: =O116*6+P116 -> 36 | S116: HURLEY
A117: BEST PLAYERS
A118: BRUNSWICK | C118: HARKER | F118: WOODS | I118: SULLIVAN | L118: O'CONNOR | O118: CHASE
A119: FOOTSCRAY | C119: C GRIERSON | F119: A MITCHELL | I119: McDONALD | L119: SAMSON | O119: McKENZIE | R119: WALLIS
A120: GOALKICKERS
A121: BRUNSWICK | C121: HARKER 7 | F121: WOODS | I121: SULLIVAN
A122: FOOTSCRAY | C122: THARROW | F122: A MITCHELL | I122: MIDDLETON | L122: CROUCH | O122: SAMSON
A124: ROUND 5 | E124: 15TH JUNE | J124: WEATHER | M124: LIGHT SHOWERS N.W. WIND | S124: PLAYED AT | X124: LADDER | AB124: ROUND | AD124: 5
D125: 1ST QTR | H125: 2ND QTR | L125: 3RD QTR | P125: FINAL | S125: BRUNSWICK
A126: NORTH MELB | C126: 2 | D126: 2 | E126: =C126*6+D126 -> 14 | G126: 2 | H126: 10 | I126: =G126*6+H126 -> 22 | K126: 5 | L126: 19 | M126: =K126*6+L126 -> 49 | O126: 5 | P126: 29 | Q126: =O126*6+P126 -> 59 | S126: UMPIRE | W126: TEAM | X126: W | Y126: L | Z126: D | AA126: FOR | AB126: AGST | AC126: % | AD126: PTS
A127: BRUNSWICK | C127: 3 | D127: 2 | E127: =C127*6+D127 -> 20 | G127: 3 | H127: 3 | I127: =G127*6+H127 -> 21 | K127: 6 | L127: 6 | M127: =K127*6+L127 -> 42 | O127: 8 | P127: 6 | Q127: =O127*6+P127 -> 54 | S127: FRANKLIN
A128: BEST PLAYERS | W128: NORTH MELBOURNE | X128: 5 | Y128: 0 | Z128: 0 | AA128: 433 | AB128: 235 | AC128: 184.25531914893617 | AD128: 20
A129: NORTH MELB | C129: SHEEHAN | F129: HARDY | I129: TONKIN | L129: DONNELLY | O129: BARKER | R129: STEVENS | W129: PRAHRAN | X129: 4 | Y129: 1 | Z129: 0 | AA129: 382 | AB129: 284 | AC129: 134.50704225352112 | AD129: 16
A130: BRUNSWICK | C130: TWOMEY | F130: GRIMSTER | I130: KEMP | L130: PRINCE | O130: CHRISTIE | R130: CHASE | W130: PORT MELBOURNE | X130: 3 | Y130: 2 | Z130: 0 | AA130: 326 | AB130: 339 | AC130: 96.165191740412979 | AD130: 12
A131: GOALKICKERS | W131: BRUNSWICK | X131: 1 | Y131: 4 | Z131: 0 | AA131: 245 | AB131: 292 | AC131: 83.904109589041099 | AD131: 4
A132: NORTH MELB | C132: STEVENS 2 | G132: TONKIN 2 | J132: HAWKINS
A133: BRUNSWICK | C133: CHASE 3 | F133: GEORGE 2 | I133: SULLIVAN 2 | L133: BARKER | W133: NORTHCOTE | X133: 1 | Y133: 4 | Z133: 0 | AA133: 257 | AB133: 336 | AC133: 76.488095238095241 | AD133: 4
W134: FOOTSCRAY | X134: 1 | Y134: 4 | Z134: 0 | AA134: 217 | AB134: 374 | AC134: 58.021390374331553 | AD134: 4
A135: PRAHRAN | C135: 2 | D135: 1 | E135: =C135*6+D135 -> 13 | G135: 5 | H135: 2 | I135: =G135*6+H135 -> 32 | K135: 7 | L135: 3 | M135: =K135*6+L135 -> 45 | O135: 12 | P135: 10 | Q135: =O135*6+P135 -> 82 | S135: TOORAK PARK
A136: NORTHCOTE | C136: 2 | D136: 3 | E136: =C136*6+D136 -> 15 | G136: 6 | H136: 5 | I136: =G136*6+H136 -> 41 | K136: 8 | L136: 6 | M136: =K136*6+L136 -> 54 | O136: 8 | P136: 6 | Q136: =O136*6+P136 -> 54 | S136: HERBERT
A137: BEST PLAYERS
A138: PRAHRAN | C138: MORONEY | F138: ALLISTER | I138: RICHARDSON | L138: CARLSON | O138: FRAWLEY | R138: V JONES
A139: NORTHCOTE | C139: H THOMAS | F139: BASSETT | I139: BYRNE | L139: WELLS | O139: WILSON | R139: CHESSWASS
A140: GOALKICKERS
A141: PRAHRAN | C141: MORONEY 2 | F141: DOWSING 2 | I141: CARLSON 2 | L141: O'HARA 2 | N141: V JONES | P141: WEIDNER | R141: COMER | T141: ALLISTER
A142: NORTHCOTE | C142: RYAN 5 | F142: BYRNE 2 | I142: GRAY
A144: PORT MELBOURNE | C144: 3 | D144: 1 | E144: =C144*6+D144 -> 19 | G144: 8 | H144: 6 | I144: =G144*6+H144 -> 54 | K144: 12 | L144: 9 | M144: =K144*6+L144 -> 81 | O144: 14 | P144: 12 | Q144: =O144*6+P144 -> 96 | S144: PORT MELB
A145: FOOTSCRAY | C145: 3 | D145: 1 | E145: =C145*6+D145 -> 19 | G145: 4 | H145: 1 | I145: =G145*6+H145 -> 25 | K145: 7 | L145: 3 | M145: =K145*6+L145 -> 45 | O145: 8 | P145: 4 | Q145: =O145*6+P145 -> 52 | S145: KENDALL
A146: BEST PLAYERS
A147: PORT MELBOURNE | C147: JENKINS | F147: ROBINSON | I147: KEAST | L147: BARFOOT | O147: GRAHAM | R147: NANCARROW
A148: FOOTSCRAY | C148: McKENZIE | F148: SAMSON | I148: GREGORY | L148: C GRIERSON | O148: McDONALD | R148: WALLIS
A149: GOALKICKERS
A150: PORT MELBOURNE | C150: KEAST 6 | F150: AMY 2 | I150: J STANFORD | L150: GRAHAM | N150: HOWARD | P150: McINTYRE | R150: BARFOOT | U150: COOK
A151: FOOTSCRAY | C151: McKENZIE 2 | F151: EDWARDS 2 | I151: WALLIS | K151: A MITCHELL | N151: COLLINS | Q151: CROUCH
A153: ROUND 6 | E153: 22ND JUNE | J153: WEATHER | M153: CLOUDY BUT FINE | S153: PLAYED AT | X153: LADDER | AB153: ROUND | AD153: 6
D154: 1ST QTR | H154: 2ND QTR | L154: 3RD QTR | P154: FINAL | S154: NORTH MELB
A155: NORTH MELBOURNE | C155: 4 | D155: 7 | E155: =C155*6+D155 -> 31 | G155: 7 | H155: 11 | I155: =G155*6+H155 -> 53 | K155: 7 | L155: 16 | M155: =K155*6+L155 -> 58 | O155: 12 | P155: 20 | Q155: =O155*6+P155 -> 92 | S155: UMPIRE | W155: TEAM | X155: W | Y155: L | Z155: D | AA155: FOR | AB155: AGST | AC155: % | AD155: PTS
A156: PORT MELBOURNE | C156: 3 | D156: 2 | E156: =C156*6+D156 -> 20 | G156: 4 | H156: 4 | I156: =G156*6+H156 -> 28 | K156: 6 | L156: 8 | M156: =K156*6+L156 -> 44 | O156: 6 | P156: 9 | Q156: =O156*6+P156 -> 45 | S156: HERBERT
A157: BEST PLAYERS | W157: NORTH MELBOURNE | X157: 6 | Y157: 0 | Z157: 0 | AA157: 525 | AB157: 280 | AC157: 187.5 | AD157: 24
A158: NORTH MELBOURNE | C158: STEVENS | F158: HARDY | I158: BROWN | L158: McCARTHY | O158: SHEEHAN | R158: CAVE | W158: PRAHRAN | X158: 4 | Y158: 2 | Z158: 0 | AA158: 453 | AB158: 402 | AC158: 112.68656716417911 | AD158: 16
A159: PORT MELBOURNE | C159: BARFOOT | F159: KEAST | I159: SAMSON | L159: ANDERSON | O159: NANCARROW | R159: GOTZ | W159: PORT MELBOURNE | X159: 3 | Y159: 3 | Z159: 0 | AA159: 371 | AB159: 431 | AC159: 86.078886310904878 | AD159: 12
A160: GOALKICKERS | W160: BRUNSWICK | X160: 2 | Y160: 4 | Z160: 0 | AA160: 363 | AB160: 363 | AC160: 100 | AD160: 8
A161: NORTH MELBOURNE | C161: STEVENS 5 | F161: HARDY 2 | I161: BROWN | K161: RAWLE | M161: TONKIN | O161: McCARTHY | R161: BARKER
A162: PORT MELBOURNE | C162: KEAST 3 | F162: BARFOOT 2 | I162: NANCARROW | W162: NORTHCOTE | X162: 2 | Y162: 4 | Z162: 0 | AA162: 330 | AB162: 401 | AC162: 82.294264339152122 | AD162: 8
W163: FOOTSCRAY | X163: 1 | Y163: 5 | Z163: 0 | AA163: 282 | AB163: 447 | AC163: 63.087248322147651 | AD163: 4
A164: BRUNSWICK | C164: 3 | D164: 3 | E164: =C164*6+D164 -> 21 | G164: 6 | H164: 5 | I164: =G164*6+H164 -> 41 | K164: 10 | L164: 10 | M164: =K164*6+L164 -> 70 | O164: 18 | P164: 10 | Q164: =O164*6+P164 -> 118 | S164: BRUNSWICK
A165: PRAHRAN | C165: 2 | D165: 1 | E165: =C165*6+D165 -> 13 | G165: 4 | H165: 5 | I165: =G165*6+H165 -> 29 | K165: 6 | L165: 8 | M165: =K165*6+L165 -> 44 | O165: 10 | P165: 11 | Q165: =O165*6+P165 -> 71 | S165: KENDALL
A166: BEST PLAYERS
A167: BRUNSWICK | C167: CHANDLER | F167: CHASE | I167: BRAID | L167: SWIFT | O167: GEORGE | Q167: TWOMEY
A168: PRAHRAN | C168: CARLSON | F168: FEWSTER | I168: DOWSING | L168: WEIDNER | O168: COMER | Q168: MORONEY
A169: GOALKICKERS
A170: BRUNSWICK | C170: TWOMEY 4 | F170: HARKER 4 | I170: KRUSE 3 | K170: SULLIVAN 2 | N170: CHASE | P170: GEORGE | R170: KEMP | T170: WOOD | V170: CHANDLER
A171: PRAHRAN | C171: COMER 3 | F171: LOVE 2 | I171: MORONEY 2 | L171: CARLSON | N171: MATHEWS | Q171: FEWSTER
A173: NORTHCOTE | C173: 1 | D173: 4 | E173: =C173*6+D173 -> 10 | G173: 5 | H173: 8 | I173: =G173*6+H173 -> 38 | K173: 7 | L173: 9 | M173: =K173*6+L173 -> 51 | O173: 10 | P173: 13 | Q173: =O173*6+P173 -> 73 | S173: NORTHCOTE
A174: FOOTSCRAY | C174: 3 | D174: 1 | E174: =C174*6+D174 -> 19 | G174: 4 | H174: 4 | I174: =G174*6+H174 -> 28 | K174: 7 | L174: 9 | M174: =K174*6+L174 -> 51 | O174: 9 | P174: 11 | Q174: =O174*6+P174 -> 65 | S174: HURLEY
A175: BEST PLAYERS
A176: NORTHCOTE | C176: RYAN | F176: H THOMAS | I176: CHESSWASS | L176: JOYCE | O176: BASSETT | R176: DANIELS
A177: FOOTSCRAY | C177: SAMSON | F177: CROUCH | I177: HARDY | L177: McKENZIE | O177: WALLIS | R177: GREGORY
A178: GOALKICKERS
A179: NORTHCOTE | C179: RYAN 6 | F179: DANIELS 2 | I179: MARTIN | K179: BENNETT
A180: FOOTSCRAY | C180: GREGORY 3 | F180: FITZGIBBON 3 | I180: A MITCHELL | L180: McDONALD | O180: McKENZIE
A182: ROUND 7 | E182: 29TH JUNE | J182: WEATHER | M182: N.W. WIND RAIN GORUNDS BAD | S182: PLAYED AT | X182: LADDER | AB182: ROUND | AD182: 7
D183: 1ST QTR | H183: 2ND QTR | L183: 3RD QTR | P183: FINAL | S183: PORT MELB
A184: PRAHRAN | C184: 1 | D184: 3 | E184: =C184*6+D184 -> 9 | G184: 1 | H184: 4 | I184: =G184*6+H184 -> 10 | K184: 5 | L184: 5 | M184: =K184*6+L184 -> 35 | O184: 5 | P184: 5 | Q184: =O184*6+P184 -> 35 | S184: UMPIRE | W184: TEAM | X184: W | Y184: L | Z184: D | AA184: FOR | AB184: AGST | AC184: % | AD184: PTS
A185: PORT MELBOURNE | C185: 0 | D185: 0 | E185: =C185*6+D185 -> 0 | G185: 0 | H185: 3 | I185: =G185*6+H185 -> 3 | K185: 0 | L185: 3 | M185: =K185*6+L185 -> 3 | O185: 3 | P185: 6 | Q185: =O185*6+P185 -> 24 | S185: PORTEOUS
A186: BEST PLAYERS | W186: NORTH MELBOURNE | X186: 7 | Y186: 0 | Z186: 0 | AA186: 573 | AB186: 294 | AC186: 194.89795918367346 | AD186: 28
A187: PRAHRAN | C187: DOWSING | F187: COMER | I187: MORONEY | L187: V JONES | O187: FEWSTER | W187: PRAHRAN | X187: 5 | Y187: 2 | Z187: 0 | AA187: 488 | AB187: 426 | AC187: 114.55399061032864 | AD187: 20
A188: PORT MELBOURNE | C188: GOTZ | F188: McNEILL | I188: SAMSON | L188: ROBINSON | O188: BARFOOT | W188: BRUNSWICK | X188: 3 | Y188: 4 | Z188: 0 | AA188: 407 | AB188: 402 | AC188: 101.24378109452736 | AD188: 12
A189: GOALKICKERS | W189: PORT MELBOURNE | X189: 3 | Y189: 4 | Z189: 0 | AA189: 395 | AB189: 466 | AC189: 84.763948497854074 | AD189: 12
A190: PRAHRAN | C190: FEWSTER 2 | F190: COMER | I190: DOWSING | L190: MORONEY
A191: PORT MELBOURNE | C191: ROBINSON 2 | G191: JENKINS | W191: NORTHCOTE | X191: 2 | Y191: 5 | Z191: 0 | AA191: 369 | AB191: 445 | AC191: 82.921348314606746 | AD191: 8
W192: FOOTSCRAY | X192: 1 | Y192: 6 | Z192: 0 | AA192: 296 | AB192: 495 | AC192: 59.797979797979799 | AD192: 4
A193: BRUNSWICK | C193: 3 | D193: 6 | E193: =C193*6+D193 -> 24 | G193: 3 | H193: 6 | I193: =G193*6+H193 -> 24 | K193: 4 | L193: 7 | M193: =K193*6+L193 -> 31 | O193: 6 | P193: 8 | Q193: =O193*6+P193 -> 44 | S193: NORTHCOTE
A194: NORTHCOTE | C194: 0 | D194: 2 | E194: =C194*6+D194 -> 2 | G194: 4 | H194: 8 | I194: =G194*6+H194 -> 32 | K194: 4 | L194: 8 | M194: =K194*6+L194 -> 32 | O194: 5 | P194: 9 | Q194: =O194*6+P194 -> 39 | S194: FRANKLIN
A195: BEST PLAYERS
A196: BRUNSWICK | C196: TWOMEY | F196: BRAID | I196: HARKER | L196: CHASE | O196: HASSETT | R196: CHANDLER
A197: NORTHCOTE | C197: RYAN | F197: DAVIES | I197: CHESSWASS | L197: KENNEDY | O197: GRAY | R197: H THOMAS
A198: GOALKICKERS
A199: BRUNSWICK | C199: TWOMEY 2 | G199: BRAID 2 | J199: HARKER | M199: TRICKEY
A200: NORTHCOTE | C200: RYAN 3 | F200: H SMITH | I200: DANIELS
A202: NORTH MELBOURNE | C202: 3 | D202: 4 | E202: =C202*6+D202 -> 22 | G202: 3 | H202: 5 | I202: =G202*6+H202 -> 23 | K202: 5 | L202: 5 | M202: =K202*6+L202 -> 35 | O202: 7 | P202: 6 | Q202: =O202*6+P202 -> 48 | S202: FOOTSCRAY
A203: FOOTSCRAY | C203: 0 | D203: 0 | E203: =C203*6+D203 -> 0 | G203: 0 | H203: 2 | I203: =G203*6+H203 -> 2 | K203: 0 | L203: 4 | M203: =K203*6+L203 -> 4 | O203: 1 | P203: 8 | Q203: =O203*6+P203 -> 14 | S203: KENDALL
A204: BEST PLAYERS
A205: NORTH MELBOURNE | C205: STEVENS | F205: MILBURN | I205: SHEEAHN | L205: BROWN | O205: DONNELLY | R205: GARDINER
A206: FOOTSCRAY | C206: WALLIS | F206: GREGORY | I206: CROUCH | L206: SAMSON | O206: McKENZIE
A207: GOALKICKERS
A208: NORTH MELBOURNE | C208: STEVENS 4 | F208: BROWN | I208: McCARTHY | L208: HAWKINS
A209: FOOTSCRAY | C209: McDONALD
A211: ROUND 8 | E211: 6TH JULY | J211: WEATHER | M211: SHOWERS WEST WIND | S211: PLAYED AT | X211: LADDER | AB211: ROUND | AD211: 8
D212: 1ST QTR | H212: 2ND QTR | L212: 3RD QTR | P212: FINAL | S212: BRUNSWICK
A213: BRUNSWICK | C213: 4 | D213: 6 | E213: =C213*6+D213 -> 30 | G213: 8 | H213: 10 | I213: =G213*6+H213 -> 58 | K213: 8 | L213: 12 | M213: =K213*6+L213 -> 60 | O213: 12 | P213: 15 | Q213: =O213*6+P213 -> 87 | S213: UMPIRE | W213: TEAM | X213: W | Y213: L | Z213: D | AA213: FOR | AB213: AGST | AC213: % | AD213: PTS
A214: PORT MELBOURNE | C214: 4 | D214: 2 | E214: =C214*6+D214 -> 26 | G214: 4 | H214: 4 | I214: =G214*6+H214 -> 28 | K214: 8 | L214: 8 | M214: =K214*6+L214 -> 56 | O214: 8 | P214: 14 | Q214: =O214*6+P214 -> 62 | S214: KENDALL
A215: BEST PLAYERS | W215: NORTH MELBOURNE | X215: 8 | Y215: 0 | Z215: 0 | AA215: 682 | AB215: 333 | AC215: 204.8048048048048 | AD215: 32
A216: BRUNSWICK | C216: WALKER | F216: SWIFT | I216: HARKER | L216: SULLIVAN | O216: BRAID | R216: CHASE | W216: PRAHRAN | X216: 6 | Y216: 2 | Z216: 0 | AA216: 586 | AB216: 458 | AC216: 127.9475982532751 | AD216: 24
A217: PORT MELBOURNE | C217: HOWARD | F217: GOTZ | I217: GRAHAM | L217: BARFOOT | O217: HARRISON | R217: KEAST | W217: BRUNSWICK | X217: 4 | Y217: 4 | Z217: 0 | AA217: 494 | AB217: 464 | AC217: 106.46551724137932 | AD217: 16
A218: GOALKICKERS | W218: PORT MELBOURNE | X218: 3 | Y218: 5 | Z218: 0 | AA218: 457 | AB218: 553 | AC218: 82.640144665461122 | AD218: 12
A219: BRUNSWICK | C219: HARKER 4 | F219: SULLIVAN 2 | J219: CHANDLER 2
A220: PORT MELBOURNE | C220: GOTZ 4 | F220: KEAST 2 | W220: NORTHCOTE | X220: 2 | Y220: 6 | Z220: 0 | AA220: 408 | AB220: 554 | AC220: 73.646209386281583 | AD220: 8
W221: FOOTSCRAY | X221: 1 | Y221: 7 | Z221: 0 | AA221: 328 | AB221: 593 | AC221: 55.31197301854975 | AD221: 4
A222: NORTH MELBOURNE | C222: 3 | D222: 6 | E222: =C222*6+D222 -> 24 | G222: 6 | H222: 8 | I222: =G222*6+H222 -> 44 | K222: 11 | L222: 13 | M222: =K222*6+L222 -> 79 | O222: 15 | P222: 19 | Q222: =O222*6+P222 -> 109 | S222: NORTH MELB
A223: NORTHCOTE | C223: 0 | D223: 1 | E223: =C223*6+D223 -> 1 | G223: 2 | H223: 7 | I223: =G223*6+H223 -> 19 | K223: 2 | L223: 8 | M223: =K223*6+L223 -> 20 | O223: 5 | P223: 9 | Q223: =O223*6+P223 -> 39 | S223: HURLEY
A224: BEST PLAYERS
A225: NORTH MELBOURNE | C225: STEVENS | F225: GARDINER | I225: HARDY | L225: CAVE | O225: SHEEHAN | R225: DONNELLY
A226: NORTHCOTE | C226: EDWARDS | F226: H SMITH | I226: RYAN | L226: H THOMAS
A227: GOALKICKERS
A228: NORTH MELBOURNE | C228: STEVENS 8 | F228: BROWN 3 | I228: TONKIN 2
A229: NORTHCOTE | C229: RYAN 4
A231: PRAHRAN | C231: 3 | D231: 5 | E231: =C231*6+D231 -> 23 | G231: 7 | H231: 6 | I231: =G231*6+H231 -> 48 | K231: 10 | L231: 7 | M231: =K231*6+L231 -> 67 | O231: 14 | P231: 14 | Q231: =O231*6+P231 -> 98 | S231: TOORAK PARK
A232: FOOTSCRAY | C232: 1 | D232: 0 | E232: =C232*6+D232 -> 6 | G232: 3 | H232: 6 | I232: =G232*6+H232 -> 24 | K232: 4 | L232: 7 | M232: =K232*6+L232 -> 31 | O232: 4 | P232: 8 | Q232: =O232*6+P232 -> 32 | S232: HERBERT
A233: BEST PLAYERS
A234: PRAHRAN | C234: CARLSON | F234: MORONEY | I234: CARR | L234: WEIDNER | O234: WOODHEAD | R234: V JONES
A235: FOOTSCRAY | C235: CROUCH | F235: GREGORY | I235: ANDREWS | L235: McKENZIE | O235: CRADDOCK
A236: GOALKICKERS
A237: PRAHRAN | C237: CARR 3 | F237: V JONES 2 | I237: MAYNARD 2 | L237: SALVANA 2 | O237: DOWSING 2
A238: FOOTSCRAY | C238: ANDREWS 2 | F238: CRADDOCK | I238: GREGORY
A240: ROUND 9 | E240: 13TH JULY | J240: WEATHER | M240: RAIN GROUNDS BAD | S240: PLAYED AT | X240: LADDER | AB240: ROUND | AD240: 9
D241: 1ST QTR | H241: 2ND QTR | L241: 3RD QTR | P241: FINAL | S241: TOORAK PARK
A242: NORTH MELBOURNE | C242: 2 | D242: 4 | E242: =C242*6+D242 -> 16 | G242: 5 | H242: 5 | I242: =G242*6+H242 -> 35 | K242: 6 | L242: 6 | M242: =K242*6+L242 -> 42 | O242: 8 | P242: 10 | Q242: =O242*6+P242 -> 58 | S242: UMPIRE | W242: TEAM | X242: W | Y242: L | Z242: D | AA242: FOR | AB242: AGST | AC242: % | AD242: PTS
A243: PRAHRAN | C243: 4 | D243: 3 | E243: =C243*6+D243 -> 27 | G243: 5 | H243: 5 | I243: =G243*6+H243 -> 35 | K243: 6 | L243: 5 | M243: =K243*6+L243 -> 41 | O243: 6 | P243: 8 | Q243: =O243*6+P243 -> 44 | S243: HURLEY
A244: BEST PLAYERS | W244: NORTH MELBOURNE | X244: 9 | Y244: 0 | Z244: 0 | AA244: 740 | AB244: 377 | AC244: 196.28647214854112 | AD244: 36
A245: NORTH MELBOURNE | C245: FRANKS | F245: GARDINER | I245: SHEEHAN | L245: BARKER | O245: DONNELLY | R245: CAVE | W245: PRAHRAN | X245: 6 | Y245: 3 | Z245: 0 | AA245: 630 | AB245: 516 | AC245: 122.09302325581395 | AD245: 24
A246: PRAHRAN | C246: ANTONIO | F246: FRAWLEY | I246: QUINN | L246: MORONEY | O246: RICHARDSON | R246: COMER | W246: BRUNSWICK | X246: 5 | Y246: 4 | Z246: 0 | AA246: 583 | AB246: 490 | AC246: 118.9795918367347 | AD246: 20
A247: GOALKICKERS | W247: PORT MELBOURNE | X247: 4 | Y247: 5 | Z247: 0 | AA247: 501 | AB247: 576 | AC247: 86.979166666666671 | AD247: 16
A248: NORTH MELBOURNE | C248: STEVENS 2
A249: PRAHRAN | C249: COMER 3 | W249: NORTHCOTE | X249: 2 | Y249: 7 | Z249: 0 | AA249: 431 | AB249: 598 | AC249: 72.073578595317727 | AD249: 8
W250: FOOTSCRAY | X250: 1 | Y250: 8 | Z250: 0 | AA250: 354 | AB250: 682 | AC250: 51.906158357771261 | AD250: 4
A251: PORT MELBOURNE | C251: 1 | D251: 1 | E251: =C251*6+D251 -> 7 | G251: 2 | H251: 4 | I251: =G251*6+H251 -> 16 | K251: 2 | L251: 4 | M251: =K251*6+L251 -> 16 | O251: 6 | P251: 8 | Q251: =O251*6+P251 -> 44 | S251: PORT MELB
A252: NORTHCOTE | C252: 1 | D252: 5 | E252: =C252*6+D252 -> 11 | G252: 1 | H252: 5 | I252: =G252*6+H252 -> 11 | K252: 2 | L252: 10 | M252: =K252*6+L252 -> 22 | O252: 2 | P252: 11 | Q252: =O252*6+P252 -> 23 | S252: KENDALL
A253: BEST PLAYERS
A254: PORT MELBOURNE | C254: GOTZ | F254: G STANFORD | I254: BARFOOT | L254: AMY | O254: SAMSON | R254: HARRISON
A255: NORTHCOTE | C255: RYAN | F255: CHESSWASS | I255: H THOMAS | L255: H SMITH | O255: JOYCE | R255: BASSETT
A256: GOALKICKERS
A257: PORT MELBOURNE | C257: GOTZ 3 | F257: G STANFORD | J257: COOK | M257: J STANFORD
A258: NORTHCOTE
A260: BRUNSWICK | C260: 1 | D260: 2 | E260: =C260*6+D260 -> 8 | G260: 5 | H260: 9 | I260: =G260*6+H260 -> 39 | K260: 6 | L260: 12 | M260: =K260*6+L260 -> 48 | O260: 12 | P260: 17 | Q260: =O260*6+P260 -> 89 | S260: BRUNSWICK
A261: FOOTSCRAY | C261: 0 | D261: 2 | E261: =C261*6+D261 -> 2 | G261: 0 | H261: 4 | I261: =G261*6+H261 -> 4 | K261: 3 | L261: 6 | M261: =K261*6+L261 -> 24 | O261: 3 | P261: 8 | Q261: =O261*6+P261 -> 26 | S261: HERBERT
A262: BEST PLAYERS
A263: BRUNSWICK | C263: CHASE | F263: SULLIVAN | I263: HARKER | L263: KEMP | O263: BRAID | R263: TWOMEY
A264: FOOTSCRAY | C264: CROUCH | F264: GREGORY | I264: CRADDOCK | L264: SAMSON | O264: McDONALD
A265: GOALKICKERS
A266: BRUNSWICK | C266: HARKER 4 | F266: TWOMEY 2 | I266: COFFEY 2 | L266: SULLIVAN | N266: CHASE | P266: CHRISTIE | R266: KEMP
A267: FOOTSCRAY | C267: CROUCH 2 | F267: ANDREWS
A269: ROUND 10 | E269: 20TH JULY | J269: WEATHER | M269: FINE COLD | S269: PLAYED AT | X269: LADDER | AB269: ROUND | AD269: 10
D270: 1ST QTR | H270: 2ND QTR | L270: 3RD QTR | P270: FINAL | S270: NORTH MELB
A271: NORTH MELBOURNE | C271: 1 | D271: 2 | E271: =C271*6+D271 -> 8 | G271: 6 | H271: 8 | I271: =G271*6+H271 -> 44 | K271: 11 | L271: 12 | M271: =K271*6+L271 -> 78 | O271: 16 | P271: 15 | Q271: =O271*6+P271 -> 111 | S271: UMPIRE | W271: TEAM | X271: W | Y271: L | Z271: D | AA271: FOR | AB271: AGST | AC271: % | AD271: PTS
A272: BRUNSWICK | C272: 1 | D272: 1 | E272: =C272*6+D272 -> 7 | G272: 3 | H272: 1 | I272: =G272*6+H272 -> 19 | K272: 4 | L272: 1 | M272: =K272*6+L272 -> 25 | O272: 4 | P272: 2 | Q272: =O272*6+P272 -> 26 | S272: HERBERT
A273: BEST PLAYERS | W273: NORTH MELBOURNE | X273: 10 | Y273: 0 | Z273: 0 | AA273: 851 | AB273: 403 | AC273: 211.16625310173697 | AD273: 40
A274: NORTH MELBOURNE | C274: BARKER | F274: GARDINER | I274: SHEEHAN | L274: McCARTHY | O274: DONNELLY | Q274: CAVE | W274: PRAHRAN | X274: 6 | Y274: 4 | Z274: 0 | AA274: 698 | AB274: 613 | AC274: 113.86623164763458 | AD274: 24
A275: BRUNSWICK | C275: HASSETT | F275: CHASE | I275: HARKER | L275: SWIFT | O275: COFFEY | Q275: WOODS | W275: BRUNSWICK | X275: 5 | Y275: 5 | Z275: 0 | AA275: 609 | AB275: 601 | AC275: 101.33111480865225 | AD275: 20
A276: GOALKICKERS | W276: PORT MELBOURNE | X276: 4 | Y276: 6 | Z276: 0 | AA276: 540 | AB276: 637 | AC276: 84.77 | AD276: 16
A277: NORTH MELBOURNE | C277: STEVENS 6 | F277: FORBES
A278: BRUNSWICK | W278: NORTHCOTE | X278: 3 | Y278: 7 | Z278: 0 | AA278: 528 | AB278: 666 | AC278: 79.27927927927928 | AD278: 12
W279: FOOTSCRAY | X279: 2 | Y279: 8 | Z279: 0 | AA279: 415 | AB279: 721 | AC279: 57.56 | AD279: 8
A280: FOOTSCRAY | C280: 3 | D280: 2 | E280: =C280*6+D280 -> 20 | G280: 5 | H280: 6 | I280: =G280*6+H280 -> 36 | K280: 6 | L280: 9 | M280: =K280*6+L280 -> 45 | O280: 8 | P280: 13 | Q280: =O280*6+P280 -> 61 | S280: FOOTSCRAY
A281: PORT MELBOURNE | C281: 0 | D281: 3 | E281: =C281*6+D281 -> 3 | G281: 2 | H281: 6 | I281: =G281*6+H281 -> 18 | K281: 4 | L281: 12 | M281: =K281*6+L281 -> 36 | O281: 4 | P281: 15 | Q281: =O281*6+P281 -> 39 | S281: HURLEY
A282: BEST PLAYERS
A283: FOOTSCRAY | C283: CRADDOCK | F283: GREGORY | I283: McDONALD | L283: McKENZIE | O283: CROUCH | R283: A MITCHELL
A284: PORT MELBOURNE | C284: GOTZ | F284: AMY | I284: SAMSON | L284: COOK | O284: GRAHAM | R284: HARRISON
A285: GOALKICKERS
A286: FOOTSCRAY | C286: LAWRENCE 2
A287: PORT MELBOURNE
A289: NORTHCOTE | C289: 4 | D289: 3 | E289: =C289*6+D289 -> 27 | G289: 6 | H289: 7 | I289: =G289*6+H289 -> 43 | K289: 9 | L289: 9 | M289: =K289*6+L289 -> 63 | O289: 14 | P289: 13 | Q289: =O289*6+P289 -> 97 | S289: NORTHCOTE
A290: PRAHRAN | C290: 1 | D290: 0 | E290: =C290*6+D290 -> 6 | G290: 5 | H290: 3 | I290: =G290*6+H290 -> 33 | K290: 6 | L290: 4 | M290: =K290*6+L290 -> 40 | O290: 10 | P290: 8 | Q290: =O290*6+P290 -> 68 | S290: KENDALL
A291: BEST PLAYERS
A292: NORTHCOTE | C292: RYAN | F292: JOYCE | I292: BASSETT | L292: CHESSWASS | O292: BYRNE | R292: DANIELS
A293: PRAHRAN | C293: DOWSING | F293: WEIDNER | I293: V JONES | L293: RICHARDSON | O293: WOODHEAD | R293: LOVE
A294: GOALKICKERS
A295: NORTHCOTE | C295: RYAN 5 | F295: DANIELS 2 | J295: WILSON 2
A296: PRAHRAN | C296: RICHARDSON 2 | G296: HUNTER 2 | J296: LOVE 2
A298: FINALS
A299: 1ST SEMI | E299: 27TH JULY | J299: WEATHER | M299: FINE BUT CLOUDY
D300: 1ST QTR | H300: 2ND QTR | L300: 3RD QTR | P300: FINAL
A301: PRAHRAN | C301: 1 | D301: 4 | E301: =C301*6+D301 -> 10 | G301: 5 | H301: 6 | I301: =G301*6+H301 -> 36 | K301: 6 | L301: 8 | M301: =K301*6+L301 -> 44 | O301: 8 | P301: 10 | Q301: =O301*6+P301 -> 58 | S301: NORTH MELB
A302: PORT MELBOURNE | C302: 4 | D302: 2 | E302: =C302*6+D302 -> 26 | G302: 5 | H302: 4 | I302: =G302*6+H302 -> 34 | K302: 7 | L302: 6 | M302: =K302*6+L302 -> 48 | O302: 8 | P302: 8 | Q302: =O302*6+P302 -> 56 | S302: KENDALL
A303: BEST PLAYERS
A304: PRAHRAN | D304: MORONEY | G304: ALLISTER | K304: MATHEWS | N304: WOOD | Q304: SALVANA | T304: CARLSON
A305: PORT MELBOURNE | D305: BARFOOT | G305: GRAHAM | K305: HOWARD | N305: NANCARROW | Q305: ROBINSON | T305: GRAHAM
A306: GOALKICKERS
A307: PRAHRAN | D307: WOOD 2 | G307: SALVANA 2
A308: PORT MELBOURNE | D308: HOWARD 2
A310: 2ND SEMI | E310: 3RD AUGUST | J310: WEATHER | M310: FINE SOUTH BREEZE
A311: NORTH MELBOURNE | C311: 2 | D311: 5 | E311: =C311*6+D311 -> 17 | G311: 6 | H311: 11 | I311: =G311*6+H311 -> 47 | K311: 7 | L311: 13 | M311: =K311*6+L311 -> 55 | O311: 10 | P311: 23 | Q311: =O311*6+P311 -> 83 | S311: NORTH MELB
A312: BRUNSWICK | C312: 3 | D312: 2 | E312: =C312*6+D312 -> 20 | G312: 3 | H312: 5 | I312: =G312*6+H312 -> 23 | K312: 4 | L312: 7 | M312: =K312*6+L312 -> 31 | O312: 4 | P312: 11 | Q312: =O312*6+P312 -> 35 | S312: HURLEY
A313: BEST PLAYERS
A314: NORTH MELBOURNE | D314: SHEEHAN | G314: BROWN | J314: BARKER | M314: HARDY | P314: DONNELY | S314: HART
A315: BRUNSWICK | D315: HARKER | G315: GEORGE | J315: HASSETT | M315: PRINCE | P315: TWOMEY | S315: BRAID
A316: GOALKICKERS
A317: NORTH MELBOURNE | D317: STEVENS 2 | G317: HAWKINS 2 | J317: HARDY 2 | M317: BROWN 2 | P317: DONNELLY | S317: FRANKS
A318: BRUNSWICK | D318: HARKER 2 | G318: HASSETT | J318: WOODS
A320: FINAL | E320: 10TH AUGUST | J320: WEATHER | M320: FINE
A321: NORTH MELBOURNE | C321: 6 | D321: 2 | E321: 38 | G321: 11 | H321: 6 | I321: 72 | K321: 15 | L321: 7 | M321: 97 | O321: 18 | P321: 13 | Q321: =O321*6+P321 -> 121 | S321: NORTH MELB
A322: PRAHRAN | C322: 0 | D322: 2 | E322: 2 | G322: 1 | H322: 6 | I322: 12 | K322: 3 | L322: 7 | M322: 25 | O322: 3 | P322: 10 | Q322: =O322*6+P322 -> 28 | S322: HURLEY
A323: BEST PLAYERS
A324: NORTH MELBOURNE | D324: STEVENS | G324: HARDY | J324: TONKIN | M324: CAVE | P324: DONNELLY | S324: BARKER
A325: PRAHRAN | D325: V JONES | G325: WOODS | J325: WEIDNER | M325: QUINN | P325: MORONEY | S325: MAYNARD
A326: GOALKICKERS
A327: NORTH MELBOURNE | D327: STEVENS 9 | G327: TONKIN 4 | J327: HAWKINS 4 | M327: HARDY
A328: PRAHRAN | D328: SALVANO | G328: MORONEY | J328: WOODHEAD