A1: Victorian Football Association
A2: Season 1919
A3: © Copyright Wal Williams | F3: First created: 2 August 2014
A4: Contact: joywalwi at gmail dot com | F4: Last updated: 30 July 2017 | W4: VFA Results and tables - Link to the main index page
A5: You are free to copy this document in whole or part provided that proper acknowledgement is given to the author. All rights reserved.
A7: YEAR 1919
A8: ROUND 1 | D8: 3RD MAY | J8: WEATHER | M8: FINE | S8: PLAYED AT | X8: LADDER | AB8: ROUND | AD8: 1
D9: 1ST QTR | H9: 2ND QTR | L9: 3RD QTR | P9: FINAL | S9: NORTH MELB
A10: NORTH MELBOURNE | C10: 5 | D10: 2 | E10: =C10*6+D10 -> 32 | G10: 7 | H10: 7 | I10: =G10*6+H10 -> 49 | K10: 12 | L10: 10 | M10: =K10*6+L10 -> 82 | O10: 19 | P10: 13 | Q10: =O10*6+P10 -> 127 | S10: UMPIRE | W10: TEAM | X10: W | Y10: L | Z10: D | AA10: FOR | AB10: AGST | AC10: % | AD10: PTS
A11: PORT MELBOURNE | C11: 1 | D11: 0 | E11: =C11*6+D11 -> 6 | G11: 1 | H11: 0 | I11: =G11*6+H11 -> 6 | K11: 1 | L11: 0 | M11: =K11*6+L11 -> 6 | O11: 4 | P11: 1 | Q11: =O11*6+P11 -> 25 | S11: McKENZIE
A12: BEST PLAYERS | W12: FOOTSCRAY | X12: 1 | Y12: 0 | Z12: 0 | AA12: 100 | AB12: 19 | AC12: 526.31578947368416 | AD12: 4
A13: NORTH MELBOURNE | C13: HART | F13: WOODINGTON | I13: STEVENS | L13: HAWKINS | O13: BARKER | Q13: HILL | W13: NORTH MELBOURNE | X13: 1 | Y13: 0 | Z13: 0 | AA13: 127 | AB13: 25 | AC13: 508 | AD13: 4
A14: PORT MELBOURNE | C14: J STANFORD | F14: COY | I14: PATTERSON | L14: BARFOOT | O14: SAMSON | Q14: JOHNSTON | W14: WILLIAMSTOWN | X14: 1 | Y14: 0 | Z14: 0 | AA14: 125 | AB14: 33 | AC14: 378.78787878787881 | AD14: 4
A15: GOALKICKERS | W15: BRUNSWICK | X15: 1 | Y15: 0 | Z15: 0 | AA15: 52 | AB15: 26 | AC15: 200 | AD15: 4
A16: NORTH MELBOURNE | C16: STEVENS 4 | F16: HARDY 3 | I16: MAY 3 | K16: RAWLE 2 | M16: BROWN 2 | O16: HAWKINS 2
A17: PORT MELBOURNE | W17: NORTHCOTE | X17: 1 | Y17: 0 | Z17: 0 | AA17: 85 | AB17: 66 | AC17: 128.78787878787878 | AD17: 4
W18: HAWTHORN | X18: 0 | Y18: 1 | Z18: 0 | AA18: 66 | AB18: 85 | AC18: 77.647058823529406 | AD18: 0
A19: FOOTSCRAY | C19: 3 | D19: 4 | E19: =C19*6+D19 -> 22 | G19: 7 | H19: 9 | I19: =G19*6+H19 -> 51 | K19: 12 | L19: 13 | M19: =K19*6+L19 -> 85 | O19: 14 | P19: 16 | Q19: =O19*6+P19 -> 100 | S19: FOOTSCRAY | W19: ESSENDON ASSOC. | X19: 0 | Y19: 1 | Z19: 0 | AA19: 26 | AB19: 52 | AC19: 50 | AD19: 0
A20: PRAHRAN | C20: 0 | D20: 1 | E20: =C20*6+D20 -> 1 | G20: 0 | H20: 3 | I20: =G20*6+H20 -> 3 | K20: 0 | L20: 4 | M20: =K20*6+L20 -> 4 | O20: 2 | P20: 7 | Q20: =O20*6+P20 -> 19 | S20: PRITCHARD | W20: BRIGHTON | X20: 0 | Y20: 1 | Z20: 0 | AA20: 33 | AB20: 125 | AC20: 26.4 | AD20: 0
A21: BEST PLAYERS | W21: PORT MELBOURNE | X21: 0 | Y21: 1 | Z21: 0 | AA21: 25 | AB21: 127 | AC21: 19.685039370078741 | AD21: 0
A22: FOOTSCRAY | C22: SEWART | F22: GREGORY | I22: J GRIERSON | L22: GRIEVES | O22: McDONALD | R22: PHILLIPS | W22: PRAHRAN | X22: 0 | Y22: 1 | Z22: 0 | AA22: 19 | AB22: 100 | AC22: 19 | AD22: 0
A23: PRAHRAN | C23: SULLIVAN | F23: TOPHAM | I23: MAYNARD | L23: QUINN | O23: TENNANT | R23: GEORGE
A24: GOALKICKERS
A25: FOOTSCRAY | C25: J GRIERSON 4 | F25: HOWELL 2 | I25: PHILLIPS 2 | K25: GREGORY 2 | N25: McDONALD 2 | Q25: GRIEVES | S25: TOMLIN
A26: PRAHRAN | C26: TENNANT | F26: CARLSON
A28: BRUNSWICK | C28: 0 | D28: 3 | E28: =C28*6+D28 -> 3 | G28: 1 | H28: 8 | I28: =G28*6+H28 -> 14 | K28: 4 | L28: 17 | M28: =K28*6+L28 -> 41 | O28: 5 | P28: 22 | Q28: =O28*6+P28 -> 52 | S28: ESSENDON
A29: ESSENDON ASSOC. | C29: 0 | D29: 4 | E29: =C29*6+D29 -> 4 | G29: 1 | H29: 6 | I29: =G29*6+H29 -> 12 | K29: 1 | L29: 7 | M29: =K29*6+L29 -> 13 | O29: 3 | P29: 8 | Q29: =O29*6+P29 -> 26 | S29: HERBERT
A30: BEST PLAYERS
A31: BRUNSWICK | C31: TAPPING | F31: STEVENSON | I31: HARKER | L31: CHRISTIE | O31: SULLIVAN | R31: JOHNSON
A32: ESSENDON ASSOC. | C32: SHEA | F32: WATT | I32: SHORTEN | L32: RUSSELL | O32: ROTHWELL | R32: KING
A33: GOALKICKERS
A34: BRUNSWICK | C34: DICK 2 | F34: HARKER 2 | I34: TOPHAM
A35: ESSENDON ASSOC. | C35: KING | F35: McCORMACK | I35: ADAMS
A37: WILLIAMSTOWN | C37: 7 | D37: 9 | E37: =C37*6+D37 -> 51 | G37: 9 | H37: 12 | I37: =G37*6+H37 -> 66 | K37: 12 | L37: 20 | M37: =K37*6+L37 -> 92 | O37: 17 | P37: 23 | Q37: =O37*6+P37 -> 125 | S37: BRIGHTON BEACH
A38: BRIGHTON | C38: 1 | D38: 0 | E38: =C38*6+D38 -> 6 | G38: 3 | H38: 1 | I38: =G38*6+H38 -> 19 | K38: 3 | L38: 2 | M38: =K38*6+L38 -> 20 | O38: 5 | P38: 3 | Q38: =O38*6+P38 -> 33 | S38: HURLEY
A39: BEST PLAYERS
A40: WILLIAMSTOWN | C40: MITCHELL | F40: GIBBS | I40: McTAGGART | L40: McSHANE | O40: AMY | Q40: McDONALD
A41: BRIGHTON | C41: DOWDING | F41: COBB | I41: McCARTHY | L41: McDONALD
A42: GOALKICKERS
A43: WILLIAMSTOWN | C43: MITCHELL 5 | F43: AMY 4 | H43: McDONALD 3 | K43: MIDDLETON 2 | N43: WOUDA | P43: DAYKIN | R43: McTAGGART
A44: BRIGHTON | C44: COBB 3
A46: NORTHCOTE | C46: 4 | D46: 3 | E46: =C46*6+D46 -> 27 | G46: 4 | H46: 13 | I46: =G46*6+H46 -> 37 | K46: 7 | L46: 18 | M46: =K46*6+L46 -> 60 | O46: 11 | P46: 19 | Q46: =O46*6+P46 -> 85 | S46: GLENFERRIE
A47: HAWTHORN | C47: 4 | D47: 1 | E47: =C47*6+D47 -> 25 | G47: 7 | H47: 2 | I47: =G47*6+H47 -> 44 | K47: 8 | L47: 9 | M47: =K47*6+L47 -> 57 | O47: 9 | P47: 12 | Q47: =O47*6+P47 -> 66 | S47: ALLEY
A48: BEST PLAYERS
A49: NORTHCOTE | C49: PINK | F49: MILLS | I49: O'KEEFE | L49: RYAN | O49: PURCELL | R49: CHESSWASS
A50: HAWTHORN | C50: LES GIBB | F50: LEN GIBB | I50: TANDAU | L50: WILKINSON | O50: DWYER | R50: HYDER
A51: GOALKICKERS
A52: NORTHCOTE | C52: PINK 3 | F52: T CHESSWASS 3 | J52: RYAN 2 | M52: BYRNE | O52: MILLS | Q52: WILSON
A53: HAWTHORN | C53: WILKINSON 3 | F53: TANTAU 2 | I53: TEAGUE | K53: NOTT | M53: HYDER | O53: LES GIBB
A55: ROUND 2 | D55: 10TH MAY | J55: WEATHER | M55: FINE N.W. WIND | S55: PLAYED AT | X55: LADDER | AB55: ROUND | AD55: 2
D56: 1ST QTR | H56: 2ND QTR | L56: 3RD QTR | P56: FINAL | S56: WILLIAMSTOWN
A57: NORTH MELBOURNE | C57: 3 | D57: 7 | E57: =C57*6+D57 -> 25 | G57: 4 | H57: 9 | I57: =G57*6+H57 -> 33 | K57: 6 | L57: 11 | M57: =K57*6+L57 -> 47 | O57: 7 | P57: 12 | Q57: =O57*6+P57 -> 54 | S57: UMPIRE | W57: TEAM | X57: W | Y57: L | Z57: D | AA57: FOR | AB57: AGST | AC57: % | AD57: PTS
A58: WILLIAMSTOWN | C58: 1 | D58: 1 | E58: =C58*6+D58 -> 7 | G58: 1 | H58: 6 | I58: =G58*6+H58 -> 12 | K58: 1 | L58: 7 | M58: =K58*6+L58 -> 13 | O58: 2 | P58: 9 | Q58: =O58*6+P58 -> 21 | S58: McKINNON
A59: BEST PLAYERS | W59: NORTH MELBOURNE | X59: 2 | Y59: 0 | Z59: 0 | AA59: 181 | AB59: 46 | AC59: 393.47826086956519 | AD59: 8
A60: NORTH MELBOURNE | C60: HART | F60: CAVE | I60: MILLER | K60: IRWIN | N60: HAWKINS | Q60: RAWLE | W60: FOOTSCRAY | X60: 2 | Y60: 0 | Z60: 0 | AA60: 154 | AB60: 57 | AC60: 270.17543859649123 | AD60: 8
A61: WILLIAMSTOWN | C61: MITCHELL | F61: ROBERTSON | I61: HARDEN | K61: AMY | N61: GIBBS | Q61: McTAGGART | W61: BRUNSWICK | X61: 2 | Y61: 0 | Z61: 0 | AA61: 106 | AB61: 70 | AC61: 151.42857142857142 | AD61: 8
A62: GOALKICKERS | W62: WILLIAMSTOWN | X62: 1 | Y62: 1 | Z62: 0 | AA62: 146 | AB62: 87 | AC62: 167.81609195402299 | AD62: 4
A63: NORTH MELBOURNE | C63: STEVENS 2 | F63: HAWKINS 2 | I63: MATSON 2
A64: WILLIAMSTOWN | C64: MITCHELL | F64: WEBSTER | W64: NORTHCOTE | X64: 1 | Y64: 1 | Z64: 0 | AA64: 123 | AB64: 120 | AC64: 102.5 | AD64: 4
W65: PORT MELBOURNE | X65: 1 | Y65: 1 | Z65: 0 | AA65: 88 | AB65: 167 | AC65: 52.694610778443113 | AD65: 4
A66: FOOTSCRAY | C66: 1 | D66: 2 | E66: =C66*6+D66 -> 8 | G66: 4 | H66: 5 | I66: =G66*6+H66 -> 29 | K66: 6 | L66: 6 | M66: =K66*6+L66 -> 42 | O66: 8 | P66: 6 | Q66: =O66*6+P66 -> 54 | S66: NORTHCOTE | W66: PRAHRAN | X66: 1 | Y66: 1 | Z66: 0 | AA66: 61 | AB66: 135 | AC66: 45.185185185185183 | AD66: 4
A67: NORTHCOTE | C67: 0 | D67: 3 | E67: =C67*6+D67 -> 3 | G67: 1 | H67: 4 | I67: =G67*6+H67 -> 10 | K67: 3 | L67: 9 | M67: =K67*6+L67 -> 27 | O67: 4 | P67: 14 | Q67: =O67*6+P67 -> 38 | S67: GIBSON | W67: HAWTHORN | X67: 0 | Y67: 2 | Z67: 0 | AA67: 110 | AB67: 139 | AC67: 79.136690647482013 | AD67: 0
A68: BEST PLAYERS | W68: ESSENDON ASSOC. | X68: 0 | Y68: 2 | Z68: 0 | AA68: 61 | AB68: 94 | AC68: 64.893617021276597 | AD68: 0
A69: FOOTSCRAY | C69: SAMSON | F69: PHILLIPS | I69: GREGORY | L69: McKENZIE | O69: BYRON | Q69: HOWELL | W69: BRIGHTON | X69: 0 | Y69: 2 | Z69: 0 | AA69: 73 | AB69: 188 | AC69: 38.829787234042556 | AD69: 0
A70: NORTHCOTE | C70: PATTERSON | F70: POWDITCH | I70: PINK | L70: O'KEEFE | O70: THOMAS
A71: GOALKICKERS
A72: FOOTSCRAY | C72: BYRON 3 | F72: SAMSON | I72: McDONALD | L72: PHILLIPS | O72: BECK | Q72: GREGORY
A73: NORTHCOTE | C73: O'BRIEN | F73: POWDITCH | I73: PINK | L73: RYAN
A75: BRUNSWICK | C75: 3 | D75: 7 | E75: =C75*6+D75 -> 25 | G75: 4 | H75: 8 | I75: =G75*6+H75 -> 32 | K75: 6 | L75: 11 | M75: =K75*6+L75 -> 47 | O75: 7 | P75: 12 | Q75: =O75*6+P75 -> 54 | S75: BRUNSWICK
A76: HAWTHORN | C76: 0 | D76: 1 | E76: =C76*6+D76 -> 1 | G76: 3 | H76: 4 | I76: =G76*6+H76 -> 22 | K76: 5 | L76: 6 | M76: =K76*6+L76 -> 36 | O76: 6 | P76: 8 | Q76: =O76*6+P76 -> 44 | S76: KNOWLES
A77: BEST PLAYERS
A78: BRUNSWICK | C78: BRISCOE | F78: DICK | I78: SULLIVAN | L78: HARKER | O78: CHASE | R78: GRIMSTER
A79: HAWTHORN | C79: TEAGUE | F79: WILKINSON | I79: LEN GIBB | L79: LES GIBB | O79: HOLLAND | R79: NOTT
A80: GOALKICKERS
A81: BRUNSWICK | C81: HARKER 2 | F81: ADAMS | I81: WALKER | K81: GARDINER | N81: STEVENSON | Q81: CHASE
A82: HAWTHORN | C82: LEN GIBB 2 | F82: WILKINSON | I82: BRAZIER | K82: DAVEY | M82: NOTT
A84: PRAHRAN | C84: 1 | D84: 5 | E84: =C84*6+D84 -> 11 | G84: 2 | H84: 5 | I84: =G84*6+H84 -> 17 | K84: 3 | L84: 6 | M84: =K84*6+L84 -> 24 | O84: 5 | P84: 12 | Q84: =O84*6+P84 -> 42 | S84: TOORAK PARK
A85: ESSENDON ASSOC. | C85: 1 | D85: 0 | E85: =C85*6+D85 -> 6 | G85: 2 | H85: 3 | I85: =G85*6+H85 -> 15 | K85: 3 | L85: 10 | M85: =K85*6+L85 -> 28 | O85: 4 | P85: 11 | Q85: =O85*6+P85 -> 35 | S85: SMITH
A86: BEST PLAYERS
A87: PRAHRAN | C87: JAMES | F87: KIKER | I87: MAYNARD | L87: WEIDNER | O87: CARLSON | R87: V JONES
A88: ESSENDON ASSOC. | C88: RYAN | F88: MADDEN | I88: STROWNIX | L88: SHEA | O88: KING | R88: PERKINS
A89: GOALKICKERS
A90: PRAHRAN | C90: JAMES 3 | F90: KIKER | I90: V JONES
A91: ESSENDON ASSOC.
A93: PORT MELBOURNE | C93: 3 | D93: 3 | E93: =C93*6+D93 -> 21 | G93: 3 | H93: 7 | I93: =G93*6+H93 -> 25 | K93: 5 | L93: 13 | M93: =K93*6+L93 -> 43 | O93: 8 | P93: 15 | Q93: =O93*6+P93 -> 63 | S93: PORT MELB
A94: BRIGHTON | C94: 0 | D94: 0 | E94: =C94*6+D94 -> 0 | G94: 4 | H94: 6 | I94: =G94*6+H94 -> 30 | K94: 4 | L94: 6 | M94: =K94*6+L94 -> 30 | O94: 5 | P94: 10 | Q94: =O94*6+P94 -> 40 | S94: PORTEOUS
A95: BEST PLAYERS
A96: PORT MELBOURNE | C96: HUTCHINSON | F96: BARFOOT | I96: NANCARROW | L96: RYLAND | O96: J STANFORD | R96: CONDON
A97: BRIGHTON | C97: A McCARTHY | F97: COBB | I97: DOWDING | L97: GREEN | O97: CARROLL | R97: SHELTON
A98: GOALKICKERS
A99: PORT MELBOURNE | C99: HUTCHINSON 2 | F99: COOK 2 | H99: KEAST | J99: BELLEVILLE | M99: BOND | O99: HOWARD
A100: BRIGHTON | C100: COBB 2
A102: ROUND 3 | D102: 17TH MAY | J102: WEATHER | M102: FINE S.E. BREEZE | S102: PLAYED AT | X102: LADDER | AB102: ROUND | AD102: 3
D103: 1ST QTR | H103: 2ND QTR | L103: 3RD QTR | P103: FINAL | S103: NORTH MELB
A104: NORTH MELBOURNE | C104: 2 | D104: 0 | E104: =C104*6+D104 -> 12 | G104: 5 | H104: 2 | I104: =G104*6+H104 -> 32 | K104: 5 | L104: 5 | M104: =K104*6+L104 -> 35 | O104: 8 | P104: 6 | Q104: =O104*6+P104 -> 54 | S104: UMPIRE | W104: TEAM | X104: W | Y104: L | Z104: D | AA104: FOR | AB104: AGST | AC104: % | AD104: PTS
A105: FOOTSCRAY | C105: 2 | D105: 1 | E105: =C105*6+D105 -> 13 | G105: 2 | H105: 2 | I105: =G105*6+H105 -> 14 | K105: 6 | L105: 4 | M105: =K105*6+L105 -> 40 | O105: 7 | P105: 5 | Q105: =O105*6+P105 -> 47 | S105: McKINNON
A106: BEST PLAYERS | W106: NORTH MELBOURNE | X106: 3 | Y106: 0 | Z106: 0 | AA106: 235 | AB106: 93 | AC106: 252.68817204301075 | AD106: 12
A107: NORTH MELBOURNE | C107: BROWN | F107: STEVENS | I107: RAWLE | L107: FORBES | O107: WOODINGTON | R107: GARDINER | W107: BRUNSWICK | X107: 3 | Y107: 0 | Z107: 0 | AA107: 171 | AB107: 125 | AC107: 136.8 | AD107: 12
A108: FOOTSCRAY | C108: HOWELL | F108: SAMSON | I108: J GRIERSON | L108: GREGORY | O108: McKENZIE | R108: FITZGIBBON | W108: FOOTSCRAY | X108: 2 | Y108: 1 | Z108: 0 | AA108: 201 | AB108: 111 | AC108: 181.08108108108109 | AD108: 8
A109: GOALKICKERS | W109: NORTHCOTE | X109: 2 | Y109: 1 | Z109: 0 | AA109: 210 | AB109: 186 | AC109: 112.90322580645162 | AD109: 8
A110: NORTH MELBOURNE | C110: STEVENS 2 | F110: BARKER 2 | I110: IRWIN | K110: HAWKINS | M110: FORBES | O110: MAY
A111: FOOTSCRAY | C111: GRGEORY 3 | F111: PHILLIPS 2 | I111: McDONALD 2 | W111: PORT MELBOURNE | X111: 2 | Y111: 1 | Z111: 0 | AA111: 176 | AB111: 218 | AC111: 80.733944954128447 | AD111: 8
W112: WILLIAMSTOWN | X112: 1 | Y112: 2 | Z112: 0 | AA112: 202 | AB112: 151 | AC112: 133.7748344370861 | AD112: 4
A113: BRUNSWICK | C113: 2 | D113: 4 | E113: =C113*6+D113 -> 16 | G113: 3 | H113: 6 | I113: =G113*6+H113 -> 24 | K113: 5 | L113: 10 | M113: =K113*6+L113 -> 40 | O113: 9 | P113: 11 | Q113: =O113*6+P113 -> 65 | S113: BRUNSWICK | W113: HAWTHORN | X113: 1 | Y113: 2 | Z113: 0 | AA113: 174 | AB113: 195 | AC113: 89.230769230769226 | AD113: 4
A114: PRAHRAN | C114: 0 | D114: 2 | E114: =C114*6+D114 -> 2 | G114: 1 | H114: 5 | I114: =G114*6+H114 -> 11 | K114: 2 | L114: 10 | M114: =K114*6+L114 -> 22 | O114: 7 | P114: 13 | Q114: =O114*6+P114 -> 55 | S114: HERBERT | W114: PRAHRAN | X114: 1 | Y114: 2 | Z114: 0 | AA114: 116 | AB114: 200 | AC114: 58 | AD114: 4
A115: BEST PLAYERS | W115: ESSENDON ASSOC. | X115: 0 | Y115: 3 | Z115: 0 | AA115: 112 | AB115: 182 | AC115: 61.53846153846154 | AD115: 0
A116: BRUNSWICK | C116: SULLIVAN | F116: HARKER | I116: PRINCE | L116: KEMP | O116: CHRISTIE | R116: BRISCOE | W116: BRIGHTON | X116: 0 | Y116: 3 | Z116: 0 | AA116: 139 | AB116: 275 | AC116: 50.545454545454547 | AD116: 0
A117: PRAHRAN | C117: FRAWLEY | F117: QUINN | I117: ALLISTER | L117: WEIDNER | O117: GLEESON | R117: KIKER
A118: GOALKICKERS
A119: BRUNSWICK | C119: TOPHAM 3 | F119: GARDINER 2 | I119: WALKER 2 | L119: SULLIVAN | N119: HARKER
A120: PRAHRAN | C120: KIKER 2 | F120: JAMES 2 | I120: SULLIVAN | L120: WEBSTER | N120: CARR
A122: HAWTHORN | C122: 2 | D122: 3 | E122: =C122*6+D122 -> 15 | G122: 5 | H122: 6 | I122: =G122*6+H122 -> 36 | K122: 5 | L122: 12 | M122: =K122*6+L122 -> 42 | O122: 8 | P122: 16 | Q122: =O122*6+P122 -> 64 | S122: GLENFERRIE
A123: WILLIAMSTOWN | C123: 1 | D123: 6 | E123: =C123*6+D123 -> 12 | G123: 4 | H123: 10 | I123: =G123*6+H123 -> 34 | K123: 5 | L123: 10 | M123: =K123*6+L123 -> 40 | O123: 7 | P123: 14 | Q123: =O123*6+P123 -> 56 | S123: HERBERT
A124: BEST PLAYERS
A125: HAWTHORN | C125: WILKINSON | F125: LEN GIBB | I125: NOTT | L125: ROBERTS | O125: ALLEY | Q125: WALLIS
A126: WILLIAMSTOWN | C126: ROBERTSON | F126: AMY | I126: ANDERSON | L126: HARDEN | O126: MITCHELL | Q126: BROWN
A127: GOALKICKERS
A128: HAWTHORN | C128: WILKINSON 3 | G128: NOTT 3 | J128: LEN GIBB | M128: SCOTT
A129: WILLIAMSTOWN | C129: H McTAGGART 3 | G129: HARDEN | J129: McDONALD | M129: GIBBS | O129: STEPHENSON | R129: ROBERTSON
A131: PORT MELBOURNE | C131: 3 | D131: 4 | E131: =C131*6+D131 -> 22 | G131: 4 | H131: 8 | I131: =G131*6+H131 -> 32 | K131: 8 | L131: 12 | M131: =K131*6+L131 -> 60 | O131: 12 | P131: 16 | Q131: =O131*6+P131 -> 88 | S131: PORT MELB
A132: ESSENDON ASSOC. | C132: 1 | D132: 1 | E132: =C132*6+D132 -> 7 | G132: 4 | H132: 7 | I132: =G132*6+H132 -> 31 | K132: 4 | L132: 8 | M132: =K132*6+L132 -> 32 | O132: 7 | P132: 9 | Q132: =O132*6+P132 -> 51 | S132: ALLEY
A133: BEST PLAYERS
A134: PORT MELBOURNE | C134: COCK | F134: BOND | I134: CONDON | L134: BARFOOT | O134: SAMSON | R134: HUTCHINSON
A135: ESSENDON ASSOC. | C135: MITCHELL | F135: RUSSELL | I135: McDONALD | L135: STOWNIX | O135: LAIDLAW | R135: ADAMS
A136: GOALKICKERS
A137: PORT MELBOURNE | C137: COOK 4 | F137: BOND 3 | I137: CONDON 3 | L137: NANCARROW | O137: HOWARD
A138: ESSENDON ASSOC.
A140: NORTHCOTE | C140: 1 | D140: 8 | E140: =C140*6+D140 -> 14 | G140: 3 | H140: 9 | I140: =G140*6+H140 -> 27 | K140: 9 | L140: 13 | M140: =K140*6+L140 -> 67 | O140: 12 | P140: 15 | Q140: =O140*6+P140 -> 87 | S140: BRIGHTON BEACH
A141: BRIGHTON | C141: 0 | D141: 1 | E141: =C141*6+D141 -> 1 | G141: 3 | H141: 4 | I141: =G141*6+H141 -> 22 | K141: 6 | L141: 7 | M141: =K141*6+L141 -> 43 | O141: 9 | P141: 12 | Q141: =O141*6+P141 -> 66 | S141: PORTEOUS
A142: BEST PLAYERS
A143: NORTHCOTE | C143: POWDITCH | F143: O'KEEFE | I143: O'BRIEN | L143: HOLMES | O143: DANIELS | R143: MILLS
A144: BRIGHTON | C144: DUGGAN | F144: T BAYLISS | I144: COBB | L144: BYRNE | O144: M McCARTHY | R144: CARROLL
A145: GOALKICKERS
A146: NORTHCOTE | C146: RYAN 3 | F146: MILLS 3 | I146: O'BRIEN 3
A147: BRIGHTON
A149: ROUND 4 | D149: 24TH MAY | J149: WEATHER | M149: SOUTH WIND SHOWERS | S149: PLAYED AT | X149: LADDER | AB149: ROUND | AD149: 4
D150: 1ST QTR | H150: 2ND QTR | L150: 3RD QTR | P150: FINAL | S150: NORTHCOTE
A151: NORTHCOTE | C151: 3 | D151: 2 | E151: =C151*6+D151 -> 20 | G151: 6 | H151: 3 | I151: =G151*6+H151 -> 39 | K151: 8 | L151: 5 | M151: =K151*6+L151 -> 53 | O151: 11 | P151: 6 | Q151: =O151*6+P151 -> 72 | S151: UMPIRE | W151: TEAM | X151: W | Y151: L | Z151: D | AA151: FOR | AB151: AGST | AC151: % | AD151: PTS
A152: BRUNSWICK | C152: 2 | D152: 4 | E152: =C152*6+D152 -> 16 | G152: 4 | H152: 4 | I152: =G152*6+H152 -> 28 | K152: 7 | L152: 6 | M152: =K152*6+L152 -> 48 | O152: 10 | P152: 9 | Q152: =O152*6+P152 -> 69 | S152: HERBERT
A153: BEST PLAYERS | W153: NORTH MELBOURNE | X153: 4 | Y153: 0 | Z153: 0 | AA153: 314 | AB153: 130 | AC153: 241.53846153846155 | AD153: 16
A154: NORTHCOTE | C154: JOYCE | F154: O'KEEFE | I154: MILLS | L154: CHESSWASS | O154: SMITH | Q154: O'BRIEN | W154: FOOTSCRAY | X154: 3 | Y154: 1 | Z154: 0 | AA154: 267 | AB154: 125 | AC154: 213.6 | AD154: 12
A155: BRUNSWICK | C155: KIELY | F155: CHASE | I155: HARKER | L155: GRIMSTER | O155: SULLIVAN | Q155: STEVENSON | W155: BRUNSWICK | X155: 3 | Y155: 1 | Z155: 0 | AA155: 240 | AB155: 197 | AC155: 121.82741116751269 | AD155: 12
A156: GOALKICKERS | W156: NORTHCOTE | X156: 3 | Y156: 1 | Z156: 0 | AA156: 282 | AB156: 255 | AC156: 110.58823529411765 | AD156: 12
A157: NORTHCOTE | C157: JOYCE 5 | F157: MILLS | H157: O'KEEFE | J157: WILSON | L157: O'BRIEN | N157: McGUIRE | P157: POWDITCH
A158: BRUNSWICK | C158: HARKER 4 | F158: CHASE 2 | I158: PRINCE | K158: KIELY | M158: KEMP | O158: SULLIVAN | W158: WILLIAMSTOWN | X158: 2 | Y158: 2 | Z158: 0 | AA158: 249 | AB158: 185 | AC158: 134.59459459459458 | AD158: 8
W159: PORT MELBOURNE | X159: 2 | Y159: 2 | Z159: 0 | AA159: 210 | AB159: 265 | AC159: 79.245283018867923 | AD159: 8
A160: WILLIAMSTOWN | C160: 1 | D160: 2 | E160: =C160*6+D160 -> 8 | G160: 2 | H160: 8 | I160: =G160*6+H160 -> 20 | K160: 4 | L160: 11 | M160: =K160*6+L160 -> 35 | O160: 5 | P160: 17 | Q160: =O160*6+P160 -> 47 | S160: WILLIAMSTOWN | W160: ESSENDON ASSOC. | X160: 1 | Y160: 3 | Z160: 0 | AA160: 202 | AB160: 237 | AC160: 85.232067510548518 | AD160: 4
A161: PORT MELBOURNE | C161: 1 | D161: 3 | E161: =C161*6+D161 -> 9 | G161: 1 | H161: 4 | I161: =G161*6+H161 -> 10 | K161: 3 | L161: 4 | M161: =K161*6+L161 -> 22 | O161: 5 | P161: 4 | Q161: =O161*6+P161 -> 34 | S161: McKENZIE | W161: HAWTHORN | X161: 1 | Y161: 3 | Z161: 0 | AA161: 188 | AB161: 261 | AC161: 72.030651340996172 | AD161: 4
A162: BEST PLAYERS | W162: PRAHRAN | X162: 1 | Y162: 3 | Z162: 0 | AA162: 153 | AB162: 279 | AC162: 54.838709677419352 | AD162: 4
A163: WILLIAMSTOWN | C163: BROWN | F163: WEBSTER | I163: ROBERTSON | L163: KENNEDY | N163: GIBBS | Q163: MITCHELL | W163: BRIGHTON | X163: 0 | Y163: 4 | Z163: 0 | AA163: 194 | AB163: 365 | AC163: 53.150684931506852 | AD163: 0
A164: PORT MELBOURNE | C164: BARFOOT | F164: THORPE | I164: CONDON | L164: COOK | N164: HOWARD | Q164: NANCARROW
A165: GOALKICKERS
A166: WILLIAMSTOWN | C166: AMY 2 | F166: McTAGGART | I166: BROWN | L166: WEBSTER
A167: PORT MELBOURNE | C167: THORPE 2 | F167: CONDON | I167: COOK | L167: HOWARD
A169: FOOTSCRAY | C169: 0 | D169: 4 | E169: =C169*6+D169 -> 4 | G169: 1 | H169: 9 | I169: =G169*6+H169 -> 15 | K169: 6 | L169: 10 | M169: =K169*6+L169 -> 46 | O169: 8 | P169: 18 | Q169: =O169*6+P169 -> 66 | S169: FOOTSCRAY
A170: HAWTHORN | C170: 0 | D170: 0 | E170: =C170*6+D170 -> 0 | G170: 0 | H170: 2 | I170: =G170*6+H170 -> 2 | K170: 0 | L170: 2 | M170: =K170*6+L170 -> 2 | O170: 2 | P170: 2 | Q170: =O170*6+P170 -> 14 | S170: McKINNON
A171: BEST PLAYERS
A172: FOOTSCRAY | C172: McDONALD | F172: HOWELL | I172: EDWARDS | L172: SAMSON | N172: FITZGIBBON | Q172: MONGAN
A173: HAWTHORN | C173: ROBERTS | F173: WALLIS | I173: LEN GIBB | L173: GODFREY | N173: BLACKMAN | Q173: ALLEY
A174: GOALKICKERS
A175: FOOTSCRAY | C175: MORGAN 4 | F175: MCKENZIE | I175: GRIEVES | L175: COLLINS | O175: KEYHOE
A176: HAWTHORN | C176: RIGALDI | F176: LES GIBB
A178: NORTH MELBOURNE | C178: 1 | D178: 3 | E178: =C178*6+D178 -> 9 | G178: 4 | H178: 10 | I178: =G178*6+H178 -> 34 | K178: 5 | L178: 13 | M178: =K178*6+L178 -> 43 | O178: 10 | P178: 19 | Q178: =O178*6+P178 -> 79 | S178: TOORAK PARK
A179: PRAHRAN | C179: 0 | D179: 6 | E179: =C179*6+D179 -> 6 | G179: 0 | H179: 8 | I179: =G179*6+H179 -> 8 | K179: 1 | L179: 13 | M179: =K179*6+L179 -> 19 | O179: 4 | P179: 13 | Q179: =O179*6+P179 -> 37 | S179: PRITCHARD
A180: BEST PLAYERS
A181: NORTH MELBOURNE | C181: IRWIN | F181: BARKER | I181: HARDY | L181: STEVENS | N181: GARDINER | Q181: BROWN
A182: PRAHRAN | C182: WEIDNER | F182: FRAWLEY | I182: CARR | L182: MOORE | N182: MASTERS | Q182: ALLISTER
A183: GOALKICKERS
A184: NORTH MELBOURNE | C184: STEVENS 4 | F184: IRWIN 2 | I184: BROWN 2 | L184: BARKER | N184: FORBES
A185: PRAHRAN | C185: JAMES 2 | F185: COMER | I185: V JONES
A187: ESSENDON ASSOC. | C187: 2 | D187: 4 | E187: =C187*6+D187 -> 16 | G187: 8 | H187: 6 | I187: =G187*6+H187 -> 54 | K187: 11 | L187: 12 | M187: =K187*6+L187 -> 78 | O187: 13 | P187: 12 | Q187: =O187*6+P187 -> 90 | S187: ESSENDON
A188: BRIGHTON | C188: 1 | D188: 2 | E188: =C188*6+D188 -> 8 | G188: 2 | H188: 3 | I188: =G188*6+H188 -> 15 | K188: 3 | L188: 4 | M188: =K188*6+L188 -> 22 | O188: 7 | P188: 13 | Q188: =O188*6+P188 -> 55 | S188: HURLEY
A189: BEST PLAYERS
A190: ESSENDON ASSOC. | C190: SHORTEN | F190: STROWNIX | I190: SEVIOR | L190: KING | N190: COCHRANE | Q190: GRUNDEN
A191: BRIGHTON | C191: SHELTON | F191: BYRNE | I191: J McCARTHY | L191: CARROLL | N191: GRAHAM | Q191: DOWDING
A192: GOALKICKERS
A193: ESSENDON ASSOC. | C193: GRUNDEN 4 | F193: MURTAGH 3 | I193: STROWNIX | K193: KING | M193: McDONALD | O193: McCORMACK | R193: DONNELLY | U193: ROTHWELL
A194: BRIGHTON | C194: DOWDING 3 | F194: J McCARTHY 2 | J194: COBB | L194: DUGGAN
A196: ROUND 5 | D196: 31ST MAY | J196: WEATHER | M196: NORTH WIND | S196: PLAYED AT | X196: LADDER | AB196: ROUND | AD196: 5
D197: 1ST QTR | H197: 2ND QTR | L197: 3RD QTR | P197: FINAL | S197: NORTH MELB
A198: NORTH MELBOURNE | C198: 2 | D198: 3 | E198: =C198*6+D198 -> 15 | G198: 5 | H198: 10 | I198: =G198*6+H198 -> 40 | K198: 6 | L198: 13 | M198: =K198*6+L198 -> 49 | O198: 8 | P198: 22 | Q198: =O198*6+P198 -> 70 | S198: UMPIRE | W198: TEAM | X198: W | Y198: L | Z198: D | AA198: FOR | AB198: AGST | AC198: % | AD198: PTS
A199: BRUNSWICK | C199: 0 | D199: 1 | E199: =C199*6+D199 -> 1 | G199: 2 | H199: 1 | I199: =G199*6+H199 -> 13 | K199: 4 | L199: 6 | M199: =K199*6+L199 -> 30 | O199: 5 | P199: 7 | Q199: =O199*6+P199 -> 37 | S199: PRITCHARD
A200: BEST PLAYERS | W200: NORTH MELBOURNE | X200: 5 | Y200: 0 | Z200: 0 | AA200: 384 | AB200: 167 | AC200: 229.94011976047904 | AD200: 20
A201: NORTH MELBOURNE | C201: HARDY | E201: BARKER | H201: CUMMINGS | K201: STEVENS | N201: WOODINGTON | Q201: SHEEHAN | W201: FOOTSCRAY | X201: 4 | Y201: 1 | Z201: 0 | AA201: 374 | AB201: 155 | AC201: 241.29032258064515 | AD201: 16
A202: BRUNSWICK | C202: TAPPING | E202: DICK | H202: WOODS | K202: CHASE | N202: STEVENSON | Q202: CLOWE | W202: WILLIAMSTOWN | X202: 3 | Y202: 2 | Z202: 0 | AA202: 300 | AB202: 210 | AC202: 142.85714285714286 | AD202: 12
A203: GOALKICKERS | W203: NORTHCOTE | X203: 3 | Y203: 2 | Z203: 0 | AA203: 318 | AB203: 306 | AC203: 103.92156862745098 | AD203: 12
A204: NORTH MELBOURNE | C204: STEVENS 3 | F204: CUMMINGS 2 | J204: BROWN | M204: RAWLE | O204: HARDY
A205: BRUNSWICK | C205: KIELY | F205: GARDINER | I205: HARKER | L205: DICK | N205: CHASE | W205: BRUNSWICK | X205: 3 | Y205: 2 | Z205: 0 | AA205: 277 | AB205: 267 | AC205: 103.74531835205993 | AD205: 12
W206: PORT MELBOURNE | X206: 3 | Y206: 2 | Z206: 0 | AA206: 283 | AB206: 317 | AC206: 89.274447949526817 | AD206: 12
A207: WILLIAMSTOWN | C207: 1 | D207: 3 | E207: =C207*6+D207 -> 9 | G207: 3 | H207: 6 | I207: =G207*6+H207 -> 24 | K207: 3 | L207: 11 | M207: =K207*6+L207 -> 29 | O207: 6 | P207: 15 | Q207: =O207*6+P207 -> 51 | S207: ESSENDON | W207: PRAHRAN | X207: 2 | Y207: 3 | Z207: 0 | AA207: 204 | AB207: 315 | AC207: 64.761904761904759 | AD207: 8
A208: ESSENDON ASSOC. | C208: 1 | D208: 4 | E208: =C208*6+D208 -> 10 | G208: 1 | H208: 7 | I208: =G208*6+H208 -> 13 | K208: 2 | L208: 9 | M208: =K208*6+L208 -> 21 | O208: 2 | P208: 13 | Q208: =O208*6+P208 -> 25 | S208: ALLEY | W208: ESSENDON ASSOC. | X208: 1 | Y208: 4 | Z208: 0 | AA208: 227 | AB208: 288 | AC208: 78.819444444444443 | AD208: 4
A209: BEST PLAYERS | W209: HAWTHORN | X209: 1 | Y209: 4 | Z209: 0 | AA209: 240 | AB209: 334 | AC209: 71.856287425149702 | AD209: 4
A210: WILLIAMSTOWN | C210: KENNEDY | F210: MITCHELL | I210: BROWN | L210: WEBSTER | O210: McDONALD | R210: AMY | W210: BRIGHTON | X210: 0 | Y210: 5 | Z210: 0 | AA210: 224 | AB210: 472 | AC210: 47.457627118644069 | AD210: 0
A211: ESSENDON ASSOC. | C211: FIELDING | F211: STROWNIX | I211: COCHRANE | L211: SHORTEN | O211: MURTAGH | R211: WATT
A212: GOALKICKERS
A213: WILLIAMSTOWN | C213: STEPHENSON 2 | G213: McTAGGART | J213: STONE | M213: GIBBS | O213: WEBSTER
A214: ESSENDON ASSOC. | C214: SHORTEN | F214: FIELDING
A216: PORT MELBOURNE | C216: 2 | D216: 4 | E216: =C216*6+D216 -> 16 | G216: 6 | H216: 10 | I216: =G216*6+H216 -> 46 | K216: 8 | L216: 10 | M216: =K216*6+L216 -> 58 | O216: 10 | P216: 13 | Q216: =O216*6+P216 -> 73 | S216: PORT MELB
A217: HAWTHORN | C217: 5 | D217: 0 | E217: =C217*6+D217 -> 30 | G217: 6 | H217: 0 | I217: =G217*6+H217 -> 36 | K217: 7 | L217: 2 | M217: =K217*6+L217 -> 44 | O217: 8 | P217: 4 | Q217: =O217*6+P217 -> 52 | S217: HERBERT
A218: BEST PLAYERS
A219: PORT MELBOURNE | C219: THORPE | F219: HOWARD | I219: G STANFORD | L219: BARFOOT | O219: NANCARROW | R219: ASHTON
A220: HAWTHORN | C220: ALLEY | F220: BLACKMAN | I220: WILKINSON | L220: TEAGUE | O220: SCOTT | R220: DWYER
A221: GOALKICKERS
A222: PORT MELBOURNE | C222: BOND 2 | E222: NANCARROW 2 | H222: CONDON 2 | J222: THORPE | L222: HOWARD | N222: COOK | P222: G STANFORD
A223: HAWTHORN | C223: SANDILANDS 3 | F223: WILKINSON 2 | I223: McFARLANE | L223: RIGALDI | N223: LEN GIBB
A225: PRAHRAN | C225: 1 | D225: 6 | E225: =C225*6+D225 -> 12 | G225: 3 | H225: 9 | I225: =G225*6+H225 -> 27 | K225: 5 | L225: 14 | M225: =K225*6+L225 -> 44 | O225: 6 | P225: 15 | Q225: =O225*6+P225 -> 51 | S225: TOORAK PARK
A226: NORTHCOTE | C226: 1 | D226: 3 | E226: =C226*6+D226 -> 9 | G226: 3 | H226: 8 | I226: =G226*6+H226 -> 26 | K226: 3 | L226: 8 | M226: =K226*6+L226 -> 26 | O226: 4 | P226: 12 | Q226: =O226*6+P226 -> 36 | S226: McKINNON
A227: BEST PLAYERS
A228: PRAHRAN | C228: MORONEY | F228: MAYNARD | I228: V JONES | L228: MOORE | O228: WEIDNER | R228: QUINN
A229: NORTHCOTE | C229: HOLMES | F229: O'BRIEN | I229: JOYCE | L229: THOMAS | O229: CHESSWASS | R229: O'KEEFE
A230: GOALKICKERS
A231: PRAHRAN | C231: COMER 2
A232: NORTHCOTE
A234: FOOTSCRAY | C234: 0 | D234: 5 | E234: =C234*6+D234 -> 5 | G234: 4 | H234: 11 | I234: =G234*6+H234 -> 35 | K234: 8 | L234: 16 | M234: =K234*6+L234 -> 64 | O234: 14 | P234: 23 | Q234: =O234*6+P234 -> 107 | S234: BRIGHTON BEACH
A235: BRIGHTON | C235: 2 | D235: 3 | E235: =C235*6+D235 -> 15 | G235: 2 | H235: 4 | I235: =G235*6+H235 -> 16 | K235: 4 | L235: 6 | M235: =K235*6+L235 -> 30 | O235: 4 | P235: 6 | Q235: =O235*6+P235 -> 30 | S235: HURLEY
A236: BEST PLAYERS
A237: FOOTSCRAY | C237: SAMSON | F237: J GRIERSON | I237: MORGAN | L237: HOWELL | O237: C GRIERSON | R237: SEWART
A238: BRIGHTON | C238: HATTAM | F238: CARROLL | I238: BYRNE | L238: COBB | O238: J McCARTHY | R238: GREEN
A239: GOALKICKERS
A240: FOOTSCRAY | C240: MORGAN 6 | F240: McDONALD 2 | I240: J GRIERSON 2 | L240: BYRON 2 | N240: McKENZIE | Q240: SAMSON
A241: BRIGHTON | C241: COBB 3 | F241: BYRNE
A243: ROUND 6 | D243: 7TH JUNE | J243: WEATHER | M243: NORTH WIND | S243: PLAYED AT | X243: LADDER | AB243: ROUND | AD243: 6
D244: 1ST QTR | H244: 2ND QTR | L244: 3RD QTR | P244: FINAL | S244: NORTHCOTE
A245: NORTH MELBOURNE | C245: 2 | D245: 9 | E245: =C245*6+D245 -> 21 | G245: 3 | H245: 12 | I245: =G245*6+H245 -> 30 | K245: 5 | L245: 15 | M245: =K245*6+L245 -> 45 | O245: 8 | P245: 22 | Q245: =O245*6+P245 -> 70 | S245: UMPIRE | W245: TEAM | X245: W | Y245: L | Z245: D | AA245: FOR | AB245: AGST | AC245: % | AD245: PTS
A246: NORTHCOTE | C246: 1 | D246: 0 | E246: =C246*6+D246 -> 6 | G246: 2 | H246: 3 | I246: =G246*6+H246 -> 15 | K246: 2 | L246: 7 | M246: =K246*6+L246 -> 19 | O246: 3 | P246: 9 | Q246: =O246*6+P246 -> 27 | S246: HURLEY
A247: BEST PLAYERS | W247: NORTH MELBOURNE | X247: 6 | Y247: 0 | Z247: 0 | AA247: 454 | AB247: 204 | AC247: 222.54901960784315 | AD247: 24
A248: NORTH MELBOURNE | C248: WOODINGTON | F248: HARDY | H248: BARKER | K248: HILL | N248: GARDINER | Q248: SHEEHAN | W248: FOOTSCRAY | X248: 5 | Y248: 1 | Z248: 0 | AA248: 447 | AB248: 207 | AC248: 215.94202898550725 | AD248: 20
A249: NORTHCOTE | C249: MILLS | F249: JOYCE | H249: PATTINSON | K249: POWDITCH | N249: O'KEEFE | Q249: BUISST | W249: BRUNSWICK | X249: 4 | Y249: 2 | Z249: 0 | AA249: 328 | AB249: 303 | AC249: 108.25082508250826 | AD249: 16
A250: GOALKICKERS | W250: WILLIAMSTOWN | X250: 3 | Y250: 3 | Z250: 0 | AA250: 336 | AB250: 261 | AC250: 128.73563218390805 | AD250: 12
A251: NORTH MELBOURNE | C251: IRWIN | F251: STEVENS | I251: HARDY
A252: NORTHCOTE | C252: MILLS 2 | W252: NORTHCOTE | X252: 3 | Y252: 3 | Z252: 0 | AA252: 355 | AB252: 376 | AC252: 94.414893617021278 | AD252: 12
W253: PORT MELBOURNE | X253: 3 | Y253: 3 | Z253: 0 | AA253: 308 | AB253: 368 | AC253: 83.695652173913047 | AD253: 12
A254: BRUNSWICK | C254: 3 | D254: 1 | E254: =C254*6+D254 -> 19 | G254: 6 | H254: 3 | I254: =G254*6+H254 -> 39 | K254: 8 | L254: 4 | M254: =K254*6+L254 -> 52 | O254: 11 | P254: 7 | Q254: =O254*6+P254 -> 73 | S254: BRUNSWICK | W254: PRAHRAN | X254: 3 | Y254: 3 | Z254: 0 | AA254: 255 | AB254: 340 | AC254: 75 | AD254: 12
A255: WILLIAMSTOWN | C255: 3 | D255: 1 | E255: =C255*6+D255 -> 19 | G255: 4 | H255: 3 | I255: =G255*6+H255 -> 27 | K255: 5 | L255: 9 | M255: =K255*6+L255 -> 39 | O255: 10 | P255: 11 | Q255: =O255*6+P255 -> 71 | S255: PRITCHARD | W255: HAWTHORN | X255: 2 | Y255: 4 | Z255: 0 | AA255: 347 | AB255: 364 | AC255: 95.329670329670336 | AD255: 8
A256: BEST PLAYERS | W256: ESSENDON ASSOC. | X256: 1 | Y256: 5 | Z256: 0 | AA256: 279 | AB256: 361 | AC256: 77.285318559556785 | AD256: 4
A257: BRUNSWICK | C257: TRICKEY | F257: TAPPING | I257: BRISCOE | L257: CROUCH | O257: ADAMS | R257: SHAND | W257: BRIGHTON | X257: 0 | Y257: 6 | Z257: 0 | AA257: 254 | AB257: 579 | AC257: 43.868739205526772 | AD257: 0
A258: WILLIAMSTOWN | C258: AMY | F258: MITCHELL | I258: ROBERTSON | L258: KENNEDY | O258: ANDERSON | R258: SMITH
A259: GOALKICKERS
A260: BRUNSWICK | C260: ADAMS 3 | F260: CHRISTIE 3) | I260: CROUCH 2 | L260: KRUSE | N260: BRISCOE | P260: HARKER
A261: WILLIAMSTOWN | C261: STEPHENSON 3 | G261: AMY 2 | I261: KENNEDY 2 | L261: SMITH | N261: MITCHELL | Q261: WEBSTER
A263: PRAHRAN | C263: 3 | D263: 4 | E263: =C263*6+D263 -> 22 | G263: 5 | H263: 7 | I263: =G263*6+H263 -> 37 | K263: 11 | L263: 10 | M263: =K263*6+L263 -> 76 | O263: 11 | P263: 11 | Q263: =O263*6+P263 -> 77 | S263: TOORAK PARK
A264: PORT MELBOURNE | C264: 3 | D264: 1 | E264: =C264*6+D264 -> 19 | G264: 3 | H264: 4 | I264: =G264*6+H264 -> 22 | K264: 6 | L264: 6 | M264: =K264*6+L264 -> 42 | O264: 9 | P264: 8 | Q264: =O264*6+P264 -> 62 | S264: PORTEOUS
A265: BEST PLAYERS
A266: PRAHRAN | C266: COMER | F266: WEIDNER | I266: KIKER | L266: CHADWICK | O266: WEBSTER | R266: MORONEY
A267: PORT MELBOURNE | C267: WATSON | F267: J STANFORD | I267: BARFOOT | L267: NANCARROW | O267: BOND | R267: COOK
A268: GOALKICKERS
A269: PRAHRAN | C269: COMER 3 | F269: WEIDNER 2 | I269: KIKER 2 | K269: CHADWICK 2 | N269: WEBSTER | Q269: MOORE
A270: PORT MELBOURNE | C270: BOND 2 | F270: CONDON 2 | I270: HOWARD 2 | L270: COOK 2 | N270: NANCARROW
A272: HAWTHORN | C272: 5 | D272: 3 | E272: =C272*6+D272 -> 33 | G272: 6 | H272: 7 | I272: =G272*6+H272 -> 43 | K272: 8 | L272: 12 | M272: =K272*6+L272 -> 60 | O272: 10 | P272: 17 | Q272: =O272*6+P272 -> 77 | S272: GLENFERRIE
A273: BRIGHTON | C273: 2 | D273: 4 | E273: =C273*6+D273 -> 16 | G273: 4 | H273: 6 | I273: =G273*6+H273 -> 30 | K273: 6 | L273: 10 | M273: =K273*6+L273 -> 46 | O273: 8 | P273: 12 | Q273: =O273*6+P273 -> 60 | S273: HERBERT
A274: BEST PLAYERS
A275: HAWTHORN | C275: DWYER | F275: LEN GIBB | I275: BLACKMAN | L275: WALLIS | O275: ALLEY | Q275: WALKER
A276: BRIGHTON | C276: GREEN | F276: T BAYLISS | I276: SHELTON | L276: R BAYLISS | O276: CARROLL | Q276: SMITH
A277: GOALKICKERS
A278: HAWTHORN | C278: LEN GIBB 3 | F278: WILKINSON 2 | I278: SANDILAND 2 | L278: NOTT | N278: HOWARD | Q278: McFARLANE
A279: BRIGHTON | C279: DOWDING 3 | F279: COBB 2 | H279: McCARTHY | J279: STEWART | M279: BANNISTER
A281: FOOTSCRAY | C281: 4 | D281: 9 | E281: =C281*6+D281 -> 33 | G281: 7 | H281: 12 | I281: =G281*6+H281 -> 54 | K281: 13 | L281: 17 | M281: =K281*6+L281 -> 95 | O281: 15 | P281: 21 | Q281: =O281*6+P281 -> 111 | S281: FOOTSCRAY
A282: ESSENDON ASSOC. | C282: 0 | D282: 1 | E282: =C282*6+D282 -> 1 | G282: 3 | H282: 3 | I282: =G282*6+H282 -> 21 | K282: 4 | L282: 4 | M282: =K282*6+L282 -> 28 | O282: 6 | P282: 5 | Q282: =O282*6+P282 -> 41 | S282: McKINNON
A283: BEST PLAYERS
A284: FOOTSCRAY | C284: MORGAN | F284: MONGAN | I284: McDONALD | L284: SAMSON | O284: MARTIN | R284: FORD
A285: ESSENDON ASSOC. | C285: SHORTEN | F285: MURTAGH | I285: WATT | L285: ADAMS | O285: KING | R285: STROWNIX
A286: GOALKICKERS
A287: FOOTSCRAY | C287: MORGAN 7 | F287: MCDONALD 3 | I287: MARTIN 3 | L287: J GRIERSON | O287: GRIEVES
A288: ESSENDON ASSOC. | C288: MURTAGH 3 | F288: KEMP 2 | I288: SHORTEN
A290: ROUND 7 | D290: 14TH JUNE | J290: WEATHER | M290: FINE | S290: PLAYED AT | X290: LADDER | AB290: ROUND | AD290: 7
D291: 1ST QTR | H291: 2ND QTR | L291: 3RD QTR | P291: FINAL | S291: WILLIAMSTOWN
A292: FOOTSCRAY | C292: 2 | D292: 4 | E292: =C292*6+D292 -> 16 | G292: 4 | H292: 9 | I292: =G292*6+H292 -> 33 | K292: 6 | L292: 11 | M292: =K292*6+L292 -> 47 | O292: 10 | P292: 12 | Q292: =O292*6+P292 -> 72 | S292: UMPIRE | W292: TEAM | X292: W | Y292: L | Z292: D | AA292: FOR | AB292: AGST | AC292: % | AD292: PTS
A293: WILLIAMSTOWN | C293: 1 | D293: 0 | E293: =C293*6+D293 -> 6 | G293: 1 | H293: 4 | I293: =G293*6+H293 -> 10 | K293: 1 | L293: 7 | M293: =K293*6+L293 -> 13 | O293: 2 | P293: 10 | Q293: =O293*6+P293 -> 22 | S293: HERBERT
A294: BEST PLAYERS | W294: NORTH MELBOURNE | X294: 7 | Y294: 0 | Z294: 0 | AA294: 545 | AB294: 234 | AC294: 232.90598290598291 | AD294: 28
A295: FOOTSCRAY | C295: McDONALD | F295: FORD | I295: PATERSON | L295: McKENZIE | O295: HOWELL | Q295: MORGAN | W295: FOOTSCRAY | X295: 6 | Y295: 1 | Z295: 0 | AA295: 519 | AB295: 229 | AC295: 226.63755458515283 | AD295: 24
A296: WILLIAMSTOWN | C296: ROBERTSON | F296: KENNEDY | I296: MITCHELL | L296: GIBBS | O296: AMY | Q296: J McDONALD | W296: BRUNSWICK | X296: 4 | Y296: 3 | Z296: 0 | AA296: 372 | AB296: 368 | AC296: 101.08695652173913 | AD296: 16
A297: GOALKICKERS | W297: NORTHCOTE | X297: 4 | Y297: 3 | Z297: 0 | AA297: 424 | AB297: 420 | AC297: 100.95238095238095 | AD297: 16
A298: FOOTSCRAY | C298: MORGAN 3 | F298: MARTIN 3 | I298: J GRIERSON 2 | L298: CRADDOCK 2
A299: WILLIAMSTOWN | C299: CASANELLA | F299: HARDEN | W299: PORT MELBOURNE | X299: 4 | Y299: 3 | Z299: 0 | AA299: 373 | AB299: 412 | AC299: 90.533980582524265 | AD299: 16
W300: PRAHRAN | X300: 4 | Y300: 3 | Z300: 0 | AA300: 328 | AB300: 371 | AC300: 88.409703504043122 | AD300: 16
A301: PORT MELBOURNE | C301: 2 | D301: 3 | E301: =C301*6+D301 -> 15 | G301: 3 | H301: 4 | I301: =G301*6+H301 -> 22 | K301: 7 | L301: 10 | M301: =K301*6+L301 -> 52 | O301: 9 | P301: 11 | Q301: =O301*6+P301 -> 65 | S301: PORT MELB | W301: WILLIAMSTOWN | X301: 3 | Y301: 4 | Z301: 0 | AA301: 358 | AB301: 333 | AC301: 107.50750750750751 | AD301: 12
A302: BRUNSWICK | C302: 1 | D302: 6 | E302: =C302*6+D302 -> 12 | G302: 2 | H302: 7 | I302: =G302*6+H302 -> 19 | K302: 3 | L302: 9 | M302: =K302*6+L302 -> 27 | O302: 5 | P302: 14 | Q302: =O302*6+P302 -> 44 | S302: McKINNON | W302: HAWTHORN | X302: 2 | Y302: 5 | Z302: 0 | AA302: 377 | AB302: 455 | AC302: 82.857142857142861 | AD302: 8
A303: BEST PLAYERS | W303: ESSENDON ASSOC. | X303: 1 | Y303: 6 | Z303: 0 | AA303: 323 | AB303: 430 | AC303: 75.116279069767444 | AD303: 4
A304: PORT MELBOURNE | C304: HOWARD | G304: McCONVILLE | J304: RUDD | M304: CONDON | P304: J STANFORD | S304: BARFOOT | W304: BRIGHTON | X304: 0 | Y304: 7 | Z304: 0 | AA304: 285 | AB304: 652 | AC304: 43.711656441717793 | AD304: 0
A305: BRUNSWICK | C305: FEATHERSTONE | G305: O'CONNOR | J305: GOONAN | M305: STEVENSON | P305: TAPPING | S305: CLOWE
A306: GOALKICKERS
A307: PORT MELBOURNE | C307: HOWARD 4 | F307: CONDON 2 | I307: RUDD | K307: THORPE | M307: NANCARROW
A308: BRUNSWICK | C308: ADAMS 2 | F308: HASSETT | I308: TAPPING | K308: STEVENSON
A310: PRAHRAN | C310: 5 | D310: 2 | E310: =C310*6+D310 -> 32 | G310: 5 | H310: 7 | I310: =G310*6+H310 -> 37 | K310: 7 | L310: 7 | M310: =K310*6+L310 -> 49 | O310: 11 | P310: 7 | Q310: =O310*6+P310 -> 73 | S310: BRIGHTON BEACH
A311: BRIGHTON | C311: 1 | D311: 0 | E311: =C311*6+D311 -> 6 | G311: 2 | H311: 3 | I311: =G311*6+H311 -> 15 | K311: 3 | L311: 3 | M311: =K311*6+L311 -> 21 | O311: 4 | P311: 7 | Q311: =O311*6+P311 -> 31 | S311: ALLEY
A312: BEST PLAYERS
A313: PRAHRAN | C313: V JONES | F313: CARR | I313: COMER | L313: CHADWICK | O313: CARLSON | R313: MORONEY
A314: BRIGHTON | C314: HATTAM | F314: DUGGAN | I314: McCARTHY | L314: GREEN | O314: WYATT | R314: DOWDING
A315: GOALKICKERS
A316: PRAHRAN | C316: COMER 4 | F316: CHADWICK 3
A317: BRIGHTON
A319: NORTHCOTE | C319: 3 | D319: 3 | E319: =C319*6+D319 -> 21 | G319: 4 | H319: 6 | I319: =G319*6+H319 -> 30 | K319: 8 | L319: 8 | M319: =K319*6+L319 -> 56 | O319: 9 | P319: 15 | Q319: =O319*6+P319 -> 69 | S319: ESSENDON
A320: ESSENDON ASSOC. | C320: 3 | D320: 1 | E320: =C320*6+D320 -> 19 | G320: 4 | H320: 5 | I320: =G320*6+H320 -> 29 | K320: 5 | L320: 7 | M320: =K320*6+L320 -> 37 | O320: 6 | P320: 8 | Q320: =O320*6+P320 -> 44 | S320: HURLEY
A321: BEST PLAYERS
A322: NORTHCOTE | C322: HOLLAND | F322: H SMITH | I322: BENNETT | L322: THOMAS | O322: BUISST | R322: MILLS
A323: ESSENDON ASSOC. | C323: ADAMS | F323: WATT | I323: MORRIS | L323: BASS | O323: FIELDING | R323: SHORTEN
A324: GOALKICKERS
A325: NORTHCOTE | C325: BENNETT 3 | F325: WILSON 2 | I325: S SMITH | L325: MILLS
A326: ESSENDON ASSOC. | C326: BASS 4 | F326: O'DONOGHUE
A328: NORTH MELBOURNE | C328: 5 | D328: 4 | E328: =C328*6+D328 -> 34 | G328: 6 | H328: 9 | I328: =G328*6+H328 -> 45 | K328: 10 | L328: 10 | M328: =K328*6+L328 -> 70 | O328: 13 | P328: 13 | Q328: =O328*6+P328 -> 91 | S328: GLENFERRIE
A329: HAWTHORN | C329: 1 | D329: 2 | E329: =C329*6+D329 -> 8 | G329: 2 | H329: 3 | I329: =G329*6+H329 -> 15 | K329: 4 | L329: 5 | M329: =K329*6+L329 -> 29 | O329: 4 | P329: 6 | Q329: =O329*6+P329 -> 30 | S329: PRITCHARD
A330: BEST PLAYERS
A331: NORTH MELBOURNE | C331: STEVENS | F331: WOODINGTON | J331: SHEEHAN | M331: HILL | P331: DONNELLY | S331: BARKER
A332: HAWTHORN | C332: ALLEY | F332: LES GIBB | J332: LEN GIBB | M332: ROBERTS | P332: TEAGUE | S332: WALLIS
A333: GOALKICKERS
A334: NORTH MELBOURNE | C334: STEVENS 8
A335: HAWTHORN
A337: ROUND 8 | D337: 21ST JUNE | H337: WEATHER | K337: COLD SQUALLY S.W. WIND SHOWERS | S337: PLAYED AT | X337: LADDER | AB337: ROUND | AD337: 8
D338: 1ST QTR | H338: 2ND QTR | L338: 3RD QTR | P338: FINAL | S338: FOOTSCRAY
A339: FOOTSCRAY | C339: 3 | D339: 1 | E339: =C339*6+D339 -> 19 | G339: 6 | H339: 6 | I339: =G339*6+H339 -> 42 | K339: 8 | L339: 12 | M339: =K339*6+L339 -> 60 | O339: 9 | P339: 16 | Q339: =O339*6+P339 -> 70 | S339: UMPIRE | W339: TEAM | X339: W | Y339: L | Z339: D | AA339: FOR | AB339: AGST | AC339: % | AD339: PTS
A340: PORT MELBOURNE | C340: 0 | D340: 1 | E340: =C340*6+D340 -> 1 | G340: 1 | H340: 2 | I340: =G340*6+H340 -> 8 | K340: 2 | L340: 2 | M340: =K340*6+L340 -> 14 | O340: 3 | P340: 3 | Q340: =O340*6+P340 -> 21 | S340: ALLEY
A341: BEST PLAYERS | W341: NORTH MELBOURNE | X341: 8 | Y341: 0 | Z341: 0 | AA341: 648 | AB341: 252 | AC341: 257.14285714285717 | AD341: 32
A342: FOOTSCRAY | C342: SAMSON | F342: HOWELL | I342: L'ESTRANGE | L342: MORGAN | O342: MARTIN | Q342: CRADDOCK | W342: FOOTSCRAY | X342: 7 | Y342: 1 | Z342: 0 | AA342: 589 | AB342: 250 | AC342: 235.6 | AD342: 28
A343: PORT MELBOURNE | C343: NANCARROW | F343: RUDD | I343: TOPHAM | L343: ASHTON | O343: SAMSON | Q343: COOK | W343: BRUNSWICK | X343: 5 | Y343: 3 | Z343: 0 | AA343: 474 | AB343: 408 | AC343: 116.17647058823529 | AD343: 20
A344: GOALKICKERS | W344: NORTHCOTE | X344: 5 | Y344: 3 | Z344: 0 | AA344: 459 | AB344: 441 | AC344: 104.08163265306122 | AD344: 20
A345: FOOTSCRAY | C345: MORGAN 3 | F345: TOMLIN 2 | I345: MARTIN | K345: HOWELL | M345: SAMSON | O345: CRADDOCK
A346: PORT MELBOURNE | C346: THORPE | F346: COOK | I346: CONDON | W346: PRAHRAN | X346: 4 | Y346: 4 | Z346: 0 | AA346: 385 | AB346: 429 | AC346: 89.743589743589737 | AD346: 16
W347: PORT MELBOURNE | X347: 4 | Y347: 4 | Z347: 0 | AA347: 394 | AB347: 482 | AC347: 81.742738589211612 | AD347: 16
A348: HAWTHORN | C348: 1 | D348: 2 | E348: =C348*6+D348 -> 8 | G348: 5 | H348: 7 | I348: =G348*6+H348 -> 37 | K348: 6 | L348: 9 | M348: =K348*6+L348 -> 45 | O348: 8 | P348: 10 | Q348: =O348*6+P348 -> 58 | S348: TOORAK PARK | W348: WILLIAMSTOWN | X348: 3 | Y348: 5 | Z348: 0 | AA348: 379 | AB348: 368 | AC348: 102.98913043478261 | AD348: 12
A349: PRAHRAN | C349: 3 | D349: 4 | E349: =C349*6+D349 -> 22 | G349: 5 | H349: 6 | I349: =G349*6+H349 -> 36 | K349: 7 | L349: 11 | M349: =K349*6+L349 -> 53 | O349: 7 | P349: 15 | Q349: =O349*6+P349 -> 57 | S349: McKINNON | W349: HAWTHORN | X349: 3 | Y349: 5 | Z349: 0 | AA349: 435 | AB349: 512 | AC349: 84.9609375 | AD349: 12
A350: BEST PLAYERS | W350: ESSENDON ASSOC. | X350: 1 | Y350: 7 | Z350: 0 | AA350: 341 | AB350: 533 | AC350: 63.977485928705441 | AD350: 4
A351: HAWTHORN | C351: LEN GIBB | F351: WILKINSON | I351: WALLIS | L351: LES GIBB | O351: NOTT | Q351: TEAGUE | W351: BRIGHTON | X351: 0 | Y351: 8 | Z351: 0 | AA351: 325 | AB351: 754 | AC351: 43.103448275862071 | AD351: 0
A352: PRAHRAN | C352: CARR | F352: MOORE | I352: WEIDNER | L352: MAYNARD | O352: V JONES
A353: GOALKICKERS
A354: HAWTHORN | C354: MUNRO 2 | F354: WILKINSON 2 | J354: McFARLANE | M354: LEN GIBBS | P354: TEAGUE | R354: NOTT
A355: PRAHRAN | C355: WEIDNER 2 | F355: KIKER 2 | I355: V JONES | K355: WEBSTER | M355: COMER
A357: NORTHCOTE | C357: 4 | D357: 1 | E357: =C357*6+D357 -> 25 | G357: 4 | H357: 1 | I357: =G357*6+H357 -> 25 | K357: 5 | L357: 4 | M357: =K357*6+L357 -> 34 | O357: 5 | P357: 5 | Q357: =O357*6+P357 -> 35 | S357: WILLIAMSTOWN
A358: WILLIAMSTOWN | C358: 0 | D358: 0 | E358: =C358*6+D358 -> 0 | G358: 1 | H358: 5 | I358: =G358*6+H358 -> 11 | K358: 1 | L358: 5 | M358: =K358*6+L358 -> 11 | O358: 2 | P358: 9 | Q358: =O358*6+P358 -> 21 | S358: SMITH
A359: BEST PLAYERS
A360: NORTHCOTE | C360: MILLS | F360: HOLLAND | I360: S SMITH | L360: GITTENS | O360: PATTERSON | R360: COCKRAM
A361: WILLIAMSTOWN | C361: KENNEDY | F361: MITCHELL | I361: HARRISON | L361: STONE | O361: McDONALD | R361: HARDEN
A362: GOALKICKERS
A363: NORTHCOTE | C363: MILLS 3
A364: WILLIAMSTOWN | C364: HARDEN | F364: MITCHELL
A366: BRUNSWICK | C366: 4 | D366: 5 | E366: =C366*6+D366 -> 29 | G366: 5 | H366: 7 | I366: =G366*6+H366 -> 37 | K366: 10 | L366: 15 | M366: =K366*6+L366 -> 75 | O366: 14 | P366: 18 | Q366: =O366*6+P366 -> 102 | S366: BRUNSWICK
A367: BRIGHTON | C367: 0 | D367: 2 | E367: =C367*6+D367 -> 2 | G367: 2 | H367: 5 | I367: =G367*6+H367 -> 17 | K367: 4 | L367: 5 | M367: =K367*6+L367 -> 29 | O367: 5 | P367: 10 | Q367: =O367*6+P367 -> 40 | S367: PRITCHARD
A368: BEST PLAYERS
A369: BRUNSWICK | C369: O'CONNOR | G369: BRISCOE | J369: CHRISTIE | M369: HASSETT | P369: KEMP | R369: McINERNEY
A370: BRIGHTON | C370: M McCARTHY | G370: M BAYLISS | J370: DOWDING | M370: T BAYLISS | P370: WYATT | R370: HATTAM
A371: GOALKICKERS
A372: BRUNSWICK | C372: CHRISTIE 2 | F372: CROUCH 2
A373: BRIGHTON
A375: NORTH MELBOURNE | C375: 3 | D375: 3 | E375: =C375*6+D375 -> 21 | G375: 7 | H375: 4 | I375: =G375*6+H375 -> 46 | K375: 14 | L375: 10 | M375: =K375*6+L375 -> 94 | O375: 14 | P375: 19 | Q375: =O375*6+P375 -> 103 | S375: NORTH MELB
A376: ESSENDON ASSOC. | C376: 1 | D376: 0 | E376: =C376*6+D376 -> 6 | G376: 1 | H376: 2 | I376: =G376*6+H376 -> 8 | K376: 2 | L376: 4 | M376: =K376*6+L376 -> 16 | O376: 2 | P376: 6 | Q376: =O376*6+P376 -> 18 | S376: PORTEOUS
A377: BEST PLAYERS
A378: NORTH MELBOURNE | C378: HARDY | G378: IRWIN | J378: BROWN | M378: JOHNSON | P378: BARKER | R378: STEVENS
A379: ESSENDON ASSOC. | C379: ADAMS | G379: STROWNIX | J379: MORRIS | M379: SHORTEN | P379: McGRATH | R379: TODD
A380: GOALKICKERS
A381: NORTH MELBOURNE | C381: HARDY 4 | F381: STEVENS 3 | I381: BROWN 2 | L381: HAWKINS 2
A382: ESSENDON ASSOC.
A384: ROUND 9 | D384: 28TH JUNE | J384: WEATHER | M384: COLD WEST WIND SHOWERS | S384: PLAYED AT | X384: LADDER | AB384: ROUND | AD384: 9
D385: 1ST QTR | H385: 2ND QTR | L385: 3RD QTR | P385: FINAL | S385: FOOTSCRAY
A386: FOOTSCRAY | C386: 4 | D386: 2 | E386: =C386*6+D386 -> 26 | G386: 5 | H386: 6 | I386: =G386*6+H386 -> 36 | K386: 10 | L386: 11 | M386: =K386*6+L386 -> 71 | O386: 13 | P386: 10 | Q386: =O386*6+P386 -> 88 | S386: UMPIRE | W386: TEAM | X386: W | Y386: L | Z386: D | AA386: FOR | AB386: AGST | AC386: % | AD386: PTS
A387: BRUNSWICK | C387: 2 | D387: 4 | E387: =C387*6+D387 -> 16 | G387: 2 | H387: 4 | I387: =G387*6+H387 -> 16 | K387: 3 | L387: 4 | M387: =K387*6+L387 -> 22 | O387: 4 | P387: 4 | Q387: =O387*6+P387 -> 28 | S387: PORTEOUS
A388: BEST PLAYERS | W388: NORTH MELBOURNE | X388: 9 | Y388: 0 | Z388: 0 | AA388: 761 | AB388: 267 | AC388: 285.0187265917603 | AD388: 36
A389: FOOTSCRAY | C389: PATTERSON | F389: PHILLIPS | I389: TOMLIN | K389: SAMSON | N389: CRADDOCK | Q389: MORGAN | W389: FOOTSCRAY | X389: 8 | Y389: 1 | Z389: 0 | AA389: 677 | AB389: 278 | AC389: 243.5251798561151 | AD389: 32
A390: BRUNSWICK | C390: CLOWE | F390: GOONAN | I390: VROUCH | K390: FEATHERSTONE | N390: CHRISTIE | Q390: HASSETT | W390: NORTHCOTE | X390: 6 | Y390: 3 | Z390: 0 | AA390: 513 | AB390: 471 | AC390: 108.9171974522293 | AD390: 24
A391: GOALKICKERS | Q391: MARTIN | W391: BRUNSWICK | X391: 5 | Y391: 4 | Z391: 0 | AA391: 502 | AB391: 496 | AC391: 101.20967741935483 | AD391: 20
A392: FOOTSCRAY | C392: MORGAN 5 | F392: SAMSON 2 | I392: PATTERSON | L392: PHILLIPS | N392: J GRIERSON | Q392: CRADDOCK | T392: TOMLIN
A393: BRUNSWICK | C393: CROUCH 2 | F393: KEMP | I393: KIELY | W393: PRAHRAN | X393: 5 | Y393: 4 | Z393: 0 | AA393: 459 | AB393: 486 | AC393: 94.444444444444443 | AD393: 20
W394: HAWTHORN | X394: 4 | Y394: 5 | Z394: 0 | AA394: 477 | AB394: 543 | AC394: 87.845303867403317 | AD394: 16
A395: NORTHCOTE | C395: 3 | D395: 7 | E395: =C395*6+D395 -> 25 | G395: 4 | H395: 8 | I395: =G395*6+H395 -> 32 | K395: 5 | L395: 16 | M395: =K395*6+L395 -> 46 | O395: 6 | P395: 18 | Q395: =O395*6+P395 -> 54 | S395: NORTHCOTE | W395: PORT MELBOURNE | X395: 4 | Y395: 5 | Z395: 0 | AA395: 424 | AB395: 536 | AC395: 79.104477611940297 | AD395: 16
A396: PORT MELBOURNE | C396: 1 | D396: 1 | E396: =C396*6+D396 -> 7 | G396: 2 | H396: 2 | I396: =G396*6+H396 -> 14 | K396: 2 | L396: 5 | M396: =K396*6+L396 -> 17 | O396: 4 | P396: 6 | Q396: =O396*6+P396 -> 30 | S396: HERBERT | W396: WILLIAMSTOWN | X396: 3 | Y396: 6 | Z396: 0 | AA396: 436 | AB396: 442 | AC396: 98.642533936651589 | AD396: 12
A397: BEST PLAYERS | W397: ESSENDON ASSOC. | X397: 1 | Y397: 8 | Z397: 0 | AA397: 372 | AB397: 575 | AC397: 64.695652173913047 | AD397: 4
A398: NORTHCOTE | C398: HOLLAND | F398: MILLS | I398: H SMITH | L398: S SMITH | N398: T CHESSWASS | Q398: POWDITCH | W398: BRIGHTON | X398: 0 | Y398: 9 | Z398: 0 | AA398: 340 | AB398: 867 | AC398: 39.215686274509807 | AD398: 0
A399: PORT MELBOURNE | C399: RUDD | F399: BARFOOT | I399: ANDERSON | L399: COOK | N399: CONDON | Q399: NANCARROW
A400: GOALKICKERS
A401: NORTHCOTE | C401: MILLS 4 | F401: BENNETT | I401: WILSON
A402: PORT MELBOURNE | C402: COOK 2 | F402: BARFOOT | I402: CONDON
A404: PRAHRAN | C404: 4 | D404: 4 | E404: =C404*6+D404 -> 28 | G404: 8 | H404: 7 | I404: =G404*6+H404 -> 55 | K404: 10 | L404: 13 | M404: =K404*6+L404 -> 73 | O404: 10 | P404: 14 | Q404: =O404*6+P404 -> 74 | S404: TOORAK PARK
A405: WILLIAMSTOWN | C405: 1 | D405: 4 | E405: =C405*6+D405 -> 10 | G405: 4 | H405: 5 | I405: =G405*6+H405 -> 29 | K405: 5 | L405: 7 | M405: =K405*6+L405 -> 37 | O405: 8 | P405: 9 | Q405: =O405*6+P405 -> 57 | S405: McKINNON
A406: BEST PLAYERS
A407: PRAHRAN | C407: MORONEY | F407: PARKER | I407: WEIDNER | L407: V JONES | N407: JAMES | Q407: CARR
A408: WILLIAMSTOWN | C408: KENNEDY | F408: MITCHELL | I408: SUTTON | L408: SMITH | N408: STEPHENSON | Q408: WEBSTER
A409: GOALKICKERS
A410: PRAHRAN | C410: PARKER 4 | F410: BOLAND 2
A411: WILLIAMSTOWN | C411: SMITH 3 | F411: STEPHENSON | I411: WEBSTER | L411: AMY | N411: KENNEDY | Q411: SUTTON
A413: HAWTHORN | C413: 2 | D413: 1 | E413: =C413*6+D413 -> 13 | G413: 3 | H413: 2 | I413: =G413*6+H413 -> 20 | K413: 4 | L413: 4 | M413: =K413*6+L413 -> 28 | O413: 6 | P413: 6 | Q413: =O413*6+P413 -> 42 | S413: ESSENDON
A414: ESSENDON ASSOC. | C414: 0 | D414: 7 | E414: =C414*6+D414 -> 7 | G414: 0 | H414: 9 | I414: =G414*6+H414 -> 9 | K414: 2 | L414: 13 | M414: =K414*6+L414 -> 25 | O414: 2 | P414: 19 | Q414: =O414*6+P414 -> 31 | S414: PRITCHARD
A415: BEST PLAYERS
A416: HAWTHORN | C416: R GIBB | F416: LEN GIBB | I416: WALLIS | L416: BLACKMAN | O416: TEAGUE | Q416: ROBERTS
A417: ESSENDON ASSOC. | C417: SHEA | F417: O'DONOGHUE | I417: SHORTEN | L417: MORRIS | O417: ADAMS | Q417: WATT
A418: GOALKICKERS
A419: HAWTHORN | C419: BURCHALL 2 | F419: McFARLANE | I419: WALLIS | K419: LES GIBB | N419: WILKINSON
A420: ESSENDON ASSOC. | C420: SHORTEN | F420: KING
A422: NORTH MELBOURNE | C422: 6 | D422: 9 | E422: =C422*6+D422 -> 45 | G422: 7 | H422: 13 | I422: =G422*6+H422 -> 55 | K422: 12 | L422: 19 | M422: =K422*6+L422 -> 91 | O422: 15 | P422: 23 | Q422: =O422*6+P422 -> 113 | S422: BRIGHTON BEACH
A423: BRIGHTON | C423: 0 | D423: 1 | E423: =C423*6+D423 -> 1 | G423: 1 | H423: 3 | I423: =G423*6+H423 -> 9 | K423: 1 | L423: 3 | M423: =K423*6+L423 -> 9 | O423: 2 | P423: 3 | Q423: =O423*6+P423 -> 15 | S423: SMITH
A424: BEST PLAYERS
A425: NORTH MELBOURNE | C425: MOODIE | F425: GARDINER | I425: IRWIN | L425: STEVENS | N425: HAWKINS | Q425: DONNELLY
A426: BRIGHTON | C426: McCARTHY | F426: GREEN | I426: DOWDING | L426: DUGGAN | N426: M BAYLISS | Q426: BANNISTER
A427: GOALKICKERS
A428: NORTH MELBOURNE | C428: STEVENS 8 | F428: HAWKINS 2 | I428: BROWN | K428: NORRIS | M428: FRANKS | O428: MOODIE
A429: BRIGHTON | C429: COBB
A431: ROUND 10 | D431: 5TH JULY | J431: WEATHER | M431: CLOUDY BUT FINE WEST BREEZE | S431: PLAYED AT | X431: LADDER | AB431: ROUND | AD431: 10
D432: 1ST QTR | H432: 2ND QTR | L432: 3RD QTR | P432: FINAL | S432: TOORAK PARK
A433: FOOTSCRAY | C433: 2 | D433: 3 | E433: =C433*6+D433 -> 15 | G433: 6 | H433: 9 | I433: =G433*6+H433 -> 45 | K433: 9 | L433: 9 | M433: =K433*6+L433 -> 63 | O433: 13 | P433: 14 | Q433: =O433*6+P433 -> 92 | S433: UMPIRE | W433: TEAM | X433: W | Y433: L | Z433: D | AA433: FOR | AB433: AGST | AC433: % | AD433: PTS
A434: PRAHRAN | C434: 2 | D434: 4 | E434: =C434*6+D434 -> 16 | G434: 3 | H434: 4 | I434: =G434*6+H434 -> 22 | K434: 4 | L434: 8 | M434: =K434*6+L434 -> 32 | O434: 5 | P434: 9 | Q434: =O434*6+P434 -> 39 | S434: HERBERT
A435: BEST PLAYERS | W435: NORTH MELBOURNE | X435: 10 | Y435: 0 | Z435: 0 | AA435: 826 | AB435: 296 | AC435: 279.05405405405406 | AD435: 40
A436: FOOTSCRAY | C436: PHILLIPS | F436: SAMSON | I436: J GRIERSON | L436: MORGAN | N436: C GRIERSON | Q436: DAVIDSON | W436: FOOTSCRAY | X436: 9 | Y436: 1 | Z436: 0 | AA436: 769 | AB436: 317 | AC436: 242.58675078864354 | AD436: 36
A437: PRAHRAN | C437: CARR | F437: MOORE | I437: CHADWICK | L437: WEIDNER | N437: PARKER | Q437: MORONEY | W437: NORTHCOTE | X437: 7 | Y437: 3 | Z437: 0 | AA437: 584 | AB437: 507 | AC437: 115.18737672583826 | AD437: 28
A438: GOALKICKERS | W438: BRUNSWICK | X438: 6 | Y438: 4 | Z438: 0 | AA438: 595 | AB438: 542 | AC438: 109.77859778597787 | AD438: 24
A439: FOOTSCRAY | C439: MORGAN 8 | F439: GREAVES 2 | I439: DAVIDSON | L439: HOWELL | N439: SAMSON
A440: PRAHRAN | C440: CHADWICK 2 | F440: PARKER | I440: MAYNARD | L440: BOLAND | W440: PRAHRAN | X440: 5 | Y440: 5 | Z440: 0 | AA440: 498 | AB440: 578 | AC440: 86.159169550173004 | AD440: 20
W441: WILLIAMSTOWN | X441: 4 | Y441: 6 | Z441: 0 | AA441: 503 | AB441: 493 | AC441: 102.02839756592292 | AD441: 16
A442: NORTHCOTE | C442: 4 | D442: 2 | E442: =C442*6+D442 -> 26 | G442: 6 | H442: 6 | I442: =G442*6+H442 -> 42 | K442: 10 | L442: 8 | M442: =K442*6+L442 -> 68 | O442: 10 | P442: 11 | Q442: =O442*6+P442 -> 71 | S442: NORTHCOTE | W442: HAWTHORN | X442: 4 | Y442: 6 | Z442: 0 | AA442: 513 | AB442: 614 | AC442: 83.55048859934854 | AD442: 16
A443: HAWTHORN | C443: 2 | D443: 1 | E443: =C443*6+D443 -> 13 | G443: 2 | H443: 5 | I443: =G443*6+H443 -> 17 | K443: 5 | L443: 5 | M443: =K443*6+L443 -> 35 | O443: 5 | P443: 6 | Q443: =O443*6+P443 -> 36 | S443: ALLEY | W443: PORT MELBOURNE | X443: 4 | Y443: 6 | Z443: 0 | AA443: 453 | AB443: 601 | AC443: 75.374376039933438 | AD443: 16
A444: BEST PLAYERS | W444: ESSENDON ASSOC. | X444: 1 | Y444: 9 | Z444: 0 | AA444: 418 | AB444: 668 | AC444: 62.574850299401199 | AD444: 4
A445: NORTHCOTE | C445: H SMITH | F445: PATTERSON | I445: POWDITCH | L445: E SMITH | N445: MILLS | Q445: CHESSWASS | W445: BRIGHTON | X445: 0 | Y445: 10 | Z445: 0 | AA445: 391 | AB445: 934 | AC445: 41.862955032119913 | AD445: 0
A446: HAWTHORN | C446: NOTT | F446: ROBERTS | I446: TEAGUE | L446: DWYER | N446: BLACKMAN | Q446: MUNRO
A447: GOALKICKERS
A448: NORTHCOTE | C448: MILLS 4 | F448: WILSON 2 | I448: H SMITH
A449: HAWTHORN | C449: MUNRO 3 | F449: BURCHALL 2
A451: NORTH MELBOURNE | C451: 0 | D451: 2 | E451: =C451*6+D451 -> 2 | G451: 4 | H451: 7 | I451: =G451*6+H451 -> 31 | K451: 7 | L451: 13 | M451: =K451*6+L451 -> 55 | O451: 8 | P451: 17 | Q451: =O451*6+P451 -> 65 | S451: PORT MELB
A452: PORT MELBOURNE | C452: 1 | D452: 2 | E452: =C452*6+D452 -> 8 | G452: 1 | H452: 2 | I452: =G452*6+H452 -> 8 | K452: 4 | L452: 5 | M452: =K452*6+L452 -> 29 | O452: 4 | P452: 5 | Q452: =O452*6+P452 -> 29 | S452: PRITCHARD
A453: BEST PLAYERS
A454: NORTH MELBOURNE | C454: MOODIE | F454: IRWIN | I454: DONNELLY | L454: HARDY | O454: MILBURN | R454: JOHNSON
A455: PORT MELBOURNE | C455: NANCARROW | F455: BLENCOE | I455: ANDERSON | L455: SAMSON | O455: BARFOOT | R455: COOK
A456: GOALKICKERS
A457: NORTH MELBOURNE | C457: STEVENS 2 | F457: IRWIN | I457: DONNELLY
A458: PORT MELBOURNE
A460: BRUNSWICK | C460: 4 | D460: 4 | E460: =C460*6+D460 -> 28 | G460: 7 | H460: 5 | I460: =G460*6+H460 -> 47 | K460: 10 | L460: 7 | M460: =K460*6+L460 -> 67 | O460: 13 | P460: 15 | Q460: =O460*6+P460 -> 93 | S460: BRUNSWICK
A461: ESSENDON ASSOC. | C461: 1 | D461: 1 | E461: =C461*6+D461 -> 7 | G461: 4 | H461: 5 | I461: =G461*6+H461 -> 29 | K461: 4 | L461: 8 | M461: =K461*6+L461 -> 32 | O461: 6 | P461: 10 | Q461: =O461*6+P461 -> 46 | S461: McKINNON
A462: BEST PLAYERS
A463: BRUNSWICK | C463: CLARKE | F463: HARKER | I463: SHAND | L463: CHASE | O463: MAY | R463: ADAMS
A464: ESSENDON ASSOC. | C464: WATT | F464: DAVIDSON | I464: COCHRANE | L464: GRAHAM | O464: SHORTEN | R464: O'DONOGHUE
A465: GOALKICKERS
A466: BRUNSWICK | C466: HARKER 4 | F466: CHASE 3
A467: ESSENDON ASSOC.
A469: WILLIAMSTOWN | C469: 6 | D469: 1 | E469: =C469*6+D469 -> 37 | G469: 7 | H469: 3 | I469: =G469*6+H469 -> 45 | K469: 8 | L469: 3 | M469: =K469*6+L469 -> 51 | O469: 10 | P469: 7 | Q469: =O469*6+P469 -> 67 | S469: WILLIAMSTOWN
A470: BRIGHTON | C470: 1 | D470: 1 | E470: =C470*6+D470 -> 7 | G470: 4 | H470: 2 | I470: =G470*6+H470 -> 26 | K470: 5 | L470: 3 | M470: =K470*6+L470 -> 33 | O470: 7 | P470: 9 | Q470: =O470*6+P470 -> 51 | S470: PORTEOUS
A471: BEST PLAYERS
A472: WILLIAMSTOWN | C472: HARDEN | F472: McNAB | I472: WOUDA | L472: McSHANE | O472: MITCHELL | R472: AMY
A473: BRIGHTON | C473: McCARTHY | F473: DUGGAN | I473: M BAYLISS | L473: WYATT | O473: SODERBLOOM | R473: BANNISTER
A474: GOALKICKERS
A475: WILLIAMSTOWN | C475: AMESS 2 | F475: AMY | H475: SMITH | J475: BUSBRIDGE | M475: WOUDA | O475: HARDEN | Q475: MITCHELL | T475: SUTTON
A476: BRIGHTON | C476: M BAYLISS 3 | G476: McCARTHY 2 | J476: DUGGAN | M476: WYATT | O476: CARROLL
A478: ROUND 11 | D478: 12TH JULY | J478: WEATHER | M478: HEAVY RAIN S.W. WIND | S478: PLAYED AT | X478: LADDER | AB478: ROUND | AD478: 11
D479: 1ST QTR | H479: 2ND QTR | L479: 3RD QTR | P479: FINAL | S479: FOOTSCRAY
A480: NORTHCOTE | C480: 3 | D480: 2 | E480: =C480*6+D480 -> 20 | G480: 3 | H480: 2 | I480: =G480*6+H480 -> 20 | K480: 5 | L480: 7 | M480: =K480*6+L480 -> 37 | O480: 6 | P480: 7 | Q480: =O480*6+P480 -> 43 | S480: UMPIRE | W480: TEAM | X480: W | Y480: L | Z480: D | AA480: FOR | AB480: AGST | AC480: % | AD480: PTS
A481: FOOTSCRAY | C481: 1 | D481: 0 | E481: =C481*6+D481 -> 6 | G481: 1 | H481: 6 | I481: =G481*6+H481 -> 12 | K481: 2 | L481: 6 | M481: =K481*6+L481 -> 18 | O481: 3 | P481: 10 | Q481: =O481*6+P481 -> 28 | S481: McKINNON
A482: BEST PLAYERS | W482: NORTH MELBOURNE | X482: 11 | Y482: 0 | Z482: 0 | AA482: 877 | AB482: 336 | AC482: 261.01190476190476 | AD482: 44
A483: NORTHCOTE | C483: O'KEEFE | F483: POWDITCH | I483: MILLS | L483: BENNETT | O483: JOYCE | Q483: PATTERSON | W483: FOOTSCRAY | X483: 9 | Y483: 2 | Z483: 0 | AA483: 797 | AB483: 360 | AC483: 221.38888888888889 | AD483: 36
A484: FOOTSCRAY | C484: SAMSON | F484: PHILLIPS | I484: DAVIDSON | L484: MORGAN | N484: J GRIERSON | Q484: C GRIERSON | W484: NORTHCOTE | X484: 8 | Y484: 3 | Z484: 0 | AA484: 627 | AB484: 535 | AC484: 117.19626168224299 | AD484: 32
A485: GOALKICKERS | W485: BRUNSWICK | X485: 7 | Y485: 4 | Z485: 0 | AA485: 669 | AB485: 569 | AC485: 117.57469244288225 | AD485: 28
A486: NORTHCOTE | C486: JOYCE 2 | F486: BENNETT 2 | J486: O'KEEFE | M486: SMITH | O486: MILLS
A487: FOOTSCRAY | C487: MARTIN | F487: MORGAN | I487: TOMLIN | W487: PRAHRAN | X487: 5 | Y487: 6 | Z487: 0 | AA487: 554 | AB487: 637 | AC487: 86.970172684458404 | AD487: 20
W488: WILLIAMSTOWN | X488: 4 | Y488: 7 | Z488: 0 | AA488: 543 | AB488: 544 | AC488: 99.816176470588232 | AD488: 16
A489: BRUNSWICK | C489: 4 | D489: 4 | E489: =C489*6+D489 -> 28 | G489: 5 | H489: 8 | I489: =G489*6+H489 -> 38 | K489: 6 | L489: 12 | M489: =K489*6+L489 -> 48 | O489: 9 | P489: 20 | Q489: =O489*6+P489 -> 74 | S489: GLENFERRIE | W489: HAWTHORN | X489: 4 | Y489: 7 | Z489: 0 | AA489: 540 | AB489: 688 | AC489: 78.488372093023258 | AD489: 16
A490: HAWTHORN | C490: 0 | D490: 3 | E490: =C490*6+D490 -> 3 | G490: 2 | H490: 6 | I490: =G490*6+H490 -> 18 | K490: 3 | L490: 7 | M490: =K490*6+L490 -> 25 | O490: 3 | P490: 9 | Q490: =O490*6+P490 -> 27 | S490: KNOWLES | W490: PORT MELBOURNE | X490: 4 | Y490: 7 | Z490: 0 | AA490: 500 | AB490: 661 | AC490: 75.642965204236006 | AD490: 16
A491: BEST PLAYERS | W491: ESSENDON ASSOC. | X491: 2 | Y491: 9 | Z491: 0 | AA491: 477 | AB491: 724 | AC491: 65.88397790055248 | AD491: 8
A492: BRUNSWICK | C492: CLOWE | F492: HARKER | I492: KIELY | L492: SHAND | O492: MAY | Q492: FEATHERSTONE | W492: BRIGHTON | X492: 1 | Y492: 10 | Z492: 0 | AA492: 451 | AB492: 981 | AC492: 45.973496432212031 | AD492: 4
A493: HAWTHORN | C493: LEN GIBB | F493: HOOD | I493: GODFREY | L493: NOTT | O493: KELSO | Q493: MUNRO
A494: GOALKICKERS
A495: BRUNSWICK | C495: HARKER 5 | F495: SHAND | I495: FEATHERSTONE | M495: SWIFT | O495: LARKIN
A496: HAWTHORN | C496: LEN GIBB 2 | G496: WILKINSON
A498: NORTH MELBOURNE | C498: 2 | D498: 2 | E498: =C498*6+D498 -> 14 | G498: 7 | H498: 4 | I498: =G498*6+H498 -> 46 | K498: 7 | L498: 6 | M498: =K498*6+L498 -> 48 | O498: 7 | P498: 9 | Q498: =O498*6+P498 -> 51 | S498: NORTH MELB
A499: WILLIAMSTOWN | C499: 2 | D499: 3 | E499: =C499*6+D499 -> 15 | G499: 2 | H499: 4 | I499: =G499*6+H499 -> 16 | K499: 4 | L499: 10 | M499: =K499*6+L499 -> 34 | O499: 5 | P499: 10 | Q499: =O499*6+P499 -> 40 | S499: McKENZIE
A500: BEST PLAYERS
A501: NORTH MELBOURNE | C501: HARDY | F501: IRWIN | I501: MOODIE | L501: SHEEHAN | O501: HART | Q501: DONNELLY
A502: WILLIAMSTOWN | C502: AMY | F502: BUSBRIDGE | I502: SMITH | L502: McDONALD | O502: AMESS | Q502: MITCHELL
A503: GOALKICKERS
A504: NORTH MELBOURNE | C504: CONDON 3 | F504: IRWIN | I504: HAWKINS
A505: WILLIAMSTOWN | C505: SMITH 2 | F505: McDONALD 2 | J505: AMY
A507: BRIGHTON | C507: 4 | D507: 7 | E507: =C507*6+D507 -> 31 | G507: 5 | H507: 7 | I507: =G507*6+H507 -> 37 | K507: 6 | L507: 11 | M507: =K507*6+L507 -> 47 | O507: 8 | P507: 12 | Q507: =O507*6+P507 -> 60 | S507: BRIGHTON BEACH
A508: PORT MELBOURNE | C508: 2 | D508: 1 | E508: =C508*6+D508 -> 13 | G508: 6 | H508: 3 | I508: =G508*6+H508 -> 39 | K508: 6 | L508: 4 | M508: =K508*6+L508 -> 40 | O508: 7 | P508: 5 | Q508: =O508*6+P508 -> 47 | S508: ALLEY
A509: BEST PLAYERS
A510: BRIGHTON | C510: McCARTHY | F510: M BAYLISS | I510: BYRNE | L510: SODERBLOOM | O510: DUGGAN | Q510: HATTAM
A511: PORT MELBOURNE | C511: COY | F511: HOWARD | I511: BARFOOT | L511: STANFORD | O511: COOK | Q511: RUDD
A512: GOALKICKERS
A513: BRIGHTON | C513: BYRNE 2 | F513: DUGGAN 2
A514: PORT MELBOURNE | C514: HOWARD 2 | F514: COOK 2
A516: ESSENDON ASSOC. | C516: 0 | D516: 1 | E516: =C516*6+D516 -> 1 | G516: 2 | H516: 5 | I516: =G516*6+H516 -> 17 | K516: 4 | L516: 5 | M516: =K516*6+L516 -> 29 | O516: 8 | P516: 11 | Q516: =O516*6+P516 -> 59 | S516: ESSENDON
A517: PRAHRAN | C517: 3 | D517: 3 | E517: =C517*6+D517 -> 21 | G517: 5 | H517: 3 | I517: =G517*6+H517 -> 33 | K517: 8 | L517: 6 | M517: =K517*6+L517 -> 54 | O517: 8 | P517: 8 | Q517: =O517*6+P517 -> 56 | S517: GIBSON
A518: BEST PLAYERS
A519: ESSENDON ASSOC. | C519: WATT | F519: KING | I519: COCHRANE | L519: McDONALD | O519: SHORTEN | Q519: FIELDING
A520: PRAHRAN | C520: MORONEY | F520: CHADWICK | I520: MOORE | L520: FRAWLEY | O520: CARR | Q520: JAMES
A521: GOALKICKERS
A522: ESSENDON ASSOC. | C522: O'DONOGHUE 2 | G522: SHORTEN | J522: GRUNDEN | M522: McDONALD | P522: COCHRANE
A523: PRAHRAN
A525: ROUND 12 | D525: 19TH JULY | J525: WEATHER | M525: NORTH WIND SHOWERS | S525: PLAYED AT | X525: LADDER | AB525: ROUND | AD525: 12
D526: 1ST QTR | H526: 2ND QTR | L526: 3RD QTR | P526: FINAL | S526: FOOTSCRAY
A527: NORTH MELBOURNE | C527: 2 | D527: 0 | E527: =C527*6+D527 -> 12 | G527: 3 | H527: 3 | I527: =G527*6+H527 -> 21 | K527: 4 | L527: 4 | M527: =K527*6+L527 -> 28 | O527: 9 | P527: 7 | Q527: =O527*6+P527 -> 61 | S527: UMPIRE | W527: TEAM | X527: W | Y527: L | Z527: D | AA527: FOR | AB527: AGST | AC527: % | AD527: PTS
A528: FOOTSCRAY | C528: 2 | D528: 5 | E528: =C528*6+D528 -> 17 | G528: 2 | H528: 5 | I528: =G528*6+H528 -> 17 | K528: 6 | L528: 6 | M528: =K528*6+L528 -> 42 | O528: 8 | P528: 7 | Q528: =O528*6+P528 -> 55 | S528: MCKINNON
A529: BEST PLAYERS | W529: NORTH MELBOURNE | X529: 12 | Y529: 0 | Z529: 0 | AA529: 938 | AB529: 391 | AC529: 239.89769820971867 | AD529: 48
A530: NORTH MELBOURNE | C530: HARDY | F530: WALSH | I530: WOODINGTON | L530: HART | N530: SHEEHAN | Q530: MILBURN | W530: FOOTSCRAY | X530: 9 | Y530: 3 | Z530: 0 | AA530: 852 | AB530: 421 | AC530: 202.37529691211401 | AD530: 36
A531: FOOTSCRAY | C531: MONGAN | F531: MARTIN | I531: HOWELL | L531: CRADDOCK | N531: C GRIERSON | Q531: MORGAN | W531: NORTHCOTE | X531: 9 | Y531: 3 | Z531: 0 | AA531: 702 | AB531: 585 | AC531: 120 | AD531: 36
A532: GOALKICKERS | W532: BRUNSWICK | X532: 8 | Y532: 4 | Z532: 0 | AA532: 736 | AB532: 632 | AC532: 116.45569620253164 | AD532: 32
A533: NORTH MELBOURNE | C533: WALSH 3 | F533: HARDY 2 | I533: HAWKINS 2 | L533: CONDON | O533: DONNELLY
A534: FOOTSCRAY | C534: MORGAN 3 | F534: BANBURY 2 | I534: CLARKE | L534: McKENZIE | O534: FITZGIBBON | W534: WILLIAMSTOWN | X534: 5 | Y534: 7 | Z534: 0 | AA534: 607 | AB534: 574 | AC534: 105.74912891986062 | AD534: 20
W535: PRAHRAN | X535: 5 | Y535: 7 | Z535: 0 | AA535: 617 | AB535: 704 | AC535: 87.642045454545453 | AD535: 20
A536: BRUNSWICK | C536: 3 | D536: 6 | E536: =C536*6+D536 -> 24 | G536: 5 | H536: 6 | I536: =G536*6+H536 -> 36 | K536: 9 | L536: 12 | M536: =K536*6+L536 -> 66 | O536: 9 | P536: 13 | Q536: =O536*6+P536 -> 67 | S536: TOORAK PARK | W536: PORT MELBOURNE | X536: 4 | Y536: 8 | Z536: 0 | AA536: 547 | AB536: 719 | AC536: 76.077885952712094 | AD536: 16
A537: PRAHRAN | C537: 1 | D537: 3 | E537: =C537*6+D537 -> 9 | G537: 5 | H537: 5 | I537: =G537*6+H537 -> 35 | K537: 6 | L537: 5 | M537: =K537*6+L537 -> 41 | O537: 9 | P537: 9 | Q537: =O537*6+P537 -> 63 | S537: ALLEY | W537: HAWTHORN | X537: 4 | Y537: 8 | Z537: 0 | AA537: 570 | AB537: 752 | AC537: 75.797872340425528 | AD537: 16
A538: BEST PLAYERS | W538: ESSENDON ASSOC. | X538: 3 | Y538: 9 | Z538: 0 | AA538: 535 | AB538: 771 | AC538: 69.390402075226973 | AD538: 12
A539: BRUNSWICK | C539: O'CONNOR | F539: CHASE | I539: KIELY | K539: GRIMSTER | N539: HASSETT | Q539: McINERNEY | W539: BRIGHTON | X539: 1 | Y539: 11 | Z539: 0 | AA539: 501 | AB539: 1056 | AC539: 47.44318181818182 | AD539: 4
A540: PRAHRAN | C540: MOORE | F540: MORONEY | I540: CARR | K540: WEIDNER | N540: CHADWICK | Q540: DIAMOND
A541: GOALKICKERS
A542: BRUNSWICK | C542: McINERNEY 3 | G542: CHRISTIE 3
A543: PRAHRAN | C543: MOORE 3
A545: WILLIAMSTOWN | C545: 5 | D545: 2 | E545: =C545*6+D545 -> 32 | I545: =G545*6+H545 -> 0 | M545: =K545*6+L545 -> 0 | O545: 9 | P545: 10 | Q545: =O545*6+P545 -> 64 | S545: WILLIAMSTOWN
A546: HAWTHORN | C546: 0 | D546: 0 | E546: =C546*6+D546 -> 0 | I546: =G546*6+H546 -> 0 | M546: =K546*6+L546 -> 0 | O546: 4 | P546: 6 | Q546: =O546*6+P546 -> 30 | S546: HERBERT
A547: BEST PLAYERS
A548: WILLIAMSTOWN | C548: AMY | F548: STEPHENSON | I548: BROWN | L548: BUSBRIDGE | O548: MITCHELL | R548: McTAGGART
A549: HAWTHORN | C549: KELSO | F549: JENKINS | I549: WILKINSON | L549: MUNRO | O549: WALLIS | R549: GODFREY
A550: GOALKICKERS
A551: WILLIAMSTOWN | C551: SMITH 3 | F551: STEPHENSON 2) | J551: McTAGGART | M551: MITCHELL | O551: N McDONALD | R551: BUSBRIDGE
A552: HAWTHORN
A554: ESSENDON ASSOC. | C554: 2 | D554: 4 | E554: =C554*6+D554 -> 16 | G554: 5 | H554: 2 | I554: =G554*6+H554 -> 32 | K554: 6 | L554: 14 | M554: =K554*6+L554 -> 50 | O554: 7 | P554: 16 | Q554: =O554*6+P554 -> 58 | S554: ESSENDON
A555: PORT MELBOURNE | C555: 1 | D555: 1 | E555: =C555*6+D555 -> 7 | G555: 3 | H555: 6 | I555: =G555*6+H555 -> 24 | K555: 5 | L555: 4 | M555: =K555*6+L555 -> 34 | O555: 7 | P555: 5 | Q555: =O555*6+P555 -> 47 | S555: PRITCHARD
A556: BEST PLAYERS
A557: ESSENDON ASSOC. | C557: WATT | F557: ADAMS | I557: GOULDING | L557: FIELDING | O557: McCRACKEN | R557: DAVIDSON
A558: PORT MELBOURNE | C558: BLENCOWE | F558: BARFOOT | I558: THORPE | L558: HOWARD | O558: TAYLOR | R558: COOK
A559: GOALKICKERS
A560: ESSENDON ASSOC. | C560: O'DONOGHUE 2 | F560: FIELDING | I560: DICK | K560: KING | M560: McCRACKEN | P560: RUSSELL
A561: PORT MELBOURNE | C561: HOWARD 3 | F561: TAYLOR 2 | I561: NANCARROW | L561: J STANFORD
A563: NORTHCOTE | C563: 3 | D563: 4 | E563: =C563*6+D563 -> 22 | G563: 5 | H563: 8 | I563: =G563*6+H563 -> 38 | K563: 6 | L563: 10 | M563: =K563*6+L563 -> 46 | O563: 10 | P563: 15 | Q563: =O563*6+P563 -> 75 | S563: NORTHCOTE
A564: BRIGHTON | C564: 1 | D564: 1 | E564: =C564*6+D564 -> 7 | G564: 2 | H564: 4 | I564: =G564*6+H564 -> 16 | K564: 5 | L564: 5 | M564: =K564*6+L564 -> 35 | O564: 7 | P564: 8 | Q564: =O564*6+P564 -> 50 | S564: HURLEY
A565: BEST PLAYERS
A566: NORTHCOTE | C566: GITTENS | F566: THOMAS | I566: G SMITH | L566: PATTERSON | O566: BENNETT | R566: JOYCE
A567: BRIGHTON
A568: GOALKICKERS
A569: NORTHCOTE | C569: BENNETT 4 | F569: MILLS 3 | H569: JOYCE 2
A570: BRIGHTON
A572: ROUND 13 | D572: 26TH JULY | J572: WEATHER | M572: FINE | S572: PLAYED AT | X572: LADDER | AB572: ROUND | AD572: 13
D573: 1ST QTR | H573: 2ND QTR | L573: 3RD QTR | P573: FINAL | S573: BRUNSWICK
A574: BRUNSWICK | C574: 3 | D574: 0 | E574: =C574*6+D574 -> 18 | G574: 4 | H574: 4 | I574: =G574*6+H574 -> 28 | K574: 4 | L574: 5 | M574: =K574*6+L574 -> 29 | O574: 6 | P574: 11 | Q574: =O574*6+P574 -> 47 | S574: UMPIRE | W574: TEAM | X574: W | Y574: L | Z574: D | AA574: FOR | AB574: AGST | AC574: % | AD574: PTS
A575: NORTHCOTE | C575: 1 | D575: 2 | E575: =C575*6+D575 -> 8 | G575: 3 | H575: 4 | I575: =G575*6+H575 -> 22 | K575: 5 | L575: 5 | M575: =K575*6+L575 -> 35 | O575: 5 | P575: 9 | Q575: =O575*6+P575 -> 39 | S575: PRITCHARD
A576: BEST PLAYERS | W576: NORTH MELBOURNE | X576: 13 | Y576: 0 | Z576: 0 | AA576: 1054 | AB576: 426 | AC576: 247.41784037558685 | AD576: 52
A577: BRUNSWICK | C577: KIELY | F577: BRISCOE | I577: GRIMSTER | L577: KRUSE | O577: SHAND | Q577: CHASE | W577: FOOTSCRAY | X577: 10 | Y577: 3 | Z577: 0 | AA577: 938 | AB577: 457 | AC577: 205.25164113785559 | AD577: 40
A578: NORTHCOTE | C578: S SMITH | F578: H SMITH | I578: PATTERSON | L578: BUISST | O578: TIERNEY | Q578: FITZGERALD | W578: NORTHCOTE | X578: 9 | Y578: 4 | Z578: 0 | AA578: 741 | AB578: 632 | AC578: 117.24683544303798 | AD578: 36
A579: GOALKICKERS | W579: BRUNSWICK | X579: 9 | Y579: 4 | Z579: 0 | AA579: 783 | AB579: 671 | AC579: 116.69150521609538 | AD579: 36
A580: BRUNSWICK | C580: CROUCH | E580: SHAND | G580: HARKER | I580: MAY | K580: SWIFT | M580: STEVENSON
A581: NORTHCOTE | C581: MILLS 2 | F581: TIERNEY | I581: HOLMES | L581: S SMITH | W581: WILLIAMSTOWN | X581: 6 | Y581: 7 | Z581: 0 | AA581: 655 | AB581: 620 | AC581: 105.64516129032258 | AD581: 24
W582: PRAHRAN | X582: 5 | Y582: 8 | Z582: 0 | AA582: 652 | AB582: 820 | AC582: 79.512195121951223 | AD582: 20
A583: WILLIAMSTOWN | C583: 3 | D583: 1 | E583: =C583*6+D583 -> 19 | G583: 5 | H583: 4 | I583: =G583*6+H583 -> 34 | K583: 7 | L583: 5 | M583: =K583*6+L583 -> 47 | O583: 7 | P583: 6 | Q583: =O583*6+P583 -> 48 | S583: PORT MELB | W583: PORT MELBOURNE | X583: 4 | Y583: 9 | Z583: 0 | AA583: 593 | AB583: 767 | AC583: 77.314211212516298 | AD583: 16
A584: PORT MELBOURNE | C584: 2 | D584: 4 | E584: =C584*6+D584 -> 16 | G584: 3 | H584: 6 | I584: =G584*6+H584 -> 24 | K584: 5 | L584: 9 | M584: =K584*6+L584 -> 39 | O584: 6 | P584: 10 | Q584: =O584*6+P584 -> 46 | S584: McKINNON | W584: HAWTHORN | X584: 4 | Y584: 9 | Z584: 0 | AA584: 606 | AB584: 838 | AC584: 72.315035799522676 | AD584: 16
A585: BEST PLAYERS | W585: ESSENDON ASSOC. | X585: 3 | Y585: 10 | Z585: 0 | AA585: 573 | AB585: 848 | AC585: 67.570754716981128 | AD585: 12
A586: WILLIAMSTOWN | C586: ROBERTSON | F586: McTAGGART | I586: AMESS | L586: J McDONALD | O586: SUTTON | Q586: BROWN | W586: BRIGHTON | X586: 2 | Y586: 11 | Z586: 0 | AA586: 578 | AB586: 1094 | AC586: 52.833638025594148 | AD586: 8
A587: PORT MELBOURNE | C587: NANCARROW | F587: BARFOOT | I587: COOK | L587: WILDING | O587: BAIRD | Q587: TAYLOR
A588: GOALKICKERS
A589: WILLIAMSTOWN | C589: N McDONALD 2 | G589: McSHANE | J589: MITCHELL | M589: HARRISON | O589: McTAGGART
A590: PORT MELBOURNE | C590: TAYLOR 3 | F590: PALMER | H590: COOK | J590: HOWARD | L590: COY
A592: NORTH MELBOURNE | C592: 5 | D592: 2 | E592: =C592*6+D592 -> 32 | G592: 9 | H592: 12 | I592: =G592*6+H592 -> 66 | K592: 11 | L592: 14 | M592: =K592*6+L592 -> 80 | O592: 16 | P592: 20 | Q592: =O592*6+P592 -> 116 | S592: NORTH MELB
A593: PRAHRAN | C593: 0 | D593: 1 | E593: =C593*6+D593 -> 1 | G593: 0 | H593: 1 | I593: =G593*6+H593 -> 1 | K593: 4 | L593: 4 | M593: =K593*6+L593 -> 28 | O593: 5 | P593: 5 | Q593: =O593*6+P593 -> 35 | S593: HURLEY
A594: BEST PLAYERS
A595: NORTH MELBOURNE | C595: HARDY | F595: MILBURN | I595: STEVENS | L595: IRWIN | O595: WOODINGTON | R595: NOONAN
A596: PRAHRAN | C596: MORONEY | F596: YOUNG | I596: QUINN | L596: LEE | O596: MOORE | R596: FRAWLEY
A597: GOALKICKERS
A598: NORTH MELBOURNE | C598: IRWIN 5 | F598: NOONAN 4 | I598: MILBURN 2 | L598: HARDY 2 | N598: STEVENS 2
A599: PRAHRAN | C599: MORONEY 2
A601: BRIGHTON | C601: 4 | D601: 0 | E601: =C601*6+D601 -> 24 | G601: 7 | H601: 6 | I601: =G601*6+H601 -> 48 | K601: 9 | L601: 8 | M601: =K601*6+L601 -> 62 | O601: 11 | P601: 11 | Q601: =O601*6+P601 -> 77 | S601: BRIGHTON BEACH
A602: ESSENDON ASSOC. | C602: 3 | D602: 1 | E602: =C602*6+D602 -> 19 | G602: 3 | H602: 2 | I602: =G602*6+H602 -> 20 | K602: 5 | L602: 6 | M602: =K602*6+L602 -> 36 | O602: 5 | P602: 8 | Q602: =O602*6+P602 -> 38 | S602: ALLEY
A603: BEST PLAYERS
A604: BRIGHTON | C604: SODERBLOOM | F604: JOHNSON | I604: BAILES | L604: BAYLISS | O604: WILSON | R604: COBB
A605: ESSENDON ASSOC. | C605: STROWNIX | F605: FIELDING | I605: SHEA | L605: DICKSON | O605: SHORTEN | R605: GRAHAM
A606: GOALKICKERS
A607: BRIGHTON | C607: COBB 4 | F607: T BAYLISS 2 | J607: WHITE | M607: HOWELL
A608: ESSENDON ASSOC. | C608: SHEA 2 | F608: GOULDING | I608: McCRACKEN | L608: GRAHAM
A610: FOOTSCRAY | C610: 4 | D610: 7 | E610: =C610*6+D610 -> 31 | G610: 6 | H610: 10 | I610: =G610*6+H610 -> 46 | K610: 9 | L610: 14 | M610: =K610*6+L610 -> 68 | O610: 12 | P610: 14 | Q610: =O610*6+P610 -> 86 | S610: GLENFERRIE
A611: HAWTHORN | C611: 0 | D611: 0 | E611: =C611*6+D611 -> 0 | G611: 0 | H611: 2 | I611: =G611*6+H611 -> 2 | K611: 3 | L611: 3 | M611: =K611*6+L611 -> 21 | O611: 5 | P611: 6 | Q611: =O611*6+P611 -> 36 | S611: GIBSON
A612: BEST PLAYERS
A613: FOOTSCRAY | C613: CRADDOCK | F613: J GRIERSON | I613: MOORE | L613: GREAVES | O613: FITZGIBBON | R613: MUELEMAN
A614: HAWTHORN | C614: ALLEY | F614: RIGALDI | I614: HOOD | L614: L GIBB | O614: WILKINSON | R614: TEAGUE
A615: GOALKICKERS
A616: FOOTSCRAY | C616: MOORE 4 | F616: FITZGIBBON 2 | I616: MARTIN 2 | L616: CRADDOCK 2 | O616: CLARK | Q616: J GRIERSON
A617: HAWTHORN | C617: BURCHALL 2 | F617: WILKINSON | I617: NOTT | K617: LEN GIBB
A619: ROUND 14 | D619: 2ND AUGUST | H619: WEATHER | J619: COLD CLOUDY OCCASIONAL SHOWERS S.W. WIND | S619: PLAYED AT | X619: LADDER | AB619: ROUND | AD619: 14
D620: 1ST QTR | H620: 2ND QTR | L620: 3RD QTR | P620: FINAL | S620: BRUNSWICK
A621: NORTH MELBOURNE | C621: 1 | D621: 4 | E621: =C621*6+D621 -> 10 | G621: 2 | H621: 7 | I621: =G621*6+H621 -> 19 | K621: 5 | L621: 9 | M621: =K621*6+L621 -> 39 | O621: 7 | P621: 12 | Q621: =O621*6+P621 -> 54 | S621: UMPIRE | W621: TEAM | X621: W | Y621: L | Z621: D | AA621: FOR | AB621: AGST | AC621: % | AD621: PTS
A622: BRUNSWICK | C622: 2 | D622: 0 | E622: =C622*6+D622 -> 12 | G622: 3 | H622: 2 | I622: =G622*6+H622 -> 20 | K622: 5 | L622: 4 | M622: =K622*6+L622 -> 34 | O622: 7 | P622: 7 | Q622: =O622*6+P622 -> 49 | S622: PORTEOUS
A623: BEST PLAYERS | W623: NORTH MELBOURNE | X623: 14 | Y623: 0 | Z623: 0 | AA623: 1108 | AB623: 475 | AC623: 233.26315789473685 | AD623: 56
A624: NORTH MELBOURNE | C624: RAWLE | F624: MOODIE | I624: SHEEHAN | L624: HART | N624: CORNELL | Q624: HARDY | W624: FOOTSCRAY | X624: 11 | Y624: 3 | Z624: 0 | AA624: 1019 | AB624: 505 | AC624: 201.78217821782178 | AD624: 44
A625: BRUNSWICK | C625: ADAMS | F625: CROUCH | I625: SULLIVAN | L625: STEVENSON | N625: MAY | Q625: KIELY | W625: NORTHCOTE | X625: 10 | Y625: 4 | Z625: 0 | AA625: 809 | AB625: 664 | AC625: 121.83734939759036 | AD625: 40
A626: GOALKICKERS | W626: BRUNSWICK | X626: 9 | Y626: 5 | Z626: 0 | AA626: 832 | AB626: 725 | AC626: 114.75862068965517 | AD626: 36
A627: NORTH MELBOURNE | C627: HARDY 2 | F627: STEVENS 2 | I627: JOHNSON | L627: HAWKINS | N627: BARKER
A628: BRUNSWICK | C628: MAY 2 | F628: CROUCH | I628: SULLIVAN | L628: CHASE | N628: ADAMS | Q628: HARKER | W628: WILLIAMSTOWN | X628: 7 | Y628: 7 | Z628: 0 | AA628: 699 | AB628: 657 | AC628: 106.39269406392694 | AD628: 28
W629: HAWTHORN | X629: 5 | Y629: 9 | Z629: 0 | AA629: 724 | AB629: 881 | AC629: 82.179341657207715 | AD629: 20
A630: NORTHCOTE | C630: 0 | D630: 3 | E630: =C630*6+D630 -> 3 | G630: 4 | H630: 6 | I630: =G630*6+H630 -> 30 | K630: 6 | L630: 9 | M630: =K630*6+L630 -> 45 | O630: 9 | P630: 14 | Q630: =O630*6+P630 -> 68 | S630: NORTHCOTE | W630: PRAHRAN | X630: 5 | Y630: 9 | Z630: 0 | AA630: 684 | AB630: 888 | AC630: 77.027027027027032 | AD630: 20
A631: PRAHRAN | C631: 2 | D631: 8 | E631: =C631*6+D631 -> 20 | G631: 2 | H631: 9 | I631: =G631*6+H631 -> 21 | K631: 3 | L631: 13 | M631: =K631*6+L631 -> 31 | O631: 3 | P631: 14 | Q631: =O631*6+P631 -> 32 | S631: ALLEY | W631: PORT MELBOURNE | X631: 4 | Y631: 10 | Z631: 0 | AA631: 636 | AB631: 885 | AC631: 71.86440677966101 | AD631: 16
A632: BEST PLAYERS | W632: ESSENDON ASSOC. | X632: 3 | Y632: 11 | Z632: 0 | AA632: 610 | AB632: 892 | AC632: 68.38565022421524 | AD632: 12
A633: NORTHCOTE | C633: H SMITH | F633: BUISST | I633: O'BRIEN | L633: GITTENS | N633: INGHAM | Q633: CHESSWASS | W633: BRIGHTON | X633: 2 | Y633: 12 | Z633: 0 | AA633: 626 | AB633: 1175 | AC633: 53.276595744680854 | AD633: 8
A634: PRAHRAN | C634: PARKER | F634: CARR | I634: ALLISTER | L634: MORONEY | N634: CHADWICK | Q634: MOORE
A635: GOALKICKERS
A636: NORTHCOTE | C636: O'BRIEN 3 | F636: MILLS 2 | I636: INGHAM 2 | L636: HOLMES | N636: S SMITH
A637: PRAHRAN | C637: LEE 2 | F637: MORONEY
A639: HAWTHORN | C639: 2 | D639: 3 | E639: =C639*6+D639 -> 15 | G639: 5 | H639: 14 | I639: =G639*6+H639 -> 44 | K639: 10 | L639: 20 | M639: =K639*6+L639 -> 80 | O639: 15 | P639: 28 | Q639: =O639*6+P639 -> 118 | S639: GLENFERRIE
A640: PORT MELBOURNE | C640: 1 | D640: 3 | E640: =C640*6+D640 -> 9 | G640: 2 | H640: 5 | I640: =G640*6+H640 -> 17 | K640: 4 | L640: 6 | M640: =K640*6+L640 -> 30 | O640: 6 | P640: 7 | Q640: =O640*6+P640 -> 43 | S640: HURLEY
A641: BEST PLAYERS
A642: HAWTHORN | C642: WALLIS | F642: L GIBB | I642: R GIBB | L642: HOOD | N642: TEAGUE | Q642: NOTT
A643: PORT MELBOURNE | C643: BARFOOT | F643: COOK | I643: BOND | L643: RUDD | N643: WILDING | Q643: LOVETT
A644: GOALKICKERS
A645: HAWTHORN | C645: HOOD 4 | E645: NOTT 2 | G645: DWYER 2 | I645: L GIBB | K645: ALLEY | M645: HARGREAVES
A646: PORT MELBOURNE | C646: COOK 3 | F646: BOND 2 | I646: STANFORD
A648: WILLIAMSTOWN | C648: 3 | D648: 7 | E648: =C648*6+D648 -> 25 | G648: 4 | H648: 9 | I648: =G648*6+H648 -> 33 | K648: 5 | L648: 14 | M648: =K648*6+L648 -> 44 | O648: 5 | P648: 14 | Q648: =O648*6+P648 -> 44 | S648: WILLIAMSTOWN
A649: ESSENDON ASSOC. | C649: 0 | D649: 0 | E649: =C649*6+D649 -> 0 | G649: 2 | H649: 6 | I649: =G649*6+H649 -> 18 | K649: 3 | L649: 7 | M649: =K649*6+L649 -> 25 | O649: 4 | P649: 13 | Q649: =O649*6+P649 -> 37 | S649: HERBERT
A650: BEST PLAYERS
A651: WILLIAMSTOWN | C651: STONE | F651: WEBSTER | I651: SUTTON | L651: MITCHELL | N651: J McDONALD | Q651: AMESS
A652: ESSENDON ASSOC. | C652: SHEA | F652: DIXON | I652: FIELDING | L652: STROWNIX | N652: KING | Q652: ADAMS
A653: GOALKICKERS
A654: WILLIAMSTOWN | C654: N McDONALD | F654: MITCHELL | I654: McTAGGART | L654: BUSBRIDGE | O654: ARMITAGE
A655: ESSENDON ASSOC. | C655: McCRACKEN 2 | G655: SHORTEN | J655: GRUNDEN
A657: FOOTSCRAY | C657: 3 | D657: 1 | E657: =C657*6+D657 -> 19 | G657: 6 | H657: 5 | I657: =G657*6+H657 -> 41 | K657: 9 | L657: 8 | M657: =K657*6+L657 -> 62 | O657: 12 | P657: 9 | Q657: =O657*6+P657 -> 81 | S657: FOOTSCRAY
A658: BRIGHTON | C658: 4 | D658: 4 | E658: =C658*6+D658 -> 28 | G658: 4 | H658: 4 | I658: =G658*6+H658 -> 28 | K658: 5 | L658: 5 | M658: =K658*6+L658 -> 35 | O658: 7 | P658: 6 | Q658: =O658*6+P658 -> 48 | S658: McKINNON
A659: BEST PLAYERS
A660: FOOTSCRAY | C660: SAMSON | F660: McKENZIE | I660: FORD | L660: GREAVES | N660: FITZGIBBON | Q660: DAVIDSON
A661: BRIGHTON | C661: McCARTHY | F661: COBB | I661: WILSON | L661: JOHNSON | N661: M BAYLISS | Q661: R BAYLISS
A662: GOALKICKERS
A663: FOOTSCRAY | C663: SAMSON 4 | F663: GREAVES | H663: CLARK | J663: MARTIN | L663: MOORE | N663: McKENZIE | Q663: J GRIERSON | T663: EDWARDS | W663: PHILLIPS
A664: BRIGHTON | C664: McCARTHY 3 | F664: COBB 2 | I664: HOWELL | K664: T BAYLISS
A666: ROUND 15 | D666: 9TH AUGUST | J666: WEATHER | M666: FINE WEST WIND | S666: PLAYED AT | X666: LADDER | AB666: ROUND | AD666: 15
D667: 1ST QTR | H667: 2ND QTR | L667: 3RD QTR | P667: FINAL | S667: NORTH MELB
A668: NORTH MELBOURNE | C668: 1 | D668: 1 | E668: =C668*6+D668 -> 7 | G668: 2 | H668: 8 | I668: =G668*6+H668 -> 20 | K668: 4 | L668: 8 | M668: =K668*6+L668 -> 32 | O668: 7 | P668: 11 | Q668: =O668*6+P668 -> 53 | S668: UMPIRE | W668: TEAM | X668: W | Y668: L | Z668: D | AA668: FOR | AB668: AGST | AC668: % | AD668: PTS
A669: NORTHCOTE | C669: 0 | D669: 2 | E669: =C669*6+D669 -> 2 | G669: 0 | H669: 2 | I669: =G669*6+H669 -> 2 | K669: 0 | L669: 2 | M669: =K669*6+L669 -> 2 | O669: 0 | P669: 4 | Q669: =O669*6+P669 -> 4 | S669: PORTEOUS
A670: BEST PLAYERS | W670: NORTH MELBOURNE | X670: 15 | Y670: 0 | Z670: 0 | AA670: 1161 | AB670: 503 | AC670: 230.81510934393637 | AD670: 60
A671: NORTH MELBOURNE | C671: HART | F671: NORRIS | I671: SHEEHAN | L671: MILBURN | N671: CONDON | Q671: IRWIN | W671: FOOTSCRAY | X671: 12 | Y671: 3 | Z671: 0 | AA671: 1131 | AB671: 555 | AC671: 203.78378378378378 | AD671: 48
A672: NORTHCOTE | C672: FITZGIBBON | F672: PATTERSON | I672: COCKRAM | L672: H SMITH | N672: CHESSWASS | Q672: GITTENS | W672: NORTHCOTE | X672: 10 | Y672: 5 | Z672: 0 | AA672: 837 | AB672: 717 | AC672: 116.73640167364017 | AD672: 40
A673: GOALKICKERS | W673: BRUNSWICK | X673: 9 | Y673: 6 | Z673: 0 | AA673: 877 | AB673: 779 | AC673: 112.58023106546855 | AD673: 36
A674: NORTH MELBOURNE | C674: STEVENS 4 | G674: NORRIS
A675: NORTHCOTE | D675: NIL | W675: WILLIAMSTOWN | X675: 8 | Y675: 7 | Z675: 0 | AA675: 753 | AB675: 702 | AC675: 107.26495726495726 | AD675: 32
W676: HAWTHORN | X676: 6 | Y676: 9 | Z676: 0 | AA676: 796 | AB676: 945 | AC676: 84.232804232804227 | AD676: 24
A677: WILLIAMSTOWN | C677: 2 | D677: 3 | E677: =C677*6+D677 -> 15 | G677: 3 | H677: 7 | I677: =G677*6+H677 -> 25 | K677: 4 | L677: 12 | M677: =K677*6+L677 -> 36 | O677: 6 | P677: 18 | Q677: =O677*6+P677 -> 54 | S677: WILLIAMSTOWN | W677: PRAHRAN | X677: 6 | Y677: 9 | Z677: 0 | AA677: 761 | AB677: 956 | AC677: 79.60251046025104 | AD677: 24
A678: BRUNSWICK | C678: 3 | D678: 0 | E678: =C678*6+D678 -> 18 | G678: 4 | H678: 5 | I678: =G678*6+H678 -> 29 | K678: 4 | L678: 8 | M678: =K678*6+L678 -> 32 | O678: 6 | P678: 9 | Q678: =O678*6+P678 -> 45 | S678: McKINNON | W678: PORT MELBOURNE | X678: 4 | Y678: 11 | Z678: 0 | AA678: 704 | AB678: 962 | AC678: 73.180873180873178 | AD678: 16
A679: BEST PLAYERS | W679: ESSENDON ASSOC. | X679: 3 | Y679: 12 | Z679: 0 | AA679: 660 | AB679: 1004 | AC679: 65.73705179282868 | AD679: 12
A680: WILLIAMSTOWN | C680: KENNEDY | F680: ROBERTSON | I680: MITCHELL | L680: AMY | N680: STONE | Q680: J McDONALD | W680: BRIGHTON | X680: 2 | Y680: 13 | Z680: 0 | AA680: 690 | AB680: 1247 | AC680: 55.332798716920607 | AD680: 8
A681: BRUNSWICK | C681: CHRISTIE | F681: WALKER | I681: SULLIVAN | L681: CLOWE | N681: HARKER | Q681: GRIMSTER
A682: GOALKICKERS
A683: WILLIAMSTOWN | C683: MITCHELL 3 | F683: McTAGGART | I683: AMY | K683: GIBBS
A684: BRUNSWICK | C684: CHRISTIE 2 | F684: HARKER | I684: MAY | K684: KIELY | M684: WALKER
A686: PRAHRAN | C686: 1 | D686: 4 | E686: =C686*6+D686 -> 10 | G686: 7 | H686: 8 | I686: =G686*6+H686 -> 50 | K686: 11 | L686: 10 | M686: =K686*6+L686 -> 76 | O686: 11 | P686: 11 | Q686: =O686*6+P686 -> 77 | S686: PORT MELB
A687: PORT MELBOURNE | C687: 3 | D687: 2 | E687: =C687*6+D687 -> 20 | G687: 5 | H687: 3 | I687: =G687*6+H687 -> 33 | K687: 8 | L687: 7 | M687: =K687*6+L687 -> 55 | O687: 10 | P687: 8 | Q687: =O687*6+P687 -> 68 | S687: ALLEY
A688: BEST PLAYERS
A689: PRAHRAN | C689: MOORE | F689: CARR | I689: ALLISTER | L689: CHADWICK | O689: CORFIELD | Q689: MORONEY
A690: PORT MELBOURNE | C690: RUDD | F690: RYLAND | I690: KELLAN | L690: BARFOOT | O690: H PALMER | Q690: G STANFORD
A691: GOALKICKERS
A692: PRAHRAN | C692: PARKER 3 | F692: MOORE 3 | I692: E JONES 2 | L692: MORONEY | O692: RYAN | Q692: CHADWICK
A693: PORT MELBOURNE | C693: TAYLOR 4 | F693: FROOD 3
A695: HAWTHORN | C695: 2 | D695: 4 | E695: =C695*6+D695 -> 16 | G695: 5 | H695: 9 | I695: =G695*6+H695 -> 39 | K695: 10 | L695: 11 | M695: =K695*6+L695 -> 71 | O695: 10 | P695: 12 | Q695: =O695*6+P695 -> 72 | S695: BRIGHTON BEACH
A696: BRIGHTON | C696: 2 | D696: 1 | E696: =C696*6+D696 -> 13 | G696: 2 | H696: 6 | I696: =G696*6+H696 -> 18 | K696: 6 | L696: 8 | M696: =K696*6+L696 -> 44 | O696: 8 | P696: 16 | Q696: =O696*6+P696 -> 64 | S696: PRITCHARD
A697: BEST PLAYERS
A698: HAWTHORN | C698: GODFREY | F698: ROBERTS | I698: WILKINSON | L698: LEN GIBB | O698: ALLEY | R698: BURCHALL
A699: BRIGHTON | C699: McCARTHY | F699: R BAYLISS | I699: DUGGAN | L699: BANNISTER | O699: JOHNSTON | R699: HATTAM
A700: GOALKICKERS
A701: HAWTHORN | C701: KELSO 3 | F701: DAVEY 2 | I701: HARGREAVES 2 | M701: HOOD | O701: TEAGUE
A702: BRIGHTON | C702: R BAYLISS 4 | F702: McCARTHY 2 | J702: COBB
A704: FOOTSCRAY | C704: 5 | D704: 4 | E704: =C704*6+D704 -> 34 | G704: 10 | H704: 7 | I704: =G704*6+H704 -> 67 | K704: 11 | L704: 9 | M704: =K704*6+L704 -> 75 | O704: 17 | P704: 10 | Q704: =O704*6+P704 -> 112 | S704: ESSENDON
A705: ESSENDON ASSOC. | C705: 2 | D705: 3 | E705: =C705*6+D705 -> 15 | G705: 5 | H705: 4 | I705: =G705*6+H705 -> 34 | K705: 7 | L705: 7 | M705: =K705*6+L705 -> 49 | O705: 7 | P705: 8 | Q705: =O705*6+P705 -> 50 | S705: HURLEY
A706: BEST PLAYERS
A707: FOOTSCRAY | C707: PHILLIPS | F707: TOMLIN | I707: MORGAN | L707: FORD | O707: HOWELL | R707: CLARK
A708: ESSENDON ASSOC. | C708: WATT | F708: SHEA | I708: FIELDING | L708: STROWNIX | O708: SHORTEN | R708: KING
A709: GOALKICKERS
A710: FOOTSCRAY | C710: MORGAN 10 | F710: CLARK 3 | I710: PHILLIPS | L710: GREAVES | O710: MARTIN | R710: TOMLIN
A711: ESSENDON ASSOC. | C711: SHEA 3 | F711: McCRACKEN | I711: FIELDING | L711: SHORTEN | O711: KING
A713: ROUND 16 | D713: 16TH AUGUST | J713: WEATHER | M713: FINE | S713: PLAYED AT | X713: LADDER | AB713: ROUND | AD713: 16
D714: 1ST QTR | H714: 2ND QTR | L714: 3RD QTR | P714: FINAL | S714: FOOTSCRAY
A715: FOOTSCRAY | C715: 0 | D715: 4 | E715: =C715*6+D715 -> 4 | G715: 4 | H715: 8 | I715: =G715*6+H715 -> 32 | K715: 5 | L715: 13 | M715: =K715*6+L715 -> 43 | O715: 8 | P715: 16 | Q715: =O715*6+P715 -> 64 | S715: UMPIRE | W715: TEAM | X715: W | Y715: L | Z715: D | AA715: FOR | AB715: AGST | AC715: % | AD715: PTS
A716: WILLIAMSTOWN | C716: 0 | D716: 3 | E716: =C716*6+D716 -> 3 | G716: 1 | H716: 3 | I716: =G716*6+H716 -> 9 | K716: 2 | L716: 6 | M716: =K716*6+L716 -> 18 | O716: 2 | P716: 10 | Q716: =O716*6+P716 -> 22 | S716: ALLEY
A717: BEST PLAYERS | W717: NORTH MELBOURNE | X717: 16 | Y717: 0 | Z717: 0 | AA717: 1248 | AB717: 556 | AC717: 224.46043165467626 | AD717: 64
A718: FOOTSCRAY | C718: L'ESTRANGE | F718: MARTIN | I718: EDWARD | L718: GREAVES | N718: PATTERSON | Q718: DAVIDSON | W718: FOOTSCRAY | X718: 13 | Y718: 3 | Z718: 0 | AA718: 1195 | AB718: 577 | AC718: 207.10571923743501 | AD718: 52
A719: WILLIAMSTOWN | C719: MITCHELL | F719: A McTAGGART | I719: P McTAGGART | L719: KENNEDY | N719: ANDERSON | Q719: N McDONALD | W719: NORTHCOTE | X719: 11 | Y719: 5 | Z719: 0 | AA719: 909 | AB719: 761 | AC719: 119.44809461235216 | AD719: 44
A720: GOALKICKERS | W720: BRUNSWICK | X720: 10 | Y720: 6 | Z720: 0 | AA720: 1045 | AB720: 808 | AC720: 129.33168316831683 | AD720: 40
A721: FOOTSCRAY | C721: MORGAN 6 | F721: MARTIN | I721: DAVIDSON
A722: WILLIAMSTOWN | C722: AMY | F722: A McTAGGART | W722: WILLIAMSTOWN | X722: 8 | Y722: 8 | Z722: 0 | AA722: 775 | AB722: 766 | AC722: 101.17493472584856 | AD722: 32
W723: HAWTHORN | X723: 6 | Y723: 10 | Z723: 0 | AA723: 849 | AB723: 1032 | AC723: 82.267441860465112 | AD723: 24
A724: NORTH MELBOURNE | C724: 4 | D724: 6 | E724: =C724*6+D724 -> 30 | G724: 5 | H724: 8 | I724: =G724*6+H724 -> 38 | K724: 9 | L724: 13 | M724: =K724*6+L724 -> 67 | O724: 12 | P724: 15 | Q724: =O724*6+P724 -> 87 | S724: NORTH MELBOURNE | W724: PRAHRAN | X724: 6 | Y724: 10 | Z724: 0 | AA724: 816 | AB724: 1048 | AC724: 77.862595419847324 | AD724: 24
A725: HAWTHORN | C725: 1 | D725: 1 | E725: =C725*6+D725 -> 7 | G725: 4 | H725: 5 | I725: =G725*6+H725 -> 29 | K725: 4 | L725: 6 | M725: =K725*6+L725 -> 30 | O725: 7 | P725: 11 | Q725: =O725*6+P725 -> 53 | S725: McKINNON | W725: PORT MELBOURNE | X725: 4 | Y725: 12 | Z725: 0 | AA725: 733 | AB725: 1130 | AC725: 64.86725663716814 | AD725: 16
A726: BEST PLAYERS | W726: ESSENDON ASSOC. | X726: 3 | Y726: 13 | Z726: 0 | AA726: 704 | AB726: 1076 | AC726: 65.427509293680302 | AD726: 12
A727: NORTH MELBOURNE | C727: BARKER | F727: BROWN | I727: STEVENS | L727: IRWIN | N727: HAWKINS | Q727: CORNALL | W727: BRIGHTON | X727: 3 | Y727: 13 | Z727: 0 | AA727: 782 | AB727: 1302 | AC727: 60.061443932411677 | AD727: 12
A728: HAWTHORN | C728: ROBERTS | F728: FARRELLY | I728: ALLEY | L728: HOOD | N728: DAVEY | Q728: LES GIBB
A729: GOALKICKERS
A730: NORTH MELBOURNE | C730: STEVENS 4 | F730: BROWN 3 | I730: HAWKINS 3 | L730: BARKER | N730: JOHNSON
A731: HAWTHORN | C731: LEN GIBB 3 | G731: SANDILANDS | J731: WILKINSON
A733: BRUNSWICK | C733: 6 | D733: 2 | E733: =C733*6+D733 -> 38 | G733: 14 | H733: 8 | I733: =G733*6+H733 -> 92 | K733: 20 | L733: 11 | M733: =K733*6+L733 -> 131 | O733: 25 | P733: 18 | Q733: =O733*6+P733 -> 168 | S733: BRUNSWICK
A734: PORT MELBOURNE | C734: 1 | D734: 2 | E734: =C734*6+D734 -> 8 | G734: 1 | H734: 5 | I734: =G734*6+H734 -> 11 | K734: 1 | L734: 6 | M734: =K734*6+L734 -> 12 | O734: 3 | P734: 11 | Q734: =O734*6+P734 -> 29 | S734: HURLEY
A735: BEST PLAYERS
A736: BRUNSWICK | C736: HARKER | F736: HASSETT | I736: GRIMSTER | L736: SWIFT | N736: SHAND | Q736: SULLIVAN
A737: PORT MELBOURNE | C737: RUDD | F737: BARFOOT | I737: LOVETT | L737: BOND | N737: J PALMER | Q737: HOWARD
A738: GOALKICKERS
A739: BRUNSWICK | C739: HARKER 9 | F739: CHRISTIE 5 | I739: SULLIVAN 4 | L739: SWIFT 2 | N739: MAY | P739: CROUCH | R739: KIELY | T739: BUSSEY
A740: PORT MELBOURNE | C740: RUDD | F740: WALMERSLEY | J740: TAYLOR
A742: BRIGHTON | C742: 3 | D742: 2 | E742: =C742*6+D742 -> 20 | G742: 5 | H742: 10 | I742: =G742*6+H742 -> 40 | K742: 8 | L742: 12 | M742: =K742*6+L742 -> 60 | O742: 13 | P742: 14 | Q742: =O742*6+P742 -> 92 | S742: TOORAK PARK
A743: PRAHRAN | C743: 1 | D743: 4 | E743: =C743*6+D743 -> 10 | G743: 1 | H743: 6 | I743: =G743*6+H743 -> 12 | K743: 3 | L743: 13 | M743: =K743*6+L743 -> 31 | O743: 6 | P743: 19 | Q743: =O743*6+P743 -> 55 | S743: HERBERT
A744: BEST PLAYERS
A745: BRIGHTON | C745: DOWDING | F745: McCARTHY | I745: DUGGAN | L745: CARROLL | O745: SMITH | Q745: BAILES
A746: PRAHRAN | C746: CARR | F746: MOORE | I746: V JONES | L746: CARLSON | O746: FRAWLEY | Q746: BOLAND
A747: GOALKICKERS
A748: BRIGHTON | C748: R BAYLISS 5 | G748: M BAYLISS 3 | K748: COBB 2 | N748: SODERBLOOM
A749: PRAHRAN | C749: V JONES 2 | F749: BOLAND
A751: NORTHCOTE | C751: 1 | D751: 3 | E751: =C751*6+D751 -> 9 | G751: 2 | H751: 6 | I751: =G751*6+H751 -> 18 | K751: 2 | L751: 16 | M751: =K751*6+L751 -> 28 | O751: 8 | P751: 24 | Q751: =O751*6+P751 -> 72 | S751: NORTHCOTE
A752: ESSENDON ASSOC. | C752: 2 | D752: 4 | E752: =C752*6+D752 -> 16 | G752: 4 | H752: 6 | I752: =G752*6+H752 -> 30 | K752: 6 | L752: 6 | M752: =K752*6+L752 -> 42 | O752: 6 | P752: 8 | Q752: =O752*6+P752 -> 44 | S752: PRITCHARD
A753: BEST PLAYERS
A754: NORTHCOTE | C754: HOLLAND | F754: H SMITH | I754: O'KEEFE | L754: THOMAS | O754: KENNEDY | R754: TIERNEY
A755: ESSENDON ASSOC. | C755: WATT | F755: McGRATH | I755: KING | L755: SHEA | O755: McCRACKEN | R755: STROWNIX
A756: GOALKICKERS
A757: NORTHCOTE | C757: S SMITH 2 | F757: O'KEEFE | H757: MILLS | J757: COCKRAM | M757: HOLLAND | O757: WILSON | Q757: BENNETT
A758: ESSENDON ASSOC. | C758: McCRACKEN 3 | G758: ROTHWELL | J758: SHORTEN | M758: SHEA
A760: ROUND 17 | D760: 23RD AUGUST | J760: WEATHER | M760: FINE | S760: PLAYED AT | X760: LADDER | AB760: ROUND | AD760: 17
D761: 1ST QTR | H761: 2ND QTR | L761: 3RD QTR | P761: FINAL | S761: NORTHCOTE
A762: NORTHCOTE | C762: 3 | D762: 6 | E762: =C762*6+D762 -> 24 | G762: 5 | H762: 14 | I762: =G762*6+H762 -> 44 | K762: 7 | L762: 21 | M762: =K762*6+L762 -> 63 | O762: 9 | P762: 25 | Q762: =O762*6+P762 -> 79 | S762: UMPIRE | W762: TEAM | X762: W | Y762: L | Z762: D | AA762: FOR | AB762: AGST | AC762: % | AD762: PTS
A763: WILLIAMSTOWN | C763: 3 | D763: 4 | E763: =C763*6+D763 -> 22 | G763: 3 | H763: 7 | I763: =G763*6+H763 -> 25 | K763: 3 | L763: 9 | M763: =K763*6+L763 -> 27 | O763: 4 | P763: 11 | Q763: =O763*6+P763 -> 35 | S763: GIBSON
A764: BEST PLAYERS | W764: NORTH MELBOURNE | X764: 17 | Y764: 0 | Z764: 0 | AA764: 1310 | AB764: 603 | AC764: 217.24709784411277 | AD764: 68
A765: NORTHCOTE | C765: MILLS | E765: S SMITH | H765: H SMITH | K765: CHESSWASS | N765: O'KEEFE | Q765: HOLLAND | W765: FOOTSCRAY | X765: 14 | Y765: 3 | Z765: 0 | AA765: 1276 | AB765: 626 | AC765: 203.83386581469648 | AD765: 56
A766: WILLIAMSTOWN | C766: GIBBS | E766: N BUSBRIDGE | H766: KENNEDY | K766: ANDERSON | N766: J McDONALD | Q766: STEPHENSON | W766: NORTHCOTE | X766: 12 | Y766: 5 | Z766: 0 | AA766: 988 | AB766: 796 | AC766: 124.12060301507537 | AD766: 48
A767: GOALKICKERS | W767: BRUNSWICK | X767: 11 | Y767: 6 | Z767: 0 | AA767: 1115 | AB767: 868 | AC767: 128.45622119815667 | AD767: 44
A768: NORTHCOTE | C768: MILLS 4 | F768: S SMITH 4 | I768: POWDITCH
A769: WILLIAMSTOWN | C769: N BUSBRIDGE 2 | G769: McSHANE | J769: FAIRLESS | W769: WILLIAMSTOWN | X769: 8 | Y769: 9 | Z769: 0 | AA769: 810 | AB769: 845 | AC769: 95.857988165680467 | AD769: 32
W770: HAWTHORN | X770: 7 | Y770: 10 | Z770: 0 | AA770: 931 | AB770: 1077 | AC770: 86.44382544103992 | AD770: 28
A771: HAWTHORN | C771: 3 | D771: 4 | E771: =C771*6+D771 -> 22 | G771: 4 | H771: 7 | I771: =G771*6+H771 -> 31 | K771: 5 | L771: 13 | M771: =K771*6+L771 -> 43 | O771: 11 | P771: 16 | Q771: =O771*6+P771 -> 82 | S771: GLENFERRIE | W771: PRAHRAN | X771: 6 | Y771: 11 | Z771: 0 | AA771: 861 | AB771: 1130 | AC771: 76.194690265486727 | AD771: 24
A772: PRAHRAN | C772: 3 | D772: 2 | E772: =C772*6+D772 -> 20 | G772: 3 | H772: 5 | I772: =G772*6+H772 -> 23 | K772: 5 | L772: 8 | M772: =K772*6+L772 -> 38 | O772: 6 | P772: 9 | Q772: =O772*6+P772 -> 45 | S772: ALLEY | W772: PORT MELBOURNE | X772: 4 | Y772: 13 | Z772: 0 | AA772: 782 | AB772: 1211 | AC772: 64.574731626754755 | AD772: 16
A773: BEST PLAYERS | W773: ESSENDON ASSOC. | X773: 3 | Y773: 14 | Z773: 0 | AA773: 751 | AB773: 1138 | AC773: 65.992970123022843 | AD773: 12
A774: HAWTHORN | C774: LES GIBB | F774: LEN GIBB | I774: TANTAU | L774: WILKINSON | O774: KELSO | Q774: ALLEY | W774: BRIGHTON | X774: 3 | Y774: 14 | Z774: 0 | AA774: 842 | AB774: 1372 | AC774: 61.370262390670554 | AD774: 12
A775: PRAHRAN | C775: SKATER | F775: FRAWLEY | I775: McMAHON | L775: CORFIELD | O775: V JONES | Q775: BOLAND
A776: GOALKICKERS
A777: HAWTHORN | C777: WILKINSON 3 | F777: KELSO 2 | I777: ALLEY 2 | L777: SANDILANDS | O777: TEAGUE | Q777: TANTAU
A778: PRAHRAN | C778: SULLIVAN 2 | F778: McAULEY | I778: PARKER | L778: V JONES
A780: FOOTSCRAY | C780: 2 | D780: 5 | E780: =C780*6+D780 -> 17 | G780: 5 | H780: 9 | I780: =G780*6+H780 -> 39 | K780: 10 | L780: 12 | M780: =K780*6+L780 -> 72 | O780: 11 | P780: 15 | Q780: =O780*6+P780 -> 81 | S780: PORT MELB
A781: PORT MELBOURNE | C781: 3 | D781: 2 | E781: =C781*6+D781 -> 20 | G781: 4 | H781: 3 | I781: =G781*6+H781 -> 27 | K781: 6 | L781: 5 | M781: =K781*6+L781 -> 41 | O781: 7 | P781: 7 | Q781: =O781*6+P781 -> 49 | S781: PRITCHARD
A782: BEST PLAYERS
A783: FOOTSCRAY | C783: CRADDOCK | F783: PHILLIPS | I783: L'ESTRANGE | L783: DAVIDSON | O783: FORD | Q783: GREAVES
A784: PORT MELBOURNE | C784: COOK | F784: BARFOOT | I784: G STANFORD | L784: FENNER | O784: LOVETT
A785: GOALKICKERS
A786: FOOTSCRAY | C786: MORGAN 5 | F786: L'ESTRANGE 2 | J786: PATTERSON | M786: O'BRIEN | O786: CRADDOCK | R786: MARTIN
A787: PORT MELBOURNE | C787: HOWARD 2 | F787: WOLMERSLEY | J787: MALONEY | M787: TAYLOR | O787: G STANFORD | R787: FEAVER
A789: BRUNSWICK | C789: 1 | D789: 5 | E789: =C789*6+D789 -> 11 | G789: 3 | H789: 8 | I789: =G789*6+H789 -> 26 | K789: 6 | L789: 11 | M789: =K789*6+L789 -> 47 | O789: 8 | P789: 22 | Q789: =O789*6+P789 -> 70 | S789: BRIGHTON BEACH
A790: BRIGHTON | C790: 4 | D790: 2 | E790: =C790*6+D790 -> 26 | G790: 6 | H790: 7 | I790: =G790*6+H790 -> 43 | K790: 8 | L790: 10 | M790: =K790*6+L790 -> 58 | O790: 8 | P790: 12 | Q790: =O790*6+P790 -> 60 | S790: McKINNON
A791: BEST PLAYERS
A792: BRUNSWICK | C792: HASSETT | F792: McINERNEY | I792: TRICKEY | L792: BRISCOE | O792: WOODS | Q792: CHASE
A793: BRIGHTON | C793: DUGGAN | F793: M BAYLISS | I793: R BAYLISS | L793: SODERBLOOM | O793: WARD | Q793: SMITH
A794: GOALKICKERS
A795: BRUNSWICK | C795: CHRISTIE 2 | F795: HARKER 2 | I795: CHASE 2 | L795: O'CONNOR | O795: SULLIVAN
A796: BRIGHTON | C796: R BAYLISS 3 | G796: T BAYLISS 2 | K796: M BAYLISS 2 | O796: WILSON
A798: NORTH MELBOURNE | C798: 3 | D798: 5 | E798: =C798*6+D798 -> 23 | G798: 6 | H798: 12 | I798: =G798*6+H798 -> 48 | K798: 7 | L798: 15 | M798: =K798*6+L798 -> 57 | O798: 7 | P798: 20 | Q798: =O798*6+P798 -> 62 | S798: ESSENDON
A799: ESSENDON ASSOC. | C799: 1 | D799: 1 | E799: =C799*6+D799 -> 7 | G799: 3 | H799: 6 | I799: =G799*6+H799 -> 24 | K799: 5 | L799: 7 | M799: =K799*6+L799 -> 37 | O799: 6 | P799: 11 | Q799: =O799*6+P799 -> 47 | S799: HURLEY
A800: BEST PLAYERS
A801: NORTH MELBOURNE | C801: BARKER | F801: MILLER | I801: FORBES | L801: IRWIN | O801: HART | Q801: CORNELL
A802: ESSENDON ASSOC. | C802: KING | F802: FIELDING | I802: SHEA | L802: MORRIS | O802: McGRATH | Q802: McCRACKEN
A803: GOALKICKERS
A804: NORTH MELBOURNE | C804: BROWN 3 | F804: STEVENS 2 | I804: IRWIN | L804: BARKER
A805: ESSENDON ASSOC. | C805: KING 3 | F805: MCCRACKEN 2
A807: ROUND 18 | D807: 30TH AUGUST | J807: WEATHER | M807: FINE MILD | S807: PLAYED AT | X807: LADDER | AB807: ROUND | AD807: 18
D808: 1ST QTR | H808: 2ND QTR | L808: 3RD QTR | P808: FINAL | S808: BRUNSWICK
A809: BRUNSWICK | C809: 5 | D809: 3 | E809: =C809*6+D809 -> 33 | G809: 8 | H809: 6 | I809: =G809*6+H809 -> 54 | K809: 8 | L809: 12 | M809: =K809*6+L809 -> 60 | O809: 10 | P809: 19 | Q809: =O809*6+P809 -> 79 | S809: UMPIRE | W809: TEAM | X809: W | Y809: L | Z809: D | AA809: FOR | AB809: AGST | AC809: % | AD809: PTS
A810: FOOTSCRAY | C810: 2 | D810: 4 | E810: =C810*6+D810 -> 16 | G810: 7 | H810: 4 | I810: =G810*6+H810 -> 46 | K810: 9 | L810: 6 | M810: =K810*6+L810 -> 60 | O810: 11 | P810: 6 | Q810: =O810*6+P810 -> 72 | S810: McKINNON
A811: BEST PLAYERS | W811: NORTH MELBOURNE | X811: 18 | Y811: 0 | Z811: 0 | AA811: 1389 | AB811: 645 | AC811: 215.34883720930233 | AD811: 72
A812: BRUNSWICK | C812: CHASE | F812: O'CONNOR | I812: HASSETT | L812: HARKER | O812: MAY | Q812: CROUCH | W812: FOOTSCRAY | X812: 14 | Y812: 4 | Z812: 0 | AA812: 1348 | AB812: 705 | AC812: 191.20567375886526 | AD812: 56
A813: FOOTSCRAY | C813: HOWELL | F813: J GRIERSON | I813: C GRIERSON | L813: PATTERSON | O813: CRADDOCK | Q813: TOMLIN | W813: BRUNSWICK | X813: 12 | Y813: 6 | Z813: 0 | AA813: 1194 | AB813: 940 | AC813: 127.02127659574468 | AD813: 48
A814: GOALKICKERS | W814: NORTHCOTE | X814: 12 | Y814: 6 | Z814: 0 | AA814: 1061 | AB814: 900 | AC814: 117.88888888888889 | AD814: 48
A815: BRUNSWICK | C815: SULLIVAN 2 | F815: CROUCH 2 | I815: CHASE 2 | L815: HARKER 2 | N815: STEVENSON | Q815: TRICKEY
A816: FOOTSCRAY | C816: MORGAN 4 | F816: MARTIN 2 | I816: CLARK | K816: FITZGIBBON | N816: HOWELL | P816: CRADDOCK | R816: PHILLIPS | W816: WILLIAMSTOWN | X816: 9 | Y816: 9 | Z816: 0 | AA816: 877 | AB816: 899 | AC816: 97.552836484983317 | AD816: 36
W817: HAWTHORN | X817: 8 | Y817: 10 | Z817: 0 | AA817: 1006 | AB817: 1130 | AC817: 89.026548672566378 | AD817: 32
A818: WILLIAMSTOWN | C818: 1 | D818: 4 | E818: =C818*6+D818 -> 10 | G818: 5 | H818: 7 | I818: =G818*6+H818 -> 37 | K818: 7 | L818: 11 | M818: =K818*6+L818 -> 53 | O818: 9 | P818: 13 | Q818: =O818*6+P818 -> 67 | S818: WILLIAMSTOWN | W818: PRAHRAN | X818: 6 | Y818: 12 | Z818: 0 | AA818: 915 | AB818: 1197 | AC818: 76.441102756892235 | AD818: 24
A819: PRAHRAN | C819: 5 | D819: 1 | E819: =C819*6+D819 -> 31 | G819: 5 | H819: 3 | I819: =G819*6+H819 -> 33 | K819: 7 | L819: 4 | M819: =K819*6+L819 -> 46 | O819: 8 | P819: 6 | Q819: =O819*6+P819 -> 54 | S819: PRITCHARD | W819: PORT MELBOURNE | X819: 5 | Y819: 13 | Z819: 0 | AA819: 886 | AB819: 1284 | AC819: 69.003115264797515 | AD819: 20
A820: BEST PLAYERS | W820: ESSENDON ASSOC. | X820: 3 | Y820: 15 | Z820: 0 | AA820: 804 | AB820: 1213 | AC820: 66.281945589447645 | AD820: 12
A821: WILLIAMSTOWN | C821: BROWN | F821: SUTTON | I821: KENNEDY | L821: TURNBULL | O821: AMY | Q821: ROBERTSON | W821: BRIGHTON | X821: 3 | Y821: 15 | Z821: 0 | AA821: 884 | AB821: 1451 | AC821: 60.923501033769817 | AD821: 12
A822: PRAHRAN | C822: MOORE | F822: WEIDNER | I822: CARLSON | L822: DIAMOND | O822: BOLAND | Q822: E JONES
A823: GOALKICKERS
A824: WILLIAMSTOWN | C824: SMITH 3 | F824: FAIRLESS 2 | I824: AMY | J824: KENNEDY | M824: BUSBRIDGE
A825: PRAHRAN | C825: PARKER 2 | F825: McCAULEY 2 | I825: BOLAND 2 | L825: V JONES | N825: McNAMARA
A827: HAWTHORN | C827: 5 | D827: 3 | E827: =C827*6+D827 -> 33 | G827: 8 | H827: 8 | I827: =G827*6+H827 -> 56 | K827: 9 | L827: 13 | M827: =K827*6+L827 -> 67 | O827: 10 | P827: 15 | Q827: =O827*6+P827 -> 75 | S827: GLENFERRIE
A828: ESSENDON ASSOC. | C828: 3 | D828: 0 | E828: =C828*6+D828 -> 18 | G828: 5 | H828: 2 | I828: =G828*6+H828 -> 32 | K828: 5 | L828: 6 | M828: =K828*6+L828 -> 36 | O828: 7 | P828: 11 | Q828: =O828*6+P828 -> 53 | S828: PORTEOUS
A829: BEST PLAYERS
A830: HAWTHORN | C830: HOOD | F830: NOTT | I830: KELSO | L830: WILKINSON | O830: ALLEY | Q830: LEN GIBB
A831: ESSENDON ASSOC. | C831: McCRACKEN | F831: WATT | I831: SHEA | L831: STROWNIX | O831: ADAMS | Q831: SHORTEN
A832: GOALKICKERS
A833: HAWTHORN | C833: ALLEY 3 | F833: NOTT 2 | H833: LEN GIBB 2 | J833: HOOD | L833: WILKINSON | O833: KELSO
A834: ESSENDON ASSOC. | C834: SHEA | E834: ROTHWELL | H834: BECTON | J834: WATT | L834: McCRACKEN
A836: PORT MELBOURNE | C836: 4 | D836: 7 | E836: =C836*6+D836 -> 31 | G836: 5 | H836: 12 | I836: =G836*6+H836 -> 42 | K836: 13 | L836: 14 | M836: =K836*6+L836 -> 92 | O836: 15 | P836: 14 | Q836: =O836*6+P836 -> 104 | S836: PORT MELB
A837: NORTHCOTE | C837: 0 | D837: 0 | E837: =C837*6+D837 -> 0 | G837: 4 | H837: 1 | I837: =G837*6+H837 -> 25 | K837: 5 | L837: 2 | M837: =K837*6+L837 -> 32 | O837: 11 | P837: 7 | Q837: =O837*6+P837 -> 73 | S837: HURLEY
A838: BEST PLAYERS
A839: PORT MELBOURNE | C839: RUDD | F839: BARFOOT | I839: HOWARD | L839: NANCARROW | O839: COY | Q839: KELLAN
A840: NORTHCOTE | C840: YATES | F840: CHESSWASS | I840: COCKRAM | L840: BOLAND | O840: INGHAM | Q840: BENNETT
A841: GOALKICKERS
A842: PORT MELBOURNE | C842: TAYLOR 5 | F842: HOWARD 3 | I842: BARFOOT 2 | L842: G STANFORD 2 | O842: WILSON | Q842: NANCARROW
A843: NORTHCOTE | C843: YATES 2 | F843: COCKRAM 2 | I843: MILLS 2 | K843: BENNETT 2
A845: NORTH MELBOURNE | C845: 1 | D845: 6 | E845: =C845*6+D845 -> 12 | G845: 4 | H845: 17 | I845: =G845*6+H845 -> 41 | K845: 6 | L845: 19 | M845: =K845*6+L845 -> 55 | O845: 9 | P845: 25 | Q845: =O845*6+P845 -> 79 | S845: NORTH MELB
A846: BRIGHTON | C846: 3 | D846: 0 | E846: =C846*6+D846 -> 18 | G846: 3 | H846: 0 | I846: =G846*6+H846 -> 18 | K846: 6 | L846: 0 | M846: =K846*6+L846 -> 36 | O846: 7 | P846: 0 | Q846: =O846*6+P846 -> 42 | S846: ALLEY
A847: BEST PLAYERS
A848: NORTH MELBOURNE | C848: HARDY | F848: DONNELLY | I848: HAWKINS | L848: BARKER | O848: IRWIN | Q848: MILBURN
A849: BRIGHTON | C849: WILSON | F849: WARD | I849: MCCARTHY | L849: SODERBLOOM | O849: HATTAM | Q849: R BAYLISS
A850: GOALKICKERS
A851: NORTH MELBOURNE | C851: BARKER 2 | F851: HARDY 2 | I851: DEVEREAUX 2 | M851: BROWN | O851: CONDON | Q851: HAWKINS
A852: BRIGHTON | C852: MILLER 2 | F852: SODERBLOOM | I852: DUGGAN | K852: R BAYLISS | N852: WILSON
A854: FINALS
A855: 1ST SEMI | D855: 6TH SEPTEMBER | J855: WEATHER | M855: COLD | O855: DULL
A856: FOOTSCRAY | C856: 4 | D856: 5 | E856: =C856*6+D856 -> 29 | G856: 6 | H856: 5 | I856: =G856*6+H856 -> 41 | K856: 11 | L856: 6 | M856: =K856*6+L856 -> 72 | O856: 12 | P856: 8 | Q856: =O856*6+P856 -> 80 | S856: EMCG
A857: NORTHCOTE | C857: 1 | D857: 1 | E857: =C857*6+D857 -> 7 | G857: 3 | H857: 6 | I857: =G857*6+H857 -> 24 | K857: 3 | L857: 7 | M857: =K857*6+L857 -> 25 | O857: 4 | P857: 9 | Q857: =O857*6+P857 -> 33 | S857: McKINNON
A858: BEST PLAYERS
A859: FOOTSCRAY | D859: HOWELL | G859: MARTIN | J859: PATTERSON | N859: DAVIDSON | Q859: CRADDOCK | T859: FITZGIBBON
A860: NORTHCOTE | D860: O'KEEFE | G860: FITZGERALD | J860: H SMITH | N860: KENNEDY | Q860: YATES | T860: GITTENS
A861: GOALKICKERS
A862: FOOTSCRAY | D862: HOWELL 4 | G862: MARTIN 3 | J862: MORGAN 3 | M862: CRADDCOK | P862: GREAVES
A863: NORTHCOTE | D863: MILLS | G863: POWDITCH | J863: H SMITH | M863: HOLMES
A865: 2ND SEMI | D865: 13TH SEPTEMBER | J865: WEATHER | M865: RAIN SOUTH WIND
A866: BRUNSWICK | C866: 2 | D866: 5 | E866: =C866*6+D866 -> 17 | G866: 5 | H866: 8 | I866: =G866*6+H866 -> 38 | K866: 7 | L866: 15 | M866: =K866*6+L866 -> 57 | O866: 7 | P866: 19 | Q866: =O866*6+P866 -> 61 | S866: EMCG
A867: NORTH MELBOURNE | C867: 1 | D867: 1 | E867: =C867*6+D867 -> 7 | G867: 4 | H867: 1 | I867: =G867*6+H867 -> 25 | K867: 5 | L867: 1 | M867: =K867*6+L867 -> 31 | O867: 8 | P867: 4 | Q867: =O867*6+P867 -> 52 | S867: HURLEY
A868: BEST PLAYERS
A869: BRUNSWICK | D869: O'CONNOR | G869: SULLIVAN | J869: KIELY | M869: ADAMS | P869: CHRISTIE | S869: SHAND
A870: NORTH MELBOURNE | D870: HARDY | G870: RAWLE | J870: MILLER | M870: CONDON | P870: McKENZIE | S870: CORNELL
A871: GOALKICKERS
A872: BRUNSWICK | D872: CHRISTIE 4 | H872: CROUCH 2 | K872: SULLIVAN
A873: NORTH MELBOURNE | D873: HAWKINS 2 | G873: HARDY | I873: STEVENS | K873: RAWLE | M873: BROWN | O873: JOHNSON | R873: CORNELL
A875: FINAL | D875: 20TH SEPTEMBER | H875: WEATHER | K875: COLD EARLY SHOWERS CLEARING S.W. WIND
A876: FOOTSCRAY | C876: 0 | D876: 0 | E876: =C876*6+D876 -> 0 | G876: 3 | H876: 3 | I876: =G876*6+H876 -> 21 | K876: 6 | L876: 5 | M876: =K876*6+L876 -> 41 | O876: 8 | P876: 11 | Q876: =O876*6+P876 -> 59 | S876: EMCG
A877: BRUNSWICK | C877: 4 | D877: 3 | E877: =C877*6+D877 -> 27 | G877: 4 | H877: 3 | I877: =G877*6+H877 -> 27 | K877: 6 | L877: 3 | M877: =K877*6+L877 -> 39 | O877: 7 | P877: 4 | Q877: =O877*6+P877 -> 46 | S877: HURLEY
A878: BEST PLAYERS
A879: FOOTSCRAY | D879: HOWELL | G879: MARTIN | J879: BANBURY | M879: PATTERSON | P879: J GRIERSON | S879: MONGAN
A880: BRUNSWICK | D880: O'CONNOR | G880: SHAND | J880: GRIMSTER | M880: STEVENSON | P880: TRICKEY | S880: KIELY
A881: GOALKICKERS
A882: FOOTSCRAY | D882: MORGAN 4 | G882: MARTIN 2 | J882: CRADDOCK | M882: HOWELL
A883: BRUNSWICK | D883: KIELY 3 | G883: BRISCOE | J883: GOONAN | M883: MAY | O883: HARKER
A885: GRAND FINAL | D885: 27TH SEPTEMBER | J885: WEATHER | M885: FINE S.W. WIND
A886: FOOTSCRAY | C886: 4 | D886: 5 | E886: 29 | G886: 4 | H886: 8 | I886: 32 | K886: 6 | L886: 16 | M886: 52 | O886: 8 | P886: 17 | Q886: =O886*6+P886 -> 65 | S886: EMCG
A887: NORTH MELBOURNE | C887: 1 | D887: 1 | E887: 7 | G887: 4 | H887: 6 | I887: 30 | K887: 4 | L887: 7 | M887: 31 | O887: 6 | P887: 7 | Q887: =O887*6+P887 -> 43 | S887: HURLEY
A888: BEST PLAYERS
A889: FOOTSCRAY | D889: PATTERSON | G889: HOWELL | J889: MARTIN | M889: EDWARDS | P889: GREAVES | S889: CRADDOCK
A890: NORTH MELBOURNE | D890: HARDY | G890: BARKER | J890: IRWIN | M890: RAWLE | P890: CORNELL | S890: SHEEHAN
A891: GOALKICKERS
A892: FOOTSCRAY | D892: CRADDOCK 4 | G892: SAMSON | J892: MORGAN | M892: HOWELL | P892: MARTIN
A893: NORTH MELBOURNE | D893: IRWIN | G893: STEVENS | J893: FORBES | M893: BARKER | P893: HAWKINS | S893: HARDY