A1: Victorian Football Association
A2: Season 1920
A3: © Copyright Wal Williams | F3: First created: 2 August 2014
A4: Contact: joywalwi at gmail dot com | F4: Last updated: 2 August 2014 | W4: VFA Results and tables - Link to the main index page
A5: You are free to copy this document in whole or part provided that proper acknowledgement is given to the author. All rights reserved.
A7: YEAR 1920
A8: ROUND 1 | D8: 1ST MAY | H8: WEATHER | K8: COOL MODERATE S.W. WIND LATE SHOWERS | S8: PLAYED AT | X8: LADDER | AB8: ROUND | AD8: 1
D9: 1ST QTR | H9: 2ND QTR | L9: 3RD QTR | P9: FINAL | S9: PORT MELB
A10: NORTH MELBOURNE | C10: 0 | D10: 1 | E10: =C10*6+D10 -> 1 | G10: 4 | H10: 8 | I10: =G10*6+H10 -> 32 | K10: 6 | L10: 9 | M10: =K10*6+L10 -> 45 | O10: 6 | P10: 12 | Q10: =O10*6+P10 -> 48 | S10: UMPIRE | W10: TEAM | X10: W | Y10: L | Z10: D | AA10: FOR | AB10: AGST | AC10: % | AD10: PTS
A11: PORT MELBOURNE | C11: 1 | D11: 8 | E11: =C11*6+D11 -> 14 | G11: 1 | H11: 8 | I11: =G11*6+H11 -> 14 | K11: 6 | L11: 11 | M11: =K11*6+L11 -> 47 | O11: 6 | P11: 11 | Q11: =O11*6+P11 -> 47 | S11: ALLEY
A12: BEST PLAYERS | W12: FOOTSCRAY | X12: 1 | Y12: 0 | Z12: 0 | AA12: 72 | AB12: 53 | AC12: 135.84905660377359 | AD12: 4
A13: NORTH MELBOURNE | C13: ELLINGSEN | F13: HARDY | I13: BARKER | L13: GARDINER | O13: DONNELLY | R13: HART | W13: HAWTHORN | X13: 1 | Y13: 0 | Z13: 0 | AA13: 68 | AB13: 58 | AC13: 117.24137931034483 | AD13: 4
A14: PORT MELBOURNE | C14: RUDD | F14: WALTON | I14: STANFORD | L14: KELLAM | O14: BARFOOT | R14: RYLAND | W14: WILLIAMSTOWN | X14: 1 | Y14: 0 | Z14: 0 | AA14: 41 | AB14: 35 | AC14: 117.14285714285714 | AD14: 4
A15: GOALKICKERS | W15: ESSENDON ASSOC. | X15: 1 | Y15: 0 | Z15: 0 | AA15: 58 | AB15: 56 | AC15: 103.57142857142857 | AD15: 4
A16: NORTH MELBOURNE | C16: NOONAN 3 | F16: ELLINGSEN 2 | J16: IRWIN
A17: PORT MELBOURNE | C17: KELLAM | F17: O'BRIEN | I17: WALKER | K17: THORPE | M17: WALTON | P17: CONDON | W17: NORTH MELBOURNE | X17: 1 | Y17: 0 | Z17: 0 | AA17: 48 | AB17: 47 | AC17: 102.12765957446808 | AD17: 4
W18: PORT MELBOURNE | X18: 0 | Y18: 1 | Z18: 0 | AA18: 47 | AB18: 48 | AC18: 97.916666666666671 | AD18: 0
A19: WILLIAMSTOWN | C19: 1 | D19: 5 | E19: =C19*6+D19 -> 11 | G19: 2 | H19: 10 | I19: =G19*6+H19 -> 22 | K19: 4 | L19: 17 | M19: =K19*6+L19 -> 41 | O19: 4 | P19: 17 | Q19: =O19*6+P19 -> 41 | S19: WILLIAMSTOWN | W19: BRUNSWICK | X19: 0 | Y19: 1 | Z19: 0 | AA19: 56 | AB19: 58 | AC19: 96.551724137931032 | AD19: 0
A20: BRIGHTON | C20: 1 | D20: 1 | E20: =C20*6+D20 -> 7 | G20: 1 | H20: 2 | I20: =G20*6+H20 -> 8 | K20: 1 | L20: 3 | M20: =K20*6+L20 -> 9 | O20: 5 | P20: 5 | Q20: =O20*6+P20 -> 35 | S20: HERBERT | W20: BRIGHTON | X20: 0 | Y20: 1 | Z20: 0 | AA20: 35 | AB20: 41 | AC20: 85.365853658536579 | AD20: 0
A21: BEST PLAYERS | W21: NORTHCOTE | X21: 0 | Y21: 1 | Z21: 0 | AA21: 58 | AB21: 68 | AC21: 85.294117647058826 | AD21: 0
A22: WILLIAMSTOWN | C22: HAUGHTON | F22: MITCHELL | I22: SMITH | L22: ROBERTSON | O22: BUSBRIDGE | W22: PRAHRAN | X22: 0 | Y22: 1 | Z22: 0 | AA22: 53 | AB22: 72 | AC22: 73.611111111111114 | AD22: 0
A23: BRIGHTON | C23: McCARTHY | F23: COBB | I23: JOHNSON | L23: GREEN | O23: CARROLL | R23: SMITH
A24: GOALKICKERS
A25: WILLIAMSTOWN | C25: SMITH 2 | F25: E McDONALD | I25: HAUGHTON
A26: BRIGHTON | C26: COBB 3 | F26: HARDIE | I26: HOWELL
A28: ESSENDON ASSOC. | C28: 5 | D28: 3 | E28: =C28*6+D28 -> 33 | G28: 6 | H28: 3 | I28: =G28*6+H28 -> 39 | K28: 8 | L28: 7 | M28: =K28*6+L28 -> 55 | O28: 8 | P28: 10 | Q28: =O28*6+P28 -> 58 | S28: ESSENDON
A29: BRUNSWICK | C29: 0 | D29: 2 | E29: =C29*6+D29 -> 2 | G29: 4 | H29: 5 | I29: =G29*6+H29 -> 29 | K29: 4 | L29: 5 | M29: =K29*6+L29 -> 29 | O29: 8 | P29: 8 | Q29: =O29*6+P29 -> 56 | S29: McKINNON
A30: BEST PLAYERS
A31: ESSENDON ASSOC. | C31: WATT | F31: SCOBIE | I31: KING | L31: RAISBECK | O31: SHORTEN | R31: STROWNIX
A32: BRUNSWICK | C32: SULLIVAN | F32: FEATHERSTONE | J32: McQUEEN | M32: STEPHENSON | P32: SHAND | R32: MOORE
A33: GOALKICKERS
A34: ESSENDON ASSOC. | C34: O'DONOGHUE 2 | G34: SHORTEN 2 | J34: KING 2 | M34: FIELDING | P34: RAISBECK
A35: BRUNSWICK | C35: MAY 2 | F35: MOORE 2 | I35: MATSON | K35: ROBERTS | M35: TRICKEY | O35: GOONAN
A37: FOOTSCRAY | C37: 1 | D37: 5 | E37: =C37*6+D37 -> 11 | G37: 5 | H37: 9 | I37: =G37*6+H37 -> 39 | K37: 9 | L37: 10 | M37: =K37*6+L37 -> 64 | O37: 10 | P37: 12 | Q37: =O37*6+P37 -> 72 | S37: TOORAK PARK
A38: PRAHRAN | C38: 2 | D38: 0 | E38: =C38*6+D38 -> 12 | G38: 3 | H38: 2 | I38: =G38*6+H38 -> 20 | K38: 7 | L38: 4 | M38: =K38*6+L38 -> 46 | O38: 8 | P38: 5 | Q38: =O38*6+P38 -> 53 | S38: KAIN
A39: BEST PLAYERS
A40: FOOTSCRAY | C40: MARTIN | F40: MUELEMAN | I40: J GRIERSON | L40: HOWELL | O40: MAYBURY | R40: DAVIDSON
A41: PRAHRAN | C41: ALLISTER | F41: CORFIELD | I41: EDGAR | L41: BRENNAN | O41: FRAWLEY | R41: CARR
A42: GOALKICKERS
A43: FOOTSCRAY | C43: MARTIN 3 | F43: PORTER 2 | I43: O'DONOGHUE 2 | M43: HOWELL | O43: MAYBURY | Q43: BANBURY
A44: PRAHRAN | C44: EDGAR 3 | F44: GOWER 2 | I44: V JONES 2 | L44: WIDDICOMBE
A46: HAWTHORN | C46: 3 | D46: 7 | E46: =C46*6+D46 -> 25 | G46: 4 | H46: 14 | I46: =G46*6+H46 -> 38 | K46: 7 | L46: 16 | M46: =K46*6+L46 -> 58 | O46: 8 | P46: 20 | Q46: =O46*6+P46 -> 68 | S46: GLENFERRIE
A47: NORTHCOTE | C47: 2 | D47: 3 | E47: =C47*6+D47 -> 15 | G47: 4 | H47: 5 | I47: =G47*6+H47 -> 29 | K47: 5 | L47: 7 | M47: =K47*6+L47 -> 37 | O47: 8 | P47: 10 | Q47: =O47*6+P47 -> 58 | S47: HURLEY
A48: BEST PLAYERS
A49: HAWTHORN | C49: ROBERTS | F49: FEWSTER | I49: GIBB | L49: RIGALDI | O49: TEAGUE | R49: ALLEY
A50: NORTHCOTE | C50: O'KEEFE | F50: COCKRAM | I50: GREENHILL | L50: B BENNETT | O50: BALLANTYNE | R50: SMITH
A51: GOALKICKERS
A52: HAWTHORN | C52: CLARK 2 | F52: DAVEY | I52: HENRY | K52: DWYER | M52: GIBB | O52: HOOD | Q52: KRUSE
A53: NORTHCOTE | C53: COCKRAM 3 | F53: O'KEEFE 2 | I53: KENNEDY | L53: STONE | N53: B BENNETT
A55: ROUND 2 | D55: 8TH MAY | J55: WEATHER | M55: FINE | S55: PLAYED AT | X55: LADDER | AB55: ROUND | AD55: 2
D56: 1ST QTR | H56: 2ND QTR | L56: 3RD QTR | P56: FINAL | S56: FOOTSCRAY
A57: FOOTSCRAY | C57: 2 | D57: 5 | E57: =C57*6+D57 -> 17 | G57: 5 | H57: 7 | I57: =G57*6+H57 -> 37 | K57: 7 | L57: 10 | M57: =K57*6+L57 -> 52 | O57: 9 | P57: 15 | Q57: =O57*6+P57 -> 69 | S57: UMPIRE | W57: TEAM | X57: W | Y57: L | Z57: D | AA57: FOR | AB57: AGST | AC57: % | AD57: PTS
A58: WILLIAMSTOWN | C58: 1 | D58: 0 | E58: =C58*6+D58 -> 6 | G58: 4 | H58: 1 | I58: =G58*6+H58 -> 25 | K58: 5 | L58: 1 | M58: =K58*6+L58 -> 31 | O58: 8 | P58: 3 | Q58: =O58*6+P58 -> 51 | S58: JENKINS
A59: BEST PLAYERS | W59: NORTH MELBOURNE | X59: 2 | Y59: 0 | Z59: 0 | AA59: 121 | AB59: 76 | AC59: 159.21052631578948 | AD59: 8
A60: FOOTSCRAY | C60: MUELEMAN | F60: J GRIERSON | I60: SAMSON | L60: MAYBURY | O60: MARTIN | Q60: STEVENS | W60: FOOTSCRAY | X60: 2 | Y60: 0 | Z60: 0 | AA60: 141 | AB60: 104 | AC60: 135.57692307692307 | AD60: 8
A61: WILLIAMSTOWN | C61: SUTTON | F61: McLEAN | I61: FAIRLESS | L61: BROWN | O61: SMITH | Q61: HAUGHTON | W61: ESSENDON ASSOC. | X61: 2 | Y61: 0 | Z61: 0 | AA61: 124 | AB61: 107 | AC61: 115.88785046728972 | AD61: 8
A62: GOALKICKERS | W62: BRIGHTON | X62: 1 | Y62: 1 | Z62: 0 | AA62: 113 | AB62: 80 | AC62: 141.25 | AD62: 4
A63: FOOTSCRAY | C63: STEVENS 4 | F63: O'DONOGHUE 2 | J63: MAYBURY 2 | M63: BANBURY
A64: WILLIAMSTOWN | C64: MITCHELL 2 | F64: HAUGHTON 2 | J64: KENT | L64: TASKER | N64: SUTTON | Q64: SMITH | W64: PORT MELBOURNE | X64: 1 | Y64: 1 | Z64: 0 | AA64: 130 | AB64: 123 | AC64: 105.6910569105691 | AD64: 4
W65: WILLIAMSTOWN | X65: 1 | Y65: 1 | Z65: 0 | AA65: 92 | AB65: 104 | AC65: 88.461538461538467 | AD65: 4
A66: NORTH MELBOURNE | C66: 3 | D66: 3 | E66: =C66*6+D66 -> 21 | G66: 3 | H66: 8 | I66: =G66*6+H66 -> 26 | K66: 4 | L66: 11 | M66: =K66*6+L66 -> 35 | O66: 10 | P66: 13 | Q66: =O66*6+P66 -> 73 | S66: NORTH MELB | W66: HAWTHORN | X66: 1 | Y66: 1 | Z66: 0 | AA66: 97 | AB66: 131 | AC66: 74.045801526717554 | AD66: 4
A67: HAWTHORN | C67: 1 | D67: 0 | E67: =C67*6+D67 -> 6 | G67: 2 | H67: 2 | I67: =G67*6+H67 -> 14 | K67: 3 | L67: 4 | M67: =K67*6+L67 -> 22 | O67: 4 | P67: 5 | Q67: =O67*6+P67 -> 29 | S67: LEWIS | W67: BRUNSWICK | X67: 0 | Y67: 2 | Z67: 0 | AA67: 131 | AB67: 141 | AC67: 92.907801418439718 | AD67: 0
A68: BEST PLAYERS | W68: NORTHCOTE | X68: 0 | Y68: 2 | Z68: 0 | AA68: 109 | AB68: 134 | AC68: 81.343283582089555 | AD68: 0
A69: NORTH MELBOURNE | C69: MILES | F69: GARDINER | I69: WEATHERALL | L69: MOODIE | O69: DONNELLY | Q69: HARDY | W69: PRAHRAN | X69: 0 | Y69: 2 | Z69: 0 | AA69: 92 | AB69: 150 | AC69: 61.333333333333336 | AD69: 0
A70: HAWTHORN | C70: ALLEY | F70: FEWSTER | I70: FEHRING | L70: RIGALDI | O70: DWYER | Q70: DAVEY
A71: GOALKICKERS
A72: NORTH MELBOURNE | C72: WEATHERALL 3 | G72: ELLINGSEN 3 | J72: V IRWIN 2 | M72: NOONAN | O72: FURLONGER | R72: HARDY
A73: HAWTHORN | C73: FEHRING 2 | G73: FEWSTER
A75: PORT MELBOURNE | C75: 1 | D75: 5 | E75: =C75*6+D75 -> 11 | G75: 6 | H75: 8 | I75: =G75*6+H75 -> 44 | K75: 8 | L75: 9 | M75: =K75*6+L75 -> 57 | O75: 12 | P75: 11 | Q75: =O75*6+P75 -> 83 | S75: BRUNSWICK
A76: BRUNSWICK | C76: 5 | D76: 3 | E76: =C76*6+D76 -> 33 | G76: 5 | H76: 6 | I76: =G76*6+H76 -> 36 | K76: 8 | L76: 8 | M76: =K76*6+L76 -> 56 | O76: 11 | P76: 9 | Q76: =O76*6+P76 -> 75 | S76: HERRON
A77: BEST PLAYERS
A78: PORT MELBOURNE | C78: TAYLOR | F78: BARFOOT | I78: HANDO | L78: STANFORD | O78: TREMBATH | R78: O'BRIEN
A79: BRUNSWICK | C79: FEATHERSTONE | F79: ADAMS | I79: HASSETT | L79: SULLIVAN | O79: MOORE | R79: SHAND
A80: GOALKICKERS
A81: PORT MELBOURNE | C81: TAYLOR 6 | F81: BARFOOT 2 | I81: O'BRIEN | K81: WALTON | M81: McDONALD | P81: ASHTON
A82: BRUNSWICK | C82: MOORE 4 | F82: SULLIVAN 3 | I82: McQUEEN | K82: STEPHENSON | N82: ELLIOTT | Q82: TRICKEY
A84: BRIGHTON | C84: 2 | D84: 4 | E84: =C84*6+D84 -> 16 | G84: 6 | H84: 7 | I84: =G84*6+H84 -> 43 | K84: 8 | L84: 9 | M84: =K84*6+L84 -> 57 | O84: 11 | P84: 12 | Q84: =O84*6+P84 -> 78 | S84: BRIGHTON BEACH
A85: PRAHRAN | C85: 2 | D85: 3 | E85: =C85*6+D85 -> 15 | G85: 4 | H85: 4 | I85: =G85*6+H85 -> 28 | K85: 5 | L85: 8 | M85: =K85*6+L85 -> 38 | O85: 5 | P85: 9 | Q85: =O85*6+P85 -> 39 | S85: LEEDS
A86: BEST PLAYERS
A87: BRIGHTON | C87: GREEN | F87: McCARTHY | I87: LEVER | L87: BANNISTER | O87: DANGERFIELD | R87: HOWELL
A88: PRAHRAN | C88: WOODS | F88: CARR | I88: JONES | L88: WIDDICOMBE | O88: FRAWLEY | R88: WEIDNER
A89: GOALKICKERS
A90: BRIGHTON | C90: COBB 5 | F90: SODERBLOOM 2 | J90: BANNISTER | M90: WYATT | P90: MCCARTHY | S90: BAYLISS
A91: PRAHRAN | C91: WEIDNER 2 | F91: WOODS 2 | I91: STRAWBRIDGE
A93: ESSENDON ASSOC. | C93: 2 | D93: 1 | E93: =C93*6+D93 -> 13 | G93: 4 | H93: 6 | I93: =G93*6+H93 -> 30 | K93: 8 | L93: 10 | M93: =K93*6+L93 -> 58 | O93: 8 | P93: 18 | Q93: =O93*6+P93 -> 66 | S93: NORTHCOTE
A94: NORTHCOTE | C94: 2 | D94: 0 | E94: =C94*6+D94 -> 12 | G94: 3 | H94: 3 | I94: =G94*6+H94 -> 21 | K94: 6 | L94: 3 | M94: =K94*6+L94 -> 39 | O94: 8 | P94: 3 | Q94: =O94*6+P94 -> 51 | S94: COLLINS
A95: BEST PLAYERS
A96: ESSENDON ASSOC. | C96: WATT | F96: SCOBIE | I96: EBBOTT | L96: KING | O96: GRAHAM | R96: LATIMER
A97: NORTHCOTE | C97: O'KEEFE | F97: BENNETT | I97: BUISST | L97: H SMITH | O97: CHESSWASS | R97: POWDITCH
A98: GOALKICKERS
A99: ESSENDON ASSOC. | C99: GRAHAM 3 | F99: SCOBIE | I99: O'DONOGHUE | L99: KING | N99: STROWNIX | Q99: EBBOTT
A100: NORTHCOTE | C100: O'KEEFE 3 | F100: POWDITCH 2 | J100: COCKRAM | M100: S SMITH | O100: FERRIS
A102: ROUND 3 | D102: 15TH MAY | J102: WEATHER | M102: COLD STRONG N.W. WIND RAIN | S102: PLAYED AT | X102: LADDER | AB102: ROUND | AD102: 3
D103: 1ST QTR | H103: 2ND QTR | L103: 3RD QTR | P103: FINAL | S103: ESSENDON
A104: NORTH MELBOURNE | C104: 1 | D104: 6 | E104: =C104*6+D104 -> 12 | G104: 1 | H104: 6 | I104: =G104*6+H104 -> 12 | K104: 4 | L104: 10 | M104: =K104*6+L104 -> 34 | O104: 5 | P104: 12 | Q104: =O104*6+P104 -> 42 | S104: UMPIRE | W104: TEAM | X104: W | Y104: L | Z104: D | AA104: FOR | AB104: AGST | AC104: % | AD104: PTS
A105: ESSENDON ASSOC. | C105: 1 | D105: 0 | E105: =C105*6+D105 -> 6 | G105: 2 | H105: 3 | I105: =G105*6+H105 -> 15 | K105: 3 | L105: 3 | M105: =K105*6+L105 -> 21 | O105: 3 | P105: 4 | Q105: =O105*6+P105 -> 22 | S105: JENKINS
A106: BEST PLAYERS | W106: NORTH MELBOURNE | X106: 3 | Y106: 0 | Z106: 0 | AA106: 163 | AB106: 98 | AC106: 166.32653061224491 | AD106: 12
A107: NORTH MELBOURNE | C107: HARDY | F107: GARDINER | I107: BARKER | L107: IRWIN | N107: CONDON | Q107: BROWN | W107: FOOTSCRAY | X107: 3 | Y107: 0 | Z107: 0 | AA107: 226 | AB107: 171 | AC107: 132.16374269005848 | AD107: 12
A108: ESSENDON ASSOC. | C108: KING | F108: McDONALD | I108: MAYNARD | L108: WATT | N108: FORBES | Q108: SCOBIE | W108: ESSENDON ASSOC. | X108: 2 | Y108: 1 | Z108: 0 | AA108: 146 | AB108: 149 | AC108: 97.986577181208048 | AD108: 8
A109: GOALKICKERS | W109: WILLIAMSTOWN | X109: 2 | Y109: 1 | Z109: 0 | AA109: 135 | AB109: 138 | AC109: 97.826086956521735 | AD109: 8
A110: NORTH MELBOURNE | C110: FURLONGER 2 | G110: NOONAN | J110: SWALLOW | M110: IRWIN
A111: ESSENDON ASSOC. | C111: KING | F111: SHORTEN | I111: EBBOTT | W111: BRUNSWICK | X111: 1 | Y111: 2 | Z111: 0 | AA111: 203 | AB111: 177 | AC111: 114.68926553672317 | AD111: 4
W112: BRIGHTON | X112: 1 | Y112: 2 | Z112: 0 | AA112: 149 | AB112: 152 | AC112: 98.026315789473685 | AD112: 4
A113: FOOTSCRAY | C113: 2 | D113: 3 | E113: =C113*6+D113 -> 15 | G113: 5 | H113: 6 | I113: =G113*6+H113 -> 36 | K113: 5 | L113: 10 | M113: =K113*6+L113 -> 40 | O113: 12 | P113: 13 | Q113: =O113*6+P113 -> 85 | S113: PORT MELB | W113: PORT MELBOURNE | X113: 1 | Y113: 2 | Z113: 0 | AA113: 197 | AB113: 208 | AC113: 94.711538461538467 | AD113: 4
A114: PORT MELBOURNE | C114: 6 | D114: 1 | E114: =C114*6+D114 -> 37 | G114: 6 | H114: 1 | I114: =G114*6+H114 -> 37 | K114: 10 | L114: 6 | M114: =K114*6+L114 -> 66 | O114: 10 | P114: 7 | Q114: =O114*6+P114 -> 67 | S114: McKINNON | W114: PRAHRAN | X114: 1 | Y114: 2 | Z114: 0 | AA114: 165 | AB114: 209 | AC114: 78.94736842105263 | AD114: 4
A115: BEST PLAYERS | W115: HAWTHORN | X115: 1 | Y115: 2 | Z115: 0 | AA115: 156 | AB115: 204 | AC115: 76.470588235294116 | AD115: 4
A116: FOOTSCRAY | C116: SAMSON | F116: J GRIERSON | I116: BANBURY | L116: MAYBURY | N116: STEVENS | Q116: BULPIT | W116: NORTHCOTE | X116: 0 | Y116: 3 | Z116: 0 | AA116: 143 | AB116: 177 | AC116: 80.790960451977398 | AD116: 0
A117: PORT MELBOURNE | C117: BARFOOT | F117: McDONALD | I117: J STANFORD | L117: COX | N117: HANDO | Q117: O'BRIEN
A118: GOALKICKERS
A119: FOOTSCRAY | C119: STEVENS 2 | F119: BULPIT 2 | I119: BANBURY 2 | L119: SAMSON | N119: MAYBURY | Q119: CRADDOCK | T119: HOWELL | W119: MARTIN | X119: O'DONOGHUE
A120: PORT MELBOURNE | C120: O'BRIEN 3 | F120: TAYLOR 3 | I120: BEESON 2 | L120: COOK | N120: BARFOOT
A122: BRUNSWICK | C122: 1 | D122: 2 | E122: =C122*6+D122 -> 8 | G122: 3 | H122: 9 | I122: =G122*6+H122 -> 27 | K122: 3 | L122: 10 | M122: =K122*6+L122 -> 28 | O122: 9 | P122: 18 | Q122: =O122*6+P122 -> 72 | S122: BRIGHTON BEACH
A123: BRIGHTON | C123: 2 | D123: 4 | E123: =C123*6+D123 -> 16 | G123: 2 | H123: 4 | I123: =G123*6+H123 -> 16 | K123: 4 | L123: 6 | M123: =K123*6+L123 -> 30 | O123: 5 | P123: 6 | Q123: =O123*6+P123 -> 36 | S123: ALLEY
A124: BEST PLAYERS
A125: BRUNSWICK | C125: PRICE | F125: MOORE | I125: SWIFT | L125: FAUST | N125: McQUEEN | Q125: MAY
A126: BRIGHTON | C126: McCARTHY | F126: LEVER | I126: BAILES | L126: JOHNSON | N126: WYATT | Q126: SODERBLOOM
A127: GOALKICKERS
A128: BRUNSWICK | C128: HAWKINS 2 | F128: PRICE 2 | I128: MOORE | K128: ALESSIO | M128: TRICKEY | O128: MAY | Q128: SULLIVAN
A129: BRIGHTON | C129: BAILES | F129: MILLER | I129: MCCARTHY | L129: DANGERFIELD | O129: SODERBLOOM
A131: WILLIAMSTOWN | C131: 1 | D131: 3 | E131: =C131*6+D131 -> 9 | G131: 2 | H131: 4 | I131: =G131*6+H131 -> 16 | K131: 5 | L131: 6 | M131: =K131*6+L131 -> 36 | O131: 6 | P131: 7 | Q131: =O131*6+P131 -> 43 | S131: WILLIAMSTOWN
A132: NORTHCOTE | C132: 1 | D132: 2 | E132: =C132*6+D132 -> 8 | G132: 3 | H132: 2 | I132: =G132*6+H132 -> 20 | K132: 4 | L132: 4 | M132: =K132*6+L132 -> 28 | O132: 5 | P132: 4 | Q132: =O132*6+P132 -> 34 | S132: HERBERT
A133: BEST PLAYERS
A134: WILLIAMSTOWN | C134: McNABB | F134: HICKEY | I134: KENNEDY | L134: FAIRLESS | O134: BUSBRIDGE | R134: BENNETT
A135: NORTHCOTE | C135: FERRIS | F135: McKECKNIE | I135: O'KEEFE | L135: COOMBS | O135: H BENNETT | R135: H YATES
A136: GOALKICKERS
A137: WILLIAMSTOWN | C137: TASKER 2 | F137: FAIRLESS | I137: STEPHENSON | L137: HAUGHTON | O137: ROBERTSON
A138: NORTHCOTE | C138: H YATES 2 | F138: O'KEEFE | I138: S YATES | L138: KENNY
A140: PRAHRAN | C140: 4 | D140: 3 | E140: =C140*6+D140 -> 27 | G140: 7 | H140: 4 | I140: =G140*6+H140 -> 46 | K140: 10 | L140: 6 | M140: =K140*6+L140 -> 66 | O140: 11 | P140: 7 | Q140: =O140*6+P140 -> 73 | S140: GLENFERRIE
A141: HAWTHORN | C141: 2 | D141: 4 | E141: =C141*6+D141 -> 16 | G141: 4 | H141: 5 | I141: =G141*6+H141 -> 29 | K141: 6 | L141: 8 | M141: =K141*6+L141 -> 44 | O141: 8 | P141: 11 | Q141: =O141*6+P141 -> 59 | S141: HURLEY
A142: BEST PLAYERS
A143: PRAHRAN | C143: CORFIELD | F143: E JONES | I143: V JONES | L143: EDGAR | O143: GIBB | Q143: BRENNAN
A144: HAWTHORN | C144: REEVES | F144: SUTHERLAND | I144: LES GIBB | L144: DOOLEY | O144: TEAGUE | Q144: ROBERTS
A145: GOALKICKERS
A146: PRAHRAN | C146: V JONES 2 | F146: GIBB 2 | I146: EDGAR 2 | K146: WEIDNER | M146: FRAWLEY | O146: E JONES | Q146: NAYLOR | S146: STRAWBRIDGE
A147: HAWTHORN | C147: FEHRING 3 | F147: ROBERTS 2 | I147: FEWSTER 2 | L147: ALLEY
A149: ROUND 4 | D149: 22ND MAY | J149: WEATHER | M149: FINE BUT GROUNDS HEAVY | S149: PLAYED AT | X149: LADDER | AB149: ROUND | AD149: 4
D150: 1ST QTR | H150: 2ND QTR | L150: 3RD QTR | P150: FINAL | S150: FOOTSCRAY
A151: FOOTSCRAY | C151: 2 | D151: 2 | E151: =C151*6+D151 -> 14 | G151: 3 | H151: 2 | I151: =G151*6+H151 -> 20 | K151: 5 | L151: 4 | M151: =K151*6+L151 -> 34 | O151: 6 | P151: 8 | Q151: =O151*6+P151 -> 44 | S151: UMPIRE | W151: TEAM | X151: W | Y151: L | Z151: D | AA151: FOR | AB151: AGST | AC151: % | AD151: PTS
A152: NORTH MELBOURNE | C152: 1 | D152: 1 | E152: =C152*6+D152 -> 7 | G152: 3 | H152: 2 | I152: =G152*6+H152 -> 20 | K152: 4 | L152: 5 | M152: =K152*6+L152 -> 29 | O152: 6 | P152: 6 | Q152: =O152*6+P152 -> 42 | S152: HURLEY
A153: BEST PLAYERS | W153: FOOTSCRAY | X153: 4 | Y153: 0 | Z153: 0 | AA153: 270 | AB153: 213 | AC153: 126.7605633802817 | AD153: 16
A154: FOOTSCRAY | C154: EDWARD | F154: GRIERSON | I154: MULEMAN | L154: BULPIT | N154: BANBURY | Q154: L'ESTRANGE | W154: NORTH MELBOURNE | X154: 3 | Y154: 1 | Z154: 0 | AA154: 205 | AB154: 142 | AC154: 144.36619718309859 | AD154: 12
A155: NORTH MELBOURNE | C155: McKENZIE | F155: MILBURN | I155: IRWIN | L155: BROWN | N155: RAWLE | Q155: HARDY | W155: WILLIAMSTOWN | X155: 3 | Y155: 1 | Z155: 0 | AA155: 221 | AB155: 196 | AC155: 112.75510204081633 | AD155: 12
A156: GOALKICKERS | W156: BRUNSWICK | X156: 2 | Y156: 2 | Z156: 0 | AA156: 251 | AB156: 222 | AC156: 113.06306306306307 | AD156: 8
A157: FOOTSCRAY | C157: BANBURY 3 | F157: SAMSON | I157: CRADDOCK | L157: MAYBURY
A158: NORTH MELBOURNE | C158: NOONAN 2 | F158: LEE | I158: BARKER | L158: CONDON | O158: WEATHERALL | W158: PORT MELBOURNE | X158: 2 | Y158: 2 | Z158: 0 | AA158: 274 | AB158: 258 | AC158: 106.2015503875969 | AD158: 8
W159: ESSENDON ASSOC. | X159: 2 | Y159: 2 | Z159: 0 | AA159: 196 | AB159: 226 | AC159: 86.725663716814154 | AD159: 8
A160: PORT MELBOURNE | C160: 3 | D160: 3 | E160: =C160*6+D160 -> 21 | G160: 5 | H160: 5 | I160: =G160*6+H160 -> 35 | K160: 7 | L160: 7 | M160: =K160*6+L160 -> 49 | O160: 11 | P160: 11 | Q160: =O160*6+P160 -> 77 | S160: ESSENDON | W160: NORTHCOTE | X160: 1 | Y160: 3 | Z160: 0 | AA160: 217 | AB160: 220 | AC160: 98.63636363636364 | AD160: 4
A161: ESSENDON ASSOC. | C161: 1 | D161: 4 | E161: =C161*6+D161 -> 10 | G161: 4 | H161: 7 | I161: =G161*6+H161 -> 31 | K161: 6 | L161: 10 | M161: =K161*6+L161 -> 46 | O161: 6 | P161: 14 | Q161: =O161*6+P161 -> 50 | S161: QUINN | W161: BRIGHTON | X161: 1 | Y161: 3 | Z161: 0 | AA161: 192 | AB161: 226 | AC161: 84.955752212389385 | AD161: 4
A162: BEST PLAYERS | W162: PRAHRAN | X162: 1 | Y162: 3 | Z162: 0 | AA162: 210 | AB162: 257 | AC162: 81.712062256809332 | AD162: 4
A163: PORT MELBOURNE | C163: TAYLOR | F163: WALTON | I163: McDONALD | L163: O'BRIEN | N163: PASH | Q163: ALBRESS | W163: HAWTHORN | X163: 1 | Y163: 3 | Z163: 0 | AA163: 214 | AB163: 290 | AC163: 73.793103448275858 | AD163: 4
A164: ESSENDON ASSOC. | C164: WATT | F164: FIELDING | I164: EBBOTT | L164: McGRATH | N164: TURNER | Q164: SCOBIE
A165: GOALKICKERS
A166: PORT MELBOURNE | C166: TAYLOR 5 | F166: PASH 2 | I166: McDONALD 2 | L166: BARFOOT | O166: WALTON
A167: ESSENDON ASSOC. | C167: GRAHAM 2 | F167: FIELDING 2 | J167: SCOBIE | M167: KING
A169: BRUNSWICK | C169: 3 | D169: 2 | E169: =C169*6+D169 -> 20 | G169: 4 | H169: 9 | I169: =G169*6+H169 -> 33 | K169: 5 | L169: 8 | M169: =K169*6+L169 -> 38 | O169: 6 | P169: 12 | Q169: =O169*6+P169 -> 48 | S169: TOORAK PARK
A170: PRAHRAN | C170: 2 | D170: 3 | E170: =C170*6+D170 -> 15 | G170: 4 | H170: 3 | I170: =G170*6+H170 -> 27 | K170: 4 | L170: 10 | M170: =K170*6+L170 -> 34 | O170: 5 | P170: 15 | Q170: =O170*6+P170 -> 45 | S170: LEEDS
A171: BEST PLAYERS
A172: BRUNSWICK | C172: ALESSIO | F172: ADAMS | I172: CHRISTIE | L172: HASSETT | N172: FAUST | Q172: SULLIVAN
A173: PRAHRAN | C173: CORFIELD | F173: FRAWLEY | I173: STRAWBEIDGE | L173: WOODS | N173: MORONEY | Q173: OSBERG
A174: GOALKICKERS
A175: BRUNSWICK | C175: CHRISTIE 3 | G175: STEPHENSON | J175: SULLIVAN | M175: HAWKINS
A176: PRAHRAN | C176: WOODS 3 | F176: ROOHEY | I176: WEIDNER
A178: WILLIAMSTOWN | C178: 2 | D178: 5 | E178: =C178*6+D178 -> 17 | G178: 6 | H178: 9 | I178: =G178*6+H178 -> 45 | K178: 7 | L178: 16 | M178: =K178*6+L178 -> 58 | O178: 11 | P178: 20 | Q178: =O178*6+P178 -> 86 | S178: WILLIAMSTOWN
A179: HAWTHORN | C179: 3 | D179: 1 | E179: =C179*6+D179 -> 19 | G179: 5 | H179: 1 | I179: =G179*6+H179 -> 31 | K179: 7 | L179: 2 | M179: =K179*6+L179 -> 44 | O179: 9 | P179: 4 | Q179: =O179*6+P179 -> 58 | S179: LOVELL
A180: BEST PLAYERS
A181: WILLIAMSTOWN | C181: SUTTON | F181: ROBERTSON | I181: HAUGHTON | L181: TASKER | N181: STEPHENSON | Q181: DUNN
A182: HAWTHORN | C182: FEHRING | F182: McCASHNEY | I182: HENRY | L182: ROBERTS | N182: TEAGUE | Q182: HAZELL
A183: GOALKICKERS
A184: WILLIAMSTOWN | C184: STEPHENSON 3 | F184: ROBERTSON 2 | I184: BUSBRIDGE 2 | L184: TASKER 2 | N184: JAMIESON | Q184: McTAGGART
A185: HAWTHORN | C185: FEHRING 6 | F185: WILKINSON | I185: TEAGUE | K185: WALLIS
A187: NORTHCOTE | C187: 2 | D187: 4 | E187: =C187*6+D187 -> 16 | G187: 2 | H187: 7 | I187: =G187*6+H187 -> 19 | K187: 7 | L187: 12 | M187: =K187*6+L187 -> 54 | O187: 10 | P187: 14 | Q187: =O187*6+P187 -> 74 | S187: NORTHCOTE
A188: BRIGHTON | C188: 1 | D188: 0 | E188: =C188*6+D188 -> 6 | G188: 4 | H188: 1 | I188: =G188*6+H188 -> 25 | K188: 4 | L188: 1 | M188: =K188*6+L188 -> 25 | O188: 5 | P188: 3 | Q188: =O188*6+P188 -> 33 | S188: ALLEY
A189: BEST PLAYERS
A190: NORTHCOTE | C190: GREENHILL | F190: BENNETT | I190: KENNY | L190: CHESSWASS | N190: COCKRAM | Q190: MCKECKNIE
A191: BRIGHTON | C191: GREEN | F191: SODERBLOOM | I191: HARDY | L191: WELSH | N191: DANGERFIELD | Q191: BALME
A192: GOALKICKERS
A193: NORTHCOTE | C193: KENNY 3 | F193: THORPE 3 | I193: COCKRAM 2 | L193: GREENHILL | O193: O'KEEFE
A194: BRIGHTON | C194: WYATT 2 | F194: TURNBULL | I194: MCCARTHY | L194: WILSON
A196: ROUND 5 | D196: 29TH MAY | J196: WEATHER | M196: FINE & SUNNY NORTH BREEZE | S196: PLAYED AT | X196: LADDER | AB196: ROUND | AD196: 5
D197: 1ST QTR | H197: 2ND QTR | L197: 3RD QTR | P197: FINAL | S197: PORT MELB
A198: PORT MELBOURNE | C198: 3 | D198: 5 | E198: =C198*6+D198 -> 23 | G198: 5 | H198: 6 | I198: =G198*6+H198 -> 36 | K198: 9 | L198: 11 | M198: =K198*6+L198 -> 65 | O198: 10 | P198: 14 | Q198: =O198*6+P198 -> 74 | S198: UMPIRE | W198: TEAM | X198: W | Y198: L | Z198: D | AA198: FOR | AB198: AGST | AC198: % | AD198: PTS
A199: WILLIAMSTOWN | C199: 2 | D199: 1 | E199: =C199*6+D199 -> 13 | G199: 4 | H199: 5 | I199: =G199*6+H199 -> 29 | K199: 5 | L199: 10 | M199: =K199*6+L199 -> 40 | O199: 7 | P199: 14 | Q199: =O199*6+P199 -> 56 | S199: HERRON
A200: BEST PLAYERS | W200: FOOTSCRAY | X200: 5 | Y200: 0 | Z200: 0 | AA200: 369 | AB200: 282 | AC200: 130.85106382978722 | AD200: 20
A201: PORT MELBOURNE | C201: JOHNSON | F201: COY | I201: PASH | L201: O'BRIEN | N201: McDONALD | Q201: ALBRESS | W201: NORTH MELBOURNE | X201: 4 | Y201: 1 | Z201: 0 | AA201: 259 | AB201: 189 | AC201: 137.03703703703704 | AD201: 16
A202: WILLIAMSTOWN | C202: JAMIESON | F202: J McDONALD | I202: FAIRLESS | L202: MITCHELL | N202: R SMITH | Q202: CHANDLER | W202: BRUNSWICK | X202: 3 | Y202: 2 | Z202: 0 | AA202: 350 | AB202: 271 | AC202: 129.15129151291512 | AD202: 12
A203: GOALKICKERS | W203: PORT MELBOURNE | X203: 3 | Y203: 2 | Z203: 0 | AA203: 348 | AB203: 314 | AC203: 110.828025477707 | AD203: 12
A204: PORT MELBOURNE | C204: TAYLOR 3 | F204: McDONALD 2 | I204: O'BRIEN 2 | L204: RUDD | N204: WALTON | P204: BARFOOT
A205: WILLIAMSTOWN | C205: JAMIESON 2 | F205: MITCHELL 2 | I205: N McDONALD | L205: McTAGGART | O205: HAUGHTON | W205: WILLIAMSTOWN | X205: 3 | Y205: 2 | Z205: 0 | AA205: 277 | AB205: 270 | AC205: 102.5925925925926 | AD205: 12
W206: ESSENDON ASSOC. | X206: 3 | Y206: 2 | Z206: 0 | AA206: 268 | AB206: 277 | AC206: 96.750902527075809 | AD206: 12
A207: BRUNSWICK | C207: 4 | D207: 2 | E207: =C207*6+D207 -> 26 | G207: 8 | H207: 8 | I207: =G207*6+H207 -> 56 | K207: 10 | L207: 10 | M207: =K207*6+L207 -> 70 | O207: 14 | P207: 15 | Q207: =O207*6+P207 -> 99 | S207: BRUNSWICK | W207: NORTHCOTE | X207: 1 | Y207: 4 | Z207: 0 | AA207: 266 | AB207: 319 | AC207: 83.385579937304072 | AD207: 4
A208: NORTHCOTE | C208: 1 | D208: 3 | E208: =C208*6+D208 -> 9 | G208: 3 | H208: 6 | I208: =G208*6+H208 -> 24 | K208: 6 | L208: 12 | M208: =K208*6+L208 -> 48 | O208: 6 | P208: 13 | Q208: =O208*6+P208 -> 49 | S208: HURLEY | W208: PRAHRAN | X208: 1 | Y208: 4 | Z208: 0 | AA208: 257 | AB208: 311 | AC208: 82.636655948553056 | AD208: 4
A209: BEST PLAYERS | W209: BRIGHTON | X209: 1 | Y209: 4 | Z209: 0 | AA209: 243 | AB209: 298 | AC209: 81.543624161073822 | AD209: 4
A210: BRUNSWICK | C210: MATSON | F210: SULLIVAN | I210: PRICE | L210: ALESSIO | N210: SHAND | Q210: O'CONNOR | W210: HAWTHORN | X210: 1 | Y210: 4 | Z210: 0 | AA210: 283 | AB210: 389 | AC210: 72.750642673521853 | AD210: 4
A211: NORTHCOTE | C211: FERRIS | F211: O'KEEFE | I211: BENNETT | L211: THORPE | N211: POWDITCH | Q211: BALLANTYNE
A212: GOALKICKERS
A213: BRUNSWICK | C213: MATSON 5 | F213: STEPHENSON 2 | I213: SHAND 2 | K213: TRICKEY | M213: CAEL | N213: PRICE | P213: SULLIVAN | R213: ALESSIO
A214: NORTHCOTE | C214: POWDITCH 2 | F214: FERRIS | I214: KENNY | K214: THORPE | N214: O'KEEFE
A216: ESSENDON ASSOC. | C216: 1 | D216: 3 | E216: =C216*6+D216 -> 9 | G216: 3 | H216: 5 | I216: =G216*6+H216 -> 23 | K216: 5 | L216: 12 | M216: =K216*6+L216 -> 42 | O216: 9 | P216: 18 | Q216: =O216*6+P216 -> 72 | S216: BRIGHTON BEACH
A217: BRIGHTON | C217: 0 | D217: 6 | E217: =C217*6+D217 -> 6 | G217: 4 | H217: 6 | I217: =G217*6+H217 -> 30 | K217: 6 | L217: 12 | M217: =K217*6+L217 -> 48 | O217: 6 | P217: 15 | Q217: =O217*6+P217 -> 51 | S217: McKINNON
A218: BEST PLAYERS
A219: ESSENDON ASSOC. | C219: SCOBIE | F219: WATT | I219: McGRATH | L219: SWINDELLS | N219: FIELDING | Q219: EVANS
A220: BRIGHTON | C220: GREEN | F220: McCARTHY | I220: LEVER | L220: BANNISTER | N220: HATTAM
A221: GOALKICKERS
A222: ESSENDON ASSOC. | C222: SHORTEN 2 | F222: LATIMER 2 | I222: KING 2 | K222: TURNER | M222: EBBOTT | O222: FIELDING
A223: BRIGHTON | C223: McCARTHY 3 | F223: LEVER 2 | I223: COBB
A225: NORTH MELBOURNE | C225: 3 | D225: 4 | E225: =C225*6+D225 -> 22 | G225: 4 | H225: 7 | I225: =G225*6+H225 -> 31 | K225: 5 | L225: 10 | M225: =K225*6+L225 -> 40 | O225: 7 | P225: 12 | Q225: =O225*6+P225 -> 54 | S225: NORTH MELB
A226: PRAHRAN | C226: 2 | D226: 4 | E226: =C226*6+D226 -> 16 | G226: 3 | H226: 8 | I226: =G226*6+H226 -> 26 | K226: 4 | L226: 8 | M226: =K226*6+L226 -> 32 | O226: 6 | P226: 11 | Q226: =O226*6+P226 -> 47 | S226: JENKINS
A227: BEST PLAYERS
A228: NORTH MELBOURNE | C228: MILBURN | F228: IRWIN | I228: RODGERS | L228: BARKER | O228: WOODINGTON | R228: BROWN
A229: PRAHRAN | C229: TOOHEY | F229: MORONEY | I229: WEIDNER | L229: V JONES | O229: CORFIELD | R229: STRAWBRIDGE
A230: GOALKICKERS
A231: NORTH MELBOURNE | C231: NOONAN 2 | F231: LEE 2 | I231: SWALLOW | L231: BARKER | N231: IRWIN
A232: PRAHRAN | C232: WEIDNER 2 | F232: EDGAR | I232: STRAWBRIDGE | L232: CARR | N232: KENLEY
A234: FOOTSCRAY | C234: 3 | D234: 4 | E234: =C234*6+D234 -> 22 | G234: 6 | H234: 7 | I234: =G234*6+H234 -> 43 | K234: 8 | L234: 14 | M234: =K234*6+L234 -> 62 | O234: 14 | P234: 15 | Q234: =O234*6+P234 -> 99 | S234: GLENFERRIE
A235: HAWTHORN | C235: 3 | D235: 2 | E235: =C235*6+D235 -> 20 | G235: 4 | H235: 8 | I235: =G235*6+H235 -> 32 | K235: 6 | L235: 11 | M235: =K235*6+L235 -> 47 | O235: 9 | P235: 15 | Q235: =O235*6+P235 -> 69 | S235: COLLINS
A236: BEST PLAYERS
A237: FOOTSCRAY | C237: McKENZIE | F237: BANBURY | I237: J GRIERSON | L237: DAVIDSON | O237: L'ESTRANGE | R237: MUELEMAN
A238: HAWTHORN | C238: LES GIBB | F238: WILKINSON | I238: NOTT | L238: HOOD | O238: TEAGUE | R238: McCASHNEY
A239: GOALKICKERS
A240: FOOTSCRAY | C240: MAYBURY 3 | F240: CRADDOCK 2 | I240: BANBURY 2 | L240: O'DONOGHUE 2 | O240: MARTIN 2 | Q240: MUNRO | S240: SAMSON | V240: DAVIDSON
A241: HAWTHORN | C241: WEBSTER 2 | F241: WILKINSON 2 | J241: FEHRING 2 | M241: McCASHNEY | P241: EMPEY | R241: HENRY
A243: ROUND 6 | D243: 5TH JUNE | G243: WEATHER | J243: COLD S.W. WIND SHOWERS GROUNDS WATERLOGGED | S243: PLAYED AT | X243: LADDER | AB243: ROUND | AD243: 6
D244: 1ST QTR | H244: 2ND QTR | L244: 3RD QTR | P244: FINAL | S244: FOOTSCRAY
A245: FOOTSCRAY | C245: 3 | D245: 0 | E245: =C245*6+D245 -> 18 | G245: 8 | H245: 1 | I245: =G245*6+H245 -> 49 | K245: 10 | L245: 2 | M245: =K245*6+L245 -> 62 | O245: 10 | P245: 4 | Q245: =O245*6+P245 -> 64 | S245: UMPIRE | W245: TEAM | X245: W | Y245: L | Z245: D | AA245: FOR | AB245: AGST | AC245: % | AD245: PTS
A246: BRUNSWICK | C246: 1 | D246: 3 | E246: =C246*6+D246 -> 9 | G246: 3 | H246: 4 | I246: =G246*6+H246 -> 22 | K246: 4 | L246: 4 | M246: =K246*6+L246 -> 28 | O246: 5 | P246: 8 | Q246: =O246*6+P246 -> 38 | S246: KAIN
A247: BEST PLAYERS | W247: FOOTSCRAY | X247: 6 | Y247: 0 | Z247: 0 | AA247: 433 | AB247: 320 | AC247: 135.3125 | AD247: 24
A248: FOOTSCRAY | C248: MARTIN | F248: L'ESTRANGE | I248: MAYBURY | L248: BANBURY | O248: CRADDOCK | R248: HOWELL | W248: NORTH MELBOURNE | X248: 5 | Y248: 1 | Z248: 0 | AA248: 309 | AB248: 213 | AC248: 145.07042253521126 | AD248: 20
A249: BRUNSWICK | C249: ALESSIO | F249: CAHILL | I249: PRICE | L249: McINERNEY | O249: MOORE | R249: SULLIVAN | W249: PORT MELBOURNE | X249: 4 | Y249: 2 | Z249: 0 | AA249: 451 | AB249: 368 | AC249: 122.55434782608695 | AD249: 16
A250: GOALKICKERS | W250: BRUNSWICK | X250: 3 | Y250: 3 | Z250: 0 | AA250: 388 | AB250: 335 | AC250: 115.82089552238806 | AD250: 12
A251: FOOTSCRAY | C251: MAYBURY 3 | F251: MARTIN 3 | I251: SAMSON 2 | L251: EDWARDS | N251: CRADDOCK
A252: BRUNSWICK | C252: CAHILL 2 | F252: STEPHENSON | I252: MATSON | L252: ALESSIO | W252: WILLIAMSTOWN | X252: 3 | Y252: 3 | Z252: 0 | AA252: 311 | AB252: 309 | AC252: 100.64724919093851 | AD252: 12
W253: ESSENDON ASSOC. | X253: 3 | Y253: 3 | Z253: 0 | AA253: 312 | AB253: 326 | AC253: 95.705521472392633 | AD253: 12
A254: PORT MELBOURNE | C254: 2 | D254: 4 | E254: =C254*6+D254 -> 16 | G254: 9 | H254: 9 | I254: =G254*6+H254 -> 63 | K254: 13 | L254: 12 | M254: =K254*6+L254 -> 90 | O254: 15 | P254: 13 | Q254: =O254*6+P254 -> 103 | S254: PORT MELB | W254: PRAHRAN | X254: 2 | Y254: 4 | Z254: 0 | AA254: 296 | AB254: 345 | AC254: 85.79710144927536 | AD254: 8
A255: NORTHCOTE | C255: 1 | D255: 1 | E255: =C255*6+D255 -> 7 | G255: 2 | H255: 1 | I255: =G255*6+H255 -> 13 | K255: 4 | L255: 5 | M255: =K255*6+L255 -> 29 | O255: 7 | P255: 12 | Q255: =O255*6+P255 -> 54 | S255: PRITCHARD | W255: HAWTHORN | X255: 2 | Y255: 4 | Z255: 0 | AA255: 332 | AB255: 433 | AC255: 76.674364896073897 | AD255: 8
A256: BEST PLAYERS | W256: BRIGHTON | X256: 1 | Y256: 5 | Z256: 0 | AA256: 267 | AB256: 348 | AC256: 76.724137931034477 | AD256: 4
A257: PORT MELBOURNE | C257: McDONALD | F257: T O'BRIEN | I257: J O'BRIEN | L257: WALTON | O257: TAYLOR | Q257: PASH | W257: NORTHCOTE | X257: 1 | Y257: 5 | Z257: 0 | AA257: 320 | AB257: 422 | AC257: 75.829383886255926 | AD257: 4
A258: NORTHCOTE | C258: H SMITH | F258: BUISST | I258: COCKRAM | L258: YATES | O258: KENNY | Q258: COOMBS
A259: GOALKICKERS
A260: PORT MELBOURNE | C260: TAYLOR 6 | F260: BEESON 3 | I260: WALTON 3 | L260: DUNN | N260: RUDD | P260: McDONALD
A261: NORTHCOTE | C261: THORPE 3 | F261: O'KEEFE 2 | I261: SMITH | K261: GREENHILL
A263: PRAHRAN | C263: 2 | D263: 2 | E263: =C263*6+D263 -> 14 | G263: 2 | H263: 8 | I263: =G263*6+H263 -> 20 | K263: 3 | L263: 18 | M263: =K263*6+L263 -> 36 | O263: 3 | P263: 21 | Q263: =O263*6+P263 -> 39 | S263: TOORAK PARK
A264: WILLIAMSTOWN | C264: 1 | D264: 3 | E264: =C264*6+D264 -> 9 | G264: 3 | H264: 5 | I264: =G264*6+H264 -> 23 | K264: 3 | L264: 7 | M264: =K264*6+L264 -> 25 | O264: 4 | P264: 10 | Q264: =O264*6+P264 -> 34 | S264: McKINNON
A265: BEST PLAYERS
A266: PRAHRAN | C266: V JONES | F266: MORONEY | I266: STRAWBRIDGE | L266: CORFIELD | N266: TOOHEY | Q266: WIDDICOMBE
A267: WILLIAMSTOWN | C267: MITCHELL | F267: McNABB | I267: R SMITH | L267: HAUGHTON | N267: WOODFIELD | Q267: JAMIESON
A268: GOALKICKERS
A269: PRAHRAN | C269: V JONES | F269: MORONEY | I269: MOORE
A270: WILLIAMSTOWN | C270: MITCHELL 2 | F270: SPICER | I270: HAUGHTON
A272: HAWTHORN | C272: 1 | D272: 1 | E272: =C272*6+D272 -> 7 | G272: 1 | H272: 2 | I272: =G272*6+H272 -> 8 | K272: 4 | L272: 4 | M272: =K272*6+L272 -> 28 | O272: 7 | P272: 7 | Q272: =O272*6+P272 -> 49 | S272: ESSENDON
A273: ESSENDON ASSOC. | C273: 1 | D273: 3 | E273: =C273*6+D273 -> 9 | G273: 3 | H273: 9 | I273: =G273*6+H273 -> 27 | K273: 4 | L273: 10 | M273: =K273*6+L273 -> 34 | O273: 5 | P273: 14 | Q273: =O273*6+P273 -> 44 | S273: COLLINS
A274: BEST PLAYERS
A275: HAWTHORN | C275: FEHRING | F275: TEAGUE | I275: NOTT | L275: LES GIBBS | O275: DAVEY | Q275: PARKINSON
A276: ESSENDON ASSOC. | C276: R WATT | F276: RUSSELL | I276: SCOBIE | L276: RAISBECK | O276: KING | Q276: GOULDING
A277: GOALKICKERS
A278: HAWTHORN | C278: FEHRING 3 | F278: DAVEY | I278: EMPEY | K278: WILSON | N278: WEBSTER
A279: ESSENDON ASSOC. | C279: SHORTEN 2 | F279: GOULDING | I279: KING | K279: SCOBIE
A281: NORTH MELBOURNE | C281: 3 | D281: 1 | E281: =C281*6+D281 -> 19 | G281: 6 | H281: 5 | I281: =G281*6+H281 -> 41 | K281: 7 | L281: 5 | M281: =K281*6+L281 -> 47 | O281: 7 | P281: 8 | Q281: =O281*6+P281 -> 50 | S281: NORTH MELB
A282: BRIGHTON | C282: 2 | D282: 5 | E282: =C282*6+D282 -> 17 | G282: 2 | H282: 5 | I282: =G282*6+H282 -> 17 | K282: 2 | L282: 6 | M282: =K282*6+L282 -> 18 | O282: 2 | P282: 12 | Q282: =O282*6+P282 -> 24 | S282: HURLEY
A283: BEST PLAYERS
A284: NORTH MELBOURNE | C284: SWALLOW | F284: RAWLE | I284: MILBURN | L284: WOODINGTON | O284: BARKER | Q284: McKENZIE
A285: BRIGHTON | C285: McCARTHY | F285: SODERBLOOM | I285: GREEN | L285: BANNISTER | O285: BALME
A286: GOALKICKERS
A287: NORTH MELBOURNE | C287: SWALLOW 5 | F287: IRWIN | I287: McINTOSH
A288: BRIGHTON | C288: BAYLISS | F288: GREEN
A290: ROUND 7 | D290: 12TH JUNE | J290: WEATHER | M290: FINE | S290: PLAYED AT | X290: LADDER | AB290: ROUND | AD290: 7
D291: 1ST QTR | H291: 2ND QTR | L291: 3RD QTR | P291: FINAL | S291: BRUNSWICK
A292: BRUNSWICK | C292: 2 | D292: 3 | E292: =C292*6+D292 -> 15 | G292: 4 | H292: 6 | I292: =G292*6+H292 -> 30 | K292: 4 | L292: 11 | M292: =K292*6+L292 -> 35 | O292: 7 | P292: 14 | Q292: =O292*6+P292 -> 56 | S292: UMPIRE | W292: TEAM | X292: W | Y292: L | Z292: D | AA292: FOR | AB292: AGST | AC292: % | AD292: PTS
A293: NORTH MELBOURNE | C293: 0 | D293: 2 | E293: =C293*6+D293 -> 2 | G293: 2 | H293: 4 | I293: =G293*6+H293 -> 16 | K293: 4 | L293: 8 | M293: =K293*6+L293 -> 32 | O293: 7 | P293: 10 | Q293: =O293*6+P293 -> 52
A294: BEST PLAYERS | W294: FOOTSCRAY | X294: 7 | Y294: 0 | Z294: 0 | AA294: 562 | AB294: 399 | AC294: 140.85213032581453 | AD294: 28
A295: BRUNSWICK | C295: HASSETT | G295: FAUST | I295: McINTOSH | L295: MAY | N295: MOORE | Q295: PRICE | W295: NORTH MELBOURNE | X295: 5 | Y295: 2 | Z295: 0 | AA295: 361 | AB295: 269 | AC295: 134.20074349442379 | AD295: 20
A296: NORTH MELBOURNE | C296: WOODINGTON | G296: BROWN | I296: MILBURN | L296: SHEEHAN | N296: IRWIN | Q296: HARDY | W296: PORT MELBOURNE | X296: 5 | Y296: 2 | Z296: 0 | AA296: 529 | AB296: 413 | AC296: 128.08716707021793 | AD296: 20
A297: GOALKICKERS | W297: BRUNSWICK | X297: 4 | Y297: 3 | Z297: 0 | AA297: 444 | AB297: 387 | AC297: 114.72868217054264 | AD297: 16
A298: BRUNSWICK | C298: CHRISTIE 2 | F298: CAHILL | I298: MCLEAN | K298: STEPHENSON | N298: GOONAN | Q298: SULLIVAN
A299: NORTH MELBOURNE | C299: BARKER 2 | F299: HARDY | I299: McINTOSH | K299: SWALLOW | N299: IRWIN | Q299: FURLONGER | W299: WILLIAMSTOWN | X299: 4 | Y299: 3 | Z299: 0 | AA299: 385 | AB299: 368 | AC299: 104.6195652173913 | AD299: 16
W300: ESSENDON ASSOC. | X300: 3 | Y300: 4 | Z300: 0 | AA300: 371 | AB300: 400 | AC300: 92.75 | AD300: 12
A301: WILLIAMSTOWN | C301: 3 | D301: 6 | E301: =C301*6+D301 -> 24 | G301: 5 | H301: 7 | I301: =G301*6+H301 -> 37 | K301: 9 | L301: 12 | M301: =K301*6+L301 -> 66 | O301: 10 | P301: 14 | Q301: =O301*6+P301 -> 74 | S301: WILLIAMSTOWN | W301: PRAHRAN | X301: 2 | Y301: 5 | Z301: 0 | AA301: 338 | AB301: 392 | AC301: 86.224489795918373 | AD301: 8
A302: ESSENDON ASSOC. | C302: 1 | D302: 1 | E302: =C302*6+D302 -> 7 | G302: 5 | H302: 6 | I302: =G302*6+H302 -> 36 | K302: 5 | L302: 7 | M302: =K302*6+L302 -> 37 | O302: 8 | P302: 11 | Q302: =O302*6+P302 -> 59 | W302: NORTHCOTE | X302: 2 | Y302: 5 | Z302: 0 | AA302: 367 | AB302: 464 | AC302: 79.09482758620689 | AD302: 8
A303: BEST PLAYERS | W303: HAWTHORN | X303: 2 | Y303: 5 | Z303: 0 | AA303: 377 | AB303: 511 | AC303: 73.776908023483372 | AD303: 8
A304: WILLIAMSTOWN | C304: PUNSHON | F304: FAIRLESS | I304: SUTTON | L304: L SMITH | O304: McLEAN | Q304: J McDONALD | W304: BRIGHTON | X304: 1 | Y304: 6 | Z304: 0 | AA304: 346 | AB304: 477 | AC304: 72.536687631027249 | AD304: 4
A305: ESSENDON ASSOC. | C305: KING | F305: SCOBIE | I305: WATT | L305: GOULDING | O305: WALSH | Q305: TURNER
A306: GOALKICKERS
A307: WILLIAMSTOWN | C307: PUNSHON 3 | F307: SPICER 2 | I307: SUTTON | K307: L SMITH | M307: WOODFIELD | P307: E McDONALD | S307: TASKER
A308: ESSENDON ASSOC. | C308: WALSH 3 | F308: GOULDING 2 | I308: TURNER 2 | L308: GRAHAM
A310: PORT MELBOURNE | C310: 4 | D310: 4 | E310: =C310*6+D310 -> 28 | G310: 6 | H310: 6 | I310: =G310*6+H310 -> 42 | K310: 7 | L310: 7 | M310: =K310*6+L310 -> 49 | O310: 11 | P310: 12 | Q310: =O310*6+P310 -> 78 | S310: PORT MELB
A311: HAWTHORN | C311: 3 | D311: 2 | E311: =C311*6+D311 -> 20 | G311: 5 | H311: 6 | I311: =G311*6+H311 -> 36 | K311: 6 | L311: 7 | M311: =K311*6+L311 -> 43 | O311: 6 | P311: 9 | Q311: =O311*6+P311 -> 45
A312: BEST PLAYERS
A313: PORT MELBOURNE | C313: WALTON | F313: J O'BRIEN | I313: T O'BRIEN | L313: BEESON | O313: HAIR | Q313: McDONALD
A314: HAWTHORN | C314: HENRY | F314: WALLIS | I314: L GIBB | L314: WILKINSON | O314: NOTT | Q314: FEHRING
A315: GOALKICKERS
A316: PORT MELBOURNE | C316: WALTON 3 | F316: BEESON 2 | I316: J O'BRIEN | K316: HAIR | M316: BRISCOE | O316: RUDD | Q316: TAYLOR | S316: PASH
A317: HAWTHORN | C317: FEHRING 3 | F317: EMPEY | I317: McMAHON | L317: DOOLEY
A319: NORTHCOTE | C319: 1 | D319: 3 | E319: =C319*6+D319 -> 9 | G319: 4 | H319: 6 | I319: =G319*6+H319 -> 30 | K319: 5 | L319: 9 | M319: =K319*6+L319 -> 39 | O319: 6 | P319: 11 | Q319: =O319*6+P319 -> 47 | S319: NORTHCOTE
A320: PRAHRAN | C320: 2 | D320: 1 | E320: =C320*6+D320 -> 13 | G320: 2 | H320: 5 | I320: =G320*6+H320 -> 17 | K320: 3 | L320: 10 | M320: =K320*6+L320 -> 28 | O320: 5 | P320: 12 | Q320: =O320*6+P320 -> 42
A321: BEST PLAYERS
A322: NORTHCOTE | C322: McKENZIE | F322: POWDITCH | I322: O'KEEFE | L322: KENNY | O322: MOORE | Q322: H SMITH
A323: PRAHRAN | C323: V JONES | F323: FRAWLEY | I323: CORFIELD | L323: KENLEY | O323: LAWRENCE | Q323: TOOHEY
A324: GOALKICKERS
A325: NORTHCOTE | C325: POWDITCH 4 | F325: THORPE | I325: KENNY
A326: PRAHRAN | C326: WOODS 2 | F326: MOORE 2 | I326: KENLEY
A328: FOOTSCRAY | C328: 7 | D328: 4 | E328: =C328*6+D328 -> 46 | G328: 11 | H328: 6 | I328: =G328*6+H328 -> 72 | K328: 17 | L328: 10 | M328: =K328*6+L328 -> 112 | O328: 19 | P328: 15 | Q328: =O328*6+P328 -> 129 | S328: BRIGHTON BEACH
A329: BRIGHTON | C329: 2 | D329: 1 | E329: =C329*6+D329 -> 13 | G329: 3 | H329: 4 | I329: =G329*6+H329 -> 22 | K329: 5 | L329: 5 | M329: =K329*6+L329 -> 35 | O329: 12 | P329: 7 | Q329: =O329*6+P329 -> 79
A330: BEST PLAYERS
A331: FOOTSCRAY | C331: O'DONOGHUE | F331: MARTON | I331: McKENZIE | L331: MAYBURY | O331: EDWARDS | R331: MULEMAN
A332: BRIGHTON | C332: CULLEN | F332: BALME | I332: McCARTHY | L332: M BAYLISS | O332: HATTAM | R332: TURNBULL
A333: GOALKICKERS
A334: FOOTSCRAY | C334: BULPIT 3 | E334: MAYBURY 3 | H334: CRADDOCK 3 | K334: HOWELL 3 | M334: McKENZIE 2 | P334: MARTIN 2 | R334: HOLDEN | U334: BANBURY | X334: PORTER
A335: BRIGHTON | C335: CULLEN 4 | F335: M BAYLISS 3 | I335: DANGERFIELD 2 | L335: TURNBULL | N335: WALSH | P335: ACKERS
A337: ROUND 8 | D337: 19TH JUNE | J337: WEATHER | M337: FINE GROUNDS WET & SLIPPERY | S337: PLAYED AT | X337: LADDER | AB337: ROUND | AD337: 8
D338: 1ST QTR | H338: 2ND QTR | L338: 3RD QTR | P338: FINAL | S338: BRUNSWICK
A339: BRUNSWICK | C339: 2 | D339: 5 | E339: =C339*6+D339 -> 17 | G339: 4 | H339: 12 | I339: =G339*6+H339 -> 36 | K339: 10 | L339: 15 | M339: =K339*6+L339 -> 75 | O339: 11 | P339: 16 | Q339: =O339*6+P339 -> 82 | S339: UMPIRE | W339: TEAM | X339: W | Y339: L | Z339: D | AA339: FOR | AB339: AGST | AC339: % | AD339: PTS
A340: WILLIAMSTOWN | C340: 2 | D340: 4 | E340: =C340*6+D340 -> 16 | G340: 4 | H340: 8 | I340: =G340*6+H340 -> 32 | K340: 4 | L340: 11 | M340: =K340*6+L340 -> 35 | O340: 6 | P340: 12 | Q340: =O340*6+P340 -> 48 | S340: COLLINS
A341: BEST PLAYERS | W341: FOOTSCRAY | X341: 8 | Y341: 0 | Z341: 0 | AA341: 665 | AB341: 439 | AC341: 151.48063781321184 | AD341: 32
A342: BRUNSWICK | C342: MOORE | F342: GOONAN | I342: PRICE | K342: SULLIVAN | N342: CAHILL | Q342: McQUEEN | W342: NORTH MELBOURNE | X342: 6 | Y342: 2 | Z342: 0 | AA342: 416 | AB342: 309 | AC342: 134.62783171521036 | AD342: 24
A343: WILLIAMSTOWN | C343: SUTTON | F343: MITCHELL | I343: BROWN | K343: HARDEN | N343: WOODFIELD | Q343: J McDONALD | W343: PORT MELBOURNE | X343: 6 | Y343: 2 | Z343: 0 | AA343: 599 | AB343: 461 | AC343: 129.93492407809111 | AD343: 24
A344: GOALKICKERS | W344: BRUNSWICK | X344: 5 | Y344: 3 | Z344: 0 | AA344: 526 | AB344: 435 | AC344: 120.91954022988506 | AD344: 20
A345: BRUNSWICK | C345: MOORE 3 | F345: McQUEEN 3 | I345: SULLIVAN | K345: MATSON | M345: PRICE | O345: MAY | Q345: CHRISTIE
A346: WILLIAMSTOWN | C346: HARDEN | F346: MITCHELL | I346: SUTTON | K346: WOODFIELD | N346: TASKER | P346: FAIRLESS | W346: WILLIAMSTOWN | X346: 4 | Y346: 4 | Z346: 0 | AA346: 433 | AB346: 450 | AC346: 96.222222222222229 | AD346: 16
W347: ESSENDON ASSOC. | X347: 3 | Y347: 5 | Z347: 0 | AA347: 411 | AB347: 503 | AC347: 81.709741550695824 | AD347: 12
A348: FOOTSCRAY | C348: 4 | D348: 1 | E348: =C348*6+D348 -> 25 | G348: 6 | H348: 3 | I348: =G348*6+H348 -> 39 | K348: 11 | L348: 3 | M348: =K348*6+L348 -> 69 | O348: 16 | P348: 7 | Q348: =O348*6+P348 -> 103 | S348: FOOTSCRAY | W348: HAWTHORN | X348: 3 | Y348: 5 | Z348: 0 | AA348: 444 | AB348: 554 | AC348: 80.144404332129966 | AD348: 12
A349: ESSENDON ASSOC. | C349: 1 | D349: 2 | E349: =C349*6+D349 -> 8 | G349: 4 | H349: 4 | I349: =G349*6+H349 -> 28 | K349: 4 | L349: 5 | M349: =K349*6+L349 -> 29 | O349: 5 | P349: 10 | Q349: =O349*6+P349 -> 40 | S349: QUINN | W349: PRAHRAN | X349: 2 | Y349: 6 | Z349: 0 | AA349: 386 | AB349: 462 | AC349: 83.549783549783555 | AD349: 8
A350: BEST PLAYERS | W350: NORTHCOTE | X350: 2 | Y350: 6 | Z350: 0 | AA350: 407 | AB350: 519 | AC350: 78.420038535645475 | AD350: 8
A351: FOOTSCRAY | C351: BANBURY | F351: McKENZIE | I351: HOWELL | K351: MAYBURY | N351: O'DONOGHUE | Q351: MARTIN | W351: BRIGHTON | X351: 1 | Y351: 7 | Z351: 0 | AA351: 389 | AB351: 544 | AC351: 71.507352941176464 | AD351: 4
A352: ESSENDON ASSOC. | C352: SCOBIE | F352: WATT | I352: SWIFT | K352: KING | N352: GOULDING | Q352: GILES
A353: GOALKICKERS
A354: FOOTSCRAY | C354: MAYBURY 4 | F354: CRADDOCK 3 | I354: HOWELL 2 | L354: McKENZIE 2 | O354: MARTIN 2 | Q354: O'DONOGHUE 2 | U354: J GRIERSON
A355: ESSENDON ASSOC. | C355: WALSH 2 | F355: KING | I355: SHORTEN | L355: McAULEY
A357: PORT MELBOURNE | C357: 2 | D357: 3 | E357: =C357*6+D357 -> 15 | G357: 6 | H357: 4 | I357: =G357*6+H357 -> 40 | K357: 9 | L357: 5 | M357: =K357*6+L357 -> 59 | O357: 10 | P357: 10 | Q357: =O357*6+P357 -> 70 | S357: TOORAK PARK
A358: PRAHRAN | C358: 0 | D358: 4 | E358: =C358*6+D358 -> 4 | G358: 3 | H358: 7 | I358: =G358*6+H358 -> 25 | K358: 6 | L358: 8 | M358: =K358*6+L358 -> 44 | O358: 6 | P358: 12 | Q358: =O358*6+P358 -> 48 | S358: HURLEY
A359: BEST PLAYERS
A360: PORT MELBOURNE | C360: COY | F360: STANFORD | I360: ALBRESS | L360: WALTON | O360: RUDD | Q360: McDONALD
A361: PRAHRAN | C361: ALLISTER | F361: STRAWBRIDGE | I361: MORONEY | L361: BRENNAN | O361: BAYLISS | Q361: KENLEY
A362: GOALKICKERS
A363: PORT MELBOURNE | C363: WALTON 2 | F363: McDONALD 2 | I363: TAYLOR 2 | L363: DWYER | N363: RUDD | P363: HAIR | Q363: BEESON
A364: PRAHRAN | C364: KENLEY 2 | F364: MOORE | I364: MORONEY | K364: ALLISTER | N364: CARR
A366: HAWTHORN | C366: 2 | D366: 5 | E366: =C366*6+D366 -> 17 | G366: 6 | H366: 5 | I366: =G366*6+H366 -> 41 | K366: 7 | L366: 9 | M366: =K366*6+L366 -> 51 | O366: 9 | P366: 13 | Q366: =O366*6+P366 -> 67 | S366: HAW
A367: BRIGHTON | C367: 2 | D367: 2 | E367: =C367*6+D367 -> 14 | G367: 3 | H367: 4 | I367: =G367*6+H367 -> 22 | K367: 3 | L367: 6 | M367: =K367*6+L367 -> 24 | O367: 6 | P367: 7 | Q367: =O367*6+P367 -> 43 | S367: McKINNON
A368: BEST PLAYERS
A369: HAWTHORN | C369: WILKINSON | F369: EMPEY | I369: HANSON | L369: GIBB | N369: FEWSTER | Q369: ROBERTS
A370: BRIGHTON | C370: McCARTHY | F370: TURNBULL | I370: BALME | L370: HATTAM | N370: TOMBLIN | Q370: CULLEN
A371: GOALKICKERS
A372: HAWTHORN | C372: WILKINSON 3 | F372: EMPEY 3 | I372: FEHRING 2 | L372: HENRY
A373: BRIGHTON | C373: McCARTHY 3 | G373: CULLEN 2 | J373: TURNBULL
A375: NORTH MELBOURNE | C375: 2 | D375: 2 | E375: =C375*6+D375 -> 14 | G375: 4 | H375: 4 | I375: =G375*6+H375 -> 28 | K375: 6 | L375: 6 | M375: =K375*6+L375 -> 42 | O375: 8 | P375: 7 | Q375: =O375*6+P375 -> 55 | S375: NORTH MELB
A376: NORTHCOTE | C376: 1 | D376: 3 | E376: =C376*6+D376 -> 9 | G376: 3 | H376: 7 | I376: =G376*6+H376 -> 25 | K376: 4 | L376: 8 | M376: =K376*6+L376 -> 32 | O376: 5 | P376: 10 | Q376: =O376*6+P376 -> 40 | S376: LOVELL
A377: BEST PLAYERS
A378: NORTH MELBOURNE | C378: BROWN | F378: HARDY | I378: IRWIN | L378: SHEEHAN | N378: RAWLE | Q378: MILES
A379: NORTHCOTE | C379: BENNETT | F379: H SMITH | I379: POWDITCH | L379: BUISST | N379: McKECKNIE | Q379: KEAVER
A380: GOALKICKERS
A381: NORTH MELBOURNE | C381: HARDY 2 | F381: RODGERS 2 | I381: BELL | K381: BROWN | M381: DOHERTY | P381: WEATHERALL
A382: NORTHCOTE | C382: THORPE 3 | F382: POWDITCH | I382: MILLS
A384: ROUND 9 | D384: 26TH JUNE | J384: WEATHER | M384: NORTH WIND | S384: PLAYED AT | X384: LADDER | AB384: ROUND | AD384: 9
D385: 1ST QTR | H385: 2ND QTR | L385: 3RD QTR | P385: FINAL | S385: WILLIAMSTOWN
A386: NORTH MELBOURNE | C386: 2 | D386: 4 | E386: =C386*6+D386 -> 16 | G386: 3 | H386: 8 | I386: =G386*6+H386 -> 26 | K386: 5 | L386: 11 | M386: =K386*6+L386 -> 41 | O386: 7 | P386: 13 | Q386: =O386*6+P386 -> 55 | S386: UMPIRE | W386: TEAM | X386: W | Y386: L | Z386: D | AA386: FOR | AB386: AGST | AC386: % | AD386: PTS
A387: WILLIAMSTOWN | C387: 2 | D387: 2 | E387: =C387*6+D387 -> 14 | G387: 3 | H387: 2 | I387: =G387*6+H387 -> 20 | K387: 3 | L387: 9 | M387: =K387*6+L387 -> 27 | O387: 5 | P387: 10 | Q387: =O387*6+P387 -> 40 | S387: McKINNON
A388: BEST PLAYERS | W388: FOOTSCRAY | X388: 8 | Y388: 1 | Z388: 0 | AA388: 709 | AB388: 484 | AC388: 146.48760330578511 | AD388: 32
A389: NORTH MELBOURNE | C389: BARKER | F389: HARDY | I389: RAWLE | K389: GREENHILL | N389: WEATHERALL | Q389: WOODINGTON | W389: NORTH MELBOURNE | X389: 7 | Y389: 2 | Z389: 0 | AA389: 471 | AB389: 349 | AC389: 134.95702005730658 | AD389: 28
A390: WILLIAMSTOWN | C390: HAUGHTON | F390: McDONALD | I390: SUTTON | K390: FAIRLESS | N390: HARDEN | W390: PORT MELBOURNE | X390: 7 | Y390: 2 | Z390: 0 | AA390: 695 | AB390: 516 | AC390: 134.68992248062017 | AD390: 28
A391: GOALKICKERS | W391: BRUNSWICK | X391: 6 | Y391: 3 | Z391: 0 | AA391: 599 | AB391: 480 | AC391: 124.79166666666667 | AD391: 24
A392: NORTH MELBOURNE | C392: WEATHERALL 4 | G392: BARKER | J392: BROWN | M392: FURLONGER
A393: WILLIAMSTOWN | C393: HAUGHTON | F393: PUNSHON | I393: HARDEN | L393: FAIRLESS | O393: SUTTON | W393: WILLIAMSTOWN | X393: 4 | Y393: 5 | Z393: 0 | AA393: 473 | AB393: 505 | AC393: 93.663366336633658 | AD393: 16
W394: PRAHRAN | X394: 3 | Y394: 6 | Z394: 0 | AA394: 452 | AB394: 515 | AC394: 87.766990291262132 | AD394: 12
A395: BRUNSWICK | C395: 3 | D395: 3 | E395: =C395*6+D395 -> 21 | G395: 7 | H395: 6 | I395: =G395*6+H395 -> 48 | K395: 9 | L395: 9 | M395: =K395*6+L395 -> 63 | O395: 10 | P395: 13 | Q395: =O395*6+P395 -> 73 | S395: BRUNSWICK | W395: ESSENDON ASSOC. | X395: 3 | Y395: 6 | Z395: 0 | AA395: 464 | AB395: 569 | AC395: 81.546572934973639 | AD395: 12
A396: HAWTHORN | C396: 0 | D396: 2 | E396: =C396*6+D396 -> 2 | G396: 2 | H396: 5 | I396: =G396*6+H396 -> 17 | K396: 4 | L396: 8 | M396: =K396*6+L396 -> 32 | O396: 6 | P396: 9 | Q396: =O396*6+P396 -> 45 | S396: HURLEY | W396: NORTHCOTE | X396: 3 | Y396: 6 | Z396: 0 | AA396: 452 | AB396: 563 | AC396: 80.284191829484897 | AD396: 12
A397: BEST PLAYERS | W397: HAWTHORN | X397: 3 | Y397: 6 | Z397: 0 | AA397: 489 | AB397: 627 | AC397: 77.990430622009569 | AD397: 12
A398: BRUNSWICK | C398: CHRISTIE | F398: ALESSIO | I398: SHAND | K398: McINERNEY | N398: CAHILL | Q398: MATSON | W398: BRIGHTON | X398: 1 | Y398: 8 | Z398: 0 | AA398: 444 | AB398: 640 | AC398: 69.375 | AD398: 4
A399: HAWTHORN | C399: L GIBB | F399: WALLIS | I399: ROBERTS | K399: HENRY | N399: NOTT | Q399: REEVES
A400: GOALKICKERS
A401: BRUNSWICK | C401: CHRISTIE 8 | G401: MAY | I401: MATSON
A402: HAWTHORN | C402: FEHRING 3 | F402: WEBSTER | I402: EMPEY | L402: WILSON
A404: PRAHRAN | C404: 4 | D404: 3 | E404: =C404*6+D404 -> 27 | G404: 5 | H404: 6 | I404: =G404*6+H404 -> 36 | K404: 7 | L404: 7 | M404: =K404*6+L404 -> 49 | O404: 9 | P404: 12 | Q404: =O404*6+P404 -> 66 | S404: ESSENDON
A405: ESSENDON ASSOC. | C405: 0 | D405: 5 | E405: =C405*6+D405 -> 5 | G405: 3 | H405: 7 | I405: =G405*6+H405 -> 25 | K405: 4 | L405: 13 | M405: =K405*6+L405 -> 37 | O405: 6 | P405: 17 | Q405: =O405*6+P405 -> 53 | S405: LOVELL
A406: BEST PLAYERS
A407: PRAHRAN | C407: STRAWBRIDGE | G407: CARR | I407: ALLISTER | L407: WEIDNER | O407: MORONEY | R407: MOORE
A408: ESSENDON ASSOC. | C408: WATT | G408: TURNER | I408: RAISBECK | L408: McDONALD | O408: FIELDING | R408: KING
A409: GOALKICKERS
A410: PRAHRAN | C410: MOORE 3 | F410: WEIDNER 2 | I410: CONDON | K410: TOOHEY | M410: V JONES | P410: BAYLISS
A411: ESSENDON ASSOC. | C411: FIELDING | F411: TURNER | I411: KING | K411: BOLAND | M411: WALSH | O411: SHORTEN
A413: PORT MELBOURNE | C413: 7 | D413: 6 | E413: =C413*6+D413 -> 48 | G413: 7 | H413: 9 | I413: =G413*6+H413 -> 51 | K413: 11 | L413: 13 | M413: =K413*6+L413 -> 79 | O413: 13 | P413: 18 | Q413: =O413*6+P413 -> 96 | S413: BRIGHTON BEACH
A414: BRIGHTON | C414: 0 | D414: 0 | E414: =C414*6+D414 -> 0 | G414: 4 | H414: 3 | I414: =G414*6+H414 -> 27 | K414: 5 | L414: 4 | M414: =K414*6+L414 -> 34 | O414: 8 | P414: 7 | Q414: =O414*6+P414 -> 55 | S414: QUINN
A415: BEST PLAYERS
A416: PORT MELBOURNE | C416: WALTON | F416: COY | I416: J O'BRIEN | L416: ASHTON | O416: MILLER | R416: STANFORD
A417: BRIGHTON | C417: BALME | F417: DANGERFIELD | I417: TURNBULL | L417: TOMBLIN | O417: SODERBLOOM | R417: SINCLAIR
A418: GOALKICKERS
A419: PORT MELBOURNE | C419: McDONALD 3 | F419: WALTON 3 | I419: DWYER 2 | L419: COY | M419: BARFOOT | O419: TAYLOR | Q419: DUNN | S419: MILLER
A420: BRIGHTON | C420: COBB 2 | F420: McCARTHY 2 | I420: SODERBLOOM | L420: DANGERFIELD | O420: DUNCAN | Q420: CULLEN
A422: NORTHCOTE | C422: 2 | D422: 0 | E422: =C422*6+D422 -> 12 | G422: 4 | H422: 2 | I422: =G422*6+H422 -> 26 | K422: 6 | L422: 9 | M422: =K422*6+L422 -> 45 | O422: 6 | P422: 9 | Q422: =O422*6+P422 -> 45 | S422: NORTHCOTE
A423: FOOTSCRAY | C423: 1 | D423: 5 | E423: =C423*6+D423 -> 11 | G423: 3 | H423: 7 | I423: =G423*6+H423 -> 25 | K423: 3 | L423: 7 | M423: =K423*6+L423 -> 25 | O423: 5 | P423: 14 | Q423: =O423*6+P423 -> 44 | S423: JENKINS
A424: BEST PLAYERS
A425: NORTHCOTE | C425: H SMITH | F425: THORPE | I425: O'KEEFE | L425: FERRIS | O425: MILLS | R425: BENNETT
A426: FOOTSCRAY | C426: O'DONOGHUE | F426: SAMSON | I426: MUELEMAN | L426: J GRIERSON | O426: PORTER | R426: MARTIN
A427: GOALKICKERS
A428: NORTHCOTE | C428: THORPE 4 | F428: MILLS | I428: GRIFFITHS
A429: FOOTSCRAY | C429: PORTER 2 | F429: MAYBURY | I429: SAMSON | L429: CRADDOCK
A431: ROUND 10 | D431: 3RD JULY | J431: WEATHER | M431: FINE NORTH WIND | S431: PLAYED AT | X431: LADDER | AB431: ROUND | AD431: 10
D432: 1ST QTR | H432: 2ND QTR | L432: 3RD QTR | P432: FINAL | S432: NORTH MELB
A433: NORTH MELBOURNE | C433: 1 | D433: 3 | E433: =C433*6+D433 -> 9 | G433: 2 | H433: 5 | I433: =G433*6+H433 -> 17 | K433: 3 | L433: 6 | M433: =K433*6+L433 -> 24 | O433: 5 | P433: 11 | Q433: =O433*6+P433 -> 41 | S433: UMPIRE | W433: TEAM | X433: W | Y433: L | Z433: D | AA433: FOR | AB433: AGST | AC433: % | AD433: PTS
A434: PORT MELBOURNE | C434: 0 | D434: 3 | E434: =C434*6+D434 -> 3 | G434: 1 | H434: 3 | I434: =G434*6+H434 -> 9 | K434: 2 | L434: 9 | M434: =K434*6+L434 -> 21 | O434: 4 | P434: 10 | Q434: =O434*6+P434 -> 34 | S434: McKINNON
A435: BEST PLAYERS | W435: FOOTSCRAY | X435: 9 | Y435: 1 | Z435: 0 | AA435: 788 | AB435: 543 | AC435: 145.11970534069982 | AD435: 36
A436: NORTH MELBOURNE | C436: BARKER | F436: HARDY | I436: MILBURN | L436: NANCARROW | O436: MILES | Q436: WOODINGTON | W436: NORTH MELBOURNE | X436: 8 | Y436: 2 | Z436: 0 | AA436: 512 | AB436: 383 | AC436: 133.68146214099218 | AD436: 32
A437: PORT MELBOURNE | C437: STANFORD | F437: TREMBATH | I437: BARFOOT | L437: ASHTON | O437: COY | Q437: BRISCOE | W437: PORT MELBOURNE | X437: 7 | Y437: 3 | Z437: 0 | AA437: 729 | AB437: 557 | AC437: 130.87971274685816 | AD437: 28
A438: GOALKICKERS | W438: BRUNSWICK | X438: 6 | Y438: 4 | Z438: 0 | AA438: 646 | AB438: 529 | AC438: 122.117202268431 | AD438: 24
A439: NORTH MELBOURNE | C439: BARKER 2 | F439: HARDY | I439: MILBURN | L439: SHEEHAN
A440: PORT MELBOURNE | C440: McDONALD 2 | G440: BEESON | J440: J O'BRIEN | W440: WILLIAMSTOWN | X440: 5 | Y440: 5 | Z440: 0 | AA440: 554 | AB440: 554 | AC440: 100 | AD440: 20
W441: NORTHCOTE | X441: 4 | Y441: 6 | Z441: 0 | AA441: 590 | AB441: 612 | AC441: 96.40522875816994 | AD441: 16
A442: ESSENDON ASSOC. | C442: 5 | D442: 3 | E442: =C442*6+D442 -> 33 | G442: 6 | H442: 3 | I442: =G442*6+H442 -> 39 | K442: 7 | L442: 6 | M442: =K442*6+L442 -> 48 | O442: 7 | P442: 7 | Q442: =O442*6+P442 -> 49 | S442: BRUNSWICK | W442: ESSENDON ASSOC. | X442: 4 | Y442: 6 | Z442: 0 | AA442: 513 | AB442: 616 | AC442: 83.279220779220779 | AD442: 16
A443: BRUNSWICK | C443: 2 | D443: 0 | E443: =C443*6+D443 -> 12 | G443: 5 | H443: 4 | I443: =G443*6+H443 -> 34 | K443: 5 | L443: 5 | M443: =K443*6+L443 -> 35 | O443: 6 | P443: 11 | Q443: =O443*6+P443 -> 47 | S443: LOVELL | W443: PRAHRAN | X443: 3 | Y443: 7 | Z443: 0 | AA443: 511 | AB443: 594 | AC443: 86.026936026936028 | AD443: 12
A444: BEST PLAYERS | W444: HAWTHORN | X444: 3 | Y444: 7 | Z444: 0 | AA444: 538 | AB444: 765 | AC444: 70.326797385620921 | AD444: 12
A445: ESSENDON ASSOC. | C445: STROWNIX | F445: SCOBIE | I445: WATT | L445: KING | O445: GILES | Q445: JOHNSON | W445: BRIGHTON | X445: 1 | Y445: 9 | Z445: 0 | AA445: 493 | AB445: 721 | AC445: 68.377253814147025 | AD445: 4
A446: BRUNSWICK | C446: SHAND | F446: McQUEEN | I446: CHRISTIE | L446: MAY | O446: HASSETT | Q446: STEPHENSON
A447: GOALKICKERS
A448: ESSENDON ASSOC. | C448: McGRATH 2 | F448: WALSH 2 | I448: WATT | K448: JOHNSON | N448: TURNER
A449: BRUNSWICK | C449: CHRISTIE 5 | G449: ALESSIO
A451: FOOTSCRAY | C451: 4 | D451: 1 | E451: =C451*6+D451 -> 25 | G451: 7 | H451: 6 | I451: =G451*6+H451 -> 48 | K451: 9 | L451: 9 | M451: =K451*6+L451 -> 63 | O451: 11 | P451: 13 | Q451: =O451*6+P451 -> 79 | S451: FOOTSCRAY
A452: PRAHRAN | C452: 2 | D452: 2 | E452: =C452*6+D452 -> 14 | G452: 2 | H452: 6 | I452: =G452*6+H452 -> 18 | K452: 5 | L452: 10 | M452: =K452*6+L452 -> 40 | O452: 8 | P452: 11 | Q452: =O452*6+P452 -> 59 | S452: PRITCHARD
A453: BEST PLAYERS
A454: FOOTSCRAY | C454: MARTIN | F454: O'DONOGHUE | I454: MAYBURY | L454: J GRIERSON | O454: HART | Q454: BANBURY
A455: PRAHRAN | C455: STRAWBRIDGE | F455: CARR | I455: LAWRENCE | L455: E JONES | O455: MOORE | Q455: WEIDNER
A456: GOALKICKERS
A457: FOOTSCRAY | C457: O'DONOGHUE 3 | G457: MAYBURY 3 | J457: MARTIN 3 | M457: BANBURY | O457: McKENZIE
A458: PRAHRAN | C458: MOORE 3 | F458: WEIDNER 2 | I458: EDGAR 2 | L458: WIDDICOMBE
A460: NORTHCOTE | C460: 5 | D460: 2 | E460: =C460*6+D460 -> 32 | G460: 7 | H460: 7 | I460: =G460*6+H460 -> 49 | K460: 14 | L460: 13 | M460: =K460*6+L460 -> 97 | O460: 20 | P460: 18 | Q460: =O460*6+P460 -> 138 | S460: NORTHCOTE
A461: HAWTHORN | C461: 0 | D461: 1 | E461: =C461*6+D461 -> 1 | G461: 1 | H461: 6 | I461: =G461*6+H461 -> 12 | K461: 1 | L461: 9 | M461: =K461*6+L461 -> 15 | O461: 6 | P461: 13 | Q461: =O461*6+P461 -> 49 | S461: LEWIS
A462: BEST PLAYERS
A463: NORTHCOTE | C463: THORPE | F463: H SMITH | I463: BUISST | L463: COOMBS | O463: O'KEEFE | R463: MILLS
A464: HAWTHORN | C464: HENRY | F464: ROBERTS | I464: WALLIS | L464: WILKINSON | O464: PARKINSON | R464: RIGALDI
A465: GOALKICKERS
A466: NORTHCOTE | C466: THORPE 7 | F466: SMITH 3 | H466: COCKRAM 2 | K466: YATES 2 | M466: SCOTT 2 | O466: O'KEEFE | Q466: STONE | S466: MILLER | U466: NORRIS
A467: HAWTHORN | C467: SCOTT 3 | F467: WILKINSON | I467: WALLIS | K467: RIGALDI
A469: WILLIAMSTOWN | C469: 5 | D469: 5 | E469: =C469*6+D469 -> 35 | G469: 6 | H469: 6 | I469: =G469*6+H469 -> 42 | K469: 11 | L469: 9 | M469: =K469*6+L469 -> 75 | O469: 12 | P469: 9 | Q469: =O469*6+P469 -> 81 | S469: BRIGHTON BEACH
A470: BRIGHTON | C470: 1 | D470: 1 | E470: =C470*6+D470 -> 7 | G470: 2 | H470: 4 | I470: =G470*6+H470 -> 16 | K470: 3 | L470: 7 | M470: =K470*6+L470 -> 25 | O470: 6 | P470: 13 | Q470: =O470*6+P470 -> 49 | S470: HURLEY
A471: BEST PLAYERS
A472: WILLIAMSTOWN | C472: HAUGHTON | G472: CARPENTER | J472: SUTTON | M472: McLEAN | P472: DUNN | R472: HARDEN
A473: BRIGHTON | C473: BANNISTER | G473: LEVER | J473: GREEN | M473: TOMBLIN | P473: ACKERS | R473: SINCLAIR
A474: GOALKICKERS
A475: WILLIAMSTOWN | C475: CARPENTER 7 | G475: HAUGHTON 3 | K475: HARDEN 2
A476: BRIGHTON | C476: MCCARTHY 2 | G476: COBB | I476: CULLEN | L476: BAYLISS | N476: SODERBLOOM
A478: ROUND 11 | D478: 10TH JULY | J478: WEATHER | M478: FINE N.W. WIND | S478: PLAYED AT | X478: LADDER | AB478: ROUND | AD478: 11
D479: 1ST QTR | H479: 2ND QTR | L479: 3RD QTR | P479: FINAL | S479: PORT MELB
A480: BRUNSWICK | C480: 3 | D480: 7 | E480: =C480*6+D480 -> 25 | G480: 3 | H480: 9 | I480: =G480*6+H480 -> 27 | K480: 5 | L480: 14 | M480: =K480*6+L480 -> 44 | O480: 5 | P480: 14 | Q480: =O480*6+P480 -> 44 | S480: UMPIRE | W480: TEAM | X480: W | Y480: L | Z480: D | AA480: FOR | AB480: AGST | AC480: % | AD480: PTS
A481: PORT MELBOURNE | C481: 1 | D481: 2 | E481: =C481*6+D481 -> 8 | G481: 2 | H481: 4 | I481: =G481*6+H481 -> 16 | K481: 2 | L481: 5 | M481: =K481*6+L481 -> 17 | O481: 5 | P481: 8 | Q481: =O481*6+P481 -> 38 | S481: JENKINS
A482: BEST PLAYERS | W482: FOOTSCRAY | X482: 10 | Y482: 1 | Z482: 0 | AA482: 898 | AB482: 597 | AC482: 150.41876046901172 | AD482: 40
A483: BRUNSWICK | C483: MAY | F483: GOONAN | I483: MOORE | L483: ADAMS | O483: HASSETT | R483: ALESSIO | W483: NORTH MELBOURNE | X483: 9 | Y483: 2 | Z483: 0 | AA483: 578 | AB483: 434 | AC483: 133.17972350230414 | AD483: 36
A484: PORT MELBOURNE | C484: STANFORD | F484: MILLER | I484: HANDO | L484: JOHNSON | O484: TREMBATH | R484: BEESLEY | W484: PORT MELBOURNE | X484: 7 | Y484: 4 | Z484: 0 | AA484: 767 | AB484: 601 | AC484: 127.62063227953411 | AD484: 28
A485: GOALKICKERS | W485: BRUNSWICK | X485: 7 | Y485: 4 | Z485: 0 | AA485: 690 | AB485: 567 | AC485: 121.6931216931217 | AD485: 28
A486: BRUNSWICK | C486: CHRISTIE 3 | G486: MCINERNEY | J486: CAHILL
A487: PORT MELBOURNE | C487: TAYLOR 2 | F487: McDONALD | I487: RUDD | K487: WALTON | W487: NORTHCOTE | X487: 5 | Y487: 6 | Z487: 0 | AA487: 651 | AB487: 669 | AC487: 97.309417040358738 | AD487: 20
W488: WILLIAMSTOWN | X488: 5 | Y488: 6 | Z488: 0 | AA488: 608 | AB488: 664 | AC488: 91.566265060240966 | AD488: 20
A489: FOOTSCRAY | C489: 7 | D489: 4 | E489: =C489*6+D489 -> 46 | G489: 9 | H489: 8 | I489: =G489*6+H489 -> 62 | K489: 12 | L489: 12 | M489: =K489*6+L489 -> 84 | O489: 16 | P489: 14 | Q489: =O489*6+P489 -> 110 | S489: WILLIAMSTOWN | W489: PRAHRAN | X489: 4 | Y489: 7 | Z489: 0 | AA489: 568 | AB489: 645 | AC489: 88.062015503875969 | AD489: 16
A490: WILLIAMSTOWN | C490: 2 | D490: 0 | E490: =C490*6+D490 -> 12 | G490: 4 | H490: 1 | I490: =G490*6+H490 -> 25 | K490: 6 | L490: 7 | M490: =K490*6+L490 -> 43 | O490: 6 | P490: 8 | Q490: =O490*6+P490 -> 44 | S490: HURLEY | W490: ESSENDON ASSOC. | X490: 4 | Y490: 7 | Z490: 0 | AA490: 570 | AB490: 677 | AC490: 84.194977843426884 | AD490: 16
A491: BEST PLAYERS | W491: HAWTHORN | X491: 3 | Y491: 8 | Z491: 0 | AA491: 589 | AB491: 831 | AC491: 70.87845968712395 | AD491: 12
A492: FOOTSCRAY | C492: HOWELL | F492: MARTIN | I492: SAMSON | L492: J GRIERSON | O492: MUELEMAN | R492: O'DONOGHUE | W492: BRIGHTON | X492: 1 | Y492: 10 | Z492: 0 | AA492: 544 | AB492: 778 | AC492: 69.922879177377894 | AD492: 4
A493: WILLIAMSTOWN | C493: SUTTON | F493: WOODFIELD | I493: HARDEN | L493: MITCHELL | O493: McLEAN | R493: BROWN
A494: GOALKICKERS
A495: FOOTSCRAY | C495: McKENZIE 3 | F495: O'DONOGHUE 3 | I495: MARTIN 3 | K495: PARK 2 | M495: CRADDOCK | P495: BANBURY | R495: HOWELL | U495: MAYBURY | X495: SAMSON
A496: WILLIAMSTOWN | C496: HARDEN 2 | F496: PUNSHON | I496: CARPENTER | L496: MITCHELL | O496: SUTTON
A498: NORTHCOTE | C498: 1 | D498: 3 | E498: =C498*6+D498 -> 9 | G498: 5 | H498: 7 | I498: =G498*6+H498 -> 37 | K498: 5 | L498: 11 | M498: =K498*6+L498 -> 41 | O498: 8 | P498: 13 | Q498: =O498*6+P498 -> 61 | S498: ESSENDON
A499: ESSENDON ASSOC. | C499: 3 | D499: 1 | E499: =C499*6+D499 -> 19 | G499: 5 | H499: 2 | I499: =G499*6+H499 -> 32 | K499: 7 | L499: 5 | M499: =K499*6+L499 -> 47 | O499: 8 | P499: 9 | Q499: =O499*6+P499 -> 57 | S499: McKINNON
A500: BEST PLAYERS
A501: NORTHCOTE | C501: H SMITH | F501: BENNETT | I501: STONE | L501: BUISST | O501: YATES | Q501: POWDITCH
A502: ESSENDON ASSOC. | C502: SCOBIE | F502: McDONALD | I502: GILES | L502: JOHNSON | O502: GRAHAM | Q502: WATT
A503: GOALKICKERS
A504: NORTHCOTE | C504: THORPE 5 | F504: SMITH | I504: COCKRAM | L504: BUISST
A505: ESSENDON ASSOC. | C505: GRAHAM 3 | F505: FIELDING 2 | I505: WALSH 2 | L505: TURNER
A507: PRAHRAN | C507: 0 | D507: 1 | E507: =C507*6+D507 -> 1 | G507: 5 | H507: 8 | I507: =G507*6+H507 -> 38 | K507: 5 | L507: 8 | M507: =K507*6+L507 -> 38 | O507: 7 | P507: 15 | Q507: =O507*6+P507 -> 57 | S507: TOORAK PARK
A508: BRIGHTON | C508: 2 | D508: 5 | E508: =C508*6+D508 -> 17 | G508: 2 | H508: 7 | I508: =G508*6+H508 -> 19 | K508: 5 | L508: 15 | M508: =K508*6+L508 -> 45 | O508: 6 | P508: 15 | Q508: =O508*6+P508 -> 51 | S508: HERBERT
A509: BEST PLAYERS
A510: PRAHRAN | C510: STRAWBRIDGE | F510: TOOHEY | I510: CORFIELD | L510: MORONEY | O510: V JONES | R510: CONDON
A511: BRIGHTON | C511: MCCARTHY | F511: BANNISTER | I511: ACKERS | L511: BORLAND | O511: CARROLL | R511: GREEN
A512: GOALKICKERS
A513: PRAHRAN | C513: MORONEY 3 | F513: CONDON | I513: CORFIELD | L513: V JONES | O513: CONDON
A514: BRIGHTON | C514: R BAYLISS 2 | F514: MCCARTHY | I514: COBB | K514: WALSH | M514: CULLEN
A516: NORTH MELBOURNE | C516: 3 | D516: 2 | E516: =C516*6+D516 -> 20 | G516: 7 | H516: 4 | I516: =G516*6+H516 -> 46 | K516: 8 | L516: 9 | M516: =K516*6+L516 -> 57 | O516: 9 | P516: 12 | Q516: =O516*6+P516 -> 66 | S516: GLENFERRIE
A517: HAWTHORN | C517: 0 | D517: 4 | E517: =C517*6+D517 -> 4 | G517: 2 | H517: 10 | I517: =G517*6+H517 -> 22 | K517: 3 | L517: 12 | M517: =K517*6+L517 -> 30 | O517: 6 | P517: 15 | Q517: =O517*6+P517 -> 51 | S517: PRITCHARD
A518: BEST PLAYERS
A519: NORTH MELBOURNE | C519: HARDY | F519: BARKER | I519: MILES | L519: MCKENZIE | O519: RAWLE | R519: IRWIN
A520: HAWTHORN | C520: LEN GIBB | F520: NOTT | I520: DAVEY | L520: RIGALDI | O520: RADEMACHER | R520: EMPEY
A521: GOALKICKERS
A522: NORTH MELBOURNE | C522: SHEEHAN 2 | F522: SMITH 2 | I522: HARDY 2 | L522: KERR | N522: MOODY | P522: IRWIN
A523: HAWTHORN | C523: T McMAHON 2 | G523: NOTT 2 | J523: RUDOLPH | M523: RIGALDI
A525: ROUND 12 | D525: 17TH JULY | J525: WEATHER | M525: NORTH WIND | S525: PLAYED AT | X525: LADDER | AB525: ROUND | AD525: 12
D526: 1ST QTR | H526: 2ND QTR | L526: 3RD QTR | P526: FINAL | S526: FOOTSCRAY
A527: FOOTSCRAY | C527: 1 | D527: 2 | E527: =C527*6+D527 -> 8 | G527: 4 | H527: 6 | I527: =G527*6+H527 -> 30 | K527: 6 | L527: 9 | M527: =K527*6+L527 -> 45 | O527: 9 | P527: 11 | Q527: =O527*6+P527 -> 65 | S527: UMPIRE | W527: TEAM | X527: W | Y527: L | Z527: D | AA527: FOR | AB527: AGST | AC527: % | AD527: PTS
A528: PORT MELBOURNE | C528: 2 | D528: 1 | E528: =C528*6+D528 -> 13 | G528: 3 | H528: 1 | I528: =G528*6+H528 -> 19 | K528: 4 | L528: 5 | M528: =K528*6+L528 -> 29 | O528: 5 | P528: 5 | Q528: =O528*6+P528 -> 35 | S528: McKINNON
A529: BEST PLAYERS | W529: FOOTSCRAY | X529: 11 | Y529: 1 | Z529: 0 | AA529: 963 | AB529: 632 | AC529: 152.37341772151899 | AD529: 44
A530: FOOTSCRAY | C530: O'DONOGHUE | G530: MARTIN | I530: HOWELL | L530: EDWARDS | O530: PORTER | Q530: PARK | W530: NORTH MELBOURNE | X530: 10 | Y530: 2 | Z530: 0 | AA530: 663 | AB530: 485 | AC530: 136.70103092783506 | AD530: 40
A531: PORT MELBOURNE | C531: STANFORD | G531: ASHTON | I531: McDONALD | L531: PASH | O531: TAYLOR | Q531: WILDING | W531: BRUNSWICK | X531: 8 | Y531: 4 | Z531: 0 | AA531: 796 | AB531: 613 | AC531: 129.85318107667212 | AD531: 32
A532: GOALKICKERS | W532: PORT MELBOURNE | X532: 7 | Y532: 5 | Z532: 0 | AA532: 802 | AB532: 666 | AC532: 120.42042042042043 | AD532: 28
A533: FOOTSCRAY | C533: PARK 3 | E533: MAYBURY 2 | H533: CRADDOCK | J533: O'DONOGHUE | M533: DAVIDSON | P533: MARTIN
A534: PORT MELBOURNE | C534: TAYLOR 5 | W534: NORTHCOTE | X534: 6 | Y534: 6 | Z534: 0 | AA534: 764 | AB534: 706 | AC534: 108.21529745042493 | AD534: 24
W535: PRAHRAN | X535: 5 | Y535: 7 | Z535: 0 | AA535: 657 | AB535: 714 | AC535: 92.016806722689083 | AD535: 20
A536: NORTHCOTE | C536: 5 | D536: 7 | E536: =C536*6+D536 -> 37 | G536: 8 | H536: 8 | I536: =G536*6+H536 -> 56 | K536: 11 | L536: 12 | M536: =K536*6+L536 -> 78 | O536: 16 | P536: 17 | Q536: =O536*6+P536 -> 113 | S536: NORTHCOTE | W536: WILLIAMSTOWN | X536: 5 | Y536: 7 | Z536: 0 | AA536: 645 | AB536: 777 | AC536: 83.011583011583014 | AD536: 20
A537: WILLIAMSTOWN | C537: 3 | D537: 1 | E537: =C537*6+D537 -> 19 | G537: 4 | H537: 1 | I537: =G537*6+H537 -> 25 | K537: 4 | L537: 1 | M537: =K537*6+L537 -> 25 | O537: 6 | P537: 1 | Q537: =O537*6+P537 -> 37 | S537: JENKINS | W537: ESSENDON ASSOC. | X537: 4 | Y537: 8 | Z537: 0 | AA537: 621 | AB537: 762 | AC537: 81.496062992125985 | AD537: 16
A538: BEST PLAYERS | W538: HAWTHORN | X538: 3 | Y538: 9 | Z538: 0 | AA538: 658 | AB538: 920 | AC538: 71.521739130434781 | AD538: 12
A539: NORTHCOTE | C539: THORPE | G539: H SMITH | J539: BALLANTYNE | M539: STONE | O539: BUISST | Q539: NORRIS | W539: BRIGHTON | X539: 1 | Y539: 11 | Z539: 0 | AA539: 590 | AB539: 884 | AC539: 66.742081447963798 | AD539: 4
A540: WILLIAMSTOWN | C540: HAUGHTON | G540: MITCHELL | J540: SUTTON | M540: HARDEN | O540: HICKEY | Q540: CONDON
A541: GOALKICKERS
A542: NORTHCOTE | C542: THORPE 8 | F542: SMITH 2 | I542: NORRIS 2 | K542: POWDITCH | M542: H SMITH | O542: COCKRAM | Q542: MILLS
A543: WILLIAMSTOWN | C543: FAIRLESS | F543: ANDERSON | I543: SUTTON | K543: HARDEN | M543: CARPENTER | P543: MITCHELL
A545: PRAHRAN | C545: 3 | D545: 2 | E545: =C545*6+D545 -> 20 | G545: 5 | H545: 2 | I545: =G545*6+H545 -> 32 | K545: 8 | L545: 7 | M545: =K545*6+L545 -> 55 | O545: 12 | P545: 17 | Q545: =O545*6+P545 -> 89 | S545: TOORAK PARK
A546: HAWTHORN | C546: 6 | D546: 1 | E546: =C546*6+D546 -> 37 | G546: 6 | H546: 5 | I546: =G546*6+H546 -> 41 | K546: 9 | L546: 8 | M546: =K546*6+L546 -> 62 | O546: 10 | P546: 9 | Q546: =O546*6+P546 -> 69 | S546: HERBERT
A547: BEST PLAYERS
A548: PRAHRAN | C548: MOORE | F548: TOOHEY | I548: STRAWBRIDGE | M548: MORONEY | P548: DE GARIS | S548: WEIDNER
A549: HAWTHORN | C549: NOTT | F549: ROBERTS | I549: HENRY | M549: TRITSCHLER | P549: C FEHRING | S549: DAVEY
A550: GOALKICKERS
A551: PRAHRAN | C551: BRENNAN 3 | F551: FANNING 3 | I551: WEIDNER 2 | L551: STRAWBRIDGE 2 | P551: BAYLISS | R551: V JONES
A552: HAWTHORN | C552: FEHRING 3 | F552: RUDOLPH 2 | I552: McMAHON | L552: TRITSCHLER | O552: HENRY | Q552: DAVEY | S552: MCCASHNEY
A554: NORTH MELBOURNE | C554: 3 | D554: 5 | E554: =C554*6+D554 -> 23 | G554: 3 | H554: 7 | I554: =G554*6+H554 -> 25 | K554: 8 | L554: 9 | M554: =K554*6+L554 -> 57 | O554: 12 | P554: 13 | Q554: =O554*6+P554 -> 85 | S554: NORTH MELB
A555: ESSENDON ASSOC. | C555: 1 | D555: 2 | E555: =C555*6+D555 -> 8 | G555: 1 | H555: 8 | I555: =G555*6+H555 -> 14 | K555: 2 | L555: 13 | M555: =K555*6+L555 -> 25 | O555: 6 | P555: 15 | Q555: =O555*6+P555 -> 51 | S555: PRITCHARD
A556: BEST PLAYERS
A557: NORTH MELBOURNE | C557: BROWN | F557: BARKER | I557: HARDY | L557: GARDINER | O557: SHEEHAN | R557: MILBURN
A558: ESSENDON ASSOC. | C558: JOHNSON | F558: WALSH | I558: STOWNIX | L558: RUSSELL | O558: McDONALD | R558: RAISBECK
A559: GOALKICKERS
A560: NORTH MELBOURNE | C560: IRWIN 3 | F560: SWALLOW 3 | I560: BARKER 2 | L560: FURLONGER | O560: SMITH | Q560: HARDY | S560: BROWN
A561: ESSENDON ASSOC. | C561: TURNER | F561: GRAHAM | I561: GILES | K561: GOULDING | N561: WATT | P561: WALSH
A563: BRUNSWICK | C563: 3 | D563: 3 | E563: =C563*6+D563 -> 21 | G563: 9 | H563: 6 | I563: =G563*6+H563 -> 60 | K563: 12 | L563: 10 | M563: =K563*6+L563 -> 82 | O563: 16 | P563: 10 | Q563: =O563*6+P563 -> 106 | S563: BRUNSWICK
A564: BRIGHTON | C564: 3 | D564: 1 | E564: =C564*6+D564 -> 19 | G564: 6 | H564: 1 | I564: =G564*6+H564 -> 37 | K564: 6 | L564: 2 | M564: =K564*6+L564 -> 38 | O564: 7 | P564: 4 | Q564: =O564*6+P564 -> 46 | S564: HURLEY
A565: BEST PLAYERS
A566: BRUNSWICK | C566: JOSE | F566: ADAMS | I566: ALESSIO | L566: FEATHERSTONE | P566: FAUST | S566: PRICE
A567: BRIGHTON | C567: BORLAND | F567: COBB | I567: GREEN | L567: TOMBLIN | P567: BANNISTER | S567: CARROLL
A568: GOALKICKERS
A569: BRUNSWICK | C569: ALESSIO 4 | F569: CHASE 3 | I569: MOORE 2 | K569: JOSE 2 | M569: PRICE 2 | O569: CHRISTIE | Q569: GOONAN | S569: FEATHERSTONE
A570: BRIGHTON | C570: CULLEN 3 | F570: COBB 2 | I570: TAYLOR | K570: WHITE
A572: ROUND 13 | D572: 24TH JULY | J572: WEATHER | M572: FINE | S572: PLAYED AT | X572: LADDER | AB572: ROUND | AD572: 13
D573: 1ST QTR | H573: 2ND QTR | L573: 3RD QTR | P573: FINAL | S573: NORTH MELB
A574: FOOTSCRAY | C574: 4 | D574: 2 | E574: =C574*6+D574 -> 26 | G574: 6 | H574: 3 | I574: =G574*6+H574 -> 39 | K574: 6 | L574: 4 | M574: =K574*6+L574 -> 40 | O574: 7 | P574: 5 | Q574: =O574*6+P574 -> 47 | S574: UMPIRE | W574: TEAM | X574: W | Y574: L | Z574: D | AA574: FOR | AB574: AGST | AC574: % | AD574: PTS
A575: NORTH MELBOURNE | C575: 1 | D575: 3 | E575: =C575*6+D575 -> 9 | G575: 2 | H575: 5 | I575: =G575*6+H575 -> 17 | K575: 4 | L575: 8 | M575: =K575*6+L575 -> 32 | O575: 5 | P575: 9 | Q575: =O575*6+P575 -> 39 | S575: McKINNON
A576: BEST PLAYERS | W576: FOOTSCRAY | X576: 12 | Y576: 1 | Z576: 0 | AA576: 1010 | AB576: 671 | AC576: 150.52160953800299 | AD576: 48
A577: FOOTSCRAY | C577: J GRIERSON | F577: SAMSON | I577: MUELEMAN | L577: PARK | N577: O'DONOGHUE | Q577: L'ESTRANGE | W577: NORTH MELBOURNE | X577: 10 | Y577: 3 | Z577: 0 | AA577: 702 | AB577: 532 | AC577: 131.95488721804512 | AD577: 40
A578: NORTH MELBOURNE | C578: GARDINER | F578: BARKER | I578: HARDY | L578: IRWIN | N578: MILBURN | Q578: SAVER | W578: BRUNSWICK | X578: 9 | Y578: 4 | Z578: 0 | AA578: 872 | AB578: 679 | AC578: 128.42415316642121 | AD578: 36
A579: GOALKICKERS | W579: PORT MELBOURNE | X579: 8 | Y579: 5 | Z579: 0 | AA579: 900 | AB579: 752 | AC579: 119.68085106382979 | AD579: 32
A580: FOOTSCRAY | C580: CRADDOCK 2 | F580: PARK 2 | I580: McKENZIE | L580: MARTIN | O580: SAMSON
A581: NORTH MELBOURNE | C581: SMITH 3 | F581: IRWIN 2 | W581: NORTHCOTE | X581: 7 | Y581: 6 | Z581: 0 | AA581: 850 | AB581: 744 | AC581: 114.24731182795699 | AD581: 28
W582: PRAHRAN | X582: 5 | Y582: 8 | Z582: 0 | AA582: 723 | AB582: 790 | AC582: 91.518987341772146 | AD582: 20
A583: PORT MELBOURNE | C583: 6 | D583: 6 | E583: =C583*6+D583 -> 42 | G583: 10 | H583: 6 | I583: =G583*6+H583 -> 66 | K583: 14 | L583: 11 | M583: =K583*6+L583 -> 95 | O583: 14 | P583: 14 | Q583: =O583*6+P583 -> 98 | S583: PORT MELB | W583: WILLIAMSTOWN | X583: 5 | Y583: 8 | Z583: 0 | AA583: 700 | AB583: 866 | AC583: 80.831408775981529 | AD583: 20
A584: ESSENDON ASSOC. | C584: 3 | D584: 3 | E584: =C584*6+D584 -> 21 | G584: 6 | H584: 5 | I584: =G584*6+H584 -> 41 | K584: 8 | L584: 6 | M584: =K584*6+L584 -> 54 | O584: 13 | P584: 8 | Q584: =O584*6+P584 -> 86 | S584: HURLEY | W584: ESSENDON ASSOC. | X584: 4 | Y584: 9 | Z584: 0 | AA584: 707 | AB584: 860 | AC584: 82.20930232558139 | AD584: 16
A585: BEST PLAYERS | W585: HAWTHORN | X585: 4 | Y585: 9 | Z585: 0 | AA585: 747 | AB585: 975 | AC585: 76.615384615384613 | AD585: 16
A586: PORT MELBOURNE | C586: RUDD | F586: HANDO | I586: McDONALD | L586: TAYLOR | N586: ANDERSON | Q586: BRISCOE | W586: BRIGHTON | X586: 1 | Y586: 12 | Z586: 0 | AA586: 628 | AB586: 970 | AC586: 64.742268041237111 | AD586: 4
A587: ESSENDON ASSOC. | C587: JOHNSON | F587: WALSH | I587: FIELDING | L587: KING | N587: STROWNIX | Q587: GRAHAM
A588: GOALKICKERS
A589: PORT MELBOURNE | C589: TAYLOR 8 | F589: WALTON 2 | I589: RUDD | K589: HAIR | M589: PASH | O589: McDONALD
A590: ESSENDON ASSOC. | C590: KING 3 | F590: WALSH 3 | I590: FIELDING 3 | L590: TURNER 2 | O590: GRAHAM | Q590: McAULEY
A592: BRUNSWICK | C592: 5 | D592: 4 | E592: =C592*6+D592 -> 34 | G592: 10 | H592: 6 | I592: =G592*6+H592 -> 66 | K592: 10 | L592: 9 | M592: =K592*6+L592 -> 69 | O592: 11 | P592: 10 | Q592: =O592*6+P592 -> 76 | S592: BRUNSWICK
A593: PRAHRAN | C593: 3 | D593: 1 | E593: =C593*6+D593 -> 19 | G593: 4 | H593: 3 | I593: =G593*6+H593 -> 27 | K593: 8 | L593: 9 | M593: =K593*6+L593 -> 57 | O593: 9 | P593: 12 | Q593: =O593*6+P593 -> 66 | S593: PRITCHARD
A594: BEST PLAYERS
A595: BRUNSWICK | C595: HASSETT | F595: ALESSIO | I595: FAUST | L595: GOONAN | N595: PRICE | Q595: MATSON
A596: PRAHRAN | C596: CORFIELD | F596: STRAWBRIDGE | I596: DE GARIS | L596: E JONES | N596: WIDDICOMBE | Q596: MOORE
A597: GOALKICKERS
A598: BRUNSWICK | C598: ALESSIO 3 | F598: CHRISTIE 3 | I598: CHASE 2 | L598: STEPHENSON | O598: FEATHERSTONE | R598: MATSON
A599: PRAHRAN | C599: BRENNAN 4 | F599: STRAWBRIDGE 2 | J599: MORONEY | M599: GIBB | O599: WEIDNER
A601: HAWTHORN | C601: 2 | D601: 4 | E601: =C601*6+D601 -> 16 | G601: 4 | H601: 8 | I601: =G601*6+H601 -> 32 | K601: 7 | L601: 10 | M601: =K601*6+L601 -> 52 | O601: 13 | P601: 11 | Q601: =O601*6+P601 -> 89 | S601: GLENFERRIE
A602: WILLIAMSTOWN | C602: 1 | D602: 6 | E602: =C602*6+D602 -> 12 | G602: 3 | H602: 9 | I602: =G602*6+H602 -> 27 | K602: 7 | L602: 13 | M602: =K602*6+L602 -> 55 | O602: 7 | P602: 13 | Q602: =O602*6+P602 -> 55 | S602: HERON
A603: BEST PLAYERS
A604: HAWTHORN | C604: RUDOLPH | F604: C FEHRING | I604: A FEHRING | L604: DAVEY | N604: TRITSCHLER | Q604: RADEMACHER
A605: WILLIAMSTOWN | C605: SUTTON | F605: HICKEY | I605: HAUGHTON | L605: CARPENTER | N605: McSHANE | Q605: L SMITH
A606: GOALKICKERS
A607: HAWTHORN | C607: NOTT 4 | F607: MCCASHNEY 3 | J607: C FEHRING 3 | N607: A FEHRING 2 | R607: ROBERTS
A608: WILLIAMSTOWN | C608: MCDONALD 2 | F608: CARPENTER 2 | J608: McSHANE | M608: SUTTON | O608: ANDERSON
A610: NORTHCOTE | C610: 3 | D610: 3 | E610: =C610*6+D610 -> 21 | G610: 7 | H610: 7 | I610: =G610*6+H610 -> 49 | K610: 9 | L610: 16 | M610: =K610*6+L610 -> 70 | O610: 11 | P610: 20 | Q610: =O610*6+P610 -> 86 | S610: BRIGHTON BEACH
A611: BRIGHTON | C611: 1 | D611: 2 | E611: =C611*6+D611 -> 8 | G611: 3 | H611: 4 | I611: =G611*6+H611 -> 22 | K611: 3 | L611: 6 | M611: =K611*6+L611 -> 24 | O611: 5 | P611: 8 | Q611: =O611*6+P611 -> 38 | S611: JENKINS
A612: BEST PLAYERS
A613: NORTHCOTE | C613: H SMITH | F613: COCKRAM | I613: FERRIS | L613: COCK | N613: PATTERSON | Q613: BALLANTYNE
A614: BRIGHTON | C614: BORLAND | F614: GREEN | I614: BANNISTER | L614: CARROLL | N614: AITKEN | Q614: CULLEN
A615: GOALKICKERS
A616: NORTHCOTE | C616: KENNY 3 | F616: FERRIS 2 | I616: SMITH 2 | L616: POWDITCH | N616: GRIFFITHS | Q616: O'KEEFE | S616: THORPE
A617: BRIGHTON | C617: CULLEN | F617: COBB | I617: TURNBULL | L617: WELSH | N617: BAYLISS
A619: ROUND 14 | D619: 31ST JULY | J619: WEATHER | M619: FINE | S619: PLAYED AT | X619: LADDER | AB619: ROUND | AD619: 14
D620: 1ST QTR | H620: 2ND QTR | L620: 3RD QTR | P620: FINAL | S620: NORTHCOTE
A621: BRUNSWICK | C621: 2 | D621: 1 | E621: =C621*6+D621 -> 13 | G621: 5 | H621: 2 | I621: =G621*6+H621 -> 32 | K621: 7 | L621: 4 | M621: =K621*6+L621 -> 46 | O621: 9 | P621: 5 | Q621: =O621*6+P621 -> 59 | S621: UMPIRE | W621: TEAM | X621: W | Y621: L | Z621: D | AA621: FOR | AB621: AGST | AC621: % | AD621: PTS
A622: NORTHCOTE | C622: 1 | D622: 5 | E622: =C622*6+D622 -> 11 | G622: 4 | H622: 7 | I622: =G622*6+H622 -> 31 | K622: 7 | L622: 10 | M622: =K622*6+L622 -> 52 | O622: 7 | P622: 13 | Q622: =O622*6+P622 -> 55 | S622: McKINNON
A623: BEST PLAYERS | W623: FOOTSCRAY | X623: 13 | Y623: 1 | Z623: 0 | AA623: 1129 | AB623: 720 | AC623: 156.80555555555554 | AD623: 52
A624: BRUNSWICK | C624: GRIMSTER | F624: SWIFT | I624: GOONAN | L624: MATSON | O624: ADAMS | Q624: PRICE | W624: NORTH MELBOURNE | X624: 11 | Y624: 3 | Z624: 0 | AA624: 775 | AB624: 598 | AC624: 129.59866220735785 | AD624: 44
A625: NORTHCOTE | C625: COCKRAM | F625: BALLANTYNE | I625: McKECHNIE | L625: BUISST | O625: COOMBS | Q625: KENNY | W625: BRUNSWICK | X625: 10 | Y625: 4 | Z625: 0 | AA625: 931 | AB625: 734 | AC625: 126.83923705722071 | AD625: 40
A626: GOALKICKERS | W626: PORT MELBOURNE | X626: 9 | Y626: 5 | Z626: 0 | AA626: 974 | AB626: 795 | AC626: 122.51572327044025 | AD626: 36
A627: BRUNSWICK | C627: SULLIVAN 3 | F627: PRICE 2 | I627: FAUST | K627: CHRISTIE | N627: HASSETT | Q627: CARROLL
A628: NORTHCOTE | C628: COCKRAM 2 | F628: KENNY | I628: SMITH | K628: MILLS | M628: THORPE | O628: GRIFFITHS | W628: NORTHCOTE | X628: 7 | Y628: 7 | Z628: 0 | AA628: 905 | AB628: 803 | AC628: 112.70236612702367 | AD628: 28
W629: PRAHRAN | X629: 5 | Y629: 9 | Z629: 0 | AA629: 789 | AB629: 863 | AC629: 91.425260718424099 | AD629: 20
A630: NORTH MELBOURNE | C630: 2 | D630: 1 | E630: =C630*6+D630 -> 13 | G630: 6 | H630: 8 | I630: =G630*6+H630 -> 44 | K630: 9 | L630: 8 | M630: =K630*6+L630 -> 62 | O630: 10 | P630: 13 | Q630: =O630*6+P630 -> 73 | S630: TOORAK PARK | W630: ESSENDON ASSOC. | X630: 5 | Y630: 9 | Z630: 0 | AA630: 788 | AB630: 909 | AC630: 86.688668866886687 | AD630: 20
A631: PRAHRAN | C631: 2 | D631: 2 | E631: =C631*6+D631 -> 14 | G631: 3 | H631: 2 | I631: =G631*6+H631 -> 20 | K631: 8 | L631: 4 | M631: =K631*6+L631 -> 52 | O631: 10 | P631: 6 | Q631: =O631*6+P631 -> 66 | S631: JENKINS | W631: WILLIAMSTOWN | X631: 5 | Y631: 9 | Z631: 0 | AA631: 743 | AB631: 940 | AC631: 79.042553191489361 | AD631: 20
A632: BEST PLAYERS | W632: HAWTHORN | X632: 4 | Y632: 10 | Z632: 0 | AA632: 796 | AB632: 1094 | AC632: 72.760511882998173 | AD632: 16
A633: NORTH MELBOURNE | C633: BROWN | F633: BELL | I633: MILBURN | L633: SMITH | O633: MILES | Q633: WOODINGTON | W633: BRIGHTON | X633: 1 | Y633: 13 | Z633: 0 | AA633: 677 | AB633: 1051 | AC633: 64.41484300666032 | AD633: 4
A634: PRAHRAN | C634: MOORE | F634: CARR | I634: LAWRENCE | L634: DE GARIS | O634: WEIDNER | Q634: BRENNAN
A635: GOALKICKERS
A636: NORTH MELBOURNE | C636: MILES 3 | F636: SMITH 3 | I636: MONOHAN 2 | L636: McSWEENEY | O636: SAVER
A637: PRAHRAN | C637: EDGAR 4 | F637: BRENNAN 3 | I637: WEIDNER 2 | L637: FRAWLEY
A639: PORT MELBOURNE | C639: 2 | D639: 4 | E639: =C639*6+D639 -> 16 | G639: 5 | H639: 4 | I639: =G639*6+H639 -> 34 | K639: 10 | L639: 7 | M639: =K639*6+L639 -> 67 | O639: 10 | P639: 14 | Q639: =O639*6+P639 -> 74 | S639: WILLIAMSTOWN
A640: WILLIAMSTOWN | C640: 0 | D640: 5 | E640: =C640*6+D640 -> 5 | G640: 2 | H640: 7 | I640: =G640*6+H640 -> 19 | K640: 4 | L640: 10 | M640: =K640*6+L640 -> 34 | O640: 5 | P640: 13 | Q640: =O640*6+P640 -> 43 | S640: PRITCHARD
A641: BEST PLAYERS
A642: PORT MELBOURNE | C642: HANDO | F642: ANDERSON | I642: BRISCOE | L642: STANFORD | O642: TAYLOR | R642: PASH
A643: WILLIAMSTOWN | C643: WOODFIELD | F643: JAMIESON | I643: McSHANE | L643: MITCHELL | O643: R SMITH | R643: MILLER
A644: GOALKICKERS
A645: PORT MELBOURNE | C645: TAYLOR 5 | F645: WALTON 2 | I645: STANFORD | L645: ASHTON | N645: McDONALD
A646: WILLIAMSTOWN | C646: HAUGHTON 2 | F646: MILLER | I646: CARPENTER | L646: MITCHELL
A648: ESSENDON ASSOC. | C648: 2 | D648: 5 | E648: =C648*6+D648 -> 17 | G648: 4 | H648: 8 | I648: =G648*6+H648 -> 32 | K648: 9 | L648: 12 | M648: =K648*6+L648 -> 66 | O648: 11 | P648: 15 | Q648: =O648*6+P648 -> 81 | S648: ESSENDON
A649: BRIGHTON | C649: 3 | D649: 4 | E649: =C649*6+D649 -> 22 | G649: 4 | H649: 6 | I649: =G649*6+H649 -> 30 | K649: 6 | L649: 6 | M649: =K649*6+L649 -> 42 | O649: 7 | P649: 7 | Q649: =O649*6+P649 -> 49 | S649: HERBERT
A650: BEST PLAYERS
A651: ESSENDON ASSOC. | C651: SCOBIE | F651: McGRATH | I651: KING | L651: McDONALD | O651: JOHNSTON | R651: GRAHAM
A652: BRIGHTON | C652: BORLAND | F652: TURNBULL | I652: DANGERFIELD | L652: GREEN | O652: TOMBLIN | R652: WARD
A653: GOALKICKERS
A654: ESSENDON ASSOC. | C654: GRAHAM 3 | F654: KING 2 | I654: WALSH 2 | L654: McAULEY | N654: SCOBIE | P654: FIELDING | R654: JOHNSON
A655: BRIGHTON | C655: TURNBULL 2 | F655: R BAYLISS 2 | J655: M BAYLISS | M655: WARD | O655: BORLAND
A657: FOOTSCRAY | C657: 3 | D657: 5 | E657: =C657*6+D657 -> 23 | G657: 7 | H657: 9 | I657: =G657*6+H657 -> 51 | K657: 12 | L657: 11 | M657: =K657*6+L657 -> 83 | O657: 17 | P657: 15 | Q657: =O657*6+P657 -> 117 | S657: FOOTSCRAY
A658: HAWTHORN | C658: 3 | D658: 3 | E658: =C658*6+D658 -> 21 | G658: 4 | H658: 3 | I658: =G658*6+H658 -> 27 | K658: 5 | L658: 5 | M658: =K658*6+L658 -> 35 | O658: 7 | P658: 7 | Q658: =O658*6+P658 -> 49 | S658: HURLEY
A659: BEST PLAYERS
A660: FOOTSCRAY | C660: J GRIERSON | G660: HOWELL | J660: MARTIN | M660: PARK | P660: HOLDEN | R660: McKENZIE
A661: HAWTHORN | C661: McCASHNEY | G661: RIGALDI | J661: ROBERTS | M661: DAVEY | P661: HENRY | R661: TRITSCHLER
A662: GOALKICKERS
A663: FOOTSCRAY | C663: MARTIN 5 | E663: O'DONOGHUE 3 | H663: PARK 3 | J663: HOWELL 2 | M663: BANBURY | O663: CRADDOCK | R663: MAYBURY | U663: McKENZIE
A664: HAWTHORN | C664: McCASHNEY 4 | G664: SCOTT 2 | J664: HENRY
A666: ROUND 15 | D666: 14TH AUGUST | J666: WEATHER | M666: FINE | S666: PLAYED AT | X666: LADDER | AB666: ROUND | AD666: 15
D667: 1ST QTR | H667: 2ND QTR | L667: 3RD QTR | P667: FINAL | S667: BRUNSWICK
A668: BRUNSWICK | C668: 2 | D668: 3 | E668: =C668*6+D668 -> 15 | G668: 4 | H668: 7 | I668: =G668*6+H668 -> 31 | K668: 6 | L668: 11 | M668: =K668*6+L668 -> 47 | O668: 9 | P668: 11 | Q668: =O668*6+P668 -> 65 | S668: UMPIRE | W668: TEAM | X668: W | Y668: L | Z668: D | AA668: FOR | AB668: AGST | AC668: % | AD668: PTS
A669: FOOTSCRAY | C669: 2 | D669: 4 | E669: =C669*6+D669 -> 16 | G669: 3 | H669: 6 | I669: =G669*6+H669 -> 24 | K669: 5 | L669: 8 | M669: =K669*6+L669 -> 38 | O669: 5 | P669: 10 | Q669: =O669*6+P669 -> 40 | S669: McKINNON
A670: BEST PLAYERS | W670: FOOTSCRAY | X670: 13 | Y670: 2 | Z670: 0 | AA670: 1169 | AB670: 785 | AC670: 148.91719745222929 | AD670: 52
A671: BRUNSWICK | C671: O'CONNOR | G671: SWIFT | J671: HASSETT | M671: MAY | O671: CAHILL | R671: ADAMS | W671: NORTH MELBOURNE | X671: 12 | Y671: 3 | Z671: 0 | AA671: 903 | AB671: 655 | AC671: 137.86259541984734 | AD671: 48
A672: FOOTSCRAY | C672: J GRIERSON | G672: C GRIERSON | J672: HART | M672: MARTIN | O672: McKENZIE | R672: EDWARDS | W672: BRUNSWICK | X672: 11 | Y672: 4 | Z672: 0 | AA672: 996 | AB672: 774 | AC672: 128.68217054263565 | AD672: 44
A673: GOALKICKERS | W673: PORT MELBOURNE | X673: 9 | Y673: 6 | Z673: 0 | AA673: 1029 | AB673: 863 | AC673: 119.23522595596755 | AD673: 36
A674: BRUNSWICK | C674: CHRISTIE 3 | F674: FAUST 2 | I674: ALESSIO | K674: PRICE | M674: SULLIVAN | P674: CAHILL
A675: FOOTSCRAY | C675: MARTIN 2 | F675: MCKENZIE | I675: O'DONOGHUE | L675: PORTER | W675: NORTHCOTE | X675: 8 | Y675: 7 | Z675: 0 | AA675: 973 | AB675: 858 | AC675: 113.40326340326341 | AD675: 32
W676: WILLIAMSTOWN | X676: 6 | Y676: 9 | Z676: 0 | AA676: 859 | AB676: 1007 | AC676: 85.302879841112215 | AD676: 24
A677: NORTHCOTE | C677: 1 | D677: 4 | E677: =C677*6+D677 -> 10 | G677: 4 | H677: 8 | I677: =G677*6+H677 -> 32 | K677: 6 | L677: 9 | M677: =K677*6+L677 -> 45 | O677: 9 | P677: 14 | Q677: =O677*6+P677 -> 68 | S677: NORTHCOTE | W677: PRAHRAN | X677: 5 | Y677: 10 | Z677: 0 | AA677: 856 | AB677: 979 | AC677: 87.436159346271708 | AD677: 20
A678: PORT MELBOURNE | C678: 3 | D678: 1 | E678: =C678*6+D678 -> 19 | G678: 4 | H678: 6 | I678: =G678*6+H678 -> 30 | K678: 5 | L678: 9 | M678: =K678*6+L678 -> 39 | O678: 7 | P678: 13 | Q678: =O678*6+P678 -> 55 | S678: HURLEY | W678: ESSENDON ASSOC. | X678: 5 | Y678: 10 | Z678: 0 | AA678: 852 | AB678: 987 | AC678: 86.322188449848028 | AD678: 20
A679: BEST PLAYERS | W679: HAWTHORN | X679: 5 | Y679: 10 | Z679: 0 | AA679: 874 | AB679: 1158 | AC679: 75.474956822107075 | AD679: 20
A680: NORTHCOTE | C680: COCKRAM | F680: BUISST | I680: YATES | L680: H SMITH | N680: THORPE | Q680: McKENZIE | W680: BRIGHTON | X680: 1 | Y680: 14 | Z680: 0 | AA680: 734 | AB680: 1179 | AC680: 62.256149279050042 | AD680: 4
A681: PORT MELBOURNE | C681: RUDD | F681: HANDO | I681: STANFORD | L681: McDONALD | N681: PASH | Q681: BRISCOE
A682: GOALKICKERS
A683: NORTHCOTE | C683: THORPE 5 | F683: POWDITCH | I683: COCKRAM | L683: BUISST | N683: TIERNEY
A684: PORT MELBOURNE | C684: TAYLOR 3 | F684: WALTON | I684: J O'BRIEN | L684: PASH | N684: MCDONALD
A686: WILLIAMSTOWN | C686: 4 | D686: 1 | E686: =C686*6+D686 -> 25 | G686: 9 | H686: 10 | I686: =G686*6+H686 -> 64 | K686: 14 | L686: 12 | M686: =K686*6+L686 -> 96 | O686: 17 | P686: 14 | Q686: =O686*6+P686 -> 116 | S686: WILLIAMSTOWN
A687: PRAHRAN | C687: 0 | D687: 4 | E687: =C687*6+D687 -> 4 | G687: 2 | H687: 11 | I687: =G687*6+H687 -> 23 | K687: 7 | L687: 12 | M687: =K687*6+L687 -> 54 | O687: 8 | P687: 19 | Q687: =O687*6+P687 -> 67 | S687: HERBERT
A688: BEST PLAYERS
A689: WILLIAMSTOWN | C689: HAUGHTON | F689: JOHNSON | I689: R SMITH | L689: CARPENTER | O689: WOOD | R689: McLEAN
A690: PRAHRAN | C690: DE GARIS | F690: CORFIELD | I690: BRENNAN | L690: V JONES | O690: MASTERS | R690: TOOHEY
A691: GOALKICKERS
A692: WILLIAMSTOWN | C692: CARPENTER 4 | F692: HAUGHTON 3 | I692: R SMITH 3 | L692: WOODS 2 | N692: McLEAN 2 | Q692: TASKER | S692: L SMITH | U692: JAMIESON
A693: PRAHRAN | C693: BRENNAN (4) | F693: STRAWBRIDGE | I693: EDGAR | K693: TRESSIDER | N693: MASTERS
A695: HAWTHORN | C695: 6 | D695: 3 | E695: =C695*6+D695 -> 39 | G695: 6 | H695: 6 | I695: =G695*6+H695 -> 42 | K695: 8 | L695: 11 | M695: =K695*6+L695 -> 59 | O695: 10 | P695: 18 | Q695: =O695*6+P695 -> 78 | S695: HAW
A696: ESSENDON ASSOC. | C696: 3 | D696: 7 | E696: =C696*6+D696 -> 25 | G696: 3 | H696: 8 | I696: =G696*6+H696 -> 26 | K696: 7 | L696: 9 | M696: =K696*6+L696 -> 51 | O696: 9 | P696: 10 | Q696: =O696*6+P696 -> 64 | S696: LOVELL
A697: BEST PLAYERS
A698: HAWTHORN | C698: ROBERTS | F698: DAVEY | I698: NOTT | L698: MCCASHNEY | O698: HENRY | R698: RUDOLPH
A699: ESSENDON ASSOC. | C699: FIELDING | F699: WALSH | I699: SCOBIE | L699: JOHNSON | O699: GRAHAM | R699: STROWNIX
A700: GOALKICKERS
A701: HAWTHORN | C701: MCCASHNEY 3 | F701: NOTT 2 | I701: RUDOLPH 2 | L701: WEBSTER | N701: COOK | P701: FEHRING
A702: ESSENDON ASSOC. | C702: FIELDING 3 | F702: KING 2 | I702: SCOBIE | K702: LATIMER | M702: GRAHAM | O702: PALMER
A704: NORTH MELBOURNE | C704: 2 | D704: 3 | E704: =C704*6+D704 -> 15 | G704: 7 | H704: 6 | I704: =G704*6+H704 -> 48 | K704: 11 | L704: 15 | M704: =K704*6+L704 -> 81 | O704: 18 | P704: 20 | Q704: =O704*6+P704 -> 128 | S704: BRIGHTON BEACH
A705: BRIGHTON | C705: 2 | D705: 0 | E705: =C705*6+D705 -> 12 | G705: 5 | H705: 0 | I705: =G705*6+H705 -> 30 | K705: 7 | L705: 1 | M705: =K705*6+L705 -> 43 | O705: 9 | P705: 3 | Q705: =O705*6+P705 -> 57 | S705: JENKINS
A706: BEST PLAYERS
A707: NORTH MELBOURNE | C707: BROWN | F707: MILES | I707: IRWIN | L707: MONOHAN | O707: ELLINGSEN | R707: SAWYER
A708: BRIGHTON | C708: TURNBULL | F708: BORLAND | I708: GREEN | L708: CARROLL | O708: COBB | R708: HATTAM
A709: GOALKICKERS
A710: NORTH MELBOURNE | C710: SMITH 5 | E710: MONOHAN 3 | H710: MILES 2 | J710: WOODFIELD 2 | M710: BROWN 2 | O710: ELLINGSEN | Q710: BELL | R710: GARDINER | U710: IRWIN
A711: BRIGHTON | C711: COBB 4 | F711: R BAYLISS 2 | I711: DANGERFIELD | L711: TURNBULL | N711: BANNISTER
A713: ROUND 16 | D713: 21ST AUGUST | J713: WEATHER | M713: STRONG NORTH WIND | S713: PLAYED AT | X713: LADDER | AB713: ROUND | AD713: 16
D714: 1ST QTR | H714: 2ND QTR | L714: 3RD QTR | P714: FINAL | S714: NORTH MELB
A715: BRUNSWICK | C715: 0 | D715: 4 | E715: =C715*6+D715 -> 4 | G715: 3 | H715: 10 | I715: =G715*6+H715 -> 28 | K715: 3 | L715: 11 | M715: =K715*6+L715 -> 29 | O715: 7 | P715: 18 | Q715: =O715*6+P715 -> 60 | S715: UMPIRE | W715: TEAM | X715: W | Y715: L | Z715: D | AA715: FOR | AB715: AGST | AC715: % | AD715: PTS
A716: NORTH MELBOURNE | C716: 2 | D716: 0 | E716: =C716*6+D716 -> 12 | G716: 3 | H716: 0 | I716: =G716*6+H716 -> 18 | K716: 5 | L716: 2 | M716: =K716*6+L716 -> 32 | O716: 5 | P716: 2 | Q716: =O716*6+P716 -> 32 | S716: HERBERT
A717: BEST PLAYERS | W717: FOOTSCRAY | X717: 14 | Y717: 2 | Z717: 0 | AA717: 1243 | AB717: 838 | AC717: 148.3293556085919 | AD717: 56
A718: BRUNSWICK | C718: ALESSIO | F718: FAUST | H718: O'CONNOR | K718: ADAMS | N718: GRIMSTER | Q718: SHAND | W718: BRUNSWICK | X718: 12 | Y718: 4 | Z718: 0 | AA718: 1056 | AB718: 806 | AC718: 131.01736972704714 | AD718: 48
A719: NORTH MELBOURNE | C719: JONES | F719: IRWIN | H719: HARDY | K719: WOODINGTON | N719: McKENZIE | Q719: MILBURN | W719: NORTH MELBOURNE | X719: 12 | Y719: 4 | Z719: 0 | AA719: 935 | AB719: 715 | AC719: 130.76923076923077 | AD719: 48
A720: GOALKICKERS | W720: PORT MELBOURNE | X720: 10 | Y720: 6 | Z720: 0 | AA720: 1097 | AB720: 924 | AC720: 118.72294372294373 | AD720: 40
A721: BRUNSWICK | C721: MAY 2 | F721: CHRISTIE | I721: SULLIVAN | L721: MOORE | N721: MONOHAN | Q721: ALESSIO
A722: NORTH MELBOURNE | C722: NANCARROW 2 | G722: IRWIN 2 | J722: SMITH | W722: NORTHCOTE | X722: 8 | Y722: 8 | Z722: 0 | AA722: 1010 | AB722: 925 | AC722: 109.18918918918919 | AD722: 32
W723: WILLIAMSTOWN | X723: 7 | Y723: 9 | Z723: 0 | AA723: 933 | AB723: 1039 | AC723: 89.797882579403279 | AD723: 28
A724: PRAHRAN | C724: 0 | D724: 2 | E724: =C724*6+D724 -> 2 | G724: 4 | H724: 6 | I724: =G724*6+H724 -> 30 | K724: 5 | L724: 6 | M724: =K724*6+L724 -> 36 | O724: 10 | P724: 7 | Q724: =O724*6+P724 -> 67 | S724: TOORAK PARK | W724: PRAHRAN | X724: 6 | Y724: 10 | Z724: 0 | AA724: 923 | AB724: 1016 | AC724: 90.846456692913392 | AD724: 24
A725: NORTHCOTE | C725: 3 | D725: 3 | E725: =C725*6+D725 -> 21 | G725: 3 | H725: 6 | I725: =G725*6+H725 -> 24 | K725: 4 | L725: 11 | M725: =K725*6+L725 -> 35 | O725: 4 | P725: 13 | Q725: =O725*6+P725 -> 37 | S725: PRITCHARD | W725: ESSENDON ASSOC. | X725: 5 | Y725: 11 | Z725: 0 | AA725: 884 | AB725: 1061 | AC725: 83.317624882186621 | AD725: 20
A726: BEST PLAYERS | W726: HAWTHORN | X726: 5 | Y726: 11 | Z726: 0 | AA726: 935 | AB726: 1226 | AC726: 76.264274061990207 | AD726: 20
A727: PRAHRAN | C727: CORFIELD | F727: LAWRENCE | I727: MOORE | L727: DE GARIS | N727: MASTERS | Q727: ALLISTER | W727: BRIGHTON | X727: 1 | Y727: 15 | Z727: 0 | AA727: 787 | AB727: 1253 | AC727: 62.809257781324817 | AD727: 4
A728: NORTHCOTE | C728: STONE | F728: McKECHNIE | I728: H SMITH | L728: NORRIS | N728: THOMAS
A729: GOALKICKERS
A730: PRAHRAN | C730: EDGAR 3 | F730: GIBB 2 | H730: MASTERS | J730: BRENNAN | M730: STRAWVBRIDGE | P730: V JONES | R730: MOORE
A731: NORTHCOTE | C731: THORPE 2 | F731: SMITH | I731: GRIFFITH
A733: WILLIAMSTOWN | C733: 2 | D733: 1 | E733: =C733*6+D733 -> 13 | G733: 6 | H733: 3 | I733: =G733*6+H733 -> 39 | K733: 8 | L733: 6 | M733: =K733*6+L733 -> 54 | O733: 11 | P733: 8 | Q733: =O733*6+P733 -> 74 | S733: ESSENDON
A734: ESSENDON ASSOC. | C734: 3 | D734: 5 | E734: =C734*6+D734 -> 23 | G734: 3 | H734: 7 | I734: =G734*6+H734 -> 25 | K734: 4 | L734: 7 | M734: =K734*6+L734 -> 31 | O734: 4 | P734: 8 | Q734: =O734*6+P734 -> 32 | S734: JENKINS
A735: BEST PLAYERS
A736: WILLIAMSTOWN | C736: CONDON | F736: HICKEY | I736: McDONALD | L736: HAUGHTON | O736: ARMSTRONG | R736: CARPENTER
A737: ESSENDON ASSOC. | C737: SCOBIE | F737: McGRATH | I737: JOHNSON | L737: STOWNIX | O737: FIELDING | R737: PALMER
A738: GOALKICKERS
A739: WILLIAMSTOWN | C739: HAUGHTON 3 | F739: L SMITH 2 | I739: CARPENTER 2 | L739: JAMIESON | N739: TASKER | P739: WOOD | R739: PUNSHON
A740: ESSENDON ASSOC. | C740: JOHNSON | F740: MCAULEY | I740: PALMER | K740: WALSH
A742: PORT MELBOURNE | C742: 3 | D742: 6 | E742: =C742*6+D742 -> 24 | G742: 4 | H742: 7 | I742: =G742*6+H742 -> 31 | K742: 7 | L742: 12 | M742: =K742*6+L742 -> 54 | O742: 9 | P742: 14 | Q742: =O742*6+P742 -> 68 | S742: GLENFERRIE
A743: HAWTHORN | C743: 1 | D743: 4 | E743: =C743*6+D743 -> 10 | G743: 4 | H743: 12 | I743: =G743*6+H743 -> 36 | K743: 6 | L743: 15 | M743: =K743*6+L743 -> 51 | O743: 7 | P743: 19 | Q743: =O743*6+P743 -> 61 | S743: McKINNON
A744: BEST PLAYERS
A745: PORT MELBOURNE | C745: T O'BRIEN | F745: RUDD | I745: HAIR | L745: BARFOOT | O745: TAYLOR | R745: BRISCOE
A746: HAWTHORN | C746: RUDOLPH | F746: HENRY | I746: DAVEY | L746: BLACK | O746: McMAHON | R746: FEHRING
A747: GOALKICKERS
A748: PORT MELBOURNE | C748: TAYLOR 4 | F748: PASH 2 | I748: WALTON | K748: BARFOOT | M748: RUDD
A749: HAWTHORN | C749: FEHRING 2 | F749: McCASHNEY 2 | J749: NOTT | L749: BLACK | N749: McMAHON
A751: FOOTSCRAY | C751: 1 | D751: 1 | E751: =C751*6+D751 -> 7 | G751: 6 | H751: 8 | I751: =G751*6+H751 -> 44 | K751: 6 | L751: 8 | M751: =K751*6+L751 -> 44 | O751: 10 | P751: 14 | Q751: =O751*6+P751 -> 74 | S751: FOOTSCRAY
A752: BRIGHTON | C752: 4 | D752: 2 | E752: =C752*6+D752 -> 26 | G752: 4 | H752: 2 | I752: =G752*6+H752 -> 26 | K752: 8 | L752: 5 | M752: =K752*6+L752 -> 53 | O752: 8 | P752: 5 | Q752: =O752*6+P752 -> 53 | S752: HURLEY
A753: BEST PLAYERS
A754: FOOTSCRAY | C754: PORTER | F754: O'DONOGHUE | J754: McKENZIE | M754: PARK | O754: MARTIN | R754: JOHNSON
A755: BRIGHTON | C755: BORLAND | F755: HATTAM | J755: TOMBLIN | M755: ACKERS | O755: MCCARTHY | R755: BANNISTER
A756: GOALKICKERS
A757: FOOTSCRAY | C757: O'DONOGHUE 3 | G757: McKENZIE 2 | J757: PARK 2 | M757: GREAVES 2 | P757: MAYBURY
A758: BRIGHTON | C758: McCARTHY 3 | G758: TOMBLIN | J758: TAYLOR | M758: CULLEN | O758: COBB | Q758: LAVER
A760: ROUND 17 | D760: 28TH AUGUST | J760: WEATHER | M760: FINE | S760: PLAYED AT | X760: LADDER | AB760: ROUND | AD760: 17
D761: 1ST QTR | H761: 2ND QTR | L761: 3RD QTR | P761: FINAL | S761: NORTHCOTE
A762: NORTHCOTE | C762: 2 | D762: 1 | E762: =C762*6+D762 -> 13 | G762: 3 | H762: 8 | I762: =G762*6+H762 -> 26 | K762: 8 | L762: 15 | M762: =K762*6+L762 -> 63 | O762: 12 | P762: 18 | Q762: =O762*6+P762 -> 90 | S762: UMPIRE | W762: TEAM | X762: W | Y762: L | Z762: D | AA762: FOR | AB762: AGST | AC762: % | AD762: PTS
A763: NORTH MELBOURNE | C763: 3 | D763: 0 | E763: =C763*6+D763 -> 18 | G763: 5 | H763: 2 | I763: =G763*6+H763 -> 32 | K763: 6 | L763: 3 | M763: =K763*6+L763 -> 39 | O763: 8 | P763: 6 | Q763: =O763*6+P763 -> 54 | S763: HURLEY
A764: BEST PLAYERS | W764: FOOTSCRAY | X764: 15 | Y764: 2 | Z764: 0 | AA764: 1309 | AB764: 886 | AC764: 147.74266365688487 | AD764: 60
A765: NORTHCOTE | C765: MCKECHNIE | G765: MILLS | I765: KENNY | L765: STONE | O765: SMITH | Q765: COCKRAM | W765: BRUNSWICK | X765: 12 | Y765: 5 | Z765: 0 | AA765: 1114 | AB765: 866 | AC765: 128.63741339491918 | AD765: 48
A766: NORTH MELBOURNE | C766: WOODINGTON | G766: SMITH | I766: BARKER | L766: ELLINGSEN | O766: HARDY | Q766: GARDINER | W766: NORTH MELBOURNE | X766: 12 | Y766: 5 | Z766: 0 | AA766: 988 | AB766: 807 | AC766: 122.42874845105328 | AD766: 48
A767: GOALKICKERS | W767: PORT MELBOURNE | X767: 11 | Y767: 6 | Z767: 0 | AA767: 1197 | AB767: 979 | AC767: 122.26762002042901 | AD767: 44
A768: NORTHCOTE | C768: THORPE 4 | F768: KENNY 2 | I768: GRIFFITH 2 | L768: HELWIG | N768: SMITH | P768: NORRIS | R768: MILLS
A769: NORTH MELBOURNE | C769: SMITH 3 | F769: IRWIN 2 | I769: ELLINGSEN | L769: MONOHAN | N769: FURLONGER | W769: NORTHCOTE | X769: 9 | Y769: 8 | Z769: 0 | AA769: 1102 | AB769: 978 | AC769: 112.67893660531698 | AD769: 36
W770: WILLIAMSTOWN | X770: 8 | Y770: 9 | Z770: 0 | AA770: 993 | AB770: 1097 | AC770: 90.519598906107561 | AD770: 32
A771: WILLIAMSTOWN | C771: 2 | D771: 1 | E771: =C771*6+D771 -> 13 | G771: 2 | H771: 9 | I771: =G771*6+H771 -> 21 | K771: 4 | L771: 14 | M771: =K771*6+L771 -> 38 | O771: 7 | P771: 18 | Q771: =O771*6+P771 -> 60 | S771: WILLIAMSTOWN | W771: PRAHRAN | X771: 6 | Y771: 11 | Z771: 0 | AA771: 978 | AB771: 1116 | AC771: 87.634408602150543 | AD771: 24
A772: BRUNSWICK | C772: 3 | D772: 3 | E772: =C772*6+D772 -> 21 | G772: 3 | H772: 8 | I772: =G772*6+H772 -> 26 | K772: 6 | L772: 11 | M772: =K772*6+L772 -> 47 | O772: 7 | P772: 16 | Q772: =O772*6+P772 -> 58 | S772: LOVELL | W772: HAWTHORN | X772: 6 | Y772: 11 | Z772: 0 | AA772: 991 | AB772: 1281 | AC772: 77.361436377829818 | AD772: 24
A773: BEST PLAYERS | W773: ESSENDON ASSOC. | X773: 5 | Y773: 12 | Z773: 0 | AA773: 932 | AB773: 1127 | AC773: 82.697426796805672 | AD773: 20
A774: WILLIAMSTOWN | C774: HAUGHTON | F774: HICKEY | I774: CARPENTER | L774: L SMITH | O774: R SMITH | Q774: TASKER | W774: BRIGHTON | X774: 1 | Y774: 16 | Z774: 0 | AA774: 842 | AB774: 1309 | AC774: 64.323911382734906 | AD774: 4
A775: BRUNSWICK | C775: GOONAN | F775: ALESSIO | I775: CAHILL | L775: O'CONNOR | O775: HASSETT | Q775: JOSE
A776: GOALKICKERS
A777: WILLIAMSTOWN | C777: HAUGHTON 4 | F777: TASKER 2 | I777: CARPENTER
A778: BRUNSWICK | C778: CHRISTIE 3 | F778: ALESSIO 2 | I778: CAHILL 2
A780: PORT MELBOURNE | C780: 3 | D780: 0 | E780: =C780*6+D780 -> 18 | G780: 7 | H780: 4 | I780: =G780*6+H780 -> 46 | K780: 11 | L780: 9 | M780: =K780*6+L780 -> 75 | O780: 15 | P780: 10 | Q780: =O780*6+P780 -> 100 | S780: PORT MELB
A781: PRAHRAN | C781: 1 | D781: 3 | E781: =C781*6+D781 -> 9 | G781: 2 | H781: 6 | I781: =G781*6+H781 -> 18 | K781: 5 | L781: 11 | M781: =K781*6+L781 -> 41 | O781: 7 | P781: 13 | Q781: =O781*6+P781 -> 55 | S781: KAIN
A782: BEST PLAYERS
A783: PORT MELBOURNE | C783: COY | F783: HANDO | I783: WILDING | L783: STANFORD | O783: LACKMANN | R783: ROHAN
A784: PRAHRAN | C784: V JONES | F784: CORFIELD | I784: LAWRENCE | L784: E JONES | O784: GOURLEY | R784: GIBB
A785: GOALKICKERS
A786: PORT MELBOURNE | C786: TAYLOR 6 | F786: DWYER 2 | I786: LACKMANN 2 | L786: McDONALD 2 | O786: WALTON | Q786: PASH
A787: PRAHRAN | C787: BRENNAN 2 | F787: MASTERS | I787: MOORE | K787: V JONES | M787: DE GARIS | O787: EDGAR
A789: HAWTHORN | C789: 2 | D789: 0 | E789: =C789*6+D789 -> 12 | G789: 4 | H789: 4 | I789: =G789*6+H789 -> 28 | K789: 8 | L789: 6 | M789: =K789*6+L789 -> 54 | O789: 8 | P789: 8 | Q789: =O789*6+P789 -> 56 | S789: BRIGHTON BEACH
A790: BRIGHTON | C790: 1 | D790: 5 | E790: =C790*6+D790 -> 11 | G790: 2 | H790: 10 | I790: =G790*6+H790 -> 22 | K790: 3 | L790: 12 | M790: =K790*6+L790 -> 30 | O790: 7 | P790: 13 | Q790: =O790*6+P790 -> 55 | S790: JENKINS
A791: BEST PLAYERS
A792: HAWTHORN | C792: DAVEY | F792: HENRY | I792: MCCASHNEY | L792: PARKINSON | O792: TEAGUE | R792: NOTT
A793: BRIGHTON | C793: BORLAND | F793: GREEN | I793: DANGERFIELD | L793: McCARTHY | O793: CARROLL | R793: TOMBLIN
A794: GOALKICKERS
A795: HAWTHORN | C795: MCCASHNEY 3 | F795: NOTT 2 | I795: RUDOLPH | L795: HENRY | N795: McMAHON
A796: BRIGHTON | C796: CULLEN 2 | F796: COBB 2 | I796: DANGERFIELD | L796: MCCARTHY | N796: CARROLL
A798: FOOTSCRAY | C798: 2 | D798: 8 | E798: =C798*6+D798 -> 20 | G798: 4 | H798: 10 | I798: =G798*6+H798 -> 34 | K798: 7 | L798: 12 | M798: =K798*6+L798 -> 54 | O798: 8 | P798: 18 | Q798: =O798*6+P798 -> 66 | S798: ESSENDON
A799: ESSENDON ASSOC. | C799: 2 | D799: 1 | E799: =C799*6+D799 -> 13 | G799: 4 | H799: 3 | I799: =G799*6+H799 -> 27 | K799: 6 | L799: 5 | M799: =K799*6+L799 -> 41 | O799: 7 | P799: 6 | Q799: =O799*6+P799 -> 48 | S799: McKINNON
A800: BEST PLAYERS
A801: FOOTSCRAY | C801: HOWELL | F801: McKENZIE | I801: MARTIN | L801: BANBURY | N801: PORTER | Q801: HOLDEN
A802: ESSENDON ASSOC. | C802: RUSSELL | F802: SCOBIE | I802: R WATT | L802: B WATT | N802: McDONALD | Q802: KING
A803: GOALKICKERS
A804: FOOTSCRAY | C804: BANBURY 2 | F804: CRADDOCK | I804: LORD | J804: MARTIN | L804: McKENZIE | N804: O'DONOGHUE | Q804: MAYBURY
A805: ESSENDON ASSOC. | C805: JOHNSON 2 | F805: KING | H805: SCOBIE | J805: TURNER | L805: WALSH | N805: CARTER
A807: ROUND 18 | D807: 4TH SEPTEMBER | J807: WEATHER | M807: FINE & MILD N.W. BREEZE | S807: PLAYED AT | X807: LADDER | AB807: ROUND | AD807: 18
D808: 1ST QTR | H808: 2ND QTR | L808: 3RD QTR | P808: FINAL | S808: FOOTSCRAY
A809: FOOTSCRAY | C809: 1 | D809: 3 | E809: =C809*6+D809 -> 9 | G809: 4 | H809: 11 | I809: =G809*6+H809 -> 35 | K809: 6 | L809: 12 | M809: =K809*6+L809 -> 48 | O809: 10 | P809: 17 | Q809: =O809*6+P809 -> 77 | S809: UMPIRE | W809: TEAM | X809: W | Y809: L | Z809: D | AA809: FOR | AB809: AGST | AC809: % | AD809: PTS
A810: NORTHCOTE | C810: 3 | D810: 2 | E810: =C810*6+D810 -> 20 | G810: 3 | H810: 3 | I810: =G810*6+H810 -> 21 | K810: 4 | L810: 5 | M810: =K810*6+L810 -> 29 | O810: 5 | P810: 8 | Q810: =O810*6+P810 -> 38 | S810: KAIN
A811: BEST PLAYERS | W811: FOOTSCRAY | X811: 16 | Y811: 2 | Z811: 0 | AA811: 1386 | AB811: 924 | AC811: 150 | AD811: 64
A812: FOOTSCRAY | C812: J GRIERSON | F812: SAMSON | I812: MUELEMAN | L812: JOHNSON | O812: HOLDEN | Q812: BANBURY | W812: BRUNSWICK | X812: 13 | Y812: 5 | Z812: 0 | AA812: 1209 | AB812: 903 | AC812: 133.88704318936877 | AD812: 52
A813: NORTHCOTE | C813: COCKRAM | F813: POWDITCH | I813: H SMITH | L813: FERRIS | O813: BENNETT | Q813: O'KEEFE | W813: NORTH MELBOURNE | X813: 13 | Y813: 5 | Z813: 0 | AA813: 1081 | AB813: 865 | AC813: 124.97109826589596 | AD813: 52
A814: GOALKICKERS | W814: PORT MELBOURNE | X814: 12 | Y814: 6 | Z814: 0 | AA814: 1311 | AB814: 1020 | AC814: 128.52941176470588 | AD814: 48
A815: FOOTSCRAY | C815: O'DONOGHUE 2 | G815: CRADDOCK 2 | J815: SAMSON 2 | M815: MAYBURY 2 | P815: PARK | R815: MARTIN
A816: NORTHCOTE | C816: COCKRAM 2 | F816: WALSH | I816: THORPE | L816: KENNY | W816: NORTHCOTE | X816: 9 | Y816: 9 | Z816: 0 | AA816: 1140 | AB816: 1055 | AC816: 108.05687203791469 | AD816: 36
W817: WILLIAMSTOWN | X817: 8 | Y817: 10 | Z817: 0 | AA817: 1051 | AB817: 1190 | AC817: 88.319327731092443 | AD817: 32
A818: NORTH MELBOURNE | C818: 3 | D818: 2 | E818: =C818*6+D818 -> 20 | G818: 7 | H818: 2 | I818: =G818*6+H818 -> 44 | K818: 11 | L818: 3 | M818: =K818*6+L818 -> 69 | O818: 13 | P818: 15 | Q818: =O818*6+P818 -> 93 | S818: NORTH MELB | W818: PRAHRAN | X818: 7 | Y818: 11 | Z818: 0 | AA818: 1079 | AB818: 1176 | AC818: 91.751700680272108 | AD818: 28
A819: WILLIAMSTOWN | C819: 1 | D819: 3 | E819: =C819*6+D819 -> 9 | G819: 4 | H819: 5 | I819: =G819*6+H819 -> 29 | K819: 5 | L819: 8 | M819: =K819*6+L819 -> 38 | O819: 8 | P819: 10 | Q819: =O819*6+P819 -> 58 | S819: McKINNON | W819: HAWTHORN | X819: 6 | Y819: 12 | Z819: 0 | AA819: 1028 | AB819: 1376 | AC819: 74.70930232558139 | AD819: 24
A820: BEST PLAYERS | W820: ESSENDON ASSOC. | X820: 5 | Y820: 13 | Z820: 0 | AA820: 992 | AB820: 1228 | AC820: 80.781758957654716 | AD820: 20
A821: NORTH MELBOURNE | C821: HARDY | F821: BELL | I821: McKENZIE | L821: JONES | O821: ELLINGSEN | R821: CONSIDINE | W821: BRIGHTON | X821: 1 | Y821: 17 | Z821: 0 | AA821: 883 | AB821: 1423 | AC821: 62.052002810962755 | AD821: 4
A822: WILLIAMSTOWN | C822: CONDON | F822: FAIRLESS | I822: BROWN | L822: HAUGHTON | O822: OGILVIE | R822: PUNSHON
A823: GOALKICKERS
A824: NORTH MELBOURNE | C824: SMITH 4 | F824: MONOHAN 3 | I824: CONSIDINE 2 | L824: IRWIN | N824: JONES | P824: HAMPTON | R824: HARDY
A825: WILLIAMSTOWN | C825: HAUGHTON 3 | F825: CARPENTER 2 | J825: McDONALD 2 | N825: JAMIESON
A827: PRAHRAN | C827: 2 | D827: 3 | E827: =C827*6+D827 -> 15 | G827: 7 | H827: 11 | I827: =G827*6+H827 -> 53 | K827: 10 | L827: 15 | M827: =K827*6+L827 -> 75 | O827: 13 | P827: 23 | Q827: =O827*6+P827 -> 101 | S827: TOORAK PARK
A828: ESSENDON ASSOC. | C828: 2 | D828: 5 | E828: =C828*6+D828 -> 17 | G828: 4 | H828: 5 | I828: =G828*6+H828 -> 29 | K828: 6 | L828: 6 | M828: =K828*6+L828 -> 42 | O828: 9 | P828: 6 | Q828: =O828*6+P828 -> 60 | S828: HERON
A829: BEST PLAYERS
A830: PRAHRAN | C830: MOORE | F830: DE GARIS | I830: BRENNAN | L830: CORFIELD | O830: MASTERS | R830: WEIDNER
A831: ESSENDON ASSOC. | C831: SCOBIE | F831: RAISBECK | I831: McDONALD | L831: STROWNIX | O831: GRAHAM | R831: GOULDING
A832: GOALKICKERS
A833: PRAHRAN | C833: BRENNAN 5 | F833: GOURLEY 3 | I833: STRAWBRIDGE 2 | M833: EDGAR | O833: MORONEY | R833: ALLISTER
A834: ESSENDON ASSOC. | C834: WALSH 4 | F834: FIELDING 2 | I834: GRAHAM | K834: PALMER | M834: KING
A836: BRUNSWICK | C836: 2 | D836: 4 | E836: =C836*6+D836 -> 16 | G836: 8 | H836: 7 | I836: =G836*6+H836 -> 55 | K836: 10 | L836: 15 | M836: =K836*6+L836 -> 75 | O836: 13 | P836: 17 | Q836: =O836*6+P836 -> 95 | S836: HAW
A837: HAWTHORN | C837: 0 | D837: 1 | E837: =C837*6+D837 -> 1 | G837: 2 | H837: 5 | I837: =G837*6+H837 -> 17 | K837: 3 | L837: 6 | M837: =K837*6+L837 -> 24 | O837: 4 | P837: 13 | Q837: =O837*6+P837 -> 37 | S837: LEWIS
A838: BEST PLAYERS
A839: BRUNSWICK | C839: ADAMS | F839: ALESSIO | I839: STEPHENSON | L839: HASSETT | O839: SHAND | R839: GOONAN
A840: HAWTHORN | C840: WALLIS | F840: TEAGUE | I840: PARKINSON | L840: ROBERTS | O840: REEVES | R840: BLACK
A841: GOALKICKERS
A842: BRUNSWICK | C842: CHRISTIE 4 | F842: McINERNEY 4 | J842: MATSON 2 | M842: CAHILL | O842: STEPHENSON | R842: FEATHERSTONE
A843: HAWTHORN | C843: DAVEY | F843: HENRY | I843: BLACK | L843: ROBERTS
A845: PORT MELBOURNE | C845: 4 | D845: 1 | E845: =C845*6+D845 -> 25 | G845: 7 | H845: 1 | I845: =G845*6+H845 -> 43 | K845: 12 | L845: 6 | M845: =K845*6+L845 -> 78 | O845: 18 | P845: 6 | Q845: =O845*6+P845 -> 114 | S845: PORT MELB
A846: BRIGHTON | C846: 1 | D846: 5 | E846: =C846*6+D846 -> 11 | G846: 3 | H846: 7 | I846: =G846*6+H846 -> 25 | K846: 3 | L846: 7 | M846: =K846*6+L846 -> 25 | O846: 5 | P846: 11 | Q846: =O846*6+P846 -> 41 | S846: LOVELL
A847: BEST PLAYERS
A848: PORT MELBOURNE | C848: HANDO | F848: TAYLOR | I848: BARFOOT | L848: McDONALD | O848: COY | R848: BRISCOE
A849: BRIGHTON | C849: BORLAND | F849: McCARTHY | I849: BANNISTER | L849: GREEN | O849: TURNBULL | R849: WOODSMAN
A850: GOALKICKERS
A851: PORT MELBOURNE | C851: TAYLOR 10 | F851: LACKMANN 3 | I851: PASH 3 | K851: DWYER | M851: McDONALD
A852: BRIGHTON | C852: BANNISTER | F852: GRAHAM | I852: McCARTHY | L852: WOODSMAN | O852: CARROLL
A854: FINALS
A855: 1ST SEMI | D855: 11TH SEPTEMBER | J855: WEATHER | M855: COLD S.W. WIND SHOWERS | S855: PLAYED AT
D856: 1ST QTR | H856: 2ND QTR | L856: 3RD QTR | P856: FINAL | S856: EAST MELB
A857: BRUNSWICK | C857: 2 | D857: 3 | E857: =C857*6+D857 -> 15 | G857: 2 | H857: 7 | I857: =G857*6+H857 -> 19 | K857: 4 | L857: 13 | M857: =K857*6+L857 -> 37 | O857: 5 | P857: 15 | Q857: =O857*6+P857 -> 45 | S857: UMPIRE
A858: PORT MELBOURNE | C858: 2 | D858: 0 | E858: =C858*6+D858 -> 12 | G858: 2 | H858: 6 | I858: =G858*6+H858 -> 18 | K858: 2 | L858: 7 | M858: =K858*6+L858 -> 19 | O858: 2 | P858: 9 | Q858: =O858*6+P858 -> 21 | S858: HURLEY
A859: BEST PLAYERS
A860: BRUNSWICK | D860: MAY | G860: MOORE | J860: ADAMS | M860: JOSE | O860: STEPHENSON | S860: SULLIVAN
A861: PORT MELBOURNE | D861: McDONALD | G861: WILDING | J861: HANDO | M861: COY | O861: MURPHY | S861: LACKMANN
A862: GOALKICKERS
A863: BRUNSWICK | D863: CHRISTIE 2 | H863: SHAND | K863: MOORE | N863: SULLIVAN
A864: PORT MELBOURNE | D864: TAYLOR 2
A866: 2ND SEMI | B866: (NO GAME) | F866: 25TH SEPTEMBER | J866: WEATHER | M866: FINE MILD AFTER WET FRIDAY | U866: (POSTPONED 18TH SEPT DUE TO HEAVY RAIN)
A867: FOOTSCRAY | C867: 2 | D867: 2 | E867: =C867*6+D867 -> 14 | G867: 3 | H867: 3 | I867: =G867*6+H867 -> 21 | K867: 5 | L867: 5 | M867: =K867*6+L867 -> 35 | O867: 8 | P867: 8 | Q867: =O867*6+P867 -> 56 | S867: EAST MELB
A868: NORTH MELBOURNE | C868: 0 | D868: 4 | E868: =C868*6+D868 -> 4 | G868: 3 | H868: 7 | I868: =G868*6+H868 -> 25 | K868: 4 | L868: 11 | M868: =K868*6+L868 -> 35 | O868: 6 | P868: 15 | Q868: =O868*6+P868 -> 51 | S868: HURLEY
A869: BEST PLAYERS
A870: FOOTSCRAY | D870: JOHNSON | H870: J GRIERSON | L870: PARK | O870: HOWELL | R870: MARTIN | U870: McKENZIE
A871: NORTH MELBOURNE | D871: RAWLE | H871: BARKER | L871: HARDY | O871: WOODINGTON | R871: SMITH | U871: GARDINER
A872: GOALKICKERS
A873: FOOTSCRAY | D873: PARK 3 | G873: CRADDOCK 2 | K873: LORD | M873: BANBURY | O873: HOWELL
A874: NORTH MELBOURNE | D874: SMITH 3 | G874: JONES | J874: CONSIDINE | M874: BROWN
A876: 2ND SEMI REPLAY | F876: 2ND OCTOBER | J876: WEATHER | M876: FINE SOUTH WEST WIND
A877: FOOTSCRAY | C877: 3 | D877: 4 | E877: =C877*6+D877 -> 22 | G877: 4 | H877: 7 | I877: =G877*6+H877 -> 31 | K877: 5 | L877: 8 | M877: =K877*6+L877 -> 38 | O877: 10 | P877: 9 | Q877: =O877*6+P877 -> 69 | S877: EAST MELB
A878: NORTH MELBOURNE | C878: 0 | D878: 2 | E878: =C878*6+D878 -> 2 | G878: 4 | H878: 5 | I878: =G878*6+H878 -> 29 | K878: 7 | L878: 9 | M878: =K878*6+L878 -> 51 | O878: 9 | P878: 11 | Q878: =O878*6+P878 -> 65 | S878: HURLEY
A879: BEST PLAYERS
A880: FOOTSCRAY | D880: McKENZIE | H880: SAMSON | K880: HOWELL | N880: MARTIN | Q880: J GRIERSON | T880: MUELEMAN
A881: NORTH MELBOURNE | D881: MILBURN | H881: RAWLE | K881: ELLINGSEN | N881: BARKER | Q881: BELL | T881: HARDY
A882: GOALKICKERS
A883: FOOTSCRAY | D883: PARK 4 | G883: CRADDOCK 2 | J883: SAMSON | M883: MILLER | O883: HOWELL | Q883: GOVAN
A884: NORTH MELBOURNE | D884: ELLINGSEN 2 | G884: SMITH 2 | I884: MONOHAN | L884: BARKER | N884: NANCARROW | Q884: CONSIDINE | T884: IRWIN
A886: FINAL | D886: 9TH OCTOBER | J886: WEATHER | N886: FINE WEST BREEZE
A887: FOOTSCRAY | C887: 3 | D887: 3 | E887: 21 | G887: 5 | H887: 4 | I887: 34 | K887: 6 | L887: 7 | M887: 43 | O887: 10 | P887: 9 | Q887: =O887*6+P887 -> 69 | T887: EAST MELB
A888: BRUNSWICK | C888: 1 | D888: 5 | E888: 11 | G888: 3 | H888: 12 | I888: 30 | K888: 6 | L888: 15 | M888: 51 | O888: 8 | P888: 18 | Q888: =O888*6+P888 -> 66 | T888: HURLEY
A889: BEST PLAYERS
A890: FOOTSCRAY | D890: HOWELL | H890: PARK | K890: SAMSON | N890: McKENZIE | Q890: MARTINB | T890: MUELEMAN
A891: BRUNSWICK | D891: CAHILL | H891: ALESSIO | K891: McINERNEY | N891: GOONAN | Q891: ADAMS | T891: KIEL;Y
A892: GOALKICKERS
A893: FOOTSCRAY | D893: PARK 5 | G893: CRADDOCK 3 | K893: HOWELL | N893: GOVAN
A894: BRUNSWICK | D894: CHRISTIE 3 | G894: KIELY 2 | I894: CAHILL | K894: MOORE | M894: ALESSIO
A896: REPRESENTATIVE GAMES | G896: 28TH JULY | K896: WEATHER | N896: NORTH BREEZE
A897: V.F.A. | C897: 1 | D897: 3 | E897: =C897*6+D897 -> 9 | G897: 3 | H897: 8 | I897: =G897*6+H897 -> 26 | K897: 4 | L897: 13 | M897: =K897*6+L897 -> 37 | O897: 6 | P897: 18 | Q897: 54
A898: W.A GOLDFIELDS | C898: 4 | D898: 4 | E898: =C898*6+D898 -> 28 | G898: 5 | H898: 10 | I898: =G898*6+H898 -> 40 | K898: 7 | L898: 12 | M898: =K898*6+L898 -> 54 | O898: 9 | P898: 14 | Q898: 68
A899: BEST PLAYERS
A900: V.F.A. | D900: MORONEY | G900: BARKER | J900: HARDY | M900: V JONES | P900: BARFOOT | S900: WALLIS
A901: W.A GOLDFIELDS | D901: S TYSON | G901: HEBBARD | J901: SMITH | M901: INGLE | P901: ROBERTSON | S901: ROCCI
A902: GOALKICKERS
A903: V.F.A. | D903: WALLIS 2 | G903: MORONEY | J903: HARDY | M903: SAMSON | P903: BARFOOT
A904: W.A GOLDFIELDS | D904: ROCCHI 2 | G904: HEBBARD 2 | J904: SMITH 2 | M904: HICKEY | P904: LYNCH | S904: JONES
G906: 1ST AUGUST
A907: V.F.A. | C907: 6 | D907: 2 | E907: =C907*6+D907 -> 38 | G907: 8 | H907: 6 | I907: =G907*6+H907 -> 54 | K907: 9 | L907: 10 | M907: =K907*6+L907 -> 64 | O907: 11 | P907: 11 | Q907: 77
A908: W.A GOLDFIELDS | C908: 2 | D908: 2 | E908: =C908*6+D908 -> 14 | G908: 6 | H908: 2 | I908: =G908*6+H908 -> 38 | K908: 7 | L908: 8 | M908: =K908*6+L908 -> 50 | O908: 11 | P908: 11 | Q908: 77
A909: BEST PLAYERS
A910: V.F.A. | D910: HARDY | G910: O'CONNOR | J910: BARKER | M910: McCARTHY | P910: SAMSON | S910: BARFOOT
A911: W.A GOLDFIELDS | D911: S TYSON | G911: BAILEY | J911: INGLE | M911: LYNCH | P911: JONES | S911: HICKEY
A912: GOALKICKERS
A913: V.F.A. | D913: V JONES 2 | G913: HARDY 2 | J913: WATT 2 | M913: SAMSON 2 | P913: McCARTHY 2 | S913: MAY
A914: W.A GOLDFIELDS | D914: HEBBARD 4 | G914: LYNCH 2 | J914: ROCCI 2 | M914: O'LOUGHLIN | P914: RICHARDS | S914: HICKEY
G915: 4TH AUGUST
A916: V.F.A. | C916: 1 | D916: 6 | E916: =C916*6+D916 -> 12 | G916: 4 | H916: 9 | I916: =G916*6+H916 -> 33 | K916: 5 | L916: 12 | M916: =K916*6+L916 -> 42 | O916: 6 | P916: 17 | Q916: 53
A917: W.A GOLDFIELDS | C917: 2 | D917: 0 | E917: =C917*6+D917 -> 12 | G917: 6 | H917: 3 | I917: =G917*6+H917 -> 39 | K917: 8 | L917: 5 | M917: =K917*6+L917 -> 53 | O917: 11 | P917: 6 | Q917: 72
A918: BEST PLAYERS
A919: V.F.A. | D919: BARKER | G919: HARDY | J919: V JONES | M919: McCARTHY | P919: SAMSON | S919: O'CONNOR
A920: W.A GOLDFIELDS | D920: HEBBARD | G920: LYNCH | J920: S TYSON | M920: ROCCI | P920: BAILEY | S920: FRY
A921: GOALKICKERS
A922: V.F.A. | D922: McCARTHY 3 | G922: SAMSON | J922: BANNISTER | M922: MAY
A923: W.A GOLDFIELDS | D923: BROWN 5 | G923: HEBBARD 2 | J923: ARMSTRONG | M923: O'LOUGHLIN | P923: JONES | S923: DALY