A1: Victorian Football Association
A2: Season 1921
A3: © Copyright Wal Williams | F3: First created: 2 August 2014
A4: Contact: joywalwi at gmail dot com | F4: Last updated: 30 July 2017 | W4: VFA Results and tables - Link to the main index page
A5: You are free to copy this document in whole or part provided that proper acknowledgement is given to the author. All rights reserved.
A7: YEAR 1921
A8: ROUND 1 | D8: 7TH MAY | J8: WEATHER | S8: PLAYED AT | X8: LADDER | AB8: ROUND | AD8: 1
D9: 1ST QTR | H9: 2ND QTR | L9: 3RD QTR | P9: FINAL | S9: NORTH MELB
A10: NORTH MELBOURNE | C10: 2 | D10: 5 | E10: =C10*6+D10 -> 17 | G10: 4 | H10: 10 | I10: =G10*6+H10 -> 34 | K10: 6 | L10: 12 | M10: =K10*6+L10 -> 48 | O10: 11 | P10: 15 | Q10: =O10*6+P10 -> 81 | S10: UMPIRE | W10: TEAM | X10: W | Y10: L | Z10: D | AA10: FOR | AB10: AGST | AC10: % | AD10: PTS
A11: HAWTHORN | C11: 0 | D11: 1 | E11: =C11*6+D11 -> 1 | G11: 2 | H11: 3 | I11: =G11*6+H11 -> 15 | K11: 6 | L11: 6 | M11: =K11*6+L11 -> 42 | O11: 7 | P11: 7 | Q11: =O11*6+P11 -> 49 | S11: KAIN
A12: BEST PLAYERS | W12: PORT MELBOURNE | X12: 1 | Y12: 0 | Z12: 0 | AA12: 92 | AB12: 39 | AC12: 235.89743589743588 | AD12: 4
A13: NORTH MELBOURNE | D13: ELLINGSEN | G13: BARKER | I13: HARDY | L13: KEANE | N13: O'CONNELL | Q13: MONOHAN | W13: NORTH MELBOURNE | X13: 1 | Y13: 0 | Z13: 0 | AA13: 81 | AB13: 49 | AC13: 165.30612244897958 | AD13: 4
A14: HAWTHORN | D14: ROBERTS | G14: EMPEY | I14: TEAGUE | L14: FISHER | N14: DAVEY | Q14: YEOMANS | W14: NORTHCOTE | X14: 1 | Y14: 0 | Z14: 0 | AA14: 62 | AB14: 45 | AC14: 137.77777777777777 | AD14: 4
A15: GOALKICKERS | W15: FOOTSCRAY | X15: 1 | Y15: 0 | Z15: 0 | AA15: 69 | AB15: 54 | AC15: 127.77777777777777 | AD15: 4
A16: NORTH MELBOURNE | D16: MONOHAN 4 | G16: ELLINGSEN 3 | J16: SMITH 2 | L16: WALSH | N16: BARKER
A17: HAWTHORN | D17: W GAMBETTA 2 | H17: YEOMANS 2 | K17: EMPEY 2 | N17: ROBERTS | W17: PRAHRAN | X17: 1 | Y17: 0 | Z17: 0 | AA17: 47 | AB17: 46 | AC17: 102.17 | AD17: 4
W18: BRIGHTON | X18: 0 | Y18: 1 | Z18: 0 | AA18: 46 | AB18: 47 | AC18: 97.87 | AD18: 0
A19: NORTHCOTE | C19: 1 | D19: 6 | E19: =C19*6+D19 -> 12 | G19: 4 | H19: 9 | I19: =G19*6+H19 -> 33 | K19: 7 | L19: 13 | M19: =K19*6+L19 -> 55 | O19: 7 | P19: 20 | Q19: =O19*6+P19 -> 62 | S19: ESSENDON | W19: WILLIAMSTOWN | X19: 0 | Y19: 1 | Z19: 0 | AA19: 54 | AB19: 69 | AC19: 78.260869565217391 | AD19: 0
A20: ESSENDON ASSOC. | C20: 2 | D20: 3 | E20: =C20*6+D20 -> 15 | G20: 3 | H20: 8 | I20: =G20*6+H20 -> 26 | K20: 4 | L20: 11 | M20: =K20*6+L20 -> 35 | O20: 5 | P20: 15 | Q20: =O20*6+P20 -> 45 | S20: SHELLEY | W20: ESSENDON ASSOC. | X20: 0 | Y20: 1 | Z20: 0 | AA20: 45 | AB20: 62 | AC20: 72.58064516129032 | AD20: 0
A21: BEST PLAYERS | W21: HAWTHORN | X21: 0 | Y21: 1 | Z21: 0 | AA21: 49 | AB21: 81 | AC21: 60.493827160493829 | AD21: 0
A22: NORTHCOTE | D22: COCKRAM | G22: SMITH | I22: STONE | L22: DOWNES | O22: MILLS | Q22: BUISST | W22: BRUNSWICK | X22: 0 | Y22: 1 | Z22: 0 | AA22: 39 | AB22: 92 | AC22: 42.391304347826086 | AD22: 0
A23: ESSENDON ASSOC. | D23: WATT | G23: SCOBIE | I23: MORIARTY | L23: SHORTEN | O23: KING | Q23: FIELDING
A24: GOALKICKERS
A25: NORTHCOTE | D25: THORPE 2 | G25: HELWIG | J25: SMITH | L25: BYRNE | N25: O'KEEFE | Q25: KENNY
A26: ESSENDON ASSOC. | D26: MORIARTY 3 | G26: FIELDING | J26: WALSH
A28: PRAHRAN | C28: 1 | D28: 1 | E28: =C28*6+D28 -> 7 | G28: 1 | H28: 1 | I28: =G28*6+H28 -> 7 | K28: 5 | L28: 8 | M28: =K28*6+L28 -> 38 | O28: 6 | P28: 11 | Q28: =O28*6+P28 -> 47 | S28: BRIGHTON BEACH
A29: BRIGHTON | C29: 0 | D29: 4 | E29: =C29*6+D29 -> 4 | G29: 3 | H29: 3 | I29: =G29*6+H29 -> 21 | K29: 5 | L29: 8 | M29: =K29*6+L29 -> 38 | O29: 6 | P29: 10 | Q29: =O29*6+P29 -> 46 | S29: JENKINS
A30: BEST PLAYERS
A31: PRAHRAN | D31: FILER | G31: SAUNDERS | J31: BRENNAN | M31: NAYLOR | P31: BAYLISS | S31: CORFIELD
A32: BRIGHTON | D32: HATTAM | G32: DANGERFIELD | J32: RINGROSE | M32: COBB | P32: BORLAND | S32: MCCARTHY
A33: GOALKICKERS
A34: PRAHRAN | D34: BRENNAN 2 | G34: EDGAR 2 | J34: SAUNDERS | M34: MOORE
A35: BRIGHTON | D35: RINGROSE 2 | G35: DANGERFIELD | J35: COBB | L35: GREEN | N35: MCCARTHY
A37: PORT MELBOURNE | C37: 7 | D37: 2 | E37: =C37*6+D37 -> 44 | G37: 9 | H37: 3 | I37: =G37*6+H37 -> 57 | K37: 11 | L37: 6 | M37: =K37*6+L37 -> 72 | O37: 14 | P37: 8 | Q37: =O37*6+P37 -> 92 | S37: PORT MELB
A38: BRUNSWICK | C38: 0 | D38: 2 | E38: =C38*6+D38 -> 2 | G38: 3 | H38: 4 | I38: =G38*6+H38 -> 22 | K38: 4 | L38: 7 | M38: =K38*6+L38 -> 31 | O38: 5 | P38: 9 | Q38: =O38*6+P38 -> 39 | S38: McKINNON
A39: BEST PLAYERS
A40: PORT MELBOURNE | D40: HANDO | G40: LESTER | J40: NANCARROW | M40: LEEHANE | P40: PASH | S40: MURPHY
A41: BRUNSWICK | D41: ADAMS | G41: FEATHERSTONE | K41: GRIMSTER | N41: SULLIVAN | Q41: CHRISTIE
A42: GOALKICKERS
A43: PORT MELBOURNE | D43: TAYLOR 5 | G43: LACKMAN 3 | J43: WALTON 2 | M43: JOHNSON | O43: MATTHEWS | R43: NANCARROW | V43: LESTER
A44: BRUNSWICK | D44: McINERNEY 2 | H44: CHRISTIE | K44: CAHILL | N44: KIELY
A46: FOOTSCRAY | C46: 1 | D46: 1 | E46: =C46*6+D46 -> 7 | G46: 5 | H46: 6 | I46: =G46*6+H46 -> 36 | K46: 5 | L46: 11 | M46: =K46*6+L46 -> 41 | O46: 9 | P46: 15 | Q46: =O46*6+P46 -> 69 | S46: FOOTSCRAY
A47: WILLIAMSTOWN | C47: 3 | D47: 3 | E47: =C47*6+D47 -> 21 | G47: 4 | H47: 6 | I47: =G47*6+H47 -> 30 | K47: 7 | L47: 10 | M47: =K47*6+L47 -> 52 | O47: 7 | P47: 12 | Q47: =O47*6+P47 -> 54 | S47: M CAIN
A48: BEST PLAYERS
A49: FOOTSCRAY | D49: MARTIN | G49: CALLAHAN | J49: SAMSON | M49: MULEMAN | P49: C GRIERSON | S49: DOOLAN
A50: WILLIAMSTOWN | D50: McAULIFFE | G50: HARDEN | J50: WISEMAN | M50: JAMIESON | P50: N McDONALD | S50: CONDON
A51: GOALKICKERS
A52: FOOTSCRAY | D52: PARK 4 | G52: MARTIN 3 | J52: O'DONOGHUE | M52: MAYBURY
A53: WILLIAMSTOWN | D53: McAULIFFE 3 | G53: CARPENTER | J53: HARDEN | M53: R SMITH | P53: HAUGHTON
A55: ROUND 2 | D55: 14TH MAY | J55: WEATHER | M55: FINE MILD | S55: PLAYED AT | X55: LADDER | AB55: ROUND | AD55: 2
D56: 1ST QTR | H56: 2ND QTR | L56: 3RD QTR | P56: FINAL | S56: NORTHCOTE
A57: PORT MELBOURNE | C57: 2 | D57: 6 | E57: =C57*6+D57 -> 18 | G57: 4 | H57: 7 | I57: =G57*6+H57 -> 31 | K57: 7 | L57: 14 | M57: =K57*6+L57 -> 56 | O57: 12 | P57: 18 | Q57: =O57*6+P57 -> 90 | S57: UMPIRE | W57: TEAM | X57: W | Y57: L | Z57: D | AA57: FOR | AB57: AGST | AC57: % | AD57: PTS
A58: NORTHCOTE | C58: 0 | D58: 8 | E58: =C58*6+D58 -> 8 | G58: 1 | H58: 8 | I58: =G58*6+H58 -> 14 | K58: 2 | L58: 12 | M58: =K58*6+L58 -> 24 | O58: 3 | P58: 16 | Q58: =O58*6+P58 -> 34
A59: BEST PLAYERS | W59: PORT MELBOURNE | X59: 2 | Y59: 0 | Z59: 0 | AA59: 182 | AB59: 73 | AC59: 249.31506849315068 | AD59: 8
A60: PORT MELBOURNE | D60: WALTON | F60: NANCARROW | I60: RUDD | L60: LACKMAN | O60: MURPHY | Q60: MATTHEWS | W60: NORTH MELBOURNE | X60: 2 | Y60: 0 | Z60: 0 | AA60: 167 | AB60: 70 | AC60: 238.57142857142858 | AD60: 8
A61: NORTHCOTE | D61: SMITH | F61: O'KEEFE | I61: DIMMICK | L61: COCKRAM | O61: PURCELL | Q61: BUISST | W61: FOOTSCRAY | X61: 1 | Y61: 0 | Z61: 1 | AA61: 129 | AB61: 114 | AC61: 113.15789473684211 | AD61: 6
A62: GOALKICKERS | W62: WILLIAMSTOWN | X62: 1 | Y62: 1 | Z62: 0 | AA62: 130 | AB62: 133 | AC62: 97.744360902255636 | AD62: 4
A63: PORT MELBOURNE | D63: TAYLOR 4 | F63: WALTON 3 | I63: LACKMAN 2 | L63: MATTHEWS | O63: PASH | Q63: McMURRAY
A64: NORTHCOTE | D64: KENNY | G64: H SMITH | J64: O'KEEFE | W64: PRAHRAN | X64: 1 | Y64: 1 | Z64: 0 | AA64: 111 | AB64: 122 | AC64: 90.98 | AD64: 4
W65: HAWTHORN | X65: 1 | Y65: 1 | Z65: 0 | AA65: 132 | AB65: 159 | AC65: 83.018867924528308 | AD65: 4
A66: NORTH MELBOURNE | C66: 5 | D66: 6 | E66: =C66*6+D66 -> 36 | G66: 7 | H66: 9 | I66: =G66*6+H66 -> 51 | K66: 8 | L66: 17 | M66: =K66*6+L66 -> 65 | O66: 11 | P66: 20 | Q66: =O66*6+P66 -> 86 | S66: NORTH MELB | W66: NORTHCOTE | X66: 1 | Y66: 1 | Z66: 0 | AA66: 96 | AB66: 135 | AC66: 71.111111111111114 | AD66: 4
A67: BRIGHTON | C67: 2 | D67: 0 | E67: =C67*6+D67 -> 12 | G67: 2 | H67: 1 | I67: =G67*6+H67 -> 13 | K67: 2 | L67: 2 | M67: =K67*6+L67 -> 14 | O67: 3 | P67: 3 | Q67: =O67*6+P67 -> 21 | S67: McKINNON | W67: BRUNSWICK | X67: 0 | Y67: 1 | Z67: 1 | AA67: 99 | AB67: 152 | AC67: 65.131578947368425 | AD67: 2
A68: BEST PLAYERS | W68: ESSENDON ASSOC. | X68: 0 | Y68: 2 | Z68: 0 | AA68: 123 | AB68: 145 | AC68: 84.827586206896555 | AD68: 0
A69: NORTH MELBOURNE | D69: ELLINGSEN | F69: BARKER | I69: HARDY | L69: McKENZIE | O69: TUCK | Q69: O'CONNELL | W69: BRIGHTON | X69: 0 | Y69: 2 | Z69: 0 | AA69: 67 | AB69: 133 | AC69: 50.38 | AD69: 0
A70: BRIGHTON | D70: BORLAND | F70: DANGERFIELD | I70: HATTAM | L70: GREEN | O70: SHILLITO | Q70: MCCARTHY
A71: GOALKICKERS
A72: NORTH MELBOURNE | D72: ELLINGSEN 4 | H72: MONOHAN 3 | K72: WALSH 3 | N72: SMITH
A73: BRIGHTON | D73: P BOLAND 2 | H73: RINGROSE
A75: WILLIAMSTOWN | C75: 2 | D75: 5 | E75: =C75*6+D75 -> 17 | G75: 4 | H75: 6 | I75: =G75*6+H75 -> 30 | K75: 7 | L75: 8 | M75: =K75*6+L75 -> 50 | O75: 11 | P75: 10 | Q75: =O75*6+P75 -> 76 | S75: WILLIAMSTOWN
A76: PRAHRAN | C76: 2 | D76: 3 | E76: =C76*6+D76 -> 15 | G76: 5 | H76: 8 | I76: =G76*6+H76 -> 38 | K76: 8 | L76: 10 | M76: =K76*6+L76 -> 58 | O76: 9 | P76: 10 | Q76: =O76*6+P76 -> 64 | S76: RILEY
A77: BEST PLAYERS
A78: WILLIAMSTOWN | D78: L SMITH | G78: CONDON | J78: McLEAN | M78: MCAULIFFE | P78: HARDEN | S78: R BROWN
A79: PRAHRAN | D79: TOOHEY | G79: V JONES | J79: E JONES | M79: MOORE | P79: ALLISTER | S79: GILLAN
A80: GOALKICKERS
A81: WILLIAMSTOWN | D81: McAULIFFE 4 | G81: HAUGHTON 2 | J81: GIESLER 2 | M81: N McDONALD | P81: HARDEN | R81: CARPENTER
A82: PRAHRAN | D82: NAYLOR 3 | G82: BRENNAN 2 | J82: SAUNDERS | M82: TOOHEY | P82: V JONES | S82: EDGAR
A84: HAWTHORN | C84: 2 | D84: 2 | E84: =C84*6+D84 -> 14 | G84: 4 | H84: 4 | I84: =G84*6+H84 -> 28 | K84: 8 | L84: 9 | M84: =K84*6+L84 -> 57 | O84: 12 | P84: 11 | Q84: =O84*6+P84 -> 83 | S84: GLENFERRIE
A85: ESSENDON ASSOC. | C85: 1 | D85: 8 | E85: =C85*6+D85 -> 14 | G85: 6 | H85: 8 | I85: =G85*6+H85 -> 44 | K85: 7 | L85: 11 | M85: =K85*6+L85 -> 53 | O85: 11 | P85: 12 | Q85: =O85*6+P85 -> 78 | S85: THOMPSON
A86: BEST PLAYERS
A87: HAWTHORN | D87: JACKSON | G87: W GAMBETTA | J87: McCORMACK | M87: DAVEY | O87: RADEMACHER | R87: MCCASHNEY
A88: ESSENDON ASSOC. | D88: WATT | G88: EDWARDS | J88: MORIARTY | M88: KING | O88: RUSSELL | R88: FIELDING
A89: GOALKICKERS
A90: HAWTHORN | D90: W GAMBETTA 3 | H90: YEOMANS 2 | K90: MCCASHNEY 2 | N90: ROBERTS 2 | Q90: BURKE | S90: WILSON | V90: DAVEY
A91: ESSENDON ASSOC. | D91: HARRISON 3 | G91: MORIARTY 2 | J91: GRAHAM 2 | M91: FIELDING | O91: KING | Q91: SHORTEN | S91: WATT
A93: FOOTSCRAY | C93: 2 | D93: 2 | E93: =C93*6+D93 -> 14 | G93: 6 | H93: 4 | I93: =G93*6+H93 -> 40 | K93: 7 | L93: 9 | M93: =K93*6+L93 -> 51 | O93: 8 | P93: 12 | Q93: =O93*6+P93 -> 60 | S93: BRUNSWICK
A94: BRUNSWICK | C94: 3 | D94: 3 | E94: =C94*6+D94 -> 21 | G94: 5 | H94: 8 | I94: =G94*6+H94 -> 38 | K94: 7 | L94: 14 | M94: =K94*6+L94 -> 56 | O94: 7 | P94: 18 | Q94: =O94*6+P94 -> 60 | S94: C PRITCHARD
A95: BEST PLAYERS
A96: FOOTSCRAY | D96: NEILSON | G96: MARTIN | J96: HOWELL | M96: SHERRY | O96: McKENZIE | R96: DOOLAN
A97: BRUNSWICK | D97: MOORE | G97: SULLIVAN | J97: ALESSIO | M97: MATSON | O97: FEATHERSTONE | R97: MILLEN
A98: GOALKICKERS
A99: FOOTSCRAY | D99: HOWELL 2 | G99: MARTIN 2 | J99: SAMSON | L99: MCKENZIE | N99: BANBURY | Q99: DOOLAN
A100: BRUNSWICK | D100: SULLIVAN 2 | G100: MAY | I100: MOORE | K100: STEVENSON | N100: CHRISTIE | Q100: MATSON
A102: ROUND 3 | D102: 21ST MAY | J102: WEATHER | M102: FINE NORTH BREEZE | S102: PLAYED AT | X102: LADDER | AB102: ROUND | AD102: 3
D103: 1ST QTR | H103: 2ND QTR | L103: 3RD QTR | P103: FINAL | S103: WILLIAMSTOWN
A104: PORT MELBOURNE | C104: 4 | D104: 5 | E104: =C104*6+D104 -> 29 | G104: 4 | H104: 7 | I104: =G104*6+H104 -> 31 | K104: 8 | L104: 11 | M104: =K104*6+L104 -> 59 | O104: 10 | P104: 12 | Q104: =O104*6+P104 -> 72 | S104: UMPIRE | W104: TEAM | X104: W | Y104: L | Z104: D | AA104: FOR | AB104: AGST | AC104: % | AD104: PTS
A105: WILLIAMSTOWN | C105: 1 | D105: 2 | E105: =C105*6+D105 -> 8 | G105: 5 | H105: 4 | I105: =G105*6+H105 -> 34 | K105: 5 | L105: 7 | M105: =K105*6+L105 -> 37 | O105: 10 | P105: 10 | Q105: =O105*6+P105 -> 70 | S105: RILEY
A106: BEST PLAYERS | W106: NORTH MELBOURNE | X106: 3 | Y106: 0 | Z106: 0 | AA106: 238 | AB106: 116 | AC106: 205.17241379310346 | AD106: 12
A107: PORT MELBOURNE | D107: HANDO | G107: DILLON | I107: WALTON | L107: NANCARROW | O107: RUDD | Q107: PASH | W107: PORT MELBOURNE | X107: 3 | Y107: 0 | Z107: 0 | AA107: 254 | AB107: 143 | AC107: 177.62237762237763 | AD107: 12
A108: WILLIAMSTOWN | D108: CALDWELL | G108: L SMITH | I108: MCLEAN | L108: McAULIFFE | O108: G DUNN | Q108: HAUGHTON | W108: FOOTSCRAY | X108: 2 | Y108: 0 | Z108: 1 | AA108: 208 | AB108: 158 | AC108: 131.64556962025316 | AD108: 10
A109: GOALKICKERS | W109: NORTHCOTE | X109: 2 | Y109: 1 | Z109: 0 | AA109: 156 | AB109: 191 | AC109: 81.675392670157066 | AD109: 8
A110: PORT MELBOURNE | D110: TAYLOR 3 | F110: LACKMAN 2 | I110: DILLON 2 | L110: WALTON | N110: MATTHEWS | Q110: STANFORD
A111: WILLIAMSTOWN | D111: McAULIFFE 3 | G111: HARDEN 2 | I111: HAUGHTON 2 | L111: N McDONALD 2 | O111: CALDWELL | W111: ESSENDON ASSOC. | X111: 1 | Y111: 2 | Z111: 0 | AA111: 181 | AB111: 172 | AC111: 105.23255813953489 | AD111: 4
W112: WILLIAMSTOWN | X112: 1 | Y112: 2 | Z112: 0 | AA112: 200 | AB112: 205 | AC112: 97.560975609756099 | AD112: 4
A113: FOOTSCRAY | C113: 4 | D113: 1 | E113: =C113*6+D113 -> 25 | G113: 6 | H113: 3 | I113: =G113*6+H113 -> 39 | K113: 9 | L113: 6 | M113: =K113*6+L113 -> 60 | O113: 12 | P113: 7 | Q113: =O113*6+P113 -> 79 | S113: FOOTSCRAY | W113: PRAHRAN | X113: 1 | Y113: 2 | Z113: 0 | AA113: 157 | AB113: 193 | AC113: 81.35 | AD113: 4
A114: HAWTHORN | C114: 1 | D114: 3 | E114: =C114*6+D114 -> 9 | G114: 2 | H114: 6 | I114: =G114*6+H114 -> 18 | K114: 3 | L114: 7 | M114: =K114*6+L114 -> 25 | O114: 6 | P114: 8 | Q114: =O114*6+P114 -> 44 | S114: KAIN | W114: HAWTHORN | X114: 1 | Y114: 2 | Z114: 0 | AA114: 176 | AB114: 238 | AC114: 73.949579831932766 | AD114: 4
A115: BEST PLAYERS | W115: BRUNSWICK | X115: 0 | Y115: 2 | Z115: 1 | AA115: 155 | AB115: 212 | AC115: 73.113207547169807 | AD115: 2
A116: FOOTSCRAY | D116: PARK | F116: MUELEMAN | I116: BANBURY | L116: MAYBURY | O116: W DOOLAN | R116: HOWELL | W116: BRIGHTON | X116: 0 | Y116: 3 | Z116: 0 | AA116: 94 | AB116: 191 | AC116: 49.21 | AD116: 0
A117: HAWTHORN | D117: DAVEY | F117: HENRY | I117: YEOMANS | L117: JACKSON | O117: W GAMBETTA | R117: TEAGUE
A118: GOALKICKERS
A119: FOOTSCRAY | D119: PARK 7 | G119: W DOOLAN 2 | J119: SAMSON | L119: O'DONOGHUE | O119: MARTIN
A120: HAWTHORN | D120: DAVEY 2 | G120: BURKE | I120: W GAMBETTA | L120: YEOMANS | O120: JACKSON
A122: NORTHCOTE | C122: 2 | D122: 1 | E122: =C122*6+D122 -> 13 | G122: 5 | H122: 5 | I122: =G122*6+H122 -> 35 | K122: 6 | L122: 6 | M122: =K122*6+L122 -> 42 | O122: 8 | P122: 12 | Q122: =O122*6+P122 -> 60 | S122: NORTHCOTE
A123: BRUNSWICK | C123: 0 | D123: 5 | E123: =C123*6+D123 -> 5 | G123: 1 | H123: 10 | I123: =G123*6+H123 -> 16 | K123: 5 | L123: 12 | M123: =K123*6+L123 -> 42 | O123: 7 | P123: 14 | Q123: =O123*6+P123 -> 56 | S123: McKINNON
A124: BEST PLAYERS
A125: NORTHCOTE | D125: COOMBS | G125: O'KEEFE | J125: COCKRAM | M125: SMITH | O125: G THORPE | R125: YATES
A126: BRUNSWICK | D126: ALESSIO | G126: MILLEN | J126: MAY | M126: SULLIVAN | O126: GOONAN | R126: MOORE
A127: GOALKICKERS
A128: NORTHCOTE | D128: WRAITH 3 | G128: COCKRAM 2 | J128: O'KEEFE | M128: KENNY | O128: THORPE
A129: BRUNSWICK | D129: SULLIVAN 3 | G129: MCMAHON 2 | J129: MILLEN | M129: TOPHAM
A131: ESSENDON ASSOC. | C131: 3 | D131: 0 | E131: =C131*6+D131 -> 18 | G131: 4 | H131: 8 | I131: =G131*6+H131 -> 32 | K131: 5 | L131: 9 | M131: =K131*6+L131 -> 39 | O131: 8 | P131: 10 | Q131: =O131*6+P131 -> 58 | S131: ESSENDON
A132: BRIGHTON | C132: 0 | D132: 3 | E132: =C132*6+D132 -> 3 | G132: 2 | H132: 5 | I132: =G132*6+H132 -> 17 | K132: 2 | L132: 6 | M132: =K132*6+L132 -> 18 | O132: 3 | P132: 9 | Q132: =O132*6+P132 -> 27 | S132: THOMPSON
A133: BEST PLAYERS
A134: ESSENDON ASSOC. | D134: WATT | G134: MORIARTY | J134: ADAMS | M134: KING | O134: MULCAHY
A135: BRIGHTON | D135: DANGERFIELD | G135: HOCKING | J135: RINGROSE | M135: P BOLAND
A136: GOALKICKERS
A137: ESSENDON ASSOC. | D137: MORIARTY 6 | H137: KING | J137: GILES
A138: BRIGHTON | D138: RINGROSE 2 | H138: HOCKING
A140: NORTH MELBOURNE | C140: 2 | D140: 7 | E140: =C140*6+D140 -> 19 | G140: 2 | H140: 11 | I140: =G140*6+H140 -> 23 | K140: 7 | L140: 15 | M140: =K140*6+L140 -> 57 | O140: 9 | P140: 17 | Q140: =O140*6+P140 -> 71 | S140: TOORAK PARK
A141: PRAHRAN | C141: 1 | D141: 2 | E141: =C141*6+D141 -> 8 | G141: 3 | H141: 5 | I141: =G141*6+H141 -> 23 | K141: 4 | L141: 9 | M141: =K141*6+L141 -> 33 | O141: 6 | P141: 10 | Q141: =O141*6+P141 -> 46 | S141: C PRITCHARD
A142: BEST PLAYERS
A143: NORTH MELBOURNE | D143: HARDY | G143: HILL | J143: O'CONNELL | M143: McKENZIE | P143: KEANE | S143: ELLINGSEN
A144: PRAHRAN | D144: E JONES | G144: V JONES | J144: MOORE | M144: BELLEVILLE | P144: MORONEY | S144: TOOHEY
A145: GOALKICKERS
A146: NORTH MELBOURNE | D146: MONOHAN 3 | G146: HILL 2 | I146: HARDY | L146: ELLINGSEN | O146: RAWLE | R146: SMITH
A147: PRAHRAN | D147: BRENNAN 2 | G147: SHARP 2 | I147: MORONEY | L147: M BAYLISS
A149: ROUND 4 | D149: 28TH MAY | J149: WEATHER | S149: PLAYED AT | X149: LADDER | AB149: ROUND | AD149: 4
D150: 1ST QTR | H150: 2ND QTR | L150: 3RD QTR | P150: FINAL | S150: FOOTSCRAY
A151: FOOTSCRAY | C151: 0 | D151: 2 | E151: =C151*6+D151 -> 2 | G151: 2 | H151: 4 | I151: =G151*6+H151 -> 16 | K151: 4 | L151: 5 | M151: =K151*6+L151 -> 29 | O151: 7 | P151: 8 | Q151: =O151*6+P151 -> 50 | S151: UMPIRE | W151: TEAM | X151: W | Y151: L | Z151: D | AA151: FOR | AB151: AGST | AC151: % | AD151: PTS
A152: NORTH MELBOURNE | C152: 1 | D152: 5 | E152: =C152*6+D152 -> 11 | G152: 4 | H152: 8 | I152: =G152*6+H152 -> 32 | K152: 4 | L152: 9 | M152: =K152*6+L152 -> 33 | O152: 6 | P152: 9 | Q152: =O152*6+P152 -> 45 | S152: THOMPSON
A153: BEST PLAYERS | W153: PORT MELBOURNE | X153: 4 | Y153: 0 | Z153: 0 | AA153: 328 | AB153: 175 | AC153: 187.42857142857142 | AD153: 16
A154: FOOTSCRAY | D154: McKENZIE | G154: SAMSON | I154: C GRIERSON | L154: PORTER | O154: HOLDEN | Q154: MAYBURY | W154: FOOTSCRAY | X154: 3 | Y154: 0 | Z154: 1 | AA154: 258 | AB154: 203 | AC154: 127.0935960591133 | AD154: 14
A155: NORTH MELBOURNE | D155: GARDINER | G155: KEANE | I155: BANNON | L155: WOODINGTON | O155: BARKER | Q155: HARDY | W155: NORTH MELBOURNE | X155: 3 | Y155: 1 | Z155: 0 | AA155: 283 | AB155: 166 | AC155: 170.48192771084337 | AD155: 12
A156: GOALKICKERS | W156: NORTHCOTE | X156: 3 | Y156: 1 | Z156: 0 | AA156: 256 | AB156: 239 | AC156: 107.11297071129707 | AD156: 12
A157: FOOTSCRAY | D157: DAVIDSON 2 | F157: W DOOLAN | I157: PARK | K157: BULT | M157: SAMSON | O157: PORTER
A158: NORTH MELBOURNE | D158: ELLINGSEN 2 | G158: SMITH | I158: RAWLE | K158: WALSH | M158: MONOHAN | W158: WILLIAMSTOWN | X158: 2 | Y158: 2 | Z158: 0 | AA158: 315 | AB158: 261 | AC158: 120.68965517241379 | AD158: 8
W159: BRUNSWICK | X159: 1 | Y159: 2 | Z159: 1 | AA159: 221 | AB159: 269 | AC159: 82.156133828996289 | AD159: 6
A160: PORT MELBOURNE | C160: 2 | D160: 4 | E160: =C160*6+D160 -> 16 | G160: 6 | H160: 10 | I160: =G160*6+H160 -> 46 | K160: 8 | L160: 14 | M160: =K160*6+L160 -> 62 | O160: 9 | P160: 20 | Q160: =O160*6+P160 -> 74 | S160: PORT MELB | W160: ESSENDON ASSOC. | X160: 1 | Y160: 3 | Z160: 0 | AA160: 213 | AB160: 246 | AC160: 86.58536585365853 | AD160: 4
A161: ESSENDON ASSOC. | C161: 1 | D161: 5 | E161: =C161*6+D161 -> 11 | G161: 1 | H161: 7 | I161: =G161*6+H161 -> 13 | K161: 2 | L161: 11 | M161: =K161*6+L161 -> 23 | O161: 3 | P161: 14 | Q161: =O161*6+P161 -> 32 | S161: McKINNON | W161: PRAHRAN | X161: 1 | Y161: 3 | Z161: 0 | AA161: 214 | AB161: 259 | AC161: 82.63 | AD161: 4
A162: BEST PLAYERS | W162: HAWTHORN | X162: 1 | Y162: 3 | Z162: 0 | AA162: 232 | AB162: 353 | AC162: 65.722379603399432 | AD162: 4
A163: PORT MELBOURNE | D163: WALTON | G163: HANDO | I163: FORBES | L163: RUDD | N163: MATTHEWS | Q163: PASH | W163: BRIGHTON | X163: 0 | Y163: 4 | Z163: 0 | AA163: 142 | AB163: 291 | AC163: 48.8 | AD163: 0
A164: ESSENDON ASSOC. | D164: WATT | G164: ADAMS | I164: MORIARTY | L164: GILES | N164: RUSSELL | Q164: FIELDING
A165: GOALKICKERS
A166: PORT MELBOURNE | D166: TAYLOR 4 | G166: LACKMAN 3 | K166: PASH | M166: WALTON
A167: ESSENDON ASSOC. | D167: MORIARTY | G167: JONES | J167: JOHNSON
A169: WILLIAMSTOWN | C169: 7 | D169: 3 | E169: =C169*6+D169 -> 45 | G169: 11 | H169: 5 | I169: =G169*6+H169 -> 71 | K169: 15 | L169: 9 | M169: =K169*6+L169 -> 99 | O169: 17 | P169: 13 | Q169: =O169*6+P169 -> 115 | S169: GLENFERRIE
A170: HAWTHORN | C170: 1 | D170: 2 | E170: =C170*6+D170 -> 8 | G170: 3 | H170: 5 | I170: =G170*6+H170 -> 23 | K170: 6 | L170: 8 | M170: =K170*6+L170 -> 44 | O170: 7 | P170: 14 | Q170: =O170*6+P170 -> 56 | S170: LOVELL
A171: BEST PLAYERS
A172: WILLIAMSTOWN | D172: GIESLER | G172: MOORE | J172: HAUGHTON | M172: McAULIFFE | P172: HARRISON
A173: HAWTHORN | D173: RUDOLPH | G173: ROBERTS | J173: RADEMACHER | M173: DAVEY | P173: EMPEY | S173: MCCASHNEY
A174: GOALKICKERS
A175: WILLIAMSTOWN | D175: GIESLER 4 | F175: MITCHELL 4 | I175: MUNRO 3 | K175: HAUGHTON 2 | N175: McAULIFFE 2 | Q175: BROWN | S175: JEFFRIES
A176: HAWTHORN | D176: HENRY 2 | F176: ROBERTS 2 | I176: MCCASHNEY 2 | L176: W GAMBETTA
A178: BRUNSWICK | C178: 0 | D178: 4 | E178: =C178*6+D178 -> 4 | G178: 3 | H178: 9 | I178: =G178*6+H178 -> 27 | K178: 4 | L178: 15 | M178: =K178*6+L178 -> 39 | O178: 8 | P178: 18 | Q178: =O178*6+P178 -> 66 | S178: TOORAK PARK
A179: PRAHRAN | C179: 1 | D179: 6 | E179: =C179*6+D179 -> 12 | G179: 4 | H179: 7 | I179: =G179*6+H179 -> 31 | K179: 6 | L179: 8 | M179: =K179*6+L179 -> 44 | O179: 8 | P179: 9 | Q179: =O179*6+P179 -> 57 | S179: JENKINS
A180: BEST PLAYERS
A181: BRUNSWICK | D181: WALKER | G181: McINERNEY | J181: ALESSIO | M181: SHAND | P181: MILLEN | S181: CAHILL
A182: PRAHRAN | D182: CORFIELD | G182: ALLISTER | J182: TOOHEY | M182: NAYLOR | P182: BELLEVILLE | S182: STRAWBRIDGE
A183: GOALKICKERS
A184: BRUNSWICK | D184: McMAHON 2 | G184: ALESSIO 2 | J184: KIELY 2 | M184: MOORE | O184: SULLIVAN
A185: PRAHRAN | D185: BRENNAN 3 | G185: NAYLOR 3 | J185: M BAYLISS | M185: ALLISTER
A187: NORTHCOTE | C187: 1 | D187: 6 | E187: =C187*6+D187 -> 12 | G187: 6 | H187: 10 | I187: =G187*6+H187 -> 46 | K187: 9 | L187: 13 | M187: =K187*6+L187 -> 67 | O187: 14 | P187: 16 | Q187: =O187*6+P187 -> 100 | S187: BRIGHTON BEACH
A188: BRIGHTON | C188: 1 | D188: 2 | E188: =C188*6+D188 -> 8 | G188: 3 | H188: 5 | I188: =G188*6+H188 -> 23 | K188: 5 | L188: 5 | M188: =K188*6+L188 -> 35 | O188: 7 | P188: 6 | Q188: =O188*6+P188 -> 48 | S188: GILLARD
A189: BEST PLAYERS
A190: NORTHCOTE | D190: COCKRAM | G190: HELWIG | J190: STONE | M190: PURCELL | P190: MAYFIELD | S190: COOMBS
A191: BRIGHTON | D191: McCARTHY | G191: P BOLAND | J191: RINGROSE | M191: CARROLL | P191: BANNISTER | S191: WYATT
A192: GOALKICKERS
A193: NORTHCOTE | D193: COCKRAM 4 | G193: HELWIG 4 | I193: YATES 2 | K193: KENNY | M193: DOWNES | O193: WRAITH | Q193: O'KEEFE
A194: BRIGHTON | D194: RINGROSE 3 | G194: McCARTHY 2 | J194: KEOGH | L194: BORLAND
A196: ROUND 5 | E196: 4TH JUNE | J196: WEATHER | M196: FINE NORTH WIND | S196: PLAYED AT | X196: LADDER | AB196: ROUND | AD196: 5
D197: 1ST QTR | H197: 2ND QTR | L197: 3RD QTR | P197: FINAL | S197: GLENFERRIE
A198: NORTHCOTE | C198: 4 | D198: 4 | E198: =C198*6+D198 -> 28 | G198: 7 | H198: 7 | I198: =G198*6+H198 -> 49 | K198: 10 | L198: 12 | M198: =K198*6+L198 -> 72 | O198: 13 | P198: 15 | Q198: =O198*6+P198 -> 93 | S198: UMPIRE | W198: TEAM | X198: W | Y198: L | Z198: D | AA198: FOR | AB198: AGST | AC198: % | AD198: PTS
A199: HAWTHORN | C199: 4 | D199: 4 | E199: =C199*6+D199 -> 28 | G199: 4 | H199: 9 | I199: =G199*6+H199 -> 33 | K199: 7 | L199: 11 | M199: =K199*6+L199 -> 53 | O199: 9 | P199: 14 | Q199: =O199*6+P199 -> 68 | S199: SHELLEY
A200: BEST PLAYERS | W200: FOOTSCRAY | X200: 4 | Y200: 0 | Z200: 1 | AA200: 313 | AB200: 246 | AC200: 127.23577235772358 | AD200: 18
A201: NORTHCOTE | D201: WRAITH | F201: COCKRAM | I201: MILLS | K201: O'KEEFE | N201: SMITH | Q201: POWELL | W201: NORTH MELBOURNE | X201: 4 | Y201: 1 | Z201: 0 | AA201: 335 | AB201: 198 | AC201: 169.1919191919192 | AD201: 16
A202: HAWTHORN | D202: YEOMANS | F202: DAVEY | I202: RADEMACHER | L202: RUDOLPH | N202: C GAMBETTA | Q202: WALLIS | W202: PORT MELBOURNE | X202: 4 | Y202: 1 | Z202: 0 | AA202: 360 | AB202: 227 | AC202: 158.59030837004406 | AD202: 16
A203: GOALKICKERS | W203: NORTHCOTE | X203: 4 | Y203: 1 | Z203: 0 | AA203: 349 | AB203: 307 | AC203: 113.68078175895765 | AD203: 16
A204: NORTHCOTE | D204: WRAITH 5 | G204: W THORPE 3 | J204: MILLS 3 | L204: POWDITCH | N204: GRAY
A205: HAWTHORN | D205: C GAMBETTA 2 | G205: YEOMANS 2 | J205: HENRY | L205: WALLIS | N205: RUDOLPH | P205: McCASHNEY | S205: NOONAN | W205: WILLIAMSTOWN | X205: 3 | Y205: 2 | Z205: 0 | AA205: 405 | AB205: 306 | AC205: 132.35294117647058 | AD205: 12
W206: BRUNSWICK | X206: 2 | Y206: 2 | Z206: 1 | AA206: 272 | AB206: 304 | AC206: 89.473684210526315 | AD206: 10
A207: WILLIAMSTOWN | C207: 3 | D207: 4 | E207: =C207*6+D207 -> 22 | G207: 6 | H207: 6 | I207: =G207*6+H207 -> 42 | K207: 11 | L207: 8 | M207: =K207*6+L207 -> 74 | O207: 13 | P207: 12 | Q207: =O207*6+P207 -> 90 | S207: WILLIAMSTOWN | W207: ESSENDON ASSOC. | X207: 1 | Y207: 4 | Z207: 0 | AA207: 248 | AB207: 297 | AC207: 83.501683501683502 | AD207: 4
A208: BRIGHTON | C208: 1 | D208: 1 | E208: =C208*6+D208 -> 7 | G208: 2 | H208: 5 | I208: =G208*6+H208 -> 17 | K208: 3 | L208: 7 | M208: =K208*6+L208 -> 25 | O208: 6 | P208: 9 | Q208: =O208*6+P208 -> 45 | S208: THOMPSON | W208: PRAHRAN | X208: 1 | Y208: 4 | Z208: 0 | AA208: 257 | AB208: 314 | AC208: 81.85 | AD208: 4
A209: BEST PLAYERS | W209: HAWTHORN | X209: 1 | Y209: 4 | Z209: 0 | AA209: 300 | AB209: 446 | AC209: 67.264573991031384 | AD209: 4
A210: WILLIAMSTOWN | D210: McAULIFFE | G210: ANDERSON | J210: CALDWELL | M210: TRUEMAN | O210: BROWN | Q210: HAUGHTON | W210: BRIGHTON | X210: 0 | Y210: 5 | Z210: 0 | AA210: 187 | AB210: 381 | AC210: 49.08 | AD210: 0
A211: BRIGHTON | D211: MCCARTHY | G211: M BOLAND | J211: HOCKING | M211: HATTAM | O211: RINGROSE | Q211: WYATT
A212: GOALKICKERS
A213: WILLIAMSTOWN | D213: McAULIFFE 6 | G213: CONDON 3 | J213: HARDEN 2 | M213: TRUEMAN | P213: GIESLER
A214: BRIGHTON | D214: HOCKING 2 | G214: KEOGH 2 | J214: BOWMAN | M214: McCARTHY
A216: FOOTSCRAY | C216: 2 | D216: 5 | E216: =C216*6+D216 -> 17 | G216: 3 | H216: 7 | I216: =G216*6+H216 -> 25 | K216: 7 | L216: 11 | M216: =K216*6+L216 -> 53 | O216: 7 | P216: 13 | Q216: =O216*6+P216 -> 55 | S216: TOORAK PARK
A217: PRAHRAN | C217: 0 | D217: 2 | E217: =C217*6+D217 -> 2 | G217: 2 | H217: 4 | I217: =G217*6+H217 -> 16 | K217: 4 | L217: 6 | M217: =K217*6+L217 -> 30 | O217: 6 | P217: 7 | Q217: =O217*6+P217 -> 43 | S217: McKINNON
A218: BEST PLAYERS
A219: FOOTSCRAY | D219: GOVAN | G219: HOWELL | J219: O'DONOGHUE | M219: O'BRIEN | P219: W DOOLAN | S219: PARK
A220: PRAHRAN | D220: CHAPMAN | G220: V JONES | J220: CORFIELD | M220: DINGWALL | P220: BRENNAN | S220: LOVE
A221: GOALKICKERS
A222: FOOTSCRAY | D222: W DOOLAN 2 | G222: PARK 2 | I222: NAGLE | K222: McKENZIE | N222: SMITH
A223: PRAHRAN | D223: BRENNAN 2 | G223: LOVE 2 | I223: STRAWBRIDGE | L223: NAYLOR
E224: 6TH JUNE
A225: NORTH MELBOURNE | C225: 2 | D225: 3 | E225: =C225*6+D225 -> 15 | G225: 2 | H225: 6 | I225: =G225*6+H225 -> 18 | K225: 4 | L225: 9 | M225: =K225*6+L225 -> 33 | O225: 6 | P225: 16 | Q225: =O225*6+P225 -> 52 | S225: NORTH MELB
A226: PORT MELBOURNE | C226: 2 | D226: 1 | E226: =C226*6+D226 -> 13 | G226: 3 | H226: 4 | I226: =G226*6+H226 -> 22 | K226: 3 | L226: 7 | M226: =K226*6+L226 -> 25 | O226: 4 | P226: 8 | Q226: =O226*6+P226 -> 32 | S226: KAIN
A227: BEST PLAYERS
A228: NORTH MELBOURNE | D228: HARDY | G228: McKENZIE | J228: ELLINGSEN | M228: GARDINER | P228: BARKER | S228: RAWLE
A229: PORT MELBOURNE | D229: WALTON | G229: NANCARROW | J229: STANFORD | M229: TAYLOR | P229: MATTHEWS | S229: WILDING
A230: GOALKICKERS
A231: NORTH MELBOURNE | D231: MONOGHAN 3 | G231: RAWLE | I231: O'CONNOR | L231: WALSH
A232: PORT MELBOURNE | D232: DILLON 2 | G232: JOHNSON | I232: TAYLOR
A234: BRUNSWICK | C234: 2 | D234: 3 | E234: =C234*6+D234 -> 15 | G234: 2 | H234: 5 | I234: =G234*6+H234 -> 17 | K234: 2 | L234: 10 | M234: =K234*6+L234 -> 22 | O234: 6 | P234: 15 | Q234: =O234*6+P234 -> 51 | S234: BRUNSWICK
A235: ESSENDON ASSOC. | C235: 3 | D235: 1 | E235: =C235*6+D235 -> 19 | G235: 5 | H235: 4 | I235: =G235*6+H235 -> 34 | K235: 5 | L235: 5 | M235: =K235*6+L235 -> 35 | O235: 5 | P235: 5 | Q235: =O235*6+P235 -> 35 | S235: JENKINS
A236: BEST PLAYERS
A237: BRUNSWICK | D237: McINERNEY | G237: CAHILL | J237: MAY | M237: SWIFT | O237: ALESSIO | Q237: MOORE
A238: ESSENDON ASSOC. | D238: WATT | G238: ADAMS | J238: SULLIVAN | M238: GILES | O238: SHORTEN | Q238: KING
A239: GOALKICKERS
A240: BRUNSWICK | D240: MAY 2 | G240: SULLIVAN | J240: CAHILL | L240: MOORE | N240: ALESSIO
A241: ESSENDON ASSOC. | D241: MORIARTY 2 | G241: JOHNSON | I241: WALKER | K241: FIELDING
A243: ROUND 6 | D243: 11TH JUNE | J243: WEATHER | M243: FINE NORTH BREEZE | S243: PLAYED AT | X243: LADDER | AB243: ROUND | AD243: 6
D244: 1ST QTR | H244: 2ND QTR | L244: 3RD QTR | P244: FINAL | S244: BRUNSWICK
A245: BRUNSWICK | C245: 3 | D245: 2 | E245: =C245*6+D245 -> 20 | G245: 7 | H245: 3 | I245: =G245*6+H245 -> 45 | K245: 8 | L245: 8 | M245: =K245*6+L245 -> 56 | O245: 10 | P245: 13 | Q245: =O245*6+P245 -> 73 | S245: UMPIRE | W245: TEAM | X245: W | Y245: L | Z245: D | AA245: FOR | AB245: AGST | AC245: % | AD245: PTS
A246: NORTH MELBOURNE | C246: 3 | D246: 2 | E246: =C246*6+D246 -> 20 | G246: 3 | H246: 4 | I246: =G246*6+H246 -> 22 | K246: 6 | L246: 6 | M246: =K246*6+L246 -> 42 | O246: 8 | P246: 11 | Q246: =O246*6+P246 -> 59 | S246: KAIN
A247: BEST PLAYERS | W247: FOOTSCRAY | X247: 5 | Y247: 0 | Z247: 1 | AA247: 370 | AB247: 277 | AC247: 133.5740072202166 | AD247: 22
A248: BRUNSWICK | D248: McMAHON | G248: SULLIVAN | J248: ALESSIO | M248: ADAMS | P248: MAY | R248: SHAND | W248: PORT MELBOURNE | X248: 5 | Y248: 1 | Z248: 0 | AA248: 436 | AB248: 285 | AC248: 152.98245614035088 | AD248: 20
A249: NORTH MELBOURNE | D249: RAWLE | G249: HARDY | J249: TOOHEY | M249: TUCK | P249: JAMES | R249: McKENZIE | W249: NORTHCOTE | X249: 5 | Y249: 1 | Z249: 0 | AA249: 451 | AB249: 366 | AC249: 123.22404371584699 | AD249: 20
A250: GOALKICKERS | W250: NORTH MELBOURNE | X250: 4 | Y250: 2 | Z250: 0 | AA250: 394 | AB250: 271 | AC250: 145.38745387453875 | AD250: 16
A251: BRUNSWICK | D251: MILLEN 3 | G251: MCMAHON 2 | J251: SULLIVAN 2 | M251: BOYCE 2 | O251: CHRISTIE
A252: NORTH MELBOURNE | D252: TOOHEY 3 | G252: MONOHAN | J252: BARKER | L252: McGREGOR | N252: WALSH | P252: RAWLE | W252: WILLIAMSTOWN | X252: 4 | Y252: 2 | Z252: 0 | AA252: 472 | AB252: 371 | AC252: 127.22371967654986 | AD252: 16
W253: BRUNSWICK | X253: 3 | Y253: 2 | Z253: 1 | AA253: 345 | AB253: 363 | AC253: 95.04132231404958 | AD253: 14
A254: WILLIAMSTOWN | C254: 1 | D254: 3 | E254: =C254*6+D254 -> 9 | G254: 4 | H254: 7 | I254: =G254*6+H254 -> 31 | K254: 4 | L254: 8 | M254: =K254*6+L254 -> 32 | O254: 9 | P254: 13 | Q254: =O254*6+P254 -> 67 | S254: ESSENDON | W254: ESSENDON ASSOC. | X254: 1 | Y254: 5 | Z254: 0 | AA254: 313 | AB254: 364 | AC254: 85.989010989010993 | AD254: 4
A255: ESSENDON ASSOC. | C255: 3 | D255: 6 | E255: =C255*6+D255 -> 24 | G255: 5 | H255: 7 | I255: =G255*6+H255 -> 37 | K255: 9 | L255: 10 | M255: =K255*6+L255 -> 64 | O255: 9 | P255: 11 | Q255: =O255*6+P255 -> 65 | S255: J KAIN | W255: PRAHRAN | X255: 1 | Y255: 5 | Z255: 0 | AA255: 316 | AB255: 416 | AC255: 75.96 | AD255: 4
A256: BEST PLAYERS | W256: HAWTHORN | X256: 1 | Y256: 5 | Z256: 0 | AA256: 358 | AB256: 522 | AC256: 68.582375478927204 | AD256: 4
A257: WILLIAMSTOWN | D257: CARPENTER | G257: TRUEMAN | I257: CALDWELL | L257: HAUGHTON | O257: N McDONALD | R257: MITCHELL | W257: BRIGHTON | X257: 0 | Y257: 6 | Z257: 0 | AA257: 218 | AB257: 438 | AC257: 49.77 | AD257: 0
A258: ESSENDON ASSOC. | D258: WATT | G258: ADAMS | I258: BOLAN | L258: KING | O258: STROWNIX | R258: MORIARTY
A259: GOALKICKERS
A260: WILLIAMSTOWN | D260: CARPENTER 4 | G260: MITCHELL 2 | J260: McAULIFFE 2 | M260: HAUGHTON
A261: ESSENDON ASSOC. | D261: KING 3 | G261: FRASER 2 | J261: WALKER | L261: STROWNIX | N261: WILSON | P261: MORIARTY
A263: PORT MELBOURNE | C263: 3 | D263: 5 | E263: =C263*6+D263 -> 23 | G263: 6 | H263: 10 | I263: =G263*6+H263 -> 46 | K263: 7 | L263: 15 | M263: =K263*6+L263 -> 57 | O263: 10 | P263: 16 | Q263: =O263*6+P263 -> 76 | S263: GLENFERRIE
A264: HAWTHORN | C264: 3 | D264: 1 | E264: =C264*6+D264 -> 19 | G264: 6 | H264: 4 | I264: =G264*6+H264 -> 40 | K264: 6 | L264: 7 | M264: =K264*6+L264 -> 43 | O264: 8 | P264: 10 | Q264: =O264*6+P264 -> 58 | S264: SHELLEY
A265: BEST PLAYERS
A266: PORT MELBOURNE | D266: LACKMAN | G266: WALTON | J266: MATTHEWS | M266: BARFOOT | P266: DILLON | S266: T O'BRIEN
A267: HAWTHORN | D267: JOHNSON | G267: C GAMBETTA | J267: YEOMANS | M267: HENRY | P267: RADEMACHER | S267: McCASHNEY
A268: GOALKICKERS
A269: PORT MELBOURNE | D269: TAYLOR 4 | G269: LACKMAN 3 | J269: BENCE | L269: STANFORD | O269: BARFOOT
A270: HAWTHORN | D270: YEOMANS 3 | G270: C GAMBETTA 2 | J270: HENRY 2 | L270: WILSON
A272: NORTHCOTE | C272: 5 | D272: 2 | E272: =C272*6+D272 -> 32 | G272: 8 | H272: 5 | I272: =G272*6+H272 -> 53 | K272: 11 | L272: 8 | M272: =K272*6+L272 -> 74 | O272: 15 | P272: 12 | Q272: =O272*6+P272 -> 102 | S272: NORTHCOTE
A273: PRAHRAN | C273: 3 | D273: 1 | E273: =C273*6+D273 -> 19 | G273: 3 | H273: 2 | I273: =G273*6+H273 -> 20 | K273: 7 | L273: 5 | M273: =K273*6+L273 -> 47 | O273: 9 | P273: 5 | Q273: =O273*6+P273 -> 59 | S273: McKINNON
A274: BEST PLAYERS
A275: NORTHCOTE | D275: MILLS | G275: W THORPE | J275: KENNY | M275: POWDITCH | P275: COCKRAM | S275: WRAITH
A276: PRAHRAN | D276: BRENNAN | G276: NAYLOR | J276: HALLETT | M276: STRAWBRIDGE | P276: V JONES | S276: GIBB
A277: GOALKICKERS
A278: NORTHCOTE | D278: W THORPE 5 | G278: KENNY 4 | J278: POWDITCH 3 | M278: O'KEEFE | O278: MILLS | Q278: WRAITH
A279: PRAHRAN | D279: BRENNAN 4 | G279: CHAPMAN 2 | J279: GREAVES 2 | M279: STRAWBRIDGE
A281: FOOTSCRAY | C281: 4 | D281: 3 | E281: =C281*6+D281 -> 27 | G281: 4 | H281: 4 | I281: =G281*6+H281 -> 28 | K281: 5 | L281: 11 | M281: =K281*6+L281 -> 41 | O281: 7 | P281: 15 | Q281: =O281*6+P281 -> 57 | S281: FOOTSCRAY
A282: BRIGHTON | C282: 0 | D282: 1 | E282: =C282*6+D282 -> 1 | G282: 1 | H282: 4 | I282: =G282*6+H282 -> 10 | K282: 1 | L282: 4 | M282: =K282*6+L282 -> 10 | O282: 4 | P282: 7 | Q282: =O282*6+P282 -> 31 | S282: JENKINS
A283: BEST PLAYERS
A284: FOOTSCRAY | D284: O'DONOGHUE | G284: VALENTINE | J284: PARK | L284: BULT | O284: BANBURY | R284: GOVAN
A285: BRIGHTON | D285: BORLAND | G285: RINGROSE | J285: HOCKING | L285: BANNISTER | O285: MCCARTHY | R285: HOCKING
A286: GOALKICKERS
A287: FOOTSCRAY | D287: O'DONOGHUE 3 | H287: PARK 2 | K287: MAYBURY | N287: BULT
A288: BRIGHTON | D288: HOCKING 4
A290: ROUND 7 | D290: 18TH JUNE | J290: WEATHER | M290: COOL SHOWERS N.W. WIND | S290: PLAYED AT | X290: LADDER | AB290: ROUND | AD290: 7
D291: 1ST QTR | H291: 2ND QTR | L291: 3RD QTR | P291: FINAL | S291: PORT MELB
A292: PORT MELBOURNE | C292: 3 | D292: 8 | E292: =C292*6+D292 -> 26 | G292: 5 | H292: 9 | I292: =G292*6+H292 -> 39 | K292: 6 | L292: 14 | M292: =K292*6+L292 -> 50 | O292: 9 | P292: 16 | Q292: =O292*6+P292 -> 70 | S292: UMPIRE | W292: TEAM | X292: W | Y292: L | Z292: D | AA292: FOR | AB292: AGST | AC292: % | AD292: PTS
A293: FOOTSCRAY | C293: 2 | D293: 1 | E293: =C293*6+D293 -> 13 | G293: 4 | H293: 4 | I293: =G293*6+H293 -> 28 | K293: 6 | L293: 6 | M293: =K293*6+L293 -> 42 | O293: 8 | P293: 10 | Q293: =O293*6+P293 -> 58 | S293: SHELLEY
A294: BEST PLAYERS | W294: PORT MELBOURNE | X294: 6 | Y294: 1 | Z294: 0 | AA294: 506 | AB294: 343 | AC294: 147.52186588921282 | AD294: 24
A295: PORT MELBOURNE | D295: WALTON | G295: MATTHEWS | J295: T O'BRIEN | M295: DILLON | O295: PASH | Q295: SANDFORD | W295: NORTHCOTE | X295: 6 | Y295: 1 | Z295: 0 | AA295: 512 | AB295: 405 | AC295: 126.41975308641975 | AD295: 24
A296: FOOTSCRAY | D296: BULT | G296: SHERRY | J296: McKENZIE | M296: GOVAN | O296: SMITH | Q296: J O'BRIEN | W296: FOOTSCRAY | X296: 5 | Y296: 1 | Z296: 1 | AA296: 428 | AB296: 347 | AC296: 123.342939481268 | AD296: 22
A297: GOALKICKERS | W297: NORTH MELBOURNE | X297: 5 | Y297: 2 | Z297: 0 | AA297: 458 | AB297: 309 | AC297: 148.2200647249191 | AD297: 20
A298: PORT MELBOURNE | D298: BENCE 3 | G298: TAYLOR 2 | J298: LACKMAN 2 | M298: DILLON | O298: BARFOOT
A299: FOOTSCRAY | D299: McKENZIE 2 | G299: HOWELL 2 | J299: C GRIERSON 2 | M299: O'DONONGHUE | P299: SAMSON | W299: BRUNSWICK | X299: 4 | Y299: 2 | Z299: 1 | AA299: 428 | AB299: 398 | AC299: 107.53768844221105 | AD299: 18
W300: WILLIAMSTOWN | X300: 4 | Y300: 3 | Z300: 0 | AA300: 511 | AB300: 432 | AC300: 118.28703703703704 | AD300: 16
A301: NORTHCOTE | C301: 2 | D301: 0 | E301: =C301*6+D301 -> 12 | G301: 4 | H301: 3 | I301: =G301*6+H301 -> 27 | K301: 7 | L301: 5 | M301: =K301*6+L301 -> 47 | O301: 9 | P301: 7 | Q301: =O301*6+P301 -> 61 | S301: NORTHCOTE | W301: HAWTHORN | X301: 2 | Y301: 5 | Z301: 0 | AA301: 441 | AB301: 586 | AC301: 75.255972696245735 | AD301: 8
A302: WILLIAMSTOWN | C302: 0 | D302: 3 | E302: =C302*6+D302 -> 3 | G302: 1 | H302: 5 | I302: =G302*6+H302 -> 11 | K302: 4 | L302: 7 | M302: =K302*6+L302 -> 31 | O302: 5 | P302: 9 | Q302: =O302*6+P302 -> 39 | S302: KAIN | W302: ESSENDON ASSOC. | X302: 1 | Y302: 6 | Z302: 0 | AA302: 351 | AB302: 428 | AC302: 82.00934579439253 | AD302: 4
A303: BEST PLAYERS | W303: PRAHRAN | X303: 1 | Y303: 6 | Z303: 0 | AA303: 380 | AB303: 499 | AC303: 76.15 | AD303: 4
A304: NORTHCOTE | D304: O'KEEFE | G304: SMITH | J304: STONE | M304: MILLS | O304: COCKRAM | Q304: WRAITH | W304: BRIGHTON | X304: 0 | Y304: 7 | Z304: 0 | AA304: 253 | AB304: 521 | AC304: 48.56 | AD304: 0
A305: WILLIAMSTOWN | D305: HAUGHTON | G305: MITCHELL | J305: SMITH | M305: HARDEN | O305: MUNRO | Q305: TRUMAN
A306: GOALKICKERS
A307: NORTHCOTE | D307: WRAITH | F307: FERRIS | H307: G SHARPE | J307: O'KEEFE | L307: POWDITCH | N307: W THORPE | Q307: MILLS | S307: HELWIG | U307: KENNY
A308: WILLIAMSTOWN | D308: HARDEN 3 | G308: MUNRO | I308: McAULIFFE
A310: NORTH MELBOURNE | C310: 3 | D310: 3 | E310: =C310*6+D310 -> 21 | G310: 5 | H310: 6 | I310: =G310*6+H310 -> 36 | K310: 8 | L310: 6 | M310: =K310*6+L310 -> 54 | O310: 9 | P310: 10 | Q310: =O310*6+P310 -> 64 | S310: NORTH MELB
A311: ESSENDON ASSOC. | C311: 3 | D311: 5 | E311: =C311*6+D311 -> 23 | G311: 4 | H311: 5 | I311: =G311*6+H311 -> 29 | K311: 5 | L311: 5 | M311: =K311*6+L311 -> 35 | O311: 5 | P311: 8 | Q311: =O311*6+P311 -> 38 | S311: RILEY
A312: BEST PLAYERS
A313: NORTH MELBOURNE | D313: HARDY | G313: MONOHAN | J313: ELLINGSEN | M313: BARKER | P313: CLAPSON | R313: J WALSH
A314: ESSENDON ASSOC. | D314: KING | G314: WATT | J314: JOHNSON | M314: SHORTEN | P314: ADAMS | R314: FIELDING
A315: GOALKICKERS
A316: NORTH MELBOURNE | D316: J WALSH 4 | G316: MONOHAN 2 | J316: RAWLE | L316: TREVASKIS | O316: TUCK
A317: ESSENDON ASSOC. | D317: MORIARTY 2 | H317: STROWNIX | K317: AMESS | N317: FRASER
A319: HAWTHORN | C319: 1 | D319: 2 | E319: =C319*6+D319 -> 8 | G319: 6 | H319: 6 | I319: =G319*6+H319 -> 42 | K319: 8 | L319: 9 | M319: =K319*6+L319 -> 57 | O319: 12 | P319: 11 | Q319: =O319*6+P319 -> 83 | S319: TOORAK PARK
A320: PRAHRAN | C320: 5 | D320: 6 | E320: =C320*6+D320 -> 36 | G320: 5 | H320: 9 | I320: =G320*6+H320 -> 39 | K320: 8 | L320: 10 | M320: =K320*6+L320 -> 58 | O320: 9 | P320: 10 | Q320: =O320*6+P320 -> 64 | S320: JENKINS
A321: BEST PLAYERS
A322: HAWTHORN | D322: C GAMBETTA | G322: DAVEY | J322: HENRY | M322: JACKSON | P322: McCASHNEY | S322: TEAGUE
A323: PRAHRAN | D323: CORFIELD | G323: HALLETT | J323: NAYLOR | M323: BRENNAN | P323: MORONEY | S323: V JONES
A324: GOALKICKERS
A325: HAWTHORN | D325: C GAMBETTA 6 | H325: WILSON 2 | K325: YEOMANS 2 | N325: JACKSON | P325: NOONAN
A326: PRAHRAN | D326: BRENNAN 3 | G326: NAYLOR 2 | J326: LOVE 2 | L326: HALLETT | N326: MOORE
A328: BRUNSWICK | C328: 2 | D328: 3 | E328: =C328*6+D328 -> 15 | G328: 5 | H328: 5 | I328: =G328*6+H328 -> 35 | K328: 7 | L328: 7 | M328: =K328*6+L328 -> 49 | O328: 12 | P328: 11 | Q328: =O328*6+P328 -> 83 | S328: BRIGHTON BEACH
A329: BRIGHTON | C329: 3 | D329: 2 | E329: =C329*6+D329 -> 20 | G329: 3 | H329: 2 | I329: =G329*6+H329 -> 20 | K329: 3 | L329: 6 | M329: =K329*6+L329 -> 24 | O329: 4 | P329: 11 | Q329: =O329*6+P329 -> 35
A330: BEST PLAYERS
A331: BRUNSWICK | D331: McMAHON | G331: ALESSIO | J331: FAUST | M331: MAY | O331: SULLIVAN | Q331: GOONAN
A332: BRIGHTON | D332: ACKERS | G332: DANGERFIELD | J332: DUNCAN | M332: M BOLAND | P332: BORLAND | R332: P BOLAND
A333: GOALKICKERS
A334: BRUNSWICK | D334: MAY 4 | G334: SWIFT 2 | I334: MARSHALL | L334: MOORE | N334: McMAHON | Q334: BOYCE | S334: ALESSIO | V334: CHRISTIE
A335: BRIGHTON | D335: DUNCAN | G335: DANGERFIELD | K335: BANNISTER | N335: WYATT
A337: ROUND 8 | D337: 25TH JUNE | J337: WEATHER | M337: FINE COLD | S337: PLAYED AT | X337: LADDER | AB337: ROUND | AD337: 8
D338: 1ST QTR | H338: 2ND QTR | L338: 3RD QTR | P338: FINAL | S338: NORTHCOTE
A339: NORTHCOTE | C339: 2 | D339: 4 | E339: =C339*6+D339 -> 16 | G339: 6 | H339: 9 | I339: =G339*6+H339 -> 45 | K339: 10 | L339: 12 | M339: =K339*6+L339 -> 72 | O339: 14 | P339: 16 | Q339: =O339*6+P339 -> 100 | S339: UMPIRE | W339: TEAM | X339: W | Y339: L | Z339: D | AA339: FOR | AB339: AGST | AC339: % | AD339: PTS
A340: NORTH MELBOURNE | C340: 0 | D340: 2 | E340: =C340*6+D340 -> 2 | G340: 2 | H340: 4 | I340: =G340*6+H340 -> 16 | K340: 3 | L340: 12 | M340: =K340*6+L340 -> 30 | O340: 5 | P340: 11 | Q340: =O340*6+P340 -> 41 | S340: SHELLEY
A341: BEST PLAYERS | W341: PORT MELBOURNE | X341: 7 | Y341: 1 | Z341: 0 | AA341: 656 | AB341: 377 | AC341: 174.0053050397878 | AD341: 28
A342: NORTHCOTE | D342: SMITH | F342: MILLS | I342: YATES | L342: GITTENS | O342: O'KEEFE | Q342: COCKRAM | W342: NORTHCOTE | X342: 7 | Y342: 1 | Z342: 0 | AA342: 612 | AB342: 446 | AC342: 137.21973094170403 | AD342: 28
A343: NORTH MELBOURNE | D343: HARDY | F343: ELLINGSEN | I343: McKENZIE | L343: O'CONNELL | O343: TUCK | Q343: MILES | W343: FOOTSCRAY | X343: 6 | Y343: 1 | Z343: 1 | AA343: 548 | AB343: 422 | AC343: 129.85781990521326 | AD343: 26
A344: GOALKICKERS | Q344: BUISST | S344: MILLS | W344: BRUNSWICK | X344: 5 | Y344: 2 | Z344: 1 | AA344: 493 | AB344: 454 | AC344: 108.59030837004406 | AD344: 22
A345: NORTHCOTE | D345: SMITH 3 | F345: WRAITH 2 | I345: O'KEEFE 2 | K345: W THORPE 2 | N345: KELLY | P345: G THORPE | R345: COCKRAM
A346: NORTH MELBOURNE | D346: HARDY | F346: SMITH | H346: MONOHAN | J346: CLARK | L346: IRWIN | W346: NORTH MELBOURNE | X346: 5 | Y346: 3 | Z346: 0 | AA346: 499 | AB346: 409 | AC346: 122.00488997555013 | AD346: 20
W347: WILLIAMSTOWN | X347: 4 | Y347: 4 | Z347: 0 | AA347: 567 | AB347: 497 | AC347: 114.08450704225352 | AD347: 16
A348: BRUNSWICK | C348: 2 | D348: 6 | E348: =C348*6+D348 -> 18 | G348: 4 | H348: 13 | I348: =G348*6+H348 -> 37 | K348: 6 | L348: 15 | M348: =K348*6+L348 -> 51 | O348: 8 | P348: 17 | Q348: =O348*6+P348 -> 65 | S348: WILLIAMSTOWN | W348: HAWTHORN | X348: 3 | Y348: 5 | Z348: 0 | AA348: 554 | AB348: 637 | AC348: 86.970172684458404 | AD348: 12
A349: WILLIAMSTOWN | C349: 4 | D349: 1 | E349: =C349*6+D349 -> 25 | G349: 4 | H349: 2 | I349: =G349*6+H349 -> 26 | K349: 6 | L349: 4 | M349: =K349*6+L349 -> 40 | O349: 8 | P349: 8 | Q349: =O349*6+P349 -> 56 | S349: KAIN | W349: ESSENDON ASSOC. | X349: 1 | Y349: 7 | Z349: 0 | AA349: 426 | AB349: 548 | AC349: 77.737226277372258 | AD349: 4
A350: BEST PLAYERS | W350: PRAHRAN | X350: 1 | Y350: 7 | Z350: 0 | AA350: 414 | AB350: 649 | AC350: 63.79 | AD350: 4
A351: BRUNSWICK | D351: MOORE | G351: ALESSIO | I351: STEPHENSON | L351: HASSETT | N351: McMAHON | Q351: CAHILL | W351: BRIGHTON | X351: 0 | Y351: 8 | Z351: 0 | AA351: 304 | AB351: 634 | AC351: 47.95 | AD351: 0
A352: WILLIAMSTOWN | D352: MITCHELL | G352: CONDON | I352: CALDWELL | L352: MUNRO | N352: HARDEN | Q352: FAIRLESS
A353: GOALKICKERS
A354: BRUNSWICK | D354: SULLIVAN 2 | G354: McMAHON 2 | J354: MAY 2 | L354: HASSETT | O354: WOOLLARD
A355: WILLIAMSTOWN | D355: HAUGHTON 3 | G355: HARDEN 2 | J355: MITCHELL 2 | M355: CARPENTER
A357: HAWTHORN | C357: 7 | D357: 4 | E357: =C357*6+D357 -> 46 | G357: 9 | H357: 11 | I357: =G357*6+H357 -> 65 | K357: 13 | L357: 13 | M357: =K357*6+L357 -> 91 | O357: 16 | P357: 17 | Q357: =O357*6+P357 -> 113 | S357: GLENFERRIE
A358: BRIGHTON | C358: 0 | D358: 2 | E358: =C358*6+D358 -> 2 | G358: 2 | H358: 3 | I358: =G358*6+H358 -> 15 | K358: 4 | L358: 13 | M358: =K358*6+L358 -> 37 | O358: 6 | P358: 15 | Q358: =O358*6+P358 -> 51 | S358: KAIN
A359: BEST PLAYERS
A360: HAWTHORN | D360: JACKSON | F360: YEOMANS | I360: C GAMBETTA | L360: HENRY | N360: BURKE | Q360: TEAGUE
A361: BRIGHTON | D361: CARROLL | F361: DUNCAN | I361: McCARTHY | L361: RINGROSE | N361: COLLINS | Q361: DANGERFIELD
A362: GOALKICKERS
A363: HAWTHORN | D363: C GAMBETTA 5 | G363: YEOMANS 4 | J363: WILSON 2 | M363: HENRY | O363: ROBERTS | Q363: DOOLAN | S363: W GAMBETTA
A364: BRIGHTON | D364: McCARTHY 3 | G364: RINGROSE 2 | J364: M BOLAND
A366: FOOTSCRAY | C366: 4 | D366: 4 | E366: =C366*6+D366 -> 28 | G366: 6 | H366: 9 | I366: =G366*6+H366 -> 45 | K366: 11 | L366: 12 | M366: =K366*6+L366 -> 78 | O366: 17 | P366: 18 | Q366: =O366*6+P366 -> 120 | S366: ESSENDON
A367: ESSENDON ASSOC. | C367: 1 | D367: 3 | E367: =C367*6+D367 -> 9 | G367: 4 | H367: 5 | I367: =G367*6+H367 -> 29 | K367: 7 | L367: 7 | M367: =K367*6+L367 -> 49 | O367: 11 | P367: 9 | Q367: =O367*6+P367 -> 75 | S367: RILEY
A368: BEST PLAYERS
A369: FOOTSCRAY | D369: C GRIERSON | G369: MAYBURY | J369: PORTER | M369: SHERRY | P369: HOWELL | R369: MUELEMAN
A370: ESSENDON ASSOC. | D370: MORIARTY | G370: GILES | J370: KING | M370: METCALFE | P370: ADAMS
A371: GOALKICKERS
A372: FOOTSCRAY | D372: C GRIERSON 4 | G372: PORTER 4 | I372: O'DONOGHUE 3 | L372: MAYBURY 2 | O372: W DOOLAN | R372: SAMSON | U372: BANBURY | X372: HOWELL
A373: ESSENDON ASSOC. | D373: GILES 3 | G373: KING 3 | I373: WALKER | K373: SCOBIE | M373: METCALFE | P373: MORIARTY | R373: JOHNSON
A375: PORT MELBOURNE | C375: 0 | D375: 1 | E375: =C375*6+D375 -> 1 | G375: 7 | H375: 13 | I375: =G375*6+H375 -> 55 | K375: 14 | L375: 19 | M375: =K375*6+L375 -> 103 | O375: 20 | P375: 30 | Q375: =O375*6+P375 -> 150 | S375: PORT MELB
A376: PRAHRAN | C376: 2 | D376: 1 | E376: =C376*6+D376 -> 13 | G376: 2 | H376: 1 | I376: =G376*6+H376 -> 13 | K376: 3 | L376: 2 | M376: =K376*6+L376 -> 20 | O376: 5 | P376: 4 | Q376: =O376*6+P376 -> 34 | S376: JENKINS
A377: BEST PLAYERS
A378: PORT MELBOURNE | D378: TAYLOR | G378: J O'BRIEN | J378: BARFOOT | M378: LESTER | P378: W RUDD | S378: STANFORD
A379: PRAHRAN | D379: CHAPMAN | G379: MOORE | J379: CORFIELD | M379: LOVE | P379: V JONES | S379: EDGAR
A380: GOALKICKERS
A381: PORT MELBOURNE | D381: J O'BRIEN 6 | G381: TAYLOR 6 | J381: DILLON 4 | M381: LACKMAN 2 | P381: BENCE | R381: MATTHEWS
A382: PRAHRAN | D382: CHAPMAN 2 | G382: LOVE | I382: HALLETT | K382: BRENNAN
A384: ROUND 9 | D384: 2ND JULY | J384: WEATHER | M384: FINE WEST WIND | S384: PLAYED AT | X384: LADDER | AB384: ROUND | AD384: 9
D385: 1ST QTR | H385: 2ND QTR | L385: 3RD QTR | P385: FINAL | S385: FOOTSCRAY
A386: FOOTSCRAY | C386: 4 | D386: 1 | E386: =C386*6+D386 -> 25 | G386: 8 | H386: 7 | I386: =G386*6+H386 -> 55 | K386: 11 | L386: 9 | M386: =K386*6+L386 -> 75 | O386: 12 | P386: 15 | Q386: =O386*6+P386 -> 87 | S386: UMPIRE | W386: TEAM | X386: W | Y386: L | Z386: D | AA386: FOR | AB386: AGST | AC386: % | AD386: PTS
A387: NORTHCOTE | C387: 1 | D387: 4 | E387: =C387*6+D387 -> 10 | G387: 3 | H387: 5 | I387: =G387*6+H387 -> 23 | K387: 3 | L387: 8 | M387: =K387*6+L387 -> 26 | O387: 6 | P387: 9 | Q387: =O387*6+P387 -> 45 | S387: KELLY
A388: BEST PLAYERS | W388: PORT MELBOURNE | X388: 8 | Y388: 1 | Z388: 0 | AA388: 802 | AB388: 422 | AC388: 190.04739336492892 | AD388: 32
A389: FOOTSCRAY | D389: O'DONOGHUE | G389: HOWELL | I389: GOVAN | K389: MUELEMAN | N389: MARTIN | Q389: SAMSON | W389: FOOTSCRAY | X389: 7 | Y389: 1 | Z389: 1 | AA389: 635 | AB389: 467 | AC389: 135.97430406852249 | AD389: 30
A390: NORTHCOTE | D390: COOMBS | G390: MILLS | I390: STONE | K390: SMITH | N390: COCKRAM | Q390: KIELY | W390: NORTHCOTE | X390: 7 | Y390: 2 | Z390: 0 | AA390: 657 | AB390: 533 | AC390: 123.26454033771107 | AD390: 28
A391: GOALKICKERS | W391: BRUNSWICK | X391: 6 | Y391: 2 | Z391: 1 | AA391: 601 | AB391: 521 | AC391: 115.35508637236084 | AD391: 26
A392: FOOTSCRAY | D392: PARK 4 | G392: O'BRIEN 3 | J392: O'DONOGHUE 3 | N392: MARTIN 2
A393: NORTHCOTE | D393: BUISST | F393: WRAITH | H393: SMITH | J393: W THORPE | M393: KENNY | O393: G THORPE | W393: NORTH MELBOURNE | X393: 5 | Y393: 4 | Z393: 0 | AA393: 499 | AB393: 409 | AC393: 122.00488997555013 | AD393: 20
W394: WILLIAMSTOWN | X394: 5 | Y394: 4 | Z394: 0 | AA394: 567 | AB394: 497 | AC394: 114.08450704225352 | AD394: 20
A395: BRUNSWICK | C395: 2 | D395: 0 | E395: =C395*6+D395 -> 12 | G395: 7 | H395: 4 | I395: =G395*6+H395 -> 46 | K395: 9 | L395: 15 | M395: =K395*6+L395 -> 69 | O395: 14 | P395: 24 | Q395: =O395*6+P395 -> 108 | S395: BRUNSWICK | W395: HAWTHORN | X395: 3 | Y395: 6 | Z395: 0 | AA395: 621 | AB395: 745 | AC395: 83.355704697986582 | AD395: 12
A396: HAWTHORN | C396: 2 | D396: 8 | E396: =C396*6+D396 -> 20 | G396: 3 | H396: 9 | I396: =G396*6+H396 -> 27 | K396: 5 | L396: 13 | M396: =K396*6+L396 -> 43 | O396: 9 | P396: 13 | Q396: =O396*6+P396 -> 67 | S396: SHELLEY | W396: ESSENDON ASSOC. | X396: 2 | Y396: 7 | Z396: 0 | AA396: 488 | AB396: 588 | AC396: 82.993197278911566 | AD396: 8
A397: BEST PLAYERS | W397: PRAHRAN | X397: 1 | Y397: 8 | Z397: 0 | AA397: 454 | AB397: 711 | AC397: 63.85 | AD397: 4
A398: BRUNSWICK | D398: BOYCE | G398: STEPHENSON | J398: MILLEN | M398: ALESSIO | P398: McMAHON | R398: SHAND | W398: BRIGHTON | X398: 0 | Y398: 9 | Z398: 0 | AA398: 349 | AB398: 780 | AC398: 44.74 | AD398: 0
A399: HAWTHORN | D399: C GAMBETTA | G399: YEOMANS | J399: McCASHNEY | M399: W GAMBETTA | P399: DAVEY | R399: TEAGUE
A400: GOALKICKERS
A401: BRUNSWICK | D401: BOYCE 6 | G401: McMAHON 4 | J401: ALESSIO 2 | M401: MILLEN | O401: SULLIVAN
A402: HAWTHORN | D402: C GAMBETTA 5 | H402: W GAMBETTA 3 | L402: WILSON
A404: ESSENDON ASSOC. | C404: 4 | D404: 4 | E404: =C404*6+D404 -> 28 | G404: 6 | H404: 6 | I404: =G404*6+H404 -> 42 | K404: 8 | L404: 7 | M404: =K404*6+L404 -> 55 | O404: 9 | P404: 8 | Q404: =O404*6+P404 -> 62 | S404: ESSENDON
A405: PRAHRAN | C405: 0 | D405: 5 | E405: =C405*6+D405 -> 5 | G405: 2 | H405: 8 | I405: =G405*6+H405 -> 20 | K405: 3 | L405: 13 | M405: =K405*6+L405 -> 31 | O405: 4 | P405: 16 | Q405: =O405*6+P405 -> 40 | S405: J KAIN
A406: BEST PLAYERS
A407: ESSENDON ASSOC. | D407: JACKSON | G407: ADAMS | I407: BOLAN | L407: METCALFE | O407: WARRY | R407: BLACKMAN
A408: PRAHRAN | D408: CORFIELD | G408: MOORE | I408: V JONES | L408: NAYLOR | O408: BRENNAN | R408: QUINN
A409: GOALKICKERS
A410: ESSENDON ASSOC. | D410: METCALFE 3 | G410: MORIARTY | I410: GILES | J410: STROWNIX | M410: JOHNSON | O410: FRASER | Q410: WALSH
A411: PRAHRAN | D411: BRENNAN 2 | G411: V JONES 2
A413: PORT MELBOURNE | C413: 5 | D413: 4 | E413: =C413*6+D413 -> 34 | G413: 11 | H413: 8 | I413: =G413*6+H413 -> 74 | K413: 16 | L413: 12 | M413: =K413*6+L413 -> 108 | O413: 22 | P413: 14 | Q413: =O413*6+P413 -> 146 | S413: BRIGHTON BEACH
A414: BRIGHTON | C414: 0 | D414: 0 | E414: =C414*6+D414 -> 0 | G414: 0 | H414: 4 | I414: =G414*6+H414 -> 4 | K414: 2 | L414: 6 | M414: =K414*6+L414 -> 18 | O414: 6 | P414: 9 | Q414: =O414*6+P414 -> 45 | S414: CAIN
A415: BEST PLAYERS
A416: PORT MELBOURNE | D416: WALTON | G416: J O'BRIEN | J416: TAYLOR | M416: BENCE | P416: ANDERSON | S416: PASH
A417: BRIGHTON | D417: P BOLAND | G417: ACKERS | J417: CARROLL | M417: BORLAND | P417: RINGROSE | S417: DANGERFIELD
A418: GOALKICKERS
A419: PORT MELBOURNE | D419: TAYLOR 9 | G419: J O'BRIEN 4 | J419: ANDERSON 3 | M419: DILLON | O419: TASKER | Q419: LACKMAN | T419: WALTON | W419: BENCE | X419: BARFOOT
A420: BRIGHTON | D420: SHILLITO 2 | G420: McCARTHY | J420: DUNSMORE | M420: COBB | O420: ELDER
A422: NORTH MELBOURNE | C422: FORFEIT TO
A423: WILLIAMSTOWN
A425: ROUND 10 | D425: 16TH JULY | J425: WEATHER | M425: RAIN NORTH WIND | S425: PLAYED AT | X425: LADDER | AB425: ROUND | AD425: 10
D426: 1ST QTR | H426: 2ND QTR | L426: 3RD QTR | P426: FINAL | S426: BRUNSWICK
A427: BRUNSWICK | C427: 3 | D427: 2 | E427: =C427*6+D427 -> 20 | G427: 5 | H427: 3 | I427: =G427*6+H427 -> 33 | K427: 8 | L427: 11 | M427: =K427*6+L427 -> 59 | O427: 11 | P427: 12 | Q427: =O427*6+P427 -> 78 | S427: UMPIRE | W427: TEAM | X427: W | Y427: L | Z427: D | AA427: FOR | AB427: AGST | AC427: % | AD427: PTS
A428: PORT MELBOURNE | C428: 3 | D428: 1 | E428: =C428*6+D428 -> 19 | G428: 6 | H428: 1 | I428: =G428*6+H428 -> 37 | K428: 7 | L428: 2 | M428: =K428*6+L428 -> 44 | O428: 8 | P428: 12 | Q428: =O428*6+P428 -> 60 | S428: McKINNON
A429: BEST PLAYERS | W429: FOOTSCRAY | X429: 8 | Y429: 1 | Z429: 1 | AA429: 710 | AB429: 512 | AC429: 138.671875 | AD429: 34
A430: BRUNSWICK | D430: SULLIVAN | G430: MILLEN | I430: ADAMS | K430: McINERNEY | N430: ALESSIO | Q430: FEATHERSTONE | W430: PORT MELBOURNE | X430: 8 | Y430: 2 | Z430: 0 | AA430: 862 | AB430: 500 | AC430: 172.4 | AD430: 32
A431: PORT MELBOURNE | D431: T O'BRIEN | G431: J O'BRIEN | I431: TASKER | K431: DILLON | N431: LEEHANE | Q431: HANDO | W431: NORTHCOTE | X431: 8 | Y431: 2 | Z431: 0 | AA431: 726 | AB431: 578 | AC431: 125.60553633217994 | AD431: 32
A432: GOALKICKERS | W432: BRUNSWICK | X432: 7 | Y432: 2 | Z432: 1 | AA432: 679 | AB432: 581 | AC432: 116.86746987951807 | AD432: 30
A433: BRUNSWICK | D433: SULLIVAN 4 | G433: BOYCE 3 | I433: McMAHON 2 | L433: ALESSIO | N433: MAY
A434: PORT MELBOURNE | D434: LACKMAN 3 | G434: TAYLOR 3 | J434: J O'BRIEN 2 | M434: WALTON | W434: NORTH MELBOURNE | X434: 5 | Y434: 5 | Z434: 0 | AA434: 499 | AB434: 409 | AC434: 122.00488997555013 | AD434: 20
W435: WILLIAMSTOWN | X435: 5 | Y435: 5 | Z435: 0 | AA435: 612 | AB435: 572 | AC435: 106.99300699300699 | AD435: 20
A436: FOOTSCRAY | C436: 4 | D436: 3 | E436: =C436*6+D436 -> 27 | G436: 6 | H436: 4 | I436: =G436*6+H436 -> 40 | K436: 9 | L436: 6 | M436: =K436*6+L436 -> 60 | O436: 11 | P436: 9 | Q436: =O436*6+P436 -> 75 | S436: WILLIAMSTOWN | W436: HAWTHORN | X436: 4 | Y436: 6 | Z436: 0 | AA436: 621 | AB436: 745 | AC436: 83.355704697986582 | AD436: 16
A437: WILLIAMSTOWN | C437: 2 | D437: 1 | E437: =C437*6+D437 -> 13 | G437: 3 | H437: 4 | I437: =G437*6+H437 -> 22 | K437: 3 | L437: 5 | M437: =K437*6+L437 -> 23 | O437: 6 | P437: 9 | Q437: =O437*6+P437 -> 45 | S437: THOMPSON | W437: ESSENDON ASSOC. | X437: 2 | Y437: 8 | Z437: 0 | AA437: 533 | AB437: 657 | AC437: 81.126331811263313 | AD437: 8
A438: BEST PLAYERS | W438: PRAHRAN | X438: 1 | Y438: 8 | Z438: 1 | AA438: 488 | AB438: 745 | AC438: 65.5 | AD438: 6
A439: FOOTSCRAY | D439: ELLINGSEN | G439: PARK | I439: McKENZIE | L439: MARTIN | N439: MUELEMAN | Q439: O'BRIEN | W439: BRIGHTON | X439: 0 | Y439: 9 | Z439: 1 | AA439: 383 | AB439: 814 | AC439: 47.05 | AD439: 2
A440: WILLIAMSTOWN | D440: CONDON | G440: MITCHELL | I440: MILES | L440: KING | N440: J McDONALD | Q440: N McDONALD
A441: GOALKICKERS
A442: FOOTSCRAY | D442: PARK 4 | G442: ELLINGSEN 2 | J442: O'BRIEN 2 | M442: MARTIN | O442: MAYBURY | Q442: O'DONONGHUE
A443: WILLIAMSTOWN | D443: McAULIFFE 3 | G443: ELLIMAN | J443: HARDEN | M443: CONDON
A445: PRAHRAN | C445: 0 | D445: 0 | E445: =C445*6+D445 -> 0 | G445: 1 | H445: 3 | I445: =G445*6+H445 -> 9 | K445: 2 | L445: 3 | M445: =K445*6+L445 -> 15 | O445: 5 | P445: 4 | Q445: =O445*6+P445 -> 34 | S445: TOORAK PARK
A446: BRIGHTON | C446: 2 | D446: 5 | E446: =C446*6+D446 -> 17 | G446: 3 | H446: 7 | I446: =G446*6+H446 -> 25 | K446: 3 | L446: 9 | M446: =K446*6+L446 -> 27 | O446: 4 | P446: 10 | Q446: =O446*6+P446 -> 34 | S446: SHELLEY
A447: BEST PLAYERS
A448: PRAHRAN | D448: CORFIELD | G448: DINGWELL | J448: V JONES | M448: BRENNAN | P448: BELLEVILLE | S448: MORONEY
A449: BRIGHTON | D449: COX | G449: McCARTHY | J449: RINGROSE | M449: COBB | P449: BORLAND | S449: P BOLAND
A450: GOALKICKERS
A451: PRAHRAN | D451: BRENNAN 2 | G451: MORONEY | J451: V JONES | M451: BELLEVILLE
A452: BRIGHTON | D452: COBB 2 | G452: P BAYLISS | J452: WYATT
A454: NORTHCOTE | C454: 2 | D454: 6 | E454: =C454*6+D454 -> 18 | G454: 5 | H454: 8 | I454: =G454*6+H454 -> 38 | K454: 8 | L454: 12 | M454: =K454*6+L454 -> 60 | O454: 9 | P454: 15 | Q454: =O454*6+P454 -> 69 | S454: NORTHCOTE
A455: ESSENDON ASSOC. | C455: 1 | D455: 1 | E455: =C455*6+D455 -> 7 | G455: 4 | H455: 5 | I455: =G455*6+H455 -> 29 | K455: 5 | L455: 6 | M455: =K455*6+L455 -> 36 | O455: 6 | P455: 9 | Q455: =O455*6+P455 -> 45 | S455: JENKINS
A456: BEST PLAYERS
A457: NORTHCOTE | D457: H SMITH | G457: B MILLS | J457: COOMBS | M457: STONE | P457: WRAITH | S457: O'KEEFE
A458: ESSENDON ASSOC. | D458: WATT | G458: ADAMS | J458: RAWLE | M458: WALKER | P458: GILES | S458: MORIARTY
A459: GOALKICKERS
A460: NORTHCOTE | D460: H SMITH 2 | G460: G THORPE 2 | J460: WRAITH 2 | M460: O'KEEFE | O460: B MILLS | Q460: GRAY
A461: ESSENDON ASSOC. | D461: SMITH 2 | G461: MORIARTY 2 | J461: WALKER | M461: GILES
A463: NORTH MELBOURNE | C463: FORFEIT TO
A464: HAWTHORN
A466: ROUND 11 | D466: 23RD JULY | J466: WEATHER | M466: FINE | S466: PLAYED AT | X466: LADDER | AB466: ROUND | AD466: 11
D467: 1ST QTR | H467: 2ND QTR | L467: 3RD QTR | P467: FINAL | S467: FOOTSCRAY
A468: FOOTSCRAY | C468: 1 | D468: 1 | E468: =C468*6+D468 -> 7 | G468: 4 | H468: 3 | I468: =G468*6+H468 -> 27 | K468: 7 | L468: 7 | M468: =K468*6+L468 -> 49 | O468: 7 | P468: 9 | Q468: =O468*6+P468 -> 51 | S468: UMPIRE | W468: TEAM | X468: W | Y468: L | Z468: D | AA468: FOR | AB468: AGST | AC468: % | AD468: PTS
A469: BRUNSWICK | C469: 2 | D469: 1 | E469: =C469*6+D469 -> 13 | G469: 2 | H469: 5 | I469: =G469*6+H469 -> 17 | K469: 4 | L469: 7 | M469: =K469*6+L469 -> 31 | O469: 6 | P469: 10 | Q469: =O469*6+P469 -> 46 | S469: McKINNON
A470: BEST PLAYERS | W470: FOOTSCRAY | X470: 9 | Y470: 1 | Z470: 1 | AA470: 761 | AB470: 558 | AC470: 136.37992831541217 | AD470: 38
A471: FOOTSCRAY | D471: McINTYRE | G471: SHERRY | I471: SAMSON | L471: MARTIN | O471: BANBURY | Q471: PARK | W471: PORT MELBOURNE | X471: 9 | Y471: 2 | Z471: 0 | AA471: 978 | AB471: 540 | AC471: 181.11111111111111 | AD471: 36
A472: BRUNSWICK | D472: ALESSIO | G472: MILLEN | I472: MOORE | L472: SULLIVAN | O472: CAGILL | Q472: GOONAN | W472: NORTHCOTE | X472: 8 | Y472: 3 | Z472: 0 | AA472: 766 | AB472: 694 | AC472: 110.37463976945244 | AD472: 32
A473: GOALKICKERS | W473: BRUNSWICK | X473: 7 | Y473: 3 | Z473: 1 | AA473: 725 | AB473: 632 | AC473: 114.71518987341773 | AD473: 30
A474: FOOTSCRAY | D474: PARK 2 | G474: ELLINGSEN 2 | J474: MAYBURY 2 | M474: SAMSON
A475: BRUNSWICK | D475: SULLIVAN 2 | G475: SHAND | I475: BOYCE | K475: MOORE | M475: McMAHON | W475: WILLIAMSTOWN | X475: 6 | Y475: 5 | Z475: 0 | AA475: 734 | AB475: 599 | AC475: 122.53756260434056 | AD475: 24
W476: NORTH MELBOURNE | X476: 5 | Y476: 6 | Z476: 0 | AA476: 499 | AB476: 409 | AC476: 122.00488997555013 | AD476: 20
A477: PORT MELBOURNE | C477: 2 | D477: 3 | E477: =C477*6+D477 -> 15 | G477: 8 | H477: 8 | I477: =G477*6+H477 -> 56 | K477: 14 | L477: 9 | M477: =K477*6+L477 -> 93 | O477: 17 | P477: 14 | Q477: =O477*6+P477 -> 116 | S477: PORT MELB | W477: HAWTHORN | X477: 5 | Y477: 6 | Z477: 0 | AA477: 720 | AB477: 831 | AC477: 86.642599277978334 | AD477: 20
A478: NORTHCOTE | C478: 4 | D478: 3 | E478: =C478*6+D478 -> 27 | G478: 4 | H478: 4 | I478: =G478*6+H478 -> 28 | K478: 5 | L478: 4 | M478: =K478*6+L478 -> 34 | O478: 6 | P478: 4 | Q478: =O478*6+P478 -> 40 | S478: JENKINS | W478: ESSENDON ASSOC. | X478: 2 | Y478: 9 | Z478: 0 | AA478: 619 | AB478: 756 | AC478: 81.878306878306873 | AD478: 8
A479: BEST PLAYERS | W479: PRAHRAN | X479: 1 | Y479: 9 | Z479: 1 | AA479: 515 | AB479: 867 | AC479: 59.4 | AD479: 6
A480: PORT MELBOURNE | D480: BENCE | G480: HANDO | I480: LESTER | L480: DILLON | O480: NANCARROW | R480: SHAW | W480: BRIGHTON | X480: 1 | Y480: 9 | Z480: 1 | AA480: 383 | AB480: 808 | AC480: 47.05 | AD480: 6
A481: NORTHCOTE | D481: MILLS | G481: JOHNSON | I481: COCKRAM | L481: T O'KEEFE | O481: COOMBS | R481: GITTENS
A482: GOALKICKERS
A483: PORT MELBOURNE | D483: TAYLOR 5 | F483: TASKER 3 | I483: DILLON 3 | K483: BENCE 2 | M483: WALTON | O483: SHAW | Q483: LEEHANE | S483: LACKMAN
A484: NORTHCOTE | D484: COOMBS | F484: MILLS | H484: G THORPE | K484: W THORPE | N484: KILEY | P484: COCKRAM
A486: HAWTHORN | C486: 3 | D486: 4 | E486: =C486*6+D486 -> 22 | G486: 7 | H486: 9 | I486: =G486*6+H486 -> 51 | K486: 11 | L486: 10 | M486: =K486*6+L486 -> 76 | O486: 14 | P486: 15 | Q486: =O486*6+P486 -> 99 | S486: ESSENDON
A487: ESSENDON ASSOC. | C487: 4 | D487: 4 | E487: =C487*6+D487 -> 28 | G487: 5 | H487: 6 | I487: =G487*6+H487 -> 36 | K487: 8 | L487: 8 | M487: =K487*6+L487 -> 56 | O487: 12 | P487: 14 | Q487: =O487*6+P487 -> 86 | S487: SHELLEY
A488: BEST PLAYERS
A489: HAWTHORN | D489: JACKSON | G489: C GAMBETTA | J489: W GAMBETTA | M489: YEOMANS | P489: WALLIS | R489: RADEMACHER
A490: ESSENDON ASSOC. | D490: WATT | G490: JOHNSON | J490: KING | M490: FIELDING | P490: RAWLE | R490: WARRY
A491: GOALKICKERS
A492: HAWTHORN | D492: C GAMBETTA 6 | G492: W GAMBETTA 3 | J492: WILSON 2 | M492: MONOHAN | P492: YEOMANS | R492: ROBERTS
A493: ESSENDON ASSOC. | D493: SMITH 3 | G493: FIELDING 2 | J493: WALSH 2 | M493: MORIARTY 2 | P493: RAWLE | R493: KING | T493: SHORTEN
A495: WILLIAMSTOWN | C495: 3 | D495: 5 | E495: =C495*6+D495 -> 23 | G495: 7 | H495: 9 | I495: =G495*6+H495 -> 51 | K495: 8 | L495: 17 | M495: =K495*6+L495 -> 65 | O495: 16 | P495: 26 | Q495: =O495*6+P495 -> 122 | S495: TOORAK PARK
A496: PRAHRAN | C496: 2 | D496: 4 | E496: =C496*6+D496 -> 16 | G496: 3 | H496: 6 | I496: =G496*6+H496 -> 24 | K496: 3 | L496: 9 | M496: =K496*6+L496 -> 27 | O496: 3 | P496: 9 | Q496: =O496*6+P496 -> 27 | S496: THOMPSON
A497: BEST PLAYERS
A498: WILLIAMSTOWN | D498: CONDON | G498: HAUGHTON | J498: CALDWELL | M498: KING | O498: MITCHELL | R498: McAULIFFE
A499: PRAHRAN | D499: CORFIELD | G499: MORONEY | J499: V JONES | M499: ALLISTER | O499: LOVE | R499: E JONES
A500: GOALKICKERS
A501: WILLIAMSTOWN | D501: HAUGHTON 6 | G501: McAULIFFE 4 | J501: STANBRIDGE 2 | M501: MITCHELL 2 | P501: CALDWELL | R501: TRUMAN
A502: PRAHRAN | D502: V JONES | G502: MORONEY | J502: BRENNAN
A504: NORTH MELBOURNE | C504: FORFEIT TO
A505: BRIGHTON
A507: ROUND 12 | D507: 30TH JULY | H507: WEATHER | K507: COLD RAIN SQUALLY S.W. WIND GROUNDS BAD | S507: PLAYED AT | X507: LADDER | AB507: ROUND | AD507: 12
D508: 1ST QTR | H508: 2ND QTR | L508: 3RD QTR | P508: FINAL | S508: BRUNSWICK
A509: BRUNSWICK | C509: 0 | D509: 2 | E509: =C509*6+D509 -> 2 | G509: 2 | H509: 7 | I509: =G509*6+H509 -> 19 | K509: 2 | L509: 8 | M509: =K509*6+L509 -> 20 | O509: 6 | P509: 12 | Q509: =O509*6+P509 -> 48 | S509: UMPIRE | W509: TEAM | X509: W | Y509: L | Z509: D | AA509: FOR | AB509: AGST | AC509: % | AD509: PTS
A510: NORTHCOTE | C510: 3 | D510: 7 | E510: =C510*6+D510 -> 25 | G510: 3 | H510: 7 | I510: =G510*6+H510 -> 25 | K510: 4 | L510: 11 | M510: =K510*6+L510 -> 35 | O510: 5 | P510: 12 | Q510: =O510*6+P510 -> 42 | S510: CAIN
A511: BEST PLAYERS | W511: FOOTSCRAY | X511: 10 | Y511: 1 | Z511: 1 | AA511: 831 | AB511: 603 | AC511: 137.81094527363183 | AD511: 42
A512: BRUNSWICK | D512: MOORE | F512: MILLEN | I512: SULLIVAN | L512: CAHILL | N512: FAUST | Q512: MARSHALL | W512: PORT MELBOURNE | X512: 10 | Y512: 2 | Z512: 0 | AA512: 1032 | AB512: 571 | AC512: 180.7355516637478 | AD512: 40
A513: NORTHCOTE | D513: MILLS | F513: YATES | I513: O'KEEFE | L513: COCKRAM | N513: JOHNSON | Q513: STONE | W513: BRUNSWICK | X513: 8 | Y513: 3 | Z513: 1 | AA513: 773 | AB513: 674 | AC513: 114.68842729970326 | AD513: 34
A514: GOALKICKERS | W514: NORTHCOTE | X514: 8 | Y514: 4 | Z514: 0 | AA514: 808 | AB514: 742 | AC514: 108.89487870619946 | AD514: 32
A515: BRUNSWICK | D515: McMAHON 2 | G515: SULLIVAN 2 | J515: WOOLARD | M515: McQUEEN
A516: NORTHCOTE | D516: KENNY 2 | G516: POWDITCH | J516: G THORPE | M516: KIELY | W516: WILLIAMSTOWN | X516: 6 | Y516: 6 | Z516: 0 | AA516: 765 | AB516: 653 | AC516: 117.15160796324655 | AD516: 24
W517: NORTH MELBOURNE | X517: 5 | Y517: 7 | Z517: 0 | AA517: 499 | AB517: 409 | AC517: 122.00488997555013 | AD517: 20
A518: PORT MELBOURNE | C518: 0 | D518: 1 | E518: =C518*6+D518 -> 1 | G518: 1 | H518: 9 | I518: =G518*6+H518 -> 15 | K518: 1 | L518: 10 | M518: =K518*6+L518 -> 16 | O518: 7 | P518: 12 | Q518: =O518*6+P518 -> 54 | S518: PORT MELB | W518: HAWTHORN | X518: 5 | Y518: 7 | Z518: 0 | AA518: 765 | AB518: 901 | AC518: 84.905660377358487 | AD518: 20
A519: WILLIAMSTOWN | C519: 2 | D519: 6 | E519: =C519*6+D519 -> 18 | G519: 2 | H519: 6 | I519: =G519*6+H519 -> 18 | K519: 4 | L519: 7 | M519: =K519*6+L519 -> 31 | O519: 4 | P519: 7 | Q519: =O519*6+P519 -> 31 | S519: SHELLEY | W519: ESSENDON ASSOC. | X519: 3 | Y519: 9 | Z519: 0 | AA519: 668 | AB519: 790 | AC519: 84.556962025316452 | AD519: 12
A520: BEST PLAYERS | W520: PRAHRAN | X520: 2 | Y520: 9 | Z520: 1 | AA520: 515 | AB520: 867 | AC520: 58.708189158016147 | AD520: 10
A521: PORT MELBOURNE | D521: W RUDD | G521: TASKER | I521: WALTON | L521: LESTER | O521: BENCE | R521: BRISCOE | W521: BRIGHTON | X521: 1 | Y521: 10 | Z521: 1 | AA521: 417 | AB521: 863 | AC521: 48.32 | AD521: 6
A522: WILLIAMSTOWN | D522: MITCHELL | G522: WISEMAN | I522: O'CONNELL | L522: ELLIMAN | O522: KING | R522: CONDON
A523: GOALKICKERS
A524: PORT MELBOURNE | D524: TAYLOR 3 | G524: TASKER 2 | J524: W RUDD | L524: LEEHANE
A525: WILLIAMSTOWN | D525: HAUGHTON | G525: MUNRO | J525: MITCHELL | M525: McAULIFFE
A527: FOOTSCRAY | C527: 4 | D527: 5 | E527: =C527*6+D527 -> 29 | G527: 6 | H527: 5 | I527: =G527*6+H527 -> 41 | K527: 10 | L527: 9 | M527: =K527*6+L527 -> 69 | O527: 10 | P527: 10 | Q527: =O527*6+P527 -> 70 | S527: HAW
A528: HAWTHORN | C528: 0 | D528: 1 | E528: =C528*6+D528 -> 1 | G528: 5 | H528: 4 | I528: =G528*6+H528 -> 34 | K528: 5 | L528: 4 | M528: =K528*6+L528 -> 34 | O528: 6 | P528: 9 | Q528: =O528*6+P528 -> 45 | S528: LOVELL
A529: BEST PLAYERS
A530: FOOTSCRAY | D530: MAYBURY | G530: HOWELL | J530: PARK | M530: O'DONOGHUE | P530: SMITH | S530: SHERRY
A531: HAWTHORN | D531: JACKSON | G531: McCASHNEY | J531: HODGES | M531: W GAMBETTA | P531: YEOMANS | S531: TEAGUE
A532: GOALKICKERS
A533: FOOTSCRAY | D533: PARK 4 | G533: OGILVIE 3 | J533: O'DONOGHUE | M533: MAYBURY | O533: GOVAN
A534: HAWTHORN | D534: HODGES 2 | G534: C GAMBETTA | J534: ROBERTS | M534: HAYES | O534: WALLIS
A536: ESSENDON ASSOC. | C536: 3 | D536: 4 | E536: =C536*6+D536 -> 22 | G536: 3 | H536: 4 | I536: =G536*6+H536 -> 22 | K536: 6 | L536: 9 | M536: =K536*6+L536 -> 45 | O536: 6 | P536: 13 | Q536: =O536*6+P536 -> 49 | S536: BRIGHTON BEACH
A537: BRIGHTON | C537: 0 | D537: 0 | E537: =C537*6+D537 -> 0 | G537: 2 | H537: 2 | I537: =G537*6+H537 -> 14 | K537: 3 | L537: 2 | M537: =K537*6+L537 -> 20 | O537: 5 | P537: 4 | Q537: =O537*6+P537 -> 34 | S537: RILEY
A538: BEST PLAYERS
A539: ESSENDON ASSOC. | D539: KING | G539: WATT | J539: MORIARTY | M539: GILES | P539: ADAMS | S539: SMITH
A540: BRIGHTON | D540: McCARTHY | G540: HATTAM | J540: RINGROSE | M540: DANGERFIELD | P540: WYATT | S540: SHERIDAN
A541: GOALKICKERS
A542: ESSENDON ASSOC. | D542: MORIARTY 3 | H542: RUSSELL 2 | L542: MANNIX
A543: BRIGHTON | D543: RINGROSE 2 | H543: SMMITH | K543: SHERIDAN | N543: COBB
A545: NORTH MELBOURNE | C545: FORFEIT TO
A546: PRAHRAN
A548: ROUND 13 | D548: 13TH AUGUST | J548: WEATHER | M548: FINE N.E. BREEZE | S548: PLAYED AT | X548: LADDER | AB548: ROUND | AD548: 13
D549: 1ST QTR | H549: 2ND QTR | L549: 3RD QTR | P549: FINAL | S549: WILLIAMSTOWN
A550: WILLIAMSTOWN | C550: 3 | D550: 1 | E550: =C550*6+D550 -> 19 | G550: 7 | H550: 4 | I550: =G550*6+H550 -> 46 | K550: 11 | L550: 8 | M550: =K550*6+L550 -> 74 | O550: 14 | P550: 11 | Q550: =O550*6+P550 -> 95 | S550: UMPIRE | W550: TEAM | X550: W | Y550: L | Z550: D | AA550: FOR | AB550: AGST | AC550: % | AD550: PTS
A551: HAWTHORN | C551: 1 | D551: 3 | E551: =C551*6+D551 -> 9 | G551: 2 | H551: 8 | I551: =G551*6+H551 -> 20 | K551: 5 | L551: 12 | M551: =K551*6+L551 -> 42 | O551: 5 | P551: 19 | Q551: =O551*6+P551 -> 49 | S551: CAIN
A552: BEST PLAYERS | W552: FOOTSCRAY | X552: 11 | Y552: 1 | Z552: 1 | AA552: 831 | AB552: 603 | AC552: 137.81094527363183 | AD552: 46
A553: WILLIAMSTOWN | D553: CALDWELL | F553: HAUGHTON | I553: J McDONALD | L553: McAULIFFE | O553: MUNRO | R553: KING | W553: PORT MELBOURNE | X553: 11 | Y553: 2 | Z553: 0 | AA553: 1131 | AB553: 638 | AC553: 177.27272727272728 | AD553: 44
A554: HAWTHORN | D554: JACKSON | F554: WALLIS | I554: C GAMBETTA | L554: McCASHNEY | O554: W GAMBETTA | R554: BURKE | W554: BRUNSWICK | X554: 9 | Y554: 3 | Z554: 1 | AA554: 859 | AB554: 729 | AC554: 117.83264746227709 | AD554: 38
A555: GOALKICKERS | W555: NORTHCOTE | X555: 9 | Y555: 4 | Z555: 0 | AA555: 912 | AB555: 778 | AC555: 117.22365038560412 | AD555: 36
A556: WILLIAMSTOWN | D556: McAULIFFE 5 | G556: HAUGHTON 4 | J556: N McDONALD | M556: MITCHELL | O556: MUNRO | Q556: HARDEN | S556: CALDWELL
A557: HAWTHORN | D557: C GAMBETTA 2 | H557: HENRY 2 | K557: W GAMBETTA | W557: WILLIAMSTOWN | X557: 7 | Y557: 6 | Z557: 0 | AA557: 860 | AB557: 702 | AC557: 122.5071225071225 | AD557: 28
W558: NORTH MELBOURNE | X558: 5 | Y558: 8 | Z558: 0 | AA558: 499 | AB558: 409 | AC558: 122.00488997555013 | AD558: 20
A559: NORTHCOTE | C559: 5 | D559: 3 | E559: =C559*6+D559 -> 33 | G559: 9 | H559: 4 | I559: =G559*6+H559 -> 58 | K559: 13 | L559: 6 | M559: =K559*6+L559 -> 84 | O559: 15 | P559: 14 | Q559: =O559*6+P559 -> 104 | S559: NORTHCOTE | W559: HAWTHORN | X559: 5 | Y559: 8 | Z559: 0 | AA559: 814 | AB559: 996 | AC559: 81.726907630522092 | AD559: 20
A560: BRIGHTON | C560: 1 | D560: 2 | E560: =C560*6+D560 -> 8 | G560: 2 | H560: 4 | I560: =G560*6+H560 -> 16 | K560: 3 | L560: 7 | M560: =K560*6+L560 -> 25 | O560: 4 | P560: 12 | Q560: =O560*6+P560 -> 36 | S560: SHELLEY | W560: ESSENDON ASSOC. | X560: 3 | Y560: 10 | Z560: 0 | AA560: 735 | AB560: 889 | AC560: 82.677165354330711 | AD560: 12
A561: BEST PLAYERS | W561: PRAHRAN | X561: 2 | Y561: 10 | Z561: 1 | AA561: 570 | AB561: 953 | AC561: 59.81 | AD561: 10
A562: NORTHCOTE | D562: PURCELL | F562: YATES | I562: MILLS | L562: O'KEEFE | N562: DIMMICK | Q562: BUISST | W562: BRIGHTON | X562: 1 | Y562: 11 | Z562: 1 | AA562: 453 | AB562: 967 | AC562: 46.85 | AD562: 6
A563: BRIGHTON | D563: BORLAND | F563: McCARTHY | I563: COX | L563: SMITH | N563: P BOLAND | Q563: M BOLAND
A564: GOALKICKERS
A565: NORTHCOTE | D565: W THORPE 3 | G565: YATES 2 | I565: HELLWIG 2 | L565: DIMMICK 2 | N565: MILLS 2 | P565: BENSON | R565: WRAITH | U565: BUISST | W565: COCKRAM
A566: BRIGHTON | D566: VIRTUE 2 | G566: SHERIDAN | J566: RINGROSE
A568: PORT MELBOURNE | C568: 1 | D568: 2 | E568: =C568*6+D568 -> 8 | G568: 6 | H568: 6 | I568: =G568*6+H568 -> 42 | K568: 8 | L568: 12 | M568: =K568*6+L568 -> 60 | O568: 14 | P568: 15 | Q568: =O568*6+P568 -> 99 | S568: ESSENDON
A569: ESSENDON ASSOC. | C569: 3 | D569: 3 | E569: =C569*6+D569 -> 21 | G569: 4 | H569: 6 | I569: =G569*6+H569 -> 30 | K569: 6 | L569: 10 | M569: =K569*6+L569 -> 46 | O569: 9 | P569: 13 | Q569: =O569*6+P569 -> 67 | S569: RILEY
A570: BEST PLAYERS
A571: PORT MELBOURNE | D571: HANDO | G571: WALTON | I571: NANCARROW | L571: W RUDD | O571: DILLON | R571: BENCE
A572: ESSENDON ASSOC. | D572: RUSSELL | G572: WATT | I572: ADAMS | L572: WALSH | O572: BLACKMAN | R572: MORIARTY
A573: GOALKICKERS
A574: PORT MELBOURNE | D574: TAYLOR 6 | G574: TASKER 3 | I574: DILLON | K574: LACKMAN | M574: J O'BRIEN | O574: LEEHANE | Q574: SHAW
A575: ESSENDON ASSOC. | D575: MORIARTY 3 | G575: SMITH 2 | I575: FIELDING 2 | L575: WALSH | N575: WILSON
A577: BRUNSWICK | C577: 2 | D577: 2 | E577: =C577*6+D577 -> 14 | G577: 5 | H577: 8 | I577: =G577*6+H577 -> 38 | K577: 7 | L577: 11 | M577: =K577*6+L577 -> 53 | O577: 12 | P577: 14 | Q577: =O577*6+P577 -> 86 | S577: BRUNSWICK
A578: PRAHRAN | C578: 2 | D578: 3 | E578: =C578*6+D578 -> 15 | G578: 2 | H578: 3 | I578: =G578*6+H578 -> 15 | K578: 3 | L578: 5 | M578: =K578*6+L578 -> 23 | O578: 8 | P578: 7 | Q578: =O578*6+P578 -> 55 | S578: CAIN
A579: BEST PLAYERS
A580: BRUNSWICK | D580: SULLIVAN | G580: GRIMSTER | J580: SWIFT | M580: CAHILL | P580: MAY | S580: ALESSIO
A581: PRAHRAN | D581: CORFIELD | G581: V JONES | J581: DINGWELL | M581: LOVE | P581: SPENCER | S581: MILLER
A582: GOALKICKERS
A583: BRUNSWICK | D583: SULLIVAN 3 | G583: FAUST 2 | I583: MOORE 2 | K583: McMAHON 2 | N583: MILLEN | P583: ALESSIO | R583: WOLLARD
A584: PRAHRAN | D584: BRENNAN 2 | G584: KELLY 2 | I584: BAYLISS | K584: LOVE | M584: DINGWELL | P584: E JONES
A586: NORTH MELBOURNE | C586: FORFEIT TO
A587: FOOTSCRAY
A589: ROUND 14 | D589: 20TH AUGUST | J589: WEATHER | M589: FINE MILD N.E. WIND | S589: PLAYED AT | X589: LADDER | AB589: ROUND | AD589: 14
D590: 1ST QTR | H590: 2ND QTR | L590: 3RD QTR | P590: FINAL | S590: NORTHCOTE
A591: HAWTHORN | C591: 3 | D591: 1 | E591: =C591*6+D591 -> 19 | G591: 7 | H591: 3 | I591: =G591*6+H591 -> 45 | K591: 9 | L591: 7 | M591: =K591*6+L591 -> 61 | O591: 10 | P591: 12 | Q591: =O591*6+P591 -> 72 | S591: UMPIRE | W591: TEAM | X591: W | Y591: L | Z591: D | AA591: FOR | AB591: AGST | AC591: % | AD591: PTS
A592: NORTHCOTE | C592: 2 | D592: 5 | E592: =C592*6+D592 -> 17 | G592: 5 | H592: 8 | I592: =G592*6+H592 -> 38 | K592: 7 | L592: 15 | M592: =K592*6+L592 -> 57 | O592: 8 | P592: 17 | Q592: =O592*6+P592 -> 65 | S592: JENKINS
A593: BEST PLAYERS | W593: FOOTSCRAY | X593: 12 | Y593: 1 | Z593: 1 | AA593: 944 | AB593: 658 | AC593: 143.46504559270517 | AD593: 50
A594: HAWTHORN | D594: YEOMANS | F594: C GAMBETTA | I594: W GAMBETTA | L594: ROBERTS | O594: JACKSON | Q594: DAVEY | W594: PORT MELBOURNE | X594: 12 | Y594: 2 | Z594: 0 | AA594: 1131 | AB594: 638 | AC594: 177.27272727272728 | AD594: 48
A595: NORTHCOTE | D595: MILLS | F595: STONE | I595: T O'KEEFE | L595: COOMBS | O595: KIELY | Q595: JOHNSON | W595: BRUNSWICK | X595: 10 | Y595: 3 | Z595: 1 | AA595: 934 | AB595: 783 | AC595: 119.28480204342273 | AD595: 42
A596: GOALKICKERS | W596: NORTHCOTE | X596: 9 | Y596: 5 | Z596: 0 | AA596: 977 | AB596: 850 | AC596: 114.94117647058823 | AD596: 36
A597: HAWTHORN | D597: W GAMBETTA 2 | G597: C GAMBETTA 2 | J597: COLQUHOUN 2 | M597: HENRY | O597: YEOMANS | Q597: POWER | S597: DAVEY
A598: NORTHCOTE | D598: WRAITH 2 | G598: KIELY 2 | I598: THORPE | K598: GRAY | M598: DIMMICK | O598: MILLER | W598: WILLIAMSTOWN | X598: 8 | Y598: 6 | Z598: 0 | AA598: 952 | AB598: 749 | AC598: 127.10280373831776 | AD598: 32
W599: HAWTHORN | X599: 6 | Y599: 8 | Z599: 0 | AA599: 886 | AB599: 1061 | AC599: 83.506126295947226 | AD599: 24
A600: BRUNSWICK | C600: 2 | D600: 4 | E600: =C600*6+D600 -> 16 | G600: 3 | H600: 12 | I600: =G600*6+H600 -> 30 | K600: 6 | L600: 18 | M600: =K600*6+L600 -> 54 | O600: 9 | P600: 21 | Q600: =O600*6+P600 -> 75 | S600: ESSENDON | W600: NORTH MELBOURNE | X600: 5 | Y600: 9 | Z600: 0 | AA600: 499 | AB600: 409 | AC600: 122.00488997555013 | AD600: 20
A601: ESSENDON ASSOC. | C601: 1 | D601: 4 | E601: =C601*6+D601 -> 10 | G601: 2 | H601: 9 | I601: =G601*6+H601 -> 21 | K601: 5 | L601: 10 | M601: =K601*6+L601 -> 40 | O601: 7 | P601: 12 | Q601: =O601*6+P601 -> 54 | S601: LEWIS | W601: ESSENDON ASSOC. | X601: 3 | Y601: 11 | Z601: 0 | AA601: 789 | AB601: 964 | AC601: 81.84647302904564 | AD601: 12
A602: BEST PLAYERS | W602: PRAHRAN | X602: 2 | Y602: 11 | Z602: 1 | AA602: 625 | AB602: 1066 | AC602: 58.63 | AD602: 10
A603: BRUNSWICK | D603: ALESSIO | G603: GOONAN | J603: SWIFT | L603: SULLIVAN | O603: MILLEN | Q603: MAY | W603: BRIGHTON | X603: 1 | Y603: 12 | Z603: 1 | AA603: 500 | AB603: 1059 | AC603: 47.21 | AD603: 6
A604: ESSENDON ASSOC. | D604: WATT | G604: RAISBECK | J604: RAWLE | L604: JOHNSON | O604: WALSH | Q604: RUSSELL
A605: GOALKICKERS
A606: BRUNSWICK | D606: SULLIVAN 3 | G606: BOYCE 3 | J606: MAY | L606: MOORE | N606: ALESSIO
A607: ESSENDON ASSOC. | D607: WALSH 2 | G607: SMITH | J607: BOLAN | L607: ADAMS | N607: KING | P607: MORIARTY
A609: WILLIAMSTOWN | C609: 2 | D609: 1 | E609: =C609*6+D609 -> 13 | G609: 5 | H609: 7 | I609: =G609*6+H609 -> 37 | K609: 6 | L609: 10 | M609: =K609*6+L609 -> 46 | O609: 12 | P609: 20 | Q609: =O609*6+P609 -> 92 | S609: BRIGHTON BEACH
A610: BRIGHTON | C610: 0 | D610: 5 | E610: =C610*6+D610 -> 5 | G610: 1 | H610: 6 | I610: =G610*6+H610 -> 12 | K610: 5 | L610: 9 | M610: =K610*6+L610 -> 39 | O610: 6 | P610: 11 | Q610: =O610*6+P610 -> 47 | S610: SHELLEY
A611: BEST PLAYERS
A612: WILLIAMSTOWN | D612: KING | G612: CALDWELL | J612: McAULIFFE | M612: SMITH | O612: MUNRO | Q612: CARPENTER
A613: BRIGHTON | D613: BORLAND | G613: CARROLL | J613: P BOLAND | M613: SMITH | O613: VIRTUE | Q613: McCARTHY
A614: GOALKICKERS
A615: WILLIAMSTOWN | D615: MUNRO 4 | G615: McAULIFFE 3 | K615: HAUGHTON 2 | N615: MITCHELL | Q615: BLUNT | S615: CARPENTER
A616: BRIGHTON | D616: COBB 2 | G616: VIRTUE 2 | K616: RINGROSE | N616: WYATT
A618: FOOTSCRAY | C618: 7 | D618: 7 | E618: =C618*6+D618 -> 49 | G618: 7 | H618: 7 | I618: =G618*6+H618 -> 49 | K618: 14 | L618: 14 | M618: =K618*6+L618 -> 98 | O618: 16 | P618: 17 | Q618: =O618*6+P618 -> 113 | S618: FOOTS
A619: PRAHRAN | C619: 0 | D619: 0 | E619: =C619*6+D619 -> 0 | G619: 4 | H619: 5 | I619: =G619*6+H619 -> 29 | K619: 4 | L619: 5 | M619: =K619*6+L619 -> 29 | O619: 8 | P619: 7 | Q619: =O619*6+P619 -> 55 | S619: N CAIN
A620: BEST PLAYERS
A621: FOOTSCRAY | D621: ELLINGSEN | G621: O'DONOGHUE | J621: DOOLAN | M621: OGILVIE | O621: McKENZIE | Q621: MUELEMAN
A622: PRAHRAN | D622: CORFIELD | G622: E JONES | J622: V JONES | M622: LOVE | O622: T BAYLISS | Q622: M BAYLISS
A623: GOALKICKERS
A624: FOOTSCRAY | D624: ELLINGSEN 4 | G624: O'DONOGHUE 4 | J624: MAYBURY 2 | M624: OGILVIE 2 | O624: PORTER 2 | Q624: VALENTINE | T624: BANBURY
A625: PRAHRAN | D625: LOVE 4 | G625: MILLER 2 | J625: COWLEY | L625: BRENNAN
A627: NORTH MELBOURNE | C627: FORFEIT TO
A628: PORT MELBOURNE
A630: ROUND 15 | D630: 27TH AUGUST | H630: WEATHER | K630: COOL CLOUDY LIGHT SHOWERS N.W. WIND | S630: PLAYED AT | X630: LADDER | AB630: ROUND | AD630: 15
D631: 1ST QTR | H631: 2ND QTR | L631: 3RD QTR | P631: FINAL | S631: PORT MELB
A632: PORT MELBOURNE | C632: 3 | D632: 8 | E632: =C632*6+D632 -> 26 | G632: 8 | H632: 11 | I632: =G632*6+H632 -> 59 | K632: 10 | L632: 15 | M632: =K632*6+L632 -> 75 | O632: 13 | P632: 22 | Q632: =O632*6+P632 -> 100 | S632: UMPIRE | W632: TEAM | X632: W | Y632: L | Z632: D | AA632: FOR | AB632: AGST | AC632: % | AD632: PTS
A633: HAWTHORN | C633: 1 | D633: 1 | E633: =C633*6+D633 -> 7 | G633: 3 | H633: 2 | I633: =G633*6+H633 -> 20 | K633: 8 | L633: 4 | M633: =K633*6+L633 -> 52 | O633: 10 | P633: 7 | Q633: =O633*6+P633 -> 67 | S633: SHELLEY
A634: BEST PLAYERS | W634: FOOTSCRAY | X634: 13 | Y634: 1 | Z634: 1 | AA634: 1022 | AB634: 696 | AC634: 146.83908045977012 | AD634: 54
A635: PORT MELBOURNE | D635: DILLON | F635: SHAW | I635: BARFOOT | L635: LESTER | O635: TAYLOR | R635: LEEHANE | W635: PORT MELBOURNE | X635: 13 | Y635: 2 | Z635: 0 | AA635: 1231 | AB635: 705 | AC635: 174.60992907801418 | AD635: 52
A636: HAWTHORN | D636: YEOMANS | F636: ROBERTS | I636: W GAMBETTA | L636: C GAMBETTA | O636: COLQUHOUN | R636: HENRY | W636: BRUNSWICK | X636: 11 | Y636: 3 | Z636: 1 | AA636: 934 | AB636: 783 | AC636: 119.28480204342273 | AD636: 46
A637: GOALKICKERS | W637: WILLIAMSTOWN | X637: 9 | Y637: 6 | Z637: 0 | AA637: 1056 | AB637: 795 | AC637: 132.83018867924528 | AD637: 36
A638: PORT MELBOURNE | D638: TAYLOR 4 | F638: TASKER 2 | I638: LACKMAN 2 | L638: LEEHANE | N638: PASH | P638: SHAW | R638: BENCE | T638: STANFORD
A639: HAWTHORN | D639: W GAMBETTA 2 | G639: C GAMBETTA 2 | J639: DAVEY 2 | L639: MONOHAN 2 | O639: YEOMANS | Q639: ROBERTS | W639: NORTHCOTE | X639: 9 | Y639: 6 | Z639: 0 | AA639: 1037 | AB639: 922 | AC639: 112.47288503253796 | AD639: 36
W640: HAWTHORN | X640: 6 | Y640: 9 | Z640: 0 | AA640: 953 | AB640: 1161 | AC640: 82.084409991386735 | AD640: 24
A641: WILLIAMSTOWN | C641: 6 | D641: 6 | E641: =C641*6+D641 -> 42 | G641: 8 | H641: 10 | I641: =G641*6+H641 -> 58 | K641: 13 | L641: 18 | M641: =K641*6+L641 -> 96 | O641: 14 | P641: 20 | Q641: =O641*6+P641 -> 104 | S641: WILLIAMSTOWN | W641: NORTH MELBOURNE | X641: 5 | Y641: 10 | Z641: 0 | AA641: 499 | AB641: 409 | AC641: 122.00488997555013 | AD641: 20
A642: ESSENDON ASSOC. | C642: 0 | D642: 1 | E642: =C642*6+D642 -> 1 | G642: 3 | H642: 2 | I642: =G642*6+H642 -> 20 | K642: 4 | L642: 2 | M642: =K642*6+L642 -> 26 | O642: 7 | P642: 4 | Q642: =O642*6+P642 -> 46 | S642: JENKINS | W642: PRAHRAN | X642: 3 | Y642: 11 | Z642: 1 | AA642: 697 | AB642: 1126 | AC642: 61.9 | AD642: 14
A643: BEST PLAYERS | W643: ESSENDON ASSOC. | X643: 3 | Y643: 12 | Z643: 0 | AA643: 835 | AB643: 1068 | AC643: 78.18352059925094 | AD643: 12
A644: WILLIAMSTOWN | D644: KING | F644: McAULIFFE | I644: HAUGHTON | L644: CARPENTER | O644: ELLIMAN | Q644: L SMITH | W644: BRIGHTON | X644: 1 | Y644: 13 | Z644: 1 | AA644: 538 | AB644: 1137 | AC644: 47.32 | AD644: 6
A645: ESSENDON ASSOC. | D645: RAWLE | F645: FIELDING | I645: SMITH | L645: JOHNSON | O645: HARRIS | Q645: ADAMS
A646: GOALKICKERS
A647: WILLIAMSTOWN | D647: CARPENTER 6 | G647: HAUGHTON 4 | J647: MITCHELL 2 | M647: McAULIFFE | P647: MUNRO
A648: ESSENDON ASSOC. | D648: SMITH 4 | G648: MORRIS | J648: FIELDING
A650: PRAHRAN | C650: 4 | D650: 3 | E650: =C650*6+D650 -> 27 | G650: 6 | H650: 3 | I650: =G650*6+H650 -> 39 | K650: 9 | L650: 11 | M650: =K650*6+L650 -> 65 | O650: 10 | P650: 12 | Q650: =O650*6+P650 -> 72 | S650: TOORAK PARK
A651: NORTHCOTE | C651: 0 | D651: 5 | E651: =C651*6+D651 -> 5 | G651: 4 | H651: 8 | I651: =G651*6+H651 -> 32 | K651: 6 | L651: 9 | M651: =K651*6+L651 -> 45 | O651: 8 | P651: 12 | Q651: =O651*6+P651 -> 60 | S651: LEWIS
A652: BEST PLAYERS
A653: PRAHRAN | D653: DINGWELL | G653: CORFIELD | J653: CHAPMAN | M653: T BAYLISS | P653: E JONES | S653: BRENNAN
A654: NORTHCOTE | D654: YATES | G654: KENNY | J654: MILLS | M654: PURCELL | P654: STONE | S654: KIELY
A655: GOALKICKERS
A656: PRAHRAN | D656: BRENNAN 3 | G656: LOVE 2 | I656: COWLEY 2 | L656: T BAYLISS | N656: P BAYLISS | Q656: DINGWELL
A657: NORTHCOTE | D657: BENSON 2 | G657: WRAITH 2 | J657: YATES | L657: POWELL | N657: McKECKNIE | Q657: KILEY
A659: FOOTSCRAY | C659: 2 | D659: 3 | E659: =C659*6+D659 -> 15 | G659: 5 | H659: 9 | I659: =G659*6+H659 -> 39 | K659: 9 | L659: 15 | M659: =K659*6+L659 -> 69 | O659: 10 | P659: 18 | Q659: =O659*6+P659 -> 78 | S659: BRIGHTON BEACH
A660: BRIGHTON | C660: 2 | D660: 3 | E660: =C660*6+D660 -> 15 | G660: 2 | H660: 6 | I660: =G660*6+H660 -> 18 | K660: 4 | L660: 7 | M660: =K660*6+L660 -> 31 | O660: 5 | P660: 8 | Q660: =O660*6+P660 -> 38 | S660: McKINNON
A661: BEST PLAYERS
A662: FOOTSCRAY | D662: McINTYRE | G662: HOLDEN | J662: PORTER | M662: ELLINGSEN
A663: BRIGHTON | D663: BAYLISS | G663: RINGROSE | J663: BORLAND | M663: COX | P663: WELSH | S663: MCCARTHY
A664: GOALKICKERS
A665: FOOTSCRAY | D665: ELLINGSEN 3 | G665: O'DONOGHUE 2 | J665: PARK 2 | L665: BANBURY | N665: MARTIN | P665: OGILVIE
A666: BRIGHTON | D666: COBB 2 | G666: RINGROSE | J666: VIRTUE | M666: OSBORNE
A668: NORTH MELBOURNE | C668: FORFEIT TO
A669: BRUNSWICK
A671: ROUND 16 | D671: 3RD SEPTEMBER | J671: WEATHER | M671: FINE | S671: PLAYED AT | X671: LADDER | AB671: ROUND | AD671: 16
D672: 1ST QTR | H672: 2ND QTR | L672: 3RD QTR | P672: FINAL | S672: FOOTSCRAY
A673: FOOTSCRAY | C673: 0 | D673: 4 | E673: =C673*6+D673 -> 4 | G673: 3 | H673: 10 | I673: =G673*6+H673 -> 28 | K673: 6 | L673: 15 | M673: =K673*6+L673 -> 51 | O673: 10 | P673: 17 | Q673: =O673*6+P673 -> 77 | S673: UMPIRE | W673: TEAM | X673: W | Y673: L | Z673: D | AA673: FOR | AB673: AGST | AC673: % | AD673: PTS
A674: PORT MELBOURNE | C674: 2 | D674: 2 | E674: =C674*6+D674 -> 14 | G674: 2 | H674: 5 | I674: =G674*6+H674 -> 17 | K674: 5 | L674: 6 | M674: =K674*6+L674 -> 36 | O674: 5 | P674: 9 | Q674: =O674*6+P674 -> 39 | S674: McKINNON
A675: BEST PLAYERS | W675: FOOTSCRAY | X675: 14 | Y675: 1 | Z675: 1 | AA675: 1099 | AB675: 735 | AC675: 149.52380952380952 | AD675: 58
A676: FOOTSCRAY | D676: OGILVIE | G676: MAYBURY | J676: ELLINGSEN | M676: BANBURY | O676: MARTIN | Q676: HOWELL | W676: PORT MELBOURNE | X676: 13 | Y676: 3 | Z676: 0 | AA676: 1270 | AB676: 782 | AC676: 162.40409207161125 | AD676: 52
A677: PORT MELBOURNE | D677: BARFOOT | G677: MATTHEWS | J677: BENCE | M677: SHAW | O677: DILLON | Q677: WALTON | W677: BRUNSWICK | X677: 12 | Y677: 3 | Z677: 1 | AA677: 1040 | AB677: 835 | AC677: 124.55089820359281 | AD677: 50
A678: GOALKICKERS | W678: WILLIAMSTOWN | X678: 10 | Y678: 6 | Z678: 0 | AA678: 1159 | AB678: 834 | AC678: 138.96882494004797 | AD678: 40
A679: FOOTSCRAY | D679: O'BRIEN 3 | G679: ELLINGSEN 2 | J679: MARTIN 2 | M679: HOWELL | O679: PARK | Q679: OGILVIE
A680: PORT MELBOURNE | D680: LEEHANE 2 | G680: WALTON | J680: SHAW | L680: LACKMAN | W680: NORTHCOTE | X680: 9 | Y680: 7 | Z680: 0 | AA680: 1076 | AB680: 1025 | AC680: 104.97560975609755 | AD680: 36
W681: HAWTHORN | X681: 7 | Y681: 9 | Z681: 0 | AA681: 1024 | AB681: 1215 | AC681: 84.279835390946502 | AD681: 28
A682: WILLIAMSTOWN | C682: 1 | D682: 5 | E682: =C682*6+D682 -> 11 | G682: 7 | H682: 7 | I682: =G682*6+H682 -> 49 | K682: 11 | L682: 12 | M682: =K682*6+L682 -> 78 | O682: 14 | P682: 19 | Q682: =O682*6+P682 -> 103 | S682: WILLIAMSTOWN | W682: NORTH MELBOURNE | X682: 5 | Y682: 11 | Z682: 0 | AA682: 499 | AB682: 409 | AC682: 122.00488997555013 | AD682: 20
A683: NORTHCOTE | C683: 1 | D683: 3 | E683: =C683*6+D683 -> 9 | G683: 2 | H683: 4 | I683: =G683*6+H683 -> 16 | K683: 3 | L683: 9 | M683: =K683*6+L683 -> 27 | O683: 5 | P683: 9 | Q683: =O683*6+P683 -> 39 | S683: J CAIN | W683: ESSENDON ASSOC. | X683: 4 | Y683: 12 | Z683: 0 | AA683: 835 | AB683: 1068 | AC683: 78.18352059925094 | AD683: 16
A684: BEST PLAYERS | W684: PRAHRAN | X684: 3 | Y684: 12 | Z684: 1 | AA684: 751 | AB684: 1197 | AC684: 62.74 | AD684: 14
A685: WILLIAMSTOWN | D685: McAULIFFE | G685: MITCHELL | J685: ELLIMAN | L685: KING | N685: CARPENTER | Q685: MUNRO | W685: BRIGHTON | X685: 1 | Y685: 14 | Z685: 1 | AA685: 590 | AB685: 1243 | AC685: 47.47 | AD685: 6
A686: NORTHCOTE | D686: W JOHNSON | G686: COCKRAM | J686: O'KEEFE | L686: BUISST | N686: STONE | Q686: GRAY
A687: GOALKICKERS
A688: WILLIAMSTOWN | D688: McAULIFFE 5 | G688: HAUGHTON 3 | J688: CARPENTER 3 | M688: MUNRO 2 | P688: N McDONALD
A689: NORTHCOTE | D689: KELLY | F689: DUNSTONE | I689: SMITH | K689: COOPER | N689: COCKRAM
A691: HAWTHORN | C691: 5 | D691: 2 | E691: =C691*6+D691 -> 32 | G691: 6 | H691: 4 | I691: =G691*6+H691 -> 40 | K691: 9 | L691: 8 | M691: =K691*6+L691 -> 62 | O691: 10 | P691: 11 | Q691: =O691*6+P691 -> 71 | S691: HAW
A692: PRAHRAN | C692: 1 | D692: 2 | E692: =C692*6+D692 -> 8 | G692: 5 | H692: 7 | I692: =G692*6+H692 -> 37 | K692: 6 | L692: 8 | M692: =K692*6+L692 -> 44 | O692: 7 | P692: 12 | Q692: =O692*6+P692 -> 54 | S692: LEWIS
A693: BEST PLAYERS
A694: HAWTHORN | D694: W GAMBETTA | G694: REEVES | J694: ROBERTS | M694: McCASHNEY | P694: DAVEY | R694: YEOMANS
A695: PRAHRAN | D695: NAYLOR | G695: DINGWELL | J695: LOVE | M695: CHADWICK | P695: V JONES | R695: SPENCE
A696: GOALKICKERS
A697: HAWTHORN | D697: W GAMBETTA 6 | H697: YEOMANS 2 | K697: MONOHAN 2
A698: PRAHRAN | D698: BRENNAN 3 | H698: V JONES 2 | K698: FILER | M698: EDGAR
A700: BRUNSWICK | C700: 5 | D700: 2 | E700: =C700*6+D700 -> 32 | G700: 9 | H700: 5 | I700: =G700*6+H700 -> 59 | K700: 12 | L700: 8 | M700: =K700*6+L700 -> 80 | O700: 16 | P700: 10 | Q700: =O700*6+P700 -> 106 | S700: BRUNSWICK
A701: BRIGHTON | C701: 0 | D701: 6 | E701: =C701*6+D701 -> 6 | G701: 2 | H701: 8 | I701: =G701*6+H701 -> 20 | K701: 4 | L701: 9 | M701: =K701*6+L701 -> 33 | O701: 7 | P701: 10 | Q701: =O701*6+P701 -> 52
A702: BEST PLAYERS
A703: BRUNSWICK | D703: SULLIVAN | G703: CHRISTIE | J703: SWIFT | M703: MILLEN | P703: BOYCE | R703: CAHILL
A704: BRIGHTON | D704: RINGROSE | G704: WYATT | J704: HATTAM | M704: WHITE | P704: VIRTUE | R704: SHERIDAN
A705: GOALKICKERS
A706: BRUNSWICK | D706: SULLIVAN 5 | G706: MILLEN 3 | I706: CHRISTIE 2 | L706: BOYCE 2 | N706: ALESSIO | P706: McMAHON | S706: FAUST | U706: MOORE
A707: BRIGHTON | D707: COBB 3 | G707: SHERIDAN 2 | J707: TURNBULL | M707: OSBORNE
A709: NORTH MELBOURNE | C709: FORFEIT TO
A710: ESSENDON ASSOC.
A712: ROUND 17 | D712: 10TH SEPTEMBER | J712: WEATHER | M712: CLOUDY NORTH WIND | S712: PLAYED AT | X712: LADDER | AB712: ROUND | AD712: 17
D713: 1ST QTR | H713: 2ND QTR | L713: 3RD QTR | P713: FINAL | S713: BRUNSWICK
A714: BRUNSWICK | C714: 1 | D714: 2 | E714: =C714*6+D714 -> 8 | G714: 2 | H714: 2 | I714: =G714*6+H714 -> 14 | K714: 4 | L714: 7 | M714: =K714*6+L714 -> 31 | O714: 6 | P714: 9 | Q714: =O714*6+P714 -> 45 | S714: UMPIRE | W714: TEAM | X714: W | Y714: L | Z714: D | AA714: FOR | AB714: AGST | AC714: % | AD714: PTS
A715: WILLIAMSTOWN | C715: 0 | D715: 0 | E715: =C715*6+D715 -> 0 | G715: 0 | H715: 6 | I715: =G715*6+H715 -> 6 | K715: 0 | L715: 6 | M715: =K715*6+L715 -> 6 | O715: 4 | P715: 9 | Q715: =O715*6+P715 -> 33 | S715: LEWIS
A716: BEST PLAYERS | W716: FOOTSCRAY | X716: 15 | Y716: 1 | Z716: 1 | AA716: 1169 | AB716: 797 | AC716: 146.67503136762861 | AD716: 62
A717: BRUNSWICK | D717: SWIFT | G717: MOORE | I717: MARSHALL | L717: ALESSIO | N717: O'CONNOR | Q717: SULLIVAN | W717: PORT MELBOURNE | X717: 14 | Y717: 3 | Z717: 0 | AA717: 1379 | AB717: 825 | AC717: 167.15151515151516 | AD717: 56
A718: WILLIAMSTOWN | D718: CONDON | G718: KING | I718: O'CONNEL | L718: ELLIMAN | N718: MITCHELL | Q718: N McDONALD | W718: BRUNSWICK | X718: 13 | Y718: 3 | Z718: 1 | AA718: 1085 | AB718: 868 | AC718: 125 | AD718: 54
A719: GOALKICKERS | W719: WILLIAMSTOWN | X719: 10 | Y719: 7 | Z719: 0 | AA719: 1192 | AB719: 879 | AC719: 135.60864618885097 | AD719: 40
A720: BRUNSWICK | D720: SULLIVAN 2 | G720: BOYCE 2 | J720: CHRISTIE | M720: MAY
A721: WILLIAMSTOWN | D721: MITCHELL 2 | G721: CARPENTER | J721: CONDON | W721: NORTHCOTE | X721: 10 | Y721: 7 | Z721: 0 | AA721: 1076 | AB721: 1025 | AC721: 104.97560975609755 | AD721: 40
W722: HAWTHORN | X722: 8 | Y722: 9 | Z722: 0 | AA722: 1091 | AB722: 1271 | AC722: 85.837922895357991 | AD722: 32
A723: FOOTSCRAY | C723: 3 | D723: 4 | E723: =C723*6+D723 -> 22 | G723: 6 | H723: 5 | I723: =G723*6+H723 -> 41 | K723: 9 | L723: 7 | M723: =K723*6+L723 -> 61 | O723: 10 | P723: 10 | Q723: =O723*6+P723 -> 70 | S723: FOOTSCRAY | W723: NORTH MELBOURNE | X723: 5 | Y723: 12 | Z723: 0 | AA723: 499 | AB723: 409 | AC723: 122.00488997555013 | AD723: 20
A724: ESSENDON ASSOC. | C724: 0 | D724: 5 | E724: =C724*6+D724 -> 5 | G724: 4 | H724: 10 | I724: =G724*6+H724 -> 34 | K724: 6 | L724: 14 | M724: =K724*6+L724 -> 50 | O724: 7 | P724: 20 | Q724: =O724*6+P724 -> 62 | S724: THOMPSON | W724: ESSENDON ASSOC. | X724: 4 | Y724: 13 | Z724: 0 | AA724: 897 | AB724: 1138 | AC724: 78.822495606326896 | AD724: 16
A725: BEST PLAYERS | W725: PRAHRAN | X725: 3 | Y725: 13 | Z725: 1 | AA725: 794 | AB725: 1306 | AC725: 60.8 | AD725: 14
A726: FOOTSCRAY | D726: MAYBURY | G726: PARK | I726: SMITH | L726: McINTYRE | N726: OGILVIE | Q726: BANBURY | W726: BRIGHTON | X726: 1 | Y726: 15 | Z726: 1 | AA726: 646 | AB726: 1310 | AC726: 49.31 | AD726: 6
A727: ESSENDON ASSOC. | D727: WATT | G727: KING | I727: GILES | L727: FIELDING | N727: RAWLE | Q727: BLACKMAN
A728: GOALKICKERS
A729: FOOTSCRAY | D729: PARK 6 | G729: O'BRIEN 2 | J729: ELLINGSEN | M729: OGILVIE
A730: ESSENDON ASSOC. | D730: KING 2 | G730: MORIARTY 2 | J730: ADAMS | L730: WALSH | N730: SMITH
A732: HAWTHORN | C732: 1 | D732: 0 | E732: =C732*6+D732 -> 6 | G732: 4 | H732: 6 | I732: =G732*6+H732 -> 30 | K732: 4 | L732: 8 | M732: =K732*6+L732 -> 32 | O732: 9 | P732: 13 | Q732: =O732*6+P732 -> 67 | S732: BRIGHTON BEACH
A733: BRIGHTON | C733: 3 | D733: 6 | E733: =C733*6+D733 -> 24 | G733: 4 | H733: 6 | I733: =G733*6+H733 -> 30 | K733: 4 | L733: 8 | M733: =K733*6+L733 -> 32 | O733: 8 | P733: 8 | Q733: =O733*6+P733 -> 56 | S733: RILEY
A734: BEST PLAYERS
A735: HAWTHORN | D735: RADEMACHER | G735: YEOMANS | J735: McCASHNEY | M735: COLQUHOUN | P735: HENRY | S735: BURKE
A736: BRIGHTON | D736: BAYLISS | G736: RINGROSE | J736: COBB | M736: P BOLAND | P736: COLLINS | S736: CARROLL
A737: GOALKICKERS
A738: HAWTHORN | D738: COLQUHOUN 3 | G738: W GAMBETTA 2 | K738: MONOHAN 2 | N738: C GAMBETTA | Q738: YEOMANS
A739: BRIGHTON | D739: COBB 4 | G739: RINGROSE | J739: WYATT | L739: DUNCAN | N739: VIRTUE
A741: PORT MELBOURNE | C741: 4 | D741: 2 | E741: =C741*6+D741 -> 26 | G741: 9 | H741: 7 | I741: =G741*6+H741 -> 61 | K741: 12 | L741: 14 | M741: =K741*6+L741 -> 86 | O741: 15 | P741: 19 | Q741: =O741*6+P741 -> 109 | S741: TOORAK PARK
A742: PRAHRAN | C742: 5 | D742: 3 | E742: =C742*6+D742 -> 33 | G742: 6 | H742: 4 | I742: =G742*6+H742 -> 40 | K742: 6 | L742: 5 | M742: =K742*6+L742 -> 41 | O742: 6 | P742: 7 | Q742: =O742*6+P742 -> 43 | S742: JENKINS
A743: BEST PLAYERS
A744: PORT MELBOURNE | D744: LEEHANE | G744: TAYLOR | J744: MATTHEWS | M744: DILLON | P744: BARFOOT | S744: W RUDD
A745: PRAHRAN | D745: BRENNAN | G745: NAYLOR | J745: E JONES | M745: M BAYLISS | P745: KELLY | S745: COWLEY
A746: GOALKICKERS
A747: PORT MELBOURNE | D747: TAYLOR 5 | F747: LEEHANE 4 | I747: SHAW 2 | K747: DILLON | M747: LACKMAN | P747: WALTON | R747: TASKER
A748: PRAHRAN | D748: BRENNAN 2 | G748: KELLY | I748: EDGAR | K748: COWLEY | M748: WALDRON
A750: NORTH MELBOURNE | C750: FORFEIT TO
A751: NORTHCOTE
A753: ROUND 18 | D753: 17TH SEPTEMBER | H753: WEATHER | K753: EARLY SHOWER THEN FINE N BREEZE | S753: PLAYED AT | X753: LADDER | AB753: ROUND | AD753: 18
D754: 1ST QTR | H754: 2ND QTR | L754: 3RD QTR | P754: FINAL | S754: NORTHCOTE
A755: FOOTSCRAY | C755: 4 | D755: 3 | E755: =C755*6+D755 -> 27 | G755: 9 | H755: 8 | I755: =G755*6+H755 -> 62 | K755: 11 | L755: 9 | M755: =K755*6+L755 -> 75 | O755: 15 | P755: 12 | Q755: =O755*6+P755 -> 102 | S755: UMPIRE | W755: TEAM | X755: W | Y755: L | Z755: D | AA755: FOR | AB755: AGST | AC755: % | AD755: PTS
A756: NORTHCOTE | C756: 2 | D756: 3 | E756: =C756*6+D756 -> 15 | G756: 3 | H756: 4 | I756: =G756*6+H756 -> 22 | K756: 5 | L756: 10 | M756: =K756*6+L756 -> 40 | O756: 7 | P756: 10 | Q756: =O756*6+P756 -> 52 | S756: SHELLEY
A757: BEST PLAYERS | W757: FOOTSCRAY | X757: 16 | Y757: 1 | Z757: 1 | AA757: 1271 | AB757: 849 | AC757: 149.70553592461721 | AD757: 66
A758: FOOTSCRAY | D758: MARTIN | G758: ELLINGSEN | J758: HOWELL | M758: PARK | O758: OGILVIE | R758: HOLDEN | W758: PORT MELBOURNE | X758: 15 | Y758: 3 | Z758: 0 | AA758: 1522 | AB758: 841 | AC758: 180.97502972651606 | AD758: 60
A759: NORTHCOTE | D759: BUISST | G759: COOMBS | J759: KENNY | M759: GRAY | O759: COCKRAM | R759: HELLWIG | W759: BRUNSWICK | X759: 14 | Y759: 3 | Z759: 1 | AA759: 1221 | AB759: 917 | AC759: 133.1515812431843 | AD759: 58
A760: GOALKICKERS | W760: WILLIAMSTOWN | X760: 11 | Y760: 7 | Z760: 0 | AA760: 1192 | AB760: 879 | AC760: 135.60864618885097 | AD760: 44
A761: FOOTSCRAY | D761: ELLINGSEN 5 | G761: PARK 5 | I761: MARTIN 2 | L761: O'BRIEN | N761: SAMSON | P761: OGILVIE
A762: NORTHCOTE | D762: WRAITH 2 | G762: HELLWIG 2 | J762: KENNY 2 | M762: KIELY | W762: NORTHCOTE | X762: 10 | Y762: 8 | Z762: 0 | AA762: 1128 | AB762: 1127 | AC762: 100.08873114463177 | AD762: 40
W763: HAWTHORN | X763: 8 | Y763: 10 | Z763: 0 | AA763: 1140 | AB763: 1407 | AC763: 81.02345415778251 | AD763: 32
A764: BRUNSWICK | C764: 5 | D764: 5 | E764: =C764*6+D764 -> 35 | G764: 9 | H764: 11 | I764: =G764*6+H764 -> 65 | K764: 15 | L764: 16 | M764: =K764*6+L764 -> 106 | O764: 19 | P764: 22 | Q764: =O764*6+P764 -> 136 | S764: HAW | W764: NORTH MELBOURNE | X764: 5 | Y764: 13 | Z764: 0 | AA764: 499 | AB764: 409 | AC764: 122.00488997555013 | AD764: 20
A765: HAWTHORN | C765: 2 | D765: 2 | E765: =C765*6+D765 -> 14 | G765: 2 | H765: 8 | I765: =G765*6+H765 -> 20 | K765: 5 | L765: 10 | M765: =K765*6+L765 -> 40 | O765: 6 | P765: 13 | Q765: =O765*6+P765 -> 49 | S765: RILEY | W765: ESSENDON ASSOC. | X765: 5 | Y765: 13 | Z765: 0 | AA765: 991 | AB765: 1187 | AC765: 83.48778433024431 | AD765: 20
A766: BEST PLAYERS | W766: PRAHRAN | X766: 3 | Y766: 14 | Z766: 1 | AA766: 843 | AB766: 1400 | AC766: 60.21 | AD766: 14
A767: BRUNSWICK | D767: MOORE | G767: CAHILL | I767: BOYCE | K767: SULLIVAN | N767: GRIMSTER | Q767: O'CONNOR | W767: BRIGHTON | X767: 1 | Y767: 16 | Z767: 1 | AA767: 662 | AB767: 1453 | AC767: 45.56 | AD767: 6
A768: HAWTHORN | D768: McCASHNEY | G768: REEVES | I768: DAVEY | K768: BURKE | N768: MONOHAN | Q768: YEOMANS
A769: GOALKICKERS
A770: BRUNSWICK | D770: SULLIVAN 7 | G770: BOYCE 7 | J770: MILLEN 2 | M770: O'CONNOR 2 | P770: ALESSIO
A771: HAWTHORN | D771: MONOHAN 3 | G771: C GAMBETTA 2 | K771: COLQUHOUN
A773: ESSENDON ASSOC. | C773: 4 | D773: 7 | E773: =C773*6+D773 -> 31 | G773: 6 | H773: 7 | I773: =G773*6+H773 -> 43 | K773: 12 | L773: 9 | M773: =K773*6+L773 -> 81 | O773: 14 | P773: 10 | Q773: =O773*6+P773 -> 94 | S773: TOORAK PARK
A774: PRAHRAN | C774: 2 | D774: 1 | E774: =C774*6+D774 -> 13 | G774: 4 | H774: 3 | I774: =G774*6+H774 -> 27 | K774: 4 | L774: 4 | M774: =K774*6+L774 -> 28 | O774: 7 | P774: 7 | Q774: =O774*6+P774 -> 49 | S774: THOMPSON
A775: BEST PLAYERS
A776: ESSENDON ASSOC. | D776: RAWLE | G776: SMITH | J776: SHORTEN | M776: KING | P776: ADAMS | S776: FIELDING
A777: PRAHRAN | D777: CORFIELD | G777: MOORE | J777: BRENNAN | M777: CHAPMAN | P777: E JONES | S777: M BAYLISS
A778: GOALKICKERS
A779: ESSENDON ASSOC. | D779: SMITH 5 | G779: MORIARTY 3 | J779: RUSSELL 2 | M779: BOLAN 2 | O779: GILES | Q779: JOHNSTON
A780: PRAHRAN | D780: NAYLOR 2 | G780: M BAYLISS 2 | J780: BRENNAN 2 | M780: ARCHER
A782: PORT MELBOURNE | C782: 2 | D782: 9 | E782: =C782*6+D782 -> 21 | G782: 7 | H782: 21 | I782: =G782*6+H782 -> 63 | K782: 10 | L782: 27 | M782: =K782*6+L782 -> 87 | O782: 18 | P782: 35 | Q782: =O782*6+P782 -> 143 | S782: PORT MELB
A783: BRIGHTON | C783: 0 | D783: 2 | E783: =C783*6+D783 -> 2 | G783: 1 | H783: 2 | I783: =G783*6+H783 -> 8 | K783: 1 | L783: 3 | M783: =K783*6+L783 -> 9 | O783: 2 | P783: 4 | Q783: =O783*6+P783 -> 16 | S783: LEWIS
A784: BEST PLAYERS
A785: PORT MELBOURNE | D785: MATTHEWS | G785: TAYLOR | J785: WALTON | M785: W RUDD | P785: STANFORD | S785: LACKMAN
A786: BRIGHTON | D786: McCARTHY | G786: BORLAND | J786: P BOLAND | M786: WELSH | P786: WHITE | S786: COLLINS
A787: GOALKICKERS
A788: PORT MELBOURNE | D788: TAYLOR 10 | G788: LACKMAN 4 | J788: LESTER | L788: MATTHEWS | O788: DILLON | Q788: NANCARROW
A789: BRIGHTON | D789: DANGERFIELD | G789: RINGROSE
A791: NORTH MELBOURNE | C791: FORFEIT TO
A792: WILLIAMSTOWN
A794: FINALS
A795: 1ST SEMI | D795: 24TH SEPTEMBER | J795: WEATHER | M795: FINE
D796: 1ST QTR | H796: 2ND QTR | L796: 3RD QTR | P796: FINAL | S796: PLAYED AT
A797: WILLIAMSTOWN | C797: 3 | D797: 2 | E797: =C797*6+D797 -> 20 | G797: 9 | H797: 7 | I797: =G797*6+H797 -> 61 | K797: 12 | L797: 9 | M797: =K797*6+L797 -> 81 | O797: 15 | P797: 11 | Q797: =O797*6+P797 -> 101 | S797: EAST MELB
A798: PORT MELBOURNE | C798: 4 | D798: 2 | E798: =C798*6+D798 -> 26 | G798: 6 | H798: 3 | I798: =G798*6+H798 -> 39 | K798: 8 | L798: 7 | M798: =K798*6+L798 -> 55 | O798: 11 | P798: 9 | Q798: =O798*6+P798 -> 75 | S798: UMPIRE
A799: BEST PLAYERS | S799: JENKINS
A800: WILLIAMSTOWN | D800: KING | G800: HAUGHTON | J800: N McDONALD | M800: CARPENTER | P800: McAULIFFE | S800: MITCHELL
A801: PORT MELBOURNE | D801: WALTON | G801: W RUDD | J801: BENCE | M801: TAYLOR | P801: PASH | S801: LEEHANE
A802: GOALKICKERS
A803: WILLIAMSTOWN | D803: CARPENTER 4 | G803: McAULIFFE 3 | J803: MITCHELL 2 | M803: HAUGHTON 2 | P803: ELLIMAN | R803: N McDONALD | V803: MUNRO | X803: STANBRIDGE
A804: PORT MELBOURNE | D804: TAYLOR 3 | G804: LEEHANE 2 | J804: PASH 2 | L804: LACKMAN | N804: BENCE | P804: W RUDD | R804: DILLON
A806: 2ND SEMI | D806: 1ST OCTOBER | J806: WEATHER | M806: COOL LIGHT SHOWERS SOUTH WIND
A807: FOOTSCRAY | C807: 1 | D807: 3 | E807: =C807*6+D807 -> 9 | G807: 3 | H807: 3 | I807: =G807*6+H807 -> 21 | K807: 9 | L807: 4 | M807: =K807*6+L807 -> 58 | O807: 12 | P807: 5 | Q807: =O807*6+P807 -> 77 | S807: EMCG
A808: BRUNSWICK | C808: 1 | D808: 1 | E808: =C808*6+D808 -> 7 | G808: 3 | H808: 5 | I808: =G808*6+H808 -> 23 | K808: 4 | L808: 7 | M808: =K808*6+L808 -> 31 | O808: 7 | P808: 10 | Q808: =O808*6+P808 -> 52 | S808: JENKINS
A809: BEST PLAYERS
A810: FOOTSCRAY | D810: HOWELL | G810: MARTIN | J810: MUELEMAN | M810: ELLINGSEN | P810: C GRIERSON | S810: McINTYRE
A811: BRUNSWICK | D811: SWIFT | G811: McMAHON | J811: CAHILL | M811: MOORE | P811: ADAMS | S811: GRIMSTER
A812: GOALKICKERS
A813: FOOTSCRAY | D813: HOWELL 3 | G813: ELLINGSEN 3 | J813: O'BRIEN 2 | M813: MARTIN 2 | P813: O'DONOGHUE | S813: BANBURY
A814: BRUNSWICK | D814: McMAHON 4 | G814: ALESSIO | J814: FAUST | M814: SULLIVAN
A816: FINAL | D816: ABANDONED 15 MINS INTO 3RD QUARTER DUE TO SEVERE HAILSTORM
D817: 8TH OCTOBER | J817: WEATHER | M817: STORMY
A818: WILLIAMSTOWN | C818: 6 | D818: 2 | E818: =C818*6+D818 -> 38 | G818: 8 | H818: 4 | I818: =G818*6+H818 -> 52 | K818: 10 | L818: 5 | M818: =K818*6+L818 -> 65 | S818: EAST MELB
A819: FOOTSCRAY | C819: 2 | D819: 3 | E819: =C819*6+D819 -> 15 | G819: 6 | H819: 6 | I819: =G819*6+H819 -> 42 | K819: 9 | L819: 7 | M819: =K819*6+L819 -> 61 | S819: JENKINS
A820: BEST PLAYERS
A821: WILLIAMSTOWN | D821: MITCHELL | G821: CARPENTER | J821: MUNRO | M821: HAUGHTON | P821: CALDWELL | S821: STANBRIDGE
A822: FOOTSCRAY | D822: OGILVIE | G822: O'BRIEN | J822: HOWELL | M822: O'DONOGHUE | P822: SAMSON | S822: SHERRY
A823: GOALKICKERS
A824: WILLIAMSTOWN | D824: CARPENTER 4 | H824: MUNRO 3 | K824: HAUGHTON 2 | N824: McAULIFFE
A825: FOOTSCRAY | D825: O'DONOGHUE 3 | H825: ELLINGSEN 2 | K825: PARK 2 | M825: O'BRIEN | O825: MARTIN
A827: FINAL REPLAY | D827: 15TH OCTOBER | J827: WEATHER | M827: CLOUDY BUT FINE LIGHT SOUTH BREEZE
A828: WILLIAMSTOWN | C828: 4 | D828: 5 | E828: =C828*6+D828 -> 29 | G828: 5 | H828: 10 | I828: =G828*6+H828 -> 40 | K828: 8 | L828: 14 | M828: =K828*6+L828 -> 62 | O828: 9 | P828: 14 | Q828: =O828*6+P828 -> 68 | S828: EAST MELB
A829: FOOTSCRAY | C829: 1 | D829: 0 | E829: =C829*6+D829 -> 6 | G829: 4 | H829: 3 | I829: =G829*6+H829 -> 27 | K829: 8 | L829: 4 | M829: =K829*6+L829 -> 52 | O829: 10 | P829: 5 | Q829: =O829*6+P829 -> 65 | S829: JENKINS
A830: BEST PLAYERS
A831: WILLIAMSTOWN | D831: CALDWELL | G831: MITCHELL | J831: McAULIFFE | M831: KING | P831: CONDON | S831: O'CONNELL
A832: FOOTSCRAY | D832: MAYBURY | G832: SAMSON | J832: HOWELL | M832: SHERRY | P832: BANBURY | S832: ELLINGSEN
A833: GOALKICKERS
A834: WILLIAMSTOWN | D834: McAULIFFE 3 | G834: MITCHELL 3 | J834: JAMIESON | M834: ARMSTRONG | P834: HAUGHTON
A835: FOOTSCRAY | D835: PARK 3 | F835: ELLINGSEN 2 | I835: O'DONOGHUE 2 | L835: MARTIN | N835: SAMSON | P835: BANBURY
A837: GRAND FINAL | D837: 22ND OCTOBER | J837: WEATHER | M837: FINE COLL SOUTH WIND
A838: WILLIAMSTOWN | C838: 2 | D838: 1 | E838: 13 | G838: 2 | H838: 5 | I838: 17 | K838: 7 | L838: 5 | M838: 47 | O838: 8 | P838: 9 | Q838: =O838*6+P838 -> 57 | S838: FITZROY
A839: FOOTSCRAY | C839: 0 | D839: 4 | E839: 4 | G839: 3 | H839: 6 | I839: 24 | K839: 5 | L839: 8 | M839: 38 | O839: 5 | P839: 9 | Q839: =O839*6+P839 -> 39 | S839: KAIN
A840: BEST PLAYERS
A841: WILLIAMSTOWN | D841: KING | G841: CONDON | J841: N McDONALD | M841: J McDONALD | P841: CARPENTER | S841: CALDWELL
A842: FOOTSCRAY | D842: SAMSON | G842: SHERRY | J842: MAYBURY | M842: OGILVIE | P842: MARTIN | S842: PARK
A843: GOALKICKERS
A844: WILLIAMSTOWN | D844: CARPENTER 3 | G844: MUNRO 2 | J844: McAULIFFE | M844: HAUGHTON | P844: N McDONALD
A845: FOOTSCRAY | D845: SAMSON 2 | G845: PARK | J845: McKENZIE | M845: SMITH
A847: REPRESENTATIVE GAME | F847: 6TH AUGUST | J847: WEATHER | M847: CLOUDY SOUTH WIND GROUND SOFT
A848: V F A | C848: 6 | D848: 2 | E848: =C848*6+D848 -> 38 | G848: 8 | H848: 4 | I848: =G848*6+H848 -> 52 | K848: 11 | L848: 8 | M848: =K848*6+L848 -> 74 | O848: 18 | P848: 10 | Q848: =O848*6+P848 -> 118 | T848: EAST MELB
A849: W A GOLDFIELDS | C849: 1 | D849: 0 | E849: =C849*6+D849 -> 6 | G849: 1 | H849: 2 | I849: =G849*6+H849 -> 8 | K849: 1 | L849: 5 | M849: =K849*6+L849 -> 11 | O849: 2 | P849: 10 | Q849: =O849*6+P849 -> 22 | T849: SHELLEY
A850: BEST PLAYERS
A851: V F A | D851: McAULIFFE | G851: WALTON | J851: ADAMS | M851: MAY | P851: WATTS | S851: MARTIN
A852: W A GOLDFIELDS | D852: COOPER | G852: McDIARMID | J852: BROWN | M852: HICKEY | P852: T SULLIVAN | S852: W SULLIVAN
A853: GOALKICKERS
A854: V F A | D854: McAULIFFE 6 | G854: SULLIVAN 3 | J854: MARTIN 3 | M854: McCARTHY 3 | P854: WALLIS 2 | S854: SAMSON
A855: W A GOLDFIELDS | D855: COOPER | G855: BROWN