A1: Victorian Football Association
A2: Season 1922
A3: © Copyright Wal Williams | F3: First created: 2 August 2014
A4: Contact: joywalwi at gmail dot com | F4: Last updated: 2 August 2014 | W4: VFA Results and tables - Link to the main index page
A5: You are free to copy this document in whole or part provided that proper acknowledgement is given to the author. All rights reserved.
A7: YEAR 1922 | S7: PLAYED AT
A8: ROUND 1 | E8: 6TH MAY | J8: WEATHER | M8: FINE N.W. BREEZE | S8: BRUNSWICK | X8: LADDER | AB8: ROUND | AD8: 1
D9: 1ST QTR | H9: 2ND QTR | L9: 3RD QTR | P9: FINAL | S9: UMPIRE
A10: FOOTSCRAY | C10: 1 | D10: 9 | E10: =C10*6+D10 -> 15 | G10: 4 | H10: 11 | I10: =G10*6+H10 -> 35 | K10: 7 | L10: 15 | M10: =K10*6+L10 -> 57 | O10: 9 | P10: 17 | Q10: =O10*6+P10 -> 71 | S10: LEWIS | W10: TEAM | X10: W | Y10: L | Z10: D | AA10: FOR | AB10: AGST | AC10: % | AD10: PTS
A11: BRUNSWICK | C11: 0 | D11: 2 | E11: =C11*6+D11 -> 2 | G11: 2 | H11: 4 | I11: =G11*6+H11 -> 16 | K11: 4 | L11: 4 | M11: =K11*6+L11 -> 28 | O11: 6 | P11: 7 | Q11: =O11*6+P11 -> 43
A12: BEST PLAYERS | W12: WILLIAMSTOWN | X12: 1 | Y12: 0 | Z12: 0 | AA12: 108 | AB12: 31 | AC12: 348.38709677419354 | AD12: 4
A13: FOOTSCRAY | D13: McCARTHY | G13: EASON | I13: SHERRY | L13: O'BRIEN | O13: ROWE | Q13: MARTIN | W13: HAWTHORN | X13: 1 | Y13: 0 | Z13: 0 | AA13: 64 | AB13: 31 | AC13: 206.45161290322579 | AD13: 4
A14: BRUNSWICK | D14: SWIFT | G14: SINCLAIR | I14: McINERNEY | L14: MOORE | O14: HANDO | Q14: MILLEN | W14: FOOTSCRAY | X14: 1 | Y14: 0 | Z14: 0 | AA14: 71 | AB14: 43 | AC14: 165.11627906976744 | AD14: 4
A15: GOALKICKERS | W15: PORT MELBOURNE | X15: 1 | Y15: 0 | Z15: 0 | AA15: 92 | AB15: 74 | AC15: 124.32432432432432 | AD15: 4
A16: FOOTSCRAY | D16: WALSH 3 | G16: EASON 3 | I16: G ROWE | K16: MARTIN | M16: DOOLAN
A17: BRUNSWICK | D17: MILLEN 2 | G17: McINERNEY 2 | J17: SULLIVAN | M17: HAMPTON | W17: NORTH MELBOURNE | X17: 1 | Y17: 0 | Z17: 0 | AA17: 47 | AB17: 45 | AC17: 104.44444444444444 | AD17: 4
W18: BRIGHTON | X18: 0 | Y18: 1 | Z18: 0 | AA18: 45 | AB18: 47 | AC18: 95.744680851063833 | AD18: 0
A19: PORT MELBOURNE | C19: 2 | D19: 2 | E19: =C19*6+D19 -> 14 | G19: 5 | H19: 8 | I19: =G19*6+H19 -> 38 | K19: 5 | L19: 10 | M19: =K19*6+L19 -> 40 | O19: 13 | P19: 14 | Q19: =O19*6+P19 -> 92 | S19: NORTHCOTE | W19: NORTHCOTE | X19: 0 | Y19: 1 | Z19: 0 | AA19: 74 | AB19: 92 | AC19: 80.434782608695656 | AD19: 0
A20: NORTHCOTE | C20: 2 | D20: 1 | E20: =C20*6+D20 -> 13 | G20: 4 | H20: 3 | I20: =G20*6+H20 -> 27 | K20: 9 | L20: 6 | M20: =K20*6+L20 -> 60 | O20: 11 | P20: 8 | Q20: =O20*6+P20 -> 74 | S20: KAIN | W20: BRUNSWICK | X20: 0 | Y20: 1 | Z20: 0 | AA20: 43 | AB20: 71 | AC20: 60.563380281690144 | AD20: 0
A21: BEST PLAYERS | W21: GEELONG ASSOC. | X21: 0 | Y21: 1 | Z21: 0 | AA21: 31 | AB21: 64 | AC21: 48.4375 | AD21: 0
A22: PORT MELBOURNE | D22: W RUDD | G22: BARFOOT | J22: TREMBATH | M22: TAYLOR | O22: BRISCOE | Q22: DOBRIGH | W22: PRAHRAN | X22: 0 | Y22: 1 | Z22: 0 | AA22: 31 | AB22: 108 | AC22: 28.703703703703702 | AD22: 0
A23: NORTHCOTE | D23: GRAY | G23: JOHNSON | J23: DILLON | M23: INCH | O23: MASON | Q23: DOWNES
A24: GOALKICKERS
A25: PORT MELBOURNE | D25: TAYLOR 8 | G25: PASH 2 | I25: FORBES | K25: McQUEEN | M25: J RUDD
A26: NORTHCOTE | D26: INCH 4 | G26: JOHNSON 3 | J26: DILLON | L26: WRAITH | N26: MILLS | P26: DOWNES
A28: WILLIAMSTOWN | C28: 2 | D28: 4 | E28: =C28*6+D28 -> 16 | G28: 6 | H28: 9 | I28: =G28*6+H28 -> 45 | K28: 9 | L28: 11 | M28: =K28*6+L28 -> 65 | O28: 15 | P28: 18 | Q28: =O28*6+P28 -> 108 | S28: WILLIAMSTOWN
A29: PRAHRAN | C29: 2 | D29: 1 | E29: =C29*6+D29 -> 13 | G29: 4 | H29: 1 | I29: =G29*6+H29 -> 25 | K29: 4 | L29: 4 | M29: =K29*6+L29 -> 28 | O29: 4 | P29: 7 | Q29: =O29*6+P29 -> 31 | S29: DAVEY
A30: BEST PLAYERS
A31: WILLIAMSTOWN | D31: GEISLER | F31: MILES | I31: O'CONNELL | L31: McAULIFFE | O31: CARPENTER | R31: O'KEEFE
A32: PRAHRAN | D32: FIELD | F32: CALLENDER | I32: CHAPMAN | L32: McMAHON | O32: MILLER | R32: QUINN
A33: GOALKICKERS
A34: WILLIAMSTOWN | D34: McAULIFFE 5 | G34: CARPENTER 3 | J34: HAUGHTON 3 | M34: GEDDES | O34: GEISLER | Q34: MITCHELL | T34: HOLTEN
A35: PRAHRAN | D35: MILLER 2 | G35: M BAYLISS | J35: McMAHON
A37: NORTH MELBOURNE | C37: 5 | D37: 3 | E37: =C37*6+D37 -> 33 | G37: 6 | H37: 4 | I37: =G37*6+H37 -> 40 | K37: 6 | L37: 11 | M37: =K37*6+L37 -> 47 | O37: 6 | P37: 11 | Q37: =O37*6+P37 -> 47 | S37: BRIGHTON BEACH
A38: BRIGHTON | C38: 0 | D38: 2 | E38: =C38*6+D38 -> 2 | G38: 3 | H38: 7 | I38: =G38*6+H38 -> 25 | K38: 3 | L38: 7 | M38: =K38*6+L38 -> 25 | O38: 6 | P38: 9 | Q38: =O38*6+P38 -> 45 | S38: HALFPENNY
A39: BEST PLAYERS
A40: NORTH MELBOURNE | D40: SHORTEN | F40: RUSSELL | I40: RAWLE | L40: LINTON | O40: RUTLEY | R40: SIMPSON
A41: BRIGHTON | D41: DAYKIN | F41: VIRTUE | I41: COBB | L41: DANGERFIELD | O41: CARROLL | R41: NANCARROW
A42: GOALKICKERS
A43: NORTH MELBOURNE | D43: SMITH 2 | G43: GARDINER | J43: JOHNSON | M43: SHEPPARD | P43: KING
A44: BRIGHTON | D44: VIRTUE 3 | G44: DAYKIN | J44: DANGERFIELD | M44: RINGROSE
A46: HAWTHORN | C46: 1 | D46: 3 | E46: =C46*6+D46 -> 9 | G46: 4 | H46: 3 | I46: =G46*6+H46 -> 27 | K46: 8 | L46: 6 | M46: =K46*6+L46 -> 54 | O46: 9 | P46: 10 | Q46: =O46*6+P46 -> 64 | S46: KARDINIA PARK
A47: GEELONG ASSOC. | C47: 0 | D47: 2 | E47: =C47*6+D47 -> 2 | G47: 3 | H47: 3 | I47: =G47*6+H47 -> 21 | K47: 3 | L47: 7 | M47: =K47*6+L47 -> 25 | O47: 4 | P47: 7 | Q47: =O47*6+P47 -> 31 | S47: CAIN
A48: BEST PLAYERS
A49: HAWTHORN | D49: McCASHNEY | G49: GLYNN | I49: YEOMANS | L49: BURKE | O49: COLQUHOUN | R49: FINCH
A50: GEELONG ASSOC. | D50: BUCHANAN | G50: FEDER | I50: ELLINGSEN | L50: GILMOUR | O50: MCQUEEN | R50: BUTTERWORTH
A51: GOALKICKERS
A52: HAWTHORN | D52: PEARSON 4 | G52: YEOMANS | I52: FINCH | K52: COLQUHOUN | N52: GLYNN | P52: HENDERSON
A53: GEELONG ASSOC. | D53: ELLINGSEN | G53: WEARMOUTH | J53: BUCHANAN | M53: MARTINI
A55: ROUND 2 | D55: 13TH MAY | J55: WEATHER | M55: CLOUDY BUT FINE | S55: PLAYED AT | X55: LADDER | AB55: ROUND | AD55: 2
D56: 1ST QTR | H56: 2ND QTR | L56: 3RD QTR | P56: FINAL | S56: NORTH MELB
A57: WILLIAMSTOWN | C57: 4 | D57: 4 | E57: =C57*6+D57 -> 28 | G57: 6 | H57: 3 | I57: =G57*6+H57 -> 39 | K57: 8 | L57: 6 | M57: =K57*6+L57 -> 54 | O57: 9 | P57: 7 | Q57: =O57*6+P57 -> 61 | S57: UMPIRE | W57: TEAM | X57: W | Y57: L | Z57: D | AA57: FOR | AB57: AGST | AC57: % | AD57: PTS
A58: NORTH MELBOURNE | C58: 1 | D58: 2 | E58: =C58*6+D58 -> 8 | G58: 5 | H58: 5 | I58: =G58*6+H58 -> 35 | K58: 5 | L58: 6 | M58: =K58*6+L58 -> 36 | O58: 8 | P58: 10 | Q58: =O58*6+P58 -> 58 | S58: McKINNON
A59: BEST PLAYERS | W59: WILLIAMSTOWN | X59: 2 | Y59: 0 | Z59: 0 | AA59: 169 | AB59: 89 | AC59: 189.88764044943821 | AD59: 8
A60: WILLIAMSTOWN | D60: GEISLER | G60: RUSSELL | I60: CALDWELL | L60: HOLTEN | N60: MITCHELL | Q60: HAUGHTON | W60: FOOTSCRAY | X60: 2 | Y60: 0 | Z60: 0 | AA60: 155 | AB60: 103 | AC60: 150.48543689320388 | AD60: 8
A61: NORTH MELBOURNE | D61: WALSH | G61: KING | I61: GILES | L61: SIMPSON | N61: RUSSELL | Q61: JOHNSON | W61: PORT MELBOURNE | X61: 2 | Y61: 0 | Z61: 0 | AA61: 169 | AB61: 139 | AC61: 121.58273381294964 | AD61: 8
A62: GOALKICKERS | W62: HAWTHORN | X62: 1 | Y62: 1 | Z62: 0 | AA62: 128 | AB62: 114 | AC62: 112.28070175438596 | AD62: 4
A63: WILLIAMSTOWN | D63: CARPENTER 2 | G63: O'KEEFE 2 | I63: HAUGHTON 2 | L63: McAULIFFE 2 | O63: HOLTEN
A64: NORTH MELBOURNE | D64: FIELDING 2 | G64: SIMPSON 2 | J64: GARDINER 2 | M64: METCALFE | P64: RUSSELL | W64: NORTH MELBOURNE | X64: 1 | Y64: 1 | Z64: 0 | AA64: 105 | AB64: 106 | AC64: 99.056603773584911 | AD64: 4
W65: BRUNSWICK | X65: 1 | Y65: 1 | Z65: 0 | AA65: 126 | AB65: 135 | AC65: 93.333333333333329 | AD65: 4
A66: PORT MELBOURNE | C66: 6 | D66: 3 | E66: =C66*6+D66 -> 39 | G66: 8 | H66: 6 | I66: =G66*6+H66 -> 54 | K66: 11 | L66: 7 | M66: =K66*6+L66 -> 73 | O66: 11 | P66: 11 | Q66: =O66*6+P66 -> 77 | S66: PORT MELB | W66: PRAHRAN | X66: 1 | Y66: 1 | Z66: 0 | AA66: 105 | AB66: 171 | AC66: 61.403508771929822 | AD66: 4
A67: BRIGHTON | C67: 1 | D67: 6 | E67: =C67*6+D67 -> 12 | G67: 4 | H67: 9 | I67: =G67*6+H67 -> 33 | K67: 5 | L67: 14 | M67: =K67*6+L67 -> 44 | O67: 8 | P67: 17 | Q67: =O67*6+P67 -> 65 | S67: LEWIS | W67: BRIGHTON | X67: 0 | Y67: 2 | Z67: 0 | AA67: 110 | AB67: 124 | AC67: 88.709677419354833 | AD67: 0
A68: BEST PLAYERS | W68: NORTHCOTE | X68: 0 | Y68: 2 | Z68: 0 | AA68: 134 | AB68: 176 | AC68: 76.13636363636364 | AD68: 0
A69: PORT MELBOURNE | D69: PASH | G69: TAYLOR | I69: DOBRIGH | L69: W RUDD | N69: JOHNSON | Q69: BARFOOT | W69: GEELONG ASSOC. | X69: 0 | Y69: 2 | Z69: 0 | AA69: 94 | AB69: 138 | AC69: 68.115942028985501 | AD69: 0
A70: BRIGHTON | D70: DAYKIN | G70: EWINS | I70: RINGROSE | L70: P BOLAND | N70: CARROLL | Q70: HATTAM
A71: GOALKICKERS
A72: PORT MELBOURNE | D72: PASH 5 | G72: TAYLOR 4 | J72: McQUEEN | M72: W RUDD
A73: BRIGHTON | D73: DAYKIN 2 | G73: EWINS 2 | J73: IRWIN 2 | M73: VIRTUE | O73: D MAU
A75: FOOTSCRAY | C75: 5 | D75: 4 | E75: =C75*6+D75 -> 34 | G75: 7 | H75: 4 | I75: =G75*6+H75 -> 46 | K75: 10 | L75: 6 | M75: =K75*6+L75 -> 66 | O75: 13 | P75: 6 | Q75: =O75*6+P75 -> 84 | S75: FOOTSCRAY
A76: NORTHCOTE | C76: 1 | D76: 0 | E76: =C76*6+D76 -> 6 | G76: 3 | H76: 3 | I76: =G76*6+H76 -> 21 | K76: 5 | L76: 4 | M76: =K76*6+L76 -> 34 | O76: 9 | P76: 6 | Q76: =O76*6+P76 -> 60 | S76: JENKINS
A77: BEST PLAYERS
A78: FOOTSCRAY | D78: VALENTINE | G78: McCARTHY | J78: MARTIN | M78: McINTYRE | P78: WALSH | R78: NEILSON
A79: NORTHCOTE | D79: DOWNES | G79: OGDEN | J79: GRAY | M79: GOUGH | P79: BEITZEL | R79: DIMMICK
A80: GOALKICKERS
A81: FOOTSCRAY | D81: WALSH 5 | G81: ROWE 3 | J81: FORBES 3 | M81: MARTIN | O81: McCARTHY
A82: NORTHCOTE | D82: DOWNES 2 | G82: GOUGH 2 | J82: INCH 2 | M82: BENSON | O82: YATES | Q82: COOMBS
A84: PRAHRAN | C84: 0 | D84: 4 | E84: =C84*6+D84 -> 4 | G84: 4 | H84: 7 | I84: =G84*6+H84 -> 31 | K84: 6 | L84: 10 | M84: =K84*6+L84 -> 46 | O84: 10 | P84: 14 | Q84: =O84*6+P84 -> 74 | S84: TOORAK PARK
A85: GEELONG ASSOC. | C85: 3 | D85: 3 | E85: =C85*6+D85 -> 21 | G85: 7 | H85: 8 | I85: =G85*6+H85 -> 50 | K85: 7 | L85: 13 | M85: =K85*6+L85 -> 55 | O85: 8 | P85: 15 | Q85: =O85*6+P85 -> 63 | S85: THOMPSON
A86: BEST PLAYERS
A87: PRAHRAN | D87: MILLER | G87: M BAYLISS | J87: E JONES | M87: WIDDICOMBE | P87: NAYLOR | R87: ALLISTER
A88: GEELONG ASSOC. | D88: ELLINGSEN | G88: ELLIS | J88: BUTTERWORTH | M88: BRIGGS | P88: McQUEEN | R88: MELLEHAN
A89: GOALKICKERS
A90: PRAHRAN | D90: MILLER 3 | G90: M BAYLISS 2 | J90: RIDER 2 | L90: COWLEY 2 | N90: BOUSSIE
A91: GEELONG ASSOC. | D91: COOPER 4 | G91: ELLINGSEN | J91: ELSTON | L91: McQUEEN | N91: BUCHANAN
A93: BRUNSWICK | C93: 5 | D93: 3 | E93: =C93*6+D93 -> 33 | G93: 5 | H93: 4 | I93: =G93*6+H93 -> 34 | K93: 10 | L93: 9 | M93: =K93*6+L93 -> 69 | O93: 12 | P93: 11 | Q93: =O93*6+P93 -> 83 | S93: HAW
A94: HAWTHORN | C94: 3 | D94: 1 | E94: =C94*6+D94 -> 19 | G94: 5 | H94: 6 | I94: =G94*6+H94 -> 36 | K94: 6 | L94: 7 | M94: =K94*6+L94 -> 43 | O94: 9 | P94: 10 | Q94: =O94*6+P94 -> 64 | S94: KAIN
A95: BEST PLAYERS
A96: BRUNSWICK | D96: McCORMACK | G96: MILLEN | J96: KEOGH | M96: McINERNEY | P96: CAHILL | S96: MOORE
A97: HAWTHORN | D97: REEVES | G97: YEOMANS | J97: FINCH | M97: McCASHNEY | P97: GILL | S97: JACKSON
A98: GOALKICKERS
A99: BRUNSWICK | D99: SULLIVAN 5 | G99: ALESSIO 2 | J99: McINERNEY 2 | M99: WOOLLARD 2 | P99: MOORE
A100: HAWTHORN | D100: HENDERSON 2 | G100: COLQUHOUN 2 | J100: BURKE 2 | M100: HEDGES | O100: GREGG | Q100: PEARSON
A102: ROUND 3 | E102: 20TH MAY | J102: WEATHER | M102: FINE MILD | S102: PLAYED AT | X102: LADDER | AB102: ROUND | AD102: 3
D103: 1ST QTR | H103: 2ND QTR | L103: 3RD QTR | P103: FINAL | S103: FOOTSCRAY
A104: FOOTSCRAY | C104: 3 | D104: 3 | E104: =C104*6+D104 -> 21 | G104: 5 | H104: 6 | I104: =G104*6+H104 -> 36 | K104: 5 | L104: 14 | M104: =K104*6+L104 -> 44 | O104: 7 | P104: 15 | Q104: =O104*6+P104 -> 57 | S104: UMPIRE | W104: TEAM | X104: W | Y104: L | Z104: D | AA104: FOR | AB104: AGST | AC104: % | AD104: PTS
A105: HAWTHORN | C105: 0 | D105: 3 | E105: =C105*6+D105 -> 3 | G105: 2 | H105: 4 | I105: =G105*6+H105 -> 16 | K105: 3 | L105: 5 | M105: =K105*6+L105 -> 23 | O105: 4 | P105: 8 | Q105: =O105*6+P105 -> 32 | S105: GILLARD
A106: BEST PLAYERS | W106: FOOTSCRAY | X106: 3 | Y106: 0 | Z106: 0 | AA106: 212 | AB106: 135 | AC106: 157.03703703703704 | AD106: 12
A107: FOOTSCRAY | D107: MCCARTHY | G107: EASON | I107: HOWELL | L107: ROWE | N107: MARTIN | Q107: WALSH | W107: PORT MELBOURNE | X107: 3 | Y107: 0 | Z107: 0 | AA107: 225 | AB107: 189 | AC107: 119.04761904761905 | AD107: 12
A108: HAWTHORN | D108: YEOMANS | G108: KEMP | I108: REEVES | L108: JACKSON | N108: McCASHNEY | Q108: GILL | W108: WILLIAMSTOWN | X108: 2 | Y108: 1 | Z108: 0 | AA108: 219 | AB108: 145 | AC108: 151.0344827586207 | AD108: 8
A109: GOALKICKERS | W109: BRUNSWICK | X109: 2 | Y109: 1 | Z109: 0 | AA109: 235 | AB109: 188 | AC109: 125 | AD109: 8
A110: FOOTSCRAY | D110: ROWE 3 | G110: MCCARTHY | J110: WALSH | M110: FORBES | O110: O'BRIEN
A111: HAWTHORN | D111: KEMP 2 | G111: PEARSON | J111: YEOMANS | W111: NORTH MELBOURNE | X111: 2 | Y111: 1 | Z111: 0 | AA111: 192 | AB111: 165 | AC111: 116.36363636363636 | AD111: 8
W112: BRIGHTON | X112: 1 | Y112: 2 | Z112: 0 | AA112: 182 | AB112: 180 | AC112: 101.11111111111111 | AD112: 4
A113: PORT MELBOURNE | C113: 0 | D113: 1 | E113: =C113*6+D113 -> 1 | G113: 5 | H113: 1 | I113: =G113*6+H113 -> 31 | K113: 7 | L113: 1 | M113: =K113*6+L113 -> 43 | O113: 9 | P113: 2 | Q113: =O113*6+P113 -> 56 | S113: PORT MELB | W113: HAWTHORN | X113: 1 | Y113: 2 | Z113: 0 | AA113: 160 | AB113: 171 | AC113: 93.567251461988306 | AD113: 4
A114: WILLIAMSTOWN | C114: 2 | D114: 2 | E114: =C114*6+D114 -> 14 | G114: 3 | H114: 4 | I114: =G114*6+H114 -> 22 | K114: 6 | L114: 6 | M114: =K114*6+L114 -> 42 | O114: 7 | P114: 8 | Q114: =O114*6+P114 -> 50 | S114: JONES | W114: PRAHRAN | X114: 1 | Y114: 2 | Z114: 0 | AA114: 164 | AB114: 258 | AC114: 63.565891472868216 | AD114: 4
A115: BEST PLAYERS | W115: GEELONG ASSOC. | X115: 0 | Y115: 3 | Z115: 0 | AA115: 150 | AB115: 210 | AC115: 71.428571428571431 | AD115: 0
A116: PORT MELBOURNE | D116: BARFOOT | G116: PASH | I116: JOHNSON | L116: FORBES | N116: TREMBATH | Q116: DOBRIGH | W116: NORTHCOTE | X116: 0 | Y116: 3 | Z116: 0 | AA116: 187 | AB116: 285 | AC116: 65.614035087719301 | AD116: 0
A117: WILLIAMSTOWN | D117: HOLTEN | G117: GEDDES | I117: GEISLER | L117: EDWARDS | N117: DUSSELL | Q117: SUTHERLAND
A118: GOALKICKERS
A119: PORT MELBOURNE | D119: TAYLOR 3 | G119: GARBUTT 2 | J119: PASH 2 | M119: O'BRIEN 2
A120: WILLIAMSTOWN | D120: McAULIFFE 4 | G120: CARPENTER 2 | K120: EDWARDS
A122: NORTH MELBOURNE | C122: 2 | D122: 4 | E122: =C122*6+D122 -> 16 | G122: 6 | H122: 12 | I122: =G122*6+H122 -> 48 | K122: 8 | L122: 13 | M122: =K122*6+L122 -> 61 | O122: 12 | P122: 15 | Q122: =O122*6+P122 -> 87 | S122: NORTH MELB
A123: PRAHRAN | C123: 3 | D123: 1 | E123: =C123*6+D123 -> 19 | G123: 3 | H123: 2 | I123: =G123*6+H123 -> 20 | K123: 5 | L123: 5 | M123: =K123*6+L123 -> 35 | O123: 9 | P123: 5 | Q123: =O123*6+P123 -> 59 | S123: McLEAN
A124: BEST PLAYERS
A125: NORTH MELBOURNE | D125: WALSH | G125: METCALFE | J125: GARDINER | M125: RUSS | O125: RAWLE | R125: SIMPSON
A126: PRAHRAN | D126: MILLER | G126: MORONEY | J126: BAYLISS | M126: HARRISON | O126: CHAPMAN | R126: BOUSSIE
A127: GOALKICKERS
A128: NORTH MELBOURNE | D128: GARDINER 6 | G128: SMITH 2 | J128: KING | L128: DOOLAN | N128: METCALFE | Q128: SIMPSON
A129: PRAHRAN | D129: BOUSSIE 2 | G129: RIDER 2 | I129: CALLANDER 2 | L129: MILLER | N129: NAYLOR | P129: LOWE
A131: BRIGHTON | C131: 1 | D131: 0 | E131: =C131*6+D131 -> 6 | G131: 4 | H131: 3 | I131: =G131*6+H131 -> 27 | K131: 7 | L131: 7 | M131: =K131*6+L131 -> 49 | O131: 10 | P131: 12 | Q131: =O131*6+P131 -> 72 | S131: KARDINIA PARK
A132: GEELONG ASSOC. | C132: 3 | D132: 5 | E132: =C132*6+D132 -> 23 | G132: 5 | H132: 6 | I132: =G132*6+H132 -> 36 | K132: 6 | L132: 8 | M132: =K132*6+L132 -> 44 | O132: 7 | P132: 14 | Q132: =O132*6+P132 -> 56 | S132: LOVELL
A133: BEST PLAYERS
A134: BRIGHTON | D134: HARBOARD | G134: IRWIN | J134: DANGERFIELD | M134: CARROLL | P134: MILLS | R134: BORLAND
A135: GEELONG ASSOC. | D135: ELLINGSEN | G135: BUCHANAN | J135: FEDER | M135: GILMOUR | P135: MELLAN | R135: BRIGGS
A136: GOALKICKERS
A137: BRIGHTON | D137: COBB 3 | G137: RINGROSE 2 | J137: D MAU | M137: DANGERFIELD | P137: IRWIN | R137: DAYKIN | U137: EWINS
A138: GEELONG ASSOC. | D138: MELLEHAN 2 | G138: ELLINGSEN | J138: GILMOUR | M138: BUCHANAN | P138: CALABY | R138: COOPER
A140: BRUNSWICK | C140: 4 | D140: 4 | E140: =C140*6+D140 -> 28 | G140: 7 | H140: 4 | I140: =G140*6+H140 -> 46 | K140: 9 | L140: 12 | M140: =K140*6+L140 -> 66 | O140: 15 | P140: 19 | Q140: =O140*6+P140 -> 109 | S140: BRUNSWICK
A141: NORTHCOTE | C141: 4 | D141: 1 | E141: =C141*6+D141 -> 25 | G141: 6 | H141: 6 | I141: =G141*6+H141 -> 42 | K141: 6 | L141: 10 | M141: =K141*6+L141 -> 46 | O141: 7 | P141: 11 | Q141: =O141*6+P141 -> 53 | S141: McMURRAY
A142: BEST PLAYERS
A143: BRUNSWICK | D143: SWIFT | G143: ALESSIO | J143: FITZGERALD | M143: McINERNEY | P143: MILLEN | R143: ROBERTS
A144: NORTHCOTE | D144: BEITZEL | G144: JOHNSON | J144: OGDEN | M144: GOUGH | P144: DIMMICK | R144: DOWNES
A145: GOALKICKERS
A146: BRUNSWICK | D146: MCINERNEY 6 | G146: SULLIVAN 3 | J146: McCORMACK 2 | N146: MOORE | P146: ALESSIO | R146: FISHER | U146: MILLEN
A147: NORTHCOTE | D147: JOHNSON 3 | G147: INCH 2 | I147: COOMBS | K147: DOWNES
A149: ROUND 4 | E149: 27TH MAY | J149: WEATHER | M149: FINE S.W. BREEZE | S149: PLAYED AT | X149: LADDER | AB149: ROUND | AD149: 4
D150: 1ST QTR | H150: 2ND QTR | L150: 3RD QTR | P150: FINAL | S150: WILLIAMSTOWN
A151: WILLIAMSTOWN | C151: 2 | D151: 4 | E151: =C151*6+D151 -> 16 | G151: 3 | H151: 7 | I151: =G151*6+H151 -> 25 | K151: 8 | L151: 8 | M151: =K151*6+L151 -> 56 | O151: 10 | P151: 8 | Q151: =O151*6+P151 -> 68 | S151: UMPIRE | W151: TEAM | X151: W | Y151: L | Z151: D | AA151: FOR | AB151: AGST | AC151: % | AD151: PTS
A152: BRUNSWICK | C152: 3 | D152: 2 | E152: =C152*6+D152 -> 20 | G152: 3 | H152: 4 | I152: =G152*6+H152 -> 22 | K152: 4 | L152: 6 | M152: =K152*6+L152 -> 30 | O152: 7 | P152: 13 | Q152: =O152*6+P152 -> 55 | S152: CAIN
A153: BEST PLAYERS | W153: FOOTSCRAY | X153: 4 | Y153: 0 | Z153: 0 | AA153: 348 | AB153: 161 | AC153: 216.14906832298138 | AD153: 16
A154: WILLIAMSTOWN | D154: CARPENTER | G154: MITCHELL | J154: N McDONALD | M154: O'KEEFE | O154: GEISLER | Q154: DUSSELL | W154: PORT MELBOURNE | X154: 4 | Y154: 0 | Z154: 0 | AA154: 314 | AB154: 250 | AC154: 125.6 | AD154: 16
A155: BRUNSWICK | D155: HANDO | G155: ROBERTS | J155: FITZGERALD | M155: MILLER | O155: SULLIVAN | Q155: MCINERNEY | W155: WILLIAMSTOWN | X155: 3 | Y155: 1 | Z155: 0 | AA155: 287 | AB155: 200 | AC155: 143.5 | AD155: 12
A156: GOALKICKERS | W156: BRUNSWICK | X156: 2 | Y156: 2 | Z156: 0 | AA156: 290 | AB156: 256 | AC156: 113.28125 | AD156: 8
A157: WILLIAMSTOWN | D157: McAULIFFE 4 | G157: N McDOANLD 3 | J157: CARPENTER | M157: MUNRO | O157: CALDWELL
A158: BRUNSWICK | D158: McINERNEY 3 | G158: SULLIVAN 2 | J158: McCORMACK | M158: FISHER | W158: NORTH MELBOURNE | X158: 2 | Y158: 2 | Z158: 0 | AA158: 242 | AB158: 218 | AC158: 111.0091743119266 | AD158: 8
W159: HAWTHORN | X159: 2 | Y159: 2 | Z159: 0 | AA159: 205 | AB159: 205 | AC159: 100 | AD159: 8
A160: HAWTHORN | C160: 2 | D160: 1 | E160: =C160*6+D160 -> 13 | G160: 4 | H160: 3 | I160: =G160*6+H160 -> 27 | K160: 6 | L160: 5 | M160: =K160*6+L160 -> 41 | O160: 6 | P160: 9 | Q160: =O160*6+P160 -> 45 | S160: BRIGHTON BEACH | W160: BRIGHTON | X160: 1 | Y160: 3 | Z160: 0 | AA160: 216 | AB160: 225 | AC160: 96 | AD160: 4
A161: BRIGHTON | C161: 0 | D161: 2 | E161: =C161*6+D161 -> 2 | G161: 2 | H161: 6 | I161: =G161*6+H161 -> 18 | K161: 3 | L161: 9 | M161: =K161*6+L161 -> 27 | O161: 3 | P161: 16 | Q161: =O161*6+P161 -> 34 | S161: McKINNON | W161: NORTHCOTE | X161: 1 | Y161: 3 | Z161: 0 | AA161: 240 | AB161: 335 | AC161: 71.641791044776113 | AD161: 4
A162: BEST PLAYERS | W162: PRAHRAN | X162: 1 | Y162: 3 | Z162: 0 | AA162: 225 | AB162: 347 | AC162: 64.841498559077806 | AD162: 4
A163: HAWTHORN | D163: McCASHNEY | G163: LEEHANE | J163: GLYNN | M163: HENRY | O163: OWENS | Q163: YEOMANS | W163: GEELONG ASSOC. | X163: 0 | Y163: 4 | Z163: 0 | AA163: 176 | AB163: 346 | AC163: 50.867052023121389 | AD163: 0
A164: BRIGHTON | D164: MILLS | G164: HARBOARD | J164: DAWSON | M164: LYNCH | O164: EWINS | Q164: DAYKIN
A165: GOALKICKERS
A166: HAWTHORN | D166: PEARSON 2 | G166: YEOMANS 2 | J166: KEMP | L166: REEVES
A167: BRIGHTON | D167: DAYKIN 2 | G167: IRWIN
A169: NORTHCOTE | C169: 1 | D169: 4 | E169: =C169*6+D169 -> 10 | G169: 4 | H169: 5 | I169: =G169*6+H169 -> 29 | K169: 6 | L169: 7 | M169: =K169*6+L169 -> 43 | O169: 7 | P169: 11 | Q169: =O169*6+P169 -> 53 | S169: N'COTE PK
A170: NORTH MELBOURNE | C170: 0 | D170: 4 | E170: =C170*6+D170 -> 4 | G170: 0 | H170: 6 | I170: =G170*6+H170 -> 6 | K170: 4 | L170: 6 | M170: =K170*6+L170 -> 30 | O170: 7 | P170: 8 | Q170: =O170*6+P170 -> 50 | S170: HUDD
A171: BEST PLAYERS
A172: NORTHCOTE | D172: DOWNES | G172: PURCELL | J172: MILDREN | M172: GOUGH | P172: JOHNSON | S172: GRIERSON
A173: NORTH MELBOURNE | D173: WALSH | G173: KING | J173: JOHNSON | M173: SMITH | P173: GILES | S173: FIELDING
A174: GOALKICKERS
A175: NORTHCOTE | D175: THORPE 4 | G175: LUGG | J175: GRAY | L175: GOUGH
A176: NORTH MELBOURNE | D176: GARDINER 3 | G176: SMITH 2 | J176: KING 2
A178: PORT MELBOURNE | C178: 7 | D178: 2 | E178: =C178*6+D178 -> 44 | G178: 10 | H178: 5 | I178: =G178*6+H178 -> 65 | K178: 11 | L178: 7 | M178: =K178*6+L178 -> 73 | O178: 13 | P178: 11 | Q178: =O178*6+P178 -> 89 | S178: TOORAK PARK
A179: PRAHRAN | C179: 1 | D179: 2 | E179: =C179*6+D179 -> 8 | G179: 4 | H179: 4 | I179: =G179*6+H179 -> 28 | K179: 4 | L179: 8 | M179: =K179*6+L179 -> 32 | O179: 8 | P179: 13 | Q179: =O179*6+P179 -> 61 | S179: THOMPSON
A180: BEST PLAYERS
A181: PORT MELBOURNE | D181: TAYLOR | G181: W RUDD | J181: GARBUTT | M181: DOBRIGH | P181: O'BRIEN | S181: REES
A182: PRAHRAN | D182: M BAYLISS | G182: T BAYLISS | J182: SHERIDAN | M182: MORONEY | P182: O'HALLORAN | S182: NAYLOR
A183: GOALKICKERS
A184: PORT MELBOURNE | D184: TAYLOR 8 | G184: O'BRIEN 2 | J184: J RUDD | L184: GARBUTT | O184: W RUDD
A185: PRAHRAN | D185: M BAYLISS 4 | H185: NAYLOR 2 | K185: O'HALLORAN | N185: SHERIDAN
A187: FOOTSCRAY | C187: 3 | D187: 5 | E187: =C187*6+D187 -> 23 | G187: 9 | H187: 9 | I187: =G187*6+H187 -> 63 | K187: 13 | L187: 12 | M187: =K187*6+L187 -> 90 | O187: 19 | P187: 22 | Q187: =O187*6+P187 -> 136 | S187: FOOTSCRAY
A188: GEELONG ASSOC. | C188: 1 | D188: 3 | E188: =C188*6+D188 -> 9 | G188: 1 | H188: 3 | I188: =G188*6+H188 -> 9 | K188: 3 | L188: 8 | M188: =K188*6+L188 -> 26 | O188: 3 | P188: 8 | Q188: =O188*6+P188 -> 26 | S188: CLINNICK
A189: BEST PLAYERS
A190: FOOTSCRAY | D190: EASON | G190: NEILSON | J190: O'DONOGHUE | M190: THOMSON | P190: ROWE | R190: McINTYRE
A191: GEELONG ASSOC. | D191: ELLIS | G191: ELLINGSEN | J191: FEDER | M191: FOWLER | P191: BUCHANAN | R191: BRIGGS
A192: GOALKICKERS
A193: FOOTSCRAY | D193: SMITH 4 | F193: WALSH 4 | I193: THOMSON 3 | L193: ROWE 2 | N193: EASON 2 | P193: O'DONOGHUE 2 | T193: SAMSON 2
A194: GEELONG ASSOC. | D194: ELLINGSEN 2 | H194: BUCHANAN
A196: ROUND 5 | E196: 3RD JUNE | J196: WEATHER | M196: FINE MILD NORTH WIND | S196: PLAYED AT | X196: LADDER | AB196: ROUND | AD196: 5
D197: 1ST QTR | H197: 2ND QTR | L197: 3RD QTR | P197: FINAL | S197: NORTH MELB
A198: NORTH MELBOURNE | C198: 3 | D198: 6 | E198: =C198*6+D198 -> 24 | G198: 4 | H198: 6 | I198: =G198*6+H198 -> 30 | K198: 10 | L198: 10 | M198: =K198*6+L198 -> 70 | O198: 12 | P198: 13 | Q198: =O198*6+P198 -> 85 | S198: UMPIRE | W198: TEAM | X198: W | Y198: L | Z198: D | AA198: FOR | AB198: AGST | AC198: % | AD198: PTS
A199: PORT MELBOURNE | C199: 0 | D199: 2 | E199: =C199*6+D199 -> 2 | G199: 2 | H199: 5 | I199: =G199*6+H199 -> 17 | K199: 4 | L199: 6 | M199: =K199*6+L199 -> 30 | O199: 8 | P199: 10 | Q199: =O199*6+P199 -> 58 | S199: McKINNON
A200: BEST PLAYERS | W200: FOOTSCRAY | X200: 5 | Y200: 0 | Z200: 0 | AA200: 464 | AB200: 176 | AC200: 263.64 | AD200: 20
A201: NORTH MELBOURNE | D201: RUSSELL | G201: KING | I201: FIELDING | L201: METCALFE | O201: SMITH | Q201: RAWLE | W201: WILLIAMSTOWN | X201: 4 | Y201: 1 | Z201: 0 | AA201: 377 | AB201: 256 | AC201: 147.265625 | AD201: 16
A202: PORT MELBOURNE | D202: BARFOOT | G202: STANFORD | J202: TREMBATH | M202: OGILVIE | O202: WILDING | Q202: JOHNSON | W202: PORT MELBOURNE | X202: 4 | Y202: 1 | Z202: 0 | AA202: 372 | AB202: 335 | AC202: 111.04477611940298 | AD202: 16
A203: GOALKICKERS | W203: NORTH MELBOURNE | X203: 3 | Y203: 2 | Z203: 0 | AA203: 327 | AB203: 276 | AC203: 118.47826086956522 | AD203: 12
A204: NORTH MELBOURNE | D204: FIELDING 3 | G204: SMITH 3 | I204: METCALFE 2 | L204: GARDINER 2 | O204: SIMPSON
A205: PORT MELBOURNE | D205: HEANEY 2 | G205: STANFORD 2 | J205: TAYLOR | L205: BARLOW | W205: BRUNSWICK | X205: 3 | Y205: 2 | Z205: 0 | AA205: 361 | AB205: 311 | AC205: 116.07717041800643 | AD205: 12
W206: HAWTHORN | X206: 2 | Y206: 2 | Z206: 1 | AA206: 274 | AB206: 274 | AC206: 100 | AD206: 10
A207: HAWTHORN | C207: 3 | D207: 4 | E207: =C207*6+D207 -> 22 | G207: 5 | H207: 4 | I207: =G207*6+H207 -> 34 | K207: 6 | L207: 6 | M207: =K207*6+L207 -> 42 | O207: 10 | P207: 9 | Q207: =O207*6+P207 -> 69 | S207: NORTHCOTE | W207: NORTHCOTE | X207: 1 | Y207: 3 | Z207: 1 | AA207: 309 | AB207: 404 | AC207: 76.485148514851488 | AD207: 6
A208: NORTHCOTE | C208: 4 | D208: 0 | E208: =C208*6+D208 -> 24 | G208: 4 | H208: 5 | I208: =G208*6+H208 -> 29 | K208: 7 | L208: 9 | M208: =K208*6+L208 -> 51 | O208: 9 | P208: 15 | Q208: =O208*6+P208 -> 69 | S208: CLARKE | W208: BRIGHTON | X208: 1 | Y208: 4 | Z208: 0 | AA208: 272 | AB208: 315 | AC208: 86.349206349206355 | AD208: 4
A209: BEST PLAYERS | W209: PRAHRAN | X209: 1 | Y209: 4 | Z209: 0 | AA209: 240 | AB209: 463 | AC209: 51.84 | AD209: 4
A210: HAWTHORN | D210: GILL | G210: McCASHNEY | J210: FINCH | L210: YEOMANS | N210: RADEMACHER | Q210: BURKE | W210: GEELONG ASSOC. | X210: 0 | Y210: 5 | Z210: 0 | AA210: 231 | AB210: 417 | AC210: 55.39568345323741 | AD210: 0
A211: NORTHCOTE | D211: DOWNES | G211: GRAY | J211: BEITZEL | L211: OGDEN | N211: DILLON | Q211: GOUGH
A212: GOALKICKERS
A213: HAWTHORN | D213: YEOMANS 2 | G213: HAYES 2 | I213: LEEHANE | K213: BURKE | M213: COLQUHOUN | P213: PEARSON | R213: WISE | T213: EMPEY
A214: NORTHCOTE | D214: THORPE 2 | G214: DILLON | I214: INCH | J214: DOWNES | L214: ROSS | N214: OGDEN | P214: CORFIELD | R214: GOUGH
A216: WILLIAMSTOWN | C216: 4 | D216: 2 | E216: =C216*6+D216 -> 26 | G216: 9 | H216: 6 | I216: =G216*6+H216 -> 60 | K216: 12 | L216: 10 | M216: =K216*6+L216 -> 82 | O216: 13 | P216: 12 | Q216: =O216*6+P216 -> 90 | S216: WILLIAMSTOWN
A217: BRIGHTON | C217: 1 | D217: 4 | E217: =C217*6+D217 -> 10 | G217: 2 | H217: 4 | I217: =G217*6+H217 -> 16 | K217: 3 | L217: 6 | M217: =K217*6+L217 -> 24 | O217: 8 | P217: 8 | Q217: =O217*6+P217 -> 56 | S217: KAIN
A218: BEST PLAYERS
A219: WILLIAMSTOWN | D219: DUSSELL | G219: CARPENTER | J219: RUSSELL | M219: HOLTEN | P219: MITCHELL | S219: CALDWELL
A220: BRIGHTON | D220: IRWIN | G220: DANGERFIELD | J220: BOLAND | M220: RINGROSE | P220: WYATT | S220: WHITTMAN
A221: GOALKICKERS
A222: WILLIAMSTOWN | D222: McAULIFFE 6 | G222: CARPENTER 3 | K222: DUSSELL 2 | N222: RUSSELL 2
A223: BRIGHTON | D223: IRWIN 2 | G223: BORLAND 2 | K223: N MAU 2 | N223: WHITTMAN | Q223: RINGROSE
A225: BRUNSWICK | C225: 1 | D225: 1 | E225: =C225*6+D225 -> 7 | G225: 5 | H225: 4 | I225: =G225*6+H225 -> 34 | K225: 9 | L225: 8 | M225: =K225*6+L225 -> 62 | O225: 10 | P225: 11 | Q225: =O225*6+P225 -> 71 | S225: KARDINIA PARK
A226: GEELONG ASSOC. | C226: 3 | D226: 3 | E226: =C226*6+D226 -> 21 | G226: 4 | H226: 4 | I226: =G226*6+H226 -> 28 | K226: 4 | L226: 5 | M226: =K226*6+L226 -> 29 | O226: 8 | P226: 7 | Q226: =O226*6+P226 -> 55 | S226: DUNGEON
A227: BEST PLAYERS
A228: BRUNSWICK | D228: ALESSIO | G228: KEOGH | J228: McINERNEY | M228: FISHER | P228: RALEIGH | S228: O'CONNOR
A229: GEELONG ASSOC. | D229: McQUEEN | G229: ELLINGSEN | J229: ELLIS | M229: LITTLE | P229: FEDER | S229: MELLEHAN
A230: GOALKICKERS
A231: BRUNSWICK | D231: McINERNEY 4 | G231: ALESSIO 2 | J231: McCORMACK | M231: SULLIVAN | O231: FISHER | Q231: MOORE
A232: GEELONG ASSOC. | D232: COOPER 3 | G232: MELLEHAN 2 | J232: BUTTERWORTH | M232: GILMOUR | O232: ELSTON
A234: FOOTSCRAY | C234: 6 | D234: 8 | E234: =C234*6+D234 -> 44 | G234: 9 | H234: 11 | I234: =G234*6+H234 -> 65 | K234: 14 | L234: 17 | M234: =K234*6+L234 -> 101 | O234: 16 | P234: 20 | Q234: =O234*6+P234 -> 116 | S234: FOOTSCRAY
A235: PRAHRAN | C235: 0 | D235: 0 | E235: =C235*6+D235 -> 0 | G235: 0 | H235: 4 | I235: =G235*6+H235 -> 4 | K235: 0 | L235: 4 | M235: =K235*6+L235 -> 4 | O235: 1 | P235: 9 | Q235: =O235*6+P235 -> 15 | S235: McMILLAN
A236: BEST PLAYERS
A237: FOOTSCRAY | D237: O'BRIEN | G237: EASON | J237: THOMSON | M237: MARTIN | P237: O'DONOGHUE | S237: McCARTHY
A238: PRAHRAN | D238: M BAYLISS | G238: LOVE | J238: MILLER | M238: T BAYLISS | P238: O'HALLORAN | S238: MORONEY
A239: GOALKICKERS
A240: FOOTSCRAY | D240: O'BRIEN 6 | G240: EASON 3 | I240: THOMSON 2 | L240: WALSH 2 | N240: MARTIN 2 | Q240: DILLON
A241: PRAHRAN | D241: M BAYLISS
A243: ROUND 6 | D243: 5TH JUNE | H243: KINGS BIRTHDAY | L243: WEATHER | N243: COLD SHOWERS S.W. WIND | S243: PLAYED AT | X243: LADDER | AB243: ROUND | AD243: 6
D244: 1ST QTR | H244: 2ND QTR | L244: 3RD QTR | P244: FINAL | S244: PORT MELB
A245: PORT MELBOURNE | C245: 1 | D245: 3 | E245: =C245*6+D245 -> 9 | G245: 5 | H245: 7 | I245: =G245*6+H245 -> 37 | K245: 7 | L245: 7 | M245: =K245*6+L245 -> 49 | O245: 11 | P245: 10 | Q245: =O245*6+P245 -> 76 | S245: UMPIRE | W245: TEAM | X245: W | Y245: L | Z245: D | AA245: FOR | AB245: AGST | AC245: % | AD245: PTS
A246: FOOTSCRAY | C246: 2 | D246: 3 | E246: =C246*6+D246 -> 15 | G246: 2 | H246: 4 | I246: =G246*6+H246 -> 16 | K246: 5 | L246: 8 | M246: =K246*6+L246 -> 38 | O246: 7 | P246: 10 | Q246: =O246*6+P246 -> 52 | S246: YHOMPSON
A247: BEST PLAYERS | W247: FOOTSCRAY | X247: 5 | Y247: 1 | Z247: 0 | AA247: 516 | AB247: 252 | AC247: 204.76 | AD247: 20
A248: PORT MELBOURNE | D248: BARFOOT | G248: STANFORD | J248: DOBRIGH | M248: W RUDD | P248: JOHNSON | R248: OGILVIE | W248: PORT MELBOURNE | X248: 5 | Y248: 1 | Z248: 0 | AA248: 448 | AB248: 387 | AC248: 115.76227390180878 | AD248: 20
A249: FOOTSCRAY | D249: McCARTHY | G249: NEILSON | J249: SHELLY | M249: MUELEMAN | P249: HOWELL | R249: SMITH | W249: NORTH MELBOURNE | X249: 4 | Y249: 2 | Z249: 0 | AA249: 438 | AB249: 332 | AC249: 131.92771084337349 | AD249: 16
A250: GOALKICKERS | W250: WILLIAMSTOWN | X250: 4 | Y250: 2 | Z250: 0 | AA250: 454 | AB250: 349 | AC250: 130.08595988538681 | AD250: 16
A251: PORT MELBOURNE | D251: TAYLOR 4 | F251: GARBUTT 2 | I251: STANFORD | K251: BARFOOT | M251: O'BRIEN | O251: REES | P251: DOBRIGH
A252: FOOTSCRAY | D252: HOWELL 2 | G252: WALSH 2 | I252: McCARTHY | L252: SAMSON | N252: ROWE | W252: BRUNSWICK | X252: 4 | Y252: 2 | Z252: 0 | AA252: 458 | AB252: 360 | AC252: 127.22222222222223 | AD252: 16
W253: HAWTHORN | X253: 3 | Y253: 2 | Z253: 1 | AA253: 383 | AB253: 351 | AC253: 109.11680911680912 | AD253: 14
A254: BRUNSWICK | C254: 6 | D254: 5 | E254: =C254*6+D254 -> 41 | G254: 8 | H254: 8 | I254: =G254*6+H254 -> 56 | K254: 12 | L254: 13 | M254: =K254*6+L254 -> 85 | O254: 14 | P254: 13 | Q254: =O254*6+P254 -> 97 | S254: BRUNSWICK | W254: NORTHCOTE | X254: 2 | Y254: 3 | Z254: 1 | AA254: 402 | AB254: 481 | AC254: 83.57588357588358 | AD254: 10
A255: BRIGHTON | C255: 0 | D255: 0 | E255: =C255*6+D255 -> 0 | G255: 5 | H255: 5 | I255: =G255*6+H255 -> 35 | K255: 5 | L255: 6 | M255: =K255*6+L255 -> 36 | O255: 6 | P255: 13 | Q255: =O255*6+P255 -> 49 | S255: JONES | W255: BRIGHTON | X255: 1 | Y255: 5 | Z255: 0 | AA255: 321 | AB255: 412 | AC255: 77.912621359223294 | AD255: 4
A256: BEST PLAYERS | W256: PRAHRAN | X256: 1 | Y256: 5 | Z256: 0 | AA256: 317 | AB256: 572 | AC256: 55.42 | AD256: 4
A257: BRUNSWICK | D257: RALEIGH | G257: McCORMACK | J257: SWIFT | M257: GRIMSTER | O257: FEATHERSTONE | R257: O'CONNOR | W257: GEELONG ASSOC. | X257: 0 | Y257: 6 | Z257: 0 | AA257: 287 | AB257: 528 | AC257: 54.356060606060609 | AD257: 0
A258: BRIGHTON | D258: P BOLAND | G258: HATTAM | J258: DANGERFIELD | M258: RINGROSE | O258: DAYKIN | R258: GRIMBLATT
A259: GOALKICKERS
A260: BRUNSWICK | D260: SULLIVAN 6 | G260: McINERNEY 4 | K260: MILLEN 2 | N260: MOORE | P260: FISHER
A261: BRIGHTON | D261: DAYKIN 2 | G261: IRWIN 2 | J261: RINGROSE | M261: EWINS
A263: NORTHCOTE | C263: 1 | D263: 3 | E263: =C263*6+D263 -> 9 | G263: 8 | H263: 7 | I263: =G263*6+H263 -> 55 | K263: 8 | L263: 10 | M263: =K263*6+L263 -> 58 | O263: 13 | P263: 15 | Q263: =O263*6+P263 -> 93 | S263: N'COTE PK
A264: WILLIAMSTOWN | C264: 4 | D264: 2 | E264: =C264*6+D264 -> 26 | G264: 7 | H264: 4 | I264: =G264*6+H264 -> 46 | K264: 11 | L264: 5 | M264: =K264*6+L264 -> 71 | O264: 12 | P264: 5 | Q264: =O264*6+P264 -> 77 | S264: McKINNON
A265: BEST PLAYERS
A266: NORTHCOTE | D266: ROSS | G266: DOWNES | J266: YATES | M266: GRAY | O266: PURCELL | R266: GOUGH
A267: WILLIAMSTOWN | D267: HAUGHTON | G267: CARPENTER | J267: O'KEEFE | M267: MITCHELL | O267: GEISLER | R267: J McDONALD
A268: GOALKICKERS
A269: NORTHCOTE | D269: ROSS 3 | F269: GOUGH 2 | H269: STEPHENSON | K269: INCH | M269: LUGG
A270: WILLIAMSTOWN | D270: CARPENTER 5 | G270: HAUGHTON 2 | J270: CALDWELL | M270: CONDON | O270: O'KEEFE | Q270: GEISLER | S270: RUSSELL
A272: HAWTHORN | C272: 2 | D272: 3 | E272: =C272*6+D272 -> 15 | G272: 6 | H272: 6 | I272: =G272*6+H272 -> 42 | K272: 11 | L272: 11 | M272: =K272*6+L272 -> 77 | O272: 15 | P272: 19 | Q272: =O272*6+P272 -> 109 | S272: TOORAK PARK
A273: PRAHRAN | C273: 4 | D273: 5 | E273: =C273*6+D273 -> 29 | G273: 9 | H273: 7 | I273: =G273*6+H273 -> 61 | K273: 10 | L273: 8 | M273: =K273*6+L273 -> 68 | O273: 11 | P273: 11 | Q273: =O273*6+P273 -> 77 | S273: COLLINS
A274: BEST PLAYERS
A275: HAWTHORN | D275: PEARSON | G275: EMPEY | J275: GILL | L275: YEOMANS | O275: REEVES | R275: LEEHANE
A276: PRAHRAN | D276: HOLBROOK | G276: LOVE | J276: MILLER | L276: M BAYLISS | O276: MORONEY | R276: NAYLOR
A277: GOALKICKERS
A278: HAWTHORN | D278: PEARSON 5 | G278: EMPEY 4 | I278: COLQUHOUN 2 | L278: YEOMANS | N278: GILL | P278: LEEHANE | R278: FINCH
A279: PRAHRAN | D279: M BAYLISS 2 | G279: HARRISON 2 | J279: HOLBROOK 2 | M279: NAYLOR 2 | P279: O'HALLORAN 2 | S279: CHAPMAN
A281: NORTH MELBOURNE | C281: 6 | D281: 1 | E281: =C281*6+D281 -> 37 | G281: 12 | H281: 4 | I281: =G281*6+H281 -> 76 | K281: 13 | L281: 6 | M281: =K281*6+L281 -> 84 | O281: 17 | P281: 9 | Q281: =O281*6+P281 -> 111 | S281: NORTH MELB
A282: GEELONG ASSOC. | C282: 2 | D282: 2 | E282: =C282*6+D282 -> 14 | G282: 5 | H282: 3 | I282: =G282*6+H282 -> 33 | K282: 8 | L282: 8 | M282: =K282*6+L282 -> 56 | O282: 8 | P282: 8 | Q282: =O282*6+P282 -> 56 | S282: LEWIS
A283: BEST PLAYERS
A284: NORTH MELBOURNE | D284: ROSS | G284: KING | J284: METCALFE | M284: RAWLE | P284: RUSSELL | S284: GARDINER
A285: GEELONG ASSOC. | D285: COOPER | G285: MANSON | J285: GILMOUR | M285: FEDER | P285: LITTLE | S285: ELLIS
A286: GOALKICKERS
A287: NORTH MELBOURNE | D287: SIMPSON 4 | F287: METCALFE 3 | I287: GARDINER 3 | L287: KING 2 | N287: ROSS | P287: JOHNSON | R287: RAWLE | T287: FIELDING | W287: KEW MING
A288: GEELONG ASSOC. | D288: COOPER 3 | G288: GILMOUR 3 | J288: MANSON | L288: RUSSELL
A290: ROUND 7 | E290: 10TH JUNE | J290: WEATHER | M290: FINE NORTH BREEZE | S290: PLAYED AT | X290: LADDER | AB290: ROUND | AD290: 7
D291: 1ST QTR | H291: 2ND QTR | L291: 3RD QTR | P291: FINAL | S291: FOOTSCRAY
A292: FOOTSCRAY | C292: 3 | D292: 2 | E292: =C292*6+D292 -> 20 | G292: 6 | H292: 3 | I292: =G292*6+H292 -> 39 | K292: 8 | L292: 3 | M292: =K292*6+L292 -> 51 | O292: 13 | P292: 5 | Q292: =O292*6+P292 -> 83 | S292: UMPIRE | W292: TEAM | X292: W | Y292: L | Z292: D | AA292: FOR | AB292: AGST | AC292: % | AD292: PTS
A293: NORTH MELBOURNE | C293: 1 | D293: 1 | E293: =C293*6+D293 -> 7 | G293: 4 | H293: 2 | I293: =G293*6+H293 -> 26 | K293: 5 | L293: 5 | M293: =K293*6+L293 -> 35 | O293: 7 | P293: 5 | Q293: =O293*6+P293 -> 47 | S293: J CLARKE
A294: BEST PLAYERS | W294: FOOTSCRAY | X294: 6 | Y294: 1 | Z294: 0 | AA294: 599 | AB294: 299 | AC294: 200.33 | AD294: 24
A295: FOOTSCRAY | D295: O'BRIEN | F295: HOLDEN | I295: VALENTINE | L295: MARTIN | N295: O'DONOGHUE | Q295: MUELEMAN | W295: PORT MELBOURNE | X295: 6 | Y295: 1 | Z295: 0 | AA295: 613 | AB295: 427 | AC295: 143.55971896955504 | AD295: 24
A296: NORTH MELBOURNE | D296: WALSH | F296: JOHNSON | I296: LINTON | L296: FIELDING | N296: KING | Q296: GILES | W296: BRUNSWICK | X296: 5 | Y296: 2 | Z296: 0 | AA296: 584 | AB296: 405 | AC296: 144.19753086419752 | AD296: 20
A297: GOALKICKERS | W297: HAWTHORN | X297: 4 | Y297: 2 | Z297: 1 | AA297: 435 | AB297: 401 | AC297: 108.47880299251871 | AD297: 18
A298: FOOTSCRAY | D298: O'BRIEN 5 | G298: O'DONOGHUE 2 | J298: EASON 2 | L298: FORD | N298: WALSH | P298: SMITH | R298: MARTIN
A299: NORTH MELBOURNE | D299: GARDINER 4 | G299: SMITH 2 | J299: FIELDING | W299: WILLIAMSTOWN | X299: 4 | Y299: 3 | Z299: 0 | AA299: 504 | AB299: 401 | AC299: 125.6857855361596 | AD299: 16
W300: NORTH MELBOURNE | X300: 4 | Y300: 3 | Z300: 0 | AA300: 485 | AB300: 415 | AC300: 116.86746987951807 | AD300: 16
A301: HAWTHORN | C301: 1 | D301: 6 | E301: =C301*6+D301 -> 12 | G301: 4 | H301: 7 | I301: =G301*6+H301 -> 31 | K301: 7 | L301: 9 | M301: =K301*6+L301 -> 51 | O301: 7 | P301: 10 | Q301: =O301*6+P301 -> 52 | S301: WILLIAMSTOWN | W301: NORTHCOTE | X301: 3 | Y301: 3 | Z301: 1 | AA301: 475 | AB301: 521 | AC301: 91.170825335892516 | AD301: 14
A302: WILLIAMSTOWN | C302: 2 | D302: 3 | E302: =C302*6+D302 -> 15 | G302: 4 | H302: 4 | I302: =G302*6+H302 -> 28 | K302: 6 | L302: 5 | M302: =K302*6+L302 -> 41 | O302: 7 | P302: 8 | Q302: =O302*6+P302 -> 50 | W302: BRIGHTON | X302: 1 | Y302: 6 | Z302: 0 | AA302: 361 | AB302: 485 | AC302: 74.432989690721655 | AD302: 4
A303: BEST PLAYERS | W303: PRAHRAN | X303: 1 | Y303: 6 | Z303: 0 | AA303: 362 | AB303: 698 | AC303: 51.86 | AD303: 4
A304: HAWTHORN | D304: YEOMANS | F304: RADEMACHER | I304: McKENZIE | L304: McCASHNEY | O304: KEMP | Q304: PEARSON | W304: GEELONG ASSOC. | X304: 0 | Y304: 7 | Z304: 0 | AA304: 327 | AB304: 693 | AC304: 47.186147186147188 | AD304: 0
A305: WILLIAMSTOWN | D305: DUSSELL | F305: MITCHELL | I305: SMITH | L305: GEDDES | O305: O'KEEFE | Q305: McAULIFFE
A306: GOALKICKERS
A307: HAWTHORN | D307: PEARSON 3 | G307: YEOMANS 2 | J307: SCHOLLENBERG | M307: ROBERTS
A308: WILLIAMSTOWN | D308: MCAULIFFE 4 | G308: MITCHELL | J308: CARPENTER | M308: GEDDES
A310: NORTHCOTE | C310: 1 | D310: 6 | E310: =C310*6+D310 -> 12 | G310: 3 | H310: 10 | I310: =G310*6+H310 -> 28 | K310: 7 | L310: 17 | M310: =K310*6+L310 -> 59 | O310: 9 | P310: 19 | Q310: =O310*6+P310 -> 73 | S310: BRIGHTON BEACH
A311: BRIGHTON | C311: 1 | D311: 5 | E311: =C311*6+D311 -> 11 | G311: 4 | H311: 7 | I311: =G311*6+H311 -> 31 | K311: 4 | L311: 7 | M311: =K311*6+L311 -> 31 | O311: 5 | P311: 10 | Q311: =O311*6+P311 -> 40
A312: BEST PLAYERS
A313: NORTHCOTE | D313: BEITZEL | G313: DILLON | J313: LUGG | M313: ROSS | P313: INCH | S313: GRAY
A314: BRIGHTON | D314: DAYKIN | G314: DANGERFIELD | J314: HATTAM | M314: HARBOARD | P314: BICKFORD | S314: MILLS
A315: GOALKICKERS
A316: NORTHCOTE | D316: INCH 3 | G316: ROSS 2 | J316: THORPE | L316: JOHNSON | O316: DOWNES | Q316: GOUGH
A317: BRIGHTON | D317: DAYKIN 3 | G317: COLLINS | J317: IRWIN
A319: BRUNSWICK | C319: 3 | D319: 3 | E319: =C319*6+D319 -> 21 | G319: 9 | H319: 6 | I319: =G319*6+H319 -> 60 | K319: 13 | L319: 10 | M319: =K319*6+L319 -> 88 | O319: 19 | P319: 12 | Q319: =O319*6+P319 -> 126 | S319: TOORAK PARK
A320: PRAHRAN | C320: 0 | D320: 4 | E320: =C320*6+D320 -> 4 | G320: 4 | H320: 7 | I320: =G320*6+H320 -> 31 | K320: 4 | L320: 12 | M320: =K320*6+L320 -> 36 | O320: 5 | P320: 15 | Q320: =O320*6+P320 -> 45
A321: BEST PLAYERS
A322: BRUNSWICK | D322: SULLIVAN | G322: FITZGERALD | J322: MARSHALL | M322: FISHER | O322: RALEIGH | R322: MOORE
A323: PRAHRAN | D323: LOVE | G323: QUINN | J323: T BAYLISS | M323: M BAYLISS | O323: NAYLOR | R323: BOUSSIE
A324: GOALKICKERS
A325: BRUNSWICK | D325: SULLIVAN 13 | H325: MOORE 3 | K325: MARSHALL | N325: McINERNEY | Q325: MILLEN
A326: PRAHRAN | D326: BOUSSIE | G326: R NAYLOR | J326: MILLER | L326: M BAYLISS | O326: STEWART
A328: PORT MELBOURNE | C328: 5 | D328: 3 | E328: =C328*6+D328 -> 33 | G328: 12 | H328: 9 | I328: =G328*6+H328 -> 81 | K328: 18 | L328: 17 | M328: =K328*6+L328 -> 125 | O328: 24 | P328: 21 | Q328: =O328*6+P328 -> 165 | S328: PORT MELB
A329: GEELONG ASSOC. | C329: 2 | D329: 3 | E329: =C329*6+D329 -> 15 | G329: 3 | H329: 9 | I329: =G329*6+H329 -> 27 | K329: 3 | L329: 10 | M329: =K329*6+L329 -> 28 | O329: 5 | P329: 10 | Q329: =O329*6+P329 -> 40
A330: BEST PLAYERS
A331: PORT MELBOURNE | D331: GARBUTT | G331: OGILVIE | J331: HEANEY | M331: DOBRIGH | P331: W RUDD | R331: TAYLOR
A332: GEELONG ASSOC. | D332: GILMOUR | G332: WARREN | J332: MADDEN | M332: COOPER | P332: ELLIS | R332: McFARLANE
A333: GOALKICKERS
A334: PORT MELBOURNE | D334: TAYLOR 7 | F334: GARBUTT 7 | I334: W RUDD 2 | K334: WALTON 2 | N334: HEANEY 2 | Q334: DOBRIGH | S334: STANBRIDGE | V334: O'BRIEN | X334: JOHNSON
A335: GEELONG ASSOC. | D335: GILMOUR 2 | G335: COOPER | I335: BUTTERWORTH | L335: WARREN
A337: ROUND 8 | E337: 17TH JUNE | J337: WEATHER | M337: FINE COLD A.M. FOG | S337: PLAYED AT | X337: LADDER | AB337: ROUND | AD337: 8
D338: 1ST QTR | H338: 2ND QTR | L338: 3RD QTR | P338: FINAL | S338: PORT MELB
A339: PORT MELBOURNE | C339: 4 | D339: 6 | E339: =C339*6+D339 -> 30 | G339: 6 | H339: 8 | I339: =G339*6+H339 -> 44 | K339: 8 | L339: 14 | M339: =K339*6+L339 -> 62 | O339: 10 | P339: 14 | Q339: =O339*6+P339 -> 74 | S339: UMPIRE | W339: TEAM | X339: W | Y339: L | Z339: D | AA339: FOR | AB339: AGST | AC339: % | AD339: PTS
A340: HAWTHORN | C340: 1 | D340: 1 | E340: =C340*6+D340 -> 7 | G340: 3 | H340: 3 | I340: =G340*6+H340 -> 21 | K340: 3 | L340: 3 | M340: =K340*6+L340 -> 21 | O340: 6 | P340: 8 | Q340: =O340*6+P340 -> 44 | S340: DOHERTY
A341: BEST PLAYERS | W341: FOOTSCRAY | X341: 7 | Y341: 1 | Z341: 0 | AA341: 695 | AB341: 342 | AC341: 203.22 | AD341: 28
A342: PORT MELBOURNE | D342: TREMBATH | G342: BARFOOT | J342: WALTON | M342: DOBRIGH | O342: OGILVIE | Q342: JOHNSON | W342: PORT MELBOURNE | X342: 7 | Y342: 1 | Z342: 0 | AA342: 687 | AB342: 471 | AC342: 145.85987261146497 | AD342: 28
A343: HAWTHORN | D343: McCASHNEY | G343: RADEMACHER | J343: LETHLEAN | M343: BURKE | O343: ROBERTS | Q343: REEVES | W343: BRUNSWICK | X343: 6 | Y343: 2 | Z343: 0 | AA343: 674 | AB343: 461 | AC343: 146.20390455531452 | AD343: 24
A344: GOALKICKERS | W344: WILLIAMSTOWN | X344: 5 | Y344: 3 | Z344: 0 | AA344: 566 | AB344: 428 | AC344: 132.24299065420561 | AD344: 20
A345: PORT MELBOURNE | D345: TAYLOR 4 | G345: O'BRIEN 3 | J345: GARBUTT | M345: DOBRIGH | O345: PASH
A346: HAWTHORN | D346: SCHOLLENBERG 4 | I346: PEARSON 2 | W346: HAWTHORN | X346: 4 | Y346: 3 | Z346: 1 | AA346: 479 | AB346: 475 | AC346: 100.84210526315789 | AD346: 18
W347: NORTHCOTE | X347: 4 | Y347: 3 | Z347: 1 | AA347: 568 | AB347: 582 | AC347: 97.594501718213053 | AD347: 18
A348: BRUNSWICK | C348: 0 | D348: 3 | E348: =C348*6+D348 -> 3 | G348: 3 | H348: 7 | I348: =G348*6+H348 -> 25 | K348: 6 | L348: 12 | M348: =K348*6+L348 -> 48 | O348: 12 | P348: 18 | Q348: =O348*6+P348 -> 90 | S348: BRUNSWICK | W348: NORTH MELBOURNE | X348: 4 | Y348: 4 | Z348: 0 | AA348: 541 | AB348: 505 | AC348: 107.12871287128714 | AD348: 16
A349: NORTH MELBOURNE | C349: 2 | D349: 4 | E349: =C349*6+D349 -> 16 | G349: 2 | H349: 8 | I349: =G349*6+H349 -> 20 | K349: 4 | L349: 13 | M349: =K349*6+L349 -> 37 | O349: 7 | P349: 14 | Q349: =O349*6+P349 -> 56 | S349: MOXHAM | W349: BRIGHTON | X349: 1 | Y349: 7 | Z349: 0 | AA349: 404 | AB349: 581 | AC349: 69.535283993115314 | AD349: 4
A350: BEST PLAYERS | W350: PRAHRAN | X350: 1 | Y350: 7 | Z350: 0 | AA350: 423 | AB350: 791 | AC350: 53.48 | AD350: 4
A351: BRUNSWICK | D351: McINERNEY | G351: SWIFT | J351: O'CONNOR | M351: DALTON | O351: SULLIVAN | Q351: ALESSIO | W351: GEELONG ASSOC. | X351: 0 | Y351: 8 | Z351: 0 | AA351: 354 | AB351: 755 | AC351: 46.88741721854305 | AD351: 0
A352: NORTH MELBOURNE | D352: JOHNSON | G352: RUSSELL | J352: METCALFE | M352: WALSH | O352: SIMPSON | Q352: KING
A353: GOALKICKERS
A354: BRUNSWICK | D354: McINERNEY 7 | G354: SULLIVAN 2 | J354: McCORMACK | M354: FISHER | O354: CHRISTIE
A355: NORTH MELBOURNE | D355: METCALFE 3 | H355: SMITH | J355: SIMPSON | M355: GARDINER | O355: FIELDING
A357: NORTHCOTE | C357: 4 | D357: 5 | E357: =C357*6+D357 -> 29 | G357: 9 | H357: 10 | I357: =G357*6+H357 -> 64 | K357: 12 | L357: 12 | M357: =K357*6+L357 -> 84 | O357: 13 | P357: 15 | Q357: =O357*6+P357 -> 93 | S357: NORTHCOTE
A358: PRAHRAN | C358: 1 | D358: 0 | E358: =C358*6+D358 -> 6 | G358: 5 | H358: 2 | I358: =G358*6+H358 -> 32 | K358: 6 | L358: 4 | M358: =K358*6+L358 -> 40 | O358: 9 | P358: 7 | Q358: =O358*6+P358 -> 61 | S358: CLARKE
A359: BEST PLAYERS
A360: NORTHCOTE | D360: DILLON | G360: INCH | J360: GRAY | M360: ROSS | P360: DOWNES | S360: STONE
A361: PRAHRAN | D361: M BAYLISS | G361: LOVE | J361: MILLER | M361: O'HALLORAN | P361: FIELD | S361: MORONEY
A362: GOALKICKERS
A363: NORTHCOTE | D363: THORPE 3 | G363: ROSS 2 | I363: DILLON 2 | K363: DOWNES 2 | N363: GOUGH | P363: JOHNSON | R363: GRAY | T363: INCH
A364: PRAHRAN | D364: M BAYLISS 3 | G364: MILLER 2 | I364: O'MEARA | K364: LOVE | M364: BUGDEN | O364: O'HALLORAN
A366: WILLIAMSTOWN | C366: 3 | D366: 0 | E366: =C366*6+D366 -> 18 | G366: 5 | H366: 1 | I366: =G366*6+H366 -> 31 | K366: 7 | L366: 4 | M366: =K366*6+L366 -> 46 | O366: 9 | P366: 8 | Q366: =O366*6+P366 -> 62 | S366: KARDINIA PARK
A367: GEELONG ASSOC. | C367: 2 | D367: 1 | E367: =C367*6+D367 -> 13 | G367: 2 | H367: 5 | I367: =G367*6+H367 -> 17 | K367: 2 | L367: 8 | M367: =K367*6+L367 -> 20 | O367: 3 | P367: 9 | Q367: =O367*6+P367 -> 27 | S367: McKINNON
A368: BEST PLAYERS
A369: WILLIAMSTOWN | D369: MITCHELL | G369: LYONS | I369: CALDWELL | L369: N McDONALD | O369: HOLTEN | R369: O'KEEFE
A370: GEELONG ASSOC. | D370: McFARLANE | G370: ELLIS | I370: LITTLE | L370: BUCHANAN | O370: ELLINGSEN | R370: MANSON
A371: GOALKICKERS
A372: WILLIAMSTOWN | D372: MITCHELL 2 | G372: O'KEEFE 2 | I372: CARPENTER 2 | L372: HAUGHTON | O372: N McDONALD | R372: McAULIFFE
A373: GEELONG ASSOC. | D373: BUCHANAN 2 | G373: ELLINGSEN
A375: FOOTSCRAY | C375: 5 | D375: 5 | E375: =C375*6+D375 -> 35 | G375: 9 | H375: 9 | I375: =G375*6+H375 -> 63 | K375: 11 | L375: 16 | M375: =K375*6+L375 -> 82 | O375: 13 | P375: 18 | Q375: =O375*6+P375 -> 96 | S375: BRIGHTON BEACH
A376: BRIGHTON | C376: 0 | D376: 1 | E376: =C376*6+D376 -> 1 | G376: 2 | H376: 3 | I376: =G376*6+H376 -> 15 | K376: 2 | L376: 3 | M376: =K376*6+L376 -> 15 | O376: 5 | P376: 13 | Q376: =O376*6+P376 -> 43 | S376: CAIN
A377: BEST PLAYERS
A378: FOOTSCRAY | D378: McCARTHY | G378: SHERRY | J378: HOLDEN | M378: O'BRIEN | P378: EASON | S378: JONSSON
A379: BRIGHTON | D379: DAYKIN | G379: HATTAM | J379: EWINS | M379: HARBOARD | P379: COBB | S379: CARROLL
A380: GOALKICKERS
A381: FOOTSCRAY | D381: O'BRIEN 4 | G381: EASON 2 | I381: McCARTHY | L381: SMITH | N381: VALENTINE | Q381: DILLON | S381: DOOLAN | W381: SHERRY | Y381: THOMSON
A382: BRIGHTON | D382: DAYKIN 3 | G382: HARBOARD | J382: COBB
A384: ROUND 9 | E384: 24TH JUNE | J384: WEATHER | M384: FINE COLD | S384: PLAYED AT | X384: LADDER | AB384: ROUND | AD384: 9
D385: 1ST QTR | H385: 2ND QTR | L385: 3RD QTR | P385: FINAL | S385: BRUNSWICK
A386: BRUNSWICK | C386: 2 | D386: 7 | E386: =C386*6+D386 -> 19 | G386: 5 | H386: 12 | I386: =G386*6+H386 -> 42 | K386: 10 | L386: 13 | M386: =K386*6+L386 -> 73 | O386: 15 | P386: 16 | Q386: =O386*6+P386 -> 106 | S386: UMPIRE | W386: TEAM | X386: W | Y386: L | Z386: D | AA386: FOR | AB386: AGST | AC386: % | AD386: PTS
A387: PORT MELBOURNE | C387: 1 | D387: 4 | E387: =C387*6+D387 -> 10 | G387: 4 | H387: 7 | I387: =G387*6+H387 -> 31 | K387: 5 | L387: 12 | M387: =K387*6+L387 -> 42 | O387: 8 | P387: 14 | Q387: =O387*6+P387 -> 62 | S387: CAIN
A388: BEST PLAYERS | W388: FOOTSCRAY | X388: 8 | Y388: 1 | Z388: 0 | AA388: 768 | AB388: 406 | AC388: 189.16 | AD388: 32
A389: BRUNSWICK | D389: O'CONNOR | G389: RALEIGH | J389: SWIFT | L389: SULLIVAN | N389: MILLEN | Q389: McINERNEY | W389: BRUNSWICK | X389: 7 | Y389: 2 | Z389: 0 | AA389: 780 | AB389: 523 | AC389: 149.13957934990441 | AD389: 28
A390: PORT MELBOURNE | D390: WALTON | G390: BARFOOT | J390: REES | L390: OGILVIE | N390: McQUEEN | Q390: STANBRIDGE | W390: PORT MELBOURNE | X390: 7 | Y390: 2 | Z390: 0 | AA390: 749 | AB390: 577 | AC390: 129.80935875216639 | AD390: 28
A391: GOALKICKERS | W391: NORTHCOTE | X391: 5 | Y391: 3 | Z391: 1 | AA391: 699 | AB391: 626 | AC391: 111.66134185303514 | AD391: 22
A392: BRUNSWICK | D392: SULLIVAN 5 | G392: McINERNEY 4 | J392: ALESSIO 4 | M392: FEATHERSTONE | Q392: CHRISTIE
A393: PORT MELBOURNE | D393: TAYLOR 4 | G393: J RUDD | J393: McQUEEN | M393: GARBUTT | O393: OGILVIE | W393: WILLIAMSTOWN | X393: 5 | Y393: 4 | Z393: 0 | AA393: 630 | AB393: 501 | AC393: 125.74850299401197 | AD393: 20
W394: NORTH MELBOURNE | X394: 5 | Y394: 4 | Z394: 0 | AA394: 613 | AB394: 540 | AC394: 113.51851851851852 | AD394: 20
A395: FOOTSCRAY | C395: 4 | D395: 1 | E395: =C395*6+D395 -> 25 | G395: 8 | H395: 4 | I395: =G395*6+H395 -> 52 | K395: 8 | L395: 7 | M395: =K395*6+L395 -> 55 | O395: 11 | P395: 7 | Q395: =O395*6+P395 -> 73 | S395: WILLIAMSTOWN | W395: HAWTHORN | X395: 4 | Y395: 4 | Z395: 1 | AA395: 514 | AB395: 547 | AC395: 93.967093235831811 | AD395: 18
A396: WILLIAMSTOWN | C396: 2 | D396: 1 | E396: =C396*6+D396 -> 13 | G396: 7 | H396: 3 | I396: =G396*6+H396 -> 45 | K396: 8 | L396: 5 | M396: =K396*6+L396 -> 53 | O396: 9 | P396: 10 | Q396: =O396*6+P396 -> 64 | S396: CLARKE | W396: BRIGHTON | X396: 2 | Y396: 7 | Z396: 0 | AA396: 516 | AB396: 620 | AC396: 83.225806451612897 | AD396: 8
A397: BEST PLAYERS | W397: PRAHRAN | X397: 1 | Y397: 8 | Z397: 0 | AA397: 462 | AB397: 903 | AC397: 51.16 | AD397: 4
A398: FOOTSCRAY | D398: EASON | G398: McCARTHY | J398: SAMSON | L398: O'BRIEN | O398: VALENTINE | R398: MARTIN | W398: GEELONG ASSOC. | X398: 0 | Y398: 9 | Z398: 0 | AA398: 398 | AB398: 886 | AC398: 44.920993227990969 | AD398: 0
A399: WILLIAMSTOWN | D399: N McDONALD | G399: McAULIFFE | J399: BROWN | L399: J McDONALD | O399: CONDON | R399: DUSSELL
A400: GOALKICKERS
A401: FOOTSCRAY | D401: SAMSON 4 | G401: O'BRIEN 2 | I401: EASON 2 | K401: DILLON | M401: MARTIN | O401: O'DONOGHUE
A402: WILLIAMSTOWN | D402: McAULIFFE 4 | G402: N McDONALD 3 | J402: DUSSELL 2
A404: NORTH MELBOURNE | C404: 2 | D404: 3 | E404: =C404*6+D404 -> 15 | G404: 4 | H404: 8 | I404: =G404*6+H404 -> 32 | K404: 6 | L404: 14 | M404: =K404*6+L404 -> 50 | O404: 9 | P404: 18 | Q404: =O404*6+P404 -> 72 | S404: NORTH MELB
A405: HAWTHORN | C405: 1 | D405: 3 | E405: =C405*6+D405 -> 9 | G405: 1 | H405: 6 | I405: =G405*6+H405 -> 12 | K405: 3 | L405: 8 | M405: =K405*6+L405 -> 26 | O405: 4 | P405: 11 | Q405: =O405*6+P405 -> 35 | S405: McKINNON
A406: BEST PLAYERS
A407: NORTH MELBOURNE | D407: GARDINER | G407: SIMPSON | J407: FIELDING | M407: RAWLE | O407: KEW MING | Q407: WOODINGTON
A408: HAWTHORN | D408: PEARSON | G408: RADEMACHER | J408: EMPEY | M408: GILL | O408: GLYNN | Q408: McCASHNEY
A409: GOALKICKERS
A410: NORTH MELBOURNE | D410: SIMPSON 3 | G410: GARDINER 2 | J410: LINDSAY 2 | M410: FIELDING | P410: DOOLAN
A411: HAWTHORN | D411: PEARSON 2 | G411: EMPEY | J411: COLQUHOUN
A413: BRIGHTON | C413: 3 | D413: 6 | E413: =C413*6+D413 -> 24 | G413: 8 | H413: 12 | I413: =G413*6+H413 -> 60 | K413: 13 | L413: 14 | M413: =K413*6+L413 -> 92 | O413: 15 | P413: 22 | Q413: =O413*6+P413 -> 112 | S413: TOORAK PARK
A414: PRAHRAN | C414: 1 | D414: 1 | E414: =C414*6+D414 -> 7 | G414: 2 | H414: 2 | I414: =G414*6+H414 -> 14 | K414: 4 | L414: 5 | M414: =K414*6+L414 -> 29 | O414: 5 | P414: 9 | Q414: =O414*6+P414 -> 39 | S414: JENKIN
A415: BEST PLAYERS
A416: BRIGHTON | D416: D MAU | G416: DAYKIN | J416: HATTAM | M416: COBB | O416: BICKFORD | R416: CARROLL
A417: PRAHRAN | D417: LOVE | G417: NAYLOR | J417: MORONEY | M417: KELLY | O417: M BAYLISS | R417: CHAPMAN
A418: GOALKICKERS
A419: BRIGHTON | D419: COBB 6 | G419: DAYKIN 3 | J419: IRWIN 2 | M419: COLLINS 2 | P419: BICKFORD | S419: DANGERFIELD
A420: PRAHRAN | D420: M BAYLISS 2 | G420: HOLBROOK | J420: STEWART | M420: RIDER
A422: NORTHCOTE | C422: 2 | D422: 5 | E422: =C422*6+D422 -> 17 | G422: 6 | H422: 9 | I422: =G422*6+H422 -> 45 | K422: 12 | L422: 12 | M422: =K422*6+L422 -> 84 | O422: 19 | P422: 17 | Q422: =O422*6+P422 -> 131 | S422: N'COTE PK
A423: GEELONG ASSOC. | C423: 2 | D423: 4 | E423: =C423*6+D423 -> 16 | G423: 5 | H423: 6 | I423: =G423*6+H423 -> 36 | K423: 6 | L423: 7 | M423: =K423*6+L423 -> 43 | O423: 6 | P423: 8 | Q423: =O423*6+P423 -> 44 | S423: LEWIS
A424: BEST PLAYERS
A425: NORTHCOTE | D425: THORPE | G425: GOUGH | J425: DOWNES | M425: JOHNSON | O425: ROSS | Q425: OGDEN
A426: GEELONG ASSOC. | D426: ELLINGSEN | G426: BUCHANAN | J426: ELSTON | M426: TILLEY | O426: COOPER | Q426: MANSON
A427: GOALKICKERS
A428: NORTHCOTE | D428: THORPE 5 | F428: JOHNSON 3 | I428: DILLON 3 | K428: LUGG 2 | M428: DOWNES 2 | P428: ROSS 2 | R428: NAISMITH | U428: DIMMICK
A429: GEELONG ASSOC. | D429: ELSTON 3 | G429: COOPER | I429: PURTLE | K429: DIMMICK
A431: ROUND 10 | E431: 1ST JULY | H431: WEATHER | K431: COLD CLOUDY MISTY RAIN S.W. WIND | S431: PLAYED AT | X431: LADDER | AB431: ROUND | AD431: 10
D432: 1ST QTR | H432: 2ND QTR | L432: 3RD QTR | P432: FINAL | S432: FOOTSCRAY
A433: FOOTSCRAY | C433: 2 | D433: 4 | E433: =C433*6+D433 -> 16 | G433: 6 | H433: 7 | I433: =G433*6+H433 -> 43 | K433: 10 | L433: 9 | M433: =K433*6+L433 -> 69 | O433: 16 | P433: 11 | Q433: =O433*6+P433 -> 107 | S433: UMPIRE | W433: TEAM | X433: W | Y433: L | Z433: D | AA433: FOR | AB433: AGST | AC433: % | AD433: PTS
A434: BRUNSWICK | C434: 1 | D434: 4 | E434: =C434*6+D434 -> 10 | G434: 3 | H434: 7 | I434: =G434*6+H434 -> 25 | K434: 4 | L434: 9 | M434: =K434*6+L434 -> 33 | O434: 7 | P434: 11 | Q434: =O434*6+P434 -> 53 | S434: McKINNON
A435: BEST PLAYERS | W435: FOOTSCRAY | X435: 9 | Y435: 1 | Z435: 0 | AA435: 875 | AB435: 459 | AC435: 190.63 | AD435: 36
A436: FOOTSCRAY | D436: VALENTINE | G436: EASON | I436: MARTIN | L436: O'BRIEN | N436: O'DONOGHUE | Q436: HANSON | W436: PORT MELBOURNE | X436: 8 | Y436: 2 | Z436: 0 | AA436: 829 | AB436: 638 | AC436: 129.93730407523512 | AD436: 32
A437: BRUNSWICK | D437: O'CONNOR | G437: SWIFT | I437: RALEIGH | L437: KEOGH | N437: MOORE | Q437: SULLIVAN | W437: BRUNSWICK | X437: 7 | Y437: 3 | Z437: 0 | AA437: 833 | AB437: 630 | AC437: 132.22222222222223 | AD437: 28
A438: GOALKICKERS | W438: WILLIAMSTOWN | X438: 6 | Y438: 4 | Z438: 0 | AA438: 700 | AB438: 546 | AC438: 128.2051282051282 | AD438: 24
A439: FOOTSCRAY | D439: HANSON 4 | G439: O'DONOGHUE 4 | J439: O'BRIEN 4 | M439: EASON 2 | P439: SMITH 2
A440: BRUNSWICK | D440: SULLIVAN 3 | G440: McCORMACK | J440: CHRISTIE | M440: GREENHILL | P440: MILLEN | W440: NORTH MELBOURNE | X440: 6 | Y440: 4 | Z440: 0 | AA440: 667 | AB440: 587 | AC440: 113.62862010221465 | AD440: 24
W441: NORTHCOTE | X441: 5 | Y441: 4 | Z441: 1 | AA441: 760 | AB441: 706 | AC441: 107.64872521246458 | AD441: 22
A442: PORT MELBOURNE | C442: 6 | D442: 3 | E442: =C442*6+D442 -> 39 | G442: 7 | H442: 5 | I442: =G442*6+H442 -> 47 | K442: 10 | L442: 6 | M442: =K442*6+L442 -> 66 | O442: 12 | P442: 8 | Q442: =O442*6+P442 -> 80 | S442: PORT MELB | W442: HAWTHORN | X442: 5 | Y442: 4 | Z442: 1 | AA442: 618 | AB442: 605 | AC442: 102.14876033057851 | AD442: 22
A443: NORTHCOTE | C443: 2 | D443: 4 | E443: =C443*6+D443 -> 16 | G443: 4 | H443: 8 | I443: =G443*6+H443 -> 32 | K443: 5 | L443: 10 | M443: =K443*6+L443 -> 40 | O443: 7 | P443: 19 | Q443: =O443*6+P443 -> 61 | S443: CAIN | W443: BRIGHTON | X443: 2 | Y443: 8 | Z443: 0 | AA443: 563 | AB443: 674 | AC443: 83.531157270029667 | AD443: 8
A444: BEST PLAYERS | W444: PRAHRAN | X444: 1 | Y444: 9 | Z444: 0 | AA444: 507 | AB444: 973 | AC444: 52.11 | AD444: 4
A445: PORT MELBOURNE | D445: J RUDD | G445: WALTON | I445: TAYLOR | L445: O'BRIEN | N445: BARFOOT | Q445: JOHNSON | W445: GEELONG ASSOC. | X445: 0 | Y445: 10 | Z445: 0 | AA445: 456 | AB445: 990 | AC445: 46.060606060606062 | AD445: 0
A446: NORTHCOTE | D446: THORPE | G446: GOUGH | I446: DIMMICK | L446: OGDEN | N446: YATES | Q446: JOHNSON
A447: GOALKICKERS
A448: PORT MELBOURNE | D448: TAYLOR 6 | G448: BARFOOT 2 | J448: O'BRIEN 2 | M448: STANFORD | P448: STANBRIDGE
A449: NORTHCOTE | D449: DIMMICK 2 | G449: GOUGH 2 | J449: THORPE 2 | M449: DOWNES
A451: NORTH MELBOURNE | C451: 4 | D451: 3 | E451: =C451*6+D451 -> 27 | G451: 7 | H451: 5 | I451: =G451*6+H451 -> 47 | K451: 7 | L451: 9 | M451: =K451*6+L451 -> 51 | O451: 7 | P451: 12 | Q451: =O451*6+P451 -> 54 | S451: NORTH MELB
A452: BRIGHTON | C452: 1 | D452: 1 | E452: =C452*6+D452 -> 7 | G452: 3 | H452: 3 | I452: =G452*6+H452 -> 21 | K452: 4 | L452: 4 | M452: =K452*6+L452 -> 28 | O452: 7 | P452: 5 | Q452: =O452*6+P452 -> 47 | S452: KAIN
A453: BEST PLAYERS
A454: NORTH MELBOURNE | D454: SHORTEN | G454: LINDSAY | J454: GARDINER | M454: SIMPSON | P454: RUSS | R454: RAWLE
A455: BRIGHTON | D455: DAYKIN | G455: D MAU | J455: COBB | M455: IRWIN | P455: COLLINS | R455: BOYD
A456: GOALKICKERS
A457: NORTH MELBOURNE | D457: GARDINER 2 | G457: SIMPSON 2 | J457: LINDSAY | L457: FIELDING | N457: SHORTEN
A458: BRIGHTON | D458: BOYD 2 | G458: COBB | I458: IRWIN | K458: COLLINS | M458: DAYKIN | O458: D MAU
A460: WILLIAMSTOWN | C460: 2 | D460: 4 | E460: =C460*6+D460 -> 16 | G460: 4 | H460: 10 | I460: =G460*6+H460 -> 34 | K460: 6 | L460: 14 | M460: =K460*6+L460 -> 50 | O460: 9 | P460: 16 | Q460: =O460*6+P460 -> 70 | S460: TOORAK PARK
A461: PRAHRAN | C461: 1 | D461: 1 | E461: =C461*6+D461 -> 7 | G461: 3 | H461: 6 | I461: =G461*6+H461 -> 24 | K461: 5 | L461: 8 | M461: =K461*6+L461 -> 38 | O461: 6 | P461: 9 | Q461: =O461*6+P461 -> 45 | S461: JENKINS
A462: BEST PLAYERS
A463: WILLIAMSTOWN | D463: CARPENTER | G463: KELLAM | I463: CONDON | L463: CALDWELL | O463: DUSSELL | R463: J McDONALD
A464: PRAHRAN | D464: M BAYLISS | G464: LOVE | I464: HEPBURN | L464: MILLER | O464: HOLBROOK | R464: CHAPMAN
A465: GOALKICKERS
A466: WILLIAMSTOWN | D466: HAUGHTON 2 | G466: N McDONALD 2 | J466: HOLTEN | L466: DUSSELL | N466: RUSSELL | P466: CARPENTER | S466: JAMIESON
A467: PRAHRAN | D467: LOVE 2 | G467: M BAYLISS | J467: HOLBROOK | M467: BUGDEN | O467: MILLER
A469: HAWTHORN | C469: 4 | D469: 5 | E469: =C469*6+D469 -> 29 | G469: 7 | H469: 12 | I469: =G469*6+H469 -> 54 | K469: 11 | L469: 17 | M469: =K469*6+L469 -> 83 | O469: 14 | P469: 24 | Q469: =O469*6+P469 -> 108 | S469: HAW
A470: GEELONG ASSOC. | C470: 2 | D470: 3 | E470: =C470*6+D470 -> 15 | G470: 5 | H470: 4 | I470: =G470*6+H470 -> 34 | K470: 6 | L470: 7 | M470: =K470*6+L470 -> 43 | O470: 8 | P470: 10 | Q470: =O470*6+P470 -> 58 | S470: LEWIS
A471: BEST PLAYERS
A472: HAWTHORN | D472: W GAMBETTA | G472: BURKE | I472: MURPHY | L472: YEOMANS | O472: HODGES | R472: SCHOLLENBERG
A473: GEELONG ASSOC. | D473: ELLINGSEN | G473: LITTLE | I473: BUCHANAN | L473: COOPER | O473: McSWEENEY | R473: MANSON
A474: GOALKICKERS
A475: HAWTHORN | D475: W GAMBETTA 6 | H475: YEOMANS 2 | K475: BRUCE | M475: BURKE | O475: MURPHY | Q475: HENRY | S475: LEEHANE | V475: SCHOLLENBERG
A476: GEELONG ASSOC. | D476: ELLLINGSEN 3 | H476: LITTLE | J476: MANSON | L476: BUCHANAN | O476: COOPER | Q476: McSWEENEY
A478: ROUND 11 | E478: 8TH JULY | G478: WEATHER | I478: COLD CLOUDY SOME SHOWERS SOUTH WIND GROUNDS BAD | S478: PLAYED AT | X478: LADDER | AB478: ROUND | AD478: 11
D479: 1ST QTR | H479: 2ND QTR | L479: 3RD QTR | P479: FINAL | S479: WILLIAMSTOWN
A480: WILLIAMSTOWN | C480: 0 | D480: 0 | E480: =C480*6+D480 -> 0 | G480: 3 | H480: 4 | I480: =G480*6+H480 -> 22 | K480: 4 | L480: 6 | M480: =K480*6+L480 -> 30 | O480: 6 | P480: 9 | Q480: =O480*6+P480 -> 45 | S480: UMPIRE | W480: TEAM | X480: W | Y480: L | Z480: D | AA480: FOR | AB480: AGST | AC480: % | AD480: PTS
A481: NORTH MELBOURNE | C481: 1 | D481: 3 | E481: =C481*6+D481 -> 9 | G481: 4 | H481: 3 | I481: =G481*6+H481 -> 27 | K481: 5 | L481: 6 | M481: =K481*6+L481 -> 36 | O481: 5 | P481: 7 | Q481: =O481*6+P481 -> 37 | S481: McKINNON
A482: BEST PLAYERS | W482: FOOTSCRAY | X482: 10 | Y482: 1 | Z482: 0 | AA482: 957 | AB482: 496 | AC482: 192.94 | AD482: 40
A483: WILLIAMSTOWN | D483: HOLTEN | F483: J McDONALD | I483: N McDONALD | L483: McAULIFFE | O483: DUSSELL | Q483: GEISLER | W483: PORT MELBOURNE | X483: 8 | Y483: 3 | Z483: 0 | AA483: 881 | AB483: 699 | AC483: 126.03719599427754 | AD483: 32
A484: NORTH MELBOURNE | D484: WALSH | F484: LAMBE | I484: SIMPSON | L484: RAWLE | O484: SMITH | Q484: LINTON | W484: WILLIAMSTOWN | X484: 7 | Y484: 4 | Z484: 0 | AA484: 745 | AB484: 583 | AC484: 127.78730703259005 | AD484: 28
A485: GOALKICKERS | W485: BRUNSWICK | X485: 7 | Y485: 4 | Z485: 0 | AA485: 868 | AB485: 690 | AC485: 125.79710144927536 | AD485: 28
A486: WILLIAMSTOWN | D486: N McDONALD 3 | H486: HAUGHTON 2 | K486: McAULIFFE
A487: NORTH MELBOURNE | D487: LINDSAY 2 | G487: SIMPSON | J487: KING | L487: GARDINER | W487: HAWTHORN | X487: 6 | Y487: 4 | Z487: 1 | AA487: 678 | AB487: 640 | AC487: 105.9375 | AD487: 26
W488: NORTH MELBOURNE | X488: 6 | Y488: 5 | Z488: 0 | AA488: 704 | AB488: 632 | AC488: 111.39240506329114 | AD488: 24
A489: HAWTHORN | C489: 1 | D489: 5 | E489: =C489*6+D489 -> 11 | G489: 3 | H489: 7 | I489: =G489*6+H489 -> 25 | K489: 5 | L489: 9 | M489: =K489*6+L489 -> 39 | O489: 8 | P489: 12 | Q489: =O489*6+P489 -> 60 | S489: BRUNSWICK | W489: NORTHCOTE | X489: 5 | Y489: 5 | Z489: 1 | AA489: 797 | AB489: 788 | AC489: 101.14213197969544 | AD489: 22
A490: BRUNSWICK | C490: 1 | D490: 2 | E490: =C490*6+D490 -> 8 | G490: 2 | H490: 8 | I490: =G490*6+H490 -> 20 | K490: 4 | L490: 9 | M490: =K490*6+L490 -> 33 | O490: 4 | P490: 11 | Q490: =O490*6+P490 -> 35 | S490: JENKINS | W490: BRIGHTON | X490: 3 | Y490: 8 | Z490: 0 | AA490: 624 | AB490: 726 | AC490: 85.950413223140501 | AD490: 12
A491: BEST PLAYERS | W491: GEELONG ASSOC. | X491: 1 | Y491: 10 | Z491: 0 | AA491: 538 | AB491: 1026 | AC491: 52.44 | AD491: 4
A492: HAWTHORN | D492: YEOMANS | F492: McCASHNEY | I492: BRUCE | L492: FINCH | N492: LEEHANE | Q492: LETHLEAN | W492: PRAHRAN | X492: 1 | Y492: 10 | Z492: 0 | AA492: 545 | AB492: 1057 | AC492: 51.561021759697255 | AD492: 4
A493: BRUNSWICK | D493: DALTON | F493: ALESSIO | I493: FISHER | L493: GREENHILL | O493: MILLEN | Q493: McINERNEY
A494: GOALKICKERS
A495: HAWTHORN | D495: BRUCE 2 | G495: LETHLEAN 2 | K495: YEOMANS 2 | N495: LEEHANE | P495: GILL
A496: BRUNSWICK | D496: MILLEN 2 | G496: ALESSIO | J496: FISHER
A498: FOOTSCRAY | C498: 1 | D498: 5 | E498: =C498*6+D498 -> 11 | G498: 3 | H498: 8 | I498: =G498*6+H498 -> 26 | K498: 7 | L498: 16 | M498: =K498*6+L498 -> 58 | O498: 11 | P498: 16 | Q498: =O498*6+P498 -> 82 | S498: NORTHCOTE
A499: NORTHCOTE | C499: 0 | D499: 4 | E499: =C499*6+D499 -> 4 | G499: 0 | H499: 9 | I499: =G499*6+H499 -> 9 | K499: 2 | L499: 10 | M499: =K499*6+L499 -> 22 | O499: 4 | P499: 13 | Q499: =O499*6+P499 -> 37 | S499: CLARKE
A500: BEST PLAYERS
A501: FOOTSCRAY | D501: O'BRIEN | G501: MARTIN | J501: HANSEN | M501: GRIERSON | P501: SAMSON | S501: McCARTHY
A502: NORTHCOTE | D502: GRAY | G502: ROSS | J502: LUGG | M502: POWELL | P502: OGDEN | S502: THORPE
A503: GOALKICKERS
A504: FOOTSCRAY | D504: SAMSON 3 | G504: O'BRIEN 3 | I504: O'DONOGHUE 2 | L504: HANSEN 2 | N504: McCARTHY
A505: NORTHCOTE | D505: JOHNSON 2 | G505: GRAY | I505: DIMMICK
A507: GEELONG ASSOC. | C507: 2 | D507: 6 | E507: =C507*6+D507 -> 18 | G507: 5 | H507: 6 | I507: =G507*6+H507 -> 36 | K507: 6 | L507: 12 | M507: =K507*6+L507 -> 48 | O507: 11 | P507: 16 | Q507: =O507*6+P507 -> 82 | S507: KARDINIA PARK
A508: PRAHRAN | C508: 2 | D508: 0 | E508: =C508*6+D508 -> 12 | G508: 4 | H508: 2 | I508: =G508*6+H508 -> 26 | K508: 4 | L508: 2 | M508: =K508*6+L508 -> 26 | O508: 6 | P508: 2 | Q508: =O508*6+P508 -> 38 | S508: LEWIS
A509: BEST PLAYERS
A510: GEELONG ASSOC. | D510: HEALEY | G510: FOWLER | J510: MARTINI | M510: ELLINGSEN | P510: McQUEEN | S510: CATIONS
A511: PRAHRAN | D511: O'MEARA | G511: T BAYLISS | J511: HOLBROOK | M511: MORONEY | P511: CHAPMAN | S511: LOVE
A512: GOALKICKERS
A513: GEELONG ASSOC. | D513: MARTINI 8 | G513: HEALEY | J513: BUCHANAN | M513: ELLINGSEN
A514: PRAHRAN | D514: HOLBROOK 2 | G514: M BAYLISS 2 | J514: T BAYLISS 2
A516: BRIGHTON | C516: 4 | D516: 9 | E516: =C516*6+D516 -> 33 | G516: 5 | H516: 10 | I516: =G516*6+H516 -> 40 | K516: 8 | L516: 13 | M516: =K516*6+L516 -> 61 | O516: 8 | P516: 13 | Q516: =O516*6+P516 -> 61 | S516: BRIGHTON BEACH
A517: PORT MELBOURNE | C517: 0 | D517: 0 | E517: =C517*6+D517 -> 0 | G517: 3 | H517: 3 | I517: =G517*6+H517 -> 21 | K517: 4 | L517: 7 | M517: =K517*6+L517 -> 31 | O517: 7 | P517: 10 | Q517: =O517*6+P517 -> 52 | S517: COLLINS
A518: BEST PLAYERS
A519: BRIGHTON | D519: EWINS | G519: IRWIN | J519: D MAU | M519: COLLINS | P519: DAYKIN | S519: COBB
A520: PORT MELBOURNE | D520: TREMBATH | G520: TAYLOR | J520: STANFORD | M520: BARFOOT | P520: WALTON | S520: JOHNSON
A521: GOALKICKERS
A522: BRIGHTON | D522: BOYD 2 | G522: IRWIN 2 | J522: DAYKIN 2 | M522: BORLAND | O522: COBB
A523: PORT MELBOURNE | D523: TAYLOR 4 | G523: COOPER 2 | J523: NELSON
A525: ROUND 12 | E525: 15TH JULY | J525: WEATHER | M525: RAIN N.W. WIND | S525: PLAYED AT | X525: LADDER | AB525: ROUND | AD525: 12
D526: 1ST QTR | H526: 2ND QTR | L526: 3RD QTR | P526: FINAL | S526: WILLIAMSTOWN
A527: PORT MELBOURNE | C527: 2 | D527: 1 | E527: =C527*6+D527 -> 13 | G527: 5 | H527: 3 | I527: =G527*6+H527 -> 33 | K527: 8 | L527: 4 | M527: =K527*6+L527 -> 52 | O527: 11 | P527: 11 | Q527: =O527*6+P527 -> 77 | S527: UMPIRE | W527: TEAM | X527: W | Y527: L | Z527: D | AA527: FOR | AB527: AGST | AC527: % | AD527: PTS
A528: WILLIAMSTOWN | C528: 6 | D528: 2 | E528: =C528*6+D528 -> 38 | G528: 6 | H528: 4 | I528: =G528*6+H528 -> 40 | K528: 9 | L528: 5 | M528: =K528*6+L528 -> 59 | O528: 10 | P528: 5 | Q528: =O528*6+P528 -> 65 | S528: CAIN
A529: BEST PLAYERS | W529: FOOTSCRAY | X529: 11 | Y529: 1 | Z529: 0 | AA529: 1045 | AB529: 535 | AC529: 195.33 | AD529: 44
A530: PORT MELBOURNE | D530: OGILVIE | F530: TREMBATH | I530: MURPHY | L530: COOPER | N530: BARFOOT | Q530: O'BRIEN | W530: PORT MELBOURNE | X530: 9 | Y530: 3 | Z530: 0 | AA530: 958 | AB530: 764 | AC530: 125.39267015706807 | AD530: 36
A531: WILLIAMSTOWN | D531: CONDON | F531: GEDDES | I531: MUNRO | L531: GEISLER | N531: MITCHELL | Q531: HOLTEN | W531: BRUNSWICK | X531: 8 | Y531: 4 | Z531: 0 | AA531: 951 | AB531: 772 | AC531: 123.18652849740933 | AD531: 32
A532: GOALKICKERS | W532: WILLIAMSTOWN | X532: 7 | Y532: 5 | Z532: 0 | AA532: 810 | AB532: 660 | AC532: 122.72727272727273 | AD532: 28
A533: PORT MELBOURNE | D533: TAYLOR 6 | G533: W RUDD 2 | J533: NELSON | L533: COOPER | N533: OGILVIE
A534: WILLIAMSTOWN | D534: MCAULIFFE 4 | G534: CARPENTER 2 | J534: WHITBURN | M534: MITCHELL | O534: HOLTEN | Q534: N McDONALD | W534: NORTH MELBOURNE | X534: 7 | Y534: 5 | Z534: 0 | AA534: 794 | AB534: 670 | AC534: 118.50746268656717 | AD534: 28
W535: HAWTHORN | X535: 6 | Y535: 5 | Z535: 1 | AA535: 717 | AB535: 728 | AC535: 98.489010989010993 | AD535: 26
A536: FOOTSCRAY | C536: 5 | D536: 1 | E536: =C536*6+D536 -> 31 | G536: 7 | H536: 7 | I536: =G536*6+H536 -> 49 | K536: 9 | L536: 8 | M536: =K536*6+L536 -> 62 | O536: 13 | P536: 10 | Q536: =O536*6+P536 -> 88 | S536: GLENFERRIE | W536: NORTHCOTE | X536: 5 | Y536: 6 | Z536: 1 | AA536: 879 | AB536: 871 | AC536: 100.91848450057405 | AD536: 22
A537: HAWTHORN | C537: 2 | D537: 5 | E537: =C537*6+D537 -> 17 | G537: 2 | H537: 7 | I537: =G537*6+H537 -> 19 | K537: 3 | L537: 12 | M537: =K537*6+L537 -> 30 | O537: 4 | P537: 15 | Q537: =O537*6+P537 -> 39 | S537: CLARKE | W537: BRIGHTON | X537: 4 | Y537: 8 | Z537: 0 | AA537: 709 | AB537: 789 | AC537: 89.860583016476554 | AD537: 16
A538: BEST PLAYERS | W538: GEELONG ASSOC. | X538: 1 | Y538: 11 | Z538: 0 | AA538: 601 | AB538: 1111 | AC538: 54.09 | AD538: 4
A539: FOOTSCRAY | D539: EASON | F539: McCARTHY | I539: O'DONOGHUE | L539: McINTYRE | O539: DOOLAN | Q539: SMITH | W539: PRAHRAN | X539: 1 | Y539: 11 | Z539: 0 | AA539: 583 | AB539: 1147 | AC539: 50.828247602441152 | AD539: 4
A540: HAWTHORN | D540: YEOMANS | F540: HODGES | I540: FINCH | L540: RADEMACHER | O540: LEEHANE | Q540: GLYNN
A541: GOALKICKERS
A542: FOOTSCRAY | D542: O'DONOGHUE 4 | G542: THOMSON 2 | J542: HANSEN 2 | M542: EASON 2 | O542: McCARTHY | R542: MARTIN | U542: O'BRIEN
A543: HAWTHORN | D543: HODGES 2 | G543: YEOMANS 2
A545: BRUNSWICK | C545: 2 | D545: 5 | E545: =C545*6+D545 -> 17 | G545: 7 | H545: 10 | I545: =G545*6+H545 -> 52 | K545: 10 | L545: 10 | M545: =K545*6+L545 -> 70 | O545: 11 | P545: 17 | Q545: =O545*6+P545 -> 83 | S545: NORTHCOTE
A546: NORTHCOTE | C546: 7 | D546: 7 | E546: =C546*6+D546 -> 49 | G546: 8 | H546: 10 | I546: =G546*6+H546 -> 58 | K546: 11 | L546: 10 | M546: =K546*6+L546 -> 76 | O546: 12 | P546: 10 | Q546: =O546*6+P546 -> 82 | S546: LEWIS
A547: BEST PLAYERS
A548: BRUNSWICK | D548: RALEIGH | G548: FISHER | I548: SULLIVAN | L548: CHRISTIE | O548: ALESSIO | R548: GRIMSTER
A549: NORTHCOTE | D549: LUGG | G549: GRAY | I549: DOWNES | L549: YATES | O549: ROSS | R549: DIMMICK
A550: GOALKICKERS
A551: BRUNSWICK | D551: SULLIVAN 4 | G551: CHRISTIE 4 | J551: FISHER | L551: PARSONS | N551: ALESSIO
A552: NORTHCOTE | D552: THORPE 5 | G552: OGDEN 2 | J552: DOWNES 2 | M552: GOUGH | O552: ROSS | Q552: LUGG
A554: BRIGHTON | C554: 4 | D554: 4 | E554: =C554*6+D554 -> 28 | G554: 7 | H554: 6 | I554: =G554*6+H554 -> 48 | K554: 9 | L554: 8 | M554: =K554*6+L554 -> 62 | O554: 12 | P554: 13 | Q554: =O554*6+P554 -> 85 | S554: BRIGHTON BEACH
A555: GEELONG ASSOC. | C555: 2 | D555: 3 | E555: =C555*6+D555 -> 15 | G555: 4 | H555: 4 | I555: =G555*6+H555 -> 28 | K555: 8 | L555: 7 | M555: =K555*6+L555 -> 55 | O555: 9 | P555: 9 | Q555: =O555*6+P555 -> 63 | S555: JENKINS
A556: BEST PLAYERS
A557: BRIGHTON | D557: COBB | G557: BOYD | J557: HATTAM | M557: BORLAND | P557: DAYKIN | S557: CARROLL
A558: GEELONG ASSOC. | D558: DIGBY | G558: ELSTON | J558: COOPER | M558: HEALEY | P558: CESARI | S558: BUCHANAN
A559: GOALKICKERS
A560: BRIGHTON | D560: COBB 5 | G560: BOYD 3 | J560: N MAU 2 | M560: IRWIN | O560: CAMPBELL
A561: GEELONG ASSOC. | D561: DIGBY 2 | G561: HEALEY 2 | J561: WARREN 2 | M561: ELSTON | O561: CESARI | Q561: MARTINI
A563: NORTH MELBOURNE | C563: 3 | D563: 2 | E563: =C563*6+D563 -> 20 | G563: 6 | H563: 6 | I563: =G563*6+H563 -> 42 | K563: 8 | L563: 8 | M563: =K563*6+L563 -> 56 | O563: 12 | P563: 18 | Q563: =O563*6+P563 -> 90 | S563: TOORAK PARK
A564: PRAHRAN | C564: 1 | D564: 6 | E564: =C564*6+D564 -> 12 | G564: 2 | H564: 7 | I564: =G564*6+H564 -> 19 | K564: 2 | L564: 9 | M564: =K564*6+L564 -> 21 | O564: 4 | P564: 14 | Q564: =O564*6+P564 -> 38 | S564: COLLINS
A565: BEST PLAYERS
A566: NORTH MELBOURNE | D566: ROSS | G566: GARDINER | J566: DOOLAN | M566: KING | P566: SHORTEN | S566: LINTON
A567: PRAHRAN | D567: T BAYLISS | G567: TWEEDLEY | J567: HOLBROOK | M567: LOVE | P567: MORONEY | S567: O'MEARA
A568: GOALKICKERS
A569: NORTH MELBOURNE | D569: GARDINER 6 | G569: ROSS 2 | I569: DOOLAN | K569: KING | M569: SHORTEN | O569: LINDSAY
A570: PRAHRAN | D570: T BAYLISS 2 | H570: TWEEDLEY | K570: BUGDEN
A572: ROUND 13 | E572: 22ND JULY | J572: WEATHER | M572: FINE | S572: PLAYED AT | X572: LADDER | AB572: ROUND | AD572: 13
D573: 1ST QTR | H573: 2ND QTR | L573: 3RD QTR | P573: FINAL | S573: BRUNSWICK
A574: BRUNSWICK | C574: 4 | D574: 2 | E574: =C574*6+D574 -> 26 | G574: 5 | H574: 6 | I574: =G574*6+H574 -> 36 | K574: 9 | L574: 8 | M574: =K574*6+L574 -> 62 | O574: 10 | P574: 12 | Q574: =O574*6+P574 -> 72 | S574: UMPIRE | W574: TEAM | X574: W | Y574: L | Z574: D | AA574: FOR | AB574: AGST | AC574: % | AD574: PTS
A575: WILLIAMSTOWN | C575: 3 | D575: 1 | E575: =C575*6+D575 -> 19 | G575: 4 | H575: 2 | I575: =G575*6+H575 -> 26 | K575: 7 | L575: 8 | M575: =K575*6+L575 -> 50 | O575: 10 | P575: 12 | Q575: =O575*6+P575 -> 72 | S575: LEWIS
A576: BEST PLAYERS | W576: FOOTSCRAY | X576: 12 | Y576: 1 | Z576: 0 | AA576: 1144 | AB576: 582 | AC576: 196.56 | AD576: 48
A577: BRUNSWICK | D577: MOORE | F577: ALESSIO | I577: ROBERTS | K577: BROMLEY | N577: McINERNEY | Q577: FISHER | W577: PORT MELBOURNE | X577: 10 | Y577: 3 | Z577: 0 | AA577: 1040 | AB577: 800 | AC577: 130 | AD577: 40
A578: WILLIAMSTOWN | D578: MITCHELL | F578: HOLTEN | I578: GEDDES | K578: N McDONALD | N578: J McDONALD | Q578: WHITBURN | W578: BRUNSWICK | X578: 8 | Y578: 4 | Z578: 1 | AA578: 1023 | AB578: 844 | AC578: 121.2085308056872 | AD578: 34
A579: GOALKICKERS | W579: NORTH MELBOURNE | X579: 8 | Y579: 5 | Z579: 0 | AA579: 888 | AB579: 732 | AC579: 121.31147540983606 | AD579: 32
A580: BRUNSWICK | D580: McINERNEY 6 | H580: FISHER 2 | K580: ALESSIO | N580: SULLIVAN
A581: WILLIAMSTOWN | D581: N McDONALD 4 | H581: McAULIFFE 2 | K581: CARPENTER 2 | N581: WHITBURN | Q581: O'KEEFE | W581: WILLIAMSTOWN | X581: 7 | Y581: 5 | Z581: 1 | AA581: 882 | AB581: 732 | AC581: 120.49180327868852 | AD581: 30
W582: HAWTHORN | X582: 7 | Y582: 5 | Z582: 1 | AA582: 819 | AB582: 796 | AC582: 102.8894472361809 | AD582: 30
A583: NORTH MELBOURNE | C583: 3 | D583: 3 | E583: =C583*6+D583 -> 21 | G583: 7 | H583: 10 | I583: =G583*6+H583 -> 52 | K583: 10 | L583: 12 | M583: =K583*6+L583 -> 72 | O583: 13 | P583: 16 | Q583: =O583*6+P583 -> 94 | S583: NORTH MELB | W583: NORTHCOTE | X583: 5 | Y583: 7 | Z583: 1 | AA583: 941 | AB583: 965 | AC583: 97.512953367875653 | AD583: 22
A584: NORTHCOTE | C584: 1 | D584: 2 | E584: =C584*6+D584 -> 8 | G584: 3 | H584: 5 | I584: =G584*6+H584 -> 23 | K584: 7 | L584: 8 | M584: =K584*6+L584 -> 50 | O584: 9 | P584: 8 | Q584: =O584*6+P584 -> 62 | S584: McMULLEN | W584: BRIGHTON | X584: 4 | Y584: 9 | Z584: 0 | AA584: 777 | AB584: 891 | AC584: 87.205387205387211 | AD584: 16
A585: BEST PLAYERS | W585: GEELONG ASSOC. | X585: 1 | Y585: 12 | Z585: 0 | AA585: 648 | AB585: 1210 | AC585: 53.55 | AD585: 4
A586: NORTH MELBOURNE | D586: ROSS | F586: LINTON | I586: GARDINER | L586: SMITH | N586: KING | Q586: JOHNSON | W586: PRAHRAN | X586: 1 | Y586: 12 | Z586: 0 | AA586: 619 | AB586: 1229 | AC586: 50.366151342554922 | AD586: 4
A587: NORTHCOTE | D587: LUGG | F587: STEPHENSON | I587: THORPE | L587: ROSS | N587: PURCELL | Q587: HARLEY
A588: GOALKICKERS
A589: NORTH MELBOURNE | D589: GARDINER 4 | G589: ROSS 3 | I589: LINDSAY 3 | L589: SHORTEN | N589: JOHNSON | P589: FIELDING
A590: NORTHCOTE | D590: THORPE 4 | G590: JOHNSON 2 | J590: DOWNES | L590: GOUGH | N590: LUGG
A592: HAWTHORN | C592: 2 | D592: 2 | E592: =C592*6+D592 -> 14 | G592: 6 | H592: 7 | I592: =G592*6+H592 -> 43 | K592: 10 | L592: 10 | M592: =K592*6+L592 -> 70 | O592: 15 | P592: 12 | Q592: =O592*6+P592 -> 102 | S592: GLENFERRIE
A593: BRIGHTON | C593: 3 | D593: 3 | E593: =C593*6+D593 -> 21 | G593: 4 | H593: 4 | I593: =G593*6+H593 -> 28 | K593: 6 | L593: 6 | M593: =K593*6+L593 -> 42 | O593: 10 | P593: 8 | Q593: =O593*6+P593 -> 68 | S593: CLARKE
A594: BEST PLAYERS
A595: HAWTHORN | D595: GAMBETTA | F595: PEARSON | I595: BRUCE | L595: YEOMANS | O595: McCASHNEY | R595: CARBARNS
A596: BRIGHTON | D596: IRWIN | F596: MILLER | I596: LYNCH | L596: DAYKIN | O596: COBB | R596: CARROLL
A597: GOALKICKERS
A598: HAWTHORN | D598: GAMBETTA 7 | G598: YEOMANS 3 | J598: BRUCE 2 | M598: PEARSON 2 | P598: McCASHNEY
A599: BRIGHTON | D599: IRWIN 4 | G599: BOYD 2 | I599: COLLINS | K599: N MAU | M599: COBB | O599: DAYKIN
A601: PORT MELBOURNE | C601: 2 | D601: 4 | E601: =C601*6+D601 -> 16 | G601: 4 | H601: 8 | I601: =G601*6+H601 -> 32 | K601: 8 | L601: 15 | M601: =K601*6+L601 -> 63 | O601: 11 | P601: 16 | Q601: =O601*6+P601 -> 82 | S601: PORT MELB
A602: PRAHRAN | C602: 2 | D602: 2 | E602: =C602*6+D602 -> 14 | G602: 4 | H602: 3 | I602: =G602*6+H602 -> 27 | K602: 4 | L602: 4 | M602: =K602*6+L602 -> 28 | O602: 5 | P602: 6 | Q602: =O602*6+P602 -> 36 | S602: McKINNON
A603: BEST PLAYERS
A604: PORT MELBOURNE | D604: TREMBATH | G604: WALTON | I604: TAYLOR | L604: BARFOOT | O604: DOBRIGH | R604: JOHNSON
A605: PRAHRAN | D605: T BAYLISS | G605: LOVE | I605: PEARSON | L605: HARRISON | O605: FERGEUS | R605: O'HALLORAN
A606: GOALKICKERS
A607: PORT MELBOURNE | D607: TAYLOR 3 | G607: GARBUTT 3 | J607: BARFOOT 2 | M607: OGILVIE | O607: O'BRIEN | R607: REES
A608: PRAHRAN | D608: HOLBROOK 2 | G608: FERGEUS | J608: HARRISON | M608: T BAYLISS
A610: FOOTSCRAY | C610: 3 | D610: 1 | E610: =C610*6+D610 -> 19 | G610: 8 | H610: 6 | I610: =G610*6+H610 -> 54 | K610: 10 | L610: 8 | M610: =K610*6+L610 -> 68 | O610: 14 | P610: 15 | Q610: =O610*6+P610 -> 99 | S610: KARDINIA PARK
A611: GEELONG ASSOC. | C611: 1 | D611: 2 | E611: =C611*6+D611 -> 8 | G611: 2 | H611: 3 | I611: =G611*6+H611 -> 15 | K611: 4 | L611: 5 | M611: =K611*6+L611 -> 29 | O611: 7 | P611: 5 | Q611: =O611*6+P611 -> 47 | S611: CAIN
A612: BEST PLAYERS
A613: FOOTSCRAY | D613: McCARTHY | G613: EASON | J613: MARTIN | M613: O'BRIEN | P613: O'DONOGHUE | S613: McINTYRE
A614: GEELONG ASSOC. | D614: BUCHANAN | G614: FOWLER | J614: ELLINGSEN | M614: SPENDLOVE | P614: COOPER | S614: MANSON
A615: GOALKICKERS
A616: FOOTSCRAY | D616: O'BRIEN 5 | G616: O'DONOGHUE 3 | J616: EASON 2 | M616: HANSEN 2 | P616: McCARTHY | S616: SAMPSON
A617: GEELONG ASSOC. | D617: COOPER 4 | G617: DIGBY | J617: MANSON | M617: MARTINI
A619: ROUND 14 | E619: 29TH JULY | J619: WEATHER | M619: FINE S.E. BREEZE | S619: PLAYED AT | X619: LADDER | AB619: ROUND | AD619: 14
D620: 1ST QTR | H620: 2ND QTR | L620: 3RD QTR | P620: FINAL | S620: PORT MELB
A621: PORT MELBOURNE | C621: 2 | D621: 2 | E621: =C621*6+D621 -> 14 | G621: 7 | H621: 6 | I621: =G621*6+H621 -> 48 | K621: 8 | L621: 11 | M621: =K621*6+L621 -> 59 | O621: 11 | P621: 17 | Q621: =O621*6+P621 -> 83 | S621: UMPIRE | W621: TEAM | X621: W | Y621: L | Z621: D | AA621: FOR | AB621: AGST | AC621: % | AD621: PTS
A622: NORTH MELBOURNE | C622: 2 | D622: 1 | E622: =C622*6+D622 -> 13 | G622: 4 | H622: 3 | I622: =G622*6+H622 -> 27 | K622: 6 | L622: 4 | M622: =K622*6+L622 -> 40 | O622: 6 | P622: 6 | Q622: =O622*6+P622 -> 42 | S622: McKINNON
A623: BEST PLAYERS | W623: FOOTSCRAY | X623: 13 | Y623: 1 | Z623: 0 | AA623: 1268 | AB623: 629 | AC623: 201.59 | AD623: 52
A624: PORT MELBOURNE | D624: OGILVIE | F624: J RUDD | I624: JOHNSON | L624: BISSETT | N624: SKILTON | Q624: W RUDD | W624: PORT MELBOURNE | X624: 11 | Y624: 3 | Z624: 0 | AA624: 1123 | AB624: 842 | AC624: 133.3729216152019 | AD624: 44
A625: NORTH MELBOURNE | D625: JOHNSON | F625: RAWLE | I625: LAMBE | L625: WALSH | N625: STROWNIX | Q625: GILES | W625: BRUNSWICK | X625: 9 | Y625: 4 | Z625: 1 | AA625: 1130 | AB625: 921 | AC625: 122.69272529858848 | AD625: 38
A626: GOALKICKERS | W626: WILLIAMSTOWN | X626: 8 | Y626: 5 | Z626: 1 | AA626: 954 | AB626: 784 | AC626: 121.68367346938776 | AD626: 34
A627: PORT MELBOURNE | D627: OGILVIE 3 | F627: STANFORD 2 | I627: BARFOOT | K627: SKILTON | M627: TAYLOR | O627: W RUDD | Q627: COOPER | S627: J RUDD
A628: NORTH MELBOURNE | D628: LINDSAY 2 | G628: GARDINER 2 | J628: JOHNSON | L628: SHORTEN | W628: HAWTHORN | X628: 8 | Y628: 5 | Z628: 1 | AA628: 928 | AB628: 870 | AC628: 106.66666666666667 | AD628: 34
W629: NORTH MELBOURNE | X629: 8 | Y629: 6 | Z629: 0 | AA629: 930 | AB629: 815 | AC629: 114.11042944785277 | AD629: 32
A630: HAWTHORN | C630: 4 | D630: 4 | E630: =C630*6+D630 -> 28 | G630: 8 | H630: 6 | I630: =G630*6+H630 -> 54 | K630: 11 | L630: 8 | M630: =K630*6+L630 -> 74 | O630: 16 | P630: 13 | Q630: =O630*6+P630 -> 109 | S630: GLENFERRIE | W630: NORTHCOTE | X630: 5 | Y630: 8 | Z630: 1 | AA630: 1015 | AB630: 1074 | AC630: 94.506517690875228 | AD630: 22
A631: NORTHCOTE | C631: 4 | D631: 3 | E631: =C631*6+D631 -> 27 | G631: 6 | H631: 4 | I631: =G631*6+H631 -> 40 | K631: 9 | L631: 11 | M631: =K631*6+L631 -> 65 | O631: 10 | P631: 14 | Q631: =O631*6+P631 -> 74 | S631: CAIN | W631: BRIGHTON | X631: 4 | Y631: 10 | Z631: 0 | AA631: 829 | AB631: 963 | AC631: 86.085150571131877 | AD631: 16
A632: BEST PLAYERS | W632: GEELONG ASSOC. | X632: 1 | Y632: 13 | Z632: 0 | AA632: 725 | AB632: 1319 | AC632: 54.97 | AD632: 4
A633: HAWTHORN | D633: McCASHNEY | G633: LETHLEAN | J633: RADEMACHER | M633: REEVES | O633: BRUCE | R633: BURKE | W633: PRAHRAN | X633: 1 | Y633: 13 | Z633: 0 | AA633: 666 | AB633: 1351 | AC633: 49.3 | AD633: 4
A634: NORTHCOTE | D634: GRAY | G634: STONE | J634: STEPHENSON | M634: DOWNES | O634: JOHNSON | R634: ROSS
A635: GOALKICKERS
A636: HAWTHORN | D636: PEARSON 4 | G636: REEVES 3 | I636: HEDGES 3 | K636: BROWN 2 | M636: YEOMANS | O636: BURKE | Q636: GILL | R636: BRUCE
A637: NORTHCOTE | D637: THORPE 3 | F637: JOHNSON 2 | I637: GOUGH 2 | K637: DILLON 2 | M637: STEPHENSON
A639: WILLIAMSTOWN | C639: 3 | D639: 2 | E639: =C639*6+D639 -> 20 | G639: 5 | H639: 7 | I639: =G639*6+H639 -> 37 | K639: 6 | L639: 13 | M639: =K639*6+L639 -> 49 | O639: 9 | P639: 18 | Q639: =O639*6+P639 -> 72 | S639: BRIGHTON BEACH
A640: BRIGHTON | C640: 2 | D640: 2 | E640: =C640*6+D640 -> 14 | G640: 5 | H640: 3 | I640: =G640*6+H640 -> 33 | K640: 6 | L640: 3 | M640: =K640*6+L640 -> 39 | O640: 8 | P640: 4 | Q640: =O640*6+P640 -> 52 | S640: LEWIS
A641: BEST PLAYERS
A642: WILLIAMSTOWN | D642: N McDONALD | G642: CARPENTER | J642: MILES | M642: WHITBURN | P642: O'KEEFE | R642: McAULIFFE
A643: BRIGHTON | D643: MILLER | G643: DANGERFIELD | J643: DAYKIN | M643: BOYD | P643: LYNCH | R643: CARROLL
A644: GOALKICKERS
A645: WILLIAMSTOWN | D645: CARPENTER 4 | H645: McAULIFFE 2 | K645: MUNRO | M645: WHITBURN | P645: N McDONALD
A646: BRIGHTON | D646: DANGERFIELD 2 | H646: BOYD 2 | J646: COBB | L646: N MAU
A648: BRUNSWICK | C648: 5 | D648: 5 | E648: =C648*6+D648 -> 35 | G648: 8 | H648: 10 | I648: =G648*6+H648 -> 58 | K648: 10 | L648: 18 | M648: =K648*6+L648 -> 78 | O648: 14 | P648: 23 | Q648: =O648*6+P648 -> 107 | S648: BRUNSWICK
A649: GEELONG ASSOC. | C649: 3 | D649: 4 | E649: =C649*6+D649 -> 22 | G649: 6 | H649: 5 | I649: =G649*6+H649 -> 41 | K649: 9 | L649: 7 | M649: =K649*6+L649 -> 61 | O649: 11 | P649: 11 | Q649: =O649*6+P649 -> 77 | S649: CAIN
A650: BEST PLAYERS
A651: BRUNSWICK | D651: McINERNEY | G651: SULLIVAN | J651: WYATT | M651: MOORE | P651: ALESSIO | R651: FISHER
A652: GEELONG ASSOC. | D652: MARTINI | G652: CESARI | J652: ELLINGSEN | M652: BUCHANAN | P652: DIGBY | R652: ELSTON
A653: GOALKICKERS
A654: BRUNSWICK | D654: MCINERNEY 8 | G654: SULLIVAN 2 | J654: GREENHILL 2 | M654: WYATT | O654: MARSHALL
A655: GEELONG ASSOC. | D655: MARTINI 4 | F655: MANSON 2 | I655: COOPER 2 | K655: BUCHANAN | N655: DIGBY | P655: FOWLER
A657: FOOTSCRAY | C657: 2 | D657: 3 | E657: =C657*6+D657 -> 15 | G657: 9 | H657: 7 | I657: =G657*6+H657 -> 61 | K657: 13 | L657: 14 | M657: =K657*6+L657 -> 92 | O657: 17 | P657: 22 | Q657: =O657*6+P657 -> 124 | S657: TOORAK PARK
A658: PRAHRAN | C658: 2 | D658: 3 | E658: =C658*6+D658 -> 15 | G658: 3 | H658: 7 | I658: =G658*6+H658 -> 25 | K658: 5 | L658: 10 | M658: =K658*6+L658 -> 40 | O658: 6 | P658: 11 | Q658: =O658*6+P658 -> 47 | S658: CLARKE
A659: BEST PLAYERS
A660: FOOTSCRAY | D660: MCINTYRE | G660: VALENTINE | J660: O'BRIEN | M660: McCARTHY | P660: EASON | R660: O'DONOGHUE
A661: PRAHRAN | D661: RIDER | G661: STEWART | J661: LOVE | M661: McCUBBIN | P661: T BAYLISS | R661: CHAPMAN
A662: GOALKICKERS
A663: FOOTSCRAY | D663: O'DONOGHUE 4 | G663: O'BRIEN 3 | I663: HANSEN 3 | K663: MCCARTHY 2 | N663: ROWE 2 | P663: SAMPSON | R663: EASON | U663: MARTIN
A664: PRAHRAN | D664: TWEEDLEY | F664: HARRISON | I664: BOLAND | K664: LOVE | M664: CHAPMAN | P664: HOLBROOK
A666: ROUND 15 | E666: 5TH AUGUST | J666: WEATHER | M666: FINE LIGHT NORTH BREEZE | S666: PLAYED AT | X666: LADDER | AB666: ROUND | AD666: 15
D667: 1ST QTR | H667: 2ND QTR | L667: 3RD QTR | P667: FINAL | S667: FOOTSCRAY
A668: FOOTSCRAY | C668: 2 | D668: 3 | E668: =C668*6+D668 -> 15 | G668: 5 | H668: 5 | I668: =G668*6+H668 -> 35 | K668: 7 | L668: 9 | M668: =K668*6+L668 -> 51 | O668: 9 | P668: 9 | Q668: =O668*6+P668 -> 63 | S668: UMPIRE | W668: TEAM | X668: W | Y668: L | Z668: D | AA668: FOR | AB668: AGST | AC668: % | AD668: PTS
A669: PORT MELBOURNE | C669: 1 | D669: 0 | E669: =C669*6+D669 -> 6 | G669: 5 | H669: 3 | I669: =G669*6+H669 -> 33 | K669: 5 | L669: 6 | M669: =K669*6+L669 -> 36 | O669: 9 | P669: 7 | Q669: =O669*6+P669 -> 61 | S669: McLEAN
A670: BEST PLAYERS | W670: FOOTSCRAY | X670: 14 | Y670: 1 | Z670: 0 | AA670: 1331 | AB670: 690 | AC670: 192.9 | AD670: 56
A671: FOOTSCRAY | D671: McCARTHY | G671: DOOLAN | J671: McINTYRE | M671: MARTIN | O671: NEILSON | R671: FORD | W671: PORT MELBOURNE | X671: 11 | Y671: 4 | Z671: 0 | AA671: 1184 | AB671: 905 | AC671: 130.82872928176795 | AD671: 44
A672: PORT MELBOURNE | D672: WALTON | G672: BARFOOT | J672: J RUDD | M672: BRISCOE | O672: TREMBATH | R672: JOHNSON | W672: WILLIAMSTOWN | X672: 9 | Y672: 5 | Z672: 1 | AA672: 1050 | AB672: 831 | AC672: 126.35379061371842 | AD672: 38
A673: GOALKICKERS | W673: HAWTHORN | X673: 9 | Y673: 5 | Z673: 1 | AA673: 1139 | AB673: 915 | AC673: 124.48087431693989 | AD673: 38
A674: FOOTSCRAY | D674: O'BRIEN 3 | G674: McCARTHY 2 | J674: HANSEN | L674: SAMPSON | N674: O'DONOGHUE | Q674: MARTIN
A675: PORT MELBOURNE | D675: TAYLOR 4 | G675: WALTON 2 | J675: BARFOOT | L675: GARBUTT | N675: FORBES | W675: BRUNSWICK | X675: 9 | Y675: 5 | Z675: 1 | AA675: 1194 | AB675: 1013 | AC675: 117.86771964461994 | AD675: 38
W676: NORTH MELBOURNE | X676: 9 | Y676: 6 | Z676: 0 | AA676: 1005 | AB676: 862 | AC676: 116.5893271461717 | AD676: 36
A677: WILLIAMSTOWN | C677: 3 | D677: 3 | E677: =C677*6+D677 -> 21 | G677: 8 | H677: 6 | I677: =G677*6+H677 -> 54 | K677: 11 | L677: 15 | M677: =K677*6+L677 -> 81 | O677: 13 | P677: 18 | Q677: =O677*6+P677 -> 96 | S677: WILLIAMSTOWN | W677: NORTHCOTE | X677: 5 | Y677: 9 | Z677: 1 | AA677: 1062 | AB677: 1170 | AC677: 90.769230769230774 | AD677: 22
A678: NORTHCOTE | C678: 0 | D678: 2 | E678: =C678*6+D678 -> 2 | G678: 2 | H678: 4 | I678: =G678*6+H678 -> 16 | K678: 2 | L678: 7 | M678: =K678*6+L678 -> 19 | O678: 6 | P678: 11 | Q678: =O678*6+P678 -> 47 | S678: KANE | W678: BRIGHTON | X678: 5 | Y678: 10 | Z678: 0 | AA678: 921 | AB678: 1027 | AC678: 89.678675754625118 | AD678: 20
A679: BEST PLAYERS | W679: GEELONG ASSOC. | X679: 1 | Y679: 14 | Z679: 0 | AA679: 772 | AB679: 1394 | AC679: 55.38020086083214 | AD679: 4
A680: WILLIAMSTOWN | D680: GEDDES | G680: CARPENTER | J680: HOLTEN | M680: MITCHELL | O680: J McDONALD | R680: N McDONALD | W680: PRAHRAN | X680: 1 | Y680: 14 | Z680: 0 | AA680: 711 | AB680: 1562 | AC680: 45.52 | AD680: 4
A681: NORTHCOTE | D681: STEPHENSON | G681: GRAY | J681: HARLEY | M681: YATES | O681: DILLON | R681: GOUGH
A682: GOALKICKERS
A683: WILLIAMSTOWN | D683: CARPENTER 6 | G683: McAULIFFE 5 | J683: N McDONALD | M683: MITCHELL
A684: NORTHCOTE | D684: GRAY | F684: GOUGH | I684: JOHNSON | K684: CORFIELD | N684: DOWNES | P684: AYRES
A686: BRIGHTON | C686: 4 | D686: 3 | E686: =C686*6+D686 -> 27 | G686: 7 | H686: 7 | I686: =G686*6+H686 -> 49 | K686: 9 | L686: 6 | M686: =K686*6+L686 -> 60 | O686: 13 | P686: 14 | Q686: =O686*6+P686 -> 92 | S686: BRIGHTON BEACH
A687: BRUNSWICK | C687: 4 | D687: 4 | E687: =C687*6+D687 -> 28 | G687: 7 | H687: 6 | I687: =G687*6+H687 -> 48 | K687: 8 | L687: 9 | M687: =K687*6+L687 -> 57 | O687: 9 | P687: 10 | Q687: =O687*6+P687 -> 64 | S687: CLARKE
A688: BEST PLAYERS
A689: BRIGHTON | D689: DAYKIN | G689: BORLAND | J689: HATTAM | M689: WADE | O689: COBB | R689: MILLS
A690: BRUNSWICK | D690: McINERNEY | G690: SULLIVAN | J690: MOORE | M690: CAHILL | O690: ALESSIO | R690: RALEIGH
A691: GOALKICKERS
A692: BRIGHTON | D692: BOYD 6 | G692: DAYKIN 2 | J692: COBB 2 | L692: EWINS | N692: HARBOARD | Q692: BORLAND
A693: BRUNSWICK | D693: McINERNEY 5 | G693: SULLIVAN | J693: MOORE | L693: FISHER | N693: ALESSIO
A695: NORTH MELBOURNE | C695: 2 | D695: 1 | E695: =C695*6+D695 -> 13 | G695: 4 | H695: 3 | I695: =G695*6+H695 -> 27 | K695: 7 | L695: 7 | M695: =K695*6+L695 -> 49 | O695: 11 | P695: 9 | Q695: =O695*6+P695 -> 75 | S695: KARDINIA PARK
A696: GEELONG ASSOC. | C696: 1 | D696: 4 | E696: =C696*6+D696 -> 10 | G696: 2 | H696: 7 | I696: =G696*6+H696 -> 19 | K696: 4 | L696: 10 | M696: =K696*6+L696 -> 34 | O696: 6 | P696: 11 | Q696: =O696*6+P696 -> 47 | S696: McMULLEN
A697: BEST PLAYERS
A698: NORTH MELBOURNE | D698: SMITH | G698: GARDINER | J698: JOHNSON | M698: LINTON | O698: STROWNIX
A699: GEELONG ASSOC. | D699: BUCHANAN | G699: WARREN | J699: HEALEY | M699: SPENDLOVE | O699: CATIONS | R699: ELSTON
A700: GOALKICKERS
A701: NORTH MELBOURNE | D701: GARDINER 6 | G701: SMITH 2 | J701: RAWLE | L701: JOHNSON | O701: ROSS
A702: GEELONG ASSOC. | D702: MARIN 2 | G702: COOPER 2 | J702: CALABI | L702: DIGBY
A704: HAWTHORN | C704: 5 | D704: 7 | E704: =C704*6+D704 -> 37 | G704: 13 | H704: 16 | I704: =G704*6+H704 -> 94 | K704: 19 | L704: 22 | M704: =K704*6+L704 -> 136 | O704: 30 | P704: 31 | Q704: =O704*6+P704 -> 211 | S704: GLENFERRIE
A705: PRAHRAN | C705: 3 | D705: 2 | E705: =C705*6+D705 -> 20 | G705: 3 | H705: 4 | I705: =G705*6+H705 -> 22 | K705: 6 | L705: 8 | M705: =K705*6+L705 -> 44 | O705: 6 | P705: 9 | Q705: =O705*6+P705 -> 45 | S705: McKINNON
A706: BEST PLAYERS
A707: HAWTHORN | D707: YEOMANS | G707: GAMBETTA | J707: RADEMACHER | M707: FINCH | P707: McCASHNEY | S707: HODGES
A708: PRAHRAN | D708: T BAYLISS | G708: OGILVIE | J708: RIDER | M708: MORONEY | P708: CHAPMAN
A709: GOALKICKERS | N709: LETHLEAN | Q709: GILL | S709: REEVES | U709: BROWN
A710: HAWTHORN | D710: YEOMANS 6 | G710: GAMBETTA 5 | J710: HODGES 4 | M710: PEARSON 3 | P710: BRUCE 3 | R710: McCASHNEY 2 | W710: LEEHANE 2
A711: PRAHRAN | D711: T BAYLISS 2 | G711: RIDER 2 | J711: BOLAND | M711: HARRISON
A713: ROUND 16 | E713: 12TH AUGUST | H713: WEATHER | K713: COOL CLOUDY SHOWERS S.W. WIND | S713: PLAYED AT | X713: LADDER | AB713: ROUND | AD713: 16
D714: 1ST QTR | H714: 2ND QTR | L714: 3RD QTR | P714: FINAL | S714: NORTH MELB
A715: NORTH MELBOURNE | C715: 4 | D715: 3 | E715: =C715*6+D715 -> 27 | G715: 6 | H715: 5 | I715: =G715*6+H715 -> 41 | K715: 6 | L715: 8 | M715: =K715*6+L715 -> 44 | O715: 6 | P715: 11 | Q715: =O715*6+P715 -> 47 | S715: UMPIRE | W715: TEAM | X715: W | Y715: L | Z715: D | AA715: FOR | AB715: AGST | AC715: % | AD715: PTS
A716: FOOTSCRAY | C716: 0 | D716: 1 | E716: =C716*6+D716 -> 1 | G716: 2 | H716: 2 | I716: =G716*6+H716 -> 14 | K716: 4 | L716: 5 | M716: =K716*6+L716 -> 29 | O716: 4 | P716: 6 | Q716: =O716*6+P716 -> 30 | S716: McKINNON
A717: BEST PLAYERS | W717: FOOTSCRAY | X717: 14 | Y717: 2 | Z717: 0 | AA717: 1361 | AB717: 737 | AC717: 184.67 | AD717: 56
A718: NORTH MELBOURNE | D718: KING | F718: JOHNSON | I718: FIELDING | L718: WALSH | N718: STROWNIX | Q718: GARDINER | W718: PORT MELBOURNE | X718: 12 | Y718: 4 | Z718: 0 | AA718: 1259 | AB718: 963 | AC718: 130.73727933541016 | AD718: 48
A719: FOOTSCRAY | D719: McCARTHY | F719: MUELEMAN | I719: SAMSON | L719: MARTIN | N719: O'DONOGHUE | Q719: DOOLAN | W719: HAWTHORN | X719: 10 | Y719: 5 | Z719: 1 | AA719: 1212 | AB719: 967 | AC719: 125.33609100310238 | AD719: 42
A720: GOALKICKERS | W720: BRUNSWICK | X720: 10 | Y720: 5 | Z720: 1 | AA720: 1281 | AB720: 1036 | AC720: 123.64864864864865 | AD720: 42
A721: NORTH MELBOURNE | D721: FIELDING 2 | G721: GARDINER 2 | K721: JOHNSON | N721: DOOLAN
A722: FOOTSCRAY | D722: MARTIN | G722: MCCARTHY | J722: O'DONOGHUE | M722: O'BRIEN | W722: NORTH MELBOURNE | X722: 10 | Y722: 6 | Z722: 0 | AA722: 1052 | AB722: 892 | AC722: 117.93721973094171 | AD722: 40
W723: WILLIAMSTOWN | X723: 9 | Y723: 6 | Z723: 1 | AA723: 1102 | AB723: 904 | AC723: 121.90265486725664 | AD723: 38
A724: HAWTHORN | C724: 0 | D724: 5 | E724: =C724*6+D724 -> 5 | G724: 8 | H724: 7 | I724: =G724*6+H724 -> 55 | K724: 10 | L724: 10 | M724: =K724*6+L724 -> 70 | O724: 10 | P724: 13 | Q724: =O724*6+P724 -> 73 | S724: GLENFERRIE | W724: NORTHCOTE | X724: 6 | Y724: 9 | Z724: 1 | AA724: 1153 | AB724: 1233 | AC724: 93.511759935117595 | AD724: 26
A725: WILLIAMSTOWN | C725: 5 | D725: 0 | E725: =C725*6+D725 -> 30 | G725: 5 | H725: 1 | I725: =G725*6+H725 -> 31 | K725: 7 | L725: 4 | M725: =K725*6+L725 -> 46 | O725: 8 | P725: 4 | Q725: =O725*6+P725 -> 52 | S725: CLARKE | W725: BRIGHTON | X725: 5 | Y725: 11 | Z725: 0 | AA725: 984 | AB725: 1118 | AC725: 88.014311270125219 | AD725: 20
A726: BEST PLAYERS | W726: GEELONG ASSOC. | X726: 1 | Y726: 15 | Z726: 0 | AA726: 830 | AB726: 1469 | AC726: 56.501021102791015 | AD726: 4
A727: HAWTHORN | D727: FINCH | F727: GILL | I727: BROWN | L727: LETHLEAN | N727: GAMBETTA | Q727: RADEMACHER | W727: PRAHRAN | X727: 1 | Y727: 15 | Z727: 0 | AA727: 734 | AB727: 1649 | AC727: 44.51 | AD727: 4
A728: WILLIAMSTOWN | D728: CONDON | F728: GEISLER | I728: N McDONALD | L728: MUNRO | N728: MILES | Q728: COLECHIN
A729: GOALKICKERS
A730: HAWTHORN | D730: GAMBETTA 5 | G730: LETHLEAN 2 | J730: PEARSON 2 | M730: YEOMANS
A731: WILLIAMSTOWN | D731: CARPENTER 2 | G731: MUNRO 2 | J731: McAULIFFE | M731: MITCHELL | O731: DUSSELL | Q731: N McDONALD
A733: NORTHCOTE | C733: 7 | D733: 1 | E733: =C733*6+D733 -> 43 | G733: 9 | H733: 2 | I733: =G733*6+H733 -> 56 | K733: 13 | L733: 4 | M733: =K733*6+L733 -> 82 | O733: 14 | P733: 7 | Q733: =O733*6+P733 -> 91 | S733: NORTHCOTE
A734: BRIGHTON | C734: 1 | D734: 4 | E734: =C734*6+D734 -> 10 | G734: 3 | H734: 10 | I734: =G734*6+H734 -> 28 | K734: 5 | L734: 11 | M734: =K734*6+L734 -> 41 | O734: 8 | P734: 15 | Q734: =O734*6+P734 -> 63 | S734: MOSHAM
A735: BEST PLAYERS
A736: NORTHCOTE | D736: STEPHENSON | G736: BUISST | J736: LUGG | M736: DILLON | P736: OGDEN | R736: GOUGH
A737: BRIGHTON | D737: HATTAM | G737: WELSH | J737: N MAU | M737: IRWIN | P737: MILLS | R737: BOLAND
A738: GOALKICKERS
A739: NORTHCOTE | D739: OGDEN 5 | G739: DILLON 4 | I739: GOUGH 2 | K739: LUGG | M739: CORFIELD | O739: STEPHENSON
A740: BRIGHTON | D740: N MAU 4 | G740: IRWIN 2 | J740: WELSH 2
A742: BRUNSWICK | C742: 5 | D742: 6 | E742: =C742*6+D742 -> 36 | G742: 8 | H742: 9 | I742: =G742*6+H742 -> 57 | K742: 9 | L742: 16 | M742: =K742*6+L742 -> 70 | O742: 11 | P742: 21 | Q742: =O742*6+P742 -> 87 | S742: BRUNSWICK
A743: PRAHRAN | C743: 0 | D743: 0 | E743: =C743*6+D743 -> 0 | G743: 1 | H743: 5 | I743: =G743*6+H743 -> 11 | K743: 1 | L743: 5 | M743: =K743*6+L743 -> 11 | O743: 3 | P743: 5 | Q743: =O743*6+P743 -> 23 | S743: JENKINS
A744: BEST PLAYERS
A745: BRUNSWICK | D745: GRIMSTER | G745: FITZGERALD | J745: BROMLEY | M745: DALTON | P745: MOORE | R745: FISHER
A746: PRAHRAN | D746: T BAYLISS | G746: HARRISON | J746: TWEEDLEY | M746: McCUBBIN | P746: BUGDEN | R746: HOLBROOK
A747: GOALKICKERS
A748: BRUNSWICK | D748: McINERNEY 4 | H748: ALESSIO 2 | K748: WALSH 2 | N748: DALTON 2 | Q748: FISHER
A749: PRAHRAN | D749: HOLBROOK | H749: CROWLEY | K749: GLEESON
A751: PORT MELBOURNE | C751: 4 | D751: 1 | E751: =C751*6+D751 -> 25 | G751: 8 | H751: 3 | I751: =G751*6+H751 -> 51 | K751: 8 | L751: 9 | M751: =K751*6+L751 -> 57 | O751: 10 | P751: 15 | Q751: =O751*6+P751 -> 75 | S751: KARDINIA PARK
A752: GEELONG ASSOC. | C752: 2 | D752: 4 | E752: =C752*6+D752 -> 16 | G752: 4 | H752: 10 | I752: =G752*6+H752 -> 34 | K752: 6 | L752: 10 | M752: =K752*6+L752 -> 46 | O752: 8 | P752: 10 | Q752: =O752*6+P752 -> 58 | S752: THOMPSON
A753: BEST PLAYERS
A754: PORT MELBOURNE | D754: WALTON | G754: SKILTON | J754: OGILVIE | M754: GARBUTT | P754: W RUDD | R754: BARFOOT
A755: GEELONG ASSOC. | D755: BUCHANAN | G755: HEALEY | J755: HASSETT | M755: McFARLAND | P755: J FOWLER | R755: S FOWLER
A756: GOALKICKERS
A757: PORT MELBOURNE | D757: TAYLOR 6 | G757: GARBUTT | J757: SKILTON | M757: COOPER | O757: TREMBATH
A758: GEELONG ASSOC. | D758: MARTINI 3 | G758: COOPER 2 | J758: BUCHANAN | M758: KIRWOOD | O758: HEALEY
A760: ROUND 17 | E760: 19TH AUGUST | H760: WEATHER | K760: DULL CLOUDY SOME SHOWERS COLD S.W. WIND | S760: PLAYED AT | X760: LADDER | AB760: ROUND | AD760: 17
D761: 1ST QTR | H761: 2ND QTR | L761: 3RD QTR | P761: FINAL | S761: GLENFERRIE
A762: PORT MELBOURNE | C762: 3 | D762: 10 | E762: =C762*6+D762 -> 28 | G762: 4 | H762: 16 | I762: =G762*6+H762 -> 40 | K762: 10 | L762: 20 | M762: =K762*6+L762 -> 80 | O762: 12 | P762: 23 | Q762: =O762*6+P762 -> 95 | S762: UMPIRE | W762: TEAM | X762: W | Y762: L | Z762: D | AA762: FOR | AB762: AGST | AC762: % | AD762: PTS
A763: HAWTHORN | C763: 2 | D763: 0 | E763: =C763*6+D763 -> 12 | G763: 2 | H763: 3 | I763: =G763*6+H763 -> 15 | K763: 4 | L763: 5 | M763: =K763*6+L763 -> 29 | O763: 5 | P763: 10 | Q763: =O763*6+P763 -> 40 | S763: THOMSON
A764: BEST PLAYERS | W764: FOOTSCRAY | X764: 15 | Y764: 2 | Z764: 0 | AA764: 1475 | AB764: 770 | AC764: 191.56 | AD764: 60
A765: PORT MELBOURNE | D765: SKILTON | G765: BARFOOT | I765: REES | L765: FORBES | N765: TREMBATH | Q765: O'BRIEN | W765: PORT MELBOURNE | X765: 13 | Y765: 4 | Z765: 0 | AA765: 1354 | AB765: 1003 | AC765: 134.99501495513459 | AD765: 52
A766: HAWTHORN | D766: GAMBETTA | G766: HENRY | I766: YEOMANS | L766: PEARSON | N766: REEVES | Q766: GRIFFITHS | W766: NORTH MELBOURNE | X766: 11 | Y766: 6 | Z766: 0 | AA766: 1116 | AB766: 947 | AC766: 117.84582893347412 | AD766: 44
A767: GOALKICKERS | W767: WILLIAMSTOWN | X767: 10 | Y767: 6 | Z767: 1 | AA767: 1202 | AB767: 952 | AC767: 126.26050420168067 | AD767: 42
A768: PORT MELBOURNE | D768: BARFOOT 3 | F768: TAYLOR 2 | I768: O'BRIEN 2 | K768: OGILVIE | M768: DOBRIGH | O768: REES | P768: BARLOW | R768: STANFORD
A769: HAWTHORN | D769: GAMBETTA 2 | G769: HODGES 2 | J769: YEOMANS | W769: BRUNSWICK | X769: 10 | Y769: 6 | Z769: 1 | AA769: 1336 | AB769: 1100 | AC769: 121.45454545454545 | AD769: 42
W770: HAWTHORN | X770: 10 | Y770: 6 | Z770: 1 | AA770: 1252 | AB770: 1062 | AC770: 117.89077212806026 | AD770: 42
A771: NORTH MELBOURNE | C771: 3 | D771: 5 | E771: =C771*6+D771 -> 23 | G771: 7 | H771: 6 | I771: =G771*6+H771 -> 48 | K771: 9 | L771: 6 | M771: =K771*6+L771 -> 60 | O771: 9 | P771: 10 | Q771: =O771*6+P771 -> 64 | S771: NORTH MELB | W771: NORTHCOTE | X771: 7 | Y771: 9 | Z771: 1 | AA771: 1240 | AB771: 1290 | AC771: 96.124031007751938 | AD771: 30
A772: BRUNSWICK | C772: 1 | D772: 2 | E772: =C772*6+D772 -> 8 | G772: 3 | H772: 4 | I772: =G772*6+H772 -> 22 | K772: 4 | L772: 10 | M772: =K772*6+L772 -> 34 | O772: 7 | P772: 13 | Q772: =O772*6+P772 -> 55 | S772: JENKINS | W772: BRIGHTON | X772: 5 | Y772: 12 | Z772: 0 | AA772: 1017 | AB772: 1232 | AC772: 82.548701298701303 | AD772: 20
A773: BEST PLAYERS | W773: GEELONG ASSOC. | X773: 1 | Y773: 16 | Z773: 0 | AA773: 878 | AB773: 1569 | AC773: 55.959209687699172 | AD773: 4
A774: NORTH MELBOURNE | D774: STROWNIX | G774: WALSH | I774: GARDINER | L774: SMITH | N774: FIELDING | Q774: RAWLE | W774: PRAHRAN | X774: 1 | Y774: 16 | Z774: 0 | AA774: 791 | AB774: 1736 | AC774: 45.56 | AD774: 4
A775: BRUNSWICK | D775: ALESSIO | G775: KEOGH | I775: ROBERTS | L775: DALTON | N775: McINERNEY | Q775: GRIMSTER
A776: GOALKICKERS
A777: NORTH MELBOURNE | D777: GARDINER 5 | G777: DOOLAN 2 | J777: LINDSAY | L777: STROWNIX
A778: BRUNSWICK | D778: McINERNEY 4 | G778: MOORE | I778: ROBERTS | K778: FISHER
A780: NORTHCOTE | C780: 1 | D780: 2 | E780: =C780*6+D780 -> 8 | G780: 6 | H780: 9 | I780: =G780*6+H780 -> 45 | K780: 8 | L780: 14 | M780: =K780*6+L780 -> 62 | O780: 11 | P780: 21 | Q780: =O780*6+P780 -> 87 | S780: TOORAK PARK
A781: PRAHRAN | C781: 2 | D781: 5 | E781: =C781*6+D781 -> 17 | G781: 3 | H781: 5 | I781: =G781*6+H781 -> 23 | K781: 6 | L781: 8 | M781: =K781*6+L781 -> 44 | O781: 7 | P781: 15 | Q781: =O781*6+P781 -> 57 | S781: McKINNON
A782: BEST PLAYERS
A783: NORTHCOTE | D783: JOHNSON | G783: DOWNES | J783: CORFIELD | M783: MILBURN | P783: GOUGH | S783: DILLON
A784: PRAHRAN | D784: T BAYLISS | G784: MORONEY | J784: FARRELLY | M784: BOLAND | P784: OGILVIE | S784: HOLBROOK
A785: GOALKICKERS
A786: NORTHCOTE | D786: JOHNSON 4 | G786: DOWNES 3 | J786: GOUGH 3 | M786: AYRES
A787: PRAHRAN | D787: FARRELLY 3 | G787: BOUSSIE | J787: PEARSON | M787: T BAYLISS | P787: OGDEN
A789: WILLIAMSTOWN | C789: 5 | D789: 5 | E789: =C789*6+D789 -> 35 | G789: 6 | H789: 9 | I789: =G789*6+H789 -> 45 | K789: 10 | L789: 11 | M789: =K789*6+L789 -> 71 | O789: 14 | P789: 16 | Q789: =O789*6+P789 -> 100 | S789: WILLIAMSTOWN
A790: GEELONG ASSOC. | C790: 0 | D790: 3 | E790: =C790*6+D790 -> 3 | G790: 1 | H790: 8 | I790: =G790*6+H790 -> 14 | K790: 4 | L790: 11 | M790: =K790*6+L790 -> 35 | O790: 6 | P790: 12 | Q790: =O790*6+P790 -> 48 | S790: KANE
A791: BEST PLAYERS
A792: WILLIAMSTOWN | D792: MUNRO | G792: CARPENTER | J792: GEISLER | M792: KELLAM | P792: MILES | S792: WHITBURN
A793: GEELONG ASSOC. | D793: COOPER | G793: FOWLER | J793: CESARI | M793: BUCHANAN | P793: ELSTON | S793: JONES
A794: GOALKICKERS
A795: WILLIAMSTOWN | D795: MUNRO 4 | F795: CARPENTER 3 | I795: J McDONALD 3 | L795: GEISLER | N795: McAULIFFE | Q795: BLADEN | S795: WHITBURN
A796: GEELONG ASSOC. | D796: COOPER 3 | G796: JONES | I796: WARREN | L796: MANSON
A798: FOOTSCRAY | C798: 4 | D798: 0 | E798: =C798*6+D798 -> 24 | G798: 10 | H798: 4 | I798: =G798*6+H798 -> 64 | K798: 11 | L798: 8 | M798: =K798*6+L798 -> 74 | O798: 17 | P798: 12 | Q798: =O798*6+P798 -> 114 | S798: FOOTSCRAY
A799: BRIGHTON | C799: 1 | D799: 1 | E799: =C799*6+D799 -> 7 | G799: 1 | H799: 5 | I799: =G799*6+H799 -> 11 | K799: 2 | L799: 6 | M799: =K799*6+L799 -> 18 | O799: 4 | P799: 9 | Q799: =O799*6+P799 -> 33 | S799: CLARKE
A800: BEST PLAYERS
A801: FOOTSCRAY | D801: McCARTHY | G801: O'BRIEN | J801: EASON | M801: GOVAN | P801: O'DONOGHUE | S801: HANSEN
A802: BRIGHTON | D802: IRWIN | G802: N MAU | J802: DAYKIN | M802: EWINS | P802: BOLAND | S802: CARROLL
A803: GOALKICKERS
A804: FOOTSCRAY | D804: HANSEN 5 | F804: O'BRIEN 4 | I804: O'DONOGHUE 3 | L804: EASON 2 | N804: MARTIN | P804: McCARTHY | R804: GOVAN
A805: BRIGHTON | D805: N MAU 2 | G805: LYNCH | J805: WELSH
A807: ROUND 18 | E807: 26TH AUGUST | J807: WEATHER | M807: RAIN NORTH WIND | S807: PLAYED AT | X807: LADDER | AB807: ROUND | AD807: 18
D808: 1ST QTR | H808: 2ND QTR | L808: 3RD QTR | P808: FINAL | S808: FOOTSCRAY
A809: FOOTSCRAY | C809: 3 | D809: 2 | E809: =C809*6+D809 -> 20 | G809: 6 | H809: 7 | I809: =G809*6+H809 -> 43 | K809: 7 | L809: 8 | M809: =K809*6+L809 -> 50 | O809: 9 | P809: 10 | Q809: =O809*6+P809 -> 64 | S809: UMPIRE | W809: TEAM | X809: W | Y809: L | Z809: D | AA809: FOR | AB809: AGST | AC809: % | AD809: PTS
A810: WILLIAMSTOWN | C810: 4 | D810: 4 | E810: =C810*6+D810 -> 28 | G810: 4 | H810: 7 | I810: =G810*6+H810 -> 31 | K810: 5 | L810: 9 | M810: =K810*6+L810 -> 39 | O810: 5 | P810: 9 | Q810: =O810*6+P810 -> 39 | S810: CLARKE
A811: BEST PLAYERS | W811: FOOTSCRAY | X811: 16 | Y811: 2 | Z811: 0 | AA811: 1539 | AB811: 809 | AC811: 190.23 | AD811: 64
A812: FOOTSCRAY | D812: McCARTHY | G812: SMITH | J812: HANSEN | L812: SIMPSON | N812: DOOLAN | Q812: FORD | W812: PORT MELBOURNE | X812: 14 | Y812: 4 | Z812: 0 | AA812: 1422 | AB812: 1035 | AC812: 137.39130434782609 | AD812: 56
A813: WILLIAMSTOWN | D813: WHITBURN | G813: N McDONALD | J813: GEDDES | L813: MILES | N813: HOLTEN | Q813: MITCHELL | W813: NORTH MELBOURNE | X813: 12 | Y813: 6 | Z813: 0 | AA813: 1179 | AB813: 996 | AC813: 118.37349397590361 | AD813: 48
A814: GOALKICKERS | W814: WILLIAMSTOWN | X814: 10 | Y814: 7 | Z814: 1 | AA814: 1241 | AB814: 1016 | AC814: 122.14566929133858 | AD814: 42
A815: FOOTSCRAY | D815: HANSEN 3 | G815: SAMSON 3 | J815: SMITH | L815: McCARTHY | O815: GRIERSON
A816: WILLIAMSTOWN | D816: N McDONALD 2 | H816: CALDWELL | K816: FROST | M816: CARPENTER | W816: BRUNSWICK | X816: 10 | Y816: 7 | Z816: 1 | AA816: 1368 | AB816: 1168 | AC816: 117.12328767123287 | AD816: 42
W817: HAWTHORN | X817: 10 | Y817: 7 | Z817: 1 | AA817: 1301 | AB817: 1125 | AC817: 115.64444444444445 | AD817: 42
A818: PORT MELBOURNE | C818: 0 | D818: 3 | E818: =C818*6+D818 -> 3 | G818: 2 | H818: 10 | I818: =G818*6+H818 -> 22 | K818: 4 | L818: 11 | M818: =K818*6+L818 -> 35 | O818: 9 | P818: 14 | Q818: =O818*6+P818 -> 68 | S818: PORT MELB | W818: NORTHCOTE | X818: 7 | Y818: 10 | Z818: 1 | AA818: 1286 | AB818: 1339 | AC818: 96.041822255414488 | AD818: 30
A819: BRUNSWICK | C819: 3 | D819: 0 | E819: =C819*6+D819 -> 18 | G819: 3 | H819: 0 | I819: =G819*6+H819 -> 18 | K819: 4 | L819: 1 | M819: =K819*6+L819 -> 25 | O819: 5 | P819: 2 | Q819: =O819*6+P819 -> 32 | S819: CAIN | W819: BRIGHTON | X819: 6 | Y819: 12 | Z819: 0 | AA819: 1100 | AB819: 1273 | AC819: 86.410054988216814 | AD819: 24
A820: BEST PLAYERS | W820: GEELONG ASSOC. | X820: 2 | Y820: 16 | Z820: 0 | AA820: 927 | AB820: 1615 | AC820: 57.399380804953559 | AD820: 8
A821: PORT MELBOURNE | D821: OGILVIE | G821: BARFOOT | J821: BISSETT | L821: JOHNSON | O821: W RUDD | R821: J RUDD | W821: PRAHRAN | X821: 1 | Y821: 17 | Z821: 0 | AA821: 832 | AB821: 1819 | AC821: 45.74 | AD821: 4
A822: BRUNSWICK | D822: RALEIGH | G822: SULLIVAN | J822: MOORE | L822: FISHER | O822: ROBERTS | R822: HAYES
A823: GOALKICKERS
A824: PORT MELBOURNE | D824: TAYLOR 4 | G824: GARBUTT 3 | J824: McQUEEN | L824: WALTON
A825: BRUNSWICK | D825: MILLEN | G825: McINERNEY | J825: ALESSIO | L825: SULLIVAN | O825: FISHER
A827: NORTH MELBOURNE | C827: 2 | D827: 3 | E827: =C827*6+D827 -> 15 | G827: 5 | H827: 4 | I827: =G827*6+H827 -> 34 | K827: 8 | L827: 7 | M827: =K827*6+L827 -> 55 | O827: 9 | P827: 9 | Q827: =O827*6+P827 -> 63 | S827: GLENFERRIE
A828: HAWTHORN | C828: 1 | D828: 1 | E828: =C828*6+D828 -> 7 | G828: 4 | H828: 4 | I828: =G828*6+H828 -> 28 | K828: 6 | L828: 4 | M828: =K828*6+L828 -> 40 | O828: 7 | P828: 7 | Q828: =O828*6+P828 -> 49 | S828: KAIN
A829: BEST PLAYERS
A830: NORTH MELBOURNE | D830: LAMBE | G830: WOODINGTON | J830: SHORTEN | M830: JOHNSON | P830: RAWLE | R830: GILES
A831: HAWTHORN | D831: RADEMACHER | G831: FINCH | J831: GRIFFITHS | M831: MURPHY | P831: YEOMANS | R831: BURKE
A832: GOALKICKERS
A833: NORTH MELBOURNE | D833: GARDINER 2 | G833: FIELDING | I833: LINTON | K833: DOOLAN | M833: STROWNIX | P833: JOHNSON | R833: RUSS | T833: KING
A834: HAWTHORN | D834: YEOMANS 3 | G834: PEARSON 2 | J834: GAMBETTA 2
A836: GEELONG ASSOC. | C836: 2 | D836: 3 | E836: =C836*6+D836 -> 15 | G836: 3 | H836: 7 | I836: =G836*6+H836 -> 25 | K836: 3 | L836: 8 | M836: =K836*6+L836 -> 26 | O836: 6 | P836: 13 | Q836: =O836*6+P836 -> 49 | S836: KARDINIA PARK
A837: NORTHCOTE | C837: 2 | D837: 4 | E837: =C837*6+D837 -> 16 | G837: 2 | H837: 7 | I837: =G837*6+H837 -> 19 | K837: 6 | L837: 10 | M837: =K837*6+L837 -> 46 | O837: 6 | P837: 10 | Q837: =O837*6+P837 -> 46 | S837: McKINNON
A838: BEST PLAYERS
A839: GEELONG ASSOC. | D839: HEALEY | G839: ELSTON | J839: McFARLAND | M839: BUCHANAN | P839: MARTINI | S839: WARREN
A840: NORTHCOTE | D840: JOHNSON | G840: ROSS | J840: GOUGH | M840: OGDEN | P840: LUGG | S840: GRAY
A841: GOALKICKERS
A842: GEELONG ASSOC. | D842: MARTINI 2 | G842: MANSON 2 | J842: BUCHANAN | M842: ELSTON
A843: NORTHCOTE | D843: JOHNSON 3 | G843: OGDEN | J843: DILLON | M843: GRAY
A845: BRIGHTON | C845: 3 | D845: 3 | E845: =C845*6+D845 -> 21 | G845: 8 | H845: 11 | I845: =G845*6+H845 -> 59 | K845: 8 | L845: 13 | M845: =K845*6+L845 -> 61 | O845: 11 | P845: 17 | Q845: =O845*6+P845 -> 83 | S845: BRIGHTON BEACH
A846: PRAHRAN | C846: 3 | D846: 2 | E846: =C846*6+D846 -> 20 | G846: 3 | H846: 4 | I846: =G846*6+H846 -> 22 | K846: 4 | L846: 10 | M846: =K846*6+L846 -> 34 | O846: 5 | P846: 11 | Q846: =O846*6+P846 -> 41 | S846: LEWIS
A847: BEST PLAYERS
A848: BRIGHTON | D848: COBB | G848: IRWIN | J848: MONGAN | M848: MILLS | O848: CARROLL | R848: LYNCH
A849: PRAHRAN | D849: T BAYLISS | G849: BOLAND | J849: STEWART | M849: MORONEY | O849: McCUBBIN | R849: HOLBROOK
A850: GOALKICKERS
A851: BRIGHTON | D851: BOYD 4 | G851: COBB 4 | J851: LYNCH | L851: IRWIN | N851: WELSH
A852: PRAHRAN | D852: T BAYLISS 2 | H852: BOLAND 2 | K852: CHAPMAN
A854: FINALS
A855: 1ST SEMI | E855: 2ND SEPTEMBER | J855: WEATHER | M855: FINE S.W. BREEZE
D856: 1ST QTR | H856: 2ND QTR | L856: 3RD QTR | P856: FINAL
A857: PORT MELBOURNE | C857: 2 | D857: 6 | E857: =C857*6+D857 -> 18 | G857: 4 | H857: 8 | I857: =G857*6+H857 -> 32 | K857: 10 | L857: 12 | M857: =K857*6+L857 -> 72 | O857: 13 | P857: 14 | Q857: =O857*6+P857 -> 92 | S857: NORTH MELB
A858: WILLIAMSTOWN | C858: 2 | D858: 0 | E858: =C858*6+D858 -> 12 | G858: 2 | H858: 2 | I858: =G858*6+H858 -> 14 | K858: 4 | L858: 2 | M858: =K858*6+L858 -> 26 | O858: 8 | P858: 3 | Q858: =O858*6+P858 -> 51 | S858: CAIN
A859: BEST PLAYERS
A860: PORT MELBOURNE | D860: SKILTON | G860: BARFOOT | J860: J RUDD | M860: BISSETT | P860: W RUDD | S860: O'BRIEN
A861: WILLIAMSTOWN | D861: DUSSELL | G861: CONDON | J861: GEISLER | M861: MITCHELL | P861: WHITBURN | S861: MILES
A862: GOALKICKERS
A863: PORT MELBOURNE | D863: TAYLOR 4 | G863: O'BRIEN 2 | I863: GARBUTT | K863: McQUEEN | M863: SKILTON | O863: OGILVIE | Q863: DOBRIGH | S863: BARFOOT | V863: STANBRIDGE
A864: WILLIAMSTOWN | D864: CARPENTER 3 | G864: N McDONALD 2 | J864: McAULIFFE 2 | M864: MITCHELL
A866: 2ND SEMI | E866: 9TH SEPTEMBER | J866: WEATHER | M866: COOL CLOUDY S.E. BREEZE
A867: NORTH MELBOURNE | C867: 2 | D867: 1 | E867: =C867*6+D867 -> 13 | G867: 4 | H867: 6 | I867: =G867*6+H867 -> 30 | K867: 6 | L867: 6 | M867: =K867*6+L867 -> 42 | O867: 10 | P867: 8 | Q867: =O867*6+P867 -> 68 | S867: NORTH MELB
A868: FOOTSCRAY | C868: 4 | D868: 3 | E868: =C868*6+D868 -> 27 | G868: 4 | H868: 5 | I868: =G868*6+H868 -> 29 | K868: 5 | L868: 10 | M868: =K868*6+L868 -> 40 | O868: 6 | P868: 12 | Q868: =O868*6+P868 -> 48 | S868: McKINNON
A869: BEST PLAYERS
A870: NORTH MELBOURNE | D870: KING | G870: FIELDING | J870: JOHNSON | M870: ROSS | O870: SHORTEN | R870: RAWLE
A871: FOOTSCRAY | D871: MCCARTHY | G871: EASON | J871: FORD | M871: DOOLAN | O871: O'DONOGHUE | R871: SAMSON
A872: GOALKICKERS
A873: NORTH MELBOURNE | D873: KING 3 | G873: JOHNSON 2 | J873: LINDSAY 2 | M873: GARDINER | O873: ROHSBURN | R873: FIELDING
A874: FOOTSCRAY | D874: O'BRIEN 3 | G874: MARTIN | J874: O'DONOGHUE | M874: SAMSON
A876: FINAL | E876: 16TH SEPTEMBER | J876: WEATHER | M876: EARLY RAIN NORTH WIND
A877: PORT MELBOURNE | C877: 4 | D877: 6 | E877: =C877*6+D877 -> 30 | G877: 5 | H877: 7 | I877: =G877*6+H877 -> 37 | K877: 8 | L877: 10 | M877: =K877*6+L877 -> 58 | O877: 9 | P877: 12 | Q877: =O877*6+P877 -> 66 | S877: NORTH MELB
A878: NORTH MELBOURNE | C878: 0 | D878: 0 | E878: =C878*6+D878 -> 0 | G878: 2 | H878: 4 | I878: =G878*6+H878 -> 16 | K878: 2 | L878: 7 | M878: =K878*6+L878 -> 19 | O878: 5 | P878: 8 | Q878: =O878*6+P878 -> 38 | S878: McKINNON
A879: BEST PLAYERS
A880: PORT MELBOURNE | D880: BRISCOE | G880: JOHNSON | J880: J RUDD | M880: DOBRIGH | P880: WALTON | S880: STANFORD
A881: NORTH MELBOURNE | D881: JOHNSON | G881: KING | J881: WALSH | M881: KEW MING | P881: SHORTEN | S881: LINTON
A882: GOALKICKERS
A883: PORT MELBOURNE | D883: TAYLOR 5 | G883: REES 3 | J883: WALTON
A884: NORTH MELBOURNE | D884: GARDINER 2 | G884: WALSH | J884: LINDSAY | M884: KING
A886: GRAND FINAL | E886: 23RD SEPTEMBER | J886: WEATHER | M886: FINE SOUTH WIND
A887: PORT MELBOURNE | C887: 6 | D887: 2 | E887: 38 | G887: 7 | H887: 2 | I887: 44 | K887: 9 | L887: 6 | M887: 60 | O887: 9 | P887: 6 | Q887: =O887*6+P887 -> 60 | S887: NORTH MELB
A888: FOOTSCRAY | C888: 0 | D888: 2 | E888: 2 | G888: 4 | H888: 7 | I888: 31 | K888: 5 | L888: 7 | M888: 37 | O888: 8 | P888: 10 | Q888: =O888*6+P888 -> 58 | S888: McKINNON
A889: BEST PLAYERS
A890: PORT MELBOURNE | D890: J RUDD | G890: W RUDD | J890: WALTON | M890: OGILVIE | P890: DOBRIGH | S890: REES
A891: FOOTSCRAY | D891: SAMSON | G891: McCARTHY | J891: EASON | M891: SAMPSON | P891: McINTYRE | S891: OUTEN
A892: GOALKICKERS
A893: PORT MELBOURNE | D893: TAYLOR 3 | G893: REES | I893: BARFOOT | L893: O'BRIEN | N893: STANBRIDGE | Q893: DOBRIGH | T893: WALTON
A894: FOOTSCRAY | D894: O'BRIEN 4 | G894: SAMPSON | J894: SAMSON | L894: OUTEN | N894: HOLDEN
A896: OTHER GAME
A897: WILLIAMSTOWN | O897: 11 | P897: 10 | Q897: 76
A898: MARYBOROUGH RAILWAYS | O898: 5 | P898: 6 | Q898: 36