A1: Victorian Football Association
A2: Season 1923
A3: © Copyright Wal Williams | F3: First created: 2 August 2014
A4: Contact: joywalwi at gmail dot com | F4: Last updated: 30 July 2017 | W4: VFA Results and tables - Link to the main index page
A5: You are free to copy this document in whole or part provided that proper acknowledgement is given to the author. All rights reserved.
A7: YEAR 1923
A8: ROUND 1 | E8: 5TH MAY | H8: WEATHER | K8: CLOUDY BUT FINE STRONG NORTH WIND | S8: PLAYED AT | X8: LADDER | AB8: ROUND | AD8: 1
D9: 1ST QTR | H9: 2ND QTR | L9: 3RD QTR | P9: FINAL | S9: NORTH MELB
A10: PORT MELBOURNE | C10: 3 | D10: 0 | E10: =C10*6+D10 -> 18 | G10: 3 | H10: 3 | I10: =G10*6+H10 -> 21 | K10: 4 | L10: 5 | M10: =K10*6+L10 -> 29 | O10: 6 | P10: 7 | Q10: =O10*6+P10 -> 43 | S10: UMPIRE | W10: TEAM | X10: W | Y10: L | Z10: D | AA10: FOR | AB10: AGST | AC10: % | AD10: PTS
A11: NORTH MELBOURNE | C11: 2 | D11: 2 | E11: =C11*6+D11 -> 14 | G11: 3 | H11: 5 | I11: =G11*6+H11 -> 23 | K11: 4 | L11: 9 | M11: =K11*6+L11 -> 33 | O11: 5 | P11: 12 | Q11: =O11*6+P11 -> 42 | S11: THOMPSON
A12: BEST PLAYERS | W12: FOOTSCRAY | X12: 1 | Y12: 0 | Z12: 0 | AA12: 104 | AB12: 38 | AC12: 273.68421052631578 | AD12: 4
A13: PORT MELBOURNE | D13: W RUDD | G13: SKILTON | I13: CROMPTON | L13: BARFOOT | N13: JOHNSTON | Q13: CRUDDEN | W13: WILLIAMSTOWN | X13: 1 | Y13: 0 | Z13: 0 | AA13: 77 | AB13: 40 | AC13: 192.5 | AD13: 4
A14: NORTH MELBOURNE | D14: TREMBATH | G14: JOHNSON | I14: LAMBE | L14: GILES | N14: SHORTEN | Q14: GARDINER | W14: BRUNSWICK | X14: 1 | Y14: 0 | Z14: 0 | AA14: 65 | AB14: 40 | AC14: 162.5 | AD14: 4
A15: GOALKICKERS | W15: HAWTHORN | X15: 1 | Y15: 0 | Z15: 0 | AA15: 92 | AB15: 59 | AC15: 155.93220338983051 | AD15: 4
A16: PORT MELBOURNE | D16: REES 2 | G16: TAYLOR 2 | J16: CRUDDEN 2
A17: NORTH MELBOURNE | D17: GARDINER 3 | G17: JOHNSON | J17: FIELDING | W17: PORT MELBOURNE | X17: 1 | Y17: 0 | Z17: 0 | AA17: 43 | AB17: 42 | AC17: 102.38095238095238 | AD17: 4
W18: NORTH MELBOURNE | X18: 0 | Y18: 1 | Z18: 0 | AA18: 42 | AB18: 43 | AC18: 97.674418604651166 | AD18: 0
A19: FOOTSCRAY | C19: 6 | D19: 5 | E19: =C19*6+D19 -> 41 | G19: 6 | H19: 7 | I19: =G19*6+H19 -> 43 | K19: 9 | L19: 13 | M19: =K19*6+L19 -> 67 | O19: 15 | P19: 14 | Q19: =O19*6+P19 -> 104 | S19: FOOTSCRAY | W19: GEELONG ASSOC. | X19: 0 | Y19: 1 | Z19: 0 | AA19: 59 | AB19: 92 | AC19: 64.130434782608702 | AD19: 0
A20: NORTHCOTE | C20: 0 | D20: 1 | E20: =C20*6+D20 -> 1 | G20: 4 | H20: 4 | I20: =G20*6+H20 -> 28 | K20: 4 | L20: 4 | M20: =K20*6+L20 -> 28 | O20: 5 | P20: 8 | Q20: =O20*6+P20 -> 38 | S20: CLARKE | W20: BRIGHTON | X20: 0 | Y20: 1 | Z20: 0 | AA20: 40 | AB20: 65 | AC20: 61.53846153846154 | AD20: 0
A21: BEST PLAYERS | W21: PRAHRAN | X21: 0 | Y21: 1 | Z21: 0 | AA21: 40 | AB21: 77 | AC21: 51.948051948051948 | AD21: 0
A22: FOOTSCRAY | D22: McCARTHY | G22: EASON | I22: HOWELL | L22: C GRIERSON | O22: G WOODMAN | R22: SAMSON | W22: NORTHCOTE | X22: 0 | Y22: 1 | Z22: 0 | AA22: 38 | AB22: 104 | AC22: 36.53846153846154 | AD22: 0
A23: NORTHCOTE | D23: SHEEHY | G23: GOUGH | I23: JOHNSON | L23: STEPHENSON | O23: ROSS | R23: DILLON
A24: GOALKICKERS
A25: FOOTSCRAY | D25: SCANLON 4 | G25: G WOODMAN 3 | J25: HANSEN 2 | M25: EASON 2 | O25: O'BRIEN 2 | Q25: McCARTHY | T25: SAMSON
A26: NORTHCOTE | D26: GOUGH 2 | G26: DOWNES | J26: JOHNSON | M26: DIMMICK
A28: HAWTHORN | C28: 4 | D28: 7 | E28: =C28*6+D28 -> 31 | G28: 4 | H28: 11 | I28: =G28*6+H28 -> 35 | K28: 9 | L28: 16 | M28: =K28*6+L28 -> 70 | O28: 12 | P28: 20 | Q28: =O28*6+P28 -> 92 | S28: KARDINIA PARK
A29: GEELONG ASSOC. | C29: 2 | D29: 0 | E29: =C29*6+D29 -> 12 | G29: 6 | H29: 5 | I29: =G29*6+H29 -> 41 | K29: 6 | L29: 5 | M29: =K29*6+L29 -> 41 | O29: 8 | P29: 11 | Q29: =O29*6+P29 -> 59 | S29: McKINNON
A30: BEST PLAYERS
A31: HAWTHORN | D31: WALTON | G31: FINCH | J31: MURPHY | M31: GILL | O31: LEEHANE | R31: McCASHNEY
A32: GEELONG ASSOC. | D32: ELSTON | G32: STEPHENS | J32: WARREN | M32: FOWLER | O32: MANSON | R32: CESARI
A33: GOALKICKERS
A34: HAWTHORN | D34: LATHAM 5 | G34: PEARSON 3 | J34: WALTON 2 | M34: MURPHY | O34: YEOMANS
A35: GEELONG ASSOC. | D35: MARTINI 2 | G35: CESARI 2 | J35: WEARMOUTH | M35: WARREN | O35: LARKINS | Q35: STEPHENS
A37: BRUNSWICK | C37: 1 | D37: 2 | E37: =C37*6+D37 -> 8 | G37: 5 | H37: 4 | I37: =G37*6+H37 -> 34 | K37: 5 | L37: 8 | M37: =K37*6+L37 -> 38 | O37: 9 | P37: 11 | Q37: =O37*6+P37 -> 65 | S37: BRUNSWICK
A38: BRIGHTON | C38: 1 | D38: 2 | E38: =C38*6+D38 -> 8 | G38: 3 | H38: 4 | I38: =G38*6+H38 -> 22 | K38: 4 | L38: 9 | M38: =K38*6+L38 -> 33 | O38: 5 | P38: 10 | Q38: =O38*6+P38 -> 40 | S38: CAIN
A39: BEST PLAYERS
A40: BRUNSWICK | D40: STAHL | G40: FISHER | J40: MOORE | M40: J HOLFORD | P40: L HOLFORD | S40: ALESSIO
A41: BRIGHTON | D41: HATTAM | G41: CARROLL | J41: REARDON | M41: EWANS | P41: HARBOARD | S41: BORLAND
A42: GOALKICKERS
A43: BRUNSWICK | D43: FISHER 3 | G43: MOORE 2 | J43: L HOLFORD 2 | N43: J HOLFORD | Q43: O'CONNOR
A44: BRIGHTON | D44: EWANS 2 | G44: MAU 2 | J44: BORLAND
A46: WILLIAMSTOWN | C46: 0 | D46: 2 | E46: =C46*6+D46 -> 2 | G46: 5 | H46: 6 | I46: =G46*6+H46 -> 36 | K46: 7 | L46: 7 | M46: =K46*6+L46 -> 49 | O46: 11 | P46: 11 | Q46: =O46*6+P46 -> 77 | S46: WILLIAMSTOWN
A47: PRAHRAN | C47: 2 | D47: 1 | E47: =C47*6+D47 -> 13 | G47: 3 | H47: 1 | I47: =G47*6+H47 -> 19 | K47: 6 | L47: 2 | M47: =K47*6+L47 -> 38 | O47: 6 | P47: 4 | Q47: =O47*6+P47 -> 40 | S47: BLACKBURN
A48: BEST PLAYERS
A49: WILLIAMSTOWN | D49: N McDONALD | G49: GEDDES | J49: O'HALLORAN | M49: MARTIN | P49: KING | R49: L SMITH
A50: PRAHRAN | D50: KERLEY | G50: FERGEUS | J50: BAYLISS | M50: V JONES | P50: N MILLER | R50: O MILLER
A51: GOALKICKERS
A52: WILLIAMSTOWN | D52: N McDONALD 4 | H52: GEISLER 2 | K52: WHITBURN 2 | N52: CARPENTER 2 | R52: MARTIN
A53: PRAHRAN | D53: O'MEARA 2 | G53: BAYLISS 2 | J53: FERGEUS | L53: THOMAS
A55: ROUND 2 | E55: 12TH MAY | J55: WEATHER | M55: CLOUDY FRESH WEST WIND | S55: PLAYED AT | X55: LADDER | AB55: ROUND | AD55: 2
D56: 1ST QTR | H56: 2ND QTR | L56: 3RD QTR | P56: FINAL | S56: GLENFERRIE
A57: FOOTSCRAY | C57: 2 | D57: 3 | E57: =C57*6+D57 -> 15 | G57: 6 | H57: 9 | I57: =G57*6+H57 -> 45 | K57: 8 | L57: 12 | M57: =K57*6+L57 -> 60 | O57: 12 | P57: 16 | Q57: =O57*6+P57 -> 88 | S57: UMPIRE | W57: TEAM | X57: W | Y57: L | Z57: D | AA57: FOR | AB57: AGST | AC57: % | AD57: PTS
A58: HAWTHORN | C58: 4 | D58: 3 | E58: =C58*6+D58 -> 27 | G58: 5 | H58: 5 | I58: =G58*6+H58 -> 35 | K58: 8 | L58: 6 | M58: =K58*6+L58 -> 54 | O58: 11 | P58: 10 | Q58: =O58*6+P58 -> 76 | S58: VALLENCE
A59: BEST PLAYERS | W59: FOOTSCRAY | X59: 2 | Y59: 0 | Z59: 0 | AA59: 192 | AB59: 114 | AC59: 168.42105263157896 | AD59: 8
A60: FOOTSCRAY | D60: EASON | G60: GIBB | J60: McCARTHY | M60: NEILSON | O60: SCANLON | Q60: C GRIERSON | W60: PORT MELBOURNE | X60: 2 | Y60: 0 | Z60: 0 | AA60: 108 | AB60: 75 | AC60: 144 | AD60: 8
A61: HAWTHORN | D61: McCASHNEY | G61: YEOMANS | J61: NOTT | M61: BRUCE | O61: BROWN | Q61: LETHLEAN | W61: BRIGHTON | X61: 1 | Y61: 1 | Z61: 0 | AA61: 145 | AB61: 99 | AC61: 146.46464646464648 | AD61: 4
A62: GOALKICKERS | W62: BRUNSWICK | X62: 1 | Y62: 1 | Z62: 0 | AA62: 119 | AB62: 97 | AC62: 122.68041237113403 | AD62: 4
A63: FOOTSCRAY | D63: SCANLON 4 | G63: O'BRIEN 4 | J63: GRIERSON 2 | M63: HANSEN | O63: GIBB
A64: HAWTHORN | D64: PEARSON 3 | G64: BROWN 2 | I64: BRUCE 2 | K64: YEOMANS 2 | N64: LETHLEAN | Q64: WALTON | W64: NORTH MELBOURNE | X64: 1 | Y64: 1 | Z64: 0 | AA64: 128 | AB64: 107 | AC64: 119.62616822429906 | AD64: 4
W65: HAWTHORN | X65: 1 | Y65: 1 | Z65: 0 | AA65: 168 | AB65: 147 | AC65: 114.28571428571429 | AD65: 4
A66: PORT MELBOURNE | C66: 3 | D66: 0 | E66: =C66*6+D66 -> 18 | G66: 3 | H66: 3 | I66: =G66*6+H66 -> 21 | K66: 8 | L66: 8 | M66: =K66*6+L66 -> 56 | O66: 9 | P66: 11 | Q66: =O66*6+P66 -> 65 | S66: PORT MELB | W66: WILLIAMSTOWN | X66: 1 | Y66: 1 | Z66: 0 | AA66: 110 | AB66: 105 | AC66: 104.76190476190476 | AD66: 4
A67: WILLIAMSTOWN | C67: 0 | D67: 1 | E67: =C67*6+D67 -> 1 | G67: 2 | H67: 4 | I67: =G67*6+H67 -> 16 | K67: 2 | L67: 4 | M67: =K67*6+L67 -> 16 | O67: 4 | P67: 9 | Q67: =O67*6+P67 -> 33 | S67: JENKINS | W67: PRAHRAN | X67: 1 | Y67: 1 | Z67: 0 | AA67: 97 | AB67: 131 | AC67: 74.045801526717554 | AD67: 4
A68: BEST PLAYERS | W68: NORTHCOTE | X68: 0 | Y68: 2 | Z68: 0 | AA68: 102 | AB68: 190 | AC68: 53.684210526315788 | AD68: 0
A69: PORT MELBOURNE | D69: BARFOOT | G69: TAYLOR | I69: CROMPTON | L69: JOHNSTON | O69: MURPHY | Q69: W RUDD | W69: GEELONG ASSOC. | X69: 0 | Y69: 2 | Z69: 0 | AA69: 93 | AB69: 197 | AC69: 47.208121827411169 | AD69: 0
A70: WILLIAMSTOWN | D70: MARTIN | G70: KING | I70: CONDON | L70: LAXTON | O70: GEISLER | Q70: STONE
A71: GOALKICKERS
A72: PORT MELBOURNE | D72: TAYLOR 5 | G72: BARFOOT 2 | J72: PASH | L72: SKILTON
A73: WILLIAMSTOWN | D73: CARPENTER | G73: TRUMAN | J73: GEISLER | L73: O'HALLORAN
A75: BRIGHTON | C75: 4 | D75: 1 | E75: =C75*6+D75 -> 25 | G75: 8 | H75: 7 | I75: =G75*6+H75 -> 55 | K75: 10 | L75: 9 | M75: =K75*6+L75 -> 69 | O75: 15 | P75: 15 | Q75: =O75*6+P75 -> 105 | S75: BRIGHTON BEACH
A76: GEELONG ASSOC. | C76: 3 | D76: 6 | E76: =C76*6+D76 -> 24 | G76: 3 | H76: 7 | I76: =G76*6+H76 -> 25 | K76: 3 | L76: 10 | M76: =K76*6+L76 -> 28 | O76: 4 | P76: 10 | Q76: =O76*6+P76 -> 34 | S76: PANNAM
A77: BEST PLAYERS
A78: BRIGHTON | D78: HATTAM | G78: BORLAND | J78: REARDON | M78: MILLS | P78: MAU | S78: COBB
A79: GEELONG ASSOC. | D79: WARREN | G79: HEALEY | J79: MANSON | M79: EVANS | P79: STEPHENS | S79: ELSTON
A80: GOALKICKERS
A81: BRIGHTON | D81: SULLIVAN 5 | G81: REARDON 4 | J81: N MAU 2 | M81: COBB | N81: TONKIN | P81: BOYD | R81: WILSON
A82: GEELONG ASSOC. | D82: WARREN 2 | G82: EVANS | J82: BROWN
A84: NORTH MELBOURNE | C84: 5 | D84: 5 | E84: =C84*6+D84 -> 35 | G84: 5 | H84: 7 | I84: =G84*6+H84 -> 37 | K84: 9 | L84: 14 | M84: =K84*6+L84 -> 68 | O84: 12 | P84: 14 | Q84: =O84*6+P84 -> 86 | S84: NORTHCOTE
A85: NORTHCOTE | C85: 2 | D85: 2 | E85: =C85*6+D85 -> 14 | G85: 7 | H85: 8 | I85: =G85*6+H85 -> 50 | K85: 7 | L85: 11 | M85: =K85*6+L85 -> 53 | O85: 8 | P85: 16 | Q85: =O85*6+P85 -> 64 | S85: BOLAN
A86: BEST PLAYERS
A87: NORTH MELBOURNE | D87: METCALFE | G87: LEWIS | J87: WALSH | M87: STROWNIX | P87: TREVASKIS | S87: C HALL
A88: NORTHCOTE | D88: JOHNSON | G88: YATES | J88: DIMMICK | M88: HELLWIG | P88: SHERRY | S88: GOUGH
A89: GOALKICKERS
A90: NORTH MELBOURNE | D90: LEWIS 3 | G90: HALL 2 | I90: METCALFE 2 | L90: KING 2 | N90: GARDINER | Q90: FIELDING | S90: JOHNSON
A91: NORTHCOTE | D91: ROSS 3 | G91: DAVIS 2 | J91: H PARGETTER | M91: GOUGH | O91: JOHNSON
A93: PRAHRAN | C93: 2 | D93: 3 | E93: =C93*6+D93 -> 15 | G93: 6 | H93: 6 | I93: =G93*6+H93 -> 42 | K93: 7 | L93: 7 | M93: =K93*6+L93 -> 49 | O93: 8 | P93: 9 | Q93: =O93*6+P93 -> 57 | S93: TOORAK PARK
A94: BRUNSWICK | C94: 2 | D94: 7 | E94: =C94*6+D94 -> 19 | G94: 3 | H94: 9 | I94: =G94*6+H94 -> 27 | K94: 5 | L94: 11 | M94: =K94*6+L94 -> 41 | O94: 6 | P94: 18 | Q94: =O94*6+P94 -> 54 | S94: HARRISON
A95: BEST PLAYERS
A96: PRAHRAN | D96: KERLEY | G96: BAYLISS | J96: FERGEUS | M96: GUY | O96: HARRISON | R96: DINGWALL
A97: BRUNSWICK | D97: HERBERT | G97: CAHILL | J97: J HOLFORD | M97: CLEMENTS | O97: O'CONNOR | R97: MOORE
A98: GOALKICKERS
A99: PRAHRAN | D99: BAYLISS 3 | G99: FERGEUS | J99: GUY | L99: KERLEY | N99: R NAYLOR | Q99: HARRISON
A100: BRUNSWICK | D100: HERBERT 2 | G100: O'CONNOR | J100: J HOLFORD | M100: CAHILL | O100: FLEMING
A102: ROUND 3 | E102: 19TH MAY | J102: WEATHER | M102: FINE MILD STRONG N.W. WIND | S102: PLAYED AT | X102: LADDER | AB102: ROUND | AD102: 3
D103: 1ST QTR | H103: 2ND QTR | L103: 3RD QTR | P103: FINAL | S103: PORT MELB
A104: PORT MELBOURNE | C104: 5 | D104: 3 | E104: =C104*6+D104 -> 33 | G104: 6 | H104: 5 | I104: =G104*6+H104 -> 41 | K104: 8 | L104: 12 | M104: =K104*6+L104 -> 60 | O104: 9 | P104: 15 | Q104: =O104*6+P104 -> 69 | S104: UMPIRE | W104: TEAM | X104: W | Y104: L | Z104: D | AA104: FOR | AB104: AGST | AC104: % | AD104: PTS
A105: HAWTHORN | C105: 0 | D105: 0 | E105: =C105*6+D105 -> 0 | G105: 5 | H105: 2 | I105: =G105*6+H105 -> 32 | K105: 5 | L105: 3 | M105: =K105*6+L105 -> 33 | O105: 8 | P105: 11 | Q105: =O105*6+P105 -> 59 | S105: CLARKE
A106: BEST PLAYERS | W106: FOOTSCRAY | X106: 3 | Y106: 0 | Z106: 0 | AA106: 244 | AB106: 146 | AC106: 167.12328767123287 | AD106: 12
A107: PORT MELBOURNE | D107: STANBRIDGE | G107: CROMPTON | J107: JOHNSTON | M107: TASKER | O107: TAYLOR | Q107: W RUDD | W107: PORT MELBOURNE | X107: 3 | Y107: 0 | Z107: 0 | AA107: 177 | AB107: 134 | AC107: 132.08955223880596 | AD107: 12
A108: HAWTHORN | D108: WALTON | G108: NOTT | I108: McKENZIE | L108: McCASHNEY | O108: CARBARNS | Q108: BROWN | W108: BRUNSWICK | X108: 2 | Y108: 1 | Z108: 0 | AA108: 189 | AB108: 131 | AC108: 144.27480916030535 | AD108: 8
A109: GOALKICKERS | W109: BRIGHTON | X109: 2 | Y109: 1 | Z109: 0 | AA109: 222 | AB109: 172 | AC109: 129.06976744186048 | AD109: 8
A110: PORT MELBOURNE | D110: TAYLOR 4 | G110: OGILVIE 2 | J110: GARBUTT | M110: REES | O110: DOBRIGH
A111: HAWTHORN | D111: CARBARNS 2 | G111: McCASHNEY 2 | K111: LATHAM | M111: RAY | O111: WALTON | W111: NORTH MELBOURNE | X111: 1 | Y111: 1 | Z111: 1 | AA111: 195 | AB111: 174 | AC111: 112.06896551724138 | AD111: 6
W112: PRAHRAN | X112: 1 | Y112: 1 | Z112: 1 | AA112: 164 | AB112: 198 | AC112: 82.828282828282823 | AD112: 6
A113: NORTH MELBOURNE | C113: 0 | D113: 1 | E113: =C113*6+D113 -> 1 | G113: 3 | H113: 7 | I113: =G113*6+H113 -> 25 | K113: 3 | L113: 7 | M113: =K113*6+L113 -> 25 | O113: 9 | P113: 13 | Q113: =O113*6+P113 -> 67 | S113: NORTH MELB | W113: HAWTHORN | X113: 1 | Y113: 2 | Z113: 0 | AA113: 227 | AB113: 216 | AC113: 105.0925925925926 | AD113: 4
A114: PRAHRAN | C114: 5 | D114: 5 | E114: =C114*6+D114 -> 35 | G114: 6 | H114: 5 | I114: =G114*6+H114 -> 41 | K114: 8 | L114: 7 | M114: =K114*6+L114 -> 55 | O114: 10 | P114: 7 | Q114: =O114*6+P114 -> 67 | S114: McKINNON | W114: WILLIAMSTOWN | X114: 1 | Y114: 2 | Z114: 0 | AA114: 142 | AB114: 157 | AC114: 90.445859872611464 | AD114: 4
A115: BEST PLAYERS | W115: NORTHCOTE | X115: 0 | Y115: 3 | Z115: 0 | AA115: 175 | AB115: 267 | AC115: 65.543071161048687 | AD115: 0
A116: NORTH MELBOURNE | D116: WALSH | G116: LEWIS | J116: RUSS | M116: SHORTEN | O116: LIMTON | Q116: GILES | W116: GEELONG ASSOC. | X116: 0 | Y116: 3 | Z116: 0 | AA116: 127 | AB116: 267 | AC116: 47.565543071161052 | AD116: 0
A117: PRAHRAN | D117: KERLEY | G117: FERGEUS | J117: MORONEY | M117: ALLISTER | O117: BOUSSIE | Q117: O MILLER
A118: GOALKICKERS
A119: NORTH MELBOURNE | D119: METCALFE 3 | G119: HALL 2 | J119: RUSS 2 | L119: JOHNSON | N119: PORTER
A120: PRAHRAN | D120: KERLEY 4 | G120: SPRAGUE 3 | J120: BAYLISS | L120: MILLER | N120: FERGEUS
A122: FOOTSCRAY | C122: 1 | D122: 3 | E122: =C122*6+D122 -> 9 | G122: 1 | H122: 7 | I122: =G122*6+H122 -> 13 | K122: 6 | L122: 8 | M122: =K122*6+L122 -> 44 | O122: 7 | P122: 10 | Q122: =O122*6+P122 -> 52 | S122: WILLIAMSTOWN
A123: WILLIAMSTOWN | C123: 0 | D123: 4 | E123: =C123*6+D123 -> 4 | G123: 3 | H123: 6 | I123: =G123*6+H123 -> 24 | K123: 3 | L123: 7 | M123: =K123*6+L123 -> 25 | O123: 4 | P123: 8 | Q123: =O123*6+P123 -> 32 | S123: CAIN
A124: BEST PLAYERS
A125: FOOTSCRAY | D125: McINTYRE | G125: SAMSON | J125: McCARTHY | M125: FORD | O125: O'BRIEN | R125: NEILSON
A126: WILLIAMSTOWN | D126: L SMITH | G126: KING | J126: MILES | M126: GEDDES | O126: CONDON | R126: MITCHELL
A127: GOALKICKERS
A128: FOOTSCRAY | D128: McCARTHY 2 | G128: MULLINS 2 | J128: O'BRIEN 2 | M128: SCANLON
A129: WILLIAMSTOWN | D129: CARPENTER 2 | H129: MITCHELL | K129: LEE
A131: BRIGHTON | C131: 5 | D131: 0 | E131: =C131*6+D131 -> 30 | G131: 6 | H131: 10 | I131: =G131*6+H131 -> 46 | K131: 10 | L131: 14 | M131: =K131*6+L131 -> 74 | O131: 10 | P131: 17 | Q131: =O131*6+P131 -> 77 | S131: NORTHCOTE
A132: NORTHCOTE | C132: 1 | D132: 0 | E132: =C132*6+D132 -> 6 | G132: 7 | H132: 4 | I132: =G132*6+H132 -> 46 | K132: 8 | L132: 5 | M132: =K132*6+L132 -> 53 | O132: 11 | P132: 7 | Q132: =O132*6+P132 -> 73 | S132: COLLINS
A133: BEST PLAYERS
A134: BRIGHTON | D134: HARRIS | G134: IRWIN | J134: TONKIN | M134: BOYD | O134: LYNCH | R134: CARROLL
A135: NORTHCOTE | D135: JOHNSON | G135: YATES | J135: DOWNES | M135: GOUGH | O135: POWELL | R135: BUISST
A136: GOALKICKERS
A137: BRIGHTON | D137: IRWIN 3 | G137: TONKIN 2 | J137: MAU 2 | L137: REARDON | O137: WILSON | Q137: CARROLL
A138: NORTHCOTE | D138: YATES 2 | G138: GOUGH 2 | I138: DILLON 2 | K138: PARGETTER 2 | N138: DOWNES | P138: ROSS | R138: FORTY
A140: BRUNSWICK | C140: 4 | D140: 6 | E140: =C140*6+D140 -> 30 | G140: 5 | H140: 7 | I140: =G140*6+H140 -> 37 | K140: 8 | L140: 10 | M140: =K140*6+L140 -> 58 | O140: 9 | P140: 16 | Q140: =O140*6+P140 -> 70 | S140: BRUNSWICK
A141: GEELONG ASSOC. | C141: 0 | D141: 3 | E141: =C141*6+D141 -> 3 | G141: 3 | H141: 5 | I141: =G141*6+H141 -> 23 | K141: 3 | L141: 6 | M141: =K141*6+L141 -> 24 | O141: 4 | P141: 10 | Q141: =O141*6+P141 -> 34 | S141: HUGHES
A142: BEST PLAYERS
A143: BRUNSWICK | D143: L HOLFORD | G143: RALEIGH | J143: KEOGH | M143: FISHER | O143: STAHL | R143: HERBERT
A144: GEELONG ASSOC. | D144: CESARI | G144: ELSTON | J144: SULLIVAN | M144: WARREN | O144: CATIONS | R144: STEPHENS
A145: GOALKICKERS
A146: BRUNSWICK | D146: McINERNEY 2 | G146: MOORE 2 | J146: HERBERT 2 | M146: L HOLFORD | P146: FISHER | R146: WRIGHT
A147: GEELONG ASSOC. | D147: ELSTON 2 | G147: KERBY | J147: T RIGBY
A149: ROUND 4 | E149: 26TH MAY | J149: WEATHER | M149: FINE | S149: PLAYED AT | X149: LADDER | AB149: ROUND | AD149: 4
D150: 1ST QTR | H150: 2ND QTR | L150: 3RD QTR | P150: FINAL | S150: PORT MELB
A151: PORT MELBOURNE | C151: 5 | D151: 3 | E151: =C151*6+D151 -> 33 | G151: 11 | H151: 7 | I151: =G151*6+H151 -> 73 | K151: 12 | L151: 12 | M151: =K151*6+L151 -> 84 | O151: 15 | P151: 19 | Q151: =O151*6+P151 -> 109 | S151: UMPIRE | W151: TEAM | X151: W | Y151: L | Z151: D | AA151: FOR | AB151: AGST | AC151: % | AD151: PTS
A152: BRIGHTON | C152: 1 | D152: 0 | E152: =C152*6+D152 -> 6 | G152: 2 | H152: 2 | I152: =G152*6+H152 -> 14 | K152: 2 | L152: 6 | M152: =K152*6+L152 -> 18 | O152: 4 | P152: 8 | Q152: =O152*6+P152 -> 32 | S152: McKINNON
A153: BEST PLAYERS | W153: PORT MELBOURNE | X153: 4 | Y153: 0 | Z153: 0 | AA153: 286 | AB153: 166 | AC153: 172.28915662650601 | AD153: 16
A154: PORT MELBOURNE | D154: TAYLOR | G154: W RUDD | I154: BARFOOT | L154: STANBRIDGE | O154: J RUDD | Q154: SKILTON | W154: FOOTSCRAY | X154: 4 | Y154: 0 | Z154: 0 | AA154: 343 | AB154: 204 | AC154: 168.13725490196077 | AD154: 16
A155: BRIGHTON | D155: MATTHEWS | G155: CARROLL | I155: TONKIN | L155: HARBOARD | O155: SULLIVAN | Q155: HARRIS | W155: BRUNSWICK | X155: 3 | Y155: 1 | Z155: 0 | AA155: 264 | AB155: 202 | AC155: 130.69306930693068 | AD155: 12
A156: GOALKICKERS | W156: WILLIAMSTOWN | X156: 2 | Y156: 2 | Z156: 0 | AA156: 252 | AB156: 227 | AC156: 111.01321585903084 | AD156: 8
A157: PORT MELBOURNE | D157: TAYLOR 9 | G157: SKILTON 2 | J157: DOBRIGH 2 | M157: CROMPTON | P157: REES
A158: BRIGHTON | D158: SULLIVAN | G158: IRWIN | J158: HARBOARD | M158: MAU | W158: BRIGHTON | X158: 2 | Y158: 2 | Z158: 0 | AA158: 254 | AB158: 281 | AC158: 90.391459074733092 | AD158: 8
W159: NORTH MELBOURNE | X159: 1 | Y159: 2 | Z159: 1 | AA159: 253 | AB159: 273 | AC159: 92.673992673992672 | AD159: 6
A160: FOOTSCRAY | C160: 6 | D160: 1 | E160: =C160*6+D160 -> 37 | G160: 7 | H160: 2 | I160: =G160*6+H160 -> 44 | K160: 11 | L160: 4 | M160: =K160*6+L160 -> 70 | O160: 15 | P160: 9 | Q160: =O160*6+P160 -> 99 | S160: FOOTSCRAY | W160: PRAHRAN | X160: 1 | Y160: 2 | Z160: 1 | AA160: 210 | AB160: 305 | AC160: 68.852459016393439 | AD160: 6
A161: NORTH MELBOURNE | C161: 4 | D161: 2 | E161: =C161*6+D161 -> 26 | G161: 5 | H161: 6 | I161: =G161*6+H161 -> 36 | K161: 6 | L161: 6 | M161: =K161*6+L161 -> 42 | O161: 8 | P161: 10 | Q161: =O161*6+P161 -> 58 | S161: BOARD | W161: HAWTHORN | X161: 1 | Y161: 3 | Z161: 0 | AA161: 298 | AB161: 291 | AC161: 102.40549828178695 | AD161: 4
A162: BEST PLAYERS | W162: NORTHCOTE | X162: 1 | Y162: 3 | Z162: 0 | AA162: 282 | AB162: 313 | AC162: 90.095846645367416 | AD162: 4
A163: FOOTSCRAY | D163: McCARTHY | G163: O'BRIEN | I163: NEILSON | L163: MULLINS | O163: SMITH | Q163: SAMSON | W163: GEELONG ASSOC. | X163: 0 | Y163: 4 | Z163: 0 | AA163: 197 | AB163: 377 | AC163: 52.254641909814325 | AD163: 0
A164: NORTH MELBOURNE | D164: LINTON | G164: RUSS | I164: LEWIS | L164: WALSH | O164: SMITH | Q164: McINTOSH
A165: GOALKICKERS
A166: FOOTSCRAY | D166: O'BRIEN 4 | G166: SCANLON 3 | J166: MULLINS 3 | M166: McCARTHY 2 | P166: EASON | R166: WOODMAN | U166: SAMSON
A167: NORTH MELBOURNE | D167: MEEKING 2 | G167: McINTOSH 2 | J167: FIELDING | M167: GARDINER | O167: JOHNSON | R167: LEWIS
A169: BRUNSWICK | C169: 2 | D169: 3 | E169: =C169*6+D169 -> 15 | G169: 7 | H169: 5 | I169: =G169*6+H169 -> 47 | K169: 8 | L169: 6 | M169: =K169*6+L169 -> 54 | O169: 11 | P169: 9 | Q169: =O169*6+P169 -> 75 | S169: HAW
A170: HAWTHORN | C170: 1 | D170: 4 | E170: =C170*6+D170 -> 10 | G170: 3 | H170: 6 | I170: =G170*6+H170 -> 24 | K170: 6 | L170: 14 | M170: =K170*6+L170 -> 50 | O170: 9 | P170: 17 | Q170: =O170*6+P170 -> 71 | S170: CAIN
A171: BEST PLAYERS
A172: BRUNSWICK | D172: O'CONNOR | G172: STAHL | J172: McINERNEY | M172: L HOLFORD | P172: BROWN | R172: FISHER
A173: HAWTHORN | D173: FINCH | G173: YEOMANS | J173: WALTON | M173: CARBARNS | P173: LATHAM | R173: McCASHNEY
A174: GOALKICKERS
A175: BRUNSWICK | D175: McINERNEY 6 | G175: STAHL | I175: FISHER | K175: L HOLFORD | N175: HERBERT | P175: FITZGERALD
A176: HAWTHORN | D176: LATHAM 5 | G176: BRUCE | I176: YEOMANS | K176: GILL | M176: CARBARNS
A178: NORTHCOTE | C178: 2 | D178: 5 | E178: =C178*6+D178 -> 17 | G178: 5 | H178: 10 | I178: =G178*6+H178 -> 40 | K178: 11 | L178: 14 | M178: =K178*6+L178 -> 80 | O178: 15 | P178: 17 | Q178: =O178*6+P178 -> 107 | S178: NORTHCOTE
A179: PRAHRAN | C179: 1 | D179: 2 | E179: =C179*6+D179 -> 8 | G179: 2 | H179: 6 | I179: =G179*6+H179 -> 18 | K179: 4 | L179: 7 | M179: =K179*6+L179 -> 31 | O179: 6 | P179: 10 | Q179: =O179*6+P179 -> 46 | S179: CLARKE
A180: BEST PLAYERS
A181: NORTHCOTE | D181: JOHNSON | G181: YATES | J181: SHEEHY | M181: PURCELL | P181: DILLON | R181: GOUGH
A182: PRAHRAN | D182: FERGEUS | G182: O'MEARA | J182: THOMAS | M182: MORONEY | P182: BAYLISS | R182: ALLISTER
A183: GOALKICKERS
A184: NORTHCOTE | D184: GOUGH 5 | F184: JOHNSON 3 | I184: YATES 2 | K184: DILLON | M184: FORTY | O184: H PARGETTER | R184: DIMMICK | U184: ROSS
A185: PRAHRAN | D185: KERLEY 4 | G185: BAYLISS | J185: THOMAS
A187: WILLIAMSTOWN | C187: 4 | D187: 6 | E187: =C187*6+D187 -> 30 | G187: 7 | H187: 9 | I187: =G187*6+H187 -> 51 | K187: 13 | L187: 11 | M187: =K187*6+L187 -> 89 | O187: 16 | P187: 14 | Q187: =O187*6+P187 -> 110 | S187: KARDINIA PARK
A188: GEELONG ASSOC. | C188: 1 | D188: 2 | E188: =C188*6+D188 -> 8 | G188: 4 | H188: 7 | I188: =G188*6+H188 -> 31 | K188: 5 | L188: 9 | M188: =K188*6+L188 -> 39 | O188: 10 | P188: 10 | Q188: =O188*6+P188 -> 70 | S188: COLLINS
A189: BEST PLAYERS
A190: WILLIAMSTOWN | D190: GEDDES | G190: MARTIN | I190: O'HALLORAN | L190: HOLTEN | O190: THOMPSON | R190: STONE
A191: GEELONG ASSOC. | D191: WARREN | G191: ELSTON | I191: COOPER | L191: STEPHENS | O191: PRIDDLE | R191: McFARLANE
A192: GOALKICKERS
A193: WILLIAMSTOWN | D193: CARPENTER 5 | G193: LEE 3 | I193: MARTIN 3 | K193: MUNRO 2 | M193: O'HALLORAN | P193: DEEGAN | R193: MITCHELL
A194: GEELONG ASSOC. | D194: WARREN 3 | G194: MELLAHAN 2 | J194: BRADY | L194: FOWLER | N194: ELSTON | P194: COOPER | R194: BIRCH
A196: ROUND 5 | E196: 2ND JUNE | H196: WEATHER | K196: MILD NORTH WIND A.M. RAIN GROUNDS BAD | S196: PLAYED AT | X196: LADDER | AB196: ROUND | AD196: 5
D197: 1ST QTR | H197: 2ND QTR | L197: 3RD QTR | P197: FINAL | S197: NORTHCOTE
A198: HAWTHORN | C198: 4 | D198: 3 | E198: =C198*6+D198 -> 27 | G198: 9 | H198: 6 | I198: =G198*6+H198 -> 60 | K198: 11 | L198: 7 | M198: =K198*6+L198 -> 73 | O198: 14 | P198: 12 | Q198: =O198*6+P198 -> 96 | S198: UMPIRE | W198: TEAM | X198: W | Y198: L | Z198: D | AA198: FOR | AB198: AGST | AC198: % | AD198: PTS
A199: NORTHCOTE | C199: 2 | D199: 4 | E199: =C199*6+D199 -> 16 | G199: 3 | H199: 5 | I199: =G199*6+H199 -> 23 | K199: 3 | L199: 7 | M199: =K199*6+L199 -> 25 | O199: 5 | P199: 10 | Q199: =O199*6+P199 -> 40 | S199: COLLINS
A200: BEST PLAYERS | W200: PORT MELBOURNE | X200: 5 | Y200: 0 | Z200: 0 | AA200: 412 | AB200: 202 | AC200: 203.96039603960395 | AD200: 20
A201: HAWTHORN | D201: WALTON | G201: JACKSON | J201: LATHAM | M201: FINCH | O201: MURPHY | Q201: YEOMANS | W201: FOOTSCRAY | X201: 4 | Y201: 1 | Z201: 0 | AA201: 400 | AB201: 265 | AC201: 150.9433962264151 | AD201: 16
A202: NORTHCOTE | D202: JOHNSON | G202: HELLWIG | J202: LONG | M202: HARLEY | O202: SHEEHY | Q202: DOWNES | W202: BRUNSWICK | X202: 4 | Y202: 1 | Z202: 0 | AA202: 325 | AB202: 259 | AC202: 125.48262548262548 | AD202: 16
A203: GOALKICKERS | W203: WILLIAMSTOWN | X203: 3 | Y203: 2 | Z203: 0 | AA203: 344 | AB203: 305 | AC203: 112.78688524590164 | AD203: 12
A204: HAWTHORN | D204: LATHAM 6 | F204: YEOMANS 2 | I204: PEARSON | K204: LETHLEAN | M204: MURPHY | O204: W REA | Q204: WALTON | S204: GILL
A205: NORTHCOTE | D205: DOWNES | G205: ROSS | I205: JOHNSON | K205: DILLON | M205: HELLWIG | W205: NORTH MELBOURNE | X205: 2 | Y205: 2 | Z205: 1 | AA205: 359 | AB205: 329 | AC205: 109.11854103343465 | AD205: 10
W206: HAWTHORN | X206: 2 | Y206: 3 | Z206: 0 | AA206: 394 | AB206: 331 | AC206: 119.03323262839879 | AD206: 8
A207: WILLIAMSTOWN | C207: 2 | D207: 7 | E207: =C207*6+D207 -> 19 | G207: 6 | H207: 7 | I207: =G207*6+H207 -> 43 | K207: 12 | L207: 8 | M207: =K207*6+L207 -> 80 | O207: 14 | P207: 8 | Q207: =O207*6+P207 -> 92 | S207: BRIGHTON BEACH | W207: BRIGHTON | X207: 2 | Y207: 3 | Z207: 0 | AA207: 332 | AB207: 373 | AC207: 89.008042895442358 | AD207: 8
A208: BRIGHTON | C208: 1 | D208: 1 | E208: =C208*6+D208 -> 7 | G208: 6 | H208: 5 | I208: =G208*6+H208 -> 41 | K208: 8 | L208: 9 | M208: =K208*6+L208 -> 57 | O208: 11 | P208: 12 | Q208: =O208*6+P208 -> 78 | S208: BOYD | W208: PRAHRAN | X208: 1 | Y208: 3 | Z208: 1 | AA208: 246 | AB208: 431 | AC208: 57.076566125290022 | AD208: 6
A209: BEST PLAYERS | W209: NORTHCOTE | X209: 1 | Y209: 4 | Z209: 0 | AA209: 322 | AB209: 409 | AC209: 78.728606356968214 | AD209: 4
A210: WILLIAMSTOWN | D210: MARTIN | G210: CARPENTER | J210: MUNRO | L210: CONDON | N210: O'HALLORAN | Q210: MILES | W210: GEELONG ASSOC. | X210: 0 | Y210: 5 | Z210: 0 | AA210: 253 | AB210: 483 | AC210: 52.38095238095238 | AD210: 0
A211: BRIGHTON | D211: SULLIVAN | G211: DANGERFIELD | J211: HARRIS | L211: BENCE | N211: BOYD | Q211: BORLAND
A212: GOALKICKERS
A213: WILLIAMSTOWN | D213: CARPENTER 7 | G213: LEE 3 | I213: MUNRO 2 | K213: A SMITH | M213: MITCHELL
A214: BRIGHTON | D214: MAU 3 | F214: SULLIVAN 2 | I214: IRWIN 2 | K214: BENCE | M214: EWANS | O214: REARDON | Q214: DANGERFIELD
A216: NORTH MELBOURNE | C216: 6 | D216: 4 | E216: =C216*6+D216 -> 40 | G216: 8 | H216: 8 | I216: =G216*6+H216 -> 56 | K216: 12 | L216: 12 | M216: =K216*6+L216 -> 84 | O216: 15 | P216: 16 | Q216: =O216*6+P216 -> 106 | S216: KARDINIA PARK
A217: GEELONG ASSOC. | C217: 2 | D217: 4 | E217: =C217*6+D217 -> 16 | G217: 3 | H217: 8 | I217: =G217*6+H217 -> 26 | K217: 6 | L217: 9 | M217: =K217*6+L217 -> 45 | O217: 7 | P217: 14 | Q217: =O217*6+P217 -> 56 | S217: CLARKE
A218: BEST PLAYERS
A219: NORTH MELBOURNE | D219: HALL | G219: McINTOSH | J219: WATSON | M219: MEEKING | P219: WALSH | S219: LAMBE
A220: GEELONG ASSOC. | D220: ELSTON | G220: STEPHENS | J220: THORLEY | M220: WARREN | P220: CATIONS | S220: PRIDDLE
A221: GOALKICKERS
A222: NORTH MELBOURNE | D222: HALL 3 | F222: WATSON 3 | I222: McINTOSH 2 | L222: LEWIS 2 | N222: JOHNSON | P222: LINDSAY | R222: MEEKING | U222: WALSH | W222: GUNN
A223: GEELONG ASSOC. | D223: WARREN 2 | G223: STEPHENS 2 | J223: MELLAHAN | M223: PRIDDLE | O223: BIRCH
E224: 4TH JUNE | J224: WEATHER | M224: CLOUDY STRONG NORTH WIND LIGHT SHOWERS
A225: BRUNSWICK | C225: 3 | D225: 2 | E225: =C225*6+D225 -> 20 | G225: 5 | H225: 5 | I225: =G225*6+H225 -> 35 | K225: 6 | L225: 8 | M225: =K225*6+L225 -> 44 | O225: 8 | P225: 13 | Q225: =O225*6+P225 -> 61 | S225: BRUNSWICK
A226: FOOTSCRAY | C226: 3 | D226: 6 | E226: =C226*6+D226 -> 24 | G226: 3 | H226: 8 | I226: =G226*6+H226 -> 26 | K226: 6 | L226: 11 | M226: =K226*6+L226 -> 47 | O226: 7 | P226: 15 | Q226: =O226*6+P226 -> 57 | S226: McKINNON
A227: BEST PLAYERS
A228: BRUNSWICK | D228: O'CONNOR | G228: RALEIGH | J228: MILLEN | M228: McNEENY | P228: ALESSIO | S228: FITZGERALD
A229: FOOTSCRAY | D229: FORD | G229: MCCARTHY | J229: DOOLAN | M229: NEILSON | P229: O'BRIEN | S229: MULLINS
A230: GOALKICKERS
A231: BRUNSWICK | D231: McINERNEY 2 | G231: L HOLFORD 2 | K231: MOORE | M231: STAHL | O231: FITZGERALD | R231: MILLEN
A232: FOOTSCRAY | D232: G WOODMAN 2 | G232: MULLINS | I232: McCARTHY | L232: SCANLON | N232: O'BRIEN | Q232: SAMSON
A234: PORT MELBOURNE | C234: 6 | D234: 4 | E234: =C234*6+D234 -> 40 | G234: 7 | H234: 11 | I234: =G234*6+H234 -> 53 | K234: 11 | L234: 13 | M234: =K234*6+L234 -> 79 | O234: 18 | P234: 18 | Q234: =O234*6+P234 -> 126 | S234: TOORAK PARK
A235: PRAHRAN | C235: 0 | D235: 1 | E235: =C235*6+D235 -> 1 | G235: 2 | H235: 4 | I235: =G235*6+H235 -> 16 | K235: 3 | L235: 5 | M235: =K235*6+L235 -> 23 | O235: 5 | P235: 6 | Q235: =O235*6+P235 -> 36 | S235: CAIN
A236: BEST PLAYERS
A237: PORT MELBOURNE | D237: OGILVIE | G237: REES | J237: TREMBATH | M237: J RUDD | O237: W RUDD | R237: PASH
A238: PRAHRAN | D238: MORONEY | G238: ALLISTER | J238: E JONES | M238: FERGEUS | O238: V JONES | R238: BAYLISS
A239: GOALKICKERS
A240: PORT MELBOURNE | D240: TAYLOR 4 | F240: SKILTON 3 | I240: DOBRIGH 2 | L240: PASH 2 | N240: TASKER 2 | Q240: TREMBATH | T240: OGILVIE | W240: STANFORD | X240: MURPHY | Z240: J RUDD
A241: PRAHRAN | D241: SPRAGUE 2 | G241: THOMAS | J241: KERLEY | L241: V JONES
A243: ROUND 6 | E243: 9TH JUNE | H243: WEATHER | J243: CLOUDY STRONG NORTH WIND LIGHT SHOWERS | S243: PLAYED AT | X243: LADDER | AB243: ROUND | AD243: 6
D244: 1ST QTR | H244: 2ND QTR | L244: 3RD QTR | P244: FINAL | S244: WILLIAMSTOWN
A245: WILLIAMSTOWN | C245: 5 | D245: 5 | E245: =C245*6+D245 -> 35 | G245: 6 | H245: 5 | I245: =G245*6+H245 -> 41 | K245: 8 | L245: 10 | M245: =K245*6+L245 -> 58 | O245: 12 | P245: 11 | Q245: =O245*6+P245 -> 83 | S245: UMPIRE | W245: TEAM | X245: W | Y245: L | Z245: D | AA245: FOR | AB245: AGST | AC245: % | AD245: PTS
A246: BRUNSWICK | C246: 2 | D246: 0 | E246: =C246*6+D246 -> 12 | G246: 2 | H246: 6 | I246: =G246*6+H246 -> 18 | K246: 2 | L246: 7 | M246: =K246*6+L246 -> 19 | O246: 5 | P246: 9 | Q246: =O246*6+P246 -> 39 | S246: CLARKE
A247: BEST PLAYERS | W247: PORT MELBOURNE | X247: 6 | Y247: 0 | Z247: 0 | AA247: 470 | AB247: 250 | AC247: 188 | AD247: 24
A248: WILLIAMSTOWN | D248: MARTIN | G248: STONE | I248: O'HALLORAN | L248: SMITH | O248: LEE | Q248: KING | W248: FOOTSCRAY | X248: 5 | Y248: 1 | Z248: 0 | AA248: 467 | AB248: 302 | AC248: 154.63576158940398 | AD248: 20
A249: BRUNSWICK | D249: O'CONNOR | G249: RALEIGH | I249: FISHER | L249: HASSETT | O249: MOORE | Q249: J HOLFORD | W249: WILLIAMSTOWN | X249: 4 | Y249: 2 | Z249: 0 | AA249: 427 | AB249: 344 | AC249: 124.12790697674419 | AD249: 16
A250: GOALKICKERS | W250: BRUNSWICK | X250: 4 | Y250: 2 | Z250: 0 | AA250: 364 | AB250: 342 | AC250: 106.43274853801169 | AD250: 16
A251: WILLIAMSTOWN | D251: LEE 5 | F251: GEISLER 2 | I251: MARTIN 2 | K251: N McDONALD | N251: CARPENTER | Q251: O'HALLORAN
A252: BRUNSWICK | D252: FISHER 2 | G252: McINERNEY 2 | J252: MOORE | W252: HAWTHORN | X252: 3 | Y252: 3 | Z252: 0 | AA252: 459 | AB252: 377 | AC252: 121.75066312997347 | AD252: 12
W253: BRIGHTON | X253: 3 | Y253: 3 | Z253: 0 | AA253: 426 | AB253: 413 | AC253: 103.14769975786925 | AD253: 12
A254: HAWTHORN | C254: 3 | D254: 2 | E254: =C254*6+D254 -> 20 | G254: 7 | H254: 2 | I254: =G254*6+H254 -> 44 | K254: 9 | L254: 4 | M254: =K254*6+L254 -> 58 | O254: 10 | P254: 5 | Q254: =O254*6+P254 -> 65 | S254: NORTH MELB | W254: NORTH MELBOURNE | X254: 2 | Y254: 3 | Z254: 1 | AA254: 405 | AB254: 394 | AC254: 102.79187817258884 | AD254: 10
A255: NORTH MELBOURNE | C255: 3 | D255: 2 | E255: =C255*6+D255 -> 20 | G255: 4 | H255: 3 | I255: =G255*6+H255 -> 27 | K255: 5 | L255: 9 | M255: =K255*6+L255 -> 39 | O255: 6 | P255: 10 | Q255: =O255*6+P255 -> 46 | S255: McKINNON | W255: PRAHRAN | X255: 1 | Y255: 4 | Z255: 1 | AA255: 286 | AB255: 525 | AC255: 54.476190476190474 | AD255: 6
A256: BEST PLAYERS | W256: NORTHCOTE | X256: 1 | Y256: 5 | Z256: 0 | AA256: 370 | AB256: 467 | AC256: 79.229122055674523 | AD256: 4
A257: HAWTHORN | D257: WALTON | G257: JACKSON | J257: MCCASHNEY | M257: LATHAM | O257: MURPHY | Q257: DILLON | W257: GEELONG ASSOC. | X257: 0 | Y257: 6 | Z257: 0 | AA257: 290 | AB257: 550 | AC257: 52.727272727272727 | AD257: 0
A258: NORTH MELBOURNE | D258: McINTOSH | G258: TREVASKIS | J258: WATSON | M258: HALL | O258: GILES | Q258: LEWIS
A259: GOALKICKERS
A260: HAWTHORN | D260: LATHAM 7 | G260: CARBARNS | J260: LETHLEAN | M260: WALTON
A261: NORTH MELBOURNE | D261: JOHNSON 2 | G261: HALL 2 | J261: GARDINER | M261: McINTOSH
A263: BRIGHTON | C263: 2 | D263: 4 | E263: =C263*6+D263 -> 16 | G263: 4 | H263: 11 | I263: =G263*6+H263 -> 35 | K263: 6 | L263: 15 | M263: =K263*6+L263 -> 51 | O263: 12 | P263: 22 | Q263: =O263*6+P263 -> 94 | S263: BRIGHTON BEACH
A264: PRAHRAN | C264: 4 | D264: 2 | E264: =C264*6+D264 -> 26 | G264: 4 | H264: 3 | I264: =G264*6+H264 -> 27 | K264: 4 | L264: 8 | M264: =K264*6+L264 -> 32 | O264: 5 | P264: 10 | Q264: =O264*6+P264 -> 40 | S264: COLLINS
A265: BEST PLAYERS
A266: BRIGHTON | D266: CARROLL | G266: SULLIVAN | J266: MAU | L266: HARRIS | O266: PEARSON | R266: BENCE
A267: PRAHRAN | D267: V JONES | G267: O MILLER | J267: N MILLER | L267: STEWART | O267: FERGEUS | R267: THOMAS
A268: GOALKICKERS
A269: BRIGHTON | D269: SULLIVAN 5 | G269: LAIRD 3 | J269: MAU | L269: BENCE | N269: MILDREN | P269: CARROLL
A270: PRAHRAN | D270: FERGEUS 2 | G270: BAYLISS | J270: HARRIS | L270: THOMAS
A272: PORT MELBOURNE | C272: 1 | D272: 4 | E272: =C272*6+D272 -> 10 | G272: 3 | H272: 9 | I272: =G272*6+H272 -> 27 | K272: 5 | L272: 12 | M272: =K272*6+L272 -> 42 | O272: 7 | P272: 16 | Q272: =O272*6+P272 -> 58 | S272: PORT MELB
A273: NORTHCOTE | C273: 1 | D273: 4 | E273: =C273*6+D273 -> 10 | G273: 1 | H273: 5 | I273: =G273*6+H273 -> 11 | K273: 5 | L273: 9 | M273: =K273*6+L273 -> 39 | O273: 6 | P273: 12 | Q273: =O273*6+P273 -> 48 | S273: THOMPSON
A274: BEST PLAYERS
A275: PORT MELBOURNE | D275: SKILTON | G275: BISSETT | J275: PASH | L275: BARFOOT | O275: TREMBATH | R275: DOBRIGH
A276: NORTHCOTE | D276: JOHNSON | G276: PURCELL | J276: DOWNES | L276: PARGETTER | O276: HARLEY | R276: DIMMICK
A277: GOALKICKERS
A278: PORT MELBOURNE | D278: PASH 2 | G278: TAYLOR 2 | J278: SKILTON 2 | M278: DOBRIGH
A279: NORTHCOTE | D279: PARGETTER 2 | G279: SHEEHY | J279: SMITH | L279: YATES | N279: SCOTT
A281: FOOTSCRAY | C281: 5 | D281: 5 | E281: =C281*6+D281 -> 35 | G281: 5 | H281: 7 | I281: =G281*6+H281 -> 37 | K281: 8 | L281: 15 | M281: =K281*6+L281 -> 63 | O281: 8 | P281: 19 | Q281: =O281*6+P281 -> 67 | S281: FOOTSCRAY
A282: GEELONG ASSOC. | C282: 0 | D282: 1 | E282: =C282*6+D282 -> 1 | G282: 4 | H282: 5 | I282: =G282*6+H282 -> 29 | K282: 5 | L282: 5 | M282: =K282*6+L282 -> 35 | O282: 5 | P282: 7 | Q282: =O282*6+P282 -> 37 | S282: CAIN
A283: BEST PLAYERS
A284: FOOTSCRAY | D284: SAMSON | G284: HANSEN | J284: EASON | M284: MCCARTHY | P284: FORD | S284: SAMPSON
A285: GEELONG ASSOC. | D285: WARREN | G285: ELSTON | J285: McFARLANE | M285: COOPER | P285: MOORE | S285: STEPHENS
A286: GOALKICKERS
A287: FOOTSCRAY | D287: SCANLON 2 | G287: MULLINS 2 | J287: HANSEN 2 | M287: R SAMPSON 2
A288: GEELONG ASSOC. | D288: WARREN 2 | G288: MOORE | J288: COOPER | M288: ELSTON
A290: ROUND 7 | E290: 16TH JUNE | J290: WEATHER | M290: CLOUDY LIGHT NORTH BREEZE | S290: PLAYED AT | X290: LADDER | AB290: ROUND | AD290: 7
D291: 1ST QTR | H291: 2ND QTR | L291: 3RD QTR | P291: FINAL | S291: FOOTSCRAY
A292: FOOTSCRAY | C292: 2 | D292: 4 | E292: =C292*6+D292 -> 16 | G292: 5 | H292: 7 | I292: =G292*6+H292 -> 37 | K292: 8 | L292: 10 | M292: =K292*6+L292 -> 58 | O292: 13 | P292: 13 | Q292: =O292*6+P292 -> 91 | S292: UMPIRE | W292: TEAM | X292: W | Y292: L | Z292: D | AA292: FOR | AB292: AGST | AC292: % | AD292: PTS
A293: PORT MELBOURNE | C293: 4 | D293: 1 | E293: =C293*6+D293 -> 25 | G293: 6 | H293: 2 | I293: =G293*6+H293 -> 38 | K293: 6 | L293: 2 | M293: =K293*6+L293 -> 38 | O293: 7 | P293: 4 | Q293: =O293*6+P293 -> 46 | S293: CLARKE
A294: BEST PLAYERS | W294: FOOTSCRAY | X294: 6 | Y294: 1 | Z294: 0 | AA294: 558 | AB294: 348 | AC294: 160.34482758620689 | AD294: 24
A295: FOOTSCRAY | D295: MCCARTHY | G295: EASON | J295: McINTYRE | M295: FORD | O295: ZINNICK | Q295: OUTEN | W295: PORT MELBOURNE | X295: 6 | Y295: 1 | Z295: 0 | AA295: 516 | AB295: 341 | AC295: 151.31964809384164 | AD295: 24
A296: PORT MELBOURNE | D296: OGILVIE | G296: STANBRIDGE | J296: SKILTON | M296: DOBRIGH | O296: PASH | Q296: J RUDD | W296: BRUNSWICK | X296: 5 | Y296: 2 | Z296: 0 | AA296: 435 | AB296: 410 | AC296: 106.09756097560975 | AD296: 20
A297: GOALKICKERS | W297: HAWTHORN | X297: 4 | Y297: 3 | Z297: 0 | AA297: 515 | AB297: 428 | AC297: 120.32710280373831 | AD297: 16
A298: FOOTSCRAY | D298: MULLINS 5 | G298: O'BRIEN 4 | I298: McCARTHY | L298: HANSEN | N298: EASON | P298: SMITH
A299: PORT MELBOURNE | D299: CALWELL 2 | G299: PASH | I299: TASKER | K299: STANBRIDGE | N299: DANTON | P299: BRISCOE | W299: WILLIAMSTOWN | X299: 4 | Y299: 3 | Z299: 0 | AA299: 478 | AB299: 400 | AC299: 119.5 | AD299: 16
W300: NORTH MELBOURNE | X300: 3 | Y300: 3 | Z300: 1 | AA300: 480 | AB300: 468 | AC300: 102.56410256410257 | AD300: 14
A301: HAWTHORN | C301: 3 | D301: 3 | E301: =C301*6+D301 -> 21 | G301: 4 | H301: 7 | I301: =G301*6+H301 -> 31 | K301: 4 | L301: 10 | M301: =K301*6+L301 -> 34 | O301: 7 | P301: 14 | Q301: =O301*6+P301 -> 56 | S301: GLENFERRIE | W301: BRIGHTON | X301: 3 | Y301: 4 | Z301: 0 | AA301: 500 | AB301: 488 | AC301: 102.45901639344262 | AD301: 12
A302: WILLIAMSTOWN | C302: 0 | D302: 3 | E302: =C302*6+D302 -> 3 | G302: 3 | H302: 6 | I302: =G302*6+H302 -> 24 | K302: 7 | L302: 8 | M302: =K302*6+L302 -> 50 | O302: 7 | P302: 9 | Q302: =O302*6+P302 -> 51 | S302: THOMPSON | W302: PRAHRAN | X302: 2 | Y302: 4 | Z302: 1 | AA302: 347 | AB302: 575 | AC302: 60.347826086956523 | AD302: 10
A303: BEST PLAYERS | W303: NORTHCOTE | X303: 1 | Y303: 6 | Z303: 0 | AA303: 438 | AB303: 538 | AC303: 81.412639405204459 | AD303: 4
A304: HAWTHORN | D304: JACKSON | G304: NOTT | I304: BROWN | K304: YEOMANS | N304: McCASHNEY | Q304: MURPHY | W304: GEELONG ASSOC. | X304: 0 | Y304: 7 | Z304: 0 | AA304: 340 | AB304: 611 | AC304: 55.646481178396073 | AD304: 0
A305: WILLIAMSTOWN | D305: STONE | G305: L SMITH | I305: R KING | K305: O'HALLORAN | N305: N McDONALD | Q305: CARPENTER
A306: GOALKICKERS
A307: HAWTHORN | D307: YEOMANS 2 | G307: LATHAM 2 | J307: GILL | L307: MURPHY | N307: PEARSON
A308: WILLIAMSTOWN | D308: CARPENTER 2 | G308: WHITBURN | J308: N McDONALD | M308: TRUMAN | O308: O'HALLORAN | R308: LEE
A310: NORTH MELBOURNE | C310: 4 | D310: 6 | E310: =C310*6+D310 -> 30 | G310: 5 | H310: 7 | I310: =G310*6+H310 -> 37 | K310: 8 | L310: 10 | M310: =K310*6+L310 -> 58 | O310: 10 | P310: 15 | Q310: =O310*6+P310 -> 75 | S310: NORTH MELB
A311: BRIGHTON | C311: 2 | D311: 4 | E311: =C311*6+D311 -> 16 | G311: 6 | H311: 10 | I311: =G311*6+H311 -> 46 | K311: 8 | L311: 12 | M311: =K311*6+L311 -> 60 | O311: 10 | P311: 14 | Q311: =O311*6+P311 -> 74 | S311: COLLINS
A312: BEST PLAYERS
A313: NORTH MELBOURNE | D313: LINTON | G313: TREVASKIS | J313: METCALFE | M313: FIELDING | P313: McINTOSH | S313: HALL
A314: BRIGHTON | D314: HATTAM | G314: PEARSON | J314: LILBURNE | M314: REARDON | P314: EVANS | S314: CARROLL
A315: GOALKICKERS
A316: NORTH MELBOURNE | D316: RUTLEY 4 | G316: METCALFE 2 | K316: McINTOSH | N316: JOHNSON | Q316: FIELDING | S316: LEWIS
A317: BRIGHTON | D317: SULLIVAN 3 | G317: MAU 2 | I317: EWINS | K317: REARDON | M317: TONKIN | O317: LILBURNE | R317: WARD
A319: PRAHRAN | C319: 2 | D319: 4 | E319: =C319*6+D319 -> 16 | G319: 3 | H319: 7 | I319: =G319*6+H319 -> 25 | K319: 4 | L319: 11 | M319: =K319*6+L319 -> 35 | O319: 7 | P319: 19 | Q319: =O319*6+P319 -> 61 | S319: TOORAK PARK
A320: GEELONG ASSOC. | C320: 0 | D320: 7 | E320: =C320*6+D320 -> 7 | G320: 2 | H320: 10 | I320: =G320*6+H320 -> 22 | K320: 5 | L320: 14 | M320: =K320*6+L320 -> 44 | O320: 6 | P320: 14 | Q320: =O320*6+P320 -> 50 | S320: McKINNON
A321: BEST PLAYERS
A322: PRAHRAN | D322: MORONEY | G322: E JONES | J322: O'MEARA | M322: FERGEUS | P322: SPRAGUE | S322: C MILLER
A323: GEELONG ASSOC. | D323: FINNEGAN | G323: CESARI | J323: COOPER | M323: ELSTON | P323: WARREN | S323: PRIDDLE
A324: GOALKICKERS
A325: PRAHRAN | D325: FERGEUS 2 | G325: THOMAS | J325: MARSHALL | M325: V JONES | O325: A MILLER | Q325: BOUSSIE
A326: GEELONG ASSOC. | D326: ELSTON 2 | G326: MOORE | J326: PERKINS | M326: DIGBY | O326: WARREN
A328: BRUNSWICK | C328: 2 | D328: 1 | E328: =C328*6+D328 -> 13 | G328: 6 | H328: 2 | I328: =G328*6+H328 -> 38 | K328: 9 | L328: 6 | M328: =K328*6+L328 -> 60 | O328: 10 | P328: 11 | Q328: =O328*6+P328 -> 71 | S328: NORTHCOTE
A329: NORTHCOTE | C329: 1 | D329: 3 | E329: =C329*6+D329 -> 9 | G329: 5 | H329: 4 | I329: =G329*6+H329 -> 34 | K329: 6 | L329: 6 | M329: =K329*6+L329 -> 42 | O329: 10 | P329: 8 | Q329: =O329*6+P329 -> 68 | S329: CAIN
A330: BEST PLAYERS
A331: BRUNSWICK | D331: GRANLAMD | G331: FISHER | J331: McINERNEY | M331: McMAHON | P331: BROWN | S331: HERBERT
A332: NORTHCOTE | D332: DOWNES | G332: DIMMICK | J332: HELLWIG | M332: HARLEY | P332: HOLBROOK | S332: DILLON
A333: GOALKICKERS
A334: BRUNSWICK | D334: McINERNEY 5 | H334: FISHER 2 | K334: McMAHON 2 | N334: L HOLFORD
A335: NORTHCOTE | D335: DOWNES 3 | G335: HELLWIG 2 | J335: HOLBROOK | M335: STEPHENSON | P335: DILLON | R335: JOHNSON | U335: ROSS
A337: ROUND 8 | E337: 23RD JUNE | J337: WEATHER | M337: CLOUDY STRONG NORTH WIND | S337: PLAYED AT
D338: 1ST QTR | H338: 2ND QTR | L338: 3RD QTR | P338: FINAL | S338: BRUNSWICK | X338: LADDER | AB338: ROUND | AD338: 8
A339: BRUNSWICK | C339: 4 | D339: 3 | E339: =C339*6+D339 -> 27 | G339: 4 | H339: 5 | I339: =G339*6+H339 -> 29 | K339: 5 | L339: 8 | M339: =K339*6+L339 -> 38 | O339: 7 | P339: 12 | Q339: =O339*6+P339 -> 54 | S339: UMPIRE
A340: NORTH MELBOURNE | C340: 3 | D340: 2 | E340: =C340*6+D340 -> 20 | G340: 3 | H340: 6 | I340: =G340*6+H340 -> 24 | K340: 4 | L340: 7 | M340: =K340*6+L340 -> 31 | O340: 4 | P340: 9 | Q340: =O340*6+P340 -> 33 | S340: CAIN | W340: TEAM | X340: W | Y340: L | Z340: D | AA340: FOR | AB340: AGST | AC340: % | AD340: PTS
A341: BEST PLAYERS
A342: BRUNSWICK | D342: MILLEN | F342: O'CONNOR | I342: FITZGERALD | L342: FISHER | N342: HASSETT | Q342: KEOGH | W342: FOOTSCRAY | X342: 7 | Y342: 1 | Z342: 0 | AA342: 641 | AB342: 410 | AC342: 156.34146341463415 | AD342: 28
A343: NORTH MELBOURNE | D343: GILES | F343: WALSH | I343: LAMBE | L343: LINTON | N343: McINTOSH | Q343: RUSS | W343: PORT MELBOURNE | X343: 7 | Y343: 1 | Z343: 0 | AA343: 600 | AB343: 389 | AC343: 154.24164524421593 | AD343: 28
A344: GOALKICKERS | W344: BRUNSWICK | X344: 6 | Y344: 2 | Z344: 0 | AA344: 489 | AB344: 443 | AC344: 110.38374717832957 | AD344: 24
A345: BRUNSWICK | D345: FITZGERALD 2 | G345: FISHER | I345: McINERNEY | L345: MILLEN | N345: HERBERT | Q345: L HOLFORD | W345: HAWTHORN | X345: 5 | Y345: 3 | Z345: 0 | AA345: 603 | AB345: 460 | AC345: 131.08695652173913 | AD345: 20
A346: NORTH MELBOURNE | D346: HALL | F346: RUTLEY | I346: LINDSAY | K346: GARDINER
W347: WILLIAMSTOWN | X347: 5 | Y347: 3 | Z347: 0 | AA347: 524 | AB347: 440 | AC347: 119.09090909090909 | AD347: 20
A348: HAWTHORN | C348: 1 | D348: 5 | E348: =C348*6+D348 -> 11 | G348: 4 | H348: 9 | I348: =G348*6+H348 -> 33 | K348: 5 | L348: 14 | M348: =K348*6+L348 -> 44 | O348: 12 | P348: 16 | Q348: =O348*6+P348 -> 88 | S348: TOORAK PARK | W348: NORTH MELBOURNE | X348: 3 | Y348: 4 | Z348: 1 | AA348: 513 | AB348: 522 | AC348: 98.275862068965523 | AD348: 14
A349: PRAHRAN | C349: 1 | D349: 3 | E349: =C349*6+D349 -> 9 | G349: 3 | H349: 4 | I349: =G349*6+H349 -> 22 | K349: 3 | L349: 6 | M349: =K349*6+L349 -> 24 | O349: 4 | P349: 8 | Q349: =O349*6+P349 -> 32 | S349: BOYD | W349: BRIGHTON | X349: 3 | Y349: 5 | Z349: 0 | AA349: 562 | AB349: 571 | AC349: 98.423817863397545 | AD349: 12
A350: BEST PLAYERS | W350: PRAHRAN | X350: 2 | Y350: 5 | Z350: 1 | AA350: 379 | AB350: 663 | AC350: 57.164404223227756 | AD350: 10
A351: HAWTHORN | D351: PEARSON | G351: LATHAM | J351: McCASHNEY | M351: MURPHY | O351: WALTON | Q351: FINCH | W351: NORTHCOTE | X351: 1 | Y351: 7 | Z351: 0 | AA351: 478 | AB351: 584 | AC351: 81.849315068493155 | AD351: 4
A352: PRAHRAN | D352: FERGEUS | G352: BAYLISS | J352: SPRAGUE | M352: V JONES | O352: FIELD | Q352: SHAND | W352: GEELONG ASSOC. | X352: 0 | Y352: 8 | Z352: 0 | AA352: 388 | AB352: 695 | AC352: 55.827338129496404 | AD352: 0
A353: GOALKICKERS
A354: HAWTHORN | D354: LATHAM 3 | G354: UTTING 2 | I354: MURPHY 2 | L354: PEARSON 2 | N354: YEOMANS | Q354: WALTON | S354: REA
A355: PRAHRAN | D355: FERGEUS 3 | G355: THOMAS
A357: FOOTSCRAY | C357: 2 | D357: 5 | E357: =C357*6+D357 -> 17 | G357: 8 | H357: 12 | I357: =G357*6+H357 -> 60 | K357: 8 | L357: 12 | M357: =K357*6+L357 -> 60 | O357: 11 | P357: 17 | Q357: =O357*6+P357 -> 83 | S357: BRIGHTON BEACH
A358: BRIGHTON | C358: 3 | D358: 5 | E358: =C358*6+D358 -> 23 | G358: 3 | H358: 6 | I358: =G358*6+H358 -> 24 | K358: 5 | L358: 11 | M358: =K358*6+L358 -> 41 | O358: 8 | P358: 14 | Q358: =O358*6+P358 -> 62 | S358: CLARKE
A359: BEST PLAYERS
A360: FOOTSCRAY | D360: DOOLAN | G360: SAMSON | J360: MULLINS | M360: WOODMAN | P360: McCARTHY | S360: OUTEN
A361: BRIGHTON | D361: HATTAM | G361: LILBURNE | J361: DANGERFIELD | M361: LAIRD | P361: IRWIN | S361: LEE
A362: GOALKICKERS
A363: FOOTSCRAY | D363: MULLINS 5 | G363: GIBB | I363: ZINNICK | K363: O'BRIEN | M363: HANSEN | O363: G WOODMAN | R363: McCARTHY
A364: BRIGHTON | D364: SULLIVAN 2 | G364: LAIRD 2 | I364: BENCE | K364: LEE | M364: REARDON | O364: LILBURNE
A366: WILLIAMSTOWN | C366: 1 | D366: 2 | E366: =C366*6+D366 -> 8 | G366: 4 | H366: 4 | I366: =G366*6+H366 -> 28 | K366: 4 | L366: 5 | M366: =K366*6+L366 -> 29 | O366: 6 | P366: 10 | Q366: =O366*6+P366 -> 46 | S366: WILLIAMSTOWN
A367: NORTHCOTE | C367: 2 | D367: 4 | E367: =C367*6+D367 -> 16 | G367: 3 | H367: 6 | I367: =G367*6+H367 -> 24 | K367: 5 | L367: 9 | M367: =K367*6+L367 -> 39 | O367: 5 | P367: 10 | Q367: =O367*6+P367 -> 40 | S367: COLLINS
A368: BEST PLAYERS
A369: WILLIAMSTOWN | D369: TRUMAN | G369: MARTIN | J369: STONE | M369: SMITH | P369: CALLESON | S369: LEE
A370: NORTHCOTE | D370: SHEEHY | G370: YATES | J370: ROSS | M370: HARLEY | P370: DIMMICK | S370: HELLWIG
A371: GOALKICKERS
A372: WILLIAMSTOWN | D372: LEE 3 | G372: N McDONALD | J372: CARPENTER | M372: THOMPSON
A373: NORTHCOTE | D373: POWELL | G373: GOUGH | I373: SMITH | K373: ROSS | M373: HELLWIG
A375: PORT MELBOURNE | C375: 7 | D375: 4 | E375: =C375*6+D375 -> 46 | G375: 8 | H375: 8 | I375: =G375*6+H375 -> 56 | K375: 10 | L375: 11 | M375: =K375*6+L375 -> 71 | O375: 12 | P375: 12 | Q375: =O375*6+P375 -> 84 | S375: KARDINIA PARK
A376: GEELONG ASSOC. | C376: 0 | D376: 0 | E376: =C376*6+D376 -> 0 | G376: 3 | H376: 3 | I376: =G376*6+H376 -> 21 | K376: 4 | L376: 6 | M376: =K376*6+L376 -> 30 | O376: 6 | P376: 12 | Q376: =O376*6+P376 -> 48 | S376: BROWN
A377: BEST PLAYERS
A378: PORT MELBOURNE | D378: REES | G378: MURPHY | J378: J RUDD | M378: JOHNSTON | P378: SKILTON | S378: CROMPTON
A379: GEELONG ASSOC. | D379: WEARMOUTH | G379: CATIONS | J379: STEPHENS | M379: CESARI | P379: FOWLER | S379: ELSTON
A380: GOALKICKERS
A381: PORT MELBOURNE | D381: TAYLOR 3 | G381: KERLEY 2 | J381: MURPHY 2 | M381: PATON 2 | P381: SKILTON 2 | S381: CRUDDEN
A382: GEELONG ASSOC. | D382: PERKINS 2 | G382: ELSTON | J382: WARREN | L382: STEPHENS | O382: CESARI
A384: ROUND 9 | E384: 30TH JUNE | J384: WEATHER | N384: FINE COOL SOUTH WIND | S384: PLAYED AT | X384: LADDER | AB384: ROUND | AD384: 9
D385: 1ST QTR | H385: 2ND QTR | L385: 3RD QTR | P385: FINAL | S385: BRUNSWICK
A386: BRUNSWICK | C386: 2 | D386: 3 | E386: =C386*6+D386 -> 15 | G386: 4 | H386: 5 | I386: =G386*6+H386 -> 29 | K386: 8 | L386: 6 | M386: =K386*6+L386 -> 54 | O386: 8 | P386: 9 | Q386: =O386*6+P386 -> 57 | S386: UMPIRE | W386: TEAM | X386: W | Y386: L | Z386: D | AA386: FOR | AB386: AGST | AC386: % | AD386: PTS
A387: PORT MELBOURNE | C387: 3 | D387: 2 | E387: =C387*6+D387 -> 20 | G387: 5 | H387: 6 | I387: =G387*6+H387 -> 36 | K387: 5 | L387: 7 | M387: =K387*6+L387 -> 37 | O387: 8 | P387: 9 | Q387: =O387*6+P387 -> 57 | S387: McKINNON
A388: BEST PLAYERS | W388: FOOTSCRAY | X388: 8 | Y388: 1 | Z388: 0 | AA388: 757 | AB388: 460 | AC388: 164.56521739130434 | AD388: 32
A389: BRUNSWICK | D389: MILLEN | F389: O'CONNOR | I389: ROBERTS | L389: ALESSIO | O389: HERBERT | Q389: FISHER | W389: PORT MELBOURNE | X389: 7 | Y389: 1 | Z389: 1 | AA389: 657 | AB389: 446 | AC389: 147.30941704035874 | AD389: 30
A390: PORT MELBOURNE | D390: OGILVIE | F390: REES | I390: KERLEY | L390: TREMBATH | O390: BARFOOT | Q390: SKILTON | W390: BRUNSWICK | X390: 6 | Y390: 2 | Z390: 1 | AA390: 546 | AB390: 500 | AC390: 109.2 | AD390: 26
A391: GOALKICKERS | W391: HAWTHORN | X391: 6 | Y391: 3 | Z391: 0 | AA391: 681 | AB391: 529 | AC391: 128.73345935727789 | AD391: 24
A392: BRUNSWICK | D392: McINERNEY 3 | G392: McMAHON 2 | J392: RALEIGH | L392: FISHER | N392: MILLEN
A393: PORT MELBOURNE | D393: KERLEY 3 | G393: TASKER 2 | J393: CRUDDEN | L393: TAYLOR | N393: REES | W393: WILLIAMSTOWN | X393: 5 | Y393: 4 | Z393: 0 | AA393: 579 | AB393: 508 | AC393: 113.97637795275591 | AD393: 20
W394: NORTH MELBOURNE | X394: 4 | Y394: 4 | Z394: 1 | AA394: 581 | AB394: 577 | AC394: 100.69324090121317 | AD394: 18
A395: NORTH MELBOURNE | C395: 3 | D395: 3 | E395: =C395*6+D395 -> 21 | G395: 4 | H395: 5 | I395: =G395*6+H395 -> 29 | K395: 7 | L395: 11 | M395: =K395*6+L395 -> 53 | O395: 9 | P395: 14 | Q395: =O395*6+P395 -> 68 | S395: NORTH MELB | W395: BRIGHTON | X395: 3 | Y395: 6 | Z395: 0 | AA395: 631 | AB395: 649 | AC395: 97.226502311248069 | AD395: 12
A396: WILLIAMSTOWN | C396: 2 | D396: 4 | E396: =C396*6+D396 -> 16 | G396: 4 | H396: 5 | I396: =G396*6+H396 -> 29 | K396: 5 | L396: 6 | M396: =K396*6+L396 -> 36 | O396: 8 | P396: 7 | Q396: =O396*6+P396 -> 55 | S396: CLARKE | W396: PRAHRAN | X396: 2 | Y396: 6 | Z396: 1 | AA396: 429 | AB396: 779 | AC396: 55.070603337612326 | AD396: 10
A397: BEST PLAYERS | W397: NORTHCOTE | X397: 2 | Y397: 7 | Z397: 0 | AA397: 583 | AB397: 649 | AC397: 89.830508474576277 | AD397: 8
A398: NORTH MELBOURNE | D398: RUTLEY | F398: JOHNSON | I398: HALL | L398: CONSIDINE | O398: WALSH | Q398: SHORTEN | W398: GEELONG ASSOC. | X398: 0 | Y398: 9 | Z398: 0 | AA398: 453 | AB398: 800 | AC398: 56.625 | AD398: 0
A399: WILLIAMSTOWN | D399: KING | F399: CARPENTER | I399: LEE | L399: MARTIN | O399: STONE | Q399: CONDON
A400: GOALKICKERS
A401: NORTH MELBOURNE | D401: RUTLEY 4 | G401: WALSH 2 | J401: CONSIDINE | M401: MEEKING | P401: HALL
A402: WILLIAMSTOWN | D402: CARPENTER 4 | H402: LEE 3 | K402: N McDONALD
A404: NORTHCOTE | C404: 3 | D404: 7 | E404: =C404*6+D404 -> 25 | G404: 7 | H404: 8 | I404: =G404*6+H404 -> 50 | K404: 10 | L404: 10 | M404: =K404*6+L404 -> 70 | O404: 15 | P404: 15 | Q404: =O404*6+P404 -> 105 | S404: NORTHCOTE
A405: GEELONG ASSOC. | C405: 1 | D405: 4 | E405: =C405*6+D405 -> 10 | G405: 3 | H405: 4 | I405: =G405*6+H405 -> 22 | K405: 7 | L405: 8 | M405: =K405*6+L405 -> 50 | O405: 9 | P405: 11 | Q405: =O405*6+P405 -> 65 | S405: JENKINS
A406: BEST PLAYERS
A407: NORTHCOTE | D407: BUISST | G407: SHEEHY | J407: STEPHENSON | N407: HELLWIG | Q407: GOUGH | S407: HARLEY
A408: GEELONG ASSOC. | D408: SULLIVAN | G408: LARKIN | J408: FINNEGAN | N408: CESARI | Q408: COOPER | S408: WARREN
A409: GOALKICKERS
A410: NORTHCOTE | D410: GOUGH 4 | G410: ROSS 3 | I410: DOWNES 3 | L410: JOHNSON 2 | O410: BUISST | Q410: SHEEHY | S410: STEPHENSON
A411: GEELONG ASSOC. | D411: ELSTON 2 | G411: PERKINS 2 | J411: MOORE 2 | M411: BROWN | O411: BIRCH | Q411: WARREN
A413: FOOTSCRAY | C413: 6 | D413: 3 | E413: =C413*6+D413 -> 39 | G413: 8 | H413: 4 | I413: =G413*6+H413 -> 52 | K413: 14 | L413: 8 | M413: =K413*6+L413 -> 92 | O413: 18 | P413: 8 | Q413: =O413*6+P413 -> 116 | S413: FOOTSCRAY
A414: PRAHRAN | C414: 1 | D414: 2 | E414: =C414*6+D414 -> 8 | G414: 3 | H414: 7 | I414: =G414*6+H414 -> 25 | K414: 4 | L414: 11 | M414: =K414*6+L414 -> 35 | O414: 6 | P414: 14 | Q414: =O414*6+P414 -> 50 | S414: COLLINS
A415: BEST PLAYERS
A416: FOOTSCRAY | D416: EASON | G416: McCARTHY | J416: SMITH | M416: MULLINS | P416: OUTEN | S416: WOODMAN
A417: PRAHRAN | D417: COBB | G417: SPRAGUE | J417: FIELD | M417: FERGEUS | P417: V JONES | S417: BOUSSIE
A418: GOALKICKERS
A419: FOOTSCRAY | D419: MULLINS 6 | F419: SMITH 2 | H419: SAMSON 2 | J419: FRASER 2 | M419: ZINNICK | O419: SAMPSON | Q419: WOODMAN | T419: McCARTHY | W419: O'BRIEN
A420: PRAHRAN | D420: FERGEUS 2 | G420: COBB 2 | I420: THOMAS | K420: MASTERS
A422: HAWTHORN | C422: 2 | D422: 3 | E422: =C422*6+D422 -> 15 | G422: 5 | H422: 4 | I422: =G422*6+H422 -> 34 | K422: 6 | L422: 8 | M422: =K422*6+L422 -> 44 | O422: 11 | P422: 12 | Q422: =O422*6+P422 -> 78 | S422: GLENFERRIE
A423: BRIGHTON | C423: 3 | D423: 0 | E423: =C423*6+D423 -> 18 | G423: 5 | H423: 3 | I423: =G423*6+H423 -> 33 | K423: 7 | L423: 7 | M423: =K423*6+L423 -> 49 | O423: 10 | P423: 9 | Q423: =O423*6+P423 -> 69 | S423: CAIN | V423: MATCH UNFINISHED REPLAYED 25TH JULY
A424: BEST PLAYERS
A425: HAWTHORN | D425: MURPHY | G425: GILL | J425: FINCH | M425: PEARSON | P425: NOTT | S425: UTTING
A426: BRIGHTON | D426: BOYD | G426: CARROLL | J426: REARDON | M426: DANGERFIELD | P426: MATTHEWS | S426: SULLIVAN
A427: GOALKICKERS
A428: HAWTHORN | D428: PEARSON 3 | G428: WALTON 2 | J428: LATHAM 2 | M428: BROWN 2 | P428: UTTING | R428: BRUCE
A429: BRIGHTON | D429: LILBURN 4 | G429: DANGERFIELD | J429: BOYD | L429: SULLIVAN | O429: LAIRD | Q429: MAU | R429: BENCE
C430: 25TH JULY | F430: REPLAY
A431: HAWTHORN | C431: 2 | D431: 4 | E431: =C431*6+D431 -> 16 | G431: 7 | H431: 6 | I431: =G431*6+H431 -> 48 | K431: 7 | L431: 8 | M431: =K431*6+L431 -> 50 | O431: 7 | P431: 10 | Q431: =O431*6+P431 -> 52 | S431: GLENFERRIE
A432: BRIGHTON | C432: 1 | D432: 2 | E432: =C432*6+D432 -> 8 | G432: 1 | H432: 5 | I432: =G432*6+H432 -> 11 | K432: 1 | L432: 7 | M432: =K432*6+L432 -> 13 | O432: 2 | P432: 8 | Q432: =O432*6+P432 -> 20 | S432: McKINNON
A433: BEST PLAYERS
A434: HAWTHORN | D434: HAMMOND | G434: YEOMANS | J434: LATHAM | M434: JACKSON | P434: PEARSON | S434: UTTING
A435: BRIGHTON | D435: HARBOARD | G435: CARROLL | J435: REARDON | M435: BORLAND | P435: HARRIS | S435: MATTHEWS
A436: GOALKICKERS
A437: HAWTHORN | D437: LATHAM 6 | G437: WALTON
A438: BRIGHTON | D438: SULLIVAN | G438: BENCE
A440: ROUND 10 | E440: 7TH JULY | H440: WEATHER | K440: COLD RAIN S.W. BREEZE GROUNDS HEAVY | S440: PLAYED AT | X440: LADDER | AB440: ROUND | AD440: 10
D441: 1ST QTR | H441: 2ND QTR | L441: 3RD QTR | P441: FINAL | S441: PORT MELB
A442: PORT MELBOURNE | C442: 1 | D442: 1 | E442: =C442*6+D442 -> 7 | G442: 5 | H442: 5 | I442: =G442*6+H442 -> 35 | K442: 6 | L442: 8 | M442: =K442*6+L442 -> 44 | O442: 12 | P442: 17 | Q442: =O442*6+P442 -> 89 | S442: UMPIRE | W442: TEAM | X442: W | Y442: L | Z442: D | AA442: FOR | AB442: AGST | AC442: % | AD442: PTS
A443: NORTH MELBOURNE | C443: 4 | D443: 1 | E443: =C443*6+D443 -> 25 | G443: 4 | H443: 1 | I443: =G443*6+H443 -> 25 | K443: 6 | L443: 4 | M443: =K443*6+L443 -> 40 | O443: 7 | P443: 4 | Q443: =O443*6+P443 -> 46 | S443: CLARKE
A444: BEST PLAYERS | W444: FOOTSCRAY | X444: 9 | Y444: 1 | Z444: 0 | AA444: 802 | AB444: 477 | AC444: 168.13417190775681 | AD444: 36
A445: PORT MELBOURNE | D445: J RUDD | G445: OGILVIE | I445: REES | K445: STANBRIDGE | N445: SKILTON | Q445: JOHNSON | W445: PORT MELBOURNE | X445: 8 | Y445: 1 | Z445: 1 | AA445: 746 | AB445: 492 | AC445: 151.6260162601626 | AD445: 34
A446: NORTH MELBOURNE | D446: WALSH | G446: LAMBE | I446: JOHNSON | K446: METCALFE | N446: KEW MING | Q446: CONSIDINE | W446: HAWTHORN | X446: 7 | Y446: 3 | Z446: 0 | AA446: 750 | AB446: 559 | AC446: 134.16815742397137 | AD446: 28
A447: GOALKICKERS | W447: BRUNSWICK | X447: 6 | Y447: 3 | Z447: 1 | AA447: 625 | AB447: 584 | AC447: 107.02054794520548 | AD447: 26
A448: PORT MELBOURNE | D448: SKILTON 3 | F448: TASKER 2 | I448: CRUDDEN 2 | L448: KERLEY | N448: DOBRIGH | P448: REES | Q448: TREMBATH | T448: MURPHY
A449: NORTH MELBOURNE | D449: HALL | F449: JOHNSON | H449: CONSIDINE | K449: METCALFE | N449: MEEKING | P449: KIRKLEY | R449: JOHNSON | W449: WILLIAMSTOWN | X449: 6 | Y449: 4 | Z449: 0 | AA449: 649 | AB449: 563 | AC449: 115.2753108348135 | AD449: 24
W450: NORTH MELBOURNE | X450: 4 | Y450: 5 | Z450: 1 | AA450: 627 | AB450: 666 | AC450: 94.14414414414415 | AD450: 18
A451: BRIGHTON | C451: 5 | D451: 2 | E451: =C451*6+D451 -> 32 | G451: 7 | H451: 3 | I451: =G451*6+H451 -> 45 | K451: 12 | L451: 5 | M451: =K451*6+L451 -> 77 | O451: 13 | P451: 6 | Q451: =O451*6+P451 -> 84 | S451: BRIGHTON BEACH | W451: BRIGHTON | X451: 4 | Y451: 6 | Z451: 0 | AA451: 715 | AB451: 728 | AC451: 98.214285714285708 | AD451: 16
A452: BRUNSWICK | C452: 4 | D452: 1 | E452: =C452*6+D452 -> 25 | G452: 7 | H452: 8 | I452: =G452*6+H452 -> 50 | K452: 8 | L452: 11 | M452: =K452*6+L452 -> 59 | O452: 11 | P452: 13 | Q452: =O452*6+P452 -> 79 | S452: JENKIN | W452: PRAHRAN | X452: 2 | Y452: 7 | Z452: 1 | AA452: 484 | AB452: 849 | AC452: 57.008244994110719 | AD452: 10
A453: BEST PLAYERS | W453: NORTHCOTE | X453: 2 | Y453: 8 | Z453: 0 | AA453: 600 | AB453: 694 | AC453: 86.455331412103746 | AD453: 8
A454: BRIGHTON | D454: PEARSON | G454: BOYD | I454: DANGERFIELD | L454: HARRIS | N454: SULLIVAN | Q454: MATTHEWS | W454: GEELONG ASSOC. | X454: 0 | Y454: 10 | Z454: 0 | AA454: 483 | AB454: 869 | AC454: 55.58112773302647 | AD454: 0
A455: BRUNSWICK | D455: McINERNEY | G455: MILLEN | I455: ROBERTS | L455: RALEIGH | N455: HASSETT | Q455: L HOLFORD
A456: GOALKICKERS
A457: BRIGHTON | D457: BOYD 4 | G457: REARDON 3 | J457: IRWIN 2 | M457: LAIRD 2 | P457: SULLIVAN | S457: DANGERFIELD
A458: BRUNSWICK | D458: MOORE 2 | G458: ROBERTS 2 | J458: L HOLFORD | M458: HERBERT | O458: RAYMOND | Q458: FITZGERALD | T458: FISHER | V458: BROWN
A460: WILLIAMSTOWN | C460: 1 | D460: 1 | E460: =C460*6+D460 -> 7 | G460: 5 | H460: 3 | I460: =G460*6+H460 -> 33 | K460: 8 | L460: 6 | M460: =K460*6+L460 -> 54 | O460: 10 | P460: 10 | Q460: =O460*6+P460 -> 70 | S460: TOORAK PARK
A461: PRAHRAN | C461: 3 | D461: 3 | E461: =C461*6+D461 -> 21 | G461: 5 | H461: 3 | I461: =G461*6+H461 -> 33 | K461: 7 | L461: 7 | M461: =K461*6+L461 -> 49 | O461: 8 | P461: 7 | Q461: =O461*6+P461 -> 55 | S461: McKINNON
A462: BEST PLAYERS
A463: WILLIAMSTOWN | D463: McAULIFFE | G463: CALLESON | J463: MARTIN | M463: N McDONALD | P463: CAHILL | S463: KING
A464: PRAHRAN | D464: FERGEUS | G464: E JONES | J464: BOUSSIE | M464: SPRAGUE | P464: COBB | S464: NOBLE
A465: GOALKICKERS
A466: WILLIAMSTOWN | D466: McAULIFFE 3 | G466: TRUMAN 2 | J466: MARTIN 2 | M466: MUNRO | O466: CALLESON | R466: BANKS
A467: PRAHRAN | D467: FERGEUS 3 | G467: SHAND 2 | J467: COBB 2 | M467: MILLER
A469: HAWTHORN | C469: 4 | D469: 8 | E469: =C469*6+D469 -> 32 | G469: 4 | H469: 12 | I469: =G469*6+H469 -> 36 | K469: 7 | L469: 16 | M469: =K469*6+L469 -> 58 | O469: 8 | P469: 21 | Q469: =O469*6+P469 -> 69 | S469: GLENFERRIE
A470: GEELONG ASSOC. | C470: 0 | D470: 2 | E470: =C470*6+D470 -> 2 | G470: 1 | H470: 3 | I470: =G470*6+H470 -> 9 | K470: 4 | L470: 4 | M470: =K470*6+L470 -> 28 | O470: 4 | P470: 6 | Q470: =O470*6+P470 -> 30 | S470: COLLINS
A471: BEST PLAYERS
A472: HAWTHORN | D472: JACKSON | G472: McKENZIE | J472: FINCH | M472: BRUCE | O472: PEARSON | R472: GRIFFITH
A473: GEELONG ASSOC. | D473: STEPHENS | G473: CESARI | J473: McFARLANE | M473: FINNEGAN | O473: THORLEY
A474: GOALKICKERS
A475: HAWTHORN | D475: PEARSON 3 | G475: LATHAM 2 | J475: CARBARNS | M475: BRUCE | O475: FINCH
A476: GEELONG ASSOC. | D476: CESARI | G476: MOORE | J476: WEARMOUTH | M476: STEPHENS
A478: FOOTSCRAY | C478: 1 | D478: 2 | E478: =C478*6+D478 -> 8 | G478: 2 | H478: 4 | I478: =G478*6+H478 -> 16 | K478: 6 | L478: 5 | M478: =K478*6+L478 -> 41 | O478: 6 | P478: 9 | Q478: =O478*6+P478 -> 45 | S478: NORTHCOTE
A479: NORTHCOTE | C479: 1 | D479: 0 | E479: =C479*6+D479 -> 6 | G479: 2 | H479: 2 | I479: =G479*6+H479 -> 14 | K479: 2 | L479: 2 | M479: =K479*6+L479 -> 14 | O479: 2 | P479: 5 | Q479: =O479*6+P479 -> 17 | S479: BLACKBURN
A480: BEST PLAYERS
A481: FOOTSCRAY | D481: McLEOD | G481: McCARTHY | J481: EASON | M481: MULLINS | P481: NEILSON | S481: ZINNICK
A482: NORTHCOTE | D482: LONG | G482: SHEEHY | J482: DOWNES | M482: GIBBS | P482: DIMMICK | S482: HARLEY
A483: GOALKICKERS
A484: FOOTSCRAY | D484: McCARTHY 2 | G484: MULLINS 2 | J484: SAMPSON | L484: SAMSON
A485: NORTHCOTE | D485: PARGETTER | G485: GOUGH
A487: ROUND 11 | E487: 14TH JULY | H487: WEATHER | K487: FINE SOUTH BREEZE GROUNDS HEAVY | S487: PLAYED AT | X487: LADDER | AB487: ROUND | AD487: 11
D488: 1ST QTR | H488: 2ND QTR | L488: 3RD QTR | P488: FINAL | S488: FOOTSCRAY
A489: FOOTSCRAY | C489: 5 | D489: 2 | E489: =C489*6+D489 -> 32 | G489: 8 | H489: 5 | I489: =G489*6+H489 -> 53 | K489: 8 | L489: 7 | M489: =K489*6+L489 -> 55 | O489: 10 | P489: 11 | Q489: =O489*6+P489 -> 71 | S489: UMPIRE | W489: TEAM | X489: W | Y489: L | Z489: D | AA489: FOR | AB489: AGST | AC489: % | AD489: PTS
A490: HAWTHORN | C490: 2 | D490: 2 | E490: =C490*6+D490 -> 14 | G490: 3 | H490: 5 | I490: =G490*6+H490 -> 23 | K490: 6 | L490: 6 | M490: =K490*6+L490 -> 42 | O490: 6 | P490: 7 | Q490: =O490*6+P490 -> 43 | S490: CLARKE
A491: BEST PLAYERS | W491: FOOTSCRAY | X491: 10 | Y491: 1 | Z491: 0 | AA491: 873 | AB491: 520 | AC491: 167.88461538461539 | AD491: 40
A492: FOOTSCRAY | D492: McCARTHY | G492: McLEOD | I492: O'BRIEN | L492: McINTYRE | O492: EASON | Q492: ZINNICK | W492: PORT MELBOURNE | X492: 9 | Y492: 1 | Z492: 1 | AA492: 809 | AB492: 545 | AC492: 148.44036697247705 | AD492: 38
A493: HAWTHORN | D493: GLYNN | G493: GILL | I493: UTTING | L493: YEOMANS | O493: PEARSON | Q493: JACKSON | W493: BRUNSWICK | X493: 7 | Y493: 3 | Z493: 1 | AA493: 727 | AB493: 618 | AC493: 117.63754045307444 | AD493: 30
A494: GOALKICKERS | W494: HAWTHORN | X494: 7 | Y494: 4 | Z494: 0 | AA494: 793 | AB494: 630 | AC494: 125.87301587301587 | AD494: 28
A495: FOOTSCRAY | D495: O'BRIEN 2 | G495: FRASER 2 | J495: McCARTHY 2 | M495: ZINNICK 2 | P495: EASON | R495: MULLINS
A496: HAWTHORN | D496: PEARSON 2 | G496: LATHAM 2 | J496: GLYNN | L496: GLASS | W496: WILLIAMSTOWN | X496: 6 | Y496: 5 | Z496: 0 | AA496: 702 | AB496: 626 | AC496: 112.14057507987221 | AD496: 24
W497: NORTH MELBOURNE | X497: 5 | Y497: 5 | Z497: 1 | AA497: 680 | AB497: 711 | AC497: 95.639943741209564 | AD497: 22
A498: PORT MELBOURNE | C498: 2 | D498: 3 | E498: =C498*6+D498 -> 15 | G498: 5 | H498: 7 | I498: =G498*6+H498 -> 37 | K498: 6 | L498: 10 | M498: =K498*6+L498 -> 46 | O498: 8 | P498: 15 | Q498: =O498*6+P498 -> 63 | S498: WILLIAMSTOWN | W498: BRIGHTON | X498: 5 | Y498: 6 | Z498: 0 | AA498: 777 | AB498: 784 | AC498: 99.107142857142861 | AD498: 20
A499: WILLIAMSTOWN | C499: 3 | D499: 2 | E499: =C499*6+D499 -> 20 | G499: 4 | H499: 3 | I499: =G499*6+H499 -> 27 | K499: 7 | L499: 4 | M499: =K499*6+L499 -> 46 | O499: 8 | P499: 5 | Q499: =O499*6+P499 -> 53 | S499: COLLINS | W499: PRAHRAN | X499: 2 | Y499: 8 | Z499: 1 | AA499: 518 | AB499: 951 | AC499: 54.468980021030497 | AD499: 10
A500: BEST PLAYERS | W500: NORTHCOTE | X500: 2 | Y500: 9 | Z500: 0 | AA500: 645 | AB500: 747 | AC500: 86.345381526104418 | AD500: 8
A501: PORT MELBOURNE | D501: STANBRIDGE | G501: BARFOOT | J501: REES | L501: BISSETT | O501: PASH | Q501: TREMBATH | W501: GEELONG ASSOC. | X501: 0 | Y501: 11 | Z501: 0 | AA501: 539 | AB501: 931 | AC501: 57.89473684210526 | AD501: 0
A502: WILLIAMSTOWN | D502: HOLTEN | G502: CONDON | J502: LEE | L502: CARPENTER | O502: GEDDES | Q502: GIBBS
A503: GOALKICKERS
A504: PORT MELBOURNE | D504: KERLEY 2 | G504: GARBUTT 2 | J504: J RUDD | L504: JAMIESON | O504: BARFOOT | R504: PASH
A505: WILLIAMSTOWN | D505: McAULIFFE 2 | G505: CARPENTER 2 | J505: TRUMAN | M505: LEE | O505: GIBBS | Q505: MARTIN
A507: BRIGHTON | C507: 4 | D507: 2 | E507: =C507*6+D507 -> 26 | G507: 7 | H507: 2 | I507: =G507*6+H507 -> 44 | K507: 8 | L507: 6 | M507: =K507*6+L507 -> 54 | O507: 9 | P507: 8 | Q507: =O507*6+P507 -> 62 | S507: KARDINIA PARK
A508: GEELONG ASSOC. | C508: 3 | D508: 4 | E508: =C508*6+D508 -> 22 | G508: 5 | H508: 6 | I508: =G508*6+H508 -> 36 | K508: 5 | L508: 11 | M508: =K508*6+L508 -> 41 | O508: 7 | P508: 14 | Q508: =O508*6+P508 -> 56 | S508: CAIN
A509: BEST PLAYERS
A510: BRIGHTON | D510: TONKIN | G510: BORLAND | J510: HARRIS | M510: MAU | O510: DANGERFIELD | S510: LILBURNE
A511: GEELONG ASSOC. | D511: P DIGBY | G511: FOWLER | J511: McFARLANE | M511: L STEPHENS | P511: THORLEY | S511: TOPP
A512: GOALKICKERS
A513: BRIGHTON | D513: MAU 4 | G513: SULLIVAN 2 | K513: LAIRD | M513: IRWIN | O513: LILBURNE
A514: GEELONG ASSOC. | D514: MOORE 2 | G514: L STEPHENS 2 | K514: THORLEY | N514: TOPP | P514: DIGBY
A516: BRUNSWICK | C516: 2 | D516: 3 | E516: =C516*6+D516 -> 15 | G516: 6 | H516: 10 | I516: =G516*6+H516 -> 46 | K516: 9 | L516: 15 | M516: =K516*6+L516 -> 69 | O516: 14 | P516: 18 | Q516: =O516*6+P516 -> 102 | S516: BRUNSWICK
A517: PRAHRAN | C517: 2 | D517: 1 | E517: =C517*6+D517 -> 13 | G517: 2 | H517: 2 | I517: =G517*6+H517 -> 14 | K517: 3 | L517: 7 | M517: =K517*6+L517 -> 25 | O517: 4 | P517: 10 | Q517: =O517*6+P517 -> 34 | S517: McKINNON
A518: BEST PLAYERS
A519: BRUNSWICK | D519: McINERNEY | G519: McNEENY | J519: L HOLFORD | M519: MOORE | O519: STAHL | R519: WYATT
A520: PRAHRAN | D520: COBB | G520: E JONES | J520: HERBERT | M520: C MILLER | O520: BOUSSIE | R520: FERGEUS
A521: GOALKICKERS
A522: BRUNSWICK | D522: McINERNEY 11 | H522: FITZGERALD 2 | L522: MOORE
A523: PRAHRAN | D523: COBB 3 | G523: FERGEUS
A525: NORTH MELBOURNE | C525: 4 | D525: 4 | E525: =C525*6+D525 -> 28 | G525: 4 | H525: 6 | I525: =G525*6+H525 -> 30 | K525: 5 | L525: 8 | M525: =K525*6+L525 -> 38 | O525: 7 | P525: 11 | Q525: =O525*6+P525 -> 53 | S525: NORTH MELB
A526: NORTHCOTE | C526: 1 | D526: 3 | E526: =C526*6+D526 -> 9 | G526: 2 | H526: 6 | I526: =G526*6+H526 -> 18 | K526: 3 | L526: 8 | M526: =K526*6+L526 -> 26 | O526: 6 | P526: 9 | Q526: =O526*6+P526 -> 45 | S526: JENKINS
A527: BEST PLAYERS
A528: NORTH MELBOURNE | D528: SMITH | G528: RUSS | J528: RUTLEY | M528: SHORTEN | P528: GILES | S528: McINTYRE
A529: NORTHCOTE | D529: DIMMICK | G529: HARLEY | J529: SHEEHY | M529: GOUGH | P529: YATES | S529: HOLBROOK
A530: GOALKICKERS
A531: NORTH MELBOURNE | D531: GARDINER 3 | G531: HOCKING | J531: SHORTEN | M531: WATSON | P531: METCALFE
A532: NORTHCOTE | D532: POWELL 2 | G532: SHEEHY 2 | J532: YATES | L532: ROSS
A534: ROUND 12 | E534: 21ST JULY | J534: WEATHER | M534: FINE SOUTH BREEZE | S534: PLAYED AT | X534: LADDER | AB534: ROUND | AD534: 12
D535: 1ST QTR | H535: 2ND QTR | L535: 3RD QTR | P535: FINAL | S535: GLENFERRIE
A536: HAWTHORN | C536: 4 | D536: 0 | E536: =C536*6+D536 -> 24 | G536: 7 | H536: 3 | I536: =G536*6+H536 -> 45 | K536: 9 | L536: 5 | M536: =K536*6+L536 -> 59 | O536: 12 | P536: 10 | Q536: =O536*6+P536 -> 82 | S536: UMPIRE | W536: TEAM | X536: W | Y536: L | Z536: D | AA536: FOR | AB536: AGST | AC536: % | AD536: PTS
A537: PORT MELBOURNE | C537: 3 | D537: 2 | E537: =C537*6+D537 -> 20 | G537: 4 | H537: 3 | I537: =G537*6+H537 -> 27 | K537: 6 | L537: 4 | M537: =K537*6+L537 -> 40 | O537: 7 | P537: 9 | Q537: =O537*6+P537 -> 51 | S537: McKINNON
A538: BEST PLAYERS | W538: FOOTSCRAY | X538: 11 | Y538: 1 | Z538: 0 | AA538: 966 | AB538: 549 | AC538: 175.95628415300547 | AD538: 44
A539: HAWTHORN | D539: JACKSON | G539: FINCH | I539: UTTING | L539: McKENZIE | O539: BROWN | R539: WALTON | W539: PORT MELBOURNE | X539: 9 | Y539: 2 | Z539: 1 | AA539: 860 | AB539: 627 | AC539: 137.16108452950559 | AD539: 38
A540: PORT MELBOURNE | D540: W RUDD | G540: J RUDD | I540: TREMBATH | L540: REES | O540: STANBRIDGE | R540: OGILVIE | W540: BRUNSWICK | X540: 8 | Y540: 3 | Z540: 1 | AA540: 788 | AB540: 667 | AC540: 118.14092953523239 | AD540: 34
A541: GOALKICKERS | W541: HAWTHORN | X541: 8 | Y541: 4 | Z541: 0 | AA541: 875 | AB541: 681 | AC541: 128.48751835535975 | AD541: 32
A542: HAWTHORN | D542: UTTING 3 | F542: LATHAM 3 | I542: BRUCE 2 | K542: GLYNN | M542: LETHLEAN | O542: PEARSON | Q542: WALTON
A543: PORT MELBOURNE | D543: TAYLOR 3 | G543: JAMIESON 2 | K543: KERLEY | M543: OGILVIE | W543: NORTH MELBOURNE | X543: 6 | Y543: 5 | Z543: 1 | AA543: 764 | AB543: 750 | AC543: 101.86666666666666 | AD543: 26
W544: BRIGHTON | X544: 6 | Y544: 6 | Z544: 0 | AA544: 862 | AB544: 838 | AC544: 102.86396181384248 | AD544: 24
A545: FOOTSCRAY | C545: 6 | D545: 3 | E545: =C545*6+D545 -> 39 | G545: 8 | H545: 6 | I545: =G545*6+H545 -> 54 | K545: 12 | L545: 11 | M545: =K545*6+L545 -> 83 | O545: 13 | P545: 15 | Q545: =O545*6+P545 -> 93 | S545: FOOTSCRAY | W545: WILLIAMSTOWN | X545: 6 | Y545: 6 | Z545: 0 | AA545: 731 | AB545: 719 | AC545: 101.66898470097358 | AD545: 24
A546: WILLIAMSTOWN | C546: 1 | D546: 0 | E546: =C546*6+D546 -> 6 | G546: 1 | H546: 2 | I546: =G546*6+H546 -> 8 | K546: 1 | L546: 3 | M546: =K546*6+L546 -> 9 | O546: 4 | P546: 5 | Q546: =O546*6+P546 -> 29 | S546: VALLANCE | W546: PRAHRAN | X546: 2 | Y546: 9 | Z546: 1 | AA546: 557 | AB546: 1035 | AC546: 53.816425120772948 | AD546: 10
A547: BEST PLAYERS | W547: NORTHCOTE | X547: 2 | Y547: 10 | Z547: 0 | AA547: 699 | AB547: 832 | AC547: 84.01442307692308 | AD547: 8
A548: FOOTSCRAY | D548: O'BRIEN | F548: McCARTHY | I548: EASON | L548: McINTYRE | O548: MULLINS | Q548: DOOLAN | W548: GEELONG ASSOC. | X548: 0 | Y548: 12 | Z548: 0 | AA548: 588 | AB548: 992 | AC548: 59.274193548387096 | AD548: 0
A549: WILLIAMSTOWN | D549: GEDDES | F549: SMITH | I549: MILES | L549: CAHILL | O549: LEE | Q549: MARTIN
A550: GOALKICKERS
A551: FOOTSCRAY | D551: O'BRIEN 4 | G551: MULLINS 3 | J551: EASON 2 | M551: McCARTHY 2 | P551: SAMSON | R551: HOWELL
A552: WILLIAMSTOWN | D552: O'HALLORAN | G552: LAXTON | J552: McAULIFFE | M552: GIBBS
A554: NORTH MELBOURNE | C554: 2 | D554: 1 | E554: =C554*6+D554 -> 13 | G554: 7 | H554: 5 | I554: =G554*6+H554 -> 47 | K554: 9 | L554: 10 | M554: =K554*6+L554 -> 64 | O554: 12 | P554: 12 | Q554: =O554*6+P554 -> 84 | S554: TOORAK PARK
A555: PRAHRAN | C555: 1 | D555: 3 | E555: =C555*6+D555 -> 9 | G555: 1 | H555: 3 | I555: =G555*6+H555 -> 9 | K555: 4 | L555: 5 | M555: =K555*6+L555 -> 29 | O555: 5 | P555: 9 | Q555: =O555*6+P555 -> 39 | S555: COLLINS
A556: BEST PLAYERS
A557: NORTH MELBOURNE | D557: SHORTEN | G557: GARDINER | J557: CONSIDINE | M557: METCALFE | P557: WALSH | S557: KIRKLEY
A558: PRAHRAN | D558: C MILLER | G558: LOVE | J558: PURCELL | M558: V JONES | P558: FERGEUS | S558: BOUSSIE
A559: GOALKICKERS
A560: NORTH MELBOURNE | D560: RUTLEY 3 | G560: GARDINER 3 | J560: JOHNSON 2 | M560: CONSIDINE 2 | P560: SHORTEN | R560: METCALFE
A561: PRAHRAN | D561: FERGEUS 3 | G561: LOVE | J561: V JONES
A563: BRIGHTON | C563: 4 | D563: 8 | E563: =C563*6+D563 -> 32 | G563: 6 | H563: 10 | I563: =G563*6+H563 -> 46 | K563: 11 | L563: 13 | M563: =K563*6+L563 -> 79 | O563: 12 | P563: 13 | Q563: =O563*6+P563 -> 85 | S563: BRIGHTON BEACH
A564: NORTHCOTE | C564: 1 | D564: 2 | E564: =C564*6+D564 -> 8 | G564: 4 | H564: 7 | I564: =G564*6+H564 -> 31 | K564: 6 | L564: 8 | M564: =K564*6+L564 -> 44 | O564: 7 | P564: 12 | Q564: =O564*6+P564 -> 54 | S564: CLARKE
A565: BEST PLAYERS
A566: BRIGHTON | D566: LAIRD | G566: PEARSON | J566: HATTAM | M566: SULLIVAN | P566: CHAMPION | S566: HARBOARD
A567: NORTHCOTE | D567: BUISST | G567: JOHNSON | J567: DOWNES | M567: HELLWIG | P567: GOUGH | S567: CASSIDY
A568: GOALKICKERS
A569: BRIGHTON | D569: LAIRD 5 | G569: SULLIVAN 4 | K569: MAU | M569: BOYD | O569: TONKIN
A570: NORTHCOTE | D570: DOWNES 2 | G570: HELLWIG 2 | K570: YATES | M570: ROSS
A572: BRUNSWICK | C572: 3 | D572: 2 | E572: =C572*6+D572 -> 20 | G572: 6 | H572: 7 | I572: =G572*6+H572 -> 43 | K572: 8 | L572: 11 | M572: =K572*6+L572 -> 59 | O572: 8 | P572: 13 | Q572: =O572*6+P572 -> 61 | S572: KARDINIA PARK
A573: GEELONG ASSOC. | C573: 2 | D573: 2 | E573: =C573*6+D573 -> 14 | G573: 5 | H573: 4 | I573: =G573*6+H573 -> 34 | K573: 6 | L573: 5 | M573: =K573*6+L573 -> 41 | O573: 7 | P573: 7 | Q573: =O573*6+P573 -> 49 | S573: CAIN
A574: BEST PLAYERS
A575: BRUNSWICK | D575: RALEIGH | G575: HASSETT | J575: KEOGH | M575: ALESSIO | P575: FITZGERALD | S575: McINERNEY
A576: GEELONG ASSOC. | D576: DIGBY | G576: FINNEGAN | J576: FOWLER | M576: STEPHENS | P576: THORLEY | S576: ELSTON
A577: GOALKICKERS
A578: BRUNSWICK | D578: STAHL 4 | G578: McINERNEY | J578: MOORE | M578: FITZGERALD | P578: MILLEN
A579: GEELONG ASSOC. | D579: WARREN 2 | G579: MOORE 2 | J579: ELSTON | L579: COOPER | O579: CESARI
A581: ROUND 13 | E581: 28TH JULY | J581: WEATHER | M581: CLOUDY NORTH WIND | S581: PLAYED AT | X581: LADDER | AB581: ROUND | AD581: 13
D582: 1ST QTR | H582: 2ND QTR | L582: 3RD QTR | P582: FINAL | S582: BRUNSWICK
A583: BRUNSWICK | C583: 4 | D583: 2 | E583: =C583*6+D583 -> 26 | G583: 7 | H583: 6 | I583: =G583*6+H583 -> 48 | K583: 9 | L583: 7 | M583: =K583*6+L583 -> 61 | O583: 13 | P583: 15 | Q583: =O583*6+P583 -> 93 | S583: UMPIRE | W583: TEAM | X583: W | Y583: L | Z583: D | AA583: FOR | AB583: AGST | AC583: % | AD583: PTS
A584: HAWTHORN | C584: 3 | D584: 4 | E584: =C584*6+D584 -> 22 | G584: 4 | H584: 7 | I584: =G584*6+H584 -> 31 | K584: 5 | L584: 9 | M584: =K584*6+L584 -> 39 | O584: 7 | P584: 10 | Q584: =O584*6+P584 -> 52 | S584: CLARKE
A585: BEST PLAYERS | W585: FOOTSCRAY | X585: 12 | Y585: 1 | Z585: 0 | AA585: 1057 | AB585: 612 | AC585: 172.71241830065358 | AD585: 48
A586: BRUNSWICK | D586: O'CONNOR | G586: FISHER | I586: L HOLFORD | L586: McINERNEY | O586: KEOGH | Q586: STAHL | W586: PORT MELBOURNE | X586: 10 | Y586: 2 | Z586: 1 | AA586: 909 | AB586: 672 | AC586: 135.26785714285714 | AD586: 42
A587: HAWTHORN | D587: BROWN | G587: NOTT | I587: PEARSON | L587: REA | O587: YEOMANS | Q587: McKENZIE | W587: BRUNSWICK | X587: 9 | Y587: 3 | Z587: 1 | AA587: 881 | AB587: 719 | AC587: 122.53129346314326 | AD587: 38
A588: GOALKICKERS | W588: HAWTHORN | X588: 8 | Y588: 5 | Z588: 0 | AA588: 927 | AB588: 774 | AC588: 119.76744186046511 | AD588: 32
A589: BRUNSWICK | D589: L HOLFORD 5 | H589: FISHER 3 | K589: McINERNEY 3 | O589: STAHL | Q589: MOORE
A590: HAWTHORN | D590: LATHAM 4 | H590: YEOMANS 2 | K590: BROWN | W590: WILLIAMSTOWN | X590: 7 | Y590: 6 | Z590: 0 | AA590: 821 | AB590: 749 | AC590: 109.61281708945261 | AD590: 28
W591: NORTH MELBOURNE | X591: 6 | Y591: 6 | Z591: 1 | AA591: 827 | AB591: 841 | AC591: 98.335315101070151 | AD591: 26
A592: FOOTSCRAY | C592: 2 | D592: 3 | E592: =C592*6+D592 -> 15 | G592: 6 | H592: 9 | I592: =G592*6+H592 -> 45 | K592: 7 | L592: 10 | M592: =K592*6+L592 -> 52 | O592: 13 | P592: 13 | Q592: =O592*6+P592 -> 91 | S592: NORTH MELB | W592: BRIGHTON | X592: 6 | Y592: 7 | Z592: 0 | AA592: 907 | AB592: 887 | AC592: 102.25479143179255 | AD592: 24
A593: NORTH MELBOURNE | C593: 2 | D593: 4 | E593: =C593*6+D593 -> 16 | G593: 4 | H593: 5 | I593: =G593*6+H593 -> 29 | K593: 9 | L593: 7 | M593: =K593*6+L593 -> 61 | O593: 9 | P593: 9 | Q593: =O593*6+P593 -> 63 | S593: CAIN | W593: PRAHRAN | X593: 3 | Y593: 9 | Z593: 1 | AA593: 623 | AB593: 1076 | AC593: 57.899628252788105 | AD593: 14
A594: BEST PLAYERS | W594: NORTHCOTE | X594: 2 | Y594: 11 | Z594: 0 | AA594: 740 | AB594: 898 | AC594: 82.405345211581292 | AD594: 8
A595: FOOTSCRAY | D595: McCARTHY | G595: OUTEN | I595: NORDEN | L595: SAMSON | O595: O'BRIEN | R595: EASON | W595: GEELONG ASSOC. | X595: 0 | Y595: 13 | Z595: 0 | AA595: 618 | AB595: 1082 | AC595: 57.116451016635857 | AD595: 0
A596: NORTH MELBOURNE | D596: RUSS | G596: SMITH | I596: LAMBE | L596: LEWIS | O596: TREVASKIS | R596: RUTLEY
A597: GOALKICKERS
A598: FOOTSCRAY | D598: MULLINS 4 | G598: O'BRIEN 4 | J598: EASON 3 | M598: SAMSON | O598: FRASER
A599: NORTH MELBOURNE | D599: METCALFE 2 | G599: GOMEZ 2 | I599: JOHNSON | K599: GARDINER | M599: GILES | O599: RUTLEY | Q599: KIRKLEY
A601: PORT MELBOURNE | C601: 0 | D601: 7 | E601: =C601*6+D601 -> 7 | G601: 1 | H601: 9 | I601: =G601*6+H601 -> 15 | K601: 5 | L601: 10 | M601: =K601*6+L601 -> 40 | O601: 6 | P601: 13 | Q601: =O601*6+P601 -> 49 | S601: BRIGHTON BEACH
A602: BRIGHTON | C602: 0 | D602: 0 | E602: =C602*6+D602 -> 0 | G602: 3 | H602: 3 | I602: =G602*6+H602 -> 21 | K602: 3 | L602: 6 | M602: =K602*6+L602 -> 24 | O602: 6 | P602: 9 | Q602: =O602*6+P602 -> 45 | S602: COLLINS
A603: BEST PLAYERS
A604: PORT MELBOURNE | D604: GARBUTT | G604: STANBRIDGE | J604: W RUDD | M604: TREMBATH | P604: KERLEY | R604: REES
A605: BRIGHTON | D605: HARRIS | G605: LILBURNE | J605: IRWIN | M605: BENCE | P605: N MAU | R605: CARROLL
A606: GOALKICKERS
A607: PORT MELBOURNE | D607: TAYLOR 3 | G607: KERLEY 2 | J607: PASH
A608: BRIGHTON | D608: SULLIVAN 3 | G608: LAIRD 2 | J608: BOYD
A610: PRAHRAN | C610: 1 | D610: 4 | E610: =C610*6+D610 -> 10 | G610: 2 | H610: 5 | I610: =G610*6+H610 -> 17 | K610: 4 | L610: 15 | M610: =K610*6+L610 -> 39 | O610: 8 | P610: 18 | Q610: =O610*6+P610 -> 66 | S610: TOORAK PARK
A611: NORTHCOTE | C611: 2 | D611: 3 | E611: =C611*6+D611 -> 15 | G611: 3 | H611: 9 | I611: =G611*6+H611 -> 27 | K611: 4 | L611: 9 | M611: =K611*6+L611 -> 33 | O611: 5 | P611: 11 | Q611: =O611*6+P611 -> 41 | S611: VALLANCE
A612: BEST PLAYERS
A613: PRAHRAN | D613: V JONES | G613: BAYLISS | J613: PURCELL | M613: SHAND | P613: C MILLER | S613: DUNCAN
A614: NORTHCOTE | D614: DOWNES | G614: HELLWIG | J614: ROSS | M614: HARLEY | P614: YATES | S614: STEPHENSON
A615: GOALKICKERS
A616: PRAHRAN | D616: SHAND 2 | G616: DUNCAN 2 | J616: BAYLISS 2 | M616: GREENWOOD | P616: C MILLER
A617: NORTHCOTE | D617: POWELL | G617: GOUGH | J617: DOWNES | M617: HARLEY | P617: HELLWIG
A619: WILLIAMSTOWN | C619: 5 | D619: 4 | E619: =C619*6+D619 -> 34 | G619: 7 | H619: 5 | I619: =G619*6+H619 -> 47 | K619: 10 | L619: 9 | M619: =K619*6+L619 -> 69 | O619: 13 | P619: 12 | Q619: =O619*6+P619 -> 90 | S619: WILLIAMSTOWN
A620: GEELONG ASSOC. | C620: 1 | D620: 2 | E620: =C620*6+D620 -> 8 | G620: 2 | H620: 4 | I620: =G620*6+H620 -> 16 | K620: 3 | L620: 5 | M620: =K620*6+L620 -> 23 | O620: 4 | P620: 6 | Q620: =O620*6+P620 -> 30 | S620: PANNAM
A621: BEST PLAYERS
A622: WILLIAMSTOWN | D622: KING | G622: CAHILL | J622: HOLTEN | M622: GEDDES | P622: MUNRO | S622: CARPENTER
A623: GEELONG ASSOC. | D623: FINNEGAN | G623: CATIONS | J623: WARREN | M623: WATERHOUSE | P623: ELSTON | S623: STEPHENS
A624: GOALKICKERS
A625: WILLIAMSTOWN | D625: CARPENTER 9 | G625: MUNRO | J625: N McDONALD | M625: MARTIN | P625: LEE
A626: GEELONG ASSOC. | D626: MOORE | G626: WARREN | J626: L STEPHENS | M626: WILLIAMS
A628: ROUND 14 | E628: 4TH AUGUST | H628: WEATHER | K628: COLD SHOWERS N.W. WIND GROUNDS BAD | S628: PLAYED AT | X628: LADDER | AB628: ROUND | AD628: 14
D629: 1ST QTR | H629: 2ND QTR | L629: 3RD QTR | P629: FINAL | S629: FOOTSCRAY
A630: FOOTSCRAY | C630: 5 | D630: 2 | E630: =C630*6+D630 -> 32 | G630: 6 | H630: 5 | I630: =G630*6+H630 -> 41 | K630: 11 | L630: 8 | M630: =K630*6+L630 -> 74 | O630: 12 | P630: 10 | Q630: =O630*6+P630 -> 82 | S630: UMPIRE | W630: TEAM | X630: W | Y630: L | Z630: D | AA630: FOR | AB630: AGST | AC630: % | AD630: PTS
A631: BRUNSWICK | C631: 1 | D631: 2 | E631: =C631*6+D631 -> 8 | G631: 3 | H631: 3 | I631: =G631*6+H631 -> 21 | K631: 3 | L631: 3 | M631: =K631*6+L631 -> 21 | O631: 4 | P631: 7 | Q631: =O631*6+P631 -> 31 | S631: CAIN
A632: BEST PLAYERS | W632: FOOTSCRAY | X632: 13 | Y632: 1 | Z632: 0 | AA632: 1139 | AB632: 643 | AC632: 177.13841368584758 | AD632: 52
A633: FOOTSCRAY | D633: OUTEN | G633: FRASER | J633: EASON | M633: NORDEN | O633: SAMSON | R633: McINTYRE | W633: PORT MELBOURNE | X633: 11 | Y633: 2 | Z633: 1 | AA633: 991 | AB633: 708 | AC633: 139.97175141242937 | AD633: 46
A634: BRUNSWICK | D634: GRIMSTER | G634: J HOLFORD | J634: WILLIAMSON | M634: KEOGH | O634: FITZGERALD | R634: HERBERT | W634: BRUNSWICK | X634: 9 | Y634: 4 | Z634: 1 | AA634: 912 | AB634: 801 | AC634: 113.85767790262172 | AD634: 38
A635: GOALKICKERS | W635: HAWTHORN | X635: 9 | Y635: 5 | Z635: 0 | AA635: 970 | AB635: 802 | AC635: 120.94763092269326 | AD635: 36
A636: FOOTSCRAY | D636: MULLINS 4 | G636: FRASER 3 | J636: EASON 2 | M636: SCANLON | O636: ZINNICK | Q636: HOWELL
A637: BRUNSWICK | D637: McINERNEY 2 | H637: ALESSIO | K637: PENBERTHY | W637: WILLIAMSTOWN | X637: 8 | Y637: 6 | Z637: 0 | AA637: 906 | AB637: 797 | AC637: 113.6762860727729 | AD637: 32
W638: NORTH MELBOURNE | X638: 7 | Y638: 6 | Z638: 1 | AA638: 897 | AB638: 862 | AC638: 104.06032482598607 | AD638: 30
A639: WILLIAMSTOWN | C639: 5 | D639: 3 | E639: =C639*6+D639 -> 33 | G639: 8 | H639: 6 | I639: =G639*6+H639 -> 54 | K639: 10 | L639: 11 | M639: =K639*6+L639 -> 71 | O639: 12 | P639: 13 | Q639: =O639*6+P639 -> 85 | S639: WILLIAMSTOWN | W639: BRIGHTON | X639: 6 | Y639: 8 | Z639: 0 | AA639: 955 | AB639: 972 | AC639: 98.251028806584358 | AD639: 24
A640: BRIGHTON | C640: 3 | D640: 1 | E640: =C640*6+D640 -> 19 | G640: 5 | H640: 2 | I640: =G640*6+H640 -> 32 | K640: 7 | L640: 3 | M640: =K640*6+L640 -> 45 | O640: 7 | P640: 6 | Q640: =O640*6+P640 -> 48 | S640: McKINNON | W640: PRAHRAN | X640: 3 | Y640: 10 | Z640: 1 | AA640: 659 | AB640: 1158 | AC640: 56.908462867012091 | AD640: 14
A641: BEST PLAYERS | W641: NORTHCOTE | X641: 2 | Y641: 12 | Z641: 0 | AA641: 768 | AB641: 941 | AC641: 81.615302869287987 | AD641: 8
A642: WILLIAMSTOWN | D642: MARTIN | G642: KING | I642: STONE | K642: GEDDES | N642: TRUMAN | Q642: CARPENTER | W642: GEELONG ASSOC. | X642: 0 | Y642: 14 | Z642: 0 | AA642: 639 | AB642: 1152 | AC642: 55.46875 | AD642: 0
A643: BRIGHTON | D643: DANGERFIELD | G643: BENCE | I643: CARROLL | K643: HARRIS | N643: HARBOARD | Q643: GARCIA
A644: GOALKICKERS
A645: WILLIAMSTOWN | D645: CARPENTER 5 | G645: TRUMAN 2 | J645: MARTIN 2 | M645: STONE 2 | P645: N McDONALD
A646: BRIGHTON | D646: BOYD 2 | G646: SULLIVAN 2 | J646: WILLIAMS 2 | M646: LAIRD
A648: NORTH MELBOURNE | C648: 1 | D648: 6 | E648: =C648*6+D648 -> 12 | G648: 3 | H648: 8 | I648: =G648*6+H648 -> 26 | K648: 6 | L648: 14 | M648: =K648*6+L648 -> 50 | O648: 9 | P648: 16 | Q648: =O648*6+P648 -> 70 | S648: NORTH MELB
A649: GEELONG ASSOC. | C649: 0 | D649: 2 | E649: =C649*6+D649 -> 2 | G649: 2 | H649: 5 | I649: =G649*6+H649 -> 17 | K649: 2 | L649: 6 | M649: =K649*6+L649 -> 18 | O649: 2 | P649: 9 | Q649: =O649*6+P649 -> 21 | S649: JONES
A650: BEST PLAYERS
A651: NORTH MELBOURNE | D651: GILES | G651: METCALFE | J651: RUTLEY | M651: WALSH | O651: GARDINER | R651: HALL
A652: GEELONG ASSOC. | D652: CATIONS | G652: CESARI | J652: FINNEGAN | M652: WARREN | O652: WEARMOUTH | R652: DIGBY
A653: GOALKICKERS
A654: NORTH MELBOURNE | D654: GARDINER 4 | G654: HALL 3 | J654: RUTLEY | M654: METCALFE
A655: GEELONG ASSOC. | D655: WARREN | G655: L STEPHENS
A657: HAWTHORN | C657: 2 | D657: 4 | E657: =C657*6+D657 -> 16 | G657: 4 | H657: 5 | I657: =G657*6+H657 -> 29 | K657: 5 | L657: 5 | M657: =K657*6+L657 -> 35 | O657: 6 | P657: 7 | Q657: =O657*6+P657 -> 43 | S657: GLENFERRIE
A658: NORTHCOTE | C658: 1 | D658: 2 | E658: =C658*6+D658 -> 8 | G658: 2 | H658: 3 | I658: =G658*6+H658 -> 15 | K658: 3 | L658: 4 | M658: =K658*6+L658 -> 22 | O658: 4 | P658: 4 | Q658: =O658*6+P658 -> 28 | S658: JENKINS
A659: BEST PLAYERS
A660: HAWTHORN | D660: SPLATT | G660: LATHAM | J660: UTTING | M660: PEARSON | O660: YEOMANS | R660: LETHLEAN
A661: NORTHCOTE | D661: POWELL | G661: BUISST | J661: HELLWIG | M661: S YATES | O661: WOODS | R661: P YATES
A662: GOALKICKERS
A663: HAWTHORN | D663: LETHLEAN | G663: UTTING | J663: PEARSON | M663: REA | O663: YEOMANS | R663: LATHAM
A664: NORTHCOTE | D664: HELLWIG 3 | G664: S YATES
A666: PORT MELBOURNE | C666: 5 | D666: 9 | E666: =C666*6+D666 -> 39 | G666: 6 | H666: 16 | I666: =G666*6+H666 -> 52 | K666: 8 | L666: 20 | M666: =K666*6+L666 -> 68 | O666: 10 | P666: 22 | Q666: =O666*6+P666 -> 82 | S666: PORT MELB
A667: PRAHRAN | C667: 0 | D667: 2 | E667: =C667*6+D667 -> 2 | G667: 5 | H667: 4 | I667: =G667*6+H667 -> 34 | K667: 5 | L667: 5 | M667: =K667*6+L667 -> 35 | O667: 5 | P667: 6 | Q667: =O667*6+P667 -> 36 | S667: COLLINS
A668: BEST PLAYERS
A669: PORT MELBOURNE | D669: BARFOOT | G669: GARBUTT | J669: REES | M669: JOHNSON | O669: J RUDD | R669: KERLEY
A670: PRAHRAN | D670: SPRAGUE | G670: PURCELL | J670: SHAND | M670: BAYLISS | O670: ROBERTS | R670: V JONES
A671: GOALKICKERS
A672: PORT MELBOURNE | D672: KERLEY 3 | G672: TAYLOR 2 | J672: J RUDD | L672: REES | N672: SKILTON | P672: JAMIESON | S672: BARFOOT
A673: PRAHRAN | D673: SPRAGUE 2 | G673: BAYLISS 2 | J673: BOUSSIE
A675: ROUND 15 | E675: 11TH AUGUST | J675: WEATHER | M675: FINE | S675: PLAYED AT | X675: LADDER | AB675: ROUND | AD675: 15
D676: 1ST QTR | H676: 2ND QTR | L676: 3RD QTR | P676: FINAL | S676: BRUNSWICK
A677: WILLIAMSTOWN | C677: 1 | D677: 3 | E677: =C677*6+D677 -> 9 | G677: 4 | H677: 4 | I677: =G677*6+H677 -> 28 | K677: 8 | L677: 6 | M677: =K677*6+L677 -> 54 | O677: 12 | P677: 13 | Q677: =O677*6+P677 -> 85 | S677: UMPIRE | W677: TEAM | X677: W | Y677: L | Z677: D | AA677: FOR | AB677: AGST | AC677: % | AD677: PTS
A678: BRUNSWICK | C678: 3 | D678: 2 | E678: =C678*6+D678 -> 20 | G678: 4 | H678: 2 | I678: =G678*6+H678 -> 26 | K678: 5 | L678: 3 | M678: =K678*6+L678 -> 33 | O678: 6 | P678: 5 | Q678: =O678*6+P678 -> 41 | S678: JENKINS
A679: BEST PLAYERS | W679: FOOTSCRAY | X679: 14 | Y679: 1 | Z679: 0 | AA679: 1213 | AB679: 684 | AC679: 177.33918128654972 | AD679: 56
A680: WILLIAMSTOWN | D680: HOLTEN | G680: MARTIN | J680: CARPENTER | M680: MILES | O680: TRUMAN | Q680: NEWTON | W680: PORT MELBOURNE | X680: 12 | Y680: 2 | Z680: 1 | AA680: 1064 | AB680: 759 | AC680: 140.1844532279315 | AD680: 50
A681: BRUNSWICK | D681: J HOLFORD | G681: FITZGERALD | J681: WILLIAMSON | M681: R HOLFORD | O681: RALEIGH | Q681: HASSETT | W681: HAWTHORN | X681: 10 | Y681: 5 | Z681: 0 | AA681: 1070 | AB681: 847 | AC681: 126.32821723730815 | AD681: 40
A682: GOALKICKERS | W682: BRUNSWICK | X682: 9 | Y682: 5 | Z682: 1 | AA682: 953 | AB682: 886 | AC682: 107.56207674943566 | AD682: 38
A683: WILLIAMSTOWN | D683: CARPENTER 4 | G683: MARTIN 4 | J683: NEWTON 2 | M683: TRUMAN | O683: MUNRO
A684: BRUNSWICK | D684: L HOLFORD 2 | G684: KEOGH | I684: RAYMOND | K684: McINERNEY | N684: HERBERT | W684: WILLIAMSTOWN | X684: 9 | Y684: 6 | Z684: 0 | AA684: 991 | AB684: 838 | AC684: 118.25775656324582 | AD684: 36
W685: NORTH MELBOURNE | X685: 7 | Y685: 7 | Z685: 1 | AA685: 942 | AB685: 962 | AC685: 97.92099792099792 | AD685: 30
A686: HAWTHORN | C686: 5 | D686: 0 | E686: =C686*6+D686 -> 30 | G686: 9 | H686: 8 | I686: =G686*6+H686 -> 62 | K686: 10 | L686: 11 | M686: =K686*6+L686 -> 71 | O686: 14 | P686: 16 | Q686: =O686*6+P686 -> 100 | S686: GLENFERRIE | W686: BRIGHTON | X686: 7 | Y686: 8 | Z686: 0 | AA686: 1026 | AB686: 1041 | AC686: 98.559077809798268 | AD686: 28
A687: NORTH MELBOURNE | C687: 0 | D687: 5 | E687: =C687*6+D687 -> 5 | G687: 4 | H687: 7 | I687: =G687*6+H687 -> 31 | K687: 5 | L687: 8 | M687: =K687*6+L687 -> 38 | O687: 6 | P687: 9 | Q687: =O687*6+P687 -> 45 | S687: COLLINS | W687: PRAHRAN | X687: 3 | Y687: 11 | Z687: 1 | AA687: 728 | AB687: 1229 | AC687: 59.235150528885271 | AD687: 14
A688: BEST PLAYERS | W688: NORTHCOTE | X688: 2 | Y688: 13 | Z688: 0 | AA688: 819 | AB688: 1014 | AC688: 80.769230769230774 | AD688: 8
A689: HAWTHORN | D689: GILL | G689: GLYNN | I689: JACKSON | L689: LATHAM | N689: LYNCH | Q689: UTTING | W689: GEELONG ASSOC. | X689: 0 | Y689: 15 | Z689: 0 | AA689: 680 | AB689: 1226 | AC689: 55.464926590538333 | AD689: 0
A690: NORTH MELBOURNE | D690: LEWIS | G690: LINTON | I690: RUSS | L690: TREVASKIS | N690: WALSH | Q690: WATSON
A691: GOALKICKERS
A692: HAWTHORN | D692: LATHAM 4 | G692: UTTING 2 | I692: BRUCE 2 | K692: LETHLEAN 2 | N692: NOTT 2 | P692: PEARSON | R692: SPLATT
A693: NORTH MELBOURNE | D693: RUTLEY 2 | G693: HALL | I693: CONSIDINE | K693: LEWIS | M693: GILES
A695: BRIGHTON | C695: 2 | D695: 1 | E695: =C695*6+D695 -> 13 | G695: 6 | H695: 4 | I695: =G695*6+H695 -> 40 | K695: 8 | L695: 8 | M695: =K695*6+L695 -> 56 | O695: 10 | P695: 11 | Q695: =O695*6+P695 -> 71 | S695: TOORAK PARK
A696: PRAHRAN | C696: 5 | D696: 0 | E696: =C696*6+D696 -> 30 | G696: 7 | H696: 1 | I696: =G696*6+H696 -> 43 | K696: 9 | L696: 2 | M696: =K696*6+L696 -> 56 | O696: 11 | P696: 3 | Q696: =O696*6+P696 -> 69 | S696: CAIN
A697: BEST PLAYERS
A698: BRIGHTON | D698: CARROLL | G698: LILBURNE | J698: BENCE | M698: MATTHEWS | P698: HARRIS | S698: GRAHAM
A699: PRAHRAN | D699: A MILLER | G699: C MILLER | J699: FERGEUS | M699: O'MEARA | P699: DUNCAN | S699: THOMAS
A700: GOALKICKERS
A701: BRIGHTON | D701: LILBURN 4 | G701: WILLIAMS 2 | J701: GRAHAM 2 | M701: HARRIS | O701: BENCE
A702: PRAHRAN | D702: FERGEUS 2 | F702: A MILLER 2 | I702: O'MEARA | K702: SHAND | M702: LOVE | O702: DUNCAN | Q702: C MILLER | S702: THOMAS
A704: PORT MELBOURNE | C704: 2 | D704: 6 | E704: =C704*6+D704 -> 18 | G704: 2 | H704: 10 | I704: =G704*6+H704 -> 22 | K704: 6 | L704: 16 | M704: =K704*6+L704 -> 52 | O704: 9 | P704: 19 | Q704: =O704*6+P704 -> 73 | S704: NORTHCOTE
A705: NORTHCOTE | C705: 1 | D705: 1 | E705: =C705*6+D705 -> 7 | G705: 4 | H705: 4 | I705: =G705*6+H705 -> 28 | K705: 5 | L705: 8 | M705: =K705*6+L705 -> 38 | O705: 7 | P705: 9 | Q705: =O705*6+P705 -> 51 | S705: JONES
A706: BEST PLAYERS
A707: PORT MELBOURNE | D707: STANBRIDGE | G707: REES | J707: BARFOOT | M707: BISSETT | P707: SKILTON | S707: GARBUTT
A708: NORTHCOTE | D708: HOLBROOK | G708: DOWNES | J708: HELLWIG | M708: ROSS | P708: WOODS | S708: SHEEHY
A709: GOALKICKERS
A710: PORT MELBOURNE | D710: J RUDD 2 | G710: BARFOOT 2 | J710: TASKER | L710: STANBRIDGE | O710: CRUDDEN | R710: REES
A711: NORTHCOTE | D711: HOLBROOK 3 | G711: HELLWIG 2 | J711: McCASKER | M711: GIBBS
A713: FOOTSCRAY | C713: 3 | D713: 1 | E713: =C713*6+D713 -> 19 | G713: 5 | H713: 2 | I713: =G713*6+H713 -> 32 | K713: 7 | L713: 7 | M713: =K713*6+L713 -> 49 | O713: 11 | P713: 8 | Q713: =O713*6+P713 -> 74 | S713: KARDINIA PARK
A714: GEELONG ASSOC. | C714: 2 | D714: 0 | E714: =C714*6+D714 -> 12 | G714: 2 | H714: 2 | I714: =G714*6+H714 -> 14 | K714: 3 | L714: 4 | M714: =K714*6+L714 -> 22 | O714: 6 | P714: 5 | Q714: =O714*6+P714 -> 41 | S714: McKINNON
A715: BEST PLAYERS
A716: FOOTSCRAY | D716: MORDEN | G716: DOOLAN | J716: McINTYRE | M716: FORD | O716: C GRIERSON | R716: MULLINS
A717: GEELONG ASSOC. | D717: ELSTON | G717: FINNEGAN | J717: WEARMOUTH | M717: WARREN | O717: T KERVIN | R717: CATIONS
A718: GOALKICKERS
A719: FOOTSCRAY | D719: MULLINS 4 | G719: O'BRIEN 2 | J719: GIBB | L719: SCANLON | O719: WOODMAN | R719: McCARTHY | U719: HOWELL
A720: GEELONG ASSOC. | D720: COOPER 2 | G720: WATERHOUSE | J720: ELSTON | L720: WARREN | N720: WEARMOUTH
A722: ROUND 16 | E722: 18TH AUGUST | J722: WEATHER | M722: FINE | S722: PLAYED AT | X722: LADDER | AB722: ROUND | AD722: 16
D723: 1ST QTR | H723: 2ND QTR | L723: 3RD QTR | P723: FINAL | S723: PORT MELB
A724: PORT MELBOURNE | C724: 4 | D724: 6 | E724: =C724*6+D724 -> 30 | G724: 8 | H724: 9 | I724: =G724*6+H724 -> 57 | K724: 12 | L724: 14 | M724: =K724*6+L724 -> 86 | O724: 13 | P724: 20 | Q724: =O724*6+P724 -> 98 | S724: UMPIRE | W724: TEAM | X724: W | Y724: L | Z724: D | AA724: FOR | AB724: AGST | AC724: % | AD724: PTS
A725: FOOTSCRAY | C725: 2 | D725: 1 | E725: =C725*6+D725 -> 13 | G725: 6 | H725: 3 | I725: =G725*6+H725 -> 39 | K725: 7 | L725: 6 | M725: =K725*6+L725 -> 48 | O725: 9 | P725: 12 | Q725: =O725*6+P725 -> 66 | S725: McKINNON
A726: BEST PLAYERS | W726: FOOTSCRAY | X726: 14 | Y726: 2 | Z726: 0 | AA726: 1279 | AB726: 782 | AC726: 163.55498721227622 | AD726: 56
A727: PORT MELBOURNE | D727: OGILVIE | F727: STANBRIDGE | I727: BARFOOT | L727: GARBUTT | O727: KERLEY | Q727: J RUDD | W727: PORT MELBOURNE | X727: 13 | Y727: 2 | Z727: 1 | AA727: 1162 | AB727: 825 | AC727: 140.84848484848484 | AD727: 54
A728: FOOTSCRAY | D728: McCARTHY | F728: DOOLAN | I728: SIVVIES | L728: NEILSON | O728: FRASER | Q728: EASON | W728: WILLIAMSTOWN | X728: 10 | Y728: 6 | Z728: 0 | AA728: 1056 | AB728: 870 | AC728: 121.37931034482759 | AD728: 40
A729: GOALKICKERS | W729: HAWTHORN | X729: 10 | Y729: 6 | Z729: 0 | AA729: 1102 | AB729: 912 | AC729: 120.83333333333333 | AD729: 40
A730: PORT MELBOURNE | D730: TAYLOR 5 | G730: KERLEY 3 | I730: DOBRIGH | K730: PASH | M730: W RUDD | O730: CRUDDEN | Q730: STANBRIDGE
A731: FOOTSCRAY | D731: FRASER 3 | G731: McCARTHY 2 | J731: SMITH 2 | M731: HOLDEN 2 | W731: BRUNSWICK | X731: 9 | Y731: 6 | Z731: 1 | AA731: 1009 | AB731: 943 | AC731: 106.99893955461293 | AD731: 38
W732: NORTH MELBOURNE | X732: 8 | Y732: 7 | Z732: 1 | AA732: 1011 | AB732: 1017 | AC732: 99.410029498525077 | AD732: 34
A733: WILLIAMSTOWN | C733: 4 | D733: 6 | E733: =C733*6+D733 -> 30 | G733: 4 | H733: 8 | I733: =G733*6+H733 -> 32 | K733: 7 | L733: 13 | M733: =K733*6+L733 -> 55 | O733: 8 | P733: 17 | Q733: =O733*6+P733 -> 65 | S733: WILLIAMSTOWN | W733: BRIGHTON | X733: 7 | Y733: 9 | Z733: 0 | AA733: 1081 | AB733: 1110 | AC733: 97.387387387387392 | AD733: 28
A734: HAWTHORN | C734: 2 | D734: 0 | E734: =C734*6+D734 -> 12 | G734: 4 | H734: 2 | I734: =G734*6+H734 -> 26 | K734: 4 | L734: 5 | M734: =K734*6+L734 -> 29 | O734: 4 | P734: 8 | Q734: =O734*6+P734 -> 32 | S734: VALLANCE | W734: PRAHRAN | X734: 3 | Y734: 12 | Z734: 1 | AA734: 760 | AB734: 1287 | AC734: 59.05205905205905 | AD734: 14
A735: BEST PLAYERS | W735: NORTHCOTE | X735: 3 | Y735: 13 | Z735: 0 | AA735: 876 | AB735: 1070 | AC735: 81.869158878504678 | AD735: 12
A736: WILLIAMSTOWN | D736: MARTIN | G736: GEDDES | I736: KING | L736: O'HALLORAN | O736: LEE | Q736: HOLTEN | W736: GEELONG ASSOC. | X736: 1 | Y736: 15 | Z736: 0 | AA736: 738 | AB736: 1258 | AC736: 58.664546899841021 | AD736: 4
A737: HAWTHORN | D737: WALTON | G737: GILL | I737: BROWN | L737: JACKSON | O737: McKENZIE | Q737: GRIFFITHS
A738: GOALKICKERS
A739: WILLIAMSTOWN | D739: LEE 3 | G739: N McDONALD 2 | K739: CARPENTER 2 | O739: MUNRO
A740: HAWTHORN | D740: YEOMANS | G740: BROWN | J740: SPLATT | M740: LATHAM
A742: NORTH MELBOURNE | C742: 3 | D742: 3 | E742: =C742*6+D742 -> 21 | G742: 5 | H742: 6 | I742: =G742*6+H742 -> 36 | K742: 9 | L742: 8 | M742: =K742*6+L742 -> 62 | O742: 10 | P742: 9 | Q742: =O742*6+P742 -> 69 | S742: BRIGHTON BEACH
A743: BRIGHTON | C743: 2 | D743: 1 | E743: =C743*6+D743 -> 13 | G743: 3 | H743: 7 | I743: =G743*6+H743 -> 25 | K743: 4 | L743: 10 | M743: =K743*6+L743 -> 34 | O743: 7 | P743: 13 | Q743: =O743*6+P743 -> 55 | S743: SINCLAIR
A744: BEST PLAYERS
A745: NORTH MELBOURNE | D745: JOHNSON | G745: LEWIS | J745: METCALFE | M745: HALL | O745: CONSIDINE | R745: RUTLEY
A746: BRIGHTON | D746: HATTAM | G746: IRWIN | J746: PEARSON | M746: LILBURNE | O746: DANGERFIELD | R746: REARDON
A747: GOALKICKERS
A748: NORTH MELBOURNE | D748: KIRKLEY 3 | G748: METCALFE 2 | J748: LEWIS | L748: GARDINER | O748: SMITH | Q748: CONSIDINE | T748: RUTLEY
A749: BRIGHTON | D749: IRWIN 2 | G749: SULLIVAN | J749: BENCE | L749: WILLIAMS | O749: LYNCH | Q749: TONKIN
A751: GEELONG ASSOC. | C751: 2 | D751: 3 | E751: =C751*6+D751 -> 15 | G751: 4 | H751: 6 | I751: =G751*6+H751 -> 30 | K751: 5 | L751: 9 | M751: =K751*6+L751 -> 39 | O751: 8 | P751: 10 | Q751: =O751*6+P751 -> 58 | S751: KARDINIA PARK
A752: PRAHRAN | C752: 1 | D752: 3 | E752: =C752*6+D752 -> 9 | G752: 2 | H752: 4 | I752: =G752*6+H752 -> 16 | K752: 2 | L752: 7 | M752: =K752*6+L752 -> 19 | O752: 4 | P752: 8 | Q752: =O752*6+P752 -> 32 | S752: JONES
A753: BEST PLAYERS
A754: GEELONG ASSOC. | D754: FINNEGAN | G754: CATIONS | J754: FOWLER | M754: S STEPHENS | P754: COOPER | R754: ELSTON
A755: PRAHRAN | D755: PURCELL | G755: N MILLER | J755: SPRAGUE | M755: MORONEY | P755: SHAND | R755: BOUSSIE
A756: GOALKICKERS
A757: GEELONG ASSOC. | D757: COOPER 5 | G757: L STEPHENS 3
A758: PRAHRAN | D758: FERGEUS | G758: DUNCAN | J758: MORONEY | M758: A MILLER
A760: NORTHCOTE | C760: 2 | D760: 4 | E760: =C760*6+D760 -> 16 | G760: 5 | H760: 4 | I760: =G760*6+H760 -> 34 | K760: 6 | L760: 7 | M760: =K760*6+L760 -> 43 | O760: 8 | P760: 9 | Q760: =O760*6+P760 -> 57 | S760: BRUNSWICK
A761: BRUNSWICK | C761: 1 | D761: 2 | E761: =C761*6+D761 -> 8 | G761: 3 | H761: 4 | I761: =G761*6+H761 -> 22 | K761: 5 | L761: 8 | M761: =K761*6+L761 -> 38 | O761: 7 | P761: 14 | Q761: =O761*6+P761 -> 56 | S761: CAIN
A762: BEST PLAYERS
A763: NORTHCOTE | D763: ROSS | G763: STEPHENSON | J763: SMITH | M763: HOLBROOK | P763: HELLWIG | R763: S YATES
A764: BRUNSWICK | D764: J HOLFORD | G764: ALESSIO | J764: RALEIGH | M764: RAYMOND | P764: L HOLFORD | R764: McINERNEY
A765: GOALKICKERS
A766: NORTHCOTE | D766: HELLWIG 2 | G766: SMITH 2 | J766: HOLBROOK 2 | M766: S YATES
A767: BRUNSWICK | D767: FITZGERALD 3 | H767: FISHER 2 | K767: L HOLFORD | N767: McINERNEY
A769: ROUND 17 | E769: 25TH AUGUST | J769: WEATHER | N769: FINE MILD | S769: PLAYED AT | X769: LADDER | AB769: ROUND | AD769: 17
D770: 1ST QTR | H770: 2ND QTR | L770: 3RD QTR | P770: FINAL | S770: NORTH MELB
A771: NORTH MELBOURNE | C771: 4 | D771: 3 | E771: =C771*6+D771 -> 27 | G771: 8 | H771: 4 | I771: =G771*6+H771 -> 52 | K771: 10 | L771: 8 | M771: =K771*6+L771 -> 68 | O771: 12 | P771: 9 | Q771: =O771*6+P771 -> 81 | S771: UMPIRE | W771: TEAM | X771: W | Y771: L | Z771: D | AA771: FOR | AB771: AGST | AC771: % | AD771: PTS
A772: BRUNSWICK | C772: 1 | D772: 4 | E772: =C772*6+D772 -> 10 | G772: 3 | H772: 7 | I772: =G772*6+H772 -> 25 | K772: 5 | L772: 13 | M772: =K772*6+L772 -> 43 | O772: 7 | P772: 18 | Q772: =O772*6+P772 -> 60 | S772: JONES
A773: BEST PLAYERS | W773: FOOTSCRAY | X773: 15 | Y773: 2 | Z773: 0 | AA773: 1367 | AB773: 854 | AC773: 160.07025761124123 | AD773: 60
A774: NORTH MELBOURNE | D774: LEWIS | F774: METCALFE | I774: LINTON | K774: MEEKING | N774: W SMITH | Q774: GOMEZ | W774: PORT MELBOURNE | X774: 14 | Y774: 2 | Z774: 1 | AA774: 1312 | AB774: 869 | AC774: 150.981726122 | AD774: 58
A775: BRUNSWICK | D775: RALEIGH | F775: J HOLFORD | I775: MILLEN | K775: ROBERTS | N775: MOORE | Q775: HASSETT | W775: HAWTHORN | X775: 11 | Y775: 6 | Z775: 0 | AA775: 1190 | AB775: 958 | AC775: 124.21711899791232 | AD775: 44
A776: GOALKICKERS | W776: WILLIAMSTOWN | X776: 11 | Y776: 6 | Z776: 0 | AA776: 1133 | AB776: 914 | AC776: 123.96061269146608 | AD776: 44
A777: NORTH MELBOURNE | D777: METCALFE 5 | G777: LEWIS 3 | J777: CONSIDINE 2 | M777: RUTLEY | O777: JOHNSON
A778: BRUNSWICK | D778: HADLEY 2 | G778: MILLEN 2 | J778: FISHER | L778: O'CONNOR | O778: McINERNEY | W778: BRUNSWICK | X778: 9 | Y778: 7 | Z778: 1 | AA778: 1069 | AB778: 1024 | AC778: 104.39453125 | AD778: 38
W779: NORTH MELBOURNE | X779: 9 | Y779: 7 | Z779: 1 | AA779: 1092 | AB779: 1077 | AC779: 101.39275766016713 | AD779: 38
A780: FOOTSCRAY | C780: 2 | D780: 4 | E780: =C780*6+D780 -> 16 | G780: 6 | H780: 11 | I780: =G780*6+H780 -> 47 | K780: 10 | L780: 14 | M780: =K780*6+L780 -> 74 | O780: 12 | P780: 16 | Q780: =O780*6+P780 -> 88 | S780: FOOTSCRAY | W780: BRIGHTON | X780: 7 | Y780: 10 | Z780: 0 | AA780: 1153 | AB780: 1198 | AC780: 96.243739565943244 | AD780: 28
A781: BRIGHTON | C781: 2 | D781: 5 | E781: =C781*6+D781 -> 17 | G781: 4 | H781: 7 | I781: =G781*6+H781 -> 31 | K781: 8 | L781: 8 | M781: =K781*6+L781 -> 56 | O781: 10 | P781: 12 | Q781: =O781*6+P781 -> 72 | S781: SINCLAIR | W781: PRAHRAN | X781: 3 | Y781: 13 | Z781: 1 | AA781: 806 | AB781: 1375 | AC781: 58.618181818181817 | AD781: 14
A782: BEST PLAYERS | W782: NORTHCOTE | X782: 3 | Y782: 14 | Z782: 0 | AA782: 920 | AB782: 1147 | AC782: 80.209241499564087 | AD782: 12
A783: FOOTSCRAY | D783: EASON | F783: HOWELL | I783: McCARTHY | L783: MULLINS | O783: O'BRIEN | R783: FRASER | W783: GEELONG ASSOC. | X783: 1 | Y783: 16 | Z783: 0 | AA783: 782 | AB783: 1408 | AC783: 55.54 | AD783: 4
A784: BRIGHTON | D784: HARRIS | F784: PEARSON | I784: LILBURNE | L784: SULLIVAN | O784: HARBOARD | R784: HATTAM
A785: GOALKICKERS
A786: FOOTSCRAY | D786: O'BRIEN 5 | F786: MULLINS 3 | I786: G WOODMAN 2 | L786: McCARTHY | O786: HOWELL
A787: BRIGHTON | D787: IRWIN 6 | G787: BOYD 2 | J787: BENCE | L787: LILBURN
A789: HAWTHORN | C789: 2 | D789: 7 | E789: =C789*6+D789 -> 19 | G789: 6 | H789: 13 | I789: =G789*6+H789 -> 49 | K789: 10 | L789: 20 | M789: =K789*6+L789 -> 80 | O789: 11 | P789: 22 | Q789: =O789*6+P789 -> 88 | S789: GLENFERRIE
A790: PRAHRAN | C790: 1 | D790: 4 | E790: =C790*6+D790 -> 10 | G790: 3 | H790: 5 | I790: =G790*6+H790 -> 23 | K790: 5 | L790: 7 | M790: =K790*6+L790 -> 37 | O790: 6 | P790: 10 | Q790: =O790*6+P790 -> 46 | S790: COLLINS
A791: BEST PLAYERS
A792: HAWTHORN | D792: HAMMOND | G792: SPLATT | J792: UTTING | M792: PEARSON | P792: YEOMANS | S792: LETHLEAN
A793: PRAHRAN | D793: N MILLER | G793: SPRAGUE | J793: BOUSSIE | M793: FERGEUS | P793: V JONES | S793: MORONEY
A794: GOALKICKERS
A795: HAWTHORN | D795: UTTING 6 | G795: REA 2 | J795: GILL | L795: WALTON | N795: BRUCE
A796: PRAHRAN | D796: A MILLER 2 | H796: DUNCAN | K796: SHAND | M796: N MILLER
A798: WILLIAMSTOWN | C798: 0 | D798: 4 | E798: =C798*6+D798 -> 4 | G798: 6 | H798: 6 | I798: =G798*6+H798 -> 42 | K798: 8 | L798: 10 | M798: =K798*6+L798 -> 58 | O798: 11 | P798: 11 | Q798: =O798*6+P798 -> 77 | S798: NORTHCOTE
A799: NORTHCOTE | C799: 0 | D799: 2 | E799: =C799*6+D799 -> 2 | G799: 1 | H799: 6 | I799: =G799*6+H799 -> 12 | K799: 1 | L799: 6 | M799: =K799*6+L799 -> 12 | O799: 6 | P799: 8 | Q799: =O799*6+P799 -> 44 | S799: VALLANCE
A800: BEST PLAYERS
A801: WILLIAMSTOWN | D801: O'HALLORAN | G801: KING | J801: HOLTEN | M801: GEDDES | P801: MARTIN | S801: J McDONALD
A802: NORTHCOTE | D802: ROSS | G802: BUISST | J802: SHEEHY | M802: DIMMICK | P802: HELLWIG | S802: S YATES
A803: GOALKICKERS
A804: WILLIAMSTOWN | D804: CARPENTER 7 | H804: GEDDES 2 | K804: THOMPSON 2
A805: NORTHCOTE | D805: DIMMICK 2 | G805: P YATES 2 | J805: STEPHENSON | M805: S YATES
A807: PORT MELBOURNE | C807: 5 | D807: 4 | E807: =C807*6+D807 -> 34 | G807: 12 | H807: 7 | I807: =G807*6+H807 -> 79 | K807: 14 | L807: 9 | M807: =K807*6+L807 -> 93 | O807: 22 | P807: 18 | Q807: =O807*6+P807 -> 150 | S807: PORT MELB
A808: GEELONG ASSOC. | C808: 2 | D808: 2 | E808: =C808*6+D808 -> 14 | G808: 3 | H808: 3 | I808: =G808*6+H808 -> 21 | K808: 4 | L808: 12 | M808: =K808*6+L808 -> 36 | O808: 5 | P808: 14 | Q808: =O808*6+P808 -> 44 | S808: CLARKE
A809: BEST PLAYERS
A810: PORT MELBOURNE | D810: BARFOOT | G810: W RUDD | J810: TAYLOR | M810: OGILVIE | P810: ENNIS | R810: GARBUTT
A811: GEELONG ASSOC. | D811: SPENDLOVE | G811: WEARMOUTH | J811: L STEPHENS | M811: ELSTON | P811: DIGBY | R811: CESARI
A812: GOALKICKERS
A813: PORT MELBOURNE | D813: TAYLOR 10 | G813: OGILVIE 4 | J813: ENNIS 4 | M813: SKILTON | O813: JAMIESON | Q813: BARFOOT | T813: STANBRIDGE
A814: GEELONG ASSOC. | D814: BIRCH | G814: WEARMOUTH | J814: ELSTON | L814: WARREN | N814: COOPER
A816: ROUND 18 | E816: 1ST SEPTEMBER | J816: WEATHER | M816: FINE | S816: PLAYED AT | X816: LADDER | AB816: ROUND | AD816: 18
D817: 1ST QTR | H817: 2ND QTR | L817: 3RD QTR | P817: FINAL | S817: PORT MELB
A818: PORT MELBOURNE | C818: 2 | D818: 5 | E818: =C818*6+D818 -> 17 | G818: 5 | H818: 10 | I818: =G818*6+H818 -> 40 | K818: 9 | L818: 16 | M818: =K818*6+L818 -> 70 | O818: 11 | P818: 20 | Q818: =O818*6+P818 -> 86 | S818: UMPIRE | W818: TEAM | X818: W | Y818: L | Z818: D | AA818: FOR | AB818: AGST | AC818: % | AD818: PTS
A819: BRUNSWICK | C819: 2 | D819: 4 | E819: =C819*6+D819 -> 16 | G819: 5 | H819: 10 | I819: =G819*6+H819 -> 40 | K819: 6 | L819: 11 | M819: =K819*6+L819 -> 47 | O819: 7 | P819: 19 | Q819: =O819*6+P819 -> 61 | S819: VALLANCE
A820: BEST PLAYERS | W820: FOOTSCRAY | X820: 16 | Y820: 2 | Z820: 0 | AA820: 1527 | AB820: 908 | AC820: 168.17180616740089 | AD820: 64
A821: PORT MELBOURNE | D821: BARFOOT | G821: REES | I821: J RUDD | L821: JOHNSON | N821: DOBRIGH | Q821: STANBRIDGE | W821: PORT MELBOURNE | X821: 15 | Y821: 2 | Z821: 1 | AA821: 1398 | AB821: 930 | AC821: 150.32 | AD821: 62
A822: BRUNSWICK | D822: FITZGERALD | G822: MILLEN | I822: J HOLFORD | L822: HASSETT | N822: FISHER | Q822: McINERNEY | W822: WILLIAMSTOWN | X822: 12 | Y822: 6 | Z822: 0 | AA822: 1188 | AB822: 966 | AC822: 122.98136645962732 | AD822: 48
A823: GOALKICKERS | W823: HAWTHORN | X823: 11 | Y823: 7 | Z823: 0 | AA823: 1229 | AB823: 1024 | AC823: 120.01953125 | AD823: 44
A824: PORT MELBOURNE | D824: TAYLOR 5 | G824: KERLEY 2 | I824: J RUDD 2 | K824: SKILTON | M824: STANBRIDGE
A825: BRUNSWICK | D825: McMAHON 2 | G825: FITZGERALD 2 | J825: McINERNEY 2 | M825: HADLEY | W825: BRUNSWICK | X825: 9 | Y825: 8 | Z825: 1 | AA825: 1130 | AB825: 1110 | AC825: 101.8018018018018 | AD825: 38
W826: NORTH MELBOURNE | X826: 9 | Y826: 8 | Z826: 1 | AA826: 1144 | AB826: 1132 | AC826: 101.06007067137809 | AD826: 38
A827: WILLIAMSTOWN | C827: 3 | D827: 1 | E827: =C827*6+D827 -> 19 | G827: 4 | H827: 3 | I827: =G827*6+H827 -> 27 | K827: 7 | L827: 4 | M827: =K827*6+L827 -> 46 | O827: 8 | P827: 7 | Q827: =O827*6+P827 -> 55 | S827: WILLIAMSTOWN | W827: BRIGHTON | X827: 8 | Y827: 10 | Z827: 0 | AA827: 1219 | AB827: 1237 | AC827: 98.544866612772836 | AD827: 32
A828: NORTH MELBOURNE | C828: 1 | D828: 3 | E828: =C828*6+D828 -> 9 | G828: 4 | H828: 5 | I828: =G828*6+H828 -> 29 | K828: 6 | L828: 9 | M828: =K828*6+L828 -> 45 | O828: 7 | P828: 10 | Q828: =O828*6+P828 -> 52 | S828: JONES | W828: PRAHRAN | X828: 3 | Y828: 14 | Z828: 1 | AA828: 860 | AB828: 1535 | AC828: 56.026058631921821 | AD828: 14
A829: BEST PLAYERS | W829: NORTHCOTE | X829: 3 | Y829: 15 | Z829: 0 | AA829: 952 | AB829: 1217 | AC829: 78.225143796220209 | AD829: 12
A830: WILLIAMSTOWN | D830: GEDDES | G830: LEE | I830: N McDONALD | L830: J McDONALD | O830: KING | Q830: CARPENTER | W830: GEELONG ASSOC. | X830: 2 | Y830: 16 | Z830: 0 | AA830: 852 | AB830: 1440 | AC830: 59.16 | AD830: 8
A831: NORTH MELBOURNE | D831: JOHNSON | G831: LEWIS | I831: GOMEZ | L831: WATSON | O831: SHORTEN | Q831: SMITH
A832: GOALKICKERS
A833: WILLIAMSTOWN | D833: CARPENTER 5 | G833: TRUMAN | J833: LEE | L833: MARTIN
A834: NORTH MELBOURNE | D834: JOHNSON 3 | G834: LEWIS | I834: McINTOSH | L834: CONSIDINE | O834: KIRKLEY
A836: BRIGHTON | C836: 2 | D836: 1 | E836: =C836*6+D836 -> 13 | G836: 5 | H836: 3 | I836: =G836*6+H836 -> 33 | K836: 5 | L836: 11 | M836: =K836*6+L836 -> 41 | O836: 9 | P836: 12 | Q836: =O836*6+P836 -> 66 | S836: BRIGHTON BEACH
A837: HAWTHORN | C837: 1 | D837: 5 | E837: =C837*6+D837 -> 11 | G837: 1 | H837: 14 | I837: =G837*6+H837 -> 20 | K837: 4 | L837: 15 | M837: =K837*6+L837 -> 39 | O837: 4 | P837: 15 | Q837: =O837*6+P837 -> 39 | S837: CLARKE
A838: BEST PLAYERS
A839: BRIGHTON | D839: HARRIS | G839: DANGERFIELD | J839: HATTAM | M839: CARROLL | P839: BOYD | R839: PEARSON
A840: HAWTHORN | D840: FINCH | G840: JACKSON | J840: HAMMOND | M840: NOTT | P840: YEOMANS | R840: SPLATT
A841: GOALKICKERS
A842: BRIGHTON | D842: BOYD 4 | G842: LYNCH 2 | J842: PEARSON | M842: TONKIN | P842: IRWIN
A843: HAWTHORN | D843: LETHLEAN 2 | G843: YEOMANS | J843: BRUCE
A845: GEELONG ASSOC. | C845: 1 | D845: 3 | E845: =C845*6+D845 -> 9 | G845: 2 | H845: 5 | I845: =G845*6+H845 -> 17 | K845: 7 | L845: 7 | M845: =K845*6+L845 -> 49 | O845: 10 | P845: 10 | Q845: =O845*6+P845 -> 70 | S845: KARDINIA PARK
A846: NORTHCOTE | C846: 1 | D846: 1 | E846: =C846*6+D846 -> 7 | G846: 2 | H846: 6 | I846: =G846*6+H846 -> 18 | K846: 2 | L846: 12 | M846: =K846*6+L846 -> 24 | O846: 3 | P846: 14 | Q846: =O846*6+P846 -> 32 | S846: COLLINS
A847: BEST PLAYERS
A848: GEELONG ASSOC. | D848: ELSTON | G848: CATIONS | J848: FINNEGAN | M848: J KERVIN | P848: L STEPHENS | S848: DIGBY
A849: NORTHCOTE | D849: ROSS | G849: SHEEHY | J849: POWELL | M849: DOWNES | P849: STEPHENSON | S849: CASSIDY
A850: GOALKICKERS
A851: GEELONG ASSOC. | D851: HAMMETT 2 | G851: WEARMOUTH 2 | K851: ELSTON 2 | M851: COOPER 2 | O851: CESARI | Q851: L STEPHENS
A852: NORTHCOTE | D852: HARLEY | G852: McCASKER | K852: P YATES
A854: FOOTSCRAY | C854: 6 | D854: 6 | E854: =C854*6+D854 -> 42 | G854: 12 | H854: 11 | I854: =G854*6+H854 -> 83 | K854: 16 | L854: 15 | M854: =K854*6+L854 -> 111 | O854: 24 | P854: 16 | Q854: =O854*6+P854 -> 160 | S854: TOORAK PARK
A855: PRAHRAN | C855: 1 | D855: 1 | E855: =C855*6+D855 -> 7 | G855: 3 | H855: 4 | I855: =G855*6+H855 -> 22 | K855: 5 | L855: 6 | M855: =K855*6+L855 -> 36 | O855: 7 | P855: 12 | Q855: =O855*6+P855 -> 54 | S855: SINCLAIR
A856: BEST PLAYERS
A857: FOOTSCRAY | D857: McINTYRE | G857: McLEOD | J857: MULLINS | M857: McCARTHY | P857: ZINNICK | S857: GIBB
A858: PRAHRAN | D858: BOUSSIE | G858: LOVE | J858: FERGEUS | M858: A MILLER | P858: DUNCAN | S858: DINGWALL
A859: GOALKICKERS
A860: FOOTSCRAY | D860: HOPKINS 7 | F860: MULLINS 7 | I860: O'BRIEN 4 | K860: ZINNICK 2 | M860: EASON | O860: McLEOD | Q860: FRASER | S860: GRIERSON
A861: PRAHRAN | D861: FERGEUS 3 | G861: A MILLER | I861: THOMAS | L861: LOVE | N861: BOUSSIE
A863: FINALS
A864: 1ST SEMI | E864: 8TH SEPTEMBER | J864: WEATHER | M864: FINE
D865: 1ST QTR | H865: 2ND QTR | L865: 3RD QTR | P865: FINAL
A866: PORT MELBOURNE | C866: 2 | D866: 4 | E866: =C866*6+D866 -> 16 | G866: 4 | H866: 6 | I866: =G866*6+H866 -> 30 | K866: 8 | L866: 10 | M866: =K866*6+L866 -> 58 | O866: 14 | P866: 11 | Q866: =O866*6+P866 -> 95 | S866: NORTH MELB
A867: HAWTHORN | C867: 3 | D867: 2 | E867: =C867*6+D867 -> 20 | G867: 6 | H867: 3 | I867: =G867*6+H867 -> 39 | K867: 8 | L867: 6 | M867: =K867*6+L867 -> 54 | O867: 9 | P867: 13 | Q867: =O867*6+P867 -> 67 | S867: JONES
A868: BEST PLAYERS
A869: PORT MELBOURNE | D869: BARFOOT | G869: KERLEY | J869: STANBRIDGE | N869: BISSETT | Q869: ENNIS | S869: OGILVIE
A870: HAWTHORN | D870: BROWN | G870: McKENZIE | J870: YEOMANS | N870: McCASHNEY | Q870: JACKSON | S870: LATHAM
A871: GOALKICKERS
A872: PORT MELBOURNE | D872: TAYLOR 5 | G872: KERLEY 3 | J872: BARFOOT 2 | M872: SKILTON | O872: ENNIS | Q872: OGILVIE | S872: TREMBATH
A873: HAWTHORN | D873: LATHAM 3 | G873: UTTING 2 | J873: YEOMANS 2 | M873: BROWN | O873: PEARSON
A875: 2ND SEMI | E875: 15TH SEPTEMBER | J875: WEATHER | M875: COOL CLOUDY LIGHT SHOWERS S.W. WIND
A876: FOOTSCRAY | C876: 6 | D876: 3 | E876: =C876*6+D876 -> 39 | G876: 9 | H876: 3 | I876: =G876*6+H876 -> 57 | K876: 10 | L876: 5 | M876: =K876*6+L876 -> 65 | O876: 12 | P876: 7 | Q876: =O876*6+P876 -> 79 | S876: NORTH MELB
A877: WILLIAMSTOWN | C877: 2 | D877: 1 | E877: =C877*6+D877 -> 13 | G877: 5 | H877: 1 | I877: =G877*6+H877 -> 31 | K877: 6 | L877: 5 | M877: =K877*6+L877 -> 41 | O877: 6 | P877: 11 | Q877: =O877*6+P877 -> 47 | S877: JONES
A878: BEST PLAYERS
A879: FOOTSCRAY | D879: McINTYRE | G879: FORD | J879: O'BRIEN | M879: SAMSON | P879: MCCARTHY | S879: GIBB
A880: WILLIAMSTOWN | D880: GEDDES | G880: MUNRO | J880: LEE | M880: O'HALLORAN | P880: N McDONALD | S880: CONDON
A881: GOALKICKERS
A882: FOOTSCRAY | D882: MULLINS 4 | G882: SAMSON 3 | J882: FRASER 2 | M882: McCARTHY | P882: O'BRIEN | R882: ZINNICK
A883: WILLIAMSTOWN | D883: CARPENTER 2 | G883: LEE 2 | J883: GEISLER | M883: TRUMAN
A885: FINAL | E885: 22ND SEPTEMBER | J885: WEATHER | M885: CLOUDY SHOWERS
A886: PORT MELBOURNE | C886: 2 | D886: 2 | E886: =C886*6+D886 -> 14 | G886: 4 | H886: 6 | I886: =G886*6+H886 -> 30 | K886: 4 | L886: 9 | M886: =K886*6+L886 -> 33 | O886: 8 | P886: 9 | Q886: =O886*6+P886 -> 57 | S886: NORTH MELB
A887: FOOTSCRAY | C887: 1 | D887: 2 | E887: =C887*6+D887 -> 8 | G887: 3 | H887: 5 | I887: =G887*6+H887 -> 23 | K887: 4 | L887: 9 | M887: =K887*6+L887 -> 33 | O887: 5 | P887: 11 | Q887: =O887*6+P887 -> 41 | S887: JONES
A888: BEST PLAYERS
A889: PORT MELBOURNE | D889: STANBRIDGE | G889: OGILVIE | J889: BARFOOT | M889: BISSETT | P889: DOBRIGH | S889: J RUDD
A890: FOOTSCRAY | D890: FORD | G890: McCARTHY | J890: EASON | M890: SIVVIES | P890: GIBB | S890: McINTYRE
A891: GOALKICKERS
A892: PORT MELBOURNE | D892: DOBRIGH 2 | G892: CRUUDEN | J892: OGILVIE | M892: TAYLOR | O892: ENNIS | Q892: KERLEY | S892: W RUDD
A893: FOOTSCRAY | D893: EASON | G893: McCARTHY | J893: O'BRIEN | M893: GIBB | O893: MULLINS
A895: GRAND FINAL | E895: 29TH SEPTEMBER
A896: FOOTSCRAY | C896: 3 | D896: 4 | E896: 22 | G896: 3 | H896: 4 | I896: 22 | K896: 6 | L896: 9 | M896: 45 | O896: 7 | P896: 10 | Q896: =O896*6+P896 -> 52 | S896: NORTH MELB
A897: PORT MELBOURNE | C897: 0 | D897: 0 | E897: 0 | G897: 2 | H897: 1 | I897: 13 | K897: 2 | L897: 2 | M897: 14 | O897: 5 | P897: 8 | Q897: =O897*6+P897 -> 38 | S897: JONES
A898: BEST PLAYERS
A899: FOOTSCRAY | D899: McINTYRE | G899: SAMSON | J899: ZINNICK | M899: FORD | P899: McCARTHY | S899: NEILSON
A900: PORT MELBOURNE | D900: STANBRIDGE | G900: BARFOOT | J900: GARBUTT | M900: SKILTON | P900: REES | S900: CRUDDEN
A901: GOALKICKERS
A902: FOOTSCRAY | D902: MULLINS 2 | G902: SAMSON | I902: EASON | K902: SCANLON | N902: O'BRIEN | Q902: HOWELL
A903: PORT MELBOURNE | D903: KERLEY 2 | G903: CRUDDEN | I903: TAYLOR | K903: BARFOOT
A905: REPRESENTATIVE MATCHES
D906: 9TH JULY
A907: W.A. GOLDFIELDS | C907: 3 | D907: 2 | E907: =C907*6+D907 -> 20 | G907: 11 | H907: 5 | I907: =G907*6+H907 -> 71 | K907: 12 | L907: 9 | M907: =K907*6+L907 -> 81 | O907: 14 | P907: 13 | Q907: =O907*6+P907 -> 97 | S907: AT KALGOOR;IE
A908: V.F.A. | C908: 7 | D908: 1 | E908: =C908*6+D908 -> 43 | G908: 8 | H908: 2 | I908: =G908*6+H908 -> 50 | K908: 10 | L908: 4 | M908: =K908*6+L908 -> 64 | O908: 13 | P908: 5 | Q908: =O908*6+P908 -> 83 | S908: WILLIAMS
A909: BEST PLAYERS
A910: W.A. GOLDFIELDS | D910: MITCHELL | G910: McLIHENEY | J910: BAILEY | M910: McDIARMID | P910: WILLOX | S910: P HUNT
A911: V.F.A. | D911: WARREN | G911: WALTON | J911: ALESSIO | M911: BRISCOE | P911: CARROLL | S911: BAYLISS
A912: GOALKICKERS
A913: W.A. GOLDFIELDS | D913: McLIHENEY 3 | G913: BENNETT 3 | J913: McDIARMID 2 | M913: McCARTHY 2 | P913: PALMER 2 | S913: A TEMPLEMAN | W913: WILLOX
A914: V.F.A. | D914: TAYLOR 5 | G914: ALESSIO 3 | J914: WARREN 2 | M914: TREVASKIS 2 | P914: LEWIS
D916: 11TH JULY
A917: V.F.A. | C917: 5 | D917: 2 | E917: =C917*6+D917 -> 32 | G917: 11 | H917: 9 | I917: =G917*6+H917 -> 75 | K917: 14 | L917: 11 | M917: =K917*6+L917 -> 95 | O917: 20 | P917: 22 | Q917: =O917*6+P917 -> 142 | S917: AT BOULDER
A918: W.A. GOLDFIELDS | C918: 5 | D918: 3 | E918: =C918*6+D918 -> 33 | G918: 8 | H918: 5 | I918: =G918*6+H918 -> 53 | K918: 12 | L918: 10 | M918: =K918*6+L918 -> 82 | O918: 13 | P918: 17 | Q918: =O918*6+P918 -> 95 | S918: C PRATT
A919: BEST PLAYERS
A920: V.F.A. | D920: WALTON | G920: McCASHNEY | J920: WARREN | M920: TAYLOR | P920: O'CONNOR
A921: W.A. GOLDFIELDS | D921: McDIARMID | G921: RICHARDS | J921: ROBERTSON | M921: BAILEY | P921: WILLOX
A922: GOALKICKERS
A923: V.F.A. | D923: TAYLOR 9 | G923: TREVASKIS 3 | J923: ALESSIO 2 | M923: JOHNSON 2 | P923: WARREN | R923: SMITH | T923: WALTON
A924: W.A. GOLDFIELDS | D924: BENNETT 4 | G924: MURPHY 2 | I924: WEBB 2 | K924: McCARTHY | N924: McLIHENEY | Q924: McDIARMID | T924: BAILEY
D926: 15TH JULY
A927: V.F.A. | C927: 3 | D927: 3 | E927: =C927*6+D927 -> 21 | G927: 6 | H927: 10 | I927: =G927*6+H927 -> 46 | K927: 9 | L927: 11 | M927: =K927*6+L927 -> 65 | O927: 15 | P927: 17 | Q927: =O927*6+P927 -> 107 | S927: AT BOULDER
A928: W.A. GOLDFIELDS | C928: 3 | D928: 6 | E928: =C928*6+D928 -> 24 | G928: 6 | H928: 9 | I928: =G928*6+H928 -> 45 | K928: 11 | L928: 12 | M928: =K928*6+L928 -> 78 | O928: 11 | P928: 15 | Q928: =O928*6+P928 -> 81 | S928: T ANGWIN
A929: BEST PLAYERS
A930: V.F.A. | D930: WALTON | G930: McCASHNEY | J930: GRIERSON | M930: CARROLL | P930: WARREN | S930: ALESSIO
A931: W.A. GOLDFIELDS | D931: UREN | G931: RICHARDS | J931: HUNT | M931: McDIARMID | P931: McHILENEY | S931: MITCHELL
A932: GOALKICKERS
A933: V.F.A. | D933: ALESSIO 4 | G933: TAYLOR 4 | I933: WARREN 2 | L933: GRIERSON 2 | O933: EWANS | Q933: TREVASKIS | T933: JOHNSON
A934: W.A. GOLDFIELDS | D934: RISEBERRY 4 | G934: PALMER 3 | J934: McDIARMID 2 | M934: McCARTHY | P934: McHILENEY