A1: Victorian Football Association
A2: Season 1924
A3: © Copyright Wal Williams | F3: First created: 2 August 2014
A4: Contact: joywalwi at gmail dot com | F4: Last updated: 2 August 2014 | W4: VFA Results and tables - Link to the main index page
A5: You are free to copy this document in whole or part provided that proper acknowledgement is given to the author. All rights reserved.
A7: YEAR 1924
A8: ROUND 1 | E8: 26TH APRIL | J8: WEATHER | M8: COOL CLOUDY S.W. WIND | S8: PLAYED AT | X8: LADDER | AB8: ROUND | AD8: 1
D9: 1ST QTR | H9: 2ND QTR | L9: 3RD QTR | P9: FINAL | S9: KARDINIA PARK
A10: FOOTSCRAY | C10: 4 | D10: 5 | E10: =C10*6+D10 -> 29 | G10: 6 | H10: 10 | I10: =G10*6+H10 -> 46 | K10: 9 | L10: 14 | M10: =K10*6+L10 -> 68 | O10: 10 | P10: 16 | Q10: =O10*6+P10 -> 76 | S10: UMPIRE | W10: TEAM | X10: W | Y10: L | Z10: D | AA10: FOR | AB10: AGST | AC10: % | AD10: PTS
A11: GEELONG ASSOC. | C11: 2 | D11: 1 | E11: =C11*6+D11 -> 13 | G11: 5 | H11: 4 | I11: =G11*6+H11 -> 34 | K11: 8 | L11: 5 | M11: =K11*6+L11 -> 53 | O11: 11 | P11: 6 | Q11: =O11*6+P11 -> 72 | S11: FRIMLEY
A12: BEST PLAYERS | W12: BRIGHTON | X12: 1 | Y12: 0 | Z12: 0 | AA12: 104 | AB12: 29 | AC12: 358.62068965517244 | AD12: 4
A13: FOOTSCRAY | D13: EASON | F13: G WOODMAN | I13: McCARTHY | L13: FORD | N13: ASHTON | Q13: PUNCH | W13: BRUNSWICK | X13: 1 | Y13: 0 | Z13: 0 | AA13: 106 | AB13: 55 | AC13: 192.72727272727272 | AD13: 4
A14: GEELONG ASSOC. | D14: CORFIELD | F14: COOPER | I14: THORLEY | L14: DIGBY | N14: ROUTLEY | Q14: ELSTON | W14: HAWTHORN | X14: 1 | Y14: 0 | Z14: 0 | AA14: 59 | AB14: 41 | AC14: 143.90243902439025 | AD14: 4
A15: GOALKICKERS | W15: FOOTSCRAY | X15: 1 | Y15: 0 | Z15: 0 | AA15: 76 | AB15: 72 | AC15: 105.55555555555556 | AD15: 4
A16: FOOTSCRAY | D16: HOPKINS 3 | G16: G WOODMAN 2 | J16: ASHTON 2 | M16: FRASER | O16: SAMSON | Q16: EASON
A17: GEELONG ASSOC. | D17: COOPER 3 | G17: ROUTLEY 2 | J17: S STEVENS 2 | M17: MELLAHN | O17: THORLEY | Q17: CESARI | S17: ELSTON | W17: PORT MELBOURNE | X17: 1 | Y17: 0 | Z17: 0 | AA17: 75 | AB17: 73 | AC17: 102.73972602739725 | AD17: 4
W18: NORTHCOTE | X18: 0 | Y18: 1 | Z18: 0 | AA18: 73 | AB18: 75 | AC18: 97.333333333333329 | AD18: 0
A19: HAWTHORN | C19: 3 | D19: 1 | E19: =C19*6+D19 -> 19 | G19: 4 | H19: 4 | I19: =G19*6+H19 -> 28 | K19: 7 | L19: 8 | M19: =K19*6+L19 -> 50 | O19: 8 | P19: 11 | Q19: =O19*6+P19 -> 59 | S19: GLENFERRIE | W19: GEELONG ASSOC. | X19: 0 | Y19: 1 | Z19: 0 | AA19: 72 | AB19: 76 | AC19: 94.736842105263165 | AD19: 0
A20: NORTH MELBOURNE | C20: 1 | D20: 2 | E20: =C20*6+D20 -> 8 | G20: 2 | H20: 5 | I20: =G20*6+H20 -> 17 | K20: 3 | L20: 8 | M20: =K20*6+L20 -> 26 | O20: 5 | P20: 11 | Q20: =O20*6+P20 -> 41 | S20: LEHENY | W20: NORTH MELBOURNE | X20: 0 | Y20: 1 | Z20: 0 | AA20: 41 | AB20: 59 | AC20: 69.491525423728817 | AD20: 0
A21: BEST PLAYERS | W21: WILLIAMSTOWN | X21: 0 | Y21: 1 | Z21: 0 | AA21: 55 | AB21: 106 | AC21: 51.886792452830186 | AD21: 0
A22: HAWTHORN | D22: CARBARNS | G22: LETHLEAN | J22: BRUCE | M22: JACKSON | P22: GILL | R22: UTTING | W22: PRAHRAN | X22: 0 | Y22: 1 | Z22: 0 | AA22: 29 | AB22: 104 | AC22: 27.884615384615383 | AD22: 0
A23: NORTH MELBOURNE | D23: SMITH | G23: SHORTEN | J23: WALSH | M23: TREVASKIS | P23: MEEKING | R23: BAYLISS
A24: GOALKICKERS
A25: HAWTHORN | D25: LATHAM 3 | G25: YEOMANS 2 | J25: LETHLEAN | M25: OSBORNE | O25: BRUCE
A26: NORTH MELBOURNE | D26: RUTLEY 2 | G26: METCALFE | J26: GARDINER | M26: BAYLISS
A28: PORT MELBOURNE | C28: 3 | D28: 1 | E28: =C28*6+D28 -> 19 | G28: 9 | H28: 5 | I28: =G28*6+H28 -> 59 | K28: 10 | L28: 6 | M28: =K28*6+L28 -> 66 | O28: 11 | P28: 9 | Q28: =O28*6+P28 -> 75 | S28: PORT MELB
A29: NORTHCOTE | C29: 1 | D29: 2 | E29: =C29*6+D29 -> 8 | G29: 4 | H29: 2 | I29: =G29*6+H29 -> 26 | K29: 8 | L29: 7 | M29: =K29*6+L29 -> 55 | O29: 11 | P29: 7 | Q29: =O29*6+P29 -> 73 | S29: CHEESELEY
A30: BEST PLAYERS
A31: PORT MELBOURNE | D31: W RUDD | G31: BARFOOT | J31: JOHNSTONE | M31: TREMBATH | P31: ENNIS | R31: SKILTON
A32: NORTHCOTE | D32: McCASKER | G32: WOODS | J32: DOWNES | M32: SMITH | P32: BUISST | R32: ROSS
A33: GOALKICKERS
A34: PORT MELBOURNE | D34: ENNIS 4 | F34: SKILTON 3 | I34: KENELLEY 2 | L34: TREMBATH | N34: STANBRIDGE
A35: NORTHCOTE | D35: ROSS 4 | F35: STEPHENSON 3 | J35: DOWNES | L35: McCASKER | N35: POWER | P35: SUTHERLAND
A37: BRUNSWICK | C37: 2 | D37: 3 | E37: =C37*6+D37 -> 15 | G37: 4 | H37: 10 | I37: =G37*6+H37 -> 34 | K37: 7 | L37: 15 | M37: =K37*6+L37 -> 57 | O37: 14 | P37: 22 | Q37: =O37*6+P37 -> 106 | S37: BRUNSWICK
A38: WILLIAMSTOWN | C38: 2 | D38: 8 | E38: =C38*6+D38 -> 20 | G38: 4 | H38: 13 | I38: =G38*6+H38 -> 37 | K38: 5 | L38: 13 | M38: =K38*6+L38 -> 43 | O38: 7 | P38: 13 | Q38: =O38*6+P38 -> 55 | S38: ANTONIO
A39: BEST PLAYERS
A40: BRUNSWICK | D40: O'CONNOR | G40: McINERNEY | J40: VOSTI | M40: FITZGERALD | P40: JAMES | R40: KEDDIE
A41: WILLIAMSTOWN | D41: GEDDES | G41: N McDONALD | J41: THOMSON | M41: GEISLER | P41: MILES | R41: CARPENTER
A42: GOALKICKERS
A43: BRUNSWICK | D43: McINERNEY 7 | G43: HOLFORD 2 | J43: FURLONGER 2 | M43: McMAHON | O43: HYDE | Q43: O'CONNOR
A44: WILLIAMSTOWN | D44: THOMSON 2 | G44: MARTIN 2 | J44: GEISLER | M44: N McDONALD | P44: J MUNN
A46: BRIGHTON | C46: 4 | D46: 3 | E46: =C46*6+D46 -> 27 | G46: 8 | H46: 8 | I46: =G46*6+H46 -> 56 | K46: 12 | L46: 14 | M46: =K46*6+L46 -> 86 | O46: 15 | P46: 14 | Q46: =O46*6+P46 -> 104 | S46: BRIGHTON BEACH
A47: PRAHRAN | C47: 0 | D47: 2 | E47: =C47*6+D47 -> 2 | G47: 2 | H47: 6 | I47: =G47*6+H47 -> 18 | K47: 3 | L47: 10 | M47: =K47*6+L47 -> 28 | O47: 3 | P47: 11 | Q47: =O47*6+P47 -> 29 | S47: PETERS
A48: BEST PLAYERS
A49: BRIGHTON | D49: CHAMPION | G49: TONKIN | J49: DAYKIN | L49: SUTHERLAND | O49: LILBURNE | R49: CARROLL
A50: PRAHRAN | D50: TYMMS | G50: SHAND | J50: V JONES | L50: NAYLOR | O50: BAXTER | R50: ROBERTS
A51: GOALKICKERS
A52: BRIGHTON | D52: LILBURNE 4 | G52: SULLIVAN 3 | J52: SUTHERLAND 3 | N52: RUMNEY 2 | Q52: BANKS | S52: DAYKIN | U52: TONKIN
A53: PRAHRAN | D53: V JONES | G53: SHAND | J53: GOW
A55: ROUND 2 | E55: 3RD MAY | J55: WEATHER | M55: FINE MILD LIGHT SOUTH BREEZE | S55: PLAYED AT | X55: LADDER | AB55: ROUND | AD55: 2
D56: 1ST QTR | H56: 2ND QTR | L56: 3RD QTR | P56: FINAL | S56: FOOTSCRAY
A57: FOOTSCRAY | C57: 2 | D57: 1 | E57: =C57*6+D57 -> 13 | G57: 4 | H57: 3 | I57: =G57*6+H57 -> 27 | K57: 5 | L57: 6 | M57: =K57*6+L57 -> 36 | O57: 8 | P57: 10 | Q57: =O57*6+P57 -> 58 | S57: UMPIRE | W57: TEAM | X57: W | Y57: L | Z57: D | AA57: FOR | AB57: AGST | AC57: % | AD57: PTS
A58: BRUNSWICK | C58: 3 | D58: 0 | E58: =C58*6+D58 -> 18 | G58: 3 | H58: 2 | I58: =G58*6+H58 -> 20 | K58: 3 | L58: 6 | M58: =K58*6+L58 -> 24 | O58: 7 | P58: 8 | Q58: =O58*6+P58 -> 50 | S58: BYRON
A59: BEST PLAYERS | W59: PORT MELBOURNE | X59: 2 | Y59: 0 | Z59: 0 | AA59: 152 | AB59: 128 | AC59: 118.75 | AD59: 8
A60: FOOTSCRAY | D60: McCARTHY | G60: MERTON | I60: ZINNICK | L60: G WOODMAN | O60: FORD | Q60: PUNCH | W60: FOOTSCRAY | X60: 2 | Y60: 0 | Z60: 0 | AA60: 134 | AB60: 122 | AC60: 109.8360655737705 | AD60: 8
A61: BRUNSWICK | D61: ROBERTS | G61: HYDE | I61: KEDDIE | L61: FITZGERALD | O61: RAYMOND | Q61: KEOGH | W61: BRIGHTON | X61: 1 | Y61: 1 | Z61: 0 | AA61: 168 | AB61: 106 | AC61: 158.49056603773585 | AD61: 4
A62: GOALKICKERS | W62: NORTH MELBOURNE | X62: 1 | Y62: 1 | Z62: 0 | AA62: 154 | AB62: 106 | AC62: 145.28301886792454 | AD62: 4
A63: FOOTSCRAY | D63: SCANLON 3 | G63: MULLINS 2 | J63: FRASER | L63: G WOODMAN | O63: McCARTHY
A64: BRUNSWICK | D64: CORBOYS 2 | G64: FITZGERALD 2 | J64: WHITFIELD | M64: HYDE | O64: McINERNEY | W64: BRUNSWICK | X64: 1 | Y64: 1 | Z64: 0 | AA64: 156 | AB64: 113 | AC64: 138.05309734513276 | AD64: 4
W65: NORTHCOTE | X65: 1 | Y65: 1 | Z65: 0 | AA65: 151 | AB65: 133 | AC65: 113.53383458646617 | AD65: 4
A66: NORTHCOTE | C66: 4 | D66: 3 | E66: =C66*6+D66 -> 27 | G66: 5 | H66: 6 | I66: =G66*6+H66 -> 36 | K66: 10 | L66: 11 | M66: =K66*6+L66 -> 71 | O66: 11 | P66: 12 | Q66: =O66*6+P66 -> 78 | S66: NORTHCOTE | W66: HAWTHORN | X66: 1 | Y66: 1 | Z66: 0 | AA66: 117 | AB66: 119 | AC66: 98.319327731092443 | AD66: 4
A67: HAWTHORN | C67: 2 | D67: 4 | E67: =C67*6+D67 -> 16 | G67: 3 | H67: 7 | I67: =G67*6+H67 -> 25 | K67: 4 | L67: 8 | M67: =K67*6+L67 -> 32 | O67: 7 | P67: 16 | Q67: =O67*6+P67 -> 58 | S67: BLACKBURN | W67: WILLIAMSTOWN | X67: 1 | Y67: 1 | Z67: 0 | AA67: 132 | AB67: 170 | AC67: 77.647058823529406 | AD67: 4
A68: BEST PLAYERS | W68: GEELONG ASSOC. | X68: 0 | Y68: 2 | Z68: 0 | AA68: 119 | AB68: 189 | AC68: 62.962962962962962 | AD68: 0
A69: NORTHCOTE | D69: DIMMICK | G69: ROSS | I69: DOWNES | L69: H SMITH | O69: LONG | Q69: SHEEHY | W69: PRAHRAN | X69: 0 | Y69: 2 | Z69: 0 | AA69: 84 | AB69: 181 | AC69: 46.408839779005525 | AD69: 0
A70: HAWTHORN | D70: GILL | G70: NOTT | I70: BROWN | L70: MCKENZIE | O70: MURPHY | Q70: JACKSON
A71: GOALKICKERS
A72: NORTHCOTE | D72: GOUGH 4 | G72: ROSS 3 | I72: HELLWIG 2 | L72: DIMMICK | N72: POWER
A73: HAWTHORN | D73: BEASLEY 2 | G73: WALTON | I73: LETHLEAN | L73: YEOMANS | N73: BURKE | P73: BRUCE
A75: NORTH MELBOURNE | C75: 3 | D75: 2 | E75: =C75*6+D75 -> 20 | G75: 8 | H75: 8 | I75: =G75*6+H75 -> 56 | K75: 11 | L75: 11 | M75: =K75*6+L75 -> 77 | O75: 16 | P75: 17 | Q75: =O75*6+P75 -> 113 | S75: NORTH MELB
A76: GEELONG ASSOC. | C76: 2 | D76: 5 | E76: =C76*6+D76 -> 17 | G76: 4 | H76: 5 | I76: =G76*6+H76 -> 29 | K76: 4 | L76: 5 | M76: =K76*6+L76 -> 29 | O76: 7 | P76: 5 | Q76: =O76*6+P76 -> 47 | S76: VALLANCE
A77: BEST PLAYERS
A78: NORTH MELBOURNE | D78: LINTON | G78: CLAPSON | J78: SHORTEN | M78: WALSH | P78: McINTOSH | S78: LEWIS
A79: GEELONG ASSOC. | D79: CORFIELD | G79: MELLAHN | J79: ELSTON | M79: HEWITSON | P79: CESARI | S79: COOPER
A80: GOALKICKERS
A81: NORTH MELBOURNE | D81: CLAPSON 6 | G81: KING 3 | I81: RUTLEY 2 | K81: GREENSMITH 2 | N81: LEWIS | P81: McINTOSH | R81: SHORTEN
A82: GEELONG ASSOC. | D82: S STEVENS 2 | G82: HEWITSON 2 | J82: ELSTON | L82: STACK | N82: CESARI
A84: PORT MELBOURNE | C84: 3 | D84: 2 | E84: =C84*6+D84 -> 20 | G84: 4 | H84: 10 | I84: =G84*6+H84 -> 34 | K84: 7 | L84: 14 | M84: =K84*6+L84 -> 56 | O84: 9 | P84: 23 | Q84: =O84*6+P84 -> 77 | S84: TOORAK PARK
A85: PRAHRAN | C85: 4 | D85: 3 | E85: =C85*6+D85 -> 27 | G85: 5 | H85: 3 | I85: =G85*6+H85 -> 33 | K85: 7 | L85: 3 | M85: =K85*6+L85 -> 45 | O85: 8 | P85: 7 | Q85: =O85*6+P85 -> 55 | S85: JONES
A86: BEST PLAYERS
A87: PORT MELBOURNE | D87: ENNIS | G87: TREMBATH | J87: BARFOOT | M87: W RUDD | O87: TASKER | Q87: W JOHNSTONE
A88: PRAHRAN | D88: ROBERTS | G88: V JONES | J88: TYMMS | M88: NAYLOR | O88: EDGAR | Q88: HOUSE
A89: GOALKICKERS
A90: PORT MELBOURNE | D90: ENNIS 6 | G90: TREMBATH | J90: J RUDD | L90: TASKER
A91: PRAHRAN | D91: EDGAR 3 | G91: HOUSE 2 | J91: WYLES 2 | M91: BAXTER
A93: WILLIAMSTOWN | C93: 4 | D93: 6 | E93: =C93*6+D93 -> 30 | G93: 4 | H93: 9 | I93: =G93*6+H93 -> 33 | K93: 8 | L93: 12 | M93: =K93*6+L93 -> 60 | O93: 10 | P93: 17 | Q93: =O93*6+P93 -> 77 | S93: WILLIAMSTOWN
A94: BRIGHTON | C94: 3 | D94: 1 | E94: =C94*6+D94 -> 19 | G94: 4 | H94: 7 | I94: =G94*6+H94 -> 31 | K94: 7 | L94: 9 | M94: =K94*6+L94 -> 51 | O94: 9 | P94: 10 | Q94: =O94*6+P94 -> 64 | S94: HARROD
A95: BEST PLAYERS
A96: WILLIAMSTOWN | D96: THOMSON | G96: N McDONALD | J96: CONDON | M96: BRITT | P96: J MUNN | R96: LEWIS
A97: BRIGHTON | D97: MONGAN | G97: BLECKLEY | J97: LILBURNE | M97: CHAMPION | P97: HARRIS | R97: DANGERFIELD
A98: GOALKICKERS
A99: WILLIAMSTOWN | D99: McAULIFFE 3 | G99: N McDONALD 3 | J99: MITCHELL 2 | M99: THOMSON | P99: J MUNN
A100: BRIGHTON | D100: CARROLL 2 | G100: DAYKIN 2 | J100: BANKS 2 | M100: SULLIVAN | P100: MONGAN | R100: TONKIN
A102: ROUND 3 | E102: 10TH MAY | J102: WEATHER | M102: FINE COOL LIGHT SOUTH WIND | S102: PLAYED AT | X102: LADDER | AB102: ROUND | AD102: 3
D103: 1ST QTR | H103: 2ND QTR | L103: 3RD QTR | P103: FINAL | S103: FOOTSCRAY
A104: FOOTSCRAY | C104: 3 | D104: 1 | E104: =C104*6+D104 -> 19 | G104: 9 | H104: 4 | I104: =G104*6+H104 -> 58 | K104: 10 | L104: 6 | M104: =K104*6+L104 -> 66 | O104: 16 | P104: 11 | Q104: =O104*6+P104 -> 107 | S104: UMPIRE | W104: TEAM | X104: W | Y104: L | Z104: D | AA104: FOR | AB104: AGST | AC104: % | AD104: PTS
A105: BRIGHTON | C105: 3 | D105: 0 | E105: =C105*6+D105 -> 18 | G105: 5 | H105: 1 | I105: =G105*6+H105 -> 31 | K105: 7 | L105: 8 | M105: =K105*6+L105 -> 50 | O105: 8 | P105: 9 | Q105: =O105*6+P105 -> 57 | S105: SINCLAIR
A106: BEST PLAYERS | W106: FOOTSCRAY | X106: 3 | Y106: 0 | Z106: 0 | AA106: 241 | AB106: 179 | AC106: 134.6368715083799 | AD106: 12
A107: FOOTSCRAY | D107: McCARTHY | G107: NEILSON | J107: EASON | L107: O'BRIEN | N107: PUNCH | Q107: MUELEMAN | W107: HAWTHORN | X107: 2 | Y107: 1 | Z107: 0 | AA107: 237 | AB107: 176 | AC107: 134.65909090909091 | AD107: 8
A108: BRIGHTON | D108: HARRIS | G108: CHAMPION | J108: TONKIN | L108: LYNCH | N108: MATTHEWS | Q108: LILBURNE | W108: BRUNSWICK | X108: 2 | Y108: 1 | Z108: 0 | AA108: 241 | AB108: 195 | AC108: 123.58974358974359 | AD108: 8
A109: GOALKICKERS | W109: PORT MELBOURNE | X109: 2 | Y109: 1 | Z109: 0 | AA109: 226 | AB109: 204 | AC109: 110.78431372549019 | AD109: 8
A110: FOOTSCRAY | D110: MULLINS 4 | F110: O'BRIEN 3 | I110: EASON 2 | K110: SAMSON 2 | M110: PUNCH 2 | O110: McCARTHY | Q110: GIBB | R110: SCANLON
A111: BRIGHTON | D111: SUTHERLAND 3 | G111: RUMNEY | I111: SULLIVAN | K111: DAYKIN | M111: ROBERTSON | P111: LYNCH | W111: WILLIAMSTOWN | X111: 2 | Y111: 1 | Z111: 0 | AA111: 220 | AB111: 212 | AC111: 103.77358490566037 | AD111: 8
W112: NORTH MELBOURNE | X112: 1 | Y112: 2 | Z112: 0 | AA112: 236 | AB112: 191 | AC112: 123.56020942408377 | AD112: 4
A113: BRUNSWICK | C113: 3 | D113: 2 | E113: =C113*6+D113 -> 20 | G113: 7 | H113: 7 | I113: =G113*6+H113 -> 49 | K113: 12 | L113: 10 | M113: =K113*6+L113 -> 82 | O113: 12 | P113: 13 | Q113: =O113*6+P113 -> 85 | S113: BRUNSWICK | W113: BRIGHTON | X113: 1 | Y113: 2 | Z113: 0 | AA113: 225 | AB113: 213 | AC113: 105.63380281690141 | AD113: 4
A114: NORTH MELBOURNE | C114: 4 | D114: 3 | E114: =C114*6+D114 -> 27 | G114: 7 | H114: 5 | I114: =G114*6+H114 -> 47 | K114: 7 | L114: 6 | M114: =K114*6+L114 -> 48 | O114: 12 | P114: 10 | Q114: =O114*6+P114 -> 82 | S114: CHEESELEY | W114: NORTHCOTE | X114: 1 | Y114: 2 | Z114: 0 | AA114: 193 | AB114: 221 | AC114: 87.33031674208145 | AD114: 4
A115: BEST PLAYERS | W115: GEELONG ASSOC. | X115: 1 | Y115: 2 | Z115: 0 | AA115: 195 | AB115: 263 | AC115: 74.144486692015207 | AD115: 4
A116: BRUNSWICK | D116: O'CONNOR | G116: HASSETT | I116: McMAHON | L116: ROBERTS | O116: KEOGH | Q116: FITZGERALD | W116: PRAHRAN | X116: 0 | Y116: 3 | Z116: 0 | AA116: 141 | AB116: 301 | AC116: 46.843853820598007 | AD116: 0
A117: NORTH MELBOURNE | D117: McINTOSH | G117: LEWIS | I117: WALSH | L117: SMITH | O117: LINTON | Q117: RUSS
A118: GOALKICKERS
A119: BRUNSWICK | D119: FITZGERALD 3 | G119: O'CONNOR 2 | J119: McMAHON 2 | M119: McINERNEY 2 | P119: VOSTI | R119: WILLIAMSON | V119: MILLEN
A120: NORTH MELBOURNE | D120: RUTLEY 4 | G120: GREENSMITH 2 | J120: CLAPSON 2 | M120: McINTOSH 2 | P120: LEWIS 2
A122: WILLIAMSTOWN | C122: 2 | D122: 2 | E122: =C122*6+D122 -> 14 | G122: 7 | H122: 3 | I122: =G122*6+H122 -> 45 | K122: 10 | L122: 7 | M122: =K122*6+L122 -> 67 | O122: 13 | P122: 10 | Q122: =O122*6+P122 -> 88 | S122: WILLIAMSTOWN
A123: NORTHCOTE | C123: 3 | D123: 0 | E123: =C123*6+D123 -> 18 | G123: 3 | H123: 3 | I123: =G123*6+H123 -> 21 | K123: 4 | L123: 5 | M123: =K123*6+L123 -> 29 | O123: 6 | P123: 6 | Q123: =O123*6+P123 -> 42 | S123: BYRON
A124: BEST PLAYERS
A125: WILLIAMSTOWN | D125: HOLTEN | G125: CARPENTER | J125: McAULIFFE | M125: CONDON | P125: GEDDES | S125: N McDONALD
A126: NORTHCOTE | D126: DOWNES | G126: LONG | J126: WEBB | M126: REID | P126: WOOLLARD | S126: SHEEHY
A127: GOALKICKERS
A128: WILLIAMSTOWN | D128: McAULIFFE 3 | G128: CARPENTER 2 | J128: MITCHELL 2 | M128: THOMSON 2 | P128: LEE 2 | R128: GEISLER | U128: BURKETT
A129: NORTHCOTE | D129: GOUGH (4) | G129: ROSS | J129: POWER
A131: HAWTHORN | C131: 4 | D131: 5 | E131: =C131*6+D131 -> 29 | G131: 10 | H131: 10 | I131: =G131*6+H131 -> 70 | K131: 15 | L131: 15 | M131: =K131*6+L131 -> 105 | O131: 17 | P131: 18 | Q131: =O131*6+P131 -> 120 | S131: GLENFERRIE
A132: PRAHRAN | C132: 2 | D132: 2 | E132: =C132*6+D132 -> 14 | G132: 3 | H132: 6 | I132: =G132*6+H132 -> 24 | K132: 4 | L132: 7 | M132: =K132*6+L132 -> 31 | O132: 8 | P132: 9 | Q132: =O132*6+P132 -> 57 | S132: COLLINS
A133: BEST PLAYERS
A134: HAWTHORN | D134: McCASHNEY | G134: WALTON | J134: REA | M134: LETHLEAN | P134: LATHAM | S134: YEOMANS
A135: PRAHRAN | D135: V JONES | G135: LEVER | J135: FERGEUS | M135: THORPE | P135: GREENWOOD | S135: TYMMS
A136: GOALKICKERS
A137: HAWTHORN | D137: LATHAM 6 | G137: YEOMANS 3 | J137: LETHLEAN 2 | M137: REA 2 | O137: RUDD 2 | Q137: WALTON | S137: BEASLEY
A138: PRAHRAN | D138: THORPE 3 | G138: V JONES 2 | J138: FERGEUS 2 | M138: WARD
A140: GEELONG ASSOC. | C140: 2 | D140: 1 | E140: =C140*6+D140 -> 13 | G140: 6 | H140: 4 | I140: =G140*6+H140 -> 40 | K140: 9 | L140: 8 | M140: =K140*6+L140 -> 62 | O140: 11 | P140: 10 | Q140: =O140*6+P140 -> 76 | S140: KARDINIA PARK
A141: PORT MELBOURNE | C141: 5 | D141: 1 | E141: =C141*6+D141 -> 31 | G141: 7 | H141: 2 | I141: =G141*6+H141 -> 44 | K141: 9 | L141: 4 | M141: =K141*6+L141 -> 58 | O141: 11 | P141: 8 | Q141: =O141*6+P141 -> 74 | S141: FRIMLEY
A142: BEST PLAYERS
A143: GEELONG ASSOC. | D143: GRIERSON | G143: KING | J143: DIGBY | M143: ELSTON | P143: SPENDLOVE | S143: CESARI
A144: PORT MELBOURNE | D144: LEWIS | G144: TASKER | J144: ENNIS | M144: REES | P144: M JOHNSON | S144: TREMBATH
A145: GOALKICKERS
A146: GEELONG ASSOC. | D146: HEWITSON 2 | G146: MELLAHN 2 | J146: ELSTON 2 | M146: CATIONS 2 | P146: S STEVENS | S146: COOPER | V146: TOPP
A147: PORT MELBOURNE | D147: STANBRIDGE 2 | G147: MURPHY 2 | J147: ENNIS 2 | L147: IRWIN 2 | N147: M JOHNSON | Q147: W RUDD | S147: REES
A149: ROUND 4 | E149: 17TH MAY | J149: WEATHER | M149: CLOUDY BUT FINE SOUTH WIND | S149: PLAYED AT | X149: LADDER | AB149: ROUND | AD149: 4
D150: 1ST QTR | H150: 2ND QTR | L150: 3RD QTR | P150: FINAL | S150: PORT MELB
A151: PORT MELBOURNE | C151: 0 | D151: 3 | E151: =C151*6+D151 -> 3 | G151: 3 | H151: 9 | I151: =G151*6+H151 -> 27 | K151: 4 | L151: 11 | M151: =K151*6+L151 -> 35 | O151: 8 | P151: 16 | Q151: =O151*6+P151 -> 64 | S151: UMPIRE | W151: TEAM | X151: W | Y151: L | Z151: D | AA151: FOR | AB151: AGST | AC151: % | AD151: PTS
A152: NORTH MELBOURNE | C152: 1 | D152: 1 | E152: =C152*6+D152 -> 7 | G152: 1 | H152: 2 | I152: =G152*6+H152 -> 8 | K152: 5 | L152: 6 | M152: =K152*6+L152 -> 36 | O152: 6 | P152: 10 | Q152: =O152*6+P152 -> 46 | S152: BYRON
A153: BEST PLAYERS | W153: FOOTSCRAY | X153: 3 | Y153: 0 | Z153: 1 | AA153: 291 | AB153: 229 | AC153: 127.07423580786026 | AD153: 14
A154: PORT MELBOURNE | D154: SKILTON | F154: FORBES | I154: J RUDD | K154: BARFOOT | N154: STANBRIDGE | Q154: MILES | W154: HAWTHORN | X154: 3 | Y154: 1 | Z154: 0 | AA154: 357 | AB154: 208 | AC154: 171.63461538461539 | AD154: 12
A155: NORTH MELBOURNE | D155: LINTON | F155: WALSH | I155: SMITH | K155: JOHNSON | N155: CLAPSON | Q155: HEARN | W155: BRUNSWICK | X155: 3 | Y155: 1 | Z155: 0 | AA155: 330 | AB155: 255 | AC155: 129.41176470588235 | AD155: 12
A156: GOALKICKERS | W156: WILLIAMSTOWN | X156: 3 | Y156: 1 | Z156: 0 | AA156: 306 | AB156: 255 | AC156: 120 | AD156: 12
A157: PORT MELBOURNE | D157: ENNIS 4 | G157: SKILTON 3 | J157: LEWIS
A158: NORTH MELBOURNE | D158: CLAPSON 3 | G158: TREVASKIS | J158: LEWIS | L158: RUTLEY | W158: PORT MELBOURNE | X158: 3 | Y158: 1 | Z158: 0 | AA158: 290 | AB158: 250 | AC158: 116 | AD158: 12
W159: NORTHCOTE | X159: 1 | Y159: 2 | Z159: 1 | AA159: 243 | AB159: 271 | AC159: 89.667896678966784 | AD159: 6
A160: BRUNSWICK | C160: 2 | D160: 2 | E160: =C160*6+D160 -> 14 | G160: 6 | H160: 11 | I160: =G160*6+H160 -> 47 | K160: 7 | L160: 11 | M160: =K160*6+L160 -> 53 | O160: 12 | P160: 17 | Q160: =O160*6+P160 -> 89 | S160: BRIGHTON BEACH | W160: NORTH MELBOURNE | X160: 1 | Y160: 3 | Z160: 0 | AA160: 282 | AB160: 255 | AC160: 110.58823529411765 | AD160: 4
A161: BRIGHTON | C161: 4 | D161: 5 | E161: =C161*6+D161 -> 29 | G161: 4 | H161: 7 | I161: =G161*6+H161 -> 31 | K161: 7 | L161: 9 | M161: =K161*6+L161 -> 51 | O161: 8 | P161: 12 | Q161: =O161*6+P161 -> 60 | S161: COLLINS | W161: BRIGHTON | X161: 1 | Y161: 3 | Z161: 0 | AA161: 285 | AB161: 302 | AC161: 94.370860927152322 | AD161: 4
A162: BEST PLAYERS | W162: GEELONG ASSOC. | X162: 1 | Y162: 3 | Z162: 0 | AA162: 227 | AB162: 383 | AC162: 59.268929503916446 | AD162: 4
A163: BRUNSWICK | D163: ADAMS | G163: KEOGH | I163: HYDE | K163: O'CONNOR | N163: FITZGERALD | Q163: CORBOYS | W163: PRAHRAN | X163: 0 | Y163: 4 | Z163: 0 | AA163: 184 | AB163: 387 | AC163: 47.545219638242891 | AD163: 0
A164: BRIGHTON | D164: HARRIS | G164: SULLIVAN | I164: IRWIN | K164: DANGERFIELD | N164: RUMNEY | Q164: BORLAND
A165: GOALKICKERS
A166: BRUNSWICK | D166: McINERNEY 4 | G166: HYDE 3 | J166: McMAHON 2 | M166: VOSTI | O166: O'CONNOR | R166: MILLEN
A167: BRIGHTON | D167: SULLIVAN 3 | G167: DAYKIN 2 | J167: RUMNEY | L167: BANKS | N167: ATKINSON
A169: NORTHCOTE | C169: 3 | D169: 1 | E169: =C169*6+D169 -> 19 | G169: 5 | H169: 5 | I169: =G169*6+H169 -> 35 | K169: 7 | L169: 7 | M169: =K169*6+L169 -> 49 | O169: 7 | P169: 8 | Q169: =O169*6+P169 -> 50 | S169: NORTHCOTE
A170: FOOTSCRAY | C170: 0 | D170: 0 | E170: =C170*6+D170 -> 0 | G170: 3 | H170: 4 | I170: =G170*6+H170 -> 22 | K170: 4 | L170: 9 | M170: =K170*6+L170 -> 33 | O170: 6 | P170: 14 | Q170: =O170*6+P170 -> 50 | S170: LEHENY
A171: BEST PLAYERS
A172: NORTHCOTE | D172: SHEEHY | G172: DOWNES | J172: BUSST | L172: JOHNSON | O172: WOODS | R172: WEBB
A173: FOOTSCRAY | D173: McCARTHY | G173: MERTON | J173: FORD | L173: PUNCH | O173: FRASER | R173: MULLINS
A174: GOALKICKERS
A175: NORTHCOTE | D175: JOHNSON 2 | G175: ANDERSON 2 | K175: GOUGH | M175: McCASKER | P175: ROSS
A176: FOOTSCRAY | D176: FRASER 2 | G176: GARLICK 2 | K176: LAIDLAW | N176: MULLINS
A178: WILLIAMSTOWN | C178: 4 | D178: 2 | E178: =C178*6+D178 -> 26 | G178: 4 | H178: 4 | I178: =G178*6+H178 -> 28 | K178: 10 | L178: 9 | M178: =K178*6+L178 -> 69 | O178: 13 | P178: 8 | Q178: =O178*6+P178 -> 86 | S178: TOORAK PARK
A179: PRAHRAN | C179: 0 | D179: 0 | E179: =C179*6+D179 -> 0 | G179: 1 | H179: 4 | I179: =G179*6+H179 -> 10 | K179: 3 | L179: 4 | M179: =K179*6+L179 -> 22 | O179: 6 | P179: 7 | Q179: =O179*6+P179 -> 43 | S179: GILCHRIST
A180: BEST PLAYERS
A181: WILLIAMSTOWN | D181: CARPENTER | G181: J MUNN | J181: CONDON | M181: BURKITT | P181: GEDDES | R181: McAULIFFE
A182: PRAHRAN | D182: ROBERTS | G182: FERGEUS | J182: E JONES | M182: THORPE | P182: V JONES | R182: DINGWALL
A183: GOALKICKERS
A184: WILLIAMSTOWN | D184: CARPENTER 3 | G184: McAULIFFE 3 | J184: J MUNN 3 | M184: N McDONALD 2 | Q184: LEE | R184: GEISLER
A185: PRAHRAN | D185: THORPE 2 | G185: HOWARD | J185: V JONES | M185: DONALD | O185: WARD
A187: HAWTHORN | C187: 4 | D187: 6 | E187: =C187*6+D187 -> 30 | G187: 7 | H187: 8 | I187: =G187*6+H187 -> 50 | K187: 11 | L187: 13 | M187: =K187*6+L187 -> 79 | O187: 17 | P187: 18 | Q187: =O187*6+P187 -> 120 | S187: GLENFERRIE
A188: GEELONG ASSOC. | C188: 2 | D188: 2 | E188: =C188*6+D188 -> 14 | G188: 2 | H188: 4 | I188: =G188*6+H188 -> 16 | K188: 4 | L188: 6 | M188: =K188*6+L188 -> 30 | O188: 4 | P188: 8 | Q188: =O188*6+P188 -> 32 | S188: JONES
A189: BEST PLAYERS
A190: HAWTHORN | D190: JACKSON | G190: MURPHY | J190: YEOMANS | M190: BRUCE | P190: RUDD | S190: McKENZIE
A191: GEELONG ASSOC. | D191: CESARI | G191: DIGBY | J191: CORFIELD | M191: MELLAHN | P191: ROUTLEY | S191: CATIONS
A192: GOALKICKERS
A193: HAWTHORN | D193: LATHAM 6 | G193: BRUCE 4 | J193: RUDD 3 | M193: YEOMANS 2 | P193: LETHLEAN 2
A194: GEELONG ASSOC. | D194: COOPER | G194: STACK | J194: ROUTLEY | M194: THORLEY
A196: ROUND 5 | E196: 24TH MAY | J196: WEATHER | N196: CLOUDY BUT FINE | S196: PLAYED AT | X196: LADDER | AB196: ROUND | AD196: 5
D197: 1ST QTR | H197: 2ND QTR | L197: 3RD QTR | P197: FINAL | S197: WILLIAMSTOWN
A198: FOOTSCRAY | C198: 2 | D198: 1 | E198: =C198*6+D198 -> 13 | G198: 5 | H198: 6 | I198: =G198*6+H198 -> 36 | K198: 7 | L198: 10 | M198: =K198*6+L198 -> 52 | O198: 8 | P198: 14 | Q198: =O198*6+P198 -> 62 | S198: UMPIRE | W198: TEAM | X198: W | Y198: L | Z198: D | AA198: FOR | AB198: AGST | AC198: % | AD198: PTS
A199: WILLIAMSTOWN | C199: 3 | D199: 2 | E199: =C199*6+D199 -> 20 | G199: 4 | H199: 3 | I199: =G199*6+H199 -> 27 | K199: 7 | L199: 6 | M199: =K199*6+L199 -> 48 | O199: 7 | P199: 8 | Q199: =O199*6+P199 -> 50 | S199: COLLINS
A200: BEST PLAYERS | W200: FOOTSCRAY | X200: 4 | Y200: 0 | Z200: 1 | AA200: 353 | AB200: 279 | AC200: 126.52329749103943 | AD200: 18
A201: FOOTSCRAY | D201: FORD | F201: McCARTHY | I201: HOPKINS | L201: DOOLAN | O201: NEILSON | Q201: SAMSON | W201: BRUNSWICK | X201: 4 | Y201: 1 | Z201: 0 | AA201: 417 | AB201: 309 | AC201: 134.95145631067962 | AD201: 16
A202: WILLIAMSTOWN | D202: MUNRO | F202: GEDDES | I202: CONDON | L202: MITCHELL | O202: BRITT | Q202: TRUMAN | W202: PORT MELBOURNE | X202: 4 | Y202: 1 | Z202: 0 | AA202: 374 | AB202: 293 | AC202: 127.64505119453925 | AD202: 16
A203: GOALKICKERS | W203: HAWTHORN | X203: 3 | Y203: 2 | Z203: 0 | AA203: 400 | AB203: 292 | AC203: 136.98630136986301 | AD203: 12
A204: FOOTSCRAY | D204: PUNCH 4 | G204: ZINNICK 2 | J204: HOPKINS 2
A205: WILLIAMSTOWN | D205: N McDONALD 3 | H205: J MUNN 2 | K205: CARPENTER | N205: MITCHELL | W205: WILLIAMSTOWN | X205: 3 | Y205: 2 | Z205: 0 | AA205: 356 | AB205: 317 | AC205: 112.30283911671924 | AD205: 12
W206: NORTHCOTE | X206: 2 | Y206: 2 | Z206: 1 | AA206: 326 | AB206: 342 | AC206: 95.32163742690058 | AD206: 10
A207: PORT MELBOURNE | C207: 1 | D207: 4 | E207: =C207*6+D207 -> 10 | G207: 6 | H207: 10 | I207: =G207*6+H207 -> 46 | K207: 8 | L207: 14 | M207: =K207*6+L207 -> 62 | O207: 11 | P207: 18 | Q207: =O207*6+P207 -> 84 | S207: PORT MELB | W207: NORTH MELBOURNE | X207: 2 | Y207: 3 | Z207: 0 | AA207: 390 | AB207: 311 | AC207: 125.40192926045016 | AD207: 8
A208: HAWTHORN | C208: 1 | D208: 3 | E208: =C208*6+D208 -> 9 | G208: 2 | H208: 3 | I208: =G208*6+H208 -> 15 | K208: 3 | L208: 5 | M208: =K208*6+L208 -> 23 | O208: 6 | P208: 7 | Q208: =O208*6+P208 -> 43 | S208: JONES | W208: BRIGHTON | X208: 1 | Y208: 4 | Z208: 0 | AA208: 356 | AB208: 385 | AC208: 92.467532467532465 | AD208: 4
A209: BEST PLAYERS | W209: GEELONG ASSOC. | X209: 1 | Y209: 4 | Z209: 0 | AA209: 281 | AB209: 470 | AC209: 59.787234042553195 | AD209: 4
A210: PORT MELBOURNE | D210: W JOHNSTONE | G210: STANBRIDGE | J210: SKILTON | M210: ENNIS | O210: O'HALLORAN | R210: MILES | W210: PRAHRAN | X210: 0 | Y210: 5 | Z210: 0 | AA210: 240 | AB210: 495 | AC210: 48.484848484848484 | AD210: 0
A211: HAWTHORN | D211: FINCH | G211: YEOMANS | J211: McKENZIE | M211: LETHLEAN | O211: BEASLEY | R211: JACKSON
A212: GOALKICKERS
A213: PORT MELBOURNE | D213: ENNIS 5 | G213: J RUDD 2 | J213: BARFOOT | L213: LEWIS | N213: SKILTON | P213: M JOHNSON
A214: HAWTHORN | D214: LETHLEAN 3 | G214: SPLATT | J214: BURKE | L214: BRUCE
A216: NORTHCOTE | C216: 4 | D216: 7 | E216: =C216*6+D216 -> 31 | G216: 8 | H216: 7 | I216: =G216*6+H216 -> 55 | K216: 11 | L216: 10 | M216: =K216*6+L216 -> 76 | O216: 12 | P216: 11 | Q216: =O216*6+P216 -> 83 | S216: BRIGHTON BEACH
A217: BRIGHTON | C217: 1 | D217: 2 | E217: =C217*6+D217 -> 8 | G217: 4 | H217: 7 | I217: =G217*6+H217 -> 31 | K217: 7 | L217: 10 | M217: =K217*6+L217 -> 52 | O217: 9 | P217: 17 | Q217: =O217*6+P217 -> 71 | S217: LEHENY
A218: BEST PLAYERS
A219: NORTHCOTE | D219: DOWNES | G219: BUISST | J219: ROSS | M219: DIMMICK | P219: GOUGH | R219: JOHNSON
A220: BRIGHTON | D220: SULLIVAN | G220: DAYKIN | J220: LILBURNE | M220: HARRIS | P220: RUMNEY | R220: TONKIN
A221: GOALKICKERS
A222: NORTHCOTE | D222: DOWNES 4 | G222: GOUGH 2 | I222: ANDERSON 2 | L222: JOHNSON 2 | O222: REID | Q222: SHEEHY
A223: BRIGHTON | D223: SULLIVAN 4 | G223: ANDERSON 3 | J223: DAYKIN 2
A225: NORTH MELBOURNE | C225: 2 | D225: 6 | E225: =C225*6+D225 -> 18 | G225: 6 | H225: 12 | I225: =G225*6+H225 -> 48 | K225: 8 | L225: 17 | M225: =K225*6+L225 -> 65 | O225: 15 | P225: 18 | Q225: =O225*6+P225 -> 108 | S225: NORTH MELB
A226: PRAHRAN | C226: 1 | D226: 3 | E226: =C226*6+D226 -> 9 | G226: 2 | H226: 6 | I226: =G226*6+H226 -> 18 | K226: 4 | L226: 10 | M226: =K226*6+L226 -> 34 | O226: 7 | P226: 14 | Q226: =O226*6+P226 -> 56 | S226: FRIMLEY
A227: BEST PLAYERS
A228: NORTH MELBOURNE | D228: LINTON | G228: WOOD | J228: CLAPSON | M228: KING | P228: GILES | R228: JOHNSON
A229: PRAHRAN | D229: V JONES | G229: ROBERTS | J229: NAYLOR | M229: GRIFFITHS | P229: THOMAS | R229: THORPE
A230: GOALKICKERS
A231: NORTH MELBOURNE | D231: WOOD 4 | F231: CLAPSON 3 | I231: BAYLISS 2 | K231: GREENSMITH 2 | N231: TREVASKIS | Q231: WALSH | S231: RUTLEY | U231: WATSON
A232: PRAHRAN | D232: THORPE 3 | G232: EDGAR | I232: ROBERTS | K232: JAMES | M232: FIELD
A234: BRUNSWICK | C234: 3 | D234: 1 | E234: =C234*6+D234 -> 19 | G234: 4 | H234: 9 | I234: =G234*6+H234 -> 33 | K234: 5 | L234: 13 | M234: =K234*6+L234 -> 43 | O234: 11 | P234: 21 | Q234: =O234*6+P234 -> 87 | S234: KARDINIA PARK
A235: GEELONG ASSOC. | C235: 3 | D235: 2 | E235: =C235*6+D235 -> 20 | G235: 3 | H235: 5 | I235: =G235*6+H235 -> 23 | K235: 8 | L235: 5 | M235: =K235*6+L235 -> 53 | O235: 8 | P235: 6 | Q235: =O235*6+P235 -> 54 | S235: BYRON
A236: BEST PLAYERS
A237: BRUNSWICK | D237: McINERNEY | G237: O'CONNOR | J237: McCARMACK | M237: HASSETT | P237: MILLEN | S237: RALEIGH
A238: GEELONG ASSOC. | D238: CATIONS | G238: WATERHOUSE | J238: CORFIELD | M238: DIGBY | P238: GRIERSON | S238: BURCH
A239: GOALKICKERS
A240: BRUNSWICK | D240: McINERNEY 6 | G240: VOSTI 2 | I240: MILLEN | K240: O'CONNOR | N240: McMAHON
A241: GEELONG ASSOC. | D241: NOONAN 4 | G241: L STEVENS | I241: CESARI | K241: COOPER
A243: ROUND 6 | E243: 31ST MAY | J243: WEATHER | M243: FINE N.W. WIND | S243: PLAYED AT | X243: LADDER | AB243: ROUND | AD243: 6
D244: 1ST QTR | H244: 2ND QTR | L244: 3RD QTR | P244: FINAL | S244: BRUNSWICK
A245: BRUNSWICK | C245: 4 | D245: 6 | E245: =C245*6+D245 -> 30 | G245: 5 | H245: 7 | I245: =G245*6+H245 -> 37 | K245: 8 | L245: 11 | M245: =K245*6+L245 -> 59 | O245: 9 | P245: 14 | Q245: =O245*6+P245 -> 68 | S245: UMPIRE | W245: TEAM | X245: W | Y245: L | Z245: D | AA245: FOR | AB245: AGST | AC245: % | AD245: PTS
A246: PORT MELBOURNE | C246: 1 | D246: 3 | E246: =C246*6+D246 -> 9 | G246: 3 | H246: 6 | I246: =G246*6+H246 -> 24 | K246: 5 | L246: 7 | M246: =K246*6+L246 -> 37 | O246: 8 | P246: 9 | Q246: =O246*6+P246 -> 57 | S246: COLLINS
A247: BEST PLAYERS | W247: FOOTSCRAY | X247: 5 | Y247: 0 | Z247: 1 | AA247: 496 | AB247: 320 | AC247: 155 | AD247: 22
A248: BRUNSWICK | D248: FITZGERALD | G248: KEOGH | I248: McINERNEY | L248: McMAHON | O248: HASSETT | Q248: MILLEN | W248: BRUNSWICK | X248: 5 | Y248: 1 | Z248: 0 | AA248: 485 | AB248: 366 | AC248: 132.5136612021858 | AD248: 20
A249: PORT MELBOURNE | D249: CROMPTON | G249: BISSETT | I249: STANBRIDGE | L249: W RUDD | O249: TREMBATH | Q249: BARFOOT | W249: HAWTHORN | X249: 4 | Y249: 2 | Z249: 0 | AA249: 496 | AB249: 332 | AC249: 149.39759036144579 | AD249: 16
A250: GOALKICKERS | W250: PORT MELBOURNE | X250: 4 | Y250: 2 | Z250: 0 | AA250: 431 | AB250: 361 | AC250: 119.39058171745152 | AD250: 16
A251: BRUNSWICK | D251: McINERNEY 4 | G251: VOSTI | I251: McMAHON | L251: WILLIAMSON | O251: FITZGERALD | R251: RAYMOND
A252: PORT MELBOURNE | D252: ENNIS (4) | G252: J RUDD | I252: PATON | K252: STANBRIDGE | N252: W JOHNSTONE | W252: WILLIAMSTOWN | X252: 4 | Y252: 2 | Z252: 0 | AA252: 411 | AB252: 370 | AC252: 111.08108108108108 | AD252: 16
W253: NORTHCOTE | X253: 3 | Y253: 2 | Z253: 1 | AA253: 429 | AB253: 409 | AC253: 104.88997555012224 | AD253: 14
A254: WILLIAMSTOWN | C254: 4 | D254: 2 | E254: =C254*6+D254 -> 26 | G254: 5 | H254: 2 | I254: =G254*6+H254 -> 32 | K254: 8 | L254: 5 | M254: =K254*6+L254 -> 53 | O254: 8 | P254: 7 | Q254: =O254*6+P254 -> 55 | S254: WILLIAMSTOWN | W254: NORTH MELBOURNE | X254: 2 | Y254: 4 | Z254: 0 | AA254: 443 | AB254: 366 | AC254: 121.03825136612022 | AD254: 8
A255: NORTH MELBOURNE | C255: 1 | D255: 4 | E255: =C255*6+D255 -> 10 | G255: 5 | H255: 6 | I255: =G255*6+H255 -> 36 | K255: 5 | L255: 7 | M255: =K255*6+L255 -> 37 | O255: 7 | P255: 11 | Q255: =O255*6+P255 -> 53 | S255: LEHENY | W255: BRIGHTON | X255: 1 | Y255: 5 | Z255: 0 | AA255: 396 | AB255: 481 | AC255: 82.328482328482323 | AD255: 4
A256: BEST PLAYERS | W256: GEELONG ASSOC. | X256: 1 | Y256: 5 | Z256: 0 | AA256: 348 | AB256: 573 | AC256: 60.732984293193716 | AD256: 4
A257: WILLIAMSTOWN | D257: CARPENTER | G257: McAULIFFE | J257: J MUNN | M257: BRITT | O257: GEISLER | R257: HOLTEN | W257: PRAHRAN | X257: 0 | Y257: 6 | Z257: 0 | AA257: 281 | AB257: 638 | AC257: 44.043887147335425 | AD257: 0
A258: NORTH MELBOURNE | D258: GILES | G258: LINTON | J258: CLAPSON | M258: JONES | O258: GARDINER | R258: GOMEA
A259: GOALKICKERS
A260: WILLIAMSTOWN | D260: J MUNN 3 | G260: McAULIFFE | J260: CARPENTER | M260: TRUMAN | O260: N McDONALD
A261: NORTH MELBOURNE | D261: METCALFE 2 | G261: JOHNSON 2 | J261: CLAPSON | M261: RUTLEY | O261: TRVASKIS
A263: NORTHCOTE | C263: 5 | D263: 5 | E263: =C263*6+D263 -> 35 | G263: 10 | H263: 6 | I263: =G263*6+H263 -> 66 | K263: 12 | L263: 11 | M263: =K263*6+L263 -> 83 | O263: 15 | P263: 13 | Q263: =O263*6+P263 -> 103 | S263: NORTHCOTE
A264: GEELONG ASSOC. | C264: 2 | D264: 1 | E264: =C264*6+D264 -> 13 | G264: 4 | H264: 2 | I264: =G264*6+H264 -> 26 | K264: 7 | L264: 2 | M264: =K264*6+L264 -> 44 | O264: 10 | P264: 7 | Q264: =O264*6+P264 -> 67 | S264: JONES
A265: BEST PLAYERS
A266: NORTHCOTE | D266: LONG | G266: BUISST | J266: HARLEY | M266: DIMMICK | P266: WOODS | R266: THEOBOLD
A267: GEELONG ASSOC. | D267: CORFIELD | G267: ROUTLEY | J267: GRIERSON | M267: WATERHOUSE | P267: CATIONS | R267: DIGBY
A268: GOALKICKERS
A269: NORTHCOTE | D269: GOUGH 8 | G269: THEOBOLD 3 | J269: ROSS | L269: McCASKER | O269: SHEEHY | Q269: REID
A270: GEELONG ASSOC. | D270: NOONAN 5 | G270: ROUTLEY 3 | J270: GITTENS | L270: ELSTON
A272: HAWTHORN | C272: 3 | D272: 4 | E272: =C272*6+D272 -> 22 | G272: 6 | H272: 6 | I272: =G272*6+H272 -> 42 | K272: 10 | L272: 9 | M272: =K272*6+L272 -> 69 | O272: 14 | P272: 12 | Q272: =O272*6+P272 -> 96 | S272: BRIGHTON BEACH
A273: BRIGHTON | C273: 1 | D273: 2 | E273: =C273*6+D273 -> 8 | G273: 2 | H273: 5 | I273: =G273*6+H273 -> 17 | K273: 3 | L273: 8 | M273: =K273*6+L273 -> 26 | O273: 5 | P273: 10 | Q273: =O273*6+P273 -> 40 | S273: FRIMLEY
A274: BEST PLAYERS
A275: HAWTHORN | D275: LETHLEAN | G275: LATHAM | J275: BURKE | M275: BIRTLES | P275: PEARSON | S275: UTTING
A276: BRIGHTON | D276: LILBURNE | G276: MATTHEWS | J276: SULLIVAN | M276: IRWIN | P276: IRWIN | S276: TONKIN
A277: GOALKICKERS
A278: HAWTHORN | D278: LATHAM 5 | G278: LETHLEAN 2 | J278: BIRTLES 2 | M278: BURKE 2 | O278: YEOMANS 2 | R278: RUDD
A279: BRIGHTON | D279: SULLIVAN 3 | G279: BORLAND | J279: RUMNEY
A281: FOOTSCRAY | C281: 5 | D281: 10 | E281: =C281*6+D281 -> 40 | G281: 8 | H281: 17 | I281: =G281*6+H281 -> 65 | K281: 15 | L281: 25 | M281: =K281*6+L281 -> 115 | O281: 19 | P281: 29 | Q281: =O281*6+P281 -> 143 | S281: TOORAK PARK
A282: PRAHRAN | C282: 0 | D282: 1 | E282: =C282*6+D282 -> 1 | G282: 1 | H282: 2 | I282: =G282*6+H282 -> 8 | K282: 3 | L282: 3 | M282: =K282*6+L282 -> 21 | O282: 6 | P282: 5 | Q282: =O282*6+P282 -> 41 | S282: ANTONIO
A283: BEST PLAYERS
A284: FOOTSCRAY | D284: EASON | G284: McCARTHY | J284: MERTON | M284: DOOLAN | P284: HOPKINS | S284: SAMSON
A285: PRAHRAN | D285: GRIFFITHS | G285: V JONES | J285: DONALD | M285: FRIEND | P285: NAYLOR | S285: ROBERTS
A286: GOALKICKERS
A287: FOOTSCRAY | D287: HOPKINS 6 | F287: GARLICK 3 | I287: BAYLISS 3 | K287: McCARTHY 2 | N287: EASON 2 | P287: PUNCH 2 | R287: ROSS
A288: PRAHRAN | D288: KENNY | F288: V JONES | I288: FRIEND | K288: THORPE | N288: COOMBS | P288: NAYLOR
A290: ROUND 7 | E290: 7TH JUNE | J290: WEATHER | M290: COLD SOUTH WIND RAIN | S290: PLAYED AT | X290: LADDER | AB290: ROUND | AD290: 7
D291: 1ST QTR | H291: 2ND QTR | L291: 3RD QTR | P291: FINAL | S291: NORTH MELB
A292: NORTH MELBOURNE | C292: 2 | D292: 5 | E292: =C292*6+D292 -> 17 | G292: 6 | H292: 9 | I292: =G292*6+H292 -> 45 | K292: 11 | L292: 12 | M292: =K292*6+L292 -> 78 | O292: 14 | P292: 13 | Q292: =O292*6+P292 -> 97 | S292: UMPIRE | W292: TEAM | X292: W | Y292: L | Z292: D | AA292: FOR | AB292: AGST | AC292: % | AD292: PTS
A293: BRIGHTON | C293: 3 | D293: 2 | E293: =C293*6+D293 -> 20 | G293: 5 | H293: 4 | I293: =G293*6+H293 -> 34 | K293: 6 | L293: 6 | M293: =K293*6+L293 -> 42 | O293: 6 | P293: 11 | Q293: =O293*6+P293 -> 47 | S293: FRIMLEY
A294: BEST PLAYERS | W294: FOOTSCRAY | X294: 6 | Y294: 0 | Z294: 1 | AA294: 590 | AB294: 388 | AC294: 152.06185567010309 | AD294: 26
A295: NORTH MELBOURNE | D295: LINTON | G295: GILES | I295: LOCKE | K295: LAMBE | N295: METCALFE | Q295: WATSON | W295: BRUNSWICK | X295: 5 | Y295: 2 | Z295: 0 | AA295: 546 | AB295: 445 | AC295: 122.7 | AD295: 20
A296: BRIGHTON | D296: DANGERFIELD | G296: ATKINSON | I296: HARRIS | K296: MATTHEWS | N296: IRWIN | Q296: TONKIN | W296: WILLIAMSTOWN | X296: 5 | Y296: 2 | Z296: 0 | AA296: 484 | AB296: 427 | AC296: 113.34894613583138 | AD296: 20
A297: GOALKICKERS | W297: NORTHCOTE | X297: 4 | Y297: 2 | Z297: 1 | AA297: 500 | AB297: 470 | AC297: 104.6 | AD297: 18
A298: NORTH MELBOURNE | D298: WOOD 5 | F298: METCALFE 4 | I298: CLAPSON 2 | L298: LEWIS | N298: JOHNSON | P298: P SMITH
A299: BRIGHTON | D299: RUMNEY 2 | G299: POTTER | J299: SULLIVAN | M299: ATKINSON | P299: HERRIDGE | W299: HAWTHORN | X299: 4 | Y299: 3 | Z299: 0 | AA299: 553 | AB299: 405 | AC299: 136.54320987654322 | AD299: 16
W300: PORT MELBOURNE | X300: 4 | Y300: 3 | Z300: 0 | AA300: 499 | AB300: 455 | AC300: 109.67032967032966 | AD300: 16
A301: WILLIAMSTOWN | C301: 2 | D301: 4 | E301: =C301*6+D301 -> 16 | G301: 6 | H301: 6 | I301: =G301*6+H301 -> 42 | K301: 8 | L301: 9 | M301: =K301*6+L301 -> 57 | O301: 10 | P301: 13 | Q301: =O301*6+P301 -> 73 | S301: GLENFERRIE | W301: NORTH MELBOURNE | X301: 3 | Y301: 4 | Z301: 0 | AA301: 540 | AB301: 413 | AC301: 130.75060532687652 | AD301: 12
A302: HAWTHORN | C302: 2 | D302: 2 | E302: =C302*6+D302 -> 14 | G302: 3 | H302: 3 | I302: =G302*6+H302 -> 21 | K302: 5 | L302: 7 | M302: =K302*6+L302 -> 37 | O302: 8 | P302: 9 | Q302: =O302*6+P302 -> 57 | S302: JONES | W302: GEELONG ASSOC. | X302: 2 | Y302: 5 | Z302: 0 | AA302: 392 | AB302: 616 | AC302: 63.636363636363633 | AD302: 8
A303: BEST PLAYERS | W303: BRIGHTON | X303: 1 | Y303: 6 | Z303: 0 | AA303: 443 | AB303: 578 | AC303: 76.643598615916957 | AD303: 4
A304: WILLIAMSTOWN | D304: GEISLER | G304: GEDDES | I304: MUNRO | L304: McDONALD | O304: HANSON | R304: CALLESON | W304: PRAHRAN | X304: 0 | Y304: 7 | Z304: 0 | AA304: 324 | AB304: 682 | AC304: 47.507331378299121 | AD304: 0
A305: HAWTHORN | D305: YEOMANS | G305: DAVEY | I305: JACKSON | L305: BRUCE | O305: PEARSON | R305: NOTT
A306: GOALKICKERS
A307: WILLIAMSTOWN | D307: CARPENTER 3 | G307: HANSON 2 | J307: McAULIFFE 2 | M307: McDONALD | P307: LEE
A308: HAWTHORN | D308: YEOMANS 3 | G308: RUDD 2 | J308: BRUCE 2 | M308: LATHAM
E309: 9TH JUNE | J309: WEATHER | M309: FINE BUT CLOUDY
A310: NORTHCOTE | C310: 6 | D310: 0 | E310: =C310*6+D310 -> 36 | G310: 8 | H310: 0 | I310: =G310*6+H310 -> 48 | K310: 10 | L310: 1 | M310: =K310*6+L310 -> 61 | O310: 13 | P310: 1 | Q310: =O310*6+P310 -> 79 | S310: NORTHCOTE
A311: BRUNSWICK | C311: 1 | D311: 3 | E311: =C311*6+D311 -> 9 | G311: 1 | H311: 6 | I311: =G311*6+H311 -> 12 | K311: 5 | L311: 9 | M311: =K311*6+L311 -> 39 | O311: 8 | P311: 13 | Q311: =O311*6+P311 -> 61 | S311: LEHENY
A312: BEST PLAYERS
A313: NORTHCOTE | D313: SHEEHY | G313: McCASKER | J313: DOWNES | M313: TAYLOR | P313: WOOLLARD | S313: LONG
A314: BRUNSWICK | D314: FITZGERALD | G314: KEDDIE | J314: McCORMACK | M314: MILLEN | P314: RAYMOND | S314: RALEIGH
A315: GOALKICKERS
A316: NORTHCOTE | D316: GOUGH 5 | G316: REID 4 | J316: JOHNSON 3 | M316: TAYLOR
A317: BRUNSWICK | D317: MILLEN 3 | G317: McINERNEY 2 | K317: McMAHON | N317: McCORMACK | Q317: O'CONNOR
A319: FOOTSCRAY | C319: 5 | D319: 0 | E319: =C319*6+D319 -> 30 | G319: 8 | H319: 7 | I319: =G319*6+H319 -> 55 | K319: 11 | L319: 9 | M319: =K319*6+L319 -> 75 | O319: 14 | P319: 10 | Q319: =O319*6+P319 -> 94 | S319: FOOTSCRAY
A320: PORT MELBOURNE | C320: 5 | D320: 2 | E320: =C320*6+D320 -> 32 | G320: 6 | H320: 2 | I320: =G320*6+H320 -> 38 | K320: 7 | L320: 6 | M320: =K320*6+L320 -> 48 | O320: 10 | P320: 8 | Q320: =O320*6+P320 -> 68 | S320: COLLINS
A321: BEST PLAYERS
A322: FOOTSCRAY | D322: HOPKINS | G322: EASON | J322: OUTEN | M322: MUELEMAN | P322: PUNCH | S322: McCARTHY
A323: PORT MELBOURNE | D323: SKILTON | G323: ENNIS | J323: BISSETT | M323: M JOHNSON | P323: MURPHY | S323: REES
A324: GOALKICKERS
A325: FOOTSCRAY | D325: PUNCH 4 | F325: HOPKINS 3 | I325: O'BRIEN 3 | K325: EASON | M325: SAMSON | O325: GARLICK | Q325: BAYLISS
A326: PORT MELBOURNE | D326: ENNIS 4 | F326: SKILTON 2 | I326: BARFOOT 2 | L326: W JOHNSTONE | O326: REES
A328: GEELONG ASSOC. | C328: 5 | D328: 3 | E328: =C328*6+D328 -> 33 | G328: 5 | H328: 6 | I328: =G328*6+H328 -> 36 | K328: 5 | L328: 8 | M328: =K328*6+L328 -> 38 | O328: 5 | P328: 14 | Q328: =O328*6+P328 -> 44 | S328: KARDINIA PARK
A329: PRAHRAN | C329: 0 | D329: 2 | E329: =C329*6+D329 -> 2 | G329: 4 | H329: 3 | I329: =G329*6+H329 -> 27 | K329: 4 | L329: 5 | M329: =K329*6+L329 -> 29 | O329: 5 | P329: 13 | Q329: =O329*6+P329 -> 43 | S329: BYRON
A330: BEST PLAYERS
A331: GEELONG ASSOC. | D331: DIGBY | G331: SPENDLOVE | J331: COOPER | M331: ELSTON | P331: NOONAN | S331: WATERHOUSE
A332: PRAHRAN | D332: GRIFFITHS | G332: FIELD | J332: ROBERTS | M332: V JONES | P332: FERGEUS | S332: MILLER
A333: GOALKICKERS
A334: GEELONG ASSOC. | D334: ELSTON 3 | G334: NOONAN 2
A335: PRAHRAN | D335: INCH 2 | G335: EDGAR | J335: BOUSSIE | M335: V JONES
A337: ROUND 8 | E337: 14TH JUNE | J337: WEATHER | M337: CLOUDY BUT FINE NORTH WIND | S337: PLAYED AT | X337: LADDER | AB337: ROUND | AD337: 8
D338: 1ST QTR | H338: 2ND QTR | L338: 3RD QTR | P338: FINAL | S338: GLENFERRIE
A339: FOOTSCRAY | C339: 4 | D339: 7 | E339: =C339*6+D339 -> 31 | G339: 6 | H339: 8 | I339: =G339*6+H339 -> 44 | K339: 7 | L339: 14 | M339: =K339*6+L339 -> 56 | O339: 11 | P339: 20 | Q339: =O339*6+P339 -> 86 | S339: UMPIRE | W339: TEAM | X339: W | Y339: L | Z339: D | AA339: FOR | AB339: AGST | AC339: % | AD339: PTS
A340: HAWTHORN | C340: 1 | D340: 1 | E340: =C340*6+D340 -> 7 | G340: 4 | H340: 5 | I340: =G340*6+H340 -> 29 | K340: 5 | L340: 9 | M340: =K340*6+L340 -> 39 | O340: 5 | P340: 10 | Q340: =O340*6+P340 -> 40 | S340: CHEESELY
A341: BEST PLAYERS | W341: FOOTSCRAY | X341: 7 | Y341: 0 | Z341: 1 | AA341: 676 | AB341: 428 | AC341: 157.94392523364485 | AD341: 30
A342: FOOTSCRAY | D342: EASON | F342: FORD | I342: OUTEN | K342: LAIDLAW | N342: McHENRY | Q342: McCARTHY | W342: BRUNSWICK | X342: 6 | Y342: 2 | Z342: 0 | AA342: 674 | AB342: 471 | AC342: 143.1 | AD342: 24
A343: HAWTHORN | D343: DAVEY | F343: YEOMANS | I343: SPLATT | K343: JACKSON | N343: FINCH | Q343: LETHLEAN | W343: WILLIAMSTOWN | X343: 6 | Y343: 2 | Z343: 0 | AA343: 546 | AB343: 468 | AC343: 116.66666666666667 | AD343: 24
A344: GOALKICKERS | W344: NORTHCOTE | X344: 4 | Y344: 3 | Z344: 1 | AA344: 555 | AB344: 563 | AC344: 98.58 | AD344: 18
A345: FOOTSCRAY | D345: BAYLISS 6 | G345: PUNCH 2 | J345: McCARTHY | M345: EASON | O345: HOPKINS
A346: HAWTHORN | D346: LETHLEAN 2 | G346: YEOMANS | J346: DAVEY | L346: JACKSON | W346: NORTH MELBOURNE | X346: 4 | Y346: 4 | Z346: 0 | AA346: 633 | AB346: 460 | AC346: 137.60869565217391 | AD346: 16
W347: HAWTHORN | X347: 4 | Y347: 4 | Z347: 0 | AA347: 593 | AB347: 491 | AC347: 120.77393075356416 | AD347: 16
A348: WILLIAMSTOWN | C348: 2 | D348: 3 | E348: =C348*6+D348 -> 15 | G348: 3 | H348: 5 | I348: =G348*6+H348 -> 23 | K348: 4 | L348: 7 | M348: =K348*6+L348 -> 31 | O348: 8 | P348: 14 | Q348: =O348*6+P348 -> 62 | S348: PORT MELB | W348: PORT MELBOURNE | X348: 4 | Y348: 4 | Z348: 0 | AA348: 540 | AB348: 517 | AC348: 104.44874274661508 | AD348: 16
A349: PORT MELBOURNE | C349: 2 | D349: 2 | E349: =C349*6+D349 -> 14 | G349: 3 | H349: 4 | I349: =G349*6+H349 -> 22 | K349: 5 | L349: 7 | M349: =K349*6+L349 -> 37 | O349: 5 | P349: 11 | Q349: =O349*6+P349 -> 41 | S349: FRIMLEY | W349: BRIGHTON | X349: 2 | Y349: 6 | Z349: 0 | AA349: 526 | AB349: 641 | AC349: 82.06 | AD349: 8
A350: BEST PLAYERS | W350: GEELONG ASSOC. | X350: 2 | Y350: 6 | Z350: 0 | AA350: 455 | AB350: 699 | AC350: 65.09 | AD350: 8
A351: WILLIAMSTOWN | D351: CARPENTER | G351: GEDDES | I351: McDONALD | L351: BRITT | O351: STONE | Q351: CONDON | W351: PRAHRAN | X351: 0 | Y351: 8 | Z351: 0 | AA351: 350 | AB351: 810 | AC351: 43.209876543209873 | AD351: 0
A352: PORT MELBOURNE | D352: REES | G352: FROUD | I352: STANBRIDGE | L352: W JOHNSTONE | O352: FORBES | Q352: O'HALLORAN
A353: GOALKICKERS
A354: WILLIAMSTOWN | D354: WALL 3 | G354: CARPENTER 3 | K354: McDONALD | N354: McAULIFFE
A355: PORT MELBOURNE | D355: CRUDDEN | G355: FROUD | J355: BISSETT | M355: W JOHNSTONE | P355: REES
A357: NORTH MELBOURNE | C357: 6 | D357: 2 | E357: =C357*6+D357 -> 38 | G357: 6 | H357: 5 | I357: =G357*6+H357 -> 41 | K357: 9 | L357: 7 | M357: =K357*6+L357 -> 61 | O357: 14 | P357: 9 | Q357: =O357*6+P357 -> 93 | S357: NORTH MELB
A358: NORTHCOTE | C358: 1 | D358: 1 | E358: =C358*6+D358 -> 7 | G358: 2 | H358: 2 | I358: =G358*6+H358 -> 14 | K358: 6 | L358: 4 | M358: =K358*6+L358 -> 40 | O358: 7 | P358: 5 | Q358: =O358*6+P358 -> 47 | S358: COLLINS
A359: BEST PLAYERS
A360: NORTH MELBOURNE | D360: LINTON | G360: METCALFE | J360: CLAPSON | M360: GOMEZ | O360: W SMITH | R360: WOOD
A361: NORTHCOTE | D361: McCASKER | G361: DOWNES | J361: ROSS | M361: JOHNSON | O361: GOUGH | R361: BUISST
A362: GOALKICKERS
A363: NORTH MELBOURNE | D363: WOOD 4 | F363: METCALFE 3 | I363: CLAPSON 2 | L363: LINTON 2 | N363: BAYLISS | P363: LEWIS | R363: JOHNSON
A364: NORTHCOTE | D364: GOUGH 4 | G364: DOWNES 2 | J364: REID
A366: BRIGHTON | C366: 4 | D366: 3 | E366: =C366*6+D366 -> 27 | G366: 8 | H366: 6 | I366: =G366*6+H366 -> 54 | K366: 8 | L366: 9 | M366: =K366*6+L366 -> 57 | O366: 12 | P366: 11 | Q366: =O366*6+P366 -> 83 | S366: KARDINIA PARK
A367: GEELONG ASSOC. | C367: 2 | D367: 3 | E367: =C367*6+D367 -> 15 | G367: 2 | H367: 4 | I367: =G367*6+H367 -> 16 | K367: 6 | L367: 5 | M367: =K367*6+L367 -> 41 | O367: 9 | P367: 9 | Q367: =O367*6+P367 -> 63 | S367: PANNAM
A368: BEST PLAYERS
A369: BRIGHTON | D369: ROBERTSON | G369: BOYD | J369: HARRIS | M369: SULLIVAN | O369: CARROLL | R369: DAYKIN
A370: GEELONG ASSOC. | D370: POWELL | G370: GITTENS | J370: NOONAN | M370: COOPER | O370: G HARRIS | R370: ELSTON
A371: GOALKICKERS
A372: BRIGHTON | D372: DAYKIN 4 | G372: BOYD 3 | I372: DANGERFIELD 2 | M372: ROBERTSON | P372: GARCIA | R372: LYNCH
A373: GEELONG ASSOC. | D373: NOONAN 3 | G373: WAYTH 2 | J373: STEPHENS | M373: COOPER | O373: STARK | Q373: MELLAHN
A375: BRUNSWICK | C375: 3 | D375: 6 | E375: =C375*6+D375 -> 24 | G375: 7 | H375: 11 | I375: =G375*6+H375 -> 53 | K375: 12 | L375: 14 | M375: =K375*6+L375 -> 86 | O375: 18 | P375: 20 | Q375: =O375*6+P375 -> 128 | S375: BRUNSWICK
A376: PRAHRAN | C376: 0 | D376: 2 | E376: =C376*6+D376 -> 2 | G376: 1 | H376: 6 | I376: =G376*6+H376 -> 12 | K376: 1 | L376: 7 | M376: =K376*6+L376 -> 13 | O376: 3 | P376: 8 | Q376: =O376*6+P376 -> 26 | S376: JONES
A377: BEST PLAYERS
A378: BRUNSWICK | D378: KEOGH | G378: MILLEN | I378: McMAHON | L378: McINERNEY | O378: KEDDIE | R378: FITZGERALD
A379: PRAHRAN | D379: V JONES | G379: HOUSE | I379: ROBERTS | L379: FRIEND | O379: VANCE | R379: GRIFFITHS
A380: GOALKICKERS
A381: BRUNSWICK | D381: McINERNEY 11 | H381: McMAHON 6 | L381: RAYMOND
A382: PRAHRAN | D382: NAYLOR | G382: INCH | J382: THORPE
A384: ROUND 9 | E384: 21ST JUNE | J384: WEATHER | M384: FINE DULL COLD NORTH WIND | S384: PLAYED AT | X384: LADDER | AB384: ROUND | AD384: 9
D385: 1ST QTR | H385: 2ND QTR | L385: 3RD QTR | P385: FINAL | S385: FOOTSCRAY
A386: FOOTSCRAY | C386: 1 | D386: 0 | E386: =C386*6+D386 -> 6 | G386: 7 | H386: 3 | I386: =G386*6+H386 -> 45 | K386: 8 | L386: 3 | M386: =K386*6+L386 -> 51 | O386: 10 | P386: 9 | Q386: =O386*6+P386 -> 69 | S386: UMPIRE | W386: TEAM | X386: W | Y386: L | Z386: D | AA386: FOR | AB386: AGST | AC386: % | AD386: PTS
A387: NORTH MELBOURNE | C387: 4 | D387: 6 | E387: =C387*6+D387 -> 30 | G387: 4 | H387: 7 | I387: =G387*6+H387 -> 31 | K387: 8 | L387: 13 | M387: =K387*6+L387 -> 61 | O387: 8 | P387: 13 | Q387: =O387*6+P387 -> 61 | S387: BYRON
A388: BEST PLAYERS | W388: FOOTSCRAY | X388: 8 | Y388: 0 | Z388: 1 | AA388: 745 | AB388: 489 | AC388: 152.35173824130879 | AD388: 34
A389: FOOTSCRAY | D389: FORD | F389: McINTYRE | I389: HOPKINS | L389: LAIDLAW | O389: SAMSON | Q389: MUELEMAN | W389: BRUNSWICK | X389: 7 | Y389: 2 | Z389: 0 | AA389: 745 | AB389: 519 | AC389: 143.55 | AD389: 28
A390: NORTH MELBOURNE | D390: GOMEZ | F390: RUTLEY | I390: GILES | L390: JOHNSON | O390: WOOD | Q390: LEWIS | W390: WILLIAMSTOWN | X390: 6 | Y390: 3 | Z390: 0 | AA390: 587 | AB390: 511 | AC390: 114.87279843444227 | AD390: 24
A391: GOALKICKERS | W391: NORTHCOTE | X391: 5 | Y391: 3 | Z391: 1 | AA391: 637 | AB391: 604 | AC391: 105.46 | AD391: 22
A392: FOOTSCRAY | D392: PUNCH 2 | F392: BAYLISS 2 | I392: FRASER | K392: HOPKINS | M392: ZINNICK | O392: EASON | Q392: SAMSON | S392: McCARTHY
A393: NORTH MELBOURNE | D393: METCALFE 3 | G393: WOOD 3 | I393: McINTOSH | L393: JOHNSON | W393: PORT MELBOURNE | X393: 5 | Y393: 4 | Z393: 0 | AA393: 606 | AB393: 568 | AC393: 106.69014084507042 | AD393: 20
W394: NORTH MELBOURNE | X394: 4 | Y394: 5 | Z394: 0 | AA394: 694 | AB394: 529 | AC394: 131.19092627599244 | AD394: 16
A395: BRUNSWICK | C395: 2 | D395: 3 | E395: =C395*6+D395 -> 15 | G395: 6 | H395: 5 | I395: =G395*6+H395 -> 41 | K395: 9 | L395: 8 | M395: =K395*6+L395 -> 62 | O395: 10 | P395: 11 | Q395: =O395*6+P395 -> 71 | S395: BRUNSWICK | W395: HAWTHORN | X395: 4 | Y395: 5 | Z395: 0 | AA395: 641 | AB395: 562 | AC395: 114.05693950177935 | AD395: 16
A396: HAWTHORN | C396: 3 | D396: 4 | E396: =C396*6+D396 -> 22 | G396: 4 | H396: 4 | I396: =G396*6+H396 -> 28 | K396: 7 | L396: 5 | M396: =K396*6+L396 -> 47 | O396: 7 | P396: 6 | Q396: =O396*6+P396 -> 48 | S396: JONES | W396: GEELONG ASSOC. | X396: 3 | Y396: 6 | Z396: 0 | AA396: 498 | AB396: 740 | AC396: 67.3 | AD396: 12
A397: BEST PLAYERS | W397: BRIGHTON | X397: 2 | Y397: 7 | Z397: 0 | AA397: 577 | AB397: 707 | AC397: 81.61 | AD397: 8
A398: BRUNSWICK | D398: MILLEN | G398: SWIFT | I398: RAYMOND | L398: McINERNEY | O398: WILLIAMSON | R398: ROBERTS | W398: PRAHRAN | X398: 0 | Y398: 9 | Z398: 0 | AA398: 391 | AB398: 892 | AC398: 43.834080717488789 | AD398: 0
A399: HAWTHORN | D399: BRISCOE | G399: UTTING | I399: GILL | L399: BURKE | O399: DAVEY | R399: WRIGHT
A400: GOALKICKERS
A401: BRUNSWICK | D401: McINERNEY 5 | G401: CLIFFORD 2 | J401: FITZGERALD | M401: WILLIAMSON | P401: BULT
A402: HAWTHORN | D402: HOLLIDAY 2 | G402: WALTON | I402: YEOMANS | K402: OFFICER | M402: GILL | O402: LETHLEAN
A404: PORT MELBOURNE | C404: 1 | D404: 1 | E404: =C404*6+D404 -> 7 | G404: 7 | H404: 5 | I404: =G404*6+H404 -> 47 | K404: 8 | L404: 6 | M404: =K404*6+L404 -> 54 | O404: 9 | P404: 12 | Q404: =O404*6+P404 -> 66 | S404: BRIGHTON BEACH
A405: BRIGHTON | C405: 4 | D405: 6 | E405: =C405*6+D405 -> 30 | G405: 4 | H405: 7 | I405: =G405*6+H405 -> 31 | K405: 6 | L405: 13 | M405: =K405*6+L405 -> 49 | O405: 6 | P405: 15 | Q405: =O405*6+P405 -> 51 | S405: COLLINS
A406: BEST PLAYERS
A407: PORT MELBOURNE | D407: W JOHNSTONE | G407: STANBRIDGE | J407: M JOHNSON | M407: FORBES | P407: TREMBATH | S407: SKILTON
A408: BRIGHTON | D408: HARRIS | G408: TONKIN | J408: MATTHEWS | M408: DANGERFIELD | P408: GARCIA | S408: LILBURNE
A409: GOALKICKERS
A410: PORT MELBOURNE | D410: W JOHNSTONE 3 | H410: ENNIS 3 | J410: LEWIS 2 | L410: STANBRIDGE | O410: DEVINE
A411: BRIGHTON | D411: ATKINSON | G411: DANGERFIELD | J411: HARRIS | L411: TONKIN | N411: BORLAND | Q411: DAYKIN
A413: NORTHCOTE | C413: 2 | D413: 2 | E413: =C413*6+D413 -> 14 | G413: 5 | H413: 9 | I413: =G413*6+H413 -> 39 | K413: 7 | L413: 11 | M413: =K413*6+L413 -> 53 | O413: 11 | P413: 16 | Q413: =O413*6+P413 -> 82 | S413: TOORAK PARK
A414: PRAHRAN | C414: 3 | D414: 3 | E414: =C414*6+D414 -> 21 | G414: 4 | H414: 3 | I414: =G414*6+H414 -> 27 | K414: 6 | L414: 3 | M414: =K414*6+L414 -> 39 | O414: 6 | P414: 5 | Q414: =O414*6+P414 -> 41 | S414: FRIMLEY
A415: BEST PLAYERS
A416: NORTHCOTE | D416: H SMITH | G416: DOWNES | J416: ROSS | M416: DIMMICK | P416: McCASKER | S416: CROWLEY
A417: PRAHRAN | D417: E JONES | G417: V JONES | J417: ROBERTS | M417: McLEOD | P417: THORPE | S417: BOUSSIE
A418: GOALKICKERS
A419: NORTHCOTE | D419: DIMMICK 3 | G419: GOUGH 2 | J419: TAYLOR 2 | M419: SMITH | O419: REID | Q419: McCASKER | T419: SHEEHY
A420: PRAHRAN | D420: NAYLOR | F420: BAXTER | H420: DOOLAN | J420: V JONES | L420: DONALD | N420: THORPE
A422: GEELONG ASSOC. | C422: 2 | D422: 2 | E422: =C422*6+D422 -> 14 | G422: 3 | H422: 3 | I422: =G422*6+H422 -> 21 | K422: 6 | L422: 7 | M422: =K422*6+L422 -> 43 | O422: 6 | P422: 7 | Q422: =O422*6+P422 -> 43 | S422: WILLIAMSTOWN
A423: WILLIAMSTOWN | C423: 0 | D423: 2 | E423: =C423*6+D423 -> 2 | G423: 2 | H423: 7 | I423: =G423*6+H423 -> 19 | K423: 3 | L423: 10 | M423: =K423*6+L423 -> 28 | O423: 5 | P423: 11 | Q423: =O423*6+P423 -> 41 | S423: LEHENY
A424: BEST PLAYERS
A425: GEELONG ASSOC. | D425: CATIONS | G425: ROUTLEY | J425: HEWITSON | M425: ELSTON | P425: BIRCH | S425: LAIDLAW
A426: WILLIAMSTOWN | D426: STONE | G426: CARPENTER | J426: BRITT | M426: GEISLER | P426: McDONALD | S426: CONDON
A427: GOALKICKERS
A428: GEELONG ASSOC. | D428: HEWITSON 2 | G428: COOPER | J428: ELSTON | L428: BIRCH | N428: NOONAN
A429: WILLIAMSTOWN | D429: CARPENTER 2 | H429: McDONALD 2 | L429: HOLTEN
A431: ROUND 10 | E431: 28TH JUNE | J431: WEATHER | M431: FINE NORTH BREEZE | S431: PLAYED AT | X431: LADDER | AB431: ROUND | AD431: 10
D432: 1ST QTR | H432: 2ND QTR | L432: 3RD QTR | P432: FINAL | S432: WILLIAMSTOWN
A433: WILLIAMSTOWN | C433: 0 | D433: 2 | E433: =C433*6+D433 -> 2 | G433: 2 | H433: 7 | I433: =G433*6+H433 -> 19 | K433: 3 | L433: 9 | M433: =K433*6+L433 -> 27 | O433: 5 | P433: 14 | Q433: =O433*6+P433 -> 44 | S433: UMPIRE | W433: TEAM | X433: W | Y433: L | Z433: D | AA433: FOR | AB433: AGST | AC433: % | AD433: PTS
A434: BRUNSWICK | C434: 0 | D434: 2 | E434: =C434*6+D434 -> 2 | G434: 2 | H434: 3 | I434: =G434*6+H434 -> 15 | K434: 3 | L434: 6 | M434: =K434*6+L434 -> 24 | O434: 4 | P434: 6 | Q434: =O434*6+P434 -> 30 | S434: FRIMLEY
A435: BEST PLAYERS | W435: FOOTSCRAY | X435: 9 | Y435: 0 | Z435: 1 | AA435: 834 | AB435: 536 | AC435: 155.59701492537314 | AD435: 38
A436: WILLIAMSTOWN | D436: LAIDLAW | G436: CONDON | I436: GEISLER | K436: McDONALD | N436: CARPENTER | Q436: STONE | W436: BRUNSWICK | X436: 7 | Y436: 3 | Z436: 0 | AA436: 775 | AB436: 563 | AC436: 137.66 | AD436: 28
A437: BRUNSWICK | D437: HASSETT | G437: HYDE | I437: ROBERTS | K437: McMILLAN | N437: MILLEN | Q437: BULT | W437: WILLIAMSTOWN | X437: 7 | Y437: 3 | Z437: 0 | AA437: 631 | AB437: 541 | AC437: 116.6358595194085 | AD437: 28
A438: GOALKICKERS | W438: PORT MELBOURNE | X438: 6 | Y438: 4 | Z438: 0 | AA438: 681 | AB438: 621 | AC438: 109.66183574879227 | AD438: 24
A439: WILLIAMSTOWN | D439: GEISLER 2 | G439: LEE | I439: CARPENTER | L439: McDONALD
A440: BRUNSWICK | D440: McMAHON | G440: O'CONNOR | J440: FITZGERALD | M440: McCORMACK | W440: NORTHCOTE | X440: 5 | Y440: 4 | Z440: 1 | AA440: 690 | AB440: 679 | AC440: 101.62 | AD440: 22
W441: NORTH MELBOURNE | X441: 5 | Y441: 5 | Z441: 0 | AA441: 762 | AB441: 577 | AC441: 132.06239168110918 | AD441: 20
A442: PORT MELBOURNE | C442: 3 | D442: 2 | E442: =C442*6+D442 -> 20 | G442: 6 | H442: 3 | I442: =G442*6+H442 -> 39 | K442: 11 | L442: 6 | M442: =K442*6+L442 -> 72 | O442: 11 | P442: 9 | Q442: =O442*6+P442 -> 75 | S442: NORTHCOTE | W442: HAWTHORN | X442: 4 | Y442: 6 | Z442: 0 | AA442: 689 | AB442: 630 | AC442: 109.36507936507937 | AD442: 16
A443: NORTHCOTE | C443: 1 | D443: 4 | E443: =C443*6+D443 -> 10 | G443: 4 | H443: 9 | I443: =G443*6+H443 -> 33 | K443: 6 | L443: 12 | M443: =K443*6+L443 -> 48 | O443: 8 | P443: 15 | Q443: =O443*6+P443 -> 63 | S443: JONES | W443: GEELONG ASSOC. | X443: 3 | Y443: 7 | Z443: 0 | AA443: 545 | AB443: 829 | AC443: 65.74 | AD443: 12
A444: BEST PLAYERS | W444: BRIGHTON | X444: 2 | Y444: 8 | Z444: 0 | AA444: 620 | AB444: 755 | AC444: 82.12 | AD444: 8
A445: PORT MELBOURNE | D445: DOBRIGH | G445: W JOHNSTONE | J445: TREMBATH | M445: FROUD | O445: DILLON | R445: SKILTON | W445: PRAHRAN | X445: 1 | Y445: 9 | Z445: 0 | AA445: 439 | AB445: 935 | AC445: 46.951871657754012 | AD445: 4
A446: NORTHCOTE | D446: THEOBOLD | G446: DOWNES | J446: SHEEHY | M446: ROSS | O446: WOOLLLARD | R446: LONG
A447: GOALKICKERS
A448: PORT MELBOURNE | D448: ENNIS 3 | G448: FROUD 3 | I448: W JOHNSTONE 2 | M448: TREMBATH | P448: SKILTON | R448: RUDD
A449: NORTHCOTE | D449: GOUGH 4 | G449: YATES 2 | J449: DOWNES | M449: JOHNSON
A451: NORTH MELBOURNE | C451: 2 | D451: 4 | E451: =C451*6+D451 -> 16 | G451: 3 | H451: 5 | I451: =G451*6+H451 -> 23 | K451: 7 | L451: 17 | M451: =K451*6+L451 -> 59 | O451: 8 | P451: 20 | Q451: =O451*6+P451 -> 68 | S451: NORTH MELB
A452: HAWTHORN | C452: 0 | D452: 2 | E452: =C452*6+D452 -> 2 | G452: 2 | H452: 4 | I452: =G452*6+H452 -> 16 | K452: 4 | L452: 5 | M452: =K452*6+L452 -> 29 | O452: 7 | P452: 6 | Q452: =O452*6+P452 -> 48 | S452: LEHENY
A453: BEST PLAYERS
A454: NORTH MELBOURNE | D454: LINTON | G454: RUSS | J454: METCALFE | M454: TREVASKIS | P454: GOMEZ | S454: RUTLEY
A455: HAWTHORN | D455: YEOMANS | G455: McCASHNEY | J455: LATHAM | M455: SPLATT | P455: WALTON | S455: BROWN
A456: GOALKICKERS
A457: NORTH MELBOURNE | D457: LEWIS 2 | G457: TREVASKIS 2 | J457: WOOD 2 | M457: JOHNSON | P457: METCALFE
A458: HAWTHORN | D458: YEOMANS 3 | G458: BEASLEY | J458: OFFICER | M458: SPLATT | O458: McCASHNEY
A460: PRAHRAN | C460: 3 | D460: 2 | E460: =C460*6+D460 -> 20 | G460: 4 | H460: 3 | I460: =G460*6+H460 -> 27 | K460: 7 | L460: 5 | M460: =K460*6+L460 -> 47 | O460: 7 | P460: 6 | Q460: =O460*6+P460 -> 48 | S460: TOORAK PARK
A461: BRIGHTON | C461: 0 | D461: 1 | E461: =C461*6+D461 -> 1 | G461: 1 | H461: 5 | I461: =G461*6+H461 -> 11 | K461: 1 | L461: 8 | M461: =K461*6+L461 -> 14 | O461: 5 | P461: 13 | Q461: =O461*6+P461 -> 43 | S461: VALLANCE
A462: BEST PLAYERS
A463: PRAHRAN | D463: FERGEUS | G463: V JONES | J463: LYTE | M463: MILLER | P463: ROBERTS | S463: GRIFFITHS
A464: BRIGHTON | D464: DAYKIN | G464: RUMNEY | J464: LILBURNE | M464: HARRIS | P464: GARCIA | S464: MONGAN
A465: GOALKICKERS
A466: PRAHRAN | D466: A MILLER 5 | G466: NAYLOR | J466: FERGEUS
A467: BRIGHTON | D467: DAYKIN 3 | G467: BENCE | J467: RUMNEY
A469: FOOTSCRAY | C469: 0 | D469: 0 | E469: =C469*6+D469 -> 0 | G469: 6 | H469: 7 | I469: =G469*6+H469 -> 43 | K469: 8 | L469: 10 | M469: =K469*6+L469 -> 58 | O469: 12 | P469: 17 | Q469: =O469*6+P469 -> 89 | S469: FOOTSCRAY
A470: GEELONG ASSOC. | C470: 3 | D470: 11 | E470: =C470*6+D470 -> 29 | G470: 3 | H470: 11 | I470: =G470*6+H470 -> 29 | K470: 6 | L470: 11 | M470: =K470*6+L470 -> 47 | O470: 6 | P470: 11 | Q470: =O470*6+P470 -> 47 | S470: BYRON
A471: BEST PLAYERS
A472: FOOTSCRAY | D472: McCARTHY | G472: BAYLISS | J472: EASON | M472: PUNCH | O472: FORD | R472: McINTYRE
A473: GEELONG ASSOC. | D473: FERRIS | G473: NOONAN | J473: GITTENS | M473: PRIDDLE | O473: POWELL
A474: GOALKICKERS
A475: FOOTSCRAY | D475: MULLINS 5 | G475: HOPKINS 3 | J475: PUNCH | L475: EASON | N475: ROSS | P475: McINTYRE
A476: GEELONG ASSOC. | D476: NOONAN 4 | G476: STACK | J476: ROUTLEY
A478: ROUND 11 | E478: 5TH JULY | J478: WEATHER | M478: FINE | S478: PLAYED AT | X478: LADDER | AB478: ROUND | AD478: 11
D479: 1ST QTR | H479: 2ND QTR | L479: 3RD QTR | P479: FINAL | S479: BRUNSWICK
A480: FOOTSCRAY | C480: 3 | D480: 7 | E480: =C480*6+D480 -> 25 | G480: 5 | H480: 12 | I480: =G480*6+H480 -> 42 | K480: 8 | L480: 14 | M480: =K480*6+L480 -> 62 | O480: 9 | P480: 14 | Q480: =O480*6+P480 -> 68 | S480: UMPIRE | W480: TEAM | X480: W | Y480: L | Z480: D | AA480: FOR | AB480: AGST | AC480: % | AD480: PTS
A481: BRUNSWICK | C481: 1 | D481: 1 | E481: =C481*6+D481 -> 7 | G481: 2 | H481: 3 | I481: =G481*6+H481 -> 15 | K481: 4 | L481: 6 | M481: =K481*6+L481 -> 30 | O481: 5 | P481: 8 | Q481: =O481*6+P481 -> 38 | S481: LEHENY
A482: BEST PLAYERS | W482: FOOTSCRAY | X482: 10 | Y482: 0 | Z482: 1 | AA482: 902 | AB482: 574 | AC482: 157.14285714285714 | AD482: 42
A483: FOOTSCRAY | D483: EASON | F483: HOPKINS | I483: DOOLAN | L483: PUNCH | O483: McINTYRE | Q483: FORD | W483: WILLIAMSTOWN | X483: 8 | Y483: 3 | Z483: 0 | AA483: 744 | AB483: 611 | AC483: 121.76759410801964 | AD483: 32
A484: BRUNSWICK | D484: SWIFT | F484: KEDDIE | I484: MILLEN | L484: FITZGERALD | O484: BULT | Q484: ROBERTS | W484: BRUNSWICK | X484: 7 | Y484: 4 | Z484: 0 | AA484: 813 | AB484: 631 | AC484: 128.84 | AD484: 28
A485: GOALKICKERS | W485: PORT MELBOURNE | X485: 7 | Y485: 4 | Z485: 0 | AA485: 794 | AB485: 676 | AC485: 117.45562130177515 | AD485: 28
A486: FOOTSCRAY | D486: BAYLISS 4 | G486: O'BRIEN 2 | J486: HOPKINS | M486: EASON | O486: MULLINS
A487: BRUNSWICK | D487: CONSIDINE 2 | H487: GREEN 2 | K487: WILLIAMSON | W487: NORTH MELBOURNE | X487: 6 | Y487: 5 | Z487: 0 | AA487: 869 | AB487: 629 | AC487: 138.1558028616852 | AD487: 24
W488: NORTHCOTE | X488: 5 | Y488: 5 | Z488: 1 | AA488: 725 | AB488: 732 | AC488: 99.04 | AD488: 22
A489: HAWTHORN | C489: 0 | D489: 5 | E489: =C489*6+D489 -> 5 | G489: 2 | H489: 13 | I489: =G489*6+H489 -> 25 | K489: 5 | L489: 13 | M489: =K489*6+L489 -> 43 | O489: 6 | P489: 17 | Q489: =O489*6+P489 -> 53 | S489: GLENFERRIE | W489: HAWTHORN | X489: 5 | Y489: 6 | Z489: 0 | AA489: 742 | AB489: 665 | AC489: 111.57894736842105 | AD489: 20
A490: NORTHCOTE | C490: 1 | D490: 2 | E490: =C490*6+D490 -> 8 | G490: 2 | H490: 3 | I490: =G490*6+H490 -> 15 | K490: 3 | L490: 6 | M490: =K490*6+L490 -> 24 | O490: 4 | P490: 11 | Q490: =O490*6+P490 -> 35 | S490: PANNAM | W490: GEELONG ASSOC. | X490: 3 | Y490: 8 | Z490: 0 | AA490: 597 | AB490: 936 | AC490: 63.78 | AD490: 12
A491: BEST PLAYERS | W491: BRIGHTON | X491: 2 | Y491: 9 | Z491: 0 | AA491: 690 | AB491: 868 | AC491: 79.49 | AD491: 8
A492: HAWTHORN | D492: McCASHNEY | G492: JACKSON | J492: FINCH | L492: WALTON | O492: GILL | Q492: LETHLEAN | W492: PRAHRAN | X492: 1 | Y492: 10 | Z492: 0 | AA492: 494 | AB492: 1048 | AC492: 47.137404580152669 | AD492: 4
A493: NORTHCOTE | D493: SHEEHY | G493: WOOLLLARD | J493: GOUGH | L493: ROSS | O493: TAYLOR | Q493: DIMMICK
A494: GOALKICKERS
A495: HAWTHORN | D495: LETHLEAN | G495: WALTON | J495: FINCH | L495: SPLATT | N495: RUDD | P495: YEOMANS
A496: NORTHCOTE | D496: GOUGH 2 | G496: TAYLOR 2
A498: NORTH MELBOURNE | C498: 3 | D498: 2 | E498: =C498*6+D498 -> 20 | G498: 6 | H498: 6 | I498: =G498*6+H498 -> 42 | K498: 10 | L498: 13 | M498: =K498*6+L498 -> 73 | O498: 15 | P498: 17 | Q498: =O498*6+P498 -> 107 | S498: KARDINIA PARK
A499: GEELONG ASSOC. | C499: 4 | D499: 3 | E499: =C499*6+D499 -> 27 | G499: 4 | H499: 4 | I499: =G499*6+H499 -> 28 | K499: 6 | L499: 7 | M499: =K499*6+L499 -> 43 | O499: 7 | P499: 10 | Q499: =O499*6+P499 -> 52 | S499: PETERS
A500: BEST PLAYERS
A501: NORTH MELBOURNE | D501: LEWIS | G501: GOMEZ | J501: LINTON | M501: JOHNSON | P501: McINTOSH | S501: TREVASKIS
A502: GEELONG ASSOC. | D502: CORFIELD | G502: CATIONS | J502: ROUTLEY | M502: HARRIS | P502: COOPER | S502: PRIDDLE
A503: GOALKICKERS
A504: NORTH MELBOURNE | D504: TREVASKIS 3 | G504: METCALFE 3 | J504: WOOD 3 | L504: WALSH 2 | N504: JOHNSON | P504: GOMEZ | R504: LINTON | U504: SHORTEN
A505: GEELONG ASSOC. | D505: STACK 3 | G505: ELSTON 2 | J505: HARRIS | L505: DIGBY
A507: WILLIAMSTOWN | C507: 7 | D507: 6 | E507: =C507*6+D507 -> 48 | G507: 10 | H507: 8 | I507: =G507*6+H507 -> 68 | K507: 13 | L507: 11 | M507: =K507*6+L507 -> 89 | O507: 16 | P507: 17 | Q507: =O507*6+P507 -> 113 | S507: BRIGHTON BEACH
A508: BRIGHTON | C508: 0 | D508: 1 | E508: =C508*6+D508 -> 1 | G508: 2 | H508: 6 | I508: =G508*6+H508 -> 18 | K508: 4 | L508: 7 | M508: =K508*6+L508 -> 31 | O508: 10 | P508: 10 | Q508: =O508*6+P508 -> 70 | S508: JONES
A509: BEST PLAYERS
A510: WILLIAMSTOWN | D510: LAIDLAW | G510: CONDON | J510: BLANCHE | M510: LEE | O510: GEISLER | R510: FLANNERY
A511: BRIGHTON | D511: THRELFALL | G511: HARRIS | J511: BANKS | M511: JOHNSON | O511: DANGERFIELD | R511: TONKIN
A512: GOALKICKERS
A513: WILLIAMSTOWN | D513: MUNN 4 | F513: CARPENTER 4 | I513: MITCHELL 2 | L513: McDONALD 2 | O513: BLANCHE 2 | R513: GEDDES | U513: LEE
A514: BRIGHTON | D514: THRELFALL 3 | G514: TONKIN 2 | J514: DANGERFIELD | M514: BENCE | O514: HARRIS | Q514: JOHNSON | S514: DAYKIN
A516: PORT MELBOURNE | C516: 4 | D516: 3 | E516: =C516*6+D516 -> 27 | G516: 7 | H516: 9 | I516: =G516*6+H516 -> 51 | K516: 10 | L516: 10 | M516: =K516*6+L516 -> 70 | O516: 16 | P516: 17 | Q516: =O516*6+P516 -> 113 | S516: PORT MELB
A517: PRAHRAN | C517: 1 | D517: 1 | E517: =C517*6+D517 -> 7 | G517: 2 | H517: 4 | I517: =G517*6+H517 -> 16 | K517: 7 | L517: 7 | M517: =K517*6+L517 -> 49 | O517: 8 | P517: 7 | Q517: =O517*6+P517 -> 55 | S517: FRIMLEY
A518: BEST PLAYERS
A519: PORT MELBOURNE | D519: FORBES | G519: WALL | J519: MURPHY | M519: W JOHNSTONE | P519: M JOHNSON | S519: TREMBATH
A520: PRAHRAN | D520: V JONES | G520: LYTE | J520: MILLER | M520: NAYLOR | P520: ROBERTS | S520: McLEOD
A521: GOALKICKERS
A522: PORT MELBOURNE | D522: ENNIS 5 | F522: W JOHNSTONE 3 | J522: FROUD 3 | M522: OGILVIE 2 | O522: MURPPHY 2 | R522: W RUDD
A523: PRAHRAN | D523: A MILLER 5 | G523: DONOHOO 2 | J523: ROBERTS
A525: ROUND 12 | E525: 12TH JULY | J525: WEATHER | M525: FINE | S525: PLAYED AT | X525: LADDER | AB525: ROUND | AD525: 12
D526: 1ST QTR | H526: 2ND QTR | L526: 3RD QTR | P526: FINAL | S526: NORTHCOTE
A527: NORTHCOTE | C527: 3 | D527: 4 | E527: =C527*6+D527 -> 22 | G527: 6 | H527: 6 | I527: =G527*6+H527 -> 42 | K527: 6 | L527: 11 | M527: =K527*6+L527 -> 47 | O527: 8 | P527: 14 | Q527: =O527*6+P527 -> 62 | S527: UMPIRE | W527: TEAM | X527: W | Y527: L | Z527: D | AA527: FOR | AB527: AGST | AC527: % | AD527: PTS
A528: WILLIAMSTOWN | C528: 0 | D528: 2 | E528: =C528*6+D528 -> 2 | G528: 3 | H528: 5 | I528: =G528*6+H528 -> 23 | K528: 5 | L528: 6 | M528: =K528*6+L528 -> 36 | O528: 8 | P528: 7 | Q528: =O528*6+P528 -> 55 | S528: FRIMLEY
A529: BEST PLAYERS | W529: FOOTSCRAY | X529: 11 | Y529: 0 | Z529: 1 | AA529: 1002 | AB529: 624 | AC529: 160.57692307692307 | AD529: 46
A530: NORTHCOTE | D530: JOHNSON | G530: SHEEHY | J530: GOUGH | M530: BUISST | O530: LONG | Q530: ROSS | W530: PORT MELBOURNE | X530: 8 | Y530: 4 | Z530: 0 | AA530: 895 | AB530: 718 | AC530: 124.65181058495821 | AD530: 32
A531: WILLIAMSTOWN | D531: GEISLER | G531: STANFORD | J531: McAULIFFE | M531: MITCHELL | O531: CONDON | Q531: LEE | W531: WILLIAMSTOWN | X531: 8 | Y531: 4 | Z531: 0 | AA531: 799 | AB531: 673 | AC531: 118.7221396731055 | AD531: 32
A532: GOALKICKERS | W532: NORTH MELBOURNE | X532: 7 | Y532: 5 | Z532: 0 | AA532: 930 | AB532: 681 | AC532: 136.56387665198238 | AD532: 28
A533: NORTHCOTE | D533: GOUGH 3 | G533: JOHNSON 2 | J533: YATES | L533: TAYLOR | N533: ROSS
A534: WILLIAMSTOWN | D534: McDONALD 2 | G534: BEER | I534: LEE | J534: McAULIFFE | M534: STANFORD | P534: LEWIS | R534: GEISLER | W534: BRUNSWICK | X534: 7 | Y534: 5 | Z534: 0 | AA534: 865 | AB534: 692 | AC534: 125 | AD534: 28
W535: NORTHCOTE | X535: 6 | Y535: 5 | Z535: 1 | AA535: 787 | AB535: 787 | AC535: 100 | AD535: 26
A536: NORTH MELBOURNE | C536: 1 | D536: 5 | E536: =C536*6+D536 -> 11 | G536: 5 | H536: 10 | I536: =G536*6+H536 -> 40 | K536: 6 | L536: 10 | M536: =K536*6+L536 -> 46 | O536: 8 | P536: 13 | Q536: =O536*6+P536 -> 61 | S536: NORTH MELB | W536: HAWTHORN | X536: 6 | Y536: 6 | Z536: 0 | AA536: 864 | AB536: 711 | AC536: 121.51898734177215 | AD536: 24
A537: BRUNSWICK | C537: 2 | D537: 4 | E537: =C537*6+D537 -> 16 | G537: 2 | H537: 5 | I537: =G537*6+H537 -> 17 | K537: 4 | L537: 7 | M537: =K537*6+L537 -> 31 | O537: 7 | P537: 10 | Q537: =O537*6+P537 -> 52 | S537: JONES | W537: GEELONG ASSOC. | X537: 3 | Y537: 9 | Z537: 0 | AA537: 639 | AB537: 1037 | AC537: 61.62 | AD537: 12
A538: BEST PLAYERS | W538: BRIGHTON | X538: 2 | Y538: 10 | Z538: 0 | AA538: 740 | AB538: 968 | AC538: 76.45 | AD538: 8
A539: NORTH MELBOURNE | D539: LEWIS | G539: DAWSON | J539: GOMEZ | M539: LAMBE | O539: WATSON | Q539: WALSH | W539: PRAHRAN | X539: 1 | Y539: 11 | Z539: 0 | AA539: 540 | AB539: 1170 | AC539: 46.153846153846153 | AD539: 4
A540: BRUNSWICK | D540: MILLEN | G540: RALEIGH | J540: KEDDIE | M540: HART | O540: BULT | Q540: HASSETT
A541: GOALKICKERS
A542: NORTH MELBOURNE | D542: WALSH 2 | G542: DAWSON 2 | J542: METCALFE | M542: JOHNSON | P542: CLAPSON
A543: BRUNSWICK | D543: GREEN 3 | G543: HART 2 | J543: MILLEN | L543: KEDDIE
A545: PORT MELBOURNE | C545: 5 | D545: 2 | E545: =C545*6+D545 -> 32 | G545: 7 | H545: 6 | I545: =G545*6+H545 -> 48 | K545: 9 | L545: 10 | M545: =K545*6+L545 -> 64 | O545: 14 | P545: 17 | Q545: =O545*6+P545 -> 101 | S545: PORT MELB
A546: GEELONG ASSOC. | C546: 1 | D546: 6 | E546: =C546*6+D546 -> 12 | G546: 3 | H546: 6 | I546: =G546*6+H546 -> 24 | K546: 5 | L546: 11 | M546: =K546*6+L546 -> 41 | O546: 5 | P546: 12 | Q546: =O546*6+P546 -> 42 | S546: PANNAM
A547: BEST PLAYERS
A548: PORT MELBOURNE | D548: OGILVIE | G548: W RUDD | J548: J RUDD | M548: M JOHNSON | P548: CROMPTON | S548: SKILTON
A549: GEELONG ASSOC. | D549: FERRIS | G549: CORFIELD | J549: COOPER | M549: ELSTON | P549: HARRIS | S549: PRIDDLE
A550: GOALKICKERS
A551: PORT MELBOURNE | D551: ENNIS 4 | F551: SKILTON 2 | I551: BARFOOT 2 | L551: W RUDD | N551: MURPHY | P551: FROUD | R551: K JOHNSON | U551: LEWIS | W551: J RUDD
A552: GEELONG ASSOC. | D552: COOPER 2 | G552: NOONAN | J552: FERRIS | L552: HARRIS
A554: HAWTHORN | C554: 4 | D554: 2 | E554: =C554*6+D554 -> 26 | G554: 8 | H554: 10 | I554: =G554*6+H554 -> 58 | K554: 12 | L554: 12 | M554: =K554*6+L554 -> 84 | O554: 18 | P554: 14 | Q554: =O554*6+P554 -> 122 | S554: TOORAK PARK
A555: PRAHRAN | C555: 1 | D555: 1 | E555: =C555*6+D555 -> 7 | G555: 2 | H555: 2 | I555: =G555*6+H555 -> 14 | K555: 4 | L555: 2 | M555: =K555*6+L555 -> 26 | O555: 7 | P555: 4 | Q555: =O555*6+P555 -> 46 | S555: LEHENY
A556: BEST PLAYERS
A557: HAWTHORN | D557: GILL | G557: UTTING | J557: PEARSON | M557: FINCH | P557: YEOMANS | S557: BROWN
A558: PRAHRAN | D558: V JONES | G558: DONOHOO | J558: NAYLOR | M558: BOUSSIE | P558: VANCE | S558: WARD
A559: GOALKICKERS
A560: HAWTHORN | D560: OFFICER 5 | F560: RUDD 3 | H560: YEOMANS 2 | K560: LETHLEAN 2 | N560: BURKE 2 | P560: SPLATT 2 | R560: WALTON | U560: FINCH
A561: PRAHRAN | D561: NAYLOR 5 | G561: A MILLER | J561: PROCTOR
A563: FOOTSCRAY | C563: 3 | D563: 1 | E563: =C563*6+D563 -> 19 | G563: 6 | H563: 11 | I563: =G563*6+H563 -> 47 | K563: 11 | L563: 13 | M563: =K563*6+L563 -> 79 | O563: 14 | P563: 16 | Q563: =O563*6+P563 -> 100 | S563: BRIGHTON BEACH
A564: BRIGHTON | C564: 3 | D564: 3 | E564: =C564*6+D564 -> 21 | G564: 5 | H564: 8 | I564: =G564*6+H564 -> 38 | K564: 6 | L564: 10 | M564: =K564*6+L564 -> 46 | O564: 6 | P564: 14 | Q564: =O564*6+P564 -> 50 | S564: PETERS
A565: BEST PLAYERS
A566: FOOTSCRAY | D566: HOPKINS | G566: PUNCH | J566: MULLINS | M566: SAMSON | P566: EASON | S566: MUELEMAN
A567: BRIGHTON | D567: RUMNEY | G567: GARCIA | J567: MATTHEWS | M567: LILBURNE | P567: BURKE | S567: DANGERFIELD
A568: GOALKICKERS
A569: FOOTSCRAY | D569: MULLINS 4 | G569: PUNCH 3 | J569: HOPKINS 3 | M569: BAYLISS | O569: EASON | Q569: HOWELL | S569: O'BRIEN
A570: BRIGHTON | D570: BANKS 2 | G570: DILLON | J570: DANGERFIELD | M570: TONKIN | O570: DAYKIN
A572: ROUND 13 | E572: 19TH JULY | J572: WEATHER | M572: FINE NORTH BREEZE | S572: PLAYED AT | X572: LADDER | AB572: ROUND | AD572: 13
D573: 1ST QTR | H573: 2ND QTR | L573: 3RD QTR | P573: FINAL | S573: NORTH MELB
A574: PORT MELBOURNE | C574: 2 | D574: 1 | E574: =C574*6+D574 -> 13 | G574: 6 | H574: 6 | I574: =G574*6+H574 -> 42 | K574: 8 | L574: 8 | M574: =K574*6+L574 -> 56 | O574: 11 | P574: 11 | Q574: =O574*6+P574 -> 77 | S574: UMPIRE | W574: TEAM | X574: W | Y574: L | Z574: D | AA574: FOR | AB574: AGST | AC574: % | AD574: PTS
A575: NORTH MELBOURNE | C575: 0 | D575: 8 | E575: =C575*6+D575 -> 8 | G575: 2 | H575: 11 | I575: =G575*6+H575 -> 23 | K575: 6 | L575: 14 | M575: =K575*6+L575 -> 50 | O575: 6 | P575: 17 | Q575: =O575*6+P575 -> 53 | S575: PETERS
A576: BEST PLAYERS | W576: FOOTSCRAY | X576: 12 | Y576: 0 | Z576: 1 | AA576: 1100 | AB576: 653 | AC576: 168.45329249617151 | AD576: 50
A577: PORT MELBOURNE | D577: M JOHNSON | G577: CROMPTON | J577: LEWIS | L577: W RUDD | O577: J RUDD | Q577: DOBRIGH | W577: PORT MELBOURNE | X577: 9 | Y577: 4 | Z577: 0 | AA577: 972 | AB577: 771 | AC577: 126.07003891050584 | AD577: 36
A578: NORTH MELBOURNE | D578: JOHNSON | G578: LEWIS | J578: GOMEZ | L578: McINTOSH | O578: SMITH | Q578: TREVASKIS | W578: WILLIAMSTOWN | X578: 9 | Y578: 4 | Z578: 0 | AA578: 873 | AB578: 706 | AC578: 123.65439093484419 | AD578: 36
A579: GOALKICKERS | W579: BRUNSWICK | X579: 8 | Y579: 5 | Z579: 0 | AA579: 925 | AB579: 747 | AC579: 123.83 | AD579: 32
A580: PORT MELBOURNE | D580: ENNIS 3 | F580: LEWIS 3 | H580: OGILVIE 2 | J580: SKILTON | L580: BARFOOT | N580: DILLON
A581: NORTH MELBOURNE | D581: LEWIS | F581: DAWSON | I581: TREVASKIS | L581: CLAPSON | N581: METCALFE | Q581: JOHNSON | W581: NORTH MELBOURNE | X581: 7 | Y581: 6 | Z581: 0 | AA581: 983 | AB581: 758 | AC581: 129.68337730870712 | AD581: 28
W582: HAWTHORN | X582: 7 | Y582: 6 | Z582: 0 | AA582: 947 | AB582: 766 | AC582: 123.62924281984334 | AD582: 28
A583: FOOTSCRAY | C583: 3 | D583: 4 | E583: =C583*6+D583 -> 22 | G583: 3 | H583: 6 | I583: =G583*6+H583 -> 24 | K583: 10 | L583: 13 | M583: =K583*6+L583 -> 73 | O583: 14 | P583: 14 | Q583: =O583*6+P583 -> 98 | S583: FOOTSCRAY | W583: NORTHCOTE | X583: 6 | Y583: 6 | Z583: 1 | AA583: 816 | AB583: 885 | AC583: 92.2 | AD583: 26
A584: NORTHCOTE | C584: 0 | D584: 0 | E584: =C584*6+D584 -> 0 | G584: 2 | H584: 7 | I584: =G584*6+H584 -> 19 | K584: 2 | L584: 8 | M584: =K584*6+L584 -> 20 | O584: 3 | P584: 11 | Q584: =O584*6+P584 -> 29 | S584: FRIMLEY | W584: GEELONG ASSOC. | X584: 3 | Y584: 10 | Z584: 0 | AA584: 694 | AB584: 1120 | AC584: 61.96 | AD584: 12
A585: BEST PLAYERS | W585: BRIGHTON | X585: 2 | Y585: 11 | Z585: 0 | AA585: 795 | AB585: 1028 | AC585: 77.33 | AD585: 8
A586: FOOTSCRAY | D586: McCARTHY | G586: EASON | J586: NEILSON | M586: MULLINS | P586: PUNCH | R586: FORD | W586: PRAHRAN | X586: 1 | Y586: 12 | Z586: 0 | AA586: 573 | AB586: 1244 | AC586: 46.061093247588424 | AD586: 4
A587: NORTHCOTE | D587: WOODS | G587: LONG | J587: WOOLLARD | M587: JOHNSON | P587: TAYLOR | R587: REID
A588: GOALKICKERS
A589: FOOTSCRAY | D589: MULLINS 6 | G589: McCARTHY 2 | J589: HOWELL 2 | M589: FRASER 2 | P589: EASON | R589: HOPKINS
A590: NORTHCOTE | D590: GOUGH 2 | G590: SMITH
A592: HAWTHORN | C592: 2 | D592: 1 | E592: =C592*6+D592 -> 13 | G592: 6 | H592: 3 | I592: =G592*6+H592 -> 39 | K592: 9 | L592: 8 | M592: =K592*6+L592 -> 62 | O592: 11 | P592: 17 | Q592: =O592*6+P592 -> 83 | S592: KARDINIA PARK
A593: GEELONG ASSOC. | C593: 2 | D593: 3 | E593: =C593*6+D593 -> 15 | G593: 5 | H593: 5 | I593: =G593*6+H593 -> 35 | K593: 8 | L593: 7 | M593: =K593*6+L593 -> 55 | O593: 8 | P593: 7 | Q593: =O593*6+P593 -> 55 | S593: BLACKBURN
A594: BEST PLAYERS
A595: HAWTHORN | D595: FINCH | G595: LETHLEAN | J595: GILL | M595: BROWN | P595: NOTT | R595: SPLATT
A596: GEELONG ASSOC. | D596: CORFIELD | G596: DIGBY | J596: HARRIS | M596: ELSTON | P596: COOPER | R596: CATIONS
A597: GOALKICKERS
A598: HAWTHORN | D598: LETHLEAN 3 | G598: BRUCE 3 | I598: OFFICER 2 | K598: SPLATT | M598: RUDD | O598: McCASHNEY
A599: GEELONG ASSOC. | D599: COOPER 3 | G599: NOONAN | J599: HEWITSON | M599: ROUTLEY | O599: MELLAHN
A601: BRUNSWICK | C601: 3 | D601: 1 | E601: =C601*6+D601 -> 19 | G601: 4 | H601: 2 | I601: =G601*6+H601 -> 26 | K601: 7 | L601: 4 | M601: =K601*6+L601 -> 46 | O601: 9 | P601: 6 | Q601: =O601*6+P601 -> 60 | S601: BRUNSWICK
A602: BRIGHTON | C602: 1 | D602: 5 | E602: =C602*6+D602 -> 11 | G602: 5 | H602: 11 | I602: =G602*6+H602 -> 41 | K602: 7 | L602: 12 | M602: =K602*6+L602 -> 54 | O602: 7 | P602: 13 | Q602: =O602*6+P602 -> 55 | S602: JONES
A603: BEST PLAYERS
A604: BRUNSWICK | D604: MILLEN | G604: McCORMACK | J604: O'CONNOR | M604: SWIFT | P604: BULT | S604: CORBOYS
A605: BRIGHTON | D605: HARRIS | G605: DANGERFIELD | J605: JOHNSON | M605: DAYKIN | P605: SULLIVAN | S605: LILBURNE
A606: GOALKICKERS
A607: BRUNSWICK | D607: VOSTI 2 | G607: McMAHON 2 | J607: HALL 2 | L607: MILLEN 2 | O607: GREEN
A608: BRIGHTON | D608: DAYKIN 6 | G608: TONKIN
A610: WILLIAMSTOWN | C610: 1 | D610: 3 | E610: =C610*6+D610 -> 9 | G610: 4 | H610: 9 | I610: =G610*6+H610 -> 33 | K610: 6 | L610: 15 | M610: =K610*6+L610 -> 51 | O610: 9 | P610: 20 | Q610: =O610*6+P610 -> 74 | S610: WILLIAMSTOWN
A611: PRAHRAN | C611: 0 | D611: 3 | E611: =C611*6+D611 -> 3 | G611: 1 | H611: 5 | I611: =G611*6+H611 -> 11 | K611: 1 | L611: 8 | M611: =K611*6+L611 -> 14 | O611: 4 | P611: 9 | Q611: =O611*6+P611 -> 33 | S611: COLLINS
A612: BEST PLAYERS
A613: WILLIAMSTOWN | D613: GEISLER | G613: BLANCHE | J613: LAIDLAW | M613: HOLTEN | P613: MITCHELL | S613: CARPENTER
A614: PRAHRAN | D614: GRIFFITHS | G614: VANCE | J614: HEADEN | M614: LYTE | P614: DOOLEN | S614: WARD
A615: GOALKICKERS
A616: WILLIAMSTOWN | D616: CARPENTER 4 | G616: MITCHELL 2 | J616: MUNN | M616: STANFORD | P616: McDONALD
A617: PRAHRAN | D617: HEADEN 2 | G617: NAYLOR | J617: A MILLER
A619: ROUND 14 | E619: 26TH JULY | J619: WEATHER | M619: FINE | S619: PLAYED AT | X619: LADDER | AB619: ROUND | AD619: 14
D620: 1ST QTR | H620: 2ND QTR | L620: 3RD QTR | P620: FINAL | S620: FOOTSCRAY
A621: FOOTSCRAY | C621: 3 | D621: 3 | E621: =C621*6+D621 -> 21 | G621: 5 | H621: 6 | I621: =G621*6+H621 -> 36 | K621: 9 | L621: 9 | M621: =K621*6+L621 -> 63 | O621: 11 | P621: 10 | Q621: =O621*6+P621 -> 76 | S621: UMPIRE | W621: TEAM | X621: W | Y621: L | Z621: D | AA621: FOR | AB621: AGST | AC621: % | AD621: PTS
A622: WILLIAMSTOWN | C622: 3 | D622: 1 | E622: =C622*6+D622 -> 19 | G622: 5 | H622: 2 | I622: =G622*6+H622 -> 32 | K622: 8 | L622: 4 | M622: =K622*6+L622 -> 52 | O622: 10 | P622: 6 | Q622: =O622*6+P622 -> 66 | S622: FRIMLEY
A623: BEST PLAYERS | W623: FOOTSCRAY | X623: 13 | Y623: 0 | Z623: 1 | AA623: 1176 | AB623: 719 | AC623: 163.5605006954103 | AD623: 54
A624: FOOTSCRAY | D624: EASON | F624: MCCARTHY | I624: HOWELL | L624: DOOLEN | N624: MUELEMAN | Q624: MULLINS | W624: BRUNSWICK | X624: 9 | Y624: 5 | Z624: 0 | AA624: 1035 | AB624: 769 | AC624: 134.59 | AD624: 36
A625: WILLIAMSTOWN | D625: STONE | F625: CONLAN | I625: HOLTEN | L625: GEISLER | N625: MITCHELL | Q625: CONDON | W625: PORT MELBOURNE | X625: 9 | Y625: 5 | Z625: 0 | AA625: 1044 | AB625: 861 | AC625: 121.25435540069687 | AD625: 36
A626: GOALKICKERS | W626: WILLIAMSTOWN | X626: 9 | Y626: 5 | Z626: 0 | AA626: 939 | AB626: 782 | AC626: 120.076726342711 | AD626: 36
A627: FOOTSCRAY | D627: MULLINS 4 | G627: McCARTHY 2 | J627: ROSS 2 | L627: HOWELL | N627: McHENRY | Q627: BAYLISS
A628: WILLIAMSTOWN | D628: McDONALD 3 | G628: MITCHELL 2 | J628: THOMSON | M628: CARPENTER | P628: BEER | Q628: BRITT | R628: GEISLER | W628: NORTH MELBOURNE | X628: 8 | Y628: 6 | Z628: 0 | AA628: 1055 | AB628: 798 | AC628: 132.20551378446115 | AD628: 32
W629: HAWTHORN | X629: 8 | Y629: 6 | Z629: 0 | AA629: 1037 | AB629: 838 | AC629: 123.74701670644392 | AD629: 32
A630: HAWTHORN | C630: 4 | D630: 2 | E630: =C630*6+D630 -> 26 | G630: 8 | H630: 8 | I630: =G630*6+H630 -> 56 | K630: 10 | L630: 9 | M630: =K630*6+L630 -> 69 | O630: 13 | P630: 12 | Q630: =O630*6+P630 -> 90 | S630: GLENFERRIE | W630: NORTHCOTE | X630: 7 | Y630: 6 | Z630: 1 | AA630: 903 | AB630: 957 | AC630: 94.36 | AD630: 30
A631: PORT MELBOURNE | C631: 1 | D631: 5 | E631: =C631*6+D631 -> 11 | G631: 2 | H631: 8 | I631: =G631*6+H631 -> 20 | K631: 6 | L631: 13 | M631: =K631*6+L631 -> 49 | O631: 9 | P631: 18 | Q631: =O631*6+P631 -> 72 | S631: COLLINS | W631: GEELONG ASSOC. | X631: 3 | Y631: 11 | Z631: 0 | AA631: 716 | AB631: 1230 | AC631: 57.84 | AD631: 12
A632: BEST PLAYERS | W632: BRIGHTON | X632: 2 | Y632: 12 | Z632: 0 | AA632: 867 | AB632: 1115 | AC632: 77.76 | AD632: 8
A633: HAWTHORN | D633: GILL | F633: BROWN | I633: JACKSON | K633: YEOMANS | N633: LETHLEAN | Q633: McCASHNEY | W633: PRAHRAN | X633: 1 | Y633: 13 | Z633: 0 | AA633: 613 | AB633: 1316 | AC633: 46.580547112462007 | AD633: 4
A634: PORT MELBOURNE | D634: SKILTON | F634: W JOHNSTONE | I634: OGILVIE | K634: BARFOOT | N634: CROMPTON | Q634: J RUDD
A635: GOALKICKERS
A636: HAWTHORN | D636: OFFICER 4 | G636: LETHLEAN 2 | J636: YEOMANS 2 | M636: BURKE 2 | O636: RUDD | Q636: SPLATT | S636: GILL
A637: PORT MELBOURNE | D637: ENNIS 6 | G637: OGILVIE 2 | J637: DOBRIGH
A639: NORTHCOTE | C639: 3 | D639: 3 | E639: =C639*6+D639 -> 21 | G639: 6 | H639: 12 | I639: =G639*6+H639 -> 48 | K639: 8 | L639: 14 | M639: =K639*6+L639 -> 62 | O639: 12 | P639: 15 | Q639: =O639*6+P639 -> 87 | S639: NORTHCOTE
A640: BRIGHTON | C640: 2 | D640: 2 | E640: =C640*6+D640 -> 14 | G640: 5 | H640: 2 | I640: =G640*6+H640 -> 32 | K640: 9 | L640: 2 | M640: =K640*6+L640 -> 56 | O640: 11 | P640: 6 | Q640: =O640*6+P640 -> 72 | S640: BYRON
A641: BEST PLAYERS
A642: NORTHCOTE | D642: JOHNSON | G642: DOWNES | J642: ROSS | M642: HELLWIG | P642: GOUGH | S642: WOODS
A643: BRIGHTON | D643: DAYKIN | G643: SULLIVAN | J643: LILBURNE | M643: IRWIN | P643: RUMNEY | S643: JOHNSON
A644: GOALKICKERS
A645: NORTHCOTE | D645: GOUGH 4 | G645: ROSS 2 | I645: JOHNSON | K645: HELLWIG | M645: TAYLOR | O645: SHEEHY | Q645: McCASKER
A646: BRIGHTON | D646: DAYKIN 7 | G646: TONKIN | I646: SULLIVAN | K646: JONES | M646: BORLAND
A648: BRUNSWICK | C648: 5 | D648: 4 | E648: =C648*6+D648 -> 34 | G648: 8 | H648: 7 | I648: =G648*6+H648 -> 55 | K648: 11 | L648: 15 | M648: =K648*6+L648 -> 81 | O648: 15 | P648: 20 | Q648: =O648*6+P648 -> 110 | S648: BRUNSWICK
A649: GEELONG ASSOC. | C649: 1 | D649: 3 | E649: =C649*6+D649 -> 9 | G649: 2 | H649: 8 | I649: =G649*6+H649 -> 20 | K649: 2 | L649: 8 | M649: =K649*6+L649 -> 20 | O649: 2 | P649: 10 | Q649: =O649*6+P649 -> 22 | S649: LEHENY
A650: BEST PLAYERS
A651: BRUNSWICK | D651: VOSTI | G651: McKENZIE | J651: O'CONNOR | M651: HART | P651: HASSETT | S651: MILLEN
A652: GEELONG ASSOC. | D652: ELSTON | G652: COOPER | J652: SPENDLOVE | M652: MELLAHN | P652: CATIONS | S652: DIGBY
A653: GOALKICKERS
A654: BRUNSWICK | D654: McKENZIE 6 | G654: VOSTI 3 | J654: HART 2 | M654: FITZGERALD 2 | Q654: MILLEN | S654: O'CONNOR
A655: GEELONG ASSOC. | D655: NOONAN | G655: COOPER
A657: NORTH MELBOURNE | C657: 1 | D657: 5 | E657: =C657*6+D657 -> 11 | G657: 5 | H657: 15 | I657: =G657*6+H657 -> 45 | K657: 6 | L657: 22 | M657: =K657*6+L657 -> 58 | O657: 8 | P657: 24 | Q657: =O657*6+P657 -> 72 | S657: TOORAK PARK
A658: PRAHRAN | C658: 1 | D658: 5 | E658: =C658*6+D658 -> 11 | G658: 2 | H658: 6 | I658: =G658*6+H658 -> 18 | K658: 4 | L658: 8 | M658: =K658*6+L658 -> 32 | O658: 5 | P658: 10 | Q658: =O658*6+P658 -> 40 | S658: JONES
A659: BEST PLAYERS
A660: NORTH MELBOURNE | D660: METCALFE | G660: LAMBE | J660: WATSON | M660: LINTON | P660: WALSH | S660: McINTOSH
A661: PRAHRAN | D661: HOUSE | G661: VANCE | J661: LYTE | M661: NAYLOR | P661: McLEOD | S661: DOOLAN
A662: GOALKICKERS
A663: NORTH MELBOURNE | D663: RUTLEY | F663: McINTOSH | I663: CLAPSON | K663: LINTON | N663: METCALFE | Q663: LEWIS | S663: TREVASKIS | V663: WOOD
A664: PRAHRAN | D664: HOUSE 2 | G664: DOOLAN | J664: V JONES | M664: NAYLOR
A666: ROUND 15 | E666: 9TH AUGUST | H666: WEATHER | J666: NORTH WIND WEST CHANGE & RAIN LAST QTR | S666: PLAYED AT | X666: LADDER | AB666: ROUND | AD666: 15
D667: 1ST QTR | H667: 2ND QTR | L667: 3RD QTR | P667: FINAL | S667: PORT MELB
A668: BRUNSWICK | C668: 2 | D668: 3 | E668: =C668*6+D668 -> 15 | G668: 3 | H668: 6 | I668: =G668*6+H668 -> 24 | K668: 5 | L668: 8 | M668: =K668*6+L668 -> 38 | O668: 10 | P668: 14 | Q668: =O668*6+P668 -> 74 | S668: UMPIRE | W668: TEAM | X668: W | Y668: L | Z668: D | AA668: FOR | AB668: AGST | AC668: % | AD668: PTS
A669: PORT MELBOURNE | C669: 3 | D669: 6 | E669: =C669*6+D669 -> 24 | G669: 4 | H669: 9 | I669: =G669*6+H669 -> 33 | K669: 8 | L669: 10 | M669: =K669*6+L669 -> 58 | O669: 8 | P669: 11 | Q669: =O669*6+P669 -> 59 | S669: BYRON
A670: BEST PLAYERS | W670: FOOTSCRAY | X670: 14 | Y670: 0 | Z670: 1 | AA670: 1277 | AB670: 749 | AC670: 170.49399198931908 | AD670: 58
A671: BRUNSWICK | D671: KEDDIE | F671: HASSETT | I671: McCORMACK | L671: VOSTI | O671: BULT | Q671: MILLEN | W671: BRUNSWICK | X671: 10 | Y671: 5 | Z671: 0 | AA671: 1109 | AB671: 828 | AC671: 133.94 | AD671: 40
A672: PORT MELBOURNE | D672: J RUDD | F672: K JOHNSON | I672: W JOHNSTONE | L672: M JOHNSON | O672: BARFOOT | Q672: MURPHY | W672: WILLIAMSTOWN | X672: 10 | Y672: 5 | Z672: 0 | AA672: 988 | AB672: 816 | AC672: 121.07843137254902 | AD672: 40
A673: GOALKICKERS | W673: HAWTHORN | X673: 9 | Y673: 6 | Z673: 0 | AA673: 1141 | AB673: 877 | AC673: 130.10262257696692 | AD673: 36
A674: BRUNSWICK | D674: McINERNEY 4 | G674: VOSTI 2 | I674: GREEN 2 | L674: MILLEN | N674: HART
A675: PORT MELBOURNE | D675: ENNIS 2 | G675: LEWIS 2 | I675: FROUD | K675: FORBES | M675: BARFOOT | P675: MURPHY | W675: PORT MELBOURNE | X675: 9 | Y675: 6 | Z675: 0 | AA675: 1103 | AB675: 935 | AC675: 117.96791443850267 | AD675: 36
W676: NORTHCOTE | X676: 8 | Y676: 6 | Z676: 1 | AA676: 968 | AB676: 1006 | AC676: 96.22 | AD676: 34
A677: WILLIAMSTOWN | C677: 4 | D677: 5 | E677: =C677*6+D677 -> 29 | G677: 5 | H677: 6 | I677: =G677*6+H677 -> 36 | K677: 6 | L677: 6 | M677: =K677*6+L677 -> 42 | O677: 7 | P677: 7 | Q677: =O677*6+P677 -> 49 | S677: NORTH MELB | W677: NORTH MELBOURNE | X677: 8 | Y677: 7 | Z677: 0 | AA677: 1089 | AB677: 847 | AC677: 128.57142857142858 | AD677: 32
A678: NORTH MELBOURNE | C678: 2 | D678: 0 | E678: =C678*6+D678 -> 12 | G678: 3 | H678: 6 | I678: =G678*6+H678 -> 24 | K678: 3 | L678: 9 | M678: =K678*6+L678 -> 27 | O678: 4 | P678: 10 | Q678: =O678*6+P678 -> 34 | S678: JONES | W678: GEELONG ASSOC. | X678: 3 | Y678: 12 | Z678: 0 | AA678: 765 | AB678: 1295 | AC678: 59.07 | AD678: 12
A679: BEST PLAYERS | W679: BRIGHTON | X679: 2 | Y679: 13 | Z679: 0 | AA679: 906 | AB679: 1219 | AC679: 74.32 | AD679: 8
A680: WILLIAMSTOWN | D680: SMITH | F680: HOLTEN | I680: STONE | L680: MITCHELL | O680: BRITT | Q680: CARPENTER | W680: PRAHRAN | X680: 1 | Y680: 14 | Z680: 0 | AA680: 643 | AB680: 1417 | AC680: 45.377558221594917 | AD680: 4
A681: NORTH MELBOURNE | D681: LEWIS | F681: GILES | I681: JOHNSON | L681: ROSS | O681: GOMEZ | Q681: METCALFE
A682: GOALKICKERS
A683: WILLIAMSTOWN | D683: CARPENTER 3 | H683: MITCHELL | K683: BLANCHE | N683: LEE | P683: BRITT
A684: NORTH MELBOURNE | D684: METCALFE 3 | H684: GREENSMITH
A686: NORTHCOTE | C686: 5 | D686: 5 | E686: =C686*6+D686 -> 35 | G686: 6 | H686: 6 | I686: =G686*6+H686 -> 42 | K686: 8 | L686: 9 | M686: =K686*6+L686 -> 57 | O686: 9 | P686: 11 | Q686: =O686*6+P686 -> 65 | S686: KARDINIA PARK
A687: GEELONG ASSOC. | C687: 0 | D687: 4 | E687: =C687*6+D687 -> 4 | G687: 4 | H687: 11 | I687: =G687*6+H687 -> 35 | K687: 5 | L687: 12 | M687: =K687*6+L687 -> 42 | O687: 6 | P687: 13 | Q687: =O687*6+P687 -> 49
A688: BEST PLAYERS
A689: NORTHCOTE | D689: SHEEHY | G689: JOHNSON | J689: TAYLOR | M689: GOUGH | P689: DOWNES | S689: LONG
A690: GEELONG ASSOC. | D690: NOONAN | G690: COOPER | J690: KENNEDY | M690: CATIONS | P690: ALLISTER | S690: PRIDDLE
A691: GOALKICKERS
A692: NORTHCOTE | D692: GOUGH 3 | G692: HELLWIG 2 | J692: JOHNSON 2 | M692: DOWNES | O692: REID
A693: GEELONG ASSOC. | D693: KENNEDY | G693: STACK | I693: ALLISTER | K693: COOPER | M693: NOONAN | O693: JAMIESON
A695: HAWTHORN | C695: 4 | D695: 0 | E695: =C695*6+D695 -> 24 | G695: 11 | H695: 2 | I695: =G695*6+H695 -> 68 | K695: 12 | L695: 3 | M695: =K695*6+L695 -> 75 | O695: 16 | P695: 8 | Q695: =O695*6+P695 -> 104 | S695: GLENFERRIE
A696: BRIGHTON | C696: 0 | D696: 4 | E696: =C696*6+D696 -> 4 | G696: 0 | H696: 5 | I696: =G696*6+H696 -> 5 | K696: 2 | L696: 13 | M696: =K696*6+L696 -> 25 | O696: 4 | P696: 15 | Q696: =O696*6+P696 -> 39 | S696: FRIMLEY
A697: BEST PLAYERS
A698: HAWTHORN | D698: McCASHNEY | G698: JACKSON | J698: OFFICER | M698: SPLATT | P698: GILL | S698: WALTON
A699: BRIGHTON | D699: HARRIS | G699: LYNCH | J699: DAYKIN | M699: SULLIVAN | P699: THRELFALL | S699: JOHNSON
A700: GOALKICKERS
A701: HAWTHORN | D701: OFFICER 5 | F701: OSBORNE 3 | I701: DALTON 2 | K701: YEOMANS 2 | N701: BURKE | P701: SPLATT | R701: LETHLEAN | U701: McKENZIE
A702: BRIGHTON | D702: DAYKIN 3 | G702: HARRIS
A704: FOOTSCRAY | C704: 7 | D704: 5 | E704: =C704*6+D704 -> 47 | G704: 8 | H704: 15 | I704: =G704*6+H704 -> 63 | K704: 11 | L704: 20 | M704: =K704*6+L704 -> 86 | O704: 12 | P704: 29 | Q704: =O704*6+P704 -> 101 | S704: FOOTSCRAY
A705: PRAHRAN | C705: 0 | D705: 0 | E705: =C705*6+D705 -> 0 | G705: 2 | H705: 3 | I705: =G705*6+H705 -> 15 | K705: 3 | L705: 6 | M705: =K705*6+L705 -> 24 | O705: 4 | P705: 6 | Q705: =O705*6+P705 -> 30 | S705: LEHENY
A706: BEST PLAYERS
A707: FOOTSCRAY | D707: BAYLISS | G707: SAMSON | J707: McCARTHY | M707: EASON | P707: DOOLAN | S707: FRASER
A708: PRAHRAN | D708: E JONES | G708: V JONES | J708: NAYLOR | M708: GRIFFITHS | P708: MILLER | S708: McLEOD
A709: GOALKICKERS
A710: FOOTSCRAY | D710: BAYLISS 4 | G710: MULLINS 2 | J710: McHENRY 2 | M710: PUNCH 2 | O710: MCCARTHY | R710: EASON
A711: PRAHRAN | D711: A MILLER 3 | G711: NAYLOR
A713: ROUND 16 | E713: 9TH AUGUST | J713: WEATHER | M713: CLOUDY BUT FINE | S713: PLAYED AT | X713: LADDER | AB713: ROUND | AD713: 16
D714: 1ST QTR | H714: 2ND QTR | L714: 3RD QTR | P714: FINAL | S714: BRUNSWICK
A715: NORTHCOTE | C715: 2 | D715: 2 | E715: =C715*6+D715 -> 14 | G715: 6 | H715: 6 | I715: =G715*6+H715 -> 42 | K715: 9 | L715: 8 | M715: =K715*6+L715 -> 62 | O715: 12 | P715: 12 | Q715: =O715*6+P715 -> 84 | S715: UMPIRE | W715: TEAM | X715: W | Y715: L | Z715: D | AA715: FOR | AB715: AGST | AC715: % | AD715: PTS
A716: BRUNSWICK | C716: 3 | D716: 5 | E716: =C716*6+D716 -> 23 | G716: 5 | H716: 10 | I716: =G716*6+H716 -> 40 | K716: 9 | L716: 13 | M716: =K716*6+L716 -> 67 | O716: 10 | P716: 17 | Q716: =O716*6+P716 -> 77 | S716: BYRON
A717: BEST PLAYERS | W717: FOOTSCRAY | X717: 15 | Y717: 0 | Z717: 1 | AA717: 1365 | AB717: 821 | AC717: 166.26065773447016 | AD717: 62
A718: NORTHCOTE | D718: JOHNSON | F718: HELLWIG | I718: GOUGH | L718: YATES | N718: LONG | Q718: WARD | W718: WILLIAMSTOWN | X718: 11 | Y718: 5 | Z718: 0 | AA718: 1056 | AB718: 878 | AC718: 120.27334851936219 | AD718: 44
A719: BRUNSWICK | D719: BULT | F719: FITZGERALD | I719: McINERNEY | L719: HASSETT | N719: WILLIAMSON | Q719: O'CONNOR | W719: BRUNSWICK | X719: 10 | Y719: 6 | Z719: 0 | AA719: 1186 | AB719: 912 | AC719: 130.04 | AD719: 40
A720: GOALKICKERS | W720: NORTHCOTE | X720: 9 | Y720: 6 | Z720: 1 | AA720: 1052 | AB720: 1083 | AC720: 97.14 | AD720: 38
A721: NORTHCOTE | D721: GOUGH 4 | F721: JOHNSON 2 | I721: HELLWIG 2 | L721: DIMMICK | N721: DOWNES | P721: YATES | R721: SHEEHY
A722: BRUNSWICK | D722: McINERNEY 6 | H722: O'CONNOR | K722: WILLIAMSON | N722: GREEN | P722: KEDDIE | W722: NORTH MELBOURNE | X722: 9 | Y722: 7 | Z722: 0 | AA722: 1156 | AB722: 905 | AC722: 127.73480662983425 | AD722: 36
W723: HAWTHORN | X723: 9 | Y723: 7 | Z723: 0 | AA723: 1203 | AB723: 945 | AC723: 127.3015873015873 | AD723: 36
A724: WILLIAMSTOWN | C724: 1 | D724: 4 | E724: =C724*6+D724 -> 10 | G724: 3 | H724: 4 | I724: =G724*6+H724 -> 22 | K724: 5 | L724: 11 | M724: =K724*6+L724 -> 41 | O724: 9 | P724: 14 | Q724: =O724*6+P724 -> 68 | S724: WILLIAMSTOWN | W724: PORT MELBOURNE | X724: 9 | Y724: 7 | Z724: 0 | AA724: 1175 | AB724: 1023 | AC724: 114.85826001955034 | AD724: 36
A725: HAWTHORN | C725: 2 | D725: 3 | E725: =C725*6+D725 -> 15 | G725: 7 | H725: 6 | I725: =G725*6+H725 -> 48 | K725: 9 | L725: 8 | M725: =K725*6+L725 -> 62 | O725: 9 | P725: 8 | Q725: =O725*6+P725 -> 62 | S725: LEHENY | W725: GEELONG ASSOC. | X725: 3 | Y725: 13 | Z725: 0 | AA725: 829 | AB725: 1366 | AC725: 60.69 | AD725: 12
A726: BEST PLAYERS | W726: BRIGHTON | X726: 2 | Y726: 14 | Z726: 0 | AA726: 964 | AB726: 1286 | AC726: 74.96 | AD726: 8
A727: WILLIAMSTOWN | D727: MITCHELL | F727: STONE | I727: GEDDES | K727: BEER | N727: BRITT | P727: BLANCHE | W727: PRAHRAN | X727: 2 | Y727: 14 | Z727: 0 | AA727: 714 | AB727: 1481 | AC727: 48.210668467251857 | AD727: 8
A728: HAWTHORN | D728: UTTING | F728: PEARSON | I728: GILL | K728: CARBARNS | N728: NOTT | P728: JACKSON
A729: GOALKICKERS
A730: WILLIAMSTOWN | D730: CARPENTER 3 | G730: STONE 2 | I730: BEER 2 | K730: MITCHELL | M730: N McDONALD
A731: HAWTHORN | D731: YEOMANS 4 | G731: OFFICER 2 | J731: BURKE | L731: LETHLEAN | O731: CARBARNS
A733: FOOTSCRAY | C733: 6 | D733: 4 | E733: =C733*6+D733 -> 40 | G733: 10 | H733: 7 | I733: =G733*6+H733 -> 67 | K733: 12 | L733: 10 | M733: =K733*6+L733 -> 82 | O733: 13 | P733: 10 | Q733: =O733*6+P733 -> 88 | S733: PORT MELB
A734: PORT MELBOURNE | C734: 3 | D734: 1 | E734: =C734*6+D734 -> 19 | G734: 5 | H734: 5 | I734: =G734*6+H734 -> 35 | K734: 9 | L734: 9 | M734: =K734*6+L734 -> 63 | O734: 10 | P734: 12 | Q734: =O734*6+P734 -> 72 | S734: FRIMLEY
A735: BEST PLAYERS
A736: FOOTSCRAY | D736: McCARTHY | G736: FORD | J736: HOPKINS | M736: SAMSON | P736: NEILSON | S736: GIBB
A737: PORT MELBOURNE | D737: W JOHNSTONE | G737: STANBRIDGE | J737: BARFOOT | M737: DOBRIGH | P737: W RUDD | S737: CROMPTON
A738: GOALKICKERS
A739: FOOTSCRAY | D739: HOPKINS 3 | G739: O'BRIEN 3 | I739: McCARTHY 3 | L739: BAYLISS 2 | N739: PUNCH | P739: MULLINS
A740: PORT MELBOURNE | D740: FROUD 3 | G740: KERLEY 3 | I740: ENNIS 2 | L740: OGILVIE | N740: DOBRIGH
A742: PRAHRAN | C742: 1 | D742: 2 | E742: =C742*6+D742 -> 8 | G742: 3 | H742: 6 | I742: =G742*6+H742 -> 24 | K742: 7 | L742: 7 | M742: =K742*6+L742 -> 49 | O742: 10 | P742: 11 | Q742: =O742*6+P742 -> 71 | S742: TOORAK PARK
A743: GEELONG ASSOC. | C743: 1 | D743: 3 | E743: =C743*6+D743 -> 9 | G743: 3 | H743: 8 | I743: =G743*6+H743 -> 26 | K743: 7 | L743: 10 | M743: =K743*6+L743 -> 52 | O743: 8 | P743: 16 | Q743: =O743*6+P743 -> 64 | S743: COLLINS
A744: BEST PLAYERS
A745: PRAHRAN | D745: NAYLOR | G745: McLEOD | J745: LYTE | M745: GRIFFITHS | P745: LEVER | S745: MILLER
A746: GEELONG ASSOC. | D746: PRIDDLE | G746: WATERHOUSE | J746: COOPER | M746: ELSTON | P746: NOONAN | S746: CATIONS
A747: GOALKICKERS
A748: PRAHRAN | D748: MILLER 3 | G748: McLEOD | I748: NAYLOR | K748: LEVER | M748: HOOPELL | O748: BEARD | Q748: V JONES | S748: TINNINO
A749: GEELONG ASSOC. | D749: STACK 2 | G749: COOPER 2 | J749: ELSTON | L749: ROUTLEY | O749: HARRIS | Q749: NOONAN
A751: NORTH MELBOURNE | C751: 1 | D751: 1 | E751: =C751*6+D751 -> 7 | G751: 5 | H751: 2 | I751: =G751*6+H751 -> 32 | K751: 8 | L751: 5 | M751: =K751*6+L751 -> 53 | O751: 10 | P751: 7 | Q751: =O751*6+P751 -> 67 | S751: BRIGHTON BEACH
A752: BRIGHTON | C752: 2 | D752: 3 | E752: =C752*6+D752 -> 15 | G752: 5 | H752: 5 | I752: =G752*6+H752 -> 35 | K752: 5 | L752: 8 | M752: =K752*6+L752 -> 38 | O752: 8 | P752: 10 | Q752: =O752*6+P752 -> 58 | S752: PANNAM
A753: BEST PLAYERS
A754: NORTH MELBOURNE | D754: LEWIS | G754: GILES | J754: RUSS | L754: METCALFE | O754: WALSH | R754: JOHNSON
A755: BRIGHTON | D755: DAYKIN | G755: LILBURNE | J755: HARRIS | L755: C IRWIN | O755: BORLAND | R755: DANGERFIELD
A756: GOALKICKERS
A757: NORTH MELBOURNE | D757: GILES 3 | G757: LEWIS 2 | I757: METCALFE 2 | L757: WOODS | N757: RUSS | Q757: CLAPSON
A758: BRIGHTON | D758: DAYKIN 3 | G758: TONKIN | I758: BANKS | K758: SULLIVAN | N758: D IRWIN | Q758: LYNCH
A760: ROUND 17 | E760: 23RD AUGUST | H760: WEATHER | K760: NORTH WIND CLOUDY WARM HUMID | S760: PLAYED AT | X760: LADDER | AB760: ROUND | AD760: 17
D761: 1ST QTR | H761: 2ND QTR | L761: 3RD QTR | P761: FINAL | S761: NORTHCOTE
A762: NORTHCOTE | C762: 2 | D762: 3 | E762: =C762*6+D762 -> 15 | G762: 5 | H762: 6 | I762: =G762*6+H762 -> 36 | K762: 7 | L762: 10 | M762: =K762*6+L762 -> 52 | O762: 7 | P762: 14 | Q762: =O762*6+P762 -> 56 | S762: UMPIRE | W762: TEAM | X762: W | Y762: L | Z762: D | AA762: FOR | AB762: AGST | AC762: % | AD762: PTS
A763: NORTH MELBOURNE | C763: 1 | D763: 6 | E763: =C763*6+D763 -> 12 | G763: 2 | H763: 10 | I763: =G763*6+H763 -> 22 | K763: 4 | L763: 13 | M763: =K763*6+L763 -> 37 | O763: 6 | P763: 17 | Q763: =O763*6+P763 -> 53 | S763: FRIMLEY
A764: BEST PLAYERS | W764: FOOTSCRAY | X764: 16 | Y764: 0 | Z764: 1 | AA764: 1420 | AB764: 845 | AC764: 168.04733727810651 | AD764: 66
A765: NORTHCOTE | D765: JOHNSON | G765: SHEEHY | J765: DOWNES | M765: LONG | O765: McCASKER | Q765: H SMITH | W765: WILLIAMSTOWN | X765: 12 | Y765: 5 | Z765: 0 | AA765: 1129 | AB765: 902 | AC765: 125.16629711751663 | AD765: 48
A766: NORTH MELBOURNE | D766: LEWIS | G766: METCALFE | J766: JOHNSON | M766: TREVASKIS | O766: WALSH | Q766: LAMBE | W766: BRUNSWICK | X766: 11 | Y766: 6 | Z766: 0 | AA766: 1324 | AB766: 956 | AC766: 138.49 | AD766: 44
A767: GOALKICKERS | W767: NORTHCOTE | X767: 10 | Y767: 6 | Z767: 1 | AA767: 1108 | AB767: 1136 | AC767: 97.54 | AD767: 42
A768: NORTHCOTE | D768: GOUGH 3 | G768: TAYLOR 2 | J768: THEOBOLD | M768: ROSS
A769: NORTH MELBOURNE | D769: METCALFE 2 | G769: JOHNSON | J769: GOONAN | M769: WALSH | O769: TREVASKIS | W769: NORTH MELBOURNE | X769: 9 | Y769: 8 | Z769: 0 | AA769: 1209 | AB769: 961 | AC769: 125.80645161290323 | AD769: 36
W770: HAWTHORN | X770: 9 | Y770: 8 | Z770: 0 | AA770: 1227 | AB770: 1000 | AC770: 122.7 | AD770: 36
A771: FOOTSCRAY | C771: 2 | D771: 5 | E771: =C771*6+D771 -> 17 | G771: 2 | H771: 6 | I771: =G771*6+H771 -> 18 | K771: 5 | L771: 13 | M771: =K771*6+L771 -> 43 | O771: 7 | P771: 13 | Q771: =O771*6+P771 -> 55 | S771: FOOTSCRAY | W771: PORT MELBOURNE | X771: 9 | Y771: 8 | Z771: 0 | AA771: 1199 | AB771: 1096 | AC771: 109.39781021897811 | AD771: 36
A772: HAWTHORN | C772: 0 | D772: 0 | E772: =C772*6+D772 -> 0 | G772: 1 | H772: 5 | I772: =G772*6+H772 -> 11 | K772: 1 | L772: 5 | M772: =K772*6+L772 -> 11 | O772: 2 | P772: 12 | Q772: =O772*6+P772 -> 24 | S772: HARROD | W772: GEELONG ASSOC. | X772: 4 | Y772: 13 | Z772: 0 | AA772: 888 | AB772: 1422 | AC772: 62.45 | AD772: 16
A773: BEST PLAYERS | W773: BRIGHTON | X773: 2 | Y773: 15 | Z773: 0 | AA773: 1020 | AB773: 1345 | AC773: 75.84 | AD773: 8
A774: FOOTSCRAY | D774: McCARTHY | G774: MUELEMAN | J774: EASON | M774: MERTON | O774: O'BRIEN | Q774: SAMSON | W774: PRAHRAN | X774: 2 | Y774: 15 | Z774: 0 | AA774: 758 | AB774: 1619 | AC774: 46.819024088943792 | AD774: 8
A775: HAWTHORN | D775: UTTING | G775: PEARSON | J775: OFFICER | M775: SPLATT | O775: YEOMANS | Q775: McKENZIE
A776: GOALKICKERS
A777: FOOTSCRAY | D777: O'BRIEN 4 | G777: GIBB 2 | J777: HOPKINS
A778: HAWTHORN | D778: GILL | G778: OFFICER
A780: WILLIAMSTOWN | C780: 6 | D780: 4 | E780: =C780*6+D780 -> 40 | G780: 6 | H780: 6 | I780: =G780*6+H780 -> 42 | K780: 9 | L780: 9 | M780: =K780*6+L780 -> 63 | O780: 10 | P780: 13 | Q780: =O780*6+P780 -> 73 | S780: WILLIAMSTOWN
A781: PORT MELBOURNE | C781: 0 | D781: 3 | E781: =C781*6+D781 -> 3 | G781: 2 | H781: 6 | I781: =G781*6+H781 -> 18 | K781: 2 | L781: 9 | M781: =K781*6+L781 -> 21 | O781: 2 | P781: 12 | Q781: =O781*6+P781 -> 24 | S781: LEHENY
A782: BEST PLAYERS
A783: WILLIAMSTOWN | D783: CARPENTER | G783: MUNN | J783: HOLTEN | M783: CONDON | P783: MITCHELL | S783: TRUMAN
A784: PORT MELBOURNE | D784: STANBRIDGE | G784: KERLEY | J784: BARFOOT | M784: R JOHNSON | P784: M JOHNSON | S784: CALWELL
A785: GOALKICKERS
A786: WILLIAMSTOWN | D786: LEE 3 | F786: MUNN 2 | I786: STANFORD 2 | L786: McDONALD | O786: MITCHELL | R786: GEISLER
A787: PORT MELBOURNE | D787: REES 2
A789: GEELONG ASSOC. | C789: 0 | D789: 0 | E789: =C789*6+D789 -> 0 | G789: 5 | H789: 7 | I789: =G789*6+H789 -> 37 | K789: 5 | L789: 7 | M789: =K789*6+L789 -> 37 | O789: 8 | P789: 11 | Q789: =O789*6+P789 -> 59 | S789: BRIGHTON BEACH
A790: BRIGHTON | C790: 3 | D790: 4 | E790: =C790*6+D790 -> 22 | G790: 4 | H790: 5 | I790: =G790*6+H790 -> 29 | K790: 7 | L790: 7 | M790: =K790*6+L790 -> 49 | O790: 8 | P790: 8 | Q790: =O790*6+P790 -> 56 | S790: BROWN
A791: BEST PLAYERS
A792: GEELONG ASSOC. | D792: MELLAHN | G792: HEWITSON | J792: CATIONS | M792: BENTLEY | P792: STACK | S792: COOPER
A793: BRIGHTON | D793: LILBURNE | G793: LYNCH | J793: GARCIA | M793: RUMNEY | P793: BANKS | S793: C IRWIN
A794: GOALKICKERS
A795: GEELONG ASSOC. | D795: COOPER 2 | G795: STACK 2 | J795: MELLAHN 2 | M795: HARRIS | O795: HEWITSON
A796: BRIGHTON | D796: BANKS 2 | G796: GRAHAM 2 | J796: KYNCH | L796: DUGDALE | N796: DAYKIN | P796: S IRWIN
A798: BRUNSWICK | C798: 4 | D798: 5 | E798: =C798*6+D798 -> 29 | G798: 8 | H798: 16 | I798: =G798*6+H798 -> 64 | K798: 11 | L798: 19 | M798: =K798*6+L798 -> 85 | O798: 19 | P798: 24 | Q798: =O798*6+P798 -> 138 | S798: TOORAK PARK
A799: PRAHRAN | C799: 1 | D799: 5 | E799: =C799*6+D799 -> 11 | G799: 1 | H799: 6 | I799: =G799*6+H799 -> 12 | K799: 5 | L799: 6 | M799: =K799*6+L799 -> 36 | O799: 6 | P799: 8 | Q799: =O799*6+P799 -> 44 | S799: JONES
A800: BEST PLAYERS
A801: BRUNSWICK | D801: McINERNEY | G801: RAYMOND | J801: O'CONNOR | M801: CORBOYS | P801: BULT | R801: McKENZIE
A802: PRAHRAN | D802: E JONES | G802: NAYLOR | J802: HOOPELL | M802: BEARD | P802: MILLER | R802: BAXTER
A803: GOALKICKERS
A804: BRUNSWICK | D804: McINERNEY 9 | G804: McCORMACK 2 | J804: ADAMS 2 | M804: McKENZIE 2 | P804: RAYMOND | R804: RALEIGH | U804: WILLIAMSON | X804: CORBOYS
A805: PRAHRAN | D805: NAYLOR 2 | G805: MILLER | J805: HOOPELL | M805: BAXTER | O805: BEARD
A807: ROUND 18 | E807: 30TH AUGUST | J807: WEATHER | N807: FINE PARTLY CLOUDY | S807: PLAYED AT | X807: LADDER | AB807: ROUND | AD807: 18
D808: 1ST QTR | H808: 2ND QTR | L808: 3RD QTR | P808: FINAL | S808: GLENFERRIE
A809: HAWTHORN | C809: 0 | D809: 3 | E809: =C809*6+D809 -> 3 | G809: 3 | H809: 10 | I809: =G809*6+H809 -> 28 | K809: 5 | L809: 13 | M809: =K809*6+L809 -> 43 | O809: 7 | P809: 16 | Q809: =O809*6+P809 -> 58 | S809: UMPIRE | W809: TEAM | X809: W | Y809: L | Z809: D | AA809: FOR | AB809: AGST | AC809: % | AD809: PTS
A810: BRUNSWICK | C810: 1 | D810: 6 | E810: =C810*6+D810 -> 12 | G810: 1 | H810: 9 | I810: =G810*6+H810 -> 15 | K810: 4 | L810: 11 | M810: =K810*6+L810 -> 35 | O810: 7 | P810: 15 | Q810: =O810*6+P810 -> 57 | S810: BYRON
A811: BEST PLAYERS | W811: FOOTSCRAY | X811: 16 | Y811: 1 | Z811: 1 | AA811: 1484 | AB811: 917 | AC811: 161.8320610687023 | AD811: 66
A812: HAWTHORN | D812: McCASHNEY | G812: McKENZIE | J812: WALTON | M812: GILL | O812: FINCH | Q812: PEARSON | W812: WILLIAMSTOWN | X812: 13 | Y812: 5 | Z812: 0 | AA812: 1192 | AB812: 946 | AC812: 126.00422832980972 | AD812: 52
A813: BRUNSWICK | D813: CORBOYS | G813: FITZGERALD | J813: RALEIGH | M813: WEBB | O813: FISHER | Q813: RAYMOND | W813: NORTHCOTE | X813: 11 | Y813: 6 | Z813: 1 | AA813: 1305 | AB813: 1176 | AC813: 110.97 | AD813: 46
A814: GOALKICKERS | W814: BRUNSWICK | X814: 11 | Y814: 7 | Z814: 0 | AA814: 1381 | AB814: 1014 | AC814: 136.19 | AD814: 44
A815: HAWTHORN | D815: SPLATT 2 | G815: YEOMANS 2 | J815: BURKE 2 | M815: WALTON
A816: BRUNSWICK | D816: McINERNEY 3 | G816: HART 2 | J816: WEBB | L816: FITZGERALD | W816: NORTH MELBOURNE | X816: 10 | Y816: 8 | Z816: 0 | AA816: 1281 | AB816: 1025 | AC816: 124.97560975609755 | AD816: 40
W817: HAWTHORN | X817: 10 | Y817: 8 | Z817: 0 | AA817: 1285 | AB817: 1057 | AC817: 121.57048249763481 | AD817: 40
A818: NORTH MELBOURNE | C818: 2 | D818: 1 | E818: =C818*6+D818 -> 13 | G818: 6 | H818: 2 | I818: =G818*6+H818 -> 38 | K818: 11 | L818: 5 | M818: =K818*6+L818 -> 71 | O818: 11 | P818: 6 | Q818: =O818*6+P818 -> 72 | S818: NORTH MELB | W818: PORT MELBOURNE | X818: 10 | Y818: 8 | Z818: 0 | AA818: 1277 | AB818: 1169 | AC818: 109.23866552609067 | AD818: 40
A819: FOOTSCRAY | C819: 4 | D819: 3 | E819: =C819*6+D819 -> 27 | G819: 6 | H819: 10 | I819: =G819*6+H819 -> 46 | K819: 7 | L819: 12 | M819: =K819*6+L819 -> 54 | O819: 8 | P819: 16 | Q819: =O819*6+P819 -> 64 | S819: LEHENY | W819: GEELONG ASSOC. | X819: 4 | Y819: 14 | Z819: 0 | AA819: 932 | AB819: 1485 | AC819: 62.76 | AD819: 16
A820: BEST PLAYERS | W820: BRIGHTON | X820: 2 | Y820: 16 | Z820: 0 | AA820: 1093 | AB820: 1423 | AC820: 76.81 | AD820: 8
A821: NORTH MELBOURNE | D821: LOCKE | G821: JOHNSON | J821: RUTLEY | M821: LAMBE | O821: GILES | R821: LEWIS | W821: PRAHRAN | X821: 2 | Y821: 16 | Z821: 0 | AA821: 798 | AB821: 1816 | AC821: 43.942731277533042 | AD821: 8
A822: FOOTSCRAY | D822: McCARTHY | G822: NEILSON | J822: DOOLAN | M822: FORD | O822: STEPHENSON | R822: PUNCH
A823: GOALKICKERS
A824: NORTH MELBOURNE | D824: METCALFE 3 | G824: WOOD 3 | J824: TREVASKIS | M824: SHORTEN | O824: GOONAN | Q824: JOHNSON | S824: GILES
A825: FOOTSCRAY | D825: ROSS 2 | G825: O'BRIEN 2 | J825: SAMSON | L825: FRASER | N825: MULLINS | P825: McHENRY
A827: PORT MELBOURNE | C827: 1 | D827: 3 | E827: =C827*6+D827 -> 9 | G827: 7 | H827: 6 | I827: =G827*6+H827 -> 48 | K827: 11 | L827: 12 | M827: =K827*6+L827 -> 78 | O827: 11 | P827: 12 | Q827: =O827*6+P827 -> 78 | S827: PORT MELB
A828: BRIGHTON | C828: 2 | D828: 3 | E828: =C828*6+D828 -> 15 | G828: 4 | H828: 6 | I828: =G828*6+H828 -> 30 | K828: 8 | L828: 9 | M828: =K828*6+L828 -> 57 | O828: 10 | P828: 13 | Q828: =O828*6+P828 -> 73 | S828: HARROD
A829: BEST PLAYERS
A830: PORT MELBOURNE | D830: CROMPTON | G830: STANBRIDGE | K830: W JOHNSTONE | N830: J RUDD | Q830: FORBES | S830: OGILVIE
A831: BRIGHTON | D831: HARRIS | G831: TONKIN | K831: LILBURNE | N831: GARCIA | Q831: RUMNEY | S831: BORLAND
A832: GOALKICKERS
A833: PORT MELBOURNE | D833: ENNIS 6 | G833: MURPHY 2 | J833: BARFOOT | M833: J RUDD | O833: KERLEY
A834: BRIGHTON | D834: DUGDALE 3 | G834: DAYKIN 3 | J834: BANKS | L834: LILBURNE | N834: F IRWIN | P834: ATKINSON
A836: WILLIAMSTOWN | C836: 3 | D836: 4 | E836: =C836*6+D836 -> 22 | G836: 3 | H836: 8 | I836: =G836*6+H836 -> 26 | K836: 7 | L836: 12 | M836: =K836*6+L836 -> 54 | O836: 8 | P836: 15 | Q836: =O836*6+P836 -> 63 | S836: KARDINIA PARK
A837: GEELONG ASSOC. | C837: 2 | D837: 3 | E837: =C837*6+D837 -> 15 | G837: 3 | H837: 7 | I837: =G837*6+H837 -> 25 | K837: 4 | L837: 7 | M837: =K837*6+L837 -> 31 | O837: 6 | P837: 8 | Q837: =O837*6+P837 -> 44 | S837: FRIMLEY
A838: BEST PLAYERS
A839: WILLIAMSTOWN | D839: CARPENTER | G839: GEISLER | J839: BEER | L839: GEDDES | O839: STANFORD | R839: BALL
A840: GEELONG ASSOC. | D840: MACK | G840: WATERHOUSE | J840: STACK | L840: GITTENS | O840: CATIONS | R840: MELLAHN
A841: GOALKICKERS
A842: WILLIAMSTOWN | D842: McDONALD 2 | G842: CARPENTER 2 | K842: LEE | M842: STANFORD | O842: BLANCHE | R842: MITCHELL
A843: GEELONG ASSOC. | D843: NOONAN 3 | G843: ALLISTER | J843: MELLAHN | M843: CORFIELD
A845: NORTHCOTE | C845: 4 | D845: 7 | E845: =C845*6+D845 -> 31 | G845: 14 | H845: 12 | I845: =G845*6+H845 -> 96 | K845: 19 | L845: 15 | M845: =K845*6+L845 -> 129 | O845: 30 | P845: 17 | Q845: =O845*6+P845 -> 197 | S845: NORTHCOTE
A846: PRAHRAN | C846: 1 | D846: 3 | E846: =C846*6+D846 -> 9 | G846: 2 | H846: 5 | I846: =G846*6+H846 -> 17 | K846: 3 | L846: 6 | M846: =K846*6+L846 -> 24 | O846: 5 | P846: 10 | Q846: =O846*6+P846 -> 40 | S846: PANNAM
A847: BEST PLAYERS
A848: NORTHCOTE | D848: GOUGH | G848: JOHNSON | J848: SHEEHY | M848: WOODS | P848: DIMMICK | S848: DOWNES
A849: PRAHRAN | D849: GRIFFITHS | G849: HEADEN | J849: NAYLOR | M849: MILLER | P849: ROBERTS | S849: McLEOD
A850: GOALKICKERS
A851: NORTHCOTE | D851: GOUGH 25 | G851: JOHNSON 3 | J851: DOWNES | M851: THEOBOLD
A852: PRAHRAN | D852: HEADEN 3 | G852: NAYLOR | J852: ROBERTS
A854: FINALS
A855: 1ST SEMI | E855: 6TH SEPTEMBER | J855: WEATHER | M855: FINE
D856: 1ST QTR | H856: 2ND QTR | L856: 3RD QTR | P856: FINAL
A857: WILLIAMSTOWN | C857: 3 | D857: 2 | E857: =C857*6+D857 -> 20 | G857: 4 | H857: 5 | I857: =G857*6+H857 -> 29 | K857: 5 | L857: 8 | M857: =K857*6+L857 -> 38 | O857: 8 | P857: 9 | Q857: =O857*6+P857 -> 57 | S857: NORTH MELB
A858: BRUNSWICK | C858: 1 | D858: 4 | E858: =C858*6+D858 -> 10 | G858: 3 | H858: 9 | I858: =G858*6+H858 -> 27 | K858: 4 | L858: 13 | M858: =K858*6+L858 -> 37 | O858: 5 | P858: 16 | Q858: =O858*6+P858 -> 46 | S858: LEHENY
A859: BEST PLAYERS
A860: WILLIAMSTOWN | D860: CARPENTER | G860: CONDON | J860: STONE | M860: MITCHELL | P860: BRITT | S860: GEDDES
A861: BRUNSWICK | D861: RALEIGH | G861: KEDDIE | J861: MILLEN | M861: CORBOYS | P861: VOSTI | S861: WEBB
A862: GOALKICKERS
A863: WILLIAMSTOWN | D863: CARPENTER 2 | G863: McDONALD | J863: STANFORD | M863: MUNRO | O863: GEISLER | Q863: MUNN | S863: MITCHELL
A864: BRUNSWICK | D864: McINERNEY 2 | H864: FITZGERALD 2 | L864: McKENZIE
A866: 2ND SEMI | E866: 13TH SEPTEMBER | J866: WEATHER | M866: FINE STRONG NORTH WIND
A867: FOOTSCRAY | C867: 1 | D867: 0 | E867: =C867*6+D867 -> 6 | G867: 3 | H867: 4 | I867: =G867*6+H867 -> 22 | K867: 3 | L867: 5 | M867: =K867*6+L867 -> 23 | O867: 9 | P867: 7 | Q867: =O867*6+P867 -> 61 | S867: NORTH MELB
A868: NORTHCOTE | C868: 3 | D868: 2 | E868: =C868*6+D868 -> 20 | G868: 3 | H868: 2 | I868: =G868*6+H868 -> 20 | K868: 4 | L868: 4 | M868: =K868*6+L868 -> 28 | O868: 4 | P868: 8 | Q868: =O868*6+P868 -> 32 | S868: LEHENY
A869: BEST PLAYERS
A870: FOOTSCRAY | D870: McCARTHY | G870: PUNCH | J870: MERTON | M870: EASON | P870: FRASER | S870: GIBB
A871: NORTHCOTE | D871: H SMITH | G871: DOWNES | J871: McCASKER | M871: SHEEHY | P871: DIMMICK | S871: JOHNSON
A872: GOALKICKERS
A873: FOOTSCRAY | D873: MULLINS 3 | G873: PUNCH 2 | J873: O'BRIEN 2 | M873: BAYLISS | O873: McCARTHY
A874: NORTHCOTE | D874: DOWNES | G874: GOUGH | J874: JOHNSON | M874: ROSS
A876: FINAL | E876: 20TH SEPTEMBER | J876: WEATHER
A877: FOOTSCRAY | C877: 3 | D877: 5 | E877: 23 | G877: 4 | H877: 6 | I877: 30 | K877: 9 | L877: 9 | M877: 63 | O877: 11 | P877: 11 | Q877: =O877*6+P877 -> 77 | S877: NORTH MELB
A878: WILLIAMSTOWN | C878: 0 | D878: 1 | E878: 1 | G878: 0 | H878: 4 | I878: 4 | K878: 0 | L878: 4 | M878: 4 | O878: 3 | P878: 4 | Q878: =O878*6+P878 -> 22 | S878: LEHENY
A879: BEST PLAYERS
A880: FOOTSCRAY | D880: McCARTHY | G880: SAMSON | J880: MERTON | M880: EASON | P880: FORD | S880: MULLINS
A881: WILLIAMSTOWN | D881: CONLAN | G881: TRUMAN | J881: STONE | M881: BRITT | P881: MITCHELL | S881: MUNRO
A882: GOALKICKERS
A883: FOOTSCRAY | D883: MULLINS 5 | G883: O'BRIEN 4 | J883: HOPKINS 2
A884: WILLIAMSTOWN | D884: MUNN 2 | G884: BRITT
A886: INTERSTATE MATCH | F886: 2ND AUGUST | J886: WEATHER | M886: CLOUDY BUT FINE WEST WIND
A887: W A | C887: 0 | D887: 1 | E887: =C887*6+D887 -> 1 | G887: 3 | H887: 5 | I887: =G887*6+H887 -> 23 | K887: 4 | L887: 6 | M887: =K887*6+L887 -> 30 | O887: 5 | P887: 8 | Q887: =O887*6+P887 -> 38 | S887: NORTH MELB
A888: V F A | C888: 2 | D888: 2 | E888: =C888*6+D888 -> 14 | G888: 3 | H888: 4 | I888: =G888*6+H888 -> 22 | K888: 4 | L888: 6 | M888: =K888*6+L888 -> 30 | O888: 4 | P888: 12 | Q888: =O888*6+P888 -> 36 | S888: FRIMLEY
A889: BEST PLAYERS
A890: W A | D890: CLOWES | G890: WATTS | J890: McDERMISH | M890: SHARPLES | P890: STEELE | S890: EVANS
A891: V F A | D891: McKENZIE | G891: JOHNSON | J891: DOWNES | M891: NOONAN | P891: McCARTHY | S891: LEWIS
A892: GOALKICKERS
A893: W A | D893: EVANS 5
A894: V F A | D894: McCARTHY 2 | G894: KEDDIE | J894: YEOMANS
A896: CHARITY CHAMPIONSHIP | J896: WEATHER | M896: COOL CLOUDY SOUTH WIND MORNING RAIN
A897: FOOTSCRAY | C897: 2 | D897: 3 | E897: =C897*6+D897 -> 15 | G897: 3 | H897: 4 | I897: =G897*6+H897 -> 22 | K897: 5 | L897: 8 | M897: =K897*6+L897 -> 38 | O897: 9 | P897: 10 | Q897: =O897*6+P897 -> 64 | S897: M.C.G.
A898: (V.F.A.) | S898: LEHENY 1ST & 3RD QTRS
A899: ESSENDON | C899: 3 | D899: 1 | E899: =C899*6+D899 -> 19 | G899: 3 | H899: 5 | I899: =G899*6+H899 -> 23 | K899: 3 | L899: 8 | M899: =K899*6+L899 -> 26 | O899: 4 | P899: 12 | Q899: =O899*6+P899 -> 36 | S899: McMURRAY 2ND & 4TH QTRS
A900: (V.F.L.)
A901: BEST PLAYERS
A902: FOOTSCRAY | D902: SAMSON | G902: LAIDLAW | J902: EASON | M902: PUNCH | P902: McCARTHY | S902: FORD
A903: ESSENDON | D903: WATT | G903: FITZMAURICE | J903: DONALDSON | M903: MAHER | P903: STOCKDALE | S903: FARRELL
A904: GOALKICKERS
A905: FOOTSCRAY | D905: PUNCH 2 | G905: McHENRY 2 | J905: MULLINS 2 | M905: O'BRIEN 2 | P905: SAMSON
A906: ESSENDON | D906: JENKINS 2 | H906: MAY | J906: SHORTEN