A1: Victorian Football Association
A2: Season 1925
A3: © Copyright Wal Williams | F3: First created: 2 November 2014
A4: Contact: joywalwi at gmail dot com | F4: Last updated: 27 January 2018 | W4: VFA Results and tables - Link to the main index page
A5: You are free to copy this document in whole or part provided that proper acknowledgement is given to the author. All rights reserved.
A7: YEAR 1925
A8: ROUND 1 | E8: 2ND MAY | J8: WEATHER | M8: CLOUDY BUT FINE SOUTH WIND | S8: PLAYED AT | X8: LADDER | AB8: ROUND | AD8: 1
D9: 1ST QTR | H9: 2ND QTR | L9: 3RD QTR | P9: FINAL | S9: BRIGHTON BEACH
A10: NORTHCOTE | C10: 1 | D10: 1 | E10: =C10*6+D10 -> 7 | G10: 2 | H10: 4 | I10: =G10*6+H10 -> 16 | K10: 7 | L10: 8 | M10: =K10*6+L10 -> 50 | O10: 8 | P10: 9 | Q10: =O10*6+P10 -> 57 | S10: UMPIRE | W10: TEAM | X10: W | Y10: L | Z10: D | AA10: FOR | AB10: AGST | AC10: % | AD10: PTS
A11: BRIGHTON | C11: 2 | D11: 2 | E11: =C11*6+D11 -> 14 | G11: 4 | H11: 6 | I11: =G11*6+H11 -> 30 | K11: 4 | L11: 9 | M11: =K11*6+L11 -> 33 | O11: 6 | P11: 13 | Q11: =O11*6+P11 -> 49 | S11: STUBBS
A12: BEST PLAYERS | W12: BRUNSWICK | X12: 1 | Y12: 0 | Z12: 0 | AA12: 100 | AB12: 25 | AC12: 400 | AD12: 4
A13: NORTHCOTE | D13: DIMMICK | G13: SHEEHY | I13: HELLWIG | L13: THEOBOLD | O13: DOWNES | Q13: BUISST | W13: PORT MELBOURNE | X13: 1 | Y13: 0 | Z13: 0 | AA13: 107 | AB13: 55 | AC13: 194.54545454545453 | AD13: 4
A14: BRIGHTON | D14: HARRIS | G14: BOYD | I14: GARCIA | L14: LYNCH | O14: FRIEND | Q14: LILBURNE | W14: COBURG | X14: 1 | Y14: 0 | Z14: 0 | AA14: 94 | AB14: 68 | AC14: 138.23529411764707 | AD14: 4
A15: GOALKICKERS | W15: NORTHCOTE | X15: 1 | Y15: 0 | Z15: 0 | AA15: 57 | AB15: 49 | AC15: 116.32653061224489 | AD15: 4
A16: NORTHCOTE | D16: HELLWIG 3 | G16: GOUGH 3 | J16: BAGGOTT | M16: THEOBOLD
A17: BRIGHTON | D17: DAYKIN 2 | G17: BOYD 2 | J17: GRAHAM | M17: BELL | W17: BRIGHTON | X17: 0 | Y17: 1 | Z17: 0 | AA17: 49 | AB17: 57 | AC17: 85.964912280701753 | AD17: 0
W18: GEELONG ASSOC. | X18: 0 | Y18: 1 | Z18: 0 | AA18: 68 | AB18: 94 | AC18: 72.340425531914889 | AD18: 0
A19: BRUNSWICK | C19: 2 | D19: 7 | E19: =C19*6+D19 -> 19 | G19: 5 | H19: 14 | I19: =G19*6+H19 -> 44 | K19: 9 | L19: 25 | M19: =K19*6+L19 -> 79 | O19: 12 | P19: 28 | Q19: =O19*6+P19 -> 100 | S19: BRUNSWICK | W19: PRAHRAN | X19: 0 | Y19: 1 | Z19: 0 | AA19: 55 | AB19: 107 | AC19: 51.401869158878505 | AD19: 0
A20: WILLIAMSTOWN | C20: 1 | D20: 1 | E20: =C20*6+D20 -> 7 | G20: 1 | H20: 4 | I20: =G20*6+H20 -> 10 | K20: 2 | L20: 4 | M20: =K20*6+L20 -> 16 | O20: 3 | P20: 7 | Q20: =O20*6+P20 -> 25 | S20: FURLONGER | W20: WILLIAMSTOWN | X20: 0 | Y20: 1 | Z20: 0 | AA20: 25 | AB20: 100 | AC20: 25 | AD20: 0
A21: BEST PLAYERS
A22: BRUNSWICK | D22: MILLEN | G22: FITZGERALD | J22: McINERNEY | M22: KEDDIE | P22: HASSETT | S22: LOGAN
A23: WILLIAMSTOWN | D23: BRITT | G23: TRUMAN | J23: MUNRO | M23: GEISLER | P23: KING | S23: MUNN
A24: GOALKICKERS
A25: BRUNSWICK | D25: McINERNEY 6 | H25: FITZGERALD 3 | K25: RALEIGH | M25: CAMPBELL | P25: McCORMACK
A26: WILLIAMSTOWN | D26: GEISLER | G26: MUNN | J26: McDONALD
A28: PORT MELBOURNE | C28: 3 | D28: 4 | E28: =C28*6+D28 -> 22 | G28: 7 | H28: 9 | I28: =G28*6+H28 -> 51 | K28: 8 | L28: 12 | M28: =K28*6+L28 -> 60 | O28: 15 | P28: 17 | Q28: =O28*6+P28 -> 107 | S28: TOORAK PARK
A29: PRAHRAN | C29: 2 | D29: 4 | E29: =C29*6+D29 -> 16 | G29: 5 | H29: 5 | I29: =G29*6+H29 -> 35 | K29: 7 | L29: 13 | M29: =K29*6+L29 -> 55 | O29: 7 | P29: 13 | Q29: =O29*6+P29 -> 55 | S29: GREIG
A30: BEST PLAYERS
A31: PORT MELBOURNE | D31: W JOHNSTONE | H31: MURPHY | K31: BARFOOT | N31: J RUDD | Q31: REES | S31: SKILTON
A32: PRAHRAN | D32: E JONES | H32: OSBORNE | K32: HOWELL | N32: V JONES | Q32: THORPE | S32: CARTER
A33: GOALKICKERS
A34: PORT MELBOURNE | D34: SMITH 3 | F34: McMEEKIN 3 | I34: FROUD 2 | K34: MURPHY 2 | M34: SKILTON 2 | O34: ENNIS 2 | Q34: REES | R34: REDMAN
A35: PRAHRAN | D35: CARTER 3 | G35: THORPE 2 | J35: RICHARDS | M35: REA
A37: COBURG | C37: 5 | D37: 1 | E37: =C37*6+D37 -> 31 | G37: 9 | H37: 7 | I37: =G37*6+H37 -> 61 | K37: 12 | L37: 8 | M37: =K37*6+L37 -> 80 | O37: 14 | P37: 10 | Q37: =O37*6+P37 -> 94 | S37: COBURG
A38: GEELONG ASSOC. | C38: 3 | D38: 3 | E38: =C38*6+D38 -> 21 | G38: 4 | H38: 7 | I38: =G38*6+H38 -> 31 | K38: 8 | L38: 12 | M38: =K38*6+L38 -> 60 | O38: 9 | P38: 14 | Q38: =O38*6+P38 -> 68 | S38: BEAUMONT
A39: BEST PLAYERS
A40: COBURG | D40: KERLEY | G40: MARTIN | J40: HUGGINS | M40: FORD | O40: BACQUIE | R40: WEATHERALL
A41: GEELONG ASSOC. | D41: CORFIELD | G41: W DIGBY | J41: NOONAN | M41: HARRIS | O41: RYAN | R41: WATERHOUSE
A42: GOALKICKERS
A43: COBURG | D43: KERLEY 5 | F43: MEARS 3 | H43: REES 2 | J43: WEATHERALL 2 | N43: HUGGINS | P43: HUNTINGTON
A44: GEELONG ASSOC. | D44: NOONAN 7 | G44: COLEMAN | J44: WATERHOUSE
A46: ROUND 2 | E46: 9TH MAY | J46: WEATHER | M46: FINE MILD S.E. BREEZE | S46: PLAYED AT | X46: LADDER | AB46: ROUND | AD46: 2
D47: 1ST QTR | H47: 2ND QTR | L47: 3RD QTR | P47: FINAL | S47: PORT MELBOURNE
A48: PORT MELBOURNE | C48: 1 | D48: 4 | E48: =C48*6+D48 -> 10 | G48: 4 | H48: 7 | I48: =G48*6+H48 -> 31 | K48: 9 | L48: 12 | M48: =K48*6+L48 -> 66 | O48: 9 | P48: 12 | Q48: =O48*6+P48 -> 66 | S48: UMPIRE | W48: TEAM | X48: W | Y48: L | Z48: D | AA48: FOR | AB48: AGST | AC48: % | AD48: PTS
A49: COBURG | C49: 3 | D49: 3 | E49: =C49*6+D49 -> 21 | G49: 5 | H49: 5 | I49: =G49*6+H49 -> 35 | K49: 5 | L49: 6 | M49: =K49*6+L49 -> 36 | O49: 9 | P49: 11 | Q49: =O49*6+P49 -> 65 | S49: LEHENY
A50: BEST PLAYERS | W50: BRUNSWICK | X50: 2 | Y50: 0 | Z50: 0 | AA50: 199 | AB50: 70 | AC50: 284.28571428571428 | AD50: 8
A51: PORT MELBOURNE | D51: REES | F51: J RUDD | I51: MURPHY | L51: ENNIS | N51: W RUDD | Q51: McMEEKIN | W51: PORT MELBOURNE | X51: 2 | Y51: 0 | Z51: 0 | AA51: 173 | AB51: 120 | AC51: 144.16666666666666 | AD51: 8
A52: COBURG | D52: GOULD | F52: MARTIN | I52: BACQUIE | L52: ALEXANDER | N52: REES | Q52: McQUEEN | W52: NORTHCOTE | X52: 2 | Y52: 0 | Z52: 0 | AA52: 145 | AB52: 123 | AC52: 117.88617886178862 | AD52: 8
A53: GOALKICKERS | W53: COBURG | X53: 1 | Y53: 1 | Z53: 0 | AA53: 159 | AB53: 134 | AC53: 118.65671641791045 | AD53: 4
A54: PORT MELBOURNE | D54: FROUD 3 | G54: McMEEKIN 2 | J54: ENNIS 2 | M54: MURPHY | O54: BARFOOT
A55: COBURG | D55: KERLEY 4 | G55: GARDINER 2 | J55: HUGGINS | M55: HUNTINGTON | P55: ELLIOTT | W55: WILLIAMSTOWN | X55: 1 | Y55: 1 | Z55: 0 | AA55: 90 | AB55: 160 | AC55: 56.25 | AD55: 4
W56: BRIGHTON | X56: 0 | Y56: 2 | Z56: 0 | AA56: 109 | AB56: 122 | AC56: 89.344262295081961 | AD56: 0
A57: BRUNSWICK | C57: 5 | D57: 1 | E57: =C57*6+D57 -> 31 | G57: 6 | H57: 6 | I57: =G57*6+H57 -> 42 | K57: 11 | L57: 7 | M57: =K57*6+L57 -> 73 | O57: 15 | P57: 9 | Q57: =O57*6+P57 -> 99 | S57: KARDINIA PARK | W57: PRAHRAN | X57: 0 | Y57: 2 | Z57: 0 | AA57: 129 | AB57: 195 | AC57: 66.15384615384616 | AD57: 0
A58: GEELONG ASSOC. | C58: 1 | D58: 3 | E58: =C58*6+D58 -> 9 | G58: 3 | H58: 7 | I58: =G58*6+H58 -> 25 | K58: 5 | L58: 7 | M58: =K58*6+L58 -> 37 | O58: 6 | P58: 9 | Q58: =O58*6+P58 -> 45 | S58: CHEESELY | W58: GEELONG ASSOC. | X58: 0 | Y58: 2 | Z58: 0 | AA58: 113 | AB58: 193 | AC58: 58.549222797927463 | AD58: 0
A59: BEST PLAYERS
A60: BRUNSWICK | D60: FITZGERALD | G60: RALEIGH | I60: CORBOYS | L60: CAMPBELL | O60: McINERNEY | R60: KEDDIE
A61: GEELONG ASSOC. | D61: ANDERSON | G61: COOPER | I61: ELSTON | L61: NOONAN | O61: FARR | R61: HARRIS
A62: GOALKICKERS
A63: BRUNSWICK | D63: McINERNEY 5 | G63: FITZGERALD 3 | J63: ALESSIO 2 | M63: CAMPBELL 2 | P63: RAYMOND | R63: ANDERSON | U63: DUDLEY
A64: GEELONG ASSOC. | D64: NOONAN 5 | H64: PACKHAM
A66: WILLIAMSTOWN | C66: 0 | D66: 6 | E66: =C66*6+D66 -> 6 | G66: 4 | H66: 9 | I66: =G66*6+H66 -> 33 | K66: 5 | L66: 11 | M66: =K66*6+L66 -> 41 | O66: 9 | P66: 11 | Q66: =O66*6+P66 -> 65 | S66: WILLIAMSTOWN
A67: BRIGHTON | C67: 1 | D67: 2 | E67: =C67*6+D67 -> 8 | G67: 4 | H67: 4 | I67: =G67*6+H67 -> 28 | K67: 6 | L67: 8 | M67: =K67*6+L67 -> 44 | O67: 8 | P67: 12 | Q67: =O67*6+P67 -> 60 | S67: BYRON
A68: BEST PLAYERS
A69: WILLIAMSTOWN | D69: BRITT | G69: SMITH | J69: TRUMAN | M69: GEISLER | P69: CONLAN | S69: KING
A70: BRIGHTON | D70: HARRIS | G70: LILBURNE | J70: DAYKIN | M70: RATTRAY | P70: BORLAND | S70: THRELFALL
A71: GOALKICKERS
A72: WILLIAMSTOWN | D72: MUNN 3 | G72: McDONALD 2 | J72: TORY 2 | M72: TRUMAN | O72: BRITT
A73: BRIGHTON | D73: DAYKIN 3 | G73: TONKIN | J73: BANKS | L73: THRELFALL | O73: COOK | Q73: RINGROSE
A75: NORTHCOTE | C75: 3 | D75: 3 | E75: =C75*6+D75 -> 21 | G75: 6 | H75: 9 | I75: =G75*6+H75 -> 45 | K75: 10 | L75: 13 | M75: =K75*6+L75 -> 73 | O75: 12 | P75: 16 | Q75: =O75*6+P75 -> 88 | S75: NORTHCOTE
A76: PRAHRAN | C76: 1 | D76: 2 | E76: =C76*6+D76 -> 8 | G76: 6 | H76: 5 | I76: =G76*6+H76 -> 41 | K76: 8 | L76: 10 | M76: =K76*6+L76 -> 58 | O76: 10 | P76: 14 | Q76: =O76*6+P76 -> 74 | S76: BLACKBURN
A77: BEST PLAYERS
A78: NORTHCOTE | D78: SHEEHY | G78: SMITH | I78: DOBRIGH | L78: HELLWIG | O78: GOUGH | R78: DOWNES
A79: PRAHRAN | D79: HOWELL | G79: SCALES | I79: CARTER | L79: RENNOLDS | O79: THORPE | R79: E JONES
A80: GOALKICKERS
A81: NORTHCOTE | D81: GOUGH 4 | G81: THEOBOLD 2 | J81: BAGGOTT 2 | M81: DOBRIGH 2 | P81: AHERN | R81: SMITH
A82: PRAHRAN | D82: THORPE 4 | G82: CARTER 2 | J82: RENNOLDS | M82: OSBORNE | O82: MILLER | R82: FIELD
A84: ROUND 3 | E84: 16TH MAY | J84: WEATHER | M84: CLOUDY BUT FINE | S84: PLAYED AT | X84: LADDER | AB84: ROUND | AD84: 3
D85: 1ST QTR | H85: 2ND QTR | L85: 3RD QTR | P85: FINAL | S85: BRUNSWICK
A86: BRUNSWICK | C86: 3 | D86: 4 | E86: =C86*6+D86 -> 22 | G86: 8 | H86: 6 | I86: =G86*6+H86 -> 54 | K86: 12 | L86: 8 | M86: =K86*6+L86 -> 80 | O86: 14 | P86: 14 | Q86: =O86*6+P86 -> 98 | S86: UMPIRE | W86: TEAM | X86: W | Y86: L | Z86: D | AA86: FOR | AB86: AGST | AC86: % | AD86: PTS
A87: NORTHCOTE | C87: 2 | D87: 2 | E87: =C87*6+D87 -> 14 | G87: 5 | H87: 6 | I87: =G87*6+H87 -> 36 | K87: 5 | L87: 9 | M87: =K87*6+L87 -> 39 | O87: 8 | P87: 14 | Q87: =O87*6+P87 -> 62 | S87: BYRON
A88: BEST PLAYERS | W88: BRUNSWICK | X88: 3 | Y88: 0 | Z88: 0 | AA88: 297 | AB88: 132 | AC88: 225 | AD88: 12
A89: BRUNSWICK | D89: RAYMOND | G89: FITZGERALD | J89: McINERNEY | M89: BOLS | O89: O'CONNOR | Q89: LOGAN | W89: PORT MELBOURNE | X89: 3 | Y89: 0 | Z89: 0 | AA89: 241 | AB89: 167 | AC89: 144.31137724550899 | AD89: 12
A90: NORTHCOTE | D90: BAGGOTT | G90: GOUGH | J90: HELLWIG | M90: THOMAS | O90: SHEEHY | Q90: McCASKER | W90: NORTHCOTE | X90: 2 | Y90: 1 | Z90: 0 | AA90: 207 | AB90: 221 | AC90: 93.665158371040718 | AD90: 8
A91: GOALKICKERS | W91: COBURG | X91: 1 | Y91: 2 | Z91: 0 | AA91: 228 | AB91: 214 | AC91: 106.54205607476635 | AD91: 4
A92: BRUNSWICK | D92: McINERNEY 7 | G92: FITZGERALD 3 | J92: ANDERSON 2 | M92: RAYMOND | O92: HART
A93: NORTHCOTE | D93: GOUGH 4 | G93: BAGGOTT 3 | K93: SMITH | W93: BRIGHTON | X93: 1 | Y93: 2 | Z93: 0 | AA93: 189 | AB93: 191 | AC93: 98.952879581151834 | AD93: 4
W94: PRAHRAN | X94: 1 | Y94: 2 | Z94: 0 | AA94: 204 | AB94: 231 | AC94: 88.311688311688314 | AD94: 4
A95: PORT MELBOURNE | C95: 1 | D95: 1 | E95: =C95*6+D95 -> 7 | G95: 2 | H95: 4 | I95: =G95*6+H95 -> 16 | K95: 5 | L95: 10 | M95: =K95*6+L95 -> 40 | O95: 9 | P95: 14 | Q95: =O95*6+P95 -> 68 | S95: WILLIAMSTOWN | W95: WILLIAMSTOWN | X95: 1 | Y95: 2 | Z95: 0 | AA95: 137 | AB95: 228 | AC95: 60.087719298245617 | AD95: 4
A96: WILLIAMSTOWN | C96: 3 | D96: 7 | E96: =C96*6+D96 -> 25 | G96: 4 | H96: 9 | I96: =G96*6+H96 -> 33 | K96: 5 | L96: 10 | M96: =K96*6+L96 -> 40 | O96: 6 | P96: 11 | Q96: =O96*6+P96 -> 47 | S96: FURLONGER | W96: GEELONG ASSOC. | X96: 0 | Y96: 3 | Z96: 0 | AA96: 149 | AB96: 268 | AC96: 55.597014925373138 | AD96: 0
A97: BEST PLAYERS
A98: PORT MELBOURNE | D98: LEWIS | G98: J RUDD | I98: G STYLES | L98: FROUD | N98: LUFF | Q98: BARFOOT
A99: WILLIAMSTOWN | D99: McDONALD | G99: SMITH | I99: BEER | L99: MUNRO | N99: KING | Q99: GEISLER
A100: GOALKICKERS
A101: PORT MELBOURNE | D101: FROUD 3 | G101: WALL 2 | J101: McMEEKIN | M101: J RUDD | O101: W JOHNSTONE | S101: ENNIS
A102: WILLIAMSTOWN | D102: GEISLER 2 | G102: McDONALD | J102: KING | L102: MUNN | N102: SMITH
A104: BRIGHTON | C104: 5 | D104: 4 | E104: =C104*6+D104 -> 34 | G104: 7 | H104: 6 | I104: =G104*6+H104 -> 48 | K104: 9 | L104: 12 | M104: =K104*6+L104 -> 66 | O104: 11 | P104: 14 | Q104: =O104*6+P104 -> 80 | S104: BRIGHTON BEACH
A105: COBURG | C105: 0 | D105: 5 | E105: =C105*6+D105 -> 5 | G105: 2 | H105: 9 | I105: =G105*6+H105 -> 21 | K105: 4 | L105: 14 | M105: =K105*6+L105 -> 38 | O105: 9 | P105: 15 | Q105: =O105*6+P105 -> 69 | S105: LEHENY
A106: BEST PLAYERS
A107: BRIGHTON | D107: BOYD | G107: RATTRAY | J107: BORLAND | M107: DAYKIN | P107: KOLLE | S107: GARCIA
A108: COBURG | D108: FAUST | G108: KERLEY | J108: MEARS | M108: GARDINER | P108: GILBEY | S108: REES
A109: GOALKICKERS
A110: BRIGHTON | D110: BOYD 5 | G110: DAYKIN 5 | J110: MAIN
A111: COBURG | D111: GARDINER 4 | G111: ELLIOTT 2 | J111: MEARS | L111: KERLEY | N111: ALEXANDER
A113: PRAHRAN | C113: 2 | D113: 3 | E113: =C113*6+D113 -> 15 | G113: 5 | H113: 10 | I113: =G113*6+H113 -> 40 | K113: 5 | L113: 13 | M113: =K113*6+L113 -> 43 | O113: 9 | P113: 21 | Q113: =O113*6+P113 -> 75 | S113: TOORAK PARK
A114: GEELONG ASSOC. | C114: 2 | D114: 4 | E114: =C114*6+D114 -> 16 | G114: 3 | H114: 4 | I114: =G114*6+H114 -> 22 | K114: 3 | L114: 9 | M114: =K114*6+L114 -> 27 | O114: 4 | P114: 12 | Q114: =O114*6+P114 -> 36 | S114: BLACKBURN
A115: BEST PLAYERS
A116: PRAHRAN | D116: HOWELL | G116: NAYLOR | J116: V JONES | M116: OSBORNE | P116: REA | R116: THORPE
A117: GEELONG ASSOC. | D117: CATIONS | G117: McFARLANE | J117: NOONAN | M117: HEWITSON | P117: STACK | R117: HARRIS
A118: GOALKICKERS
A119: PRAHRAN | D119: CARTER 2 | G119: THORPE 2 | J119: HOWELL | L119: ROWE | N119: SCALES | P119: SULLIVAN | S119: SHAND
A120: GEELONG ASSOC. | D120: NOONAN 2 | G120: HEWITSON | J120: URE
A122: ROUND 4 | E122: 23RD MAY | H122: WEATHER | K122: COLD CLOUDY LIGHT SHOWERS SOUTH WIND | S122: PLAYED AT | X122: LADDER | AB122: ROUND | AD122: 4
D123: 1ST QTR | H123: 2ND QTR | L123: 3RD QTR | P123: FINAL | S123: NORTHCOTE
A124: NORTHCOTE | C124: 1 | D124: 5 | E124: =C124*6+D124 -> 11 | G124: 4 | H124: 9 | I124: =G124*6+H124 -> 33 | K124: 5 | L124: 10 | M124: =K124*6+L124 -> 40 | O124: 7 | P124: 10 | Q124: =O124*6+P124 -> 52 | S124: UMPIRE | W124: TEAM | X124: W | Y124: L | Z124: D | AA124: FOR | AB124: AGST | AC124: % | AD124: PTS
A125: PORT MELBOURNE | C125: 1 | D125: 4 | E125: =C125*6+D125 -> 10 | G125: 2 | H125: 6 | I125: =G125*6+H125 -> 18 | K125: 2 | L125: 8 | M125: =K125*6+L125 -> 20 | O125: 4 | P125: 11 | Q125: =O125*6+P125 -> 35 | S125: CAIN
A126: BEST PLAYERS | W126: BRUNSWICK | X126: 3 | Y126: 1 | Z126: 0 | AA126: 354 | AB126: 204 | AC126: 173.52941176470588 | AD126: 12
A127: NORTHCOTE | D127: SMITH | F127: HARLEY | I127: BUISST | K127: DOWNES | N127: TAYLOR | Q127: SHEEHY | W127: PORT MELBOURNE | X127: 3 | Y127: 1 | Z127: 0 | AA127: 276 | AB127: 219 | AC127: 126.02739726027397 | AD127: 12
A128: PORT MELBOURNE | D128: W RUDD | F128: BARFOOT | I128: G STYLES | K128: LEWIS | N128: M JOHNSON | Q128: ENNIS | W128: NORTHCOTE | X128: 3 | Y128: 1 | Z128: 0 | AA128: 259 | AB128: 256 | AC128: 101.171875 | AD128: 12
A129: GOALKICKERS | W129: COBURG | X129: 2 | Y129: 2 | Z129: 0 | AA129: 300 | AB129: 271 | AC129: 110.70110701107011 | AD129: 8
A130: NORTHCOTE | D130: DOBRIGH 2 | G130: GOUGH 2 | J130: SHEEHY | L130: GOODRICH | O130: HELLWIG
A131: PORT MELBOURNE | D131: ENNIS 2 | G131: FROUD | J131: FORBES | W131: BRIGHTON | X131: 2 | Y131: 2 | Z131: 0 | AA131: 259 | AB131: 248 | AC131: 104.43548387096774 | AD131: 8
W132: WILLIAMSTOWN | X132: 2 | Y132: 2 | Z132: 0 | AA132: 202 | AB132: 283 | AC132: 71.378091872791515 | AD132: 8
A133: COBURG | C133: 2 | D133: 2 | E133: =C133*6+D133 -> 14 | G133: 4 | H133: 8 | I133: =G133*6+H133 -> 32 | K133: 8 | L133: 12 | M133: =K133*6+L133 -> 60 | O133: 9 | P133: 18 | Q133: =O133*6+P133 -> 72 | S133: COBURG | W133: PRAHRAN | X133: 1 | Y133: 3 | Z133: 0 | AA133: 261 | AB133: 301 | AC133: 86.710963455149496 | AD133: 4
A134: BRUNSWICK | C134: 4 | D134: 4 | E134: =C134*6+D134 -> 28 | G134: 4 | H134: 9 | I134: =G134*6+H134 -> 33 | K134: 7 | L134: 13 | M134: =K134*6+L134 -> 55 | O134: 7 | P134: 15 | Q134: =O134*6+P134 -> 57 | S134: BLACKBURN | W134: GEELONG ASSOC. | X134: 0 | Y134: 4 | Z134: 0 | AA134: 204 | AB134: 333 | AC134: 61.261261261261261 | AD134: 0
A135: BEST PLAYERS
A136: COBURG | D136: HUNTINGTON | G136: MEARS | I136: KERLEY | L136: ELLIOTT | O136: FORD | Q136: WEATHERALL
A137: BRUNSWICK | D137: FITZGERALD | G137: BOLS | I137: RALEIGH | L137: ANDERSON | O137: HISKENS | Q137: McINERNEY
A138: GOALKICKERS
A139: COBURG | D139: REES 2 | G139: KERLAY 2 | J139: MEARS 2 | M139: HUNTINGTON 2 | Q139: ELLIOTT
A140: BRUNSWICK | D140: McINERNEY 4 | H140: FITZGERALD 2 | L140: ANDERSON
A142: BRIGHTON | C142: 3 | D142: 1 | E142: =C142*6+D142 -> 19 | G142: 6 | H142: 3 | I142: =G142*6+H142 -> 39 | K142: 9 | L142: 6 | M142: =K142*6+L142 -> 60 | O142: 10 | P142: 10 | Q142: =O142*6+P142 -> 70 | S142: TOORAK PARK
A143: PRAHRAN | C143: 1 | D143: 1 | E143: =C143*6+D143 -> 7 | G143: 3 | H143: 4 | I143: =G143*6+H143 -> 22 | K143: 5 | L143: 6 | M143: =K143*6+L143 -> 36 | O143: 8 | P143: 9 | Q143: =O143*6+P143 -> 57 | S143: PATTISON
A144: BEST PLAYERS
A145: BRIGHTON | D145: BORLAND | G145: LILBURNE | J145: GARCIA | M145: BOYD | O145: KOLLE | R145: DAYKIN
A146: PRAHRAN | D146: RAE | G146: THORPE | J146: HOWELL | M146: NAYLOR | O146: V JONES | R146: RENNOLDS
A147: GOALKICKERS
A148: BRIGHTON | D148: DAYKIN 3 | G148: MILLIS 3 | J148: GRIFFITHS 2 | N148: RINGROSE 2
A149: PRAHRAN | D149: THORPE 4 | G149: SNELL | J149: A MILLER | M149: ROWE | O149: V JONES
A151: WILLIAMSTOWN | C151: 3 | D151: 2 | E151: =C151*6+D151 -> 20 | G151: 5 | H151: 3 | I151: =G151*6+H151 -> 33 | K151: 9 | L151: 4 | M151: =K151*6+L151 -> 58 | O151: 10 | P151: 5 | Q151: =O151*6+P151 -> 65 | S151: KARDINIA PARK
A152: GEELONG ASSOC. | C152: 0 | D152: 1 | E152: =C152*6+D152 -> 1 | G152: 3 | H152: 4 | I152: =G152*6+H152 -> 22 | K152: 6 | L152: 5 | M152: =K152*6+L152 -> 41 | O152: 8 | P152: 7 | Q152: =O152*6+P152 -> 55 | S152: BEAUMONT
A153: BEST PLAYERS
A154: WILLIAMSTOWN | D154: McDONALD | G154: MUNRO | J154: KING | M154: GEISLER | P154: PORTER | S154: TRUMAN
A155: GEELONG ASSOC. | D155: NOONAN | G155: RYAN | J155: FARR | M155: HEWITSON | P155: PRIDDLE | S155: W DIGBY
A156: GOALKICKERS
A157: WILLIAMSTOWN | D157: McDONALD 4 | G157: GEISLER 2 | J157: KING 2 | L157: ROBERTS | N157: TORY
A158: GEELONG ASSOC. | D158: NOONAN 4 | G158: COLEMAN 2 | J158: COOPER | L158: SPENDLOVE
A160: ROUND 5 | E160: 30TH MAY | J160: WEATHER | M160: CLOUDY BUT FINE | S160: PLAYED AT | X160: LADDER | AB160: ROUND | AD160: 5
D161: 1ST QTR | H161: 2ND QTR | L161: 3RD QTR | P161: FINAL | S161: BRIGHTON BEACH
A162: BRIGHTON | C162: 2 | D162: 4 | E162: =C162*6+D162 -> 16 | G162: 3 | H162: 7 | I162: =G162*6+H162 -> 25 | K162: 9 | L162: 8 | M162: =K162*6+L162 -> 62 | O162: 13 | P162: 9 | Q162: =O162*6+P162 -> 87 | S162: UMPIRE | W162: TEAM | X162: W | Y162: L | Z162: D | AA162: FOR | AB162: AGST | AC162: % | AD162: PTS
A163: PORT MELBOURNE | C163: 0 | D163: 2 | E163: =C163*6+D163 -> 2 | G163: 4 | H163: 9 | I163: =G163*6+H163 -> 33 | K163: 4 | L163: 11 | M163: =K163*6+L163 -> 35 | O163: 7 | P163: 17 | Q163: =O163*6+P163 -> 59 | S163: LEHENY
A164: BEST PLAYERS | W164: BRUNSWICK | X164: 4 | Y164: 1 | Z164: 0 | AA164: 410 | AB164: 244 | AC164: 168.03278688524591 | AD164: 16
A165: BRIGHTON | D165: LILBURNE | F165: RATTRAY | I165: BORLAND | L165: DAYKIN | O165: KOLLE | Q165: BOYD | W165: NORTHCOTE | X165: 4 | Y165: 1 | Z165: 0 | AA165: 357 | AB165: 316 | AC165: 112.9746835443038 | AD165: 16
A166: PORT MELBOURNE | D166: LEWIS | F166: J RUDD | I166: W RUDD | L166: CAMPBELL | O166: BARFOOT | Q166: ROSS | W166: BRIGHTON | X166: 3 | Y166: 2 | Z166: 0 | AA166: 346 | AB166: 307 | AC166: 112.70358306188925 | AD166: 12
A167: GOALKICKERS | W167: COBURG | X167: 3 | Y167: 2 | Z167: 0 | AA167: 365 | AB167: 324 | AC167: 112.65432098765432 | AD167: 12
A168: BRIGHTON | D168: DAYKIN 7 | G168: BOYD 4 | J168: RINGROSE | M168: MILLIS
A169: PORT MELBOURNE | D169: MURPHY 2 | G169: McMEEKIN | J169: MORCAM | M169: K JOHNSON | P169: STYLES | R169: FROUD | W169: PORT MELBOURNE | X169: 3 | Y169: 2 | Z169: 0 | AA169: 335 | AB169: 306 | AC169: 109.47712418300654 | AD169: 12
W170: WILLIAMSTOWN | X170: 2 | Y170: 3 | Z170: 0 | AA170: 255 | AB170: 348 | AC170: 73.275862068965523 | AD170: 8
A171: COBURG | C171: 3 | D171: 4 | E171: =C171*6+D171 -> 22 | G171: 4 | H171: 5 | I171: =G171*6+H171 -> 29 | K171: 6 | L171: 6 | M171: =K171*6+L171 -> 42 | O171: 9 | P171: 11 | Q171: =O171*6+P171 -> 65 | S171: WILLIAMSTOWN | W171: PRAHRAN | X171: 1 | Y171: 4 | Z171: 0 | AA171: 301 | AB171: 357 | AC171: 84.313725490196077 | AD171: 4
A172: WILLIAMSTOWN | C172: 2 | D172: 5 | E172: =C172*6+D172 -> 17 | G172: 4 | H172: 7 | I172: =G172*6+H172 -> 31 | K172: 5 | L172: 10 | M172: =K172*6+L172 -> 40 | O172: 7 | P172: 11 | Q172: =O172*6+P172 -> 53 | S172: BYRON | W172: GEELONG ASSOC. | X172: 0 | Y172: 5 | Z172: 0 | AA172: 264 | AB172: 431 | AC172: 61.252900232018561 | AD172: 0
A173: BEST PLAYERS
A174: COBURG | D174: SEXTON | G174: KERLEY | I174: BACQUIE | L174: GRAF | O174: HUNTINGTON | R174: FORD
A175: WILLIAMSTOWN | D175: MUNRO | G175: KING | I175: BRITT | L175: SMITH | O175: FERGUSON | R175: MUNN
A176: GOALKICKERS
A177: COBURG | D177: GRAF 3 | G177: REES 2 | J177: HUNTINGTON 2 | N177: KERLEY 2
A178: WILLIAMSTOWN | D178: SMITH 2 | G178: McDONALD 2 | J178: BRITT 2 | M178: LARKIN
A180: BRUNSWICK | C180: 0 | D180: 4 | E180: =C180*6+D180 -> 4 | G180: 6 | H180: 5 | I180: =G180*6+H180 -> 41 | K180: 6 | L180: 8 | M180: =K180*6+L180 -> 44 | O180: 7 | P180: 14 | Q180: =O180*6+P180 -> 56 | S180: BRUNSWICK
A181: PRAHRAN | C181: 0 | D181: 7 | E181: =C181*6+D181 -> 7 | G181: 3 | H181: 8 | I181: =G181*6+H181 -> 26 | K181: 4 | L181: 10 | M181: =K181*6+L181 -> 34 | O181: 5 | P181: 10 | Q181: =O181*6+P181 -> 40 | S181: POTTER
A182: BEST PLAYERS
A183: BRUNSWICK | D183: CORBOYS | G183: BLACKMAN | J183: FITZGERALD | N183: KEDDIE | Q183: HASSETT | T183: KEOGH
A184: PRAHRAN | D184: NAYLOR | G184: HOWELL | J184: SCALES | N184: E JONES | Q184: McLEOD | T184: REA
A185: GOALKICKERS
A186: BRUNSWICK | D186: McINERNEY 3 | H186: LEE 2 | K186: EWINS | N186: FITZGERALD
A187: PRAHRAN | D187: SNELL 2 | G187: SULLIVAN | J187: THORPE | M187: V JONES
A189: NORTHCOTE | C189: 1 | D189: 7 | E189: =C189*6+D189 -> 13 | G189: 5 | H189: 10 | I189: =G189*6+H189 -> 40 | K189: 8 | L189: 15 | M189: =K189*6+L189 -> 63 | O189: 13 | P189: 20 | Q189: =O189*6+P189 -> 98 | S189: NORTHCOTE
A190: GEELONG ASSOC. | C190: 2 | D190: 3 | E190: =C190*6+D190 -> 15 | G190: 4 | H190: 9 | I190: =G190*6+H190 -> 33 | K190: 6 | L190: 14 | M190: =K190*6+L190 -> 50 | O190: 7 | P190: 18 | Q190: =O190*6+P190 -> 60 | S190: BLACKBURN
A191: BEST PLAYERS
A192: NORTHCOTE | D192: HELLWIG | G192: HARLEY | J192: DOBRIGH | M192: BAGGOTT | P192: GOUGH | S192: WOODS
A193: GEELONG ASSOC. | D193: COOPER | G193: ELSTON | J193: HARRIS | M193: A COLEMAN | P193: CATIONS | S193: W DIGBY
A194: GOALKICKERS
A195: NORTHCOTE | D195: HELLWIG 5 | G195: BAGGOTT 3 | J195: TAYLOR 2 | M195: GOUGH | O195: DOBRIGH | R195: SMITH
A196: GEELONG ASSOC. | D196: HARRIS 2 | G196: W DIGBY 2 | J196: A COLEMAN | M196: ELSTON | O196: COOPER
A198: ROUND 6 | E198: 6TH JUNE | J198: WEATHER | M198: SHOWERS STRONG WEST WIND | S198: PLAYED AT
D199: 1ST QTR | H199: 2ND QTR | L199: 3RD QTR | P199: FINAL | S199: PORT MELBOURNE | X199: LADDER | AB199: ROUND | AD199: 6
A200: BRUNSWICK | C200: 6 | D200: 2 | E200: =C200*6+D200 -> 38 | G200: 6 | H200: 5 | I200: =G200*6+H200 -> 41 | K200: 9 | L200: 8 | M200: =K200*6+L200 -> 62 | O200: 11 | P200: 11 | Q200: =O200*6+P200 -> 77 | S200: UMPIRE
A201: PORT MELBOURNE | C201: 1 | D201: 1 | E201: =C201*6+D201 -> 7 | G201: 4 | H201: 3 | I201: =G201*6+H201 -> 27 | K201: 5 | L201: 4 | M201: =K201*6+L201 -> 34 | O201: 7 | P201: 6 | Q201: =O201*6+P201 -> 48 | S201: MACHAR | W201: TEAM | X201: W | Y201: L | Z201: D | AA201: FOR | AB201: AGST | AC201: % | AD201: PTS
A202: BEST PLAYERS
A203: BRUNSWICK | D203: O'CONNELL | G203: FITZGERALD | J203: BLACKBURN | M203: BOLS | O203: CAMPBELL | Q203: McINERNEY | W203: BRUNSWICK | X203: 5 | Y203: 1 | Z203: 0 | AA203: 487 | AB203: 292 | AC203: 166.78082191780823 | AD203: 20
A204: PORT MELBOURNE | D204: J RUDD | G204: BARFOOT | J204: REES | M204: W RUDD | O204: SKILTON | Q204: McMEEKIN | W204: NORTHCOTE | X204: 5 | Y204: 1 | Z204: 0 | AA204: 480 | AB204: 371 | AC204: 129.38005390835579 | AD204: 20
A205: GOALKICKERS | W205: COBURG | X205: 4 | Y205: 2 | Z205: 0 | AA205: 420 | AB205: 377 | AC205: 111.40583554376659 | AD205: 16
A206: BRUNSWICK | D206: McINERNEY 4 | G206: BLACKMAN 2 | J206: HISKENS | L206: HASSETT | N206: FITZGERALD | Q206: CAMPBELL | T206: BOLS | W206: BRIGHTON | X206: 3 | Y206: 3 | Z206: 0 | AA206: 386 | AB206: 367 | AC206: 105.17711171662125 | AD206: 12
A207: PORT MELBOURNE | D207: McMEEKIN 3 | H207: SKILTON 2 | K207: M JOHNSON | N207: FROUD
W208: PORT MELBOURNE | X208: 3 | Y208: 3 | Z208: 0 | AA208: 383 | AB208: 383 | AC208: 100 | AD208: 12
A209: NORTHCOTE | C209: 4 | D209: 2 | E209: =C209*6+D209 -> 26 | G209: 9 | H209: 5 | I209: =G209*6+H209 -> 59 | K209: 11 | L209: 9 | M209: =K209*6+L209 -> 75 | O209: 18 | P209: 15 | Q209: =O209*6+P209 -> 123 | S209: NORTHCOTE | W209: WILLIAMSTOWN | X209: 2 | Y209: 4 | Z209: 0 | AA209: 310 | AB209: 471 | AC209: 65.817409766454347 | AD209: 8
A210: WILLIAMSTOWN | C210: 2 | D210: 4 | E210: =C210*6+D210 -> 16 | G210: 3 | H210: 4 | I210: =G210*6+H210 -> 22 | K210: 4 | L210: 7 | M210: =K210*6+L210 -> 31 | O210: 8 | P210: 7 | Q210: =O210*6+P210 -> 55 | S210: BLACKBURN | W210: PRAHRAN | X210: 1 | Y210: 5 | Z210: 0 | AA210: 354 | AB210: 412 | AC210: 85.922330097087382 | AD210: 4
A211: BEST PLAYERS | W211: GEELONG ASSOC. | X211: 1 | Y211: 5 | Z211: 0 | AA211: 324 | AB211: 471 | AC211: 68.789808917197448 | AD211: 4
A212: NORTHCOTE | D212: SHEEHY | G212: HELLWIG | J212: LONG | L212: DOWNES | O212: WHITE | R212: GOUGH
A213: WILLIAMSTOWN | D213: WARREN | G213: WILKINS | J213: SMITH | L213: McKELLAR | O213: BRITT | R213: CALLESON
A214: GOALKICKERS
A215: NORTHCOTE | D215: GOUGH 7 | F215: BAGGOTT 2 | I215: HELLWIG 2 | L215: DOBRIGH 2 | N215: DOWNES 2 | Q215: THEOBOLD 2 | T215: WHITE
A216: WILLIAMSTOWN | D216: WILKINS 3 | G216: McDONALD 3 | K216: SMITH 2
A218: COBURG | C218: 2 | D218: 3 | E218: =C218*6+D218 -> 15 | G218: 3 | H218: 7 | I218: =G218*6+H218 -> 25 | K218: 5 | L218: 9 | M218: =K218*6+L218 -> 39 | O218: 6 | P218: 19 | Q218: =O218*6+P218 -> 55 | S218: COBURG
A219: PRAHRAN | C219: 3 | D219: 2 | E219: =C219*6+D219 -> 20 | G219: 6 | H219: 6 | I219: =G219*6+H219 -> 42 | K219: 7 | L219: 7 | M219: =K219*6+L219 -> 49 | O219: 7 | P219: 11 | Q219: =O219*6+P219 -> 53 | S219: LEHENY
A220: BEST PLAYERS
A221: COBURG | D221: FAUST | G221: BACQUIE | J221: BROOKES | M221: HUNTINGTON | P221: BEESON | S221: TURNER
A222: PRAHRAN | D222: HOWELL | G222: THORPE | J222: VANCE | M222: RENNOLDS | P222: SULLIVAN | S222: OSBORNE
A223: GOALKICKERS
A224: COBURG | D224: BEESON 3 | G224: JENKINS | J224: REES | L224: MEARS
A225: PRAHRAN | D225: THORPE 3 | G225: REEVES 2 | J225: SULLIVAN 2
E226: 9TH JUNE | J226: WEATHER | M226: CLOUDY BUT FINE WEST WIND
A227: GEELONG ASSOC. | C227: 1 | D227: 1 | E227: =C227*6+D227 -> 7 | G227: 3 | H227: 2 | I227: =G227*6+H227 -> 20 | K227: 6 | L227: 4 | M227: =K227*6+L227 -> 40 | O227: 9 | P227: 6 | Q227: =O227*6+P227 -> 60 | S227: KARDINIA PARK
A228: BRIGHTON | C228: 0 | D228: 2 | E228: =C228*6+D228 -> 2 | G228: 2 | H228: 9 | I228: =G228*6+H228 -> 21 | K228: 3 | L228: 13 | M228: =K228*6+L228 -> 31 | O228: 4 | P228: 16 | Q228: =O228*6+P228 -> 40
A229: BEST PLAYERS
A230: GEELONG ASSOC. | D230: COOPER | G230: NOONAN | J230: CORFIELD | M230: CATIONS | P230: MELLAHN | S230: A COLEMAN
A231: BRIGHTON | D231: CARROLL | G231: FRIEND | J231: KOLLE | M231: BORLAND | P231: RATTRAY | S231: LILBURNE
A232: GOALKICKERS
A233: GEELONG ASSOC. | D233: COOPER 4 | G233: HARRIS | J233: A COLEMAN
A234: BRIGHTON | D234: DAYKIN | G234: MAIN | J234: BOYD
A236: ROUND 7 | E236: 13TH JUNE | J236: WEATHER | M236: FINE AFTER EARLY FOG | S236: PLAYED AT | X236: LADDER | AB236: ROUND | AD236: 7
D237: 1ST QTR | H237: 2ND QTR | L237: 3RD QTR | P237: FINAL | S237: COBURG
A238: NORTHCOTE | C238: 3 | D238: 0 | E238: =C238*6+D238 -> 18 | G238: 7 | H238: 4 | I238: =G238*6+H238 -> 46 | K238: 8 | L238: 5 | M238: =K238*6+L238 -> 53 | O238: 13 | P238: 8 | Q238: =O238*6+P238 -> 86 | S238: UMPIRE | W238: TEAM | X238: W | Y238: L | Z238: D | AA238: FOR | AB238: AGST | AC238: % | AD238: PTS
A239: COBURG | C239: 1 | D239: 6 | E239: =C239*6+D239 -> 12 | G239: 2 | H239: 14 | I239: =G239*6+H239 -> 26 | K239: 6 | L239: 20 | M239: =K239*6+L239 -> 56 | O239: 8 | P239: 23 | Q239: =O239*6+P239 -> 71 | S239: LEHENY
A240: BEST PLAYERS | W240: BRUNSWICK | X240: 6 | Y240: 1 | Z240: 0 | AA240: 568 | AB240: 351 | AC240: 161.82336182336184 | AD240: 24
A241: NORTHCOTE | D241: DOWNES | F241: SHEEHY | I241: GOUGH | L241: WOODS | O241: SMITH | Q241: DOBRIGH | W241: NORTHCOTE | X241: 6 | Y241: 1 | Z241: 0 | AA241: 566 | AB241: 442 | AC241: 128.05429864253395 | AD241: 24
A242: COBURG | D242: FORD | F242: ALEXANDER | I242: ELLIOTT | L242: MEARS | O242: BROOKES | Q242: REES | W242: PORT MELBOURNE | X242: 4 | Y242: 3 | Z242: 0 | AA242: 476 | AB242: 428 | AC242: 111.21495327102804 | AD242: 16
A243: GOALKICKERS | Q243: SMITH | S243: BAGGOTT | W243: COBURG | X243: 4 | Y243: 3 | Z243: 0 | AA243: 491 | AB243: 463 | AC243: 106.0475161987041 | AD243: 16
A244: NORTHCOTE | D244: THEOBOLD 3 | G244: GOUGH 2 | I244: JOHNSON 2 | L244: DOBRIGH | N244: DOWNES | P244: WOODS | R244: HELLWIG
A245: COBURG | D245: KERLEY 4 | G245: HUNTINGTON 2 | K245: MEARS | M245: BEESON | W245: BRIGHTON | X245: 3 | Y245: 4 | Z245: 0 | AA245: 445 | AB245: 448 | AC245: 99.330357142857139 | AD245: 12
W246: WILLIAMSTOWN | X246: 3 | Y246: 4 | Z246: 0 | AA246: 396 | AB246: 524 | AC246: 75.572519083969468 | AD246: 12
A247: BRUNSWICK | C247: 5 | D247: 2 | E247: =C247*6+D247 -> 32 | G247: 6 | H247: 2 | I247: =G247*6+H247 -> 38 | K247: 9 | L247: 6 | M247: =K247*6+L247 -> 60 | O247: 12 | P247: 9 | Q247: =O247*6+P247 -> 81 | S247: BRIGHTON BEACH | W247: PRAHRAN | X247: 1 | Y247: 6 | Z247: 0 | AA247: 407 | AB247: 498 | AC247: 81.726907630522092 | AD247: 4
A248: BRIGHTON | C248: 0 | D248: 1 | E248: =C248*6+D248 -> 1 | G248: 4 | H248: 9 | I248: =G248*6+H248 -> 33 | K248: 6 | L248: 9 | M248: =K248*6+L248 -> 45 | O248: 8 | P248: 11 | Q248: =O248*6+P248 -> 59 | S248: BYRON | W248: GEELONG ASSOC. | X248: 1 | Y248: 6 | Z248: 0 | AA248: 369 | AB248: 564 | AC248: 65.425531914893611 | AD248: 4
A249: BEST PLAYERS
A250: BRUNSWICK | D250: RAYMOND | G250: CORBOYS | J250: BOLS | M250: GREEN | P250: McINERNEY | S250: HART
A251: BRIGHTON | D251: IRWIN | G251: KOLLE | J251: CARROLL | M251: RATTRAY | P251: GARCIA | S251: BORLAND
A252: GOALKICKERS
A253: BRUNSWICK | D253: McINERNEY 5 | G253: BOLS 4) | J253: BLACKBURN | M253: ANDERSON | P253: FITZGERALD
A254: BRIGHTON | D254: DAYKIN 2 | G254: BANKS 2 | J254: LYNCH | L254: ATKINSON | O254: RATTRAY | Q254: RINGROSE
A256: WILLIAMSTOWN | C256: 2 | D256: 2 | E256: =C256*6+D256 -> 14 | G256: 7 | H256: 4 | I256: =G256*6+H256 -> 46 | K256: 9 | L256: 11 | M256: =K256*6+L256 -> 65 | O256: 12 | P256: 14 | Q256: =O256*6+P256 -> 86 | S256: WILLIAMSTOWN
A257: PRAHRAN | C257: 2 | D257: 2 | E257: =C257*6+D257 -> 14 | G257: 5 | H257: 3 | I257: =G257*6+H257 -> 33 | K257: 7 | L257: 4 | M257: =K257*6+L257 -> 46 | O257: 8 | P257: 5 | Q257: =O257*6+P257 -> 53 | S257: BLACKBURN
A258: BEST PLAYERS
A259: WILLIAMSTOWN | D259: KING | G259: SMITH | J259: FERGUSON | M259: MUNRO | P259: BRITT | S259: WILKENS
A260: PRAHRAN | D260: V JONES | G260: RENNOLDS | J260: MORDEN | M260: TAYLOR | P260: THORPE | S260: SNELL
A261: GOALKICKERS
A262: WILLIAMSTOWN | D262: KING 4 | G262: TRUMAN 2 | J262: SMITH 2 | M262: FERGUSON 2 | P262: BRITT | R262: WILKENS
A263: PRAHRAN | D263: THORPE 3 | G263: REEVES 2 | J263: SNELL | L263: EDWARDS | O263: V JONES
A265: PORT MELBOURNE | C265: 2 | D265: 4 | E265: =C265*6+D265 -> 16 | G265: 5 | H265: 8 | I265: =G265*6+H265 -> 38 | K265: 10 | L265: 12 | M265: =K265*6+L265 -> 72 | O265: 13 | P265: 15 | Q265: =O265*6+P265 -> 93 | S265: PORT MELBOURNE
A266: GEELONG ASSOC. | C266: 5 | D266: 5 | E266: =C266*6+D266 -> 35 | G266: 5 | H266: 6 | I266: =G266*6+H266 -> 36 | K266: 6 | L266: 7 | M266: =K266*6+L266 -> 43 | O266: 6 | P266: 9 | Q266: =O266*6+P266 -> 45 | S266: PETERS
A267: BEST PLAYERS
A268: PORT MELBOURNE | D268: REES | G268: BARFOOT | J268: J STYLES | M268: McMEEKIN | P268: MORRIS | S268: LEWIS
A269: GEELONG ASSOC. | D269: HEWITSON | G269: NOONAN | J269: CORFIELD | M269: HARRIS | P269: MELLAHN | S269: POWELL
A270: GOALKICKERS
A271: PORT MELBOURNE | D271: McMEEKIN 5 | G271: MORRIS 2 | I271: REES 2 | K271: BARFOOT | M271: FROUD | O271: SKILTON | Q271: K JOHNSON
A272: GEELONG ASSOC. | D272: NOONAN 2 | G272: A COLEMAN 2 | K272: HEWITSON | N272: STACK
A274: ROUND 8 | E274: 20TH JUNE | J274: WEATHER | N274: FINE S.E. BREEZE | S274: PLAYED AT | X274: LADDER | AB274: ROUND | AD274: 8
D275: 1ST QTR | H275: 2ND QTR | L275: 3RD QTR | P275: FINAL | S275: NORTHCOTE
A276: NORTHCOTE | C276: 1 | D276: 2 | E276: =C276*6+D276 -> 8 | G276: 4 | H276: 3 | I276: =G276*6+H276 -> 27 | K276: 7 | L276: 5 | M276: =K276*6+L276 -> 47 | O276: 10 | P276: 7 | Q276: =O276*6+P276 -> 67 | S276: UMPIRE | W276: TEAM | X276: W | Y276: L | Z276: D | AA276: FOR | AB276: AGST | AC276: % | AD276: PTS
A277: BRIGHTON | C277: 1 | D277: 6 | E277: =C277*6+D277 -> 12 | G277: 3 | H277: 10 | I277: =G277*6+H277 -> 28 | K277: 5 | L277: 11 | M277: =K277*6+L277 -> 41 | O277: 8 | P277: 15 | Q277: =O277*6+P277 -> 63 | S277: PETERS
A278: BEST PLAYERS | W278: BRUNSWICK | X278: 7 | Y278: 1 | Z278: 0 | AA278: 629 | AB278: 398 | AC278: 158.04020100502512 | AD278: 28
A279: NORTHCOTE | D279: DOWNES | G279: HARLEY | I279: WOODS | L279: HELLWIG | O279: CASSIDY | Q279: LONG | W279: NORTHCOTE | X279: 7 | Y279: 1 | Z279: 0 | AA279: 633 | AB279: 505 | AC279: 125.34653465346534 | AD279: 28
A280: BRIGHTON | D280: BORLAND | G280: RINGROSE | I280: LILBURNE | L280: THRELFALL | O280: KOLLE | Q280: DORE | W280: PORT MELBOURNE | X280: 5 | Y280: 3 | Z280: 0 | AA280: 582 | AB280: 485 | AC280: 120 | AD280: 20
A281: GOALKICKERS | W281: COBURG | X281: 5 | Y281: 3 | Z281: 0 | AA281: 581 | AB281: 525 | AC281: 110.66666666666667 | AD281: 20
A282: NORTHCOTE | D282: CASSIDY 2 | F282: PERKINS 2 | I282: HELLWIG 2 | L282: THEOBOLD | N282: BAGGOTT | P282: DIMMICK | R282: DOBRIGH
A283: BRIGHTON | D283: BOYD 2 | F283: DAYKIN | H283: DEADY | J283: RATTRAY | L283: BORLAND | N283: RINGROSE | Q283: IRWIN | W283: BRIGHTON | X283: 3 | Y283: 5 | Z283: 0 | AA283: 508 | AB283: 515 | AC283: 98.640776699029132 | AD283: 12
W284: WILLIAMSTOWN | X284: 3 | Y284: 5 | Z284: 0 | AA284: 443 | AB284: 585 | AC284: 75.726495726495727 | AD284: 12
A285: BRUNSWICK | C285: 0 | D285: 5 | E285: =C285*6+D285 -> 5 | G285: 2 | H285: 6 | I285: =G285*6+H285 -> 18 | K285: 7 | L285: 11 | M285: =K285*6+L285 -> 53 | O285: 8 | P285: 13 | Q285: =O285*6+P285 -> 61 | S285: WILLIAMSTOWN | W285: PRAHRAN | X285: 1 | Y285: 7 | Z285: 0 | AA285: 464 | AB285: 604 | AC285: 76.821192052980138 | AD285: 4
A286: WILLIAMSTOWN | C286: 2 | D286: 0 | E286: =C286*6+D286 -> 12 | G286: 2 | H286: 5 | I286: =G286*6+H286 -> 17 | K286: 4 | L286: 6 | M286: =K286*6+L286 -> 30 | O286: 6 | P286: 11 | Q286: =O286*6+P286 -> 47 | S286: LEHENY | W286: GEELONG ASSOC. | X286: 1 | Y286: 7 | Z286: 0 | AA286: 431 | AB286: 654 | AC286: 65.902140672782878 | AD286: 4
A287: BEST PLAYERS
A288: BRUNSWICK | D288: HASSETT | F288: FITZGERALD | I288: RALEIGH | L288: CORBOYS | O288: BRIGHT | Q288: GREEN
A289: WILLIAMSTOWN | D289: BRITT | F289: WHITBURN | I289: FLANNERY | L289: SMITH | O289: FERGUSON | Q289: KING
A290: GOALKICKERS
A291: BRUNSWICK | D291: ANDERSON 2 | G291: McINERNEY 2 | J291: BLACKBURN 2 | M291: HASSETT | O291: RALEIGH
A292: WILLIAMSTOWN | D292: BRITT 2 | G292: MUNRO | J292: HERMAN | L292: SMITH | N292: CALLESON
A294: PORT MELBOURNE | C294: 4 | D294: 5 | E294: =C294*6+D294 -> 29 | G294: 6 | H294: 8 | I294: =G294*6+H294 -> 44 | K294: 9 | L294: 10 | M294: =K294*6+L294 -> 64 | O294: 15 | P294: 16 | Q294: =O294*6+P294 -> 106 | S294: PORT MELBOURNE
A295: PRAHRAN | C295: 2 | D295: 3 | E295: =C295*6+D295 -> 15 | G295: 3 | H295: 8 | I295: =G295*6+H295 -> 26 | K295: 6 | L295: 10 | M295: =K295*6+L295 -> 46 | O295: 7 | P295: 15 | Q295: =O295*6+P295 -> 57 | S295: BLACKBURN
A296: BEST PLAYERS
A297: PORT MELBOURNE | D297: W RUDD | G297: MORRIS | J297: SKILTON | M297: BARFOOT | P297: CROMPTON | S297: McMEEKIN
A298: PRAHRAN | D298: WARD | G298: SULLIVAN | J298: REA | M298: OSBORNE | P298: McLEOD | S298: NAYLOR
A299: GOALKICKERS
A300: PORT MELBOURNE | D300: MORRIS 7 | G300: SKILTON 3 | J300: McMEEKIN 3 | M300: K JOHNSON | P300: W RUDD
A301: PRAHRAN | D301: SULLIVAN 3 | G301: A MILLER | J301: O MILLER | M301: THORPE | O301: SCALES
A303: COBURG | C303: 2 | D303: 3 | E303: =C303*6+D303 -> 15 | G303: 5 | H303: 9 | I303: =G303*6+H303 -> 39 | K303: 12 | L303: 10 | M303: =K303*6+L303 -> 82 | O303: 13 | P303: 12 | Q303: =O303*6+P303 -> 90 | S303: KARDINIA PARK
A304: GEELONG ASSOC. | C304: 2 | D304: 5 | E304: =C304*6+D304 -> 17 | G304: 4 | H304: 7 | I304: =G304*6+H304 -> 31 | K304: 6 | L304: 9 | M304: =K304*6+L304 -> 45 | O304: 8 | P304: 14 | Q304: =O304*6+P304 -> 62 | S304: ANTONIO
A305: BEST PLAYERS
A306: COBURG | D306: BEESON | G306: JENKINS | J306: SEXTON | M306: SMITH | P306: KERLEY | S306: WEATHERALL
A307: GEELONG ASSOC. | D307: ELSTON | G307: WRIGHT | J307: HARRIS | M307: McFARLANE | P307: CATIONS | S307: W DIGBY
A308: GOALKICKERS
A309: COBURG | D309: BEESON 6 | F309: WEATHERALL | I309: ALEXANDER | L309: JENKINS | N309: SMITH | P309: KERLEY | R309: BACQUIS
A310: GEELONG ASSOC. | D310: A COLEMAN 3 | G310: NOONAN | I310: W DIGBY | L310: FARR | N310: DUNCAN | Q310: ELSTON
A312: ROUND 9 | E312: 27TH JUNE | H312: WEATHER | K312: CLOUDY LIGHT SHOWERS GROUNDS DAMP | S312: PLAYED AT | X312: LADDER | AB312: ROUND | AD312: 9
D313: 1ST QTR | H313: 2ND QTR | L313: 3RD QTR | P313: FINAL | S313: COBURG
A314: COBURG | C314: 2 | D314: 1 | E314: =C314*6+D314 -> 13 | G314: 6 | H314: 2 | I314: =G314*6+H314 -> 38 | K314: 10 | L314: 7 | M314: =K314*6+L314 -> 67 | O314: 11 | P314: 9 | Q314: =O314*6+P314 -> 75 | S314: UMPIRE | W314: TEAM | X314: W | Y314: L | Z314: D | AA314: FOR | AB314: AGST | AC314: % | AD314: PTS
A315: PORT MELBOURNE | C315: 1 | D315: 1 | E315: =C315*6+D315 -> 7 | G315: 2 | H315: 4 | I315: =G315*6+H315 -> 16 | K315: 4 | L315: 8 | M315: =K315*6+L315 -> 32 | O315: 9 | P315: 8 | Q315: =O315*6+P315 -> 62 | S315: PETERS
A316: BEST PLAYERS | W316: BRUNSWICK | X316: 8 | Y316: 1 | Z316: 0 | AA316: 749 | AB316: 435 | AC316: 172.18390804597701 | AD316: 32
A317: COBURG | D317: FORD | F317: GARDINER | I317: JENKINS | K317: MILNE | M317: MEARS | P317: BROOKES | W317: NORTHCOTE | X317: 8 | Y317: 1 | Z317: 0 | AA317: 714 | AB317: 576 | AC317: 123.95833333333333 | AD317: 32
A318: PORT MELBOURNE | D318: LEWIS | F318: BARFOOT | I318: SKILTON | K318: W RUDD | M318: CROMPTON | P318: M JOHNSON | W318: COBURG | X318: 6 | Y318: 3 | Z318: 0 | AA318: 656 | AB318: 587 | AC318: 111.75468483816013 | AD318: 24
A319: GOALKICKERS | W319: PORT MELBOURNE | X319: 5 | Y319: 4 | Z319: 0 | AA319: 644 | AB319: 560 | AC319: 115 | AD319: 20
A320: COBURG | D320: BEESON 3 | F320: KERLEY 2 | H320: GARDINER 2 | K320: ALEXANDER | N320: WEATHERALL | Q320: HUNTINGTON | T320: REES
A321: PORT MELBOURNE | D321: MORRIS 4 | G321: M JOHNSON 2 | K321: SKILTON 2 | N321: RUSSELL | W321: BRIGHTON | X321: 4 | Y321: 5 | Z321: 0 | AA321: 584 | AB321: 561 | AC321: 104.09982174688056 | AD321: 16
W322: WILLIAMSTOWN | X322: 3 | Y322: 6 | Z322: 0 | AA322: 489 | AB322: 661 | AC322: 73.978819969742815 | AD322: 12
A323: BRIGHTON | C323: 1 | D323: 1 | E323: =C323*6+D323 -> 7 | G323: 4 | H323: 5 | I323: =G323*6+H323 -> 29 | K323: 7 | L323: 9 | M323: =K323*6+L323 -> 51 | O323: 10 | P323: 16 | Q323: =O323*6+P323 -> 76 | S323: BRIGHTON BEACH | W323: PRAHRAN | X323: 1 | Y323: 8 | Z323: 0 | AA323: 535 | AB323: 685 | AC323: 78.102189781021892 | AD323: 4
A324: WILLIAMSTOWN | C324: 2 | D324: 4 | E324: =C324*6+D324 -> 16 | G324: 3 | H324: 7 | I324: =G324*6+H324 -> 25 | K324: 5 | L324: 10 | M324: =K324*6+L324 -> 40 | O324: 6 | P324: 10 | Q324: =O324*6+P324 -> 46 | S324: ANTONIO | W324: GEELONG ASSOC. | X324: 1 | Y324: 8 | Z324: 0 | AA324: 468 | AB324: 774 | AC324: 60.465116279069768 | AD324: 4
A325: BEST PLAYERS
A326: BRIGHTON | D326: RINGROSE | G326: LILBURNE | J326: BORLAND | M326: STEPHENSON | P326: DAYKIN | S326: IRWIN
A327: WILLIAMSTOWN | D327: BRITT | G327: KING | J327: MUNRO | M327: ROBERTS | P327: TRUMAN | S327: CONLAN
A328: GOALKICKERS
A329: BRIGHTON | D329: DAYKIN 4 | G329: GRIFFITHS 3 | J329: IRWIN | L329: RATTRAY | N329: ATKINSON | Q329: ATKINSON
A330: WILLIAMSTOWN | D330: KING | G330: FERGUSON | J330: JOHNS | L330: MUNRO | N330: BRITT | P330: TORY
A332: NORTHCOTE | C332: 4 | D332: 8 | E332: =C332*6+D332 -> 32 | G332: 7 | H332: 9 | I332: =G332*6+H332 -> 51 | K332: 9 | L332: 12 | M332: =K332*6+L332 -> 66 | O332: 11 | P332: 15 | Q332: =O332*6+P332 -> 81 | S332: TOORAK PARK
A333: PRAHRAN | C333: 0 | D333: 1 | E333: =C333*6+D333 -> 1 | G333: 4 | H333: 7 | I333: =G333*6+H333 -> 31 | K333: 4 | L333: 9 | M333: =K333*6+L333 -> 33 | O333: 10 | P333: 11 | Q333: =O333*6+P333 -> 71 | S333: LEHENY
A334: BEST PLAYERS
A335: NORTHCOTE | D335: GOODRICH | G335: BAGGOTT | J335: THEOBOLD | M335: McNEIL | O335: HELLWIG | R335: SHEEHY
A336: PRAHRAN | D336: McLEOD | G336: V JONES | J336: NAYLOR | M336: VANCE | O336: RENNOLDS | R336: SULLIVAN
A337: GOALKICKERS
A338: NORTHCOTE | D338: GOODRICH 4 | G338: BAGGOTT 2 | J338: HELLWIG | L338: GOUGH | N338: McNEIL | P338: THEOBOLD | R338: DOWNES
A339: PRAHRAN | D339: THORPE 5 | G339: SULLIVAN 2 | K339: SCALES | N339: NAYLOR | P339: JAMES
A341: BRUNSWICK | C341: 4 | D341: 1 | E341: =C341*6+D341 -> 25 | G341: 9 | H341: 6 | I341: =G341*6+H341 -> 60 | K341: 13 | L341: 11 | M341: =K341*6+L341 -> 89 | O341: 17 | P341: 18 | Q341: =O341*6+P341 -> 120 | S341: BRUNSWICK
A342: GEELONG ASSOC. | C342: 2 | D342: 0 | E342: =C342*6+D342 -> 12 | G342: 3 | H342: 2 | I342: =G342*6+H342 -> 20 | K342: 4 | L342: 3 | M342: =K342*6+L342 -> 27 | O342: 5 | P342: 7 | Q342: =O342*6+P342 -> 37 | S342: BLACKBURN
A343: BEST PLAYERS
A344: BRUNSWICK | D344: FITZGERALD | G344: McINERNEY | J344: BOLS | M344: RAYMOND | O344: HISKENS | R344: CORBOYS
A345: GEELONG ASSOC. | D345: ELSTON | G345: PRIDDLE | J345: NOONAN | M345: WRIGHT | O345: MELLAHN | R345: FARR
A346: GOALKICKERS
A347: BRUNSWICK | D347: McINERNEY 13 | H347: EWINS | J347: HART | L347: FITZGERALD | O347: BOLS
A348: GEELONG ASSOC. | D348: NOONAN | G348: A COLEMAN | J348: ELSTON | M348: MELLAHN | P348: FARR
A350: ROUND 10 | E350: 4TH JULY | H350: WEATHER | K350: CLOUDY BUT FINE SOUTH BREEZE | S350: PLAYED AT | X350: LADDER | AB350: ROUND | AD350: 10
D351: 1ST QTR | H351: 2ND QTR | L351: 3RD QTR | P351: FINAL | S351: NORTHCOTE
A352: BRUNSWICK | C352: 1 | D352: 2 | E352: =C352*6+D352 -> 8 | G352: 6 | H352: 6 | I352: =G352*6+H352 -> 42 | K352: 6 | L352: 8 | M352: =K352*6+L352 -> 44 | O352: 11 | P352: 13 | Q352: =O352*6+P352 -> 79 | S352: UMPIRE | W352: TEAM | X352: W | Y352: L | Z352: D | AA352: FOR | AB352: AGST | AC352: % | AD352: PTS
A353: NORTHCOTE | C353: 2 | D353: 2 | E353: =C353*6+D353 -> 14 | G353: 2 | H353: 4 | I353: =G353*6+H353 -> 16 | K353: 4 | L353: 9 | M353: =K353*6+L353 -> 33 | O353: 6 | P353: 13 | Q353: =O353*6+P353 -> 49 | S353: MACHAR
A354: BEST PLAYERS | W354: BRUNSWICK | X354: 9 | Y354: 1 | Z354: 0 | AA354: 828 | AB354: 484 | AC354: 171.07438016528926 | AD354: 36
A355: BRUNSWICK | D355: McINERNEY | G355: FITZGERALD | J355: GREEN | L355: HASSETT | O355: RALEIGH | Q355: KEDDIE | W355: NORTHCOTE | X355: 8 | Y355: 2 | Z355: 0 | AA355: 763 | AB355: 655 | AC355: 116.4885496183206 | AD355: 32
A356: NORTHCOTE | D356: DOWNES | G356: SHEEHY | J356: SMITH | L356: GOODRICH | O356: JOHNSON | Q356: THEOBOLD | W356: PORT MELBOURNE | X356: 6 | Y356: 4 | Z356: 0 | AA356: 721 | AB356: 617 | AC356: 116.85575364667747 | AD356: 24
A357: GOALKICKERS | W357: COBURG | X357: 6 | Y357: 4 | Z357: 0 | AA357: 724 | AB357: 663 | AC357: 109.20060331825037 | AD357: 24
A358: BRUNSWICK | D358: McINERNEY 6 | H358: BOLS 2 | K358: McLATCHIE | N358: RAYMOND | Q358: HART
A359: NORTHCOTE | D359: GOODRICH 2 | H359: JOHNSON 2 | K359: BAGGOTT | N359: THEOBOLD | W359: BRIGHTON | X359: 5 | Y359: 5 | Z359: 0 | AA359: 660 | AB359: 629 | AC359: 104.92845786963434 | AD359: 20
W360: WILLIAMSTOWN | X360: 3 | Y360: 7 | Z360: 0 | AA360: 546 | AB360: 738 | AC360: 73.983739837398375 | AD360: 12
A361: BRIGHTON | C361: 3 | D361: 1 | E361: =C361*6+D361 -> 19 | G361: 5 | H361: 11 | I361: =G361*6+H361 -> 41 | K361: 8 | L361: 14 | M361: =K361*6+L361 -> 62 | O361: 10 | P361: 16 | Q361: =O361*6+P361 -> 76 | S361: COBURG | W361: PRAHRAN | X361: 2 | Y361: 8 | Z361: 0 | AA361: 625 | AB361: 762 | AC361: 82.020997375328079 | AD361: 8
A362: COBURG | C362: 3 | D362: 6 | E362: =C362*6+D362 -> 24 | G362: 4 | H362: 8 | I362: =G362*6+H362 -> 32 | K362: 7 | L362: 11 | M362: =K362*6+L362 -> 53 | O362: 9 | P362: 14 | Q362: =O362*6+P362 -> 68 | S362: LEHENY | W362: GEELONG ASSOC. | X362: 1 | Y362: 9 | Z362: 0 | AA362: 545 | AB362: 864 | AC362: 63.078703703703702 | AD362: 4
A363: BEST PLAYERS
A364: BRIGHTON | D364: RATTRAY | G364: RINGROSE | J364: MITCHELL | M364: GRIFFITHS | P364: BORLAND | S364: BOYD
A365: COBURG | D365: FORD | G365: DICKENS | J365: JENKINS | M365: BACQUIE | P365: WEATHERALL | S365: HUNTINGTON
A366: GOALKICKERS
A367: BRIGHTON | D367: BOYD 5 | G367: RINGROSE 3 | K367: MITCHELL | N367: THRELFALL
A368: COBURG | D368: MEARS 3 | G368: BEESON 2 | J368: ALEXANDER | M368: REES | O368: WEATHERALL | R368: HUNTINGTON
A370: PORT MELBOURNE | C370: 1 | D370: 7 | E370: =C370*6+D370 -> 13 | G370: 3 | H370: 10 | I370: =G370*6+H370 -> 28 | K370: 7 | L370: 14 | M370: =K370*6+L370 -> 56 | O370: 10 | P370: 17 | Q370: =O370*6+P370 -> 77 | S370: PORT MELBOURNE
A371: WILLIAMSTOWN | C371: 0 | D371: 3 | E371: =C371*6+D371 -> 3 | G371: 2 | H371: 7 | I371: =G371*6+H371 -> 19 | K371: 3 | L371: 8 | M371: =K371*6+L371 -> 26 | O371: 8 | P371: 9 | Q371: =O371*6+P371 -> 57 | S371: BLACKBURN
A372: BEST PLAYERS
A373: PORT MELBOURNE | D373: BARFOOT | G373: RUSSELL | J373: REES | M373: MORRIS | P373: SKILTON | S373: J STYLES
A374: WILLIAMSTOWN | D374: JOHNS | G374: PUNSHON | J374: FERGUSON | M374: MUNRO | P374: ROUTLEY | S374: TRUMAN
A375: GOALKICKERS
A376: PORT MELBOURNE | D376: MORRIS 4 | G376: SKILTON 3 | J376: J STYLES 2 | M376: BARFOOT
A377: WILLIAMSTOWN | D377: McGUINNESS 3 | G377: WILKINS | I377: SMITH | K377: WHITBURN | N377: TRUMAN | P377: PUNSHON
A379: PRAHRAN | C379: 4 | D379: 6 | E379: =C379*6+D379 -> 30 | G379: 6 | H379: 9 | I379: =G379*6+H379 -> 45 | K379: 8 | L379: 14 | M379: =K379*6+L379 -> 62 | O379: 12 | P379: 18 | Q379: =O379*6+P379 -> 90 | S379: KARDINIA PARK
A380: GEELONG ASSOC. | C380: 3 | D380: 4 | E380: =C380*6+D380 -> 22 | G380: 6 | H380: 6 | I380: =G380*6+H380 -> 42 | K380: 9 | L380: 8 | M380: =K380*6+L380 -> 62 | O380: 11 | P380: 11 | Q380: =O380*6+P380 -> 77 | S380: PETERS
A381: BEST PLAYERS
A382: PRAHRAN | D382: A MILLER | G382: NAYLOR | J382: V JONES | M382: McLEOD | P382: WARD | S382: SNELL
A383: GEELONG ASSOC. | D383: ELSTON | G383: W DIGBY | J383: HEWITSON | M383: WRIGHT | P383: NOONAN | S383: POWELL
A384: GOALKICKERS
A385: PRAHRAN | D385: SULLIVAN 4 | G385: THORPE 3 | J385: SNELL | L385: A MILLER | O385: NAYLOR | Q385: V JONES | S385: RENNOLDS
A386: GEELONG ASSOC. | D386: NOONAN 3 | F386: ELSTON 2 | I386: HEWITSON 2 | L386: A COLEMAN | O386: P DIGBY | Q386: MELLAHN | T386: W DIGBY
A388: ROUND 11 | E388: 11TH JULY | H388: WEATHER | K388: COLD RAIN STRONG EAST WIND GROUNDS BAD | S388: PLAYED AT | X388: LADDER | AB388: ROUND | AD388: 11
D389: 1ST QTR | H389: 2ND QTR | L389: 3RD QTR | P389: FINAL | S389: PORT MELBOURNE
A390: NORTHCOTE | C390: 2 | D390: 2 | E390: =C390*6+D390 -> 14 | G390: 3 | H390: 6 | I390: =G390*6+H390 -> 24 | K390: 5 | L390: 10 | M390: =K390*6+L390 -> 40 | O390: 8 | P390: 14 | Q390: =O390*6+P390 -> 62 | S390: UMPIRE | W390: TEAM | X390: W | Y390: L | Z390: D | AA390: FOR | AB390: AGST | AC390: % | AD390: PTS
A391: PORT MELBOURNE | C391: 1 | D391: 1 | E391: =C391*6+D391 -> 7 | G391: 4 | H391: 7 | I391: =G391*6+H391 -> 31 | K391: 4 | L391: 9 | M391: =K391*6+L391 -> 33 | O391: 5 | P391: 13 | Q391: =O391*6+P391 -> 43 | S391: PETERS
A392: BEST PLAYERS | W392: BRUNSWICK | X392: 9 | Y392: 2 | Z392: 0 | AA392: 892 | AB392: 559 | AC392: 159.57066189624328 | AD392: 36
A393: NORTHCOTE | D393: JOHNSON | G393: DOWNES | I393: LONG | L393: THEPBOLD | O393: DIMMICK | Q393: BAGGOTT | W393: NORTHCOTE | X393: 9 | Y393: 2 | Z393: 0 | AA393: 825 | AB393: 698 | AC393: 118.19484240687679 | AD393: 36
A394: PORT MELBOURNE | D394: WATERHOUSE | G394: G STYLES | I394: BARFOOT | L394: CROMPTON | O394: RUSSELL | Q394: MORRIS | W394: COBURG | X394: 7 | Y394: 4 | Z394: 0 | AA394: 799 | AB394: 727 | AC394: 109.90371389270976 | AD394: 28
A395: GOALKICKERS | W395: PORT MELBOURNE | X395: 6 | Y395: 5 | Z395: 0 | AA395: 764 | AB395: 679 | AC395: 112.51840942562592 | AD395: 24
A396: NORTHCOTE | D396: THEOBOLD 2 | G396: JOHNSON 2 | J396: BAGGOTT 2 | M396: GOUGH | O396: GOODRICH
A397: PORT MELBOURNE | D397: RUSSELL 2 | G397: W RUDD | J397: MORRIS | M397: M JOHNSON | W397: BRIGHTON | X397: 6 | Y397: 5 | Z397: 0 | AA397: 739 | AB397: 682 | AC397: 108.35777126099707 | AD397: 24
W398: WILLIAMSTOWN | X398: 4 | Y398: 7 | Z398: 0 | AA398: 602 | AB398: 749 | AC398: 80.373831775700936 | AD398: 16
A399: COBURG | C399: 3 | D399: 2 | E399: =C399*6+D399 -> 20 | G399: 3 | H399: 5 | I399: =G399*6+H399 -> 23 | K399: 7 | L399: 8 | M399: =K399*6+L399 -> 50 | O399: 11 | P399: 9 | Q399: =O399*6+P399 -> 75 | S399: BRUNSWICK | W399: PRAHRAN | X399: 2 | Y399: 9 | Z399: 0 | AA399: 678 | AB399: 841 | AC399: 80.618311533888232 | AD399: 8
A400: BRUNSWICK | C400: 4 | D400: 4 | E400: =C400*6+D400 -> 28 | G400: 6 | H400: 5 | I400: =G400*6+H400 -> 41 | K400: 7 | L400: 6 | M400: =K400*6+L400 -> 48 | O400: 9 | P400: 10 | Q400: =O400*6+P400 -> 64 | S400: MACHAR | W400: GEELONG ASSOC. | X400: 1 | Y400: 10 | Z400: 0 | AA400: 556 | AB400: 920 | AC400: 60.434782608695649 | AD400: 4
A401: BEST PLAYERS
A402: COBURG | D402: C MARTYN | G402: MEARS | J402: FORD | M402: MILNE | P402: WEATHERALL | S402: SEXTON
A403: BRUNSWICK | D403: HISKENS | G403: FITZGERALD | J403: KEDDIE | M403: McINERNEY | P403: McMAHON | S403: BOLS
A404: GOALKICKERS
A405: COBURG | D405: MEARS 3 | G405: BEESON 3 | J405: KERLEY 2 | M405: GRAF | O405: WEATHERALL | R405: TURNER
A406: BRUNSWICK | D406: McINERNEY 5 | G406: BLACKMAN 2 | K406: McCORMACK | N406: FITZGERALD
A408: BRIGHTON | C408: 3 | D408: 4 | E408: =C408*6+D408 -> 22 | G408: 4 | H408: 4 | I408: =G408*6+H408 -> 28 | K408: 10 | L408: 11 | M408: =K408*6+L408 -> 71 | O408: 11 | P408: 13 | Q408: =O408*6+P408 -> 79 | S408: BRIGHTON BEACH
A409: PRAHRAN | C409: 1 | D409: 0 | E409: =C409*6+D409 -> 6 | G409: 3 | H409: 3 | I409: =G409*6+H409 -> 21 | K409: 3 | L409: 4 | M409: =K409*6+L409 -> 22 | O409: 7 | P409: 11 | Q409: =O409*6+P409 -> 53 | S409: BLACKBURN
A410: BEST PLAYERS
A411: BRIGHTON | D411: LILBURNE | G411: RINGROSE | J411: CARROLL | M411: RATTRAY | P411: EASON | S411: BORLAND
A412: PRAHRAN | D412: RENNOLDS | G412: OSBORNE | J412: ROWE | M412: C MILLER | P412: E JONES | S412: LYONS
A413: GOALKICKERS
A414: BRIGHTON | D414: RINGROSE 4 | H414: BOYD 3 | K414: DAYKIN 2 | N414: RATTRAY | Q414: LILBURNE
A415: PRAHRAN | D415: SULLIVAN | G415: SNELL | I415: NAYLOR | K415: REEVES | M415: V JONES | O415: LYONS | Q415: ROWE
A417: WILLIAMSTOWN | C417: 0 | D417: 3 | E417: =C417*6+D417 -> 3 | G417: 2 | H417: 4 | I417: =G417*6+H417 -> 16 | K417: 3 | L417: 6 | M417: =K417*6+L417 -> 24 | O417: 7 | P417: 14 | Q417: =O417*6+P417 -> 56 | S417: WILLIAMSTOWN
A418: GEELONG ASSOC. | C418: 0 | D418: 2 | E418: =C418*6+D418 -> 2 | G418: 0 | H418: 3 | I418: =G418*6+H418 -> 3 | K418: 0 | L418: 5 | M418: =K418*6+L418 -> 5 | O418: 1 | P418: 5 | Q418: =O418*6+P418 -> 11 | S418: LEHENY
A419: BEST PLAYERS
A420: WILLIAMSTOWN | D420: WHITBURN | G420: MUNRO | J420: KING | M420: ROBERTS | P420: CALLESON | S420: TORY
A421: GEELONG ASSOC. | D421: POWELL | G421: W DIGBY | J421: ELSTON | M421: PRIDDLE | P421: DUNCAN | S421: PACKHAM
A422: GOALKICKERS
A423: WILLIAMSTOWN | D423: TORY 3 | G423: PUNSHON | J423: DAVIDSON | M423: McKELLIN | P423: ROBERTS
A424: GEELONG ASSOC. | D424: NOONAN
A426: ROUND 12 | E426: 18TH JULY | H426: WEATHER | K426: CLOUDY SHOWERS SOUTH BREEZE | S426: PLAYED AT | X426: LADDER | AB426: ROUND | AD426: 12
D427: 1ST QTR | H427: 2ND QTR | L427: 3RD QTR | P427: FINAL | S427: PORT MELBOURNE
A428: PORT MELBOURNE | C428: 2 | D428: 9 | E428: =C428*6+D428 -> 21 | G428: 9 | H428: 13 | I428: =G428*6+H428 -> 67 | K428: 11 | L428: 18 | M428: =K428*6+L428 -> 84 | O428: 13 | P428: 25 | Q428: =O428*6+P428 -> 103 | S428: UMPIRE | W428: TEAM | X428: W | Y428: L | Z428: D | AA428: FOR | AB428: AGST | AC428: % | AD428: PTS
A429: BRIGHTON | C429: 1 | D429: 1 | E429: =C429*6+D429 -> 7 | G429: 3 | H429: 4 | I429: =G429*6+H429 -> 22 | K429: 6 | L429: 6 | M429: =K429*6+L429 -> 42 | O429: 8 | P429: 8 | Q429: =O429*6+P429 -> 56 | S429: LEHENY
A430: BEST PLAYERS | W430: BRUNSWICK | X430: 10 | Y430: 2 | Z430: 0 | AA430: 998 | AB430: 603 | AC430: 165.50580431177445 | AD430: 40
A431: PORT MELBOURNE | D431: BARFOOT | G431: W RUDD | J431: LEWIS | M431: MORRIS | O431: SKILTON | Q431: HARVEY | W431: NORTHCOTE | X431: 10 | Y431: 2 | Z431: 0 | AA431: 881 | AB431: 748 | AC431: 117.7807486631016 | AD431: 40
A432: BRIGHTON | D432: LILBURNE | G432: MITCHELL | J432: RINGROSE | M432: GRIFFITHS | O432: DORE | Q432: BOYD | W432: COBURG | X432: 8 | Y432: 4 | Z432: 0 | AA432: 877 | AB432: 744 | AC432: 117.8763440860215 | AD432: 32
A433: GOALKICKERS | W433: PORT MELBOURNE | X433: 7 | Y433: 5 | Z433: 0 | AA433: 867 | AB433: 735 | AC433: 117.95918367346938 | AD433: 28
A434: PORT MELBOURNE | D434: MORRIS 6 | G434: BARFOOT 3 | J434: W RUDD | L434: H RUSSELL | N434: CAMPBELL | Q434: McMEEKIN
A435: BRIGHTON | D435: BOYD 3 | G435: LILBURNE 2 | J435: RINGROSE | L435: RATTRAY | N435: GRIFFITHS | W435: BRIGHTON | X435: 6 | Y435: 6 | Z435: 0 | AA435: 795 | AB435: 785 | AC435: 101.27388535031847 | AD435: 24
W436: WILLIAMSTOWN | X436: 4 | Y436: 8 | Z436: 0 | AA436: 619 | AB436: 827 | AC436: 74.84885126964933 | AD436: 16
A437: COBURG | C437: 2 | D437: 3 | E437: =C437*6+D437 -> 15 | G437: 5 | H437: 8 | I437: =G437*6+H437 -> 38 | K437: 6 | L437: 10 | M437: =K437*6+L437 -> 46 | O437: 11 | P437: 12 | Q437: =O437*6+P437 -> 78 | S437: COBURG | W437: PRAHRAN | X437: 2 | Y437: 10 | Z437: 0 | AA437: 722 | AB437: 947 | AC437: 76.24076029567054 | AD437: 8
A438: WILLIAMSTOWN | C438: 1 | D438: 2 | E438: =C438*6+D438 -> 8 | G438: 1 | H438: 4 | I438: =G438*6+H438 -> 10 | K438: 2 | L438: 5 | M438: =K438*6+L438 -> 17 | O438: 2 | P438: 5 | Q438: =O438*6+P438 -> 17 | S438: MACHAR | W438: GEELONG ASSOC. | X438: 1 | Y438: 11 | Z438: 0 | AA438: 606 | AB438: 976 | AC438: 62.090163934426229 | AD438: 4
A439: BEST PLAYERS
A440: COBURG | D440: FAUST | G440: BEESON | J440: JENKINS | M440: SEXTON | P440: FORD | S440: MEARS
A441: WILLIAMSTOWN | D441: WHITBURN | G441: GEISLER | J441: SMITH | M441: BEER | P441: CALLESON | S441: WARREN
A442: GOALKICKERS
A443: COBURG | D443: BEESON 6 | G443: GRAF 3 | J443: KERLEY | M443: SMITH
A444: WILLIAMSTOWN | D444: FERGUSON | G444: McGUINNESS
A446: NORTHCOTE | C446: 2 | D446: 2 | E446: =C446*6+D446 -> 14 | G446: 4 | H446: 5 | I446: =G446*6+H446 -> 29 | K446: 7 | L446: 6 | M446: =K446*6+L446 -> 48 | O446: 8 | P446: 8 | Q446: =O446*6+P446 -> 56 | S446: KARDINIA PARK
A447: GEELONG ASSOC. | C447: 4 | D447: 1 | E447: =C447*6+D447 -> 25 | G447: 6 | H447: 1 | I447: =G447*6+H447 -> 37 | K447: 6 | L447: 5 | M447: =K447*6+L447 -> 41 | O447: 7 | P447: 8 | Q447: =O447*6+P447 -> 50 | S447: BLACKBURN
A448: BEST PLAYERS
A449: NORTHCOTE | D449: DOWNES | G449: BAGGOTT | J449: SHEEHY | M449: DOBRIGH | P449: WHITE | S449: AHERN
A450: GEELONG ASSOC. | D450: PRIDDLE | G450: W DIGBY | J450: SHARPE | M450: ELSTON | P450: McFARLANE | S450: HEWITSON
A451: GOALKICKERS
A452: NORTHCOTE | D452: BAGGOTT 2 | G452: AHERN 2 | J452: DOBRIGH | M452: GOODRICH | P452: GOUGH | R452: THEOBOLD
A453: GEELONG ASSOC. | D453: ELSTON 2 | G453: SHARPE 2 | J453: W DIGBY | M453: A COLEMAN
A455: BRUNSWICK | C455: 3 | D455: 2 | E455: =C455*6+D455 -> 20 | G455: 9 | H455: 11 | I455: =G455*6+H455 -> 65 | K455: 11 | L455: 14 | M455: =K455*6+L455 -> 80 | O455: 14 | P455: 22 | Q455: =O455*6+P455 -> 106 | S455: TOORAK PARK
A456: PRAHRAN | C456: 2 | D456: 8 | E456: =C456*6+D456 -> 20 | G456: 2 | H456: 8 | I456: =G456*6+H456 -> 20 | K456: 4 | L456: 13 | M456: =K456*6+L456 -> 37 | O456: 5 | P456: 14 | Q456: =O456*6+P456 -> 44 | S456: PETERS
A457: BEST PLAYERS
A458: BRUNSWICK | D458: McINERNEY | G458: HASSETT | J458: BOLS | M458: McLATCHIE | P458: RAYMOND | S458: HARRIS
A459: PRAHRAN | D459: REA | G459: ROWE | J459: NAYLOR | M459: RENNOLDS | P459: V JONES | S459: OSBORNE
A460: GOALKICKERS
A461: BRUNSWICK | D461: McINERNEY 8 | G461: O'CONNOR 3 | J461: McLATCHIE 2 | M461: ALESSIO
A462: PRAHRAN | D462: THORPE 2 | G462: A MILLER 2 | K462: SHARP
A464: ROUND 13 | E464: 25TH JULY | J464: WEATHER | M464: FINE GROUNDS SOFT | S464: PLAYED AT | X464: LADDER | AB464: ROUND | AD464: 13
D465: 1ST QTR | H465: 2ND QTR | L465: 3RD QTR | P465: FINAL | S465: BRUNSWICK
A466: BRUNSWICK | C466: 3 | D466: 2 | E466: =C466*6+D466 -> 20 | G466: 5 | H466: 9 | I466: =G466*6+H466 -> 39 | K466: 7 | L466: 13 | M466: =K466*6+L466 -> 55 | O466: 8 | P466: 16 | Q466: =O466*6+P466 -> 64 | S466: UMPIRE | W466: TEAM | X466: W | Y466: L | Z466: D | AA466: FOR | AB466: AGST | AC466: % | AD466: PTS
A467: PORT MELBOURNE | C467: 3 | D467: 4 | E467: =C467*6+D467 -> 22 | G467: 5 | H467: 7 | I467: =G467*6+H467 -> 37 | K467: 5 | L467: 10 | M467: =K467*6+L467 -> 40 | O467: 6 | P467: 11 | Q467: =O467*6+P467 -> 47 | S467: BLACKBURN
A468: BEST PLAYERS | W468: BRUNSWICK | X468: 11 | Y468: 2 | Z468: 0 | AA468: 1062 | AB468: 650 | AC468: 163.38461538461539 | AD468: 44
A469: BRUNSWICK | D469: McINERNEY | G469: FITZGERALD | J469: GREEN | M469: HASSETT | O469: ALESSIO | Q469: HARRIS | W469: NORTHCOTE | X469: 11 | Y469: 2 | Z469: 0 | AA469: 937 | AB469: 792 | AC469: 118.3080808080808 | AD469: 44
A470: PORT MELBOURNE | D470: BARFOOT | G470: LEWIS | J470: HARVEY | M470: REES | O470: W RUDD | Q470: FROUD | W470: COBURG | X470: 9 | Y470: 4 | Z470: 0 | AA470: 982 | AB470: 779 | AC470: 126.05905006418486 | AD470: 36
A471: GOALKICKERS | W471: PORT MELBOURNE | X471: 7 | Y471: 6 | Z471: 0 | AA471: 914 | AB471: 799 | AC471: 114.39299123904881 | AD471: 28
A472: BRUNSWICK | D472: McINERNEY 5 | H472: FITZGERALD 2 | L472: McLATCHIE
A473: PORT MELBOURNE | D473: MORRIS 2 | G473: McMEEKIN 2 | J473: J STYLES | M473: H RUSSELL | W473: BRIGHTON | X473: 7 | Y473: 6 | Z473: 0 | AA473: 877 | AB473: 814 | AC473: 107.73955773955774 | AD473: 28
W474: WILLIAMSTOWN | X474: 4 | Y474: 9 | Z474: 0 | AA474: 663 | AB474: 883 | AC474: 75.084937712344285 | AD474: 16
A475: NORTHCOTE | C475: 3 | D475: 2 | E475: =C475*6+D475 -> 20 | G475: 6 | H475: 3 | I475: =G475*6+H475 -> 39 | K475: 7 | L475: 4 | M475: =K475*6+L475 -> 46 | O475: 8 | P475: 8 | Q475: =O475*6+P475 -> 56 | S475: WILLIAMSTOWN | W475: PRAHRAN | X475: 2 | Y475: 11 | Z475: 0 | AA475: 757 | AB475: 1052 | AC475: 71.958174904942965 | AD475: 8
A476: WILLIAMSTOWN | C476: 3 | D476: 2 | E476: =C476*6+D476 -> 20 | G476: 4 | H476: 5 | I476: =G476*6+H476 -> 29 | K476: 5 | L476: 8 | M476: =K476*6+L476 -> 38 | O476: 6 | P476: 8 | Q476: =O476*6+P476 -> 44 | S476: MACHAR | W476: GEELONG ASSOC. | X476: 1 | Y476: 12 | Z476: 0 | AA476: 635 | AB476: 1058 | AC476: 60.018903591682417 | AD476: 4
A477: BEST PLAYERS
A478: NORTHCOTE | D478: SHEEHY | G478: JOHNSON | J478: DOWNES | M478: DIMMICK | O478: HARLEY | R478: AHERN
A479: WILLIAMSTOWN | D479: MUNRO | G479: SMITH | J479: TORY | M479: GEISLER | O479: WHITBURN | R479: ROUTLEY
A480: GOALKICKERS
A481: NORTHCOTE | D481: JOHNSON 2 | G481: AHERN 2 | J481: GOUGH 2 | M481: DOWNES | P481: GOODRICH
A482: WILLIAMSTOWN | D482: ROUTLEY 2 | G482: SMITH 2 | J482: BEER | L482: ROBERTS
A484: COBURG | C484: 7 | D484: 5 | E484: =C484*6+D484 -> 47 | G484: 8 | H484: 8 | I484: =G484*6+H484 -> 56 | K484: 14 | L484: 15 | M484: =K484*6+L484 -> 99 | O484: 15 | P484: 15 | Q484: =O484*6+P484 -> 105 | S484: TOORAK PARK
A485: PRAHRAN | C485: 1 | D485: 0 | E485: =C485*6+D485 -> 6 | G485: 2 | H485: 3 | I485: =G485*6+H485 -> 15 | K485: 2 | L485: 3 | M485: =K485*6+L485 -> 15 | O485: 4 | P485: 11 | Q485: =O485*6+P485 -> 35 | S485: PATTISON
A486: BEST PLAYERS
A487: COBURG | D487: GRAF | G487: HUNTINGTON | K487: MEARS | M487: KERLEY | P487: JENKINS | R487: GARDINER
A488: PRAHRAN | D488: RENNOLDS | G488: OSBORNE | K488: WARD | M488: RAE | P488: WOODS | R488: V JONES
A489: GOALKICKERS
A490: COBURG | D490: GRAF 7 | G490: BEESON 2 | J490: MEARS 2 | M490: KERLEY | O490: REES | Q490: JENKINS | S490: HUNTINGTON
A491: PRAHRAN | D491: V JONES | G491: REA | J491: RENNOLDS | M491: DOOLAN
A493: BRIGHTON | C493: 1 | D493: 3 | E493: =C493*6+D493 -> 9 | G493: 4 | H493: 9 | I493: =G493*6+H493 -> 33 | K493: 8 | L493: 11 | M493: =K493*6+L493 -> 59 | O493: 11 | P493: 16 | Q493: =O493*6+P493 -> 82 | S493: BRIGHTON BEACH
A494: GEELONG ASSOC. | C494: 1 | D494: 2 | E494: =C494*6+D494 -> 8 | G494: 2 | H494: 2 | I494: =G494*6+H494 -> 14 | K494: 2 | L494: 3 | M494: =K494*6+L494 -> 15 | O494: 4 | P494: 5 | Q494: =O494*6+P494 -> 29 | S494: LEHENY
A495: BEST PLAYERS
A496: BRIGHTON | D496: RATTRAY | G496: GARCIA | J496: BOYD | M496: THRELFALL | P496: RINGROSE | R496: BORLAND
A497: GEELONG ASSOC. | D497: POWELL | G497: CATIONS | J497: J NOONAN | M497: W DIGBY | P497: FARR | R497: HEWITSON
A498: GOALKICKERS
A499: BRIGHTON | D499: BOYD 4 | F499: MITCHELL | I499: RATTRAY | K499: RINGROSE | M499: ATKINSON | P499: LILBURNE | S499: TANION
A500: GEELONG ASSOC. | D500: W DIGBY 2 | G500: NEILSON | J500: HEWITSON
A502: ROUND 14 | E502: 1ST AUGUST | J502: WEATHER | M502: FINE GROUNDS FAIR | S502: PLAYED AT | X502: LADDER | AB502: ROUND | AD502: 14
D503: 1ST QTR | H503: 2ND QTR | L503: 3RD QTR | P503: FINAL | S503: NORTHCOTE
A504: COBURG | C504: 0 | D504: 6 | E504: =C504*6+D504 -> 6 | G504: 3 | H504: 8 | I504: =G504*6+H504 -> 26 | K504: 8 | L504: 11 | M504: =K504*6+L504 -> 59 | O504: 11 | P504: 13 | Q504: =O504*6+P504 -> 79 | S504: UMPIRE | W504: TEAM | X504: W | Y504: L | Z504: D | AA504: FOR | AB504: AGST | AC504: % | AD504: PTS
A505: NORTHCOTE | C505: 1 | D505: 1 | E505: =C505*6+D505 -> 7 | G505: 5 | H505: 10 | I505: =G505*6+H505 -> 40 | K505: 7 | L505: 11 | M505: =K505*6+L505 -> 53 | O505: 9 | P505: 17 | Q505: =O505*6+P505 -> 71 | S505: MACHAR
A506: BEST PLAYERS | W506: BRUNSWICK | X506: 12 | Y506: 2 | Z506: 0 | AA506: 1138 | AB506: 703 | AC506: 161.87766714082503 | AD506: 48
A507: COBURG | D507: FAUST | G507: GARDINER | J507: JENKINS | M507: MEARS | O507: QUARRY | Q507: GRAF | W507: NORTHCOTE | X507: 11 | Y507: 3 | Z507: 0 | AA507: 1008 | AB507: 871 | AC507: 115.72904707233066 | AD507: 44
A508: NORTHCOTE | D508: WOODS | G508: JOHNSON | J508: DOWNES | M508: BAGGOTT | O508: SHEEHY | Q508: DOBRIGH | W508: COBURG | X508: 10 | Y508: 4 | Z508: 0 | AA508: 1061 | AB508: 850 | AC508: 124.82352941176471 | AD508: 40
A509: GOALKICKERS | W509: PORT MELBOURNE | X509: 8 | Y509: 6 | Z509: 0 | AA509: 1017 | AB509: 855 | AC509: 118.94736842105263 | AD509: 32
A510: COBURG | D510: WEATHERALL 3 | G510: GRAF 3 | I510: KERLEY 2 | K510: E MARTIN | M510: MEARS | O510: ALEXANDER
A511: NORTHCOTE | D511: WHITE 2 | F511: GOUGH 2 | H511: SHEEHY | J511: THEOBOLD | M511: PERKINS | O511: DIMMICK | Q511: DOWNES | W511: BRIGHTON | X511: 7 | Y511: 7 | Z511: 0 | AA511: 930 | AB511: 890 | AC511: 104.49438202247191 | AD511: 28
W512: WILLIAMSTOWN | X512: 4 | Y512: 10 | Z512: 0 | AA512: 702 | AB512: 929 | AC512: 75.565123789020447 | AD512: 16
A513: BRUNSWICK | C513: 4 | D513: 3 | E513: =C513*6+D513 -> 27 | G513: 8 | H513: 6 | I513: =G513*6+H513 -> 54 | K513: 9 | L513: 7 | M513: =K513*6+L513 -> 61 | O513: 11 | P513: 10 | Q513: =O513*6+P513 -> 76 | S513: BRUNSWICK | W513: PRAHRAN | X513: 3 | Y513: 11 | Z513: 0 | AA513: 803 | AB513: 1091 | AC513: 73.602199816681946 | AD513: 12
A514: BRIGHTON | C514: 2 | D514: 2 | E514: =C514*6+D514 -> 14 | G514: 3 | H514: 4 | I514: =G514*6+H514 -> 22 | K514: 6 | L514: 9 | M514: =K514*6+L514 -> 45 | O514: 7 | P514: 11 | Q514: =O514*6+P514 -> 53 | S514: PATTISON | W514: GEELONG ASSOC. | X514: 1 | Y514: 13 | Z514: 0 | AA514: 691 | AB514: 1161 | AC514: 59.517657192075795 | AD514: 4
A515: BEST PLAYERS
A516: BRUNSWICK | D516: HISKENS | G516: RAYMOND | J516: McINERNEY | M516: BOLS | P516: McLATCHIE | S516: ALESSIO
A517: BRIGHTON | D517: RINGROSE | G517: GARCIA | J517: KOLLE | M517: GRIFFITHS | P517: RATTRAY | S517: THRELFALL
A518: GOALKICKERS
A519: BRUNSWICK | D519: McINERNEY 4 | H519: RAYMOND 3 | K519: BOLS | M519: EWINS | O519: ALESSIO | R519: McLATCHIE
A520: BRIGHTON | D520: BOYD 2 | G520: GRIFFITHS 2 | K520: MITCHELL | N520: JONES | P520: LILBURNE
A522: PRAHRAN | C522: 2 | D522: 6 | E522: =C522*6+D522 -> 18 | G522: 5 | H522: 8 | I522: =G522*6+H522 -> 38 | K522: 5 | L522: 8 | M522: =K522*6+L522 -> 38 | O522: 6 | P522: 10 | Q522: =O522*6+P522 -> 46 | S522: TOORAK PARK
A523: WILLIAMSTOWN | C523: 2 | D523: 3 | E523: =C523*6+D523 -> 15 | G523: 2 | H523: 7 | I523: =G523*6+H523 -> 19 | K523: 4 | L523: 13 | M523: =K523*6+L523 -> 37 | O523: 4 | P523: 15 | Q523: =O523*6+P523 -> 39 | S523: LEHENY
A524: BEST PLAYERS
A525: PRAHRAN | D525: REA | G525: OSBORNE | J525: RENNOLDS | M525: A MILLER | P525: NAYLOR | S525: V JONES
A526: WILLIAMSTOWN | D526: JOHNS | G526: ROBERTS | J526: SMITH | M526: GEISLER | P526: TRUMAN | S526: FLANNERY
A527: GOALKICKERS
A528: PRAHRAN | D528: THORPE 2 | G528: A MILLER | J528: REA | L528: ARCHMAN | O528: V JONES
A529: WILLIAMSTOWN | D529: KING | G529: CALLESON | J529: ROUTLEY | M529: DAVIDSON
A531: PORT MELBOURNE | C531: 6 | D531: 2 | E531: =C531*6+D531 -> 38 | G531: 9 | H531: 6 | I531: =G531*6+H531 -> 60 | K531: 11 | L531: 9 | M531: =K531*6+L531 -> 75 | O531: 15 | P531: 13 | Q531: =O531*6+P531 -> 103 | S531: KARDINIA PARK
A532: GEELONG ASSOC. | C532: 1 | D532: 1 | E532: =C532*6+D532 -> 7 | G532: 5 | H532: 2 | I532: =G532*6+H532 -> 32 | K532: 6 | L532: 7 | M532: =K532*6+L532 -> 43 | O532: 8 | P532: 8 | Q532: =O532*6+P532 -> 56 | S532: BLACKBURN
A533: BEST PLAYERS
A534: PORT MELBOURNE | D534: MORRIS | G534: HARVEY | J534: W RUDD | M534: REES | O534: M JOHNSON | R534: BARFOOT
A535: GEELONG ASSOC. | D535: PRIDDLE | G535: W DIGBY | J535: McFARLANE | M535: ELSTON | O535: A COLEMAN | R535: CATIONS
A536: GOALKICKERS
A537: PORT MELBOURNE | D537: MORRIS 5 | F537: M JOHNSON 3 | I537: LAWSON 2 | L537: SKILTON 2 | N537: BARFOOT | P537: J STYLES | R537: WATERHOUSE
A538: GEELONG ASSOC. | D538: A COLEMAN 2 | G538: ELSTON | I538: FARR | K538: SPENDLOVE | N538: NOONAN | P538: McFARLANE | S538: HARRIS
A540: FINALS
A541: 1ST SEMI | E541: 8TH AUGUST | J541: WEATHER | M541: FINE AFTER FROST
D542: 1ST QTR | H542: 2ND QTR | L542: 3RD QTR | P542: FINAL
A543: PORT MELBOURNE | C543: 8 | D543: 4 | E543: =C543*6+D543 -> 52 | G543: 10 | H543: 7 | I543: =G543*6+H543 -> 67 | K543: 11 | L543: 10 | M543: =K543*6+L543 -> 76 | O543: 14 | P543: 12 | Q543: =O543*6+P543 -> 96 | S543: MOTORDROME
A544: NORTHCOTE | C544: 0 | D544: 2 | E544: =C544*6+D544 -> 2 | G544: 3 | H544: 7 | I544: =G544*6+H544 -> 25 | K544: 5 | L544: 11 | M544: =K544*6+L544 -> 41 | O544: 9 | P544: 12 | Q544: =O544*6+P544 -> 66 | S544: LEHENY
A545: BEST PLAYERS
A546: PORT MELBOURNE | D546: BARFOOT | G546: FROUD | J546: LAWSON | M546: G STYLES | P546: REES | R546: W RUDD
A547: NORTHCOTE | D547: WOODS | G547: BAGGOTT | J547: GOODRICH | M547: JOHNSON | P547: REID | R547: LONG
A548: GOALKICKERS
A549: PORT MELBOURNE | D549: LAWSON 5 | G549: SKILTON 3 | J549: McMEEKIN 2 | M549: MORRIS 2 | P549: BARFOOT | S549: REES
A550: NORTHCOTE | D550: GOODRICH 2 | G550: DOWNES 2 | J550: DOBRIGH | L550: JOHNSON | N550: BAGGOTT | P550: REID | R550: PERKINS
A552: 2ND SEMI | E552: 15TH AUGUST | J552: WEATHER | M552: FINE STRONG NORTH WIND
A553: BRUNSWICK | C553: 2 | D553: 1 | E553: =C553*6+D553 -> 13 | G553: 5 | H553: 9 | I553: =G553*6+H553 -> 39 | K553: 6 | L553: 10 | M553: =K553*6+L553 -> 46 | O553: 6 | P553: 18 | Q553: =O553*6+P553 -> 54 | S553: MOTORDROME
A554: COBURG | C554: 5 | D554: 6 | E554: =C554*6+D554 -> 36 | G554: 6 | H554: 7 | I554: =G554*6+H554 -> 43 | K554: 7 | L554: 9 | M554: =K554*6+L554 -> 51 | O554: 7 | P554: 9 | Q554: =O554*6+P554 -> 51 | S554: BLACKBURN
A555: BEST PLAYERS
A556: BRUNSWICK | D556: RAYMOND | G556: FITZGERALD | J556: HART | M556: GREEN | O556: HISKENS | R556: BLACKMAN
A557: COBURG | D557: MILNE | G557: FORD | J557: JENKINS | M557: SEXTON | O557: GARDINER | R557: GRAF
A558: GOALKICKERS
A559: BRUNSWICK | D559: EWINS | G559: BLACKMAN | J559: FITZGERALD | M559: RAYMOND | O559: HART | R559: McINERNEY
A560: COBURG | D560: MILNE 2 | G560: BEESON 2 | J560: KERLEY 2 | M560: GRAF
E562: MATCH POSTPONED 22ND AUGUST
A563: FINAL | E563: 29TH AUGUST | J563: WEATHER | M563: FINE NORTH WIND
A564: BRUNSWICK | C564: 1 | D564: 3 | E564: 9 | G564: 7 | H564: 5 | I564: 47 | K564: 8 | L564: 8 | M564: 56 | O564: 10 | P564: 9 | Q564: =O564*6+P564 -> 69 | S564: MOTORDROME
A565: PORT MELBOURNE | C565: 4 | D565: 1 | E565: 25 | G565: 5 | H565: 3 | I565: 33 | K565: 6 | L565: 7 | M565: 43 | O565: 7 | P565: 11 | Q565: =O565*6+P565 -> 53 | S565: LEHENY
A566: BEST PLAYERS
A567: BRUNSWICK | D567: FITZGERALD | G567: HASSETT | J567: ALESSIO | M567: McINERNEY | P567: BOLS | S567: O'CONNOR
A568: PORT MELBOURNE | D568: WATERHOUSE | G568: BARFOOT | J568: REES | M568: W RUDD | P568: M JOHNSON | S568: SKILTON
A569: GOALKICKERS
A570: BRUNSWICK | D570: HASSETT 4 | G570: McINERNEY 3 | K570: O'CONNOR | N570: FITZGERALD | Q570: McLATCHIE
A571: PORT MELBOURNE | D571: FROUD 2 | G571: LAWSON 2 | J571: REES 2 | M571: W RUDD
A574: TEAMS
G575: BRUNSWICK | S575: PORT MELBOURNE
A576: BACKS | D576: McMAHON | G576: ALESSIO | K576: GREEN | P576: MURPHY | S576: J STYLES | W576: REES
A577: H-BACKS | D577: HART | G577: HASSETT | K577: BOLS | P577: CROMPTON | S577: WATERHOUSE | W577: REDMOND
A578: CENTRES | D578: BRIGHT | G578: BLACKMAN | K578: KEDDIE | P578: G STYLES | S578: J RUSSELL | W578: HARVEY
A579: H-FORWARDS | D579: ANDERSON | G579: RAYMOND | K579: O'CONNOR | P579: FROUD | S579: M JOHNSON | W579: SKILTON
A580: FORWARDS | D580: RALEIGH | G580: McINERNEY | K580: McLATCHIE | P580: FORBES | S580: MORRIS | W580: LAWSON
A581: RUCK | D581: HISKINS | G581: EWANS | K581: FITZGERALD | P581: W RUDD | S581: CAMPBELL | W581: BARFOOT