A1: Victorian Football Association
A2: Season 1926
A3: © Copyright Wal Williams | F3: First created: 2 November 2014
A4: Contact: joywalwi at gmail dot com | F4: Last updated: 27 January 2018 | W4: VFA Results and tables - Link to the main index page
A5: You are free to copy this document in whole or part provided that proper acknowledgement is given to the author. All rights reserved.
A7: YEAR 1926
A8: ROUND 1 | E8: 1ST MAY | J8: WEATHER | M8: CLOUDY WEST WIND LATE RAIN | S8: PLAYED AT | X8: LADDER | AB8: ROUND | AD8: 1
D9: 1ST QTR | H9: 2ND QTR | L9: 3RD QTR | P9: FINAL | S9: WILLIAMSTOWN
A10: COBURG | C10: 1 | D10: 2 | E10: =C10*6+D10 -> 8 | G10: 7 | H10: 7 | I10: =G10*6+H10 -> 49 | K10: 7 | L10: 8 | M10: =K10*6+L10 -> 50 | O10: 10 | P10: 13 | Q10: =O10*6+P10 -> 73 | S10: UMPIRE | W10: TEAM | X10: W | Y10: L | Z10: D | AA10: FOR | AB10: AGST | AC10: % | AD10: PTS
A11: WILLIAMSTOWN | C11: 1 | D11: 6 | E11: =C11*6+D11 -> 12 | G11: 1 | H11: 7 | I11: =G11*6+H11 -> 13 | K11: 2 | L11: 18 | M11: =K11*6+L11 -> 30 | O11: 2 | P11: 22 | Q11: =O11*6+P11 -> 34 | S11: OLDFIELD
A12: BEST PLAYERS | W12: BRIGHTON | X12: 1 | Y12: 0 | Z12: 0 | AA12: 110 | AB12: 41 | AC12: 268.29268292682929 | AD12: 4
A13: COBURG | D13: MEARS | F13: CHAPMAN | I13: SPEAKMAN | L13: GARDINER | O13: MILNE | Q13: GRAF | W13: COBURG | X13: 1 | Y13: 0 | Z13: 0 | AA13: 73 | AB13: 34 | AC13: 214.70588235294119 | AD13: 4
A14: WILLIAMSTOWN | D14: MARTIN | F14: WARREN | I14: RIGALDI | L14: TORY | O14: McKELLIN | Q14: JOYCE | W14: NORTHCOTE | X14: 1 | Y14: 0 | Z14: 0 | AA14: 58 | AB14: 30 | AC14: 193.33333333333334 | AD14: 4
A15: GOALKICKERS | W15: PORT MELBOURNE | X15: 1 | Y15: 0 | Z15: 0 | AA15: 75 | AB15: 39 | AC15: 192.30769230769232 | AD15: 4
A16: COBURG | D16: GARDINER 4 | G16: SPEAKMAN 3 | K16: GRAF | M16: COX | O16: KERLEY
A17: WILLIAMSTOWN | D17: RIGALDI | G17: MARTIN | W17: PRESTON | X17: 1 | Y17: 0 | Z17: 0 | AA17: 77 | AB17: 48 | AC17: 160.41666666666666 | AD17: 4
W18: GEELONG ASSOC. | X18: 0 | Y18: 1 | Z18: 0 | AA18: 48 | AB18: 77 | AC18: 62.337662337662337 | AD18: 0
A19: BRIGHTON | C19: 4 | D19: 6 | E19: =C19*6+D19 -> 30 | G19: 5 | H19: 8 | I19: =G19*6+H19 -> 38 | K19: 8 | L19: 9 | M19: =K19*6+L19 -> 57 | O19: 16 | P19: 14 | Q19: =O19*6+P19 -> 110 | S19: CAMBERWELL | W19: PRAHRAN | X19: 0 | Y19: 1 | Z19: 0 | AA19: 39 | AB19: 75 | AC19: 52 | AD19: 0
A20: CAMBERWELL | C20: 1 | D20: 2 | E20: =C20*6+D20 -> 8 | G20: 4 | H20: 7 | I20: =G20*6+H20 -> 31 | K20: 5 | L20: 10 | M20: =K20*6+L20 -> 40 | O20: 5 | P20: 11 | Q20: =O20*6+P20 -> 41 | S20: THOMAS | W20: BRUNSWICK | X20: 0 | Y20: 1 | Z20: 0 | AA20: 30 | AB20: 58 | AC20: 51.724137931034484 | AD20: 0
A21: BEST PLAYERS | W21: WILLIAMSTOWN | X21: 0 | Y21: 1 | Z21: 0 | AA21: 34 | AB21: 73 | AC21: 46.575342465753423 | AD21: 0
A22: BRIGHTON | D22: WALSH | G22: HUNT | J22: CARROLL | M22: BORLAND | O22: ATKINSON | R22: BESWICK | W22: CAMBERWELL | X22: 0 | Y22: 1 | Z22: 0 | AA22: 41 | AB22: 110 | AC22: 37.272727272727273 | AD22: 0
A23: CAMBERWELL | D23: WOODFORD | G23: GREENBURY | J23: TRESIZE | M23: YOLE | O23: WHITECROSS | R23: McLENNAN
A24: GOALKICKERS
A25: BRIGHTON | D25: WALSH 6 | F25: MITCHELL 2 | I25: WOOD | K25: CARROLL | M25: RATTRAY | O25: BORLAND | Q25: HUNT | R25: FAGIN | T25: MAINE | V25: ATKINSON
A26: CAMBERWELL | D26: GREENBURY 2 | G26: ELLIMAN | I26: WHITECROSS | L26: WOODFORD
A28: PORT MELBOURNE | C28: 6 | D28: 1 | E28: =C28*6+D28 -> 37 | G28: 7 | H28: 5 | I28: =G28*6+H28 -> 47 | K28: 8 | L28: 6 | M28: =K28*6+L28 -> 54 | O28: 11 | P28: 9 | Q28: =O28*6+P28 -> 75 | S28: TOOORAK PARK
A29: PRAHRAN | C29: 3 | D29: 0 | E29: =C29*6+D29 -> 18 | G29: 3 | H29: 7 | I29: =G29*6+H29 -> 25 | K29: 4 | L29: 12 | M29: =K29*6+L29 -> 36 | O29: 4 | P29: 15 | Q29: =O29*6+P29 -> 39 | S29: MACHAR
A30: BEST PLAYERS
A31: PORT MELBOURNE | D31: H BOLMAN | G31: SKILTON | J31: SLOLEY | M31: CARPENTER | P31: FORBES | S31: W RUDD
A32: PRAHRAN | D32: NAYLOR | G32: OSBORNE | J32: V JONES | M32: REYNOLDS | P32: SPAIN | S32: PARKER
A33: GOALKICKERS
A34: PORT MELBOURNE | D34: SKILTON 3 | G34: SLOLEY 2 | J34: WALKER 2 | M34: SMITH 2 | O34: CARPENTER | R34: FORBES
A35: PRAHRAN | D35: V JONES | G35: ROWE | J35: HARLEY | M35: NAYLOR
A37: NORTHCOTE | C37: 1 | D37: 2 | E37: =C37*6+D37 -> 8 | G37: 4 | H37: 5 | I37: =G37*6+H37 -> 29 | K37: 4 | L37: 9 | M37: =K37*6+L37 -> 33 | O37: 7 | P37: 16 | Q37: =O37*6+P37 -> 58 | S37: NORTHCOTE
A38: BRUNSWICK | C38: 2 | D38: 2 | E38: =C38*6+D38 -> 14 | G38: 2 | H38: 2 | I38: =G38*6+H38 -> 14 | K38: 4 | L38: 4 | M38: =K38*6+L38 -> 28 | O38: 4 | P38: 6 | Q38: =O38*6+P38 -> 30 | S38: LOUGHLIN
A39: BEST PLAYERS
A40: NORTHCOTE | D40: SHEEHY | G40: LAFFEY | J40: DOLOFFSKY | M40: H SMITH | P40: WOODS | S40: DOWNES
A41: BRUNSWICK | D41: HARRIS | G41: BRIGHT | J41: KEDDIE | M41: KENNETT | P41: MITCHELL | S41: McMAHON
A42: GOALKICKERS
A43: NORTHCOTE | D43: DOWNES 2 | G43: SHEEHY 2 | J43: GOUGH 2 | M43: THEOBOLD
A44: BRUNSWICK | D44: McINERNEY 2 | G44: RAYMOND | J44: JOHNSON
A46: PRESTON | C46: 2 | D46: 4 | E46: =C46*6+D46 -> 16 | G46: 4 | H46: 6 | I46: =G46*6+H46 -> 30 | K46: 6 | L46: 11 | M46: =K46*6+L46 -> 47 | O46: 10 | P46: 17 | Q46: =O46*6+P46 -> 77 | S46: PRESTON
A47: GEELONG ASSOC. | C47: 1 | D47: 2 | E47: =C47*6+D47 -> 8 | G47: 3 | H47: 4 | I47: =G47*6+H47 -> 22 | K47: 4 | L47: 6 | M47: =K47*6+L47 -> 30 | O47: 7 | P47: 6 | Q47: =O47*6+P47 -> 48 | S47: HARRIS
A48: BEST PLAYERS
A49: PRESTON | D49: SUMMERS | G49: MARMO | J49: WHITE | M49: WATT | O49: WARR | R49: SURTEES
A50: GEELONG ASSOC. | D50: HARRIS | G50: ELSTON | J50: F McINERNEY | M50: FOX | O50: POWELL | R50: W DIGBY
A51: GOALKICKERS
A52: PRESTON | D52: STEVENS 2 | G52: TAYLOR 2 | J52: WARR 2 | L52: MUIR 2 | O52: TORODE | R52: DILLON
A53: GEELONG ASSOC. | D53: HARRIS 3 | G53: LEICHARDT | J53: ELSTON | L53: F McINERNEY | O53: FARR
A55: ROUND 2 | E55: 8TH MAY | J55: WEATHER | M55: DULL CLOUDY WEST WIND | S55: PLAYED AT | X55: LADDER | AB55: ROUND | AD55: 2
D56: 1ST QTR | H56: 2ND QTR | L56: 3RD QTR | P56: FINAL | S56: PORT MELBOURNE
A57: PORT MELBOURNE | C57: 1 | D57: 2 | E57: =C57*6+D57 -> 8 | G57: 5 | H57: 7 | I57: =G57*6+H57 -> 37 | K57: 9 | L57: 13 | M57: =K57*6+L57 -> 67 | O57: 13 | P57: 15 | Q57: =O57*6+P57 -> 93 | S57: UMPIRE | W57: TEAM | X57: W | Y57: L | Z57: D | AA57: FOR | AB57: AGST | AC57: % | AD57: PTS
A58: PRESTON | C58: 5 | D58: 2 | E58: =C58*6+D58 -> 32 | G58: 5 | H58: 2 | I58: =G58*6+H58 -> 32 | K58: 9 | L58: 3 | M58: =K58*6+L58 -> 57 | O58: 12 | P58: 6 | Q58: =O58*6+P58 -> 78 | S58: KENNY
A59: BEST PLAYERS | W59: COBURG | X59: 2 | Y59: 0 | Z59: 0 | AA59: 153 | AB59: 90 | AC59: 170 | AD59: 8
A60: PORT MELBOURNE | D60: H BOLMAN | G60: BARFOOT | J60: W RUDD | M60: WALKER | O60: CARPENTER | R60: FROUD | W60: NORTHCOTE | X60: 2 | Y60: 0 | Z60: 0 | AA60: 97 | AB60: 66 | AC60: 146.96969696969697 | AD60: 8
A61: PRESTON | D61: SURTEES | G61: A LUDLOW | J61: SUMMERS | M61: STEVENS | O61: MARMO | R61: HOLLIDAY | W61: PORT MELBOURNE | X61: 2 | Y61: 0 | Z61: 0 | AA61: 168 | AB61: 117 | AC61: 143.58974358974359 | AD61: 8
A62: GOALKICKERS | W62: BRIGHTON | X62: 1 | Y62: 1 | Z62: 0 | AA62: 164 | AB62: 114 | AC62: 143.85964912280701 | AD62: 4
A63: PORT MELBOURNE | D63: WALKER 3 | F63: SLOLEY 2 | H63: J STYLES 2 | J63: FROUD 2 | L63: SKILTON | N63: CARPENTER | Q63: BARFOOT | S63: CAMPBELL
A64: PRESTON | D64: STEVENS 6 | G64: WARR 2 | I64: SKIPPER | K64: TAYLOR | M64: A LUDLOW | P64: LEE | W64: PRESTON | X64: 1 | Y64: 1 | Z64: 0 | AA64: 155 | AB64: 141 | AC64: 109.9290780141844 | AD64: 4
W65: BRUNSWICK | X65: 1 | Y65: 1 | Z65: 0 | AA65: 111 | AB65: 113 | AC65: 98.230088495575217 | AD65: 4
A66: NORTHCOTE | C66: 1 | D66: 0 | E66: =C66*6+D66 -> 6 | G66: 3 | H66: 8 | I66: =G66*6+H66 -> 26 | K66: 3 | L66: 9 | M66: =K66*6+L66 -> 27 | O66: 4 | P66: 15 | Q66: =O66*6+P66 -> 39 | S66: KARDINIA PARK | W66: PRAHRAN | X66: 1 | Y66: 1 | Z66: 0 | AA66: 112 | AB66: 129 | AC66: 86.821705426356587 | AD66: 4
A67: GEELONG ASSOC. | C67: 3 | D67: 1 | E67: =C67*6+D67 -> 19 | G67: 4 | H67: 1 | I67: =G67*6+H67 -> 25 | K67: 5 | L67: 6 | M67: =K67*6+L67 -> 36 | O67: 5 | P67: 6 | Q67: =O67*6+P67 -> 36 | S67: MACHAR | W67: GEELONG ASSOC. | X67: 0 | Y67: 2 | Z67: 0 | AA67: 84 | AB67: 116 | AC67: 72.41379310344827 | AD67: 0
A68: BEST PLAYERS | W68: WILLIAMSTOWN | X68: 0 | Y68: 2 | Z68: 0 | AA68: 89 | AB68: 154 | AC68: 57.79220779220779 | AD68: 0
A69: NORTHCOTE | D69: GRIMSHAW | G69: SHEEHY | I69: H SMITH | L69: GOODRICK | O69: GOUGH | Q69: LAFFEY | W69: CAMBEREWLL | X69: 0 | Y69: 2 | Z69: 0 | AA69: 97 | AB69: 190 | AC69: 51.05263157894737 | AD69: 0
A70: GEELONG ASSOC. | D70: NOONAN | G70: CATIONS | I70: HARRIS | L70: FARR | O70: TAYLOR | Q70: DAVIS
A71: GOALKICKERS
A72: NORTHCOTE | D72: GOUGH 3 | G72: GOODRICK
A73: GEELONG ASSOC. | D73: NOONAN 2 | G73: F McINERNEY | J73: DAVIS | L73: W DIGBY
A75: BRUNSWICK | C75: 3 | D75: 3 | E75: =C75*6+D75 -> 21 | G75: 6 | H75: 9 | I75: =G75*6+H75 -> 45 | K75: 8 | L75: 9 | M75: =K75*6+L75 -> 57 | O75: 12 | P75: 9 | Q75: =O75*6+P75 -> 81 | S75: BRUNSWICK
A76: WILLIAMSTOWN | C76: 2 | D76: 2 | E76: =C76*6+D76 -> 14 | G76: 6 | H76: 3 | I76: =G76*6+H76 -> 39 | K76: 7 | L76: 6 | M76: =K76*6+L76 -> 48 | O76: 8 | P76: 7 | Q76: =O76*6+P76 -> 55 | S76: MAKER
A77: BEST PLAYERS
A78: BRUNSWICK | D78: BLACKMAN | G78: PENMAN | J78: REICHMAN | M78: KENNETT | P78: HUMPHREY | S78: KEDDIE
A79: WILLIAMSTOWN | D79: McKELLIN | G79: MARTIN | J79: MUNRO | M79: GEISLER | P79: WARREN | S79: J MUNN
A80: GOALKICKERS
A81: BRUNSWICK | D81: REICHMAN 5 | G81: STONE 3 | J81: HASSETT 2 | M81: ALESSIO | O81: BLACKMAN
A82: WILLIAMSTOWN | D82: J MUNN 2 | G82: W MUNN 2 | J82: MUNRO 2 | M82: TORY | O82: RIGALDI
A84: PRAHRAN | C84: 4 | D84: 4 | E84: =C84*6+D84 -> 28 | G84: 5 | H84: 5 | I84: =G84*6+H84 -> 35 | K84: 8 | L84: 6 | M84: =K84*6+L84 -> 54 | O84: 11 | P84: 7 | Q84: =O84*6+P84 -> 73 | S84: BRIGHTON BEACH
A85: BRIGHTON | C85: 0 | D85: 1 | E85: =C85*6+D85 -> 1 | G85: 2 | H85: 7 | I85: =G85*6+H85 -> 19 | K85: 2 | L85: 10 | M85: =K85*6+L85 -> 22 | O85: 7 | P85: 12 | Q85: =O85*6+P85 -> 54 | S85: BLACKBURN
A86: BEST PLAYERS
A87: PRAHRAN | D87: REYNOLDS | G87: ROWE | J87: OSBORNE | M87: SEACH | P87: VANCE | S87: HORTON
A88: BRIGHTON | D88: WALSH | G88: BORLAND | J88: KOLLE | M88: BOYD | P88: ALDRIDGE | S88: ISAACS
A89: GOALKICKERS
A90: PRAHRAN | D90: HARLEY 4 | G90: NAYLOR 3 | J90: SPAIN 2 | M90: GREENING | P90: ROWE
A91: BRIGHTON | D91: WALSH 2 | G91: ALDRIDGE | J91: BOYD | L91: WOOD | N91: CARROLL | P91: ISAACS
A93: COBURG | C93: 0 | D93: 4 | E93: =C93*6+D93 -> 4 | G93: 4 | H93: 13 | I93: =G93*6+H93 -> 37 | K93: 7 | L93: 17 | M93: =K93*6+L93 -> 59 | O93: 10 | P93: 20 | Q93: =O93*6+P93 -> 80 | S93: COBURG
A94: CAMBERWELL | C94: 3 | D94: 3 | E94: =C94*6+D94 -> 21 | G94: 5 | H94: 6 | I94: =G94*6+H94 -> 36 | K94: 6 | L94: 8 | M94: =K94*6+L94 -> 44 | O94: 8 | P94: 8 | Q94: =O94*6+P94 -> 56 | S94: LESTER
A95: BEST PLAYERS
A96: COBURG | D96: KERLEY | G96: FAUST | J96: SEXTON | M96: SPEAKMAN | P96: CHARLESTON | S96: CHAPMAN
A97: CAMBERWELL | D97: TRESIZE | G97: WOODFORD | J97: HARRISON | M97: CONNOP | P97: WRIGHT | S97: KILLEN
A98: GOALKICKERS
A99: COBURG | D99: KERLEY 6 | G99: JENKINS 2 | J99: RICHARDS | M99: CHARLESTON
A100: CAMBERWELL | D100: WARD 3 | G100: WRIGHT | J100: YOLE | L100: GREENBURY | O100: CONNOP | Q100: WOODFORD
A102: ROUND 3 | E102: 15TH MAY | J102: WEATHER | M102: FINE SOUTH WIND | S102: PLAYED AT | X102: LADDER | AB102: ROUND | AD102: 3
D103: 1ST QTR | H103: 2ND QTR | L103: 3RD QTR | P103: FINAL | S103: NORTHCOTE
A104: COBURG | C104: 2 | D104: 1 | E104: =C104*6+D104 -> 13 | G104: 5 | H104: 3 | I104: =G104*6+H104 -> 33 | K104: 6 | L104: 8 | M104: =K104*6+L104 -> 44 | O104: 8 | P104: 10 | Q104: =O104*6+P104 -> 58 | S104: UMPIRE | W104: TEAM | X104: W | Y104: L | Z104: D | AA104: FOR | AB104: AGST | AC104: % | AD104: PTS
A105: NORTHCOTE | C105: 3 | D105: 1 | E105: =C105*6+D105 -> 19 | G105: 5 | H105: 3 | I105: =G105*6+H105 -> 33 | K105: 5 | L105: 6 | M105: =K105*6+L105 -> 36 | O105: 5 | P105: 11 | Q105: =O105*6+P105 -> 41 | S105: CAIN
A106: BEST PLAYERS | W106: PORT MELBOURNE | X106: 3 | Y106: 0 | Z106: 0 | AA106: 287 | AB106: 161 | AC106: 178.2608695652174 | AD106: 12
A107: COBURG | D107: PLANT | F107: C MARTYN | I107: SPEAKMAN | L107: MEARS | N107: BEESON | Q107: OWEN | W107: COBURG | X107: 3 | Y107: 0 | Z107: 0 | AA107: 211 | AB107: 131 | AC107: 161.06870229007635 | AD107: 12
A108: NORTHCOTE | D108: SHEEHY | F108: DOLOFFSKY | I108: ROGAN | L108: H SMITH | N108: DOWNES | Q108: THEOBOLD | W108: BRUNSWICK | X108: 2 | Y108: 1 | Z108: 0 | AA108: 187 | AB108: 149 | AC108: 125.50335570469798 | AD108: 8
A109: GOALKICKERS | W109: PRESTON | X109: 2 | Y109: 1 | Z109: 0 | AA109: 245 | AB109: 216 | AC109: 113.42592592592592 | AD109: 8
A110: COBURG | D110: PLANT 4 | G110: MEARS | J110: BEESON | M110: SPEAKMAN | P110: KERLEY
A111: NORTHCOTE | D111: GOUGH 4 | G111: THEOBOLD | W111: NORTHCOTE | X111: 2 | Y111: 1 | Z111: 0 | AA111: 138 | AB111: 124 | AC111: 111.29032258064517 | AD111: 8
W112: PRAHRAN | X112: 2 | Y112: 1 | Z112: 0 | AA112: 200 | AB112: 198 | AC112: 101.01010101010101 | AD112: 8
A113: PRESTON | C113: 2 | D113: 2 | E113: =C113*6+D113 -> 14 | G113: 5 | H113: 8 | I113: =G113*6+H113 -> 38 | K113: 7 | L113: 8 | M113: =K113*6+L113 -> 50 | O113: 13 | P113: 12 | Q113: =O113*6+P113 -> 90 | S113: BRIGHTON BEACH | W113: BRIGHTON | X113: 1 | Y113: 2 | Z113: 0 | AA113: 239 | AB113: 204 | AC113: 117.15686274509804 | AD113: 4
A114: BRIGHTON | C114: 2 | D114: 5 | E114: =C114*6+D114 -> 17 | G114: 3 | H114: 7 | I114: =G114*6+H114 -> 25 | K114: 8 | L114: 8 | M114: =K114*6+L114 -> 56 | O114: 11 | P114: 9 | Q114: =O114*6+P114 -> 75 | S114: BLACKBURN | W114: WILLIAMSTOWN | X114: 0 | Y114: 3 | Z114: 0 | AA114: 158 | AB114: 242 | AC114: 65.289256198347104 | AD114: 0
A115: BEST PLAYERS | W115: GEELONG ASSOC. | X115: 0 | Y115: 3 | Z115: 0 | AA115: 120 | AB115: 192 | AC115: 62.5 | AD115: 0
A116: PRESTON | D116: WHITE | G116: STEVENS | J116: SURTEES | M116: SUMMERS | P116: WATT | R116: WARR | W116: CAMBERWELL | X116: 0 | Y116: 3 | Z116: 0 | AA116: 141 | AB116: 309 | AC116: 45.631067961165051 | AD116: 0
A117: BRIGHTON | D117: WALSH | G117: RATTRAY | J117: ALDRIDGE | M117: HUNT | P117: GARCIA
A118: GOALKICKERS
A119: PRESTON | D119: STEVENS 3 | F119: WARR 2 | H119: A LUDLOW 2 | K119: SUMMERS 2 | N119: TORODE | P119: SHAW | R119: WATT | T119: BARNETT
A120: BRIGHTON | D120: WALSH 4 | G120: RATTRAY 2 | J120: BOYD 2 | M120: WOOD | O120: MAINE | Q120: ALDRIDGE
A122: BRUNSWICK | C122: 3 | D122: 3 | E122: =C122*6+D122 -> 21 | G122: 5 | H122: 10 | I122: =G122*6+H122 -> 40 | K122: 7 | L122: 12 | M122: =K122*6+L122 -> 54 | O122: 10 | P122: 16 | Q122: =O122*6+P122 -> 76 | S122: BRUNSWICK
A123: GEELONG ASSOC. | C123: 3 | D123: 2 | E123: =C123*6+D123 -> 20 | G123: 4 | H123: 4 | I123: =G123*6+H123 -> 28 | K123: 5 | L123: 6 | M123: =K123*6+L123 -> 36 | O123: 5 | P123: 6 | Q123: =O123*6+P123 -> 36 | S123: BYRON
A124: BEST PLAYERS
A125: BRUNSWICK | D125: BLACKMAN | G125: HASSETT | J125: KENNETT | M125: FITZGERALD | P125: ALESSIO | S125: McINERNEY
A126: GEELONG ASSOC. | D126: TAYLOR | G126: CATIONS | J126: POWELL | M126: F DIGBY | P126: NOONAN | S126: KEANE
A127: GOALKICKERS
A128: BRUNSWICK | D128: McINERNEY 3 | G128: FITZGERALD 3 | K128: STONE 2 | N128: PARKER | P128: HASSETT
A129: GEELONG ASSOC. | D129: NOONAN 3 | G129: J McINERNEY | K129: HARRIS
A131: PRAHRAN | C131: 3 | D131: 3 | E131: =C131*6+D131 -> 21 | G131: 6 | H131: 6 | I131: =G131*6+H131 -> 42 | K131: 9 | L131: 6 | M131: =K131*6+L131 -> 60 | O131: 13 | P131: 10 | Q131: =O131*6+P131 -> 88 | S131: TOORAK PARK
A132: WILLIAMSTOWN | C132: 1 | D132: 6 | E132: =C132*6+D132 -> 12 | G132: 3 | H132: 11 | I132: =G132*6+H132 -> 29 | K132: 9 | L132: 14 | M132: =K132*6+L132 -> 68 | O132: 9 | P132: 15 | Q132: =O132*6+P132 -> 69 | S132: MAKER
A133: BEST PLAYERS
A134: PRAHRAN | D134: OSBORNE | G134: VANCE | J134: HARLEY | M134: E JONES | P134: V JONES | S134: HORTON
A135: WILLIAMSTOWN | D135: FLANNERY | G135: FERGUSON | J135: RIGALDI | M135: J MUNN | P135: KENNY | S135: MUNRO
A136: GOALKICKERS
A137: PRAHRAN | D137: HARLEY 7 | G137: WEATHERALL 2 | K137: HORTON | M137: SMITH | O137: SPAIN | Q137: V JONES
A138: WILLIAMSTOWN | D138: RIGALDI 2 | G138: LYONS 2 | I138: J MUNN 2 | K138: ROBERTS | M138: GEISLER | O138: MUNRO
A140: PORT MELBOURNE | C140: 4 | D140: 4 | E140: =C140*6+D140 -> 28 | G140: 6 | H140: 10 | I140: =G140*6+H140 -> 46 | K140: 12 | L140: 21 | M140: =K140*6+L140 -> 93 | O140: 16 | P140: 23 | Q140: =O140*6+P140 -> 119 | S140: PORT MELBOURNE
A141: CAMBERWELL | C141: 0 | D141: 0 | E141: =C141*6+D141 -> 0 | G141: 2 | H141: 3 | I141: =G141*6+H141 -> 15 | K141: 2 | L141: 5 | M141: =K141*6+L141 -> 17 | O141: 6 | P141: 8 | Q141: =O141*6+P141 -> 44 | S141: FURLONG
A142: BEST PLAYERS
A143: PORT MELBOURNE | D143: SKILTON | G143: W RUDD | J143: CARPENTER | M143: L BOLMAN | P143: BARFOOT | S143: LAWSON
A144: CAMBERWELL | D144: KILLEN | G144: HARRISON | J144: KARTHAUS | M144: WOODFORD | P144: CONNOP | S144: WRIGHT
A145: GOALKICKERS
A146: PORT MELBOURNE | D146: CARPENTER 3 | G146: SKILTON 3 | I146: CAREY 3 | K146: WALKER 2 | M146: BARFOOT 2 | P146: J STYLES | R146: W RUDD | U146: L BOLMAN
A147: CAMBERWELL | D147: CONNOP 2 | G147: WILSON | I147: WOODFORD | L147: HARRISON | O147: YOLE
A149: ROUND 4 | E149: 22ND MAY | J149: WEATHER | M149: DULL CLOUDY COLD N.W. WIND | S149: PLAYED AT | X149: LADDER | AB149: ROUND | AD149: 3
D150: 1ST QTR | H150: 2ND QTR | L150: 3RD QTR | P150: FINAL | S150: COBURG
A151: BRUNSWICK | C151: 2 | D151: 3 | E151: =C151*6+D151 -> 15 | G151: 4 | H151: 3 | I151: =G151*6+H151 -> 27 | K151: 10 | L151: 4 | M151: =K151*6+L151 -> 64 | O151: 11 | P151: 5 | Q151: =O151*6+P151 -> 71 | W151: TEAM | X151: W | Y151: L | Z151: D | AA151: FOR | AB151: AGST | AC151: % | AD151: PTS
A152: COBURG | C152: 1 | D152: 4 | E152: =C152*6+D152 -> 10 | G152: 4 | H152: 7 | I152: =G152*6+H152 -> 31 | K152: 6 | L152: 9 | M152: =K152*6+L152 -> 45 | O152: 9 | P152: 14 | Q152: =O152*6+P152 -> 68 | S152: BLACKBURN
A153: BEST PLAYERS | W153: PORT MELBOURNE | X153: 4 | Y153: 0 | Z153: 0 | AA153: 351 | AB153: 201 | AC153: 174.62686567164178 | AD153: 16
A154: BRUNSWICK | D154: McINERNEY | G154: KEDDIE | I154: KENNETT | K154: W JOHNSON | N154: EWINS | Q154: O'CONNOR | W154: COBURG | X154: 3 | Y154: 1 | Z154: 0 | AA154: 279 | AB154: 202 | AC154: 138.11881188118812 | AD154: 12
A155: COBURG | D155: KERLEY | G155: C MARTYN | I155: FORD | K155: BROOKES | N155: CHARLESTON | Q155: COX | W155: PRAHRAN | X155: 3 | Y155: 1 | Z155: 0 | AA155: 326 | AB155: 258 | AC155: 126.35658914728683 | AD155: 12
A156: GOALKICKERS | W156: BRUNSWICK | X156: 3 | Y156: 1 | Z156: 0 | AA156: 258 | AB156: 217 | AC156: 118.89400921658986 | AD156: 12
A157: BRUNSWICK | D157: McINERNEY 7 | G157: ALESSIO 2 | J157: RAYMOND | M157: McMAHON
A158: COBURG | D158: MEARS 2 | F158: PLANT 2 | H158: KERLEY | J158: SPEAKMAN | M158: BEESON | O158: C MARTYN | Q158: HARRIS | W158: NORTHCOTE | X158: 3 | Y158: 1 | Z158: 0 | AA158: 206 | AB158: 185 | AC158: 111.35135135135135 | AD158: 12
W159: PRESTON | X159: 2 | Y159: 2 | Z159: 0 | AA159: 306 | AB159: 284 | AC159: 107.74647887323944 | AD159: 8
A160: NORTHCOTE | C160: 4 | D160: 2 | E160: =C160*6+D160 -> 26 | G160: 6 | H160: 5 | I160: =G160*6+H160 -> 41 | K160: 7 | L160: 6 | M160: =K160*6+L160 -> 48 | O160: 9 | P160: 14 | Q160: =O160*6+P160 -> 68 | S160: PRESTON | W160: BRIGHTON | X160: 1 | Y160: 3 | Z160: 0 | AA160: 331 | AB160: 298 | AC160: 111.07382550335571 | AD160: 4
A161: PRESTON | C161: 2 | D161: 6 | E161: =C161*6+D161 -> 18 | G161: 4 | H161: 7 | I161: =G161*6+H161 -> 31 | K161: 5 | L161: 13 | M161: =K161*6+L161 -> 43 | O161: 8 | P161: 13 | Q161: =O161*6+P161 -> 61 | S161: OLDFIELD | W161: WILLIAMSTOWN | X161: 1 | Y161: 3 | Z161: 0 | AA161: 252 | AB161: 334 | AC161: 75.449101796407192 | AD161: 4
A162: BEST PLAYERS | W162: GEELONG ASSOC. | X162: 0 | Y162: 4 | Z162: 0 | AA162: 160 | AB162: 256 | AC162: 62.5 | AD162: 0
A163: NORTHCOTE | D163: H SMITH | F163: T DOWNES | I163: SHEEHY | K163: GOODRICK | N163: PERKINS | Q163: THEOBOLD | W163: CAMBERWELL | X163: 0 | Y163: 4 | Z163: 0 | AA163: 201 | AB163: 435 | AC163: 46.206896551724135 | AD163: 0
A164: PRESTON | D164: SURTEES | F164: A LUDLOW | I164: MUIR | K164: SEEBECK | N164: SKIPPER | Q164: WHITE
A165: GOALKICKERS
A166: NORTHCOTE | D166: GOUGH 3 | G166: DESLANDES 2 | J166: GOODRICK | M166: T DOWNES | P166: SHEEHY | R166: R DOWNES
A167: PRESTON | D167: SKIPPER 2 | G167: MUIR 2 | I167: A LUDLOW | L167: MARMO | N167: JONES | P167: BARNETT
A169: WILLIAMSTOWN | C169: 2 | D169: 3 | E169: =C169*6+D169 -> 15 | G169: 6 | H169: 7 | I169: =G169*6+H169 -> 43 | K169: 10 | L169: 9 | M169: =K169*6+L169 -> 69 | O169: 14 | P169: 10 | Q169: =O169*6+P169 -> 94 | S169: WILLIAMSTOWN
A170: BRIGHTON | C170: 3 | D170: 3 | E170: =C170*6+D170 -> 21 | G170: 8 | H170: 5 | I170: =G170*6+H170 -> 53 | K170: 9 | L170: 9 | M170: =K170*6+L170 -> 63 | O170: 13 | P170: 14 | Q170: =O170*6+P170 -> 92 | S170: BYRON
A171: BEST PLAYERS
A172: WILLIAMSTOWN | D172: FERGUSON | G172: CONLAN | J172: JOYCE | M172: LYONS | P172: J MUNN | S172: RIGALDI
A173: BRIGHTON | D173: ALDRIDGE | G173: HUNT | J173: WALSH | M173: RATTRAY | P173: IRWIN | S173: ATKINSON
A174: GOALKICKERS
A175: WILLIAMSTOWN | D175: RIGALDI 7 | G175: J MUNN 3 | J175: LYONS 2 | M175: JOHNS | O175: ROBERTS
A176: BRIGHTON | D176: WALSH 6 | F176: MAINE | H176: MITCHELL | J176: D LYNCH | M176: BESWICK | O176: BOYD | Q176: RATTRAY | S176: THRELFALL
A178: PRAHRAN | C178: 6 | D178: 1 | E178: =C178*6+D178 -> 37 | G178: 12 | H178: 6 | I178: =G178*6+H178 -> 78 | K178: 13 | L178: 8 | M178: =K178*6+L178 -> 86 | O178: 19 | P178: 12 | Q178: =O178*6+P178 -> 126 | S178: CAMBERWELL
A179: CAMBERWELL | C179: 3 | D179: 5 | E179: =C179*6+D179 -> 23 | G179: 5 | H179: 6 | I179: =G179*6+H179 -> 36 | K179: 6 | L179: 14 | M179: =K179*6+L179 -> 50 | O179: 7 | P179: 18 | Q179: =O179*6+P179 -> 60 | S179: PETERS
A180: BEST PLAYERS
A181: PRAHRAN | D181: OSBORNE | G181: B SMITH | J181: SPAIN | M181: ROOKE | P181: E JONES | S181: HARLEY
A182: CAMBERWELL | D182: ELLIOTT | G182: WOODFORD | J182: HARRISON | M182: KARTHAUS | P182: TRESIZE | S182: McKERNAN
A183: GOALKICKERS
A184: PRAHRAN | D184: HARLEY 6 | F184: NAYLOR 3 | I184: V JONES 3 | K184: ROWE 2 | M184: B SMITH 2 | P184: ROGERS | R184: SPAIN | T184: WEATHERALL
A185: CAMBERWELL | D185: WOODFORD 2 | G185: GREENBURY 2 | J185: YOLE | L185: WARD | N185: R WRIGHT
A187: PORT MELBOURNE | C187: 2 | D187: 3 | E187: =C187*6+D187 -> 15 | G187: 3 | H187: 4 | I187: =G187*6+H187 -> 22 | K187: 8 | L187: 9 | M187: =K187*6+L187 -> 57 | O187: 9 | P187: 10 | Q187: =O187*6+P187 -> 64 | S187: KARDINIA PARK
A188: GEELONG ASSOC. | C188: 0 | D188: 0 | E188: =C188*6+D188 -> 0 | G188: 5 | H188: 7 | I188: =G188*6+H188 -> 37 | K188: 5 | L188: 9 | M188: =K188*6+L188 -> 39 | O188: 5 | P188: 10 | Q188: =O188*6+P188 -> 40 | S188: MACHAR
A189: BEST PLAYERS
A190: PORT MELBOURNE | D190: W RUDD | G190: FORBES | J190: FARNAN | M190: JOHNSON | P190: LAWSON | S190: CARPENTER
A191: GEELONG ASSOC. | D191: MACK | G191: NOONAN | J191: CATIONS | M191: POWELL | P191: McCLEARY | S191: FARR
A192: GOALKICKERS
A193: PORT MELBOURNE | D193: FORBES 3 | G193: SKILTON 2 | J193: SHIPPICK 2 | M193: LAWSON | O193: BARFOOT
A194: GEELONG ASSOC. | D194: NOONAN 3 | G194: McCLEARY | J194: FARR
A196: ROUND 5 | E196: 29TH MAY | J196: WEATHER | M196: FINE | S196: PLAYED AT | X196: LADDER | AB196: ROUND | AD196: 5
D197: 1ST QTR | H197: 2ND QTR | L197: 3RD QTR | P197: FINAL | S197: BRUNSWICK
A198: PORT MELBOURNE | C198: 5 | D198: 3 | E198: =C198*6+D198 -> 33 | G198: 7 | H198: 4 | I198: =G198*6+H198 -> 46 | K198: 7 | L198: 5 | M198: =K198*6+L198 -> 47 | O198: 8 | P198: 9 | Q198: =O198*6+P198 -> 57 | S198: UMPIRE | W198: TEAM | X198: W | Y198: L | Z198: D | AA198: FOR | AB198: AGST | AC198: % | AD198: PTS
A199: BRUNSWICK | C199: 1 | D199: 2 | E199: =C199*6+D199 -> 8 | G199: 1 | H199: 5 | I199: =G199*6+H199 -> 11 | K199: 4 | L199: 8 | M199: =K199*6+L199 -> 32 | O199: 7 | P199: 9 | Q199: =O199*6+P199 -> 51
A200: BEST PLAYERS | W200: PORT MELBOURNE | X200: 5 | Y200: 0 | Z200: 0 | AA200: 408 | AB200: 252 | AC200: 161.9047619047619 | AD200: 20
A201: PORT MELBOURNE | D201: SKILTON | F201: CARPENTER | I201: FORBES | L201: PERRETT | O201: SLOLEY | Q201: SHIPPICK | W201: NORTHCOTE | X201: 4 | Y201: 1 | Z201: 0 | AA201: 294 | AB201: 220 | AC201: 133.63636363636363 | AD201: 16
A202: BRUNSWICK | D202: HART | F202: KENNETT | I202: KEDDIE | L202: FITZGERALD | O202: O'CONNOR | Q202: EWINS | W202: COBURG | X202: 4 | Y202: 1 | Z202: 0 | AA202: 355 | AB202: 266 | AC202: 133.45864661654136 | AD202: 16
A203: GOALKICKERS | W203: PRAHRAN | X203: 4 | Y203: 1 | Z203: 0 | AA203: 382 | AB203: 297 | AC203: 128.61952861952861 | AD203: 16
A204: PORT MELBOURNE | D204: SKILTON 4 | G204: SLOLEY | J204: CARPENTER | M204: CAMPBELL | P204: REES
A205: BRUNSWICK | D205: McINERNEY 3 | G205: ALESSIO | J205: FITZGERALD | M205: McMAHON | P205: RAYMOND | W205: BRUNSWICK | X205: 3 | Y205: 2 | Z205: 0 | AA205: 309 | AB205: 274 | AC205: 112.77372262773723 | AD205: 12
W206: PRESTON | X206: 2 | Y206: 3 | Z206: 0 | AA206: 382 | AB206: 361 | AC206: 105.81717451523545 | AD206: 8
A207: COBURG | C207: 2 | D207: 5 | E207: =C207*6+D207 -> 17 | G207: 6 | H207: 10 | I207: =G207*6+H207 -> 46 | K207: 9 | L207: 13 | M207: =K207*6+L207 -> 67 | O207: 10 | P207: 16 | Q207: =O207*6+P207 -> 76 | S207: BRIGHTON | W207: BRIGHTON | X207: 1 | Y207: 4 | Z207: 0 | AA207: 395 | AB207: 374 | AC207: 105.61497326203208 | AD207: 4
A208: BRIGHTON | C208: 3 | D208: 5 | E208: =C208*6+D208 -> 23 | G208: 6 | H208: 6 | I208: =G208*6+H208 -> 42 | K208: 8 | L208: 7 | M208: =K208*6+L208 -> 55 | O208: 9 | P208: 10 | Q208: =O208*6+P208 -> 64 | S208: BLACKBURN | W208: WILLIAMSTOWN | X208: 1 | Y208: 4 | Z208: 0 | AA208: 287 | AB208: 422 | AC208: 68.009478672985779 | AD208: 4
A209: BEST PLAYERS | W209: CAMBERWELL | X209: 1 | Y209: 4 | Z209: 0 | AA209: 278 | AB209: 511 | AC209: 54.403131115459885 | AD209: 4
A210: COBURG | D210: BROOKES | G210: JENKINS | I210: FORD | L210: SPEAKMAN | O210: KERLEY | Q210: FORBES | W210: GEELONG ASSOC. | X210: 0 | Y210: 5 | Z210: 0 | AA210: 199 | AB210: 312 | AC210: 63.782051282051285 | AD210: 0
A211: BRIGHTON | D211: IRWIN | G211: L BOYD | I211: WALSH | L211: RATTRAY | O211: ALDRIDGE | Q211: GARCIA
A212: GOALKICKERS
A213: COBURG | D213: FORBES 4 | G213: GARDINER 3 | J213: JENKINS | L213: KERLEY | N213: CHARLESTON
A214: BRIGHTON | D214: WALSH 5 | G214: HUNT | I214: FRIEND | K214: BOYD
A216: NORTHCOTE | C216: 2 | D216: 2 | E216: =C216*6+D216 -> 14 | G216: 6 | H216: 7 | I216: =G216*6+H216 -> 43 | K216: 6 | L216: 8 | M216: =K216*6+L216 -> 44 | O216: 13 | P216: 10 | Q216: =O216*6+P216 -> 88 | S216: WILLIAMSTOWN
A217: WILLIAMSTOWN | C217: 0 | D217: 3 | E217: =C217*6+D217 -> 3 | G217: 0 | H217: 3 | I217: =G217*6+H217 -> 3 | K217: 4 | L217: 4 | M217: =K217*6+L217 -> 28 | O217: 5 | P217: 5 | Q217: =O217*6+P217 -> 35 | S217: OLDFIELD
A218: BEST PLAYERS
A219: NORTHCOTE | D219: R DOWNES | G219: H SMITH | J219: WHITTAKER | M219: GOODRICK | P219: JUDKINS | S219: T DOWNES
A220: WILLIAMSTOWN | D220: JOYCE | G220: FERGUSON | J220: TORY | M220: LYONS | P220: BEER | S220: McKELLIN
A221: GOALKICKERS
A222: NORTHCOTE | D222: GOUGH 3 | F222: DESLANDES 3 | I222: GOODRICK 2 | L222: JUDKINS | N222: SHEEHY | P222: PERKINS | R222: R DOWNES | U222: THEOBOLD
A223: WILLIAMSTOWN | D223: JOYCE | F223: TORY | H223: RIGALDI | K223: J MUNN | N223: LYONS
A225: CAMBERWELL | C225: 3 | D225: 1 | E225: =C225*6+D225 -> 19 | G225: 6 | H225: 7 | I225: =G225*6+H225 -> 43 | K225: 7 | L225: 8 | M225: =K225*6+L225 -> 50 | O225: 11 | P225: 11 | Q225: =O225*6+P225 -> 77 | S225: CAMBERWELL
A226: PRESTON | C226: 1 | D226: 5 | E226: =C226*6+D226 -> 11 | G226: 5 | H226: 7 | I226: =G226*6+H226 -> 37 | K226: 9 | L226: 13 | M226: =K226*6+L226 -> 67 | O226: 10 | P226: 16 | Q226: =O226*6+P226 -> 76 | S226: BYRON
A227: BEST PLAYERS
A228: CAMBERWELL | D228: ELLIMAN | G228: DIMOND | J228: WHITECROSS | M228: OWEN | P228: KILLEN | S228: M WRIGHT
A229: PRESTON | D229: SURTEES | G229: A LUDLOW | J229: SHAW | M229: DOBRIGH | P229: WARR | S229: ROBERTSON
A230: GOALKICKERS
A231: CAMBERWELL | D231: WOODFORD 4 | G231: DIMOND 2 | J231: OWEN 2 | L231: McKERNAN | O231: R WRIGHT | R231: ELLIMAN
A232: PRESTON | D232: STEVENS 3 | G232: A LUDLOW 2 | J232: TAYLOR 2 | M232: DOBRIGH | O232: SHAW | Q232: SUMMERS
A234: PRAHRAN | C234: 3 | D234: 6 | E234: =C234*6+D234 -> 24 | G234: 4 | H234: 8 | I234: =G234*6+H234 -> 32 | K234: 6 | L234: 13 | M234: =K234*6+L234 -> 49 | O234: 7 | P234: 14 | Q234: =O234*6+P234 -> 56 | S234: TOORAK PARK
A235: GEELONG ASSOC. | C235: 0 | D235: 2 | E235: =C235*6+D235 -> 2 | G235: 2 | H235: 3 | I235: =G235*6+H235 -> 15 | K235: 2 | L235: 6 | M235: =K235*6+L235 -> 18 | O235: 5 | P235: 9 | Q235: =O235*6+P235 -> 39 | S235: LOUGHLIN
A236: BEST PLAYERS
A237: PRAHRAN | D237: OSBORNE | G237: V JONES | J237: SPAIN | M237: REYNOLDS | P237: B SMITH | S237: SEACH
A238: GEELONG ASSOC. | D238: DEAN | G238: CATIONS | J238: POWELL | M238: ELSTON | P238: NOONAN | S238: MACK
A239: GOALKICKERS
A240: PRAHRAN | D240: B SMITH 3 | G240: NAYLOR | J240: HARLEY | L240: ROWE | N240: V JONES
A241: GEELONG ASSOC. | D241: DEAN 2 | G241: NOONAN 2 | J241: ELSTON
A243: ROUND 6 | E243: 5TH JUNE | H243: WEATHER | K243: FINE BUT COLD AFTER EARLY FOG | S243: PLAYED AT | X243: LADDER | AB243: ROUND | AD243: 6
D244: 1ST QTR | H244: 2ND QTR | L244: 3RD QTR | P244: FINAL | S244: KARDINIA PARK
A245: GEELONG ASSOC. | C245: 5 | D245: 1 | E245: =C245*6+D245 -> 31 | G245: 7 | H245: 3 | I245: =G245*6+H245 -> 45 | K245: 11 | L245: 4 | M245: =K245*6+L245 -> 70 | O245: 13 | P245: 5 | Q245: =O245*6+P245 -> 83 | S245: UMPIRE | W245: TEAM | X245: W | Y245: L | Z245: D | AA245: FOR | AB245: AGST | AC245: % | AD245: PTS
A246: CAMBERWELL | C246: 1 | D246: 2 | E246: =C246*6+D246 -> 8 | G246: 3 | H246: 2 | I246: =G246*6+H246 -> 20 | K246: 6 | L246: 3 | M246: =K246*6+L246 -> 39 | O246: 8 | P246: 7 | Q246: =O246*6+P246 -> 55 | S246: OLDFIELD
A247: BEST PLAYERS | W247: PORT MELBOURNE | X247: 6 | Y247: 0 | Z247: 0 | AA247: 476 | AB247: 296 | AC247: 160.81081081081081 | AD247: 24
A248: GEELONG ASSOC. | D248: TAYLOR | G248: NOONAN | I248: J McINERNEY | L248: McINTYRE | O248: CATIONS | Q248: ELSTON | W248: NORTHCOTE | X248: 5 | Y248: 1 | Z248: 0 | AA248: 400 | AB248: 282 | AC248: 141.84397163120568 | AD248: 20
A249: CAMBERWELL | D249: WOODFORD | G249: RAWLE | I249: TRESIZE | L249: KARTHAUS | O249: HARRISON | Q249: KILLEN | W249: COBURG | X249: 5 | Y249: 1 | Z249: 0 | AA249: 467 | AB249: 335 | AC249: 139.40298507462686 | AD249: 20
A250: GOALKICKERS | W250: BRUNSWICK | X250: 4 | Y250: 2 | Z250: 0 | AA250: 406 | AB250: 343 | AC250: 118.36734693877551 | AD250: 16
A251: GEELONG ASSOC. | D251: NOONAN 6 | G251: McINTYRE 2 | J251: KEANE 2 | M251: BLISS | O251: ROACH | Q251: JOHNSON
A252: CAMBERWELL | D252: WOODFORD 3 | G252: JACKMAN 3 | J252: OWENS | M252: GREENBURY | W252: PRAHRAN | X252: 4 | Y252: 2 | Z252: 0 | AA252: 451 | AB252: 394 | AC252: 114.46700507614213 | AD252: 16
W253: PRESTON | X253: 2 | Y253: 4 | Z253: 0 | AA253: 451 | AB253: 473 | AC253: 95.348837209302332 | AD253: 8
A254: PORT MELBOURNE | C254: 2 | D254: 3 | E254: =C254*6+D254 -> 15 | G254: 5 | H254: 8 | I254: =G254*6+H254 -> 38 | K254: 7 | L254: 11 | M254: =K254*6+L254 -> 53 | O254: 9 | P254: 14 | Q254: =O254*6+P254 -> 68 | S254: WILLIAMSTOWN | W254: BRIGHTON | X254: 1 | Y254: 5 | Z254: 0 | AA254: 457 | AB254: 480 | AC254: 95.208333333333329 | AD254: 4
A255: WILLIAMSTOWN | C255: 2 | D255: 2 | E255: =C255*6+D255 -> 14 | G255: 2 | H255: 2 | I255: =G255*6+H255 -> 14 | K255: 6 | L255: 7 | M255: =K255*6+L255 -> 43 | O255: 6 | P255: 8 | Q255: =O255*6+P255 -> 44 | S255: BYRON | W255: GEELONG ASSOC. | X255: 1 | Y255: 5 | Z255: 0 | AA255: 282 | AB255: 367 | AC255: 76.839237057220714 | AD255: 4
A256: BEST PLAYERS | W256: WILLIAMSTOWN | X256: 1 | Y256: 5 | Z256: 0 | AA256: 331 | AB256: 490 | AC256: 67.551020408163268 | AD256: 4
A257: PORT MELBOURNE | D257: SKILTON | G257: ROSEMAN | I257: CARPENTER | L257: H BOLMAN | O257: SLOLEY | Q257: LAWSON | W257: CAMBERWELL | X257: 1 | Y257: 5 | Z257: 0 | AA257: 333 | AB257: 594 | AC257: 56.060606060606062 | AD257: 4
A258: WILLIAMSTOWN | D258: CHALMERS | G258: BALL | I258: MARTIN | L258: KENNY | O258: GEISLER | Q258: JOYCE
A259: GOALKICKERS
A260: PORT MELBOURNE | D260: SKILTON 3 | G260: REES 2 | I260: FROUD 2 | K260: CARPENTER | N260: SHIPPICK
A261: WILLIAMSTOWN | D261: GEISLER 2 | G261: MARTIN | J261: RIGALDI | L261: KENNY | O261: OWENS
A263: NORTHCOTE | C263: 6 | D263: 1 | E263: =C263*6+D263 -> 37 | G263: 8 | H263: 5 | I263: =G263*6+H263 -> 53 | K263: 12 | L263: 6 | M263: =K263*6+L263 -> 78 | O263: 15 | P263: 16 | Q263: =O263*6+P263 -> 106 | S263: NORTHCOTE
A264: BRIGHTON | C264: 1 | D264: 2 | E264: =C264*6+D264 -> 8 | G264: 4 | H264: 6 | I264: =G264*6+H264 -> 30 | K264: 7 | L264: 7 | M264: =K264*6+L264 -> 49 | O264: 9 | P264: 8 | Q264: =O264*6+P264 -> 62 | S264: MURRAY
A265: BEST PLAYERS
A266: NORTHCOTE | D266: GOUGH | G266: LONG | J266: JUDKINS | M266: GOODRICK | P266: DESLANDES | S266: PERKINS
A267: BRIGHTON | D267: ALDRIDGE | G267: BORLAND | J267: MITCHELL | M267: KOLLE | P267: LYNCH | S267: GARCIA
A268: GOALKICKERS
A269: NORTHCOTE | D269: GOUGH 9 | G269: GOODRICK 2 | J269: T DOWNES | M269: THEOBOLD | P269: PERKINS | R269: DESLANDES
A270: BRIGHTON | D270: WALSH 5 | G270: MITCHELL 2 | J270: BESWICK 2
E271: 7TH JUNE | J271: WEATHER | M271: FINE
A272: BRUNSWICK | C272: 6 | D272: 3 | E272: =C272*6+D272 -> 39 | G272: 10 | H272: 4 | I272: =G272*6+H272 -> 64 | K272: 13 | L272: 5 | M272: =K272*6+L272 -> 83 | O272: 15 | P272: 7 | Q272: =O272*6+P272 -> 97 | S272: BRUNSWICK
A273: PRAHRAN | C273: 1 | D273: 1 | E273: =C273*6+D273 -> 7 | G273: 4 | H273: 3 | I273: =G273*6+H273 -> 27 | K273: 7 | L273: 5 | M273: =K273*6+L273 -> 47 | O273: 10 | P273: 9 | Q273: =O273*6+P273 -> 69 | S273: OLDFIELD
A274: BEST PLAYERS
A275: BRUNSWICK | D275: HASSETT | G275: ALESSIO | J275: HART | M275: KEDDIE | O275: FITZGERALD | R275: KENNETT
A276: PRAHRAN | D276: OSBORNE | G276: C SMITH | J276: V JONES | M276: GREEN | O276: HORTON | R276: E JONES
A277: GOALKICKERS
A278: BRUNSWICK | D278: McINERNEY 4 | G278: O'CONNOR 3 | J278: ALESSIO 2 | M278: MILLER 2 | O278: HASSETT 2 | R278: FITZGERALD | U278: REICHMAN
A279: PRAHRAN | D279: HARLEY 3 | G279: NAYLOR | I279: GREENING | K279: HORTON | M279: WEATHERALL | P279: B SMITH | R279: SPAIN
A281: COBURG | C281: 5 | D281: 3 | E281: =C281*6+D281 -> 33 | G281: 7 | H281: 8 | I281: =G281*6+H281 -> 50 | K281: 12 | L281: 12 | M281: =K281*6+L281 -> 84 | O281: 16 | P281: 16 | Q281: =O281*6+P281 -> 112 | S281: PRESTON
A282: PRESTON | C282: 1 | D282: 1 | E282: =C282*6+D282 -> 7 | G282: 3 | H282: 3 | I282: =G282*6+H282 -> 21 | K282: 6 | L282: 8 | M282: =K282*6+L282 -> 44 | O282: 10 | P282: 9 | Q282: =O282*6+P282 -> 69 | S282: PATTISON
A283: BEST PLAYERS
A284: COBURG | D284: CHARLESTON | G284: JENKINS | J284: PLANT | M284: KERLEY | O284: BROOKES | R284: FORBES
A285: PRESTON | D285: HOLLIDAY | G285: WHITE | J285: SEEBECK | M285: SURTEES | O285: ROBERTSON | R285: WARR
A286: GOALKICKERS
A287: COBURG | D287: PLANT 5 | F287: FORBES 3 | I287: KERLEY 3 | L287: GARDINER 3 | O287: BROOKES | Q287: C MARTYN
A288: PRESTON | D288: STEVENS 2 | F288: WARR 2 | H288: LUDLOW 2 | J288: SHAW | L288: SUMMERS | N288: SKIPPER | P288: FOTHERGILL
A290: ROUND 7 | E290: 12TH JUNE | J290: WEATHER | M290: CLOUDY SOUTH WIND | S290: PLAYED AT | X290: LADDER | AB290: ROUND | AD290: 7
D291: 1ST QTR | H291: 2ND QTR | L291: 3RD QTR | P291: FINAL | S291: COBURG
A292: COBURG | C292: 3 | D292: 3 | E292: =C292*6+D292 -> 21 | G292: 6 | H292: 9 | I292: =G292*6+H292 -> 45 | K292: 9 | L292: 9 | M292: =K292*6+L292 -> 63 | O292: 10 | P292: 13 | Q292: =O292*6+P292 -> 73 | S292: UMPIRE | W292: TEAM | X292: W | Y292: L | Z292: D | AA292: FOR | AB292: AGST | AC292: % | AD292: PTS
A293: PORT MELBOURNE | C293: 3 | D293: 1 | E293: =C293*6+D293 -> 19 | G293: 4 | H293: 3 | I293: =G293*6+H293 -> 27 | K293: 6 | L293: 4 | M293: =K293*6+L293 -> 40 | O293: 8 | P293: 8 | Q293: =O293*6+P293 -> 56 | S293: BYRON
A294: BEST PLAYERS | W294: PORT MELBOURNE | X294: 6 | Y294: 1 | Z294: 0 | AA294: 532 | AB294: 369 | AC294: 144.17344173441734 | AD294: 24
A295: COBURG | D295: CHARLESTON | G295: CHAPMAN | I295: BROOKES | L295: MEARS | O295: FORD | Q295: SPEAKMAN | W295: NORTHCOTE | X295: 6 | Y295: 1 | Z295: 0 | AA295: 489 | AB295: 349 | AC295: 140.11461318051576 | AD295: 24
A296: PORT MELBOURNE | D296: REES | G296: HARVEY | I296: CROMPTON | L296: PERRETT | O296: W RUDD | Q296: SKILTON | W296: COBURG | X296: 6 | Y296: 1 | Z296: 0 | AA296: 540 | AB296: 391 | AC296: 138.10741687979541 | AD296: 24
A297: GOALKICKERS | W297: BRUNSWICK | X297: 4 | Y297: 3 | Z297: 0 | AA297: 460 | AB297: 407 | AC297: 113.02211302211302 | AD297: 16
A298: COBURG | D298: GARDINER 5 | G298: PLANT 3 | J298: FORBES | M298: MEARS
A299: PORT MELBOURNE | D299: REES 4 | G299: SKILTON 2 | J299: HARVEY | M299: LAWSON | W299: PRAHRAN | X299: 4 | Y299: 3 | Z299: 0 | AA299: 536 | AB299: 480 | AC299: 111.66666666666667 | AD299: 16
W300: PRESTON | X300: 3 | Y300: 4 | Z300: 0 | AA300: 537 | AB300: 558 | AC300: 96.236559139784944 | AD300: 12
A301: PRESTON | C301: 9 | D301: 2 | E301: =C301*6+D301 -> 56 | G301: 9 | H301: 3 | I301: =G301*6+H301 -> 57 | K301: 11 | L301: 8 | M301: =K301*6+L301 -> 74 | O301: 13 | P301: 8 | Q301: =O301*6+P301 -> 86 | S301: PRESTON | W301: BRIGHTON | X301: 2 | Y301: 5 | Z301: 0 | AA301: 521 | AB301: 534 | AC301: 97.565543071161045 | AD301: 8
A302: PRAHRAN | C302: 1 | D302: 1 | E302: =C302*6+D302 -> 7 | G302: 7 | H302: 7 | I302: =G302*6+H302 -> 49 | K302: 8 | L302: 9 | M302: =K302*6+L302 -> 57 | O302: 12 | P302: 13 | Q302: =O302*6+P302 -> 85 | S302: BLACKBURN | W302: WILLIAMSTOWN | X302: 2 | Y302: 5 | Z302: 0 | AA302: 377 | AB302: 534 | AC302: 70.599250936329582 | AD302: 8
A303: BEST PLAYERS | W303: GEELONG ASSOC. | X303: 1 | Y303: 6 | Z303: 0 | AA303: 326 | AB303: 413 | AC303: 78.93462469733656 | AD303: 4
A304: PRESTON | D304: A STEVENS | G304: TAYLOR | J304: SEEBECK | M304: SURTEES | P304: WHITE | R304: WARR | W304: CAMBERWELL | X304: 1 | Y304: 6 | Z304: 0 | AA304: 400 | AB304: 683 | AC304: 58.565153733528554 | AD304: 4
A305: PRAHRAN | D305: HARLEY | G305: SPAIN | J305: VANCE | M305: WARD | P305: OSBORNE | R305: B SMITH
A306: GOALKICKERS
A307: PRESTON | D307: A LUDLOW 3 | G307: F LUDLOW 3 | J307: TIMOTHEE 2 | M307: STEVENS | O307: WARR | Q307: LEE | R307: MARMO | U307: SUMMERS
A308: PRAHRAN | D308: HARLEY 4 | G308: B SMITH 3 | I308: GREENING | K308: SPAIN | M308: REA | N308: SHORT | P308: OSBORNE
A310: BRIGHTON | C310: 2 | D310: 4 | E310: =C310*6+D310 -> 16 | G310: 2 | H310: 8 | I310: =G310*6+H310 -> 20 | K310: 6 | L310: 11 | M310: =K310*6+L310 -> 47 | O310: 8 | P310: 16 | Q310: =O310*6+P310 -> 64 | S310: BRUNSWICK
A311: BRUNSWICK | C311: 1 | D311: 1 | E311: =C311*6+D311 -> 7 | G311: 4 | H311: 3 | I311: =G311*6+H311 -> 27 | K311: 5 | L311: 4 | M311: =K311*6+L311 -> 34 | O311: 8 | P311: 6 | Q311: =O311*6+P311 -> 54 | S311: MAKER
A312: BEST PLAYERS
A313: BRIGHTON | D313: KOLLE | G313: ACKERS | J313: ALDRIDGE | M313: RATTRAY | P313: McCARTHY | S313: RINGROSE
A314: BRUNSWICK | D314: HARRIS | G314: RALEIGH | J314: HOLFORD | M314: McMAHON | P314: REICHMAN | S314: FITZGERALD
A315: GOALKICKERS
A316: BRIGHTON | D316: BOYD 2 | F316: WALSH 2 | I316: BESWICK | K316: McCARTHY | N316: RINGROSE | Q316: DORE
A317: BRUNSWICK | D317: PARKER 2 | G317: McINERNEY 2 | J317: REICHMAN | M317: HUMPHREY | P317: BLACKMAN | S317: HART
A319: WILLIAMSTOWN | C319: 1 | D319: 6 | E319: =C319*6+D319 -> 12 | G319: 1 | H319: 8 | I319: =G319*6+H319 -> 14 | K319: 2 | L319: 12 | M319: =K319*6+L319 -> 24 | O319: 5 | P319: 16 | Q319: =O319*6+P319 -> 46 | S319: WILLIAMSTOWN
A320: GEELONG ASSOC. | C320: 2 | D320: 0 | E320: =C320*6+D320 -> 12 | G320: 4 | H320: 3 | I320: =G320*6+H320 -> 27 | K320: 5 | L320: 4 | M320: =K320*6+L320 -> 34 | O320: 6 | P320: 8 | Q320: =O320*6+P320 -> 44 | S320: MURRAY
A321: BEST PLAYERS
A322: WILLIAMSTOWN | D322: JOYCE | F322: CHALMERS | I322: MEEHAN | K322: MUNRO | N322: ANDREWS | Q322: FERGUSON
A323: GEELONG ASSOC. | D323: ELSTON | F323: TAYLOR | I323: KEANE | K323: HARRIS | N323: FARR | Q323: NOONAN
A324: GOALKICKERS
A325: WILLIAMSTOWN | D325: BEER | F325: MARTIN | I325: MUNRO | K325: ANDREWS | N325: KENNY
A326: GEELONG ASSOC. | D326: ELSTON 2 | G326: KEANE | J326: HARRIS | L326: DEAN | N326: FARR
A328: NORTHCOTE | C328: 1 | D328: 2 | E328: =C328*6+D328 -> 8 | G328: 6 | H328: 7 | I328: =G328*6+H328 -> 43 | K328: 9 | L328: 9 | M328: =K328*6+L328 -> 63 | O328: 13 | P328: 11 | Q328: =O328*6+P328 -> 89 | S328: CAMBERWELL
A329: CAMBERWELL | C329: 3 | D329: 1 | E329: =C329*6+D329 -> 19 | G329: 7 | H329: 3 | I329: =G329*6+H329 -> 45 | K329: 8 | L329: 6 | M329: =K329*6+L329 -> 54 | O329: 10 | P329: 7 | Q329: =O329*6+P329 -> 67 | S329: PETERS
A330: BEST PLAYERS
A331: NORTHCOTE | D331: JUDKINS | G331: GOUGH | I331: PERKINS | L331: LONG | N331: ROGAN | Q331: NEWMAN
A332: CAMBERWELL | D332: GREENBURY | G332: RAWLE | I332: HARRISON | L332: WHITECROSS | O332: ELLIOTT | Q332: KARTHAUS
A333: GOALKICKERS
A334: NORTHCOTE | D334: GOUGH 8 | G334: PERKINS 2 | J334: VOLK | L334: GOODRICK | O334: DESLANDES
A335: CAMBERWELL | D335: WOODFORD 3 | G335: CLARKE 3 | J335: ELLIOTT | L335: RAWLE | N335: McKERNAN | Q335: JACKSON
A337: ROUND 8 | E337: 19TH JUNE | J337: WEATHER | M337: FINE NORTH BREEZE | S337: PLAYED AT | X337: LADDER | AB337: ROUND | AD337: 8
D338: 1ST QTR | H338: 2ND QTR | L338: 3RD QTR | P338: FINAL | S338: NORTHCOTE
A339: NORTHCOTE | C339: 3 | D339: 3 | E339: =C339*6+D339 -> 21 | G339: 5 | H339: 6 | I339: =G339*6+H339 -> 36 | K339: 7 | L339: 11 | M339: =K339*6+L339 -> 53 | O339: 8 | P339: 16 | Q339: =O339*6+P339 -> 64 | S339: UMPIRE | W339: TEAM | X339: W | Y339: L | Z339: D | AA339: FOR | AB339: AGST | AC339: % | AD339: PTS
A340: PRAHRAN | C340: 0 | D340: 2 | E340: =C340*6+D340 -> 2 | G340: 3 | H340: 4 | I340: =G340*6+H340 -> 22 | K340: 5 | L340: 7 | M340: =K340*6+L340 -> 37 | O340: 8 | P340: 7 | Q340: =O340*6+P340 -> 55 | S340: BYRON
A341: BEST PLAYERS | W341: COBURG | X341: 7 | Y341: 1 | Z341: 0 | AA341: 661 | AB341: 440 | AC341: 150.22727272727272 | AD341: 28
A342: NORTHCOTE | D342: GOODRICK | G342: JUDKINS | I342: LEAKE | L342: T DOWNES | O342: SHEEHY | Q342: LONG | W342: NORTHCOTE | X342: 7 | Y342: 1 | Z342: 0 | AA342: 553 | AB342: 404 | AC342: 136.88118811881188 | AD342: 28
A343: PRAHRAN | D343: E JONES | G343: SHORT | I343: REA | L343: HARLEY | O343: OSBORNE | Q343: V JONES | W343: PORT MELBOURNE | X343: 6 | Y343: 2 | Z343: 0 | AA343: 591 | AB343: 430 | AC343: 137.44186046511629 | AD343: 24
A344: GOALKICKERS | W344: BRUNSWICK | X344: 5 | Y344: 3 | Z344: 0 | AA344: 551 | AB344: 461 | AC344: 119.52277657266811 | AD344: 20
A345: NORTHCOTE | D345: GOODRICK 2 | G345: VOLK 2 | I345: GOUGH | K345: THEOBOLD | N345: DOLLOFFSKY | Q345: PERKINS
A346: PRAHRAN | D346: HARLEY 5 | G346: SPAIN 2 | I346: WEATHERALL | W346: PRAHRAN | X346: 4 | Y346: 4 | Z346: 0 | AA346: 591 | AB346: 544 | AC346: 108.63970588235294 | AD346: 16
W347: PRESTON | X347: 4 | Y347: 4 | Z347: 0 | AA347: 612 | AB347: 627 | AC347: 97.607655502392348 | AD347: 16
A348: BRIGHTON | C348: 0 | D348: 0 | E348: =C348*6+D348 -> 0 | G348: 1 | H348: 5 | I348: =G348*6+H348 -> 11 | K348: 4 | L348: 9 | M348: =K348*6+L348 -> 33 | O348: 8 | P348: 13 | Q348: =O348*6+P348 -> 61 | S348: BRIGHTON BEACH | W348: BRIGHTON | X348: 3 | Y348: 5 | Z348: 0 | AA348: 582 | AB348: 593 | AC348: 98.145025295109619 | AD348: 12
A349: PORT MELBOURNE | C349: 2 | D349: 4 | E349: =C349*6+D349 -> 16 | G349: 5 | H349: 7 | I349: =G349*6+H349 -> 37 | K349: 6 | L349: 10 | M349: =K349*6+L349 -> 46 | O349: 8 | P349: 11 | Q349: =O349*6+P349 -> 59 | S349: PATTISON | W349: WILLIAMSTOWN | X349: 2 | Y349: 6 | Z349: 0 | AA349: 446 | AB349: 609 | AC349: 73.234811165845642 | AD349: 8
A350: BEST PLAYERS | W350: GEELONG ASSOC. | X350: 1 | Y350: 7 | Z350: 0 | AA350: 375 | AB350: 534 | AC350: 70.224719101123597 | AD350: 4
A351: BRIGHTON | D351: ALDRIDGE | G351: BOYD | I351: RINGROSE | L351: ATKINSON | O351: RATTRAY | Q351: KOLLE | W351: CAMBERWELL | X351: 1 | Y351: 7 | Z351: 0 | AA351: 454 | AB351: 774 | AC351: 58.656330749354005 | AD351: 4
A352: PORT MELBOURNE | D352: REES | G352: PERRETT | I352: FARNAN | L352: CARPENTER | O352: MORRIS | Q352: SKILTON
A353: GOALKICKERS
A354: BRIGHTON | D354: BOYD 2 | F354: RINGROSE 2 | I354: RATTRAY | K354: WALSH | M354: FRIEND | O354: BESWICK
A355: PORT MELBOURNE | D355: MORRIS 3 | G355: REES | I355: CAREY | K355: SKILTON | M355: LAWSON | O355: MURPHY
A357: PRESTON | C357: 2 | D357: 2 | E357: =C357*6+D357 -> 14 | G357: 7 | H357: 11 | I357: =G357*6+H357 -> 53 | K357: 7 | L357: 12 | M357: =K357*6+L357 -> 54 | O357: 10 | P357: 15 | Q357: =O357*6+P357 -> 75 | S357: WILLIAMSTOWN
A358: WILLIAMSTOWN | C358: 4 | D358: 5 | E358: =C358*6+D358 -> 29 | G358: 5 | H358: 5 | I358: =G358*6+H358 -> 35 | K358: 7 | L358: 7 | M358: =K358*6+L358 -> 49 | O358: 10 | P358: 9 | Q358: =O358*6+P358 -> 69 | S358: MURRAY
A359: BEST PLAYERS
A360: PRESTON | D360: DOBRIGH | G360: WATT | J360: WHITE | M360: TAYLOR | P360: A LUDLOW | S360: F LUDLOW
A361: WILLIAMSTOWN | D361: J MUNN | G361: RIGALDI | J361: GEISLER | M361: MARTIN | P361: CHALMERS | S361: MUNRO
A362: GOALKICKERS
A363: PRESTON | D363: F LUDLOW 3 | G363: A LUDLOW 2 | J363: MARMO 2 | M363: MUIR | O363: HUME | Q363: SEEBECK
A364: WILLIAMSTOWN | D364: RIGALDI 4 | G364: MUNRO 2 | J364: McKELLIN 2 | M364: MARTIN | O364: KENNY
A366: BRUNSWICK | C366: 5 | D366: 1 | E366: =C366*6+D366 -> 31 | G366: 10 | H366: 1 | I366: =G366*6+H366 -> 61 | K366: 13 | L366: 5 | M366: =K366*6+L366 -> 83 | O366: 14 | P366: 7 | Q366: =O366*6+P366 -> 91 | S366: BRUNSWICK
A367: CAMBERWELL | C367: 1 | D367: 1 | E367: =C367*6+D367 -> 7 | G367: 5 | H367: 8 | I367: =G367*6+H367 -> 38 | K367: 5 | L367: 11 | M367: =K367*6+L367 -> 41 | O367: 7 | P367: 12 | Q367: =O367*6+P367 -> 54 | S367: BLACKBURN
A368: BEST PLAYERS
A369: BRUNSWICK | D369: BOLS | G369: KENNETT | J369: McINERNEY | M369: ALESSIO | P369: KEDDIE | S369: HART
A370: CAMBERWELL | D370: PARRIS | G370: McKERNAN | J370: WHITECROSS | M370: GREENBURY | P370: SEIDEL | S370: ELLIOTT
A371: GOALKICKERS
A372: BRUNSWICK | D372: McINERNEY 9 | G372: CURTIS 2 | J372: PARKER | L372: ALESSIO | N372: O'CONNOR
A373: CAMBERWELL | D373: WHITECROSS 3 | H373: CLARKE | J373: WOODFORD | M373: R WRIGHT | O373: CONNOP
A375: COBURG | C375: 7 | D375: 5 | E375: =C375*6+D375 -> 47 | G375: 11 | H375: 5 | I375: =G375*6+H375 -> 71 | K375: 11 | L375: 9 | M375: =K375*6+L375 -> 75 | O375: 18 | P375: 13 | Q375: =O375*6+P375 -> 121 | S375: GEE WEST
A376: GEELONG ASSOC. | C376: 0 | D376: 2 | E376: =C376*6+D376 -> 2 | G376: 3 | H376: 10 | I376: =G376*6+H376 -> 28 | K376: 5 | L376: 13 | M376: =K376*6+L376 -> 43 | O376: 6 | P376: 13 | Q376: =O376*6+P376 -> 49 | S376: LESTER
A377: BEST PLAYERS
A378: COBURG | D378: KERLEY | G378: JENKINS | J378: SPEAKMAN | M378: GARDINER | P378: MARTIN | S378: PLANT
A379: GEELONG ASSOC. | D379: TAYLOR | G379: NOONAN | J379: HARRIS | M379: ELSTON | P379: CATIONS | S379: POWELL
A380: GOALKICKERS
A381: COBURG | D381: PLANT 6 | G381: GARDINER 4 | J381: JENKINS 3 | M381: KERLEY 2 | O381: FORBES 2 | Q381: SPEAKMAN
A382: GEELONG ASSOC. | D382: NOONAN 3 | G382: COLEMAN | J382: STAGGARD | M382: DAVIS
A384: ROUND 9 | E384: 26TH JUNE | J384: WEATHER | M384: COLD RAIN | S384: PLAYED AT | X384: LADDER | AB384: ROUND | AD384: 9
D385: 1ST QTR | H385: 2ND QTR | L385: 3RD QTR | P385: FINAL | S385: PORT MELBOURNE
A386: NORTHCOTE | C386: 1 | D386: 3 | E386: =C386*6+D386 -> 9 | G386: 3 | H386: 6 | I386: =G386*6+H386 -> 24 | K386: 3 | L386: 6 | M386: =K386*6+L386 -> 24 | O386: 7 | P386: 7 | Q386: =O386*6+P386 -> 49 | S386: UMPIRE | W386: TEAM | X386: W | Y386: L | Z386: D | AA386: FOR | AB386: AGST | AC386: % | AD386: PTS
A387: PORT MELBOURNE | C387: 1 | D387: 2 | E387: =C387*6+D387 -> 8 | G387: 5 | H387: 5 | I387: =G387*6+H387 -> 35 | K387: 5 | L387: 9 | M387: =K387*6+L387 -> 39 | O387: 5 | P387: 13 | Q387: =O387*6+P387 -> 43 | S387: MAKER
A388: BEST PLAYERS | W388: COBURG | X388: 8 | Y388: 1 | Z388: 0 | AA388: 816 | AB388: 501 | AC388: 162.87425149700599 | AD388: 32
A389: NORTHCOTE | D389: T DOWNES | G389: SHEEHY | I389: LAFFEY | K389: GOUGH | N389: LEAKE | Q389: JUDKINS | W389: NORTHCOTE | X389: 8 | Y389: 1 | Z389: 0 | AA389: 602 | AB389: 447 | AC389: 134.67561521252796 | AD389: 32
A390: PORT MELBOURNE | D390: PERRETT | G390: LOVETT | I390: GARBUTT | K390: SKILTON | N390: CARPENTER | Q390: HARVEY | W390: PORT MELBOURNE | X390: 6 | Y390: 3 | Z390: 0 | AA390: 634 | AB390: 479 | AC390: 132.3590814196242 | AD390: 24
A391: GOALKICKERS | W391: BRUNSWICK | X391: 6 | Y391: 3 | Z391: 0 | AA391: 625 | AB391: 523 | AC391: 119.50286806883365 | AD391: 24
A392: NORTHCOTE | D392: LEAKE 2 | G392: GOUGH 2 | I392: SHEEHY | K392: GOODRICK | M392: DOLLOFFSKY
A393: PORT MELBOURNE | D393: W JOHNSTONE 2 | H393: MORRIS | J393: REES | L393: CARPENTER | W393: BRIGHTON | X393: 4 | Y393: 5 | Z393: 0 | AA393: 675 | AB393: 661 | AC393: 102.11800302571861 | AD393: 16
W394: PRESTON | X394: 4 | Y394: 5 | Z394: 0 | AA394: 674 | AB394: 701 | AC394: 96.14835948644793 | AD394: 16
A395: BRUNSWICK | C395: 1 | D395: 5 | E395: =C395*6+D395 -> 11 | G395: 3 | H395: 7 | I395: =G395*6+H395 -> 25 | K395: 7 | L395: 11 | M395: =K395*6+L395 -> 53 | O395: 10 | P395: 14 | Q395: =O395*6+P395 -> 74 | S395: BRUNSWICK | W395: PRAHRAN | X395: 4 | Y395: 5 | Z395: 0 | AA395: 652 | AB395: 699 | AC395: 93.276108726752497 | AD395: 16
A396: PRESTON | C396: 2 | D396: 1 | E396: =C396*6+D396 -> 13 | G396: 3 | H396: 1 | I396: =G396*6+H396 -> 19 | K396: 6 | L396: 2 | M396: =K396*6+L396 -> 38 | O396: 10 | P396: 2 | Q396: =O396*6+P396 -> 62 | S396: BLACKBURN | W396: WILLIAMSTOWN | X396: 2 | Y396: 7 | Z396: 0 | AA396: 495 | AB396: 703 | AC396: 70.412517780938828 | AD396: 8
A397: BEST PLAYERS | W397: CAMBERWELL | X397: 2 | Y397: 7 | Z397: 0 | AA397: 548 | AB397: 823 | AC397: 66.585662211421635 | AD397: 8
A398: BRUNSWICK | D398: BOLS | G398: ALESSIO | I398: RAYMOND | L398: REICHMAN | O398: HARRIS | Q398: EWINS | W398: GEELONG ASSOC. | X398: 1 | Y398: 8 | Z398: 0 | AA398: 443 | AB398: 627 | AC398: 70.653907496012764 | AD398: 4
A399: PRESTON | D399: WHITE | G399: WATT | I399: DOBRIGH | L399: F LUDLOW | O399: TAYLOR | Q399: ROBERTSON
A400: GOALKICKERS
A401: BRUNSWICK | D401: McINERNEY 5 | G401: RAYMOND 2 | J401: RALEIGH | M401: ALESSIO | O401: RAYMOND
A402: PRESTON | D402: F LUDLOW 4 | G402: WARR 2 | J402: WATT | L402: HUME | N402: MUIR | P402: SEEBECK
A404: COBURG | C404: 8 | D404: 2 | E404: =C404*6+D404 -> 50 | G404: 14 | H404: 9 | I404: =G404*6+H404 -> 93 | K404: 17 | L404: 15 | M404: =K404*6+L404 -> 117 | O404: 23 | P404: 17 | Q404: =O404*6+P404 -> 155 | S404: TOORAK PARK
A405: PRAHRAN | C405: 2 | D405: 0 | E405: =C405*6+D405 -> 12 | G405: 5 | H405: 1 | I405: =G405*6+H405 -> 31 | K405: 6 | L405: 3 | M405: =K405*6+L405 -> 39 | O405: 9 | P405: 7 | Q405: =O405*6+P405 -> 61 | S405: MACHAR
A406: BEST PLAYERS
A407: COBURG | D407: C MARTYN | G407: GARDINER | J407: MEARS | L407: SPEAKMAN | O407: KERLEY | R407: FORBES
A408: PRAHRAN | D408: HARLEY | G408: PROCTOR | J408: V JONES | L408: E JONES | O408: OSBORNE | R408: REA
A409: GOALKICKERS
A410: COBURG | D410: GARDINER 9 | G410: PLANT 4 | I410: FORBES 4 | K410: KERLEY 2 | M410: MEARS | O410: SPEAKMAN | R410: MARTIN | U410: JENKINS
A411: PRAHRAN | D411: HARLEY 6 | G411: SNELL | J411: RUSSELL | M411: B SMITH
A413: CAMBERWELL | C413: 5 | D413: 4 | E413: =C413*6+D413 -> 34 | G413: 6 | H413: 7 | I413: =G413*6+H413 -> 43 | K413: 11 | L413: 9 | M413: =K413*6+L413 -> 75 | O413: 14 | P413: 10 | Q413: =O413*6+P413 -> 94 | S413: CAMBERWELL
A414: WILLIAMSTOWN | C414: 2 | D414: 4 | E414: =C414*6+D414 -> 16 | G414: 2 | H414: 8 | I414: =G414*6+H414 -> 20 | K414: 4 | L414: 8 | M414: =K414*6+L414 -> 32 | O414: 6 | P414: 13 | Q414: =O414*6+P414 -> 49 | S414: LESTER
A415: BEST PLAYERS
A416: CAMBERWELL | D416: CONNOP | G416: ELLIMAN | J416: HARRISON | M416: SEIDEL | O416: KARTHAUS | R416: PARRIS
A417: WILLIAMSTOWN | D417: MUNRO | G417: MEEHAN | J417: BEER | M417: MARTIN | O417: MCKELLIN | R417: JOHNS
A418: GOALKICKERS
A419: CAMBERWELL | D419: CONNOP 7 | G419: OWEN 3 | I419: WOODFORD 2 | L419: GREENSMITH 2
A420: WILLIAMSTOWN | D420: BARNETT 3 | G420: BEER | I420: MARTIN | K420: JOHNS
A422: BRIGHTON | C422: 1 | D422: 1 | E422: =C422*6+D422 -> 7 | G422: 4 | H422: 2 | I422: =G422*6+H422 -> 26 | K422: 8 | L422: 4 | M422: =K422*6+L422 -> 52 | O422: 14 | P422: 9 | Q422: =O422*6+P422 -> 93 | S422: BRIGHTON BEACH
A423: GEELONG ASSOC. | C423: 2 | D423: 6 | E423: =C423*6+D423 -> 18 | G423: 3 | H423: 9 | I423: =G423*6+H423 -> 27 | K423: 9 | L423: 13 | M423: =K423*6+L423 -> 67 | O423: 9 | P423: 14 | Q423: =O423*6+P423 -> 68 | S423: MURRAY
A424: BEST PLAYERS
A425: BRIGHTON | D425: WALSH | G425: ACKERS | J425: ALDRIDGE | M425: L BOYD | P425: RATTRAY | S425: ATKINSON
A426: GEELONG ASSOC. | D426: CATIONS | G426: DEAN | J426: TAYLOR | M426: ELSTON | P426: FARR | S426: JOHNSON
A427: GOALKICKERS
A428: BRIGHTON | D428: WALSH 9 | G428: BOYD 2 | I428: HUNT | K428: BESWICK | M428: ALDRIDGE
A429: GEELONG ASSOC. | D429: ARMSTRONG 3 | G429: DEAN 2 | I429: NOONAN | K429: FARR | M429: KEANE | O429: JOHNSON
A431: ROUND 10 | E431: 3RD JULY | J431: WEATHER | M431: FINE CLOUDY | S431: PLAYED AT | X431: LADDER | AB431: ROUND | AD431: 10
D432: 1ST QTR | H432: 2ND QTR | L432: 3RD QTR | P432: FINAL | S432: BRUNSWICK
A433: BRUNSWICK | C433: 0 | D433: 0 | E433: =C433*6+D433 -> 0 | G433: 5 | H433: 2 | I433: =G433*6+H433 -> 32 | K433: 6 | L433: 4 | M433: =K433*6+L433 -> 40 | O433: 7 | P433: 7 | Q433: =O433*6+P433 -> 49 | S433: UMPIRE | W433: TEAM | X433: W | Y433: L | Z433: D | AA433: FOR | AB433: AGST | AC433: % | AD433: PTS
A434: NORTHCOTE | C434: 1 | D434: 5 | E434: =C434*6+D434 -> 11 | G434: 2 | H434: 6 | I434: =G434*6+H434 -> 18 | K434: 3 | L434: 9 | M434: =K434*6+L434 -> 27 | O434: 4 | P434: 10 | Q434: =O434*6+P434 -> 34 | S434: LESTER
A435: BEST PLAYERS | W435: COBURG | X435: 9 | Y435: 1 | Z435: 0 | AA435: 939 | AB435: 527 | AC435: 178.17836812144213 | AD435: 36
A436: BRUNSWICK | D436: McMAHON | G436: HASSETT | I436: McINERNEY | L436: RAYMOND | O436: BOLS | Q436: RALEIGH | W436: NORTHCOTE | X436: 8 | Y436: 2 | Z436: 0 | AA436: 636 | AB436: 496 | AC436: 128.2258064516129 | AD436: 32
A437: NORTHCOTE | D437: THEODORE | G437: LEAKE | I437: JUDKINS | L437: T DOWNES | O437: H SMITH | Q437: GOODRICK | W437: PORT MELBOURNE | X437: 7 | Y437: 3 | Z437: 0 | AA437: 734 | AB437: 545 | AC437: 134.67889908256882 | AD437: 28
A438: GOALKICKERS | W438: BRUNSWICK | X438: 7 | Y438: 3 | Z438: 0 | AA438: 674 | AB438: 557 | AC438: 121.00538599640933 | AD438: 28
A439: BRUNSWICK | D439: McINERNEY 3 | G439: RAYMOND 2 | J439: HASSETT | M439: REICHMAN
A440: NORTHCOTE | D440: GOUGH 2 | G440: LEAKE | I440: GOODRICK | W440: BRIGHTON | X440: 5 | Y440: 5 | Z440: 0 | AA440: 751 | AB440: 729 | AC440: 103.01783264746227 | AD440: 20
W441: PRESTON | X441: 5 | Y441: 5 | Z441: 0 | AA441: 757 | AB441: 755 | AC441: 100.26490066225166 | AD441: 20
A442: PORT MELBOURNE | C442: 6 | D442: 2 | E442: =C442*6+D442 -> 38 | G442: 11 | H442: 5 | I442: =G442*6+H442 -> 71 | K442: 14 | L442: 8 | M442: =K442*6+L442 -> 92 | O442: 15 | P442: 10 | Q442: =O442*6+P442 -> 100 | S442: PORT MELBOURNE | W442: PRAHRAN | X442: 4 | Y442: 6 | Z442: 0 | AA442: 718 | AB442: 799 | AC442: 89.862327909887355 | AD442: 16
A443: PRAHRAN | C443: 2 | D443: 0 | E443: =C443*6+D443 -> 12 | G443: 2 | H443: 0 | I443: =G443*6+H443 -> 12 | K443: 8 | L443: 1 | M443: =K443*6+L443 -> 49 | O443: 10 | P443: 6 | Q443: =O443*6+P443 -> 66 | S443: BLACKBURN | W443: CAMBERWELL | X443: 2 | Y443: 8 | Z443: 0 | AA443: 616 | AB443: 899 | AC443: 68.520578420467189 | AD443: 8
A444: BEST PLAYERS | W444: WILLIAMSTOWN | X444: 2 | Y444: 8 | Z444: 0 | AA444: 521 | AB444: 826 | AC444: 63.075060532687651 | AD444: 8
A445: PORT MELBOURNE | D445: W RUDD | G445: REES | I445: MERRICK | L445: SLOLEY | N445: LOVETT | Q445: SCANLON | W445: GEELONG ASSOC. | X445: 1 | Y445: 9 | Z445: 0 | AA445: 497 | AB445: 710 | AC445: 70 | AD445: 4
A446: PRAHRAN | D446: McLEOD | G446: RUSSELL | I446: RICHARDSON | L446: SEACH | N446: B SMITH | Q446: SPAIN
A447: GOALKICKERS
A448: PORT MELBOURNE | D448: MERRICK 7 | G448: CARPENTER 3 | J448: SCANLON 2 | M448: SLOLEY | O448: STYLES | Q448: PERRETT
A449: PRAHRAN | D449: HARLEY 4 | G449: SNELL 2 | J449: B SMITH | M449: FULLING | O449: RICHARDSON | R449: ROWE
A451: BRIGHTON | C451: 2 | D451: 3 | E451: =C451*6+D451 -> 15 | G451: 6 | H451: 3 | I451: =G451*6+H451 -> 39 | K451: 8 | L451: 11 | M451: =K451*6+L451 -> 59 | O451: 10 | P451: 16 | Q451: =O451*6+P451 -> 76 | S451: BRIGHTON BEACH
A452: CAMBERWELL | C452: 4 | D452: 1 | E452: =C452*6+D452 -> 25 | G452: 6 | H452: 4 | I452: =G452*6+H452 -> 40 | K452: 9 | L452: 6 | M452: =K452*6+L452 -> 60 | O452: 10 | P452: 8 | Q452: =O452*6+P452 -> 68 | S452: MAKER
A453: BEST PLAYERS
A454: BRIGHTON | D454: CARROLL | G454: LYNCH | J454: BOYD | M454: RATTRAY | P454: DORE | S454: BESWICK
A455: CAMBERWELL | D455: ELLIMAN | G455: KARTHAUS | J455: TRESIZE | M455: OWEN | P455: ELLIOTT | S455: WOODFORD
A456: GOALKICKERS
A457: BRIGHTON | D457: WALSH 5 | G457: BOYD 4 | I457: RINGROSE
A458: CAMBERWELL | D458: WOODFORD 5 | G458: OWEN | I458: WRIGHT | K458: WHITECROSS | N458: ELLIMAN | Q458: TRESIZE
A460: PRESTON | C460: 5 | D460: 3 | E460: =C460*6+D460 -> 33 | G460: 8 | H460: 5 | I460: =G460*6+H460 -> 53 | K460: 10 | L460: 8 | M460: =K460*6+L460 -> 68 | O460: 12 | P460: 11 | Q460: =O460*6+P460 -> 83 | S460: KARDINIA PARK
A461: GEELONG ASSOC. | C461: 4 | D461: 3 | E461: =C461*6+D461 -> 27 | G461: 6 | H461: 7 | I461: =G461*6+H461 -> 43 | K461: 6 | L461: 9 | M461: =K461*6+L461 -> 45 | O461: 7 | P461: 12 | Q461: =O461*6+P461 -> 54 | S461: MACHAR
A462: BEST PLAYERS
A463: PRESTON | D463: F LUDLOW | G463: STEVENS | J463: WATT | M463: DOBRIGH | P463: SURTEES | S463: HUME
A464: GEELONG ASSOC. | D464: TAYLOR | G464: ELSTON | J464: J McINERNEY | M464: CATIONS | P464: MACK | S464: DEAN
A465: GOALKICKERS
A466: PRESTON | D466: HUME 4 | F466: F LUDLOW 3 | I466: T STEVENS 2 | L466: SUMMERS | N466: SKIPPER | P466: A STEVENS
A467: GEELONG ASSOC. | D467: NOONAN 2 | G467: ARMSTRONG 2 | J467: ELSTON | L467: KEANE | N467: DEAN
A469: COBURG | C469: 4 | D469: 6 | E469: =C469*6+D469 -> 30 | G469: 9 | H469: 13 | I469: =G469*6+H469 -> 67 | K469: 13 | L469: 17 | M469: =K469*6+L469 -> 95 | O469: 17 | P469: 21 | Q469: =O469*6+P469 -> 123 | S469: COBURG
A470: WILLIAMSTOWN | C470: 1 | D470: 2 | E470: =C470*6+D470 -> 8 | G470: 2 | H470: 4 | I470: =G470*6+H470 -> 16 | K470: 2 | L470: 8 | M470: =K470*6+L470 -> 20 | O470: 3 | P470: 8 | Q470: =O470*6+P470 -> 26 | S470: MURRAY
A471: BEST PLAYERS
A472: COBURG | D472: PLANT | G472: KERLEY | J472: GARDINER | M472: FORBES | P472: MEARS | S472: SPEAKMAN
A473: WILLIAMSTOWN | D473: J MUNN | G473: MUNRO | J473: BEER | M473: BALL | P473: MARTIN | S473: JOHNS
A474: GOALKICKERS
A475: COBURG | D475: PLANT 7 | F475: GARDINER 3 | I475: KERLEY 2 | K475: FORBES 2 | M475: MEARS | O475: BROOKES | Q475: CHAPMAN
A476: WILLIAMSTOWN | D476: J MUNN 2 | G476: BEER
A478: ROUND 11 | E478: 10TH JULY | J478: WEATHER | M478: FINE NORTH BREEZE | S478: PLAYED AT | X478: LADDER | AB478: ROUND | AD478: 11
D479: 1ST QTR | H479: 2ND QTR | L479: 3RD QTR | P479: FINAL | S479: PRESTON
A480: PRESTON | C480: 4 | D480: 2 | E480: =C480*6+D480 -> 26 | G480: 5 | H480: 4 | I480: =G480*6+H480 -> 34 | K480: 10 | L480: 6 | M480: =K480*6+L480 -> 66 | O480: 14 | P480: 8 | Q480: =O480*6+P480 -> 92 | S480: UMPIRE | W480: TEAM | X480: W | Y480: L | Z480: D | AA480: FOR | AB480: AGST | AC480: % | AD480: PTS
A481: PORT MELBOURNE | C481: 4 | D481: 3 | E481: =C481*6+D481 -> 27 | G481: 8 | H481: 5 | I481: =G481*6+H481 -> 53 | K481: 9 | L481: 8 | M481: =K481*6+L481 -> 62 | O481: 10 | P481: 13 | Q481: =O481*6+P481 -> 73 | S481: MURRAY
A482: BEST PLAYERS | W482: COBURG | X482: 10 | Y482: 1 | Z482: 0 | AA482: 1033 | AB482: 591 | AC482: 174.78849407783417 | AD482: 40
A483: PRESTON | D483: A STEVENS | G483: WARR | I483: SEEBECK | L483: WATT | N483: WHITE | Q483: DOBRIGH | W483: NORTHCOTE | X483: 9 | Y483: 2 | Z483: 0 | AA483: 692 | AB483: 546 | AC483: 126.73992673992674 | AD483: 36
A484: PORT MELBOURNE | D484: GARBUTT | G484: MERRICK | I484: FARNAN | L484: LOVETT | N484: HARVEY | Q484: PERRETT | W484: BRUNSWICK | X484: 8 | Y484: 3 | Z484: 0 | AA484: 752 | AB484: 587 | AC484: 128.10902896081771 | AD484: 32
A485: GOALKICKERS | W485: PORT MELBOURNE | X485: 7 | Y485: 4 | Z485: 0 | AA485: 807 | AB485: 637 | AC485: 126.68759811616954 | AD485: 28
A486: PRESTON | D486: A STEVENS 3 | G486: WARR 3 | I486: A LUDLOW 2 | L486: T STEVENS 2 | O486: F LUDLOW 2 | R486: HUME | T486: SUMMERS
A487: PORT MELBOURNE | D487: MERRICK 5 | G487: MORRIS 2 | I487: SKILTON | K487: GARBUTT | M487: SCANLON | W487: BRIGHTON | X487: 6 | Y487: 5 | Z487: 0 | AA487: 842 | AB487: 811 | AC487: 103.82244143033292 | AD487: 24
W488: PRESTON | X488: 6 | Y488: 5 | Z488: 0 | AA488: 849 | AB488: 828 | AC488: 102.53623188405797 | AD488: 24
A489: BRIGHTON | C489: 3 | D489: 3 | E489: =C489*6+D489 -> 21 | G489: 6 | H489: 4 | I489: =G489*6+H489 -> 40 | K489: 10 | L489: 6 | M489: =K489*6+L489 -> 66 | O489: 13 | P489: 13 | Q489: =O489*6+P489 -> 91 | S489: TOORAK PARK | W489: PRAHRAN | X489: 4 | Y489: 7 | Z489: 0 | AA489: 800 | AB489: 890 | AC489: 89.887640449438209 | AD489: 16
A490: PRAHRAN | C490: 2 | D490: 2 | E490: =C490*6+D490 -> 14 | G490: 7 | H490: 7 | I490: =G490*6+H490 -> 49 | K490: 12 | L490: 8 | M490: =K490*6+L490 -> 80 | O490: 12 | P490: 10 | Q490: =O490*6+P490 -> 82 | S490: MACHAR | W490: CAMBERWELL | X490: 2 | Y490: 9 | Z490: 0 | AA490: 680 | AB490: 993 | AC490: 68.479355488418932 | AD490: 8
A491: BEST PLAYERS | W491: WILLIAMSTOWN | X491: 2 | Y491: 9 | Z491: 0 | AA491: 551 | AB491: 904 | AC491: 60.951327433628322 | AD491: 8
A492: BRIGHTON | D492: DAINTY | G492: BOYD | I492: GARCIA | L492: CARROLL | O492: MITCHELL | R492: DORE | W492: GEELONG ASSOC. | X492: 1 | Y492: 10 | Z492: 0 | AA492: 547 | AB492: 766 | AC492: 71.409921671018282 | AD492: 4
A493: PRAHRAN | D493: OSBORNE | G493: SPAIN | I493: NAYLOR | L493: V JONES | O493: SEACH | R493: E JONES
A494: GOALKICKERS
A495: BRIGHTON | D495: WALSH 4 | G495: BOYD 3 | I495: DAINTY 2 | K495: MAINE 2 | M495: DORE | O495: MITCHELL
A496: PRAHRAN | D496: V JONES 3 | F496: FULLING 2 | I496: NAYLOR 2 | K496: HARLEY | M496: PROCTOR | O496: B SMITH | Q496: RICHARDSON | T496: SNELL
A498: COBURG | C498: 3 | D498: 5 | E498: =C498*6+D498 -> 23 | G498: 6 | H498: 7 | I498: =G498*6+H498 -> 43 | K498: 11 | L498: 16 | M498: =K498*6+L498 -> 82 | O498: 13 | P498: 16 | Q498: =O498*6+P498 -> 94 | S498: CAMBERWELL
A499: CAMBERWELL | C499: 1 | D499: 2 | E499: =C499*6+D499 -> 8 | G499: 4 | H499: 7 | I499: =G499*6+H499 -> 31 | K499: 5 | L499: 8 | M499: =K499*6+L499 -> 38 | O499: 9 | P499: 10 | Q499: =O499*6+P499 -> 64 | S499: BYRON
A500: BEST PLAYERS
A501: COBURG | D501: C MARTYN | G501: FORD | J501: CHAPMAN | M501: KERLEY | P501: CHARLESTON | S501: FAUST
A502: CAMBERWELL | D502: PARRIS | G502: KARTHAUS | J502: PRICE | M502: SEIDEL | P502: ELLIOTT | S502: OWEN
A503: GOALKICKERS | S503: NORTHCOTE
A504: COBURG | D504: PLANT 3 | G504: KERLEY 3 | I504: GARDINER 3 | L504: MEARS 2 | N504: SPEAKMAN | Q504: CHARLESTON
A505: CAMBERWELL | D505: WOODFORD 2 | G505: RAWLE 2 | I505: OWEN 2 | K505: GREENBURY | N505: WHITECROSS | Q505: ELLIMAN
A507: BRUNSWICK | C507: 2 | D507: 2 | E507: =C507*6+D507 -> 14 | G507: 4 | H507: 10 | I507: =G507*6+H507 -> 34 | K507: 9 | L507: 10 | M507: =K507*6+L507 -> 64 | O507: 11 | P507: 12 | Q507: =O507*6+P507 -> 78 | S507: WILLIAMSTOWN
A508: WILLIAMSTOWN | C508: 1 | D508: 2 | E508: =C508*6+D508 -> 8 | G508: 2 | H508: 2 | I508: =G508*6+H508 -> 14 | K508: 4 | L508: 4 | M508: =K508*6+L508 -> 28 | O508: 4 | P508: 6 | Q508: =O508*6+P508 -> 30 | S508: MAKER
A509: BEST PLAYERS
A510: BRUNSWICK | D510: PARKER | G510: HART | J510: BRIGHT | M510: REID | P510: BOURKE | S510: MILLER
A511: WILLIAMSTOWN | D511: MUNRO | G511: MARTIN | J511: MATHER | M511: GEISLER | P511: J MUNN | S511: McKELLIN
A512: GOALKICKERS
A513: BRUNSWICK | D513: PARKER 3 | G513: MILLER 3 | J513: HASSETT 2 | M513: RAYMOND | P513: BOURKE | R513: HART
A514: WILLIAMSTOWN | D514: MARTIN 2 | G514: MATHER | J514: MUNRO
A516: NORTHCOTE | C516: 3 | D516: 4 | E516: =C516*6+D516 -> 22 | G516: 3 | H516: 8 | I516: =G516*6+H516 -> 26 | K516: 5 | L516: 12 | M516: =K516*6+L516 -> 42 | O516: 7 | P516: 14 | Q516: =O516*6+P516 -> 56 | S516: NORTHCOTE
A517: GEELONG ASSOC. | C517: 0 | D517: 2 | E517: =C517*6+D517 -> 2 | G517: 3 | H517: 5 | I517: =G517*6+H517 -> 23 | K517: 4 | L517: 9 | M517: =K517*6+L517 -> 33 | O517: 6 | P517: 14 | Q517: =O517*6+P517 -> 50 | S517: LESTER
A518: BEST PLAYERS
A519: NORTHCOTE | D519: DOLLOFFSKY | G519: PERKINS | J519: ROGAN | M519: GOODRICK | P519: JUDKINS | S519: LONG
A520: GEELONG ASSOC. | D520: TAYLOR | G520: CATIONS | J520: POWELL | M520: ARMSTRONG | P520: FARRELLY | S520: DEAN
A521: GOALKICKERS
A522: NORTHCOTE | D522: DOLLOFFSKY 3 | H522: T DOWNES | K522: HARRIS | N522: GOODRICK | Q522: LARKINS
A523: GEELONG ASSOC. | D523: ARMSTRONG 2 | H523: NOONAN | K523: CATIONS | N523: FARRELLY | Q523: TAYLOR
A525: ROUND 12 | E525: 17TH JULY | J525: WEATHER | M525: CLOUDY BUT FINE | S525: PLAYED AT | X525: LADDER | AB525: ROUND | AD525: 12
D526: 1ST QTR | H526: 2ND QTR | L526: 3RD QTR | P526: FINAL | S526: COBURG
A527: COBURG | C527: 5 | D527: 5 | E527: =C527*6+D527 -> 35 | G527: 9 | H527: 11 | I527: =G527*6+H527 -> 65 | K527: 13 | L527: 14 | M527: =K527*6+L527 -> 92 | O527: 17 | P527: 14 | Q527: =O527*6+P527 -> 116 | S527: UMPIRE | W527: TEAM | X527: W | Y527: L | Z527: D | AA527: FOR | AB527: AGST | AC527: % | AD527: PTS
A528: NORTHCOTE | C528: 3 | D528: 2 | E528: =C528*6+D528 -> 20 | G528: 7 | H528: 3 | I528: =G528*6+H528 -> 45 | K528: 8 | L528: 4 | M528: =K528*6+L528 -> 52 | O528: 9 | P528: 8 | Q528: =O528*6+P528 -> 62 | S528: BLACKBURN
A529: BEST PLAYERS | W529: COBURG | X529: 11 | Y529: 1 | Z529: 0 | AA529: 1149 | AB529: 653 | AC529: 175.95712098009187 | AD529: 44
A530: COBURG | D530: JENKINS | G530: MEARS | I530: FORD | K530: CHAPMAN | N530: C MARTYN | Q530: SPEAKMAN | W530: NORTHCOTE | X530: 9 | Y530: 3 | Z530: 0 | AA530: 754 | AB530: 662 | AC530: 113.89728096676737 | AD530: 36
A531: NORTHCOTE | D531: T DOWNES | G531: JUDKINS | I531: SHEEHY | K531: THEOBOLD | N531: ROGAN | Q531: DOLLOFFSKY | W531: PORT MELBOURNE | X531: 8 | Y531: 4 | Z531: 0 | AA531: 890 | AB531: 693 | AC531: 128.42712842712842 | AD531: 32
A532: GOALKICKERS | Q532: JENKINS | W532: BRUNSWICK | X532: 8 | Y532: 4 | Z532: 0 | AA532: 796 | AB532: 663 | AC532: 120.06033182503771 | AD532: 32
A533: COBURG | D533: GARDINER 5 | G533: FORBES 3 | I533: PLANT 3 | K533: MEARS 2 | M533: KERLEY | O533: SPEAKMAN | R533: CHARLESTON
A534: NORTHCOTE | D534: GOUGH 5 | G534: ROGAN 2 | J534: THEOBOLD | M534: LARKINS | W534: BRIGHTON | X534: 7 | Y534: 5 | Z534: 0 | AA534: 925 | AB534: 868 | AC534: 106.56682027649769 | AD534: 28
W535: PRESTON | X535: 6 | Y535: 6 | Z535: 0 | AA535: 906 | AB535: 911 | AC535: 99.451152579582882 | AD535: 24
A536: BRIGHTON | C536: 3 | D536: 2 | E536: =C536*6+D536 -> 20 | G536: 7 | H536: 5 | I536: =G536*6+H536 -> 47 | K536: 9 | L536: 7 | M536: =K536*6+L536 -> 61 | O536: 12 | P536: 11 | Q536: =O536*6+P536 -> 83 | S536: PRESTON | W536: PRAHRAN | X536: 4 | Y536: 8 | Z536: 0 | AA536: 875 | AB536: 968 | AC536: 90.392561983471069 | AD536: 16
A537: PRESTON | C537: 2 | D537: 6 | E537: =C537*6+D537 -> 18 | G537: 5 | H537: 9 | I537: =G537*6+H537 -> 39 | K537: 6 | L537: 13 | M537: =K537*6+L537 -> 49 | O537: 7 | P537: 15 | Q537: =O537*6+P537 -> 57 | S537: MAKER | W537: WILLIAMSTOWN | X537: 3 | Y537: 9 | Z537: 0 | AA537: 629 | AB537: 979 | AC537: 64.249233912155262 | AD537: 12
A538: BEST PLAYERS | W538: GEELONG ASSOC. | X538: 2 | Y538: 10 | Z538: 0 | AA538: 623 | AB538: 810 | AC538: 76.913580246913583 | AD538: 8
A539: BRIGHTON | D539: MITCHELL | G539: BOYD | I539: RATTRAY | L539: HUNT | O539: FRIEND | Q539: DORE | W539: CAMBERWELL | X539: 2 | Y539: 10 | Z539: 0 | AA539: 736 | AB539: 1076 | AC539: 68.40148698884758 | AD539: 8
A540: PRESTON | D540: WATT | G540: SKIPPER | I540: A STEVENS | L540: ROBERTSON | O540: WARR | Q540: SHERMAN
A541: GOALKICKERS
A542: BRIGHTON | D542: WALSH 4 | F542: RINGROSE 3 | I542: MITCHELL 2 | L542: FRIEND | N542: DAINTY | P542: HUNT
A543: PRESTON | D543: HUME 2 | F543: WARR | H543: WATT | J543: T STEVENS | M543: F LUDLOW | P543: SURTEES
A545: WILLIAMSTOWN | C545: 3 | D545: 4 | E545: =C545*6+D545 -> 22 | G545: 7 | H545: 8 | I545: =G545*6+H545 -> 50 | K545: 10 | L545: 11 | M545: =K545*6+L545 -> 71 | O545: 11 | P545: 12 | Q545: =O545*6+P545 -> 78 | S545: WILLIAMSTOWN
A546: PRAHRAN | C546: 1 | D546: 2 | E546: =C546*6+D546 -> 8 | G546: 6 | H546: 3 | I546: =G546*6+H546 -> 39 | K546: 9 | L546: 6 | M546: =K546*6+L546 -> 60 | O546: 11 | P546: 9 | Q546: =O546*6+P546 -> 75 | S546: MURRAY
A547: BEST PLAYERS
A548: WILLIAMSTOWN | D548: KENNY | G548: MARTIN | J548: MUNRO | M548: McKELLIN | P548: GEISLER | S548: FLANNERY
A549: PRAHRAN | D549: RUSSELL | G549: NAYLOR | J549: V JONES | M549: E JONES | P549: SPAIN | S549: RICHARDSON
A550: GOALKICKERS
A551: WILLIAMSTOWN | D551: KENNY 5 | G551: J MUNN 3 | J551: MARTIN | L551: MUNRO | N551: SKEWES
A552: PRAHRAN | D552: NAYLOR 3 | F552: B SMITH 2 | I552: SPAIN 2 | K552: RICHARDSON | N552: SNELL | P552: RILEY | R552: SHORT
A554: GEELONG ASSOC. | C554: 4 | D554: 1 | E554: =C554*6+D554 -> 25 | G554: 6 | H554: 6 | I554: =G554*6+H554 -> 42 | K554: 7 | L554: 10 | M554: =K554*6+L554 -> 52 | O554: 10 | P554: 16 | Q554: =O554*6+P554 -> 76 | S554: GEE WEST
A555: BRUNSWICK | C555: 2 | D555: 3 | E555: =C555*6+D555 -> 15 | G555: 3 | H555: 5 | I555: =G555*6+H555 -> 23 | K555: 5 | L555: 7 | M555: =K555*6+L555 -> 37 | O555: 6 | P555: 8 | Q555: =O555*6+P555 -> 44 | S555: LESTER
A556: BEST PLAYERS
A557: GEELONG ASSOC. | D557: TAYLOR | G557: CATIONS | J557: McFARLANE | M557: NOONAN | P557: POWELL | S557: ARMSTRONG
A558: BRUNSWICK | D558: KEDDIE | G558: MILLER | J558: PARKER | M558: McMAHON | P558: BRIGHT | S558: McLAUGHLIN
A559: GOALKICKERS
A560: GEELONG ASSOC. | D560: McFARLANE 3 | G560: ARMSTRONG 3 | K560: NOONAN 3 | N560: DEAN
A561: BRUNSWICK | D561: PARKER 2 | G561: REICHMAN 2 | K561: SUMNER | N561: MILLER
A563: PORT MELBOURNE | C563: 0 | D563: 3 | E563: =C563*6+D563 -> 3 | G563: 3 | H563: 5 | I563: =G563*6+H563 -> 23 | K563: 10 | L563: 8 | M563: =K563*6+L563 -> 68 | O563: 12 | P563: 11 | Q563: =O563*6+P563 -> 83 | S563: CAMBERWELL
A564: CAMBERWELL | C564: 4 | D564: 2 | E564: =C564*6+D564 -> 26 | G564: 6 | H564: 4 | I564: =G564*6+H564 -> 40 | K564: 7 | L564: 6 | M564: =K564*6+L564 -> 48 | O564: 8 | P564: 8 | Q564: =O564*6+P564 -> 56 | S564: MACHAR
A565: BEST PLAYERS
A566: PORT MELBOURNE | D566: PERRETT | G566: LOVETT | J566: GARBUTT | M566: MERRICK | P566: HARVEY | S566: REES
A567: CAMBERWELL | D567: KARTHAUS | G567: ELLIOTT | J567: WOODFORD | M567: RAWLE | P567: WHITECROSS | S567: OWEN
A568: GOALKICKERS
A569: PORT MELBOURNE | D569: MERRICK 6 | G569: REES 2 | I569: BARFOOT 2 | L569: MORRIS | N569: GARBUTT
A570: CAMBERWELL | D570: WOODFORD 6 | G570: WHITECROSS | J570: ALLERDING
A572: ROUND 13 | E572: 24TH JULY | H572: WEATHER | K572: SHOWERS S.W. WIND GROUNDS SLIPPERY | S572: PLAYED AT | X572: LADDER | AB572: ROUND | AD572: 13
D573: 1ST QTR | H573: 2ND QTR | L573: 3RD QTR | P573: FINAL | S573: BRUNSWICK
A574: COBURG | C574: 8 | D574: 1 | E574: =C574*6+D574 -> 49 | G574: 9 | H574: 6 | I574: =G574*6+H574 -> 60 | K574: 13 | L574: 9 | M574: =K574*6+L574 -> 87 | O574: 15 | P574: 13 | Q574: =O574*6+P574 -> 103 | S574: UMPIRE | W574: TEAM | X574: W | Y574: L | Z574: D | AA574: FOR | AB574: AGST | AC574: % | AD574: PTS
A575: BRUNSWICK | C575: 0 | D575: 0 | E575: =C575*6+D575 -> 0 | G575: 2 | H575: 4 | I575: =G575*6+H575 -> 16 | K575: 2 | L575: 5 | M575: =K575*6+L575 -> 17 | O575: 7 | P575: 8 | Q575: =O575*6+P575 -> 50 | S575: MURRAY
A576: BEST PLAYERS | W576: COBURG | X576: 12 | Y576: 1 | Z576: 0 | AA576: 1252 | AB576: 703 | AC576: 178.09388335704125 | AD576: 48
A577: COBURG | D577: FORBES | F577: BROOKS | I577: MEARS | L577: SPEAKMAN | O577: C MARTYN | Q577: JENKINS | W577: NORTHCOTE | X577: 10 | Y577: 3 | Z577: 0 | AA577: 817 | AB577: 707 | AC577: 115.55869872701555 | AD577: 40
A578: BRUNSWICK | D578: BOLS | F578: PARKER | I578: McMAHON | L578: HARRIS | O578: KEDDIE | Q578: RALEIGH | W578: PORT MELBOURNE | X578: 9 | Y578: 4 | Z578: 0 | AA578: 994 | AB578: 741 | AC578: 134.14304993252361 | AD578: 36
A579: GOALKICKERS | W579: BRIGHTON | X579: 8 | Y579: 5 | Z579: 0 | AA579: 1034 | AB579: 913 | AC579: 113.25301204819277 | AD579: 32
A580: COBURG | D580: FORBES 7 | F580: GARDINER 2 | I580: KERLEY 2 | K580: MEARS 2 | M580: PLANT | O580: JENKINS
A581: BRUNSWICK | D581: McINERNEY 3 | G581: McMAHON 2 | J581: HASSETT | L581: BURKE | W581: BRUNSWICK | X581: 8 | Y581: 5 | Z581: 0 | AA581: 846 | AB581: 766 | AC581: 110.44386422976501 | AD581: 32
W582: PRESTON | X582: 6 | Y582: 7 | Z582: 0 | AA582: 951 | AB582: 974 | AC582: 97.638603696098556 | AD582: 24
A583: NORTHCOTE | C583: 3 | D583: 1 | E583: =C583*6+D583 -> 19 | G583: 5 | H583: 2 | I583: =G583*6+H583 -> 32 | K583: 7 | L583: 8 | M583: =K583*6+L583 -> 50 | O583: 9 | P583: 9 | Q583: =O583*6+P583 -> 63 | S583: NORTHCOTE | W583: PRAHRAN | X583: 5 | Y583: 8 | Z583: 0 | AA583: 939 | AB583: 1009 | AC583: 93.062438057482652 | AD583: 20
A584: PRESTON | C584: 2 | D584: 4 | E584: =C584*6+D584 -> 16 | G584: 4 | H584: 8 | I584: =G584*6+H584 -> 32 | K584: 5 | L584: 9 | M584: =K584*6+L584 -> 39 | O584: 6 | P584: 9 | Q584: =O584*6+P584 -> 45 | S584: LESTER | W584: WILLIAMSTOWN | X584: 3 | Y584: 10 | Z584: 0 | AA584: 674 | AB584: 1088 | AC584: 61.948529411764703 | AD584: 12
A585: BEST PLAYERS | W585: GEELONG ASSOC. | X585: 2 | Y585: 11 | Z585: 0 | AA585: 671 | AB585: 914 | AC585: 73.413566739606125 | AD585: 8
A586: NORTHCOTE | D586: PERKINS | F586: R DOWNES | I586: SHEEHY | L586: JUDKINS | O586: GOUGH | Q586: GOODRICK | W586: CAMBERWELL | X586: 2 | Y586: 11 | Z586: 0 | AA586: 777 | AB586: 1140 | AC586: 68.15789473684211 | AD586: 8
A587: PRESTON | D587: WARR | F587: SEEBECK | I587: WATT | L587: ROBERTSON | O587: A STEVENS | Q587: SHERMAN
A588: GOALKICKERS
A589: NORTHCOTE | D589: GOUGH 4 | G589: R DOWNES 3 | J589: DOLLOFFSKY | M589: GOODRICK
A590: PRESTON | D590: A STEVENS 2 | G590: SUMMERS | J590: DOBRIGH | M590: A LUDLOW | P590: WARR
A592: BRIGHTON | C592: 4 | D592: 2 | E592: =C592*6+D592 -> 26 | G592: 7 | H592: 7 | I592: =G592*6+H592 -> 49 | K592: 13 | L592: 12 | M592: =K592*6+L592 -> 90 | O592: 16 | P592: 13 | Q592: =O592*6+P592 -> 109 | S592: BRIGHTON BEACH
A593: WILLIAMSTOWN | C593: 1 | D593: 0 | E593: =C593*6+D593 -> 6 | G593: 2 | H593: 3 | I593: =G593*6+H593 -> 15 | K593: 3 | L593: 5 | M593: =K593*6+L593 -> 23 | O593: 6 | P593: 9 | Q593: =O593*6+P593 -> 45 | S593: MAHER
A594: BEST PLAYERS
A595: BRIGHTON | D595: RATTRAY | G595: DORE | J595: ACKERS | M595: HUNT | O595: BESWICK | R595: RINGROSE
A596: WILLIAMSTOWN | D596: MARTIN | G596: McKELLIN | J596: WHITBURN | M596: BEER | O596: FLANNERY | R596: MEEHAN
A597: GOALKICKERS
A598: BRIGHTON | D598: WALSH 4 | F598: BOYD 3 | H598: HUNT 3 | J598: RATTRAY 2 | M598: RINGROSE 2 | P598: BESWICK | R598: MITCHELL | U598: DAINTY
A599: WILLIAMSTOWN | D599: SKEWES 2 | G599: MARTIN 2 | J599: MATHER | L599: QUINN
A601: PRAHRAN | C601: 1 | D601: 0 | E601: =C601*6+D601 -> 6 | G601: 5 | H601: 6 | I601: =G601*6+H601 -> 36 | K601: 7 | L601: 7 | M601: =K601*6+L601 -> 49 | O601: 9 | P601: 10 | Q601: =O601*6+P601 -> 64 | S601: TOORAK PARK
A602: CAMBERWELL | C602: 1 | D602: 6 | E602: =C602*6+D602 -> 12 | G602: 2 | H602: 8 | I602: =G602*6+H602 -> 20 | K602: 3 | L602: 11 | M602: =K602*6+L602 -> 29 | O602: 4 | P602: 17 | Q602: =O602*6+P602 -> 41 | S602: BLACKBURN
A603: BEST PLAYERS
A604: PRAHRAN | D604: VANCE | G604: NAYLOR | J604: OSBORNE | M604: SPAIN | O604: HARLEY | R604: V JONES
A605: CAMBERWELL | D605: PARRIS | G605: ELLIOTT | J605: KILLEN | M605: YOLE | O605: KARTHAUS | R605: PRICE
A606: GOALKICKERS
A607: PRAHRAN | D607: HARLEY 3 | G607: V JONES | I607: B SMITH | K607: RICHARDSON | N607: NAYLOR | P607: FULLING | R607: ROWE
A608: CAMBERWELL | D608: WOODFORD 3 | G608: WHITECROSS
A610: PORT MELBOURNE | C610: 4 | D610: 5 | E610: =C610*6+D610 -> 29 | G610: 7 | H610: 9 | I610: =G610*6+H610 -> 51 | K610: 11 | L610: 14 | M610: =K610*6+L610 -> 80 | O610: 15 | P610: 14 | Q610: =O610*6+P610 -> 104 | S610: PORT MELBOURNE
A611: GEELONG ASSOC. | C611: 0 | D611: 0 | E611: =C611*6+D611 -> 0 | G611: 6 | H611: 3 | I611: =G611*6+H611 -> 39 | K611: 6 | L611: 5 | M611: =K611*6+L611 -> 41 | O611: 7 | P611: 6 | Q611: =O611*6+P611 -> 48 | S611: FURLONG
A612: BEST PLAYERS
A613: PORT MELBOURNE | D613: MERRICK | G613: BOLMAN | J613: REES | L613: HARVEY | O613: BARFOOT | R613: CROMPTON
A614: GEELONG ASSOC. | D614: TAYLOR | G614: POWELL | J614: NOONAN | L614: McFARLANE | O614: HARRIS | R614: BLISS
A615: GOALKICKERS
A616: PORT MELBOURNE | D616: CARPENTER 5 | G616: MERRICK 4 | J616: JOHNSTONE 2 | M616: MORRIS 2 | P616: REES | R616: STYLES
A617: GEELONG ASSOC. | D617: McFARLANE 2 | G617: HARRIS 2 | J617: NOONAN 2 | M617: BLISS
A619: ROUND 14 | E619: 31ST JULY | J619: WEATHER | M619: RAIN N.W. WIND | S619: PLAYED AT | X619: LADDER | AB619: ROUND | AD619: 14
D620: 1ST QTR | H620: 2ND QTR | L620: 3RD QTR | P620: FINAL | S620: COBURG
A621: BRIGHTON | C621: 1 | D621: 3 | E621: =C621*6+D621 -> 9 | G621: 3 | H621: 5 | I621: =G621*6+H621 -> 23 | K621: 6 | L621: 5 | M621: =K621*6+L621 -> 41 | O621: 9 | P621: 9 | Q621: =O621*6+P621 -> 63 | S621: UMPIRE | W621: TEAM | X621: W | Y621: L | Z621: D | AA621: FOR | AB621: AGST | AC621: % | AD621: PTS
A622: COBURG | C622: 5 | D622: 6 | E622: =C622*6+D622 -> 36 | G622: 6 | H622: 9 | I622: =G622*6+H622 -> 45 | K622: 6 | L622: 14 | M622: =K622*6+L622 -> 50 | O622: 8 | P622: 14 | Q622: =O622*6+P622 -> 62 | S622: MURRAY
A623: BEST PLAYERS | W623: COBURG | X623: 12 | Y623: 2 | Z623: 0 | AA623: 1314 | AB623: 766 | AC623: 171.54046997389034 | AD623: 48
A624: BRIGHTON | D624: KOLLE | F624: RINGROSE | I624: ALDRIDGE | L624: RATTRAY | O624: MITCHELL | Q624: WALSH | W624: NORTHCOTE | X624: 11 | Y624: 3 | Z624: 0 | AA624: 914 | AB624: 744 | AC624: 122.84946236559139 | AD624: 44
A625: COBURG | D625: KERLEY | F625: MEARS | I625: JENKINS | L625: GARDINER | O625: FORBES | Q625: BROOKS | W625: PORT MELBOURNE | X625: 10 | Y625: 4 | Z625: 0 | AA625: 1060 | AB625: 789 | AC625: 134.34727503168568 | AD625: 40
A626: GOALKICKERS | W626: BRIGHTON | X626: 9 | Y626: 5 | Z626: 0 | AA626: 1097 | AB626: 975 | AC626: 112.51282051282051 | AD626: 36
A627: BRIGHTON | D627: WALSH 4) | G627: RINGROSE 2 | J627: FRIEND | L627: BOYD | N627: HUNT
A628: COBURG | D628: GARDINER 3 | G628: KERLEY 2 | J628: FORBES | L628: JENKINS | N628: MEARS | W628: BRUNSWICK | X628: 8 | Y628: 6 | Z628: 0 | AA628: 894 | AB628: 832 | AC628: 107.45192307692308 | AD628: 32
W629: PRESTON | X629: 7 | Y629: 7 | Z629: 0 | AA629: 1025 | AB629: 1037 | AC629: 98.842815814850525 | AD629: 28
A630: PORT MELBOURNE | C630: 0 | D630: 3 | E630: =C630*6+D630 -> 3 | G630: 4 | H630: 8 | I630: =G630*6+H630 -> 32 | K630: 5 | L630: 8 | M630: =K630*6+L630 -> 38 | O630: 9 | P630: 12 | Q630: =O630*6+P630 -> 66 | S630: PORT MELBOURNE | W630: PRAHRAN | X630: 5 | Y630: 9 | Z630: 0 | AA630: 1000 | AB630: 1099 | AC630: 90.99181073703366 | AD630: 20
A631: BRUNSWICK | C631: 1 | D631: 11 | E631: =C631*6+D631 -> 17 | G631: 1 | H631: 11 | I631: =G631*6+H631 -> 17 | K631: 5 | L631: 14 | M631: =K631*6+L631 -> 44 | O631: 5 | P631: 18 | Q631: =O631*6+P631 -> 48 | S631: FURLONG | W631: GEELONG ASSOC. | X631: 3 | Y631: 11 | Z631: 0 | AA631: 761 | AB631: 975 | AC631: 78.051282051282058 | AD631: 12
A632: BEST PLAYERS | W632: WILLIAMSTOWN | X632: 3 | Y632: 11 | Z632: 0 | AA632: 711 | AB632: 1185 | AC632: 60 | AD632: 12
A633: PORT MELBOURNE | D633: BARFOOT | F633: CROMPTON | I633: CARPENTER | L633: FARNAN | O633: STYLES | Q633: JOHNSTONE | W633: CAMBERWELL | X633: 2 | Y633: 12 | Z633: 0 | AA633: 840 | AB633: 1214 | AC633: 69.192751235584836 | AD633: 8
A634: BRUNSWICK | D634: KENNETT | F634: BOLS | I634: RAYMOND | L634: BLACKMAN | O634: REICHMAN | Q634: HASSETT
A635: GOALKICKERS
A636: PORT MELBOURNE | D636: CARPENTER 3 | G636: STYLES 2 | I636: BARFOOT 2 | L636: MERRICK | N636: JOHNSTONE
A637: BRUNSWICK | D637: BLACKMAN 2 | H637: JOHNSON 2 | K637: MILLER
A639: GEELONG ASSOC. | C639: 3 | D639: 1 | E639: =C639*6+D639 -> 19 | G639: 8 | H639: 7 | I639: =G639*6+H639 -> 55 | K639: 9 | L639: 7 | M639: =K639*6+L639 -> 61 | O639: 13 | P639: 12 | Q639: =O639*6+P639 -> 90 | S639: KARDINIA PARK
A640: PRAHRAN | C640: 2 | D640: 3 | E640: =C640*6+D640 -> 15 | G640: 3 | H640: 5 | I640: =G640*6+H640 -> 23 | K640: 7 | L640: 6 | M640: =K640*6+L640 -> 48 | O640: 9 | P640: 7 | Q640: =O640*6+P640 -> 61 | S640: LESTER
A641: BEST PLAYERS
A642: GEELONG ASSOC. | D642: NOONAN | G642: HARRIS | J642: DEAN | L642: TAYLOR | O642: McFARLANE | R642: FARR
A643: PRAHRAN | D643: HORTON | G643: RUSSELL | J643: SPAIN | L643: OSBORNE | O643: SEACH | R643: V JONES
A644: GOALKICKERS
A645: GEELONG ASSOC. | D645: ARMSTRONG 5 | G645: LEIGHTON 2 | J645: HARRIS 2 | M645: NOONAN | O645: DEAN | Q645: FARRELLY | T645: FARR
A646: PRAHRAN | D646: HARLEY 4 | G646: SNELL 3 | J646: RICHARDSON 2
A648: PRESTON | C648: 3 | D648: 5 | E648: =C648*6+D648 -> 23 | G648: 5 | H648: 8 | I648: =G648*6+H648 -> 38 | K648: 7 | L648: 12 | M648: =K648*6+L648 -> 54 | O648: 10 | P648: 14 | Q648: =O648*6+P648 -> 74 | S648: PRESTON
A649: CAMBERWELL | C649: 1 | D649: 2 | E649: =C649*6+D649 -> 8 | G649: 4 | H649: 5 | I649: =G649*6+H649 -> 29 | K649: 6 | L649: 6 | M649: =K649*6+L649 -> 42 | O649: 9 | P649: 9 | Q649: =O649*6+P649 -> 63 | S649: PETERS
A650: BEST PLAYERS
A651: PRESTON | D651: SUMMERS | G651: WARR | J651: WATT | M651: SURTEES | O651: HUME | R651: SEEBECK
A652: CAMBERWELL | D652: RAWLE | G652: WHITECROSS | J652: WOODFORD | M652: YOLE | O652: HORNE | R652: LE STANGE
A653: GOALKICKERS
A654: PRESTON | D654: HUME 4 | G654: WARR 2 | I654: SHAW | K654: T STEVENS | N654: A STEVENS | Q654: SEEBECK
A655: CAMBERWELL | D655: WOODFORD 3 | G655: HORNE 3 | I655: HARRISON | L655: LE STRANGE | O655: KILLEN
A657: NORTHCOTE | C657: 0 | D657: 5 | E657: =C657*6+D657 -> 5 | G657: 2 | H657: 10 | I657: =G657*6+H657 -> 22 | K657: 6 | L657: 17 | M657: =K657*6+L657 -> 53 | O657: 13 | P657: 19 | Q657: =O657*6+P657 -> 97 | S657: NORTHCOTE
A658: WILLIAMSTOWN | C658: 2 | D658: 3 | E658: =C658*6+D658 -> 15 | G658: 3 | H658: 3 | I658: =G658*6+H658 -> 21 | K658: 4 | L658: 5 | M658: =K658*6+L658 -> 29 | O658: 5 | P658: 7 | Q658: =O658*6+P658 -> 37 | S658: MAHER
A659: BEST PLAYERS
A660: NORTHCOTE | D660: H SMITH | G660: GOODRICK | J660: PERKINS | M660: JUDKINS | O660: T DOWNES | R660: R DOWNES
A661: WILLIAMSTOWN | D661: McKELLIN | G661: MARTIN | J661: J MUNN | M661: BEER | O661: QUINN | R661: MEEHAN
A662: GOALKICKERS
A663: NORTHCOTE | D663: GOUGH 4 | F663: DOLLOFFSKY 2 | I663: R DOWNES 2 | L663: GOODRICK 2 | O663: SHEEHY | Q663: H SMITH | S663: LEAKE
A664: WILLIAMSTOWN | D664: J MUNN 2 | G664: MARTIN | I664: BEER | K664: QUINN
A666: ROUND 15 | E666: 7TH AUGUST | J666: WEATHER | M666: FINE NORTH BREEZE | S666: PLAYED AT | X666: LADDER | AB666: ROUND | AD666: 15
D667: 1ST QTR | H667: 2ND QTR | L667: 3RD QTR | P667: FINAL | S667: BRIGHTON BEACH
A668: BRIGHTON | C668: 4 | D668: 4 | E668: =C668*6+D668 -> 28 | G668: 8 | H668: 8 | I668: =G668*6+H668 -> 56 | K668: 12 | L668: 10 | M668: =K668*6+L668 -> 82 | O668: 15 | P668: 16 | Q668: =O668*6+P668 -> 106 | S668: UMPIRE | W668: TEAM | X668: W | Y668: L | Z668: D | AA668: FOR | AB668: AGST | AC668: % | AD668: PTS
A669: NORTHCOTE | C669: 3 | D669: 3 | E669: =C669*6+D669 -> 21 | G669: 5 | H669: 4 | I669: =G669*6+H669 -> 34 | K669: 8 | L669: 6 | M669: =K669*6+L669 -> 54 | O669: 11 | P669: 7 | Q669: =O669*6+P669 -> 73 | S669: MURRAY
A670: BEST PLAYERS | W670: COBURG | X670: 13 | Y670: 2 | Z670: 0 | AA670: 1434 | AB670: 817 | AC670: 175.5201958384333 | AD670: 52
A671: BRIGHTON | D671: CARROLL | G671: WALSH | I671: IRWIN | K671: KOLLE | N671: RINGROSE | Q671: GARCIA | W671: PORT MELBOURNE | X671: 11 | Y671: 4 | Z671: 0 | AA671: 1131 | AB671: 844 | AC671: 134.00473933649289 | AD671: 44
A672: NORTHCOTE | D672: GOUGH | G672: LAFFY | I672: H SMITH | K672: T DOWNES | N672: GOODRICK | Q672: SHEEHY | W672: NORTHCOTE | X672: 11 | Y672: 4 | Z672: 0 | AA672: 987 | AB672: 850 | AC672: 116.12 | AD672: 44
A673: GOALKICKERS | W673: BRIGHTON | X673: 10 | Y673: 5 | Z673: 0 | AA673: 1203 | AB673: 1048 | AC673: 114.79 | AD673: 40
A674: BRIGHTON | D674: WALSH 8 | F674: RINGROSE 3 | I674: ATKINSON | K674: BOYD | M674: FRIEND | O674: DAINTY
A675: NORTHCOTE | D675: GOUGH 5 | G675: R DOWNES 2 | J675: H SMITH 2 | M675: GOODRICK | O675: T DOWNES | W675: BRUNSWICK | X675: 9 | Y675: 6 | Z675: 0 | AA675: 954 | AB675: 891 | AC675: 107.07070707070707 | AD675: 36
W676: PRESTON | X676: 7 | Y676: 8 | Z676: 0 | AA676: 1076 | AB676: 1157 | AC676: 92.999135695764906 | AD676: 28
A677: COBURG | C677: 5 | D677: 6 | E677: =C677*6+D677 -> 36 | G677: 6 | H677: 9 | I677: =G677*6+H677 -> 45 | K677: 12 | L677: 14 | M677: =K677*6+L677 -> 86 | O677: 17 | P677: 18 | Q677: =O677*6+P677 -> 120 | S677: COBURG | W677: PRAHRAN | X677: 5 | Y677: 10 | Z677: 0 | AA677: 1059 | AB677: 1159 | AC677: 91.371872303710092 | AD677: 20
A678: PRESTON | C678: 1 | D678: 0 | E678: =C678*6+D678 -> 6 | G678: 2 | H678: 2 | I678: =G678*6+H678 -> 14 | K678: 4 | L678: 4 | M678: =K678*6+L678 -> 28 | O678: 7 | P678: 9 | Q678: =O678*6+P678 -> 51 | S678: OLDFIELD | W678: GEELONG ASSOC. | X678: 3 | Y678: 12 | Z678: 0 | AA678: 826 | AB678: 1068 | AC678: 77.340823970037448 | AD678: 12
A679: BEST PLAYERS | W679: CAMBERWELL | X679: 3 | Y679: 12 | Z679: 0 | AA679: 933 | AB679: 1279 | AC679: 72.947615324472238 | AD679: 12
A680: COBURG | D680: MEARS | G680: FORBES | I680: A MARTYN | L680: C MARTYN | N680: JENKINS | Q680: SEXTON | W680: WILLIAMSTOWN | X680: 3 | Y680: 12 | Z680: 0 | AA680: 766 | AB680: 1256 | AC680: 60.987261146496813 | AD680: 12
A681: PRESTON | D681: A STEVENS | G681: HUME | I681: SURTEES | L681: F LUDLOW | N681: WARR | Q681: SHERMAN
A682: GOALKICKERS
A683: COBURG | D683: GARDINER 4 | G683: KERLEY 2 | I683: MEARS 2 | K683: SPEAKMAN 2 | N683: SEXTON 2 | Q683: A MARTYN 2 | T683: FORBES | V683: HARRIS | X683: COX
A684: PRESTON | D684: A STEVENS 2 | G684: HUME 2 | I684: F LUDLOW | K684: SUMMERS | M684: MUIR
A686: BRUNSWICK | C686: 1 | D686: 7 | E686: =C686*6+D686 -> 13 | G686: 1 | H686: 7 | I686: =G686*6+H686 -> 13 | K686: 4 | L686: 15 | M686: =K686*6+L686 -> 39 | O686: 7 | P686: 18 | Q686: =O686*6+P686 -> 60 | S686: TOORAK PARK
A687: PRAHRAN | C687: 3 | D687: 1 | E687: =C687*6+D687 -> 19 | G687: 6 | H687: 6 | I687: =G687*6+H687 -> 42 | K687: 6 | L687: 7 | M687: =K687*6+L687 -> 43 | O687: 8 | P687: 11 | Q687: =O687*6+P687 -> 59 | S687: MAKER
A688: BEST PLAYERS
A689: BRUNSWICK | D689: RAYMOND | G689: HASSETT | I689: PARKER | L689: KENNETT | O689: KEDDIE | R689: BOLS
A690: PRAHRAN | D690: SPAIN | G690: SHORT | I690: E JONES | L690: REYNOLDS | O690: B SMITH | R690: VANCE
A691: GOALKICKERS
A692: BRUNSWICK | D692: McINERNEY 2 | H692: HASSETT 2 | K692: MILLER 2 | N692: RAYMOND
A693: PRAHRAN | D693: HARLEY 4 | G693: ROWE | I693: SPAIN | K693: B SMITH | N693: RICHARDSON
A695: CAMBERWELL | C695: 3 | D695: 5 | E695: =C695*6+D695 -> 23 | G695: 8 | H695: 7 | I695: =G695*6+H695 -> 55 | K695: 10 | L695: 13 | M695: =K695*6+L695 -> 73 | O695: 13 | P695: 15 | Q695: =O695*6+P695 -> 93 | S695: CAMBERWELL
A696: GEELONG ASSOC. | C696: 1 | D696: 2 | E696: =C696*6+D696 -> 8 | G696: 5 | H696: 4 | I696: =G696*6+H696 -> 34 | K696: 7 | L696: 6 | M696: =K696*6+L696 -> 48 | O696: 9 | P696: 11 | Q696: =O696*6+P696 -> 65 | S696: BLACKBURN
A697: BEST PLAYERS
A698: CAMBERWELL | D698: GREENBURY | G698: ELLIOTT | I698: RAWLE | L698: McCAMISH | O698: KARTHAUS | R698: POOLE
A699: GEELONG ASSOC. | D699: NOONAN | G699: FARR | I699: HARRIS | L699: DEAN | O699: POWELL | R699: TAYLOR
A700: GOALKICKERS
A701: CAMBERWELL | D701: WOODFORD 3 | G701: McCAMISH 3 | J701: HORNE 2 | L701: PRICE 2 | N701: GREENBURY | Q701: RAWLE | S701: WRIGHT
A702: GEELONG ASSOC. | D702: NOONAN 4 | G702: LEIGHTON 2 | J702: HARRIS | L702: HOHENSELS | O702: DEAN
A704: PORT MELBOURNE | C704: 1 | D704: 6 | E704: =C704*6+D704 -> 12 | G704: 2 | H704: 9 | I704: =G704*6+H704 -> 21 | K704: 6 | L704: 14 | M704: =K704*6+L704 -> 50 | O704: 9 | P704: 17 | Q704: =O704*6+P704 -> 71 | S704: PORT MELBOURNE
A705: WILLIAMSTOWN | C705: 3 | D705: 3 | E705: =C705*6+D705 -> 21 | G705: 5 | H705: 6 | I705: =G705*6+H705 -> 36 | K705: 5 | L705: 6 | M705: =K705*6+L705 -> 36 | O705: 8 | P705: 7 | Q705: =O705*6+P705 -> 55 | S705: MACHAR
A706: BEST PLAYERS
A707: PORT MELBOURNE | D707: CROMPTON | G707: BARFOOT | J707: MERRICK | M707: PERRETT | O707: BOLMAN | R707: GARBUTT
A708: WILLIAMSTOWN | D708: MARTIN | G708: BALL | J708: BEER | M708: KENNY | O708: McKELLIN | R708: CHALMERS
A709: GOALKICKERS
A710: PORT MELBOURNE | D710: MERRICK 5 | G710: CROMPTON | J710: BARFOOT | L710: SKILTON | N710: FORBES
A711: WILLIAMSTOWN | D711: KENNY 4 | G711: BEER | I711: MARTIN | K711: RIGALDI | N711: JOHNS
A713: ROUND 16 | E713: 14TH AUGUST | J713: WEATHER | M713: FINE NORTH WIND | S713: PLAYED AT | X713: LADDER | AB713: ROUND | AD713: 16
D714: 1ST QTR | H714: 2ND QTR | L714: 3RD QTR | P714: FINAL | S714: PORT MELBOURNE
A715: PORT MELBOURNE | C715: 2 | D715: 0 | E715: =C715*6+D715 -> 12 | G715: 10 | H715: 3 | I715: =G715*6+H715 -> 63 | K715: 12 | L715: 5 | M715: =K715*6+L715 -> 77 | O715: 16 | P715: 8 | Q715: =O715*6+P715 -> 104 | S715: UMPIRE | W715: TEAM | X715: W | Y715: L | Z715: D | AA715: FOR | AB715: AGST | AC715: % | AD715: PTS
A716: COBURG | C716: 4 | D716: 2 | E716: =C716*6+D716 -> 26 | G716: 4 | H716: 3 | I716: =G716*6+H716 -> 27 | K716: 4 | L716: 5 | M716: =K716*6+L716 -> 29 | O716: 8 | P716: 5 | Q716: =O716*6+P716 -> 53 | S716: MACHAR
A717: BEST PLAYERS | W717: COBURG | X717: 13 | Y717: 3 | Z717: 0 | AA717: 1487 | AB717: 921 | AC717: 161.45494028230183 | AD717: 52
A718: PORT MELBOURNE | D718: BARFOOT | F718: CROMPTON | I718: ROSS | K718: SLOLEY | N718: MERRICK | Q718: PERRETT | W718: PORT MELBOURNE | X718: 12 | Y718: 4 | Z718: 0 | AA718: 1235 | AB718: 897 | AC718: 137.68115942028984 | AD718: 48
A719: COBURG | D719: HARRIS | F719: C MARTYN | I719: ADAMS | K719: WILSON | N719: DURIE | Q719: COX | W719: NORTHCOTE | X719: 12 | Y719: 4 | Z719: 0 | AA719: 1051 | AB719: 897 | AC719: 117.17 | AD719: 48
A720: GOALKICKERS | W720: BRIGHTON | X720: 11 | Y720: 5 | Z720: 0 | AA720: 1292 | AB720: 1099 | AC720: 117.56 | AD720: 44
A721: PORT MELBOURNE | D721: MERRICK 8 | G721: JOHNSTONE 2 | J721: MORRIS 2 | M721: SKILTON | O721: PERRETT | Q721: HARVEY | S721: FORBES
A722: COBURG | D722: A MARTYN 3 | G722: GARDINER 2 | J722: BROOKS | L722: FORBES | N722: DURIE | W722: BRUNSWICK | X722: 9 | Y722: 7 | Z722: 0 | AA722: 1005 | AB722: 980 | AC722: 102.55102040816327 | AD722: 36
W723: PRESTON | X723: 7 | Y723: 9 | Z723: 0 | AA723: 1166 | AB723: 1276 | AC723: 91.379310344827587 | AD723: 28
A724: BRIGHTON | C724: 4 | D724: 5 | E724: =C724*6+D724 -> 29 | G724: 6 | H724: 5 | I724: =G724*6+H724 -> 41 | K724: 12 | L724: 11 | M724: =K724*6+L724 -> 83 | O724: 13 | P724: 11 | Q724: =O724*6+P724 -> 89 | S724: BRIGHTON BEACH | W724: PRAHRAN | X724: 6 | Y724: 10 | Z724: 0 | AA724: 1178 | AB724: 1249 | AC724: 94.315452361889513 | AD724: 24
A725: BRUNSWICK | C725: 1 | D725: 0 | E725: =C725*6+D725 -> 6 | G725: 3 | H725: 3 | I725: =G725*6+H725 -> 21 | K725: 3 | L725: 4 | M725: =K725*6+L725 -> 22 | O725: 6 | P725: 15 | Q725: =O725*6+P725 -> 51 | S725: BYRON | W725: GEELONG ASSOC. | X725: 4 | Y725: 12 | Z725: 0 | AA725: 890 | AB725: 1097 | AC725: 81.130355515041018 | AD725: 16
A726: BEST PLAYERS | W726: CAMBERWELL | X726: 3 | Y726: 13 | Z726: 0 | AA726: 980 | AB726: 1343 | AC726: 72.970960536113182 | AD726: 12
A727: BRIGHTON | D727: HUNT | G727: IRWIN | I727: RINGROSE | L727: BOYD | N727: CARROLL | Q727: DAINTY | W727: WILLIAMSTOWN | X727: 3 | Y727: 13 | Z727: 0 | AA727: 795 | AB727: 1320 | AC727: 60.227272727272727 | AD727: 12
A728: BRUNSWICK | D728: KENNETT | G728: KEDDIE | I728: REID | L728: ALESSIO | N728: MILLER | Q728: HART
A729: GOALKICKERS
A730: BRIGHTON | D730: WALSH 3 | F730: RINGROSE 3 | I730: FRIEND 3 | K730: RATTRAY | M730: BESWICK | O730: IRWIN | Q730: BOYD
A731: BRUNSWICK | D731: RAYMOND 3 | G731: O'CONNOR | J731: ALESSIO | M731: PARKER
A733: PRAHRAN | C733: 5 | D733: 6 | E733: =C733*6+D733 -> 36 | G733: 9 | H733: 9 | I733: =G733*6+H733 -> 63 | K733: 14 | L733: 10 | M733: =K733*6+L733 -> 94 | O733: 17 | P733: 17 | Q733: =O733*6+P733 -> 119 | S733: TOORAK PARK
A734: PRESTON | C734: 1 | D734: 2 | E734: =C734*6+D734 -> 8 | G734: 7 | H734: 8 | I734: =G734*6+H734 -> 50 | K734: 11 | L734: 10 | M734: =K734*6+L734 -> 76 | O734: 13 | P734: 12 | Q734: =O734*6+P734 -> 90 | S734: MURRAY
A735: BEST PLAYERS
A736: PRAHRAN | D736: HARLEY | G736: PROCTOR | J736: HORTON | M736: SPAIN | P736: SMITH | S736: RUSSELL
A737: PRESTON | D737: SURTEES | G737: HUME | J737: DOBRIGH | M737: A LUDLOW | P737: F LUDLOW | S737: WARR
A738: GOALKICKERS
A739: PRAHRAN | D739: HARLEY 10 | G739: ROWE 2 | I739: SPAIN | J739: SHORT | L739: WHITELEY | N739: V JONES | P739: RICHARDSON
A740: PRESTON | D740: HUME 6 | F740: ELLIS 2 | H740: A LUDLOW | J740: WARR | L740: DOBRIGH | N740: A STEVENS | Q740: SUMMERS
A742: GEELONG ASSOC. | C742: 4 | D742: 5 | E742: =C742*6+D742 -> 29 | G742: 5 | H742: 5 | I742: =G742*6+H742 -> 35 | K742: 7 | L742: 8 | M742: =K742*6+L742 -> 50 | O742: 9 | P742: 10 | Q742: =O742*6+P742 -> 64 | S742: KARDINIA PARK
A743: WILLIAMSTOWN | C743: 0 | D743: 2 | E743: =C743*6+D743 -> 2 | G743: 1 | H743: 4 | I743: =G743*6+H743 -> 10 | K743: 1 | L743: 6 | M743: =K743*6+L743 -> 12 | O743: 3 | P743: 11 | Q743: =O743*6+P743 -> 29 | S743: MAHER
A744: BEST PLAYERS
A745: GEELONG ASSOC. | D745: NOONAN | G745: ARMSTRONG | J745: HARRIS | M745: McFARLANE | P745: J McINERNEY | S745: POWELL
A746: WILLIAMSTOWN | D746: MARTIN | G746: KENNY | J746: CHALMERS | M746: MUNRO | P746: J MUNN | S746: QUINN
A747: GOALKICKERS
A748: GEELONG ASSOC. | D748: ARMSTRONG 2 | G748: HARRIS 2 | I748: McFARLANE 2 | L748: NOONAN | N748: BLISS | P748: DEAN
A749: WILLIAMSTOWN | D749: KENNY | F749: QUINN | H749: THOMPSON
A751: NORTHCOTE | C751: 2 | D751: 4 | E751: =C751*6+D751 -> 16 | G751: 4 | H751: 8 | I751: =G751*6+H751 -> 32 | K751: 7 | L751: 11 | M751: =K751*6+L751 -> 53 | O751: 8 | P751: 16 | Q751: =O751*6+P751 -> 64 | S751: NORTHCOTE
A752: CAMBERWELL | C752: 2 | D752: 3 | E752: =C752*6+D752 -> 15 | G752: 3 | H752: 3 | I752: =G752*6+H752 -> 21 | K752: 4 | L752: 7 | M752: =K752*6+L752 -> 31 | O752: 6 | P752: 11 | Q752: =O752*6+P752 -> 47 | S752: BLACKBURN
A753: BEST PLAYERS
A754: NORTHCOTE | D754: T DOWNES | G754: SHEEHY | J754: GOUGH | M754: DIMMICK | P754: GOODRICK | S754: JUDKINS
A755: CAMBERWELL | D755: KARTHAUS | G755: TRESIZE | J755: KILLEN | M755: ELLIOTT | P755: LE STRANGE | S755: HORNE
A756: GOALKICKERS
A757: NORTHCOTE | D757: GOUGH 6 | G757: T DOWNES 2
A758: CAMBERWELL | D758: WOODFORD 3 | G758: ELLIOTT | I758: OWENS | K758: HORNE
A760: ROUND 17 | D760: 22ND AUGUST | J760: WEATHER | M760: FINE SOUTH BREEZE | S760: PLAYED AT | X760: LADDER | AB760: ROUND | AD760: 17
D761: 1ST QTR | H761: 2ND QTR | L761: 3RD QTR | P761: FINAL | S761: PORT MELBOURNE
A762: PORT MELBOURNE | C762: 4 | D762: 1 | E762: =C762*6+D762 -> 25 | G762: 11 | H762: 6 | I762: =G762*6+H762 -> 72 | K762: 14 | L762: 9 | M762: =K762*6+L762 -> 93 | O762: 20 | P762: 11 | Q762: =O762*6+P762 -> 131 | S762: UMPIRE | W762: TEAM | X762: W | Y762: L | Z762: D | AA762: FOR | AB762: AGST | AC762: % | AD762: PTS
A763: BRIGHTON | C763: 3 | D763: 0 | E763: =C763*6+D763 -> 18 | G763: 4 | H763: 1 | I763: =G763*6+H763 -> 25 | K763: 7 | L763: 5 | M763: =K763*6+L763 -> 47 | O763: 8 | P763: 5 | Q763: =O763*6+P763 -> 53 | S763: MAHER
A764: BEST PLAYERS | W764: COBURG | X764: 14 | Y764: 3 | Z764: 0 | AA764: 1633 | AB764: 966 | AC764: 169.04761904761904 | AD764: 56
A765: PORT MELBOURNE | D765: GARBUTT | G765: HARVEY | I765: MERRICK | K765: W RUDD | N765: REES | Q765: SKILTON | W765: PORT MELBOURNE | X765: 13 | Y765: 4 | Z765: 0 | AA765: 1366 | AB765: 950 | AC765: 143.78947368421052 | AD765: 52
A766: BRIGHTON | D766: CARROLL | G766: DORE | I766: GARCIA | K766: IRWIN | N766: WALSH | Q766: ATKINSON | W766: NORTHCOTE | X766: 13 | Y766: 4 | Z766: 0 | AA766: 1135 | AB766: 975 | AC766: 116.41 | AD766: 52
A767: GOALKICKERS | Q767: JOHNSTONE | W767: BRIGHTON | X767: 11 | Y767: 6 | Z767: 0 | AA767: 1345 | AB767: 1230 | AC767: 109.35 | AD767: 44
A768: PORT MELBOURNE | D768: MERRICK 7 | F768: HARVEY 3 | I768: SLOLEY 3 | K768: CAMPBELL 2 | N768: REES 2 | P768: MORRIS | R768: SKILTON
A769: BRIGHTON | D769: WALSH 3 | F769: ATKINSON | I769: IRWIN | K769: RINGROSE | N769: FRIEND | P769: BOYD | W769: BRUNSWICK | X769: 9 | Y769: 8 | Z769: 0 | AA769: 1005 | AB769: 980 | AC769: 102.55102040816327 | AD769: 36
W770: PRESTON | X770: 8 | Y770: 9 | Z770: 0 | AA770: 1304 | AB770: 1326 | AC770: 98.340874811463053 | AD770: 32
A771: NORTHCOTE | C771: 2 | D771: 7 | E771: =C771*6+D771 -> 19 | G771: 6 | H771: 9 | I771: =G771*6+H771 -> 45 | K771: 11 | L771: 10 | M771: =K771*6+L771 -> 76 | O771: 12 | P771: 12 | Q771: =O771*6+P771 -> 84 | S771: TOORAK PARK | W771: PRAHRAN | X771: 6 | Y771: 11 | Z771: 0 | AA771: 1256 | AB771: 1333 | AC771: 94.223555888972243 | AD771: 24
A772: PRAHRAN | C772: 2 | D772: 2 | E772: =C772*6+D772 -> 14 | G772: 6 | H772: 4 | I772: =G772*6+H772 -> 40 | K772: 10 | L772: 4 | M772: =K772*6+L772 -> 64 | O772: 12 | P772: 6 | Q772: =O772*6+P772 -> 78 | S772: BLACKBURN | W772: GEELONG ASSOC. | X772: 4 | Y772: 13 | Z772: 0 | AA772: 935 | AB772: 1243 | AC772: 75.221238938053091 | AD772: 16
A773: BEST PLAYERS | W773: CAMBERWELL | X773: 4 | Y773: 13 | Z773: 0 | AA773: 980 | AB773: 1343 | AC773: 72.970960536113182 | AD773: 16
A774: NORTHCOTE | D774: H SMITH | G774: DIMMICK | J774: T DOWNES | M774: GOUGH | O774: SHEEHY | Q774: WOODS | W774: WILLIAMSTOWN | X774: 3 | Y774: 14 | Z774: 0 | AA774: 845 | AB774: 1458 | AC774: 57.95610425240055 | AD774: 12
A775: PRAHRAN | D775: HARVEY | G775: REYNOLDS | J775: OSBORNE | M775: E JONES | O775: B SMITH | Q775: F SMITH
A776: GOALKICKERS
A777: NORTHCOTE | D777: GOUGH 5 | G777: T DOWNES 4 | J777: R DOWNES 2 | M777: DESLANDES
A778: PRAHRAN | D778: HARLEY 5 | G778: ROWE 2 | I778: B SMITH 2 | L778: REYNOLDS | N778: SHORT | P778: PROCTOR
A780: COBURG | C780: 5 | D780: 5 | E780: =C780*6+D780 -> 35 | G780: 11 | H780: 6 | I780: =G780*6+H780 -> 72 | K780: 17 | L780: 9 | M780: =K780*6+L780 -> 111 | O780: 22 | P780: 14 | Q780: =O780*6+P780 -> 146 | S780: COBURG
A781: GEELONG ASSOC. | C781: 1 | D781: 3 | E781: =C781*6+D781 -> 9 | G781: 3 | H781: 7 | I781: =G781*6+H781 -> 25 | K781: 3 | L781: 8 | M781: =K781*6+L781 -> 26 | O781: 6 | P781: 9 | Q781: =O781*6+P781 -> 45 | S781: FURLONG
A782: BEST PLAYERS
A783: COBURG | D783: C MARTYN | G783: HARRIS | J783: E MARTIN | M783: DURIE | P783: ADAMS | S783: PLANT
A784: GEELONG ASSOC. | D784: HARRIS | G784: POWELL | J784: BLISS | M784: J McINERNEY | P784: CATIONS | S784: FARRELLY
A785: GOALKICKERS
A786: COBURG | D786: PLANT 7 | G786: GARDINER 6 | J786: FORBES 4 | M786: MEARS 3 | O786: JENKINS | R786: SEXTON
A787: GEELONG ASSOC. | D787: BLISS 2 | G787: ARMSTRONG 2 | K787: HARRIS | M787: ROACH
A789: PRESTON | C789: 8 | D789: 8 | E789: =C789*6+D789 -> 56 | G789: 10 | H789: 8 | I789: =G789*6+H789 -> 68 | K789: 15 | L789: 12 | M789: =K789*6+L789 -> 102 | O789: 21 | P789: 12 | Q789: =O789*6+P789 -> 138 | S789: PRESTON
A790: WILLIAMSTOWN | C790: 1 | D790: 2 | E790: =C790*6+D790 -> 8 | G790: 5 | H790: 6 | I790: =G790*6+H790 -> 36 | K790: 5 | L790: 7 | M790: =K790*6+L790 -> 37 | O790: 7 | P790: 8 | Q790: =O790*6+P790 -> 50 | S790: PETERS
A791: BEST PLAYERS
A792: PRESTON | D792: ELLIS | G792: HUME | J792: A STEVENS | M792: SHERMAN | P792: DOBRIGH | S792: ROBERTSON
A793: WILLIAMSTOWN | D793: MARTIN | G793: RIGALDI | J793: KENNY | M793: WIGNALL | P793: J MUNN | S793: GEISLER
A794: GOALKICKERS
A795: PRESTON | D795: ELLIS 6 | F795: HUME 6 | H795: A STEVENS 2 | K795: A LUDLOW 2 | N795: SKIPPER | P795: J LUDLOW | R795: MARMO | U795: SUMMERS | X795: WARR
A796: WILLIAMSTOWN | D796: KENNY 3 | G796: RIGALDI 2 | J796: MARTIN | L796: PORTER
A798: BRUNSWICK | S798: FORFEITED TO CAMBERWELL
A799: CAMBERWELL
A801: ROUND 18 | E801: 28TH AUGUST | J801: WEATHER | M801: FINE NORTH BREEZE | S801: PLAYED AT | X801: LADDER | AB801: ROUND | AD801: 18
D802: 1ST QTR | H802: 2ND QTR | L802: 3RD QTR | P802: FINAL | S802: NORTHCOTE
A803: NORTHCOTE | C803: 4 | D803: 4 | E803: =C803*6+D803 -> 28 | G803: 6 | H803: 6 | I803: =G803*6+H803 -> 42 | K803: 11 | L803: 7 | M803: =K803*6+L803 -> 73 | O803: 13 | P803: 8 | Q803: =O803*6+P803 -> 86 | S803: UMPIRE | W803: TEAM | X803: W | Y803: L | Z803: D | AA803: FOR | AB803: AGST | AC803: % | AD803: PTS
A804: PORT MELBOURNE | C804: 3 | D804: 3 | E804: =C804*6+D804 -> 21 | G804: 6 | H804: 11 | I804: =G804*6+H804 -> 47 | K804: 8 | L804: 12 | M804: =K804*6+L804 -> 60 | O804: 11 | P804: 13 | Q804: =O804*6+P804 -> 79 | S804: MURRAY
A805: BEST PLAYERS | W805: COBURG | X805: 15 | Y805: 3 | Z805: 0 | AA805: 1777 | AB805: 1036 | AC805: 171.52509652509653 | AD805: 60
A806: NORTHCOTE | D806: WHITTAKER | G806: ROGAN | I806: GOUGH | K806: AHERN | N806: SHEEHY | Q806: PERKINS | W806: NORTHCOTE | X806: 14 | Y806: 4 | Z806: 0 | AA806: 1221 | AB806: 1054 | AC806: 115.84 | AD806: 56
A807: PORT MELBOURNE | D807: GARBUTT | G807: W RUDD | I807: MERRICK | K807: BARFOOT | N807: H BOLMAN | Q807: PERRETT | W807: PORT MELBOURNE | X807: 13 | Y807: 5 | Z807: 0 | AA807: 1445 | AB807: 1036 | AC807: 139.47876447876448 | AD807: 52
A808: GOALKICKERS | W808: BRIGHTON | X808: 12 | Y808: 6 | Z808: 0 | AA808: 1432 | AB808: 1302 | AC808: 109.98 | AD808: 48
A809: NORTHCOTE | D809: GOUGH 5 | F809: PERKINS 2 | I809: T DOWNES 2 | L809: LEAKE | N809: R DOWNES | Q809: DIMMICK | S809: DESLANDES
A810: PORT MELBOURNE | D810: MERRICK 6 | G810: SKILTON 2 | J810: BARFOOT | L810: REES | N810: SLOLEY | W810: BRUNSWICK | X810: 9 | Y810: 9 | Z810: 0 | AA810: 1005 | AB810: 980 | AC810: 102.55102040816327 | AD810: 36
W811: PRESTON | X811: 9 | Y811: 9 | Z811: 0 | AA811: 1304 | AB811: 1326 | AC811: 98.340874811463053 | AD811: 36
A812: BRIGHTON | C812: 3 | D812: 6 | E812: =C812*6+D812 -> 24 | G812: 7 | H812: 9 | I812: =G812*6+H812 -> 51 | K812: 9 | L812: 9 | M812: =K812*6+L812 -> 63 | O812: 12 | P812: 15 | Q812: =O812*6+P812 -> 87 | S812: KARDINIA PARK | W812: PRAHRAN | X812: 6 | Y812: 12 | Z812: 0 | AA812: 1326 | AB812: 1477 | AC812: 89.776574136763713 | AD812: 24
A813: GEELONG ASSOC. | C813: 1 | D813: 3 | E813: =C813*6+D813 -> 9 | G813: 8 | H813: 7 | I813: =G813*6+H813 -> 55 | K813: 8 | L813: 10 | M813: =K813*6+L813 -> 58 | O813: 10 | P813: 12 | Q813: =O813*6+P813 -> 72 | S813: FURLONG | W813: GEELONG ASSOC. | X813: 4 | Y813: 14 | Z813: 0 | AA813: 1007 | AB813: 1330 | AC813: 75.714285714285708 | AD813: 16
A814: BEST PLAYERS | W814: CAMBERWELL | X814: 4 | Y814: 14 | Z814: 0 | AA814: 1046 | AB814: 1412 | AC814: 74.079320113314452 | AD814: 16
A815: BRIGHTON | D815: HUNT | G815: RINGROSE | I815: GARCIA | K815: CARROLL | N815: RATTRAY | Q815: BORLAND | W815: WILLIAMSTOWN | X815: 4 | Y815: 14 | Z815: 0 | AA815: 914 | AB815: 1524 | AC815: 59.973753280839894 | AD815: 16
A816: GEELONG ASSOC. | D816: CATIONS | G816: NOONAN | I816: KEANE | K816: DEAN | N816: HILL | Q816: MACK
A817: GOALKICKERS
A818: BRIGHTON | D818: WALSH 6 | G818: FRIEND 2 | J818: HUNT 2 | M818: RINGROSE | P818: BESWICK
A819: GEELONG ASSOC. | D819: NOONAN 3 | G819: ARMSTRONG 2 | J819: BLISS 2 | L819: DEAN | N819: HARRIS | P819: FARRELLY
A821: WILLIAMSTOWN | C821: 2 | D821: 1 | E821: =C821*6+D821 -> 13 | G821: 5 | H821: 7 | I821: =G821*6+H821 -> 37 | K821: 8 | L821: 8 | M821: =K821*6+L821 -> 56 | O821: 10 | P821: 9 | Q821: =O821*6+P821 -> 69 | S821: WILLIAMSTOWN
A822: CAMBERWELL | C822: 3 | D822: 0 | E822: =C822*6+D822 -> 18 | G822: 6 | H822: 3 | I822: =G822*6+H822 -> 39 | K822: 8 | L822: 10 | M822: =K822*6+L822 -> 58 | O822: 9 | P822: 12 | Q822: =O822*6+P822 -> 66 | S822: BLACKBURN
A823: BEST PLAYERS
A824: WILLIAMSTOWN | D824: MARIN | G824: GEISLER | I824: THOMPSON | L824: MUNRO | N824: J MUNN | Q824: FLANNERY
A825: CAMBERWELL | D825: YOLE | G825: SEIDEL | I825: WOODFORD | L825: POOLE | N825: CONNOP | Q825: OWENS
A826: GOALKICKERS
A827: WILLIAMSTOWN | D827: THOMPSON 2 | G827: J MUNN 2 | I827: PORTER 2 | K827: BEER | L827: KENNY | N827: MUNRO | P827: MARTIN
A828: CAMBERWELL | D828: WOODFORD 5 | G828: OWENS 2 | I828: HORNE | K828: SEIDEL
A830: COBURG | C830: 4 | D830: 1 | E830: =C830*6+D830 -> 25 | G830: 13 | H830: 5 | I830: =G830*6+H830 -> 83 | K830: 16 | L830: 8 | M830: =K830*6+L830 -> 104 | O830: 22 | P830: 12 | Q830: =O830*6+P830 -> 144 | S830: COBURG
A831: PRAHRAN | C831: 2 | D831: 1 | E831: =C831*6+D831 -> 13 | G831: 2 | H831: 2 | I831: =G831*6+H831 -> 14 | K831: 6 | L831: 3 | M831: =K831*6+L831 -> 39 | O831: 11 | P831: 4 | Q831: =O831*6+P831 -> 70 | S831: MAKER
A832: BEST PLAYERS
A833: COBURG | D833: SPEAKMAN | G833: FORD | J833: FORBES | M833: C MARTYN | P833: ADAMS | R833: HARRIS
A834: PRAHRAN | D834: HARLEY | G834: REYNOLDS | J834: SMITH | M834: SPAIN | P834: VANCE | R834: DARVALL
A835: GOALKICKERS
A836: COBURG | D836: GARDINER 10 | G836: PLANT 4 | I836: MEARS 3 | K836: SPEAKMAN 2 | N836: C MARTYN | Q836: JENKINS | S836: HUNTINGTON
A837: PRAHRAN | D837: HARLEY 4 | G837: FULLING 2 | J837: SHORT 2 | M837: ROWE | O837: FARRINGTON | R837: DARVALL
A839: BRUNSWICK | S839: BRUNSWICK FORFEITED TO PRESTON
A840: PRESTON
A842: FINALS
A843: 1ST SEMI | E843: 4TH SEPTEMBER | J843: WEATHER | M843: CLOUDY SOUTH BREEZE
D844: 1ST QTR | H844: 2ND QTR | L844: 3RD QTR | P844: FINAL
A845: BRIGHTON | C845: 3 | D845: 2 | E845: =C845*6+D845 -> 20 | G845: 3 | H845: 3 | I845: =G845*6+H845 -> 21 | K845: 7 | L845: 4 | M845: =K845*6+L845 -> 46 | O845: 8 | P845: 6 | Q845: =O845*6+P845 -> 54 | S845: MOTORDROME
A846: NORTHCOTE | C846: 2 | D846: 2 | E846: =C846*6+D846 -> 14 | G846: 4 | H846: 3 | I846: =G846*6+H846 -> 27 | K846: 5 | L846: 6 | M846: =K846*6+L846 -> 36 | O846: 6 | P846: 6 | Q846: =O846*6+P846 -> 42 | S846: MURRAY
A847: BEST PLAYERS
A848: BRIGHTON | D848: RINGROSE | G848: RATTRAY | J848: GARCIA | M848: KOLLE | O848: WALSH | R848: MITCHELL
A849: NORTHCOTE | D849: T DOWNES | G849: PERKINS | J849: GOUGH | M849: DIMMICK | O849: BROWN | R849: LONG
A850: GOALKICKERS
A851: BRIGHTON | D851: WALSH 5 | G851: IRWIN | J851: FRIEND | M851: BOYD
A852: NORTHCOTE | D852: GOUGH 4 | G852: R DOWNES | J852: AHERN
A854: 2ND SEMI | E854: 11TH SEPTEMBER | J854: WEATHER | M854: CLOUDY WEST BREEZE
A855: COBURG | C855: 1 | D855: 3 | E855: =C855*6+D855 -> 9 | G855: 5 | H855: 7 | I855: =G855*6+H855 -> 37 | K855: 8 | L855: 14 | M855: =K855*6+L855 -> 62 | O855: 9 | P855: 14 | Q855: =O855*6+P855 -> 68 | S855: MOTORDROME
A856: PORT MELBOURNE | C856: 0 | D856: 3 | E856: =C856*6+D856 -> 3 | G856: 1 | H856: 6 | I856: =G856*6+H856 -> 12 | K856: 2 | L856: 9 | M856: =K856*6+L856 -> 21 | O856: 5 | P856: 11 | Q856: =O856*6+P856 -> 41 | S856: MAKER
A857: BEST PLAYERS
A858: COBURG | D858: C MARTYN | G858: FORD | J858: E MARTIN | M858: ADAMS | O858: CHARLESWORTH | S858: PLANT
A859: PORT MELBOURNE | D859: W RUDD | G859: H BOLMAN | J859: REES | M859: CROMPTON | O859: CAMPBELL | S859: MERRICK
A860: GOALKICKERS
A861: COBURG | D861: PLANT 3 | G861: SPEAKMAN 2 | J861: GARDINER | M861: HUNTINGTON | P861: KERLEY | R861: MEARS
A862: PORT MELBOURNE | D862: MERRICK 2 | G862: M JOHNSON | J862: BARFOOT | M862: CAMPBELL
A864: FINAL | E864: 18TH SEPTEMBER | J864: WEATHER
A865: COBURG | C865: 5 | D865: 3 | E865: 33 | G865: 6 | H865: 3 | I865: 39 | K865: 10 | L865: 7 | M865: 67 | O865: 12 | P865: 9 | Q865: =O865*6+P865 -> 81 | S865: MOTORDROME
A866: BRIGHTON | C866: 2 | D866: 2 | E866: 14 | G866: 6 | H866: 4 | I866: 40 | K866: 7 | L866: 6 | M866: 48 | O866: 9 | P866: 11 | Q866: =O866*6+P866 -> 65 | S866: MURRAY
A867: BEST PLAYERS
A868: COBURG | D868: E MARTIN | G868: GARDINER | J868: C MARTYN | M868: KERLEY | P868: ADAMS | R868: MEARS
A869: BRIGHTON | D869: CARROLL | G869: DORE | J869: ALDRIDGE | M869: WALSH | P869: RATTRAY | R869: BOYD
A870: GOALKICKERS
A871: COBURG | D871: GARDINER 4 | G871: HUNTINGTON 2 | J871: HARRIS 2 | M871: PLANT 2 | O871: KERLEY
A872: BRIGHTON | D872: WALSH 5 | G872: BOYD | I872: HUNT | K872: CARROLL | M872: RATTRAY
A874: TEAMS
G875: COBURG | R875: BRIGHTON
A876: BACKS | C876: A MARTYN | G876: ADAM | K876: FAUST | P876: GARCIA | S876: KOLLE | W876: DORE
A877: H-BACKS | C877: CHAPMAN | G877: FORD | K877: CHARLESTON | P877: ACKERS | S877: RATTRAY | W877: IRWIN
A878: CENTRES | C878: SEXTON | G878: C MARTYN | K878: E MARTIN | P878: CARROLL | S878: ALDRIDGE | W878: BORLAND
A879: H-FORWARDS | C879: HUNTINGTON | G879: KERLEY | K879: HARRIS | P879: HUNT | S879: DAINTY | W879: BESWICK
A880: FORWARDS | C880: SPEARMAN | G880: GARDINER | K880: PLANT | P880: FRIEND | S880: WALSH | W880: MITCHELL
A881: RUCKS | C881: JENKINS | G881: BROOKS | K881: MEARS | P881: BOYD | S881: ATKINSON | W881: RINGROSE