A1: Victorian Football Association
A2: Season 1927
A3: © Copyright Wal Williams | F3: First created: 2 November 2014
A4: Contact: joywalwi at gmail dot com | F4: Last updated: 27 January 2018 | W4: VFA Results and tables - Link to the main index page
A5: You are free to copy this document in whole or part provided that proper acknowledgement is given to the author. All rights reserved.
A7: YEAR 1927
A8: ROUND 1 | E8: 30TH APRIL | J8: WEATHER | M8: FINE STRONG NORTH WIND | S8: PLAYED AT | X8: LADDER | AB8: ROUND | AD8: 1
D9: 1ST QTR | H9: 2ND QTR | L9: 3RD QTR | P9: FINAL | S9: CAMBERWELL
A10: CAMBERWELL | C10: 3 | D10: 4 | E10: =C10*6+D10 -> 22 | G10: 9 | H10: 8 | I10: =G10*6+H10 -> 62 | K10: 11 | L10: 9 | M10: =K10*6+L10 -> 75 | O10: 13 | P10: 10 | Q10: =O10*6+P10 -> 88 | S10: UMPIRE | W10: TEAM | X10: W | Y10: L | Z10: D | AA10: FOR | AB10: AGST | AC10: % | AD10: PTS
A11: WILLIAMSTOWN | C11: 1 | D11: 3 | E11: =C11*6+D11 -> 9 | G11: 4 | H11: 5 | I11: =G11*6+H11 -> 29 | K11: 9 | L11: 8 | M11: =K11*6+L11 -> 62 | O11: 10 | P11: 14 | Q11: =O11*6+P11 -> 74 | S11: PETERS (LESTER)
A12: BEST PLAYERS | W12: PRAHRAN | X12: 1 | Y12: 0 | Z12: 0 | AA12: 92 | AB12: 31 | AC12: 296.77419354838707 | AD12: 4
A13: CAMBERWELL | D13: ALBERRY | G13: GREENBURY | J13: WOODFORD | M13: HUNTER | O13: LAWN | Q13: DIMOND | W13: PORT MELBOURNE | X13: 1 | Y13: 0 | Z13: 0 | AA13: 96 | AB13: 53 | AC13: 181.1320754716981 | AD13: 4
A14: WILLIAMSTOWN | D14: McKAY | G14: BALL | J14: MURPHY | M14: J MUNN | O14: WARREN | Q14: LORD | W14: COBURG | X14: 1 | Y14: 0 | Z14: 0 | AA14: 112 | AB14: 68 | AC14: 164.70588235294119 | AD14: 4
A15: GOALKICKERS | W15: PRESTON | X15: 1 | Y15: 0 | Z15: 0 | AA15: 85 | AB15: 60 | AC15: 141.66666666666666 | AD15: 4
A16: CAMBERWELL | D16: WOODFORD 6 | G16: LAWN 3 | I16: DIMOND | K16: GREENBURY | N16: BAZIN | P16: ELLIOTT
A17: WILLIAMSTOWN | D17: J MARTIN 2 | G17: MENHENNIT 2 | J17: N WALKER 2 | M17: J MUNN 2 | O17: MURPHY | Q17: WHITBURN | W17: CAMBERWELL | X17: 1 | Y17: 0 | Z17: 0 | AA17: 88 | AB17: 74 | AC17: 118.91891891891892 | AD17: 4
W18: WILLIAMSTOWN | X18: 0 | Y18: 1 | Z18: 0 | AA18: 74 | AB18: 88 | AC18: 84.090909090909093 | AD18: 0
A19: COBURG | C19: 3 | D19: 1 | E19: =C19*6+D19 -> 19 | G19: 6 | H19: 5 | I19: =G19*6+H19 -> 41 | K19: 9 | L19: 7 | M19: =K19*6+L19 -> 61 | O19: 17 | P19: 10 | Q19: =O19*6+P19 -> 112 | S19: COBURG | W19: BRUNSWICK | X19: 0 | Y19: 1 | Z19: 0 | AA19: 60 | AB19: 85 | AC19: 70.588235294117652 | AD19: 0
A20: BRIGHTON | C20: 0 | D20: 3 | E20: =C20*6+D20 -> 3 | G20: 3 | H20: 8 | I20: =G20*6+H20 -> 26 | K20: 7 | L20: 13 | M20: =K20*6+L20 -> 55 | O20: 9 | P20: 14 | Q20: =O20*6+P20 -> 68 | S20: ALLEY | W20: BRIGHTON | X20: 0 | Y20: 1 | Z20: 0 | AA20: 68 | AB20: 112 | AC20: 60.714285714285715 | AD20: 0
A21: BEST PLAYERS | W21: NORTHCOTE | X21: 0 | Y21: 1 | Z21: 0 | AA21: 53 | AB21: 96 | AC21: 55.208333333333336 | AD21: 0
A22: COBURG | D22: C MARTYN | G22: PLANT | I22: FAUST | K22: A MARTYN | N22: GARDINER | Q22: HARRIS | W22: GEELONG ASSOC. | X22: 0 | Y22: 1 | Z22: 0 | AA22: 31 | AB22: 92 | AC22: 33.695652173913047 | AD22: 0
A23: BRIGHTON | D23: CARROLL | G23: BOYD | I23: RATTRAY | K23: HUNT | N23: GREAVES | Q23: BORLAND
A24: GOALKICKERS
A25: COBURG | D25: PLANT 7 | G25: GARDINER 5 | J25: KERLEY 4 | M25: MEARS
A26: BRIGHTON | D26: BOYD 2 | F26: JAMES 2 | H26: RATTRAY 2 | K26: WALSH | M26: ALDRIDGE | O26: CARSWELL
A28: PORT MELBOURNE | C28: 2 | D28: 1 | E28: =C28*6+D28 -> 13 | G28: 5 | H28: 6 | I28: =G28*6+H28 -> 36 | K28: 10 | L28: 11 | M28: =K28*6+L28 -> 71 | O28: 14 | P28: 12 | Q28: =O28*6+P28 -> 96 | S28: PORT MELBOURNE
A29: NORTHCOTE | C29: 0 | D29: 5 | E29: =C29*6+D29 -> 5 | G29: 1 | H29: 6 | I29: =G29*6+H29 -> 12 | K29: 6 | L29: 3 | M29: =K29*6+L29 -> 39 | O29: 7 | P29: 11 | Q29: =O29*6+P29 -> 53 | S29: MAHER (LYNCH)
A30: BEST PLAYERS
A31: PORT MELBOURNE | D31: CARPENTER | G31: KEYHOE | I31: DAVENPORT | L31: FARNAN | N31: FORBES | Q31: GARBUTT
A32: NORTHCOTE | D32: H SMITH | G32: PERKINS | I32: WOODS | L32: LAFFY | N32: LEAKE | Q32: GOODRICK
A33: GOALKICKERS
A34: PORT MELBOURNE | D34: McMEEKIN 4 | G34: MERRICK 2 | J34: KENNEDY 2 | M34: FROUD 2 | O34: FORBES | Q34: UREN | R34: LOVETT | U34: GARBUTT
A35: NORTHCOTE | D35: POWELL 2 | G35: GOUGH 2 | J35: LEAKE 2 | M35: DOLLOFFSKY
A37: PRESTON | C37: 4 | D37: 3 | E37: =C37*6+D37 -> 27 | G37: 6 | H37: 6 | I37: =G37*6+H37 -> 42 | K37: 9 | L37: 8 | M37: =K37*6+L37 -> 62 | O37: 12 | P37: 13 | Q37: =O37*6+P37 -> 85 | S37: PRESTON
A38: BRUNSWICK | C38: 3 | D38: 1 | E38: =C38*6+D38 -> 19 | G38: 6 | H38: 3 | I38: =G38*6+H38 -> 39 | K38: 7 | L38: 3 | M38: =K38*6+L38 -> 45 | O38: 9 | P38: 6 | Q38: =O38*6+P38 -> 60 | S38: MACHAR (McKINNON)
A39: BEST PLAYERS
A40: PRESTON | D40: HUME | G40: A STEVENS | J40: DILLON | M40: WARR | O40: WHITE | Q40: DOBRIGH
A41: BRUNSWICK | D41: HART | G41: REID | J41: HARRIS | M41: KENNETT | O41: GARSIDE | Q41: SAYNOR
A42: GOALKICKERS
A43: PRESTON | D43: HUME 7 | G43: CONNAUGHTON 2 | K43: A STEVENS | N43: SKIPPER | P43: SUMMERS
A44: BRUNSWICK | D44: HART 4 | G44: WRIGHT | I44: ROBERTS | K44: GARSIDE | M44: PENMAN | O44: HAIG
A46: PRAHRAN | C46: 3 | D46: 7 | E46: =C46*6+D46 -> 25 | G46: 5 | H46: 9 | I46: =G46*6+H46 -> 39 | K46: 11 | L46: 13 | M46: =K46*6+L46 -> 79 | O46: 13 | P46: 14 | Q46: =O46*6+P46 -> 92 | S46: WEST OVAL
A47: GEELONG ASSOC. | C47: 0 | D47: 0 | E47: =C47*6+D47 -> 0 | G47: 1 | H47: 4 | I47: =G47*6+H47 -> 10 | K47: 2 | L47: 5 | M47: =K47*6+L47 -> 17 | O47: 4 | P47: 7 | Q47: =O47*6+P47 -> 31 | S47: MURRAY (SCHAEFER)
A48: BEST PLAYERS
A49: PRAHRAN | D49: RUSSELL | G49: HARLEY | I49: SNELL | L49: CROSSEN | O49: HANDLEY | Q49: SHORT
A50: GEELONG ASSOC. | D50: WRIGHT | G50: CATIONS | I50: HARRIS | L50: SCANLON | O50: HAINES | Q50: JONES
A51: GOALKICKERS
A52: PRAHRAN | D52: HARLEY 7 | G52: ROWE 2 | I52: PARKER | K52: WOODS | M52: CROSSEN | O52: WHITELEY
A53: GEELONG ASSOC. | D53: HARRIS 3 | G53: BLISS
A55: ROUND 2 | E55: 7TH MAY | J55: WEATHER | M55: FINE MILD STRONG N. WIND | S55: PLAYED AT | X55: LADDER | AB55: ROUND | AD55: 2
D56: 1ST QTR | H56: 2ND QTR | L56: 3RD QTR | P56: FINAL | S56: TOORAK PARK
A57: PRESTON | C57: 2 | D57: 7 | E57: =C57*6+D57 -> 19 | G57: 5 | H57: 11 | I57: =G57*6+H57 -> 41 | K57: 10 | L57: 17 | M57: =K57*6+L57 -> 77 | O57: 11 | P57: 18 | Q57: =O57*6+P57 -> 84 | S57: UMPIRE | W57: TEAM | X57: W | Y57: L | Z57: D | AA57: FOR | AB57: AGST | AC57: % | AD57: PTS
A58: PRAHRAN | C58: 3 | D58: 0 | E58: =C58*6+D58 -> 18 | G58: 6 | H58: 4 | I58: =G58*6+H58 -> 40 | K58: 7 | L58: 5 | M58: =K58*6+L58 -> 47 | O58: 9 | P58: 7 | Q58: =O58*6+P58 -> 61 | S58: MACHAR
A59: BEST PLAYERS | W59: COBURG | X59: 2 | Y59: 0 | Z59: 0 | AA59: 212 | AB59: 103 | AC59: 205.82524271844659 | AD59: 8
A60: PRESTON | D60: A STEVENS | G60: SURTEES | I60: WARR | L60: SUMMERS | O60: WATT | Q60: HUME | W60: PORT MELBOURNE | X60: 2 | Y60: 0 | Z60: 0 | AA60: 176 | AB60: 121 | AC60: 145.45454545454547 | AD60: 8
A61: PRAHRAN | D61: VANCE | G61: HARLEY | I61: F SMITH | L61: OSBORNE | O61: PARKER | Q61: CROSSEN | W61: PRESTON | X61: 2 | Y61: 0 | Z61: 0 | AA61: 169 | AB61: 121 | AC61: 139.6694214876033 | AD61: 8
A62: GOALKICKERS | W62: PRAHRAN | X62: 1 | Y62: 1 | Z62: 0 | AA62: 153 | AB62: 115 | AC62: 133.04347826086956 | AD62: 4
A63: PRESTON | D63: HUME 5 | G63: A STEVENS 2 | J63: SUMMERS 2 | M63: GRAY | O63: ELLIS
A64: PRAHRAN | D64: PARKER 3 | G64: SHORT 2 | J64: PROCTOR 2 | M64: HARLEY 2 | W64: WILLIAMSTOWN | X64: 1 | Y64: 1 | Z64: 0 | AA64: 141 | AB64: 122 | AC64: 115.57377049180327 | AD64: 4
W65: NORTHCOTE | X65: 1 | Y65: 1 | Z65: 0 | AA65: 165 | AB65: 167 | AC65: 98.802395209580837 | AD65: 4
A66: COBURG | C66: 3 | D66: 7 | E66: =C66*6+D66 -> 25 | G66: 5 | H66: 8 | I66: =G66*6+H66 -> 38 | K66: 9 | L66: 14 | M66: =K66*6+L66 -> 68 | O66: 14 | P66: 16 | Q66: =O66*6+P66 -> 100 | S66: BRUNSWICK | W66: CAMBERWELL | X66: 1 | Y66: 1 | Z66: 0 | AA66: 159 | AB66: 186 | AC66: 85.483870967741936 | AD66: 4
A67: BRUNSWICK | C67: 0 | D67: 2 | E67: =C67*6+D67 -> 2 | G67: 1 | H67: 5 | I67: =G67*6+H67 -> 11 | K67: 1 | L67: 8 | M67: =K67*6+L67 -> 14 | O67: 4 | P67: 11 | Q67: =O67*6+P67 -> 35 | S67: PETERS | W67: BRIGHTON | X67: 0 | Y67: 2 | Z67: 0 | AA67: 136 | AB67: 192 | AC67: 70.833333333333329 | AD67: 0
A68: BEST PLAYERS | W68: BRUNSWICK | X68: 0 | Y68: 2 | Z68: 0 | AA68: 95 | AB68: 185 | AC68: 51.351351351351354 | AD68: 0
A69: COBURG | D69: FORD | F69: CHAPMAN | I69: E MARTIN | L69: HARRIS | N69: A MARTYN | Q69: MEARS | W69: GEELONG ASSOC. | X69: 0 | Y69: 2 | Z69: 0 | AA69: 65 | AB69: 159 | AC69: 40.880503144654085 | AD69: 0
A70: BRUNSWICK | D70: PARKER | F70: PARKHILL | I70: PENMAN | L70: HARRIS | N70: KENNETT | Q70: JONES
A71: GOALKICKERS
A72: COBURG | D72: PLANT 3 | F72: GARDINER 3 | I72: FORBES 3 | K72: KERLEY 2 | M72: HUNTINGTON | P72: HARRIS | R72: MEARS
A73: BRUNSWICK | D73: ROBERTS 2 | G73: JONES | J73: ALESSIO
A75: NORTHCOTE | C75: 3 | D75: 4 | E75: =C75*6+D75 -> 22 | G75: 7 | H75: 7 | I75: =G75*6+H75 -> 49 | K75: 10 | L75: 11 | M75: =K75*6+L75 -> 71 | O75: 16 | P75: 16 | Q75: =O75*6+P75 -> 112 | S75: NORTHCOTE
A76: CAMBERWELL | C76: 3 | D76: 5 | E76: =C76*6+D76 -> 23 | G76: 6 | H76: 6 | I76: =G76*6+H76 -> 42 | K76: 7 | L76: 10 | M76: =K76*6+L76 -> 52 | O76: 10 | P76: 11 | Q76: =O76*6+P76 -> 71 | S76: MURRAY
A77: BEST PLAYERS
A78: NORTHCOTE | D78: GOUGH | G78: ADAMS | J78: PERKINS | M78: GALL | P78: STOTT | S78: LEAKE
A79: CAMBERWELL | D79: LAWN | G79: ALBERRY | J79: KARTHAUS | M79: HORNE | P79: DIMOND | S79: TRESIZE
A80: GOALKICKERS
A81: NORTHCOTE | D81: GOUGH 5 | F81: ADAMS 4 | I81: REILLY 2 | K81: GALL 2 | M81: THEOBOLD | O81: DOLLOFFSKY | R81: STOTT
A82: CAMBERWELL | D82: WOODFORD 3 | G82: ALBERRY 2 | J82: BAZIN | L82: GREENBURY | O82: KARTHAUS | R82: PAGE | T82: LAWN
A84: WILLIAMSTOWN | C84: 2 | D84: 4 | E84: =C84*6+D84 -> 16 | G84: 4 | H84: 4 | I84: =G84*6+H84 -> 28 | K84: 10 | L84: 5 | M84: =K84*6+L84 -> 65 | O84: 10 | P84: 7 | Q84: =O84*6+P84 -> 67 | S84: WILLIAMSTOWN
A85: GEELONG ASSOC. | C85: 0 | D85: 1 | E85: =C85*6+D85 -> 1 | G85: 1 | H85: 6 | I85: =G85*6+H85 -> 12 | K85: 2 | L85: 6 | M85: =K85*6+L85 -> 18 | O85: 4 | P85: 10 | Q85: =O85*6+P85 -> 34 | S85: BLACKBURN
A86: BEST PLAYERS
A87: WILLIAMSTOWN | D87: J MUNN | G87: BEER | J87: MARTIN | M87: LORD | P87: JOHNS | S87: DREW
A88: GEELONG ASSOC. | D88: RANKIN | G88: ROACH | J88: LEIGHTON | M88: McMANUS | P88: CATIONS | S88: ARMSTRONG
A89: GOALKICKERS
A90: WILLIAMSTOWN | D90: J MUNN 2 | G90: J MARTIN 2 | J90: JOHNS | L90: LORD | N90: MENHENNIT | Q90: QUINN | S90: DREW
A91: GEELONG ASSOC. | D91: ARMSTRONG 2 | G91: BUSHELL | J91: SCANLON
A93: PORT MELBOURNE | C93: 3 | D93: 11 | E93: =C93*6+D93 -> 29 | G93: 3 | H93: 12 | I93: =G93*6+H93 -> 30 | K93: 9 | L93: 18 | M93: =K93*6+L93 -> 72 | O93: 10 | P93: 20 | Q93: =O93*6+P93 -> 80 | S93: BRIGHTON BEACH
A94: BRIGHTON | C94: 1 | D94: 1 | E94: =C94*6+D94 -> 7 | G94: 6 | H94: 5 | I94: =G94*6+H94 -> 41 | K94: 7 | L94: 5 | M94: =K94*6+L94 -> 47 | O94: 9 | P94: 14 | Q94: =O94*6+P94 -> 68 | S94: MAHAR
A95: BEST PLAYERS
A96: PORT MELBOURNE | D96: JOHNSTONE | G96: RUDD | J96: FORBES | M96: TAYLOR | P96: GARBUTT | S96: SKILTON
A97: BRIGHTON | D97: CARROLL | G97: RATTRAY | J97: ALDRIDGE | M97: WALSH | P97: DAINTY | S97: KOLLE
A98: GOALKICKERS
A99: PORT MELBOURNE | D99: TAYLOR 3 | G99: BARFOOT 2 | J99: MERRICK 2 | M99: GARBUTT | O99: SKILTON | Q99: PRICE
A100: BRIGHTON | D100: WALSH 2 | G100: GREAVES | I100: BOYD | J100: McCARTHY | M100: BESWICK | O100: RATTRAY | Q100: HUNT | S100: ALDRIDGE
A102: ROUND 3 | E102: 14TH MAY | J102: WEATHER | M102: FINE STRONG NORTH WIND | S102: PLAYED AT | X102: LADDER | AB102: ROUND | AD102: 3
D103: 1ST QTR | H103: 2ND QTR | L103: 3RD QTR | P103: FINAL | S103: COBURG
A104: COBURG | C104: 7 | D104: 6 | E104: =C104*6+D104 -> 48 | G104: 10 | H104: 7 | I104: =G104*6+H104 -> 67 | K104: 13 | L104: 14 | M104: =K104*6+L104 -> 92 | O104: 14 | P104: 14 | Q104: =O104*6+P104 -> 98 | S104: UMPIRE | W104: TEAM | X104: W | Y104: L | Z104: D | AA104: FOR | AB104: AGST | AC104: % | AD104: PTS
A105: WILLIAMSTOWN | C105: 0 | D105: 0 | E105: =C105*6+D105 -> 0 | G105: 3 | H105: 5 | I105: =G105*6+H105 -> 23 | K105: 4 | L105: 8 | M105: =K105*6+L105 -> 32 | O105: 7 | P105: 13 | Q105: =O105*6+P105 -> 55 | S105: THOMAS
A106: BEST PLAYERS | W106: COBURG | X106: 3 | Y106: 0 | Z106: 0 | AA106: 310 | AB106: 158 | AC106: 196.20253164556962 | AD106: 12
A107: COBURG | D107: E MARTIN | G107: MEARS | I107: MARCHESI | L107: A MARTYN | O107: BROOKS | Q107: PLANT | W107: PORT MELBOURNE | X107: 3 | Y107: 0 | Z107: 0 | AA107: 208 | AB107: 145 | AC107: 143.44827586206895 | AD107: 12
A108: WILLIAMSTOWN | D108: J MARTIN | G108: SCOONES | I108: MENHENNIT | L108: JOHNS | O108: MEEHAN | Q108: WARREN | W108: PRESTON | X108: 3 | Y108: 0 | Z108: 0 | AA108: 258 | AB108: 205 | AC108: 125.85365853658537 | AD108: 12
A109: GOALKICKERS | W109: CAMBERWELL | X109: 2 | Y109: 1 | Z109: 0 | AA109: 293 | AB109: 287 | AC109: 102.09 | AD109: 8
A110: COBURG | D110: GARDINER 6 | G110: PLANT 3 | I110: KERLEY 2 | K110: JENKINS | M110: FORBES | O110: MARCHESI
A111: WILLIAMSTOWN | D111: WHITBURN 2 | G111: LORD | I111: MENHENNIT | L111: BEER | N111: FISHER | P111: JOHNS | W111: PRAHRAN | X111: 1 | Y111: 2 | Z111: 0 | AA111: 254 | AB111: 249 | AC111: 102.01 | AD111: 4
W112: NORTHCOTE | X112: 1 | Y112: 2 | Z112: 0 | AA112: 249 | AB112: 256 | AC112: 97.265625 | AD112: 4
A113: PRESTON | C113: 0 | D113: 0 | E113: =C113*6+D113 -> 0 | G113: 5 | H113: 14 | I113: =G113*6+H113 -> 44 | K113: 6 | L113: 14 | M113: =K113*6+L113 -> 50 | O113: 11 | P113: 23 | Q113: =O113*6+P113 -> 89 | S113: PRESTON | W113: BRIGHTON | X113: 1 | Y113: 2 | Z113: 0 | AA113: 231 | AB113: 258 | AC113: 89.534883720930239 | AD113: 4
A114: NORTHCOTE | C114: 6 | D114: 9 | E114: =C114*6+D114 -> 45 | G114: 6 | H114: 9 | I114: =G114*6+H114 -> 45 | K114: 12 | L114: 12 | M114: =K114*6+L114 -> 84 | O114: 12 | P114: 12 | Q114: =O114*6+P114 -> 84 | S114: CLARKE | W114: WILLIAMSTOWN | X114: 1 | Y114: 2 | Z114: 0 | AA114: 196 | AB114: 220 | AC114: 89.090909090909093 | AD114: 4
A115: BEST PLAYERS | W115: BRUNSWICK | X115: 0 | Y115: 3 | Z115: 0 | AA115: 161 | AB115: 280 | AC115: 57.5 | AD115: 0
A116: PRESTON | D116: WARR | F116: A STEVENS | I116: SURTEES | L116: DOBRIGH | O116: SEEBECK | Q116: WATT | W116: GEELONG ASSOC. | X116: 0 | Y116: 3 | Z116: 0 | AA116: 89 | AB116: 191 | AC116: 46.596858638743456 | AD116: 0
A117: NORTHCOTE | D117: GALL | F117: CAREY | I117: AHERN | L117: SMITH | O117: WOODS | Q117: ADAMS
A118: GOALKICKERS
A119: PRESTON | D119: WARR 3 | F119: CONNAGHTON 2 | J119: ELLIS 2 | L119: DOWNES | N119: LUDLOW | P119: A STEVENS | R119: HUME
A120: NORTHCOTE | D120: ADAMS 3 | G120: GALL 3 | I120: GOUGH 3 | K120: WOOD | M120: POWELL | O120: REILLY
A122: CAMBERWELL | C122: 10 | D122: 10 | E122: =C122*6+D122 -> 70 | G122: 10 | H122: 10 | I122: =G122*6+H122 -> 70 | K122: 19 | L122: 20 | M122: =K122*6+L122 -> 134 | O122: 19 | P122: 20 | Q122: =O122*6+P122 -> 134 | S122: CAMBERWELL
A123: PRAHRAN | C123: 1 | D123: 0 | E123: =C123*6+D123 -> 6 | G123: 8 | H123: 9 | I123: =G123*6+H123 -> 57 | K123: 8 | L123: 9 | M123: =K123*6+L123 -> 57 | O123: 14 | P123: 17 | Q123: =O123*6+P123 -> 101 | S123: ALLEY
A124: BEST PLAYERS
A125: CAMBERWELL | D125: LAWN | G125: WOODFORD | J125: STEVENS | M125: BAZIN | O125: KARTHAUS | R125: ELLIMAN
A126: PRAHRAN | D126: McPHERSON | G126: McGRATH | J126: HANDLEY | M126: SNELL | O126: RUSSELL | R126: OSBORNE
A127: GOALKICKERS
A128: CAMBERWELL | D128: WOODFROD 7 | G128: LAWN 4 | I128: PAGE 2 | K128: DIMOND | M128: ELLIOTT | O128: ELLIMAN | Q128: GREENBURY | T128: RAY | V128: CONNOP
A129: PRAHRAN | D129: HARLEY 4 | F129: RUSSELL 2 | I129: RILEY 2 | K129: SNELL 2 | M129: ROWE | O129: HANDLEY | Q129: OSBORNE | T129: PARKER
A131: BRIGHTON | C131: 1 | D131: 2 | E131: =C131*6+D131 -> 8 | G131: 5 | H131: 16 | I131: =G131*6+H131 -> 46 | K131: 6 | L131: 16 | M131: =K131*6+L131 -> 52 | O131: 12 | P131: 23 | Q131: =O131*6+P131 -> 95 | S131: BRIGHTON BEACH
A132: BRUNSWICK | C132: 3 | D132: 0 | E132: =C132*6+D132 -> 18 | G132: 3 | H132: 0 | I132: =G132*6+H132 -> 18 | K132: 6 | L132: 9 | M132: =K132*6+L132 -> 45 | O132: 9 | P132: 12 | Q132: =O132*6+P132 -> 66 | S132: OLDFIELD
A133: BEST PLAYERS
A134: BRIGHTON | D134: CARROLL | G134: WALSH | J134: HUNT | M134: DE ARAUGO | P134: KOLLE | S134: RATTRAY
A135: BRUNSWICK | D135: PARKER | G135: BRIGHT | J135: REID | M135: McMAHON | P135: PARKHILL | S135: ROBERTSON
A136: GOALKICKERS
A137: BRIGHTON | D137: WALSH 5 | G137: DE ARAUGO 2 | J137: DORE 2 | L137: BESWICK | N137: CARROLL | P137: RATTRAY
A138: BRUNSWICK | D138: HART 4 | G138: McINERNEY 2 | J138: PARKER | L138: MILLER | N138: ROBERTSON
A140: PORT MELBOURNE | C140: 2 | D140: 2 | E140: =C140*6+D140 -> 14 | G140: 2 | H140: 3 | I140: =G140*6+H140 -> 15 | K140: 4 | L140: 7 | M140: =K140*6+L140 -> 31 | O140: 4 | P140: 8 | Q140: =O140*6+P140 -> 32 | S140: WEST OVAL
A141: GEELONG ASSOC. | C141: 1 | D141: 1 | E141: =C141*6+D141 -> 7 | G141: 2 | H141: 4 | I141: =G141*6+H141 -> 16 | K141: 2 | L141: 5 | M141: =K141*6+L141 -> 17 | O141: 2 | P141: 12 | Q141: =O141*6+P141 -> 24 | S141: PATTERSON
A142: BEST PLAYERS
A143: PORT MELBOURNE | D143: PERRETT | G143: WILSON | J143: W RUDD | M143: FORBES | P143: BARFOOT | S143: ROSEMAN
A144: GEELONG ASSOC. | D144: COLEMAN | G144: CATIONS | J144: TAYLOR | M144: WRIGHT | P144: DOGBY | S144: RANKIN
A145: GOALKICKERS
A146: PORT MELBOURNE | D146: MERRICK 2 | H146: ROSEMAN | K146: PERRETT
A147: GEELONG ASSOC. | D147: RUSHTON | H147: FARRELLY
A149: ROUND 4 | E149: 21ST MAY | J149: WEATHER | M149: FINE LIGHT SOUTH BREEZE | S149: PLAYED AT | X149: LADDER | AB149: ROUND | AD149: 4
D150: 1ST QTR | H150: 2ND QTR | L150: 3RD QTR | P150: FINAL | S150: PORT MELBOURNE
A151: PORT MELBOURNE | C151: 4 | D151: 2 | E151: =C151*6+D151 -> 26 | G151: 6 | H151: 6 | I151: =G151*6+H151 -> 42 | K151: 11 | L151: 7 | M151: =K151*6+L151 -> 73 | O151: 12 | P151: 12 | Q151: =O151*6+P151 -> 84 | W151: TEAM | X151: W | Y151: L | Z151: D | AA151: FOR | AB151: AGST | AC151: % | AD151: PTS
A152: CAMBERWELL | C152: 0 | D152: 4 | E152: =C152*6+D152 -> 4 | G152: 4 | H152: 4 | I152: =G152*6+H152 -> 28 | K152: 6 | L152: 8 | M152: =K152*6+L152 -> 44 | O152: 6 | P152: 12 | Q152: =O152*6+P152 -> 48 | S152: PATTISON
A153: BEST PLAYERS | W153: COBURG | X153: 4 | Y153: 0 | Z153: 0 | AA153: 486 | AB153: 241 | AC153: 201.65975103734439 | AD153: 16
A154: PORT MELBOURNE | D154: GARBUTT | F154: CARPENTER | I154: W RUDD | L154: BARFOOT | O154: BOLMAN | Q154: JOHNSTONE | W154: PORT MELBOURNE | X154: 4 | Y154: 0 | Z154: 0 | AA154: 292 | AB154: 193 | AC154: 151.29533678756476 | AD154: 16
A155: CAMBERWELL | D155: ELLIMAN | F155: WOODFORD | I155: HARRISON | L155: GREENWOOD | O155: BAZIN | Q155: PAGE | W155: PRESTON | X155: 4 | Y155: 0 | Z155: 0 | AA155: 387 | AB155: 281 | AC155: 137.72241992882562 | AD155: 16
A156: GOALKICKERS | W156: BRIGHTON | X156: 2 | Y156: 2 | Z156: 0 | AA156: 340 | AB156: 311 | AC156: 109.32475884244373 | AD156: 8
A157: PORT MELBOURNE | D157: MERRICK 5 | F157: GARBUTT 2 | I157: SKILTON 2 | L157: FROUD | N157: BARFOOT | Q157: KENNEDY
A158: CAMBERWELL | D158: WOODFORD 4 | G158: RAY | I158: LAWN | W158: NORTHCOTE | X158: 2 | Y158: 2 | Z158: 0 | AA158: 349 | AB158: 342 | AC158: 102.046783625731 | AD158: 8
W159: CAMBERWELL | X159: 2 | Y159: 2 | Z159: 0 | AA159: 341 | AB159: 371 | AC159: 91.91 | AD159: 8
A160: COBURG | C160: 5 | D160: 8 | E160: =C160*6+D160 -> 38 | G160: 10 | H160: 14 | I160: =G160*6+H160 -> 74 | K160: 15 | L160: 17 | M160: =K160*6+L160 -> 107 | O160: 26 | P160: 20 | Q160: =O160*6+P160 -> 176 | S160: TOORAK PARK | W160: PRAHRAN | X160: 1 | Y160: 3 | Z160: 0 | AA160: 337 | AB160: 425 | AC160: 79.29 | AD160: 4
A161: PRAHRAN | C161: 2 | D161: 1 | E161: =C161*6+D161 -> 13 | G161: 4 | H161: 4 | I161: =G161*6+H161 -> 28 | K161: 7 | L161: 5 | M161: =K161*6+L161 -> 47 | O161: 13 | P161: 5 | Q161: =O161*6+P161 -> 83 | S161: LYNCH | W161: WILLIAMSTOWN | X161: 1 | Y161: 3 | Z161: 0 | AA161: 249 | AB161: 329 | AC161: 75.683890577507597 | AD161: 4
A162: BEST PLAYERS | W162: BRUNSWICK | X162: 0 | Y162: 4 | Z162: 0 | AA162: 247 | AB162: 380 | AC162: 65 | AD162: 0
A163: COBURG | D163: KERLEY | F163: HUNTINGTON | I163: PLANT | L163: GARDINER | O163: WALSH | Q163: E MARTIN | W163: GEELONG ASSOC. | X163: 0 | Y163: 4 | Z163: 0 | AA163: 165 | AB163: 320 | AC163: 51.5625 | AD163: 0
A164: PRAHRAN | D164: HARLEY | F164: E JONES | I164: McGRATH | L164: SHORT | O164: ISBELL | Q164: McPHERSON
A165: GOALKICKERS
A166: COBURG | D166: GARDINER 7 | G166: HUNTINGTON 5 | J166: PLANT 5 | L166: MEARS 4 | N166: FORBES 2 | P166: COX | Q166: KERLEY | S166: JENKINS
A167: PRAHRAN | D167: HARLEY 7 | G167: HANDLEY | I167: McGRATH | K167: OSBORNE | M167: ROWE | O167: REYNOLDS | Q167: ISBELL
A169: BRIGHTON | C169: 2 | D169: 2 | E169: =C169*6+D169 -> 14 | G169: 7 | H169: 6 | I169: =G169*6+H169 -> 48 | K169: 13 | L169: 10 | M169: =K169*6+L169 -> 88 | O169: 16 | P169: 13 | Q169: =O169*6+P169 -> 109 | S169: WILLIAMSTOWN
A170: WILLIAMSTOWN | C170: 4 | D170: 0 | E170: =C170*6+D170 -> 24 | G170: 6 | H170: 1 | I170: =G170*6+H170 -> 37 | K170: 7 | L170: 3 | M170: =K170*6+L170 -> 45 | O170: 8 | P170: 5 | Q170: =O170*6+P170 -> 53 | S170: ALLEY
A171: BEST PLAYERS
A172: BRIGHTON | D172: RATTRAY | G172: WALSH | J172: ALDRIDGE | M172: CARSWELL | P172: DE ARAUGO | S172: CARROLL
A173: WILLIAMSTOWN | D173: MARIN | G173: LORD | J173: MEEHAN | M173: MENHENNIT | P173: W MUNN | S173: KENNY
A174: GOALKICKERS
A175: BRIGHTON | D175: WALSH 8 | G175: RATTRAY 3 | J175: RINGROSE 3 | M175: HUNT | O175: DE ARAUGO
A176: WILLIAMSTOWN | D176: MENHENNIT 2 | G176: SCOONES | I176: LORD | K176: MURPHY | M176: J MUNN | O176: KENNY | Q176: BANKS
A178: NORTHCOTE | C178: 2 | D178: 4 | E178: =C178*6+D178 -> 16 | G178: 7 | H178: 6 | I178: =G178*6+H178 -> 48 | K178: 11 | L178: 8 | M178: =K178*6+L178 -> 74 | O178: 15 | P178: 10 | Q178: =O178*6+P178 -> 100 | S178: BRUNSWICK
A179: BRUNSWICK | C179: 3 | D179: 5 | E179: =C179*6+D179 -> 23 | G179: 6 | H179: 5 | I179: =G179*6+H179 -> 41 | K179: 10 | L179: 10 | M179: =K179*6+L179 -> 70 | O179: 12 | P179: 14 | Q179: =O179*6+P179 -> 86 | S179: OLDFIELD
A180: BEST PLAYERS
A181: NORTHCOTE | D181: ADAMS | G181: GOUGH | I181: H SMITH | K181: WOOD | N181: DOUG NICHOLLS | R181: POWELL
A182: BRUNSWICK | D182: McINERNEY | G182: BRIGHT | I182: REID | K182: RAYMOND | N182: HART | R182: PARKER
A183: GOALKICKERS
A184: NORTHCOTE | D184: GOUGH 7 | G184: ADAMS 4 | J184: POWELL 2 | M184: LUDLOW | O184: CAREY
A185: BRUNSWICK | D185: McINERNEY 5 | G185: PARKER 2 | I185: GARSIDE | K185: RAYMOND | M185: BRIGHT | O185: GRINHAM | Q185: PROUDFOOT
A187: PRESTON | C187: 5 | D187: 1 | E187: =C187*6+D187 -> 31 | G187: 8 | H187: 3 | I187: =G187*6+H187 -> 51 | K187: 15 | L187: 6 | M187: =K187*6+L187 -> 96 | O187: 20 | P187: 9 | Q187: =O187*6+P187 -> 129 | S187: PRESTON
A188: GEELONG ASSOC. | C188: 3 | D188: 1 | E188: =C188*6+D188 -> 19 | G188: 6 | H188: 3 | I188: =G188*6+H188 -> 39 | K188: 9 | L188: 3 | M188: =K188*6+L188 -> 57 | O188: 11 | P188: 4 | Q188: =O188*6+P188 -> 70 | S188: McKINNON
A189: BEST PLAYERS
A190: PRESTON | D190: SURTEES | G190: CONNAUGHTON | J190: SUMMERS | M190: WHITE | P190: SHERMAN | R190: DOBRIGH
A191: GEELONG ASSOC. | D191: ROACH | G191: COLEMAN | J191: CHISHOLM | M191: RANKIN | P191: N WRIGHT | R191: NOONAN
A192: GOALKICKERS
A193: PRESTON | D193: HUME 5 | F193: CONNAUGHTON 3 | J193: LUDLOW 3 | M193: GRAY 3 | O193: HOLLIDAY 2 | R193: SKIPPER | U193: BLUNDELL | X193: ROBERTSON | AA193: ANDERSON
A194: GEELONG ASSOC. | D194: NOONAN 5 | G194: HARRIS 2 | J194: ARMSTRONG | M194: RUSHTON | O194: ROACH | Q194: McMANUS
A196: ROUND 5 | E196: 28TH MAY | J196: WEATHER | M196: RAIN | S196: PLAYED AT | X196: LADDER | AB196: ROUND | AD196: 5
D197: 1ST QTR | H197: 2ND QTR | L197: 3RD QTR | P197: FINAL | S197: CAMBERWELL
A198: PRESTON | C198: 4 | D198: 4 | E198: =C198*6+D198 -> 28 | G198: 6 | H198: 4 | I198: =G198*6+H198 -> 40 | K198: 9 | L198: 12 | M198: =K198*6+L198 -> 66 | O198: 9 | P198: 12 | Q198: =O198*6+P198 -> 66 | S198: UMPIRE | W198: TEAM | X198: W | Y198: L | Z198: D | AA198: FOR | AB198: AGST | AC198: % | AD198: PTS
A199: CAMBERWELL | C199: 0 | D199: 1 | E199: =C199*6+D199 -> 1 | G199: 4 | H199: 7 | I199: =G199*6+H199 -> 31 | K199: 5 | L199: 10 | M199: =K199*6+L199 -> 40 | O199: 7 | P199: 14 | Q199: =O199*6+P199 -> 56
A200: BEST PLAYERS | W200: COBURG | X200: 5 | Y200: 0 | Z200: 0 | AA200: 580 | AB200: 291 | AC200: 199.3127147766323 | AD200: 20
A201: PRESTON | D201: WHITE | F201: SURTEES | I201: TAYLOR | L201: WARR | N201: A LUDLOW | Q201: GRAY | W201: PORT MELBOURNE | X201: 5 | Y201: 0 | Z201: 0 | AA201: 364 | AB201: 228 | AC201: 159.64912280701753 | AD201: 20
A202: CAMBERWELL | D202: HORNE | F202: CONNOP | I202: ELLIOTT | L202: PAGE | N202: WOODFORD | Q202: GREENWOOD | W202: PRESTON | X202: 5 | Y202: 0 | Z202: 0 | AA202: 453 | AB202: 337 | AC202: 134.42136498516319 | AD202: 20
A203: GOALKICKERS | W203: BRIGHTON | X203: 3 | Y203: 2 | Z203: 0 | AA203: 418 | AB203: 373 | AC203: 112.06434316353888 | AD203: 12
A204: PRESTON | D204: HUME 3 | G204: GRAY 2 | J204: A LUDLOW | M204: WARR | O204: WHITE | Q204: WATT
A205: CAMBERWELL | D205: CONNOP 2 | G205: LAWN 2 | J205: BAZIN 2 | M205: WOODFORD | W205: NORTHCOTE | X205: 3 | Y205: 2 | Z205: 0 | AA205: 455 | AB205: 411 | AC205: 110.70559610705597 | AD205: 12
W206: CAMBERWELL | X206: 2 | Y206: 3 | Z206: 0 | AA206: 397 | AB206: 437 | AC206: 90.85 | AD206: 8
A207: BRIGHTON | C207: 3 | D207: 10 | E207: =C207*6+D207 -> 28 | G207: 3 | H207: 10 | I207: =G207*6+H207 -> 28 | K207: 8 | L207: 17 | M207: =K207*6+L207 -> 65 | O207: 10 | P207: 17 | Q207: =O207*6+P207 -> 77 | S207: BRIGHTON BEACH | W207: PRAHRAN | X207: 1 | Y207: 4 | Z207: 0 | AA207: 399 | AB207: 503 | AC207: 79.32 | AD207: 4
A208: PRAHRAN | C208: 0 | D208: 0 | E208: =C208*6+D208 -> 0 | G208: 4 | H208: 3 | I208: =G208*6+H208 -> 27 | K208: 6 | L208: 3 | M208: =K208*6+L208 -> 39 | O208: 9 | P208: 8 | Q208: =O208*6+P208 -> 62 | S208: McKINNON | W208: WILLIAMSTOWN | X208: 1 | Y208: 4 | Z208: 0 | AA208: 318 | AB208: 435 | AC208: 73.103448275862064 | AD208: 4
A209: BEST PLAYERS | W209: BRUNSWICK | X209: 0 | Y209: 5 | Z209: 0 | AA209: 282 | AB209: 452 | AC209: 62.389380530973455 | AD209: 0
A210: BRIGHTON | D210: GARCIA | F210: ALDRIDGE | I210: DAINTY | L210: KOLLE | N210: DORE | Q210: IRWIN | W210: GEELONG ASSOC. | X210: 0 | Y210: 5 | Z210: 0 | AA210: 215 | AB210: 414 | AC210: 51.932367149758456 | AD210: 0
A211: PRAHRAN | D211: B SMITH | F211: CROSSEN | I211: McPHERSON | L211: F SMITH | N211: J SMITH | Q211: SHORT
A212: GOALKICKERS
A213: BRIGHTON | D213: WALSH 3 | G213: DE ARAUGO 2 | J213: DORE 2 | L213: HUNT 2 | N213: FRIEND
A214: PRAHRAN | D214: CROSSEN 4 | G214: HARLEY 2 | J214: J SMITH | L214: REYNOLDS | N214: PROCTOR
A216: NORTHCOTE | C216: 5 | D216: 2 | E216: =C216*6+D216 -> 32 | G216: 7 | H216: 6 | I216: =G216*6+H216 -> 48 | K216: 11 | L216: 12 | M216: =K216*6+L216 -> 78 | O216: 15 | P216: 16 | Q216: =O216*6+P216 -> 106 | S216: NORTHCOTE
A217: WILLIAMSTOWN | C217: 3 | D217: 4 | E217: =C217*6+D217 -> 22 | G217: 5 | H217: 9 | I217: =G217*6+H217 -> 39 | K217: 7 | L217: 12 | M217: =K217*6+L217 -> 54 | O217: 9 | P217: 15 | Q217: =O217*6+P217 -> 69 | S217: CLARK
A218: BEST PLAYERS
A219: NORTHCOTE | D219: GOUGH | G219: BOYLE | J219: DESLANDES | M219: DOUG NICHOLLS | Q219: ADAMS | S219: GALL
A220: WILLIAMSTOWN | D220: MARTIN | G220: LORD | J220: SCOONES | M220: KENNY | Q220: HAYDEN | S220: WHITBURN
A221: GOALKICKERS
A222: NORTHCOTE | D222: GOUGH 7 | F222: BOYLE 2 | H222: DESLANDES 2 | K222: DIMMICK | M222: ADAMS | O222: POWELL | Q222: DOUG NICHOLLS
A223: WILLIAMSTOWN | D223: KENNY 2 | F223: LORD 2 | H223: HAYDEN | J223: MARTIN | L223: BANKS | N223: CHALMERS | Q223: SCOONES
A225: PORT MELBOURNE | C225: 2 | D225: 4 | E225: =C225*6+D225 -> 16 | G225: 7 | H225: 6 | I225: =G225*6+H225 -> 48 | K225: 8 | L225: 6 | M225: =K225*6+L225 -> 54 | O225: 10 | P225: 12 | Q225: =O225*6+P225 -> 72 | S225: BRUNSWICK
A226: BRUNSWICK | C226: 1 | D226: 3 | E226: =C226*6+D226 -> 9 | G226: 1 | H226: 4 | I226: =G226*6+H226 -> 10 | K226: 5 | L226: 5 | M226: =K226*6+L226 -> 35 | O226: 5 | P226: 5 | Q226: =O226*6+P226 -> 35 | S226: MAHER
A227: BEST PLAYERS
A228: PORT MELBOURNE | D228: GARBUTT | F228: BOLMAN | I228: BARFOOT | L228: JOHNSTONE | O228: KENNEDY | R228: W RUDD
A229: BRUNSWICK | D229: BRIGHT | F229: HARRIS | I229: LAFFIN | L229: KENNETT | O229: REID | R229: WARDEN
A230: GOALKICKERS
A231: PORT MELBOURNE | D231: GARBUTT 4 | G231: MERRICK 3 | J231: KENNEDY 2 | M231: BOURKE
A232: BRUNSWICK | D232: McINERNEY 2 | H232: WARDEN 2 | K232: RAYMOND
A234: COBURG | C234: 8 | D234: 3 | E234: =C234*6+D234 -> 51 | G234: 8 | H234: 4 | I234: =G234*6+H234 -> 52 | K234: 12 | L234: 9 | M234: =K234*6+L234 -> 81 | O234: 14 | P234: 10 | Q234: =O234*6+P234 -> 94 | S234: WEST OVAL
A235: GEELONG ASSOC. | C235: 0 | D235: 3 | E235: =C235*6+D235 -> 3 | G235: 4 | H235: 9 | I235: =G235*6+H235 -> 33 | K235: 4 | L235: 9 | M235: =K235*6+L235 -> 33 | O235: 6 | P235: 14 | Q235: =O235*6+P235 -> 50 | S235: BLACKBURN
A236: BEST PLAYERS
A237: COBURG | D237: PLANT | G237: JENKINS | J237: McALPINE | M237: GARDINER | P237: KERLEY | S237: MEARS
A238: GEELONG ASSOC. | D238: WRIGHT | G238: RANKIN | J238: SQUIRES | M238: BUSHELL | P238: NOONAN | S238: McMANUS
A239: GOALKICKERS
A240: COBURG | D240: PLANT 6 | G240: GARDINER 4 | J240: KERLEY 2 | M240: CHAPMAN | P240: FORBES
A241: GEELONG ASSOC. | D241: NOONAN 4 | G241: JONES | J241: McMANUS
A243: ROUND 6 | E243: 4TH JUNE | J243: WEATHER | M243: FINE STRONG N.W. WIND | S243: PLAYED AT | X243: LADDER | AB243: ROUND | AD243: 6
D244: 1ST QTR | H244: 2ND QTR | L244: 3RD QTR | P244: FINAL | S244: COBURG
A245: COBURG | C245: 4 | D245: 5 | E245: =C245*6+D245 -> 29 | G245: 8 | H245: 8 | I245: =G245*6+H245 -> 56 | K245: 12 | L245: 18 | M245: =K245*6+L245 -> 90 | O245: 13 | P245: 22 | Q245: =O245*6+P245 -> 100 | S245: UMPIRE | W245: TEAM | X245: W | Y245: L | Z245: D | AA245: FOR | AB245: AGST | AC245: % | AD245: PTS
A246: PRESTON | C246: 0 | D246: 1 | E246: =C246*6+D246 -> 1 | G246: 4 | H246: 6 | I246: =G246*6+H246 -> 30 | K246: 6 | L246: 9 | M246: =K246*6+L246 -> 45 | O246: 10 | P246: 16 | Q246: =O246*6+P246 -> 76 | S246: McKINNON
A247: BEST PLAYERS | W247: COBURG | X247: 6 | Y247: 0 | Z247: 0 | AA247: 680 | AB247: 367 | AC247: 185.28610354223434 | AD247: 24
A248: COBURG | D248: FORD | F248: McALPINE | I248: PLANT | K248: KERLEY | N248: C MARTYN | Q248: MEARS | W248: PORT MELBOURNE | X248: 6 | Y248: 0 | Z248: 0 | AA248: 432 | AB248: 260 | AC248: 166.15384615384616 | AD248: 24
A249: PRESTON | D249: SUMMERS | F249: WATT | I249: WHITE | K249: ROBINSON | N249: CONNAUGHTON | Q249: STEVENS | W249: PRESTON | X249: 5 | Y249: 1 | Z249: 0 | AA249: 529 | AB249: 437 | AC249: 121.05263157894737 | AD249: 20
A250: GOALKICKERS | W250: NORTHCOTE | X250: 4 | Y250: 2 | Z250: 0 | AA250: 494 | AB250: 434 | AC250: 113.82488479262673 | AD250: 16
A251: COBURG | D251: PLANT 5 | G251: KERLEY 4 | J251: McALPINE 2 | M251: MEARS | O251: CHAPMAN
A252: PRESTON | D252: HUME 4 | G252: CONNAUGHTON 3 | K252: WATT | M252: SURTEES | O252: HOLLIDAY | W252: BRIGHTON | X252: 3 | Y252: 3 | Z252: 0 | AA252: 441 | AB252: 412 | AC252: 107.03883495145631 | AD252: 12
W253: CAMBERWELL | X253: 2 | Y253: 4 | Z253: 0 | AA253: 461 | AB253: 514 | AC253: 89.69 | AD253: 8
A254: NORTHCOTE | C254: 1 | D254: 0 | E254: =C254*6+D254 -> 6 | G254: 3 | H254: 2 | I254: =G254*6+H254 -> 20 | K254: 4 | L254: 8 | M254: =K254*6+L254 -> 32 | O254: 5 | P254: 9 | Q254: =O254*6+P254 -> 39 | S254: NORTHCOTE | W254: PRAHRAN | X254: 1 | Y254: 5 | Z254: 0 | AA254: 454 | AB254: 564 | AC254: 80.5 | AD254: 4
A255: BRIGHTON | C255: 1 | D255: 2 | E255: =C255*6+D255 -> 8 | G255: 2 | H255: 3 | I255: =G255*6+H255 -> 15 | K255: 2 | L255: 3 | M255: =K255*6+L255 -> 15 | O255: 3 | P255: 5 | Q255: =O255*6+P255 -> 23 | S255: MAHER | W255: WILLIAMSTOWN | X255: 1 | Y255: 5 | Z255: 0 | AA255: 350 | AB255: 503 | AC255: 69.582504970178931 | AD255: 4
A256: BEST PLAYERS | W256: BRUNSWICK | X256: 1 | Y256: 5 | Z256: 0 | AA256: 343 | AB256: 507 | AC256: 67.652859960552263 | AD256: 4
A257: NORTHCOTE | D257: DOUG NICHOLLS | G257: DARRA NICHOLLS | K257: JUDKINS | M257: WOODS | O257: SMITH | Q257: ADAMS | W257: GEELONG ASSOC. | X257: 1 | Y257: 5 | Z257: 0 | AA257: 292 | AB257: 478 | AC257: 61.087866108786613 | AD257: 4
A258: BRIGHTON | D258: IRWIN | G258: GARCIA | K258: KOLLE | M258: HUNT | O258: BESWICK | Q258: RATTRAY
A259: GOALKICKERS
A260: NORTHCOTE | D260: ADAMS | G260: JUDKINS | J260: DARRA NICHOLLS | N260: DESLANDES | Q260: POWELL
A261: BRIGHTON | D261: WALSH 2 | G261: RATTRAY
A263: PORT MELBOURNE | C263: 1 | D263: 2 | E263: =C263*6+D263 -> 8 | G263: 7 | H263: 6 | I263: =G263*6+H263 -> 48 | K263: 8 | L263: 8 | M263: =K263*6+L263 -> 56 | O263: 10 | P263: 8 | Q263: =O263*6+P263 -> 68 | S263: PORT MELBOURNE
A264: WILLIAMSTOWN | C264: 0 | D264: 0 | E264: =C264*6+D264 -> 0 | G264: 1 | H264: 1 | I264: =G264*6+H264 -> 7 | K264: 2 | L264: 4 | M264: =K264*6+L264 -> 16 | O264: 4 | P264: 8 | Q264: =O264*6+P264 -> 32 | S264: MACHAR
A265: BEST PLAYERS
A266: PORT MELBOURNE | D266: GARBUTT | G266: FORBES | J266: TAYLOR | M266: COMBER | P266: KENNEDY | S266: UREN
A267: WILLIAMSTOWN | D267: SAYNOR | G267: LORD | J267: SYKES | M267: SCOONES | P267: McKAY | S267: KENNY
A268: GOALKICKERS
A269: PORT MELBOURNE | D269: TAYLOR 3 | G269: SKILTON 2 | J269: COMBER 2 | M269: KENNEDY | O269: PERRETT | Q269: FORBES
A270: WILLIAMSTOWN | D270: SAYNOR 3 | G270: MEEHAN
E271: 6TH JUNE | J271: WEATHER | M271: FINE N.W. WIND
A272: BRUNSWICK | C272: 2 | D272: 3 | E272: =C272*6+D272 -> 15 | G272: 4 | H272: 5 | I272: =G272*6+H272 -> 29 | K272: 7 | L272: 12 | M272: =K272*6+L272 -> 54 | O272: 8 | P272: 13 | Q272: =O272*6+P272 -> 61 | S272: TOORAK PARK
A273: PRAHRAN | C273: 1 | D273: 2 | E273: =C273*6+D273 -> 8 | G273: 4 | H273: 4 | I273: =G273*6+H273 -> 28 | K273: 5 | L273: 4 | M273: =K273*6+L273 -> 34 | O273: 8 | P273: 7 | Q273: =O273*6+P273 -> 55 | S273: BLACKBURN
A274: BEST PLAYERS
A275: BRUNSWICK | D275: KENNETT | G275: BRIGHT | J275: WARDEN | M275: McINERNEY | P275: PARKER | S275: RUSSELL
A276: PRAHRAN | D276: E JONES | G276: HARLEY | J276: SNELL | M276: VANCE | P276: PROCTOR | S276: CROSSEN
A277: GOALKICKERS
A278: BRUNSWICK | D278: McINERNEY 3 | G278: CAREY 2 | J278: O'CONNOR 2 | M278: NEWMAN
A279: PRAHRAN | D279: HARLEY 4 | G279: McPHERSON | J279: SHORT | M279: WOODS | O279: CROSSEN
A281: GEELONG ASSOC. | C281: 2 | D281: 0 | E281: =C281*6+D281 -> 12 | G281: 6 | H281: 5 | I281: =G281*6+H281 -> 41 | K281: 7 | L281: 9 | M281: =K281*6+L281 -> 51 | O281: 11 | P281: 11 | Q281: =O281*6+P281 -> 77 | S281: WEST OVAL
A282: CAMBERWELL | C282: 3 | D282: 5 | E282: =C282*6+D282 -> 23 | G282: 3 | H282: 8 | I282: =G282*6+H282 -> 26 | K282: 4 | L282: 17 | M282: =K282*6+L282 -> 41 | O282: 7 | P282: 22 | Q282: =O282*6+P282 -> 64 | S282: CLARKE
A283: BEST PLAYERS
A284: GEELONG ASSOC. | D284: CATIONS | G284: JONES | J284: ROACH | M284: WRIGHT | P284: FARRELLY | S284: NOONAN
A285: CAMBERWELL | D285: LAWN | G285: GREENBURY | J285: THORPE | M285: CONNOP | P285: ELLIOTT | S285: ALLBERRY
A286: GOALKICKERS
A287: GEELONG ASSOC. | D287: NOONAN 2 | G287: McMANUS 2 | J287: WRIGHT 2 | M287: CATIONS 2 | P287: DIGBY 2 | S287: HARRIS
A288: CAMBERWELL | D288: CONNOP 2 | G288: GREENBURY 2 | J288: LAWN | L288: WOODFORD | O288: DIMOND
A290: ROUND 7 | E290: 11TH JUNE | H290: WEATHER | K290: CLOUDY LIGHT SHOWERS S. BREEZE | S290: PLAYED AT | X290: LADDER | AB290: ROUND | AD290: 7
D291: 1ST QTR | H291: 2ND QTR | L291: 3RD QTR | P291: FINAL | S291: PORT MELBOURNE
A292: COBURG | C292: 2 | D292: 2 | E292: =C292*6+D292 -> 14 | G292: 5 | H292: 6 | I292: =G292*6+H292 -> 36 | K292: 8 | L292: 9 | M292: =K292*6+L292 -> 57 | O292: 10 | P292: 11 | Q292: =O292*6+P292 -> 71 | S292: UMPIRE | W292: TEAM | X292: W | Y292: L | Z292: D | AA292: FOR | AB292: AGST | AC292: % | AD292: PTS
A293: PORT MELBOURNE | C293: 0 | D293: 7 | E293: =C293*6+D293 -> 7 | G293: 2 | H293: 9 | I293: =G293*6+H293 -> 21 | K293: 4 | L293: 11 | M293: =K293*6+L293 -> 35 | O293: 4 | P293: 12 | Q293: =O293*6+P293 -> 36 | S293: ALLEY
A294: BEST PLAYERS | W294: COBURG | X294: 7 | Y294: 0 | Z294: 0 | AA294: 751 | AB294: 403 | AC294: 186.35235732009926 | AD294: 28
A295: COBURG | D295: E MARTIN | G295: CHARLESTON | J295: KERLEY | M295: MEARS | O295: PLANT | Q295: MARCHESI | W295: PORT MELBOURNE | X295: 6 | Y295: 1 | Z295: 0 | AA295: 468 | AB295: 331 | AC295: 141.38972809667675 | AD295: 24
A296: PORT MELBOURNE | D296: FORBES | G296: PERRETT | J296: HARVEY | M296: BARFOOT | O296: UREN | Q296: TAYLOR | W296: NORTHCOTE | X296: 5 | Y296: 2 | Z296: 0 | AA296: 587 | AB296: 469 | AC296: 125.15991471215352 | AD296: 20
A297: GOALKICKERS | W297: PRESTON | X297: 5 | Y297: 2 | Z297: 0 | AA297: 566 | AB297: 476 | AC297: 118.90756302521008 | AD297: 20
A298: COBURG | D298: PLANT 3 | F298: KERLEY 2 | I298: HARRIS 2 | K298: MEARS | M298: McALPINE | O298: CHARLESTON
A299: PORT MELBOURNE | D299: TAYLOR 3 | G299: GARBUTT | W299: BRIGHTON | X299: 4 | Y299: 3 | Z299: 0 | AA299: 539 | AB299: 456 | AC299: 118.20175438596492 | AD299: 16
W300: CAMBERWELL | X300: 2 | Y300: 5 | Z300: 0 | AA300: 542 | AB300: 600 | AC300: 90.33 | AD300: 8
A301: NORTHCOTE | C301: 3 | D301: 1 | E301: =C301*6+D301 -> 19 | G301: 7 | H301: 9 | I301: =G301*6+H301 -> 51 | K301: 10 | L301: 10 | M301: =K301*6+L301 -> 70 | O301: 13 | P301: 15 | Q301: =O301*6+P301 -> 93 | S301: NORTHCOTE | W301: BRUNSWICK | X301: 2 | Y301: 5 | Z301: 0 | AA301: 429 | AB301: 588 | AC301: 72.959183673469383 | AD301: 8
A302: PRAHRAN | C302: 2 | D302: 1 | E302: =C302*6+D302 -> 13 | G302: 2 | H302: 1 | I302: =G302*6+H302 -> 13 | K302: 3 | L302: 2 | M302: =K302*6+L302 -> 20 | O302: 5 | P302: 5 | Q302: =O302*6+P302 -> 35 | S302: SCHAEFER | W302: WILLIAMSTOWN | X302: 2 | Y302: 5 | Z302: 0 | AA302: 389 | AB302: 540 | AC302: 72.037037037037038 | AD302: 8
A303: BEST PLAYERS | W303: PRAHRAN | X303: 1 | Y303: 6 | Z303: 0 | AA303: 489 | AB303: 657 | AC303: 74.43 | AD303: 4
A304: NORTHCOTE | D304: REILLY | G304: LEAKE | I304: GALL | K304: LONG | M304: ADAMS | P304: DOUG NICHOLLS | W304: GEELONG ASSOC. | X304: 1 | Y304: 6 | Z304: 0 | AA304: 336 | AB304: 576 | AC304: 58.333333333333336 | AD304: 4
A305: PRAHRAN | D305: SNELL | G305: OSBORNE | I305: VANCE | K305: CROSSEN | M305: B SMITH | P305: DARVELL
A306: GOALKICKERS
A307: NORTHCOTE | D307: REILLY 6 | G307: DARRA NICHOLLS 3 | K307: LEAKE 2 | M307: POWELL | O307: DIMMICK
A308: PRAHRAN | D308: ALESSIO | G308: DARVELL | I308: HOWLEY | L308: REYNOLDS | O308: HARLEY
A310: BRUNSWICK | C310: 2 | D310: 4 | E310: =C310*6+D310 -> 16 | G310: 8 | H310: 6 | I310: =G310*6+H310 -> 54 | K310: 9 | L310: 6 | M310: =K310*6+L310 -> 60 | O310: 13 | P310: 8 | Q310: =O310*6+P310 -> 86 | S310: CAMBERWELL
A311: CAMBERWELL | C311: 3 | D311: 4 | E311: =C311*6+D311 -> 22 | G311: 7 | H311: 6 | I311: =G311*6+H311 -> 48 | K311: 11 | L311: 8 | M311: =K311*6+L311 -> 74 | O311: 12 | P311: 9 | Q311: =O311*6+P311 -> 81 | S311: CLARKE
A312: BEST PLAYERS
A313: BRUNSWICK | D313: REID | G313: KENNETT | J313: GILMORE | M313: BRIGHT | P313: WARDEN | S313: LAFFIN
A314: CAMBERWELL | D314: LAWN | G314: PAGE | J314: GREENWOOD | M314: ELLIMAN | P314: WOODFORD | S314: HARRISON
A315: GOALKICKERS
A316: BRUNSWICK | D316: GILMORE 4 | G316: BRIGHT 2 | I316: LAFFIN 2 | K316: CAREY 2 | M316: CAMPBELL | O316: WARDEN | Q316: PROUDFOOT
A317: CAMBERWELL | D317: CONNOP 5 | G317: ELLIMAN 3 | J317: WOODFORD 3 | M317: OWENS
A319: WILLIAMSTOWN | C319: 0 | D319: 6 | E319: =C319*6+D319 -> 6 | G319: 3 | H319: 8 | I319: =G319*6+H319 -> 26 | K319: 3 | L319: 12 | M319: =K319*6+L319 -> 30 | O319: 4 | P319: 15 | Q319: =O319*6+P319 -> 39 | S319: WILLIAMSTOWN
A320: PRESTON | C320: 2 | D320: 2 | E320: =C320*6+D320 -> 14 | G320: 2 | H320: 5 | I320: =G320*6+H320 -> 17 | K320: 4 | L320: 11 | M320: =K320*6+L320 -> 35 | O320: 4 | P320: 13 | Q320: =O320*6+P320 -> 37 | S320: McKINNON
A321: BEST PLAYERS
A322: WILLIAMSTOWN | D322: CLAUSCEN | G322: WHITBURN | J322: BEER | M322: LORD | P322: DREW | S322: KENNY
A323: PRESTON | D323: STEVENS | G323: TAYLOR | J323: LUDLOW | M323: HUME | P323: SURTEES | S323: SUMMERS
A324: GOALKICKERS
A325: WILLIAMSTOWN | D325: SAYNOR 2 | G325: BEER | J325: LORD
A326: PRESTON | D326: HUME 2 | G326: LUDLOW 2
A328: BRIGHTON | C328: 1 | D328: 4 | E328: =C328*6+D328 -> 10 | G328: 6 | H328: 13 | I328: =G328*6+H328 -> 49 | K328: 9 | L328: 15 | M328: =K328*6+L328 -> 69 | O328: 13 | P328: 20 | Q328: =O328*6+P328 -> 98 | S328: WEST OVAL
A329: GEELONG ASSOC. | C329: 1 | D329: 3 | E329: =C329*6+D329 -> 9 | G329: 2 | H329: 4 | I329: =G329*6+H329 -> 16 | K329: 5 | L329: 7 | M329: =K329*6+L329 -> 37 | O329: 6 | P329: 8 | Q329: =O329*6+P329 -> 44 | S329: MAHER
A330: BEST PLAYERS
A331: BRIGHTON | D331: RATTRAY | G331: BORLAND | J331: GARCIA | M331: ACKERS | P331: HUNT | R331: WALSH
A332: GEELONG ASSOC. | D332: ROACH | G332: JONES | J332: HARRIS | M332: RUSHTON | P332: COLEMAN | R332: NOONAN
A333: GOALKICKERS
A334: BRIGHTON | D334: WALSH 4 | F334: ACKERS 3 | I334: ALDRIDGE 2 | L334: HUNT | N334: BORLAND | P334: RINGROSE | R334: DE ARAUGO
A335: GEELONG ASSOC. | D335: NOONAN 3 | G335: CATIONS 2 | J335: WRIGHT
A337: ROUND 8 | E337: 18TH JUNE | J337: WEATHER | M337: CLOUDY STRONG NORTH WIND | S337: PLAYED AT | X337: LADDER | AB337: ROUND | AD337: 8
D338: 1ST QTR | H338: 2ND QTR | L338: 3RD QTR | P338: FINAL | S338: COBURG
A339: COBURG | C339: 0 | D339: 2 | E339: =C339*6+D339 -> 2 | G339: 3 | H339: 10 | I339: =G339*6+H339 -> 28 | K339: 3 | L339: 11 | M339: =K339*6+L339 -> 29 | O339: 13 | P339: 19 | Q339: =O339*6+P339 -> 97 | S339: UMPIRE | W339: TEAM | X339: W | Y339: L | Z339: D | AA339: FOR | AB339: AGST | AC339: % | AD339: PTS
A340: NORTHCOTE | C340: 4 | D340: 6 | E340: =C340*6+D340 -> 30 | G340: 5 | H340: 6 | I340: =G340*6+H340 -> 36 | K340: 9 | L340: 12 | M340: =K340*6+L340 -> 66 | O340: 10 | P340: 12 | Q340: =O340*6+P340 -> 72 | S340: LESTER
A341: BEST PLAYERS | W341: COBURG | X341: 8 | Y341: 0 | Z341: 0 | AA341: 848 | AB341: 475 | AC341: 178.52631578947367 | AD341: 32
A342: COBURG | D342: FORD | F342: CHARLESTON | I342: HUNTINGTON | L342: CHAPMAN | O342: MEARS | Q342: WALSH | W342: PORT MELBOURNE | X342: 6 | Y342: 2 | Z342: 0 | AA342: 562 | AB342: 445 | AC342: 126.29213483146067 | AD342: 24
A343: NORTHCOTE | D343: WOODS | F343: SMITH | I343: JUDKINS | L343: PERKINS | O343: GALL | Q343: DOUG NICHOLLS | W343: PRESTON | X343: 6 | Y343: 2 | Z343: 0 | AA343: 680 | AB343: 570 | AC343: 119.29824561403508 | AD343: 24
A344: GOALKICKERS | W344: BRIGHTON | X344: 5 | Y344: 3 | Z344: 0 | AA344: 648 | AB344: 519 | AC344: 124.85549132947978 | AD344: 20
A345: COBURG | D345: GARDINER 5 | G345: PLANT 4 | I345: HUNTINGTON 2 | L345: CHARLESTON | O345: HARRIS
A346: NORTHCOTE | D346: GALL 3 | F346: BOYLE 3 | H346: ROGAN | J346: PERKINS | L346: GALL | N346: ADAMS | W346: NORTHCOTE | X346: 5 | Y346: 3 | Z346: 0 | AA346: 659 | AB346: 566 | AC346: 116.43109540636043 | AD346: 20
W347: BRUNSWICK | X347: 3 | Y347: 5 | Z347: 0 | AA347: 502 | AB347: 656 | AC347: 76.524390243902445 | AD347: 12
A348: PRESTON | C348: 1 | D348: 3 | E348: =C348*6+D348 -> 9 | G348: 10 | H348: 7 | I348: =G348*6+H348 -> 67 | K348: 11 | L348: 10 | M348: =K348*6+L348 -> 76 | O348: 16 | P348: 18 | Q348: =O348*6+P348 -> 114 | S348: PRESTON | W348: WILLIAMSTOWN | X348: 2 | Y348: 5 | Z348: 1 | AA348: 452 | AB348: 603 | AC348: 74.958540630182426 | AD348: 10
A349: PORT MELBOURNE | C349: 4 | D349: 4 | E349: =C349*6+D349 -> 28 | G349: 4 | H349: 4 | I349: =G349*6+H349 -> 28 | K349: 13 | L349: 9 | M349: =K349*6+L349 -> 87 | O349: 14 | P349: 10 | Q349: =O349*6+P349 -> 94 | S349: BLACKBURN | W349: CAMBERWELL | X349: 2 | Y349: 6 | Z349: 0 | AA349: 605 | AB349: 709 | AC349: 85.33 | AD349: 8
A350: BEST PLAYERS | W350: PRAHRAN | X350: 1 | Y350: 6 | Z350: 1 | AA350: 552 | AB350: 720 | AC350: 76.67 | AD350: 6
A351: PRESTON | D351: WATT | G351: SHAW | I351: WHITE | L351: STEVENS | O351: LUDLOW | Q351: ELLIS | W351: GEELONG ASSOC. | X351: 1 | Y351: 7 | Z351: 0 | AA351: 404 | AB351: 649 | AC351: 62.249614791987675 | AD351: 4
A352: PORT MELBOURNE | D352: W RUDD | G352: HARVEY | I352: KENNEDY | L352: WILSON | O352: BOURKE | Q352: TAYLOR
A353: GOALKICKERS
A354: PRESTON | D354: LUDLOW 3 | F354: STEVENS 3 | I354: MILLER 2 | K354: GRAY 2 | M354: WATT | N354: WHITE | P354: ELLIS | Q354: WARR | S354: SUMMERS | V354: HUME
A355: PORT MELBOURNE | D355: TAYLOR 5 | F355: KENNEDY 3 | I355: KUHLKEN 2 | L355: BOURKE | N355: SKILTON | P355: COMBER | R355: FORBES
A357: BRIGHTON | C357: 7 | D357: 11 | E357: =C357*6+D357 -> 53 | G357: 7 | H357: 11 | I357: =G357*6+H357 -> 53 | K357: 14 | L357: 21 | M357: =K357*6+L357 -> 105 | O357: 14 | P357: 25 | Q357: =O357*6+P357 -> 109 | S357: BRIGHTON BEACH
A358: CAMBERWELL | C358: 0 | D358: 0 | E358: =C358*6+D358 -> 0 | G358: 6 | H358: 6 | I358: =G358*6+H358 -> 42 | K358: 6 | L358: 6 | M358: =K358*6+L358 -> 42 | O358: 9 | P358: 9 | Q358: =O358*6+P358 -> 63 | S358: PETERS
A359: BEST PLAYERS
A360: BRIGHTON | D360: ALDRIDGE | G360: RATTRAY | J360: WALSH | M360: HUNT | P360: CARROLL | S360: RINGROSE
A361: CAMBERWELL | D361: WOODFROD | G361: KARTHAUS | J361: PAGE | M361: ELLIOTT | P361: SEIDEL | S361: CONNOP
A362: GOALKICKERS
A363: BRIGHTON | D363: WALSH 6 | F363: RATTRAY 2 | I363: HUNT 2 | K363: DE ARAUGO | N363: CARROLL | P363: STEWART | R363: HERON
A364: CAMBERWELL | D364: WOODFORD 3 | G364: CONNOP 3 | I364: DIMOND | K364: ALBERRY | M364: GREENBURY
A366: PRAHRAN | C366: 1 | D366: 1 | E366: =C366*6+D366 -> 7 | G366: 3 | H366: 3 | I366: =G366*6+H366 -> 21 | K366: 4 | L366: 3 | M366: =K366*6+L366 -> 27 | O366: 9 | P366: 9 | Q366: =O366*6+P366 -> 63 | S366: TOORAK PARK
A367: WILLIAMSTOWN | C367: 5 | D367: 8 | E367: =C367*6+D367 -> 38 | G367: 6 | H367: 10 | I367: =G367*6+H367 -> 46 | K367: 8 | L367: 13 | M367: =K367*6+L367 -> 61 | O367: 8 | P367: 15 | Q367: =O367*6+P367 -> 63 | S367: MURRAY
A368: BEST PLAYERS
A369: PRAHRAN | D369: HARLEY | G369: SEACH | I369: VANCE | L369: PROCTOR | O369: F SMITH | Q369: E JONES
A370: WILLIAMSTOWN | D370: LORD | G370: SAYNOR | I370: MARTIN | L370: SCOONES | O370: BEER | Q370: WHITBURN
A371: GOALKICKERS
A372: PRAHRAN | D372: HARLEY 6 | G372: WOODS 2 | J372: McPHERSON
A373: WILLIAMSTOWN | D373: MARTIN 3 | G373: BEER 2 | J373: SAYNOR 2 | M373: McKAY
A375: BRUNSWICK | C375: 5 | D375: 6 | E375: =C375*6+D375 -> 36 | G375: 7 | H375: 7 | I375: =G375*6+H375 -> 49 | K375: 9 | L375: 11 | M375: =K375*6+L375 -> 65 | O375: 10 | P375: 13 | Q375: =O375*6+P375 -> 73 | S375: BRUNSWICK
A376: GEELONG ASSOC. | C376: 1 | D376: 1 | E376: =C376*6+D376 -> 7 | G376: 2 | H376: 4 | I376: =G376*6+H376 -> 16 | K376: 6 | L376: 4 | M376: =K376*6+L376 -> 40 | O376: 10 | P376: 8 | Q376: =O376*6+P376 -> 68 | S376: OLDFIELD
A377: BEST PLAYERS
A378: BRUNSWICK | D378: CAREY | G378: HARRIS | I378: HART | L378: KENNETT | O378: TELFER | Q378: WARDEN
A379: GEELONG ASSOC. | D379: ROACH | G379: DEAN | I379: COLEMAN | L379: McMANUS | O379: NOONAN | Q379: WHITE
A380: GOALKICKERS
A381: BRUNSWICK | D381: CAREY 2 | F381: RYAN | H381: WARDEN | J381: GARSIDE | L381: HART | N381: TELFER | P381: KENNEDY | R381: PARKER | U381: LAFFIN
A382: GEELONG ASSOC. | D382: NOONAN 4 | G382: MELLAHN 3 | J382: DEAN | L382: McMANUS | N382: BLISS
A384: ROUND 9 | E384: 25TH JUNE | H384: WEATHER | K384: CLOUDY DULL BUT FINE S.W. BREEZE | S384: PLAYED AT | X384: LADDER | AB384: ROUND | AD384: 9
D385: 1ST QTR | H385: 2ND QTR | L385: 3RD QTR | P385: FINAL | S385: PRESTON
A386: BRIGHTON | C386: 4 | D386: 2 | E386: =C386*6+D386 -> 26 | G386: 6 | H386: 7 | I386: =G386*6+H386 -> 43 | K386: 11 | L386: 11 | M386: =K386*6+L386 -> 77 | O386: 17 | P386: 13 | Q386: =O386*6+P386 -> 115 | S386: UMPIRE | W386: TEAM | X386: W | Y386: L | Z386: D | AA386: FOR | AB386: AGST | AC386: % | AD386: PTS
A387: PRESTON | C387: 4 | D387: 5 | E387: =C387*6+D387 -> 29 | G387: 7 | H387: 6 | I387: =G387*6+H387 -> 48 | K387: 9 | L387: 9 | M387: =K387*6+L387 -> 63 | O387: 10 | P387: 9 | Q387: =O387*6+P387 -> 69 | S387: ALLEY
A388: BEST PLAYERS | W388: COBURG | X388: 9 | Y388: 0 | Z388: 0 | AA388: 1004 | AB388: 564 | AC388: 178.01418439716312 | AD388: 36
A389: BRIGHTON | D389: CARROLL | F389: WALSH | I389: ARTHUR | L389: HUNT | O389: GARCIA | Q389: RATTRAY | W389: PORT MELBOURNE | X389: 7 | Y389: 2 | Z389: 0 | AA389: 671 | AB389: 484 | AC389: 138.63636363636363 | AD389: 28
A390: PRESTON | D390: SHAW | F390: HOLLIDAY | I390: SKIPPER | L390: LUDLOW | O390: TAYLOR | Q390: STEVENS | W390: BRIGHTON | X390: 6 | Y390: 3 | Z390: 0 | AA390: 763 | AB390: 588 | AC390: 129.76190476190476 | AD390: 24
A391: GOALKICKERS | W391: NORTHCOTE | X391: 6 | Y391: 3 | Z391: 0 | AA391: 777 | AB391: 601 | AC391: 129.28452579034942 | AD391: 24
A392: BRIGHTON | D392: WALSH 9 | F392: RATTRAY 3 | I392: DE ARAUGO 2 | L392: STEWART 2 | O392: RINGROSE
A393: PRESTON | D393: STEVENS 4 | G393: HUME 2 | I393: LUDLOW 2 | L393: SHAW | N393: ELLIS | W393: PRESTON | X393: 6 | Y393: 3 | Z393: 0 | AA393: 749 | AB393: 685 | AC393: 109.34306569343066 | AD393: 24
W394: WILLIAMSTOWN | X394: 3 | Y394: 5 | Z394: 1 | AA394: 516 | AB394: 634 | AC394: 81.388012618296528 | AD394: 14
A395: WILLIAMSTOWN | C395: 3 | D395: 2 | E395: =C395*6+D395 -> 20 | G395: 6 | H395: 3 | I395: =G395*6+H395 -> 39 | K395: 8 | L395: 7 | M395: =K395*6+L395 -> 55 | O395: 9 | P395: 10 | Q395: =O395*6+P395 -> 64 | S395: WILLIAMSTOWN | W395: BRUNSWICK | X395: 3 | Y395: 6 | Z395: 0 | AA395: 533 | AB395: 720 | AC395: 74.027777777777771 | AD395: 12
A396: BRUNSWICK | C396: 1 | D396: 1 | E396: =C396*6+D396 -> 7 | G396: 2 | H396: 4 | I396: =G396*6+H396 -> 16 | K396: 3 | L396: 5 | M396: =K396*6+L396 -> 23 | O396: 4 | P396: 7 | Q396: =O396*6+P396 -> 31 | S396: LESTER | W396: CAMBERWELL | X396: 2 | Y396: 7 | Z396: 0 | AA396: 694 | AB396: 865 | AC396: 80.23 | AD396: 8
A397: BEST PLAYERS | W397: PRAHRAN | X397: 1 | Y397: 7 | Z397: 1 | AA397: 591 | AB397: 829 | AC397: 71.29 | AD397: 6
A398: WILLIAMSTOWN | D398: LORD | F398: CLAUSCEN | I398: SYKES | L398: BEER | N398: SAYNER | Q398: DREW | W398: GEELONG ASSOC. | X398: 1 | Y398: 8 | Z398: 0 | AA398: 439 | AB398: 767 | AC398: 57.235984354628421 | AD398: 4
A399: BRUNSWICK | D399: RAYMOND | F399: BRIGHT | I399: CAREY | L399: RAE | N399: KENNETT | Q399: REID
A400: GOALKICKERS
A401: WILLIAMSTOWN | D401: SAYNOR 3 | G401: LORD 2 | I401: DREW 2 | K401: GRINHAM | M401: KENNY
A402: BRUNSWICK | D402: CAREY 2 | G402: KENNEDY | I402: RAYMOND
A404: NORTHCOTE | C404: 5 | D404: 6 | E404: =C404*6+D404 -> 36 | G404: 6 | H404: 13 | I404: =G404*6+H404 -> 49 | K404: 11 | L404: 15 | M404: =K404*6+L404 -> 81 | O404: 16 | P404: 22 | Q404: =O404*6+P404 -> 118 | S404: NORTHCOTE
A405: GEELONG ASSOC. | C405: 2 | D405: 3 | E405: =C405*6+D405 -> 15 | G405: 4 | H405: 4 | I405: =G405*6+H405 -> 28 | K405: 5 | L405: 5 | M405: =K405*6+L405 -> 35 | O405: 5 | P405: 5 | Q405: =O405*6+P405 -> 35 | S405: McKINNON
A406: BEST PLAYERS
A407: NORTHCOTE | D407: JUDKINS | F407: WOODS | H407: DOUG NICHOLLS | K407: DARRA NICHOLLS | O407: REILLY | Q407: DESLANDES
A408: GEELONG ASSOC. | D408: WRIGHT | F408: DIGBY | H408: DEAN | K408: FARR | O408: HARRIS | Q408: RANKIN
A409: GOALKICKERS
A410: NORTHCOTE | D410: BOYLE 5 | F410: DESLANDES 4 | I410: ADAMS 3 | K410: REILLY 3 | M410: DOUG NICHOLLS
A411: GEELONG ASSOC. | D411: DEAN 2 | G411: DIGBY | J411: WRIGHT | M411: NOONAN
A413: COBURG | C413: 6 | D413: 3 | E413: =C413*6+D413 -> 39 | G413: 9 | H413: 10 | I413: =G413*6+H413 -> 64 | K413: 16 | L413: 15 | M413: =K413*6+L413 -> 111 | O413: 23 | P413: 18 | Q413: =O413*6+P413 -> 156 | S413: CAMBERWELL
A414: CAMBERWELL | C414: 2 | D414: 3 | E414: =C414*6+D414 -> 15 | G414: 8 | H414: 7 | I414: =G414*6+H414 -> 55 | K414: 11 | L414: 7 | M414: =K414*6+L414 -> 73 | O414: 13 | P414: 11 | Q414: =O414*6+P414 -> 89 | S414: CLARKE
A415: BEST PLAYERS
A416: COBURG | D416: GARDINER | G416: MEARS | I416: C MARTYN | L416: CHARLESTON | O416: MARCHESI | Q416: HUNTINGTON
A417: CAMBERWELL | D417: ALBERRY | G417: TRESIZE | I417: WHITEHEAD | L417: WOODFORD | O417: PAGE | Q417: ELLIMAN
A418: GOALKICKERS
A419: COBURG | D419: GARDINER 8 | G419: MEARS 5 | I419: FORBES 3 | K419: PLANT 3 | M419: HUNTINGTON 2 | P419: HARRIS 2
A420: CAMBERWELL | D420: WHITEHEAD 5 | G420: ELLIMAN 3 | J420: BAZIN 2 | L420: WOODFORD | O420: CONNOP | Q420: ELLIOTT
A422: PORT MELBOURNE | C422: 3 | D422: 1 | E422: =C422*6+D422 -> 19 | G422: 7 | H422: 6 | I422: =G422*6+H422 -> 48 | K422: 11 | L422: 7 | M422: =K422*6+L422 -> 73 | O422: 16 | P422: 13 | Q422: =O422*6+P422 -> 109 | S422: PORT MELBOURNE
A423: PRAHRAN | C423: 1 | D423: 2 | E423: =C423*6+D423 -> 8 | G423: 1 | H423: 5 | I423: =G423*6+H423 -> 11 | K423: 4 | L423: 6 | M423: =K423*6+L423 -> 30 | O423: 5 | P423: 9 | Q423: =O423*6+P423 -> 39 | S423: BLACKBURN
A424: BEST PLAYERS
A425: PORT MELBOURNE | D425: WILSON | G425: TAYLOR | I425: BARFOOT | L425: BOLMAN | O425: HARVEY | Q425: KUHLKEN
A426: PRAHRAN | D426: McPHERSON | G426: F SMITH | I426: HARLEY | L426: RUSSELL | O426: DARVELL | Q426: McGRATH
A427: GOALKICKERS
A428: PORT MELBOURNE | D428: TAYLOR 8 | G428: WILSON 3 | J428: KUHLKEN 2 | M428: FORBES | O428: BARFOOT | Q428: SKILTON
A429: PRAHRAN | D429: HARLEY 4 | G429: SNELL
A431: ROUND 10 | E431: 2ND JULY | H431: WEATHER | K431: RAIN NORTH WIND GROUNDS BAD | S431: PLAYED AT | X431: LADDER | AB431: ROUND | AD431: 10
D432: 1ST QTR | H432: 2ND QTR | L432: 3RD QTR | P432: FINAL | S432: BRIGHTON BEACH
A433: COBURG | C433: 6 | D433: 3 | E433: =C433*6+D433 -> 39 | G433: 6 | H433: 3 | I433: =G433*6+H433 -> 39 | K433: 12 | L433: 5 | M433: =K433*6+L433 -> 77 | O433: 12 | P433: 5 | Q433: =O433*6+P433 -> 77 | S433: UMPIRE | W433: TEAM | X433: W | Y433: L | Z433: D | AA433: FOR | AB433: AGST | AC433: % | AD433: PTS
A434: BRIGHTON | C434: 1 | D434: 0 | E434: =C434*6+D434 -> 6 | G434: 2 | H434: 7 | I434: =G434*6+H434 -> 19 | K434: 2 | L434: 7 | M434: =K434*6+L434 -> 19 | O434: 3 | P434: 10 | Q434: =O434*6+P434 -> 28 | S434: BLACKBURN
A435: BEST PLAYERS | W435: COBURG | X435: 10 | Y435: 0 | Z435: 0 | AA435: 1081 | AB435: 592 | AC435: 182.60135135135135 | AD435: 40
A436: COBURG | D436: WALSH | G436: GARDINER | J436: FORBES | M436: COX | O436: MEARS | Q436: HARRIS | W436: PORT MELBOURNE | X436: 7 | Y436: 3 | Z436: 0 | AA436: 739 | AB436: 555 | AC436: 133.15315315315314 | AD436: 28
A437: BRIGHTON | D437: CARROLL | G437: KOLLE | J437: IRWIN | M437: DORE | O437: RATTRAY | Q437: BORLAND | W437: NORTHCOTE | X437: 7 | Y437: 3 | Z437: 0 | AA437: 848 | AB437: 669 | AC437: 126.75635276532138 | AD437: 28
A438: GOALKICKERS | W438: PRESTON | X438: 7 | Y438: 3 | Z438: 0 | AA438: 803 | AB438: 728 | AC438: 110.3021978021978 | AD438: 28
A439: COBURG | D439: PLANT 3 | F439: GARDINER 3 | I439: HARRIS 2 | K439: McALPINE | M439: COX | N439: HUNTINGTON | Q439: MEARS
A440: BRIGHTON | D440: WALSH 2 | G440: RINGROSE | W440: BRIGHTON | X440: 6 | Y440: 4 | Z440: 0 | AA440: 791 | AB440: 665 | AC440: 118.94736842105263 | AD440: 24
W441: WILLIAMSTOWN | X441: 4 | Y441: 5 | Z441: 1 | AA441: 566 | AB441: 683 | AC441: 82.869692532942892 | AD441: 18
A442: NORTHCOTE | C442: 3 | D442: 2 | E442: =C442*6+D442 -> 20 | G442: 7 | H442: 4 | I442: =G442*6+H442 -> 46 | K442: 10 | L442: 5 | M442: =K442*6+L442 -> 65 | O442: 11 | P442: 5 | Q442: =O442*6+P442 -> 71 | S442: NORTHCOTE | W442: BRUNSWICK | X442: 3 | Y442: 7 | Z442: 0 | AA442: 576 | AB442: 774 | AC442: 74.418604651162795 | AD442: 12
A443: PORT MELBOURNE | C443: 2 | D443: 4 | E443: =C443*6+D443 -> 16 | G443: 3 | H443: 6 | I443: =G443*6+H443 -> 24 | K443: 3 | L443: 10 | M443: =K443*6+L443 -> 28 | O443: 9 | P443: 14 | Q443: =O443*6+P443 -> 68 | S443: LESTER | W443: PRAHRAN | X443: 2 | Y443: 7 | Z443: 1 | AA443: 674 | AB443: 866 | AC443: 77.83 | AD443: 10
A444: BEST PLAYERS | W444: CAMBERWELL | X444: 2 | Y444: 8 | Z444: 0 | AA444: 743 | AB444: 915 | AC444: 81.2 | AD444: 8
A445: NORTHCOTE | D445: JUDKINS | G445: WHITFIELD | J445: ROGAN | M445: LONG | O445: SMITH | Q445: WOODS | W445: GEELONG ASSOC. | X445: 1 | Y445: 9 | Z445: 0 | AA445: 476 | AB445: 850 | AC445: 56 | AD445: 4
A446: PORT MELBOURNE | D446: JOHNSTONE | G446: CROMPTON | J446: GARBUTT | M446: BARFOOT | O446: TAYLOR | Q446: WILSON
A447: GOALKICKERS
A448: NORTHCOTE | D448: WHITFIELD 4 | G448: WOODS | I448: BOYLE | J448: ADAMS | L448: ROSERS | N448: ANTHONY | Q448: DOUG NICHOLLS | U448: JUDKINS
A449: PORT MELBOURNE | D449: TAYLOR 5 | G449: GARBUTT 2 | J449: FORBES | L449: ROSEMAN
A451: PRESTON | C451: 1 | D451: 3 | E451: =C451*6+D451 -> 9 | G451: 2 | H451: 4 | I451: =G451*6+H451 -> 16 | K451: 7 | L451: 4 | M451: =K451*6+L451 -> 46 | O451: 8 | P451: 6 | Q451: =O451*6+P451 -> 54 | S451: BRUNSWICK
A452: BRUNSWICK | C452: 3 | D452: 1 | E452: =C452*6+D452 -> 19 | G452: 4 | H452: 3 | I452: =G452*6+H452 -> 27 | K452: 5 | L452: 4 | M452: =K452*6+L452 -> 34 | O452: 6 | P452: 7 | Q452: =O452*6+P452 -> 43 | S452: ALLEY
A453: BEST PLAYERS
A454: PRESTON | D454: WHITE | G454: WATT | I454: WARR | L454: SHAW | O454: SUMMERS | R454: CONNAUGHTON
A455: BRUNSWICK | D455: BRIGHT | G455: WARDEN | I455: TELFER | L455: WRIGHT | O455: KENNEDY | R455: KENNETT
A456: GOALKICKERS
A457: PRESTON | D457: HUME 3 | G457: ANDERSON 2 | J457: WARR | M457: LUDLOW | O457: MILLER
A458: BRUNSWICK | D458: RAYMOND 2 | G458: TELFER | J458: KENNEDY | M458: CAREY | O458: WARDEN
A460: WILLIAMSTOWN | C460: 1 | D460: 0 | E460: =C460*6+D460 -> 6 | G460: 7 | H460: 7 | I460: =G460*6+H460 -> 49 | K460: 7 | L460: 8 | M460: =K460*6+L460 -> 50 | O460: 7 | P460: 8 | Q460: =O460*6+P460 -> 50 | S460: WILLIAMSTOWN
A461: CAMBERWELL | C461: 2 | D461: 2 | E461: =C461*6+D461 -> 14 | G461: 2 | H461: 2 | I461: =G461*6+H461 -> 14 | K461: 5 | L461: 5 | M461: =K461*6+L461 -> 35 | O461: 7 | P461: 7 | Q461: =O461*6+P461 -> 49 | S461: MAHER
A462: BEST PLAYERS
A463: WILLIAMSTOWN | D463: LORD | G463: McKAY | J463: WHITBURN | M463: SAYNOR | P463: MEEHAN | S463: KENNY
A464: CAMBERWELL | D464: HORNE | G464: BOOTHMAN | J464: WHITECROSS | M464: CONNOP | P464: ELLIOTT | S464: KARTHAUS
A465: GOALKICKERS
A466: WILLIAMSTOWN | D466: MEEHAN 2 | G466: QUINN | I466: SAYNER | K466: KENNY | M466: GRINHAM | P466: LORD
A467: CAMBERWELL | D467: ELLIMAN 2 | G467: PRICE 2 | I467: CONNOP | K467: ALBERRY | M467: WOODFORD
A469: PRAHRAN | C469: 2 | D469: 1 | E469: =C469*6+D469 -> 13 | G469: 4 | H469: 5 | I469: =G469*6+H469 -> 29 | K469: 10 | L469: 5 | M469: =K469*6+L469 -> 65 | O469: 12 | P469: 11 | Q469: =O469*6+P469 -> 83 | S469: TOORAK PARK
A470: GEELONG ASSOC. | C470: 2 | D470: 2 | E470: =C470*6+D470 -> 14 | G470: 4 | H470: 2 | I470: =G470*6+H470 -> 26 | K470: 5 | L470: 7 | M470: =K470*6+L470 -> 37 | O470: 5 | P470: 7 | Q470: =O470*6+P470 -> 37 | S470: MURRAY
A471: BEST PLAYERS
A472: PRAHRAN | D472: SHORT | G472: B SMITH | J472: VANCE | M472: PROCTOR | P472: McPHERSON | S472: HARLEY
A473: GEELONG ASSOC. | D473: TAYLOR | G473: ROACH | J473: MELLAHN | M473: WHITE | P473: FARR | S473: NOONAN
A474: GOALKICKERS
A475: PRAHRAN | D475: HARLEY 5 | G475: CROSSEN 2 | J475: SNELL 2 | L475: McPHERSON | O475: DARVELL | Q475: SHORT
A476: GEELONG ASSOC. | D476: SINGLETON 2 | G476: NOONAN | I476: TAYLOR | K476: HARRIS
A478: ROUND 11 | E478: 9TH JULY | J478: WEATHER | M478: CLOUDY BUT FINE S.W. BREEZE | S478: PLAYED AT | X478: LADDER | AB478: ROUND | AD478: 11
D479: 1ST QTR | H479: 2ND QTR | L479: 3RD QTR | P479: FINAL | S479: PORT MELBOURNE
A480: BRIGHTON | C480: 0 | D480: 3 | E480: =C480*6+D480 -> 3 | G480: 6 | H480: 7 | I480: =G480*6+H480 -> 43 | K480: 8 | L480: 9 | M480: =K480*6+L480 -> 57 | O480: 13 | P480: 9 | Q480: =O480*6+P480 -> 87 | S480: UMPIRE | W480: TEAM | X480: W | Y480: L | Z480: D | AA480: FOR | AB480: AGST | AC480: % | AD480: PTS
A481: PORT MELBOURNE | C481: 4 | D481: 4 | E481: =C481*6+D481 -> 28 | G481: 5 | H481: 4 | I481: =G481*6+H481 -> 34 | K481: 8 | L481: 5 | M481: =K481*6+L481 -> 53 | O481: 11 | P481: 7 | Q481: =O481*6+P481 -> 73 | S481: MURRAY
A482: BEST PLAYERS | W482: COBURG | X482: 11 | Y482: 0 | Z482: 0 | AA482: 1168 | AB482: 646 | AC482: 180.80495356037153 | AD482: 44
A483: BRIGHTON | D483: CARROLL | G483: ARTHUR | I483: BESWICK | L483: RATTRAY | N483: WALSH | Q483: BORLAND | W483: NORTHCOTE | X483: 8 | Y483: 3 | Z483: 0 | AA483: 910 | AB483: 722 | AC483: 126.0387811634349 | AD483: 32
A484: PORT MELBOURNE | D484: FORBES | G484: WILSON | I484: ROSEMAN | L484: CANNON | N484: CARPENTER | Q484: CROMPTON | W484: PRESTON | X484: 8 | Y484: 3 | Z484: 0 | AA484: 920 | AB484: 760 | AC484: 121.05263157894737 | AD484: 32
A485: GOALKICKERS | Q485: ACKERS | W485: PORT MELBOURNE | X485: 7 | Y485: 4 | Z485: 0 | AA485: 812 | AB485: 642 | AC485: 126.4797507788162 | AD485: 28
A486: BRIGHTON | D486: WALSH 5 | F486: BESWICK 2 | I486: DE ARAUGO | L486: RATTRAY | N486: DORE | P486: RINGROSE | R486: CARSWELL
A487: PORT MELBOURNE | D487: TAYLOR 6 | G487: FORBES 2 | J487: ROSEMAN | M487: CANNON | O487: CROMPTON | W487: BRIGHTON | X487: 7 | Y487: 4 | Z487: 0 | AA487: 878 | AB487: 738 | AC487: 118.97018970189701 | AD487: 28
W488: WILLIAMSTOWN | X488: 5 | Y488: 5 | Z488: 1 | AA488: 632 | AB488: 739 | AC488: 85.520974289580508 | AD488: 22
A489: PRESTON | C489: 2 | D489: 5 | E489: =C489*6+D489 -> 17 | G489: 7 | H489: 5 | I489: =G489*6+H489 -> 47 | K489: 13 | L489: 6 | M489: =K489*6+L489 -> 84 | O489: 17 | P489: 15 | Q489: =O489*6+P489 -> 117 | S489: PRESTON | W489: BRUNSWICK | X489: 3 | Y489: 8 | Z489: 0 | AA489: 630 | AB489: 861 | AC489: 73.170731707317074 | AD489: 12
A490: PRAHRAN | C490: 2 | D490: 3 | E490: =C490*6+D490 -> 15 | G490: 3 | H490: 4 | I490: =G490*6+H490 -> 22 | K490: 4 | L490: 7 | M490: =K490*6+L490 -> 31 | O490: 4 | P490: 8 | Q490: =O490*6+P490 -> 32 | S490: LESTER | W490: PRAHRAN | X490: 2 | Y490: 8 | Z490: 1 | AA490: 706 | AB490: 983 | AC490: 71.82 | AD490: 10
A491: BEST PLAYERS | W491: CAMBERWELL | X491: 2 | Y491: 9 | Z491: 0 | AA491: 796 | AB491: 977 | AC491: 81.47 | AD491: 8
A492: PRESTON | D492: WHITE | G492: WARR | I492: SHAW | K492: LUDLOW | N492: HUME | P492: CONNAUGHTON | W492: GEELONG ASSOC. | X492: 1 | Y492: 10 | Z492: 0 | AA492: 532 | AB492: 916 | AC492: 58.078602620087338 | AD492: 4
A493: PRAHRAN | D493: B SMITH | G493: McGRATH | I493: RUSSEL | K493: McPHERSON | N493: HORTON | P493: SEACH
A494: GOALKICKERS
A495: PRESTON | D495: ANDERSON 5 | G495: HUME 4 | I495: McMEEKIN 3 | L495: SHAW 2 | N495: COGHLAN 2 | Q495: SURTEES
A496: PRAHRAN | D496: HARLEY | G496: McGRATH | J496: McPHERSON | M496: SNELL
A498: COBURG | C498: 3 | D498: 3 | E498: =C498*6+D498 -> 21 | G498: 5 | H498: 10 | I498: =G498*6+H498 -> 40 | K498: 7 | L498: 14 | M498: =K498*6+L498 -> 56 | O498: 12 | P498: 15 | Q498: =O498*6+P498 -> 87 | S498: COBURG
A499: BRUNSWICK | C499: 0 | D499: 4 | E499: =C499*6+D499 -> 4 | G499: 3 | H499: 5 | I499: =G499*6+H499 -> 23 | K499: 5 | L499: 8 | M499: =K499*6+L499 -> 38 | O499: 7 | P499: 12 | Q499: =O499*6+P499 -> 54 | S499: SCHAEFER
A500: BEST PLAYERS
A501: COBURG | D501: KERLEY | G501: C MARTYN | J501: JENKINS | M501: CHAPMAN | P501: HUNTINGTON | S501: SEXTON
A502: BRUNSWICK | D502: CAREY | G502: KENNETT | J502: WARREN | M502: BRIGHT | P502: EVANS | S502: HART
A503: GOALKICKERS | S503: NORTHCOTE
A504: COBURG | D504: KERLEY 5 | G504: PLANT 3 | J504: WALSH | L504: JENKINS | O504: GARDINER | R504: HARRIS
A505: BRUNSWICK | D505: CAREY 2 | G505: WARDEN | J505: TELFER | L505: EDWARDS | O505: PROUDFOOT | R505: HART
A507: WILLIAMSTOWN | C507: 1 | D507: 3 | E507: =C507*6+D507 -> 9 | G507: 3 | H507: 5 | I507: =G507*6+H507 -> 23 | K507: 4 | L507: 11 | M507: =K507*6+L507 -> 35 | O507: 9 | P507: 12 | Q507: =O507*6+P507 -> 66 | S507: WEST OVAL
A508: GEELONG ASSOC. | C508: 1 | D508: 2 | E508: =C508*6+D508 -> 8 | G508: 4 | H508: 5 | I508: =G508*6+H508 -> 29 | K508: 6 | L508: 6 | M508: =K508*6+L508 -> 42 | O508: 8 | P508: 8 | Q508: =O508*6+P508 -> 56 | S508: McKINNON
A509: BEST PLAYERS
A510: WILLIAMSTOWN | D510: PARKER | G510: CLAUSCEN | J510: SYKES | M510: WHITBURN | P510: SCOONES | S510: KENNY
A511: GEELONG ASSOC. | D511: ROACH | G511: FARR | J511: HARRIS | M511: WRIGHT | P511: CATIONS | S511: NOONAN
A512: GOALKICKERS
A513: WILLIAMSTOWN | D513: PARKER 5 | G513: DREW | I513: McKAY | K513: WHITBURN | N513: GRINHAM
A514: GEELONG ASSOC. | D514: NOONAN 2 | G514: DEAN 2 | I514: McPHERSON | L514: FARR | N514: CARTER | Q514: CATIONS
A516: NORTHCOTE | C516: 2 | D516: 5 | E516: =C516*6+D516 -> 17 | G516: 4 | H516: 7 | I516: =G516*6+H516 -> 31 | K516: 7 | L516: 11 | M516: =K516*6+L516 -> 53 | O516: 8 | P516: 14 | Q516: =O516*6+P516 -> 62 | S516: CAMBERWELL
A517: CAMBERWELL | C517: 3 | D517: 3 | E517: =C517*6+D517 -> 21 | G517: 3 | H517: 5 | I517: =G517*6+H517 -> 23 | K517: 5 | L517: 7 | M517: =K517*6+L517 -> 37 | O517: 7 | P517: 11 | Q517: =O517*6+P517 -> 53 | S517: LAVER
A518: BEST PLAYERS
A519: NORTHCOTE | D519: PERKINS | G519: LAFFY | J519: LONG | M519: GRIFFITHS | P519: JUDKINS | S519: SMITH
A520: CAMBERWELL | D520: LAWN | G520: HARRISON | J520: PAGE | M520: GREENWOOD | P520: CONNOP | S520: HORNE
A521: GOALKICKERS
A522: NORTHCOTE | D522: WHITFIELD 3 | G522: GALL 2 | I522: ADAMS | K522: BEESON | M522: ANTHONY
A523: CAMBERWELL | D523: CONNOP 4 | G523: LAWN 2 | I523: ALBERRY
A525: ROUND 12 | E525: 16TH JULY | H525: WEATHER | K525: CLOUDY BUT FINE S.W. WIND GROUNDS HEAVY | S525: PLAYED AT | X525: LADDER | AB525: ROUND | AD525: 12
D526: 1ST QTR | H526: 2ND QTR | L526: 3RD QTR | P526: FINAL | S526: NORTHCOTE
A527: PRESTON | C527: 5 | D527: 4 | E527: =C527*6+D527 -> 34 | G527: 7 | H527: 4 | I527: =G527*6+H527 -> 46 | K527: 8 | L527: 12 | M527: =K527*6+L527 -> 60 | O527: 9 | P527: 13 | Q527: =O527*6+P527 -> 67 | S527: UMPIRE | W527: TEAM | X527: W | Y527: L | Z527: D | AA527: FOR | AB527: AGST | AC527: % | AD527: PTS
A528: NORTHCOTE | C528: 0 | D528: 0 | E528: =C528*6+D528 -> 0 | G528: 3 | H528: 14 | I528: =G528*6+H528 -> 32 | K528: 4 | L528: 16 | M528: =K528*6+L528 -> 40 | O528: 6 | P528: 25 | Q528: =O528*6+P528 -> 61
A529: BEST PLAYERS | W529: COBURG | X529: 12 | Y529: 0 | Z529: 0 | AA529: 1293 | AB529: 706 | AC529: 183.14447592067989 | AD529: 48
A530: PRESTON | D530: WATT | F530: SUMMERS | I530: TAYLOR | K530: WARR | M530: ANDERSON | P530: LUDLOW | W530: PRESTON | X530: 9 | Y530: 3 | Z530: 0 | AA530: 987 | AB530: 821 | AC530: 120.21924482338612 | AD530: 36
A531: NORTHCOTE | D531: THEOBOLD | F531: PERKINS | I531: LONG | K531: SMITH | M531: GALL | P531: ANTHONY | W531: PORT MELBOURNE | X531: 8 | Y531: 4 | Z531: 0 | AA531: 927 | AB531: 676 | AC531: 137.1301775147929 | AD531: 32
A532: GOALKICKERS | W532: NORTHCOTE | X532: 8 | Y532: 4 | Z532: 0 | AA532: 971 | AB532: 789 | AC532: 123.06717363751584 | AD532: 32
A533: PRESTON | D533: HUME 2 | F533: McMEEKIN 2 | I533: CONNAUGHTON | L533: SUMMERS | N533: MILLER | P533: WARR | R533: ANDERSON
A534: NORTHCOTE | D534: BEESON 2 | G534: LEAKE | I534: GALL | K534: WHITFIELD | N534: BOYLE | W534: BRIGHTON | X534: 8 | Y534: 4 | Z534: 0 | AA534: 928 | AB534: 772 | AC534: 120.20725388601036 | AD534: 32
W535: WILLIAMSTOWN | X535: 5 | Y535: 6 | Z535: 1 | AA535: 692 | AB535: 864 | AC535: 80.092592592592595 | AD535: 22
A536: BRIGHTON | C536: 1 | D536: 2 | E536: =C536*6+D536 -> 8 | G536: 2 | H536: 9 | I536: =G536*6+H536 -> 21 | K536: 4 | L536: 11 | M536: =K536*6+L536 -> 35 | O536: 6 | P536: 14 | Q536: =O536*6+P536 -> 50 | S536: BRUNSWICK | W536: CAMBERWELL | X536: 3 | Y536: 9 | Z536: 0 | AA536: 889 | AB536: 1019 | AC536: 87.24 | AD536: 12
A537: BRUNSWICK | C537: 2 | D537: 3 | E537: =C537*6+D537 -> 15 | G537: 3 | H537: 5 | I537: =G537*6+H537 -> 23 | K537: 4 | L537: 9 | M537: =K537*6+L537 -> 33 | O537: 4 | P537: 10 | Q537: =O537*6+P537 -> 34 | S537: BLACKBURN | W537: BRUNSWICK | X537: 3 | Y537: 9 | Z537: 0 | AA537: 664 | AB537: 911 | AC537: 72.886937431394074 | AD537: 12
A538: BEST PLAYERS | W538: PRAHRAN | X538: 2 | Y538: 9 | Z538: 1 | AA538: 748 | AB538: 1076 | AC538: 69.52 | AD538: 10
A539: BRIGHTON | D539: DORE | G539: WALSH | I539: GARCIA | L539: CARSWELL | O539: CARROLL | Q539: BESWICK | W539: GEELONG ASSOC. | X539: 1 | Y539: 11 | Z539: 0 | AA539: 566 | AB539: 1031 | AC539: 54.898157129000971 | AD539: 4
A540: BRUNSWICK | D540: CAREY | G540: HART | I540: PROUDFOOT | L540: EDWARDS | O540: KENNETT | Q540: KENNEDY
A541: GOALKICKERS
A542: BRIGHTON | D542: WALSH 2 | G542: CARROLL | J542: DORE | L542: RATTRAY | O542: BESWICK
A543: BRUNSWICK | D543: CAREY | G543: HART | J543: PROUDFOOT | M543: O'ROURKE
A545: COBURG | C545: 0 | D545: 1 | E545: =C545*6+D545 -> 1 | G545: 11 | H545: 4 | I545: =G545*6+H545 -> 70 | K545: 11 | L545: 5 | M545: =K545*6+L545 -> 71 | O545: 19 | P545: 11 | Q545: =O545*6+P545 -> 125 | S545: WILLIAMSTOWN
A546: WILLIAMSTOWN | C546: 3 | D546: 7 | E546: =C546*6+D546 -> 25 | G546: 3 | H546: 7 | I546: =G546*6+H546 -> 25 | K546: 7 | L546: 11 | M546: =K546*6+L546 -> 53 | O546: 8 | P546: 12 | Q546: =O546*6+P546 -> 60 | S546: McKINNON
A547: BEST PLAYERS
A548: COBURG | D548: GARDINER | G548: JENKINS | I548: HUNTINGTON | L548: E MARTIN | O548: CHARLESTON | R548: McALPINE
A549: WILLIAMSTOWN | D549: SYKES | G549: BEER | I549: LORD | L549: PARKER | O549: ROBERTS | R549: QUINN
A550: GOALKICKERS
A551: COBURG | D551: GARDINER 4 | G551: HARRIS 4 | I551: JENKINS 3 | K551: PLANT 2 | M551: HUNTINGTON 2 | P551: CHARLESTON 2 | S551: GOSLING | U551: KERLEY
A552: WILLIAMSTOWN | D552: PARKER 2 | G552: LORD 2 | I552: ROBERTS 2 | L552: MURPHY | N552: QUINN
A554: CAMBERWELL | C554: 4 | D554: 6 | E554: =C554*6+D554 -> 30 | G554: 7 | H554: 10 | I554: =G554*6+H554 -> 52 | K554: 12 | L554: 13 | M554: =K554*6+L554 -> 85 | O554: 13 | P554: 15 | Q554: =O554*6+P554 -> 93 | S554: TOORAK PARK
A555: PRAHRAN | C555: 1 | D555: 0 | E555: =C555*6+D555 -> 6 | G555: 1 | H555: 2 | I555: =G555*6+H555 -> 8 | K555: 1 | L555: 3 | M555: =K555*6+L555 -> 9 | O555: 6 | P555: 6 | Q555: =O555*6+P555 -> 42 | S555: OLDFIELD
A556: BEST PLAYERS
A557: CAMBERWELL | D557: ELLIMAN | G557: PAGE | I557: STEVENS | L557: GREENWOOD | O557: PRICE | Q557: LAWN
A558: PRAHRAN | D558: McGRATH | G558: SEACH | I558: McPHERSON | L558: F SMITH | O558: PROCTOR | Q558: REYNOLDS
A559: GOALKICKERS
A560: CAMBERWELL | D560: ELLIMAN 4 | G560: WOODFORD 2 | J560: LAWN 2 | L560: CONNOP 2 | N560: HENDRIE 2 | Q560: KARTHAUS
A561: PRAHRAN | D561: HARLEY 3 | G561: SHORT | I561: WOODS | K561: HORTON
A563: PORT MELBOURNE | C563: 3 | D563: 0 | E563: =C563*6+D563 -> 18 | G563: 8 | H563: 4 | I563: =G563*6+H563 -> 52 | K563: 10 | L563: 8 | M563: =K563*6+L563 -> 68 | O563: 17 | P563: 13 | Q563: =O563*6+P563 -> 115 | S563: PORT MELBOURNE
A564: GEELONG ASSOC. | C564: 3 | D564: 6 | E564: =C564*6+D564 -> 24 | G564: 3 | H564: 7 | I564: =G564*6+H564 -> 25 | K564: 4 | L564: 9 | M564: =K564*6+L564 -> 33 | O564: 4 | P564: 10 | Q564: =O564*6+P564 -> 34 | S564: LYNCH
A565: BEST PLAYERS
A566: PORT MELBOURNE | D566: BOURKE | G566: SKILTON | J566: KENNEDY | M566: GARBUTT | P566: WILKINS | S566: ROSEMAN
A567: GEELONG ASSOC. | D567: TAYLOR | G567: MELLAHN | J567: CATIONS | M567: DEAN | P567: McPHERSON | S567: McMANUS
A568: GOALKICKERS
A569: PORT MELBOURNE | D569: WILKINS 5 | F569: TAYLOR 3 | I569: BOURKE 2 | K569: KENNEDY 2 | N569: ROSEMAN 2 | Q569: SKILTON | S569: CANNON | V569: HOWIE
A570: GEELONG ASSOC. | D570: McPHERSON | G570: CARTER | J570: DIGBY | L570: DEAN
A572: ROUND 13 | E572: 23RD JULY | H572: WEATHER | K572: COLD CLOUDY SHOWERS SOUTH WIND | S572: PLAYED AT | X572: LADDER | AB572: ROUND | AD572: 13
D573: 1ST QTR | H573: 2ND QTR | L573: 3RD QTR | P573: FINAL | S573: BRIGHTON BEACH
A574: BRIGHTON | C574: 0 | D574: 1 | E574: =C574*6+D574 -> 1 | G574: 2 | H574: 7 | I574: =G574*6+H574 -> 19 | K574: 3 | L574: 7 | M574: =K574*6+L574 -> 25 | O574: 13 | P574: 9 | Q574: =O574*6+P574 -> 87 | S574: UMPIRE | W574: TEAM | X574: W | Y574: L | Z574: D | AA574: FOR | AB574: AGST | AC574: % | AD574: PTS
A575: WILLIAMSTOWN | C575: 3 | D575: 4 | E575: =C575*6+D575 -> 22 | G575: 3 | H575: 4 | I575: =G575*6+H575 -> 22 | K575: 3 | L575: 8 | M575: =K575*6+L575 -> 26 | O575: 3 | P575: 9 | Q575: =O575*6+P575 -> 27 | S575: PATTISON
A576: BEST PLAYERS | W576: COBURG | X576: 13 | Y576: 0 | Z576: 0 | AA576: 1411 | AB576: 766 | AC576: 184.20365535248041 | AD576: 52
A577: BRIGHTON | D577: BESWICK | G577: CARROLL | J577: WALSH | M577: DORE | O577: WRIGHT | Q577: RATTRAY | W577: PRESTON | X577: 10 | Y577: 3 | Z577: 0 | AA577: 1090 | AB577: 890 | AC577: 122.47191011235955 | AD577: 40
A578: WILLIAMSTOWN | D578: LORD | G578: CLAUSCEN | J578: CHALMERS | M578: BEER | O578: MATHER | Q578: WARREN | W578: PORT MELBOURNE | X578: 9 | Y578: 4 | Z578: 0 | AA578: 1022 | AB578: 724 | AC578: 141.16022099447514 | AD578: 36
A579: GOALKICKERS | W579: BRIGHTON | X579: 9 | Y579: 4 | Z579: 0 | AA579: 1015 | AB579: 799 | AC579: 127.03379224030037 | AD579: 36
A580: BRIGHTON | D580: WALSH 5 | F580: WRIGHT 2 | I580: RATTRAY 2 | L580: STEWART | N580: KOLLE | P580: RINGROSE | R580: DE ARAUGO
A581: WILLIAMSTOWN | D581: DREW | G581: LORD | J581: PARKER | W581: NORTHCOTE | X581: 9 | Y581: 4 | Z581: 0 | AA581: 1066 | AB581: 841 | AC581: 126.7538644470868 | AD581: 36
W582: WILLIAMSTOWN | X582: 5 | Y582: 7 | Z582: 1 | AA582: 719 | AB582: 951 | AC582: 75.60462670872765 | AD582: 22
A583: PORT MELBOURNE | C583: 2 | D583: 2 | E583: =C583*6+D583 -> 14 | G583: 7 | H583: 11 | I583: =G583*6+H583 -> 53 | K583: 7 | L583: 12 | M583: =K583*6+L583 -> 54 | O583: 13 | P583: 17 | Q583: =O583*6+P583 -> 95 | S583: CAMBERWELL | W583: CAMBERWELL | X583: 3 | Y583: 10 | Z583: 0 | AA583: 937 | AB583: 1114 | AC583: 84.11 | AD583: 12
A584: CAMBERWELL | C584: 1 | D584: 3 | E584: =C584*6+D584 -> 9 | G584: 2 | H584: 4 | I584: =G584*6+H584 -> 16 | K584: 7 | L584: 6 | M584: =K584*6+L584 -> 48 | O584: 7 | P584: 6 | Q584: =O584*6+P584 -> 48 | S584: ALLEY | W584: BRUNSWICK | X584: 3 | Y584: 10 | Z584: 0 | AA584: 716 | AB584: 1006 | AC584: 71.172962226640152 | AD584: 12
A585: BEST PLAYERS | W585: PRAHRAN | X585: 2 | Y585: 10 | Z585: 1 | AA585: 808 | AB585: 1194 | AC585: 67.67 | AD585: 10
A586: PORT MELBOURNE | D586: FROUD | G586: SKILTON | J586: BARFOOT | M586: GARBUTT | O586: BOURKE | Q586: CROMPTON | W586: GEELONG ASSOC. | X586: 1 | Y586: 12 | Z586: 0 | AA586: 635 | AB586: 1134 | AC586: 55.996472663139329 | AD586: 4
A587: CAMBERWELL | D587: BOOTHMAN | G587: FULLING | J587: WHITECROSS | M587: LAWN | O587: CONNOP | Q587: KARTHAUS
A588: GOALKICKERS
A589: PORT MELBOURNE | D589: SKILTON 3 | F589: WILSON 2 | I589: KUHLKEN 2 | L589: CANNON 2 | N589: FROUD | P589: BOURKE | R589: WILSON | U589: HOWIE
A590: CAMBERWELL | D590: LAWN 5 | G590: PAGE | I590: CONNOP
A592: NORTHCOTE | C592: 5 | D592: 1 | E592: =C592*6+D592 -> 31 | G592: 7 | H592: 4 | I592: =G592*6+H592 -> 46 | K592: 10 | L592: 8 | M592: =K592*6+L592 -> 68 | O592: 14 | P592: 11 | Q592: =O592*6+P592 -> 95 | S592: NORTHCOTE
A593: BRUNSWICK | C593: 2 | D593: 1 | E593: =C593*6+D593 -> 13 | G593: 6 | H593: 1 | I593: =G593*6+H593 -> 37 | K593: 8 | L593: 2 | M593: =K593*6+L593 -> 50 | O593: 8 | P593: 4 | Q593: =O593*6+P593 -> 52 | S593: MURRAY
A594: BEST PLAYERS
A595: NORTHCOTE | D595: LONG | G595: AHERN | J595: PERKINS | M595: LAFFY | O595: BEESON | R595: DOUG NICHOLLS
A596: BRUNSWICK | D596: KENNETT | G596: EDWARDS | J596: NEWMAN | M596: HART | O596: HARRIS | R596: REID
A597: GOALKICKERS
A598: NORTHCOTE | D598: BEESON 7 | F598: ROGAN 2 | H598: DOUG NICHOLLS 2 | L598: ADAMS | N598: BOYLE | P598: JUDKINS
A599: BRUNSWICK | D599: O'ROURKE 2 | G599: WRIGHT 2 | I599: CAREY | K599: WARREN | M599: TELFER | O599: HART
A601: PRESTON | C601: 0 | D601: 1 | E601: =C601*6+D601 -> 1 | G601: 3 | H601: 9 | I601: =G601*6+H601 -> 27 | K601: 8 | L601: 12 | M601: =K601*6+L601 -> 60 | O601: 14 | P601: 19 | Q601: =O601*6+P601 -> 103 | S601: WEST OVAL
A602: GEELONG ASSOC. | C602: 7 | D602: 7 | E602: =C602*6+D602 -> 49 | G602: 7 | H602: 10 | I602: =G602*6+H602 -> 52 | K602: 9 | L602: 12 | M602: =K602*6+L602 -> 66 | O602: 9 | P602: 15 | Q602: =O602*6+P602 -> 69 | S602: CLARKE
A603: BEST PLAYERS
A604: PRESTON | D604: MILLER | G604: WARR | I604: DOBRIGH | L604: LUDLOW | O604: CONNAUGHTON | R604: SUMMERS
A605: GEELONG ASSOC. | D605: NOONAN | G605: FARRELLY | I605: CATIONS | L605: COLEMAN | O605: ROACH | R605: BUSHELL
A606: GOALKICKERS
A607: PRESTON | D607: MILLER 5 | F607: WARR 2 | H607: ANDERSON 2 | K607: DOBRIGH | M607: McMEEKIN | O607: GRAY | Q607: LUDLOW | S607: ELLIS
A608: GEELONG ASSOC. | D608: NOONAN 5 | G608: DEAN 2 | I608: FARRELLY | L608: HARRIS
A610: COBURG | C610: 0 | D610: 2 | E610: =C610*6+D610 -> 2 | G610: 10 | H610: 9 | I610: =G610*6+H610 -> 69 | K610: 12 | L610: 13 | M610: =K610*6+L610 -> 85 | O610: 17 | P610: 16 | Q610: =O610*6+P610 -> 118 | S610: COBURG
A611: PRAHRAN | C611: 5 | D611: 3 | E611: =C611*6+D611 -> 33 | G611: 6 | H611: 4 | I611: =G611*6+H611 -> 40 | K611: 8 | L611: 6 | M611: =K611*6+L611 -> 54 | O611: 9 | P611: 6 | Q611: =O611*6+P611 -> 60 | S611: McKINNON
A612: BEST PLAYERS
A613: COBURG | D613: MEARS | G613: GARDINER | J613: KERLEY | M613: CHARLESTON | P613: CHAPMAN | S613: SEXTON
A614: PRAHRAN | D614: ISBELL | G614: HARLEY | J614: CHATFIELD | M614: SHORT | P614: B SMITH | S614: F SMITH
A615: GOALKICKERS
A616: COBURG | D616: GARDINER 8 | G616: KERLEY 2 | I616: PLANT 2 | K616: MEARS 2 | M616: CHAPMAN | O616: HUNTINGTON | R616: HARRIS
A617: PRAHRAN | D617: HARLEY 6 | G617: ISBELL | I617: BOWTELL | L617: ALESSIO
A619: ROUND 14 | E619: 30TH JULY | J619: WEATHER | M619: STRONG N.E. BREEZE | S619: PLAYED AT | X619: LADDER | AB619: ROUND | AD619: 14
D620: 1ST QTR | H620: 2ND QTR | L620: 3RD QTR | P620: FINAL | S620: WILLIAMSTOWN
A621: WILLIAMSTOWN | C621: 3 | D621: 5 | E621: =C621*6+D621 -> 23 | G621: 4 | H621: 8 | I621: =G621*6+H621 -> 32 | K621: 6 | L621: 14 | M621: =K621*6+L621 -> 50 | O621: 7 | P621: 14 | Q621: =O621*6+P621 -> 56 | S621: UMPIRE | W621: TEAM | X621: W | Y621: L | Z621: D | AA621: FOR | AB621: AGST | AC621: % | AD621: PTS
A622: NORTHCOTE | C622: 0 | D622: 1 | E622: =C622*6+D622 -> 1 | G622: 1 | H622: 4 | I622: =G622*6+H622 -> 10 | K622: 2 | L622: 4 | M622: =K622*6+L622 -> 16 | O622: 4 | P622: 6 | Q622: =O622*6+P622 -> 30 | S622: LESTER
A623: BEST PLAYERS | W623: COBURG | X623: 14 | Y623: 0 | Z623: 0 | AA623: 1541 | AB623: 816 | AC623: 188.84803921568627 | AD623: 56
A624: WILLIAMSTOWN | D624: SYKES | F624: WARREN | H624: LORD | J624: WATERMAN | M624: MATHER | Q624: BEER | W624: PRESTON | X624: 11 | Y624: 3 | Z624: 0 | AA624: 1238 | AB624: 946 | AC624: 130.86680761099365 | AD624: 44
A625: NORTHCOTE | D625: ADAMS | F625: LAFFY | H625: PERKINS | J625: WOODS | M625: DARRA NICHOLLS | Q625: BEESON | W625: PORT MELBOURNE | X625: 10 | Y625: 4 | Z625: 0 | AA625: 1093 | AB625: 753 | AC625: 145.1527224435591 | AD625: 40
A626: GOALKICKERS | W626: BRIGHTON | X626: 10 | Y626: 4 | Z626: 0 | AA626: 1113 | AB626: 871 | AC626: 127.78415614236509 | AD626: 40
A627: WILLIAMSTOWN | D627: PARKER 4 | G627: BEER | J627: MATHER | M627: LORD
A628: NORTHCOTE | D628: BEESON 4 | W628: NORTHCOTE | X628: 9 | Y628: 5 | Z628: 0 | AA628: 1096 | AB628: 897 | AC628: 122.1850613154961 | AD628: 36
W629: WILLIAMSTOWN | X629: 6 | Y629: 7 | Z629: 1 | AA629: 775 | AB629: 981 | AC629: 79.001019367991844 | AD629: 26
A630: PRESTON | C630: 0 | D630: 2 | E630: =C630*6+D630 -> 2 | G630: 10 | H630: 6 | I630: =G630*6+H630 -> 66 | K630: 12 | L630: 11 | M630: =K630*6+L630 -> 83 | O630: 21 | P630: 22 | Q630: =O630*6+P630 -> 148 | S630: PRESTON | W630: CAMBERWELL | X630: 3 | Y630: 11 | Z630: 0 | AA630: 993 | AB630: 1262 | AC630: 78.68 | AD630: 12
A631: CAMBERWELL | C631: 3 | D631: 4 | E631: =C631*6+D631 -> 22 | G631: 4 | H631: 4 | I631: =G631*6+H631 -> 28 | K631: 8 | L631: 8 | M631: =K631*6+L631 -> 56 | O631: 8 | P631: 8 | Q631: =O631*6+P631 -> 56 | S631: ALLEY | W631: BRUNSWICK | X631: 3 | Y631: 11 | Z631: 0 | AA631: 745 | AB631: 1077 | AC631: 69.173630454967508 | AD631: 12
A632: BEST PLAYERS | W632: PRAHRAN | X632: 2 | Y632: 11 | Z632: 1 | AA632: 880 | AB632: 1292 | AC632: 68.11 | AD632: 10
A633: PRESTON | D633: DOBRIGH | F633: LUDLOW | I633: WARR | L633: WHITE | N633: SURTEES | Q633: HUME | W633: GEELONG ASSOC. | X633: 1 | Y633: 13 | Z633: 0 | AA633: 685 | AB633: 1264 | AC633: 54.193037974683541 | AD633: 4
A634: CAMBERWELL | D634: PAGE | F634: WOODFORD | I634: KARTHAUS | L634: LAWN | N634: STEVENS | Q634: GREENBURY
A635: GOALKICKERS
A636: PRESTON | D636: HUME 6 | F636: DOBRIGH 3 | I636: ANDERSON 3 | L636: LUDLOW 2 | N636: SURTEES 2 | Q636: McMEEKIN 2 | T636: WARR | V636: WHITE | X636: SUMMERS
A637: CAMBERWELL | D637: WOODFORD 2 | G637: LAWN 2 | I637: CONNOP | K637: PAGE | M637: GREENBURY | P637: ELLIOTT
A639: PORT MELBOURNE | C639: 1 | D639: 2 | E639: =C639*6+D639 -> 8 | G639: 6 | H639: 8 | I639: =G639*6+H639 -> 44 | K639: 7 | L639: 16 | M639: =K639*6+L639 -> 58 | O639: 8 | P639: 23 | Q639: =O639*6+P639 -> 71 | S639: PORT MELBOURNE
A640: BRUNSWICK | C640: 2 | D640: 3 | E640: =C640*6+D640 -> 15 | G640: 2 | H640: 4 | I640: =G640*6+H640 -> 16 | K640: 4 | L640: 4 | M640: =K640*6+L640 -> 28 | O640: 4 | P640: 5 | Q640: =O640*6+P640 -> 29 | S640: MURRAY
A641: BEST PLAYERS
A642: PORT MELBOURNE | D642: HARVEY | G642: WILKINS | J642: FROUD | M642: CARPENTER | P642: BOLMAN | S642: BARFOOT
A643: BRUNSWICK | D643: REID | G643: WARDEN | J643: TELFER | M643: PROUDFOOT | P643: KENNETT | S643: EUDEY
A644: GOALKICKERS
A645: PORT MELBOURNE | D645: BARFFOT | F645: WILKINS | H645: HARVEY | J645: BOURKE | L645: KUHLKEN | N645: CARPENTER | Q645: SKILTON | T645: WILSON
A646: BRUNSWICK | D646: WARDEN 3 | G646: TELFER
A648: BRIGHTON | C648: 0 | D648: 3 | E648: =C648*6+D648 -> 3 | G648: 6 | H648: 6 | I648: =G648*6+H648 -> 42 | K648: 9 | L648: 8 | M648: =K648*6+L648 -> 62 | O648: 14 | P648: 14 | Q648: =O648*6+P648 -> 98 | S648: TOORAK PARK
A649: PRAHRAN | C649: 3 | D649: 0 | E649: =C649*6+D649 -> 18 | G649: 6 | H649: 1 | I649: =G649*6+H649 -> 37 | K649: 11 | L649: 6 | M649: =K649*6+L649 -> 72 | O649: 11 | P649: 6 | Q649: =O649*6+P649 -> 72 | S649: McKINNON
A650: BEST PLAYERS
A651: BRIGHTON | D651: RATTRAY | G651: WALSH | J651: DE ARAUGO | M651: ALDRIDGE | P651: HUNT | S651: GARCIA
A652: PRAHRAN | D652: J SMITH | G652: SCOTT | J652: RUSSELL | M652: B SMITH | P652: PROCTOR | S652: McPHERSON
A653: GOALKICKERS
A654: BRIGHTON | D654: WALSH 7 | F654: RATTRAY 2 | I654: DE ARAUGO 2 | L654: ALDRIDGE | N654: YEMM | P654: WRIGHT
A655: PRAHRAN | D655: HARLEY 5 | G655: SCOTT 3 | I655: RICHARDS | L655: McGRATH | O655: J SMITH
A657: COBURG | C657: 5 | D657: 9 | E657: =C657*6+D657 -> 39 | G657: 10 | H657: 10 | I657: =G657*6+H657 -> 70 | K657: 16 | L657: 15 | M657: =K657*6+L657 -> 111 | O657: 19 | P657: 16 | Q657: =O657*6+P657 -> 130 | S657: COBURG
A658: GEELONG ASSOC. | C658: 1 | D658: 1 | E658: =C658*6+D658 -> 7 | G658: 3 | H658: 4 | I658: =G658*6+H658 -> 22 | K658: 3 | L658: 4 | M658: =K658*6+L658 -> 22 | O658: 7 | P658: 8 | Q658: =O658*6+P658 -> 50 | S658: BLACKMAN
A659: BEST PLAYERS
A660: COBURG | D660: E MARTIN | G660: BROOKS | J660: MEARS | M660: GARDINER | P660: PLANT | S660: HUNTINGTON
A661: GEELONG ASSOC. | D661: JONES | G661: FARR | J661: TAYLOR | M661: McMANUS | P661: COLEMAN | S661: McPHERSON
A662: GOALKICKERS
A663: COBURG | D663: GARDINER 7 | G663: PLANT 4 | I663: KERLEY 3 | K663: CHARLESTON | N663: HEAVEY | P663: McALPINE | R663: E MARTIN | U663: HUNTINGTON
A664: GEELONG ASSOC. | D664: TAYLOR 2 | G664: WHITE | I664: NOONAN | K664: HARRIS | M664: CATIONS | O664: McPHERSON
A666: ROUND 15 | E666: 6TH AUGUST | J666: WEATHER | M666: LIGHT SOUTH BREEZE | S666: PLAYED AT | X666: LADDER | AB666: ROUND | AD666: 15
D667: 1ST QTR | H667: 2ND QTR | L667: 3RD QTR | P667: FINAL | S667: PRESTON
A668: COBURG | C668: 4 | D668: 2 | E668: =C668*6+D668 -> 26 | G668: 10 | H668: 2 | I668: =G668*6+H668 -> 62 | K668: 13 | L668: 6 | M668: =K668*6+L668 -> 84 | O668: 22 | P668: 7 | Q668: =O668*6+P668 -> 139 | S668: UMPIRE | W668: TEAM | X668: W | Y668: L | Z668: D | AA668: FOR | AB668: AGST | AC668: % | AD668: PTS
A669: PRESTON | C669: 1 | D669: 7 | E669: =C669*6+D669 -> 13 | G669: 5 | H669: 13 | I669: =G669*6+H669 -> 43 | K669: 11 | L669: 18 | M669: =K669*6+L669 -> 84 | O669: 13 | P669: 21 | Q669: =O669*6+P669 -> 99 | S669: ALLEY
A670: BEST PLAYERS | W670: COBURG | X670: 15 | Y670: 0 | Z670: 0 | AA670: 1680 | AB670: 915 | AC670: 183.60655737704917 | AD670: 60
A671: COBURG | D671: HARRIS | F671: KERLEY | I671: HUNTINGTON | L671: MEARS | N671: GARDINER | Q671: PLANT | W671: PORT MELBOURNE | X671: 11 | Y671: 4 | Z671: 0 | AA671: 1151 | AB671: 802 | AC671: 143.51620947630923 | AD671: 44
A672: PRESTON | D672: LUDLOW | F672: SHERMAN | I672: SUMMERS | L672: WHITE | N672: WATT | Q672: ANDERSON | W672: BRIGHTON | X672: 11 | Y672: 4 | Z672: 0 | AA672: 1189 | AB672: 918 | AC672: 129.520697167756 | AD672: 44
A673: GOALKICKERS | W673: PRESTON | X673: 11 | Y673: 4 | Z673: 0 | AA673: 1337 | AB673: 1085 | AC673: 123.2258064516129 | AD673: 44
A674: COBURG | D674: PLANT 7 | F674: GARDINER 5 | I674: HUNTINGTON 4 | L674: KERLEY 3 | N674: FORBES | P674: MEARS | R674: JENKINS
A675: PRESTON | D675: HUME 4 | F675: ANDERSON 3 | I675: SUMMERS 2 | L675: MILLER 2 | N675: McMEEKIN 2 | W675: NORTHCOTE | X675: 9 | Y675: 6 | Z675: 0 | AA675: 1143 | AB675: 973 | AC675: 117.47173689619733 | AD675: 36
W676: WILLIAMSTOWN | X676: 6 | Y676: 8 | Z676: 1 | AA676: 824 | AB676: 1039 | AC676: 79.307025986525503 | AD676: 26
A677: BRIGHTON | C677: 3 | D677: 5 | E677: =C677*6+D677 -> 23 | G677: 5 | H677: 8 | I677: =G677*6+H677 -> 38 | K677: 8 | L677: 14 | M677: =K677*6+L677 -> 62 | O677: 10 | P677: 16 | Q677: =O677*6+P677 -> 76 | S677: BRIGHTON BEACH | W677: CAMBERWELL | X677: 4 | Y677: 11 | Z677: 0 | AA677: 1089 | AB677: 1330 | AC677: 81.88 | AD677: 16
A678: NORTHCOTE | C678: 0 | D678: 5 | E678: =C678*6+D678 -> 5 | G678: 3 | H678: 6 | I678: =G678*6+H678 -> 24 | K678: 6 | L678: 7 | M678: =K678*6+L678 -> 43 | O678: 6 | P678: 11 | Q678: =O678*6+P678 -> 47 | S678: McKINNON | W678: BRUNSWICK | X678: 4 | Y678: 11 | Z678: 0 | AA678: 839 | AB678: 1151 | AC678: 72.893136403127713 | AD678: 16
A679: BEST PLAYERS | W679: PRAHRAN | X679: 2 | Y679: 12 | Z679: 1 | AA679: 954 | AB679: 1386 | AC679: 68.83 | AD679: 10
A680: BRIGHTON | D680: RATTRAY | F680: MAY | I680: DAINTY | K680: DE ARAUGO | N680: RINGROSE | Q680: BESWICK | W680: GEELONG ASSOC. | X680: 1 | Y680: 14 | Z680: 0 | AA680: 753 | AB680: 1360 | AC680: 55.367647058823529 | AD680: 4
A681: NORTHCOTE | D681: PERKINS | F681: THEOBOLD | I681: JUDKINS | K681: ADAMS | N681: LONG | Q681: DARRA NICHOLLS
A682: GOALKICKERS
A683: BRIGHTON | D683: ALDRIDGE 3 | G683: DE ARAUGO 2 | J683: RINGROSE 2 | M683: WRIGHT | O683: BESWICK | Q683: MAY
A684: NORTHCOTE | D684: SMITH 2 | G684: ANTHONY | J684: BOYLE | L684: WOODS | N684: ROGAN
A686: PORT MELBOURNE | C686: 1 | D686: 1 | E686: =C686*6+D686 -> 7 | G686: 3 | H686: 6 | I686: =G686*6+H686 -> 24 | K686: 3 | L686: 6 | M686: =K686*6+L686 -> 24 | O686: 8 | P686: 10 | Q686: =O686*6+P686 -> 58 | S686: WILLIAMSTOWN
A687: WILLIAMSTOWN | C687: 1 | D687: 3 | E687: =C687*6+D687 -> 9 | G687: 5 | H687: 3 | I687: =G687*6+H687 -> 33 | K687: 7 | L687: 7 | M687: =K687*6+L687 -> 49 | O687: 7 | P687: 7 | Q687: =O687*6+P687 -> 49 | S687: MURRAY
A688: BEST PLAYERS
A689: PORT MELBOURNE | D689: CARPENTER | G689: HARVEY | J689: W RUDD | M689: BOURKE | P689: GARBUTT | S689: FORBES
A690: WILLIAMSTOWN | D690: QUINN | G690: WARREN | J690: BEER | M690: LORD | P690: WATERMAN | S690: MEEHAN
A691: GOALKICKERS
A692: PORT MELBOURNE | D692: CARPENTER 3 | G692: HARVEY | I692: FORBES | K692: KUHLKEN | M692: WILKINS | O692: WILSON
A693: WILLIAMSTOWN | D693: BEER 2 | G693: LORD 2 | I693: QUINN | K693: MURPHY | M693: DREW
A695: BRUNSWICK | C695: 3 | D695: 2 | E695: =C695*6+D695 -> 20 | G695: 8 | H695: 5 | I695: =G695*6+H695 -> 53 | K695: 12 | L695: 8 | M695: =K695*6+L695 -> 80 | O695: 14 | P695: 10 | Q695: =O695*6+P695 -> 94 | S695: BRUNSWICK
A696: PRAHRAN | C696: 2 | D696: 1 | E696: =C696*6+D696 -> 13 | G696: 3 | H696: 5 | I696: =G696*6+H696 -> 23 | K696: 5 | L696: 11 | M696: =K696*6+L696 -> 41 | O696: 10 | P696: 14 | Q696: =O696*6+P696 -> 74 | S696: LESTER
A697: BEST PLAYERS
A698: BRUNSWICK | D698: KENNETT | G698: REID | J698: WARDEN | M698: WHITELEY | P698: O'ROURKE
A699: PRAHRAN | D699: McGRATH | G699: PROCTOR | J699: DIPROSE | M699: J SMITH | P699: HARLEY | S699: McPHERSON
A700: GOALKICKERS
A701: BRUNSWICK | D701: O'ROURKE 8 | G701: KENNEDY 2 | J701: WHITELEY | M701: CAREY | O701: ALLISON | Q701: EDWARDS
A702: PRAHRAN | D702: HARLEY 8 | G702: J SMITH | J702: WILSON
A704: CAMBERWELL | C704: 5 | D704: 3 | E704: =C704*6+D704 -> 33 | G704: 9 | H704: 8 | I704: =G704*6+H704 -> 62 | K704: 12 | L704: 13 | M704: =K704*6+L704 -> 85 | O704: 13 | P704: 18 | Q704: =O704*6+P704 -> 96 | S704: CAMBERWELL
A705: GEELONG ASSOC. | C705: 3 | D705: 1 | E705: =C705*6+D705 -> 19 | G705: 3 | H705: 2 | I705: =G705*6+H705 -> 20 | K705: 5 | L705: 4 | M705: =K705*6+L705 -> 34 | O705: 10 | P705: 8 | Q705: =O705*6+P705 -> 68 | S705: BLACKBURN
A706: BEST PLAYERS
A707: CAMBERWELL | D707: LAWN | G707: ELLIMAN | J707: WOODFORD | M707: PAGE | P707: PRICE | S707: BOOTHMAN
A708: GEELONG ASSOC. | D708: TAYLOR | G708: McPHERSON | J708: ROACH | M708: DEAN | P708: BUSHELL | S708: MELLAHN
A709: GOALKICKERS
A710: CAMBERWELL | D710: WOODFORD 4 | G710: LAWN 4 | I710: WARD 2 | K710: PAGE | M710: KARTHAUS | P710: CONNOP
A711: GEELONG ASSOC. | D711: McPHERSON 4 | G711: TAYLOR 2 | I711: DEAN 2 | K711: MELLAHN | M711: FARR
A713: ROUND 16 | E713: 13TH AUGUST | J713: WEATHER | M713: FINE WEST BREEZE | S713: PLAYED AT | X713: LADDER | AB713: ROUND | AD713: 16
D714: 1ST QTR | H714: 2ND QTR | L714: 3RD QTR | P714: FINAL | S714: COBURG
A715: COBURG | C715: 3 | D715: 4 | E715: =C715*6+D715 -> 22 | G715: 6 | H715: 10 | I715: =G715*6+H715 -> 46 | K715: 8 | L715: 13 | M715: =K715*6+L715 -> 61 | O715: 12 | P715: 19 | Q715: =O715*6+P715 -> 91 | S715: UMPIRE | W715: TEAM | X715: W | Y715: L | Z715: D | AA715: FOR | AB715: AGST | AC715: % | AD715: PTS
A716: PORT MELBOURNE | C716: 3 | D716: 4 | E716: =C716*6+D716 -> 22 | G716: 5 | H716: 4 | I716: =G716*6+H716 -> 34 | K716: 7 | L716: 7 | M716: =K716*6+L716 -> 49 | O716: 8 | P716: 7 | Q716: =O716*6+P716 -> 55 | S716: ALLEY
A717: BEST PLAYERS | W717: COBURG | X717: 16 | Y717: 0 | Z717: 0 | AA717: 1771 | AB717: 970 | AC717: 182.57731958762886 | AD717: 64
A718: COBURG | D718: CHARLESTON | G718: MEARS | I718: E MARTIN | L718: JENKINS | O718: KERLEY | Q718: CHAPMAN | W718: BRIGHTON | X718: 12 | Y718: 4 | Z718: 0 | AA718: 1297 | AB718: 962 | AC718: 134.82328482328484 | AD718: 48
A719: PORT MELBOURNE | D719: BOLMAN | G719: HARVEY | I719: FROUD | L719: ROSEMAN | O719: SKILTON | Q719: CROMPTON | W719: PRESTON | X719: 12 | Y719: 4 | Z719: 0 | AA719: 1443 | AB719: 1139 | AC719: 126.6900790166813 | AD719: 48
A720: GOALKICKERS | W720: PORT MELBOURNE | X720: 11 | Y720: 5 | Z720: 0 | AA720: 1206 | AB720: 893 | AC720: 135.05039193729004 | AD720: 44
A721: COBURG | D721: PLANT 4 | F721: GARDINER 4 | I721: MEARS | K721: McALPINE | M721: KERLEY | O721: SEXTON
A722: PORT MELBOURNE | D722: WILSON 3 | F722: WILKINS | H722: JOHNSTONE | K722: SKILTON | M722: GARBUTT | O722: FORBES | W722: NORTHCOTE | X722: 10 | Y722: 6 | Z722: 0 | AA722: 1247 | AB722: 1040 | AC722: 119.90384615384616 | AD722: 40
W723: WILLIAMSTOWN | X723: 6 | Y723: 9 | Z723: 1 | AA723: 878 | AB723: 1145 | AC723: 76.681222707423586 | AD723: 26
A724: PRESTON | C724: 2 | D724: 3 | E724: =C724*6+D724 -> 15 | G724: 5 | H724: 6 | I724: =G724*6+H724 -> 36 | K724: 7 | L724: 8 | M724: =K724*6+L724 -> 50 | O724: 15 | P724: 16 | Q724: =O724*6+P724 -> 106 | S724: PRESTON | W724: CAMBERWELL | X724: 5 | Y724: 11 | Z724: 0 | AA724: 1161 | AB724: 1385 | AC724: 83.83 | AD724: 20
A725: WILLIAMSTOWN | C725: 3 | D725: 1 | E725: =C725*6+D725 -> 19 | G725: 5 | H725: 6 | I725: =G725*6+H725 -> 36 | K725: 6 | L725: 12 | M725: =K725*6+L725 -> 48 | O725: 7 | P725: 12 | Q725: =O725*6+P725 -> 54 | S725: MURRAY | W725: BRUNSWICK | X725: 4 | Y725: 12 | Z725: 0 | AA725: 894 | AB725: 1223 | AC725: 73.098937040065408 | AD725: 16
A726: BEST PLAYERS | W726: PRAHRAN | X726: 2 | Y726: 13 | Z726: 1 | AA726: 1021 | AB726: 1490 | AC726: 68.52 | AD726: 10
A727: PRESTON | D727: WATT | G727: McMEEKIN | J727: ANDERSON | M727: SHAW | O727: SURTEES | Q727: SUMMERS | W727: GEELONG ASSOC. | X727: 1 | Y727: 15 | Z727: 0 | AA727: 797 | AB727: 1468 | AC727: 54.291553133514988 | AD727: 4
A728: WILLIAMSTOWN | D728: WHITBURN | G728: CLAUSCEN | J728: McKAY | M728: SYKES | O728: MURPHY | Q728: BEER
A729: GOALKICKERS
A730: PRESTON | D730: HUME 4 | F730: ANDERSON 4 | I730: MILLER 2 | K730: McMEEKIN 2 | N730: WARR | P730: LUDLOW | R730: SURTEES
A731: WILLIAMSTOWN | D731: MURPHY 2 | G731: PARKER 2 | J731: BEER | L731: MATHER | N731: DREW
A733: CAMBERWELL | C733: 3 | D733: 1 | E733: =C733*6+D733 -> 19 | G733: 5 | H733: 4 | I733: =G733*6+H733 -> 34 | K733: 11 | L733: 5 | M733: =K733*6+L733 -> 71 | O733: 11 | P733: 6 | Q733: =O733*6+P733 -> 72 | S733: BRUNSWICK
A734: BRUNSWICK | C734: 2 | D734: 6 | E734: =C734*6+D734 -> 18 | G734: 5 | H734: 9 | I734: =G734*6+H734 -> 39 | K734: 5 | L734: 11 | M734: =K734*6+L734 -> 41 | O734: 7 | P734: 13 | Q734: =O734*6+P734 -> 55 | S734: McKINNON
A735: BEST PLAYERS
A736: CAMBERWELL | D736: WARD | G736: LE STRANGE | K736: HORNE | N736: ELLIMAN | Q736: LAWN | S736: CONNOP
A737: BRUNSWICK | D737: REID | G737: HARRIS | K737: McMAHON | N737: O'ROURKE | Q737: WARDEN | S737: KENNEDY
A738: GOALKICKERS
A739: CAMBERWELL | D739: WARD 4 | G739: WOODFORD 2 | J739: PAGE 2 | L739: CONNOP | N739: ELLIMAN | P739: LAWN
A740: BRUNSWICK | D740: O'ROURKE 5 | G740: WARREN | J740: EWINS
A742: NORTHCOTE | C742: 3 | D742: 0 | E742: =C742*6+D742 -> 18 | G742: 8 | H742: 4 | I742: =G742*6+H742 -> 52 | K742: 11 | L742: 4 | M742: =K742*6+L742 -> 70 | O742: 16 | P742: 8 | Q742: =O742*6+P742 -> 104 | S742: TOORAK PARK
A743: PRAHRAN | C743: 2 | D743: 4 | E743: =C743*6+D743 -> 16 | G743: 5 | H743: 5 | I743: =G743*6+H743 -> 35 | K743: 9 | L743: 9 | M743: =K743*6+L743 -> 63 | O743: 9 | P743: 13 | Q743: =O743*6+P743 -> 67
A744: BEST PLAYERS
A745: NORTHCOTE | D745: ADAMS | G745: SMITH | I745: ANTHONY | L745: GALL | N745: DESLANDES | Q745: DOUG NICHOLLS
A746: PRAHRAN | D746: B SMITH | G746: J SMITH | I746: McPHERSON | L746: RUSSELL | N746: McGRATH | Q746: SHORT
A747: GOALKICKERS
A748: NORTHCOTE | D748: DESLANDES 5 | G748: ANTHONY 4 | J748: DOUG NICHOLLS 2 | N748: ADAMS | P748: AHERN | R748: BOYLE | T748: LEAKE | V748: GALL
A749: PRAHRAN | D749: HARLEY 3 | G749: SHORT 3 | J749: PROCTOR | L749: HORTON | N749: McGRATH
A751: BRIGHTON | C751: 3 | D751: 9 | E751: =C751*6+D751 -> 27 | G751: 7 | H751: 10 | I751: =G751*6+H751 -> 52 | K751: 11 | L751: 15 | M751: =K751*6+L751 -> 81 | O751: 15 | P751: 18 | Q751: =O751*6+P751 -> 108 | S751: BRIGHTON BEACH
A752: GEELONG ASSOC. | C752: 1 | D752: 0 | E752: =C752*6+D752 -> 6 | G752: 3 | H752: 3 | I752: =G752*6+H752 -> 21 | K752: 4 | L752: 5 | M752: =K752*6+L752 -> 29 | O752: 6 | P752: 8 | Q752: =O752*6+P752 -> 44 | S752: SCHAEFER
A753: BEST PLAYERS
A754: BRIGHTON | D754: CARROLL | G754: BESWICK | I754: ALDRIDGE | L754: WALSH | N754: RINGROSE | Q754: MAY
A755: GEELONG ASSOC. | D755: HARRIS | G755: ROACH | I755: DIGBY | L755: JONES | N755: TAYLOR | Q755: NOONAN
A756: GOALKICKERS
A757: BRIGHTON | D757: WALSH 10 | G757: ALDRIDGE 2 | J757: BOYD | L757: WRIGHT | N757: MAY
A758: GEELONG ASSOC. | D758: NOONAN | G758: LEIGHTON | J758: CATIONS | M758: MELLAHN | O758: HARRIS | Q758: CAREY
A760: ROUND 17 | E760: 20TH AUGUST | H760: WEATHER | K760: COLD CLOUDY SHOWERS S.W. WIND | S760: PLAYED AT | X760: LADDER | AB760: ROUND | AD760: 17
D761: 1ST QTR | H761: 2ND QTR | L761: 3RD QTR | P761: FINAL | S761: NORTHCOTE
A762: COBURG | C762: 7 | D762: 7 | E762: =C762*6+D762 -> 49 | G762: 9 | H762: 11 | I762: =G762*6+H762 -> 65 | K762: 14 | L762: 14 | M762: =K762*6+L762 -> 98 | O762: 19 | P762: 15 | Q762: =O762*6+P762 -> 129 | S762: UMPIRE | W762: TEAM | X762: W | Y762: L | Z762: D | AA762: FOR | AB762: AGST | AC762: % | AD762: PTS
A763: NORTHCOTE | C763: 0 | D763: 2 | E763: =C763*6+D763 -> 2 | G763: 1 | H763: 3 | I763: =G763*6+H763 -> 9 | K763: 4 | L763: 4 | M763: =K763*6+L763 -> 28 | O763: 6 | P763: 9 | Q763: =O763*6+P763 -> 45 | S763: LESTER
A764: BEST PLAYERS | W764: COBURG | X764: 17 | Y764: 0 | Z764: 0 | AA764: 1900 | AB764: 1015 | AC764: 187.192118226601 | AD764: 68
A765: COBURG | D765: C MARTYN | G765: FORD | I765: KERLEY | L765: SEXTON | O765: JENKINS | Q765: CHARLESTON | W765: BRIGHTON | X765: 13 | Y765: 4 | Z765: 0 | AA765: 1362 | AB765: 1025 | AC765: 132.8780487804878 | AD765: 52
A766: NORTHCOTE | D766: JUDKINS | G766: LAFFY | I766: H SMITH | L766: CAREY | O766: ADAMS | Q766: BOYLE | W766: PORT MELBOURNE | X766: 12 | Y766: 5 | Z766: 0 | AA766: 1303 | AB766: 964 | AC766: 135.16597510373444 | AD766: 48
A767: GOALKICKERS | W767: PRESTON | X767: 12 | Y767: 5 | Z767: 0 | AA767: 1514 | AB767: 1236 | AC767: 122.49190938511327 | AD767: 48
A768: COBURG | D768: GARDINER 8 | G768: KERLEY 3 | I768: PLANT 3 | K768: HARRIS 2 | M768: HUNTINGTON 2 | P768: JENKINS
A769: NORTHCOTE | D769: ADAMS | F769: DESLANDES | I769: DOLLOFFSKY | L769: GALL | N769: BOYLE | P769: DOUG NICHOLLS | W769: NORTHCOTE | X769: 10 | Y769: 7 | Z769: 0 | AA769: 1292 | AB769: 1169 | AC769: 110.52181351582549 | AD769: 40
W770: WILLIAMSTOWN | X770: 7 | Y770: 9 | Z770: 1 | AA770: 963 | AB770: 1209 | AC770: 79.652605459057071 | AD770: 30
A771: PORT MELBOURNE | C771: 2 | D771: 1 | E771: =C771*6+D771 -> 13 | G771: 7 | H771: 4 | I771: =G771*6+H771 -> 46 | K771: 10 | L771: 4 | M771: =K771*6+L771 -> 64 | O771: 15 | P771: 7 | Q771: =O771*6+P771 -> 97 | S771: PORT MELBOURNE | W771: CAMBERWELL | X771: 5 | Y771: 12 | Z771: 0 | AA771: 1224 | AB771: 1450 | AC771: 84.41 | AD771: 20
A772: PRESTON | C772: 1 | D772: 4 | E772: =C772*6+D772 -> 10 | G772: 1 | H772: 7 | I772: =G772*6+H772 -> 13 | K772: 7 | L772: 10 | M772: =K772*6+L772 -> 52 | O772: 10 | P772: 11 | Q772: =O772*6+P772 -> 71 | S772: BLACKBURN | W772: BRUNSWICK | X772: 5 | Y772: 12 | Z772: 0 | AA772: 958 | AB772: 1280 | AC772: 74.84375 | AD772: 20
A773: BEST PLAYERS | W773: PRAHRAN | X773: 2 | Y773: 14 | Z773: 1 | AA773: 1085 | AB773: 1575 | AC773: 68.89 | AD773: 10
A774: PORT MELBOURNE | D774: BOLMAN | G774: W RUDD | I774: CARPENTER | L774: FORBES | N774: GARBUTT | Q774: HARVEY | W774: GEELONG ASSOC. | X774: 1 | Y774: 16 | Z774: 0 | AA774: 854 | AB774: 1532 | AC774: 55.744125326370757 | AD774: 4
A775: PRESTON | D775: WHITE | G775: WARR | I775: LUDLOW | L775: WATT | N775: HUME | Q775: SUMMERS
A776: GOALKICKERS
A777: PORT MELBOURNE | D777: TAYLOR 8 | G777: GARBUTT 2 | J777: BOURKE 2 | M777: WILKINS | O777: SKILTON | Q777: FARNAN
A778: PRESTON | D778: LUDLOW 4 | G778: SKIPPER 2 | J778: HUME 2 | M778: SURTEES | O778: SUMMERS
A780: BRIGHTON | C780: 2 | D780: 1 | E780: =C780*6+D780 -> 13 | G780: 6 | H780: 3 | I780: =G780*6+H780 -> 39 | K780: 9 | L780: 4 | M780: =K780*6+L780 -> 58 | O780: 10 | P780: 5 | Q780: =O780*6+P780 -> 65 | S780: CAMBERWELL
A781: CAMBERWELL | C781: 2 | D781: 3 | E781: =C781*6+D781 -> 15 | G781: 5 | H781: 9 | I781: =G781*6+H781 -> 39 | K781: 7 | L781: 11 | M781: =K781*6+L781 -> 53 | O781: 8 | P781: 15 | Q781: =O781*6+P781 -> 63 | S781: SCHAEFER
A782: BEST PLAYERS
A783: BRIGHTON | D783: DAINTY | G783: MAY | J783: RINGROSE | M783: CARROLL | P783: RATTRAY | S783: ALDRIDGE
A784: CAMBERWELL | D784: LAWN | G784: BOOTHMAN | J784: KARTHAUS | M784: LE STRANGE | P784: PAGE | S784: CONNOP
A785: GOALKICKERS
A786: BRIGHTON | D786: WALSH 3 | G786: BESWICK 2 | J786: WRIGHT 2 | M786: MAY | O786: ALDRIDGE | R786: RINGROSE
A787: CAMBERWELL | D787: ELLIMAN 2 | G787: LAWN 2 | J787: PAGE 2 | M787: ELLIOTT | P787: ALBERRY
A789: BRUNSWICK | C789: 1 | D789: 8 | E789: =C789*6+D789 -> 14 | G789: 5 | H789: 8 | I789: =G789*6+H789 -> 38 | K789: 6 | L789: 10 | M789: =K789*6+L789 -> 46 | O789: 9 | P789: 10 | Q789: =O789*6+P789 -> 64 | S789: WEST OVAL
A790: GEELONG ASSOC. | C790: 1 | D790: 1 | E790: =C790*6+D790 -> 7 | G790: 4 | H790: 5 | I790: =G790*6+H790 -> 29 | K790: 7 | L790: 9 | M790: =K790*6+L790 -> 51 | O790: 8 | P790: 9 | Q790: =O790*6+P790 -> 57 | S790: ALLEY
A791: BEST PLAYERS
A792: BRUNSWICK | D792: BRIGHT | G792: KENNEDY | J792: O'ROURKE | M792: McMAHON | P792: HARRIS | S792: DOUGLAS
A793: GEELONG ASSOC. | D793: McMANUS | G793: JONES | J793: TAYLOR | M793: ROACH | P793: BUSHELL | S793: HARRIS
A794: GOALKICKERS
A795: BRUNSWICK | D795: O'ROURKE 5 | G795: DOUGLAS 3 | J795: TELFER
A796: GEELONG ASSOC. | D796: CATIONS 3 | G796: MELLAHN 2 | J796: HARRIS 2 | M796: FARR
A798: WILLIAMSTOWN | C798: 2 | D798: 1 | E798: =C798*6+D798 -> 13 | G798: 6 | H798: 8 | I798: =G798*6+H798 -> 44 | K798: 8 | L798: 9 | M798: =K798*6+L798 -> 57 | O798: 12 | P798: 13 | Q798: =O798*6+P798 -> 85 | S798: WILLIAMSTOWN
A799: PRAHRAN | C799: 5 | D799: 4 | E799: =C799*6+D799 -> 34 | G799: 6 | H799: 5 | I799: =G799*6+H799 -> 41 | K799: 9 | L799: 8 | M799: =K799*6+L799 -> 62 | O799: 9 | P799: 10 | Q799: =O799*6+P799 -> 64 | S799: McKINNON
A800: BEST PLAYERS
A801: WILLIAMSTOWN | D801: MURPHY | G801: McKAY | J801: SYKES | M801: WARREN | P801: CLAUSCEN | S801: LORD
A802: PRAHRAN | D802: RUSSELL | G802: HARLEY | J802: F SMITH | M802: J SMITH | P802: B SMITH | S802: CHATFIELD
A803: GOALKICKERS
A804: WILLIAMSTOWN | D804: PARKER 5 | G804: BEER 2 | I804: MATHER | K804: SYKES | M804: JOHNS | O804: WATERMAN | R804: LORD
A805: PRAHRAN | D805: HARLEY 5 | G805: RUSSELL 2 | J805: CROSSEN | L805: J SMITH
A807: ROUND 18 | E807: 27TH AUGUST | H807: WEATHER | K807: COLD RAIN NORTH WIND GROUNDS SLIPPERY | S807: PLAYED AT | X807: LADDER | AB807: ROUND | AD807: 18
D808: 1ST QTR | H808: 2ND QTR | L808: 3RD QTR | P808: FINAL | S808: BRIGHTON BEACH
A809: BRIGHTON | C809: 3 | D809: 0 | E809: =C809*6+D809 -> 18 | G809: 7 | H809: 2 | I809: =G809*6+H809 -> 44 | K809: 12 | L809: 7 | M809: =K809*6+L809 -> 79 | O809: 14 | P809: 8 | Q809: =O809*6+P809 -> 92 | S809: UMPIRE | W809: TEAM | X809: W | Y809: L | Z809: D | AA809: FOR | AB809: AGST | AC809: % | AD809: PTS
A810: PRESTON | C810: 3 | D810: 1 | E810: =C810*6+D810 -> 19 | G810: 7 | H810: 2 | I810: =G810*6+H810 -> 44 | K810: 8 | L810: 4 | M810: =K810*6+L810 -> 52 | O810: 11 | P810: 8 | Q810: =O810*6+P810 -> 74 | S810: LESTER
A811: BEST PLAYERS | W811: COBURG | X811: 18 | Y811: 0 | Z811: 0 | AA811: 2004 | AB811: 1051 | AC811: 190.67554709800191 | AD811: 72
A812: BRIGHTON | D812: RATTRAY | G812: ARTHUR | I812: BORLAND | L812: HERON | O812: DORE | Q812: WALSH | W812: BRIGHTON | X812: 14 | Y812: 4 | Z812: 0 | AA812: 1454 | AB812: 1099 | AC812: 132.30209281164696 | AD812: 56
A813: PRESTON | D813: SURTEES | G813: WATT | I813: SKIPPER | L813: WHITE | O813: SHAW | Q813: LUDLOW | W813: PORT MELBOURNE | X813: 13 | Y813: 5 | Z813: 0 | AA813: 1394 | AB813: 1012 | AC813: 137.74703557312253 | AD813: 52
A814: GOALKICKERS | Q814: MAY | W814: PRESTON | X814: 12 | Y814: 6 | Z814: 0 | AA814: 1588 | AB814: 1328 | AC814: 119.57831325301204 | AD814: 48
A815: BRIGHTON | D815: WALSH 4 | F815: BESWICK 3 | I815: WRIGHT 2 | K815: ALDRIDGE | M815: RATTRAY | O815: DE ARAUGO | R815: STEWART
A816: PRESTON | D816: SURTEES 5 | G816: LUDLOW 2 | J816: HUME 2 | M816: WARR 2 | W816: NORTHCOTE | X816: 11 | Y816: 7 | Z816: 0 | AA816: 1376 | AB816: 1206 | AC816: 114.09618573797678 | AD816: 44
W817: WILLIAMSTOWN | X817: 7 | Y817: 10 | Z817: 1 | AA817: 1013 | AB817: 1288 | AC817: 78.649068322981364 | AD817: 30
A818: BRUNSWICK | C818: 0 | D818: 5 | E818: =C818*6+D818 -> 5 | G818: 6 | H818: 9 | I818: =G818*6+H818 -> 45 | K818: 10 | L818: 13 | M818: =K818*6+L818 -> 73 | O818: 11 | P818: 13 | Q818: =O818*6+P818 -> 79 | S818: BRUNSWICK | W818: BRUNSWICK | X818: 6 | Y818: 12 | Z818: 0 | AA818: 1037 | AB818: 1330 | AC818: 77.969924812030072 | AD818: 24
A819: WILLIAMSTOWN | C819: 4 | D819: 1 | E819: =C819*6+D819 -> 25 | G819: 4 | H819: 3 | I819: =G819*6+H819 -> 27 | K819: 1 | L819: 4 | M819: =K819*6+L819 -> 10 | O819: 7 | P819: 8 | Q819: =O819*6+P819 -> 50 | S819: ALLEY | W819: CAMBERWELL | X819: 5 | Y819: 13 | Z819: 0 | AA819: 1260 | AB819: 1554 | AC819: 81.08 | AD819: 20
A820: BEST PLAYERS | W820: PRAHRAN | X820: 2 | Y820: 15 | Z820: 1 | AA820: 1133 | AB820: 1666 | AC820: 68.01 | AD820: 10
A821: BRUNSWICK | D821: WHITELEY | G821: REID | I821: BRIGHT | L821: EDWARDS | O821: ALLISON | Q821: O'ROURKE | W821: GEELONG ASSOC. | X821: 1 | Y821: 17 | Z821: 0 | AA821: 891 | AB821: 1616 | AC821: 55.136138613861384 | AD821: 4
A822: WILLIAMSTOWN | D822: DREW | G822: MEEHAN | I822: CLAUSCEN | L822: SYKES | O822: LORD | Q822: BEER
A823: GOALKICKERS
A824: BRUNSWICK | D824: O'ROURKE 3 | G824: WHITELEY 3 | J824: EUDEY | L824: WARDEN | N824: ALLISON | P824: EWINS | R824: REID
A825: WILLIAMSTOWN | D825: STOCK | F825: BEER | H825: MURPHY | J825: LORD | L825: JOHNS | N825: WHITBURN | Q825: MATHER
A827: COBURG | C827: 5 | D827: 2 | E827: =C827*6+D827 -> 32 | G827: 7 | H827: 6 | I827: =G827*6+H827 -> 48 | K827: 12 | L827: 11 | M827: =K827*6+L827 -> 83 | O827: 15 | P827: 14 | Q827: =O827*6+P827 -> 104 | S827: COBURG
A828: CAMBERWELL | C828: 3 | D828: 4 | E828: =C828*6+D828 -> 22 | G828: 3 | H828: 9 | I828: =G828*6+H828 -> 27 | K828: 3 | L828: 9 | M828: =K828*6+L828 -> 27 | O828: 4 | P828: 12 | Q828: =O828*6+P828 -> 36 | S828: MAKER
A829: BEST PLAYERS
A830: COBURG | D830: BROOKS | F830: E MARTIN | I830: CHARLESTON | M830: JENKINS | P830: KERLEY | S830: HARTIGAN
A831: CAMBERWELL | D831: HORNE | F831: TRESIZE | I831: LE STRANGE | M831: KARTHAUS | P831: J HARRISON | S831: BOOTHMAN
A832: GOALKICKERS
A833: COBURG | D833: PLANT 6 | G833: GARDINER 5 | J833: KERLEY | L833: CHARLESTON | O833: JENKINS | Q833: FORBES
A834: CAMBERWELL | D834: CONNOP 2 | G834: WOOD | I834: ELLIOTT
A836: NORTHCOTE | C836: 2 | D836: 3 | E836: =C836*6+D836 -> 15 | G836: 4 | H836: 9 | I836: =G836*6+H836 -> 33 | K836: 6 | L836: 14 | M836: =K836*6+L836 -> 50 | O836: 11 | P836: 18 | Q836: =O836*6+P836 -> 84 | S836: WEST OVAL
A837: GEELONG ASSOC. | C837: 2 | D837: 1 | E837: =C837*6+D837 -> 13 | G837: 4 | H837: 6 | I837: =G837*6+H837 -> 30 | K837: 4 | L837: 9 | M837: =K837*6+L837 -> 33 | O837: 4 | P837: 13 | Q837: =O837*6+P837 -> 37 | S837: MURRAY
A838: BEST PLAYERS
A839: NORTHCOTE | D839: ANTHONY | G839: DESLANDES | J839: SMITH | M839: DOUG NICHOLLS | Q839: DARRA NICHOLLS | U839: ADAMS
A840: GEELONG ASSOC. | D840: ROACH | G840: COLEMAN | J840: WRIGHT | M840: LEIGHTON | Q840: MELLAHN | U840: McFARLANE
A841: GOALKICKERS
A842: NORTHCOTE | D842: WOOD 4 | G842: ANTHONY | J842: DOUG NICHOLLS | N842: DESLANDES | Q842: ADAMS | S842: BOYLE | U842: LAFFY | W842: GALL
A843: GEELONG ASSOC. | D843: MELLAHN 2 | G843: McFARLANE | J843: TAYLOR
A845: PORT MELBOURNE | C845: 4 | D845: 3 | E845: =C845*6+D845 -> 27 | G845: 8 | H845: 6 | I845: =G845*6+H845 -> 54 | K845: 10 | L845: 10 | M845: =K845*6+L845 -> 70 | O845: 13 | P845: 13 | Q845: =O845*6+P845 -> 91 | S845: TOORAK PARK
A846: PRAHRAN | C846: 2 | D846: 3 | E846: =C846*6+D846 -> 15 | G846: 3 | H846: 4 | I846: =G846*6+H846 -> 22 | K846: 4 | L846: 5 | M846: =K846*6+L846 -> 29 | O846: 7 | P846: 6 | Q846: =O846*6+P846 -> 48 | S846: McKINNON
A847: BEST PLAYERS
A848: PORT MELBOURNE | D848: JOHNSTONE | G848: CARPENTER | J848: FARNAN | M848: GARBUTT | P848: BOLMAN | S848: HARVEY
A849: PRAHRAN | D849: VANCE | G849: E JONES | J849: BURTON | M849: McGRATH | P849: REYNOLDS | S849: J SMITH
A850: GOALKICKERS
A851: PORT MELBOURNE | D851: TAYLOR 5 | F851: UREN 2 | H851: MERRICK | J851: WILKINS | L851: GARBUTT | N851: BOURKE | P851: FARNAN | R851: SKILTON
A852: PRAHRAN | D852: J SMITH 3 | G852: CROSSEN 2 | J852: DIPROSE | L852: DARVELL
A854: FINALS
A855: 1ST SEMI | E855: 3RD SEPTEMBER | J855: WEATHER | M855: GALE FORCE NORTH WIND
D856: 1ST QTR | H856: 2ND QTR | L856: 3RD QTR | P856: FINAL
A857: BRIGHTON | C857: 5 | D857: 8 | E857: =C857*6+D857 -> 38 | G857: 5 | H857: 8 | I857: =G857*6+H857 -> 38 | K857: 7 | L857: 14 | M857: =K857*6+L857 -> 56 | O857: 8 | P857: 14 | Q857: =O857*6+P857 -> 62 | S857: MOTORDROME
A858: PRESTON | C858: 0 | D858: 0 | E858: =C858*6+D858 -> 0 | G858: 3 | H858: 11 | I858: =G858*6+H858 -> 29 | K858: 4 | L858: 11 | M858: =K858*6+L858 -> 35 | O858: 7 | P858: 20 | Q858: =O858*6+P858 -> 62 | S858: McKINNON
A859: BEST PLAYERS
A860: BRIGHTON | D860: DE ARAUGO | G860: ARTHUR | J860: ALDRIDGE | M860: HUNT | O860: RINGROSE | R860: DAINTY
A861: PRESTON | D861: WHITE | G861: WARR | J861: SURTEES | M861: TAYLOR | O861: WATT | R861: LUDLOW
A862: GOALKICKERS
A863: BRIGHTON | D863: BOYD 2 | G863: WALSH 2 | J863: DE ARAUGO 2 | N863: WRIGHT | P863: BESWICK
A864: PRESTON | D864: SURTEES 2 | G864: SUMMERS | J864: SHAW | L864: WARR | N864: SKIPPER | P864: ELLIS
A866: 1ST SEMI REPLAY | E866: 17TH SEPTEMBER | J866: WEATHER | M866: FINE
A867: BRIGHTON | C867: 3 | D867: 4 | E867: =C867*6+D867 -> 22 | G867: 8 | H867: 6 | I867: =G867*6+H867 -> 54 | K867: 11 | L867: 12 | M867: =K867*6+L867 -> 78 | O867: 12 | P867: 13 | Q867: =O867*6+P867 -> 85 | S867: MOTORDROME
A868: PRESTON | C868: 2 | D868: 4 | E868: =C868*6+D868 -> 16 | G868: 7 | H868: 12 | I868: =G868*6+H868 -> 54 | K868: 7 | L868: 12 | M868: =K868*6+L868 -> 54 | O868: 9 | P868: 17 | Q868: =O868*6+P868 -> 71 | S868: McKINNON
A869: BEST PLAYERS
A870: BRIGHTON | D870: DE ARAUGO | G870: RATTRAY | J870: RINGROSE | M870: HUNT | O870: DAINTY | R870: WALSH
A871: PRESTON | D871: SURTEES | G871: SKIPPER | J871: WARR | M871: SHAW | O871: MILLER | R871: WHITE
A872: GOALKICKERS
A873: BRIGHTON | D873: RINGROSE 3 | G873: HUNT 2 | I873: ALDRIDGE 2 | L873: DE ARAUGO 2 | O873: RATTRAY | Q873: WALSH | S873: MAY
A874: PRESTON | D874: HUME 4 | G874: SURTEES 3 | J874: WARR 2
A876: 2ND SEMI | E876: 10TH SEPTEMBER | J876: WEATHER | M876: CLOUDY BUT FINE SOUTH BREEZE
A877: PORT MELBOURNE | C877: 4 | D877: 3 | E877: =C877*6+D877 -> 27 | G877: 8 | H877: 7 | I877: =G877*6+H877 -> 55 | K877: 13 | L877: 10 | M877: =K877*6+L877 -> 88 | O877: 15 | P877: 10 | Q877: =O877*6+P877 -> 100 | S877: MOTORDROME
A878: COBURG | C878: 2 | D878: 5 | E878: =C878*6+D878 -> 17 | G878: 7 | H878: 8 | I878: =G878*6+H878 -> 50 | K878: 9 | L878: 9 | M878: =K878*6+L878 -> 63 | O878: 15 | P878: 10 | Q878: =O878*6+P878 -> 100 | S878: McKINNON
A879: BEST PLAYERS
A880: PORT MELBOURNE | D880: WILSON | G880: MERRICK | J880: TAYLOR | M880: CARPENTER | P880: SKILTON | S880: FROUD
A881: COBURG | D881: JENKINS | G881: HARRIS | J881: KERLEY | M881: C MARTYN | P881: PLANT | S881: CHAPMAN
A882: GOALKICKERS
A883: PORT MELBOURNE | D883: TAYLOR 4 | G883: MERRICK 4 | J883: WILSON 2 | M883: BOURKE 2 | P883: CANNON | R883: GARBUTT | U883: WILKINS
A884: COBURG | D884: PLANT 6 | G884: HARRIS 3 | J884: GARDINER 2 | M884: FORBES 2 | P884: MEARS 2
A886: 2ND SEMI REPLAY | E886: 24TH SEPTEMBER | J886: WEATHER | M886: COLD SOUTH WIND SHOWERS
A887: PORT MELBOURNE | C887: 6 | D887: 5 | E887: =C887*6+D887 -> 41 | G887: 7 | H887: 7 | I887: =G887*6+H887 -> 49 | K887: 12 | L887: 11 | M887: =K887*6+L887 -> 83 | O887: 14 | P887: 13 | Q887: =O887*6+P887 -> 97 | S887: MOTORDROME
A888: COBURG | C888: 2 | D888: 0 | E888: =C888*6+D888 -> 12 | G888: 4 | H888: 3 | I888: =G888*6+H888 -> 27 | K888: 4 | L888: 3 | M888: =K888*6+L888 -> 27 | O888: 7 | P888: 6 | Q888: =O888*6+P888 -> 48
A889: BEST PLAYERS
A890: PORT MELBOURNE | D890: CARPENTER | G890: HARVEY | J890: TAYLOR | M890: FROUD | P890: SKILTON | S890: BOURKE
A891: COBURG | D891: BROOKS | G891: E MARTIN | J891: CHAPMAN | M891: HARRIS | P891: JENKINS | S891: FORD
A892: GOALKICKERS
A893: PORT MELBOURNE | D893: TAYLOR 3 | F893: WILKINS 2 | I893: JOHNSTONE 2 | L893: FORBES 2 | N893: WILKINS | P893: SKILTON | R893: MERRICK | U893: BOURKE | W893: FROUD
A894: COBURG | D894: PLANT 2 | G894: GARDINER 2 | J894: E MARTIN | M894: JENKINS | P894: HARRIS
A896: FINAL | E896: POSTPONED 1ST OCTOBER | J896: DUE TO RAIN
E897: 8TH OCTOBER | J897: WEATHER | M897: FINE WARM
A898: BRIGHTON | C898: 3 | D898: 2 | E898: =C898*6+D898 -> 20 | G898: 7 | H898: 6 | I898: =G898*6+H898 -> 48 | K898: 8 | L898: 10 | M898: =K898*6+L898 -> 58 | O898: 11 | P898: 14 | Q898: =O898*6+P898 -> 80 | S898: MOTORDROME
A899: PORT MELBOURNE | C899: 4 | D899: 3 | E899: =C899*6+D899 -> 27 | G899: 5 | H899: 7 | I899: =G899*6+H899 -> 37 | K899: 8 | L899: 12 | M899: =K899*6+L899 -> 60 | O899: 9 | P899: 15 | Q899: =O899*6+P899 -> 69
A900: BEST PLAYERS
A901: BRIGHTON | D901: HUNT | G901: DE ARAUGO | J901: RATTRAY | M901: CARROLL | P901: WALSH | S901: DAINTY
A902: PORT MELBOURNE | D902: BOURKE | G902: SKILTON | J902: BOLMAN | M902: FROUD | P902: MERRICK | S902: W RUDD
A903: GOALKICKERS
A904: BRIGHTON | D904: WALSH 5 | G904: RATTRAY 3 | J904: DE ARAUGO 2 | M904: WRIGHT
A905: PORT MELBOURNE | D905: MERRICK 3 | G905: BOURKE 3 | J905: TAYLOR 2 | M905: W RUDD
A907: GRAND FINAL | E907: 15TH OCTOBER | J907: WEATHER | M907: FINE WARM SOUTH WIND
A908: COBURG | C908: 5 | D908: 1 | E908: 31 | G908: 9 | H908: 3 | I908: 57 | K908: 13 | L908: 6 | M908: 84 | O908: 19 | P908: 10 | Q908: =O908*6+P908 -> 124 | S908: MOTORDROME
A909: BRIGHTON | C909: 1 | D909: 4 | E909: 10 | G909: 6 | H909: 6 | I909: 42 | K909: 10 | L909: 7 | M909: 67 | O909: 13 | P909: 12 | Q909: =O909*6+P909 -> 90
A910: BEST PLAYERS
A911: COBURG | D911: KERLEY | G911: GARDINER | J911: SEXTON | M911: C MARTYN | P911: CHARLESTON | S911: FORBES
A912: BRIGHTON | D912: MAY | G912: RINGROSE | J912: CARROLL | M912: ALDRIDGE | P912: IRWIN | S912: STEWART
A913: GOALKICKERS
A914: COBURG | D914: GARDINER 10 | G914: FORBES 2 | I914: HARRIS 2 | K914: KERLEY 2 | M914: HUNTINGTON | P914: CHARLESTON | S914: ROGERS
A915: BRIGHTON | D915: WALSH 7 | G915: DE ARAUGO 2 | J915: HUNT 2 | L915: ARTHUR | N915: MAY
A918: TEAMS
F919: COBURG | P919: BRIGHTON
A920: BACKS | C920: A MARTYN | F920: CHAPMAN | J920: WALSH | N920: GARCIA | Q920: DAINTY | T920: ANDERSON
A921: H-BACKS | C921: ROGERS | F921: CHARLESTON | J921: COX | N921: DORE | Q921: IRWIN | T921: STEWART
A922: CENTRES | C922: SEXTON | F922: C MARTYN | J922: E MARTIN | N922: CARROLL | Q922: ARTHUR | T922: BORLAND
A923: H-FORWARDS | C923: HUNTINGTON | F923: KERLEY | J923: FORBES | N923: ALDRIDGE | Q923: RATTRAY | T923: WRIGHT
A924: FORWARDS | C924: PLANT | F924: GARDINER | J924: McALPINE | N924: HUNT | Q924: WALSH | T924: BESWICK
A925: RUCKS | C925: JENKINS | F925: BROOKS | J925: HARRIS | N925: DE ARAUGO | Q925: MAY | T925: RINGROSE