A1: Victorian Football Association
A2: Season 1928
A3: © Copyright Wal Williams | F3: First created: 2 November 2014
A4: Contact: joywalwi at gmail dot com | F4: Last updated: 27 January 2018 | W4: VFA Results and tables - Link to the main index page
A5: You are free to copy this document in whole or part provided that proper acknowledgement is given to the author. All rights reserved.
A7: YEAR 1928
A8: ROUND 1 | E8: 21ST APRIL | J8: WEATHER | M8: FINE NORTH BREEZE | S8: PLAYED AT | X8: LADDER | AB8: ROUND | AD8: 1
D9: 1ST QTR | H9: 2ND QTR | L9: 3RD QTR | P9: FINAL | S9: WILLIAMSTOWN
A10: PORT MELBOURNE | C10: 2 | D10: 4 | E10: =C10*6+D10 -> 16 | G10: 2 | H10: 6 | I10: =G10*6+H10 -> 18 | K10: 3 | L10: 10 | M10: =K10*6+L10 -> 28 | O10: 6 | P10: 14 | Q10: =O10*6+P10 -> 50 | S10: UMPIRE | W10: TEAM | X10: W | Y10: L | Z10: D | AA10: FOR | AB10: AGST | AC10: % | AD10: PTS
A11: WILLIAMSTOWN | C11: 1 | D11: 0 | E11: =C11*6+D11 -> 6 | G11: 2 | H11: 2 | I11: =G11*6+H11 -> 14 | K11: 2 | L11: 3 | M11: =K11*6+L11 -> 15 | O11: 2 | P11: 3 | Q11: =O11*6+P11 -> 15 | S11: PRESTON
A12: BEST PLAYERS | W12: PORT MELBOURNE | X12: 1 | Y12: 0 | Z12: 0 | AA12: 50 | AB12: 15 | AC12: 333.33333333333331 | AD12: 4
A13: PORT MELBOURNE | D13: FARNAN | G13: KEYHOE | I13: BOURKE | L13: SKILTON | N13: MERRICK | Q13: BROOKER | W13: BRUNSWICK | X13: 1 | Y13: 0 | Z13: 0 | AA13: 104 | AB13: 57 | AC13: 182.45614035087721 | AD13: 4
A14: WILLIAMSTOWN | D14: WARREN | G14: BEER | I14: WATERMAN | L14: QUINN | N14: C DREW | Q14: STOCK | W14: COBURG | X14: 1 | Y14: 0 | Z14: 0 | AA14: 78 | AB14: 57 | AC14: 136.84210526315789 | AD14: 4
A15: GOALKICKERS | W15: BRIGHTON | X15: 1 | Y15: 0 | Z15: 0 | AA15: 99 | AB15: 73 | AC15: 135.61643835616439 | AD15: 4
A16: PORT MELBOURNE | D16: MERRICK 4 | G16: WILSON | J16: BOURKE
A17: WILLIAMSTOWN | D17: SAYNOR | G17: PARKER | W17: YARRAVILLE | X17: 1 | Y17: 0 | Z17: 0 | AA17: 78 | AB17: 63 | AC17: 123.80952380952381 | AD17: 4
W18: CAMBERWELL | X18: 0 | Y18: 1 | Z18: 0 | AA18: 63 | AB18: 78 | AC18: 80.769230769230774 | AD18: 0
A19: BRIGHTON | C19: 6 | D19: 4 | E19: =C19*6+D19 -> 40 | G19: 8 | H19: 7 | I19: =G19*6+H19 -> 55 | K19: 13 | L19: 8 | M19: =K19*6+L19 -> 86 | O19: 15 | P19: 9 | Q19: =O19*6+P19 -> 99 | S19: ELSTERNWICK PARK | W19: NORTHCOTE | X19: 0 | Y19: 1 | Z19: 0 | AA19: 73 | AB19: 99 | AC19: 73.737373737373744 | AD19: 0
A20: NORTHCOTE | C20: 2 | D20: 3 | E20: =C20*6+D20 -> 15 | G20: 8 | H20: 5 | I20: =G20*6+H20 -> 53 | K20: 8 | L20: 7 | M20: =K20*6+L20 -> 55 | O20: 10 | P20: 13 | Q20: =O20*6+P20 -> 73 | S20: McBEAN | W20: PRESTON | X20: 0 | Y20: 1 | Z20: 0 | AA20: 57 | AB20: 78 | AC20: 73.07692307692308 | AD20: 0
A21: BEST PLAYERS | W21: PRAHRAN | X21: 0 | Y21: 1 | Z21: 0 | AA21: 57 | AB21: 104 | AC21: 54.807692307692307 | AD21: 0
A22: BRIGHTON | D22: STEWART | G22: DAINTY | I22: HUNT | L22: NOONAN | O22: BURTON | R22: CARROLL | W22: WILLIAMSTOWN | X22: 0 | Y22: 1 | Z22: 0 | AA22: 15 | AB22: 50 | AC22: 30 | AD22: 0
A23: NORTHCOTE | D23: COLE | G23: LONG | I23: ALDRIDGE | L23: DESLANDES | O23: DOUG NICHOLLS | R23: HEENAN
A24: GOALKICKERS
A25: BRIGHTON | D25: WALSH 5 | F25: BURNES 3 | I25: HUNT 2 | K25: WRIGHT 2 | M25: HERRON 2 | O25: MURPHY
A26: NORTHCOTE | D26: COLE 3 | F26: ALDRIDGE 3 | I26: DESLANDES 3 | L26: MOORE
A28: PORT MELBOURNE | C28: 2 | D28: 3 | E28: =C28*6+D28 -> 15 | G28: 6 | H28: 7 | I28: =G28*6+H28 -> 43 | K28: 10 | L28: 8 | M28: =K28*6+L28 -> 68 | O28: 11 | P28: 12 | Q28: =O28*6+P28 -> 78 | S28: PRESTON
A29: PRESTON | C29: 2 | D29: 3 | E29: =C29*6+D29 -> 15 | G29: 2 | H29: 7 | I29: =G29*6+H29 -> 19 | K29: 4 | L29: 13 | M29: =K29*6+L29 -> 37 | O29: 7 | P29: 15 | Q29: =O29*6+P29 -> 57 | S29: BENTINCK
A30: BEST PLAYERS
A31: COBURG | D31: FORD | G31: CHAPMAN | J31: WALSH | M31: JENKINS | P31: SEXTON | S31: MEARS
A32: PRESTON | D32: SUMMERS | G32: TAYLOR | J32: WHITE | M32: MILLER | P32: JOHNSTON | S32: HOLLIDAY
A33: GOALKICKERS
A34: COBURG | D34: KERLEY 3 | G34: FORBES 3 | J34: GARDINER 2 | M34: F PLANT 2 | P34: HUNTINGTON
A35: PRESTON | D35: HUME 4 | G35: SUMMERS 2 | J35: ADAMS
A37: BRUNSWICK | C37: 4 | D37: 0 | E37: =C37*6+D37 -> 24 | G37: 7 | H37: 4 | I37: =G37*6+H37 -> 46 | K37: 13 | L37: 5 | M37: =K37*6+L37 -> 83 | O37: 16 | P37: 8 | Q37: =O37*6+P37 -> 104 | S37: BRUNSWICK
A38: PRAHRAN | C38: 0 | D38: 1 | E38: =C38*6+D38 -> 1 | G38: 2 | H38: 5 | I38: =G38*6+H38 -> 17 | K38: 6 | L38: 7 | M38: =K38*6+L38 -> 43 | O38: 8 | P38: 9 | Q38: =O38*6+P38 -> 57 | S38: McNIECE
A39: BEST PLAYERS
A40: BRUNSWICK | D40: McINERNEY | G40: HARRIS | J40: WRIGHT | M40: LINDSAY | P40: CARTON | S40: EDWARDS
A41: PRAHRAN | D41: PRYOR | G41: B SMITH | J41: OSBORNE | M41: DIPROSE | P41: HOPKINS | S41: BROWN
A42: GOALKICKERS
A43: BRUNSWICK | D43: McINERNEY 9 | G43: LINDSAY 4 | J43: CAMPBELL 2 | M43: PENMAN
A44: PRAHRAN | D44: B SMITH 4 | G44: HOPKINS 3 | J44: WYLES
A46: YARRAVILLE * | C46: 3 | D46: 1 | E46: =C46*6+D46 -> 19 | G46: 5 | H46: 5 | I46: =G46*6+H46 -> 35 | K46: 8 | L46: 8 | M46: =K46*6+L46 -> 56 | O46: 10 | P46: 11 | Q46: =O46*6+P46 -> 71 | S46: YARRAVILLE
A47: CAMBERWELL | C47: 2 | D47: 2 | E47: =C47*6+D47 -> 14 | G47: 5 | H47: 6 | I47: =G47*6+H47 -> 36 | K47: 8 | L47: 11 | M47: =K47*6+L47 -> 59 | O47: 8 | P47: 17 | Q47: =O47*6+P47 -> 65 | S47: FROOD
A48: BEST PLAYERS
A49: YARRAVILLE | D49: COULSELL | G49: GREENWOOD | K49: POOLE | N49: J BOLMAN | Q49: A LEONARD
A50: CAMBERWELL | D50: LAWN | G50: WOODFROD | K50: BOOTHMAN | N50: GUNNYON
A51: GOALKICKERS
A52: YARRAVILLE | D52: GREENWOOD 3 | G52: DOWLING 2 | J52: MALBERG 2 | M52: BOLMAN | O52: COULSELL | Q52: A LEONARD
A53: CAMBERWELL | D53: WOODFORD 4 | G53: LAWN 2 | J53: BOOTHMAN | M53: BRIDE
A54: * REPLAYED: | B54: 4TH JUNE | E54: AFTER | G54: PROTEST | J54: BY | K54: CAMBERWELL
A55: YARRAVILLE * | C55: 3 | D55: 2 | E55: =C55*6+D55 -> 20 | G55: 6 | H55: 4 | I55: =G55*6+H55 -> 40 | K55: 9 | L55: 10 | M55: =K55*6+L55 -> 64 | O55: 11 | P55: 12 | Q55: =O55*6+P55 -> 78 | S55: YARRAVILLE
A56: CAMBERWELL | C56: 1 | D56: 2 | E56: =C56*6+D56 -> 8 | G56: 2 | H56: 7 | I56: =G56*6+H56 -> 19 | K56: 5 | L56: 9 | M56: =K56*6+L56 -> 39 | O56: 8 | P56: 15 | Q56: =O56*6+P56 -> 63 | S56: BLACKBURN
A57: BEST PLAYERS
A58: YARRAVILLE | D58: LYONS | G58: LINTON | J58: WOODMAN | M58: FROUD | P58: PETZKE | S58: TRAVERS
A59: CAMBERWELL | D59: LAWN | G59: GREENWOOD | J59: WILLIAMS | M59: BOOTHMAN | P59: GUNNYON | S59: PRICE
A60: GOALKICKERS
A61: YARRAVILLE | D61: COULSELL 3 | G61: FROUD 2 | I61: LYONS | K61: KENNEDY | M61: A LEONARD | P61: MORTON | R61: GILL | T61: PETZKE
A62: CAMBERWELL | D62: GOUGH 3 | G62: LAWN 2 | I62: MILLS | K62: WOODFORD | N62: STEVENS
A64: ROUND 2 | E64: 28TH APRIL | J64: WEATHER | M64: CLOUDY BUT FINE SOUTH WIND | S64: PLAYED AT | X64: LADDER | AB64: ROUND | AD64: 2
D65: 1ST QTR | H65: 2ND QTR | L65: 3RD QTR | P65: FINAL | S65: PORT MELBOURNE
A66: PORT MELBOURNE | C66: 3 | D66: 4 | E66: =C66*6+D66 -> 22 | G66: 6 | H66: 4 | I66: =G66*6+H66 -> 40 | K66: 7 | L66: 5 | M66: =K66*6+L66 -> 47 | O66: 14 | P66: 12 | Q66: =O66*6+P66 -> 96 | S66: UMPIRE | W66: TEAM | X66: W | Y66: L | Z66: D | AA66: FOR | AB66: AGST | AC66: % | AD66: PTS
A67: BRUNSWICK | C67: 0 | D67: 1 | E67: =C67*6+D67 -> 1 | G67: 2 | H67: 1 | I67: =G67*6+H67 -> 13 | K67: 5 | L67: 3 | M67: =K67*6+L67 -> 33 | O67: 6 | P67: 5 | Q67: =O67*6+P67 -> 41 | S67: McKINNON
A68: BEST PLAYERS | W68: PORT MELBOURNE | X68: 2 | Y68: 0 | Z68: 0 | AA68: 146 | AB68: 56 | AC68: 260.71428571428572 | AD68: 8
A69: PORT MELBOURNE | D69: SKILTON | F69: GARBUTT | I69: BOURKE | L69: RUDD | N69: MERRICK | Q69: HOWIE | W69: COBURG | X69: 2 | Y69: 0 | Z69: 0 | AA69: 142 | AB69: 98 | AC69: 144.89795918367346 | AD69: 8
A70: BRUNSWICK | D70: CARTON | F70: ALLISON | I70: BARRIE | L70: WHITELEY | N70: HARRIS | Q70: McINERNEY | W70: BRIGHTON | X70: 2 | Y70: 0 | Z70: 0 | AA70: 181 | AB70: 137 | AC70: 132.11678832116789 | AD70: 8
A71: GOALKICKERS | W71: CAMBERWELL | X71: 1 | Y71: 1 | Z71: 0 | AA71: 115 | AB71: 112 | AC71: 102.67857142857143 | AD71: 4
A72: PORT MELBOURNE | D72: SKILTON 5 | G72: MERRICK 4 | J72: WILSON 2 | M72: BOURKE | O72: TUCK | Q72: GARBUTT
A73: BRUNSWICK | D73: McINERNEY 3 | H73: EDWARDS | K73: LINDSAY | N73: CAMPBELL | W73: BRUNSWICK | X73: 1 | Y73: 1 | Z73: 0 | AA73: 145 | AB73: 153 | AC73: 94.771241830065364 | AD73: 4
W74: YARRAVILLE | X74: 1 | Y74: 1 | Z74: 0 | AA74: 119 | AB74: 127 | AC74: 93.7007874015748 | AD74: 4
A75: COBURG | C75: 3 | D75: 10 | E75: =C75*6+D75 -> 28 | G75: 6 | H75: 10 | I75: =G75*6+H75 -> 46 | K75: 7 | L75: 15 | M75: =K75*6+L75 -> 57 | O75: 8 | P75: 16 | Q75: =O75*6+P75 -> 64 | S75: COBURG | W75: WILLIAMSTOWN | X75: 1 | Y75: 1 | Z75: 0 | AA75: 81 | AB75: 90 | AC75: 90 | AD75: 4
A76: YARRAVILLE | C76: 1 | D76: 2 | E76: =C76*6+D76 -> 8 | G76: 2 | H76: 7 | I76: =G76*6+H76 -> 19 | K76: 3 | L76: 8 | M76: =K76*6+L76 -> 26 | O76: 5 | P76: 11 | Q76: =O76*6+P76 -> 41 | S76: MURRAY | W76: PRESTON | X76: 0 | Y76: 2 | Z76: 0 | AA76: 91 | AB76: 130 | AC76: 70 | AD76: 0
A77: BEST PLAYERS | W77: NORTHCOTE | X77: 0 | Y77: 2 | Z77: 0 | AA77: 113 | AB77: 165 | AC77: 68.484848484848484 | AD77: 0
A78: COBURG | D78: FORD | F78: F PLANT | I78: MEARS | L78: KERLEY | N78: JENKINS | Q78: HARRIS | W78: PRAHRAN | X78: 0 | Y78: 2 | Z78: 0 | AA78: 121 | AB78: 186 | AC78: 65.053763440860209 | AD78: 0
A79: YARRAVILLE | D79: POOLE | F79: WHITE | I79: TRAVERS | L79: COULSELL | N79: BOLMAN | Q79: WOODMAN
A80: GOALKICKERS
A81: COBURG | D81: F PLANT 5 | G81: MEARS 2 | J81: HARRIS
A82: YARRAVILLE | D82: WALKER 3 | G82: GREENWOOD | J82: MORAN
A84: CAMBERWELL | C84: 2 | D84: 4 | E84: =C84*6+D84 -> 16 | G84: 4 | H84: 5 | I84: =G84*6+H84 -> 29 | K84: 5 | L84: 13 | M84: =K84*6+L84 -> 43 | O84: 6 | P84: 16 | Q84: =O84*6+P84 -> 52 | S84: CAMBERWELL
A85: PRESTON | C85: 1 | D85: 5 | E85: =C85*6+D85 -> 11 | G85: 3 | H85: 9 | I85: =G85*6+H85 -> 27 | K85: 3 | L85: 10 | M85: =K85*6+L85 -> 28 | O85: 4 | P85: 10 | Q85: =O85*6+P85 -> 34 | S85: BLANCHE
A86: BEST PLAYERS
A87: CAMBERWELL | D87: H CALWELL | G87: ROSEMAN | J87: LAWN | M87: GUNNYON | P87: BOOTHMAN | S87: PAGE
A88: PRESTON | D88: SUMMERS | G88: SHAW | J88: MILLER | M88: ADAMS | P88: BRIDGFORD | S88: HARRIS
A89: GOALKICKERS
A90: CAMBERWELL | D90: LAWN 3 | G90: BAZIN 2 | J90: WARD
A91: PRESTON | D91: SUMMERS 2 | G91: HUME | J91: STEVENS
A93: WILLIAMSTOWN | C93: 1 | D93: 9 | E93: =C93*6+D93 -> 15 | G93: 4 | H93: 15 | I93: =G93*6+H93 -> 39 | K93: 6 | L93: 17 | M93: =K93*6+L93 -> 53 | O93: 8 | P93: 18 | Q93: =O93*6+P93 -> 66 | S93: NORTHCOTE
A94: NORTHCOTE | C94: 2 | D94: 2 | E94: =C94*6+D94 -> 14 | G94: 4 | H94: 8 | I94: =G94*6+H94 -> 32 | K94: 5 | L94: 9 | M94: =K94*6+L94 -> 39 | O94: 5 | P94: 10 | Q94: =O94*6+P94 -> 40 | S94: LESTER
A95: BEST PLAYERS
A96: WILLIAMSTOWN | D96: BEER | G96: CLAUSCEN | J96: WARREN | M96: BOARDMAN | P96: McKAY | S96: QUINN
A97: NORTHCOTE | D97: LONG | G97: HEENAN | J97: FARR | M97: GARNETT | P97: DOUG NICHOLLS | S97: ALDRIDGE
A98: GOALKICKERS
A99: WILLIAMSTOWN | D99: BEER 4 | G99: MUNRO 2 | J99: SAYNOR | L99: BROMLEY
A100: NORTHCOTE | D100: COLE | G100: ALDRIDGE | J100: MOORE | L100: POULTER | O100: HEENAN
A102: BRIGHTON | C102: 1 | D102: 2 | E102: =C102*6+D102 -> 8 | G102: 7 | H102: 6 | I102: =G102*6+H102 -> 48 | K102: 8 | L102: 6 | M102: =K102*6+L102 -> 54 | O102: 12 | P102: 10 | Q102: =O102*6+P102 -> 82 | S102: TOORAK PARK
A103: PRAHRAN | C103: 1 | D103: 4 | E103: =C103*6+D103 -> 10 | G103: 5 | H103: 5 | I103: =G103*6+H103 -> 35 | K103: 7 | L103: 12 | M103: =K103*6+L103 -> 54 | O103: 8 | P103: 16 | Q103: =O103*6+P103 -> 64 | S103: HUNTINGTON
A104: BEST PLAYERS
A105: BRIGHTON | D105: DAINTY | G105: GARCIA | J105: STEWART | M105: BURNES | P105: ULBRICK | S105: HUNT
A106: PRAHRAN | D106: PAGE | G106: B SMITH | J106: F SMITH | M106: OSBORNE | P106: GLOVER | S106: CROSSEN
A107: GOALKICKERS
A108: BRIGHTON | D108: WALSH 4 | G108: NOONAN 4 | J108: MURPHY 2 | M108: HUNT | O108: COGHLAN
A109: PRAHRAN | D109: HOPKINS 2 | G109: CROSSEN 2 | J109: B SMITH | M109: BROWN | O109: HORTON | Q109: DARVALL
A111: ROUND 3 | E111: 5TH MAY | J111: WEATHER | M111: FINE STRONG NORTH WIND | S111: PLAYED AT
D112: 1ST QTR | H112: 2ND QTR | L112: 3RD QTR | P112: FINAL | S112: COBURG | X112: LADDER | AB112: ROUND | AD112: 3
A113: COBURG | C113: 3 | D113: 7 | E113: =C113*6+D113 -> 25 | G113: 4 | H113: 10 | I113: =G113*6+H113 -> 34 | K113: 8 | L113: 17 | M113: =K113*6+L113 -> 65 | O113: 12 | P113: 18 | Q113: =O113*6+P113 -> 90 | S113: UMPIRE
A114: PORT MELBOURNE | C114: 0 | D114: 0 | E114: =C114*6+D114 -> 0 | G114: 4 | H114: 5 | I114: =G114*6+H114 -> 29 | K114: 5 | L114: 5 | M114: =K114*6+L114 -> 35 | O114: 9 | P114: 8 | Q114: =O114*6+P114 -> 62 | S114: LESTER | W114: TEAM | X114: W | Y114: L | Z114: D | AA114: FOR | AB114: AGST | AC114: % | AD114: PTS
A115: BEST PLAYERS
A116: COBURG | D116: KERLEY | G116: SEXTON | I116: MEARS | K116: JENKINS | N116: ROGERS | Q116: HARRIS | W116: COBURG | X116: 3 | Y116: 0 | Z116: 0 | AA116: 232 | AB116: 160 | AC116: 145 | AD116: 12
A117: PORT MELBOURNE | D117: CARPENTER | G117: RUDD | I117: BOURKE | K117: SKILTON | N117: CROMPTON | Q117: ROWE | W117: PORT MELBOURNE | X117: 2 | Y117: 1 | Z117: 0 | AA117: 208 | AB117: 146 | AC117: 142.46575342465752 | AD117: 8
A118: GOALKICKERS | W118: BRIGHTON | X118: 2 | Y118: 1 | Z118: 0 | AA118: 240 | AB118: 208 | AC118: 115.38461538461539 | AD118: 8
A119: COBURG | D119: F PLANT 4 | F119: MEARS 3 | I119: KERLEY 2 | K119: HARRIS | M119: HUNTINGTON | P119: NORDEN | W119: CAMBERWELL | X119: 2 | Y119: 1 | Z119: 0 | AA119: 161 | AB119: 157 | AC119: 102.54777070063695 | AD119: 8
A120: PORT MELBOURNE | D120: WILSON 3 | G120: MERRICK 2 | J120: BOURKE 2 | M120: DAVIS | O120: FORBES
W121: YARRAVILLE | X121: 2 | Y121: 1 | Z121: 0 | AA121: 190 | AB121: 186 | AC121: 102.15053763440861 | AD121: 8
A122: CAMBERWELL | C122: 2 | D122: 3 | E122: =C122*6+D122 -> 15 | G122: 4 | H122: 5 | I122: =G122*6+H122 -> 29 | K122: 5 | L122: 10 | M122: =K122*6+L122 -> 40 | O122: 6 | P122: 10 | Q122: =O122*6+P122 -> 46 | S122: BRUNSWICK | W122: BRUNSWICK | X122: 1 | Y122: 2 | Z122: 0 | AA122: 190 | AB122: 199 | AC122: 95.477386934673362 | AD122: 4
A123: BRUNSWICK | C123: 2 | D123: 0 | E123: =C123*6+D123 -> 12 | G123: 3 | H123: 4 | I123: =G123*6+H123 -> 22 | K123: 4 | L123: 5 | M123: =K123*6+L123 -> 29 | O123: 6 | P123: 9 | Q123: =O123*6+P123 -> 45 | S123: MURRAY | W123: PRESTON | X123: 1 | Y123: 2 | Z123: 0 | AA123: 158 | AB123: 176 | AC123: 89.772727272727266 | AD123: 4
A124: BEST PLAYERS | W124: WILLIAMSTOWN | X124: 1 | Y124: 2 | Z124: 0 | AA124: 127 | AB124: 157 | AC124: 80.891719745222929 | AD124: 4
A125: CAMBERWELL | D125: HARRISON | F125: GREENWOOD | I125: KILLEN | L125: BOOTHMAN | O125: HORNE | Q125: PRICE | W125: NORTHCOTE | X125: 1 | Y125: 2 | Z125: 0 | AA125: 184 | AB125: 235 | AC125: 78.297872340425528 | AD125: 4
A126: BRUNSWICK | D126: HASSETT | F126: RAYMOND | I126: WHITELEY | L126: ALLISON | O126: EDWARDS | Q126: LINDSAY | W126: PRAHRAN | X126: 0 | Y126: 3 | Z126: 0 | AA126: 191 | AB126: 257 | AC126: 74.319066147859928 | AD126: 0
A127: GOALKICKERS
A128: CAMBERWELL | D128: LAWN 2 | G128: WOODFORD 2 | K128: BRIDE | N128: KARTHAUS
A129: BRUNSWICK | D129: McINERNEY 3 | H129: HASSETT 2 | K129: RAYMOND
A131: YARRAVILLE | C131: 1 | D131: 5 | E131: =C131*6+D131 -> 11 | G131: 5 | H131: 12 | I131: =G131*6+H131 -> 42 | K131: 6 | L131: 14 | M131: =K131*6+L131 -> 50 | O131: 9 | P131: 17 | Q131: =O131*6+P131 -> 71 | S131: YARRAVILLE
A132: BRIGHTON | C132: 4 | D132: 3 | E132: =C132*6+D132 -> 27 | G132: 5 | H132: 4 | I132: =G132*6+H132 -> 34 | K132: 7 | L132: 5 | M132: =K132*6+L132 -> 47 | O132: 9 | P132: 5 | Q132: =O132*6+P132 -> 59 | S132: MAKER
A133: BEST PLAYERS
A134: YARRAVILLE | D134: COULSELL | G134: BOLMAN | J134: LINTON | M134: POOLE | P134: KNOTT | S134: KENNEDY
A135: BRIGHTON | D135: DAINTY | G135: GARCIA | J135: STEWART | M135: HUNT | P135: NOONAN | S135: FITT
A136: GOALKICKERS
A137: YARRAVILLE | D137: KENNEDY 3 | G137: MALBERG 2 | J137: P BOLMAN | M137: GREENWOOD | P137: A LEONARD | S137: MOLONEY
A138: BRIGHTON | D138: NOONAN 3 | G138: HUNT 3 | J138: CARROLL | M138: WALSH | P138: YEMM
A140: PRESTON | C140: 3 | D140: 6 | E140: =C140*6+D140 -> 24 | G140: 3 | H140: 7 | I140: =G140*6+H140 -> 25 | K140: 7 | L140: 12 | M140: =K140*6+L140 -> 54 | O140: 9 | P140: 13 | Q140: =O140*6+P140 -> 67 | S140: WILLIAMSTOWN
A141: WILLIAMSTOWN | C141: 1 | D141: 2 | E141: =C141*6+D141 -> 8 | G141: 4 | H141: 7 | I141: =G141*6+H141 -> 31 | K141: 4 | L141: 7 | M141: =K141*6+L141 -> 31 | O141: 6 | P141: 10 | Q141: =O141*6+P141 -> 46 | S141: McKINNON
A142: BEST PLAYERS
A143: PRESTON | D143: ADAMS | G143: MILLER | J143: DOWNIE | M143: DODD | P143: JOHNSTONE | S143: DOWLING
A144: WILLIAMSTOWN | D144: BEER | G144: CLAUSCEN | J144: SHEEHAN | M144: TAAFE | P144: MATHER | S144: MUNN
A145: GOALKICKERS
A146: PRESTON | D146: DODD 2 | F146: DOWNIE 2 | I146: DOWLING 2 | L146: ADAMS | N146: HARRIS | Q146: SHAW
A147: WILLIAMSTOWN | D147: BEER 2 | F147: BROMLEY | I147: JOHNS | L147: SHEEHAN | N147: MATHER
A149: NORTHCOTE | C149: 1 | D149: 2 | E149: =C149*6+D149 -> 8 | G149: 6 | H149: 6 | I149: =G149*6+H149 -> 42 | K149: 7 | L149: 7 | M149: =K149*6+L149 -> 49 | O149: 10 | P149: 11 | Q149: =O149*6+P149 -> 71 | S149: TOORAK PARK
A150: PRAHRAN | C150: 2 | D150: 2 | E150: =C150*6+D150 -> 14 | G150: 5 | H150: 4 | I150: =G150*6+H150 -> 34 | K150: 9 | L150: 9 | M150: =K150*6+L150 -> 63 | O150: 10 | P150: 10 | Q150: =O150*6+P150 -> 70 | S150: BLACKBURN
A151: BEST PLAYERS
A152: NORTHCOTE | D152: POULTER | G152: JOBSON | J152: LEITCH | M152: BROWN | P152: ALDRIDGE | S152: COLE
A153: PRAHRAN | D153: J SMITH | G153: LORD | J153: TAYLOR | M153: PAGE | P153: DARVELL | S153: ISBEL
A154: GOALKICKERS
A155: NORTHCOTE | D155: COLE 3 | F155: CAREY 2 | H155: POULTER | J155: ALDRIDGE | M155: FARR | O155: LEITCH | Q155: JOBSON
A156: PRAHRAN | D156: J SMITH 5 | F156: LORD 3 | H156: DARVELL | J156: HORTON
A158: ROUND 4 | E158: 12TH MAY | H158: WEATHER | K158: STRONG S.W. WIND GROUNDS BAD | S158: PLAYED AT | X158: LADDER | AB158: ROUND | AD158: 4
D159: 1ST QTR | H159: 2ND QTR | L159: 3RD QTR | P159: FINAL | S159: CAMBERWELL
A160: CAMBERWELL | C160: 3 | D160: 3 | E160: =C160*6+D160 -> 21 | G160: 3 | H160: 7 | I160: =G160*6+H160 -> 25 | K160: 5 | L160: 7 | M160: =K160*6+L160 -> 37 | O160: 8 | P160: 11 | Q160: =O160*6+P160 -> 59 | S160: UMPIRE | W160: TEAM | X160: W | Y160: L | Z160: D | AA160: FOR | AB160: AGST | AC160: % | AD160: PTS
A161: PORT MELBOURNE | C161: 1 | D161: 0 | E161: =C161*6+D161 -> 6 | G161: 1 | H161: 3 | I161: =G161*6+H161 -> 9 | K161: 1 | L161: 3 | M161: =K161*6+L161 -> 9 | O161: 3 | P161: 7 | Q161: =O161*6+P161 -> 25 | S161: LESTER
A162: BEST PLAYERS | W162: COBURG | X162: 4 | Y162: 0 | Z162: 0 | AA162: 332 | AB162: 204 | AC162: 162.74509803921569 | AD162: 16
A163: CAMBERWELL | D163: LAWN | F163: BRIDE | I163: L WILLIAMS | L163: GUNNYON | N163: WOODFROD | Q163: LAKIN | W163: CAMBERWELL | X163: 3 | Y163: 1 | Z163: 0 | AA163: 220 | AB163: 182 | AC163: 120.87912087912088 | AD163: 12
A164: PORT MELBOURNE | D164: HARVEY | F164: CARPENTER | I164: SKILTON | L164: BROOKER | N164: WILSON | Q164: MERRICK | W164: BRIGHTON | X164: 3 | Y164: 1 | Z164: 0 | AA164: 308 | AB164: 263 | AC164: 117.11026615969581 | AD164: 12
A165: GOALKICKERS | W165: PORT MELBOURNE | X165: 2 | Y165: 2 | Z165: 0 | AA165: 233 | AB165: 205 | AC165: 113.65853658536585 | AD165: 8
A166: CAMBERWELL | D166: STEVENS 2 | G166: BRIDE 2 | I166: ROSEMAN | K166: WOODFORD | N166: LAKIN | P166: CONNOP
A167: PORT MELBOURNE | D167: MERRICK 3 | W167: PRESTON | X167: 2 | Y167: 2 | Z167: 0 | AA167: 228 | AB167: 207 | AC167: 110.14492753623189 | AD167: 8
W168: NORTHCOTE | X168: 2 | Y168: 2 | Z168: 0 | AA168: 245 | AB168: 272 | AC168: 90.07352941176471 | AD168: 8
A169: PRESTON | C169: 2 | D169: 1 | E169: =C169*6+D169 -> 13 | G169: 4 | H169: 4 | I169: =G169*6+H169 -> 28 | K169: 8 | L169: 6 | M169: =K169*6+L169 -> 54 | O169: 10 | P169: 10 | Q169: =O169*6+P169 -> 70 | S169: PRESTON | W169: YARRAVILLE | X169: 2 | Y169: 2 | Z169: 0 | AA169: 221 | AB169: 256 | AC169: 86.328125 | AD169: 8
A170: YARRAVILLE | C170: 0 | D170: 3 | E170: =C170*6+D170 -> 3 | G170: 3 | H170: 6 | I170: =G170*6+H170 -> 24 | K170: 4 | L170: 6 | M170: =K170*6+L170 -> 30 | O170: 4 | P170: 7 | Q170: =O170*6+P170 -> 31 | S170: MURRAY | W170: BRUNSWICK | X170: 1 | Y170: 3 | Z170: 0 | AA170: 227 | AB170: 260 | AC170: 87.307692307692307 | AD170: 4
A171: BEST PLAYERS | W171: WILLIAMSTOWN | X171: 1 | Y171: 3 | Z171: 0 | AA171: 182 | AB171: 225 | AC171: 80.888888888888886 | AD171: 4
A172: PRESTON | D172: SUMMERS | F172: GROGAN | I172: MONOHAN | L172: BRIDGFORD | O172: DODD | Q172: HARRIS | W172: PRAHRAN | X172: 0 | Y172: 4 | Z172: 0 | AA172: 235 | AB172: 357 | AC172: 65.826330532212879 | AD172: 0
A173: YARRAVILLE | D173: P BOLMAN | F173: J BOLMAN | I173: COULSELL | L173: POOLE | O173: LINTON | Q173: KENNEDY
A174: GOALKICKERS
A175: PRESTON | D175: HARRIS 5 | G175: DODD 2 | I175: ADAMS | K175: DOWNIE | M175: HAYES
A176: YARRAVILLE | D176: KENNEDY | G176: ROGERS | I176: KNOTT | K176: MARTIN
A178: BRIGHTON | C178: 1 | D178: 1 | E178: =C178*6+D178 -> 7 | G178: 5 | H178: 6 | I178: =G178*6+H178 -> 36 | K178: 9 | L178: 9 | M178: =K178*6+L178 -> 63 | O178: 9 | P178: 14 | Q178: =O178*6+P178 -> 68 | S178: ELSTERNWICK PARK
A179: WILLIAMSTOWN | C179: 1 | D179: 4 | E179: =C179*6+D179 -> 10 | G179: 5 | H179: 5 | I179: =G179*6+H179 -> 35 | K179: 7 | L179: 5 | M179: =K179*6+L179 -> 47 | O179: 8 | P179: 7 | Q179: =O179*6+P179 -> 55 | S179: McKINNON
A180: BEST PLAYERS
A181: BRIGHTON | D181: GARCIA | G181: YEMM | J181: STOREY | M181: FITT | P181: ULBRICK | S181: NOONAN
A182: WILLIAMSTOWN | D182: CLAUSCEN | G182: MUNRO | J182: SHEEHAN | M182: KENNY | P182: BEER | S182: GODWILL
A183: GOALKICKERS
A184: BRIGHTON | D184: WALSH 3 | F184: HUNT 2 | H184: WRIGHT | J184: YEMM | L184: BORLAND | N184: NOONAN
A185: WILLIAMSTOWN | D185: SHEEHAN 2 | G185: KENNY 2 | I185: MUNRO | K185: MATHER | M185: WHITBURN | P185: L DREW
A187: NORTHCOTE | C187: 0 | D187: 0 | E187: =C187*6+D187 -> 0 | G187: 3 | H187: 7 | I187: =G187*6+H187 -> 25 | K187: 5 | L187: 7 | M187: =K187*6+L187 -> 37 | O187: 8 | P187: 13 | Q187: =O187*6+P187 -> 61 | S187: NORTHCOTE
A188: BRUNSWICK | C188: 1 | D188: 9 | E188: =C188*6+D188 -> 15 | G188: 1 | H188: 9 | I188: =G188*6+H188 -> 15 | K188: 4 | L188: 13 | M188: =K188*6+L188 -> 37 | O188: 4 | P188: 13 | Q188: =O188*6+P188 -> 37 | S188: SCHAEFER
A189: BEST PLAYERS
A190: NORTHCOTE | D190: GARRETT | G190: COLE | I190: HEENAN | L190: LONG | O190: THEOBOLD | R190: PERKINS
A191: BRUNSWICK | D191: ALLISON | G191: BARRY | I191: WHITELEY | L191: RALEIGH | O191: GRANT | R191: RAYMOND
A192: GOALKICKERS
A193: NORTHCOTE | D193: PIKE 3 | F193: COLE 2 | H193: HEENAN 2 | K193: DESLANDES
A194: BRUNSWICK | D194: McINERNEY 3 | H194: RALEIGH
A196: COBURG | C196: 2 | D196: 2 | E196: =C196*6+D196 -> 14 | G196: 7 | H196: 7 | I196: =G196*6+H196 -> 49 | K196: 10 | L196: 12 | M196: =K196*6+L196 -> 72 | O196: 14 | P196: 16 | Q196: =O196*6+P196 -> 100 | S196: TOORAK PARK
A197: PRAHRAN | C197: 1 | D197: 5 | E197: =C197*6+D197 -> 11 | G197: 4 | H197: 8 | I197: =G197*6+H197 -> 32 | K197: 5 | L197: 11 | M197: =K197*6+L197 -> 41 | O197: 5 | P197: 14 | Q197: =O197*6+P197 -> 44 | S197: LYNCH
A198: BEST PLAYERS
A199: COBURG | D199: MEARS | G199: CHARLESTON | J199: F PLANT | M199: FORBES | O199: JENKINS | R199: KERLEY
A200: PRAHRAN | D200: PARKER | G200: JONES | J200: B SMITH | M200: J SMITH | O200: LORD | R200: GLOVER
A201: GOALKICKERS
A202: COBURG | D202: F PLANT 5 | G202: MEARS 4 | J202: FORBES 3 | M202: GARDINER | P202: VOIGHT
A203: PRAHRAN | D203: PARKER 3 | G203: McGRATH | J203: J SMITH
A205: ROUND 5 | E205: 19TH MAY | J205: WEATHER | M205: FINE SOUTH BREEZE | S205: PLAYED AT | X205: LADDER | AB205: ROUND | AD205: 5
D206: 1ST QTR | H206: 2ND QTR | L206: 3RD QTR | P206: FINAL | S206: E'WICK
A207: COBURG | C207: 3 | D207: 7 | E207: =C207*6+D207 -> 25 | G207: 6 | H207: 10 | I207: =G207*6+H207 -> 46 | K207: 10 | L207: 13 | M207: =K207*6+L207 -> 73 | O207: 11 | P207: 17 | Q207: =O207*6+P207 -> 83 | S207: UMPIRE | W207: TEAM | X207: W | Y207: L | Z207: D | AA207: FOR | AB207: AGST | AC207: % | AD207: PTS
A208: BRIGHTON | C208: 3 | D208: 1 | E208: =C208*6+D208 -> 19 | G208: 4 | H208: 4 | I208: =G208*6+H208 -> 28 | K208: 6 | L208: 7 | M208: =K208*6+L208 -> 43 | O208: 10 | P208: 13 | Q208: =O208*6+P208 -> 73 | S208: LESTER
A209: BEST PLAYERS
A210: COBURG | D210: CHAPMAN | G210: REYNOLDS | J210: GARDINER | M210: ROGERS | O210: VOIGHT | Q210: MEARS | W210: COBURG | X210: 5 | Y210: 0 | Z210: 0 | AA210: 415 | AB210: 277 | AC210: 149.81949458483754 | AD210: 20
A211: BRIGHTON | D211: CARROLL | G211: STEWART | J211: HUNT | M211: GARCIA | O211: FITT | Q211: STOREY | W211: PORT MELBOURNE | X211: 3 | Y211: 2 | Z211: 0 | AA211: 349 | AB211: 274 | AC211: 127.37226277372262 | AD211: 12
A212: GOALKICKERS | W212: CAMBERWELL | X212: 3 | Y212: 2 | Z212: 0 | AA212: 279 | AB212: 248 | AC212: 112.5 | AD212: 12
A213: COBURG | D213: FORBES 5 | G213: F PLANT 2 | J213: KERLEY | L213: HUNTINGTON | O213: COLBERT | Q213: DONNELLY | W213: BRIGHTON | X213: 3 | Y213: 2 | Z213: 0 | AA213: 381 | AB213: 346 | AC213: 110.11560693641619 | AD213: 12
A214: BRIGHTON | D214: WALSH 4 | G214: NOONAN 2 | J214: BURNES | L214: HUNT | N214: CARROLL | Q214: STOREY
W215: YARRAVILLE | X215: 3 | Y215: 2 | Z215: 0 | AA215: 294 | AB215: 318 | AC215: 92.452830188679243 | AD215: 12
A216: PORT MELBOURNE | C216: 3 | D216: 7 | E216: =C216*6+D216 -> 25 | G216: 7 | H216: 10 | I216: =G216*6+H216 -> 52 | K216: 12 | L216: 13 | M216: =K216*6+L216 -> 85 | O216: 16 | P216: 20 | Q216: =O216*6+P216 -> 116 | S216: PORT MELBOURNE | W216: PRESTON | X216: 2 | Y216: 3 | Z216: 0 | AA216: 314 | AB216: 301 | AC216: 104.31893687707641 | AD216: 8
A217: NORTHCOTE | C217: 5 | D217: 2 | E217: =C217*6+D217 -> 32 | G217: 7 | H217: 6 | I217: =G217*6+H217 -> 48 | K217: 8 | L217: 8 | M217: =K217*6+L217 -> 56 | O217: 10 | P217: 9 | Q217: =O217*6+P217 -> 69 | S217: FROOD | W217: BRUNSWICK | X217: 2 | Y217: 3 | Z217: 0 | AA217: 321 | AB217: 346 | AC217: 92.774566473988443 | AD217: 8
A218: BEST PLAYERS | W218: WILLIAMSTOWN | X218: 2 | Y218: 3 | Z218: 0 | AA218: 248 | AB218: 284 | AC218: 87.323943661971825 | AD218: 8
A219: PORT MELBOURNE | D219: GARBUTT | F219: CARPENTER | I219: SKILTON | L219: KUHLKEN | O219: HYDE | Q219: RUDD | W219: NORTHCOTE | X219: 2 | Y219: 3 | Z219: 0 | AA219: 314 | AB219: 388 | AC219: 80.927835051546396 | AD219: 8
A220: NORTHCOTE | D220: PERKINS | F220: COLE | I220: DOUG NICHOLLS | M220: HEENAN | O220: POULTER | Q220: JOBSON | W220: PRAHRAN | X220: 0 | Y220: 5 | Z220: 0 | AA220: 297 | AB220: 430 | AC220: 69.069767441860463 | AD220: 0
A221: GOALKICKERS
A222: PORT MELBOURNE | D222: KUHLKEN 6 | G222: SKILTON 4 | I222: WILSON 2 | L222: FORBES | N222: ATKINSON | Q222: WILKINS | S222: RUDD
A223: NORTHCOTE | D223: HEENAN 3 | G223: PIKE 3 | I223: O'BRIEN 2 | L223: DESLANDES | O223: POULTER
A225: BRUNSWICK | C225: 5 | D225: 6 | E225: =C225*6+D225 -> 36 | G225: 7 | H225: 11 | I225: =G225*6+H225 -> 53 | K225: 8 | L225: 13 | M225: =K225*6+L225 -> 61 | O225: 13 | P225: 16 | Q225: =O225*6+P225 -> 94 | S225: BRUNSWICK
A226: PRESTON | C226: 2 | D226: 1 | E226: =C226*6+D226 -> 13 | G226: 3 | H226: 5 | I226: =G226*6+H226 -> 23 | K226: 11 | L226: 7 | M226: =K226*6+L226 -> 73 | O226: 13 | P226: 8 | Q226: =O226*6+P226 -> 86 | S226: HUNTINGTON
A227: BEST PLAYERS
A228: BRUNSWICK | D228: RALEIGH | G228: WHITELEY | J228: HARRIS | M228: LANGWELL | P228: RUSSELL | S228: HASSETT
A229: PRESTON | D229: MILLER | G229: ADAMS | J229: JOHNSTONE | M229: DODD | P229: BRIDGFORD | S229: HARRIS
A230: GOALKICKERS
A231: BRUNSWICK | D231: RAYMOND 3 | G231: HASSETT 2 | J231: McINERNEY 2 | M231: FARROW 2 | P231: LANGWELL | R231: ALESSIO | U231: PENMAN | X231: YEOMANS
A232: PRESTON | D232: DODD 4 | G232: HARRIS 3 | J232: ADAMS 3 | M232: STEVENS 2 | P232: SHAW
A234: YARRAVILLE | C234: 3 | D234: 3 | E234: =C234*6+D234 -> 21 | G234: 4 | H234: 4 | I234: =G234*6+H234 -> 28 | K234: 5 | L234: 7 | M234: =K234*6+L234 -> 37 | O234: 10 | P234: 13 | Q234: =O234*6+P234 -> 73 | S234: TOORAK PARK
A235: PRAHRAN | C235: 3 | D235: 2 | E235: =C235*6+D235 -> 20 | G235: 5 | H235: 4 | I235: =G235*6+H235 -> 34 | K235: 8 | L235: 7 | M235: =K235*6+L235 -> 55 | O235: 9 | P235: 8 | Q235: =O235*6+P235 -> 62 | S235: MURRAY
A236: BEST PLAYERS
A237: YARRAVILLE | D237: PETZKE | G237: LINTON | J237: LYONS | M237: COULSELL | P237: GILL | S237: POOLE
A238: PRAHRAN | D238: F SMITH | G238: LORD | J238: FIDLER | M238: OSBORNE | P238: ROBBINS | S238: GLOVER
A239: GOALKICKERS
A240: YARRAVILLE | D240: GREENWOOD 4 | G240: COULSELL | I240: P BOLMAN | K240: A LEONARD | N240: KNOTT | P240: LINTON | R240: PETZKE
A241: PRAHRAN | D241: PARKER 3 | G241: LORD 3 | I241: J SMITH | K241: SALISBURY | N241: ROBBINS
A243: WILLIAMSTOWN | C243: 2 | D243: 5 | E243: =C243*6+D243 -> 17 | G243: 7 | H243: 7 | I243: =G243*6+H243 -> 49 | K243: 9 | L243: 12 | M243: =K243*6+L243 -> 66 | O243: 9 | P243: 12 | Q243: =O243*6+P243 -> 66 | S243: WILLIAMSTOWN
A244: CAMBERWELL | C244: 0 | D244: 4 | E244: =C244*6+D244 -> 4 | G244: 3 | H244: 8 | I244: =G244*6+H244 -> 26 | K244: 4 | L244: 13 | M244: =K244*6+L244 -> 37 | O244: 7 | P244: 17 | Q244: =O244*6+P244 -> 59 | S244: BENTINCK
A245: BEST PLAYERS
A246: WILLIAMSTOWN | D246: GODWILL | G246: MUNRO | J246: BEER | M246: MATHER | P246: C DREW | S246: CLAUSCEN
A247: CAMBERWELL | D247: GREENWOOD | G247: CONNOP | J247: LAWN | M247: WOODFORD | P247: PAGE | S247: HORNE
A248: GOALKICKERS
A249: WILLIAMSTOWN | D249: MUNRO 4 | G249: BEER 2 | J249: MATHER | M249: L DREW | O249: GODWILL
A250: CAMBERWELL | D250: CONNOP 3 | G250: LAWN 2 | J250: PAGE | L250: WOODFORD
A252: ROUND 6 | E252: 26TH MAY | H252: WEATHER | K252: CLOUDY LIGHT SHOWERS S.E.BREEZE | S252: PLAYED AT | X252: LADDER | AB252: ROUND | AD252: 6
D253: 1ST QTR | H253: 2ND QTR | L253: 3RD QTR | P253: FINAL | S253: CAMBERWELL
A254: BRIGHTON | C254: 3 | D254: 3 | E254: =C254*6+D254 -> 21 | G254: 6 | H254: 13 | I254: =G254*6+H254 -> 49 | K254: 7 | L254: 17 | M254: =K254*6+L254 -> 59 | O254: 10 | P254: 21 | Q254: =O254*6+P254 -> 81 | S254: UMPIRE | W254: TEAM | X254: W | Y254: L | Z254: D | AA254: FOR | AB254: AGST | AC254: % | AD254: PTS
A255: CAMBERWELL | C255: 4 | D255: 5 | E255: =C255*6+D255 -> 29 | G255: 5 | H255: 6 | I255: =G255*6+H255 -> 36 | K255: 9 | L255: 8 | M255: =K255*6+L255 -> 62 | O255: 11 | P255: 14 | Q255: =O255*6+P255 -> 80 | S255: HUNTINGTON
A256: BEST PLAYERS | W256: COBURG | X256: 6 | Y256: 0 | Z256: 0 | AA256: 526 | AB256: 310 | AC256: 169.67741935483872 | AD256: 24
A257: BRIGHTON | D257: HUNT | G257: CARROLL | I257: GARCIA | K257: ULBRICK | N257: NOONAN | Q257: DAINTY | W257: PORT MELBOURNE | X257: 4 | Y257: 2 | Z257: 0 | AA257: 415 | AB257: 333 | AC257: 124.62462462462463 | AD257: 16
A258: CAMBERWELL | D258: GUNNYON | G258: GOUGH | I258: PRICE | K258: LAWN | N258: HORNE | Q258: LAKIN | W258: BRIGHTON | X258: 4 | Y258: 2 | Z258: 0 | AA258: 462 | AB258: 426 | AC258: 108.45070422535211 | AD258: 16
A259: GOALKICKERS | W259: YARRAVILLE | X259: 4 | Y259: 2 | Z259: 0 | AA259: 357 | AB259: 358 | AC259: 99.720670391061446 | AD259: 16
A260: BRIGHTON | D260: WALSH 3 | G260: BURNES 3 | J260: BURTON 2 | M260: BORLAND | P260: STOREY
A261: CAMBERWELL | D261: STEVENS 2 | G261: BRIDE 2 | I261: LAKIN 2 | K261: GOUGH 2 | M261: GUNNYON 2 | P261: CONNOP | W261: CAMBERWELL | X261: 3 | Y261: 3 | Z261: 0 | AA261: 359 | AB261: 329 | AC261: 109.11854103343465 | AD261: 12
W262: PRESTON | X262: 2 | Y262: 4 | Z262: 0 | AA262: 373 | AB262: 367 | AC262: 101.63487738419619 | AD262: 8
A263: PORT MELBOURNE | C263: 2 | D263: 3 | E263: =C263*6+D263 -> 15 | G263: 6 | H263: 3 | I263: =G263*6+H263 -> 39 | K263: 9 | L263: 3 | M263: =K263*6+L263 -> 57 | O263: 10 | P263: 6 | Q263: =O263*6+P263 -> 66 | S263: PRESTON | W263: WILLIAMSTOWN | X263: 2 | Y263: 4 | Z263: 0 | AA263: 347 | AB263: 384 | AC263: 90.364583333333329 | AD263: 8
A264: PRESTON | C264: 2 | D264: 4 | E264: =C264*6+D264 -> 16 | G264: 5 | H264: 6 | I264: =G264*6+H264 -> 36 | K264: 7 | L264: 7 | M264: =K264*6+L264 -> 49 | O264: 8 | P264: 11 | Q264: =O264*6+P264 -> 59 | S264: LYNCH | W264: BRUNSWICK | X264: 2 | Y264: 4 | Z264: 0 | AA264: 361 | AB264: 409 | AC264: 88.264058679706608 | AD264: 8
A265: BEST PLAYERS | W265: NORTHCOTE | X265: 2 | Y265: 4 | Z265: 0 | AA265: 347 | AB265: 499 | AC265: 69.539078156312627 | AD265: 8
A266: PORT MELBOURNE | D266: GARBUTT | F266: KUHLKEN | I266: CARPENTER | L266: WILKINS | O266: HYDE | Q266: SKILTON | W266: PRAHRAN | X266: 1 | Y266: 5 | Z266: 0 | AA266: 397 | AB266: 529 | AC266: 75.047258979206049 | AD266: 4
A267: PRESTON | D267: MILLER | F267: ADAMS | I267: SUMMERS | L267: WHITE | O267: STEVENS | Q267: MONOHAN
A268: GOALKICKERS
A269: PORT MELBOURNE | D269: WILKINS 2 | F269: KUHLKEN 2 | I269: HYDE 2 | K269: CROMPTON 2 | N269: TUCK | P269: SKILTON
A270: PRESTON | D270: DODD 4 | F270: HAYES | H270: ADAMS | J270: SUMMERS | M270: SEEBECK
A272: YARRAVILLE | C272: 2 | D272: 4 | E272: =C272*6+D272 -> 16 | G272: 3 | H272: 5 | I272: =G272*6+H272 -> 23 | K272: 6 | L272: 8 | M272: =K272*6+L272 -> 44 | O272: 9 | P272: 9 | Q272: =O272*6+P272 -> 63 | S272: YARRAVILLE
A273: BRUNSWICK | C273: 1 | D273: 3 | E273: =C273*6+D273 -> 9 | G273: 2 | H273: 4 | I273: =G273*6+H273 -> 16 | K273: 3 | L273: 7 | M273: =K273*6+L273 -> 25 | O273: 5 | P273: 10 | Q273: =O273*6+P273 -> 40 | S273: BRITT
A274: BEST PLAYERS
A275: YARRAVILLE | D275: KNOTT | G275: J BOLMAN | J275: PETZKE | M275: GREENWOOD | P275: COULSELL | S275: LYONS
A276: BRUNSWICK | D276: RAYMOND | G276: KENNETT | J276: BRIGHT | M276: HASSETT | P276: BARRIE | S276: HARRIS
A277: GOALKICKERS
A278: YARRAVILLE | D278: GREENWOOD 4 | H278: ROGERS | J278: KENNEDY | M278: LINTON | O278: LYONS | Q278: GILL
A279: BRUNSWICK | D279: McINERNEY 3 | H279: RAYMOND | K279: BRIGHT
A281: PRAHRAN | C281: 4 | D281: 7 | E281: =C281*6+D281 -> 31 | G281: 8 | H281: 11 | I281: =G281*6+H281 -> 59 | K281: 13 | L281: 14 | M281: =K281*6+L281 -> 92 | O281: 14 | P281: 16 | Q281: =O281*6+P281 -> 100 | S281: TOORAK PARK
A282: WILLIAMSTOWN | C282: 5 | D282: 3 | E282: =C282*6+D282 -> 33 | G282: 10 | H282: 8 | I282: =G282*6+H282 -> 68 | K282: 11 | L282: 13 | M282: =K282*6+L282 -> 79 | O282: 14 | P282: 15 | Q282: =O282*6+P282 -> 99 | S282: McKINNON
A283: BEST PLAYERS
A284: PRAHRAN | D284: F SMITH | G284: GLOVER | J284: LORD | M284: E JONES | P284: SHORT | S284: McGRATH
A285: WILLIAMSTOWN | D285: MUNRO | G285: SHEEHAN | J285: BEER | M285: QUINN | P285: McKAY | S285: GODWILL
A286: GOALKICKERS
A287: PRAHRAN | D287: SALISBURY 3 | G287: McGRATH 3 | J287: HOGAN 3 | M287: LORD 2 | O287: BOWTELL 2 | R287: PRYOR
A288: WILLIAMSTOWN | D288: SHEEHAN 4 | G288: BEER 3 | I288: STOCK 2 | K288: JOHNS | M288: MUNRO | O288: GODWILL | Q288: QUINN | S288: LEADER
A290: COBURG | C290: 3 | D290: 2 | E290: =C290*6+D290 -> 20 | G290: 6 | H290: 6 | I290: =G290*6+H290 -> 42 | K290: 10 | L290: 15 | M290: =K290*6+L290 -> 75 | O290: 16 | P290: 15 | Q290: =O290*6+P290 -> 111 | S290: COBURG
A291: NORTHCOTE | C291: 0 | D291: 1 | E291: =C291*6+D291 -> 1 | G291: 4 | H291: 3 | I291: =G291*6+H291 -> 27 | K291: 4 | L291: 5 | M291: =K291*6+L291 -> 29 | O291: 4 | P291: 9 | Q291: =O291*6+P291 -> 33 | S291: FROOD
A292: BEST PLAYERS
A293: COBURG | D293: KERLEY | G293: MEARS | I293: GARDINER | L293: F PLANT | O293: WATT | Q293: CHAPMAN
A294: NORTHCOTE | D294: GARRETT | G294: CLOUGH | I294: DARRA NICHOLLS | M294: LONG | O294: PERKINS | Q294: DOUG NICHOLLS
A295: GOALKICKERS
A296: COBURG | D296: GARDINER 5 | G296: F PLANT 4 | I296: MEARS 2 | K296: KERLEY | M296: HUNTINGTON | P296: HARRIS | R296: CONNELL | U296: MORRISON
A297: NORTHCOTE | D297: COLE 2 | G297: ALDRIDGE 2
A299: ROUND 7 | E299: 2ND JUNE | J299: WEATHER | M299: RAIN NORTH WIND | S299: PLAYED AT | X299: LADDER | AB299: ROUND | AD299: 7
D300: 1ST QTR | H300: 2ND QTR | L300: 3RD QTR | P300: FINAL | S300: PORT MELBOURNE
A301: PORT MELBOURNE | C301: 0 | D301: 3 | E301: =C301*6+D301 -> 3 | G301: 2 | H301: 5 | I301: =G301*6+H301 -> 17 | K301: 3 | L301: 8 | M301: =K301*6+L301 -> 26 | O301: 6 | P301: 10 | Q301: =O301*6+P301 -> 46 | S301: UMPIRE | W301: TEAM | X301: W | Y301: L | Z301: D | AA301: FOR | AB301: AGST | AC301: % | AD301: PTS
A302: YARRAVILLE | C302: 1 | D302: 1 | E302: =C302*6+D302 -> 7 | G302: 1 | H302: 3 | I302: =G302*6+H302 -> 9 | K302: 3 | L302: 5 | M302: =K302*6+L302 -> 23 | O302: 3 | P302: 6 | Q302: =O302*6+P302 -> 24 | S302: MAHER
A303: BEST PLAYERS | W303: COBURG | X303: 7 | Y303: 0 | Z303: 0 | AA303: 681 | AB303: 357 | AC303: 190.75630252100839 | AD303: 28
A304: PORT MELBOURNE | D304: CARPENTER | G304: GARBUTT | I304: BOURKE | L304: RUDD | O304: HYDE | Q304: PETERSON | W304: PORT MELBOURNE | X304: 5 | Y304: 2 | Z304: 0 | AA304: 461 | AB304: 357 | AC304: 129.13165266106444 | AD304: 20
A305: YARRAVILLE | D305: R LEONARD | G305: COULSELL | I305: BOLMAN | L305: WOODMAN | O305: LYONS | Q305: KNOTT | W305: CAMBERWELL | X305: 4 | Y305: 3 | Z305: 0 | AA305: 443 | AB305: 385 | AC305: 115.06493506493507 | AD305: 16
A306: GOALKICKERS | W306: BRIGHTON | X306: 4 | Y306: 3 | Z306: 0 | AA306: 531 | AB306: 501 | AC306: 105.9880239520958 | AD306: 16
A307: PORT MELBOURNE | D307: PETERSON 2 | G307: SKILTON | J307: WILSON | L307: KUHLKEN | N307: MORTON
A308: YARRAVILLE | D308: LYONS | G308: R LEONARD | J308: MALBERG | W308: YARRAVILLE | X308: 4 | Y308: 3 | Z308: 0 | AA308: 381 | AB308: 404 | AC308: 94.306930693069305 | AD308: 16
W309: PRESTON | X309: 3 | Y309: 4 | Z309: 0 | AA309: 455 | AB309: 434 | AC309: 104.83870967741936 | AD309: 12
A310: CAMBERWELL | C310: 7 | D310: 4 | E310: =C310*6+D310 -> 46 | G310: 7 | H310: 6 | I310: =G310*6+H310 -> 48 | K310: 12 | L310: 8 | M310: =K310*6+L310 -> 80 | O310: 12 | P310: 12 | Q310: =O310*6+P310 -> 84 | S310: TOORAK PARK | W310: BRUNSWICK | X310: 3 | Y310: 4 | Z310: 0 | AA310: 436 | AB310: 478 | AC310: 91.213389121338906 | AD310: 12
A311: PRAHRAN | C311: 0 | D311: 1 | E311: =C311*6+D311 -> 1 | G311: 5 | H311: 3 | I311: =G311*6+H311 -> 33 | K311: 6 | L311: 3 | M311: =K311*6+L311 -> 39 | O311: 8 | P311: 8 | Q311: =O311*6+P311 -> 56 | S311: MURRAY | W311: WILLIAMSTOWN | X311: 2 | Y311: 5 | Z311: 0 | AA311: 394 | AB311: 539 | AC311: 73.098330241187384 | AD311: 8
A312: BEST PLAYERS | W312: NORTHCOTE | X312: 2 | Y312: 5 | Z312: 0 | AA312: 414 | AB312: 581 | AC312: 71.256454388984508 | AD312: 8
A313: CAMBERWELL | D313: LAWN | G313: HORNE | I313: STEVENS | L313: PRICE | O313: GUNNYON | Q313: PAGE | W313: PRAHRAN | X313: 1 | Y313: 6 | Z313: 0 | AA313: 453 | AB313: 613 | AC313: 73.898858075040778 | AD313: 4
A314: PRAHRAN | D314: F SMITH | G314: McGRATH | I314: PAGE | L314: ISBEL | O314: LORD | Q314: DIPROSE
A315: GOALKICKERS
A316: CAMBERWELL | D316: GUNNYON 2 | G316: MILLS 2 | I316: GOUGH 2 | K316: BRIDE | M316: LAKIN | O316: LAWN | Q316: STEVENS | S316: KARTHAUS | V316: PAGE
A317: PRAHRAN | D317: LORD 3 | G317: McGRATH 3 | J317: PRYOR | L317: COOKE
A319: COBURG | C319: 5 | D319: 2 | E319: =C319*6+D319 -> 32 | G319: 8 | H319: 10 | I319: =G319*6+H319 -> 58 | K319: 16 | L319: 14 | M319: =K319*6+L319 -> 110 | O319: 22 | P319: 23 | Q319: =O319*6+P319 -> 155 | S319: COBURG
A320: WILLIAMSTOWN | C320: 2 | D320: 2 | E320: =C320*6+D320 -> 14 | G320: 3 | H320: 3 | I320: =G320*6+H320 -> 21 | K320: 5 | L320: 9 | M320: =K320*6+L320 -> 39 | O320: 6 | P320: 11 | Q320: =O320*6+P320 -> 47 | S320: LESTER
A321: BEST PLAYERS
A322: COBURG | D322: CHAPMAN | G322: FORD | J322: CORNELL | M322: V DONNELLY | P322: HARRIS | S322: F PLANT
A323: WILLIAMSTOWN | D323: MUNRO | G323: GODWILL | J323: WARREN | M323: CLAUSCEN | P323: L DREW | S323: BEER
A324: GOALKICKERS
A325: COBURG | D325: GARDINER 7 | G325: F PLANT 5 | I325: HUNTINGTON 4 | L325: MEARS 2 | N325: KERLEY 2 | Q325: HARRIS | S325: COLBERT
A326: WILLIAMSTOWN | D326: SHEEHAN 2 | G326: MUNRO | I326: BEER | K326: JOHNS | M326: OUTEN
E327: 4TH JUNE | J327: WEATHER | M327: CLOUDY BUT FINE WEST BREEZE
A328: PRESTON | C328: 3 | D328: 3 | E328: =C328*6+D328 -> 21 | G328: 3 | H328: 10 | I328: =G328*6+H328 -> 28 | K328: 7 | L328: 12 | M328: =K328*6+L328 -> 54 | O328: 11 | P328: 16 | Q328: =O328*6+P328 -> 82 | S328: NORTHCOTE
A329: NORTHCOTE | C329: 0 | D329: 7 | E329: =C329*6+D329 -> 7 | G329: 4 | H329: 12 | I329: =G329*6+H329 -> 36 | K329: 8 | L329: 13 | M329: =K329*6+L329 -> 61 | O329: 9 | P329: 13 | Q329: =O329*6+P329 -> 67 | S329: SCHAEFER
A330: BEST PLAYERS
A331: PRESTON | D331: MONOHAN | G331: BRIDGFORD | J331: H TAYLOR | M331: HARRIS | P331: GROGAN | S331: MILLER
A332: NORTHCOTE | D332: ALDRIDGE | G332: PERKINS | J332: COLE | M332: DOUG NICHOLLS | P332: HOULDECROFT | S332: DILLON
A333: GOALKICKERS
A334: PRESTON | D334: DODD 6 | G334: HARRIS 2 | J334: ADAMS | L334: MONOHAN | N334: DOWLING
A335: NORTHCOTE | D335: COLE 6 | G335: ALDRIDGE | J335: HEENAN | L335: O'BRIEN
A337: BRUNSWICK | C337: 4 | D337: 3 | E337: =C337*6+D337 -> 27 | G337: 7 | H337: 4 | I337: =G337*6+H337 -> 46 | K337: 10 | L337: 7 | M337: =K337*6+L337 -> 67 | O337: 13 | P337: 8 | Q337: =O337*6+P337 -> 86 | S337: E'WICK
A338: BRIGHTON | C338: 2 | D338: 2 | E338: =C338*6+D338 -> 14 | G338: 5 | H338: 5 | I338: =G338*6+H338 -> 35 | K338: 6 | L338: 8 | M338: =K338*6+L338 -> 44 | O338: 8 | P338: 16 | Q338: =O338*6+P338 -> 64 | S338: PAYNE
A339: BEST PLAYERS
A340: BRUNSWICK | D340: HASSETT | G340: HARRIS | J340: BARRIE | M340: KENNEDY | P340: RAYMOND | S340: RALEIGH
A341: BRIGHTON | D341: ARTHUR | G341: HUNT | J341: MATTHEWS | M341: ULBRICK | P341: NOONAN | S341: DAINTY
A342: GOALKICKERS
A343: BRUNSWICK | D343: KENNETT 2 | F343: KENNEDY 2 | I343: McINERNEY 2 | L343: RAYMOND 2 | O343: HASSETT | Q343: FARROW | S343: RALEIGH | V343: LANGWELL | X343: BARRIE
A344: BRIGHTON | D344: BURNES 4 | G344: WALSH 2 | J344: WRIGHT | L344: ULBRICK
A345: * REPLAYED: | B345: 18TH JULY | F345: AFTER | H345: PROTEST | J345: BY | K345: BRIGHTON
A346: BRUNSWICK | C346: 6 | D346: 3 | E346: =C346*6+D346 -> 39 | G346: 7 | H346: 4 | I346: =G346*6+H346 -> 46 | K346: 9 | L346: 10 | M346: =K346*6+L346 -> 64 | O346: 10 | P346: 15 | Q346: =O346*6+P346 -> 75 | S346: M.C.G.
A347: BRIGHTON | C347: 0 | D347: 2 | E347: =C347*6+D347 -> 2 | G347: 4 | H347: 6 | I347: =G347*6+H347 -> 30 | K347: 9 | L347: 6 | M347: =K347*6+L347 -> 60 | O347: 10 | P347: 9 | Q347: =O347*6+P347 -> 69 | S347: MURRAY
A348: BEST PLAYERS
A349: BRUNSWICK | D349: KENNETT | G349: WHITELEY | J349: BRIGHT | M349: WRIGHT | P349: BARRIE | S349: STEELE
A350: BRIGHTON | D350: CARROLL | G350: BORLAND | J350: GARCIA | M350: DAINTY | P350: MATTHEWS | S350: WALSH
A351: GOALKICKERS
A352: BRUNSWICK | D352: BLACKMORE 3 | G352: FARROW 2 | I352: GREENWOOD | L352: HASSETT | N352: ALESSIO | P352: BARRIE | R352: McGRATH
A353: BRIGHTON | D353: HUNT 3 | F353: WEBB 2 | H353: BORLAND | J353: MATTHEWS | M353: STOREY | O353: BURNES | Q353: ULBRICK
A355: ROUND 8 | E355: 9TH JUNE | J355: WEATHER | M355: FINE SLIGHT NORTH BREEZE | S355: PLAYED AT | X355: LADDER | AB355: ROUND | AD355: 8
D356: 1ST QTR | H356: 2ND QTR | L356: 3RD QTR | P356: FINAL | S356: CAMBERWELL
A357: CAMBERWELL | C357: 0 | D357: 2 | E357: =C357*6+D357 -> 2 | G357: 6 | H357: 6 | I357: =G357*6+H357 -> 42 | K357: 7 | L357: 9 | M357: =K357*6+L357 -> 51 | O357: 10 | P357: 12 | Q357: =O357*6+P357 -> 72 | S357: UMPIRE | W357: TEAM | X357: W | Y357: L | Z357: D | AA357: FOR | AB357: AGST | AC357: % | AD357: PTS
A358: COBURG | C358: 4 | D358: 2 | E358: =C358*6+D358 -> 26 | G358: 5 | H358: 4 | I358: =G358*6+H358 -> 34 | K358: 8 | L358: 8 | M358: =K358*6+L358 -> 56 | O358: 10 | P358: 9 | Q358: =O358*6+P358 -> 69 | S358: FROOD
A359: BEST PLAYERS | W359: COBURG | X359: 7 | Y359: 1 | Z359: 0 | AA359: 750 | AB359: 429 | AC359: 174.82517482517483 | AD359: 28
A360: CAMBERWELL | D360: LAWN | F360: L WILLIAMS | I360: LE STRANGE | L360: CALWELL | N360: GREENWOOD | Q360: BOOTHMAN | W360: PORT MELBOURNE | X360: 6 | Y360: 2 | Z360: 0 | AA360: 580 | AB360: 405 | AC360: 143.20987654320987 | AD360: 24
A361: COBURG | D361: WALSH | F361: REYNOLDS | I361: COLBERT | L361: KIRBY | N361: HUNTINGTON | Q361: BROOKS | W361: CAMBERWELL | X361: 5 | Y361: 3 | Z361: 0 | AA361: 515 | AB361: 454 | AC361: 113.43612334801762 | AD361: 20
A362: GOALKICKERS | W362: PRESTON | X362: 4 | Y362: 4 | Z362: 0 | AA362: 520 | AB362: 480 | AC362: 108.33333333333333 | AD362: 16
A363: CAMBERWELL | D363: WOODFORD 3 | G363: LAKIN 3 | I363: LAWN | K363: GOUGH | M363: STEVENS | O363: KARTHAUS
A364: COBURG | D364: HUNTINGTON 3 | H364: COLBERT 3 | K364: KERLEY 2 | N364: F PLANT 2 | W364: BRIGHTON | X364: 4 | Y364: 4 | Z364: 0 | AA364: 577 | AB364: 566 | AC364: 101.9434628975265 | AD364: 16
W365: BRUNSWICK | X365: 4 | Y365: 4 | Z365: 0 | AA365: 493 | AB365: 518 | AC365: 95.173745173745175 | AD365: 16
A366: PRESTON | C366: 6 | D366: 4 | E366: =C366*6+D366 -> 40 | G366: 6 | H366: 5 | I366: =G366*6+H366 -> 41 | K366: 9 | L366: 9 | M366: =K366*6+L366 -> 63 | O366: 9 | P366: 11 | Q366: =O366*6+P366 -> 65 | S366: PRESTON | W366: YARRAVILLE | X366: 4 | Y366: 4 | Z366: 0 | AA366: 458 | AB366: 483 | AC366: 94.824016563146998 | AD366: 16
A367: BRIGHTON | C367: 1 | D367: 0 | E367: =C367*6+D367 -> 6 | G367: 4 | H367: 6 | I367: =G367*6+H367 -> 30 | K367: 4 | L367: 9 | M367: =K367*6+L367 -> 33 | O367: 5 | P367: 16 | Q367: =O367*6+P367 -> 46 | S367: LESTER | W367: NORTHCOTE | X367: 3 | Y367: 5 | Z367: 0 | AA367: 493 | AB367: 658 | AC367: 74.924012158054708 | AD367: 12
A368: BEST PLAYERS | W368: WILLIAMSTOWN | X368: 2 | Y368: 6 | Z368: 0 | AA368: 434 | AB368: 596 | AC368: 72.818791946308721 | AD368: 8
A369: PRESTON | D369: BRIDGFORD | G369: SHAW | J369: ADAMS | M369: G TAYLOR | O369: SUMMERS | Q369: ROBERTSON | W369: PRAHRAN | X369: 1 | Y369: 7 | Z369: 0 | AA369: 501 | AB369: 732 | AC369: 68.442622950819668 | AD369: 4
A370: BRIGHTON | D370: DAINTY | G370: MATTHEWS | J370: McINTYRE | M370: BORLAND | O370: TROOD | Q370: STOREY
A371: GOALKICKERS
A372: PRESTON | D372: DODD 4 | F372: ADAMS | H372: SUMMERS | J372: MONOHAN | M372: G TAYLOR | O372: DENNINGTON
A373: BRIGHTON | D373: WRIGHT 2 | F373: BURNES | H373: BORLAND | J373: STEWART
A375: BRUNSWICK | C375: 3 | D375: 5 | E375: =C375*6+D375 -> 23 | G375: 3 | H375: 5 | I375: =G375*6+H375 -> 23 | K375: 5 | L375: 7 | M375: =K375*6+L375 -> 37 | O375: 8 | P375: 9 | Q375: =O375*6+P375 -> 57 | S375: WILLIAMSTOWN
A376: WILLIAMSTOWN | C376: 1 | D376: 0 | E376: =C376*6+D376 -> 6 | G376: 3 | H376: 3 | I376: =G376*6+H376 -> 21 | K376: 5 | L376: 3 | M376: =K376*6+L376 -> 33 | O376: 6 | P376: 4 | Q376: =O376*6+P376 -> 40 | S376: McKINNON
A377: BEST PLAYERS
A378: BRUNSWICK | D378: ALLISON | G378: EUDEY | J378: KENNEDY | M378: WHITELEY | P378: RAYMOND | S378: McINERNEY
A379: WILLIAMSTOWN | D379: TAAFE | G379: L DREW | J379: BEER | M379: ANDERSON | P379: LEADER | S379: WALKER
A380: GOALKICKERS
A381: BRUNSWICK | D381: McINERNEY 2 | G381: PROUDFOOT | J381: BRIGHT | L381: RAYMOND | N381: HASSETT | P381: RALEIGH | R381: LANGWELL
A382: WILLIAMSTOWN | D382: SHEEHAN 3 | G382: WALKER 2 | J382: BEER
A384: NORTHCOTE | C384: 6 | D384: 3 | E384: =C384*6+D384 -> 39 | G384: 8 | H384: 3 | I384: =G384*6+H384 -> 51 | K384: 11 | L384: 4 | M384: =K384*6+L384 -> 70 | O384: 12 | P384: 7 | Q384: =O384*6+P384 -> 79 | S384: YARRAVILLE
A385: YARRAVILLE | C385: 1 | D385: 2 | E385: =C385*6+D385 -> 8 | G385: 3 | H385: 10 | I385: =G385*6+H385 -> 28 | K385: 7 | L385: 14 | M385: =K385*6+L385 -> 56 | O385: 10 | P385: 17 | Q385: =O385*6+P385 -> 77 | S385: BLACKBURN
A386: BEST PLAYERS
A387: NORTHCOTE | D387: ALDRIDGE | G387: LAFFY | J387: DESLANDES | M387: ROBINSON | P387: O'BRIEN | S387: PERKINS
A388: YARRAVILLE | D388: KNOTT | G388: LYONS | J388: KENNEDY | M388: LINTON | P388: J BOLMAN | S388: MORAN
A389: GOALKICKERS
A390: NORTHCOTE | D390: DESLANDES 3 | G390: O'BRIEN 2 | I390: COLE | J390: ALDRIDGE | L390: MOORE | N390: DILLON | P390: LAFFY | R390: HOULDECROFT
A391: YARRAVILLE | D391: KENNEDY 3 | G391: COULSELL 3 | J391: LINTON | M391: GREENWOOD | P391: HUDD | R391: KNOTT
A393: PORT MELBOURNE | C393: 3 | D393: 1 | E393: =C393*6+D393 -> 19 | G393: 7 | H393: 11 | I393: =G393*6+H393 -> 53 | K393: 11 | L393: 15 | M393: =K393*6+L393 -> 81 | O393: 17 | P393: 17 | Q393: =O393*6+P393 -> 119 | S393: TOORAK PARK
A394: PRAHRAN | C394: 1 | D394: 6 | E394: =C394*6+D394 -> 12 | G394: 2 | H394: 6 | I394: =G394*6+H394 -> 18 | K394: 2 | L394: 9 | M394: =K394*6+L394 -> 21 | O394: 6 | P394: 12 | Q394: =O394*6+P394 -> 48 | S394: MURRAY
A395: BEST PLAYERS
A396: PORT MELBOURNE | D396: RUDD | G396: SKILTON | J396: FORBES | M396: GARBUTT | P396: MERRICK | S396: ATKINSON
A397: PRAHRAN | D397: F SMITH | G397: J SMITH | J397: E JONES | M397: PRYOR | P397: DIPROSE | S397: DOUGLAS
A398: GOALKICKERS
A399: PORT MELBOURNE | D399: MERRICK 6 | F399: KUHLKEN 3 | I399: BOURKE 2 | K399: ATKINSON 2 | N399: WILKINS | P399: FORBES | R399: HYDE | T399: HARVEY
A400: PRAHRAN | D400: J SMITH 2 | G400: McGRATH | J400: PRYOR | L400: BROWN | N400: ANDERSON
A402: ROUND 9 | E402: 16TH JUNE | J402: WEATHER | M402: FINE SOUTH WIND | S402: PLAYED AT | X402: LADDER | AB402: ROUND | AD402: 9
D403: 1ST QTR | H403: 2ND QTR | L403: 3RD QTR | P403: FINAL | S403: E'WICK
A404: BRIGHTON | C404: 1 | D404: 2 | E404: =C404*6+D404 -> 8 | G404: 5 | H404: 7 | I404: =G404*6+H404 -> 37 | K404: 6 | L404: 8 | M404: =K404*6+L404 -> 44 | O404: 8 | P404: 12 | Q404: =O404*6+P404 -> 60 | S404: UMPIRE | W404: TEAM | X404: W | Y404: L | Z404: D | AA404: FOR | AB404: AGST | AC404: % | AD404: PTS
A405: PORT MELBOURNE | C405: 1 | D405: 5 | E405: =C405*6+D405 -> 11 | G405: 2 | H405: 7 | I405: =G405*6+H405 -> 19 | K405: 4 | L405: 12 | M405: =K405*6+L405 -> 36 | O405: 5 | P405: 14 | Q405: =O405*6+P405 -> 44 | S405: McKINNON
A406: BEST PLAYERS | W406: COBURG | X406: 8 | Y406: 1 | Z406: 0 | AA406: 829 | AB406: 496 | AC406: 167.13709677419354 | AD406: 32
A407: BRIGHTON | D407: ELLIOTT | G407: HUNT | I407: MATTHEWS | L407: WALSH | N407: CARROLL | Q407: DAINTY | W407: PORT MELBOURNE | X407: 6 | Y407: 3 | Z407: 0 | AA407: 624 | AB407: 465 | AC407: 134.19354838709677 | AD407: 24
A408: PORT MELBOURNE | D408: CROMPTON | G408: SMITH | I408: HARVEY | L408: WILKINS | N408: BARNES | Q408: PETERSON | W408: CAMBERWELL | X408: 6 | Y408: 3 | Z408: 0 | AA408: 577 | AB408: 505 | AC408: 114.25742574257426 | AD408: 24
A409: GOALKICKERS | W409: PRESTON | X409: 5 | Y409: 4 | Z409: 0 | AA409: 621 | AB409: 541 | AC409: 114.78743068391867 | AD409: 20
A410: BRIGHTON | D410: MATTHEWS 6 | H410: STOREY | K410: BURNES
A411: PORT MELBOURNE | D411: KUHLKEN 2 | H411: MERRICK | K411: BOURKE | N411: HYDE | W411: BRIGHTON | X411: 5 | Y411: 4 | Z411: 0 | AA411: 637 | AB411: 610 | AC411: 104.42622950819673 | AD411: 20
W412: YARRAVILLE | X412: 5 | Y412: 4 | Z412: 0 | AA412: 532 | AB412: 530 | AC412: 100.37735849056604 | AD412: 20
A413: COBURG | C413: 4 | D413: 5 | E413: =C413*6+D413 -> 29 | G413: 7 | H413: 8 | I413: =G413*6+H413 -> 50 | K413: 11 | L413: 11 | M413: =K413*6+L413 -> 77 | O413: 11 | P413: 13 | Q413: =O413*6+P413 -> 79 | S413: BRUNSWICK | W413: BRUNSWICK | X413: 4 | Y413: 5 | Z413: 0 | AA413: 560 | AB413: 597 | AC413: 93.802345058626472 | AD413: 16
A414: BRUNSWICK | C414: 3 | D414: 1 | E414: =C414*6+D414 -> 19 | G414: 6 | H414: 6 | I414: =G414*6+H414 -> 42 | K414: 6 | L414: 13 | M414: =K414*6+L414 -> 49 | O414: 8 | P414: 19 | Q414: =O414*6+P414 -> 67 | S414: LESTER | W414: NORTHCOTE | X414: 3 | Y414: 6 | Z414: 0 | AA414: 544 | AB414: 720 | AC414: 75.555555555555557 | AD414: 12
A415: BEST PLAYERS | W415: WILLIAMSTOWN | X415: 2 | Y415: 7 | Z415: 0 | AA415: 481 | AB415: 670 | AC415: 71.791044776119406 | AD415: 8
A416: COBURG | D416: JENKINS | F416: BROOKS | I416: CHAPMAN | L416: WATT | N416: KERLEY | Q416: F PLANT | W416: PRAHRAN | X416: 1 | Y416: 8 | Z416: 0 | AA416: 562 | AB416: 833 | AC416: 67.466986794717883 | AD416: 4
A417: BRUNSWICK | D417: WHITELEY | F417: RAYMOND | I417: EUDEY | L417: RUSSELL | N417: HARRIS | Q417: PROUDFOOT
A418: GOALKICKERS
A419: COBURG | D419: KERLEY 2 | F419: GARDINER 2 | I419: F PLANT 2 | L419: STONE 2 | N419: JENKINS | P419: A MARTYN | R419: BROOKS
A420: BRUNSWICK | D420: RAYMOND 4 | G420: LINDSAY 2 | J420: KENNEDY | M420: McINERNEY
A422: YARRAVILLE | C422: 5 | D422: 5 | E422: =C422*6+D422 -> 35 | G422: 8 | H422: 6 | I422: =G422*6+H422 -> 54 | K422: 9 | L422: 9 | M422: =K422*6+L422 -> 63 | O422: 10 | P422: 14 | Q422: =O422*6+P422 -> 74 | S422: YARRAVILLE
A423: WILLIAMSTOWN | C423: 0 | D423: 0 | E423: =C423*6+D423 -> 0 | G423: 3 | H423: 8 | I423: =G423*6+H423 -> 26 | K423: 6 | L423: 8 | M423: =K423*6+L423 -> 44 | O423: 6 | P423: 11 | Q423: =O423*6+P423 -> 47 | S423: SCHAEFER
A424: BEST PLAYERS
A425: YARRAVILLE | D425: LINTON | G425: COULSELL | I425: WHITE | L425: KENNEDY | N425: P BOLMAN | Q425: HUDD
A426: WILLIAMSTOWN | D426: BEER | G426: McKAY | I426: FREW | L426: KENNY | N426: SHEEHAN | Q426: CLAUSCEN
A427: GOALKICKERS
A428: YARRAVILLE | D428: KENNEDY 3 | G428: LYONS 2 | I428: BEESON 2 | K428: COULSELL | N428: GILL
A429: WILLIAMSTOWN | D429: SHEEHAN 2 | G429: KENNY | I429: GODWILL | K429: LEADER
A431: CAMBERWELL | C431: 3 | D431: 1 | E431: =C431*6+D431 -> 19 | G431: 4 | H431: 3 | I431: =G431*6+H431 -> 27 | K431: 6 | L431: 6 | M431: =K431*6+L431 -> 42 | O431: 9 | P431: 8 | Q431: =O431*6+P431 -> 62 | S431: NORTHCOTE
A432: NORTHCOTE | C432: 2 | D432: 1 | E432: =C432*6+D432 -> 13 | G432: 6 | H432: 3 | I432: =G432*6+H432 -> 39 | K432: 6 | L432: 5 | M432: =K432*6+L432 -> 41 | O432: 7 | P432: 9 | Q432: =O432*6+P432 -> 51 | S432: MAKER
A433: BEST PLAYERS
A434: CAMBERWELL | D434: LE STRANGE | G434: GREENWOOD | J434: LAWN | L434: HARRISON | O434: WOODFORD | R434: PAGE
A435: NORTHCOTE | D435: ROBINSON | G435: ALDRIDGE | J435: DILLON | L435: CLOUGH | O435: GARRETT | R435: WHITTAKER
A436: GOALKICKERS
A437: CAMBERWELL | D437: GOUGH 2 | F437: WOODFORD 2 | I437: LAWN | K437: STEVENS | M437: LAKIN | O437: BROWN | Q437: PAGE
A438: NORTHCOTE | D438: COLE 3 | F438: DESLANDES | I438: ALDRIDGE | K438: GRAY | M438: DILLON
A440: PRESTON | C440: 0 | D440: 3 | E440: =C440*6+D440 -> 3 | G440: 8 | H440: 7 | I440: =G440*6+H440 -> 55 | K440: 9 | L440: 8 | M440: =K440*6+L440 -> 62 | O440: 15 | P440: 11 | Q440: =O440*6+P440 -> 101 | S440: TOORAK PARK
A441: PRAHRAN | C441: 1 | D441: 7 | E441: =C441*6+D441 -> 13 | G441: 2 | H441: 8 | I441: =G441*6+H441 -> 20 | K441: 7 | L441: 18 | M441: =K441*6+L441 -> 60 | O441: 7 | P441: 19 | Q441: =O441*6+P441 -> 61 | S441: FROOD
A442: BEST PLAYERS
A443: PRESTON | D443: DODD | F443: ADAMS | I443: G TAYLOR | L443: MONOHAN | O443: HOLLIDAY | Q443: DOWNIE
A444: PRAHRAN | D444: GLOVER | F444: F SMITH | I444: OSBORNE | L444: ALBERRY | O444: PRYOR | Q444: LORD
A445: GOALKICKERS
A446: PRESTON | D446: DODD 5 | F446: JOHNSTONE 3 | I446: HARRIS 2 | K446: STEVENS 2 | M446: MONOHAN 2 | P446: SUMMERS
A447: PRAHRAN | D447: LORD 2 | F447: PRYOR 2 | I447: J SMITH | K447: McGRATH | M447: E JONES
A449: ROUND 10 | E449: 23RD JUNE | J449: WEATHER | M449: CLOUDY BUT FINE SOUTH WIND | S449: PLAYED AT | X449: LADDER | AB449: ROUND | AD449: 10
D450: 1ST QTR | H450: 2ND QTR | L450: 3RD QTR | P450: FINAL | S450: COBURG
A451: COBURG | C451: 5 | D451: 4 | E451: =C451*6+D451 -> 34 | G451: 7 | H451: 6 | I451: =G451*6+H451 -> 48 | K451: 11 | L451: 10 | M451: =K451*6+L451 -> 76 | O451: 14 | P451: 11 | Q451: =O451*6+P451 -> 95 | S451: UMPIRE | W451: TEAM | X451: W | Y451: L | Z451: D | AA451: FOR | AB451: AGST | AC451: % | AD451: PTS
A452: PRESTON | C452: 0 | D452: 3 | E452: =C452*6+D452 -> 3 | G452: 2 | H452: 4 | I452: =G452*6+H452 -> 16 | K452: 2 | L452: 6 | M452: =K452*6+L452 -> 18 | O452: 6 | P452: 11 | Q452: =O452*6+P452 -> 47 | S452: HUNTINGTON
A453: BEST PLAYERS | W453: COBURG | X453: 9 | Y453: 1 | Z453: 0 | AA453: 924 | AB453: 543 | AC453: 170.1657458563536 | AD453: 36
A454: COBURG | D454: O'BRIEN | G454: HUNTINGTON | J454: JENKINS | M454: MEARS | O454: REYNOLDS | Q454: CHAPMAN | W454: PORT MELBOURNE | X454: 7 | Y454: 3 | Z454: 0 | AA454: 757 | AB454: 533 | AC454: 142.02626641651031 | AD454: 28
A455: PRESTON | D455: SUMMERS | G455: MONOHAN | J455: BRIDGFORD | M455: DOUGLAS | O455: HOLLIDAY | Q455: ROBERTSON | W455: CAMBERWELL | X455: 7 | Y455: 3 | Z455: 0 | AA455: 667 | AB455: 559 | AC455: 119.32021466905188 | AD455: 28
A456: GOALKICKERS | W456: BRIGHTON | X456: 6 | Y456: 4 | Z456: 0 | AA456: 715 | AB456: 680 | AC456: 105.14705882352941 | AD456: 24
A457: COBURG | D457: F PLANT 5 | G457: O'BRIEN 3 | J457: GARDINER 3 | M457: COLBERT 2 | P457: HARRIS
A458: PRESTON | D458: ROBERTSON 2 | G458: SUMMERS | J458: DODD | L458: STEVENS | O458: HOLLIDAY | W458: PRESTON | X458: 5 | Y458: 5 | Z458: 0 | AA458: 668 | AB458: 636 | AC458: 105.03144654088051 | AD458: 20
W459: BRUNSWICK | X459: 5 | Y459: 5 | Z459: 0 | AA459: 615 | AB459: 641 | AC459: 95.943837753510138 | AD459: 20
A460: CAMBERWELL | C460: 2 | D460: 7 | E460: =C460*6+D460 -> 19 | G460: 3 | H460: 8 | I460: =G460*6+H460 -> 26 | K460: 11 | L460: 12 | M460: =K460*6+L460 -> 78 | O460: 13 | P460: 12 | Q460: =O460*6+P460 -> 90 | S460: CAMBERWELL | W460: YARRAVILLE | X460: 5 | Y460: 5 | Z460: 0 | AA460: 586 | AB460: 620 | AC460: 94.516129032258064 | AD460: 20
A461: YARRAVILLE | C461: 0 | D461: 1 | E461: =C461*6+D461 -> 1 | G461: 3 | H461: 5 | I461: =G461*6+H461 -> 23 | K461: 5 | L461: 5 | M461: =K461*6+L461 -> 35 | O461: 7 | P461: 12 | Q461: =O461*6+P461 -> 54 | S461: MURPHY | W461: NORTHCOTE | X461: 3 | Y461: 7 | Z461: 0 | AA461: 614 | AB461: 798 | AC461: 76.942355889724311 | AD461: 12
A462: BEST PLAYERS | W462: WILLIAMSTOWN | X462: 2 | Y462: 8 | Z462: 0 | AA462: 549 | AB462: 803 | AC462: 68.368617683686182 | AD462: 8
A463: CAMBERWELL | D463: GUNNYON | G463: HARRISON | J463: BOOTHMAN | M463: LAWN | O463: WILLIAMS | Q463: GREENWOOD | W463: PRAHRAN | X463: 1 | Y463: 9 | Z463: 0 | AA463: 606 | AB463: 888 | AC463: 68.243243243243242 | AD463: 4
A464: YARRAVILLE | D464: LYONS | G464: KENNEDY | J464: KNOTT | M464: P BOLMAN | O464: POOLE | Q464: COULSELL
A465: GOALKICKERS
A466: CAMBERWELL | D466: LAWN 3 | F466: PAGE 2 | H466: WOODFORD 2 | K466: GUNNYON 2 | N466: GOUGH | P466: STEVENS | R466: LAKIN | T466: BRIDE
A467: YARRAVILLE | D467: BEESON 3 | F467: LYONS | H467: GILL | J467: HUDD | L467: JOYCE
A469: BRIGHTON | C469: 1 | D469: 4 | E469: =C469*6+D469 -> 10 | G469: 5 | H469: 13 | I469: =G469*6+H469 -> 43 | K469: 5 | L469: 16 | M469: =K469*6+L469 -> 46 | O469: 9 | P469: 24 | Q469: =O469*6+P469 -> 78 | S469: NORTHCOTE
A470: NORTHCOTE | C470: 4 | D470: 4 | E470: =C470*6+D470 -> 28 | G470: 5 | H470: 4 | I470: =G470*6+H470 -> 34 | K470: 8 | L470: 9 | M470: =K470*6+L470 -> 57 | O470: 10 | P470: 10 | Q470: =O470*6+P470 -> 70 | S470: McKINNON
A471: BEST PLAYERS
A472: BRIGHTON | D472: McINTYRE | G472: CARROLL | J472: MATTHEWS | M472: WALSH | P472: STOREY | S472: ULBRICK
A473: NORTHCOTE | D473: PERKINS | G473: GARRETT | J473: SEYMOUR | M473: HEENAN | P473: LAFFY | S473: BROWN
A474: GOALKICKERS
A475: BRIGHTON | D475: WALSH 3 | G475: MATTHEWS 3 | J475: BURNES | M475: HUNT | O475: V WRIGHT
A476: NORTHCOTE | D476: SEYMOUR 4 | G476: DILLON | I476: ALDRIDGE | K476: DESLANDES | N476: LAFFY | P476: HOULDECROFT | S476: GRAY
A478: BRUNSWICK | C478: 3 | D478: 3 | E478: =C478*6+D478 -> 21 | G478: 4 | H478: 4 | I478: =G478*6+H478 -> 28 | K478: 6 | L478: 5 | M478: =K478*6+L478 -> 41 | O478: 8 | P478: 7 | Q478: =O478*6+P478 -> 55 | S478: TOORAK PARK
A479: PRAHRAN | C479: 3 | D479: 0 | E479: =C479*6+D479 -> 18 | G479: 4 | H479: 5 | I479: =G479*6+H479 -> 29 | K479: 5 | L479: 5 | M479: =K479*6+L479 -> 35 | O479: 6 | P479: 8 | Q479: =O479*6+P479 -> 44 | S479: McNIECE
A480: BEST PLAYERS
A481: BRUNSWICK | D481: HASSETT | G481: PROUDFOOT | J481: KENNEDY | M481: CARTON | P481: ALESSIO | S481: RALEIGH
A482: PRAHRAN | D482: F SMITH | G482: GLOVER | J482: McRAE | M482: OSBORNE | P482: LORD | S482: J SMITH
A483: GOALKICKERS
A484: BRUNSWICK | D484: RAYMOND 2 | G484: HASSETT 2 | J484: BARRIE 2 | M484: LANGWELL | P484: EDWARDS
A485: PRAHRAN | D485: PRYOR 2 | G485: LORD | J485: J SMITH | M485: McGRATH | P485: SHORT
A487: PORT MELBOURNE | C487: 4 | D487: 1 | E487: =C487*6+D487 -> 25 | G487: 12 | H487: 2 | I487: =G487*6+H487 -> 74 | K487: 13 | L487: 6 | M487: =K487*6+L487 -> 84 | O487: 20 | P487: 13 | Q487: =O487*6+P487 -> 133 | S487: PORT MELBOURNE
A488: WILLIAMSTOWN | C488: 5 | D488: 2 | E488: =C488*6+D488 -> 32 | G488: 5 | H488: 2 | I488: =G488*6+H488 -> 32 | K488: 8 | L488: 11 | M488: =K488*6+L488 -> 59 | O488: 9 | P488: 14 | Q488: =O488*6+P488 -> 68 | S488: MAKER
A489: BEST PLAYERS
A490: PORT MELBOURNE | D490: KUHLKEN | G490: GARBUTT | J490: CROMPTON | N490: SKILTON | Q490: RUDD | S490: PETERSON
A491: WILLIAMSTOWN | D491: BEER | G491: FREW | J491: FURLONG | N491: TAAFE | Q491: L DREW | S491: WARREN
A492: GOALKICKERS
A493: PORT MELBOURNE | D493: KUHLKEN 7 | F493: BOURKE 4 | I493: WILSON 2 | K493: FARNAM | M493: WILKINS | O493: ATKINSON | Q493: RUDD | R493: HARVEY | U493: BROOKER | X493: SMITH
A494: WILLIAMSTOWN | D494: FREW 2 | F494: WARREN 2 | I494: BEER | K494: JOHNS | M494: WALKER | O494: QUINN | Q494: CLAPSON
A496: ROUND 11 | E496: 30TH JUNE | J496: WEATHER | M496: FINE NORTH WIND | S496: PLAYED AT | X496: LADDER | AB496: ROUND | AD496: 11
D497: 1ST QTR | H497: 2ND QTR | L497: 3RD QTR | P497: FINAL | S497: PRESTON
A498: PRESTON | C498: 3 | D498: 5 | E498: =C498*6+D498 -> 23 | G498: 3 | H498: 10 | I498: =G498*6+H498 -> 28 | K498: 10 | L498: 14 | M498: =K498*6+L498 -> 74 | O498: 11 | P498: 14 | Q498: =O498*6+P498 -> 80 | S498: UMPIRE | W498: TEAM | X498: W | Y498: L | Z498: D | AA498: FOR | AB498: AGST | AC498: % | AD498: PTS
A499: CAMBERWELL | C499: 0 | D499: 1 | E499: =C499*6+D499 -> 1 | G499: 3 | H499: 5 | I499: =G499*6+H499 -> 23 | K499: 5 | L499: 6 | M499: =K499*6+L499 -> 36 | O499: 5 | P499: 10 | Q499: =O499*6+P499 -> 40 | S499: BLACKBURN
A500: BEST PLAYERS | W500: COBURG | X500: 10 | Y500: 1 | Z500: 0 | AA500: 1018 | AB500: 610 | AC500: 166.88524590163934 | AD500: 40
A501: PRESTON | D501: BRIDGFORD | G501: DOUGLAS | I501: SHAW | L501: SUMMERS | O501: STEVENS | Q501: HOLLIDAY | W501: PORT MELBOURNE | X501: 8 | Y501: 3 | Z501: 0 | AA501: 828 | AB501: 580 | AC501: 142.75862068965517 | AD501: 32
A502: CAMBERWELL | D502: GUNNYON | G502: LAKIN | I502: BOOTHMAN | L502: BRIDE | O502: WILLIAMS | Q502: PAGE | W502: CAMBERWELL | X502: 7 | Y502: 4 | Z502: 0 | AA502: 707 | AB502: 639 | AC502: 110.64162754303599 | AD502: 28
A503: GOALKICKERS | S503: NORTHCOTE | W503: BRIGHTON | X503: 7 | Y503: 4 | Z503: 0 | AA503: 824 | AB503: 756 | AC503: 108.994708994709 | AD503: 28
A504: PRESTON | D504: BRIDGFORD 6 | G504: DODD | I504: SUMMERS | L504: STEVENS | N504: MONOHAN | Q504: SHAW
A505: CAMBERWELL | D505: LAKIN 2 | G505: LAWN | I505: WOODFORD | L505: BRIDE | W505: PRESTON | X505: 6 | Y505: 5 | Z505: 0 | AA505: 748 | AB505: 676 | AC505: 110.6508875739645 | AD505: 24
W506: BRUNSWICK | X506: 5 | Y506: 6 | Z506: 0 | AA506: 662 | AB506: 712 | AC506: 92.977528089887642 | AD506: 20
A507: PORT MELBOURNE | C507: 1 | D507: 2 | E507: =C507*6+D507 -> 8 | G507: 5 | H507: 3 | I507: =G507*6+H507 -> 33 | K507: 7 | L507: 6 | M507: =K507*6+L507 -> 48 | O507: 10 | P507: 11 | Q507: =O507*6+P507 -> 71 | S507: BRUNSWICK | W507: YARRAVILLE | X507: 5 | Y507: 6 | Z507: 0 | AA507: 653 | AB507: 714 | AC507: 91.456582633053216 | AD507: 20
A508: BRUNSWICK | C508: 1 | D508: 3 | E508: =C508*6+D508 -> 9 | G508: 3 | H508: 7 | I508: =G508*6+H508 -> 25 | K508: 4 | L508: 10 | M508: =K508*6+L508 -> 34 | O508: 6 | P508: 11 | Q508: =O508*6+P508 -> 47 | S508: CLARK | W508: NORTHCOTE | X508: 3 | Y508: 8 | Z508: 0 | AA508: 682 | AB508: 890 | AC508: 76.629213483146074 | AD508: 12
A509: BEST PLAYERS | W509: WILLIAMSTOWN | X509: 3 | Y509: 8 | Z509: 0 | AA509: 641 | AB509: 871 | AC509: 73.59357060849598 | AD509: 12
A510: PORT MELBOURNE | D510: HYDE | F510: GARBUTT | I510: CARPENTER | L510: BARNES | N510: SKILTON | Q510: PETERSON | W510: PRAHRAN | X510: 1 | Y510: 10 | Z510: 0 | AA510: 682 | AB510: 997 | AC510: 68.405215646940817 | AD510: 4
A511: BRUNSWICK | D511: KENNETT | F511: McFARLANE | I511: ALESSIO | L511: HASSETT | N511: RAYMOND | Q511: EDWARDS
A512: GOALKICKERS
A513: PORT MELBOURNE | D513: KUHLKEN 3 | G513: McINNES 3 | J513: WILKINS | L513: BOURKE | N513: BROOKER | Q513: CARPENTER
A514: BRUNSWICK | D514: HASSETT 2 | G514: LINDSAY 2 | J514: BLACKMORE 2
A516: COBURG | C516: 4 | D516: 4 | E516: =C516*6+D516 -> 28 | G516: 10 | H516: 10 | I516: =G516*6+H516 -> 70 | K516: 12 | L516: 11 | M516: =K516*6+L516 -> 83 | O516: 13 | P516: 16 | Q516: =O516*6+P516 -> 94 | S516: YARRAVILLE
A517: YARRAVILLE | C517: 5 | D517: 4 | E517: =C517*6+D517 -> 34 | G517: 5 | H517: 5 | I517: =G517*6+H517 -> 35 | K517: 8 | L517: 10 | M517: =K517*6+L517 -> 58 | O517: 9 | P517: 13 | Q517: =O517*6+P517 -> 67 | S517: MUTCH
A518: BEST PLAYERS
A519: COBURG | D519: BROOKS | G519: COLBERT | J519: F PLANT | M519: NELSON | P519: CORNELL | S519: MEARS
A520: YARRAVILLE | D520: LYONS | G520: GILL | J520: SHERMAN | M520: HUDD | P520: COULSELL | S520: JOHNSTON
A521: GOALKICKERS
A522: COBURG | D522: F PLANT 5 | G522: COLBERT 2 | J522: HARRIS 2 | M522: REYNOLDS 2 | P522: J PLANT | S522: ROGERS
A523: YARRAVILLE | D523: P BOLMAN 3 | G523: CHAPPLE 2 | J523: JOHNSTON | M523: HUDD | O523: GILL | Q523: MORAN
A525: WILLIAMSTOWN | C525: 1 | D525: 3 | E525: =C525*6+D525 -> 9 | G525: 6 | H525: 7 | I525: =G525*6+H525 -> 43 | K525: 9 | L525: 10 | M525: =K525*6+L525 -> 64 | O525: 13 | P525: 14 | Q525: =O525*6+P525 -> 92 | S525: WILLIAMSTOWN
A526: NORTHCOTE | C526: 1 | D526: 6 | E526: =C526*6+D526 -> 12 | G526: 3 | H526: 7 | I526: =G526*6+H526 -> 25 | K526: 8 | L526: 12 | M526: =K526*6+L526 -> 60 | O526: 9 | P526: 14 | Q526: =O526*6+P526 -> 68 | S526: MURRAY
A527: BEST PLAYERS
A528: WILLIAMSTOWN | D528: CLAUSCEN | G528: BEER | J528: L DREW | M528: CANNON | P528: TAAFE | S528: McKAY
A529: NORTHCOTE | D529: PERKINS | G529: POULTER | J529: BROWN | M529: NICHOLLS | P529: DESLANDES | S529: SEYMOUR
A530: GOALKICKERS
A531: WILLIAMSTOWN | D531: CLAUSCEN 4 | G531: KENNY 4 | J531: SHEEHAN 2 | M531: BEER | N531: WARREN | P531: CANNON
A532: NORTHCOTE | D532: SEYMOUR 5 | G532: HEENAN 2 | J532: DESLANDES 2 | M532: COLE
A534: BRIGHTON | C534: 10 | D534: 5 | E534: =C534*6+D534 -> 65 | G534: 12 | H534: 5 | I534: =G534*6+H534 -> 77 | K534: 14 | L534: 10 | M534: =K534*6+L534 -> 94 | O534: 16 | P534: 13 | Q534: =O534*6+P534 -> 109 | S534: E'WICK
A535: PRAHRAN | C535: 0 | D535: 1 | E535: =C535*6+D535 -> 1 | G535: 6 | H535: 7 | I535: =G535*6+H535 -> 43 | K535: 6 | L535: 7 | M535: =K535*6+L535 -> 43 | O535: 11 | P535: 10 | Q535: =O535*6+P535 -> 76 | S535: LESTER
A536: BEST PLAYERS
A537: BRIGHTON | D537: GARCIA | G537: STEWART | J537: WEBB | M537: STOREY | P537: V WRIGHT | S537: EVERETT
A538: PRAHRAN | D538: LETCHER | G538: SHORT | J538: E JONES | M538: J SMITH | P538: F SMITH | S538: LORD
A539: GOALKICKERS
A540: BRIGHTON | D540: BURNES 4 | F540: WALSH 3 | I540: MATTHEWS 2 | L540: HUNT 2 | N540: V WRIGHT 2 | Q540: BORLAND | S540: ULBRICK
A541: PRAHRAN | D541: J SMITH 4 | G541: SHORT 4 | J541: PRYOR | L541: JAMES | N541: PAGE
A543: ROUND 12 | E543: 7TH JULY | H543: WEATHER | K543: CLOUDY BUT FINE NORTH BREEZE | S543: PLAYED AT | X543: LADDER | AB543: ROUND | AD543: 12
D544: 1ST QTR | H544: 2ND QTR | L544: 3RD QTR | P544: FINAL | S544: PORT MELBOURNE
A545: PORT MELBOURNE | C545: 5 | D545: 4 | E545: =C545*6+D545 -> 34 | G545: 9 | H545: 9 | I545: =G545*6+H545 -> 63 | K545: 9 | L545: 11 | M545: =K545*6+L545 -> 65 | O545: 13 | P545: 13 | Q545: =O545*6+P545 -> 91 | S545: UMPIRE | W545: TEAM | X545: W | Y545: L | Z545: D | AA545: FOR | AB545: AGST | AC545: % | AD545: PTS
A546: COBURG | C546: 1 | D546: 4 | E546: =C546*6+D546 -> 10 | G546: 3 | H546: 5 | I546: =G546*6+H546 -> 23 | K546: 6 | L546: 9 | M546: =K546*6+L546 -> 45 | O546: 8 | P546: 9 | Q546: =O546*6+P546 -> 57 | S546: MURRAY
A547: BEST PLAYERS | W547: COBURG | X547: 10 | Y547: 2 | Z547: 0 | AA547: 1075 | AB547: 701 | AC547: 153.35235378031385 | AD547: 40
A548: PORT MELBOURNE | D548: CROMPTON | G548: HYDE | I548: SMITH | L548: ATKINSON | O548: PETERSON | Q548: CARPENTER | W548: PORT MELBOURNE | X548: 9 | Y548: 3 | Z548: 0 | AA548: 919 | AB548: 637 | AC548: 144.27001569858712 | AD548: 36
A549: COBURG | D549: CHAPMAN | G549: HARRIS | I549: MEARS | L549: BROOKS | O549: JENKINS | Q549: J PLANT | W549: BRIGHTON | X549: 8 | Y549: 4 | Z549: 0 | AA549: 952 | AB549: 835 | AC549: 114.0119760479042 | AD549: 32
A550: GOALKICKERS | W550: CAMBERWELL | X550: 8 | Y550: 4 | Z550: 0 | AA550: 826 | AB550: 726 | AC550: 113.77410468319559 | AD550: 32
A551: PORT MELBOURNE | D551: KUHLKEN 4 | F551: WILKINS 3 | I551: McINNES 2 | L551: SMITH | N551: HARVEY | P551: BOURKE | R551: HYDE
A552: COBURG | D552: F PLANT 4 | G552: O'BRIEN 2 | I552: MEARS | K552: BLACKMAN | W552: PRESTON | X552: 7 | Y552: 5 | Z552: 0 | AA552: 848 | AB552: 711 | AC552: 119.26863572433193 | AD552: 28
W553: BRUNSWICK | X553: 5 | Y553: 7 | Z553: 0 | AA553: 749 | AB553: 831 | AC553: 90.132370637785797 | AD553: 20
A554: CAMBERWELL | C554: 8 | D554: 5 | E554: =C554*6+D554 -> 53 | G554: 9 | H554: 5 | I554: =G554*6+H554 -> 59 | K554: 17 | L554: 11 | M554: =K554*6+L554 -> 113 | O554: 18 | P554: 11 | Q554: =O554*6+P554 -> 119 | S554: CAMBERWELL | W554: YARRAVILLE | X554: 5 | Y554: 7 | Z554: 0 | AA554: 732 | AB554: 842 | AC554: 86.935866983372918 | AD554: 20
A555: BRUNSWICK | C555: 1 | D555: 1 | E555: =C555*6+D555 -> 7 | G555: 7 | H555: 5 | I555: =G555*6+H555 -> 47 | K555: 10 | L555: 7 | M555: =K555*6+L555 -> 67 | O555: 13 | P555: 9 | Q555: =O555*6+P555 -> 87 | S555: LESTER | W555: NORTHCOTE | X555: 3 | Y555: 9 | Z555: 0 | AA555: 755 | AB555: 982 | AC555: 76.883910386965383 | AD555: 12
A556: BEST PLAYERS | W556: WILLIAMSTOWN | X556: 3 | Y556: 9 | Z556: 0 | AA556: 676 | AB556: 971 | AC556: 69.618949536560251 | AD556: 12
A557: CAMBERWELL | D557: HARRISON | G557: GUNNYON | J557: LAWN | M557: GOUGH | P557: LAKIN | R557: G CALWELL | W557: PRAHRAN | X557: 2 | Y557: 10 | Z557: 0 | AA557: 774 | AB557: 1070 | AC557: 72.336448598130843 | AD557: 8
A558: BRUNSWICK | D558: HASSETT | G558: BLACKMORE | J558: EDWARDS | M558: PROUDFOOT | P558: CARTON | R558: KENNETT
A559: GOALKICKERS
A560: CAMBERWELL | D560: BROWN 4 | F560: WOODFORD 4 | I560: LAKIN 3 | K560: GOUGH 2 | M560: LAWN 2 | O560: G CALWELL | R560: PAGE | T560: EGAN
A561: BRUNSWICK | D561: STEELE 3 | F561: McINERNEY 2 | I561: BARRIE 2 | K561: BLACKMORE 2 | N561: PROUDFOOT | Q561: WRIGHT | S561: ALESSIO | U561: HASSETT
A563: BRIGHTON | C563: 2 | D563: 7 | E563: =C563*6+D563 -> 19 | G563: 11 | H563: 12 | I563: =G563*6+H563 -> 78 | K563: 13 | L563: 15 | M563: =K563*6+L563 -> 93 | O563: 18 | P563: 20 | Q563: =O563*6+P563 -> 128 | S563: E'WICK
A564: YARRAVILLE | C564: 1 | D564: 5 | E564: =C564*6+D564 -> 11 | G564: 5 | H564: 7 | I564: =G564*6+H564 -> 37 | K564: 9 | L564: 12 | M564: =K564*6+L564 -> 66 | O564: 11 | P564: 13 | Q564: =O564*6+P564 -> 79 | S564: FROOD
A565: BEST PLAYERS
A566: BRIGHTON | D566: MATTHEWS | G566: WEBB | J566: TROOD | M566: CARROLL | P566: ARTHUR | S566: BURNES
A567: YARRAVILLE | D567: SHERMAN | G567: KENNEDY | J567: HUDD | M567: KNOTT | P567: MOLONEY | S567: COULSELL
A568: GOALKICKERS
A569: BRIGHTON | D569: WALSH 5 | G569: BURNES 4 | J569: MATTHEWS 3 | M569: NOONAN 3 | P569: CARROLL 2 | S569: WRIGHT
A570: YARRAVILLE | D570: CHAPPLE 4 | G570: COULSELL 3 | J570: KENNEDY | L570: FROUD | N570: KNOTT | P570: McCARNEY
A572: PRAHRAN | C572: 1 | D572: 2 | E572: =C572*6+D572 -> 8 | G572: 7 | H572: 6 | I572: =G572*6+H572 -> 48 | K572: 11 | L572: 7 | M572: =K572*6+L572 -> 73 | O572: 14 | P572: 8 | Q572: =O572*6+P572 -> 92 | S572: NORTHCOTE
A573: NORTHCOTE | C573: 6 | D573: 2 | E573: =C573*6+D573 -> 38 | G573: 6 | H573: 5 | I573: =G573*6+H573 -> 41 | K573: 8 | L573: 8 | M573: =K573*6+L573 -> 56 | O573: 10 | P573: 13 | Q573: =O573*6+P573 -> 73 | S573: McKINNON
A574: BEST PLAYERS
A575: PRAHRAN | D575: LORD | G575: TULLOH | J575: LETCHER | M575: F SMITH | P575: SHORT | S575: GLOVER
A576: NORTHCOTE | D576: PERKINS | G576: SEYMOUR | J576: HEENAN | M576: COLE | P576: NICHOLLS | S576: WHITE
A577: GOALKICKERS
A578: PRAHRAN | D578: ALBERRY 3 | F578: ANTHONY 2 | I578: LORD 2 | K578: J SMITH 2 | N578: SHORT | P578: TULLOH | R578: OSBORNE | U578: PAGE
A579: NORTHCOTE | D579: STANLEY 2 | G579: HEENAN 2 | I579: SEYMOUR | K579: DILLON | M579: COLE | N579: WHITE | P579: DESLANDES
A581: PRESTON | C581: 4 | D581: 3 | E581: =C581*6+D581 -> 27 | G581: 5 | H581: 9 | I581: =G581*6+H581 -> 39 | K581: 9 | L581: 20 | M581: =K581*6+L581 -> 74 | O581: 13 | P581: 22 | Q581: =O581*6+P581 -> 100 | S581: PRESTON
A582: WILLIAMSTOWN | C582: 1 | D582: 3 | E582: =C582*6+D582 -> 9 | G582: 3 | H582: 5 | I582: =G582*6+H582 -> 23 | K582: 3 | L582: 8 | M582: =K582*6+L582 -> 26 | O582: 4 | P582: 11 | Q582: =O582*6+P582 -> 35 | S582: BLACKBURN
A583: BEST PLAYERS
A584: PRESTON | D584: MILLER | G584: SEEBECK | J584: DOUGLAS | M584: MONOHAN | P584: G TAYLOR | S584: HOLLIDAY
A585: WILLIAMSTOWN | D585: BEER | G585: WARREN | J585: OUTEN | M585: TAAFE | P585: GODWILL | S585: CLAUSCEN
A586: GOALKICKERS
A587: PRESTON | D587: ADAMS 3 | F587: JOHNSTONE 2 | I587: STEVENS 2 | K587: G TAYLOR | M587: DODD | N587: CAMPBELL | Q587: DOUGLAS | S587: SHAW | U587: MONOHAN
A588: WILLIAMSTOWN | D588: OUTEN 3 | G588: CLAUSCEN
A590: ROUND 13 | E590: 7TH JULY | H590: WEATHER | K590: CLOUDY BUT FINE STRONG NORTH WIND | S590: PLAYED AT | X590: LADDER | AB590: ROUND | AD590: 13
D591: 1ST QTR | H591: 2ND QTR | L591: 3RD QTR | P591: FINAL | S591: PORT MELBOURNE
A592: PORT MELBOURNE | C592: 2 | D592: 2 | E592: =C592*6+D592 -> 14 | G592: 6 | H592: 4 | I592: =G592*6+H592 -> 40 | K592: 9 | L592: 4 | M592: =K592*6+L592 -> 58 | O592: 14 | P592: 6 | Q592: =O592*6+P592 -> 90 | S592: UMPIRE | W592: TEAM | X592: W | Y592: L | Z592: D | AA592: FOR | AB592: AGST | AC592: % | AD592: PTS
A593: CAMBERWELL | C593: 1 | D593: 3 | E593: =C593*6+D593 -> 9 | G593: 5 | H593: 7 | I593: =G593*6+H593 -> 37 | K593: 9 | L593: 9 | M593: =K593*6+L593 -> 63 | O593: 12 | P593: 11 | Q593: =O593*6+P593 -> 83 | S593: BLACKBURN
A594: BEST PLAYERS
A595: PORT MELBOURNE | D595: HARVEY | F595: SKILTON | I595: SMITH | K595: WILKINS | N595: BOURKE | Q595: HYDE | W595: COBURG | X595: 11 | Y595: 2 | Z595: 0 | AA595: 1211 | AB595: 743 | AC595: 162.98788694481831 | AD595: 44
A596: CAMBERWELL | D596: PAGE | F596: L WILLIAMS | I596: STEVENS | K596: LAKIN | N596: GREENWOOD | Q596: HARRISON | W596: PORT MELBOURNE | X596: 10 | Y596: 3 | Z596: 0 | AA596: 1009 | AB596: 720 | AC596: 140.13888888888889 | AD596: 40
A597: GOALKICKERS | W597: BRIGHTON | X597: 9 | Y597: 4 | Z597: 0 | AA597: 1054 | AB597: 873 | AC597: 120.73310423825887 | AD597: 36
A598: PORT MELBOURNE | D598: KUHLKEN 5 | G598: FORBES 4 | I598: SMITH | K598: BOURKE | M598: WILKINS | O598: ATKINSON | Q598: SKILTON | W598: PRESTON | X598: 8 | Y598: 5 | Z598: 0 | AA598: 922 | AB598: 766 | AC598: 120.36553524804178 | AD598: 32
A599: CAMBERWELL | D599: R WILLIAMS 3 | G599: GOUGH 3 | I599: LAKIN 3 | K599: LAWN 2 | M599: BRIDE
W600: CAMBERWELL | X600: 8 | Y600: 5 | Z600: 0 | AA600: 909 | AB600: 816 | AC600: 111.39705882352941 | AD600: 32
A601: PRESTON | C601: 6 | D601: 4 | E601: =C601*6+D601 -> 40 | G601: 6 | H601: 8 | I601: =G601*6+H601 -> 44 | K601: 8 | L601: 15 | M601: =K601*6+L601 -> 63 | O601: 9 | P601: 20 | Q601: =O601*6+P601 -> 74 | S601: YARRAVILLE | W601: BRUNSWICK | X601: 6 | Y601: 7 | Z601: 0 | AA601: 834 | AB601: 890 | AC601: 93.707865168539328 | AD601: 24
A602: YARRAVILLE | C602: 1 | D602: 0 | E602: =C602*6+D602 -> 6 | G602: 3 | H602: 6 | I602: =G602*6+H602 -> 24 | K602: 4 | L602: 8 | M602: =K602*6+L602 -> 32 | O602: 7 | P602: 13 | Q602: =O602*6+P602 -> 55 | S602: FROOD | W602: YARRAVILLE | X602: 5 | Y602: 8 | Z602: 0 | AA602: 787 | AB602: 916 | AC602: 85.917030567685586 | AD602: 20
A603: BEST PLAYERS | W603: NORTHCOTE | X603: 3 | Y603: 10 | Z603: 0 | AA603: 814 | AB603: 1067 | AC603: 76.288659793814432 | AD603: 12
A604: PRESTON | D604: TAYLOR | G604: SUMMERS | J604: MILLER | L604: DODD | N604: BRIDGFORD | Q604: MARNEY | W604: WILLIAMSTOWN | X604: 3 | Y604: 10 | Z604: 0 | AA604: 714 | AB604: 1073 | AC604: 66.54240447343895 | AD604: 12
A605: YARRAVILLE | D605: MOLONEY | G605: JOHNSTON | J605: HUDD | L605: KNOTT | N605: LYONS | Q605: KENNEDY | W605: PRAHRAN | X605: 2 | Y605: 11 | Z605: 0 | AA605: 816 | AB605: 1206 | AC605: 67.661691542288551 | AD605: 8
A606: GOALKICKERS
A607: PRESTON | D607: DODD 2 | F607: MARNEY | H607: BRIDGFORD | J607: SUMMERS | M607: STEVENS | O607: SHAW | Q607: ADAMS | S607: JOHNSTONE
A608: YARRAVILLE | D608: LYONS 2 | F608: GILL | H608: JOYCE | J608: COULSELL | M608: A LEONARD | P608: HUDD
A610: BRUNSWICK | C610: 2 | D610: 2 | E610: =C610*6+D610 -> 14 | G610: 3 | H610: 8 | I610: =G610*6+H610 -> 26 | K610: 7 | L610: 10 | M610: =K610*6+L610 -> 52 | O610: 12 | P610: 13 | Q610: =O610*6+P610 -> 85 | S610: BRUNSWICK
A611: NORTHCOTE | C611: 2 | D611: 0 | E611: =C611*6+D611 -> 12 | G611: 3 | H611: 2 | I611: =G611*6+H611 -> 20 | K611: 5 | L611: 4 | M611: =K611*6+L611 -> 34 | O611: 9 | P611: 5 | Q611: =O611*6+P611 -> 59 | S611: MAKER
A612: BEST PLAYERS
A613: BRUNSWICK | D613: PROUDFOOT | G613: GREENWOOD | J613: HARRIS | M613: RALEIGH | P613: STEELE | S613: ALLISON
A614: NORTHCOTE | D614: PERKINS | G614: SEYMOUR | J614: NICHOLLS | M614: HOULDECROFT | P614: STANLEY | S614: ANDREWS
A615: GOALKICKERS
A616: BRUNSWICK | D616: FARROW 4 | G616: GREENWOOD 3 | J616: KENNETT 2 | M616: HASSETT | O616: STEELE | Q616: RALEIGH
A617: NORTHCOTE | D617: SEYMOUR 5 | G617: HEENAN | J617: HOULDECROFT | M617: WHITE | O617: STANLEY
A619: BRIGHTON | C619: 1 | D619: 3 | E619: =C619*6+D619 -> 9 | G619: 7 | H619: 6 | I619: =G619*6+H619 -> 48 | K619: 9 | L619: 8 | M619: =K619*6+L619 -> 62 | O619: 15 | P619: 12 | Q619: =O619*6+P619 -> 102 | S619: WILLIAMSTOWN
A620: WILLIAMSTOWN | C620: 3 | D620: 2 | E620: =C620*6+D620 -> 20 | G620: 4 | H620: 5 | I620: =G620*6+H620 -> 29 | K620: 5 | L620: 8 | M620: =K620*6+L620 -> 38 | O620: 5 | P620: 8 | Q620: =O620*6+P620 -> 38 | S620: PAYNE
A621: BEST PLAYERS
A622: BRIGHTON | D622: GARCIA | G622: DAINTY | J622: CARROLL | M622: TROOD | P622: MATTHEWS | S622: WALSH
A623: WILLIAMSTOWN | D623: McKAY | G623: L DREW | J623: JOHNS | M623: FURLONG | P623: MUNRO | S623: CANNON
A624: GOALKICKERS
A625: BRIGHTON | D625: WALSH 5 | G625: MATTHEWS 4 | J625: BORLAND 2 | M625: NOONAN 2 | P625: WEBB
A626: WILLIAMSTOWN | D626: SMITH 2 | G626: FREW | J626: KENNY | M626: CANNON
A628: COBURG | C628: 7 | D628: 9 | E628: =C628*6+D628 -> 51 | G628: 11 | H628: 15 | I628: =G628*6+H628 -> 81 | K628: 16 | L628: 20 | M628: =K628*6+L628 -> 116 | O628: 19 | P628: 22 | Q628: =O628*6+P628 -> 136 | S628: COBURG
A629: PRAHRAN | C629: 1 | D629: 0 | E629: =C629*6+D629 -> 6 | G629: 1 | H629: 3 | I629: =G629*6+H629 -> 9 | K629: 2 | L629: 3 | M629: =K629*6+L629 -> 15 | O629: 6 | P629: 6 | Q629: =O629*6+P629 -> 42 | S629: McKINNON
A630: BEST PLAYERS
A631: COBURG | D631: JENKINS | G631: MEARS | J631: F PLANT | M631: MILLARD | P631: WATT | S631: McALPINE
A632: PRAHRAN | D632: LORD | G632: F SMITH | J632: ANDERSON | M632: SHORT | P632: TULLOH | S632: J SMITH
A633: GOALKICKERS
A634: COBURG | D634: F PLANT 7 | F634: CORNELL 4 | I634: HARRIS 2 | K634: COLBERT 2 | N634: BROOKS | P634: GARDINER | R634: STONE | T634: MEARS
A635: PRAHRAN | D635: SHORT 2 | F635: LORD | H635: J SMITH | J635: RITCHIE | M635: JAMES
A637: ROUND 14 | E637: 21ST JULY | H637: WEATHER | K637: LIGHT SHOWERS A.M. CLOUDY WEST WIND | S637: PLAYED AT | X637: LADDER | AB637: ROUND | AD637: 14
D638: 1ST QTR | H638: 2ND QTR | L638: 3RD QTR | P638: FINAL | S638: COBURG
A639: BRIGHTON | C639: 3 | D639: 2 | E639: =C639*6+D639 -> 20 | G639: 5 | H639: 12 | I639: =G639*6+H639 -> 42 | K639: 7 | L639: 16 | M639: =K639*6+L639 -> 58 | O639: 9 | P639: 18 | Q639: =O639*6+P639 -> 72 | S639: UMPIRE | W639: TEAM | X639: W | Y639: L | Z639: D | AA639: FOR | AB639: AGST | AC639: % | AD639: PTS
A640: COBURG | C640: 3 | D640: 4 | E640: =C640*6+D640 -> 22 | G640: 6 | H640: 7 | I640: =G640*6+H640 -> 43 | K640: 8 | L640: 8 | M640: =K640*6+L640 -> 56 | O640: 10 | P640: 10 | Q640: =O640*6+P640 -> 70 | S640: MURRAY
A641: BEST PLAYERS | W641: COBURG | X641: 11 | Y641: 3 | Z641: 0 | AA641: 1281 | AB641: 815 | AC641: 157.17791411042944 | AD641: 44
A642: BRIGHTON | D642: STEWART | F642: GARCIA | I642: ARTHUR | L642: WEBB | N642: ELLIOTT | Q642: CARROLL | W642: PORT MELBOURNE | X642: 11 | Y642: 3 | Z642: 0 | AA642: 1102 | AB642: 771 | AC642: 142.93125810635539 | AD642: 44
A643: COBURG | D643: MEARS | F643: BROOKS | I643: JENKINS | L643: CORNELL | N643: HARRIS | Q643: MILLARD | W643: BRIGHTON | X643: 10 | Y643: 4 | Z643: 0 | AA643: 1126 | AB643: 943 | AC643: 119.40615058324497 | AD643: 40
A644: GOALKICKERS | W644: PRESTON | X644: 9 | Y644: 5 | Z644: 0 | AA644: 998 | AB644: 831 | AC644: 120.09626955475331 | AD644: 36
A645: BRIGHTON | D645: WALSH 3 | G645: MATTHEWS 2 | J645: NOONAN | L645: HUNT | N645: ULBRICK | P645: DORE
A646: COBURG | D646: HARRIS 3 | G646: MEARS 3 | J646: F PLANT 2 | M646: STONE | O646: BROOKS | W646: CAMBERWELL | X646: 9 | Y646: 5 | Z646: 0 | AA646: 985 | AB646: 864 | AC646: 114.00462962962963 | AD646: 36
W647: BRUNSWICK | X647: 6 | Y647: 8 | Z647: 0 | AA647: 899 | AB647: 966 | AC647: 93.064182194616976 | AD647: 24
A648: PRESTON | C648: 0 | D648: 3 | E648: =C648*6+D648 -> 3 | G648: 4 | H648: 8 | I648: =G648*6+H648 -> 32 | K648: 6 | L648: 11 | M648: =K648*6+L648 -> 47 | O648: 10 | P648: 16 | Q648: =O648*6+P648 -> 76 | S648: PRESTON | W648: YARRAVILLE | X648: 6 | Y648: 8 | Z648: 0 | AA648: 909 | AB648: 985 | AC648: 92.28426395939087 | AD648: 24
A649: BRUNSWICK | C649: 4 | D649: 1 | E649: =C649*6+D649 -> 25 | G649: 5 | H649: 2 | I649: =G649*6+H649 -> 32 | K649: 10 | L649: 5 | M649: =K649*6+L649 -> 65 | O649: 10 | P649: 5 | Q649: =O649*6+P649 -> 65 | S649: McKINNON | W649: NORTHCOTE | X649: 3 | Y649: 11 | Z649: 0 | AA649: 865 | AB649: 1160 | AC649: 74.568965517241381 | AD649: 12
A650: BEST PLAYERS | W650: WILLIAMSTOWN | X650: 3 | Y650: 11 | Z650: 0 | AA650: 762 | AB650: 1149 | AC650: 66.318537859007833 | AD650: 12
A651: PRESTON | D651: ADAMS | F651: JOHNSTONE | I651: SEEBECK | L651: BRIDGFORD | O651: STEVENS | R651: SHAW | W651: PRAHRAN | X651: 2 | Y651: 12 | Z651: 0 | AA651: 885 | AB651: 1328 | AC651: 66.641566265060234 | AD651: 8
A652: BRUNSWICK | D652: RAYMOND | F652: WHITELEY | I652: BLACKMORE | L652: FARROW | O652: GREENWOOD | R652: HARRIS
A653: GOALKICKERS
A654: PRESTON | D654: ADAMS 3 | G654: BRIDGFORD 2 | K654: STEVENS 2 | N654: SUMMERS
A655: BRUNSWICK | D655: STEELE 4 | G655: GREENWOOD 3 | K655: FARROW 2 | N655: ALESSIO
A657: YARRAVILLE | C657: 4 | D657: 6 | E657: =C657*6+D657 -> 30 | G657: 7 | H657: 10 | I657: =G657*6+H657 -> 52 | K657: 13 | L657: 18 | M657: =K657*6+L657 -> 96 | O657: 16 | P657: 26 | Q657: =O657*6+P657 -> 122 | S657: YARRAVILLE
A658: PRAHRAN | C658: 1 | D658: 3 | E658: =C658*6+D658 -> 9 | G658: 4 | H658: 7 | I658: =G658*6+H658 -> 31 | K658: 7 | L658: 11 | M658: =K658*6+L658 -> 53 | O658: 9 | P658: 15 | Q658: =O658*6+P658 -> 69 | S658: BLACKBURN
A659: BEST PLAYERS
A660: YARRAVILLE | D660: LYONS | F660: GILL | H660: COULSELL | J660: CHAPPLE | M660: McCARNEY | P660: J BOLMAN
A661: PRAHRAN | D661: TULLOH | F661: LORD | H661: FIDLER | J661: ALLEN | M661: ALBERRY | P661: GLOVER
A662: GOALKICKERS
A663: YARRAVILLE | D663: CHAPPLE 6 | G663: McCARNEY 6 | J663: A LEONARD 2 | M663: LYONS | O663: COULSELL
A664: PRAHRAN | D664: TULLOH 3 | G664: LORD 2 | J664: SHORT | L664: ALBERRY
A666: CAMBERWELL | C666: 2 | D666: 11 | E666: =C666*6+D666 -> 23 | G666: 2 | H666: 16 | I666: =G666*6+H666 -> 28 | K666: 4 | L666: 30 | M666: =K666*6+L666 -> 54 | O666: 7 | P666: 34 | Q666: =O666*6+P666 -> 76 | S666: CAMBERWELL
A667: WILLIAMSTOWN | C667: 3 | D667: 0 | E667: =C667*6+D667 -> 18 | G667: 6 | H667: 5 | I667: =G667*6+H667 -> 41 | K667: 7 | L667: 5 | M667: =K667*6+L667 -> 47 | O667: 7 | P667: 6 | Q667: =O667*6+P667 -> 48 | S667: MUTCH
A668: BEST PLAYERS
A669: CAMBERWELL | D669: GUNNYON | G669: LAWN | I669: L WILLIAMS | L669: PAGE | N669: GREENWOOD | Q669: H CALWELL
A670: WILLIAMSTOWN | D670: McKAY | G670: KENNY | I670: MUNRO | L670: TAAFE | N670: CLAUSCEN | Q670: QUINN
A671: GOALKICKERS
A672: CAMBERWELL | D672: GUNNYON 3 | G672: GOUGH 2 | J672: LAWN | L672: R WILLIAMS
A673: WILLIAMSTOWN | D673: KENNY 3 | G673: MUNRO 2 | J673: QUINN | L673: CANNON
A675: PORT MELBOURNE | C675: 1 | D675: 6 | E675: =C675*6+D675 -> 12 | G675: 4 | H675: 11 | I675: =G675*6+H675 -> 35 | K675: 7 | L675: 16 | M675: =K675*6+L675 -> 58 | O675: 12 | P675: 21 | Q675: =O675*6+P675 -> 93 | S675: NORTHCOTE
A676: NORTHCOTE | C676: 2 | D676: 2 | E676: =C676*6+D676 -> 14 | G676: 2 | H676: 5 | I676: =G676*6+H676 -> 17 | K676: 3 | L676: 8 | M676: =K676*6+L676 -> 26 | O676: 7 | P676: 9 | Q676: =O676*6+P676 -> 51 | S676: LESTER
A677: BEST PLAYERS
A678: PORT MELBOURNE | D678: GARBUTT | G678: KUHLKEN | I678: CARPENTER | L678: CROMPTON | O678: McINNES | R678: ATKINSON
A679: NORTHCOTE | D679: POULTER | G679: PERKINS | I679: GARRETT | L679: HEENAN | O679: SEYMOUR | R679: ALDRIDGE
A680: GOALKICKERS
A681: PORT MELBOURNE | D681: KUHLKEN 6 | G681: FORBES | I681: ATKINSON | L681: HYDE | N681: McINNES | Q681: BROOKEER | T681: BARNES
A682: NORTHCOTE | D682: SEYMOUR 2 | G682: ALDRIDGE | I682: POULTER | L682: LAFFY | N682: WHITE | Q682: BYRNE
A684: ROUND 15 | E684: 28TH JULY | J684: WEATHER | M684: FINE | S684: PLAYED AT | X684: LADDER | AB684: ROUND | AD684: 15
D685: 1ST QTR | H685: 2ND QTR | L685: 3RD QTR | P685: FINAL | S685: PORT MELBOURNE
A686: PORT MELBOURNE | C686: 4 | D686: 1 | E686: =C686*6+D686 -> 25 | G686: 5 | H686: 5 | I686: =G686*6+H686 -> 35 | K686: 6 | L686: 9 | M686: =K686*6+L686 -> 45 | O686: 11 | P686: 12 | Q686: =O686*6+P686 -> 78 | S686: UMPIRE | W686: TEAM | X686: W | Y686: L | Z686: D | AA686: FOR | AB686: AGST | AC686: % | AD686: PTS
A687: PRESTON | C687: 4 | D687: 1 | E687: =C687*6+D687 -> 25 | G687: 7 | H687: 2 | I687: =G687*6+H687 -> 44 | K687: 7 | L687: 3 | M687: =K687*6+L687 -> 45 | O687: 9 | P687: 3 | Q687: =O687*6+P687 -> 57 | S687: MURRAY
A688: BEST PLAYERS | W688: COBURG | X688: 12 | Y688: 3 | Z688: 0 | AA688: 1438 | AB688: 885 | AC688: 162.4858757062147 | AD688: 48
A689: PORT MELBOURNE | D689: PETERSON | F689: FREYER | I689: GARBUTT | L689: FARNAN | N689: HYDE | P689: SMITH | W689: PORT MELBOURNE | X689: 12 | Y689: 3 | Z689: 0 | AA689: 1180 | AB689: 828 | AC689: 142.51207729468598 | AD689: 48
A690: PRESTON | D690: WHITE | F690: JOHNSTONE | I690: DOUGLAS | L690: MILLER | N690: HUME | P690: MARNEY | W690: BRIGHTON | X690: 11 | Y690: 4 | Z690: 0 | AA690: 1237 | AB690: 1002 | AC690: 123.45309381237524 | AD690: 44
A691: GOALKICKERS | W691: PRESTON | X691: 9 | Y691: 6 | Z691: 0 | AA691: 1055 | AB691: 909 | AC691: 116.06160616061607 | AD691: 36
A692: PORT MELBOURNE | D692: FREYER 3 | F692: KUHLKEN 2 | I692: HYDE 2 | K692: BOURKE | M692: WILKINS | O692: FORBES | Q692: SMITH
A693: PRESTON | D693: HUME 4 | F693: ADAMS 2 | I693: BRIDGFORD 2 | L693: HAYES | W693: CAMBERWELL | X693: 9 | Y693: 6 | Z693: 0 | AA693: 1044 | AB693: 975 | AC693: 107.07692307692308 | AD693: 36
W694: YARRAVILLE | X694: 7 | Y694: 8 | Z694: 0 | AA694: 969 | AB694: 1042 | AC694: 92.99 | AD694: 28
A695: BRIGHTON | C695: 3 | D695: 5 | E695: =C695*6+D695 -> 23 | G695: 7 | H695: 7 | I695: =G695*6+H695 -> 49 | K695: 13 | L695: 11 | M695: =K695*6+L695 -> 89 | O695: 16 | P695: 15 | Q695: =O695*6+P695 -> 111 | S695: E'WICK | W695: BRUNSWICK | X695: 6 | Y695: 9 | Z695: 0 | AA695: 956 | AB695: 1026 | AC695: 93.18 | AD695: 24
A696: CAMBERWELL | C696: 2 | D696: 3 | E696: =C696*6+D696 -> 15 | G696: 5 | H696: 8 | I696: =G696*6+H696 -> 38 | K696: 7 | L696: 10 | M696: =K696*6+L696 -> 52 | O696: 8 | P696: 11 | Q696: =O696*6+P696 -> 59 | S696: MUTCH | W696: NORTHCOTE | X696: 3 | Y696: 12 | Z696: 0 | AA696: 935 | AB696: 1317 | AC696: 70.99 | AD696: 12
A697: BEST PLAYERS | W697: PRAHRAN | X697: 3 | Y697: 12 | Z697: 0 | AA697: 967 | AB697: 1403 | AC697: 68.92 | AD697: 12
A698: BRIGHTON | D698: ARTHUR | G698: CARROLL | I698: DAINTY | L698: FITT | N698: GARCIA | Q698: ELLIOTT | W698: WILLIAMSTOWN | X698: 3 | Y698: 12 | Z698: 0 | AA698: 837 | AB698: 1231 | AC698: 67.99 | AD698: 12
A699: CAMBERWELL | D699: GREENWOOD | G699: PAGE | I699: STEVENS | L699: EGAN | N699: LAWN | Q699: L WILLIAMS
A700: GOALKICKERS
A701: BRIGHTON | D701: WALSH 7 | F701: NOONAN 2 | I701: WEBB 2 | K701: MATTHEWS | N701: BURNES | P701: HUNT | R701: ULBRICK | U701: FITT
A702: CAMBERWELL | D702: LAWN 2 | F702: GOUGH 2 | I702: R WILLIAMS 2 | L702: GREENBURY | O702: PRICE
A704: YARRAVILLE | C704: 1 | D704: 2 | E704: =C704*6+D704 -> 8 | G704: 6 | H704: 3 | I704: =G704*6+H704 -> 39 | K704: 7 | L704: 4 | M704: =K704*6+L704 -> 46 | O704: 9 | P704: 6 | Q704: =O704*6+P704 -> 60 | S704: BRUNSWICK
A705: BRUNSWICK | C705: 1 | D705: 4 | E705: =C705*6+D705 -> 10 | G705: 1 | H705: 10 | I705: =G705*6+H705 -> 16 | K705: 1 | L705: 16 | M705: =K705*6+L705 -> 22 | O705: 6 | P705: 21 | Q705: =O705*6+P705 -> 57 | S705: LESTER
A706: BEST PLAYERS
A707: YARRAVILLE | D707: CHAPPLE | G707: HUDD | I707: BOLMAN | L707: JOYCE | O707: GILL | R707: COULSELL
A708: BRUNSWICK | D708: HARRIS | G708: STEELE | I708: RALEIGH | L708: RAYMOND | O708: WHITELEY | R708: PROUDFOOT
A709: GOALKICKERS
A710: YARRAVILLE | D710: CHAPPLE 4 | G710: JOHNSTON | J710: KENNEDY | L710: LYONS | N710: TRAVERS | P710: McCARNEY
A711: BRUNSWICK | D711: GREENWOOD 2 | G711: RAYMOND | J711: McINERNEY | M711: FARROW | P711: BARRIE
A713: PRAHRAN | C713: 0 | D713: 3 | E713: =C713*6+D713 -> 3 | G713: 2 | H713: 12 | I713: =G713*6+H713 -> 24 | K713: 8 | L713: 14 | M713: =K713*6+L713 -> 62 | O713: 11 | P713: 16 | Q713: =O713*6+P713 -> 82 | S713: WILLIAMSTOWN
A714: WILLIAMSTOWN | C714: 4 | D714: 6 | E714: =C714*6+D714 -> 30 | G714: 6 | H714: 8 | I714: =G714*6+H714 -> 44 | K714: 7 | L714: 12 | M714: =K714*6+L714 -> 54 | O714: 10 | P714: 15 | Q714: =O714*6+P714 -> 75 | S714: HUNTINGTON
A715: BEST PLAYERS
A716: PRAHRAN | D716: LORD | G716: F SMITH | I716: LETCHER | L716: TULLOH | O716: PAGE | R716: McGRATH
A717: WILLIAMSTOWN | D717: GODWILL | G717: BEER | I717: SHEEHAN | L717: CLAUSCEN | O717: WARREN | R717: L DREW
A718: GOALKICKERS
A719: PRAHRAN | D719: TULLOH 3 | G719: McGRATH 2 | J719: PRYOR 2 | M719: PAGE 2 | O719: LORD | Q719: FEGENT
A720: WILLIAMSTOWN | D720: MUNRO 2 | F720: CLAUSCEN 2 | I720: KENNY | K720: WARREN | M720: L DREW | O720: MORALEE | Q720: SMITH | S720: VICKERS
A722: COBURG | C722: 4 | D722: 7 | E722: =C722*6+D722 -> 31 | G722: 11 | H722: 11 | I722: =G722*6+H722 -> 77 | K722: 16 | L722: 13 | M722: =K722*6+L722 -> 109 | O722: 22 | P722: 25 | Q722: =O722*6+P722 -> 157 | S722: NORTHCOTE
A723: NORTHCOTE | C723: 2 | D723: 2 | E723: =C723*6+D723 -> 14 | G723: 5 | H723: 7 | I723: =G723*6+H723 -> 37 | K723: 7 | L723: 9 | M723: =K723*6+L723 -> 51 | O723: 10 | P723: 10 | Q723: =O723*6+P723 -> 70 | S723: LYNCH
A724: BEST PLAYERS
A725: COBURG | D725: YOUNG | G725: MEARS | I725: KERLEY | L725: CORNELL | O725: COLBERT | R725: F PLANT
A726: NORTHCOTE | D726: PERKINS | G726: LAFFY | I726: ALDRIDGE | L726: SEYMOUR | O726: GARRETT | R726: CLOUGH
A727: GOALKICKERS
A728: COBURG | D728: COLBERT 6 | F728: GARDINER 6 | I728: F PLANT 6 | L728: McALPINE | N728: MEARS | P728: MILLARD | R728: YOUNG
A729: NORTHCOTE | D729: SEYMOUR 3 | F729: COLE 2 | H729: HEENAN | J729: ALDRIDGE | M729: POULTER | O729: LAFFY | Q729: BYRNE
A731: ROUND 16 | E731: 4TH AUGUST | H731: WEATHER | K731: CLOUDY LIGHT SHOWERS WEST BREEZE | S731: PLAYED AT | X731: LADDER | AB731: ROUND | AD731: 16
D732: 1ST QTR | H732: 2ND QTR | L732: 3RD QTR | P732: FINAL | S732: YARRAVILLE
A733: YARRAVILLE | C733: 2 | D733: 5 | E733: =C733*6+D733 -> 17 | G733: 6 | H733: 6 | I733: =G733*6+H733 -> 42 | K733: 11 | L733: 11 | M733: =K733*6+L733 -> 77 | O733: 14 | P733: 12 | Q733: =O733*6+P733 -> 96 | S733: UMPIRE | W733: TEAM | X733: W | Y733: L | Z733: D | AA733: FOR | AB733: AGST | AC733: % | AD733: PTS
A734: PORT MELBOURNE | C734: 3 | D734: 4 | E734: =C734*6+D734 -> 22 | G734: 8 | H734: 8 | I734: =G734*6+H734 -> 56 | K734: 9 | L734: 11 | M734: =K734*6+L734 -> 65 | O734: 13 | P734: 13 | Q734: =O734*6+P734 -> 91 | S734: McKINNON
A735: BEST PLAYERS | W735: COBURG | X735: 13 | Y735: 3 | Z735: 0 | AA735: 1540 | AB735: 939 | AC735: 164.00425985090521 | AD735: 52
A736: YARRAVILLE | D736: JOYCE | G736: CHAPPLE | I736: COULSELL | L736: J BOLMAN | O736: SHERMAN | Q736: LYONS | W736: PORT MELBOURNE | X736: 12 | Y736: 4 | Z736: 0 | AA736: 1271 | AB736: 924 | AC736: 137.55411255411255 | AD736: 48
A737: PORT MELBOURNE | D737: KUHLKEN | G737: SKILTON | I737: FREYER | L737: CROMPTON | O737: WILKINS | Q737: HYDE | W737: BRIGHTON | X737: 11 | Y737: 5 | Z737: 0 | AA737: 1300 | AB737: 1086 | AC737: 119.70534069981584 | AD737: 44
A738: GOALKICKERS | W738: PRESTON | X738: 10 | Y738: 6 | Z738: 0 | AA738: 1195 | AB738: 994 | AC738: 120.22132796780684 | AD738: 40
A739: YARRAVILLE | D739: CHAPPLE 5 | G739: COULSELL 4 | J739: A LEONARD 2 | M739: KENNEDY | O739: LYONS | Q739: McCARNEY
A740: PORT MELBOURNE | D740: KUHLKEN 8 | G740: WILKINS 2 | J740: HYDE | L740: FREYER | N740: CROMPTON | W740: CAMBERWELL | X740: 10 | Y740: 6 | Z740: 0 | AA740: 1123 | AB740: 1018 | AC740: 110.31434184675835 | AD740: 40
W741: YARRAVILLE | X741: 8 | Y741: 8 | Z741: 0 | AA741: 1065 | AB741: 1133 | AC741: 93.998234774933806 | AD741: 32
A742: BRUNSWICK | C742: 3 | D742: 2 | E742: =C742*6+D742 -> 20 | G742: 5 | H742: 9 | I742: =G742*6+H742 -> 39 | K742: 8 | L742: 12 | M742: =K742*6+L742 -> 60 | O742: 11 | P742: 18 | Q742: =O742*6+P742 -> 84 | S742: BRUNSWICK | W742: BRUNSWICK | X742: 7 | Y742: 9 | Z742: 0 | AA742: 1040 | AB742: 1089 | AC742: 95.500459136822769 | AD742: 28
A743: BRIGHTON | C743: 4 | D743: 3 | E743: =C743*6+D743 -> 27 | G743: 5 | H743: 5 | I743: =G743*6+H743 -> 35 | K743: 8 | L743: 9 | M743: =K743*6+L743 -> 57 | O743: 8 | P743: 15 | Q743: =O743*6+P743 -> 63 | S743: MURRAY | W743: NORTHCOTE | X743: 3 | Y743: 13 | Z743: 0 | AA743: 1020 | AB743: 1457 | AC743: 70.00686341798216 | AD743: 12
A744: BEST PLAYERS | W744: PRAHRAN | X744: 3 | Y744: 13 | Z744: 0 | AA744: 1010 | AB744: 1482 | AC744: 68.151147098515523 | AD744: 12
A745: BRUNSWICK | D745: RALEIGH | G745: McINERNEY | J745: STEELE | L745: KENNETT | N745: CARTON | Q745: FARROW | W745: WILLIAMSTOWN | X745: 3 | Y745: 13 | Z745: 0 | AA745: 891 | AB745: 1333 | AC745: 66.841710427606898 | AD745: 12
A746: BRIGHTON | D746: MATTHEWS | G746: HUNT | J746: GARCIA | L746: BORLAND | N746: V WRIGHT | Q746: FITT
A747: GOALKICKERS
A748: BRUNSWICK | D748: GREENWOOD 3 | G748: BLACKMORE 2 | J748: EDWARDS 2 | M748: FARROW | O748: McINERNEY | Q748: RALEIGH | S748: WRIGHT
A749: BRIGHTON | D749: MATTHEWS 3 | G749: HUNT 2 | I749: WALSH | K749: NOONAN | M749: ULBRICK
A751: PRESTON | C751: 2 | D751: 4 | E751: =C751*6+D751 -> 16 | G751: 10 | H751: 8 | I751: =G751*6+H751 -> 68 | K751: 12 | L751: 12 | M751: =K751*6+L751 -> 84 | O751: 21 | P751: 14 | Q751: =O751*6+P751 -> 140 | S751: PRESTON
A752: NORTHCOTE | C752: 4 | D752: 4 | E752: =C752*6+D752 -> 28 | G752: 5 | H752: 8 | I752: =G752*6+H752 -> 38 | K752: 8 | L752: 13 | M752: =K752*6+L752 -> 61 | O752: 12 | P752: 13 | Q752: =O752*6+P752 -> 85 | S752: FROOD
A753: BEST PLAYERS
A754: PRESTON | D754: ADAMS | G754: TAYLOR | J754: SHAW | M754: MILLER | P754: MONOHAN | S754: BRIDGFORD
A755: NORTHCOTE | D755: SEYMOUR | G755: GARRETT | J755: PERKINS | M755: WHITTAKER | P755: ROBINSON | S755: BROWN
A756: GOALKICKERS
A757: PRESTON | D757: DODD 6 | F757: HUME 6 | H757: DOWLING 4 | J757: MONOHAN 2 | M757: ADAMS | O757: STEVENS | Q757: DOUGLAS
A758: NORTHCOTE | D758: SEYMOUR 7 | G758: DESLANDES 2 | J758: LAFFY | L758: HEENAN | N758: ROBINSON
A760: CAMBERWELL | C760: 3 | D760: 8 | E760: =C760*6+D760 -> 26 | G760: 5 | H760: 14 | I760: =G760*6+H760 -> 44 | K760: 6 | L760: 17 | M760: =K760*6+L760 -> 53 | O760: 10 | P760: 19 | Q760: =O760*6+P760 -> 79 | S760: CAMBERWELL
A761: PRAHRAN | C761: 3 | D761: 0 | E761: =C761*6+D761 -> 18 | G761: 3 | H761: 0 | I761: =G761*6+H761 -> 18 | K761: 4 | L761: 1 | M761: =K761*6+L761 -> 25 | O761: 7 | P761: 1 | Q761: =O761*6+P761 -> 43 | S761: MAKER
A762: BEST PLAYERS
A763: CAMBERWELL | D763: L WILLIAMS | G763: LE STRANGE | J763: BROWN | M763: STEVENS | P763: WOODFORD | S763: PRICE
A764: PRAHRAN | D764: RITCHIE | G764: LETCHER | J764: McRAE | M764: DIPROSE | P764: E JONES | S764: LORD
A765: GOALKICKERS
A766: CAMBERWELL | D766: WOODFORD 6 | G766: R WILLIAMS 2 | J766: PAGE | L766: LAWN
A767: PRAHRAN | D767: LORD 2 | F767: McGRATH | I767: PRYOR | K767: TULLOH | M767: DIPROSE | O767: LETCHER
A769: COBURG | C769: 5 | D769: 5 | E769: =C769*6+D769 -> 35 | G769: 8 | H769: 9 | I769: =G769*6+H769 -> 57 | K769: 10 | L769: 10 | M769: =K769*6+L769 -> 70 | O769: 15 | P769: 12 | Q769: =O769*6+P769 -> 102 | S769: WILLIAMSTOWN
A770: WILLIAMSTOWN | C770: 1 | D770: 4 | E770: =C770*6+D770 -> 10 | G770: 2 | H770: 6 | I770: =G770*6+H770 -> 18 | K770: 5 | L770: 11 | M770: =K770*6+L770 -> 41 | O770: 7 | P770: 12 | Q770: =O770*6+P770 -> 54 | S770: BLACKBURN
A771: BEST PLAYERS
A772: COBURG | D772: JENKINS | G772: MEARS | I772: GARDINER | L772: VOIGHT | O772: CORNELL | R772: F PLANT
A773: WILLIAMSTOWN | D773: CLAUSCEN | G773: McKAY | I773: SHEEHAN | L773: L DREW | O773: KENNY | R773: GODWILL
A774: GOALKICKERS
A775: COBURG | D775: GARDINER 5 | G775: F PLANT 4 | I775: COLBERT 2 | L775: CORNELL 2 | N775: MEARS | P775: J PLANT
A776: WILLIAMSTOWN | D776: KENNY 5 | G776: FREW | I776: GODWILL
A778: ROUND 17 | E778: 11TH AUGUST | J778: WEATHER | M778: FINE STRONG NORTH WIND | S778: PLAYED AT | X778: LADDER | AB778: ROUND | AD778: 17
D779: 1ST QTR | H779: 2ND QTR | L779: 3RD QTR | P779: FINAL | S779: E'WICK
A780: BRIGHTON | C780: 5 | D780: 6 | E780: =C780*6+D780 -> 36 | G780: 5 | H780: 6 | I780: =G780*6+H780 -> 36 | K780: 7 | L780: 11 | M780: =K780*6+L780 -> 53 | O780: 7 | P780: 15 | Q780: =O780*6+P780 -> 57 | S780: UMPIRE | W780: TEAM | X780: W | Y780: L | Z780: D | AA780: FOR | AB780: AGST | AC780: % | AD780: PTS
A781: PRESTON | C781: 0 | D781: 0 | E781: =C781*6+D781 -> 0 | G781: 4 | H781: 5 | I781: =G781*6+H781 -> 29 | K781: 4 | L781: 5 | M781: =K781*6+L781 -> 29 | O781: 7 | P781: 12 | Q781: =O781*6+P781 -> 54 | S781: BLACKBURN
A782: BEST PLAYERS | W782: COBURG | X782: 14 | Y782: 3 | Z782: 0 | AA782: 1638 | AB782: 980 | AC782: 167.14285714285714 | AD782: 56
A783: BRIGHTON | D783: DAINTY | G783: NOONAN | I783: GARCIA | L783: SALTER | O783: WALSH | Q783: WEBB | W783: PORT MELBOURNE | X783: 13 | Y783: 4 | Z783: 0 | AA783: 1393 | AB783: 961 | AC783: 144.9531737773153 | AD783: 52
A784: PRESTON | D784: MARNEY | G784: ADAMS | I784: SHAW | L784: WHITE | O784: SEEBECK | Q784: TAYLOR | W784: BRIGHTON | X784: 12 | Y784: 5 | Z784: 0 | AA784: 1357 | AB784: 1140 | AC784: 119.03508771929825 | AD784: 48
A785: GOALKICKERS | W785: PRESTON | X785: 10 | Y785: 7 | Z785: 0 | AA785: 1249 | AB785: 1051 | AC785: 118.83920076117982 | AD785: 40
A786: BRIGHTON | D786: MATTHEWS 3 | G786: NOONAN | I786: WALSH | K786: HUNT | M786: SALTER
A787: PRESTON | D787: DODD 2 | G787: HUME 2 | I787: ADAMS | K787: SUMMERS | M787: SEEBECK | W787: CAMBERWELL | X787: 10 | Y787: 7 | Z787: 0 | AA787: 1164 | AB787: 1116 | AC787: 104.3010752688172 | AD787: 40
W788: YARRAVILLE | X788: 9 | Y788: 8 | Z788: 0 | AA788: 1150 | AB788: 1207 | AC788: 95.277547638773825 | AD788: 36
A789: COBURG | C789: 3 | D789: 9 | E789: =C789*6+D789 -> 27 | G789: 5 | H789: 9 | I789: =G789*6+H789 -> 39 | K789: 10 | L789: 20 | M789: =K789*6+L789 -> 80 | O789: 13 | P789: 20 | Q789: =O789*6+P789 -> 98 | S789: COBURG | W789: BRUNSWICK | X789: 8 | Y789: 9 | Z789: 0 | AA789: 1135 | AB789: 1146 | AC789: 99.040139616055853 | AD789: 32
A790: CAMBERWELL | C790: 0 | D790: 0 | E790: =C790*6+D790 -> 0 | G790: 2 | H790: 6 | I790: =G790*6+H790 -> 18 | K790: 3 | L790: 7 | M790: =K790*6+L790 -> 25 | O790: 5 | P790: 11 | Q790: =O790*6+P790 -> 41 | S790: MURRAY | W790: NORTHCOTE | X790: 3 | Y790: 14 | Z790: 0 | AA790: 1094 | AB790: 1542 | AC790: 70.946822308690017 | AD790: 12
A791: BEST PLAYERS | W791: WILLIAMSTOWN | X791: 3 | Y791: 14 | Z791: 0 | AA791: 948 | AB791: 1428 | AC791: 66.386554621848745 | AD791: 12
A792: COBURG | D792: F PLANT | G792: COLBERT | J792: JENKINS | L792: KERLEY | N792: HARRIS | Q792: ROGERS | W792: PRAHRAN | X792: 3 | Y792: 14 | Z792: 0 | AA792: 1047 | AB792: 1604 | AC792: 65.274314214463843 | AD792: 12
A793: CAMBERWELL | D793: L WILLIAMS | G793: GREENWOOD | J793: EGAN | L793: PRICE | N793: TRESIZE | Q793: GUNNYON
A794: GOALKICKERS
A795: COBURG | D795: F PLANT 4 | F795: COLBERT 3 | I795: GARDINER 2 | L795: KERLEY | N795: HARRIS | P795: HUNTINGTON | S795: STONE
A796: CAMBERWELL | D796: WOODFORD 2 | G796: STEVENS | I796: GUNNYON | L796: HARRISON
A798: YARRAVILLE | C798: 3 | D798: 5 | E798: =C798*6+D798 -> 23 | G798: 4 | H798: 8 | I798: =G798*6+H798 -> 32 | K798: 11 | L798: 9 | M798: =K798*6+L798 -> 75 | O798: 12 | P798: 13 | Q798: =O798*6+P798 -> 85 | S798: NORTHCOTE
A799: NORTHCOTE | C799: 2 | D799: 0 | E799: =C799*6+D799 -> 12 | G799: 6 | H799: 3 | I799: =G799*6+H799 -> 39 | K799: 8 | L799: 5 | M799: =K799*6+L799 -> 53 | O799: 11 | P799: 8 | Q799: =O799*6+P799 -> 74 | S799: McKINNON
A800: BEST PLAYERS
A801: YARRAVILLE | D801: CHAPPLE | G801: COULSELL | J801: KENNEDY | M801: P BOLMAN | P801: J BOLMAN | S801: JOYCE
A802: NORTHCOTE | D802: DILLON | G802: SEYMOUR | J802: WHITE | M802: HEENAN | P802: GARRETT | S802: ROBINSON
A803: GOALKICKERS
A804: YARRAVILLE | D804: CHAPPLE 4 | G804: COULSELL 3 | J804: KENNEDY 3 | M804: A LEONARD | P804: McCARNEY
A805: NORTHCOTE | D805: SEYMOUR 5 | G805: DESLANDES 2 | J805: DILLON 2 | M805: COLE | O805: WHITE
A807: BRUNSWICK | C807: 3 | D807: 2 | E807: =C807*6+D807 -> 20 | G807: 7 | H807: 7 | I807: =G807*6+H807 -> 49 | K807: 11 | L807: 13 | M807: =K807*6+L807 -> 79 | O807: 13 | P807: 17 | Q807: =O807*6+P807 -> 95 | S807: BRUNSWICK
A808: WILLIAMSTOWN | C808: 3 | D808: 3 | E808: =C808*6+D808 -> 21 | G808: 4 | H808: 5 | I808: =G808*6+H808 -> 29 | K808: 5 | L808: 6 | M808: =K808*6+L808 -> 36 | O808: 8 | P808: 9 | Q808: =O808*6+P808 -> 57 | S808: FROOD
A809: BEST PLAYERS
A810: BRUNSWICK | D810: WHITELEY | G810: RALEIGH | I810: PROUDFOOT | L810: KENNETT | O810: HARRIS | R810: GREENWOOD
A811: WILLIAMSTOWN | D811: McKAY | G811: WARREN | I811: QUINN | L811: CLAUSCEN | O811: BEER | R811: TAAFE
A812: GOALKICKERS
A813: BRUNSWICK | D813: PROUDFOOT 4 | G813: WHITELEY 2 | J813: GREENWOOD 2 | M813: ALLISON 2 | O813: McINERNEY | R813: STEELE | T813: RALEIGH
A814: WILLIAMSTOWN | D814: WARREN 4 | G814: GODWILL | I814: QUINN | K814: STOCK | M814: VICKERS
A816: PORT MELBOURNE | C816: 3 | D816: 2 | E816: =C816*6+D816 -> 20 | G816: 7 | H816: 7 | I816: =G816*6+H816 -> 49 | K816: 11 | L816: 9 | M816: =K816*6+L816 -> 75 | O816: 18 | P816: 14 | Q816: =O816*6+P816 -> 122 | S816: PORT MELBOURNE
A817: PRAHRAN | C817: 3 | D817: 4 | E817: =C817*6+D817 -> 22 | G817: 3 | H817: 4 | I817: =G817*6+H817 -> 22 | K817: 4 | L817: 6 | M817: =K817*6+L817 -> 30 | O817: 5 | P817: 7 | Q817: =O817*6+P817 -> 37 | S817: PAYNE
A818: BEST PLAYERS
A819: PORT MELBOURNE | D819: GARBUTT | G819: KUHLKEN | J819: SMITH | M819: WILKINS | P819: HYDE | R819: BARNES
A820: PRAHRAN | D820: F SMITH | G820: LETCHER | J820: LORD | M820: RITCHIE | P820: J SMITH | R820: ANDERSON
A821: GOALKICKERS
A822: PORT MELBOURNE | D822: KUHLKEN 5 | G822: SMITH 3 | I822: WILKINS 3 | L822: GARBUTT 3 | N822: HYDE | P822: FORBES | R822: BARNES
A823: PRAHRAN | D823: PRYOR 2 | G823: J SMITH | I823: TULLOH | K823: E JONES
A825: ROUND 18 | E825: 18TH AUGUST | J825: WEATHER | M825: FINE NORTH BREEZE | S825: PLAYED AT | X825: LADDER | AB825: ROUND | AD825: 18
D826: 1ST QTR | H826: 2ND QTR | L826: 3RD QTR | P826: FINAL | S826: PORT MELBOURNE
A827: PORT MELBOURNE | C827: 6 | D827: 4 | E827: =C827*6+D827 -> 40 | G827: 8 | H827: 5 | I827: =G827*6+H827 -> 53 | K827: 13 | L827: 6 | M827: =K827*6+L827 -> 84 | O827: 16 | P827: 10 | Q827: =O827*6+P827 -> 106 | S827: UMPIRE | W827: TEAM | X827: W | Y827: L | Z827: D | AA827: FOR | AB827: AGST | AC827: % | AD827: PTS
A828: BRIGHTON | C828: 1 | D828: 4 | E828: =C828*6+D828 -> 10 | G828: 4 | H828: 7 | I828: =G828*6+H828 -> 31 | K828: 6 | L828: 9 | M828: =K828*6+L828 -> 45 | O828: 7 | P828: 13 | Q828: =O828*6+P828 -> 55 | S828: FROOD
A829: BEST PLAYERS | W829: COBURG | X829: 15 | Y829: 3 | Z829: 0 | AA829: 1742 | AB829: 1052 | AC829: 165.58935361216729 | AD829: 60
A830: PORT MELBOURNE | D830: GARBUTT | G830: SKILTON | I830: BROOKER | L830: KUHLKEN | N830: CROMPTON | Q830: HYDE | W830: PORT MELBOURNE | X830: 14 | Y830: 4 | Z830: 0 | AA830: 1499 | AB830: 1016 | AC830: 147.53937007874015 | AD830: 56
A831: BRIGHTON | D831: BORLAND | G831: WRIGHT | I831: GARCIA | L831: HUNT | N831: BURNES | Q831: WEBB | W831: BRIGHTON | X831: 12 | Y831: 6 | Z831: 0 | AA831: 1412 | AB831: 1246 | AC831: 113.32263242375602 | AD831: 48
A832: GOALKICKERS | W832: PRESTON | X832: 11 | Y832: 7 | Z832: 0 | AA832: 1376 | AB832: 1104 | AC832: 124.6376811594203 | AD832: 44
A833: PORT MELBOURNE | D833: KUHLKEN 6 | G833: McINNES 4 | I833: HYDE 3 | K833: WILKINS | M833: BOURKE | O833: ERRIDGE
A834: BRIGHTON | D834: MATTHEWS 3 | G834: WALSH | I834: BURNES | K834: TROOD | M834: DORE | W834: CAMBERWELL | X834: 11 | Y834: 7 | Z834: 0 | AA834: 1270 | AB834: 1189 | AC834: 106.81244743481918 | AD834: 44
W835: YARRAVILLE | X835: 10 | Y835: 8 | Z835: 0 | AA835: 1212 | AB835: 1233 | AC835: 98.296836982968372 | AD835: 40
A836: COBURG | C836: 4 | D836: 4 | E836: =C836*6+D836 -> 28 | G836: 10 | H836: 9 | I836: =G836*6+H836 -> 69 | K836: 10 | L836: 11 | M836: =K836*6+L836 -> 71 | O836: 14 | P836: 20 | Q836: =O836*6+P836 -> 104 | S836: COBURG | W836: BRUNSWICK | X836: 8 | Y836: 10 | Z836: 0 | AA836: 1207 | AB836: 1250 | AC836: 96.56 | AD836: 32
A837: BRUNSWICK | C837: 3 | D837: 7 | E837: =C837*6+D837 -> 25 | G837: 5 | H837: 8 | I837: =G837*6+H837 -> 38 | K837: 9 | L837: 12 | M837: =K837*6+L837 -> 66 | O837: 10 | P837: 12 | Q837: =O837*6+P837 -> 72 | S837: MURRAY | W837: NORTHCOTE | X837: 3 | Y837: 15 | Z837: 0 | AA837: 1167 | AB837: 1648 | AC837: 70.8131067961165 | AD837: 12
A838: BEST PLAYERS | W838: WILLIAMSTOWN | X838: 3 | Y838: 15 | Z838: 0 | AA838: 974 | AB838: 1490 | AC838: 65.369127516778519 | AD838: 12
A839: COBURG | D839: JENKINS | G839: MEARS | I839: HARRIS | L839: WALSH | N839: CHAPMAN | Q839: CORNELL | W839: PRAHRAN | X839: 3 | Y839: 15 | Z839: 0 | AA839: 1100 | AB839: 1731 | AC839: 63.547082611207394 | AD839: 12
A840: BRUNSWICK | D840: KENNETT | G840: ALESSIO | I840: PROUDFOOT | L840: WHITELEY | N840: HARRIS | Q840: STEELE
A841: GOALKICKERS
A842: COBURG | D842: STONE 4 | F842: F PLANT 3 | I842: MEARS 3 | K842: GARDINER | M842: COLBERT | O842: KERLEY | Q842: WALSH
A843: BRUNSWICK | D843: GREENWOOD 3 | G843: ALLISON 2 | J843: HASSETT 2 | M843: BARRIE | O843: KENNETT | Q843: ALESSIO
A845: YARRAVILLE | C845: 0 | D845: 2 | E845: =C845*6+D845 -> 2 | G845: 4 | H845: 5 | I845: =G845*6+H845 -> 29 | K845: 5 | L845: 8 | M845: =K845*6+L845 -> 38 | O845: 8 | P845: 14 | Q845: =O845*6+P845 -> 62 | S845: WILLIAMSTOWN
A846: WILLIAMSTOWN | C846: 2 | D846: 2 | E846: =C846*6+D846 -> 14 | G846: 3 | H846: 2 | I846: =G846*6+H846 -> 20 | K846: 3 | L846: 7 | M846: =K846*6+L846 -> 25 | O846: 3 | P846: 8 | Q846: =O846*6+P846 -> 26 | S846: BLACKBURN
A847: BEST PLAYERS
A848: YARRAVILLE | D848: SHERMAN | G848: COULSELL | J848: P BOLMAN | M848: LYONS | O848: HUDD | Q848: POOLE
A849: WILLIAMSTOWN | D849: McKAY | G849: SHEEHAN | J849: FURLONG | M849: BEER | O849: TAAFE | Q849: GODWILL
A850: GOALKICKERS
A851: YARRAVILLE | D851: CHAPPLE 2 | G851: COULSELL 2 | J851: LYONS | L851: A LEONARD | O851: R LEONARD | R851: McCARNEY
A852: WILLIAMSTOWN | D852: CLAUSCEN | G852: QUINN | J852: WALKER
A854: CAMBERWELL | C854: 1 | D854: 2 | E854: =C854*6+D854 -> 8 | G854: 9 | H854: 10 | I854: =G854*6+H854 -> 64 | K854: 10 | L854: 12 | M854: =K854*6+L854 -> 72 | O854: 15 | P854: 16 | Q854: =O854*6+P854 -> 106 | S854: CAMBERWELL
A855: NORTHCOTE | C855: 5 | D855: 4 | E855: =C855*6+D855 -> 34 | G855: 5 | H855: 5 | I855: =G855*6+H855 -> 35 | K855: 9 | L855: 12 | M855: =K855*6+L855 -> 66 | O855: 10 | P855: 13 | Q855: =O855*6+P855 -> 73 | S855: LESTER
A856: BEST PLAYERS
A857: CAMBERWELL | D857: HARRISON | F857: BRIDE | H857: LAKIN | K857: TRESIZE | N857: LE STRANGE | Q857: GREENWOOD
A858: NORTHCOTE | D858: SEYNOUR | F858: PERKINS | H858: DESLANDES | K858: MOORE | N858: DILLON | Q858: POULTER
A859: GOALKICKERS
A860: CAMBERWELL | D860: R WILLIAMS 3 | G860: HARRISON 2 | J860: BRIDE 2 | L860: CALWELL 2 | N860: WOODFORD | Q860: LAKIN | R860: GUNNYON | U860: PAGE | W860: CONNOP | X860: BROWN
A861: NORTHCOTE | D861: SEYMOUR 7 | G861: DILLON | I861: DESLANDES | L861: GRAY
A863: PRESTON | C863: 0 | D863: 2 | E863: =C863*6+D863 -> 2 | G863: 8 | H863: 6 | I863: =G863*6+H863 -> 54 | K863: 11 | L863: 9 | M863: =K863*6+L863 -> 75 | O863: 19 | P863: 13 | Q863: =O863*6+P863 -> 127 | S863: PRESTON
A864: PRAHRAN | C864: 1 | D864: 0 | E864: =C864*6+D864 -> 6 | G864: 3 | H864: 1 | I864: =G864*6+H864 -> 19 | K864: 7 | L864: 8 | M864: =K864*6+L864 -> 50 | O864: 7 | P864: 11 | Q864: =O864*6+P864 -> 53 | S864: McKINNON
A865: BEST PLAYERS
A866: PRESTON | D866: SHAW | F866: BRIDGFORD | I866: MILLER | L866: ROBERTSON | O866: H TAYLOR | R866: MONOHAN
A867: PRAHRAN | D867: F SMITH | F867: McGRATH | I867: GLOVER | L867: DEVINE | O867: ALBERRY | R867: PRYOR
A868: GOALKICKERS
A869: PRESTON | D869: BRIDGFORD 6 | G869: SHAW 6 | I869: ADAMS 2 | K869: HUME 2 | M869: MARNEY | O869: STEVENS | Q869: HAYES
A870: PRAHRAN | D870: PRYOR 3 | F870: McGRATH | I870: ALBERRY | L870: FEGENT | N870: McRAE
A872: FINALS
A873: 1ST SEMI | E873: 25TH AUGUST | J873: WEATHER | N873: FINE MILD N.W. BREEZE
D874: 1ST QTR | H874: 2ND QTR | L874: 3RD QTR | P874: FINAL
A875: PORT MELBOURNE | C875: 3 | D875: 5 | E875: =C875*6+D875 -> 23 | G875: 7 | H875: 7 | I875: =G875*6+H875 -> 49 | K875: 9 | L875: 13 | M875: =K875*6+L875 -> 67 | O875: 9 | P875: 15 | Q875: =O875*6+P875 -> 69 | S875: COBURG
A876: PRESTON | C876: 1 | D876: 2 | E876: =C876*6+D876 -> 8 | G876: 4 | H876: 6 | I876: =G876*6+H876 -> 30 | K876: 4 | L876: 7 | M876: =K876*6+L876 -> 31 | O876: 9 | P876: 11 | Q876: =O876*6+P876 -> 65 | S876: MURRAY
A877: BEST PLAYERS
A878: PORT MELBOURNE | D878: GARBUTT | G878: CROMPTON | J878: BOURKE | M878: HYDE | P878: PETERSON | S878: KUHLKEN
A879: PRESTON | D879: DOUGLAS | G879: WHITE | J879: MILLER | M879: CAMPBELL | P879: SHAW | S879: SUMMERS
A880: GOALKICKERS
A881: PORT MELBOURNE | D881: HYDE 3 | G881: BOURKE 2 | J881: KUHLKEN 2 | M881: WILKINS | O881: McINNES
A882: PRESTON | D882: BRIDGFORD 3 | G882: HUME 2 | J882: SHAW 2 | M882: ADAMS | O882: MARNEY
A884: 2ND SEMI | E884: 1ST SEPTEMBER | J884: WEATHER | M884: CLOUDY LIGHT SHOWERS N.W. BREEZE
A885: COBURG | C885: 2 | D885: 9 | E885: =C885*6+D885 -> 21 | G885: 3 | H885: 9 | I885: =G885*6+H885 -> 27 | K885: 9 | L885: 14 | M885: =K885*6+L885 -> 68 | O885: 11 | P885: 16 | Q885: =O885*6+P885 -> 82 | S885: PORT MELBOURNE
A886: BRIGHTON | C886: 0 | D886: 1 | E886: =C886*6+D886 -> 1 | G886: 6 | H886: 5 | I886: =G886*6+H886 -> 41 | K886: 8 | L886: 5 | M886: =K886*6+L886 -> 53 | O886: 12 | P886: 7 | Q886: =O886*6+P886 -> 79 | S886: MURRAY
A887: BEST PLAYERS
A888: COBURG | D888: J PLANT | G888: McGRATH | J888: MEARS | M888: HARRIS | P888: WALSH | S888: WATT
A889: BRIGHTON | D889: MATTHEWS | G889: BURNES | J889: HUNT | M889: WALSH | P889: WEBB | S889: DAINTY
A890: GOALKICKERS
A891: COBURG | D891: F PLANT 2 | G891: J PLANT 2 | J891: COLBERT 2 | M891: GARDINER 2 | P891: STONE | R891: McGRATH | U891: MEARS
A892: BRIGHTON | D892: MATTHEWS 5 | G892: WALSH 2 | J892: STEWART 2 | M892: NOONAN | O892: BURNES | Q892: FITT
A894: FINAL | E894: 8TH SEPTEMBER | J894: WEATHER | M894: FINE WEST BREEZE
A895: COBURG | C895: 5 | D895: 4 | E895: 34 | G895: 7 | H895: 5 | I895: 47 | K895: 15 | L895: 10 | M895: 100 | O895: 17 | P895: 12 | Q895: =O895*6+P895 -> 114 | S895: BRUNSWICK
A896: PORT MELBOURNE | C896: 3 | D896: 4 | E896: 22 | G896: 10 | H896: 7 | I896: 67 | K896: 12 | L896: 9 | M896: 81 | O896: 16 | P896: 11 | Q896: =O896*6+P896 -> 107 | S896: MURRAY
A897: BEST PLAYERS
A898: COBURG | D898: WALSH | G898: BROOKS | J898: COLBERT | M898: F PLANT | P898: STONE | S898: GARDINER
A899: PORT MELBOURNE | D899: PETERSON | G899: GARBUTT | J899: BOURKE | M899: HARVEY | P899: KUHLKEN | S899: SMITH
A900: GOALKICKERS
A901: COBURG | D901: STONE 4 | F901: F PLANT 4 | I901: COLBERT 3 | L901: KERLEY 2 | N901: GARDINER | Q901: MEARS | S901: J PLANT | U901: HUNTINGTON
A902: PORT MELBOURNE | D902: McINNES 5 | F902: KUHLKEN 4 | I902: SMITH 2 | K902: HYDE | M902: BOURKE | O902: TUCK | Q902: ERRIDGE | S902: BARNES
A904: TEAMS | G904: COBURG
A905: BACKS | C905: McGRATH | G905: CHAPMAN | K905: VOIGHT
A906: H-BACKS | C906: ROGERS | G906: J PLANT | K906: BROOKS
A907: CENTRES | C907: CORNELL | G907: WATT | K907: HARRIS
A908: H-FORWARDS | C908: HUNTINGTON | G908: KERLEY | K908: STONE
A909: FORWARDS | C909: COLBERT | G909: GARDINER | K909: F PLANT
A910: RUCKS | C910: JENKINS | G910: WALSH | K910: MEARS