A1: Victorian Football Association
A2: Season 1929
A3: © Copyright Wal Williams | F3: First created: 2 November 2014
A4: Contact: joywalwi at gmail dot com | F4: Last updated: 27 January 2018 | W4: VFA Results and tables - Link to the main index page
A5: You are free to copy this document in whole or part provided that proper acknowledgement is given to the author. All rights reserved.
A7: YEAR 1929
A8: ROUND 1 | E8: 20TH APRIL | J8: WEATHER | M8: CLOUDY BUT FINE S.W. BREEZE | S8: PLAYED AT | X8: LADDER | AB8: ROUND | AD8: 1
D9: 1ST QTR | H9: 2ND QTR | L9: 3RD QTR | P9: FINAL | S9: BEACH ROAD
A10: BRIGHTON | C10: 1 | D10: 5 | E10: =C10*6+D10 -> 11 | G10: 8 | H10: 7 | I10: =G10*6+H10 -> 55 | K10: 11 | L10: 11 | M10: =K10*6+L10 -> 77 | O10: 17 | P10: 13 | Q10: =O10*6+P10 -> 115 | S10: UMPIRE | W10: TEAM | X10: W | Y10: L | Z10: D | AA10: FOR | AB10: AGST | AC10: % | AD10: PTS
A11: SANDRINGHAM | C11: 4 | D11: 4 | E11: =C11*6+D11 -> 28 | G11: 6 | H11: 7 | I11: =G11*6+H11 -> 43 | K11: 8 | L11: 10 | M11: =K11*6+L11 -> 58 | O11: 9 | P11: 14 | Q11: =O11*6+P11 -> 68 | S11: McKINNON
A12: BEST PLAYERS | W12: OAKLEIGH | X12: 1 | Y12: 0 | Z12: 0 | AA12: 121 | AB12: 69 | AC12: 175.36231884057972 | AD12: 4
A13: BRIGHTON | D13: GARCIA | G13: STOREY | I13: DUNBAR | L13: HUNT | N13: IRWIN | Q13: DAINTY | W13: BRIGHTON | X13: 1 | Y13: 0 | Z13: 0 | AA13: 115 | AB13: 68 | AC13: 169.11764705882354 | AD13: 4
A14: SANDRINGHAM | D14: McCASHNEY | G14: CHALLIS | I14: AMSDEN | L14: GEDDES | N14: DE LUCA | Q14: BOURKE | W14: PRESTON | X14: 1 | Y14: 0 | Z14: 0 | AA14: 103 | AB14: 65 | AC14: 158.46153846153845 | AD14: 4
A15: GOALKICKERS | W15: WILLIAMSTOWN | X15: 1 | Y15: 0 | Z15: 0 | AA15: 105 | AB15: 82 | AC15: 128.04878048780489 | AD15: 4
A16: BRIGHTON | D16: DUNBAR 4 | F16: MATTHEWS 4 | I16: TULLOH 3 | K16: BARNES 3 | M16: STOREY 2 | O16: BESWICK
A17: SANDRINGHAM | D17: DICK 4 | F17: DE LUCA 3 | I17: GEDDES | K17: GAY | W17: PORT MELBOURNE | X17: 1 | Y17: 0 | Z17: 0 | AA17: 91 | AB17: 80 | AC17: 113.75 | AD17: 4
W18: COBURG | X18: 0 | Y18: 0 | Z18: 1 | AA18: 113 | AB18: 113 | AC18: 100 | AD18: 2
A19: COBURG | C19: 5 | D19: 3 | E19: =C19*6+D19 -> 33 | G19: 9 | H19: 4 | I19: =G19*6+H19 -> 58 | K19: 17 | L19: 9 | M19: =K19*6+L19 -> 111 | O19: 17 | P19: 11 | Q19: =O19*6+P19 -> 113 | S19: COBURG | W19: BRUNSWICK | X19: 0 | Y19: 0 | Z19: 1 | AA19: 113 | AB19: 113 | AC19: 100 | AD19: 2
A20: BRUNSWICK | C20: 2 | D20: 2 | E20: =C20*6+D20 -> 14 | G20: 7 | H20: 5 | I20: =G20*6+H20 -> 47 | K20: 11 | L20: 6 | M20: =K20*6+L20 -> 72 | O20: 17 | P20: 11 | Q20: =O20*6+P20 -> 113 | S20: FROOD | W20: PRAHRAN | X20: 0 | Y20: 1 | Z20: 0 | AA20: 80 | AB20: 91 | AC20: 87.912087912087912 | AD20: 0
A21: BEST PLAYERS | W21: YARRAVILLE | X21: 0 | Y21: 1 | Z21: 0 | AA21: 82 | AB21: 105 | AC21: 78.095238095238102 | AD21: 0
A22: COBURG | D22: CHAPMAN | G22: MEARS | I22: VOIGHT | L22: KERLEY | N22: KIGHT | Q22: F PLANT | W22: NORTHCOTE | X22: 0 | Y22: 1 | Z22: 0 | AA22: 65 | AB22: 103 | AC22: 63.106796116504853 | AD22: 0
A23: BRUNSWICK | D23: FITZGERALD | G23: WILLIAMS | I23: HEARN | L23: RALEIGH | N23: ALESSIO | Q23: McINERNEY | W23: SANDRINGHAM | X23: 0 | Y23: 1 | Z23: 0 | AA23: 68 | AB23: 115 | AC23: 59.130434782608695 | AD23: 0
A24: GOALKICKERS | W24: CAMBERWELL | X24: 0 | Y24: 1 | Z24: 0 | AA24: 69 | AB24: 121 | AC24: 57.02479338842975 | AD24: 0
A25: COBURG | D25: F PLANT 5 | F25: HARRIS 2 | H25: McGRATH 2 | J25: COLBERT 2 | M25: KERLEY 2 | O25: JENKINS | Q25: MEARS | S25: WATT | U25: KIGHT
A26: BRUNSWICK | D26: McINERNEY 5 | G26: FITZGERALD 3 | J26: STEELE 2 | L26: RALEIGH 2 | N26: MILLEN | P26: WILLIAMS | R26: RAYMOND | U26: KENNETT | X26: PANNAM
A28: PORT MELBOURNE | C28: 7 | D28: 2 | E28: =C28*6+D28 -> 44 | G28: 8 | H28: 4 | I28: =G28*6+H28 -> 52 | K28: 10 | L28: 5 | M28: =K28*6+L28 -> 65 | O28: 16 | P28: 7 | Q28: =O28*6+P28 -> 103 | S28: NORTHCOTE
A29: NORTHCOTE | C29: 2 | D29: 3 | E29: =C29*6+D29 -> 15 | G29: 3 | H29: 10 | I29: =G29*6+H29 -> 28 | K29: 5 | L29: 15 | M29: =K29*6+L29 -> 45 | O29: 8 | P29: 17 | Q29: =O29*6+P29 -> 65 | S29: MURRAY
A30: BEST PLAYERS
A31: PRESTON | D31: MILLER | G31: ADAMS | J31: BRIDGFORD | M31: DODD | O31: DOUGLAS | R31: SUMMERS
A32: NORTHCOTE | D32: WILSON | G32: NICHOLLS | J32: STOCKDALE | M32: PERKINS | O32: ROBINSON | R32: GOUGH
A33: GOALKICKERS
A34: PRESTON | D34: ADAMS 6 | F34: DODD 4 | H34: BRIDGFORD 3 | K34: SURTEES | M34: BOYD | O34: GOONAN
A35: NORTHCOTE | D35: GOUGH 3 | F35: SEYMOUR 3 | I35: O'BRIEN | K35: ROBINSON
A37: OAKLEIGH | C37: 2 | D37: 5 | E37: =C37*6+D37 -> 17 | G37: 12 | H37: 5 | I37: =G37*6+H37 -> 77 | K37: 16 | L37: 7 | M37: =K37*6+L37 -> 103 | O37: 18 | P37: 13 | Q37: =O37*6+P37 -> 121 | S37: OAKLEIGH
A38: CAMBERWELL | C38: 1 | D38: 3 | E38: =C38*6+D38 -> 9 | G38: 4 | H38: 6 | I38: =G38*6+H38 -> 30 | K38: 7 | L38: 13 | M38: =K38*6+L38 -> 55 | O38: 8 | P38: 21 | Q38: =O38*6+P38 -> 69 | S38: PAYNE
A39: BEST PLAYERS
A40: OAKLEIGH | D40: FLEMING | F40: TAYLOR | I40: RUDOLPH | K40: MAHER | M40: McALISTER | P40: OFFICER
A41: CAMBERWELL | D41: LAWN | F41: PAGE | I41: LAKIN | K41: SHANAHAN | N41: BENNETT
A42: GOALKICKERS
A43: OAKLEIGH | D43: TAYLOR 7 | G43: FLEMING 5 | J43: IRWIN 3 | L43: MORRIS | N43: MAHER | P43: GODING
A44: CAMBERWELL | D44: BENNETT 2 | G44: WILLIAMS 2 | J44: GOUGH | L44: LAWN | N44: PAGE | P44: WOODFROD
A46: PORT MELBOURNE | C46: 7 | D46: 7 | E46: =C46*6+D46 -> 49 | G46: 8 | H46: 9 | I46: =G46*6+H46 -> 57 | K46: 10 | L46: 15 | M46: =K46*6+L46 -> 75 | O46: 12 | P46: 19 | Q46: =O46*6+P46 -> 91 | S46: TOORAK PARK
A47: PRAHRAN | C47: 2 | D47: 0 | E47: =C47*6+D47 -> 12 | G47: 4 | H47: 8 | I47: =G47*6+H47 -> 32 | K47: 7 | L47: 11 | M47: =K47*6+L47 -> 53 | O47: 11 | P47: 14 | Q47: =O47*6+P47 -> 80 | S47: LESTER
A48: BEST PLAYERS
A49: PORT MELBOURNE | D49: FORBES | G49: SKILTON | I49: PLUMRIDGE | L49: SMITH | N49: HYDE | Q49: STYLES
A50: PRAHRAN | D50: HARLEY | G50: NAYLOR | I50: SUTCLIFFE | L50: LORD | N50: LUCAS | Q50: SMITH
A51: GOALKICKERS
A52: PORT MELBOURNE | D52: HYDE 3 | F52: FORBES 3 | H52: PLUMRIDGE 2 | K52: SMITH 2 | M52: SKILTON 2 | P52: ATKINSON
A53: PRAHRAN | D53: HARLEY 4 | F53: LORD 2 | H53: SUTCLIFFE | J53: LUCAS | L53: ALLAN | N53: JACK SMITH | Q53: NAYLOR
A55: WILLIAMSTOWN | C55: 3 | D55: 1 | E55: =C55*6+D55 -> 19 | G55: 9 | H55: 3 | I55: =G55*6+H55 -> 57 | K55: 10 | L55: 6 | M55: =K55*6+L55 -> 66 | O55: 16 | P55: 9 | Q55: =O55*6+P55 -> 105 | S55: YARRAVILLE
A56: YARRAVILLE | C56: 3 | D56: 4 | E56: =C56*6+D56 -> 22 | G56: 6 | H56: 9 | I56: =G56*6+H56 -> 45 | K56: 9 | L56: 12 | M56: =K56*6+L56 -> 66 | O56: 11 | P56: 16 | Q56: =O56*6+P56 -> 82 | S56: MAKER
A57: BEST PLAYERS
A58: WILLIAMSTOWN | D58: HELWIG | F58: McAULIFFE | I58: WARREN | L58: BEASLEY | N58: SYKES | Q58: TAAFE
A59: YARRAVILLE | D59: JOYCE | F59: COULSELL | I59: LOVETT | L59: SMITH | N59: CHAPPLE | Q59: ROBERTS
A60: GOALKICKERS
A61: WILLIAMSTOWN | D61: McAULIFFE 4 | G61: HELWIG 3 | I61: BRITT 3 | K61: McDONALD 2 | N61: MATHER 2 | Q61: FREW | S61: TRUMAN
A62: YARRAVILLE | D62: ROBERTS 3 | F62: JOYCE 2 | H62: COULSELL 2 | K62: CHAPPLE 2 | N62: SINCLAIR | Q62: KENNEDY
A64: ROUND 2 | E64: 27TH APRIL | H64: WEATHER | K64: COOL CLOUDY SHOWERS SOUTH WIND | S64: PLAYED AT | X64: LADDER | AB64: ROUND | AD64: 2
D65: 1ST QTR | H65: 2ND QTR | L65: 3RD QTR | P65: FINAL | S65: WILLIAMSTOWN
A66: OAKLEIGH | C66: 3 | D66: 4 | E66: =C66*6+D66 -> 22 | G66: 3 | H66: 4 | I66: =G66*6+H66 -> 22 | K66: 9 | L66: 9 | M66: =K66*6+L66 -> 63 | O66: 10 | P66: 11 | Q66: =O66*6+P66 -> 71 | S66: UMPIRE | W66: TEAM | X66: W | Y66: L | Z66: D | AA66: FOR | AB66: AGST | AC66: % | AD66: PTS
A67: WILLIAMSTOWN | C67: 0 | D67: 0 | E67: =C67*6+D67 -> 0 | G67: 2 | H67: 3 | I67: =G67*6+H67 -> 15 | K67: 2 | L67: 4 | M67: =K67*6+L67 -> 16 | O67: 6 | P67: 4 | Q67: =O67*6+P67 -> 40 | S67: MURRAY
A68: BEST PLAYERS | W68: OAKLEIGH | X68: 2 | Y68: 0 | Z68: 0 | AA68: 192 | AB68: 109 | AC68: 176.14678899082568 | AD68: 8
A69: OAKLEIGH | D69: FLEMING | F69: THOMAS | I69: HOLFORD | L69: GODING | O69: OFFICER | Q69: IRWIN | W69: BRIGHTON | X69: 2 | Y69: 0 | Z69: 0 | AA69: 188 | AB69: 132 | AC69: 142.42424242424244 | AD69: 8
A70: WILLIAMSTOWN | D70: SYKES | F70: BEASLEY | I70: TAAFE | L70: TRUMAN | O70: JOHNS | Q70: McDONALD | W70: PORT MELBOURNE | X70: 2 | Y70: 0 | Z70: 0 | AA70: 148 | AB70: 135 | AC70: 109.62962962962963 | AD70: 8
A71: GOALKICKERS | W71: BRUNSWICK | X71: 1 | Y71: 0 | Z71: 1 | AA71: 218 | AB71: 163 | AC71: 133.74233128834356 | AD71: 6
A72: OAKLEIGH | D72: TAYLOR 4 | F72: FLEMING 2 | I72: IRWIN 2 | K72: SPAIN | M72: OFFICER
A73: WILLIAMSTOWN | D73: SHEEHAN 2 | G73: BRITT | I73: McDONALD | L73: TAAFE | N73: FERGUSON | W73: COBURG | X73: 1 | Y73: 0 | Z73: 1 | AA73: 173 | AB73: 164 | AC73: 105.48780487804878 | AD73: 6
W74: PRESTON | X74: 1 | Y74: 1 | Z74: 0 | AA74: 154 | AB74: 125 | AC74: 123.2 | AD74: 4
A75: COBURG | C75: 2 | D75: 2 | E75: =C75*6+D75 -> 14 | G75: 7 | H75: 5 | I75: =G75*6+H75 -> 47 | K75: 8 | L75: 8 | M75: =K75*6+L75 -> 56 | O75: 8 | P75: 12 | Q75: =O75*6+P75 -> 60 | S75: PRESTON | W75: WILLIAMSTOWN | X75: 1 | Y75: 1 | Z75: 0 | AA75: 145 | AB75: 153 | AC75: 94.771241830065364 | AD75: 4
A76: PRESTON | C76: 3 | D76: 1 | E76: =C76*6+D76 -> 19 | G76: 4 | H76: 2 | I76: =G76*6+H76 -> 26 | K76: 6 | L76: 6 | M76: =K76*6+L76 -> 42 | O76: 7 | P76: 9 | Q76: =O76*6+P76 -> 51 | S76: McPHEE | W76: CAMBERWELL | X76: 1 | Y76: 1 | Z76: 0 | AA76: 144 | AB76: 180 | AC76: 80 | AD76: 4
A77: BEST PLAYERS | W77: YARRAVILLE | X77: 0 | Y77: 2 | Z77: 0 | AA77: 137 | AB77: 162 | AC77: 84.567901234567898 | AD77: 0
A78: COBURG | D78: HARRIS | F78: KIGHT | I78: MEARS | L78: CHAPMAN | O78: KERLEY | Q78: WALSH | W78: PRAHRAN | X78: 0 | Y78: 2 | Z78: 0 | AA78: 139 | AB78: 166 | AC78: 83.734939759036138 | AD78: 0
A79: PRESTON | D79: NONOHAN | F79: BRIDGFORD | I79: MILLER | L79: GOONAN | O79: ADAMS | Q79: DAVIE | W79: NORTHCOTE | X79: 0 | Y79: 2 | Z79: 0 | AA79: 129 | AB79: 176 | AC79: 73.295454545454547 | AD79: 0
A80: GOALKICKERS | W80: SANDRINGHAM | X80: 0 | Y80: 2 | Z80: 0 | AA80: 118 | AB80: 220 | AC80: 53.636363636363633 | AD80: 0
A81: COBURG | D81: F PLANT 3 | G81: HARRIS 3 | J81: McGRATH | M81: J PLANT
A82: PRESTON | D82: MONOHAN 2 | G82: ADAMS | J82: DODD | L82: GOONAN | N82: SEEBECK | P82: DAVIE
A84: PORT MELBOURNE | C84: 1 | D84: 4 | E84: =C84*6+D84 -> 10 | G84: 5 | H84: 6 | I84: =G84*6+H84 -> 36 | K84: 6 | L84: 10 | M84: =K84*6+L84 -> 46 | O84: 7 | P84: 15 | Q84: =O84*6+P84 -> 57 | S84: PORT MELBOURNE
A85: YARRAVILLE | C85: 3 | D85: 2 | E85: =C85*6+D85 -> 20 | G85: 6 | H85: 5 | I85: =G85*6+H85 -> 41 | K85: 6 | L85: 6 | M85: =K85*6+L85 -> 42 | O85: 8 | P85: 7 | Q85: =O85*6+P85 -> 55 | S85: WILLIAMSON
A86: BEST PLAYERS
A87: PORT MELBOURNE | D87: GARBUTT | G87: WILKIN | J87: SKILTON | M87: PETERSON | P87: CARPENTER | S87: CROMPTON
A88: YARRAVILLE | D88: KNOTT | G88: ROBERTS | J88: HANNAN | M88: DOOLAN | P88: W BROWN | S88: HENRY
A89: GOALKICKERS
A90: PORT MELBOURNE | D90: WILKIN 3 | G90: FORBES | I90: PLUMRIDGE | L90: LEE-ARCHER | O90: BARNES
A91: YARRAVILLE | D91: HENRY 4 | G91: COULSELL 2 | J91: CHAPPLE | M91: KENNEDY
A93: BRUNSWICK | C93: 1 | D93: 5 | E93: =C93*6+D93 -> 11 | G93: 7 | H93: 14 | I93: =G93*6+H93 -> 56 | K93: 12 | L93: 17 | M93: =K93*6+L93 -> 89 | O93: 14 | P93: 21 | Q93: =O93*6+P93 -> 105 | S93: BRUNSWICK
A94: SANDRINGHAM | C94: 2 | D94: 2 | E94: =C94*6+D94 -> 14 | G94: 2 | H94: 5 | I94: =G94*6+H94 -> 17 | K94: 4 | L94: 6 | M94: =K94*6+L94 -> 30 | O94: 7 | P94: 8 | Q94: =O94*6+P94 -> 50 | S94: MORCOM
A95: BEST PLAYERS
A96: BRUNSWICK | D96: FITZGERALD | G96: McINERNEY | J96: PLUMMER | M96: EAVES | P96: PANNAM | S96: STEELE
A97: SANDRINGHAM | D97: DE LUCA | G97: CHALLIS | J97: BOYD | M97: McCASHNEY | P97: BOURKE | S97: FRICKER
A98: GOALKICKERS
A99: BRUNSWICK | D99: McINERNEY 6 | G99: WILLIAMS 3 | J99: PLUMMER 2 | M99: STEELE | O99: FITZGERALD | R99: HEARN
A100: SANDRINGHAM | D100: DE LUCA 2 | G100: ARNELL 2 | J100: DICK | L100: GAY | N100: BOYD
A102: CAMBERWELL | C102: 2 | D102: 3 | E102: =C102*6+D102 -> 15 | G102: 5 | H102: 7 | I102: =G102*6+H102 -> 37 | K102: 7 | L102: 11 | M102: =K102*6+L102 -> 53 | O102: 10 | P102: 15 | Q102: =O102*6+P102 -> 75 | S102: CAMBERWELL
A103: PRAHRAN | C103: 2 | D103: 1 | E103: =C103*6+D103 -> 13 | G103: 4 | H103: 3 | I103: =G103*6+H103 -> 27 | K103: 6 | L103: 4 | M103: =K103*6+L103 -> 40 | O103: 9 | P103: 5 | Q103: =O103*6+P103 -> 59 | S103: MUTCH
A104: BEST PLAYERS
A105: CAMBERWELL | D105: WOODFORD | G105: LAWN | I105: BOOTHMAN | L105: MILLS | O105: PRYOR | R105: L GOUGH
A106: PRAHRAN | D106: LORD | G106: BREWIS | I106: F SMITH | L106: B SMITH | O106: McGRATH | R106: SUTCLIFFE
A107: GOALKICKERS
A108: CAMBERWELL | D108: WOODFORD 6 | G108: GOUGH | I108: PRYOR | K108: MILLS | N108: GREENBURY
A109: PRAHRAN | D109: HARLEY 3 | G109: LORD 3 | I109: SUTCLIFFE | L109: F SMITH | N109: McGRATH
A111: BRIGHTON | C111: 7 | D111: 7 | E111: =C111*6+D111 -> 49 | G111: 7 | H111: 7 | I111: =G111*6+H111 -> 49 | K111: 8 | L111: 12 | M111: =K111*6+L111 -> 60 | O111: 10 | P111: 13 | Q111: =O111*6+P111 -> 73 | S111: ELSTERNWICK PARK
A112: NORTHCOTE | C112: 1 | D112: 1 | E112: =C112*6+D112 -> 7 | G112: 6 | H112: 8 | I112: =G112*6+H112 -> 44 | K112: 6 | L112: 8 | M112: =K112*6+L112 -> 44 | O112: 9 | P112: 10 | Q112: =O112*6+P112 -> 64 | S112: FROOD
A113: BEST PLAYERS
A114: BRIGHTON | D114: BESWICK | G114: ALDRIDGE | J114: LEAPER | M114: CARROLL | P114: DUNBAR | S114: BORLAND
A115: NORTHCOTE | D115: J WOODS | G115: KOOP | J115: SAYNOR | M115: ROWE | P115: NICHOLLS | S115: COCKRAM
A116: GOALKICKERS
A117: BRIGHTON | D117: TULLOH 2 | G117: RENNIE 2 | J117: BURNES | L117: BESWICK | N117: HUNT | P117: LEAPER | R117: WRIGHT
A118: NORTHCOTE | D118: GOUGH 3 | G118: SEYMOUR 2 | J118: KOOP | L118: ROSS | N118: ROWE | P118: STOCKDALE
A120: ROUND 3 | E120: 4TH MAY | J120: WEATHER | M120: FINE MILD NORTH WIND | S120: PLAYED AT | X120: LADDER | AB120: ROUND | AD120: 3
D121: 1ST QTR | H121: 2ND QTR | L121: 3RD QTR | P121: FINAL | S121: PORT MELBOURNE
A122: BRUNSWICK | C122: 3 | D122: 1 | E122: =C122*6+D122 -> 19 | G122: 3 | H122: 4 | I122: =G122*6+H122 -> 22 | K122: 5 | L122: 8 | M122: =K122*6+L122 -> 38 | O122: 5 | P122: 10 | Q122: =O122*6+P122 -> 40 | S122: UMPIRE | W122: TEAM | X122: W | Y122: L | Z122: D | AA122: FOR | AB122: AGST | AC122: % | AD122: PTS
A123: PORT MELBOURNE | C123: 0 | D123: 2 | E123: =C123*6+D123 -> 2 | G123: 0 | H123: 4 | I123: =G123*6+H123 -> 4 | K123: 4 | L123: 6 | M123: =K123*6+L123 -> 30 | O123: 5 | P123: 9 | Q123: =O123*6+P123 -> 39 | S123: MAKER
A124: BEST PLAYERS | W124: OAKLEIGH | X124: 3 | Y124: 0 | Z124: 0 | AA124: 298 | AB124: 190 | AC124: 156.84210526315789 | AD124: 12
A125: BRUNSWICK | D125: KENNETT | F125: WHITELEY | I125: PANNAM | L125: BLACKMORE | O125: HEARN | Q125: PLUMMER | W125: COBURG | X125: 2 | Y125: 0 | Z125: 1 | AA125: 324 | AB125: 221 | AC125: 146.60633484162895 | AD125: 10
A126: PORT MELBOURNE | D126: SKILTON | F126: CARPENTER | I126: BARNES | L126: SMITH | O126: PERRETT | Q126: STYLES | W126: BRUNSWICK | X126: 2 | Y126: 0 | Z126: 1 | AA126: 258 | AB126: 202 | AC126: 127.72277227722772 | AD126: 10
A127: GOALKICKERS | W127: BRIGHTON | X127: 2 | Y127: 1 | Z127: 0 | AA127: 276 | AB127: 222 | AC127: 124.32432432432432 | AD127: 8
A128: BRUNSWICK | D128: McINERNEY 2 | H128: PLUMMER 2 | K128: FITZGERALD
A129: PORT MELBOURNE | D129: PETERSON 2 | H129: BOURKE | K129: SKILTON | N129: REES | W129: PRESTON | X129: 2 | Y129: 1 | Z129: 0 | AA129: 244 | AB129: 213 | AC129: 114.55399061032864 | AD129: 8
W130: PORT MELBOURNE | X130: 2 | Y130: 1 | Z130: 0 | AA130: 187 | AB130: 175 | AC130: 106.85714285714286 | AD130: 8
A131: PRESTON | C131: 2 | D131: 1 | E131: =C131*6+D131 -> 13 | G131: 7 | H131: 6 | I131: =G131*6+H131 -> 48 | K131: 8 | L131: 9 | M131: =K131*6+L131 -> 57 | O131: 13 | P131: 12 | Q131: =O131*6+P131 -> 90 | S131: ELSTERNWICK PARK | W131: YARRAVILLE | X131: 1 | Y131: 2 | Z131: 0 | AA131: 257 | AB131: 208 | AC131: 123.55769230769231 | AD131: 4
A132: BRIGHTON | C132: 2 | D132: 10 | E132: =C132*6+D132 -> 22 | G132: 2 | H132: 11 | I132: =G132*6+H132 -> 23 | K132: 10 | L132: 13 | M132: =K132*6+L132 -> 73 | O132: 12 | P132: 16 | Q132: =O132*6+P132 -> 88 | S132: McNEICE | W132: NORTHCOTE | X132: 1 | Y132: 2 | Z132: 0 | AA132: 265 | AB132: 243 | AC132: 109.05349794238683 | AD132: 4
A133: BEST PLAYERS | W133: CAMBERWELL | X133: 1 | Y133: 2 | Z133: 0 | AA133: 211 | AB133: 316 | AC133: 66.77215189873418 | AD133: 4
A134: PRESTON | D134: ADAMS | F134: NICHOLSON | I134: WHITE | K134: SHAW | N134: MILLER | Q134: CAMPBELL | W134: WILLIAMSTOWN | X134: 1 | Y134: 2 | Z134: 0 | AA134: 202 | AB134: 304 | AC134: 66.44736842105263 | AD134: 4
A135: BRIGHTON | D135: BESWICK | F135: TULLOH | I135: ELLIOTT | K135: STOREY | N135: WEBB | Q135: LEAPER | W135: PRAHRAN | X135: 0 | Y135: 3 | Z135: 0 | AA135: 220 | AB135: 272 | AC135: 80.882352941176464 | AD135: 0
A136: GOALKICKERS | W136: SANDRINGHAM | X136: 0 | Y136: 3 | Z136: 0 | AA136: 164 | AB136: 340 | AC136: 48.235294117647058 | AD136: 0
A137: PRESTON | D137: ADAMS 4 | F137: DAVIE 3 | H137: BRIDGFORD 2 | K137: SHAW 2 | M137: SURTEES | O137: DENNINGTON
A138: BRIGHTON | D138: MATTHEWS 4 | G138: RENNIE 3 | I138: NOONAN 2 | L138: TULLOH | N138: HUNT | P138: LEAPER
A140: COBURG | C140: 4 | D140: 4 | E140: =C140*6+D140 -> 28 | G140: 7 | H140: 5 | I140: =G140*6+H140 -> 47 | K140: 14 | L140: 11 | M140: =K140*6+L140 -> 95 | O140: 23 | P140: 13 | Q140: =O140*6+P140 -> 151 | S140: COBURG
A141: WILLIAMSTOWN | C141: 1 | D141: 2 | E141: =C141*6+D141 -> 8 | G141: 5 | H141: 7 | I141: =G141*6+H141 -> 37 | K141: 6 | L141: 9 | M141: =K141*6+L141 -> 45 | O141: 7 | P141: 15 | Q141: =O141*6+P141 -> 57 | S141: LYNCH
A142: BEST PLAYERS
A143: COBURG | D143: F PLANT | G143: WATT | I143: HARRIS | L143: VOIGHT | O143: CHAPMAN | R143: JENKINS
A144: WILLIAMSTOWN | D144: CLAPSON | G144: BRITT | I144: McEWAN | L144: HELLWIG | O144: McAULIFFE | R144: TRUMAN
A145: GOALKICKERS
A146: COBURG | D146: F PLANT 8 | F146: VOIGHT 3 | I146: McGRATH 3 | L146: COLBERT 2 | N146: JENKINS 2 | Q146: HARRIS | S146: STONE | U146: MEARS | W146: O'KEEFE | X146: KERLEY
A147: WILLIAMSTOWN | D147: BRITT 2 | F147: McAULIFFE 2 | I147: SHEEHAN | L147: DREW | N147: BEASLEY
A149: NORTHCOTE | C149: 4 | D149: 4 | E149: =C149*6+D149 -> 28 | G149: 8 | H149: 10 | I149: =G149*6+H149 -> 58 | K149: 13 | L149: 14 | M149: =K149*6+L149 -> 92 | O149: 20 | P149: 16 | Q149: =O149*6+P149 -> 136 | S149: NORTHCOTE
A150: CAMBERWELL | C150: 3 | D150: 4 | E150: =C150*6+D150 -> 22 | G150: 7 | H150: 8 | I150: =G150*6+H150 -> 50 | K150: 8 | L150: 11 | M150: =K150*6+L150 -> 59 | O150: 9 | P150: 13 | Q150: =O150*6+P150 -> 67 | S150: LESTER
A151: BEST PLAYERS
A152: NORTHCOTE | D152: WOODS | G152: PERKINS | J152: KOOP | M152: NICHOLLS | P152: MILNE | S152: SEYMOUR
A153: CAMBERWELL | D153: COFFIN | G153: LAWN | J153: HARRISON | M153: CALWELL | P153: PAGE | S153: WARD
A154: GOALKICKERS
A155: NORTHCOTE | D155: GOUGH 8 | G155: SEYMOUR 4 | J155: STOCKDALE 3 | M155: ROSS 2 | O155: COLE 2 | Q155: MILNE
A156: CAMBERWELL | D156: COFFIN 6 | G156: L GOUGH | J156: PAGE | L156: WARD
A158: YARRAVILLE | C158: 4 | D158: 7 | E158: =C158*6+D158 -> 31 | G158: 5 | H158: 8 | I158: =G158*6+H158 -> 38 | K158: 13 | L158: 13 | M158: =K158*6+L158 -> 91 | O158: 17 | P158: 18 | Q158: =O158*6+P158 -> 120 | S158: Y'VILLLE
A159: SANDRINGHAM | C159: 3 | D159: 3 | E159: =C159*6+D159 -> 21 | G159: 5 | H159: 5 | I159: =G159*6+H159 -> 35 | K159: 5 | L159: 5 | M159: =K159*6+L159 -> 35 | O159: 6 | P159: 10 | Q159: =O159*6+P159 -> 46 | S159: MILLIKEN
A160: BEST PLAYERS
A161: YARRAVILLE | D161: COULSELL | G161: ROBERTS | J161: THOMAS | M161: KNOTT | P161: JOYCE | S161: McKELLIN
A162: SANDRINGHAM | D162: McCASHNEY | G162: CHALLIS | J162: COGDEN | M162: DE LUCA | P162: EWIN | S162: BOYD
A163: GOALKICKERS
A164: YARRAVILLE | D164: COULSELL 6 | G164: HENRY 4 | I164: MORAN 2 | K164: LOVETT 2 | M164: CHAPPLE | O164: LYONS | Q164: CUTTING
A165: SANDRINGHAM | D165: BOYD 2 | G165: GAY | I165: DICK | K165: DE LUCA | N165: JO RYAN
A167: OAKLEIGH | C167: 1 | D167: 2 | E167: =C167*6+D167 -> 8 | G167: 7 | H167: 3 | I167: =G167*6+H167 -> 45 | K167: 10 | L167: 8 | M167: =K167*6+L167 -> 68 | O167: 16 | P167: 10 | Q167: =O167*6+P167 -> 106 | S167: OAKLEIGH
A168: PRAHRAN | C168: 5 | D168: 3 | E168: =C168*6+D168 -> 33 | G168: 7 | H168: 3 | I168: =G168*6+H168 -> 45 | K168: 9 | L168: 7 | M168: =K168*6+L168 -> 61 | O168: 12 | P168: 9 | Q168: =O168*6+P168 -> 81 | S168: SCHAEFER
A169: BEST PLAYERS
A170: OAKLEIGH | D170: FLEMING | G170: RUDOLPH | J170: MAHER | M170: HOLFORD | P170: TAYLOR | S170: SPAIN
A171: PRAHRAN | D171: F SMITH | G171: LORD | J171: NAYLOR | M171: OSBORNE | P171: B SMITH
A172: GOALKICKERS
A173: OAKLEIGH | D173: FLEMING 4 | G173: IRWIN 4 | I173: TAYLOR 3 | L173: MAHER 2 | N173: RUDOLPH | P173: CLEARY | R173: HOLFORD
A174: PRAHRAN | D174: HARLEY 4 | F174: B SMITH 2 | I174: GREENWOOD | L174: LORD | N174: LUCAS | P174: STAINSBURY | S174: ANTHONY | V174: BARNETT
A176: ROUND 4 | E176: 11TH MAY | J176: WEATHER | M176: FINE MILD | S176: PLAYED AT | X176: LADDER | AB176: ROUND | AD176: 4
D177: 1ST QTR | H177: 2ND QTR | L177: 3RD QTR | P177: FINAL | S177: YARRAVILLE
A178: YARRAVILLE | C178: 4 | D178: 0 | E178: =C178*6+D178 -> 24 | G178: 5 | H178: 3 | I178: =G178*6+H178 -> 33 | K178: 7 | L178: 5 | M178: =K178*6+L178 -> 47 | O178: 10 | P178: 8 | Q178: =O178*6+P178 -> 68 | S178: UMPIRE | W178: TEAM | X178: W | Y178: L | Z178: D | AA178: FOR | AB178: AGST | AC178: % | AD178: PTS
A179: OAKLEIGH | C179: 3 | D179: 1 | E179: =C179*6+D179 -> 19 | G179: 3 | H179: 5 | I179: =G179*6+H179 -> 23 | K179: 4 | L179: 7 | M179: =K179*6+L179 -> 31 | O179: 8 | P179: 9 | Q179: =O179*6+P179 -> 57 | S179: WILLIAMSON
A180: BEST PLAYERS | W180: COBURG | X180: 3 | Y180: 0 | Z180: 1 | AA180: 429 | AB180: 273 | AC180: 157.14285714285714 | AD180: 14
A181: YARRAVILLE | D181: SMITH | G181: SHERMAN | I181: COULSELL | L181: FROUD | N181: HANNAN | Q181: THOMAS | W181: OAKLEIGH | X181: 3 | Y181: 1 | Z181: 0 | AA181: 355 | AB181: 258 | AC181: 137.59689922480621 | AD181: 12
A182: OAKLEIGH | D182: RUDOLPH | G182: FLEMING | I182: OFFICER | L182: THOMAS | N182: SPAIN | Q182: CHAPMAN | W182: BRIGHTON | X182: 3 | Y182: 1 | Z182: 0 | AA182: 358 | AB182: 275 | AC182: 130.18181818181819 | AD182: 12
A183: GOALKICKERS | W183: PRESTON | X183: 3 | Y183: 1 | Z183: 0 | AA183: 340 | AB183: 274 | AC183: 124.08759124087591 | AD183: 12
A184: YARRAVILLE | D184: SINCLAIR 3 | F184: THOMAS 2 | I184: LOVETT | K184: CUTTING | M184: FARRELL | O184: HANNAN | Q184: FROUD
A185: OAKLEIGH | D185: FLEMING 2 | G185: SPAIN 2 | I185: OFFICER 2 | K185: TAYLOR | M185: IRWIN | W185: PORT MELBOURNE | X185: 3 | Y185: 1 | Z185: 0 | AA185: 250 | AB185: 218 | AC185: 114.6788990825688 | AD185: 12
W186: BRUNSWICK | X186: 2 | Y186: 1 | Z186: 1 | AA186: 333 | AB186: 278 | AC186: 119.7841726618705 | AD186: 10
A187: NORTHCOTE | C187: 2 | D187: 0 | E187: =C187*6+D187 -> 12 | G187: 3 | H187: 4 | I187: =G187*6+H187 -> 22 | K187: 5 | L187: 7 | M187: =K187*6+L187 -> 37 | O187: 10 | P187: 16 | Q187: =O187*6+P187 -> 76 | S187: BRUNSWICK | W187: YARRAVILLE | X187: 2 | Y187: 2 | Z187: 0 | AA187: 325 | AB187: 265 | AC187: 122.64150943396227 | AD187: 8
A188: BRUNSWICK | C188: 4 | D188: 4 | E188: =C188*6+D188 -> 28 | G188: 6 | H188: 4 | I188: =G188*6+H188 -> 40 | K188: 10 | L188: 8 | M188: =K188*6+L188 -> 68 | O188: 11 | P188: 9 | Q188: =O188*6+P188 -> 75 | S188: MUTCH | W188: NORTHCOTE | X188: 2 | Y188: 2 | Z188: 0 | AA188: 341 | AB188: 318 | AC188: 107.23270440251572 | AD188: 8
A189: BEST PLAYERS | W189: WILLIAMSTOWN | X189: 1 | Y189: 3 | Z189: 0 | AA189: 245 | AB189: 367 | AC189: 66.757493188010898 | AD189: 4
A190: NORTHCOTE | D190: ROBINSON | G190: PERKINS | I190: SEYMOUR | L190: ROSS | N190: WILSON | Q190: COCKRAM | W190: CAMBERWELL | X190: 1 | Y190: 3 | Z190: 0 | AA190: 272 | AB190: 412 | AC190: 66.019417475728162 | AD190: 4
A191: BRUNSWICK | D191: RALEIGH | G191: STEELE | I191: McINERNEY | L191: EAVES | N191: WILLIAMS | Q191: FITZGERALD | W191: PRAHRAN | X191: 0 | Y191: 4 | Z191: 0 | AA191: 273 | AB191: 354 | AC191: 77.118644067796609 | AD191: 0
A192: GOALKICKERS | W192: SANDRINGHAM | X192: 0 | Y192: 4 | Z192: 0 | AA192: 216 | AB192: 445 | AC192: 48.539325842696627 | AD192: 0
A193: NORTHCOTE | D193: SEYMOUR 4 | G193: COLE 2 | I193: STOCKDALE | L193: GOUGH | N193: MILNE
A194: BRUNSWICK | D194: McINERNEY 6 | G194: STEELE 2 | I194: PLUMMER | L194: RALEIGH | N194: MILLEN
A196: PRESTON | C196: 4 | D196: 3 | E196: =C196*6+D196 -> 27 | G196: 8 | H196: 9 | I196: =G196*6+H196 -> 57 | K196: 11 | L196: 12 | M196: =K196*6+L196 -> 78 | O196: 13 | P196: 18 | Q196: =O196*6+P196 -> 96 | S196: CAMBERWELL
A197: CAMBERWELL | C197: 2 | D197: 3 | E197: =C197*6+D197 -> 15 | G197: 5 | H197: 3 | I197: =G197*6+H197 -> 33 | K197: 7 | L197: 4 | M197: =K197*6+L197 -> 46 | O197: 9 | P197: 7 | Q197: =O197*6+P197 -> 61 | S197: NEWMAN
A198: BEST PLAYERS
A199: PRESTON | D199: SURTEES | G199: WHITE | I199: TAYLOR | L199: BRIDGFORD | O199: MILLER | R199: DAVIE
A200: CAMBERWELL | D200: LAWN | G200: PAGE | I200: WOODFORD | L200: SHANAHAN | O200: COFFIN | R200: MAYER
A201: GOALKICKERS
A202: PRESTON | D202: DAVIE 2 | F202: BRIDGFORD 2 | I202: SURTEES 2 | K202: MONOHAN 2 | N202: DOUGLAS 2 | Q202: ADAMS | S202: CAMPBELL | V202: SUMMERS
A203: CAMBERWELL | D203: WOODFORD 2 | G203: COFFIN 2 | I203: LAWN 2 | K203: GREENBURY | N203: HARRISON | Q203: MEYER
A205: PORT MELBOURNE | C205: 0 | D205: 3 | E205: =C205*6+D205 -> 3 | G205: 3 | H205: 8 | I205: =G205*6+H205 -> 26 | K205: 5 | L205: 11 | M205: =K205*6+L205 -> 41 | O205: 8 | P205: 15 | Q205: =O205*6+P205 -> 63 | S205: WILLIAMSTOWN
A206: WILLIAMSTOWN | C206: 1 | D206: 2 | E206: =C206*6+D206 -> 8 | G206: 3 | H206: 2 | I206: =G206*6+H206 -> 20 | K206: 4 | L206: 4 | M206: =K206*6+L206 -> 28 | O206: 6 | P206: 7 | Q206: =O206*6+P206 -> 43 | S206: FROOD
A207: BEST PLAYERS
A208: PORT MELBOURNE | D208: SMITH | G208: SKILTON | J208: BEDFORD | M208: FREYER | P208: GARBUTT | S208: REES
A209: WILLIAMSTOWN | D209: SHEEHAN | G209: CLAPSON | J209: JOHNS | M209: SYKES | P209: NUGENT
A210: GOALKICKERS
A211: PORT MELBOURNE | D211: SMITH 2 | G211: FREYER 2 | J211: BEDFORD 2 | M211: WILKIN | O211: BARNES
A212: WILLIAMSTOWN | D212: HELLWIG 4 | G212: BRITT 2
A214: BRIGHTON | C214: 4 | D214: 3 | E214: =C214*6+D214 -> 27 | G214: 7 | H214: 4 | I214: =G214*6+H214 -> 46 | K214: 9 | L214: 6 | M214: =K214*6+L214 -> 60 | O214: 12 | P214: 10 | Q214: =O214*6+P214 -> 82 | S214: TOORAK PARK
A215: PRAHRAN | C215: 2 | D215: 3 | E215: =C215*6+D215 -> 15 | G215: 3 | H215: 8 | I215: =G215*6+H215 -> 26 | K215: 6 | L215: 15 | M215: =K215*6+L215 -> 51 | O215: 6 | P215: 17 | Q215: =O215*6+P215 -> 53 | S215: McKINNON
A216: BEST PLAYERS
A217: BRIGHTON | D217: MATTHEWS | G217: RENNIE | I217: LEAPER | L217: ALDRIDGE | O217: BESWICK | R217: TULLOH
A218: PRAHRAN | D218: JORDAN | G218: LORD | I218: LUCAS | L218: JIM SMITH | O218: F SMITH | R218: BREWIS
A219: GOALKICKERS
A220: BRIGHTON | D220: MATTHEWS 5 | G220: RENNIE 2 | I220: LEAPER 2 | K220: DUNBAR | M220: HUNT | O220: STEWART
A221: PRAHRAN | D221: LORD 2 | G221: BARNETT | I221: HARLEY | K221: JORDAN | M221: McPHERSON
A223: COBURG | C223: 4 | D223: 1 | E223: =C223*6+D223 -> 25 | G223: 7 | H223: 6 | I223: =G223*6+H223 -> 48 | K223: 11 | L223: 9 | M223: =K223*6+L223 -> 75 | O223: 15 | P223: 15 | Q223: =O223*6+P223 -> 105 | S223: BEACH ROAD
A224: SANDRINGHAM | C224: 2 | D224: 4 | E224: =C224*6+D224 -> 16 | G224: 3 | H224: 8 | I224: =G224*6+H224 -> 26 | K224: 5 | L224: 11 | M224: =K224*6+L224 -> 41 | O224: 6 | P224: 16 | Q224: =O224*6+P224 -> 52 | S224: MURRAY
A225: BEST PLAYERS
A226: COBURG | D226: VOIGHT | G226: F PLANT | J226: McGRATH | M226: JENKINS | P226: MEARS | S226: HARRIS
A227: SANDRINGHAM | D227: BOURKE | G227: McCASHNEY | J227: WATERS | M227: BOYD | P227: DE LUCA | S227: CHALLIS
A228: GOALKICKERS
A229: COBURG | D229: F PLANT 6 | F229: COLBERT 3 | I229: McGRATH 2 | L229: MEARS | N229: HARRIS | P229: JENKINS | R229: STONE
A230: SANDRINGHAM | D230: GEDDES | G230: GAY | I230: DE LUCA | K230: BOYD | M230: CLARK | O230: WATERS
A232: ROUND 5 | E232: 18TH MAY | J232: WEATHER | M232: CLOUDY NORTH WIND | S232: PLAYED AT | X232: LADDER | AB232: ROUND | AD232: 5
D233: 1ST QTR | H233: 2ND QTR | L233: 3RD QTR | P233: FINAL | S233: COBURG
A234: PORT MELBOURNE | C234: 5 | D234: 4 | E234: =C234*6+D234 -> 34 | G234: 6 | H234: 4 | I234: =G234*6+H234 -> 40 | K234: 12 | L234: 10 | M234: =K234*6+L234 -> 82 | O234: 14 | P234: 11 | Q234: =O234*6+P234 -> 95 | S234: UMPIRE | W234: TEAM | X234: W | Y234: L | Z234: D | AA234: FOR | AB234: AGST | AC234: % | AD234: PTS
A235: COBURG | C235: 0 | D235: 1 | E235: =C235*6+D235 -> 1 | G235: 3 | H235: 3 | I235: =G235*6+H235 -> 21 | K235: 6 | L235: 5 | M235: =K235*6+L235 -> 41 | O235: 10 | P235: 12 | Q235: =O235*6+P235 -> 72 | S235: LESTER
A236: BEST PLAYERS | W236: OAKLEIGH | X236: 4 | Y236: 1 | Z236: 0 | AA236: 446 | AB236: 316 | AC236: 141.13924050632912 | AD236: 16
A237: PORT MELBOURNE | D237: WILKIN | G237: BOURKE | I237: SMITH | K237: PERRETT | N237: CARPENTER | Q237: SKILTON | W237: BRIGHTON | X237: 4 | Y237: 1 | Z237: 0 | AA237: 461 | AB237: 359 | AC237: 128.41225626740948 | AD237: 16
A238: COBURG | D238: CHARLESTON | G238: MEARS | I238: COLBERT | K238: HARRIS | N238: F PLANT | Q238: KIGHT | W238: PRESTON | X238: 4 | Y238: 1 | Z238: 0 | AA238: 424 | AB238: 341 | AC238: 124.34017595307918 | AD238: 16
A239: GOALKICKERS | W239: PORT MELBOURNE | X239: 4 | Y239: 1 | Z239: 0 | AA239: 345 | AB239: 290 | AC239: 118.96551724137932 | AD239: 16
A240: PORT MELBOURNE | D240: BEDFORD 5 | F240: WILKIN 2 | H240: HYDE 2 | J240: FREYER 2 | M240: SMITH | O240: PETERSON | Q240: BARNES
A241: COBURG | D241: F PLANT 5 | G241: COLBERT 3 | J241: McGRATH | M241: KERLEY | W241: COBURG | X241: 3 | Y241: 1 | Z241: 1 | AA241: 501 | AB241: 368 | AC241: 136.14130434782609 | AD241: 14
W242: YARRAVILLE | X242: 3 | Y242: 2 | Z242: 0 | AA242: 461 | AB242: 382 | AC242: 120.68062827225131 | AD242: 12
A243: BRIGHTON | C243: 2 | D243: 0 | E243: =C243*6+D243 -> 12 | G243: 11 | H243: 5 | I243: =G243*6+H243 -> 71 | K243: 13 | L243: 8 | M243: =K243*6+L243 -> 86 | O243: 15 | P243: 13 | Q243: =O243*6+P243 -> 103 | S243: ELSTERNWICK PARK | W243: NORTHCOTE | X243: 3 | Y243: 2 | Z243: 0 | AA243: 427 | AB243: 377 | AC243: 113.26259946949602 | AD243: 12
A244: BRUNSWICK | C244: 5 | D244: 4 | E244: =C244*6+D244 -> 34 | G244: 6 | H244: 5 | I244: =G244*6+H244 -> 41 | K244: 9 | L244: 10 | M244: =K244*6+L244 -> 64 | O244: 12 | P244: 12 | Q244: =O244*6+P244 -> 84 | S244: MURRAY | W244: BRUNSWICK | X244: 2 | Y244: 2 | Z244: 1 | AA244: 417 | AB244: 381 | AC244: 109.44881889763779 | AD244: 10
A245: BEST PLAYERS | W245: CAMBERWELL | X245: 1 | Y245: 4 | Z245: 0 | AA245: 389 | AB245: 548 | AC245: 70.985401459854018 | AD245: 4
A246: BRIGHTON | D246: HUNT | F246: BESWICK | I246: STEWART | L246: ELLIOTT | N246: RENNIE | Q246: MATTHEWS | W246: WILLIAMSTOWN | X246: 1 | Y246: 4 | Z246: 0 | AA246: 312 | AB246: 451 | AC246: 69.179600886917953 | AD246: 4
A247: BRUNSWICK | D247: STEELE | F247: BLACKMORE | I247: KENNETT | L247: ALESSIO | N247: FITZGERALD | Q247: PANNAM | W247: PRAHRAN | X247: 0 | Y247: 5 | Z247: 0 | AA247: 332 | AB247: 440 | AC247: 75.454545454545453 | AD247: 0
A248: GOALKICKERS | W248: SANDRINGHAM | X248: 0 | Y248: 5 | Z248: 0 | AA248: 274 | AB248: 536 | AC248: 51.119402985074629 | AD248: 0
A249: BRIGHTON | D249: MATTHEWS 6 | G249: STEWART 5 | J249: HUNT 2 | L249: RENNIE | N249: TULLOH
A250: BRUNSWICK | D250: CHARGE 2 | F250: CARTON 2 | I250: CLARKE 2 | K250: PLUMMER | M250: FITZGERALD | P250: KENNETT | R250: PANNAM | U250: STEELE | W250: ALESSIO
A252: PRESTON | C252: 1 | D252: 3 | E252: =C252*6+D252 -> 9 | G252: 8 | H252: 13 | I252: =G252*6+H252 -> 61 | K252: 11 | L252: 15 | M252: =K252*6+L252 -> 81 | O252: 11 | P252: 18 | Q252: =O252*6+P252 -> 84 | S252: PRESTON
A253: WILLIAMSTOWN | C253: 2 | D253: 4 | E253: =C253*6+D253 -> 16 | G253: 3 | H253: 5 | I253: =G253*6+H253 -> 23 | K253: 5 | L253: 10 | M253: =K253*6+L253 -> 40 | O253: 9 | P253: 13 | Q253: =O253*6+P253 -> 67 | S253: MAKER
A254: BEST PLAYERS
A255: PRESTON | D255: SURTEES | G255: MILLER | I255: BRIDGFORD | L255: WHITE | O255: SUMMERS | R255: STOTT
A256: WILLIAMSTOWN | D256: BRITT | G256: JOHNS | I256: SYKES | L256: WARREN | O256: CLAPSON | R256: McEWAN
A257: GOALKICKERS
A258: PRESTON | D258: SURTEES 3 | G258: LEE 3 | I258: CAMPBELL | L258: BRIDGFORD | N258: DAVIE | P258: SUMMERS | R258: McMEEKIN
A259: WILLIAMSTOWN | D259: McDONALD 2 | G259: HELWIG 2 | J259: JOHNS 2 | M259: CLAPSON 2 | P259: DUNCAN
A261: YARRAVILLE | C261: 5 | D261: 5 | E261: =C261*6+D261 -> 35 | G261: 8 | H261: 8 | I261: =G261*6+H261 -> 56 | K261: 17 | L261: 18 | M261: =K261*6+L261 -> 120 | O261: 18 | P261: 28 | Q261: =O261*6+P261 -> 136 | S261: CAMBERWELL
A262: CAMBERWELL | C262: 6 | D262: 0 | E262: =C262*6+D262 -> 36 | G262: 12 | H262: 2 | I262: =G262*6+H262 -> 74 | K262: 13 | L262: 6 | M262: =K262*6+L262 -> 84 | O262: 18 | P262: 9 | Q262: =O262*6+P262 -> 117 | S262: SCHAEFER
A263: BEST PLAYERS
A264: YARRAVILLE | D264: OGILVIE | G264: COULSELL | J264: HENRY | M264: GAMBETTA | P264: SINCLAIR | S264: KNOTT
A265: CAMBERWELL | D265: LAWN | G265: WOODFORD | J265: QUARTERMAIN | M265: PAGE | P265: MEYER | S265: CALWELL
A266: GOALKICKERS
A267: YARRAVILLE | D267: COULSELL 5 | G267: GAMBETTA 5 | J267: OGILVIE 3 | M267: HENRY | O267: SINCLAIR | Q267: JOYCE | R267: FARRELL | U267: KNOTT
A268: CAMBERWELL | D268: WARD 4 | F268: WOODFORD 4 | I268: LAWN 3 | K268: MEYER 2 | M268: COFFIN | O268: PAGE | P268: BIRCHALL | R268: McCOLL | T268: CALWELL
A270: NORTHCOTE | C270: 4 | D270: 5 | E270: =C270*6+D270 -> 29 | G270: 7 | H270: 7 | I270: =G270*6+H270 -> 49 | K270: 10 | L270: 10 | M270: =K270*6+L270 -> 70 | O270: 12 | P270: 14 | Q270: =O270*6+P270 -> 86 | S270: NORTHCOTE
A271: PRAHRAN | C271: 2 | D271: 3 | E271: =C271*6+D271 -> 15 | G271: 3 | H271: 5 | I271: =G271*6+H271 -> 23 | K271: 6 | L271: 7 | M271: =K271*6+L271 -> 43 | O271: 8 | P271: 11 | Q271: =O271*6+P271 -> 59 | S271: WILLIAMSON
A272: BEST PLAYERS
A273: NORTHCOTE | D273: ROWE | G273: STOCKDALE | J273: SEYMOUR | M273: ROSS | O273: PERKINS | R273: COCKRAM
A274: PRAHRAN | D274: BREWIS | G274: LORD | J274: LUCAS | M274: F SMITH | O274: GLOVER | R274: McPHERSON
A275: GOALKICKERS
A276: NORTHCOTE | D276: GOUGH 4 | G276: POULTER 3 | J276: STOCKDALE 2 | M276: SEYMOUR | O276: COLE | Q276: MILNE
A277: PRAHRAN | D277: JORDAN 4 | G277: JACK SMITH 2 | J277: LORD | L277: McPHERSON
A279: OAKLEIGH | C279: 3 | D279: 7 | E279: =C279*6+D279 -> 25 | G279: 6 | H279: 8 | I279: =G279*6+H279 -> 44 | K279: 9 | L279: 12 | M279: =K279*6+L279 -> 66 | O279: 13 | P279: 13 | Q279: =O279*6+P279 -> 91 | S279: OAKLEIGH
A280: SANDRINGHAM | C280: 1 | D280: 2 | E280: =C280*6+D280 -> 8 | G280: 3 | H280: 2 | I280: =G280*6+H280 -> 20 | K280: 4 | L280: 6 | M280: =K280*6+L280 -> 30 | O280: 8 | P280: 10 | Q280: =O280*6+P280 -> 58 | S280: PAYNE
A281: BEST PLAYERS
A282: OAKLEIGH | D282: TAYLOR | G282: SALTER | J282: BELL | M282: McFARLANE | P282: GUNNYON | S282: BROWN
A283: SANDRINGHAM | D283: BOURKE | G283: BOYD | J283: CLARK | M283: McCASHNEY | P283: FRICKER | S283: REES
A284: GOALKICKERS
A285: OAKLEIGH | D285: TAYLOR 6 | G285: OFFICER 2 | I285: McFARLANE 2 | L285: IRWIN | N285: GODING | P285: BELL
A286: SANDRINGHAM | D286: A KENNA 2 | G286: COGDEN 2 | I286: GAY | K286: DICK | M286: CLARK | O286: HERRON
A288: ROUND 6 | E288: 25TH MAY | H288: WEATHER | K288: COOL CLOUDY SHOWERS SOUTH WIND | S288: PLAYED AT | X288: LADDER | AB288: ROUND | AD288: 6
D289: 1ST QTR | H289: 2ND QTR | L289: 3RD QTR | P289: FINAL | S289: PORT MELBOURNE
A290: OAKLEIGH | C290: 4 | D290: 2 | E290: =C290*6+D290 -> 26 | G290: 6 | H290: 3 | I290: =G290*6+H290 -> 39 | K290: 9 | L290: 5 | M290: =K290*6+L290 -> 59 | O290: 12 | P290: 8 | Q290: =O290*6+P290 -> 80 | S290: UMPIRE | W290: TEAM | X290: W | Y290: L | Z290: D | AA290: FOR | AB290: AGST | AC290: % | AD290: PTS
A291: PORT MELBOURNE | C291: 2 | D291: 2 | E291: =C291*6+D291 -> 14 | G291: 4 | H291: 10 | I291: =G291*6+H291 -> 34 | K291: 8 | L291: 11 | M291: =K291*6+L291 -> 59 | O291: 11 | P291: 13 | Q291: =O291*6+P291 -> 79 | S291: McKINNON
A292: BEST PLAYERS | W292: OAKLEIGH | X292: 5 | Y292: 1 | Z292: 0 | AA292: 526 | AB292: 395 | AC292: 133.16455696202533 | AD292: 20
A293: OAKLEIGH | D293: RUDOLPH | G293: BROWNE | I293: GUNNYON | L293: FLEMING | N293: OFFICER | Q293: MAHER | W293: PRESTON | X293: 5 | Y293: 1 | Z293: 0 | AA293: 538 | AB293: 408 | AC293: 131.86274509803923 | AD293: 20
A294: PORT MELBOURNE | D294: REES | G294: BOURKE | I294: WILKIN | L294: CROSSEN | N294: CROMPTON | Q294: SKILTON | W294: BRIGHTON | X294: 5 | Y294: 1 | Z294: 0 | AA294: 528 | AB294: 403 | AC294: 131.01736972704714 | AD294: 20
A295: GOALKICKERS | W295: COBURG | X295: 4 | Y295: 1 | Z295: 1 | AA295: 586 | AB295: 426 | AC295: 137.55868544600938 | AD295: 18
A296: OAKLEIGH | D296: OFFICER 4 | F296: TAYLOR 3 | I296: MAHER | K296: IRWIN | M296: RUDOLPH | O296: WOOLARD | Q296: CHAPMAN
A297: PORT MELBOURNE | D297: WILKIN 3 | F297: FREYER 2 | I297: PETERSON 2 | L297: FARNAN 2 | N297: SKILTON | P297: REES | W297: YARRAVILLE | X297: 4 | Y297: 2 | Z297: 0 | AA297: 525 | AB297: 427 | AC297: 122.95081967213115 | AD297: 16
W298: PORT MELBOURNE | X298: 4 | Y298: 2 | Z298: 0 | AA298: 424 | AB298: 370 | AC298: 114.5945945945946 | AD298: 16
A299: YARRAVILLE | C299: 1 | D299: 0 | E299: =C299*6+D299 -> 6 | G299: 4 | H299: 12 | I299: =G299*6+H299 -> 36 | K299: 6 | L299: 13 | M299: =K299*6+L299 -> 49 | O299: 8 | P299: 16 | Q299: =O299*6+P299 -> 64 | S299: YARRAVILLE | W299: NORTHCOTE | X299: 3 | Y299: 3 | Z299: 0 | AA299: 472 | AB299: 441 | AC299: 107.02947845804988 | AD299: 12
A300: NORTHCOTE | C300: 3 | D300: 4 | E300: =C300*6+D300 -> 22 | G300: 3 | H300: 4 | I300: =G300*6+H300 -> 22 | K300: 5 | L300: 8 | M300: =K300*6+L300 -> 38 | O300: 6 | P300: 9 | Q300: =O300*6+P300 -> 45 | S300: WILLIAMSON | W300: BRUNSWICK | X300: 2 | Y300: 3 | Z300: 1 | AA300: 484 | AB300: 495 | AC300: 97.777777777777771 | AD300: 10
A301: BEST PLAYERS | W301: CAMBERWELL | X301: 1 | Y301: 5 | Z301: 0 | AA301: 484 | AB301: 658 | AC301: 73.556231003039514 | AD301: 4
A302: YARRAVILLE | D302: KENNEDY | G302: HENRY | I302: OGILVIE | L302: THOMAS | O302: LINTON | Q302: W BROWN | W302: WILLIAMSTOWN | X302: 1 | Y302: 5 | Z302: 0 | AA302: 356 | AB302: 518 | AC302: 68.725868725868722 | AD302: 4
A303: NORTHCOTE | D303: KOOP | G303: NICHOLLS | I303: ROSS | L303: STOCKDALE | O303: POULTER | Q303: GOUGH | W303: SANDRINGHAM | X303: 1 | Y303: 5 | Z303: 0 | AA303: 384 | AB303: 631 | AC303: 60.855784469096669 | AD303: 4
A304: GOALKICKERS | W304: PRAHRAN | X304: 0 | Y304: 6 | Z304: 0 | AA304: 390 | AB304: 525 | AC304: 74.285714285714292 | AD304: 0
A305: YARRAVILLE | D305: KENNEDY 3 | G305: HENRY 2 | I305: THOMAS 2 | L305: OGILVIE
A306: NORTHCOTE | D306: STOCKDALE 3 | G306: KOOP | I306: COCK | K306: LAFFY
A308: PRESTON | C308: 2 | D308: 1 | E308: =C308*6+D308 -> 13 | G308: 9 | H308: 5 | I308: =G308*6+H308 -> 59 | K308: 11 | L308: 9 | M308: =K308*6+L308 -> 75 | O308: 17 | P308: 12 | Q308: =O308*6+P308 -> 114 | S308: PRESTON
A309: BRUNSWICK | C309: 2 | D309: 3 | E309: =C309*6+D309 -> 15 | G309: 2 | H309: 3 | I309: =G309*6+H309 -> 15 | K309: 7 | L309: 5 | M309: =K309*6+L309 -> 47 | O309: 10 | P309: 7 | Q309: =O309*6+P309 -> 67 | S309: LESTER
A310: BEST PLAYERS
A311: PRESTON | D311: SURTEES | G311: JENKINS | J311: STOTT | M311: ADAMS | O311: BASCOMBE | R311: SUMMERS
A312: BRUNSWICK | D312: KENNETT | G312: PANNAM | J312: RALEIGH | M312: PENMAN | O312: McGRATH | R312: BLACKMORE
A313: GOALKICKERS
A314: PRESTON | D314: DAVIE 7 | F314: DOWNIE 2 | I314: DODD 2 | K314: MONOHAN | M314: SURTEES | O314: ADAMS | Q314: LEE | R314: BASCOMBE | U314: STEVENS
A315: BRUNSWICK | D315: CLARK 3 | F315: BRAY 2 | I315: STEELE | K315: RALEIGH | M315: WHITELEY | O315: FORBES | Q315: McGRATH
A317: SANDRINGHAM | C317: 6 | D317: 6 | E317: =C317*6+D317 -> 42 | G317: 11 | H317: 9 | I317: =G317*6+H317 -> 75 | K317: 16 | L317: 12 | M317: =K317*6+L317 -> 108 | O317: 16 | P317: 14 | Q317: =O317*6+P317 -> 110 | S317: BEACH ROAD
A318: CAMBERWELL | C318: 2 | D318: 5 | E318: =C318*6+D318 -> 17 | G318: 5 | H318: 11 | I318: =G318*6+H318 -> 41 | K318: 7 | L318: 16 | M318: =K318*6+L318 -> 58 | O318: 12 | P318: 23 | Q318: =O318*6+P318 -> 95 | S318: MILLEKAN
A319: BEST PLAYERS
A320: SANDRINGHAM | D320: McCASHNEY | G320: CHALLIS | J320: COGDEN | M320: REES | O320: BOYD | R320: ROSS
A321: CAMBERWELL | D321: HARRISON | G321: WARD | J321: LAWN | M321: GOUGH | O321: WOODFORD | R321: BOOTHMAN
A322: GOALKICKERS
A323: SANDRINGHAM | D323: WATERS 7 | G323: BOYD 4 | I323: GAY 2 | K323: ARNELL | M323: JIM RYAN | O323: DE LUCA
A324: CAMBERWELL | D324: GOUGH 2 | F324: LAWN 2 | H324: MEYER 2 | J324: WOODFORD 2 | M324: WARD | O324: PAGE | P324: BENNETT | R324: QUARTERMAIN
A326: COBURG | C326: 4 | D326: 4 | E326: =C326*6+D326 -> 28 | G326: 6 | H326: 7 | I326: =G326*6+H326 -> 43 | K326: 11 | L326: 12 | M326: =K326*6+L326 -> 78 | O326: 12 | P326: 13 | Q326: =O326*6+P326 -> 85 | S326: TOORAK PARK
A327: PRAHRAN | C327: 3 | D327: 0 | E327: =C327*6+D327 -> 18 | G327: 5 | H327: 4 | I327: =G327*6+H327 -> 34 | K327: 5 | L327: 6 | M327: =K327*6+L327 -> 36 | O327: 8 | P327: 10 | Q327: =O327*6+P327 -> 58 | S327: FROOD
A328: BEST PLAYERS
A329: COBURG | D329: ROGERS | G329: CHAPMAN | J329: CHARLESTON | M329: VOIGHT | O329: MEARS | Q329: F PLANT
A330: PRAHRAN | D330: LUCAS | G330: JIM SMITH | J330: GREENWOOD | M330: ROWE | O330: LORD | Q330: NAYLOR
A331: GOALKICKERS
A332: COBURG | D332: F PLANT 4 | G332: MEARS 4 | I332: KERLEY | K332: COLBERT | M332: KIGHT | O332: WATT
A333: PRAHRAN | D333: JORDAN 2 | F333: NAYLOR 2 | I333: ROWE 2 | K333: BARNETT | M333: DIPROSE
A335: BRIGHTON | C335: 0 | D335: 0 | E335: =C335*6+D335 -> 0 | G335: 5 | H335: 2 | I335: =G335*6+H335 -> 32 | K335: 6 | L335: 2 | M335: =K335*6+L335 -> 38 | O335: 10 | P335: 7 | Q335: =O335*6+P335 -> 67 | S335: WILLIAMSTOWN
A336: WILLIAMSTOWN | C336: 4 | D336: 4 | E336: =C336*6+D336 -> 28 | G336: 4 | H336: 4 | I336: =G336*6+H336 -> 28 | K336: 5 | L336: 6 | M336: =K336*6+L336 -> 36 | O336: 6 | P336: 8 | Q336: =O336*6+P336 -> 44 | S336: MURRAY
A337: BEST PLAYERS
A338: BRIGHTON | D338: LEAPER | G338: BESWICK | J338: DORE | M338: RENNIE | P338: ALDRIDGE | S338: ELLIOTT
A339: WILLIAMSTOWN | D339: BRITT | G339: HELLWIG | J339: SYKES | M339: O'BRIEN | P339: McKAY | S339: BEASLEY
A340: GOALKICKERS
A341: BRIGHTON | D341: MATTHEWS 3 | G341: RENNIE 2 | I341: TULLOH | K341: BURNES | M341: LEAPER | O341: TUCKER | Q341: IRWIN
A342: WILLIAMSTOWN | D342: HELLWIG 3 | G342: O'BRIEN 2 | J342: SYKES
A344: ROUND 7 | E344: 1ST JUNE | J344: WEATHER | M344: CLOUDY BUT FINE S.E. BREEZE | S344: PLAYED AT | X344: LADDER | AB344: ROUND | AD344: 7
D345: 1ST QTR | H345: 2ND QTR | L345: 3RD QTR | P345: FINAL | S345: ELSTERNWICK PARK
A346: YARRAVILLE | C346: 2 | D346: 7 | E346: =C346*6+D346 -> 19 | G346: 6 | H346: 9 | I346: =G346*6+H346 -> 45 | K346: 9 | L346: 12 | M346: =K346*6+L346 -> 66 | O346: 12 | P346: 16 | Q346: =O346*6+P346 -> 88 | S346: UMPIRE | W346: TEAM | X346: W | Y346: L | Z346: D | AA346: FOR | AB346: AGST | AC346: % | AD346: PTS
A347: BRIGHTON | C347: 3 | D347: 4 | E347: =C347*6+D347 -> 22 | G347: 4 | H347: 8 | I347: =G347*6+H347 -> 32 | K347: 7 | L347: 10 | M347: =K347*6+L347 -> 52 | O347: 10 | P347: 13 | Q347: =O347*6+P347 -> 73 | S347: FROOD
A348: BEST PLAYERS | W348: OAKLEIGH | X348: 6 | Y348: 1 | Z348: 0 | AA348: 588 | AB348: 449 | AC348: 130.95768374164811 | AD348: 24
A349: YARRAVILLE | D349: OGILVIE | G349: COULSELL | J349: HANNAN | M349: JOYCE | O349: SMITH | Q349: CAMERON | W349: COBURG | X349: 5 | Y349: 1 | Z349: 1 | AA349: 700 | AB349: 494 | AC349: 141.70040485829961 | AD349: 22
A350: BRIGHTON | D350: BORLAND | G350: MATTHEWS | J350: LEAPER | M350: CARROLL | O350: HUNT | Q350: ELLIOTT | W350: YARRAVILLE | X350: 5 | Y350: 2 | Z350: 0 | AA350: 613 | AB350: 500 | AC350: 122.6 | AD350: 20
A351: GOALKICKERS | W351: BRIGHTON | X351: 5 | Y351: 2 | Z351: 0 | AA351: 601 | AB351: 491 | AC351: 122.40325865580448 | AD351: 20
A352: YARRAVILLE | D352: CAMERON 3 | G352: OGILVIE 3 | I352: KENNEDY 2 | L352: HENRY | N352: LOVETT | P352: COULSELL | R352: DOOLAN
A353: BRIGHTON | D353: MATTHEWS 6 | G353: ALDRIDGE 2 | J353: RENNIE | L353: DORE | W353: PORT MELBOURNE | X353: 5 | Y353: 2 | Z353: 0 | AA353: 521 | AB353: 430 | AC353: 121.16279069767442 | AD353: 20
W354: PRESTON | X354: 5 | Y354: 2 | Z354: 0 | AA354: 598 | AB354: 505 | AC354: 118.41584158415841 | AD354: 20
A355: PORT MELBOURNE | C355: 6 | D355: 3 | E355: =C355*6+D355 -> 39 | G355: 8 | H355: 8 | I355: =G355*6+H355 -> 56 | K355: 10 | L355: 9 | M355: =K355*6+L355 -> 69 | O355: 14 | P355: 13 | Q355: =O355*6+P355 -> 97 | S355: PRESTON | W355: NORTHCOTE | X355: 3 | Y355: 4 | Z355: 0 | AA355: 540 | AB355: 555 | AC355: 97.297297297297291 | AD355: 12
A356: PRESTON | C356: 2 | D356: 2 | E356: =C356*6+D356 -> 14 | G356: 6 | H356: 6 | I356: =G356*6+H356 -> 42 | K356: 7 | L356: 11 | M356: =K356*6+L356 -> 53 | O356: 8 | P356: 12 | Q356: =O356*6+P356 -> 60 | S356: MURRAY | W356: BRUNSWICK | X356: 2 | Y356: 4 | Z356: 1 | AA356: 538 | AB356: 557 | AC356: 96.58886894075404 | AD356: 10
A357: BEST PLAYERS | W357: WILLIAMSTOWN | X357: 2 | Y357: 5 | Z357: 0 | AA357: 449 | AB357: 606 | AC357: 74.092409240924098 | AD357: 8
A358: PORT MELBOURNE | D358: PETERSON | G358: SKILTON | I358: BEDFORD | L358: CROSSEN | O358: PERRETT | Q358: CARPENTER | W358: PRAHRAN | X358: 1 | Y358: 6 | Z358: 0 | AA358: 519 | AB358: 590 | AC358: 87.966101694915253 | AD358: 4
A359: PRESTON | D359: ADAMS | G359: TAYLOR | I359: REICHMAN | L359: SURTEES | O359: LEE | Q359: STOTT | W359: CAMBERWELL | X359: 1 | Y359: 6 | Z359: 0 | AA359: 572 | AB359: 751 | AC359: 76.16511318242344 | AD359: 4
A360: GOALKICKERS | W360: SANDRINGHAM | X360: 1 | Y360: 6 | Z360: 0 | AA360: 449 | AB360: 760 | AC360: 59.078947368421055 | AD360: 4
A361: PORT MELBOURNE | D361: BEDFORD 5 | F361: PLUMRIDGE 2 | I361: BOURKE 2 | K361: WILKIN | M361: BARNES | O361: SMITH | Q361: CROMPTON | T361: BROOKS
A362: PRESTON | D362: SURTEES 4 | G362: LEE | I362: SUMMERS | K362: DAVIE | M362: BRIDGFORD
A364: COBURG | C364: 4 | D364: 6 | E364: =C364*6+D364 -> 30 | G364: 10 | H364: 8 | I364: =G364*6+H364 -> 68 | K364: 11 | L364: 9 | M364: =K364*6+L364 -> 75 | O364: 17 | P364: 12 | Q364: =O364*6+P364 -> 114 | S364: NORTHCOTE
A365: NORTHCOTE | C365: 2 | D365: 4 | E365: =C365*6+D365 -> 16 | G365: 4 | H365: 5 | I365: =G365*6+H365 -> 29 | K365: 7 | L365: 10 | M365: =K365*6+L365 -> 52 | O365: 9 | P365: 14 | Q365: =O365*6+P365 -> 68 | S365: PAYNE
A366: BEST PLAYERS
A367: COBURG | D367: McGRATH | G367: MEARS | J367: WALSH | M367: KERLEY | P367: F PLANT | S367: ROGERS
A368: NORTHCOTE | D368: ROSS | G368: NICHOLLS | J368: KOOP | M368: SEYMOUR | P368: BROWN | S368: PERKINS
A369: GOALKICKERS
A370: COBURG | D370: F PLANT 3 | F370: McGRATH 3 | I370: MEARS 3 | K370: J PLANT 2 | M370: KERLEY 2 | O370: VOIGHT | Q370: IRVING | S370: COLBERT | V370: HARRIS
A371: NORTHCOTE | D371: GOUGH 2 | G371: KOOP 2 | I371: SEYMOUR 2 | L371: POULTER | N371: MILNE | P371: ROSS
A373: WILLIAMSTOWN | C373: 4 | D373: 4 | E373: =C373*6+D373 -> 28 | G373: 7 | H373: 9 | I373: =G373*6+H373 -> 51 | K373: 11 | L373: 11 | M373: =K373*6+L373 -> 77 | O373: 13 | P373: 15 | Q373: =O373*6+P373 -> 93 | S373: CAMBERWELL
A374: CAMBERWELL | C374: 2 | D374: 4 | E374: =C374*6+D374 -> 16 | G374: 5 | H374: 7 | I374: =G374*6+H374 -> 37 | K374: 6 | L374: 14 | M374: =K374*6+L374 -> 50 | O374: 12 | P374: 15 | Q374: =O374*6+P374 -> 87 | S374: SCHAEFER
A375: BEST PLAYERS
A376: WILLIAMSTOWN | D376: WATERMAN | G376: L DREW | J376: CAHILL | M376: BRITT | P376: HELLWIG | S376: FERGUSON
A377: CAMBERWELL | D377: LAWN | G377: BENNETT | J377: GREENBURY | M377: McCOLL | P377: BIRCHALL | S377: WOODFORD
A378: GOALKICKERS
A379: WILLIAMSTOWN | D379: BEASLEY 4 | F379: HELLWIG 2 | I379: NAGEL 2 | L379: McDONALD 2 | O379: BRITT | Q379: CAHILL | S379: WATERMAN
A380: CAMBERWELL | D380: LAWN 5 | F380: GOUGH 3 | I380: WOODFORD 2 | L380: HARRISON | O380: WARD
A382: PRAHRAN | C382: 4 | D382: 7 | E382: =C382*6+D382 -> 31 | G382: 10 | H382: 11 | I382: =G382*6+H382 -> 71 | K382: 14 | L382: 20 | M382: =K382*6+L382 -> 104 | O382: 17 | P382: 27 | Q382: =O382*6+P382 -> 129 | S382: TOORAK PARK
A383: SANDRINGHAM | C383: 2 | D383: 3 | E383: =C383*6+D383 -> 15 | G383: 5 | H383: 6 | I383: =G383*6+H383 -> 36 | K383: 7 | L383: 7 | M383: =K383*6+L383 -> 49 | O383: 9 | P383: 11 | Q383: =O383*6+P383 -> 65 | S383: LESTER
A384: BEST PLAYERS
A385: PRAHRAN | D385: JIM SMITH | G385: BREWIS | J385: F SMITH | M385: ROWE | O385: NAYLOR | R385: McKINLEY
A386: SANDRINGHAM | D386: CHALLIS | G386: BOURKE | J386: McCASHNEY | M386: LAVER | O386: DE LUCA | R386: WATERS
A387: GOALKICKERS
A388: PRAHRAN | D388: ROWE 5 | F388: NAYLOR 4 | I388: EICKE 3 | K388: OSBORNE | M388: McKINLEY | O388: BARNETT | Q388: LORD | S388: JORDAN
A389: SANDRINGHAM | D389: WATERS 4 | G389: DE LUCA 3 | J389: GAY | L389: McCASHNEY
A391: OAKLEIGH | C391: 1 | D391: 4 | E391: =C391*6+D391 -> 10 | G391: 5 | H391: 6 | I391: =G391*6+H391 -> 36 | K391: 6 | L391: 9 | M391: =K391*6+L391 -> 45 | O391: 8 | P391: 14 | Q391: =O391*6+P391 -> 62 | S391: BRUNSWICK
A392: BRUNSWICK | C392: 1 | D392: 3 | E392: =C392*6+D392 -> 9 | G392: 4 | H392: 5 | I392: =G392*6+H392 -> 29 | K392: 5 | L392: 10 | M392: =K392*6+L392 -> 40 | O392: 7 | P392: 12 | Q392: =O392*6+P392 -> 54 | S392: LYNCH
A393: BEST PLAYERS
A394: OAKLEIGH | D394: MAHER | G394: McALLISTER | J394: RUDOLPH | M394: GUNNYON | P394: GODING | S394: SHELTON
A395: BRUNSWICK | D395: BLACKMORE | G395: KENNETT | J395: McINERNEY | M395: JACOBSON | P395: BRAY | S395: EAVES
A396: GOALKICKERS
A397: OAKLEIGH | D397: IRWIN 3 | F397: OFFICER | I397: GOMEZ | K397: SHELTON | N397: RUDOLPH | Q397: SPAIN
A398: BRUNSWICK | D398: McINERNEY 3 | G398: BRAY 2 | I398: FITZGERALD | L398: STEELE
A400: ROUND 8 | E400: 3RD JUNE | H400: WEATHER | K400: FINE AT FIRST LATE SHOWERS N. WIND | S400: PLAYED AT | X400: LADDER | AB400: ROUND | AD400: 8
D401: 1ST QTR | H401: 2ND QTR | L401: 3RD QTR | P401: FINAL | S401: COBURG
A402: COBURG | C402: 3 | D402: 3 | E402: =C402*6+D402 -> 21 | G402: 7 | H402: 6 | I402: =G402*6+H402 -> 48 | K402: 10 | L402: 9 | M402: =K402*6+L402 -> 69 | O402: 10 | P402: 10 | Q402: =O402*6+P402 -> 70 | S402: UMPIRE | W402: TEAM | X402: W | Y402: L | Z402: D | AA402: FOR | AB402: AGST | AC402: % | AD402: PTS
A403: BRIGHTON | C403: 1 | D403: 1 | E403: =C403*6+D403 -> 7 | G403: 3 | H403: 5 | I403: =G403*6+H403 -> 23 | K403: 3 | L403: 6 | M403: =K403*6+L403 -> 24 | O403: 8 | P403: 13 | Q403: =O403*6+P403 -> 61 | S403: MURRAY
A404: BEST PLAYERS | W404: OAKLEIGH | X404: 7 | Y404: 1 | Z404: 0 | AA404: 656 | AB404: 492 | AC404: 133.33333333333334 | AD404: 28
A405: COBURG | D405: DONNELLY | G405: KIGHT | I405: HARRIS | K405: CARRUTHERS | N405: LYONS | Q405: CHAPMAN | W405: COBURG | X405: 6 | Y405: 1 | Z405: 1 | AA405: 770 | AB405: 555 | AC405: 138.73873873873873 | AD405: 26
A406: BRIGHTON | D406: IRWIN | G406: LEAPER | I406: RENNIE | K406: HUNT | N406: BESWICK | Q406: TUCKER | W406: YARRAVILLE | X406: 6 | Y406: 2 | Z406: 0 | AA406: 681 | AB406: 552 | AC406: 123.3695652173913 | AD406: 24
A407: GOALKICKERS | W407: PORT MELBOURNE | X407: 6 | Y407: 2 | Z407: 0 | AA407: 580 | AB407: 476 | AC407: 121.84873949579831 | AD407: 24
A408: COBURG | D408: F PLANT 5 | G408: HARRIS 2 | J408: McGRATH | M408: CARRUTHERS | P408: KERLEY
A409: BRIGHTON | D409: STOREY 2 | G409: BESWICK 2 | J409: TUCKER 2 | M409: RENNIE | O409: CANTWELL | W409: BRIGHTON | X409: 5 | Y409: 3 | Z409: 0 | AA409: 662 | AB409: 561 | AC409: 118.00356506238859 | AD409: 20
W410: PRESTON | X410: 5 | Y410: 3 | Z410: 0 | AA410: 641 | AB410: 573 | AC410: 111.8673647469459 | AD410: 20
A411: OAKLEIGH | C411: 1 | D411: 1 | E411: =C411*6+D411 -> 7 | G411: 5 | H411: 6 | I411: =G411*6+H411 -> 36 | K411: 7 | L411: 9 | M411: =K411*6+L411 -> 51 | O411: 9 | P411: 14 | Q411: =O411*6+P411 -> 68 | S411: OAKLEIGH | W411: BRUNSWICK | X411: 3 | Y411: 4 | Z411: 1 | AA411: 632 | AB411: 646 | AC411: 97.832817337461307 | AD411: 14
A412: PRESTON | C412: 3 | D412: 2 | E412: =C412*6+D412 -> 20 | G412: 5 | H412: 4 | I412: =G412*6+H412 -> 34 | K412: 6 | L412: 5 | M412: =K412*6+L412 -> 41 | O412: 6 | P412: 7 | Q412: =O412*6+P412 -> 43 | S412: MUTCH | W412: NORTHCOTE | X412: 3 | Y412: 5 | Z412: 0 | AA412: 586 | AB412: 614 | AC412: 95.439739413680783 | AD412: 12
A413: BEST PLAYERS | W413: WILLIAMSTOWN | X413: 3 | Y413: 5 | Z413: 0 | AA413: 566 | AB413: 682 | AC413: 82.99120234604105 | AD413: 12
A414: OAKLEIGH | D414: GOMEZ | G414: THOMAS | J414: SPAIN | M414: RUDOLPH | O414: MAHER | Q414: MORRIS | W414: PRAHRAN | X414: 1 | Y414: 7 | Z414: 0 | AA414: 571 | AB414: 658 | AC414: 86.77811550151975 | AD414: 4
A415: PRESTON | D415: TAYLOR | G415: REICHMAN | J415: SUMMERS | M415: HOLLIDAY | O415: DAVIE | Q415: WHITE | W415: CAMBERWELL | X415: 1 | Y415: 7 | Z415: 0 | AA415: 661 | AB415: 845 | AC415: 78.224852071005913 | AD415: 4
A416: GOALKICKERS | W416: SANDRINGHAM | X416: 1 | Y416: 7 | Z416: 0 | AA416: 525 | AB416: 877 | AC416: 59.863169897377425 | AD416: 4
A417: OAKLEIGH | D417: OFFICER 4 | G417: MAHER 2 | J417: GOMEZ | L417: FLEMING | O417: SHELTON
A418: PRESTON | D418: DAVIE 3 | G418: SUMMERS 2 | J418: SURTEES
A420: PORT MELBOURNE | C420: 6 | D420: 2 | E420: =C420*6+D420 -> 38 | G420: 6 | H420: 4 | I420: =G420*6+H420 -> 40 | K420: 9 | L420: 5 | M420: =K420*6+L420 -> 59 | O420: 9 | P420: 5 | Q420: =O420*6+P420 -> 59 | S420: PORT MELBOURNE
A421: NORTHCOTE | C421: 0 | D421: 0 | E421: =C421*6+D421 -> 0 | G421: 2 | H421: 3 | I421: =G421*6+H421 -> 15 | K421: 2 | L421: 6 | M421: =K421*6+L421 -> 18 | O421: 6 | P421: 10 | Q421: =O421*6+P421 -> 46 | S421: LESTER
A422: BEST PLAYERS
A423: PORT MELBOURNE | D423: PERRETT | G423: PETERSON | J423: GARBUTT | M423: BROOKER | P423: BEDFORD | S423: BARNES
A424: NORTHCOTE | D424: NICHOLLS | G424: L BROWN | J424: ROWE | M424: KOOP | P424: POULTER | S424: PERKINS
A425: GOALKICKERS
A426: PORT MELBOURNE | D426: BEDFORD 3 | G426: BARNES 2 | J426: BOURKE 2 | M426: GARBUTT | P426: WILKIN
A427: NORTHCOTE | D427: KOOP | F427: POULTER | I427: SEYMOUR | L427: GRAY | N427: W WOODS | Q427: ROSS
A429: BRUNSWICK | C429: 5 | D429: 5 | E429: =C429*6+D429 -> 35 | G429: 6 | H429: 6 | I429: =G429*6+H429 -> 42 | K429: 14 | L429: 10 | M429: =K429*6+L429 -> 94 | O429: 14 | P429: 10 | Q429: =O429*6+P429 -> 94 | S429: CAMBERWELL
A430: CAMBERWELL | C430: 2 | D430: 1 | E430: =C430*6+D430 -> 13 | G430: 6 | H430: 7 | I430: =G430*6+H430 -> 43 | K430: 7 | L430: 8 | M430: =K430*6+L430 -> 50 | O430: 12 | P430: 17 | Q430: =O430*6+P430 -> 89 | S430: McKINNON
A431: BEST PLAYERS
A432: BRUNSWICK | D432: RALEIGH | G432: BLACKMORE | J432: BARRIE | M432: JOHNSTONE | P432: FITZGERALD | S432: EUDEY
A433: CAMBERWELL | D433: LAWN | G433: MEYER | J433: WOODFORD | M433: WOOLFE | P433: QUARTERMAIN | S433: McCOLL
A434: GOALKICKERS
A435: BRUNSWICK | D435: McINERNEY 5 | G435: FITZGERALD 2 | J435: BARRIE 2 | L435: CARTON | N435: PENMAN | P435: JOHNSTONE | R435: ALESSIO | U435: BLACKMORE
A436: CAMBERWELL | D436: WOODFORD 3 | G436: MEYER 3 | I436: LAWN 2 | K436: McCOLL 2 | N436: WARD | P436: CALWELL
A438: WILLIAMSTOWN | C438: 7 | D438: 3 | E438: =C438*6+D438 -> 45 | G438: 11 | H438: 4 | I438: =G438*6+H438 -> 70 | K438: 18 | L438: 8 | M438: =K438*6+L438 -> 116 | O438: 18 | P438: 9 | Q438: =O438*6+P438 -> 117 | S438: BEACH ROAD
A439: SANDRINGHAM | C439: 1 | D439: 6 | E439: =C439*6+D439 -> 12 | G439: 5 | H439: 11 | I439: =G439*6+H439 -> 41 | K439: 5 | L439: 12 | M439: =K439*6+L439 -> 42 | O439: 9 | P439: 22 | Q439: =O439*6+P439 -> 76 | S439: MAKER
A440: BEST PLAYERS
A441: WILLIAMSTOWN | D441: O'BRIEN | G441: HELLWIG | J441: SHEEHAN | M441: LONERGAN | P441: WATERMAN | S441: CAHILL
A442: SANDRINGHAM | D442: McCASHNEY | G442: CHALLIS | J442: DE LUCA | M442: BOYD | P442: LAVER | S442: ROSS
A443: GOALKICKERS
A444: WILLIAMSTOWN | D444: O'BRIEN 8 | G444: CAHILL 4 | J444: HELLWIG 3 | M444: C DREW | O444: SHEEHAN | R444: TAAFE
A445: SANDRINGHAM | D445: BOYD 3 | G445: CHALLIS 2 | J445: WATERS | M445: DE LUCA | O445: LAVER | R445: ROSS
A447: YARRAVILLE | C447: 1 | D447: 17 | E447: =C447*6+D447 -> 23 | G447: 2 | H447: 19 | I447: =G447*6+H447 -> 31 | K447: 6 | L447: 32 | M447: =K447*6+L447 -> 68 | O447: 6 | P447: 32 | Q447: =O447*6+P447 -> 68 | S447: YARRAVILLE
A448: PRAHRAN | C448: 0 | D448: 0 | E448: =C448*6+D448 -> 0 | G448: 2 | H448: 3 | I448: =G448*6+H448 -> 15 | K448: 2 | L448: 3 | M448: =K448*6+L448 -> 15 | O448: 6 | P448: 16 | Q448: =O448*6+P448 -> 52 | S448: FROOD
A449: BEST PLAYERS
A450: YARRAVILLE | D450: KENNEDY | G450: ROBERTS | J450: OGILVIE | M450: HANNAN | P450: COOPER | S450: HENRY
A451: PRAHRAN | D451: NAYLOR | G451: F SMITH | J451: OSBORNE | M451: JIM SMITH | P451: JORDAN | S451: B SMITH
A452: GOALKICKERS
A453: YARRAVILLE | D453: OGILVIE 2 | G453: ROBERTS | J453: JOYCE | L453: CAMERON | O453: FROUD
A454: PRAHRAN | D454: LORD 2 | G454: ROWE | I454: JORDAN | L454: EICKE | N454: B SMITH
A456: ROUND 9 | E456: 8TH JUNE | J456: WEATHER | M456: CLOUDY BUT FINE SOUTH BREEZE | S456: PLAYED AT | X456: LADDER | AB456: ROUND | AD456: 9
D457: 1ST QTR | H457: 2ND QTR | L457: 3RD QTR | P457: FINAL | S457: COBURG
A458: YARRAVILLE | C458: 4 | D458: 5 | E458: =C458*6+D458 -> 29 | G458: 7 | H458: 6 | I458: =G458*6+H458 -> 48 | K458: 10 | L458: 9 | M458: =K458*6+L458 -> 69 | O458: 13 | P458: 13 | Q458: =O458*6+P458 -> 91 | S458: UMPIRE | W458: TEAM | X458: W | Y458: L | Z458: D | AA458: FOR | AB458: AGST | AC458: % | AD458: PTS
A459: COBURG | C459: 0 | D459: 0 | E459: =C459*6+D459 -> 0 | G459: 3 | H459: 5 | I459: =G459*6+H459 -> 23 | K459: 3 | L459: 5 | M459: =K459*6+L459 -> 23 | O459: 5 | P459: 7 | Q459: =O459*6+P459 -> 37 | S459: MURRAY
A460: BEST PLAYERS | W460: OAKLEIGH | X460: 8 | Y460: 1 | Z460: 0 | AA460: 717 | AB460: 551 | AC460: 130.12704174228676 | AD460: 32
A461: YARRAVILLE | D461: CAMERON | G461: HANNAN | I461: BROWN | K461: OGILVIE | N461: KNOTT | Q461: SHERMAN | W461: YARRAVILLE | X461: 7 | Y461: 2 | Z461: 0 | AA461: 772 | AB461: 589 | AC461: 131.06960950764008 | AD461: 28
A462: COBURG | D462: HARRIS | G462: KIGHT | I462: JENKINS | K462: WALSH | N462: CHARLESTON | Q462: CHAPMAN | W462: PORT MELBOURNE | X462: 7 | Y462: 2 | Z462: 0 | AA462: 698 | AB462: 547 | AC462: 127.60511882998172 | AD462: 28
A463: GOALKICKERS | W463: COBURG | X463: 6 | Y463: 2 | Z463: 1 | AA463: 807 | AB463: 646 | AC463: 124.92260061919505 | AD463: 26
A464: YARRAVILLE | D464: CAMERON 4 | G464: BEER 3 | I464: KENNEDY 2 | L464: JOYCE | N464: COULSELL | Q464: HENRY | S464: OGILVIE
A465: COBURG | D465: F PLANT 3 | G465: KIGHT | I465: LEAHY | W465: PRESTON | X465: 6 | Y465: 3 | Z465: 0 | AA465: 762 | AB465: 626 | AC465: 121.72523961661342 | AD465: 24
W466: BRIGHTON | X466: 5 | Y466: 4 | Z466: 0 | AA466: 721 | AB466: 622 | AC466: 115.91639871382637 | AD466: 20
A467: OAKLEIGH | C467: 2 | D467: 3 | E467: =C467*6+D467 -> 15 | G467: 4 | H467: 8 | I467: =G467*6+H467 -> 32 | K467: 5 | L467: 10 | M467: =K467*6+L467 -> 40 | O467: 8 | P467: 13 | Q467: =O467*6+P467 -> 61 | S467: ELSTERNWICK PARK | W467: BRUNSWICK | X467: 4 | Y467: 4 | Z467: 1 | AA467: 708 | AB467: 716 | AC467: 98.882681564245814 | AD467: 18
A468: BRIGHTON | C468: 2 | D468: 4 | E468: =C468*6+D468 -> 16 | G468: 3 | H468: 5 | I468: =G468*6+H468 -> 23 | K468: 7 | L468: 11 | M468: =K468*6+L468 -> 53 | O468: 8 | P468: 11 | Q468: =O468*6+P468 -> 59 | S468: PAYNE | W468: NORTHCOTE | X468: 4 | Y468: 5 | Z468: 0 | AA468: 755 | AB468: 670 | AC468: 112.68656716417911 | AD468: 16
A469: BEST PLAYERS | W469: WILLIAMSTOWN | X469: 3 | Y469: 6 | Z469: 0 | AA469: 636 | AB469: 758 | AC469: 83.905013192612131 | AD469: 12
A470: OAKLEIGH | D470: RUDOLPH | G470: MAHER | I470: GUNNYON | K470: SHELTON | N470: SPAIN | Q470: GOMEZ | W470: PRAHRAN | X470: 1 | Y470: 8 | Z470: 0 | AA470: 624 | AB470: 779 | AC470: 80.102695763799744 | AD470: 4
A471: BRIGHTON | D471: DUNBAR | G471: IRWIN | I471: LEAPER | K471: CARROLL | N471: RENNIE | Q471: STOREY | W471: CAMBERWELL | X471: 1 | Y471: 8 | Z471: 0 | AA471: 732 | AB471: 963 | AC471: 76.012461059190031 | AD471: 4
A472: GOALKICKERS | W472: SANDRINGHAM | X472: 1 | Y472: 8 | Z472: 0 | AA472: 581 | AB472: 1046 | AC472: 55.544933078393882 | AD472: 4
A473: OAKLEIGH | D473: SHELTON 2 | F473: RUDOLPH | I473: IRWIN | K473: OFFICER | M473: MAHER | O473: HOLFORD | Q473: WOOLARD
A474: BRIGHTON | D474: FRANCIS 2 | F474: RENNIE 2 | I474: TULLOH | K474: LEAPER | M474: TUCKER | O474: BORLAND
A476: BRUNSWICK | C476: 4 | D476: 4 | E476: =C476*6+D476 -> 28 | G476: 8 | H476: 6 | I476: =G476*6+H476 -> 54 | K476: 8 | L476: 6 | M476: =K476*6+L476 -> 54 | O476: 11 | P476: 10 | Q476: =O476*6+P476 -> 76 | S476: WILLIAMSTOWN
A477: WILLIAMSTOWN | C477: 5 | D477: 5 | E477: =C477*6+D477 -> 35 | G477: 5 | H477: 8 | I477: =G477*6+H477 -> 38 | K477: 8 | L477: 12 | M477: =K477*6+L477 -> 60 | O477: 9 | P477: 16 | Q477: =O477*6+P477 -> 70 | S477: McPHEE
A478: BEST PLAYERS
A479: BRUNSWICK | D479: PANNAM | G479: FITZGERALD | J479: BLACKMORE | M479: JOHNSTONE | P479: JACOBSON | S479: BRAY
A480: WILLIAMSTOWN | D480: TAAFE | G480: O'BRIEN | J480: MEEHAN | M480: L DREW | P480: LONERGAN | S480: BEASLEY
A481: GOALKICKERS
A482: BRUNSWICK | D482: McINERNEY 3 | G482: FITZGERALD 3 | J482: BRAY 2 | L482: STEELE | N482: JACOBSON | Q482: PENMAN
A483: WILLIAMSTOWN | D483: O'BRIEN 4 | G483: SHEEHAN 2 | J483: BEASLEY | M483: BRITT | O483: MEEHAN
A485: PRESTON | C485: 3 | D485: 3 | E485: =C485*6+D485 -> 21 | G485: 10 | H485: 10 | I485: =G485*6+H485 -> 70 | K485: 10 | L485: 11 | M485: =K485*6+L485 -> 71 | O485: 17 | P485: 19 | Q485: =O485*6+P485 -> 121 | S485: PRESTON
A486: PRAHRAN | C486: 2 | D486: 3 | E486: =C486*6+D486 -> 15 | G486: 3 | H486: 4 | I486: =G486*6+H486 -> 22 | K486: 6 | L486: 10 | M486: =K486*6+L486 -> 46 | O486: 7 | P486: 11 | Q486: =O486*6+P486 -> 53 | S486: LYNCH
A487: BEST PLAYERS
A488: PRESTON | D488: REICHMAN | G488: HARRIS | J488: ADAMS | M488: SURTEES | P488: WHITE | S488: DAVIE
A489: PRAHRAN | D489: LORD | G489: OSBORNE | J489: GLOVER | M489: HOOPER | P489: JORDAN | S489: NAYLOR
A490: GOALKICKERS
A491: PRESTON | D491: DODD 5 | F491: DAVIE 3 | H491: ADAMS 2 | J491: STEVENS 2 | M491: SUMMERS 2 | P491: MONOHAN 2 | S491: LEE
A492: PRAHRAN | D492: LORD 2 | F492: ROWE 2 | H492: NAYLOR | J492: BARNETT | M492: GREENWOOD
A494: NORTHCOTE | C494: 8 | D494: 4 | E494: =C494*6+D494 -> 52 | G494: 14 | H494: 8 | I494: =G494*6+H494 -> 92 | K494: 22 | L494: 17 | M494: =K494*6+L494 -> 149 | O494: 26 | P494: 18 | Q494: =O494*6+P494 -> 174 | S494: BEACH ROAD
A495: SANDRINGHAM | C495: 0 | D495: 2 | E495: =C495*6+D495 -> 2 | G495: 1 | H495: 9 | I495: =G495*6+H495 -> 15 | K495: 2 | L495: 10 | M495: =K495*6+L495 -> 22 | O495: 6 | P495: 20 | Q495: =O495*6+P495 -> 56 | S495: WILLIAMSON
A496: BEST PLAYERS
A497: NORTHCOTE | D497: COLE | G497: ROSS | J497: GRAY | M497: TOWERS | P497: COCKRAM | S497: SEYMOUR
A498: SANDRINGHAM | D498: BOURKE | G498: CHALLIS | J498: BOYD | M498: A KENNA | P498: GAY | S498: FRICKER
A499: GOALKICKERS
A500: NORTHCOTE | D500: COLE 7 | F500: GRAY 4 | H500: SEYMOUR 3 | K500: BROWN 3 | M500: ROSS 2 | O500: MILNE 2 | Q500: STOCKDALE 2 | T500: HEENAN | W500: ROBINSON
A501: SANDRINGHAM | D501: McCASHNEY | G501: GAY | I501: A KENNA | L501: LAVER | N501: R KENNA | Q501: KENNEDY
A503: PORT MELBOURNE | C503: 7 | D503: 12 | E503: =C503*6+D503 -> 54 | G503: 8 | H503: 14 | I503: =G503*6+H503 -> 62 | K503: 14 | L503: 18 | M503: =K503*6+L503 -> 102 | O503: 16 | P503: 22 | Q503: =O503*6+P503 -> 118 | S503: NORTHCOTE
A504: CAMBERWELL | C504: 2 | D504: 1 | E504: =C504*6+D504 -> 13 | G504: 6 | H504: 2 | I504: =G504*6+H504 -> 38 | K504: 7 | L504: 2 | M504: =K504*6+L504 -> 44 | O504: 11 | P504: 5 | Q504: =O504*6+P504 -> 71 | S504: MAKER
A505: BEST PLAYERS
A506: PORT MELBOURNE | D506: BROOKER | G506: SKILTON | J506: FISHER | M506: CROSSEN | P506: WILKIN | S506: PERRETT
A507: CAMBERWELL | D507: LAWN | G507: McCOLL | J507: WOODFORD | M507: WARD | P507: LE STRANGE | S507: WOOLFE
A508: GOALKICKERS
A509: PORT MELBOURNE | D509: BEDFORD 5 | G509: WILKIN 3 | I509: PLUMRIDGE 2 | L509: PERRETT | N509: BROOKER | P509: BARNES | R509: BOURKE | U509: HYDE | W509: FISHER
A510: CAMBERWELL | D510: LAWN 7 | G510: WARD | I510: MEYER | K510: QUARTERMAIN | O510: PRYOR
A512: ROUND 10 | E512: 15TH JUNE | J512: WEATHER | M512: FINE | S512: PLAYED AT | X512: LADDER | AB512: ROUND | AD512: 10
D513: 1ST QTR | H513: 2ND QTR | L513: 3RD QTR | P513: FINAL | S513: OAKLEIGH
A514: COBURG | C514: 3 | D514: 4 | E514: =C514*6+D514 -> 22 | G514: 8 | H514: 6 | I514: =G514*6+H514 -> 54 | K514: 12 | L514: 7 | M514: =K514*6+L514 -> 79 | O514: 14 | P514: 11 | Q514: =O514*6+P514 -> 95 | S514: UMPIRE | W514: TEAM | X514: W | Y514: L | Z514: D | AA514: FOR | AB514: AGST | AC514: % | AD514: PTS
A515: OAKLEIGH | C515: 4 | D515: 3 | E515: =C515*6+D515 -> 27 | G515: 7 | H515: 4 | I515: =G515*6+H515 -> 46 | K515: 8 | L515: 10 | M515: =K515*6+L515 -> 58 | O515: 13 | P515: 13 | Q515: =O515*6+P515 -> 91 | S515: PAYNE
A516: BEST PLAYERS | W516: PORT MELBOURNE | X516: 8 | Y516: 2 | Z516: 0 | AA516: 842 | AB516: 620 | AC516: 135.80645161290323 | AD516: 32
A517: COBURG | D517: KIGHT | F517: COLBERT | I517: DONNELLY | L517: KERLEY | N517: CORNELL | Q517: WALSH | W517: YARRAVILLE | X517: 8 | Y517: 2 | Z517: 0 | AA517: 876 | AB517: 659 | AC517: 132.92867981790593 | AD517: 32
A518: OAKLEIGH | D518: BROWN | F518: RUDOLPH | I518: MAHER | L518: GODING | N518: FLEMING | Q518: SHELTON | W518: OAKLEIGH | X518: 8 | Y518: 2 | Z518: 0 | AA518: 808 | AB518: 646 | AC518: 125.07739938080495 | AD518: 32
A519: GOALKICKERS | W519: COBURG | X519: 7 | Y519: 2 | Z519: 1 | AA519: 902 | AB519: 737 | AC519: 122.38805970149254 | AD519: 30
A520: COBURG | D520: CORNELL 4 | F520: HARRIS 3 | I520: COLBERT 2 | L520: McGRATH 2 | N520: KERLEY 2 | Q520: F PLANT
A521: OAKLEIGH | D521: FLEMING 3 | F521: MAHER 2 | I521: IRWIN 2 | K521: SHELTON 2 | N521: CROFT 2 | P521: RUDOLPH | R521: RICHARDSON | W521: BRIGHTON | X521: 6 | Y521: 4 | Z521: 0 | AA521: 809 | AB521: 699 | AC521: 115.73676680972818 | AD521: 24
W522: PRESTON | X522: 6 | Y522: 4 | Z522: 0 | AA522: 832 | AB522: 730 | AC522: 113.97260273972603 | AD522: 24
A523: YARRAVILLE | C523: 3 | D523: 4 | E523: =C523*6+D523 -> 22 | G523: 9 | H523: 10 | I523: =G523*6+H523 -> 64 | K523: 11 | L523: 11 | M523: =K523*6+L523 -> 77 | O523: 15 | P523: 14 | Q523: =O523*6+P523 -> 104 | S523: YARRAVILLE | W523: BRUNSWICK | X523: 5 | Y523: 4 | Z523: 1 | AA523: 789 | AB523: 796 | AC523: 99.120603015075375 | AD523: 22
A524: PRESTON | C524: 1 | D524: 3 | E524: =C524*6+D524 -> 9 | G524: 2 | H524: 6 | I524: =G524*6+H524 -> 18 | K524: 8 | L524: 15 | M524: =K524*6+L524 -> 63 | O524: 9 | P524: 16 | Q524: =O524*6+P524 -> 70 | S524: MURRAY | W524: NORTHCOTE | X524: 5 | Y524: 5 | Z524: 0 | AA524: 869 | AB524: 755 | AC524: 115.09933774834437 | AD524: 20
A525: BEST PLAYERS | W525: WILLIAMSTOWN | X525: 3 | Y525: 7 | Z525: 0 | AA525: 721 | AB525: 872 | AC525: 82.683486238532112 | AD525: 12
A526: YARRAVILLE | D526: SMITH | F526: ROBERTS | I526: BROWN | L526: SHERMAN | O526: EDWARDS | Q526: CAMERON | W526: PRAHRAN | X526: 1 | Y526: 9 | Z526: 0 | AA526: 704 | AB526: 860 | AC526: 81.860465116279073 | AD526: 4
A527: PRESTON | D527: TAYLOR | F527: MILLER | I527: STOTT | L527: REICHMAN | O527: ADAMS | Q527: SUMMERS | W527: CAMBERWELL | X527: 1 | Y527: 9 | Z527: 0 | AA527: 809 | AB527: 1051 | AC527: 76.974310180780208 | AD527: 4
A528: GOALKICKERS | W528: SANDRINGHAM | X528: 1 | Y528: 9 | Z528: 0 | AA528: 654 | AB528: 1190 | AC528: 54.957983193277308 | AD528: 4
A529: YARRAVILLE | D529: HENRY 5 | F529: CAMERON 3 | I529: ROBERTS 2 | L529: OGILVIE | N529: KENNEDY | P529: LOVETT | R529: THOMAS | U529: BEER
A530: PRESTON | D530: ADAMS 4 | G530: MONOHAN | J530: SURTEES | M530: DODD | O530: SUMMERS | Q530: LEE
A532: NORTHCOTE | C532: 2 | D532: 4 | E532: =C532*6+D532 -> 16 | G532: 10 | H532: 5 | I532: =G532*6+H532 -> 65 | K532: 12 | L532: 7 | M532: =K532*6+L532 -> 79 | O532: 17 | P532: 12 | Q532: =O532*6+P532 -> 114 | S532: NORTHCOTE
A533: WILLIAMSTOWN | C533: 4 | D533: 3 | E533: =C533*6+D533 -> 27 | G533: 5 | H533: 4 | I533: =G533*6+H533 -> 34 | K533: 9 | L533: 6 | M533: =K533*6+L533 -> 60 | O533: 13 | P533: 7 | Q533: =O533*6+P533 -> 85 | S533: MORCOM
A534: BEST PLAYERS
A535: NORTHCOTE | D535: COCKRAM | G535: CORRIGAN | J535: ROWE | M535: COLE | P535: PRUSER | S535: BROWN
A536: WILLIAMSTOWN | D536: CAHILL | G536: J O'BRIEN | J536: McDONALD | M536: SYKES | P536: BEASLEY | S536: LONERGREN
A537: GOALKICKERS
A538: NORTHCOTE | D538: COLE 5 | F538: PRUSER 3 | I538: ROSS 3 | K538: BROWN 2 | M538: ROWE 2 | O538: GRAY | Q538: CORRIGAN
A539: WILLIAMSTOWN | D539: CAHILL 5 | F539: SHEEHAN 2 | I539: BEASLEY 2 | L539: HELLWIG | N539: W O'BRIEN | Q539: BRITT | S539: MEEHAN
A541: BRUNSWICK | C541: 3 | D541: 6 | E541: =C541*6+D541 -> 24 | G541: 3 | H541: 7 | I541: =G541*6+H541 -> 25 | K541: 8 | L541: 13 | M541: =K541*6+L541 -> 61 | O541: 11 | P541: 15 | Q541: =O541*6+P541 -> 81 | S541: TOORAK PARK
A542: PRAHRAN | C542: 4 | D542: 4 | E542: =C542*6+D542 -> 28 | G542: 6 | H542: 6 | I542: =G542*6+H542 -> 42 | K542: 9 | L542: 6 | M542: =K542*6+L542 -> 60 | O542: 12 | P542: 8 | Q542: =O542*6+P542 -> 80 | S542: LYNCH
A543: BEST PLAYERS
A544: BRUNSWICK | D544: BLACKMORE | G544: McINERNEY | J544: PANNAM | M544: EAVES | P544: REID | S544: MURPHY
A545: PRAHRAN | D545: LORD | G545: JORDAN | J545: F SMITH | M545: BREWIS | P545: JIM SMITH | S545: GLOVER
A546: GOALKICKERS
A547: BRUNSWICK | D547: McINERNEY 6 | G547: RALEIGH | J547: BRAY | L547: STEELE | N547: WILLIAMS | Q547: JOHNSTONE
A548: PRAHRAN | D548: LORD 3 | G548: JORDAN 3 | J548: NAYLOR 3 | M548: ROWE 2 | O548: BOWTELL
A550: BRIGHTON | C550: 3 | D550: 2 | E550: =C550*6+D550 -> 20 | G550: 8 | H550: 6 | I550: =G550*6+H550 -> 54 | K550: 9 | L550: 9 | M550: =K550*6+L550 -> 63 | O550: 13 | P550: 10 | Q550: =O550*6+P550 -> 88 | S550: CAMBERWELL
A551: CAMBERWELL | C551: 3 | D551: 3 | E551: =C551*6+D551 -> 21 | G551: 6 | H551: 3 | I551: =G551*6+H551 -> 39 | K551: 10 | L551: 7 | M551: =K551*6+L551 -> 67 | O551: 11 | P551: 11 | Q551: =O551*6+P551 -> 77 | S551: MUTCH
A552: BEST PLAYERS
A553: BRIGHTON | D553: MATTHEWS | G553: BURNES | J553: STOREY | M553: LEAPER | P553: GARCIA | S553: DUNBAR
A554: CAMBERWELL | D554: LAWN | G554: WOODFORD | J554: PAGE | M554: WOOLFE | P554: BOOTHMAN | S554: H CALWELL
A555: GOALKICKERS
A556: BRIGHTON | D556: MATTHEWS 5 | G556: BURNES 4 | J556: HUNT | L556: RENNIE | N556: STEWART | Q556: C IRWIN
A557: CAMBERWELL | D557: LAWN 4 | G557: COFFIN 3 | J557: WOODFORD | M557: MEYER | O557: PAGE | Q557: GREENBURY
A559: PORT MELBOURNE | C559: 4 | D559: 8 | E559: =C559*6+D559 -> 32 | G559: 11 | H559: 12 | I559: =G559*6+H559 -> 78 | K559: 14 | L559: 16 | M559: =K559*6+L559 -> 100 | O559: 20 | P559: 24 | Q559: =O559*6+P559 -> 144 | S559: BEACH ROAD
A560: SANDRINGHAM | C560: 4 | D560: 3 | E560: =C560*6+D560 -> 27 | G560: 7 | H560: 8 | I560: =G560*6+H560 -> 50 | K560: 9 | L560: 10 | M560: =K560*6+L560 -> 64 | O560: 10 | P560: 13 | Q560: =O560*6+P560 -> 73 | S560: McKINNON
A561: BEST PLAYERS
A562: PORT MELBOURNE | D562: GARBUTT | G562: BROOKS | J562: SMITH | M562: BOURKE | P562: FARNAN | S562: BEDFORD
A563: SANDRINGHAM | D563: CHALLIS | G563: LAVER | J563: McCASHNEY | M563: BOURKE | P563: CONNOP | S563: YOUNG
A564: GOALKICKERS
A565: PORT MELBOURNE | D565: BEDFORD 5 | G565: HYDE 4 | I565: BOURKE 3 | K565: FARNAN 3 | M565: SMITH 2 | O565: PERRETT 2 | R565: PLUMRIDGE
A566: SANDRINGHAM | D566: LAVER 6 | G566: McCASHNEY | J566: CHALLIS | L566: BOYD | N566: CONNOP
A568: ROUND 11 | E568: 22ND JUNE | J568: WEATHER | M568: COLD RAIN S.W. WIND | S568: PLAYED AT | X568: LADDER | AB568: ROUND | AD568: 11
D569: 1ST QTR | H569: 2ND QTR | L569: 3RD QTR | P569: FINAL | S569: PORT MELBOURNE
A570: PORT MELBOURNE | C570: 1 | D570: 1 | E570: =C570*6+D570 -> 7 | G570: 10 | H570: 5 | I570: =G570*6+H570 -> 65 | K570: 10 | L570: 5 | M570: =K570*6+L570 -> 65 | O570: 11 | P570: 9 | Q570: =O570*6+P570 -> 75 | S570: UMPIRE | W570: TEAM | X570: W | Y570: L | Z570: D | AA570: FOR | AB570: AGST | AC570: % | AD570: PTS
A571: BRIGHTON | C571: 4 | D571: 3 | E571: =C571*6+D571 -> 27 | G571: 5 | H571: 3 | I571: =G571*6+H571 -> 33 | K571: 7 | L571: 10 | M571: =K571*6+L571 -> 52 | O571: 7 | P571: 14 | Q571: =O571*6+P571 -> 56 | S571: MUTCH
A572: BEST PLAYERS | W572: PORT MELBOURNE | X572: 9 | Y572: 2 | Z572: 0 | AA572: 917 | AB572: 676 | AC572: 135.6508875739645 | AD572: 36
A573: PORT MELBOURNE | D573: PERRETT | G573: BROOKS | I573: SMITH | K573: GARBUTT | N573: BEDFORD | Q573: McINNES | W573: COBURG | X573: 8 | Y573: 2 | Z573: 1 | AA573: 985 | AB573: 783 | AC573: 125.79821200510855 | AD573: 34
A574: BRIGHTON | D574: DUNBAR | G574: CARROLL | I574: LUCAS | K574: RENNIE | N574: BORLAND | Q574: TUCKER | W574: YARRAVILLE | X574: 8 | Y574: 3 | Z574: 0 | AA574: 950 | AB574: 754 | AC574: 125.9946949602122 | AD574: 32
A575: GOALKICKERS | W575: OAKLEIGH | X575: 8 | Y575: 3 | Z575: 0 | AA575: 872 | AB575: 712 | AC575: 122.47191011235955 | AD575: 32
A576: PORT MELBOURNE | D576: BEDFORD 3 | F576: HYDE 2 | H576: BARNES | J576: SMITH | L576: SKILTON | N576: TYSON | P576: BROOKS | R576: McINNES
A577: BRIGHTON | D577: TULLOH 2 | G577: DUNBAR | I577: BURNES | K577: RENNIE | M577: TUCKER | O577: LUCAS | W577: PRESTON | X577: 7 | Y577: 4 | Z577: 0 | AA577: 959 | AB577: 796 | AC577: 120.47738693467336 | AD577: 28
W578: BRUNSWICK | X578: 6 | Y578: 4 | Z578: 1 | AA578: 884 | AB578: 870 | AC578: 101.60919540229885 | AD578: 26
A579: BRUNSWICK | C579: 0 | D579: 0 | E579: =C579*6+D579 -> 0 | G579: 10 | H579: 7 | I579: =G579*6+H579 -> 67 | K579: 11 | L579: 7 | M579: =K579*6+L579 -> 73 | O579: 14 | P579: 11 | Q579: =O579*6+P579 -> 95 | S579: BRUNSWICK | W579: NORTHCOTE | X579: 6 | Y579: 5 | Z579: 0 | AA579: 935 | AB579: 819 | AC579: 114.16361416361417 | AD579: 24
A580: YARRAVILLE | C580: 6 | D580: 8 | E580: =C580*6+D580 -> 44 | G580: 6 | H580: 9 | I580: =G580*6+H580 -> 45 | K580: 9 | L580: 14 | M580: =K580*6+L580 -> 68 | O580: 10 | P580: 14 | Q580: =O580*6+P580 -> 74 | S580: PAYNE | W580: BRIGHTON | X580: 6 | Y580: 5 | Z580: 0 | AA580: 865 | AB580: 774 | AC580: 111.75710594315245 | AD580: 24
A581: BEST PLAYERS | W581: WILLIAMSTOWN | X581: 4 | Y581: 7 | Z581: 0 | AA581: 803 | AB581: 902 | AC581: 89.024390243902445 | AD581: 16
A582: BRUNSWICK | D582: CARTON | F582: FITZGERALD | I582: KENNETT | L582: RALEIGH | N582: EAVES | Q582: PANNAM | W582: PRAHRAN | X582: 1 | Y582: 10 | Z582: 0 | AA582: 734 | AB582: 942 | AC582: 77.919320594479828 | AD582: 4
A583: YARRAVILLE | D583: SHERMAN | F583: OGILVIE | I583: CAMERON | L583: KENNEDY | N583: THOMAS | Q583: LOVETT | W583: CAMBERWELL | X583: 1 | Y583: 10 | Z583: 0 | AA583: 855 | AB583: 1134 | AC583: 75.396825396825392 | AD583: 4
A584: GOALKICKERS | R584: EAVES | W584: SANDRINGHAM | X584: 1 | Y584: 10 | Z584: 0 | AA584: 720 | AB584: 1317 | AC584: 54.66970387243736 | AD584: 4
A585: BRUNSWICK | D585: McINERNEY 3 | G585: FITZGERALD 3 | J585: RALEIGH 2 | M585: STEELE | O585: PANNAM | Q585: GRAY | R585: HEARN | T585: CROSS
A586: YARRAVILLE | D586: CAMERON 2 | G586: KENNEDY 2 | J586: KNOTT 2 | L586: OGILVIE | N586: JOYCE | P586: FARRELL | R586: TYSON
A588: NORTHCOTE | C588: 2 | D588: 9 | E588: =C588*6+D588 -> 21 | G588: 4 | H588: 11 | I588: =G588*6+H588 -> 35 | K588: 8 | L588: 18 | M588: =K588*6+L588 -> 66 | O588: 8 | P588: 18 | Q588: =O588*6+P588 -> 66 | S588: OAKLEIGH
A589: OAKLEIGH | C589: 2 | D589: 0 | E589: =C589*6+D589 -> 12 | G589: 5 | H589: 5 | I589: =G589*6+H589 -> 35 | K589: 6 | L589: 7 | M589: =K589*6+L589 -> 43 | O589: 8 | P589: 16 | Q589: =O589*6+P589 -> 64 | S589: LESTER
A590: BEST PLAYERS
A591: NORTHCOTE | D591: J WOODS | G591: TOWERS | J591: STOCKDALE | M591: MILNE | P591: ROWE | S591: BROWN
A592: OAKLEIGH | D592: McALLISTER | G592: NOTT | J592: THOMAS | M592: RUDOLPH | P592: FLEMING | S592: MORRIS
A593: GOALKICKERS
A594: NORTHCOTE | D594: ROSS 2 | F594: STOCKDALE | I594: GRAY | K594: SEYMOUR | M594: GOULLET | O594: BROWN | Q594: MILNE
A595: OAKLEIGH | D595: IRWIN 2 | F595: MAHER 2 | I595: SPAIN 2 | K595: RUDOLPH | M595: GOMEZ
A597: WILLIAMSTOWN | C597: 2 | D597: 7 | E597: =C597*6+D597 -> 19 | G597: 5 | H597: 8 | I597: =G597*6+H597 -> 38 | K597: 10 | L597: 16 | M597: =K597*6+L597 -> 76 | O597: 11 | P597: 16 | Q597: =O597*6+P597 -> 82 | S597: WILLIAMSTOWN
A598: PRAHRAN | C598: 0 | D598: 1 | E598: =C598*6+D598 -> 1 | G598: 2 | H598: 3 | I598: =G598*6+H598 -> 15 | K598: 2 | L598: 3 | M598: =K598*6+L598 -> 15 | O598: 4 | P598: 6 | Q598: =O598*6+P598 -> 30 | S598: MURRAY
A599: BEST PLAYERS
A600: WILLIAMSTOWN | D600: SYKES | G600: TRUMAN | J600: HELLWIG | M600: CAHILL | P600: McKAY | S600: W O'BRIEN
A601: PRAHRAN | D601: BOWTELL | G601: BREWIS | J601: BARNETT | M601: LORD | P601: JIM SMITH | S601: JORDAN
A602: GOALKICKERS
A603: WILLIAMSTOWN | D603: CAHILL 2 | G603: SHEEHAN 2 | J603: McDONALD 2 | M603: TAAFE 2 | O603: TRUMAN 2 | R603: BASCOMBE
A604: PRAHRAN | D604: LORD | G604: NAYLOR | J604: BARNETT | M604: BOWTELL
A606: PRESTON | C606: 3 | D606: 6 | E606: =C606*6+D606 -> 24 | G606: 4 | H606: 12 | I606: =G606*6+H606 -> 36 | K606: 12 | L606: 20 | M606: =K606*6+L606 -> 92 | O606: 17 | P606: 25 | Q606: =O606*6+P606 -> 127 | S606: PRESTON
A607: SANDRINGHAM | C607: 2 | D607: 2 | E607: =C607*6+D607 -> 14 | G607: 6 | H607: 3 | I607: =G607*6+H607 -> 39 | K607: 6 | L607: 4 | M607: =K607*6+L607 -> 40 | O607: 10 | P607: 6 | Q607: =O607*6+P607 -> 66 | S607: McNIECE
A608: BEST PLAYERS
A609: PRESTON | D609: MILLER | G609: ADAMS | J609: REICHMAN | M609: MONOHAN | P609: SURTEES | S609: JENKINS
A610: SANDRINGHAM | D610: ANDERSON | G610: YEMM | J610: SHILLITO | M610: CLARK | P610: BOURKE | S610: A KENNA
A611: GOALKICKERS
A612: PRESTON | D612: ADAMS 7 | F612: SURTEES 3 | I612: DAVIE 2 | K612: STOTT 2 | M612: DODD | O612: MONOHAN | Q612: SUMMERS
A613: SANDRINGHAM | D613: SHILLITO 2 | G613: BOYD 2 | I613: HERRON | K613: LAVER | M613: ANDERSON | O613: G REES | Q613: BRIDGFORD | T613: YEMM
A615: COBURG | C615: 1 | D615: 3 | E615: =C615*6+D615 -> 9 | G615: 4 | H615: 10 | I615: =G615*6+H615 -> 34 | K615: 10 | L615: 14 | M615: =K615*6+L615 -> 74 | O615: 11 | P615: 17 | Q615: =O615*6+P615 -> 83 | S615: COBURG
A616: CAMBERWELL | C616: 4 | D616: 2 | E616: =C616*6+D616 -> 26 | G616: 4 | H616: 5 | I616: =G616*6+H616 -> 29 | K616: 4 | L616: 5 | M616: =K616*6+L616 -> 29 | O616: 6 | P616: 10 | Q616: =O616*6+P616 -> 46 | S616: MAKER
A617: BEST PLAYERS
A618: COBURG | D618: DONNELLY | G618: COLBERT | J618: F PLANT | M618: HARRIS | P618: IRVING | S618: CORNELL
A619: CAMBERWELL | D619: WOOLFE | G619: HARRISON | J619: CALWELL | M619: BOOTHMAN | P619: LAWN | S619: WOODFORD
A620: GOALKICKERS
A621: COBURG | D621: F PLANT 3 | G621: CORNELL 3 | J621: COLBERT 2 | M621: McGRATH | O621: HARRIS | Q621: JENKINS
A622: CAMBERWELL | D622: LAWN 3 | G622: GOUGH | J622: HAYES | L622: PETRIE
A624: ROUND 12 | E624: 29TH JUNE | J624: WEATHER | N624: FINE | S624: PLAYED AT | X624: LADDER | AB624: ROUND | AD624: 12
D625: 1ST QTR | H625: 2ND QTR | L625: 3RD QTR | P625: FINAL | S625: BRUNSWICK
A626: BRUNSWICK | C626: 2 | D626: 1 | E626: =C626*6+D626 -> 13 | G626: 5 | H626: 5 | I626: =G626*6+H626 -> 35 | K626: 7 | L626: 10 | M626: =K626*6+L626 -> 52 | O626: 12 | P626: 14 | Q626: =O626*6+P626 -> 86 | S626: UMPIRE | W626: TEAM | X626: W | Y626: L | Z626: D | AA626: FOR | AB626: AGST | AC626: % | AD626: PTS
A627: COBURG | C627: 2 | D627: 6 | E627: =C627*6+D627 -> 18 | G627: 3 | H627: 8 | I627: =G627*6+H627 -> 26 | K627: 4 | L627: 12 | M627: =K627*6+L627 -> 36 | O627: 6 | P627: 13 | Q627: =O627*6+P627 -> 49 | S627: MAKER
A628: BEST PLAYERS | W628: PORT MELBOURNE | X628: 10 | Y628: 2 | Z628: 0 | AA628: 1033 | AB628: 753 | AC628: 137.18459495351925 | AD628: 40
A629: BRUNSWICK | D629: CARTON | G629: BRAY | I629: KENNETT | L629: PANNAM | N629: FITZGERALD | Q629: McINERNEY | W629: OAKLEIGH | X629: 9 | Y629: 3 | Z629: 0 | AA629: 942 | AB629: 763 | AC629: 123.46002621231979 | AD629: 36
A630: COBURG | D630: CHAPMAN | G630: McGRATH | I630: JENKINS | L630: HARRIS | N630: WALSH | Q630: MILLARD | W630: COBURG | X630: 8 | Y630: 3 | Z630: 1 | AA630: 1034 | AB630: 869 | AC630: 118.98734177215189 | AD630: 34
A631: GOALKICKERS | W631: YARRAVILLE | X631: 8 | Y631: 4 | Z631: 0 | AA631: 1002 | AB631: 833 | AC631: 120.28811524609844 | AD631: 32
A632: BRUNSWICK | D632: McINERNEY 5 | G632: BRAY 2 | I632: CROSS | K632: STEELE | M632: PLUMMER | O632: JACOBSON | Q632: BRIGHT
A633: COBURG | D633: COLBERT 2 | G633: GARDINER 2 | J633: McGRATH | M633: MILLARD | W633: BRUNSWICK | X633: 7 | Y633: 4 | Z633: 1 | AA633: 970 | AB633: 919 | AC633: 105.54951033732318 | AD633: 30
W634: BRIGHTON | X634: 7 | Y634: 5 | Z634: 0 | AA634: 1036 | AB634: 826 | AC634: 125.42372881355932 | AD634: 28
A635: NORTHCOTE | C635: 3 | D635: 2 | E635: =C635*6+D635 -> 20 | G635: 6 | H635: 9 | I635: =G635*6+H635 -> 45 | K635: 7 | L635: 11 | M635: =K635*6+L635 -> 53 | O635: 11 | P635: 13 | Q635: =O635*6+P635 -> 79 | S635: PRESTON | W635: PRESTON | X635: 7 | Y635: 5 | Z635: 0 | AA635: 1023 | AB635: 875 | AC635: 116.91428571428571 | AD635: 28
A636: PRESTON | C636: 6 | D636: 4 | E636: =C636*6+D636 -> 40 | G636: 6 | H636: 6 | I636: =G636*6+H636 -> 42 | K636: 7 | L636: 12 | M636: =K636*6+L636 -> 54 | O636: 8 | P636: 16 | Q636: =O636*6+P636 -> 64 | S636: MURRAY | W636: NORTHCOTE | X636: 7 | Y636: 5 | Z636: 0 | AA636: 1014 | AB636: 883 | AC636: 114.83578708946773 | AD636: 28
A637: BEST PLAYERS | W637: WILLIAMSTOWN | X637: 5 | Y637: 7 | Z637: 0 | AA637: 882 | AB637: 954 | AC637: 92.452830188679243 | AD637: 20
A638: NORTHCOTE | D638: NICHOLLS | G638: COCKRAM | I638: HUGGINS | L638: STOCKDALE | O638: ROWE | Q638: SEYMOYUR | W638: PRAHRAN | X638: 1 | Y638: 11 | Z638: 0 | AA638: 811 | AB638: 1058 | AC638: 76.654064272211727 | AD638: 4
A639: PRESTON | D639: MILLER | G639: ADAMS | I639: TAYLOR | L639: SURTEES | O639: CAMPBELL | Q639: McMAHON | W639: CAMBERWELL | X639: 1 | Y639: 11 | Z639: 0 | AA639: 906 | AB639: 1204 | AC639: 75.249169435215947 | AD639: 4
A640: GOALKICKERS | W640: SANDRINGHAM | X640: 1 | Y640: 11 | Z640: 0 | AA640: 772 | AB640: 1488 | AC640: 51.881720430107528 | AD640: 4
A641: NORTHCOTE | D641: SEYMOUR 3 | G641: COLE 2 | I641: PRUSER 2 | K641: NICHOLLS 2 | N641: ROSS | P641: GRAY
A642: PRESTON | D642: ADAMS 5 | G642: SURTEES | I642: MONOHAN | L642: TAYLOR
A644: WILLIAMSTOWN | C644: 2 | D644: 4 | E644: =C644*6+D644 -> 16 | G644: 5 | H644: 6 | I644: =G644*6+H644 -> 36 | K644: 7 | L644: 11 | M644: =K644*6+L644 -> 53 | O644: 11 | P644: 13 | Q644: =O644*6+P644 -> 79 | S644: WILLIAMSTOWN
A645: YARRAVILLE | C645: 2 | D645: 2 | E645: =C645*6+D645 -> 14 | G645: 4 | H645: 5 | I645: =G645*6+H645 -> 29 | K645: 7 | L645: 7 | M645: =K645*6+L645 -> 49 | O645: 7 | P645: 10 | Q645: =O645*6+P645 -> 52 | S645: McKINNON
A646: BEST PLAYERS
A647: WILLIAMSTOWN | D647: BEASLEY | G647: SINCLAIR | J647: CAHILL | M647: J O'BRIEN | P647: McKAY | S647: L DREW
A648: YARRAVILLE | D648: JOYCE | G648: POOLE | J648: COULSELL | M648: SMITH | P648: SHERMAN | S648: HANNAN
A649: GOALKICKERS
A650: WILLIAMSTOWN | D650: BEASLEY 3 | F650: SINCLAIR 2 | I650: J O'BRIEN 2 | L650: W O'BRIEN | N650: SHEEHAN | P650: WATERMAN | S650: McKAY
A651: YARRAVILLE | D651: HENRY 2 | G651: TYSON 2 | I651: JOYCE | K651: BEER | M651: WALLACE
A653: BRIGHTON | C653: 5 | D653: 2 | E653: =C653*6+D653 -> 32 | G653: 11 | H653: 13 | I653: =G653*6+H653 -> 79 | K653: 15 | L653: 19 | M653: =K653*6+L653 -> 109 | O653: 24 | P653: 27 | Q653: =O653*6+P653 -> 171 | S653: ELSTERNWICK PARK
A654: SANDRINGHAM | C654: 1 | D654: 8 | E654: =C654*6+D654 -> 14 | G654: 2 | H654: 9 | I654: =G654*6+H654 -> 21 | K654: 5 | L654: 14 | M654: =K654*6+L654 -> 44 | O654: 6 | P654: 16 | Q654: =O654*6+P654 -> 52 | S654: LESTER
A655: BEST PLAYERS
A656: BRIGHTON | D656: CARROLL | G656: C IRWIN | J656: ALDRIDGE | M656: LEAPER | P656: MATTHEWS | S656: LUCAS
A657: SANDRINGHAM | D657: BOURKE | G657: ANDERSON | J657: HERRON | M657: BOYD | P657: BRIDGFORD | S657: R KENNA
A658: GOALKICKERS
A659: BRIGHTON | D659: MATTHEWS 11 | G659: BURNES 3 | I659: ALDRIDGE 2 | L659: LUCAS 2 | N659: STOREY | P659: TULLOH | R659: STEWART | U659: HUNT | W659: DUNBAR | X659: LEAPER
A660: SANDRINGHAM | D660: BOYD 3 | G660: GAY | I660: BRIDGFORD | L660: CONNOP
A662: OAKLEIGH | C662: 2 | D662: 2 | E662: =C662*6+D662 -> 14 | G662: 4 | H662: 8 | I662: =G662*6+H662 -> 32 | K662: 4 | L662: 12 | M662: =K662*6+L662 -> 36 | O662: 9 | P662: 16 | Q662: =O662*6+P662 -> 70 | S662: CAMBERWELL
A663: CAMBERWELL | C663: 2 | D663: 4 | E663: =C663*6+D663 -> 16 | G663: 2 | H663: 4 | I663: =G663*6+H663 -> 16 | K663: 5 | L663: 7 | M663: =K663*6+L663 -> 37 | O663: 7 | P663: 9 | Q663: =O663*6+P663 -> 51 | S663: SCHAEFER
A664: BEST PLAYERS
A665: OAKLEIGH | D665: RUDOLPH | G665: MORRIS | J665: MAHER | M665: SPAIN | P665: GODING | S665: IRWIN
A666: CAMBERWELL | D666: HARRISON | G666: LAKIN | J666: PAGE | M666: McCOLL | P666: LAWN | S666: WOODFORD
A667: GOALKICKERS
A668: OAKLEIGH | D668: IRWIN 2 | F668: SPAIN | H668: FLEMING | J668: OFFICER | L668: MAHER | N668: SHELTON | P668: RUDOLPH | R668: GODING
A669: CAMBERWELL | D669: PAGE 3 | G669: PETRIE 2 | J669: BROWN 2
A671: PORT MELBOURNE | C671: 1 | D671: 4 | E671: =C671*6+D671 -> 10 | G671: 6 | H671: 12 | I671: =G671*6+H671 -> 48 | K671: 9 | L671: 16 | M671: =K671*6+L671 -> 70 | O671: 15 | P671: 26 | Q671: =O671*6+P671 -> 116 | S671: PORT MELBOURNE
A672: PRAHRAN | C672: 3 | D672: 4 | E672: =C672*6+D672 -> 22 | G672: 4 | H672: 5 | I672: =G672*6+H672 -> 29 | K672: 7 | L672: 10 | M672: =K672*6+L672 -> 52 | O672: 11 | P672: 11 | Q672: =O672*6+P672 -> 77 | S672: PAYNE
A673: BEST PLAYERS
A674: PORT MELBOURNE | D674: GARBUTT | G674: PERRETT | J674: SMITH | M674: CROSSAN | P674: PLUMRIDGE | S674: BEDFORD
A675: PRAHRAN | D675: LORD | G675: GREENWOOD | J675: JACK SMITH | M675: BREWIS | P675: LUCAS | S675: F SMITH
A676: GOALKICKERS
A677: PORT MELBOURNE | D677: BEDFORD 4 | F677: PLUMRIDGE 3 | I677: SMITH 2 | K677: McINNES 2 | N677: HYDE | P677: BARNES | R677: PERRETT | T677: CROSSAN
A678: PRAHRAN | D678: JORDAN 3 | F678: LORD 2 | H678: ROWE 2 | J678: BARNETT 2 | M678: JACK SMITH | P678: SMEDLEY
A680: ROUND 13 | E680: 6TH JULY | J680: WEATHER | M680: CLOUDY BUT FINE | S680: PLAYED AT | X680: LADDER | AB680: ROUND | AD680: 13
D681: 1ST QTR | H681: 2ND QTR | L681: 3RD QTR | P681: FINAL | S681: YARRAVILLE
A682: PORT MELBOURNE | C682: 2 | D682: 1 | E682: =C682*6+D682 -> 13 | G682: 4 | H682: 6 | I682: =G682*6+H682 -> 30 | K682: 5 | L682: 10 | M682: =K682*6+L682 -> 40 | O682: 10 | P682: 13 | Q682: =O682*6+P682 -> 73 | S682: UMPIRE | W682: TEAM | X682: W | Y682: L | Z682: D | AA682: FOR | AB682: AGST | AC682: % | AD682: PTS
A683: YARRAVILLE | C683: 2 | D683: 4 | E683: =C683*6+D683 -> 16 | G683: 4 | H683: 6 | I683: =G683*6+H683 -> 30 | K683: 5 | L683: 9 | M683: =K683*6+L683 -> 39 | O683: 6 | P683: 12 | Q683: =O683*6+P683 -> 48 | S683: PAYNE
A684: BEST PLAYERS | W684: PORT MELBOURNE | X684: 11 | Y684: 2 | Z684: 0 | AA684: 1106 | AB684: 801 | AC684: 138.07740324594258 | AD684: 44
A685: PORT MELBOURNE | D685: WILKIN | F685: R PERRETT | I685: BROOKS | L685: GARBUTT | N685: PLUMRIDGE | Q685: HYDE | W685: OAKLEIGH | X685: 10 | Y685: 3 | Z685: 0 | AA685: 1010 | AB685: 811 | AC685: 124.53760789149199 | AD685: 40
A686: YARRAVILLE | D686: COULSELL | F686: KNOTT | I686: SHERMAN | L686: KENNEDY | N686: HENRY | Q686: CAMERON | W686: COBURG | X686: 8 | Y686: 4 | Z686: 1 | AA686: 1107 | AB686: 965 | AC686: 114.71502590673575 | AD686: 34
A687: GOALKICKERS | W687: BRUNSWICK | X687: 8 | Y687: 4 | Z687: 1 | AA687: 1125 | AB687: 1014 | AC687: 110.94674556213018 | AD687: 34
A688: PORT MELBOURNE | D688: BEDFORD 2 | F688: HYDE 2 | H688: R PERRETT | J688: WILKIN | L688: PLUMRIDGE | O688: McINNES | Q688: BROOKS | S688: TYSON
A689: YARRAVILLE | D689: CAMERON 3 | G689: COULSELL | I689: THOMAS | K689: GAMBETTA | W689: NORTHCOTE | X689: 8 | Y689: 5 | Z689: 0 | AA689: 1123 | AB689: 932 | AC689: 120.49356223175965 | AD689: 32
W690: PRESTON | X690: 8 | Y690: 5 | Z690: 0 | AA690: 1119 | AB690: 948 | AC690: 118.03797468354431 | AD690: 32
A691: PRESTON | C691: 4 | D691: 6 | E691: =C691*6+D691 -> 30 | G691: 6 | H691: 7 | I691: =G691*6+H691 -> 43 | K691: 10 | L691: 10 | M691: =K691*6+L691 -> 70 | O691: 14 | P691: 12 | Q691: =O691*6+P691 -> 96 | S691: COBURG | W691: YARRAVILLE | X691: 8 | Y691: 5 | Z691: 0 | AA691: 1050 | AB691: 906 | AC691: 115.89403973509934 | AD691: 32
A692: COBURG | C692: 1 | D692: 2 | E692: =C692*6+D692 -> 8 | G692: 4 | H692: 9 | I692: =G692*6+H692 -> 33 | K692: 6 | L692: 12 | M692: =K692*6+L692 -> 48 | O692: 10 | P692: 13 | Q692: =O692*6+P692 -> 73 | S692: FROUDE | W692: BRIGHTON | X692: 7 | Y692: 6 | Z692: 0 | AA692: 1085 | AB692: 935 | AC692: 116.04278074866311 | AD692: 28
A693: BEST PLAYERS | W693: WILLIAMSTOWN | X693: 5 | Y693: 8 | Z693: 0 | AA693: 930 | AB693: 1022 | AC693: 90.998043052837573 | AD693: 20
A694: PRESTON | D694: ADAMS | G694: SURTEES | I694: STOTT | K694: REICHMAN | N694: SEEBECK | Q694: WHITE | W694: PRAHRAN | X694: 2 | Y694: 11 | Z694: 0 | AA694: 928 | AB694: 1118 | AC694: 83.005366726296955 | AD694: 8
A695: COBURG | D695: CORNELL | G695: HARRIS | I695: VOIGHT | K695: CHAPMAN | N695: DONNELLY | Q695: FROUD | W695: CAMBERWELL | X695: 1 | Y695: 12 | Z695: 0 | AA695: 966 | AB695: 1321 | AC695: 73.126419379258138 | AD695: 4
A696: GOALKICKERS | W696: SANDRINGHAM | X696: 1 | Y696: 12 | Z696: 0 | AA696: 867 | AB696: 1643 | AC696: 52.76932440657334 | AD696: 4
A697: PRESTON | D697: ADAMS 7 | G697: DAVIE 3 | I697: SURTEES | K697: GOONAN | M697: HICKEY | O697: BIRCHALL
A698: COBURG | D698: F PLANT 4 | G698: CORNELL 3 | J698: VOIGHT 2 | M698: HARRIS
A700: NORTHCOTE | C700: 5 | D700: 8 | E700: =C700*6+D700 -> 38 | G700: 8 | H700: 11 | I700: =G700*6+H700 -> 59 | K700: 13 | L700: 18 | M700: =K700*6+L700 -> 96 | O700: 15 | P700: 19 | Q700: =O700*6+P700 -> 109 | S700: NORTHCOTE
A701: BRIGHTON | C701: 2 | D701: 0 | E701: =C701*6+D701 -> 12 | G701: 4 | H701: 6 | I701: =G701*6+H701 -> 30 | K701: 5 | L701: 8 | M701: =K701*6+L701 -> 38 | O701: 6 | P701: 13 | Q701: =O701*6+P701 -> 49 | S701: MURRAY
A702: BEST PLAYERS
A703: NORTHCOTE | D703: J WOODS | G703: BROWN | J703: SEYMOUR | M703: MILNE | P703: COCKRAM | S703: ROSS
A704: BRIGHTON | D704: STOREY | G704: BORLAND | J704: CARROLL | M704: ALDRIDGE | P704: IRWIN | S704: DAINTY
A705: GOALKICKERS
A706: NORTHCOTE | D706: SEYMOUR 5 | G706: COLE 5 | I706: MILNE 2 | L706: BROWN 2 | O706: PRUSER
A707: BRIGHTON | D707: MATTHEWS 2 | G707: BURNES | I707: TULLOH | L707: STEWART | O707: DUNBAR
A709: PRAHRAN | C709: 5 | D709: 2 | E709: =C709*6+D709 -> 32 | G709: 8 | H709: 7 | I709: =G709*6+H709 -> 55 | K709: 13 | L709: 13 | M709: =K709*6+L709 -> 91 | O709: 16 | P709: 21 | Q709: =O709*6+P709 -> 117 | S709: TOORAK PARK
A710: CAMBERWELL | C710: 4 | D710: 4 | E710: =C710*6+D710 -> 28 | G710: 6 | H710: 5 | I710: =G710*6+H710 -> 41 | K710: 8 | L710: 6 | M710: =K710*6+L710 -> 54 | O710: 9 | P710: 6 | Q710: =O710*6+P710 -> 60 | S710: McKINNON
A711: BEST PLAYERS
A712: PRAHRAN | D712: BREWIS | G712: SMEDLEY | J712: JACK SMITH | M712: F SMITH | P712: LORD | S712: OSBORNE
A713: CAMBERWELL | D713: WOOLFE | G713: LAKIN | J713: BOOTHMAN | M713: PETRIE | P713: LAWN | S713: PAGE
A714: GOALKICKERS
A715: PRAHRAN | D715: SMEDLEY 6 | G715: GREENWOOD 5 | J715: ALDER | L715: BARNETT | N715: LORD | P715: JORDAN | R715: TERRY
A716: CAMBERWELL | D716: LECKIE 3 | G716: LAWN 2 | J716: PETRIE 2 | M716: PAGE | O716: MEYER
A718: OAKLEIGH | C718: 2 | D718: 6 | E718: =C718*6+D718 -> 18 | G718: 3 | H718: 10 | I718: =G718*6+H718 -> 28 | K718: 5 | L718: 15 | M718: =K718*6+L718 -> 45 | O718: 8 | P718: 20 | Q718: =O718*6+P718 -> 68 | S718: OAKLEIGH
A719: WILLIAMSTOWN | C719: 0 | D719: 3 | E719: =C719*6+D719 -> 3 | G719: 2 | H719: 7 | I719: =G719*6+H719 -> 19 | K719: 2 | L719: 8 | M719: =K719*6+L719 -> 20 | O719: 6 | P719: 12 | Q719: =O719*6+P719 -> 48 | S719: LESTER
A720: BEST PLAYERS
A721: OAKLEIGH | D721: RUDOLPH | G721: FLEMING | J721: MAHER | M721: THOMAS | P721: McALLISTER | S721: GODING
A722: WILLIAMSTOWN | D722: BEASLEY | G722: J O'BRIEN | J722: W O'BRIEN | M722: WATERMAN | P722: CLAPSON | S722: JOHNS
A723: GOALKICKERS
A724: OAKLEIGH | D724: FRASER 2 | G724: HOLFORD | I724: FLEMING | K724: MAHER | M724: GOMEZ | O724: GODING | Q724: DAY
A725: WILLIAMSTOWN | D725: McDONALD 3 | G725: J O'BRIEN | I725: SHEEHAN | K725: SINCLAIR
A727: BRUNSWICK | C727: 6 | D727: 3 | E727: =C727*6+D727 -> 39 | G727: 14 | H727: 6 | I727: =G727*6+H727 -> 90 | K727: 19 | L727: 8 | M727: =K727*6+L727 -> 122 | O727: 24 | P727: 11 | Q727: =O727*6+P727 -> 155 | S727: BEACH ROAD
A728: SANDRINGHAM | C728: 3 | D728: 4 | E728: =C728*6+D728 -> 22 | G728: 10 | H728: 5 | I728: =G728*6+H728 -> 65 | K728: 10 | L728: 8 | M728: =K728*6+L728 -> 68 | O728: 14 | P728: 11 | Q728: =O728*6+P728 -> 95 | S728: MAKER
A729: BEST PLAYERS
A730: BRUNSWICK | D730: PLUMMER | G730: PANNAM | J730: CARTON | M730: BRAY | P730: BLACKMORE | S730: LANGWELL
A731: SANDRINGHAM | D731: CHALLIS | G731: McCASHNEY | J731: BOYD | M731: G REES | P731: JACK RYAN | S731: BOURKE
A732: GOALKICKERS
A733: BRUNSWICK | D733: PLUMMER 12 | G733: BRAY 6 | I733: LANGWELL 3 | L733: FITZGERALD 2 | O733: EUDEY
A734: SANDRINGHAM | D734: G REES 4 | G734: LAVER 2 | I734: BOYD 2 | K734: JACK RYAN 2 | N734: WRIGHT 2 | Q734: CONNOP | S734: HERRON
A736: ROUND 14 | E736: 13TH JULY | H736: WEATHER | K736: CLOUDY LIGHT SHOWERS S. WIND GROUNDS BAD | S736: PLAYED AT | X736: LADDER | AB736: ROUND | AD736: 14
D737: 1ST QTR | H737: 2ND QTR | L737: 3RD QTR | P737: FINAL | S737: BRUNSWICK
A738: BRUNSWICK | C738: 2 | D738: 3 | E738: =C738*6+D738 -> 15 | G738: 5 | H738: 6 | I738: =G738*6+H738 -> 36 | K738: 7 | L738: 8 | M738: =K738*6+L738 -> 50 | O738: 8 | P738: 9 | Q738: =O738*6+P738 -> 57 | S738: UMPIRE | W738: TEAM | X738: W | Y738: L | Z738: D | AA738: FOR | AB738: AGST | AC738: % | AD738: PTS
A739: PORT MELBOURNE | C739: 1 | D739: 1 | E739: =C739*6+D739 -> 7 | G739: 3 | H739: 5 | I739: =G739*6+H739 -> 23 | K739: 5 | L739: 8 | M739: =K739*6+L739 -> 38 | O739: 6 | P739: 13 | Q739: =O739*6+P739 -> 49 | S739: MURRAY
A740: BEST PLAYERS | W740: PORT MELBOURNE | X740: 11 | Y740: 3 | Z740: 0 | AA740: 1155 | AB740: 858 | AC740: 134.61538461538461 | AD740: 44
A741: BRUNSWICK | D741: FITZGERALD | G741: BLACKMORE | J741: JACOBSON | M741: EUDEY | O741: CARTON | R741: HEARN | W741: OAKLEIGH | X741: 11 | Y741: 3 | Z741: 0 | AA741: 1075 | AB741: 856 | AC741: 125.58411214953271 | AD741: 44
A742: PORT MELBOURNE | D742: CLARKE | G742: E PERRETT | J742: SMITH | M742: GARBUTT | O742: CROMPTON | R742: TYSON | W742: BRUNSWICK | X742: 9 | Y742: 4 | Z742: 1 | AA742: 1182 | AB742: 1063 | AC742: 111.19473189087488 | AD742: 38
A743: GOALKICKERS | W743: NORTHCOTE | X743: 9 | Y743: 5 | Z743: 0 | AA743: 1254 | AB743: 965 | AC743: 129.94818652849742 | AD743: 36
A744: BRUNSWICK | D744: McINERNEY 4 | G744: BRAY 2 | J744: CROSS | L744: JACOBSON
A745: PORT MELBOURNE | D745: BEDFORD 2 | G745: PLUMRIDGE | J745: BROOKS | L745: R PERRETT | O745: KUHLKEN | W745: PRESTON | X745: 9 | Y745: 5 | Z745: 0 | AA745: 1241 | AB745: 1010 | AC745: 122.87128712871286 | AD745: 36
W746: YARRAVILLE | X746: 9 | Y746: 5 | Z746: 0 | AA746: 1200 | AB746: 979 | AC746: 122.57405515832482 | AD746: 36
A747: PRESTON | C747: 6 | D747: 2 | E747: =C747*6+D747 -> 38 | G747: 11 | H747: 7 | I747: =G747*6+H747 -> 73 | K747: 14 | L747: 11 | M747: =K747*6+L747 -> 95 | O747: 18 | P747: 14 | Q747: =O747*6+P747 -> 122 | S747: PRESTON | W747: COBURG | X747: 8 | Y747: 5 | Z747: 1 | AA747: 1168 | AB747: 1032 | AC747: 113.17829457364341 | AD747: 34
A748: BRIGHTON | C748: 3 | D748: 1 | E748: =C748*6+D748 -> 19 | G748: 4 | H748: 3 | I748: =G748*6+H748 -> 27 | K748: 6 | L748: 8 | M748: =K748*6+L748 -> 44 | O748: 8 | P748: 14 | Q748: =O748*6+P748 -> 62 | S748: LESTER | W748: BRIGHTON | X748: 7 | Y748: 7 | Z748: 0 | AA748: 1147 | AB748: 1057 | AC748: 108.51466414380322 | AD748: 28
A749: BEST PLAYERS | W749: WILLIAMSTOWN | X749: 6 | Y749: 8 | Z749: 0 | AA749: 997 | AB749: 1083 | AC749: 92.059095106186518 | AD749: 24
A750: PRESTON | D750: TAYLOR | G750: ADAMS | I750: DAVIE | K750: STOTT | N750: SUMMERS | Q750: REICHMAN | W750: PRAHRAN | X750: 2 | Y750: 12 | Z750: 0 | AA750: 973 | AB750: 1183 | AC750: 82.248520710059168 | AD750: 8
A751: BRIGHTON | D751: IRWIN | G751: HUNT | I751: DAINTY | K751: BURNES | N751: LEAPER | Q751: STOREY | W751: CAMBERWELL | X751: 1 | Y751: 13 | Z751: 0 | AA751: 999 | AB751: 1452 | AC751: 68.801652892561989 | AD751: 4
A752: GOALKICKERS | W752: SANDRINGHAM | X752: 1 | Y752: 13 | Z752: 0 | AA752: 940 | AB752: 1793 | AC752: 52.42610150585611 | AD752: 4
A753: PRESTON | D753: ADAMS 4 | F753: DAVIE 4 | H753: TAYLOR 3 | J753: SUMMERS 2 | M753: O'DOHERTY 2 | P753: GOONAN | R753: STOTT | T753: SEEBECK
A754: BRIGHTON | D754: BURNES 3 | G754: RENNIE 2 | I754: HUNT | K754: STOREY | M754: B SMITH
A756: WILLIAMSTOWN | C756: 3 | D756: 4 | E756: =C756*6+D756 -> 22 | G756: 3 | H756: 4 | I756: =G756*6+H756 -> 22 | K756: 9 | L756: 7 | M756: =K756*6+L756 -> 61 | O756: 10 | P756: 7 | Q756: =O756*6+P756 -> 67 | S756: WILLIAMSTOWN
A757: COBURG | C757: 2 | D757: 2 | E757: =C757*6+D757 -> 14 | G757: 3 | H757: 6 | I757: =G757*6+H757 -> 24 | K757: 4 | L757: 7 | M757: =K757*6+L757 -> 31 | O757: 8 | P757: 13 | Q757: =O757*6+P757 -> 61 | S757: PAYNE
A758: BEST PLAYERS
A759: WILLIAMSTOWN | D759: CLAPSON | G759: McDONALD | J759: JOHNS | M759: W O'BRIEN | P759: CAHILL | S759: McKAY
A760: COBURG | D760: KIGHT | G760: JENKINS | J760: COLBERT | M760: KERLEY | P760: CHAPMAN | S760: VOIGHT
A761: GOALKICKERS
A762: WILLIAMSTOWN | D762: CAHILL 3 | F762: McDONALD 2 | I762: SHEEHAN | K762: BRITT | M762: TRUMAN | O762: JOHNS | Q762: SINCLAIR
A763: COBURG | D763: KERLEY 2 | F763: GARDINER 2 | I763: VOIGHT | K763: JENKINS | M763: KIGHT | O763: CHAPMAN
A765: YARRAVILLE | C765: 5 | D765: 3 | E765: =C765*6+D765 -> 33 | G765: 11 | H765: 11 | I765: =G765*6+H765 -> 77 | K765: 13 | L765: 17 | M765: =K765*6+L765 -> 95 | O765: 21 | P765: 24 | Q765: =O765*6+P765 -> 150 | S765: BEACH ROAD
A766: SANDRINGHAM | C766: 2 | D766: 4 | E766: =C766*6+D766 -> 16 | G766: 6 | H766: 8 | I766: =G766*6+H766 -> 44 | K766: 7 | L766: 13 | M766: =K766*6+L766 -> 55 | O766: 10 | P766: 13 | Q766: =O766*6+P766 -> 73 | S766: MUTCH
A767: BEST PLAYERS
A768: YARRAVILLE | D768: BROWN | G768: HANNAN | I768: WEBB | L768: TYSON | O768: KNOTT | Q768: CAMERON
A769: SANDRINGHAM | D769: BOYD | G769: REES | I769: CHALLIS | L769: YEMM | O769: YOUNG | Q769: BOURKE
A770: GOALKICKERS
A771: YARRAVILLE | D771: HENRY 7 | F771: CAMERON 3 | I771: KENNEDY 3 | L771: TYSON 3 | N771: ROBERTS 2 | Q771: THOMAS 2 | T771: BROWN
A772: SANDRINGHAM | D772: McCASHNEY 3 | G772: BOYD 2 | I772: G REES 2 | L772: WRIGHT | N772: FRICKER | Q772: LAVER
A774: NORTHCOTE | C774: 2 | D774: 2 | E774: =C774*6+D774 -> 14 | G774: 6 | H774: 6 | I774: =G774*6+H774 -> 42 | K774: 14 | L774: 9 | M774: =K774*6+L774 -> 93 | O774: 19 | P774: 17 | Q774: =O774*6+P774 -> 131 | S774: CAMBERWELL
A775: CAMBERWELL | C775: 0 | D775: 5 | E775: =C775*6+D775 -> 5 | G775: 1 | H775: 9 | I775: =G775*6+H775 -> 15 | K775: 2 | L775: 14 | M775: =K775*6+L775 -> 26 | O775: 3 | P775: 15 | Q775: =O775*6+P775 -> 33 | S775: STUART
A776: BEST PLAYERS
A777: NORTHCOTE | D777: CORRIGAN | G777: PERKINS | J777: COCKRAM | M777: ROSS | P777: PRUSER | S777: SEYMOUR
A778: CAMBERWELL | D778: BOOTHMAN | G778: WOOLFE | J778: HARRISON | M778: McCOLL | P778: LE STRANGE | S778: C CALWELL
A779: GOALKICKERS
A780: NORTHCOTE | D780: SEYMOUR 7 | G780: COLE 5 | I780: PRUSER 4 | L780: MILNE 2 | O780: GRAY
A781: CAMBERWELL | D781: HUGGARD 2 | G781: PAGE
A783: OAKLEIGH | C783: 3 | D783: 4 | E783: =C783*6+D783 -> 22 | G783: 5 | H783: 6 | I783: =G783*6+H783 -> 36 | K783: 9 | L783: 9 | M783: =K783*6+L783 -> 63 | O783: 9 | P783: 11 | Q783: =O783*6+P783 -> 65 | S783: TOORAK PARK
A784: PRAHRAN | C784: 0 | D784: 0 | E784: =C784*6+D784 -> 0 | G784: 1 | H784: 6 | I784: =G784*6+H784 -> 12 | K784: 2 | L784: 9 | M784: =K784*6+L784 -> 21 | O784: 5 | P784: 15 | Q784: =O784*6+P784 -> 45 | S784: FROUD
A785: BEST PLAYERS
A786: OAKLEIGH | D786: FLEMING | G786: SPAIN | J786: RUDOLPH | M786: MAHER | P786: MORRIS | S786: NOTT
A787: PRAHRAN | D787: GLOVER | G787: F SMITH | J787: J SMITH | M787: LUCAS | P787: TERRY | S787: OSBORNE
A788: GOALKICKERS
A789: OAKLEIGH | D789: MAHER 4 | G789: FRASER 2 | I789: GODING | K789: FLEMING | N789: SHELTON
A790: PRAHRAN | D790: JORDAN 2 | G790: ROWE | I790: GREENWOOD | L790: LUCAS
A792: ROUND 15 | E792: 20TH JULY | J792: WEATHER | M792: CLOUDY BUT FINE N.W. WIND | S792: PLAYED AT | X792: LADDER | AB792: ROUND | AD792: 15
D793: 1ST QTR | H793: 2ND QTR | L793: 3RD QTR | P793: FINAL | S793: NORTHCOTE
A794: NORTHCOTE | C794: 3 | D794: 4 | E794: =C794*6+D794 -> 22 | G794: 9 | H794: 7 | I794: =G794*6+H794 -> 61 | K794: 11 | L794: 8 | M794: =K794*6+L794 -> 74 | O794: 15 | P794: 11 | Q794: =O794*6+P794 -> 101 | S794: UMPIRE | W794: TEAM | X794: W | Y794: L | Z794: D | AA794: FOR | AB794: AGST | AC794: % | AD794: PTS
A795: BRUNSWICK | C795: 3 | D795: 1 | E795: =C795*6+D795 -> 19 | G795: 4 | H795: 6 | I795: =G795*6+H795 -> 30 | K795: 5 | L795: 10 | M795: =K795*6+L795 -> 40 | O795: 8 | P795: 12 | Q795: =O795*6+P795 -> 60 | S795: LESTER
A796: BEST PLAYERS | W796: PORT MELBOURNE | X796: 12 | Y796: 3 | Z796: 0 | AA796: 1219 | AB796: 911 | AC796: 133.80900109769485 | AD796: 48
A797: NORTHCOTE | D797: J WOODS | G797: CORRIGAN | I797: BROWN | K797: PRUSER | N797: COCKRAM | Q797: STOCKDALE | W797: OAKLEIGH | X797: 12 | Y797: 3 | Z797: 0 | AA797: 1155 | AB797: 916 | AC797: 126.09170305676857 | AD797: 48
A798: BRUNSWICK | D798: BLACKMORE | G798: WILLIAMS | I798: STEELE | K798: EUDEY | N798: CARTON | Q798: FITZGERALD | W798: NORTHCOTE | X798: 10 | Y798: 5 | Z798: 0 | AA798: 1355 | AB798: 1025 | AC798: 132.19512195121951 | AD798: 40
A799: GOALKICKERS | W799: PRESTON | X799: 10 | Y799: 5 | Z799: 0 | AA799: 1344 | AB799: 1038 | AC799: 129.47976878612718 | AD799: 40
A800: NORTHCOTE | D800: SEYMOUR 5 | G800: PRUSER 4 | I800: GRAY 2 | K800: ROWE 2 | M800: CORRIGAN | P800: HUGGINS
A801: BRUNSWICK | D801: STEELE 3 | F801: BRAY | H801: McINERNEY | K801: FITZGERALD | N801: CROSS | P801: McMEEKIN | W801: COBURG | X801: 9 | Y801: 5 | Z801: 1 | AA801: 1270 | AB801: 1061 | AC801: 119.69839773798303 | AD801: 38
W802: BRUNSWICK | X802: 9 | Y802: 5 | Z802: 1 | AA802: 1242 | AB802: 1164 | AC802: 106.70103092783505 | AD802: 38
A803: OAKLEIGH | C803: 2 | D803: 3 | E803: =C803*6+D803 -> 15 | G803: 3 | H803: 5 | I803: =G803*6+H803 -> 23 | K803: 7 | L803: 5 | M803: =K803*6+L803 -> 47 | O803: 12 | P803: 8 | Q803: =O803*6+P803 -> 80 | S803: OAKLEIGH | W803: YARRAVILLE | X803: 9 | Y803: 6 | Z803: 0 | AA803: 1260 | AB803: 1059 | AC803: 118.98016997167139 | AD803: 36
A804: YARRAVILLE | C804: 1 | D804: 3 | E804: =C804*6+D804 -> 9 | G804: 5 | H804: 5 | I804: =G804*6+H804 -> 35 | K804: 6 | L804: 9 | M804: =K804*6+L804 -> 45 | O804: 8 | P804: 12 | Q804: =O804*6+P804 -> 60 | S804: MURRAY | W804: BRIGHTON | X804: 7 | Y804: 7 | Z804: 1 | AA804: 1233 | AB804: 1143 | AC804: 107.8740157480315 | AD804: 30
A805: BEST PLAYERS | W805: WILLIAMSTOWN | X805: 6 | Y805: 9 | Z805: 0 | AA805: 1050 | AB805: 1147 | AC805: 91.543156059285096 | AD805: 24
A806: OAKLEIGH | D806: GOMEZ | G806: IRWIN | I806: MAHER | K806: FLEMING | N806: DOLAN | Q806: GUNNYON | W806: PRAHRAN | X806: 2 | Y806: 12 | Z806: 1 | AA806: 1059 | AB806: 1269 | AC806: 83.451536643026003 | AD806: 10
A807: YARRAVILLE | D807: BROWN | G807: SHERMAN | I807: HENRY | K807: KENNEDY | N807: COULSELL | Q807: CAMERON | W807: CAMBERWELL | X807: 1 | Y807: 14 | Z807: 0 | AA807: 1027 | AB807: 1555 | AC807: 66.045016077170416 | AD807: 4
A808: GOALKICKERS | W808: SANDRINGHAM | X808: 1 | Y808: 14 | Z808: 0 | AA808: 969 | AB808: 1895 | AC808: 51.134564643799472 | AD808: 4
A809: OAKLEIGH | D809: IRWIN 6 | G809: MAHER 2 | I809: FRASER 2 | K809: GOMEZ 2
A810: YARRAVILLE | D810: HENRY 3 | G810: COULSELL 2 | J810: CAMERON | M810: ROBERTS | O810: THOMAS
A812: BRIGHTON | C812: 5 | D812: 4 | E812: =C812*6+D812 -> 34 | G812: 6 | H812: 5 | I812: =G812*6+H812 -> 41 | K812: 9 | L812: 11 | M812: =K812*6+L812 -> 65 | O812: 12 | P812: 14 | Q812: =O812*6+P812 -> 86 | S812: ELSTERNWICK PARK
A813: PRAHRAN | C813: 1 | D813: 3 | E813: =C813*6+D813 -> 9 | G813: 6 | H813: 8 | I813: =G813*6+H813 -> 44 | K813: 8 | L813: 10 | M813: =K813*6+L813 -> 58 | O813: 12 | P813: 14 | Q813: =O813*6+P813 -> 86 | S813: PAYNE
A814: BEST PLAYERS
A815: BRIGHTON | D815: HUNT | G815: RENNIE | J815: CANTWELL | M815: B SMITH | P815: DAINTY | S815: LEAPER
A816: PRAHRAN | D816: GREENWOOD | G816: LORD | J816: LUCAS | M816: NAYLOR | P816: LAMPREY | S816: SMEDLEY
A817: GOALKICKERS
A818: BRIGHTON | D818: B SMITH 3 | G818: BURNES 2 | I818: RENNIE 2 | K818: HUNT 2 | M818: IRWIN
A819: PRAHRAN | D819: LORD 3 | F819: GREENWOOD 2 | I819: SMEDLEY 2 | L819: ROWE 2 | N819: LUCAS | P819: ALDER | R819: JACK SMITH
A821: COBURG | C821: 4 | D821: 7 | E821: =C821*6+D821 -> 31 | G821: 6 | H821: 12 | I821: =G821*6+H821 -> 48 | K821: 10 | L821: 17 | M821: =K821*6+L821 -> 77 | O821: 13 | P821: 24 | Q821: =O821*6+P821 -> 102 | S821: COBURG
A822: SANDRINGHAM | C822: 0 | D822: 0 | E822: =C822*6+D822 -> 0 | G822: 0 | H822: 5 | I822: =G822*6+H822 -> 5 | K822: 1 | L822: 5 | M822: =K822*6+L822 -> 11 | O822: 3 | P822: 11 | Q822: =O822*6+P822 -> 29 | S822: STEWART
A823: BEST PLAYERS
A824: COBURG | D824: JENKINS | G824: GARDINER | J824: DONNELLY | M824: COLBERT | P824: HARRIS | S824: KIGHT
A825: SANDRINGHAM | D825: CHALLIS | G825: ANDERSON | J825: McCASHNEY | M825: BOURKE | P825: HERRON | S825: A REES
A826: GOALKICKERS
A827: COBURG | D827: GARDINER 7 | G827: F PLANT 2 | J827: JENKINS | L827: COLBERT | N827: CARRUTHERS | Q827: DONNELLY
A828: SANDRINGHAM | D828: BOYD | G828: WATERS | J828: McCASHNEY
A830: PRESTON | C830: 7 | D830: 7 | E830: =C830*6+D830 -> 49 | G830: 8 | H830: 10 | I830: =G830*6+H830 -> 58 | K830: 13 | L830: 22 | M830: =K830*6+L830 -> 100 | O830: 13 | P830: 25 | Q830: =O830*6+P830 -> 103 | S830: PRESTON
A831: CAMBERWELL | C831: 0 | D831: 1 | E831: =C831*6+D831 -> 1 | G831: 2 | H831: 4 | I831: =G831*6+H831 -> 16 | K831: 2 | L831: 4 | M831: =K831*6+L831 -> 16 | O831: 3 | P831: 10 | Q831: =O831*6+P831 -> 28 | S831: MUTCH
A832: BEST PLAYERS
A833: PRESTON | D833: REICHMAN | G833: TAYLOR | I833: SUMMERS | L833: STOTT | O833: DAVIE | R833: McMAHON
A834: CAMBERWELL | D834: WOOLFE | G834: PAGE | I834: WOODFORD | L834: BOOTHMAN | O834: PETRIE | R834: FERGUSON
A835: GOALKICKERS
A836: PRESTON | D836: ADAMS 3 | F836: SUMMERS 3 | I836: DAVIE 2 | K836: SURTEES 2 | N836: O'DOHERTY 2 | Q836: WHITE
A837: CAMBERWELL | D837: WOODFORD 2 | G837: MEYER
A839: PORT MELBOURNE | C839: 2 | D839: 3 | E839: =C839*6+D839 -> 15 | G839: 2 | H839: 6 | I839: =G839*6+H839 -> 18 | K839: 4 | L839: 9 | M839: =K839*6+L839 -> 33 | O839: 9 | P839: 10 | Q839: =O839*6+P839 -> 64 | S839: PORT MELBOURNE
A840: WILLIAMSTOWN | C840: 1 | D840: 3 | E840: =C840*6+D840 -> 9 | G840: 3 | H840: 6 | I840: =G840*6+H840 -> 24 | K840: 5 | L840: 10 | M840: =K840*6+L840 -> 40 | O840: 7 | P840: 11 | Q840: =O840*6+P840 -> 53 | S840: MAKER
A841: BEST PLAYERS
A842: PORT MELBOURNE | D842: CLARKE | G842: E PERRETT | J842: GARBUTT | M842: HYDE | O842: KUHLKEN | R842: SMITH
A843: WILLIAMSTOWN | D843: BEASLEY | G843: BRITT | J843: SHEEHAN | M843: CAHILL | O843: J O'BRIEN | R843: McKAY
A844: GOALKICKERS
A845: PORT MELBOURNE | D845: BEDFORD 3 | G845: KUHLKEN 2 | J845: E PERRETT 2) | M845: GARBUTT | O845: PLUMRIDGE
A846: WILLIAMSTOWN | D846: W O'BRIEN 3 | G846: WATERMAN | J846: CAHILL | L846: McDONALD | N846: JOHNS
A848: ROUND 16 | E848: 27TH JULY | J848: WEATHER | M848: CLOUDY BUT FINE | S848: PLAYED AT | X848: LADDER | AB848: ROUND | AD848: 16
D849: 1ST QTR | H849: 2ND QTR | L849: 3RD QTR | P849: FINAL | S849: PORT MELBOURNE
A850: PORT MELBOURNE | C850: 2 | D850: 1 | E850: =C850*6+D850 -> 13 | G850: 5 | H850: 4 | I850: =G850*6+H850 -> 34 | K850: 6 | L850: 10 | M850: =K850*6+L850 -> 46 | O850: 10 | P850: 17 | Q850: =O850*6+P850 -> 77 | S850: UMPIRE | W850: TEAM | X850: W | Y850: L | Z850: D | AA850: FOR | AB850: AGST | AC850: % | AD850: PTS
A851: COBURG | C851: 1 | D851: 5 | E851: =C851*6+D851 -> 11 | G851: 6 | H851: 8 | I851: =G851*6+H851 -> 44 | K851: 8 | L851: 10 | M851: =K851*6+L851 -> 58 | O851: 8 | P851: 14 | Q851: =O851*6+P851 -> 62 | S851: MURRAY
A852: BEST PLAYERS | W852: OAKLEIGH | X852: 13 | Y852: 3 | Z852: 0 | AA852: 1308 | AB852: 978 | AC852: 133.74233128834356 | AD852: 52
A853: PORT MELBOURNE | D853: GARBUTT | G853: CLARKE | I853: CARPENTER | L853: CROMPTON | N853: WILKIN | Q853: BROOKER | W853: PORT MELBOURNE | X853: 13 | Y853: 3 | Z853: 0 | AA853: 1296 | AB853: 973 | AC853: 133.19630010277493 | AD853: 52
A854: COBURG | D854: GARDINER | G854: MEARS | I854: KIGHT | L854: J PLANT | N854: CHARLESTON | Q854: IRVING | W854: NORTHCOTE | X854: 11 | Y854: 5 | Z854: 0 | AA854: 1443 | AB854: 1093 | AC854: 132.02195791399816 | AD854: 44
A855: GOALKICKERS | W855: PRESTON | X855: 11 | Y855: 5 | Z855: 0 | AA855: 1444 | AB855: 1095 | AC855: 131.87214611872147 | AD855: 44
A856: PORT MELBOURNE | D856: BEDFORD 3 | G856: SMITH 2 | I856: PLUMRIDGE | L856: HYDE | N856: BOURKE | P856: McINNES | R856: E PERRETT
A857: COBURG | D857: F PLANT 4 | G857: GARDINER 3 | J857: LEE | W857: BRUNSWICK | X857: 10 | Y857: 5 | Z857: 1 | AA857: 1352 | AB857: 1233 | AC857: 109.65125709651257 | AD857: 42
W858: YARRAVILLE | X858: 10 | Y858: 6 | Z858: 0 | AA858: 1412 | AB858: 1129 | AC858: 125.06643046944198 | AD858: 40
A859: BRUNSWICK | C859: 7 | D859: 2 | E859: =C859*6+D859 -> 44 | G859: 10 | H859: 7 | I859: =G859*6+H859 -> 67 | K859: 11 | L859: 14 | M859: =K859*6+L859 -> 80 | O859: 15 | P859: 20 | Q859: =O859*6+P859 -> 110 | S859: BRUNSWICK | W859: COBURG | X859: 9 | Y859: 6 | Z859: 1 | AA859: 1332 | AB859: 1138 | AC859: 117.04745166959579 | AD859: 38
A860: BRIGHTON | C860: 2 | D860: 3 | E860: =C860*6+D860 -> 15 | G860: 4 | H860: 4 | I860: =G860*6+H860 -> 28 | K860: 6 | L860: 5 | M860: =K860*6+L860 -> 41 | O860: 10 | P860: 9 | Q860: =O860*6+P860 -> 69 | S860: MUTCH | W860: BRIGHTON | X860: 7 | Y860: 8 | Z860: 1 | AA860: 1302 | AB860: 1253 | AC860: 103.91061452513966 | AD860: 30
A861: BEST PLAYERS | W861: WILLIAMSTOWN | X861: 6 | Y861: 10 | Z861: 0 | AA861: 1107 | AB861: 1247 | AC861: 88.77305533279872 | AD861: 24
A862: BRUNSWICK | D862: BLACKMORE | G862: CARTON | I862: KENNETT | L862: McINERNEY | O862: HEARN | Q862: WHITELEY | W862: PRAHRAN | X862: 2 | Y862: 13 | Z862: 1 | AA862: 1127 | AB862: 1357 | AC862: 83.050847457627114 | AD862: 10
A863: BRIGHTON | D863: DUNBAR | G863: LEAPER | I863: DAINTY | L863: BURNES | O863: ELLIOTT | Q863: GARCIA | W863: CAMBERWELL | X863: 1 | Y863: 15 | Z863: 0 | AA863: 1097 | AB863: 1707 | AC863: 64.264792032806099 | AD863: 4
A864: GOALKICKERS | W864: SANDRINGHAM | X864: 1 | Y864: 15 | Z864: 0 | AA864: 1031 | AB864: 2048 | AC864: 50.341796875 | AD864: 4
A865: BRUNSWICK | D865: McINERNEY 7 | G865: KENNETT 2 | J865: HEARN 2 | M865: BRAY | N865: FITZGERALD | Q865: BARRIE | S865: JOHNSTONE
A866: BRIGHTON | D866: HUNT 2 | F866: STEWART 2 | I866: B SMITH 2 | L866: LEAPER | N866: TUCKER | P866: ALDRIDGE | R866: FITT
A868: PRESTON | C868: 4 | D868: 1 | E868: =C868*6+D868 -> 25 | G868: 9 | H868: 6 | I868: =G868*6+H868 -> 60 | K868: 9 | L868: 6 | M868: =K868*6+L868 -> 60 | O868: 15 | P868: 10 | Q868: =O868*6+P868 -> 100 | S868: WILLIAMSTOWN
A869: WILLIAMSTOWN | C869: 1 | D869: 5 | E869: =C869*6+D869 -> 11 | G869: 2 | H869: 7 | I869: =G869*6+H869 -> 19 | K869: 8 | L869: 9 | M869: =K869*6+L869 -> 57 | O869: 8 | P869: 9 | Q869: =O869*6+P869 -> 57 | S869: McKINNON
A870: BEST PLAYERS
A871: PRESTON | D871: SURTEES | G871: TAYLOR | I871: HICKEY | L871: STOTT | O871: SUMMERS | R871: CAMPBELL
A872: WILLIAMSTOWN | D872: CAHILL | G872: BRITT | I872: HELLWIG | L872: SHEEHAN | O872: McDONALD | R872: NANCARROW
A873: GOALKICKERS
A874: PRESTON | D874: SURTEES 4 | F874: DAVIE 3 | H874: SUMMERS 2 | K874: TAYLOR 2 | M874: ADAMS | O874: STOTT | Q874: SEEBECK | S874: McMAHON
A875: WILLIAMSTOWN | D875: CAHILL 2 | F875: McDONALD 2 | I875: SINCLAIR 2 | L875: SHEEHAN | N875: TAAFE
A877: YARRAVILLE | C877: 7 | D877: 4 | E877: =C877*6+D877 -> 46 | G877: 11 | H877: 10 | I877: =G877*6+H877 -> 76 | K877: 18 | L877: 11 | M877: =K877*6+L877 -> 119 | O877: 23 | P877: 14 | Q877: =O877*6+P877 -> 152 | S877: YARRAVILLE
A878: CAMBERWELL | C878: 1 | D878: 0 | E878: =C878*6+D878 -> 6 | G878: 6 | H878: 5 | I878: =G878*6+H878 -> 41 | K878: 9 | L878: 7 | M878: =K878*6+L878 -> 61 | O878: 10 | P878: 10 | Q878: =O878*6+P878 -> 70 | S878: STUART
A879: BEST PLAYERS
A880: YARRAVILLE | D880: TYSON | G880: COULSELL | J880: HENRY | M880: CAMERON | P880: KENNEDY | S880: SHERMAN
A881: CAMBERWELL | D881: WOOLFE | G881: WOODFROD | J881: PETRIE | M881: GREENBURY | P881: HARRISON | S881: JACKSON
A882: GOALKICKERS
A883: YARRAVILLE | D883: TYSON 8 | F883: CAMERON 4 | I883: HENRY 4 | K883: COULSELL 3 | N883: KENNEDY 2 | Q883: THOMAS 2
A884: CAMBERWELL | D884: PETRIE 3 | F884: WOODFORD 2 | I884: GREENBURY 2 | L884: MEYER | N884: COFFIN | P884: McCOLL
A886: NORTHCOTE | C886: 3 | D886: 4 | E886: =C886*6+D886 -> 22 | G886: 5 | H886: 8 | I886: =G886*6+H886 -> 38 | K886: 11 | L886: 15 | M886: =K886*6+L886 -> 81 | O886: 12 | P886: 16 | Q886: =O886*6+P886 -> 88 | S886: TOORAK PARK
A887: PRAHRAN | C887: 0 | D887: 0 | E887: =C887*6+D887 -> 0 | G887: 2 | H887: 6 | I887: =G887*6+H887 -> 18 | K887: 2 | L887: 6 | M887: =K887*6+L887 -> 18 | O887: 10 | P887: 8 | Q887: =O887*6+P887 -> 68 | S887: PAYNE
A888: BEST PLAYERS
A889: NORTHCOTE | D889: ROWE | G889: KOOP | I889: COLE | L889: COCKRAM | O889: BROWN | R889: HANNAN
A890: PRAHRAN | D890: SMEDLEY | G890: NAYLOR | I890: DONOGHUE | L890: LUCAS | O890: OSBORNE | R890: J SMITH
A891: GOALKICKERS
A892: NORTHCOTE | D892: SEYMOUR 4 | G892: COLE 3 | I892: HEENAN 2 | L892: MILNE | N892: BROWN | P892: TOWERS
A893: PRAHRAN | D893: ROWE 3 | F893: DONOGHUE 3 | I893: BARNETT 2 | L893: SMEDLEY | N893: LAMPREY | Q893: PRENTICE
A895: OAKLEIGH | C895: 3 | D895: 7 | E895: =C895*6+D895 -> 25 | G895: 10 | H895: 10 | I895: =G895*6+H895 -> 70 | K895: 15 | L895: 13 | M895: =K895*6+L895 -> 103 | O895: 22 | P895: 21 | Q895: =O895*6+P895 -> 153 | S895: BEACH ROAD
A896: SANDRINGHAM | C896: 1 | D896: 4 | E896: =C896*6+D896 -> 10 | G896: 2 | H896: 8 | I896: =G896*6+H896 -> 20 | K896: 3 | L896: 12 | M896: =K896*6+L896 -> 30 | O896: 8 | P896: 14 | Q896: =O896*6+P896 -> 62 | S896: LESTER
A897: BEST PLAYERS
A898: OAKLEIGH | D898: FRASER | G898: RUDOLPH | J898: DOLAN | M898: GODING | P898: GUNNYON | S898: IRWIN
A899: SANDRINGHAM | D899: BOURKE | G899: ANDERSON | J899: CHALLIS | M899: BOYD | P899: ROSS | S899: FRICKER
A900: GOALKICKERS
A901: OAKLEIGH | D901: FRASER 7 | F901: IRWIN 5 | H901: MAHER 3 | J901: LUKIES 2 | M901: WOOLARD 2 | P901: SHELTON | R901: GODING | T901: HOLFORD
A902: SANDRINGHAM | D902: BOYD 2 | F902: BOURKE 2 | I902: CONNOP | K902: JACK RYAN | N902: R KENNA | Q902: FRICKER
A904: ROUND 17 | E904: 3RD AUGUST | H904: WEATHER | K904: CLOUDY BUT FINE STRONG N.W. WIND | S904: PLAYED AT | X904: LADDER | AB904: ROUND | AD904: 17
D905: 1ST QTR | H905: 2ND QTR | L905: 3RD QTR | P905: FINAL | S905: OAKLEIGH
A906: PORT MELBOURNE | C906: 0 | D906: 3 | E906: =C906*6+D906 -> 3 | G906: 4 | H906: 4 | I906: =G906*6+H906 -> 28 | K906: 7 | L906: 4 | M906: =K906*6+L906 -> 46 | O906: 10 | P906: 10 | Q906: =O906*6+P906 -> 70 | S906: UMPIRE | W906: TEAM | X906: W | Y906: L | Z906: D | AA906: FOR | AB906: AGST | AC906: % | AD906: PTS
A907: OAKLEIGH | C907: 2 | D907: 2 | E907: =C907*6+D907 -> 14 | G907: 4 | H907: 6 | I907: =G907*6+H907 -> 30 | K907: 8 | L907: 7 | M907: =K907*6+L907 -> 55 | O907: 10 | P907: 8 | Q907: =O907*6+P907 -> 68 | S907: McKINNON
A908: BEST PLAYERS | W908: PORT MELBOURNE | X908: 14 | Y908: 3 | Z908: 0 | AA908: 1366 | AB908: 1041 | AC908: 131.21998078770412 | AD908: 56
A909: PORT MELBOURNE | D909: FISHER | G909: PLUMRIDGE | J909: HYDE | L909: CROMPTON | O909: SKILTON | Q909: PETERSON | W909: OAKLEIGH | X909: 13 | Y909: 4 | Z909: 0 | AA909: 1376 | AB909: 1048 | AC909: 131.29770992366412 | AD909: 52
A910: OAKLEIGH | D910: RUDOLPH | G910: MAHER | J910: IRWIN | L910: HOLFORD | O910: THOMAS | Q910: MORRIS | W910: NORTHCOTE | X910: 12 | Y910: 5 | Z910: 0 | AA910: 1566 | AB910: 1154 | AC910: 135.70190641247834 | AD910: 48
A911: GOALKICKERS | W911: BRUNSWICK | X911: 11 | Y911: 5 | Z911: 1 | AA911: 1422 | AB911: 1292 | AC911: 110.06191950464397 | AD911: 46
A912: PORT MELBOURNE | D912: BEDFORD 2 | F912: PLUMRIDGE 2 | I912: FISHER 2 | K912: WILKIN | M912: SMITH | O912: E PERRETT | Q912: R PERRETT
A913: OAKLEIGH | D913: IRWIN 3 | F913: MAHER 2 | I913: FRASER 2 | K913: SPAIN | M913: RUDOLPH | O913: HOLFORD | W913: PRESTON | X913: 11 | Y913: 6 | Z913: 0 | AA913: 1503 | AB913: 1165 | AC913: 129.01287553648069 | AD913: 44
W914: COBURG | X914: 10 | Y914: 6 | Z914: 1 | AA914: 1409 | AB914: 1178 | AC914: 119.60950764006792 | AD914: 42
A915: BRUNSWICK | C915: 3 | D915: 3 | E915: =C915*6+D915 -> 21 | G915: 6 | H915: 5 | I915: =G915*6+H915 -> 41 | K915: 8 | L915: 7 | M915: =K915*6+L915 -> 55 | O915: 10 | P915: 10 | Q915: =O915*6+P915 -> 70 | S915: BRUNSWICK | W915: YARRAVILLE | X915: 10 | Y915: 7 | Z915: 0 | AA915: 1473 | AB915: 1252 | AC915: 117.65175718849841 | AD915: 40
A916: PRESTON | C916: 2 | D916: 2 | E916: =C916*6+D916 -> 14 | G916: 5 | H916: 6 | I916: =G916*6+H916 -> 36 | K916: 5 | L916: 12 | M916: =K916*6+L916 -> 42 | O916: 7 | P916: 17 | Q916: =O916*6+P916 -> 59 | S916: PAYNE | W916: BRIGHTON | X916: 7 | Y916: 9 | Z916: 1 | AA916: 1339 | AB916: 1307 | AC916: 102.44835501147666 | AD916: 30
A917: BEST PLAYERS | W917: WILLIAMSTOWN | X917: 7 | Y917: 10 | Z917: 0 | AA917: 1161 | AB917: 1284 | AC917: 90.420560747663558 | AD917: 28
A918: BRUNSWICK | D918: STEELE | G918: KENNETT | I918: JACOBSON | L918: BLACKMORE | O918: CROSS | Q918: BRAY | W918: PRAHRAN | X918: 2 | Y918: 14 | Z918: 1 | AA918: 1167 | AB918: 1434 | AC918: 81.38075313807532 | AD918: 10
A919: PRESTON | D919: STOTT | G919: SURTEES | I919: JENKINS | L919: REICHMAN | O919: TAYLOR | Q919: MONOHAN | W919: CAMBERWELL | X919: 2 | Y919: 15 | Z919: 0 | AA919: 1178 | AB919: 1776 | AC919: 66.328828828828833 | AD919: 8
A920: GOALKICKERS | W920: SANDRINGHAM | X920: 1 | Y920: 16 | Z920: 0 | AA920: 1100 | AB920: 2129 | AC920: 51.667449506810712 | AD920: 4
A921: BRUNSWICK | D921: BRAY 5 | G921: CROSS 2 | J921: JOHNSTONE 2 | N921: FITZGERALD
A922: PRESTON | D922: SURTEES 3 | G922: STOTT 2 | J922: DODD | L922: TAYLOR
A924: NORTHCOTE | C924: 6 | D924: 4 | E924: =C924*6+D924 -> 40 | G924: 8 | H924: 6 | I924: =G924*6+H924 -> 54 | K924: 11 | L924: 13 | M924: =K924*6+L924 -> 79 | O924: 18 | P924: 15 | Q924: =O924*6+P924 -> 123 | S924: NORTHCOTE
A925: YARRAVILLE | C925: 1 | D925: 3 | E925: =C925*6+D925 -> 9 | G925: 4 | H925: 8 | I925: =G925*6+H925 -> 32 | K925: 7 | L925: 9 | M925: =K925*6+L925 -> 51 | O925: 8 | P925: 13 | Q925: =O925*6+P925 -> 61 | S925: MURRAY
A926: BEST PLAYERS
A927: NORTHCOTE | D927: PRUSER | G927: NICHOLLS | J927: SEYMOUR | M927: ROSS | O927: WILSON | R927: STOCKDALE
A928: YARRAVILLE | D928: COULSELL | G928: BROWN | J928: BEER | M928: JOYCE | O928: EDWARDS | R928: KENNEDY
A929: GOALKICKERS
A930: NORTHCOTE | D930: SEYMOUR 4 | G930: PRUSER 4 | I930: ROSS 3 | K930: COLE 2 | M930: MILNE 2 | O930: GRAY | Q930: GOULLET | S930: TOWERS
A931: YARRAVILLE | D931: TYSON 3 | G931: COULSELL 2 | J931: CAMERON 2 | M931: KENNEDY
A933: WILLIAMSTOWN | C933: 5 | D933: 5 | E933: =C933*6+D933 -> 35 | G933: 5 | H933: 5 | I933: =G933*6+H933 -> 35 | K933: 6 | L933: 16 | M933: =K933*6+L933 -> 52 | O933: 6 | P933: 18 | Q933: =O933*6+P933 -> 54 | S933: ELSTERNWICK
A934: BRIGHTON | C934: 1 | D934: 0 | E934: =C934*6+D934 -> 6 | G934: 2 | H934: 1 | I934: =G934*6+H934 -> 13 | K934: 2 | L934: 3 | M934: =K934*6+L934 -> 15 | O934: 5 | P934: 7 | Q934: =O934*6+P934 -> 37 | S934: LYNCH
A935: BEST PLAYERS
A936: WILLIAMSTOWN | D936: HELLWIG | G936: JOHNS | J936: W O'BRIEN | M936: SYKES | O936: CLAPSON | R936: SINCLAIR
A937: BRIGHTON | D937: LEAPER | G937: ELLIOTT | J937: GARCIA | M937: DUNBAR | O937: BORLAND | R937: B SMITH
A938: GOALKICKERS
A939: WILLIAMSTOWN | D939: SINCLAIR 2 | G939: JOHNS 2 | J939: HELLWIG | M939: DREW
A940: BRIGHTON | D940: B SMITH 2 | G940: TULLOH | J940: TUCKER | M940: PAGE
A942: CAMBERWELL | C942: 0 | D942: 1 | E942: =C942*6+D942 -> 1 | G942: 7 | H942: 9 | I942: =G942*6+H942 -> 51 | K942: 8 | L942: 9 | M942: =K942*6+L942 -> 57 | O942: 10 | P942: 21 | Q942: =O942*6+P942 -> 81 | S942: CAMBERWELL
A943: SANDRINGHAM | C943: 2 | D943: 10 | E943: =C943*6+D943 -> 22 | G943: 2 | H943: 11 | I943: =G943*6+H943 -> 23 | K943: 9 | L943: 15 | M943: =K943*6+L943 -> 69 | O943: 9 | P943: 15 | Q943: =O943*6+P943 -> 69 | S943: LESTER
A944: BEST PLAYERS
A945: CAMBERWELL | D945: PETRIE | G945: ANDERSON | J945: PAGE | M945: JACKSON | P945: LAWN | R945: CLAMP
A946: SANDRINGHAM | D946: BOURKE | G946: CHALLIS | J946: SMITH | M946: LAVER | P946: FRICKER | R946: McCASHNEY
A947: GOALKICKERS
A948: CAMBERWELL | D948: LAWN 4 | G948: COFFIN 2 | J948: PETRIE 2 | M948: GREENBURY | P948: ANDERSON
A949: SANDRINGHAM | D949: BOYD 2 | G949: CHALLIS 2 | J949: BOURKE 2 | M949: R KENNA 2 | P949: HERRON
A951: COBURG | C951: 0 | D951: 2 | E951: =C951*6+D951 -> 2 | G951: 5 | H951: 8 | I951: =G951*6+H951 -> 38 | K951: 7 | L951: 10 | M951: =K951*6+L951 -> 52 | O951: 10 | P951: 17 | Q951: =O951*6+P951 -> 77 | S951: COBURG
A952: PRAHRAN | C952: 0 | D952: 9 | E952: =C952*6+D952 -> 9 | G952: 0 | H952: 9 | I952: =G952*6+H952 -> 9 | K952: 2 | L952: 15 | M952: =K952*6+L952 -> 27 | O952: 4 | P952: 16 | Q952: =O952*6+P952 -> 40 | S952: STUART
A953: BEST PLAYERS
A954: COBURG | D954: CHAPMAN | G954: F PLANT | I954: KIGHT | L954: JENKINS | O954: MEARS | Q954: WITHAM
A955: PRAHRAN | D955: TERRY | G955: LUCAS | I955: JACK SMITH | L955: OSBORNE | O955: FIDLER | Q955: DARVELL
A956: GOALKICKERS
A957: COBURG | D957: F PLANT 6 | G957: VOIGHT 2 | J957: McGRATH | M957: LEE
A958: PRAHRAN | D958: ROWE | F958: JORDAN | I958: LAMPREY | L958: PRENTICE
A960: ROUND 18 | E960: 10TH AUGUST | J960: WEATHER | M960: FINE SOUTH BREEZE | S960: PLAYED AT | X960: LADDER | AB960: ROUND | AD960: 18
D961: 1ST QTR | H961: 2ND QTR | L961: 3RD QTR | P961: FINAL | S961: PORT MELBOURNE
A962: PRESTON | C962: 5 | D962: 3 | E962: =C962*6+D962 -> 33 | G962: 8 | H962: 9 | I962: =G962*6+H962 -> 57 | K962: 12 | L962: 13 | M962: =K962*6+L962 -> 85 | O962: 19 | P962: 15 | Q962: =O962*6+P962 -> 129 | S962: UMPIRE | W962: TEAM | X962: W | Y962: L | Z962: D | AA962: FOR | AB962: AGST | AC962: % | AD962: PTS
A963: PORT MELBOURNE | C963: 0 | D963: 8 | E963: =C963*6+D963 -> 8 | G963: 2 | H963: 8 | I963: =G963*6+H963 -> 20 | K963: 5 | L963: 13 | M963: =K963*6+L963 -> 43 | O963: 6 | P963: 14 | Q963: =O963*6+P963 -> 50 | S963: MURRAY
A964: BEST PLAYERS | W964: OAKLEIGH | X964: 14 | Y964: 4 | Z964: 0 | AA964: 1444 | AB964: 1111 | AC964: 129.97299729972997 | AD964: 56
A965: PRESTON | D965: HICKEY | F965: CAMPBELL | I965: SURTEES | L965: REICHMAN | O965: TAYLOR | Q965: DAVIE | W965: PORT MELBOURNE | X965: 14 | Y965: 4 | Z965: 0 | AA965: 1416 | AB965: 1170 | AC965: 121.02564102564102 | AD965: 56
A966: PORT MELBOURNE | D966: WILKIN | F966: SKILTON | I966: HYDE | L966: SMITH | O966: McINNES | Q966: GARBUTT | W966: NORTHCOTE | X966: 13 | Y966: 5 | Z966: 0 | AA966: 1682 | AB966: 1200 | AC966: 140.16666666666666 | AD966: 52
A967: GOALKICKERS | W967: PRESTON | X967: 12 | Y967: 6 | Z967: 0 | AA967: 1632 | AB967: 1215 | AC967: 134.32098765432099 | AD967: 48
A968: PRESTON | D968: SURTEES 6 | F968: ADAMS 5 | I968: SUMMERS 3 | L968: DAVIE 2 | N968: TAYLOR 2 | Q968: McMAHON
A969: PORT MELBOURNE | D969: GARBUTT 2 | G969: BEDFORD | I969: PETERSON | L969: KUHLKEN | N969: CROSSEN | W969: BRUNSWICK | X969: 11 | Y969: 6 | Z969: 1 | AA969: 1485 | AB969: 1360 | AC969: 109.19117647058823 | AD969: 46
W970: YARRAVILLE | X970: 11 | Y970: 7 | Z970: 0 | AA970: 1574 | AB970: 1309 | AC970: 120.24446142093201 | AD970: 44
A971: NORTHCOTE | C971: 0 | D971: 2 | E971: =C971*6+D971 -> 2 | G971: 6 | H971: 5 | I971: =G971*6+H971 -> 41 | K971: 7 | L971: 7 | M971: =K971*6+L971 -> 49 | O971: 17 | P971: 14 | Q971: =O971*6+P971 -> 116 | S971: COBURG | W971: COBURG | X971: 10 | Y971: 7 | Z971: 1 | AA971: 1455 | AB971: 1294 | AC971: 112.44204018547141 | AD971: 42
A972: COBURG | C972: 3 | D972: 6 | E972: =C972*6+D972 -> 24 | G972: 4 | H972: 6 | I972: =G972*6+H972 -> 30 | K972: 5 | L972: 10 | M972: =K972*6+L972 -> 40 | O972: 6 | P972: 10 | Q972: =O972*6+P972 -> 46 | S972: LESTER | W972: WILLIAMSTOWN | X972: 8 | Y972: 10 | Z972: 0 | AA972: 1242 | AB972: 1330 | AC972: 93.383458646616546 | AD972: 32
A973: BEST PLAYERS | W973: BRIGHTON | X973: 7 | Y973: 10 | Z973: 1 | AA973: 1396 | AB973: 1408 | AC973: 99.147727272727266 | AD973: 30
A974: NORTHCOTE | D974: NICHOLLS | G974: PRUSER | I974: ROSS | K974: WILSON | N974: POULTER | Q974: BROWN | W974: PRAHRAN | X974: 3 | Y974: 14 | Z974: 1 | AA974: 1279 | AB974: 1494 | AC974: 85.609103078982599 | AD974: 14
A975: COBURG | D975: CHARLESTON | G975: KIGHT | I975: MEARS | K975: HASSETT | N975: F PLANT | Q975: McGRATH | W975: CAMBERWELL | X975: 2 | Y975: 16 | Z975: 0 | AA975: 1224 | AB975: 1857 | AC975: 65.912762520193866 | AD975: 8
A976: GOALKICKERS | S976: KOOP | W976: SANDRINGHAM | X976: 1 | Y976: 17 | Z976: 0 | AA976: 1160 | AB976: 2241 | AC976: 51.762605979473449 | AD976: 4
A977: NORTHCOTE | D977: POULTER 2 | F977: SEYMOUR 2 | I977: PRUSER 2 | K977: MILNE 2 | M977: COLE 2 | O977: GRAY 2 | Q977: BROWN 2 | T977: J WOODS 2
A978: COBURG | D978: COLBERT 2 | G978: McGRATH 2 | J978: MEARS 2
A980: OAKLEIGH | C980: 3 | D980: 0 | E980: =C980*6+D980 -> 18 | G980: 8 | H980: 3 | I980: =G980*6+H980 -> 51 | K980: 9 | L980: 7 | M980: =K980*6+L980 -> 61 | O980: 9 | P980: 14 | Q980: =O980*6+P980 -> 68 | S980: OAKLEIGH
A981: BRUNSWICK | C981: 4 | D981: 4 | E981: =C981*6+D981 -> 28 | G981: 6 | H981: 6 | I981: =G981*6+H981 -> 42 | K981: 8 | L981: 7 | M981: =K981*6+L981 -> 55 | O981: 9 | P981: 9 | Q981: =O981*6+P981 -> 63 | S981: McKINNON
A982: BEST PLAYERS
A983: OAKLEIGH | D983: FRASER | G983: MAHER | J983: RUDOLPH | M983: SPAIN | P983: GOMEZ | S983: DOLAN
A984: BRUNSWICK | D984: McINERNEY | G984: BLACKMORE | J984: WILTSHIRE | M984: KENNETT | P984: BARRIE | S984: BRAY
A985: GOALKICKERS
A986: OAKLEIGH | D986: FRASER 3 | G986: MAHER 2 | J986: SPAIN 2 | M986: SHELTON | O986: GOMEZ
A987: BRUNSWICK | D987: McINERNEY 4 | G987: BRAY | I987: FITZGERALD | L987: JOHNSTONE | N987: KENNETT | Q987: BARRIE
A989: YARRAVILLE | C989: 5 | D989: 7 | E989: =C989*6+D989 -> 37 | G989: 5 | H989: 8 | I989: =G989*6+H989 -> 38 | K989: 13 | L989: 12 | M989: =K989*6+L989 -> 90 | O989: 14 | P989: 17 | Q989: =O989*6+P989 -> 101 | S989: YARRAVILLE
A990: BRIGHTON | C990: 0 | D990: 1 | E990: =C990*6+D990 -> 1 | G990: 4 | H990: 4 | I990: =G990*6+H990 -> 28 | K990: 5 | L990: 6 | M990: =K990*6+L990 -> 36 | O990: 8 | P990: 9 | Q990: =O990*6+P990 -> 57 | S990: McNIECE
A991: BEST PLAYERS
A992: YARRAVILLE | D992: BOLMAN | G992: COULSELL | J992: TYSON | M992: JOYCE | P992: HENRY | S992: ROBERTS
A993: BRIGHTON | D993: TUCKER | G993: B SMITH | J993: ALDRIDGE | M993: LEAPER | P993: ELLIOTT | S993: BORLAND
A994: GOALKICKERS
A995: YARRAVILLE | D995: FARRELL 3 | F995: HENRY 3 | H995: GAMBETTA 2 | K995: SMITH 2 | M995: TYSON | O995: COULSELL | Q995: KENNEDY | T995: LYONS
A996: BRIGHTON | D996: B SMITH 6 | G996: LEAPER | I996: STOREY
A998: WILLIAMSTOWN | C998: 0 | D998: 4 | E998: =C998*6+D998 -> 4 | G998: 2 | H998: 8 | I998: =G998*6+H998 -> 20 | K998: 6 | L998: 9 | M998: =K998*6+L998 -> 45 | O998: 12 | P998: 9 | Q998: =O998*6+P998 -> 81 | S998: WILLIAMSTOWN
A999: CAMBERWELL | C999: 2 | D999: 3 | E999: =C999*6+D999 -> 15 | G999: 4 | H999: 4 | I999: =G999*6+H999 -> 28 | K999: 5 | L999: 8 | M999: =K999*6+L999 -> 38 | O999: 6 | P999: 10 | Q999: =O999*6+P999 -> 46 | S999: MUTCH
A1000: BEST PLAYERS
A1001: WILLIAMSTOWN | D1001: SYKES | G1001: J O'BRIEN | J1001: W O'BRIEN | M1001: CAHILL | P1001: HELLWIG | S1001: SINCLAIR
A1002: CAMBERWELL | D1002: LAWN | G1002: WOODFORD | J1002: PAGE | M1002: BOOTHMAN | P1002: WOOLFE | S1002: MEYER
A1003: GOALKICKERS
A1004: WILLIAMSTOWN | D1004: J O'BRIEN 4 | G1004: HELLWIG 3 | J1004: W O'BRIEN 2 | M1004: CAHILL | O1004: McDONALD | R1004: SINCLAIR
A1005: CAMBERWELL | D1005: LAWN 2 | G1005: WOODFORD 2 | J1005: COFFIN | L1005: MEYER
A1007: PRAHRAN | C1007: 6 | D1007: 7 | E1007: =C1007*6+D1007 -> 43 | G1007: 9 | H1007: 12 | I1007: =G1007*6+H1007 -> 66 | K1007: 12 | L1007: 23 | M1007: =K1007*6+L1007 -> 95 | O1007: 14 | P1007: 28 | Q1007: =O1007*6+P1007 -> 112 | S1007: BEACH ROAD
A1008: SANDRINGHAM | C1008: 1 | D1008: 3 | E1008: =C1008*6+D1008 -> 9 | G1008: 5 | H1008: 6 | I1008: =G1008*6+H1008 -> 36 | K1008: 6 | L1008: 6 | M1008: =K1008*6+L1008 -> 42 | O1008: 9 | P1008: 6 | Q1008: =O1008*6+P1008 -> 60 | S1008: WILLIAMSON
A1009: BEST PLAYERS
A1010: PRAHRAN | D1010: LORD | G1010: LAMPREY | J1010: PRENTICE | M1010: NAYLOR | P1010: OSBORNE | S1010: BREWIS
A1011: SANDRINGHAM | D1011: BRIDGFORD | G1011: BOYD | J1011: BOURKE | M1011: CHALLIS | P1011: CONNOP | S1011: ROSS
A1012: GOALKICKERS
A1013: PRAHRAN | D1013: PRENTICE 5 | F1013: SMEDLEY 2 | I1013: ROWE 2 | K1013: LORD | M1013: JORDAN | O1013: BARNETT | Q1013: JACK SMITH | T1013: LAMPREY
A1014: SANDRINGHAM | D1014: BOYD 3 | F1014: CONNOP 2 | I1014: CHALLIS | K1014: R KENNA | M1014: JACK RYAN | P1014: BRIDGFORD
A1016: ROUND 19 | E1016: 17TH AUGUST | H1016: WEATHER | K1016: SHOWERS S.W. WIND GROUNDS BAD | S1016: PLAYED AT | X1016: LADDER | AB1016: ROUND | AD1016: 19
D1017: 1ST QTR | H1017: 2ND QTR | L1017: 3RD QTR | P1017: FINAL | S1017: NORTHCOTE
A1018: NORTHCOTE | C1018: 2 | D1018: 1 | E1018: =C1018*6+D1018 -> 13 | G1018: 5 | H1018: 2 | I1018: =G1018*6+H1018 -> 32 | K1018: 9 | L1018: 2 | M1018: =K1018*6+L1018 -> 56 | O1018: 12 | P1018: 6 | Q1018: =O1018*6+P1018 -> 78 | S1018: UMPIRE | W1018: TEAM | X1018: W | Y1018: L | Z1018: D | AA1018: FOR | AB1018: AGST | AC1018: % | AD1018: PTS
A1019: PORT MELBOURNE | C1019: 1 | D1019: 3 | E1019: =C1019*6+D1019 -> 9 | G1019: 4 | H1019: 7 | I1019: =G1019*6+H1019 -> 31 | K1019: 7 | L1019: 10 | M1019: =K1019*6+L1019 -> 52 | O1019: 9 | P1019: 11 | Q1019: =O1019*6+P1019 -> 65 | S1019: McKINNON
A1020: BEST PLAYERS | W1020: NORTHCOTE | X1020: 14 | Y1020: 5 | Z1020: 0 | AA1020: 1760 | AB1020: 1265 | AC1020: 139.13043478260869 | AD1020: 56
A1021: NORTHCOTE | D1021: STOCKDALE | G1021: SEYMOUR | I1021: MILNE | L1021: TOWERS | O1021: ROSS | Q1021: PRUSER | W1021: OAKLEIGH | X1021: 14 | Y1021: 5 | Z1021: 0 | AA1021: 1495 | AB1021: 1174 | AC1021: 127.34241908006814 | AD1021: 56
A1022: PORT MELBOURNE | D1022: CROMPTON | G1022: LEGGO | I1022: PLUMRIDGE | L1022: WILKIN | O1022: R PERRETT | Q1022: SKILTON | W1022: PORT MELBOURNE | X1022: 14 | Y1022: 5 | Z1022: 0 | AA1022: 1481 | AB1022: 1248 | AC1022: 118.6698717948718 | AD1022: 56
A1023: GOALKICKERS | W1023: PRESTON | X1023: 13 | Y1023: 6 | Z1023: 0 | AA1023: 1695 | AB1023: 1266 | AC1023: 133.88625592417063 | AD1023: 52
A1024: NORTHCOTE | D1024: SEYMOUR 4 | G1024: COLE 3 | I1024: ROSS 2 | K1024: PRUSER | M1024: GRAY | O1024: BROWN
A1025: PORT MELBOURNE | D1025: KUHLKEN 3 | G1025: McINNES | I1025: BEDFORD | K1025: PLUMRIDGE | N1025: E PERRETT | Q1025: FISHER | S1025: LEGGO | W1025: BRUNSWICK | X1025: 12 | Y1025: 6 | Z1025: 1 | AA1025: 1629 | AB1025: 1437 | AC1025: 113.36116910229646 | AD1025: 50
W1026: COBURG | X1026: 11 | Y1026: 7 | Z1026: 1 | AA1026: 1545 | AB1026: 1376 | AC1026: 112.28197674418605 | AD1026: 46
A1027: PRESTON | C1027: 2 | D1027: 2 | E1027: =C1027*6+D1027 -> 14 | G1027: 4 | H1027: 9 | I1027: =G1027*6+H1027 -> 33 | K1027: 4 | L1027: 12 | M1027: =K1027*6+L1027 -> 36 | O1027: 8 | P1027: 15 | Q1027: =O1027*6+P1027 -> 63 | S1027: PRESTON | W1027: YARRAVILLE | X1027: 11 | Y1027: 8 | Z1027: 0 | AA1027: 1625 | AB1027: 1378 | AC1027: 117.9245283018868 | AD1027: 44
A1028: OAKLEIGH | C1028: 1 | D1028: 9 | E1028: =C1028*6+D1028 -> 15 | G1028: 2 | H1028: 11 | I1028: =G1028*6+H1028 -> 23 | K1028: 5 | L1028: 13 | M1028: =K1028*6+L1028 -> 43 | O1028: 6 | P1028: 15 | Q1028: =O1028*6+P1028 -> 51 | S1028: PAYNE | W1028: WILLIAMSTOWN | X1028: 9 | Y1028: 10 | Z1028: 0 | AA1028: 1336 | AB1028: 1349 | AC1028: 99.036323202372131 | AD1028: 36
A1029: BEST PLAYERS | W1029: BRIGHTON | X1029: 7 | Y1029: 11 | Z1029: 1 | AA1029: 1478 | AB1029: 1498 | AC1029: 98.6648865153538 | AD1029: 30
A1030: PRESTON | D1030: ADAMS | F1030: SURTEES | I1030: SUMMERS | L1030: REICHMAN | O1030: STOTT | Q1030: HICKEY | W1030: PRAHRAN | X1030: 4 | Y1030: 14 | Z1030: 1 | AA1030: 1348 | AB1030: 1545 | AC1030: 87.249190938511333 | AD1030: 18
A1031: OAKLEIGH | D1031: MAHER | F1031: RUDOLPH | I1031: SPAIN | L1031: IRWIN | O1031: SHELTON | Q1031: GOMEZ | W1031: CAMBERWELL | X1031: 2 | Y1031: 17 | Z1031: 0 | AA1031: 1301 | AB1031: 2001 | AC1031: 65.017491254372814 | AD1031: 8
A1032: GOALKICKERS | W1032: SANDRINGHAM | X1032: 1 | Y1032: 18 | Z1032: 0 | AA1032: 1179 | AB1032: 2335 | AC1032: 50.492505353319061 | AD1032: 4
A1033: PRESTON | D1033: ADAMS 3 | G1033: DAVIE 3 | J1033: SURTEES 2
A1034: OAKLEIGH | D1034: MAHER 2 | G1034: SHELTON 2 | J1034: IRWIN | L1034: W BROWNE
A1036: COBURG | C1036: 6 | D1036: 3 | E1036: =C1036*6+D1036 -> 39 | G1036: 7 | H1036: 3 | I1036: =G1036*6+H1036 -> 45 | K1036: 10 | L1036: 5 | M1036: =K1036*6+L1036 -> 65 | O1036: 14 | P1036: 6 | Q1036: =O1036*6+P1036 -> 90 | S1036: ELSTERNWICK PARK
A1037: BRIGHTON | C1037: 2 | D1037: 1 | E1037: =C1037*6+D1037 -> 13 | G1037: 5 | H1037: 7 | I1037: =G1037*6+H1037 -> 37 | K1037: 7 | L1037: 11 | M1037: =K1037*6+L1037 -> 53 | O1037: 11 | P1037: 16 | Q1037: =O1037*6+P1037 -> 82 | S1037: MURRAY
A1038: BEST PLAYERS
A1039: COBURG | D1039: JENKINS | G1039: IRVING | J1039: GARDINER | M1039: F PLANT | P1039: MEARS | S1039: ROGERS
A1040: BRIGHTON | D1040: CANTWELL | G1040: STEWART | J1040: BURNES | M1040: LEAPER | P1040: TULLOH | S1040: TUCKER
A1041: GOALKICKERS
A1042: COBURG | D1042: GARDINER 6 | G1042: F PLANT 3 | J1042: MEARS 3 | M1042: McGRATH | O1042: KIGHT
A1043: BRIGHTON | D1043: RENNIE 4 | F1043: B SMITH 2 | I1043: DORE | K1043: BURNES | M1043: DUNBAR | O1043: LUCAS | Q1043: HARRISON
A1045: PRAHRAN | C1045: 3 | D1045: 1 | E1045: =C1045*6+D1045 -> 19 | G1045: 4 | H1045: 3 | I1045: =G1045*6+H1045 -> 27 | K1045: 5 | L1045: 9 | M1045: =K1045*6+L1045 -> 39 | O1045: 9 | P1045: 15 | Q1045: =O1045*6+P1045 -> 69 | S1045: TOORAK PARK
A1046: YARRAVILLE | C1046: 1 | D1046: 2 | E1046: =C1046*6+D1046 -> 8 | G1046: 2 | H1046: 2 | I1046: =G1046*6+H1046 -> 14 | K1046: 5 | L1046: 3 | M1046: =K1046*6+L1046 -> 33 | O1046: 8 | P1046: 3 | Q1046: =O1046*6+P1046 -> 51 | S1046: MUTCH
A1047: BEST PLAYERS
A1048: PRAHRAN | D1048: TERRY | G1048: GREENWOOD | J1048: LORD | M1048: NAYLOR | P1048: F SMITH | S1048: FIDLER
A1049: YARRAVILLE | D1049: COULSELL | G1049: POOLE | J1049: TYSON | M1049: KENNEDY | P1049: SMITH | S1049: BOLMAN
A1050: GOALKICKERS
A1051: PRAHRAN | D1051: SMEDLEY 2 | G1051: GREENWOOD 2 | J1051: PRENTICE 2 | M1051: LORD | O1051: ROWE | Q1051: LAMPREY
A1052: YARRAVILLE | D1052: HENRY 2 | G1052: ROBERTS 2 | J1052: COULSELL | M1052: THOMAS | O1052: LYONS | Q1052: WUNHYM
A1054: WILLIAMSTOWN | C1054: 2 | D1054: 7 | E1054: =C1054*6+D1054 -> 19 | G1054: 6 | H1054: 9 | I1054: =G1054*6+H1054 -> 45 | K1054: 9 | L1054: 11 | M1054: =K1054*6+L1054 -> 65 | O1054: 13 | P1054: 16 | Q1054: =O1054*6+P1054 -> 94 | S1054: WILLIAMSTOWN
A1055: SANDRINGHAM | C1055: 1 | D1055: 1 | E1055: =C1055*6+D1055 -> 7 | G1055: 1 | H1055: 2 | I1055: =G1055*6+H1055 -> 8 | K1055: 1 | L1055: 6 | M1055: =K1055*6+L1055 -> 12 | O1055: 2 | P1055: 7 | Q1055: =O1055*6+P1055 -> 19 | S1055: MAKER
A1056: BEST PLAYERS
A1057: WILLIAMSTOWN | D1057: CAHILL | G1057: J O'BRIEN | J1057: WARD | M1057: SINCLAIR | P1057: McDONALD | S1057: HELLWIG
A1058: SANDRINGHAM | D1058: DE LUCA | G1058: R KENNA | J1058: A KENNA | M1058: ANDERSON | P1058: YOUNG | S1058: LEWIS
A1059: GOALKICKERS
A1060: WILLIAMSTOWN | D1060: J O'BRIEN 4 | G1060: McDONALD 3 | J1060: HELLWIG 2 | M1060: CAHILL | O1060: SINCLAIR | Q1060: W O'BRIEN | T1060: BASCOMBE
A1061: SANDRINGHAM | D1061: CONNOP | G1061: SMITH
A1063: BRUNSWICK | C1063: 4 | D1063: 5 | E1063: =C1063*6+D1063 -> 29 | G1063: 9 | H1063: 8 | I1063: =G1063*6+H1063 -> 62 | K1063: 13 | L1063: 11 | M1063: =K1063*6+L1063 -> 89 | O1063: 22 | P1063: 12 | Q1063: =O1063*6+P1063 -> 144 | S1063: BRUNSWICK
A1064: CAMBERWELL | C1064: 0 | D1064: 1 | E1064: =C1064*6+D1064 -> 1 | G1064: 6 | H1064: 4 | I1064: =G1064*6+H1064 -> 40 | K1064: 10 | L1064: 5 | M1064: =K1064*6+L1064 -> 65 | O1064: 12 | P1064: 5 | Q1064: =O1064*6+P1064 -> 77 | S1064: McNIECE
A1065: BEST PLAYERS
A1066: BRUNSWICK | D1066: McINERNEY | G1066: BLACKMORE | J1066: KENNETT | M1066: CROSS | P1066: FITZGERALD | S1066: PANNAM
A1067: CAMBERWELL | D1067: LAWN | G1067: PAGE | J1067: BOOTHMAN | M1067: HARRISON | P1067: ANDERSON | S1067: WOODFORD
A1068: GOALKICKERS
A1069: BRUNSWICK | D1069: McINERNEY 13 | G1069: BRAY 3 | I1069: KENNETT 2 | L1069: EUDEY | N1069: FITZGERALD | Q1069: CROSS | S1069: WRIGHT
A1070: CAMBERWELL | D1070: LAWN 4 | G1070: PAGE 4 | I1070: PETRIE 2 | K1070: COFFIN | M1070: WOODFORD
A1072: ROUND 20 | E1072: 24TH AUGUST | H1072: WEATHER | K1072: CLOUDY COLD S.WIND A.M. RAIN GROUNDS BAD | S1072: PLAYED AT | X1072: LADDER | AB1072: ROUND | AD1072: 20
D1073: 1ST QTR | H1073: 2ND QTR | L1073: 3RD QTR | P1073: FINAL | S1073: YARRAVILLE
A1074: COBURG | C1074: 2 | D1074: 0 | E1074: =C1074*6+D1074 -> 12 | G1074: 7 | H1074: 7 | I1074: =G1074*6+H1074 -> 49 | K1074: 11 | L1074: 9 | M1074: =K1074*6+L1074 -> 75 | O1074: 14 | P1074: 14 | Q1074: =O1074*6+P1074 -> 98 | S1074: UMPIRE | W1074: TEAM | X1074: W | Y1074: L | Z1074: D | AA1074: FOR | AB1074: AGST | AC1074: % | AD1074: PTS
A1075: YARRAVILLE | C1075: 3 | D1075: 3 | E1075: =C1075*6+D1075 -> 21 | G1075: 4 | H1075: 3 | I1075: =G1075*6+H1075 -> 27 | K1075: 7 | L1075: 7 | M1075: =K1075*6+L1075 -> 49 | O1075: 8 | P1075: 8 | Q1075: =O1075*6+P1075 -> 56 | S1075: STUART
A1076: BEST PLAYERS | W1076: NORTHCOTE | X1076: 15 | Y1076: 5 | Z1076: 0 | AA1076: 1954 | AB1076: 1294 | AC1076: 151.00463678516229 | AD1076: 60
A1077: COBURG | D1077: CHAPMAN | G1077: COLBERT | I1077: MEARS | L1077: GARDINER | O1077: JENKINS | Q1077: KIGHT | W1077: OAKLEIGH | X1077: 15 | Y1077: 5 | Z1077: 0 | AA1077: 1614 | AB1077: 1232 | AC1077: 131.00649350649351 | AD1077: 60
A1078: YARRAVILLE | D1078: WUNHYM | G1078: FARRELL | I1078: COULSELL | L1078: HANNAN | O1078: BOLMAN | Q1078: THOMAS | W1078: PORT MELBOURNE | X1078: 15 | Y1078: 5 | Z1078: 0 | AA1078: 1628 | AB1078: 1291 | AC1078: 126.10379550735864 | AD1078: 60
A1079: GOALKICKERS | W1079: PRESTON | X1079: 14 | Y1079: 6 | Z1079: 0 | AA1079: 1778 | AB1079: 1334 | AC1079: 133.28335832083957 | AD1079: 56
A1080: COBURG | D1080: GARDINER 4 | G1080: F PLANT 3 | J1080: MEARS 3 | M1080: COLBERT 2 | P1080: LEE 2
A1081: YARRAVILLE | D1081: SCOTT 3 | G1081: COULSELL 2 | J1081: CAMERON | M1081: THOMAS | P1081: EDWARDS | W1081: BRUNSWICK | X1081: 13 | Y1081: 6 | Z1081: 1 | AA1081: 1755 | AB1081: 1496 | AC1081: 117.31283422459893 | AD1081: 54
W1082: COBURG | X1082: 12 | Y1082: 7 | Z1082: 1 | AA1082: 1643 | AB1082: 1432 | AC1082: 114.73463687150839 | AD1082: 50
A1083: BRUNSWICK | C1083: 5 | D1083: 1 | E1083: =C1083*6+D1083 -> 31 | G1083: 11 | H1083: 6 | I1083: =G1083*6+H1083 -> 72 | K1083: 13 | L1083: 8 | M1083: =K1083*6+L1083 -> 86 | O1083: 19 | P1083: 12 | Q1083: =O1083*6+P1083 -> 126 | S1083: BRUNSWICK | W1083: YARRAVILLE | X1083: 11 | Y1083: 9 | Z1083: 0 | AA1083: 1681 | AB1083: 1476 | AC1083: 113.88888888888889 | AD1083: 44
A1084: WILLIAMSTOWN | C1084: 1 | D1084: 1 | E1084: =C1084*6+D1084 -> 7 | G1084: 6 | H1084: 1 | I1084: =G1084*6+H1084 -> 37 | K1084: 8 | L1084: 4 | M1084: =K1084*6+L1084 -> 52 | O1084: 9 | P1084: 5 | Q1084: =O1084*6+P1084 -> 59 | S1084: LESTER | W1084: WILLIAMSTOWN | X1084: 9 | Y1084: 11 | Z1084: 0 | AA1084: 1395 | AB1084: 1475 | AC1084: 94.576271186440678 | AD1084: 36
A1085: BEST PLAYERS | W1085: BRIGHTON | X1085: 7 | Y1085: 12 | Z1085: 1 | AA1085: 1536 | AB1085: 1617 | AC1085: 94.990723562152127 | AD1085: 30
A1086: BRUNSWICK | D1086: BRAY | F1086: MURPHY | I1086: EUDEY | K1086: McINERNEY | N1086: CARTON | Q1086: BLACKMORE | W1086: PRAHRAN | X1086: 4 | Y1086: 15 | Z1086: 1 | AA1086: 1416 | AB1086: 1628 | AC1086: 86.977886977886982 | AD1086: 18
A1087: WILLIAMSTOWN | D1087: J O'BRIEN | F1087: SHEEHAN | I1087: CLAPSON | K1087: McKAY | N1087: W O'BRIEN | Q1087: HELLWIG | W1087: CAMBERWELL | X1087: 2 | Y1087: 18 | Z1087: 0 | AA1087: 1344 | AB1087: 2148 | AC1087: 62.569832402234638 | AD1087: 8
A1088: GOALKICKERS | W1088: SANDRINGHAM | X1088: 1 | Y1088: 19 | Z1088: 0 | AA1088: 1208 | AB1088: 2529 | AC1088: 47.765915381573741 | AD1088: 4
A1089: BRUNSWICK | D1089: BRAY 5 | F1089: McINERNEY 5 | I1089: RALEIGH 2 | K1089: CROSS 2 | M1089: HEARN 2 | O1089: STEELE | Q1089: EUDEY | S1089: FITZGERALD
A1090: WILLIAMSTOWN | D1090: J O'BRIEN 4 | G1090: SHEEHAN 3 | J1090: HELLWIG | L1090: WARD
A1092: PRESTON | C1092: 2 | D1092: 2 | E1092: =C1092*6+D1092 -> 14 | G1092: 5 | H1092: 9 | I1092: =G1092*6+H1092 -> 39 | K1092: 6 | L1092: 13 | M1092: =K1092*6+L1092 -> 49 | O1092: 11 | P1092: 17 | Q1092: =O1092*6+P1092 -> 83 | S1092: TOORAK PARK
A1093: PRAHRAN | C1093: 5 | D1093: 6 | E1093: =C1093*6+D1093 -> 36 | G1093: 7 | H1093: 7 | I1093: =G1093*6+H1093 -> 49 | K1093: 8 | L1093: 14 | M1093: =K1093*6+L1093 -> 62 | O1093: 9 | P1093: 14 | Q1093: =O1093*6+P1093 -> 68 | S1093: PAYNE
A1094: BEST PLAYERS
A1095: PRESTON | D1095: ADAMS | G1095: SUMMERS | J1095: O'DOHERTY | M1095: REICHMAN | P1095: CAMPBELL | S1095: STOTT
A1096: PRAHRAN | D1096: LORD | G1096: NAYLOR | J1096: LUCAS | M1096: JACK SMITH | P1096: F SMITH | S1096: OSBORNE
A1097: GOALKICKERS
A1098: PRESTON | D1098: ADAMS 7 | G1098: SURTEES 2 | J1098: SUMMERS | M1098: O'DOHERTY
A1099: PRAHRAN | D1099: SMEDLEY 2 | G1099: LORD 2 | I1099: ROWE | K1099: JORDAN | M1099: BARNETT | O1099: LUCAS | Q1099: LAMPREY
A1101: OAKLEIGH | C1101: 5 | D1101: 4 | E1101: =C1101*6+D1101 -> 34 | G1101: 8 | H1101: 7 | I1101: =G1101*6+H1101 -> 55 | K1101: 12 | L1101: 10 | M1101: =K1101*6+L1101 -> 82 | O1101: 17 | P1101: 17 | Q1101: =O1101*6+P1101 -> 119 | S1101: OAKLEIGH
A1102: BRIGHTON | C1102: 0 | D1102: 4 | E1102: =C1102*6+D1102 -> 4 | G1102: 5 | H1102: 8 | I1102: =G1102*6+H1102 -> 38 | K1102: 6 | L1102: 8 | M1102: =K1102*6+L1102 -> 44 | O1102: 8 | P1102: 10 | Q1102: =O1102*6+P1102 -> 58 | S1102: McNIECE
A1103: BEST PLAYERS
A1104: OAKLEIGH | D1104: HOLFORD | G1104: THOMAS | J1104: SHELTON | M1104: MAHER | P1104: RUDOLPH | S1104: NOTT
A1105: BRIGHTON | D1105: BORLAND | G1105: HUNT | J1105: CANTWELL | M1105: WHITEOAK | P1105: DUNBAR | S1105: IRWIN
A1106: GOALKICKERS
A1107: OAKLEIGH | D1107: FRASER 5 | G1107: SHELTON 5 | J1107: SPAIN 2 | L1107: IRWIN 2 | N1107: MAHER 2 | Q1107: GRACIE
A1108: BRIGHTON | D1108: WHITEOAK 3 | G1108: LUCAS | I1108: BURNES | K1108: RENNIE | M1108: B SMITH | O1108: DUNBAR
A1110: PORT MELBOURNE | C1110: 2 | D1110: 5 | E1110: =C1110*6+D1110 -> 17 | G1110: 6 | H1110: 13 | I1110: =G1110*6+H1110 -> 49 | K1110: 12 | L1110: 17 | M1110: =K1110*6+L1110 -> 89 | O1110: 21 | P1110: 21 | Q1110: =O1110*6+P1110 -> 147 | S1110: CAMBERWELL
A1111: CAMBERWELL | C1111: 4 | D1111: 0 | E1111: =C1111*6+D1111 -> 24 | G1111: 5 | H1111: 2 | I1111: =G1111*6+H1111 -> 32 | K1111: 5 | L1111: 6 | M1111: =K1111*6+L1111 -> 36 | O1111: 6 | P1111: 7 | Q1111: =O1111*6+P1111 -> 43 | S1111: MUTCH
A1112: BEST PLAYERS
A1113: PORT MELBOURNE | D1113: KUHLKEN | G1113: BARNES | J1113: LOVETT | M1113: GARBUTT | P1113: HYDE | R1113: BEDFORD
A1114: CAMBERWELL | D1114: BOOTHMAN | G1114: PAGE | J1114: H CALWELL | M1114: LE STRANGE | P1114: CLAMP | R1114: LECKIE
A1115: GOALKICKERS
A1116: PORT MELBOURNE | D1116: KUHLKEN 5 | F1116: BARNES 5 | I1116: WILKIN 2 | K1116: BEDFORD 2 | N1116: PLUMRIDGE 2 | Q1116: SMITH 2 | S1116: BROOKS 2 | V1116: E PERRETT
A1117: CAMBERWELL | D1117: ANDERSON | G1117: COFFIN | I1117: LAWN | K1117: PAGE | M1117: WARD | O1117: BOOTHMAN
A1119: NORTHCOTE | C1119: 7 | D1119: 1 | E1119: =C1119*6+D1119 -> 43 | G1119: 14 | H1119: 3 | I1119: =G1119*6+H1119 -> 87 | K1119: 21 | L1119: 5 | M1119: =K1119*6+L1119 -> 131 | O1119: 30 | P1119: 14 | Q1119: =O1119*6+P1119 -> 194 | S1119: NORTHCOTE
A1120: SANDRINGHAM | C1120: 1 | D1120: 1 | E1120: =C1120*6+D1120 -> 7 | G1120: 2 | H1120: 2 | I1120: =G1120*6+H1120 -> 14 | K1120: 3 | L1120: 3 | M1120: =K1120*6+L1120 -> 21 | O1120: 4 | P1120: 5 | Q1120: =O1120*6+P1120 -> 29 | S1120: McKINNON
A1121: BEST PLAYERS
A1122: NORTHCOTE | D1122: CORRIGAN | G1122: SEYMOUR | J1122: NICHOLLS | M1122: COLE | P1122: PRUSER | S1122: KOOP
A1123: SANDRINGHAM | D1123: BOURKE | G1123: G REES | J1123: YOUNG | M1123: ANDERSON | P1123: CHALLIS | S1123: R KENNA
A1124: GOALKICKERS
A1125: NORTHCOTE | D1125: SEYMOUR 8 | F1125: COLE 6 | H1125: PRUSER 4 | J1125: MILNE 4 | L1125: GRAY | N1125: STOCKDALE | Q1125: BROWN | S1125: POULTER | V1125: COCKRAM | X1125: HILL | Z1125: CORRIGAN | AB1125: J WOODS
A1126: SANDRINGHAM | D1126: BOURKE 2 | G1126: DE LUCA | J1126: R KENNA
A1128: ROUND 21 | E1128: 31ST AUGUST | J1128: WEATHER | M1128: RAIN STRONG NORTH WIND | S1128: PLAYED AT | X1128: LADDER | AB1128: ROUND | AD1128: 21
D1129: 1ST QTR | H1129: 2ND QTR | L1129: 3RD QTR | P1129: FINAL | S1129: BRUNSWICK
A1130: BRUNSWICK | C1130: 6 | D1130: 4 | E1130: =C1130*6+D1130 -> 40 | G1130: 9 | H1130: 7 | I1130: =G1130*6+H1130 -> 61 | K1130: 13 | L1130: 11 | M1130: =K1130*6+L1130 -> 89 | O1130: 14 | P1130: 14 | Q1130: =O1130*6+P1130 -> 98 | S1130: UMPIRE | W1130: TEAM | X1130: W | Y1130: L | Z1130: D | AA1130: FOR | AB1130: AGST | AC1130: % | AD1130: PTS
A1131: PRAHRAN | C1131: 3 | D1131: 1 | E1131: =C1131*6+D1131 -> 19 | G1131: 5 | H1131: 4 | I1131: =G1131*6+H1131 -> 34 | K1131: 6 | L1131: 5 | M1131: =K1131*6+L1131 -> 41 | O1131: 7 | P1131: 5 | Q1131: =O1131*6+P1131 -> 47 | S1131: WILLIAMSON
A1132: BEST PLAYERS | W1132: NORTHCOTE | X1132: 16 | Y1132: 5 | Z1132: 0 | AA1132: 2005 | AB1132: 1329 | AC1132: 150.86531226486079 | AD1132: 64
A1133: BRUNSWICK | D1133: BRAY | F1133: CROSS | H1133: ALLISON | K1133: JOHNSTONE | N1133: CARTON | Q1133: FITZGERALD | W1133: PORT MELBOURNE | X1133: 16 | Y1133: 5 | Z1133: 0 | AA1133: 1764 | AB1133: 1343 | AC1133: 131.34772896500371 | AD1133: 64
A1134: PRAHRAN | D1134: BREWIS | F1134: NAYLOR | H1134: JACK SMITH | K1134: OSBORNE | N1134: LUCAS | Q1134: DONOGHUE | W1134: PRESTON | X1134: 15 | Y1134: 6 | Z1134: 0 | AA1134: 1861 | AB1134: 1385 | AC1134: 134.36823104693141 | AD1134: 60
A1135: GOALKICKERS | W1135: OAKLEIGH | X1135: 15 | Y1135: 6 | Z1135: 0 | AA1135: 1650 | AB1135: 1293 | AC1135: 127.61020881670534 | AD1135: 60
A1136: BRUNSWICK | D1136: BRAY 4 | F1136: HEARN 3 | H1136: McINERNEY 2 | K1136: ALLISON 2 | M1136: JOHNSTONE | P1136: FITZGERALD | S1136: CROSS
A1137: PRAHRAN | D1137: SMEDLEY 2 | G1137: GREENWOOD 2 | J1137: ROWE | L1137: JORDAN | N1137: NAYLOR | W1137: BRUNSWICK | X1137: 14 | Y1137: 6 | Z1137: 1 | AA1137: 1853 | AB1137: 1543 | AC1137: 120.09073233959819 | AD1137: 58
W1138: COBURG | X1138: 13 | Y1138: 7 | Z1138: 1 | AA1138: 1704 | AB1138: 1468 | AC1138: 116.07629427792915 | AD1138: 54
A1139: PRESTON | C1139: 4 | D1139: 8 | E1139: =C1139*6+D1139 -> 32 | G1139: 7 | H1139: 9 | I1139: =G1139*6+H1139 -> 51 | K1139: 10 | L1139: 14 | M1139: =K1139*6+L1139 -> 74 | O1139: 11 | P1139: 17 | Q1139: =O1139*6+P1139 -> 83 | S1139: PRESTON | W1139: YARRAVILLE | X1139: 11 | Y1139: 10 | Z1139: 0 | AA1139: 1732 | AB1139: 1559 | AC1139: 111.09685695958947 | AD1139: 44
A1140: YARRAVILLE | C1140: 0 | D1140: 0 | E1140: =C1140*6+D1140 -> 0 | G1140: 2 | H1140: 5 | I1140: =G1140*6+H1140 -> 17 | K1140: 3 | L1140: 6 | M1140: =K1140*6+L1140 -> 24 | O1140: 7 | P1140: 9 | Q1140: =O1140*6+P1140 -> 51 | S1140: SCHAEFER | W1140: WILLIAMSTOWN | X1140: 9 | Y1140: 12 | Z1140: 0 | AA1140: 1430 | AB1140: 1526 | AC1140: 93.709043250327653 | AD1140: 36
A1141: BEST PLAYERS | W1141: BRIGHTON | X1141: 8 | Y1141: 12 | Z1141: 1 | AA1141: 1667 | AB1141: 1706 | AC1141: 97.71395076201641 | AD1141: 34
A1142: PRESTON | D1142: STOTT | G1142: TAYLOR | I1142: SURTEES | L1142: McGANN | O1142: SUMMERS | Q1142: HICKEY | W1142: PRAHRAN | X1142: 4 | Y1142: 16 | Z1142: 1 | AA1142: 1463 | AB1142: 1726 | AC1142: 84.762456546929315 | AD1142: 18
A1143: YARRAVILLE | D1143: WUNHYM | G1143: LYONS | I1143: EVANS | L1143: FARRELL | O1143: CAMERON | Q1143: COULSELL | W1143: CAMBERWELL | X1143: 2 | Y1143: 19 | Z1143: 0 | AA1143: 1433 | AB1143: 2279 | AC1143: 62.878455462922332 | AD1143: 8
A1144: GOALKICKERS | W1144: SANDRINGHAM | X1144: 1 | Y1144: 20 | Z1144: 0 | AA1144: 1260 | AB1144: 2665 | AC1144: 47.27954971857411 | AD1144: 4
A1145: PRESTON | D1145: DAVIE 3 | F1145: SURTEES 2 | I1145: ADAMS 2 | K1145: TAYLOR | M1145: SHAW | O1145: CAMPBELL | Q1145: HAYES
A1146: YARRAVILLE | D1146: EVANS 3 | G1146: McCARROLL | J1146: CAMERON | L1146: SCOTT | N1146: COOPER
A1148: COBURG | C1148: 2 | D1148: 10 | E1148: =C1148*6+D1148 -> 22 | G1148: 2 | H1148: 13 | I1148: =G1148*6+H1148 -> 25 | K1148: 6 | L1148: 19 | M1148: =K1148*6+L1148 -> 55 | O1148: 7 | P1148: 19 | Q1148: =O1148*6+P1148 -> 61 | S1148: COBURG
A1149: OAKLEIGH | C1149: 1 | D1149: 0 | E1149: =C1149*6+D1149 -> 6 | G1149: 3 | H1149: 5 | I1149: =G1149*6+H1149 -> 23 | K1149: 3 | L1149: 6 | M1149: =K1149*6+L1149 -> 24 | O1149: 4 | P1149: 12 | Q1149: =O1149*6+P1149 -> 36 | S1149: MURRAY
A1150: BEST PLAYERS
A1151: COBURG | D1151: COLBERT | G1151: FORD | J1151: F PLANT | M1151: ROGERS | P1151: CLOUGH | S1151: CHAPMAN
A1152: OAKLEIGH | D1152: GUNNYON | G1152: DOLAN | J1152: E THOMAS | M1152: RUDOLPH | P1152: MAHER | S1152: GOMEZ
A1153: GOALKICKERS
A1154: COBURG | D1154: F PLANT 4 | G1154: McGRATH | J1154: VOIGHT | M1154: JENKINS
A1155: OAKLEIGH | D1155: HOLFORD 2 | G1155: FRASER | J1155: SPAIN
A1157: NORTHCOTE | C1157: 0 | D1157: 0 | E1157: =C1157*6+D1157 -> 0 | G1157: 3 | H1157: 1 | I1157: =G1157*6+H1157 -> 19 | K1157: 4 | L1157: 7 | M1157: =K1157*6+L1157 -> 31 | O1157: 7 | P1157: 9 | Q1157: =O1157*6+P1157 -> 51 | S1157: WILLIAMSTOWN
A1158: WILLIAMSTOWN | C1158: 2 | D1158: 2 | E1158: =C1158*6+D1158 -> 14 | G1158: 4 | H1158: 3 | I1158: =G1158*6+H1158 -> 27 | K1158: 5 | L1158: 3 | M1158: =K1158*6+L1158 -> 33 | O1158: 5 | P1158: 5 | Q1158: =O1158*6+P1158 -> 35 | S1158: MCKINNON
A1159: BEST PLAYERS
A1160: NORTHCOTE | D1160: STOCKDALE | G1160: WILSON | J1160: SEYMOUR | M1160: ROSS | P1160: NICHOLLS | S1160: PRUSER
A1161: WILLIAMSTOWN | D1161: HELLWIG | G1161: JOHNS | J1161: W O'BRIEN | M1161: TAAFE | P1161: CLAPSON | S1161: CAHILL
A1162: GOALKICKERS
A1163: NORTHCOTE | D1163: SEYMOUR 3 | G1163: PRUSER 2 | J1163: HEENAN | L1163: NICHOLLS
A1164: WILLIAMSTOWN | D1164: W O'BRIEN 2 | G1164: CAHILL | J1164: JOHNS | L1164: CHALMERS
A1166: BRIGHTON | C1166: 2 | D1166: 3 | E1166: =C1166*6+D1166 -> 15 | G1166: 8 | H1166: 12 | I1166: =G1166*6+H1166 -> 60 | K1166: 8 | L1166: 12 | M1166: =K1166*6+L1166 -> 60 | O1166: 19 | P1166: 17 | Q1166: =O1166*6+P1166 -> 131 | S1166: E'WICK
A1167: CAMBERWELL | C1167: 7 | D1167: 4 | E1167: =C1167*6+D1167 -> 46 | G1167: 7 | H1167: 5 | I1167: =G1167*6+H1167 -> 47 | K1167: 13 | L1167: 11 | M1167: =K1167*6+L1167 -> 89 | O1167: 13 | P1167: 11 | Q1167: =O1167*6+P1167 -> 89 | S1167: STUART
A1168: BEST PLAYERS
A1169: BRIGHTON | D1169: DAINTY | G1169: LEAPER | J1169: IRWIN | M1169: TULLOH | P1169: BORLAND | S1169: B SMITH
A1170: CAMBERWELL | D1170: PAGE | G1170: HAYES | J1170: WOODFORD | M1170: MORRISOPN | P1170: BOOTHMAN
A1171: GOALKICKERS
A1172: BRIGHTON | D1172: B SMITH 6 | F1172: WHITEOAK 3 | I1172: IRWIN 2 | K1172: DUNBAR | M1172: BURNES | O1172: RENNIE | Q1172: TULLOH | S1172: TUCKER | U1172: DORE | W1172: LEAPER | X1172: MILLER
A1173: CAMBERWELL | D1173: PAGE 3 | F1173: MORRISON 3 | I1173: MEYER 2 | K1173: WOODFORD 2 | N1173: COFFIN | P1173: HUGGARD
A1175: PORT MELBOURNE | C1175: 6 | D1175: 15 | E1175: =C1175*6+D1175 -> 51 | G1175: 8 | H1175: 18 | I1175: =G1175*6+H1175 -> 66 | K1175: 16 | L1175: 27 | M1175: =K1175*6+L1175 -> 123 | O1175: 18 | P1175: 28 | Q1175: =O1175*6+P1175 -> 136 | S1175: PORT MELBOURNE
A1176: SANDRINGHAM | C1176: 1 | D1176: 1 | E1176: =C1176*6+D1176 -> 7 | G1176: 2 | H1176: 3 | I1176: =G1176*6+H1176 -> 15 | K1176: 3 | L1176: 3 | M1176: =K1176*6+L1176 -> 21 | O1176: 8 | P1176: 4 | Q1176: =O1176*6+P1176 -> 52 | S1176: MORCOM
A1177: BEST PLAYERS
A1178: PORT MELBOURNE | D1178: BROOKER | G1178: LEGGO | I1178: PLUMRIDGE | L1178: KUHLKEN | O1178: HYDE | R1178: BEDFORD
A1179: SANDRINGHAM | D1179: BOURKE | G1179: BOYD | I1179: RYAN | L1179: ANDERSON | O1179: LEWIS | R1179: QUINN
A1180: GOALKICKERS
A1181: PORT MELBOURNE | D1181: BROOKS 5 | F1181: KUHLKEN 4 | I1181: E PERRETT 3 | L1181: BARNES 2 | N1181: BEDFORD 2 | Q1181: PLUMRIDGE | T1181: LOVETT
A1182: SANDRINGHAM | D1182: BOYD 2 | F1182: CHALLIS | I1182: DE LUCA | L1182: BOURKE | N1182: A KENNA | Q1182: SMITH | S1182: QUINN
A1184: ROUND 22 | E1184: 7TH SEPTEMBER | J1184: WEATHER | M1184: CLOUDY BUT FINE NORTH BREEZE | S1184: PLAYED AT | X1184: LADDER | AB1184: ROUND | AD1184: 22
D1185: 1ST QTR | H1185: 2ND QTR | L1185: 3RD QTR | P1185: FINAL | S1185: NORTHCOTE
A1186: NORTHCOTE | C1186: 5 | D1186: 2 | E1186: =C1186*6+D1186 -> 32 | G1186: 8 | H1186: 4 | I1186: =G1186*6+H1186 -> 52 | K1186: 11 | L1186: 9 | M1186: =K1186*6+L1186 -> 75 | O1186: 13 | P1186: 12 | Q1186: =O1186*6+P1186 -> 90 | S1186: UMPIRE | W1186: TEAM | X1186: W | Y1186: L | Z1186: D | AA1186: FOR | AB1186: AGST | AC1186: % | AD1186: PTS
A1187: OAKLEIGH | C1187: 1 | D1187: 1 | E1187: =C1187*6+D1187 -> 7 | G1187: 5 | H1187: 2 | I1187: =G1187*6+H1187 -> 32 | K1187: 6 | L1187: 5 | M1187: =K1187*6+L1187 -> 41 | O1187: 10 | P1187: 12 | Q1187: =O1187*6+P1187 -> 72 | S1187: MURRAY
A1188: BEST PLAYERS | W1188: NORTHCOTE | X1188: 17 | Y1188: 5 | Z1188: 0 | AA1188: 2095 | AB1188: 1401 | AC1188: 149.53604568165596 | AD1188: 68
A1189: NORTHCOTE | D1189: PRUSER | F1189: NICHOLLS | I1189: ROWE | K1189: WILSON | N1189: J WOODS | Q1189: STOCKDALE | W1189: PORT MELBOURNE | X1189: 17 | Y1189: 5 | Z1189: 0 | AA1189: 1864 | AB1189: 1392 | AC1189: 133.90804597701148 | AD1189: 68
A1190: OAKLEIGH | D1190: RUDOLPH | F1190: MAHER | I1190: MORRIS | K1190: GUNNYON | N1190: FRASER | Q1190: THOMAS | W1190: PRESTON | X1190: 16 | Y1190: 6 | Z1190: 0 | AA1190: 1993 | AB1190: 1461 | AC1190: 136.41341546885695 | AD1190: 64
A1191: GOALKICKERS | W1191: BRUNSWICK | X1191: 15 | Y1191: 6 | Z1191: 1 | AA1191: 1931 | AB1191: 1615 | AC1191: 119.56656346749226 | AD1191: 62
A1192: NORTHCOTE | D1192: PRUSER 4 | F1192: COLE 2 | H1192: SEYMOUR 2 | K1192: GRAY 2 | M1192: MILNE | O1192: STOCKDALE | R1192: ROWE
A1193: OAKLEIGH | D1193: FRASER 5 | G1193: IRWIN 2 | I1193: FLEMING | K1193: SPAIN | M1193: W BROWNE | W1193: OAKLEIGH | X1193: 15 | Y1193: 7 | Z1193: 0 | AA1193: 1722 | AB1193: 1383 | AC1193: 124.5119305856833 | AD1193: 60
W1194: COBURG | X1194: 14 | Y1194: 7 | Z1194: 1 | AA1194: 1809 | AB1194: 1523 | AC1194: 118.77872619829284 | AD1194: 58
A1195: BRUNSWICK | C1195: 2 | D1195: 6 | E1195: =C1195*6+D1195 -> 18 | G1195: 6 | H1195: 7 | I1195: =G1195*6+H1195 -> 43 | K1195: 9 | L1195: 10 | M1195: =K1195*6+L1195 -> 64 | O1195: 11 | P1195: 12 | Q1195: =O1195*6+P1195 -> 78 | S1195: YARRAVILLE | W1195: YARRAVILLE | X1195: 11 | Y1195: 11 | Z1195: 0 | AA1195: 1804 | AB1195: 1637 | AC1195: 110.20158827122786 | AD1195: 44
A1196: YARRAVILLE | C1196: 1 | D1196: 1 | E1196: =C1196*6+D1196 -> 7 | G1196: 8 | H1196: 4 | I1196: =G1196*6+H1196 -> 52 | K1196: 8 | L1196: 7 | M1196: =K1196*6+L1196 -> 55 | O1196: 10 | P1196: 12 | Q1196: =O1196*6+P1196 -> 72 | S1196: McKINNON | W1196: WILLIAMSTOWN | X1196: 9 | Y1196: 13 | Z1196: 0 | AA1196: 1472 | AB1196: 1606 | AC1196: 91.656288916562886 | AD1196: 36
A1197: BEST PLAYERS | W1197: BRIGHTON | X1197: 8 | Y1197: 13 | Z1197: 1 | AA1197: 1716 | AB1197: 1806 | AC1197: 95.016611295681059 | AD1197: 34
A1198: BRUNSWICK | D1198: CARTON | G1198: PANNAM | I1198: BRAY | K1198: WHITELEY | N1198: MURPHY | Q1198: EUDEY | W1198: PRAHRAN | X1198: 5 | Y1198: 16 | Z1198: 1 | AA1198: 1543 | AB1198: 1768 | AC1198: 87.273755656108591 | AD1198: 22
A1199: YARRAVILLE | D1199: COULSELL | G1199: EVANS | I1199: KENNEDY | K1199: BOLMAN | N1199: FARRELL | Q1199: BROWN | W1199: CAMBERWELL | X1199: 2 | Y1199: 20 | Z1199: 0 | AA1199: 1488 | AB1199: 2384 | AC1199: 62.416107382550337 | AD1199: 8
A1200: GOALKICKERS | W1200: SANDRINGHAM | X1200: 1 | Y1200: 21 | Z1200: 0 | AA1200: 1336 | AB1200: 2797 | AC1200: 47.765462996067214 | AD1200: 4
A1201: BRUNSWICK | D1201: BRAY 4 | F1201: HEARN 2 | H1201: BARRIE 2 | J1201: FITZGERALD | M1201: PANNAM | O1201: ALLISON
A1202: YARRAVILLE | D1202: KENNEDY 3 | G1202: SCOTT 2 | I1202: JOYCE | K1202: ROBERTS | M1202: COULSELL | O1202: LYONS | Q1202: EVANS
A1204: PRAHRAN | C1204: 3 | D1204: 9 | E1204: =C1204*6+D1204 -> 27 | G1204: 4 | H1204: 13 | I1204: =G1204*6+H1204 -> 37 | K1204: 7 | L1204: 20 | M1204: =K1204*6+L1204 -> 62 | O1204: 10 | P1204: 20 | Q1204: =O1204*6+P1204 -> 80 | S1204: TOORAK PARK
A1205: WILLIAMSTOWN | C1205: 0 | D1205: 1 | E1205: =C1205*6+D1205 -> 1 | G1205: 1 | H1205: 8 | I1205: =G1205*6+H1205 -> 14 | K1205: 1 | L1205: 11 | M1205: =K1205*6+L1205 -> 17 | O1205: 4 | P1205: 18 | Q1205: =O1205*6+P1205 -> 42 | S1205: MAKER
A1206: BEST PLAYERS
A1207: PRAHRAN | D1207: JORDAN | G1207: GREENWOOD | J1207: F SMITH | M1207: NAYLOR | P1207: ANDERSON | S1207: OSBORNE
A1208: WILLIAMSTOWN | D1208: SYKES | G1208: McKAY | J1208: J O'BRIEN | M1208: W O'BRIEN | P1208: WATERMAN | S1208: CLAPSON
A1209: GOALKICKERS
A1210: PRAHRAN | D1210: SMEDLEY 3 | G1210: ROWE 2 | I1210: GREENWOOD 2 | L1210: BARNETT | N1210: ANDERSON | Q1210: LORD
A1211: WILLIAMSTOWN | D1211: J O'BRIEN 3 | H1211: W O'BRIEN
A1213: COBURG | C1213: 5 | D1213: 5 | E1213: =C1213*6+D1213 -> 35 | G1213: 8 | H1213: 9 | I1213: =G1213*6+H1213 -> 57 | K1213: 14 | L1213: 14 | M1213: =K1213*6+L1213 -> 98 | O1213: 15 | P1213: 15 | Q1213: =O1213*6+P1213 -> 105 | S1213: CAMBERWELL
A1214: CAMBERWELL | C1214: 1 | D1214: 5 | E1214: =C1214*6+D1214 -> 11 | G1214: 3 | H1214: 10 | I1214: =G1214*6+H1214 -> 28 | K1214: 4 | L1214: 11 | M1214: =K1214*6+L1214 -> 35 | O1214: 7 | P1214: 13 | Q1214: =O1214*6+P1214 -> 55 | S1214: STUART
A1215: BEST PLAYERS
A1216: COBURG | D1216: COLBERT | G1216: CHAPMAN | J1216: CORNELL | M1216: F PLANT | P1216: GARDINER | S1216: CHARLESTON
A1217: CAMBERWELL | D1217: PETRIE | G1217: WOOLFE | J1217: H CALWELL | M1217: BENNETT | P1217: PAGE | S1217: BOOTHMAN
A1218: GOALKICKERS
A1219: COBURG | D1219: F PLANT 5 | G1219: COLBERT 3 | J1219: MEARS 3 | M1219: DONNELLY 2 | P1219: VOIGHT | R1219: GARDINER
A1220: CAMBERWELL | D1220: LAWN 3 | G1220: PETRIE 2 | J1220: PAGE | L1220: HUGGARD
A1222: PORT MELBOURNE | C1222: 3 | D1222: 4 | E1222: =C1222*6+D1222 -> 22 | G1222: 5 | H1222: 11 | I1222: =G1222*6+H1222 -> 41 | K1222: 7 | L1222: 12 | M1222: =K1222*6+L1222 -> 54 | O1222: 13 | P1222: 22 | Q1222: =O1222*6+P1222 -> 100 | S1222: ELSTERNWICK PARK
A1223: BRIGHTON | C1223: 3 | D1223: 2 | E1223: =C1223*6+D1223 -> 20 | G1223: 4 | H1223: 4 | I1223: =G1223*6+H1223 -> 28 | K1223: 5 | L1223: 11 | M1223: =K1223*6+L1223 -> 41 | O1223: 6 | P1223: 13 | Q1223: =O1223*6+P1223 -> 49 | S1223: MUTCH
A1224: BEST PLAYERS
A1225: PORT MELBOURNE | D1225: KUHLKEN | G1225: CROMPTON | J1225: GARBUTT | M1225: SMITH | O1225: PLUMRIDGE | R1225: WILKIN
A1226: BRIGHTON | D1226: BORLAND | G1226: TULLOH | J1226: ELLIOTT | M1226: TUCKER | O1226: HUNT | R1226: STEWART
A1227: GOALKICKERS
A1228: PORT MELBOURNE | D1228: KUHLKEN 5 | G1228: TYSON 2 | I1228: McINNES | K1228: BARNES | M1228: WILKIN | O1228: PLUMRIDGE | R1228: SMITH | T1228: E PERRETT
A1229: BRIGHTON | D1229: RENNIE 2 | G1229: BURNES 2 | J1229: B SMITH | M1229: HARRISON
A1231: PRESTON | C1231: 5 | D1231: 1 | E1231: =C1231*6+D1231 -> 31 | G1231: 9 | H1231: 8 | I1231: =G1231*6+H1231 -> 62 | K1231: 12 | L1231: 12 | M1231: =K1231*6+L1231 -> 84 | O1231: 19 | P1231: 18 | Q1231: =O1231*6+P1231 -> 132 | S1231: BEACH ROAD
A1232: SANDRINGHAM | C1232: 5 | D1232: 3 | E1232: =C1232*6+D1232 -> 33 | G1232: 7 | H1232: 3 | I1232: =G1232*6+H1232 -> 45 | K1232: 9 | L1232: 8 | M1232: =K1232*6+L1232 -> 62 | O1232: 11 | P1232: 10 | Q1232: =O1232*6+P1232 -> 76 | S1232: LESTER
A1233: BEST PLAYERS
A1234: PRESTON | D1234: STOTT | G1234: DAVIE | I1234: MONOHAN | L1234: SURTEES | O1234: TAYLOR | Q1234: SUMMERS
A1235: SANDRINGHAM | D1235: BOURKE | G1235: HARRIS | I1235: R KENNA | L1235: BOYD | O1235: DE LUCA | Q1235: A KENNA
A1236: GOALKICKERS
A1237: PRESTON | D1237: DAVIE 7 | F1237: ADAMS 4 | I1237: SURTEES 2 | L1237: HAYES 2 | N1237: CAMPBELL | Q1237: MONOHAN | T1237: TAYLOR | W1237: STOTT
A1238: SANDRINGHAM | D1238: BOYD 4 | G1238: DE LUCA 2 | J1238: BOURKE 2 | M1238: A KENNA 2 | P1238: JA RYAN
A1240: FINALS
A1241: 1ST SEMI | E1241: 14TH SEPTEMBER | J1241: WEATHER | M1241: FINE
D1242: 1ST QTR | H1242: 2ND QTR | L1242: 3RD QTR | P1242: FINAL
A1243: PORT MELBOURNE | C1243: 3 | D1243: 3 | E1243: =C1243*6+D1243 -> 21 | G1243: 7 | H1243: 10 | I1243: =G1243*6+H1243 -> 52 | K1243: 8 | L1243: 11 | M1243: =K1243*6+L1243 -> 59 | O1243: 10 | P1243: 15 | Q1243: 75 | S1243: COBURG
A1244: BRUNSWICK | C1244: 4 | D1244: 4 | E1244: =C1244*6+D1244 -> 28 | G1244: 6 | H1244: 6 | I1244: =G1244*6+H1244 -> 42 | K1244: 7 | L1244: 10 | M1244: =K1244*6+L1244 -> 52 | O1244: 9 | P1244: 14 | Q1244: 68 | S1244: McKINNON
A1245: BEST PLAYERS
A1246: PORT MELBOURNE | D1246: GARBUTT | G1246: HYDE | I1246: PETERSON | L1246: BROOKER | O1246: SMITH | Q1246: BROOKS
A1247: BRUNSWICK | D1247: PANNAM | G1247: BRAY | I1247: McINERNEY | L1247: FITZGERALD | O1247: CROSS | Q1247: CARTON
A1248: GOALKICKERS
A1249: PORT MELBOURNE | D1249: PETERSON 3 | G1249: KUHLKEN 2 | J1249: BEDFORD 2 | M1249: PLUMRIDGE | P1249: BARNES | R1249: CARPENTER
A1250: BRUNSWICK | D1250: McINERNEY 4 | G1250: WHITELEY 3 | J1250: BRAY | L1250: FITZGERALD
A1252: 2ND SEMI | E1252: 21ST SEPTEMBER | J1252: WEATHER | M1252: CLOUDY DULL N.W.BREEZE CHANGE WITH DUST & RAIN 2ND QTR W WIND
A1253: NORTHCOTE | C1253: 3 | D1253: 5 | E1253: =C1253*6+D1253 -> 23 | G1253: 4 | H1253: 6 | I1253: =G1253*6+H1253 -> 30 | K1253: 7 | L1253: 9 | M1253: =K1253*6+L1253 -> 51 | O1253: 9 | P1253: 10 | Q1253: 64 | S1253: BRUNSWICK
A1254: PRESTON | C1254: 3 | D1254: 2 | E1254: =C1254*6+D1254 -> 20 | G1254: 5 | H1254: 6 | I1254: =G1254*6+H1254 -> 36 | K1254: 6 | L1254: 8 | M1254: =K1254*6+L1254 -> 44 | O1254: 7 | P1254: 8 | Q1254: 50 | S1254: McKINNON
A1255: BEST PLAYERS
A1256: NORTHCOTE | D1256: NICHOLLS | G1256: ROWE | J1256: COCKRAM | M1256: WOODS | P1256: SEYMOUR | S1256: ROSS
A1257: PRESTON | D1257: McGANN | G1257: SUMMERS | J1257: TAYLOR | M1257: DAVIE | P1257: REICHMAN | S1257: CAMPBELL
A1258: GOALKICKERS
A1259: NORTHCOTE | D1259: SEYMOUR 5 | G1259: COLE | I1259: PRUSER | K1259: MILNE | M1259: ROSS
A1260: PRESTON | D1260: ADAMS 2 | G1260: DAVIE 2 | I1260: SUMMERS | K1260: MONOHAN | M1260: O'DOHERTY
A1262: FINAL | E1262: 28TH SEPTEMBER | J1262: WEATHER | M1262: CLOUDY N.W.BREEZE
A1263: NORTHCOTE | C1263: 3 | D1263: 6 | E1263: =C1263*6+D1263 -> 24 | G1263: 3 | H1263: 11 | I1263: =G1263*6+H1263 -> 29 | K1263: 7 | L1263: 14 | M1263: =K1263*6+L1263 -> 56 | O1263: 9 | P1263: 17 | Q1263: 71 | S1263: COBURG
A1264: PORT MELBOURNE | C1264: 2 | D1264: 0 | E1264: =C1264*6+D1264 -> 12 | G1264: 2 | H1264: 4 | I1264: =G1264*6+H1264 -> 16 | K1264: 7 | L1264: 7 | M1264: =K1264*6+L1264 -> 49 | O1264: 10 | P1264: 11 | Q1264: 71 | S1264: McKINNON
A1265: BEST PLAYERS
A1266: NORTHCOTE | D1266: ROWE | G1266: WILSON | I1266: COCKRAM | L1266: STOCKDALE | O1266: SEYMOUR | R1266: WOODS
A1267: PORT MELBOURNE | D1267: GARBUTT | G1267: WILKIN | I1267: PLUMRIDGE | L1267: E PERRETT | O1267: KUHLKEN | R1267: CROMPTON
A1268: GOALKICKERS
A1269: NORTHCOTE | D1269: SEYMOUR 3 | G1269: PRUSER 3 | J1269: COLE 2 | M1269: STOCKDALE
A1270: PORT MELBOURNE | D1270: KUHLKEN 4 | G1270: PETERSON 2 | J1270: McINNES 2 | M1270: E PERRETT | P1270: BTOOKS
A1272: FINAL REPLAY | E1272: 5TH OCTOBER | J1272: WEATHER | M1272: FINE NORTH WIND
A1273: PORT MELBOURNE | C1273: 2 | D1273: 2 | E1273: =C1273*6+D1273 -> 14 | G1273: 3 | H1273: 3 | I1273: =G1273*6+H1273 -> 21 | K1273: 4 | L1273: 6 | M1273: =K1273*6+L1273 -> 30 | O1273: 8 | P1273: 7 | Q1273: 55 | S1273: M.C.G.
A1274: NORTHCOTE | C1274: 2 | D1274: 1 | E1274: =C1274*6+D1274 -> 13 | G1274: 3 | H1274: 9 | I1274: =G1274*6+H1274 -> 27 | K1274: 6 | L1274: 12 | M1274: =K1274*6+L1274 -> 48 | O1274: 6 | P1274: 15 | Q1274: 51 | S1274: McKINNON
A1275: BEST PLAYERS
A1276: PORT MELBOURNE | D1276: GARBUTT | G1276: LEGGO | I1276: PLUMRIDGE | L1276: BROOKER | O1276: CROMPTON | R1276: LOVETT
A1277: NORTHCOTE | D1277: WILSON | G1277: WOODS | I1277: COCKRAM | L1277: ROWE | O1277: STOCKDALE | R1277: PRUSER
A1278: GOALKICKERS
A1279: PORT MELBOURNE | D1279: PLUMRIDGE 3 | G1279: McINNES 2 | J1279: KUHLKEN | M1279: WILKIN | O1279: PETERSON
A1280: NORTHCOTE | D1280: COLE 2 | G1280: MILNE | I1280: GRAY | K1280: ROWE | M1280: BRIDE
A1282: GRAND FINAL
A1283: NORTHCOTE | C1283: 3 | D1283: 3 | E1283: 21 | G1283: 10 | H1283: 10 | I1283: 70 | K1283: 12 | L1283: 13 | M1283: 85 | O1283: 15 | P1283: 21 | Q1283: 111 | S1283: M.C.G.
A1284: PORT MELBOURNE | C1284: 2 | D1284: 5 | E1284: 17 | G1284: 5 | H1284: 5 | I1284: 35 | K1284: 8 | L1284: 9 | M1284: 57 | O1284: 10 | P1284: 9 | Q1284: 69 | S1284: McKINNON
A1285: BEST PLAYERS
A1286: NORTHCOTE | D1286: ROWE | G1286: NICHOLLS | J1286: STOCKDALE | M1286: WILSON | P1286: MILNE | S1286: WOODS
A1287: PORT MELBOURNE | D1287: E PERRETT | G1287: SMITH | J1287: GARBUTT | M1287: CARPENTER | P1287: SKILTON | S1287: BROOKER
A1288: GOALKICKERS
A1289: NORTHCOTE | D1289: PRUSER 4 | G1289: SEYMOUR 3 | J1289: GRAY 2 | L1289: COLE 2 | N1289: ROWE | P1289: MILNE | R1289: HEENAN | U1289: KOOP
A1290: PORT MELBOURNE | D1290: KUHLKEN 4 | G1290: PLUMRIDGE 2 | J1290: HYDE | L1290: SKILTON | N1290: E PERRETT | Q1290: CARPENTER
A1292: TEAMS
G1293: NORTHCOTE
A1294: BACKS | C1294: WILSON | G1294: COCKRAM | K1294: BROWN
A1295: H-BACKS | C1295: STOCKDALE | G1295: KOOP | K1295: WOODS
A1296: CENTRES | C1296: TOWERS | G1296: ROSS | K1296: NICHOLLS
A1297: H-FORWARDS | C1297: GRAY | G1297: POULTER | K1297: COLE
A1298: FORWARDS | C1298: PRUSER | G1298: SEYMOUR | K1298: HEENAN
A1299: RUCKS | C1299: ROWE | G1299: MILNE | K1299: BRIDE