A1: Victorian Football Association
A2: Season 1930
A3: © Copyright Wal Williams | F3: First created: 2 November 2014
A4: Contact: joywalwi at gmail dot com | F4: Last updated: 27 January 2018 | W4: VFA Results and tables - Link to the main index page
A5: You are free to copy this document in whole or part provided that proper acknowledgement is given to the author. All rights reserved.
A7: YEAR 1930
A8: ROUND 1 | E8: 26TH APRIL | J8: WEATHER | M8: FINE S.W. WIND | S8: PLAYED AT | X8: LADDER | AB8: ROUND | AD8: 1
D9: 1ST QTR | H9: 2ND QTR | L9: 3RD QTR | P9: FINAL | S9: BRUNSWICK
A10: COBURG | C10: 2 | D10: 2 | E10: =C10*6+D10 -> 14 | G10: 6 | H10: 5 | I10: =G10*6+H10 -> 41 | K10: 8 | L10: 6 | M10: =K10*6+L10 -> 54 | O10: 16 | P10: 9 | Q10: =O10*6+P10 -> 105 | S10: UMPIRE | W10: TEAM | X10: W | Y10: L | Z10: D | AA10: FOR | AB10: AGST | AC10: % | AD10: PTS
A11: BRUNSWICK | C11: 2 | D11: 2 | E11: =C11*6+D11 -> 14 | G11: 5 | H11: 3 | I11: =G11*6+H11 -> 33 | K11: 7 | L11: 5 | M11: =K11*6+L11 -> 47 | O11: 8 | P11: 7 | Q11: =O11*6+P11 -> 55 | S11: McKINNON
A12: BEST PLAYERS | W12: OAKLEIGH | X12: 1 | Y12: 0 | Z12: 0 | AA12: 111 | AB12: 35 | AC12: 317.14285714285717 | AD12: 4
A13: COBURG | C13: CHARLESTON | F13: COLBERT | I13: F PLANT | L13: KIGHT | N13: TREVASKIS | Q13: JENKINS | W13: BRIGHTON | X13: 1 | Y13: 0 | Z13: 0 | AA13: 131 | AB13: 43 | AC13: 304.6511627906977 | AD13: 4
A14: BRUNSWICK | C14: KENNETT | F14: BRIGHT | I14: EUDEY | L14: JACOBSEN | N14: MURPHY | Q14: PROUDFOOT | W14: PORT MELBOURNE | X14: 1 | Y14: 0 | Z14: 0 | AA14: 87 | AB14: 45 | AC14: 193.33333333333334 | AD14: 4
A15: GOALKICKERS | W15: COBURG | X15: 1 | Y15: 0 | Z15: 0 | AA15: 105 | AB15: 55 | AC15: 190.90909090909091 | AD15: 4
A16: COBURG | C16: F PLANT 9 | F16: MEARS 5 | I16: VOIGHT | K16: HARRIS
A17: BRUNSWICK | C17: McINERNEY 3 | F17: McNEIL | H17: JACOBSON | J17: PENMAN | L17: WILLIAMS | N17: FITZGERALD | W17: YARRAVILLE | X17: 1 | Y17: 0 | Z17: 0 | AA17: 75 | AB17: 67 | AC17: 111.94029850746269 | AD17: 4
W18: PRESTON | X18: 1 | Y18: 0 | Z18: 0 | AA18: 65 | AB18: 61 | AC18: 106.55737704918033 | AD18: 4
A19: PRESTON | C19: 4 | D19: 4 | E19: =C19*6+D19 -> 28 | G19: 4 | H19: 6 | I19: =G19*6+H19 -> 30 | K19: 7 | L19: 14 | M19: =K19*6+L19 -> 56 | O19: 8 | P19: 17 | Q19: =O19*6+P19 -> 65 | S19: PRESTON | W19: NORTHCOTE | X19: 0 | Y19: 1 | Z19: 0 | AA19: 61 | AB19: 65 | AC19: 93.84615384615384 | AD19: 0
A20: NORTHCOTE | C20: 1 | D20: 1 | E20: =C20*6+D20 -> 7 | G20: 3 | H20: 8 | I20: =G20*6+H20 -> 26 | K20: 4 | L20: 9 | M20: =K20*6+L20 -> 33 | O20: 8 | P20: 13 | Q20: =O20*6+P20 -> 61 | S20: STUART | W20: WILLIAMSTOWN | X20: 0 | Y20: 1 | Z20: 0 | AA20: 67 | AB20: 75 | AC20: 89.333333333333329 | AD20: 0
A21: BEST PLAYERS | W21: BRUNSWICK | X21: 0 | Y21: 1 | Z21: 0 | AA21: 55 | AB21: 105 | AC21: 52.38095238095238 | AD21: 0
A22: PRESTON | C22: PETCHALL | F22: GALL | I22: TAYLOR | L22: GROGAN | N22: REICHMAN | Q22: MILLER | W22: PRAHRAN | X22: 0 | Y22: 1 | Z22: 0 | AA22: 45 | AB22: 87 | AC22: 51.724137931034484 | AD22: 0
A23: NORTHCOTE | C23: COCKRAM | F23: ROWE | I23: WILSON | L23: ROSS | N23: PERKINS | Q23: POULTER | W23: SANDRINGHAM | X23: 0 | Y23: 1 | Z23: 0 | AA23: 43 | AB23: 131 | AC23: 32.824427480916029 | AD23: 0
A24: GOALKICKERS | W24: CAMBERWELL | X24: 0 | Y24: 1 | Z24: 0 | AA24: 35 | AB24: 111 | AC24: 31.531531531531531 | AD24: 0
A25: PRESTON | C25: DAVIE 3 | E25: SURTEES 2 | H25: PETCHELL | J25: GALL | M25: W GRAY
A26: NORTHCOTE | C26: ROSS 2 | E26: GRAY 2 | G26: POULTER | I26: SEYMOUR | L26: ROWE | N26: HAW
A28: PORT MELBOURNE | C28: 1 | D28: 0 | E28: =C28*6+D28 -> 6 | G28: 7 | H28: 5 | I28: =G28*6+H28 -> 47 | K28: 10 | L28: 6 | M28: =K28*6+L28 -> 66 | O28: 16 | P28: 15 | Q28: =O28*6+P28 -> 111 | S28: CAMBERWELL
A29: CAMBERWELL | C29: 0 | D29: 8 | E29: =C29*6+D29 -> 8 | G29: 1 | H29: 10 | I29: =G29*6+H29 -> 16 | K29: 1 | L29: 14 | M29: =K29*6+L29 -> 20 | O29: 3 | P29: 17 | Q29: =O29*6+P29 -> 35 | S29: LESTER
A30: BEST PLAYERS
A31: OAKLEIGH | C31: BEASLEY | F31: RUDOLPH | I31: O'BRIEN | L31: SHELTON | O31: FLEMING | Q31: MAHER
A32: CAMBERWELL | C32: HUNTER | F32: WALLIS | I32: LAWN | L32: BOOTHMAN | O32: TICKLE | Q32: JACKSON
A33: GOALKICKERS
A34: OAKLEIGH | C34: SHELTON 5 | F34: SPAIN 3 | I34: MAHER 3 | K34: FRASER 2 | M34: FLEMING | O34: GODING | Q34: GOMEZ
A35: CAMBERWELL | C35: WATERS 2 | G35: LAWN
A37: BRIGHTON | C37: 4 | D37: 0 | E37: =C37*6+D37 -> 24 | G37: 13 | H37: 9 | I37: =G37*6+H37 -> 87 | K37: 13 | L37: 9 | M37: =K37*6+L37 -> 87 | O37: 19 | P37: 17 | Q37: =O37*6+P37 -> 131 | S37: ELSTERNWICK PARK
A38: SANDRINGHAM | C38: 1 | D38: 6 | E38: =C38*6+D38 -> 12 | G38: 1 | H38: 6 | I38: =G38*6+H38 -> 12 | K38: 4 | L38: 12 | M38: =K38*6+L38 -> 36 | O38: 5 | P38: 13 | Q38: =O38*6+P38 -> 43 | S38: WILLIAMSON
A39: BEST PLAYERS
A40: BRIGHTON | C40: LILBURNE | F40: DORE | I40: LEAPER | L40: GALLAGHER | O40: TUCKER | R40: BESWICK
A41: SANDRINGHAM | C41: DE LUCA | F41: DICK | I41: R KENNA | L41: BAZIN | O41: HARRIS | R41: ESPOSITO
A42: GOALKICKERS
A43: BRIGHTON | C43: MATTHEWS 9 | F43: HUNT 3 | H43: TUCKER 3 | J43: LILBURNE 2 | M43: HAYHOW | O43: BURNES
A44: SANDRINGHAM | C44: DICK 3 | F44: BOYD | H44: A KENNA
A46: PORT MELBOURNE | C46: 1 | D46: 3 | E46: =C46*6+D46 -> 9 | G46: 4 | H46: 6 | I46: =G46*6+H46 -> 30 | K46: 6 | L46: 12 | M46: =K46*6+L46 -> 48 | O46: 12 | P46: 15 | Q46: =O46*6+P46 -> 87 | S46: PORT MELBOURNE
A47: PRAHRAN | C47: 1 | D47: 2 | E47: =C47*6+D47 -> 8 | G47: 3 | H47: 4 | I47: =G47*6+H47 -> 22 | K47: 6 | L47: 8 | M47: =K47*6+L47 -> 44 | O47: 6 | P47: 9 | Q47: =O47*6+P47 -> 45 | S47: FROOD
A48: BEST PLAYERS
A49: PORT MELBOURNE | C49: HYDE | F49: GARBUTT | I49: McINNES | L49: STANBRIDGE | O49: FISHER | R49: PERRETT
A50: PRAHRAN | C50: F SMITH | F50: JORDAN | I50: LORD | L50: FLOWERS | O50: BANKS | R50: DONOGHUE
A51: GOALKICKERS
A52: PORT MELBOURNE | C52: MCINNES 5 | F52: BEDFORD 2 | I52: PLUMRIDGE 2 | L52: BROOKER | N52: BARNES | P52: PERRETT
A53: PRAHRAN | C53: LUCAS 3 | F53: BUTCHER | I53: ANDERSON | L53: R BANKS
A55: YARRAVILLE | C55: 3 | D55: 0 | E55: =C55*6+D55 -> 18 | G55: 6 | H55: 3 | I55: =G55*6+H55 -> 39 | K55: 6 | L55: 6 | M55: =K55*6+L55 -> 42 | O55: 11 | P55: 9 | Q55: =O55*6+P55 -> 75 | S55: WILLIAMSTOWN
A56: WILLIAMSTOWN | C56: 4 | D56: 4 | E56: =C56*6+D56 -> 28 | G56: 5 | H56: 6 | I56: =G56*6+H56 -> 36 | K56: 7 | L56: 11 | M56: =K56*6+L56 -> 53 | O56: 9 | P56: 13 | Q56: =O56*6+P56 -> 67 | S56: COLEMAN
A57: BEST PLAYERS
A58: YARRAVILLE | C58: PLUNKLETT | F58: TYSON | I58: KENNEDY | L58: JOYCE | O58: THOMAS | R58: COULSELL
A59: WILLIAMSTOWN | C59: O'BRIEN | F59: BOURKE | I59: SINCLAIR | L59: DORGAN | O59: HELLWIG | R59: FLYNN
A60: GOALKICKERS
A61: YARRAVILLE | C61: PLUNKETT 3 | F61: SCOTT 3 | I61: TYSON 3 | K61: FITZMAURICE | O61: KENNEDY
A62: WILLIAMSTOWN | C62: BOURKE 4 | F62: J O'BRIEN 2 | I62: WATERMAN | L62: SINCLAIR | O62: McDONALD
A64: ROUND 2 | E64: 3RD MAY | J64: WEATHER | M64: FINE N.W. WIND | S64: PLAYED AT | X64: LADDER | AB64: ROUND | AD64: 2
D65: 1ST QTR | H65: 2ND QTR | L65: 3RD QTR | P65: FINAL | S65: YARRAVILLE
A66: PORT MELBOURNE | C66: 4 | D66: 2 | E66: =C66*6+D66 -> 26 | G66: 5 | H66: 4 | I66: =G66*6+H66 -> 34 | K66: 9 | L66: 7 | M66: =K66*6+L66 -> 61 | O66: 11 | P66: 7 | Q66: =O66*6+P66 -> 73 | S66: UMPIRE | W66: TEAM | X66: W | Y66: L | Z66: D | AA66: FOR | AB66: AGST | AC66: % | AD66: PTS
A67: YARRAVILLE | C67: 1 | D67: 3 | E67: =C67*6+D67 -> 9 | G67: 5 | H67: 7 | I67: =G67*6+H67 -> 37 | K67: 5 | L67: 8 | M67: =K67*6+L67 -> 38 | O67: 9 | P67: 17 | Q67: =O67*6+P67 -> 71 | S67: McLOUGHLIN
A68: BEST PLAYERS | W68: OAKLEIGH | X68: 2 | Y68: 0 | Z68: 0 | AA68: 188 | AB68: 90 | AC68: 208.88888888888889 | AD68: 8
A69: PORT MELBOURNE | C69: LEGGO | E69: HYDE | H69: GARBUTT | K69: PLUMRIDGE | N69: FISHER | Q69: STANBRIDGE | W69: PORT MELBOURNE | X69: 2 | Y69: 0 | Z69: 0 | AA69: 160 | AB69: 116 | AC69: 137.93103448275863 | AD69: 8
A70: YARRAVILLE | C70: HUNTER | E70: WUNHYM | H70: FITZMAURICE | K70: DRISCOLL | N70: DWYER | Q70: TYSON | W70: COBURG | X70: 1 | Y70: 0 | Z70: 1 | AA70: 185 | AB70: 135 | AC70: 137.03703703703704 | AD70: 6
A71: GOALKICKERS | W71: PRESTON | X71: 1 | Y71: 0 | Z71: 1 | AA71: 145 | AB71: 141 | AC71: 102.83687943262412 | AD71: 6
A72: PORT MELBOURNE | C72: TYSON 4 | E72: BEDFORD 2 | H72: McINNES | J72: PLUMRIDGE | M72: BROOKER | P72: STANBRIDGE | S72: FISHER
A73: YARRAVILLE | C73: PLUNKETT 3 | F73: LOVETT 2 | I73: ROBERTSON 2 | L73: DRISCOLL | O73: CAMERON | W73: BRIGHTON | X73: 1 | Y73: 1 | Z73: 0 | AA73: 220 | AB73: 161 | AC73: 136.64596273291926 | AD73: 4
W74: NORTHCOTE | X74: 1 | Y74: 1 | Z74: 0 | AA74: 179 | AB74: 154 | AC74: 116.23376623376623 | AD74: 4
A75: COBURG | C75: 2 | D75: 5 | E75: =C75*6+D75 -> 17 | G75: 4 | H75: 6 | I75: =G75*6+H75 -> 30 | K75: 10 | L75: 10 | M75: =K75*6+L75 -> 70 | O75: 11 | P75: 14 | Q75: =O75*6+P75 -> 80 | S75: COBURG | W75: YARRAVILLE | X75: 1 | Y75: 1 | Z75: 0 | AA75: 146 | AB75: 140 | AC75: 104.28571428571429 | AD75: 4
A76: PRESTON | C76: 2 | D76: 4 | E76: =C76*6+D76 -> 16 | G76: 6 | H76: 9 | I76: =G76*6+H76 -> 45 | K76: 6 | L76: 13 | M76: =K76*6+L76 -> 49 | O76: 10 | P76: 20 | Q76: =O76*6+P76 -> 80 | S76: McKINNON | W76: BRUNSWICK | X76: 1 | Y76: 1 | Z76: 0 | AA76: 159 | AB76: 162 | AC76: 98.148148148148152 | AD76: 4
A77: BEST PLAYERS | W77: PRAHRAN | X77: 1 | Y77: 1 | Z77: 0 | AA77: 105 | AB77: 135 | AC77: 77.777777777777771 | AD77: 4
A78: COBURG | C78: MARTIN | E78: GAUDION | H78: VOIGHT | K78: PLANT | N78: JENKINS | Q78: CHAPMAN | W78: WILLIAMSTOWN | X78: 0 | Y78: 2 | Z78: 0 | AA78: 122 | AB78: 152 | AC78: 80.263157894736835 | AD78: 0
A79: PRESTON | C79: HOLLIDAY | E79: REICHMAN | H79: MILLER | K79: SEEBECK | N79: SUMMERS | Q79: WHITE | W79: CAMBERWELL | X79: 0 | Y79: 2 | Z79: 0 | AA79: 83 | AB79: 171 | AC79: 48.538011695906434 | AD79: 0
A80: GOALKICKERS | W80: SANDRINGHAM | X80: 0 | Y80: 2 | Z80: 0 | AA80: 100 | AB80: 235 | AC80: 42.553191489361701 | AD80: 0
A81: COBURG | C81: PLANT 7 | E81: VOIGHT 2 | G81: MEARS | I81: JENKINS
A82: PRESTON | C82: SURTEES 3 | F82: GALL 2 | H82: SEEBECK 2 | K82: PETCHELL | M82: SUMMERS | O82: CARROLL
A84: NORTHCOTE | C84: 7 | D84: 4 | E84: =C84*6+D84 -> 46 | G84: 12 | H84: 5 | I84: =G84*6+H84 -> 77 | K84: 16 | L84: 8 | M84: =K84*6+L84 -> 104 | O84: 18 | P84: 10 | Q84: =O84*6+P84 -> 118 | S84: NORTHCOTE
A85: BRIGHTON | C85: 2 | D85: 2 | E85: =C85*6+D85 -> 14 | G85: 7 | H85: 4 | I85: =G85*6+H85 -> 46 | K85: 9 | L85: 7 | M85: =K85*6+L85 -> 61 | O85: 13 | P85: 11 | Q85: =O85*6+P85 -> 89 | S85: LESTER
A86: BEST PLAYERS
A87: NORTHCOTE | C87: ROWE | E87: HAW | H87: SIMMONDS | K87: PRUSER | N87: POULTER | Q87: CORRIGAN
A88: BRIGHTON | C88: STEWART | E88: LEAPER | H88: CLOTZ | K88: BESWICK | N88: LILBURNE | Q88: BURNES
A89: GOALKICKERS
A90: NORTHCOTE | C90: SIMMONDS 7 | F90: PRUSER 5 | I90: SEYMOUR 2 | L90: HUGGINS 2 | O90: HAW | Q90: CORRIGAN
A91: BRIGHTON | C91: MATTHEWS 5 | F91: LILBURNE 2 | I91: WOOD 2 | L91: BESWICK 2 | O91: BURNES | Q91: BORLAND
A93: PRAHRAN | C93: 2 | D93: 4 | E93: =C93*6+D93 -> 16 | G93: 3 | H93: 9 | I93: =G93*6+H93 -> 27 | K93: 5 | L93: 11 | M93: =K93*6+L93 -> 41 | O93: 7 | P93: 18 | Q93: =O93*6+P93 -> 60 | S93: TOORAK PARK
A94: CAMBERWELL | C94: 1 | D94: 4 | E94: =C94*6+D94 -> 10 | G94: 3 | H94: 6 | I94: =G94*6+H94 -> 24 | K94: 6 | L94: 12 | M94: =K94*6+L94 -> 48 | O94: 6 | P94: 12 | Q94: =O94*6+P94 -> 48 | S94: SCHAEFER
A95: BEST PLAYERS
A96: PRAHRAN | C96: LORD | F96: OSBORNE | I96: F SMITH | L96: PRENTICE | O96: FLOWERS | R96: JORDAN
A97: CAMBERWELL | C97: PETRIE | F97: FARRELLY | I97: BLACK | L97: JACKSON | O97: BOOTHMAN | R97: STONE
A98: GOALKICKERS
A99: PRAHRAN | C99: PRENTICE 3 | G99: R BANKS | J99: LORD | L99: GREENWOOD | O99: JORDAN
A100: CAMBERWELL | C100: FARRELLY 2 | G100: STONE 2 | J100: LAWN | L100: PETRIE
A102: BRUNSWICK | C102: 5 | D102: 2 | E102: =C102*6+D102 -> 32 | G102: 6 | H102: 3 | I102: =G102*6+H102 -> 39 | K102: 11 | L102: 9 | M102: =K102*6+L102 -> 75 | O102: 15 | P102: 14 | Q102: =O102*6+P102 -> 104 | S102: BEACH ROAD
A103: SANDRINGHAM | C103: 2 | D103: 0 | E103: =C103*6+D103 -> 12 | G103: 6 | H103: 4 | I103: =G103*6+H103 -> 40 | K103: 7 | L103: 6 | M103: =K103*6+L103 -> 48 | O103: 8 | P103: 9 | Q103: =O103*6+P103 -> 57
A104: BEST PLAYERS
A105: BRUNSWICK | C105: FITZGERALD | F105: JACOBSEN | I105: McINERNEY | L105: BRIGHT | O105: JOHNSTONE | R105: EUDEY
A106: SANDRINGHAM | C106: DE LUCA | F106: BOURKE | I106: BALDWIN | L106: JOHNSTONE | O106: R KENNA | R106: ESPOSITO
A107: GOALKICKERS
A108: BRUNSWICK | C108: McINERNEY 5 | F108: FITZGERALD 5 | I108: BRAY 3 | K108: JACOBSON | N108: KINNEAR
A109: SANDRINGHAM | C109: BALDWIN 2 | F109: DE LUCA 2 | I109: SMITH 2 | K109: A KENNA | N109: McAULIFFE
A111: OAKLEIGH | C111: 2 | D111: 3 | E111: =C111*6+D111 -> 15 | G111: 5 | H111: 11 | I111: =G111*6+H111 -> 41 | K111: 7 | L111: 13 | M111: =K111*6+L111 -> 55 | O111: 10 | P111: 17 | Q111: =O111*6+P111 -> 77 | S111: OAKLEIGH
A112: WILLIAMSTOWN | C112: 0 | D112: 5 | E112: =C112*6+D112 -> 5 | G112: 1 | H112: 5 | I112: =G112*6+H112 -> 11 | K112: 4 | L112: 11 | M112: =K112*6+L112 -> 35 | O112: 7 | P112: 13 | Q112: =O112*6+P112 -> 55 | S112: STEWART
A113: BEST PLAYERS
A114: OAKLEIGH | C114: GUNNYON | F114: MORRIS | I114: WILTSHIRE | L114: ALLISON | O114: SPAIN | R114: GODING
A115: WILLIAMSTOWN | C115: O'BRIEN | F115: TAAFE | I115: DREW | L115: HELLWIG | O115: SHEEHAN | R115: WARD
A116: GOALKICKERS
A117: OAKLEIGH | C117: FRASER 4 | F117: SHELTON 2 | I117: GODING 2 | L117: FLEMING | N117: ALLISON
A118: WILLIAMSTOWN | C118: J O'BRIEN 2 | F118: BLAKE 2 | I118: SINCLAIR | L118: WARD | N118: SHEEHAN
A120: ROUND 3 | E120: 10TH MAY | J120: WEATHER | M120: CLOUDY BUT FINE N BREEZE | S120: PLAYED AT | X120: LADDER | AB120: ROUND | AD120: 3
D121: 1ST QTR | H121: 2ND QTR | L121: 3RD QTR | P121: FINAL | S121: OAKLEIGH
A122: OAKLEIGH | C122: 5 | D122: 4 | E122: =C122*6+D122 -> 34 | G122: 6 | H122: 4 | I122: =G122*6+H122 -> 40 | K122: 11 | L122: 9 | M122: =K122*6+L122 -> 75 | O122: 15 | P122: 9 | Q122: =O122*6+P122 -> 99 | S122: UMPIRE | W122: TEAM | X122: W | Y122: L | Z122: D | AA122: FOR | AB122: AGST | AC122: % | AD122: PTS
A123: BRIGHTON | C123: 2 | D123: 4 | E123: =C123*6+D123 -> 16 | G123: 3 | H123: 11 | I123: =G123*6+H123 -> 29 | K123: 5 | L123: 14 | M123: =K123*6+L123 -> 44 | O123: 9 | P123: 19 | Q123: =O123*6+P123 -> 73 | S123: GREGORY
A124: BEST PLAYERS | W124: OAKLEIGH | X124: 3 | Y124: 0 | Z124: 0 | AA124: 287 | AB124: 163 | AC124: 176.07361963190183 | AD124: 12
A125: OAKLEIGH | C125: MAHER | F125: FLEMING | I125: GUNNYON | L125: FRASER | N125: GODING | Q125: MORRIS | W125: PORT MELBOURNE | X125: 3 | Y125: 0 | Z125: 0 | AA125: 237 | AB125: 178 | AC125: 133.14606741573033 | AD125: 12
A126: BRIGHTON | C126: FORDHAM | F126: STEWART | I126: LILBURNE | L126: DORE | N126: TUCKER | Q126: GALLAGHER | W126: PRESTON | X126: 2 | Y126: 0 | Z126: 1 | AA126: 240 | AB126: 211 | AC126: 113.74407582938389 | AD126: 10
A127: GOALKICKERS | W127: NORTHCOTE | X127: 2 | Y127: 1 | Z127: 0 | AA127: 327 | AB127: 242 | AC127: 135.12396694214877 | AD127: 8
A128: OAKLEIGH | C128: FRASER 6 | E128: MAHER 2 | G128: O'NEILL 2 | I128: FLEMING | K128: GODING | M128: GOMEZ | O128: JONES | Q128: BEATON
A129: BRIGHTON | C129: TUCKER 3 | E129: MATTHEWS 2 | H129: HUNT | J129: LILBURNE | M129: WOOD | O129: RENNIE | W129: YARRAVILLE | X129: 2 | Y129: 1 | Z129: 0 | AA129: 226 | AB129: 203 | AC129: 111.33004926108374 | AD129: 8
W130: COBURG | X130: 1 | Y130: 1 | Z130: 1 | AA130: 248 | AB130: 215 | AC130: 115.34883720930233 | AD130: 6
A131: YARRAVILLE | C131: 1 | D131: 2 | E131: =C131*6+D131 -> 8 | G131: 7 | H131: 5 | I131: =G131*6+H131 -> 47 | K131: 9 | L131: 9 | M131: =K131*6+L131 -> 63 | O131: 11 | P131: 14 | Q131: =O131*6+P131 -> 80 | S131: COBURG | W131: BRIGHTON | X131: 1 | Y131: 2 | Z131: 0 | AA131: 293 | AB131: 260 | AC131: 112.69230769230769 | AD131: 4
A132: COBURG | C132: 3 | D132: 3 | E132: =C132*6+D132 -> 21 | G132: 3 | H132: 4 | I132: =G132*6+H132 -> 22 | K132: 5 | L132: 11 | M132: =K132*6+L132 -> 41 | O132: 8 | P132: 15 | Q132: =O132*6+P132 -> 63 | S132: HUTCHINGS | W132: WILLIAMSTOWN | X132: 1 | Y132: 2 | Z132: 0 | AA132: 218 | AB132: 211 | AC132: 103.3175355450237 | AD132: 4
A133: BEST PLAYERS | W133: BRUNSWICK | X133: 1 | Y133: 2 | Z133: 0 | AA133: 218 | AB133: 258 | AC133: 84.496124031007753 | AD133: 4
A134: YARRAVILLE | C134: PLUNKETT | F134: CAMERON | I134: FITZMAURICE | L134: SMITH | N134: DWYER | Q134: EDWARDS | W134: PRAHRAN | X134: 1 | Y134: 2 | Z134: 0 | AA134: 175 | AB134: 230 | AC134: 76.086956521739125 | AD134: 4
A135: COBURG | C135: McGRATH | F135: JENKINS | I135: MEARS | L135: PLANT | N135: MARTIN | Q135: DONNELLY | W135: CAMBERWELL | X135: 0 | Y135: 3 | Z135: 0 | AA135: 145 | AB135: 248 | AC135: 58.467741935483872 | AD135: 0
A136: GOALKICKERS | W136: SANDRINGHAM | X136: 0 | Y136: 3 | Z136: 0 | AA136: 188 | AB136: 383 | AC136: 49.086161879895563 | AD136: 0
A137: YARRAVILLE | C137: PLUNKETT 7 | F137: TYSON 2 | I137: ROBERTS | L137: JOYCE
A138: COBURG | C138: PLANT 2 | F138: JENKINS 2 | I138: MEARS | K138: CHAPMAN | N138: COLBERT | Q138: LOWE
A140: WILLIAMSTOWN | C140: 2 | D140: 0 | E140: =C140*6+D140 -> 12 | G140: 5 | H140: 5 | I140: =G140*6+H140 -> 35 | K140: 8 | L140: 9 | M140: =K140*6+L140 -> 57 | O140: 14 | P140: 12 | Q140: =O140*6+P140 -> 96 | S140: WILLIAMSTOWN
A141: BRUNSWICK | C141: 3 | D141: 5 | E141: =C141*6+D141 -> 23 | G141: 4 | H141: 8 | I141: =G141*6+H141 -> 32 | K141: 6 | L141: 10 | M141: =K141*6+L141 -> 46 | O141: 7 | P141: 17 | Q141: =O141*6+P141 -> 59 | S141: MUTCH
A142: BEST PLAYERS
A143: WILLIAMSTOWN | C143: HENDLE | F143: HELLWIG | I143: J O'BRIEN | L143: CAHILL | O143: SYKES | R143: McDONALD
A144: BRUNSWICK | C144: PROUDFOOT | F144: JACOBSEN | I144: THOMPSON | L144: PENMAN | O144: FITZGERALD | R144: WHITELEY
A145: GOALKICKERS
A146: WILLIAMSTOWN | C146: CAHILL 4 | F146: SINCLAIR 4 | I146: McDONALD 3 | L146: BOURKE | N146: J O'BRIEN | Q146: W O'BRIEN
A147: BRUNSWICK | C147: McINERNEY 3 | F147: HOGG 2 | I147: BRAY | K147: PETERSON
A149: PRESTON | C149: 2 | D149: 2 | E149: =C149*6+D149 -> 14 | G149: 7 | H149: 7 | I149: =G149*6+H149 -> 49 | K149: 9 | L149: 7 | M149: =K149*6+L149 -> 61 | O149: 14 | P149: 11 | Q149: =O149*6+P149 -> 95 | S149: PRESTON
A150: PRAHRAN | C150: 2 | D150: 4 | E150: =C150*6+D150 -> 16 | G150: 4 | H150: 6 | I150: =G150*6+H150 -> 30 | K150: 7 | L150: 15 | M150: =K150*6+L150 -> 57 | O150: 9 | P150: 16 | Q150: =O150*6+P150 -> 70 | S150: ASHMORE
A151: BEST PLAYERS
A152: PRESTON | C152: McCORMACK | F152: SURTEES | I152: REICHMAN | L152: TAYLOR | O152: SUMMERS | R152: MONOHAN
A153: PRAHRAN | C153: LORD | F153: W BANKS | I153: NAYLOR | L153: KOOP | O153: TOOHEY | R153: BREWIS
A154: GOALKICKERS
A155: PRESTON | C155: McCORMACK 8 | F155: SURTEES 3 | I155: PETCHELL | L155: SUMMERS | O155: MONOHAN
A156: PRAHRAN | C156: W BANKS 3 | F156: PRENTICE | I156: LORD | K156: TOOHEY | M156: J BANKS | O156: KOOP | Q156: OSBORNE
A158: NORTHCOTE | C158: 3 | D158: 6 | E158: =C158*6+D158 -> 24 | G158: 11 | H158: 8 | I158: =G158*6+H158 -> 74 | K158: 16 | L158: 10 | M158: =K158*6+L158 -> 106 | O158: 22 | P158: 16 | Q158: =O158*6+P158 -> 148 | S158: BEACH ROAD
A159: SANDRINGHAM | C159: 6 | D159: 6 | E159: =C159*6+D159 -> 42 | G159: 8 | H159: 9 | I159: =G159*6+H159 -> 57 | K159: 11 | L159: 14 | M159: =K159*6+L159 -> 80 | O159: 12 | P159: 16 | Q159: =O159*6+P159 -> 88 | S159: COLEMAN
A160: BEST PLAYERS
A161: NORTHCOTE | C161: NICHOLLS | F161: ROWE | I161: WOODS | L161: SEYMOUR | O161: PRUSER | R161: GARRETT
A162: SANDRINGHAM | C162: BAZIN | F162: DE LUCA | I162: DOCKENDORFF | L162: JOHNSTONE | O162: BRIDGFORD | R162: YEMM
A163: GOALKICKERS
A164: NORTHCOTE | C164: SEYMOUR 11 | F164: SIMMONDS 3 | I164: HAW 2 | K164: ROWE | M164: PRUSER | O164: HUGGINS | Q164: HILL | R164: DAVIES | T164: POULTER
A165: SANDRINGHAM | C165: JOHNSTONE 4 | F165: BALDWIN 2 | I165: DE LUCA 2 | L165: SMITH | N165: McAULIFFE | Q165: BAZIN | S165: DOCKENDORFF
A167: PORT MELBOURNE | C167: 4 | D167: 8 | E167: =C167*6+D167 -> 32 | G167: 6 | H167: 12 | I167: =G167*6+H167 -> 48 | K167: 8 | L167: 18 | M167: =K167*6+L167 -> 66 | O167: 9 | P167: 23 | Q167: =O167*6+P167 -> 77 | S167: PORT MELBOURNE
A168: CAMBERWELL | C168: 2 | D168: 0 | E168: =C168*6+D168 -> 12 | G168: 5 | H168: 3 | I168: =G168*6+H168 -> 33 | K168: 6 | L168: 5 | M168: =K168*6+L168 -> 41 | O168: 9 | P168: 8 | Q168: =O168*6+P168 -> 62 | S168: LESTER
A169: BEST PLAYERS
A170: PORT MELBOURNE | C170: PERRETT | F170: GARBUTT | I170: BROOKER | L170: HYDE | O170: BROOKS | R170: STANBRIDGE
A171: CAMBERWELL | C171: PAGE | F171: BROWNLEE | I171: VALE | L171: WARD | O171: WATERS | R171: STONE
A172: GOALKICKERS
A173: PORT MELBOURNE | C173: McINNES 2 | F173: WILKIN 2 | I173: PERRETT 2 | L173: TYSON | N173: SMITH | P173: BROOKS
A174: CAMBERWELL | C174: LAWN 2 | F174: WATERS 2 | I174: STONE | K174: PETRIE | M174: PAGE | O174: VALE | Q174: HUNTER
A176: ROUND 4 | E176: 17TH MAY | J176: WEATHER | M176: CLOUDY BUT FINE | S176: PLAYED AT | X176: LADDER | AB176: ROUND | AD176: 4
D177: 1ST QTR | H177: 2ND QTR | L177: 3RD QTR | P177: FINAL | S177: OAKLEIGH
A178: OAKLEIGH | C178: 7 | D178: 0 | E178: =C178*6+D178 -> 42 | G178: 9 | H178: 2 | I178: =G178*6+H178 -> 56 | K178: 15 | L178: 5 | M178: =K178*6+L178 -> 95 | O178: 17 | P178: 6 | Q178: =O178*6+P178 -> 108 | S178: UMPIRE | W178: TEAM | X178: W | Y178: L | Z178: D | AA178: FOR | AB178: AGST | AC178: % | AD178: PTS
A179: PORT MELBOURNE | C179: 4 | D179: 1 | E179: =C179*6+D179 -> 25 | G179: 6 | H179: 9 | I179: =G179*6+H179 -> 45 | K179: 9 | L179: 13 | M179: =K179*6+L179 -> 67 | O179: 13 | P179: 17 | Q179: =O179*6+P179 -> 95 | S179: McINERNEY
A180: BEST PLAYERS | W180: OAKLEIGH | X180: 4 | Y180: 0 | Z180: 0 | AA180: 395 | AB180: 258 | AC180: 153.10077519379846 | AD180: 16
A181: OAKLEIGH | C181: MAHER | E181: FLEMING | H181: ALLISON | K181: THOMAS | N181: FRASER | Q181: BEASLEY | W181: PORT MELBOURNE | X181: 3 | Y181: 1 | Z181: 0 | AA181: 332 | AB181: 286 | AC181: 116.08391608391608 | AD181: 12
A182: PORT MELBOURNE | C182: HYDE | E182: TYSON | H182: BROOKER | K182: PERRETT | N182: GARBUTT | Q182: ERRIDGE | W182: YARRAVILLE | X182: 3 | Y182: 1 | Z182: 0 | AA182: 288 | AB182: 253 | AC182: 113.83399209486166 | AD182: 12
A183: GOALKICKERS | W183: COBURG | X183: 2 | Y183: 1 | Z183: 1 | AA183: 350 | AB183: 269 | AC183: 130.11152416356876 | AD183: 10
A184: OAKLEIGH | C184: MAHER 4 | E184: FRASER 4 | G184: COCHRANE 3 | J184: ALLISON 2 | M184: BEATON 2 | O184: RUDOLPH | Q184: BEASLEY
A185: PORT MELBOURNE | C185: TYSON 3 | E185: PERRETT 2 | G185: WILKIN 2 | I185: BROOKS 2 | K185: McINNES | M185: PLUMRIDGE | P185: LOVETT | R185: ERRIDGE | W185: PRESTON | X185: 2 | Y185: 1 | Z185: 1 | AA185: 320 | AB185: 302 | AC185: 105.96026490066225 | AD185: 10
W186: NORTHCOTE | X186: 2 | Y186: 2 | Z186: 0 | AA186: 377 | AB186: 304 | AC186: 124.01315789473684 | AD186: 8
A187: YARRAVILLE | C187: 1 | D187: 2 | E187: =C187*6+D187 -> 8 | G187: 5 | H187: 3 | I187: =G187*6+H187 -> 33 | K187: 7 | L187: 6 | M187: =K187*6+L187 -> 48 | O187: 9 | P187: 8 | Q187: =O187*6+P187 -> 62 | S187: NORTHCOTE | W187: WILLIAMSTOWN | X187: 2 | Y187: 2 | Z187: 0 | AA187: 309 | AB187: 280 | AC187: 110.35714285714286 | AD187: 8
A188: NORTHCOTE | C188: 2 | D188: 4 | E188: =C188*6+D188 -> 16 | G188: 3 | H188: 9 | I188: =G188*6+H188 -> 27 | K188: 4 | L188: 11 | M188: =K188*6+L188 -> 35 | O188: 6 | P188: 14 | Q188: =O188*6+P188 -> 50 | W188: BRUNSWICK | X188: 2 | Y188: 2 | Z188: 0 | AA188: 309 | AB188: 338 | AC188: 91.42011834319527 | AD188: 8
A189: BEST PLAYERS | W189: BRIGHTON | X189: 1 | Y189: 3 | Z189: 0 | AA189: 362 | AB189: 351 | AC189: 103.13390313390313 | AD189: 4
A190: YARRAVILLE | C190: HUNTER | E190: HANNAN | H190: WUNHYM | K190: SMITH | N190: DWYER | Q190: FITZMAURICE | W190: CAMBERWELL | X190: 1 | Y190: 3 | Z190: 0 | AA190: 278 | AB190: 319 | AC190: 87.147335423197489 | AD190: 4
A191: NORTHCOTE | C191: MILNE | E191: ROWE | H191: NICHOLLS | K191: WILSON | N191: GARRETT | Q191: SEYMOUR | W191: PRAHRAN | X191: 1 | Y191: 3 | Z191: 0 | AA191: 229 | AB191: 332 | AC191: 68.975903614457835 | AD191: 4
A192: GOALKICKERS | W192: SANDRINGHAM | X192: 0 | Y192: 4 | Z192: 0 | AA192: 259 | AB192: 516 | AC192: 50.193798449612402 | AD192: 0
A193: YARRAVILLE | C193: SCOTT 4 | E193: CAMERON 2 | H193: DRISCOLL | K193: THOMAS | N193: DWYER
A194: NORTHCOTE | C194: SEYMOUR 2 | F194: PRUSER 2 | I194: MILNE | K194: COLE
A196: WILLIAMSTOWN | C196: 4 | D196: 3 | E196: =C196*6+D196 -> 27 | G196: 8 | H196: 12 | I196: =G196*6+H196 -> 60 | K196: 11 | L196: 14 | M196: =K196*6+L196 -> 80 | O196: 12 | P196: 19 | Q196: =O196*6+P196 -> 91 | S196: ELSTERNWICK
A197: BRIGHTON | C197: 2 | D197: 7 | E197: =C197*6+D197 -> 19 | G197: 5 | H197: 9 | I197: =G197*6+H197 -> 39 | K197: 7 | L197: 12 | M197: =K197*6+L197 -> 54 | O197: 9 | P197: 15 | Q197: =O197*6+P197 -> 69 | S197: MUTCH
A198: BEST PLAYERS
A199: WILLIAMSTOWN | C199: CAHILL | E199: J O'BRIEN | H199: JOHNS | K199: WATERMAN | N199: CLAPSON | Q199: HELLWIG
A200: BRIGHTON | C200: MORCAM | E200: STOREY | H200: BESWICK | K200: GALLAGHER | N200: FRANCIS | Q200: LILBURNE
A201: GOALKICKERS
A202: WILLIAMSTOWN | C202: CAHILL 6 | E202: J O'BRIEN 3 | H202: McDONALD 2 | K202: FLYNN
A203: BRIGHTON | C203: MORCAM 4 | F203: MATTHEWS | I203: BESTWICK | K203: LAHIFF | M203: GRACIE | O203: GALLAGHER
A205: CAMBERWELL | C205: 4 | D205: 7 | E205: =C205*6+D205 -> 31 | G205: 7 | H205: 12 | I205: =G205*6+H205 -> 54 | K205: 11 | L205: 20 | M205: =K205*6+L205 -> 86 | O205: 18 | P205: 25 | Q205: =O205*6+P205 -> 133 | S205: CAMBERWELL
A206: SANDRINGHAM | C206: 4 | D206: 3 | E206: =C206*6+D206 -> 27 | G206: 7 | H206: 6 | I206: =G206*6+H206 -> 48 | K206: 7 | L206: 8 | M206: =K206*6+L206 -> 50 | O206: 10 | P206: 11 | Q206: =O206*6+P206 -> 71 | S206: McKINNON
A207: BEST PLAYERS
A208: CAMBERWELL | C208: LAWN | E208: PAGE | H208: BOOTHMAN | K208: MURPHY | N208: HUNTER | Q208: VALE
A209: SANDRINGHAM | C209: BOYD | E209: JOHNSTONE | H209: YEMM | K209: BOURKE | N209: ESPOSITO | Q209: BAZIN
A210: GOALKICKERS
A211: CAMBERWELL | C211: LAWN 10 | E211: WARD 2 | G211: MURPHY 2 | I211: WATERS | K211: VALE | M211: DYBALL | O211: QUARTERMAN
A212: SANDRINGHAM | C212: BOYD 3 | E212: SMITH 2 | G212: A KENNA | I212: JOHNSTONE | L212: BAZIN | N212: DOCKENDORFF | Q212: ESPOSITO
A214: COBURG | C214: 3 | D214: 3 | E214: =C214*6+D214 -> 21 | G214: 5 | H214: 9 | I214: =G214*6+H214 -> 39 | K214: 8 | L214: 14 | M214: =K214*6+L214 -> 62 | O214: 14 | P214: 18 | Q214: =O214*6+P214 -> 102 | S214: TOORAK PARK
A215: PRAHRAN | C215: 5 | D215: 1 | E215: =C215*6+D215 -> 31 | G215: 6 | H215: 4 | I215: =G215*6+H215 -> 40 | K215: 7 | L215: 5 | M215: =K215*6+L215 -> 47 | O215: 8 | P215: 6 | Q215: =O215*6+P215 -> 54 | S215: STUART
A216: BEST PLAYERS
A217: COBURG | C217: MARTIN | E217: SPEAKMAN | H217: KIGHT | K217: MEARS | N217: VOIGHT | Q217: CHAPMAN
A218: PRAHRAN | C218: OSBORNE | E218: W BANKS | H218: KIDD | K218: BREWIS | N218: TOOHEY | Q218: RASTAS
A219: GOALKICKERS
A220: COBURG | C220: PLANT 5 | E220: WALLEY 3 | H220: MEARS 2 | J220: VOIGHT | M220: JENKINS | O220: MARTIN | Q220: SPEAKMAN
A221: PRAHRAN | C221: RASTUS 2 | F221: LORD | H221: JORDAN | J221: TOOHEY | L221: J BANKS | N221: DONOHUE | Q221: KIDD
A223: BRUNSWICK | C223: 3 | D223: 7 | E223: =C223*6+D223 -> 25 | G223: 6 | H223: 7 | I223: =G223*6+H223 -> 43 | K223: 9 | L223: 10 | M223: =K223*6+L223 -> 64 | O223: 13 | P223: 13 | Q223: =O223*6+P223 -> 91 | S223: BRUNSWICK
A224: PRESTON | C224: 2 | D224: 4 | E224: =C224*6+D224 -> 16 | G224: 4 | H224: 12 | I224: =G224*6+H224 -> 36 | K224: 10 | L224: 13 | M224: =K224*6+L224 -> 73 | O224: 11 | P224: 14 | Q224: =O224*6+P224 -> 80
A225: BEST PLAYERS
A226: BRUNSWICK | C226: KINNEAR | F226: HEARN | H226: THOMPSON | K226: PROUDFOOT | N226: CARTON | Q226: BLACKMORE
A227: PRESTON | C227: McCORMACK | F227: GALL | H227: REICHMAN | K227: WHITE | N227: TAYLOR | Q227: SURTEES
A228: GOALKICKERS
A229: BRUNSWICK | C229: KINNEAR 6 | F229: BRAY 2 | H229: JACOBSON | J229: PENMAN | L229: FITZGERALD | O229: HEARN | Q229: ALEXANDER
A230: PRESTON | C230: McCORMACK 5 | F230: SEEBECK 3 | I230: SURTEES 2 | L230: GALL
A232: ROUND 5 | E232: 24TH MAY | J232: WEATHER | M232: FINE | S232: PLAYED AT | X232: LADDER | AB232: ROUND | AD232: 5
D233: 1ST QTR | H233: 2ND QTR | L233: 3RD QTR | P233: FINAL | S233: PORT MELBOURNE
A234: PORT MELBOURNE | C234: 2 | D234: 6 | E234: =C234*6+D234 -> 18 | G234: 5 | H234: 10 | I234: =G234*6+H234 -> 40 | K234: 6 | L234: 14 | M234: =K234*6+L234 -> 50 | O234: 9 | P234: 15 | Q234: =O234*6+P234 -> 69 | S234: UMPIRE | W234: TEAM | X234: W | Y234: L | Z234: D | AA234: FOR | AB234: AGST | AC234: % | AD234: PTS
A235: PRESTON | C235: 1 | D235: 5 | E235: =C235*6+D235 -> 11 | G235: 2 | H235: 7 | I235: =G235*6+H235 -> 19 | K235: 5 | L235: 9 | M235: =K235*6+L235 -> 39 | O235: 7 | P235: 12 | Q235: =O235*6+P235 -> 54 | S235: FROOD
A236: BEST PLAYERS | W236: OAKLEIGH | X236: 5 | Y236: 0 | Z236: 0 | AA236: 480 | AB236: 311 | AC236: 154.34083601286173 | AD236: 20
A237: PORT MELBOURNE | C237: HYDE | E237: STANBRIDGE | H237: GARBUTT | K237: BROOKER | N237: HARRISON | Q237: WILKIN | W237: PORT MELBOURNE | X237: 4 | Y237: 1 | Z237: 0 | AA237: 401 | AB237: 340 | AC237: 117.94117647058823 | AD237: 16
A238: PRESTON | C238: TAYLOR | E238: O'DOHERTY | H238: LEVER | K238: MILLER | N238: GALL | Q238: GOONAN | W238: YARRAVILLE | X238: 4 | Y238: 1 | Z238: 0 | AA238: 396 | AB238: 350 | AC238: 113.14285714285714 | AD238: 16
A239: GOALKICKERS | W239: NORTHCOTE | X239: 3 | Y239: 2 | Z239: 0 | AA239: 465 | AB239: 371 | AC239: 125.33692722371967 | AD239: 12
A240: PORT MELBOURNE | C240: WILKIN 3 | E240: TYSON 2 | G240: BROOKS 2 | I240: PLUMRIDGE | L240: BARNETT
A241: PRESTON | C241: McCORMACK 2 | F241: SURTEES | I241: GALL | K241: SUMMERS | M241: MILLER | O241: TAYLOR | W241: WILLIAMSTOWN | X241: 3 | Y241: 2 | Z241: 0 | AA241: 431 | AB241: 354 | AC241: 121.75141242937853 | AD241: 12
W242: COBURG | X242: 2 | Y242: 2 | Z242: 1 | AA242: 417 | AB242: 357 | AC242: 116.80672268907563 | AD242: 10
A243: NORTHCOTE | C243: 4 | D243: 6 | E243: =C243*6+D243 -> 30 | G243: 9 | H243: 12 | I243: =G243*6+H243 -> 66 | K243: 9 | L243: 12 | M243: =K243*6+L243 -> 66 | O243: 12 | P243: 16 | Q243: =O243*6+P243 -> 88 | S243: NORTHCOTE | W243: PRESTON | X243: 2 | Y243: 2 | Z243: 1 | AA243: 374 | AB243: 371 | AC243: 100.80862533692722 | AD243: 10
A244: COBURG | C244: 1 | D244: 2 | E244: =C244*6+D244 -> 8 | G244: 2 | H244: 5 | I244: =G244*6+H244 -> 17 | K244: 5 | L244: 9 | M244: =K244*6+L244 -> 39 | O244: 9 | P244: 13 | Q244: =O244*6+P244 -> 67 | S244: MORCOM | W244: BRUNSWICK | X244: 2 | Y244: 3 | Z244: 0 | AA244: 362 | AB244: 423 | AC244: 85.579196217494086 | AD244: 8
A245: BEST PLAYERS | W245: BRIGHTON | X245: 1 | Y245: 4 | Z245: 0 | AA245: 459 | AB245: 459 | AC245: 100 | AD245: 4
A246: NORTHCOTE | C246: COCKRAM | F246: BROWN | I246: HUMPHRIES | L246: SEYMOUR | O246: MILNE | Q246: GARRETT | W246: CAMBERWELL | X246: 1 | Y246: 4 | Z246: 0 | AA246: 352 | AB246: 441 | AC246: 79.818594104308389 | AD246: 4
A247: COBURG | C247: TREVASKIS | F247: CHARLESTON | I247: CHAPMAN | L247: KIGHT | O247: ROGERS | Q247: VOIGHT | W247: SANDRINGHAM | X247: 1 | Y247: 4 | Z247: 0 | AA247: 406 | AB247: 594 | AC247: 68.350168350168346 | AD247: 4
A248: GOALKICKERS | W248: PRAHRAN | X248: 1 | Y248: 4 | Z248: 0 | AA248: 307 | AB248: 479 | AC248: 64.091858037578291 | AD248: 4
A249: NORTHCOTE | C249: SEYMOUR 5 | F249: SIMMONDS 2 | I249: MILNE 2 | K249: PRUSER | M249: BROWN | O249: GOULLET
A250: COBURG | C250: VOIGHT 2 | F250: HASSETT 2 | I250: MEARS | K250: HARRIS | M250: LOWE | O250: WALLEY | Q250: TREVASKIS
A252: OAKLEIGH | C252: 5 | D252: 2 | E252: =C252*6+D252 -> 32 | G252: 5 | H252: 10 | I252: =G252*6+H252 -> 40 | K252: 7 | L252: 11 | M252: =K252*6+L252 -> 53 | O252: 11 | P252: 19 | Q252: =O252*6+P252 -> 85 | S252: BRUNSWICK
A253: BRUNSWICK | C253: 3 | D253: 1 | E253: =C253*6+D253 -> 19 | G253: 6 | H253: 2 | I253: =G253*6+H253 -> 38 | K253: 6 | L253: 9 | M253: =K253*6+L253 -> 45 | O253: 7 | P253: 11 | Q253: =O253*6+P253 -> 53 | S253: McKINNON
A254: BEST PLAYERS
A255: OAKLEIGH | C255: McALLISTER | F255: MAHER | I255: SPAIN | L255: DOLAN | O255: RUDOLPH | Q255: FLEMING
A256: BRUNSWICK | C256: McNEILL | F256: KINNEAR | I256: THOMPSON | L256: CARTON | O256: BRAY | Q256: FITZGERALD
A257: GOALKICKERS
A258: OAKLEIGH | C258: SHELTON 2 | F258: MAHER 2 | I258: FRASER 2 | K258: ALLISON 2 | N258: BEASLEY | P258: HENRY
A259: BRUNSWICK | C259: KINNEAR 6 | G259: McINERNEY
A261: WILLIAMSTOWN | C261: 6 | D261: 2 | E261: =C261*6+D261 -> 38 | G261: 12 | H261: 9 | I261: =G261*6+H261 -> 81 | K261: 14 | L261: 14 | M261: =K261*6+L261 -> 98 | O261: 17 | P261: 20 | Q261: =O261*6+P261 -> 122 | S261: WILLIAMSTOWN
A262: CAMBERWELL | C262: 5 | D262: 5 | E262: =C262*6+D262 -> 35 | G262: 5 | H262: 10 | I262: =G262*6+H262 -> 40 | K262: 10 | L262: 11 | M262: =K262*6+L262 -> 71 | O262: 10 | P262: 14 | Q262: =O262*6+P262 -> 74 | S262: LESTER
A263: BEST PLAYERS
A264: WILLIAMSTOWN | C264: CAHILL | F264: JOHNS | I264: J O'BRIEN | L264: DREW | O264: SYKES | Q264: McDONALD
A265: CAMBERWELL | C265: LAWN | F265: DYBALL | I265: VALE | L265: TICKLE | O265: BLACK | Q265: BOOTHMAN
A266: GOALKICKERS
A267: WILLIAMSTOWN | C267: J O'BRIEN 5 | F267: McDONALD 5 | I267: SINCLAIR 2 | L267: BLAKE | N267: CAHILL | P267: HELWIG | R267: JOHNS | T267: LOCK
A268: CAMBERWELL | C268: LAWN 5 | F268: PETRIE 2 | I268: JONES 2 | L268: PAGE
A270: SANDRINGHAM | C270: 3 | D270: 6 | E270: =C270*6+D270 -> 24 | G270: 8 | H270: 10 | I270: =G270*6+H270 -> 58 | K270: 17 | L270: 12 | M270: =K270*6+L270 -> 114 | O270: 22 | P270: 15 | Q270: =O270*6+P270 -> 147 | S270: BEACH ROAD
A271: PRAHRAN | C271: 3 | D271: 4 | E271: =C271*6+D271 -> 22 | G271: 6 | H271: 9 | I271: =G271*6+H271 -> 45 | K271: 9 | L271: 11 | M271: =K271*6+L271 -> 65 | O271: 11 | P271: 12 | Q271: =O271*6+P271 -> 78 | S271: CARRUTHERS
A272: BEST PLAYERS
A273: SANDRINGHAM | C273: BOURKE | F273: BOYD | I273: QUINN | L273: McAULIFFE | O273: BAZIN | Q273: ORR
A274: PRAHRAN | C274: BREWIS | F274: JORDAN | I274: KOOP | L274: J BANKS | O274: OSBORNE | Q274: F SMITH
A275: GOALKICKERS
A276: SANDRINGHAM | C276: BOYD 10 | E276: QUINN 3 | G276: McAULIFFE 2 | J276: R KENNA 2 | M276: SMITH | O276: BAZIN | Q276: YEMM | S276: THOMPSON | W276: E BOURKE
A277: PRAHRAN | C277: JORDAN 5 | F277: KIDD 3 | H277: LORD | J277: GREENWOOD | M277: RASTUS
A279: YARRAVILLE | C279: 4 | D279: 0 | E279: =C279*6+D279 -> 24 | G279: 8 | H279: 2 | I279: =G279*6+H279 -> 50 | K279: 10 | L279: 6 | M279: =K279*6+L279 -> 66 | O279: 16 | P279: 12 | Q279: =O279*6+P279 -> 108 | S279: ELSTERNWICK PARK
A280: BRIGHTON | C280: 5 | D280: 2 | E280: =C280*6+D280 -> 32 | G280: 7 | H280: 3 | I280: =G280*6+H280 -> 45 | K280: 12 | L280: 5 | M280: =K280*6+L280 -> 77 | O280: 15 | P280: 7 | Q280: =O280*6+P280 -> 97 | S280: STUART
A281: BEST PLAYERS
A282: YARRAVILLE | C282: FITZMAURICE | F282: KENNEDY | I282: DWYER | L282: WUNHYM | O282: JOYCE | Q282: PLUNKETT
A283: BRIGHTON | C283: ELLIOTT | F283: LILBURNE | I283: WEBB | L283: TUCKER | O283: BORLAND | Q283: GALLAGHER
A284: GOALKICKERS
A285: YARRAVILLE | C285: PLUNKETT 6 | F285: KENNEDY 2 | I285: LOVETT 2 | K285: JOYCE 2 | M285: TYSON | O285: FITZMAURICE | R285: WUNHYM | U285: COULSELL
A286: BRIGHTON | C286: LILBURNE 4 | F286: MORCOM 3 | I286: BOCK 3 | K286: TUCKER 2 | M286: WOOD | O286: BORLAND | Q286: GALLAGHER
A288: ROUND 6 | E288: 31ST MAY | J288: WEATHER | M288: FINE NORTH BREEZE | S288: PLAYED AT
D289: 1ST QTR | H289: 2ND QTR | L289: 3RD QTR | P289: FINAL | S289: COBURG | X289: LADDER | AB289: ROUND | AD289: 6
A290: COBURG | C290: 1 | D290: 2 | E290: =C290*6+D290 -> 8 | G290: 4 | H290: 8 | I290: =G290*6+H290 -> 32 | K290: 6 | L290: 11 | M290: =K290*6+L290 -> 47 | O290: 11 | P290: 15 | Q290: =O290*6+P290 -> 81 | S290: UMPIRE
A291: PORT MELBOURNE | C291: 5 | D291: 7 | E291: =C291*6+D291 -> 37 | G291: 5 | H291: 9 | I291: =G291*6+H291 -> 39 | K291: 11 | L291: 15 | M291: =K291*6+L291 -> 81 | O291: 11 | P291: 15 | Q291: =O291*6+P291 -> 81 | S291: McKINNON | W291: TEAM | X291: W | Y291: L | Z291: D | AA291: FOR | AB291: AGST | AC291: % | AD291: PTS
A292: BEST PLAYERS
A293: COBURG | C293: KIGHT | E293: JENKINS | H293: MEARS | K293: CHAPMAN | N293: DONNELLY | Q293: GAUDION | W293: OAKLEIGH | X293: 6 | Y293: 0 | Z293: 0 | AA293: 611 | AB293: 382 | AC293: 159.9476439790576 | AD293: 24
A294: PORT MELBOURNE | C294: HYDE | E294: BARNES | H294: PLUMRIDGE | K294: PERRETT | N294: GARBUTT | Q294: WILKIN | W294: YARRAVILLE | X294: 5 | Y294: 1 | Z294: 0 | AA294: 507 | AB294: 424 | AC294: 119.5754716981132 | AD294: 20
A295: GOALKICKERS | W295: PORT MELBOURNE | X295: 4 | Y295: 1 | Z295: 1 | AA295: 482 | AB295: 421 | AC295: 114.48931116389549 | AD295: 18
A296: COBURG | C296: MEARS 3 | E296: HASSETT 3 | H296: PLANT 2 | J296: LOWE 2 | L296: HEALEY | W296: NORTHCOTE | X296: 4 | Y296: 2 | Z296: 0 | AA296: 569 | AB296: 433 | AC296: 131.40877598152426 | AD296: 16
A297: PORT MELBOURNE | C297: WILKIN 4 | E297: TYSON 3 | G297: PLUMRIDGE 2 | J297: FISHER | L297: BROOKS
W298: PRESTON | X298: 3 | Y298: 2 | Z298: 1 | AA298: 485 | AB298: 447 | AC298: 108.50111856823266 | AD298: 14
A299: PRESTON | C299: 2 | D299: 0 | E299: =C299*6+D299 -> 12 | G299: 9 | H299: 4 | I299: =G299*6+H299 -> 58 | K299: 11 | L299: 8 | M299: =K299*6+L299 -> 74 | O299: 17 | P299: 9 | Q299: =O299*6+P299 -> 111 | S299: PRESTON | W299: COBURG | X299: 2 | Y299: 2 | Z299: 2 | AA299: 498 | AB299: 438 | AC299: 113.6986301369863 | AD299: 12
A300: WILLIAMSTOWN | C300: 5 | D300: 3 | E300: =C300*6+D300 -> 33 | G300: 5 | H300: 4 | I300: =G300*6+H300 -> 34 | K300: 8 | L300: 7 | M300: =K300*6+L300 -> 55 | O300: 11 | P300: 10 | Q300: =O300*6+P300 -> 76 | S300: SCHAEFER | W300: WILLIAMSTOWN | X300: 3 | Y300: 3 | Z300: 0 | AA300: 507 | AB300: 465 | AC300: 109.03225806451613 | AD300: 12
A301: BEST PLAYERS | W301: BRIGHTON | X301: 2 | Y301: 4 | Z301: 0 | AA301: 556 | AB301: 533 | AC301: 104.31519699812382 | AD301: 8
A302: PRESTON | C302: PETCHALL | E302: REICHMAN | H302: GALL | K302: McCORMACK | N302: O'DOHERTY | Q302: GOONAN | W302: BRUNSWICK | X302: 2 | Y302: 4 | Z302: 0 | AA302: 436 | AB302: 520 | AC302: 83.84615384615384 | AD302: 8
A303: WILLIAMSTOWN | C303: CAHILL | E303: J O'BRIEN | H303: SYKES | K303: HELLWIG | N303: JOHNS | Q303: SINCLAIR | W303: CAMBERWELL | X303: 1 | Y303: 5 | Z303: 0 | AA303: 426 | AB303: 552 | AC303: 77.173913043478265 | AD303: 4
A304: GOALKICKERS | W304: SANDRINGHAM | X304: 1 | Y304: 5 | Z304: 0 | AA304: 477 | AB304: 725 | AC304: 65.793103448275858 | AD304: 4
A305: PRESTON | C305: GALL 6 | E305: McCORMACK 6 | H305: DAVIE 3 | J305: SURTEES | L305: LAVER | W305: PRAHRAN | X305: 1 | Y305: 5 | Z305: 0 | AA305: 369 | AB305: 583 | AC305: 63.293310463121784 | AD305: 4
A306: WILLIAMSTOWN | C306: CAHILL 4 | E306: J O'BRIEN 2 | H306: McDONALD 2 | K306: JOHNS 2 | M306: BLAKE
A308: BRIGHTON | C308: 2 | D308: 1 | E308: =C308*6+D308 -> 13 | G308: 9 | H308: 2 | I308: =G308*6+H308 -> 56 | K308: 10 | L308: 8 | M308: =K308*6+L308 -> 68 | O308: 14 | P308: 13 | Q308: =O308*6+P308 -> 97 | S308: BRUNSWICK
A309: BRUNSWICK | C309: 4 | D309: 5 | E309: =C309*6+D309 -> 29 | G309: 6 | H309: 10 | I309: =G309*6+H309 -> 46 | K309: 9 | L309: 13 | M309: =K309*6+L309 -> 67 | O309: 10 | P309: 14 | Q309: =O309*6+P309 -> 74 | S309: McBEAN
A310: BEST PLAYERS
A311: BRIGHTON | C311: CANTWELL | F311: LILBURNE | I311: B SMITH | L311: STOREY | O311: LEAPER | R311: TUCKER
A312: BRUNSWICK | C312: KINNEAR | F312: BLACKMORE | I312: CARTON | L312: KENNETT | O312: THOMPSON | R312: BRAY
A313: GOALKICKERS
A314: BRIGHTON | C314: TUCKER 4 | E314: B SMITH 4 | H314: LILBURNE | J314: BURNES | L314: BORLAND | N314: MORCOM | Q314: STOREY | S314: LEAPER
A315: BRUNSWICK | C315: MCINERNEY 3 | F315: PETERSON 3 | I315: KINNEAR 2 | L315: FITZGERALD | O315: BRAY
A317: NORTHCOTE | C317: 2 | D317: 7 | E317: =C317*6+D317 -> 19 | G317: 4 | H317: 10 | I317: =G317*6+H317 -> 34 | K317: 12 | L317: 16 | M317: =K317*6+L317 -> 88 | O317: 14 | P317: 20 | Q317: =O317*6+P317 -> 104 | S317: TOORAK PARK
A318: PRAHRAN | C318: 1 | D318: 1 | E318: =C318*6+D318 -> 7 | G318: 4 | H318: 8 | I318: =G318*6+H318 -> 32 | K318: 5 | L318: 10 | M318: =K318*6+L318 -> 40 | O318: 8 | P318: 14 | Q318: =O318*6+P318 -> 62 | S318: LESTER
A319: BEST PLAYERS
A320: NORTHCOTE | C320: COCKRAM | F320: BROWN | I320: NICHOLLS | L320: SEYMOUR | O320: WILSON | R320: E C BRIGGS
A321: PRAHRAN | C321: GREENWOOD | F321: ANDERSON | I321: LORD | L321: J BANKS | O321: RASTAS | R321: NAYLOR
A322: GOALKICKERS
A323: NORTHCOTE | C323: ROSS 4 | E323: SEYMOUR 3 | H323: E C BRIGGS 2 | K323: PRUSER 2 | M323: SIMMONDS | O323: BROWN | Q323: GOULLET
A324: PRAHRAN | C324: ANDERSON 2 | F324: RASTUS 2 | I324: KIDD 2 | K324: R BANKS | M324: GREENWOOD
A326: YARRAVILLE | C326: 1 | D326: 0 | E326: =C326*6+D326 -> 6 | G326: 8 | H326: 10 | I326: =G326*6+H326 -> 58 | K326: 11 | L326: 13 | M326: =K326*6+L326 -> 79 | O326: 15 | P326: 21 | Q326: =O326*6+P326 -> 111 | S326: CAMBERWELL
A327: CAMBERWELL | C327: 3 | D327: 6 | E327: =C327*6+D327 -> 24 | G327: 3 | H327: 6 | I327: =G327*6+H327 -> 24 | K327: 9 | L327: 6 | M327: =K327*6+L327 -> 60 | O327: 11 | P327: 8 | Q327: =O327*6+P327 -> 74 | S327: FROOD
A328: BEST PLAYERS
A329: YARRAVILLE | C329: HUNTER | E329: SMITH | H329: PLUNKETT | K329: TYSON | N329: ROBERTS | Q329: PENNY
A330: CAMBERWELL | C330: JONES | E330: BOOTHMAN | H330: HARVEY | K330: GREENWOOD | N330: WALLIS | Q330: PAGE
A331: GOALKICKERS
A332: YARRAVILLE | C332: PLUNKETT 5 | F332: TYSON 4 | I332: SCOTT 3 | K332: LOVETT | M332: JOYCE | O332: ROWE
A333: CAMBERWELL | C333: PETRIE 3 | E333: DYBALL 2 | H333: WALLIS 2 | J333: LAWN | L333: PAGE | N333: WARD | P333: JONES
A335: OAKLEIGH | C335: 5 | D335: 3 | E335: =C335*6+D335 -> 33 | G335: 9 | H335: 11 | I335: =G335*6+H335 -> 65 | K335: 13 | L335: 19 | M335: =K335*6+L335 -> 97 | O335: 18 | P335: 23 | Q335: =O335*6+P335 -> 131 | S335: OAKLEIGH
A336: SANDRINGHAM | C336: 4 | D336: 5 | E336: =C336*6+D336 -> 29 | G336: 5 | H336: 10 | I336: =G336*6+H336 -> 40 | K336: 8 | L336: 11 | M336: =K336*6+L336 -> 59 | O336: 10 | P336: 11 | Q336: =O336*6+P336 -> 71 | S336: STEWART
A337: BEST PLAYERS
A338: OAKLEIGH | C338: RUDOLPH | F338: GUNNYON | I338: MAHER | K338: FRASER | N338: HENRY | Q338: SPAIN
A339: SANDRINGHAM | C339: E BOURKE | F339: BAZIN | I339: BOYD | K339: R KENNA | N339: QUINN | Q339: MOORE
A340: GOALKICKERS
A341: OAKLEIGH | C341: FRASER 4 | E341: HENRY 4 | G341: SHELTON 3 | J341: SPAIN 2 | L341: MAHER 2 | N341: FLEMING | P341: ALLISON | R341: O'NEILL
A342: SANDRINGHAM | C342: BOYD 3 | E342: DOCKENDORFF 3 | I342: NAGEL 2 | K342: SMITH | M342: E BOURKE
A344: ROUND 7 | E344: 7TH JUNE | H344: WEATHER | K344: COLD CLOUDY SHOWERS STRONG S.E. WIND | S344: PLAYED AT | X344: LADDER | AB344: ROUND | AD344: 7
D345: 1ST QTR | H345: 2ND QTR | L345: 3RD QTR | P345: FINAL | S345: PORT MELBOURNE
A346: PORT MELBOURNE | C346: 3 | D346: 2 | E346: =C346*6+D346 -> 20 | G346: 4 | H346: 3 | I346: =G346*6+H346 -> 27 | K346: 7 | L346: 7 | M346: =K346*6+L346 -> 49 | O346: 12 | P346: 9 | Q346: =O346*6+P346 -> 81 | S346: UMPIRE | W346: TEAM | X346: W | Y346: L | Z346: D | AA346: FOR | AB346: AGST | AC346: % | AD346: PTS
A347: NORTHCOTE | C347: 1 | D347: 3 | E347: =C347*6+D347 -> 9 | G347: 5 | H347: 5 | I347: =G347*6+H347 -> 35 | K347: 6 | L347: 5 | M347: =K347*6+L347 -> 41 | O347: 7 | P347: 6 | Q347: =O347*6+P347 -> 48 | S347: COLEMAN
A348: BEST PLAYERS | W348: OAKLEIGH | X348: 7 | Y348: 0 | Z348: 0 | AA348: 687 | AB348: 441 | AC348: 155.78231292517006 | AD348: 28
A349: PORT MELBOURNE | C349: STANBRIDGE | F349: HYDE | I349: GARBUTT | L349: WILKIN | N349: BROOKS | Q349: TYSON | W349: YARRAVILLE | X349: 6 | Y349: 1 | Z349: 0 | AA349: 621 | AB349: 465 | AC349: 133.54838709677421 | AD349: 24
A350: NORTHCOTE | C350: GARRETT | F350: CORRIGAN | I350: MILNE | L350: E BRIGGS | N350: E .C .BRIGGS | Q350: WILSON | W350: PORT MELBOURNE | X350: 5 | Y350: 1 | Z350: 1 | AA350: 563 | AB350: 469 | AC350: 120.04264392324095 | AD350: 22
A351: GOALKICKERS | W351: NORTHCOTE | X351: 4 | Y351: 3 | Z351: 0 | AA351: 617 | AB351: 514 | AC351: 120.03891050583658 | AD351: 16
A352: PORT MELBOURNE | C352: TYSON 4 | E352: McINNES 3 | H352: WILKIN 3 | J352: STANBRIDGE | M352: BILLS
A353: NORTHCOTE | C353: MILNE 2 | E353: ROSS | G353: SEYMOUR | I353: SIMMONDS | L353: PRUSER | N353: CORRIGAN | W353: WILLIAMSTOWN | X353: 4 | Y353: 3 | Z353: 0 | AA353: 604 | AB353: 513 | AC353: 117.73879142300196 | AD353: 16
W354: PRESTON | X354: 3 | Y354: 3 | Z354: 1 | AA354: 544 | AB354: 523 | AC354: 104.01529636711281 | AD354: 14
A355: BRIGHTON | C355: 6 | D355: 2 | E355: =C355*6+D355 -> 38 | G355: 7 | H355: 4 | I355: =G355*6+H355 -> 46 | K355: 9 | L355: 11 | M355: =K355*6+L355 -> 65 | O355: 9 | P355: 14 | Q355: =O355*6+P355 -> 68 | S355: ELSTERNWICK PARK | W355: BRIGHTON | X355: 3 | Y355: 4 | Z355: 0 | AA355: 624 | AB355: 575 | AC355: 108.52173913043478 | AD355: 12
A356: COBURG | C356: 1 | D356: 2 | E356: =C356*6+D356 -> 8 | G356: 4 | H356: 8 | I356: =G356*6+H356 -> 32 | K356: 4 | L356: 8 | M356: =K356*6+L356 -> 32 | O356: 5 | P356: 12 | Q356: =O356*6+P356 -> 42 | S356: McKINNON | W356: COBURG | X356: 2 | Y356: 3 | Z356: 2 | AA356: 540 | AB356: 506 | AC356: 106.71936758893281 | AD356: 12
A357: BEST PLAYERS | W357: BRUNSWICK | X357: 3 | Y357: 4 | Z357: 0 | AA357: 501 | AB357: 573 | AC357: 87.434554973821989 | AD357: 12
A358: BRIGHTON | C358: CLOTZ | F358: SMITH | I358: BESWICK | L358: BURNES | N358: TUCKER | Q358: WEBB | W358: CAMBERWELL | X358: 1 | Y358: 6 | Z358: 0 | AA358: 479 | AB358: 617 | AC358: 77.633711507293356 | AD358: 4
A359: COBURG | C359: COLBERT | F359: GAUDION | I359: CHAPMAN | L359: JENKINS | N359: VOIGHT | Q359: KIGHT | W359: SANDRINGHAM | X359: 1 | Y359: 6 | Z359: 0 | AA359: 525 | AB359: 822 | AC359: 63.868613138686129 | AD359: 4
A360: GOALKICKERS | W360: PRAHRAN | X360: 1 | Y360: 6 | Z360: 0 | AA360: 410 | AB360: 697 | AC360: 58.823529411764703 | AD360: 4
A361: BRIGHTON | C361: LILBURNE 2 | F361: B SMITH 2 | I361: BARNES 2 | L361: BOCK | N361: STOREY | P361: CLOTZ
A362: COBURG | C362: COLBERT 3 | F362: HEALEY | I362: BERTRAM
A364: WILLIAMSTOWN | C364: 0 | D364: 0 | E364: =C364*6+D364 -> 0 | G364: 3 | H364: 3 | I364: =G364*6+H364 -> 21 | K364: 5 | L364: 9 | M364: =K364*6+L364 -> 39 | O364: 14 | P364: 13 | Q364: =O364*6+P364 -> 97 | S364: WILLIAMSTOWN
A365: SANDRINGHAM | C365: 4 | D365: 5 | E365: =C365*6+D365 -> 29 | G365: 5 | H365: 5 | I365: =G365*6+H365 -> 35 | K365: 7 | L365: 6 | M365: =K365*6+L365 -> 48 | O365: 7 | P365: 6 | Q365: =O365*6+P365 -> 48 | S365: LESTER
A366: BEST PLAYERS
A367: WILLIAMSTOWN | C367: J O'BRIEN | F367: LONERGAN | I367: W O'BRIEN | L367: BLAKE | O367: CAHILL | R367: BYRNE
A368: SANDRINGHAM | C368: ANDERSON | F368: JOHNSTONE | I368: THOMPSON | L368: BAZIN | O368: YEMM | R368: DICK
A369: GOALKICKERS
A370: WILLIAMSTOWN | C370: J O'BRIEN 5 | F370: JOHNS 3 | H370: SINCLAIR | J370: BLAKE | L370: CAHILL | N370: W O'BRIEN | Q370: FLYNN | S370: T BYRNE
A371: SANDRINGHAM | C371: DICK 2 | F371: E BOURKE 2 | I371: SMITH | K371: QUINN | M371: R KENNA
A373: YARRAVILLE | C373: 4 | D373: 5 | E373: =C373*6+D373 -> 29 | G373: 5 | H373: 5 | I373: =G373*6+H373 -> 35 | K373: 13 | L373: 9 | M373: =K373*6+L373 -> 87 | O373: 17 | P373: 12 | Q373: =O373*6+P373 -> 114 | S373: YARRAVILLE
A374: PRAHRAN | C374: 1 | D374: 2 | E374: =C374*6+D374 -> 8 | G374: 3 | H374: 7 | I374: =G374*6+H374 -> 25 | K374: 4 | L374: 8 | M374: =K374*6+L374 -> 32 | O374: 5 | P374: 11 | Q374: =O374*6+P374 -> 41 | S374: SCHAEFER
A375: BEST PLAYERS
A376: YARRAVILLE | C376: SHERMAN | F376: DWYER | I376: FARRELL | L376: COULSELL | O376: FITZMAURICE | R376: ROBERTS
A377: PRAHRAN | C377: LORD | F377: KOOP | I377: F SMITH | L377: GREENWOOD | O377: GLOVER | R377: KIDD
A378: GOALKICKERS
A379: YARRAVILLE | C379: KENNEDY 3 | F379: PLUNKETT 2 | I379: LOVETT 2 | K379: ROBERTS 2 | N379: COULSELL 2 | Q379: MILNE 2 | S379: TYSON | U379: FITZMAURICE | X379: JOYCE | Z379: DWYER
A380: PRAHRAN | C380: HILL 2 | F380: GREENWOOD | I380: KOOP | K380: BREWIS
E381: 9TH JUNE | J381: WEATHER | M381: COLD CLOUDY SHOWERS S. WIND GROUNDS BAD
A382: OAKLEIGH | C382: 2 | D382: 2 | E382: =C382*6+D382 -> 14 | G382: 7 | H382: 5 | I382: =G382*6+H382 -> 47 | K382: 8 | L382: 8 | M382: =K382*6+L382 -> 56 | O382: 11 | P382: 10 | Q382: =O382*6+P382 -> 76 | S382: PRESTON
A383: PRESTON | C383: 2 | D383: 1 | E383: =C383*6+D383 -> 13 | G383: 4 | H383: 3 | I383: =G383*6+H383 -> 27 | K383: 7 | L383: 4 | M383: =K383*6+L383 -> 46 | O383: 9 | P383: 5 | Q383: =O383*6+P383 -> 59 | S383: MORCAM
A384: BEST PLAYERS
A385: OAKLEIGH | C385: OPREY | F385: HENRY | I385: RUDOLPH | L385: THOMAS | O385: SHELTON | R385: WILTSHIRE
A386: PRESTON | C386: TAYLOR | F386: GRAY | I386: REICHMAN | L386: WHITE | O386: SUMMERS | R386: O'DOHERTY
A387: GOALKICKERS
A388: OAKLEIGH | C388: WILTSHIRE 3 | F388: MAHER 2 | I388: FLEMING 2 | L388: O'NEILL 2 | N388: ALLISON | P388: HENRY
A389: PRESTON | C389: DAVIE 3 | F389: SURTEES 2 | I389: TAYLOR 2 | L389: MCCORMACK | O389: HOLLIDAY
A391: BRUNSWICK | C391: 1 | D391: 3 | E391: =C391*6+D391 -> 9 | G391: 7 | H391: 6 | I391: =G391*6+H391 -> 48 | K391: 8 | L391: 8 | M391: =K391*6+L391 -> 56 | O391: 9 | P391: 11 | Q391: =O391*6+P391 -> 65 | S391: BRUNSWICK
A392: CAMBERWELL | C392: 0 | D392: 4 | E392: =C392*6+D392 -> 4 | G392: 2 | H392: 5 | I392: =G392*6+H392 -> 17 | K392: 5 | L392: 10 | M392: =K392*6+L392 -> 40 | O392: 7 | P392: 11 | Q392: =O392*6+P392 -> 53 | S392: STUART
A393: BEST PLAYERS
A394: BRUNSWICK | C394: THOMAS | F394: EUDEY | I394: KENNETT | L394: PETERSON | O394: FITZGERALD | R394: BLACKMORE
A395: CAMBERWELL | C395: WALLIS | F395: MURPHY | I395: QUARTERMAIN | L395: TRESIZE | O395: GREENWOOD | R395: WATERS
A396: GOALKICKERS
A397: BRUNSWICK | C397: BRAY 5 | F397: McNEILL | I397: KINNEAR | L397: PETERSON | O397: WHITELEY
A398: CAMBERWELL | C398: WALLIS 3 | F398: WATERS 2 | I398: MURPHY | L398: HARRISON
A400: ROUND 8 | E400: 14TH JUNE | J400: WEATHER | M400: CLOUDY SHOWERS N. WIND | S400: PLAYED AT | X400: LADDER | AB400: ROUND | AD400: 8
D401: 1ST QTR | H401: 2ND QTR | L401: 3RD QTR | P401: FINAL | S401: NORTHCOTE
A402: NORTHCOTE | C402: 3 | D402: 4 | E402: =C402*6+D402 -> 22 | G402: 7 | H402: 8 | I402: =G402*6+H402 -> 50 | K402: 8 | L402: 11 | M402: =K402*6+L402 -> 59 | O402: 11 | P402: 13 | Q402: =O402*6+P402 -> 79 | S402: UMPIRE | W402: TEAM | X402: W | Y402: L | Z402: D | AA402: FOR | AB402: AGST | AC402: % | AD402: PTS
A403: OAKLEIGH | C403: 0 | D403: 4 | E403: =C403*6+D403 -> 4 | G403: 2 | H403: 11 | I403: =G403*6+H403 -> 23 | K403: 2 | L403: 13 | M403: =K403*6+L403 -> 25 | O403: 7 | P403: 15 | Q403: =O403*6+P403 -> 57 | S403: McKINNON
A404: BEST PLAYERS | W404: OAKLEIGH | X404: 7 | Y404: 1 | Z404: 0 | AA404: 744 | AB404: 520 | AC404: 143.07692307692307 | AD404: 28
A405: NORTHCOTE | C405: ROSS | F405: NICHOLLS | I405: GARRETT | L405: E C BRIGGS | N405: SIMMONDS | Q405: ROWE | W405: YARRAVILLE | X405: 7 | Y405: 1 | Z405: 0 | AA405: 690 | AB405: 492 | AC405: 140.2439024390244 | AD405: 28
A406: OAKLEIGH | C406: MAHER | F406: SPAIN | I406: WILTSHIRE | L406: FRASER | N406: FLEMING | Q406: RUDOLPH | W406: PORT MELBOURNE | X406: 6 | Y406: 1 | Z406: 1 | AA406: 667 | AB406: 554 | AC406: 120.39711191335741 | AD406: 26
A407: GOALKICKERS | W407: NORTHCOTE | X407: 5 | Y407: 3 | Z407: 0 | AA407: 696 | AB407: 571 | AC407: 121.89141856392294 | AD407: 20
A408: NORTHCOTE | C408: SIMMONDS 3 | F408: SEYMOUR 2 | I408: E C BRIGGS 2 | L408: POULTER | N408: CORRIGAN | Q408: MILNE | S408: GOULLET
A409: OAKLEIGH | C409: FRASER 4 | F409: MAHER | I409: ALLISON | L409: OPREY | W409: WILLIAMSTOWN | X409: 5 | Y409: 3 | Z409: 0 | AA409: 709 | AB409: 612 | AC409: 115.84967320261438 | AD409: 20
W410: PRESTON | X410: 4 | Y410: 3 | Z410: 1 | AA410: 671 | AB410: 632 | AC410: 106.17088607594937 | AD410: 18
A411: PORT MELBOURNE | C411: 3 | D411: 2 | E411: =C411*6+D411 -> 20 | G411: 6 | H411: 5 | I411: =G411*6+H411 -> 41 | K411: 10 | L411: 12 | M411: =K411*6+L411 -> 72 | O411: 15 | P411: 14 | Q411: =O411*6+P411 -> 104 | S411: ELSTERNWICK PARK | W411: COBURG | X411: 3 | Y411: 3 | Z411: 2 | AA411: 657 | AB411: 575 | AC411: 114.26086956521739 | AD411: 16
A412: BRIGHTON | C412: 3 | D412: 2 | E412: =C412*6+D412 -> 20 | G412: 5 | H412: 7 | I412: =G412*6+H412 -> 37 | K412: 7 | L412: 10 | M412: =K412*6+L412 -> 52 | O412: 11 | P412: 19 | Q412: =O412*6+P412 -> 85 | S412: MORCOM | W412: BRIGHTON | X412: 3 | Y412: 5 | Z412: 0 | AA412: 709 | AB412: 679 | AC412: 104.41826215022091 | AD412: 12
A413: BEST PLAYERS | W413: BRUNSWICK | X413: 3 | Y413: 5 | Z413: 0 | AA413: 528 | AB413: 642 | AC413: 82.242990654205613 | AD413: 12
A414: PORT MELBOURNE | C414: STANBRIDGE | F414: LOVETT | I414: PLUMRIDGE | L414: HYDE | N414: BEDFORD | Q414: BROOKER | W414: CAMBERWELL | X414: 1 | Y414: 7 | Z414: 0 | AA414: 548 | AB414: 734 | AC414: 74.659400544959126 | AD414: 4
A415: BRIGHTON | C415: LILBURNE | F415: BORLAND | I415: SMITH | L415: SCHENCK | N415: HUNT | Q415: BESWICK | W415: SANDRINGHAM | X415: 1 | Y415: 7 | Z415: 0 | AA415: 634 | AB415: 949 | AC415: 66.80716543730243 | AD415: 4
A416: GOALKICKERS | W416: PRAHRAN | X416: 1 | Y416: 7 | Z416: 0 | AA416: 509 | AB416: 802 | AC416: 63.466334164588531 | AD416: 4
A417: PORT MELBOURNE | C417: WILKIN 5 | E417: PLUMRIDGE 2 | H417: BARNES 2 | J417: BILLS 2 | L417: TYSON | N417: STANBRIDGE | Q417: FISHER | S417: WYATT
A418: BRIGHTON | C418: B SMITH 3 | F418: TULLOH 2 | I418: HUNT 2 | K418: TUCKER 2 | N418: LILBURNE | Q418: BURNES
A420: COBURG | C420: 1 | D420: 6 | E420: =C420*6+D420 -> 12 | G420: 9 | H420: 10 | I420: =G420*6+H420 -> 64 | K420: 12 | L420: 13 | M420: =K420*6+L420 -> 85 | O420: 17 | P420: 15 | Q420: =O420*6+P420 -> 117 | S420: COBURG
A421: CAMBERWELL | C421: 3 | D421: 2 | E421: =C421*6+D421 -> 20 | G421: 4 | H421: 5 | I421: =G421*6+H421 -> 29 | K421: 8 | L421: 11 | M421: =K421*6+L421 -> 59 | O421: 9 | P421: 15 | Q421: =O421*6+P421 -> 69 | S421: CARRUTHERS
A422: BEST PLAYERS
A423: COBURG | C423: JENKINS | F423: KIGHT | I423: MARTIN | L423: CHARLESTON | P423: VOIGHT | S423: CHAPMAN
A424: CAMBERWELL | C424: PAGE | F424: MURPHY | I424: BARKER | L424: HARRISON | P424: JACKSON | S424: GREENWOOD
A425: GOALKICKERS
A426: COBURG | C426: PLANT 6 | F426: MEARS 3 | I426: BERTRAM 3 | L426: COLBERT 2 | O426: HARRIS | Q426: JENKINS | S426: LOWE
A427: CAMBERWELL | C427: PAGE 2 | F427: MURPHY 2 | I427: GREENWOOD 2 | L427: DYBALL | N427: JONES | P427: WHITTY
A429: PRESTON | C429: 6 | D429: 2 | E429: =C429*6+D429 -> 38 | G429: 12 | H429: 6 | I429: =G429*6+H429 -> 78 | K429: 15 | L429: 7 | M429: =K429*6+L429 -> 97 | O429: 19 | P429: 13 | Q429: =O429*6+P429 -> 127 | S429: BEACH ROAD
A430: SANDRINGHAM | C430: 2 | D430: 6 | E430: =C430*6+D430 -> 18 | G430: 7 | H430: 12 | I430: =G430*6+H430 -> 54 | K430: 12 | L430: 16 | M430: =K430*6+L430 -> 88 | O430: 15 | P430: 19 | Q430: =O430*6+P430 -> 109 | S430: LESTER
A431: BEST PLAYERS
A432: PRESTON | C432: McCORMACK | F432: PETCHELL | I432: SURTEES | L432: HICKEY | P432: DAVIE | S432: GRAY
A433: SANDRINGHAM | C433: E BOURKE | F433: BAZIN | I433: BOYD | L433: JOHNSTONE | P433: R KENNA | S433: BRIDGFORD
A434: GOALKICKERS
A435: PRESTON | C435: McCORMACK 8 | G435: DAVIE 7 | I435: SURTEES | K435: GALL | M435: TAYLOR | O435: HOLLIDAY
A436: SANDRINGHAM | C436: JOHNSTONE 5 | F436: R KENNA 3 | I436: BOYD 2 | K436: DOCKENDORFF 2 | N436: SMITH | P436: McAULIFFE | S436: QUINN
A438: WILLIAMSTOWN | C438: 5 | D438: 5 | E438: =C438*6+D438 -> 35 | G438: 8 | H438: 7 | I438: =G438*6+H438 -> 55 | K438: 11 | L438: 13 | M438: =K438*6+L438 -> 79 | O438: 15 | P438: 15 | Q438: =O438*6+P438 -> 105 | S438: TOORAK PARK
A439: PRAHRAN | C439: 5 | D439: 2 | E439: =C439*6+D439 -> 32 | G439: 8 | H439: 7 | I439: =G439*6+H439 -> 55 | K439: 12 | L439: 7 | M439: =K439*6+L439 -> 79 | O439: 15 | P439: 9 | Q439: =O439*6+P439 -> 99 | S439: McINERNEY
A440: BEST PLAYERS
A441: WILLIAMSTOWN | C441: J O'BRIEN | F441: W O'BRIEN | I441: JOHNS | L441: CAHILL | O441: SINCLAIR | R441: FLYNN
A442: PRAHRAN | C442: HILL | F442: GREENWOOD | I442: LORD | L442: KOOP | O442: PARRIS | R442: DUNN
A443: GOALKICKERS
A444: WILLIAMSTOWN | C444: J O'BRIEN 4 | F444: CAHILL 3 | I444: SINCLAIR 2 | L444: FLYNN 2 | N444: BLAKE | P444: W O'BRIEN | R444: BARNES | U444: DIXON
A445: PRAHRAN | C445: HILL 4 | E445: DUNN 3 | G445: ANDERSON 2 | J445: LORD 2 | L445: GREENWOOD | O445: JORDAN | Q445: KIDD | S445: LAMPREY
A447: YARRAVILLE | C447: 1 | D447: 7 | E447: =C447*6+D447 -> 13 | G447: 4 | H447: 7 | I447: =G447*6+H447 -> 31 | K447: 6 | L447: 7 | M447: =K447*6+L447 -> 43 | O447: 10 | P447: 9 | Q447: =O447*6+P447 -> 69 | S447: BRUNSWICK
A448: BRUNSWICK | C448: 2 | D448: 3 | E448: =C448*6+D448 -> 15 | G448: 2 | H448: 5 | I448: =G448*6+H448 -> 17 | K448: 3 | L448: 7 | M448: =K448*6+L448 -> 25 | O448: 3 | P448: 9 | Q448: =O448*6+P448 -> 27 | S448: STREET
A449: BEST PLAYERS
A450: YARRAVILLE | C450: DWYER | F450: HUNTER | I450: KENNEDY | L450: FITZMAURICE | O450: HARRISON | R450: FARRELL
A451: BRUNSWICK | C451: KENNETT | F451: WHITELEY | I451: THOMPSON | L451: BRAY | O451: PROUDFOOT | R451: FITZGERALD
A452: GOALKICKERS
A453: YARRAVILLE | C453: KENNEDY 5 | F453: COULSELL 2 | I453: LOVETT | L453: ROBERTSON | O453: CAMERON
A454: BRUNSWICK | C454: BRAY | F454: KINNEAR | I454: HEARN
A456: ROUND 9 | E456: 21ST JUNE | H456: WEATHER | K456: CLOUDY BUT FINE S BREEZE GROUNDS BAD | S456: PLAYED AT | X456: LADDER | AB456: ROUND | AD456: 9
D457: 1ST QTR | H457: 2ND QTR | L457: 3RD QTR | P457: FINAL | S457: WILLIAMSTOWN
A458: NORTHCOTE | C458: 2 | D458: 1 | E458: =C458*6+D458 -> 13 | G458: 6 | H458: 4 | I458: =G458*6+H458 -> 40 | K458: 9 | L458: 7 | M458: =K458*6+L458 -> 61 | O458: 11 | P458: 9 | Q458: =O458*6+P458 -> 75 | S458: UMPIRE | W458: TEAM | X458: W | Y458: L | Z458: D | AA458: FOR | AB458: AGST | AC458: % | AD458: PTS
A459: WILLIAMSTOWN | C459: 2 | D459: 10 | E459: =C459*6+D459 -> 22 | G459: 2 | H459: 14 | I459: =G459*6+H459 -> 26 | K459: 5 | L459: 17 | M459: =K459*6+L459 -> 47 | O459: 7 | P459: 20 | Q459: =O459*6+P459 -> 62 | S459: MORCOM
A460: BEST PLAYERS | W460: PORT MELBOURNE | X460: 7 | Y460: 1 | Z460: 1 | AA460: 765 | AB460: 629 | AC460: 121.62162162162163 | AD460: 30
A461: NORTHCOTE | C461: SEYMOUR | F461: ROWE | H461: GOULLET | K461: MILNE | N461: NICHOLLS | Q461: PERKINS | W461: OAKLEIGH | X461: 7 | Y461: 2 | Z461: 0 | AA461: 805 | AB461: 592 | AC461: 135.97972972972974 | AD461: 28
A462: WILLIAMSTOWN | C462: HELLWIG | F462: CAHILL | H462: SYKES | K462: SHANAHAN | N462: W O'BRIEN | W462: YARRAVILLE | X462: 7 | Y462: 2 | Z462: 0 | AA462: 766 | AB462: 573 | AC462: 133.68237347294939 | AD462: 28
A463: GOALKICKERS | W463: NORTHCOTE | X463: 6 | Y463: 3 | Z463: 0 | AA463: 771 | AB463: 633 | AC463: 121.80094786729858 | AD463: 24
A464: NORTHCOTE | C464: SEYMOUR 6 | F464: SIMMONDS 2 | I464: ROSS | J464: MILNE | L464: GARRETT
A465: WILLIAMSTOWN | C465: BARNES 2 | F465: SINCLAIR | I465: McDONALD | L465: BLAKE | N465: CAHILL | P465: FLYNN | W465: PRESTON | X465: 5 | Y465: 3 | Z465: 1 | AA465: 752 | AB465: 708 | AC465: 106.21468926553672 | AD465: 22
W466: COBURG | X466: 4 | Y466: 3 | Z466: 2 | AA466: 729 | AB466: 636 | AC466: 114.62264150943396 | AD466: 20
A467: PRESTON | C467: 3 | D467: 3 | E467: =C467*6+D467 -> 21 | G467: 10 | H467: 6 | I467: =G467*6+H467 -> 66 | K467: 12 | L467: 8 | M467: =K467*6+L467 -> 80 | O467: 12 | P467: 9 | Q467: =O467*6+P467 -> 81 | S467: PRESTON | W467: WILLIAMSTOWN | X467: 5 | Y467: 4 | Z467: 0 | AA467: 771 | AB467: 687 | AC467: 112.22707423580786 | AD467: 20
A468: YARRAVILLE | C468: 3 | D468: 4 | E468: =C468*6+D468 -> 22 | G468: 6 | H468: 5 | I468: =G468*6+H468 -> 41 | K468: 9 | L468: 6 | M468: =K468*6+L468 -> 60 | O468: 11 | P468: 10 | Q468: =O468*6+P468 -> 76 | S468: COLEMAN | W468: BRIGHTON | X468: 3 | Y468: 6 | Z468: 0 | AA468: 783 | AB468: 766 | AC468: 102.21932114882506 | AD468: 12
A469: BEST PLAYERS | W469: BRUNSWICK | X469: 3 | Y469: 6 | Z469: 0 | AA469: 600 | AB469: 740 | AC469: 81.081081081081081 | AD469: 12
A470: PRESTON | C470: SUMMERS | F470: HICKEY | I470: UNDERHILL | L470: O'DOHERTY | O470: DAVIE | Q470: SURTEES | W470: CAMBERWELL | X470: 2 | Y470: 7 | Z470: 0 | AA470: 635 | AB470: 808 | AC470: 78.589108910891085 | AD470: 8
A471: YARRAVILLE | C471: FITZMAURICE | F471: HUNTER | I471: KENNEDY | L471: SHERMAN | O471: DRISCOLL | Q471: FARRELL | W471: PRAHRAN | X471: 2 | Y471: 7 | Z471: 0 | AA471: 607 | AB471: 874 | AC471: 69.450800915331811 | AD471: 8
A472: GOALKICKERS | W472: SANDRINGHAM | X472: 1 | Y472: 8 | Z472: 0 | AA472: 709 | AB472: 1047 | AC472: 67.717287488061132 | AD472: 4
A473: PRESTON | C473: DAVIE 3 | E473: MCCORMACK 3 | H473: HOLLIDAY 2 | K473: GALL | M473: SUMMERS | O473: TAYLOR | Q473: LEVER
A474: YARRAVILLE | C474: TYSON 3 | E474: FITZMAURICE 3 | H474: DRISCOLL 3 | K474: LOVETT 2
A476: COBURG | C476: 3 | D476: 6 | E476: =C476*6+D476 -> 24 | G476: 3 | H476: 8 | I476: =G476*6+H476 -> 26 | K476: 7 | L476: 11 | M476: =K476*6+L476 -> 53 | O476: 10 | P476: 12 | Q476: =O476*6+P476 -> 72 | S476: OAKLEIGH
A477: OAKLEIGH | C477: 2 | D477: 2 | E477: =C477*6+D477 -> 14 | G477: 6 | H477: 4 | I477: =G477*6+H477 -> 40 | K477: 6 | L477: 5 | M477: =K477*6+L477 -> 41 | O477: 9 | P477: 7 | Q477: =O477*6+P477 -> 61 | S477: ASHMORE
A478: BEST PLAYERS
A479: COBURG | C479: MARTIN | F479: MEARS | I479: KIGHT | L479: GREGORY | O479: VOIGHT | R479: LOWE
A480: OAKLEIGH | C480: RUDOLPH | F480: THOMAS | I480: BEASLEY | L480: FRASER | O480: MAHER | R480: GODING
A481: GOALKICKERS
A482: COBURG | C482: PLANT 3 | F482: BERTRAM 3 | I482: COLBERT 3 | L482: MEARS
A483: OAKLEIGH | C483: FRASER 4 | F483: ALLISON 2 | I483: WILTSHIRE | L483: OPREY | N483: CHAPMAN
A485: CAMBERWELL | C485: 1 | D485: 0 | E485: =C485*6+D485 -> 6 | G485: 6 | H485: 8 | I485: =G485*6+H485 -> 44 | K485: 8 | L485: 13 | M485: =K485*6+L485 -> 61 | O485: 11 | P485: 21 | Q485: =O485*6+P485 -> 87 | S485: CAMBERWELL
A486: BRIGHTON | C486: 4 | D486: 4 | E486: =C486*6+D486 -> 28 | G486: 4 | H486: 4 | I486: =G486*6+H486 -> 28 | K486: 10 | L486: 5 | M486: =K486*6+L486 -> 65 | O486: 11 | P486: 8 | Q486: =O486*6+P486 -> 74 | S486: McKINNON
A487: BEST PLAYERS
A488: CAMBERWELL | C488: BOOTHMAN | F488: BLACK | I488: HARVEY | L488: GREENWOOD | O488: WALLIS | R488: PETRIE
A489: BRIGHTON | C489: DORE | F489: BORLAND | I489: BURNES | L489: TUCKER | O489: CLOTZ | R489: BARNES
A490: GOALKICKERS
A491: CAMBERWELL | C491: GREENWOOD 4 | F491: PETRIE 3 | I491: PAGE | K491: WALLIS | M491: HARVEY
A492: BRIGHTON | C492: B SMITH 3 | F492: TUCKER 2 | I492: BURNES 2 | K492: BORLAND 2 | N492: HUNT | P492: BOCK
A494: PRAHRAN | C494: 4 | D494: 5 | E494: =C494*6+D494 -> 29 | G494: 8 | H494: 7 | I494: =G494*6+H494 -> 55 | K494: 13 | L494: 11 | M494: =K494*6+L494 -> 89 | O494: 14 | P494: 14 | Q494: =O494*6+P494 -> 98 | S494: TOORAK PARK
A495: BRUNSWICK | C495: 3 | D495: 1 | E495: =C495*6+D495 -> 19 | G495: 4 | H495: 9 | I495: =G495*6+H495 -> 33 | K495: 5 | L495: 11 | M495: =K495*6+L495 -> 41 | O495: 10 | P495: 12 | Q495: =O495*6+P495 -> 72 | S495: SCHAEFER
A496: BEST PLAYERS
A497: PRAHRAN | C497: LORD | F497: NECK | I497: ANDERSON | L497: PARRIS | O497: GLYDE | R497: GLOVER
A498: BRUNSWICK | C498: BRIGHT | F498: MURPHY | I498: FITZGERALD | L498: KENNETT | O498: PROUDFOOT | R498: THOMPSON
A499: GOALKICKERS
A500: PRAHRAN | C500: GLYDE 5 | E500: LORD 4 | G500: DUNN 2 | I500: ANDERSON | L500: JORDAN | N500: LAMPREY
A501: BRUNSWICK | C501: KINNEAR 5 | F501: JACOBSON | I501: BRAY | L501: HEARN
A503: PORT MELBOURNE | C503: 2 | D503: 4 | E503: =C503*6+D503 -> 16 | G503: 6 | H503: 13 | I503: =G503*6+H503 -> 49 | K503: 7 | L503: 19 | M503: =K503*6+L503 -> 61 | O503: 11 | P503: 32 | Q503: =O503*6+P503 -> 98 | S503: NORTHCOTE
A504: SANDRINGHAM | C504: 5 | D504: 7 | E504: =C504*6+D504 -> 37 | G504: 5 | H504: 8 | I504: =G504*6+H504 -> 38 | K504: 8 | L504: 15 | M504: =K504*6+L504 -> 63 | O504: 10 | P504: 15 | Q504: =O504*6+P504 -> 75 | S504: McINERNEY
A505: BEST PLAYERS
A506: PORT MELBOURNE | C506: HYDE | F506: STANBRIDGE | I506: TYSON | L506: LEONARD | O506: BILLS | R506: BARNES
A507: SANDRINGHAM | C507: DOCKENDORFF | F507: BOYD | I507: E BOURKE | L507: QUINN | O507: NAGEL | R507: ANDERSON
A508: GOALKICKERS
A509: PORT MELBOURNE | C509: PLUMRIDGE 2 | F509: BARNES 2 | I509: TYSON 2 | K509: FISHER 2 | M509: WILKIN | O509: BILLS | Q509: BOLWELL
A510: SANDRINGHAM | C510: DOCKENDORFF 5 | G510: DE LUCA 2 | J510: JOHNSTONE 2 | M510: BOYD
A512: ROUND 10 | E512: 28TH JUNE | J512: WEATHER | M512: FINE MILD LIGHT N BREEZE | S512: PLAYED AT | X512: LADDER | AB512: ROUND | AD512: 10
D513: 1ST QTR | H513: 2ND QTR | L513: 3RD QTR | P513: FINAL | S513: COBURG
A514: WILLIAMSTOWN | C514: 2 | D514: 3 | E514: =C514*6+D514 -> 15 | G514: 8 | H514: 9 | I514: =G514*6+H514 -> 57 | K514: 10 | L514: 11 | M514: =K514*6+L514 -> 71 | O514: 15 | P514: 14 | Q514: =O514*6+P514 -> 104 | S514: UMPIRE | W514: TEAM | X514: W | Y514: L | Z514: D | AA514: FOR | AB514: AGST | AC514: % | AD514: PTS
A515: COBURG | C515: 1 | D515: 7 | E515: =C515*6+D515 -> 13 | G515: 5 | H515: 9 | I515: =G515*6+H515 -> 39 | K515: 7 | L515: 11 | M515: =K515*6+L515 -> 53 | O515: 10 | P515: 15 | Q515: =O515*6+P515 -> 75 | S515: STUART
A516: BEST PLAYERS | W516: PORT MELBOURNE | X516: 8 | Y516: 1 | Z516: 1 | AA516: 843 | AB516: 706 | AC516: 119.40509915014164 | AD516: 34
A517: WILLIAMSTOWN | C517: SYKES | E517: CAHILL | H517: BYRNE | K517: J O'BRIEN | N517: SINCLAIR | Q517: JOHNS | W517: YARRAVILLE | X517: 8 | Y517: 2 | Z517: 0 | AA517: 905 | AB517: 642 | AC517: 140.96573208722742 | AD517: 32
A518: COBURG | C518: KIGHT | E518: HARRIS | H518: VOIGHT | K518: LEAHY | N518: COLBERT | Q518: MEARS | W518: OAKLEIGH | X518: 8 | Y518: 2 | Z518: 0 | AA518: 931 | AB518: 664 | AC518: 140.21084337349399 | AD518: 32
A519: GOALKICKERS | W519: NORTHCOTE | X519: 7 | Y519: 3 | Z519: 0 | AA519: 874 | AB519: 727 | AC519: 120.2200825309491 | AD519: 28
A520: WILLIAMSTOWN | C520: J O'BRIEN 4 | F520: SINCLAIR 4 | I520: McDONALD 3 | L520: BLAKE 2 | N520: CAHILL | P520: JOHNS
A521: COBURG | C521: PLANT 3 | F521: MEARS 3 | I521: VOIGHT 2 | L521: COLBERT 2 | W521: PRESTON | X521: 6 | Y521: 3 | Z521: 1 | AA521: 843 | AB521: 795 | AC521: 106.0377358490566 | AD521: 26
W522: WILLIAMSTOWN | X522: 6 | Y522: 4 | Z522: 0 | AA522: 875 | AB522: 762 | AC522: 114.82939632545931 | AD522: 24
A523: PRESTON | C523: 5 | D523: 2 | E523: =C523*6+D523 -> 32 | G523: 9 | H523: 6 | I523: =G523*6+H523 -> 60 | K523: 12 | L523: 10 | M523: =K523*6+L523 -> 82 | O523: 13 | P523: 13 | Q523: 91 | S523: PRESTON | W523: COBURG | X523: 4 | Y523: 4 | Z523: 2 | AA523: 804 | AB523: 740 | AC523: 108.64864864864865 | AD523: 20
A524: BRIGHTON | C524: 1 | D524: 5 | E524: =C524*6+D524 -> 11 | G524: 2 | H524: 8 | I524: =G524*6+H524 -> 20 | K524: 9 | L524: 12 | M524: =K524*6+L524 -> 66 | O524: 12 | P524: 15 | Q524: 87 | S524: FROOD | W524: BRIGHTON | X524: 3 | Y524: 7 | Z524: 0 | AA524: 870 | AB524: 857 | AC524: 101.5169194865811 | AD524: 12
A525: BEST PLAYERS | W525: BRUNSWICK | X525: 3 | Y525: 7 | Z525: 0 | AA525: 677 | AB525: 818 | AC525: 82.762836185819069 | AD525: 12
A526: PRESTON | C526: PETCHELL | E526: MILLER | H526: SUMMERS | K526: TAYLOR | N526: GRAY | Q526: UNDERHILL | W526: CAMBERWELL | X526: 2 | Y526: 8 | Z526: 0 | AA526: 729 | AB526: 911 | AC526: 80.021953896816683 | AD526: 8
A527: BRIGHTON | C527: HUNT | E527: BESWICK | H527: FORDHAM | K527: CROSSEN | N527: TULLOH | Q527: SCHENCK | W527: PRAHRAN | X527: 2 | Y527: 8 | Z527: 0 | AA527: 679 | AB527: 1000 | AC527: 67.9 | AD527: 8
A528: GOALKICKERS | W528: SANDRINGHAM | X528: 1 | Y528: 9 | Z528: 0 | AA528: 778 | AB528: 1186 | AC528: 65.598650927487355 | AD528: 4
A529: PRESTON | C529: MCCORMACK 5 | F529: DAVIE 3 | H529: CAMPBELL 2 | K529: SURTEES | M529: PETCHELL | O529: GALL
A530: BRIGHTON | C530: TULLOH 4 | F530: B SMITH 3 | I530: LILBURNE 2 | L530: BURNES | N530: BESWICK | Q530: CROSSAN
A532: NORTHCOTE | C532: 4 | D532: 5 | E532: =C532*6+D532 -> 29 | G532: 10 | H532: 10 | I532: =G532*6+H532 -> 70 | K532: 13 | L532: 12 | M532: =K532*6+L532 -> 90 | O532: 15 | P532: 13 | Q532: =O532*6+P532 -> 103 | S532: CAMBERWELL
A533: CAMBERWELL | C533: 2 | D533: 3 | E533: =C533*6+D533 -> 15 | G533: 6 | H533: 6 | I533: =G533*6+H533 -> 42 | K533: 9 | L533: 8 | M533: =K533*6+L533 -> 62 | O533: 14 | P533: 10 | Q533: =O533*6+P533 -> 94 | S533: ASHMORE
A534: BEST PLAYERS
A535: NORTHCOTE | C535: SEYMOUR | E535: COCKRAM | H535: ROWE | K535: COLE | M535: NICHOLLS | P535: WILSON
A536: CAMBERWELL | C536: HUNTER | E536: HARVEY | H536: MURPHY | K536: HARRISON | M536: WALLIS | P536: JONES
A537: GOALKICKERS
A538: NORTHCOTE | C538: SEYMOUR 11 | F538: POULTER 2 | I538: MILNE | K538: COLE
A539: CAMBERWELL | C539: MURPHY 3 | E539: PAGE 2 | G539: WALLIS 2 | I539: GREENWOOD 2 | L539: PETRIE | N539: QUARTERMAN | Q539: HARRISON | T539: WHITTY | W539: MAGRATH
A541: PORT MELBOURNE | C541: 3 | D541: 2 | E541: =C541*6+D541 -> 20 | G541: 6 | H541: 3 | I541: =G541*6+H541 -> 39 | K541: 8 | L541: 8 | M541: =K541*6+L541 -> 56 | O541: 11 | P541: 12 | Q541: =O541*6+P541 -> 78 | S541: BRUNSWICK
A542: BRUNSWICK | C542: 2 | D542: 8 | E542: =C542*6+D542 -> 20 | G542: 5 | H542: 11 | I542: =G542*6+H542 -> 41 | K542: 8 | L542: 16 | M542: =K542*6+L542 -> 64 | O542: 10 | P542: 17 | Q542: =O542*6+P542 -> 77 | S542: McKINNON
A543: BEST PLAYERS
A544: PORT MELBOURNE | C544: BOLWELL | F544: PERRETT | I544: HYDE | L544: STANBRIDGE | O544: McINNES | Q544: ERRIDGE
A545: BRUNSWICK | C545: FITZGERALD | F545: THOMPSON | I545: BRAY | L545: MURPHY | O545: BIRD | Q545: JOHNSTONE
A546: GOALKICKERS
A547: PORT MELBOURNE | C547: BARNES 3 | F547: BEDFORD 3 | I547: PLUMRIDGE 2 | L547: BOLWELL 2 | O547: FISHER
A548: BRUNSWICK | C548: McINERNEY 4 | F548: BOLMAN 2 | I548: JOHNSTON | L548: PENMAN | N548: FITZGERALD | Q548: PROUDFOOT
A550: OAKLEIGH | C550: 4 | D550: 2 | E550: =C550*6+D550 -> 26 | G550: 9 | H550: 6 | I550: =G550*6+H550 -> 60 | K550: 12 | L550: 6 | M550: =K550*6+L550 -> 78 | O550: 19 | P550: 12 | Q550: =O550*6+P550 -> 126 | S550: OAKLEIGH
A551: PRAHRAN | C551: 2 | D551: 2 | E551: =C551*6+D551 -> 14 | G551: 6 | H551: 3 | I551: =G551*6+H551 -> 39 | K551: 8 | L551: 5 | M551: =K551*6+L551 -> 53 | O551: 11 | P551: 6 | Q551: =O551*6+P551 -> 72 | S551: SCHAEFER
A552: BEST PLAYERS
A553: OAKLEIGH | C553: MAHER | F553: RUDOLPH | J553: MORRIS | M553: SPAIN | P553: CHAPMAN | S553: FERGUSON
A554: PRAHRAN | C554: OSBORNE | F554: BEAUMONT | J554: FLOWERS | M554: KOOP | P554: BURKE | S554: SMITH
A555: GOALKICKERS
A556: OAKLEIGH | C556: FRASER 8 | E556: MAHER 4 | G556: FLEMING 3 | J556: ALLISON 2 | M556: O'NEILL | O556: BEASLEY
A557: PRAHRAN | C557: LORD 5 | E557: ANDERSON | H557: JORDAN | J557: DUNN | L557: GLYDE | N557: BEAUMONT | Q557: GLOVER
A559: YARRAVILLE | C559: 7 | D559: 4 | E559: =C559*6+D559 -> 46 | G559: 10 | H559: 6 | I559: =G559*6+H559 -> 66 | K559: 14 | L559: 15 | M559: =K559*6+L559 -> 99 | O559: 20 | P559: 19 | Q559: =O559*6+P559 -> 139 | S559: YARRAVILLE
A560: SANDRINGHAM | C560: 1 | D560: 1 | E560: =C560*6+D560 -> 7 | G560: 4 | H560: 7 | I560: =G560*6+H560 -> 31 | K560: 6 | L560: 10 | M560: =K560*6+L560 -> 46 | O560: 9 | P560: 15 | Q560: =O560*6+P560 -> 69 | S560: LESTER
A561: BEST PLAYERS
A562: YARRAVILLE | C562: EDWARDS | F562: HUNTER | J562: FITZMAURICE | M562: LOVETT | P562: DRISCOLL
A563: SANDRINGHAM | C563: JAMIESON | F563: DOCKENDORFF | J563: QUINN | M563: E BOURKE | P563: BAZIN | S563: BRIDGFORD
A564: GOALKICKERS
A565: YARRAVILLE | C565: DRISCOLL 6 | F565: SMITH 4 | H565: KENNEDY 2 | K565: LOVETT 2 | M565: TYSON | O565: CAMERON | Q565: ROBERTS | S565: JOYCE | U565: THOMAS | X565: ROWE
A566: SANDRINGHAM | C566: SMITH 3 | E566: DOCKENDORFF 2 | I566: BOYD | K566: DE LUCA | M566: R KENNA | O566: RAYMENT
A568: ROUND 11 | E568: 5TH JULY | J568: WEATHER | M568: FINE LIGHT NORTH BREEZE | S568: PLAYED AT | X568: LADDER | AB568: ROUND | AD568: 11
D569: 1ST QTR | H569: 2ND QTR | L569: 3RD QTR | P569: FINAL | S569: YARRAVILLE
A570: OAKLEIGH | C570: 4 | D570: 3 | E570: =C570*6+D570 -> 27 | G570: 4 | H570: 6 | I570: =G570*6+H570 -> 30 | K570: 8 | L570: 9 | M570: =K570*6+L570 -> 57 | O570: 10 | P570: 9 | Q570: =O570*6+P570 -> 69 | S570: UMPIRE | W570: TEAM | X570: W | Y570: L | Z570: D | AA570: FOR | AB570: AGST | AC570: % | AD570: PTS
A571: YARRAVILLE | C571: 1 | D571: 1 | E571: =C571*6+D571 -> 7 | G571: 4 | H571: 6 | I571: =G571*6+H571 -> 30 | K571: 6 | L571: 6 | M571: =K571*6+L571 -> 42 | O571: 9 | P571: 8 | Q571: =O571*6+P571 -> 62 | S571: McKINNON
A572: BEST PLAYERS | W572: OAKLEIGH | X572: 9 | Y572: 2 | Z572: 0 | AA572: 1000 | AB572: 726 | AC572: 137.74104683195591 | AD572: 36
A573: OAKLEIGH | C573: BEASLEY | F573: THOMAS | I573: RUDOLPH | L573: DRIVER | O573: YEMM | Q573: DOLAN | W573: PORT MELBOURNE | X573: 8 | Y573: 2 | Z573: 1 | AA573: 909 | AB573: 796 | AC573: 114.19597989949749 | AD573: 34
A574: YARRAVILLE | C574: FITZMAURICE | F574: HUNTER | I574: DWYER | L574: THOMAS | O574: FARRELL | Q574: BUTLER | W574: YARRAVILLE | X574: 8 | Y574: 3 | Z574: 0 | AA574: 967 | AB574: 711 | AC574: 136.00562587904361 | AD574: 32
A575: GOALKICKERS | W575: NORTHCOTE | X575: 8 | Y575: 3 | Z575: 0 | AA575: 1034 | AB575: 837 | AC575: 123.53643966547192 | AD575: 32
A576: OAKLEIGH | C576: ALLISON 4 | F576: MAHER 2 | I576: FRASER 2 | L576: SPAIN | N576: YEMM
A577: YARRAVILLE | C577: DRISCOLL 3 | F577: LOVETT 2 | I577: THOMAS 2 | L577: FITZMAURICE | O577: SMITH | W577: PRESTON | X577: 7 | Y577: 3 | Z577: 1 | AA577: 924 | AB577: 869 | AC577: 106.33 | AD577: 30
W578: WILLIAMSTOWN | X578: 7 | Y578: 4 | Z578: 0 | AA578: 965 | AB578: 828 | AC578: 116.54589371980677 | AD578: 28
A579: WILLIAMSTOWN | C579: 4 | D579: 3 | E579: =C579*6+D579 -> 27 | G579: 8 | H579: 7 | I579: =G579*6+H579 -> 55 | K579: 11 | L579: 10 | M579: =K579*6+L579 -> 76 | O579: 13 | P579: 12 | Q579: =O579*6+P579 -> 90 | S579: WILLIAMSTOWN | W579: COBURG | X579: 5 | Y579: 4 | Z579: 2 | AA579: 935 | AB579: 838 | AC579: 111.57517899761336 | AD579: 24
A580: PORT MELBOURNE | C580: 3 | D580: 1 | E580: =C580*6+D580 -> 19 | G580: 6 | H580: 5 | I580: =G580*6+H580 -> 41 | K580: 7 | L580: 9 | M580: =K580*6+L580 -> 51 | O580: 9 | P580: 12 | Q580: =O580*6+P580 -> 66 | S580: MORCOM | W580: BRIGHTON | X580: 4 | Y580: 7 | Z580: 0 | AA580: 997 | AB580: 950 | AC580: 104.94736842105263 | AD580: 16
A581: BEST PLAYERS | W581: BRUNSWICK | X581: 3 | Y581: 8 | Z581: 0 | AA581: 787 | AB581: 978 | AC581: 80.470347648261765 | AD581: 12
A582: WILLIAMSTOWN | C582: J O'BRIEN | F582: BYRNE | I582: SHANAHAN | L582: FLYNN | O582: HELLWIG | Q582: CAHILL | W582: CAMBERWELL | X582: 2 | Y582: 9 | Z582: 0 | AA582: 803 | AB582: 992 | AC582: 80.95 | AD582: 8
A583: PORT MELBOURNE | C583: STANBRIDGE | F583: FISHER | I583: ERRIDGE | L583: BEDFORD | O583: HYDE | Q583: PERRETT | W583: PRAHRAN | X583: 2 | Y583: 9 | Z583: 0 | AA583: 772 | AB583: 1127 | AC583: 68.50044365572316 | AD583: 8
A584: GOALKICKERS | W584: SANDRINGHAM | X584: 1 | Y584: 10 | Z584: 0 | AA584: 876 | AB584: 1317 | AC584: 66.514806378132121 | AD584: 4
A585: WILLIAMSTOWN | C585: J O'BRIEN 7 | F585: SINCLAIR 2 | I585: McDONALD | L585: CAHILL | N585: T BYRNE | Q585: BARNES
A586: PORT MELBOURNE | C586: BEDFORD 4 | F586: BOLWELL 2 | I586: PLUMRIDGE | L586: LOVETT | N586: JOYCE
A588: NORTHCOTE | C588: 6 | D588: 4 | E588: =C588*6+D588 -> 40 | G588: 12 | H588: 11 | I588: =G588*6+H588 -> 83 | K588: 18 | L588: 13 | M588: =K588*6+L588 -> 121 | O588: 24 | P588: 16 | Q588: =O588*6+P588 -> 160 | S588: NORTHCOTE
A589: BRUNSWICK | C589: 3 | D589: 3 | E589: =C589*6+D589 -> 21 | G589: 7 | H589: 6 | I589: =G589*6+H589 -> 48 | K589: 11 | L589: 9 | M589: =K589*6+L589 -> 75 | O589: 16 | P589: 14 | Q589: =O589*6+P589 -> 110 | S589: McINERNEY
A590: BEST PLAYERS
A591: NORTHCOTE | C591: GRAY | F591: PERKINS | I591: E .C .BRIGGS | L591: WOODS | O591: SEYMOUR | R591: NICHOLLS
A592: BRUNSWICK | C592: WARDEN | F592: BLACKMORE | I592: WHITELEY | L592: MURPHY | O592: ALESSIO | R592: PENMAN
A593: GOALKICKERS
A594: NORTHCOTE | C594: SEYMOUR 9 | F594: GRAY 6 | I594: ROSS 4 | K594: SIMMONDS 3 | N594: POULTER | P594: HONIG
A595: BRUNSWICK | C595: WARDEN 4 | F595: PENMAN 3 | I595: BLACKMORE 2 | L595: BEARD 2 | N595: BRAY | P595: BEGGS | R595: THOMPSON | U595: ALESSIO | X595: McCABE
A597: BRIGHTON | C597: 3 | D597: 4 | E597: =C597*6+D597 -> 22 | G597: 7 | H597: 6 | I597: =G597*6+H597 -> 48 | K597: 13 | L597: 15 | M597: =K597*6+L597 -> 93 | O597: 18 | P597: 19 | Q597: =O597*6+P597 -> 127 | S597: ELSTERNWICK PARK
A598: PRAHRAN | C598: 3 | D598: 4 | E598: =C598*6+D598 -> 22 | G598: 6 | H598: 9 | I598: =G598*6+H598 -> 45 | K598: 6 | L598: 13 | M598: =K598*6+L598 -> 49 | O598: 13 | P598: 15 | Q598: =O598*6+P598 -> 93 | S598: SCHAEFER
A599: BEST PLAYERS
A600: BRIGHTON | C600: LILBURNE | F600: B SMITH | I600: TUCKER | L600: FORDHAM | O600: BURNES | R600: BORLAND
A601: PRAHRAN | C601: F SMITH | F601: KOOP | I601: FLOWERS | L601: DONOGHUE | O601: JORDAN | R601: ANDERSON
A602: GOALKICKERS
A603: BRIGHTON | C603: LILBURNE 4 | F603: BURNES 4 | I603: PETERSON 3 | L603: B SMITH 3 | N603: HUNT 2 | P603: TULLOH | R603: TUCKER
A604: PRAHRAN | C604: GLYDE 3 | E604: ANDERSON 2 | H604: GREENWOOD 2 | K604: RENNIE 2 | M604: DONOHUE 2 | P604: JORDAN | R604: KIDD
A606: PRESTON | C606: 3 | D606: 3 | E606: =C606*6+D606 -> 21 | G606: 8 | H606: 8 | I606: =G606*6+H606 -> 56 | K606: 11 | L606: 9 | M606: =K606*6+L606 -> 75 | O606: 12 | P606: 9 | Q606: =O606*6+P606 -> 81 | S606: CAMBERWELL
A607: CAMBERWELL | C607: 3 | D607: 4 | E607: =C607*6+D607 -> 22 | G607: 6 | H607: 5 | I607: =G607*6+H607 -> 41 | K607: 7 | L607: 8 | M607: =K607*6+L607 -> 50 | O607: 10 | P607: 14 | Q607: =O607*6+P607 -> 74 | S607: MUTCH
A608: BEST PLAYERS
A609: PRESTON | C609: REICHMAN | F609: DAVIE | I609: TAYLOR | L609: MACKIE | O609: ESCOTT | R609: SURTEES]
A610: CAMBERWELL | C610: PAGE | F610: GREENWOOD | I610: PETRIE | L610: WHITTY | O610: HARRISON | R610: JONES
A611: GOALKICKERS
A612: PRESTON | C612: DAVIE 4 | E612: SURTEES 3 | H612: MACKIE 2 | J612: GALL | L612: McCORMACK | O612: CAMPBELL
A613: CAMBERWELL | C613: LAWN 3 | E613: PETRIE | G613: PAGE | I613: WARD | K613: GREENWOOD | N613: WHITTY | Q613: O'BRIEN
A615: COBURG | C615: 7 | D615: 5 | E615: =C615*6+D615 -> 47 | G615: 14 | H615: 7 | I615: =G615*6+H615 -> 91 | K615: 19 | L615: 14 | M615: =K615*6+L615 -> 128 | O615: 19 | P615: 17 | Q615: =O615*6+P615 -> 131 | S615: BEACH ROAD
A616: SANDRINGHAM | C616: 3 | D616: 3 | E616: =C616*6+D616 -> 21 | G616: 9 | H616: 8 | I616: =G616*6+H616 -> 62 | K616: 10 | L616: 9 | M616: =K616*6+L616 -> 69 | O616: 14 | P616: 14 | Q616: =O616*6+P616 -> 98 | S616: CARRUTHERS
A617: BEST PLAYERS
A618: COBURG | C618: MEARS | F618: COLBERT | I618: CHARLESTON | L618: VOIGHT | O618: BERTRAM | R618: JENKINS
A619: SANDRINGHAM | C619: ANDERSON | F619: R KENNA | I619: E BOURKE | L619: JOHNSTONE | O619: SIMMONDS | R619: YOUNG
A620: GOALKICKERS
A621: COBURG | C621: VOIGHT 6 | F621: MEARS 5 | I621: BERTRAM 4 | L621: COLBERT 2 | O621: LOWE | Q621: FITZGERALD
A622: SANDRINGHAM | C622: JOHNSTONE 5 | F622: DE LUCA 2 | I622: QUINN 2 | K622: R KENNA 2 | N622: BOYD | P622: MCAULIFFE | S622: SIMMONDS
A624: ROUND 12 | E624: 12TH JULY | H624: WEATHER | K624: COLD CLOUDY SHOWERS N WIND GROUNDS BAD | S624: PLAYED AT | X624: LADDER | AB624: ROUND | AD624: 12
D625: 1ST QTR | H625: 2ND QTR | L625: 3RD QTR | P625: FINAL | S625: NORTHCOTE
A626: NORTHCOTE | C626: 1 | D626: 1 | E626: =C626*6+D626 -> 7 | G626: 7 | H626: 7 | I626: =G626*6+H626 -> 49 | K626: 10 | L626: 9 | M626: =K626*6+L626 -> 69 | O626: 20 | P626: 16 | Q626: =O626*6+P626 -> 136 | S626: UMPIRE | W626: TEAM | X626: W | Y626: L | Z626: D | AA626: FOR | AB626: AGST | AC626: % | AD626: PTS
A627: PRESTON | C627: 5 | D627: 3 | E627: =C627*6+D627 -> 33 | G627: 6 | H627: 3 | I627: =G627*6+H627 -> 39 | K627: 7 | L627: 9 | M627: =K627*6+L627 -> 51 | O627: 8 | P627: 9 | Q627: =O627*6+P627 -> 57 | S627: McKINNON
A628: BEST PLAYERS | W628: OAKLEIGH | X628: 10 | Y628: 2 | Z628: 0 | AA628: 1112 | AB628: 777 | AC628: 143.11454311454312 | AD628: 40
A629: NORTHCOTE | C629: ROSS | E629: ROWE | H629: E .C .BRIGGS | K629: NICHOLLS | N629: COCKRAM | Q629: WILSON | W629: NORTHCOTE | X629: 9 | Y629: 3 | Z629: 0 | AA629: 1170 | AB629: 894 | AC629: 130.8724832214765 | AD629: 36
A630: PRESTON | C630: HICKEY | E630: SUMMERS | H630: CAMPBELL | K630: TAYLOR | N630: McCORMACK | Q630: DAVIE | W630: PORT MELBOURNE | X630: 8 | Y630: 3 | Z630: 1 | AA630: 972 | AB630: 863 | AC630: 112.63035921205099 | AD630: 34
A631: GOALKICKERS | W631: YARRAVILLE | X631: 8 | Y631: 4 | Z631: 0 | AA631: 1025 | AB631: 794 | AC631: 129.09319899244332 | AD631: 32
A632: NORTHCOTE | C632: E C BRIGGS 6 | F632: ROSS 5 | H632: SIMMONDS 3 | K632: SEYMOUR 2 | N632: POULTER | P632: GRAY | Q632: BROWN | S632: HONIG
A633: PRESTON | C633: McCORMACK 4 | F633: DAVIE 2 | I633: MACKIE | L633: ESCOTT | W633: WILLIAMSTOWN | X633: 8 | Y633: 4 | Z633: 0 | AA633: 1048 | AB633: 886 | AC633: 118.2844243792325 | AD633: 32
W634: PRESTON | X634: 7 | Y634: 4 | Z634: 1 | AA634: 981 | AB634: 1005 | AC634: 97.61 | AD634: 30
A635: WILLIAMSTOWN | C635: 6 | D635: 3 | E635: =C635*6+D635 -> 39 | G635: 6 | H635: 4 | I635: =G635*6+H635 -> 40 | K635: 10 | L635: 4 | M635: =K635*6+L635 -> 64 | O635: 13 | P635: 5 | Q635: =O635*6+P635 -> 83 | S635: YARRAVILLE | W635: COBURG | X635: 5 | Y635: 5 | Z635: 2 | AA635: 964 | AB635: 900 | AC635: 107.11111111111111 | AD635: 24
A636: YARRAVILLE | C636: 2 | D636: 2 | E636: =C636*6+D636 -> 14 | G636: 5 | H636: 8 | I636: =G636*6+H636 -> 38 | K636: 7 | L636: 8 | M636: =K636*6+L636 -> 50 | O636: 8 | P636: 10 | Q636: =O636*6+P636 -> 58 | S636: MUTCH | W636: BRIGHTON | X636: 5 | Y636: 7 | Z636: 0 | AA636: 1108 | AB636: 1019 | AC636: 108.73405299313052 | AD636: 20
A637: BEST PLAYERS | W637: BRUNSWICK | X637: 4 | Y637: 8 | Z637: 0 | AA637: 849 | AB637: 1007 | AC637: 84.309831181727901 | AD637: 16
A638: WILLIAMSTOWN | C638: J O'BRIEN | F638: BYRNE | I638: SYKES | K638: HELLWIG | N638: FLYNN | Q638: LONERGAN | W638: PRAHRAN | X638: 3 | Y638: 9 | Z638: 0 | AA638: 839 | AB638: 1190 | AC638: 70.504201680672267 | AD638: 12
A639: YARRAVILLE | C639: JOYCE | F639: KENNEDY | I639: TYSON | K639: COULSELL | N639: BUTLER | Q639: SMITH | W639: CAMBERWELL | X639: 2 | Y639: 10 | Z639: 0 | AA639: 854 | AB639: 1104 | AC639: 77.36 | AD639: 8
A640: GOALKICKERS | W640: SANDRINGHAM | X640: 1 | Y640: 11 | Z640: 0 | AA640: 945 | AB640: 1428 | AC640: 66.17647058823529 | AD640: 4
A641: WILLIAMSTOWN | C641: J O'BRIEN 4 | F641: SINCLAIR 4 | I641: McDONALD 2 | L641: T BYRNE 2 | N641: FLYNN
A642: YARRAVILLE | C642: TYSON 2 | E642: COULSELL 2 | H642: KENNEDY | J642: ROBERTS | M642: MILNE | O642: BUTLER
A644: BRUNSWICK | C644: 3 | D644: 5 | E644: =C644*6+D644 -> 23 | G644: 4 | H644: 10 | I644: =G644*6+H644 -> 34 | K644: 7 | L644: 11 | M644: =K644*6+L644 -> 53 | O644: 8 | P644: 14 | Q644: 62 | S644: COBURG
A645: COBURG | C645: 0 | D645: 5 | E645: =C645*6+D645 -> 5 | G645: 1 | H645: 8 | I645: =G645*6+H645 -> 14 | K645: 2 | L645: 14 | M645: =K645*6+L645 -> 26 | O645: 2 | P645: 17 | Q645: 29 | S645: LESTER
A646: BEST PLAYERS
A647: BRUNSWICK | C647: THOMPSON | F647: HEARN | I647: BRAY | K647: McCABE | N647: PENMAN | Q647: BLACKMORE
A648: COBURG | C648: VOIGHT | F648: MEARS | I648: KIGHT | K648: GAUDION | N648: CHAPMAN | Q648: DONNELLY
A649: GOALKICKERS
A650: BRUNSWICK | C650: McINERNEY 3 | F650: BRAY 3 | I650: PENMAN | L650: JOHNSTONE
A651: COBURG | C651: MEARS 2
A653: BRIGHTON | C653: 8 | D653: 3 | E653: =C653*6+D653 -> 51 | G653: 10 | H653: 4 | I653: =G653*6+H653 -> 64 | K653: 14 | L653: 7 | M653: =K653*6+L653 -> 91 | O653: 17 | P653: 9 | Q653: =O653*6+P653 -> 111 | S653: BEACH RD
A654: SANDRINGHAM | C654: 0 | D654: 3 | E654: =C654*6+D654 -> 3 | G654: 1 | H654: 11 | I654: =G654*6+H654 -> 17 | K654: 1 | L654: 20 | M654: =K654*6+L654 -> 26 | O654: 7 | P654: 27 | Q654: =O654*6+P654 -> 69 | S654: MORCAM
A655: BEST PLAYERS
A656: BRIGHTON | C656: B SMITH | F656: HUNT | I656: TUCKER | L656: LILBURNE | O656: DORE | R656: STEWART
A657: SANDRINGHAM | C657: SIMMONDS | F657: M BOURKE | I657: E BOURKE | L657: R KENNA | O657: JAMIESON | R657: McAULIFFE
A658: GOALKICKERS
A659: BRIGHTON | C659: B SMITH 8 | F659: HUNT 3 | I659: TUCKER 3 | K659: TULLOH | M659: PETERSON | P659: BESWICK
A660: SANDRINGHAM | C660: SMITH | E660: McAULIFFE | H660: QUINN | J660: R KENNA | M660: SIMMONDS | P660: BRIDGFORD | S660: M BOURKE
A662: PRAHRAN | C662: 2 | D662: 3 | E662: =C662*6+D662 -> 15 | G662: 3 | H662: 9 | I662: =G662*6+H662 -> 27 | K662: 6 | L662: 11 | M662: =K662*6+L662 -> 47 | O662: 8 | P662: 19 | Q662: =O662*6+P662 -> 67 | S662: TOORAK PARK
A663: PORT MELBOURNE | C663: 3 | D663: 6 | E663: =C663*6+D663 -> 24 | G663: 6 | H663: 9 | I663: =G663*6+H663 -> 45 | K663: 8 | L663: 12 | M663: =K663*6+L663 -> 60 | O663: 8 | P663: 15 | Q663: =O663*6+P663 -> 63 | S663: McINERNEY
A664: BEST PLAYERS
A665: PRAHRAN | C665: JORDAN | F665: KOOP | I665: PRENTICE | L665: FLOWERS | O665: LORD | Q665: F SMITH
A666: PORT MELBOURNE | C666: STANBRIDGE | F666: HYDE | I666: FISHER | L666: J SMITH | O666: BEDFORD | Q666: BOLWELL
A667: GOALKICKERS
A668: PRAHRAN | C668: LORD 3 | F668: DUNN 3 | I668: ANDERSON | L668: PRENTICE
A669: PORT MELBOURNE | C669: BEDFORD 4 | F669: PLUMRIDGE | I669: BROOKER | L669: BOLWELL | O669: LAHIFF
A671: OAKLEIGH | C671: 7 | D671: 0 | E671: =C671*6+D671 -> 42 | G671: 9 | H671: 4 | I671: =G671*6+H671 -> 58 | K671: 12 | L671: 5 | M671: =K671*6+L671 -> 77 | O671: 17 | P671: 10 | Q671: =O671*6+P671 -> 112 | S671: OAKLEIGH
A672: CAMBERWELL | C672: 4 | D672: 5 | E672: =C672*6+D672 -> 29 | G672: 5 | H672: 8 | I672: =G672*6+H672 -> 38 | K672: 5 | L672: 10 | M672: =K672*6+L672 -> 40 | O672: 6 | P672: 15 | Q672: =O672*6+P672 -> 51 | S672: STUART
A673: BEST PLAYERS
A674: OAKLEIGH | C674: WITHERS | F674: FLEMING | I674: McALLISTER | L674: MAHER | O674: GUNNYON | R674: YEMM
A675: CAMBERWELL | C675: LATHLAIN | F675: LAWN | I675: BLACK | L675: JONES | O675: DYBALL | R675: GREENWOOD
A676: GOALKICKERS
A677: OAKLEIGH | C677: FRASER 7 | F677: WITHERS 4 | I677: WILTSHIRE 2 | L677: YEMM 2 | N677: FLEMING | P677: GODING
A678: CAMBERWELL | C678: JONES 3 | F678: LAWN | H678: VALE | J678: MURPHY | L678: WALLIS
A680: ROUND 13 | E680: 19TH JULY | H680: WEATHER | K680: COLD CLOUDY FEW SHOWERS W WIND | S680: PLAYED AT | X680: LADDER | AB680: ROUND | AD680: 13
D681: 1ST QTR | H681: 2ND QTR | L681: 3RD QTR | P681: FINAL | S681: PORT MELBOURNE
A682: YARRAVILLE | C682: 4 | D682: 2 | E682: =C682*6+D682 -> 26 | G682: 8 | H682: 5 | I682: =G682*6+H682 -> 53 | K682: 9 | L682: 8 | M682: =K682*6+L682 -> 62 | O682: 13 | P682: 12 | Q682: =O682*6+P682 -> 90 | S682: UMPIRE | W682: TEAM | X682: W | Y682: L | Z682: D | AA682: FOR | AB682: AGST | AC682: % | AD682: PTS
A683: PORT MELBOURNE | C683: 5 | D683: 5 | E683: =C683*6+D683 -> 35 | G683: 8 | H683: 7 | I683: =G683*6+H683 -> 55 | K683: 9 | L683: 10 | M683: =K683*6+L683 -> 64 | O683: 11 | P683: 14 | Q683: =O683*6+P683 -> 80 | S683: MORCOM
A684: BEST PLAYERS | W684: OAKLEIGH | X684: 10 | Y684: 3 | Z684: 0 | AA684: 1190 | AB684: 877 | AC684: 135.68985176738883 | AD684: 40
A685: YARRAVILLE | C685: LOVETT | E685: THOMAS | H685: MILNE | K685: JOYCE | N685: ROBERTSON | Q685: WUNHYM | W685: NORTHCOTE | X685: 9 | Y685: 4 | Z685: 0 | AA685: 1223 | AB685: 956 | AC685: 127.92887029288703 | AD685: 36
A686: PORT MELBOURNE | C686: BEDFORD | E686: BROOKER | H686: STANBRIDGE | K686: McINNES | N686: ERRIDGE | Q686: WILKIN | W686: YARRAVILLE | X686: 9 | Y686: 4 | Z686: 0 | AA686: 1115 | AB686: 874 | AC686: 127.57437070938215 | AD686: 36
A687: GOALKICKERS | W687: WILLIAMSTOWN | X687: 9 | Y687: 4 | Z687: 0 | AA687: 1148 | AB687: 964 | AC687: 119.08713692946058 | AD687: 36
A688: YARRAVILLE | C688: MILNE 5 | F688: ROBERTS 3 | I688: CAMERON 2 | L688: DRISCOLL | N688: JOYCE | P688: THOMAS
A689: PORT MELBOURNE | C689: PLUMRIDGE 4 | F689: McINNES 3 | I689: WILKIN 3 | L689: TYSON | N689: LAHIFF | W689: PORT MELBOURNE | X689: 8 | Y689: 4 | Z689: 1 | AA689: 1052 | AB689: 953 | AC689: 110.38824763903463 | AD689: 34
W690: PRESTON | X690: 8 | Y690: 4 | Z690: 1 | AA690: 1013 | AB690: 1082 | AC690: 101.1 | AD690: 34
A691: WILLIAMSTOWN | C691: 3 | D691: 3 | E691: =C691*6+D691 -> 21 | G691: 5 | H691: 5 | I691: =G691*6+H691 -> 35 | K691: 11 | L691: 6 | M691: =K691*6+L691 -> 72 | O691: 15 | P691: 10 | Q691: =O691*6+P691 -> 100 | S691: WILLIAMSTOWN | W691: BRIGHTON | X691: 6 | Y691: 7 | Z691: 0 | AA691: 1170 | AB691: 1072 | AC691: 109.14179104477611 | AD691: 24
A692: OAKLEIGH | C692: 2 | D692: 1 | E692: =C692*6+D692 -> 13 | G692: 6 | H692: 5 | I692: =G692*6+H692 -> 41 | K692: 9 | L692: 6 | M692: =K692*6+L692 -> 60 | O692: 12 | P692: 6 | Q692: =O692*6+P692 -> 78 | S692: McKINNON | W692: COBURG | X692: 5 | Y692: 6 | Z692: 2 | AA692: 1041 | AB692: 1012 | AC692: 102.86561264822134 | AD692: 24
A693: BEST PLAYERS | W693: BRUNSWICK | X693: 5 | Y693: 8 | Z693: 0 | AA693: 969 | AB693: 1050 | AC693: 92.285714285714292 | AD693: 20
A694: WILLIAMSTOWN | C694: SHANAHAN | F694: BARNES | H694: SHEEHAN | K694: HELLWIG | N694: McDONALD | Q694: SINCLAIR | W694: PRAHRAN | X694: 4 | Y694: 9 | Z694: 0 | AA694: 927 | AB694: 1253 | AC694: 73.982442138866716 | AD694: 16
A695: OAKLEIGH | C695: WILTSHIRE | F695: SPAIN | H695: FLEMING | K695: McALLISTER | N695: WITHERS | Q695: ALLISON | W695: CAMBERWELL | X695: 2 | Y695: 11 | Z695: 0 | AA695: 917 | AB695: 1192 | AC695: 76.93 | AD695: 8
A696: GOALKICKERS | W696: SANDRINGHAM | X696: 1 | Y696: 12 | Z696: 0 | AA696: 988 | AB696: 1548 | AC696: 63.824289405684752 | AD696: 4
A697: WILLIAMSTOWN | C697: J O'BRIEN 5 | F697: SINCLAIR 2 | I697: McDONALD 2 | L697: SHEEHAN 2 | O697: T BYRNE 2 | R697: BLAKE | T697: BRITT
A698: OAKLEIGH | C698: FRASER 6 | F698: MAHER 2 | I698: COCHRANE 2 | L698: FLEMING | O698: ALLISON
A700: PRESTON | C700: 2 | D700: 3 | E700: =C700*6+D700 -> 15 | G700: 8 | H700: 6 | I700: =G700*6+H700 -> 54 | K700: 11 | L700: 7 | M700: =K700*6+L700 -> 73 | O700: 17 | P700: 10 | Q700: =O700*6+P700 -> 112 | S700: PRESTON
A701: COBURG | C701: 2 | D701: 3 | E701: =C701*6+D701 -> 15 | G701: 5 | H701: 7 | I701: =G701*6+H701 -> 37 | K701: 9 | L701: 11 | M701: =K701*6+L701 -> 65 | O701: 11 | P701: 11 | Q701: =O701*6+P701 -> 77 | S701: LESTER
A702: BEST PLAYERS
A703: PRESTON | C703: SURTEES | E703: TAYLOR | H703: REICHMAN | K703: DAVIE | N703: SEEBECK | Q703: MONOHAN
A704: COBURG | C704: LOWE | E704: COLBERT | H704: McDONALD | K704: JENKINS | N704: GREGORY | Q704: LEE
A705: GOALKICKERS
A706: PRESTON | C706: SURTEES 10 | F706: DAVIE 2 | H706: GALL | J706: SUMMERS | M706: McCORMACK | P706: CAMPBELL | S706: MACKIE
A707: COBURG | C707: MEARS 3 | F707: LOWE 3 | H707: McDONALD 2 | K707: JENKINS | M707: COLBERT | P707: GREGORY
A709: PRAHRAN | C709: 2 | D709: 0 | E709: =C709*6+D709 -> 12 | G709: 7 | H709: 4 | I709: =G709*6+H709 -> 46 | K709: 10 | L709: 8 | M709: =K709*6+L709 -> 68 | O709: 13 | P709: 10 | Q709: =O709*6+P709 -> 88 | S709: CAMBERWELL
A710: CAMBERWELL | C710: 5 | D710: 4 | E710: =C710*6+D710 -> 34 | G710: 7 | H710: 7 | I710: =G710*6+H710 -> 49 | K710: 8 | L710: 12 | M710: =K710*6+L710 -> 60 | O710: 8 | P710: 15 | Q710: =O710*6+P710 -> 63 | S710: ASHMORE
A711: BEST PLAYERS
A712: PRAHRAN | C712: HARVEY | F712: JORDAN | I712: KOOP | L712: LORD | O712: NECK | R712: F SMITH
A713: CAMBERWELL | C713: LAWN | F713: JONES | I713: PETRIE | L713: BLACK | O713: WARD | R713: MURPHY
A714: GOALKICKERS
A715: PRAHRAN | C715: JORDAN 4 | F715: PRENTICE 3 | I715: LORD 3 | K715: DONOHUE | N715: BREWIS | P715: DUNN
A716: CAMBERWELL | C716: JONES 4 | F716: LAWN 3 | I716: DYBALL
A718: BRUNSWICK | C718: 3 | D718: 6 | E718: =C718*6+D718 -> 24 | G718: 7 | H718: 15 | I718: =G718*6+H718 -> 57 | K718: 9 | L718: 19 | M718: =K718*6+L718 -> 73 | O718: 16 | P718: 24 | Q718: =O718*6+P718 -> 120 | S718: BRUNSWICK
A719: SANDRINGHAM | C719: 1 | D719: 0 | E719: =C719*6+D719 -> 6 | G719: 1 | H719: 1 | I719: =G719*6+H719 -> 7 | K719: 3 | L719: 6 | M719: =K719*6+L719 -> 24 | O719: 6 | P719: 7 | Q719: =O719*6+P719 -> 43 | S719: SCHAEFER
A720: BEST PLAYERS
A721: BRUNSWICK | C721: BLACKMORE | F721: THOMPSON | I721: McINERNEY | L721: PENMAN | O721: KENNETT | R721: BRAY
A722: SANDRINGHAM | C722: E BOURKE | F722: BRIDGFORD | I722: ANDERSON | L722: JOHNSTON | O722: SMITHURST | R722: YOUNG
A723: GOALKICKERS
A724: BRUNSWICK | C724: McINERNEY 4 | F724: BIRD 2 | H724: PENMAN 2 | J724: BRAY 2 | L724: BEGGS 2 | N724: FITZGERALD | Q724: ALESSIO | S724: MCCABE | W724: KENNETT
A725: SANDRINGHAM | C725: BRIDGFORD 3 | F725: SMITHURST | I725: R KENNA | L725: E BOURKE
A727: BRIGHTON | C727: 3 | D727: 1 | E727: =C727*6+D727 -> 19 | G727: 4 | H727: 6 | I727: =G727*6+H727 -> 30 | K727: 6 | L727: 10 | M727: =K727*6+L727 -> 46 | O727: 8 | P727: 14 | Q727: =O727*6+P727 -> 62 | S727: ELSTERNWICK PARK
A728: NORTHCOTE | C728: 0 | D728: 6 | E728: =C728*6+D728 -> 6 | G728: 2 | H728: 10 | I728: =G728*6+H728 -> 22 | K728: 3 | L728: 15 | M728: =K728*6+L728 -> 33 | O728: 6 | P728: 17 | Q728: =O728*6+P728 -> 53 | S728: STEWART
A729: BEST PLAYERS
A730: BRIGHTON | C730: LILBURNE | F730: HUNT | I730: CLOTZ | L730: MORCAM | O730: TUCKER | R730: DORE
A731: NORTHCOTE | C731: ROWE | F731: NICHOLLS | I731: CORRIGAN | L731: WILSON | O731: COCKRAM | R731: E C BRIGGS
A732: GOALKICKERS
A733: BRIGHTON | C733: TUCKER 2 | F733: MORCOM 2 | I733: LILBURNE | K733: WEBB | M733: BURNES | P733: ELLIOTT
A734: NORTHCOTE | C734: SEYMOUR 2 | F734: ROSS | H734: GRAY | J734: SIMMONDS | M734: BROWN
A736: ROUND 14 | E736: 26TH JULY | J736: WEATHER | M736: FINE INCREASING CLOUD | S736: PLAYED AT | X736: LADDER | AB736: ROUND | AD736: 14
D737: 1ST QTR | H737: 2ND QTR | L737: 3RD QTR | P737: FINAL | S737: YARRAVILLE
A738: YARRAVILLE | C738: 5 | D738: 4 | E738: =C738*6+D738 -> 34 | G738: 7 | H738: 5 | I738: =G738*6+H738 -> 47 | K738: 11 | L738: 8 | M738: =K738*6+L738 -> 74 | O738: 13 | P738: 9 | Q738: =O738*6+P738 -> 87 | S738: UMPIRE | W738: TEAM | X738: W | Y738: L | Z738: D | AA738: FOR | AB738: AGST | AC738: % | AD738: PTS
A739: COBURG | C739: 2 | D739: 4 | E739: =C739*6+D739 -> 16 | G739: 5 | H739: 11 | I739: =G739*6+H739 -> 41 | K739: 8 | L739: 14 | M739: =K739*6+L739 -> 62 | O739: 11 | P739: 20 | Q739: =O739*6+P739 -> 86 | S739: STEWART
A740: BEST PLAYERS | W740: OAKLEIGH | X740: 11 | Y740: 3 | Z740: 0 | AA740: 1305 | AB740: 981 | AC740: 133.02752293577981 | AD740: 44
A741: YARRAVILLE | C741: ROBERTS | E741: FITZMAURICE | H741: CAMERON | K741: WUNHYM | N741: MILNE | Q741: HUNTER | W741: NORTHCOTE | X741: 10 | Y741: 4 | Z741: 0 | AA741: 1395 | AB741: 1017 | AC741: 137.16814159292036 | AD741: 40
A742: COBURG | C742: CHAPMAN | E742: RIDDINGTON | H742: BROWN | K742: LOWE | N742: KIGHT | Q742: COLBERT | W742: YARRAVILLE | X742: 10 | Y742: 4 | Z742: 0 | AA742: 1202 | AB742: 960 | AC742: 125.20833333333333 | AD742: 40
A743: GOALKICKERS | Q743: McHENRY | W743: WILLIAMSTOWN | X743: 9 | Y743: 5 | Z743: 0 | AA743: 1210 | AB743: 1054 | AC743: 114.80075901328273 | AD743: 36
A744: YARRAVILLE | C744: FITZMAURICE 2 | F744: KENNEDY 2 | I744: CAMERON 2 | L744: ROBERTS 2 | N744: MILNE 2 | P744: JOYCE | R744: DWYER
A745: COBURG | C745: MEARS 4 | E745: COLBERT 3 | H745: WILLOX | J745: KIGHT | L745: GAUDION | N745: DONNELLY | W745: PORT MELBOURNE | X745: 8 | Y745: 5 | Z745: 1 | AA745: 1125 | AB745: 1038 | AC745: 108.38150289017341 | AD745: 34
W746: PRESTON | X746: 8 | Y746: 5 | Z746: 1 | AA746: 1154 | AB746: 1160 | AC746: 99.48 | AD746: 34
A747: OAKLEIGH | C747: 6 | D747: 1 | E747: =C747*6+D747 -> 37 | G747: 10 | H747: 5 | I747: =G747*6+H747 -> 65 | K747: 14 | L747: 6 | M747: =K747*6+L747 -> 90 | O747: 18 | P747: 7 | Q747: =O747*6+P747 -> 115 | S747: ELSTERNWICK PARK | W747: BRIGHTON | X747: 6 | Y747: 8 | Z747: 0 | AA747: 1274 | AB747: 1187 | AC747: 107.32940185341197 | AD747: 24
A748: BRIGHTON | C748: 1 | D748: 7 | E748: =C748*6+D748 -> 13 | G748: 6 | H748: 13 | I748: =G748*6+H748 -> 49 | K748: 10 | L748: 17 | M748: =K748*6+L748 -> 77 | O748: 14 | P748: 20 | Q748: =O748*6+P748 -> 104 | S748: McKINNON | W748: COBURG | X748: 5 | Y748: 7 | Z748: 2 | AA748: 1127 | AB748: 1099 | AC748: 102.54777070063695 | AD748: 24
A749: BEST PLAYERS | W749: BRUNSWICK | X749: 6 | Y749: 8 | Z749: 0 | AA749: 1059 | AB749: 1112 | AC749: 95.233812949640281 | AD749: 24
A750: OAKLEIGH | C750: FRASER | E750: MATHER | H750: GODING | K750: MORRIS | N750: WITHERS | Q750: SPAIN | W750: PRAHRAN | X750: 5 | Y750: 9 | Z750: 0 | AA750: 1005 | AB750: 1314 | AC750: 76.484018264840188 | AD750: 20
A751: BRIGHTON | C751: MORCAM | E751: CANTWELL | H751: HUNT | K751: PETERSON | N751: BARNES | Q751: LILBURNE | W751: CAMBERWELL | X751: 3 | Y751: 11 | Z751: 0 | AA751: 1002 | AB751: 1265 | AC751: 79.21 | AD751: 12
A752: GOALKICKERS | W752: SANDRINGHAM | X752: 1 | Y752: 13 | Z752: 0 | AA752: 1049 | AB752: 1720 | AC752: 60.988372093023258 | AD752: 4
A753: OAKLEIGH | C753: FRASER 6 | E753: ALLISON 3 | H753: COCHRANE 3 | K753: MAHER 2 | M753: HENRY | O753: WITHERS | Q753: GODING | S753: SPAIN
A754: BRIGHTON | C754: PETERSON 5 | F754: BURNES 3 | I754: HUNT 2 | K754: LILBURNE | M754: ELLIOTT | O754: MORCOM | Q754: ALEXANDER
A756: BRUNSWICK | C756: 2 | D756: 3 | E756: =C756*6+D756 -> 15 | G756: 4 | H756: 5 | I756: =G756*6+H756 -> 29 | K756: 7 | L756: 9 | M756: =K756*6+L756 -> 51 | O756: 13 | P756: 12 | Q756: =O756*6+P756 -> 90 | S756: BRUNSWICK
A757: WILLIAMSTOWN | C757: 4 | D757: 4 | E757: =C757*6+D757 -> 28 | G757: 6 | H757: 6 | I757: =G757*6+H757 -> 42 | K757: 8 | L757: 8 | M757: =K757*6+L757 -> 56 | O757: 9 | P757: 8 | Q757: =O757*6+P757 -> 62 | S757: SCHAEFER
A758: BEST PLAYERS
A759: BRUNSWICK | C759: PENMAN | E759: THOMPSON | H759: FITZGERALD | K759: McNEILL | N759: McINERNEY | Q759: KENNETT
A760: WILLIAMSTOWN | C760: SYKES | E760: CLAPSON | H760: HELLWIG | K760: BARNES | N760: T BYRNE | Q760: W O'BRIEN
A761: GOALKICKERS
A762: BRUNSWICK | C762: McINERNEY 7 | F762: McNEILL 2 | I762: FITZGERALD | L762: EDDY | N762: ALESSIO | Q762: KENNETT
A763: WILLIAMSTOWN | C763: T BYRNE 3 | F763: J O'BRIEN 2 | I763: McDONALD | L763: SHEEHAN | N763: HELWIG | Q763: W BYRNE
A765: PRAHRAN | C765: 3 | D765: 6 | E765: =C765*6+D765 -> 24 | G765: 6 | H765: 6 | I765: =G765*6+H765 -> 42 | K765: 9 | L765: 9 | M765: =K765*6+L765 -> 63 | O765: 11 | P765: 12 | Q765: =O765*6+P765 -> 78 | S765: TOORAK PARK
A766: PRESTON | C766: 1 | D766: 2 | E766: =C766*6+D766 -> 8 | G766: 2 | H766: 8 | I766: =G766*6+H766 -> 20 | K766: 3 | L766: 9 | M766: =K766*6+L766 -> 27 | O766: 8 | P766: 13 | Q766: =O766*6+P766 -> 61 | S766: COLEMAN
A767: BEST PLAYERS
A768: PRAHRAN | C768: PARRIS | F768: RENNIE | I768: BREWIS | L768: LORD | O768: LUCAS | R768: JORDAN
A769: PRESTON | C769: REICHMAN | F769: SUMMERS | I769: TAYLOR | L769: SEEBECK | O769: SURTEES | R769: MILLER
A770: GOALKICKERS
A771: PRAHRAN | C771: LORD 3 | F771: PRENTICE 2 | I771: BOURKE 2 | L771: GREENWOOD | O771: JORDAN | Q771: DUNN | S771: BEAUMONT
A772: PRESTON | C772: SURTEES 3 | F772: GALL 2 | I772: DAVIE | L772: MACKIE | O772: ESCOTT
A774: CAMBERWELL | C774: 2 | D774: 4 | E774: =C774*6+D774 -> 16 | G774: 4 | H774: 6 | I774: =G774*6+H774 -> 30 | K774: 9 | L774: 10 | M774: =K774*6+L774 -> 64 | O774: 12 | P774: 13 | Q774: =O774*6+P774 -> 85 | S774: CAMBERWELL
A775: PORT MELBOURNE | C775: 4 | D775: 1 | E775: =C775*6+D775 -> 25 | G775: 6 | H775: 6 | I775: =G775*6+H775 -> 42 | K775: 7 | L775: 9 | M775: =K775*6+L775 -> 51 | O775: 10 | P775: 13 | Q775: =O775*6+P775 -> 73 | S775: MORCOM
A776: BEST PLAYERS
A777: CAMBERWELL | C777: MURPHY | F777: PAGE | I777: LAWN | L777: GREENWOOD | O777: McGRATH | R777: PETRIE
A778: PORT MELBOURNE | C778: BEDFORD | F778: PLUMRIDGE | I778: BILLS | L778: PERRETT | O778: McINNES | R778: ERRIDGE
A779: GOALKICKERS
A780: CAMBERWELL | C780: EWANSON 5 | F780: LAWN 3 | I780: MURPHY 2 | L780: CLAMP | N780: PETRIE
A781: PORT MELBOURNE | C781: PLUMRIDGE 4 | F781: McINNES 2 | I781: BAKER 2 | L781: BILLS | N781: LAHIFF
A783: NORTHCOTE | C783: 7 | D783: 3 | E783: =C783*6+D783 -> 45 | G783: 14 | H783: 7 | I783: =G783*6+H783 -> 91 | K783: 20 | L783: 12 | M783: =K783*6+L783 -> 132 | O783: 26 | P783: 16 | Q783: =O783*6+P783 -> 172 | S783: NORTHCOTE
A784: SANDRINGHAM | C784: 1 | D784: 5 | E784: =C784*6+D784 -> 11 | G784: 2 | H784: 6 | I784: =G784*6+H784 -> 18 | K784: 6 | L784: 10 | M784: =K784*6+L784 -> 46 | O784: 8 | P784: 13 | Q784: =O784*6+P784 -> 61 | S784: LESTER
A785: BEST PLAYERS
A786: NORTHCOTE | C786: E C BRIGGS | F786: ROSS | I786: SEYMOUR | L786: COCKRAM | O786: CORRIGAN | R786: NICHOLLS
A787: SANDRINGHAM | C787: E BOURKE | F787: SMITH | I787: BRIDGFORD | L787: DE LUCA | O787: ANDERSON | R787: JOHNSTONE
A788: GOALKICKERS
A789: NORTHCOTE | C789: SEYMOUR 10 | F789: SIMMONDS 5 | I789: E C BRIGGS 5 | L789: MILNE 2 | N789: CORRIGAN | Q789: BROWN | S789: HONIG | U789: WOODS
A790: SANDRINGHAM | C790: BRIDGFORD 5 | F790: DE LUCA | I790: SMITHURST | L790: E BOURKE
A792: ROUND 15 | E792: 2ND AUGUST | H792: WEATHER | K792: COLD RAIN 2ND HALF S.W. WIND GROUNDS BAD | S792: PLAYED AT | X792: LADDER | AB792: ROUND | AD792: 15
D793: 1ST QTR | H793: 2ND QTR | L793: 3RD QTR | P793: FINAL | S793: YARRAVILLE
A794: NORTHCOTE | C794: 5 | D794: 3 | E794: =C794*6+D794 -> 33 | G794: 7 | H794: 6 | I794: =G794*6+H794 -> 48 | K794: 9 | L794: 10 | M794: =K794*6+L794 -> 64 | O794: 9 | P794: 13 | Q794: =O794*6+P794 -> 67 | S794: UMPIRE | W794: TEAM | X794: W | Y794: L | Z794: D | AA794: FOR | AB794: AGST | AC794: % | AD794: PTS
A795: YARRAVILLE | C795: 2 | D795: 3 | E795: =C795*6+D795 -> 15 | G795: 4 | H795: 7 | I795: =G795*6+H795 -> 31 | K795: 5 | L795: 10 | M795: =K795*6+L795 -> 40 | O795: 6 | P795: 15 | Q795: =O795*6+P795 -> 51 | S795: MCKINNON
A796: BEST PLAYERS | W796: NORTHCOTE | X796: 11 | Y796: 4 | Z796: 0 | AA796: 1462 | AB796: 1068 | AC796: 136.89138576779027 | AD796: 44
A797: NORTHCOTE | C797: E C BRIGGS | F797: ROWE | I797: NICHOLLS | L797: CORRIGAN | O797: PRUSER | Q797: SEYMOUR | W797: OAKLEIGH | X797: 11 | Y797: 4 | Z797: 0 | AA797: 1374 | AB797: 1067 | AC797: 128.77225866916589 | AD797: 44
A798: YARRAVILLE | C798: WUNHYM | F798: FITZMAURICE | I798: DRISCOLL | L798: McHENRY | O798: MILNE | Q798: JOYCE | W798: YARRAVILLE | X798: 10 | Y798: 5 | Z798: 0 | AA798: 1253 | AB798: 1027 | AC798: 122.00584225900681 | AD798: 40
A799: GOALKICKERS | W799: PORT MELBOURNE | X799: 9 | Y799: 5 | Z799: 1 | AA799: 1211 | AB799: 1107 | AC799: 109.39476061427281 | AD799: 38
A800: NORTHCOTE | C800: SEYMOUR 5 | F800: PRUSER 2 | I800: ROWE | L800: GOULLET
A801: YARRAVILLE | C801: MILNE 2 | F801: McHENRY 2 | I801: DRISCOLL | L801: CAMERON | W801: WILLIAMSTOWN | X801: 9 | Y801: 6 | Z801: 0 | AA801: 1277 | AB801: 1134 | AC801: 112.61022927689595 | AD801: 36
W802: PRESTON | X802: 8 | Y802: 6 | Z802: 1 | AA802: 1239 | AB802: 1248 | AC802: 99.28 | AD802: 34
A803: PORT MELBOURNE | C803: 5 | D803: 5 | E803: =C803*6+D803 -> 35 | G803: 7 | H803: 7 | I803: =G803*6+H803 -> 49 | K803: 11 | L803: 12 | M803: =K803*6+L803 -> 78 | O803: 12 | P803: 14 | Q803: =O803*6+P803 -> 86 | S803: PORT MELBOURNE | W803: BRIGHTON | X803: 7 | Y803: 8 | Z803: 0 | AA803: 1354 | AB803: 1254 | AC803: 107.97448165869218 | AD803: 28
A804: OAKLEIGH | C804: 1 | D804: 3 | E804: =C804*6+D804 -> 9 | G804: 5 | H804: 8 | I804: =G804*6+H804 -> 38 | K804: 6 | L804: 9 | M804: =K804*6+L804 -> 45 | O804: 9 | P804: 15 | Q804: =O804*6+P804 -> 69 | S804: STEWART | W804: COBURG | X804: 6 | Y804: 7 | Z804: 2 | AA804: 1218 | AB804: 1152 | AC804: 105.72916666666667 | AD804: 28
A805: BEST PLAYERS | W805: BRUNSWICK | X805: 7 | Y805: 8 | Z805: 0 | AA805: 1147 | AB805: 1197 | AC805: 95.82289055973267 | AD805: 28
A806: PORT MELBOURNE | C806: PLUMRIDGE | F806: SMITH | I806: STANBRIDGE | L806: LOVETT | O806: BROOKS | Q806: HYDE | W806: PRAHRAN | X806: 5 | Y806: 10 | Z806: 0 | AA806: 1058 | AB806: 1405 | AC806: 75.30249110320284 | AD806: 20
A807: OAKLEIGH | C807: MORRIS | F807: SPAIN | I807: THOMAS | L807: FLEMING | O807: MAHER | Q807: FRASER | W807: CAMBERWELL | X807: 4 | Y807: 11 | Z807: 0 | AA807: 1114 | AB807: 1363 | AC807: 81.73 | AD807: 16
A808: GOALKICKERS | W808: SANDRINGHAM | X808: 1 | Y808: 14 | Z808: 0 | AA808: 1147 | AB808: 1832 | AC808: 62.609170305676855 | AD808: 4
A809: PORT MELBOURNE | C809: PLUMRIDGE 9 | F809: TYSON | I809: BOLWELL | L809: LAHIFF
A810: OAKLEIGH | C810: FRASER 3 | F810: HENRY 2 | I810: FLEMING | L810: ALLISON | N810: COCHRANE | Q810: WITHERS
A812: BRIGHTON | C812: 2 | D812: 3 | E812: =C812*6+D812 -> 15 | G812: 6 | H812: 9 | I812: =G812*6+H812 -> 45 | K812: 8 | L812: 12 | M812: =K812*6+L812 -> 60 | O812: 11 | P812: 14 | Q812: =O812*6+P812 -> 80 | S812: WILLIAMSTOWN
A813: WILLIAMSTOWN | C813: 4 | D813: 4 | E813: =C813*6+D813 -> 28 | G813: 5 | H813: 6 | I813: =G813*6+H813 -> 36 | K813: 7 | L813: 10 | M813: =K813*6+L813 -> 52 | O813: 9 | P813: 13 | Q813: =O813*6+P813 -> 67 | S813: LESTER
A814: BEST PLAYERS
A815: BRIGHTON | C815: TULLOH | F815: LILBURNE | I815: MORCAM | L815: GALLAGHER | O815: STEWART | R815: PATERSON
A816: WILLIAMSTOWN | C816: SYKES | F816: BARNES | I816: T BYRNE | L816: FLYNN | O816: SHEEHAN | R816: JOHNS
A817: GOALKICKERS
A818: BRIGHTON | C818: TULLOH 4 | F818: PETERSON 2 | I818: LILBURNE 2 | L818: HUNT | N818: MORCOM
A819: WILLIAMSTOWN | C819: BARNES 3 | F819: SINCLAIR 2 | I819: McDONALD | L819: SHEEHAN | N819: FLYNN | P819: T BYRNE
A821: BRUNSWICK | C821: 3 | D821: 3 | E821: =C821*6+D821 -> 21 | G821: 7 | H821: 8 | I821: =G821*6+H821 -> 50 | K821: 10 | L821: 10 | M821: =K821*6+L821 -> 70 | O821: 13 | P821: 10 | Q821: =O821*6+P821 -> 88 | S821: PRESTON
A822: PRESTON | C822: 2 | D822: 4 | E822: =C822*6+D822 -> 16 | G822: 6 | H822: 10 | I822: =G822*6+H822 -> 46 | K822: 8 | L822: 16 | M822: =K822*6+L822 -> 64 | O822: 11 | P822: 19 | Q822: =O822*6+P822 -> 85 | S822: MORCOM
A823: BEST PLAYERS
A824: BRUNSWICK | C824: THOMPSON | F824: WHITELEY | I824: BLACKMORE | L824: EUDEY | O824: FITZGERALD | R824: BEGGS
A825: PRESTON | C825: REICHMAN | F825: TAYLOR | I825: SUMMERS | L825: MONOHAN | O825: GRAY | R825: ESCOTT
A826: GOALKICKERS
A827: BRUNSWICK | C827: MCINERNEY 4 | F827: KINNEAR 3 | I827: ALESSIO 2 | L827: McNEILL | N827: FITZGERALD | Q827: EDDY | R827: BEGGS
A828: PRESTON | C828: DAVIE 3 | E828: ESCOTT 3 | H828: MCCORMACK 2 | L828: SURTEES | N828: SUMMERS | Q828: TAYLOR
A830: COBURG | C830: 2 | D830: 3 | E830: =C830*6+D830 -> 15 | G830: 9 | H830: 5 | I830: =G830*6+H830 -> 59 | K830: 13 | L830: 11 | M830: =K830*6+L830 -> 89 | O830: 13 | P830: 13 | Q830: =O830*6+P830 -> 91 | S830: COBURG
A831: PRAHRAN | C831: 3 | D831: 3 | E831: =C831*6+D831 -> 21 | G831: 4 | H831: 6 | I831: =G831*6+H831 -> 30 | K831: 6 | L831: 8 | M831: =K831*6+L831 -> 44 | O831: 7 | P831: 11 | Q831: =O831*6+P831 -> 53 | S831: WILLIAMSON
A832: BEST PLAYERS
A833: COBURG | C833: COLBERT | F833: LOWE | I833: DONNELLY | L833: CHAPMAN | O833: JENKINS | R833: GAUDION
A834: PRAHRAN | C834: JORDAN | F834: SMITH | I834: KOOP | L834: BEAUMONT | O834: RENNIE | R834: DARVALL
A835: GOALKICKERS
A836: COBURG | C836: COLBERT 5 | F836: LOWE 3 | I836: MCGRATH 2 | L836: JENKINS | O836: BERTRAM | R836: KIGHT
A837: PRAHRAN | C837: BOURKE 2 | F837: JORDAN 2 | I837: PRENTICE | L837: DUNN | O837: BEAUMONT
A839: CAMBERWELL | C839: 4 | D839: 9 | E839: =C839*6+D839 -> 33 | G839: 9 | H839: 14 | I839: =G839*6+H839 -> 68 | K839: 12 | L839: 18 | M839: =K839*6+L839 -> 90 | O839: 15 | P839: 22 | Q839: =O839*6+P839 -> 112 | S839: BEACH ROAD
A840: SANDRINGHAM | C840: 6 | D840: 2 | E840: =C840*6+D840 -> 38 | G840: 9 | H840: 8 | I840: =G840*6+H840 -> 62 | K840: 10 | L840: 10 | M840: =K840*6+L840 -> 70 | O840: 14 | P840: 14 | Q840: =O840*6+P840 -> 98 | S840: FROOD
A841: BEST PLAYERS
A842: CAMBERWELL | C842: LAWN | F842: PAGE | I842: BOOTHMAN | L842: CLAMP | O842: PETRIE | R842: BLACK
A843: SANDRINGHAM | C843: E BOURKE | F843: BRIDGFORD | I843: JOHNSTONE | L843: PORTER | O843: ORR | R843: YOUNG
A844: GOALKICKERS
A845: CAMBERWELL | C845: LAWN 4 | E845: O'BRIEN 4 | H845: PAGE 3 | J845: PETRIE 2 | M845: MURPHY | O845: JONES
A846: SANDRINGHAM | C846: BRIDGFORD 8 | F846: R KENNA 2 | I846: JAMIESON | L846: BOYD | N846: DE LUCA | P846: DOCKENDORFF
A848: ROUND 16 | E848: 9TH AUGUST | H848: WEATHER | K848: CLOUDY SHOWERS S.W. WIND GROUNDS VERY BAD | S848: PLAYED AT | X848: LADDER | AB848: ROUND | AD848: 16
D849: 1ST QTR | H849: 2ND QTR | L849: 3RD QTR | P849: FINAL | S849: PRESTON
A850: PRESTON | C850: 1 | D850: 2 | E850: =C850*6+D850 -> 8 | G850: 5 | H850: 10 | I850: =G850*6+H850 -> 40 | K850: 7 | L850: 16 | M850: =K850*6+L850 -> 58 | O850: 12 | P850: 20 | Q850: =O850*6+P850 -> 92 | S850: UMPIRE | W850: TEAM | X850: W | Y850: L | Z850: D | AA850: FOR | AB850: AGST | AC850: % | AD850: PTS
A851: PORT MELBOURNE | C851: 2 | D851: 5 | E851: =C851*6+D851 -> 17 | G851: 2 | H851: 6 | I851: =G851*6+H851 -> 18 | K851: 2 | L851: 8 | M851: =K851*6+L851 -> 20 | O851: 4 | P851: 11 | Q851: =O851*6+P851 -> 35 | S851: McKINNON
A852: BEST PLAYERS | W852: NORTHCOTE | X852: 12 | Y852: 4 | Z852: 0 | AA852: 1549 | AB852: 1100 | AC852: 140.81818181818181 | AD852: 48
A853: PRESTON | C853: SUMMERS | E853: GALL | H853: DODD | K853: McMAHON | N853: SEEBECK | Q853: McGANN | W853: OAKLEIGH | X853: 12 | Y853: 4 | Z853: 0 | AA853: 1482 | AB853: 1136 | AC853: 130.45774647887325 | AD853: 48
A854: PORT MELBOURNE | C854: TYSON | E854: HYDE | H854: LEGGO | K854: SMITH | N854: McGINNES | Q854: HARRIS | W854: YARRAVILLE | X854: 10 | Y854: 6 | Z854: 0 | AA854: 1335 | AB854: 1112 | AC854: 120.05395683453237 | AD854: 40
A855: GOALKICKERS | W855: WILLIAMSTOWN | X855: 10 | Y855: 6 | Z855: 0 | AA855: 1352 | AB855: 1203 | AC855: 112.38570241064006 | AD855: 40
A856: PRESTON | C856: SURTEES 6 | F856: DAVIE 2 | H856: ESCOTT 2 | J856: GALL | L856: SEEBECK
A857: PORT MELBOURNE | C857: PLUMRIDGE 2 | F857: LEGGO 2 | W857: PORT MELBOURNE | X857: 9 | Y857: 6 | Z857: 1 | AA857: 1246 | AB857: 1199 | AC857: 103.91993327773145 | AD857: 38
W858: PRESTON | X858: 9 | Y858: 6 | Z858: 1 | AA858: 1331 | AB858: 1283 | AC858: 103.74 | AD858: 38
A859: BRIGHTON | C859: 5 | D859: 3 | E859: =C859*6+D859 -> 33 | G859: 8 | H859: 3 | I859: =G859*6+H859 -> 51 | K859: 12 | L859: 4 | M859: =K859*6+L859 -> 76 | O859: 13 | P859: 7 | Q859: =O859*6+P859 -> 85 | S859: YARRAVILLE | W859: BRIGHTON | X859: 8 | Y859: 8 | Z859: 0 | AA859: 1439 | AB859: 1336 | AC859: 107.70958083832335 | AD859: 32
A860: YARRAVILLE | C860: 1 | D860: 1 | E860: =C860*6+D860 -> 7 | G860: 8 | H860: 4 | I860: =G860*6+H860 -> 52 | K860: 9 | L860: 5 | M860: =K860*6+L860 -> 59 | O860: 12 | P860: 10 | Q860: =O860*6+P860 -> 82 | S860: WILLIAMSON | W860: COBURG | X860: 6 | Y860: 8 | Z860: 2 | AA860: 1250 | AB860: 1239 | AC860: 100.88781275221953 | AD860: 28
A861: BEST PLAYERS | W861: BRUNSWICK | X861: 7 | Y861: 9 | Z861: 0 | AA861: 1216 | AB861: 1305 | AC861: 93.180076628352495 | AD861: 28
A862: BRIGHTON | C862: DORE | E862: GALLAGHER | H862: TUCKER | K862: BOCK | N862: LILBURNE | Q862: CANTWELL | W862: PRAHRAN | X862: 6 | Y862: 10 | Z862: 0 | AA862: 1155 | AB862: 1453 | AC862: 79.490708878183071 | AD862: 24
A863: YARRAVILLE | C863: CAMERON | E863: LYONS | H863: McHENRY | K863: HANNAN | N863: HUNTER | Q863: KENNEDY | W863: CAMBERWELL | X863: 4 | Y863: 12 | Z863: 0 | AA863: 1183 | AB863: 1438 | AC863: 82.27 | AD863: 16
A864: GOALKICKERS | W864: SANDRINGHAM | X864: 1 | Y864: 15 | Z864: 0 | AA864: 1195 | AB864: 1929 | AC864: 61.949196474857438 | AD864: 4
A865: BRIGHTON | C865: HUNT 4 | E865: PETERSON 2 | H865: WEBB 2 | J865: TULLOH | L865: BURNES | N865: MORCOM | P865: GALLAGHER | S865: BARNES
A866: YARRAVILLE | C866: CAMERON 4 | F866: KENNEDY 2 | I866: HUNTER 2 | L866: McHENRY 2 | O866: FITZMAURICE | R866: LOVETT
A868: NORTHCOTE | C868: 3 | D868: 4 | E868: =C868*6+D868 -> 22 | G868: 5 | H868: 5 | I868: =G868*6+H868 -> 35 | K868: 9 | L868: 7 | M868: =K868*6+L868 -> 61 | O868: 13 | P868: 9 | Q868: =O868*6+P868 -> 87 | S868: COBURG
A869: COBURG | C869: 1 | D869: 5 | E869: =C869*6+D869 -> 11 | G869: 2 | H869: 6 | I869: =G869*6+H869 -> 18 | K869: 3 | L869: 7 | M869: =K869*6+L869 -> 25 | O869: 4 | P869: 8 | Q869: =O869*6+P869 -> 32 | S869: LESTER
A870: BEST PLAYERS
A871: NORTHCOTE | C871: NICHOLLS | F871: SEYMOUR | I871: WILSON | L871: COCKRAM | O871: ROWE | Q871: GARRETT
A872: COBURG | C872: MARTIN | F872: JENKINS | I872: LINES | L872: CHARLESTON | O872: VOIGHT | Q872: KIGHT
A873: GOALKICKERS
A874: NORTHCOTE | C874: SEYMOUR 9 | F874: GRAY | H874: PRUSER | J874: HILL | L874: BROWN
A875: COBURG | C875: COLBERT 2 | F875: VOIGHT | H875: LINES
A877: PRAHRAN | C877: 3 | D877: 3 | E877: =C877*6+D877 -> 21 | G877: 7 | H877: 8 | I877: =G877*6+H877 -> 50 | K877: 11 | L877: 11 | M877: =K877*6+L877 -> 77 | O877: 13 | P877: 19 | Q877: =O877*6+P877 -> 97 | S877: TOORAK PARK
A878: SANDRINGHAM | C878: 4 | D878: 0 | E878: =C878*6+D878 -> 24 | G878: 5 | H878: 3 | I878: =G878*6+H878 -> 33 | K878: 6 | L878: 6 | M878: =K878*6+L878 -> 42 | O878: 7 | P878: 6 | Q878: =O878*6+P878 -> 48 | S878: MORCAM
A879: BEST PLAYERS
A880: PRAHRAN | C880: F SMITH | F880: LORD | I880: BEAUMONT | L880: NECK | O880: JORDAN | R880: PARRIS
A881: SANDRINGHAM | C881: DOCKENDORFF | F881: SMITH | I881: LEWIS | L881: YOUNG | O881: R KENNA | R881: DE LUCA
A882: GOALKICKERS
A883: PRAHRAN | C883: DUNN 5 | E883: LORD 4 | G883: JORDAN 3 | J883: DARVALL
A884: SANDRINGHAM | C884: BOYD 2 | E884: DOCKENDORFF 2 | I884: BRIDGFORD 2 | L884: NAGEL
A886: OAKLEIGH | C886: 6 | D886: 2 | E886: =C886*6+D886 -> 38 | G886: 10 | H886: 9 | I886: =G886*6+H886 -> 69 | K886: 14 | L886: 10 | M886: =K886*6+L886 -> 94 | O886: 16 | P886: 12 | Q886: =O886*6+P886 -> 108 | S886: OAKLEIGH
A887: BRUNSWICK | C887: 4 | D887: 3 | E887: =C887*6+D887 -> 27 | G887: 6 | H887: 3 | I887: =G887*6+H887 -> 39 | K887: 7 | L887: 6 | M887: =K887*6+L887 -> 48 | O887: 10 | P887: 9 | Q887: =O887*6+P887 -> 69 | S887: MUTCH
A888: BEST PLAYERS
A889: OAKLEIGH | C889: THOMAS | F889: DRIVER | I889: FRASER | L889: OPREY | O889: MORRIS | R889: WITHERS
A890: BRUNSWICK | C890: BRIGHT | F890: WARDEN | I890: KINNEAR | L890: HEARN | O890: BEGGS | R890: BRAY
A891: GOALKICKERS
A892: OAKLEIGH | C892: FRASER 12 | F892: CHAPMAN 2 | I892: BEATON | K892: YEMM
A893: BRUNSWICK | C893: McINERNEY 3 | F893: KINNEAR 2 | I893: BEGGS 2 | K893: FITZGERALD | N893: EDDY | P893: ALESSIO
A895: WILLIAMSTOWN | C895: 2 | D895: 4 | E895: =C895*6+D895 -> 16 | G895: 4 | H895: 11 | I895: =G895*6+H895 -> 35 | K895: 8 | L895: 13 | M895: =K895*6+L895 -> 61 | O895: 10 | P895: 15 | Q895: =O895*6+P895 -> 75 | S895: CAMBERWELL
A896: CAMBERWELL | C896: 3 | D896: 4 | E896: =C896*6+D896 -> 22 | G896: 6 | H896: 4 | I896: =G896*6+H896 -> 40 | K896: 10 | L896: 6 | M896: =K896*6+L896 -> 66 | O896: 10 | P896: 9 | Q896: =O896*6+P896 -> 69 | S896: STUART
A897: BEST PLAYERS
A898: WILLIAMSTOWN | C898: SYKES | E898: HELLWIG | H898: SHANAHAN | K898: BARNES | N898: SINCLAIR | Q898: JOHNS
A899: CAMBERWELL | C899: LAWN | E899: PETRIE | H899: LATHLAIN | K899: BLACK | N899: JACKSON | Q899: GREENWOOD
A900: GOALKICKERS
A901: WILLIAMSTOWN | C901: BARNES 5 | F901: McDONALD 2 | J901: SINCLAIR | M901: BLAKE
A902: CAMBERWELL | C902: LAWN 4 | F902: EWANSON 2 | I902: LATHLAIN | K902: PETRIE | M902: MAGRATH | O902: O'BRIEN
A904: ROUND 17 | E904: 16TH AUGUST | J904: WEATHER | M904: CLOUDY WEST WIND | S904: PLAYED AT | X904: LADDER | AB904: ROUND | AD904: 17
D905: 1ST QTR | H905: 2ND QTR | L905: 3RD QTR | P905: FINAL | S905: WILLIAMSTOWN
A906: WILLIAMSTOWN | C906: 5 | D906: 3 | E906: =C906*6+D906 -> 33 | G906: 9 | H906: 7 | I906: =G906*6+H906 -> 61 | K906: 13 | L906: 10 | M906: =K906*6+L906 -> 88 | O906: 18 | P906: 15 | Q906: =O906*6+P906 -> 123 | S906: UMPIRE | W906: TEAM | X906: W | Y906: L | Z906: D | AA906: FOR | AB906: AGST | AC906: % | AD906: PTS
A907: PRESTON | C907: 2 | D907: 3 | E907: =C907*6+D907 -> 15 | G907: 4 | H907: 4 | I907: =G907*6+H907 -> 28 | K907: 6 | L907: 7 | M907: =K907*6+L907 -> 43 | O907: 11 | P907: 7 | Q907: =O907*6+P907 -> 73 | S907: MORCAM
A908: BEST PLAYERS | W908: NORTHCOTE | X908: 13 | Y908: 4 | Z908: 0 | AA908: 1681 | AB908: 1142 | AC908: 147.19789842381786 | AD908: 52
A909: WILLIAMSTOWN | C909: SYKES | E909: McKENZIE | H909: BUCHANAN | K909: HELLWIG | N909: BARNES | Q909: SHEEHAN | W909: OAKLEIGH | X909: 13 | Y909: 4 | Z909: 0 | AA909: 1603 | AB909: 1208 | AC909: 132.69867549668874 | AD909: 52
A910: PRESTON | C910: MACKIE | E910: REICHMAN | H910: DAVIE | K910: McGANN | N910: ESCOTT | Q910: TAYLOR | W910: YARRAVILLE | X910: 11 | Y910: 6 | Z910: 0 | AA910: 1420 | AB910: 1155 | AC910: 122.94372294372295 | AD910: 44
A911: GOALKICKERS | W911: WILLIAMSTOWN | X911: 11 | Y911: 6 | Z911: 0 | AA911: 1475 | AB911: 1276 | AC911: 115.59561128526646 | AD911: 44
A912: WILLIAMSTOWN | C912: BARNES 8 | E912: SINCLAIR 3 | H912: BLAKE 2 | J912: SHEEHAN 2 | M912: BRITT 2 | O912: McDONALD | R912: W BYRNE
A913: PRESTON | C913: DAVIE 6 | F913: GALL 2 | H913: SURTEES | J913: MONOHAN | M913: O'DOHERTY | W913: PORT MELBOURNE | X913: 9 | Y913: 7 | Z913: 1 | AA913: 1307 | AB913: 1278 | AC913: 102.26917057902973 | AD913: 38
W914: PRESTON | X914: 9 | Y914: 7 | Z914: 1 | AA914: 1404 | AB914: 1406 | AC914: 99.86 | AD914: 38
A915: COBURG | C915: 2 | D915: 8 | E915: =C915*6+D915 -> 20 | G915: 4 | H915: 9 | I915: =G915*6+H915 -> 33 | K915: 7 | L915: 18 | M915: =K915*6+L915 -> 60 | O915: 10 | P915: 19 | Q915: =O915*6+P915 -> 79 | S915: PORT MELBOURNE | W915: BRIGHTON | X915: 9 | Y915: 8 | Z915: 0 | AA915: 1538 | AB915: 1415 | AC915: 108.69257950530036 | AD915: 36
A916: PORT MELBOURNE | C916: 2 | D916: 3 | E916: =C916*6+D916 -> 15 | G916: 5 | H916: 8 | I916: =G916*6+H916 -> 38 | K916: 5 | L916: 11 | M916: =K916*6+L916 -> 41 | O916: 8 | P916: 13 | Q916: =O916*6+P916 -> 61 | S916: STUART | W916: COBURG | X916: 7 | Y916: 8 | Z916: 2 | AA916: 1329 | AB916: 1300 | AC916: 102.23076923076923 | AD916: 32
A917: BEST PLAYERS | W917: BRUNSWICK | X917: 7 | Y917: 10 | Z917: 0 | AA917: 1295 | AB917: 1404 | AC917: 92.236467236467234 | AD917: 28
A918: COBURG | C918: KIGHT | E918: JENKINS | H918: McGRATH | K918: BERTRAM | N918: BROWN | Q918: CHAPMAN | W918: PRAHRAN | X918: 6 | Y918: 11 | Z918: 0 | AA918: 1197 | AB918: 1585 | AC918: 75.520504731861195 | AD918: 24
A919: PORT MELBOURNE | C919: ERRIDGE | E919: BEDFORD | H919: MORTON | K919: McKENZIE | N919: HYDE | Q919: PLUMRIDGE | W919: CAMBERWELL | X919: 4 | Y919: 13 | Z919: 0 | AA919: 1226 | AB919: 1523 | AC919: 80.5 | AD919: 16
A920: GOALKICKERS | W920: SANDRINGHAM | X920: 1 | Y920: 16 | Z920: 0 | AA920: 1267 | AB920: 2050 | AC920: 61.804878048780488 | AD920: 4
A921: COBURG | C921: CHAPMAN 3 | F921: KIGHT 3 | I921: COLBERT 2 | L921: LEAHY | O921: BERTRAM
A922: PORT MELBOURNE | C922: PLUMRIDGE 3 | F922: BOLWELL 2 | I922: BROOKER | L922: MORTON | O922: LAHIFF
A924: BRIGHTON | C924: 5 | D924: 4 | E924: =C924*6+D924 -> 34 | G924: 6 | H924: 11 | I924: =G924*6+H924 -> 47 | K924: 12 | L924: 19 | M924: =K924*6+L924 -> 91 | O924: 13 | P924: 21 | Q924: =O924*6+P924 -> 99 | S924: ELSTERNWICK PARK
A925: BRUNSWICK | C925: 0 | D925: 1 | E925: =C925*6+D925 -> 1 | G925: 6 | H925: 7 | I925: =G925*6+H925 -> 43 | K925: 6 | L925: 8 | M925: =K925*6+L925 -> 44 | O925: 11 | P925: 13 | Q925: =O925*6+P925 -> 79 | S925: MUTCH
A926: BEST PLAYERS
A927: BRIGHTON | C927: LILBURNE | F927: HUNT | I927: TULLOH | L927: BARNES | O927: STEWART | R927: BURNES
A928: BRUNSWICK | C928: THOMPSON | F928: FITZGERALD | I928: PENMAN | L928: BLACKMORE | O928: KENNETT | R928: JOHNSTONE
A929: GOALKICKERS
A930: BRIGHTON | C930: TULLOH 3 | E930: PETERSON 3 | H930: BURNES 3 | J930: LILBURNE 2 | M930: MORCOM 2
A931: BRUNSWICK | C931: BRAY 2 | E931: JOHNSTONE 2 | H931: ALESSIO 2 | J931: MCCABE 2 | M931: McINERNEY | P931: McNEILL | R931: WHITELEY
A933: YARRAVILLE | C933: 3 | D933: 3 | E933: =C933*6+D933 -> 21 | G933: 6 | H933: 5 | I933: =G933*6+H933 -> 41 | K933: 11 | L933: 12 | M933: =K933*6+L933 -> 78 | O933: 12 | P933: 13 | Q933: =O933*6+P933 -> 85 | S933: YARRAVILLE
A934: CAMBERWELL | C934: 1 | D934: 2 | E934: =C934*6+D934 -> 8 | G934: 4 | H934: 3 | I934: =G934*6+H934 -> 27 | K934: 4 | L934: 7 | M934: =K934*6+L934 -> 31 | O934: 5 | P934: 13 | Q934: =O934*6+P934 -> 43 | S934: LESTER
A935: BEST PLAYERS
A936: YARRAVILLE | C936: PENNY | E936: DRISCOLL | H936: FITZMAURICE | K936: SHERMAN | N936: HUNTER | Q936: LOVETT
A937: CAMBERWELL | C937: DYBALL | E937: MURPHY | H937: LAWN | K937: PAGE | N937: BLACK | Q937: TROTTER
A938: GOALKICKERS
A939: YARRAVILLE | C939: MILNE 4 | E939: FITZMAURICE 2 | I939: THOMAS 2 | L939: McHENRY 2 | O939: CAMERON | Q939: JOYCE
A940: CAMBERWELL | C940: LAWN 2 | E940: TROTTER | G940: PETRIE | I940: O'BRIEN
A942: NORTHCOTE | C942: 4 | D942: 5 | E942: =C942*6+D942 -> 29 | G942: 10 | H942: 10 | I942: =G942*6+H942 -> 70 | K942: 15 | L942: 13 | M942: =K942*6+L942 -> 103 | O942: 19 | P942: 18 | Q942: =O942*6+P942 -> 132 | S942: NORTHCOTE
A943: PRAHRAN | C943: 2 | D943: 0 | E943: =C943*6+D943 -> 12 | G943: 3 | H943: 0 | I943: =G943*6+H943 -> 18 | K943: 3 | L943: 2 | M943: =K943*6+L943 -> 20 | O943: 6 | P943: 6 | Q943: =O943*6+P943 -> 42 | S943: WILLIAMSON
A944: BEST PLAYERS
A945: NORTHCOTE | C945: ROSS | E945: ROWE | H945: SEYMOUR | K945: E C BRIGGS | O945: SIMMONDS | R945: PERKINS
A946: PRAHRAN | C946: KOOP | E946: F SMITH | H946: OSBORNE | K946: LAMPREY | O946: DUNN | R946: ROBERTS
A947: GOALKICKERS
A948: NORTHCOTE | C948: SEYMOUR 6 | F948: SIMMONDS 5 | I948: E C BRIGGS 3 | L948: MILNE 2 | N948: TOWERS | P948: HUGGINS | R948: HONIG
A949: PRAHRAN | C949: LORD 2 | E949: DUNN 2 | G949: GREENWOOD | J949: JORDAN
A951: OAKLEIGH | C951: 2 | D951: 1 | E951: =C951*6+D951 -> 13 | G951: 6 | H951: 8 | I951: =G951*6+H951 -> 44 | K951: 10 | L951: 13 | M951: =K951*6+L951 -> 73 | O951: 17 | P951: 19 | Q951: =O951*6+P951 -> 121 | S951: BEACH ROAD
A952: SANDRINGHAM | C952: 2 | D952: 3 | E952: =C952*6+D952 -> 15 | G952: 4 | H952: 7 | I952: =G952*6+H952 -> 31 | K952: 9 | L952: 9 | M952: =K952*6+L952 -> 63 | O952: 10 | P952: 12 | Q952: =O952*6+P952 -> 72 | S952: McKINNON
A953: BEST PLAYERS
A954: OAKLEIGH | C954: WITHERS | F954: FRASER | I954: MORRIS | L954: YEMM | N954: MAHER | Q954: GUNNYON
A955: SANDRINGHAM | C955: DOCKENDORFF | F955: THOMPSON | I955: E BOURKE | L955: YOUNG | N955: JOHNSTONE | Q955: ORR
A956: GOALKICKERS
A957: OAKLEIGH | C957: FRASER 4 | E957: WITHERS 4 | H957: MAHER 2 | J957: YEMM 2 | L957: DOLAN 2 | N957: SALTER | P957: BEATON | R957: BEASLEY
A958: SANDRINGHAM | C958: DOCKENDORFF 3 | G958: DE LUCA 2 | J958: R KENNA 2 | M958: E BOURKE | P958: NAGEL | R958: BRIDGFORD
A960: ROUND 18 | E960: 23RD AUGUST | J960: WEATHER | M960: FINE SOUTH BREEZE | S960: PLAYED AT | X960: LADDER | AB960: ROUND | AD960: 18
D961: 1ST QTR | H961: 2ND QTR | L961: 3RD QTR | P961: FINAL | S961: NORTHCOTE
A962: NORTHCOTE | C962: 3 | D962: 4 | E962: =C962*6+D962 -> 22 | G962: 5 | H962: 5 | I962: =G962*6+H962 -> 35 | K962: 11 | L962: 7 | M962: =K962*6+L962 -> 73 | O962: 12 | P962: 9 | Q962: =O962*6+P962 -> 81 | S962: UMPIRE | W962: TEAM | X962: W | Y962: L | Z962: D | AA962: FOR | AB962: AGST | AC962: % | AD962: PTS
A963: PORT MELBOURNE | C963: 1 | D963: 2 | E963: =C963*6+D963 -> 8 | G963: 3 | H963: 8 | I963: =G963*6+H963 -> 26 | K963: 4 | L963: 12 | M963: =K963*6+L963 -> 36 | O963: 8 | P963: 17 | Q963: =O963*6+P963 -> 65 | S963: STUART
A964: BEST PLAYERS | W964: NORTHCOTE | X964: 14 | Y964: 4 | Z964: 0 | AA964: 1762 | AB964: 1207 | AC964: 145.9817729908865 | AD964: 56
A965: NORTHCOTE | C965: HONIG | E965: GARRETT | H965: CORRIGAN | K965: E C BRIGGS | N965: PERKINS | Q965: SEYMOUR | W965: OAKLEIGH | X965: 14 | Y965: 4 | Z965: 0 | AA965: 1691 | AB965: 1261 | AC965: 134.09992069785883 | AD965: 56
A966: PORT MELBOURNE | C966: BEDFORD | E966: PLUMRIDGE | H966: LEGGO | K966: McKENZIE | N966: MORTON | Q966: BARLOW | W966: YARRAVILLE | X966: 12 | Y966: 6 | Z966: 0 | AA966: 1526 | AB966: 1235 | AC966: 123.56275303643724 | AD966: 48
A967: GOALKICKERS | W967: WILLIAMSTOWN | X967: 12 | Y967: 6 | Z967: 0 | AA967: 1620 | AB967: 1394 | AC967: 116.21233859397418 | AD967: 48
A968: NORTHCOTE | C968: SEYMOUR 4 | F968: E C BRIGGS 3 | I968: GRAY | K968: SIMMONDS | N968: TOWERS | P968: BROWN | R968: HONIG
A969: PORT MELBOURNE | C969: BROOKER 3 | F969: JOYNER 2 | I969: PLUMRIDGE | L969: MORTON | N969: MCKENZIE | W969: BRIGHTON | X969: 10 | Y969: 8 | Z969: 0 | AA969: 1625 | AB969: 1494 | AC969: 108.77 | AD969: 40
W970: PORT MELBOURNE | X970: 9 | Y970: 8 | Z970: 1 | AA970: 1372 | AB970: 1359 | AC970: 100.95658572479765 | AD970: 38
A971: OAKLEIGH | C971: 5 | D971: 4 | E971: =C971*6+D971 -> 34 | G971: 9 | H971: 7 | I971: =G971*6+H971 -> 61 | K971: 10 | L971: 13 | M971: =K971*6+L971 -> 73 | O971: 12 | P971: 16 | Q971: =O971*6+P971 -> 88 | S971: OAKLEIGH | W971: PRESTON | X971: 9 | Y971: 8 | Z971: 1 | AA971: 1457 | AB971: 1494 | AC971: 97.52 | AD971: 38
A972: PRESTON | C972: 3 | D972: 4 | E972: =C972*6+D972 -> 22 | G972: 5 | H972: 6 | I972: =G972*6+H972 -> 36 | K972: 5 | L972: 8 | M972: =K972*6+L972 -> 38 | O972: 7 | P972: 11 | Q972: =O972*6+P972 -> 53 | S972: LESTER | W972: COBURG | X972: 7 | Y972: 9 | Z972: 2 | AA972: 1408 | AB972: 1387 | AC972: 101.51 | AD972: 32
A973: BEST PLAYERS | W973: BRUNSWICK | X973: 7 | Y973: 11 | Z973: 0 | AA973: 1375 | AB973: 1521 | AC973: 90.401051939513479 | AD973: 28
A974: OAKLEIGH | C974: BEASLEY | E974: FLEMING | H974: SPAIN | K974: GUNNYON | O974: MAHER | R974: YEMM | W974: PRAHRAN | X974: 6 | Y974: 12 | Z974: 0 | AA974: 1277 | AB974: 1691 | AC974: 75.517445298639856 | AD974: 24
A975: PRESTON | C975: TAYLOR | E975: SUMMERS | H975: WHITE | K975: PETCHELL | O975: DAVIE | R975: ESCOTT | W975: CAMBERWELL | X975: 5 | Y975: 13 | Z975: 0 | AA975: 1343 | AB975: 1603 | AC975: 83.78 | AD975: 20
A976: GOALKICKERS | W976: SANDRINGHAM | X976: 1 | Y976: 17 | Z976: 0 | AA976: 1385 | AB976: 2195 | AC976: 63.097949886104786 | AD976: 4
A977: OAKLEIGH | C977: YEMM 3 | E977: FLEMING 2 | H977: WITHERS 2 | K977: SALTER 2 | M977: FRASER | O977: BEASLEY | Q977: SPAIN
A978: PRESTON | C978: DAVIE 4 | E978: SURTEES | H978: ESCOTT | K978: O'DOHERTY
A980: BRIGHTON | C980: 2 | D980: 0 | E980: =C980*6+D980 -> 12 | G980: 7 | H980: 7 | I980: =G980*6+H980 -> 49 | K980: 9 | L980: 10 | M980: =K980*6+L980 -> 64 | O980: 12 | P980: 15 | Q980: =O980*6+P980 -> 87 | S980: COBURG
A981: COBURG | C981: 4 | D981: 3 | E981: =C981*6+D981 -> 27 | G981: 5 | H981: 4 | I981: =G981*6+H981 -> 34 | K981: 10 | L981: 10 | M981: =K981*6+L981 -> 70 | O981: 11 | P981: 13 | Q981: =O981*6+P981 -> 79 | S981: McKINNON
A982: BEST PLAYERS
A983: BRIGHTON | C983: DORE | E983: ELLIOTT | H983: BARNES | K983: MORCAM | N983: LILBURNE | Q983: PETERSON
A984: COBURG | C984: KIGHT | E984: MARTIN | H984: FORD | K984: VOIGHT | N984: JENKINS | Q984: COLBERT
A985: GOALKICKERS
A986: BRIGHTON | C986: PETERSON 3 | F986: MORCOM 3 | I986: TUCKER 2 | L986: LILBURNE 2 | O986: TULLOH | Q986: ALEXANDER
A987: COBURG | C987: COLBERT 3 | F987: MEARS 2 | I987: BERTRAM 2 | L987: KIGHT 2 | O987: VOIGHT | Q987: CHARLESTON
A989: CAMBERWELL | C989: 1 | D989: 3 | E989: =C989*6+D989 -> 9 | G989: 5 | H989: 10 | I989: =G989*6+H989 -> 40 | K989: 11 | L989: 12 | M989: =K989*6+L989 -> 78 | O989: 17 | P989: 15 | Q989: =O989*6+P989 -> 117 | S989: CAMBERWELL
A990: BRUNSWICK | C990: 4 | D990: 8 | E990: =C990*6+D990 -> 32 | G990: 6 | H990: 9 | I990: =G990*6+H990 -> 45 | K990: 8 | L990: 10 | M990: =K990*6+L990 -> 58 | O990: 11 | P990: 14 | Q990: =O990*6+P990 -> 80 | S990: MORCAM
A991: BEST PLAYERS
A992: CAMBERWELL | C992: LAWN | E992: WALLIS | H992: CLAMP | K992: GREENWOOD | N992: TROTTER | Q992: PETRIE
A993: BRUNSWICK | C993: HEARN | E993: McNEILL | H993: FITZGERALD | K993: JOHNSTONE | N993: THOMPSON | Q993: WARDEN
A994: GOALKICKERS
A995: CAMBERWELL | C995: LAWN 5 | E995: TROTTER 3 | H995: MURPHY 3 | J995: PAGE 2 | L995: PETRIE | N995: JONES | P995: MAGRATH | R995: EWANSON
A996: BRUNSWICK | C996: HEARN 5 | E996: McNEILL 2 | H996: BRAY 2 | J996: FITZGERALD
A998: YARRAVILLE | C998: 4 | D998: 10 | E998: =C998*6+D998 -> 34 | G998: 5 | H998: 10 | I998: =G998*6+H998 -> 40 | K998: 12 | L998: 15 | M998: =K998*6+L998 -> 87 | O998: 15 | P998: 16 | Q998: =O998*6+P998 -> 106 | S998: TOORAK PARK
A999: PRAHRAN | C999: 2 | D999: 1 | E999: =C999*6+D999 -> 13 | G999: 5 | H999: 8 | I999: =G999*6+H999 -> 38 | K999: 5 | L999: 10 | M999: =K999*6+L999 -> 40 | O999: 11 | P999: 14 | Q999: =O999*6+P999 -> 80 | S999: MUTCH
A1000: BEST PLAYERS
A1001: YARRAVILLE | C1001: FITZMAURICE | F1001: HUNTER | I1001: KENNEDY | L1001: TYSON | N1001: LOVETT | Q1001: HANNAN
A1002: PRAHRAN | C1002: KOOP | F1002: LAMPREY | I1002: JORDAN | L1002: RENNIE | N1002: LORD | Q1002: OSBORNE
A1003: GOALKICKERS
A1004: YARRAVILLE | C1004: FITZMAURICE 5 | F1004: THOMAS 4 | I1004: TYSON 2 | K1004: KENNEDY 2 | N1004: MILNE | P1004: BUTLER
A1005: PRAHRAN | C1005: LORD 3 | E1005: PARRIS 2 | G1005: RENNIE 2 | I1005: PRENTICE | K1005: JORDAN | M1005: DUNN | O1005: LAMPREY
A1007: WILLIAMSTOWN | C1007: 8 | D1007: 2 | E1007: =C1007*6+D1007 -> 50 | G1007: 12 | H1007: 11 | I1007: =G1007*6+H1007 -> 83 | K1007: 17 | L1007: 14 | M1007: =K1007*6+L1007 -> 116 | O1007: 21 | P1007: 19 | Q1007: =O1007*6+P1007 -> 145 | S1007: BEACH ROAD
A1008: SANDRINGHAM | C1008: 7 | D1008: 4 | E1008: =C1008*6+D1008 -> 46 | G1008: 8 | H1008: 7 | I1008: =G1008*6+H1008 -> 55 | K1008: 14 | L1008: 14 | M1008: =K1008*6+L1008 -> 98 | O1008: 17 | P1008: 16 | Q1008: =O1008*6+P1008 -> 118 | S1008: WILLIAMSON
A1009: BEST PLAYERS
A1010: WILLIAMSTOWN | C1010: SYKES | E1010: FLYNN | H1010: BUCHANAN | K1010: JOHNS | M1010: BARNES | P1010: SHEEHAN
A1011: SANDRINGHAM | C1011: BOYD | E1011: DOCKENDORFF | H1011: R KENNA | K1011: ORR | M1011: SMETHURST | P1011: JAMIESON
A1012: GOALKICKERS
A1013: WILLIAMSTOWN | C1013: W BYRNE 5 | F1013: MCDONALD 4 | I1013: SHEEHAN 4 | L1013: JOHNS 2 | N1013: BARNES 2 | Q1013: SINCLAIR | S1013: BLAKE | U1013: W O'BRIEN | X1013: BUCHANAN
A1014: SANDRINGHAM | C1014: BOYD 5 | E1014: LEE 2 | G1014: R KENNA 2 | J1014: E BOURKE 2 | M1014: NAGEL 2 | O1014: BRIDGFORD 2 | R1014: SMITH | T1014: DOCKENDORFF
A1016: ROUND 19 | E1016: 30TH AUGUST | J1016: WEATHER | M1016: CLOUDY BUT FINE | S1016: PLAYED AT | X1016: LADDER | AB1016: ROUND | AD1016: 19
D1017: 1ST QTR | H1017: 2ND QTR | L1017: 3RD QTR | P1017: FINAL | S1017: OAKLEIGH
A1018: OAKLEIGH | C1018: 3 | D1018: 0 | E1018: =C1018*6+D1018 -> 18 | G1018: 6 | H1018: 5 | I1018: =G1018*6+H1018 -> 41 | K1018: 10 | L1018: 8 | M1018: =K1018*6+L1018 -> 68 | O1018: 13 | P1018: 12 | Q1018: =O1018*6+P1018 -> 90 | S1018: UMPIRE | W1018: TEAM | X1018: W | Y1018: L | Z1018: D | AA1018: FOR | AB1018: AGST | AC1018: % | AD1018: PTS
A1019: NORTHCOTE | C1019: 3 | D1019: 5 | E1019: =C1019*6+D1019 -> 23 | G1019: 7 | H1019: 6 | I1019: =G1019*6+H1019 -> 48 | K1019: 12 | L1019: 7 | M1019: =K1019*6+L1019 -> 79 | O1019: 12 | P1019: 9 | Q1019: =O1019*6+P1019 -> 81 | S1019: STUART
A1020: BEST PLAYERS | W1020: OAKLEIGH | X1020: 15 | Y1020: 4 | Z1020: 0 | AA1020: 1781 | AB1020: 1342 | AC1020: 132.71236959761549 | AD1020: 60
A1021: OAKLEIGH | D1021: GODING | F1021: DOLAN | I1021: FLEMING | L1021: OPREY | N1021: YEMM | Q1021: SPAIN | W1021: NORTHCOTE | X1021: 14 | Y1021: 5 | Z1021: 0 | AA1021: 1843 | AB1021: 1297 | AC1021: 142.0971472629144 | AD1021: 56
A1022: NORTHCOTE | D1022: ROWE | F1022: HONIG | I1022: SEYMOUR | L1022: PERKINS | N1022: E C BRIGGS | Q1022: GARRETT | W1022: WILLIAMSTOWN | X1022: 13 | Y1022: 6 | Z1022: 0 | AA1022: 1712 | AB1022: 1484 | AC1022: 115.36388140161725 | AD1022: 52
A1023: GOALKICKERS | W1023: YARRAVILLE | X1023: 12 | Y1023: 7 | Z1023: 0 | AA1023: 1616 | AB1023: 1327 | AC1023: 121.77844762622456 | AD1023: 48
A1024: OAKLEIGH | D1024: FRASER 3 | F1024: WITHERS 3 | I1024: MAHER 2 | K1024: O'NEILL 2 | M1024: FLEMING | O1024: GODING | Q1024: OPREY
A1025: NORTHCOTE | D1025: SEYMOUR 3 | G1025: E C BRIGGS 2 | J1025: ROSS 2 | L1025: PRUSER 2 | N1025: ROWE | P1025: BROWN | R1025: MILNE | W1025: PORT MELBOURNE | X1025: 10 | Y1025: 8 | Z1025: 1 | AA1025: 1472 | AB1025: 1439 | AC1025: 102.29325920778318 | AD1025: 42
W1026: BRIGHTON | X1026: 10 | Y1026: 9 | Z1026: 0 | AA1026: 1705 | AB1026: 1594 | AC1026: 106.96 | AD1026: 40
A1027: WILLIAMSTOWN | C1027: 4 | D1027: 6 | E1027: =C1027*6+D1027 -> 30 | G1027: 7 | H1027: 13 | I1027: =G1027*6+H1027 -> 55 | K1027: 11 | L1027: 14 | M1027: =K1027*6+L1027 -> 80 | O1027: 13 | P1027: 14 | Q1027: =O1027*6+P1027 -> 92 | S1027: YARRAVILLE | W1027: PRESTON | X1027: 9 | Y1027: 9 | Z1027: 1 | AA1027: 1526 | AB1027: 1585 | AC1027: 96.28 | AD1027: 38
A1028: YARRAVILLE | C1028: 1 | D1028: 6 | E1028: =C1028*6+D1028 -> 12 | G1028: 5 | H1028: 8 | I1028: =G1028*6+H1028 -> 38 | K1028: 9 | L1028: 13 | M1028: =K1028*6+L1028 -> 67 | O1028: 12 | P1028: 18 | Q1028: =O1028*6+P1028 -> 90 | S1028: LESTER | W1028: COBURG | X1028: 8 | Y1028: 9 | Z1028: 2 | AA1028: 1499 | AB1028: 1456 | AC1028: 102.95 | AD1028: 36
A1029: BEST PLAYERS | W1029: BRUNSWICK | X1029: 7 | Y1029: 11 | Z1029: 0 | AA1029: 1375 | AB1029: 1521 | AC1029: 90.401051939513479 | AD1029: 28
A1030: WILLIAMSTOWN | D1030: J O'BRIEN | F1030: BRITT | I1030: CAHILL | K1030: SHANAHAN | N1030: McDONALD | Q1030: SHEEHAN | W1030: PRAHRAN | X1030: 6 | Y1030: 12 | Z1030: 0 | AA1030: 1277 | AB1030: 1691 | AC1030: 75.517445298639856 | AD1030: 24
A1031: YARRAVILLE | D1031: TYSON | F1031: FITZMAURICE | I1031: CAMERON | K1031: DWYER | N1031: EDWARDS | Q1031: KENNEDY | W1031: CAMBERWELL | X1031: 5 | Y1031: 13 | Z1031: 0 | AA1031: 1343 | AB1031: 1603 | AC1031: 83.78 | AD1031: 20
A1032: GOALKICKERS | W1032: SANDRINGHAM | X1032: 1 | Y1032: 17 | Z1032: 0 | AA1032: 1385 | AB1032: 2195 | AC1032: 63.097949886104786 | AD1032: 4
A1033: WILLIAMSTOWN | D1033: J O'BRIEN 4 | G1033: CAHILL 2 | I1033: SHEEHAN 2 | L1033: McDONALD 2 | O1033: SINCLAIR | Q1033: BLAKE | S1033: BRITT
A1034: YARRAVILLE | D1034: FITZMAURICE 3 | G1034: TYSON 2 | I1034: CAMERON | K1034: KENNEDY | M1034: DRISCOLL | O1034: BUTLER | Q1034: SCOTT | S1034: COOPER
A1036: PORT MELBOURNE | C1036: 3 | D1036: 2 | E1036: =C1036*6+D1036 -> 20 | G1036: 5 | H1036: 7 | I1036: =G1036*6+H1036 -> 37 | K1036: 6 | L1036: 9 | M1036: =K1036*6+L1036 -> 45 | O1036: 14 | P1036: 16 | Q1036: =O1036*6+P1036 -> 100 | S1036: PORT MELBOURNE
A1037: BRIGHTON | C1037: 3 | D1037: 5 | E1037: =C1037*6+D1037 -> 23 | G1037: 4 | H1037: 10 | I1037: =G1037*6+H1037 -> 34 | K1037: 9 | L1037: 17 | M1037: =K1037*6+L1037 -> 71 | O1037: 10 | P1037: 20 | Q1037: =O1037*6+P1037 -> 80 | S1037: McKINNON
A1038: BEST PLAYERS
A1039: PORT MELBOURNE | D1039: HYDE | G1039: WILKIN | J1039: BROOKER | M1039: LOVETT | P1039: BEDFORD | S1039: TYSON
A1040: BRIGHTON | D1040: LILBURNE | G1040: ADAMS | J1040: DORE | M1040: PETERSON | P1040: HARRISON | S1040: BURNES
A1041: GOALKICKERS
A1042: PORT MELBOURNE | D1042: McINNES 3 | F1042: LOVETT 2 | I1042: BARNES 2 | K1042: LAHIFF 2 | M1042: WILKIN | O1042: STANBRIDGE | R1042: JOYNER | U1042: TYSON | X1042: FISHER
A1043: BRIGHTON | D1043: PETERSON 3 | G1043: HARRISON 2 | J1043: TUCKER 2 | M1043: D CLOTZ | O1043: O'BRIEN | R1043: BURNES
A1045: COBURG | C1045: 3 | D1045: 2 | E1045: =C1045*6+D1045 -> 20 | G1045: 5 | H1045: 7 | I1045: =G1045*6+H1045 -> 37 | K1045: 9 | L1045: 11 | M1045: =K1045*6+L1045 -> 65 | O1045: 13 | P1045: 13 | Q1045: =O1045*6+P1045 -> 91 | S1045: PRESTON
A1046: PRESTON | C1046: 2 | D1046: 1 | E1046: =C1046*6+D1046 -> 13 | G1046: 5 | H1046: 4 | I1046: =G1046*6+H1046 -> 34 | K1046: 5 | L1046: 10 | M1046: =K1046*6+L1046 -> 40 | O1046: 9 | P1046: 15 | Q1046: =O1046*6+P1046 -> 69 | S1046: WILLIAMSON
A1047: BEST PLAYERS
A1048: COBURG | D1048: KIGHT | G1048: COLBERT | J1048: TREVASKIS | M1048: DONNELLY | P1048: BERTRAM | S1048: JENKINS
A1049: PRESTON | D1049: McCORMACK | G1049: SUMMERS | J1049: TAYLOR | M1049: MONOHAN | P1049: CHARGE | S1049: REICHMAN
A1050: GOALKICKERS
A1051: COBURG | D1051: COLBERT 8 | G1051: TREVASKIS 2 | J1051: JENKINS | L1051: MEARS | N1051: CHAPMAN
A1052: PRESTON | D1052: McCORMACK 3 | G1052: GALL 2 | I1052: TAYLOR | K1052: DAVIE | M1052: PETCHELL | P1052: SUMMERS
A1054: ROUND 20 | E1054: 6TH SEPTEMBER | J1054: WEATHER | M1054: FINE MILD NORTH WIND | S1054: PLAYED AT | X1054: LADDER | AB1054: ROUND | AD1054: 20
D1055: 1ST QTR | H1055: 2ND QTR | L1055: 3RD QTR | P1055: FINAL | S1055: WILLIAMSTOWN
A1056: OAKLEIGH | C1056: 1 | D1056: 3 | E1056: =C1056*6+D1056 -> 9 | G1056: 5 | H1056: 7 | I1056: =G1056*6+H1056 -> 37 | K1056: 7 | L1056: 9 | M1056: =K1056*6+L1056 -> 51 | O1056: 9 | P1056: 11 | Q1056: =O1056*6+P1056 -> 65 | S1056: UMPIRE | W1056: TEAM | X1056: W | Y1056: L | Z1056: D | AA1056: FOR | AB1056: AGST | AC1056: % | AD1056: PTS
A1057: WILLIAMSTOWN | C1057: 1 | D1057: 2 | E1057: =C1057*6+D1057 -> 8 | G1057: 2 | H1057: 2 | I1057: =G1057*6+H1057 -> 14 | K1057: 5 | L1057: 5 | M1057: =K1057*6+L1057 -> 35 | O1057: 8 | P1057: 5 | Q1057: =O1057*6+P1057 -> 53 | S1057: McKINNON
A1058: BEST PLAYERS | W1058: OAKLEIGH | X1058: 16 | Y1058: 4 | Z1058: 0 | AA1058: 1846 | AB1058: 1395 | AC1058: 132.32974910394265 | AD1058: 64
A1059: OAKLEIGH | D1059: YEMM | G1059: OPREY | I1059: RUDOLPH | L1059: SPAIN | O1059: WITHERS | R1059: SALTER | W1059: NORTHCOTE | X1059: 15 | Y1059: 5 | Z1059: 0 | AA1059: 1990 | AB1059: 1382 | AC1059: 143.99421128798843 | AD1059: 60
A1060: WILLIAMSTOWN | D1060: HELLWIG | G1060: SYKES | I1060: BYRNE | L1060: SHANAHAN | O1060: McKENZIE | R1060: CAHILL | W1060: WILLIAMSTOWN | X1060: 13 | Y1060: 7 | Z1060: 0 | AA1060: 1765 | AB1060: 1549 | AC1060: 113.94448030987733 | AD1060: 52
A1061: GOALKICKERS | W1061: YARRAVILLE | X1061: 12 | Y1061: 8 | Z1061: 0 | AA1061: 1701 | AB1061: 1474 | AC1061: 115.40027137042063 | AD1061: 48
A1062: OAKLEIGH | D1062: FLEMING 2 | G1062: WITHERS 2 | J1062: FRASER 2 | M1062: O'NEILL 2 | P1062: SALTER
A1063: WILLIAMSTOWN | D1063: BYRNE 2 | G1063: DIXON 2 | I1063: CAHILL | K1063: BLAKE | M1063: O'CONNOR | P1063: SINCLAIR | W1063: PORT MELBOURNE | X1063: 10 | Y1063: 9 | Z1063: 1 | AA1063: 1560 | AB1063: 1556 | AC1063: 100.25706940874036 | AD1063: 42
W1064: PRESTON | X1064: 10 | Y1064: 9 | Z1064: 1 | AA1064: 1630 | AB1064: 1672 | AC1064: 97.49 | AD1064: 42
A1065: NORTHCOTE | C1065: 6 | D1065: 2 | E1065: =C1065*6+D1065 -> 38 | G1065: 11 | H1065: 3 | I1065: =G1065*6+H1065 -> 69 | K1065: 16 | L1065: 15 | M1065: =K1065*6+L1065 -> 111 | O1065: 22 | P1065: 15 | Q1065: =O1065*6+P1065 -> 147 | S1065: NORTHCOTE | W1065: BRIGHTON | X1065: 10 | Y1065: 10 | Z1065: 0 | AA1065: 1792 | AB1065: 1698 | AC1065: 105.54 | AD1065: 40
A1066: YARRAVILLE | C1066: 3 | D1066: 2 | E1066: =C1066*6+D1066 -> 20 | G1066: 6 | H1066: 7 | I1066: =G1066*6+H1066 -> 43 | K1066: 7 | L1066: 14 | M1066: =K1066*6+L1066 -> 56 | O1066: 11 | P1066: 19 | Q1066: =O1066*6+P1066 -> 85 | S1066: MORCOM | W1066: COBURG | X1066: 9 | Y1066: 9 | Z1066: 2 | AA1066: 1616 | AB1066: 1544 | AC1066: 104.66 | AD1066: 40
A1067: BEST PLAYERS | W1067: BRUNSWICK | X1067: 7 | Y1067: 11 | Z1067: 0 | AA1067: 1375 | AB1067: 1521 | AC1067: 90.401051939513479 | AD1067: 28
A1068: NORTHCOTE | D1068: PERKINS | G1068: SEYMOUR | I1068: PRUSER | L1068: WOODS | O1068: CORRIGAN | R1068: BROWN | W1068: PRAHRAN | X1068: 6 | Y1068: 12 | Z1068: 0 | AA1068: 1277 | AB1068: 1691 | AC1068: 75.517445298639856 | AD1068: 24
A1069: YARRAVILLE | D1069: BUTLER | G1069: EVANS | I1069: JOYCE | L1069: MILNE | O1069: HUNTER | R1069: ROWE | W1069: CAMBERWELL | X1069: 5 | Y1069: 13 | Z1069: 0 | AA1069: 1343 | AB1069: 1603 | AC1069: 83.78 | AD1069: 20
A1070: GOALKICKERS | W1070: SANDRINGHAM | X1070: 1 | Y1070: 17 | Z1070: 0 | AA1070: 1385 | AB1070: 2195 | AC1070: 63.097949886104786 | AD1070: 4
A1071: NORTHCOTE | D1071: SEYMOUR 9 | G1071: PRUSER 5 | J1071: E C BRIGGS 3 | M1071: GRAY 3 | O1071: ROSS | Q1071: BROWN
A1072: YARRAVILLE | D1072: HUNTER 3 | G1072: McHENRY 3 | J1072: LOVETT 2 | M1072: JOYCE 2 | O1072: KENNEDY
A1074: PRESTON | C1074: 1 | D1074: 1 | E1074: =C1074*6+D1074 -> 7 | G1074: 8 | H1074: 6 | I1074: =G1074*6+H1074 -> 54 | K1074: 11 | L1074: 8 | M1074: =K1074*6+L1074 -> 74 | O1074: 15 | P1074: 14 | Q1074: =O1074*6+P1074 -> 104 | S1074: ELSTERNWICK PARK
A1075: BRIGHTON | C1075: 7 | D1075: 6 | E1075: =C1075*6+D1075 -> 48 | G1075: 8 | H1075: 8 | I1075: =G1075*6+H1075 -> 56 | K1075: 12 | L1075: 14 | M1075: =K1075*6+L1075 -> 86 | O1075: 12 | P1075: 15 | Q1075: =O1075*6+P1075 -> 87 | S1075: LESTER
A1076: BEST PLAYERS
A1077: PRESTON | D1077: DODD | G1077: MACKIE | J1077: SUMMERS | M1077: TAYLOR | P1077: SURTEES | S1077: GRAY
A1078: BRIGHTON | D1078: BARNES | G1078: LILBURNE | J1078: CAMPBELL | M1078: MORCAM | P1078: HUNT | S1078: ROSENBROCK
A1079: GOALKICKERS
A1080: PRESTON | D1080: GRAY 5 | G1080: SURTEES 3 | J1080: McCORMACK 3 | M1080: MONOHAN 3 | P1080: MACKIE
A1081: BRIGHTON | D1081: MORCAM 3 | G1081: PETERSON 3 | J1081: LILBURNE 2 | M1081: TUCKER 2 | P1081: ELLIOTT | R1081: BURNES
A1083: COBURG | C1083: 4 | D1083: 1 | E1083: =C1083*6+D1083 -> 25 | G1083: 13 | H1083: 10 | I1083: =G1083*6+H1083 -> 88 | K1083: 14 | L1083: 15 | M1083: =K1083*6+L1083 -> 99 | O1083: 17 | P1083: 15 | Q1083: =O1083*6+P1083 -> 117 | S1083: COBURG
A1084: PORT MELBOURNE | C1084: 5 | D1084: 4 | E1084: =C1084*6+D1084 -> 34 | G1084: 7 | H1084: 5 | I1084: =G1084*6+H1084 -> 47 | K1084: 12 | L1084: 8 | M1084: =K1084*6+L1084 -> 80 | O1084: 13 | P1084: 10 | Q1084: =O1084*6+P1084 -> 88 | S1084: STEWART
A1085: BEST PLAYERS
A1086: COBURG | D1086: ROGERS | G1086: MARTIN | J1086: BERTRAM | M1086: GREGORY | P1086: DONNELLY | S1086: FORD
A1087: PORT MELBOURNE | D1087: JOYNER | G1087: FISHER | J1087: HYDE | M1087: LAHIFF | P1087: BARNES | S1087: BEDFORD
A1088: GOALKICKERS
A1089: COBURG | D1089: ROGERS 6 | F1089: CHAPMAN 3 | I1089: VOIGHT 2 | K1089: TREVASKIS 2 | N1089: COLBERT | P1089: ROWE | R1089: MEARS | T1089: KIGHT
A1090: PORT MELBOURNE | D1090: TYSON 5 | G1090: JOYNER 3 | I1090: McINNES | K1090: BARNES | M1090: STANBRIDGE | P1090: PLUMRIDGE | S1090: FINNEGAN
A1092: FINALS
A1093: 1ST SEMI | E1093: 13TH SEPTEMBER | J1093: WEATHER | M1093: COOL CLOUDY VERY STRONG S.W. WIND
D1094: 1ST QTR | H1094: 2ND QTR | L1094: 3RD QTR | P1094: FINAL
A1095: NORTHCOTE | C1095: 3 | D1095: 5 | E1095: =C1095*6+D1095 -> 23 | G1095: 4 | H1095: 6 | I1095: =G1095*6+H1095 -> 30 | K1095: 9 | L1095: 11 | M1095: =K1095*6+L1095 -> 65 | O1095: 9 | P1095: 11 | Q1095: =O1095*6+P1095 -> 65 | S1095: N.M.
A1096: YARRAVILLE | C1096: 0 | D1096: 0 | E1096: =C1096*6+D1096 -> 0 | G1096: 4 | H1096: 3 | I1096: =G1096*6+H1096 -> 27 | K1096: 5 | L1096: 3 | M1096: =K1096*6+L1096 -> 33 | O1096: 5 | P1096: 11 | Q1096: =O1096*6+P1096 -> 41 | S1096: McKINNON
A1097: BEST PLAYERS
A1098: NORTHCOTE | D1098: GARRETT | G1098: WILSON | J1098: BROWN | M1098: SEYMOUR | P1098: MILNE | S1098: WOODS
A1099: YARRAVILLE | D1099: DWYER | G1099: FITZMAURICE | J1099: HUNTER | M1099: SMITH | P1099: EDWARDS | S1099: JOYCE
A1100: GOALKICKERS
A1101: NORTHCOTE | D1101: SEYMOUR 4 | G1101: STOCKDALE 2 | J1101: ROWE | L1101: BROWN | N1101: GRAY
A1102: YARRAVILLE | D1102: FITZMAURICE 3 | H1102: KENNEDY | K1102: SMITH
A1104: 2ND SEMI | E1104: 20TH SEPTEMBER | J1104: WEATHER | M1104: FINE MILD
A1105: OAKLEIGH | C1105: 4 | D1105: 1 | E1105: =C1105*6+D1105 -> 25 | G1105: 5 | H1105: 5 | I1105: =G1105*6+H1105 -> 35 | K1105: 8 | L1105: 7 | M1105: =K1105*6+L1105 -> 55 | O1105: 11 | P1105: 10 | Q1105: =O1105*6+P1105 -> 76 | S1105: N.M.
A1106: WILLIAMSTOWN | C1106: 1 | D1106: 5 | E1106: =C1106*6+D1106 -> 11 | G1106: 3 | H1106: 10 | I1106: =G1106*6+H1106 -> 28 | K1106: 5 | L1106: 14 | M1106: =K1106*6+L1106 -> 44 | O1106: 6 | P1106: 15 | Q1106: =O1106*6+P1106 -> 51 | S1106: McKINNON
A1107: BEST PLAYERS
A1108: OAKLEIGH | D1108: OPREY | G1108: O'NEILL | J1108: McALLISTER | M1108: CHAPMAN | P1108: MAHER | S1108: DOLAN
A1109: WILLIAMSTOWN | D1109: SHANAHAN | G1109: HELLWIG | J1109: W O'BRIEN | M1109: FLYNN | P1109: CAHILL | S1109: SINCLAIR
A1110: GOALKICKERS
A1111: OAKLEIGH | D1111: WITHERS 3 | G1111: FRASER 2 | J1111: CHAPMAN | M1111: FLEMING | O1111: SALTER | Q1111: MAHER | S1111: O'NEILL | V1111: YEMM
A1112: WILLIAMSTOWN | D1112: SHEEHAN | G1112: McDONALD | J1112: BLAKE | M1112: FLYNN | O1112: CAHILL | Q1112: SINCLAIR
A1114: GRAND FINAL | E1114: 27TH SEPTEMBER | J1114: WEATHER | M1114: COOL CLOUDY S.W. WIND
A1115: OAKLEIGH | C1115: 5 | D1115: 1 | E1115: 31 | G1115: 5 | H1115: 1 | I1115: 31 | K1115: 8 | L1115: 5 | M1115: 53 | O1115: 9 | P1115: 6 | Q1115: 60 | S1115: N.M.
A1116: NORTHCOTE | C1116: 1 | D1116: 1 | E1116: 7 | G1116: 5 | H1116: 4 | I1116: 34 | K1116: 6 | L1116: 5 | M1116: 41 | O1116: 7 | P1116: 9 | Q1116: 51 | S1116: MCKINNON
A1117: BEST PLAYERS
A1118: OAKLEIGH | D1118: RUDOLPH | G1118: FLEMING | J1118: BEASLEY | M1118: MAHER | P1118: WITHERS | S1118: THOMAS
A1119: NORTHCOTE | D1119: BROWN | G1119: WOODS | J1119: NICHOLLS | M1119: E C BRIGGS | P1119: WILSON | S1119: PERKINS
A1120: GOALKICKERS
A1121: OAKLEIGH | D1121: FRASER 4 | G1121: GODING | J1121: DOLAN | L1121: WITHERS | N1121: ALLISON | P1121: OPREY
A1122: NORTHCOTE | D1122: SEYMOUR 3 | G1122: E C BRIGGS 2 | K1122: BROWN | M1122: STOCKDALE
A1125: TEAMS
F1126: OAKLEIGH
A1127: BACKS | C1127: NOTT | F1127: McALISTER | J1127: O'NEILL
A1128: H-BACKS | C1128: DOLAN | F1128: RUDOLPH | J1128: THOMS
A1129: CENTRES | C1129: GODING | F1129: BEASLEY | J1129: DRIVER
A1130: H-FORWARDS | C1130: OPREY | F1130: FLEMING | J1130: WITHERS
A1131: FORWARDS | C1131: YEMM | F1131: FRASER | J1131: SALTER
A1132: RUCKS | C1132: SPAIN | F1132: WILTSHIRE | J1132: MAHER
A1133: RES | C1133: ALLISON