A1: Victorian Football Association
A2: Season 1931
A3: © Copyright Wal Williams | F3: First created: 2 November 2014
A4: Contact: joywalwi at gmail dot com | F4: Last updated: 27 January 2018 | W4: VFA Results and tables - Link to the main index page
A5: You are free to copy this document in whole or part provided that proper acknowledgement is given to the author. All rights reserved.
A7: YEAR 1931
A8: ROUND 1 | E8: 18TH APRIL | J8: WEATHER | M8: CLOUDY BUT FINE WEST WIND | S8: PLAYED AT
D9: 1ST QTR | H9: 2ND QTR | L9: 3RD QTR | P9: FINAL | S9: COBURG
A10: COBURG | C10: 3 | D10: 4 | E10: =C10*6+D10 -> 22 | G10: 6 | H10: 7 | I10: =G10*6+H10 -> 43 | K10: 10 | L10: 11 | M10: =K10*6+L10 -> 71 | O10: 12 | P10: 15 | Q10: =O10*6+P10 -> 87 | S10: UMPIRE | X10: LADDER | AB10: ROUND | AD10: 1
A11: BRUNSWICK | C11: 2 | D11: 1 | E11: =C11*6+D11 -> 13 | G11: 6 | H11: 3 | I11: =G11*6+H11 -> 39 | K11: 9 | L11: 9 | M11: =K11*6+L11 -> 63 | O11: 10 | P11: 14 | Q11: =O11*6+P11 -> 74 | S11: LESTER
A12: BEST PLAYERS | W12: TEAM | X12: W | Y12: L | Z12: D | AA12: FOR | AB12: AGST | AC12: % | AD12: PTS
A13: COBURG | C13: JENKINS | E13: PLANT | H13: MEARS | K13: KIGHT | N13: DONNELLY | Q13: ROGERS
A14: BRUNSWICK | C14: HEARN | E14: McNEILL | H14: ANDERSON | K14: WHITE | N14: DOWLING | Q14: FRASER | W14: PORT MELBOURNE | X14: 1 | Y14: 0 | Z14: 0 | AA14: 131 | AB14: 55 | AC14: 238.18181818181819 | AD14: 4
A15: GOALKICKERS | W15: WILLIAMSTOWN | X15: 1 | Y15: 0 | Z15: 0 | AA15: 117 | AB15: 85 | AC15: 137.64705882352942 | AD15: 4
A16: COBURG | C16: PLANT 8 | F16: MEARS 2 | I16: O'KEEFE | K16: KIGHT | W16: OAKLEIGH | X16: 1 | Y16: 0 | Z16: 0 | AA16: 97 | AB16: 77 | AC16: 125.97402597402598 | AD16: 4
A17: BRUNSWICK | C17: FRASER 5 | F17: PENMAN | I17: PANNAM | K17: MAYNE | M17: ANDERSON | P17: DOWLING | W17: COBURG | X17: 1 | Y17: 0 | Z17: 0 | AA17: 87 | AB17: 74 | AC17: 117.56756756756756 | AD17: 4
A19: NORTHCOTE | C19: 3 | D19: 5 | E19: =C19*6+D19 -> 23 | G19: 4 | H19: 5 | I19: =G19*6+H19 -> 29 | K19: 8 | L19: 7 | M19: =K19*6+L19 -> 55 | O19: 12 | P19: 10 | Q19: =O19*6+P19 -> 82 | S19: NORTHCOTE | W19: SANDRINGHAM | X19: 1 | Y19: 0 | Z19: 0 | AA19: 120 | AB19: 112 | AC19: 107.14285714285714 | AD19: 4
A20: PRESTON | C20: 3 | D20: 4 | E20: =C20*6+D20 -> 22 | G20: 3 | H20: 7 | I20: =G20*6+H20 -> 25 | K20: 9 | L20: 11 | M20: =K20*6+L20 -> 65 | O20: 11 | P20: 13 | Q20: =O20*6+P20 -> 79 | S20: MORCOM | W20: NORTHCOTE | X20: 1 | Y20: 0 | Z20: 0 | AA20: 82 | AB20: 79 | AC20: 103.79746835443038 | AD20: 4
A21: BEST PLAYERS | W21: PRESTON | X21: 0 | Y21: 1 | Z21: 0 | AA21: 79 | AB21: 82 | AC21: 96.341463414634148 | AD21: 0
A22: NORTHCOTE | C22: CORRIGAN | E22: ROWE | H22: COLE | K22: BRIGGS | N22: GRAY | Q22: PERKINS | W22: BRIGHTON | X22: 0 | Y22: 1 | Z22: 0 | AA22: 112 | AB22: 120 | AC22: 93.333333333333329 | AD22: 0
A23: PRESTON | C23: MONOHAN | E23: GRAY | H23: ESCOTT | K23: CAMPBELL | N23: DODD | Q23: O'DOHERTY | W23: BRUNSWICK | X23: 0 | Y23: 1 | Z23: 0 | AA23: 74 | AB23: 87 | AC23: 85.05747126436782 | AD23: 0
A24: GOALKICKERS | W24: CAMBERWELL | X24: 0 | Y24: 1 | Z24: 0 | AA24: 77 | AB24: 97 | AC24: 79.381443298969074 | AD24: 0
A25: NORTHCOTE | C25: BRIGGS 4 | E25: COLE 3 | G25: SEYMOUR 2 | J25: HUMPHRIES | M25: SIMMONDS | P25: GRAY | W25: YARRAVILLE | X25: 0 | Y25: 1 | Z25: 0 | AA25: 85 | AB25: 117 | AC25: 72.649572649572647 | AD25: 0
A26: PRESTON | C26: WARR 3 | E26: McEACHERN 3 | H26: ESCOTT | J26: CAMPBELL | M26: GALL | O26: DAVIE | Q26: DODD | W26: PRAHRAN | X26: 0 | Y26: 1 | Z26: 0 | AA26: 55 | AB26: 131 | AC26: 41.984732824427482 | AD26: 0
A28: OAKLEIGH | C28: 6 | D28: 1 | E28: =C28*6+D28 -> 37 | G28: 8 | H28: 7 | I28: =G28*6+H28 -> 55 | K28: 11 | L28: 8 | M28: =K28*6+L28 -> 74 | O28: 14 | P28: 13 | Q28: =O28*6+P28 -> 97 | S28: OAKLEIGH
A29: CAMBERWELL | C29: 2 | D29: 1 | E29: =C29*6+D29 -> 13 | G29: 5 | H29: 6 | I29: =G29*6+H29 -> 36 | K29: 8 | L29: 9 | M29: =K29*6+L29 -> 57 | O29: 11 | P29: 11 | Q29: =O29*6+P29 -> 77 | S29: SCHAEFER
A30: BEST PLAYERS
A31: OAKLEIGH | C31: RUDOLPH | F31: FLEMING | J31: SPAIN | M31: McALLISTER | P31: FRASER | S31: McPHERSON
A32: CAMBERWELL | C32: GREENWOOD | F32: QUARTERMAIN | J32: PETRIE | M32: MURPHY | P32: CALWELL | S32: WILLIAMS
A33: GOALKICKERS
A34: OAKLEIGH | C34: McPHERSON 4 | F34: FRASER 3 | I34: WITHERS 2 | L34: RODWELL | N34: CHAPMAN | Q34: DRIVER | S34: FLEMING | W34: GODING
A35: CAMBERWELL | C35: WILLIAMS 4 | F35: MURPHY 3 | I35: HENDERSON | L35: CALWELL | N35: WHITTY | P35: STRACHAN
A37: SANDRINGHAM | C37: 2 | D37: 5 | E37: =C37*6+D37 -> 17 | G37: 8 | H37: 12 | I37: =G37*6+H37 -> 60 | K37: 11 | L37: 13 | M37: =K37*6+L37 -> 79 | O37: 17 | P37: 18 | Q37: =O37*6+P37 -> 120 | S37: BEACH ROAD
A38: BRIGHTON | C38: 5 | D38: 5 | E38: =C38*6+D38 -> 35 | G38: 7 | H38: 5 | I38: =G38*6+H38 -> 47 | K38: 12 | L38: 14 | M38: =K38*6+L38 -> 86 | O38: 16 | P38: 16 | Q38: =O38*6+P38 -> 112 | S38: McINERNEY
A39: BEST PLAYERS
A40: SANDRINGHAM | C40: DOCKENDORFF | F40: E BOURKE | I40: BECKTON | L40: A KENNA | O40: CHALLIS | R40: YEMM
A41: BRIGHTON | C41: BARNES | F41: HUNT | I41: PETERSON | L41: CLOTZ | O41: TUCKER | R41: ROSENBROCK
A42: GOALKICKERS
A43: SANDRINGHAM | C43: DOCKENDORFF 5 | G43: FORBES 3 | I43: FITZGERALD 3 | L43: DE LUCA 3 | N43: R KENNA 2 | Q43: M BOURKE
A44: BRIGHTON | C44: PETERSON 9 | F44: BARNES 3 | I44: CLOTZ 3 | L44: MARSHALL
A46: PORT MELBOURNE | C46: 2 | D46: 4 | E46: =C46*6+D46 -> 16 | G46: 10 | H46: 13 | I46: =G46*6+H46 -> 73 | K46: 11 | L46: 16 | M46: =K46*6+L46 -> 82 | O46: 18 | P46: 23 | Q46: =O46*6+P46 -> 131 | S46: TOORAK PARK
A47: PRAHRAN | C47: 4 | D47: 4 | E47: =C47*6+D47 -> 28 | G47: 5 | H47: 8 | I47: =G47*6+H47 -> 38 | K47: 6 | L47: 12 | M47: =K47*6+L47 -> 48 | O47: 7 | P47: 13 | Q47: =O47*6+P47 -> 55 | S47: McLACHLAN
A48: BEST PLAYERS
A49: PORT MELBOURNE | C49: BOLMAN | E49: BARLOW | H49: STANBRIDGE | K49: PLUMRIDGE | N49: CROMPTON | Q49: BARNES
A50: PRAHRAN | C50: KOOP | E50: NECK | H50: LORD | K50: DARVALL | N50: BRUCE | Q50: ANDERSON
A51: GOALKICKERS
A52: PORT MELBOURNE | C52: PLUMRIDGE 4 | F52: McINNES 3 | I52: BARNES 3 | K52: PERRETT 2 | N52: TUITE 2 | P52: LAHIFF 2 | R52: BEDFORD | U52: McKENZIE
A53: PRAHRAN | C53: HILL 4 | F53: LORD 2 | I53: ALLEN
A55: WILLIAMSTOWN | C55: 2 | D55: 4 | E55: =C55*6+D55 -> 16 | G55: 7 | H55: 7 | I55: =G55*6+H55 -> 49 | K55: 11 | L55: 16 | M55: =K55*6+L55 -> 82 | O55: 16 | P55: 21 | Q55: =O55*6+P55 -> 117 | S55: YARRAVILLE
A56: YARRAVILLE | C56: 2 | D56: 1 | E56: =C56*6+D56 -> 13 | G56: 3 | H56: 10 | I56: =G56*6+H56 -> 28 | K56: 8 | L56: 11 | M56: =K56*6+L56 -> 59 | O56: 12 | P56: 13 | Q56: =O56*6+P56 -> 85 | S56: STUART
A57: BEST PLAYERS
A58: WILLIAMSTOWN | C58: SYKES | E58: CAHILL | H58: DREW | K58: SHANAHAN | N58: GOGGIN | Q58: DORGAN
A59: YARRAVILLE | C59: EVANS | E59: FITZMAURICE | H59: TYSON | K59: BUCKLEY | N59: BROWN | Q59: WUNHYM
A60: GOALKICKERS
A61: WILLIAMSTOWN | C61: WINNELL 3 | F61: GOGGIN 3 | I61: SHEEHAN 3 | L61: SINCLAIR 3 | N61: CAHILL 2 | Q61: BLAKE | S61: McDONALD
A62: YARRAVILLE | C62: BUCKLEY 3 | F62: KENNEDY 2 | I62: FITZMAURICE 2 | L62: EVANS | N62: DRISCOLL | Q62: PREWETT | S62: CAMERON | V62: STANLEY
A64: ROUND 2 | E64: 2ND MAY | J64: WEATHER | M64: CLOUDY S.W. WIND | S64: PLAYED AT
D65: 1ST QTR | H65: 2ND QTR | L65: 3RD QTR | P65: FINAL | S65: WILLIAMSTOWN
A66: OAKLEIGH | C66: 3 | D66: 3 | E66: =C66*6+D66 -> 21 | G66: 5 | H66: 4 | I66: =G66*6+H66 -> 34 | K66: 8 | L66: 5 | M66: =K66*6+L66 -> 53 | O66: 14 | P66: 12 | Q66: =O66*6+P66 -> 96 | S66: UMPIRE | X66: LADDER | AB66: ROUND | AD66: 2
A67: WILLIAMSTOWN | C67: 2 | D67: 2 | E67: =C67*6+D67 -> 14 | G67: 4 | H67: 6 | I67: =G67*6+H67 -> 30 | K67: 6 | L67: 13 | M67: =K67*6+L67 -> 49 | O67: 6 | P67: 13 | Q67: =O67*6+P67 -> 49 | S67: MORCAM
A68: BEST PLAYERS | W68: TEAM | X68: W | Y68: L | Z68: D | AA68: FOR | AB68: AGST | AC68: % | AD68: PTS
A69: OAKLEIGH | C69: RODWELL | E69: FLEMING | G69: RUDOLPH | J69: McALLISTER | N69: FRASER | Q69: THOMAS
A70: WILLIAMSTOWN | C70: O'BRIEN | E70: CAHILL | G70: SYKES | J70: BYRNE | N70: SHANAHAN | Q70: SHEEHAN | W70: OAKLEIGH | X70: 2 | Y70: 0 | Z70: 0 | AA70: 193 | AB70: 126 | AC70: 153.17460317460316 | AD70: 8
A71: GOALKICKERS | W71: NORTHCOTE | X71: 2 | Y71: 0 | Z71: 0 | AA71: 176 | AB71: 154 | AC71: 114.28571428571429 | AD71: 8
A72: OAKLEIGH | C72: FRASER 4 | F72: FLEMING 4 | I72: MAHER 3 | L72: YEMM 2 | N72: RODWELL | W72: PORT MELBOURNE | X72: 1 | Y72: 1 | Z72: 0 | AA72: 198 | AB72: 126 | AC72: 157.14285714285714 | AD72: 4
A73: WILLIAMSTOWN | C73: GOGGIN 2 | F73: CAHILL 2 | I73: SHEEHAN | L73: JOHNS | W73: COBURG | X73: 1 | Y73: 1 | Z73: 0 | AA73: 178 | AB73: 168 | AC73: 105.95238095238095 | AD73: 4
A75: PRESTON | C75: 4 | D75: 4 | E75: =C75*6+D75 -> 28 | G75: 8 | H75: 8 | I75: =G75*6+H75 -> 56 | K75: 12 | L75: 11 | M75: =K75*6+L75 -> 83 | O75: 13 | P75: 16 | Q75: =O75*6+P75 -> 94 | S75: PRESTON | W75: BRUNSWICK | X75: 1 | Y75: 1 | Z75: 0 | AA75: 162 | AB75: 153 | AC75: 105.88235294117646 | AD75: 4
A76: COBURG | C76: 5 | D76: 1 | E76: =C76*6+D76 -> 31 | G76: 7 | H76: 6 | I76: =G76*6+H76 -> 48 | K76: 11 | L76: 6 | M76: =K76*6+L76 -> 72 | O76: 14 | P76: 7 | Q76: =O76*6+P76 -> 91 | S76: MOWLAM | W76: CAMBERWELL | X76: 1 | Y76: 1 | Z76: 0 | AA76: 193 | AB76: 183 | AC76: 105.46448087431693 | AD76: 4
A77: BEST PLAYERS | W77: PRESTON | X77: 1 | Y77: 1 | Z77: 0 | AA77: 173 | AB77: 173 | AC77: 100 | AD77: 4
A78: PRESTON | C78: DAVIE | E78: TAYLOR | G78: SUMMERS | J78: WARR | N78: SEEBECK | Q78: CAZALY | W78: SANDRINGHAM | X78: 1 | Y78: 1 | Z78: 0 | AA78: 186 | AB78: 200 | AC78: 93 | AD78: 4
A79: COBURG | C79: MEARS | E79: DUNCAN | G79: LEAHY | J79: LOWE | N79: McGRATH | Q79: CHAPMAN | W79: WILLIAMSTOWN | X79: 1 | Y79: 1 | Z79: 0 | AA79: 166 | AB79: 181 | AC79: 91.712707182320443 | AD79: 4
A80: GOALKICKERS | W80: YARRAVILLE | X80: 1 | Y80: 1 | Z80: 0 | AA80: 156 | AB80: 184 | AC80: 84.782608695652172 | AD80: 4
A81: PRESTON | C81: MCEACHERN 4 | F81: CAMPBELL 2 | I81: CAZALY 2 | K81: IZZARD 2 | M81: GALL | O81: DAVIE | Q81: SUMMERS | W81: BRIGHTON | X81: 0 | Y81: 2 | Z81: 0 | AA81: 187 | AB81: 214 | AC81: 87.383177570093451 | AD81: 0
A82: COBURG | C82: MEARS 7 | F82: DEEGAN 3 | I82: PLANT 2 | K82: HARRIS | M82: WILLOX | W82: PRAHRAN | X82: 0 | Y82: 2 | Z82: 0 | AA82: 141 | AB82: 247 | AC82: 57.085020242914979 | AD82: 0
A84: NORTHCOTE | C84: 3 | D84: 6 | E84: =C84*6+D84 -> 24 | G84: 5 | H84: 8 | I84: =G84*6+H84 -> 38 | K84: 11 | L84: 12 | M84: =K84*6+L84 -> 78 | O84: 13 | P84: 16 | Q84: =O84*6+P84 -> 94 | S84: ELSTERNWICK PARK
A85: BRIGHTON | C85: 1 | D85: 3 | E85: =C85*6+D85 -> 9 | G85: 5 | H85: 5 | I85: =G85*6+H85 -> 35 | K85: 7 | L85: 10 | M85: =K85*6+L85 -> 52 | O85: 10 | P85: 15 | Q85: =O85*6+P85 -> 75 | S85: HASSETT
A86: BEST PLAYERS
A87: NORTHCOTE | C87: SEYMOUR | F87: ROWE | I87: NICHOLLS | M87: SIMMONDS | P87: McSWAIN | S87: COCKRAM
A88: BRIGHTON | C88: SCHENCK | F88: PETERSON | I88: STOREY | M88: LILBURNE | P88: BARNES | S88: HUNT
A89: GOALKICKERS
A90: NORTHCOTE | C90: SEYMOUR 7 | F90: SIMMONDS 3 | I90: BRIGGS 2 | L90: POULTER
A91: BRIGHTON | C91: PETERSON 3 | F91: LILBURNE 3 | I91: BURNES 2 | L91: TUCKER | O91: ALEXANDER
A93: BRUNSWICK | C93: 2 | D93: 7 | E93: =C93*6+D93 -> 19 | G93: 7 | H93: 8 | I93: =G93*6+H93 -> 50 | K93: 12 | L93: 12 | M93: =K93*6+L93 -> 84 | O93: 12 | P93: 16 | Q93: =O93*6+P93 -> 88 | S93: BRUNSWICK
A94: SANDRINGHAM | C94: 0 | D94: 7 | E94: =C94*6+D94 -> 7 | G94: 2 | H94: 7 | I94: =G94*6+H94 -> 19 | K94: 5 | L94: 9 | M94: =K94*6+L94 -> 39 | O94: 9 | P94: 12 | Q94: =O94*6+P94 -> 66 | S94: GREGORY
A95: BEST PLAYERS
A96: BRUNSWICK | C96: FRASER | F96: CARTON | I96: JOHNSTONE | L96: HEARN | O96: EUDEY | R96: WARDEN
A97: SANDRINGHAM | C97: BECKTON | F97: CHALLIS | I97: LUNN | L97: E BOURKE | O97: FORBES | R97: HUDD
A98: GOALKICKERS
A99: BRUNSWICK | C99: FRASER 6 | F99: ANDERSON 2 | J99: BRAY 2 | N99: WARDEN 2
A100: SANDRINGHAM | C100: FORBES 3 | F100: R KENNA 3 | J100: RAYMENT 2 | N100: A ANDERSON
A102: CAMBERWELL | C102: 4 | D102: 5 | E102: =C102*6+D102 -> 29 | G102: 10 | H102: 8 | I102: =G102*6+H102 -> 68 | K102: 13 | L102: 8 | M102: =K102*6+L102 -> 86 | O102: 17 | P102: 14 | Q102: =O102*6+P102 -> 116 | S102: CAMBERWELL
A103: PRAHRAN | C103: 1 | D103: 1 | E103: =C103*6+D103 -> 7 | G103: 2 | H103: 7 | I103: =G103*6+H103 -> 19 | K103: 11 | L103: 12 | M103: =K103*6+L103 -> 78 | O103: 12 | P103: 14 | Q103: =O103*6+P103 -> 86 | S103: STUART
A104: BEST PLAYERS
A105: CAMBERWELL | C105: LUFF | F105: QUARTERMAIN | J105: WILLIAMS | M105: PETRIE | O105: JONES | Q105: HENDERSON
A106: PRAHRAN | C106: KOOP | F106: ADAMS | J106: GREENWOOD | M106: RENNIE | O106: WILLIAMS | Q106: LORD
A107: GOALKICKERS
A108: CAMBERWELL | C108: LUFF 6 | E108: WILLIAMS 3 | H108: MURPHY 3 | J108: PETRIE 2 | L108: CALWELL | N108: STRACHAN | Q108: COLLINS
A109: PRAHRAN | C109: ADAMS 3 | E109: WILLIAMS 2 | H109: HILL | I109: LORD | J109: ANDERSON | M109: FEATHERSTONE | P109: LUCAS | R109: RENNIE | U109: JORDAN
A111: YARRAVILLE | C111: 4 | D111: 4 | E111: =C111*6+D111 -> 28 | G111: 5 | H111: 7 | I111: =G111*6+H111 -> 37 | K111: 8 | L111: 10 | M111: =K111*6+L111 -> 58 | O111: 10 | P111: 11 | Q111: =O111*6+P111 -> 71 | S111: PORT MELBOURNE
A112: PORT MELBOURNE | C112: 2 | D112: 2 | E112: =C112*6+D112 -> 14 | G112: 5 | H112: 8 | I112: =G112*6+H112 -> 38 | K112: 6 | L112: 12 | M112: =K112*6+L112 -> 48 | O112: 8 | P112: 19 | Q112: =O112*6+P112 -> 67 | S112: LESTER
A113: BEST PLAYERS
A114: YARRAVILLE | C114: FITZMAURICE | F114: HUNTER | I114: PENNY | L114: DWYER | O114: LAWN | Q114: BUCKLEY
A115: PORT MELBOURNE | C115: LAHIFF | F115: HYDE | I115: BOLMAN | L115: PLUMRIDGE | O115: PERRETT | Q115: GARRETT
A116: GOALKICKERS
A117: YARRAVILLE | C117: BUCKLEY 3 | F117: LAWN 3 | I117: CAMERON 2 | L117: TYSON | N117: D BROWN
A118: PORT MELBOURNE | C118: LAHIFF 2 | F118: PLUMRIDGE | I118: PERRETT | K118: TUITE | M118: BEDFORD | O118: BARLOW | Q118: HYDE
A120: ROUND 3 | E120: 9TH MAY | G120: WEATHER | I120: MILD CLOUDY SHOWERS GROUNDS WET FROM PREVIOUS RAIN | S120: PLAYED AT
D121: 1ST QTR | H121: 2ND QTR | L121: 3RD QTR | P121: FINAL | S121: PORT MELBOURNE
A122: PORT MELBOURNE | C122: 3 | D122: 4 | E122: =C122*6+D122 -> 22 | G122: 5 | H122: 9 | I122: =G122*6+H122 -> 39 | K122: 10 | L122: 12 | M122: =K122*6+L122 -> 72 | O122: 18 | P122: 17 | Q122: =O122*6+P122 -> 125 | S122: UMPIRE | X122: LADDER | AB122: ROUND | AD122: 3
A123: CAMBERWELL | C123: 3 | D123: 3 | E123: =C123*6+D123 -> 21 | G123: 4 | H123: 6 | I123: =G123*6+H123 -> 30 | K123: 6 | L123: 9 | M123: =K123*6+L123 -> 45 | O123: 7 | P123: 14 | Q123: =O123*6+P123 -> 56 | S123: BORLAND
A124: BEST PLAYERS | W124: TEAM | X124: W | Y124: L | Z124: D | AA124: FOR | AB124: AGST | AC124: % | AD124: PTS
A125: PORT MELBOURNE | C125: PERRETT | E125: BARNES | H125: GARBUTT | K125: BROOKER | N125: HYDE | Q125: BEDFORD
A126: CAMBERWELL | C126: JONES | E126: CLAMP | H126: CLARK | K126: BOOTHMAN | N126: COLLINS | Q126: GREENWOOD | W126: OAKLEIGH | X126: 3 | Y126: 0 | Z126: 0 | AA126: 305 | AB126: 207 | AC126: 147.34299516908212 | AD126: 12
A127: GOALKICKERS | W127: NORTHCOTE | X127: 3 | Y127: 0 | Z127: 0 | AA127: 260 | AB127: 213 | AC127: 122.06572769953051 | AD127: 12
A128: PORT MELBOURNE | C128: BEDFORD 9 | F128: BARNES 3 | I128: PERRETT 2 | L128: TUITE | N128: BROOKER | Q128: VEITCH | S128: WILKIN | W128: PORT MELBOURNE | X128: 2 | Y128: 1 | Z128: 0 | AA128: 323 | AB128: 182 | AC128: 177.47252747252747 | AD128: 8
A129: CAMBERWELL | C129: LUFF 3 | F129: WILLIAMS | I129: PETRIE | K129: COLLINS | M129: BOOTHMAN | W129: BRUNSWICK | X129: 2 | Y129: 1 | Z129: 0 | AA129: 268 | AB129: 226 | AC129: 118.58407079646018 | AD129: 8
A131: NORTHCOTE | C131: 2 | D131: 2 | E131: =C131*6+D131 -> 14 | G131: 5 | H131: 6 | I131: =G131*6+H131 -> 36 | K131: 7 | L131: 13 | M131: =K131*6+L131 -> 55 | O131: 11 | P131: 18 | Q131: =O131*6+P131 -> 84 | S131: BEACH ROAD | W131: YARRAVILLE | X131: 2 | Y131: 1 | Z131: 0 | AA131: 250 | AB131: 238 | AC131: 105.04201680672269 | AD131: 8
A132: SANDRINGHAM | C132: 2 | D132: 10 | E132: =C132*6+D132 -> 22 | G132: 3 | H132: 18 | I132: =G132*6+H132 -> 36 | K132: 4 | L132: 24 | M132: =K132*6+L132 -> 48 | O132: 5 | P132: 29 | Q132: =O132*6+P132 -> 59 | S132: MOWLAN | W132: PRESTON | X132: 1 | Y132: 2 | Z132: 0 | AA132: 231 | AB132: 259 | AC132: 89.189189189189193 | AD132: 4
A133: BEST PLAYERS | W133: COBURG | X133: 1 | Y133: 2 | Z133: 0 | AA133: 232 | AB133: 262 | AC133: 88.549618320610691 | AD133: 4
A134: NORTHCOTE | C134: SEYMOUR | F134: GRAY | H134: NICHOLLS | K134: COCKRAM | N134: SIMMONDS | Q134: HUMPHRIES | W134: SANDRINGHAM | X134: 1 | Y134: 2 | Z134: 0 | AA134: 245 | AB134: 284 | AC134: 86.267605633802816 | AD134: 4
A135: SANDRINGHAM | C135: BECKTON | F135: LUNN | H135: R KENNA | K135: A KENNA | N135: LEWIS | Q135: E BOURKE | W135: WILLIAMSTOWN | X135: 1 | Y135: 2 | Z135: 0 | AA135: 239 | AB135: 287 | AC135: 83.275261324041807 | AD135: 4
A136: GOALKICKERS | W136: CAMBERWELL | X136: 1 | Y136: 2 | Z136: 0 | AA136: 249 | AB136: 308 | AC136: 80.84415584415585 | AD136: 4
A137: NORTHCOTE | C137: SEYMOUR 3 | F137: GRAY 3 | H137: SIMMONDS 2 | K137: BRIGGS | M137: HUMPHRIES | P137: BYRNE | W137: PRAHRAN | X137: 1 | Y137: 2 | Z137: 0 | AA137: 227 | AB137: 305 | AC137: 74.426229508196727 | AD137: 4
A138: SANDRINGHAM | C138: BECKTON 2 | F138: DOCKENDORFF | J138: RAYMENT | M138: BAILES | W138: BRIGHTON | X138: 0 | Y138: 3 | Z138: 0 | AA138: 268 | AB138: 326 | AC138: 82.208588957055213 | AD138: 0
A140: BRUNSWICK | C140: 1 | D140: 3 | E140: =C140*6+D140 -> 9 | G140: 6 | H140: 8 | I140: =G140*6+H140 -> 44 | K140: 10 | L140: 12 | M140: =K140*6+L140 -> 72 | O140: 15 | P140: 16 | Q140: =O140*6+P140 -> 106 | S140: BRUNSWICK
A141: WILLIAMSTOWN | C141: 3 | D141: 3 | E141: =C141*6+D141 -> 21 | G141: 5 | H141: 5 | I141: =G141*6+H141 -> 35 | K141: 6 | L141: 6 | M141: =K141*6+L141 -> 42 | O141: 10 | P141: 13 | Q141: =O141*6+P141 -> 73 | S141: CAHILL
A142: BEST PLAYERS
A143: BRUNSWICK | C143: DOWLING | F143: FRASER | H143: BRAY | K143: ANDERSON | N143: KENNETT | Q143: PANNAM
A144: WILLIAMSTOWN | C144: DIXON | F144: JOHNS | H144: HELLWIG | K144: BLAKE | N144: WINNELL | Q144: SHANAHAN
A145: GOALKICKERS
A146: BRUNSWICK | C146: FRASER 4 | F146: ANDERSON 3 | I146: DOWLING 3 | L146: FITZGERALD 2 | O146: BRAY | Q146: WARDEN | T146: KENNETT
A147: WILLIAMSTOWN | C147: CAHILL 3 | F147: BLAKE 2 | I147: J O'BRIEN 2 | L147: SHEEHAN | N147: McDONALD | Q147: JOHNS
A149: PRAHRAN | C149: 2 | D149: 2 | E149: =C149*6+D149 -> 14 | G149: 7 | H149: 5 | I149: =G149*6+H149 -> 47 | K149: 10 | L149: 9 | M149: =K149*6+L149 -> 69 | O149: 12 | P149: 14 | Q149: =O149*6+P149 -> 86 | S149: TOORAK PARK
A150: PRESTON | C150: 3 | D150: 6 | E150: =C150*6+D150 -> 24 | G150: 4 | H150: 7 | I150: =G150*6+H150 -> 31 | K150: 5 | L150: 11 | M150: =K150*6+L150 -> 41 | O150: 7 | P150: 16 | Q150: =O150*6+P150 -> 58 | S150: LE BRUN
A151: BEST PLAYERS
A152: PRAHRAN | C152: JORDAN | F152: ROSS | H152: RENNIE | K152: SMEDLEY | N152: TRIM | Q152: GREENWOOD
A153: PRESTON | C153: CAZALY | F153: SMITH | H153: DOWLING | K153: TAYLOR | N153: REICHMAN | Q153: GRAY
A154: GOALKICKERS
A155: PRAHRAN | C155: GREENWOOD 4 | F155: ROSS 3 | H155: JORDAN 2 | J155: TRIM 2 | L155: ADAMS
A156: PRESTON | C156: McEACHERN 2 | F156: WARR | H156: GALL | J156: CAZALY | L156: SEEBECK | N156: REICHMAN
A158: YARRAVILLE | C158: 4 | D158: 2 | E158: =C158*6+D158 -> 26 | G158: 9 | H158: 4 | I158: =G158*6+H158 -> 58 | K158: 12 | L158: 5 | M158: =K158*6+L158 -> 77 | O158: 14 | P158: 10 | Q158: =O158*6+P158 -> 94 | S158: YARRAVILLE
A159: COBURG | C159: 3 | D159: 4 | E159: =C159*6+D159 -> 22 | G159: 5 | H159: 7 | I159: =G159*6+H159 -> 37 | K159: 6 | L159: 9 | M159: =K159*6+L159 -> 45 | O159: 7 | P159: 12 | Q159: =O159*6+P159 -> 54 | S159: MURRAY
A160: BEST PLAYERS
A161: YARRAVILLE | C161: HUNTER | F161: DWYER | I161: FITZMAURICE | L161: LAWN | O161: BUCKLEY | Q161: DRISCOLL
A162: COBURG | C162: JENKINS | F162: MEARS | I162: KIGHT | L162: CHAPMAN | O162: DEEGAN | Q162: DONNELLY
A163: GOALKICKERS
A164: YARRAVILLE | C164: LAWN 6 | F164: BUCKLEY 4 | I164: TYSON 2 | K164: DRISCOLL | M164: PREWETT
A165: COBURG | C165: PLANT | E165: MEARS | G165: DEEGAN | I165: HARRIS | K165: CHAPMAN | N165: LEAHY | P165: SHELDON
A167: OAKLEIGH | C167: 6 | D167: 4 | E167: =C167*6+D167 -> 40 | G167: 9 | H167: 7 | I167: =G167*6+H167 -> 61 | K167: 11 | L167: 12 | M167: =K167*6+L167 -> 78 | O167: 16 | P167: 16 | Q167: =O167*6+P167 -> 112 | S167: ELSTERNWICK PARK
A168: BRIGHTON | C168: 3 | D168: 0 | E168: =C168*6+D168 -> 18 | G168: 4 | H168: 1 | I168: =G168*6+H168 -> 25 | K168: 8 | L168: 6 | M168: =K168*6+L168 -> 54 | O168: 12 | P168: 9 | Q168: =O168*6+P168 -> 81 | S168: HASSETT
A169: BEST PLAYERS
A170: OAKLEIGH | C170: FLEMING | F170: RUDOLPH | I170: BEASLEY | L170: McALLISTER | O170: FRASER | Q170: DRIVER
A171: BRIGHTON | C171: HUNT | F171: BURNES | I171: SCHENCK | L171: PETERSON | O171: SAULTRY | Q171: LILBURNE
A172: GOALKICKERS
A173: OAKLEIGH | C173: FRASER 6 | F173: FLEMING 3 | I173: YEMM 2 | K173: WITHERS | M173: RODWELL | O173: CHAPMAN | Q173: GODING | S173: RUDOLPH
A174: BRIGHTON | C174: PETERSON 6 | F174: LILBURNE 2 | I174: BARNES | K174: SCHENCK | M174: HUNT
A176: ROUND 4 | E176: 16TH MAY | H176: WEATHER | K176: FINE MILD PARTLY CLOUDY N.W. WIND | S176: PLAYED AT
D177: 1ST QTR | H177: 2ND QTR | L177: 3RD QTR | P177: FINAL | S177: OAKLEIGH
A178: OAKLEIGH | C178: 3 | D178: 2 | E178: =C178*6+D178 -> 20 | G178: 5 | H178: 6 | I178: =G178*6+H178 -> 36 | K178: 7 | L178: 13 | M178: =K178*6+L178 -> 55 | O178: 12 | P178: 17 | Q178: =O178*6+P178 -> 89 | S178: UMPIRE | X178: LADDER | AB178: ROUND | AD178: 4
A179: PORT MELBOURNE | C179: 1 | D179: 3 | E179: =C179*6+D179 -> 9 | G179: 2 | H179: 6 | I179: =G179*6+H179 -> 18 | K179: 2 | L179: 10 | M179: =K179*6+L179 -> 22 | O179: 3 | P179: 14 | Q179: =O179*6+P179 -> 32 | S179: GREGORY
A180: BEST PLAYERS | W180: TEAM | X180: W | Y180: L | Z180: D | AA180: FOR | AB180: AGST | AC180: % | AD180: PTS
A181: OAKLEIGH | C181: RUDOLPH | E181: OPREY | G181: GODING | J181: RODWELL | M181: FLEMING | P181: CRAMERI
A182: PORT MELBOURNE | C182: GARBUTT | E182: SMITH | G182: P BOLMAN | J182: PERRETT | M182: HYDE | P182: BEDFORD | W182: OAKLEIGH | X182: 4 | Y182: 0 | Z182: 0 | AA182: 394 | AB182: 239 | AC182: 164.85355648535565 | AD182: 16
A183: GOALKICKERS | W183: NORTHCOTE | X183: 4 | Y183: 0 | Z183: 0 | AA183: 391 | AB183: 285 | AC183: 137.19298245614036 | AD183: 16
A184: OAKLEIGH | C184: RODWELL 4 | F184: CHAPMAN 2 | I184: CRAMERI 2 | L184: SPAIN 2 | N184: FRASER | P184: FLEMING | W184: PORT MELBOURNE | X184: 2 | Y184: 2 | Z184: 0 | AA184: 355 | AB184: 271 | AC184: 130.99630996309963 | AD184: 8
A185: PORT MELBOURNE | C185: PERRETT | F185: BEDFORD | I185: WILKIN | W185: BRUNSWICK | X185: 2 | Y185: 2 | Z185: 0 | AA185: 337 | AB185: 327 | AC185: 103.05810397553516 | AD185: 8
A187: NORTHCOTE | C187: 3 | D187: 3 | E187: =C187*6+D187 -> 21 | G187: 8 | H187: 6 | I187: =G187*6+H187 -> 54 | K187: 12 | L187: 10 | M187: =K187*6+L187 -> 82 | O187: 20 | P187: 11 | Q187: =O187*6+P187 -> 131 | S187: NORTHCOTE | W187: PRESTON | X187: 2 | Y187: 2 | Z187: 0 | AA187: 332 | AB187: 328 | AC187: 101.21951219512195 | AD187: 8
A188: YARRAVILLE | C188: 1 | D188: 6 | E188: =C188*6+D188 -> 12 | G188: 4 | H188: 7 | I188: =G188*6+H188 -> 31 | K188: 7 | L188: 9 | M188: =K188*6+L188 -> 51 | O188: 10 | P188: 12 | Q188: =O188*6+P188 -> 72 | S188: STUART | W188: WILLIAMSTOWN | X188: 2 | Y188: 2 | Z188: 0 | AA188: 331 | AB188: 341 | AC188: 97.067448680351902 | AD188: 8
A189: BEST PLAYERS | W189: SANDRINGHAM | X189: 2 | Y189: 2 | Z189: 0 | AA189: 338 | AB189: 351 | AC189: 96.296296296296291 | AD189: 8
A190: NORTHCOTE | C190: COLE | F190: HUMPHRIES | I190: GOULLET | K190: DEA | N190: SEYMOUR | Q190: NICHOLLS | W190: COBURG | X190: 2 | Y190: 2 | Z190: 0 | AA190: 344 | AB190: 364 | AC190: 94.505494505494511 | AD190: 8
A191: YARRAVILLE | C191: FITZMAURICE | F191: BUCKLEY | I191: PENNY | K191: HAMMOND | N191: ROBINSON | Q191: LAWN | W191: YARRAVILLE | X191: 2 | Y191: 2 | Z191: 0 | AA191: 322 | AB191: 369 | AC191: 87.262872628726285 | AD191: 8
A192: GOALKICKERS | Q192: ROWE | W192: PRAHRAN | X192: 1 | Y192: 3 | Z192: 0 | AA192: 329 | AB192: 417 | AC192: 78.896882494004799 | AD192: 4
A193: NORTHCOTE | C193: SEYMOUR 7 | F193: SIMMONDS 4 | I193: BRIGGS 2 | K193: BROWN 2 | M193: COLE | N193: GRAY | P193: POULTER | R193: CORRIGAN | W193: CAMBERWELL | X193: 1 | Y193: 3 | Z193: 0 | AA193: 316 | AB193: 401 | AC193: 78.802992518703249 | AD193: 4
A194: YARRAVILLE | C194: BUCKLEY 6 | F194: PREWETT 2 | I194: ROBINSON | K194: DWYER | W194: BRIGHTON | X194: 0 | Y194: 4 | Z194: 0 | AA194: 322 | AB194: 418 | AC194: 77.033492822966508 | AD194: 0
A196: PRESTON | C196: 1 | D196: 1 | E196: =C196*6+D196 -> 7 | G196: 5 | H196: 7 | I196: =G196*6+H196 -> 37 | K196: 6 | L196: 12 | M196: =K196*6+L196 -> 48 | O196: 14 | P196: 17 | Q196: =O196*6+P196 -> 101 | S196: PRESTON
A197: BRUNSWICK | C197: 4 | D197: 5 | E197: =C197*6+D197 -> 29 | G197: 5 | H197: 8 | I197: =G197*6+H197 -> 38 | K197: 6 | L197: 13 | M197: =K197*6+L197 -> 49 | O197: 9 | P197: 15 | Q197: =O197*6+P197 -> 69 | S197: MURRAY
A198: BEST PLAYERS
A199: PRESTON | C199: TAYLOR | F199: CAZALY | I199: SUMMERS | L199: SMITH | O199: MONOHAN | R199: SEEBECK
A200: BRUNSWICK | C200: HEARN | F200: CARTON | I200: BRAY | L200: DOWLING | O200: ANDERSON | R200: FITZGERALD
A201: GOALKICKERS
A202: PRESTON | C202: DAVIE 5 | F202: McEACHERN 4 | I202: CAZALY 2 | L202: SUMMERS | N202: BOLMAN | P202: JOULEN
A203: BRUNSWICK | C203: FRASER 4 | F203: ANDERSON 2 | I203: BRAY 2 | L203: PANNAM
A205: COBURG | C205: 2 | D205: 2 | E205: =C205*6+D205 -> 14 | G205: 8 | H205: 3 | I205: =G205*6+H205 -> 51 | K205: 13 | L205: 8 | M205: =K205*6+L205 -> 86 | O205: 17 | P205: 10 | Q205: =O205*6+P205 -> 112 | S205: COBURG
A206: PRAHRAN | C206: 7 | D206: 7 | E206: =C206*6+D206 -> 49 | G206: 7 | H206: 9 | I206: =G206*6+H206 -> 51 | K206: 12 | L206: 11 | M206: =K206*6+L206 -> 83 | O206: 15 | P206: 12 | Q206: =O206*6+P206 -> 102 | S206: BORLAND
A207: BEST PLAYERS
A208: COBURG | C208: JENKINS | F208: MEARS | I208: DONNELLY | L208: McGRATH | O208: ELLIOTT | R208: PLANT
A209: PRAHRAN | C209: ADAMS | F209: ROSS | I209: NECK | L209: V SMITH | O209: KOOP | R209: JORDAN
A210: GOALKICKERS
A211: COBURG | C211: PLANT 5 | E211: MEARS 4 | G211: ELLIOTT 4 | I211: DONNELLY 2 | L211: HARRIS | N211: McGRATH
A212: PRAHRAN | C212: ROSS 3 | E212: WILLIAMS 2 | H212: ANDERSON 2 | K212: GREENWOOD 2 | N212: TRIM 2 | P212: ADAMS | R212: LUCAS | T212: SMEDLEY
A214: SANDRINGHAM | C214: 5 | D214: 6 | E214: =C214*6+D214 -> 36 | G214: 5 | H214: 8 | I214: =G214*6+H214 -> 38 | K214: 11 | L214: 11 | M214: =K214*6+L214 -> 77 | O214: 13 | P214: 15 | Q214: =O214*6+P214 -> 93 | S214: CAMBERWELL
A215: CAMBERWELL | C215: 1 | D215: 2 | E215: =C215*6+D215 -> 8 | G215: 6 | H215: 8 | I215: =G215*6+H215 -> 44 | K215: 7 | L215: 12 | M215: =K215*6+L215 -> 54 | O215: 8 | P215: 19 | Q215: =O215*6+P215 -> 67 | S215: LE BRUN
A216: BEST PLAYERS
A217: SANDRINGHAM | C217: BOYD | E217: E BOURKE | H217: JAMIESON | K217: LUNN | N217: A ANDERSON | Q217: RAYMENT
A218: CAMBERWELL | C218: PAGE | E218: MURPHY | H218: LUFF | K218: JONES | N218: GREENWOOD | Q218: PETRIE
A219: GOALKICKERS
A220: SANDRINGHAM | C220: BOYD 5 | E220: RAYMENT 3 | H220: BECKTON 2 | K220: DE LUCA | M220: R KENNA | O220: A ANDERSON
A221: CAMBERWELL | C221: LUFF 4 | E221: COLLINS 2 | H221: MURPHY | K221: TRESIZE
A223: WILLIAMSTOWN | C223: 4 | D223: 5 | E223: =C223*6+D223 -> 29 | G223: 5 | H223: 10 | I223: =G223*6+H223 -> 40 | K223: 10 | L223: 17 | M223: =K223*6+L223 -> 77 | O223: 12 | P223: 20 | Q223: =O223*6+P223 -> 92 | S223: WILLIAMSTOWN
A224: BRIGHTON | C224: 2 | D224: 2 | E224: =C224*6+D224 -> 14 | G224: 2 | H224: 6 | I224: =G224*6+H224 -> 18 | K224: 4 | L224: 8 | M224: =K224*6+L224 -> 32 | O224: 7 | P224: 12 | Q224: =O224*6+P224 -> 54 | S224: MOWLAN
A225: BEST PLAYERS
A226: WILLIAMSTOWN | C226: BYRNE | F226: CAHILL | I226: SHEEHAN | L226: SINCLAIR | O226: DORGAN | R226: SYKES
A227: BRIGHTON | C227: SCHENCK | F227: MILNE | I227: TUCKER | L227: LILBURNE | O227: McGURGAN | R227: ROSENBROCK
A228: GOALKICKERS
A229: WILLIAMSTOWN | C229: CAHILL 4 | F229: SINCLAIR 3 | I229: JOHNS 2 | K229: GOGGIN | M229: SHEEHAN | O229: DIXON
A230: BRIGHTON | C230: PETERSON 2 | F230: MILNE 2 | I230: TUCKER | K230: SCHENCK | M230: McGURGIN
A232: ROUND 5 | E232: 23RD MAY | H232: WEATHER | K232: CLOUDY LIGHT SHOWERS S.W. WIND | S232: PLAYED AT
D233: 1ST QTR | H233: 2ND QTR | L233: 3RD QTR | P233: FINAL | S233: BRUNSWICK
A234: OAKLEIGH | C234: 4 | D234: 6 | E234: =C234*6+D234 -> 30 | G234: 7 | H234: 10 | I234: =G234*6+H234 -> 52 | K234: 12 | L234: 15 | M234: =K234*6+L234 -> 87 | O234: 15 | P234: 15 | Q234: =O234*6+P234 -> 105 | S234: UMPIRE | X234: LADDER | AB234: ROUND | AD234: 5
A235: BRUNSWICK | C235: 1 | D235: 1 | E235: =C235*6+D235 -> 7 | G235: 6 | H235: 5 | I235: =G235*6+H235 -> 41 | K235: 6 | L235: 6 | M235: =K235*6+L235 -> 42 | O235: 12 | P235: 10 | Q235: =O235*6+P235 -> 82 | S235: MOWLAN
A236: BEST PLAYERS | W236: TEAM | X236: W | Y236: L | Z236: D | AA236: FOR | AB236: AGST | AC236: % | AD236: PTS
A237: OAKLEIGH | C237: RUDOLPH | F237: THOMAS | I237: BEASLEY | L237: FLEMING | N237: RODWELL | Q237: FRASER
A238: BRUNSWICK | C238: JOHNSTONE | F238: THOMPSON | I238: McINERNEY | L238: BEARD | N238: PANNAM | Q238: KINNEAR | W238: OAKLEIGH | X238: 5 | Y238: 0 | Z238: 0 | AA238: 499 | AB238: 321 | AC238: 155.45171339563862 | AD238: 20
A239: GOALKICKERS | W239: NORTHCOTE | X239: 5 | Y239: 0 | Z239: 0 | AA239: 481 | AB239: 364 | AC239: 132.14285714285714 | AD239: 20
A240: OAKLEIGH | C240: FRASER 7 | F240: RODWELL 2 | I240: FLEMING | K240: YEMM | M240: CRAMERI | O240: SPAIN | Q240: OPREY | W240: PORT MELBOURNE | X240: 3 | Y240: 2 | Z240: 0 | AA240: 472 | AB240: 318 | AC240: 148.42767295597486 | AD240: 12
A241: BRUNSWICK | C241: McINERNEY 3 | F241: MAYNE 2 | I241: ANDERSON 2 | L241: BEARD 2 | N241: FRASER | P241: FITZGERALD | R241: KENNETT | W241: SANDRINGHAM | X241: 3 | Y241: 2 | Z241: 0 | AA241: 440 | AB241: 382 | AC241: 115.18324607329843 | AD241: 12
A243: PORT MELBOURNE | C243: 6 | D243: 3 | E243: =C243*6+D243 -> 39 | G243: 9 | H243: 8 | I243: =G243*6+H243 -> 62 | K243: 12 | L243: 12 | M243: =K243*6+L243 -> 84 | O243: 17 | P243: 15 | Q243: =O243*6+P243 -> 117 | S243: PORT MELBOURNE | W243: YARRAVILLE | X243: 3 | Y243: 2 | Z243: 0 | AA243: 413 | AB243: 432 | AC243: 95.601851851851848 | AD243: 12
A244: PRESTON | C244: 3 | D244: 4 | E244: =C244*6+D244 -> 22 | G244: 4 | H244: 8 | I244: =G244*6+H244 -> 32 | K244: 4 | L244: 10 | M244: =K244*6+L244 -> 34 | O244: 6 | P244: 11 | Q244: =O244*6+P244 -> 47 | S244: MORCAM | W244: BRUNSWICK | X244: 2 | Y244: 3 | Z244: 0 | AA244: 419 | AB244: 432 | AC244: 96.990740740740748 | AD244: 8
A245: BEST PLAYERS | W245: WILLIAMSTOWN | X245: 2 | Y245: 3 | Z245: 0 | AA245: 401 | AB245: 423 | AC245: 94.799054373522452 | AD245: 8
A246: PORT MELBOURNE | C246: LAHIFF | F246: GARBUTT | I246: HYDE | L246: SMITH | N246: BEDFORD | Q246: BOLMAN | W246: COBURG | X246: 2 | Y246: 3 | Z246: 0 | AA246: 423 | AB246: 454 | AC246: 93.171806167400888 | AD246: 8
A247: PRESTON | C247: DAVIE | F247: MONOHAN | I247: CAZALY | L247: TAYLOR | N247: DOWLING | Q247: SUMMERS | W247: PRESTON | X247: 2 | Y247: 3 | Z247: 0 | AA247: 379 | AB247: 445 | AC247: 85.168539325842701 | AD247: 8
A248: GOALKICKERS | W248: CAMBERWELL | X248: 2 | Y248: 3 | Z248: 0 | AA248: 398 | AB248: 471 | AC248: 84.501061571125263 | AD248: 8
A249: PORT MELBOURNE | C249: BEDFORD 8 | F249: BARNES 3 | I249: McKENZIE 2 | L249: SMITH 2 | N249: PLUMRIDGE | Q249: TUITE | W249: PRAHRAN | X249: 1 | Y249: 4 | Z249: 0 | AA249: 360 | AB249: 519 | AC249: 69.364161849710982 | AD249: 4
A250: PRESTON | C250: DAVIE 4 | F250: WARR | I250: CAZALY | W250: BRIGHTON | X250: 0 | Y250: 5 | Z250: 0 | AA250: 385 | AB250: 509 | AC250: 75.638506876227893 | AD250: 0
A252: NORTHCOTE | C252: 2 | D252: 11 | E252: =C252*6+D252 -> 23 | G252: 4 | H252: 14 | I252: =G252*6+H252 -> 38 | K252: 8 | L252: 21 | M252: =K252*6+L252 -> 69 | O252: 11 | P252: 24 | Q252: =O252*6+P252 -> 90 | S252: NORTHCOTE
A253: COBURG | C253: 2 | D253: 2 | E253: =C253*6+D253 -> 14 | G253: 8 | H253: 3 | I253: =G253*6+H253 -> 51 | K253: 8 | L253: 4 | M253: =K253*6+L253 -> 52 | O253: 12 | P253: 7 | Q253: =O253*6+P253 -> 79 | S253: GREGORY
A254: BEST PLAYERS
A255: NORTHCOTE | C255: COLE | F255: SEYMOUR | I255: LAXON | L255: COCKRAM | O255: SIMMONDS | R255: HILL
A256: COBURG | C256: MARTIN | F256: GREGORY | I256: BERTRAM | L256: LOWE | O256: DEEGAN | R256: JENKINS
A257: GOALKICKERS
A258: NORTHCOTE | C258: SEYMOUR 4 | F258: BRIGGS 2 | I258: BROWN 2 | K258: COLE | M258: SIMMONDS | P258: GRAY
A259: COBURG | C259: PLANT 4 | F259: KIGHT 2 | I259: DEEGAN | K259: HARRIS | M259: LEAHY | O259: DONNELLY | Q259: McGRATH | T259: JENKINS
A261: SANDRINGHAM | C261: 3 | D261: 4 | E261: =C261*6+D261 -> 22 | G261: 6 | H261: 9 | I261: =G261*6+H261 -> 45 | K261: 9 | L261: 13 | M261: =K261*6+L261 -> 67 | O261: 14 | P261: 18 | Q261: =O261*6+P261 -> 102 | S261: BEACH ROAD
A262: PRAHRAN | C262: 0 | D262: 3 | E262: =C262*6+D262 -> 3 | G262: 2 | H262: 9 | I262: =G262*6+H262 -> 21 | K262: 2 | L262: 10 | M262: =K262*6+L262 -> 22 | O262: 3 | P262: 13 | Q262: =O262*6+P262 -> 31 | S262: ASHMORE
A263: BEST PLAYERS
A264: SANDRINGHAM | C264: DE LUCA | F264: E ANDERSON | I264: E BOURKE | L264: JAMIESON | O264: BOYD | R264: RAYMENT
A265: PRAHRAN | C265: THOMPSON | F265: KOOP | I265: JORDAN | L265: BENCE | O265: RENNIE | R265: ROSS
A266: GOALKICKERS
A267: SANDRINGHAM | C267: BOYD 4 | F267: HUDD 3 | H267: A ANDERSON 2 | K267: DE LUCA 2 | M267: RAYMENT | O267: JAMIESON | Q267: CHALLIS
A268: PRAHRAN | C268: JORDAN | F268: ADAMS | H268: ROSS
A270: YARRAVILLE | C270: 5 | D270: 3 | E270: =C270*6+D270 -> 33 | G270: 10 | H270: 5 | I270: =G270*6+H270 -> 65 | K270: 14 | L270: 7 | M270: =K270*6+L270 -> 91 | O270: 14 | P270: 7 | Q270: =O270*6+P270 -> 91 | S270: YARRAVILLE
A271: BRIGHTON | C271: 4 | D271: 2 | E271: =C271*6+D271 -> 26 | G271: 4 | H271: 3 | I271: =G271*6+H271 -> 27 | K271: 7 | L271: 5 | M271: =K271*6+L271 -> 47 | O271: 9 | P271: 9 | Q271: =O271*6+P271 -> 63 | S271: MURRAY
A272: BEST PLAYERS
A273: YARRAVILLE | C273: FITZMAURICE | F273: DWYER | I273: KENNEDY | L273: BUCKLEY | O273: HUNTER | R273: LAWN
A274: BRIGHTON | C274: SCHENCK | F274: DORE | I274: BURNES | L274: BARNES | O274: STOREY | R274: STEWART
A275: GOALKICKERS
A276: YARRAVILLE | C276: KENNEDY 5 | F276: BUCKLEY 4 | I276: ROBERTSON 2 | L276: PREWETT | N276: LAWN | P276: BRUMBY
A277: BRIGHTON | C277: STOREY 6 | F277: SCHENCK | I277: MCGURGIN | L277: SMITH
A279: CAMBERWELL | C279: 6 | D279: 6 | E279: =C279*6+D279 -> 42 | G279: 7 | H279: 6 | I279: =G279*6+H279 -> 48 | K279: 12 | L279: 10 | M279: =K279*6+L279 -> 82 | O279: 12 | P279: 10 | Q279: =O279*6+P279 -> 82 | S279: WILLIAMSTOWN
A280: WILLIAMSTOWN | C280: 1 | D280: 2 | E280: =C280*6+D280 -> 8 | G280: 7 | H280: 5 | I280: =G280*6+H280 -> 47 | K280: 8 | L280: 7 | M280: =K280*6+L280 -> 55 | O280: 9 | P280: 16 | Q280: =O280*6+P280 -> 70 | S280: STUART
A281: BEST PLAYERS
A282: CAMBERWELL | C282: LUFF | F282: CLAMP | I282: GREENWOOD | L282: PETRIE | O282: QUARTERMAIN
A283: WILLIAMSTOWN | C283: HELLWIG | F283: SHANAHAN | I283: BLAKE | L283: FLYNN | O283: McKENZIE | R283: SHEEHAN
A284: GOALKICKERS
A285: CAMBERWELL | C285: LUFF 6 | E285: PETRIE 2 | G285: COLLINS 2 | J285: PONCHARD
A286: WILLIAMSTOWN | C286: FLYNN 3 | E286: DIXON 2 | G286: SHEEHAN | I286: SINCLAIR | L286: CAHILL | N286: JOHNS
A288: ROUND 6 | E288: 30TH MAY | J288: WEATHER | M288: COOL CLOUDY S.W. WIND | S288: PLAYED AT
D289: 1ST QTR | H289: 2ND QTR | L289: 3RD QTR | P289: FINAL | S289: OAKLEIGH
A290: SANDRINGHAM | C290: 3 | D290: 0 | E290: =C290*6+D290 -> 18 | G290: 8 | H290: 9 | I290: =G290*6+H290 -> 57 | K290: 10 | L290: 10 | M290: =K290*6+L290 -> 70 | O290: 16 | P290: 13 | Q290: =O290*6+P290 -> 109 | S290: UMPIRE | X290: LADDER | AB290: ROUND | AD290: 6
A291: OAKLEIGH | C291: 4 | D291: 9 | E291: =C291*6+D291 -> 33 | G291: 9 | H291: 11 | I291: =G291*6+H291 -> 65 | K291: 14 | L291: 16 | M291: =K291*6+L291 -> 100 | O291: 14 | P291: 20 | Q291: =O291*6+P291 -> 104 | S291: MORCAM
A292: BEST PLAYERS | W292: TEAM | X292: W | Y292: L | Z292: D | AA292: FOR | AB292: AGST | AC292: % | AD292: PTS
A293: SANDRINGHAM | C293: E BOURKE | E293: R KENNA | H293: HUDD | K293: ANDERSON | N293: DE LUCA | Q293: JAMIESON
A294: OAKLEIGH | C294: OPREY | E294: GODING | H294: FLEMING | K294: FRASER | N294: WITHERS | Q294: WATSON | W294: NORTHCOTE | X294: 6 | Y294: 0 | Z294: 0 | AA294: 576 | AB294: 427 | AC294: 134.89461358313818 | AD294: 24
A295: GOALKICKERS | W295: OAKLEIGH | X295: 5 | Y295: 1 | Z295: 0 | AA295: 603 | AB295: 430 | AC295: 140.23255813953489 | AD295: 20
A296: SANDRINGHAM | C296: BOYD 6 | E296: FITZGERALD 2 | H296: DE LUCA 2 | J296: HUDD 2 | L296: R KENNA | N296: RAYMENT | P296: A ANDERSON | S296: YEMM | W296: SANDRINGHAM | X296: 4 | Y296: 2 | Z296: 0 | AA296: 549 | AB296: 486 | AC296: 112.96296296296296 | AD296: 16
A297: OAKLEIGH | C297: FRASER 5 | E297: RODWELL 2 | H297: FLEMING 2 | J297: GODING 2 | M297: YEMM | O297: CRAMERI | Q297: SPAIN | W297: YARRAVILLE | X297: 4 | Y297: 2 | Z297: 0 | AA297: 520 | AB297: 488 | AC297: 106.55737704918033 | AD297: 16
E298: PROTEST
A299: COBURG | C299: 3 | D299: 2 | E299: =C299*6+D299 -> 20 | G299: 6 | H299: 4 | I299: =G299*6+H299 -> 40 | K299: 9 | L299: 7 | M299: =K299*6+L299 -> 61 | O299: 13 | P299: 10 | Q299: =O299*6+P299 -> 88 | S299: COBURG | W299: PORT MELBOURNE | X299: 3 | Y299: 3 | Z299: 0 | AA299: 537 | AB299: 399 | AC299: 134.59 | AD299: 12
A300: PORT MELBOURNE | C300: 1 | D300: 0 | E300: =C300*6+D300 -> 6 | G300: 4 | H300: 1 | I300: =G300*6+H300 -> 25 | K300: 8 | L300: 3 | M300: =K300*6+L300 -> 51 | O300: 12 | P300: 5 | Q300: =O300*6+P300 -> 77 | S300: MOWLAN | W300: BRUNSWICK | X300: 3 | Y300: 3 | Z300: 0 | AA300: 520 | AB300: 500 | AC300: 104 | AD300: 12
A301: BEST PLAYERS | W301: COBURG | X301: 3 | Y301: 3 | Z301: 0 | AA301: 504 | AB301: 519 | AC301: 97.11 | AD301: 12
A302: COBURG | C302: LOWE | E302: DUNCAN | H302: BERTRAM | K302: GREGORY | N302: LEAHY | Q302: PLANT | W302: PRESTON | X302: 3 | Y302: 3 | Z302: 0 | AA302: 466 | AB302: 513 | AC302: 90.838206627680307 | AD302: 12
A303: PORT MELBOURNE | C303: BOLMAN | E303: SMITH | H303: McINNES | K303: LOVETT | N303: STANBRIDGE | Q303: BEDFORD | W303: WILLIAMSTOWN | X303: 2 | Y303: 4 | Z303: 0 | AA303: 469 | AB303: 510 | AC303: 91.960784313725483 | AD303: 8
A304: GOALKICKERS | W304: CAMBERWELL | X304: 2 | Y304: 4 | Z304: 0 | AA304: 454 | AB304: 578 | AC304: 78.54671280276817 | AD304: 8
A305: COBURG | C305: PLANT 4 | E305: MEARS 2 | G305: LANGWELL 2 | J305: KIGHT | L305: ELLIOTT | N305: McGRATH | P305: JENKINS | R305: LOWE | W305: PRAHRAN | X305: 1 | Y305: 5 | Z305: 0 | AA305: 423 | AB305: 614 | AC305: 68.892508143322473 | AD305: 4
A306: PORT MELBOURNE | C306: BEDFORD 5 | F306: McINNES 3 | I306: PLUMRIDGE 2 | L306: PERRETT | N306: HARRY | W306: BRIGHTON | X306: 0 | Y306: 6 | Z306: 0 | AA306: 453 | AB306: 610 | AC306: 74.26229508196721 | AD306: 0
A307: REPLAY | E307: 29TH JULY | J307: WEATHER
A308: COBURG | C308: 1 | D308: 3 | E308: =C308*6+D308 -> 9 | G308: 5 | H308: 8 | I308: =G308*6+H308 -> 38 | K308: 8 | L308: 9 | M308: =K308*6+L308 -> 57 | O308: 11 | P308: 15 | Q308: =O308*6+P308 -> 81 | S308: COBURG
A309: PORT MELBOURNE | C309: 3 | D309: 8 | E309: =C309*6+D309 -> 26 | G309: 3 | H309: 9 | I309: =G309*6+H309 -> 27 | K309: 7 | L309: 11 | M309: =K309*6+L309 -> 53 | O309: 8 | P309: 17 | Q309: =O309*6+P309 -> 65
A310: BEST PLAYERS
A311: COBURG | C311: MARTIN | F311: LEAHY | I311: LANGWELL | L311: MEARS | O311: LOWE | Q311: DONNELLY
A312: PORT MELBOURNE | C312: PLUMRIDGE | F312: SMITH | I312: STANBRIDGE | L312: CROMPTON | O312: BAKER | Q312: GARBUTT
A313: GOALKICKERS
A314: COBURG | C314: LANGWELL 3 | F314: DUNCAN 3 | I314: LEAHY 2 | K314: MILLEN 2 | M314: HARRIS
A315: PORT MELBOURNE | C315: PERRETT | E315: LAHIFF | G315: STANBRIDGE | J315: BROOKER | M315: SMITH | O315: PLUMRIDGE | R315: WILKINS | U315: LEGGO
A317: PRESTON | C317: 3 | D317: 1 | E317: =C317*6+D317 -> 19 | G317: 4 | H317: 7 | I317: =G317*6+H317 -> 31 | K317: 8 | L317: 10 | M317: =K317*6+L317 -> 58 | O317: 12 | P317: 15 | Q317: =O317*6+P317 -> 87 | S317: PRESTON
A318: WILLIAMSTOWN | C318: 2 | D318: 7 | E318: =C318*6+D318 -> 19 | G318: 2 | H318: 11 | I318: =G318*6+H318 -> 23 | K318: 6 | L318: 13 | M318: =K318*6+L318 -> 49 | O318: 9 | P318: 14 | Q318: =O318*6+P318 -> 68 | S318: GREGORY
A319: BEST PLAYERS
A320: PRESTON | C320: McEACHARN | G320: GALL | I320: TAYLOR | K320: DAVIE | M320: WARR | P320: P SPARGO
A321: WILLIAMSTOWN | C321: SHANAHAN | G321: DORGAN | I321: JOHNS | K321: CAHILL | M321: WINNELL | P321: DIXON
A322: GOALKICKERS
A323: PRESTON | C323: McEACHERN 4 | F323: WARR 3 | I323: DAVIE 3 | K323: SUMMERS 2
A324: WILLIAMSTOWN | C324: CAHILL 4 | F324: SHEEHAN 3 | I324: GOGGIN | K324: BOURKE
A326: YARRAVILLE | C326: 4 | D326: 3 | E326: =C326*6+D326 -> 27 | G326: 7 | H326: 7 | I326: =G326*6+H326 -> 49 | K326: 11 | L326: 8 | M326: =K326*6+L326 -> 74 | O326: 16 | P326: 11 | Q326: =O326*6+P326 -> 107 | S326: YARRAVILLE
A327: CAMBERWELL | C327: 2 | D327: 2 | E327: =C327*6+D327 -> 14 | G327: 3 | H327: 5 | I327: =G327*6+H327 -> 23 | K327: 4 | L327: 8 | M327: =K327*6+L327 -> 32 | O327: 7 | P327: 14 | Q327: =O327*6+P327 -> 56 | S327: COFFEY
A328: BEST PLAYERS
A329: YARRAVILLE | C329: CAMERON | E329: PENNY | H329: BUCKLEY | K329: FITZMAURICE | N329: HUNTER | Q329: LAWN
A330: CAMBERWELL | C330: JONES | E330: GREENWOOD | H330: MURPHY | K330: WALLIS | N330: PETRIE | Q330: CALWELL
A331: GOALKICKERS
A332: YARRAVILLE | C332: BUCKLEY 5 | F332: LAWN 4 | H332: PREWETT 3 | K332: KENNEDY 2 | N332: EVANS | P332: CAMERON
A333: CAMBERWELL | C333: MURPHY 2 | F333: LUFF 2 | H333: PETRIE 2 | J333: COLLINS
A335: BRUNSWICK | C335: 7 | D335: 2 | E335: =C335*6+D335 -> 44 | G335: 10 | H335: 6 | I335: =G335*6+H335 -> 66 | K335: 11 | L335: 9 | M335: =K335*6+L335 -> 75 | O335: 15 | P335: 11 | Q335: =O335*6+P335 -> 101 | S335: ELSTERNWICK PARK
A336: BRIGHTON | C336: 0 | D336: 1 | E336: =C336*6+D336 -> 1 | G336: 2 | H336: 4 | I336: =G336*6+H336 -> 16 | K336: 4 | L336: 8 | M336: =K336*6+L336 -> 32 | O336: 10 | P336: 8 | Q336: =O336*6+P336 -> 68 | S336: STUART
A337: BEST PLAYERS
A338: BRUNSWICK | C338: ANDERSON | F338: FITZGERALD | I338: KINNEAR | L338: PANNAM | N338: DOWLING | Q338: HEARN
A339: BRIGHTON | C339: CANTWELL | F339: BARNES | I339: SCHENCK | L339: STOREY | N339: McGURGIN | Q339: LILBURNE
A340: GOALKICKERS
A341: BRUNSWICK | C341: KINNEAR 5 | F341: BRAY 3 | H341: ANDERSON 2 | K341: FITZGERALD 2 | N341: KENNETT 2 | Q341: BRANSTON | T341: EDDY
A342: BRIGHTON | C342: LILBURNE 2 | F342: TUCKER 2 | I342: STOREY 2 | K342: SMITH 2 | M342: ALEXANDER | P342: CONNELLY
A344: NORTHCOTE | C344: 2 | D344: 4 | E344: =C344*6+D344 -> 16 | G344: 7 | H344: 5 | I344: =G344*6+H344 -> 47 | K344: 11 | L344: 11 | M344: =K344*6+L344 -> 77 | O344: 13 | P344: 17 | Q344: =O344*6+P344 -> 95 | S344: TOORAK PARK
A345: PRAHRAN | C345: 1 | D345: 4 | E345: =C345*6+D345 -> 10 | G345: 2 | H345: 6 | I345: =G345*6+H345 -> 18 | K345: 4 | L345: 8 | M345: =K345*6+L345 -> 32 | O345: 8 | P345: 15 | Q345: =O345*6+P345 -> 63 | S345: MURRAY
A346: BEST PLAYERS
A347: NORTHCOTE | C347: CORRIGAN | F347: COCKRAM | I347: PRUSER | K347: SIMMONDS | N347: COLE | Q347: BRIGGS
A348: PRAHRAN | C348: ADAMS | F348: NECK | I348: BRUCE | K348: ROSS | N348: FISHER | Q348: JORDAN
A349: GOALKICKERS
A350: NORTHCOTE | C350: SIMMONDS 3 | F350: COLE 2 | H350: SEYMOUR 2 | K350: GRAY 2 | M350: PRUSER 2 | O350: BRIGGS | Q350: CORRIGAN
A351: PRAHRAN | C351: ROSS 2 | E351: WILLIAMS | H351: ANDERSON | K351: JORDAN | M351: GREENWOOD | P351: TRIM | R351: SMEDLEY
A353: ROUND 7 | E353: 8TH JUNE | H353: WEATHER | K353: CLOUDY BUT FINE GROUNDS VERY BAD | S353: PLAYED AT
D354: 1ST QTR | H354: 2ND QTR | L354: 3RD QTR | P354: FINAL | S354: NORTHCOTE
A355: PORT MELBOURNE | C355: 3 | D355: 1 | E355: =C355*6+D355 -> 19 | G355: 5 | H355: 3 | I355: =G355*6+H355 -> 33 | K355: 6 | L355: 7 | M355: =K355*6+L355 -> 43 | O355: 7 | P355: 10 | Q355: =O355*6+P355 -> 52 | S355: UMPIRE | X355: LADDER | AB355: ROUND | AD355: 7
A356: NORTHCOTE | C356: 1 | D356: 5 | E356: =C356*6+D356 -> 11 | G356: 3 | H356: 6 | I356: =G356*6+H356 -> 24 | K356: 4 | L356: 9 | M356: =K356*6+L356 -> 33 | O356: 6 | P356: 13 | Q356: =O356*6+P356 -> 49 | S356: GREGORY
A357: BEST PLAYERS | W357: TEAM | X357: W | Y357: L | Z357: D | AA357: FOR | AB357: AGST | AC357: % | AD357: PTS
A358: PORT MELBOURNE | C358: SMITH | F358: LAHIFF | H358: P BOLMAN | K358: STANBRIDGE | N358: McINNES | Q358: CROMPTON
A359: NORTHCOTE | C359: NICHOLLS | F359: HILL | H359: COCKRAM | K359: BYRNE | N359: HUMPHRIES | Q359: McSWAIN | W359: OAKLEIGH | X359: 6 | Y359: 1 | Z359: 0 | AA359: 700 | AB359: 467 | AC359: 149.89293361884367 | AD359: 24
A360: GOALKICKERS | W360: NORTHCOTE | X360: 6 | Y360: 1 | Z360: 0 | AA360: 625 | AB360: 479 | AC360: 130.48016701461378 | AD360: 24
A361: PORT MELBOURNE | C361: BEDFORD 2 | F361: SMITH 2 | I361: LAHIFF | K361: HARRY | N361: BAKER | W361: SANDRINGHAM | X361: 5 | Y361: 2 | Z361: 0 | AA361: 668 | AB361: 589 | AC361: 113.4125636672326 | AD361: 20
A362: NORTHCOTE | C362: SIMMONDS 2 | F362: SEYMOUR | I362: GRAY | K362: POULTER | N362: NICHOLLS | W362: YARRAVILLE | X362: 5 | Y362: 2 | Z362: 0 | AA362: 600 | AB362: 548 | AC362: 109.48905109489051 | AD362: 20
A364: OAKLEIGH | C364: 3 | D364: 7 | E364: =C364*6+D364 -> 25 | G364: 5 | H364: 13 | I364: =G364*6+H364 -> 43 | K364: 9 | L364: 16 | M364: =K364*6+L364 -> 70 | O364: 13 | P364: 19 | Q364: =O364*6+P364 -> 97 | S364: OAKLEIGH | W364: PORT MELBOURNE | X364: 4 | Y364: 3 | Z364: 0 | AA364: 589 | AB364: 448 | AC364: 131.47 | AD364: 16
A365: PRESTON | C365: 2 | D365: 0 | E365: =C365*6+D365 -> 12 | G365: 2 | H365: 2 | I365: =G365*6+H365 -> 14 | K365: 5 | L365: 6 | M365: =K365*6+L365 -> 36 | O365: 5 | P365: 7 | Q365: =O365*6+P365 -> 37 | S365: MOWLAN | W365: BRUNSWICK | X365: 4 | Y365: 3 | Z365: 0 | AA365: 576 | AB365: 521 | AC365: 110.55662188099808 | AD365: 16
A366: BEST PLAYERS | W366: COBURG | X366: 4 | Y366: 3 | Z366: 0 | AA366: 587 | AB366: 588 | AC366: 99.83 | AD366: 16
A367: OAKLEIGH | C367: FRASER | F367: THOMAS | I367: CHAPMAN | L367: DRIVER | N367: McALLISTER | Q367: RODWELL | W367: PRESTON | X367: 3 | Y367: 4 | Z367: 0 | AA367: 503 | AB367: 610 | AC367: 82.459016393442624 | AD367: 12
A368: PRESTON | C368: DOWLING | F368: CAZALY | I368: F SPARGO | L368: P SPARGO | N368: TAYLOR | Q368: SMITH | W368: WILLIAMSTOWN | X368: 2 | Y368: 5 | Z368: 0 | AA368: 572 | AB368: 629 | AC368: 90.937996820349767 | AD368: 8
A369: GOALKICKERS | W369: CAMBERWELL | X369: 2 | Y369: 5 | Z369: 0 | AA369: 475 | AB369: 634 | AC369: 74.921135646687702 | AD369: 8
A370: OAKLEIGH | C370: FRASER 6 | F370: CHAPMAN 2 | I370: CRAMERI 2 | L370: SPAIN 2 | O370: RODWELL | W370: PRAHRAN | X370: 1 | Y370: 6 | Z370: 0 | AA370: 483 | AB370: 694 | AC370: 69.596541786743515 | AD370: 4
A371: PRESTON | C371: MCEACHERN | F371: DAVIE | I371: CAZALY | L371: DOWLING | O371: HUGHSON | W371: BRIGHTON | X371: 0 | Y371: 7 | Z371: 0 | AA371: 522 | AB371: 693 | AC371: 75.324675324675326 | AD371: 0
A373: SANDRINGHAM | C373: 5 | D373: 10 | E373: =C373*6+D373 -> 40 | G373: 9 | H373: 11 | I373: =G373*6+H373 -> 65 | K373: 15 | L373: 17 | M373: =K373*6+L373 -> 107 | O373: 17 | P373: 17 | Q373: =O373*6+P373 -> 119 | S373: BEACH ROAD
A374: WILLIAMSTOWN | C374: 1 | D374: 0 | E374: =C374*6+D374 -> 6 | G374: 7 | H374: 5 | I374: =G374*6+H374 -> 47 | K374: 9 | L374: 7 | M374: =K374*6+L374 -> 61 | O374: 15 | P374: 13 | Q374: =O374*6+P374 -> 103 | S374: MORCAM
A375: BEST PLAYERS
A376: SANDRINGHAM | C376: E BOURKE | F376: RAYMENT | I376: BOYD | L376: R KENNA | O376: LUNN | Q376: LEWIS
A377: WILLIAMSTOWN | C377: SYKES | F377: SHANAHAN | I377: BLAKE | L377: CAHILL | O377: HELLWIG | Q377: LONERGAN
A378: GOALKICKERS
A379: SANDRINGHAM | C379: BOYD 5 | E379: R KENNA 4 | H379: A ANDERSON 2 | K379: DE LUCA 2 | N379: FITZGERALD | Q379: CHALLIS
A380: WILLIAMSTOWN | C380: SINCLAIR 4 | F380: BLAKE 4 | I380: CAHILL 3 | K380: GOGGIN 2 | N380: SHANAHAN 2 | Q380: SHEEHAN'
A382: BRUNSWICK | C382: 1 | D382: 0 | E382: =C382*6+D382 -> 6 | G382: 1 | H382: 4 | I382: =G382*6+H382 -> 10 | K382: 3 | L382: 5 | M382: =K382*6+L382 -> 23 | O382: 8 | P382: 8 | Q382: =O382*6+P382 -> 56 | S382: BRUNSWICK
A383: CAMBERWELL | C383: 0 | D383: 4 | E383: =C383*6+D383 -> 4 | G383: 0 | H383: 4 | I383: =G383*6+H383 -> 4 | K383: 1 | L383: 7 | M383: =K383*6+L383 -> 13 | O383: 2 | P383: 9 | Q383: =O383*6+P383 -> 21 | S383: COFFEY
A384: BEST PLAYERS
A385: BRUNSWICK | C385: CARTON | G385: BRAY | I385: HEARN | K385: FITZGERALD | N385: THOMPSON | Q385: JOHNSTONE
A386: CAMBERWELL | C386: LATHLAIN | G386: HARVEY | I386: JONES | K386: GREENWOOD | N386: PONCHARD | Q386: CLAMP
A387: GOALKICKERS
A388: BRUNSWICK | C388: FITZGERALD 2 | G388: KINNEAR 2 | J388: ANDERSON | M388: WARDEN | O388: BEARD | Q388: BRANSTON
A389: CAMBERWELL | C389: MURPHY | G389: LUFF
A391: YARRAVILLE | C391: 5 | D391: 9 | E391: =C391*6+D391 -> 39 | G391: 5 | H391: 9 | I391: =G391*6+H391 -> 39 | K391: 11 | L391: 13 | M391: =K391*6+L391 -> 79 | O391: 11 | P391: 14 | Q391: =O391*6+P391 -> 80 | S391: YARRAVILLE
A392: PRAHRAN | C392: 1 | D392: 4 | E392: =C392*6+D392 -> 10 | G392: 6 | H392: 7 | I392: =G392*6+H392 -> 43 | K392: 6 | L392: 8 | M392: =K392*6+L392 -> 44 | O392: 8 | P392: 12 | Q392: =O392*6+P392 -> 60 | S392: LESTER
A393: BEST PLAYERS
A394: YARRAVILLE | C394: LAWN | E394: HUNTER | H394: PENNY | K394: BRUMBY | N394: DWYER | Q394: EVANS
A395: PRAHRAN | C395: KOOP | E395: NECK | H395: LORD | K395: RENNIE | N395: TRIM | Q395: BANKS
A396: GOALKICKERS
A397: YARRAVILLE | C397: LAWN 5 | E397: BRUMBY 3 | H397: EVANS | K397: SMITH | M397: QUIGG
A398: PRAHRAN | C398: HILL 2 | E398: TRIM 2 | H398: NECK 2 | K398: LORD | M398: SMITH
A400: COBURG | C400: 0 | D400: 2 | E400: =C400*6+D400 -> 2 | G400: 4 | H400: 12 | I400: =G400*6+H400 -> 36 | K400: 6 | L400: 13 | M400: =K400*6+L400 -> 49 | O400: 10 | P400: 23 | Q400: =O400*6+P400 -> 83 | S400: ELSTERNWICK PARK
A401: BRIGHTON | C401: 4 | D401: 5 | E401: =C401*6+D401 -> 29 | G401: 5 | H401: 6 | I401: =G401*6+H401 -> 36 | K401: 10 | L401: 9 | M401: =K401*6+L401 -> 69 | O401: 10 | P401: 9 | Q401: =O401*6+P401 -> 69 | S401: MURRAY
A402: BEST PLAYERS
A403: COBURG | C403: JENKINS | F403: KIGHT | I403: MARTIN | L403: HARRIS | O403: BERTRAM | R403: DONNELLY
A404: BRIGHTON | C404: IRWIN | F404: SCHENCK | I404: TUCKER | L404: SMITH | O404: STOREY | R404: BARNES
A405: GOALKICKERS
A406: COBURG | C406: McDONALD 2 | F406: LEAHY 2 | I406: PLANT | K406: KIGHT | M406: HARRIS | O406: ELLIOTT | Q406: DONNELLY | T406: JENKINS
A407: BRIGHTON | C407: STOREY 3 | F407: SMITH 3 | I407: LILBURNE 2 | L407: McGURGIN | O407: McNIFF
A409: ROUND 8 | E409: 13TH JUNE | J409: WEATHER | M409: COOL CLOUDY S.W. WIND | S409: PLAYED AT
D410: 1ST QTR | H410: 2ND QTR | L410: 3RD QTR | P410: FINAL | S410: COBURG
A411: OAKLEIGH | C411: 1 | D411: 1 | E411: =C411*6+D411 -> 7 | G411: 8 | H411: 6 | I411: =G411*6+H411 -> 54 | K411: 11 | L411: 10 | M411: =K411*6+L411 -> 76 | O411: 14 | P411: 17 | Q411: =O411*6+P411 -> 101 | S411: UMPIRE | X411: LADDER | AB411: ROUND | AD411: 8
A412: COBURG | C412: 3 | D412: 3 | E412: =C412*6+D412 -> 21 | G412: 3 | H412: 3 | I412: =G412*6+H412 -> 21 | K412: 4 | L412: 6 | M412: =K412*6+L412 -> 30 | O412: 4 | P412: 9 | Q412: =O412*6+P412 -> 33 | S412: LESTER
A413: BEST PLAYERS | W413: TEAM | X413: W | Y413: L | Z413: D | AA413: FOR | AB413: AGST | AC413: % | AD413: PTS
A414: OAKLEIGH | C414: GODING | E414: OPREY | H414: BEASLEY | K414: DOLAN | N414: WITHERS | Q414: FRASER
A415: COBURG | C415: MEARS | E415: KIGHT | H415: GREGORY | K415: MARTIN | N415: BERTRAM | Q415: ROGERS | W415: OAKLEIGH | X415: 7 | Y415: 1 | Z415: 0 | AA415: 801 | AB415: 500 | AC415: 160.2 | AD415: 28
A416: GOALKICKERS | W416: NORTHCOTE | X416: 7 | Y416: 1 | Z416: 0 | AA416: 719 | AB416: 543 | AC416: 132.41252302025782 | AD416: 28
A417: OAKLEIGH | C417: FRASER 5 | E417: FLEMING 3 | H417: CRAMERI 2 | K417: SPAIN 2 | M417: GODING | O417: BEASLEY | W417: YARRAVILLE | X417: 6 | Y417: 2 | Z417: 0 | AA417: 699 | AB417: 643 | AC417: 108.70917573872472 | AD417: 24
A418: COBURG | C418: KIGHT 2 | F418: PLANT | I418: MEARS | W418: PORT MELBOURNE | X418: 5 | Y418: 3 | Z418: 0 | AA418: 680 | AB418: 499 | AC418: 136.27 | AD418: 20
A420: PORT MELBOURNE | C420: 0 | D420: 2 | E420: =C420*6+D420 -> 2 | G420: 4 | H420: 11 | I420: =G420*6+H420 -> 35 | K420: 6 | L420: 14 | M420: =K420*6+L420 -> 50 | O420: 12 | P420: 19 | Q420: =O420*6+P420 -> 91 | S420: PORT MELBOURNE | W420: BRUNSWICK | X420: 5 | Y420: 3 | Z420: 0 | AA420: 665 | AB420: 560 | AC420: 118.75 | AD420: 20
A421: SANDRINGHAM | C421: 3 | D421: 3 | E421: =C421*6+D421 -> 21 | G421: 3 | H421: 6 | I421: =G421*6+H421 -> 24 | K421: 4 | L421: 12 | M421: =K421*6+L421 -> 36 | O421: 6 | P421: 15 | Q421: =O421*6+P421 -> 51 | S421: NOWLAN | W421: SANDRINGHAM | X421: 5 | Y421: 3 | Z421: 0 | AA421: 719 | AB421: 680 | AC421: 105.73529411764706 | AD421: 20
A422: BEST PLAYERS | W422: COBURG | X422: 4 | Y422: 4 | Z422: 0 | AA422: 620 | AB422: 689 | AC422: 89.99 | AD422: 16
A423: PORT MELBOURNE | C423: GARBUTT | F423: HYDE | I423: SMITH | K423: McINNES | N423: TUITE | Q423: LEGGO | W423: PRESTON | X423: 3 | Y423: 5 | Z423: 0 | AA423: 598 | AB423: 709 | AC423: 84.344146685472495 | AD423: 12
A424: SANDRINGHAM | C424: RAYMENT | F424: E BOURKE | I424: BECKTON | K424: CHALLIS | N424: JAMIESON | Q424: R KENNA | W424: WILLIAMSTOWN | X424: 2 | Y424: 6 | Z424: 0 | AA424: 636 | AB424: 723 | AC424: 87.966804979253112 | AD424: 8
A425: GOALKICKERS | W425: CAMBERWELL | X425: 2 | Y425: 6 | Z425: 0 | AA425: 539 | AB425: 739 | AC425: 72.936400541271993 | AD425: 8
A426: PORT MELBOURNE | C426: BARNES 3 | F426: BEDFORD 3 | I426: PLUMRIDGE 2 | L426: McINNES | N426: McKENZIE | P426: SMITH | R426: LEGGO | W426: BRIGHTON | X426: 1 | Y426: 7 | Z426: 0 | AA426: 627 | AB426: 757 | AC426: 82.826948480845445 | AD426: 4
A427: SANDRINGHAM | C427: BOYD 2 | F427: HUDD 2 | I427: FITZGERALD | L427: RAYMENT | W427: PRAHRAN | X427: 1 | Y427: 7 | Z427: 0 | AA427: 522 | AB427: 783 | AC427: 66.666666666666671 | AD427: 4
A429: YARRAVILLE | C429: 0 | D429: 2 | E429: =C429*6+D429 -> 2 | G429: 5 | H429: 6 | I429: =G429*6+H429 -> 36 | K429: 7 | L429: 7 | M429: =K429*6+L429 -> 49 | O429: 14 | P429: 15 | Q429: =O429*6+P429 -> 99 | S429: PRESTON
A430: PRESTON | C430: 4 | D430: 4 | E430: =C430*6+D430 -> 28 | G430: 8 | H430: 4 | I430: =G430*6+H430 -> 52 | K430: 12 | L430: 9 | M430: =K430*6+L430 -> 81 | O430: 14 | P430: 11 | Q430: =O430*6+P430 -> 95 | S430: MORCOM
A431: BEST PLAYERS
A432: YARRAVILLE | C432: HUNTER | F432: LAWN | I432: KENNEDY | L432: ROBERTSON | O432: FITZMAURICE | R432: PREWETT
A433: PRESTON | C433: CAZALY | F433: WARR | I433: DAVIE | L433: SMITH | O433: SEEBECK | R433: CAMERON
A434: GOALKICKERS
A435: YARRAVILLE | C435: LAWN 6 | E435: PREWETT 3 | H435: FITZMAURICE 2 | L435: TYSON 2 | O435: ROBERTSON
A436: PRESTON | C436: WARR 4 | E436: DAVIE 4 | H436: CAZALY | K436: SUMMERS | N436: HUGHSON | Q436: MONOHAN | T436: PIPER
A438: BRIGHTON | C438: 5 | D438: 7 | E438: =C438*6+D438 -> 37 | G438: 8 | H438: 8 | I438: =G438*6+H438 -> 56 | K438: 13 | L438: 14 | M438: =K438*6+L438 -> 92 | O438: 15 | P438: 15 | Q438: =O438*6+P438 -> 105 | S438: CAMBERWELL
A439: CAMBERWELL | C439: 1 | D439: 1 | E439: =C439*6+D439 -> 7 | G439: 4 | H439: 4 | I439: =G439*6+H439 -> 28 | K439: 6 | L439: 6 | M439: =K439*6+L439 -> 42 | O439: 9 | P439: 10 | Q439: =O439*6+P439 -> 64 | S439: BORLAND
A440: BEST PLAYERS
A441: BRIGHTON | C441: LILBURNE | G441: BOLWELL | J441: STOREY | M441: BARNES | O441: SMITH | Q441: TUCKER
A442: CAMBERWELL | C442: GREENWOOD | G442: LATHLAIN | J442: STRACHAN | M442: HARVEY | O442: LUFF | Q442: JACKSON
A443: GOALKICKERS
A444: BRIGHTON | C444: STOREY 4 | F444: BOLWELL 3 | I444: TUCKER 2 | K444: MCGURGIN 2 | N444: McNIFF 2 | Q444: SMITH | S444: LILBURNE
A445: CAMBERWELL | C445: WILLIAMS 2 | F445: HARVEY 2 | I445: MURPHY | K445: LUFF | N445: COLLINS
A447: BRUNSWICK | C447: 2 | D447: 3 | E447: =C447*6+D447 -> 15 | G447: 7 | H447: 5 | I447: =G447*6+H447 -> 47 | K447: 11 | L447: 6 | M447: =K447*6+L447 -> 72 | O447: 13 | P447: 11 | Q447: =O447*6+P447 -> 89 | S447: TOORAK PARK
A448: PRAHRAN | C448: 3 | D448: 3 | E448: =C448*6+D448 -> 21 | G448: 3 | H448: 5 | I448: =G448*6+H448 -> 23 | K448: 5 | L448: 6 | M448: =K448*6+L448 -> 36 | O448: 5 | P448: 9 | Q448: =O448*6+P448 -> 39 | S448: MURRAY
A449: BEST PLAYERS
A450: BRUNSWICK | C450: ANDERSON | F450: DOWLING | I450: BRIGHT | K450: JOHNSTONE | O450: HEARN | Q450: BEARD
A451: PRAHRAN | C451: KOOP | F451: LORD | I451: NECK | K451: JORDAN | O451: BRUCE | Q451: HILL
A452: GOALKICKERS
A453: BRUNSWICK | C453: FRASER 3 | F453: DOWLING 3 | I453: BEARD 3 | K453: ANDERSON | N453: BRAY | P453: WARDEN | R453: FITZGERALD
A454: PRAHRAN | C454: LORD 2 | F454: JORDAN | I454: SALTER | K454: GLYDE
A456: NORTHCOTE | C456: 2 | D456: 3 | E456: =C456*6+D456 -> 15 | G456: 6 | H456: 7 | I456: =G456*6+H456 -> 43 | K456: 10 | L456: 13 | M456: =K456*6+L456 -> 73 | O456: 13 | P456: 16 | Q456: =O456*6+P456 -> 94 | S456: WILLIAMSTOWN
A457: WILLIAMSTOWN | C457: 2 | D457: 3 | E457: =C457*6+D457 -> 15 | G457: 3 | H457: 5 | I457: =G457*6+H457 -> 23 | K457: 5 | L457: 6 | M457: =K457*6+L457 -> 36 | O457: 9 | P457: 10 | Q457: =O457*6+P457 -> 64 | S457: COFFEY
A458: BEST PLAYERS
A459: NORTHCOTE | C459: SEYMOUR | G459: ROSS | I459: NICHOLLS | L459: ROWE | O459: WOODS | Q459: GARRETT
A460: WILLIAMSTOWN | C460: SHANAHAN | G460: SYKES | I460: JOHNS | L460: LONERGAN | O460: SINCLAIR | Q460: DORGAN
A461: GOALKICKERS
A462: NORTHCOTE | C462: SEYMOUR 4 | F462: BRIGGS 2 | I462: SIMMONDS 2 | L462: ROWE 2 | N462: GOULLET 2 | Q462: R ROSS
A463: WILLIAMSTOWN | C463: SHANAHAN 3 | F463: SINCLAIR 2 | I463: GOGGIN | L463: CAHILL | N463: JOHNS | P463: BARNES
A465: ROUND 9 | E465: 20TH JUNE | H465: WEATHER | K465: COLD SHOWERS S.W.WIND GROUNDS BAD | S465: PLAYED AT
D466: 1ST QTR | H466: 2ND QTR | L466: 3RD QTR | P466: FINAL | S466: NORTHCOTE
A467: OAKLEIGH | C467: 4 | D467: 6 | E467: =C467*6+D467 -> 30 | G467: 4 | H467: 6 | I467: =G467*6+H467 -> 30 | K467: 7 | L467: 11 | M467: =K467*6+L467 -> 53 | O467: 9 | P467: 12 | Q467: =O467*6+P467 -> 66 | S467: UMPIRE | X467: LADDER | AB467: ROUND | AD467: 9
A468: NORTHCOTE | C468: 1 | D468: 4 | E468: =C468*6+D468 -> 10 | G468: 2 | H468: 10 | I468: =G468*6+H468 -> 22 | K468: 3 | L468: 13 | M468: =K468*6+L468 -> 31 | O468: 4 | P468: 15 | Q468: =O468*6+P468 -> 39 | S468: MORCAM
A469: BEST PLAYERS | W469: TEAM | X469: W | Y469: L | Z469: D | AA469: FOR | AB469: AGST | AC469: % | AD469: PTS
A470: OAKLEIGH | C470: BEASLEY | G470: DRIVER | I470: CHAPMAN | L470: RUDOLPH | O470: RODWELL | Q470: WITHERS
A471: NORTHCOTE | C471: COCKRAM | G471: ROSS | I471: NICHOLLS | L471: DEA | O471: BRIGGS | Q471: HILL | W471: OAKLEIGH | X471: 8 | Y471: 1 | Z471: 0 | AA471: 867 | AB471: 539 | AC471: 160.85343228200372 | AD471: 32
A472: GOALKICKERS | W472: NORTHCOTE | X472: 7 | Y472: 2 | Z472: 0 | AA472: 758 | AB472: 609 | AC472: 124.46633825944171 | AD472: 28
A473: OAKLEIGH | C473: FRASER 3 | F473: RODWELL 2 | I473: GODING 2 | L473: CHAPMAN | O473: SPAIN | W473: YARRAVILLE | X473: 7 | Y473: 2 | Z473: 0 | AA473: 768 | AB473: 699 | AC473: 109.87124463519314 | AD473: 28
A474: NORTHCOTE | C474: SIMMONDS | F474: POULTER | I474: KEMP | L474: HILL | W474: PORT MELBOURNE | X474: 6 | Y474: 3 | Z474: 0 | AA474: 776 | AB474: 557 | AC474: 139.32 | AD474: 24
A476: YARRAVILLE | C476: 3 | D476: 3 | E476: =C476*6+D476 -> 21 | G476: 6 | H476: 6 | I476: =G476*6+H476 -> 42 | K476: 6 | L476: 12 | M476: =K476*6+L476 -> 48 | O476: 9 | P476: 15 | Q476: =O476*6+P476 -> 69 | S476: YARRAVILLE | W476: BRUNSWICK | X476: 5 | Y476: 4 | Z476: 0 | AA476: 721 | AB476: 629 | AC476: 114.62639109697933 | AD476: 20
A477: BRUNSWICK | C477: 1 | D477: 9 | E477: =C477*6+D477 -> 15 | G477: 1 | H477: 16 | I477: =G477*6+H477 -> 22 | K477: 5 | L477: 18 | M477: =K477*6+L477 -> 48 | O477: 6 | P477: 20 | Q477: =O477*6+P477 -> 56 | S477: SCHAEFER | W477: SANDRINGHAM | X477: 5 | Y477: 4 | Z477: 0 | AA477: 783 | AB477: 770 | AC477: 101.68831168831169 | AD477: 20
A478: BEST PLAYERS | W478: COBURG | X478: 5 | Y478: 4 | Z478: 0 | AA478: 690 | AB478: 745 | AC478: 92.62 | AD478: 20
A479: YARRAVILLE | C479: BRUMBY | F479: LORD | I479: WUNHYM | K479: TOOHEY | N479: TYSON | Q479: DWYER | W479: PRESTON | X479: 4 | Y479: 5 | Z479: 0 | AA479: 688 | AB479: 773 | AC479: 89.003880983182412 | AD479: 16
A480: BRUNSWICK | C480: HEARN | F480: THOMPSON | I480: BEARD | K480: WARDEN | N480: JOHNSTONE | Q480: DOWLING | W480: WILLIAMSTOWN | X480: 2 | Y480: 7 | Z480: 0 | AA480: 684 | AB480: 794 | AC480: 86.146095717884137 | AD480: 8
A481: GOALKICKERS | W481: CAMBERWELL | X481: 2 | Y481: 7 | Z481: 0 | AA481: 595 | AB481: 809 | AC481: 73.547589616810882 | AD481: 8
A482: YARRAVILLE | C482: KENNEDY 2 | F482: LAWN 2 | I482: TYSON 2 | K482: ROBERTSON | N482: BRUMBY | P482: QUIGG | W482: PRAHRAN | X482: 2 | Y482: 7 | Z482: 0 | AA482: 593 | AB482: 831 | AC482: 71.359807460890494 | AD482: 8
A483: BRUNSWICK | C483: BRAY 2 | F483: DOWLING | I483: WARDEN | K483: BEARD | M483: PROUDFOOT | W483: BRIGHTON | X483: 1 | Y483: 8 | Z483: 0 | AA483: 685 | AB483: 853 | AC483: 80.304806565064482 | AD483: 4
A485: PRESTON | C485: 2 | D485: 4 | E485: =C485*6+D485 -> 16 | G485: 7 | H485: 6 | I485: =G485*6+H485 -> 48 | K485: 9 | L485: 11 | M485: =K485*6+L485 -> 65 | O485: 13 | P485: 12 | Q485: =O485*6+P485 -> 90 | S485: PRESTON
A486: SANDRINGHAM | C486: 3 | D486: 2 | E486: =C486*6+D486 -> 20 | G486: 4 | H486: 4 | I486: =G486*6+H486 -> 28 | K486: 7 | L486: 6 | M486: =K486*6+L486 -> 48 | O486: 9 | P486: 10 | Q486: =O486*6+P486 -> 64 | S486: STUART
A487: BEST PLAYERS
A488: PRESTON | C488: TAYLOR | F488: WARR | I488: F SPARGO | L488: CAMERON | N488: SEEBECK | Q488: CAZALY
A489: SANDRINGHAM | C489: BECKTON | F489: R KENNA | I489: T ANDERSON | L489: LUNN | N489: E BOURKE | Q489: RAYMENT
A490: GOALKICKERS
A491: PRESTON | C491: CAZALY 5 | F491: DAVIE 3 | I491: SUMMERS 2 | L491: CAMERON 2 | O491: WARR | Q491: PIPER
A492: SANDRINGHAM | C492: R KENNA 2 | F492: HUDD 2 | I492: FITZGERALD | L492: A ANDERSON | O492: BOYD | Q492: YEMM
A494: COBURG | C494: 2 | D494: 2 | E494: =C494*6+D494 -> 14 | G494: 3 | H494: 4 | I494: =G494*6+H494 -> 22 | K494: 7 | L494: 7 | M494: =K494*6+L494 -> 49 | O494: 10 | P494: 10 | Q494: =O494*6+P494 -> 70 | S494: COBURG
A495: CAMBERWELL | C495: 5 | D495: 1 | E495: =C495*6+D495 -> 31 | G495: 6 | H495: 1 | I495: =G495*6+H495 -> 37 | K495: 6 | L495: 1 | M495: =K495*6+L495 -> 37 | O495: 9 | P495: 2 | Q495: =O495*6+P495 -> 56 | S495: GLOVER
A496: BEST PLAYERS
A497: COBURG | C497: JENKINS | F497: HARRIS | I497: KIGHT | K497: GREGORY | N497: SELLERS | Q497: DUNCAN
A498: CAMBERWELL | C498: WALLIS | F498: MURPHY | I498: PETRIE | K498: GREENWOOD | N498: LUFF | Q498: JONES
A499: GOALKICKERS
A500: COBURG | C500: SELLARS 3 | F500: DUNCAN 3 | I500: KIGHT 2 | K500: HARRIS | N500: ELEY
A501: CAMBERWELL | C501: LUFF 5 | F501: STRACHAN | I501: WILLIAMS | K501: PETRIE | N501: COLLINS
A503: PRAHRAN | C503: 2 | D503: 3 | E503: =C503*6+D503 -> 15 | G503: 4 | H503: 6 | I503: =G503*6+H503 -> 30 | K503: 8 | L503: 10 | M503: =K503*6+L503 -> 58 | O503: 9 | P503: 17 | Q503: =O503*6+P503 -> 71 | S503: NORTHCOTE
A504: WILLIAMSTOWN | C504: 1 | D504: 5 | E504: =C504*6+D504 -> 11 | G504: 3 | H504: 7 | I504: =G504*6+H504 -> 25 | K504: 4 | L504: 9 | M504: =K504*6+L504 -> 33 | O504: 6 | P504: 12 | Q504: =O504*6+P504 -> 48 | S504: LESTER
A505: BEST PLAYERS
A506: PRAHRAN | C506: KOOP | F506: CAYLEY | I506: NECK | K506: ROSS | N506: TRIM | Q506: JORDAN
A507: WILLIAMSTOWN | C507: HYDE | F507: SYKES | I507: LONERGAN | K507: WINNELL | N507: JOHNS | Q507: BARNES
A508: GOALKICKERS
A509: PRAHRAN | C509: LORD 2 | F509: RENNIE 2 | I509: HAWKINS 2 | L509: JORDAN | N509: TRIM | P509: SMEDLEY
A510: WILLIAMSTOWN | C510: SINCLAIR 2 | F510: GOOGIN | I510: BLAKE | L510: SHEEAHN | N510: BARNES
A512: PORT MELBOURNE | C512: 6 | D512: 5 | E512: =C512*6+D512 -> 41 | G512: 7 | H512: 6 | I512: =G512*6+H512 -> 48 | K512: 12 | L512: 7 | M512: =K512*6+L512 -> 79 | O512: 14 | P512: 12 | Q512: =O512*6+P512 -> 96 | S512: PORT MELBOURNE
A513: BRIGHTON | C513: 1 | D513: 0 | E513: =C513*6+D513 -> 6 | G513: 4 | H513: 5 | I513: =G513*6+H513 -> 29 | K513: 6 | L513: 5 | M513: =K513*6+L513 -> 41 | O513: 8 | P513: 10 | Q513: =O513*6+P513 -> 58 | S513: GREGORY
A514: BEST PLAYERS
A515: PORT MELBOURNE | C515: SMITH | F515: BEDFORD | I515: BROOKER | L515: LEGGO | N515: BARNES | Q515: LAHIFF
A516: BRIGHTON | C516: IRWIN | F516: LILBURNE | I516: SMITH | L516: BARNES | N516: TUCKER | Q516: DORE
A517: GOALKICKERS
A518: PORT MELBOURNE | C518: BARNES 4 | F518: LAHIFF 4 | I518: BEDFORD 3 | L518: SMITH | O518: LOVETT | Q518: STANBRIDGE
A519: BRIGHTON | C519: LILBURNE 2 | F519: BOLWELL 2 | I519: TUCKER | L519: McGURGIN | O519: STOREY | Q519: McNIFF
A521: ROUND 10 | E521: 27TH JUNE | H521: WEATHER | K521: DULL SHOWERS WEST WIND GROUNDS BAD | S521: PLAYED AT
D522: 1ST QTR | H522: 2ND QTR | L522: 3RD QTR | P522: FINAL | S522: OAKLEIGH
A523: OAKLEIGH | C523: 1 | D523: 2 | E523: =C523*6+D523 -> 8 | G523: 2 | H523: 3 | I523: =G523*6+H523 -> 15 | K523: 6 | L523: 3 | M523: =K523*6+L523 -> 39 | O523: 7 | P523: 6 | Q523: =O523*6+P523 -> 48 | S523: UMPIRE | X523: LADDER | AB523: ROUND | AD523: 10
A524: YARRAVILLE | C524: 1 | D524: 4 | E524: =C524*6+D524 -> 10 | G524: 2 | H524: 6 | I524: =G524*6+H524 -> 18 | K524: 2 | L524: 11 | M524: =K524*6+L524 -> 23 | O524: 2 | P524: 15 | Q524: =O524*6+P524 -> 27 | S524: SCHAEFER
A525: BEST PLAYERS | W525: TEAM | X525: W | Y525: L | Z525: D | AA525: FOR | AB525: AGST | AC525: % | AD525: PTS
A526: OAKLEIGH | C526: THOMAS | E526: RODWELL | H526: BEASLEY | K526: RUDOLPH | N526: GODING | Q526: WITHERS
A527: YARRAVILLE | C527: HUNTER | E527: CAMERON | H527: DWYER | K527: LAWN | N527: TYSON | Q527: BRUMBY | W527: OAKLEIGH | X527: 9 | Y527: 1 | Z527: 0 | AA527: 915 | AB527: 566 | AC527: 161.66077738515901 | AD527: 36
A528: GOALKICKERS | W528: PORT MELBOURNE | X528: 7 | Y528: 3 | Z528: 0 | AA528: 851 | AB528: 600 | AC528: 141.83 | AD528: 28
A529: OAKLEIGH | C529: FRASER 2 | E529: RODWELL | G529: GODING | I529: OPREY | K529: BEASLEY | M529: WILTSHIRE | W529: NORTHCOTE | X529: 7 | Y529: 3 | Z529: 0 | AA529: 802 | AB529: 678 | AC529: 118.28908554572271 | AD529: 28
A530: YARRAVILLE | C530: TYSON | E530: SMITH | W530: YARRAVILLE | X530: 7 | Y530: 3 | Z530: 0 | AA530: 795 | AB530: 747 | AC530: 106.42570281124497 | AD530: 28
A532: BRUNSWICK | C532: 3 | D532: 5 | E532: =C532*6+D532 -> 23 | G532: 4 | H532: 7 | I532: =G532*6+H532 -> 31 | K532: 7 | L532: 11 | M532: =K532*6+L532 -> 53 | O532: 9 | P532: 15 | Q532: =O532*6+P532 -> 69 | S532: BRUNSWICK | W532: BRUNSWICK | X532: 6 | Y532: 4 | Z532: 0 | AA532: 790 | AB532: 673 | AC532: 117.38484398216939 | AD532: 24
A533: NORTHCOTE | C533: 2 | D533: 2 | E533: =C533*6+D533 -> 14 | G533: 3 | H533: 4 | I533: =G533*6+H533 -> 22 | K533: 4 | L533: 6 | M533: =K533*6+L533 -> 30 | O533: 6 | P533: 8 | Q533: =O533*6+P533 -> 44 | S533: GLOVER | W533: SANDRINGHAM | X533: 6 | Y533: 4 | Z533: 0 | AA533: 908 | AB533: 858 | AC533: 105.82750582750583 | AD533: 24
A534: BEST PLAYERS | W534: PRESTON | X534: 5 | Y534: 5 | Z534: 0 | AA534: 780 | AB534: 827 | AC534: 94.316807738815001 | AD534: 20
A535: BRUNSWICK | C535: WARDEN | E535: PANNAM | H535: FITZGERALD | K535: MAYNES | N535: JOHNSTONE | Q535: BEARD | W535: COBURG | X535: 5 | Y535: 5 | Z535: 0 | AA535: 778 | AB535: 870 | AC535: 88.51 | AD535: 20
A536: NORTHCOTE | C536: ROWE | E536: BRIGGS | H536: SMITH | K536: HUMPHRIES | N536: ROSS | Q536: SEYMOUR | W536: PRAHRAN | X536: 3 | Y536: 7 | Z536: 0 | AA536: 670 | AB536: 897 | AC536: 74.693422519509483 | AD536: 12
A537: GOALKICKERS | W537: WILLIAMSTOWN | X537: 2 | Y537: 8 | Z537: 0 | AA537: 727 | AB537: 869 | AC537: 83.65937859608745 | AD537: 8
A538: BRUNSWICK | C538: FRASER 3 | F538: WARDEN 2 | I538: FITZGERALD 2 | L538: EUDY 2 | W538: CAMBERWELL | X538: 2 | Y538: 8 | Z538: 0 | AA538: 649 | AB538: 901 | AC538: 72.031076581576031 | AD538: 8
A539: NORTHCOTE | C539: SEYMOUR 2 | F539: BRIGGS | H539: SIMMONDS | K539: ROWE | W539: BRIGHTON | X539: 1 | Y539: 9 | Z539: 0 | AA539: 751 | AB539: 930 | AC539: 80.752688172043008 | AD539: 4
A541: SANDRINGHAM | C541: 2 | D541: 3 | E541: =C541*6+D541 -> 15 | G541: 7 | H541: 11 | I541: =G541*6+H541 -> 53 | K541: 10 | L541: 13 | M541: =K541*6+L541 -> 73 | O541: 17 | P541: 23 | Q541: =O541*6+P541 -> 125 | S541: BEACH ROAD
A542: COBURG | C542: 5 | D542: 4 | E542: =C542*6+D542 -> 34 | G542: 6 | H542: 4 | I542: =G542*6+H542 -> 40 | K542: 8 | L542: 15 | M542: =K542*6+L542 -> 63 | O542: 12 | P542: 16 | Q542: =O542*6+P542 -> 88 | S542: LESTER
A543: BEST PLAYERS
A544: SANDRINGHAM | C544: RAYMENT | F544: R KENNA | I544: YOUNG | L544: BOYD | O544: BECKTON | R544: FORBES
A545: COBURG | C545: HARRIS | F545: PLANT | I545: MEARS | L545: McGRATH | O545: LEAHY | R545: DUNCAN
A546: GOALKICKERS
A547: SANDRINGHAM | C547: FORBES 4 | F547: BOYD 4 | H547: R KENNA 3 | K547: BECKTON 2 | N547: FITZGERALD | Q547: DE LUCA | S547: RAYMENT | V547: A ANDERSON
A548: COBURG | C548: SELLARS 3 | F548: PLANT 2 | I548: MEARS 2 | K548: DUNCAN 2 | N548: LEAHY | P548: JENKINS | S548: ELEY
A550: PRESTON | C550: 4 | D550: 7 | E550: =C550*6+D550 -> 31 | G550: 7 | H550: 11 | I550: =G550*6+H550 -> 53 | K550: 10 | L550: 17 | M550: =K550*6+L550 -> 77 | O550: 12 | P550: 20 | Q550: =O550*6+P550 -> 92 | S550: CAMBERWELL
A551: CAMBERWELL | C551: 0 | D551: 0 | E551: =C551*6+D551 -> 0 | G551: 2 | H551: 2 | I551: =G551*6+H551 -> 14 | K551: 3 | L551: 4 | M551: =K551*6+L551 -> 22 | O551: 8 | P551: 6 | Q551: =O551*6+P551 -> 54 | S551: GREGORY
A552: BEST PLAYERS
A553: PRESTON | C553: WARR | F553: MONOHAN | I553: SUMMERS | L553: REICHMAN | O553: CAMERON | R553: DOWLING
A554: CAMBERWELL | C554: HENDERSON | F554: WALLIS | I554: DYBALL | L554: PETRIE | O554: COLLINS | R554: PONCHARD
A555: GOALKICKERS
A556: PRESTON | C556: WARR 6 | E556: CAMERON 2 | H556: DAVIE | J556: CAZALY | L556: SUMMERS | N556: COLLINS
A557: CAMBERWELL | C557: LUFF 3 | E557: MORT 2 | G557: MURPHY | I557: PETRIE | K557: HARVEY
A559: PORT MELBOURNE | C559: 3 | D559: 4 | E559: =C559*6+D559 -> 22 | G559: 4 | H559: 6 | I559: =G559*6+H559 -> 30 | K559: 8 | L559: 7 | M559: =K559*6+L559 -> 55 | O559: 11 | P559: 9 | Q559: =O559*6+P559 -> 75 | S559: WILLIAMSTOWN
A560: WILLIAMSTOWN | C560: 3 | D560: 3 | E560: =C560*6+D560 -> 21 | G560: 5 | H560: 3 | I560: =G560*6+H560 -> 33 | K560: 6 | L560: 5 | M560: =K560*6+L560 -> 41 | O560: 6 | P560: 7 | Q560: =O560*6+P560 -> 43 | S560: MORCOM
A561: BEST PLAYERS
A562: PORT MELBOURNE | C562: BEDFORD | F562: LAHIFF | I562: TUITE | L562: BARNES | O562: HYDE | R562: FARNAN
A563: WILLIAMSTOWN | C563: BARNES | F563: HELLWIG | I563: CAHILL | L563: SYKES | O563: NEIL | R563: SINCLAIR
A564: GOALKICKERS
A565: PORT MELBOURNE | C565: BEDFORD 5 | F565: BARNES 3 | I565: TUITE 2 | L565: LAHIFF
A566: WILLIAMSTOWN | C566: BLAKE 2 | F566: BARNES 2 | I566: WALSH | L566: HELWIG
E567: 29TH JULY | J567: WEATHER
A568: PRAHRAN | C568: 2 | D568: 9 | E568: =C568*6+D568 -> 21 | G568: 4 | H568: 11 | I568: =G568*6+H568 -> 35 | K568: 8 | L568: 15 | M568: =K568*6+L568 -> 63 | O568: 10 | P568: 17 | Q568: =O568*6+P568 -> 77 | S568: ELSTERNWICK PARK
A569: BRIGHTON | C569: 1 | D569: 5 | E569: =C569*6+D569 -> 11 | G569: 5 | H569: 13 | I569: =G569*6+H569 -> 43 | K569: 5 | L569: 17 | M569: =K569*6+L569 -> 47 | O569: 7 | P569: 24 | Q569: =O569*6+P569 -> 66 | S569: STUART
A570: BEST PLAYERS
A571: PRAHRAN | C571: NECK | F571: ROSS | I571: KOOP | L571: BRUCE | O571: SMEDLEY | R571: JORDAN
A572: BRIGHTON | C572: LILBURNE | F572: BOLWELL | I572: TUCKER | L572: IRWIN | O572: HUNT | R572: STEWART
A573: GOALKICKERS
A574: PRAHRAN | C574: HAWKINS 3 | F574: JORDAN 2 | I574: HANNAN 2 | L574: WILLIAMS | N574: GREENWOOD | Q574: SMEDLEY
A575: BRIGHTON | C575: BOLWELL 2 | F575: BURNES | I575: TUCKER | L575: SMITH | N575: McNIFF | P575: DORE
A577: ROUND 11 | E577: 4TH JULY | H577: WEATHER | K577: FINE SOUTH BREEZE GROUNDS WET | S577: PLAYED AT
D578: 1ST QTR | H578: 2ND QTR | L578: 3RD QTR | P578: FINAL | S578: BRUNSWICK
A579: PORT MELBOURNE | C579: 3 | D579: 3 | E579: =C579*6+D579 -> 21 | G579: 6 | H579: 5 | I579: =G579*6+H579 -> 41 | K579: 7 | L579: 5 | M579: =K579*6+L579 -> 47 | O579: 8 | P579: 7 | Q579: =O579*6+P579 -> 55 | S579: UMPIRE | X579: LADDER | AB579: ROUND | AD579: 11
A580: BRUNSWICK | C580: 3 | D580: 2 | E580: =C580*6+D580 -> 20 | G580: 5 | H580: 5 | I580: =G580*6+H580 -> 35 | K580: 7 | L580: 6 | M580: =K580*6+L580 -> 48 | O580: 7 | P580: 8 | Q580: =O580*6+P580 -> 50 | S580: MORCAM
A581: BEST PLAYERS | W581: TEAM | X581: W | Y581: L | Z581: D | AA581: FOR | AB581: AGST | AC581: % | AD581: PTS
A582: PORT MELBOURNE | C582: STANBRIDGE | F582: TUITE | I582: SMITH | L582: GARBUTT | N582: CROMPTON | Q582: BOLWELL
A583: BRUNSWICK | C583: DOWLING | F583: PANNAM | I583: FITZGERALD | L583: KINNEAR | N583: WARDEN | Q583: BRAY | W583: OAKLEIGH | X583: 10 | Y583: 1 | Z583: 0 | AA583: 1008 | AB583: 609 | AC583: 165.51724137931035 | AD583: 40
A584: GOALKICKERS | W584: PORT MELBOURNE | X584: 8 | Y584: 3 | Z584: 0 | AA584: 906 | AB584: 650 | AC584: 139.38 | AD584: 32
A585: PORT MELBOURNE | C585: BEDFORD 3 | F585: McKENZIE 2 | J585: BARNES | M585: TUITE | O585: FARNAN | W585: NORTHCOTE | X585: 8 | Y585: 3 | Z585: 0 | AA585: 917 | AB585: 725 | AC585: 126.48275862068965 | AD585: 32
A586: BRUNSWICK | C586: FRASER 3 | F586: FITZGERALD 2 | J586: WARDEN | M586: KENNETT | W586: YARRAVILLE | X586: 8 | Y586: 3 | Z586: 0 | AA586: 922 | AB586: 848 | AC586: 108.72641509433963 | AD586: 32
A588: YARRAVILLE | C588: 0 | D588: 5 | E588: =C588*6+D588 -> 5 | G588: 7 | H588: 13 | I588: =G588*6+H588 -> 55 | K588: 11 | L588: 14 | M588: =K588*6+L588 -> 80 | O588: 18 | P588: 19 | Q588: =O588*6+P588 -> 127 | S588: BEACH ROAD | W588: BRUNSWICK | X588: 6 | Y588: 5 | Z588: 0 | AA588: 840 | AB588: 728 | AC588: 115.38461538461539 | AD588: 24
A589: SANDRINGHAM | C589: 4 | D589: 7 | E589: =C589*6+D589 -> 31 | G589: 7 | H589: 9 | I589: =G589*6+H589 -> 51 | K589: 12 | L589: 16 | M589: =K589*6+L589 -> 88 | O589: 14 | P589: 17 | Q589: =O589*6+P589 -> 101 | S589: STUART | W589: SANDRINGHAM | X589: 6 | Y589: 5 | Z589: 0 | AA589: 1009 | AB589: 985 | AC589: 102.43654822335026 | AD589: 24
A590: BEST PLAYERS | W590: PRESTON | X590: 6 | Y590: 5 | Z590: 0 | AA590: 860 | AB590: 880 | AC590: 97.727272727272734 | AD590: 24
A591: YARRAVILLE | C591: BUCKLEY | F591: BRUMBY | I591: TYSON | K591: HANNAN | N591: FITZMAURICE | Q591: LAWN | W591: COBURG | X591: 6 | Y591: 5 | Z591: 0 | AA591: 833 | AB591: 915 | AC591: 91.04 | AD591: 24
A592: SANDRINGHAM | C592: DE LUCA | F592: E BOURKE | I592: HUDD | K592: O'DONNELL | N592: FITZGERALD | Q592: RAYMENT | W592: PRAHRAN | X592: 3 | Y592: 8 | Z592: 0 | AA592: 713 | AB592: 990 | AC592: 72.020202020202021 | AD592: 12
A593: GOALKICKERS | W593: WILLIAMSTOWN | X593: 2 | Y593: 9 | Z593: 0 | AA593: 772 | AB593: 924 | AC593: 83.549783549783555 | AD593: 8
A594: YARRAVILLE | C594: LAWN 7 | E594: BUCKLEY 5 | H594: BRUMBY 2 | J594: KENNEDY | L594: EVANS | N594: PREWETT | P594: HUNTER | W594: CAMBERWELL | X594: 2 | Y594: 9 | Z594: 0 | AA594: 696 | AB594: 1016 | AC594: 68.503937007874015 | AD594: 8
A595: SANDRINGHAM | C595: FORBES 3 | E595: BOYD 3 | G595: HUDD 2 | I595: FITZGERALD | L595: DE LUCA | N595: R KENNA | V595: O'DONNELL | W595: BRIGHTON | X595: 1 | Y595: 10 | Z595: 0 | AA595: 804 | AB595: 1010 | AC595: 79.603960396039611 | AD595: 4
A597: COBURG | C597: 1 | D597: 3 | E597: =C597*6+D597 -> 9 | G597: 3 | H597: 11 | I597: =G597*6+H597 -> 29 | K597: 4 | L597: 16 | M597: =K597*6+L597 -> 40 | O597: 6 | P597: 19 | Q597: =O597*6+P597 -> 55 | S597: COBURG
A598: WILLIAMSTOWN | C598: 2 | D598: 4 | E598: =C598*6+D598 -> 16 | G598: 3 | H598: 5 | I598: =G598*6+H598 -> 23 | K598: 4 | L598: 9 | M598: =K598*6+L598 -> 33 | O598: 6 | P598: 9 | Q598: =O598*6+P598 -> 45 | S598: MURRAY
A599: BEST PLAYERS
A600: COBURG | C600: MARTIN | F600: LOWE | I600: McGRATH | L600: JENKINS | O600: SELLERS | R600: LEAHY
A601: WILLIAMSTOWN | C601: SYKES | F601: SHEEHAN | I601: SINCLAIR | L601: CUTTING | O601: TAAFE | R601: BARNES
A602: GOALKICKERS
A603: COBURG | C603: MEARS 2 | F603: MILLEN 2 | I603: MCGRATH | L603: SELLARS
A604: WILLIAMSTOWN | C604: SINCLAIR 2 | F604: CUTTING 2 | I604: WALSH | L604: SHADE
A606: PRESTON | C606: 3 | D606: 0 | E606: =C606*6+D606 -> 18 | G606: 4 | H606: 5 | I606: =G606*6+H606 -> 29 | K606: 6 | L606: 11 | M606: =K606*6+L606 -> 47 | O606: 11 | P606: 14 | Q606: =O606*6+P606 -> 80 | S606: ELSTERNWICK PARK
A607: BRIGHTON | C607: 1 | D607: 2 | E607: =C607*6+D607 -> 8 | G607: 5 | H607: 6 | I607: =G607*6+H607 -> 36 | K607: 7 | L607: 9 | M607: =K607*6+L607 -> 51 | O607: 7 | P607: 11 | Q607: =O607*6+P607 -> 53 | S607: LESTER
A608: BEST PLAYERS
A609: PRESTON | C609: McEACHARN | F609: F SPARGO | I609: WARR | L609: CAMPBELL | O609: SUMMERS | R609: TAYLOR
A610: BRIGHTON | C610: LILBURNES | F610: IRWIN | I610: BURNES | L610: McNIFF | O610: CANTWELL | R610: HARRISON
A611: GOALKICKERS
A612: PRESTON | C612: WARR 3 | E612: PIPER 3 | H612: HUGHSON 2 | K612: CAZALY | M612: SUMMERS | P612: COLLINS
A613: BRIGHTON | C613: McNIFF 2 | E613: BOLWELL 2 | H613: HARRISON 2 | K613: LILBURNE
A615: OAKLEIGH | C615: 5 | D615: 1 | E615: =C615*6+D615 -> 31 | G615: 9 | H615: 5 | I615: =G615*6+H615 -> 59 | K615: 11 | L615: 13 | M615: =K615*6+L615 -> 79 | O615: 13 | P615: 15 | Q615: =O615*6+P615 -> 93 | S615: TOORAK PARK
A616: PRAHRAN | C616: 1 | D616: 2 | E616: =C616*6+D616 -> 8 | G616: 1 | H616: 5 | I616: =G616*6+H616 -> 11 | K616: 2 | L616: 6 | M616: =K616*6+L616 -> 18 | O616: 6 | P616: 7 | Q616: =O616*6+P616 -> 43 | S616: MOWLAN
A617: BEST PLAYERS
A618: OAKLEIGH | C618: RODWELL | F618: FRASER | I618: OPREY | L618: McALLISTER | O618: THOMAS | R618: DRIVER
A619: PRAHRAN | C619: LORD | F619: MAHONEY | I619: SALTER | L619: GLYDE | O619: THOMPSON | R619: WILLIAMS
A620: GOALKICKERS
A621: OAKLEIGH | C621: FRASER 7 | F621: CAMPBELL 2 | I621: RODWELL | K621: CRAMERI | M621: SPAIN | O621: WILTSHIRE
A622: PRAHRAN | C622: HAWKINS 4 | F622: GREENWOOD | I622: NECK
A624: NORTHCOTE | C624: 4 | D624: 2 | E624: =C624*6+D624 -> 26 | G624: 8 | H624: 5 | I624: =G624*6+H624 -> 53 | K624: 10 | L624: 7 | M624: =K624*6+L624 -> 67 | O624: 17 | P624: 13 | Q624: =O624*6+P624 -> 115 | S624: NORTHCOTE
A625: CAMBERWELL | C625: 4 | D625: 2 | E625: =C625*6+D625 -> 26 | G625: 6 | H625: 3 | I625: =G625*6+H625 -> 39 | K625: 6 | L625: 4 | M625: =K625*6+L625 -> 40 | O625: 7 | P625: 5 | Q625: =O625*6+P625 -> 47 | S625: SCHAEFER
A626: BEST PLAYERS
A627: NORTHCOTE | C627: ROSS | E627: SIMMONDS | I627: SMITH | L627: PRUSER | O627: COCKRAM | R627: GARRETT
A628: CAMBERWELL | C628: WARD | E628: CLAMP | I628: COLLINS | L628: JACKSON | O628: WILSON | R628: ELLIOTT
A629: GOALKICKERS
A630: NORTHCOTE | C630: SIMMONDS 8 | F630: PRUSER 5 | I630: COLE 2 | L630: BRIGGS | O630: R ROSS
A631: CAMBERWELL | C631: LUFF 2 | F631: PETRIE 2 | I631: STRACHAN | L631: COLLINS | O631: VALE
A633: ROUND 12 | E633: 11TH JULY | G633: WEATHER | I633: HEAVY RAIN A.M. FINE SUNNY AFTERNONN WEST BREEZE GROUNDS WATERLOGGED
D634: 1ST QTR | H634: 2ND QTR | L634: 3RD QTR | P634: FINAL | S634: PLAYED AT
A635: PORT MELBOURNE | C635: 1 | D635: 0 | E635: =C635*6+D635 -> 6 | G635: 3 | H635: 1 | I635: =G635*6+H635 -> 19 | K635: 3 | L635: 1 | M635: =K635*6+L635 -> 19 | O635: 5 | P635: 4 | Q635: =O635*6+P635 -> 34 | S635: PORT MELBOURNE | X635: LADDER | AB635: ROUND | AD635: 12
A636: OAKLEIGH | C636: 2 | D636: 1 | E636: =C636*6+D636 -> 13 | G636: 4 | H636: 1 | I636: =G636*6+H636 -> 25 | K636: 4 | L636: 4 | M636: =K636*6+L636 -> 28 | O636: 4 | P636: 5 | Q636: =O636*6+P636 -> 29 | S636: UMPIRE
A637: BEST PLAYERS | S637: MURRAY | W637: TEAM | X637: W | Y637: L | Z637: D | AA637: FOR | AB637: AGST | AC637: % | AD637: PTS
A638: PORT MELBOURNE | C638: STANBRIDGE | F638: CROMPTON | I638: BROOKER | L638: LAHIFF | N638: TUITE | Q638: GARBUTT
A639: OAKLEIGH | C639: McALLISTER | F639: THOMAS | I639: OPREY | L639: DRIVER | N639: RUDOLPH | Q639: WITHERS | W639: OAKLEIGH | X639: 10 | Y639: 2 | Z639: 0 | AA639: 1037 | AB639: 643 | AC639: 161.27527216174184 | AD639: 40
A640: GOALKICKERS | W640: PORT MELBOURNE | X640: 9 | Y640: 3 | Z640: 0 | AA640: 940 | AB640: 679 | AC640: 138.44 | AD640: 36
A641: PORT MELBOURNE | C641: BROOKER | F641: VEITCH | I641: SMITH | L641: LEGGO | N641: STANBRIDGE | W641: YARRAVILLE | X641: 8 | Y641: 3 | Z641: 1 | AA641: 968 | AB641: 894 | AC641: 108.27740492170022 | AD641: 34
A642: OAKLEIGH | C642: FRASER | F642: RODWELL | I642: CRAMERI | L642: BEATON | W642: NORTHCOTE | X642: 8 | Y642: 4 | Z642: 0 | AA642: 980 | AB642: 791 | AC642: 123.89380530973452 | AD642: 32
A644: YARRAVILLE | C644: 1 | D644: 0 | E644: =C644*6+D644 -> 6 | G644: 5 | H644: 4 | I644: =G644*6+H644 -> 34 | K644: 5 | L644: 8 | M644: =K644*6+L644 -> 38 | O644: 6 | P644: 10 | Q644: =O644*6+P644 -> 46 | S644: YARRAVILLE | W644: BRUNSWICK | X644: 7 | Y644: 5 | Z644: 0 | AA644: 912 | AB644: 779 | AC644: 117.07317073170732 | AD644: 28
A645: PRESTON | C645: 4 | D645: 6 | E645: =C645*6+D645 -> 30 | G645: 5 | H645: 9 | I645: =G645*6+H645 -> 39 | K645: 5 | L645: 14 | M645: =K645*6+L645 -> 44 | O645: 5 | P645: 16 | Q645: =O645*6+P645 -> 46 | S645: LESTER | W645: COBURG | X645: 7 | Y645: 5 | Z645: 0 | AA645: 927 | AB645: 966 | AC645: 95.96 | AD645: 28
A646: BEST PLAYERS | W646: PRESTON | X646: 6 | Y646: 5 | Z646: 1 | AA646: 906 | AB646: 926 | AC646: 97.840172786177106 | AD646: 26
A647: YARRAVILLE | C647: WUNHYM | F647: FITZMAURICE | I647: HUNTER | L647: PENNY | N647: HANNAN | Q647: SMITH | W647: SANDRINGHAM | X647: 6 | Y647: 6 | Z647: 0 | AA647: 1097 | AB647: 1087 | AC647: 100.91996320147194 | AD647: 24
A648: PRESTON | C648: REICHMAN | F648: TAYLOR | I648: SMITH | L648: HUGHSON | N648: SUMMERS | Q648: WARR | W648: PRAHRAN | X648: 4 | Y648: 8 | Z648: 0 | AA648: 815 | AB648: 1078 | AC648: 75.602968460111313 | AD648: 16
A649: GOALKICKERS | W649: WILLIAMSTOWN | X649: 3 | Y649: 9 | Z649: 0 | AA649: 838 | AB649: 987 | AC649: 84.903748733535963 | AD649: 12
A650: YARRAVILLE | C650: BUCKLEY 4 | G650: LAWN 2 | W650: CAMBERWELL | X650: 2 | Y650: 10 | Z650: 0 | AA650: 747 | AB650: 1088 | AC650: 68.658088235294116 | AD650: 8
A651: PRESTON | C651: SUMMERS 2 | G651: COLLINS 2 | K651: CAMERON | W651: BRIGHTON | X651: 1 | Y651: 11 | Z651: 0 | AA651: 855 | AB651: 1104 | AC651: 77.445652173913047 | AD651: 4
A653: PRAHRAN | C653: 4 | D653: 3 | E653: =C653*6+D653 -> 27 | G653: 7 | H653: 5 | I653: =G653*6+H653 -> 47 | K653: 13 | L653: 6 | M653: =K653*6+L653 -> 84 | O653: 15 | P653: 12 | Q653: =O653*6+P653 -> 102 | S653: TOORAK PARK
A654: SANDRINGHAM | C654: 3 | D654: 4 | E654: =C654*6+D654 -> 22 | G654: 6 | H654: 12 | I654: =G654*6+H654 -> 48 | K654: 7 | L654: 13 | M654: =K654*6+L654 -> 55 | O654: 12 | P654: 16 | Q654: =O654*6+P654 -> 88 | S654: STUART
A655: BEST PLAYERS
A656: PRAHRAN | C656: HARVEY | F656: RENNIE | I656: LORD | L656: GREENWOOD | P656: HAWKINS | S656: KOOP
A657: SANDRINGHAM | C657: BECKTON | F657: STAFF | I657: RATMENT | L657: R KENNA | P657: YOUNG | S657: BAILES
A658: GOALKICKERS
A659: PRAHRAN | C659: HAWKINS 5 | F659: GREENWOOD 3 | I659: SALTER 2 | K659: HARVEY 2 | N659: LORD | P659: RENNIE | S659: SMITH
A660: SANDRINGHAM | C660: RAYMENT 4 | F660: BAILES 4 | I660: FORBES | K660: R KENNA | N660: A ANDERSON | Q660: O'DONNELL
A662: BRUNSWICK | C662: 2 | D662: 4 | E662: =C662*6+D662 -> 16 | G662: 5 | H662: 7 | I662: =G662*6+H662 -> 37 | K662: 10 | L662: 11 | M662: =K662*6+L662 -> 71 | O662: 10 | P662: 12 | Q662: =O662*6+P662 -> 72 | S662: CAMBERWELL
A663: CAMBERWELL | C663: 3 | D663: 2 | E663: =C663*6+D663 -> 20 | G663: 4 | H663: 6 | I663: =G663*6+H663 -> 30 | K663: 4 | L663: 7 | M663: =K663*6+L663 -> 31 | O663: 7 | P663: 9 | Q663: =O663*6+P663 -> 51 | S663: MOWLAN
A664: BEST PLAYERS
A665: BRUNSWICK | C665: PANNAM | F665: BRAY | I665: PROUDFOOT | L665: BEARD | O665: THOMPSON | R665: DOWLING
A666: CAMBERWELL | C666: WARD | F666: PETRIE | I666: WALLIS | L666: HENDERSON | O666: CLAMP | R666: JONES
A667: GOALKICKERS
A668: BRUNSWICK | C668: BRAY 3 | E668: FRASER 2 | H668: DOWLING | J668: WARDEN | L668: FITZGERALD | O668: KENNETT | Q668: BEARD
A669: CAMBERWELL | C669: LUFF 4 | E669: WILLIAMS | H669: STRACHAN | J669: HARVEY
A671: COBURG | C671: 1 | D671: 7 | E671: =C671*6+D671 -> 13 | G671: 4 | H671: 12 | I671: =G671*6+H671 -> 36 | K671: 7 | L671: 15 | M671: =K671*6+L671 -> 57 | O671: 13 | P671: 16 | Q671: =O671*6+P671 -> 94 | S671: COBURG
A672: BRIGHTON | C672: 2 | D672: 2 | E672: =C672*6+D672 -> 14 | G672: 4 | H672: 3 | I672: =G672*6+H672 -> 27 | K672: 6 | L672: 5 | M672: =K672*6+L672 -> 41 | O672: 7 | P672: 9 | Q672: =O672*6+P672 -> 51 | S672: SCHAEFER
A673: BEST PLAYERS
A674: COBURG | C674: GREGORY | E674: JENKINS | G674: KIGHT | J674: LEAHY | M674: MEARS | O674: MARTIN
A675: BRIGHTON | C675: BURNES | E675: HUNT | G675: McGURGAN | J675: STEART | M675: LILBURNE | O675: TUCKER
A676: GOALKICKERS
A677: COBURG | C677: McGRATH 3 | F677: MEARS 2 | I677: LEAHY 2 | K677: ROGERS 2 | M677: JENKINS | O677: SELLARS | Q677: DUNCAN | S677: BROOKS
A678: BRIGHTON | C678: HARRISON 3 | F678: BURNES 2 | I678: McGURGIN 2
A680: WILLIAMSTOWN | C680: 2 | D680: 1 | E680: =C680*6+D680 -> 13 | G680: 5 | H680: 3 | I680: =G680*6+H680 -> 33 | K680: 9 | L680: 5 | M680: =K680*6+L680 -> 59 | O680: 10 | P680: 6 | Q680: =O680*6+P680 -> 66 | S680: NORTHCOTE
A681: NORTHCOTE | C681: 3 | D681: 6 | E681: =C681*6+D681 -> 24 | G681: 7 | H681: 10 | I681: =G681*6+H681 -> 52 | K681: 8 | L681: 14 | M681: =K681*6+L681 -> 62 | O681: 8 | P681: 15 | Q681: =O681*6+P681 -> 63 | S681: MORCAM
A682: BEST PLAYERS
A683: WILLIAMSTOWN | C683: HELLWIG | F683: BLAKE | I683: W O'BRIEN | L683: SYKES | O683: SHADE | Q683: SHEEHAN
A684: NORTHCOTE | C684: McSWAIN | F684: COCKRAM | I684: BRIGGS | L684: WILLIAMS | O684: ROSS | Q684: GARRETT
A685: GOALKICKERS
A686: WILLIAMSTOWN | C686: SINCLAIR 4 | F686: HELWIG 3 | I686: CAHILL | L686: BLAKE | O686: SHADE
A687: NORTHCOTE | C687: BRIGGS 3 | F687: PRUSER 2 | I687: COLE | L687: SIMMONDS | O687: WILLIAMS
A689: ROUND 13 | E689: 18TH JULY | J689: WEATHER | M689: DULL CLOUDY GROUNDS WET | S689: PLAYED AT
D690: 1ST QTR | H690: 2ND QTR | L690: 3RD QTR | P690: FINAL | S690: OAKLEIGH
A691: COBURG | C691: 3 | D691: 5 | E691: =C691*6+D691 -> 23 | G691: 7 | H691: 8 | I691: =G691*6+H691 -> 50 | K691: 9 | L691: 12 | M691: =K691*6+L691 -> 66 | O691: 10 | P691: 15 | Q691: =O691*6+P691 -> 75 | S691: UMPIRE | X691: LADDER | AB691: ROUND | AD691: 13
A692: OAKLEIGH | C692: 3 | D692: 2 | E692: =C692*6+D692 -> 20 | G692: 5 | H692: 7 | I692: =G692*6+H692 -> 37 | K692: 8 | L692: 9 | M692: =K692*6+L692 -> 57 | O692: 9 | P692: 11 | Q692: =O692*6+P692 -> 65 | S692: SCHAEFER
A693: BEST PLAYERS | W693: TEAM | X693: W | Y693: L | Z693: D | AA693: FOR | AB693: AGST | AC693: % | AD693: PTS
A694: COBURG | C694: MARTIN | E694: LOWE | H694: DUNCAN | K694: BERTRAM | N694: SHORT | Q694: MEARS
A695: OAKLEIGH | C695: RUDOLPH | E695: CAMPBELL | H695: CHAPMAN | K695: CRAMERI | N695: DRIVER | Q695: OPREY | W695: OAKLEIGH | X695: 10 | Y695: 3 | Z695: 0 | AA695: 1102 | AB695: 718 | AC695: 153.48189415041782 | AD695: 40
A696: GOALKICKERS | W696: YARRAVILLE | X696: 9 | Y696: 3 | Z696: 1 | AA696: 1035 | AB696: 934 | AC696: 110.81370449678801 | AD696: 38
A697: COBURG | C697: MEARS 3 | E697: MILLEN 2 | H697: LEAHY | J697: ELLIOTT | L697: SELLERS | N697: DUNCAN | P697: JENKINS | W697: NORTHCOTE | X697: 9 | Y697: 4 | Z697: 0 | AA697: 1141 | AB697: 827 | AC697: 137.96856106408706 | AD697: 36
A698: OAKLEIGH | C698: FRASER 2 | E698: CHAPMAN 2 | H698: YEMM 2 | J698: RODWELL | M698: CRAMERI | O698: WILTSHIRE | W698: PORT MELBOURNE | X698: 9 | Y698: 4 | Z698: 0 | AA698: 1038 | AB698: 796 | AC698: 130.4 | AD698: 36
A700: SANDRINGHAM | C700: 5 | D700: 6 | E700: =C700*6+D700 -> 36 | G700: 9 | H700: 11 | I700: =G700*6+H700 -> 65 | K700: 14 | L700: 14 | M700: =K700*6+L700 -> 98 | O700: 17 | P700: 15 | Q700: =O700*6+P700 -> 117 | S700: BEACH ROAD | W700: COBURG | X700: 8 | Y700: 5 | Z700: 0 | AA700: 1002 | AB700: 1031 | AC700: 97.19 | AD700: 32
A701: PORT MELBOURNE | C701: 6 | D701: 3 | E701: =C701*6+D701 -> 39 | G701: 8 | H701: 9 | I701: =G701*6+H701 -> 57 | K701: 12 | L701: 12 | M701: =K701*6+L701 -> 84 | O701: 13 | P701: 20 | Q701: =O701*6+P701 -> 98 | S701: MURRAY | W701: PRESTON | X701: 7 | Y701: 5 | Z701: 1 | AA701: 960 | AB701: 965 | AC701: 99.481865284974091 | AD701: 30
A702: BEST PLAYERS | W702: BRUNSWICK | X702: 7 | Y702: 6 | Z702: 0 | AA702: 972 | AB702: 849 | AC702: 114.48763250883393 | AD702: 28
A703: SANDRINGHAM | C703: BECKTON | E703: RAYMENT | H703: E BOURKE | K703: CHALLIS | N703: BOYD | Q703: BAILES | W703: SANDRINGHAM | X703: 7 | Y703: 6 | Z703: 0 | AA703: 1214 | AB703: 1185 | AC703: 102.44725738396625 | AD703: 28
A704: PORT MELBOURNE | C704: LAHIFF | E704: BROOKER | H704: LOVETT | K704: BARNES | N704: TUITE | Q704: SMITH | W704: WILLIAMSTOWN | X704: 4 | Y704: 9 | Z704: 0 | AA704: 908 | AB704: 1047 | AC704: 86.723973256924552 | AD704: 16
A705: GOALKICKERS | W705: PRAHRAN | X705: 4 | Y705: 9 | Z705: 0 | AA705: 854 | AB705: 1132 | AC705: 75.441696113074201 | AD705: 16
A706: SANDRINGHAM | C706: BAILES 5 | E706: DE LUCA 3 | H706: BOYD 3 | J706: FORBES 2 | M706: BECKTON 2 | P706: R KENNA | R706: RAYMENT | W706: CAMBERWELL | X706: 2 | Y706: 11 | Z706: 0 | AA706: 787 | AB706: 1155 | AC706: 68.138528138528144 | AD706: 8
A707: PORT MELBOURNE | C707: BARNES 3 | E707: LAHIFF 3 | H707: BEDFORD 2 | K707: LEGGO 2 | M707: LINDSAY 2 | P707: BOLMAN | W707: BRIGHTON | X707: 1 | Y707: 12 | Z707: 0 | AA707: 891 | AB707: 1265 | AC707: 70.434782608695656 | AD707: 4
A709: PRESTON | C709: 3 | D709: 1 | E709: =C709*6+D709 -> 19 | G709: 6 | H709: 7 | I709: =G709*6+H709 -> 43 | K709: 6 | L709: 9 | M709: =K709*6+L709 -> 45 | O709: 7 | P709: 12 | Q709: =O709*6+P709 -> 54 | S709: PRESTON
A710: PRAHRAN | C710: 2 | D710: 5 | E710: =C710*6+D710 -> 17 | G710: 2 | H710: 7 | I710: =G710*6+H710 -> 19 | K710: 3 | L710: 7 | M710: =K710*6+L710 -> 25 | O710: 5 | P710: 9 | Q710: =O710*6+P710 -> 39 | S710: MOWLAN
A711: BEST PLAYERS
A712: PRESTON | C712: DAVIE | F712: REICHMAN | I712: SUMMERS | L712: DOWLING | O712: WARR | Q712: F SPARGO
A713: PRAHRAN | C713: HAWKINS | F713: FOSTER | I713: TRIM | L713: KOOP | O713: HARVEY | Q713: LORD
A714: GOALKICKERS
A715: PRESTON | C715: WARR 2 | F715: DAVIE 2 | I715: CAMPBELL | L715: CAZALY | O715: PIPER
A716: PRAHRAN | C716: HAWKINS 3) | F716: LORD | I716: SALTER
A718: WILLIAMSTOWN | C718: 3 | D718: 1 | E718: =C718*6+D718 -> 19 | G718: 7 | H718: 7 | I718: =G718*6+H718 -> 49 | K718: 7 | L718: 10 | M718: =K718*6+L718 -> 52 | O718: 10 | P718: 10 | Q718: =O718*6+P718 -> 70 | S718: WILLIAMSTOWN
A719: BRUNSWICK | C719: 3 | D719: 5 | E719: =C719*6+D719 -> 23 | G719: 5 | H719: 6 | I719: =G719*6+H719 -> 36 | K719: 7 | L719: 8 | M719: =K719*6+L719 -> 50 | O719: 8 | P719: 12 | Q719: =O719*6+P719 -> 60 | S719: MORCAM
A720: BEST PLAYERS
A721: WILLIAMSTOWN | C721: CAHILL | F721: HELLWIG | I721: SYKES | L721: SINCLAIR | O721: BLAKE | R721: SHEEHAN
A722: BRUNSWICK | C722: CARTON | F722: PANNAM | I722: WHITELEY | L722: DOWLING | O722: FITZGERALD | R722: BRAY
A723: GOALKICKERS
A724: WILLIAMSTOWN | C724: HELLWIG 4 | F724: SINCLAIR 2 | I724: CAHILL | L724: J O'BRIEN | O724: WALSH | Q724: SHADE
A725: BRUNSWICK | C725: DOWLING 3 | F725: FRASER 2 | I725: WARDEN | L725: EUDY | O725: CARTON
A727: YARRAVILLE | C727: 2 | D727: 2 | E727: =C727*6+D727 -> 14 | G727: 5 | H727: 3 | I727: =G727*6+H727 -> 33 | K727: 5 | L727: 6 | M727: =K727*6+L727 -> 36 | O727: 9 | P727: 13 | Q727: =O727*6+P727 -> 67 | S727: CAMBERWELL
A728: CAMBERWELL | C728: 1 | D728: 7 | E728: =C728*6+D728 -> 13 | G728: 2 | H728: 13 | I728: =G728*6+H728 -> 25 | K728: 3 | L728: 15 | M728: =K728*6+L728 -> 33 | O728: 4 | P728: 16 | Q728: =O728*6+P728 -> 40 | S728: STUART
A729: BEST PLAYERS
A730: YARRAVILLE | C730: HUNTER | F730: CAMERON | I730: KENNEDY | L730: DWYER | O730: TYSON | R730: FITZMAURICE
A731: CAMBERWELL | C731: HENDERSON | F731: JONES | I731: STRACHAN | L731: CLAMP | O731: DYBALL | R731: JACKSON
A732: GOALKICKERS
A733: YARRAVILLE | C733: BUCKLEY 2 | F733: KENNEDY 2 | I733: WUNHYM 2 | L733: LAWN | N733: BRUMBY | Q733: FOOTE
A734: CAMBERWELL | C734: McGRATH | F734: TROTTER | I734: JONES | K734: WILSON
A736: NORTHCOTE | C736: 9 | D736: 4 | E736: =C736*6+D736 -> 58 | G736: 12 | H736: 5 | I736: =G736*6+H736 -> 77 | K736: 21 | L736: 7 | M736: =K736*6+L736 -> 133 | O736: 25 | P736: 11 | Q736: =O736*6+P736 -> 161 | S736: NORTHCOTE
A737: BRIGHTON | C737: 1 | D737: 1 | E737: =C737*6+D737 -> 7 | G737: 3 | H737: 2 | I737: =G737*6+H737 -> 20 | K737: 4 | L737: 5 | M737: =K737*6+L737 -> 29 | O737: 5 | P737: 6 | Q737: =O737*6+P737 -> 36 | S737: GREGORY
A738: BEST PLAYERS
A739: NORTHCOTE | C739: SEYMOUR | F739: WOODS | I739: GARRETT | L739: COLE | O739: ROWE | R739: BYRNE
A740: BRIGHTON | C740: HUNT | F740: DORE | I740: LILBURNE | L740: CAMPBELL | O740: BARNES | R740: TUCKER
A741: GOALKICKERS
A742: NORTHCOTE | C742: SEYMOUR 12 | F742: COLE 5 | I742: BYRNE 2 | L742: PRUSER 2 | N742: GRAY | P742: GOULLET | R742: R ROSS
A743: BRIGHTON | C743: LILBURNE 2 | F743: MCGURGIN | I743: MCNIFF | L743: O'CONNOR
A745: ROUND 14 | E745: 25TH JULY | G745: WEATHER | I745: DULL CLOUDY STRONG NORTH WIND LATE SOUTH CHANGE | S745: PLAYED AT
D746: 1ST QTR | H746: 2ND QTR | L746: 3RD QTR | P746: FINAL | S746: OAKLEIGH
A747: NORTHCOTE | C747: 5 | D747: 6 | E747: =C747*6+D747 -> 36 | G747: 7 | H747: 8 | I747: =G747*6+H747 -> 50 | K747: 10 | L747: 10 | M747: =K747*6+L747 -> 70 | O747: 11 | P747: 10 | Q747: =O747*6+P747 -> 76 | S747: UMPIRE | X747: LADDER | AB747: ROUND | AD747: 14
A748: OAKLEIGH | C748: 1 | D748: 1 | E748: =C748*6+D748 -> 7 | G748: 5 | H748: 3 | I748: =G748*6+H748 -> 33 | K748: 6 | L748: 4 | M748: =K748*6+L748 -> 40 | O748: 8 | P748: 5 | Q748: =O748*6+P748 -> 53 | S748: MOWLAN
A749: BEST PLAYERS | W749: TEAM | X749: W | Y749: L | Z749: D | AA749: FOR | AB749: AGST | AC749: % | AD749: PTS
A750: NORTHCOTE | C750: BRIGGS | E750: COLE | H750: ROSS | K750: PRUSER | N750: NICHOLLS | Q750: COCKRAM
A751: OAKLEIGH | C751: THOMAS | E751: DRIVER | H751: CHAPMAN | K751: FLEMING | N751: YEMM | Q751: WITHERS | W751: YARRAVILLE | X751: 10 | Y751: 3 | Z751: 1 | AA751: 1116 | AB751: 981 | AC751: 113.76146788990826 | AD751: 42
A752: GOALKICKERS | W752: OAKLEIGH | X752: 10 | Y752: 4 | Z752: 0 | AA752: 1155 | AB752: 794 | AC752: 145.46599496221663 | AD752: 40
A753: NORTHCOTE | C753: COLE 4 | E753: SEYMOUR 2 | H753: PRUSER 2 | J753: HUMPHRIES | M753: BYRNE | O753: GOULLET | W753: NORTHCOTE | X753: 10 | Y753: 4 | Z753: 0 | AA753: 1217 | AB753: 880 | AC753: 138.29545454545453 | AD753: 40
A754: OAKLEIGH | C754: FRASER 2 | F754: FLEMING 2 | I754: YEMM | K754: WILTSHIRE | N754: CAMPBELL | Q754: THOMAS | W754: PORT MELBOURNE | X754: 10 | Y754: 4 | Z754: 0 | AA754: 1112 | AB754: 844 | AC754: 131.75 | AD754: 40
A756: BRUNSWICK | C756: 4 | D756: 5 | E756: =C756*6+D756 -> 29 | G756: 6 | H756: 10 | I756: =G756*6+H756 -> 46 | K756: 8 | L756: 14 | M756: =K756*6+L756 -> 62 | O756: 9 | P756: 14 | Q756: =O756*6+P756 -> 68 | S756: BRUNSWICK | W756: PRESTON | X756: 8 | Y756: 5 | Z756: 1 | AA756: 1072 | AB756: 1005 | AC756: 106.66666666666667 | AD756: 34
A757: COBURG | C757: 0 | D757: 1 | E757: =C757*6+D757 -> 1 | G757: 3 | H757: 5 | I757: =G757*6+H757 -> 23 | K757: 4 | L757: 6 | M757: =K757*6+L757 -> 30 | O757: 5 | P757: 6 | Q757: =O757*6+P757 -> 36 | S757: MORCAM | W757: BRUNSWICK | X757: 8 | Y757: 6 | Z757: 0 | AA757: 1040 | AB757: 885 | AC757: 117.51412429378531 | AD757: 32
A758: BEST PLAYERS | W758: COBURG | X758: 8 | Y758: 6 | Z758: 0 | AA758: 1038 | AB758: 1099 | AC758: 94.45 | AD758: 32
A759: BRUNSWICK | C759: FITZGERALD | F759: FRASER | I759: THOMPSON | L759: BRAY | O759: KINNEAR | Q759: PANNAM | W759: SANDRINGHAM | X759: 7 | Y759: 7 | Z759: 0 | AA759: 1254 | AB759: 1297 | AC759: 96.684656900539707 | AD759: 28
A760: COBURG | C760: JENKINS | F760: GREGORY | I760: SELLERS | L760: BERTRAM | O760: WILLOX | Q760: SHORT | W760: PRAHRAN | X760: 5 | Y760: 9 | Z760: 0 | AA760: 930 | AB760: 1176 | AC760: 79.08163265306122 | AD760: 20
A761: GOALKICKERS | W761: WILLIAMSTOWN | X761: 4 | Y761: 10 | Z761: 0 | AA761: 956 | AB761: 1121 | AC761: 85.280999107939337 | AD761: 16
A762: BRUNSWICK | C762: FRASER 2 | F762: DOWLING 2 | I762: FITZGERALD 2 | L762: ANDERSON | O762: KENNETT | Q762: WHITELEY | W762: CAMBERWELL | X762: 2 | Y762: 12 | Z762: 0 | AA762: 831 | AB762: 1231 | AC762: 67.506092607636063 | AD762: 8
A763: COBURG | C763: SELLERS 2 | F763: WILLOX 2 | I763: MILLEN | W763: BRIGHTON | X763: 1 | Y763: 13 | Z763: 0 | AA763: 938 | AB763: 1346 | AC763: 69.687964338781569 | AD763: 4
A765: PRESTON | C765: 5 | D765: 5 | E765: =C765*6+D765 -> 35 | G765: 6 | H765: 6 | I765: =G765*6+H765 -> 42 | K765: 11 | L765: 9 | M765: =K765*6+L765 -> 75 | O765: 17 | P765: 10 | Q765: =O765*6+P765 -> 112 | S765: BEACH ROAD
A766: SANDRINGHAM | C766: 0 | D766: 2 | E766: =C766*6+D766 -> 2 | G766: 5 | H766: 6 | I766: =G766*6+H766 -> 36 | K766: 5 | L766: 9 | M766: =K766*6+L766 -> 39 | O766: 5 | P766: 10 | Q766: =O766*6+P766 -> 40 | S766: LESTER
A767: BEST PLAYERS
A768: PRESTON | C768: WARR | F768: CAZALY | I768: SMITH | L768: MONOHAN | O768: TAYLOR | R768: MARSHALL
A769: SANDRINGHAM | C769: CHALLIS | F769: E BOURKE | I769: HUDD | L769: RAYMENT | O769: BOYD | R769: O'DONNELL
A770: GOALKICKERS
A771: PRESTON | C771: DAVIE 6 | E771: CAZALY 3 | H771: WARR 2 | J771: SUMMERS 2 | M771: HUGHSON 2 | P771: PIPER 2
A772: SANDRINGHAM | C772: FORBES 2 | E772: RAYMENT | H772: BAILES | J772: JAMIESON
A774: PRAHRAN | C774: 3 | D774: 1 | E774: =C774*6+D774 -> 19 | G774: 5 | H774: 4 | I774: =G774*6+H774 -> 34 | K774: 7 | L774: 7 | M774: =K774*6+L774 -> 49 | O774: 11 | P774: 10 | Q774: =O774*6+P774 -> 76 | S774: TOORAK PARK
A775: CAMBERWELL | C775: 4 | D775: 6 | E775: =C775*6+D775 -> 30 | G775: 4 | H775: 6 | I775: =G775*6+H775 -> 30 | K775: 4 | L775: 7 | M775: =K775*6+L775 -> 31 | O775: 6 | P775: 8 | Q775: =O775*6+P775 -> 44 | S775: STUART
A776: BEST PLAYERS
A777: PRAHRAN | C777: KOOP | F777: DARVALL | I777: ROSS | L777: V SMITH | O777: SALTER | R777: HAWKINS
A778: CAMBERWELL | C778: JONES | F778: DYBALL | I778: PETRIE | L778: CLAMP | O778: HARVEY | R778: LATH;AIN
A779: GOALKICKERS
A780: PRAHRAN | C780: RENNIE 5 | F780: SMEDLEY 2 | I780: ROSS | L780: SMITH | O780: HAWKINS | R780: SALTER
A781: CAMBERWELL | C781: LUFF 2 | F781: PETRIE 2 | I781: COLLINS | L781: PONCHARD
A783: PORT MELBOURNE | C783: 4 | D783: 5 | E783: =C783*6+D783 -> 29 | G783: 5 | H783: 5 | I783: =G783*6+H783 -> 35 | K783: 9 | L783: 12 | M783: =K783*6+L783 -> 66 | O783: 10 | P783: 14 | Q783: =O783*6+P783 -> 74 | S783: PORT MELBOURNE
A784: WILLIAMSTOWN | C784: 0 | D784: 0 | E784: =C784*6+D784 -> 0 | G784: 5 | H784: 8 | I784: =G784*6+H784 -> 38 | K784: 5 | L784: 9 | M784: =K784*6+L784 -> 39 | O784: 6 | P784: 12 | Q784: =O784*6+P784 -> 48 | S784: GREGORY
A785: BEST PLAYERS
A786: PORT MELBOURNE | C786: STANBRIDGE | F786: GARBUTT | I786: WILKIN | L786: LAHIFF | O786: ERRIDGE | R786: TUITE
A787: WILLIAMSTOWN | C787: CAHILL | F787: SYKES | I787: BARNES | L787: SINCLAIR | O787: HELLWIG | R787: J O'BRIEN
A788: GOALKICKERS
A789: PORT MELBOURNE | C789: WILKIN 3 | F789: LAHIFF 2 | I789: SMITH | K789: STANBRIDGE | N789: BARNES | P789: GARBUTT | R789: HARRY
A790: WILLIAMSTOWN | C790: SINCLAIR 2 | F790: CAHILL 2 | I790: BARNES | K790: HELWIG
A792: YARRAVILLE | C792: 3 | D792: 7 | E792: =C792*6+D792 -> 25 | G792: 5 | H792: 7 | I792: =G792*6+H792 -> 37 | K792: 8 | L792: 11 | M792: =K792*6+L792 -> 59 | O792: 11 | P792: 15 | Q792: =O792*6+P792 -> 81 | S792: ELSTERNWICK PARK
A793: BRIGHTON | C793: 0 | D793: 1 | E793: =C793*6+D793 -> 1 | G793: 2 | H793: 8 | I793: =G793*6+H793 -> 20 | K793: 3 | L793: 9 | M793: =K793*6+L793 -> 27 | O793: 6 | P793: 11 | Q793: =O793*6+P793 -> 47 | S793: MURRAY
A794: BEST PLAYERS
A795: YARRAVILLE | C795: PENNY | F795: CAMERON | I795: FITZMAURICE | M795: TYSON | P795: DWYER | S795: BUCKLEY
A796: BRIGHTON | C796: HILL | F796: LILBURNE | I796: DORE | M796: ALLEN | P796: McNIFF | S796: HUNT
A797: GOALKICKERS
A798: YARRAVILLE | C798: BUCKLEY 3 | F798: TYSON 3 | I798: KENNEDY 2 | L798: LAWN | N798: BRUMBY | P798: FOOTE
A799: BRIGHTON | C799: MCNIFF 3 | F799: LILBURNE 2 | I799: McGURGIN
A801: ROUND 15 | E801: 1ST AUGUST | J801: WEATHER | M801: FINE S.E. BREEZE | S801: PLAYED AT
D802: 1ST QTR | H802: 2ND QTR | L802: 3RD QTR | P802: FINAL | S802: PRESTON
A803: PRESTON | C803: 4 | D803: 2 | E803: =C803*6+D803 -> 26 | G803: 7 | H803: 6 | I803: =G803*6+H803 -> 48 | K803: 7 | L803: 8 | M803: =K803*6+L803 -> 50 | O803: 10 | P803: 10 | Q803: =O803*6+P803 -> 70 | S803: UMPIRE | X803: LADDER | AB803: ROUND | AD803: 15
A804: NORTHCOTE | C804: 2 | D804: 4 | E804: =C804*6+D804 -> 16 | G804: 3 | H804: 5 | I804: =G804*6+H804 -> 23 | K804: 8 | L804: 9 | M804: =K804*6+L804 -> 57 | O804: 9 | P804: 10 | Q804: =O804*6+P804 -> 64 | S804: STUART
A805: BEST PLAYERS | W805: TEAM | X805: W | Y805: L | Z805: D | AA805: FOR | AB805: AGST | AC805: % | AD805: PTS
A806: PRESTON | C806: HUGHSON | F806: McEACHARN | I806: SUMMERS | L806: CAZALY | N806: MONOHAN | Q806: PIPER
A807: NORTHCOTE | C807: BRIGGS | F807: PRUSER | I807: GARRETT | L807: COLE | N807: COCKRAM | Q807: GOULLET | W807: YARRAVILLE | X807: 11 | Y807: 3 | Z807: 1 | AA807: 1185 | AB807: 1042 | AC807: 113.7236084452975 | AD807: 46
A808: GOALKICKERS | W808: OAKLEIGH | X808: 11 | Y808: 4 | Z808: 0 | AA808: 1242 | AB808: 849 | AC808: 146.28975265017667 | AD808: 44
A809: PRESTON | C809: DAVIE 3 | F809: WARR 2 | I809: CAZALY 2 | L809: PIPER 2 | N809: CAMERON | W809: PORT MELBOURNE | X809: 11 | Y809: 4 | Z809: 0 | AA809: 1190 | AB809: 911 | AC809: 130.63 | AD809: 44
A810: NORTHCOTE | C810: SIMMONDS 3 | F810: GRAY 2 | I810: COLE | K810: SEYMOUR | N810: POULTER | Q810: PRUSER | W810: NORTHCOTE | X810: 10 | Y810: 5 | Z810: 0 | AA810: 1281 | AB810: 950 | AC810: 134.84210526315789 | AD810: 40
A812: PORT MELBOURNE | C812: 2 | D812: 0 | E812: =C812*6+D812 -> 12 | G812: 7 | H812: 2 | I812: =G812*6+H812 -> 44 | K812: 8 | L812: 10 | M812: =K812*6+L812 -> 58 | O812: 11 | P812: 12 | Q812: =O812*6+P812 -> 78 | S812: PORT MELBOURNE | W812: PRESTON | X812: 9 | Y812: 5 | Z812: 1 | AA812: 1142 | AB812: 1069 | AC812: 106.82881197380729 | AD812: 38
A813: BRUNSWICK | C813: 2 | D813: 2 | E813: =C813*6+D813 -> 14 | G813: 2 | H813: 4 | I813: =G813*6+H813 -> 16 | K813: 8 | L813: 5 | M813: =K813*6+L813 -> 53 | O813: 10 | P813: 7 | Q813: =O813*6+P813 -> 67 | S813: LESTER | W813: COBURG | X813: 9 | Y813: 6 | Z813: 0 | AA813: 1155 | AB813: 1165 | AC813: 99.14 | AD813: 36
A814: BEST PLAYERS | W814: BRUNSWICK | X814: 8 | Y814: 7 | Z814: 0 | AA814: 1107 | AB814: 963 | AC814: 114.95327102803738 | AD814: 32
A815: PORT MELBOURNE | C815: HYDE | E815: STANBRIDGE | H815: GARBUTT | K815: BAKER | N815: BROOKER | Q815: WILKIN | W815: SANDRINGHAM | X815: 7 | Y815: 8 | Z815: 0 | AA815: 1320 | AB815: 1414 | AC815: 93.352192362093348 | AD815: 28
A816: BRUNSWICK | C816: MAYNES | E816: WARDEN | H816: FITZGERALD | K816: CARTON | N816: JOHNSTONE | Q816: KINNEAR | W816: PRAHRAN | X816: 6 | Y816: 9 | Z816: 0 | AA816: 1062 | AB816: 1236 | AC816: 85.922330097087382 | AD816: 24
A817: GOALKICKERS | W817: WILLIAMSTOWN | X817: 4 | Y817: 11 | Z817: 0 | AA817: 1017 | AB817: 1190 | AC817: 85.462184873949582 | AD817: 16
A818: PORT MELBOURNE | C818: McINNES 3 | F818: PLUMRIDGE 2 | I818: TUITE 2 | K818: McKENZIE 2 | N818: LAHIFF | P818: BROOKER | W818: CAMBERWELL | X818: 2 | Y818: 13 | Z818: 0 | AA818: 886 | AB818: 1318 | AC818: 67.223065250379364 | AD818: 8
A819: BRUNSWICK | C819: FRASER 4 | F819: ANDERSON 2 | I819: PANNAM | K819: BRAY | M819: FITZGERALD | P819: KENNETT | W819: BRIGHTON | X819: 1 | Y819: 14 | Z819: 0 | AA819: 998 | AB819: 1478 | AC819: 67.523680649526383 | AD819: 4
A821: COBURG | C821: 1 | D821: 2 | E821: =C821*6+D821 -> 8 | G821: 8 | H821: 6 | I821: =G821*6+H821 -> 54 | K821: 13 | L821: 10 | M821: =K821*6+L821 -> 88 | O821: 17 | P821: 15 | Q821: =O821*6+P821 -> 117 | S821: COBURG
A822: SANDRINGHAM | C822: 4 | D822: 2 | E822: =C822*6+D822 -> 26 | G822: 5 | H822: 5 | I822: =G822*6+H822 -> 35 | K822: 7 | L822: 5 | M822: =K822*6+L822 -> 47 | O822: 10 | P822: 6 | Q822: =O822*6+P822 -> 66 | S822: MOWLAN
A823: BEST PLAYERS
A824: COBURG | C824: LEAHY | E824: MEARS | H824: JENKINS | K824: LOWE | N824: BERTRAM | Q824: McGRATH
A825: SANDRINGHAM | C825: BUSH | E825: BECKTON | H825: PARRIS | K825: RAYMENT | N825: T ANDERSON | Q825: DOCKENDORFF
A826: GOALKICKERS
A827: COBURG | C827: LEAHY 5 | F827: MEARS 3 | I827: LANGWELL 3 | L827: DUNCAN 3 | N827: MILLEN 2 | Q827: WILLOX
A828: SANDRINGHAM | C828: FORBES 4 | F828: BAILES 3 | I828: RAYMENT 2 | L828: DOCKENDORFF
A830: PRAHRAN | C830: 4 | D830: 4 | E830: =C830*6+D830 -> 28 | G830: 8 | H830: 10 | I830: =G830*6+H830 -> 58 | K830: 12 | L830: 13 | M830: =K830*6+L830 -> 85 | O830: 19 | P830: 18 | Q830: =O830*6+P830 -> 132 | S830: TOORAK PARK
A831: BRIGHTON | C831: 2 | D831: 2 | E831: =C831*6+D831 -> 14 | G831: 4 | H831: 3 | I831: =G831*6+H831 -> 27 | K831: 6 | L831: 5 | M831: =K831*6+L831 -> 41 | O831: 9 | P831: 6 | Q831: =O831*6+P831 -> 60 | S831: GREGORY
A832: BEST PLAYERS
A833: PRAHRAN | C833: MAHONEY | F833: JORDAN | I833: KOOP | L833: SALTER | O833: RENNIE | R833: TRIM
A834: BRIGHTON | C834: HILL | F834: McGURGAN | I834: STEWART | L834: TUCKER | O834: LILBURNE | R834: HUNT
A835: GOALKICKERS
A836: PRAHRAN | C836: HAWKINS 6 | F836: JORDAN 4 | I836: TRIM 3 | K836: RENNIE | M836: GREENWOOD | P836: ROSS | R836: SMITH | T836: SALTER
A837: BRIGHTON | C837: LILBURNE 3 | F837: BURNES 2 | I837: TUCKER | K837: MCGURGIN | N837: McNIFF | P837: BOLWELL
A839: YARRAVILLE | C839: 3 | D839: 4 | E839: =C839*6+D839 -> 22 | G839: 5 | H839: 4 | I839: =G839*6+H839 -> 34 | K839: 7 | L839: 7 | M839: =K839*6+L839 -> 49 | O839: 10 | P839: 9 | Q839: =O839*6+P839 -> 69 | S839: WILLIAMSTOWN
A840: WILLIAMSTOWN | C840: 0 | D840: 0 | E840: =C840*6+D840 -> 0 | G840: 4 | H840: 4 | I840: =G840*6+H840 -> 28 | K840: 8 | L840: 5 | M840: =K840*6+L840 -> 53 | O840: 9 | P840: 7 | Q840: =O840*6+P840 -> 61 | S840: MURRAY
A841: BEST PLAYERS
A842: YARRAVILLE | C842: DWYER | E842: FOOTE | H842: WUNHYM | K842: FITZMAURICE | O842: BUCKLEY | Q842: LAWN
A843: WILLIAMSTOWN | C843: CAHILL | E843: J O'BRIEN | H843: BLAKE | K843: SINCLAIR | O843: DIXON | Q843: BARNES
A844: GOALKICKERS
A845: YARRAVILLE | C845: FOOTE 5 | F845: BUCKLEY 2 | I845: LAWN | K845: TYSON | M845: BRUMBY
A846: WILLIAMSTOWN | C846: J O'BRIEN 3 | F846: SINCLAIR 2 | I846: CAHILL | K846: DIXON | M846: HELWIG | O846: SHADE
A848: OAKLEIGH | C848: 4 | D848: 6 | E848: =C848*6+D848 -> 30 | G848: 5 | H848: 11 | I848: =G848*6+H848 -> 41 | K848: 7 | L848: 14 | M848: =K848*6+L848 -> 56 | O848: 12 | P848: 15 | Q848: =O848*6+P848 -> 87 | S848: CAMBERWELL
A849: CAMBERWELL | C849: 2 | D849: 1 | E849: =C849*6+D849 -> 13 | G849: 4 | H849: 4 | I849: =G849*6+H849 -> 28 | K849: 6 | L849: 6 | M849: =K849*6+L849 -> 42 | O849: 8 | P849: 7 | Q849: =O849*6+P849 -> 55 | S849: MORCAM
A850: BEST PLAYERS
A851: OAKLEIGH | C851: MORRIS | E851: OPREY | H851: SPAIN | K851: WILTSHIRE | O851: WITHERS | R851: THOMAS
A852: CAMBERWELL | C852: JONES | E852: CLAMP | H852: PETRIE | K852: COLLINS | O852: McGRATH | R852: PONCHARD
A853: GOALKICKERS
A854: OAKLEIGH | C854: FRASER 4 | F854: SPAIN 3 | I854: OPREY 3
A855: CAMBERWELL | C855: PETRIE 2 | F855: MURPHY | I855: STRACHAN | L855: LUFF | N855: COLLINS | Q855: McGRATH
A857: ROUND 16 | E857: 8TH AUGUST | J857: WEATHER | M857: CLOUDY BUT FINE WEST BREEZE | S857: PLAYED AT
D858: 1ST QTR | H858: 2ND QTR | L858: 3RD QTR | P858: FINAL | S858: YARRAVILLE
A859: OAKLEIGH | C859: 4 | D859: 4 | E859: =C859*6+D859 -> 28 | G859: 7 | H859: 11 | I859: =G859*6+H859 -> 53 | K859: 8 | L859: 11 | M859: =K859*6+L859 -> 59 | O859: 11 | P859: 12 | Q859: =O859*6+P859 -> 78 | S859: UMPIRE | X859: LADDER | AB859: ROUND | AD859: 16
A860: YARRAVILLE | C860: 3 | D860: 1 | E860: =C860*6+D860 -> 19 | G860: 4 | H860: 2 | I860: =G860*6+H860 -> 26 | K860: 9 | L860: 10 | M860: =K860*6+L860 -> 64 | O860: 10 | P860: 12 | Q860: =O860*6+P860 -> 72 | S860: STUART
A861: BEST PLAYERS | W861: TEAM | X861: W | Y861: L | Z861: D | AA861: FOR | AB861: AGST | AC861: % | AD861: PTS
A862: OAKLEIGH | C862: HUTCHINSON | F862: MORRIS | I862: FLEMING | L862: DRIVER | O862: RUDOLPH | Q862: DOLAN
A863: YARRAVILLE | C863: WUNHYM | F863: DWYER | I863: FITZMAURICE | L863: HUNTER | O863: PENNY | Q863: HANNA | W863: OAKLEIGH | X863: 12 | Y863: 4 | Z863: 0 | AA863: 1320 | AB863: 921 | AC863: 143.32247557003257 | AD863: 48
A864: GOALKICKERS | W864: PORT MELBOURNE | X864: 12 | Y864: 4 | Z864: 0 | AA864: 1297 | AB864: 998 | AC864: 129.96 | AD864: 48
A865: OAKLEIGH | C865: FRASER 4 | F865: YEMM 3 | I865: OPREY | K865: SPAIN | M865: CHAPMAN | P865: WILTSHIRE | W865: YARRAVILLE | X865: 11 | Y865: 4 | Z865: 1 | AA865: 1257 | AB865: 1120 | AC865: 112.23214285714286 | AD865: 46
A866: YARRAVILLE | C866: FITZMAURICE 3 | F866: BUCKLEY 2 | I866: JOYCE | K866: EVANS | M866: STRATTON | P866: DWYER | R866: CAMERON | W866: NORTHCOTE | X866: 11 | Y866: 5 | Z866: 0 | AA866: 1451 | AB866: 1036 | AC866: 140.05791505791507 | AD866: 44
A868: NORTHCOTE | C868: 4 | D868: 8 | E868: =C868*6+D868 -> 32 | G868: 11 | H868: 10 | I868: =G868*6+H868 -> 76 | K868: 19 | L868: 17 | M868: =K868*6+L868 -> 131 | O868: 25 | P868: 20 | Q868: =O868*6+P868 -> 170 | S868: NORTHCOTE | W868: PRESTON | X868: 10 | Y868: 5 | Z868: 1 | AA868: 1265 | AB868: 1144 | AC868: 110.57692307692308 | AD868: 42
A869: SANDRINGHAM | C869: 4 | D869: 2 | E869: =C869*6+D869 -> 26 | G869: 8 | H869: 5 | I869: =G869*6+H869 -> 53 | K869: 9 | L869: 8 | M869: =K869*6+L869 -> 62 | O869: 12 | P869: 14 | Q869: =O869*6+P869 -> 86 | S869: MURRAY | W869: COBURG | X869: 10 | Y869: 6 | Z869: 0 | AA869: 1248 | AB869: 1219 | AC869: 102.38 | AD869: 40
A870: BEST PLAYERS | W870: BRUNSWICK | X870: 9 | Y870: 7 | Z870: 0 | AA870: 1209 | AB870: 1038 | AC870: 116.47398843930635 | AD870: 36
A871: NORTHCOTE | C871: GARRETT | F871: ROSS | I871: BRIGGS | L871: COLE | N871: SIMMONDS | Q871: STOCKDALE | W871: SANDRINGHAM | X871: 7 | Y871: 9 | Z871: 0 | AA871: 1406 | AB871: 1584 | AC871: 88.762626262626256 | AD871: 28
A872: SANDRINGHAM | C872: BECKTON | F872: DOCKENDORFF | I872: E BOURKE | L872: O'DONNELL | N872: RAYMENT | Q872: BAILES | W872: PRAHRAN | X872: 6 | Y872: 10 | Z872: 0 | AA872: 1137 | AB872: 1338 | AC872: 84.97757847533633 | AD872: 24
A873: GOALKICKERS | W873: WILLIAMSTOWN | X873: 4 | Y873: 12 | Z873: 0 | AA873: 1071 | AB873: 1283 | AC873: 83.47622759158223 | AD873: 16
A874: NORTHCOTE | C874: SEYMOUR 8 | F874: GRAY 5 | H874: SIMMONDS 4 | K874: COLE 4 | M874: HUMPHRIES 2 | P874: PRUSER | R874: ROSS | W874: CAMBERWELL | X874: 2 | Y874: 14 | Z874: 0 | AA874: 973 | AB874: 1425 | AC874: 68.280701754385959 | AD874: 8
A875: SANDRINGHAM | C875: BAILES 3 | E875: BECKTON 3 | H875: FITZGERALD 2 | K875: DE LUCA | M875: R KENNA | O875: RAYMENT | Q875: DOCKENDORFF | W875: BRIGHTON | X875: 1 | Y875: 15 | Z875: 0 | AA875: 1073 | AB875: 1601 | AC875: 67.020612117426609 | AD875: 4
A877: BRUNSWICK | C877: 3 | D877: 9 | E877: =C877*6+D877 -> 27 | G877: 6 | H877: 13 | I877: =G877*6+H877 -> 49 | K877: 11 | L877: 17 | M877: =K877*6+L877 -> 83 | O877: 14 | P877: 18 | Q877: =O877*6+P877 -> 102 | S877: BRUNSWICK
A878: PRAHRAN | C878: 1 | D878: 2 | E878: =C878*6+D878 -> 8 | G878: 6 | H878: 3 | I878: =G878*6+H878 -> 39 | K878: 8 | L878: 7 | M878: =K878*6+L878 -> 55 | O878: 11 | P878: 9 | Q878: =O878*6+P878 -> 75 | S878: PRESTON
A879: BEST PLAYERS
A880: BRUNSWICK | C880: FITZGERALD | F880: McNEILL | I880: PENMAN | L880: FRASER | O880: WARDEN | Q880: BRAY
A881: PRAHRAN | C881: HAWKINS | F881: KOOP | I881: LORD | L881: BANKS | O881: TRIM | Q881: THOMPSON
A882: GOALKICKERS
A883: BRUNSWICK | C883: BRAY 3 | E883: FITZGERALD 2 | H883: FRASER 2 | J883: WARDEN 2 | M883: PENMAN | O883: DOWLING | Q883: BEARD | S883: ANDERSON | W883: McNEILL
A884: PRAHRAN | C884: HAWKINS 9 | G884: SALTER | J884: TRIM
A886: COBURG | C886: 4 | D886: 0 | E886: =C886*6+D886 -> 24 | G886: 6 | H886: 4 | I886: =G886*6+H886 -> 40 | K886: 8 | L886: 4 | M886: =K886*6+L886 -> 52 | O886: 14 | P886: 9 | Q886: =O886*6+P886 -> 93 | S886: WILLIAMSTOWN
A887: WILLIAMSTOWN | C887: 2 | D887: 5 | E887: =C887*6+D887 -> 17 | G887: 3 | H887: 6 | I887: =G887*6+H887 -> 24 | K887: 5 | L887: 10 | M887: =K887*6+L887 -> 40 | O887: 7 | P887: 12 | Q887: =O887*6+P887 -> 54 | S887: LESTER
A888: BEST PLAYERS
A889: COBURG | C889: JENKINS | F889: MARTIN | I889: DONNELLY | L889: GREGORY | N889: ROGERS | Q889: BERTRAM
A890: WILLIAMSTOWN | C890: CAHILL | F890: SHANAHAN | I890: SYKES | L890: BLAKE | N890: HELLWIG | Q890: NEIL
A891: GOALKICKERS
A892: COBURG | C892: DONNELLY 3 | F892: MILLEN 2 | I892: WILLOX 2 | K892: DUNCAN 2 | M892: LEAHY | O892: MEARS | Q892: JENKINS | S892: HARRIS | U892: LANGWELL
A893: WILLIAMSTOWN | C893: HELLWIG 3 | F893: SHADE | H893: CAHILL | J893: SINCLAIR | M893: BLAKE
A895: PRESTON | C895: 3 | D895: 1 | E895: =C895*6+D895 -> 19 | G895: 6 | H895: 7 | I895: =G895*6+H895 -> 43 | K895: 11 | L895: 8 | M895: =K895*6+L895 -> 74 | O895: 18 | P895: 15 | Q895: =O895*6+P895 -> 123 | S895: PRESTON
A896: BRIGHTON | C896: 3 | D896: 3 | E896: =C896*6+D896 -> 21 | G896: 6 | H896: 3 | I896: =G896*6+H896 -> 39 | K896: 10 | L896: 8 | M896: =K896*6+L896 -> 68 | O896: 11 | P896: 9 | Q896: =O896*6+P896 -> 75 | S896: MORCAM
A897: BEST PLAYERS
A898: PRESTON | C898: SMITH | F898: HUGHSON | I898: CAZALY | L898: DAVIE | N898: McEACHARN | Q898: MILLER
A899: BRIGHTON | C899: LILBURNE | F899: BURNES | I899: McNIFF | L899: HUNT | N899: STEWART | Q899: IRWIN
A900: GOALKICKERS
A901: PRESTON | C901: PIPER 5 | F901: DAVIE 4 | I901: WARR 3 | K901: CAZALY 3 | N901: HUGHSON 2 | Q901: CAMERON
A902: BRIGHTON | C902: BURNES 4 | F902: McNIFF 2 | I902: HUNT 2 | K902: McGURGAN | N902: STEWART | Q902: LILBURNE
A904: PORT MELBOURNE | C904: 1 | D904: 5 | E904: =C904*6+D904 -> 11 | G904: 5 | H904: 11 | I904: =G904*6+H904 -> 41 | K904: 7 | L904: 20 | M904: =K904*6+L904 -> 62 | O904: 14 | P904: 23 | Q904: =O904*6+P904 -> 107 | S904: CAMBERWELL
A905: CAMBERWELL | C905: 8 | D905: 4 | E905: =C905*6+D905 -> 52 | G905: 9 | H905: 6 | I905: =G905*6+H905 -> 60 | K905: 11 | L905: 7 | M905: =K905*6+L905 -> 73 | O905: 13 | P905: 9 | Q905: =O905*6+P905 -> 87 | S905: GREGORY
A906: BEST PLAYERS
A907: PORT MELBOURNE | C907: STANBRIDGE | F907: BOLMAN | I907: LAHIFF | L907: PLUMRIDGE | O907: ERIDGE | Q907: TUITE
A908: CAMBERWELL | C908: LATHLAIN | F908: COLLINS | I908: TROTTER | L908: WARD | O908: JACKSON | Q908: JONES
A909: GOALKICKERS
A910: PORT MELBOURNE | C910: McKENZIE 4 | F910: WILKIN 3 | I910: BOLMAN 2 | L910: TUITE 2 | N910: PLUMRIDGE | Q910: VEITCH | S910: LAHIFF
A911: CAMBERWELL | C911: TROTTER 5 | F911: LUFF 2 | I911: MAGRATH | L911: ELLIOTT | N911: CLAMP | P911: STRACHAN | R911: MURPHY | U911: COLLINS
A913: ROUND 17 | E913: 15TH AUGUST | J913: WEATHER | M913: CLOUDY BUT FINE WEST BREEZE | S913: PLAYED AT
D914: 1ST QTR | H914: 2ND QTR | L914: 3RD QTR | P914: FINAL | S914: COBURG
A915: COBURG | C915: 2 | D915: 2 | E915: =C915*6+D915 -> 14 | G915: 4 | H915: 6 | I915: =G915*6+H915 -> 30 | K915: 6 | L915: 11 | M915: =K915*6+L915 -> 47 | O915: 10 | P915: 16 | Q915: =O915*6+P915 -> 76 | S915: UMPIRE | X915: LADDER | AB915: ROUND | AD915: 17
A916: NORTHCOTE | C916: 3 | D916: 4 | E916: =C916*6+D916 -> 22 | G916: 6 | H916: 12 | I916: =G916*6+H916 -> 48 | K916: 7 | L916: 14 | M916: =K916*6+L916 -> 56 | O916: 9 | P916: 16 | Q916: =O916*6+P916 -> 70 | S916: MORCAM
A917: BEST PLAYERS | W917: TEAM | X917: W | Y917: L | Z917: D | AA917: FOR | AB917: AGST | AC917: % | AD917: PTS
A918: COBURG | C918: DUNCAN | F918: HARRIS | I918: KIGHT | L918: ELLIOTT | N918: BERTRAM | Q918: MARTIN
A919: NORTHCOTE | C919: GARRETT | F919: ROSS | I919: SIMMONDS | L919: COCKRAM | N919: McSWAIN | Q919: STOCKDALE | W919: OAKLEIGH | X919: 13 | Y919: 4 | Z919: 0 | AA919: 1450 | AB919: 961 | AC919: 150.88449531737774 | AD919: 52
A920: GOALKICKERS | W920: PORT MELBOURNE | X920: 13 | Y920: 4 | Z920: 0 | AA920: 1417 | AB920: 1049 | AC920: 135.08 | AD920: 52
A921: COBURG | C921: KIGHT 3 | F921: DUNCAN 3 | I921: LANGWELL 2 | L921: WILLOX | N921: SELLERS | W921: PRESTON | X921: 11 | Y921: 5 | Z921: 1 | AA921: 1365 | AB921: 1236 | AC921: 110.4368932038835 | AD921: 46
A922: NORTHCOTE | C922: SEYMOUR 3 | F922: PRUSER 2 | I922: SIMMONDS 2 | L922: POULTER | N922: GRAY | W922: YARRAVILLE | X922: 11 | Y922: 5 | Z922: 1 | AA922: 1327 | AB922: 1229 | AC922: 107.9739625711961 | AD922: 46
A924: PRESTON | C924: 4 | D924: 2 | E924: =C924*6+D924 -> 26 | G924: 7 | H924: 2 | I924: =G924*6+H924 -> 44 | K924: 11 | L924: 8 | M924: =K924*6+L924 -> 74 | O924: 15 | P924: 10 | Q924: =O924*6+P924 -> 100 | S924: BRUNSWICK | W924: NORTHCOTE | X924: 11 | Y924: 6 | Z924: 0 | AA924: 1521 | AB924: 1112 | AC924: 136.78057553956833 | AD924: 44
A925: BRUNSWICK | C925: 2 | D925: 3 | E925: =C925*6+D925 -> 15 | G925: 6 | H925: 11 | I925: =G925*6+H925 -> 47 | K925: 12 | L925: 13 | M925: =K925*6+L925 -> 85 | O925: 13 | P925: 14 | Q925: =O925*6+P925 -> 92 | S925: SCHAEFER | W925: COBURG | X925: 11 | Y925: 6 | Z925: 0 | AA925: 1324 | AB925: 1289 | AC925: 102.72 | AD925: 44
A926: BEST PLAYERS | W926: BRUNSWICK | X926: 9 | Y926: 8 | Z926: 0 | AA926: 1301 | AB926: 1138 | AC926: 114.32337434094903 | AD926: 36
A927: PRESTON | C927: SUMMERS | F927: McEACHARN | I927: CAZALY | K927: DAVIE | N927: F SPARGO | Q927: MONOHAN | W927: SANDRINGHAM | X927: 8 | Y927: 9 | Z927: 0 | AA927: 1602 | AB927: 1698 | AC927: 94.346289752650179 | AD927: 32
A928: BRUNSWICK | C928: JOHNSTONE | F928: BRAY | I928: PENMAN | K928: DOWLING | N928: THOMPSON | Q928: MAYNES | W928: PRAHRAN | X928: 7 | Y928: 10 | Z928: 0 | AA928: 1246 | AB928: 1408 | AC928: 88.494318181818187 | AD928: 28
A929: GOALKICKERS | W929: WILLIAMSTOWN | X929: 4 | Y929: 13 | Z929: 0 | AA929: 1111 | AB929: 1413 | AC929: 78.627034677990096 | AD929: 16
A930: PRESTON | C930: PIPER 4 | E930: HUGHSON 3 | H930: McEACHARN 2 | K930: DAVIE 2 | M930: TAYLOR | O930: CAZALY | Q930: SUMMERS | W930: CAMBERWELL | X930: 2 | Y930: 15 | Z930: 0 | AA930: 1087 | AB930: 1621 | AC930: 67.057371992597169 | AD930: 8
A931: BRUNSWICK | C931: DOWLING 3 | F931: WHITELEY 2 | I931: FRASER 2 | K931: KENNETT 2 | N931: BEARD 2 | P931: PENMAN | R931: BRAY | W931: BRIGHTON | X931: 1 | Y931: 16 | Z931: 0 | AA931: 1124 | AB931: 1721 | AC931: 65.31086577571179 | AD931: 4
A933: PRAHRAN | C933: 3 | D933: 1 | E933: =C933*6+D933 -> 19 | G933: 8 | H933: 7 | I933: =G933*6+H933 -> 55 | K933: 10 | L933: 10 | M933: =K933*6+L933 -> 70 | O933: 16 | P933: 13 | Q933: =O933*6+P933 -> 109 | S933: TOORAK PARK
A934: YARRAVILLE | C934: 0 | D934: 2 | E934: =C934*6+D934 -> 2 | G934: 3 | H934: 3 | I934: =G934*6+H934 -> 21 | K934: 5 | L934: 6 | M934: =K934*6+L934 -> 36 | O934: 10 | P934: 10 | Q934: =O934*6+P934 -> 70 | S934: LESTER
A935: BEST PLAYERS
A936: PRAHRAN | C936: JORDAN | F936: DARVALL | I936: BRUCE | K936: HAMILTON | N936: BANKS | Q936: SMITH
A937: YARRAVILLE | C937: HUNTER | F937: DWYER | I937: JOYCE | K937: FITZMAURICE | N937: HANNAN | Q937: PANNELL
A938: GOALKICKERS
A939: PRAHRAN | C939: JORDAN 4 | F939: SMITH 3 | H939: HAWKINS 3 | K939: WILLIAMS 2 | N939: LUCAS | P939: SALTER | R939: GREENWOOD | V939: HAMILTON
A940: YARRAVILLE | C940: LAWN 3 | F940: JOYCE 3 | I940: WUNHYM | K940: FITZMAURICE | N940: PENNY | P940: MOLONEY
A942: SANDRINGHAM | C942: 6 | D942: 7 | E942: =C942*6+D942 -> 43 | G942: 14 | H942: 12 | I942: =G942*6+H942 -> 96 | K942: 19 | L942: 19 | M942: =K942*6+L942 -> 133 | O942: 28 | P942: 28 | Q942: =O942*6+P942 -> 196 | S942: BEACH ROAD
A943: CAMBERWELL | C943: 3 | D943: 3 | E943: =C943*6+D943 -> 21 | G943: 8 | H943: 7 | I943: =G943*6+H943 -> 55 | K943: 14 | L943: 12 | M943: =K943*6+L943 -> 96 | O943: 17 | P943: 12 | Q943: =O943*6+P943 -> 114 | S943: STUART
A944: BEST PLAYERS
A945: SANDRINGHAM | C945: BECKTON | F945: YEMM | I945: BOYD | L945: DE LUCA | O945: RAYMENT | Q945: BAILES
A946: CAMBERWELL | C946: CLAMP | F946: PETRIE | I946: JACKSON | L946: TROTTER | O946: LUFF | Q946: JONES
A947: GOALKICKERS
A948: SANDRINGHAM | C948: BAILES 7 | E948: FORBES 6 | G948: RAYMENT 4 | J948: DE LUCA 4 | M948: BOYD 3 | O948: R KENNA 2 | R948: ANDERSON | U948: FITZGERALD
A949: CAMBERWELL | C949: LUFF 6 | E949: TROTTER 3 | H949: JONES 2 | J949: STRACHAN 2 | M949: WARD | O949: CURRAN | Q949: MAGRATH | T949: PETRIE
A951: OAKLEIGH | C951: 3 | D951: 6 | E951: =C951*6+D951 -> 24 | G951: 5 | H951: 14 | I951: =G951*6+H951 -> 44 | K951: 10 | L951: 20 | M951: =K951*6+L951 -> 80 | O951: 17 | P951: 28 | Q951: =O951*6+P951 -> 130 | S951: OAKLEIGH
A952: WILLIAMSTOWN | C952: 0 | D952: 2 | E952: =C952*6+D952 -> 2 | G952: 1 | H952: 3 | I952: =G952*6+H952 -> 9 | K952: 4 | L952: 3 | M952: =K952*6+L952 -> 27 | O952: 6 | P952: 4 | Q952: =O952*6+P952 -> 40 | S952: MOWLEN
A953: BEST PLAYERS
A954: OAKLEIGH | C954: RUDOLPH | F954: WITHERS | I954: FRASER | L954: HOLMES | O954: CLARKE | Q954: DOLAN
A955: WILLIAMSTOWN | C955: CAHILL | F955: HELLWIG | I955: SHANAHAN | L955: WHITBURN | O955: NEIL | Q955: BARNES
A956: GOALKICKERS
A957: OAKLEIGH | C957: FRASER 8 | E957: RODWELL 2 | H957: THOMAS 2 | J957: WILTSHIRE | M957: CLARKE | O957: YEMM | Q957: FLEMING | S957: DOLAN
A958: WILLIAMSTOWN | C958: J O'BRIEN 2 | F958: FARRELL 2 | I958: DIXON | K958: SINCLAIR
A960: PORT MELBOURNE | C960: 6 | D960: 6 | E960: =C960*6+D960 -> 42 | G960: 8 | H960: 8 | I960: =G960*6+H960 -> 56 | K960: 13 | L960: 13 | M960: =K960*6+L960 -> 91 | O960: 17 | P960: 18 | Q960: =O960*6+P960 -> 120 | S960: ELSTERNWICK PARK
A961: BRIGHTON | C961: 1 | D961: 2 | E961: =C961*6+D961 -> 8 | G961: 3 | H961: 7 | I961: =G961*6+H961 -> 25 | K961: 4 | L961: 8 | M961: =K961*6+L961 -> 32 | O961: 7 | P961: 9 | Q961: =O961*6+P961 -> 51 | S961: MURRAY
A962: BEST PLAYERS
A963: PORT MELBOURNE | C963: McINNES | F963: CROMPTON | I963: BEDFORD | K963: PLUMRIDGE | N963: SMITH | Q963: McKENZIE
A964: BRIGHTON | C964: BURNES | F964: McNIFF | I964: HILL | K964: TUCKER | N964: STEWART | Q964: BARNES
A965: GOALKICKERS
A966: PORT MELBOURNE | C966: BEDFORD 9 | F966: McKENZIE | H966: SMITH | J966: LEGGO | L966: STANBRIDGE | O966: PLUMRIDGE | R966: TUITE | T966: ERRIDGE
A967: BRIGHTON | C967: BOLWELL 3 | F967: HILL | H967: HARRISON | J967: McNIFF | M967: McGURGAN
A969: ROUND 18 | E969: 29TH AUGUST | H969: WEATHER | J969: RAIN A.M. CLEARING SHOWERS DULL S.W. WIND | S969: PLAYED AT
D970: 1ST QTR | H970: 2ND QTR | L970: 3RD QTR | P970: FINAL | S970: COBURG
A971: PRESTON | C971: 1 | D971: 2 | E971: =C971*6+D971 -> 8 | G971: 6 | H971: 6 | I971: =G971*6+H971 -> 42 | K971: 6 | L971: 7 | M971: =K971*6+L971 -> 43 | O971: 7 | P971: 11 | Q971: =O971*6+P971 -> 53 | S971: UMPIRE | X971: LADDER | AB971: ROUND | AD971: 18
A972: COBURG | C972: 2 | D972: 5 | E972: =C972*6+D972 -> 17 | G972: 3 | H972: 6 | I972: =G972*6+H972 -> 24 | K972: 4 | L972: 10 | M972: =K972*6+L972 -> 34 | O972: 6 | P972: 11 | Q972: =O972*6+P972 -> 47 | S972: STUART
A973: BEST PLAYERS | W973: TEAM | X973: W | Y973: L | Z973: D | AA973: FOR | AB973: AGST | AC973: % | AD973: PTS
A974: PRESTON | C974: DOWLING | F974: CAZALY | I974: WARR | L974: SUMMERS | O974: PIPER | Q974: HUGHSON
A975: COBURG | C975: LOWE | F975: ROGERS | I975: DONNELLY | L975: BERTRAM | O975: McGRATH | Q975: LEAHY | W975: OAKLEIGH | X975: 14 | Y975: 4 | Z975: 0 | AA975: 1547 | AB975: 1046 | AC975: 147.89674952198854 | AD975: 56
A976: GOALKICKERS | W976: PORT MELBOURNE | X976: 14 | Y976: 4 | Z976: 0 | AA976: 1501 | AB976: 1090 | AC976: 137.71 | AD976: 56
A977: PRESTON | C977: KUPSCH 3 | F977: MILLER 2 | I977: WARR | K977: HUGHSON | W977: PRESTON | X977: 12 | Y977: 5 | Z977: 1 | AA977: 1418 | AB977: 1283 | AC977: 110.52221356196415 | AD977: 50
A978: COBURG | C978: DUNCAN 3 | F978: MILLEN | I978: MEARS | K978: KIGHT | W978: NORTHCOTE | X978: 12 | Y978: 6 | Z978: 0 | AA978: 1602 | AB978: 1171 | AC978: 136.80614859094791 | AD978: 48
A980: NORTHCOTE | C980: 3 | D980: 9 | E980: =C980*6+D980 -> 27 | G980: 5 | H980: 12 | I980: =G980*6+H980 -> 42 | K980: 10 | L980: 13 | M980: =K980*6+L980 -> 73 | O980: 11 | P980: 15 | Q980: =O980*6+P980 -> 81 | S980: YARRAVILLE | W980: YARRAVILLE | X980: 11 | Y980: 6 | Z980: 1 | AA980: 1386 | AB980: 1310 | AC980: 105.80152671755725 | AD980: 46
A981: YARRAVILLE | C981: 1 | D981: 2 | E981: =C981*6+D981 -> 8 | G981: 5 | H981: 4 | I981: =G981*6+H981 -> 34 | K981: 6 | L981: 6 | M981: =K981*6+L981 -> 42 | O981: 8 | P981: 11 | Q981: =O981*6+P981 -> 59 | S981: GREGORY | W981: COBURG | X981: 11 | Y981: 7 | Z981: 0 | AA981: 1371 | AB981: 1342 | AC981: 102.16 | AD981: 44
A982: BEST PLAYERS | W982: BRUNSWICK | X982: 9 | Y982: 9 | Z982: 0 | AA982: 1386 | AB982: 1235 | AC982: 112.22672064777328 | AD982: 36
A983: NORTHCOTE | C983: ROSS | F983: STOCKDALE | I983: NICHOLLS | L983: PRUSER | N983: SIMMONDS | Q983: SEYMOUR | W983: SANDRINGHAM | X983: 8 | Y983: 10 | Z983: 0 | AA983: 1665 | AB983: 1775 | AC983: 93.802816901408448 | AD983: 32
A984: YARRAVILLE | C984: HUNTER | F984: DWYER | I984: FOOTE | L984: WUNHYM | N984: PENNY | Q984: BRUMBY | W984: PRAHRAN | X984: 7 | Y984: 11 | Z984: 0 | AA984: 1287 | AB984: 1492 | AC984: 86.260053619302951 | AD984: 28
A985: GOALKICKERS | W985: WILLIAMSTOWN | X985: 5 | Y985: 13 | Z985: 0 | AA985: 1188 | AB985: 1476 | AC985: 80.487804878048777 | AD985: 20
A986: NORTHCOTE | C986: SEYMOUR 6 | F986: SIMMONDS 2 | I986: PRUSER 2 | L986: BRIGGS | N986: ROSS | P986: GRAY | R986: COLE | W986: BRIGHTON | X986: 2 | Y986: 16 | Z986: 0 | AA986: 1237 | AB986: 1798 | AC986: 68.798665183537267 | AD986: 8
A987: YARRAVILLE | C987: LAWN 2 | F987: BRUMBY 2 | I987: JOYCE 2 | L987: EVANS | N987: KENNEDY | W987: CAMBERWELL | X987: 2 | Y987: 16 | Z987: 0 | AA987: 1164 | AB987: 1734 | AC987: 67.128027681660896 | AD987: 8
A989: OAKLEIGH | C989: 4 | D989: 3 | E989: =C989*6+D989 -> 27 | G989: 9 | H989: 7 | I989: =G989*6+H989 -> 61 | K989: 10 | L989: 10 | M989: =K989*6+L989 -> 70 | O989: 14 | P989: 13 | Q989: =O989*6+P989 -> 97 | S989: OAKLEIGH
A990: BRUNSWICK | C990: 4 | D990: 1 | E990: =C990*6+D990 -> 25 | G990: 6 | H990: 2 | I990: =G990*6+H990 -> 38 | K990: 11 | L990: 5 | M990: =K990*6+L990 -> 71 | O990: 13 | P990: 7 | Q990: =O990*6+P990 -> 85 | S990: MOWLAN
A991: BEST PLAYERS
A992: OAKLEIGH | C992: RUDOLPH | F992: FLEMING | I992: SPAIN | L992: FRASER | O992: WILTSHIRE | R992: DRIVER
A993: BRUNSWICK | C993: BRAY | F993: DOWLING | I993: KENNETT | L993: WARDEN | O993: FITZGERALD | R993: JOHNSTONE
A994: GOALKICKERS
A995: OAKLEIGH | C995: FRASER 6 | F995: FLEMING 2 | I995: CHAPMAN 2 | L995: SPAIN | N995: WILTSHIRE | Q995: RODWELL | T995: OPREY
A996: BRUNSWICK | C996: KINNEAR 4 | F996: KENNETT 2 | I996: DOWLING 2 | L996: PENMAN 2 | N996: ANDERSON | Q996: FRASER | T996: WARDEN
A998: WILLIAMSTOWN | C998: 5 | D998: 12 | E998: =C998*6+D998 -> 42 | G998: 8 | H998: 12 | I998: =G998*6+H998 -> 60 | K998: 11 | L998: 11 | M998: =K998*6+L998 -> 77 | O998: 14 | P998: 14 | Q998: =O998*6+P998 -> 98 | S998: WILLIAMSTOWN
A999: SANDRINGHAM | C999: 0 | D999: 5 | E999: =C999*6+D999 -> 5 | G999: 4 | H999: 11 | I999: =G999*6+H999 -> 35 | K999: 6 | L999: 13 | M999: =K999*6+L999 -> 49 | O999: 7 | P999: 21 | Q999: =O999*6+P999 -> 63 | S999: McINERNEY
A1000: BEST PLAYERS
A1001: WILLIAMSTOWN | C1001: BLAKE | F1001: SINCLAIR | I1001: HELLWIG | L1001: WALSH | O1001: DIXON | R1001: SYKES
A1002: SANDRINGHAM | C1002: FITZGERALD | F1002: BAILES | I1002: R KENNA | L1002: CHALLIS | O1002: BECKTON | R1002: FORBES
A1003: GOALKICKERS
A1004: WILLIAMSTOWN | C1004: SINCLAIR 4 | F1004: HELLWIG 3 | I1004: BLAKE 2 | K1004: WALSH 2 | M1004: CUTTING | O1004: SHANAHAN | R1004: DIXON
A1005: SANDRINGHAM | C1005: BAILES 2 | F1005: R KENNA 2 | I1005: FORBES | K1005: FITZGERALD | N1005: E BOURKE
A1007: BRIGHTON | C1007: 6 | D1007: 7 | E1007: =C1007*6+D1007 -> 43 | G1007: 12 | H1007: 10 | I1007: =G1007*6+H1007 -> 82 | K1007: 16 | L1007: 15 | M1007: =K1007*6+L1007 -> 111 | O1007: 16 | P1007: 17 | Q1007: =O1007*6+P1007 -> 113 | S1007: BRIGHTON BEACH
A1008: CAMBERWELL | C1008: 3 | D1008: 5 | E1008: =C1008*6+D1008 -> 23 | G1008: 6 | H1008: 9 | I1008: =G1008*6+H1008 -> 45 | K1008: 6 | L1008: 15 | M1008: =K1008*6+L1008 -> 51 | O1008: 10 | P1008: 17 | Q1008: =O1008*6+P1008 -> 77 | S1008: LESTER
A1009: BEST PLAYERS
A1010: BRIGHTON | C1010: STEWART | F1010: BURNES | I1010: IRWIN | L1010: LILBURNE | O1010: CANTWELL | R1010: TUCKER
A1011: CAMBERWELL | C1011: JONES | F1011: LUFF | I1011: STRACHAN | L1011: WILLIAMS | O1011: PETRIE | R1011: DYBALL
A1012: GOALKICKERS
A1013: BRIGHTON | C1013: BURNES 8 | F1013: TUCKER 4 | I1013: LILBURNE 3 | L1013: HUNT
A1014: CAMBERWELL | C1014: LUFF 4 | F1014: STRACHAN 3 | I1014: TROTTER | L1014: PETRIE | N1014: JACKSON
A1016: PORT MELBOURNE | C1016: 3 | D1016: 6 | E1016: =C1016*6+D1016 -> 24 | G1016: 5 | H1016: 11 | I1016: =G1016*6+H1016 -> 41 | K1016: 8 | L1016: 11 | M1016: =K1016*6+L1016 -> 59 | O1016: 12 | P1016: 12 | Q1016: =O1016*6+P1016 -> 84 | S1016: PORT MELBOURNE
A1017: PRAHRAN | C1017: 3 | D1017: 2 | E1017: =C1017*6+D1017 -> 20 | G1017: 4 | H1017: 2 | I1017: =G1017*6+H1017 -> 26 | K1017: 4 | L1017: 3 | M1017: =K1017*6+L1017 -> 27 | O1017: 6 | P1017: 5 | Q1017: =O1017*6+P1017 -> 41 | S1017: SCHAEFER
A1018: BEST PLAYERS
A1019: PORT MELBOURNE | C1019: LAHIFF | F1019: STANBRIDGE | I1019: HYDE | L1019: BOLMAN | O1019: BROOKER | R1019: BEDFORD
A1020: PRAHRAN | C1020: KOOP | F1020: BANKS | I1020: HARVEY | L1020: HAWKINS | O1020: JORDAN | R1020: SALTER
A1021: GOALKICKERS
A1022: PORT MELBOURNE | C1022: BEDFORD 5 | F1022: LAHIFF 2 | I1022: HYDE | K1022: BARNES | M1022: WILKIN | O1022: SMITH | Q1022: LEGGO
A1023: PRAHRAN | C1023: HAWKINS 5 | F1023: WILLIAMS
A1025: FINALS
A1026: 1ST SEMI | E1026: 5TH SEPTEMBER | J1026: WEATHER | M1026: FINE SOUTH BREEZE | S1026: PLAYED AT
D1027: 1ST QTR | H1027: 2ND QTR | L1027: 3RD QTR | P1027: FINAL | S1027: BRUNSWICK
A1028: NORTHCOTE | C1028: 1 | D1028: 2 | E1028: =C1028*6+D1028 -> 8 | G1028: 2 | H1028: 5 | I1028: =G1028*6+H1028 -> 17 | K1028: 8 | L1028: 8 | M1028: =K1028*6+L1028 -> 56 | O1028: 9 | P1028: 11 | Q1028: =O1028*6+P1028 -> 65 | S1028: UMPIRE
A1029: PORT MELBOURNE | C1029: 1 | D1029: 4 | E1029: =C1029*6+D1029 -> 10 | G1029: 2 | H1029: 4 | I1029: =G1029*6+H1029 -> 16 | K1029: 3 | L1029: 5 | M1029: =K1029*6+L1029 -> 23 | O1029: 5 | P1029: 8 | Q1029: =O1029*6+P1029 -> 38 | S1029: STUART
A1030: BEST PLAYERS
A1031: NORTHCOTE | C1031: NICHOLLS | F1031: McSWAIN | I1031: HUMPHRIES | L1031: COCKRAM | O1031: CORRIGAN | R1031: BRIGGS
A1032: PORT MELBOURNE | C1032: STANBRIDGE | F1032: TUITE | I1032: GARBUTT | L1032: SMITH | O1032: PLUMRIDGE | R1032: HYDE
A1033: GOALKICKERS
A1034: NORTHCOTE | C1034: SEYMOUR 2 | F1034: BYRNE 2 | I1034: SIMMONDS 2 | L1034: COLE | N1034: PRUSER | P1034: ROWE
A1035: PORT MELBOURNE | C1035: BEDFORD 2 | F1035: PLUMRIDGE | I1035: LEGGO | K1035: BROOKER
A1037: 2ND SEMI | E1037: 12TH SEPTEMBER | J1037: WEATHER | M1037: COLD HEAVY RAIN 2ND HALF WEST WIND
A1038: PRESTON | C1038: 1 | D1038: 1 | E1038: =C1038*6+D1038 -> 7 | G1038: 2 | H1038: 5 | I1038: =G1038*6+H1038 -> 17 | K1038: 5 | L1038: 9 | M1038: =K1038*6+L1038 -> 39 | O1038: 9 | P1038: 13 | Q1038: =O1038*6+P1038 -> 67 | S1038: COBURG
A1039: OAKLEIGH | C1039: 2 | D1039: 1 | E1039: =C1039*6+D1039 -> 13 | G1039: 4 | H1039: 3 | I1039: =G1039*6+H1039 -> 27 | K1039: 5 | L1039: 8 | M1039: =K1039*6+L1039 -> 38 | O1039: 6 | P1039: 8 | Q1039: =O1039*6+P1039 -> 44 | S1039: STUART
A1040: BEST PLAYERS
A1041: PRESTON | C1041: CAZALY | F1041: CAMERON | I1041: UNDERHILL | L1041: P SPARGO | O1041: F SPARGO | R1041: HUGHSON
A1042: OAKLEIGH | C1042: MAHER | F1042: RODWELL | I1042: THOMAS | L1042: CLARKE | O1042: HUTCHINSON | R1042: WATSON
A1043: GOALKICKERS
A1044: PRESTON | C1044: WARR 3 | F1044: MILLER 3 | I1044: PIPER 2 | L1044: KUPSCH
A1045: OAKLEIGH | C1045: FRASER 3 | F1045: MAHER | I1045: RODWELL | L1045: FLEMING
A1047: FINAL | E1047: 19TH SEPTEMBER | J1047: WEATHER | M1047: FINE GALE FORCE NORTH WIND
A1048: NORTHCOTE | C1048: 0 | D1048: 1 | E1048: =C1048*6+D1048 -> 1 | G1048: 6 | H1048: 15 | I1048: =G1048*6+H1048 -> 51 | K1048: 6 | L1048: 16 | M1048: =K1048*6+L1048 -> 52 | O1048: 11 | P1048: 22 | Q1048: =O1048*6+P1048 -> 88 | S1048: COBURG
A1049: PRESTON | C1049: 1 | D1049: 3 | E1049: =C1049*6+D1049 -> 9 | G1049: 1 | H1049: 3 | I1049: =G1049*6+H1049 -> 9 | K1049: 6 | L1049: 9 | M1049: =K1049*6+L1049 -> 45 | O1049: 7 | P1049: 9 | Q1049: =O1049*6+P1049 -> 51 | S1049: STUART
A1050: BEST PLAYERS
A1051: NORTHCOTE | C1051: COCKRAM | F1051: BRIGGS | I1051: PRUSER | L1051: ROSS | O1051: SIMMONDS | R1051: DEA
A1052: PRESTON | C1052: PIPER | F1052: WARR | I1052: MONOHAN | L1052: SMITH | O1052: UNDERHILL | R1052: DOWLING
A1053: GOALKICKERS
A1054: NORTHCOTE | C1054: SEYMOUR 3 | F1054: PRUSER 3 | I1054: COLE 2 | K1054: BRIGGS | M1054: BYRNE | P1054: STOCKDALE
A1055: PRESTON | C1055: PIPER 2 | F1055: MILLER 2 | I1055: GALL 2 | K1055: CAMERON
A1057: GRAND FINAL | E1057: 26TH SEPTEMBER | J1057: WEATHER | M1057: FINE S.E. BREEZE
A1058: OAKLEIGH | C1058: 2 | D1058: 3 | E1058: =C1058*6+D1058 -> 15 | G1058: 3 | H1058: 7 | I1058: =G1058*6+H1058 -> 25 | K1058: 7 | L1058: 11 | M1058: =K1058*6+L1058 -> 53 | O1058: 10 | P1058: 14 | Q1058: =O1058*6+P1058 -> 74 | S1058: PORT MELBOURNE
A1059: NORTHCOTE | C1059: 2 | D1059: 1 | E1059: =C1059*6+D1059 -> 13 | G1059: 4 | H1059: 3 | I1059: =G1059*6+H1059 -> 27 | K1059: 9 | L1059: 3 | M1059: =K1059*6+L1059 -> 57 | O1059: 11 | P1059: 5 | Q1059: =O1059*6+P1059 -> 71 | S1059: STUART
A1060: BEST PLAYERS
A1061: OAKLEIGH | C1061: RUDOLPH | F1061: WITHERS | I1061: MAHER | L1061: CHAPMAN | O1061: WILTSHIRE | R1061: SPAIN
A1062: NORTHCOTE | C1062: COCKRAM | F1062: SIMMONDS | I1062: ROSS | L1062: STOCKDALE | O1062: BRIGGS | R1062: NICHOLLS
A1063: GOALKICKERS
A1064: OAKLEIGH | C1064: FRASER 3 | F1064: RODWELL 3 | I1064: MAHER 2 | L1064: DOLAN | N1064: CRAMERI
A1065: NORTHCOTE | C1065: SIMMONDS 4 | F1065: SEYMOUR 3 | I1065: BYRNE 2 | L1065: CORRIGAN | N1065: ROSS
A1067: TEAMS
G1068: OAKLEIGH
A1069: BACKS | C1069: WATSON | G1069: WITHERS | K1069: McALISTER
A1070: H-BACKS | C1070: MORRIS | G1070: RUDOLPH | K1070: THOMAS
A1071: CENTRES | C1071: OPREY | G1071: DOLAN | K1071: GODING
A1072: H-FORWARDS | C1072: WILTSHIRE | G1072: FLEMING | K1072: CHAPMAN
A1073: FORWARDS | C1073: RODHELL | G1073: FRASER | K1073: MAHER
A1074: RUCKS | C1074: SPAIN | G1074: YEMM | K1074: CRAMERI
A1076: OTHER MATCHES
E1077: 6TH JUNE | J1077: WEATHER | S1077: PLAYED AT
A1078: V.F.L. | C1078: 2 | D1078: 4 | E1078: =C1078*6+D1078 -> 16 | G1078: 2 | H1078: 5 | I1078: =G1078*6+H1078 -> 17 | K1078: 8 | L1078: 15 | M1078: =K1078*6+L1078 -> 63 | O1078: 12 | P1078: 17 | Q1078: =O1078*6+P1078 -> 89 | S1078: M.C.G.
A1079: V.F.A. | C1079: 1 | D1079: 2 | E1079: =C1079*6+D1079 -> 8 | G1079: 3 | H1079: 5 | I1079: =G1079*6+H1079 -> 23 | K1079: 3 | L1079: 5 | M1079: =K1079*6+L1079 -> 23 | O1079: 3 | P1079: 10 | Q1079: =O1079*6+P1079 -> 28 | S1079: UMPIRES
A1080: BEST PLAYERS | S1080: SCOTT MURRAY
A1081: V.F.L. | D1081: McCORMACK | G1081: RUMNEY | J1081: BATCHELOR | M1081: POOLE | P1081: S COVENTRY | S1081: HICKEY
A1082: V.F.A. | D1082: SYKES | G1082: NICHOLLS | J1082: GARBUTT | M1082: SUMMERS | P1082: MEARS | S1082: BROOKER
A1083: GOALKICKERS
A1084: V.F.L. | D1084: TITUS 5 | G1084: SPURLING 2 | J1084: POOLE 2 | M1084: G COVENTRY | P1084: OKEY | R1084: HOPKINS
A1085: V.F.A. | D1085: MEARS | G1085: FLEMING | J1085: BEDFORD
A1087: TEAMS
G1088: V.F.L. | U1088: V.F.A.
A1089: BACKS | C1089: S COVENTRY | G1089: TYMMS | K1089: RUMNEY | Q1089: KOOP | U1089: GARBUTT | X1089: TAYLOR
A1090: H-BACKS | C1090: MATTHEWS | G1090: HICKEY | K1090: McCORMACK | Q1090: BOURKE | U1090: RUDOLPH | X1090: SYKES
A1091: CENTRES | C1091: CAMERON | G1091: OKEY | K1091: KELLY | Q1091: BARNES | U1091: BROOKER | X1091: NICHOLLS
A1092: H-FORWARDS | C1092: TITUS | G1092: SPURLING | K1092: HOPKINS | Q1092: RODHELL | U1092: LAWN | X1092: HEARN
A1093: FORWARDS | C1093: BATCHELOR | G1093: G COVENTRY | K1093: DAVEY | Q1093: BEDFORD | U1093: SEYMOUR | X1093: SUMMERS
A1094: RUCKS | C1094: FOSTER | G1094: METHERALL | K1094: POOLE | Q1094: FLEMING | U1094: JOHNS | X1094: MEARS
A1095: 19TH MAN | C1095: JOHNSON | G1095: PHILLIPS | K1095: GEDDES | Q1095: LOWE
E1097: 15TH AUGUST | J1097: WEATHER
A1098: V.F.A. | C1098: 5 | D1098: 5 | E1098: =C1098*6+D1098 -> 35 | G1098: 8 | H1098: 6 | I1098: =G1098*6+H1098 -> 54 | K1098: 11 | L1098: 11 | M1098: =K1098*6+L1098 -> 77 | O1098: 16 | P1098: 11 | Q1098: =O1098*6+P1098 -> 107 | S1098: SYDNEY
A1099: N.S.W. | C1099: 4 | D1099: 4 | E1099: =C1099*6+D1099 -> 28 | G1099: 8 | H1099: 12 | I1099: =G1099*6+H1099 -> 60 | K1099: 10 | L1099: 15 | M1099: =K1099*6+L1099 -> 75 | O1099: 13 | P1099: 17 | Q1099: =O1099*6+P1099 -> 95
A1100: BEST PLAYERS
A1101: V.F.A. | D1101: GARBUTT | G1101: BUCKLEY | J1101: KINNEAR | M1101: OPREY | P1101: MEARS | S1101: LILBURNE
A1102: N.S.W. | D1102: J STAFF | G1102: QUINN | J1102: McCOY | M1102: LONDON
A1103: GOALKICKERS
A1104: V.F.A. | D1104: BUCKLEY 5 | G1104: KINNEAR 3 | J1104: FITZGERALD 2 | M1104: COLE 2 | O1104: LILBURNE | Q1104: NICHOLLS | T1104: WARR | W1104: HENDERSON
A1105: N.S.W. | D1105: J STAFF 5 | G1105: QUINN 2 | J1105: FITZGERALD 2 | M1105: CASTLES | O1105: McGUIRE | Q1105: LINNEY | T1105: FERGUSON
A1107: TEAMS
G1108: V.F.A. | S1108: N.S.W.
A1109: BACKS | C1109: KOOP | G1109: GARBUTT | K1109: HENDERSON | P1109: GREEN | S1109: LONDON | W1109: LINNEY
A1110: H-BACKS | C1110: SPAIN | G1110: BOURKE | K1110: SYKES | P1110: MATTHEWS | S1110: RADFORD | W1110: JENNER
A1111: CENTRES | C1111: NICHOLLS | G1111: BROOKER | K1111: OPREY | P1111: McCOY | S1111: PHELAN | W1111: JONES
A1112: H-FORWARDS | C1112: COLE | G1112: CAHILL | K1112: CAMPBELL | P1112: WALSH | S1112: QUINN | W1112: FERGUSON
A1113: FORWARDS | C1113: KINNEAR | G1113: BUCKLEY | K1113: FITZGERALD | P1113: ELLIMAN | S1113: CASTLES | W1113: STAFF
A1114: RUCKS | C1114: LILBURNE | G1114: LORD | K1114: MEARS | P1114: DONALD | S1114: McGUIRE | W1114: FITZGERALD
A1115: RES | C1115: HUNT | G1115: WARR