A1: Victorian Football Association
A2: Season 1932
A3: © Copyright Wal Williams | F3: First created: 2 November 2014
A4: Contact: joywalwi at gmail dot com | F4: Last updated: 27 January 2018 | W4: VFA Results and tables - Link to the main index page
A5: You are free to copy this document in whole or part provided that proper acknowledgement is given to the author. All rights reserved.
A7: ROUND 1 | E7: 23RD APRIL | J7: WEATHER | M7: FINE N.W.BREEZE | S7: PLAYED AT
D8: 1ST QTR | H8: 2ND QTR | L8: 3RD QTR | P8: FINAL | S8: BRUNSWICK | X8: LADDER | AB8: ROUND | AD8: 1
A9: COBURG | C9: 1 | D9: 8 | E9: =C9*6+D9 -> 14 | G9: 3 | H9: 16 | I9: =G9*6+H9 -> 34 | K9: 6 | L9: 20 | M9: =K9*6+L9 -> 56 | O9: 15 | P9: 26 | Q9: =O9*6+P9 -> 116 | S9: UMPIRE
A10: BRUNSWICK | C10: 3 | D10: 3 | E10: =C10*6+D10 -> 21 | G10: 5 | H10: 5 | I10: =G10*6+H10 -> 35 | K10: 9 | L10: 7 | M10: =K10*6+L10 -> 61 | O10: 10 | P10: 8 | Q10: =O10*6+P10 -> 68 | S10: SCHAEFER | W10: TEAM | X10: W | Y10: L | Z10: D | AA10: FOR | AB10: AGST | AC10: % | AD10: PTS
A11: BEST PLAYERS | DA11: \D | DB11: {GOTO}BJ3~/M{RIGHT 7}{END}{DOWN}~G4~
A12: COBURG | C12: BERTRAM | F12: STOCKDALE | I12: KIGHT | L12: LOWE | O12: DUNCAN | Q12: ROGERS | W12: PORT MELBOURNE | X12: 1 | Y12: 0 | Z12: 0 | AA12: 103 | AB12: 57 | AC12: 180.7017543859649 | AD12: 4 | DB12: {GOTO}AL3~/M{END}{RIGHT}{END}{DOWN}~P3~
A13: BRUNSWICK | C13: BLACKMORE | F13: DOWLING | I13: MAYNES | L13: FITZGERALD | O13: CARTON | Q13: WHITELEY | W13: CAMBERWELL | X13: 1 | Y13: 0 | Z13: 0 | AA13: 122 | AB13: 68 | AC13: 179.41176470588235 | AD13: 4 | DB13: {GOTO}BJ23~/M{RIGHT 7}{END}{DOWN}~V4~
A14: GOALKICKERS | W14: COBURG | X14: 1 | Y14: 0 | Z14: 0 | AA14: 116 | AB14: 68 | AC14: 170.58823529411765 | AD14: 4 | DB14: {GOTO}BJ43~/M{RIGHT 7}{END}{DOWN}~G27~
A15: COBURG | C15: DUNCAN 4 | F15: KIGHT 3 | H15: TURNER 3 | J15: STOCKDALE 2 | M15: JENKINS | O15: WILLOX | Q15: BEERS | W15: PRESTON | X15: 1 | Y15: 0 | Z15: 0 | AA15: 83 | AB15: 71 | AC15: 116.9 | AD15: 4 | DB15: {GOTO}AL26~/M{END}{RIGHT}{END}{DOWN}~P26~
A16: BRUNSWICK | C16: PENMAN 3 | F16: W DARLINSON 2 | J16: FITZGERALD 2 | M16: BAIRD 2 | O16: WHITE | DB16: {GOTO}BJ63~/M{RIGHT 7}{END}{DOWN}~V27~
W17: WILLIAMSTOWN | X17: 1 | Y17: 0 | Z17: 0 | AA17: 89 | AB17: 81 | AC17: 109.87654320987654 | AD17: 4 | DB17: {GOTO}BJ83~/M{RIGHT 7}{END}{DOWN}~G50~
A18: PRESTON | C18: 4 | D18: 0 | E18: =C18*6+D18 -> 24 | G18: 7 | H18: 3 | I18: =G18*6+H18 -> 45 | K18: 9 | L18: 4 | M18: =K18*6+L18 -> 58 | O18: 13 | P18: 5 | Q18: =O18*6+P18 -> 83 | S18: PRESTON | W18: BRIGHTON | X18: 1 | Y18: 0 | Z18: 0 | AA18: 79 | AB18: 77 | AC18: 102.59740259740259 | AD18: 4 | DB18: {GOTO}AL49~/M{END}{RIGHT}{END}{DOWN}~P49~
A19: NORTHCOTE | C19: 0 | D19: 5 | E19: =C19*6+D19 -> 5 | G19: 2 | H19: 10 | I19: =G19*6+H19 -> 22 | K19: 6 | L19: 18 | M19: =K19*6+L19 -> 54 | O19: 8 | P19: 23 | Q19: =O19*6+P19 -> 71 | S19: MURRAY | W19: SANDRINGHAM | X19: 0 | Y19: 1 | Z19: 0 | AA19: 77 | AB19: 79 | AC19: 97.468354430379748 | AD19: 0 | DB19: {GOTO}BJ103~/M{RIGHT 7}{END}{DOWN}~V50~
A20: BEST PLAYERS | W20: YARRAVILLE | X20: 0 | Y20: 1 | Z20: 0 | AA20: 81 | AB20: 89 | AC20: 91.011235955056179 | AD20: 0 | DB20: {GOTO}BJ123~/M{RIGHT 7}{END}{DOWN}~G73~
A21: PRESTON | C21: HUGHSON | F21: SMITH | I21: MONOHAN | L21: WARR | N21: DINEEN | Q21: UNDERHILL | W21: NORTHCOTE | X21: 0 | Y21: 1 | Z21: 0 | AA21: 71 | AB21: 83 | AC21: 85.54 | AD21: 0 | DB21: {GOTO}AL72~/M{END}{RIGHT}{END}{DOWN}~P72~
A22: NORTHCOTE | C22: ROSS | F22: ROWE | I22: BROWN | L22: GRAY | N22: GOULLET | Q22: BYRNE | W22: BRUNSWICK | X22: 0 | Y22: 1 | Z22: 0 | AA22: 68 | AB22: 116 | AC22: 58.620689655172413 | AD22: 0 | DB22: {GOTO}BJ143~/M{RIGHT 7}{END}{DOWN}~V73~
A23: GOALKICKERS | W23: OAKLEIGH | X23: 0 | Y23: 1 | Z23: 0 | AA23: 68 | AB23: 122 | AC23: 55.73770491803279 | AD23: 0 | DB23: {GOTO}BJ163~/M{RIGHT 7}{END}{DOWN}~G96~
A24: PRESTON | C24: DAVIE 5 | E24: HUGHSON 3 | H24: LANGWELL 2 | K24: WARR 2 | M24: SUMMERS | W24: PRAHRAN | X24: 0 | Y24: 1 | Z24: 0 | AA24: 57 | AB24: 103 | AC24: 55.339805825242721 | AD24: 0 | DB24: {GOTO}AL95~/M{END}{RIGHT}{END}{DOWN}~P95~
A25: NORTHCOTE | C25: COLE 2 | E25: ROSS 2 | H25: SEYMOUR 2 | K25: GRAY | M25: BYRNE | DB25: {GOTO}BJ183~/M{RIGHT 7}{END}{DOWN}~V96~
DB26: {GOTO}BJ203~/M{RIGHT 7}{END}{DOWN}~G119~
A27: BRIGHTON | C27: 6 | D27: 3 | E27: =C27*6+D27 -> 39 | G27: 9 | H27: 6 | I27: =G27*6+H27 -> 60 | K27: 9 | L27: 7 | M27: =K27*6+L27 -> 61 | O27: 12 | P27: 7 | Q27: =O27*6+P27 -> 79 | S27: ELSTERNWICK PARK | DB27: {GOTO}AL118~/M{END}{RIGHT}{END}{DOWN}~P113~
A28: PORT MELBOURNE | C28: 2 | D28: 5 | E28: =C28*6+D28 -> 17 | G28: 7 | H28: 6 | I28: =G28*6+H28 -> 48 | K28: 9 | L28: 8 | M28: =K28*6+L28 -> 62 | O28: 11 | P28: 11 | Q28: =O28*6+P28 -> 77 | S28: MORCAM | DB28: {GOTO}BJ223~/M{RIGHT 7}{END}{DOWN}~V119~
A29: BEST PLAYERS
A30: BRIGHTON | C30: JOHNSON | F30: LILBURNE | I30: GRAHAM | L30: POULTER | O30: CAMPBELL | R30: HUNT
A31: SANDRINGHAM | C31: BECKTON | F31: GAMBETTA | I31: THOMS | L31: BAILES | O31: RAYMENT | R31: LAVER | DB31: {GOTO}BJ243~/M{RIGHT 7}{END}{DOWN}~G142~
A32: GOALKICKERS | DB32: {GOTO}AL141~/M{END}{RIGHT}{END}{DOWN}~P141~
A33: BRIGHTON | C33: GRAHAM 4 | F33: AMINDE 3 | I33: JOHNSON 3 | L33: POULTER | O33: HILL | DB33: {GOTO}BJ263~/M{RIGHT 7}{END}{DOWN}~V142~
A34: SANDRINGHAM | C34: BECKTON 3 | F34: GAMBETTA 2 | I34: THOMS 2 | L34: PERRY | N34: CHALLIS | Q34: BAILES | S34: FITZGERALD | DB34: {GOTO}BJ283~/M{RIGHT 7}{END}{DOWN}~G165~
DB35: {GOTO}AL164~/M{END}{RIGHT}{END}{DOWN}~P164~
A36: CAMBERWELL | C36: 4 | D36: 2 | E36: =C36*6+D36 -> 26 | G36: 8 | H36: 6 | I36: =G36*6+H36 -> 54 | K36: 11 | L36: 8 | M36: =K36*6+L36 -> 74 | O36: 18 | P36: 14 | Q36: =O36*6+P36 -> 122 | S36: CAMBERWELL | DB36: {GOTO}BJ303~/M{RIGHT 7}{END}{DOWN}~V165~
A37: OAKLEIGH | C37: 3 | D37: 0 | E37: =C37*6+D37 -> 18 | G37: 4 | H37: 4 | I37: =G37*6+H37 -> 28 | K37: 6 | L37: 9 | M37: =K37*6+L37 -> 45 | O37: 9 | P37: 14 | Q37: =O37*6+P37 -> 68 | S37: GLOVER | DB37: {GOTO}BJ323~/M{RIGHT 7}{END}{DOWN}~G188~
A38: BEST PLAYERS | DB38: {GOTO}AL187~/M{END}{RIGHT}{END}{DOWN}~P187~
A39: CAMBERWELL | C39: LAWN | F39: GREENWOOD | I39: LUFF | L39: ROWE | O39: WILLIAMS | R39: STRACHAN | DB39: {GOTO}BJ343~/M{RIGHT 7}{END}{DOWN}~V188~
A40: OAKLEIGH | C40: FRASER | F40: DENNING | I40: WITHERS | L40: MUDGE | O40: CHESSWASS | R40: DRIVER | DB40: {GOTO}BJ363~/M{RIGHT 7}{END}{DOWN}~G211~
A41: GOALKICKERS | DB41: {GOTO}AL210~/M{END}{RIGHT}{END}{DOWN}~P210~
A42: CAMBERWELL | C42: LAWN 7 | F42: LUFF 4 | H42: W JONES 2 | K42: MASON 2 | M42: STRACHAN 2 | P42: O'NEILL | DB42: {GOTO}BJ383~/M{RIGHT 7}{END}{DOWN}~V211~
A43: OAKLEIGH | C43: FRASER 5 | F43: DENNING 2 | I43: YANN | K43: CHESSWASS | DB43: {HOME}
A45: PORT MELBOURNE | C45: 2 | D45: 3 | E45: =C45*6+D45 -> 15 | G45: 7 | H45: 8 | I45: =G45*6+H45 -> 50 | K45: 8 | L45: 16 | M45: =K45*6+L45 -> 64 | O45: 13 | P45: 25 | Q45: =O45*6+P45 -> 103 | S45: PORT MELBOURNE
A46: PRAHRAN | C46: 2 | D46: 4 | E46: =C46*6+D46 -> 16 | G46: 2 | H46: 5 | I46: =G46*6+H46 -> 17 | K46: 3 | L46: 9 | M46: =K46*6+L46 -> 27 | O46: 8 | P46: 9 | Q46: =O46*6+P46 -> 57 | S46: STUART
A47: BEST PLAYERS
A48: PORT MELBOURNE | C48: CROMPTON | F48: PLUMRIDGE | I48: PERRETT | L48: McINNES | O48: TUITE | R48: McKENZIE
A49: PRAHRAN | C49: LUCAS | F49: BANKS | I49: SALTER | L49: WIGNELL | O49: THOMPSON | R49: GREENWOOD
A50: GOALKICKERS
A51: PORT MELBOURNE | C51: LAHIFF 3 | F51: HARRY 3 | I51: McINNES 2 | L51: WILKIN 2 | N51: PLUMRIDGE 2 | Q51: TUITE
A52: PRAHRAN | C52: HAWKINS 3 | F52: GREENWOOD 3 | J52: TRIM 2
A54: WILLIAMSTOWN | C54: 6 | D54: 2 | E54: =C54*6+D54 -> 38 | G54: 6 | H54: 2 | I54: =G54*6+H54 -> 38 | K54: 10 | L54: 8 | M54: =K54*6+L54 -> 68 | O54: 13 | P54: 11 | Q54: =O54*6+P54 -> 89 | S54: WILLIAMSTOWN
A55: YARRAVILLE | C55: 1 | D55: 4 | E55: =C55*6+D55 -> 10 | G55: 4 | H55: 8 | I55: =G55*6+H55 -> 32 | K55: 8 | L55: 10 | M55: =K55*6+L55 -> 58 | O55: 11 | P55: 15 | Q55: =O55*6+P55 -> 81
A56: BEST PLAYERS
A57: WILLIAMSTOWN | C57: HELLWIG | F57: BYRNE | I57: J O'BRIEN | L57: BROOKS | O57: BARNES | R57: SHADE
A58: YARRAVILLE | C58: BRUMBY | F58: W BUCKLEY | I58: DAVIES | L58: JONES | O58: FORDHAM | R58: J BUCKLEY
A59: GOALKICKERS
A60: WILLIAMSTOWN | C60: BYRNE 3 | E60: HELWIG 2 | G60: McGRATH 2 | J60: L DREW 2 | M60: SHADE | O60: BARNES | Q60: J O'BRIEN | T60: SINCLAIR
A61: YARRAVILLE | C61: FORDHAM 3 | F61: DAVIES 2 | I61: W BUCKLEY 2 | L61: BRUMBY | N61: MORRISON | Q61: DRISCOLL | T61: JONES
A63: ROUND 2 | E63: 30TH APRIL | J63: WEATHER | M63: FINE | S63: PLAYED AT
D64: 1ST QTR | H64: 2ND QTR | L64: 3RD QTR | P64: FINAL | S64: COBURG
A65: PRESTON | C65: 1 | D65: 4 | E65: =C65*6+D65 -> 10 | G65: 4 | H65: 10 | I65: =G65*6+H65 -> 34 | K65: 7 | L65: 11 | M65: =K65*6+L65 -> 53 | O65: 13 | P65: 13 | Q65: =O65*6+P65 -> 91 | S65: UMPIRE | X65: LADDER | AB65: ROUND | AD65: 2
A66: COBURG | C66: 4 | D66: 2 | E66: =C66*6+D66 -> 26 | G66: 6 | H66: 5 | I66: =G66*6+H66 -> 41 | K66: 11 | L66: 8 | M66: =K66*6+L66 -> 74 | O66: 13 | P66: 12 | Q66: =O66*6+P66 -> 90 | S66: MORCAM
A67: BEST PLAYERS | W67: TEAM | X67: W | Y67: L | Z67: D | AA67: FOR | AB67: AGST | AC67: % | AD67: PTS
A68: PRESTON | C68: REICHMAN | F68: WARR | I68: DINEEN | K68: HUGHSON | N68: KUPSCH | Q68: SUMMERS
A69: COBURG | C69: JENKINS | F69: MARTIN | I69: DUNCAN | K69: LOWE | N69: KIGHT | Q69: BRIGGS | W69: PORT MELBOURNE | X69: 2 | Y69: 0 | Z69: 0 | AA69: 219 | AB69: 121 | AC69: 180.9917355371901 | AD69: 8
A70: GOALKICKERS | Q70: DINEEN | W70: CAMBERWELL | X70: 2 | Y70: 0 | Z70: 0 | AA70: 204 | AB70: 143 | AC70: 142.65734265734267 | AD70: 8
A71: PRESTON | C71: LANGWELL 3 | F71: WARR 2 | H71: KUPSCH 2 | J71: DAVIE | L71: HUGHSON | N71: SUMMERS | P71: POULTER | R71: HARDING | W71: WILLIAMSTOWN | X71: 2 | Y71: 0 | Z71: 0 | AA71: 195 | AB71: 177 | AC71: 110.16949152542372 | AD71: 8
A72: COBURG | C72: DUNCAN 3 | F72: KIGHT 3 | H72: TURNER 2 | J72: STOCKDALE 2 | M72: WILLOX | O72: ELLIOTT | Q72: BRIGGS | W72: PRESTON | X72: 2 | Y72: 0 | Z72: 0 | AA72: 174 | AB72: 161 | AC72: 108.07 | AD72: 8
A74: NORTHCOTE | C74: 2 | D74: 7 | E74: =C74*6+D74 -> 19 | G74: 5 | H74: 8 | I74: =G74*6+H74 -> 38 | K74: 15 | L74: 12 | M74: =K74*6+L74 -> 102 | O74: 18 | P74: 15 | Q74: =O74*6+P74 -> 123 | S74: NORTHCOTE | W74: SANDRINGHAM | X74: 1 | Y74: 1 | Z74: 0 | AA74: 198 | AB74: 141 | AC74: 140.42553191489361 | AD74: 4
A75: BRIGHTON | C75: 2 | D75: 4 | E75: =C75*6+D75 -> 16 | G75: 8 | H75: 7 | I75: =G75*6+H75 -> 55 | K75: 10 | L75: 8 | M75: =K75*6+L75 -> 68 | O75: 12 | P75: 15 | Q75: =O75*6+P75 -> 87 | S75: GLOVER | W75: COBURG | X75: 1 | Y75: 1 | Z75: 0 | AA75: 206 | AB75: 159 | AC75: 129.55974842767296 | AD75: 4
A76: BEST PLAYERS | W76: NORTHCOTE | X76: 1 | Y76: 1 | Z76: 0 | AA76: 194 | AB76: 170 | AC76: 114.12 | AD76: 4
A77: NORTHCOTE | C77: SEYMOUR | F77: GARRETT | I77: McSWAIN | L77: ROSS | O77: SMITH | R77: COLE | W77: BRIGHTON | X77: 1 | Y77: 1 | Z77: 0 | AA77: 166 | AB77: 200 | AC77: 83 | AD77: 4
A78: BRIGHTON | C78: TUCKER | F78: POULTER | I78: LILBURNE | L78: McGURGAN | O78: GOULDSWORTHY | R78: STEWSRT | W78: OAKLEIGH | X78: 0 | Y78: 2 | Z78: 0 | AA78: 164 | AB78: 228 | AC78: 71.929824561403507 | AD78: 0
A79: GOALKICKERS | W79: PRAHRAN | X79: 0 | Y79: 2 | Z79: 0 | AA79: 132 | AB79: 185 | AC79: 71.351351351351354 | AD79: 0
A80: NORTHCOTE | C80: SEYMOUR 12 | F80: COLE 3 | I80: GOULLET 2 | L80: GRAY | W80: YARRAVILLE | X80: 0 | Y80: 2 | Z80: 0 | AA80: 145 | AB80: 205 | AC80: 70.731707317073173 | AD80: 0
A81: BRIGHTON | C81: GRAHAM 2 | F81: JOHNSON 2 | I81: POULTER 2 | L81: TUCKER 2 | N81: STEWART | Q81: McGUIGAN | T81: HUNT | W81: BRUNSWICK | X81: 0 | Y81: 2 | Z81: 0 | AA81: 130 | AB81: 237 | AC81: 54.852320675105489 | AD81: 0
Q82: TEMPEST
A83: SANDRINGHAM | C83: 3 | D83: 6 | E83: =C83*6+D83 -> 24 | G83: 8 | H83: 12 | I83: =G83*6+H83 -> 60 | K83: 12 | L83: 16 | M83: =K83*6+L83 -> 88 | O83: 17 | P83: 19 | Q83: =O83*6+P83 -> 121 | S83: BEACH ROAD
A84: BRUNSWICK | C84: 5 | D84: 2 | E84: =C84*6+D84 -> 32 | G84: 5 | H84: 4 | I84: =G84*6+H84 -> 34 | K84: 6 | L84: 7 | M84: =K84*6+L84 -> 43 | O84: 9 | P84: 8 | Q84: =O84*6+P84 -> 62 | S84: STUART
A85: BEST PLAYERS
A86: SANDRINGHAM | C86: E BOURKE | F86: LUNN | I86: THOMS | L86: RAYMENT | O86: DE LUCA | R86: LAVER
A87: BRUNSWICK | C87: C DARLINSON | F87: KNOTT | I87: McNEILL | L87: BRIGHT | O87: DOWLING | R87: BLACKMORE
A88: GOALKICKERS
A89: SANDRINGHAM | C89: THOMS 8 | F89: RAYMENT 3 | I89: GAMBETTA 2 | L89: BAILES 2 | N89: BECKTON | Q89: DE LUCA
A90: BRUNSWICK | C90: C DARLINSON 2 | F90: KNOTT 2 | H90: W DARLINSON | K90: BAIRD | M90: DOWLING | O90: HARRISON | Q90: WARDEN
A92: PORT MELBOURNE | C92: 0 | D92: 4 | E92: =C92*6+D92 -> 4 | G92: 5 | H92: 11 | I92: =G92*6+H92 -> 41 | K92: 7 | L92: 16 | M92: =K92*6+L92 -> 58 | O92: 15 | P92: 26 | Q92: =O92*6+P92 -> 116 | S92: YARRAVILLE
A93: YARRAVILLE | C93: 4 | D93: 2 | E93: =C93*6+D93 -> 26 | G93: 6 | H93: 5 | I93: =G93*6+H93 -> 41 | K93: 9 | L93: 10 | M93: =K93*6+L93 -> 64 | O93: 9 | P93: 10 | Q93: =O93*6+P93 -> 64 | S93: LESTER
A94: BEST PLAYERS
A95: PORT MELBOURNE | C95: GARBUTT | F95: TUITE | I95: BARNES | L95: STANBRIDGE | O95: BEDFORD | R95: CROMPTON
A96: YARRAVILLE | C96: J BUCKLEY | F96: W BUCKLEY | I96: MORRISON | L96: BRUMBY | O96: FULLWOOD | R96: WUNHYM
A97: GOALKICKERS
A98: PORT MELBOURNE | C98: TUITE 4 | E98: BEDFORD 4 | H98: BARNES 3 | J98: MALTBY 2 | M98: LEGGO | O98: W PERRETT
A99: YARRAVILLE | C99: J BUCKLEY 4 | F99: W BUCKLEY 2 | I99: FORDHAM | L99: BRUMBY | N99: WUNHYM
A101: WILLIAMSTOWN | C101: 0 | D101: 6 | E101: =C101*6+D101 -> 6 | G101: 8 | H101: 9 | I101: =G101*6+H101 -> 57 | K101: 9 | L101: 12 | M101: =K101*6+L101 -> 66 | O101: 15 | P101: 16 | Q101: =O101*6+P101 -> 106 | S101: OAKLEIGH
A102: OAKLEIGH | C102: 1 | D102: 6 | E102: =C102*6+D102 -> 12 | G102: 3 | H102: 9 | I102: =G102*6+H102 -> 27 | K102: 7 | L102: 15 | M102: =K102*6+L102 -> 57 | O102: 13 | P102: 18 | Q102: =O102*6+P102 -> 96 | S102: MURRAY
A103: BEST PLAYERS
A104: WILLIAMSTOWN | C104: LYNCH | F104: BYRNE | I104: McGRATH | L104: HELLWIG | O104: SINCLAIR | R104: BARNES
A105: OAKLEIGH | C105: WITHERS | F105: DRIVER | I105: McALLISTER | L105: JACKSON | O105: MUDGE | R105: FRASER
A106: GOALKICKERS
A107: WILLIAMSTOWN | C107: BYRNE 5 | F107: McGRATH 4 | I107: HELWIG 2 | L107: SINCLAIR 2 | O107: SHADE | Q107: DIXON
A108: OAKLEIGH | C108: FRASER 8 | F108: YEMM 2 | I108: RODWELL | L108: MUDGE | N108: CAMPBELL
A110: CAMBERWELL | C110: 1 | D110: 2 | E110: =C110*6+D110 -> 8 | G110: 6 | H110: 5 | I110: =G110*6+H110 -> 41 | K110: 6 | L110: 6 | M110: =K110*6+L110 -> 42 | O110: 11 | P110: 16 | Q110: =O110*6+P110 -> 82 | S110: TOORAK PARK
A111: PRAHRAN | C111: 3 | D111: 9 | E111: =C111*6+D111 -> 27 | G111: 3 | H111: 11 | I111: =G111*6+H111 -> 29 | K111: 8 | L111: 15 | M111: =K111*6+L111 -> 63 | O111: 10 | P111: 15 | Q111: =O111*6+P111 -> 75 | S111: MOWLAN
A112: BEST PLAYERS
A113: CAMBERWELL | C113: CLAMP | F113: LAWN | I113: H JONES | L113: LUFF | O113: GREENWOOD | R113: DYBALL
A114: PRAHRAN | C114: WHITE | F114: MAHONEY | I114: GREENWOOD | L114: MORLEY | O114: HAWKINS | R114: BANKS
A115: GOALKICKERS
A116: CAMBERWELL | C116: LUFF 3 | E116: LAWN 2 | G116: MASON 2 | I116: STRAUGHAN | L116: W COFFIN | O116: V COFFIN | Q116: PETRIE
A117: PRAHRAN | C117: HAWKINS 6 | F117: GREENWOOD | I117: WILLIAMS | L117: WIGNELL | N117: SALTER
A119: ROUND 3 | E119: 7TH MAY | J119: WEATHER | M119: FINE S.W. BREEZE | S119: PLAYED AT
D120: 1ST QTR | H120: 2ND QTR | L120: 3RD QTR | P120: FINAL | S120: WILLIAMSTOWN
A121: WILLIAMSTOWN | C121: 3 | D121: 1 | E121: =C121*6+D121 -> 19 | G121: 6 | H121: 11 | I121: =G121*6+H121 -> 47 | K121: 9 | L121: 12 | M121: =K121*6+L121 -> 66 | O121: 17 | P121: 16 | Q121: =O121*6+P121 -> 118 | S121: UMPIRE | X121: LADDER | AB121: ROUND | AD121: 3
A122: COBURG | C122: 5 | D122: 3 | E122: =C122*6+D122 -> 33 | G122: 7 | H122: 3 | I122: =G122*6+H122 -> 45 | K122: 8 | L122: 8 | M122: =K122*6+L122 -> 56 | O122: 12 | P122: 10 | Q122: =O122*6+P122 -> 82 | S122: LEWIS
A123: BEST PLAYERS | W123: TEAM | X123: W | Y123: L | Z123: D | AA123: FOR | AB123: AGST | AC123: % | AD123: PTS
A124: WILLIAMSTOWN | C124: HELLWIG | F124: LONERGAN | I124: WILLIAMSON | L124: BARNES | N124: SINCLAIR | Q124: CUTTING
A125: COBURG | C125: DUNCAN | F125: BRIGGS | I125: WILLOX | L125: LOWE | N125: BERTRAM | Q125: ROGERS | W125: PORT MELBOURNE | X125: 3 | Y125: 0 | Z125: 0 | AA125: 309 | AB125: 173 | AC125: 178.61271676300578 | AD125: 12
A126: GOALKICKERS | W126: CAMBERWELL | X126: 3 | Y126: 0 | Z126: 0 | AA126: 365 | AB126: 232 | AC126: 157.32758620689654 | AD126: 12
A127: WILLIAMSTOWN | C127: SINCLAIR 5 | F127: McGRATH 4 | I127: BYRNE 3 | K127: SHADE 3 | M127: L DREW | O127: DIXON | W127: PRESTON | X127: 3 | Y127: 0 | Z127: 0 | AA127: 250 | AB127: 201 | AC127: 124.38 | AD127: 12
A128: COBURG | C128: DUNCAN 4 | F128: BRIGGS 4 | I128: STOCKDALE | L128: WILLOX | N128: McFARLANE | Q128: LOWE | W128: WILLIAMSTOWN | X128: 3 | Y128: 0 | Z128: 0 | AA128: 313 | AB128: 259 | AC128: 120.84942084942085 | AD128: 12
A130: CAMBERWELL | C130: 6 | D130: 2 | E130: =C130*6+D130 -> 38 | G130: 14 | H130: 7 | I130: =G130*6+H130 -> 91 | K130: 17 | L130: 10 | M130: =K130*6+L130 -> 112 | O130: 24 | P130: 17 | Q130: =O130*6+P130 -> 161 | S130: CAMBERWELL | W130: SANDRINGHAM | X130: 2 | Y130: 1 | Z130: 0 | AA130: 315 | AB130: 233 | AC130: 135.1931330472103 | AD130: 8
A131: NORTHCOTE | C131: 3 | D131: 2 | E131: =C131*6+D131 -> 20 | G131: 5 | H131: 6 | I131: =G131*6+H131 -> 36 | K131: 9 | L131: 9 | M131: =K131*6+L131 -> 63 | O131: 13 | P131: 11 | Q131: =O131*6+P131 -> 89 | S131: STUART | W131: COBURG | X131: 1 | Y131: 2 | Z131: 0 | AA131: 288 | AB131: 277 | AC131: 103.97111913357401 | AD131: 4
A132: BEST PLAYERS | W132: PRAHRAN | X132: 1 | Y132: 2 | Z132: 0 | AA132: 241 | AB132: 268 | AC132: 89.925373134328353 | AD132: 4
A133: CAMBERWELL | C133: GREENWOOD | F133: MASON | I133: LASKY | L133: LAWN | N133: LUFF | Q133: O'NEILL | W133: NORTHCOTE | X133: 1 | Y133: 2 | Z133: 0 | AA133: 283 | AB133: 331 | AC133: 85.5 | AD133: 4
A134: NORTHCOTE | C134: WOODS | F134: BRAY | I134: BYRNE | L134: ROSS | N134: GRAY | Q134: HUMPHRIES | W134: BRIGHTON | X134: 1 | Y134: 2 | Z134: 0 | AA134: 206 | AB134: 276 | AC134: 74.637681159420296 | AD134: 4
A135: GOALKICKERS | Q135: COLLIMS | W135: YARRAVILLE | X135: 0 | Y135: 3 | Z135: 0 | AA135: 237 | AB135: 322 | AC135: 73.602484472049696 | AD135: 0
A136: CAMBERWELL | C136: LAWN 6 | E136: LUFF 6 | G136: MASON 3 | I136: W COFFIN 2 | L136: LASKY 2 | N136: ROWE 2 | P136: CLAMP | R136: L WILLIAMS | W136: OAKLEIGH | X136: 0 | Y136: 3 | Z136: 0 | AA136: 247 | AB136: 337 | AC136: 73.29376854599407 | AD136: 0
A137: NORTHCOTE | C137: BRAY 6 | E137: SEYMOUR 4 | H137: BYRNE 2 | J137: ROSS | W137: BRUNSWICK | X137: 0 | Y137: 3 | Z137: 0 | AA137: 182 | AB137: 327 | AC137: 55.657492354740064 | AD137: 0
A139: PRESTON | C139: 3 | D139: 8 | E139: =C139*6+D139 -> 26 | G139: 5 | H139: 8 | I139: =G139*6+H139 -> 38 | K139: 8 | L139: 13 | M139: =K139*6+L139 -> 61 | O139: 10 | P139: 16 | Q139: =O139*6+P139 -> 76 | S139: PRESTON
A140: BRIGHTON | C140: 1 | D140: 1 | E140: =C140*6+D140 -> 7 | G140: 4 | H140: 2 | I140: =G140*6+H140 -> 26 | K140: 4 | L140: 3 | M140: =K140*6+L140 -> 27 | O140: 6 | P140: 4 | Q140: =O140*6+P140 -> 40 | S140: GREGORY
A141: BEST PLAYERS
A142: PRESTON | C142: HUGHSON | F142: WARR | I142: DINEEN | L142: DOWLING | O142: F SPARGO | R142: SMITH
A143: BRIGHTON | C143: POULTER | F143: STEWART | I143: TUCKER | L143: ROSENBROCK | O143: TOMLINS | R143: HUNT
A144: GOALKICKERS
A145: PRESTON | C145: DAVIE 4 | F145: STAFFORD 2 | I145: HUGHSON | L145: WARR | N145: DINEEN | P145: DOWLING
A146: BRIGHTON | C146: GRAHAM 2 | F146: JOHNSON 2 | I146: POULTER | L146: TUCKER
A148: PRAHRAN | C148: 5 | D148: 4 | E148: =C148*6+D148 -> 34 | G148: 12 | H148: 9 | I148: =G148*6+H148 -> 81 | K148: 13 | L148: 11 | M148: =K148*6+L148 -> 89 | O148: 16 | P148: 13 | Q148: =O148*6+P148 -> 109 | S148: OAKLEIGH
A149: OAKLEIGH | C149: 1 | D149: 8 | E149: =C149*6+D149 -> 14 | G149: 3 | H149: 12 | I149: =G149*6+H149 -> 30 | K149: 6 | L149: 17 | M149: =K149*6+L149 -> 53 | O149: 10 | P149: 23 | Q149: =O149*6+P149 -> 83 | S149: McKINNON
A150: BEST PLAYERS
A151: PRAHRAN | C151: KOOP | F151: HAWKINS | I151: JORDAN | L151: WHITE | O151: MAHONEY | R151: HARRIS
A152: OAKLEIGH | C152: WITHERS | F152: DRIVER | I152: WILTSHIRE | L152: GRANT | O152: McALLISTER | R152: MUDGE
A153: GOALKICKERS
A154: PRAHRAN | C154: HAWKINS 3 | F154: GREENWOOD 3 | I154: WILLIAMS 3 | L154: WIGNELL 2 | N154: SALTER 2 | Q154: HARRIS | S154: MORLEY
A155: OAKLEIGH | C155: FRASER 5 | F155: YANN 2 | I155: RODWELL | L155: MUDGE
A157: SANDRINGHAM | C157: 6 | D157: 8 | E157: =C157*6+D157 -> 44 | G157: 9 | H157: 11 | I157: =G157*6+H157 -> 65 | K157: 14 | L157: 18 | M157: =K157*6+L157 -> 102 | O157: 16 | P157: 21 | Q157: =O157*6+P157 -> 117 | S157: BEACH ROAD
A158: YARRAVILLE | C158: 4 | D158: 2 | E158: =C158*6+D158 -> 26 | G158: 9 | H158: 4 | I158: =G158*6+H158 -> 58 | K158: 10 | L158: 7 | M158: =K158*6+L158 -> 67 | O158: 13 | P158: 14 | Q158: =O158*6+P158 -> 92 | S158: MOWLAN
A159: BEST PLAYERS
A160: SANDRINGHAM | C160: RAYMENT | F160: BECKTON | I160: THOMS | L160: E BOURKE | O160: GAMBETTA | R160: DE LUCA
A161: YARRAVILLE | C161: FORDHAM | F161: GAUDION | I161: STRETTON | L161: BRUMBY | O161: SHEEHAN | R161: CAMERON
A162: GOALKICKERS
A163: SANDRINGHAM | C163: THOMS 5 | E163: RAYMENT 3 | H163: FORBES 3 | J163: BECKTON | M163: GAMBETTA | P163: BAILES | R163: DE LUCA | U163: M BOURKE
A164: YARRAVILLE | C164: FORDHAM 7 | F164: W BUCKLEY 2 | I164: BRUMBY | L164: DRISCOLL | N164: WUNHYM | P164: DIAMOND
A166: PORT MELBOURNE | C166: 3 | D166: 4 | E166: =C166*6+D166 -> 22 | G166: 6 | H166: 5 | I166: =G166*6+H166 -> 41 | K166: 11 | L166: 10 | M166: =K166*6+L166 -> 76 | O166: 13 | P166: 12 | Q166: =O166*6+P166 -> 90 | S166: PORT MELBOURNE
A167: BRUNSWICK | C167: 2 | D167: 4 | E167: =C167*6+D167 -> 16 | G167: 3 | H167: 5 | I167: =G167*6+H167 -> 23 | K167: 5 | L167: 7 | M167: =K167*6+L167 -> 37 | O167: 7 | P167: 10 | Q167: =O167*6+P167 -> 52 | S167: GLOVER
A168: BEST PLAYERS
A169: PORT MELBOURNE | C169: PLUMRIDGE | F169: STANBRIDGE | I169: PERRETT | L169: GARBUTT | O169: BAKER | R169: HYDE
A170: BRUNSWICK | C170: THOMPSON | F170: FITZGERALD | I170: DOWLING | L170: WARDEN | O170: MUTIMER | R170: PENMAN
A171: GOALKICKERS
A172: PORT MELBOURNE | C172: LAHIFF 3 | F172: TUITE 3 | I172: BEDFORD 3 | L172: BARNES 2 | N172: WILKIN | P172: PLUMRIDGE
A173: BRUNSWICK | C173: FITZGERALD 2 | F173: CARROLL 2 | I173: W DARLINSON | L173: MUTIMER | N173: BLACKMORE
A175: ROUND 4 | E175: 14TH MAY | J175: WEATHER | M175: FINE S.E.BREEZE | S175: PLAYED AT
D176: 1ST QTR | H176: 2ND QTR | L176: 3RD QTR | P176: FINAL | S176: BEACH ROAD
A177: SANDRINGHAM | C177: 3 | D177: 5 | E177: =C177*6+D177 -> 23 | G177: 7 | H177: 9 | I177: =G177*6+H177 -> 51 | K177: 10 | L177: 13 | M177: =K177*6+L177 -> 73 | O177: 10 | P177: 13 | Q177: =O177*6+P177 -> 73 | S177: UMPIRE | X177: LADDER | AB177: ROUND | AD177: 4
A178: PORT MELBOURNE | C178: 2 | D178: 4 | E178: =C178*6+D178 -> 16 | G178: 2 | H178: 9 | I178: =G178*6+H178 -> 21 | K178: 5 | L178: 11 | M178: =K178*6+L178 -> 41 | O178: 7 | P178: 18 | Q178: =O178*6+P178 -> 60 | S178: STUART
A179: BEST PLAYERS | W179: TEAM | X179: W | Y179: L | Z179: D | AA179: FOR | AB179: AGST | AC179: % | AD179: PTS
A180: SANDRINGHAM | C180: JORDAN | F180: BECKTON | I180: RAYMENT | L180: E BOURKE | N180: DE LUCA | Q180: FORBES
A181: PORT MELBOURNE | C181: STANBRIDGE | F181: HYDE | I181: BROOKER | L181: LAHIFF | N181: GARBUTT | Q181: PERRETT | W181: CAMBERWELL | X181: 4 | Y181: 0 | Z181: 0 | AA181: 475 | AB181: 309 | AC181: 153.72168284789643 | AD181: 16
A182: GOALKICKERS | W182: PRESTON | X182: 4 | Y182: 0 | Z182: 0 | AA182: 339 | AB182: 278 | AC182: 121.94 | AD182: 16
A183: SANDRINGHAM | C183: FORBES 4 | F183: GAMBETTA 2 | I183: THOMS | L183: RAYMENT | N183: DE LUCA | Q183: M BOURKE | W183: PORT MELBOURNE | X183: 3 | Y183: 1 | Z183: 0 | AA183: 369 | AB183: 246 | AC183: 150 | AD183: 12
A184: PORT MELBOURNE | C184: LAHIFF 2 | F184: BEDFORD 2 | I184: PLUMRIDGE | L184: TUITE | N184: HYDE | W184: SANDRINGHAM | X184: 3 | Y184: 1 | Z184: 0 | AA184: 388 | AB184: 293 | AC184: 132.42320819112629 | AD184: 12
A186: NORTHCOTE | C186: 1 | D186: 10 | E186: =C186*6+D186 -> 16 | G186: 4 | H186: 12 | I186: =G186*6+H186 -> 36 | K186: 8 | L186: 12 | M186: =K186*6+L186 -> 60 | O186: 12 | P186: 14 | Q186: =O186*6+P186 -> 86 | S186: NORTHCOTE | W186: WILLIAMSTOWN | X186: 3 | Y186: 1 | Z186: 0 | AA186: 369 | AB186: 345 | AC186: 106.95652173913044 | AD186: 12
A187: WILLIAMSTOWN | C187: 3 | D187: 5 | E187: =C187*6+D187 -> 23 | G187: 4 | H187: 6 | I187: =G187*6+H187 -> 30 | K187: 5 | L187: 8 | M187: =K187*6+L187 -> 38 | O187: 7 | P187: 14 | Q187: =O187*6+P187 -> 56 | S187: GREGORY | W187: COBURG | X187: 2 | Y187: 2 | Z187: 0 | AA187: 372 | AB187: 348 | AC187: 106.89655172413794 | AD187: 8
A188: BEST PLAYERS | W188: NORTHCOTE | X188: 2 | Y188: 2 | Z188: 0 | AA188: 369 | AB188: 387 | AC188: 95.35 | AD188: 8
A189: NORTHCOTE | C189: SEYMOUR | F189: GARRETT | I189: ROSS | L189: SMITH | N189: BYRNE | Q189: BRAY | W189: PRAHRAN | X189: 1 | Y189: 3 | Z189: 0 | AA189: 337 | AB189: 377 | AC189: 89.389920424403186 | AD189: 4
A190: WILLIAMSTOWN | C190: HELLWIG | F190: BROOKS | I190: LYNCH | L190: JOHNS | N190: FLYNN | Q190: GRANT | W190: BRIGHTON | X190: 1 | Y190: 3 | Z190: 0 | AA190: 283 | AB190: 386 | AC190: 73.316062176165801 | AD190: 4
A191: GOALKICKERS | W191: BRUNSWICK | X191: 1 | Y191: 3 | Z191: 0 | AA191: 291 | AB191: 423 | AC191: 68.794326241134755 | AD191: 4
A192: NORTHCOTE | C192: SEYMOUR 8 | F192: BRAY 2 | I192: ROSS | L192: MILNE | W192: YARRAVILLE | X192: 0 | Y192: 4 | Z192: 0 | AA192: 314 | AB192: 411 | AC192: 76.399026763990264 | AD192: 0
A193: WILLIAMSTOWN | C193: GRANT 3 | F193: BYRNE 2 | I193: McGRATH | L193: SINCLAIR | W193: OAKLEIGH | X193: 0 | Y193: 4 | Z193: 0 | AA193: 318 | AB193: 421 | AC193: 75.534441805225654 | AD193: 0
A195: CAMBERWELL | C195: 6 | D195: 5 | E195: =C195*6+D195 -> 41 | G195: 9 | H195: 8 | I195: =G195*6+H195 -> 62 | K195: 13 | L195: 10 | M195: =K195*6+L195 -> 88 | O195: 16 | P195: 14 | Q195: =O195*6+P195 -> 110 | S195: ELSTERNWICK PARK
A196: BRIGHTON | C196: 2 | D196: 2 | E196: =C196*6+D196 -> 14 | G196: 4 | H196: 7 | I196: =G196*6+H196 -> 31 | K196: 8 | L196: 12 | M196: =K196*6+L196 -> 60 | O196: 10 | P196: 17 | Q196: =O196*6+P196 -> 77 | S196: SCHAEFER
A197: BEST PLAYERS
A198: CAMBERWELL | C198: MASON | F198: LASKY | I198: JONES | L198: GREENWOOD | P198: LAWN | R198: W COFFIN
A199: BRIGHTON | C199: HILL | F199: TUCKER | I199: STEWART | L199: GOULDSWORTHY | P199: HUNT | R199: TOMLINS
A200: GOALKICKERS
A201: CAMBERWELL | C201: LAWN 4 | F201: LASKY 4 | I201: LUFF 2 | K201: MASON 2 | N201: W COFFIN 2 | Q201: PETRIE | S201: R WILLIAMS
A202: BRIGHTON | C202: JOHNSON 5 | F202: TUCKER 2 | I202: POULTER | K202: HILL | N202: AVERY
A204: BRUNSWICK | C204: 5 | D204: 4 | E204: =C204*6+D204 -> 34 | G204: 11 | H204: 7 | I204: =G204*6+H204 -> 73 | K204: 12 | L204: 10 | M204: =K204*6+L204 -> 82 | O204: 16 | P204: 13 | Q204: =O204*6+P204 -> 109 | S204: BRUNSWICK
A205: PRAHRAN | C205: 4 | D205: 4 | E205: =C205*6+D205 -> 28 | G205: 6 | H205: 7 | I205: =G205*6+H205 -> 43 | K205: 10 | L205: 11 | M205: =K205*6+L205 -> 71 | O205: 14 | P205: 12 | Q205: =O205*6+P205 -> 96 | S205: McKINNON
A206: BEST PLAYERS
A207: BRUNSWICK | C207: DOWLING | F207: FITZGERALD | I207: THOMPSON | L207: EUDEY | O207: BLACKMORE | R207: CHAPMAN
A208: PRAHRAN | C208: BANKS | F208: BRUCE | I208: WHITE | L208: HAWKINS | O208: KOOP | R208: JORDAN
A209: GOALKICKERS
A210: BRUNSWICK | C210: BLACKMORE 7 | F210: DOWLING 3 | I210: FITZGERALD 2 | L210: WARDEN | O210: CARROLL | Q210: MUTIMER | S210: SMITH
A211: PRAHRAN | C211: HAWKINS 6 | F211: WILLIAMS 2 | I211: SALTER 2 | L211: GREENWOOD | O211: HARRIS | Q211: JORDAN | S211: WHITE
A213: COBURG | C213: 1 | D213: 4 | E213: =C213*6+D213 -> 10 | G213: 5 | H213: 13 | I213: =G213*6+H213 -> 43 | K213: 8 | L213: 14 | M213: =K213*6+L213 -> 62 | O213: 10 | P213: 24 | Q213: =O213*6+P213 -> 84 | S213: OAKLEIGH
A214: OAKLEIGH | C214: 3 | D214: 9 | E214: =C214*6+D214 -> 27 | G214: 6 | H214: 12 | I214: =G214*6+H214 -> 48 | K214: 9 | L214: 15 | M214: =K214*6+L214 -> 69 | O214: 9 | P214: 17 | Q214: =O214*6+P214 -> 71 | S214: NOWLAN
A215: BEST PLAYERS
A216: COBURG | C216: STOCKDALE | F216: JENKINS | I216: KIGHT | L216: BERTRAM | O216: VOIGHT | R216: BRIGGS
A217: OAKLEIGH | C217: FLEMING | F217: DRIVER | I217: McALLISTER | L217: WITHERS | O217: YANN | R217: GRANT
A218: GOALKICKERS
A219: COBURG | C219: STOCKDALE 3 | F219: BRIGGS 2 | I219: DUNCAN | K219: KIGHT | M219: BEERS | O219: GRIFFITH | Q219: LEAHY
A220: OAKLEIGH | C220: YANN 3 | F220: RODWELL 2 | I220: FLEMING 2 | L220: FRASER | N220: WILTSHIRE
A222: PRESTON | C222: 2 | D222: 2 | E222: =C222*6+D222 -> 14 | G222: 7 | H222: 6 | I222: =G222*6+H222 -> 48 | K222: 11 | L222: 7 | M222: =K222*6+L222 -> 73 | O222: 13 | P222: 11 | Q222: =O222*6+P222 -> 89 | S222: YARRAVILLE
A223: YARRAVILLE | C223: 3 | D223: 3 | E223: =C223*6+D223 -> 21 | G223: 6 | H223: 7 | I223: =G223*6+H223 -> 43 | K223: 8 | L223: 8 | M223: =K223*6+L223 -> 56 | O223: 11 | P223: 11 | Q223: =O223*6+P223 -> 77 | S223: GLOVER
A224: BEST PLAYERS
A225: PRESTON | C225: SUMMERS | F225: WARR | I225: SMITH | L225: HARDING | O225: DINEEN | R225: HUNTER
A226: YARRAVILLE | C226: WUNHYM | F226: C MILBURN | I226: PREWETT | L226: J BUCKLEY | O226: EVANS | R226: QUIGG
A227: GOALKICKERS
A228: PRESTON | C228: LANGWELL 3 | F228: DINEEN 3 | I228: WARR 2 | L228: POULTER 2 | O228: HUNTER 2 | R228: SUMMERS
A229: YARRAVILLE | C229: J BUCKLEY 4 | F229: W BUCKLEY 2 | I229: FORDHAM | L229: BRUMBY | N229: WUNHYM | Q229: DIAMOND | T229: STRATTON
A231: ROUND 5 | E231: 21ST MAY | H231: WEATHER | K231: COOL CLOUDY S BREEZE LIGHT SHOWERS | S231: PLAYED AT
D232: 1ST QTR | H232: 2ND QTR | L232: 3RD QTR | P232: FINAL | S232: WILLIAMSTOWN
A233: SANDRINGHAM | C233: 2 | D233: 3 | E233: =C233*6+D233 -> 15 | G233: 3 | H233: 3 | I233: =G233*6+H233 -> 21 | K233: 9 | L233: 4 | M233: =K233*6+L233 -> 58 | O233: 9 | P233: 9 | Q233: =O233*6+P233 -> 63 | S233: UMPIRE | X233: LADDER | AB233: ROUND | AD233: 5
A234: WILLIAMSTOWN | C234: 0 | D234: 1 | E234: =C234*6+D234 -> 1 | G234: 2 | H234: 6 | I234: =G234*6+H234 -> 18 | K234: 4 | L234: 7 | M234: =K234*6+L234 -> 31 | O234: 6 | P234: 10 | Q234: =O234*6+P234 -> 46 | S234: PRESTON
A235: BEST PLAYERS | W235: TEAM | X235: W | Y235: L | Z235: D | AA235: FOR | AB235: AGST | AC235: % | AD235: PTS
A236: SANDRINGHAM | C236: JORDAN | F236: LUNN | H236: GAMBETTA | K236: MICHAELSON | N236: RAYMENT | Q236: ANDERSON
A237: WILLIAMSTOWN | C237: SINCLAIR | F237: SYKES | H237: DREW | K237: FLYNN | N237: HELLWIG | Q237: O'BRIEN | W237: CAMBERWELL | X237: 5 | Y237: 0 | Z237: 0 | AA237: 575 | AB237: 378 | AC237: 152.11640211640213 | AD237: 20
A238: GOALKICKERS | W238: PRESTON | X238: 5 | Y238: 0 | Z238: 0 | AA238: 425 | AB238: 335 | AC238: 126.87 | AD238: 20
A239: SANDRINGHAM | C239: ANDERSON 2 | F239: BECKTON | H239: GAMBETTA | J239: THOMS | L239: DE LUCA | N239: FORBES | P239: FRICKER | R239: LUNN | W239: SANDRINGHAM | X239: 4 | Y239: 1 | Z239: 0 | AA239: 451 | AB239: 339 | AC239: 133.03834808259586 | AD239: 16
A240: WILLIAMSTOWN | C240: SINCLAIR 2 | F240: GRANT 2 | I240: BARNES | K240: CAHILL | W240: PORT MELBOURNE | X240: 3 | Y240: 2 | Z240: 0 | AA240: 431 | AB240: 324 | AC240: 133.02469135802468 | AD240: 12
A242: NORTHCOTE | C242: 1 | D242: 3 | E242: =C242*6+D242 -> 9 | G242: 6 | H242: 9 | I242: =G242*6+H242 -> 45 | K242: 10 | L242: 12 | M242: =K242*6+L242 -> 72 | O242: 10 | P242: 18 | Q242: =O242*6+P242 -> 78 | S242: PORT MELBOURNE | W242: COBURG | X242: 3 | Y242: 2 | Z242: 0 | AA242: 457 | AB242: 388 | AC242: 117.78350515463917 | AD242: 12
A243: PORT MELBOURNE | C243: 5 | D243: 3 | E243: =C243*6+D243 -> 33 | G243: 7 | H243: 3 | I243: =G243*6+H243 -> 45 | K243: 9 | L243: 5 | M243: =K243*6+L243 -> 59 | O243: 9 | P243: 8 | Q243: =O243*6+P243 -> 62 | S243: McKINNON | W243: WILLIAMSTOWN | X243: 3 | Y243: 2 | Z243: 0 | AA243: 415 | AB243: 408 | AC243: 101.71568627450981 | AD243: 12
A244: BEST PLAYERS | W244: NORTHCOTE | X244: 3 | Y244: 2 | Z244: 0 | AA244: 447 | AB244: 449 | AC244: 99.55 | AD244: 12
A245: NORTHCOTE | C245: ROSS | E245: WOODS | H245: McSWAIN | K245: ROWE | N245: SIMMONDS | Q245: CORRIGAN | W245: PRAHRAN | X245: 2 | Y245: 3 | Z245: 0 | AA245: 447 | AB245: 469 | AC245: 95.309168443496802 | AD245: 8
A246: PORT MELBOURNE | C246: HYDE | E246: SING | H246: PERRETT | K246: LAHIFF | N246: GARBUTT | Q246: STANBRIDGE | W246: BRUNSWICK | X246: 1 | Y246: 4 | Z246: 0 | AA246: 360 | AB246: 523 | AC246: 68.833652007648183 | AD246: 4
A247: GOALKICKERS | W247: BRIGHTON | X247: 1 | Y247: 4 | Z247: 0 | AA247: 323 | AB247: 471 | AC247: 68.57749469214437 | AD247: 4
A248: NORTHCOTE | C248: SEYMOUR 3 | F248: COLE 2 | I248: SIMMONDS 2 | L248: BYRNE | N248: BRAY | P248: ROWE | W248: YARRAVILLE | X248: 0 | Y248: 5 | Z248: 0 | AA248: 406 | AB248: 521 | AC248: 77.927063339731291 | AD248: 0
A249: PORT MELBOURNE | C249: SING 4 | F249: BARNES 2 | I249: TUITE | K249: W PERRETT | N249: POWER | W249: OAKLEIGH | X249: 0 | Y249: 5 | Z249: 0 | AA249: 375 | AB249: 507 | AC249: 73.964497041420117 | AD249: 0
A251: COBURG | C251: 3 | D251: 6 | E251: =C251*6+D251 -> 24 | G251: 5 | H251: 7 | I251: =G251*6+H251 -> 37 | K251: 9 | L251: 11 | M251: =K251*6+L251 -> 65 | O251: 12 | P251: 13 | Q251: =O251*6+P251 -> 85 | S251: COBURG
A252: BRIGHTON | C252: 1 | D252: 0 | E252: =C252*6+D252 -> 6 | G252: 5 | H252: 2 | I252: =G252*6+H252 -> 32 | K252: 5 | L252: 2 | M252: =K252*6+L252 -> 32 | O252: 6 | P252: 4 | Q252: =O252*6+P252 -> 40 | S252: SCHAEFER
A253: BEST PLAYERS
A254: COBURG | C254: JENKINS | F254: WILLOX | I254: MARTON | L254: WATSON | N254: LEAHY | Q254: GREGORY
A255: BRIGHTON | C255: LILBURNE | F255: TUCKER | I255: GOULDSWORTHY | L255: POULTER | N255: STEWART | Q255: M JOHNSTONE
A256: GOALKICKERS
A257: COBURG | C257: BRIGGS 3 | F257: DUNCAN 2 | I257: KIGHT 2 | K257: STOCKDALE | N257: WILLOX | P257: GRIFFITHS | R257: LEAHY | T257: WATSON
A258: BRIGHTON | C258: JOHNSON 2 | F258: LILBURNE 2 | I258: TUCKER | K258: STEWART
A260: PRAHRAN | C260: 1 | D260: 4 | E260: =C260*6+D260 -> 10 | G260: 5 | H260: 12 | I260: =G260*6+H260 -> 42 | K260: 9 | L260: 14 | M260: =K260*6+L260 -> 68 | O260: 15 | P260: 20 | Q260: =O260*6+P260 -> 110 | S260: TOORAK PARK
A261: YARRAVILLE | C261: 4 | D261: 8 | E261: =C261*6+D261 -> 32 | G261: 5 | H261: 9 | I261: =G261*6+H261 -> 39 | K261: 8 | L261: 13 | M261: =K261*6+L261 -> 61 | O261: 13 | P261: 14 | Q261: =O261*6+P261 -> 92 | S261: STUART
A262: BEST PLAYERS
A263: PRAHRAN | C263: HAWKINS | F263: TABATEAU | I263: KOOP | L263: TRIM | O263: WHITE | R263: JORDAN
A264: YARRAVILLE | C264: FORDHAM | F264: BRUMBY | I264: EDWARDS | L264: WUNHYM | O264: J BUCKLEY | R264: CAMERON
A265: GOALKICKERS
A266: PRAHRAN | C266: HAWKINS 6 | F266: WELLS 3 | I266: JORDAN 2 | K266: TRIM | M266: WILLIAMS | P266: HARRIS | R266: WHITE
A267: YARRAVILLE | C267: FORDHAM 5 | F267: W BUCKLEY 2 | I267: BRUMBY 2 | L267: J BUCKLEY 2 | O267: PETERS | Q267: DIAMOND
A269: CAMBERWELL | C269: 1 | D269: 2 | E269: =C269*6+D269 -> 8 | G269: 8 | H269: 9 | I269: =G269*6+H269 -> 57 | K269: 11 | L269: 11 | M269: =K269*6+L269 -> 77 | O269: 14 | P269: 16 | Q269: =O269*6+P269 -> 100 | S269: CAMBERWELL
A270: BRUNSWICK | C270: 5 | D270: 3 | E270: =C270*6+D270 -> 33 | G270: 8 | H270: 5 | I270: =G270*6+H270 -> 53 | K270: 9 | L270: 6 | M270: =K270*6+L270 -> 60 | O270: 10 | P270: 9 | Q270: =O270*6+P270 -> 69 | S270: GLOVER
A271: BEST PLAYERS
A272: CAMBERWELL | C272: MASON | F272: GREENWOOD | I272: JONES | L272: LASKY | O272: LUFF | R272: LAWN
A273: BRUNSWICK | C273: KNOTT | F273: ROWE | I273: BRIGHT | L273: MUTIMER | O273: DOWLING | R273: FITZGERALD
A274: GOALKICKERS
A275: CAMBERWELL | C275: LUFF 5 | F275: LAWN 3 | I275: MASON 2 | K275: PETRIE 2 | M275: W COFFIN | P275: LASKY
A276: BRUNSWICK | C276: FITZGERALD 3 | F276: MUTIMER 3 | I276: CARROLL 2 | L276: SMITH | N276: R THOMPSON
A278: PRESTON | C278: 5 | D278: 7 | E278: =C278*6+D278 -> 37 | G278: 6 | H278: 8 | I278: =G278*6+H278 -> 44 | K278: 10 | L278: 13 | M278: =K278*6+L278 -> 73 | O278: 12 | P278: 14 | Q278: =O278*6+P278 -> 86 | S278: PRESTON
A279: OAKLEIGH | C279: 0 | D279: 2 | E279: =C279*6+D279 -> 2 | G279: 3 | H279: 13 | I279: =G279*6+H279 -> 31 | K279: 3 | L279: 13 | M279: =K279*6+L279 -> 31 | O279: 6 | P279: 21 | Q279: =O279*6+P279 -> 57 | S279: GREGORY
A280: BEST PLAYERS
A281: PRESTON | C281: WARR | F281: SMITH | I281: HUNTER | L281: SPARGO | O281: SUMMERS | R281: TAYLOR
A282: OAKLEIGH | C282: FLEMING | F282: DRIVER | I282: WITHERS | L282: WATSON | O282: RODWELL | R282: SPAIN
A283: GOALKICKERS
A284: PRESTON | C284: DAVIE 4 | F284: DINEEN 2 | I284: WALSH 2 | L284: LANGWELL | O284: HUNTER | Q284: OWENS | S284: BIRD
A285: OAKLEIGH | C285: FLEMING 2 | F285: DENNING | I285: RODWELL | L285: SPAIN | N285: AMES
A287: ROUND 6 | E287: 28TH MAY | J287: WEATHER | M287: FINE MILD NORTH BREEZE | S287: PLAYED AT
D288: 1ST QTR | H288: 2ND QTR | L288: 3RD QTR | P288: FINAL | S288: CAMBERWELL
A289: CAMBERWELL | C289: 3 | D289: 9 | E289: =C289*6+D289 -> 27 | G289: 9 | H289: 13 | I289: =G289*6+H289 -> 67 | K289: 15 | L289: 18 | M289: =K289*6+L289 -> 108 | O289: 17 | P289: 20 | Q289: =O289*6+P289 -> 122 | S289: UMPIRE | X289: LADDER | AB289: ROUND | AD289: 6
A290: PRESTON | C290: 2 | D290: 2 | E290: =C290*6+D290 -> 14 | G290: 4 | H290: 5 | I290: =G290*6+H290 -> 29 | K290: 5 | L290: 10 | M290: =K290*6+L290 -> 40 | O290: 7 | P290: 14 | Q290: =O290*6+P290 -> 56 | S290: STUART
A291: BEST PLAYERS | W291: TEAM | X291: W | Y291: L | Z291: D | AA291: FOR | AB291: AGST | AC291: % | AD291: PTS
A292: CAMBERWELL | C292: GREENWOOD | F292: LAWN | I292: LUFF | L292: COLLINS | N292: R WILLIAMS | Q292: JONES
A293: PRESTON | C293: WARR | F293: POULTER | I293: MONOHAN | L293: REICHMAN | N293: MOONEY | Q293: SPARGO | W293: CAMBERWELL | X293: 6 | Y293: 0 | Z293: 0 | AA293: 697 | AB293: 434 | AC293: 160.59907834101384 | AD293: 24
A294: GOALKICKERS | W294: SANDRINGHAM | X294: 5 | Y294: 1 | Z294: 0 | AA294: 566 | AB294: 453 | AC294: 124.9448123620309 | AD294: 20
A295: CAMBERWELL | C295: LUFF 9 | F295: LAWN 2 | I295: W COFFIN 2 | L295: PETRIE 2 | N295: COLLINS 2 | W295: PRESTON | X295: 5 | Y295: 1 | Z295: 0 | AA295: 481 | AB295: 457 | AC295: 105.25 | AD295: 20
A296: PRESTON | C296: WARR 3 | F296: LANGWELL 2 | I296: SUMMERS | L296: POULTER | W296: PORT MELBOURNE | X296: 4 | Y296: 2 | Z296: 0 | AA296: 502 | AB296: 392 | AC296: 128.0612244897959 | AD296: 16
A298: SANDRINGHAM | C298: 5 | D298: 4 | E298: =C298*6+D298 -> 34 | G298: 7 | H298: 12 | I298: =G298*6+H298 -> 54 | K298: 12 | L298: 15 | M298: =K298*6+L298 -> 87 | O298: 16 | P298: 19 | Q298: =O298*6+P298 -> 115 | S298: BEACH ROAD | W298: NORTHCOTE | X298: 4 | Y298: 2 | Z298: 0 | AA298: 600 | AB298: 515 | AC298: 116.5 | AD298: 16
A299: COBURG | C299: 5 | D299: 6 | E299: =C299*6+D299 -> 36 | G299: 8 | H299: 9 | I299: =G299*6+H299 -> 57 | K299: 13 | L299: 11 | M299: =K299*6+L299 -> 89 | O299: 16 | P299: 18 | Q299: =O299*6+P299 -> 114 | S299: NOWLAN | W299: COBURG | X299: 3 | Y299: 3 | Z299: 0 | AA299: 571 | AB299: 503 | AC299: 113.51888667992047 | AD299: 12
A300: BEST PLAYERS | W300: PRAHRAN | X300: 3 | Y300: 3 | Z300: 0 | AA300: 543 | AB300: 533 | AC300: 101.87617260787992 | AD300: 12
A301: SANDRINGHAM | C301: YEMM | F301: FITZGERALD | I301: RAYMENT | L301: BECKTON | N301: DE LUCA | Q301: YOUNG | W301: WILLIAMSTOWN | X301: 3 | Y301: 3 | Z301: 0 | AA301: 483 | AB301: 479 | AC301: 100.83507306889352 | AD301: 12
A302: COBURG | C302: MARTIN | F302: BERTRAM | I302: BRIGGS | L302: JENKINS | N302: WILLOX | Q302: STOCKDALE | W302: OAKLEIGH | X302: 1 | Y302: 5 | Z302: 0 | AA302: 485 | AB302: 579 | AC302: 83.765112262521583 | AD302: 4
A303: GOALKICKERS | W303: BRIGHTON | X303: 1 | Y303: 5 | Z303: 0 | AA303: 387 | AB303: 567 | AC303: 68.253968253968253 | AD303: 4
A304: SANDRINGHAM | C304: DE LUCA 6 | E304: BECKTON 2 | H304: RAYMENT 2 | K304: FORBES 2 | M304: MILBURN | O304: M BOURKE | R304: DOREY | T304: THOMS | W304: BRUNSWICK | X304: 1 | Y304: 5 | Z304: 0 | AA304: 426 | AB304: 676 | AC304: 63.017751479289942 | AD304: 4
A305: COBURG | C305: STOCKDALE 5 | F305: WILLOX 5 | I305: BRIGGS 2 | K305: HARRIS 2 | M305: WATSON | O305: VOIGHT | W305: YARRAVILLE | X305: 0 | Y305: 6 | Z305: 0 | AA305: 478 | AB305: 631 | AC305: 75.752773375594302 | AD305: 0
A307: PORT MELBOURNE | C307: 1 | D307: 2 | E307: =C307*6+D307 -> 8 | G307: 6 | H307: 7 | I307: =G307*6+H307 -> 43 | K307: 7 | L307: 8 | M307: =K307*6+L307 -> 50 | O307: 10 | P307: 11 | Q307: =O307*6+P307 -> 71 | S307: WILLIAMSTOWN
A308: WILLIAMSTOWN | C308: 4 | D308: 5 | E308: =C308*6+D308 -> 29 | G308: 6 | H308: 5 | I308: =G308*6+H308 -> 41 | K308: 7 | L308: 11 | M308: =K308*6+L308 -> 53 | O308: 9 | P308: 14 | Q308: =O308*6+P308 -> 68 | S308: SCHAEFER
A309: BEST PLAYERS
A310: PORT MELBOURNE | C310: E PERRETT | F310: HARRISON | I310: BUCKLEY | L310: HYDE | O310: POWER | Q310: SING
A311: WILLIAMSTOWN | C311: HELLWIG | F311: LYNCH | I311: WILLIAMSON | L311: WALSH | O311: SYKES | Q311: CAHILL
A312: GOALKICKERS
A313: PORT MELBOURNE | C313: BEDFORD 2 | F313: E PERRETT 2 | I313: BUCKLEY 2 | L313: SING | M313: POWER | O313: STANBRIDGE | R313: MURPHY
A314: WILLIAMSTOWN | C314: HELWIG 3 | F314: BYRNE | H314: McGRATH | J314: BARNES | L314: SINCLAIR | N314: GRANT | P314: CAHILL
A316: NORTHCOTE | C316: 5 | D316: 3 | E316: =C316*6+D316 -> 33 | G316: 12 | H316: 8 | I316: =G316*6+H316 -> 80 | K316: 17 | L316: 11 | M316: =K316*6+L316 -> 113 | O316: 23 | P316: 15 | Q316: =O316*6+P316 -> 153 | S316: NORTHCOTE
A317: BRUNSWICK | C317: 3 | D317: 1 | E317: =C317*6+D317 -> 19 | G317: 7 | H317: 5 | I317: =G317*6+H317 -> 47 | K317: 9 | L317: 6 | M317: =K317*6+L317 -> 60 | O317: 10 | P317: 6 | Q317: =O317*6+P317 -> 66 | S317: FIRBECK
A318: BEST PLAYERS
A319: NORTHCOTE | C319: ROSS | F319: HART | I319: SEYMOUR | L319: GOULLET | O319: CORRIGAN | R319: SMITH
A320: BRUNSWICK | C320: MUTIMER | F320: THOMPSON | I320: BLACKMORE | L320: CHAPMAN | O320: BRIGHT | R320: WOODS
A321: GOALKICKERS
A322: NORTHCOTE | C322: SEYMOUR 10 | F322: ROSS 4 | I322: COLE 3 | K322: GRAY | M322: GOULLET | O322: BRAY | Q322: MILNE | S322: POWELL | V322: BYRNE
A323: BRUNSWICK | C323: CHAPMAN 3 | F323: CARROLL 2 | I323: MUTIMER 2 | L323: BRANSTON 2 | O323: FITZGERALD
A325: PRAHRAN | C325: 2 | D325: 4 | E325: =C325*6+D325 -> 16 | G325: 6 | H325: 11 | I325: =G325*6+H325 -> 47 | K325: 9 | L325: 19 | M325: =K325*6+L325 -> 73 | O325: 12 | P325: 24 | Q325: =O325*6+P325 -> 96 | S325: ELSTERNWICK PARK
A326: BRIGHTON | C326: 2 | D326: 4 | E326: =C326*6+D326 -> 16 | G326: 3 | H326: 7 | I326: =G326*6+H326 -> 25 | K326: 5 | L326: 13 | M326: =K326*6+L326 -> 43 | O326: 8 | P326: 16 | Q326: =O326*6+P326 -> 64 | S326: McINERNEY
A327: BEST PLAYERS
A328: PRAHRAN | C328: JORDAN | F328: HAWKINS | I328: SALTER | L328: MAHONEY | O328: WILLIAMS | R328: KOOP
A329: BRIGHTON | C329: LILBURNE | F329: HILL | I329: HUNT | L329: POULTER | O329: WILKINS | R329: CAMPBELL
A330: GOALKICKERS
A331: PRAHRAN | C331: JORDAN 3 | F331: HAWKINS 2 | I331: WILLIAMS 2 | L331: WELLS 2 | N331: TRIM | P331: SALTER | R331: MAHONEY
A332: BRIGHTON | C332: JOHNSON 5 | F332: POULTER | I332: HILL | K332: CLOTZ
A334: OAKLEIGH | C334: 1 | D334: 5 | E334: =C334*6+D334 -> 11 | G334: 6 | H334: 11 | I334: =G334*6+H334 -> 47 | K334: 10 | L334: 15 | M334: =K334*6+L334 -> 75 | O334: 15 | P334: 20 | Q334: =O334*6+P334 -> 110 | S334: OAKLEIGH
A335: YARRAVILLE | C335: 2 | D335: 5 | E335: =C335*6+D335 -> 17 | G335: 5 | H335: 8 | I335: =G335*6+H335 -> 38 | K335: 6 | L335: 10 | M335: =K335*6+L335 -> 46 | O335: 10 | P335: 12 | Q335: =O335*6+P335 -> 72 | S335: McKINNON
A336: BEST PLAYERS
A337: OAKLEIGH | C337: SPAIN | F337: SMITH | I337: FRASER | L337: RODWELL | O337: MUDGE | R337: FLEMING
A338: YARRAVILLE | C338: CAMERON | F338: WUNHYM | I338: L JONES | L338: FORDHAM | O338: SHEEHAN | R338: BRUMBY
A339: GOALKICKERS
A340: OAKLEIGH | C340: FRASER 6 | F340: RODWELL 2 | I340: SPAIN 2 | K340: AMES 2 | M340: BERNARD 2 | P340: FLEMING
A341: YARRAVILLE | C341: FORDHAM 4 | F341: W BUCKLEY 2 | I341: BRUMBY 2 | L341: QUIGG | N341: PREWETT
A343: ROUND 7 | E343: 4TH JUNE | H343: WEATHER | K343: COLD CLOUDY S.W. BREEZE SOME SHOWERS | S343: PLAYED AT
D344: 1ST QTR | H344: 2ND QTR | L344: 3RD QTR | P344: FINAL | S344: PRESTON
A345: PORT MELBOURNE | C345: 4 | D345: 3 | E345: =C345*6+D345 -> 27 | G345: 8 | H345: 4 | I345: =G345*6+H345 -> 52 | K345: 11 | L345: 8 | M345: =K345*6+L345 -> 74 | O345: 14 | P345: 11 | Q345: =O345*6+P345 -> 95 | S345: UMPIRE | X345: LADDER | AB345: ROUND | AD345: 7
A346: PRESTON | C346: 3 | D346: 5 | E346: =C346*6+D346 -> 23 | G346: 8 | H346: 9 | I346: =G346*6+H346 -> 57 | K346: 9 | L346: 15 | M346: =K346*6+L346 -> 69 | O346: 12 | P346: 17 | Q346: =O346*6+P346 -> 89 | S346: McINERNEY
A347: BEST PLAYERS | W347: TEAM | X347: W | Y347: L | Z347: D | AA347: FOR | AB347: AGST | AC347: % | AD347: PTS
A348: PORT MELBOURNE | C348: STANBRIDGE | F348: BEDFORD | I348: PLUMRIDGE | L348: BROOKER | N348: SING | Q348: BUCKLEY
A349: PRESTON | C349: SMITH | F349: POULTER | I349: WARR | L349: GRIERSON | N349: MONOHAN | Q349: MOONEY | W349: CAMBERWELL | X349: 7 | Y349: 0 | Z349: 0 | AA349: 763 | AB349: 488 | AC349: 156.35245901639345 | AD349: 28
A350: GOALKICKERS | P350: BROOKER | W350: SANDRINGHAM | X350: 6 | Y350: 1 | Z350: 0 | AA350: 658 | AB350: 525 | AC350: 125.33333333333333 | AD350: 24
A351: PORT MELBOURNE | C351: BEDFORD 4 | F351: PLUMRIDGE 3 | I351: BUCKLEY 2 | L351: POWER | N351: W PERRETT | Q351: LOVETT | S351: SING | W351: PORT MELBOURNE | X351: 5 | Y351: 2 | Z351: 0 | AA351: 597 | AB351: 481 | AC351: 124.11642411642411 | AD351: 20
A352: PRESTON | C352: WARR 5 | F352: GRIERSON 4 | I352: HARDING 2 | L352: DAVIE | W352: PRESTON | X352: 5 | Y352: 2 | Z352: 0 | AA352: 570 | AB352: 552 | AC352: 103.26 | AD352: 20
A354: COBURG | C354: 3 | D354: 3 | E354: =C354*6+D354 -> 21 | G354: 8 | H354: 5 | I354: =G354*6+H354 -> 53 | K354: 9 | L354: 9 | M354: =K354*6+L354 -> 63 | O354: 12 | P354: 12 | Q354: =O354*6+P354 -> 84 | S354: COBURG | W354: COBURG | X354: 4 | Y354: 3 | Z354: 0 | AA354: 655 | AB354: 569 | AC354: 115.11423550087873 | AD354: 16
A355: NORTHCOTE | C355: 3 | D355: 2 | E355: =C355*6+D355 -> 20 | G355: 6 | H355: 7 | I355: =G355*6+H355 -> 43 | K355: 7 | L355: 12 | M355: =K355*6+L355 -> 54 | O355: 9 | P355: 12 | Q355: =O355*6+P355 -> 66 | S355: STUART | W355: NORTHCOTE | X355: 4 | Y355: 3 | Z355: 0 | AA355: 666 | AB355: 599 | AC355: 111.19 | AD355: 16
A356: BEST PLAYERS | W356: WILLIAMSTOWN | X356: 3 | Y356: 4 | Z356: 0 | AA356: 537 | AB356: 545 | AC356: 98.532110091743121 | AD356: 12
A357: COBURG | C357: UHE | E357: MARSHALL | H357: DUNCAN | K357: BRIGGS | N357: ROGERS | Q357: LEAHY | W357: PRAHRAN | X357: 3 | Y357: 4 | Z357: 0 | AA357: 615 | AB357: 625 | AC357: 98.4 | AD357: 12
A358: NORTHCOTE | C358: WOODS | E358: CORRIGAN | H358: ROSS | K358: SMITH | N358: GOULLET | Q358: HUMPHRIES | W358: BRIGHTON | X358: 2 | Y358: 5 | Z358: 0 | AA358: 481 | AB358: 654 | AC358: 73.547400611620802 | AD358: 8
A359: GOALKICKERS | W359: BRUNSWICK | X359: 2 | Y359: 5 | Z359: 0 | AA359: 504 | AB359: 745 | AC359: 67.651006711409394 | AD359: 8
A360: COBURG | C360: BRIGGS 4 | F360: DUNCAN 3 | I360: STOCKDALE 2 | L360: KIGHT | N360: LOWE | P360: ROGERS | W360: OAKLEIGH | X360: 1 | Y360: 6 | Z360: 0 | AA360: 554 | AB360: 657 | AC360: 84.322678843226782 | AD360: 4
A361: NORTHCOTE | C361: SEYMOUR 5 | F361: GOULLET 2 | I361: COLE | L361: BRAY | W361: YARRAVILLE | X361: 0 | Y361: 7 | Z361: 0 | AA361: 565 | AB361: 725 | AC361: 77.931034482758619 | AD361: 0
A363: SANDRINGHAM | C363: 3 | D363: 6 | E363: =C363*6+D363 -> 24 | G363: 6 | H363: 9 | I363: =G363*6+H363 -> 45 | K363: 11 | L363: 11 | M363: =K363*6+L363 -> 77 | O363: 13 | P363: 14 | Q363: =O363*6+P363 -> 92 | S363: BEACH ROAD
A364: PRAHRAN | C364: 3 | D364: 3 | E364: =C364*6+D364 -> 21 | G364: 4 | H364: 7 | I364: =G364*6+H364 -> 31 | K364: 7 | L364: 10 | M364: =K364*6+L364 -> 52 | O364: 10 | P364: 12 | Q364: =O364*6+P364 -> 72 | S364: ASHMORE
A365: BEST PLAYERS
A366: SANDRINGHAM | C366: BECKTON | F366: YOUNG | I366: FITZGERALD | M366: RAYMENT | P366: FRICKER | S366: E BOURKE
A367: PRAHRAN | C367: BRUCE | F367: TRIM | I367: JORDAN | M367: SALTER | P367: WHITE | S367: KOOP
A368: GOALKICKERS
A369: SANDRINGHAM | C369: BECKTON 3 | F369: FORBES 3 | I369: THOMS 2 | K369: RAYMENT 2 | N369: BAILES | P369: DE LUCA | R369: JAMIESON
A370: PRAHRAN | C370: HAWKINS 3 | F370: JORDAN 2 | I370: TRIM | K370: HARRIS | M370: WELLS | O370: RENNIE | Q370: FARNAN
A372: BRUNSWICK | C372: 2 | D372: 3 | E372: =C372*6+D372 -> 15 | G372: 7 | H372: 8 | I372: =G372*6+H372 -> 50 | K372: 7 | L372: 10 | M372: =K372*6+L372 -> 52 | O372: 10 | P372: 18 | Q372: =O372*6+P372 -> 78 | S372: BRUNSWICK
A373: OAKLEIGH | C373: 6 | D373: 5 | E373: =C373*6+D373 -> 41 | G373: 8 | H373: 5 | I373: =G373*6+H373 -> 53 | K373: 9 | L373: 6 | M373: =K373*6+L373 -> 60 | O373: 10 | P373: 9 | Q373: =O373*6+P373 -> 69 | S373: NOWLAN
A374: BEST PLAYERS
A375: BRUNSWICK | C375: MUTIMER | F375: JONES | I375: ANDERSON | M375: WOODS | P375: FOLEY | S375: WHITELEY
A376: OAKLEIGH | C376: WITHERS | F376: FLEMING | I376: DRIVER | M376: CHESSWASS | P376: FRASER | S376: AMES
A377: GOALKICKERS
A378: BRUNSWICK | C378: JONES 3 | E378: FITZGERALD 2 | H378: PENMAN | J378: KNOTT | L378: DOWLING | N378: MUTIMER | Q378: McNEILL
A379: OAKLEIGH | C379: FRASER 3 | E379: AMES 2 | G379: YANN | I379: FLEMING | K379: BERNARD | M379: CRAMERI | O379: STEW SMITH
A381: BRIGHTON | C381: 3 | D381: 7 | E381: =C381*6+D381 -> 25 | G381: 5 | H381: 12 | I381: =G381*6+H381 -> 42 | K381: 9 | L381: 21 | M381: =K381*6+L381 -> 75 | O381: 11 | P381: 28 | Q381: =O381*6+P381 -> 94 | S381: YARRAVILLE
A382: YARRAVILLE | C382: 2 | D382: 1 | E382: =C382*6+D382 -> 13 | G382: 6 | H382: 9 | I382: =G382*6+H382 -> 45 | K382: 8 | L382: 10 | M382: =K382*6+L382 -> 58 | O382: 12 | P382: 15 | Q382: =O382*6+P382 -> 87 | S382: LESTER
A383: BEST PLAYERS
A384: BRIGHTON | C384: H JOHNSON | F384: HUNT | I384: POULTER | L384: STEWART | O384: WILKINS | R384: T JOHNSON
A385: YARRAVILLE | C385: CAMERON | F385: FULLWOOD | I385: W BUCKLEY | L385: PREWETT | O385: FORDHAM | R385: BRUMBY
A386: GOALKICKERS
A387: BRIGHTON | C387: JOHNSON 6 | F387: POULTER 2 | I387: HILL | K387: BESTWICK | M387: CANTWELL
A388: YARRAVILLE | C388: W BUCKLEY 3 | F388: BRUMBY 3 | I388: PREWETT 2 | L388: SHEEHAN 2 | O388: JONES | Q388: EVANS
A390: CAMBERWELL | C390: 5 | D390: 3 | E390: =C390*6+D390 -> 33 | G390: 5 | H390: 3 | I390: =G390*6+H390 -> 33 | K390: 7 | L390: 7 | M390: =K390*6+L390 -> 49 | O390: 9 | P390: 12 | Q390: =O390*6+P390 -> 66 | S390: WILLIAMSTOWN
A391: WILLIAMSTOWN | C391: 1 | D391: 3 | E391: =C391*6+D391 -> 9 | G391: 5 | H391: 7 | I391: =G391*6+H391 -> 37 | K391: 5 | L391: 9 | M391: =K391*6+L391 -> 39 | O391: 7 | P391: 12 | Q391: =O391*6+P391 -> 54 | S391: MCKINNON
A392: BEST PLAYERS
A393: CAMBERWELL | C393: MASON | F393: ROWE | I393: H JONES | L393: O'NEILL | O393: HENDERSON | R393: LASKY
A394: WILLIAMSTOWN | C394: HELLWIG | F394: DREW | I394: BYRNE | L394: SINCLAIR | O394: BLAKE | R394: CUTTING
A395: GOALKICKERS
A396: CAMBERWELL | C396: MASON 3 | F396: LUFF 2 | I396: PIERCE 2 | L396: ROWE | N396: CLAMP
A397: WILLIAMSTOWN | C397: BLAKE | E397: BYRNE | G397: HELWIG | I397: L DREW | K397: SINCLAIR | M397: CAHILL | O397: WALSH
A399: ROUND 8 | E399: 11TH JUNE | J399: WEATHER | M399: FINE NORTH BREEZE | S399: PLAYED AT
D400: 1ST QTR | H400: 2ND QTR | L400: 3RD QTR | P400: FINAL | S400: BEACH ROAD
A401: SANDRINGHAM | C401: 6 | D401: 5 | E401: =C401*6+D401 -> 41 | G401: 8 | H401: 7 | I401: =G401*6+H401 -> 55 | K401: 13 | L401: 12 | M401: =K401*6+L401 -> 90 | O401: 15 | P401: 15 | Q401: =O401*6+P401 -> 105 | S401: UMPIRE | X401: LADDER | AB401: ROUND | AD401: 8
A402: CAMBERWELL | C402: 3 | D402: 1 | E402: =C402*6+D402 -> 19 | G402: 10 | H402: 5 | I402: =G402*6+H402 -> 65 | K402: 10 | L402: 6 | M402: =K402*6+L402 -> 66 | O402: 15 | P402: 7 | Q402: =O402*6+P402 -> 97 | S402: McKINNON
A403: BEST PLAYERS | W403: TEAM | X403: W | Y403: L | Z403: D | AA403: FOR | AB403: AGST | AC403: % | AD403: PTS
A404: SANDRINGHAM | C404: YEMM | E404: BECKTON | H404: DE LUCA | J404: ANDERSON | M404: FITZGERALD | Q404: RAYMENT
A405: CAMBERWELL | C405: JONES | E405: ELLIOTT | H405: PETRIE | J405: MASON | M405: HENDERSON | Q405: LUFF | W405: CAMBERWELL | X405: 7 | Y405: 1 | Z405: 0 | AA405: 860 | AB405: 593 | AC405: 145.02529510961213 | AD405: 28
A406: GOALKICKERS | N406: FORBES | P406: ANDERSON | S406: YEMM | W406: SANDRINGHAM | X406: 7 | Y406: 1 | Z406: 0 | AA406: 763 | AB406: 622 | AC406: 122.66881028938907 | AD406: 28
A407: SANDRINGHAM | C407: THOMS 4 | E407: FITZGERALD 2 | H407: M BOURKE 2 | K407: BECKTON | M407: GAMBETTA | P407: RAYMENT | R407: DE LUCA | W407: PORT MELBOURNE | X407: 6 | Y407: 2 | Z407: 0 | AA407: 666 | AB407: 505 | AC407: 131.88118811881188 | AD407: 24
A408: CAMBERWELL | C408: LUFF 4 | E408: LAWN 2 | G408: MASON 2 | I408: PETRIE 2 | K408: W COFFIN | M408: LASKY | O408: ROWE | Q408: COLLINS | S408: PIERCE | W408: COBURG | X408: 5 | Y408: 3 | Z408: 0 | AA408: 771 | AB408: 649 | AC408: 118.79815100154083 | AD408: 20
A410: COBURG | C410: 2 | D410: 3 | E410: =C410*6+D410 -> 15 | G410: 7 | H410: 6 | I410: =G410*6+H410 -> 48 | K410: 10 | L410: 9 | M410: =K410*6+L410 -> 69 | O410: 17 | P410: 14 | Q410: =O410*6+P410 -> 116 | S410: TOORAK PARK | W410: NORTHCOTE | X410: 5 | Y410: 3 | Z410: 0 | AA410: 762 | AB410: 670 | AC410: 113.73 | AD410: 20
A411: PRAHRAN | C411: 3 | D411: 1 | E411: =C411*6+D411 -> 19 | G411: 5 | H411: 2 | I411: =G411*6+H411 -> 32 | K411: 7 | L411: 7 | M411: =K411*6+L411 -> 49 | O411: 12 | P411: 8 | Q411: =O411*6+P411 -> 80 | S411: LESTER | W411: PRESTON | X411: 5 | Y411: 3 | Z411: 0 | AA411: 638 | AB411: 655 | AC411: 97.4 | AD411: 20
A412: BEST PLAYERS | W412: WILLIAMSTOWN | X412: 4 | Y412: 4 | Z412: 0 | AA412: 621 | AB412: 613 | AC412: 101.30505709624796 | AD412: 16
A413: COBURG | C413: JENKINS | E413: MARTIN | H413: ROGERS | K413: BRIGGS | N413: STOCKDALE | Q413: HARRIS | W413: PRAHRAN | X413: 3 | Y413: 5 | Z413: 0 | AA413: 695 | AB413: 741 | AC413: 93.792172739541158 | AD413: 12
A414: PRAHRAN | C414: BRUCE | E414: BANKS | H414: HAWKINS | K414: THOMPSON | N414: JORDAN | Q414: FOSTER | W414: BRUNSWICK | X414: 3 | Y414: 5 | Z414: 0 | AA414: 607 | AB414: 813 | AC414: 74.661746617466179 | AD414: 12
A415: GOALKICKERS | W415: BRIGHTON | X415: 2 | Y415: 6 | Z415: 0 | AA415: 549 | AB415: 738 | AC415: 74.390243902439025 | AD415: 8
A416: COBURG | C416: BRIGGS 5 | E416: STOCKDALE 4 | H416: WILLOX 2 | J416: ROGERS 2 | M416: DUNCAN | O416: JENKINS | Q416: LOWE | R416: VOIGHT | W416: OAKLEIGH | X416: 1 | Y416: 7 | Z416: 0 | AA416: 578 | AB416: 726 | AC416: 79.614325068870528 | AD416: 4
A417: PRAHRAN | C417: JORDAN 4 | F417: HAWKINS 3 | I417: WELLS 2 | K417: SALTER | M417: SMITH | O417: BANKS | W417: YARRAVILLE | X417: 0 | Y417: 8 | Z417: 0 | AA417: 636 | AB417: 821 | AC417: 77.466504263093782 | AD417: 0
A419: WILLIAMSTOWN | C419: 3 | D419: 6 | E419: =C419*6+D419 -> 24 | G419: 7 | H419: 9 | I419: =G419*6+H419 -> 51 | K419: 9 | L419: 17 | M419: =K419*6+L419 -> 71 | O419: 11 | P419: 18 | Q419: =O419*6+P419 -> 84 | S419: ELSTERNWICK PARK
A420: BRIGHTON | C420: 2 | D420: 0 | E420: =C420*6+D420 -> 12 | G420: 7 | H420: 5 | I420: =G420*6+H420 -> 47 | K420: 7 | L420: 7 | M420: =K420*6+L420 -> 49 | O420: 9 | P420: 14 | Q420: =O420*6+P420 -> 68 | S420: STUART
A421: BEST PLAYERS
A422: WILLIAMSTOWN | C422: LYNCH | F422: SINCLAIR | I422: CAHILL | L422: BARNES | N422: WILLIAMSON | Q422: DREW
A423: BRIGHTON | C423: McLEAN | F423: WILKINS | I423: H JOHNSON | L423: HUNT | N423: CAMPBELL | Q423: TUCKER
A424: GOALKICKERS
A425: WILLIAMSTOWN | C425: CAHILL 3 | F425: McGRATH 2 | I425: SINCLAIR 2 | L425: GRANT 2 | N425: BARNES | P425: DELLER
A426: BRIGHTON | C426: JOHNSON 5 | F426: POULTER | I426: TUCKER | L426: STEWART | N426: McLEAN
A428: NORTHCOTE | C428: 6 | D428: 7 | E428: =C428*6+D428 -> 43 | G428: 7 | H428: 10 | I428: =G428*6+H428 -> 52 | K428: 10 | L428: 11 | M428: =K428*6+L428 -> 71 | O428: 14 | P428: 12 | Q428: =O428*6+P428 -> 96 | S428: YARRAVILLE
A429: YARRAVILLE | C429: 1 | D429: 3 | E429: =C429*6+D429 -> 9 | G429: 1 | H429: 8 | I429: =G429*6+H429 -> 14 | K429: 2 | L429: 11 | M429: =K429*6+L429 -> 23 | O429: 9 | P429: 17 | Q429: =O429*6+P429 -> 71 | S429: BORLAND
A430: BEST PLAYERS
A431: NORTHCOTE | C431: PERKINS | F431: ROSS | I431: HUMPHRIES | L431: ROWE | N431: McSWAIN | Q431: BYRNE
A432: YARRAVILLE | C432: PETERS | F432: WUNHYM | I432: QUIGG | L432: BRUMBY | N432: J BUCKLEY | Q432: MILBURN
A433: GOALKICKERS
A434: NORTHCOTE | C434: SEYMOUR 4 | F434: HUMPHRIES 4 | I434: BYRNE 2 | K434: BRAY 2 | M434: WILLIAMSON 2
A435: YARRAVILLE | C435: J BUCKLEY 5 | F435: WUNHYM | I435: PETERS | K435: QUIGG
A437: BRUNSWICK | C437: 5 | D437: 1 | E437: =C437*6+D437 -> 31 | G437: 7 | H437: 11 | I437: =G437*6+H437 -> 53 | K437: 12 | L437: 17 | M437: =K437*6+L437 -> 89 | O437: 14 | P437: 19 | Q437: =O437*6+P437 -> 103 | S437: BRUNSWICK
A438: PRESTON | C438: 3 | D438: 6 | E438: =C438*6+D438 -> 24 | G438: 3 | H438: 6 | I438: =G438*6+H438 -> 24 | K438: 6 | L438: 9 | M438: =K438*6+L438 -> 45 | O438: 9 | P438: 14 | Q438: =O438*6+P438 -> 68 | S438: NOWLAN
A439: BEST PLAYERS
A440: BRUNSWICK | C440: BLACKMORE | F440: DOWLING | I440: MUTIMER | L440: FITZGERALD | O440: EUDEY | Q440: WHITELEY
A441: PRESTON | C441: SMITH | F441: HUGHSON | I441: McEACHARN | L441: SPARGO | O441: BIRD | Q441: DOWLING
A442: GOALKICKERS
A443: BRUNSWICK | C443: JONES 4 | E443: FITZGERALD 3 | H443: WARDEN 2 | K443: PENMAN | M443: KNOTT | O443: MUTIMER | Q443: ANDERSON | T443: WHITELEY
A444: PRESTON | C444: DAVIE 2 | E444: HUGHSON 2 | H444: WARR 2 | J444: LANGWELL | M444: SUMMERS | O444: SMITH
A446: PORT MELBOURNE | C446: 0 | D446: 2 | E446: =C446*6+D446 -> 2 | G446: 5 | H446: 4 | I446: =G446*6+H446 -> 34 | K446: 6 | L446: 8 | M446: =K446*6+L446 -> 44 | O446: 10 | P446: 9 | Q446: =O446*6+P446 -> 69 | S446: PORT MELBOURNE
A447: OAKLEIGH | C447: 0 | D447: 3 | E447: =C447*6+D447 -> 3 | G447: 0 | H447: 7 | I447: =G447*6+H447 -> 7 | K447: 0 | L447: 9 | M447: =K447*6+L447 -> 9 | O447: 2 | P447: 12 | Q447: =O447*6+P447 -> 24 | S447: GLOVER
A448: BEST PLAYERS
A449: PORT MELBOURNE | C449: GARBUTT | F449: BEDFORD | I449: HYDE | L449: E PERRETT | O449: BAKER | R449: STANBRIDGE
A450: OAKLEIGH | C450: FLEMING | F450: DRIVER | I450: McALLISTER | L450: WITHERS | O450: RUDOLPH | R450: BERNARD
A451: GOALKICKERS
A452: PORT MELBOURNE | C452: BEDFORD 5 | F452: W PERRETT 2 | I452: PLUMRIDGE | L452: TUITE | N452: BARNES
A453: OAKLEIGH | C453: YANN 2
A455: ROUND 9 | E455: 18TH JUNE | J455: WEATHER | M455: COOL CLOUDY S.W. WIND | S455: PLAYED AT
D456: 1ST QTR | H456: 2ND QTR | L456: 3RD QTR | P456: FINAL | S456: CAMBERWELL
A457: CAMBERWELL | C457: 2 | D457: 3 | E457: =C457*6+D457 -> 15 | G457: 5 | H457: 4 | I457: =G457*6+H457 -> 34 | K457: 7 | L457: 9 | M457: =K457*6+L457 -> 51 | O457: 10 | P457: 14 | Q457: =O457*6+P457 -> 74 | S457: UMPIRE | X457: LADDER | AB457: ROUND | AD457: 9
A458: COBURG | C458: 2 | D458: 2 | E458: =C458*6+D458 -> 14 | G458: 5 | H458: 8 | I458: =G458*6+H458 -> 38 | K458: 6 | L458: 9 | M458: =K458*6+L458 -> 45 | O458: 9 | P458: 11 | Q458: =O458*6+P458 -> 65 | S458: GREGORY
A459: BEST PLAYERS | W459: TEAM | X459: W | Y459: L | Z459: D | AA459: FOR | AB459: AGST | AC459: % | AD459: PTS
A460: CAMBERWELL | C460: PETRIE | E460: LAWN | H460: LASKY | K460: MASON | N460: COLLINS | Q460: DYBALL
A461: COBURG | C461: JENKINS | E461: HARRIS | H461: KIGHT | K461: LOWE | N461: ROGERS | Q461: VOIGHT | W461: CAMBERWELL | X461: 8 | Y461: 1 | Z461: 0 | AA461: 934 | AB461: 658 | AC461: 141.94528875379939 | AD461: 32
A462: GOALKICKERS | W462: SANDRINGHAM | X462: 7 | Y462: 2 | Z462: 0 | AA462: 816 | AB462: 723 | AC462: 112.86307053941908 | AD462: 28
A463: CAMBERWELL | C463: LUFF 4 | E463: MASON | G463: W COFFIN | I463: PETRIE | K463: LASKY | M463: COLLINS | O463: TROTTER | W463: PORT MELBOURNE | X463: 6 | Y463: 3 | Z463: 0 | AA463: 747 | AB463: 593 | AC463: 125.96964586846543 | AD463: 24
A464: COBURG | C464: ROGERS 3 | F464: DUNCAN 2 | I464: BRIGGS | K464: KIGHT | M464: HARRIS | O464: PROUDFOOT | W464: NORTHCOTE | X464: 6 | Y464: 3 | Z464: 0 | AA464: 865 | AB464: 759 | AC464: 113.97 | AD464: 24
A466: PRESTON | C466: 2 | D466: 1 | E466: =C466*6+D466 -> 13 | G466: 4 | H466: 7 | I466: =G466*6+H466 -> 31 | K466: 9 | L466: 14 | M466: =K466*6+L466 -> 68 | O466: 14 | P466: 17 | Q466: =O466*6+P466 -> 101 | S466: PRESTON | W466: PRESTON | X466: 6 | Y466: 3 | Z466: 0 | AA466: 739 | AB466: 708 | AC466: 104.38 | AD466: 24
A467: SANDRINGHAM | C467: 1 | D467: 4 | E467: =C467*6+D467 -> 10 | G467: 3 | H467: 6 | I467: =G467*6+H467 -> 24 | K467: 4 | L467: 9 | M467: =K467*6+L467 -> 33 | O467: 7 | P467: 11 | Q467: =O467*6+P467 -> 53 | S467: STUART | W467: COBURG | X467: 5 | Y467: 4 | Z467: 0 | AA467: 836 | AB467: 723 | AC467: 115.62932226832642 | AD467: 20
A468: BEST PLAYERS | W468: WILLIAMSTOWN | X468: 5 | Y468: 4 | Z468: 0 | AA468: 696 | AB468: 682 | AC468: 102.05278592375366 | AD468: 20
A469: PRESTON | C469: MONOHAN | F469: MOONEY | I469: DOWLING | K469: SUMMERS | N469: HUGHSON | Q469: SMITH | W469: PRAHRAN | X469: 3 | Y469: 6 | Z469: 0 | AA469: 764 | AB469: 816 | AC469: 93.627450980392155 | AD469: 12
A470: SANDRINGHAM | C470: THOMS | F470: YOUNG | I470: KEMP | K470: YEMM | N470: LUNN | Q470: RAYMENT | W470: BRIGHTON | X470: 3 | Y470: 6 | Z470: 0 | AA470: 637 | AB470: 819 | AC470: 77.777777777777771 | AD470: 12
A471: GOALKICKERS | W471: BRUNSWICK | X471: 3 | Y471: 6 | Z471: 0 | AA471: 660 | AB471: 908 | AC471: 72.687224669603523 | AD471: 12
A472: PRESTON | C472: DAVIE 4 | E472: WARR 2 | G472: POULTER 2 | J472: DINEEN 2 | M472: SMITH 2 | O472: HUGHSON | Q472: SUMMERS | W472: YARRAVILLE | X472: 1 | Y472: 8 | Z472: 0 | AA472: 731 | AB472: 874 | AC472: 83.638443935926773 | AD472: 4
A473: SANDRINGHAM | C473: FORBES 2 | E473: GAMBETTA 2 | H473: THOMS | J473: FITZGERALD | M473: RAYMENT | W473: OAKLEIGH | X473: 1 | Y473: 8 | Z473: 0 | AA473: 667 | AB473: 829 | AC473: 80.458383594692407 | AD473: 4
A475: WILLIAMSTOWN | C475: 3 | D475: 5 | E475: =C475*6+D475 -> 23 | G475: 4 | H475: 9 | I475: =G475*6+H475 -> 33 | K475: 8 | L475: 12 | M475: =K475*6+L475 -> 60 | O475: 10 | P475: 15 | Q475: =O475*6+P475 -> 75 | S475: TOORAK PARK
A476: PRAHRAN | C476: 3 | D476: 2 | E476: =C476*6+D476 -> 20 | G476: 7 | H476: 6 | I476: =G476*6+H476 -> 48 | K476: 8 | L476: 7 | M476: =K476*6+L476 -> 55 | O476: 10 | P476: 9 | Q476: =O476*6+P476 -> 69 | S476: MORCOM
A477: BEST PLAYERS
A478: WILLIAMSTOWN | C478: JAENSCH | F478: BROOKS | I478: FLYNN | L478: DREW | O478: LYNCH | R478: BARNES
A479: PRAHRAN | C479: TABATEAU | F479: JORDAN | I479: KOOP | L479: BANKS | O479: HAWKINS | R479: SALTER
A480: GOALKICKERS
A481: WILLIAMSTOWN | C481: L DREW 4 | F481: McGRATH 2 | I481: BARNES 2 | L481: SHADE | N481: JAENSCH
A482: PRAHRAN | C482: HAWKINS 3 | F482: SALTER 2 | I482: MORLEY | K482: JORDAN | M482: FARNAHM | P482: BANKS | R482: KOOP
A484: YARRAVILLE | C484: 2 | D484: 3 | E484: =C484*6+D484 -> 15 | G484: 6 | H484: 5 | I484: =G484*6+H484 -> 41 | K484: 9 | L484: 9 | M484: =K484*6+L484 -> 63 | O484: 14 | P484: 11 | Q484: =O484*6+P484 -> 95 | S484: YARRAVILLE
A485: BRUNSWICK | C485: 1 | D485: 3 | E485: =C485*6+D485 -> 9 | G485: 4 | H485: 6 | I485: =G485*6+H485 -> 30 | K485: 6 | L485: 9 | M485: =K485*6+L485 -> 45 | O485: 7 | P485: 11 | Q485: =O485*6+P485 -> 53 | S485: MURRAY
A486: BEST PLAYERS
A487: YARRAVILLE | C487: J BUCKLEY | F487: W BUCKLEY | I487: PREWETT | L487: QUIGG | O487: WHITE | R487: BRUMBY
A488: BRUNSWICK | C488: EUDEY | F488: EAVES | I488: FITZGERALD | L488: DOWLING | O488: WARDEN | R488: HEARN
A489: GOALKICKERS
A490: YARRAVILLE | C490: J BUCKLEY 7 | F490: W BUCKLEY 3 | I490: BRUMBY 2 | L490: ROBERTSON | O490: PREWETT
A491: BRUNSWICK | C491: WARDEN 2 | F491: BRANSTON 2 | I491: FITZGERALD | L491: KNOTT | N491: ANDERSON
A493: BRIGHTON | C493: 5 | D493: 4 | E493: =C493*6+D493 -> 34 | G493: 7 | H493: 7 | I493: =G493*6+H493 -> 49 | K493: 11 | L493: 9 | M493: =K493*6+L493 -> 75 | O493: 13 | P493: 10 | Q493: =O493*6+P493 -> 88 | S493: ELSTERNWICK PARK
A494: PORT MELBOURNE | C494: 2 | D494: 4 | E494: =C494*6+D494 -> 16 | G494: 4 | H494: 5 | I494: =G494*6+H494 -> 29 | K494: 5 | L494: 10 | M494: =K494*6+L494 -> 40 | O494: 11 | P494: 15 | Q494: =O494*6+P494 -> 81 | S494: IRVING
A495: BEST PLAYERS
A496: BRIGHTON | C496: WILKINS | F496: H JOHNSON | I496: M JOHNSTONE | L496: HUNT | O496: TUCKER | R496: TEMPEST
A497: PORT MELBOURNE | C497: BARNES | F497: SIMPSON | I497: HYDE | L497: W PERRETT | O497: TUITE | R497: E PERRETT
A498: GOALKICKERS
A499: BRIGHTON | C499: JOHNSON 7 | F499: POULTER 3 | I499: STEWART | L499: TEMPEST | O499: CLOTZ
A500: PORT MELBOURNE | C500: BEDFORD 3 | F500: SING 3 | I500: BUCKLEY 2 | L500: PLUMRIDGE | O500: TUITE | Q500: E PERRETT
A502: NORTHCOTE | C502: 1 | D502: 3 | E502: =C502*6+D502 -> 9 | G502: 8 | H502: 9 | I502: =G502*6+H502 -> 57 | K502: 9 | L502: 12 | M502: =K502*6+L502 -> 66 | O502: 14 | P502: 19 | Q502: =O502*6+P502 -> 103 | S502: OAKLEIGH
A503: OAKLEIGH | C503: 4 | D503: 5 | E503: =C503*6+D503 -> 29 | G503: 5 | H503: 5 | I503: =G503*6+H503 -> 35 | K503: 11 | L503: 9 | M503: =K503*6+L503 -> 75 | O503: 13 | P503: 11 | Q503: =O503*6+P503 -> 89 | S503: NORTHCOTE
A504: BEST PLAYERS
A505: NORTHCOTE | C505: PERKINS | F505: BRAY | I505: GARRETT | L505: McSWAIN | O505: SEYMOUR | R505: SIMMONDS
A506: OAKLEIGH | C506: SPAIN | F506: RUDOLPH | I506: WITHERS | L506: McALLISTER | O506: FRASER | R506: FLEMING
A507: GOALKICKERS
A508: NORTHCOTE | C508: SEYMOUR 5 | F508: SIMMONDS 3 | I508: BRAY 2 | K508: HUMPHRIES 2 | N508: WILLIAMSON 2
A509: OAKLEIGH | C509: FRASER 3 | F509: MILLER 3 | I509: FLEMING 2 | L509: MOHR 2 | N509: SPAIN | P509: WATSON | R509: HESTER
A511: ROUND 10 | E511: 25TH JUNE | H511: WEATHER | K511: COOL CLOUDY W WIND LIGHT RAIN EARLY | S511: PLAYED AT
D512: 1ST QTR | H512: 2ND QTR | L512: 3RD QTR | P512: FINAL | S512: CAMBERWELL
A513: CAMBERWELL | C513: 4 | D513: 3 | E513: =C513*6+D513 -> 27 | G513: 8 | H513: 6 | I513: =G513*6+H513 -> 54 | K513: 11 | L513: 7 | M513: =K513*6+L513 -> 73 | O513: 11 | P513: 9 | Q513: =O513*6+P513 -> 75 | S513: UMPIRE | X513: LADDER | AB513: ROUND | AD513: 10
A514: PORT MELBOURNE | C514: 4 | D514: 2 | E514: =C514*6+D514 -> 26 | G514: 5 | H514: 4 | I514: =G514*6+H514 -> 34 | K514: 6 | L514: 7 | M514: =K514*6+L514 -> 43 | O514: 8 | P514: 12 | Q514: =O514*6+P514 -> 60 | S514: STUART
A515: BEST PLAYERS | W515: TEAM | X515: W | Y515: L | Z515: D | AA515: FOR | AB515: AGST | AC515: % | AD515: PTS
A516: CAMBERWELL | C516: JONES | F516: O'NEILL | I516: MASON | L516: LUFF | N516: LASKY | Q516: R WILLIAMS
A517: PORT MELBOURNE | C517: STANBRIDGE | F517: BROOKER | I517: MURPHY | L517: SIMPSON | N517: PLUMRIDGE | Q517: GARBUTT | W517: CAMBERWELL | X517: 9 | Y517: 1 | Z517: 0 | AA517: 1009 | AB517: 718 | AC517: 140.52924791086352 | AD517: 36
A518: GOALKICKERS | W518: NORTHCOTE | X518: 7 | Y518: 3 | Z518: 0 | AA518: 981 | AB518: 826 | AC518: 118.77 | AD518: 28
A519: CAMBERWELL | C519: LUFF 7 | F519: W COFFIN 2 | I519: PETRIE | L519: LASKY | W519: PRESTON | X519: 7 | Y519: 3 | Z519: 0 | AA519: 829 | AB519: 753 | AC519: 110.09 | AD519: 28
A520: PORT MELBOURNE | C520: LAHIFF 2 | F520: BEDFORD 2 | I520: BARNES 2 | L520: STANBRIDGE | O520: BROOKER | W520: SANDRINGHAM | X520: 7 | Y520: 3 | Z520: 0 | AA520: 883 | AB520: 839 | AC520: 105.24433849821216 | AD520: 28
A522: NORTHCOTE | C522: 4 | D522: 8 | E522: =C522*6+D522 -> 32 | G522: 7 | H522: 10 | I522: =G522*6+H522 -> 52 | K522: 15 | L522: 19 | M522: =K522*6+L522 -> 109 | O522: 16 | P522: 20 | Q522: =O522*6+P522 -> 116 | S522: NORTHCOTE | W522: PORT MELBOURNE | X522: 6 | Y522: 4 | Z522: 0 | AA522: 807 | AB522: 668 | AC522: 120.80838323353294 | AD522: 24
A523: SANDRINGHAM | C523: 1 | D523: 1 | E523: =C523*6+D523 -> 7 | G523: 7 | H523: 8 | I523: =G523*6+H523 -> 50 | K523: 8 | L523: 9 | M523: =K523*6+L523 -> 57 | O523: 9 | P523: 13 | Q523: =O523*6+P523 -> 67 | S523: GLOVER | W523: COBURG | X523: 6 | Y523: 4 | Z523: 0 | AA523: 901 | AB523: 785 | AC523: 114.77707006369427 | AD523: 24
A524: BEST PLAYERS | W524: WILLIAMSTOWN | X524: 6 | Y524: 4 | Z524: 0 | AA524: 764 | AB524: 741 | AC524: 103.10391363022941 | AD524: 24
A525: NORTHCOTE | C525: PERKINS | F525: ROSS | I525: SIMMONDS | L525: SEYMOUR | O525: WOODS | Q525: GOULLET | W525: PRAHRAN | X525: 3 | Y525: 7 | Z525: 0 | AA525: 809 | AB525: 906 | AC525: 89.293598233995581 | AD525: 12
A526: SANDRINGHAM | C526: RAYMENT | F526: THOMS | I526: ANDERSON | L526: FITZGERALD | O526: DE LUCA | Q526: GAMBETTA | W526: BRIGHTON | X526: 3 | Y526: 7 | Z526: 0 | AA526: 691 | AB526: 925 | AC526: 74.702702702702709 | AD526: 12
A527: GOALKICKERS | W527: BRUNSWICK | X527: 3 | Y527: 7 | Z527: 0 | AA527: 719 | AB527: 976 | AC527: 73.668032786885249 | AD527: 12
A528: NORTHCOTE | C528: SEYMOUR 6 | F528: SIMMONDS 3 | I528: ROSS 2 | K528: MILNE 2 | M528: HUMPHRIES | P528: BYRNE | R528: ROWE | W528: OAKLEIGH | X528: 2 | Y528: 8 | Z528: 0 | AA528: 773 | AB528: 883 | AC528: 87.542468856172135 | AD528: 8
A529: SANDRINGHAM | C529: RAYMENT 3 | F529: GAMBETTA 2 | I529: ANDERSON 2 | L529: THOMS | N529: JAMIESON | W529: YARRAVILLE | X529: 1 | Y529: 9 | Z529: 0 | AA529: 793 | AB529: 939 | AC529: 84.451544195953147 | AD529: 4
A531: PRESTON | C531: 0 | D531: 5 | E531: =C531*6+D531 -> 5 | G531: 4 | H531: 12 | I531: =G531*6+H531 -> 36 | K531: 8 | L531: 17 | M531: =K531*6+L531 -> 65 | O531: 12 | P531: 18 | Q531: =O531*6+P531 -> 90 | S531: PORT MELBOURNE
A532: PRAHRAN | C532: 2 | D532: 1 | E532: =C532*6+D532 -> 13 | G532: 2 | H532: 2 | I532: =G532*6+H532 -> 14 | K532: 4 | L532: 2 | M532: =K532*6+L532 -> 26 | O532: 7 | P532: 3 | Q532: =O532*6+P532 -> 45 | S532: NOWLAN
A533: BEST PLAYERS
A534: PRESTON | C534: McEACHARN | F534: EVERETT | I534: DOWLING | L534: HUGHSON | O534: SUMMERS | R534: WARR
A535: PRAHRAN | C535: BANKS | F535: JORDAN | I535: HARRIS | L535: WHITE | O535: KOOP | R535: MASON
A536: GOALKICKERS
A537: PRESTON | C537: DAVIE 3 | F537: WARR 3 | I537: SUMMERS 2 | L537: HARDING | N537: DINEEN | P537: BIRD | R537: SMITH
A538: PRAHRAN | C538: WHITE 2 | F538: HAWKINS | I538: WILLIAMS | L538: HARRIS | N538: BANKS | P538: BRENCHLEY
A540: WILLIAMSTOWN | C540: 1 | D540: 3 | E540: =C540*6+D540 -> 9 | G540: 8 | H540: 5 | I540: =G540*6+H540 -> 53 | K540: 8 | L540: 6 | M540: =K540*6+L540 -> 54 | O540: 10 | P540: 8 | Q540: =O540*6+P540 -> 68 | S540: W'TWON
A541: BRUNSWICK | C541: 4 | D541: 2 | E541: =C541*6+D541 -> 26 | G541: 5 | H541: 3 | I541: =G541*6+H541 -> 33 | K541: 9 | L541: 5 | M541: =K541*6+L541 -> 59 | O541: 9 | P541: 5 | Q541: =O541*6+P541 -> 59 | S541: McKINNON
A542: BEST PLAYERS
A543: WILLIAMSTOWN | C543: BARNES | F543: LYNCH | I543: SINCLAIR | L543: BLAKE | O543: McCABE | R543: HELLWIG
A544: BRUNSWICK | C544: BLACKMORE | F544: MUTIMER | I544: JONES | L544: FITZGERALD | O544: BRIGHT | R544: EUDEY
A545: GOALKICKERS
A546: WILLIAMSTOWN | C546: BARNES 2 | F546: SINCLAIR 2 | I546: McCABE 2 | L546: L DREW | N546: SHADE | P546: JAENSCH | R546: CUTTING
A547: BRUNSWICK | C547: JONES 3 | F547: MUTIMER 2 | I547: FITZGERALD | L547: DOWLING | N547: WARDEN | P547: BRIGHT
A549: OAKLEIGH | C549: 1 | D549: 2 | E549: =C549*6+D549 -> 8 | G549: 9 | H549: 8 | I549: =G549*6+H549 -> 62 | K549: 11 | L549: 10 | M549: =K549*6+L549 -> 76 | O549: 15 | P549: 16 | Q549: =O549*6+P549 -> 106 | S549: OAKLEIGH
A550: BRIGHTON | C550: 2 | D550: 6 | E550: =C550*6+D550 -> 18 | G550: 3 | H550: 7 | I550: =G550*6+H550 -> 25 | K550: 7 | L550: 10 | M550: =K550*6+L550 -> 52 | O550: 7 | P550: 12 | Q550: =O550*6+P550 -> 54 | S550: GREGORY
A551: BEST PLAYERS
A552: OAKLEIGH | C552: FLEMING | F552: RUDOLPH | I552: WITHERS | L552: RODWELL | O552: MILLER | R552: BAKER
A553: BRIGHTON | C553: LILBURNE | F553: CLOUGH | I553: M JOHNSTONE | L553: TUCKER | O553: HUNT | R553: POULTER
A554: GOALKICKERS
A555: OAKLEIGH | C555: MILLER 5 | F555: RODWELL 3 | I555: BAKER 3 | L555: STAN SMITH 2 | O555: FLEMING | Q555: WATSON
A556: BRIGHTON | C556: JOHNSON 2 | F556: GRAHAM | I556: POULTER | L556: TUCKER | O556: LILBURNE | Q556: CLOTZ
A558: COBURG | C558: 5 | D558: 3 | E558: =C558*6+D558 -> 33 | G558: 7 | H558: 8 | I558: =G558*6+H558 -> 50 | K558: 7 | L558: 10 | M558: =K558*6+L558 -> 52 | O558: 9 | P558: 11 | Q558: 65 | S558: COBURG
A559: YARRAVILLE | C559: 1 | D559: 3 | E559: =C559*6+D559 -> 9 | G559: 4 | H559: 6 | I559: =G559*6+H559 -> 30 | K559: 6 | L559: 7 | M559: =K559*6+L559 -> 43 | O559: 9 | P559: 8 | Q559: 62 | S559: HASSETT
A560: BEST PLAYERS
A561: COBURG | C561: JENKINS | F561: BERTRAM | I561: ELLIOTT | L561: UHE | O561: HARRIS | R561: MARTIN
A562: YARRAVILLE | C562: SHEEHAN | F562: CAMERON | I562: PETERS | L562: BRUMBY | O562: WHITE | R562: WUNHYM
A563: GOALKICKERS
A564: COBURG | C564: KIGHT 2 | F564: STOCKDALE 2 | I564: MEARS 2 | K564: DUNCAN | M564: JENKINS | O564: BRIGGS
A565: YARRAVILLE | C565: SHEEHAN 2 | F565: W BUCKLEY | I565: BRUMBY | K565: J BUCKLEY | N565: QUIGG | P565: PREWETT | R565: CAMERON
A567: ROUND 11 | E567: 2ND JULY | J567: WEATHER | M567: FINE NORTH WIND | S567: PLAYED AT
D568: 1ST QTR | H568: 2ND QTR | L568: 3RD QTR | P568: FINAL | S568: PORT MELBOURNE
A569: COBURG | C569: 3 | D569: 1 | E569: =C569*6+D569 -> 19 | G569: 10 | H569: 3 | I569: =G569*6+H569 -> 63 | K569: 11 | L569: 5 | M569: =K569*6+L569 -> 71 | O569: 13 | P569: 10 | Q569: =O569*6+P569 -> 88 | S569: UMPIRE | X569: LADDER | AB569: ROUND | AD569: 11
A570: PORT MELBOURNE | C570: 1 | D570: 1 | E570: =C570*6+D570 -> 7 | G570: 4 | H570: 5 | I570: =G570*6+H570 -> 29 | K570: 6 | L570: 9 | M570: =K570*6+L570 -> 45 | O570: 7 | P570: 13 | Q570: =O570*6+P570 -> 55 | S570: GREGORY
A571: BEST PLAYERS | W571: TEAM | X571: W | Y571: L | Z571: D | AA571: FOR | AB571: AGST | AC571: % | AD571: PTS
A572: COBURG | C572: KIGHT | F572: MEARS | H572: COLBERT | K572: JENKINS | N572: STOCKDALE | Q572: MARSHALL
A573: PORT MELBOURNE | C573: STANBRIDGE | F573: LAHIFF | H573: E PERRETT | K573: BEDFORD | N573: HYDE | Q573: JULIER | W573: CAMBERWELL | X573: 10 | Y573: 1 | Z573: 0 | AA573: 1094 | AB573: 780 | AC573: 140.25641025641025 | AD573: 40
A574: GOALKICKERS | W574: NORTHCOTE | X574: 8 | Y574: 3 | Z574: 0 | AA574: 1101 | AB574: 912 | AC574: 120.72 | AD574: 32
A575: COBURG | C575: PROUDFOOT 3 | F575: COLBERT 3 | I575: KIGHT 2 | K575: BRIGGS 2 | M575: MEARS 2 | O575: ROGERS | W575: SANDRINGHAM | X575: 8 | Y575: 3 | Z575: 0 | AA575: 997 | AB575: 903 | AC575: 110.40974529346623 | AD575: 32
A576: PORT MELBOURNE | C576: LAHIFF 3 | F576: BEDFORD 2 | I576: BARNES | K576: REES | W576: PRESTON | X576: 8 | Y576: 3 | Z576: 0 | AA576: 895 | AB576: 816 | AC576: 109.69 | AD576: 32
A578: PRESTON | C578: 3 | D578: 5 | E578: =C578*6+D578 -> 23 | G578: 3 | H578: 6 | I578: =G578*6+H578 -> 24 | K578: 8 | L578: 10 | M578: =K578*6+L578 -> 58 | O578: 9 | P578: 12 | Q578: =O578*6+P578 -> 66 | S578: PRESTON | W578: COBURG | X578: 7 | Y578: 4 | Z578: 0 | AA578: 989 | AB578: 840 | AC578: 117.73809523809524 | AD578: 28
A579: WILLIAMSTOWN | C579: 1 | D579: 3 | E579: =C579*6+D579 -> 9 | G579: 3 | H579: 12 | I579: =G579*6+H579 -> 30 | K579: 5 | L579: 13 | M579: =K579*6+L579 -> 43 | O579: 8 | P579: 15 | Q579: =O579*6+P579 -> 63 | S579: GLOVER | W579: PORT MELBOURNE | X579: 6 | Y579: 5 | Z579: 0 | AA579: 862 | AB579: 756 | AC579: 114.02116402116403 | AD579: 24
A580: BEST PLAYERS | W580: WILLIAMSTOWN | X580: 6 | Y580: 5 | Z580: 0 | AA580: 827 | AB580: 807 | AC580: 102.47831474597274 | AD580: 24
A581: PRESTON | C581: HUGHSON | F581: MOONEY | I581: WARR | K581: DAVIE | N581: POULTER | Q581: MONOHAN | W581: BRIGHTON | X581: 3 | Y581: 7 | Z581: 1 | AA581: 807 | AB581: 1041 | AC581: 77.521613832853021 | AD581: 14
A582: WILLIAMSTOWN | C582: CAHILL | F582: SHADE | I582: DELLER | K582: STANWAY | N582: SINCLAIR | Q582: BROOKS | W582: BRUNSWICK | X582: 3 | Y582: 7 | Z582: 1 | AA582: 835 | AB582: 1092 | AC582: 76.46520146520146 | AD582: 14
A583: GOALKICKERS | W583: PRAHRAN | X583: 3 | Y583: 8 | Z583: 0 | AA583: 895 | AB583: 1026 | AC583: 87.231968810916186 | AD583: 12
A584: PRESTON | C584: DAVIE 2 | F584: WARR 2 | I584: SMITH 2 | K584: HUGHSON | M584: POULTER | O584: MONOHAN | W584: OAKLEIGH | X584: 2 | Y584: 9 | Z584: 0 | AA584: 837 | AB584: 997 | AC584: 83.951855566700104 | AD584: 8
A585: WILLIAMSTOWN | C585: BYRNE 2 | F585: SINCLAIR 2 | I585: FLYNN 2 | K585: CAHILL | M585: SHADE | W585: YARRAVILLE | X585: 1 | Y585: 10 | Z585: 0 | AA585: 855 | AB585: 1024 | AC585: 83.49609375 | AD585: 4
A587: NORTHCOTE | C587: 4 | D587: 14 | E587: =C587*6+D587 -> 38 | G587: 9 | H587: 16 | I587: =G587*6+H587 -> 70 | K587: 16 | L587: 22 | M587: =K587*6+L587 -> 118 | O587: 16 | P587: 24 | Q587: =O587*6+P587 -> 120 | S587: TOORAK PARK
A588: PRAHRAN | C588: 2 | D588: 0 | E588: =C588*6+D588 -> 12 | G588: 5 | H588: 3 | I588: =G588*6+H588 -> 33 | K588: 8 | L588: 5 | M588: =K588*6+L588 -> 53 | O588: 13 | P588: 8 | Q588: =O588*6+P588 -> 86 | S588: ELSON
A589: BEST PLAYERS
A590: NORTHCOTE | C590: SIMMONDS | F590: ROWE | I590: McSWAIN | L590: COLE | O590: GRAY | R590: WOODS
A591: PRAHRAN | C591: KOOP | F591: SALTER | I591: HARRIS | L591: MASON | O591: FARNAN | R591: RENNIE
A592: GOALKICKERS
A593: NORTHCOTE | C593: SEYMOUR 4 | F593: SIMMONDS 3 | I593: HUMPHRIES 3 | L593: COLE 2 | N593: ROSS | P593: BROWN | R593: SMITH | T593: HONIG
A594: PRAHRAN | C594: JORDAN 4 | F594: TRIM 2 | I594: SALTER 2 | L594: HARRIS 2 | N594: RENNIE 2 | Q594: FARNAN
A596: BRIGHTON | C596: 7 | D596: 5 | E596: =C596*6+D596 -> 47 | G596: 9 | H596: 6 | I596: =G596*6+H596 -> 60 | K596: 13 | L596: 11 | M596: =K596*6+L596 -> 89 | O596: 17 | P596: 14 | Q596: =O596*6+P596 -> 116 | S596: ELSTERNWICK PARK
A597: BRUNSWICK | C597: 2 | D597: 0 | E597: =C597*6+D597 -> 12 | G597: 9 | H597: 11 | I597: =G597*6+H597 -> 65 | K597: 11 | L597: 12 | M597: =K597*6+L597 -> 78 | O597: 17 | P597: 14 | Q597: =O597*6+P597 -> 116 | S597: STUART
A598: BEST PLAYERS
A599: BRIGHTON | C599: H JOHNSON | F599: HUNT | I599: M JOHNSTONE | L599: SCHENCK | O599: POULTER | R599: CLOTZ
A600: BRUNSWICK | C600: FITZGERALD | F600: PENMAN | I600: ANDERSON | L600: DOWLING | O600: BRANSTON | R600: WHITELEY
A601: GOALKICKERS
A602: BRIGHTON | C602: JOHNSON 8 | F602: POULTER 4 | I602: STEWART 2 | L602: HUNT | O602: LILBURNE | R602: WILKINS
A603: BRUNSWICK | C603: JONES 5 | F603: DOWLING 4 | I603: ANDERSON 4 | L603: FITZGERALD 2 | O603: CHAPMAN | R603: MAYNES
A605: SANDRINGHAM | C605: 6 | D605: 4 | E605: =C605*6+D605 -> 40 | G605: 7 | H605: 6 | I605: =G605*6+H605 -> 48 | K605: 12 | L605: 16 | M605: =K605*6+L605 -> 88 | O605: 16 | P605: 18 | Q605: =O605*6+P605 -> 114 | S605: BEACH ROAD
A606: OAKLEIGH | C606: 1 | D606: 0 | E606: =C606*6+D606 -> 6 | G606: 6 | H606: 5 | I606: =G606*6+H606 -> 41 | K606: 7 | L606: 8 | M606: =K606*6+L606 -> 50 | O606: 9 | P606: 10 | Q606: =O606*6+P606 -> 64 | S606: HASSETT
A607: BEST PLAYERS
A608: SANDRINGHAM | C608: ANDERSON | F608: RAYMENT | I608: DE LUCA | L608: BECKTON | O608: THOMS | R608: E BOURKE
A609: OAKLEIGH | C609: CRAMERI | F609: McALLISTER | I609: WITHERS | L609: BAKER | O609: FRASER | R609: MOHR
A610: GOALKICKERS
A611: SANDRINGHAM | C611: FORBES 5 | F611: RAYMENT 3 | I611: GAMBETTA 2 | L611: ANDERSON 2 | O611: BECKTON | Q611: CHALLIS | S611: DE LUCA | V611: BUSH
A612: OAKLEIGH | C612: FRASER 3 | F612: MOHR 2 | I612: AMES | K612: CRAMERI | N612: STEW SMITH | Q612: WATSON
A614: CAMBERWELL | C614: 5 | D614: 8 | E614: =C614*6+D614 -> 38 | G614: 7 | H614: 10 | I614: =G614*6+H614 -> 52 | K614: 11 | L614: 12 | M614: =K614*6+L614 -> 78 | O614: 12 | P614: 13 | Q614: =O614*6+P614 -> 85 | S614: YARRAVILLE
A615: YARRAVILLE | C615: 0 | D615: 0 | E615: =C615*6+D615 -> 0 | G615: 3 | H615: 11 | I615: =G615*6+H615 -> 29 | K615: 5 | L615: 11 | M615: =K615*6+L615 -> 41 | O615: 8 | P615: 14 | Q615: =O615*6+P615 -> 62 | S615: McKINNON
A616: BEST PLAYERS
A617: CAMBERWELL | C617: JONES | F617: O'NEILL | I617: CLAMP | L617: LUFF | O617: COFFIN | R617: LATHLAIN
A618: YARRAVILLE | C618: FULLWOOD | F618: EVANS | I618: WUNHYM | L618: MITCHELL | O618: WHITE | R618: J BUCKLEY
A619: GOALKICKERS
A620: CAMBERWELL | C620: LUFF 5 | E620: LAWN | G620: MASON | I620: STRACHAN | L620: W COFFIN | N620: PETRIE | P620: COLLINS | R620: TROTTER | U620: DYBALL
A621: YARRAVILLE | C621: J BUCKLEY 3 | F621: W BUCKLEY | I621: QUIGG | K621: PREWETT | N621: SHEEHAN | Q621: MITCHELL
A623: ROUND 12 | E623: 9TH JULY | H623: WEATHER | K623: COLD CLOUDY STRONG S WIND SOME SHOWERS | S623: PLAYED AT
D624: 1ST QTR | H624: 2ND QTR | L624: 3RD QTR | P624: FINAL | S624: BEACH ROAD
A625: SANDRINGHAM | C625: 3 | D625: 1 | E625: =C625*6+D625 -> 19 | G625: 9 | H625: 8 | I625: =G625*6+H625 -> 62 | K625: 9 | L625: 10 | M625: =K625*6+L625 -> 64 | O625: 10 | P625: 14 | Q625: =O625*6+P625 -> 74 | S625: UMPIRE | X625: LADDER | AB625: ROUND | AD625: 12
A626: PRESTON | C626: 0 | D626: 0 | E626: =C626*6+D626 -> 0 | G626: 0 | H626: 4 | I626: =G626*6+H626 -> 4 | K626: 2 | L626: 8 | M626: =K626*6+L626 -> 20 | O626: 6 | P626: 9 | Q626: =O626*6+P626 -> 45 | S626: LESTER
A627: BEST PLAYERS | W627: TEAM | X627: W | Y627: L | Z627: D | AA627: FOR | AB627: AGST | AC627: % | AD627: PTS
A628: SANDRINGHAM | C628: E BOURKE | F628: YOUNG | I628: FITZGERALD | L628: YEMM | O628: RAYMENT | Q628: GAMBETTA
A629: PRESTON | C629: SMITH | F629: POULTER | I629: DAVIE | L629: MONOHAN | O629: MOONEY | Q629: SUMMERS | W629: CAMBERWELL | X629: 10 | Y629: 2 | Z629: 0 | AA629: 1181 | AB629: 883 | AC629: 133.74858437146094 | AD629: 40
A630: GOALKICKERS | W630: NORTHCOTE | X630: 9 | Y630: 3 | Z630: 0 | AA630: 1290 | AB630: 962 | AC630: 134.1 | AD630: 36
A631: SANDRINGHAM | C631: FORBES 2 | F631: BECKTON 2 | I631: GAMBETTA 2 | L631: THOMS 2 | N631: RAYMENT 2 | W631: SANDRINGHAM | X631: 9 | Y631: 3 | Z631: 0 | AA631: 1071 | AB631: 948 | AC631: 112.9746835443038 | AD631: 36
A632: PRESTON | C632: DAVIE 2 | F632: HUNTER 2 | I632: POULTER | L632: DINEEN | W632: COBURG | X632: 8 | Y632: 4 | Z632: 0 | AA632: 1092 | AB632: 927 | AC632: 117.79935275080906 | AD632: 32
A634: COBURG | C634: 4 | D634: 2 | E634: =C634*6+D634 -> 26 | G634: 6 | H634: 9 | I634: =G634*6+H634 -> 45 | K634: 9 | L634: 13 | M634: =K634*6+L634 -> 67 | O634: 14 | P634: 19 | Q634: =O634*6+P634 -> 103 | S634: COBURG | W634: PRESTON | X634: 8 | Y634: 4 | Z634: 0 | AA634: 940 | AB634: 890 | AC634: 105.62 | AD634: 32
A635: CAMBERWELL | C635: 6 | D635: 3 | E635: =C635*6+D635 -> 39 | G635: 7 | H635: 4 | I635: =G635*6+H635 -> 46 | K635: 11 | L635: 8 | M635: =K635*6+L635 -> 74 | O635: 13 | P635: 9 | Q635: =O635*6+P635 -> 87 | S635: STUART | W635: PORT MELBOURNE | X635: 7 | Y635: 5 | Z635: 0 | AA635: 950 | AB635: 827 | AC635: 114.87303506650544 | AD635: 28
A636: BEST PLAYERS | W636: WILLIAMSTOWN | X636: 7 | Y636: 5 | Z636: 0 | AA636: 914 | AB636: 855 | AC636: 106.90058479532163 | AD636: 28
A637: COBURG | C637: LEAHY | F637: JENKINS | I637: DUNCAN | L637: LOWE | O637: MEARS | Q637: KIGHT | W637: BRUNSWICK | X637: 3 | Y637: 8 | Z637: 1 | AA637: 912 | AB637: 1172 | AC637: 77.815699658703068 | AD637: 14
A638: CAMBERWELL | C638: JONES | F638: ELLIOTT | I638: PETRIE | L638: LAWN | O638: ROWE | Q638: COLLINS | W638: BRIGHTON | X638: 3 | Y638: 8 | Z638: 1 | AA638: 878 | AB638: 1129 | AC638: 77.767936226749342 | AD638: 14
A639: GOALKICKERS | W639: PRAHRAN | X639: 3 | Y639: 9 | Z639: 0 | AA639: 943 | AB639: 1113 | AC639: 84.725965858041334 | AD639: 12
A640: COBURG | C640: ROGERS 3 | E640: MEARS 3 | G640: KIGHT 2 | I640: COLBERT 2 | L640: BRIGGS | N640: WILLOX | P640: LEAHY | R640: HARRIS | W640: YARRAVILLE | X640: 2 | Y640: 10 | Z640: 0 | AA640: 935 | AB640: 1101 | AC640: 84.922797456857396 | AD640: 8
A641: CAMBERWELL | C641: LUFF 4 | E641: LAWN 3 | G641: MASON | I641: PETRIE | L641: LASKY | N641: ROWE | P641: CLAMP | R641: McGRATH | W641: OAKLEIGH | X641: 2 | Y641: 10 | Z641: 0 | AA641: 887 | AB641: 1186 | AC641: 74.789207419898815 | AD641: 8
A643: PORT MELBOURNE | C643: 1 | D643: 1 | E643: =C643*6+D643 -> 7 | G643: 5 | H643: 3 | I643: =G643*6+H643 -> 33 | K643: 6 | L643: 6 | M643: =K643*6+L643 -> 42 | O643: 13 | P643: 10 | Q643: =O643*6+P643 -> 88 | S643: PORT MELBOURNE
A644: BRIGHTON | C644: 2 | D644: 2 | E644: =C644*6+D644 -> 14 | G644: 4 | H644: 7 | I644: =G644*6+H644 -> 31 | K644: 8 | L644: 7 | M644: =K644*6+L644 -> 55 | O644: 10 | P644: 11 | Q644: =O644*6+P644 -> 71 | S644: McKINNON
A645: BEST PLAYERS
A646: PORT MELBOURNE | C646: E PERRETT | F646: STANBRIDGE | I646: BEDFORD | L646: BROOKER | O646: LAHIFF | R646: TUITE
A647: BRIGHTON | C647: STEWART | F647: POULTER | I647: BARNES | L647: TUCKER | O647: H JOHNSON | R647: CANTWELL
A648: GOALKICKERS
A649: PORT MELBOURNE | C649: BEDFORD 5 | F649: TUITE 2 | I649: BROOKER 2 | L649: LAHIFF | N649: LEGGO | P649: W PERRETT | S649: HURLEY
A650: BRIGHTON | C650: JOHNSON 5 | F650: POULTER 2 | I650: DORE 2 | L650: TUCKER
A652: WILLIAMSTOWN | C652: 2 | D652: 3 | E652: =C652*6+D652 -> 15 | G652: 5 | H652: 8 | I652: =G652*6+H652 -> 38 | K652: 11 | L652: 14 | M652: =K652*6+L652 -> 80 | O652: 12 | P652: 15 | Q652: =O652*6+P652 -> 87 | S652: WILLIAMSTOWN
A653: PRAHRAN | C653: 1 | D653: 2 | E653: =C653*6+D653 -> 8 | G653: 3 | H653: 4 | I653: =G653*6+H653 -> 22 | K653: 3 | L653: 6 | M653: =K653*6+L653 -> 24 | O653: 6 | P653: 12 | Q653: =O653*6+P653 -> 48 | S653: GREGORY
A654: BEST PLAYERS
A655: WILLIAMSTOWN | C655: SYKES | F655: JOHNS | I655: BLAKE | L655: STANWAY | O655: BROOKS | R655: BARNES
A656: PRAHRAN | C656: JORDAN | F656: GOUGH | I656: FARNAN | L656: WHITE | O656: SALTER | R656: MASON
A657: GOALKICKERS
A658: WILLIAMSTOWN | C658: BARNES 5 | F658: CAHILL 3 | I658: SINCLAIR 2 | L658: BLAKE 2
A659: PRAHRAN | C659: HAWKINS 3 | F659: SALTER | I659: HARRIS | L659: FARNHAM
A661: YARRAVILLE | C661: 1 | D661: 2 | E661: =C661*6+D661 -> 8 | G661: 6 | H661: 5 | I661: =G661*6+H661 -> 41 | K661: 7 | L661: 8 | M661: =K661*6+L661 -> 50 | O661: 12 | P661: 8 | Q661: =O661*6+P661 -> 80 | S661: BRUNSWICK
A662: BRUNSWICK | C662: 3 | D662: 4 | E662: =C662*6+D662 -> 22 | G662: 5 | H662: 4 | I662: =G662*6+H662 -> 34 | K662: 10 | L662: 9 | M662: =K662*6+L662 -> 69 | O662: 11 | P662: 11 | Q662: =O662*6+P662 -> 77 | S662: WALTON
A663: BEST PLAYERS
A664: YARRAVILLE | C664: CAMERON | F664: MILBURN | I664: FULLWOOD | L664: WUNHYM | O664: SHEEHAN | R664: W BUCKLEY
A665: BRUNSWICK | C665: JONES | F665: MURPHY | I665: DOWLING | L665: CHAPMAN | O665: EUDEY | R665: FITZGERALD
A666: GOALKICKERS
A667: YARRAVILLE | C667: SHEEHAN 4 | F667: FORDHAM 3 | I667: BRUMBY 2 | L667: J BUCKLEY | N667: CAMERON | Q667: MITCHELL
A668: BRUNSWICK | C668: JONES 6 | F668: FITZGERALD 2 | I668: DOWLING 2 | L668: TUCKER
A670: NORTHCOTE | C670: 3 | D670: 3 | E670: =C670*6+D670 -> 21 | G670: 9 | H670: 10 | I670: =G670*6+H670 -> 64 | K670: 17 | L670: 13 | M670: =K670*6+L670 -> 115 | O670: 29 | P670: 15 | Q670: =O670*6+P670 -> 189 | S670: NORTHCOTE
A671: OAKLEIGH | C671: 1 | D671: 1 | E671: =C671*6+D671 -> 7 | G671: 3 | H671: 2 | I671: =G671*6+H671 -> 20 | K671: 5 | L671: 8 | M671: =K671*6+L671 -> 38 | O671: 6 | P671: 14 | Q671: =O671*6+P671 -> 50 | S671: MURRAY
A672: BEST PLAYERS
A673: NORTHCOTE | C673: COLE | F673: SEYMOUR | I673: DEA | L673: McSWAIN | O673: GRAY | R673: ROWE
A674: OAKLEIGH | C674: WITHERS | F674: MORRIS | I674: FLEMING | L674: MUDGE | O674: CHESSWASS | R674: MOHR
A675: GOALKICKERS
A676: NORTHCOTE | C676: SEYMOUR 11 | F676: SIMMONDS 4) | I676: BROWN 3 | K676: GOULLET 2 | N676: HUMPHRIES 2 | Q676: SMITH 2 | T676: HONIG 2 | W676: ROSS 2 | X676: ROWE
A677: OAKLEIGH | C677: JONES 2 | F677: MOHR 2 | I677: CRAMERI | L677: HESTER
A679: ROUND 13 | E679: 16TH JULY | H679: WEATHER | K679: COLD CLOUDY STRONG NORTH WIND | S679: PLAYED AT
D680: 1ST QTR | H680: 2ND QTR | L680: 3RD QTR | P680: FINAL | S680: NORTHCOTE
A681: NORTHCOTE | C681: 3 | D681: 1 | E681: =C681*6+D681 -> 19 | G681: 6 | H681: 3 | I681: =G681*6+H681 -> 39 | K681: 10 | L681: 12 | M681: =K681*6+L681 -> 72 | O681: 13 | P681: 16 | Q681: =O681*6+P681 -> 94 | S681: UMPIRE | X681: LADDER | AB681: ROUND | AD681: 13
A682: CAMBERWELL | C682: 1 | D682: 3 | E682: =C682*6+D682 -> 9 | G682: 1 | H682: 5 | I682: =G682*6+H682 -> 11 | K682: 2 | L682: 6 | M682: =K682*6+L682 -> 18 | O682: 3 | P682: 7 | Q682: =O682*6+P682 -> 25 | S682: MURRAY
A683: BEST PLAYERS | W683: TEAM | X683: W | Y683: L | Z683: D | AA683: FOR | AB683: AGST | AC683: % | AD683: PTS
A684: NORTHCOTE | C684: PERKINS | E684: ROSS | H684: SMITH | K684: GRAY | N684: COLE | Q684: BROWN
A685: CAMBERWELL | C685: O'NEILL | E685: DYBALL | H685: HENDERSON | K685: LATHLAIN | N685: H JONES | Q685: BOOTHMAN | W685: NORTHCOTE | X685: 10 | Y685: 3 | Z685: 0 | AA685: 1384 | AB685: 987 | AC685: 140.22 | AD685: 40
A686: GOALKICKERS | W686: CAMBERWELL | X686: 10 | Y686: 3 | Z686: 0 | AA686: 1206 | AB686: 977 | AC686: 123.43909928352099 | AD686: 40
A687: NORTHCOTE | C687: ROSS 4 | E687: COLE 2 | G687: BROWN 2 | I687: SEYMOUR | K687: BYRNE | M687: GOULLET | O687: SMITH | Q687: HONIG | W687: COBURG | X687: 9 | Y687: 4 | Z687: 0 | AA687: 1193 | AB687: 987 | AC687: 120.87132725430598 | AD687: 36
A688: CAMBERWELL | C688: LUFF 2 | E688: COLLINS | W688: SANDRINGHAM | X688: 9 | Y688: 4 | Z688: 0 | AA688: 1143 | AB688: 1022 | AC688: 111.83953033268102 | AD688: 36
A690: COBURG | C690: 0 | D690: 1 | E690: =C690*6+D690 -> 1 | G690: 5 | H690: 13 | I690: =G690*6+H690 -> 43 | K690: 5 | L690: 14 | M690: =K690*6+L690 -> 44 | O690: 14 | P690: 17 | Q690: =O690*6+P690 -> 101 | S690: COBURG | W690: PRESTON | X690: 9 | Y690: 4 | Z690: 0 | AA690: 1023 | AB690: 951 | AC690: 107.57 | AD690: 36
A691: WILLIAMSTOWN | C691: 3 | D691: 7 | E691: =C691*6+D691 -> 25 | G691: 4 | H691: 7 | I691: =G691*6+H691 -> 31 | K691: 8 | L691: 11 | M691: =K691*6+L691 -> 59 | O691: 8 | P691: 12 | Q691: =O691*6+P691 -> 60 | S691: LESTER | W691: PORT MELBOURNE | X691: 7 | Y691: 6 | Z691: 0 | AA691: 985 | AB691: 887 | AC691: 111.04847801578354 | AD691: 28
A692: BEST PLAYERS | W692: WILLIAMSTOWN | X692: 7 | Y692: 6 | Z692: 0 | AA692: 974 | AB692: 956 | AC692: 101.88284518828452 | AD692: 28
A693: COBURG | C693: JENKINS | F693: UHE | I693: MARTIN | L693: COLBERT | O693: ROGERS | Q693: ELLIOTT | W693: BRUNSWICK | X693: 4 | Y693: 8 | Z693: 1 | AA693: 972 | AB693: 1207 | AC693: 80.530240265120128 | AD693: 18
A694: WILLIAMSTOWN | C694: BROOKS | F694: LONERGAN | I694: SINCLAIR | L694: STANWAY | O694: C DREW | Q694: L DREW | W694: PRAHRAN | X694: 4 | Y694: 9 | Z694: 0 | AA694: 1009 | AB694: 1176 | AC694: 85.799319727891159 | AD694: 16
A695: GOALKICKERS | W695: BRIGHTON | X695: 3 | Y695: 9 | Z695: 1 | AA695: 939 | AB695: 1212 | AC695: 77.475247524752476 | AD695: 14
A696: COBURG | C696: COLBERT 4 | F696: WILLOX 3 | I696: MEARS 2 | K696: STOCKDALE | N696: JENKINS | P696: BRIGGS | R696: LEAHY | T696: ROGERS | W696: YARRAVILLE | X696: 3 | Y696: 10 | Z696: 0 | AA696: 1009 | AB696: 1173 | AC696: 86.018755328218248 | AD696: 12
A697: WILLIAMSTOWN | C697: SINCLAIR 2 | F697: CAHILL 2 | I697: SHADE | K697: BARNES | M697: CUTTING | O697: H STANWAY | W697: OAKLEIGH | X697: 2 | Y697: 11 | Z697: 0 | AA697: 950 | AB697: 1252 | AC697: 75.878594249201285 | AD697: 8
A699: BRUNSWICK | C699: 2 | D699: 2 | E699: =C699*6+D699 -> 14 | G699: 4 | H699: 5 | I699: =G699*6+H699 -> 29 | K699: 5 | L699: 5 | M699: =K699*6+L699 -> 35 | O699: 9 | P699: 6 | Q699: =O699*6+P699 -> 60 | S699: BRUNSWICK
A700: PORT MELBOURNE | C700: 3 | D700: 0 | E700: =C700*6+D700 -> 18 | G700: 3 | H700: 1 | I700: =G700*6+H700 -> 19 | K700: 4 | L700: 4 | M700: =K700*6+L700 -> 28 | O700: 5 | P700: 5 | Q700: =O700*6+P700 -> 35 | S700: STUART
A701: BEST PLAYERS
A702: BRUNSWICK | C702: PENMAN | F702: WHITELEY | I702: WHEELER | L702: DOWLING | O702: JONES | Q702: REID
A703: PORT MELBOURNE | C703: PERRETT | F703: BILLS | I703: LAHIFF | L703: PLUMRIDGE | O703: BARNES | Q703: TUITE
A704: GOALKICKERS
A705: BRUNSWICK | C705: JONES 3 | F705: DOWLING 3 | I705: FITZGERALD | L705: MUTIMER | O705: BRANSTON
A706: PORT MELBOURNE | C706: BROOKER 2 | F706: E PERRETT | I706: BEDFORD | L706: HYDE
A708: PRAHRAN | C708: 2 | D708: 8 | E708: =C708*6+D708 -> 20 | G708: 2 | H708: 8 | I708: =G708*6+H708 -> 20 | K708: 9 | L708: 10 | M708: =K708*6+L708 -> 64 | O708: 9 | P708: 12 | Q708: =O708*6+P708 -> 66 | S708: TOORAK PARK
A709: OAKLEIGH | C709: 0 | D709: 2 | E709: =C709*6+D709 -> 2 | G709: 5 | H709: 11 | I709: =G709*6+H709 -> 41 | K709: 5 | L709: 11 | M709: =K709*6+L709 -> 41 | O709: 8 | P709: 15 | Q709: =O709*6+P709 -> 63 | S709: McKINNON
A710: BEST PLAYERS
A711: PRAHRAN | C711: HARRIS | F711: WHITE | I711: HAWKINS | L711: GOUGH | O711: SALTER | R711: F SMITH
A712: OAKLEIGH | C712: DRIVER | F712: STAN SMITH | I712: CRAMERI | L712: FLEMING | O712: CHESSWASS | R712: WILTSHIRE
A713: GOALKICKERS
A714: PRAHRAN | C714: HAWKINS 5 | F714: GOUGH 2 | I714: JORDAN | L714: FARNHAM
A715: OAKLEIGH | C715: FLEMING 2 | F715: AMES 2 | I715: MILLER 2 | L715: CRAMERI | O715: MOHR
A717: PRESTON | C717: 0 | D717: 0 | E717: =C717*6+D717 -> 0 | G717: 9 | H717: 9 | I717: =G717*6+H717 -> 63 | K717: 9 | L717: 10 | M717: =K717*6+L717 -> 64 | O717: 11 | P717: 17 | Q717: =O717*6+P717 -> 83 | S717: ELSTERNWICK PARK
A718: BRIGHTON | C718: 5 | D718: 3 | E718: =C718*6+D718 -> 33 | G718: 5 | H718: 3 | I718: =G718*6+H718 -> 33 | K718: 8 | L718: 13 | M718: =K718*6+L718 -> 61 | O718: 8 | P718: 13 | Q718: =O718*6+P718 -> 61 | S718: GREGORY
A719: BEST PLAYERS
A720: PRESTON | C720: MOONEY | F720: WARR | I720: SUMMERS | L720: SMITH | O720: DINEEN | R720: MONOHAN
A721: BRIGHTON | C721: JOHNSON | F721: TUCKER | I721: POULTER | L721: HUNT | O721: TOMLINS | R721: DORE
A722: GOALKICKERS
A723: PRESTON | C723: WARR 7 | F723: MCEACHERN 2 | J723: HUGHSON | M723: DINEEN
A724: BRIGHTON | C724: JOHNSON 5 | F724: TUCKER 2 | I724: SCHENCK
A726: YARRAVILLE | C726: 4 | D726: 7 | E726: =C726*6+D726 -> 31 | G726: 4 | H726: 9 | I726: =G726*6+H726 -> 33 | K726: 9 | L726: 14 | M726: =K726*6+L726 -> 68 | O726: 10 | P726: 14 | Q726: =O726*6+P726 -> 74 | S726: YARRAVILLE
A727: SANDRINGHAM | C727: 1 | D727: 1 | E727: =C727*6+D727 -> 7 | G727: 5 | H727: 6 | I727: =G727*6+H727 -> 36 | K727: 5 | L727: 9 | M727: =K727*6+L727 -> 39 | O727: 9 | P727: 18 | Q727: =O727*6+P727 -> 72 | S727: LEWIS
A728: BEST PLAYERS
A729: YARRAVILLE | C729: CAMERON | F729: FULLWOOD | I729: W BUCKLEY | L729: FORDHAM | O729: WUNHYM | R729: SHEEHAN
A730: SANDRINGHAM | C730: BECKTON | F730: DE LUCA | I730: RAYMENT | L730: CHALLIS | O730: THOMS | R730: ANDERSON
A731: GOALKICKERS
A732: YARRAVILLE | C732: SHEEHAN 5 | F732: FORDHAM 2 | I732: W BUCKLEY | L732: WUNHYM | O732: CAMERON
A733: SANDRINGHAM | C733: THOMS 4 | F733: BECKTON | I733: RAYMENT | L733: FORBES | N733: M BOURKE
A735: ROUND 14 | E735: 23RD JULY | J735: WEATHER | M735: FINE N.W. BREEZE | S735: PLAYED AT
D736: 1ST QTR | H736: 2ND QTR | L736: 3RD QTR | P736: FINAL | S736: CAMBERWELL
A737: CAMBERWELL | C737: 2 | D737: 1 | E737: =C737*6+D737 -> 13 | G737: 6 | H737: 4 | I737: =G737*6+H737 -> 40 | K737: 8 | L737: 5 | M737: =K737*6+L737 -> 53 | O737: 13 | P737: 9 | Q737: =O737*6+P737 -> 87 | S737: UMPIRE | X737: LADDER | AB737: ROUND | AD737: 14
A738: SANDRINGHAM | C738: 3 | D738: 8 | E738: =C738*6+D738 -> 26 | G738: 5 | H738: 10 | I738: =G738*6+H738 -> 40 | K738: 9 | L738: 12 | M738: =K738*6+L738 -> 66 | O738: 9 | P738: 17 | Q738: =O738*6+P738 -> 71 | S738: LESTER
A739: BEST PLAYERS | W739: TEAM | X739: W | Y739: L | Z739: D | AA739: FOR | AB739: AGST | AC739: % | AD739: PTS
A740: CAMBERWELL | C740: LAWN | E740: O'NEILL | H740: BOOTHMAN | K740: DYBALL | N740: COLLINS | Q740: JONES
A741: SANDRINGHAM | C741: TOLSON | E741: BECKTON | H741: FITZGERALD | K741: KEMP | N741: GAMBETTA | Q741: RAYMENT | W741: NORTHCOTE | X741: 11 | Y741: 3 | Z741: 0 | AA741: 1495 | AB741: 1071 | AC741: 139.59 | AD741: 44
A742: GOALKICKERS | W742: CAMBERWELL | X742: 11 | Y742: 3 | Z742: 0 | AA742: 1293 | AB742: 1048 | AC742: 123.37786259541984 | AD742: 44
A743: CAMBERWELL | C743: LAWN 6 | E743: LUFF 4 | G743: MASON 2 | I743: PETRIE | W743: COBURG | X743: 10 | Y743: 4 | Z743: 0 | AA743: 1268 | AB743: 1054 | AC743: 120.30360531309297 | AD743: 40
A744: SANDRINGHAM | C744: THOMS 2 | F744: RAYMENT 2 | I744: TOLSON 2 | L744: GAMBETTA | N744: DE LUCA | P744: ANDERSON | S744: KEMP | W744: PRESTON | X744: 10 | Y744: 4 | Z744: 0 | AA744: 1125 | AB744: 1028 | AC744: 109.44 | AD744: 40
A746: PRESTON | C746: 2 | D746: 0 | E746: =C746*6+D746 -> 12 | G746: 6 | H746: 7 | I746: =G746*6+H746 -> 43 | K746: 7 | L746: 11 | M746: =K746*6+L746 -> 53 | O746: 14 | P746: 18 | Q746: =O746*6+P746 -> 102 | S746: PRESTON | W746: SANDRINGHAM | X746: 9 | Y746: 5 | Z746: 0 | AA746: 1214 | AB746: 1109 | AC746: 109.46798917944093 | AD746: 36
A747: BRUNSWICK | C747: 3 | D747: 7 | E747: =C747*6+D747 -> 25 | G747: 5 | H747: 8 | I747: =G747*6+H747 -> 38 | K747: 8 | L747: 9 | M747: =K747*6+L747 -> 57 | O747: 11 | P747: 11 | Q747: =O747*6+P747 -> 77 | S747: LEWIS | W747: PORT MELBOURNE | X747: 8 | Y747: 6 | Z747: 0 | AA747: 1068 | AB747: 965 | AC747: 110.67357512953367 | AD747: 32
A748: BEST PLAYERS | W748: WILLIAMSTOWN | X748: 8 | Y748: 6 | Z748: 0 | AA748: 1076 | AB748: 1001 | AC748: 107.4925074925075 | AD748: 32
A749: PRESTON | C749: SUMMERS | F749: POULTER | I749: P SPARGO | L749: HUGHSON | N749: DAVIE | Q749: DINEEN | W749: BRUNSWICK | X749: 4 | Y749: 9 | Z749: 1 | AA749: 1049 | AB749: 1309 | AC749: 80.137509549274256 | AD749: 18
A750: BRUNSWICK | C750: REID | F750: PENMAN | I750: FITZGERALD | L750: DOWLING | N750: BLACKMORE | Q750: JONES | W750: PRAHRAN | X750: 4 | Y750: 10 | Z750: 0 | AA750: 1076 | AB750: 1251 | AC750: 86.011191047162271 | AD750: 16
A751: GOALKICKERS | W751: BRIGHTON | X751: 3 | Y751: 10 | Z751: 1 | AA751: 984 | AB751: 1314 | AC751: 74.885844748858446 | AD751: 14
A752: PRESTON | C752: SMITH 5 | F752: DAVIE 3 | I752: POULTER 3 | L752: HUGHSON 2 | O752: WARR | W752: YARRAVILLE | X752: 3 | Y752: 11 | Z752: 0 | AA752: 1093 | AB752: 1284 | AC752: 85.124610591900307 | AD752: 12
A753: BRUNSWICK | C753: JONES 3 | E753: FITZGERALD 2 | I753: DOWLING 2 | L753: MUTIMER 2 | O753: R THOMPSON | W753: OAKLEIGH | X753: 2 | Y753: 12 | Z753: 0 | AA753: 1028 | AB753: 1335 | AC753: 77.00374531835206 | AD753: 8
A755: COBURG | C755: 5 | D755: 6 | E755: =C755*6+D755 -> 36 | G755: 5 | H755: 9 | I755: =G755*6+H755 -> 39 | K755: 9 | L755: 14 | M755: =K755*6+L755 -> 68 | O755: 10 | P755: 15 | Q755: =O755*6+P755 -> 75 | S755: COBURG
A756: PRAHRAN | C756: 2 | D756: 0 | E756: =C756*6+D756 -> 12 | G756: 6 | H756: 9 | I756: =G756*6+H756 -> 45 | K756: 7 | L756: 10 | M756: =K756*6+L756 -> 52 | O756: 9 | P756: 13 | Q756: =O756*6+P756 -> 67 | S756: SCHAEFER
A757: BEST PLAYERS
A758: COBURG | C758: UHE | F758: ELLIOTT | I758: COLBERT | L758: LEAHY | N758: WILLOX | Q758: JENKINS
A759: PRAHRAN | C759: KENNEDY | F759: KOOP | I759: F SMITH | L759: BECK | N759: MORLEY | Q759: GOUGH
A760: GOALKICKERS
A761: COBURG | C761: BRIGGS 2 | F761: ROGERS 2 | I761: MEARS 2 | L761: COLBERT 2 | O761: LEAHY | Q761: PROUDFOOT
A762: PRAHRAN | C762: JORDAN 3 | F762: HAWKINS 2 | I762: KENNEDY 2 | L762: SMITH | N762: BOLES
A764: WILLIAMSTOWN | C764: 6 | D764: 3 | E764: =C764*6+D764 -> 39 | G764: 7 | H764: 7 | I764: =G764*6+H764 -> 49 | K764: 11 | L764: 14 | M764: =K764*6+L764 -> 80 | O764: 14 | P764: 18 | Q764: =O764*6+P764 -> 102 | S764: WILLIAMSTOWN
A765: BRIGHTON | C765: 1 | D765: 1 | E765: =C765*6+D765 -> 7 | G765: 2 | H765: 6 | I765: =G765*6+H765 -> 18 | K765: 3 | L765: 6 | M765: =K765*6+L765 -> 24 | O765: 6 | P765: 9 | Q765: =O765*6+P765 -> 45 | S765: STUART
A766: BEST PLAYERS
A767: WILLIAMSTOWN | C767: CAHILL | E767: NEIL | H767: LYNCH | K767: BROOKS | N767: BLAKE | Q767: SINCLAIR
A768: BRIGHTON | C768: BARNES | E768: SCHENCK | H768: GIBBS | K768: HUNT | N768: CAMPBELL | Q768: TOMLINS
A769: GOALKICKERS
A770: WILLIAMSTOWN | C770: SINCLAIR 3 | F770: CAHILL 3 | I770: BLAKE 3 | K770: McGRATH 2 | N770: SHADE | P770: BARNES | R770: FLYNN
A771: BRIGHTON | C771: JOHNSON 4 | F771: TUCKER | I771: WILKINS
A773: PORT MELBOURNE | C773: 0 | D773: 4 | E773: =C773*6+D773 -> 4 | G773: 5 | H773: 11 | I773: =G773*6+H773 -> 41 | K773: 6 | L773: 14 | M773: =K773*6+L773 -> 50 | O773: 11 | P773: 17 | Q773: =O773*6+P773 -> 83 | S773: OAKLEIGH
A774: OAKLEIGH | C774: 4 | D774: 4 | E774: =C774*6+D774 -> 28 | G774: 5 | H774: 5 | I774: =G774*6+H774 -> 35 | K774: 7 | L774: 9 | M774: =K774*6+L774 -> 51 | O774: 11 | P774: 12 | Q774: =O774*6+P774 -> 78 | S774: GREGORY
A775: BEST PLAYERS
A776: PORT MELBOURNE | C776: PLUMRIDGE | F776: E PERRETT | I776: TUITE | L776: LAHIFF | O776: STANBRIDGE | R776: BUCKLEY
A777: OAKLEIGH | C777: FRASER | F777: DRIVER | I777: McALLISTER | L777: WITHERS | O777: MOHR | R777: MORRIS
A778: GOALKICKERS
A779: PORT MELBOURNE | C779: LAHIFF 4 | F779: TUITE 2 | I779: HARRY | K779: PLUMRIDGE | N779: E PERRETT | Q779: BILLS | S779: KEATING
A780: OAKLEIGH | C780: FRASER 5 | F780: FLEMING 2 | I780: CRAMERI | K780: MILLER | M780: MOHR | O780: WITHERS
A782: NORTHCOTE | C782: 6 | D782: 4 | E782: =C782*6+D782 -> 40 | G782: 10 | H782: 11 | I782: =G782*6+H782 -> 71 | K782: 10 | L782: 16 | M782: =K782*6+L782 -> 76 | O782: 15 | P782: 21 | Q782: =O782*6+P782 -> 111 | S782: NORTHCOTE
A783: YARRAVILLE | C783: 2 | D783: 3 | E783: =C783*6+D783 -> 15 | G783: 5 | H783: 6 | I783: =G783*6+H783 -> 36 | K783: 10 | L783: 9 | M783: =K783*6+L783 -> 69 | O783: 12 | P783: 12 | Q783: =O783*6+P783 -> 84 | S783: McKINNON
A784: BEST PLAYERS
A785: NORTHCOTE | C785: GOULLET | F785: ROSS | I785: SEYMOUR | L785: FITZGERALD | O785: McSWAIN | R785: WOODS
A786: YARRAVILLE | C786: PETERS | F786: SHEEHAN | I786: CAMERON | L786: ROBERTSON | O786: EDWARDS | R786: FORDHAM
A787: GOALKICKERS
A788: NORTHCOTE | C788: SEYMOUR 5 | F788: BROWN 4 | I788: ROSS 2 | K788: GRAY | M788: GOULLET | O788: HONIG | Q788: SMITH
A789: YARRAVILLE | C789: FORDHAM 4 | F789: SHEEHAN 4 | I789: PETERS 2 | L789: QUIGG | N789: MITCHELL
A791: ROUND 15 | E791: 30TH JULY | J791: WEATHER | M791: RAIN | S791: PLAYED AT
D792: 1ST QTR | H792: 2ND QTR | L792: 3RD QTR | P792: FINAL | S792: NORTHCOTE
A793: NORTHCOTE | C793: 6 | D793: 4 | E793: =C793*6+D793 -> 40 | G793: 10 | H793: 8 | I793: =G793*6+H793 -> 68 | K793: 14 | L793: 14 | M793: =K793*6+L793 -> 98 | O793: 19 | P793: 19 | Q793: =O793*6+P793 -> 133 | S793: UMPIRE | X793: LADDER | AB793: ROUND | AD793: 15
A794: PORT MELBOURNE | C794: 1 | D794: 2 | E794: =C794*6+D794 -> 8 | G794: 2 | H794: 5 | I794: =G794*6+H794 -> 17 | K794: 3 | L794: 7 | M794: =K794*6+L794 -> 25 | O794: 4 | P794: 9 | Q794: =O794*6+P794 -> 33 | S794: PRESTON
A795: BEST PLAYERS | W795: TEAM | X795: W | Y795: L | Z795: D | AA795: FOR | AB795: AGST | AC795: % | AD795: PTS
A796: NORTHCOTE | C796: ROSS | F796: SEYMOUR | I796: PERKINS | L796: COLE | N796: WOODS | Q796: McSWAIN
A797: PORT MELBOURNE | C797: PLUMRIDGE | F797: BROOKER | I797: LAHIFF | L797: E PERRETT | N797: STANBRIDGE | Q797: TUITE | W797: NORTHCOTE | X797: 12 | Y797: 3 | Z797: 0 | AA797: 1565 | AB797: 1104 | AC797: 141.76 | AD797: 48
A798: GOALKICKERS | W798: COBURG | X798: 11 | Y798: 4 | Z798: 0 | AA798: 1396 | AB798: 1100 | AC798: 126.90909090909091 | AD798: 44
A799: NORTHCOTE | C799: SEYMOUR 8 | F799: BROWN 3 | I799: ROSS 2 | K799: BRAY 2 | M799: GRAY 2 | O799: BYRNE | Q799: GARRETT | W799: CAMBERWELL | X799: 11 | Y799: 4 | Z799: 0 | AA799: 1363 | AB799: 1147 | AC799: 118.83173496076722 | AD799: 44
A800: PORT MELBOURNE | C800: BEDFORD | F800: E PERRETT | J800: STANBRIDGE | N800: KEATING | W800: PRESTON | X800: 11 | Y800: 4 | Z800: 0 | AA800: 1219 | AB800: 1111 | AC800: 109.72 | AD800: 44
A802: SANDRINGHAM | C802: 2 | D802: 7 | E802: =C802*6+D802 -> 19 | G802: 7 | H802: 11 | I802: =G802*6+H802 -> 53 | K802: 12 | L802: 12 | M802: =K802*6+L802 -> 84 | O802: 17 | P802: 18 | Q802: =O802*6+P802 -> 120 | S802: BEACH ROAD | W802: SANDRINGHAM | X802: 10 | Y802: 5 | Z802: 0 | AA802: 1334 | AB802: 1195 | AC802: 111.63179916317992 | AD802: 40
A803: WILLIAMSTOWN | C803: 5 | D803: 5 | E803: =C803*6+D803 -> 35 | G803: 11 | H803: 5 | I803: =G803*6+H803 -> 71 | K803: 12 | L803: 7 | M803: =K803*6+L803 -> 79 | O803: 13 | P803: 8 | Q803: =O803*6+P803 -> 86 | S803: GREGORY | W803: PORT MELBOURNE | X803: 8 | Y803: 7 | Z803: 0 | AA803: 1101 | AB803: 1042 | AC803: 105.66218809980806 | AD803: 32
A804: BEST PLAYERS | W804: WILLIAMSTOWN | X804: 8 | Y804: 7 | Z804: 0 | AA804: 1162 | AB804: 1121 | AC804: 103.65744870651204 | AD804: 32
A805: SANDRINGHAM | C805: TOLSON | E805: LUNN | H805: McGAIN | K805: YOUNG | N805: E BOURKE | Q805: RAYMENT | W805: BRUNSWICK | X805: 5 | Y805: 9 | Z805: 1 | AA805: 1148 | AB805: 1379 | AC805: 83.248730964467001 | AD805: 22
A806: WILLIAMSTOWN | C806: BARNES | E806: LONERGAN | H806: BROOKS | K806: CAHILL | N806: SYKES | Q806: O'BRIEN | W806: YARRAVILLE | X806: 4 | Y806: 11 | Z806: 0 | AA806: 1190 | AB806: 1337 | AC806: 89.005235602094245 | AD806: 16
A807: GOALKICKERS | W807: PRAHRAN | X807: 4 | Y807: 11 | Z807: 0 | AA807: 1129 | AB807: 1348 | AC807: 83.753709198813056 | AD807: 16
A808: SANDRINGHAM | C808: BECKTON 5 | F808: McGAIN 5 | I808: RAYMENT 2 | L808: TOLSON 2 | N808: CHALLIS | P808: BAILES | R808: ANDERSON | W808: BRIGHTON | X808: 3 | Y808: 11 | Z808: 1 | AA808: 1030 | AB808: 1442 | AC808: 71.428571428571431 | AD808: 14
A809: WILLIAMSTOWN | C809: BARNES 4 | F809: CAHILL 4 | I809: BLAKE 2 | L809: BYRNE | N809: DELLER | P809: MCCABE | W809: OAKLEIGH | X809: 2 | Y809: 13 | Z809: 0 | AA809: 1111 | AB809: 1429 | AC809: 77.746675997200839 | AD809: 8
A811: BRUNSWICK | C811: 3 | D811: 3 | E811: =C811*6+D811 -> 21 | G811: 8 | H811: 8 | I811: =G811*6+H811 -> 56 | K811: 11 | L811: 14 | M811: =K811*6+L811 -> 80 | O811: 14 | P811: 15 | Q811: =O811*6+P811 -> 99 | S811: BRUNSWICK
A812: CAMBERWELL | C812: 4 | D812: 2 | E812: =C812*6+D812 -> 26 | G812: 5 | H812: 3 | I812: =G812*6+H812 -> 33 | K812: 7 | L812: 6 | M812: =K812*6+L812 -> 48 | O812: 10 | P812: 10 | Q812: =O812*6+P812 -> 70 | S812: McKINNON
A813: BEST PLAYERS
A814: BRUNSWICK | C814: WOODS | F814: JONES | I814: DOWLING | L814: FITZGERALD | O814: FOLEY | Q814: MUTIMER
A815: CAMBERWELL | C815: WILLIAMS | F815: DYBALL | I815: PETRIE | L815: O'NEILL | O815: LUFF | Q815: BOOTHMAN
A816: GOALKICKERS
A817: BRUNSWICK | C817: JONES 6 | E817: MUTIMER 4 | H817: FITZGERALD | K817: CHAPMAN | N817: McNEILL | P817: WHITELEY
A818: CAMBERWELL | C818: LUFF 3 | E818: LAWN 2 | H818: COLLINS 2 | K818: W COFFIN | N818: PETRIE | P818: WARTMAN
A820: YARRAVILLE | C820: 5 | D820: 1 | E820: =C820*6+D820 -> 31 | G820: 8 | H820: 3 | I820: =G820*6+H820 -> 51 | K820: 12 | L820: 9 | M820: =K820*6+L820 -> 81 | O820: 14 | P820: 13 | Q820: =O820*6+P820 -> 97 | S820: YARRAVILLE
A821: PRAHRAN | C821: 3 | D821: 4 | E821: =C821*6+D821 -> 22 | G821: 3 | H821: 7 | I821: =G821*6+H821 -> 25 | K821: 6 | L821: 7 | M821: =K821*6+L821 -> 43 | O821: 7 | P821: 11 | Q821: =O821*6+P821 -> 53 | S821: LESTER
A822: BEST PLAYERS
A823: YARRAVILLE | C823: CAMERON | F823: WUNHYM | I823: BRUMBY | L823: SHEEHAN | O823: WHITE | R823: MILBURN
A824: PRAHRAN | C824: KENNEDY | F824: KOOP | I824: BANKS | L824: HINKS | O824: HAWKINS | R824: JORDAN
A825: GOALKICKERS
A826: YARRAVILLE | C826: SHEEHAN 4 | F826: BRUMBY 3 | I826: FORDHAM 2 | L826: W BUCKLEY 2 | O826: CAMERON | Q826: ROBERTSON | T826: MITCHELL
A827: PRAHRAN | C827: HAWKINS 3 | F827: HINKS 2 | I827: JORDAN | L827: KENNEDY
A829: COBURG | C829: 4 | D829: 7 | E829: =C829*6+D829 -> 31 | G829: 8 | H829: 12 | I829: =G829*6+H829 -> 60 | K829: 11 | L829: 14 | M829: =K829*6+L829 -> 80 | O829: 18 | P829: 20 | Q829: =O829*6+P829 -> 128 | S829: ELSTERNWICK PARK
A830: BRIGHTON | C830: 5 | D830: 2 | E830: =C830*6+D830 -> 32 | G830: 6 | H830: 3 | I830: =G830*6+H830 -> 39 | K830: 6 | L830: 7 | M830: =K830*6+L830 -> 43 | O830: 6 | P830: 10 | Q830: =O830*6+P830 -> 46 | S830: GLOVER
A831: BEST PLAYERS
A832: COBURG | C832: MARTIN | F832: LEAHY | I832: JENKINS | L832: CAMPBELL | O832: KIGHT | R832: DUNCAN
A833: BRIGHTON | C833: TUCKER | F833: HUNT | I833: BARNES | L833: SCHENCK | O833: CAMPBELL | R833: TOMLINS
A834: GOALKICKERS
A835: COBURG | C835: WILLOX 3 | F835: MEARS 3 | I835: BROOM 3 | K835: CAMPBELL 3 | N835: BRIGGS 2 | Q835: COLBERT 2 | T835: JENKINS | W835: LEAHY
A836: BRIGHTON | C836: JOHNSON 5 | F836: TUCKER
A838: PRESTON | C838: 6 | D838: 1 | E838: =C838*6+D838 -> 37 | G838: 10 | H838: 3 | I838: =G838*6+H838 -> 63 | K838: 11 | L838: 6 | M838: =K838*6+L838 -> 72 | O838: 14 | P838: 10 | Q838: =O838*6+P838 -> 94 | S838: OAKLEIGH
A839: OAKLEIGH | C839: 3 | D839: 4 | E839: =C839*6+D839 -> 22 | G839: 6 | H839: 7 | I839: =G839*6+H839 -> 43 | K839: 7 | L839: 12 | M839: =K839*6+L839 -> 54 | O839: 11 | P839: 17 | Q839: =O839*6+P839 -> 83 | S839: MURRAY
A840: BEST PLAYERS
A841: PRESTON | C841: HUGHSON | F841: POULTER | I841: SUMMERS | L841: WARR | O841: DAVIE | R841: MONOHAN
A842: OAKLEIGH | C842: CHESSWASS | F842: YEMM | I842: DRIVER | L842: WILTSHIRE | O842: RUDOLPH | R842: HESTER
A843: GOALKICKERS
A844: PRESTON | C844: SMITH 4 | F844: DAVIE 3 | I844: HUGHSON 3 | L844: WARR 2 | N844: SUMMERS | Q844: DOWLING
A845: OAKLEIGH | C845: MILLER 3 | F845: CRAMERI 2 | I845: YEMM 2 | L845: FRASER | N845: WILTSHIRE | Q845: BAKER
A847: ROUND 16 | E847: 6TH AUGUST | J847: WEATHER | M847: COOL CLOUDY NORTH BREEZE | S847: PLAYED AT
D848: 1ST QTR | H848: 2ND QTR | L848: 3RD QTR | P848: FINAL | S848: COBURG
A849: COBURG | C849: 1 | D849: 0 | E849: =C849*6+D849 -> 6 | G849: 5 | H849: 13 | I849: =G849*6+H849 -> 43 | K849: 6 | L849: 17 | M849: =K849*6+L849 -> 53 | O849: 13 | P849: 26 | Q849: =O849*6+P849 -> 104 | S849: UMPIRE | X849: LADDER | AB849: ROUND | AD849: 16
A850: PORT MELBOURNE | C850: 5 | D850: 4 | E850: =C850*6+D850 -> 34 | G850: 6 | H850: 5 | I850: =G850*6+H850 -> 41 | K850: 10 | L850: 8 | M850: =K850*6+L850 -> 68 | O850: 12 | P850: 8 | Q850: =O850*6+P850 -> 80 | S850: MURRAY
A851: BEST PLAYERS | W851: TEAM | X851: W | Y851: L | Z851: D | AA851: FOR | AB851: AGST | AC851: % | AD851: PTS
A852: COBURG | C852: CAMPBELL | F852: JENKINS | I852: UHE | K852: DUNCAN | N852: MEARS | Q852: BROOM
A853: PORT MELBOURNE | C853: PLUMRIDGE | F853: HARRISON | I853: HARRY | K853: REES | N853: STANBRIDGE | Q853: LOVETT | W853: NORTHCOTE | X853: 13 | Y853: 3 | Z853: 0 | AA853: 1685 | AB853: 1196 | AC853: 140.89 | AD853: 52
A854: GOALKICKERS | W854: COBURG | X854: 12 | Y854: 4 | Z854: 0 | AA854: 1500 | AB854: 1180 | AC854: 127.11864406779661 | AD854: 48
A855: COBURG | C855: DUNCAN 5 | F855: STOCKDALE 2 | I855: JENKINS | K855: HARRIS | M855: VOIGHT | O855: MEARS | Q855: BROOM | S855: CAMPBELL | W855: CAMBERWELL | X855: 12 | Y855: 4 | Z855: 0 | AA855: 1501 | AB855: 1236 | AC855: 121.44012944983818 | AD855: 48
A856: PORT MELBOURNE | C856: BARNES 2 | E856: RUSDEN 2 | G856: BOQUEST 2 | J856: LAHIFF | L856: TUITE | N856: LEGGO | P856: REES | Q856: KEATING | S856: BAKER | W856: SANDRINGHAM | X856: 11 | Y856: 5 | Z856: 0 | AA856: 1410 | AB856: 1258 | AC856: 112.08267090620032 | AD856: 44
A858: WILLIAMSTOWN | C858: 9 | D858: 6 | E858: =C858*6+D858 -> 60 | G858: 14 | H858: 7 | I858: =G858*6+H858 -> 91 | K858: 16 | L858: 11 | M858: =K858*6+L858 -> 107 | O858: 18 | P858: 13 | Q858: =O858*6+P858 -> 121 | S858: WILLIAMSTOWN | W858: PRESTON | X858: 11 | Y858: 5 | Z858: 0 | AA858: 1278 | AB858: 1232 | AC858: 103.73 | AD858: 44
A859: PRESTON | C859: 1 | D859: 0 | E859: =C859*6+D859 -> 6 | G859: 3 | H859: 4 | I859: =G859*6+H859 -> 22 | K859: 4 | L859: 10 | M859: =K859*6+L859 -> 34 | O859: 7 | P859: 17 | Q859: =O859*6+P859 -> 59 | S859: LESTER | W859: WILLIAMSTOWN | X859: 9 | Y859: 7 | Z859: 0 | AA859: 1283 | AB859: 1180 | AC859: 108.72881355932203 | AD859: 36
A860: BEST PLAYERS | W860: PORT MELBOURNE | X860: 8 | Y860: 8 | Z860: 0 | AA860: 1181 | AB860: 1146 | AC860: 103.05410122164049 | AD860: 32
A861: WILLIAMSTOWN | C861: BARNES | E861: SHADE | H861: DELLER | K861: LONERGAN | N861: BLAKE | Q861: LYNCH | W861: BRUNSWICK | X861: 6 | Y861: 9 | Z861: 1 | AA861: 1287 | AB861: 1408 | AC861: 91.40625 | AD861: 26
A862: PRESTON | C862: MOONEY | E862: MONOHAN | H862: HUGHSON | K862: UNDERHILL | N862: HUNTER | Q862: POULTER | W862: YARRAVILLE | X862: 4 | Y862: 12 | Z862: 0 | AA862: 1279 | AB862: 1475 | AC862: 86.711864406779668 | AD862: 16
A863: GOALKICKERS | W863: PRAHRAN | X863: 4 | Y863: 12 | Z863: 0 | AA863: 1221 | AB863: 1468 | AC863: 83.174386920980922 | AD863: 16
A864: WILLIAMSTOWN | C864: BARNES 7 | F864: BLAKE 4 | H864: SHADE | J864: GRANT | L864: CAHILL | N864: H STANWAY | Q864: WILLIAMSON | T864: NEILL | W864: BRIGHTON | X864: 3 | Y864: 12 | Z864: 1 | AA864: 1059 | AB864: 1581 | AC864: 66.982922201138521 | AD864: 14
A865: PRESTON | C865: POULTER 2 | F865: HUNTER 2 | I865: HUGHSON | L865: SMITH | N865: ELLIS | W865: OAKLEIGH | X865: 2 | Y865: 14 | Z865: 0 | AA865: 1174 | AB865: 1505 | AC865: 78.006644518272424 | AD865: 8
A867: CAMBERWELL | C867: 7 | D867: 4 | E867: =C867*6+D867 -> 46 | G867: 10 | H867: 5 | I867: =G867*6+H867 -> 65 | K867: 17 | L867: 12 | M867: =K867*6+L867 -> 114 | O867: 21 | P867: 12 | Q867: =O867*6+P867 -> 138 | S867: CAMBERWELL
A868: YARRAVILLE | C868: 3 | D868: 2 | E868: =C868*6+D868 -> 20 | G868: 10 | H868: 9 | I868: =G868*6+H868 -> 69 | K868: 10 | L868: 9 | M868: =K868*6+L868 -> 69 | O868: 12 | P868: 17 | Q868: =O868*6+P868 -> 89 | S868: NOWLAN
A869: BEST PLAYERS
A870: CAMBERWELL | C870: MASON | F870: DYBALL | I870: PETRIE | L870: O'NEILL | O870: R WILLIAMS | R870: ROWE
A871: YARRAVILLE | C871: CAMERON | F871: QUIGG | I871: WUNHYMM | L871: FORDHAM | O871: RYAN | R871: FREW
A872: GOALKICKERS
A873: CAMBERWELL | C873: TROTTER 6 | F873: LAWN 4 | H873: ROWE 3 | J873: LUFF 2 | L873: COLLINS 2 | N873: O'NEILL | P873: W COFFIN | R873: V COFFIN | U873: R WILLIAMS
A874: YARRAVILLE | C874: FORDHAM 3 | F874: SHEEHAN 3 | I874: PREWETT 2 | L874: W BUCKLEY | O874: CAMERON | Q874: MITCHELL
A876: BRUNSWICK | C876: 4 | D876: 4 | E876: =C876*6+D876 -> 28 | G876: 10 | H876: 6 | I876: =G876*6+H876 -> 66 | K876: 15 | L876: 10 | M876: =K876*6+L876 -> 100 | O876: 21 | P876: 13 | Q876: =O876*6+P876 -> 139 | S876: BRUNSWICK
A877: BRIGHTON | C877: 1 | D877: 0 | E877: =C877*6+D877 -> 6 | G877: 2 | H877: 3 | I877: =G877*6+H877 -> 15 | K877: 3 | L877: 9 | M877: =K877*6+L877 -> 27 | O877: 3 | P877: 11 | Q877: =O877*6+P877 -> 29 | S877: STUART
A878: BEST PLAYERS
A879: BRUNSWICK | C879: BLACKMORE | F879: JONES | I879: EUDEY | L879: DOWLING | O879: KENNETT | R879: FITZGERALD
A880: BRIGHTON | C880: TOMLINS | F880: GIBBS | I880: TUCKER | L880: H JOHNSON | O880: AMINDI | R880: SCHENCK
A881: GOALKICKERS
A882: BRUNSWICK | C882: JONES 11 | F882: DOWLING 5 | I882: MUTIMER 2 | L882: FITZGERALD | O882: MAYNES | Q882: KENNETT
A883: BRIGHTON | C883: JOHNSON 2 | F883: WILKINS
A885: SANDRINGHAM | C885: 4 | D885: 6 | E885: =C885*6+D885 -> 30 | G885: 6 | H885: 8 | I885: =G885*6+H885 -> 44 | K885: 7 | L885: 10 | M885: =K885*6+L885 -> 52 | O885: 11 | P885: 10 | Q885: =O885*6+P885 -> 76 | S885: OAKLEIGH
A886: OAKLEIGH | C886: 0 | D886: 2 | E886: =C886*6+D886 -> 2 | G886: 2 | H886: 12 | I886: =G886*6+H886 -> 24 | K886: 5 | L886: 18 | M886: =K886*6+L886 -> 48 | O886: 7 | P886: 21 | Q886: =O886*6+P886 -> 63 | S886: McKINNON
A887: BEST PLAYERS
A888: SANDRINGHAM | C888: LUNN | E888: BAILES | H888: YOUNG | K888: RAYMENT | N888: BECKTON | Q888: E BOURKE
A889: OAKLEIGH | C889: RUDOLPH | E889: CHESSWASS | H889: FLEMING | K889: YEMM | N889: WITHERS | Q889: BAKER
A890: GOALKICKERS
A891: SANDRINGHAM | C891: BAILES 5 | F891: FORBES 3 | I891: RAYMENT | K891: DE LUCA | M891: MCGAIN
A892: OAKLEIGH | C892: FRASER 2 | F892: FLEMING 2 | I892: YANN | K892: YEMM | M892: CRAMERI
A894: NORTHCOTE | C894: 1 | D894: 4 | E894: =C894*6+D894 -> 10 | G894: 9 | H894: 9 | I894: =G894*6+H894 -> 63 | K894: 11 | L894: 13 | M894: =K894*6+L894 -> 79 | O894: 17 | P894: 18 | Q894: =O894*6+P894 -> 120 | S894: NORTHCOTE
A895: PRAHRAN | C895: 4 | D895: 4 | E895: =C895*6+D895 -> 28 | G895: 8 | H895: 5 | I895: =G895*6+H895 -> 53 | K895: 10 | L895: 6 | M895: =K895*6+L895 -> 66 | O895: 14 | P895: 8 | Q895: =O895*6+P895 -> 92 | S895: GREGORY
A896: BEST PLAYERS
A897: NORTHCOTE | C897: ROWE | E897: GRAY | H897: SMITH | K897: PERKINS | N897: SEYMOUR | Q897: GARRETT
A898: PRAHRAN | C898: GOUGH | E898: HAWKINS | H898: TABATEAU | K898: KENNEDY | N898: KOOP | Q898: WHITE
A899: GOALKICKERS
A900: NORTHCOTE | C900: SEYMOUR 5 | F900: GRAY 4 | H900: ROWE 3 | K900: BROWN 3 | N900: ROSS 2
A901: PRAHRAN | C901: HAWKINS 6 | F901: KOOP 2 | H901: KENNEDY 2 | K901: WILLIAMS | N901: SALTER | Q901: HARRIS | T901: BANKS
A903: ROUND 17 | D903: 13TH AUGUST | G903: WEATHER | I903: VERY COLD RAIN HAIL STRONG N.W. WIND GROUNDS BAD | S903: PLAYED AT
D904: 1ST QTR | H904: 2ND QTR | L904: 3RD QTR | P904: FINAL | S904: BEACH ROAD
A905: SANDRINGHAM | C905: 4 | D905: 7 | E905: =C905*6+D905 -> 31 | G905: 4 | H905: 8 | I905: =G905*6+H905 -> 32 | K905: 9 | L905: 16 | M905: =K905*6+L905 -> 70 | O905: 11 | P905: 18 | Q905: =O905*6+P905 -> 84 | S905: UMPIRE | X905: LADDER | AB905: ROUND | AD905: 17
A906: NORTHCOTE | C906: 2 | D906: 3 | E906: =C906*6+D906 -> 15 | G906: 5 | H906: 6 | I906: =G906*6+H906 -> 36 | K906: 7 | L906: 7 | M906: =K906*6+L906 -> 49 | O906: 8 | P906: 14 | Q906: =O906*6+P906 -> 62 | S906: NOWLAN
A907: BEST PLAYERS | W907: TEAM | X907: W | Y907: L | Z907: D | AA907: FOR | AB907: AGST | AC907: % | AD907: PTS
A908: SANDRINGHAM | C908: TOLSON | E908: FITZGERALD | H908: BECKTON | K908: RAYMENT | N908: GAMBETTA | Q908: MILBURN
A909: NORTHCOTE | C909: ROSS | E909: PERKINS | H909: LYNGCOLN | K909: HUMPHRIES | N909: SMITH | Q909: BROWN | W909: NORTHCOTE | X909: 13 | Y909: 4 | Z909: 0 | AA909: 1747 | AB909: 1280 | AC909: 136.48 | AD909: 52
A910: GOALKICKERS | W910: COBURG | X910: 13 | Y910: 4 | Z910: 0 | AA910: 1596 | AB910: 1226 | AC910: 130.17944535073408 | AD910: 52
A911: SANDRINGHAM | C911: MCGAIN 3 | F911: BAILES 2 | H911: BECKTON | J911: THOMS | L911: FITZGERALD | O911: RAYMENT | Q911: TOLSON | S911: KEMP | W911: CAMBERWELL | X911: 12 | Y911: 5 | Z911: 0 | AA911: 1574 | AB911: 1321 | AC911: 119.15215745647237 | AD911: 48
A912: NORTHCOTE | C912: SEYMOUR 3 | F912: COLE 2 | I912: BROWN 2 | L912: FITZGERALD | W912: SANDRINGHAM | X912: 12 | Y912: 5 | Z912: 0 | AA912: 1494 | AB912: 1320 | AC912: 113.18181818181819 | AD912: 48
A914: PORT MELBOURNE | C914: 4 | D914: 10 | E914: =C914*6+D914 -> 34 | G914: 7 | H914: 10 | I914: =G914*6+H914 -> 52 | K914: 10 | L914: 17 | M914: =K914*6+L914 -> 77 | O914: 11 | P914: 19 | Q914: =O914*6+P914 -> 85 | S914: PORT MELBOURNE | W914: PRESTON | X914: 12 | Y914: 5 | Z914: 0 | AA914: 1407 | AB914: 1321 | AC914: 106.51 | AD914: 48
A915: CAMBERWELL | C915: 3 | D915: 0 | E915: =C915*6+D915 -> 18 | G915: 6 | H915: 3 | I915: =G915*6+H915 -> 39 | K915: 8 | L915: 6 | M915: =K915*6+L915 -> 54 | O915: 10 | P915: 13 | Q915: =O915*6+P915 -> 73 | S915: MURRAY | W915: WILLIAMSTOWN | X915: 9 | Y915: 8 | Z915: 0 | AA915: 1337 | AB915: 1250 | AC915: 106.96 | AD915: 36
A916: BEST PLAYERS | W916: PORT MELBOURNE | X916: 9 | Y916: 8 | Z916: 0 | AA916: 1266 | AB916: 1219 | AC916: 103.85561936013126 | AD916: 36
A917: PORT MELBOURNE | C917: REES | F917: LOVETT | I917: LAHIFF | K917: BARNES | N917: BROOKER | Q917: BAKER | W917: BRUNSWICK | X917: 7 | Y917: 9 | Z917: 1 | AA917: 1357 | AB917: 1462 | AC917: 92.818057455540355 | AD917: 30
A918: CAMBERWELL | C918: HENDERSON | F918: JONES | I918: PETRIE | K918: O'NEILL | N918: PIERCE | Q918: LUFF | W918: YARRAVILLE | X918: 4 | Y918: 13 | Z918: 0 | AA918: 1325 | AB918: 1571 | AC918: 84.341183959261613 | AD918: 16
A919: GOALKICKERS | W919: PRAHRAN | X919: 4 | Y919: 13 | Z919: 0 | AA919: 1310 | AB919: 1597 | AC919: 82.028804007514083 | AD919: 16
A920: PORT MELBOURNE | C920: LAHIFF 3 | E920: REES 2 | G920: KEATING 2 | J920: BARNES | L920: HYDE | N920: BROOKER | Q920: RUSDEN | W920: BRIGHTON | X920: 3 | Y920: 13 | Z920: 1 | AA920: 1103 | AB920: 1648 | AC920: 66.929611650485441 | AD920: 14
A921: CAMBERWELL | C921: LUFF 5 | E921: LAWN | G921: MASON | I921: O'NEILL | K921: V COFFIN | N921: PETRIE | W921: OAKLEIGH | X921: 3 | Y921: 14 | Z921: 0 | AA921: 1241 | AB921: 1549 | AC921: 80.116204002582307 | AD921: 12
A923: BRUNSWICK | C923: 4 | D923: 5 | E923: =C923*6+D923 -> 29 | G923: 5 | H923: 9 | I923: =G923*6+H923 -> 39 | K923: 8 | L923: 9 | M923: =K923*6+L923 -> 57 | O923: 10 | P923: 10 | Q923: =O923*6+P923 -> 70 | S923: BRUNSWICK
A924: WILLIAMSTOWN | C924: 2 | D924: 0 | E924: =C924*6+D924 -> 12 | G924: 4 | H924: 7 | I924: =G924*6+H924 -> 31 | K924: 5 | L924: 12 | M924: =K924*6+L924 -> 42 | O924: 7 | P924: 12 | Q924: =O924*6+P924 -> 54 | S924: McKINNON
A925: BEST PLAYERS
A926: BRUNSWICK | C926: PENMAN | E926: FITZGERALD | H926: BLACKMORE | K926: MURPHY | N926: JONES | Q926: DOWLING
A927: WILLIAMSTOWN | C927: L DREW | E927: BROOKS | H927: DELLER | K927: CUMMING | N927: SINCLAIR | Q927: HYDE
A928: GOALKICKERS
A929: BRUNSWICK | C929: JONES 6 | F929: FITZGERALD | I929: McNEIL | K929: WHITELEY | N929: KENNETT
A930: WILLIAMSTOWN | C930: HILL 2 | F930: BARNES | I930: CAHILL | K930: BLAKE | N930: H STANWAY | Q930: JOHNS
A932: OAKLEIGH | C932: 1 | D932: 1 | E932: =C932*6+D932 -> 7 | G932: 5 | H932: 5 | I932: =G932*6+H932 -> 35 | K932: 5 | L932: 9 | M932: =K932*6+L932 -> 39 | O932: 9 | P932: 13 | Q932: =O932*6+P932 -> 67 | S932: OAKLEIGH
A933: BRIGHTON | C933: 2 | D933: 2 | E933: =C933*6+D933 -> 14 | G933: 3 | H933: 5 | I933: =G933*6+H933 -> 23 | K933: 4 | L933: 12 | M933: =K933*6+L933 -> 36 | O933: 5 | P933: 14 | Q933: =O933*6+P933 -> 44 | S933: GREGORY
A934: BEST PLAYERS
A935: OAKLEIGH | C935: FLEMING | F935: DRIVER | I935: WITHERS | L935: RUDOLPH | O935: WILTSHIRE | R935: CRAMERI
A936: BRIGHTON | C936: H JOHNSON | F936: O'BRIEN | I936: HUNT | L936: SCHENCK | O936: POULTER | R936: GIBBS
A937: GOALKICKERS
A938: OAKLEIGH | C938: CRAMERI 3 | F938: MILLER 3 | I938: FRASER | L938: YEMM | O938: MOHR
A939: BRIGHTON | C939: JOHNSON 2 | F939: POULTER | I939: AVERY | L939: WILKINS
A941: PRESTON | C941: 6 | D941: 3 | E941: =C941*6+D941 -> 39 | G941: 13 | H941: 5 | I941: =G941*6+H941 -> 83 | K941: 16 | L941: 8 | M941: =K941*6+L941 -> 104 | O941: 20 | P941: 9 | Q941: =O941*6+P941 -> 129 | S941: TOORAK PARK
A942: PRAHRAN | C942: 2 | D942: 4 | E942: =C942*6+D942 -> 16 | G942: 7 | H942: 9 | I942: =G942*6+H942 -> 51 | K942: 10 | L942: 12 | M942: =K942*6+L942 -> 72 | O942: 12 | P942: 17 | Q942: =O942*6+P942 -> 89 | S942: STUART
A943: BEST PLAYERS
A944: PRESTON | C944: HUGHSON | F944: WARR | I944: SMITH | L944: CAMERON | O944: HARDING | R944: DOWLING
A945: PRAHRAN | C945: GOUGH | F945: KOOP | I945: WHITE | L945: TABATEAU | O945: FINLAYSON | R945: BANKS
A946: GOALKICKERS
A947: PRESTON | C947: BIRD 4 | E947: DAVIE 3 | G947: WARR 3 | I947: TAYLOR 3 | K947: HUGHSON 2 | N947: HARDING 2 | Q947: LANGWELL | T947: CAMERON | W947: SPARGO
A948: PRAHRAN | C948: SALTER 3 | E948: HAWKINS 2 | H948: WILLIAMS 2 | K948: KOOP 2 | M948: JORDAN | O948: KENNEDY | Q948: HINKS
A950: COBURG | C950: 2 | D950: 5 | E950: =C950*6+D950 -> 17 | G950: 6 | H950: 9 | I950: =G950*6+H950 -> 45 | K950: 10 | L950: 13 | M950: =K950*6+L950 -> 73 | O950: 13 | P950: 18 | Q950: =O950*6+P950 -> 96 | S950: YARRAVILLE
A951: YARRAVILLE | C951: 0 | D951: 5 | E951: =C951*6+D951 -> 5 | G951: 2 | H951: 8 | I951: =G951*6+H951 -> 20 | K951: 5 | L951: 12 | M951: =K951*6+L951 -> 42 | O951: 5 | P951: 16 | Q951: =O951*6+P951 -> 46 | S951: LESTER
A952: BEST PLAYERS
A953: COBURG | C953: LOWE | F953: VOIGHT | I953: DUNCAN | L953: KIGHT | O953: BROOM | R953: STOCKDALE
A954: YARRAVILLE | C954: WUNHYM | F954: FORDHAM | I954: FREW | L954: BRUMBY | O954: QUIGG | R954: FULLWOOD
A955: GOALKICKERS
A956: COBURG | C956: LOWE 6 | F956: BROOM 3 | I956: JENKINS | L956: GRIFFITHS | O956: MEARS | Q956: COLBERT
A957: YARRAVILLE | C957: FORDHAM 2 | F957: PREWETT 2 | I957: SHEEHAN
A959: ROUND 18 | E959: 20TH AUGUST | J959: WEATHER | M959: FINE | S959: PLAYED AT
D960: 1ST QTR | H960: 2ND QTR | L960: 3RD QTR | P960: FINAL | S960: COBURG
A961: COBURG | C961: 1 | D961: 2 | E961: =C961*6+D961 -> 8 | G961: 7 | H961: 5 | I961: =G961*6+H961 -> 47 | K961: 8 | L961: 9 | M961: =K961*6+L961 -> 57 | O961: 15 | P961: 18 | Q961: =O961*6+P961 -> 108 | S961: UMPIRE | X961: LADDER | AB961: ROUND | AD961: 18
A962: SANDRINGHAM | C962: 4 | D962: 4 | E962: =C962*6+D962 -> 28 | G962: 6 | H962: 7 | I962: =G962*6+H962 -> 43 | K962: 8 | L962: 8 | M962: =K962*6+L962 -> 56 | O962: 8 | P962: 8 | Q962: =O962*6+P962 -> 56 | S962: STUART
A963: BEST PLAYERS | W963: TEAM | X963: W | Y963: L | Z963: D | AA963: FOR | AB963: AGST | AC963: % | AD963: PTS
A964: COBURG | C964: JENKINS | F964: DUNCAN | I964: MEARS | K964: HARRY | N964: LAEHY | Q964: BROOM
A965: SANDRINGHAM | C965: E BOURKE | F965: LUNN | I965: KEMP | K965: YOUNG | N965: TOLSON | Q965: FORBES | W965: COBURG | X965: 14 | Y965: 4 | Z965: 0 | AA965: 1704 | AB965: 1282 | AC965: 132.9173166926677 | AD965: 56
A966: GOALKICKERS | W966: NORTHCOTE | X966: 13 | Y966: 5 | Z966: 0 | AA966: 1831 | AB966: 1374 | AC966: 133.26 | AD966: 52
A967: COBURG | C967: MEARS 5 | E967: BRIGGS 4 | G967: JENKINS | I967: WILLOX | K967: HARRIS | M967: ROGERS | O967: PROUDFOOT | R967: BROOM | W967: PRESTON | X967: 13 | Y967: 5 | Z967: 0 | AA967: 1496 | AB967: 1395 | AC967: 107.24 | AD967: 52
A968: SANDRINGHAM | C968: RAYMENT 2 | F968: FORBES 2 | I968: BECKTON | K968: BAILES | M968: FITZGERALD | P968: McGAIN | W968: CAMBERWELL | X968: 12 | Y968: 6 | Z968: 0 | AA968: 1648 | AB968: 1410 | AC968: 116.87943262411348 | AD968: 48
A970: PRESTON | C970: 1 | D970: 8 | E970: =C970*6+D970 -> 14 | G970: 6 | H970: 13 | I970: =G970*6+H970 -> 49 | K970: 9 | L970: 18 | M970: =K970*6+L970 -> 72 | O970: 11 | P970: 23 | Q970: =O970*6+P970 -> 89 | S970: PRESTON | W970: SANDRINGHAM | X970: 12 | Y970: 6 | Z970: 0 | AA970: 1550 | AB970: 1428 | AC970: 108.54341736694678 | AD970: 48
A971: CAMBERWELL | C971: 5 | D971: 1 | E971: =C971*6+D971 -> 31 | G971: 7 | H971: 3 | I971: =G971*6+H971 -> 45 | K971: 8 | L971: 6 | M971: =K971*6+L971 -> 54 | O971: 11 | P971: 8 | Q971: =O971*6+P971 -> 74 | S971: McKINNON | W971: PORT MELBOURNE | X971: 10 | Y971: 8 | Z971: 0 | AA971: 1373 | AB971: 1267 | AC971: 108.36621941594318 | AD971: 40
A972: BEST PLAYERS | W972: WILLIAMSTOWN | X972: 9 | Y972: 9 | Z972: 0 | AA972: 1385 | AB972: 1357 | AC972: 102.06337509211495 | AD972: 36
A973: PRESTON | C973: HUGHSON | F973: HARDING | I973: POULTER | L973: DOWLING | N973: MONOHAN | Q973: WARR | W973: BRUNSWICK | X973: 8 | Y973: 9 | Z973: 1 | AA973: 1451 | AB973: 1546 | AC973: 93.855109961190166 | AD973: 34
A974: CAMBERWELL | C974: CLAMP | F974: HENDERSON | I974: COFFIN | L974: O'NEILL | N974: LUFF | Q974: MASON | W974: YARRAVILLE | X974: 5 | Y974: 13 | Z974: 0 | AA974: 1406 | AB974: 1642 | AC974: 85.63 | AD974: 20
A975: GOALKICKERS | W975: PRAHRAN | X975: 5 | Y975: 13 | Z975: 0 | AA975: 1419 | AB975: 1663 | AC975: 85.327720986169567 | AD975: 20
A976: PRESTON | C976: WARR 3 | E976: BIRD 3 | G976: DAVIE 2 | I976: HUGHSON | L976: LANGWELL | O976: UNDERHILL | W976: BRIGHTON | X976: 3 | Y976: 14 | Z976: 1 | AA976: 1169 | AB976: 1757 | AC976: 66.533864541832671 | AD976: 14
A977: CAMBERWELL | C977: LUFF 5 | E977: LAWN 3 | G977: PETRIE | I977: R WILLIAMS | W977: OAKLEIGH | X977: 3 | Y977: 15 | Z977: 0 | AA977: 1312 | AB977: 1630 | AC977: 80.49 | AD977: 12
A979: PORT MELBOURNE | C979: 3 | D979: 5 | E979: =C979*6+D979 -> 23 | G979: 6 | H979: 8 | I979: =G979*6+H979 -> 44 | K979: 10 | L979: 17 | M979: =K979*6+L979 -> 77 | O979: 14 | P979: 23 | Q979: =O979*6+P979 -> 107 | S979: PORT MELBOURNE
A980: WILLIAMSTOWN | C980: 0 | D980: 1 | E980: =C980*6+D980 -> 1 | G980: 4 | H980: 9 | I980: =G980*6+H980 -> 33 | K980: 4 | L980: 9 | M980: =K980*6+L980 -> 33 | O980: 6 | P980: 12 | Q980: =O980*6+P980 -> 48 | S980: HASSETT
A981: BEST PLAYERS
A982: PORT MELBOURNE | C982: LAHIFF | F982: LEGGO | I982: BARNES | L982: KEATING | O982: REES | R982: LOVETT
A983: WILLIAMSTOWN | C983: LONERGAN | F983: BROOKS | I983: LYNCH | L983: SINCLAIR | O983: CAHILL | R983: WILLIAMSON
A984: GOALKICKERS
A985: PORT MELBOURNE | C985: KEATING 4 | F985: LAHIFF 3 | I985: RUSDEN 3 | L985: BARNES 2 | O985: HYDE | Q985: ADAMS
A986: WILLIAMSTOWN | C986: McDONNELL 3 | F986: BLAKE 2 | I986: CAHILL
A988: BRUNSWICK | C988: 2 | D988: 2 | E988: =C988*6+D988 -> 14 | G988: 6 | H988: 3 | I988: =G988*6+H988 -> 39 | K988: 10 | L988: 8 | M988: =K988*6+L988 -> 68 | O988: 14 | P988: 10 | Q988: =O988*6+P988 -> 94 | S988: BRUNSWICK
A989: NORTHCOTE | C989: 4 | D989: 4 | E989: =C989*6+D989 -> 28 | G989: 8 | H989: 6 | I989: =G989*6+H989 -> 54 | K989: 9 | L989: 8 | M989: =K989*6+L989 -> 62 | O989: 12 | P989: 12 | Q989: =O989*6+P989 -> 84 | S989: GREGORY
A990: BEST PLAYERS
A991: BRUNSWICK | C991: ARRELL | F991: WOODS | I991: FOLEY | L991: MURPHY | O991: BLACKMORE | R991: DOWLING
A992: NORTHCOTE | C992: SMITH | F992: ROSS | I992: ROWE | L992: HONIG | O992: COLE | R992: LYNGCOLN
A993: GOALKICKERS
A994: BRUNSWICK | C994: MAYNES 4 | F994: PENMAN 3 | I994: MUTIMER 2 | L994: JONES 2 | N994: FITZGERALD | Q994: DOWLING | T994: McNEILL
A995: NORTHCOTE | C995: SEYMOUR 5 | F995: BYRNE 3 | I995: GRAY | K995: BROWN | M995: SMITH
A997: PRAHRAN | C997: 7 | D997: 2 | E997: =C997*6+D997 -> 44 | G997: 9 | H997: 4 | I997: =G997*6+H997 -> 58 | K997: 14 | L997: 10 | M997: =K997*6+L997 -> 94 | O997: 16 | P997: 13 | Q997: =O997*6+P997 -> 109 | S997: TOORAK PARK
A998: BRIGHTON | C998: 0 | D998: 8 | E998: =C998*6+D998 -> 8 | G998: 4 | H998: 14 | I998: =G998*6+H998 -> 38 | K998: 7 | L998: 14 | M998: =K998*6+L998 -> 56 | O998: 8 | P998: 18 | Q998: =O998*6+P998 -> 66 | S998: LESTER
A999: BEST PLAYERS
A1000: PRAHRAN | C1000: WHITE | F1000: FARNAN | I1000: GOUGH | L1000: KOOP | O1000: SALTER | R1000: FINLAYSON
A1001: BRIGHTON | C1001: TOMLINS | F1001: H JOHNSON | I1001: HUNT | L1001: M JOHNSTONE | O1001: AMINDI | R1001: POULTER
A1002: GOALKICKERS
A1003: PRAHRAN | C1003: GOUGH 5 | F1003: JORDAN 3 | I1003: WILLIAMS 2 | L1003: SALTER 2 | N1003: KENNEDY 2 | Q1003: WHITE | S1003: FINLAYSON
A1004: BRIGHTON | C1004: AMINDE 2 | F1004: JOHNSON 2 | I1004: POULTER 2 | L1004: AVERY | N1004: JOYNSON
A1006: YARRAVILLE | C1006: 5 | D1006: 0 | E1006: =C1006*6+D1006 -> 30 | G1006: 9 | H1006: 2 | I1006: =G1006*6+H1006 -> 56 | K1006: 10 | L1006: 6 | M1006: =K1006*6+L1006 -> 66 | O1006: 11 | P1006: 15 | Q1006: =O1006*6+P1006 -> 81 | S1006: YARRAVILLE
A1007: OAKLEIGH | C1007: 5 | D1007: 8 | E1007: =C1007*6+D1007 -> 38 | G1007: 5 | H1007: 11 | I1007: =G1007*6+H1007 -> 41 | K1007: 7 | L1007: 16 | M1007: =K1007*6+L1007 -> 58 | O1007: 9 | P1007: 17 | Q1007: =O1007*6+P1007 -> 71 | S1007: MURRAY
A1008: BEST PLAYERS
A1009: YARRAVILLE | C1009: WUNHYM | F1009: J BUCKLEY | I1009: FREW | L1009: McELHOLUM | O1009: PANNELL | R1009: EDWARDS
A1010: OAKLEIGH | C1010: WATSON | F1010: DRIVER | I1010: FLEMING | L1010: CHESSWASS | O1010: WITHERS | R1010: FRASER
A1011: GOALKICKERS
A1012: YARRAVILLE | C1012: SHEEHAN 3 | F1012: FORDHAM 2 | I1012: J BUCKLEY 2 | L1012: PREWETT 2 | O1012: McGRATH | R1012: McELHOLUM
A1013: OAKLEIGH | C1013: FRASER 2 | F1013: MILLER 2 | I1013: CHESSWASS | L1013: WILTSHIRE | O1013: DRIVER
A1015: ROUND 19 | E1015: 27TH AUGUST | H1015: WEATHER | K1015: COOL CLOUDY LIGHT SHOWERS WEST BREEZE | S1015: PLAYED AT
D1016: 1ST QTR | H1016: 2ND QTR | L1016: 3RD QTR | P1016: FINAL | S1016: PORT MELBOURNE
A1017: PORT MELBOURNE | C1017: 3 | D1017: 1 | E1017: =C1017*6+D1017 -> 19 | G1017: 6 | H1017: 5 | I1017: =G1017*6+H1017 -> 41 | K1017: 8 | L1017: 6 | M1017: =K1017*6+L1017 -> 54 | O1017: 13 | P1017: 11 | Q1017: =O1017*6+P1017 -> 89 | S1017: UMPIRE | X1017: LADDER | AB1017: ROUND | AD1017: 19
A1018: SANDRINGHAM | C1018: 1 | D1018: 9 | E1018: =C1018*6+D1018 -> 15 | G1018: 3 | H1018: 11 | I1018: =G1018*6+H1018 -> 29 | K1018: 6 | L1018: 16 | M1018: =K1018*6+L1018 -> 52 | O1018: 7 | P1018: 17 | Q1018: =O1018*6+P1018 -> 59 | S1018: McKINNON
A1019: BEST PLAYERS | W1019: TEAM | X1019: W | Y1019: L | Z1019: D | AA1019: FOR | AB1019: AGST | AC1019: % | AD1019: PTS
A1020: PORT MELBOURNE | C1020: REES | F1020: PLUMRIDGE | I1020: HARRY | L1020: HYDE | O1020: TUITE
A1021: SANDRINGHAM | C1021: MICHAELSON | F1021: TOLSON | I1021: FITZGERALD | L1021: KEMP | O1021: MILBURN | Q1021: BECKTON | W1021: COBURG | X1021: 15 | Y1021: 4 | Z1021: 0 | AA1021: 1803 | AB1021: 1310 | AC1021: 137.63358778625954 | AD1021: 60
A1022: GOALKICKERS | W1022: NORTHCOTE | X1022: 14 | Y1022: 5 | Z1022: 0 | AA1022: 1941 | AB1022: 1461 | AC1022: 132.85 | AD1022: 56
A1023: PORT MELBOURNE | C1023: LAHIFF 2 | E1023: HYDE 2 | G1023: E PERRETT 2 | J1023: REES 2 | L1023: BOQUEST 2 | N1023: PLUMRIDGE | Q1023: KEATING | S1023: RUSDEN | W1023: PRESTON | X1023: 14 | Y1023: 5 | Z1023: 0 | AA1023: 1621 | AB1023: 1475 | AC1023: 109.9 | AD1023: 56
A1024: SANDRINGHAM | C1024: FITZGERALD 3 | F1024: THOMS 2 | I1024: M BOURKE | L1024: TOLSON | W1024: CAMBERWELL | X1024: 13 | Y1024: 6 | Z1024: 0 | AA1024: 1832 | AB1024: 1446 | AC1024: 126.69432918395574 | AD1024: 52
A1026: NORTHCOTE | C1026: 3 | D1026: 2 | E1026: =C1026*6+D1026 -> 20 | G1026: 9 | H1026: 6 | I1026: =G1026*6+H1026 -> 60 | K1026: 12 | L1026: 9 | M1026: =K1026*6+L1026 -> 81 | O1026: 16 | P1026: 14 | Q1026: =O1026*6+P1026 -> 110 | S1026: WILLIAMSTOWN | W1026: SANDRINGHAM | X1026: 12 | Y1026: 7 | Z1026: 0 | AA1026: 1609 | AB1026: 1517 | AC1026: 106.06460118655241 | AD1026: 48
A1027: WILLIAMSTOWN | C1027: 3 | D1027: 7 | E1027: =C1027*6+D1027 -> 25 | G1027: 5 | H1027: 11 | I1027: =G1027*6+H1027 -> 41 | K1027: 8 | L1027: 17 | M1027: =K1027*6+L1027 -> 65 | O1027: 11 | P1027: 21 | Q1027: =O1027*6+P1027 -> 87 | S1027: MURRAY | W1027: PORT MELBOURNE | X1027: 11 | Y1027: 8 | Z1027: 0 | AA1027: 1462 | AB1027: 1326 | AC1027: 110.25641025641026 | AD1027: 44
A1028: BEST PLAYERS | W1028: WILLIAMSTOWN | X1028: 9 | Y1028: 10 | Z1028: 0 | AA1028: 1472 | AB1028: 1467 | AC1028: 100.34083162917518 | AD1028: 36
A1029: NORTHCOTE | C1029: BRAY | E1029: POWELL | H1029: ROSS | K1029: COLE | N1029: BROWN | Q1029: HONIG | W1029: BRUNSWICK | X1029: 8 | Y1029: 10 | Z1029: 1 | AA1029: 1535 | AB1029: 1670 | AC1029: 91.916167664670652 | AD1029: 34
A1030: WILLIAMSTOWN | C1030: BANKS | E1030: SINCLAIR | H1030: CUTTING | K1030: DORGAN | N1030: LYNCH | Q1030: DELLER | W1030: PRAHRAN | X1030: 6 | Y1030: 13 | Z1030: 0 | AA1030: 1543 | AB1030: 1747 | AC1030: 88.322839152833424 | AD1030: 24
A1031: GOALKICKERS | P1031: LYNGCOLN | W1031: YARRAVILLE | X1031: 5 | Y1031: 14 | Z1031: 0 | AA1031: 1486 | AB1031: 1767 | AC1031: 84.1 | AD1031: 20
A1032: NORTHCOTE | C1032: BRAY 5 | E1032: SEYMOUR 3 | H1032: ROSS 2 | J1032: BROWN 2 | M1032: BYRNE | O1032: SMITH | Q1032: HONIG | S1032: GARRETT | W1032: BRIGHTON | X1032: 3 | Y1032: 15 | Z1032: 1 | AA1032: 1205 | AB1032: 1941 | AC1032: 62.081401339515715 | AD1032: 14
A1033: WILLIAMSTOWN | C1033: GRANT 4 | E1033: WARD 2 | H1033: C DREW 2 | J1033: SHADE | M1033: SINCLAIR | O1033: JOHNS | W1033: OAKLEIGH | X1033: 3 | Y1033: 16 | Z1033: 0 | AA1033: 1340 | AB1033: 1729 | AC1033: 77.5 | AD1033: 12
A1035: PRAHRAN | C1035: 1 | D1035: 3 | E1035: =C1035*6+D1035 -> 9 | G1035: 5 | H1035: 10 | I1035: =G1035*6+H1035 -> 40 | K1035: 9 | L1035: 15 | M1035: =K1035*6+L1035 -> 69 | O1035: 17 | P1035: 22 | Q1035: =O1035*6+P1035 -> 124 | S1035: TOORAK PARK
A1036: BRUNSWICK | C1036: 4 | D1036: 3 | E1036: =C1036*6+D1036 -> 27 | G1036: 4 | H1036: 4 | I1036: =G1036*6+H1036 -> 28 | K1036: 11 | L1036: 12 | M1036: =K1036*6+L1036 -> 78 | O1036: 12 | P1036: 12 | Q1036: =O1036*6+P1036 -> 84 | S1036: GREGORY
A1037: BEST PLAYERS
A1038: PRAHRAN | C1038: HARRIS | E1038: SMITH | H1038: KENNEDY | K1038: WHITE | N1038: FARNAN | Q1038: HAWKINS
A1039: BRUNSWICK | C1039: PENMAN | E1039: WOODS | H1039: MAYNES | K1039: BRIGHT | N1039: MUTIMER | Q1039: ANDERSON
A1040: GOALKICKERS
A1041: PRAHRAN | C1041: HAWKINS 7 | F1041: KENNEDY 4 | I1041: SALTER 3 | L1041: HARRIS | N1041: WELLS | P1041: BRENCHLEY
A1042: BRUNSWICK | C1042: ANDERSON 5 | F1042: MUTIMER 3 | I1042: MAYNES 2 | L1042: PENMAN | O1042: FITZGERALD
A1044: PRESTON | C1044: 4 | D1044: 7 | E1044: =C1044*6+D1044 -> 31 | G1044: 7 | H1044: 12 | I1044: =G1044*6+H1044 -> 54 | K1044: 10 | L1044: 16 | M1044: =K1044*6+L1044 -> 76 | O1044: 17 | P1044: 23 | Q1044: =O1044*6+P1044 -> 125 | S1044: PRESTON
A1045: YARRAVILLE | C1045: 4 | D1045: 3 | E1045: =C1045*6+D1045 -> 27 | G1045: 9 | H1045: 5 | I1045: =G1045*6+H1045 -> 59 | K1045: 11 | L1045: 8 | M1045: =K1045*6+L1045 -> 74 | O1045: 12 | P1045: 8 | Q1045: =O1045*6+P1045 -> 80 | S1045: HASSETT
A1046: BEST PLAYERS
A1047: PRESTON | C1047: HUGHSON | F1047: MONOHAN | I1047: SMITH | L1047: SUMMERS | O1047: WARD | R1047: POULTER
A1048: YARRAVILLE | C1048: J BUCKLEY | F1048: W BUCKLEY | I1048: WUNHYM | L1048: COPPOCK | O1048: EVANS | R1048: C MILBURN
A1049: GOALKICKERS
A1050: PRESTON | C1050: WARR 5 | E1050: BIRD 3 | G1050: DAVIE 2 | I1050: HARDING 2 | L1050: OWENS 2 | N1050: HUGHSON | Q1050: SUMMERS | T1050: POULTER
A1051: YARRAVILLE | C1051: J BUCKLEY 4 | F1051: EVANS 3 | H1051: FORDHAM 2 | K1051: CAMERON 2 | N1051: H MILBURN
A1053: CAMBERWELL | C1053: 3 | D1053: 2 | E1053: =C1053*6+D1053 -> 20 | G1053: 14 | H1053: 13 | I1053: =G1053*6+H1053 -> 97 | K1053: 16 | L1053: 16 | M1053: =K1053*6+L1053 -> 112 | O1053: 27 | P1053: 22 | Q1053: =O1053*6+P1053 -> 184 | S1053: CAMBERWELL
A1054: BRIGHTON | C1054: 1 | D1054: 3 | E1054: =C1054*6+D1054 -> 9 | G1054: 3 | H1054: 4 | I1054: =G1054*6+H1054 -> 22 | K1054: 5 | L1054: 4 | M1054: =K1054*6+L1054 -> 34 | O1054: 5 | P1054: 6 | Q1054: =O1054*6+P1054 -> 36 | S1054: STUART
A1055: BEST PLAYERS
A1056: CAMBERWELL | C1056: MASON | F1056: JONES | I1056: LUFF | L1056: LAWN | O1056: LASKY | R1056: PETRIE
A1057: BRIGHTON | C1057: ROSENBROCK | F1057: TUCKER | I1057: HUNT | L1057: CLINCH | O1057: CLOTZ | R1057: AVERY
A1058: GOALKICKERS
A1059: CAMBERWELL | C1059: LAWN 11 | F1059: LUFF 4 | H1059: PETRIE 4 | J1059: MASON 2 | M1059: LASKY 2 | O1059: COLLINS 2 | Q1059: ROWE | S1059: BOOTHMAN
A1060: BRIGHTON | C1060: JOHNSON 2 | F1060: TUCKER | I1060: CLOTZ | L1060: CLINCH
A1062: COBURG | C1062: 3 | D1062: 9 | E1062: =C1062*6+D1062 -> 27 | G1062: 7 | H1062: 13 | I1062: =G1062*6+H1062 -> 55 | K1062: 9 | L1062: 19 | M1062: =K1062*6+L1062 -> 73 | O1062: 13 | P1062: 21 | Q1062: =O1062*6+P1062 -> 99 | S1062: COBURG
A1063: OAKLEIGH | C1063: 0 | D1063: 0 | E1063: =C1063*6+D1063 -> 0 | G1063: 1 | H1063: 2 | I1063: =G1063*6+H1063 -> 8 | K1063: 2 | L1063: 4 | M1063: =K1063*6+L1063 -> 16 | O1063: 3 | P1063: 10 | Q1063: =O1063*6+P1063 -> 28 | S1063: LESTER
A1064: BEST PLAYERS
A1065: COBURG | C1065: UHE | E1065: MEARS | H1065: KIGHT | K1065: LEAHY | N1065: DUNCAN | Q1065: JENKINS
A1066: OAKLEIGH | C1066: WITHERS | E1066: WATSON | H1066: WILTSHIRE | K1066: RUDOLPH | N1066: CHESSWASS | Q1066: DRIVER
A1067: GOALKICKERS
A1068: COBURG | C1068: MEARS 5 | F1068: DUNCAN 2 | I1068: BRIGGS 2 | K1068: COLBERT 2 | N1068: WILLOX | Q1068: GRIFFITHS
A1069: OAKLEIGH | C1069: WILTSHIRE | F1069: WITHERS | I1069: O'HALLORAN
A1071: ROUND 20 | E1071: 3RD SEPTEMBER | J1071: WEATHER | M1071: FINE MILD NORTH WIND | S1071: PLAYED AT
D1072: 1ST QTR | H1072: 2ND QTR | L1072: 3RD QTR | P1072: FINAL | S1072: NORTHCOTE
A1073: NORTHCOTE | C1073: 4 | D1073: 4 | E1073: =C1073*6+D1073 -> 28 | G1073: 7 | H1073: 4 | I1073: =G1073*6+H1073 -> 46 | K1073: 12 | L1073: 9 | M1073: =K1073*6+L1073 -> 81 | O1073: 16 | P1073: 10 | Q1073: =O1073*6+P1073 -> 106 | S1073: UMPIRE | X1073: LADDER | AB1073: ROUND | AD1073: 20
A1074: COBURG | C1074: 1 | D1074: 2 | E1074: =C1074*6+D1074 -> 8 | G1074: 2 | H1074: 5 | I1074: =G1074*6+H1074 -> 17 | K1074: 4 | L1074: 7 | M1074: =K1074*6+L1074 -> 31 | O1074: 9 | P1074: 9 | Q1074: =O1074*6+P1074 -> 63 | S1074: McKINNON
A1075: BEST PLAYERS | W1075: TEAM | X1075: W | Y1075: L | Z1075: D | AA1075: FOR | AB1075: AGST | AC1075: % | AD1075: PTS
A1076: NORTHCOTE | C1076: ROSS | E1076: McSWAIN | H1076: GRAY | K1076: PERKINS | N1076: BROWN | Q1076: ROWE
A1077: COBURG | C1077: LEAHY | E1077: JENKINS | H1077: KIGHT | K1077: GREGORY | N1077: GRIFFITHS | Q1077: STOCKDALE | W1077: NORTHCOTE | X1077: 15 | Y1077: 5 | Z1077: 0 | AA1077: 2047 | AB1077: 1524 | AC1077: 134.32 | AD1077: 60
A1078: GOALKICKERS | W1078: COBURG | X1078: 15 | Y1078: 5 | Z1078: 0 | AA1078: 1866 | AB1078: 1416 | AC1078: 131.77966101694915 | AD1078: 60
A1079: NORTHCOTE | C1079: SEYMOUR 5 | F1079: ROSS 4 | H1079: BRAY 3 | J1079: COLE | L1079: ROWE | N1079: CORRIGAN | Q1079: MCSWAIN | W1079: CAMBERWELL | X1079: 14 | Y1079: 6 | Z1079: 0 | AA1079: 1976 | AB1079: 1542 | AC1079: 128.14526588845655 | AD1079: 56
A1080: COBURG | C1080: ROGERS 3 | F1080: MEARS 3 | I1080: BRIGGS 2 | L1080: PROUDFFOT | W1080: PRESTON | X1080: 14 | Y1080: 6 | Z1080: 0 | AA1080: 1677 | AB1080: 1548 | AC1080: 108.33 | AD1080: 56
A1082: PORT MELBOURNE | C1082: 5 | D1082: 5 | E1082: =C1082*6+D1082 -> 35 | G1082: 5 | H1082: 6 | I1082: =G1082*6+H1082 -> 36 | K1082: 10 | L1082: 12 | M1082: =K1082*6+L1082 -> 72 | O1082: 10 | P1082: 13 | Q1082: =O1082*6+P1082 -> 73 | S1082: PORT MELBOURNE | W1082: PORT MELBOURNE | X1082: 12 | Y1082: 8 | Z1082: 0 | AA1082: 1535 | AB1082: 1382 | AC1082: 111.07091172214183 | AD1082: 48
A1083: PRESTON | C1083: 1 | D1083: 3 | E1083: =C1083*6+D1083 -> 9 | G1083: 3 | H1083: 5 | I1083: =G1083*6+H1083 -> 23 | K1083: 4 | L1083: 7 | M1083: =K1083*6+L1083 -> 31 | O1083: 8 | P1083: 8 | Q1083: =O1083*6+P1083 -> 56 | S1083: HASSETT | W1083: SANDRINGHAM | X1083: 12 | Y1083: 8 | Z1083: 0 | AA1083: 1693 | AB1083: 1617 | AC1083: 104.70006184291898 | AD1083: 48
A1084: BEST PLAYERS | W1084: BRUNSWICK | X1084: 9 | Y1084: 10 | Z1084: 1 | AA1084: 1612 | AB1084: 1746 | AC1084: 92.325315005727376 | AD1084: 38
A1085: PORT MELBOURNE | C1085: LEGGO | F1085: REES | H1085: TUITE | K1085: KEATING | N1085: LOVETT | Q1085: PERRETT | W1085: WILLIAMSTOWN | X1085: 9 | Y1085: 11 | Z1085: 0 | AA1085: 1568 | AB1085: 1611 | AC1085: 97.330850403476106 | AD1085: 36
A1086: PRESTON | C1086: DOWLING | F1086: WARR | H1086: HUGHSON | K1086: MONOHAN | N1086: DINEEN | Q1086: HARDING | W1086: PRAHRAN | X1086: 7 | Y1086: 13 | Z1086: 0 | AA1086: 1643 | AB1086: 1831 | AC1086: 89.732386673948668 | AD1086: 28
A1087: GOALKICKERS | W1087: YARRAVILLE | X1087: 5 | Y1087: 15 | Z1087: 0 | AA1087: 1578 | AB1087: 1860 | AC1087: 84.84 | AD1087: 20
A1088: PORT MELBOURNE | C1088: E PERRETT 2 | F1088: REES 2 | H1088: KEATING 2 | K1088: RUSDEN 2 | N1088: HYDE | P1088: BAKER | W1088: BRIGHTON | X1088: 4 | Y1088: 15 | Z1088: 1 | AA1088: 1298 | AB1088: 2033 | AC1088: 63.846532218396462 | AD1088: 18
A1089: PRESTON | C1089: LANGWELL 3 | F1089: WARR 3 | H1089: HARDING | K1089: DINEEN | W1089: OAKLEIGH | X1089: 3 | Y1089: 17 | Z1089: 0 | AA1089: 1416 | AB1089: 1804 | AC1089: 78.49 | AD1089: 12
A1091: CAMBERWELL | C1091: 11 | D1091: 8 | E1091: =C1091*6+D1091 -> 74 | G1091: 12 | H1091: 8 | I1091: =G1091*6+H1091 -> 80 | K1091: 19 | L1091: 16 | M1091: =K1091*6+L1091 -> 130 | O1091: 21 | P1091: 18 | Q1091: =O1091*6+P1091 -> 144 | S1091: CAMBERWELL
A1092: WILLIAMSTOWN | C1092: 0 | D1092: 0 | E1092: =C1092*6+D1092 -> 0 | G1092: 8 | H1092: 5 | I1092: =G1092*6+H1092 -> 53 | K1092: 10 | L1092: 5 | M1092: =K1092*6+L1092 -> 65 | O1092: 14 | P1092: 12 | Q1092: =O1092*6+P1092 -> 96 | S1092: NOWLAN
A1093: BEST PLAYERS
A1094: CAMBERWELL | C1094: TRESIZE | E1094: MASON | H1094: LAWN | K1094: JONES | N1094: R WILLIAMS | Q1094: CLAMP
A1095: WILLIAMSTOWN | C1095: CAHILL | E1095: C DREW | H1095: SINCLAIR | K1095: SHADE | N1095: HYDE | Q1095: LYNCH
A1096: GOALKICKERS
A1097: CAMBERWELL | C1097: LAWN 8 | E1097: R WILLIAMS 3 | H1097: CLAMP 2 | J1097: COLLINS 2 | M1097: BOOTHMAN 2 | P1097: O'NEILL | R1097: W COFFIN | U1097: TRESIZE | X1097: LATHLAIN
A1098: WILLIAMSTOWN | C1098: BLAKE 3 | E1098: SHADE 2 | H1098: SINCLAIR 2 | K1098: CAHILL 2 | M1098: L DREW | O1098: GRANT | Q1098: C DREW | S1098: TAYLOR | U1098: SYKES
A1100: BRIGHTON | C1100: 5 | D1100: 8 | E1100: =C1100*6+D1100 -> 38 | G1100: 6 | H1100: 8 | I1100: =G1100*6+H1100 -> 44 | K1100: 13 | L1100: 14 | M1100: =K1100*6+L1100 -> 92 | O1100: 13 | P1100: 15 | Q1100: =O1100*6+P1100 -> 93 | S1100: ELSTERNWICK PARK
A1101: YARRAVILLE | C1101: 0 | D1101: 0 | E1101: =C1101*6+D1101 -> 0 | G1101: 6 | H1101: 5 | I1101: =G1101*6+H1101 -> 41 | K1101: 7 | L1101: 7 | M1101: =K1101*6+L1101 -> 49 | O1101: 13 | P1101: 14 | Q1101: =O1101*6+P1101 -> 92 | S1101: SCHAEFER
A1102: BEST PLAYERS
A1103: BRIGHTON | C1103: HUNT | F1103: TUCKER | I1103: SCHENCK | L1103: CLOTZ | O1103: HARRISON | R1103: H JOHNSON
A1104: YARRAVILLE | C1104: H MILBURN | F1104: CAMERON | I1104: BRUMBY | L1104: FORDHAM | O1104: EVANS | R1104: W BUCKLEY
A1105: GOALKICKERS
A1106: BRIGHTON | C1106: HARRISON 5 | F1106: JOHNSON 2 | I1106: TUCKER 2 | L1106: SCHENCK 2 | O1106: HUNT | Q1106: COLLINS
A1107: YARRAVILLE | C1107: FORDHAM 5 | F1107: EVANS 3 | I1107: PREWETT 2 | L1107: QUIGG | N1107: H MILBURN | Q1107: FREW
A1109: BRUNSWICK | C1109: 3 | D1109: 4 | E1109: =C1109*6+D1109 -> 22 | G1109: 7 | H1109: 8 | I1109: =G1109*6+H1109 -> 50 | K1109: 9 | L1109: 14 | M1109: =K1109*6+L1109 -> 68 | O1109: 10 | P1109: 17 | Q1109: =O1109*6+P1109 -> 77 | S1109: OAKLEIGH
A1110: OAKLEIGH | C1110: 2 | D1110: 1 | E1110: =C1110*6+D1110 -> 13 | G1110: 4 | H1110: 3 | I1110: =G1110*6+H1110 -> 27 | K1110: 7 | L1110: 3 | M1110: =K1110*6+L1110 -> 45 | O1110: 12 | P1110: 4 | Q1110: =O1110*6+P1110 -> 76 | S1110: STUART
A1111: BEST PLAYERS
A1112: BRUNSWICK | C1112: MUTIMER | F1112: WOODS | I1112: FITZGERALD | L1112: JONES | O1112: GILLON | R1112: KENNETT
A1113: OAKLEIGH | C1113: FRASER | F1113: CRAMERI | I1113: WITHERS | L1113: CHESSWASS | O1113: STAN SMITH | R1113: McALLISTER
A1114: GOALKICKERS
A1115: BRUNSWICK | C1115: JONES 5 | F1115: GILLON 2 | I1115: R THOMPSON | L1115: ANDERSON | O1115: KENNETT
A1116: OAKLEIGH | C1116: FRASER 7 | F1116: CHESSWASS | I1116: CRAMERI | L1116: MILLER | N1116: WATSON | Q1116: O'HALLORAN
A1118: PRAHRAN | C1118: 6 | D1118: 5 | E1118: =C1118*6+D1118 -> 41 | G1118: 6 | H1118: 5 | I1118: =G1118*6+H1118 -> 41 | K1118: 11 | L1118: 8 | M1118: =K1118*6+L1118 -> 74 | O1118: 15 | P1118: 10 | Q1118: =O1118*6+P1118 -> 100 | S1118: TOORAK PARK
A1119: SANDRINGHAM | C1119: 2 | D1119: 1 | E1119: =C1119*6+D1119 -> 13 | G1119: 8 | H1119: 13 | I1119: =G1119*6+H1119 -> 61 | K1119: 9 | L1119: 14 | M1119: =K1119*6+L1119 -> 68 | O1119: 11 | P1119: 18 | Q1119: =O1119*6+P1119 -> 84 | S1119: LESTER
A1120: BEST PLAYERS
A1121: PRAHRAN | C1121: GOUGH | F1121: F SMITH | J1121: KOOP | M1121: TABATEAU | P1121: HAWKINS | S1121: BRENCHLEY
A1122: SANDRINGHAM | C1122: RAYMENT | F1122: MICHAELSON | J1122: FITZGERALD | M1122: FRICKER | P1122: GEDDES | S1122: BECKTON
A1123: GOALKICKERS
A1124: PRAHRAN | C1124: HAWKINS 3 | F1124: JORDAN 3 | I1124: BRENCHLEY 3 | L1124: HARRIS 2 | N1124: KOOP 2 | P1124: WILLIAMS | R1124: GOUGH
A1125: SANDRINGHAM | C1125: RAYMENT 5 | F1125: BECKTON | I1125: GAMBETTA | L1125: FORBES | N1125: JAMIESON | Q1125: McGAIN | S1125: MILLER
A1127: FINALS
A1128: 1ST SEMI | E1128: 10TH SEPTEMBER | J1128: WEATHER | M1128: FINE NORTH BREEZE
D1129: 1ST QTR | H1129: 2ND QTR | L1129: 3RD QTR | P1129: FINAL
A1130: COBURG | C1130: 1 | D1130: 2 | E1130: =C1130*6+D1130 -> 8 | G1130: 3 | H1130: 5 | I1130: =G1130*6+H1130 -> 23 | K1130: 6 | L1130: 6 | M1130: =K1130*6+L1130 -> 42 | O1130: 11 | P1130: 9 | Q1130: =O1130*6+P1130 -> 75 | S1130: COBURG
A1131: PRESTON | C1131: 1 | D1131: 7 | E1131: =C1131*6+D1131 -> 13 | G1131: 1 | H1131: 12 | I1131: =G1131*6+H1131 -> 18 | K1131: 5 | L1131: 19 | M1131: =K1131*6+L1131 -> 49 | O1131: 8 | P1131: 20 | Q1131: =O1131*6+P1131 -> 68 | S1131: MURRAY
A1132: BEST PLAYERS
A1133: COBURG | C1133: MEARS | E1133: BERTRAM | I1133: DUNCAN | L1133: BRIGGS | O1133: WILLOX | R1133: STOCKDALE
A1134: PRESTON | C1134: WARR | E1134: DOWLING | I1134: BREWIS | L1134: MOONEY | O1134: DINEEN | R1134: MONOHAN
A1135: GOALKICKERS
A1136: COBURG | C1136: BRIGGS 3 | F1136: LINDSAY 3 | I1136: WILLOX 2 | L1136: MEARS 2 | O1136: PROUDFOOT
A1137: PRESTON | C1137: WARR 2 | F1137: CAMERON 2 | I1137: HUGHSON | L1137: HARDING | O1137: TAYLOR | R1137: DINEEN
A1139: 2ND SEMI | E1139: 17TH SEPTEMBER | J1139: WEATHER | M1139: FINE MILD S.E. BREEZE
A1140: NORTHCOTE | C1140: 1 | D1140: 0 | E1140: =C1140*6+D1140 -> 6 | G1140: 3 | H1140: 3 | I1140: =G1140*6+H1140 -> 21 | K1140: 9 | L1140: 5 | M1140: =K1140*6+L1140 -> 59 | O1140: 14 | P1140: 7 | Q1140: =O1140*6+P1140 -> 91 | S1140: PORT MELBOURNE
A1141: CAMBERWELL | C1141: 4 | D1141: 5 | E1141: =C1141*6+D1141 -> 29 | G1141: 7 | H1141: 9 | I1141: =G1141*6+H1141 -> 51 | K1141: 10 | L1141: 11 | M1141: =K1141*6+L1141 -> 71 | O1141: 12 | P1141: 15 | Q1141: =O1141*6+P1141 -> 87 | S1141: STUART
A1142: BEST PLAYERS
A1143: NORTHCOTE | C1143: ROWE | E1143: PERKINS | I1143: ACKLAND | L1143: SEYMOUR | O1143: ROSS | R1143: GRAY
A1144: CAMBERWELL | C1144: CLAMP | E1144: HENDERSON | I1144: MASON | L1144: WARTMAN | O1144: O'NEILL | R1144: LASKY
A1145: GOALKICKERS
A1146: NORTHCOTE | C1146: SEYMOUR 5 | F1146: GRAY 2 | I1146: COLE 2 | K1146: ROSS 2 | M1146: SMITH | O1146: BRAY | Q1146: HONIG
A1147: CAMBERWELL | C1147: O'NEILL 3 | F1147: WILLIAMS 3 | I1147: PETRIE 2 | K1147: LASKY | M1147: TRESIZE | O1147: MASON | Q1147: COLLINS
A1149: GRAND FINAL | E1149: 24TH SEPTEMBER | J1149: WEATHER | M1149: A.M. SHOWERS CLOUDY BUT CLEARING SOUTH WIND
A1150: NORTHCOTE | C1150: 1 | D1150: 2 | E1150: =C1150*6+D1150 -> 8 | G1150: 5 | H1150: 9 | I1150: =G1150*6+H1150 -> 39 | K1150: 8 | L1150: 9 | M1150: =K1150*6+L1150 -> 57 | O1150: 13 | P1150: 11 | Q1150: =O1150*6+P1150 -> 89 | S1150: COBURG
A1151: COBURG | C1151: 4 | D1151: 3 | E1151: =C1151*6+D1151 -> 27 | G1151: 5 | H1151: 4 | I1151: =G1151*6+H1151 -> 34 | K1151: 7 | L1151: 13 | M1151: =K1151*6+L1151 -> 55 | O1151: 8 | P1151: 15 | Q1151: =O1151*6+P1151 -> 63 | S1151: MURRAY
A1152: BEST PLAYERS
A1153: NORTHCOTE | D1153: ROWE | G1153: SEYMOUR | J1153: SMITH | M1153: HUMPHRIES | P1153: ROSS | S1153: CORRIGAN
A1154: COBURG | D1154: STOCKDALE | G1154: MEARS | J1154: KIGHT | M1154: ELLIOTT | P1154: CAMPBELL | S1154: JENKINS
A1155: GOALKICKERS
A1156: NORTHCOTE | D1156: SEYMOUR 8 | G1156: GRAY | I1156: BRAY | K1156: ROWE | M1156: ROSS | O1156: HUMPHRIES
A1157: COBURG | D1157: BRIGGS 2 | G1157: LOWE 2 | I1157: MEARS 2 | L1157: ELLIOTT 2
A1159: TEAMS
G1160: NORTHCOTE | S1160: COBURG
A1161: BACKS | D1161: HART | G1161: McSWAIN | K1161: HUMPHRIES | O1161: STOCKDALE | S1161: BERTRAM | W1161: VOIGHT
A1162: H-BACKS | D1162: WOODS | G1162: PERKINS | K1162: POWELL | O1162: UHE | S1162: DUNCAN | W1162: CAMPBELL
A1163: CENTRES | D1163: COLE | G1163: CORRIGAN | K1163: GARRETT | O1163: KIGHT | S1163: LEAHY | W1163: BEERS
A1164: H-FORWARDS | D1164: GRAY | G1164: SMITH | K1164: BRAY | O1164: ROGERS | S1164: BRIGGS | W1164: HARRIS
A1165: FORWARDS | D1165: BYRNE | G1165: SEYMOUR | K1165: BROWN | O1165: WILLOX | S1165: LOWE | W1165: ELLIOTT
A1166: RUCKS | D1166: ROWE | G1166: GOULLET | K1166: ROSS | O1166: JENKINS | S1166: GRIFFITHS | W1166: MEARS
A1167: RES | D1167: HONIG | G1167: ACKLAND | K1167: SIMMONDS
A1169: REPRESENTATIVE MATCH | M1169: WEATHER | P1169: FINE SOUTH WIND
A1170: V F L | C1170: 3 | D1170: 2 | E1170: =C1170*6+D1170 -> 20 | G1170: 7 | H1170: 5 | I1170: =G1170*6+H1170 -> 47 | K1170: 14 | L1170: 10 | M1170: =K1170*6+L1170 -> 94 | O1170: 15 | P1170: 17 | Q1170: =O1170*6+P1170 -> 107 | S1170: PRINCES PK
A1171: V F A | C1171: 4 | D1171: 3 | E1171: =C1171*6+D1171 -> 27 | G1171: 7 | H1171: 6 | I1171: =G1171*6+H1171 -> 48 | K1171: 8 | L1171: 13 | M1171: =K1171*6+L1171 -> 61 | O1171: 14 | P1171: 15 | Q1171: =O1171*6+P1171 -> 99 | S1171: McMURRAY McKINNON
A1172: BEST PLAYERS
A1173: V F L | D1173: GILL | G1173: WALSH | J1173: RUMNEY | M1173: McALPINE | P1173: BUNTON | S1173: TITUS
A1174: V F A | D1174: JONES | G1174: SYKES | J1174: LUFF | M1174: GARRETT | P1174: RAYMENT | S1174: HUGHSON
A1175: GOALKICKERS
A1176: V F L | D1176: BUNTON 4 | G1176: TITUS 2 | I1176: FRANCIS 2 | K1176: FORBES 2 | M1176: VALLENCE 2 | P1176: McALPINE | R1176: ROBERTS | U1176: PLATT
A1177: V F A | D1177: LUFF 4 | G1177: HELLWIG 3 | J1177: RAYMENT 3 | M1177: MASON 3 | P1177: HUGHSON
A1180: TEAMS
G1181: V.F.L. | S1181: V.F.A.
A1182: BACKS | D1182: P BENTLEY | G1182: F GILL | K1182: H RUMNEY | O1182: J WUNHYM | S1182: C McSWAIN | W1182: H JONES
D1183: RICH | G1183: CARL | K1183: COLL | O1183: YARRAVILLE | S1183: NORTHCOTE | W1183: CAMBERWELL
A1184: H-BACKS | D1184: A ROBERTSON | G1184: G STRANG | K1184: B MILLS | O1184: A SYKES | S1184: E BOURKE | W1184: R GREENWOOD
D1185: S.M. | G1185: RICH | K1185: HAW | O1185: WILLIAMSTOWN | S1185: YARRAVILLE | W1185: CAMBERWELL
A1186: CENTRES | D1186: K McALPINE | G1186: W ROBERTS | K1186: C USHER | O1186: T GARRETT | S1186: T BROOKER | W1186: C CLAMP
D1187: FOOTS | G1187: S.K. | K1187: MELB | O1187: NORTHCOTE | S1187: PORT MELBOURNE | W1187: CAMBERWELL
A1188: H-FORWARDS | D1188: J TITUS | G1188: F NASH | K1188: F MURPHY | O1188: T BYRNE | S1188: C HELLWIG | W1188: L SMITH
D1189: RICH | G1189: ESS | K1189: COLL | O1189: WILLIAMSTOWN | S1189: WILLIAMSTOWN | W1189: NORTHCOTE
A1190: FORWARDS | D1190: R PRATT | G1190: H VALLANCE | K1190: H BUNTON | O1190: F FITZGERALD | S1190: W LUFF | W1190: H MASON
D1191: S.M. | G1191: CARL | K1191: FITZ | O1191: BRUNSWICK | S1191: CAMBERWELL | W1191: CAMBERWELL
A1192: RUCKS | D1192: C DAVEY | G1192: P WALSH | K1192: K FORBES | O1192: C STANBRIDGE | S1192: L HUGHSON | W1192: D RAYMENT
D1193: CARL | G1193: ESS | K1193: ESS | O1193: PORT MELBOURNE | S1193: PRESTON | W1193: S'HAM
A1194: RES | D1194: L HARDIMAN | I1194: J FRANCIS | O1194: G HUNT | S1194: D WARR
D1195: GEE | I1195: HAW | O1195: B'TON | S1195: PRESTON
D1196: J FRANCIS REPLACED F NASH