A1: Victorian Football Association
A2: Season 1933
A3: © Copyright Wal Williams | F3: First created: 2 November 2014
A4: Contact: joywalwi at gmail dot com | F4: Last updated: 27 January 2018 | W4: VFA Results and tables - Link to the main index page
A5: You are free to copy this document in whole or part provided that proper acknowledgement is given to the author. All rights reserved.
A7: YEAR 1933
A8: ROUND 1 | E8: 17TH APRIL | J8: WEATHER | M8: FINE WARM | S8: PLAYED AT
D9: 1ST QTR | H9: 2ND QTR | L9: 3RD QTR | P9: FINAL | S9: BEACH ROAD | X9: LADDER | AB9: ROUND | AD9: 1
A10: SANDRINGHAM | C10: 8 | D10: 5 | E10: =C10*6+D10 -> 53 | G10: 10 | H10: 10 | I10: =G10*6+H10 -> 70 | K10: 12 | L10: 16 | M10: =K10*6+L10 -> 88 | O10: 18 | P10: 24 | Q10: =O10*6+P10 -> 132 | S10: UMPIRE
A11: BRIGHTON | C11: 3 | D11: 1 | E11: =C11*6+D11 -> 19 | G11: 5 | H11: 6 | I11: =G11*6+H11 -> 36 | K11: 8 | L11: 11 | M11: =K11*6+L11 -> 59 | O11: 10 | P11: 13 | Q11: =O11*6+P11 -> 73 | S11: STUART | W11: TEAM | X11: W | Y11: L | Z11: D | AA11: FOR | AB11: AGST | AC11: % | AD11: PTS | DA11: \D | DB11: {GOTO}BJ3~/M{RIGHT 7}{END}{DOWN}~G4~
A12: BEST PLAYERS | DB12: {GOTO}AL3~/M{END}{RIGHT}{END}{DOWN}~P3~
A13: SANDRINGHAM | C13: FITZGERALD | F13: RAYMENT | I13: FORBES | L13: THOMS | O13: KEMP | Q13: BECKTON | W13: SANDRINGHAM | X13: 1 | Y13: 0 | Z13: 0 | AA13: 132 | AB13: 73 | AC13: 180.82191780821918 | AD13: 4 | DB13: {GOTO}BJ23~/M{RIGHT 7}{END}{DOWN}~V4~
A14: BRIGHTON | C14: TUCKER | F14: POULTER | I14: HUNT | L14: STEWART | O14: PENNY | Q14: TOMLINS | W14: COBURG | X14: 1 | Y14: 0 | Z14: 0 | AA14: 85 | AB14: 50 | AC14: 170 | AD14: 4 | DB14: {GOTO}BJ43~/M{RIGHT 7}{END}{DOWN}~G27~
A15: GOALKICKERS | W15: CAMBERWELL | X15: 1 | Y15: 0 | Z15: 0 | AA15: 87 | AB15: 66 | AC15: 131.81818181818181 | AD15: 4 | DB15: {GOTO}AL26~/M{END}{RIGHT}{END}{DOWN}~P26~
A16: SANDRINGHAM | C16: FORBES 6 | F16: JOHNSON 5 | I16: RAYMENT 3 | L16: DE LUCA 2 | O16: McGAIN | Q16: FITZGERALD | W16: PRAHRAN | X16: 1 | Y16: 0 | Z16: 0 | AA16: 104 | AB16: 84 | AC16: 123.80952380952381 | AD16: 4 | DB16: {GOTO}BJ63~/M{RIGHT 7}{END}{DOWN}~V27~
A17: BRIGHTON | C17: AMINDE 4 | F17: WILKINS | I17: PENNY | K17: BOLWELL | M17: TUCKER | O17: HILL | Q17: CANTWELL | DB17: {GOTO}BJ83~/M{RIGHT 7}{END}{DOWN}~G50~
W18: NORTHCOTE | X18: 1 | Y18: 0 | Z18: 0 | AA18: 128 | AB18: 105 | AC18: 121.9047619047619 | AD18: 4 | DB18: {GOTO}AL49~/M{END}{RIGHT}{END}{DOWN}~P49~
A19: CAMBERWELL | C19: 2 | D19: 2 | E19: =C19*6+D19 -> 14 | G19: 6 | H19: 5 | I19: =G19*6+H19 -> 41 | K19: 9 | L19: 8 | M19: =K19*6+L19 -> 62 | O19: 13 | P19: 9 | Q19: =O19*6+P19 -> 87 | S19: OAKLEIGH | W19: YARRAVILLE | X19: 1 | Y19: 0 | Z19: 0 | AA19: 74 | AB19: 69 | AC19: 107.2463768115942 | AD19: 4 | DB19: {GOTO}BJ103~/M{RIGHT 7}{END}{DOWN}~V50~
A20: OAKLEIGH | C20: 3 | D20: 5 | E20: =C20*6+D20 -> 23 | G20: 5 | H20: 5 | I20: =G20*6+H20 -> 35 | K20: 6 | L20: 9 | M20: =K20*6+L20 -> 45 | O20: 9 | P20: 12 | Q20: =O20*6+P20 -> 66 | S20: GREGORY | W20: WILLIAMSTOWN | X20: 0 | Y20: 1 | Z20: 0 | AA20: 69 | AB20: 74 | AC20: 93.243243243243242 | AD20: 0 | DB20: {GOTO}BJ123~/M{RIGHT 7}{END}{DOWN}~G73~
A21: BEST PLAYERS | W21: PRESTON | X21: 0 | Y21: 1 | Z21: 0 | AA21: 105 | AB21: 128 | AC21: 82.03125 | AD21: 0 | DB21: {GOTO}AL72~/M{END}{RIGHT}{END}{DOWN}~P72~
A22: CAMBERWELL | C22: HENDERSON | F22: JONES | I22: LASKY | L22: MASON | O22: FYFFE | Q22: TROTTER | W22: PORT MELBOURNE | X22: 0 | Y22: 1 | Z22: 0 | AA22: 84 | AB22: 104 | AC22: 80.769230769230774 | AD22: 0 | DB22: {GOTO}BJ143~/M{RIGHT 7}{END}{DOWN}~V73~
A23: OAKLEIGH | C23: WITHERS | F23: CRAMERI | I23: YANN | L23: DRIVER | O23: JACKSON | Q23: BAKER | W23: OAKLEIGH | X23: 0 | Y23: 1 | Z23: 0 | AA23: 66 | AB23: 87 | AC23: 75.862068965517238 | AD23: 0 | DB23: {GOTO}BJ163~/M{RIGHT 7}{END}{DOWN}~G96~
A24: GOALKICKERS | W24: BRUNSWICK | X24: 0 | Y24: 1 | Z24: 0 | AA24: 50 | AB24: 85 | AC24: 58.823529411764703 | AD24: 0 | DB24: {GOTO}AL95~/M{END}{RIGHT}{END}{DOWN}~P95~
A25: CAMBERWELL | C25: MASON 4 | F25: LUFF 2 | H25: TROTTER 2 | K25: LASKY 2 | M25: FYFE | N25: CLAMP | P25: PIERCE | W25: BRIGHTON | X25: 0 | Y25: 1 | Z25: 0 | AA25: 73 | AB25: 132 | AC25: 55.303030303030305 | AD25: 0 | DB25: {GOTO}BJ183~/M{RIGHT 7}{END}{DOWN}~V96~
A26: OAKLEIGH | C26: CRAMERI 2 | F26: FLEMING 2 | I26: YANN 2 | K26: FRASER | M26: BERNARD | O26: WILTSHIRE | DB26: {GOTO}BJ203~/M{RIGHT 7}{END}{DOWN}~G119~
DB27: {GOTO}AL118~/M{END}{RIGHT}{END}{DOWN}~P113~
A28: PRAHRAN | C28: 4 | D28: 3 | E28: =C28*6+D28 -> 27 | G28: 7 | H28: 7 | I28: =G28*6+H28 -> 49 | K28: 12 | L28: 12 | M28: =K28*6+L28 -> 84 | O28: 15 | P28: 14 | Q28: =O28*6+P28 -> 104 | S28: TOORAK PARK | DB28: {GOTO}BJ223~/M{RIGHT 7}{END}{DOWN}~V119~
A29: PORT MELBOURNE | C29: 5 | D29: 2 | E29: =C29*6+D29 -> 32 | G29: 6 | H29: 6 | I29: =G29*6+H29 -> 42 | K29: 10 | L29: 8 | M29: =K29*6+L29 -> 68 | O29: 12 | P29: 12 | Q29: =O29*6+P29 -> 84 | S29: LESTER
A30: BEST PLAYERS
A31: PRAHRAN | C31: JORDAN | F31: F SMITH | I31: HAWKINS | L31: BANKS | O31: KOOP | Q31: MASON | DB31: {GOTO}BJ243~/M{RIGHT 7}{END}{DOWN}~G142~
A32: PORT MELBOURNE | C32: TUITE | F32: L KEATING | I32: HARRY | L32: REES | O32: LOVETT | Q32: LOWRIE | DB32: {GOTO}AL141~/M{END}{RIGHT}{END}{DOWN}~P141~
A33: GOALKICKERS | DB33: {GOTO}BJ263~/M{RIGHT 7}{END}{DOWN}~V142~
A34: PRAHRAN | C34: HAWKINS 6 | F34: KOOP 3 | H34: TRIM 2 | J34: HANNAN | L34: GOUGH | N34: BRENCHLEY | Q34: SMITH | DB34: {GOTO}BJ283~/M{RIGHT 7}{END}{DOWN}~G165~
A35: PORT MELBOURNE | C35: KEATING 4 | F35: BRANSTON 2 | I35: REES 2 | K35: RUSDEN | M35: HYDE | O35: MALTBY | Q35: BOQUEST | DB35: {GOTO}AL164~/M{END}{RIGHT}{END}{DOWN}~P164~
DB36: {GOTO}BJ303~/M{RIGHT 7}{END}{DOWN}~V165~
A37: YARRAVILLE | C37: 2 | D37: 3 | E37: =C37*6+D37 -> 15 | G37: 5 | H37: 5 | I37: =G37*6+H37 -> 35 | K37: 6 | L37: 13 | M37: =K37*6+L37 -> 49 | O37: 9 | P37: 20 | Q37: =O37*6+P37 -> 74 | S37: YARRAVILLE | DB37: {GOTO}BJ323~/M{RIGHT 7}{END}{DOWN}~G188~
A38: WILLIAMSTOWN | C38: 5 | D38: 6 | E38: =C38*6+D38 -> 36 | G38: 6 | H38: 11 | I38: =G38*6+H38 -> 47 | K38: 8 | L38: 11 | M38: =K38*6+L38 -> 59 | O38: 9 | P38: 15 | Q38: =O38*6+P38 -> 69 | S38: MURRAY | DB38: {GOTO}AL187~/M{END}{RIGHT}{END}{DOWN}~P187~
A39: BEST PLAYERS | DB39: {GOTO}BJ343~/M{RIGHT 7}{END}{DOWN}~V188~
A40: YARRAVILLE | C40: CAMERON | F40: McGRATH | I40: WHITE | L40: FREW | O40: QUIGG | Q40: WUNHYM | DB40: {GOTO}BJ363~/M{RIGHT 7}{END}{DOWN}~G211~
A41: WILLIAMSTOWN | C41: BLAKE | F41: STANBRIDGE | I41: BROOKS | L41: SINCLAIR | O41: CUTTING | Q41: JOHNS | DB41: {GOTO}AL210~/M{END}{RIGHT}{END}{DOWN}~P210~
A42: GOALKICKERS | DB42: {GOTO}BJ383~/M{RIGHT 7}{END}{DOWN}~V211~
A43: YARRAVILLE | C43: SHEEHAN 2 | F43: McGRATH 2 | I43: WUNHYM | L43: PENNY | N43: FORDHAM | Q43: QUIGG | S43: CAMERON | DB43: {GOTO}BJ403~/M{RIGHT 7}{END}{DOWN}~G234~
A44: WILLIAMSTOWN | C44: BLAKE 4 | F44: WARD | I44: BYRNE | L44: FLINN | N44: JAENSCH | Q44: SINCLAIR | DB44: {GOTO}AL233~/M{END}{RIGHT}{END}{DOWN}~P237~
DB45: {GOTO}BJ423~/M{RIGHT 7}{END}{DOWN}~V234~
A46: COBURG | C46: 2 | D46: 6 | E46: =C46*6+D46 -> 18 | G46: 4 | H46: 8 | I46: =G46*6+H46 -> 32 | K46: 5 | L46: 10 | M46: =K46*6+L46 -> 40 | O46: 12 | P46: 13 | Q46: =O46*6+P46 -> 85 | S46: COBURG | DB46: {HOME}
A47: BRUNSWICK | C47: 1 | D47: 0 | E47: =C47*6+D47 -> 6 | G47: 3 | H47: 4 | I47: =G47*6+H47 -> 22 | K47: 6 | L47: 7 | M47: =K47*6+L47 -> 43 | O47: 7 | P47: 8 | Q47: =O47*6+P47 -> 50 | S47: BRANDON
A48: BEST PLAYERS
A49: COBURG | C49: LEAHY | F49: MEARS | I49: JENKINS | L49: STOCKDALE | O49: ELLIOTT | R49: BROOM
A50: BRUNSWICK | C50: H JONES | F50: McGRATH | I50: KENNEDY | L50: DOWLING | O50: FITZGERALD | R50: WOODS
A51: GOALKICKERS
A52: COBURG | C52: MEARS 4 | F52: LOWE 3 | I52: BROOM 2 | L52: ROGERS | N52: WILLOX | Q52: JENKINS
A53: BRUNSWICK | C53: JONES 6 | F53: GILLON
A55: NORTHCOTE | C55: 5 | D55: 2 | E55: =C55*6+D55 -> 32 | G55: 12 | H55: 6 | I55: =G55*6+H55 -> 78 | K55: 16 | L55: 10 | M55: =K55*6+L55 -> 106 | O55: 19 | P55: 14 | Q55: =O55*6+P55 -> 128 | S55: NORTHCOTE
A56: PRESTON | C56: 6 | D56: 5 | E56: =C56*6+D56 -> 41 | G56: 7 | H56: 8 | I56: =G56*6+H56 -> 50 | K56: 10 | L56: 11 | M56: =K56*6+L56 -> 71 | O56: 15 | P56: 15 | Q56: =O56*6+P56 -> 105 | S56: HUNTINGTON
A57: BEST PLAYERS
A58: NORTHCOTE | C58: SMITH | F58: GARRETT | I58: ROSS | L58: PERKINS | O58: CORRIGAN | R58: HART
A59: PRESTON | C59: WARR | F59: BREWIS | I59: McSWAIN | L59: WALSH | O59: CAMERON | R59: DOYLE
A60: GOALKICKERS
A61: NORTHCOTE | C61: SIMMONDS 6 | F61: SMITH 4 | I61: SEYMOUR 3 | L61: BRAY 3 | O61: POWER | Q61: ROSS | S61: WILLIAMSON
A62: PRESTON | C62: WALSH 3 | F62: WARR 3 | I62: HARDING 3 | L62: DINEEN 3 | O62: CAMERON 2 | R62: HUGHSON
A64: ROUND 2 | E64: 22ND APRIL | J64: WEATHER | M64: COOL CLOUDY SOUTH BREEZE | S64: PLAYED AT
D65: 1ST QTR | H65: 2ND QTR | L65: 3RD QTR | P65: FINAL | S65: ELSTERNWICK PARK
A66: BRIGHTON | C66: 2 | D66: 2 | E66: =C66*6+D66 -> 14 | G66: 7 | H66: 7 | I66: =G66*6+H66 -> 49 | K66: 9 | L66: 11 | M66: =K66*6+L66 -> 65 | O66: 12 | P66: 13 | Q66: =O66*6+P66 -> 85 | S66: UMPIRE | X66: LADDER | AB66: ROUND | AD66: 2
A67: NORTHCOTE | C67: 2 | D67: 2 | E67: =C67*6+D67 -> 14 | G67: 7 | H67: 4 | I67: =G67*6+H67 -> 46 | K67: 10 | L67: 7 | M67: =K67*6+L67 -> 67 | O67: 12 | P67: 10 | Q67: =O67*6+P67 -> 82 | S67: MURRAY
A68: BEST PLAYERS | W68: TEAM | X68: W | Y68: L | Z68: D | AA68: FOR | AB68: AGST | AC68: % | AD68: PTS
A69: BRIGHTON | C69: STEWART | F69: PENNY | I69: WILKINS | L69: TOMLINS | O69: HILL | Q69: JOHNSTONE
A70: NORTHCOTE | C70: HONIG | F70: GARRETT | I70: WILLIAMSON | L70: BRAY | O70: ROSS | Q70: ROWE | W70: CAMBERWELL | X70: 2 | Y70: 0 | Z70: 0 | AA70: 216 | AB70: 124 | AC70: 174.19354838709677 | AD70: 8
A71: GOALKICKERS | W71: SANDRINGHAM | X71: 2 | Y71: 0 | Z71: 0 | AA71: 217 | AB71: 157 | AC71: 138.21656050955414 | AD71: 8
A72: BRIGHTON | C72: AMINDE 4 | F72: PENNY 4 | I72: AVERY | K72: TOMLINS | M72: LILBURNE | O72: QUINN | W72: COBURG | X72: 1 | Y72: 0 | Z72: 1 | AA72: 142 | AB72: 107 | AC72: 132.71028037383178 | AD72: 6
A73: NORTHCOTE | C73: SEYMOUR 4 | F73: BRAY 3 | I73: ROSS 2 | K73: SIMMONDS | N73: WILLIAMSON | Q73: HONIG | W73: NORTHCOTE | X73: 1 | Y73: 1 | Z73: 0 | AA73: 210 | AB73: 190 | AC73: 110.52631578947368 | AD73: 4
A75: CAMBERWELL | C75: 4 | D75: 2 | E75: =C75*6+D75 -> 26 | G75: 12 | H75: 7 | I75: =G75*6+H75 -> 79 | K75: 15 | L75: 8 | M75: =K75*6+L75 -> 98 | O75: 19 | P75: 15 | Q75: =O75*6+P75 -> 129 | S75: CAMBERWELL | W75: PORT MELBOURNE | X75: 1 | Y75: 1 | Z75: 0 | AA75: 184 | AB75: 173 | AC75: 106.35838150289017 | AD75: 4
A76: PRAHRAN | C76: 4 | D76: 8 | E76: =C76*6+D76 -> 32 | G76: 5 | H76: 10 | I76: =G76*6+H76 -> 40 | K76: 5 | L76: 16 | M76: =K76*6+L76 -> 46 | O76: 7 | P76: 16 | Q76: =O76*6+P76 -> 58 | S76: GLOVER | W76: OAKLEIGH | X76: 1 | Y76: 1 | Z76: 0 | AA76: 160 | AB76: 173 | AC76: 92.48554913294798 | AD76: 4
A77: BEST PLAYERS | W77: YARRAVILLE | X77: 1 | Y77: 1 | Z77: 0 | AA77: 143 | AB77: 169 | AC77: 84.615384615384613 | AD77: 4
A78: CAMBERWELL | C78: CLAMP | F78: DYBALL | I78: MASON | L78: BOOTHMAN | O78: LUFF | Q78: FYFFE | W78: PRAHRAN | X78: 1 | Y78: 1 | Z78: 0 | AA78: 162 | AB78: 213 | AC78: 76.056338028169009 | AD78: 4
A79: PRAHRAN | C79: KOOP | F79: FARNAN | I79: JORDAN | L79: F SMITH | O79: BECK | Q79: WILLIAMS | W79: BRIGHTON | X79: 1 | Y79: 1 | Z79: 0 | AA79: 158 | AB79: 214 | AC79: 73.831775700934585 | AD79: 4
A80: GOALKICKERS | W80: PRESTON | X80: 0 | Y80: 1 | Z80: 1 | AA80: 162 | AB80: 185 | AC80: 87.567567567567565 | AD80: 2
A81: CAMBERWELL | C81: LUFF 4 | E81: FYFE 4 | G81: LASKY 3 | I81: MASON 2 | K81: TROTTER 2 | N81: BOOTHMAN 2 | Q81: V COFFIN 2 | W81: WILLIAMSTOWN | X81: 0 | Y81: 2 | Z81: 0 | AA81: 155 | AB81: 168 | AC81: 92.261904761904759 | AD81: 0
A82: PRAHRAN | C82: HAWKINS 2 | F82: N WILLIAMS 2 | I82: KOOP | K82: TRIM | M82: JORDAN | W82: BRUNSWICK | X82: 0 | Y82: 2 | Z82: 0 | AA82: 134 | AB82: 170 | AC82: 78.82352941176471 | AD82: 0
A84: PORT MELBOURNE | C84: 0 | D84: 5 | E84: =C84*6+D84 -> 5 | G84: 4 | H84: 12 | I84: =G84*6+H84 -> 36 | K84: 8 | L84: 16 | M84: =K84*6+L84 -> 64 | O84: 13 | P84: 22 | Q84: =O84*6+P84 -> 100 | S84: PORT MELBOURNE
A85: YARRAVILLE | C85: 1 | D85: 1 | E85: =C85*6+D85 -> 7 | G85: 4 | H85: 4 | I85: =G85*6+H85 -> 28 | K85: 10 | L85: 7 | M85: =K85*6+L85 -> 67 | O85: 10 | P85: 9 | Q85: =O85*6+P85 -> 69 | S85: LEWIS
A86: BEST PLAYERS
A87: PORT MELBOURNE | C87: LEGGO | F87: BOQUEST | I87: RUSDEN | L87: L KEATING | O87: REES | Q87: HARRY
A88: YARRAVILLE | C88: WARDEN | F88: WHITE | I88: EDWARDS | L88: SHEEHAN | O88: PETERS | Q88: BAKER
A89: GOALKICKERS
A90: PORT MELBOURNE | C90: KEATING 3 | F90: RUSDEN 2 | I90: LEGGO 2 | K90: BOQUEST | M90: TUITE | O90: LOVETT | Q90: HURLEY | T90: PERRETT
A91: YARRAVILLE | C91: SHEEHAN 4 | F91: WALKER 2 | I91: McGRATH | K91: PENNY | M91: QUIGG | O91: PETERS
A93: SANDRINGHAM | C93: 3 | D93: 7 | E93: =C93*6+D93 -> 25 | G93: 5 | H93: 12 | I93: =G93*6+H93 -> 42 | K93: 9 | L93: 17 | M93: =K93*6+L93 -> 71 | O93: 11 | P93: 19 | Q93: =O93*6+P93 -> 85 | S93: BRUNSWICK
A94: BRUNSWICK | C94: 1 | D94: 1 | E94: =C94*6+D94 -> 7 | G94: 5 | H94: 5 | I94: =G94*6+H94 -> 35 | K94: 10 | L94: 6 | M94: =K94*6+L94 -> 66 | O94: 12 | P94: 12 | Q94: =O94*6+P94 -> 84 | S94: HUNTINGTON
A95: BEST PLAYERS
A96: SANDRINGHAM | C96: BECKTON | F96: FITZGERALD | I96: DE LUCA | L96: TOLSON | O96: RAYMENT | Q96: CHALLIS
A97: BRUNSWICK | C97: DOWLING | F97: MUTIMER | I97: RAEBURN | L97: SHEARD | O97: McNEILL | Q97: BLACKMORE
A98: GOALKICKERS
A99: SANDRINGHAM | C99: JOHNSON 5 | F99: DE LUCA 2 | I99: BECKTON 2 | L99: BOURKE | O99: MILLER
A100: BRUNSWICK | C100: JONES 2 | E100: GILLON 2 | G100: SHEARD 2 | I100: MUTIMER 2 | L100: DOWLING | N100: RAEBURN | Q100: FITZGERALD | T100: McNEAL
A102: OAKLEIGH | C102: 1 | D102: 1 | E102: =C102*6+D102 -> 7 | G102: 6 | H102: 10 | I102: =G102*6+H102 -> 46 | K102: 6 | L102: 11 | M102: =K102*6+L102 -> 47 | O102: 13 | P102: 16 | Q102: =O102*6+P102 -> 94 | S102: WILLIAMSTOWN
A103: WILLIAMSTOWN | C103: 3 | D103: 5 | E103: =C103*6+D103 -> 23 | G103: 5 | H103: 5 | I103: =G103*6+H103 -> 35 | K103: 11 | L103: 12 | M103: =K103*6+L103 -> 78 | O103: 12 | P103: 14 | Q103: =O103*6+P103 -> 86 | S103: KILKENNY
A104: BEST PLAYERS
A105: OAKLEIGH | C105: WITHERS | F105: WILTSHIRE | I105: FLEMING | L105: FRASER | O105: YANN | R105: A SMITH
A106: WILLIAMSTOWN | C106: BROOKS | F106: SHADE | I106: LONERGAN | L106: CAHILL | O106: STANBRIDGE | R106: NEILL
A107: GOALKICKERS
A108: OAKLEIGH | C108: FRASER 3 | F108: WITHERS 3 | I108: FLEMING 2 | L108: DENNING 2 | O108: YANN | Q108: O'HALLORAN | T108: BAKER
A109: WILLIAMSTOWN | C109: SHADE 4 | F109: WARD 3 | I109: CAHILL 2 | L109: C DREW | N109: McDONALD | Q109: DELLER
A111: PRESTON | C111: 3 | D111: 2 | E111: =C111*6+D111 -> 20 | G111: 5 | H111: 7 | I111: =G111*6+H111 -> 37 | K111: 5 | L111: 10 | M111: =K111*6+L111 -> 40 | O111: 7 | P111: 15 | Q111: =O111*6+P111 -> 57 | S111: PRESTON
A112: COBURG | C112: 3 | D112: 6 | E112: =C112*6+D112 -> 24 | G112: 4 | H112: 8 | I112: =G112*6+H112 -> 32 | K112: 5 | L112: 11 | M112: =K112*6+L112 -> 41 | O112: 7 | P112: 15 | Q112: =O112*6+P112 -> 57 | S112: BRANDON
A113: BEST PLAYERS
A114: PRESTON | C114: McSWAIN | F114: McEACHARN | I114: P SPARGO | L114: WARR | O114: DAVIE | Q114: G SMITH
A115: COBURG | C115: RUDOLPH | F115: JENKINS | I115: HARRIS | L115: WILLOX | O115: LOWE | Q115: ELLIOTT
A116: GOALKICKERS
A117: PRESTON | C117: WARR 3 | F117: WALSH | I117: CAMERON | L117: THOMSON | O117: DOYLE
A118: COBURG | C118: DUNCAN 2 | F118: MEARS | I118: LOWE | K118: BROOM | M118: JENKINS | O118: McGRATH
A120: ROUND 3 | E120: 29TH APRIL | J120: WEATHER | M120: FINE MILD SOUTH BREEZE | S120: PLAYED AT
D121: 1ST QTR | H121: 2ND QTR | L121: 3RD QTR | P121: FINAL | S121: COBURG
A122: NORTHCOTE | C122: 1 | D122: 0 | E122: =C122*6+D122 -> 6 | G122: 5 | H122: 5 | I122: =G122*6+H122 -> 35 | K122: 8 | L122: 8 | M122: =K122*6+L122 -> 56 | O122: 13 | P122: 9 | Q122: =O122*6+P122 -> 87 | S122: UMPIRE | X122: LADDER | AB122: ROUND | AD122: 3
A123: COBURG | C123: 4 | D123: 6 | E123: =C123*6+D123 -> 30 | G123: 5 | H123: 8 | I123: =G123*6+H123 -> 38 | K123: 8 | L123: 10 | M123: =K123*6+L123 -> 58 | O123: 10 | P123: 13 | Q123: =O123*6+P123 -> 73 | S123: SCHAEFER
A124: BEST PLAYERS | W124: TEAM | X124: W | Y124: L | Z124: D | AA124: FOR | AB124: AGST | AC124: % | AD124: PTS
A125: NORTHCOTE | C125: ROWE | E125: ROSS | H125: CORRIGAN | K125: WOODS | N125: HART | Q125: HAMILTON
A126: COBURG | C126: KIGHT | E126: MEARS | H126: ROGERS | K126: WILLOX | N126: STOCKDALE | Q126: ELLIOTT | W126: CAMBERWELL | X126: 3 | Y126: 0 | Z126: 0 | AA126: 352 | AB126: 201 | AC126: 175.12437810945275 | AD126: 12
A127: GOALKICKERS | W127: SANDRINGHAM | X127: 3 | Y127: 0 | Z127: 0 | AA127: 317 | AB127: 239 | AC127: 132.63598326359832 | AD127: 12
A128: NORTHCOTE | C128: SEYMOUR 6 | F128: ROSS 3 | H128: ROGERS 2 | J128: WILLIAMSON | M128: GRAY | N128: HAMILTON | W128: PORT MELBOURNE | X128: 2 | Y128: 1 | Z128: 0 | AA128: 313 | AB128: 263 | AC128: 119.01140684410646 | AD128: 8
A129: COBURG | C129: BROOM 3 | F129: ELEY 2 | H129: ROGERS | J129: JENKINS | L129: McGRATH | N129: VOIGHT | P129: LEAHY | W129: NORTHCOTE | X129: 2 | Y129: 1 | Z129: 0 | AA129: 297 | AB129: 263 | AC129: 112.92775665399239 | AD129: 8
A131: PORT MELBOURNE | C131: 3 | D131: 3 | E131: =C131*6+D131 -> 21 | G131: 8 | H131: 9 | I131: =G131*6+H131 -> 57 | K131: 12 | L131: 12 | M131: =K131*6+L131 -> 84 | O131: 19 | P131: 15 | Q131: =O131*6+P131 -> 129 | S131: PORT MELBOURNE | W131: YARRAVILLE | X131: 2 | Y131: 1 | Z131: 0 | AA131: 263 | AB131: 246 | AC131: 106.91056910569105 | AD131: 8
A132: PRESTON | C132: 2 | D132: 8 | E132: =C132*6+D132 -> 20 | G132: 4 | H132: 10 | I132: =G132*6+H132 -> 34 | K132: 9 | L132: 17 | M132: =K132*6+L132 -> 71 | O132: 12 | P132: 18 | Q132: =O132*6+P132 -> 90 | S132: BURSTON | W132: OAKLEIGH | X132: 2 | Y132: 1 | Z132: 0 | AA132: 273 | AB132: 277 | AC132: 98.555956678700355 | AD132: 8
A133: BEST PLAYERS | W133: COBURG | X133: 1 | Y133: 1 | Z133: 1 | AA133: 215 | AB133: 194 | AC133: 110.82474226804123 | AD133: 6
A134: PORT MELBOURNE | C134: L KEATING | F134: LOVETT | I134: PERRETT | K134: BOQUEST | N134: GARBUTT | Q134: REES | W134: PRAHRAN | X134: 1 | Y134: 2 | Z134: 0 | AA134: 244 | AB134: 313 | AC134: 77.95527156549521 | AD134: 4
A135: PRESTON | C135: HARDING | F135: HUGHSON | I135: WARR | K135: MCSWAIN | N135: CUNNINGHAM | Q135: P SPARGO | W135: BRIGHTON | X135: 1 | Y135: 2 | Z135: 0 | AA135: 235 | AB135: 334 | AC135: 70.359281437125745 | AD135: 4
A136: GOALKICKERS | P136: TUITE | R136: HURLEY | W136: PRESTON | X136: 0 | Y136: 2 | Z136: 1 | AA136: 252 | AB136: 314 | AC136: 80.254777070063696 | AD136: 2
A137: PORT MELBOURNE | C137: KEATING 6 | F137: HARRY 3 | H137: REES 2 | J137: RUSDEN 2 | M137: PERRETT 2 | P137: BRANSTON | R137: BOQUEST | W137: BRUNSWICK | X137: 0 | Y137: 3 | Z137: 0 | AA137: 238 | AB137: 283 | AC137: 84.098939929328623 | AD137: 0
A138: PRESTON | C138: WALSH 3 | F138: WARR 2 | H138: HUGHSON 2 | J138: DOYLE 2 | L138: DAVIE | N138: UNDERHILL | Q138: ROBINSON | W138: WILLIAMSTOWN | X138: 0 | Y138: 3 | Z138: 0 | AA138: 232 | AB138: 304 | AC138: 76.315789473684205 | AD138: 0
A140: OAKLEIGH | C140: 1 | D140: 5 | E140: =C140*6+D140 -> 11 | G140: 9 | H140: 8 | I140: =G140*6+H140 -> 62 | K140: 12 | L140: 13 | M140: =K140*6+L140 -> 85 | O140: 16 | P140: 17 | Q140: =O140*6+P140 -> 113 | S140: OAKLEIGH
A141: BRUNSWICK | C141: 4 | D141: 3 | E141: =C141*6+D141 -> 27 | G141: 6 | H141: 6 | I141: =G141*6+H141 -> 42 | K141: 11 | L141: 12 | M141: =K141*6+L141 -> 78 | O141: 15 | P141: 14 | Q141: =O141*6+P141 -> 104 | S141: MURRAY
A142: BEST PLAYERS
A143: OAKLEIGH | C143: DENNING | F143: CRAMERI | I143: WITHERS | L143: McALLISTER | O143: YANN | Q143: FRASER
A144: BRUNSWICK | C144: JONES | F144: MUTIMER | I144: GILLON | L144: BLACKMORE | O144: D TAYLOR | Q144: FITZGERALD
A145: GOALKICKERS
A146: OAKLEIGH | C146: DENNING 5 | F146: FRASER 3 | I146: CRAMERI 2 | L146: YANN 2 | N146: BERNARD | P146: WATSON | R146: S SMITH | U146: KENNEDY
A147: BRUNSWICK | C147: JONES 8 | F147: MUTIMER 3 | I147: GILLON 2 | L147: SHEARD | N147: D TAYLOR
A149: SANDRINGHAM | C149: 6 | D149: 4 | E149: =C149*6+D149 -> 40 | G149: 8 | H149: 10 | I149: =G149*6+H149 -> 58 | K149: 10 | L149: 18 | M149: =K149*6+L149 -> 78 | O149: 13 | P149: 22 | Q149: =O149*6+P149 -> 100 | S149: BEACH RD
A150: PRAHRAN | C150: 3 | D150: 5 | E150: =C150*6+D150 -> 23 | G150: 6 | H150: 7 | I150: =G150*6+H150 -> 43 | K150: 8 | L150: 9 | M150: =K150*6+L150 -> 57 | O150: 11 | P150: 16 | Q150: =O150*6+P150 -> 82 | S150: BRANDON
A151: BEST PLAYERS
A152: SANDRINGHAM | C152: RAYMENT | F152: JOHNSON | I152: TOLSON | L152: JAMIESON | O152: BOURKE | Q152: CHALLIS
A153: PRAHRAN | C153: THOMPSON | F153: JORDAN | I153: F SMITH | L153: KENNY | O153: HAWKINS | Q153: TRIM
A154: GOALKICKERS
A155: SANDRINGHAM | C155: JOHNSON 8 | F155: FORBES | I155: RAYMENT | L155: DE LUCA | O155: CHALLIS | Q155: TOLSON
A156: PRAHRAN | C156: HAWKINS 6 | F156: KENNY 4 | I156: WELLS | L156: FARNAN
A158: YARRAVILLE | C158: 5 | D158: 6 | E158: =C158*6+D158 -> 36 | G158: 8 | H158: 6 | I158: =G158*6+H158 -> 54 | K158: 13 | L158: 12 | M158: =K158*6+L158 -> 90 | O158: 18 | P158: 12 | Q158: =O158*6+P158 -> 120 | S158: ELSTERNWICK PARK
A159: BRIGHTON | C159: 2 | D159: 6 | E159: =C159*6+D159 -> 18 | G159: 7 | H159: 12 | I159: =G159*6+H159 -> 54 | K159: 8 | L159: 14 | M159: =K159*6+L159 -> 62 | O159: 10 | P159: 17 | Q159: =O159*6+P159 -> 77 | S159: HASSETT
A160: BEST PLAYERS
A161: YARRAVILLE | C161: WHITE | F161: WUNHYM | I161: BOURKE | L161: SHEEAHN | O161: EVANS | Q161: EDWARDS
A162: BRIGHTON | C162: POULTER | F162: WILKINS | I162: CLOUGH | L162: LILBURNE | O162: DEAN | Q162: TOMLINS
A163: GOALKICKERS
A164: YARRAVILLE | C164: DIMOND 4 | F164: COPPOCK 3 | I164: EVANS 3 | K164: SHEEHAN 2 | N164: WUNHYM 2 | Q164: McGRATH | S164: PENNY | U164: FORDHAM | X164: MILBURN
A165: BRIGHTON | C165: AMINDE 3 | F165: POULTER 3 | I165: DEAN 2 | K165: HILL | M165: O'BRIEN
A167: CAMBERWELL | C167: 2 | D167: 1 | E167: =C167*6+D167 -> 13 | G167: 10 | H167: 6 | I167: =G167*6+H167 -> 66 | K167: 14 | L167: 7 | M167: =K167*6+L167 -> 91 | O167: 20 | P167: 16 | Q167: =O167*6+P167 -> 136 | S167: CAMBERWELL
A168: WILLIAMSTOWN | C168: 4 | D168: 1 | E168: =C168*6+D168 -> 25 | G168: 5 | H168: 3 | I168: =G168*6+H168 -> 33 | K168: 11 | L168: 7 | M168: =K168*6+L168 -> 73 | O168: 11 | P168: 11 | Q168: =O168*6+P168 -> 77 | S168: HUNTINGTON
A169: BEST PLAYERS
A170: CAMBERWELL | C170: McLEOD | F170: LUFF | I170: H JONES | L170: R WILLIAMS | O170: L WILLIAMS | R170: MASON
A171: WILLIAMSTOWN | C171: STANBRIDGE | F171: CAHILL | I171: DELLER | L171: FLYNN | O171: DREW | R171: BLAKE
A172: GOALKICKERS
A173: CAMBERWELL | C173: LUFF 5 | E173: TROTTER 3 | H173: FYFE 3 | J173: W COFFIN 3 | M173: PIERCE 2 | O173: V COFFIN 2 | R173: CLAMP | U173: BOOTHMAN
A174: WILLIAMSTOWN | C174: CAHILL 4 | E174: FLINN 3 | G174: SINCLAIR 2 | J174: SHADE | L174: STANBRIDGE
A176: ROUND 4 | E176: 6TH MAY | J176: WEATHER | M176: CLOUDY BUT FINE S.W. BREEZE | S176: PLAYED AT
D177: 1ST QTR | H177: 2ND QTR | L177: 3RD QTR | P177: FINAL | S177: PRESTON
A178: PRESTON | C178: 6 | D178: 4 | E178: =C178*6+D178 -> 40 | G178: 9 | H178: 8 | I178: =G178*6+H178 -> 62 | K178: 13 | L178: 13 | M178: =K178*6+L178 -> 91 | O178: 19 | P178: 19 | Q178: =O178*6+P178 -> 133 | S178: UMPIRE | X178: LADDER | AB178: ROUND | AD178: 4
A179: BRIGHTON | C179: 4 | D179: 1 | E179: =C179*6+D179 -> 25 | G179: 7 | H179: 6 | I179: =G179*6+H179 -> 48 | K179: 10 | L179: 8 | M179: =K179*6+L179 -> 68 | O179: 12 | P179: 11 | Q179: =O179*6+P179 -> 83 | S179: GODFREY
A180: BEST PLAYERS | W180: TEAM | X180: W | Y180: L | Z180: D | AA180: FOR | AB180: AGST | AC180: % | AD180: PTS
A181: PRESTON | C181: DAVIE | F181: WALSH | I181: CAMERON | L181: McEACHARN | O181: DOYLE | Q181: McSWAIN
A182: BRIGHTON | C182: LILBURNE | F182: WILKINS | I182: HUNT | L182: W O'BRIEN | O182: CLOUGH | Q182: POULTER | W182: CAMBERWELL | X182: 3 | Y182: 1 | Z182: 0 | AA182: 440 | AB182: 293 | AC182: 150.17064846416383 | AD182: 12
A183: GOALKICKERS | Q183: SMITH | W183: PORT MELBOURNE | X183: 3 | Y183: 1 | Z183: 0 | AA183: 417 | AB183: 302 | AC183: 138.07947019867549 | AD183: 12
A184: PRESTON | C184: WARR 3 | E184: CAMERON 3 | H184: ROBINSON 3 | K184: WALSH 3 | M184: DINEEN 2 | O184: UNDERHILL 2 | R184: DOYLE | T184: COCKS | W184: SANDRINGHAM | X184: 3 | Y184: 1 | Z184: 0 | AA184: 384 | AB184: 320 | AC184: 120 | AD184: 12
A185: BRIGHTON | C185: LILBURNE 3 | F185: AMINDE 2 | I185: POULTER 2 | L185: DEAN 2 | N185: WILKINS | P185: TUCKER | R185: QUINN | W185: NORTHCOTE | X185: 3 | Y185: 1 | Z185: 0 | AA185: 389 | AB185: 351 | AC185: 110.82621082621083 | AD185: 12
A187: NORTHCOTE | C187: 1 | D187: 2 | E187: =C187*6+D187 -> 8 | G187: 5 | H187: 11 | I187: =G187*6+H187 -> 41 | K187: 9 | L187: 11 | M187: =K187*6+L187 -> 65 | O187: 13 | P187: 14 | Q187: =O187*6+P187 -> 92 | S187: NORTHCOTE | W187: YARRAVILLE | X187: 3 | Y187: 1 | Z187: 0 | AA187: 344 | AB187: 313 | AC187: 109.90415335463258 | AD187: 12
A188: CAMBERWELL | C188: 2 | D188: 6 | E188: =C188*6+D188 -> 18 | G188: 3 | H188: 7 | I188: =G188*6+H188 -> 25 | K188: 9 | L188: 13 | M188: =K188*6+L188 -> 67 | O188: 12 | P188: 16 | Q188: =O188*6+P188 -> 88 | S188: BRANDON | W188: OAKLEIGH | X188: 3 | Y188: 1 | Z188: 0 | AA188: 382 | AB188: 375 | AC188: 101.86666666666666 | AD188: 12
A189: BEST PLAYERS | W189: COBURG | X189: 1 | Y189: 2 | Z189: 1 | AA189: 269 | AB189: 268 | AC189: 100.3731343283582 | AD189: 6
A190: NORTHCOTE | C190: ROSS | F190: ROWE | I190: LYNGCOLN | L190: SEYMOUR | O190: WOODS | Q190: GOULLET | W190: PRESTON | X190: 1 | Y190: 2 | Z190: 1 | AA190: 385 | AB190: 397 | AC190: 96.977329974811084 | AD190: 6
A191: CAMBERWELL | C191: O'NEILL | F191: DYBALL | I191: L WILLIAMS | L191: LUFF | O191: WALLACE | Q191: MASON | W191: WILLIAMSTOWN | X191: 1 | Y191: 3 | Z191: 0 | AA191: 306 | AB191: 358 | AC191: 85.47486033519553 | AD191: 4
A192: GOALKICKERS | W192: PRAHRAN | X192: 1 | Y192: 3 | Z192: 0 | AA192: 342 | AB192: 422 | AC192: 81.042654028436019 | AD192: 4
A193: NORTHCOTE | C193: SEYMOUR 7 | F193: SIMMONDS 2 | I193: WILLIAMSON | L193: GRAY | N193: BROWN | W193: BRIGHTON | X193: 1 | Y193: 3 | Z193: 0 | AA193: 318 | AB193: 467 | AC193: 68.094218415417558 | AD193: 4
A194: CAMBERWELL | C194: LUFF 7 | F194: BOOTHMAN 2 | I194: W COFFIN | L194: ROWE | N194: R WILLIAMS | W194: BRUNSWICK | X194: 0 | Y194: 4 | Z194: 0 | AA194: 277 | AB194: 387 | AC194: 71.576227390180875 | AD194: 0
A196: WILLIAMSTOWN | C196: 0 | D196: 1 | E196: =C196*6+D196 -> 1 | G196: 5 | H196: 6 | I196: =G196*6+H196 -> 36 | K196: 7 | L196: 8 | M196: =K196*6+L196 -> 50 | O196: 10 | P196: 14 | Q196: =O196*6+P196 -> 74 | S196: WILLIAMSTOWN
A197: COBURG | C197: 4 | D197: 3 | E197: =C197*6+D197 -> 27 | G197: 4 | H197: 4 | I197: =G197*6+H197 -> 28 | K197: 7 | L197: 6 | M197: =K197*6+L197 -> 48 | O197: 8 | P197: 6 | Q197: =O197*6+P197 -> 54 | S197: VALE
A198: BEST PLAYERS
A199: WILLIAMSTOWN | C199: DIXON | F199: SYKES | I199: ADDISON | L199: HURWOOD | O199: STANBRIDGE
A200: COBURG | C200: STOCKDALE | F200: MEARS | I200: LEAHY | L200: ELLIOTT | O200: PROUDFOOT
A201: GOALKICKERS
A202: WILLIAMSTOWN | C202: HURWOOD 5 | F202: DIXON 2 | I202: BYRNE | K202: ADDISON | M202: McCABE
A203: COBURG | C203: BROOM 2 | F203: PROUDFOOT 2 | I203: WILLOX | K203: VOIGHT | M203: BEERS | O203: GRIFFITHS
A205: YARRAVILLE | C205: 5 | D205: 3 | E205: =C205*6+D205 -> 33 | G205: 6 | H205: 7 | I205: =G205*6+H205 -> 43 | K205: 7 | L205: 12 | M205: =K205*6+L205 -> 54 | O205: 11 | P205: 15 | Q205: =O205*6+P205 -> 81 | S205: YARRAVILLE
A206: SANDRINGHAM | C206: 4 | D206: 3 | E206: =C206*6+D206 -> 27 | G206: 4 | H206: 12 | I206: =G206*6+H206 -> 36 | K206: 7 | L206: 17 | M206: =K206*6+L206 -> 59 | O206: 8 | P206: 19 | Q206: =O206*6+P206 -> 67 | S206: McKINNON
A207: BEST PLAYERS
A208: YARRAVILLE | C208: EDWARDS | F208: BOURKE | I208: COPPOCK | L208: W BUCKLEY | O208: WUNHYM | R208: EVANS
A209: SANDRINGHAM | C209: RAYMENT | F209: BAXTER | I209: TOLSON | L209: YEMM | O209: MICHAELSON | R209: HISCOCK
A210: GOALKICKERS
A211: YARRAVILLE | C211: COPPOCK 3 | F211: J BUCKLEY 3 | I211: EVANS 2 | K211: McGRATH | M211: PETERS | O211: WARDEN
A212: SANDRINGHAM | C212: JAMIESON 2 | F212: THOMS 2 | I212: RAYMENT | K212: TOLSON | M212: YEMM | O212: DUDFIELD
A214: PORT MELBOURNE | C214: 2 | D214: 5 | E214: =C214*6+D214 -> 17 | G214: 3 | H214: 16 | I214: =G214*6+H214 -> 34 | K214: 7 | L214: 19 | M214: =K214*6+L214 -> 61 | O214: 13 | P214: 26 | Q214: =O214*6+P214 -> 104 | S214: BRUNSWICK
A215: BRUNSWICK | C215: 1 | D215: 3 | E215: =C215*6+D215 -> 9 | G215: 3 | H215: 3 | I215: =G215*6+H215 -> 21 | K215: 5 | L215: 7 | M215: =K215*6+L215 -> 37 | O215: 5 | P215: 9 | Q215: =O215*6+P215 -> 39 | S215: STUART
A216: BEST PLAYERS
A217: PORT MELBOURNE | C217: BEDFORD | F217: GARBUTT | I217: L KEATING | L217: LEGGO | O217: ALDRIDGE | R217: REES
A218: BRUNSWICK | C218: DOWLING | F218: FITZGERALD | I218: MUTIMER | L218: JONES | O218: RAEBURN | R218: WOODS
A219: GOALKICKERS
A220: PORT MELBOURNE | C220: KEATING 4 | F220: BEDFORD 4 | I220: BOQUEST 2 | L220: REES | N220: HURLEY | P220: ALDRIDGE
A221: BRUNSWICK | C221: JONES | E221: GILLON | G221: MUTIMER | J221: FITZGERALD | M221: MAYNES
A223: OAKLEIGH | C223: 7 | D223: 2 | E223: =C223*6+D223 -> 44 | G223: 9 | H223: 4 | I223: =G223*6+H223 -> 58 | K223: 12 | L223: 9 | M223: =K223*6+L223 -> 81 | O223: 16 | P223: 13 | Q223: =O223*6+P223 -> 109 | S223: TOORAK PARK
A224: PRAHRAN | C224: 5 | D224: 3 | E224: =C224*6+D224 -> 33 | G224: 9 | H224: 5 | I224: =G224*6+H224 -> 59 | K224: 12 | L224: 10 | M224: =K224*6+L224 -> 82 | O224: 14 | P224: 14 | Q224: =O224*6+P224 -> 98 | S224: HUNTINGTON
A225: BEST PLAYERS
A226: OAKLEIGH | C226: FLEMING | F226: CRAMERI | I226: FRASER | L226: McALLISTER | O226: WILTSHIRE | R226: DENNING
A227: PRAHRAN | C227: JORDAN | F227: TRIM | I227: BRENCHLEY | L227: KOOP | O227: NECK | R227: FARNAN
A228: GOALKICKERS
A229: OAKLEIGH | C229: FRASER 4 | E229: FLEMING 3 | H229: DENNING 3 | J229: BAKER 2 | L229: A SMITH 2 | O229: CRAMERI | Q229: KENNEDY | T229: CROWE
A230: PRAHRAN | C230: TRIM 4 | E230: JORDAN 3 | H230: GOUGH 3 | J230: HAWKINS | L230: BRENCHLEY | O230: SMITH | Q230: HARRIS
A232: ROUND 5 | E232: 13TH MAY | J232: WEATHER | M232: RAIN N.W. BREEZE | S232: PLAYED AT
D233: 1ST QTR | H233: 2ND QTR | L233: 3RD QTR | P233: FINAL | S233: NORTHCOTE
A234: NORTHCOTE | C234: 3 | D234: 4 | E234: =C234*6+D234 -> 22 | G234: 8 | H234: 9 | I234: =G234*6+H234 -> 57 | K234: 13 | L234: 12 | M234: =K234*6+L234 -> 90 | O234: 16 | P234: 16 | Q234: =O234*6+P234 -> 112 | S234: UMPIRE | X234: LADDER | AB234: ROUND | AD234: 5
A235: BRUNSWICK | C235: 5 | D235: 1 | E235: =C235*6+D235 -> 31 | G235: 6 | H235: 5 | I235: =G235*6+H235 -> 41 | K235: 8 | L235: 9 | M235: =K235*6+L235 -> 57 | O235: 10 | P235: 12 | Q235: =O235*6+P235 -> 72 | S235: GREGORY
A236: BEST PLAYERS | W236: TEAM | X236: W | Y236: L | Z236: D | AA236: FOR | AB236: AGST | AC236: % | AD236: PTS
A237: NORTHCOTE | C237: SEYMOUR | F237: SMITH | I237: HART | L237: BROWN | O237: ROSS | Q237: ROWE
A238: BRUNSWICK | C238: MORGAN | F238: McNEILL | I238: DOWLING | L238: JONES | O238: MUTIMER | Q238: BLACKMORE | W238: PORT MELBOURNE | X238: 4 | Y238: 1 | Z238: 0 | AA238: 504 | AB238: 354 | AC238: 142.37288135593221 | AD238: 16
A239: GOALKICKERS | W239: CAMBERWELL | X239: 4 | Y239: 1 | Z239: 0 | AA239: 517 | AB239: 365 | AC239: 141.64383561643837 | AD239: 16
A240: NORTHCOTE | C240: SEYMOUR 5 | F240: BROWN 4 | I240: SMITH 3 | K240: ROSS 2 | M240: WILLIAMSON | P240: COLE | W240: SANDRINGHAM | X240: 4 | Y240: 1 | Z240: 0 | AA240: 473 | AB240: 389 | AC240: 121.59383033419023 | AD240: 16
A241: BRUNSWICK | C241: JONES 4 | F241: MUTIMER 2 | I241: FITZGERALD 2 | M241: DOWLING | P241: McNEAL | W241: NORTHCOTE | X241: 4 | Y241: 1 | Z241: 0 | AA241: 501 | AB241: 423 | AC241: 118.43971631205673 | AD241: 16
A243: PRAHRAN | C243: 3 | D243: 4 | E243: =C243*6+D243 -> 22 | G243: 8 | H243: 11 | I243: =G243*6+H243 -> 59 | K243: 14 | L243: 16 | M243: =K243*6+L243 -> 100 | O243: 20 | P243: 19 | Q243: =O243*6+P243 -> 139 | S243: ELSTERNWICK PARK | W243: YARRAVILLE | X243: 4 | Y243: 1 | Z243: 0 | AA243: 424 | AB243: 372 | AC243: 113.97849462365592 | AD243: 16
A244: BRIGHTON | C244: 2 | D244: 6 | E244: =C244*6+D244 -> 18 | G244: 2 | H244: 7 | I244: =G244*6+H244 -> 19 | K244: 3 | L244: 9 | M244: =K244*6+L244 -> 27 | O244: 6 | P244: 9 | Q244: =O244*6+P244 -> 45 | S244: McKINNON | W244: OAKLEIGH | X244: 3 | Y244: 2 | Z244: 0 | AA244: 441 | AB244: 455 | AC244: 96.92307692307692 | AD244: 12
A245: BEST PLAYERS | W245: PRAHRAN | X245: 2 | Y245: 3 | Z245: 0 | AA245: 481 | AB245: 467 | AC245: 102.99785867237688 | AD245: 8
A246: PRAHRAN | C246: JORDAN | F246: F SMITH | I246: TRIM | L246: WHITE | N246: BRENCHLEY | Q246: NECK | W246: PRESTON | X246: 1 | Y246: 3 | Z246: 1 | AA246: 457 | AB246: 474 | AC246: 96.413502109704638 | AD246: 6
A247: BRIGHTON | C247: WILKINS | F247: HARRISON | I247: TUCKER | L247: STEWART | N247: HILL | W247: COBURG | X247: 1 | Y247: 3 | Z247: 1 | AA247: 338 | AB247: 357 | AC247: 94.677871148459388 | AD247: 6
A248: GOALKICKERS | W248: WILLIAMSTOWN | X248: 1 | Y248: 4 | Z248: 0 | AA248: 358 | AB248: 445 | AC248: 80.449438202247194 | AD248: 4
A249: PRAHRAN | C249: BRENCHLEY 5 | F249: WHITE 5 | I249: HAWKINS 4 | L249: TRIM 2 | N249: JORDAN 2 | Q249: HARRIS | S249: HINKS | W249: BRIGHTON | X249: 1 | Y249: 4 | Z249: 0 | AA249: 363 | AB249: 606 | AC249: 59.900990099009903 | AD249: 4
A250: BRIGHTON | C250: TUCKER 2 | F250: DEAN 2 | I250: HILL | K250: BURNES | W250: BRUNSWICK | X250: 0 | Y250: 5 | Z250: 0 | AA250: 349 | AB250: 499 | AC250: 69.939879759519044 | AD250: 0
A252: SANDRINGHAM | C252: 1 | D252: 4 | E252: =C252*6+D252 -> 10 | G252: 3 | H252: 9 | I252: =G252*6+H252 -> 27 | K252: 5 | L252: 15 | M252: =K252*6+L252 -> 45 | O252: 12 | P252: 17 | Q252: =O252*6+P252 -> 89 | S252: BEACH ROAD
A253: COBURG | C253: 6 | D253: 2 | E253: =C253*6+D253 -> 38 | G253: 6 | H253: 5 | I253: =G253*6+H253 -> 41 | K253: 9 | L253: 7 | M253: =K253*6+L253 -> 61 | O253: 10 | P253: 9 | Q253: =O253*6+P253 -> 69 | S253: BRANDON
A254: BEST PLAYERS
A255: SANDRINGHAM | C255: TOLSON | F255: RALPH | I255: LUNN | L255: MICHAELSON | O255: JAMIESON | R255: BECKTON
A256: COBURG | C256: RUDOLPH | F256: STOCKDALE | I256: ELLIOTT | L256: HODDER | O256: BROOM | R256: JENKINS
A257: GOALKICKERS
A258: SANDRINGHAM | C258: CAHIR 4 | F258: JOHNSON 2 | I258: JAMIESON 2 | L258: FITZGERALD | N258: BECKTON | Q258: R BAXTER
A259: COBURG | C259: JENKINS 3 | F259: MEARS 2 | I259: KIGHT 2 | L259: BROOM | N259: McGRATH | Q259: WARD
A261: YARRAVILLE | C261: 2 | D261: 5 | E261: =C261*6+D261 -> 17 | G261: 7 | H261: 12 | I261: =G261*6+H261 -> 54 | K261: 8 | L261: 14 | M261: =K261*6+L261 -> 62 | O261: 10 | P261: 20 | Q261: =O261*6+P261 -> 80 | S261: OAKLEIGH
A262: OAKLEIGH | C262: 0 | D262: 4 | E262: =C262*6+D262 -> 4 | G262: 2 | H262: 5 | I262: =G262*6+H262 -> 17 | K262: 5 | L262: 11 | M262: =K262*6+L262 -> 41 | O262: 7 | P262: 17 | Q262: =O262*6+P262 -> 59 | S262: MURRAY
A263: BEST PLAYERS
A264: YARRAVILLE | C264: WUNHYM | F264: EVANS | I264: EDWARDS | L264: McGRATH | O264: WHITE | Q264: CAMERON
A265: OAKLEIGH | C265: WITHERS | F265: FRASER | I265: McALLISTER | L265: DRIVER | O265: FAHEY | Q265: YANN
A266: GOALKICKERS
A267: YARRAVILLE | C267: J BUCKLEY 3 | F267: SHEEHAN | I267: McGRATH | K267: WUNHYM | M267: PETERS | O267: EVANS | Q267: WARDEN | S267: SIMPSON
A268: OAKLEIGH | C268: FRASER 3 | F268: YANN | I268: WITHERS | K268: DENNING | M268: GOULD
A270: PORT MELBOURNE | C270: 3 | D270: 2 | E270: =C270*6+D270 -> 20 | G270: 4 | H270: 7 | I270: =G270*6+H270 -> 31 | K270: 7 | L270: 9 | M270: =K270*6+L270 -> 51 | O270: 13 | P270: 9 | Q270: =O270*6+P270 -> 87 | S270: PORT MELBOURNE
A271: WILLIAMSTOWN | C271: 2 | D271: 2 | E271: =C271*6+D271 -> 14 | G271: 3 | H271: 4 | I271: =G271*6+H271 -> 22 | K271: 4 | L271: 8 | M271: =K271*6+L271 -> 32 | O271: 7 | P271: 10 | Q271: =O271*6+P271 -> 52 | S271: MILLER
A272: BEST PLAYERS
A273: PORT MELBOURNE | C273: LOVETT | F273: L KEATING | I273: BOQUEST | L273: LEGGO | O273: HURLEY | Q273: GARBUTT
A274: WILLIAMSTOWN | C274: SYKES | F274: BARNES | I274: JOHNS | L274: JAENSCH | O274: BLAKE | Q274: TAYLOR
A275: GOALKICKERS
A276: PORT MELBOURNE | C276: KEATING 4 | F276: BEDFORD 4 | I276: ALDRIDGE 2 | L276: TUITE | O276: GARLEPP
A277: WILLIAMSTOWN | C277: SINCLAIR 2 | F277: McADAM 2 | I277: BLAKE | L277: ADDISON | O277: JOHNS
A279: CAMBERWELL | C279: 1 | D279: 3 | E279: =C279*6+D279 -> 9 | G279: 6 | H279: 9 | I279: =G279*6+H279 -> 45 | K279: 6 | L279: 12 | M279: =K279*6+L279 -> 48 | O279: 10 | P279: 17 | Q279: =O279*6+P279 -> 77 | S279: CAMBERWELL
A280: PRESTON | C280: 4 | D280: 6 | E280: =C280*6+D280 -> 30 | G280: 6 | H280: 10 | I280: =G280*6+H280 -> 46 | K280: 6 | L280: 16 | M280: =K280*6+L280 -> 52 | O280: 9 | P280: 18 | Q280: =O280*6+P280 -> 72 | S280: HUNTINGTON
A281: BEST PLAYERS
A282: CAMBERWELL | C282: JONES | F282: R WILLIAMS | I282: ANDREW | K282: BOOTHMAN | N282: CLAMP | Q282: O'NEILL
A283: PRESTON | C283: ROBINSON | F283: DAVIE | I283: DINEEN | K283: UNDERHILL | N283: McEACHARN | Q283: WALSH
A284: GOALKICKERS
A285: CAMBERWELL | C285: MASON 2 | F285: TROTTER 2 | I285: FYFE 2 | K285: BOOTHMAN 2 | N285: LUFF | P285: CLAMP
A286: PRESTON | C286: HEARN 3 | F286: ROBINSON 2 | I286: WARR | K286: DINEEN | M286: McEACHERN | P286: McSWAIN
A288: ROUND 6 | E288: 20TH MAY | J288: WEATHER | M288: FINE PARTLY CLOUDY EAST WIND | S288: PLAYED AT
D289: 1ST QTR | H289: 2ND QTR | L289: 3RD QTR | P289: FINAL | S289: BRUNSWICK
A290: PRESTON | C290: 1 | D290: 4 | E290: =C290*6+D290 -> 10 | G290: 8 | H290: 5 | I290: =G290*6+H290 -> 53 | K290: 12 | L290: 11 | M290: =K290*6+L290 -> 83 | O290: 16 | P290: 15 | Q290: =O290*6+P290 -> 111 | S290: UMPIRE | X290: LADDER | AB290: ROUND | AD290: 6
A291: BRUNSWICK | C291: 3 | D291: 3 | E291: =C291*6+D291 -> 21 | G291: 6 | H291: 5 | I291: =G291*6+H291 -> 41 | K291: 8 | L291: 10 | M291: =K291*6+L291 -> 58 | O291: 10 | P291: 14 | Q291: =O291*6+P291 -> 74 | S291: BRANDON
A292: BEST PLAYERS | W292: TEAM | X292: W | Y292: L | Z292: D | AA292: FOR | AB292: AGST | AC292: % | AD292: PTS
A293: PRESTON | C293: McEACHARN | F293: PLUMMER | I293: CAMERON | L293: McSWAIN | O293: BOYLE | Q293: ROBINSON
A294: BRUNSWICK | C294: BLACKMORE | F294: JONES | I294: GILLON | L294: PRISMAL | O294: MUTIMER | Q294: FITZGERALD | W294: PORT MELBOURNE | X294: 5 | Y294: 1 | Z294: 0 | AA294: 622 | AB294: 438 | AC294: 142.00913242009133 | AD294: 20
A295: GOALKICKERS | W295: CAMBERWELL | X295: 5 | Y295: 1 | Z295: 0 | AA295: 614 | AB295: 452 | AC295: 135.84070796460176 | AD295: 20
A296: PRESTON | C296: WARR 4 | E296: ROBINSON 4 | H296: WALSH 3 | J296: CAMERON 2 | M296: DAVIE 2 | O296: COCKS | W296: YARRAVILLE | X296: 5 | Y296: 1 | Z296: 0 | AA296: 532 | AB296: 435 | AC296: 122.29885057471265 | AD296: 20
A297: BRUNSWICK | C297: JONES 6 | E297: MUTIMER 2 | H297: GILLON | J297: MAYNES | W297: SANDRINGHAM | X297: 4 | Y297: 2 | Z297: 0 | AA297: 560 | AB297: 486 | AC297: 115.22633744855968 | AD297: 16
A299: CAMBERWELL | C299: 4 | D299: 2 | E299: =C299*6+D299 -> 26 | G299: 6 | H299: 3 | I299: =G299*6+H299 -> 39 | K299: 10 | L299: 8 | M299: =K299*6+L299 -> 68 | O299: 14 | P299: 13 | Q299: =O299*6+P299 -> 97 | S299: CAMBERWELL | W299: NORTHCOTE | X299: 4 | Y299: 2 | Z299: 0 | AA299: 564 | AB299: 531 | AC299: 106.21468926553672 | AD299: 16
A300: SANDRINGHAM | C300: 6 | D300: 5 | E300: =C300*6+D300 -> 41 | G300: 6 | H300: 14 | I300: =G300*6+H300 -> 50 | K300: 9 | L300: 15 | M300: =K300*6+L300 -> 69 | O300: 11 | P300: 21 | Q300: =O300*6+P300 -> 87 | S300: MILLER | W300: OAKLEIGH | X300: 3 | Y300: 3 | Z300: 0 | AA300: 525 | AB300: 573 | AC300: 91.623036649214654 | AD300: 12
A301: BEST PLAYERS | W301: PRESTON | X301: 2 | Y301: 3 | Z301: 1 | AA301: 568 | AB301: 548 | AC301: 103.64963503649635 | AD301: 10
A302: CAMBERWELL | C302: WALLACE | F302: TROTTER | I302: PIERCE | K302: MASON | N302: HENDERSON | Q302: LATHLAIN | W302: COBURG | X302: 2 | Y302: 3 | Z302: 1 | AA302: 456 | AB302: 451 | AC302: 101.10864745011087 | AD302: 10
A303: SANDRINGHAM | C303: THOMS | F303: FITZGERALD | I303: YEMM | K303: BECKTON | N303: CAHIR | Q303: LUNN | W303: PRAHRAN | X303: 2 | Y303: 4 | Z303: 0 | AA303: 575 | AB303: 585 | AC303: 98.290598290598297 | AD303: 8
A304: GOALKICKERS | W304: BRIGHTON | X304: 2 | Y304: 4 | Z304: 0 | AA304: 467 | AB304: 700 | AC304: 66.714285714285708 | AD304: 8
A305: CAMBERWELL | C305: TROTTER 3 | F305: LUFF 3 | H305: MASON 2 | J305: CLAMP 2 | M305: MIDDLETON 2 | P305: LASKY | R305: O'NEILL | W305: WILLIAMSTOWN | X305: 1 | Y305: 5 | Z305: 0 | AA305: 452 | AB305: 549 | AC305: 82.331511839708554 | AD305: 4
A306: SANDRINGHAM | C306: JOHNSON 5 | F306: RAYMENT 2 | I306: CAHIR 2 | K306: TOLSON | M306: R BAXTER | W306: BRUNSWICK | X306: 0 | Y306: 6 | Z306: 0 | AA306: 423 | AB306: 610 | AC306: 69.344262295081961 | AD306: 0
A308: COBURG | C308: 3 | D308: 5 | E308: =C308*6+D308 -> 23 | G308: 7 | H308: 6 | I308: =G308*6+H308 -> 48 | K308: 14 | L308: 11 | M308: =K308*6+L308 -> 95 | O308: 17 | P308: 16 | Q308: =O308*6+P308 -> 118 | S308: COBURG
A309: PRAHRAN | C309: 4 | D309: 1 | E309: =C309*6+D309 -> 25 | G309: 8 | H309: 4 | I309: =G309*6+H309 -> 52 | K309: 11 | L309: 8 | M309: =K309*6+L309 -> 74 | O309: 13 | P309: 16 | Q309: =O309*6+P309 -> 94 | S309: STUART
A310: BEST PLAYERS
A311: COBURG | C311: KIGHT | E311: HARRIS | H311: BROOM | K311: STOCKDALE | N311: LOWE | Q311: VOIGHT
A312: PRAHRAN | C312: WHITE | E312: HYDE | H312: MASON | K312: KOOP | N312: KENNY | Q312: HAWKINS
A313: GOALKICKERS
A314: COBURG | C314: KIGHT 5 | E314: BROOM 4 | G314: LOWE 2 | I314: STOCKDALE 2 | L314: MEARS | N314: LEAHY | P314: J D HOGAN | S314: HARRIS
A315: PRAHRAN | C315: HAWKINS 4 | F315: KENNY 3 | I315: BRENCHLEY 2 | L315: WHITE 2 | N315: JORDAN | P315: TABATEAU
A317: BRIGHTON | C317: 7 | D317: 3 | E317: =C317*6+D317 -> 45 | G317: 11 | H317: 6 | I317: =G317*6+H317 -> 72 | K317: 11 | L317: 10 | M317: =K317*6+L317 -> 76 | O317: 15 | P317: 14 | Q317: =O317*6+P317 -> 104 | S317: WILLIAMSTOWN
A318: WILLIAMSTOWN | C318: 1 | D318: 3 | E318: =C318*6+D318 -> 9 | G318: 7 | H318: 9 | I318: =G318*6+H318 -> 51 | K318: 11 | L318: 13 | M318: =K318*6+L318 -> 79 | O318: 13 | P318: 16 | Q318: =O318*6+P318 -> 94 | S318: McKINNON
A319: BEST PLAYERS
A320: BRIGHTON | C320: POULTER | F320: TUCKER | I320: LILBURNE | L320: J O'BRIEN | O320: HUNT | R320: JOHNSTONE
A321: WILLIAMSTOWN | C321: CAHILL | F321: STANBRIDGE | I321: BARNES | L321: JOHNS | O321: TAYLOR | R321: ADDISON
A322: GOALKICKERS
A323: BRIGHTON | C323: HILL 3 | E323: TUCKER 2 | G323: LILBURNE 2 | J323: DEAN 2 | L323: O'BRIEN 2 | N323: PENNY | P323: BURNES | R323: GOLDSWORTHY | W323: HARRISON
A324: WILLIAMSTOWN | C324: CAHILL 8 | F324: BLAKE 2 | I324: JAENSCH | K324: SHADE | M324: McADAM
A326: YARRAVILLE | C326: 3 | D326: 3 | E326: =C326*6+D326 -> 21 | G326: 6 | H326: 7 | I326: =G326*6+H326 -> 43 | K326: 10 | L326: 10 | M326: =K326*6+L326 -> 70 | O326: 16 | P326: 12 | Q326: =O326*6+P326 -> 108 | S326: YARRAVILLE
A327: NORTHCOTE | C327: 1 | D327: 3 | E327: =C327*6+D327 -> 9 | G327: 2 | H327: 7 | I327: =G327*6+H327 -> 19 | K327: 5 | L327: 14 | M327: =K327*6+L327 -> 44 | O327: 8 | P327: 15 | Q327: =O327*6+P327 -> 63 | S327: GREGORY
A328: BEST PLAYERS
A329: YARRAVILLE | C329: WUNHYM | F329: J BUCKLEY | I329: BAKER | L329: McGRATH | O329: EVANS | R329: BOURKE
A330: NORTHCOTE | C330: SMITH | F330: CORRIGAN | I330: GOULLET | L330: ACKLAND | O330: SIMMONDS | R330: GARRETT
A331: GOALKICKERS
A332: YARRAVILLE | C332: J BUCKLEY 7 | F332: EVANS 3 | I332: SIMPSON 3 | L332: McGRATH 2 | O332: CAMERON
A333: NORTHCOTE | C333: SMITH 2 | F333: SIMMONDS | I333: ROSS | K333: GRAY | M333: HAMILTON
A335: PORT MELBOURNE | C335: 4 | D335: 2 | E335: =C335*6+D335 -> 26 | G335: 10 | H335: 9 | I335: =G335*6+H335 -> 69 | K335: 14 | L335: 12 | M335: =K335*6+L335 -> 96 | O335: 17 | P335: 16 | Q335: =O335*6+P335 -> 118 | S335: OAKLEIGH
A336: OAKLEIGH | C336: 3 | D336: 5 | E336: =C336*6+D336 -> 23 | G336: 4 | H336: 8 | I336: =G336*6+H336 -> 32 | K336: 9 | L336: 12 | M336: =K336*6+L336 -> 66 | O336: 11 | P336: 18 | Q336: =O336*6+P336 -> 84 | S336: HUNTINGTON
A337: BEST PLAYERS
A338: PORT MELBOURNE | C338: LOVETT | F338: GARBUTT | I338: L KEATING | L338: TUITE | O338: BOQUEST | R338: RUSDEN
A339: OAKLEIGH | C339: WITHERS | F339: GOULD | I339: FLEMING | L339: FRASER | O339: DENNING | R339: BAKER
A340: GOALKICKERS
A341: PORT MELBOURNE | C341: KEATING 6 | F341: BEDFORD 4 | I341: HURLEY 3 | K341: ALDRIDGE 2 | N341: REES | P341: GARLEPP
A342: OAKLEIGH | C342: DENNING 3 | F342: KENNEDY 2 | I342: CRAMERI | K342: FRASER | M342: JACKSON | O342: S SMITH | Q342: A SMITH | T342: R SMITH
A344: ROUND 7 | E344: 27TH MAY | J344: WEATHER | M344: COOL CLOUDY GUSTY N.W. WIND | S344: PLAYED AT
D345: 1ST QTR | H345: 2ND QTR | L345: 3RD QTR | P345: FINAL | S345: PORT MELBOURNE
A346: PORT MELBOURNE | C346: 2 | D346: 3 | E346: =C346*6+D346 -> 15 | G346: 6 | H346: 5 | I346: =G346*6+H346 -> 41 | K346: 10 | L346: 7 | M346: =K346*6+L346 -> 67 | O346: 12 | P346: 9 | Q346: =O346*6+P346 -> 81 | S346: UMPIRE | X346: LADDER | AB346: ROUND | AD346: 7
A347: NORTHCOTE | C347: 4 | D347: 5 | E347: =C347*6+D347 -> 29 | G347: 6 | H347: 8 | I347: =G347*6+H347 -> 44 | K347: 10 | L347: 11 | M347: =K347*6+L347 -> 71 | O347: 11 | P347: 15 | Q347: =O347*6+P347 -> 81 | S347: NOWLAN
A348: BEST PLAYERS | W348: TEAM | X348: W | Y348: L | Z348: D | AA348: FOR | AB348: AGST | AC348: % | AD348: PTS
A349: PORT MELBOURNE | C349: LEGGO | E349: BARNES | H349: GARBUTT | K349: L KEATING | N349: HURLEY | Q349: GARLEPP
A350: NORTHCOTE | C350: POWELL | E350: WOODS | H350: WILSON | K350: ROWE | N350: ROSS | Q350: GARRETT | W350: CAMBERWELL | X350: 6 | Y350: 1 | Z350: 0 | AA350: 720 | AB350: 527 | AC350: 136.62239089184061 | AD350: 24
A351: GOALKICKERS | W351: YARRAVILLE | X351: 6 | Y351: 1 | Z351: 0 | AA351: 661 | AB351: 495 | AC351: 133.53535353535352 | AD351: 24
A352: PORT MELBOURNE | C352: KEATING 3 | F352: PERRETT 3 | I352: BEDFORD 3 | L352: HURLEY 2 | N352: RUSDEN | P352: BROOKER | W352: PORT MELBOURNE | X352: 5 | Y352: 1 | Z352: 1 | AA352: 703 | AB352: 519 | AC352: 135.45279383429673 | AD352: 22
A353: NORTHCOTE | C353: SEYMOUR 4 | F353: GRAY 3 | I353: SIMMONDS | L353: SMITH | N353: ROSS | P353: HONIG | W353: SANDRINGHAM | X353: 5 | Y353: 2 | Z353: 0 | AA353: 672 | AB353: 585 | AC353: 114.87179487179488 | AD353: 20
A355: COBURG | C355: 4 | D355: 2 | E355: =C355*6+D355 -> 26 | G355: 8 | H355: 4 | I355: =G355*6+H355 -> 52 | K355: 11 | L355: 7 | M355: =K355*6+L355 -> 73 | O355: 18 | P355: 12 | Q355: =O355*6+P355 -> 120 | S355: ELSTERNWICK PARK | W355: NORTHCOTE | X355: 4 | Y355: 2 | Z355: 1 | AA355: 645 | AB355: 612 | AC355: 105.3921568627451 | AD355: 18
A356: BRIGHTON | C356: 7 | D356: 3 | E356: =C356*6+D356 -> 45 | G356: 13 | H356: 6 | I356: =G356*6+H356 -> 84 | K356: 15 | L356: 13 | M356: =K356*6+L356 -> 103 | O356: 17 | P356: 15 | Q356: =O356*6+P356 -> 117 | S356: GLOVER | W356: PRESTON | X356: 3 | Y356: 3 | Z356: 1 | AA356: 673 | AB356: 596 | AC356: 112.91946308724832 | AD356: 14
A357: BEST PLAYERS | W357: COBURG | X357: 3 | Y357: 3 | Z357: 1 | AA357: 576 | AB357: 568 | AC357: 101.40845070422536 | AD357: 14
A358: COBURG | C358: JENKINS | F358: HARRIS | I358: KIGHT | L358: LOWE | O358: ANDRSON | Q358: BROOM | W358: OAKLEIGH | X358: 3 | Y358: 4 | Z358: 0 | AA358: 573 | AB358: 678 | AC358: 84.513274336283189 | AD358: 12
A359: BRIGHTON | C359: POULTER | F359: LILBURNE | I359: TUCKER | L359: DEEGAN | O359: PENNY | Q359: DEANE | W359: PRAHRAN | X359: 2 | Y359: 5 | Z359: 0 | AA359: 635 | AB359: 714 | AC359: 88.935574229691881 | AD359: 8
A360: GOALKICKERS | W360: BRIGHTON | X360: 2 | Y360: 5 | Z360: 0 | AA360: 584 | AB360: 820 | AC360: 71.219512195121951 | AD360: 8
A361: COBURG | C361: LOWE 6 | E361: BROOM 4 | G361: KIGHT 2 | I361: ANDERSON 2 | L361: MEARS | N361: JENKINS | P361: J D HOGAN | S361: HARRIS | W361: WILLIAMSTOWN | X361: 1 | Y361: 6 | Z361: 0 | AA361: 551 | AB361: 661 | AC361: 83.35854765506808 | AD361: 4
A362: BRIGHTON | C362: POULTER 4 | F362: DEAN 4 | H362: PENNY 2 | J362: TUCKER 2 | M362: HILL 2 | O362: LILBURNE | Q362: HARRISON | W362: BRUNSWICK | X362: 0 | Y362: 7 | Z362: 0 | AA362: 498 | AB362: 716 | AC362: 69.55307262569832 | AD362: 0
A364: SANDRINGHAM | C364: 4 | D364: 7 | E364: =C364*6+D364 -> 31 | G364: 8 | H364: 8 | I364: =G364*6+H364 -> 56 | K364: 10 | L364: 16 | M364: =K364*6+L364 -> 76 | O364: 15 | P364: 22 | Q364: =O364*6+P364 -> 112 | S364: BEACH ROAD
A365: WILLIAMSTOWN | C365: 3 | D365: 0 | E365: =C365*6+D365 -> 18 | G365: 10 | H365: 5 | I365: =G365*6+H365 -> 65 | K365: 12 | L365: 8 | M365: =K365*6+L365 -> 80 | O365: 15 | P365: 9 | Q365: =O365*6+P365 -> 99 | S365: BRANDON
A366: BEST PLAYERS
A367: SANDRINGHAM | C367: RAYMENT | F367: THOMS | I367: DE LUCA | L367: TOLSON | O367: BECKTON | R367: KEMP
A368: WILLIAMSTOWN | C368: BROOKS | F368: BLAKE | I368: ADDISON | L368: CAHILL | O368: WILLIAMSON | R368: SHADE
A369: GOALKICKERS
A370: SANDRINGHAM | C370: JOHNSON 4 | F370: RAYMENT 3 | I370: CAHIR 2 | K370: DE LUCA | M370: FITZGERALD | P370: BECKTON | R370: TOLSON | U370: YEMM | W370: ANDERSON
A371: WILLIAMSTOWN | C371: CAHILL 6 | F371: BLAKE 2 | I371: STANBRIDGE 2 | L371: ADDISON | N371: McCABE | P371: SCOTT
A373: YARRAVILLE | C373: 1 | D373: 3 | E373: =C373*6+D373 -> 9 | G373: 5 | H373: 4 | I373: =G373*6+H373 -> 34 | K373: 10 | L373: 12 | M373: =K373*6+L373 -> 72 | O373: 19 | P373: 15 | Q373: =O373*6+P373 -> 129 | S373: TOORAK PARK
A374: PRAHRAN | C374: 1 | D374: 3 | E374: =C374*6+D374 -> 9 | G374: 5 | H374: 3 | I374: =G374*6+H374 -> 33 | K374: 7 | L374: 6 | M374: =K374*6+L374 -> 48 | O374: 9 | P374: 6 | Q374: =O374*6+P374 -> 60 | S374: MURRAY
A375: BEST PLAYERS
A376: YARRAVILLE | C376: BAKER | F376: WARDEN | I376: J BUCKLEY | L376: EVANS | O376: SIMPSON | R376: WUNHYM
A377: PRAHRAN | C377: THOMPSON | F377: MASON | I377: F SMITH | L377: NECK | O377: WHITE | R377: KOOP
A378: GOALKICKERS
A379: YARRAVILLE | C379: J BUCKLEY 5 | F379: SIMPSON 4 | I379: CAMERON 3 | L379: EVANS 3 | N379: WARDEN 3 | Q379: MITCHELL
A380: PRAHRAN | C380: HAWKINS 2 | F380: WHITE 2 | I380: BRENCHLEY | L380: JORDAN | N380: KENNY | P380: BANKS | R380: HYDE
A382: CAMBERWELL | C382: 6 | D382: 3 | E382: =C382*6+D382 -> 39 | G382: 8 | H382: 7 | I382: =G382*6+H382 -> 55 | K382: 9 | L382: 11 | M382: =K382*6+L382 -> 65 | O382: 15 | P382: 16 | Q382: =O382*6+P382 -> 106 | S382: BRUNSWICK
A383: BRUNSWICK | C383: 4 | D383: 1 | E383: =C383*6+D383 -> 25 | G383: 7 | H383: 4 | I383: =G383*6+H383 -> 46 | K383: 9 | L383: 6 | M383: =K383*6+L383 -> 60 | O383: 11 | P383: 9 | Q383: =O383*6+P383 -> 75 | S383: SCHAEFER
A384: BEST PLAYERS
A385: CAMBERWELL | C385: LUFF | E385: DYBALL | H385: WALLACE | K385: HENDERSON | N385: LAWN | Q385: LASKY
A386: BRUNSWICK | C386: JONES | E386: PRISMAL | H386: DOWLING | K386: BLACKMORE | N386: BRIGHT | Q386: MUTIMER
A387: GOALKICKERS
A388: CAMBERWELL | C388: LUFF 8 | E388: LASKY 3 | H388: MASON 2 | K388: MIDDLETON | N388: LAWN
A389: BRUNSWICK | C389: JONES 5 | E389: MUTIMER 2 | H389: FITZGERALD 2 | K389: GILLON | N389: McNEAL
A391: PRESTON | C391: 3 | D391: 3 | E391: =C391*6+D391 -> 21 | G391: 6 | H391: 9 | I391: =G391*6+H391 -> 45 | K391: 7 | L391: 14 | M391: =K391*6+L391 -> 56 | O391: 14 | P391: 21 | Q391: =O391*6+P391 -> 105 | S391: PRESTON
A392: OAKLEIGH | C392: 0 | D392: 6 | E392: =C392*6+D392 -> 6 | G392: 2 | H392: 7 | I392: =G392*6+H392 -> 19 | K392: 3 | L392: 10 | M392: =K392*6+L392 -> 28 | O392: 6 | P392: 12 | Q392: =O392*6+P392 -> 48 | S392: McKINNON
A393: BEST PLAYERS
A394: PRESTON | C394: CAMERON | F394: McEACHARN | I394: WARR | L394: BIRD | O394: DAVIE | R394: WALSH
A395: OAKLEIGH | C395: WITHERS | F395: FLEMING | I395: FRASER | L395: DEAN | O395: WATERS | R395: McALLISTER
A396: GOALKICKERS
A397: PRESTON | C397: WALSH 5 | F397: BIRD 3 | I397: WARR 2 | L397: DAVIE 2 | O397: SEEBECK 2
A398: OAKLEIGH | C398: FLEMING 2 | F398: DENNING 2 | I398: WITHERS | L398: DEAN
A400: ROUND 8 | E400: 3RD JUNE | J400: WEATHER | M400: COLD SHOWERS S.W. WIND | S400: PLAYED AT
D401: 1ST QTR | H401: 2ND QTR | L401: 3RD QTR | P401: FINAL | S401: NORTHCOTE
A402: NORTHCOTE | C402: 5 | D402: 2 | E402: =C402*6+D402 -> 32 | G402: 8 | H402: 7 | I402: =G402*6+H402 -> 55 | K402: 8 | L402: 14 | M402: =K402*6+L402 -> 62 | O402: 11 | P402: 16 | Q402: =O402*6+P402 -> 82 | S402: UMPIRE | X402: LADDER | AB402: ROUND | AD402: 8
A403: SANDRINGHAM | C403: 4 | D403: 4 | E403: =C403*6+D403 -> 28 | G403: 7 | H403: 4 | I403: =G403*6+H403 -> 46 | K403: 8 | L403: 8 | M403: =K403*6+L403 -> 56 | O403: 12 | P403: 10 | Q403: =O403*6+P403 -> 82 | S403: SCATES
A404: BEST PLAYERS | W404: TEAM | X404: W | Y404: L | Z404: D | AA404: FOR | AB404: AGST | AC404: % | AD404: PTS
A405: NORTHCOTE | C405: POWELL | E405: WOODS | H405: GARRETT | K405: HART | N405: SMITH | Q405: ROSS
A406: SANDRINGHAM | C406: LUNN | E406: BECKTON | H406: KEMP | K406: TOLSON | N406: L JOHNSON | Q406: RAYMENT | W406: YARRAVILLE | X406: 7 | Y406: 1 | Z406: 0 | AA406: 737 | AB406: 550 | AC406: 134 | AD406: 28
A407: GOALKICKERS | W407: PORT MELBOURNE | X407: 6 | Y407: 1 | Z407: 1 | AA407: 800 | AB407: 604 | AC407: 132.4503311258278 | AD407: 26
A408: NORTHCOTE | C408: GOULLET 4 | F408: ROSS 2 | H408: SIMMONDS | J408: SMITH | L408: GRAY | N408: ROWE | P408: R JOHNSON | R408: THOMPSON | W408: CAMBERWELL | X408: 6 | Y408: 2 | Z408: 0 | AA408: 805 | AB408: 624 | AC408: 129.00641025641025 | AD408: 24
A409: SANDRINGHAM | C409: RAYMENT 3 | F409: L JOHNSON 3 | I409: H JOHNSON 2 | L409: CAHIR 2 | N409: FITZGERALD | Q409: YEMM | S409: SMAIL | W409: SANDRINGHAM | X409: 5 | Y409: 2 | Z409: 1 | AA409: 754 | AB409: 667 | AC409: 113.04347826086956 | AD409: 22
A411: PRESTON | C411: 6 | D411: 4 | E411: =C411*6+D411 -> 40 | G411: 6 | H411: 5 | I411: =G411*6+H411 -> 41 | K411: 9 | L411: 7 | M411: =K411*6+L411 -> 61 | O411: 14 | P411: 11 | Q411: =O411*6+P411 -> 95 | S411: TOORAK PARK | W411: NORTHCOTE | X411: 4 | Y411: 2 | Z411: 2 | AA411: 727 | AB411: 694 | AC411: 104.75504322766571 | AD411: 20
A412: PRAHRAN | C412: 2 | D412: 4 | E412: =C412*6+D412 -> 16 | G412: 6 | H412: 8 | I412: =G412*6+H412 -> 44 | K412: 6 | L412: 11 | M412: =K412*6+L412 -> 47 | O412: 7 | P412: 14 | Q412: =O412*6+P412 -> 56 | S412: NOWLAN | W412: PRESTON | X412: 4 | Y412: 3 | Z412: 1 | AA412: 768 | AB412: 652 | AC412: 117.79141104294479 | AD412: 18
A413: BEST PLAYERS | W413: COBURG | X413: 3 | Y413: 4 | Z413: 1 | AA413: 631 | AB413: 644 | AC413: 97.981366459627324 | AD413: 14
A414: PRESTON | C414: P SPARGO | F414: DOYLE | I414: CAMERON | L414: DAVIE | O414: McSWAIN | Q414: BREWIS | W414: BRIGHTON | X414: 3 | Y414: 5 | Z414: 0 | AA414: 704 | AB414: 868 | AC414: 81.105990783410135 | AD414: 12
A415: PRAHRAN | C415: NECK | F415: KOOP | I415: BRENCHLEY | L415: THOMPSON | O415: WIGNELL | Q415: WHITE | W415: OAKLEIGH | X415: 3 | Y415: 5 | Z415: 0 | AA415: 621 | AB415: 798 | AC415: 77.819548872180448 | AD415: 12
A416: GOALKICKERS | W416: WILLIAMSTOWN | X416: 2 | Y416: 6 | Z416: 0 | AA416: 644 | AB416: 709 | AC416: 90.832157968970378 | AD416: 8
A417: PRESTON | C417: WALSH 4 | E417: ROBINSON 3 | H417: DAVIE 2 | J417: HARDING | L417: DINEEN | N417: CAMERON | P417: DOYLE | R417: SEEBECK | W417: PRAHRAN | X417: 2 | Y417: 6 | Z417: 0 | AA417: 691 | AB417: 809 | AC417: 85.414091470951789 | AD417: 8
A418: PRAHRAN | C418: BRENCHLEY 3 | F418: HAWKINS | I418: JORDAN | L418: KENNY | N418: BINSTEAD | W418: BRUNSWICK | X418: 0 | Y418: 8 | Z418: 0 | AA418: 546 | AB418: 809 | AC418: 67.490729295426448 | AD418: 0
A420: YARRAVILLE | C420: 1 | D420: 4 | E420: =C420*6+D420 -> 10 | G420: 5 | H420: 9 | I420: =G420*6+H420 -> 39 | K420: 7 | L420: 9 | M420: =K420*6+L420 -> 51 | O420: 11 | P420: 10 | Q420: =O420*6+P420 -> 76 | S420: COBURG
A421: COBURG | C421: 4 | D421: 2 | E421: =C421*6+D421 -> 26 | G421: 4 | H421: 3 | I421: =G421*6+H421 -> 27 | K421: 5 | L421: 8 | M421: =K421*6+L421 -> 38 | O421: 7 | P421: 13 | Q421: =O421*6+P421 -> 55 | S421: GLOVER
A422: BEST PLAYERS
A423: YARRAVILLE | C423: CAMERON | F423: BAKER | I423: PENNY | L423: EVANS | O423: SHEEHAN | R423: McGRATH
A424: COBURG | C424: KIGHT | F424: WILLOX | I424: MEARS | L424: McGRATH | O424: STOCKDALE | R424: UHE
A425: GOALKICKERS
A426: YARRAVILLE | C426: CAMERON 4 | F426: SHEEHAN 3 | I426: McGRATH 2 | L426: EVANS | N426: J BUCKLEY
A427: COBURG | C427: BROOM 2 | F427: KIGHT 2 | I427: MEARS | K427: VOIGHT | M427: HARRIS
A429: WILLIAMSTOWN | C429: 3 | D429: 3 | E429: =C429*6+D429 -> 21 | G429: 6 | H429: 7 | I429: =G429*6+H429 -> 43 | K429: 9 | L429: 12 | M429: =K429*6+L429 -> 66 | O429: 13 | P429: 15 | Q429: =O429*6+P429 -> 93 | S429: WILLIAMSTOWN
A430: BRUNSWICK | C430: 4 | D430: 4 | E430: =C430*6+D430 -> 28 | G430: 5 | H430: 6 | I430: =G430*6+H430 -> 36 | K430: 6 | L430: 10 | M430: =K430*6+L430 -> 46 | O430: 6 | P430: 12 | Q430: =O430*6+P430 -> 48 | S430: MURRAY
A431: BEST PLAYERS
A432: WILLIAMSTOWN | C432: SCOTT | F432: BROOKS | I432: SYKES | L432: BLAKE | O432: ADDISON | R432: SHADE
A433: BRUNSWICK | C433: BLACKMORE | F433: WOODS | I433: JONES | L433: DOWLING | O433: PENMAN | R433: MORGAN
A434: GOALKICKERS
A435: WILLIAMSTOWN | C435: SCOTT 6 | F435: ADDISON 4 | I435: STANBRIDGE 2 | M435: WARD
A436: BRUNSWICK | C436: JONES 2 | F436: MUTIMER | I436: McNEAL | L436: MORGAN | O436: BIRD
E437: 5TH JUNE | J437: WEATHER | M437: FINE MILD NORTH BREEZE
A438: BRIGHTON | C438: 5 | D438: 5 | E438: =C438*6+D438 -> 35 | G438: 8 | H438: 8 | I438: =G438*6+H438 -> 56 | K438: 11 | L438: 14 | M438: =K438*6+L438 -> 80 | O438: 17 | P438: 18 | Q438: =O438*6+P438 -> 120 | S438: OAKLEIGH
A439: OAKLEIGH | C439: 1 | D439: 7 | E439: =C439*6+D439 -> 13 | G439: 2 | H439: 11 | I439: =G439*6+H439 -> 23 | K439: 2 | L439: 21 | M439: =K439*6+L439 -> 33 | O439: 4 | P439: 24 | Q439: =O439*6+P439 -> 48 | S439: BRANDON
A440: BEST PLAYERS
A441: BRIGHTON | C441: JOHNSTONE | F441: DEEGAN | J441: LILBURNE | M441: HILL | P441: POULTER | S441: TUCKER
A442: OAKLEIGH | C442: BAKER | F442: HUTCHISON | J442: MUDGE | M442: BELL | P442: CRAMERI | S442: McALLISTER
A443: GOALKICKERS
A444: BRIGHTON | C444: POULTER 4 | F444: LILBURNE 3 | I444: PENNY 3 | K444: DEAN 3 | M444: TUCKER 2 | P444: BURNES | R444: HUNT
A445: OAKLEIGH | C445: DEAN 2 | F445: DENNING | I445: BAKER
A447: PORT MELBOURNE | C447: 1 | D447: 3 | E447: =C447*6+D447 -> 9 | G447: 6 | H447: 12 | I447: =G447*6+H447 -> 48 | K447: 8 | L447: 15 | M447: =K447*6+L447 -> 63 | O447: 13 | P447: 19 | Q447: =O447*6+P447 -> 97 | S447: CAMBERWELL
A448: CAMBERWELL | C448: 5 | D448: 3 | E448: =C448*6+D448 -> 33 | G448: 6 | H448: 5 | I448: =G448*6+H448 -> 41 | K448: 12 | L448: 5 | M448: =K448*6+L448 -> 77 | O448: 13 | P448: 7 | Q448: =O448*6+P448 -> 85 | S448: STUART
A449: BEST PLAYERS
A450: PORT MELBOURNE | C450: REES | F450: BOQUEST | J450: BARNES | M450: L KEATING | P450: TUITE | S450: LOVETT
A451: CAMBERWELL | C451: WALLACE | F451: FINLAYSON | J451: CLAMP | M451: ELLIOTT | P451: DYBALL | S451: H JONES
A452: GOALKICKERS
A453: PORT MELBOURNE | C453: KEATING 4 | F453: PERRETT 2 | I453: BEDFORD 2 | L453: ALDRIDGE 2 | O453: BROOKER | Q453: BARNES | S453: LAHIFF
A454: CAMBERWELL | C454: LUFF 6 | E454: TROTTER 2 | H454: LAWN 2 | J454: LASKY | L454: W COFFIN | O454: JONES
A456: ROUND 9 | E456: 10TH JUNE | J456: WEATHER | M456: FINE GROUNDS HOLDING | S456: PLAYED AT
D457: 1ST QTR | H457: 2ND QTR | L457: 3RD QTR | P457: FINAL | S457: PORT MELBOURNE
A458: COBURG | C458: 4 | D458: 9 | E458: =C458*6+D458 -> 33 | G458: 10 | H458: 12 | I458: =G458*6+H458 -> 72 | K458: 15 | L458: 17 | M458: =K458*6+L458 -> 107 | O458: 18 | P458: 19 | Q458: =O458*6+P458 -> 127 | S458: UMPIRE | X458: LADDER | AB458: ROUND | AD458: 9
A459: PORT MELBOURNE | C459: 0 | D459: 4 | E459: =C459*6+D459 -> 4 | G459: 3 | H459: 7 | I459: =G459*6+H459 -> 25 | K459: 6 | L459: 8 | M459: =K459*6+L459 -> 44 | O459: 9 | P459: 20 | Q459: =O459*6+P459 -> 74 | S459: GREGORY
A460: BEST PLAYERS | W460: TEAM | X460: W | Y460: L | Z460: D | AA460: FOR | AB460: AGST | AC460: % | AD460: PTS
A461: COBURG | C461: STOCKDALE | F461: RUDOLPH | I461: LOWE | L461: KIGHT | N461: WILLOX | Q461: MEARS
A462: PORT MELBOURNE | C462: GARBUTT | F462: LEGGO | I462: BEDFORD | L462: GARLEPP | N462: L KEATING | Q462: BOQUEST | W462: YARRAVILLE | X462: 8 | Y462: 1 | Z462: 0 | AA462: 847 | AB462: 627 | AC462: 135.08771929824562 | AD462: 32
A463: GOALKICKERS | W463: SANDRINGHAM | X463: 6 | Y463: 2 | Z463: 1 | AA463: 947 | AB463: 758 | AC463: 124.93403693931398 | AD463: 26
A464: COBURG | C464: MEARS 6 | F464: DUNCAN 6 | I464: BROOM 3 | L464: KIGHT 2 | N464: STOCKDALE | W464: PORT MELBOURNE | X464: 6 | Y464: 2 | Z464: 1 | AA464: 874 | AB464: 731 | AC464: 119.56224350205198 | AD464: 26
A465: PORT MELBOURNE | C465: KEATING 2 | F465: BEDFORD 2 | I465: ALDRIDGE 2 | L465: GARLEPP | N465: GARBUTT | Q465: PLUMRIDGE | W465: CAMBERWELL | X465: 6 | Y465: 3 | Z465: 0 | AA465: 882 | AB465: 734 | AC465: 120.16348773841962 | AD465: 24
A467: BRIGHTON | C467: 2 | D467: 4 | E467: =C467*6+D467 -> 16 | G467: 6 | H467: 6 | I467: =G467*6+H467 -> 42 | K467: 11 | L467: 14 | M467: =K467*6+L467 -> 80 | O467: 12 | P467: 14 | Q467: =O467*6+P467 -> 86 | S467: BRUNSWICK | W467: NORTHCOTE | X467: 5 | Y467: 2 | Z467: 2 | AA467: 856 | AB467: 748 | AC467: 114.43850267379679 | AD467: 24
A468: BRUNSWICK | C468: 3 | D468: 2 | E468: =C468*6+D468 -> 20 | G468: 4 | H468: 7 | I468: =G468*6+H468 -> 31 | K468: 6 | L468: 7 | M468: =K468*6+L468 -> 43 | O468: 9 | P468: 14 | Q468: =O468*6+P468 -> 68 | S468: HUNTINGTON | W468: PRESTON | X468: 5 | Y468: 3 | Z468: 1 | AA468: 858 | AB468: 740 | AC468: 115.94594594594595 | AD468: 22
A469: BEST PLAYERS | W469: COBURG | X469: 4 | Y469: 4 | Z469: 1 | AA469: 758 | AB469: 718 | AC469: 105.57103064066852 | AD469: 18
A470: BRIGHTON | C470: STEWART | F470: POULTER | I470: HARRISON | L470: J O'BRIEN | N470: TUCKER | Q470: DEEGAN | W470: BRIGHTON | X470: 4 | Y470: 5 | Z470: 0 | AA470: 790 | AB470: 936 | AC470: 84.401709401709397 | AD470: 16
A471: BRUNSWICK | C471: ARRELL | F471: DOWLING | I471: PRISMAL | L471: WOODS | N471: BLACKMORE | Q471: JONES | W471: OAKLEIGH | X471: 3 | Y471: 6 | Z471: 0 | AA471: 712 | AB471: 991 | AC471: 71.846619576185674 | AD471: 12
A472: GOALKICKERS | W472: WILLIAMSTOWN | X472: 2 | Y472: 7 | Z472: 0 | AA472: 732 | AB472: 799 | AC472: 91.614518147684606 | AD472: 8
A473: BRIGHTON | C473: POULTER 5 | F473: TUCKER 2 | I473: HILL | K473: DEAN | M473: O'BRIEN | O473: BURNES | Q473: HUNT | W473: PRAHRAN | X473: 2 | Y473: 7 | Z473: 0 | AA473: 745 | AB473: 938 | AC473: 79.424307036247342 | AD473: 8
A474: BRUNSWICK | C474: JONES 4 | F474: GILLON | H474: WOODS | J474: BLACKMORE | M474: PENMAN | O474: BENTLEY | W474: BRUNSWICK | X474: 0 | Y474: 9 | Z474: 0 | AA474: 614 | AB474: 895 | AC474: 68.603351955307261 | AD474: 0
A476: SANDRINGHAM | C476: 4 | D476: 5 | E476: =C476*6+D476 -> 29 | G476: 12 | H476: 9 | I476: =G476*6+H476 -> 81 | K476: 20 | L476: 14 | M476: =K476*6+L476 -> 134 | O476: 29 | P476: 19 | Q476: =O476*6+P476 -> 193 | S476: BEACH ROAD
A477: OAKLEIGH | C477: 5 | D477: 4 | E477: =C477*6+D477 -> 34 | G477: 10 | H477: 6 | I477: =G477*6+H477 -> 66 | K477: 10 | L477: 10 | M477: =K477*6+L477 -> 70 | O477: 13 | P477: 13 | Q477: =O477*6+P477 -> 91 | S477: MURRAY
A478: BEST PLAYERS
A479: SANDRINGHAM | C479: CAHIR | F479: THOMS | I479: McCOMB | L479: KEMP | O479: RAYMENT | R479: YOUNG
A480: OAKLEIGH | C480: McALLISTER | F480: WITHERS | I480: DENNING | L480: BELL | O480: CRAMERI | R480: FRASER
A481: GOALKICKERS
A482: SANDRINGHAM | C482: CAHIR 9 | E482: RAYMENT 8 | H482: DE LUCA 3 | J482: JAMIESON 3 | M482: H JOHNSON 2 | P482: L JOHNSON 2 | S482: SMAIL | U482: RALPH
A483: OAKLEIGH | C483: DENNING 4 | F483: FRASER 3 | I483: DEAN 2 | K483: CRAMERI | M483: FLEMING | O483: GOULD | Q483: MUDGE
A485: PRESTON | C485: 3 | D485: 2 | E485: =C485*6+D485 -> 20 | G485: 8 | H485: 5 | I485: =G485*6+H485 -> 53 | K485: 10 | L485: 5 | M485: =K485*6+L485 -> 65 | O485: 14 | P485: 6 | Q485: =O485*6+P485 -> 90 | S485: WILLIAMSTOWN
A486: WILLIAMSTOWN | C486: 4 | D486: 6 | E486: =C486*6+D486 -> 30 | G486: 7 | H486: 8 | I486: =G486*6+H486 -> 50 | K486: 10 | L486: 18 | M486: =K486*6+L486 -> 78 | O486: 11 | P486: 22 | Q486: =O486*6+P486 -> 88 | S486: GLOVER
A487: BEST PLAYERS
A488: PRESTON | C488: DAVIE | E488: BIRD | H488: DINEEN | K488: ROBINSON | N488: P SPARGO | Q488: HEARN
A489: WILLIAMSTOWN | C489: JAENSCH | E489: STANBRIDGE | H489: TAYLOR | K489: BLAKE | N489: ADDISON | Q489: McCABE
A490: GOALKICKERS
A491: PRESTON | C491: WALSH 3 | E491: DAVIE 3 | G491: HEARN 3 | I491: DINEEN | K491: CAMERON | M491: McSWAIN | O491: BIRD | Q491: PITTS
A492: WILLIAMSTOWN | C492: SCOTT 3 | E492: JAENSCH 2 | H492: McCABE 2 | K492: JOHNS 2 | M492: ADDISON | O492: BARNES
A494: NORTHCOTE | C494: 4 | D494: 3 | E494: =C494*6+D494 -> 27 | G494: 7 | H494: 8 | I494: =G494*6+H494 -> 50 | K494: 13 | L494: 16 | M494: =K494*6+L494 -> 94 | O494: 18 | P494: 21 | Q494: =O494*6+P494 -> 129 | S494: NORTHCOTE
A495: PRAHRAN | C495: 1 | D495: 5 | E495: =C495*6+D495 -> 11 | G495: 2 | H495: 7 | I495: =G495*6+H495 -> 19 | K495: 4 | L495: 9 | M495: =K495*6+L495 -> 33 | O495: 7 | P495: 12 | Q495: =O495*6+P495 -> 54 | S495: STUART
A496: BEST PLAYERS
A497: NORTHCOTE | C497: BRAY | E497: FLINN | H497: HUMPHRIES | K497: HART | N497: GRAY | Q497: SMITH
A498: PRAHRAN | C498: HYDE | E498: NECK | H498: MASON | K498: KOOP | N498: HAWKINS | Q498: KENNY
A499: GOALKICKERS
A500: NORTHCOTE | C500: SMITH 4 | E500: BRAY 4 | G500: HUMPHRIES 3 | J500: SIMMONDS | M500: ROSS | N500: HONIG | P500: COLE | R500: GOULLET | U500: R JOHNSON | X500: FLINN
A501: PRAHRAN | C501: HAWKINS 2 | F501: KENNY 2 | I501: WHITE | K501: THOMPSON | N501: GIBB
A503: YARRAVILLE | C503: 3 | D503: 6 | E503: =C503*6+D503 -> 24 | G503: 7 | H503: 8 | I503: =G503*6+H503 -> 50 | K503: 14 | L503: 12 | M503: =K503*6+L503 -> 96 | O503: 16 | P503: 14 | Q503: =O503*6+P503 -> 110 | S503: NORTHCOTE
A504: CAMBERWELL | C504: 2 | D504: 1 | E504: =C504*6+D504 -> 13 | G504: 4 | H504: 3 | I504: =G504*6+H504 -> 27 | K504: 8 | L504: 3 | M504: =K504*6+L504 -> 51 | O504: 12 | P504: 5 | Q504: =O504*6+P504 -> 77 | S504: NOWLAN
A505: BEST PLAYERS
A506: YARRAVILLE | C506: WUNHYM | F506: EVANS | I506: COOK | L506: J BUCKLEY | O506: SIMPSON | R506: CAMERON
A507: CAMBERWELL | C507: WALLACE | F507: L WILLIAMS | I507: CLAMP | L507: O'NEILL | O507: WARTMAN | R507: TROTTER
A508: GOALKICKERS
A509: YARRAVILLE | C509: J BUCKLEY 6 | F509: QUIGG 2 | H509: EVANS 2 | J509: WARDEN 2 | M509: SIMPSON 2 | P509: McGRATH | S509: CAMERON
A510: CAMBERWELL | C510: LUFF 3 | E510: TROTTER 3 | H510: LAWN 2 | J510: ANDREW 2 | M510: HENDERSON | P510: WEIST
A512: ROUND 10 | E512: 17TH JUNE | J512: WEATHER | M512: COLD CLOUDY BUT FINE | S512: PLAYED AT
D513: 1ST QTR | H513: 2ND QTR | L513: 3RD QTR | P513: FINAL | S513: TOORAK PARK
A514: WILLIAMSTOWN | C514: 3 | D514: 2 | E514: =C514*6+D514 -> 20 | G514: 6 | H514: 7 | I514: =G514*6+H514 -> 43 | K514: 9 | L514: 10 | M514: =K514*6+L514 -> 64 | O514: 12 | P514: 18 | Q514: =O514*6+P514 -> 90 | S514: UMPIRE | X514: LADDER | AB514: ROUND | AD514: 10
A515: PRAHRAN | C515: 3 | D515: 6 | E515: =C515*6+D515 -> 24 | G515: 5 | H515: 11 | I515: =G515*6+H515 -> 41 | K515: 9 | L515: 12 | M515: =K515*6+L515 -> 66 | O515: 12 | P515: 15 | Q515: =O515*6+P515 -> 87 | S515: NOWLAN
A516: BEST PLAYERS | W516: TEAM | X516: W | Y516: L | Z516: D | AA516: FOR | AB516: AGST | AC516: % | AD516: PTS
A517: WILLIAMSTOWN | C517: SYKES | E517: ADDISON | H517: McCABE | K517: BARNES | N517: SCOTT | Q517: SHADE
A518: PRAHRAN | C518: HYDE | E518: THOMPSON | H518: F SMITH | K518: KOOP | N518: C WILLIAMS | Q518: WIGNELL | W518: YARRAVILLE | X518: 9 | Y518: 1 | Z518: 0 | AA518: 952 | AB518: 680 | AC518: 140 | AD518: 36
A519: GOALKICKERS | W519: PORT MELBOURNE | X519: 7 | Y519: 2 | Z519: 1 | AA519: 983 | AB519: 820 | AC519: 119.8780487804878 | AD519: 30
A520: WILLIAMSTOWN | C520: BARNES 4 | F520: SCOTT 3 | I520: BLAKE 2 | K520: ADDISON | M520: C DREW | O520: McCABE | W520: NORTHCOTE | X520: 6 | Y520: 2 | Z520: 2 | AA520: 966 | AB520: 839 | AC520: 115.13706793802146 | AD520: 28
A521: PRAHRAN | C521: THOMPSON 5 | F521: BRENCHLEY 3 | I521: WELLS 2 | K521: WHITE | M521: KENNA | W521: SANDRINGHAM | X521: 6 | Y521: 3 | Z521: 1 | AA521: 1010 | AB521: 828 | AC521: 121.98067632850241 | AD521: 26
A523: NORTHCOTE | C523: 2 | D523: 3 | E523: =C523*6+D523 -> 15 | G523: 5 | H523: 11 | I523: =G523*6+H523 -> 41 | K523: 9 | L523: 15 | M523: =K523*6+L523 -> 69 | O523: 15 | P523: 20 | Q523: =O523*6+P523 -> 110 | S523: OAKLEIGH | W523: PRESTON | X523: 6 | Y523: 3 | Z523: 1 | AA523: 928 | AB523: 803 | AC523: 115.56662515566624 | AD523: 26
A524: OAKLEIGH | C524: 5 | D524: 4 | E524: =C524*6+D524 -> 34 | G524: 8 | H524: 7 | I524: =G524*6+H524 -> 55 | K524: 11 | L524: 10 | M524: =K524*6+L524 -> 76 | O524: 13 | P524: 13 | Q524: =O524*6+P524 -> 91 | S524: BRANDON | W524: CAMBERWELL | X524: 6 | Y524: 4 | Z524: 0 | AA524: 970 | AB524: 837 | AC524: 115.89008363201911 | AD524: 24
A525: BEST PLAYERS | W525: COBURG | X525: 5 | Y525: 4 | Z525: 1 | AA525: 861 | AB525: 806 | AC525: 106.82382133995037 | AD525: 22
A526: NORTHCOTE | C526: SMITH | F526: LYNGCOLN | I526: WILSON | L526: BRAY | O526: GOULLET | Q526: GARRETT | W526: BRIGHTON | X526: 4 | Y526: 6 | Z526: 0 | AA526: 879 | AB526: 1045 | AC526: 84.114832535885171 | AD526: 16
A527: OAKLEIGH | C527: McALLISTER | F527: DENNING | I527: BELL | L527: POWELL | O527: DEAN | Q527: CRAMERI | W527: WILLIAMSTOWN | X527: 3 | Y527: 7 | Z527: 0 | AA527: 822 | AB527: 886 | AC527: 92.776523702031596 | AD527: 12
A528: GOALKICKERS | W528: OAKLEIGH | X528: 3 | Y528: 7 | Z528: 0 | AA528: 803 | AB528: 1101 | AC528: 72.933696639418713 | AD528: 12
A529: NORTHCOTE | C529: SMITH 6 | E529: COLE 2 | G529: HUMPHRIES 2 | J529: FLINN 2 | L529: SIMMONDS | O529: LYNGCOLN | Q529: STAPLETON | W529: PRAHRAN | X529: 2 | Y529: 8 | Z529: 0 | AA529: 832 | AB529: 1028 | AC529: 80.933852140077818 | AD529: 8
A530: OAKLEIGH | C530: FRASER 5 | F530: DENNING 4 | I530: DEAN 2 | K530: CRAMERI | M530: BRACHER | W530: BRUNSWICK | X530: 0 | Y530: 10 | Z530: 0 | AA530: 667 | AB530: 1000 | AC530: 66.7 | AD530: 0
A532: PRESTON | C532: 0 | D532: 5 | E532: =C532*6+D532 -> 5 | G532: 2 | H532: 11 | I532: =G532*6+H532 -> 23 | K532: 6 | L532: 14 | M532: =K532*6+L532 -> 50 | O532: 8 | P532: 22 | Q532: =O532*6+P532 -> 70 | S532: BEACH ROAD
A533: SANDRINGHAM | C533: 2 | D533: 4 | E533: =C533*6+D533 -> 16 | G533: 4 | H533: 6 | I533: =G533*6+H533 -> 30 | K533: 6 | L533: 9 | M533: =K533*6+L533 -> 45 | O533: 8 | P533: 15 | Q533: =O533*6+P533 -> 63 | S533: MURRAY
A534: BEST PLAYERS
A535: PRESTON | C535: McSWAIN | F535: P SPARGO | I535: McEACHARN | L535: DAVIE | O535: DINEEN | R535: ROBINSON
A536: SANDRINGHAM | C536: McCOMB | F536: RAYMENT | I536: TOLSON | L536: LUNN | O536: YOUNG | R536: YEMM
A537: GOALKICKERS
A538: PRESTON | C538: WALSH 4 | F538: HARDING 2 | I538: ROBINSON | L538: McEACHERN
A539: SANDRINGHAM | C539: DE LUCA 2 | F539: R BAXTER 2 | I539: L JOHNSTONE 2 | L539: SMAIL | N539: JAMIESON
A541: PORT MELBOURNE | C541: 3 | D541: 4 | E541: =C541*6+D541 -> 22 | G541: 9 | H541: 6 | I541: =G541*6+H541 -> 60 | K541: 11 | L541: 9 | M541: =K541*6+L541 -> 75 | O541: 16 | P541: 13 | Q541: =O541*6+P541 -> 109 | S541: ELSTERNWICK PARK
A542: BRIGHTON | C542: 3 | D542: 2 | E542: =C542*6+D542 -> 20 | G542: 8 | H542: 7 | I542: =G542*6+H542 -> 55 | K542: 9 | L542: 13 | M542: =K542*6+L542 -> 67 | O542: 12 | P542: 17 | Q542: =O542*6+P542 -> 89 | S542: HUNTINGTON
A543: BEST PLAYERS
A544: PORT MELBOURNE | C544: ALDRIDGE | F544: L KEATING | I544: PERRETT | L544: GARLEPP | O544: JULIER | Q544: GARBUTT
A545: BRIGHTON | C545: POULTER | F545: HARRISON | I545: JOHNSTONE | L545: J O'BRIEN | O545: HUNT | Q545: GOULDSWORTHY
A546: GOALKICKERS
A547: PORT MELBOURNE | C547: ALDRIDGE 5 | F547: KEATING 3 | I547: MALTBY 3 | L547: RUSDEN 2 | O547: HURLEY | Q547: PERRETT | S547: GARLEPP
A548: BRIGHTON | C548: POULTER 4 | F548: PENNY 3 | I548: LILBURNE 3 | L548: HILL | O548: HARRISON
A550: COBURG | C550: 3 | D550: 4 | E550: =C550*6+D550 -> 22 | G550: 7 | H550: 8 | I550: =G550*6+H550 -> 50 | K550: 12 | L550: 9 | M550: =K550*6+L550 -> 81 | O550: 14 | P550: 19 | Q550: =O550*6+P550 -> 103 | S550: CAMBERWELL
A551: CAMBERWELL | C551: 2 | D551: 1 | E551: =C551*6+D551 -> 13 | G551: 6 | H551: 3 | I551: =G551*6+H551 -> 39 | K551: 10 | L551: 8 | M551: =K551*6+L551 -> 68 | O551: 13 | P551: 10 | Q551: =O551*6+P551 -> 88 | S551: McKINNON
A552: BEST PLAYERS
A553: COBURG | C553: RUDOLPH | F553: BERTRAM | I553: WILLOX | L553: KIGHT | N553: JENKINS | Q553: STOCKDALE
A554: CAMBERWELL | C554: CLAMP | F554: FINLAYSON | I554: HARVEY | L554: LUFF | N554: DYBALL | Q554: O'NEILL
A555: GOALKICKERS
A556: COBURG | C556: STOCKDALE 5 | F556: DUNCAN 3 | I556: MEARS 2 | L556: BROOM | N556: VOIGHT | P556: ANDERSON | R556: KIGHT
A557: CAMBERWELL | C557: LUFF 5 | E557: FYFE 2 | G557: R WILLIAMS 2 | J557: HARVEY 2 | M557: TROTTER | O557: WEIST
A559: YARRAVILLE | C559: 4 | D559: 3 | E559: =C559*6+D559 -> 27 | G559: 7 | H559: 5 | I559: =G559*6+H559 -> 47 | K559: 14 | L559: 6 | M559: =K559*6+L559 -> 90 | O559: 16 | P559: 9 | Q559: 105 | S559: YARRAVILLE
A560: BRUNSWICK | C560: 2 | D560: 1 | E560: =C560*6+D560 -> 13 | G560: 3 | H560: 4 | I560: =G560*6+H560 -> 22 | K560: 5 | L560: 8 | M560: =K560*6+L560 -> 38 | O560: 7 | P560: 11 | Q560: 53 | S560: STUART
A561: BEST PLAYERS
A562: YARRAVILLE | C562: EVANS | E562: J BUCKLEY | H562: R EDWARDS | K562: WARDEN | N562: BOURKE
A563: BRUNSWICK | C563: DOWLING | E563: THOMPSON | H563: PENMAN | K563: MORGAN | N563: WATTS | Q563: BRIGHT
A564: GOALKICKERS
A565: YARRAVILLE | C565: J BUCKLEY 9 | F565: EVANS 5 | I565: QUIGG | K565: COOK
A566: BRUNSWICK | C566: JONES 2 | E566: RALEIGH 2 | H566: DOWLING | J566: BEARD | L566: GRACE
A568: ROUND 11 | E568: 24TH JUNE | H568: WEATHER | K568: COLD SHOWERS SOUTH WIND GROUNDS HEAVY | S568: PLAYED AT
D569: 1ST QTR | H569: 2ND QTR | L569: 3RD QTR | P569: FINAL | S569: MOTORDROME
A570: NORTHCOTE | C570: 6 | D570: 4 | E570: =C570*6+D570 -> 40 | G570: 10 | H570: 7 | I570: =G570*6+H570 -> 67 | K570: 16 | L570: 13 | M570: =K570*6+L570 -> 109 | O570: 18 | P570: 16 | Q570: =O570*6+P570 -> 124 | S570: UMPIRE | X570: LADDER | AB570: ROUND | AD570: 11
A571: WILLIAMSTOWN | C571: 1 | D571: 0 | E571: =C571*6+D571 -> 6 | G571: 5 | H571: 2 | I571: =G571*6+H571 -> 32 | K571: 7 | L571: 2 | M571: =K571*6+L571 -> 44 | O571: 9 | P571: 3 | Q571: =O571*6+P571 -> 57 | S571: NOWLAN
A572: BEST PLAYERS | W572: TEAM | X572: W | Y572: L | Z572: D | AA572: FOR | AB572: AGST | AC572: % | AD572: PTS
A573: NORTHCOTE | C573: GARRETT | E573: ROSS | H573: BRAY | K573: SEYMOUR | N573: WOODS | Q573: CONNELL
A574: WILLIAMSTOWN | C574: BROOKS | E574: SYKES | H574: BLAKE | K574: BARNES | N574: STANBRIDGE | Q574: C DREW | W574: YARRAVILLE | X574: 9 | Y574: 2 | Z574: 0 | AA574: 1013 | AB574: 759 | AC574: 133.46508563899869 | AD574: 36
A575: GOALKICKERS | W575: NORTHCOTE | X575: 7 | Y575: 2 | Z575: 2 | AA575: 1090 | AB575: 896 | AC575: 121.65178571428571 | AD575: 32
A576: NORTHCOTE | C576: SEYMOUR 9 | F576: GRAY 3 | H576: FLINN 3 | J576: SMITH 2 | M576: CONNELL | W576: SANDRINGHAM | X576: 7 | Y576: 3 | Z576: 1 | AA576: 1164 | AB576: 929 | AC576: 125.29601722282024 | AD576: 30
A577: WILLIAMSTOWN | C577: C DREW 2 | F577: BLAKE | H577: STANBRIDGE | K577: ADDISON | M577: McCABE | O577: JOHNS | Q577: SCOTT | S577: BARNES | W577: PRESTON | X577: 7 | Y577: 3 | Z577: 1 | AA577: 1007 | AB577: 864 | AC577: 116.55092592592592 | AD577: 30
A579: CAMBERWELL | C579: 7 | D579: 4 | E579: =C579*6+D579 -> 46 | G579: 11 | H579: 5 | I579: =G579*6+H579 -> 71 | K579: 18 | L579: 10 | M579: =K579*6+L579 -> 118 | O579: 22 | P579: 10 | Q579: =O579*6+P579 -> 142 | S579: CAMBERWELL | W579: PORT MELBOURNE | X579: 7 | Y579: 3 | Z579: 1 | AA579: 1084 | AB579: 974 | AC579: 111.29363449691992 | AD579: 30
A580: BRIGHTON | C580: 2 | D580: 3 | E580: =C580*6+D580 -> 15 | G580: 6 | H580: 7 | I580: =G580*6+H580 -> 43 | K580: 8 | L580: 12 | M580: =K580*6+L580 -> 60 | O580: 16 | P580: 13 | Q580: =O580*6+P580 -> 109 | S580: MILLER | W580: CAMBERWELL | X580: 7 | Y580: 4 | Z580: 0 | AA580: 1112 | AB580: 946 | AC580: 117.54756871035941 | AD580: 28
A581: BEST PLAYERS | W581: COBURG | X581: 6 | Y581: 4 | Z581: 1 | AA581: 952 | AB581: 895 | AC581: 106.36871508379889 | AD581: 26
A582: CAMBERWELL | C582: CLAMP | E582: LUFF | H582: BOOTHMAN | K582: ANDREW | N582: FINLAYSON | Q582: WALLACE | W582: BRIGHTON | X582: 4 | Y582: 7 | Z582: 0 | AA582: 988 | AB582: 1187 | AC582: 83.235046335299074 | AD582: 16
A583: BRIGHTON | C583: POULTER | E583: DEEGAN | H583: PENNY | K583: JOYNSON | N583: ROSENBROCK | Q583: LILBURNE | W583: WILLIAMSTOWN | X583: 3 | Y583: 8 | Z583: 0 | AA583: 879 | AB583: 1010 | AC583: 87.029702970297024 | AD583: 12
A584: GOALKICKERS | O584: MASON | Q584: FINLAYSON | W584: PRAHRAN | X584: 3 | Y584: 8 | Z584: 0 | AA584: 947 | AB584: 1101 | AC584: 86.012715712988197 | AD584: 12
A585: CAMBERWELL | C585: LUFF 11 | E585: HARVEY 3 | G585: TROTTER | I585: CLAMP | K585: PIERCE | M585: R WILLIAMS | P585: O'NEILL | R585: ANDREW | W585: OAKLEIGH | X585: 3 | Y585: 8 | Z585: 0 | AA585: 892 | AB585: 1192 | AC585: 74.832214765100673 | AD585: 12
A586: BRIGHTON | C586: LILBURNE 4 | F586: POULTER 3 | I586: PENNY 3 | K586: HILL | L586: DEAN | N586: O'BRIEN | P586: BURNES | R586: JOYNSON | W586: BRUNSWICK | X586: 0 | Y586: 11 | Z586: 0 | AA586: 740 | AB586: 1115 | AC586: 66.367713004484301 | AD586: 0
R587: FORBES
A588: SANDRINGHAM | C588: 7 | D588: 3 | E588: =C588*6+D588 -> 45 | G588: 15 | H588: 14 | I588: =G588*6+H588 -> 104 | K588: 16 | L588: 15 | M588: =K588*6+L588 -> 111 | O588: 22 | P588: 22 | Q588: =O588*6+P588 -> 154 | S588: BEACH ROAD
A589: PORT MELBOURNE | C589: 3 | D589: 7 | E589: =C589*6+D589 -> 25 | G589: 4 | H589: 8 | I589: =G589*6+H589 -> 32 | K589: 11 | L589: 17 | M589: =K589*6+L589 -> 83 | O589: 14 | P589: 17 | Q589: =O589*6+P589 -> 101 | S589: LESTER
A590: BEST PLAYERS
A591: SANDRINGHAM | C591: LUNN | F591: BECKTON | I591: JAMIESON | L591: RAYMENT | O591: YEMM | Q591: FITZGERALD
A592: PORT MELBOURNE | C592: L KEATING | F592: DOBSON | I592: PERRETT | L592: BEDFORD | O592: RUSDEN | Q592: HURLEY
A593: GOALKICKERS
A594: SANDRINGHAM | C594: RAYMENT 5 | F594: FITZGERALD 5 | I594: BECKTON 3 | L594: SMAIL 3 | N594: TOLSON 2 | Q594: DE LUCA | S594: McGAIN | U594: JAMIESON | X594: YEMM
A595: PORT MELBOURNE | C595: BARNES 3 | F595: RUSDEN 2 | I595: HURLEY 2 | L595: BEDFORD 2 | N595: ALDRIDGE 2 | Q595: KEATING | S595: GARLEPP | U595: BUCKLEY
A597: COBURG | C597: 5 | D597: 6 | E597: =C597*6+D597 -> 36 | G597: 10 | H597: 9 | I597: =G597*6+H597 -> 69 | K597: 11 | L597: 15 | M597: =K597*6+L597 -> 81 | O597: 12 | P597: 19 | Q597: =O597*6+P597 -> 91 | S597: COBURG
A598: OAKLEIGH | C598: 2 | D598: 3 | E598: =C598*6+D598 -> 15 | G598: 5 | H598: 7 | I598: =G598*6+H598 -> 37 | K598: 10 | L598: 14 | M598: =K598*6+L598 -> 74 | O598: 12 | P598: 17 | Q598: =O598*6+P598 -> 89 | S598: McKINNON
A599: BEST PLAYERS
A600: COBURG | C600: KIGHT | E600: BERTRAM | H600: LOWE | K600: DUNCAN | N600: RUDOLPH | Q600: J L HOGAN
A601: OAKLEIGH | C601: R SMITH | E601: FLEMING | H601: McALLISTER | K601: WITHERS | N601: BELL | Q601: BEASLEY
A602: GOALKICKERS
A603: COBURG | C603: DUNCAN 6 | F603: MEARS 2 | I603: JENKINS | K603: KIGHT | M603: STOCKDALE | P603: J L HOGAN
A604: OAKLEIGH | C604: FRASER 5 | F604: CRAMERI 2 | I604: FLEMING 2 | L604: BAKER 2 | O604: MATHRICK
A606: PRESTON | C606: 1 | D606: 8 | E606: =C606*6+D606 -> 14 | G606: 3 | H606: 12 | I606: =G606*6+H606 -> 30 | K606: 7 | L606: 18 | M606: =K606*6+L606 -> 60 | O606: 10 | P606: 19 | Q606: =O606*6+P606 -> 79 | S606: PRESTON
A607: YARRAVILLE | C607: 0 | D607: 0 | E607: =C607*6+D607 -> 0 | G607: 4 | H607: 4 | I607: =G607*6+H607 -> 28 | K607: 5 | L607: 4 | M607: =K607*6+L607 -> 34 | O607: 9 | P607: 7 | Q607: =O607*6+P607 -> 61 | S607: GREGORY
A608: BEST PLAYERS
A609: PRESTON | C609: CAMERON | F609: DAVIE | I609: F SPARGO | L609: P SPARGO | O609: DINEEN | Q609: WARR
A610: YARRAVILLE | C610: WARDEN | F610: WUNHYM | I610: CAMERON | L610: W BUCKLEY | O610: BOURKE | Q610: R EDWARDS
A611: GOALKICKERS
A612: PRESTON | C612: HEARN 3 | E612: WARR 3 | G612: WALSH | I612: HARDING | L612: DINEEN | O612: CAMERON
A613: YARRAVILLE | C613: EVANS 2 | E613: SHEEHAN | G613: McGRATH | I613: CAMERON | L613: J BUCKLEY | N613: WARDEN | P613: SIMPSON | R613: R EDWARDS
A615: PRAHRAN | C615: 7 | D615: 5 | E615: =C615*6+D615 -> 47 | G615: 10 | H615: 6 | I615: =G615*6+H615 -> 66 | K615: 15 | L615: 9 | M615: =K615*6+L615 -> 99 | O615: 17 | P615: 13 | Q615: =O615*6+P615 -> 115 | S615: BRUNSWICK
A616: BRUNSWICK | C616: 0 | D616: 3 | E616: =C616*6+D616 -> 3 | G616: 5 | H616: 10 | I616: =G616*6+H616 -> 40 | K616: 8 | L616: 11 | M616: =K616*6+L616 -> 59 | O616: 10 | P616: 13 | Q616: =O616*6+P616 -> 73 | S616: BRANDON
A617: BEST PLAYERS
A618: PRAHRAN | C618: HYDE | F618: THOMPSON | I618: HAWKINS | L618: BRENCHLEY | O618: DIXON | R618: WELLS
A619: BRUNSWICK | C619: A THOMPSON | F619: ARRELL | I619: RALEIGH | L619: JONES | O619: EUDEY | R619: DOWLING
A620: GOALKICKERS
A621: PRAHRAN | C621: WELLS 4 | E621: THOMPSON 3 | H621: HAWKINS 2 | K621: BRENCHLEY 2 | N621: WILLIAMSON 2 | R621: WHITE 2 | U621: C WILLIAMS | X621: BINSTEAD
A622: BRUNSWICK | C622: JONES 3 | E622: RALEIGH 3 | H622: DOWLING | K622: BIRD | M622: A THOMPSON | P622: ANDERSON
A624: ROUND 12 | E624: 1ST JULY | J624: WEATHER | M624: FINE NORTH BREEZE | S624: PLAYED AT
D625: 1ST QTR | H625: 2ND QTR | L625: 3RD QTR | P625: FINAL | S625: PRESTON
A626: NORTHCOTE | C626: 7 | D626: 8 | E626: =C626*6+D626 -> 50 | G626: 7 | H626: 13 | I626: =G626*6+H626 -> 55 | K626: 9 | L626: 22 | M626: =K626*6+L626 -> 76 | O626: 10 | P626: 25 | Q626: =O626*6+P626 -> 85 | S626: UMPIRE | X626: LADDER | AB626: ROUND | AD626: 12
A627: PRESTON | C627: 0 | D627: 0 | E627: =C627*6+D627 -> 0 | G627: 2 | H627: 3 | I627: =G627*6+H627 -> 15 | K627: 3 | L627: 4 | M627: =K627*6+L627 -> 22 | O627: 6 | P627: 5 | Q627: =O627*6+P627 -> 41 | S627: NOWLAN
A628: BEST PLAYERS | W628: TEAM | X628: W | Y628: L | Z628: D | AA628: FOR | AB628: AGST | AC628: % | AD628: PTS
A629: NORTHCOTE | C629: POWELL | F629: WOODS | I629: ROSS | K629: ROWE | N629: GOULLET | Q629: COLE
A630: PRESTON | C630: F SPARGO | F630: DOWLING | I630: DAVIE | K630: McSWAIN | N630: ROBINSON | Q630: DOYLE | W630: YARRAVILLE | X630: 9 | Y630: 3 | Z630: 0 | AA630: 1083 | AB630: 835 | AC630: 129.70059880239521 | AD630: 36
A631: GOALKICKERS | W631: NORTHCOTE | X631: 8 | Y631: 2 | Z631: 2 | AA631: 1175 | AB631: 937 | AC631: 125.40021344717182 | AD631: 36
A632: NORTHCOTE | C632: SEYMOUR 2 | F632: ROWE 2 | I632: FLINN 2 | K632: ROSS | M632: COLE | O632: GOULLET | Q632: CONNELL | W632: CAMBERWELL | X632: 8 | Y632: 4 | Z632: 0 | AA632: 1211 | AB632: 1029 | AC632: 117.68707482993197 | AD632: 32
A633: PRESTON | C633: ROBINSON 4 | F633: DOYLE | I633: HEARN | W633: SANDRINGHAM | X633: 7 | Y633: 4 | Z633: 1 | AA633: 1226 | AB633: 1030 | AC633: 119.02912621359224 | AD633: 30
A635: BRIGHTON | C635: 2 | D635: 2 | E635: =C635*6+D635 -> 14 | G635: 7 | H635: 13 | I635: =G635*6+H635 -> 55 | K635: 8 | L635: 16 | M635: =K635*6+L635 -> 64 | O635: 13 | P635: 23 | Q635: =O635*6+P635 -> 101 | S635: ELSTERNWICK PARK | W635: COBURG | X635: 7 | Y635: 4 | Z635: 1 | AA635: 1078 | AB635: 954 | AC635: 112.99790356394129 | AD635: 30
A636: SANDRINGHAM | C636: 4 | D636: 4 | E636: =C636*6+D636 -> 28 | G636: 4 | H636: 6 | I636: =G636*6+H636 -> 30 | K636: 8 | L636: 13 | M636: =K636*6+L636 -> 61 | O636: 8 | P636: 14 | Q636: =O636*6+P636 -> 62 | S636: MILLER | W636: PRESTON | X636: 7 | Y636: 4 | Z636: 1 | AA636: 1048 | AB636: 949 | AC636: 110.43203371970495 | AD636: 30
A637: BEST PLAYERS | W637: PORT MELBOURNE | X637: 7 | Y637: 4 | Z637: 1 | AA637: 1149 | AB637: 1076 | AC637: 106.78438661710037 | AD637: 30
A638: BRIGHTON | C638: TUCKER | E638: HILL | H638: HUNT | K638: JOHNSTONE | N638: MILLER | Q638: STEWART | W638: BRIGHTON | X638: 5 | Y638: 7 | Z638: 0 | AA638: 1089 | AB638: 1249 | AC638: 87.189751801441147 | AD638: 20
A639: SANDRINGHAM | C639: BECKTON | E639: McCOMB | H639: DE LUCA | K639: RAYMENT | N639: TOLSON | Q639: LUNN | W639: PRAHRAN | X639: 4 | Y639: 8 | Z639: 0 | AA639: 1049 | AB639: 1166 | AC639: 89.965694682675817 | AD639: 16
A640: GOALKICKERS | P640: GOLDSWORTHY | W640: WILLIAMSTOWN | X640: 4 | Y640: 8 | Z640: 0 | AA640: 955 | AB640: 1080 | AC640: 88.425925925925924 | AD640: 16
A641: BRIGHTON | C641: DEAN 3 | E641: O'BRIEN 2 | G641: HILL 2 | I641: PENNY | K641: TUCKER | M641: LILBURNE | O641: POULTER | Q641: BURNES | W641: OAKLEIGH | X641: 3 | Y641: 9 | Z641: 0 | AA641: 975 | AB641: 1291 | AC641: 75.522850503485671 | AD641: 12
A642: SANDRINGHAM | C642: DE LUCA 2 | F642: JOHNSON | I642: RAYMENT | K642: FITZGERALD | N642: CAHIR | P642: R BAXTER | R642: SMAIL | W642: BRUNSWICK | X642: 0 | Y642: 12 | Z642: 0 | AA642: 799 | AB642: 1241 | AC642: 64.38356164383562 | AD642: 0
A644: CAMBERWELL | C644: 2 | D644: 1 | E644: =C644*6+D644 -> 13 | G644: 11 | H644: 8 | I644: =G644*6+H644 -> 74 | K644: 12 | L644: 9 | M644: =K644*6+L644 -> 81 | O644: 14 | P644: 15 | Q644: =O644*6+P644 -> 99 | S644: CAMBERWELL
A645: OAKLEIGH | C645: 5 | D645: 6 | E645: =C645*6+D645 -> 36 | G645: 5 | H645: 7 | I645: =G645*6+H645 -> 37 | K645: 10 | L645: 11 | M645: =K645*6+L645 -> 71 | O645: 12 | P645: 11 | Q645: =O645*6+P645 -> 83 | S645: STUART
A646: BEST PLAYERS
A647: CAMBERWELL | C647: LUFF | E647: JONES | H647: ANDREW | K647: AUSTIN | N647: LAWN | Q647: WARTMAN
A648: OAKLEIGH | C648: FLYNN | E648: WILTSHIRE | H648: DENNING | K648: DEAN | N648: GOULD | Q648: WITHERS
A649: GOALKICKERS
A650: CAMBERWELL | C650: LUFF 6 | E650: MASON 2 | H650: LAWN 2 | J650: AUSTIN 2 | M650: TROTTER | O650: O'NEILL
A651: OAKLEIGH | C651: FRASER 4 | E651: DENNING 2 | H651: CRAMERI | J651: GOULD | L651: R SMITH | N651: DEAN | P651: MUDGE | R651: C BELL
A653: PRAHRAN | C653: 5 | D653: 4 | E653: =C653*6+D653 -> 34 | G653: 5 | H653: 10 | I653: =G653*6+H653 -> 40 | K653: 9 | L653: 15 | M653: =K653*6+L653 -> 69 | O653: 14 | P653: 18 | Q653: =O653*6+P653 -> 102 | S653: PORT MELBOURNE
A654: PORT MELBOURNE | C654: 3 | D654: 3 | E654: =C654*6+D654 -> 21 | G654: 5 | H654: 6 | I654: =G654*6+H654 -> 36 | K654: 6 | L654: 8 | M654: =K654*6+L654 -> 44 | O654: 9 | P654: 11 | Q654: =O654*6+P654 -> 65 | S654: MURRAY
A655: BEST PLAYERS
A656: PRAHRAN | C656: KOOP | F656: WHITE | I656: THOMPSON | L656: KENNY | O656: BRENCHLEY | R656: HYDE
A657: PORT MELBOURNE | C657: PLUMRIDGE | F657: RUSDEN | I657: ALDRIDGE | L657: L KEATING | O657: HURLEY | R657: GARLEPP
A658: GOALKICKERS
A659: PRAHRAN | C659: BRENCHLEY 4 | F659: WHITE 3 | I659: N WILLIAMS 2 | L659: KENNY 2 | N659: THOMPSON 2 | Q659: WELLS
A660: PORT MELBOURNE | C660: ALDRIDGE 4 | F660: RUSDEN 2 | I660: BEDFORD 2 | L660: HURLEY
A662: WILLIAMSTOWN | C662: 2 | D662: 1 | E662: =C662*6+D662 -> 13 | G662: 5 | H662: 4 | I662: =G662*6+H662 -> 34 | K662: 7 | L662: 7 | M662: =K662*6+L662 -> 49 | O662: 11 | P662: 10 | Q662: =O662*6+P662 -> 76 | S662: WILLIAMSTOWN
A663: YARRAVILLE | C663: 2 | D663: 9 | E663: =C663*6+D663 -> 21 | G663: 5 | H663: 10 | I663: =G663*6+H663 -> 40 | K663: 8 | L663: 14 | M663: =K663*6+L663 -> 62 | O663: 9 | P663: 16 | Q663: =O663*6+P663 -> 70 | S663: MCKINNON
A664: BEST PLAYERS
A665: WILLIAMSTOWN | C665: STANBRIDGE | F665: ADDISON | I665: SYKES | L665: CUTTING | O665: BYRNE | R665: BARNES
A666: YARRAVILLE | C666: WARDEN | F666: WUNHYM | I666: SHEEHAN | L666: J BUCKLEY | O666: COPPOCK | R666: SIMPSON
A667: GOALKICKERS
A668: WILLIAMSTOWN | C668: ADDISON 4 | F668: C DREW 3 | I668: SCOTT 2 | K668: STANBRIDGE | N668: CUTTING
A669: YARRAVILLE | C669: J BUCKLEY 4 | F669: SIMPSON 3 | I669: McGRATH 2
A671: COBURG | C671: 1 | D671: 3 | E671: =C671*6+D671 -> 9 | G671: 8 | H671: 8 | I671: =G671*6+H671 -> 56 | K671: 12 | L671: 12 | M671: =K671*6+L671 -> 84 | O671: 18 | P671: 18 | Q671: =O671*6+P671 -> 126 | S671: BRUNSWICK
A672: BRUNSWICK | C672: 1 | D672: 5 | E672: =C672*6+D672 -> 11 | G672: 1 | H672: 8 | I672: =G672*6+H672 -> 14 | K672: 4 | L672: 12 | M672: =K672*6+L672 -> 36 | O672: 7 | P672: 17 | Q672: =O672*6+P672 -> 59 | S672: GREGORY
A673: BEST PLAYERS
A674: COBURG | C674: MEARS | E674: KIGHT | H674: RUDOLPH | K674: STOCKDALE | N674: JENKINS | Q674: DUNCAN
A675: BRUNSWICK | C675: JONES | E675: ARRELL | H675: BEARD | K675: WOODS | N675: ANDERSON | Q675: BRIGHT
A676: GOALKICKERS
A677: COBURG | C677: MEARS 7 | E677: STOCKDALE 4 | H677: DUNCAN 3 | K677: KIGHT 2 | M677: BROOM | O677: JENKINS
A678: BRUNSWICK | C678: JONES 5 | E678: FITZGERALD | H678: BRIGHT
A680: ROUND 13 | E680: 8TH JULY | J680: WEATHER | M680: COOL CLOUDY S.W. BREEZE | S680: PLAYED AT
D681: 1ST QTR | H681: 2ND QTR | L681: 3RD QTR | P681: FINAL | S681: NORTHCOTE
A682: NORTHCOTE | C682: 3 | D682: 2 | E682: =C682*6+D682 -> 20 | G682: 6 | H682: 5 | I682: =G682*6+H682 -> 41 | K682: 11 | L682: 9 | M682: =K682*6+L682 -> 75 | O682: 17 | P682: 12 | Q682: =O682*6+P682 -> 114 | S682: UMPIRE | X682: LADDER | AB682: ROUND | AD682: 13
A683: BRIGHTON | C683: 2 | D683: 8 | E683: =C683*6+D683 -> 20 | G683: 4 | H683: 14 | I683: =G683*6+H683 -> 38 | K683: 4 | L683: 16 | M683: =K683*6+L683 -> 40 | O683: 9 | P683: 18 | Q683: =O683*6+P683 -> 72 | S683: STUART
A684: BEST PLAYERS | W684: TEAM | X684: W | Y684: L | Z684: D | AA684: FOR | AB684: AGST | AC684: % | AD684: PTS
A685: NORTHCOTE | C685: WOODS | F685: SEYMOUR | I685: BRAY | L685: GARRETT | O685: ROSS | Q685: ROWE
A686: BRIGHTON | C686: GOULDSWORTHY | F686: DEANE | I686: CANTWELL | L686: LILBURNE | O686: BURTON | Q686: W O'BRIEN | W686: NORTHCOTE | X686: 9 | Y686: 2 | Z686: 2 | AA686: 1289 | AB686: 1009 | AC686: 127.75024777006938 | AD686: 40
A687: GOALKICKERS | W687: YARRAVILLE | X687: 10 | Y687: 3 | Z687: 0 | AA687: 1186 | AB687: 933 | AC687: 127.11682743837085 | AD687: 40
A688: NORTHCOTE | C688: SEYMOUR 5 | F688: ROSS 4 | I688: FLINN 4 | K688: SMITH | M688: BRAY | O688: GRAY | Q688: CONNELL | W688: CAMBERWELL | X688: 9 | Y688: 4 | Z688: 0 | AA688: 1323 | AB688: 1108 | AC688: 119.4043321299639 | AD688: 36
A689: BRIGHTON | C689: PENNY 3 | F689: DEAN 2 | I689: TUCKER | K689: HILL | M689: POULTER | O689: O'BRIEN | W689: SANDRINGHAM | X689: 8 | Y689: 4 | Z689: 1 | AA689: 1382 | AB689: 1115 | AC689: 123.94618834080717 | AD689: 34
A691: CAMBERWELL | C691: 5 | D691: 5 | E691: =C691*6+D691 -> 35 | G691: 6 | H691: 6 | I691: =G691*6+H691 -> 42 | K691: 11 | L691: 10 | M691: =K691*6+L691 -> 76 | O691: 16 | P691: 16 | Q691: =O691*6+P691 -> 112 | S691: TOORAK PARK | W691: COBURG | X691: 8 | Y691: 4 | Z691: 1 | AA691: 1160 | AB691: 1027 | AC691: 112.95034079844207 | AD691: 34
A692: PRAHRAN | C692: 3 | D692: 2 | E692: =C692*6+D692 -> 20 | G692: 7 | H692: 9 | I692: =G692*6+H692 -> 51 | K692: 10 | L692: 12 | M692: =K692*6+L692 -> 72 | O692: 11 | P692: 13 | Q692: =O692*6+P692 -> 79 | S692: GREGORY | W692: PRESTON | X692: 7 | Y692: 5 | Z692: 1 | AA692: 1121 | AB692: 1031 | AC692: 108.72938894277401 | AD692: 30
A693: BEST PLAYERS | W693: PORT MELBOURNE | X693: 7 | Y693: 5 | Z693: 1 | AA693: 1247 | AB693: 1179 | AC693: 105.76759966072943 | AD693: 30
A694: CAMBERWELL | C694: LAWN | F694: FINLAYSON | I694: JONES | L694: WALLACE | O694: O'NEILL | Q694: MASON | W694: BRIGHTON | X694: 5 | Y694: 8 | Z694: 0 | AA694: 1161 | AB694: 1363 | AC694: 85.179750550256784 | AD694: 20
A695: PRAHRAN | C695: BENSTEAD | F695: BRENCHLEY | I695: THOMPSON | L695: KENNY | O695: WHITE | Q695: F SMITH | W695: WILLIAMSTOWN | X695: 4 | Y695: 9 | Z695: 0 | AA695: 1019 | AB695: 1154 | AC695: 88.301559792027732 | AD695: 16
A696: GOALKICKERS | W696: PRAHRAN | X696: 4 | Y696: 9 | Z696: 0 | AA696: 1128 | AB696: 1278 | AC696: 88.262910798122064 | AD696: 16
A697: CAMBERWELL | C697: LUFF 5 | E697: LAWN 5 | G697: MASON | I697: W COFFIN | K697: O'NEILL | M697: HARVEY | O697: L WALLACE | R697: WARTMAN | W697: OAKLEIGH | X697: 4 | Y697: 9 | Z697: 0 | AA697: 1049 | AB697: 1355 | AC697: 77.416974169741692 | AD697: 16
A698: PRAHRAN | C698: BRENCHLEY 3 | F698: JORDAN 2 | I698: THOMPSON 2 | L698: N WILLIAMS | O698: WELLS | Q698: C WILLIAMS | T698: MASON | W698: BRUNSWICK | X698: 0 | Y698: 13 | Z698: 0 | AA698: 884 | AB698: 1397 | AC698: 63.278453829634934 | AD698: 0
A700: YARRAVILLE | C700: 5 | D700: 4 | E700: =C700*6+D700 -> 34 | G700: 7 | H700: 4 | I700: =G700*6+H700 -> 46 | K700: 14 | L700: 8 | M700: =K700*6+L700 -> 92 | O700: 15 | P700: 13 | Q700: =O700*6+P700 -> 103 | S700: YARRAVILLE
A701: PORT MELBOURNE | C701: 2 | D701: 2 | E701: =C701*6+D701 -> 14 | G701: 6 | H701: 9 | I701: =G701*6+H701 -> 45 | K701: 11 | L701: 13 | M701: =K701*6+L701 -> 79 | O701: 14 | P701: 14 | Q701: =O701*6+P701 -> 98 | S701: BRANDON
A702: BEST PLAYERS
A703: YARRAVILLE | C703: WUNHYM | F703: EVANS | I703: FISHER | L703: CAMERON | O703: R EDWARDS | R703: WARDEN
A704: PORT MELBOURNE | C704: REES | F704: KEATING | I704: HURLEY | L704: PLUMRIDGE | O704: GARBUTT | R704: BEDFORD
A705: GOALKICKERS
A706: YARRAVILLE | C706: J BUCKLEY 4 | F706: PETERS 3 | I706: EVANS 3 | L706: SHEEHAN 2 | O706: CAMERON | R706: WARDEN | U706: FISHER
A707: PORT MELBOURNE | C707: REES 4 | E707: HURLEY 2 | H707: ALDRIDGE 2 | K707: BARNES 2 | N707: BILLS 2 | Q707: BEDFORD | S707: LAHIFF
A709: SANDRINGHAM | C709: 6 | D709: 2 | E709: =C709*6+D709 -> 38 | G709: 14 | H709: 8 | I709: =G709*6+H709 -> 92 | K709: 17 | L709: 9 | M709: =K709*6+L709 -> 111 | O709: 24 | P709: 12 | Q709: =O709*6+P709 -> 156 | S709: BEACH ROAD
A710: BRUNSWICK | C710: 3 | D710: 5 | E710: =C710*6+D710 -> 23 | G710: 7 | H710: 6 | I710: =G710*6+H710 -> 48 | K710: 10 | L710: 11 | M710: =K710*6+L710 -> 71 | O710: 12 | P710: 13 | Q710: =O710*6+P710 -> 85 | S710: LESTER
A711: BEST PLAYERS
A712: SANDRINGHAM | C712: CAHIR | E712: DE LUCA | H712: RAYMENT | K712: BECKTON | N712: TOLSON | Q712: H JOHNSON
A713: BRUNSWICK | C713: DOWLING | E713: PRISMAL | H713: MAYNES | K713: JONES | N713: BRIGHT | Q713: RALEIGH
A714: GOALKICKERS
A715: SANDRINGHAM | C715: CAHIR 10 | E715: JOHNSON 6 | H715: TOLSON 3 | J715: RAYMENT | L715: DE LUCA | N715: BECKTON | P715: ANDERSON | S715: SMAIL
A716: BRUNSWICK | C716: JONES 4 | E716: RALEIGH 2 | H716: LEURI 2 | J716: MORGAN | L716: GRACE | N716: ANDERSON | Q716: ARRELL
A718: COBURG | C718: 3 | D718: 2 | E718: =C718*6+D718 -> 20 | G718: 5 | H718: 6 | I718: =G718*6+H718 -> 36 | K718: 8 | L718: 9 | M718: =K718*6+L718 -> 57 | O718: 11 | P718: 16 | Q718: =O718*6+P718 -> 82 | S718: COBURG
A719: PRESTON | C719: 3 | D719: 4 | E719: =C719*6+D719 -> 22 | G719: 5 | H719: 8 | I719: =G719*6+H719 -> 38 | K719: 9 | L719: 10 | M719: =K719*6+L719 -> 64 | O719: 10 | P719: 13 | Q719: =O719*6+P719 -> 73 | S719: MURRAY
A720: BEST PLAYERS
A721: COBURG | C721: LOWE | E721: MEARS | H721: KIGHT | K721: BROOM | N721: HOGAN | Q721: LEAHY
A722: PRESTON | C722: DAVIE | E722: DOYLE | H722: SMITH | K722: HARDING | N722: MONOHAN | Q722: WARR
A723: GOALKICKERS
A724: COBURG | C724: DUNCAN 3 | F724: KIGHT 3 | H724: BROOM 2 | J724: MEARS | L724: J L HOGAN | O724: DUNCAN JNR
A725: PRESTON | C725: ROBINSON 3 | F725: BIRD 3 | H725: WALSH | J725: WARR | L725: HARDING | O725: DINEEN
A727: OAKLEIGH | C727: 1 | D727: 7 | E727: =C727*6+D727 -> 13 | G727: 4 | H727: 14 | I727: =G727*6+H727 -> 38 | K727: 5 | L727: 19 | M727: =K727*6+L727 -> 49 | O727: 9 | P727: 20 | Q727: =O727*6+P727 -> 74 | S727: OAKLEIGH
A728: WILLIAMSTOWN | C728: 2 | D728: 6 | E728: =C728*6+D728 -> 18 | G728: 5 | H728: 9 | I728: =G728*6+H728 -> 39 | K728: 6 | L728: 14 | M728: =K728*6+L728 -> 50 | O728: 8 | P728: 16 | Q728: =O728*6+P728 -> 64 | S728: McKINNON
A729: BEST PLAYERS
A730: OAKLEIGH | C730: FRASER | F730: FLEMING | I730: McALLISTER | L730: WITHERS | O730: BAKER | R730: CRAMERI
A731: WILLIAMSTOWN | C731: STANBRIDGE | F731: BYRNE | I731: McCABE | L731: BARNES | O731: SYKES | R731: ADDISON
A732: GOALKICKERS
A733: OAKLEIGH | C733: FRASER 3 | F733: FLEMING 2 | I733: CRAMERI | L733: BAKER | N733: MUDGE | P733: C BELL
A734: WILLIAMSTOWN | C734: McCABE 2 | F734: STANBRIDGE | I734: DIXON | L734: ADDISON
A736: ROUND 14 | E736: 15TH JULY | H736: WEATHER | K736: COOL CLOUDY SOUTH BREEZE GROUNDS POOR | S736: PLAYED AT
D737: 1ST QTR | H737: 2ND QTR | L737: 3RD QTR | P737: FINAL | S737: NORTHCOTE
A738: NORTHCOTE | C738: 5 | D738: 8 | E738: =C738*6+D738 -> 38 | G738: 9 | H738: 12 | I738: =G738*6+H738 -> 66 | K738: 13 | L738: 14 | M738: =K738*6+L738 -> 92 | O738: 17 | P738: 19 | Q738: =O738*6+P738 -> 121 | S738: UMPIRE | X738: LADDER | AB738: ROUND | AD738: 14
A739: COBURG | C739: 4 | D739: 1 | E739: =C739*6+D739 -> 25 | G739: 6 | H739: 2 | I739: =G739*6+H739 -> 38 | K739: 10 | L739: 4 | M739: =K739*6+L739 -> 64 | O739: 12 | P739: 6 | Q739: =O739*6+P739 -> 78 | S739: STUART
A740: BEST PLAYERS | W740: TEAM | X740: W | Y740: L | Z740: D | AA740: FOR | AB740: AGST | AC740: % | AD740: PTS
A741: NORTHCOTE | C741: HART | F741: COLE | I741: ROSS | L741: WOODS | O741: ROWE | Q741: SMITH
A742: COBURG | C742: RUDOLPH | F742: KIGHT | I742: BROOM | L742: JENKINS | O742: LOWE | Q742: HARRIS | W742: YARRAVILLE | X742: 11 | Y742: 3 | Z742: 0 | AA742: 1355 | AB742: 1023 | AC742: 132.45356793743892 | AD742: 44
A743: GOALKICKERS | W743: NORTHCOTE | X743: 10 | Y743: 2 | Z743: 2 | AA743: 1410 | AB743: 1087 | AC743: 129.71481140754369 | AD743: 44
A744: NORTHCOTE | C744: SEYMOUR 5 | F744: GRAY 4 | H744: ROSS 3 | J744: SMITH 2 | L744: BRAY | N744: ROWE | P744: CORRIGAN | W744: CAMBERWELL | X744: 10 | Y744: 4 | Z744: 0 | AA744: 1425 | AB744: 1168 | AC744: 122.00342465753425 | AD744: 40
A745: COBURG | C745: DUNCAN 4 | F745: KIGHT 2 | H745: STOCKDALE 2 | K745: MEARS 2 | M745: UHE 2 | W745: SANDRINGHAM | X745: 9 | Y745: 4 | Z745: 1 | AA745: 1497 | AB745: 1189 | AC745: 125.90412111017662 | AD745: 38
A747: PORT MELBOURNE | C747: 1 | D747: 4 | E747: =C747*6+D747 -> 10 | G747: 7 | H747: 6 | I747: =G747*6+H747 -> 48 | K747: 8 | L747: 6 | M747: =K747*6+L747 -> 54 | O747: 14 | P747: 9 | Q747: =O747*6+P747 -> 93 | S747: PRESTON | W747: COBURG | X747: 8 | Y747: 5 | Z747: 1 | AA747: 1238 | AB747: 1148 | AC747: 107.8397212543554 | AD747: 34
A748: PRESTON | C748: 5 | D748: 4 | E748: =C748*6+D748 -> 34 | G748: 6 | H748: 7 | I748: =G748*6+H748 -> 43 | K748: 8 | L748: 10 | M748: =K748*6+L748 -> 58 | O748: 9 | P748: 12 | Q748: =O748*6+P748 -> 66 | S748: McKINNON | W748: PORT MELBOURNE | X748: 8 | Y748: 5 | Z748: 1 | AA748: 1340 | AB748: 1245 | AC748: 107.63052208835342 | AD748: 34
A749: BEST PLAYERS | W749: PRESTON | X749: 7 | Y749: 6 | Z749: 1 | AA749: 1187 | AB749: 1124 | AC749: 105.60498220640569 | AD749: 30
A750: PORT MELBOURNE | C750: PERRETT | F750: GARBUTT | I750: KEATING | K750: HURLEY | N750: ATKINSON | Q750: REES | W750: BRIGHTON | X750: 5 | Y750: 9 | Z750: 0 | AA750: 1251 | AB750: 1532 | AC750: 81.657963446475193 | AD750: 20
A751: PRESTON | C751: McEACHARN | F751: DOWLING | I751: DOYLE | K751: CAMERON | N751: MONOHAN | Q751: ROBINSON | W751: PRAHRAN | X751: 4 | Y751: 10 | Z751: 0 | AA751: 1202 | AB751: 1393 | AC751: 86.288585786073227 | AD751: 16
A752: GOALKICKERS | P752: BARNES | R752: BILLS | W752: WILLIAMSTOWN | X752: 4 | Y752: 10 | Z752: 0 | AA752: 1079 | AB752: 1256 | AC752: 85.907643312101911 | AD752: 16
A753: PORT MELBOURNE | C753: KEATING 3 | F753: BEDFORD 2 | I753: ALDRIDGE 2 | L753: PAYNE 2 | N753: REES | P753: RUSDEN | R753: HURLEY | W753: OAKLEIGH | X753: 4 | Y753: 10 | Z753: 0 | AA753: 1104 | AB753: 1428 | AC753: 77.310924369747895 | AD753: 16
A754: PRESTON | C754: WARR 2 | E754: DOYLE 2 | G754: WALSH | I754: ROBINSON | L754: BIRD | N754: KUPSCH | P754: MONOHAN | W754: BRUNSWICK | X754: 1 | Y754: 13 | Z754: 0 | AA754: 957 | AB754: 1452 | AC754: 65.909090909090907 | AD754: 4
A756: BRUNSWICK | C756: 5 | D756: 2 | E756: =C756*6+D756 -> 32 | G756: 5 | H756: 3 | I756: =G756*6+H756 -> 33 | K756: 7 | L756: 5 | M756: =K756*6+L756 -> 47 | O756: 11 | P756: 7 | Q756: =O756*6+P756 -> 73 | S756: BRUNSWICK
A757: OAKLEIGH | C757: 1 | D757: 4 | E757: =C757*6+D757 -> 10 | G757: 5 | H757: 4 | I757: =G757*6+H757 -> 34 | K757: 6 | L757: 10 | M757: =K757*6+L757 -> 46 | O757: 7 | P757: 13 | Q757: =O757*6+P757 -> 55 | S757: HUNTINGTON
A758: BEST PLAYERS
A759: BRUNSWICK | C759: BLACKMORE | F759: PRISMAL | I759: JONES | L759: DOWLING | O759: ANDERSON | R759: A THOMPSON
A760: OAKLEIGH | C760: WILTSHIRE | F760: FRASER | I760: POWELL | L760: WATSON | O760: WITHERS | R760: FLEMING
A761: GOALKICKERS
A762: BRUNSWICK | C762: JONES 5 | F762: RAEBURN 2 | I762: DOWLING | K762: MAYNES | M762: ARRELL | P762: PRISMAL
A763: OAKLEIGH | C763: FRASER 4 | F763: FLEMING | H763: DENNING | J763: BRACHER
A765: SANDRINGHAM | C765: 7 | D765: 3 | E765: =C765*6+D765 -> 45 | G765: 11 | H765: 5 | I765: =G765*6+H765 -> 71 | K765: 15 | L765: 10 | M765: =K765*6+L765 -> 100 | O765: 17 | P765: 13 | Q765: =O765*6+P765 -> 115 | S765: TOORAK PARK
A766: PRAHRAN | C766: 3 | D766: 2 | E766: =C766*6+D766 -> 20 | G766: 6 | H766: 9 | I766: =G766*6+H766 -> 45 | K766: 8 | L766: 10 | M766: =K766*6+L766 -> 58 | O766: 10 | P766: 14 | Q766: =O766*6+P766 -> 74 | S766: MURRAY
A767: BEST PLAYERS
A768: SANDRINGHAM | C768: FITZGERALD | F768: TOLSON | I768: ANDERSON | L768: BECKTON | O768: DE LUCA | R768: JAMIESON
A769: PRAHRAN | C769: F SMITH | F769: BECK | I769: THOMPSON | L769: JORDAN | O769: BRENCHLEY | R769: WHITE
A770: GOALKICKERS
A771: SANDRINGHAM | C771: FITZGERALD 6 | F771: JOHNSON 4 | I771: RAYMENT 3 | L771: TOLSON 2 | N771: BECKTON | Q771: ANDERSON
A772: PRAHRAN | C772: THOMPSON 4 | F772: HAWKINS 2 | I772: TRIM | K772: BRENCHLEY | N772: JORDAN | Q772: WHITE
A774: YARRAVILLE | C774: 10 | D774: 7 | E774: =C774*6+D774 -> 67 | G774: 13 | H774: 14 | I774: =G774*6+H774 -> 92 | K774: 20 | L774: 17 | M774: =K774*6+L774 -> 137 | O774: 25 | P774: 19 | Q774: =O774*6+P774 -> 169 | S774: YARRAVILLE
A775: BRIGHTON | C775: 0 | D775: 1 | E775: =C775*6+D775 -> 1 | G775: 7 | H775: 5 | I775: =G775*6+H775 -> 47 | K775: 11 | L775: 7 | M775: =K775*6+L775 -> 73 | O775: 13 | P775: 12 | Q775: =O775*6+P775 -> 90 | S775: BRANDON
A776: BEST PLAYERS
A777: YARRAVILLE | C777: WHITE | F777: EVANS | I777: WUNHYM | L777: J BUCKLEY | O777: WARDEN | R777: McGRATH
A778: BRIGHTON | C778: POULTER | F778: PENNY | I778: WILKINS | L778: BURTON | O778: TUCKER | R778: DEANE
A779: GOALKICKERS
A780: YARRAVILLE | C780: J BUCKLEY 8 | F780: SIMPSON 4 | I780: CAMERON 3 | L780: EVANS 3 | N780: PETERS 3 | Q780: MCGRATH 2 | T780: WARDEN 2
A781: BRIGHTON | C781: DEAN 3 | E781: BURTON 3 | H781: POULTER 2 | K781: PENNY | M781: TUCKER | O781: LILBURNE | Q781: O'BRIEN | T781: JOYNSON
A783: CAMBERWELL | C783: 7 | D783: 2 | E783: =C783*6+D783 -> 44 | G783: 7 | H783: 4 | I783: =G783*6+H783 -> 46 | K783: 12 | L783: 8 | M783: =K783*6+L783 -> 80 | O783: 14 | P783: 18 | Q783: =O783*6+P783 -> 102 | S783: WILLIAMSTOWN
A784: WILLIAMSTOWN | C784: 1 | D784: 4 | E784: =C784*6+D784 -> 10 | G784: 5 | H784: 7 | I784: =G784*6+H784 -> 37 | K784: 7 | L784: 11 | M784: =K784*6+L784 -> 53 | O784: 8 | P784: 12 | Q784: =O784*6+P784 -> 60 | S784: GREGORY
A785: BEST PLAYERS
A786: CAMBERWELL | C786: JONES | F786: LUFF | I786: LAWN | L786: MASON | O786: BOOTHMAN | R786: O'NEILL
A787: WILLIAMSTOWN | C787: STANBRIDGE | F787: McCABE | I787: SYKES | L787: ORANGE | O787: BLAKE | R787: JAENSCH
A788: GOALKICKERS
A789: CAMBERWELL | C789: MASON 5 | F789: LUFF 3 | I789: BOOTHMAN 2 | L789: LAWN 2 | N789: R WILLIAMS | Q789: O'NEILL
A790: WILLIAMSTOWN | C790: STANBRIDGE 3 | F790: JAENSCH 2 | I790: McCABE 2 | L790: DIXON
A792: ROUND 15 | E792: 22ND JULY | J792: WEATHER | M792: FINE NORTH WIND | S792: PLAYED AT
D793: 1ST QTR | H793: 2ND QTR | L793: 3RD QTR | P793: FINAL | S793: CAMBERWELL
A794: NORTHCOTE | C794: 5 | D794: 7 | E794: =C794*6+D794 -> 37 | G794: 10 | H794: 11 | I794: =G794*6+H794 -> 71 | K794: 16 | L794: 16 | M794: =K794*6+L794 -> 112 | O794: 18 | P794: 18 | Q794: =O794*6+P794 -> 126 | S794: UMPIRE | X794: LADDER | AB794: ROUND | AD794: 15
A795: CAMBERWELL | C795: 2 | D795: 1 | E795: =C795*6+D795 -> 13 | G795: 9 | H795: 7 | I795: =G795*6+H795 -> 61 | K795: 11 | L795: 9 | M795: =K795*6+L795 -> 75 | O795: 13 | P795: 14 | Q795: =O795*6+P795 -> 92 | S795: MURRAY
A796: BEST PLAYERS | W796: TEAM | X796: W | Y796: L | Z796: D | AA796: FOR | AB796: AGST | AC796: % | AD796: PTS
A797: NORTHCOTE | C797: SMITH | E797: ROSS | H797: WOODS | K797: ROWE | N797: GRAY | Q797: CORRIGAN
A798: CAMBERWELL | C798: JONES | E798: LAWN | H798: O'NEILL | K798: FYFFE | N798: FINLAYSON | Q798: LUFF | W798: NORTHCOTE | X798: 11 | Y798: 2 | Z798: 2 | AA798: 1536 | AB798: 1179 | AC798: 130.27989821882952 | AD798: 48
A799: GOALKICKERS | W799: YARRAVILLE | X799: 11 | Y799: 4 | Z799: 0 | AA799: 1416 | AB799: 1126 | AC799: 125.75488454706927 | AD799: 44
A800: NORTHCOTE | C800: SEYMOUR 6 | F800: FLINN 5 | H800: ROSS 3 | J800: SMITH 2 | L800: COLE | N800: GOULLET | W800: SANDRINGHAM | X800: 10 | Y800: 4 | Z800: 1 | AA800: 1600 | AB800: 1250 | AC800: 128 | AD800: 42
A801: CAMBERWELL | C801: LUFF 5 | F801: LAWN 3 | H801: FYFE 2 | J801: MASON | L801: WEIST | N801: FINLAYSON | W801: CAMBERWELL | X801: 10 | Y801: 5 | Z801: 0 | AA801: 1517 | AB801: 1294 | AC801: 117.23338485316847 | AD801: 40
A803: COBURG | C803: 2 | D803: 1 | E803: =C803*6+D803 -> 13 | G803: 10 | H803: 9 | I803: =G803*6+H803 -> 69 | K803: 14 | L803: 10 | M803: =K803*6+L803 -> 94 | O803: 21 | P803: 15 | Q803: =O803*6+P803 -> 141 | S803: COBURG | W803: COBURG | X803: 9 | Y803: 5 | Z803: 1 | AA803: 1379 | AB803: 1210 | AC803: 113.96694214876032 | AD803: 38
A804: WILLIAMSTOWN | C804: 1 | D804: 5 | E804: =C804*6+D804 -> 11 | G804: 2 | H804: 7 | I804: =G804*6+H804 -> 19 | K804: 6 | L804: 14 | M804: =K804*6+L804 -> 50 | O804: 8 | P804: 14 | Q804: =O804*6+P804 -> 62 | S804: BRANDON | W804: PORT MELBOURNE | X804: 9 | Y804: 5 | Z804: 1 | AA804: 1480 | AB804: 1313 | AC804: 112.71896420411272 | AD804: 38
A805: BEST PLAYERS | W805: PRESTON | X805: 7 | Y805: 7 | Z805: 1 | AA805: 1282 | AB805: 1242 | AC805: 103.22061191626409 | AD805: 30
A806: COBURG | C806: KIGHT | F806: STOCKDALE | I806: RUDOLPH | L806: BROOM | N806: DUNCAN | Q806: LOWE | W806: BRIGHTON | X806: 6 | Y806: 9 | Z806: 0 | AA806: 1369 | AB806: 1627 | AC806: 84.142593730792868 | AD806: 24
A807: WILLIAMSTOWN | C807: ADDISON | F807: STANBRIDGE | I807: TAYLOR | L807: SYKES | N807: CUTTING | Q807: BARNES | W807: OAKLEIGH | X807: 5 | Y807: 10 | Z807: 0 | AA807: 1202 | AB807: 1519 | AC807: 79.131007241606326 | AD807: 20
A808: GOALKICKERS | W808: PRAHRAN | X808: 4 | Y808: 11 | Z808: 0 | AA808: 1293 | AB808: 1491 | AC808: 86.720321931589538 | AD808: 16
A809: COBURG | C809: DUNCAN 9 | F809: KIGHT 5 | I809: WILLOX 3 | L809: UHE 2 | N809: BROOM | Q809: STOCKDALE | W809: WILLIAMSTOWN | X809: 4 | Y809: 11 | Z809: 0 | AA809: 1141 | AB809: 1397 | AC809: 81.675017895490342 | AD809: 16
A810: WILLIAMSTOWN | C810: ADDISON 2 | F810: BARNES 2 | I810: BYRNE | K810: McCABE | M810: TAYLOR | O810: ORANGE | W810: BRUNSWICK | X810: 1 | Y810: 14 | Z810: 0 | AA810: 1025 | AB810: 1592 | AC810: 64.384422110552762 | AD810: 4
A812: SANDRINGHAM | C812: 3 | D812: 5 | E812: =C812*6+D812 -> 23 | G812: 8 | H812: 10 | I812: =G812*6+H812 -> 58 | K812: 10 | L812: 12 | M812: =K812*6+L812 -> 72 | O812: 14 | P812: 19 | Q812: =O812*6+P812 -> 103 | S812: BEACH ROAD
A813: YARRAVILLE | C813: 1 | D813: 2 | E813: =C813*6+D813 -> 8 | G813: 3 | H813: 4 | I813: =G813*6+H813 -> 22 | K813: 8 | L813: 7 | M813: =K813*6+L813 -> 55 | O813: 9 | P813: 7 | Q813: =O813*6+P813 -> 61 | S813: NOWLAN
A814: BEST PLAYERS
A815: SANDRINGHAM | C815: BECKTON | E815: YEMM | H815: THOMS | K815: DE LUCA | N815: CAHIR | Q815: RAYMENT
A816: YARRAVILLE | C816: BOURKE | E816: R EDWARDS | H816: A EDWARDS | K816: EVANS | N816: SHEEHAN | Q816: FREW
A817: GOALKICKERS
A818: SANDRINGHAM | C818: FITZGERALD 7 | F818: CAHIR 3 | I818: JOHNSON | L818: BECKTON | N818: ANDERSON | Q818: SMAIL
A819: YARRAVILLE | C819: EVANS 4 | F819: J BUCKLEY 2 | I819: SIMPSON 2 | L819: SHEEHAN
A821: PORT MELBOURNE | C821: 4 | D821: 1 | E821: =C821*6+D821 -> 25 | G821: 10 | H821: 6 | I821: =G821*6+H821 -> 66 | K821: 13 | L821: 10 | M821: =K821*6+L821 -> 88 | O821: 21 | P821: 14 | Q821: =O821*6+P821 -> 140 | S821: PORT MELBOURNE
A822: BRUNSWICK | C822: 3 | D822: 6 | E822: =C822*6+D822 -> 24 | G822: 3 | H822: 8 | I822: =G822*6+H822 -> 26 | K822: 5 | L822: 11 | M822: =K822*6+L822 -> 41 | O822: 9 | P822: 14 | Q822: =O822*6+P822 -> 68 | S822: GLOVER
A823: BEST PLAYERS
A824: PORT MELBOURNE | C824: BEDFORD | F824: GARBUTT | I824: REES | L824: HURLEY | O824: PERRETT | Q824: ALDRIDGE
A825: BRUNSWICK | C825: BRIGHT | F825: KENNEDY | I825: BLACKMORE | L825: A THOMPSON | O825: JONES | Q825: WATTS
A826: GOALKICKERS
A827: PORT MELBOURNE | C827: BEDFORD 7 | F827: REES 3 | H827: KEATING 2 | J827: HURLEY 2 | M827: BARNES 2 | O827: ALDRIDGE 2 | R827: ATKINSON 2 | W827: RUSDEN
A828: BRUNSWICK | C828: JONES 4 | F828: BRIGHT 2 | I828: WATTS 2 | L828: RAEBURN
A830: OAKLEIGH | C830: 5 | D830: 1 | E830: =C830*6+D830 -> 31 | G830: 8 | H830: 5 | I830: =G830*6+H830 -> 53 | K830: 10 | L830: 7 | M830: =K830*6+L830 -> 67 | O830: 14 | P830: 14 | Q830: =O830*6+P830 -> 98 | S830: OAKLEIGH
A831: PRAHRAN | C831: 2 | D831: 3 | E831: =C831*6+D831 -> 15 | G831: 6 | H831: 5 | I831: =G831*6+H831 -> 41 | K831: 9 | L831: 10 | M831: =K831*6+L831 -> 64 | O831: 13 | P831: 13 | Q831: =O831*6+P831 -> 91 | S831: STUART
A832: BEST PLAYERS
A833: OAKLEIGH | C833: R SMITH | F833: FRASER | I833: FLEMING | L833: WITHERS | O833: DENNING | Q833: CRAMERI
A834: PRAHRAN | C834: JORDAN | F834: KOOP | I834: F SMITH | L834: THOMPSON | O834: TRIM | Q834: HYDE
A835: GOALKICKERS
A836: OAKLEIGH | C836: DENNING 10 | G836: FRASER 4
A837: PRAHRAN | C837: THOMPSON 4 | F837: WHITE 3 | I837: HAWKINS 2 | L837: JORDAN 2 | O837: HARRIS | Q837: BINSTEAD
A839: BRIGHTON | C839: 5 | D839: 4 | E839: =C839*6+D839 -> 34 | G839: 10 | H839: 4 | I839: =G839*6+H839 -> 64 | K839: 15 | L839: 7 | M839: =K839*6+L839 -> 97 | O839: 18 | P839: 10 | Q839: =O839*6+P839 -> 118 | S839: ELSTERNWICK PARK
A840: PRESTON | C840: 3 | D840: 2 | E840: =C840*6+D840 -> 20 | G840: 8 | H840: 5 | I840: =G840*6+H840 -> 53 | K840: 11 | L840: 11 | M840: =K840*6+L840 -> 77 | O840: 13 | P840: 17 | Q840: =O840*6+P840 -> 95 | S840: McKINNON
A841: BEST PLAYERS
A842: BRIGHTON | C842: JOHNSTONE | F842: STEWART | I842: HILL | L842: POULTER | O842: PENNY | R842: BURNES
A843: PRESTON | C843: DAVIE | F843: DOYLE | I843: F SPARGO | L843: MONOHAN | O843: CAMERON | R843: WARR
A844: GOALKICKERS
A845: BRIGHTON | C845: PENNY 4 | E845: POULTER 4 | H845: TUCKER 2 | J845: LILBURNE 2 | M845: DEAN 2 | O845: BURNES 2 | Q845: WILKINS | T845: HILL
A846: PRESTON | C846: WARR 3 | E846: BIRD 2 | G846: CAMERON 2 | J846: DAVIE | L846: ROBINSON | N846: McEACHERN | Q846: BREWIS | S846: BATHMAN
A848: ROUND 16 | E848: 29TH JULY | H848: WEATHER | K848: COOL CLOUDY SOUTH WIND A.M. RAIN | S848: PLAYED AT
D849: 1ST QTR | H849: 2ND QTR | L849: 3RD QTR | P849: FINAL | S849: BRUNSWICK
A850: NORTHCOTE | C850: 3 | D850: 3 | E850: =C850*6+D850 -> 21 | G850: 7 | H850: 7 | I850: =G850*6+H850 -> 49 | K850: 10 | L850: 9 | M850: =K850*6+L850 -> 69 | O850: 17 | P850: 15 | Q850: =O850*6+P850 -> 117 | S850: UMPIRE | X850: LADDER | AB850: ROUND | AD850: 16
A851: BRUNSWICK | C851: 1 | D851: 4 | E851: =C851*6+D851 -> 10 | G851: 2 | H851: 4 | I851: =G851*6+H851 -> 16 | K851: 5 | L851: 5 | M851: =K851*6+L851 -> 35 | O851: 5 | P851: 5 | Q851: =O851*6+P851 -> 35 | S851: BRANDON
A852: BEST PLAYERS | W852: TEAM | X852: W | Y852: L | Z852: D | AA852: FOR | AB852: AGST | AC852: % | AD852: PTS
A853: NORTHCOTE | C853: ROWE | F853: BROWN | I853: SMITH | L853: ACKLAND | O853: WOODS | Q853: GOULLETT
A854: BRUNSWICK | C854: BLACKMORE | F854: BRIGHT | I854: DOWLING | L854: MORGAN | O854: REID | Q854: MAYNES | W854: NORTHCOTE | X854: 12 | Y854: 2 | Z854: 2 | AA854: 1653 | AB854: 1214 | AC854: 136.16144975288304 | AD854: 52
A855: GOALKICKERS | W855: YARRAVILLE | X855: 12 | Y855: 4 | Z855: 0 | AA855: 1528 | AB855: 1194 | AC855: 127.97319932998325 | AD855: 48
A856: NORTHCOTE | C856: SEYMOUR 5 | F856: GRAY 3 | I856: BROWN 3 | L856: ROWE 2 | N856: CONNELL 2 | Q856: SMITH | S856: ROSS | W856: SANDRINGHAM | X856: 10 | Y856: 5 | Z856: 1 | AA856: 1647 | AB856: 1331 | AC856: 123.74154770848986 | AD856: 42
A857: BRUNSWICK | C857: GILLON | F857: McNEAL | I857: MAYNES | L857: RALEIGH | N857: McPHERSON | W857: COBURG | X857: 10 | Y857: 5 | Z857: 1 | AA857: 1460 | AB857: 1257 | AC857: 116.14956245027844 | AD857: 42
A859: PRAHRAN | C859: 4 | D859: 3 | E859: =C859*6+D859 -> 27 | G859: 6 | H859: 6 | I859: =G859*6+H859 -> 42 | K859: 10 | L859: 9 | M859: =K859*6+L859 -> 69 | O859: 12 | P859: 13 | Q859: =O859*6+P859 -> 85 | S859: TOORAK PARK | W859: PORT MELBOURNE | X859: 10 | Y859: 5 | Z859: 1 | AA859: 1571 | AB859: 1374 | AC859: 114.3377001455604 | AD859: 42
A860: BRIGHTON | C860: 2 | D860: 3 | E860: =C860*6+D860 -> 15 | G860: 6 | H860: 7 | I860: =G860*6+H860 -> 43 | K860: 9 | L860: 10 | M860: =K860*6+L860 -> 64 | O860: 12 | P860: 13 | Q860: =O860*6+P860 -> 85 | S860: McKINNON | W860: CAMBERWELL | X860: 10 | Y860: 6 | Z860: 0 | AA860: 1583 | AB860: 1369 | AC860: 115.63184806428049 | AD860: 40
A861: BEST PLAYERS | W861: PRESTON | X861: 8 | Y861: 7 | Z861: 1 | AA861: 1357 | AB861: 1308 | AC861: 103.74617737003058 | AD861: 34
A862: PRAHRAN | C862: HYDE | F862: WHITE | I862: JORDAN | L862: HAWKINS | N862: THOMPSON | Q862: HARRIS | W862: BRIGHTON | X862: 6 | Y862: 9 | Z862: 1 | AA862: 1454 | AB862: 1712 | AC862: 84.929906542056074 | AD862: 26
A863: BRIGHTON | C863: GOULDSWORTHY | F863: TOMLINS | I863: MILLER | L863: BURNES | N863: DEANE | Q863: HILL | W863: OAKLEIGH | X863: 5 | Y863: 11 | Z863: 0 | AA863: 1270 | AB863: 1631 | AC863: 77.866339668914776 | AD863: 20
A864: GOALKICKERS | W864: PRAHRAN | X864: 4 | Y864: 11 | Z864: 1 | AA864: 1378 | AB864: 1576 | AC864: 87.436548223350258 | AD864: 18
A865: PRAHRAN | C865: HAWKINS 5 | F865: HARRIS 2 | I865: WHITE 2 | L865: TRIM | N865: JORDAN | Q865: THOMPSON | W865: WILLIAMSTOWN | X865: 4 | Y865: 12 | Z865: 0 | AA865: 1202 | AB865: 1488 | AC865: 80.77956989247312 | AD865: 16
A866: BRIGHTON | C866: BURNES 4 | F866: DEAN 3 | I866: TUCKER 2 | L866: HILL | N866: TOMLINS | Q866: MILLER | W866: BRUNSWICK | X866: 1 | Y866: 15 | Z866: 0 | AA866: 1060 | AB866: 1709 | AC866: 62.024575775307198 | AD866: 4
A868: COBURG | C868: 3 | D868: 6 | E868: =C868*6+D868 -> 24 | G868: 6 | H868: 6 | I868: =G868*6+H868 -> 42 | K868: 7 | L868: 11 | M868: =K868*6+L868 -> 53 | O868: 11 | P868: 15 | Q868: =O868*6+P868 -> 81 | S868: COBURG
A869: SANDRINGHAM | C869: 1 | D869: 1 | E869: =C869*6+D869 -> 7 | G869: 2 | H869: 7 | I869: =G869*6+H869 -> 19 | K869: 3 | L869: 10 | M869: =K869*6+L869 -> 28 | O869: 6 | P869: 11 | Q869: =O869*6+P869 -> 47 | S869: MORCOM
A870: BEST PLAYERS
A871: COBURG | C871: WILLOX | E871: KIGHT | H871: RUDOLPH | K871: MEARS | N871: GRIFFITHS | Q871: UHE
A872: SANDRINGHAM | C872: LUNN | E872: DOBSON | H872: BECKTON | K872: FITZGERALD | N872: JAMIESON | Q872: RAYMENT
A873: GOALKICKERS
A874: COBURG | C874: MEARS 5 | F874: DUNCAN 3 | J874: BROOM | M874: STOCKDALE
A875: SANDRINGHAM | C875: FITZGERALD 2 | F875: BECKTON 2 | J875: RAYMENT | M875: L JOHNSTONE
A877: YARRAVILLE | C877: 2 | D877: 5 | E877: =C877*6+D877 -> 17 | G877: 8 | H877: 14 | I877: =G877*6+H877 -> 62 | K877: 11 | L877: 16 | M877: =K877*6+L877 -> 82 | O877: 15 | P877: 22 | Q877: =O877*6+P877 -> 112 | S877: YARRAVILLE
A878: OAKLEIGH | C878: 3 | D878: 5 | E878: =C878*6+D878 -> 23 | G878: 4 | H878: 6 | I878: =G878*6+H878 -> 30 | K878: 7 | L878: 18 | M878: =K878*6+L878 -> 60 | O878: 8 | P878: 20 | Q878: =O878*6+P878 -> 68 | S878: STUART
A879: BEST PLAYERS
A880: YARRAVILLE | C880: SHEEHAN | F880: J BUCKLEY | I880: COPPOCK | L880: CAMERON | O880: WARDEN | R880: WUNHYM
A881: OAKLEIGH | C881: WATSON | F881: WITHERS | I881: FRASER | L881: DEAN | O881: CRAMERI | R881: DENNING
A882: GOALKICKERS
A883: YARRAVILLE | C883: J BUCKLEY 5 | F883: SHEEHAN 4 | I883: SIMPSON 2 | L883: McGRATH | O883: CAMERON | Q883: PETERS | S883: FISHER
A884: OAKLEIGH | C884: DENNING 3 | F884: DEAN 3 | I884: WATSON | L884: HUTCHESON
A886: PORT MELBOURNE | C886: 1 | D886: 1 | E886: =C886*6+D886 -> 7 | G886: 8 | H886: 6 | I886: =G886*6+H886 -> 54 | K886: 8 | L886: 8 | M886: =K886*6+L886 -> 56 | O886: 13 | P886: 13 | Q886: =O886*6+P886 -> 91 | S886: WILLIAMSTOWN
A887: WILLIAMSTOWN | C887: 4 | D887: 9 | E887: =C887*6+D887 -> 33 | G887: 6 | H887: 10 | I887: =G887*6+H887 -> 46 | K887: 6 | L887: 13 | M887: =K887*6+L887 -> 49 | O887: 8 | P887: 13 | Q887: =O887*6+P887 -> 61 | S887: GLOVER
A888: BEST PLAYERS
A889: PORT MELBOURNE | C889: LOVETT | F889: BEDFORD | I889: LOWRIE | L889: MURPHY | O889: KEATING | R889: LAHIFF
A890: WILLIAMSTOWN | C890: McCABE | F890: SYKES | I890: DIXON | L890: L DREW | O890: TAYLOR | R890: BLAKE
A891: GOALKICKERS
A892: PORT MELBOURNE | C892: BEDFORD 6 | F892: LAHIFF 3 | I892: KEATING 2 | L892: REES | N892: TUITE
A893: WILLIAMSTOWN | C893: BARNES 3 | F893: BLAKE 2 | I893: BYRNE | K893: ADDISON | M893: McCABE
A895: PRESTON | C895: 3 | D895: 0 | E895: =C895*6+D895 -> 18 | G895: 7 | H895: 4 | I895: =G895*6+H895 -> 46 | K895: 9 | L895: 7 | M895: =K895*6+L895 -> 61 | O895: 11 | P895: 9 | Q895: =O895*6+P895 -> 75 | S895: PRESTON
A896: CAMBERWELL | C896: 5 | D896: 2 | E896: =C896*6+D896 -> 32 | G896: 8 | H896: 3 | I896: =G896*6+H896 -> 51 | K896: 8 | L896: 8 | M896: =K896*6+L896 -> 56 | O896: 9 | P896: 12 | Q896: =O896*6+P896 -> 66 | S896: MURRAY
A897: BEST PLAYERS
A898: PRESTON | C898: F SPARGO | F898: DAVIE | I898: DOWLING | L898: WALSH | O898: WARR | R898: BIRD
A899: CAMBERWELL | C899: R WILLIAMS | F899: LAWN | I899: LUFF | L899: JONES | O899: MASON | R899: DYBALL
A900: GOALKICKERS
A901: PRESTON | C901: WARR 4 | F901: DINEEN 2 | I901: WALSH | K901: HARDING | M901: DAVIE | O901: HEARN | Q901: BIRD
A902: CAMBERWELL | C902: LUFF 5 | F902: LAWN 2 | I902: MASON | K902: BARNETT
A904: ROUND 17 | E904: 5TH AUGUST | J904: WEATHER | M904: FINE STRONG NORTH WIND | S904: PLAYED AT
D905: 1ST QTR | H905: 2ND QTR | L905: 3RD QTR | P905: FINAL | S905: NORTHCOTE
A906: NORTHCOTE | C906: 1 | D906: 2 | E906: =C906*6+D906 -> 8 | G906: 5 | H906: 4 | I906: =G906*6+H906 -> 34 | K906: 9 | L906: 8 | M906: =K906*6+L906 -> 62 | O906: 12 | P906: 12 | Q906: =O906*6+P906 -> 84 | S906: UMPIRE | X906: LADDER | AB906: ROUND | AD906: 17
A907: YARRAVILLE | C907: 1 | D907: 4 | E907: =C907*6+D907 -> 10 | G907: 5 | H907: 7 | I907: =G907*6+H907 -> 37 | K907: 7 | L907: 8 | M907: =K907*6+L907 -> 50 | O907: 9 | P907: 10 | Q907: =O907*6+P907 -> 64 | S907: NOWLAN
A908: BEST PLAYERS | W908: TEAM | X908: W | Y908: L | Z908: D | AA908: FOR | AB908: AGST | AC908: % | AD908: PTS
A909: NORTHCOTE | C909: ROWE | F909: WOODS | I909: GOULLETT | L909: POWELL | N909: ROSS | Q909: BROWN
A910: YARRAVILLE | C910: WARDEN | F910: CAMERON | I910: EVANS | L910: WHITE | N910: SHEEHAN | Q910: WUNHYM | W910: NORTHCOTE | X910: 13 | Y910: 2 | Z910: 2 | AA910: 1737 | AB910: 1278 | AC910: 135.91549295774647 | AD910: 56
A911: GOALKICKERS | W911: YARRAVILLE | X911: 12 | Y911: 5 | Z911: 0 | AA911: 1592 | AB911: 1278 | AC911: 124.56964006259781 | AD911: 48
A912: NORTHCOTE | C912: SEYMOUR 4 | F912: ROSS 2 | I912: BROWN 2 | L912: SMITH | N912: GOULLET | Q912: ROWE | S912: FLINN | W912: SANDRINGHAM | X912: 11 | Y912: 5 | Z912: 1 | AA912: 1758 | AB912: 1435 | AC912: 122.50871080139373 | AD912: 46
A913: YARRAVILLE | C913: J BUCKLEY 3 | F913: McGRATH 2 | I913: WARDEN 2 | L913: SHEEHAN | N913: EVANS | W913: PORT MELBOURNE | X913: 11 | Y913: 5 | Z913: 1 | AA913: 1665 | AB913: 1407 | AC913: 118.33688699360341 | AD913: 46
A915: PORT MELBOURNE | C915: 3 | D915: 8 | E915: =C915*6+D915 -> 26 | G915: 7 | H915: 9 | I915: =G915*6+H915 -> 51 | K915: 9 | L915: 11 | M915: =K915*6+L915 -> 65 | O915: 13 | P915: 16 | Q915: =O915*6+P915 -> 94 | S915: PORT MELBOURNE | W915: COBURG | X915: 11 | Y915: 5 | Z915: 1 | AA915: 1566 | AB915: 1329 | AC915: 117.83295711060948 | AD915: 46
A916: OAKLEIGH | C916: 0 | D916: 2 | E916: =C916*6+D916 -> 2 | G916: 1 | H916: 7 | I916: =G916*6+H916 -> 13 | K916: 2 | L916: 8 | M916: =K916*6+L916 -> 20 | O916: 4 | P916: 9 | Q916: =O916*6+P916 -> 33 | S916: MURRAY | W916: CAMBERWELL | X916: 10 | Y916: 7 | Z916: 0 | AA916: 1687 | AB916: 1480 | AC916: 113.98648648648648 | AD916: 40
A917: BEST PLAYERS | W917: PRESTON | X917: 9 | Y917: 7 | Z917: 1 | AA917: 1495 | AB917: 1371 | AC917: 109.04449307075127 | AD917: 38
A918: PORT MELBOURNE | C918: GARBUTT | F918: LEGGO | I918: BEDFORD | K918: TUITE | N918: L KEATING | Q918: REES | W918: BRIGHTON | X918: 6 | Y918: 10 | Z918: 1 | AA918: 1520 | AB918: 1780 | AC918: 85.393258426966298 | AD918: 26
A919: OAKLEIGH | C919: WITHERS | F919: BAKER | I919: R SMITH | K919: McALLISTER | N919: DENNING | Q919: MUDGE | W919: WILLIAMSTOWN | X919: 5 | Y919: 12 | Z919: 0 | AA919: 1270 | AB919: 1554 | AC919: 81.724581724581725 | AD919: 20
A920: GOALKICKERS | W920: OAKLEIGH | X920: 5 | Y920: 12 | Z920: 0 | AA920: 1303 | AB920: 1725 | AC920: 75.536231884057969 | AD920: 20
A921: PORT MELBOURNE | C921: BEDFORD 8 | F921: RUSDEN 2 | I921: KEATING | L921: LAHIFF | N921: JULIER | W921: PRAHRAN | X921: 4 | Y921: 12 | Z921: 1 | AA921: 1450 | AB921: 1682 | AC921: 86.206896551724142 | AD921: 18
A922: OAKLEIGH | C922: DENNING | F922: BAKER | I922: GOULD | L922: DEAN | W922: BRUNSWICK | X922: 1 | Y922: 16 | Z922: 0 | AA922: 1123 | AB922: 1847 | AC922: 60.801299404439632 | AD922: 4
A924: COBURG | C924: 3 | D924: 1 | E924: =C924*6+D924 -> 19 | G924: 9 | H924: 7 | I924: =G924*6+H924 -> 61 | K924: 11 | L924: 13 | M924: =K924*6+L924 -> 79 | O924: 15 | P924: 16 | Q924: =O924*6+P924 -> 106 | S924: TOORAK PARK
A925: PRAHRAN | C925: 3 | D925: 8 | E925: =C925*6+D925 -> 26 | G925: 4 | H925: 8 | I925: =G925*6+H925 -> 32 | K925: 9 | L925: 10 | M925: =K925*6+L925 -> 64 | O925: 10 | P925: 12 | Q925: =O925*6+P925 -> 72 | S925: STUART
A926: BEST PLAYERS
A927: COBURG | C927: JENKINS | F927: STOCKDALE | I927: UHE | L927: PROUDFOOT | O927: MEARS | R927: DUNCAN
A928: PRAHRAN | C928: BRENCHLEY | F928: HAWKINS | I928: JORDAN | L928: THOMPSON | O928: WHITEHEAD | R928: EASON
A929: GOALKICKERS
A930: COBURG | C930: MEARS 3 | F930: DUNCAN 3 | I930: BROOM 2 | K930: KIGHT 2 | M930: STOCKDALE 2 | P930: PROUDFOOT | S930: WILLOX | U930: VOIGHT
A931: PRAHRAN | C931: BRENCHLEY 3 | F931: THOMPSON 3 | J931: HAWKINS 2 | M931: JORDAN 2
A933: WILLIAMSTOWN | C933: 5 | D933: 6 | E933: =C933*6+D933 -> 36 | G933: 5 | H933: 8 | I933: =G933*6+H933 -> 38 | K933: 8 | L933: 13 | M933: =K933*6+L933 -> 61 | O933: 9 | P933: 14 | Q933: =O933*6+P933 -> 68 | S933: ELSTERNWICK PARK
A934: BRIGHTON | C934: 0 | D934: 1 | E934: =C934*6+D934 -> 1 | G934: 4 | H934: 5 | I934: =G934*6+H934 -> 29 | K934: 4 | L934: 7 | M934: =K934*6+L934 -> 31 | O934: 9 | P934: 12 | Q934: =O934*6+P934 -> 66 | S934: GLOVER
A935: BEST PLAYERS
A936: WILLIAMSTOWN | C936: STANBRIDGE | F936: ADDISON | I936: SYKES | L936: SMITH | O936: BARNES | R936: DIXON
A937: BRIGHTON | C937: PENNY | F937: TOMLINS | I937: DEANE | L937: POULTER | O937: BURNES | R937: HILL
A938: GOALKICKERS
A939: WILLIAMSTOWN | C939: ADDISON 3 | F939: SMITH 3 | I939: TAYLOR | L939: HILL | N939: BROOKES
A940: BRIGHTON | C940: BURNES 4 | F940: POULTER 2 | I940: PENNY | L940: HILL | N940: DEAN
A942: PRESTON | C942: 8 | D942: 10 | E942: =C942*6+D942 -> 58 | G942: 9 | H942: 12 | I942: =G942*6+H942 -> 66 | K942: 16 | L942: 20 | M942: =K942*6+L942 -> 116 | O942: 19 | P942: 24 | Q942: =O942*6+P942 -> 138 | S942: PRESTON
A943: BRUNSWICK | C943: 0 | D943: 0 | E943: =C943*6+D943 -> 0 | G943: 4 | H943: 6 | I943: =G943*6+H943 -> 30 | K943: 4 | L943: 7 | M943: =K943*6+L943 -> 31 | O943: 8 | P943: 15 | Q943: =O943*6+P943 -> 63 | S943: KILKENNY
A944: BEST PLAYERS
A945: PRESTON | C945: McEACHARN | F945: WARR | I945: CAMERON | L945: DOYLE | O945: MONOHAN | R945: DINEEN
A946: BRUNSWICK | C946: BLACKMORE | F946: RALEIGH | I946: GILLON | L946: WATTS | O946: MORGAN | R946: MAYNES
A947: GOALKICKERS
A948: PRESTON | C948: MORGAN 3 | F948: BREWIS 2 | I948: WARR 2 | K948: DINEEN 2 | M948: CAMERON 2 | P948: DOYLE 2 | R948: ROBINSON 2 | W948: HEARN 2 | Y948: HARDING | AB948: BIRD
A949: BRUNSWICK | C949: BLACKMORE 3 | F949: GILLON 2 | I949: MAYNES | K949: RALEIGH | M949: GRACE
A951: SANDRINGHAM | C951: 7 | D951: 5 | E951: =C951*6+D951 -> 47 | G951: 8 | H951: 9 | I951: =G951*6+H951 -> 57 | K951: 14 | L951: 17 | M951: =K951*6+L951 -> 101 | O951: 15 | P951: 21 | Q951: =O951*6+P951 -> 111 | S951: BEACH ROAD
A952: CAMBERWELL | C952: 2 | D952: 1 | E952: =C952*6+D952 -> 13 | G952: 9 | H952: 8 | I952: =G952*6+H952 -> 62 | K952: 9 | L952: 13 | M952: =K952*6+L952 -> 67 | O952: 14 | P952: 20 | Q952: =O952*6+P952 -> 104 | S952: McKINNON
A953: BEST PLAYERS
A954: SANDRINGHAM | C954: RAYMENT | F954: CAHIR | I954: SMAIL | L954: MILLER | O954: BECKTON | R954: MICHAELSON
A955: CAMBERWELL | C955: DYBALL | F955: LASKY | I955: PIERCE | L955: R WILLIAMS | O955: WARTMAN | R955: MASON
A956: GOALKICKERS
A957: SANDRINGHAM | C957: RAYMENT 4 | F957: CAHIR 4 | I957: JOHNSON 3 | L957: FITZGERALD 3 | O957: JAMIESON
A958: CAMBERWELL | C958: LUFF 4 | F958: LASKY 3 | I958: CLAMP 3 | L958: LAWN 2 | O958: FYFE | Q958: O'NEILL
A960: ROUND 18 | E960: 12TH AUGUST | H960: WEATHER | J960: COOL CLOUDY WEST WIND SOME LIGHT SHOWERS | S960: PLAYED AT
D961: 1ST QTR | H961: 2ND QTR | L961: 3RD QTR | P961: FINAL | S961: NORTHCOTE
A962: NORTHCOTE | C962: 4 | D962: 4 | E962: =C962*6+D962 -> 28 | G962: 4 | H962: 7 | I962: =G962*6+H962 -> 31 | K962: 5 | L962: 12 | M962: =K962*6+L962 -> 42 | O962: 8 | P962: 13 | Q962: =O962*6+P962 -> 61 | S962: UMPIRE | X962: LADDER | AB962: ROUND | AD962: 18
A963: PORT MELBOURNE | C963: 2 | D963: 3 | E963: =C963*6+D963 -> 15 | G963: 5 | H963: 4 | I963: =G963*6+H963 -> 34 | K963: 6 | L963: 7 | M963: =K963*6+L963 -> 43 | O963: 8 | P963: 11 | Q963: =O963*6+P963 -> 59 | S963: McKINNON
A964: BEST PLAYERS | W964: TEAM | X964: W | Y964: L | Z964: D | AA964: FOR | AB964: AGST | AC964: % | AD964: PTS
A965: NORTHCOTE | C965: WOODS | E965: GOULLETT | H965: ROSS | K965: COLE | N965: HUMPHRIES | Q965: ROWE
A966: PORT MELBOURNE | C966: PERRETT | E966: LEGGO | H966: REES | K966: JULIER | N966: LAHIFF | Q966: BEDFORD | W966: NORTHCOTE | X966: 14 | Y966: 2 | Z966: 2 | AA966: 1798 | AB966: 1337 | AC966: 134.48017950635753 | AD966: 60
A967: GOALKICKERS | W967: YARRAVILLE | X967: 13 | Y967: 5 | Z967: 0 | AA967: 1766 | AB967: 1368 | AC967: 129.09356725146199 | AD967: 52
A968: NORTHCOTE | C968: SEYMOUR 2 | F968: CONNELL 2 | I968: GRAY | K968: BROWN | M968: COLE | O968: GOULLET | W968: SANDRINGHAM | X968: 12 | Y968: 5 | Z968: 1 | AA968: 1833 | AB968: 1501 | AC968: 122.11858760826117 | AD968: 50
A969: PORT MELBOURNE | C969: BEDFROD 4 | F969: ALDRIDGE 2 | I969: KEATING | K969: HURLEY | W969: COBURG | X969: 12 | Y969: 5 | Z969: 1 | AA969: 1648 | AB969: 1400 | AC969: 117.71428571428571 | AD969: 50
A971: COBURG | C971: 3 | D971: 5 | E971: =C971*6+D971 -> 23 | G971: 6 | H971: 7 | I971: =G971*6+H971 -> 43 | K971: 11 | L971: 13 | M971: =K971*6+L971 -> 79 | O971: 11 | P971: 16 | Q971: =O971*6+P971 -> 82 | S971: COBURG | W971: PORT MELBOURNE | X971: 11 | Y971: 6 | Z971: 1 | AA971: 1724 | AB971: 1468 | AC971: 117.43869209809264 | AD971: 46
A972: BRIGHTON | C972: 3 | D972: 2 | E972: =C972*6+D972 -> 20 | G972: 6 | H972: 5 | I972: =G972*6+H972 -> 41 | K972: 8 | L972: 13 | M972: =K972*6+L972 -> 61 | O972: 9 | P972: 17 | Q972: =O972*6+P972 -> 71 | S972: HASSETT | W972: CAMBERWELL | X972: 11 | Y972: 7 | Z972: 0 | AA972: 1829 | AB972: 1564 | AC972: 116.94373401534527 | AD972: 44
A973: BEST PLAYERS | W973: PRESTON | X973: 10 | Y973: 7 | Z973: 1 | AA973: 1595 | AB973: 1446 | AC973: 110.30428769017981 | AD973: 42
A974: COBURG | C974: DUNCAN | F974: VOIGHT | I974: UHE | L974: HOGAN | O974: HARRIS | Q974: BERTRAM | W974: BRIGHTON | X974: 6 | Y974: 11 | Z974: 1 | AA974: 1591 | AB974: 1862 | AC974: 85.445757250268528 | AD974: 26
A975: BRIGHTON | C975: LILBURNE | F975: TOMLINS | I975: GOULDSWORTHY | L975: W O'BRIEN | O975: DEANE | Q975: TUCKER | W975: WILLIAMSTOWN | X975: 5 | Y975: 13 | Z975: 0 | AA975: 1336 | AB975: 1629 | AC975: 82.013505217925101 | AD975: 20
A976: GOALKICKERS | W976: OAKLEIGH | X976: 5 | Y976: 13 | Z976: 0 | AA976: 1378 | AB976: 1825 | AC976: 75.506849315068493 | AD976: 20
A977: COBURG | C977: DUNCAN 6 | F977: VOIGHT 2 | I977: MEARS | K977: BROOM | M977: KIGHT | W977: PRAHRAN | X977: 4 | Y977: 13 | Z977: 1 | AA977: 1540 | AB977: 1856 | AC977: 82.974137931034477 | AD977: 18
A978: BRIGHTON | C978: O'BRIEN 3 | F978: POULTER 2 | I978: PENNY | K978: TUCKER | M978: DEAN | O978: BURNES | W978: BRUNSWICK | X978: 1 | Y978: 17 | Z978: 0 | AA978: 1207 | AB978: 1989 | AC978: 60.683760683760681 | AD978: 4
A980: SANDRINGHAM | C980: 2 | D980: 4 | E980: =C980*6+D980 -> 16 | G980: 7 | H980: 5 | I980: =G980*6+H980 -> 47 | K980: 9 | L980: 6 | M980: =K980*6+L980 -> 60 | O980: 11 | P980: 9 | Q980: =O980*6+P980 -> 75 | S980: WILLIAMSTOWN
A981: WILLIAMSTOWN | C981: 4 | D981: 1 | E981: =C981*6+D981 -> 25 | G981: 6 | H981: 7 | I981: =G981*6+H981 -> 43 | K981: 7 | L981: 10 | M981: =K981*6+L981 -> 52 | O981: 9 | P981: 12 | Q981: =O981*6+P981 -> 66 | S981: MURRAY
A982: BEST PLAYERS
A983: SANDRINGHAM | C983: THOMS | E983: SMAIL | H983: DE LUCA | K983: RAYMENT | N983: CAHIR | Q983: YOUNG
A984: WILLIAMSTOWN | C984: SYKES | E984: BLAKE | H984: STANBRIDGE | K984: ADDISON | N984: NEAL | Q984: C DREW
A985: GOALKICKERS
A986: SANDRINGHAM | C986: CAHIR 3 | E986: JOHNSON 2 | H986: RAYMENT 2 | K986: DE LUCA | M986: FITZGERALD | P986: BECKTON | S986: CHALLIS
A987: WILLIAMSTOWN | C987: BLAKE 3 | E987: MCCABE 2 | H987: BYRNE | J987: C DREW | L987: BROOKES | O987: STANBRIDGE
A989: CAMBERWELL | C989: 10 | D989: 3 | E989: =C989*6+D989 -> 63 | G989: 12 | H989: 5 | I989: =G989*6+H989 -> 77 | K989: 18 | L989: 10 | M989: =K989*6+L989 -> 118 | O989: 22 | P989: 10 | Q989: =O989*6+P989 -> 142 | S989: CAMBERWELL
A990: BRUNSWICK | C990: 2 | D990: 4 | E990: =C990*6+D990 -> 16 | G990: 6 | H990: 7 | I990: =G990*6+H990 -> 43 | K990: 6 | L990: 9 | M990: =K990*6+L990 -> 45 | O990: 12 | P990: 12 | Q990: =O990*6+P990 -> 84 | S990: NOWLAN
A991: BEST PLAYERS
A992: CAMBERWELL | C992: DYBALL | F992: O'NEILL | I992: LUFF | L992: LASKY | O992: BOOTHMAN | R992: JONES
A993: BRUNSWICK | C993: BLACKMORE | F993: BRIGHT | I993: THOMPSON | L993: DOWLING | O993: BEARD | R993: REID
A994: GOALKICKERS
A995: CAMBERWELL | C995: LUFF 10 | E995: O'NEILL 3 | G995: MASON 2 | I995: TROTTER 2 | L995: BOOTHMAN 2 | O995: LASKY | Q995: FYFE | S995: ANDREW
A996: BRUNSWICK | C996: BLACKMORE 4 | F996: BEARD 2 | I996: GILLON | K996: RALEIGH | M996: A THOMPSON | P996: BRIGHT | R996: LEURI | T996: KENNETT
A998: YARRAVILLE | C998: 6 | D998: 9 | E998: =C998*6+D998 -> 45 | G998: 11 | H998: 16 | I998: =G998*6+H998 -> 82 | K998: 18 | L998: 19 | M998: =K998*6+L998 -> 127 | O998: 25 | P998: 24 | Q998: =O998*6+P998 -> 174 | S998: YARRAVILLE
A999: PRAHRAN | C999: 1 | D999: 5 | E999: =C999*6+D999 -> 11 | G999: 4 | H999: 7 | I999: =G999*6+H999 -> 31 | K999: 8 | L999: 15 | M999: =K999*6+L999 -> 63 | O999: 12 | P999: 18 | Q999: =O999*6+P999 -> 90 | S999: MILLER
A1000: BEST PLAYERS
A1001: YARRAVILLE | C1001: J BUCKLEY | F1001: BOURKE | I1001: WHITE | L1001: WARDEN | O1001: PETERS | Q1001: HAFFENDON
A1002: PRAHRAN | C1002: WHITE | F1002: EASON | I1002: BRENCHLEY | L1002: BENSTEAD | O1002: HYDE | Q1002: NECK
A1003: GOALKICKERS
A1004: YARRAVILLE | C1004: J BUCKLEY 15 | G1004: HAFFENDON 3 | J1004: McGRATH 2 | M1004: CAMERON 2 | P1004: PETERS | R1004: EVANS | T1004: WARDEN
A1005: PRAHRAN | C1005: HAWKINS 4 | F1005: BRENCHLEY 2 | I1005: JORDAN 2 | L1005: N WILLIAMS | O1005: WHITE | Q1005: BINSTEAD | T1005: DIXON
A1007: PRESTON | C1007: 2 | D1007: 5 | E1007: =C1007*6+D1007 -> 17 | G1007: 6 | H1007: 10 | I1007: =G1007*6+H1007 -> 46 | K1007: 12 | L1007: 12 | M1007: =K1007*6+L1007 -> 84 | O1007: 14 | P1007: 16 | Q1007: =O1007*6+P1007 -> 100 | S1007: OAKLEIGH
A1008: OAKLEIGH | C1008: 5 | D1008: 1 | E1008: =C1008*6+D1008 -> 31 | G1008: 6 | H1008: 3 | I1008: =G1008*6+H1008 -> 39 | K1008: 10 | L1008: 8 | M1008: =K1008*6+L1008 -> 68 | O1008: 11 | P1008: 9 | Q1008: =O1008*6+P1008 -> 75 | S1008: KILKENNY
A1009: BEST PLAYERS
A1010: PRESTON | C1010: UNDERHILL | F1010: F SPARGO | I1010: WARR | L1010: CAMERON | O1010: MONOHAN | R1010: DINEEN
A1011: OAKLEIGH | C1011: MUDGE | F1011: R SMITH | I1011: CRAMERI | L1011: FLEMING | O1011: DENNING | R1011: POWELL
A1012: GOALKICKERS
A1013: PRESTON | C1013: HEARN 5 | E1013: WARR 2 | G1013: CAMERON 2 | J1013: BIRD 2 | L1013: HARDING | N1013: DINEEN | P1013: MONOHAN
A1014: OAKLEIGH | C1014: FRASER 3 | F1014: DENNING 3 | I1014: FLEMING | K1014: WITHERS | M1014: BAKER | O1014: WATSON | Q1014: DEAN
A1016: ROUND 19 | E1016: 19TH AUGUST | J1016: WEATHER | M1016: COOL CLOUDY S.W. WIND | S1016: PLAYED AT
D1017: 1ST QTR | H1017: 2ND QTR | L1017: 3RD QTR | P1017: FINAL | S1017: BEACH ROAD
A1018: SANDRINGHAM | C1018: 4 | D1018: 6 | E1018: =C1018*6+D1018 -> 30 | G1018: 6 | H1018: 17 | I1018: =G1018*6+H1018 -> 53 | K1018: 9 | L1018: 19 | M1018: =K1018*6+L1018 -> 73 | O1018: 13 | P1018: 25 | Q1018: =O1018*6+P1018 -> 103 | S1018: UMPIRE | X1018: LADDER | AB1018: ROUND | AD1018: 19
A1019: NORTHCOTE | C1019: 1 | D1019: 3 | E1019: =C1019*6+D1019 -> 9 | G1019: 2 | H1019: 5 | I1019: =G1019*6+H1019 -> 17 | K1019: 6 | L1019: 12 | M1019: =K1019*6+L1019 -> 48 | O1019: 8 | P1019: 14 | Q1019: =O1019*6+P1019 -> 62 | S1019: MURRAY
A1020: BEST PLAYERS | W1020: TEAM | X1020: W | Y1020: L | Z1020: D | AA1020: FOR | AB1020: AGST | AC1020: % | AD1020: PTS
A1021: SANDRINGHAM | C1021: LUNN | E1021: DE LUCA | H1021: CAHIR | K1021: KEMP | N1021: THOMS | Q1021: BECKTON
A1022: NORTHCOTE | C1022: WOODS | E1022: SMITH | H1022: ROSS | K1022: WILSON | N1022: HUMPHRIES | Q1022: GARRETT | W1022: NORTHCOTE | X1022: 14 | Y1022: 3 | Z1022: 2 | AA1022: 1860 | AB1022: 1440 | AC1022: 129.16666666666666 | AD1022: 60
A1023: GOALKICKERS | W1023: SANDRINGHAM | X1023: 13 | Y1023: 5 | Z1023: 1 | AA1023: 1936 | AB1023: 1563 | AC1023: 123.86436340371081 | AD1023: 54
A1024: SANDRINGHAM | C1024: JOHNSON 4 | F1024: SMAIL 4 | I1024: CAHIR 3 | K1024: FITZGERALD | N1024: ANDERSON | W1024: COBURG | X1024: 13 | Y1024: 5 | Z1024: 1 | AA1024: 1716 | AB1024: 1463 | AC1024: 117.29323308270676 | AD1024: 54
A1025: NORTHCOTE | C1025: SEYMOUR 3 | F1025: SMITH | I1025: COLE | K1025: ROWE | M1025: BRAY | O1025: CONNELL | W1025: YARRAVILLE | X1025: 13 | Y1025: 6 | Z1025: 0 | AA1025: 1829 | AB1025: 1436 | AC1025: 127.36768802228413 | AD1025: 52
A1027: PRAHRAN | C1027: 2 | D1027: 2 | E1027: =C1027*6+D1027 -> 14 | G1027: 5 | H1027: 6 | I1027: =G1027*6+H1027 -> 36 | K1027: 6 | L1027: 8 | M1027: =K1027*6+L1027 -> 44 | O1027: 13 | P1027: 14 | Q1027: =O1027*6+P1027 -> 92 | S1027: PRESTON | W1027: PORT MELBOURNE | X1027: 12 | Y1027: 6 | Z1027: 1 | AA1027: 1808 | AB1027: 1528 | AC1027: 118.32460732984293 | AD1027: 50
A1028: PRESTON | C1028: 6 | D1028: 4 | E1028: =C1028*6+D1028 -> 40 | G1028: 7 | H1028: 5 | I1028: =G1028*6+H1028 -> 47 | K1028: 12 | L1028: 11 | M1028: =K1028*6+L1028 -> 83 | O1028: 13 | P1028: 12 | Q1028: =O1028*6+P1028 -> 90 | S1028: SCATES | W1028: CAMBERWELL | X1028: 11 | Y1028: 8 | Z1028: 0 | AA1028: 1889 | AB1028: 1648 | AC1028: 114.62378640776699 | AD1028: 44
A1029: BEST PLAYERS | W1029: PRESTON | X1029: 10 | Y1029: 8 | Z1029: 1 | AA1029: 1685 | AB1029: 1538 | AC1029: 109.55786736020806 | AD1029: 42
A1030: PRAHRAN | C1030: HYDE | F1030: WHITE | I1030: BRENCHLEY | L1030: HAWKINS | O1030: F SMITH | Q1030: WELLS | W1030: BRIGHTON | X1030: 7 | Y1030: 11 | Z1030: 1 | AA1030: 1685 | AB1030: 1928 | AC1030: 87.396265560165972 | AD1030: 30
A1031: PRESTON | C1031: CAMERON | F1031: ROBINSON | I1031: DAVIE | L1031: MONOHAN | O1031: F SPARGO | Q1031: DINEEN | W1031: PRAHRAN | X1031: 5 | Y1031: 13 | Z1031: 1 | AA1031: 1632 | AB1031: 1946 | AC1031: 83.864337101747168 | AD1031: 22
A1032: GOALKICKERS | W1032: WILLIAMSTOWN | X1032: 5 | Y1032: 14 | Z1032: 0 | AA1032: 1382 | AB1032: 1698 | AC1032: 81.389870435806827 | AD1032: 20
A1033: PRAHRAN | C1033: HAWKINS 7 | F1033: BRENCHLEY 3 | I1033: TRIM | K1033: WELLS | M1033: WHITE | W1033: OAKLEIGH | X1033: 5 | Y1033: 14 | Z1033: 0 | AA1033: 1444 | AB1033: 1919 | AC1033: 75.247524752475243 | AD1033: 20
A1034: PRESTON | C1034: HEARN 4 | E1034: McSWAIN 2 | H1034: BIRD 2 | J1034: DINEEN | L1034: CAMERON | N1034: DAVIE | P1034: ROBINSON | R1034: STOKES | W1034: BRUNSWICK | X1034: 2 | Y1034: 17 | Z1034: 0 | AA1034: 1276 | AB1034: 2035 | AC1034: 62.702702702702702 | AD1034: 8
A1036: COBURG | C1036: 0 | D1036: 1 | E1036: =C1036*6+D1036 -> 1 | G1036: 4 | H1036: 6 | I1036: =G1036*6+H1036 -> 30 | K1036: 6 | L1036: 10 | M1036: =K1036*6+L1036 -> 46 | O1036: 9 | P1036: 14 | Q1036: =O1036*6+P1036 -> 68 | S1036: YARRAVILLE
A1037: YARRAVILLE | C1037: 0 | D1037: 8 | E1037: =C1037*6+D1037 -> 8 | G1037: 1 | H1037: 10 | I1037: =G1037*6+H1037 -> 16 | K1037: 5 | L1037: 14 | M1037: =K1037*6+L1037 -> 44 | O1037: 8 | P1037: 15 | Q1037: =O1037*6+P1037 -> 63 | S1037: MILLER
A1038: BEST PLAYERS
A1039: COBURG | C1039: RUDOLPH | F1039: KIGHT | I1039: PROUDFOOT | L1039: UHE | N1039: GRIFFITHS | Q1039: STOCKDALE
A1040: YARRAVILLE | C1040: QUIGG | F1040: BAKER | I1040: WARDEN | L1040: FISHER | N1040: EVANS | Q1040: CAMERON
A1041: GOALKICKERS
A1042: COBURG | C1042: DUNCAN 5 | F1042: MEARS 2 | I1042: PROUDFOOT | L1042: HARRIS
A1043: YARRAVILLE | C1043: SHEEHAN 2 | F1043: EVANS 2 | I1043: J BUCKLEY 2 | L1043: CAMERON | N1043: PETERS
A1045: BRIGHTON | C1045: 3 | D1045: 9 | E1045: =C1045*6+D1045 -> 27 | G1045: 3 | H1045: 11 | I1045: =G1045*6+H1045 -> 29 | K1045: 8 | L1045: 16 | M1045: =K1045*6+L1045 -> 64 | O1045: 13 | P1045: 16 | Q1045: =O1045*6+P1045 -> 94 | S1045: ELSTERNWICK PARK
A1046: OAKLEIGH | C1046: 0 | D1046: 1 | E1046: =C1046*6+D1046 -> 1 | G1046: 4 | H1046: 7 | I1046: =G1046*6+H1046 -> 31 | K1046: 4 | L1046: 10 | M1046: =K1046*6+L1046 -> 34 | O1046: 9 | P1046: 12 | Q1046: =O1046*6+P1046 -> 66 | S1046: McKINNON
A1047: BEST PLAYERS
A1048: BRIGHTON | C1048: TUCKER | F1048: TOMLINS | I1048: HUNT | L1048: PENNY | O1048: STEWART | R1048: CANTWELL
A1049: OAKLEIGH | C1049: FLEMING | F1049: McALLISTER | I1049: WITHERS | L1049: WILTSHIRE | O1049: MUDGE | R1049: DEAN
A1050: GOALKICKERS
A1051: BRIGHTON | C1051: BURNES 3 | F1051: PENNY 2 | I1051: LILBURNE 2 | L1051: POULTER 2 | O1051: DEAN 2 | Q1051: TUCKER | T1051: HILL
A1052: OAKLEIGH | C1052: WITHERS 4 | F1052: DENNING 3 | I1052: DEAN 2
A1054: PORT MELBOURNE | C1054: 5 | D1054: 3 | E1054: =C1054*6+D1054 -> 33 | G1054: 7 | H1054: 6 | I1054: =G1054*6+H1054 -> 48 | K1054: 9 | L1054: 9 | M1054: =K1054*6+L1054 -> 63 | O1054: 12 | P1054: 12 | Q1054: =O1054*6+P1054 -> 84 | S1054: PORT MELBOURNE
A1055: CAMBERWELL | C1055: 3 | D1055: 3 | E1055: =C1055*6+D1055 -> 21 | G1055: 5 | H1055: 5 | I1055: =G1055*6+H1055 -> 35 | K1055: 6 | L1055: 11 | M1055: =K1055*6+L1055 -> 47 | O1055: 8 | P1055: 12 | Q1055: =O1055*6+P1055 -> 60 | S1055: BRANDON
A1056: BEST PLAYERS
A1057: PORT MELBOURNE | C1057: LAHIFF | E1057: GARBUTT | H1057: PLUMRIDGE | K1057: BEDFORD | N1057: MALTBY | Q1057: JULIEN
A1058: CAMBERWELL | C1058: LUFF | E1058: MASON | H1058: JONES | K1058: LAWN | N1058: WALLACE | Q1058: BOOTHMAN
A1059: GOALKICKERS
A1060: PORT MELBOURNE | C1060: KEATING 4 | F1060: BEDFORD 3 | I1060: LAHIFF 2 | K1060: MALTBY | M1060: TUITE | O1060: ALDRIDGE
A1061: CAMBERWELL | C1061: LUFF 2 | F1061: MASON | H1061: TROTTER | J1061: BOOTHMAN | M1061: LAWN | O1061: HENDERSON | R1061: DYBALL
A1063: BRUNSWICK | C1063: 5 | D1063: 3 | E1063: =C1063*6+D1063 -> 33 | G1063: 8 | H1063: 5 | I1063: =G1063*6+H1063 -> 53 | K1063: 8 | L1063: 6 | M1063: =K1063*6+L1063 -> 54 | O1063: 10 | P1063: 9 | Q1063: =O1063*6+P1063 -> 69 | S1063: BRUNSWICK
A1064: WILLIAMSTOWN | C1064: 1 | D1064: 1 | E1064: =C1064*6+D1064 -> 7 | G1064: 1 | H1064: 5 | I1064: =G1064*6+H1064 -> 11 | K1064: 3 | L1064: 9 | M1064: =K1064*6+L1064 -> 27 | O1064: 6 | P1064: 10 | Q1064: =O1064*6+P1064 -> 46 | S1064: NOWLAN
A1065: BEST PLAYERS
A1066: BRUNSWICK | C1066: BEARD | F1066: DOWLING | I1066: ARRELL | L1066: BLACKMORE | O1066: ANDERSON | R1066: MAYNES
A1067: WILLIAMSTOWN | C1067: STANBRIDGE | F1067: SYKES | I1067: BYRNE | L1067: BARNES | O1067: MARTIN | R1067: BROOKS
A1068: GOALKICKERS
A1069: BRUNSWICK | C1069: RALEIGH 3 | F1069: BLACKMORE 2 | J1069: MAYNES | M1069: BEARD | O1069: BRIGHT | Q1069: WATTS | S1069: KENNETT
A1070: WILLIAMSTOWN | C1070: BARNES 3 | F1070: JAENSCH | I1070: BYRNE | L1070: WILLIAMSON
A1072: ROUND 20 | E1072: 26TH AUGUST | J1072: WEATHER | M1072: FINE NORTH WIND | S1072: PLAYED AT
D1073: 1ST QTR | H1073: 2ND QTR | L1073: 3RD QTR | P1073: FINAL | S1073: COBURG
A1074: COBURG | C1074: 2 | D1074: 4 | E1074: =C1074*6+D1074 -> 16 | G1074: 3 | H1074: 4 | I1074: =G1074*6+H1074 -> 22 | K1074: 7 | L1074: 10 | M1074: =K1074*6+L1074 -> 52 | O1074: 12 | P1074: 13 | Q1074: =O1074*6+P1074 -> 85 | S1074: UMPIRE | X1074: LADDER | AB1074: ROUND | AD1074: 20
A1075: PORT MELBOURNE | C1075: 2 | D1075: 1 | E1075: =C1075*6+D1075 -> 13 | G1075: 8 | H1075: 6 | I1075: =G1075*6+H1075 -> 54 | K1075: 9 | L1075: 7 | M1075: =K1075*6+L1075 -> 61 | O1075: 12 | P1075: 10 | Q1075: =O1075*6+P1075 -> 82 | S1075: MILLER
A1076: BEST PLAYERS | W1076: TEAM | X1076: W | Y1076: L | Z1076: D | AA1076: FOR | AB1076: AGST | AC1076: % | AD1076: PTS
A1077: COBURG | C1077: RUDOLPH | F1077: HARRIS | I1077: BROOM | L1077: STOCKDALE | O1077: LOWE | Q1077: DUNCAN
A1078: PORT MELBOURNE | C1078: LOVETT | F1078: MALTBY | I1078: PERRETT | L1078: LEGGO | O1078: LAHIFF | Q1078: BEDFORD | W1078: NORTHCOTE | X1078: 15 | Y1078: 3 | Z1078: 2 | AA1078: 1971 | AB1078: 1520 | AC1078: 129.67105263157896 | AD1078: 64
A1079: GOALKICKERS | W1079: COBURG | X1079: 14 | Y1079: 5 | Z1079: 1 | AA1079: 1801 | AB1079: 1545 | AC1079: 116.56957928802589 | AD1079: 58
A1080: COBURG | C1080: DUNCAN 3 | F1080: HARRIS 3 | I1080: BROOM 2 | K1080: MEARS | M1080: LOWE | O1080: KIGHT | Q1080: J L HOGAN | W1080: SANDRINGHAM | X1080: 13 | Y1080: 6 | Z1080: 1 | AA1080: 2028 | AB1080: 1657 | AC1080: 122.3898611949306 | AD1080: 54
A1081: PORT MELBOURNE | C1081: BEDFORD 4 | F1081: LAHIFF 2 | I1081: KEATING | K1081: MALTBY | M1081: BROOKER | O1081: BILLS | Q1081: PAYNE | S1081: ATKINSON | W1081: YARRAVILLE | X1081: 13 | Y1081: 7 | Z1081: 0 | AA1081: 1946 | AB1081: 1556 | AC1081: 125.06426735218508 | AD1081: 52
A1083: BRIGHTON | C1083: 1 | D1083: 1 | E1083: =C1083*6+D1083 -> 7 | G1083: 3 | H1083: 10 | I1083: =G1083*6+H1083 -> 28 | K1083: 4 | L1083: 14 | M1083: =K1083*6+L1083 -> 38 | O1083: 14 | P1083: 17 | Q1083: =O1083*6+P1083 -> 101 | S1083: ELSTERNWICK PARK | W1083: PORT MELBOURNE | X1083: 12 | Y1083: 7 | Z1083: 1 | AA1083: 1890 | AB1083: 1613 | AC1083: 117.17296962182269 | AD1083: 50
A1084: BRUNSWICK | C1084: 0 | D1084: 5 | E1084: =C1084*6+D1084 -> 5 | G1084: 0 | H1084: 7 | I1084: =G1084*6+H1084 -> 7 | K1084: 5 | L1084: 11 | M1084: =K1084*6+L1084 -> 41 | O1084: 5 | P1084: 14 | Q1084: =O1084*6+P1084 -> 44 | S1084: BRANDON | W1084: CAMBERWELL | X1084: 12 | Y1084: 8 | Z1084: 0 | AA1084: 2009 | AB1084: 1765 | AC1084: 113.8243626062323 | AD1084: 48
A1085: BEST PLAYERS | W1085: PRESTON | X1085: 11 | Y1085: 8 | Z1085: 1 | AA1085: 1817 | AB1085: 1573 | AC1085: 115.51176096630643 | AD1085: 46
A1086: BRIGHTON | C1086: TUCKER | F1086: TOMLINS | I1086: HUNT | L1086: DEANE | N1086: W O'BRIEN | Q1086: M JOHNSTONE | W1086: BRIGHTON | X1086: 8 | Y1086: 11 | Z1086: 1 | AA1086: 1786 | AB1086: 1972 | AC1086: 90.567951318458412 | AD1086: 34
A1087: BRUNSWICK | C1087: BLACKMORE | F1087: BRIGHT | I1087: KENNEDY | L1087: DOWLING | N1087: MORGAN | Q1087: RALEIGH | W1087: OAKLEIGH | X1087: 6 | Y1087: 14 | Z1087: 0 | AA1087: 1538 | AB1087: 2011 | AC1087: 76.479363500745905 | AD1087: 24
A1088: GOALKICKERS | W1088: PRAHRAN | X1088: 5 | Y1088: 14 | Z1088: 1 | AA1088: 1712 | AB1088: 2057 | AC1088: 83.228001944579489 | AD1088: 22
A1089: BRIGHTON | C1089: POULTER 3 | F1089: DEAN 3 | H1089: PENNY 2 | J1089: LILBURNE 2 | M1089: TUCKER | O1089: HILL | P1089: O'BRIEN | R1089: BURNES | W1089: WILLIAMSTOWN | X1089: 5 | Y1089: 15 | Z1089: 0 | AA1089: 1417 | AB1089: 1830 | AC1089: 77.431693989071036 | AD1089: 20
A1090: BRUNSWICK | C1090: JONES 2 | F1090: DOWLING 2 | I1090: MUTIMER | W1090: BRUNSWICK | X1090: 2 | Y1090: 18 | Z1090: 0 | AA1090: 1320 | AB1090: 2136 | AC1090: 61.797752808988761 | AD1090: 8
A1092: OAKLEIGH | C1092: 3 | D1092: 3 | E1092: =C1092*6+D1092 -> 21 | G1092: 8 | H1092: 3 | I1092: =G1092*6+H1092 -> 51 | K1092: 14 | L1092: 7 | M1092: =K1092*6+L1092 -> 91 | O1092: 14 | P1092: 10 | Q1092: =O1092*6+P1092 -> 94 | S1092: OAKLEIGH
A1093: SANDRINGHAM | C1093: 4 | D1093: 3 | E1093: =C1093*6+D1093 -> 27 | G1093: 7 | H1093: 8 | I1093: =G1093*6+H1093 -> 50 | K1093: 8 | L1093: 12 | M1093: =K1093*6+L1093 -> 60 | O1093: 12 | P1093: 20 | Q1093: =O1093*6+P1093 -> 92 | S1093: LESTER
A1094: BEST PLAYERS
A1095: OAKLEIGH | C1095: WITHERS | F1095: MUDGE | I1095: MATHRICK | L1095: FLEMING | O1095: DEAN | R1095: RYAN
A1096: SANDRINGHAM | C1096: SMAIL | F1096: BECKTON | I1096: LUNN | L1096: THOMS | O1096: DE LUCA | R1096: KEMP
A1097: GOALKICKERS
A1098: OAKLEIGH | C1098: WITHERS 5 | F1098: FRASER 3 | I1098: FLEMING 2 | L1098: DENNING | N1098: BAKER | P1098: WATSON | R1098: DEAN
A1099: SANDRINGHAM | C1099: SMAIL 4 | E1099: JOHNSON 2 | H1099: FITZGERALD 2 | K1099: CAHIR 2 | M1099: YEMM | O1099: DOBSON
A1101: PRESTON | C1101: 2 | D1101: 1 | E1101: =C1101*6+D1101 -> 13 | G1101: 8 | H1101: 8 | I1101: =G1101*6+H1101 -> 56 | K1101: 9 | L1101: 13 | M1101: =K1101*6+L1101 -> 67 | O1101: 19 | P1101: 18 | Q1101: =O1101*6+P1101 -> 132 | S1101: PRESTON
A1102: WILLIAMSTOWN | C1102: 2 | D1102: 4 | E1102: =C1102*6+D1102 -> 16 | G1102: 3 | H1102: 8 | I1102: =G1102*6+H1102 -> 26 | K1102: 4 | L1102: 10 | M1102: =K1102*6+L1102 -> 34 | O1102: 4 | P1102: 11 | Q1102: =O1102*6+P1102 -> 35 | S1102: NOWLAN
A1103: BEST PLAYERS
A1104: PRESTON | C1104: McSWAIN | F1104: MONOHAN | I1104: DOWLING | L1104: DAVIE | O1104: F SPARGO | R1104: HUGHSON
A1105: WILLIAMSTOWN | C1105: STANBRIDGE | F1105: SYKES | I1105: BROOKS | L1105: SMITH | O1105: TAYLOR | R1105: ADDISON
A1106: GOALKICKERS
A1107: PRESTON | C1107: HUGHSON 5 | F1107: CAMERON 4 | I1107: WARR 2 | K1107: DINEEN 2 | M1107: HEARN 2 | O1107: BREWIS 2 | Q1107: McSWAIN | T1107: MONOHAN
A1108: WILLIAMSTOWN | C1108: BLAKE 2 | F1108: HYDE | I1108: SYKES
A1110: NORTHCOTE | C1110: 6 | D1110: 6 | E1110: =C1110*6+D1110 -> 42 | G1110: 7 | H1110: 8 | I1110: =G1110*6+H1110 -> 50 | K1110: 13 | L1110: 14 | M1110: =K1110*6+L1110 -> 92 | O1110: 16 | P1110: 15 | Q1110: =O1110*6+P1110 -> 111 | S1110: TOORAK PARK
A1111: PRAHRAN | C1111: 1 | D1111: 2 | E1111: =C1111*6+D1111 -> 8 | G1111: 6 | H1111: 7 | I1111: =G1111*6+H1111 -> 43 | K1111: 6 | L1111: 9 | M1111: =K1111*6+L1111 -> 45 | O1111: 11 | P1111: 14 | Q1111: =O1111*6+P1111 -> 80 | S1111: MURRAY
A1112: BEST PLAYERS
A1113: NORTHCOTE | C1113: COLE | F1113: SEYMOUR | I1113: ROSS | L1113: SMITH | O1113: GRAY | R1113: BROWN
A1114: PRAHRAN | C1114: THOMPSON | F1114: F SMITH | I1114: KENNA | L1114: HYDE | O1114: TRIM | R1114: BRENCHLEY
A1115: GOALKICKERS
A1116: NORTHCOTE | C1116: SEYMOUR 9 | F1116: GRAY 3 | I1116: SMITH | K1116: BRAY | M1116: ROSS | O1116: GOULLET
A1117: PRAHRAN | C1117: THOMPSON 3 | F1117: TRIM 2 | I1117: JORDAN 2 | L1117: HAWKINS | N1117: KOOP | P1117: HARRIS | R1117: WHITE
A1119: CAMBERWELL | C1119: 1 | D1119: 1 | E1119: =C1119*6+D1119 -> 7 | G1119: 5 | H1119: 8 | I1119: =G1119*6+H1119 -> 38 | K1119: 10 | L1119: 9 | M1119: =K1119*6+L1119 -> 69 | O1119: 18 | P1119: 12 | Q1119: =O1119*6+P1119 -> 120 | S1119: CAMBERWELL
A1120: YARRAVILLE | C1120: 9 | D1120: 3 | E1120: =C1120*6+D1120 -> 57 | G1120: 11 | H1120: 8 | I1120: =G1120*6+H1120 -> 74 | K1120: 14 | L1120: 13 | M1120: =K1120*6+L1120 -> 97 | O1120: 17 | P1120: 15 | Q1120: =O1120*6+P1120 -> 117 | S1120: McKINNON
A1121: BEST PLAYERS
A1122: CAMBERWELL | C1122: JONES | F1122: LAWN | I1122: WARTMAN | L1122: WALLACE | O1122: MASON | R1122: L WILLIAMS
A1123: YARRAVILLE | C1123: HAFFENDON | F1123: WHITE | I1123: PARKS | L1123: W BUCKLEY | O1123: WUNHYM | R1123: CAMERON
A1124: GOALKICKERS
A1125: CAMBERWELL | C1125: LAWN 6 | E1125: LUFF 3 | G1125: AUSTIN 3 | J1125: BOOTHMAN 2 | M1125: W COFFIN 2 | P1125: MASON | S1125: PIERCE
A1126: YARRAVILLE | C1126: J BUCKLEY 4 | F1126: CAMERON 3 | I1126: EVANS 3 | K1126: SHEEHAN 2 | N1126: PETERS 2 | Q1126: HAFFENDON 2 | U1126: COPPOCK
A1128: ROUND 21 | E1128: 2ND SEPTEMBER | H1128: WEATHER | K1128: COOL CLOUDY S.W. WIND LIGHT SHOWERS | S1128: PLAYED AT
D1129: 1ST QTR | H1129: 2ND QTR | L1129: 3RD QTR | P1129: FINAL | S1129: WILLIAMSTOWN
A1130: WILLIAMSTOWN | C1130: 2 | D1130: 6 | E1130: =C1130*6+D1130 -> 18 | G1130: 7 | H1130: 6 | I1130: =G1130*6+H1130 -> 48 | K1130: 10 | L1130: 8 | M1130: =K1130*6+L1130 -> 68 | O1130: 15 | P1130: 12 | Q1130: =O1130*6+P1130 -> 102 | S1130: UMPIRE | X1130: LADDER | AB1130: ROUND | AD1130: 21
A1131: PRAHRAN | C1131: 2 | D1131: 2 | E1131: =C1131*6+D1131 -> 14 | G1131: 5 | H1131: 5 | I1131: =G1131*6+H1131 -> 35 | K1131: 7 | L1131: 8 | M1131: =K1131*6+L1131 -> 50 | O1131: 11 | P1131: 12 | Q1131: =O1131*6+P1131 -> 78 | S1131: BRANDON
A1132: BEST PLAYERS | W1132: TEAM | X1132: W | Y1132: L | Z1132: D | AA1132: FOR | AB1132: AGST | AC1132: % | AD1132: PTS
A1133: WILLIAMSTOWN | C1133: SYKES | F1133: C DREW | I1133: BLAKE | K1133: ADDISON | N1133: GILES | Q1133: STANBRIDGE
A1134: PRAHRAN | C1134: THOMPSON | F1134: C WILLIAMS | I1134: TRIM | K1134: BRENCHLEY | N1134: HYDE | Q1134: F SMITH | W1134: NORTHCOTE | X1134: 16 | Y1134: 3 | Z1134: 2 | AA1134: 2080 | AB1134: 1575 | AC1134: 132.06349206349208 | AD1134: 68
A1135: GOALKICKERS | W1135: COBURG | X1135: 15 | Y1135: 5 | Z1135: 1 | AA1135: 1874 | AB1135: 1603 | AC1135: 116.90580162195883 | AD1135: 62
A1136: WILLIAMSTOWN | C1136: C DREW 4 | F1136: HYDE 4 | I1136: DELLER 3 | K1136: BLAKE | M1136: STANBRIDGE | P1136: ADDISON | R1136: HILL | W1136: YARRAVILLE | X1136: 14 | Y1136: 7 | Z1136: 0 | AA1136: 2041 | AB1136: 1613 | AC1136: 126.53440793552387 | AD1136: 56
A1137: PRAHRAN | C1137: HAWKINS 3 | F1137: THOMPSON 3 | I1137: BECK 2 | K1137: BRENCHLEY | N1137: JORDAN | P1137: C WILLIAMS | W1137: SANDRINGHAM | X1137: 13 | Y1137: 7 | Z1137: 1 | AA1137: 2100 | AB1137: 1744 | AC1137: 120.41284403669725 | AD1137: 54
A1139: NORTHCOTE | C1139: 3 | D1139: 2 | E1139: =C1139*6+D1139 -> 20 | G1139: 6 | H1139: 6 | I1139: =G1139*6+H1139 -> 42 | K1139: 10 | L1139: 9 | M1139: =K1139*6+L1139 -> 69 | O1139: 16 | P1139: 13 | Q1139: =O1139*6+P1139 -> 109 | S1139: NORTHCOTE | W1139: PORT MELBOURNE | X1139: 13 | Y1139: 7 | Z1139: 1 | AA1139: 2001 | AB1139: 1709 | AC1139: 117.08601521357519 | AD1139: 54
A1140: OAKLEIGH | C1140: 2 | D1140: 5 | E1140: =C1140*6+D1140 -> 17 | G1140: 4 | H1140: 6 | I1140: =G1140*6+H1140 -> 30 | K1140: 5 | L1140: 9 | M1140: =K1140*6+L1140 -> 39 | O1140: 7 | P1140: 13 | Q1140: =O1140*6+P1140 -> 55 | S1140: MILLER | W1140: PRESTON | X1140: 12 | Y1140: 8 | Z1140: 1 | AA1140: 1904 | AB1140: 1645 | AC1140: 115.74468085106383 | AD1140: 50
A1141: BEST PLAYERS | W1141: CAMBERWELL | X1141: 12 | Y1141: 9 | Z1141: 0 | AA1141: 2067 | AB1141: 1838 | AC1141: 112.45919477693144 | AD1141: 48
A1142: NORTHCOTE | C1142: SIMMONDS | F1142: WOODS | I1142: ROSS | L1142: CORRIGAN | O1142: GOULLETT | Q1142: FLINN | W1142: BRIGHTON | X1142: 8 | Y1142: 12 | Z1142: 1 | AA1142: 1882 | AB1142: 2083 | AC1142: 90.350456072971681 | AD1142: 34
A1143: OAKLEIGH | C1143: WITHERS | F1143: R SMITH | I1143: HUTCHISON | L1143: HOLMES | O1143: CRAMERI | Q1143: DEAN | W1143: WILLIAMSTOWN | X1143: 6 | Y1143: 15 | Z1143: 0 | AA1143: 1519 | AB1143: 1908 | AC1143: 79.612159329140468 | AD1143: 24
A1144: GOALKICKERS | Q1144: CORRIGAN | W1144: OAKLEIGH | X1144: 6 | Y1144: 15 | Z1144: 0 | AA1144: 1593 | AB1144: 2120 | AC1144: 75.14150943396227 | AD1144: 24
A1145: NORTHCOTE | C1145: CONNELL 4 | F1145: SMITH 3 | H1145: SEYMOUR 3 | K1145: ROSS 2 | M1145: SIMMONDS | P1145: GRAY | R1145: GOULLET | W1145: PRAHRAN | X1145: 5 | Y1145: 15 | Z1145: 1 | AA1145: 1790 | AB1145: 2159 | AC1145: 82.908754052802223 | AD1145: 22
A1146: OAKLEIGH | C1146: WITHERS 2 | F1146: CRAMERI | I1146: DENNING | K1146: BAKER | M1146: R SMITH | P1146: DEAN | W1146: BRUNSWICK | X1146: 2 | Y1146: 19 | Z1146: 0 | AA1146: 1377 | AB1146: 2231 | AC1146: 61.72120125504258 | AD1146: 8
A1148: PRESTON | C1148: 8 | D1148: 4 | E1148: =C1148*6+D1148 -> 52 | G1148: 10 | H1148: 6 | I1148: =G1148*6+H1148 -> 66 | K1148: 13 | L1148: 9 | M1148: =K1148*6+L1148 -> 87 | O1148: 13 | P1148: 9 | Q1148: =O1148*6+P1148 -> 87 | S1148: BEACH ROAD
A1149: SANDRINGHAM | C1149: 1 | D1149: 1 | E1149: =C1149*6+D1149 -> 7 | G1149: 4 | H1149: 6 | I1149: =G1149*6+H1149 -> 30 | K1149: 6 | L1149: 6 | M1149: =K1149*6+L1149 -> 42 | O1149: 10 | P1149: 12 | Q1149: =O1149*6+P1149 -> 72 | S1149: MURRAY
A1150: BEST PLAYERS
A1151: PRESTON | C1151: DINEEN | F1151: MORGAN | I1151: DAVIE | L1151: DOWLING | O1151: McSWAIN | R1151: SMITH
A1152: SANDRINGHAM | C1152: THOMS | F1152: FITZGERALD | I1152: BECKTON | L1152: JAMIESON | O1152: TOLSON | R1152: LUNN
A1153: GOALKICKERS
A1154: PRESTON | C1154: MORGAN 3 | F1154: CAMERON 2 | I1154: HUGHSON 2 | L1154: BIRD 2 | N1154: DINEEN | P1154: HEARN | R1154: MONOHAN | U1154: DOWLING
A1155: SANDRINGHAM | C1155: JOHNSON 4 | F1155: TOLSON 2 | I1155: RAYMENT | L1155: FITZGERALD | O1155: L JOHNSTONE | R1155: SMAIL
A1157: PORT MELBOURNE | C1157: 3 | D1157: 2 | E1157: =C1157*6+D1157 -> 20 | G1157: 7 | H1157: 2 | I1157: =G1157*6+H1157 -> 44 | K1157: 12 | L1157: 7 | M1157: =K1157*6+L1157 -> 79 | O1157: 16 | P1157: 15 | Q1157: =O1157*6+P1157 -> 111 | S1157: PORT MELBOURNE
A1158: BRIGHTON | C1158: 4 | D1158: 7 | E1158: =C1158*6+D1158 -> 31 | G1158: 8 | H1158: 11 | I1158: =G1158*6+H1158 -> 59 | K1158: 14 | L1158: 12 | M1158: =K1158*6+L1158 -> 96 | O1158: 14 | P1158: 12 | Q1158: =O1158*6+P1158 -> 96 | S1158: McKINNON
A1159: BEST PLAYERS
A1160: PORT MELBOURNE | C1160: REES | E1160: BEDFORD | H1160: KEATING | K1160: MALTBY | N1160: BOQUEST | Q1160: ALDRIDGE
A1161: BRIGHTON | C1161: LILBURNE | E1161: JOHNSTONE | H1161: HUNT | K1161: BURNES | N1161: MILLER | Q1161: HILL
A1162: GOALKICKERS
A1163: PORT MELBOURNE | C1163: BEDFORD 9 | F1163: KEATING 3 | I1163: REES | J1163: ALDRIDGE | M1163: MALTBY | O1163: ATKINSON
A1164: BRIGHTON | C1164: HILL 3 | F1164: POULTER 3 | I1164: LILBURNE 2 | L1164: O'BRIEN 2 | N1164: MILLER 2 | Q1164: DEAN | S1164: BURNES
A1166: COBURG | C1166: 1 | D1166: 3 | E1166: =C1166*6+D1166 -> 9 | G1166: 5 | H1166: 12 | I1166: =G1166*6+H1166 -> 42 | K1166: 6 | L1166: 15 | M1166: =K1166*6+L1166 -> 51 | O1166: 9 | P1166: 19 | Q1166: =O1166*6+P1166 -> 73 | S1166: COBURG
A1167: CAMBERWELL | C1167: 0 | D1167: 5 | E1167: =C1167*6+D1167 -> 5 | G1167: 1 | H1167: 6 | I1167: =G1167*6+H1167 -> 12 | K1167: 7 | L1167: 8 | M1167: =K1167*6+L1167 -> 50 | O1167: 8 | P1167: 10 | Q1167: =O1167*6+P1167 -> 58 | S1167: NOWLAN
A1168: BEST PLAYERS
A1169: COBURG | C1169: RUDOLPH | F1169: HARRIS | I1169: WILLOX | K1169: UHE | N1169: KIGHT | Q1169: BROOM
A1170: CAMBERWELL | C1170: DYBALL | F1170: MASON | I1170: JONES | K1170: W COFFIN | N1170: BOOTHMAN | Q1170: PIERCE
A1171: GOALKICKERS
A1172: COBURG | C1172: MEARS 2 | F1172: KIGHT 2 | I1172: BROOM | K1172: WILLOX | M1172: HARRIS | O1172: J L HOGAN | Q1172: DONNELLY
A1173: CAMBERWELL | C1173: MASON 2 | F1173: LUFF 2 | I1173: W COFFIN | L1173: LAWN | N1173: ANDREW | P1173: AUSTIN
A1175: YARRAVILLE | C1175: 4 | D1175: 1 | E1175: =C1175*6+D1175 -> 25 | G1175: 4 | H1175: 5 | I1175: =G1175*6+H1175 -> 29 | K1175: 10 | L1175: 8 | M1175: =K1175*6+L1175 -> 68 | O1175: 14 | P1175: 11 | Q1175: =O1175*6+P1175 -> 95 | S1175: BRUNSWICK
A1176: BRUNSWICK | C1176: 1 | D1176: 2 | E1176: =C1176*6+D1176 -> 8 | G1176: 2 | H1176: 3 | I1176: =G1176*6+H1176 -> 15 | K1176: 4 | L1176: 5 | M1176: =K1176*6+L1176 -> 29 | O1176: 8 | P1176: 9 | Q1176: =O1176*6+P1176 -> 57 | S1176: STUART
A1177: BEST PLAYERS
A1178: YARRAVILLE | C1178: CAMERON | F1178: WUNHYM | I1178: BOURKE | L1178: W BUCKLEY | O1178: McGRATH | R1178: SHEEHAN
A1179: BRUNSWICK | C1179: BEARD | F1179: MAYNES | I1179: WOODS | L1179: DOWLING | O1179: MORGAN | R1179: GRACE
A1180: GOALKICKERS
A1181: YARRAVILLE | C1181: J BUCKLEY 6 | F1181: McGRATH 2 | I1181: CAMERON 2 | L1181: SHEEHAN | N1181: COPPOCK | Q1181: PARKS | S1181: BOURKE
A1182: BRUNSWICK | C1182: JONES 4 | F1182: MAYNES 2 | I1182: DOWLING | L1182: WATTS
A1184: ROUND 22 | E1184: 9TH SEPTEMBER | J1184: WEATHER | M1184: COOL CLOUDY S.W. WIND | S1184: PLAYED AT
D1185: 1ST QTR | H1185: 2ND QTR | L1185: 3RD QTR | P1185: FINAL | S1185: WILLIAMSTOWN
A1186: WILLIAMSTOWN | C1186: 2 | D1186: 2 | E1186: =C1186*6+D1186 -> 14 | G1186: 8 | H1186: 7 | I1186: =G1186*6+H1186 -> 55 | K1186: 8 | L1186: 11 | M1186: =K1186*6+L1186 -> 59 | O1186: 9 | P1186: 19 | Q1186: =O1186*6+P1186 -> 73 | S1186: UMPIRE | X1186: LADDER | AB1186: ROUND | AD1186: 22
A1187: NORTHCOTE | C1187: 1 | D1187: 7 | E1187: =C1187*6+D1187 -> 13 | G1187: 1 | H1187: 9 | I1187: =G1187*6+H1187 -> 15 | K1187: 6 | L1187: 11 | M1187: =K1187*6+L1187 -> 47 | O1187: 6 | P1187: 12 | Q1187: =O1187*6+P1187 -> 48 | S1187: McKINNON
A1188: BEST PLAYERS | W1188: TEAM | X1188: W | Y1188: L | Z1188: D | AA1188: FOR | AB1188: AGST | AC1188: % | AD1188: PTS
A1189: WILLIAMSTOWN | C1189: MARTIN | E1189: R DELLER | H1189: BARNES | K1189: BLAKE | N1189: STANBRIDGE | Q1189: BROOKS
A1190: NORTHCOTE | C1190: GARRETT | E1190: SMITH | H1190: WOODS | K1190: GOULLETT | N1190: HUMPHRIES | Q1190: FLINN | W1190: NORTHCOTE | X1190: 16 | Y1190: 4 | Z1190: 2 | AA1190: 2128 | AB1190: 1648 | AC1190: 129.126213592233 | AD1190: 68
A1191: GOALKICKERS | W1191: COBURG | X1191: 15 | Y1191: 6 | Z1191: 1 | AA1191: 1957 | AB1191: 1689 | AC1191: 115.86737714624037 | AD1191: 62
A1192: WILLIAMSTOWN | C1192: MARTIN 2 | F1192: HYDE 2 | H1192: BARNES 2 | K1192: R DELLER | N1192: BALKE | P1192: STANBRIDGE | W1192: YARRAVILLE | X1192: 15 | Y1192: 7 | Z1192: 0 | AA1192: 2160 | AB1192: 1726 | AC1192: 125.14484356894553 | AD1192: 60
A1193: NORTHCOTE | C1193: SMITH 3 | F1193: BROWN | H1193: SEYMOUR | K1193: SIMMONDS | W1193: PORT MELBOURNE | X1193: 14 | Y1193: 7 | Z1193: 1 | AA1193: 2095 | AB1193: 1728 | AC1193: 121.23842592592592 | AD1193: 58
A1195: PORT MELBOURNE | C1195: 4 | D1195: 9 | E1195: =C1195*6+D1195 -> 33 | G1195: 5 | H1195: 15 | I1195: =G1195*6+H1195 -> 45 | K1195: 10 | L1195: 20 | M1195: =K1195*6+L1195 -> 80 | O1195: 12 | P1195: 22 | Q1195: =O1195*6+P1195 -> 94 | S1195: PORT MELBOURNE | W1195: SANDRINGHAM | X1195: 13 | Y1195: 8 | Z1195: 1 | AA1195: 2119 | AB1195: 1838 | AC1195: 115.28835690968444 | AD1195: 54
A1196: SANDRINGHAM | C1196: 0 | D1196: 0 | E1196: =C1196*6+D1196 -> 0 | G1196: 1 | H1196: 3 | I1196: =G1196*6+H1196 -> 9 | K1196: 2 | L1196: 4 | M1196: =K1196*6+L1196 -> 16 | O1196: 2 | P1196: 7 | Q1196: =O1196*6+P1196 -> 19 | S1196: MURRAY | W1196: PRESTON | X1196: 12 | Y1196: 9 | Z1196: 1 | AA1196: 2017 | AB1196: 1764 | AC1196: 114.34240362811791 | AD1196: 50
A1197: BEST PLAYERS | W1197: CAMBERWELL | X1197: 12 | Y1197: 10 | Z1197: 0 | AA1197: 2151 | AB1197: 1970 | AC1197: 109.18781725888324 | AD1197: 48
A1198: PORT MELBOURNE | C1198: LAHIFF | E1198: PERRETT | H1198: PLUMRIDGE | K1198: BEDFORD | N1198: LOVETT | Q1198: BILLS | W1198: BRIGHTON | X1198: 9 | Y1198: 12 | Z1198: 1 | AA1198: 2014 | AB1198: 2167 | AC1198: 92.939547761882793 | AD1198: 38
A1199: SANDRINGHAM | C1199: LUNN | E1199: BECKTON | H1199: FITZGERALD | K1199: THOMS | N1199: SMAIL | Q1199: JAMIESON | W1199: WILLIAMSTOWN | X1199: 7 | Y1199: 15 | Z1199: 0 | AA1199: 1592 | AB1199: 1956 | AC1199: 81.39059304703477 | AD1199: 28
A1200: GOALKICKERS | W1200: OAKLEIGH | X1200: 7 | Y1200: 15 | Z1200: 0 | AA1200: 1679 | AB1200: 2203 | AC1200: 76.214253290966866 | AD1200: 28
A1201: PORT MELBOURNE | C1201: LAHIFF 5 | F1201: BEDFORD 4 | I1201: KEATING | K1201: MALTBY | M1201: ALDRIDGE | W1201: PRAHRAN | X1201: 5 | Y1201: 16 | Z1201: 1 | AA1201: 1855 | AB1201: 2240 | AC1201: 82.8125 | AD1201: 22
A1202: SANDRINGHAM | C1202: FITZGERALD | F1202: BECKTON | W1202: BRUNSWICK | X1202: 3 | Y1202: 19 | Z1202: 0 | AA1202: 1458 | AB1202: 2296 | AC1202: 63.501742160278745 | AD1202: 12
A1204: OAKLEIGH | C1204: 1 | D1204: 2 | E1204: =C1204*6+D1204 -> 8 | G1204: 6 | H1204: 8 | I1204: =G1204*6+H1204 -> 44 | K1204: 8 | L1204: 9 | M1204: =K1204*6+L1204 -> 57 | O1204: 13 | P1204: 18 | Q1204: =O1204*6+P1204 -> 96 | S1204: OAKLEIGH
A1205: COBURG | C1205: 3 | D1205: 8 | E1205: =C1205*6+D1205 -> 26 | G1205: 5 | H1205: 13 | I1205: =G1205*6+H1205 -> 43 | K1205: 9 | L1205: 17 | M1205: =K1205*6+L1205 -> 71 | O1205: 11 | P1205: 17 | Q1205: =O1205*6+P1205 -> 83
A1206: BEST PLAYERS
A1207: OAKLEIGH | C1207: CRAMERI | F1207: RYAN | I1207: FLEMING | L1207: YANN | O1207: MATHRICK | R1207: HUTCHISON
A1208: COBURG | C1208: LOWE | F1208: UHE | I1208: RUDOLPH | L1208: BERTRAM | O1208: HARRIS | R1208: KIGHT
A1209: GOALKICKERS
A1210: OAKLEIGH | C1210: FLEMING 2 | F1210: DEAN 2 | H1210: DENNING 2 | K1210: WILTSHIRE 2 | N1210: WATSON 2 | Q1210: WITHERS | T1210: GOULD | W1210: FRASER
A1211: COBURG | C1211: DUNCAN 4 | F1211: KIGHT 2 | I1211: ELLIOTT | K1211: WILLOX | M1211: BROOM | O1211: LOWE | Q1211: MEARS
A1213: YARRAVILLE | C1213: 1 | D1213: 1 | E1213: =C1213*6+D1213 -> 7 | G1213: 10 | H1213: 6 | I1213: =G1213*6+H1213 -> 66 | K1213: 12 | L1213: 6 | M1213: =K1213*6+L1213 -> 78 | O1213: 18 | P1213: 11 | Q1213: =O1213*6+P1213 -> 119 | S1213: YARRAVILLE
A1214: PRESTON | C1214: 9 | D1214: 6 | E1214: =C1214*6+D1214 -> 60 | G1214: 10 | H1214: 6 | I1214: =G1214*6+H1214 -> 66 | K1214: 15 | L1214: 11 | M1214: =K1214*6+L1214 -> 101 | O1214: 17 | P1214: 11 | Q1214: =O1214*6+P1214 -> 113 | S1214: MOWLAN
A1215: BEST PLAYERS
A1216: YARRAVILLE | C1216: J BUCKLEY | F1216: McGRATH | I1216: CAMERON | L1216: WHITE | O1216: W BUCKLEY | R1216: WARDEN
A1217: PRESTON | C1217: McEACHARN | F1217: DOYLE | I1217: WALSH | L1217: DAVIE | O1217: McSWAIN | R1217: UNDERHILL
A1218: GOALKICKERS
A1219: YARRAVILLE | C1219: WARDEN 5 | F1219: McGRATH 3 | I1219: CAMERON 3 | L1219: BOURKE 2 | N1219: J BUCKLEY 2 | Q1219: WUNHYM | T1219: PETERS | V1219: WHITE
A1220: PRESTON | C1220: WALSH 4 | F1220: HEARN 4 | I1220: BREWIS 3 | L1220: DINEEN 3 | N1220: McSWAIN | Q1220: McEACHARN | U1220: BIRD
A1222: BRUNSWICK | C1222: 1 | D1222: 3 | E1222: =C1222*6+D1222 -> 9 | G1222: 4 | H1222: 9 | I1222: =G1222*6+H1222 -> 33 | K1222: 10 | L1222: 10 | M1222: =K1222*6+L1222 -> 70 | O1222: 11 | P1222: 15 | Q1222: =O1222*6+P1222 -> 81 | S1222: TOORAK PARK
A1223: PRAHRAN | C1223: 3 | D1223: 2 | E1223: =C1223*6+D1223 -> 20 | G1223: 6 | H1223: 4 | I1223: =G1223*6+H1223 -> 40 | K1223: 7 | L1223: 6 | M1223: =K1223*6+L1223 -> 48 | O1223: 9 | P1223: 11 | Q1223: =O1223*6+P1223 -> 65 | S1223: MILLER
A1224: BEST PLAYERS
A1225: BRUNSWICK | C1225: ARRELL | F1225: JONES | I1225: DOWLING | L1225: ANDERSON | O1225: MUTIMER | R1225: A THOMPSON
A1226: PRAHRAN | C1226: THOMPSON | F1226: BECK | I1226: HAWKINS | L1226: SMITH | O1226: MASON | R1226: KENNA
A1227: GOALKICKERS
A1228: BRUNSWICK | C1228: JONES 4 | F1228: ARRELL 4 | I1228: MUTIMER | L1228: McNEILL | N1228: DOWLING
A1229: PRAHRAN | C1229: THOMPSON 4 | F1229: HAWKINS 3 | I1229: WELLS | L1229: WHITE
A1231: BRIGHTON | C1231: 7 | D1231: 9 | E1231: =C1231*6+D1231 -> 51 | G1231: 8 | H1231: 10 | I1231: =G1231*6+H1231 -> 58 | K1231: 13 | L1231: 22 | M1231: =K1231*6+L1231 -> 100 | O1231: 18 | P1231: 24 | Q1231: =O1231*6+P1231 -> 132 | S1231: ELSTERNWICK PARK
A1232: CAMBERWELL | C1232: 0 | D1232: 1 | E1232: =C1232*6+D1232 -> 1 | G1232: 8 | H1232: 5 | I1232: =G1232*6+H1232 -> 53 | K1232: 8 | L1232: 6 | M1232: =K1232*6+L1232 -> 54 | O1232: 12 | P1232: 12 | Q1232: =O1232*6+P1232 -> 84 | S1232: GLOVER
A1233: BEST PLAYERS
A1234: BRIGHTON | C1234: BURTON | E1234: BURNES | H1234: J O'BRIEN | K1234: TOMLINS | N1234: ROSENBROCK | Q1234: HUNT
A1235: CAMBERWELL | C1235: JONES | E1235: O'NEILL | H1235: W COFFIN | K1235: ANDREW | N1235: R WILLIAMS | Q1235: LUFF
A1236: GOALKICKERS
A1237: BRIGHTON | C1237: BURNES 6 | E1237: DEANE 3 | G1237: J O'BRIEN 2 | J1237: TUCKER 2 | M1237: LILBURNE | O1237: POULTER | Q1237: HILL | R1237: R MILLER | U1237: TOMLINS
A1238: CAMBERWELL | C1238: LUFF 6 | E1238: LAWN 2 | G1238: WARTMAN 2 | J1238: W COFFIN | M1238: CLAMP
A1240: FINALS
A1241: 1ST SEMI | E1241: 16TH SEPTEMBER | J1241: WEATHER | M1241: LIGHT SHOWERS
A1242: PORT MELBOURNE | C1242: 0 | D1242: 1 | E1242: =C1242*6+D1242 -> 1 | G1242: 1 | H1242: 9 | I1242: =G1242*6+H1242 -> 15 | K1242: 3 | L1242: 10 | M1242: =K1242*6+L1242 -> 28 | O1242: 7 | P1242: 13 | Q1242: 55 | S1242: OLYMPIC PK
A1243: YARRAVILLE | C1243: 3 | D1243: 3 | E1243: =C1243*6+D1243 -> 21 | G1243: 3 | H1243: 3 | I1243: =G1243*6+H1243 -> 21 | K1243: 7 | L1243: 7 | M1243: =K1243*6+L1243 -> 49 | O1243: 7 | P1243: 10 | Q1243: 52 | S1243: BRANDON
A1244: BEST PLAYERS
A1245: PORT MELBOURNE | C1245: PLUMRIDGE | F1245: E PERRETT | I1245: REES | L1245: GARBUTT | O1245: KEATING | R1245: MALTBY
A1246: YARRAVILLE | C1246: WUNHYM | F1246: WARDEN | I1246: SHEEHAN | L1246: WHITE | O1246: McGRATH | R1246: BAKER
A1247: GOALKICKERS
A1248: PORT MELBOURNE | C1248: BEDFORD 3 | F1248: ALDRIDGE 2 | I1248: LOVETT | L1248: L KEATING
A1249: YARRAVILLE | C1249: McGRATH 2 | F1249: BAKER | I1249: CAMERON | L1249: SHERMAN | O1249: R EDWARDS | R1249: PARKS
A1251: 2ND SEMI | E1251: 23RD SEPTEMBER | J1251: WEATHER | M1251: CLOUDY BUT FINE S.E.BREEZE
A1252: COBURG | C1252: 3 | D1252: 3 | E1252: =C1252*6+D1252 -> 21 | G1252: 7 | H1252: 6 | I1252: =G1252*6+H1252 -> 48 | K1252: 7 | L1252: 9 | M1252: =K1252*6+L1252 -> 51 | O1252: 13 | P1252: 16 | Q1252: 94 | S1252: OLYMPIC PK
A1253: NORTHCOTE | C1253: 2 | D1253: 10 | E1253: =C1253*6+D1253 -> 22 | G1253: 4 | H1253: 14 | I1253: =G1253*6+H1253 -> 38 | K1253: 7 | L1253: 17 | M1253: =K1253*6+L1253 -> 59 | O1253: 11 | P1253: 22 | Q1253: 88 | S1253: McKINNON
A1254: BEST PLAYERS
A1255: COBURG | C1255: STOCKDALE | F1255: MEARS | I1255: RUDOLPH | L1255: IHE | O1255: DUNCAN | R1255: HARRIS
A1256: NORTHCOTE | C1256: WOODS | F1256: GARRETT | I1256: ROWE | L1256: BRAY | O1256: ROSS | R1256: SMITH
A1257: GOALKICKERS
A1258: COBURG | C1258: MEARS 5 | F1258: DUNCAN 4 | I1258: BROOM 2 | L1258: LEAHY | N1258: HARRIS
A1259: NORTHCOTE | C1259: BRAY 4 | F1259: SEYMOUR 3 | I1259: SIMMONDS 2 | L1259: BROWN | N1259: CONNELL
A1261: PRELIMINARY FINAL | F1261: 30TH SEPTEMBER | J1261: WEATHER | M1261: CLOUDY BUT FINE SOUTH WIND
A1262: NORTHCOTE | C1262: 4 | D1262: 2 | E1262: =C1262*6+D1262 -> 26 | G1262: 6 | H1262: 2 | I1262: =G1262*6+H1262 -> 38 | K1262: 12 | L1262: 6 | M1262: =K1262*6+L1262 -> 78 | O1262: 13 | P1262: 9 | Q1262: 87 | S1262: OLYMPIC PK
A1263: PORT MELBOURNE | C1263: 0 | D1263: 3 | E1263: =C1263*6+D1263 -> 3 | G1263: 4 | H1263: 5 | I1263: =G1263*6+H1263 -> 29 | K1263: 5 | L1263: 7 | M1263: =K1263*6+L1263 -> 37 | O1263: 9 | P1263: 10 | Q1263: 64 | S1263: McKINNON
A1264: BEST PLAYERS
A1265: NORTHCOTE | C1265: SIMMONDS | F1265: GARRETT | I1265: SMITH | L1265: WOODS | N1265: HART | Q1265: GOULLETT
A1266: PORT MELBOURNE | C1266: MALTBY | F1266: TUITE | I1266: PLUMRIDGE | L1266: ATKINSON | N1266: PERRETT | Q1266: JULIER
A1267: GOALKICKERS
A1268: NORTHCOTE | C1268: SIMMONDS 5 | F1268: ROSS 2 | I1268: CONNELL 2 | L1268: BYRNE 2 | O1268: HUMPHRIES | R1268: SEYMOUR
A1269: PORT MELBOURNE | C1269: BEDFORD 4 | F1269: MALTBY 2 | I1269: GARBUTT | L1269: ALDRIDGE | O1269: PLUMRIDGE
A1271: GRAND FINAL | E1271: 7TH OCTOBER | J1271: WEATHER
A1272: NORTHCOTE | C1272: 3 | D1272: 8 | E1272: =C1272*6+D1272 -> 26 | G1272: 5 | H1272: 11 | I1272: =G1272*6+H1272 -> 41 | K1272: 7 | L1272: 14 | M1272: =K1272*6+L1272 -> 56 | O1272: 11 | P1272: 20 | Q1272: 86 | S1272: OLYMPIC PK
A1273: COBURG | C1273: 4 | D1273: 1 | E1273: =C1273*6+D1273 -> 25 | G1273: 6 | H1273: 8 | I1273: =G1273*6+H1273 -> 44 | K1273: 8 | L1273: 11 | M1273: =K1273*6+L1273 -> 59 | O1273: 9 | P1273: 16 | Q1273: 70 | S1273: McKINNON
A1274: BEST PLAYERS
A1275: NORTHCOTE | C1275: WOODS | F1275: HUMPHRIES | I1275: GARRETT | L1275: COLE | N1275: ROWE | Q1275: ROSS
A1276: COBURG | C1276: RUDOLPH | F1276: LOWE | I1276: STOCKDALE | L1276: HARRIS | N1276: MEARS | Q1276: UHE
A1277: GOALKICKERS
A1278: NORTHCOTE | C1278: SEYMOUR 3 | F1278: ROSS 3 | I1278: BRAY 2 | K1278: BYRNE 2 | M1278: GOULLETT
A1279: COBURG | C1279: DUNCAN 3 | F1279: MEARS 3 | I1279: HARRIS | K1279: KIGHT | M1279: GUIER
A1281: TEAMS
G1282: NORTHCOTE | S1282: COBURG
A1283: BACKS | D1283: HART | G1283: FLINN | K1283: HUMPHRIES | P1283: GRIFFITHS | T1283: BERTRAM | W1283: BAMFORD
A1284: H-BACKS | D1284: POWELL | G1284: SMITH | K1284: WOODS | P1284: UHE | T1284: RUDOLPH | W1284: LOWE
A1285: CENTRES | D1285: COLE | G1285: CORRIGAN | K1285: GARRETT | P1285: WILLOX | T1285: GUIER | W1285: J L HOGAN
A1286: H-FORWARDS | D1286: SIMMONDS | G1286: BYRNE | K1286: CONNELL | P1286: LEAHY | T1286: BROOM | W1286: HARRIS
A1287: FORWARDS | D1287: BRAY | G1287: SEYMOUR | K1287: WILSON | P1287: ELLIOTT | T1287: DUNCAN | W1287: KIGHT
A1288: RUCKS | D1288: ROWE | G1288: GOULLETT | K1288: ROSS | P1288: JENKINS | T1288: FINN | W1288: MEARS
A1289: RES | D1289: ACKLAND | G1289: WILLIAMSON | P1289: DUNCAN JNR