A1: Victorian Football Association
A2: Season 1934
A3: © Copyright Wal Williams | F3: First created: 2 November 2014
A4: Contact: joywalwi at gmail dot com | F4: Last updated: 27 January 2018 | W4: VFA Results and tables - Link to the main index page
A5: You are free to copy this document in whole or part provided that proper acknowledgement is given to the author. All rights reserved.
A7: YEAR 1934
A8: ROUND 1 | E8: 28TH APRIL | J8: WEATHER | M8: COOL CLOUDY S WIND SHOWERS | S8: PLAYED AT
D9: 1ST QTR | H9: 2ND QTR | L9: 3RD QTR | P9: FINAL | S9: ELSTERNWICK PARK
A10: SANDRINGHAM | C10: 0 | D10: 2 | E10: =C10*6+D10 -> 2 | G10: 7 | H10: 3 | I10: =G10*6+H10 -> 45 | K10: 10 | L10: 4 | M10: =K10*6+L10 -> 64 | O10: 13 | P10: 9 | Q10: =O10*6+P10 -> 87 | S10: UMPIRE | X10: LADDER | AB10: ROUND | AD10: 1
A11: BRIGHTON | C11: 1 | D11: 5 | E11: =C11*6+D11 -> 11 | G11: 2 | H11: 8 | I11: =G11*6+H11 -> 20 | K11: 4 | L11: 16 | M11: =K11*6+L11 -> 40 | O11: 8 | P11: 21 | Q11: =O11*6+P11 -> 69 | S11: DAVENPORT
A12: BEST PLAYERS | W12: TEAM | X12: W | Y12: L | Z12: D | AA12: FOR | AB12: AGST | AC12: % | AD12: PTS
A13: SANDRINGHAM | C13: THOMS | E13: CAMPBELL | H13: McCOMB | K13: SCHARP | N13: TOLSON | Q13: BECKTON
A14: BRIGHTON | C14: PENNY | E14: HUNT | H14: HARRISON | K14: L MILLER | N14: LILBURNE | Q14: GOULDSWORTHY | W14: NORTHCOTE | X14: 1 | Y14: 0 | Z14: 0 | AA14: 112 | AB14: 78 | AC14: 143.58974358974359 | AD14: 4
A15: GOALKICKERS | W15: COBURG | X15: 1 | Y15: 0 | Z15: 0 | AA15: 76 | AB15: 54 | AC15: 140.74074074074073 | AD15: 4
A16: SANDRINGHAM | C16: DOWLING 3 | F16: BECKTON 3 | I16: JOHNSON 3 | L16: DENNINGTON 2 | O16: McCOMB | Q16: RAYMENT | W16: YARRAVILLE | X16: 1 | Y16: 0 | Z16: 0 | AA16: 111 | AB16: 79 | AC16: 140.50632911392404 | AD16: 4
A17: BRIGHTON | C17: DEAN 2 | F17: LILBURNE 2 | I17: PENNY | K17: HARRISON | N17: HILL | P17: TUCKER | W17: PRAHRAN | X17: 1 | Y17: 0 | Z17: 0 | AA17: 72 | AB17: 52 | AC17: 138.46153846153845 | AD17: 4
A19: COBURG | C19: 2 | D19: 1 | E19: =C19*6+D19 -> 13 | G19: 4 | H19: 4 | I19: =G19*6+H19 -> 28 | K19: 7 | L19: 7 | M19: =K19*6+L19 -> 49 | O19: 11 | P19: 10 | Q19: =O19*6+P19 -> 76 | S19: BRUNSWICK | W19: CAMBERWELL | X19: 1 | Y19: 0 | Z19: 0 | AA19: 119 | AB19: 94 | AC19: 126.59574468085107 | AD19: 4
A20: BRUNSWICK | C20: 0 | D20: 5 | E20: =C20*6+D20 -> 5 | G20: 1 | H20: 12 | I20: =G20*6+H20 -> 18 | K20: 2 | L20: 15 | M20: =K20*6+L20 -> 27 | O20: 6 | P20: 18 | Q20: =O20*6+P20 -> 54 | W20: SANDRINGHAM | X20: 1 | Y20: 0 | Z20: 0 | AA20: 87 | AB20: 69 | AC20: 126.08695652173913 | AD20: 4
A21: BEST PLAYERS | W21: BRIGHTON | X21: 0 | Y21: 1 | Z21: 0 | AA21: 69 | AB21: 87 | AC21: 79.310344827586206 | AD21: 0
A22: COBURG | C22: BERTRAM | F22: KIGHT | I22: NASH | L22: REITSCHEL | O22: MEARS | Q22: LOWE | W22: OAKLEIGH | X22: 0 | Y22: 1 | Z22: 0 | AA22: 94 | AB22: 119 | AC22: 78.991596638655466 | AD22: 0
A23: BRUNSWICK | C23: ANDERSON | F23: DOWLING | I23: JENKINS | L23: ARRELL | O23: JORDAN | Q23: PALMER | W23: PORT MELBOURNE | X23: 0 | Y23: 1 | Z23: 0 | AA23: 52 | AB23: 72 | AC23: 72.222222222222229 | AD23: 0
A24: GOALKICKERS | W24: WILLIAMSTOWN | X24: 0 | Y24: 1 | Z24: 0 | AA24: 79 | AB24: 111 | AC24: 71.171171171171167 | AD24: 0
A25: COBURG | C25: NASH 3 | F25: REITSCHEL 2 | I25: KIGHT 2 | K25: GUIER | M25: ANDERSON | P25: MEARS | R25: HULL | W25: BRUNSWICK | X25: 0 | Y25: 1 | Z25: 0 | AA25: 54 | AB25: 76 | AC25: 71.05263157894737 | AD25: 0
A26: BRUNSWICK | C26: ARRELL 2 | F26: KENNEDY | I26: JONES | K26: BEARD | M26: MUTIMER | W26: PRESTON | X26: 0 | Y26: 1 | Z26: 0 | AA26: 78 | AB26: 112 | AC26: 69.642857142857139 | AD26: 0
A28: CAMBERWELL | C28: 3 | D28: 2 | E28: =C28*6+D28 -> 20 | G28: 7 | H28: 5 | I28: =G28*6+H28 -> 47 | K28: 15 | L28: 6 | M28: =K28*6+L28 -> 96 | O28: 18 | P28: 11 | Q28: =O28*6+P28 -> 119 | S28: CAMBERWELL
A29: OAKLEIGH | C29: 4 | D29: 7 | E29: =C29*6+D29 -> 31 | G29: 5 | H29: 8 | I29: =G29*6+H29 -> 38 | K29: 10 | L29: 12 | M29: =K29*6+L29 -> 72 | O29: 13 | P29: 16 | Q29: =O29*6+P29 -> 94 | S29: MILLER
A30: BEST PLAYERS
A31: CAMBERWELL | C31: HUNTER | F31: MEEHAN | I31: LAWN | L31: FINLAYSON | O31: CLAMP | R31: WHELAN
A32: OAKLEIGH | C32: DENNING | F32: WITHERS | I32: WILTSHIRE | L32: DEAN | O32: FRASER | R32: B SMITH
A33: GOALKICKERS
A34: CAMBERWELL | C34: LAWN 5 | E34: WHELAN 4 | H34: BEAGLEY 2 | K34: LASKY | M34: O'SHEA | O34: WILLIAMS | Q34: ANDREWS | T34: COFFIN | V34: O'NEILL | X34: HUNTER
A35: OAKLEIGH | C35: DENNING 6 | G35: FRASER 3 | I35: DEAN 2 | K35: WILTSHIRE | N35: CRAMERI
A37: PRAHRAN | C37: 4 | D37: 0 | E37: =C37*6+D37 -> 24 | G37: 7 | H37: 6 | I37: =G37*6+H37 -> 48 | K37: 10 | L37: 8 | M37: =K37*6+L37 -> 68 | O37: 10 | P37: 12 | Q37: =O37*6+P37 -> 72 | S37: PORT MELBOURNE
A38: PORT MELBOURNE | C38: 2 | D38: 3 | E38: =C38*6+D38 -> 15 | G38: 4 | H38: 4 | I38: =G38*6+H38 -> 28 | K38: 7 | L38: 8 | M38: =K38*6+L38 -> 50 | O38: 7 | P38: 10 | Q38: =O38*6+P38 -> 52 | S38: MURRAY
A39: BEST PLAYERS
A40: PRAHRAN | C40: HYDE | E40: KOOP | H40: THOMPSON | K40: BRENCHLEY | N40: DIXON | Q40: WHITE
A41: PORT MELBOURNE | C41: BEDFORD | E41: KEATING | H41: JULIER | K41: MALTBY | N41: LAHIFF | Q41: PLUMRIDGE
A42: GOALKICKERS
A43: PRAHRAN | C43: BRENCHLEY 3 | F43: THOMPSON 2 | I43: KENNY 2 | K43: HAWKINS | N43: WHITE | P43: AVERY
A44: PORT MELBOURNE | C44: BEDFORD 5 | F44: KEATING 2
A46: NORTHCOTE | C46: 1 | D46: 3 | E46: =C46*6+D46 -> 9 | G46: 10 | H46: 5 | I46: =G46*6+H46 -> 65 | K46: 11 | L46: 8 | M46: =K46*6+L46 -> 74 | O46: 17 | P46: 10 | Q46: =O46*6+P46 -> 112 | S46: PRESTON
A47: PRESTON | C47: 4 | D47: 6 | E47: =C47*6+D47 -> 30 | G47: 7 | H47: 9 | I47: =G47*6+H47 -> 51 | K47: 10 | L47: 11 | M47: =K47*6+L47 -> 71 | O47: 11 | P47: 12 | Q47: =O47*6+P47 -> 78 | S47: LESTER
A48: BEST PLAYERS
A49: NORTHCOTE | C49: SEYMOUR | F49: SMITH | I49: ACKLAND | L49: GOULLETT | O49: COLLINS | R49: LYNGCOLN
A50: PRESTON | C50: S SMITH | F50: WARR | I50: L HOOK | L50: DINEEN | O50: McEACHARN | R50: McSWAIN
A51: GOALKICKERS
A52: NORTHCOTE | C52: SEYMOUR 8 | F52: SMITH 3 | I52: GRAY 2 | K52: WILLIAMSON | N52: BYRNE | P52: POWELL | R52: HUMPHRIES
A53: PRESTON | C53: HOOK 3 | F53: LINDSAY 3 | I53: DINEEN | K53: MORAN | M53: DOYLE | O53: HEARN | Q53: WARR
A55: YARRAVILLE | C55: 0 | D55: 1 | E55: =C55*6+D55 -> 1 | G55: 5 | H55: 3 | I55: =G55*6+H55 -> 33 | K55: 11 | L55: 11 | M55: =K55*6+L55 -> 77 | O55: 16 | P55: 15 | Q55: =O55*6+P55 -> 111 | S55: YARRAVILLE
A56: WILLIAMSTOWN | C56: 3 | D56: 8 | E56: =C56*6+D56 -> 26 | G56: 5 | H56: 8 | I56: =G56*6+H56 -> 38 | K56: 10 | L56: 10 | M56: =K56*6+L56 -> 70 | O56: 11 | P56: 13 | Q56: =O56*6+P56 -> 79 | S56: MOWLAM
A57: BEST PLAYERS
A58: YARRAVILLE | C58: SHEAHAN | F58: J BUCKLEY | I58: A EDWARDS | L58: CAMERON | O58: PENNY | Q58: McGRATH
A59: WILLIAMSTOWN | C59: CAHILL | F59: JOHNS | I59: STANBRIDGE | L59: BLAKE | O59: ADDISON | Q59: COOK
A60: GOALKICKERS
A61: YARRAVILLE | C61: J BUCKLEY 5 | F61: OLIVER 2 | I61: SHEEHAN 2 | L61: McGRATH 2 | O61: CAMERON | Q61: EVANS | S61: PETERS | U61: WHITE
A62: WILLIAMSTOWN | C62: CAHILL 2 | F62: STANBRIDGE 2 | I62: GRAHAM 2 | L62: SCOTT | N62: BLAKE | P62: ADDISON | R62: COOK | T62: SINCLAIR
A64: ROUND 2 | E64: 5TH MAY | J64: WEATHER | M64: FINE | S64: PLAYED AT
D65: 1ST QTR | H65: 2ND QTR | L65: 3RD QTR | P65: FINAL | S65: TOORAK PARK
A66: PRAHRAN | C66: 4 | D66: 2 | E66: =C66*6+D66 -> 26 | G66: 6 | H66: 12 | I66: =G66*6+H66 -> 48 | K66: 9 | L66: 15 | M66: =K66*6+L66 -> 69 | O66: 14 | P66: 18 | Q66: =O66*6+P66 -> 102 | S66: UMPIRE | X66: LADDER | AB66: ROUND | AD66: 2
A67: CAMBERWELL | C67: 6 | D67: 2 | E67: =C67*6+D67 -> 38 | G67: 9 | H67: 4 | I67: =G67*6+H67 -> 58 | K67: 11 | L67: 6 | M67: =K67*6+L67 -> 72 | O67: 14 | P67: 9 | Q67: =O67*6+P67 -> 93 | S67: MILLER
A68: BEST PLAYERS | W68: TEAM | X68: W | Y68: L | Z68: D | AA68: FOR | AB68: AGST | AC68: % | AD68: PTS
A69: PRAHRAN | C69: HYDE | E69: GREENWOOD | H69: HAWKINS | K69: WESCOTT | N69: AVERY | Q69: KENNY
A70: CAMBERWELL | C70: JONES | E70: WHELAN | H70: CLAMP | K70: LAWN | W70: NORTHCOTE | X70: 2 | Y70: 0 | Z70: 0 | AA70: 302 | AB70: 162 | AC70: 186.41975308641975 | AD70: 8
A71: GOALKICKERS | W71: YARRAVILLE | X71: 2 | Y71: 0 | Z71: 0 | AA71: 207 | AB71: 170 | AC71: 121.76470588235294 | AD71: 8
A72: PRAHRAN | C72: HAWKINS 5 | F72: THOMPSON 2 | I72: KENNY 2 | K72: N WILLIAMS 2 | N72: AVERY | P72: MASON | R72: WELLS | W72: PRAHRAN | X72: 2 | Y72: 0 | Z72: 0 | AA72: 174 | AB72: 145 | AC72: 120 | AD72: 8
A73: CAMBERWELL | C73: LAWN 4 | E73: TATHAM 3 | H73: WHELAN 2 | J73: CLAMP 2 | M73: BEAGLEY | O73: O'SHEA | Q73: HUNTER | W73: SANDRINGHAM | X73: 2 | Y73: 0 | Z73: 0 | AA73: 187 | AB73: 167 | AC73: 111.97604790419162 | AD73: 8
A75: YARRAVILLE | C75: 3 | D75: 5 | E75: =C75*6+D75 -> 23 | G75: 5 | H75: 8 | I75: =G75*6+H75 -> 38 | K75: 9 | L75: 16 | M75: =K75*6+L75 -> 70 | O75: 13 | P75: 18 | Q75: =O75*6+P75 -> 96 | S75: YARRAVILLE | W75: OAKLEIGH | X75: 1 | Y75: 1 | Z75: 0 | AA75: 227 | AB75: 203 | AC75: 111.82266009852216 | AD75: 4
A76: BRIGHTON | C76: 3 | D76: 3 | E76: =C76*6+D76 -> 21 | G76: 8 | H76: 8 | I76: =G76*6+H76 -> 56 | K76: 10 | L76: 8 | M76: =K76*6+L76 -> 68 | O76: 13 | P76: 13 | Q76: =O76*6+P76 -> 91 | S76: McLATCHIE | W76: CAMBERWELL | X76: 1 | Y76: 1 | Z76: 0 | AA76: 212 | AB76: 196 | AC76: 108.16326530612245 | AD76: 4
A77: BEST PLAYERS | W77: COBURG | X77: 1 | Y77: 1 | Z77: 0 | AA77: 156 | AB77: 159 | AC77: 98.113207547169807 | AD77: 4
A78: YARRAVILLE | C78: A EDWARDS | F78: J BUCKLEY | I78: McGRATH | L78: EVANS | N78: WARDEN | Q78: PETERS | W78: PRESTON | X78: 1 | Y78: 1 | Z78: 0 | AA78: 183 | AB78: 192 | AC78: 95.3125 | AD78: 4
A79: BRIGHTON | C79: LILBURNE | F79: HILL | I79: TUCKER | L79: McLEOD | N79: J O'BRIEN | Q79: CONNELL | W79: BRIGHTON | X79: 0 | Y79: 2 | Z79: 0 | AA79: 160 | AB79: 183 | AC79: 87.431693989071036 | AD79: 0
A80: GOALKICKERS | W80: PORT MELBOURNE | X80: 0 | Y80: 2 | Z80: 0 | AA80: 150 | AB80: 172 | AC80: 87.20930232558139 | AD80: 0
A81: YARRAVILLE | C81: J BUCKLEY 6 | F81: OLIVER 2 | I81: McGRATH 2 | L81: EVANS | N81: FREW | Q81: WARDEN | W81: BRUNSWICK | X81: 0 | Y81: 2 | Z81: 0 | AA81: 138 | AB81: 209 | AC81: 66.028708133971293 | AD81: 0
A82: BRIGHTON | C82: LILBURNE 5 | F82: TUCKER 3 | I82: CONNELL 2 | L82: DEAN | N82: McLEOD | Q82: AVERY | W82: WILLIAMSTOWN | X82: 0 | Y82: 2 | Z82: 0 | AA82: 163 | AB82: 301 | AC82: 54.152823920265782 | AD82: 0
A84: SANDRINGHAM | C84: 1 | D84: 3 | E84: =C84*6+D84 -> 9 | G84: 5 | H84: 6 | I84: =G84*6+H84 -> 36 | K84: 9 | L84: 8 | M84: =K84*6+L84 -> 62 | O84: 15 | P84: 10 | Q84: =O84*6+P84 -> 100 | S84: BEACH ROAD
A85: PORT MELBOURNE | C85: 3 | D85: 8 | E85: =C85*6+D85 -> 26 | G85: 8 | H85: 9 | I85: =G85*6+H85 -> 57 | K85: 11 | L85: 14 | M85: =K85*6+L85 -> 80 | O85: 14 | P85: 14 | Q85: =O85*6+P85 -> 98 | S85: MURRAY
A86: BEST PLAYERS
A87: SANDRINGHAM | C87: SCHARP | F87: LUNN | I87: DENNINGTON | L87: CAMPBELL | O87: McCOMB | R87: TOLSON
A88: PORT MELBOURNE | C88: GARBUTT | F88: W PERRETT | I88: LAHIFF | L88: BROOKER | O88: KEATING | R88: TUITE
A89: GOALKICKERS
A90: SANDRINGHAM | C90: JOHNSON 4 | F90: DOWLING 2 | I90: DENNINGTON 2 | L90: MCCOMB 2 | O90: TOLSON 2 | Q90: BECKTON | T90: PERRETT | W90: LE NEPVEU
A91: PORT MELBOURNE | C91: RUSDEN 4 | F91: LAHIFF 3 | I91: KEATING 2 | L91: ALDRIDGE 2 | O91: HARDY | Q91: MALTBY | S91: JULIER
A93: OAKLEIGH | C93: 4 | D93: 4 | E93: =C93*6+D93 -> 28 | G93: 8 | H93: 5 | I93: =G93*6+H93 -> 53 | K93: 15 | L93: 10 | M93: =K93*6+L93 -> 100 | O93: 19 | P93: 19 | Q93: =O93*6+P93 -> 133 | S93: OAKLEIGH
A94: BRUNSWICK | C94: 5 | D94: 3 | E94: =C94*6+D94 -> 33 | G94: 8 | H94: 3 | I94: =G94*6+H94 -> 51 | K94: 10 | L94: 4 | M94: =K94*6+L94 -> 64 | O94: 13 | P94: 6 | Q94: =O94*6+P94 -> 84 | S94: DAVENPORT
A95: BEST PLAYERS
A96: OAKLEIGH | C96: DENNING | E96: R SMITH | H96: GOULD | L96: WATSON | O96: McALLISTER | R96: FRASER
A97: BRUNSWICK | C97: DOWLING | E97: WOODS | H97: BLACKMORE | L97: ANDERSON | O97: KENNEDY
A98: GOALKICKERS
A99: OAKLEIGH | C99: DENNING 6 | F99: FRASER 5 | I99: CHAPMAN 3 | L99: WATSON | N99: MUDGE | P99: BELL | R99: WITHERS | U99: MOONEY
A100: BRUNSWICK | C100: JONES 4 | F100: ANDERSON 3 | I100: KENNEDY 2 | L100: DOWLING 2 | O100: BEARD | Q100: JENKINS
A102: NORTHCOTE | C102: 7 | D102: 3 | E102: =C102*6+D102 -> 45 | G102: 13 | H102: 6 | I102: =G102*6+H102 -> 84 | K102: 20 | L102: 9 | M102: =K102*6+L102 -> 129 | O102: 30 | P102: 10 | Q102: =O102*6+P102 -> 190 | S102: NORTHCOTE
A103: WILLIAMSTOWN | C103: 4 | D103: 2 | E103: =C103*6+D103 -> 26 | G103: 4 | H103: 8 | I103: =G103*6+H103 -> 32 | K103: 4 | L103: 11 | M103: =K103*6+L103 -> 35 | O103: 11 | P103: 18 | Q103: =O103*6+P103 -> 84 | S103: NOWLAN
A104: BEST PLAYERS
A105: NORTHCOTE | C105: SEYMOUR | F105: GRAY | I105: GOULLETT | L105: HASKETT | O105: ACKLAND | Q105: WILLIAMSON
A106: WILLIAMSTOWN | C106: CAHILL | F106: STANBRIDGE | I106: LONERGAN | L106: WARD | O106: COOK | Q106: BLAKE
A107: GOALKICKERS
A108: NORTHCOTE | C108: SEYMOUR 14 | F108: GRAY 6 | H108: GOULLET 2 | J108: ROSS 2 | L108: SIMMONDS 2 | O108: SMITH | Q108: WILLIAMSON | T108: MEITZKE | W108: ACKLAND
A109: WILLIAMSTOWN | C109: CAHILL 6 | F109: BLAKE 2 | I109: BARNES 2 | L109: GRAHAM
A111: PRESTON | C111: 3 | D111: 0 | E111: =C111*6+D111 -> 18 | G111: 8 | H111: 2 | I111: =G111*6+H111 -> 50 | K111: 10 | L111: 7 | M111: =K111*6+L111 -> 67 | O111: 16 | P111: 9 | Q111: =O111*6+P111 -> 105 | S111: COBURG
A112: COBURG | C112: 2 | D112: 5 | E112: =C112*6+D112 -> 17 | G112: 5 | H112: 12 | I112: =G112*6+H112 -> 42 | K112: 10 | L112: 19 | M112: =K112*6+L112 -> 79 | O112: 10 | P112: 20 | Q112: =O112*6+P112 -> 80 | S112: SCATES
A113: BEST PLAYERS
A114: PRESTON | C114: WARR | E114: STREET | H114: DINEEN | K114: DOYLE | N114: McEACHARN | Q114: BOSCHEN
A115: COBURG | C115: MEARS | E115: A MARTYN | H115: NASH | K115: MOSS | N115: HILL | Q115: BERTRAM
A116: GOALKICKERS
A117: PRESTON | C117: WARR 5 | E117: LINDSAY 3 | H117: BOSCHEN 3 | K117: HOOK 2 | M117: DINEEN 2 | P117: MORAN
A118: COBURG | C118: NASH 2 | E118: MEARS 2 | H118: HULL 2 | K118: GUIER | M118: MARTIN | P118: MOSS | R118: HARRIS
A120: ROUND 3 | E120: 12TH MAY | J120: WEATHER | M120: FINE MILD NORTH BREEZE | S120: PLAYED AT
D121: 1ST QTR | H121: 2ND QTR | L121: 3RD QTR | P121: FINAL | S121: CAMBERWELL
A122: SANDRINGHAM | C122: 0 | D122: 0 | E122: =C122*6+D122 -> 0 | G122: 7 | H122: 4 | I122: =G122*6+H122 -> 46 | K122: 11 | L122: 4 | M122: =K122*6+L122 -> 70 | O122: 15 | P122: 9 | Q122: =O122*6+P122 -> 99 | S122: UMPIRE | X122: LADDER | AB122: ROUND | AD122: 3
A123: CAMBERWELL | C123: 4 | D123: 6 | E123: =C123*6+D123 -> 30 | G123: 5 | H123: 8 | I123: =G123*6+H123 -> 38 | K123: 10 | L123: 12 | M123: =K123*6+L123 -> 72 | O123: 12 | P123: 15 | Q123: =O123*6+P123 -> 87 | S123: GLOVER
A124: BEST PLAYERS | W124: TEAM | X124: W | Y124: L | Z124: D | AA124: FOR | AB124: AGST | AC124: % | AD124: PTS
A125: SANDRINGHAM | C125: TOLSON | F125: DOWLING | I125: SCHARP | L125: JONES | O125: THOMS | Q125: CAMPBELL
A126: CAMBERWELL | C126: WARTMAN | F126: LAWN | I126: TATHAM | L126: O'NEILL | O126: CLAMP | Q126: H JONES | W126: NORTHCOTE | X126: 3 | Y126: 0 | Z126: 0 | AA126: 440 | AB126: 242 | AC126: 181.81818181818181 | AD126: 12
A127: GOALKICKERS | W127: PRAHRAN | X127: 3 | Y127: 0 | Z127: 0 | AA127: 313 | AB127: 254 | AC127: 123.22834645669292 | AD127: 12
A128: SANDRINGHAM | C128: DOWLING 5 | F128: TOLSON 4 | I128: JOHNSON 2 | L128: DENNINGTON | O128: McCOMB | Q128: SMAIL | S128: SCHLITZ | W128: SANDRINGHAM | X128: 3 | Y128: 0 | Z128: 0 | AA128: 286 | AB128: 254 | AC128: 112.5984251968504 | AD128: 12
A129: CAMBERWELL | C129: LAWN 3 | F129: TATHAM 3 | I129: O'NEILL 2 | L129: WHELAN | N129: HUNTER | P129: WARTMAN | W129: YARRAVILLE | X129: 2 | Y129: 1 | Z129: 0 | AA129: 279 | AB129: 267 | AC129: 104.49438202247191 | AD129: 8
A131: NORTHCOTE | C131: 1 | D131: 1 | E131: =C131*6+D131 -> 7 | G131: 8 | H131: 5 | I131: =G131*6+H131 -> 53 | K131: 14 | L131: 9 | M131: =K131*6+L131 -> 93 | O131: 21 | P131: 12 | Q131: =O131*6+P131 -> 138 | S131: NORTHCOTE | W131: PRESTON | X131: 2 | Y131: 1 | Z131: 0 | AA131: 274 | AB131: 269 | AC131: 101.85873605947955 | AD131: 8
A132: COBURG | C132: 4 | D132: 3 | E132: =C132*6+D132 -> 27 | G132: 4 | H132: 3 | I132: =G132*6+H132 -> 27 | K132: 9 | L132: 5 | M132: =K132*6+L132 -> 59 | O132: 12 | P132: 8 | Q132: =O132*6+P132 -> 80 | S132: STEWART | W132: OAKLEIGH | X132: 1 | Y132: 2 | Z132: 0 | AA132: 304 | AB132: 294 | AC132: 103.40136054421768 | AD132: 4
A133: BEST PLAYERS | W133: CAMBERWELL | X133: 1 | Y133: 2 | Z133: 0 | AA133: 299 | AB133: 295 | AC133: 101.35593220338983 | AD133: 4
A134: NORTHCOTE | C134: ROSS | E134: SEYMOUR | H134: GRAY | K134: GOULLETT | N134: WILLIAMSON | Q134: LUDLOW | W134: PORT MELBOURNE | X134: 1 | Y134: 2 | Z134: 0 | AA134: 247 | AB134: 244 | AC134: 101.22950819672131 | AD134: 4
A135: COBURG | C135: MOSS | E135: A MARTYN | H135: BERTRAM | K135: BROWN | N135: LOWE | Q135: BROOM | W135: BRIGHTON | X135: 1 | Y135: 2 | Z135: 0 | AA135: 262 | AB135: 260 | AC135: 100.76923076923077 | AD135: 4
A136: GOALKICKERS | Q136: SMITH | W136: COBURG | X136: 1 | Y136: 2 | Z136: 0 | AA136: 236 | AB136: 297 | AC136: 79.46127946127946 | AD136: 4
A137: NORTHCOTE | C137: SEYMOUR 9 | F137: GRAY 2 | H137: WILLIAMSON 2 | K137: ROSS 2 | M137: SIMMONDS 2 | P137: HONIG 2 | R137: LUDLOW | W137: BRUNSWICK | X137: 0 | Y137: 3 | Z137: 0 | AA137: 247 | AB137: 348 | AC137: 70.977011494252878 | AD137: 0
A138: COBURG | C138: BROWN 4 | E138: MARTYN 3 | H138: ANDERSON 2 | K138: KIGHT | M138: MEARS | P138: VOIGHT | W138: WILLIAMSTOWN | X138: 0 | Y138: 3 | Z138: 0 | AA138: 240 | AB138: 403 | AC138: 59.553349875930522 | AD138: 0
A140: PRESTON | C140: 6 | D140: 2 | E140: =C140*6+D140 -> 38 | G140: 7 | H140: 6 | I140: =G140*6+H140 -> 48 | K140: 11 | L140: 11 | M140: =K140*6+L140 -> 77 | O140: 13 | P140: 13 | Q140: =O140*6+P140 -> 91 | S140: PRESTON
A141: OAKLEIGH | C141: 1 | D141: 2 | E141: =C141*6+D141 -> 8 | G141: 8 | H141: 8 | I141: =G141*6+H141 -> 56 | K141: 9 | L141: 9 | M141: =K141*6+L141 -> 63 | O141: 11 | P141: 11 | Q141: =O141*6+P141 -> 77 | S141: LESTER
A142: BEST PLAYERS
A143: PRESTON | C143: HOOK | E143: BREWIS | H143: BOSCHEN | K143: WARR | N143: DINEEN | Q143: UNDERHILL
A144: OAKLEIGH | C144: DENNING | E144: FRASER | H144: WILTSHIRE | K144: YANN | N144: WITHERS | Q144: GOULD
A145: GOALKICKERS
A146: PRESTON | C146: HOOK 5 | E146: WARR 3 | G146: LINDSAY 2 | J146: BOSCHEN | M146: ARTHUR | O146: McEACHERN
A147: OAKLEIGH | C147: FRASER 5 | E147: DENNING 3 | H147: WITHERS | J147: DALTON
A149: BRIGHTON | C149: 3 | D149: 3 | E149: =C149*6+D149 -> 21 | G149: 6 | H149: 6 | I149: =G149*6+H149 -> 42 | K149: 10 | L149: 7 | M149: =K149*6+L149 -> 67 | O149: 15 | P149: 12 | Q149: =O149*6+P149 -> 102 | S149: WILLIAMSTOWN
A150: WILLIAMSTOWN | C150: 3 | D150: 3 | E150: =C150*6+D150 -> 21 | G150: 4 | H150: 5 | I150: =G150*6+H150 -> 29 | K150: 10 | L150: 8 | M150: =K150*6+L150 -> 68 | O150: 11 | P150: 11 | Q150: =O150*6+P150 -> 77 | S150: LEWIS
A151: BEST PLAYERS
A152: BRIGHTON | C152: LILBURNE | F152: TUCKER | I152: HILL | K152: DREW | N152: STEWART | Q152: DEANE
A153: WILLIAMSTOWN | C153: STANBRIDGE | F153: BARNES | I153: COOK | K153: ADDISON | N153: McGILLIVRAY | Q153: McCABE
A154: GOALKICKERS
A155: BRIGHTON | C155: DEAN 5 | E155: LILBURNE 3 | H155: CONNELL 2 | K155: McLEOD 2 | M155: TUCKER | O155: WILLIAMSON | R155: HUNT
A156: WILLIAMSTOWN | C156: ADDISON 4 | F156: BARNES 2 | I156: WARD 2 | K156: STANBRIDGE | N156: McGILLIVRAY | Q156: McCABE
A158: PRAHRAN | C158: 4 | D158: 4 | E158: =C158*6+D158 -> 28 | G158: 5 | H158: 6 | I158: =G158*6+H158 -> 36 | K158: 12 | L158: 8 | M158: =K158*6+L158 -> 80 | O158: 21 | P158: 13 | Q158: =O158*6+P158 -> 139 | S158: BRUNSWICK
A159: BRUNSWICK | C159: 3 | D159: 2 | E159: =C159*6+D159 -> 20 | G159: 11 | H159: 6 | I159: =G159*6+H159 -> 72 | K159: 14 | L159: 9 | M159: =K159*6+L159 -> 93 | O159: 16 | P159: 13 | Q159: =O159*6+P159 -> 109 | S159: FRICKE
A160: BEST PLAYERS
A161: PRAHRAN | C161: MUNN | E161: KOOP | H161: BRENCHLEY | K161: MASON | N161: HAWKINS | Q161: WESCOTT
A162: BRUNSWICK | C162: JENKINS | E162: DOWLING | H162: ANDERSON | K162: JONES | N162: WOODS | Q162: THOMPSON
A163: GOALKICKERS
A164: PRAHRAN | C164: BRENCHLEY 5 | F164: KENNY 4 | I164: HAWKINS 4 | L164: BARTLING 3 | O164: THOMPSON 2 | R164: WHITE 2 | U164: AVERY
A165: BRUNSWICK | C165: ANDERSON 5 | F165: JONES 4 | I165: DOWLING 3 | L165: BEARD 3 | O165: MILLEN
A167: PORT MELBOURNE | C167: 2 | D167: 4 | E167: =C167*6+D167 -> 16 | G167: 7 | H167: 9 | I167: =G167*6+H167 -> 51 | K167: 11 | L167: 11 | M167: =K167*6+L167 -> 77 | O167: 14 | P167: 13 | Q167: =O167*6+P167 -> 97 | S167: PORT MELBOURNE
A168: YARRAVILLE | C168: 2 | D168: 5 | E168: =C168*6+D168 -> 17 | G168: 2 | H168: 7 | I168: =G168*6+H168 -> 19 | K168: 8 | L168: 8 | M168: =K168*6+L168 -> 56 | O168: 10 | P168: 12 | Q168: =O168*6+P168 -> 72 | S168: McMULLEN
A169: BEST PLAYERS
A170: PORT MELBOURNE | C170: KEATING | F170: GARBUTT | I170: LAHIFF | L170: RUSDEN | O170: TUITE | R170: BROOKER
A171: YARRAVILLE | C171: WUNHYM | F171: SHEAHAN | I171: J BUCKLEY | L171: McGRATH | O171: WAL STRONG
A172: GOALKICKERS
A173: PORT MELBOURNE | C173: RUSDEN 4 | F173: LAHIFF 4 | I173: KEATING 2 | L173: MALTBY | N173: TUITE | P173: BROOKER | R173: McNAMARA
A174: YARRAVILLE | C174: J BUCKLEY 4 | F174: EVANS 2 | I174: SHEEHAN 2 | L174: WUNHYM | N174: WAL STRONG
A176: ROUND 4 | E176: 19TH MAY | J176: WEATHER | M176: FINE MILD | S176: PLAYED AT
D177: 1ST QTR | H177: 2ND QTR | L177: 3RD QTR | P177: FINAL | S177: TOORAK PARK
A178: PRESTON | C178: 5 | D178: 4 | E178: =C178*6+D178 -> 34 | G178: 7 | H178: 7 | I178: =G178*6+H178 -> 49 | K178: 12 | L178: 13 | M178: =K178*6+L178 -> 85 | O178: 16 | P178: 16 | Q178: =O178*6+P178 -> 112 | S178: UMPIRE | X178: LADDER | AB178: ROUND | AD178: 4
A179: PRAHRAN | C179: 3 | D179: 2 | E179: =C179*6+D179 -> 20 | G179: 6 | H179: 6 | I179: =G179*6+H179 -> 42 | K179: 9 | L179: 9 | M179: =K179*6+L179 -> 63 | O179: 11 | P179: 14 | Q179: =O179*6+P179 -> 80 | S179: STEWART
A180: BEST PLAYERS | W180: TEAM | X180: W | Y180: L | Z180: D | AA180: FOR | AB180: AGST | AC180: % | AD180: PTS
A181: PRESTON | C181: DINEEN | E181: WARR | H181: ARTHUR | K181: MORAN | N181: BOSCHEN | Q181: LINDSAY
A182: PRAHRAN | C182: WHITE | E182: KOOP | H182: SMITH | K182: AVERY | N182: MUNN | Q182: THOMPSON | W182: SANDRINGHAM | X182: 4 | Y182: 0 | Z182: 0 | AA182: 426 | AB182: 365 | AC182: 116.71232876712328 | AD182: 16
A183: GOALKICKERS | W183: NORTHCOTE | X183: 3 | Y183: 1 | Z183: 0 | AA183: 560 | AB183: 371 | AC183: 150.9433962264151 | AD183: 12
A184: PRESTON | C184: WARR 5 | E184: McEACHERN 3 | H184: HOOK 2 | J184: LINDSAY 2 | M184: HARDING 2 | P184: MORAN | R184: McSWAIN | W184: YARRAVILLE | X184: 3 | Y184: 1 | Z184: 0 | AA184: 401 | AB184: 343 | AC184: 116.90962099125365 | AD184: 12
A185: PRAHRAN | C185: AVERY 4 | E185: BRENCHLEY 2 | H185: HAWKINS 2 | K185: N WILLIAMS 2 | N185: BARTLING | W185: PRESTON | X185: 3 | Y185: 1 | Z185: 0 | AA185: 386 | AB185: 349 | AC185: 110.60171919770774 | AD185: 12
A187: OAKLEIGH | C187: 4 | D187: 4 | E187: =C187*6+D187 -> 28 | G187: 9 | H187: 8 | I187: =G187*6+H187 -> 62 | K187: 13 | L187: 11 | M187: =K187*6+L187 -> 89 | O187: 19 | P187: 15 | Q187: =O187*6+P187 -> 129 | S187: OAKLEIGH | W187: PRAHRAN | X187: 3 | Y187: 1 | Z187: 0 | AA187: 393 | AB187: 366 | AC187: 107.37704918032787 | AD187: 12
A188: NORTHCOTE | C188: 7 | D188: 6 | E188: =C188*6+D188 -> 48 | G188: 8 | H188: 9 | I188: =G188*6+H188 -> 57 | K188: 14 | L188: 12 | M188: =K188*6+L188 -> 96 | O188: 18 | P188: 12 | Q188: =O188*6+P188 -> 120 | S188: GREGORY | W188: OAKLEIGH | X188: 2 | Y188: 2 | Z188: 0 | AA188: 433 | AB188: 414 | AC188: 104.58937198067633 | AD188: 8
A189: BEST PLAYERS | W189: BRIGHTON | X189: 2 | Y189: 2 | Z189: 0 | AA189: 367 | AB189: 359 | AC189: 102.2284122562674 | AD189: 8
A190: OAKLEIGH | C190: FLEMING | F190: BAKER | H190: YANN | K190: DENNING | N190: WITHERS | Q190: WILTSHIRE | W190: COBURG | X190: 2 | Y190: 2 | Z190: 0 | AA190: 335 | AB190: 388 | AC190: 86.340206185567013 | AD190: 8
A191: NORTHCOTE | C191: HASSETT | F191: ROSS | H191: SEYMOUR | K191: WILLIAMSON | N191: WOODS | Q191: SMITH | W191: PORT MELBOURNE | X191: 1 | Y191: 3 | Z191: 0 | AA191: 346 | AB191: 349 | AC191: 99.140401146131808 | AD191: 4
A192: GOALKICKERS | P192: BAKER | R192: WATSON | W192: CAMBERWELL | X192: 1 | Y192: 3 | Z192: 0 | AA192: 375 | AB192: 417 | AC192: 89.928057553956833 | AD192: 4
A193: OAKLEIGH | C193: DENNING 4 | F193: FLEMING 3 | I193: FRASER 3 | K193: CHAPMAN 2 | N193: YANN 2 | P193: HEINTZ 2 | R193: CRAMERI | W193: BRUNSWICK | X193: 0 | Y193: 4 | Z193: 0 | AA193: 358 | AB193: 488 | AC193: 73.360655737704917 | AD193: 0
A194: NORTHCOTE | C194: SEYMOUR 8 | F194: WILLIAMSON 4 | J194: ROSS 4 | L194: GRAY | N194: SIMMONDS | W194: WILLIAMSTOWN | X194: 0 | Y194: 4 | Z194: 0 | AA194: 331 | AB194: 502 | AC194: 65.936254980079681 | AD194: 0
A196: BRIGHTON | C196: 3 | D196: 5 | E196: =C196*6+D196 -> 23 | G196: 7 | H196: 6 | I196: =G196*6+H196 -> 48 | K196: 12 | L196: 9 | M196: =K196*6+L196 -> 81 | O196: 15 | P196: 15 | Q196: =O196*6+P196 -> 105 | S196: ELSTERNWICK PARK
A197: PORT MELBOURNE | C197: 3 | D197: 3 | E197: =C197*6+D197 -> 21 | G197: 7 | H197: 5 | I197: =G197*6+H197 -> 47 | K197: 13 | L197: 11 | M197: =K197*6+L197 -> 89 | O197: 14 | P197: 15 | Q197: =O197*6+P197 -> 99 | S197: HASSETT
A198: BEST PLAYERS
A199: BRIGHTON | C199: LILBURNE | F199: CONNELL | I199: CAMPBELL | L199: J O'BRIEN | N199: DREW | P199: TOMLIN
A200: PORT MELBOURNE | C200: PLUMRIDGE | F200: GARBUTT | I200: KEATING | L200: TUITE | N200: LEGGO | P200: LAHIFF
A201: GOALKICKERS
A202: BRIGHTON | C202: CONNELL 4 | F202: LILBURNE 3 | I202: DEAN 2 | K202: TUCKER 2 | M202: HILL | O202: TENNANT | Q202: DREW | S202: BOLWELL
A203: PORT MELBOURNE | C203: KEATING 4 | F203: RUSDEN 3 | I203: LAHIFF 2 | K203: ALDRIDGE 2 | N203: HARDY | P203: ATKINSON | S203: GARBUTT
A205: COBURG | C205: 5 | D205: 4 | E205: =C205*6+D205 -> 34 | G205: 9 | H205: 8 | I205: =G205*6+H205 -> 62 | K205: 11 | L205: 11 | M205: =K205*6+L205 -> 77 | O205: 14 | P205: 15 | Q205: =O205*6+P205 -> 99 | S205: COBURG
A206: WILLIAMSTOWN | C206: 4 | D206: 0 | E206: =C206*6+D206 -> 24 | G206: 9 | H206: 5 | I206: =G206*6+H206 -> 59 | K206: 13 | L206: 12 | M206: =K206*6+L206 -> 90 | O206: 13 | P206: 13 | Q206: =O206*6+P206 -> 91 | S206: KILKENNY
A207: BEST PLAYERS
A208: COBURG | C208: KIGHT | E208: BREEN | H208: BERTRAM | K208: BROOM | M208: A MARTYN | P208: BOYD
A209: WILLIAMSTOWN | C209: CAHILL | E209: STANBRIDGE | H209: BARNES | K209: SYKES | M209: DELLER | P209: BROOKS
A210: GOALKICKERS
A211: COBURG | C211: NASH 3 | E211: KIGHT 2 | G211: BROWN 2 | I211: MEARS | K211: HULL | M211: MOSS | O211: VOIGHT | Q211: BROOM | S211: BREEN | U211: BOYD
A212: WILLIAMSTOWN | C212: CAHILL 5 | F212: BARNES 3 | I212: McCABE 2 | L212: ADDISON | N212: SINCLAIR | P212: STEBBINS
A214: YARRAVILLE | C214: 2 | D214: 2 | E214: =C214*6+D214 -> 14 | G214: 9 | H214: 5 | I214: =G214*6+H214 -> 59 | K214: 15 | L214: 8 | M214: =K214*6+L214 -> 98 | O214: 19 | P214: 8 | Q214: =O214*6+P214 -> 122 | S214: YARRAVILLE
A215: CAMBERWELL | C215: 3 | D215: 5 | E215: =C215*6+D215 -> 23 | G215: 3 | H215: 7 | I215: =G215*6+H215 -> 25 | K215: 5 | L215: 12 | M215: =K215*6+L215 -> 42 | O215: 10 | P215: 16 | Q215: =O215*6+P215 -> 76 | S215: WALTER
A216: BEST PLAYERS
A217: YARRAVILLE | C217: LAVENDER | F217: J BUCKLEY | I217: KENNY | L217: W BUCKLEY | O217: MITCHELL | R217: CAMERON
A218: CAMBERWELL | C218: WARTMAN | F218: JONES | I218: TATHAM | L218: BEAGLEY | O218: PETRIE | R218: HUNTER
A219: GOALKICKERS
A220: YARRAVILLE | C220: J BUCKLEY 8 | F220: McGRATH 4 | I220: SHEEHAN 2 | L220: CAMERON 2 | O220: WARDEN 2 | R220: WAL STRONG
A221: CAMBERWELL | C221: PETRIE 4 | F221: LAWN 2 | I221: ANDREWS 2 | L221: HERRICKS 2
A223: SANDRINGHAM | C223: 5 | D223: 2 | E223: =C223*6+D223 -> 32 | G223: 11 | H223: 5 | I223: =G223*6+H223 -> 71 | K223: 17 | L223: 7 | M223: =K223*6+L223 -> 109 | O223: 22 | P223: 8 | Q223: =O223*6+P223 -> 140 | S223: BEACH ROAD
A224: BRUNSWICK | C224: 4 | D224: 3 | E224: =C224*6+D224 -> 27 | G224: 7 | H224: 9 | I224: =G224*6+H224 -> 51 | K224: 13 | L224: 10 | M224: =K224*6+L224 -> 88 | O224: 16 | P224: 15 | Q224: =O224*6+P224 -> 111 | S224: FRICKE
A225: BEST PLAYERS
A226: SANDRINGHAM | C226: JOHNSON | F226: DOWLING | I226: TOLSON | L226: LUNN | O226: SCHARP | R226: MALLETT
A227: BRUNSWICK | C227: MUTIMER | F227: JONES | I227: BLACKMORE | L227: JENKINS | O227: WOODS | R227: DOWLING
A228: GOALKICKERS
A229: SANDRINGHAM | C229: JOHNSON 11 | F229: DOWLING 4 | I229: DENNINGTON 2 | L229: TOLSON 2 | O229: BECKTON | Q229: McCOMB | S229: SCHLITZ
A230: BRUNSWICK | C230: JONES 6 | F230: ANDERSON 3 | I230: MUTIMER 2 | L230: REID 2 | O230: ARRELL | Q230: KENNEDY | S230: DOWLING
A232: ROUND 5 | E232: 26TH MAY | J232: WEATHER | M232: FINE MILD NORTH BREEZE | S232: PLAYED AT
D233: 1ST QTR | H233: 2ND QTR | L233: 3RD QTR | P233: FINAL | S233: PRESTON
A234: PRESTON | C234: 2 | D234: 3 | E234: =C234*6+D234 -> 15 | G234: 10 | H234: 9 | I234: =G234*6+H234 -> 69 | K234: 13 | L234: 11 | M234: =K234*6+L234 -> 89 | O234: 15 | P234: 12 | Q234: =O234*6+P234 -> 102 | S234: UMPIRE | X234: LADDER | AB234: ROUND | AD234: 5
A235: SANDRINGHAM | C235: 5 | D235: 2 | E235: =C235*6+D235 -> 32 | G235: 6 | H235: 2 | I235: =G235*6+H235 -> 38 | K235: 8 | L235: 8 | M235: =K235*6+L235 -> 56 | O235: 13 | P235: 11 | Q235: =O235*6+P235 -> 89 | S235: NOWLAN
A236: BEST PLAYERS | W236: TEAM | X236: W | Y236: L | Z236: D | AA236: FOR | AB236: AGST | AC236: % | AD236: PTS
A237: PRESTON | C237: SMITH | E237: WARR | H237: DINEEN | K237: McEACHARN | N237: McSWAIN | Q237: MORAN
A238: SANDRINGHAM | C238: SMAIL | E238: DENNINGTON | H238: SCHARP | K238: McCOMB | N238: SCHLITZ | Q238: MITCHELL | W238: NORTHCOTE | X238: 4 | Y238: 1 | Z238: 0 | AA238: 705 | AB238: 475 | AC238: 148.42105263157896 | AD238: 16
A239: GOALKICKERS | W239: PRESTON | X239: 4 | Y239: 1 | Z239: 0 | AA239: 488 | AB239: 438 | AC239: 111.41552511415524 | AD239: 16
A240: PRESTON | C240: WARR 6 | E240: LINDSAY 3 | H240: HOOK 2 | J240: ARTHUR 2 | M240: MORAN | P240: SPOKES | W240: SANDRINGHAM | X240: 4 | Y240: 1 | Z240: 0 | AA240: 515 | AB240: 467 | AC240: 110.27837259100643 | AD240: 16
A241: SANDRINGHAM | C241: JOHNSON 3 | F241: McCOMB 2 | I241: SMAIL 2 | K241: SCHLITZ 2 | M241: CAMPBELL 2 | P241: DOWLING | R241: THOMS | W241: YARRAVILLE | X241: 3 | Y241: 2 | Z241: 0 | AA241: 485 | AB241: 444 | AC241: 109.23423423423424 | AD241: 12
A243: NORTHCOTE | C243: 5 | D243: 3 | E243: =C243*6+D243 -> 33 | G243: 7 | H243: 5 | I243: =G243*6+H243 -> 47 | K243: 12 | L243: 10 | M243: =K243*6+L243 -> 82 | O243: 22 | P243: 13 | Q243: =O243*6+P243 -> 145 | S243: NORTHCOTE | W243: OAKLEIGH | X243: 3 | Y243: 2 | Z243: 0 | AA243: 522 | AB243: 492 | AC243: 106.09756097560975 | AD243: 12
A244: PRAHRAN | C244: 1 | D244: 5 | E244: =C244*6+D244 -> 11 | G244: 6 | H244: 13 | I244: =G244*6+H244 -> 49 | K244: 10 | L244: 16 | M244: =K244*6+L244 -> 76 | O244: 14 | P244: 20 | Q244: =O244*6+P244 -> 104 | S244: FRICKE | W244: PRAHRAN | X244: 3 | Y244: 2 | Z244: 0 | AA244: 497 | AB244: 511 | AC244: 97.260273972602747 | AD244: 12
A245: BEST PLAYERS | W245: PORT MELBOURNE | X245: 2 | Y245: 3 | Z245: 0 | AA245: 416 | AB245: 406 | AC245: 102.46305418719211 | AD245: 8
A246: NORTHCOTE | C246: BATES | E246: GRAY | H246: ROSS | K246: SEYMOUR | N246: ACKLAND | Q246: MEITZKE | W246: BRIGHTON | X246: 2 | Y246: 3 | Z246: 0 | AA246: 440 | AB246: 450 | AC246: 97.777777777777771 | AD246: 8
A247: PRAHRAN | C247: F SMITH | E247: KOOP | H247: MUNN | K247: WHITE | N247: HAWKINS | Q247: WELLS | W247: CAMBERWELL | X247: 2 | Y247: 3 | Z247: 0 | AA247: 466 | AB247: 490 | AC247: 95.102040816326536 | AD247: 8
A248: GOALKICKERS | W248: COBURG | X248: 2 | Y248: 3 | Z248: 0 | AA248: 413 | AB248: 477 | AC248: 86.582809224318652 | AD248: 8
A249: NORTHCOTE | C249: SEYMOUR 6 | F249: GRAY 5 | H249: ROSS 4 | J249: MEITZKE 2 | M249: ACKLAND 2 | P249: BATES 2 | R249: GOULLET | W249: BRUNSWICK | X249: 1 | Y249: 4 | Z249: 0 | AA249: 459 | AB249: 572 | AC249: 80.24475524475524 | AD249: 4
A250: PRAHRAN | C250: HAWKINS 7 | F250: N WILLIAMS 3 | J250: MUNN 2 | M250: BARTLING | P250: SMITH | W250: WILLIAMSTOWN | X250: 0 | Y250: 5 | Z250: 0 | AA250: 388 | AB250: 572 | AC250: 67.832167832167826 | AD250: 0
A252: OAKLEIGH | C252: 3 | D252: 7 | E252: =C252*6+D252 -> 25 | G252: 5 | H252: 9 | I252: =G252*6+H252 -> 39 | K252: 11 | L252: 15 | M252: =K252*6+L252 -> 81 | O252: 12 | P252: 17 | Q252: =O252*6+P252 -> 89 | S252: COBURG
A253: COBURG | C253: 3 | D253: 1 | E253: =C253*6+D253 -> 19 | G253: 5 | H253: 7 | I253: =G253*6+H253 -> 37 | K253: 9 | L253: 8 | M253: =K253*6+L253 -> 62 | O253: 11 | P253: 12 | Q253: =O253*6+P253 -> 78 | S253: MURRAY
A254: BEST PLAYERS
A255: OAKLEIGH | C255: CHAPMAN | F255: WITHERS | I255: YANN | L255: FLEMING | O255: DENNING | R255: BAKER
A256: COBURG | C256: MOSS | F256: BERTRAM | I256: McDONALD | L256: LOWE | O256: BROWN | R256: BROOM
A257: GOALKICKERS
A258: OAKLEIGH | C258: DENNING 5 | F258: WITHERS 2 | I258: DEAN | K258: FLEMING | M258: HEINTZ | O258: McALISTER | R258: SMITH
A259: COBURG | C259: NASH 5 | E259: HARRIS 2 | G259: DUNCAN 2 | J259: MOSS | L259: McDONALD
A261: CAMBERWELL | C261: 1 | D261: 2 | E261: =C261*6+D261 -> 8 | G261: 5 | H261: 9 | I261: =G261*6+H261 -> 39 | K261: 9 | L261: 10 | M261: =K261*6+L261 -> 64 | O261: 13 | P261: 13 | Q261: =O261*6+P261 -> 91 | S261: CAMBERWELL
A262: BRIGHTON | C262: 4 | D262: 9 | E262: =C262*6+D262 -> 33 | G262: 6 | H262: 10 | I262: =G262*6+H262 -> 46 | K262: 7 | L262: 19 | M262: =K262*6+L262 -> 61 | O262: 8 | P262: 25 | Q262: =O262*6+P262 -> 73 | S262: DUNSTAN
A263: BEST PLAYERS
A264: CAMBERWELL | C264: H JONES | F264: CLARKE | I264: DYBALL | L264: CLAMP | O264: BOOTHMAN | R264: PETRIE
A265: BRIGHTON | C265: CONNELL | F265: J O'BRIEN | I265: HUNT | L265: LILBURNE | O265: TUCKER | R265: BOLWELL
A266: GOALKICKERS
A267: CAMBERWELL | C267: PETRIE 5 | F267: LAWN 2 | I267: HUNTER 2 | L267: JONES 2 | N267: TATHAM | Q267: CLAMP
A268: BRIGHTON | C268: LILBURNE 2 | F268: BOLWELL 2 | I268: DEAN | K268: TUCKER | M268: WILLIAMSON | P268: DREW | R268: O'BRIEN
A270: PORT MELBOURNE | C270: 2 | D270: 5 | E270: =C270*6+D270 -> 17 | G270: 2 | H270: 6 | I270: =G270*6+H270 -> 18 | K270: 7 | L270: 9 | M270: =K270*6+L270 -> 51 | O270: 10 | P270: 10 | Q270: =O270*6+P270 -> 70 | S270: WILLIAMSTOWN
A271: WILLIAMSTOWN | C271: 0 | D271: 2 | E271: =C271*6+D271 -> 2 | G271: 3 | H271: 3 | I271: =G271*6+H271 -> 21 | K271: 5 | L271: 6 | M271: =K271*6+L271 -> 36 | O271: 8 | P271: 9 | Q271: =O271*6+P271 -> 57 | S271: GREGORY
A272: BEST PLAYERS
A273: PORT MELBOURNE | C273: LAHIFF | E273: PERRETT | H273: MALTBY | K273: PLUMRIDGE | N273: GARBUTT | Q273: TUITE
A274: WILLIAMSTOWN | C274: COOK | E274: STANBRIDGE | H274: McCABE | K274: CAHILL | N274: SYKES | Q274: BROOKS
A275: GOALKICKERS
A276: PORT MELBOURNE | C276: RUSDEN 2 | F276: LAHIFF 2 | I276: ATKINSON 2 | L276: KEATING | N276: ALDRIDGE | Q276: MALTBY | S276: LEGGO
A277: WILLIAMSTOWN | C277: CAHILL 5 | F277: STANBRIDGE | I277: COOK | K277: McGILLIVRAY
A279: BRUNSWICK | C279: 2 | D279: 5 | E279: =C279*6+D279 -> 17 | G279: 7 | H279: 9 | I279: =G279*6+H279 -> 51 | K279: 12 | L279: 14 | M279: =K279*6+L279 -> 86 | O279: 14 | P279: 17 | Q279: =O279*6+P279 -> 101 | S279: BRUNSWICK
A280: YARRAVILLE | C280: 3 | D280: 5 | E280: =C280*6+D280 -> 23 | G280: 4 | H280: 9 | I280: =G280*6+H280 -> 33 | K280: 8 | L280: 13 | M280: =K280*6+L280 -> 61 | O280: 11 | P280: 18 | Q280: =O280*6+P280 -> 84 | S280: STUART
A281: BEST PLAYERS
A282: BRUNSWICK | C282: MUTIMER | F282: ANDERSON | I282: JONES | L282: DOWLING | O282: RAEBURN | R282: THOMPSON
A283: YARRAVILLE | C283: J BUCKLEY | F283: CAMERON | I283: KENNY | L283: WUNHYM | O283: RYAN | R283: McGRATH
A284: GOALKICKERS
A285: BRUNSWICK | C285: ANDERSON 7 | F285: JONES 4 | I285: MUTIMER 3 | L285: KENNEDY
A286: YARRAVILLE | C286: J BUCKLEY 6 | F286: SHEEHAN 2 | I286: McGRATH | L286: CAMERON | O286: WARDEN
A288: ROUND 6 | E288: 2ND JUNE | J288: WEATHER | M288: FINE | S288: PLAYED AT
D289: 1ST QTR | H289: 2ND QTR | L289: 3RD QTR | P289: FINAL | S289: BEACH ROAD
A290: NORTHCOTE | C290: 3 | D290: 5 | E290: =C290*6+D290 -> 23 | G290: 6 | H290: 9 | I290: =G290*6+H290 -> 45 | K290: 12 | L290: 12 | M290: =K290*6+L290 -> 84 | O290: 18 | P290: 15 | Q290: =O290*6+P290 -> 123 | S290: UMPIRE | X290: LADDER | AB290: ROUND | AD290: 6
A291: SANDRINGHAM | C291: 2 | D291: 3 | E291: =C291*6+D291 -> 15 | G291: 5 | H291: 8 | I291: =G291*6+H291 -> 38 | K291: 11 | L291: 12 | M291: =K291*6+L291 -> 78 | O291: 14 | P291: 14 | Q291: =O291*6+P291 -> 98 | S291: JURY
A292: BEST PLAYERS | W292: TEAM | X292: W | Y292: L | Z292: D | AA292: FOR | AB292: AGST | AC292: % | AD292: PTS
A293: NORTHCOTE | C293: POWELL | F293: ACKLAND | I293: GARRETT | L293: ROSS | N293: GRAY | Q293: SEYMOUR
A294: SANDRINGHAM | C294: McCOMB | F294: TOLSON | I294: DENNINGTON | L294: LUNN | N294: SCHARP | Q294: WILSON | W294: NORTHCOTE | X294: 5 | Y294: 1 | Z294: 0 | AA294: 828 | AB294: 573 | AC294: 144.50261780104711 | AD294: 20
A295: GOALKICKERS | W295: OAKLEIGH | X295: 4 | Y295: 2 | Z295: 0 | AA295: 665 | AB295: 593 | AC295: 112.14165261382799 | AD295: 16
A296: NORTHCOTE | C296: SEYMOUR 7 | F296: GRAY 4 | H296: ROSS 2 | J296: WILLIAMSON 2 | N296: POWELL | P296: MEITZKE | R296: HONIG | W296: YARRAVILLE | X296: 4 | Y296: 2 | Z296: 0 | AA296: 562 | AB296: 509 | AC296: 110.41257367387034 | AD296: 16
A297: SANDRINGHAM | C297: McCOMB 4 | F297: DENNINGTON 3 | I297: CAMPBELL 2 | L297: BECKTON | N297: JOHNSON | P297: TOLSON | R297: THOMS | W297: PRESTON | X297: 4 | Y297: 2 | Z297: 0 | AA297: 553 | AB297: 515 | AC297: 107.37864077669903 | AD297: 16
Q298: BAILES
A299: PORT MELBOURNE | C299: 3 | D299: 4 | E299: =C299*6+D299 -> 22 | G299: 8 | H299: 6 | I299: =G299*6+H299 -> 54 | K299: 10 | L299: 9 | M299: =K299*6+L299 -> 69 | O299: 13 | P299: 11 | Q299: =O299*6+P299 -> 89 | S299: PORT MELBOURNE | W299: SANDRINGHAM | X299: 4 | Y299: 2 | Z299: 0 | AA299: 613 | AB299: 590 | AC299: 103.89830508474576 | AD299: 16
A300: CAMBERWELL | C300: 2 | D300: 4 | E300: =C300*6+D300 -> 16 | G300: 7 | H300: 6 | I300: =G300*6+H300 -> 48 | K300: 12 | L300: 7 | M300: =K300*6+L300 -> 79 | O300: 12 | P300: 9 | Q300: =O300*6+P300 -> 81 | S300: GREGORY | W300: PRAHRAN | X300: 4 | Y300: 2 | Z300: 0 | AA300: 614 | AB300: 605 | AC300: 101.48760330578513 | AD300: 16
A301: BEST PLAYERS | W301: PORT MELBOURNE | X301: 3 | Y301: 3 | Z301: 0 | AA301: 505 | AB301: 487 | AC301: 103.69609856262834 | AD301: 12
A302: PORT MELBOURNE | C302: TUITE | E302: LEGGO | H302: GARBUTT | K302: JULIER | N302: KEATING | Q302: LAHIFF | W302: BRIGHTON | X302: 3 | Y302: 3 | Z302: 0 | AA302: 537 | AB302: 528 | AC302: 101.70454545454545 | AD302: 12
A303: CAMBERWELL | C303: CLAMP | E303: JONES | H303: DYBALL | K303: TATHAM | N303: CLARKE | Q303: WARTMAN | W303: CAMBERWELL | X303: 2 | Y303: 4 | Z303: 0 | AA303: 547 | AB303: 579 | AC303: 94.473229706390327 | AD303: 8
A304: GOALKICKERS | W304: COBURG | X304: 2 | Y304: 4 | Z304: 0 | AA304: 507 | AB304: 594 | AC304: 85.353535353535349 | AD304: 8
A305: PORT MELBOURNE | C305: KEATING 4 | F305: TUITE 3 | H305: LAHIFF 2 | K305: PERRETT 2 | N305: RUSDEN | P305: PLUMRIDGE | W305: BRUNSWICK | X305: 1 | Y305: 5 | Z305: 0 | AA305: 537 | AB305: 669 | AC305: 80.269058295964129 | AD305: 4
A306: CAMBERWELL | C306: CLARKE 5 | F306: TATHAM 2 | I306: JONES 2 | K306: CLAMP | M306: BOOTHMAN | P306: WILLIAMSON | W306: WILLIAMSTOWN | X306: 0 | Y306: 6 | Z306: 0 | AA306: 489 | AB306: 715 | AC306: 68.391608391608386 | AD306: 0
E307: 4TH JUNE | J307: WEATHER | M307: CLOUDY BUT FINE NORTH WIND
A308: YARRAVILLE | C308: 0 | D308: 2 | E308: =C308*6+D308 -> 2 | G308: 5 | H308: 8 | I308: =G308*6+H308 -> 38 | K308: 6 | L308: 12 | M308: =K308*6+L308 -> 48 | O308: 10 | P308: 17 | Q308: =O308*6+P308 -> 77 | S308: YARRAVILLE
A309: PRESTON | C309: 4 | D309: 3 | E309: =C309*6+D309 -> 27 | G309: 5 | H309: 5 | I309: =G309*6+H309 -> 35 | K309: 6 | L309: 9 | M309: =K309*6+L309 -> 45 | O309: 9 | P309: 11 | Q309: =O309*6+P309 -> 65 | S309: NOWLAN
A310: BEST PLAYERS
A311: YARRAVILLE | C311: LAVENDER | F311: PENNY | I311: SHEAHAN | L311: WEDGEWOOD | O311: WARDEN | R311: RYAN
A312: PRESTON | C312: SMITH | F312: WARR | I312: DOWLING | L312: BREWIS | O312: McEACHARN | R312: LINDSAY
A313: GOALKICKERS
A314: YARRAVILLE | C314: J BUCKLEY 3 | F314: SHEEHAN 2 | I314: WILLIAMS 2 | L314: WEDGWOOD 2 | O314: EVANS
A315: PRESTON | C315: WARR 4 | E315: McEACHERN 2 | I315: L HOOK | L315: LINDSAY | O315: DOYLE
A317: BRIGHTON | C317: 6 | D317: 9 | E317: =C317*6+D317 -> 45 | G317: 6 | H317: 14 | I317: =G317*6+H317 -> 50 | K317: 10 | L317: 16 | M317: =K317*6+L317 -> 76 | O317: 13 | P317: 19 | Q317: =O317*6+P317 -> 97 | S317: ELSTERNWICK PARK
A318: BRUNSWICK | C318: 4 | D318: 1 | E318: =C318*6+D318 -> 25 | G318: 9 | H318: 5 | I318: =G318*6+H318 -> 59 | K318: 10 | L318: 6 | M318: =K318*6+L318 -> 66 | O318: 11 | P318: 12 | Q318: =O318*6+P318 -> 78 | S318: STUART
A319: BEST PLAYERS
A320: BRIGHTON | C320: J O'BRIEN | F320: TUCKER | I320: STEWART | L320: LILBURNE | O320: McLEOD | R320: DREW
A321: BRUNSWICK | C321: WOODS | F321: DOWLING | I321: RAEBURN | L321: BLACKMORE | O321: THOMPSON | R321: MITCHELL
A322: GOALKICKERS
A323: BRIGHTON | C323: LILBURNE 4 | F323: DREW 2 | I323: WILLIAMSON 2 | L323: HUNT 2 | N323: TUCKER | P323: HILL | Q323: CONNELL
A324: BRUNSWICK | C324: ANDERSON 6 | F324: JONES 2 | I324: MUTIMER 2 | L324: KENNEDY
A326: PRAHRAN | C326: 2 | D326: 1 | E326: =C326*6+D326 -> 13 | G326: 7 | H326: 6 | I326: =G326*6+H326 -> 48 | K326: 11 | L326: 11 | M326: =K326*6+L326 -> 77 | O326: 17 | P326: 15 | Q326: =O326*6+P326 -> 117 | S326: TOORAK PARK
A327: COBURG | C327: 3 | D327: 6 | E327: =C327*6+D327 -> 24 | G327: 6 | H327: 9 | I327: =G327*6+H327 -> 45 | K327: 10 | L327: 14 | M327: =K327*6+L327 -> 74 | O327: 13 | P327: 16 | Q327: =O327*6+P327 -> 94 | S327: MILLER
A328: BEST PLAYERS
A329: PRAHRAN | C329: F SMITH | E329: DIXON | H329: KOOP | K329: WILLISON | N329: HYDE | Q329: WESCOTT
A330: COBURG | C330: MOSS | E330: BROOM | H330: A MARTYN | K330: KIGHT | N330: HARRIS | Q330: DUNCAN
A331: GOALKICKERS
A332: PRAHRAN | C332: HAWKINS 5 | F332: THOMPSON 3 | I332: WHITE 2 | K332: AVERY 2 | M332: MUNN 2 | O332: ANDERSON 2 | R332: N WILLIAMS
A333: COBURG | C333: DUNCAN 4 | F333: MOSS 3 | I333: HARRIS 2 | K333: NASH | M333: MEARS | O333: MARTYN | Q333: WILLOX
A335: OAKLEIGH | C335: 3 | D335: 7 | E335: =C335*6+D335 -> 25 | G335: 9 | H335: 10 | I335: =G335*6+H335 -> 64 | K335: 11 | L335: 14 | M335: =K335*6+L335 -> 80 | O335: 21 | P335: 17 | Q335: =O335*6+P335 -> 143 | S335: OAKLEIGH
A336: WILLIAMSTOWN | C336: 2 | D336: 5 | E336: =C336*6+D336 -> 17 | G336: 5 | H336: 8 | I336: =G336*6+H336 -> 38 | K336: 8 | L336: 12 | M336: =K336*6+L336 -> 60 | O336: 14 | P336: 17 | Q336: =O336*6+P336 -> 101 | S336: FRICKE
A337: BEST PLAYERS
A338: OAKLEIGH | C338: DENNING | F338: FRASER | I338: FLEMING | L338: McALLISTER | O338: MUDGE | Q338: KIDD
A339: WILLIAMSTOWN | C339: CAHILL | F339: ADDISON | I339: STANBRIDGE | L339: STEBBINS | O339: SYKES | Q339: SIMMONDS
A340: GOALKICKERS
A341: OAKLEIGH | C341: DENNING 9 | F341: FRASER 6 | I341: DEAN | K341: CHAPMAN | N341: FLEMING | Q341: YANN | S341: HEINTZ | U341: BAKER
A342: WILLIAMSTOWN | C342: CAHILL 3 | F342: STEBBINS 3 | I342: ADDISON 2 | L342: BURKE 2 | N342: STANBRIDGE | Q342: BARNES | S342: McCABE | U342: BAKER
A344: ROUND 7 | E344: 9TH JUNE | J344: WEATHER | M344: EARLY LIGHT RAIN WEST BREEZE | S344: PLAYED AT
D345: 1ST QTR | H345: 2ND QTR | L345: 3RD QTR | P345: FINAL | S345: NORTHCOTE
A346: NORTHCOTE | C346: 4 | D346: 1 | E346: =C346*6+D346 -> 25 | G346: 9 | H346: 7 | I346: =G346*6+H346 -> 61 | K346: 12 | L346: 9 | M346: =K346*6+L346 -> 81 | O346: 14 | P346: 19 | Q346: =O346*6+P346 -> 103 | S346: UMPIRE | X346: LADDER | AB346: ROUND | AD346: 7
A347: YARRAVILLE | C347: 3 | D347: 6 | E347: =C347*6+D347 -> 24 | G347: 4 | H347: 8 | I347: =G347*6+H347 -> 32 | K347: 5 | L347: 9 | M347: =K347*6+L347 -> 39 | O347: 8 | P347: 10 | Q347: =O347*6+P347 -> 58 | S347: MILLER
A348: BEST PLAYERS | W348: TEAM | X348: W | Y348: L | Z348: D | AA348: FOR | AB348: AGST | AC348: % | AD348: PTS
A349: NORTHCOTE | C349: GRAY | E349: HART | H349: SIMMONDS | K349: POWELL | N349: WILLIAMSON | Q349: WOODS
A350: YARRAVILLE | C350: RYAN | E350: CAMERON | H350: McGRATH | K350: WHITE | N350: WUNHYM | Q350: EDWARDS | W350: NORTHCOTE | X350: 6 | Y350: 1 | Z350: 0 | AA350: 931 | AB350: 631 | AC350: 147.54358161648179 | AD350: 24
A351: GOALKICKERS | W351: OAKLEIGH | X351: 5 | Y351: 2 | Z351: 0 | AA351: 773 | AB351: 668 | AC351: 115.7185628742515 | AD351: 20
A352: NORTHCOTE | C352: SIMMONDS 5 | F352: GRAY 4 | I352: SEYMOUR 3 | L352: ROSS | N352: HONIG | W352: PRESTON | X352: 5 | Y352: 2 | Z352: 0 | AA352: 661 | AB352: 603 | AC352: 109.61857379767828 | AD352: 20
A353: YARRAVILLE | C353: SHEEHAN 5 | F353: WARDEN 2 | I353: NEAL | W353: PORT MELBOURNE | X353: 4 | Y353: 3 | Z353: 0 | AA353: 584 | AB353: 539 | AC353: 108.34879406307978 | AD353: 16
A355: OAKLEIGH | C355: 3 | D355: 4 | E355: =C355*6+D355 -> 22 | G355: 10 | H355: 7 | I355: =G355*6+H355 -> 67 | K355: 13 | L355: 9 | M355: =K355*6+L355 -> 87 | O355: 16 | P355: 12 | Q355: =O355*6+P355 -> 108 | S355: OAKLEIGH | W355: YARRAVILLE | X355: 4 | Y355: 3 | Z355: 0 | AA355: 620 | AB355: 612 | AC355: 101.30718954248366 | AD355: 16
A356: PRAHRAN | C356: 4 | D356: 3 | E356: =C356*6+D356 -> 27 | G356: 7 | H356: 7 | I356: =G356*6+H356 -> 49 | K356: 7 | L356: 12 | M356: =K356*6+L356 -> 54 | O356: 10 | P356: 15 | Q356: =O356*6+P356 -> 75 | S356: STUART | W356: SANDRINGHAM | X356: 4 | Y356: 3 | Z356: 0 | AA356: 681 | AB356: 674 | AC356: 101.03857566765579 | AD356: 16
A357: BEST PLAYERS | W357: PRAHRAN | X357: 4 | Y357: 3 | Z357: 0 | AA357: 689 | AB357: 713 | AC357: 96.633941093969142 | AD357: 16
A358: OAKLEIGH | C358: KIDD | E358: CRAMERI | H358: FRASER | K358: FLEMING | N358: WILTSHIRE | Q358: McALLISTER | W358: CAMBERWELL | X358: 3 | Y358: 4 | Z358: 0 | AA358: 640 | AB358: 642 | AC358: 99.688473520249218 | AD358: 12
A359: PRAHRAN | C359: KOOP | E359: WHITE | H359: AVERY | K359: DIXON | N359: WILLIAMS | Q359: TABATEAU | W359: BRIGHTON | X359: 3 | Y359: 4 | Z359: 0 | AA359: 625 | AB359: 636 | AC359: 98.270440251572325 | AD359: 12
A360: GOALKICKERS | Q360: GOULD | W360: COBURG | X360: 3 | Y360: 4 | Z360: 0 | AA360: 591 | AB360: 662 | AC360: 89.274924471299087 | AD360: 12
A361: OAKLEIGH | C361: FRASER 5 | E361: DENNING 2 | H361: FLEMING 2 | J361: SMITH 2 | L361: CRAMERI | N361: DALTON | P361: HEINTZ | R361: BAKER | W361: BRUNSWICK | X361: 1 | Y361: 6 | Z361: 0 | AA361: 589 | AB361: 748 | AC361: 78.743315508021396 | AD361: 4
A362: PRAHRAN | C362: HAWKINS 4 | F362: WHITE 2 | I362: AVERY 2 | K362: THOMPSON | N362: KENNY | W362: WILLIAMSTOWN | X362: 0 | Y362: 7 | Z362: 0 | AA362: 552 | AB362: 808 | AC362: 68.316831683168317 | AD362: 0
A364: PRESTON | C364: 6 | D364: 4 | E364: =C364*6+D364 -> 40 | G364: 7 | H364: 8 | I364: =G364*6+H364 -> 50 | K364: 14 | L364: 10 | M364: =K364*6+L364 -> 94 | O364: 16 | P364: 12 | Q364: =O364*6+P364 -> 108 | S364: PRESTON
A365: BRIGHTON | C365: 1 | D365: 2 | E365: =C365*6+D365 -> 8 | G365: 4 | H365: 8 | I365: =G365*6+H365 -> 32 | K365: 6 | L365: 10 | M365: =K365*6+L365 -> 46 | O365: 12 | P365: 16 | Q365: =O365*6+P365 -> 88 | S365: FRICKE
A366: BEST PLAYERS
A367: PRESTON | C367: WARR | E367: DINEEN | H367: HUGHSON | K367: DOWLING | N367: HUGO | Q367: McEACHARN
A368: BRIGHTON | C368: LILBURNE | E368: TOMLINS | H368: TUCKER | K368: DREW | N368: J O'BRIEN | Q368: McLEOD
A369: GOALKICKERS
A370: PRESTON | C370: WARR 5 | E370: ARTHUR 2 | H370: McEACHERN 2 | K370: HUGHSON 2 | N370: L ROBINSON 2 | Q370: McSWAIN | T370: DOYLE | V370: UNDERHILL
A371: BRIGHTON | C371: DEAN 2 | E371: BOLWELL 2 | H371: RANSON 2 | K371: BURNES 2 | N371: LILBURNE | Q371: HILL | R371: TUCKER | U371: McLEOD
A373: PORT MELBOURNE | C373: 1 | D373: 0 | E373: =C373*6+D373 -> 6 | G373: 4 | H373: 3 | I373: =G373*6+H373 -> 27 | K373: 9 | L373: 7 | M373: =K373*6+L373 -> 61 | O373: 12 | P373: 7 | Q373: =O373*6+P373 -> 79 | S373: BRUNSWICK
A374: BRUNSWICK | C374: 1 | D374: 3 | E374: =C374*6+D374 -> 9 | G374: 1 | H374: 10 | I374: =G374*6+H374 -> 16 | K374: 4 | L374: 12 | M374: =K374*6+L374 -> 36 | O374: 5 | P374: 22 | Q374: =O374*6+P374 -> 52 | S374: NOWLAN
A375: BEST PLAYERS
A376: PORT MELBOURNE | C376: PERRETT | F376: BILLS | I376: ATKINSON | L376: LAHIFF | O376: KEATING | R376: O'ROURKE
A377: BRUNSWICK | C377: ARRELL | F377: WOODS | I377: PRISMAL | L377: ANDERSON | O377: MUTIMER | R377: JENKINS
A378: GOALKICKERS
A379: PORT MELBOURNE | C379: O'ROURKE 3 | F379: KEATING 2 | I379: MALTBY 2 | L379: BILLS 2 | N379: RUSDEN | P379: TUITE | R379: ATKINSON
A380: BRUNSWICK | C380: ANDERSON 2 | F380: MUTIMER | I380: DOWLING | L380: JUSTICE
A382: CAMBERWELL | C382: 1 | D382: 5 | E382: =C382*6+D382 -> 11 | G382: 7 | H382: 9 | I382: =G382*6+H382 -> 51 | K382: 9 | L382: 13 | M382: =K382*6+L382 -> 67 | O382: 13 | P382: 15 | Q382: =O382*6+P382 -> 93 | S382: WILLIAMSTOWN
A383: WILLIAMSTOWN | C383: 2 | D383: 3 | E383: =C383*6+D383 -> 15 | G383: 4 | H383: 5 | I383: =G383*6+H383 -> 29 | K383: 6 | L383: 6 | M383: =K383*6+L383 -> 42 | O383: 9 | P383: 9 | Q383: =O383*6+P383 -> 63 | S383: JURY
A384: BEST PLAYERS
A385: CAMBERWELL | C385: R WILLIAMS | F385: FINLAYSON | I385: BOOTHMAN | L385: WARTMAN | O385: COFFIN | R385: CLARKE
A386: WILLIAMSTOWN | C386: BARNES | F386: CAHILL | I386: MARTIN | L386: BROOKS | O386: ADDISON | R386: R DELLER
A387: GOALKICKERS
A388: CAMBERWELL | C388: COFFIN 4 | E388: ANDREWS 2 | H388: WARTMAN 2 | K388: JONES 2 | M388: WILLIAMS | P388: TATHAM | R388: CLAMP
A389: WILLIAMSTOWN | C389: BURKE 3 | E389: CAHILL 2 | H389: MCCABE 2 | K389: STANBRIDGE | N389: ADDISON
A391: COBURG | C391: 5 | D391: 5 | E391: =C391*6+D391 -> 35 | G391: 5 | H391: 9 | I391: =G391*6+H391 -> 39 | K391: 9 | L391: 12 | M391: =K391*6+L391 -> 66 | O391: 12 | P391: 12 | Q391: =O391*6+P391 -> 84 | S391: COBURG
A392: SANDRINGHAM | C392: 0 | D392: 2 | E392: =C392*6+D392 -> 2 | G392: 4 | H392: 3 | I392: =G392*6+H392 -> 27 | K392: 7 | L392: 4 | M392: =K392*6+L392 -> 46 | O392: 10 | P392: 8 | Q392: =O392*6+P392 -> 68 | S392: GREGORY
A393: BEST PLAYERS
A394: COBURG | C394: RUDOLPH | F394: HENNING | I394: DUNCAN | L394: DIXON | O394: VOIGHT | R394: UHE
A395: SANDRINGHAM | C395: THOMS | F395: JOHNSON | I395: JONES | L395: TOLSON | O395: CAMPBELL | R395: SMAIL
A396: GOALKICKERS
A397: COBURG | C397: DUNCAN 4 | F397: MOSS 3 | I397: HENNING 3 | L397: NASH 2
A398: SANDRINGHAM | C398: THOMS 4 | F398: McCOMB 2 | I398: BECKTON | L398: JOHNSON | N398: SMAIL | P398: CAMPBELL
A400: ROUND 8 | E400: 23RD JUNE | J400: WEATHER | M400: FINE NORTH BREEZE | S400: PLAYED AT
D401: 1ST QTR | H401: 2ND QTR | L401: 3RD QTR | P401: FINAL | S401: PORT MELBOURNE
A402: PORT MELBOURNE | C402: 2 | D402: 6 | E402: =C402*6+D402 -> 18 | G402: 3 | H402: 10 | I402: =G402*6+H402 -> 28 | K402: 5 | L402: 12 | M402: =K402*6+L402 -> 42 | O402: 8 | P402: 12 | Q402: =O402*6+P402 -> 60 | S402: UMPIRE | X402: LADDER | AB402: ROUND | AD402: 8
A403: PRESTON | C403: 3 | D403: 2 | E403: =C403*6+D403 -> 20 | G403: 6 | H403: 7 | I403: =G403*6+H403 -> 43 | K403: 7 | L403: 10 | M403: =K403*6+L403 -> 52 | O403: 7 | P403: 17 | Q403: =O403*6+P403 -> 59 | S403: ROFE
A404: BEST PLAYERS | W404: TEAM | X404: W | Y404: L | Z404: D | AA404: FOR | AB404: AGST | AC404: % | AD404: PTS
A405: PORT MELBOURNE | C405: PERRETT | E405: LAHIFF | H405: HURLEY | K405: BILLS | N405: GARBUTT | Q405: O'ROURKE
A406: PRESTON | C406: WARR | E406: SMITH | H406: BOSCHEN | K406: SPARGO | N406: UNDERHILL | Q406: DINEEN | W406: NORTHCOTE | X406: 7 | Y406: 1 | Z406: 0 | AA406: 1088 | AB406: 708 | AC406: 153.67231638418079 | AD406: 28
A407: GOALKICKERS | W407: PRAHRAN | X407: 5 | Y407: 3 | Z407: 0 | AA407: 859 | AB407: 761 | AC407: 112.87779237844941 | AD407: 20
A408: PORT MELBOURNE | C408: LAHIFF 2 | F408: RUSDEN | H408: TUITE | J408: ATKINSON | M408: O'ROURKE | P408: BILLS | R408: REES | W408: OAKLEIGH | X408: 5 | Y408: 3 | Z408: 0 | AA408: 827 | AB408: 741 | AC408: 111.60593792172739 | AD408: 20
A409: PRESTON | C409: WARR 2 | F409: BOSCHEN 2 | I409: DINEEN | K409: HEARN | M409: ARTHUR | W409: PRESTON | X409: 5 | Y409: 3 | Z409: 0 | AA409: 720 | AB409: 663 | AC409: 108.5972850678733 | AD409: 20
A411: SANDRINGHAM | C411: 3 | D411: 2 | E411: =C411*6+D411 -> 20 | G411: 5 | H411: 9 | I411: =G411*6+H411 -> 39 | K411: 6 | L411: 11 | M411: =K411*6+L411 -> 47 | O411: 9 | P411: 19 | Q411: =O411*6+P411 -> 73 | S411: BEACH ROAD | W411: PORT MELBOURNE | X411: 5 | Y411: 3 | Z411: 0 | AA411: 644 | AB411: 598 | AC411: 107.69230769230769 | AD411: 20
A412: OAKLEIGH | C412: 2 | D412: 0 | E412: =C412*6+D412 -> 12 | G412: 4 | H412: 2 | I412: =G412*6+H412 -> 26 | K412: 6 | L412: 8 | M412: =K412*6+L412 -> 44 | O412: 7 | P412: 12 | Q412: =O412*6+P412 -> 54 | S412: GREGORY | W412: SANDRINGHAM | X412: 5 | Y412: 3 | Z412: 0 | AA412: 754 | AB412: 728 | AC412: 103.57142857142857 | AD412: 20
A413: BEST PLAYERS | W413: CAMBERWELL | X413: 4 | Y413: 4 | Z413: 0 | AA413: 740 | AB413: 719 | AC413: 102.92072322670376 | AD413: 16
A414: SANDRINGHAM | C414: THOMS | F414: CAMPBELL | I414: BAILES | L414: LUNN | N414: MITCHELL | Q414: WILSON | W414: YARRAVILLE | X414: 4 | Y414: 4 | Z414: 0 | AA414: 720 | AB414: 718 | AC414: 100.27855153203343 | AD414: 16
A415: OAKLEIGH | C415: McALLISTER | F415: WITHERS | I415: DENNING | L415: KIDD | N415: WILTSHIRE | Q415: FLEMING | W415: COBURG | X415: 4 | Y415: 4 | Z415: 0 | AA415: 697 | AB415: 762 | AC415: 91.469816272965886 | AD415: 16
A416: GOALKICKERS | W416: BRIGHTON | X416: 3 | Y416: 5 | Z416: 0 | AA416: 702 | AB416: 793 | AC416: 88.52459016393442 | AD416: 12
A417: SANDRINGHAM | C417: THOMS 3 | F417: SMAIL 2 | I417: McCOMB | L417: BAILES | N417: CAHIR | W417: BRUNSWICK | X417: 1 | Y417: 7 | Z417: 0 | AA417: 666 | AB417: 848 | AC417: 78.537735849056602 | AD417: 4
A418: OAKLEIGH | C418: DENNING 2 | F418: DEAN 2 | I418: FRASER | L418: CRAMERI | N418: CHAPMAN | W418: WILLIAMSTOWN | X418: 0 | Y418: 8 | Z418: 0 | AA418: 600 | AB418: 978 | AC418: 61.349693251533743 | AD418: 0
A420: COBURG | C420: 1 | D420: 2 | E420: =C420*6+D420 -> 8 | G420: 6 | H420: 4 | I420: =G420*6+H420 -> 40 | K420: 13 | L420: 7 | M420: =K420*6+L420 -> 85 | O420: 16 | P420: 10 | Q420: =O420*6+P420 -> 106 | S420: YARRAVILLE
A421: YARRAVILLE | C421: 1 | D421: 2 | E421: =C421*6+D421 -> 8 | G421: 6 | H421: 10 | I421: =G421*6+H421 -> 46 | K421: 10 | L421: 14 | M421: =K421*6+L421 -> 74 | O421: 14 | P421: 16 | Q421: =O421*6+P421 -> 100 | S421: STUART
A422: BEST PLAYERS
A423: COBURG | C423: RUDOLPH | G423: HARRIS | J423: HENNING | M423: MOSS | P423: BERTRAM | S423: LOWE
A424: YARRAVILLE | C424: SHEEHAN | G424: J BUCKLEY | J424: WILLOX | M424: EDWARDS | P424: LAVENDER | S424: EVANS
A425: GOALKICKERS
A426: COBURG | C426: DUNCAN 7 | F426: NASH 2 | I426: MOSS 2 | K426: HARRIS 2 | N426: HENNING 2 | Q426: DIXON
A427: YARRAVILLE | C427: J BUCKLEY 8 | F427: BENNETT 2 | I427: SHEEHAN | K427: WARDEN | M427: WUNHYM | O427: W BUCKLEY
A429: CAMBERWELL | C429: 2 | D429: 5 | E429: =C429*6+D429 -> 17 | G429: 5 | H429: 8 | I429: =G429*6+H429 -> 38 | K429: 8 | L429: 8 | M429: =K429*6+L429 -> 56 | O429: 15 | P429: 10 | Q429: =O429*6+P429 -> 100 | S429: CAMBERWELL
A430: BRUNSWICK | C430: 1 | D430: 2 | E430: =C430*6+D430 -> 8 | G430: 5 | H430: 9 | I430: =G430*6+H430 -> 39 | K430: 8 | L430: 13 | M430: =K430*6+L430 -> 61 | O430: 10 | P430: 17 | Q430: =O430*6+P430 -> 77 | S430: MOWLAM
A431: BEST PLAYERS
A432: CAMBERWELL | C432: R WILLIAMS | F432: BOOTHMAN | I432: WARTMAN | L432: H JONES | O432: CLAMP | R432: SNEDDON
A433: BRUNSWICK | C433: BLACKMORE | F433: FOWLING | I433: H JONES | L433: FRANKE | O433: MUTIMER | R433: JENKINS
A434: GOALKICKERS
A435: CAMBERWELL | C435: BOOTHMAN 4 | F435: ANDREWS 3 | I435: JONES 3 | K435: WARTMAN 2 | N435: TATHAM | P435: CLAMP | R435: TROTTER
A436: BRUNSWICK | C436: JONES 4 | F436: ANDERSON 2 | I436: FRANKE 2 | L436: MUTIMER | O436: ELLAWAY
A438: NORTHCOTE | C438: 5 | D438: 1 | E438: =C438*6+D438 -> 31 | G438: 9 | H438: 1 | I438: =G438*6+H438 -> 55 | K438: 15 | L438: 5 | M438: =K438*6+L438 -> 95 | O438: 25 | P438: 7 | Q438: =O438*6+P438 -> 157 | S438: ELSTERNWICK PARK
A439: BRIGHTON | C439: 6 | D439: 7 | E439: =C439*6+D439 -> 43 | G439: 8 | H439: 10 | I439: =G439*6+H439 -> 58 | K439: 10 | L439: 12 | M439: =K439*6+L439 -> 72 | O439: 10 | P439: 17 | Q439: =O439*6+P439 -> 77 | S439: MOWLAN
A440: BEST PLAYERS
A441: NORTHCOTE | C441: GARRETT | F441: HASKETT | I441: ROSS | L441: MEITZKE | O441: SEYMOUR | R441: GRAY
A442: BRIGHTON | C442: J O'BRIEN | F442: McLEOD | I442: LILBURNE | L442: BURNES | O442: CONNELL | R442: BOLWELL
A443: GOALKICKERS
A444: NORTHCOTE | C444: SEYMOUR 13 | F444: ROGERS 5 | I444: GRAY 3 | K444: WILLIAMSON 3 | N444: HONIG
A445: BRIGHTON | C445: CONNELL 3 | F445: DEAN 2 | I445: BURNES 2 | K445: HILL | M445: TUCKER | O445: RANSON
A447: PRAHRAN | C447: 7 | D447: 4 | E447: =C447*6+D447 -> 46 | G447: 12 | H447: 9 | I447: =G447*6+H447 -> 81 | K447: 17 | L447: 11 | M447: =K447*6+L447 -> 113 | O447: 25 | P447: 20 | Q447: =O447*6+P447 -> 170 | S447: TOORAK PARK
A448: WILLIAMSTOWN | C448: 2 | D448: 2 | E448: =C448*6+D448 -> 14 | G448: 2 | H448: 6 | I448: =G448*6+H448 -> 18 | K448: 5 | L448: 10 | M448: =K448*6+L448 -> 40 | O448: 6 | P448: 12 | Q448: =O448*6+P448 -> 48 | S448: ROGERS
A449: BEST PLAYERS
A450: PRAHRAN | C450: SHARPLEY | F450: WESCOTT | I450: KOOP | L450: HAWKINS | O450: HYDE | R450: ANDERSON
A451: WILLIAMSTOWN | C451: ADDISON | F451: BARNES | I451: LAWLOR | L451: DELLER | O451: McCABE | R451: BROOKS
A452: GOALKICKERS
A453: PRAHRAN | C453: HAWKINS 9 | F453: ANDERSON 5 | I453: BRENCHLEY 3 | L453: THOMPSON 3 | O453: WHITE 2 | Q453: N WILLIAMS 2 | U453: AVERY
A454: WILLIAMSTOWN | C454: ADDISON | F454: BARNES | I454: STEBBINS | L454: LAWLOR | O454: FLOYD | Q454: JOHNS
A456: ROUND 9 | E456: 30TH JUNE | J456: WEATHER | M456: FINE NORTH BREEZE | S456: PLAYED AT
D457: 1ST QTR | H457: 2ND QTR | L457: 3RD QTR | P457: FINAL | S457: NORTHCOTE
A458: NORTHCOTE | C458: 2 | D458: 4 | E458: =C458*6+D458 -> 16 | G458: 5 | H458: 12 | I458: =G458*6+H458 -> 42 | K458: 10 | L458: 16 | M458: =K458*6+L458 -> 76 | O458: 13 | P458: 21 | Q458: =O458*6+P458 -> 99 | S458: UMPIRE | X458: LADDER | AB458: ROUND | AD458: 9
A459: PORT MELBOURNE | C459: 1 | D459: 0 | E459: =C459*6+D459 -> 6 | G459: 2 | H459: 7 | I459: =G459*6+H459 -> 19 | K459: 4 | L459: 8 | M459: =K459*6+L459 -> 32 | O459: 7 | P459: 8 | Q459: =O459*6+P459 -> 50 | S459: STUART
A460: BEST PLAYERS | W460: TEAM | X460: W | Y460: L | Z460: D | AA460: FOR | AB460: AGST | AC460: % | AD460: PTS
A461: NORTHCOTE | C461: HART | E461: GRAY | H461: SEYMOUR | K461: HASKETT | N461: LAWRENCE | Q461: ROSS
A462: PORT MELBOURNE | C462: ATKINSON | E462: LAHIFF | H462: PERRETT | K462: HURLEY | N462: PLUMRIDGE | Q462: McNAMARA | W462: NORTHCOTE | X462: 8 | Y462: 1 | Z462: 0 | AA462: 1187 | AB462: 758 | AC462: 156.59630606860159 | AD462: 32
A463: GOALKICKERS | W463: OAKLEIGH | X463: 6 | Y463: 3 | Z463: 0 | AA463: 935 | AB463: 813 | AC463: 115.00615006150062 | AD463: 24
A464: NORTHCOTE | C464: SEYMOUR 7 | F464: GRAY 2 | I464: WILLIAMSON | L464: ROGERS | W464: PRAHRAN | X464: 6 | Y464: 3 | Z464: 0 | AA464: 970 | AB464: 844 | AC464: 114.92890995260663 | AD464: 24
A465: PORT MELBOURNE | C465: REES 3 | F465: BEDFORD 2 | I465: KEATING | L465: HURLEY | W465: PRESTON | X465: 6 | Y465: 3 | Z465: 0 | AA465: 811 | AB465: 727 | AC465: 111.55433287482806 | AD465: 24
A467: PRAHRAN | C467: 5 | D467: 4 | E467: =C467*6+D467 -> 34 | G467: 9 | H467: 7 | I467: =G467*6+H467 -> 61 | K467: 14 | L467: 11 | M467: =K467*6+L467 -> 95 | O467: 16 | P467: 15 | Q467: =O467*6+P467 -> 111 | S467: TOORAK PARK | W467: SANDRINGHAM | X467: 5 | Y467: 4 | Z467: 0 | AA467: 837 | AB467: 839 | AC467: 99.761620977353999 | AD467: 20
A468: SANDRINGHAM | C468: 1 | D468: 9 | E468: =C468*6+D468 -> 15 | G468: 2 | H468: 12 | I468: =G468*6+H468 -> 24 | K468: 7 | L468: 14 | M468: =K468*6+L468 -> 56 | O468: 11 | P468: 17 | Q468: =O468*6+P468 -> 83 | S468: MURRAY | W468: PORT MELBOURNE | X468: 5 | Y468: 4 | Z468: 0 | AA468: 694 | AB468: 697 | AC468: 99.569583931133423 | AD468: 20
A469: BEST PLAYERS | W469: COBURG | X469: 5 | Y469: 4 | Z469: 0 | AA469: 797 | AB469: 827 | AC469: 96.372430471584039 | AD469: 20
A470: PRAHRAN | C470: AVERY | E470: WHITE | H470: KOOP | K470: WALLS | N470: BRENCHLEY | Q470: SMITH | W470: CAMBERWELL | X470: 4 | Y470: 5 | Z470: 0 | AA470: 804 | AB470: 810 | AC470: 99.259259259259252 | AD470: 16
A471: SANDRINGHAM | C471: YEMM | E471: THOMS | H471: CHRISTIE | K471: SCHLITZ | N471: TOLSON | Q471: MITCHELL | W471: YARRAVILLE | X471: 4 | Y471: 5 | Z471: 0 | AA471: 792 | AB471: 826 | AC471: 95.883777239709445 | AD471: 16
A472: GOALKICKERS | W472: BRIGHTON | X472: 3 | Y472: 6 | Z472: 0 | AA472: 767 | AB472: 893 | AC472: 85.890257558790594 | AD472: 12
A473: PRAHRAN | C473: BRENCHLEY 5 | F473: HAWKINS 4 | I473: AVERY 3 | L473: N WILLIAMS 3 | O473: DOOLAN | W473: BRUNSWICK | X473: 1 | Y473: 8 | Z473: 0 | AA473: 738 | AB473: 935 | AC473: 78.930481283422466 | AD473: 4
A474: SANDRINGHAM | C474: JOHNSON 2 | F474: TOLSON 2 | I474: CAMPBELL 2 | L474: DOWLING | N474: DENNINGTON | Q474: SCHLITZ | S474: BAILES | W474: WILLIAMSTOWN | X474: 1 | Y474: 8 | Z474: 0 | AA474: 687 | AB474: 1050 | AC474: 65.428571428571431 | AD474: 4
P475: WILSON
A476: PRESTON | C476: 3 | D476: 1 | E476: =C476*6+D476 -> 19 | G476: 6 | H476: 5 | I476: =G476*6+H476 -> 41 | K476: 8 | L476: 10 | M476: =K476*6+L476 -> 58 | O476: 13 | P476: 13 | Q476: =O476*6+P476 -> 91 | S476: PRESTON
A477: CAMBERWELL | C477: 2 | D477: 1 | E477: =C477*6+D477 -> 13 | G477: 6 | H477: 4 | I477: =G477*6+H477 -> 40 | K477: 7 | L477: 7 | M477: =K477*6+L477 -> 49 | O477: 9 | P477: 10 | Q477: =O477*6+P477 -> 64 | S477: LESTER
A478: BEST PLAYERS
A479: PRESTON | C479: WARR | F479: SMITH | I479: McEACHARN | L479: ARTHUR | O479: CANNAWAY | S479: HUGHSON
A480: CAMBERWELL | C480: TATHAM | F480: COFFIN | I480: BEAGLEY | L480: CAREY | O480: MEEHAN | S480: FINLAYSON
A481: GOALKICKERS
A482: PRESTON | C482: DOYLE 2 | E482: WARR 2 | G482: McEACHERN 2 | J482: HUGHSON 2 | M482: L ROBINSON 2 | P482: HEARN | R482: ARTHUR | U482: CAMERON
A483: CAMBERWELL | C483: COFFIN 3 | F483: BOOTHMAN 2 | J483: BEAGLEY | M483: TATHAM | O483: JONES | Q483: AUSTIN
A485: OAKLEIGH | C485: 4 | D485: 4 | E485: =C485*6+D485 -> 28 | G485: 7 | H485: 6 | I485: =G485*6+H485 -> 48 | K485: 12 | L485: 12 | M485: =K485*6+L485 -> 84 | O485: 15 | P485: 18 | Q485: =O485*6+P485 -> 108 | S485: OAKLEIGH
A486: YARRAVILLE | C486: 4 | D486: 1 | E486: =C486*6+D486 -> 25 | G486: 6 | H486: 5 | I486: =G486*6+H486 -> 41 | K486: 9 | L486: 8 | M486: =K486*6+L486 -> 62 | O486: 10 | P486: 12 | Q486: =O486*6+P486 -> 72 | S486: FRICKE
A487: BEST PLAYERS
A488: OAKLEIGH | C488: CHAPMAN | F488: DENNING | I488: KIDD | K488: FRASER | N488: McALLISTER | R488: POWELL
A489: YARRAVILLE | C489: EVANS | F489: WARDEN | I489: RYAN | K489: W BUCKLEY | N489: LAVENDER
A490: GOALKICKERS
A491: OAKLEIGH | C491: DENNING 5 | F491: FRASER 4 | I491: FLEMING 2 | L491: WILTSHIRE | N491: CRAMERI | P491: MUDGE | R491: WITHERS
A492: YARRAVILLE | C492: WARDEN 2 | F492: WEDGWOOD 2 | I492: J BUCKLEY | L492: EVANS | N492: WILLIAMS | Q492: WUNHYM | T492: BRACKEN | W492: PEARCE
A494: COBURG | C494: 5 | D494: 4 | E494: =C494*6+D494 -> 34 | G494: 7 | H494: 11 | I494: =G494*6+H494 -> 53 | K494: 11 | L494: 15 | M494: =K494*6+L494 -> 81 | O494: 14 | P494: 16 | Q494: =O494*6+P494 -> 100 | S494: COBURG
A495: BRIGHTON | C495: 4 | D495: 3 | E495: =C495*6+D495 -> 27 | G495: 5 | H495: 6 | I495: =G495*6+H495 -> 36 | K495: 6 | L495: 11 | M495: =K495*6+L495 -> 47 | O495: 8 | P495: 17 | Q495: =O495*6+P495 -> 65 | S495: GLOVER
A496: BEST PLAYERS
A497: COBURG | C497: MEARS | F497: DUNCAN | I497: MOSS | L497: VOIGHT | O497: KIGHT | R497: BOYD
A498: BRIGHTON | C498: LILBURNE | F498: L MILLER | I498: R MILLER | L498: CANTWELL | O498: DREW | R498: TUCKER
A499: GOALKICKERS
A500: COBURG | C500: MEARS 3 | F500: MOSS 3 | I500: DUNCAN 3 | L500: BROWN 2 | O500: VOIGHT | Q500: BREEN | S500: HENNING
A501: BRIGHTON | C501: LILBURNE 3 | F501: CONNELL 2 | I501: BURNES 2 | L501: TUCKER
A503: WILLIAMSTOWN | C503: 1 | D503: 3 | E503: =C503*6+D503 -> 9 | G503: 6 | H503: 5 | I503: =G503*6+H503 -> 41 | K503: 8 | L503: 6 | M503: =K503*6+L503 -> 54 | O503: 13 | P503: 9 | Q503: =O503*6+P503 -> 87 | S503: NORTHCOTE
A504: BRUNSWICK | C504: 4 | D504: 3 | E504: =C504*6+D504 -> 27 | G504: 6 | H504: 6 | I504: =G504*6+H504 -> 42 | K504: 10 | L504: 12 | M504: =K504*6+L504 -> 72 | O504: 10 | P504: 12 | Q504: =O504*6+P504 -> 72 | S504: NOWLAN
A505: BEST PLAYERS
A506: WILLIAMSTOWN | C506: CAHILL | E506: MARTIN | H506: COOK | K506: BLAKE | N506: TAYLOR | Q506: BROOKS
A507: BRUNSWICK | C507: PALMER | E507: A GILLON | H507: MAYNES | K507: DOWLING | N507: BOYD | Q507: JENKINS
A508: GOALKICKERS
A509: WILLIAMSTOWN | C509: CAHILL 6 | F509: PITTS 3 | I509: HYDE 2 | K509: McADAM | M509: SIMMONDS
A510: BRUNSWICK | C510: BOYD 3 | F510: PALMER 2 | I510: DOWLING | K510: JENKINS | M510: FRANKE | O510: ELLAWAY
A512: ROUND 10 | E512: 7TH JULY | H512: WEATHER | K512: CLOUDY RAIN 2ND HALF S.W. WIND | S512: PLAYED AT
D513: 1ST QTR | H513: 2ND QTR | L513: 3RD QTR | P513: FINAL | S513: PORT MELBOURNE
A514: COBURG | C514: 5 | D514: 15 | E514: =C514*6+D514 -> 45 | G514: 5 | H514: 16 | I514: =G514*6+H514 -> 46 | K514: 12 | L514: 18 | M514: =K514*6+L514 -> 90 | O514: 13 | P514: 21 | Q514: =O514*6+P514 -> 99 | S514: UMPIRE | X514: LADDER | AB514: ROUND | AD514: 10
A515: PORT MELBOURNE | C515: 0 | D515: 0 | E515: =C515*6+D515 -> 0 | G515: 2 | H515: 10 | I515: =G515*6+H515 -> 22 | K515: 4 | L515: 11 | M515: =K515*6+L515 -> 35 | O515: 9 | P515: 16 | Q515: =O515*6+P515 -> 70 | S515: MURRAY
A516: BEST PLAYERS | W516: TEAM | X516: W | Y516: L | Z516: D | AA516: FOR | AB516: AGST | AC516: % | AD516: PTS
A517: COBURG | C517: RUDOLPH | F517: VOIGHT | I517: HENNING | L517: MOSS | N517: BROWN | Q517: MEARS
A518: PORT MELBOURNE | C518: HURLEY | F518: KEATING | I518: ATKINSON | L518: PERRETT | N518: PLUMRIDGE | Q518: TUITE | W518: NORTHCOTE | X518: 9 | Y518: 1 | Z518: 0 | AA518: 1262 | AB518: 823 | AC518: 153.34143377885783 | AD518: 36
A519: GOALKICKERS | W519: PRESTON | X519: 7 | Y519: 3 | Z519: 0 | AA519: 945 | AB519: 778 | AC519: 121.46529562982005 | AD519: 28
A520: COBURG | C520: MEARS 4 | F520: HENNING 4 | I520: DUNCAN 3 | L520: HARRIS | N520: DAYMAN | W520: PRAHRAN | X520: 7 | Y520: 3 | Z520: 0 | AA520: 1069 | AB520: 925 | AC520: 115.56756756756756 | AD520: 28
A521: PORT MELBOURNE | C521: O'ROURKE 3 | F521: RUSDEN 2 | I521: PERRETT 2 | L521: KEATING | N521: BOQUEST | W521: OAKLEIGH | X521: 7 | Y521: 3 | Z521: 0 | AA521: 1002 | AB521: 868 | AC521: 115.43778801843318 | AD521: 28
A523: PRAHRAN | C523: 4 | D523: 3 | E523: =C523*6+D523 -> 27 | G523: 7 | H523: 4 | I523: =G523*6+H523 -> 46 | K523: 12 | L523: 7 | M523: =K523*6+L523 -> 79 | O523: 15 | P523: 9 | Q523: 99 | S523: YARRAVILLE | W523: COBURG | X523: 6 | Y523: 4 | Z523: 0 | AA523: 896 | AB523: 897 | AC523: 99.888517279821627 | AD523: 24
A524: YARRAVILLE | C524: 4 | D524: 5 | E524: =C524*6+D524 -> 29 | G524: 7 | H524: 8 | I524: =G524*6+H524 -> 50 | K524: 7 | L524: 12 | M524: =K524*6+L524 -> 54 | O524: 11 | P524: 15 | Q524: 81 | S524: GLOVER | W524: SANDRINGHAM | X524: 5 | Y524: 4 | Z524: 1 | AA524: 931 | AB524: 933 | AC524: 99.785637727759919 | AD524: 22
A525: BEST PLAYERS | W525: PORT MELBOURNE | X525: 5 | Y525: 5 | Z525: 0 | AA525: 764 | AB525: 796 | AC525: 95.979899497487438 | AD525: 20
A526: PRAHRAN | C526: KOOP | F526: HAWKINS | I526: WHITE | L526: HYDE | N526: DOOLAN | Q526: MILBURN | W526: CAMBERWELL | X526: 4 | Y526: 6 | Z526: 0 | AA526: 869 | AB526: 885 | AC526: 98.192090395480221 | AD526: 16
A527: YARRAVILLE | C527: SHEEHAN | F527: WHITE | I527: MOLONEY | L527: EVANS | N527: RYAN | Q527: PEARCE | W527: YARRAVILLE | X527: 4 | Y527: 6 | Z527: 0 | AA527: 873 | AB527: 925 | AC527: 94.378378378378372 | AD527: 16
A528: GOALKICKERS | W528: BRIGHTON | X528: 3 | Y528: 7 | Z528: 0 | AA528: 822 | AB528: 960 | AC528: 85.625 | AD528: 12
A529: PRAHRAN | C529: HAWKINS 8 | F529: WHITE 3 | I529: MUNN 2 | L529: ANDERSON | N529: HAWKER | W529: WILLIAMSTOWN | X529: 1 | Y529: 8 | Z529: 1 | AA529: 781 | AB529: 1144 | AC529: 68.269230769230774 | AD529: 6
A530: YARRAVILLE | C530: J BUCKLEY 4 | F530: PEARCE 4 | I530: SHEEHAN | L530: McGRATH | N530: BRACKEN | W530: BRUNSWICK | X530: 1 | Y530: 9 | Z530: 0 | AA530: 789 | AB530: 1069 | AC530: 73.807296538821333 | AD530: 4
A532: NORTHCOTE | C532: 3 | D532: 4 | E532: =C532*6+D532 -> 22 | G532: 4 | H532: 6 | I532: =G532*6+H532 -> 30 | K532: 7 | L532: 8 | M532: =K532*6+L532 -> 50 | O532: 11 | P532: 9 | Q532: =O532*6+P532 -> 75 | S532: CAMBERWELL
A533: CAMBERWELL | C533: 0 | D533: 3 | E533: =C533*6+D533 -> 3 | G533: 8 | H533: 9 | I533: =G533*6+H533 -> 57 | K533: 9 | L533: 9 | M533: =K533*6+L533 -> 63 | O533: 9 | P533: 11 | Q533: =O533*6+P533 -> 65 | S533: HASSETT
A534: BEST PLAYERS
A535: NORTHCOTE | C535: LAWRENCE | F535: GRAY | I535: ROSS | L535: GOULLETT | O535: SEYMOUR | R535: HONIG
A536: CAMBERWELL | C536: MASON | F536: MEEHAN | I536: TATHAM | L536: CLAMP | O536: BEAGLEY | R536: WILLIAMS
A537: GOALKICKERS
A538: NORTHCOTE | C538: SEYMOUR 3 | F538: LAWRENCE 3 | I538: ROGERS 2 | L538: ROSS | N538: MEITZKE | Q538: HONIG
A539: CAMBERWELL | C539: CLAMP 3 | F539: TATHAM 2 | I539: MEEHAN 2 | L539: BEAGLEY | N539: MASON
A541: WILLIAMSTOWN | C541: 3 | D541: 4 | E541: =C541*6+D541 -> 22 | G541: 6 | H541: 5 | I541: =G541*6+H541 -> 41 | K541: 13 | L541: 10 | M541: =K541*6+L541 -> 88 | O541: 14 | P541: 10 | Q541: =O541*6+P541 -> 94 | S541: WILLIAMSTOWN
A542: SANDRINGHAM | C542: 2 | D542: 1 | E542: =C542*6+D542 -> 13 | G542: 7 | H542: 7 | I542: =G542*6+H542 -> 49 | K542: 8 | L542: 7 | M542: =K542*6+L542 -> 55 | O542: 14 | P542: 10 | Q542: =O542*6+P542 -> 94 | S542: LESTER
A543: BEST PLAYERS
A544: WILLIAMSTOWN | C544: CAHILL | F544: MARTIN | I544: HYDE | L544: DREW | O544: PITTS | R544: TAYLOR
A545: SANDRINGHAM | C545: CAMPBELL | F545: THOMS | I545: JONES | L545: CAHIR | O545: KEMP | R545: BAILES
A546: GOALKICKERS
A547: WILLIAMSTOWN | C547: PITTS 5 | E547: BLAKE 2 | H547: McGILLIVRAY 2 | K547: BURKE 2 | M547: STEBBINS | O547: HYDE | Q547: SIMMONDS
A548: SANDRINGHAM | C548: BAILES 3 | E548: WILSON 3 | H548: JONES 2 | J548: CAHIR 2 | L548: CAMPBELL | N548: THOMS | P548: MALLETT | R548: DENNINGTON
A550: PRESTON | C550: 8 | D550: 5 | E550: =C550*6+D550 -> 53 | G550: 10 | H550: 6 | I550: =G550*6+H550 -> 66 | K550: 14 | L550: 16 | M550: =K550*6+L550 -> 100 | O550: 19 | P550: 20 | Q550: =O550*6+P550 -> 134 | S550: BRUNSWICK
A551: BRUNSWICK | C551: 2 | D551: 0 | E551: =C551*6+D551 -> 12 | G551: 5 | H551: 2 | I551: =G551*6+H551 -> 32 | K551: 6 | L551: 3 | M551: =K551*6+L551 -> 39 | O551: 8 | P551: 3 | Q551: =O551*6+P551 -> 51 | S551: DURSTON
A552: BEST PLAYERS
A553: PRESTON | C553: BROWN | E553: DOYLE | H553: BREWIS | K553: HEARN | N553: ARTHUR | Q553: WARE
A554: BRUNSWICK | C554: JUSTICE | E554: BLACKMORE | H554: PRISMAL | K554: DOWLING | N554: THOMPSON | Q554: MITCHELL
A555: GOALKICKERS
A556: PRESTON | C556: BROWN 6 | E556: WARR 4 | G556: L ROBINSON 3 | J556: ARTHUR 2 | M556: McSWAIN 2 | P556: UNDERHILL | S556: W ROBINSON
A557: BRUNSWICK | C557: JUSTICE 5 | F557: FRANKE | I557: BOYD | K557: GILLON
A559: OAKLEIGH | C559: 4 | D559: 7 | E559: =C559*6+D559 -> 31 | G559: 4 | H559: 10 | I559: =G559*6+H559 -> 34 | K559: 7 | L559: 17 | M559: =K559*6+L559 -> 59 | O559: 8 | P559: 19 | Q559: =O559*6+P559 -> 67 | S559: ELSTERNWICK PARK
A560: BRIGHTON | C560: 2 | D560: 1 | E560: =C560*6+D560 -> 13 | G560: 4 | H560: 4 | I560: =G560*6+H560 -> 28 | K560: 5 | L560: 6 | M560: =K560*6+L560 -> 36 | O560: 8 | P560: 7 | Q560: =O560*6+P560 -> 55 | S560: STUART
A561: BEST PLAYERS
A562: OAKLEIGH | C562: CHAPMAN | F562: KIDD | I562: McALLISTER | M562: YANN | O562: WILTSHIRE | R562: CRAMERI
A563: BRIGHTON | C563: TUCKER | F563: CONNELL | I563: GOULDSWORTHY | M563: STEWART | O563: TOMLINS | R563: McLEOD
A564: GOALKICKERS
A565: OAKLEIGH | C565: DENNING 3 | F565: CRAMERI 3 | I565: FRASER | K565: DEAN
A566: BRIGHTON | C566: TUCKER 2 | F566: CONNELL 2 | I566: HUNT | K566: BURNES | M566: MILLER
A568: ROUND 11 | E568: 14TH JULY | J568: WEATHER | M568: FINE NORTH WIND | S568: PLAYED AT
D569: 1ST QTR | H569: 2ND QTR | L569: 3RD QTR | P569: FINAL | S569: OAKLEIGH
A570: OAKLEIGH | C570: 1 | D570: 3 | E570: =C570*6+D570 -> 9 | G570: 2 | H570: 10 | I570: =G570*6+H570 -> 22 | K570: 5 | L570: 14 | M570: =K570*6+L570 -> 44 | O570: 6 | P570: 19 | Q570: =O570*6+P570 -> 55 | S570: UMPIRE | X570: LADDER | AB570: ROUND | AD570: 11
A571: PORT MELBOURNE | C571: 4 | D571: 1 | E571: =C571*6+D571 -> 25 | G571: 6 | H571: 2 | I571: =G571*6+H571 -> 38 | K571: 6 | L571: 2 | M571: =K571*6+L571 -> 38 | O571: 8 | P571: 4 | Q571: =O571*6+P571 -> 52 | S571: STUART
A572: BEST PLAYERS | W572: TEAM | X572: W | Y572: L | Z572: D | AA572: FOR | AB572: AGST | AC572: % | AD572: PTS
A573: OAKLEIGH | C573: YANN | E573: HUTCHESON | H573: McALLISTER | K573: WITHERS | N573: DENNING | Q573: GOULD
A574: PORT MELBOURNE | C574: LAHIFF | E574: PLUMRIDGE | H574: LEGGO | K574: BEDFORD | N574: PERRETT | Q574: TUITE | W574: NORTHCOTE | X574: 10 | Y574: 1 | Z574: 0 | AA574: 1421 | AB574: 900 | AC574: 157.88888888888889 | AD574: 40
A575: GOALKICKERS | W575: PRESTON | X575: 8 | Y575: 3 | Z575: 0 | AA575: 1060 | AB575: 848 | AC575: 125 | AD575: 32
A576: OAKLEIGH | C576: DENNING 4 | F576: CHAPMAN | I576: WATSON | W576: PRAHRAN | X576: 8 | Y576: 3 | Z576: 0 | AA576: 1191 | AB576: 986 | AC576: 120.79107505070994 | AD576: 32
A577: PORT MELBOURNE | C577: RUSDEN 3 | F577: PERRETT | I577: LAHIFF | K577: HURLEY | M577: BOQUEST | O577: BOLMAN | W577: OAKLEIGH | X577: 8 | Y577: 3 | Z577: 0 | AA577: 1057 | AB577: 920 | AC577: 114.89130434782609 | AD577: 32
A579: COBURG | C579: 4 | D579: 9 | E579: =C579*6+D579 -> 33 | G579: 4 | H579: 9 | I579: =G579*6+H579 -> 33 | K579: 9 | L579: 11 | M579: =K579*6+L579 -> 65 | O579: 10 | P579: 13 | Q579: =O579*6+P579 -> 73 | S579: COBURG | W579: COBURG | X579: 7 | Y579: 4 | Z579: 0 | AA579: 969 | AB579: 963 | AC579: 100.62305295950156 | AD579: 28
A580: CAMBERWELL | C580: 1 | D580: 1 | E580: =C580*6+D580 -> 7 | G580: 6 | H580: 8 | I580: =G580*6+H580 -> 44 | K580: 6 | L580: 9 | M580: =K580*6+L580 -> 45 | O580: 9 | P580: 12 | Q580: =O580*6+P580 -> 66 | S580: NOWLAN | W580: SANDRINGHAM | X580: 6 | Y580: 4 | Z580: 1 | AA580: 1025 | AB580: 997 | AC580: 102.80842527582749 | AD580: 26
A581: BEST PLAYERS | W581: PORT MELBOURNE | X581: 5 | Y581: 6 | Z581: 0 | AA581: 816 | AB581: 851 | AC581: 95.887191539365446 | AD581: 20
A582: COBURG | C582: RUDOLPH | F582: MOSS | I582: HENNING | L582: MARTYN | O582: KIGHT | Q582: DUNCAN | W582: CAMBERWELL | X582: 4 | Y582: 7 | Z582: 0 | AA582: 935 | AB582: 958 | AC582: 97.59916492693111 | AD582: 16
A583: CAMBERWELL | C583: CLAMP | F583: TATHAM | I583: R WILLIAMS | L583: CLARKE | O583: PIERCE | Q583: MASON | W583: YARRAVILLE | X583: 4 | Y583: 7 | Z583: 0 | AA583: 937 | AB583: 1019 | AC583: 91.952894995093232 | AD583: 16
A584: GOALKICKERS | W584: BRIGHTON | X584: 3 | Y584: 8 | Z584: 0 | AA584: 883 | AB584: 1082 | AC584: 81.608133086876151 | AD584: 12
A585: COBURG | C585: RUDOLPH 4 | F585: MOSS | H585: HARRIS | J585: MARTYN | L585: DUNCAN | N585: HENNING | P585: DAYMAN | W585: WILLIAMSTOWN | X585: 1 | Y585: 9 | Z585: 1 | AA585: 851 | AB585: 1259 | AC585: 67.593328038125492 | AD585: 6
A586: CAMBERWELL | C586: TATHAM 3 | F586: STONE 2 | I586: GRIFFITH 2 | L586: MEEHAN | N586: SNEDDON | W586: BRUNSWICK | X586: 1 | Y586: 10 | Z586: 0 | AA586: 866 | AB586: 1228 | AC586: 70.521172638436482 | AD586: 4
A588: SANDRINGHAM | C588: 7 | D588: 11 | E588: =C588*6+D588 -> 53 | G588: 8 | H588: 11 | I588: =G588*6+H588 -> 59 | K588: 11 | L588: 22 | M588: =K588*6+L588 -> 88 | O588: 12 | P588: 22 | Q588: =O588*6+P588 -> 94 | S588: BEACH ROAD
A589: YARRAVILLE | C589: 0 | D589: 1 | E589: =C589*6+D589 -> 1 | G589: 5 | H589: 5 | I589: =G589*6+H589 -> 35 | K589: 5 | L589: 7 | M589: =K589*6+L589 -> 37 | O589: 8 | P589: 16 | Q589: =O589*6+P589 -> 64 | S589: MURRAY
A590: BEST PLAYERS
A591: SANDRINGHAM | C591: THOMS | F591: DOWLING | I591: TOLSON | L591: McCOMB | O591: DENNINGTON | R591: LUNN
A592: YARRAVILLE | C592: SHEEHAN | F592: HOLM | I592: WARDEN | L592: EDWARDS | O592: McGRATH | R592: COPPOCK
A593: GOALKICKERS
A594: SANDRINGHAM | C594: DOWLING 5 | F594: DENNINGTON 2 | J594: JONES 2 | L594: TOLSON | N594: THOMS | P594: CAHIR | R594: WILSON | U594: YEMM
A595: YARRAVILLE | C595: J BUCKLEY 2 | F595: SHEEHAN | I595: McGRATH | L595: WILLIAMS | O595: WEDGWOOD | R595: BRACKEN | U595: COPPOCK
A597: PRAHRAN | C597: 2 | D597: 1 | E597: =C597*6+D597 -> 13 | G597: 9 | H597: 9 | I597: =G597*6+H597 -> 63 | K597: 10 | L597: 10 | M597: =K597*6+L597 -> 70 | O597: 17 | P597: 20 | Q597: =O597*6+P597 -> 122 | S597: TOORAK PARK
A598: BRIGHTON | C598: 4 | D598: 8 | E598: =C598*6+D598 -> 32 | G598: 4 | H598: 8 | I598: =G598*6+H598 -> 32 | K598: 7 | L598: 12 | M598: =K598*6+L598 -> 54 | O598: 8 | P598: 13 | Q598: =O598*6+P598 -> 61 | S598: SCATES
A599: BEST PLAYERS
A600: PRAHRAN | C600: HAWKINS | F600: WHITE | I600: WELLS | K600: DIXON | N600: KOOP | Q600: HYDE
A601: BRIGHTON | C601: HILL | F601: TUCKER | I601: HUNT | K601: CONNELL | N601: JOHNSTONE | Q601: HARRISON
A602: GOALKICKERS
A603: PRAHRAN | C603: HAWKINS 5 | F603: WHITE 4 | I603: BRENCHLEY 2 | L603: MUNN 2 | N603: ANDERSON 2 | Q603: N WILLIAMS | T603: SHARPLEY
A604: BRIGHTON | C604: CONNELL 3 | F604: LILBURNE 2 | I604: HILL 2 | L604: DREW
A606: PRESTON | C606: 2 | D606: 0 | E606: =C606*6+D606 -> 12 | G606: 6 | H606: 13 | I606: =G606*6+H606 -> 49 | K606: 8 | L606: 15 | M606: =K606*6+L606 -> 63 | O606: 15 | P606: 25 | Q606: =O606*6+P606 -> 115 | S606: PRESTON
A607: WILLIAMSTOWN | C607: 4 | D607: 6 | E607: =C607*6+D607 -> 30 | G607: 6 | H607: 6 | I607: =G607*6+H607 -> 42 | K607: 10 | L607: 10 | M607: =K607*6+L607 -> 70 | O607: 10 | P607: 10 | Q607: =O607*6+P607 -> 70 | S607: HASSETT
A608: BEST PLAYERS
A609: PRESTON | C609: McSWAIN | F609: WARR | I609: HUGO | L609: BROWN | O609: BREWIS | Q609: DINEEN
A610: WILLIAMSTOWN | C610: CAHILL | F610: BROOKS | I610: FISHER | L610: E DELLER | O610: DREW | Q610: HYDE
A611: GOALKICKERS
A612: PRESTON | C612: WARR 5 | F612: ARTHUR 3 | I612: McSWAIN 3 | L612: BOSCHEN 2 | O612: UNDERHILL | R612: CAMERON
A613: WILLIAMSTOWN | C613: CAHILL 3 | F613: HYDE 3 | I613: DREW 2 | L613: McGILLIVRAY | O613: BURKE
A615: NORTHCOTE | C615: 5 | D615: 3 | E615: =C615*6+D615 -> 33 | G615: 10 | H615: 3 | I615: =G615*6+H615 -> 63 | K615: 13 | L615: 7 | M615: =K615*6+L615 -> 85 | O615: 24 | P615: 15 | Q615: =O615*6+P615 -> 159 | S615: NORTHCOTE
A616: BRUNSWICK | C616: 1 | D616: 2 | E616: =C616*6+D616 -> 8 | G616: 2 | H616: 4 | I616: =G616*6+H616 -> 16 | K616: 5 | L616: 10 | M616: =K616*6+L616 -> 40 | O616: 11 | P616: 11 | Q616: =O616*6+P616 -> 77 | S616: LESTER
A617: BEST PLAYERS
A618: NORTHCOTE | C618: WOODS | E618: BYRNE | H618: GOULLETT | K618: ROSS | N618: ROGERS | Q618: HASKETT
A619: BRUNSWICK | C619: PALMER | E619: DOWLING | H619: JUSTICE | K619: ELLAWAY | N619: JORDAN | Q619: J SPOKES
A620: GOALKICKERS
A621: NORTHCOTE | C621: BYRNE 11 | F621: GRAY 4 | H621: ROSS 2 | J621: ROGERS 2 | M621: MEITZKE | O621: ACKLAND | Q621: BATES
A622: BRUNSWICK | C622: PALMER 5 | F622: JUSTICE 2 | I622: JENKINS | L622: FRANKE | N622: BOYD | P622: RAEBURN
A624: ROUND 12 | E624: 21ST JULY | J624: WEATHER | M624: COOL CLOUDY SOUTH WIND | S624: PLAYED AT
D625: 1ST QTR | H625: 2ND QTR | L625: 3RD QTR | P625: FINAL | S625: NORTHCOTE
A626: PRESTON | C626: 3 | D626: 1 | E626: =C626*6+D626 -> 19 | G626: 3 | H626: 4 | I626: =G626*6+H626 -> 22 | K626: 9 | L626: 7 | M626: =K626*6+L626 -> 61 | O626: 12 | P626: 11 | Q626: =O626*6+P626 -> 83 | S626: UMPIRE | X626: LADDER | AB626: ROUND | AD626: 12
A627: NORTHCOTE | C627: 3 | D627: 1 | E627: =C627*6+D627 -> 19 | G627: 7 | H627: 3 | I627: =G627*6+H627 -> 45 | K627: 11 | L627: 7 | M627: =K627*6+L627 -> 73 | O627: 11 | P627: 14 | Q627: =O627*6+P627 -> 80 | S627: NOWLAN
A628: BEST PLAYERS | W628: TEAM | X628: W | Y628: L | Z628: D | AA628: FOR | AB628: AGST | AC628: % | AD628: PTS
A629: PRESTON | C629: SMITH | E629: HARDING | H629: WARR | K629: HUGO | N629: BOSCHEN | Q629: McEACHARN
A630: NORTHCOTE | C630: GRAY | E630: HART | H630: ROSS | K630: MEITZKE | N630: BATES | Q630: GOULLETT | W630: NORTHCOTE | X630: 10 | Y630: 2 | Z630: 0 | AA630: 1501 | AB630: 983 | AC630: 152.7 | AD630: 40
A631: GOALKICKERS | W631: PRAHRAN | X631: 9 | Y631: 3 | Z631: 0 | AA631: 1335 | AB631: 1061 | AC631: 125.82469368520263 | AD631: 36
A632: PRESTON | C632: WARR 3 | E632: BROWN 3 | H632: McSWAIN 2 | K632: BOSCHEN | N632: McEACHERN | Q632: FARRELL | W632: PRESTON | X632: 9 | Y632: 3 | Z632: 0 | AA632: 1143 | AB632: 928 | AC632: 123.17 | AD632: 36
A633: NORTHCOTE | C633: GRAY 4 | E633: BYRNE 3 | H633: WILLIAMSON | K633: GOULLET | N633: SIMMONDS | Q633: LAWRENCE | W633: OAKLEIGH | X633: 8 | Y633: 4 | Z633: 0 | AA633: 1134 | AB633: 1018 | AC633: 111.39489194499018 | AD633: 32
A635: PRAHRAN | C635: 7 | D635: 3 | E635: =C635*6+D635 -> 45 | G635: 15 | H635: 6 | I635: =G635*6+H635 -> 96 | K635: 18 | L635: 7 | M635: =K635*6+L635 -> 115 | O635: 22 | P635: 12 | Q635: =O635*6+P635 -> 144 | S635: TOORAK PARK | W635: COBURG | X635: 8 | Y635: 4 | Z635: 0 | AA635: 1062 | AB635: 1023 | AC635: 103.81231671554252 | AD635: 32
A636: PORT MELBOURNE | C636: 1 | D636: 6 | E636: =C636*6+D636 -> 12 | G636: 3 | H636: 8 | I636: =G636*6+H636 -> 26 | K636: 8 | L636: 12 | M636: =K636*6+L636 -> 60 | O636: 10 | P636: 15 | Q636: =O636*6+P636 -> 75 | S636: MURRAY | W636: SANDRINGHAM | X636: 6 | Y636: 5 | Z636: 1 | AA636: 1112 | AB636: 1096 | AC636: 101.45985401459853 | AD636: 26
A637: BEST PLAYERS | W637: CAMBERWELL | X637: 5 | Y637: 7 | Z637: 0 | AA637: 1033 | AB637: 1035 | AC637: 99.806763285024161 | AD637: 20
A638: PRAHRAN | C638: HAWKINS | F638: WESTCOTT | I638: WHITE | L638: HYDE | N638: N WILLIAMS | Q638: BRENCHLEY | W638: YARRAVILLE | X638: 5 | Y638: 7 | Z638: 0 | AA638: 1039 | AB638: 1103 | AC638: 94.1976427923844 | AD638: 20
A639: PORT MELBOURNE | C639: PLUMRIDGE | F639: MALTBY | I639: PERRETT | L639: LEGGO | N639: TUITE | Q639: HURLEY | W639: PORT MELBOURNE | X639: 5 | Y639: 7 | Z639: 0 | AA639: 891 | AB639: 995 | AC639: 89.547738693467338 | AD639: 20
A640: GOALKICKERS | W640: BRIGHTON | X640: 4 | Y640: 8 | Z640: 0 | AA640: 982 | AB640: 1169 | AC640: 84.003421727972622 | AD640: 16
A641: PRAHRAN | C641: HAWKINS 11 | F641: BRENCHLEY 4 | I641: WHITE | K641: AVERY | M641: MUNN | O641: ANDERSON | R641: MILBURN | W641: WILLIAMSTOWN | X641: 1 | Y641: 10 | Z641: 1 | AA641: 935 | AB641: 1361 | AC641: 68.699485672299787 | AD641: 6
A642: PORT MELBOURNE | C642: RUSDEN 4 | F642: HURLEY 2 | I642: LAHIFF | K642: MALTBY | M642: TUITE | O642: LOWRIE | W642: BRUNSWICK | X642: 1 | Y642: 11 | Z642: 0 | AA642: 926 | AB642: 1321 | AC642: 70.098410295230892 | AD642: 4
A644: CAMBERWELL | C644: 3 | D644: 6 | E644: =C644*6+D644 -> 24 | G644: 4 | H644: 10 | I644: =G644*6+H644 -> 34 | K644: 11 | L644: 13 | M644: =K644*6+L644 -> 79 | O644: 13 | P644: 20 | Q644: =O644*6+P644 -> 98 | S644: OAKLEIGH
A645: OAKLEIGH | C645: 4 | D645: 4 | E645: =C645*6+D645 -> 28 | G645: 6 | H645: 10 | I645: =G645*6+H645 -> 46 | K645: 6 | L645: 13 | M645: =K645*6+L645 -> 49 | O645: 10 | P645: 17 | Q645: =O645*6+P645 -> 77 | S645: LESTER
A646: BEST PLAYERS
A647: CAMBERWELL | C647: TATHAM | F647: CLAMP | I647: MEEHAN | L647: HERRICKS | O647: BEAGLEY | R647: CAREY
A648: OAKLEIGH | C648: WITHERS | F648: MUDGE | I648: KIDD | L648: YANN | O648: FLEMING | R648: FAHEY
A649: GOALKICKERS
A650: CAMBERWELL | C650: HERRICKS 4 | F650: MEEHAN 2 | I650: GRIFFITH 2 | L650: SNEDDON 2 | O650: WILLIAMS | R650: COFFIN | U650: TATHAM
A651: OAKLEIGH | C651: FRASER 4 | F651: HEINTZ 3 | I651: DEAN | L651: FLEMING | O651: FAHEY
A653: YARRAVILLE | C653: 6 | D653: 5 | E653: =C653*6+D653 -> 41 | G653: 8 | H653: 8 | I653: =G653*6+H653 -> 56 | K653: 14 | L653: 11 | M653: =K653*6+L653 -> 95 | O653: 15 | P653: 12 | Q653: =O653*6+P653 -> 102 | S653: WILLIAMSTOWN
A654: WILLIAMSTOWN | C654: 0 | D654: 1 | E654: =C654*6+D654 -> 1 | G654: 5 | H654: 7 | I654: =G654*6+H654 -> 37 | K654: 6 | L654: 8 | M654: =K654*6+L654 -> 44 | O654: 12 | P654: 12 | Q654: =O654*6+P654 -> 84 | S654: HASSETT
A655: BEST PLAYERS
A656: YARRAVILLE | C656: J BUCKLEY | F656: WARDEN | I656: WUNHYM | L656: EVANS | O656: RYAN | Q656: COPPOCK
A657: WILLIAMSTOWN | C657: JOHNS | F657: McCABE | I657: CAHILL | L657: HYDE | O657: TAYLOR | Q657: STEBBINS
A658: GOALKICKERS
A659: YARRAVILLE | C659: J BUCKLEY 6 | F659: WARDEN 4 | I659: McGRATH 3 | L659: WEDGWOOD | O659: KENNY
A660: WILLIAMSTOWN | C660: CAHILL 4 | F660: McCABE 2 | I660: STEBBINS 2 | L660: BLAKE | N660: LAWLOR | P660: JOHNS | R660: McADAM
A662: BRIGHTON | C662: 2 | D662: 6 | E662: =C662*6+D662 -> 18 | G662: 5 | H662: 7 | I662: =G662*6+H662 -> 37 | K662: 9 | L662: 11 | M662: =K662*6+L662 -> 65 | O662: 14 | P662: 15 | Q662: =O662*6+P662 -> 99 | S662: BEACH ROAD
A663: SANDRINGHAM | C663: 4 | D663: 3 | E663: =C663*6+D663 -> 27 | G663: 7 | H663: 10 | I663: =G663*6+H663 -> 52 | K663: 8 | L663: 14 | M663: =K663*6+L663 -> 62 | O663: 11 | P663: 21 | Q663: =O663*6+P663 -> 87 | S663: STUART
A664: BEST PLAYERS
A665: BRIGHTON | C665: LILBURNE | F665: M JOHNSTONE | J665: HARRISON | M665: McLEOD | P665: CONNELL | S665: HUNT
A666: SANDRINGHAM | C666: LUNN | F666: DOWLING | J666: CAHIR | M666: JONES | P666: SMAIL | S666: MITCHELL
A667: GOALKICKERS
A668: BRIGHTON | C668: DREW 4 | F668: JOHNSTON 4 | I668: McLEOD 3 | L668: DEAN | N668: CONNELL | Q668: MILLER
A669: SANDRINGHAM | C669: DOWLING 7 | F669: SMAIL | H669: CAHIR | J669: WILSON | M669: JONES
A671: COBURG | C671: 4 | D671: 5 | E671: =C671*6+D671 -> 29 | G671: 6 | H671: 12 | I671: =G671*6+H671 -> 48 | K671: 9 | L671: 18 | M671: =K671*6+L671 -> 72 | O671: 12 | P671: 21 | Q671: =O671*6+P671 -> 93 | S671: COBURG
A672: BRUNSWICK | C672: 1 | D672: 1 | E672: =C672*6+D672 -> 7 | G672: 2 | H672: 3 | I672: =G672*6+H672 -> 15 | K672: 4 | L672: 6 | M672: =K672*6+L672 -> 30 | O672: 8 | P672: 12 | Q672: =O672*6+P672 -> 60 | S672: SCATES
A673: BEST PLAYERS
A674: COBURG | C674: MOSS | F674: HARRIS | I674: HENNING | L674: UHE | O674: BROWN | R674: MARTYN
A675: BRUNSWICK | C675: DOWLING | F675: PRISMAL | I675: BLACKMORE | L675: SPOKES | O675: FRANKE | R675: JENKINS
A676: GOALKICKERS
A677: COBURG | C677: MARTYN 4 | F677: DAYMAN 3 | I677: MOSS 2 | L677: HENNING | O677: DIXON | Q677: HOSIE
A678: BRUNSWICK | C678: JUSTICE 5 | F678: FRANKE 2 | I678: THOMPSON
A680: ROUND 13 | E680: 28TH JULY | J680: WEATHER | M680: FINE | S680: PLAYED AT
D681: 1ST QTR | H681: 2ND QTR | L681: 3RD QTR | P681: FINAL | S681: PRESTON
A682: PRESTON | C682: 2 | D682: 1 | E682: =C682*6+D682 -> 13 | G682: 4 | H682: 5 | I682: =G682*6+H682 -> 29 | K682: 10 | L682: 9 | M682: =K682*6+L682 -> 69 | O682: 14 | P682: 14 | Q682: =O682*6+P682 -> 98 | S682: UMPIRE | X682: LADDER | AB682: ROUND | AD682: 13
A683: COBURG | C683: 6 | D683: 3 | E683: =C683*6+D683 -> 39 | G683: 8 | H683: 5 | I683: =G683*6+H683 -> 53 | K683: 8 | L683: 6 | M683: =K683*6+L683 -> 54 | O683: 10 | P683: 9 | Q683: =O683*6+P683 -> 69 | S683: LESTER
A684: BEST PLAYERS | W684: TEAM | X684: W | Y684: L | Z684: D | AA684: FOR | AB684: AGST | AC684: % | AD684: PTS
A685: PRESTON | C685: DOWLING | F685: McEACHARN | I685: MURRAY | L685: DINEEN | O685: WARE | Q685: BROWN
A686: COBURG | C686: UHE | F686: VOIGHT | I686: DUNCAN | L686: HENNING | O686: BOYD | Q686: MOSS | W686: NORTHCOTE | X686: 11 | Y686: 2 | Z686: 0 | AA686: 1602 | AB686: 1048 | AC686: 152.86 | AD686: 44
A687: GOALKICKERS | W687: PRESTON | X687: 10 | Y687: 3 | Z687: 0 | AA687: 1241 | AB687: 997 | AC687: 124.47 | AD687: 40
A688: PRESTON | C688: BROWN 5 | E688: McEACHERN 2 | H688: McSWAIN 2 | K688: DOYLE | M688: WARR | O688: CAMERON | Q688: FARRELL | S688: DOWLING | W688: PRAHRAN | X688: 9 | Y688: 4 | Z688: 0 | AA688: 1406 | AB688: 1138 | AC688: 123.55008787346222 | AD688: 36
A689: COBURG | C689: DUNCAN 5 | F689: HENNING 2 | I689: MARTYN | L689: DIXON | N689: DAYMAN | W689: OAKLEIGH | X689: 8 | Y689: 5 | Z689: 0 | AA689: 1209 | AB689: 1108 | AC689: 109.11552346570397 | AD689: 32
A691: CAMBERWELL | C691: 4 | D691: 6 | E691: =C691*6+D691 -> 30 | G691: 7 | H691: 7 | I691: =G691*6+H691 -> 49 | K691: 10 | L691: 10 | M691: =K691*6+L691 -> 70 | O691: 11 | P691: 11 | Q691: =O691*6+P691 -> 77 | S691: CAMBERWELL | W691: COBURG | X691: 8 | Y691: 5 | Z691: 0 | AA691: 1131 | AB691: 1121 | AC691: 100.89206066012488 | AD691: 32
A692: PRAHRAN | C692: 3 | D692: 0 | E692: =C692*6+D692 -> 18 | G692: 8 | H692: 6 | I692: =G692*6+H692 -> 54 | K692: 9 | L692: 7 | M692: =K692*6+L692 -> 61 | O692: 10 | P692: 11 | Q692: =O692*6+P692 -> 71 | S692: SCATES | W692: SANDRINGHAM | X692: 6 | Y692: 6 | Z692: 1 | AA692: 1192 | AB692: 1198 | AC692: 99.499165275459092 | AD692: 26
A693: BEST PLAYERS | W693: CAMBERWELL | X693: 6 | Y693: 7 | Z693: 0 | AA693: 1110 | AB693: 1106 | AC693: 100.36166365280289 | AD693: 24
A694: CAMBERWELL | C694: TATHAM | F694: CAREY | I694: FINLAYSON | L694: L WILLIAMS | O694: STONE | Q694: MEEHAN | W694: PORT MELBOURNE | X694: 6 | Y694: 7 | Z694: 0 | AA694: 993 | AB694: 1075 | AC694: 92.372093023255815 | AD694: 24
A695: PRAHRAN | C695: WHITE | F695: WESCOTT | I695: KOOP | K695: HAWKINS | N695: TABATEAU | Q695: HYDE | W695: YARRAVILLE | X695: 5 | Y695: 8 | Z695: 0 | AA695: 1122 | AB695: 1190 | AC695: 94.285714285714292 | AD695: 20
A696: GOALKICKERS | W696: BRIGHTON | X696: 5 | Y696: 8 | Z696: 0 | AA696: 1069 | AB696: 1252 | AC696: 85.383386581469651 | AD696: 20
A697: CAMBERWELL | C697: TATHAM 4 | F697: GRIFFITH 3 | I697: HERRICKS 2 | L697: BEAGLEY | O697: MASON | W697: BRUNSWICK | X697: 2 | Y697: 11 | Z697: 0 | AA697: 1016 | AB697: 1396 | AC697: 72.779369627507165 | AD697: 8
A698: PRAHRAN | C698: HAWKINS 3 | F698: BRENCHLEY 2 | I698: WHITE 2 | L698: MUNN 2 | O698: AVERY | W698: WILLIAMSTOWN | X698: 1 | Y698: 11 | Z698: 1 | AA698: 1000 | AB698: 1462 | AC698: 68.39945280437756 | AD698: 6
A700: PORT MELBOURNE | C700: 1 | D700: 4 | E700: =C700*6+D700 -> 10 | G700: 6 | H700: 8 | I700: =G700*6+H700 -> 44 | K700: 12 | L700: 9 | M700: =K700*6+L700 -> 81 | O700: 15 | P700: 12 | Q700: =O700*6+P700 -> 102 | S700: PORT MELBOURNE
A701: SANDRINGHAM | C701: 4 | D701: 3 | E701: =C701*6+D701 -> 27 | G701: 4 | H701: 6 | I701: =G701*6+H701 -> 30 | K701: 9 | L701: 9 | M701: =K701*6+L701 -> 63 | O701: 11 | P701: 14 | Q701: =O701*6+P701 -> 80 | S701: MURRAY
A702: BEST PLAYERS
A703: PORT MELBOURNE | C703: RUSDEN | F703: HURLEY | I703: AVERY | K703: PLUMRIDGE | N703: PERRETT | Q703: LAHIFF
A704: SANDRINGHAM | C704: WILSON | F704: SMAIL | I704: THOMS | K704: DOWLING | N704: MALLETT | Q704: SCHLITZ
A705: GOALKICKERS
A706: PORT MELBOURNE | C706: RUSDEN 5 | F706: BEDFORD 2 | I706: LAHIFF 2 | K706: HURLEY 2 | M706: LEGGO | O706: BILLS | Q706: AVERY | S706: FORREST
A707: SANDRINGHAM | C707: DOWLING 3 | F707: BAILES 3 | I707: BECKTON | L707: DENNINGTON | O707: McCOMB | Q707: SMAIL | S707: THOMS
A709: BRIGHTON | C709: 4 | D709: 2 | E709: =C709*6+D709 -> 26 | G709: 7 | H709: 5 | I709: =G709*6+H709 -> 47 | K709: 8 | L709: 7 | M709: =K709*6+L709 -> 55 | O709: 13 | P709: 9 | Q709: =O709*6+P709 -> 87 | S709: ELSTERNWICK PARK
A710: YARRAVILLE | C710: 3 | D710: 2 | E710: =C710*6+D710 -> 20 | G710: 7 | H710: 5 | I710: =G710*6+H710 -> 47 | K710: 11 | L710: 10 | M710: =K710*6+L710 -> 76 | O710: 12 | P710: 11 | Q710: =O710*6+P710 -> 83 | S710: HASSETT
A711: BEST PLAYERS
A712: BRIGHTON | C712: DREW | F712: CONNELL | I712: CANTWELL | L712: BOLWELL | O712: DEANE | Q712: HUNT
A713: YARRAVILLE | C713: EDWARDS | F713: J BUCKLEY | I713: SHEAHAN | L713: KENNY | O713: RYAN | Q713: WUNHYM
A714: GOALKICKERS
A715: BRIGHTON | C715: DEAN 3 | F715: CONNELL 3 | I715: JOHNSTON 3 | L715: DREW 2 | N715: TUCKER | P715: BOLWELL
A716: YARRAVILLE | C716: J BUCKLEY 5 | F716: WILLIAMS 2 | I716: EVANS | K716: McGRATH | M716: FREW | O716: NEAL | Q716: PEARCE
A718: BRUNSWICK | C718: 1 | D718: 3 | E718: =C718*6+D718 -> 9 | G718: 5 | H718: 4 | I718: =G718*6+H718 -> 34 | K718: 6 | L718: 9 | M718: =K718*6+L718 -> 45 | O718: 13 | P718: 12 | Q718: =O718*6+P718 -> 90 | S718: BRUNSWICK
A719: OAKLEIGH | C719: 4 | D719: 3 | E719: =C719*6+D719 -> 27 | G719: 6 | H719: 8 | I719: =G719*6+H719 -> 44 | K719: 9 | L719: 12 | M719: =K719*6+L719 -> 66 | O719: 10 | P719: 15 | Q719: =O719*6+P719 -> 75 | S719: STUART
A720: BEST PLAYERS
A721: BRUNSWICK | C721: JENKINS | F721: PRISMAL | I721: BLACKMORE | L721: DOWLING | O721: JUSTICE | R721: THOMPSON
A722: OAKLEIGH | C722: FLEMING | F722: WATSON | I722: FRASER | L722: CRAMERI | O722: WITHERS | R722: GOULD
A723: GOALKICKERS
A724: BRUNSWICK | C724: JUSTICE 3 | F724: KENNEDY 2 | I724: FRANKE 2 | L724: ANDERSON 2 | O724: DOWLING | Q724: BOYD | S724: PRISMAL | V724: BLACKMORE
A725: OAKLEIGH | C725: FRASER 4 | F725: DENNING 2 | I725: FLEMING 2 | L725: HEINTZ | O725: BAKER
A727: NORTHCOTE | C727: 3 | D727: 2 | E727: =C727*6+D727 -> 20 | G727: 10 | H727: 7 | I727: =G727*6+H727 -> 67 | K727: 13 | L727: 11 | M727: =K727*6+L727 -> 89 | O727: 15 | P727: 11 | Q727: =O727*6+P727 -> 101 | S727: WILLIAMSTOWN
A728: WILLIAMSTOWN | C728: 3 | D728: 1 | E728: =C728*6+D728 -> 19 | G728: 5 | H728: 2 | I728: =G728*6+H728 -> 32 | K728: 7 | L728: 6 | M728: =K728*6+L728 -> 48 | O728: 9 | P728: 11 | Q728: =O728*6+P728 -> 65 | S728: NOWLAN
A729: BEST PLAYERS
A730: NORTHCOTE | C730: GRAY | E730: ROSS | G730: BYRNE | J730: SIMMONDS | M730: SEYMOUR | P730: GARRETT
A731: WILLIAMSTOWN | C731: BROOKS | E731: JOHNS | G731: BLAKE | J731: DREW | M731: TAYLOR | P731: LAWLOR
A732: GOALKICKERS
A733: NORTHCOTE | C733: SEYMOUR 6 | F733: KOOCHEW 3 | I733: GRAY 2 | K733: ROSS 2 | M733: BYRNE | O733: SIMMONDS
A734: WILLIAMSTOWN | C734: LAWLOR 3 | F734: DREW 2 | I734: BLAKE | K734: McCABE | M734: McADAM | O734: TAYLOR
A736: ROUND 14 | E736: 4TH AUGUST | I736: WEATHER | L736: COLD CLOUDY SHOWERS WEST WIND | S736: PLAYED AT
D737: 1ST QTR | H737: 2ND QTR | L737: 3RD QTR | P737: FINAL | S737: OAKLEIGH
A738: OAKLEIGH | C738: 1 | D738: 0 | E738: =C738*6+D738 -> 6 | G738: 9 | H738: 5 | I738: =G738*6+H738 -> 59 | K738: 11 | L738: 7 | M738: =K738*6+L738 -> 73 | O738: 14 | P738: 10 | Q738: =O738*6+P738 -> 94 | S738: UMPIRE | X738: LADDER | AB738: ROUND | AD738: 14
A739: PRESTON | C739: 4 | D739: 2 | E739: =C739*6+D739 -> 26 | G739: 6 | H739: 11 | I739: =G739*6+H739 -> 47 | K739: 11 | L739: 13 | M739: =K739*6+L739 -> 79 | O739: 12 | P739: 15 | Q739: =O739*6+P739 -> 87 | S739: HASSETT
A740: BEST PLAYERS | W740: TEAM | X740: W | Y740: L | Z740: D | AA740: FOR | AB740: AGST | AC740: % | AD740: PTS
A741: OAKLEIGH | C741: FLEMING | F741: DENNING | I741: HUTCHESON | L741: KIDD | N741: WITHERS | Q741: McALLISTER
A742: PRESTON | C742: UNDERHILL | F742: W ROBINSON | I742: SMITH | L742: ARTHUR | N742: BREWIS | Q742: DINEEN | W742: NORTHCOTE | X742: 11 | Y742: 3 | Z742: 0 | AA742: 1658 | AB742: 1127 | AC742: 147.12 | AD742: 44
A743: GOALKICKERS | W743: PRAHRAN | X743: 10 | Y743: 4 | Z743: 0 | AA743: 1575 | AB743: 1225 | AC743: 128.57142857142858 | AD743: 40
A744: OAKLEIGH | C744: DENNING 6 | F744: FRASER 5 | I744: FLEMING 2 | L744: HEINTZ | W744: PRESTON | X744: 10 | Y744: 5 | Z744: 0 | AA744: 1328 | AB744: 1091 | AC744: 121.72 | AD744: 40
A745: PRESTON | C745: ARTHUR 3 | F745: McSWAIN 3 | I745: McEACHERN 2 | L745: L ROBINSON 2 | O745: DOYLE | Q745: HARDING | W745: OAKLEIGH | X745: 9 | Y745: 5 | Z745: 0 | AA745: 1303 | AB745: 1195 | AC745: 109.03765690376569 | AD745: 36
A747: COBURG | C747: 2 | D747: 2 | E747: =C747*6+D747 -> 14 | G747: 5 | H747: 4 | I747: =G747*6+H747 -> 34 | K747: 9 | L747: 5 | M747: =K747*6+L747 -> 59 | O747: 11 | P747: 13 | Q747: =O747*6+P747 -> 79 | S747: COBURG | W747: COBURG | X747: 9 | Y747: 5 | Z747: 0 | AA747: 1210 | AB747: 1177 | AC747: 102.80373831775701 | AD747: 36
A748: NORTHCOTE | C748: 4 | D748: 3 | E748: =C748*6+D748 -> 27 | G748: 5 | H748: 4 | I748: =G748*6+H748 -> 34 | K748: 7 | L748: 5 | M748: =K748*6+L748 -> 47 | O748: 8 | P748: 8 | Q748: =O748*6+P748 -> 56 | S748: FRICKE | W748: SANDRINGHAM | X748: 7 | Y748: 6 | Z748: 1 | AA748: 1260 | AB748: 1256 | AC748: 100.31847133757962 | AD748: 30
A749: BEST PLAYERS | W749: CAMBERWELL | X749: 6 | Y749: 8 | Z749: 0 | AA749: 1168 | AB749: 1174 | AC749: 99.488926746166953 | AD749: 24
A750: COBURG | C750: DIXON | E750: RUDOLPH | H750: HARRIS | K750: HENNING | N750: UHE | Q750: BROOM | W750: YARRAVILLE | X750: 6 | Y750: 8 | Z750: 0 | AA750: 1218 | AB750: 1240 | AC750: 98.225806451612897 | AD750: 24
A751: NORTHCOTE | C751: GRAY | E751: ROSS | H751: ACKLAND | K751: HART | N751: WILLIAMSON | Q751: GOULLETT | W751: PORT MELBOURNE | X751: 6 | Y751: 8 | Z751: 0 | AA751: 1043 | AB751: 1171 | AC751: 89.069171648163959 | AD751: 24
A752: GOALKICKERS | W752: BRIGHTON | X752: 6 | Y752: 8 | Z752: 0 | AA752: 1163 | AB752: 1330 | AC752: 87.443609022556387 | AD752: 24
A753: COBURG | C753: HENNING 4 | F753: DUNCAN 2 | I753: McDONALD 2 | L753: HARRIS | N753: VOIGHT | Q753: DAYMAN | W753: BRUNSWICK | X753: 2 | Y753: 12 | Z753: 0 | AA753: 1103 | AB753: 1565 | AC753: 70.479233226837067 | AD753: 8
A754: NORTHCOTE | C754: SEYMOUR 4 | F754: ROSS 3 | I754: GRAY | W754: WILLIAMSTOWN | X754: 1 | Y754: 12 | Z754: 1 | AA754: 1078 | AB754: 1556 | AC754: 69.280205655526998 | AD754: 6
A756: SANDRINGHAM | C756: 4 | D756: 3 | E756: =C756*6+D756 -> 27 | G756: 6 | H756: 6 | I756: =G756*6+H756 -> 42 | K756: 6 | L756: 9 | M756: =K756*6+L756 -> 45 | O756: 9 | P756: 14 | Q756: =O756*6+P756 -> 68 | S756: BEACH ROAD
A757: CAMBERWELL | C757: 2 | D757: 3 | E757: =C757*6+D757 -> 15 | G757: 5 | H757: 5 | I757: =G757*6+H757 -> 35 | K757: 7 | L757: 9 | M757: =K757*6+L757 -> 51 | O757: 8 | P757: 10 | Q757: =O757*6+P757 -> 58 | S757: LESTER
A758: BEST PLAYERS
A759: SANDRINGHAM | C759: KEMP | F759: SMAIL | I759: WILSON | L759: DOWLING | O759: SCHLITZ | R759: BECKTON
A760: CAMBERWELL | C760: STANBRIDGE | F760: JONES | I760: R WILLIAMS | L760: GRIFFITH | O760: CAREY | R760: WARTMAN
A761: GOALKICKERS
A762: SANDRINGHAM | C762: DOWLING 4 | F762: BECKTON | I762: DENNINGTON | L762: McCOMB | O762: THOMS | Q762: JONES
A763: CAMBERWELL | C763: GRIFFITH 4 | F763: STANBRIDGE 2 | J763: TATHAM | M763: HERRICKS
A765: YARRAVILLE | C765: 3 | D765: 4 | E765: =C765*6+D765 -> 22 | G765: 4 | H765: 6 | I765: =G765*6+H765 -> 30 | K765: 9 | L765: 15 | M765: =K765*6+L765 -> 69 | O765: 13 | P765: 18 | Q765: =O765*6+P765 -> 96 | S765: YARRAVILLE
A766: PORT MELBOURNE | C766: 1 | D766: 3 | E766: =C766*6+D766 -> 9 | G766: 5 | H766: 5 | I766: =G766*6+H766 -> 35 | K766: 6 | L766: 5 | M766: =K766*6+L766 -> 41 | O766: 7 | P766: 8 | Q766: =O766*6+P766 -> 50 | S766: STUART
A767: BEST PLAYERS
A768: YARRAVILLE | C768: SHEEHAN | F768: W BUCKLEY | I768: WHITE | L768: WARDEN | O768: EVANS | Q768: WEDGWOOD
A769: PORT MELBOURNE | C769: PLUMRIDGE | F769: PERRETT | I769: LEGGO | L769: PAYNE | O769: AVERY | Q769: LANDORFF
A770: GOALKICKERS
A771: YARRAVILLE | C771: J BUCKLEY 3 | F771: FREW 3 | I771: RYAN 3 | L771: WARDEN 2 | O771: BRACKEN 2
A772: PORT MELBOURNE | C772: TUITE 2 | F772: FORREST 2 | I772: BEDFORD | L772: RUSDEN | O772: HURLEY
A774: BRIGHTON | C774: 2 | D774: 6 | E774: =C774*6+D774 -> 18 | G774: 7 | H774: 10 | I774: =G774*6+H774 -> 52 | K774: 11 | L774: 15 | M774: =K774*6+L774 -> 81 | O774: 13 | P774: 16 | Q774: =O774*6+P774 -> 94 | S774: ELSTERNWICK PARK
A775: WILLIAMSTOWN | C775: 0 | D775: 2 | E775: =C775*6+D775 -> 2 | G775: 3 | H775: 6 | I775: =G775*6+H775 -> 24 | K775: 6 | L775: 9 | M775: =K775*6+L775 -> 45 | O775: 11 | P775: 12 | Q775: =O775*6+P775 -> 78 | S775: MURRAY
A776: BEST PLAYERS
A777: BRIGHTON | C777: TUCKER | F777: LILBURNE | I777: DEANE | L777: DREW | O777: CANTWELL | R777: McLEOD
A778: WILLIAMSTOWN | C778: TAYLOR | F778: McGILLIVRAY | I778: McADAM | L778: JOHNS | O778: MARTIN | R778: BROOKS
A779: GOALKICKERS
A780: BRIGHTON | C780: TUCKER 5 | F780: DEAN 3 | I780: BURTON 2 | L780: CONNELL | O780: McLEOD | Q780: DREW
A781: WILLIAMSTOWN | C781: CAHILL 3 | F781: BLAKE 3 | I781: LAWLOR 3 | L781: JOHNS | O781: DREW
A783: PRAHRAN | C783: 6 | D783: 2 | E783: =C783*6+D783 -> 38 | G783: 13 | H783: 12 | I783: =G783*6+H783 -> 90 | K783: 19 | L783: 15 | M783: =K783*6+L783 -> 129 | O783: 24 | P783: 25 | Q783: =O783*6+P783 -> 169 | S783: TOORAK PARK
A784: BRUNSWICK | C784: 4 | D784: 0 | E784: =C784*6+D784 -> 24 | G784: 7 | H784: 0 | I784: =G784*6+H784 -> 42 | K784: 10 | L784: 6 | M784: =K784*6+L784 -> 66 | O784: 13 | P784: 9 | Q784: =O784*6+P784 -> 87 | S784: MOWLAN
A785: BEST PLAYERS
A786: PRAHRAN | C786: WHITE | E786: HAWKINS | H786: AVERY | K786: BYRNE | N786: WESCOTT | Q786: MUNN
A787: BRUNSWICK | C787: FRANKS | E787: PRISMAL | H787: HAYNES | K787: ANDERSON | N787: W THOMPSON | Q787: PALMER
A788: GOALKICKERS
A789: PRAHRAN | C789: HAWKINS 10 | F789: WHITE 5 | I789: BYRNE 4 | K789: MUNN 2 | M789: BRENCHLEY | P789: AVERY | R789: ANDERSON
A790: BRUNSWICK | C790: FRANKE 3 | F790: KENNEDY 2 | I790: DOWLING 2 | L790: JUSTICE 2 | N790: ELLAWAY | Q790: BOYD | R790: PALMER | U790: PRISMAL
A792: ROUND 15 | E792: 11TH AUGUST | J792: WEATHER | M792: CLOUDY BUT FINE S.W. WIND | S792: PLAYED AT
D793: 1ST QTR | H793: 2ND QTR | L793: 3RD QTR | P793: FINAL | S793: NORTHCOTE
A794: NORTHCOTE | C794: 3 | D794: 4 | E794: =C794*6+D794 -> 22 | G794: 6 | H794: 4 | I794: =G794*6+H794 -> 40 | K794: 7 | L794: 8 | M794: =K794*6+L794 -> 50 | O794: 10 | P794: 11 | Q794: =O794*6+P794 -> 71 | S794: UMPIRE | X794: LADDER | AB794: ROUND | AD794: 15
A795: OAKLEIGH | C795: 2 | D795: 2 | E795: =C795*6+D795 -> 14 | G795: 4 | H795: 5 | I795: =G795*6+H795 -> 29 | K795: 7 | L795: 8 | M795: =K795*6+L795 -> 50 | O795: 9 | P795: 10 | Q795: =O795*6+P795 -> 64 | S795: HASSETT
A796: BEST PLAYERS | W796: TEAM | X796: W | Y796: L | Z796: D | AA796: FOR | AB796: AGST | AC796: % | AD796: PTS
A797: NORTHCOTE | C797: ROSS | F797: ACKLAND | I797: MEITZKE | L797: LAWRENCE | O797: WILLIAMSON | R797: GARRETT
A798: OAKLEIGH | C798: McALLISTER | F798: WITHERS | I798: FLEMING | L798: KIDD | O798: POWELL | R798: FAHEY | W798: NORTHCOTE | X798: 12 | Y798: 3 | Z798: 0 | AA798: 1729 | AB798: 1191 | AC798: 145.17 | AD798: 48
A799: GOALKICKERS | W799: PRESTON | X799: 11 | Y799: 4 | Z799: 0 | AA799: 1422 | AB799: 1162 | AC799: 122.38 | AD799: 44
A800: NORTHCOTE | C800: SEYMOUR 5 | F800: ROSS 2 | I800: MEITZKE | L800: LAWRENCE | O800: HUNT | W800: PRAHRAN | X800: 10 | Y800: 5 | Z800: 0 | AA800: 1646 | AB800: 1319 | AC800: 124.79150871872631 | AD800: 40
A801: OAKLEIGH | C801: FLEMING 3 | F801: DENNING 2 | I801: FAHEY 2 | L801: WILTSHIRE | O801: HEINTZ | W801: COBURG | X801: 10 | Y801: 5 | Z801: 0 | AA801: 1298 | AB801: 1243 | AC801: 104.42477876106194 | AD801: 40
A803: PRESTON | C803: 4 | D803: 4 | E803: =C803*6+D803 -> 28 | G803: 5 | H803: 5 | I803: =G803*6+H803 -> 35 | K803: 11 | L803: 13 | M803: =K803*6+L803 -> 79 | O803: 13 | P803: 16 | Q803: =O803*6+P803 -> 94 | S803: PRESTON | W803: OAKLEIGH | X803: 9 | Y803: 6 | Z803: 0 | AA803: 1367 | AB803: 1266 | AC803: 107.97788309636651 | AD803: 36
A804: PRAHRAN | C804: 0 | D804: 0 | E804: =C804*6+D804 -> 0 | G804: 4 | H804: 10 | I804: =G804*6+H804 -> 34 | K804: 5 | L804: 11 | M804: =K804*6+L804 -> 41 | O804: 9 | P804: 17 | Q804: =O804*6+P804 -> 71 | S804: MURRAY | W804: SANDRINGHAM | X804: 7 | Y804: 7 | Z804: 1 | AA804: 1330 | AB804: 1353 | AC804: 98.300073909830004 | AD804: 30
A805: BEST PLAYERS | W805: CAMBERWELL | X805: 7 | Y805: 8 | Z805: 0 | AA805: 1247 | AB805: 1247 | AC805: 100 | AD805: 28
A806: PRESTON | C806: DINEEN | E806: BREWIS | H806: STREET | K806: SMITH | N806: DOWLING | Q806: CAMERON | W806: BRIGHTON | X806: 7 | Y806: 8 | Z806: 0 | AA806: 1279 | AB806: 1417 | AC806: 90.261115031757228 | AD806: 28
A807: PRAHRAN | C807: KOOP | E807: WHITE | H807: WELLS | K807: SMITH | N807: SHARPLEY | Q807: WILLIAMS | W807: YARRAVILLE | X807: 6 | Y807: 9 | Z807: 0 | AA807: 1291 | AB807: 1319 | AC807: 97.877179681576948 | AD807: 24
A808: GOALKICKERS | W808: PORT MELBOURNE | X808: 6 | Y808: 9 | Z808: 0 | AA808: 1130 | AB808: 1287 | AC808: 87.801087801087803 | AD808: 24
A809: PRESTON | C809: BROWN 4 | F809: ARTHUR 3 | I809: WARR 2 | L809: L ROBINSON 2 | O809: CAMERON 2 | W809: BRUNSWICK | X809: 3 | Y809: 12 | Z809: 0 | AA809: 1200 | AB809: 1635 | AC809: 73.394495412844037 | AD809: 12
A810: PRAHRAN | C810: WELLS 2 | E810: HAWKINS | G810: WHITE | I810: N WILLIAMS | L810: ANDERSON | O810: SHARPLEY | Q810: KOOP | S810: HAWKER | W810: WILLIAMSTOWN | X810: 1 | Y810: 13 | Z810: 1 | AA810: 1144 | AB810: 1644 | AC810: 69.586374695863753 | AD810: 6
A812: CAMBERWELL | C812: 2 | D812: 0 | E812: =C812*6+D812 -> 12 | G812: 6 | H812: 9 | I812: =G812*6+H812 -> 45 | K812: 7 | L812: 13 | M812: =K812*6+L812 -> 55 | O812: 10 | P812: 19 | Q812: =O812*6+P812 -> 79 | S812: CAMBERWELL
A813: YARRAVILLE | C813: 6 | D813: 6 | E813: =C813*6+D813 -> 42 | G813: 7 | H813: 6 | I813: =G813*6+H813 -> 48 | K813: 10 | L813: 10 | M813: =K813*6+L813 -> 70 | O813: 10 | P813: 13 | Q813: =O813*6+P813 -> 73 | S813: NOWLAN
A814: BEST PLAYERS
A815: CAMBERWELL | C815: CAREY | F815: HERRICKS | I815: TATHAM | L815: MASON | O815: WARTMAN | R815: R WILLIAMS
A816: YARRAVILLE | C816: W BUCKLEY | F816: SHEEHAN | I816: NEILL | L816: LAVENDER | O816: WEDGWOOD | R816: WARDEN
A817: GOALKICKERS
A818: CAMBERWELL | C818: HERRICKS 3 | F818: MASON 3 | I818: GRIFFITH 2 | L818: TATHAM | N818: WALKER
A819: YARRAVILLE | C819: SHEEHAN 3 | F819: WARDEN 2 | I819: WEDGWOOD 2 | L819: RYAN 2 | N819: J BUCKLEY
A821: BRIGHTON | C821: 4 | D821: 5 | E821: =C821*6+D821 -> 29 | G821: 8 | H821: 11 | I821: =G821*6+H821 -> 59 | K821: 13 | L821: 17 | M821: =K821*6+L821 -> 95 | O821: 16 | P821: 20 | Q821: =O821*6+P821 -> 116 | S821: PORT MELBOURNE
A822: PORT MELBOURNE | C822: 4 | D822: 7 | E822: =C822*6+D822 -> 31 | G822: 8 | H822: 12 | I822: =G822*6+H822 -> 60 | K822: 9 | L822: 13 | M822: =K822*6+L822 -> 67 | O822: 12 | P822: 15 | Q822: =O822*6+P822 -> 87 | S822: LESTER
A823: BEST PLAYERS
A824: BRIGHTON | C824: DEANE | E824: LILBURNE | H824: TUCKER | K824: CONNELL | N824: HUNT | Q824: BOLWELL
A825: PORT MELBOURNE | C825: LAHIFF | E825: PLUMRIDGE | H825: RUSDEN | K825: TUITE | N825: McNAMARA | Q825: JULIER
A826: GOALKICKERS
A827: BRIGHTON | C827: DEANE 5 | E827: CONNELL 2 | H827: DREW 2 | J827: BOLWELL 2 | M827: HILL | N827: TUCKER | P827: McLEOD | R827: BURNES | T827: CANTWELL
A828: PORT MELBOURNE | C828: BEDFORD 4 | F828: RUSDEN 4 | I828: McNAMARA 2 | L828: LAHIFF | N828: PARSONS
A830: BRUNSWICK | C830: 4 | D830: 3 | E830: =C830*6+D830 -> 27 | G830: 8 | H830: 5 | I830: =G830*6+H830 -> 53 | K830: 10 | L830: 7 | M830: =K830*6+L830 -> 67 | O830: 15 | P830: 7 | Q830: =O830*6+P830 -> 97 | S830: BRUNSWICK
A831: SANDRINGHAM | C831: 3 | D831: 6 | E831: =C831*6+D831 -> 24 | G831: 7 | H831: 8 | I831: =G831*6+H831 -> 50 | K831: 9 | L831: 8 | M831: =K831*6+L831 -> 62 | O831: 10 | P831: 10 | Q831: =O831*6+P831 -> 70 | S831: McMILLAN
A832: BEST PLAYERS
A833: BRUNSWICK | C833: JENKINS | F833: PRISMAL | I833: DOWLING | L833: BOYD | O833: ANDERSON | R833: MAYNES
A834: SANDRINGHAM | C834: W WILSON | F834: SCHARP | I834: SCHLITZ | L834: DENNINGTON | O834: LUNN | R834: MALLETT
A835: GOALKICKERS
A836: BRUNSWICK | C836: PALMER 3 | F836: GILLON 3 | I836: JUSTICE 2 | L836: BOYD 2 | N836: ANDERSON 2 | Q836: KENNEDY | T836: FRANKE | V836: THOMPSON
A837: SANDRINGHAM | C837: DENNINGTON 3 | F837: McCOMB 3 | I837: TOLSON | K837: CAMPBELL | N837: THOMS | P837: WILSON
A839: COBURG | C839: 3 | D839: 7 | E839: =C839*6+D839 -> 25 | G839: 5 | H839: 10 | I839: =G839*6+H839 -> 40 | K839: 11 | L839: 13 | M839: =K839*6+L839 -> 79 | O839: 12 | P839: 16 | Q839: =O839*6+P839 -> 88 | S839: WILLIAMSTOWN
A840: WILLIAMSTOWN | C840: 1 | D840: 0 | E840: =C840*6+D840 -> 6 | G840: 4 | H840: 3 | I840: =G840*6+H840 -> 27 | K840: 4 | L840: 4 | M840: =K840*6+L840 -> 28 | O840: 10 | P840: 6 | Q840: =O840*6+P840 -> 66 | S840: STUART
A841: BEST PLAYERS
A842: COBURG | C842: BROOM | E842: BOYD | H842: BERTRAM | K842: LOWE | N842: VOIGHT | Q842: DIXON
A843: WILLIAMSTOWN | C843: BROOKS | E843: CAHILL | H843: DELLER | K843: TAYLOR | N843: HYDE | Q843: McGILLIVRAY
A844: GOALKICKERS
A845: COBURG | C845: DUNCAN 6 | F845: HENNING 2 | I845: ANDERSON | L845: VOIGHT | O845: BROOM | Q845: DAYMAN
A846: WILLIAMSTOWN | C846: LAWLOR 3 | F846: CAHILL 2 | I846: PITTS 2 | L846: McGILLIVRAY | O846: JOHNS | Q846: LEWER
A848: ROUND 16 | E848: 18TH AUGUST | J848: WEATHER | M848: COLD CLOUDY N.W. WIND | S848: PLAYED AT
D849: 1ST QTR | H849: 2ND QTR | L849: 3RD QTR | P849: FINAL | S849: BEACH ROAD
A850: PRAHRAN | C850: 7 | D850: 2 | E850: =C850*6+D850 -> 44 | G850: 10 | H850: 4 | I850: =G850*6+H850 -> 64 | K850: 13 | L850: 6 | M850: =K850*6+L850 -> 84 | O850: 14 | P850: 7 | Q850: =O850*6+P850 -> 91 | S850: UMPIRE | X850: LADDER | AB850: ROUND | AD850: 16
A851: SANDRINGHAM | C851: 4 | D851: 5 | E851: =C851*6+D851 -> 29 | G851: 9 | H851: 8 | I851: =G851*6+H851 -> 62 | K851: 10 | L851: 8 | M851: =K851*6+L851 -> 68 | O851: 13 | P851: 10 | Q851: =O851*6+P851 -> 88 | S851: HASSETT
A852: BEST PLAYERS | W852: TEAM | X852: W | Y852: L | Z852: D | AA852: FOR | AB852: AGST | AC852: % | AD852: PTS
A853: PRAHRAN | C853: AVERY | E853: KOOP | H853: HAWKINS | K853: WHITE | N853: DIXON | Q853: SHARPLEY
A854: SANDRINGHAM | C854: THOMS | E854: WILSON | H854: JONES | K854: MALLETT | N854: NOSEEDA | Q854: MALLETT | W854: NORTHCOTE | X854: 13 | Y854: 3 | Z854: 0 | AA854: 1849 | AB854: 1303 | AC854: 141.9 | AD854: 52
A855: GOALKICKERS | W855: PRESTON | X855: 12 | Y855: 4 | Z855: 0 | AA855: 1512 | AB855: 1242 | AC855: 121.74 | AD855: 48
A856: PRAHRAN | C856: HAWKINS 5 | F856: WHITE 4 | I856: BRENCHLEY | L856: AVERY | N856: MUNN | P856: ANDERSON | R856: HAWKER | W856: PRAHRAN | X856: 11 | Y856: 5 | Z856: 0 | AA856: 1737 | AB856: 1407 | AC856: 123.45415778251599 | AD856: 44
A857: SANDRINGHAM | C857: MALLETT 3 | F857: DOWLING 2 | I857: BECKTON 2 | L857: DENNINGTON 2 | O857: WILSON 2 | Q857: CAMPBELL | T857: FRICKER | W857: COBURG | X857: 10 | Y857: 5 | Z857: 1 | AA857: 1402 | AB857: 1347 | AC857: 104.08314773570898 | AD857: 42
A859: PRESTON | C859: 4 | D859: 4 | E859: =C859*6+D859 -> 28 | G859: 7 | H859: 6 | I859: =G859*6+H859 -> 48 | K859: 11 | L859: 10 | M859: =K859*6+L859 -> 76 | O859: 13 | P859: 12 | Q859: =O859*6+P859 -> 90 | S859: CAMBERWELL | W859: OAKLEIGH | X859: 9 | Y859: 7 | Z859: 0 | AA859: 1436 | AB859: 1346 | AC859: 106.68647845468054 | AD859: 36
A860: CAMBERWELL | C860: 1 | D860: 1 | E860: =C860*6+D860 -> 7 | G860: 5 | H860: 6 | I860: =G860*6+H860 -> 36 | K860: 7 | L860: 8 | M860: =K860*6+L860 -> 50 | O860: 11 | P860: 14 | Q860: =O860*6+P860 -> 80 | S860: McMULLEN | W860: SANDRINGHAM | X860: 7 | Y860: 8 | Z860: 1 | AA860: 1418 | AB860: 1444 | AC860: 98.199445983379505 | AD860: 30
A861: BEST PLAYERS | W861: BRIGHTON | X861: 7 | Y861: 8 | Z861: 1 | AA861: 1383 | AB861: 1521 | AC861: 90.927021696252467 | AD861: 30
A862: PRESTON | C862: DINEEN | E862: SUMMERS | H862: DOYLE | K862: HEARN | N862: CRUICKSHANK | Q862: BOSCHEN | W862: CAMBERWELL | X862: 7 | Y862: 9 | Z862: 0 | AA862: 1327 | AB862: 1337 | AC862: 99.252056843679881 | AD862: 28
A863: CAMBERWELL | C863: MEEHAN | E863: CAREY | H863: TATHAM | K863: CLAMP | N863: FINLAYSON | Q863: JONES | W863: YARRAVILLE | X863: 7 | Y863: 9 | Z863: 0 | AA863: 1371 | AB863: 1388 | AC863: 98.775216138328531 | AD863: 28
A864: GOALKICKERS | Q864: FARRELL | W864: PORT MELBOURNE | X864: 6 | Y864: 10 | Z864: 0 | AA864: 1242 | AB864: 1407 | AC864: 88.272921108742011 | AD864: 24
A865: PRESTON | C865: BREWIS 3 | E865: CAMERON 2 | H865: SUMMERS 2 | J865: ARTHUR 2 | M865: BOSCHEN | O865: L ROBINSON | R865: BROWN | W865: BRUNSWICK | X865: 4 | Y865: 12 | Z865: 0 | AA865: 1318 | AB865: 1705 | AC865: 77.302052785923749 | AD865: 16
A866: CAMBERWELL | C866: GRIFFITH 3 | F866: LASKY 2 | I866: MEEHAN 2 | L866: BEAGLEY | N866: TATHAM | P866: CLAMP | R866: WALKER | W866: WILLIAMSTOWN | X866: 1 | Y866: 14 | Z866: 1 | AA866: 1214 | AB866: 1762 | AC866: 68.898978433598188 | AD866: 6
A868: BRIGHTON | C868: 6 | D868: 5 | E868: =C868*6+D868 -> 41 | G868: 8 | H868: 8 | I868: =G868*6+H868 -> 56 | K868: 12 | L868: 9 | M868: =K868*6+L868 -> 81 | O868: 15 | P868: 14 | Q868: =O868*6+P868 -> 104 | S868: ELSTERNWICK PARK
A869: COBURG | C869: 4 | D869: 1 | E869: =C869*6+D869 -> 25 | G869: 10 | H869: 3 | I869: =G869*6+H869 -> 63 | K869: 12 | L869: 6 | M869: =K869*6+L869 -> 78 | O869: 16 | P869: 8 | Q869: =O869*6+P869 -> 104 | S869: LESTER
A870: BEST PLAYERS
A871: BRIGHTON | C871: STEWART | F871: CONNELL | I871: HUNT | L871: DREW | O871: TUCKER | Q871: LILBURNE
A872: COBURG | C872: DAYMAN | F872: HENNING | I872: RUDOLPH | L872: DIXON | O872: KIGHT | Q872: BOYD
A873: GOALKICKERS
A874: BRIGHTON | C874: CONNELL 4 | F874: BURNES 3 | I874: DREW 2 | K874: BOLWELL 2 | N874: McLEOD | P874: DEAN | R874: HILL | T874: HUNT
A875: COBURG | C875: DUNCAN 4 | F875: DAYMAN 3 | I875: BOYD 2 | K875: McDONALD 2 | N875: ANDERSON | Q875: HARRIS | S875: BROWN | U875: VOIGHT | X875: HENNING
A877: BRUNSWICK | C877: 6 | D877: 6 | E877: =C877*6+D877 -> 42 | G877: 7 | H877: 10 | I877: =G877*6+H877 -> 52 | K877: 15 | L877: 12 | M877: =K877*6+L877 -> 102 | O877: 17 | P877: 16 | Q877: =O877*6+P877 -> 118 | S877: BRUNSWICK
A878: WILLIAMSTOWN | C878: 1 | D878: 2 | E878: =C878*6+D878 -> 8 | G878: 5 | H878: 7 | I878: =G878*6+H878 -> 37 | K878: 8 | L878: 10 | M878: =K878*6+L878 -> 58 | O878: 10 | P878: 10 | Q878: =O878*6+P878 -> 70 | S878: DAVENPORT
A879: BEST PLAYERS
A880: BRUNSWICK | C880: JENKINS | F880: DOWLING | I880: R THOMPSON | L880: A THOMPSON | O880: BLACKMORE | R880: PALMER
A881: WILLIAMSTOWN | C881: CAHILL | F881: BROOKS | I881: LAWLOR | L881: DELLER | O881: JOHNS | R881: McADAM
A882: GOALKICKERS
A883: BRUNSWICK | C883: JUSTICE 4 | F883: DOWLING 3 | I883: BOYD 3 | K883: PALMER 3 | N883: JENKINS | P883: FRANKE | R883: ELLAWAY | U883: GILLON
A884: WILLIAMSTOWN | C884: LAWLOR 5 | F884: McADAM 2 | I884: CAHILL | K884: WHITE | M884: MARTIN
A886: YARRAVILLE | C886: 5 | D886: 3 | E886: =C886*6+D886 -> 33 | G886: 8 | H886: 8 | I886: =G886*6+H886 -> 56 | K886: 9 | L886: 9 | M886: =K886*6+L886 -> 63 | O886: 11 | P886: 14 | Q886: =O886*6+P886 -> 80 | S886: YARRAVILLE
A887: OAKLEIGH | C887: 0 | D887: 3 | E887: =C887*6+D887 -> 3 | G887: 1 | H887: 4 | I887: =G887*6+H887 -> 10 | K887: 5 | L887: 11 | M887: =K887*6+L887 -> 41 | O887: 9 | P887: 15 | Q887: =O887*6+P887 -> 69 | S887: NOWLAN
A888: BEST PLAYERS
A889: YARRAVILLE | C889: J BUCKLEY | F889: W BUCKLEY | J889: WARDEN | M889: EVANS | P889: LAVENDER | S889: WEDGWOOD
A890: OAKLEIGH | C890: KIDD | F890: WITHERS | J890: YANN | M890: CRAMERI | P890: WATSON | S890: McALLISTER
A891: GOALKICKERS
A892: YARRAVILLE | C892: J BUCKLEY 5 | F892: SHEEHAN 2 | I892: WARDEN 2 | L892: WEDGWOOD 2
A893: OAKLEIGH | C893: CRAMERI 2 | F893: POWELL 2 | I893: MUDGE | K893: FLEMING | M893: YANN | O893: HEINTZ | Q893: FAHEY
A895: NORTHCOTE | C895: 7 | D895: 6 | E895: =C895*6+D895 -> 48 | G895: 9 | H895: 9 | I895: =G895*6+H895 -> 63 | K895: 14 | L895: 18 | M895: =K895*6+L895 -> 102 | O895: 16 | P895: 24 | Q895: =O895*6+P895 -> 120 | S895: PORT MELBOURNE
A896: PORT MELBOURNE | C896: 5 | D896: 1 | E896: =C896*6+D896 -> 31 | G896: 11 | H896: 7 | I896: =G896*6+H896 -> 73 | K896: 12 | L896: 8 | M896: =K896*6+L896 -> 80 | O896: 17 | P896: 10 | Q896: =O896*6+P896 -> 112 | S896: ROFE
A897: BEST PLAYERS
A898: NORTHCOTE | C898: HART | E898: ROSS | H898: GRAY | K898: WILLIAMSON | N898: LAWRENCE | Q898: FLINN
A899: PORT MELBOURNE | C899: HURLEY | E899: LAHIFF | H899: LEGGO | K899: PERRETT | N899: McNAMARA | Q899: RUSDEN
A900: GOALKICKERS
A901: NORTHCOTE | C901: SEYMOUR 9 | F901: ROSS 3 | I901: LAWRENCE 3 | L901: MEITZKE
A902: PORT MELBOURNE | C902: RUSDEN 3 | F902: LAHIFF 3 | I902: McNAMARA 3 | L902: HURLEY 3 | N902: BEDFORD | P902: MALTBY | R902: LEGGO | T902: AVERY | W902: DOBSON
A904: ROUND 17 | E904: 25TH AUGUST | J904: WEATHER | M904: FINE S.E. BREEZE | S904: PLAYED AT
D905: 1ST QTR | H905: 2ND QTR | L905: 3RD QTR | P905: FINAL | S905: OAKLEIGH
A906: OAKLEIGH | C906: 6 | D906: 6 | E906: =C906*6+D906 -> 42 | G906: 8 | H906: 9 | I906: =G906*6+H906 -> 57 | K906: 13 | L906: 11 | M906: =K906*6+L906 -> 89 | O906: 18 | P906: 16 | Q906: =O906*6+P906 -> 124 | S906: UMPIRE | X906: LADDER | AB906: ROUND | AD906: 17
A907: BRIGHTON | C907: 2 | D907: 1 | E907: =C907*6+D907 -> 13 | G907: 5 | H907: 3 | I907: =G907*6+H907 -> 33 | K907: 7 | L907: 4 | M907: =K907*6+L907 -> 46 | O907: 11 | P907: 6 | Q907: =O907*6+P907 -> 72 | S907: ROFE
A908: BEST PLAYERS | W908: TEAM | X908: W | Y908: L | Z908: D | AA908: FOR | AB908: AGST | AC908: % | AD908: PTS
A909: OAKLEIGH | C909: FLEMING | F909: J WILTSHIRE | I909: DENNING | K909: FAHEY | N909: KIDD | Q909: WITHERS
A910: BRIGHTON | C910: MILLER | F910: W O'BRIEN | I910: TOMLINS | K910: HARRISON | N910: CANTWELL | Q910: DEANE | W910: NORTHCOTE | X910: 14 | Y910: 3 | Z910: 0 | AA910: 1970 | AB910: 1353 | AC910: 145.6 | AD910: 56
A911: GOALKICKERS | W911: PRESTON | X911: 13 | Y911: 4 | Z911: 0 | AA911: 1663 | AB911: 1326 | AC911: 125.41 | AD911: 52
A912: OAKLEIGH | C912: DENNING 6 | F912: DEAN 4 | I912: HEINTZ 4 | L912: FAHEY 2 | N912: BELL | P912: FLEMING | W912: PRAHRAN | X912: 12 | Y912: 5 | Z912: 0 | AA912: 1872 | AB912: 1524 | AC912: 122.83464566929133 | AD912: 48
A913: BRIGHTON | C913: DEAN 3 | F913: BURNES 3 | I913: DREW 2 | L913: HILL | N913: BOLWELL | P913: MILLER | W913: COBURG | X913: 11 | Y913: 5 | Z913: 1 | AA913: 1513 | AB913: 1412 | AC913: 107.15297450424929 | AD913: 46
A915: NORTHCOTE | C915: 3 | D915: 3 | E915: =C915*6+D915 -> 21 | G915: 7 | H915: 7 | I915: =G915*6+H915 -> 49 | K915: 14 | L915: 13 | M915: =K915*6+L915 -> 97 | O915: 17 | P915: 18 | Q915: =O915*6+P915 -> 120 | S915: NORTHCOTE | W915: OAKLEIGH | X915: 10 | Y915: 7 | Z915: 0 | AA915: 1560 | AB915: 1418 | AC915: 110.01410437235543 | AD915: 40
A916: CAMBERWELL | C916: 3 | D916: 3 | E916: =C916*6+D916 -> 21 | G916: 4 | H916: 4 | I916: =G916*6+H916 -> 28 | K916: 7 | L916: 6 | M916: =K916*6+L916 -> 48 | O916: 7 | P916: 8 | Q916: =O916*6+P916 -> 50 | S916: MURRAY | W916: SANDRINGHAM | X916: 7 | Y916: 9 | Z916: 1 | AA916: 1492 | AB916: 1553 | AC916: 96.072118480360587 | AD916: 30
A917: BEST PLAYERS | W917: BRIGHTON | X917: 7 | Y917: 9 | Z917: 1 | AA917: 1455 | AB917: 1645 | AC917: 88.449848024316111 | AD917: 30
A918: NORTHCOTE | C918: ROSS | E918: ACKLAND | H918: SEYMOUR | K918: WOODS | N918: GARRETT | Q918: HART | W918: YARRAVILLE | X918: 7 | Y918: 10 | Z918: 0 | AA918: 1488 | AB918: 1523 | AC918: 97.701904136572551 | AD918: 28
A919: CAMBERWELL | C919: CLAMP | E919: TATHAM | H919: CAREY | K919: L WILLIAMS | N919: MEEHAN | Q919: FINLAYSON | W919: CAMBERWELL | X919: 7 | Y919: 10 | Z919: 0 | AA919: 1377 | AB919: 1458 | AC919: 94.444444444444443 | AD919: 28
A920: GOALKICKERS | W920: PORT MELBOURNE | X920: 6 | Y920: 11 | Z920: 0 | AA920: 1307 | AB920: 1518 | AC920: 86.100131752305671 | AD920: 24
A921: NORTHCOTE | C921: SEYMOUR 8 | F921: ROSS 4 | H921: GRAY 2 | J921: HONIG | L921: LUDLOW | N921: LAWRENCE | W921: BRUNSWICK | X921: 4 | Y921: 13 | Z921: 0 | AA921: 1402 | AB921: 1856 | AC921: 75.53879310344827 | AD921: 16
A922: CAMBERWELL | C922: HERRICKS 2 | F922: AUSTIN 2 | I922: WARTMAN | L922: GRIFFITH | N922: TOLRA | W922: WILLIAMSTOWN | X922: 2 | Y922: 14 | Z922: 1 | AA922: 1323 | AB922: 1836 | AC922: 72.058823529411768 | AD922: 10
A924: PRAHRAN | C924: 5 | D924: 9 | E924: =C924*6+D924 -> 39 | G924: 9 | H924: 11 | I924: =G924*6+H924 -> 65 | K924: 18 | L924: 14 | M924: =K924*6+L924 -> 122 | O924: 20 | P924: 15 | Q924: =O924*6+P924 -> 135 | S924: TOORAK PARK
A925: YARRAVILLE | C925: 4 | D925: 0 | E925: =C925*6+D925 -> 24 | G925: 9 | H925: 5 | I925: =G925*6+H925 -> 59 | K925: 11 | L925: 8 | M925: =K925*6+L925 -> 74 | O925: 17 | P925: 15 | Q925: =O925*6+P925 -> 117 | S925: FRICKE
A926: BEST PLAYERS
A927: PRAHRAN | C927: WHITE | E927: SMITH | H927: AVERY | K927: WILLIAMS | N927: HAWKINS | Q927: SHARPLEY
A928: YARRAVILLE | C928: PEARCE | E928: SHEEHAN | H928: EVANS | K928: J BUCKLEY | N928: WARDEN | Q928: RYAN
A929: GOALKICKERS
A930: PRAHRAN | C930: HAWKINS 7 | F930: BRENCHLEY 5 | I930: WHITE 4 | K930: MUNN 2 | M930: N WILLIAMS | P930: SHARPLEY
A931: YARRAVILLE | C931: J BUCKLEY 6 | F931: PEARCE 4 | I931: FREW 2 | K931: WARDEN 2 | N931: SHEEHAN | P931: KENNY | R931: HAY
A933: COBURG | C933: 9 | D933: 1 | E933: =C933*6+D933 -> 55 | G933: 10 | H933: 2 | I933: =G933*6+H933 -> 62 | K933: 14 | L933: 7 | M933: =K933*6+L933 -> 91 | O933: 17 | P933: 9 | Q933: =O933*6+P933 -> 111 | S933: COBURG
A934: PORT MELBOURNE | C934: 2 | D934: 0 | E934: =C934*6+D934 -> 12 | G934: 6 | H934: 5 | I934: =G934*6+H934 -> 41 | K934: 7 | L934: 6 | M934: =K934*6+L934 -> 48 | O934: 9 | P934: 11 | Q934: =O934*6+P934 -> 65 | S934: HASSETT
A935: BEST PLAYERS
A936: COBURG | C936: MEARS | E936: KENT | H936: BOYD | K936: MARSHALL | N936: HARRIS | Q936: KIGHT
A937: PORT MELBOURNE | C937: LAHIFF | E937: LEGGO | H937: BROOKER | K937: BEDFORD | N937: PLUMRIDGE | Q937: PERRETT
A938: GOALKICKERS
A939: COBURG | C939: DUNCAN 7 | F939: HARRIS 3 | I939: MEARS 2 | K939: ANDERSON | M939: BOYD | N939: DAYMAN | P939: RUDOLPH | R939: KENT
A940: PORT MELBOURNE | C940: RUSDEN 3 | F940: BEDFORD | I940: LAHIFF | K940: McNAMARA | N940: HURLEY | P940: AVERY | R940: EARL
A942: WILLIAMSTOWN | C942: 7 | D942: 3 | E942: =C942*6+D942 -> 45 | G942: 8 | H942: 6 | I942: =G942*6+H942 -> 54 | K942: 13 | L942: 9 | M942: =K942*6+L942 -> 87 | O942: 16 | P942: 13 | Q942: =O942*6+P942 -> 109 | S942: BEACH ROAD
A943: SANDRINGHAM | C943: 0 | D943: 5 | E943: =C943*6+D943 -> 5 | G943: 5 | H943: 13 | I943: =G943*6+H943 -> 43 | K943: 6 | L943: 15 | M943: =K943*6+L943 -> 51 | O943: 11 | P943: 18 | Q943: =O943*6+P943 -> 84 | S943: STUART
A944: BEST PLAYERS
A945: WILLIAMSTOWN | C945: CAHILL | E945: McCABE | H945: ROGASH | K945: DELLER | N945: BROOKS | Q945: McGILLIVRAY
A946: SANDRINGHAM | C946: THOMS | E946: WILSON | H946: PERRETT | K946: JONES | N946: TOLSON | Q946: LUNN
A947: GOALKICKERS
A948: WILLIAMSTOWN | C948: LAWLOR 7 | F948: CAHILL 4 | I948: BURKE | K948: JOHNS | M948: McADAM | O948: DREW | Q948: AIRD
A949: SANDRINGHAM | C949: DOWLING 2 | F949: DENNINGTON 2 | I949: McCOMB 2 | L949: CAMPBELL 2 | O949: TOLSON | Q949: PERRETT
A951: PRESTON | C951: 2 | D951: 2 | E951: =C951*6+D951 -> 14 | G951: 9 | H951: 6 | I951: =G951*6+H951 -> 60 | K951: 14 | L951: 9 | M951: =K951*6+L951 -> 93 | O951: 23 | P951: 13 | Q951: =O951*6+P951 -> 151 | S951: PRESTON
A952: BRUNSWICK | C952: 3 | D952: 6 | E952: =C952*6+D952 -> 24 | G952: 3 | H952: 7 | I952: =G952*6+H952 -> 25 | K952: 9 | L952: 11 | M952: =K952*6+L952 -> 65 | O952: 12 | P952: 12 | Q952: =O952*6+P952 -> 84 | S952: LESTER
A953: BEST PLAYERS
A954: PRESTON | C954: DINEEN | F954: BOSCHEN | I954: HARDING | L954: UNDERHILL | O954: BROWN | Q954: ARTHUR
A955: BRUNSWICK | C955: DOWLING | F955: A GILLON | I955: MAYNES | L955: A THOMPSON | O955: BOYD | Q955: REID
A956: GOALKICKERS
A957: PRESTON | C957: WARR 7 | E957: BROWN 4 | G957: CAMERON 3 | J957: W ROBINSON 3 | N957: ARTHUR 2 | Q957: McSWAIN 2 | T957: DOYLE | V957: FINNEGAN
A958: BRUNSWICK | C958: JUSTICE 3 | F958: KENNEDY 2 | I958: DOWLING 2 | L958: GILLON 2 | N958: JAMES 2 | P958: PALMER
A960: ROUND 18 | E960: 1ST SEPTEMBER | J960: WEATHER | M960: CLOUDY BUT FINE S.E. WIND | S960: PLAYED AT
D961: 1ST QTR | H961: 2ND QTR | L961: 3RD QTR | P961: FINAL | S961: ELSTERNWICK PARK
A962: PRAHRAN | C962: 2 | D962: 2 | E962: =C962*6+D962 -> 14 | G962: 8 | H962: 6 | I962: =G962*6+H962 -> 54 | K962: 10 | L962: 6 | M962: =K962*6+L962 -> 66 | O962: 13 | P962: 16 | Q962: =O962*6+P962 -> 94 | S962: UMPIRE | X962: LADDER | AB962: ROUND | AD962: 18
A963: BRIGHTON | C963: 0 | D963: 7 | E963: =C963*6+D963 -> 7 | G963: 0 | H963: 7 | I963: =G963*6+H963 -> 7 | K963: 4 | L963: 11 | M963: =K963*6+L963 -> 35 | O963: 5 | P963: 14 | Q963: =O963*6+P963 -> 44 | S963: SCATES
A964: BEST PLAYERS | W964: TEAM | X964: W | Y964: L | Z964: D | AA964: FOR | AB964: AGST | AC964: % | AD964: PTS
A965: PRAHRAN | C965: HAWKINS | F965: MUNN | I965: HAWKER | L965: WELLS | N965: SHARPLEY | Q965: WHITE
A966: BRIGHTON | C966: GOULDSWORTHY | F966: HARRISON | I966: BURNES | L966: TOMLINS | N966: LILBURNE | Q966: HUNT | W966: NORTHCOTE | X966: 14 | Y966: 4 | Z966: 0 | AA966: 2075 | AB966: 1464 | AC966: 141.73 | AD966: 56
A967: GOALKICKERS | W967: PRESTON | X967: 14 | Y967: 4 | Z967: 0 | AA967: 1750 | AB967: 1378 | AC967: 127 | AD967: 56
A968: PRAHRAN | C968: HAWKINS 10 | F968: BRENCHLEY | I968: WHITE | L968: SHARPLEY | W968: PRAHRAN | X968: 13 | Y968: 5 | Z968: 0 | AA968: 1966 | AB968: 1568 | AC968: 125.38265306122449 | AD968: 52
A969: BRIGHTON | C969: DEAN | E969: LILBURNE | H969: HILL | J969: DREW | L969: BURNES | W969: COBURG | X969: 11 | Y969: 6 | Z969: 1 | AA969: 1564 | AB969: 1522 | AC969: 102.75952693823916 | AD969: 46
A971: YARRAVILLE | C971: 2 | D971: 3 | E971: =C971*6+D971 -> 15 | G971: 12 | H971: 11 | I971: =G971*6+H971 -> 83 | K971: 12 | L971: 14 | M971: =K971*6+L971 -> 86 | O971: 22 | P971: 22 | Q971: =O971*6+P971 -> 154 | S971: YARRAVILLE | W971: OAKLEIGH | X971: 11 | Y971: 7 | Z971: 0 | AA971: 1659 | AB971: 1498 | AC971: 110.74766355140187 | AD971: 44
A972: SANDRINGHAM | C972: 4 | D972: 5 | E972: =C972*6+D972 -> 29 | G972: 4 | H972: 5 | I972: =G972*6+H972 -> 29 | K972: 8 | L972: 8 | M972: =K972*6+L972 -> 56 | O972: 10 | P972: 8 | Q972: =O972*6+P972 -> 68 | S972: FRICKE | W972: YARRAVILLE | X972: 8 | Y972: 10 | Z972: 0 | AA972: 1642 | AB972: 1591 | AC972: 103.20553111250786 | AD972: 32
A973: BEST PLAYERS | W973: CAMBERWELL | X973: 8 | Y973: 10 | Z973: 0 | AA973: 1487 | AB973: 1509 | AC973: 98.54208084824387 | AD973: 32
A974: YARRAVILLE | C974: FREW | E974: WARDEN | H974: R EVANS | K974: BRACKEN | N974: RYAN | Q974: J BUCKLEY | W974: SANDRINGHAM | X974: 7 | Y974: 10 | Z974: 1 | AA974: 1560 | AB974: 1707 | AC974: 91.388400702987695 | AD974: 30
A975: SANDRINGHAM | C975: SMAIL | E975: W WILSON | H975: MILLER | K975: LUNN | N975: SANDERS | Q975: MALLETT | W975: BRIGHTON | X975: 7 | Y975: 10 | Z975: 1 | AA975: 1499 | AB975: 1739 | AC975: 86.198964922369171 | AD975: 30
A976: GOALKICKERS | I976: BRACKEN | K976: KENNY | M976: RYAN | O976: G EVANS | Q976: BROPHY | S976: PENNY | W976: PORT MELBOURNE | X976: 6 | Y976: 12 | Z976: 0 | AA976: 1387 | AB976: 1617 | AC976: 85.776128633271497 | AD976: 24
A977: YARRAVILLE | C977: WARDEN 5 | F977: J BUCKLEY 4 | I977: HAY 2 | K977: SHEEHAN | M977: WHITE | O977: FREW | Q977: WUNHYM | S977: W BUCKLEY | W977: BRUNSWICK | X977: 5 | Y977: 13 | Z977: 0 | AA977: 1513 | AB977: 1961 | AC977: 77.154513003569605 | AD977: 20
A978: SANDRINGHAM | C978: PERRETT 2 | F978: NEAVAN | H978: BECKTON | J978: McCOMB | L978: SMAIL | N978: WILSON | P978: JONES | R978: FRICKER | U978: LUNN | W978: WILLIAMSTOWN | X978: 2 | Y978: 15 | Z978: 1 | AA978: 1375 | AB978: 1923 | AC978: 71.502860114404569 | AD978: 10
A980: CAMBERWELL | C980: 2 | D980: 4 | E980: =C980*6+D980 -> 16 | G980: 8 | H980: 13 | I980: =G980*6+H980 -> 61 | K980: 12 | L980: 14 | M980: =K980*6+L980 -> 86 | O980: 15 | P980: 20 | Q980: =O980*6+P980 -> 110 | S980: CAMBERWELL
A981: COBURG | C981: 2 | D981: 1 | E981: =C981*6+D981 -> 13 | G981: 3 | H981: 2 | I981: =G981*6+H981 -> 20 | K981: 5 | L981: 6 | M981: =K981*6+L981 -> 36 | O981: 7 | P981: 9 | Q981: =O981*6+P981 -> 51 | S981: LESTER
A982: BEST PLAYERS
A983: CAMBERWELL | C983: TATHAM | E983: WALKER | H983: CLAMP | K983: BEAGLEY | N983: R WILLIAMS | Q983: WARTMAN
A984: COBURG | C984: BOYD | E984: HENNING | H984: MOSS | K984: BROOM | N984: ANDERSON | Q984: DIXON
A985: GOALKICKERS
A986: CAMBERWELL | C986: GRIFFITH 4 | F986: BEAGLEY 2 | I986: MASON 2 | K986: WALKER 2 | N986: WILLIAMS | Q986: TATHAM | S986: AUSTIN | U986: STANBRIDGE
A987: COBURG | C987: DUNCAN 6 | F987: HENNING
A989: OAKLEIGH | C989: 5 | D989: 5 | E989: =C989*6+D989 -> 35 | G989: 7 | H989: 6 | I989: =G989*6+H989 -> 48 | K989: 13 | L989: 8 | M989: =K989*6+L989 -> 86 | O989: 15 | P989: 9 | Q989: =O989*6+P989 -> 99 | S989: PORT MELBOURNE
A990: PORT MELBOURNE | C990: 2 | D990: 2 | E990: =C990*6+D990 -> 14 | G990: 7 | H990: 8 | I990: =G990*6+H990 -> 50 | K990: 9 | L990: 9 | M990: =K990*6+L990 -> 63 | O990: 11 | P990: 14 | Q990: =O990*6+P990 -> 80 | S990: ROFE
A991: BEST PLAYERS
A992: OAKLEIGH | C992: CRAMERI | F992: FAHEY | I992: HUTCHESON | L992: WITHERS | O992: HEINTZ | R992: KIDD
A993: PORT MELBOURNE | C993: BROOKER | F993: McNAMARA | I993: LAHIFF | L993: LEGGO | O993: FORREST | R993: PERRETT
A994: GOALKICKERS
A995: OAKLEIGH | C995: DENNING 8 | F995: BELL 2 | H995: CRAMERI | J995: WITHERS | M995: FLEMING | O995: HEINTZ | Q995: MILBURNE
A996: PORT MELBOURNE | C996: BEDFORD 3 | F996: RUSDEN 3 | I996: LAHIFF 2 | K996: EARL 2 | M996: PARSONS
A998: BRUNSWICK | C998: 3 | D998: 7 | E998: =C998*6+D998 -> 25 | G998: 5 | H998: 10 | I998: =G998*6+H998 -> 40 | K998: 9 | L998: 14 | M998: =K998*6+L998 -> 68 | O998: 16 | P998: 15 | Q998: =O998*6+P998 -> 111 | S998: BRUNSWICK
A999: NORTHCOTE | C999: 4 | D999: 0 | E999: =C999*6+D999 -> 24 | G999: 8 | H999: 1 | I999: =G999*6+H999 -> 49 | K999: 15 | L999: 1 | M999: =K999*6+L999 -> 91 | O999: 17 | P999: 3 | Q999: =O999*6+P999 -> 105 | S999: NOWLAN
A1000: BEST PLAYERS
A1001: BRUNSWICK | C1001: JENKINS | E1001: PALMER | H1001: THOMPSON | K1001: MAYNES | N1001: DOWLING | Q1001: JAMES
A1002: NORTHCOTE | C1002: ROSS | E1002: HART | H1002: ACKLAND | K1002: LAWRENCE | N1002: SEYMOUR | Q1002: GARRETT
A1003: GOALKICKERS
A1004: BRUNSWICK | C1004: JAMES 5 | E1004: JUSTICE 4 | H1004: PALMER 3 | K1004: DOWLING 2 | N1004: BOYD | P1004: SHELDON
A1005: NORTHCOTE | C1005: SEYMOUR 12 | F1005: ROSS 3 | H1005: GRAY 2
A1007: PRESTON | C1007: 4 | D1007: 5 | E1007: =C1007*6+D1007 -> 29 | G1007: 7 | H1007: 6 | I1007: =G1007*6+H1007 -> 48 | K1007: 10 | L1007: 8 | M1007: =K1007*6+L1007 -> 68 | O1007: 13 | P1007: 9 | Q1007: =O1007*6+P1007 -> 87 | S1007: WILLIAMSTOWN
A1008: WILLIAMSTOWN | C1008: 0 | D1008: 0 | E1008: =C1008*6+D1008 -> 0 | G1008: 3 | H1008: 3 | I1008: =G1008*6+H1008 -> 21 | K1008: 5 | L1008: 4 | M1008: =K1008*6+L1008 -> 34 | O1008: 8 | P1008: 4 | Q1008: =O1008*6+P1008 -> 52 | S1008: HASSETT
A1009: BEST PLAYERS
A1010: PRESTON | C1010: UNDERHILL | F1010: BOSCHEN | I1010: BROWN | L1010: SMITH | O1010: WARR | Q1010: FARRELL
A1011: WILLIAMSTOWN | C1011: McGILLIVRAY | F1011: DELLER | I1011: FISHER | L1011: BROOKS | O1011: CAHILL | Q1011: DREW
A1012: GOALKICKERS
A1013: PRESTON | C1013: ARTHUR 4 | F1013: McSWAIN 3 | I1013: WARR 2 | K1013: BOSCHEN | M1013: UNDERHILL | P1013: BROWN | R1013: FARRELL
A1014: WILLIAMSTOWN | C1014: PITTS 3 | E1014: CAHILL | G1014: McCABE | I1014: BURKE | K1014: WHITE | M1014: HOSE
A1016: FINALS
A1017: 1ST SEMI | E1017: 8TH SEPTEMBER | J1017: WEATHER | M1017: FINE COOL SOUTH WIND
D1018: 1ST QTR | H1018: 2ND QTR | L1018: 3RD QTR | P1018: FINAL
A1019: COBURG | C1019: 2 | D1019: 5 | E1019: =C1019*6+D1019 -> 17 | G1019: 5 | H1019: 8 | I1019: =G1019*6+H1019 -> 38 | K1019: 11 | L1019: 10 | M1019: =K1019*6+L1019 -> 76 | O1019: 14 | P1019: 11 | Q1019: =O1019*6+P1019 -> 95 | S1019: OLYMPIC PK
A1020: PRAHRAN | C1020: 6 | D1020: 2 | E1020: =C1020*6+D1020 -> 38 | G1020: 9 | H1020: 4 | I1020: =G1020*6+H1020 -> 58 | K1020: 12 | L1020: 5 | M1020: =K1020*6+L1020 -> 77 | O1020: 14 | P1020: 7 | Q1020: =O1020*6+P1020 -> 91 | S1020: HASSETT
A1021: BEST PLAYERS
A1022: COBURG | C1022: MARTYN | F1022: BOYD | I1022: HENNING | L1022: BERTRAM | O1022: DUNCAN | R1022: UHE
A1023: PRAHRAN | C1023: WHITE | F1023: SHARPLEY | I1023: AVERY | L1023: MUNN | O1023: WESCOTT | R1023: TABATEAU
A1024: GOALKICKERS
A1025: COBURG | C1025: DUNCAN 7 | F1025: HENNING 3 | I1025: VOIGHT 2 | L1025: ANDERSON | O1025: DAYMAN
A1026: PRAHRAN | C1026: HAWKINS 6 | F1026: MUNN 3 | I1026: ANDERSON 2 | L1026: AVERY | N1026: BYRNE | P1026: WILLISON
A1028: 2ND SEMI | E1028: 15TH SEPTEMBER | J1028: WEATHER | M1028: RAIN NORTH WIND TURNING WEST
A1029: NORTHCOTE | C1029: 4 | D1029: 2 | E1029: =C1029*6+D1029 -> 26 | G1029: 10 | H1029: 4 | I1029: =G1029*6+H1029 -> 64 | K1029: 13 | L1029: 10 | M1029: =K1029*6+L1029 -> 88 | O1029: 15 | P1029: 13 | Q1029: =O1029*6+P1029 -> 103 | S1029: OLYMPIC PK
A1030: PRESTON | C1030: 1 | D1030: 1 | E1030: =C1030*6+D1030 -> 7 | G1030: 1 | H1030: 7 | I1030: =G1030*6+H1030 -> 13 | K1030: 3 | L1030: 9 | M1030: =K1030*6+L1030 -> 27 | O1030: 5 | P1030: 12 | Q1030: =O1030*6+P1030 -> 42 | S1030: HASSETT
A1031: BEST PLAYERS
A1032: NORTHCOTE | C1032: ROSS | E1032: GRAY | H1032: BATES | K1032: GOULLETT | N1032: WOODS | Q1032: POWELL
A1033: PRESTON | C1033: DINEEN | E1033: BOSCHEN | H1033: DOWLING | K1033: STREET | N1033: HUGO | Q1033: WARR
A1034: GOALKICKERS
A1035: NORTHCOTE | C1035: ROSS 5 | E1035: GRAY 3 | G1035: SEYMOUR 2 | J1035: GOULLET 2 | M1035: MEITZKE | O1035: ROGERS | Q1035: LAWRENCE
A1036: PRESTON | C1036: ARTHUR 2 | F1036: McEACHERN | I1036: FINNEGAN | L1036: CANNAWAY
A1038: PRELIMINARY FINAL | F1038: 29TH SEPTEMBER | J1038: WEATHER | M1038: EARLY RAIN CLEARING S.W. WIND
A1039: COBURG | C1039: 1 | D1039: 4 | E1039: =C1039*6+D1039 -> 10 | G1039: 5 | H1039: 8 | I1039: =G1039*6+H1039 -> 38 | K1039: 8 | L1039: 10 | M1039: =K1039*6+L1039 -> 58 | O1039: 8 | P1039: 14 | Q1039: =O1039*6+P1039 -> 62 | S1039: OLYMPIC PK
A1040: PRESTON | C1040: 3 | D1040: 2 | E1040: =C1040*6+D1040 -> 20 | G1040: 4 | H1040: 4 | I1040: =G1040*6+H1040 -> 28 | K1040: 5 | L1040: 4 | M1040: =K1040*6+L1040 -> 34 | O1040: 9 | P1040: 4 | Q1040: =O1040*6+P1040 -> 58 | S1040: HASSETT
A1041: BEST PLAYERS
A1042: COBURG | C1042: MARTYN | F1042: RUDOLPH | I1042: DUNCAN | L1042: KIGHT | O1042: BROWN | Q1042: DIXON
A1043: PRESTON | C1043: BOSCHEN | F1043: SMITH | I1043: DINEEN | L1043: DOWLING | O1043: SPARGO | Q1043: WARR
A1044: GOALKICKERS
A1045: COBURG | C1045: DUNCAN 5 | F1045: HENNING 3
A1046: PRESTON | C1046: BROWN 2 | F1046: HUGO 2 | I1046: WARR | K1046: BOSCHEN | M1046: ARTHUR | O1046: DOWLING | Q1046: FINNEGAN
A1048: GRAND FINAL | E1048: 6TH OCTOBER | I1048: POSTPONED 29TH SEPTEMBER | O1048: WEATHER | R1048: RAIN
A1049: NORTHCOTE | C1049: 4 | D1049: 5 | E1049: =C1049*6+D1049 -> 29 | G1049: 10 | H1049: 10 | I1049: =G1049*6+H1049 -> 70 | K1049: 17 | L1049: 13 | M1049: =K1049*6+L1049 -> 115 | O1049: 19 | P1049: 16 | Q1049: =O1049*6+P1049 -> 130 | S1049: SHOWGROUNDS
A1050: COBURG | C1050: 1 | D1050: 1 | E1050: =C1050*6+D1050 -> 7 | G1050: 4 | H1050: 2 | I1050: =G1050*6+H1050 -> 26 | K1050: 4 | L1050: 8 | M1050: =K1050*6+L1050 -> 32 | O1050: 10 | P1050: 9 | Q1050: =O1050*6+P1050 -> 69 | S1050: HASSETT
A1051: BEST PLAYERS
A1052: NORTHCOTE | C1052: ROSS | E1052: GRAY | H1052: SEYMOUR | K1052: HASKETT | N1052: LUDLOW | Q1052: GOULLETT
A1053: COBURG | C1053: MOSS | E1053: MARTYN | H1053: KIGHT | K1053: ANDERSON | N1053: DUNCAN | Q1053: HARRIS
A1054: GOALKICKERS
A1055: NORTHCOTE | C1055: SEYMOUR 6 | F1055: GRAY 3 | H1055: GOULLET 3 | K1055: LUDLOW 3 | N1055: CLARKE | P1055: ROSS | Q1055: ACKLAND | T1055: BYRNE
A1056: COBURG | C1056: DUNCAN 8 | F1056: NASH | H1056: BROWN
A1058: TEAMS
G1059: NORTHCOTE | R1059: COBURG
A1060: BACKS | C1060: LYNGCOLN | G1060: HASKETT | K1060: ACKLAND | O1060: KNOTT | R1060: DIXON | U1060: BERTRAM
A1061: H-BACKS | C1061: POWELL | G1061: G BATES | K1061: J WOODS | O1061: UHE | R1061: LOWE | U1061: KENT
A1062: CENTRES | C1062: LAWRENCE | G1062: E HART | K1062: GARRETT | O1062: KIGHT | R1062: A MARTYN | U1062: MARSHALL
A1063: H-FORWARDS | C1063: CLARKE | G1063: WILLIAMSON | K1063: LUDLOW | O1063: HARRIS | R1063: ANDERSON | U1063: MOSS
A1064: FORWARDS | C1064: HONIG | G1064: SEYMOUR | K1064: GRAY | O1064: NASH | R1064: DUNCAN | U1064: VOIGHT
A1065: RUCKS | C1065: GOULLET | G1065: BYRNE | K1065: ROSS | O1065: DAYMAN | R1065: BROWN | U1065: BOYD
A1066: RES | C1066: SIMMONDS | O1066: HOSIE