A1: Victorian Football Association
A2: Season 1935
A3: © Copyright Wal Williams | F3: First created: 2 November 2014
A4: Contact: joywalwi at gmail dot com | F4: Last updated: 27 January 2018 | W4: VFA Results and tables - Link to the main index page
A5: You are free to copy this document in whole or part provided that proper acknowledgement is given to the author. All rights reserved.
A7: YEAR 1935
A8: ROUND 1 | E8: 20TH APRIL | J8: WEATHER | M8: RAIN GROUNDS BAD | S8: PLAYED AT
D9: 1ST QTR | H9: 2ND QTR | L9: 3RD QTR | P9: FINAL | S9: PORT MELBOURNE
A10: PORT MELBOURNE | C10: 2 | D10: 1 | E10: =C10*6+D10 -> 13 | G10: 3 | H10: 3 | I10: =G10*6+H10 -> 21 | K10: 6 | L10: 5 | M10: =K10*6+L10 -> 41 | O10: 7 | P10: 7 | Q10: =O10*6+P10 -> 49 | S10: UMPIRE | X10: LADDER | AB10: ROUND | AD10: 1
A11: PRAHRAN | C11: 0 | D11: 3 | E11: =C11*6+D11 -> 3 | G11: 1 | H11: 7 | I11: =G11*6+H11 -> 13 | K11: 2 | L11: 8 | M11: =K11*6+L11 -> 20 | O11: 6 | P11: 9 | Q11: =O11*6+P11 -> 45 | S11: SCATES
A12: BEST PLAYERS | W12: TEAM | X12: W | Y12: L | Z12: D | AA12: FOR | AB12: AGST | AC12: % | AD12: PTS
A13: PORT MELBOURNE | C13: RUSDEN | F13: GARBUTT | I13: LAHIFF | L13: MALTBY | N13: BROOKER | Q13: BEDFORD
A14: PRAHRAN | C14: WESCOTT | F14: TABATEAU | I14: BRENCHLEY | L14: WHITE | N14: WILTSHIRE | Q14: SMITH | W14: YARRAVILLE | X14: 1 | Y14: 0 | Z14: 0 | AA14: 128 | AB14: 33 | AC14: 387.87878787878788 | AD14: 4
A15: GOALKICKERS | W15: NORTHCOTE | X15: 1 | Y15: 0 | Z15: 0 | AA15: 78 | AB15: 34 | AC15: 229.41176470588235 | AD15: 4
A16: PORT MELBOURNE | C16: RUSDEN 4 | F16: BEDFORD 2 | I16: MALTBY | W16: OAKLEIGH | X16: 1 | Y16: 0 | Z16: 0 | AA16: 76 | AB16: 54 | AC16: 140.74074074074073 | AD16: 4
A17: PRAHRAN | C17: WHITE 3 | F17: GRANDISON | I17: KLYNE | L17: KOOP | W17: SANDRINGHAM | X17: 1 | Y17: 0 | Z17: 0 | AA17: 75 | AB17: 68 | AC17: 110.29411764705883 | AD17: 4
A19: NORTHCOTE | C19: 3 | D19: 0 | E19: =C19*6+D19 -> 18 | G19: 5 | H19: 1 | I19: =G19*6+H19 -> 31 | K19: 5 | L19: 3 | M19: =K19*6+L19 -> 33 | O19: 12 | P19: 6 | Q19: =O19*6+P19 -> 78 | S19: NORTHCOTE | W19: PORT MELBOURNE | X19: 1 | Y19: 0 | Z19: 0 | AA19: 49 | AB19: 45 | AC19: 108.88888888888889 | AD19: 4
A20: PRESTON | C20: 1 | D20: 2 | E20: =C20*6+D20 -> 8 | G20: 5 | H20: 2 | I20: =G20*6+H20 -> 32 | K20: 5 | L20: 3 | M20: =K20*6+L20 -> 33 | O20: 5 | P20: 4 | Q20: =O20*6+P20 -> 34 | S20: FRICKE | W20: COBURG | X20: 1 | Y20: 0 | Z20: 0 | AA20: 46 | AB20: 43 | AC20: 106.97674418604652 | AD20: 4
A21: BEST PLAYERS | W21: BRUNSWICK | X21: 0 | Y21: 1 | Z21: 0 | AA21: 43 | AB21: 46 | AC21: 93.478260869565219 | AD21: 0
A22: NORTHCOTE | C22: POWELL | F22: MEITZCKE | I22: LAWRENCE | L22: BATES | N22: ROSS | Q22: WOODS | W22: PRAHRAN | X22: 0 | Y22: 1 | Z22: 0 | AA22: 45 | AB22: 49 | AC22: 91.836734693877546 | AD22: 0
A23: PRESTON | C23: MUIR | F23: COOPER | I23: BOSCHEN | L23: SMITH | N23: WARR | Q23: CRUICKSHANK | W23: BRIGHTON | X23: 0 | Y23: 1 | Z23: 0 | AA23: 68 | AB23: 75 | AC23: 90.666666666666671 | AD23: 0
A24: GOALKICKERS | W24: CAMBERWELL | X24: 0 | Y24: 1 | Z24: 0 | AA24: 54 | AB24: 76 | AC24: 71.05263157894737 | AD24: 0
A25: NORTHCOTE | C25: SIMMONDS 4 | F25: MEITZCKE 3 | I25: ACKLAND 3 | L25: GARRETT | O25: GRAY | W25: PRESTON | X25: 0 | Y25: 1 | Z25: 0 | AA25: 34 | AB25: 78 | AC25: 43.589743589743591 | AD25: 0
A26: PRESTON | C26: WARR 2 | F26: CAMERON | I26: HUGHSON | L26: COOPER | W26: WILLIAMSTOWN | X26: 0 | Y26: 1 | Z26: 0 | AA26: 33 | AB26: 128 | AC26: 25.78125 | AD26: 0
A28: SANDRINGHAM | C28: 7 | D28: 9 | E28: =C28*6+D28 -> 51 | G28: 8 | H28: 11 | I28: =G28*6+H28 -> 59 | K28: 9 | L28: 19 | M28: =K28*6+L28 -> 73 | O28: 9 | P28: 21 | Q28: =O28*6+P28 -> 75 | S28: BEACH ROAD
A29: BRIGHTON | C29: 0 | D29: 2 | E29: =C29*6+D29 -> 2 | G29: 3 | H29: 11 | I29: =G29*6+H29 -> 29 | K29: 6 | L29: 11 | M29: =K29*6+L29 -> 47 | O29: 9 | P29: 14 | Q29: =O29*6+P29 -> 68 | S29: GODFREY
A30: BEST PLAYERS
A31: SANDRINGHAM | C31: MILLER | F31: SMAIL | I31: WILSON | L31: THOMS | O31: A CHRISTIE | R31: MITCHELL
A32: BRIGHTON | C32: DREW | F32: BOLWELL | I32: DEANE | L32: CANTWELL | O32: McLEOD | R32: BOURNE
A33: GOALKICKERS
A34: SANDRINGHAM | C34: SMAIL 3 | F34: MITCHELL 2 | I34: MILLER | K34: WILSON | M34: ROBERTS | O34: A CHRISTIE
A35: BRIGHTON | C35: DEANE 3 | F35: SULLIVAN 2 | I35: McLEOD | K35: CONNELL | M35: BOURNE | O35: CANTWELL
A37: COBURG | C37: 3 | D37: 4 | E37: =C37*6+D37 -> 22 | G37: 4 | H37: 4 | I37: =G37*6+H37 -> 28 | K37: 6 | L37: 9 | M37: =K37*6+L37 -> 45 | O37: 6 | P37: 10 | Q37: =O37*6+P37 -> 46 | S37: COBURG
A38: BRUNSWICK | C38: 0 | D38: 1 | E38: =C38*6+D38 -> 1 | G38: 2 | H38: 9 | I38: =G38*6+H38 -> 21 | K38: 3 | L38: 9 | M38: =K38*6+L38 -> 27 | O38: 5 | P38: 13 | Q38: =O38*6+P38 -> 43 | S38: HASSETT
A39: BEST PLAYERS
A40: COBURG | C40: McFARLANE | F40: KIGHT | I40: LE FANNUE | L40: HARRIS | O40: HOSIE | Q40: VOIGHT
A41: BRUNSWICK | C41: JENKINS | F41: DOWLING | I41: BOYD | L41: MAYNES | O41: FAY | Q41: LEE
A42: GOALKICKERS
A43: COBURG | C43: NASH 2 | F43: DUNCAN 2 | I43: McKAY | K43: VOIGHT
A44: BRUNSWICK | C44: JONES 2 | F44: BOYD | H44: GILLON | J44: DOWLING
A46: YARRAVILLE | C46: 5 | D46: 15 | E46: =C46*6+D46 -> 45 | G46: 7 | H46: 16 | I46: =G46*6+H46 -> 58 | K46: 16 | L46: 23 | M46: =K46*6+L46 -> 119 | O46: 17 | P46: 26 | Q46: =O46*6+P46 -> 128 | S46: YARRAVILLE
A47: WILLIAMSTOWN | C47: 1 | D47: 1 | E47: =C47*6+D47 -> 7 | G47: 2 | H47: 4 | I47: =G47*6+H47 -> 16 | K47: 2 | L47: 6 | M47: =K47*6+L47 -> 18 | O47: 4 | P47: 9 | Q47: =O47*6+P47 -> 33 | S47: WHITBOURN
A48: BEST PLAYERS
A49: YARRAVILLE | C49: HOPKINS | F49: WARDEN | I49: STREETER | L49: SHEEHAN | O49: LAVENDER | R49: McGRATH
A50: WILLIAMSTOWN | C50: McGILLIVRAY | F50: TAYLOR | I50: WARD | L50: COOK | O50: ROGASH | R50: BROOKS
A51: GOALKICKERS
A52: YARRAVILLE | C52: McGRATH 5 | F52: J BUCKLEY 3 | I52: STREETER 3 | L52: WARDEN 2 | O52: WEDGWOOD 2 | R52: HOPKINS | U52: KENNY
A53: WILLIAMSTOWN | C53: PITTS 2 | F53: ANDREWS | I53: LAWLOR
A55: OAKLEIGH | C55: 1 | D55: 3 | E55: =C55*6+D55 -> 9 | G55: 4 | H55: 6 | I55: =G55*6+H55 -> 30 | K55: 7 | L55: 9 | M55: =K55*6+L55 -> 51 | O55: 11 | P55: 10 | Q55: =O55*6+P55 -> 76 | S55: OAKLEIGH
A56: CAMBERWELL | C56: 1 | D56: 3 | E56: =C56*6+D56 -> 9 | G56: 3 | H56: 5 | I56: =G56*6+H56 -> 23 | K56: 4 | L56: 8 | M56: =K56*6+L56 -> 32 | O56: 7 | P56: 12 | Q56: =O56*6+P56 -> 54 | S56: LESTER
A57: BEST PLAYERS
A58: OAKLEIGH | C58: FRASER | F58: McALLISTER | I58: RYAN | L58: KIDD | O58: WATSON | R58: CRAMERI
A59: CAMBERWELL | C59: JONES | F59: HEINTZ | I59: PRIEST | L59: TATHAM | O59: MASON | R59: CAREY
A60: GOALKICKERS
A61: OAKLEIGH | C61: FRASER 4 | F61: RYAN 2 | I61: BAKER | K61: CAMPBELL | N61: HUTCHESON | Q61: HEINTZ
A62: CAMBERWELL | C62: PRIEST 4 | F62: JONES | I62: GRIFFITHS | L62: TATHAM
A64: ROUND 2 | E64: 22ND APRIL | J64: WEATHER | M64: COOL CLOUDY S.W. WIND | S64: PLAYED AT
D65: 1ST QTR | H65: 2ND QTR | L65: 3RD QTR | P65: FINAL | S65: BRUNSWICK
A66: BRUNSWICK | C66: 6 | D66: 2 | E66: =C66*6+D66 -> 38 | G66: 9 | H66: 5 | I66: =G66*6+H66 -> 59 | K66: 12 | L66: 7 | M66: =K66*6+L66 -> 79 | O66: 13 | P66: 8 | Q66: =O66*6+P66 -> 86 | S66: UMPIRE | X66: LADDER | AB66: ROUND | AD66: 2
A67: YARRAVILLE | C67: 4 | D67: 2 | E67: =C67*6+D67 -> 26 | G67: 8 | H67: 6 | I67: =G67*6+H67 -> 54 | K67: 8 | L67: 10 | M67: =K67*6+L67 -> 58 | O67: 10 | P67: 13 | Q67: =O67*6+P67 -> 73 | S67: FRICKE
A68: BEST PLAYERS | W68: TEAM | X68: W | Y68: L | Z68: D | AA68: FOR | AB68: AGST | AC68: % | AD68: PTS
A69: BRUNSWICK | C69: SPOKES | F69: MAYNES | I69: DOWLING | L69: JENKINS | O69: JONES | R69: GILLON
A70: YARRAVILLE | C70: R EDWARDS | F70: HOPKINS | I70: WEDGWOOD | L70: McGRATH | O70: W BUCKLEY | R70: KENNY | W70: OAKLEIGH | X70: 2 | Y70: 0 | Z70: 0 | AA70: 153 | AB70: 125 | AC70: 122.4 | AD70: 8
A71: GOALKICKERS | W71: COBURG | X71: 2 | Y71: 0 | Z71: 0 | AA71: 177 | AB71: 155 | AC71: 114.19354838709677 | AD71: 8
A72: BRUNSWICK | C72: JONES 7 | F72: GILLON 2 | I72: PALMER 2 | L72: JAMES | N72: DOWLING | W72: PRAHRAN | X72: 1 | Y72: 1 | Z72: 0 | AA72: 175 | AB72: 100 | AC72: 175 | AD72: 4
A73: YARRAVILLE | C73: J BUCKLEY 4 | F73: CAVE 3 | I73: KENNY | K73: PETERS | N73: EVANS | W73: YARRAVILLE | X73: 1 | Y73: 1 | Z73: 0 | AA73: 201 | AB73: 120 | AC73: 167.5 | AD73: 4
A75: PRAHRAN | C75: 4 | D75: 3 | E75: =C75*6+D75 -> 27 | G75: 11 | H75: 6 | I75: =G75*6+H75 -> 72 | K75: 16 | L75: 6 | M75: =K75*6+L75 -> 102 | O75: 20 | P75: 10 | Q75: =O75*6+P75 -> 130 | S75: TOORAK PARK | W75: BRUNSWICK | X75: 1 | Y75: 1 | Z75: 0 | AA75: 130 | AB75: 119 | AC75: 109.24 | AD75: 4
A76: NORTHCOTE | C76: 1 | D76: 4 | E76: =C76*6+D76 -> 10 | G76: 5 | H76: 5 | I76: =G76*6+H76 -> 35 | K76: 6 | L76: 10 | M76: =K76*6+L76 -> 46 | O76: 6 | P76: 15 | Q76: =O76*6+P76 -> 51 | S76: HASSETT | W76: CAMBERWELL | X76: 1 | Y76: 1 | Z76: 0 | AA76: 149 | AB76: 138 | AC76: 107.97101449275362 | AD76: 4
A77: BEST PLAYERS | W77: SANDRINGHAM | X77: 1 | Y77: 1 | Z77: 0 | AA77: 146 | AB77: 162 | AC77: 90.123456790123456 | AD77: 4
A78: PRAHRAN | C78: WHITE | E78: GRANDISON | H78: HYDE | K78: WESCOTT | N78: ANDERSON | Q78: SHARPLEY | W78: PRESTON | X78: 1 | Y78: 1 | Z78: 0 | AA78: 128 | AB78: 149 | AC78: 85.90604026845638 | AD78: 4
A79: NORTHCOTE | C79: ROSS | E79: HART | H79: SIMMONDS | K79: GRAY | N79: GARRETT | Q79: WILLIAMSON | W79: PORT MELBOURNE | X79: 1 | Y79: 1 | Z79: 0 | AA79: 111 | AB79: 140 | AC79: 79.285714285714292 | AD79: 4
A80: GOALKICKERS | Q80: MUNN | W80: NORTHCOTE | X80: 1 | Y80: 1 | Z80: 0 | AA80: 129 | AB80: 164 | AC80: 78.658536585365852 | AD80: 4
A81: PRAHRAN | C81: GRANDISON 5 | F81: WHITE 4 | I81: KLYNE 3 | K81: ANDERSON 2 | N81: GOW 2 | P81: SHARPLEY 2 | S81: WILLIAMS | W81: BRIGHTON | X81: 0 | Y81: 2 | Z81: 0 | AA81: 180 | AB81: 206 | AC81: 87.378640776699029 | AD81: 0
A82: NORTHCOTE | C82: SIMMONDS 2 | F82: FLINN 2 | I82: ROSS | K82: MEITZCKE | W82: WILLIAMSTOWN | X82: 0 | Y82: 2 | Z82: 0 | AA82: 104 | AB82: 205 | AC82: 50.73 | AD82: 0
A84: COBURG | C84: 5 | D84: 2 | E84: =C84*6+D84 -> 32 | G84: 10 | H84: 4 | I84: =G84*6+H84 -> 64 | K84: 16 | L84: 6 | M84: =K84*6+L84 -> 102 | O84: 20 | P84: 11 | Q84: =O84*6+P84 -> 131 | S84: ELSTERNWICK PARK
A85: BRIGHTON | C85: 2 | D85: 5 | E85: =C85*6+D85 -> 17 | G85: 6 | H85: 12 | I85: =G85*6+H85 -> 48 | K85: 9 | L85: 17 | M85: =K85*6+L85 -> 71 | O85: 15 | P85: 22 | Q85: =O85*6+P85 -> 112 | S85: STUART
A86: BEST PLAYERS
A87: COBURG | C87: LA FANNUE | F87: McFARLANE | I87: KIGHT | L87: NASH | O87: UHE | Q87: HENNING
A88: BRIGHTON | C88: HALLAHAN | F88: BURTON | I88: MILLER | L88: SULLIVAN | O88: DEANE | Q88: DREW
A89: GOALKICKERS
A90: COBURG | C90: NASH 5 | F90: LA FANNUE 5 | I90: HENNING 3 | L90: DUNCAN 3 | O90: HALL 2 | Q90: McKAY | S90: GARDINER
A91: BRIGHTON | C91: SULLIVAN 7 | F91: DEANE 3 | I91: DREW 2 | L91: HALLAHAN 2 | O91: BURNES
A93: CAMBERWELL | C93: 2 | D93: 4 | E93: =C93*6+D93 -> 16 | G93: 7 | H93: 7 | I93: =G93*6+H93 -> 49 | K93: 9 | L93: 12 | M93: =K93*6+L93 -> 66 | O93: 13 | P93: 17 | Q93: =O93*6+P93 -> 95 | S93: CAMBERWELL
A94: PORT MELBOURNE | C94: 2 | D94: 5 | E94: =C94*6+D94 -> 17 | G94: 2 | H94: 12 | I94: =G94*6+H94 -> 24 | K94: 6 | L94: 18 | M94: =K94*6+L94 -> 54 | O94: 7 | P94: 20 | Q94: =O94*6+P94 -> 62 | S94: JURY
A95: BEST PLAYERS
A96: CAMBERWELL | C96: BILLETT | F96: JONES | I96: MASON | L96: R WILLIAMS | O96: SCOTT | Q96: BEAGLEY
A97: PORT MELBOURNE | C97: PLUMRIDGE | F97: LAHIFF | I97: KEATING | L97: BROOKER | O97: BEDFORD | Q97: GARBUTT
A98: GOALKICKERS
A99: CAMBERWELL | C99: JONES 4 | E99: GRIFFITHS 2 | H99: SCOTT 2 | J99: TATHAM 2 | M99: BRIGGS | O99: MASON | Q99: WILLIAMS
A100: PORT MELBOURNE | C100: BEDFORD 2 | F100: RUSDEN 2 | I100: LEGGO | K100: PLUMRIDGE | N100: KEATING
A102: PRESTON | C102: 2 | D102: 1 | E102: =C102*6+D102 -> 13 | G102: 6 | H102: 10 | I102: =G102*6+H102 -> 46 | K102: 9 | L102: 11 | M102: =K102*6+L102 -> 65 | O102: 13 | P102: 16 | Q102: =O102*6+P102 -> 94 | S102: PRESTON
A103: SANDRINGHAM | C103: 4 | D103: 2 | E103: =C103*6+D103 -> 26 | G103: 6 | H103: 4 | I103: =G103*6+H103 -> 40 | K103: 7 | L103: 9 | M103: =K103*6+L103 -> 51 | O103: 10 | P103: 11 | Q103: =O103*6+P103 -> 71 | S103: ROFE
A104: BEST PLAYERS
A105: PRESTON | C105: DINEEN | E105: BOSCHEN | H105: HARDING | K105: WARR | N105: CAMERON | Q105: CRIUCKSHANK
A106: SANDRINGHAM | C106: WILSON | E106: MILLER | H106: McCOMB | K106: A CHRISTIE | N106: KEMP | Q106: THOMS
A107: GOALKICKERS
A108: PRESTON | C108: WARR 4 | E108: DAVIS 3 | G108: HUGHSON 2 | J108: CAMERON | M108: ARTHUR | O108: McCLELLAND | R108: COOPER
A109: SANDRINGHAM | C109: MITCHELL 4 | F109: ROBERTS | I109: McCOMB | K109: DENNINGTON | N109: BENNETT | Q109: TOLSON | S109: McCONVILLE
A111: OAKLEIGH | C111: 2 | D111: 1 | E111: =C111*6+D111 -> 13 | G111: 7 | H111: 5 | I111: =G111*6+H111 -> 47 | K111: 8 | L111: 7 | M111: =K111*6+L111 -> 55 | O111: 11 | P111: 11 | Q111: =O111*6+P111 -> 77 | S111: WILLIAMSTOWN
A112: WILLIAMSTOWN | C112: 1 | D112: 4 | E112: =C112*6+D112 -> 10 | G112: 5 | H112: 4 | I112: =G112*6+H112 -> 34 | K112: 8 | L112: 11 | M112: =K112*6+L112 -> 59 | O112: 10 | P112: 11 | Q112: =O112*6+P112 -> 71 | S112: LESTER
A113: BEST PLAYERS
A114: OAKLEIGH | C114: KIDD | E114: McALLISTER | H114: POWELL | K114: FRASER | N114: CRAMERI | Q114: HEINTZ
A115: WILLIAMSTOWN | C115: WARD | E115: CUTTING | H115: TAYLOR | K115: MARTIN | N115: McGILLIVRAY | Q115: BROOKS
A116: GOALKICKERS
A117: OAKLEIGH | C117: FRASER 4 | F117: HEINTZ 4 | I117: RYAN 2 | K117: CRAMERI
A118: WILLIAMSTOWN | C118: LAWLOR 4 | F118: SLAUGHTER 2 | I118: MOONEY | K118: PITTS | M118: McGILLIVRAY | P118: LEWER
A120: ROUND 3 | E120: 27TH APRIL | J120: WEATHER | M120: FINE WARM NORTH WIND | S120: PLAYED AT
D121: 1ST QTR | H121: 2ND QTR | L121: 3RD QTR | P121: FINAL | S121: OAKLEIGH
A122: OAKLEIGH | C122: 4 | D122: 3 | E122: =C122*6+D122 -> 27 | G122: 5 | H122: 6 | I122: =G122*6+H122 -> 36 | K122: 13 | L122: 13 | M122: =K122*6+L122 -> 91 | O122: 17 | P122: 16 | Q122: =O122*6+P122 -> 118 | S122: UMPIRE | X122: LADDER | AB122: ROUND | AD122: 3
A123: BRUNSWICK | C123: 4 | D123: 1 | E123: =C123*6+D123 -> 25 | G123: 10 | H123: 5 | I123: =G123*6+H123 -> 65 | K123: 12 | L123: 7 | M123: =K123*6+L123 -> 79 | O123: 15 | P123: 11 | Q123: =O123*6+P123 -> 101 | S123: GODFREY
A124: BEST PLAYERS | W124: TEAM | X124: W | Y124: L | Z124: D | AA124: FOR | AB124: AGST | AC124: % | AD124: PTS
A125: OAKLEIGH | C125: JONES | F125: BAWDEN | I125: KIDD | K125: POWELL | N125: BAKER | Q125: FRASER
A126: BRUNSWICK | C126: DOWLING | F126: PALMER | I126: JENKINS | K126: MAYNES | N126: GILLON | Q126: FAY | W126: OAKLEIGH | X126: 3 | Y126: 0 | Z126: 0 | AA126: 271 | AB126: 226 | AC126: 119.91 | AD126: 12
A127: GOALKICKERS | Q127: BAWDEN | W127: COBURG | X127: 3 | Y127: 0 | Z127: 0 | AA127: 267 | AB127: 228 | AC127: 117.11 | AD127: 12
A128: OAKLEIGH | C128: FRASER 4 | E128: HEINTZ 3 | G128: BRADLEY 2 | J128: RYAN 2 | L128: WITHERS 2 | O128: MUDGE | Q128: MAJOR | S128: BAKER | W128: YARRAVILLE | X128: 2 | Y128: 1 | Z128: 0 | AA128: 319 | AB128: 192 | AC128: 166.15 | AD128: 8
A129: BRUNSWICK | C129: DOWLING 4 | F129: JONES 4 | H129: PALMER 3 | J129: SINNOTT 2 | M129: KENNEDY | O129: GILLON | W129: CAMBERWELL | X129: 2 | Y129: 1 | Z129: 0 | AA129: 301 | AB129: 204 | AC129: 147.54901960784315 | AD129: 8
A131: PRAHRAN | C131: 3 | D131: 6 | E131: =C131*6+D131 -> 24 | G131: 6 | H131: 8 | I131: =G131*6+H131 -> 44 | K131: 9 | L131: 9 | M131: =K131*6+L131 -> 63 | O131: 15 | P131: 14 | Q131: =O131*6+P131 -> 104 | S131: BEACH ROAD | W131: PRAHRAN | X131: 2 | Y131: 1 | Z131: 0 | AA131: 279 | AB131: 191 | AC131: 146.07 | AD131: 8
A132: SANDRINGHAM | C132: 2 | D132: 6 | E132: =C132*6+D132 -> 18 | G132: 6 | H132: 8 | I132: =G132*6+H132 -> 44 | K132: 12 | L132: 11 | M132: =K132*6+L132 -> 83 | O132: 13 | P132: 13 | Q132: =O132*6+P132 -> 91 | S132: FRICKE | W132: PORT MELBOURNE | X132: 2 | Y132: 1 | Z132: 0 | AA132: 185 | AB132: 201 | AC132: 92.039800995024876 | AD132: 8
A133: BEST PLAYERS | W133: BRUNSWICK | X133: 1 | Y133: 2 | Z133: 0 | AA133: 231 | AB133: 237 | AC133: 97.47 | AD133: 4
A134: PRAHRAN | C134: WEBSTER | F134: SHARPLEY | I134: WHITE | L134: GRANDISON | O134: BRENCHLEY | R134: DIXON | W134: SANDRINGHAM | X134: 1 | Y134: 2 | Z134: 0 | AA134: 237 | AB134: 266 | AC134: 89.1 | AD134: 4
A135: SANDRINGHAM | C135: DOCKENDORFF | F135: McCONCHIE | I135: DOWLING | L135: TOLSON | O135: CHRISTIE | R135: WILSON | W135: PRESTON | X135: 1 | Y135: 2 | Z135: 0 | AA135: 201 | AB135: 239 | AC135: 84.1 | AD135: 4
A136: GOALKICKERS | W136: NORTHCOTE | X136: 1 | Y136: 2 | Z136: 0 | AA136: 190 | AB136: 238 | AC136: 79.831932773109244 | AD136: 4
A137: PRAHRAN | C137: GRANDISON 5 | F137: WHITE 3 | I137: SHARPLEY 3 | L137: BRENCHLEY 2 | O137: MUNN | Q137: KLYNE | W137: BRIGHTON | X137: 0 | Y137: 3 | Z137: 0 | AA137: 252 | AB137: 324 | AC137: 77.777777777777771 | AD137: 0
A138: SANDRINGHAM | C138: DOWLING 5 | F138: McCONCHIE 3 | I138: TOLSON 3 | L138: McCONVILLE 2 | W138: WILLIAMSTOWN | X138: 0 | Y138: 3 | Z138: 0 | AA138: 170 | AB138: 357 | AC138: 47.49 | AD138: 0
A140: COBURG | C140: 5 | D140: 4 | E140: =C140*6+D140 -> 34 | G140: 7 | H140: 5 | I140: =G140*6+H140 -> 47 | K140: 10 | L140: 11 | M140: =K140*6+L140 -> 71 | O140: 13 | P140: 12 | Q140: =O140*6+P140 -> 90 | S140: COBURG
A141: PRESTON | C141: 2 | D141: 2 | E141: =C141*6+D141 -> 14 | G141: 5 | H141: 8 | I141: =G141*6+H141 -> 38 | K141: 6 | L141: 10 | M141: =K141*6+L141 -> 46 | O141: 10 | P141: 13 | Q141: =O141*6+P141 -> 73 | S141: LESTER
A142: BEST PLAYERS
A143: COBURG | C143: HENNING | F143: NASH | I143: ANDERSON | L143: DUNCAN | O143: McFARLANE | R143: VOIGHT
A144: PRESTON | C144: FINNEGAN | F144: MUIR | I144: DOWLING | L144: HUGO | O144: UNDERHILL | R144: WARR
A145: GOALKICKERS
A146: COBURG | C146: NASH 4 | E146: DUNCAN 3 | H146: HENDERSON | K146: HULL | M146: LA FANNUE | P146: ANDERSON | R146: HENNING | U146: VOIGHT
A147: PRESTON | C147: SMITH 2 | E147: CAMERON 2 | H147: HUGO 2 | J147: MUIR 2 | M147: WARR | O147: CRACKNELL
A149: PORT MELBOURNE | C149: 2 | D149: 2 | E149: =C149*6+D149 -> 14 | G149: 5 | H149: 7 | I149: =G149*6+H149 -> 37 | K149: 10 | L149: 13 | M149: =K149*6+L149 -> 73 | O149: 10 | P149: 14 | Q149: =O149*6+P149 -> 74 | S149: PORT MELBOURNE
A150: NORTHCOTE | C150: 3 | D150: 5 | E150: =C150*6+D150 -> 23 | G150: 4 | H150: 7 | I150: =G150*6+H150 -> 31 | K150: 8 | L150: 10 | M150: =K150*6+L150 -> 58 | O150: 8 | P150: 13 | Q150: =O150*6+P150 -> 61 | S150: HASSETT
A151: BEST PLAYERS
A152: PORT MELBOURNE | C152: PLUMRIDGE | F152: McNAMARA | I152: BRAID | L152: BLOOMER | O152: PAYNE | Q152: HURLEY
A153: NORTHCOTE | C153: GRAY | F153: HART | I153: WILLIAMSON | L153: ROSS | O153: WOODS | Q153: ACKLAND
A154: GOALKICKERS
A155: PORT MELBOURNE | C155: McNAMARA 4 | F155: RUSDEN 3 | I155: LEGGO | K155: HURLEY | M155: MALTBY
A156: NORTHCOTE | C156: GRAY 3 | F156: ROGERS 2 | I156: ROSS | K156: SIMMONDS | N156: WOODS
A158: YARRAVILLE | C158: 1 | D158: 9 | E158: =C158*6+D158 -> 15 | G158: 4 | H158: 11 | I158: =G158*6+H158 -> 35 | K158: 11 | L158: 17 | M158: =K158*6+L158 -> 83 | O158: 16 | P158: 22 | Q158: =O158*6+P158 -> 118 | S158: YARRAVILLE
A159: BRIGHTON | C159: 2 | D159: 2 | E159: =C159*6+D159 -> 14 | G159: 6 | H159: 9 | I159: =G159*6+H159 -> 45 | K159: 8 | L159: 14 | M159: =K159*6+L159 -> 62 | O159: 9 | P159: 18 | Q159: =O159*6+P159 -> 72 | S159: GLOVER
A160: BEST PLAYERS
A161: YARRAVILLE | C161: HOPKINS | F161: CONABERE | I161: WEDGWOOD | M161: STREETER | P161: J BUCKLEY | S161: PEARCE
A162: BRIGHTON | C162: DEANE | F162: SULLIVAN | I162: HALLAHAN | M162: DREW | P162: MALONEY | S162: BOCK
A163: GOALKICKERS
A164: YARRAVILLE | C164: J BUCKLEY 5 | F164: McGRATH 3 | I164: WILLIAMS 3 | L164: WEDGWOOD | O164: FREW | Q164: HOPKINS | S164: LAVENDER | V164: STREETER
A165: BRIGHTON | C165: SULLIVAN 4 | F165: DEANE 3 | I165: ROWE | K165: CONNELL
A167: CAMBERWELL | C167: 2 | D167: 3 | E167: =C167*6+D167 -> 15 | G167: 13 | H167: 8 | I167: =G167*6+H167 -> 86 | K167: 16 | L167: 12 | M167: =K167*6+L167 -> 108 | O167: 22 | P167: 20 | Q167: =O167*6+P167 -> 152 | S167: CAMBERWELL
A168: WILLIAMSTOWN | C168: 2 | D168: 2 | E168: =C168*6+D168 -> 14 | G168: 3 | H168: 3 | I168: =G168*6+H168 -> 21 | K168: 8 | L168: 5 | M168: =K168*6+L168 -> 53 | O168: 10 | P168: 6 | Q168: =O168*6+P168 -> 66 | S168: CLAYTON
A169: BEST PLAYERS
A170: CAMBERWELL | C170: BILLETT | F170: FINLAYSON | I170: TATHAM | L170: BRIGGS | O170: GRIFFITHS | R170: DYBALL
A171: WILLIAMSTOWN | C171: BROOKS | F171: LAWLOR | I171: RAEBURN | L171: McGILLIVRAY | O171: SLAUGHTER | R171: TAYLOR
A172: GOALKICKERS
A173: CAMBERWELL | C173: GRIFFITHS 7 | F173: TATHAM 5 | I173: PRIEST 4 | L173: FIELDS 2 | N173: BILLETT 2 | Q173: MASON | S173: JONES
A174: WILLIAMSTOWN | C174: LAWLOR 6 | F174: RAEBURN 2 | I174: SLAUGHTER | L174: McGILLIVRAY
A176: ROUND 4 | E176: 4TH MAY | J176: WEATHER | M176: FINE MILD NORTH WIND | S176: PLAYED AT
D177: 1ST QTR | H177: 2ND QTR | L177: 3RD QTR | P177: FINAL | S177: BRUNSWICK | X177: LADDER | AB177: ROUND | AD177: 4
A178: BRUNSWICK | C178: 6 | D178: 1 | E178: =C178*6+D178 -> 37 | G178: 7 | H178: 4 | I178: =G178*6+H178 -> 46 | K178: 9 | L178: 7 | M178: =K178*6+L178 -> 61 | O178: 12 | P178: 7 | Q178: =O178*6+P178 -> 79 | S178: UMPIRE
A179: CAMBERWELL | C179: 1 | D179: 3 | E179: =C179*6+D179 -> 9 | G179: 5 | H179: 12 | I179: =G179*6+H179 -> 42 | K179: 8 | L179: 16 | M179: =K179*6+L179 -> 64 | O179: 8 | P179: 17 | Q179: =O179*6+P179 -> 65 | S179: GEE | W179: TEAM | X179: W | Y179: L | Z179: D | AA179: FOR | AB179: AGST | AC179: % | AD179: PTS
A180: BEST PLAYERS
A181: BRUNSWICK | C181: DONNELLY | F181: DOWLING | I181: SINNOTT | L181: RAEBURN | O181: FAY | Q181: QUINLAN | W181: COBURG | X181: 4 | Y181: 0 | Z181: 0 | AA181: 364 | AB181: 308 | AC181: 118.18 | AD181: 16
A182: CAMBERWELL | C182: GRIFFITHS | F182: MASON | I182: LUFF | L182: JONES | O182: SELLECK | Q182: CAREY | W182: OAKLEIGH | X182: 3 | Y182: 1 | Z182: 0 | AA182: 357 | AB182: 326 | AC182: 109.51 | AD182: 12
A183: GOALKICKERS | W183: YARRAVILLE | X183: 2 | Y183: 2 | Z183: 0 | AA183: 402 | AB183: 280 | AC183: 143.57 | AD183: 8
A184: BRUNSWICK | C184: SINNOTT 4 | F184: JONES 3 | I184: DONNELLY 2 | L184: DOWLING | O184: GILLON | Q184: SMYTHE | W184: CAMBERWELL | X184: 2 | Y184: 2 | Z184: 0 | AA184: 366 | AB184: 283 | AC184: 129.32862190812722 | AD184: 8
A185: CAMBERWELL | C185: MASON 2 | F185: LUFF 2 | I185: SELLECK 2 | L185: GRIFFITH | O185: PRIEST
W186: PRAHRAN | X186: 2 | Y186: 2 | Z186: 0 | AA186: 359 | AB186: 288 | AC186: 124.65 | AD186: 8
A187: NORTHCOTE | C187: 4 | D187: 4 | E187: =C187*6+D187 -> 28 | G187: 12 | H187: 8 | I187: =G187*6+H187 -> 80 | K187: 18 | L187: 11 | M187: =K187*6+L187 -> 119 | O187: 22 | P187: 14 | Q187: =O187*6+P187 -> 146 | S187: NORTHCOTE | W187: NORTHCOTE | X187: 2 | Y187: 2 | Z187: 0 | AA187: 336 | AB187: 297 | AC187: 113.13131313131314 | AD187: 8
A188: SANDRINGHAM | C188: 1 | D188: 1 | E188: =C188*6+D188 -> 7 | G188: 3 | H188: 4 | I188: =G188*6+H188 -> 22 | K188: 6 | L188: 5 | M188: =K188*6+L188 -> 41 | O188: 8 | P188: 11 | Q188: =O188*6+P188 -> 59 | S188: GLOVER | W188: BRUNSWICK | X188: 2 | Y188: 2 | Z188: 0 | AA188: 310 | AB188: 302 | AC188: 102.65 | AD188: 8
A189: BEST PLAYERS | W189: PORT MELBOURNE | X189: 2 | Y189: 2 | Z189: 0 | AA189: 267 | AB189: 292 | AC189: 91.438356164383563 | AD189: 8
A190: NORTHCOTE | C190: WILLIAMSON | F190: SIMMONDS | I190: ROSS | L190: BATES | N190: LYNGCOLN | Q190: GOULLETT | W190: PRESTON | X190: 2 | Y190: 2 | Z190: 0 | AA190: 289 | AB190: 322 | AC190: 89.75 | AD190: 8
A191: SANDRINGHAM | C191: DOCKENDORFF | F191: MILLER | I191: DENNINGTON | L191: SMAIL | N191: WILSON | Q191: CAMPBELL | W191: BRIGHTON | X191: 1 | Y191: 3 | Z191: 0 | AA191: 352 | AB191: 410 | AC191: 85.853658536585371 | AD191: 4
A192: GOALKICKERS | Q192: ROSS | W192: SANDRINGHAM | X192: 1 | Y192: 3 | Z192: 0 | AA192: 296 | AB192: 412 | AC192: 71.84 | AD192: 4
A193: NORTHCOTE | C193: SEYMOUR 5 | F193: SIMMONDS 4 | I193: WILLIAMSON 4 | L193: MEITZKE 2 | N193: GRAY 2 | P193: GOULLET 2 | R193: GUTHRIE 2 | W193: WILLIAMSTOWN | X193: 1 | Y193: 3 | Z193: 0 | AA193: 261 | AB193: 439 | AC193: 59.45 | AD193: 4
A194: SANDRINGHAM | C194: SMAIL 2 | F194: McCONCHIE 2 | I194: DENNNINGTON 2 | M194: ROBERTS | O194: McCOMB
A196: BRIGHTON | C196: 5 | D196: 3 | E196: =C196*6+D196 -> 33 | G196: 11 | H196: 5 | I196: =G196*6+H196 -> 71 | K196: 13 | L196: 12 | M196: =K196*6+L196 -> 90 | O196: 14 | P196: 16 | Q196: =O196*6+P196 -> 100 | S196: ELSTERNWICK PARK
A197: OAKLEIGH | C197: 1 | D197: 4 | E197: =C197*6+D197 -> 10 | G197: 6 | H197: 9 | I197: =G197*6+H197 -> 45 | K197: 9 | L197: 15 | M197: =K197*6+L197 -> 69 | O197: 13 | P197: 8 | Q197: =O197*6+P197 -> 86 | S197: HASSETT
A198: BEST PLAYERS
A199: BRIGHTON | C199: BURNES | F199: DREW | I199: BOLWELL | L199: LILBURNE | O199: McLEOD | R199: WILLIAMSON
A200: OAKLEIGH | C200: CAMPBELL | F200: DEAN | I200: CHAPMAN | L200: HICKS | O200: POWELL | R200: KIDD
A201: GOALKICKERS
A202: BRIGHTON | C202: BURNES 3 | F202: DREW 3 | I202: SULLIVAN 2 | L202: BOLWELL 2 | O202: WEBER 2 | Q202: LILBURNE | T202: DEANE
A203: OAKLEIGH | C203: FRASER 4 | F203: HEINTZ 3 | I203: CHAPMAN 3 | L203: POWELL 2 | O203: BAWDEN
E204: 6TH MAY | J204: WEATHER | M204: FINE MILD SUNNY
A205: COBURG | C205: 4 | D205: 7 | E205: =C205*6+D205 -> 31 | G205: 8 | H205: 10 | I205: =G205*6+H205 -> 58 | K205: 12 | L205: 18 | M205: =K205*6+L205 -> 90 | O205: 13 | P205: 19 | Q205: =O205*6+P205 -> 97 | S205: TOORAK PARK
A206: PRAHRAN | C206: 2 | D206: 1 | E206: =C206*6+D206 -> 13 | G206: 5 | H206: 9 | I206: =G206*6+H206 -> 39 | K206: 7 | L206: 10 | M206: =K206*6+L206 -> 52 | O206: 11 | P206: 14 | Q206: =O206*6+P206 -> 80 | S206: GODFREY
A207: BEST PLAYERS
A208: COBURG | C208: LE FANNUE | F208: McFARLANE | I208: KIGHT | K208: DUNCAN | N208: NASH | Q208: HULL
A209: PRAHRAN | C209: WHITE | F209: HYDE | I209: KOOP | K209: WILLIAMS | N209: SHARPLEY | Q209: TABATEAU
A210: GOALKICKERS
A211: COBURG | C211: NASH 3 | F211: LE FANNUE 3 | I211: DUNCAN 2 | L211: HENNING 2 | O211: HARRIS 2 | Q211: DIXON
A212: PRAHRAN | C212: WHITE 4 | F212: GRANDISON 2 | I212: WILLIAMS 2 | L212: SHARPLEY | N212: HYDE | P212: WILTSHIRE
A214: PRESTON | C214: 8 | D214: 5 | E214: =C214*6+D214 -> 53 | G214: 9 | H214: 7 | I214: =G214*6+H214 -> 61 | K214: 11 | L214: 9 | M214: =K214*6+L214 -> 75 | O214: 13 | P214: 10 | Q214: =O214*6+P214 -> 88 | S214: PRESTON
A215: YARRAVILLE | C215: 2 | D215: 3 | E215: =C215*6+D215 -> 15 | G215: 5 | H215: 13 | I215: =G215*6+H215 -> 43 | K215: 9 | L215: 13 | M215: =K215*6+L215 -> 67 | O215: 11 | P215: 17 | Q215: =O215*6+P215 -> 83 | S215: GREGORY
A216: BEST PLAYERS
A217: PRESTON | C217: SMITH | E217: BOSCHEN | H217: WARR | K217: ARTHUR | N217: DUNSTAN | Q217: DOWLING
A218: YARRAVILLE | C218: HOPKINS | E218: J BUCKLEY | H218: McGRATH | K218: RYAN | N218: EVANS | Q218: WEDGWOOD
A219: GOALKICKERS
A220: PRESTON | C220: WARR 4 | E220: HUGHSON 4 | H220: HUGO | J220: McCLELLAND | M220: BOSCHEN | O220: UNDERHILL | R220: HARDING
A221: YARRAVILLE | C221: J BUCKLEY 4 | F221: WEDGWOOD 3 | J221: McGRATH 2 | M221: CAVE | O221: SHEAHAN
A223: WILLIAMSTOWN | C223: 3 | D223: 4 | E223: =C223*6+D223 -> 22 | G223: 8 | H223: 9 | I223: =G223*6+H223 -> 57 | K223: 11 | L223: 10 | M223: =K223*6+L223 -> 76 | O223: 12 | P223: 19 | Q223: =O223*6+P223 -> 91 | S223: WILLIAMSTOWN
A224: PORT MELBOURNE | C224: 3 | D224: 1 | E224: =C224*6+D224 -> 19 | G224: 4 | H224: 5 | I224: =G224*6+H224 -> 29 | K224: 10 | L224: 9 | M224: =K224*6+L224 -> 69 | O224: 12 | P224: 10 | Q224: =O224*6+P224 -> 82 | S224: STUART
A225: BEST PLAYERS
A226: WILLIAMSTOWN | C226: KNIGHT | E226: LAWLOR | H226: RAEBURN | K226: McGILLIVRAY | N226: MOONEY | Q226: CUTTING
A227: PORT MELBOURNE | C227: RUSDEN | E227: BROOKER | H227: BRAID | K227: FORREST | N227: KEATING | Q227: PETTIONA
A228: GOALKICKERS
A229: WILLIAMSTOWN | C229: LAWLOR 3 | F229: McGILLIVRAY 2 | J229: RAEBURN 2 | M229: PITTS 2 | O229: POWER | Q229: THOMPSON | T229: ROGASH
A230: PORT MELBOURNE | C230: RUSDEN 5 | F230: KEATING 2 | I230: FORREST 2 | L230: McNAMARA | O230: BRAID | Q230: ATKINSON
A232: ROUND 5 | E232: 11TH MAY | J232: WEATHER | M232: CLOUDY BUT FINE S.W. BREEZE | S232: PLAYED AT
D233: 1ST QTR | H233: 2ND QTR | L233: 3RD QTR | P233: FINAL | S233: YARRAVILLE
A234: YARRAVILLE | C234: 1 | D234: 1 | E234: =C234*6+D234 -> 7 | G234: 4 | H234: 15 | I234: =G234*6+H234 -> 39 | K234: 6 | L234: 17 | M234: =K234*6+L234 -> 53 | O234: 12 | P234: 20 | Q234: =O234*6+P234 -> 92 | S234: UMPIRE | X234: LADDER | AB234: ROUND | AD234: 5
A235: PRAHRAN | C235: 4 | D235: 3 | E235: =C235*6+D235 -> 27 | G235: 6 | H235: 3 | I235: =G235*6+H235 -> 39 | K235: 9 | L235: 11 | M235: =K235*6+L235 -> 65 | O235: 10 | P235: 16 | Q235: =O235*6+P235 -> 76 | S235: FRICKE
A236: BEST PLAYERS | W236: TEAM | X236: W | Y236: L | Z236: D | AA236: FOR | AB236: AGST | AC236: % | AD236: PTS
A237: YARRAVILLE | C237: J BUCKLEY | F237: WARDEN | I237: WILLIAMS | L237: STREETER | O237: RYAN | R237: R EVANS
A238: PRAHRAN | C238: GOW | F238: SHARPLEY | I238: HYDE | L238: WHITEHEAD | O238: ANDERSON | R238: KOOP | W238: COBURG | X238: 4 | Y238: 1 | Z238: 0 | AA238: 442 | AB238: 425 | AC238: 104 | AD238: 16
A239: GOALKICKERS | W239: OAKLEIGH | X239: 3 | Y239: 1 | Z239: 1 | AA239: 454 | AB239: 423 | AC239: 107.33 | AD239: 14
A240: YARRAVILLE | C240: J BUCKLEY 4 | F240: W RYAN 3 | I240: STREETER | K240: WILLIAMS | M240: PETERS | O240: LAVENDER | R240: R SMITH | W240: YARRAVILLE | X240: 3 | Y240: 2 | Z240: 0 | AA240: 494 | AB240: 356 | AC240: 138.76 | AD240: 12
A241: PRAHRAN | C241: GRANDISON 2 | F241: GOW 2 | H241: WHITE | J241: MUNN | L241: ANDERSON | N241: WILLIAMS | Q241: HYDE | S241: HAWKER | W241: CAMBERWELL | X241: 3 | Y241: 2 | Z241: 0 | AA241: 473 | AB241: 352 | AC241: 134.375 | AD241: 12
A243: NORTHCOTE | C243: 1 | D243: 2 | E243: =C243*6+D243 -> 8 | G243: 7 | H243: 11 | I243: =G243*6+H243 -> 53 | K243: 9 | L243: 17 | M243: =K243*6+L243 -> 71 | O243: 16 | P243: 21 | Q243: =O243*6+P243 -> 117 | S243: COBURG | W243: NORTHCOTE | X243: 3 | Y243: 2 | Z243: 0 | AA243: 453 | AB243: 375 | AC243: 120.8 | AD243: 12
A244: COBURG | C244: 4 | D244: 2 | E244: =C244*6+D244 -> 26 | G244: 5 | H244: 3 | I244: =G244*6+H244 -> 33 | K244: 9 | L244: 5 | M244: =K244*6+L244 -> 59 | O244: 12 | P244: 6 | Q244: =O244*6+P244 -> 78 | S244: GREGORY | W244: BRUNSWICK | X244: 3 | Y244: 2 | Z244: 0 | AA244: 379 | AB244: 356 | AC244: 106.46 | AD244: 12
A245: BEST PLAYERS | W245: PORT MELBOURNE | X245: 3 | Y245: 2 | Z245: 0 | AA245: 369 | AB245: 356 | AC245: 103.65 | AD245: 12
A246: NORTHCOTE | C246: PYE | E246: GRAY | H246: MEITZCKE | K246: BATES | N246: WILLIAMSON | Q246: ROSS | W246: PRESTON | X246: 2 | Y246: 2 | Z246: 1 | AA246: 386 | AB246: 419 | AC246: 92.12 | AD246: 10
A247: COBURG | C247: HULL | E247: HENNING | H247: HARRIS | K247: REITSCHEL | N247: LA FANNUE | Q247: HARRIS | W247: PRAHRAN | X247: 2 | Y247: 3 | Z247: 0 | AA247: 435 | AB247: 380 | AC247: 114.47 | AD247: 8
A248: GOALKICKERS | W248: BRIGHTON | X248: 1 | Y248: 4 | Z248: 0 | AA248: 421 | AB248: 517 | AC248: 81.431334622823982 | AD248: 4
A249: NORTHCOTE | C249: GRAY 4 | E249: PYE 3 | G249: SIMMONDS 2 | J249: MEITZKE 2 | M249: WILLIAMSON 2 | P249: GOULLET 2 | R249: McINERNEY | W249: SANDRINGHAM | X249: 1 | Y249: 4 | Z249: 0 | AA249: 360 | AB249: 514 | AC249: 70.04 | AD249: 4
A250: COBURG | C250: DUNCAN 5 | G250: LE FANNUE 5 | J250: HENNING | M250: HULL | W250: WILLIAMSTOWN | X250: 1 | Y250: 4 | Z250: 0 | AA250: 315 | AB250: 508 | AC250: 62.01 | AD250: 4
A252: OAKLEIGH | C252: 3 | D252: 5 | E252: =C252*6+D252 -> 23 | G252: 8 | H252: 8 | I252: =G252*6+H252 -> 56 | K252: 12 | L252: 10 | M252: =K252*6+L252 -> 82 | O252: 14 | P252: 13 | Q252: =O252*6+P252 -> 97 | S252: OAKLEIGH
A253: PRESTON | C253: 4 | D253: 2 | E253: =C253*6+D253 -> 26 | G253: 10 | H253: 2 | I253: =G253*6+H253 -> 62 | K253: 13 | L253: 7 | M253: =K253*6+L253 -> 85 | O253: 15 | P253: 7 | Q253: =O253*6+P253 -> 97 | S253: GLOVER
A254: BEST PLAYERS
A255: OAKLEIGH | C255: KIDD | F255: FRASER | I255: HICKS | L255: CAMPBELL | O255: HEINTZ | Q255: YANN
A256: PRESTON | C256: HARDING | F256: ARTHUR | I256: SMITH | L256: HUGHSON | O256: BOSCHEN | Q256: McLELLAND
A257: GOALKICKERS
A258: OAKLEIGH | C258: FRASER 7 | F258: HEINTZ 4 | I258: RYAN | L258: BRADLEY | O258: MAJOR
A259: PRESTON | C259: HUGHSON 3 | F259: COOPER 3 | I259: McCLELLAND 3 | L259: ARTHUR 2 | N259: BOSCHEN 2 | Q259: DUNSTAN | T259: WALSH
A261: PORT MELBOURNE | C261: 4 | D261: 3 | E261: =C261*6+D261 -> 27 | G261: 6 | H261: 5 | I261: =G261*6+H261 -> 41 | K261: 11 | L261: 9 | M261: =K261*6+L261 -> 75 | O261: 15 | P261: 12 | Q261: =O261*6+P261 -> 102 | S261: PORT MELBOURNE
A262: SANDRINGHAM | C262: 4 | D262: 1 | E262: =C262*6+D262 -> 25 | G262: 5 | H262: 4 | I262: =G262*6+H262 -> 34 | K262: 7 | L262: 6 | M262: =K262*6+L262 -> 48 | O262: 9 | P262: 10 | Q262: =O262*6+P262 -> 64 | S262: ROFE
A263: BEST PLAYERS
A264: PORT MELBOURNE | C264: BROOKER | F264: McNAMARA | I264: KEATING | L264: PLUMRIDGE | O264: MALTBY | Q264: ONLEY
A265: SANDRINGHAM | C265: DOCKENDORFF | F265: CAMPBELL | I265: JONES | L265: DOWLING | O265: McCOMB | Q265: MILLER
A266: GOALKICKERS
A267: PORT MELBOURNE | C267: KEATING 4 | F267: GOMEZ 3 | I267: MALTBY 2 | L267: GOTZ 2 | N267: RUSDEN | P267: McNAMARA | S267: PLUMRIDGE | V267: EARLE
A268: SANDRINGHAM | C268: McCOMB 2 | F268: DENNINGTON 2 | J268: MITCHELL | M268: DOWLING | O268: MILLER | Q268: WILSON | T268: POUND
A270: BRUNSWICK | C270: 4 | D270: 2 | E270: =C270*6+D270 -> 26 | G270: 4 | H270: 4 | I270: =G270*6+H270 -> 28 | K270: 9 | L270: 6 | M270: =K270*6+L270 -> 60 | O270: 10 | P270: 9 | Q270: =O270*6+P270 -> 69 | S270: WILLIAMSTOWN
A271: WILLIAMSTOWN | C271: 1 | D271: 0 | E271: =C271*6+D271 -> 6 | G271: 5 | H271: 5 | I271: =G271*6+H271 -> 35 | K271: 6 | L271: 7 | M271: =K271*6+L271 -> 43 | O271: 7 | P271: 12 | Q271: =O271*6+P271 -> 54 | S271: WHITBURN
A272: BEST PLAYERS
A273: BRUNSWICK | C273: FAY | E273: JENKINS | H273: DOWLING | K273: DONNELLY | N273: JONES | Q273: SMYTHE
A274: WILLIAMSTOWN | C274: WARD | E274: RAEBURN | H274: FISHER | K274: PITT | N274: R DELLER | Q274: MARTIN
A275: GOALKICKERS
A276: BRUNSWICK | C276: JONES 3 | F276: SINNOTT 2 | I276: KENNEDY 2 | L276: DOWLING | N276: PALMER | P276: JAMES
A277: WILLIAMSTOWN | C277: RAEBURN 3 | F277: LAWLOR 2 | I277: PITTS | K277: THOMPSON
A279: CAMBERWELL | C279: 9 | D279: 8 | E279: =C279*6+D279 -> 62 | G279: 10 | H279: 9 | I279: =G279*6+H279 -> 69 | K279: 14 | L279: 17 | M279: =K279*6+L279 -> 101 | O279: 15 | P279: 17 | Q279: =O279*6+P279 -> 107 | S279: CAMBERWELL
A280: BRIGHTON | C280: 0 | D280: 0 | E280: =C280*6+D280 -> 0 | G280: 4 | H280: 7 | I280: =G280*6+H280 -> 31 | K280: 5 | L280: 7 | M280: =K280*6+L280 -> 37 | O280: 8 | P280: 21 | Q280: =O280*6+P280 -> 69 | S280: LESTER
A281: BEST PLAYERS
A282: CAMBERWELL | C282: WALKER | F282: DYBALL | I282: LUFF | L282: JONES | O282: WILLIAMS | R282: SCOTT
A283: BRIGHTON | C283: WEBER | F283: EVANS | I283: HINDSON | L283: MOLONEY | O283: BOLWELL | R283: MILLER
A284: GOALKICKERS
A285: CAMBERWELL | C285: LUFF 6 | F285: JONES 3 | I285: SCOTT 2 | L285: MASON 2 | O285: TATHAM | Q285: FIELD
A286: BRIGHTON | C286: MALONEY 2 | F286: DREW | H286: McLEOD | J286: BURNES | L286: BOLWELL | N286: BURTON | P286: MILLER
A288: ROUND 6 | E288: 18TH MAY | J288: WEATHER | M288: COOL CLOUDY WEST BREEZE | S288: PLAYED AT
D289: 1ST QTR | H289: 2ND QTR | L289: 3RD QTR | P289: FINAL | S289: NORTHCOTE
A290: NORTHCOTE | C290: 7 | D290: 2 | E290: =C290*6+D290 -> 44 | G290: 8 | H290: 10 | I290: =G290*6+H290 -> 58 | K290: 11 | L290: 17 | M290: =K290*6+L290 -> 83 | O290: 14 | P290: 19 | Q290: =O290*6+P290 -> 103 | S290: UMPIRE | X290: LADDER | AB290: ROUND | AD290: 6
A291: YARRAVILLE | C291: 2 | D291: 1 | E291: =C291*6+D291 -> 13 | G291: 5 | H291: 2 | I291: =G291*6+H291 -> 32 | K291: 10 | L291: 4 | M291: =K291*6+L291 -> 64 | O291: 14 | P291: 10 | Q291: =O291*6+P291 -> 94 | S291: GLOVER
A292: BEST PLAYERS | W292: TEAM | X292: W | Y292: L | Z292: D | AA292: FOR | AB292: AGST | AC292: % | AD292: PTS
A293: NORTHCOTE | C293: HASKETT | F293: PYE | H293: ROSS | K293: GOULLETT | N293: GARRETT | Q293: LUDLOW
A294: YARRAVILLE | C294: EVANS | F294: SMITH | H294: HOPKINS | K294: BLAKE | N294: RAWSON | Q294: WEDGWOOD | W294: COBURG | X294: 5 | Y294: 1 | Z294: 0 | AA294: 560 | AB294: 527 | AC294: 106.26 | AD294: 20
A295: GOALKICKERS | W295: NORTHCOTE | X295: 4 | Y295: 2 | Z295: 0 | AA295: 556 | AB295: 469 | AC295: 118.5501066098081 | AD295: 16
A296: NORTHCOTE | C296: SIMMONDS 3 | F296: ROSS 2 | H296: GUTHRIE 2 | J296: PYE 2 | L296: McINERNEY 2 | O296: MEITZKE | Q296: GRAY | R296: GOULLET | W296: BRUNSWICK | X296: 4 | Y296: 2 | Z296: 0 | AA296: 461 | AB296: 423 | AC296: 108.98 | AD296: 16
A297: YARRAVILLE | C297: J BUCKLEY 4 | F297: HOPKINS 3 | I297: KENNY 2 | K297: BLAKE 2 | M297: STREETER | O297: WEDGWOOD | R297: WILLIAMS | W297: OAKLEIGH | X297: 3 | Y297: 2 | Z297: 1 | AA297: 505 | AB297: 500 | AC297: 101 | AD297: 14
A299: BRUNSWICK | C299: 5 | D299: 4 | E299: =C299*6+D299 -> 34 | G299: 6 | H299: 5 | I299: =G299*6+H299 -> 41 | K299: 7 | L299: 13 | M299: =K299*6+L299 -> 55 | O299: 11 | P299: 16 | Q299: =O299*6+P299 -> 82 | S299: BRUNSWICK | W299: PRESTON | X299: 3 | Y299: 2 | Z299: 1 | AA299: 503 | AB299: 523 | AC299: 96.18 | AD299: 14
A300: PORT MELBOURNE | C300: 2 | D300: 1 | E300: =C300*6+D300 -> 13 | G300: 5 | H300: 5 | I300: =G300*6+H300 -> 35 | K300: 5 | L300: 9 | M300: =K300*6+L300 -> 39 | O300: 9 | P300: 13 | Q300: =O300*6+P300 -> 67 | S300: LEWIS | W300: YARRAVILLE | X300: 3 | Y300: 3 | Z300: 0 | AA300: 588 | AB300: 459 | AC300: 128.1 | AD300: 12
A301: BEST PLAYERS | W301: CAMBERWELL | X301: 3 | Y301: 3 | Z301: 0 | AA301: 577 | AB301: 469 | AC301: 123.03 | AD301: 12
A302: BRUNSWICK | C302: DOWLING | F302: JONES | I302: McELROY | L302: FAY | N302: HILL | Q302: QUINLAN | W302: PRAHRAN | X302: 3 | Y302: 3 | Z302: 0 | AA302: 512 | AB302: 431 | AC302: 118.79 | AD302: 12
A303: PORT MELBOURNE | C303: PLUMRIDGE | F303: GOMEZ | I303: BLOOMER | L303: HALL | N303: JUREY | Q303: KEATING | W303: PORT MELBOURNE | X303: 3 | Y303: 3 | Z303: 0 | AA303: 436 | AB303: 438 | AC303: 99.54 | AD303: 12
A304: GOALKICKERS | W304: BRIGHTON | X304: 2 | Y304: 4 | Z304: 0 | AA304: 553 | AB304: 586 | AC304: 94.368600682593851 | AD304: 8
A305: BRUNSWICK | C305: JONES 5 | E305: DOWLING 2 | H305: PALMER | J305: SINNOTT | M305: McELROY | P305: DONNELLY | W305: SANDRINGHAM | X305: 1 | Y305: 5 | Z305: 0 | AA305: 462 | AB305: 632 | AC305: 73.1 | AD305: 4
A306: PORT MELBOURNE | C306: BRAID 3 | E306: GOMEZ 2 | H306: RUSDEN | J306: McNAMARA | M306: KEATING | P306: PLUMRIDGE | W306: WILLIAMSTOWN | X306: 1 | Y306: 5 | Z306: 0 | AA306: 384 | AB306: 640 | AC306: 60 | AD306: 4
A308: PRESTON | C308: 5 | D308: 0 | E308: =C308*6+D308 -> 30 | G308: 7 | H308: 7 | I308: =G308*6+H308 -> 49 | K308: 14 | L308: 12 | M308: =K308*6+L308 -> 96 | O308: 17 | P308: 15 | Q308: =O308*6+P308 -> 117 | S308: PRESTON
A309: CAMBERWELL | C309: 4 | D309: 8 | E309: =C309*6+D309 -> 32 | G309: 7 | H309: 10 | I309: =G309*6+H309 -> 52 | K309: 9 | L309: 13 | M309: =K309*6+L309 -> 67 | O309: 14 | P309: 20 | Q309: =O309*6+P309 -> 104 | S309: GREGORY
A310: BEST PLAYERS
A311: PRESTON | C311: BOSCHEN | F311: CRANE | I311: SMITH | L311: DOWLING | O311: A ROBINSON | R311: WARR
A312: CAMBERWELL | C312: WILLIAMS | F312: CLAMP | I312: DYBALL | L312: MASON | O312: GRIFFITHS | R312: TATHAM
A313: GOALKICKERS
A314: PRESTON | C314: CRANE 9 | F314: BOSCHEN 3 | I314: ARTHUR 2 | L314: HUGHSON | N314: COOPER | P314: ROBINSON
A315: CAMBERWELL | C315: GRIFFITH 4 | F315: PRIEST 3 | I315: LUFF 3 | L315: TATHAM | N315: MASON | P315: TRETHOWAN | S315: FINLAYSON
A317: BRIGHTON | C317: 7 | D317: 7 | E317: =C317*6+D317 -> 49 | G317: 12 | H317: 9 | I317: =G317*6+H317 -> 81 | K317: 15 | L317: 26 | M317: =K317*6+L317 -> 116 | O317: 17 | P317: 30 | Q317: =O317*6+P317 -> 132 | S317: ELSTERNWICK PARK
A318: WILLIAMSTOWN | C318: 1 | D318: 1 | E318: =C318*6+D318 -> 7 | G318: 4 | H318: 3 | I318: =G318*6+H318 -> 27 | K318: 5 | L318: 3 | M318: =K318*6+L318 -> 33 | O318: 10 | P318: 9 | Q318: =O318*6+P318 -> 69 | S318: MILLER
A319: BEST PLAYERS
A320: BRIGHTON | C320: BOLWELL | F320: WEBER | I320: LILBURNE | L320: EVANS | O320: BOURNE | R320: DEANE
A321: WILLIAMSTOWN | C321: BROOKS | F321: TAYLOR | I321: HOLT | L321: HARSLEY | O321: MILLER | R321: McGILLIVRAY
A322: GOALKICKERS
A323: BRIGHTON | C323: DREW 4 | F323: BOLWELL 4 | I323: SULLIVAN 3 | L323: DEANE 3 | N323: MILLER 3
A324: WILLIAMSTOWN | C324: LAWLOR 4 | F324: PITTS | H324: McGILLIVRAY | K324: MOONEY | M324: POWER | O324: KNIGHTS | Q324: HYDE
A326: PRAHRAN | C326: 2 | D326: 2 | E326: =C326*6+D326 -> 14 | G326: 5 | H326: 6 | I326: =G326*6+H326 -> 36 | K326: 7 | L326: 7 | M326: =K326*6+L326 -> 49 | O326: 11 | P326: 11 | Q326: =O326*6+P326 -> 77 | S326: TOORAK PARK
A327: OAKLEIGH | C327: 1 | D327: 4 | E327: =C327*6+D327 -> 10 | G327: 2 | H327: 6 | I327: =G327*6+H327 -> 18 | K327: 6 | L327: 10 | M327: =K327*6+L327 -> 46 | O327: 6 | P327: 15 | Q327: =O327*6+P327 -> 51 | S327: HASSETT
A328: BEST PLAYERS
A329: PRAHRAN | C329: HYDE | E329: SMITH | H329: WHITE | K329: TABATEUA | N329: JOHNSON | Q329: MUNN
A330: OAKLEIGH | C330: MUDGE | E330: HEINTZ | H330: POWELL | K330: KIDD | N330: BAWDEN | Q330: CHAPMAN
A331: GOALKICKERS
A332: PRAHRAN | C332: GRANDISON 4 | F332: MUNN 2 | I332: WHITE | K332: ANDERSON | N332: WILLIAMS | Q332: SMITH | S332: MURRAY
A333: OAKLEIGH | C333: BAWDEN 3 | F333: FRASER | I333: HEINTZ | K333: CHAPMAN
A335: COBURG | C335: 7 | D335: 3 | E335: =C335*6+D335 -> 45 | G335: 8 | H335: 7 | I335: =G335*6+H335 -> 55 | K335: 15 | L335: 14 | M335: =K335*6+L335 -> 104 | O335: 17 | P335: 16 | Q335: =O335*6+P335 -> 118 | S335: BEACH ROAD
A336: SANDRINGHAM | C336: 2 | D336: 2 | E336: =C336*6+D336 -> 14 | G336: 10 | H336: 6 | I336: =G336*6+H336 -> 66 | K336: 10 | L336: 8 | M336: =K336*6+L336 -> 68 | O336: 15 | P336: 12 | Q336: =O336*6+P336 -> 102 | S336: WHITBURN
A337: BEST PLAYERS
A338: COBURG | C338: McFARLANE | F338: DUNCAN | I338: RALSTON | L338: JOYCE | O338: HENNING | R338: KNOTT
A339: SANDRINGHAM | C339: KEMP | F339: DOWLING | I339: TOLSON | L339: THOMS | O339: GILLIGAN | R339: CAMPBELL
A340: GOALKICKERS
A341: COBURG | C341: DUNCAN 7 | F341: LE FANNUE 2 | I341: HARRIS 2 | L341: MALCOLM 2 | O341: JOYCE 2 | Q341: KIGHT | S341: RALSTON
A342: SANDRINGHAM | C342: DOWLING 3 | F342: McCONVILLE 3 | I342: McCONCHIE 2 | L342: POUND 2 | N342: JONES 2 | P342: SMAIL | R342: McCOMB | U342: KEMP
A344: ROUND 7 | E344: 25TH MAY | J344: WEATHER | M344: CLOUDY BUT FINE S.E.BREEZE | S344: PLAYED AT
D345: 1ST QTR | H345: 2ND QTR | L345: 3RD QTR | P345: FINAL | S345: OAKLEIGH
A346: NORTHCOTE | C346: 4 | D346: 3 | E346: =C346*6+D346 -> 27 | G346: 6 | H346: 8 | I346: =G346*6+H346 -> 44 | K346: 12 | L346: 15 | M346: =K346*6+L346 -> 87 | O346: 15 | P346: 21 | Q346: =O346*6+P346 -> 111 | S346: UMPIRE | X346: LADDER | AB346: ROUND | AD346: 7
A347: OAKLEIGH | C347: 5 | D347: 6 | E347: =C347*6+D347 -> 36 | G347: 8 | H347: 10 | I347: =G347*6+H347 -> 58 | K347: 11 | L347: 12 | M347: =K347*6+L347 -> 78 | O347: 12 | P347: 15 | Q347: =O347*6+P347 -> 87 | S347: WHITBURN
A348: BEST PLAYERS | W348: TEAM | X348: W | Y348: L | Z348: D | AA348: FOR | AB348: AGST | AC348: % | AD348: PTS
A349: NORTHCOTE | C349: MEITZCKE | F349: PYE | I349: BATES | L349: GRAY | N349: ROSS | Q349: ACKLAND
A350: OAKLEIGH | C350: WITHERS | F350: FRASER | I350: WATSON | L350: KIDD | N350: CHAPMAN | Q350: BAWDEN | W350: COBURG | X350: 5 | Y350: 1 | Z350: 1 | AA350: 639 | AB350: 606 | AC350: 105.45 | AD350: 22
A351: GOALKICKERS | W351: NORTHCOTE | X351: 5 | Y351: 2 | Z351: 0 | AA351: 667 | AB351: 556 | AC351: 119.96 | AD351: 20
A352: NORTHCOTE | C352: GRAY 5 | F352: PYE 3 | H352: MEITZKE 2 | K352: GOULLET 2 | N352: SIMMONDS | Q352: ROSS | R352: LUDLOW | W352: BRUNSWICK | X352: 5 | Y352: 2 | Z352: 0 | AA352: 574 | AB352: 497 | AC352: 115.49 | AD352: 20
A353: OAKLEIGH | C353: FRASER 7 | F353: CHAPMAN 2 | I353: HEINTZ | K353: BAWDON | M353: WAKEMAN | W353: YARRAVILLE | X353: 4 | Y353: 3 | Z353: 0 | AA353: 740 | AB353: 513 | AC353: 144.25 | AD353: 16
A355: CAMBERWELL | C355: 1 | D355: 6 | E355: =C355*6+D355 -> 12 | G355: 7 | H355: 10 | I355: =G355*6+H355 -> 52 | K355: 11 | L355: 13 | M355: =K355*6+L355 -> 79 | O355: 13 | P355: 15 | Q355: =O355*6+P355 -> 93 | S355: CAMBERWELL | W355: CAMBERWELL | X355: 4 | Y355: 3 | Z355: 0 | AA355: 670 | AB355: 554 | AC355: 120.94 | AD355: 16
A356: PRAHRAN | C356: 3 | D356: 6 | E356: =C356*6+D356 -> 24 | G356: 3 | H356: 9 | I356: =G356*6+H356 -> 27 | K356: 8 | L356: 10 | M356: =K356*6+L356 -> 58 | O356: 12 | P356: 13 | Q356: =O356*6+P356 -> 85 | S356: HASSETT | W356: PORT MELBOURNE | X356: 3 | Y356: 3 | Z356: 1 | AA356: 515 | AB356: 517 | AC356: 99.61 | AD356: 14
A357: BEST PLAYERS | W357: OAKLEIGH | X357: 3 | Y357: 3 | Z357: 1 | AA357: 592 | AB357: 611 | AC357: 96.89 | AD357: 14
A358: CAMBERWELL | C358: TATHAM | F358: LUFF | H358: WILLIAMS | K358: JONES | N358: FIELD | Q358: FINLAYSON | W358: PRESTON | X358: 3 | Y358: 3 | Z358: 1 | AA358: 567 | AB358: 622 | AC358: 91.16 | AD358: 14
A359: PRAHRAN | C359: TABATEAU | F359: HYDE | H359: KOOP | K359: GRANDISON | N359: WHITEHEAD | Q359: HAWKER | W359: PRAHRAN | X359: 3 | Y359: 4 | Z359: 0 | AA359: 597 | AB359: 524 | AC359: 113.93 | AD359: 12
A360: GOALKICKERS | W360: BRIGHTON | X360: 2 | Y360: 5 | Z360: 0 | AA360: 627 | AB360: 699 | AC360: 89.699570815450642 | AD360: 8
A361: CAMBERWELL | C361: LUFF 6 | F361: TATHAM 4 | I361: GRIFFITH | K361: MASON | N361: WILLIAMS | W361: WILLIAMSTOWN | X361: 2 | Y361: 5 | Z361: 0 | AA361: 483 | AB361: 704 | AC361: 68.61 | AD361: 8
A362: PRAHRAN | C362: MUNN 3 | E362: GRANDISON 2 | H362: HYDE 2 | J362: MURRAY 2 | M362: ANDERSON | O362: WILTSHIRE | R362: HAWKER | W362: SANDRINGHAM | X362: 1 | Y362: 6 | Z362: 0 | AA362: 516 | AB362: 784 | AC362: 65.82 | AD362: 4
A364: YARRAVILLE | C364: 4 | D364: 5 | E364: =C364*6+D364 -> 29 | G364: 8 | H364: 10 | I364: =G364*6+H364 -> 58 | K364: 16 | L364: 15 | M364: =K364*6+L364 -> 111 | O364: 22 | P364: 20 | Q364: =O364*6+P364 -> 152 | S364: YARRAVILLE
A365: SANDRINGHAM | C365: 3 | D365: 3 | E365: =C365*6+D365 -> 21 | G365: 5 | H365: 5 | I365: =G365*6+H365 -> 35 | K365: 5 | L365: 8 | M365: =K365*6+L365 -> 38 | O365: 7 | P365: 12 | Q365: =O365*6+P365 -> 54 | S365: HUTCHINSON
A366: BEST PLAYERS
A367: YARRAVILLE | C367: HOPKINS | F367: J BUCKLEY | I367: WARDEN | L367: SMITH | O367: R EVANS | R367: I EVANS
A368: SANDRINGHAM | C368: DOCKENDORFF | F368: McCOMB | I368: CHRISTIE | L368: CAMPBELL | O368: POLLARD | R368: MILLER
A369: GOALKICKERS
A370: YARRAVILLE | C370: WARDEN 6 | F370: BUCKLEY 4 | I370: WEDGWOOD 4 | L370: WILLIAMS 2 | O370: BLAKE 2 | Q370: KENNY 2 | S370: R EVANS | V370: I EVANS
A371: SANDRINGHAM | C371: McCONCHIE 2 | F371: McCOMB 2 | I371: POUND | K371: DOCKENDORFF | N371: POLLARD
A373: WILLIAMSTOWN | C373: 2 | D373: 2 | E373: =C373*6+D373 -> 14 | G373: 7 | H373: 8 | I373: =G373*6+H373 -> 50 | K373: 9 | L373: 11 | M373: =K373*6+L373 -> 65 | O373: 14 | P373: 15 | Q373: =O373*6+P373 -> 99 | S373: WILLIAMSTOWN
A374: PRESTON | C374: 3 | D374: 7 | E374: =C374*6+D374 -> 25 | G374: 4 | H374: 9 | I374: =G374*6+H374 -> 33 | K374: 5 | L374: 12 | M374: =K374*6+L374 -> 42 | O374: 8 | P374: 16 | Q374: =O374*6+P374 -> 64 | S374: DAVENPORT
A375: BEST PLAYERS
A376: WILLIAMSTOWN | C376: BROOKS | F376: HYDE | I376: LAWLOR | L376: KNIGHT | O376: CUTTING | R376: PITTS
A377: PRESTON | C377: McCLELLAND | F377: UNDERHILL | I377: HARDING | L377: CAMERON | O377: W ROBINSON | R377: DAVIS
A378: GOALKICKERS
A379: WILLIAMSTOWN | C379: LAWLOR 3 | F379: KNIGHTS 3 | I379: HYDE 3 | K379: PITTS 2 | M379: ANDREWS | O379: THOMPSON | R379: DREW
A380: PRESTON | C380: WARR 2 | F380: HUGHSON 2 | I380: McCLELLAND 2 | M380: ARTHUR | O380: CRANE
A382: BRUNSWICK | C382: 6 | D382: 3 | E382: =C382*6+D382 -> 39 | G382: 8 | H382: 6 | I382: =G382*6+H382 -> 54 | K382: 12 | L382: 8 | M382: =K382*6+L382 -> 80 | O382: 17 | P382: 11 | Q382: =O382*6+P382 -> 113 | S382: BRUNSWICK
A383: BRIGHTON | C383: 1 | D383: 2 | E383: =C383*6+D383 -> 8 | G383: 5 | H383: 4 | I383: =G383*6+H383 -> 34 | K383: 6 | L383: 10 | M383: =K383*6+L383 -> 46 | O383: 10 | P383: 14 | Q383: =O383*6+P383 -> 74 | S383: GLOVER
A384: BEST PLAYERS
A385: BRUNSWICK | C385: DOWLING | F385: FAY | I385: LEE | L385: BOYD | O385: SEVIOR | R385: DONNELLY
A386: BRIGHTON | C386: DREW | F386: SHERLOCK | I386: HALLAHAN | L386: BURNES | O386: EVANS | R386: BURTON
A387: GOALKICKERS
A388: BRUNSWICK | C388: GILLON 4 | F388: McELROY 4 | I388: DOWLING 3 | L388: BOYD 2 | N388: ELLAWAY 2 | Q388: HILL | R388: MITCHELL
A389: BRIGHTON | C389: SULLIVAN 2 | F389: DREW 2 | H389: BURNES 2 | J389: DEANE | L389: BOLWELL | N389: LILBURNE | Q389: MILLER
A391: PORT MELBOURNE | C391: 3 | D391: 3 | E391: =C391*6+D391 -> 21 | G391: 5 | H391: 6 | I391: =G391*6+H391 -> 36 | K391: 9 | L391: 8 | M391: =K391*6+L391 -> 62 | O391: 11 | P391: 13 | Q391: =O391*6+P391 -> 79 | S391: PORT MELBOURNE
A392: COBURG | C392: 3 | D392: 2 | E392: =C392*6+D392 -> 20 | G392: 5 | H392: 4 | I392: =G392*6+H392 -> 34 | K392: 9 | L392: 8 | M392: =K392*6+L392 -> 62 | O392: 11 | P392: 13 | Q392: =O392*6+P392 -> 79 | S392: GREGORY
A393: BEST PLAYERS
A394: PORT MELBOURNE | C394: BLOOMER | F394: KEATING | I394: GOTZ | L394: CRAWSHAW | O394: GOMEZ | R394: PLUMRIDGE
A395: COBURG | C395: LE FANNUE | F395: HENNING | I395: DUNCAN | L395: MOSS | O395: VOIGHT | R395: REITSCHEL
A396: GOALKICKERS
A397: PORT MELBOURNE | C397: GOMEZ 3 | F397: KEATING 2 | I397: GOTZ 2 | K397: TYSON 2 | M397: CRAWSHAW | P397: JUREY
A398: COBURG | C398: DUNCAN 3 | F398: LE FANNUE 3 | I398: HENNING 2 | L398: MALCOLM 2 | O398: RALSTON
A400: ROUND 8 | E400: 1ST JUNE | J400: WEATHER | M400: COLD CLOUDY S.W. WIND | S400: PLAYED AT
D401: 1ST QTR | H401: 2ND QTR | L401: 3RD QTR | P401: FINAL | S401: PRESTON
A402: PRESTON | C402: 4 | D402: 1 | E402: =C402*6+D402 -> 25 | G402: 7 | H402: 2 | I402: =G402*6+H402 -> 44 | K402: 11 | L402: 8 | M402: =K402*6+L402 -> 74 | O402: 12 | P402: 12 | Q402: =O402*6+P402 -> 84 | S402: UMPIRE | X402: LADDER | AB402: ROUND | AD402: 8
A403: BRUNSWICK | C403: 3 | D403: 5 | E403: =C403*6+D403 -> 23 | G403: 5 | H403: 7 | I403: =G403*6+H403 -> 37 | K403: 6 | L403: 7 | M403: =K403*6+L403 -> 43 | O403: 11 | P403: 10 | Q403: =O403*6+P403 -> 76 | S403: HUTCHINSON
A404: BEST PLAYERS | W404: TEAM | X404: W | Y404: L | Z404: D | AA404: FOR | AB404: AGST | AC404: % | AD404: PTS
A405: PRESTON | C405: MUIR | F405: HARDING | I405: DOWLING | L405: CRANE | N405: HUGHSON | Q405: DART
A406: BRUNSWICK | C406: McELROY | F406: PALMER | I406: ELSON | L406: FAY | N406: DOWLING | Q406: JONES | W406: NORTHCOTE | X406: 6 | Y406: 2 | Z406: 0 | AA406: 768 | AB406: 639 | AC406: 120.19 | AD406: 24
A407: GOALKICKERS | W407: COBURG | X407: 5 | Y407: 2 | Z407: 1 | AA407: 720 | AB407: 697 | AC407: 103.3 | AD407: 22
A408: PRESTON | C408: CRANE 4 | F408: HUGHSON 3 | I408: WARR 2 | K408: CLARKE | M408: DART | O408: FARRELL | W408: YARRAVILLE | X408: 5 | Y408: 3 | Z408: 0 | AA408: 831 | AB408: 594 | AC408: 139.9 | AD408: 20
A409: BRUNSWICK | C409: McELROY 5 | F409: JONES 2 | I409: PALMER 2 | L409: GILLON | N409: BOYD | W409: BRUNSWICK | X409: 5 | Y409: 3 | Z409: 0 | AA409: 650 | AB409: 581 | AC409: 111.88 | AD409: 20
A411: PRAHRAN | C411: 4 | D411: 3 | E411: =C411*6+D411 -> 27 | G411: 7 | H411: 7 | I411: =G411*6+H411 -> 49 | K411: 17 | L411: 12 | M411: =K411*6+L411 -> 114 | O411: 24 | P411: 15 | Q411: =O411*6+P411 -> 159 | S411: TOORAK PARK | W411: PORT MELBOURNE | X411: 4 | Y411: 3 | Z411: 1 | AA411: 602 | AB411: 598 | AC411: 100.67 | AD411: 18
A412: WILLIAMSTOWN | C412: 4 | D412: 3 | E412: =C412*6+D412 -> 27 | G412: 6 | H412: 4 | I412: =G412*6+H412 -> 40 | K412: 8 | L412: 4 | M412: =K412*6+L412 -> 52 | O412: 9 | P412: 6 | Q412: =O412*6+P412 -> 60 | S412: WHITBURN | W412: PRESTON | X412: 4 | Y412: 3 | Z412: 1 | AA412: 651 | AB412: 698 | AC412: 93.27 | AD412: 18
A413: BEST PLAYERS | W413: PRAHRAN | X413: 4 | Y413: 4 | Z413: 0 | AA413: 756 | AB413: 584 | AC413: 129.45 | AD413: 16
A414: PRAHRAN | C414: GRANDISON | F414: HYDE | I414: KLYNE | K414: WHITE | N414: JOHNSON | Q414: TABATEAU | W414: CAMBERWELL | X414: 4 | Y414: 4 | Z414: 0 | AA414: 753 | AB414: 655 | AC414: 114.96 | AD414: 16
A415: WILLIAMSTOWN | C415: LAWLOR | F415: BROOKS | I415: KNIGHT | K415: TAYLOR | N415: McGILLIVRAY | Q415: WARD | W415: OAKLEIGH | X415: 3 | Y415: 4 | Z415: 1 | AA415: 695 | AB415: 730 | AC415: 95.21 | AD415: 14
A416: GOALKICKERS | W416: BRIGHTON | X416: 2 | Y416: 6 | Z416: 0 | AA416: 708 | AB416: 786 | AC416: 90.07633587786259 | AD416: 8
A417: PRAHRAN | C417: GRANDISON 11 | F417: KLYNE 4 | I417: JOHNSON 4 | L417: BRENCHLEY 3 | O417: WHITE | Q417: MURRAY | W417: SANDRINGHAM | X417: 2 | Y417: 6 | Z417: 0 | AA417: 635 | AB417: 887 | AC417: 71.59 | AD417: 8
A418: WILLIAMSTOWN | C418: LAWLOR 5 | F418: PITTS | I418: McGILLIVRAY | L418: KNIGHTS | O418: HYDE | W418: WILLIAMSTOWN | X418: 2 | Y418: 6 | Z418: 0 | AA418: 543 | AB418: 863 | AC418: 62.92 | AD418: 8
A420: SANDRINGHAM | C420: 5 | D420: 2 | E420: =C420*6+D420 -> 32 | G420: 8 | H420: 3 | I420: =G420*6+H420 -> 51 | K420: 13 | L420: 6 | M420: =K420*6+L420 -> 84 | O420: 18 | P420: 11 | Q420: =O420*6+P420 -> 119 | S420: BEACH ROAD
A421: OAKLEIGH | C421: 3 | D421: 3 | E421: =C421*6+D421 -> 21 | G421: 7 | H421: 4 | I421: =G421*6+H421 -> 46 | K421: 13 | L421: 6 | M421: =K421*6+L421 -> 84 | O421: 16 | P421: 7 | Q421: =O421*6+P421 -> 103 | S421: CLAYTON
A422: BEST PLAYERS
A423: SANDRINGHAM | C423: DOCKENDORFF | F423: McCOMB | I423: MILLER | L423: TOLSON | O423: McCONCHIE | R423: CAMPBELL
A424: OAKLEIGH | C424: KIDD | F424: WITHERS | I424: FRASER | L424: HARRISON | O424: PLUMMER | R424: BAWDEN
A425: GOALKICKERS
A426: SANDRINGHAM | C426: McCONCHIE 4 | F426: McCOMB 4 | I426: TOLSON 2 | K426: SMAIL 2 | M426: POLLARD 2 | P426: WITCHELL 2 | S426: POUND | U426: DOCKENDORFF
A427: OAKLEIGH | C427: FRASER 7 | F427: HARRISON 4 | I427: BAWDEN 3 | L427: WAKEMAN | O427: HICKS
E428: 3RD JUNE | J428: WEATHER | M428: FINE NORTH BREEZE
A429: YARRAVILLE | C429: 2 | D429: 5 | E429: =C429*6+D429 -> 17 | G429: 3 | H429: 12 | I429: =G429*6+H429 -> 30 | K429: 7 | L429: 14 | M429: =K429*6+L429 -> 56 | O429: 12 | P429: 19 | Q429: =O429*6+P429 -> 91 | S429: COBURG
A430: COBURG | C430: 0 | D430: 4 | E430: =C430*6+D430 -> 4 | G430: 3 | H430: 8 | I430: =G430*6+H430 -> 26 | K430: 6 | L430: 12 | M430: =K430*6+L430 -> 48 | O430: 11 | P430: 15 | Q430: =O430*6+P430 -> 81 | S430: GLOVER
A431: BEST PLAYERS
A432: YARRAVILLE | C432: WARDEN | F432: FREW | I432: HOPKINS | L432: R EVANS | O432: R SMITH | R432: G EVANS
A433: COBURG | C433: DUNCAN | F433: RALSTON | I433: VOIGHT | L433: McFARLANE | O433: REITSCHELL | R433: HARRIS
A434: GOALKICKERS
A435: YARRAVILLE | C435: HOPKINS 3 | F435: WEDGWOOD 2 | I435: WILLIAMS 2 | L435: J BUCKLEY | N435: WARDEN | P435: KENNY | R435: I EVANS | U435: R EVANS
A436: COBURG | C436: DUNCAN 3 | F436: HARRIS 3 | I436: LE FANNUE 2 | L436: VOIGHT | N436: RALSTON | P436: MALCOLM
A438: NORTHCOTE | C438: 2 | D438: 5 | E438: =C438*6+D438 -> 17 | G438: 6 | H438: 8 | I438: =G438*6+H438 -> 44 | K438: 9 | L438: 17 | M438: =K438*6+L438 -> 71 | O438: 13 | P438: 23 | Q438: =O438*6+P438 -> 101 | S438: NORTHCOTE
A439: CAMBERWELL | C439: 6 | D439: 2 | E439: =C439*6+D439 -> 38 | G439: 10 | H439: 4 | I439: =G439*6+H439 -> 64 | K439: 11 | L439: 10 | M439: =K439*6+L439 -> 76 | O439: 12 | P439: 11 | Q439: =O439*6+P439 -> 83 | S439: GREGORY
A440: BEST PLAYERS
A441: NORTHCOTE | C441: GOULLETT | F441: PYE | I441: ROSS | L441: ACKLAND | O441: SIMMONDS | R441: GARRETT
A442: CAMBERWELL | C442: WILLIAMS | F442: LUFF | I442: VANTHOFF | L442: BILLETT | O442: WALKER | R442: FIELD
A443: GOALKICKERS
A444: NORTHCOTE | C444: GOULLET 5 | F444: ACKLAND 4 | I444: PYE 2 | K444: SIMMONDS | N444: WILLIAMSON
A445: CAMBERWELL | C445: LUFF 3 | E445: GRIFFITH 2 | H445: FIELD 2 | J445: VANTHOFF 2 | M445: TATHAM | O445: JONES | Q445: HOLT
A447: PORT MELBOURNE | C447: 1 | D447: 4 | E447: =C447*6+D447 -> 10 | G447: 4 | H447: 11 | I447: =G447*6+H447 -> 35 | K447: 6 | L447: 11 | M447: =K447*6+L447 -> 47 | O447: 12 | P447: 15 | Q447: =O447*6+P447 -> 87 | S447: ELSTERNWICK PARK
A448: BRIGHTON | C448: 2 | D448: 4 | E448: =C448*6+D448 -> 16 | G448: 4 | H448: 6 | I448: =G448*6+H448 -> 30 | K448: 10 | L448: 8 | M448: =K448*6+L448 -> 68 | O448: 12 | P448: 9 | Q448: =O448*6+P448 -> 81 | S448: SCATES
A449: BEST PLAYERS
A450: PORT MELBOURNE | C450: BROOKER | F450: KEATING | I450: SHAPTER | L450: TYSON | O450: BLOOMER | R450: PLUMRIDGE
A451: BRIGHTON | C451: SULLIVAN | F451: KINNIBURGH | I451: MILLER | L451: WEBER | O451: BOLWELL | R451: DEANE
A452: GOALKICKERS
A453: PORT MELBOURNE | C453: TYSON 3 | F453: KEATING 2 | I453: CRAWSHAW 2 | L453: MALTBY | N453: ATKINSON | Q453: GOTZ | S453: JUREY | U453: SHAPTER
A454: BRIGHTON | C454: SULLIVAN 2 | F454: DEANE 2 | I454: BOURNE 2 | L454: McLEOD | N454: LILBURNE | Q454: TOMLINS
A456: ROUND 9 | E456: 8TH JUNE | J456: WEATHER | M456: SHOWERS N.W. WIND | S456: PLAYED AT
D457: 1ST QTR | H457: 2ND QTR | L457: 3RD QTR | P457: FINAL | S457: PORT MELBOURNE
A458: YARRAVILLE | C458: 3 | D458: 6 | E458: =C458*6+D458 -> 24 | G458: 6 | H458: 10 | I458: =G458*6+H458 -> 46 | K458: 10 | L458: 15 | M458: =K458*6+L458 -> 75 | O458: 11 | P458: 19 | Q458: =O458*6+P458 -> 85 | S458: UMPIRE | X458: LADDER | AB458: ROUND | AD458: 9
A459: PORT MELBOURNE | C459: 2 | D459: 1 | E459: =C459*6+D459 -> 13 | G459: 5 | H459: 3 | I459: =G459*6+H459 -> 33 | K459: 6 | L459: 7 | M459: =K459*6+L459 -> 43 | O459: 12 | P459: 10 | Q459: =O459*6+P459 -> 82 | S459: GLOVER
A460: BEST PLAYERS | W460: TEAM | X460: W | Y460: L | Z460: D | AA460: FOR | AB460: AGST | AC460: % | AD460: PTS
A461: YARRAVILLE | C461: WARDEN | F461: BLAKE | I461: HOPKINS | L461: McGRATH | O461: R EVANS | Q461: RYAN
A462: PORT MELBOURNE | C462: KEATING | F462: GOMEZ | I462: GOTZ | L462: BLOOMER | O462: BRAID | Q462: PLUMRIDGE | W462: NORTHCOTE | X462: 7 | Y462: 2 | Z462: 0 | AA462: 891 | AB462: 693 | AC462: 128.57 | AD462: 28
A463: GOALKICKERS | W463: YARRAVILLE | X463: 6 | Y463: 3 | Z463: 0 | AA463: 916 | AB463: 676 | AC463: 135.5 | AD463: 24
A464: YARRAVILLE | C464: J BUCKLEY 3 | F464: McGRATH 2 | I464: WILLIAMS 2 | L464: WARDEN 2 | O464: KENNY 2 | W464: BRUNSWICK | X464: 6 | Y464: 3 | Z464: 0 | AA464: 716 | AB464: 630 | AC464: 113.65 | AD464: 24
A465: PORT MELBOURNE | C465: TYSON 7 | F465: KEATING | I465: GOMEZ | L465: GOTZ | N465: CRAWSHAW | Q465: BROOKER | W465: COBURG | X465: 5 | Y465: 3 | Z465: 1 | AA465: 812 | AB465: 802 | AC465: 101.25 | AD465: 22
A467: BRUNSWICK | C467: 3 | D467: 4 | E467: =C467*6+D467 -> 22 | G467: 3 | H467: 5 | I467: =G467*6+H467 -> 23 | K467: 7 | L467: 8 | M467: =K467*6+L467 -> 50 | O467: 9 | P467: 12 | Q467: =O467*6+P467 -> 66 | S467: BRUNSWICK | W467: PRESTON | X467: 5 | Y467: 3 | Z467: 1 | AA467: 751 | AB467: 774 | AC467: 97.03 | AD467: 22
A468: PRAHRAN | C468: 1 | D468: 3 | E468: =C468*6+D468 -> 9 | G468: 2 | H468: 8 | I468: =G468*6+H468 -> 20 | K468: 3 | L468: 11 | M468: =K468*6+L468 -> 29 | O468: 6 | P468: 13 | Q468: =O468*6+P468 -> 49 | S468: SCATES | W468: CAMBERWELL | X468: 5 | Y468: 4 | Z468: 0 | AA468: 890 | AB468: 721 | AC468: 123.44 | AD468: 20
A469: BEST PLAYERS | W469: PORT MELBOURNE | X469: 4 | Y469: 4 | Z469: 1 | AA469: 684 | AB469: 683 | AC469: 100.15 | AD469: 18
A470: BRUNSWICK | C470: FAY | E470: McELROY | H470: JENKINS | K470: ELLAWAY | N470: GILLON | Q470: JONES | W470: OAKLEIGH | X470: 4 | Y470: 4 | Z470: 1 | AA470: 800 | AB470: 822 | AC470: 97.32 | AD470: 18
A471: PRAHRAN | C471: KOOP | E471: SHARPLEY | H471: WHITE | K471: WILLIAMS | N471: WHITEHEAD | Q471: GRANDISON | W471: PRAHRAN | X471: 4 | Y471: 5 | Z471: 0 | AA471: 805 | AB471: 650 | AC471: 123.85 | AD471: 16
A472: GOALKICKERS | W472: BRIGHTON | X472: 2 | Y472: 7 | Z472: 0 | AA472: 784 | AB472: 886 | AC472: 88.487584650112865 | AD472: 8
A473: BRUNSWICK | C473: DONNELLY 2 | F473: JONES 2 | I473: GILLON 2 | K473: McELROY 2 | N473: BOYD | W473: SANDRINGHAM | X473: 2 | Y473: 7 | Z473: 0 | AA473: 701 | AB473: 1024 | AC473: 68.46 | AD473: 8
A474: PRAHRAN | C474: JOHNSON 2 | F474: WILLIAMS 2 | I474: GRANDISON | L474: ANDERSON | W474: WILLIAMSTOWN | X474: 2 | Y474: 7 | Z474: 0 | AA474: 597 | AB474: 986 | AC474: 60.55 | AD474: 8
A476: PRESTON | C476: 1 | D476: 0 | E476: =C476*6+D476 -> 6 | G476: 6 | H476: 7 | I476: =G476*6+H476 -> 43 | K476: 6 | L476: 10 | M476: =K476*6+L476 -> 46 | O476: 14 | P476: 16 | Q476: =O476*6+P476 -> 100 | S476: ELSTERNWICK PARK
A477: BRIGHTON | C477: 3 | D477: 5 | E477: =C477*6+D477 -> 23 | G477: 3 | H477: 6 | I477: =G477*6+H477 -> 24 | K477: 10 | L477: 10 | M477: =K477*6+L477 -> 70 | O477: 11 | P477: 10 | Q477: =O477*6+P477 -> 76 | S477: FRICKE
A478: BEST PLAYERS
A479: PRESTON | C479: CRANE | F479: CLARKE | I479: HARDING | L479: HUGHSON | O479: COOPER | Q479: WARR
A480: BRIGHTON | C480: McLEOD | F480: WEBER | I480: DEANE | L480: SULLIVAN | O480: DREW | Q480: EVANS
A481: GOALKICKERS
A482: PRESTON | C482: CRANE 3 | F482: WARR 2 | I482: HUGHSON 2 | L482: COOPER 2 | N482: HARDING 2 | Q482: ARTHUR | S482: DART | U482: FARRELL
A483: BRIGHTON | C483: SULLIVAN 3 | F483: DREW 2 | I483: MILLER 2 | L483: DEANE | N483: McLEOD | P483: MALONEY | S483: FORBES
A485: CAMBERWELL | C485: 8 | D485: 5 | E485: =C485*6+D485 -> 53 | G485: 9 | H485: 8 | I485: =G485*6+H485 -> 62 | K485: 20 | L485: 16 | M485: =K485*6+L485 -> 136 | O485: 20 | P485: 17 | Q485: =O485*6+P485 -> 137 | S485: CAMBERWELL
A486: SANDRINGHAM | C486: 2 | D486: 1 | E486: =C486*6+D486 -> 13 | G486: 5 | H486: 5 | I486: =G486*6+H486 -> 35 | K486: 5 | L486: 5 | M486: =K486*6+L486 -> 35 | O486: 9 | P486: 12 | Q486: =O486*6+P486 -> 66 | S486: McMILLAN
A487: BEST PLAYERS
A488: CAMBERWELL | C488: LUFF | F488: JONES | I488: WILLIAMS | L488: BRETT | O488: TATHAM | R488: BRIGGS
A489: SANDRINGHAM | C489: DOCKENDORFF | F489: THOMS | I489: GILLIGAN | L489: A CHRISTIE | O489: McCONCHIE | R489: CAMPBELL
A490: GOALKICKERS
A491: CAMBERWELL | C491: LUFF 8 | F491: JONES 6 | I491: TATHAM 2 | L491: FIELD | N491: TRETHOWAN | Q491: VANTHOFF | T491: HENDERSON
A492: SANDRINGHAM | C492: McCONCHIE 4 | F492: DOCKENDORFF 2 | J492: TOLSON | L492: CHRISTIE | N492: McCOMB
A494: OAKLEIGH | C494: 2 | D494: 3 | E494: =C494*6+D494 -> 15 | G494: 4 | H494: 6 | I494: =G494*6+H494 -> 30 | K494: 8 | L494: 13 | M494: =K494*6+L494 -> 61 | O494: 15 | P494: 15 | Q494: =O494*6+P494 -> 105 | S494: OAKLEIGH
A495: COBURG | C495: 4 | D495: 1 | E495: =C495*6+D495 -> 25 | G495: 8 | H495: 6 | I495: =G495*6+H495 -> 54 | K495: 8 | L495: 7 | M495: =K495*6+L495 -> 55 | O495: 14 | P495: 8 | Q495: =O495*6+P495 -> 92 | S495: GREGORY
A496: BEST PLAYERS
A497: OAKLEIGH | C497: KIDD | F497: WATSON | I497: HEINTZ | L497: WITHERS | O497: YANN | R497: HARRISON
A498: COBURG | C498: LE FANNUE | F498: HENNING | I498: VOIGHT | L498: RALSTON | O498: BROWN | R498: KIGHT
A499: GOALKICKERS
A500: OAKLEIGH | C500: FRASER 3 | F500: HARRISON 3 | I500: KIDD 3 | K500: HEINTZ 2 | M500: MORRISON 2 | P500: BAKER | R500: CHAPMAN
A501: COBURG | C501: LE FANNUE 5 | F501: BROWN 4 | I501: DUNCAN 3 | L501: HENNING | N501: McFARLANE
A503: NORTHCOTE | C503: 3 | D503: 3 | E503: =C503*6+D503 -> 21 | G503: 9 | H503: 7 | I503: =G503*6+H503 -> 61 | K503: 13 | L503: 10 | M503: =K503*6+L503 -> 88 | O503: 18 | P503: 15 | Q503: =O503*6+P503 -> 123 | S503: NORTHCOTE
A504: WILLIAMSTOWN | C504: 0 | D504: 5 | E504: =C504*6+D504 -> 5 | G504: 3 | H504: 5 | I504: =G504*6+H504 -> 23 | K504: 6 | L504: 11 | M504: =K504*6+L504 -> 47 | O504: 7 | P504: 12 | Q504: =O504*6+P504 -> 54 | S504: CLAYTON
A505: BEST PLAYERS
A506: NORTHCOTE | C506: GRAY | E506: ROSS | H506: MEITZCKE | K506: LAWRENCE | N506: WOODS | Q506: PYE
A507: WILLIAMSTOWN | C507: BROOKS | E507: MARTIN | H507: KNIGHT | K507: HARSLEY | N507: LEWER | Q507: CUTTING
A508: GOALKICKERS
A509: NORTHCOTE | C509: GRAY 3 | E509: ACKLAND 3 | H509: ROSS 3 | J509: GOULLET 3 | M509: PYE 3 | O509: BATES 2 | Q509: GARRETT
A510: WILLIAMSTOWN | C510: DREW 2 | E510: LAWLOR 2 | H510: LEWER | J510: KNIGHTS | L510: WARD
A512: ROUND 10 | E512: 15TH JUNE | J512: WEATHER | M512: CLOUDY STRONG N.W. WIND | S512: PLAYED AT
D513: 1ST QTR | H513: 2ND QTR | L513: 3RD QTR | P513: FINAL | S513: NORTHCOTE
A514: NORTHCOTE | C514: 3 | D514: 7 | E514: =C514*6+D514 -> 25 | G514: 8 | H514: 9 | I514: =G514*6+H514 -> 57 | K514: 11 | L514: 14 | M514: =K514*6+L514 -> 80 | O514: 13 | P514: 17 | Q514: =O514*6+P514 -> 95 | S514: UMPIRE | X514: LADDER | AB514: ROUND | AD514: 10
A515: BRUNSWICK | C515: 4 | D515: 0 | E515: =C515*6+D515 -> 24 | G515: 7 | H515: 1 | I515: =G515*6+H515 -> 43 | K515: 8 | L515: 4 | M515: =K515*6+L515 -> 52 | O515: 11 | P515: 13 | Q515: =O515*6+P515 -> 79 | S515: GLOVER
A516: BEST PLAYERS | W516: TEAM | X516: W | Y516: L | Z516: D | AA516: FOR | AB516: AGST | AC516: % | AD516: PTS
A517: NORTHCOTE | C517: PYE | E517: GOULLETT | H517: ROSS | K517: LYNGCOLN | N517: GARRETT | Q517: POWELL
A518: BRUNSWICK | C518: FAY | E518: DONNELLY | H518: McKERNAN | K518: JONES | N518: DOWLING | Q518: ELLAWAY | W518: NORTHCOTE | X518: 8 | Y518: 2 | Z518: 0 | AA518: 986 | AB518: 772 | AC518: 127.72 | AD518: 32
A519: GOALKICKERS | W519: YARRAVILLE | X519: 7 | Y519: 3 | Z519: 0 | AA519: 1031 | AB519: 738 | AC519: 139.7 | AD519: 28
A520: NORTHCOTE | C520: PYE 3 | E520: ROSS 2 | G520: WILLIAMSON 2 | J520: GOULLET 2 | M520: GRAY | N520: GARRETT | P520: HONIG | R520: SEYMOUR | W520: COBURG | X520: 6 | Y520: 3 | Z520: 1 | AA520: 873 | AB520: 859 | AC520: 101.63 | AD520: 26
A521: BRUNSWICK | C521: GILLON 3 | E521: DOWLING 2 | H521: DONNELLY 2 | K521: McELROY 2 | N521: JONES | P521: BOYD | W521: BRUNSWICK | X521: 6 | Y521: 4 | Z521: 0 | AA521: 795 | AB521: 725 | AC521: 109.66 | AD521: 24
A523: COBURG | C523: 0 | D523: 1 | E523: =C523*6+D523 -> 1 | G523: 3 | H523: 3 | I523: =G523*6+H523 -> 21 | K523: 8 | L523: 5 | M523: =K523*6+L523 -> 53 | O523: 9 | P523: 7 | Q523: =O523*6+P523 -> 61 | S523: COBURG | W523: PORT MELBOURNE | X523: 5 | Y523: 4 | Z523: 1 | AA523: 752 | AB523: 746 | AC523: 100.8 | AD523: 22
A524: CAMBERWELL | C524: 2 | D524: 3 | E524: =C524*6+D524 -> 15 | G524: 5 | H524: 7 | I524: =G524*6+H524 -> 37 | K524: 6 | L524: 11 | M524: =K524*6+L524 -> 47 | O524: 7 | P524: 15 | Q524: =O524*6+P524 -> 57 | S524: GREGORY | W524: PRESTON | X524: 5 | Y524: 4 | Z524: 1 | AA524: 814 | AB524: 842 | AC524: 96.67 | AD524: 22
A525: BEST PLAYERS | W525: PRAHRAN | X525: 5 | Y525: 5 | Z525: 0 | AA525: 905 | AB525: 717 | AC525: 126.22 | AD525: 20
A526: COBURG | C526: HENNING | F526: KIGHT | I526: REITSCHELL | L526: OLSEN | N526: McFARLANE | Q526: CONLEY | W526: CAMBERWELL | X526: 5 | Y526: 5 | Z526: 0 | AA526: 947 | AB526: 782 | AC526: 121.1 | AD526: 20
A527: CAMBERWELL | C527: WILLIAMS | F527: FINLAYSON | I527: DYBALL | L527: WALKER | N527: JONES | Q527: TATHAM | W527: OAKLEIGH | X527: 4 | Y527: 5 | Z527: 1 | AA527: 862 | AB527: 937 | AC527: 92 | AD527: 18
A528: GOALKICKERS | W528: SANDRINGHAM | X528: 3 | Y528: 7 | Z528: 0 | AA528: 798 | AB528: 1076 | AC528: 74.16 | AD528: 12
A529: COBURG | C529: HENNING 4 | F529: DUNCAN 3 | I529: LE FANNUE | L529: BROOM | W529: BRIGHTON | X529: 2 | Y529: 8 | Z529: 0 | AA529: 851 | AB529: 986 | AC529: 86.308316430020284 | AD529: 8
A530: CAMBERWELL | C530: VANTHOFF 2 | F530: TATHAM | I530: JONES | K530: MASON | M530: LUFF | N530: MEEHL | W530: WILLIAMSTOWN | X530: 2 | Y530: 8 | Z530: 0 | AA530: 649 | AB530: 1083 | AC530: 59.93 | AD530: 8
A532: PORT MELBOURNE | C532: 2 | D532: 2 | E532: =C532*6+D532 -> 14 | G532: 5 | H532: 6 | I532: =G532*6+H532 -> 36 | K532: 6 | L532: 7 | M532: =K532*6+L532 -> 43 | O532: 10 | P532: 8 | Q532: =O532*6+P532 -> 68 | S532: PORT MELBOURNE
A533: PRESTON | C533: 4 | D533: 7 | E533: =C533*6+D533 -> 31 | G533: 4 | H533: 10 | I533: =G533*6+H533 -> 34 | K533: 8 | L533: 12 | M533: =K533*6+L533 -> 60 | O533: 8 | P533: 15 | Q533: =O533*6+P533 -> 63 | S533: HASSETT
A534: BEST PLAYERS
A535: PORT MELBOURNE | C535: KEATING | F535: PLUMRIDGE | I535: MALTBY | L535: GOMEZ | O535: GOTZ | Q535: CRAWSHAW
A536: PRESTON | C536: HARDING | F536: ARTHUR | I536: MUIR | L536: DOWLING | O536: BOSCHEN | Q536: EDWARDS
A537: GOALKICKERS
A538: PORT MELBOURNE | C538: TYSON 3 | F538: KEATING 2 | I538: GOMEZ | K538: CRAWSHAW | N538: SHAPTER | Q538: EASTMUIR | T538: HALL
A539: PRESTON | C539: ARTHUR 2 | F539: HUGHSON | I539: BOSCHEN | K539: HARDING | N539: CRANE | Q539: ROBINSON | T539: FARRELL
A541: PRAHRAN | C541: 1 | D541: 5 | E541: =C541*6+D541 -> 11 | G541: 6 | H541: 13 | I541: =G541*6+H541 -> 49 | K541: 9 | L541: 17 | M541: =K541*6+L541 -> 71 | O541: 13 | P541: 22 | Q541: =O541*6+P541 -> 100 | S541: TOORAK PARK
A542: BRIGHTON | C542: 2 | D542: 2 | E542: =C542*6+D542 -> 14 | G542: 3 | H542: 4 | I542: =G542*6+H542 -> 22 | K542: 8 | L542: 5 | M542: =K542*6+L542 -> 53 | O542: 10 | P542: 7 | Q542: =O542*6+P542 -> 67 | S542: HUTCHINSON
A543: BEST PLAYERS
A544: PRAHRAN | C544: WHITEHEAD | F544: WILLIAMS | I544: GRANDISON | L544: TABATEAU | O544: WESCOTT | R544: HYDE
A545: BRIGHTON | C545: STEWART | F545: HINDSON | I545: CONNELL | L545: EVANS | O545: TERRY | R545: TOMLINS
A546: GOALKICKERS
A547: PRAHRAN | C547: GRANDISON 4 | F547: SHARPLEY 4 | I547: WHITE | K547: MUNN | M547: HYDE | O547: SMITH | Q547: JOHNSON
A548: BRIGHTON | C548: BOLWELL 2 | F548: L EVANS 2 | I548: CONNELL 2 | L548: SULLIVAN | N548: DREW | P548: MILLER | R548: TOMLINS
A550: SANDRINGHAM | C550: 3 | D550: 4 | E550: =C550*6+D550 -> 22 | G550: 7 | H550: 6 | I550: =G550*6+H550 -> 48 | K550: 13 | L550: 8 | M550: =K550*6+L550 -> 86 | O550: 14 | P550: 13 | Q550: =O550*6+P550 -> 97 | S550: BEACH ROAD
A551: WILLIAMSTOWN | C551: 2 | D551: 2 | E551: =C551*6+D551 -> 14 | G551: 5 | H551: 3 | I551: =G551*6+H551 -> 33 | K551: 7 | L551: 7 | M551: =K551*6+L551 -> 49 | O551: 7 | P551: 10 | Q551: =O551*6+P551 -> 52 | S551: CARLISLE
A552: BEST PLAYERS
A553: SANDRINGHAM | C553: TOLSON | E553: THOMS | H553: CHALLIS | K553: POLLARD | N553: DOCKENDORFF | Q553: MALLETT
A554: WILLIAMSTOWN | C554: POWER | E554: WARD | H554: KNIGHT | K554: DANN | N554: LAWLOR | Q554: BROOKS
A555: GOALKICKERS
A556: SANDRINGHAM | C556: TOLSON 4 | F556: McCOMB 3 | I556: MITCHELL 2 | L556: POLLARD 2 | O556: McCONCHIE | R556: MILLER | T556: WITCHELL
A557: WILLIAMSTOWN | C557: LAWLOR 3 | F557: DREW 2 | I557: McGILLIVRAY | L557: HYDE
A559: YARRAVILLE | C559: 5 | D559: 5 | E559: =C559*6+D559 -> 35 | G559: 10 | H559: 8 | I559: =G559*6+H559 -> 68 | K559: 15 | L559: 12 | M559: =K559*6+L559 -> 102 | O559: 17 | P559: 13 | Q559: 115 | S559: YARRAVILLE
A560: OAKLEIGH | C560: 0 | D560: 4 | E560: =C560*6+D560 -> 4 | G560: 2 | H560: 7 | I560: =G560*6+H560 -> 19 | K560: 5 | L560: 10 | M560: =K560*6+L560 -> 40 | O560: 8 | P560: 14 | Q560: 62 | S560: CLAYTON
A561: BEST PLAYERS
A562: YARRAVILLE | C562: HOPKINS | E562: J BUCKLEY | H562: WARDEN | K562: McGRATH | N562: ELLIS | Q562: WEDGWOOD
A563: OAKLEIGH | C563: KIDD | E563: WATSON | H563: WILTSHIRE | K563: WITHERS | N563: RYAN | Q563: PLUMMER
A564: GOALKICKERS
A565: YARRAVILLE | C565: J BUCKLEY 8 | F565: STREETER 3 | I565: WARDEN 3 | L565: WEDGWOOD | O565: CAVE | Q565: HOPKINS
A566: OAKLEIGH | C566: MORRISON 3 | F566: HARRISON 2 | I566: RYAN | K566: HEINTZ | M566: CHAPMAN
A568: ROUND 11 | E568: 22ND JUNE | H568: WEATHER | K568: RAIN COLD WEST WIND GROUNDS BAD | S568: PLAYED AT
D569: 1ST QTR | H569: 2ND QTR | L569: 3RD QTR | P569: FINAL | S569: PRESTON
A570: PRESTON | C570: 1 | D570: 1 | E570: =C570*6+D570 -> 7 | G570: 4 | H570: 4 | I570: =G570*6+H570 -> 28 | K570: 6 | L570: 7 | M570: =K570*6+L570 -> 43 | O570: 10 | P570: 9 | Q570: =O570*6+P570 -> 69 | S570: UMPIRE | X570: LADDER | AB570: ROUND | AD570: 11
A571: PRAHRAN | C571: 2 | D571: 4 | E571: =C571*6+D571 -> 16 | G571: 4 | H571: 6 | I571: =G571*6+H571 -> 30 | K571: 6 | L571: 12 | M571: =K571*6+L571 -> 48 | O571: 9 | P571: 13 | Q571: =O571*6+P571 -> 67 | S571: STUART
A572: BEST PLAYERS | W572: TEAM | X572: W | Y572: L | Z572: D | AA572: FOR | AB572: AGST | AC572: % | AD572: PTS
A573: PRESTON | C573: EDWARDS | F573: HARDING | I573: ROBINSON | L573: BOSCHEN | O573: CLARKE | Q573: SMITH
A574: PRAHRAN | C574: SMITH | F574: WESCOTT | I574: KOOP | L574: SHARPLEY | O574: MUNN | Q574: WILTSHIRE | W574: NORTHCOTE | X574: 9 | Y574: 2 | Z574: 0 | AA574: 1090 | AB574: 837 | AC574: 130.23 | AD574: 36
A575: GOALKICKERS | W575: COBURG | X575: 7 | Y575: 3 | Z575: 1 | AA575: 1015 | AB575: 935 | AC575: 108.56 | AD575: 30
A576: PRESTON | C576: WARR 3 | F576: CRANE 2 | I576: FARRELL 2 | L576: SMITH | N576: BOSCHEN | Q576: ROBINSON | W576: YARRAVILLE | X576: 7 | Y576: 4 | Z576: 0 | AA576: 1108 | AB576: 823 | AC576: 134.63 | AD576: 28
A577: PRAHRAN | C577: BRENCHLEY 2 | F577: ANDERSON 2 | I577: SHARPLEY 2 | L577: GRANDISON | O577: MUNN | Q577: WESTCOTT | W577: BRUNSWICK | X577: 7 | Y577: 4 | Z577: 0 | AA577: 920 | AB577: 784 | AC577: 117.35 | AD577: 28
A579: OAKLEIGH | C579: 3 | D579: 3 | E579: =C579*6+D579 -> 21 | G579: 6 | H579: 5 | I579: =G579*6+H579 -> 41 | K579: 10 | L579: 8 | M579: =K579*6+L579 -> 68 | O579: 12 | P579: 11 | Q579: =O579*6+P579 -> 83 | S579: OAKLEIGH | W579: PRESTON | X579: 6 | Y579: 4 | Z579: 1 | AA579: 883 | AB579: 909 | AC579: 97.14 | AD579: 26
A580: PORT MELBOURNE | C580: 0 | D580: 4 | E580: =C580*6+D580 -> 4 | G580: 1 | H580: 7 | I580: =G580*6+H580 -> 13 | K580: 5 | L580: 11 | M580: =K580*6+L580 -> 41 | O580: 10 | P580: 18 | Q580: =O580*6+P580 -> 78 | S580: GREGORY | W580: CAMBERWELL | X580: 6 | Y580: 5 | Z580: 0 | AA580: 1032 | AB580: 859 | AC580: 120.14 | AD580: 24
A581: BEST PLAYERS | W581: PORT MELBOURNE | X581: 5 | Y581: 5 | Z581: 1 | AA581: 830 | AB581: 829 | AC581: 100.12 | AD581: 22
A582: OAKLEIGH | C582: BELL | E582: HEINTZ | H582: WITHERS | K582: MORRISON | N582: CAMPBELL | Q582: WATSON | W582: OAKLEIGH | X582: 5 | Y582: 5 | Z582: 1 | AA582: 945 | AB582: 1015 | AC582: 93.1 | AD582: 22
A583: PORT MELBOURNE | C583: GOMEZ | E583: MOLONEY | H583: BLOOMER | K583: TYSON | N583: KEATING | Q583: MALTBY | W583: PRAHRAN | X583: 5 | Y583: 6 | Z583: 0 | AA583: 972 | AB583: 786 | AC583: 123.66 | AD583: 20
A584: GOALKICKERS | W584: SANDRINGHAM | X584: 3 | Y584: 8 | Z584: 0 | AA584: 857 | AB584: 1201 | AC584: 71.36 | AD584: 12
A585: OAKLEIGH | C585: CAMPBELL 3 | F585: BAWDEN 3 | I585: HARRISON 3 | L585: MORRISON 2 | O585: HUTCHINSON | W585: BRIGHTON | X585: 2 | Y585: 9 | Z585: 0 | AA585: 916 | AB585: 1090 | AC585: 84.036697247706428 | AD585: 8
A586: PORT MELBOURNE | C586: TYSON 4 | F586: CRAWSHAW 2 | J586: TYRELL 2 | M586: MALTBY | O586: KEATING | W586: WILLIAMSTOWN | X586: 2 | Y586: 9 | Z586: 0 | AA586: 725 | AB586: 1225 | AC586: 59.18 | AD586: 8
A588: CAMBERWELL | C588: 3 | D588: 5 | E588: =C588*6+D588 -> 23 | G588: 7 | H588: 8 | I588: =G588*6+H588 -> 50 | K588: 8 | L588: 8 | M588: =K588*6+L588 -> 56 | O588: 12 | P588: 13 | Q588: =O588*6+P588 -> 85 | S588: CAMBERWELL
A589: YARRAVILLE | C589: 4 | D589: 4 | E589: =C589*6+D589 -> 28 | G589: 5 | H589: 4 | I589: =G589*6+H589 -> 34 | K589: 9 | L589: 8 | M589: =K589*6+L589 -> 62 | O589: 11 | P589: 11 | Q589: =O589*6+P589 -> 77 | S589: GLOVER
A590: BEST PLAYERS
A591: CAMBERWELL | C591: WILLIAMS | F591: JONES | I591: MEEHL | L591: W LUFF | O591: MASON | Q591: HOLT
A592: YARRAVILLE | C592: RYAN | F592: WARDEN | I592: HOPKINS | L592: WEDGWOOD | O592: PETERS | Q592: SMITH
A593: GOALKICKERS
A594: CAMBERWELL | C594: LUFF 6 | E594: JONES 2 | G594: MASON 2 | J594: MEEHL | L594: CLAMP
A595: YARRAVILLE | C595: CAVE 3 | E595: KENNY 3 | G595: WEDGWOOD 2 | J595: BUCKLEY | L595: McGRATH | N595: I EVANS
A597: BRUNSWICK | C597: 3 | D597: 8 | E597: =C597*6+D597 -> 26 | G597: 7 | H597: 13 | I597: =G597*6+H597 -> 55 | K597: 11 | L597: 17 | M597: =K597*6+L597 -> 83 | O597: 17 | P597: 23 | Q597: =O597*6+P597 -> 125 | S597: BRUNSWICK
A598: SANDRINGHAM | C598: 2 | D598: 4 | E598: =C598*6+D598 -> 16 | G598: 4 | H598: 5 | I598: =G598*6+H598 -> 29 | K598: 7 | L598: 10 | M598: =K598*6+L598 -> 52 | O598: 8 | P598: 11 | Q598: =O598*6+P598 -> 59 | S598: LESTER
A599: BEST PLAYERS
A600: BRUNSWICK | C600: DOWLING | F600: McELROY | I600: FAY | K600: JONES | N600: DONNELLY | Q600: QUINLAN
A601: SANDRINGHAM | C601: DOCKENDORFF | F601: McCONCHIE | I601: TOLSON | K601: THOMS | N601: CAMPBELL | Q601: CHALLIS
A602: GOALKICKERS
A603: BRUNSWICK | C603: JONES 5 | E603: McELROY 4 | H603: PALMER 3 | J603: DOWLING 2 | M603: BOYD | O603: DONNELLY | Q603: STRONG
A604: SANDRINGHAM | C604: MCCONCHIE 3 | F604: WITCHELL 2 | I604: TOLSON | K604: McCOMB | M604: POLLARD
A606: COBURG | C606: 4 | D606: 1 | E606: =C606*6+D606 -> 25 | G606: 10 | H606: 5 | I606: =G606*6+H606 -> 65 | K606: 13 | L606: 6 | M606: =K606*6+L606 -> 84 | O606: 21 | P606: 16 | Q606: =O606*6+P606 -> 142 | S606: WILLIAMSTOWN
A607: WILLIAMSTOWN | C607: 4 | D607: 3 | E607: =C607*6+D607 -> 27 | G607: 6 | H607: 3 | I607: =G607*6+H607 -> 39 | K607: 10 | L607: 9 | M607: =K607*6+L607 -> 69 | O607: 11 | P607: 10 | Q607: =O607*6+P607 -> 76 | S607: LEWIS
A608: BEST PLAYERS
A609: COBURG | C609: McKAY | E609: DUNCAN | H609: REITSCHELL | K609: LA FANNUE | N609: BROWN | Q609: UHE
A610: WILLIAMSTOWN | C610: COOK | E610: BROOKS | H610: LAWLOR | K610: KNIGHT | N610: RAEBURN | Q610: STEBBINS
A611: GOALKICKERS
A612: COBURG | C612: DUNCAN 6 | F612: LE FANNUE 4 | I612: HENNING 4 | L612: CONNELLY 3 | O612: McKEY 2 | Q612: O'KEEFE | S612: SMITH
A613: WILLIAMSTOWN | C613: LAWLOR 3 | F613: RAEBURN 3 | I613: PITTS 2 | L613: LEWER 2 | O613: BROOKS
A615: NORTHCOTE | C615: 4 | D615: 4 | E615: =C615*6+D615 -> 28 | G615: 7 | H615: 6 | I615: =G615*6+H615 -> 48 | K615: 13 | L615: 8 | M615: =K615*6+L615 -> 86 | O615: 16 | P615: 8 | Q615: =O615*6+P615 -> 104 | S615: ELSTERNWICK PARK
A616: BRIGHTON | C616: 1 | D616: 0 | E616: =C616*6+D616 -> 6 | G616: 5 | H616: 3 | I616: =G616*6+H616 -> 33 | K616: 6 | L616: 3 | M616: =K616*6+L616 -> 39 | O616: 9 | P616: 11 | Q616: =O616*6+P616 -> 65 | S616: FRICKE
A617: BEST PLAYERS
A618: NORTHCOTE | C618: BATES | E618: LAWRENCE | H618: GARRETT | K618: PYE | N618: SEYMOUR | Q618: GOULLETT
A619: BRIGHTON | C619: DREW | E619: TOMLINS | H619: BOLWELL | K619: CONDON | N619: CONNELL | Q619: STEWART
A620: GOALKICKERS
A621: NORTHCOTE | C621: SEYMOUR 5 | F621: WILLIAMSON 3 | J621: ROSS 2 | L621: PYE 2 | N621: MEITZKE | P621: GRAY | R621: GOULLET | U621: HONIG
A622: BRIGHTON | C622: DREW 2 | F622: TOMLINS 2 | I622: SULLIVAN | K622: DEAN | M622: McLEOD | O622: CONDON | Q622: HINDSON
A624: ROUND 12 | E624: 29TH JUNE | H624: WEATHER | K624: COOL CLOUDY S.W. WIND GROUNDS HEAVY | S624: PLAYED AT
D625: 1ST QTR | H625: 2ND QTR | L625: 3RD QTR | P625: FINAL | S625: BRUNSWICK
A626: BRUNSWICK | C626: 3 | D626: 5 | E626: =C626*6+D626 -> 23 | G626: 6 | H626: 8 | I626: =G626*6+H626 -> 44 | K626: 8 | L626: 10 | M626: =K626*6+L626 -> 58 | O626: 10 | P626: 13 | Q626: =O626*6+P626 -> 73 | S626: UMPIRE | X626: LADDER | AB626: ROUND | AD626: 12
A627: COBURG | C627: 0 | D627: 1 | E627: =C627*6+D627 -> 1 | G627: 4 | H627: 6 | I627: =G627*6+H627 -> 30 | K627: 7 | L627: 9 | M627: =K627*6+L627 -> 51 | O627: 9 | P627: 11 | Q627: =O627*6+P627 -> 65 | S627: GLOVER
A628: BEST PLAYERS | W628: TEAM | X628: W | Y628: L | Z628: D | AA628: FOR | AB628: AGST | AC628: % | AD628: PTS
A629: BRUNSWICK | C629: FAY | E629: DOWLING | H629: VAUGHAN | K629: McKERNAN | N629: GILLON | Q629: CLARKE
A630: COBURG | C630: O'KEEFE | E630: REITSCHELL | H630: McFARLANE | K630: VOIGHT | N630: HENNING | Q630: UHE | W630: NORTHCOTE | X630: 10 | Y630: 2 | Z630: 0 | AA630: 1207 | AB630: 911 | AC630: 132.49 | AD630: 40
A631: GOALKICKERS | W631: YARRAVILLE | X631: 8 | Y631: 4 | Z631: 0 | AA631: 1231 | AB631: 873 | AC631: 141.01 | AD631: 32
A632: BRUNSWICK | C632: PALMER 2 | F632: McELROY 2 | I632: VAUGHAN 2 | L632: DOWLING | N632: JAMES | P632: QUINLAN | R632: FITZMAURICE | W632: BRUNSWICK | X632: 8 | Y632: 4 | Z632: 0 | AA632: 993 | AB632: 859 | AC632: 115.6 | AD632: 32
A633: COBURG | C633: LE FANNUE 4 | F633: DUNCAN 2 | I633: UHE 2 | K633: O'KEEFE | W633: COBURG | X633: 7 | Y633: 4 | Z633: 1 | AA633: 1080 | AB633: 1008 | AC633: 107.14 | AD633: 30
A635: NORTHCOTE | C635: 4 | D635: 3 | E635: =C635*6+D635 -> 27 | G635: 8 | H635: 9 | I635: =G635*6+H635 -> 57 | K635: 15 | L635: 12 | M635: =K635*6+L635 -> 102 | O635: 16 | P635: 21 | Q635: =O635*6+P635 -> 117 | S635: PRESTON | W635: CAMBERWELL | X635: 7 | Y635: 5 | Z635: 0 | AA635: 1159 | AB635: 929 | AC635: 124.76 | AD635: 28
A636: PRESTON | C636: 3 | D636: 3 | E636: =C636*6+D636 -> 21 | G636: 4 | H636: 7 | I636: =G636*6+H636 -> 31 | K636: 8 | L636: 11 | M636: =K636*6+L636 -> 59 | O636: 10 | P636: 14 | Q636: =O636*6+P636 -> 74 | S636: GREGORY | W636: PRESTON | X636: 6 | Y636: 5 | Z636: 1 | AA636: 957 | AB636: 1026 | AC636: 93.27 | AD636: 26
A637: BEST PLAYERS | W637: PRAHRAN | X637: 6 | Y637: 6 | Z637: 0 | AA637: 1073 | AB637: 829 | AC637: 129.43 | AD637: 24
A638: NORTHCOTE | C638: ROSS | F638: WILLIAMSON | I638: PYE | K638: ACKLAND | N638: GARRETT | Q638: WOODS | W638: PORT MELBOURNE | X638: 5 | Y638: 6 | Z638: 1 | AA638: 873 | AB638: 930 | AC638: 93.87 | AD638: 22
A639: PRESTON | C639: W ROBINSON | F639: CLARKE | I639: HARDING | K639: CRANE | N639: MURRAY | Q639: DART | W639: OAKLEIGH | X639: 5 | Y639: 6 | Z639: 1 | AA639: 1015 | AB639: 1142 | AC639: 88.88 | AD639: 22
A640: GOALKICKERS | W640: BRIGHTON | X640: 3 | Y640: 9 | Z640: 0 | AA640: 1050 | AB640: 1136 | AC640: 92.429577464788736 | AD640: 12
A641: NORTHCOTE | C641: SEYMOUR 4 | F641: GRAY 3 | I641: PYE 3 | K641: ROSS 2 | M641: HONIG 2 | O641: GOULLET | Q641: HART | W641: SANDRINGHAM | X641: 3 | Y641: 9 | Z641: 0 | AA641: 903 | AB641: 1335 | AC641: 67.64 | AD641: 12
A642: PRESTON | C642: CRANE 4 | F642: WARR 3 | I642: McCLELLAND | L642: ARTHUR | N642: HARDING | W642: WILLIAMSTOWN | X642: 2 | Y642: 10 | Z642: 0 | AA642: 775 | AB642: 1348 | AC642: 57.49 | AD642: 8
A644: CAMBERWELL | C644: 3 | D644: 4 | E644: =C644*6+D644 -> 22 | G644: 10 | H644: 10 | I644: =G644*6+H644 -> 70 | K644: 15 | L644: 11 | M644: =K644*6+L644 -> 101 | O644: 19 | P644: 13 | Q644: =O644*6+P644 -> 127 | S644: CAMBERWELL
A645: OAKLEIGH | C645: 2 | D645: 5 | E645: =C645*6+D645 -> 17 | G645: 2 | H645: 6 | I645: =G645*6+H645 -> 18 | K645: 6 | L645: 9 | M645: =K645*6+L645 -> 45 | O645: 10 | P645: 10 | Q645: =O645*6+P645 -> 70 | S645: STUART
A646: BEST PLAYERS
A647: CAMBERWELL | C647: W LUFF | F647: WALKER | I647: WILLIAMS | L647: CLAMP | O647: HENDERSON | R647: MEEHL
A648: OAKLEIGH | C648: STEIGENBERGER | F648: KIDD | I648: BAKER | L648: WILTSHIRE | O648: PLUMMER | R648: WITHERS
A649: GOALKICKERS
A650: CAMBERWELL | C650: LUFF 10 | F650: MASON 2 | I650: HENDERSON 2 | L650: H JONES | N650: WILLIAMS | Q650: DYBALL | S650: J JONES | V650: DAVIDSON
A651: OAKLEIGH | C651: WITHERS 2 | F651: CAMPBELL 2 | I651: HEINTZ | K651: CHAPMAN | M651: BELL | N651: HARRISON | Q651: MORRISON | T651: WATSON
A653: PRAHRAN | C653: 0 | D653: 7 | E653: =C653*6+D653 -> 7 | G653: 6 | H653: 10 | I653: =G653*6+H653 -> 46 | K653: 10 | L653: 14 | M653: =K653*6+L653 -> 74 | O653: 14 | P653: 17 | Q653: =O653*6+P653 -> 101 | S653: TOORAK PARK
A654: PORT MELBOURNE | C654: 0 | D654: 1 | E654: =C654*6+D654 -> 1 | G654: 1 | H654: 2 | I654: =G654*6+H654 -> 8 | K654: 3 | L654: 3 | M654: =K654*6+L654 -> 21 | O654: 6 | P654: 7 | Q654: =O654*6+P654 -> 43 | S654: CLAYTON
A655: BEST PLAYERS
A656: PRAHRAN | C656: SMITH | F656: MUNN | I656: KOOP | L656: WILLIAMS | O656: WHITEHEAD | R656: TABATEAU
A657: PORT MELBOURNE | C657: PLUMRIDGE | F657: KEATING | I657: GOMEZ | L657: WOODS | O657: MALTBY | R657: SHAPTER
A658: GOALKICKERS
A659: PRAHRAN | C659: GRANDISON 4 | F659: MUNN 3 | I659: WHITE 2 | K659: SHARPLEY | M659: BRENCHLEY | P659: ANDERSON | R659: WILLIAMS | U659: JOHNSON
A660: PORT MELBOURNE | C660: TYSON 4 | F660: EASTWOOD 2
A662: BRIGHTON | C662: 7 | D662: 5 | E662: =C662*6+D662 -> 47 | G662: 10 | H662: 11 | I662: =G662*6+H662 -> 71 | K662: 15 | L662: 17 | M662: =K662*6+L662 -> 107 | O662: 19 | P662: 20 | Q662: =O662*6+P662 -> 134 | S662: ELSTERNWICK PARK
A663: SANDRINGHAM | C663: 1 | D663: 1 | E663: =C663*6+D663 -> 7 | G663: 4 | H663: 3 | I663: =G663*6+H663 -> 27 | K663: 5 | L663: 3 | M663: =K663*6+L663 -> 33 | O663: 7 | P663: 4 | Q663: =O663*6+P663 -> 46 | S663: CARLISLE
A664: BEST PLAYERS
A665: BRIGHTON | C665: CONNELL | F665: DREW | I665: BOLWELL | L665: TOMLINS | O665: KING | Q665: FORBES
A666: SANDRINGHAM | C666: MEEHAN | F666: DOCKENDORFF | I666: MITCHELL | L666: WITCHELL | O666: SMAIL | Q666: TOLSON
A667: GOALKICKERS
A668: BRIGHTON | C668: FORBES 6 | F668: BOLWELL 4 | I668: CONNELL 3 | L668: TOMLINS 2 | O668: KING 2 | Q668: DREW | S668: MALONEY
A669: SANDRINGHAM | C669: ROBERTS 2 | F669: WITCHELL 2 | I669: MITCHELL | L669: TOLSON | N669: CHRISTIE
A671: YARRAVILLE | C671: 3 | D671: 2 | E671: =C671*6+D671 -> 20 | G671: 5 | H671: 3 | I671: =G671*6+H671 -> 33 | K671: 12 | L671: 6 | M671: =K671*6+L671 -> 78 | O671: 19 | P671: 9 | Q671: =O671*6+P671 -> 123 | S671: WILLIAMSTOWN
A672: WILLIAMSTOWN | C672: 2 | D672: 2 | E672: =C672*6+D672 -> 14 | G672: 4 | H672: 5 | I672: =G672*6+H672 -> 29 | K672: 6 | L672: 7 | M672: =K672*6+L672 -> 43 | O672: 7 | P672: 8 | Q672: =O672*6+P672 -> 50 | S672: HUTCHINSON
A673: BEST PLAYERS
A674: YARRAVILLE | C674: HOPKINS | F674: PETERS | I674: STREETER | L674: McGRATH | O674: WEDGWOOD | R674: W BUCKLEY
A675: WILLIAMSTOWN | C675: MARTIN | F675: COOK | I675: TAYLOR | L675: RAEBURN | O675: FISHER | R675: LEWER
A676: GOALKICKERS
A677: YARRAVILLE | C677: KENNY 5 | E677: McGRATH 2 | H677: WARDEN 2 | J677: HOPKINS 2 | M677: I EVANS 2 | O677: WEDGWOOD | R677: CAVE | T677: PETERS | V677: R EVANS | X677: PIERCE | Z677: STOREY
A678: WILLIAMSTOWN | C678: LAWLOR 3 | F678: PITTS | H678: RAEBURN | J678: LEWER | M678: KNIGHTS
A680: ROUND 13 | E680: 6TH JULY | H680: WEATHER | K680: FINE NORTH BREEZE GROUNDS HEAVY | S680: PLAYED AT
D681: 1ST QTR | H681: 2ND QTR | L681: 3RD QTR | P681: FINAL | S681: YARRAVILLE
A682: YARRAVILLE | C682: 4 | D682: 4 | E682: =C682*6+D682 -> 28 | G682: 7 | H682: 4 | I682: =G682*6+H682 -> 46 | K682: 13 | L682: 9 | M682: =K682*6+L682 -> 87 | O682: 15 | P682: 11 | Q682: =O682*6+P682 -> 101 | S682: UMPIRE | X682: LADDER | AB682: ROUND | AD682: 13
A683: BRUNSWICK | C683: 1 | D683: 0 | E683: =C683*6+D683 -> 6 | G683: 6 | H683: 4 | I683: =G683*6+H683 -> 40 | K683: 8 | L683: 6 | M683: =K683*6+L683 -> 54 | O683: 12 | P683: 7 | Q683: =O683*6+P683 -> 79 | S683: GREGORY
A684: BEST PLAYERS | W684: TEAM | X684: W | Y684: L | Z684: D | AA684: FOR | AB684: AGST | AC684: % | AD684: PTS
A685: YARRAVILLE | C685: PETERS | F685: RYAN | H685: WARDEN | K685: WEDGWOOD | N685: McGRATH | Q685: WILLIAMS
A686: BRUNSWICK | C686: DOWLING | F686: FAY | H686: BOYD | K686: CLARKE | N686: PALMER | Q686: DONNELLY | W686: NORTHCOTE | X686: 11 | Y686: 2 | Z686: 0 | AA686: 1282 | AB686: 960 | AC686: 133.54 | AD686: 44
A687: GOALKICKERS | W687: YARRAVILLE | X687: 9 | Y687: 4 | Z687: 0 | AA687: 1332 | AB687: 952 | AC687: 139.92 | AD687: 36
A688: YARRAVILLE | C688: McGRATH 3 | F688: WEDGWOOD 3 | I688: CASHMAN 3 | L688: WILLIAMS 2 | O688: I EVANS 2 | Q688: WARDEN | S688: HOPKINS | W688: COBURG | X688: 8 | Y688: 4 | Z688: 1 | AA688: 1173 | AB688: 1082 | AC688: 108.41 | AD688: 34
A689: BRUNSWICK | C689: GILLON 3 | F689: FITZMAURICE 3 | J689: DOWLING 2 | M689: PALMER | O689: BOYD | Q689: JAMES | S689: McELROY | W689: CAMBERWELL | X689: 8 | Y689: 5 | Z689: 0 | AA689: 1256 | AB689: 1016 | AC689: 123.62 | AD689: 32
A691: NORTHCOTE | C691: 3 | D691: 5 | E691: =C691*6+D691 -> 23 | G691: 6 | H691: 10 | I691: =G691*6+H691 -> 46 | K691: 7 | L691: 12 | M691: =K691*6+L691 -> 54 | O691: 10 | P691: 15 | Q691: =O691*6+P691 -> 75 | S691: NORTHCOTE | W691: BRUNSWICK | X691: 8 | Y691: 5 | Z691: 0 | AA691: 1072 | AB691: 950 | AC691: 112.84 | AD691: 32
A692: PRAHRAN | C692: 2 | D692: 2 | E692: =C692*6+D692 -> 14 | G692: 4 | H692: 5 | I692: =G692*6+H692 -> 29 | K692: 5 | L692: 11 | M692: =K692*6+L692 -> 41 | O692: 6 | P692: 13 | Q692: =O692*6+P692 -> 49 | S692: STUART | W692: PRESTON | X692: 7 | Y692: 5 | Z692: 1 | AA692: 1084 | AB692: 1122 | AC692: 96.61 | AD692: 30
A693: BEST PLAYERS | W693: OAKLEIGH | X693: 6 | Y693: 6 | Z693: 1 | AA693: 1131 | AB693: 1235 | AC693: 91.58 | AD693: 26
A694: NORTHCOTE | C694: GOULLETT | F694: GRAY | I694: BATES | K694: POWELL | N694: PYE | Q694: SIMMONDS | W694: PRAHRAN | X694: 6 | Y694: 7 | Z694: 0 | AA694: 1122 | AB694: 904 | AC694: 124.12 | AD694: 24
A695: PRAHRAN | C695: KOOP | F695: TABATEAU | I695: WHITE | K695: SMITH | N695: HYDE | Q695: BRENCHLEY | W695: PORT MELBOURNE | X695: 5 | Y695: 7 | Z695: 1 | AA695: 960 | AB695: 1027 | AC695: 93.48 | AD695: 22
A696: GOALKICKERS | W696: BRIGHTON | X696: 3 | Y696: 10 | Z696: 0 | AA696: 1124 | AB696: 1229 | AC696: 91.456468673718476 | AD696: 12
A697: NORTHCOTE | C697: SIMMONDS 2 | F697: GRAY 2 | I697: ROSS 2 | K697: PYE 2 | M697: SEYMOUR | O697: LAWRENCE | W697: SANDRINGHAM | X697: 3 | Y697: 10 | Z697: 0 | AA697: 999 | AB697: 1462 | AC697: 68.33 | AD697: 12
A698: PRAHRAN | C698: BRENCHLEY 3 | F698: JOHNSON 2 | I698: WHITE | W698: WILLIAMSTOWN | X698: 2 | Y698: 11 | Z698: 0 | AA698: 868 | AB698: 1464 | AC698: 59.29 | AD698: 8
A700: CAMBERWELL | C700: 4 | D700: 1 | E700: =C700*6+D700 -> 25 | G700: 8 | H700: 6 | I700: =G700*6+H700 -> 54 | K700: 12 | L700: 11 | M700: =K700*6+L700 -> 83 | O700: 14 | P700: 13 | Q700: =O700*6+P700 -> 97 | S700: PORT MELBOURNE
A701: PORT MELBOURNE | C701: 4 | D701: 3 | E701: =C701*6+D701 -> 27 | G701: 7 | H701: 7 | I701: =G701*6+H701 -> 49 | K701: 8 | L701: 9 | M701: =K701*6+L701 -> 57 | O701: 13 | P701: 9 | Q701: =O701*6+P701 -> 87 | S701: GLOVER
A702: BEST PLAYERS
A703: CAMBERWELL | C703: DYBALL | F703: WALKER | I703: CLAMP | L703: H JONES | O703: BRETT | R703: MASON
A704: PORT MELBOURNE | C704: PLUMRIDGE | F704: TYSON | I704: EASTWOOD | L704: CRAWSHAW | O704: KEATING | R704: GOMEZ
A705: GOALKICKERS
A706: CAMBERWELL | C706: MASON 3 | F706: LUFF 3 | H706: DYBALL 2 | J706: J JONES 2 | M706: HENDERSON | P706: MEEHL | R706: CLAMP | T706: DAVIDSON
A707: PORT MELBOURNE | C707: TYSON 5 | F707: CRAWSHAW 5 | J707: KEATING 2 | M707: EASTWOOD
A709: OAKLEIGH | C709: 5 | D709: 4 | E709: =C709*6+D709 -> 34 | G709: 9 | H709: 11 | I709: =G709*6+H709 -> 65 | K709: 15 | L709: 12 | M709: =K709*6+L709 -> 102 | O709: 17 | P709: 14 | Q709: =O709*6+P709 -> 116 | S709: OAKLEIGH
A710: WILLIAMSTOWN | C710: 2 | D710: 1 | E710: =C710*6+D710 -> 13 | G710: 5 | H710: 3 | I710: =G710*6+H710 -> 33 | K710: 9 | L710: 5 | M710: =K710*6+L710 -> 59 | O710: 14 | P710: 9 | Q710: =O710*6+P710 -> 93 | S710: LESTER
A711: BEST PLAYERS
A712: OAKLEIGH | C712: HEINTZ | F712: WATSON | I712: STEIGENBERGER | M712: CHAPMAN | P712: WITHERS | S712: BAWDEN
A713: WILLIAMSTOWN | C713: LAWLOR | F713: KNIGHT | I713: McGILLIVRAY | M713: PANNELL | P713: RAEBURN | S713: HARSLEY
A714: GOALKICKERS
A715: OAKLEIGH | C715: HARRISON 5 | F715: HEINTZ 4 | I715: STEIGENBERGER 3 | M715: CAMPBELL 2 | P715: CHAPMAN 2 | S715: WITHERS
A716: WILLIAMSTOWN | C716: LAWLOR 6 | F716: RAEBURN 4 | I716: PITTS 2 | K716: LEWER | M716: KNIGHTS
A718: PRESTON | C718: 6 | D718: 5 | E718: =C718*6+D718 -> 41 | G718: 9 | H718: 9 | I718: =G718*6+H718 -> 63 | K718: 15 | L718: 12 | M718: =K718*6+L718 -> 102 | O718: 18 | P718: 19 | Q718: =O718*6+P718 -> 127 | S718: BEACH ROAD
A719: SANDRINGHAM | C719: 0 | D719: 1 | E719: =C719*6+D719 -> 1 | G719: 6 | H719: 5 | I719: =G719*6+H719 -> 41 | K719: 9 | L719: 5 | M719: =K719*6+L719 -> 59 | O719: 15 | P719: 6 | Q719: =O719*6+P719 -> 96 | S719: HASSETT
A720: BEST PLAYERS
A721: PRESTON | C721: HUGO | E721: WARR | H721: SMITH | K721: CRANE | N721: HARDING | Q721: UNDERHILL
A722: SANDRINGHAM | C722: THOMS | E722: MEEHAN | H722: GILLIGAN | K722: MITCHELL | N722: POUND | Q722: ROBERTS
A723: GOALKICKERS
A724: PRESTON | C724: WARR 6 | E724: CRANE 6 | G724: HUGHSON 2 | J724: COOPER | L724: McCLELLAND | O724: ROBINSON | R724: FARRELL
A725: SANDRINGHAM | C725: ROBERTS 7 | F725: POUND 3 | I725: MITCHELL 2 | L725: TOLSON | N725: LYONS | P725: THOMS
A727: COBURG | C727: 3 | D727: 8 | E727: =C727*6+D727 -> 26 | G727: 7 | H727: 12 | I727: =G727*6+H727 -> 54 | K727: 12 | L727: 19 | M727: =K727*6+L727 -> 91 | O727: 12 | P727: 21 | Q727: =O727*6+P727 -> 93 | S727: COBURG
A728: BRIGHTON | C728: 2 | D728: 0 | E728: =C728*6+D728 -> 12 | G728: 5 | H728: 3 | I728: =G728*6+H728 -> 33 | K728: 7 | L728: 6 | M728: =K728*6+L728 -> 48 | O728: 11 | P728: 8 | Q728: =O728*6+P728 -> 74 | S728: WHITBURN
A729: BEST PLAYERS
A730: COBURG | C730: HARRIS | E730: HENNING | H730: WALLACE | K730: OPREY | N730: LA FANNUE | Q730: EDWARDS
A731: BRIGHTON | C731: DREW | E731: BOLWELL | H731: CONNELL | K731: EVANS | N731: BOURNE | Q731: HINDSON
A732: GOALKICKERS
A733: COBURG | C733: DUNCAN 3 | F733: LE FANNUE 3 | I733: HENNING 2 | L733: HARRIS | N733: EDWARDS | Q733: HUNTER | S733: OPREY
A734: BRIGHTON | C734: BOLWELL 3 | F734: CONNELL 2 | I734: DREW 2 | K734: HALLAHAN | N734: FORBES | Q734: L EVANS | S734: HINDSON
A736: ROUND 14 | E736: 13TH JULY | H736: WEATHER | K736: SHOWERS WEST WIND GROUNDS BAD | S736: PLAYED AT
D737: 1ST QTR | H737: 2ND QTR | L737: 3RD QTR | P737: FINAL | S737: PRESTON
A738: PRESTON | C738: 2 | D738: 5 | E738: =C738*6+D738 -> 17 | G738: 5 | H738: 9 | I738: =G738*6+H738 -> 39 | K738: 7 | L738: 15 | M738: =K738*6+L738 -> 57 | O738: 9 | P738: 18 | Q738: =O738*6+P738 -> 72 | S738: UMPIRE | X738: LADDER | AB738: ROUND | AD738: 14
A739: COBURG | C739: 2 | D739: 0 | E739: =C739*6+D739 -> 12 | G739: 5 | H739: 4 | I739: =G739*6+H739 -> 34 | K739: 7 | L739: 5 | M739: =K739*6+L739 -> 47 | O739: 8 | P739: 6 | Q739: =O739*6+P739 -> 54 | S739: LESTER
A740: BEST PLAYERS | W740: TEAM | X740: W | Y740: L | Z740: D | AA740: FOR | AB740: AGST | AC740: % | AD740: PTS
A741: PRESTON | C741: CAMERON | F741: WARR | I741: HARDING | L741: MURRAY | O741: BOSCHEN | Q741: HUGHSON
A742: COBURG | C742: HENNING | F742: VOIGHT | I742: REITSCHELL | L742: BROWN | O742: UHE | Q742: BROOM | W742: NORTHCOTE | X742: 12 | Y742: 2 | Z742: 0 | AA742: 1353 | AB742: 1006 | AC742: 134.49 | AD742: 48
A743: GOALKICKERS | W743: YARRAVILLE | X743: 10 | Y743: 4 | Z743: 0 | AA743: 1436 | AB743: 1016 | AC743: 141.34 | AD743: 40
A744: PRESTON | C744: WARR 3 | F744: CRANE 3 | I744: HARDING 2 | L744: O'CONNOR | W744: CAMBERWELL | X744: 9 | Y744: 5 | Z744: 0 | AA744: 1358 | AB744: 1048 | AC744: 129.58 | AD744: 36
A745: COBURG | C745: DUNCAN 3 | F745: LE FANNUE | I745: HENNING | L745: BROWN | N745: EDWARDS | Q745: OLSEN | W745: COBURG | X745: 8 | Y745: 5 | Z745: 1 | AA745: 1227 | AB745: 1154 | AC745: 106.33 | AD745: 34
A747: OAKLEIGH | C747: 7 | D747: 6 | E747: =C747*6+D747 -> 48 | G747: 7 | H747: 7 | I747: =G747*6+H747 -> 49 | K747: 10 | L747: 11 | M747: =K747*6+L747 -> 71 | O747: 11 | P747: 14 | Q747: =O747*6+P747 -> 80 | S747: BRUNSWICK | W747: PRESTON | X747: 8 | Y747: 5 | Z747: 1 | AA747: 1156 | AB747: 1176 | AC747: 98.3 | AD747: 34
A748: BRUNSWICK | C748: 2 | D748: 2 | E748: =C748*6+D748 -> 14 | G748: 6 | H748: 8 | I748: =G748*6+H748 -> 44 | K748: 7 | L748: 11 | M748: =K748*6+L748 -> 53 | O748: 10 | P748: 17 | Q748: =O748*6+P748 -> 77 | S748: STUART | W748: BRUNSWICK | X748: 8 | Y748: 6 | Z748: 0 | AA748: 1149 | AB748: 1030 | AC748: 111.55 | AD748: 32
A749: BEST PLAYERS | W749: OAKLEIGH | X749: 7 | Y749: 6 | Z749: 1 | AA749: 1211 | AB749: 1312 | AC749: 92.3 | AD749: 30
A750: OAKLEIGH | C750: HEINTZ | F750: STEIGENBERGER | J750: WATSON | M750: HICKS | O750: FRASER | Q750: KIDD | W750: PRAHRAN | X750: 7 | Y750: 7 | Z750: 0 | AA750: 1243 | AB750: 937 | AC750: 132.66 | AD750: 28
A751: BRUNSWICK | C751: FITZMAURICE | F751: DOWLING | J751: PALMER | M751: FAY | O751: VAUGHAN | Q751: McELROY | W751: PORT MELBOURNE | X751: 5 | Y751: 8 | Z751: 1 | AA751: 1006 | AB751: 1098 | AC751: 91.62 | AD751: 22
A752: GOALKICKERS | W752: BRIGHTON | X752: 3 | Y752: 11 | Z752: 0 | AA752: 1188 | AB752: 1333 | AC752: 89.122280570142536 | AD752: 12
A753: OAKLEIGH | C753: FRASER 4 | F753: HARRISON 2 | I753: KIDD 2 | K753: HEINTZ | M753: CAMPBELL | P753: HICKS | W753: SANDRINGHAM | X753: 3 | Y753: 11 | Z753: 0 | AA753: 1032 | AB753: 1583 | AC753: 65.19 | AD753: 12
A754: BRUNSWICK | C754: FITZMAURICE 2 | F754: BEAUMONT 2 | I754: JONES | K754: GILLON | M754: BOYD | N754: DONNELLY | Q754: McELROY | S754: VAUGHAN | W754: WILLIAMSTOWN | X754: 2 | Y754: 12 | Z754: 0 | AA754: 900 | AB754: 1566 | AC754: 57.47 | AD754: 8
A756: PRAHRAN | C756: 2 | D756: 6 | E756: =C756*6+D756 -> 18 | G756: 7 | H756: 11 | I756: =G756*6+H756 -> 53 | K756: 10 | L756: 19 | M756: =K756*6+L756 -> 79 | O756: 16 | P756: 25 | Q756: =O756*6+P756 -> 121 | S756: TOORAK PARK
A757: SANDRINGHAM | C757: 2 | D757: 1 | E757: =C757*6+D757 -> 13 | G757: 4 | H757: 2 | I757: =G757*6+H757 -> 26 | K757: 4 | L757: 2 | M757: =K757*6+L757 -> 26 | O757: 5 | P757: 3 | Q757: =O757*6+P757 -> 33 | S757: FRICKE
A758: BEST PLAYERS
A759: PRAHRAN | C759: WILLIAMS | F759: WHITE | I759: BRENCHLEY | L759: HYDE | N759: SHARPLEY | Q759: SMITH
A760: SANDRINGHAM | C760: TOLSON | F760: MICHAELSON | I760: MEEHAN | L760: NOSEDA | N760: GILLIGAN | Q760: MILLER
A761: GOALKICKERS
A762: PRAHRAN | C762: WHITE 6 | F762: BRENCHLEY 5 | I762: WILLIAMS 2 | L762: MUNN | N762: JOHNSON | P762: AVERY
A763: SANDRINGHAM | C763: TOLSON 2 | F763: ROBERTS | I763: MEEHAN | L763: MICHAELSON
A765: NORTHCOTE | C765: 1 | D765: 6 | E765: =C765*6+D765 -> 12 | G765: 2 | H765: 9 | I765: =G765*6+H765 -> 21 | K765: 7 | L765: 14 | M765: =K765*6+L765 -> 56 | O765: 9 | P765: 17 | Q765: =O765*6+P765 -> 71 | S765: NORTHCOTE
A766: PORT MELBOURNE | C766: 1 | D766: 1 | E766: =C766*6+D766 -> 7 | G766: 4 | H766: 2 | I766: =G766*6+H766 -> 26 | K766: 5 | L766: 6 | M766: =K766*6+L766 -> 36 | O766: 6 | P766: 10 | Q766: =O766*6+P766 -> 46 | S766: HASSETT
A767: BEST PLAYERS
A768: NORTHCOTE | C768: POWELL | E768: ROSS | H768: ACKLAND | K768: GOULLETT | N768: LAWRENCE | Q768: PYE
A769: PORT MELBOURNE | C769: WOODS | E769: CRAWSHAW | H769: TYRELL | K769: BLOOMER | N769: GOTZ | Q769: BRAID
A770: GOALKICKERS
A771: NORTHCOTE | C771: SEYMOUR 3 | F771: GRAY 3 | H771: ROGERS | K771: GOULLET | N771: PYE
A772: PORT MELBOURNE | C772: CRAWSHAW 4 | F772: TYSON | H772: TYRELL
A774: CAMBERWELL | C774: 2 | D774: 3 | E774: =C774*6+D774 -> 15 | G774: 6 | H774: 8 | I774: =G774*6+H774 -> 44 | K774: 9 | L774: 11 | M774: =K774*6+L774 -> 65 | O774: 14 | P774: 18 | Q774: =O774*6+P774 -> 102 | S774: WILLIAMSTOWN
A775: WILLIAMSTOWN | C775: 2 | D775: 5 | E775: =C775*6+D775 -> 17 | G775: 2 | H775: 9 | I775: =G775*6+H775 -> 21 | K775: 3 | L775: 13 | M775: =K775*6+L775 -> 31 | O775: 3 | P775: 14 | Q775: =O775*6+P775 -> 32 | S775: LEWIS
A776: BEST PLAYERS
A777: CAMBERWELL | C777: DYBALL | E777: WARE | H777: H JONES | K777: CLAMP | N777: HENDERSON | Q777: MEEHL
A778: WILLIAMSTOWN | C778: BROOKS | E778: POWER | H778: THOMPSON | K778: LAWLOR | N778: HARSLEY | Q778: RAEBURN
A779: GOALKICKERS
A780: CAMBERWELL | C780: LUFF 6 | E780: JONES 2 | G780: DAVIDSON 2 | J780: MASON | L780: HENDERSON | O780: MEEHL | Q780: J JONES
A781: WILLIAMSTOWN | C781: LAWLOR | F781: ANDREWS | I781: HYDE
A783: YARRAVILLE | C783: 2 | D783: 6 | E783: =C783*6+D783 -> 18 | G783: 5 | H783: 14 | I783: =G783*6+H783 -> 44 | K783: 11 | L783: 16 | M783: =K783*6+L783 -> 82 | O783: 14 | P783: 20 | Q783: =O783*6+P783 -> 104 | S783: ELSTERNWICK PARK
A784: BRIGHTON | C784: 5 | D784: 4 | E784: =C784*6+D784 -> 34 | G784: 8 | H784: 6 | I784: =G784*6+H784 -> 54 | K784: 9 | L784: 9 | M784: =K784*6+L784 -> 63 | O784: 9 | P784: 10 | Q784: =O784*6+P784 -> 64 | S784: GLOVER
A785: BEST PLAYERS
A786: YARRAVILLE | C786: CASHMAN | F786: HOPKINS | I786: RYAN | L786: EVANS | O786: WEDGWOOD | R786: WARDEN
A787: BRIGHTON | C787: KING | F787: SHERLOCK | I787: WILLIAMSON | L787: EVANS | O787: DREW | R787: HALLAHAN
A788: GOALKICKERS
A789: YARRAVILLE | C789: CASHMAN 8 | F789: WARDEN 4 | I789: CAVE 2
A790: BRIGHTON | C790: KING 4 | F790: BOLWELL 2 | I790: DREW | K790: FORBES | M790: L EVANS
A792: ROUND 15 | E792: 20TH JULY | J792: WEATHER | M792: COLD SHOWERS WEST WIND | S792: PLAYED AT
D793: 1ST QTR | H793: 2ND QTR | L793: 3RD QTR | P793: FINAL | S793: YARRAVILLE
A794: YARRAVILLE | C794: 3 | D794: 2 | E794: =C794*6+D794 -> 20 | G794: 7 | H794: 4 | I794: =G794*6+H794 -> 46 | K794: 9 | L794: 5 | M794: =K794*6+L794 -> 59 | O794: 14 | P794: 6 | Q794: =O794*6+P794 -> 90 | S794: UMPIRE | X794: LADDER | AB794: ROUND | AD794: 15
A795: PRESTON | C795: 1 | D795: 2 | E795: =C795*6+D795 -> 8 | G795: 3 | H795: 4 | I795: =G795*6+H795 -> 22 | K795: 4 | L795: 4 | M795: =K795*6+L795 -> 28 | O795: 6 | P795: 6 | Q795: =O795*6+P795 -> 42 | S795: GREGORY
A796: BEST PLAYERS | W796: TEAM | X796: W | Y796: L | Z796: D | AA796: FOR | AB796: AGST | AC796: % | AD796: PTS
A797: YARRAVILLE | C797: WEDGWOOD | F797: HOPKINS | I797: PETERS | L797: SHEEHAN | N797: FREW | Q797: R EVANS
A798: PRESTON | C798: G SMITH | F798: WARR | I798: CAMERON | L798: BOSCHEN | N798: A ROBINSON | Q798: O'CONNOR | W798: NORTHCOTE | X798: 13 | Y798: 2 | Z798: 0 | AA798: 1447 | AB798: 1082 | AC798: 133.73 | AD798: 52
A799: GOALKICKERS | W799: YARRAVILLE | X799: 11 | Y799: 4 | Z799: 0 | AA799: 1526 | AB799: 1058 | AC799: 144.23 | AD799: 44
A800: YARRAVILLE | C800: WEDGWOOD 4 | F800: CASHMAN 3 | I800: WILLIAMS 2 | L800: SHEEHAN 2 | N800: McGRATH | P800: KENNY | R800: I EVANS | W800: CAMBERWELL | X800: 10 | Y800: 5 | Z800: 0 | AA800: 1464 | AB800: 1105 | AC800: 132.49 | AD800: 40
A801: PRESTON | C801: HUGHSON | F801: McCLELLAND | I801: BOSCHEN | K801: HARDING | M801: CRANE | O801: A ROBINSON | W801: COBURG | X801: 8 | Y801: 6 | Z801: 1 | AA801: 1305 | AB801: 1263 | AC801: 103.33 | AD801: 34
A803: CAMBERWELL | C803: 2 | D803: 2 | E803: =C803*6+D803 -> 14 | G803: 6 | H803: 13 | I803: =G803*6+H803 -> 49 | K803: 10 | L803: 18 | M803: =K803*6+L803 -> 78 | O803: 14 | P803: 22 | Q803: =O803*6+P803 -> 106 | S803: CAMBERWELL | W803: OAKLEIGH | X803: 8 | Y803: 6 | Z803: 1 | AA803: 1329 | AB803: 1375 | AC803: 96.65 | AD803: 34
A804: BRUNSWICK | C804: 4 | D804: 2 | E804: =C804*6+D804 -> 26 | G804: 4 | H804: 4 | I804: =G804*6+H804 -> 28 | K804: 6 | L804: 8 | M804: =K804*6+L804 -> 44 | O804: 8 | P804: 9 | Q804: =O804*6+P804 -> 57 | S804: GLOVER | W804: PRESTON | X804: 8 | Y804: 6 | Z804: 1 | AA804: 1198 | AB804: 1266 | AC804: 94.63 | AD804: 34
A805: BEST PLAYERS | W805: PRAHRAN | X805: 8 | Y805: 7 | Z805: 0 | AA805: 1352 | AB805: 1015 | AC805: 133.2 | AD805: 32
A806: CAMBERWELL | C806: WILLIAMS | F806: DAVIDSON | I806: H JONES | K806: WALKER | N806: MASON | Q806: HENDERSON | W806: BRUNSWICK | X806: 8 | Y806: 7 | Z806: 0 | AA806: 1206 | AB806: 1136 | AC806: 106.16 | AD806: 32
A807: BRUNSWICK | C807: McELROY | F807: FAY | I807: PALMER | K807: CLARKE | N807: McKERNAN | Q807: DONNELLY | W807: PORT MELBOURNE | X807: 6 | Y807: 8 | Z807: 1 | AA807: 1132 | AB807: 1190 | AC807: 95.13 | AD807: 26
A808: GOALKICKERS | W808: BRIGHTON | X808: 3 | Y808: 12 | Z808: 0 | AA808: 1251 | AB808: 1451 | AC808: 86.216402481047552 | AD808: 12
A809: CAMBERWELL | C809: MASON 4 | F809: JONES 3 | I809: WILLIAMS 2 | L809: MEEHL 2 | N809: W LUFF | P809: HENDERSON | S809: DAVIDSON | W809: SANDRINGHAM | X809: 3 | Y809: 12 | Z809: 0 | AA809: 1108 | AB809: 1677 | AC809: 66.07 | AD809: 12
A810: BRUNSWICK | C810: McELROY 4 | F810: JONES | I810: DOWLING | L810: ELLAWAY | N810: CLARKE | W810: WILLIAMSTOWN | X810: 2 | Y810: 13 | Z810: 0 | AA810: 992 | AB810: 1692 | AC810: 58.63 | AD810: 8
A812: PRAHRAN | C812: 3 | D812: 2 | E812: =C812*6+D812 -> 20 | G812: 6 | H812: 5 | I812: =G812*6+H812 -> 41 | K812: 10 | L812: 19 | M812: =K812*6+L812 -> 79 | O812: 15 | P812: 19 | Q812: =O812*6+P812 -> 109 | S812: COBURG
A813: COBURG | C813: 3 | D813: 3 | E813: =C813*6+D813 -> 21 | G813: 6 | H813: 5 | I813: =G813*6+H813 -> 41 | K813: 9 | L813: 6 | M813: =K813*6+L813 -> 60 | O813: 12 | P813: 6 | Q813: =O813*6+P813 -> 78 | S813: LESTER
A814: BEST PLAYERS
A815: PRAHRAN | C815: ANDERSON | F815: WILTSHIRE | I815: WESCOTT | L815: SHARPLEY | O815: BRENCHLEY | R815: SMITH
A816: COBURG | C816: HARRIS | F816: RALSTON | I816: UHE | L816: KNOTT | O816: KIGHT | R816: OLSEN
A817: GOALKICKERS
A818: PRAHRAN | C818: BRENCHLEY 5 | F818: ANDERSON 4 | I818: WHITE 2 | L818: WILLIAMS 2 | O818: HYDE | Q818: WESCOTT
A819: COBURG | C819: DUNCAN 4 | F819: HARRIS 2 | I819: HENNING | K819: VOIGHT | M819: RALSTON | O819: KIGHT | Q819: UHE | S819: OLSEN
A821: OAKLEIGH | C821: 4 | D821: 8 | E821: =C821*6+D821 -> 32 | G821: 8 | H821: 9 | I821: =G821*6+H821 -> 57 | K821: 13 | L821: 11 | M821: =K821*6+L821 -> 89 | O821: 17 | P821: 16 | Q821: =O821*6+P821 -> 118 | S821: OAKLEIGH
A822: BRIGHTON | C822: 1 | D822: 1 | E822: =C822*6+D822 -> 7 | G822: 4 | H822: 5 | I822: =G822*6+H822 -> 29 | K822: 6 | L822: 8 | M822: =K822*6+L822 -> 44 | O822: 8 | P822: 15 | Q822: =O822*6+P822 -> 63 | S822: STUART
A823: BEST PLAYERS
A824: OAKLEIGH | C824: HARRISON | F824: FRASER | I824: HEINTZ | L824: YANN | O824: BAWDEN | R824: RYAN
A825: BRIGHTON | C825: KING | F825: R MILLER | I825: CONDON | L825: SHERLOCK | O825: CONNELL | R825: BOLWELL
A826: GOALKICKERS
A827: OAKLEIGH | C827: FRASER 7 | F827: HARRISON 6 | I827: RYAN | L827: HEINTZ | N827: BAKER | P827: CHAPMAN
A828: BRIGHTON | C828: BOLWELL 2 | F828: MILLER 2 | I828: SULLIVAN | L828: McLEOD | N828: FORBES | P828: KING
A830: PORT MELBOURNE | C830: 4 | D830: 5 | E830: =C830*6+D830 -> 29 | G830: 12 | H830: 10 | I830: =G830*6+H830 -> 82 | K830: 15 | L830: 10 | M830: =K830*6+L830 -> 100 | O830: 19 | P830: 12 | Q830: =O830*6+P830 -> 126 | S830: PORT MELBOURNE
A831: WILLIAMSTOWN | C831: 5 | D831: 4 | E831: =C831*6+D831 -> 34 | G831: 6 | H831: 5 | I831: =G831*6+H831 -> 41 | K831: 12 | L831: 10 | M831: =K831*6+L831 -> 82 | O831: 13 | P831: 14 | Q831: =O831*6+P831 -> 92 | S831: FRICKE
A832: BEST PLAYERS
A833: PORT MELBOURNE | C833: PLUMRIDGE | F833: KEATING | I833: GOTZ | L833: HUGHES | O833: TYSON | Q833: GARLEPP
A834: WILLIAMSTOWN | C834: BROOKS | F834: COOK | I834: WARD | L834: PANNELL | O834: PITTS | Q834: HARSLEY
A835: GOALKICKERS
A836: PORT MELBOURNE | C836: TYRELL 6 | F836: GOMEZ 4 | I836: KEATING 3 | L836: TYSON 3 | N836: EARLE | P836: SHAPTER | R836: EASTMUIR
A837: WILLIAMSTOWN | C837: WARD 4 | F837: LAWLOR 3 | I837: KNIGHTS 2 | L837: PITTS | N837: RAEBURN | Q837: PANNELL | T837: SMITH
A839: NORTHCOTE | C839: 4 | D839: 6 | E839: =C839*6+D839 -> 30 | G839: 7 | H839: 7 | I839: =G839*6+H839 -> 49 | K839: 10 | L839: 12 | M839: =K839*6+L839 -> 72 | O839: 13 | P839: 16 | Q839: =O839*6+P839 -> 94 | S839: BEACH ROAD
A840: SANDRINGHAM | C840: 3 | D840: 2 | E840: =C840*6+D840 -> 20 | G840: 6 | H840: 6 | I840: =G840*6+H840 -> 42 | K840: 7 | L840: 11 | M840: =K840*6+L840 -> 53 | O840: 10 | P840: 16 | Q840: =O840*6+P840 -> 76 | S840: LEWIS
A841: BEST PLAYERS
A842: NORTHCOTE | C842: GRAY | E842: ACKLAND | H842: WOODS | K842: PYE | N842: WILLIAMSON | Q842: SIMMONDS
A843: SANDRINGHAM | C843: KEMP | E843: THOMS | H843: NOSEDA | K843: GILLIGAN | N843: PORTER | Q843: MICHAELSON
A844: GOALKICKERS
A845: NORTHCOTE | C845: SEYMOUR 5 | F845: GRAY 2 | H845: PYE 2 | J845: SIMMONDS | M845: McINERNEY | P845: HART | R845: KOOCHEW
A846: SANDRINGHAM | C846: POUND 2 | E846: WITCHELL 2 | H846: ROBERTS | J846: CHRISTIE | M846: MILLER | O846: MEEHAN | Q846: MICHAELSON | T846: MALLETT
A848: ROUND 16 | E848: 27TH JULY | J848: WEATHER | M848: FINE NORTH BREEZE | S848: PLAYED AT
D849: 1ST QTR | H849: 2ND QTR | L849: 3RD QTR | P849: FINAL | S849: COBURG
A850: COBURG | C850: 2 | D850: 0 | E850: =C850*6+D850 -> 12 | G850: 7 | H850: 2 | I850: =G850*6+H850 -> 44 | K850: 13 | L850: 4 | M850: =K850*6+L850 -> 82 | O850: 19 | P850: 7 | Q850: =O850*6+P850 -> 121 | S850: UMPIRE | X850: LADDER | AB850: ROUND | AD850: 16
A851: OAKLEIGH | C851: 3 | D851: 2 | E851: =C851*6+D851 -> 20 | G851: 5 | H851: 4 | I851: =G851*6+H851 -> 34 | K851: 9 | L851: 9 | M851: =K851*6+L851 -> 63 | O851: 10 | P851: 11 | Q851: =O851*6+P851 -> 71 | S851: GLOVER
A852: BEST PLAYERS | W852: TEAM | X852: W | Y852: L | Z852: D | AA852: FOR | AB852: AGST | AC852: % | AD852: PTS
A853: COBURG | C853: BROOM | F853: WALLACE | I853: McFARLANE | L853: HARRIS | N853: O'KEEFE | Q853: RALSTON
A854: OAKLEIGH | C854: HARRISON | F854: HEINTZ | I854: HICKS | L854: BAKER | N854: BAWDEN | Q854: WILTSHIRE | W854: NORTHCOTE | X854: 14 | Y854: 2 | Z854: 0 | AA854: 1588 | AB854: 1135 | AC854: 139.91 | AD854: 56
A855: GOALKICKERS | W855: YARRAVILLE | X855: 12 | Y855: 4 | Z855: 0 | AA855: 1684 | AB855: 1131 | AC855: 148.89 | AD855: 48
A856: COBURG | C856: BROOM 7 | E856: LEONARD 4 | H856: McKEY 2 | J856: HARRIS 2 | M856: RALSTON 2 | P856: DUNCAN | R856: O'KEEFE | W856: CAMBERWELL | X856: 11 | Y856: 5 | Z856: 0 | AA856: 1572 | AB856: 1154 | AC856: 136.22 | AD856: 44
A857: OAKLEIGH | C857: HARRISON 4 | F857: FRASER 2 | I857: HEINTZ 2 | K857: CAMPBELL | N857: BAWDON | W857: COBURG | X857: 9 | Y857: 6 | Z857: 1 | AA857: 1426 | AB857: 1334 | AC857: 106.9 | AD857: 38
A859: PRAHRAN | C859: 2 | D859: 3 | E859: =C859*6+D859 -> 15 | G859: 4 | H859: 7 | I859: =G859*6+H859 -> 31 | K859: 6 | L859: 10 | M859: =K859*6+L859 -> 46 | O859: 9 | P859: 15 | Q859: =O859*6+P859 -> 69 | S859: TOORAK PARK | W859: PRESTON | X859: 9 | Y859: 6 | Z859: 1 | AA859: 1311 | AB859: 1332 | AC859: 98.42 | AD859: 38
A860: BRUNSWICK | C860: 3 | D860: 5 | E860: =C860*6+D860 -> 23 | G860: 3 | H860: 7 | I860: =G860*6+H860 -> 25 | K860: 7 | L860: 8 | M860: =K860*6+L860 -> 50 | O860: 7 | P860: 9 | Q860: =O860*6+P860 -> 51 | S860: LESTER | W860: PRAHRAN | X860: 9 | Y860: 7 | Z860: 0 | AA860: 1421 | AB860: 1066 | AC860: 133.3 | AD860: 36
A861: BEST PLAYERS | W861: OAKLEIGH | X861: 8 | Y861: 7 | Z861: 1 | AA861: 1400 | AB861: 1496 | AC861: 93.58 | AD861: 34
A862: PRAHRAN | C862: AVERY | E862: WESCOTT | H862: TABATEAU | K862: WHITE | N862: MUNN | Q862: BRENCHLEY | W862: BRUNSWICK | X862: 8 | Y862: 8 | Z862: 0 | AA862: 1257 | AB862: 1205 | AC862: 104.32 | AD862: 32
A863: BRUNSWICK | C863: JONES | E863: DOWLING | H863: GILLON | K863: CLARKE | N863: PALMER | Q863: LEE | W863: PORT MELBOURNE | X863: 6 | Y863: 9 | Z863: 1 | AA863: 1205 | AB863: 1348 | AC863: 89.39 | AD863: 26
A864: GOALKICKERS | W864: BRIGHTON | X864: 3 | Y864: 13 | Z864: 0 | AA864: 1317 | AB864: 1564 | AC864: 84.207161125319686 | AD864: 12
A865: PRAHRAN | C865: BRENCHLEY 4 | F865: WHITE 2 | I865: ANDERSON 2 | L865: AVERY | W865: SANDRINGHAM | X865: 3 | Y865: 13 | Z865: 0 | AA865: 1157 | AB865: 1785 | AC865: 64.82 | AD865: 12
A866: BRUNSWICK | C866: JONES 2 | F866: GILLON 2 | I866: DOWLING | L866: CLARKE | N866: McKERNAN | W866: WILLIAMSTOWN | X866: 2 | Y866: 14 | Z866: 0 | AA866: 1045 | AB866: 1833 | AC866: 57.01 | AD866: 8
A868: PRESTON | C868: 3 | D868: 2 | E868: =C868*6+D868 -> 20 | G868: 6 | H868: 9 | I868: =G868*6+H868 -> 45 | K868: 9 | L868: 11 | M868: =K868*6+L868 -> 65 | O868: 16 | P868: 17 | Q868: =O868*6+P868 -> 113 | S868: PRESTON
A869: BRIGHTON | C869: 1 | D869: 5 | E869: =C869*6+D869 -> 11 | G869: 5 | H869: 7 | I869: =G869*6+H869 -> 37 | K869: 8 | L869: 11 | M869: =K869*6+L869 -> 59 | O869: 9 | P869: 12 | Q869: =O869*6+P869 -> 66 | S869: GREGORY
A870: BEST PLAYERS
A871: PRESTON | C871: UNDERHILL | F871: WARR | I871: HARDING | L871: CAMERON | O871: HUGO | Q871: HUGHSON
A872: BRIGHTON | C872: DREW | F872: HINDSON | I872: BOURNE | L872: CONNELL | O872: McLEOD | Q872: SHERLOCK
A873: GOALKICKERS
A874: PRESTON | C874: WARR 8 | F874: HARDING 4 | I874: CLARKE 2 | L874: CAMERON | O874: ARTHUR
A875: BRIGHTON | C875: DREW 2 | F875: BOLWELL 2 | I875: FORBES 2 | L875: KING 2 | O875: McLEOD
A877: YARRAVILLE | C877: 6 | D877: 1 | E877: =C877*6+D877 -> 37 | G877: 11 | H877: 8 | I877: =G877*6+H877 -> 74 | K877: 16 | L877: 12 | M877: =K877*6+L877 -> 108 | O877: 23 | P877: 20 | Q877: =O877*6+P877 -> 158 | S877: YARRAVILLE
A878: PORT MELBOURNE | C878: 5 | D878: 2 | E878: =C878*6+D878 -> 32 | G878: 5 | H878: 4 | I878: =G878*6+H878 -> 34 | K878: 7 | L878: 5 | M878: =K878*6+L878 -> 47 | O878: 11 | P878: 7 | Q878: =O878*6+P878 -> 73 | S878: LEWIS
A879: BEST PLAYERS
A880: YARRAVILLE | C880: HOPKINS | F880: J BUCKLEY | I880: WARDEN | L880: SHEEHAN | O880: EVANS | Q880: ELLIS
A881: PORT MELBOURNE | C881: PLUMRIDGE | F881: GOTZ | I881: JULIER | L881: BLOOMER | O881: KEATING | Q881: ATKINSON
A882: GOALKICKERS
A883: YARRAVILLE | C883: BUCKLEY 6 | F883: WARDEN 6 | I883: McGRATH 3 | L883: HOPKINS 2 | N883: SHEEHAN 2 | Q883: WEDGWOOD | T883: WILLIAMS | W883: KENNY | X883: R SMITH
A884: PORT MELBOURNE | C884: GOMEZ 2 | E884: TYSON 2 | G884: TYRELL 2 | I884: EASTMUIR 2 | L884: KEATING | N884: GOTZ | P884: SHAPTER
A886: CAMBERWELL | C886: 4 | D886: 5 | E886: =C886*6+D886 -> 29 | G886: 7 | H886: 9 | I886: =G886*6+H886 -> 51 | K886: 12 | L886: 14 | M886: =K886*6+L886 -> 86 | O886: 15 | P886: 18 | Q886: =O886*6+P886 -> 108 | S886: BEACH ROAD
A887: SANDRINGHAM | C887: 2 | D887: 3 | E887: =C887*6+D887 -> 15 | G887: 6 | H887: 4 | I887: =G887*6+H887 -> 40 | K887: 7 | L887: 5 | M887: =K887*6+L887 -> 47 | O887: 7 | P887: 7 | Q887: =O887*6+P887 -> 49 | S887: WHITBOURN
A888: BEST PLAYERS
A889: CAMBERWELL | C889: WARE | E889: TATHAM | H889: WALKER | K889: W LUFF | N889: H JONES | Q889: BRETT
A890: SANDRINGHAM | C890: MILLER | E890: MEEHAN | H890: KEMP | K890: SMAIL | N890: GILLIGAN | Q890: ROBERTS
A891: GOALKICKERS
A892: CAMBERWELL | C892: LUFF 5 | E892: TATHAM 2 | H892: MASON 2 | J892: HENDERSON 2 | M892: DAVIDSON 2 | P892: MEEHL | R892: CLAMP
A893: SANDRINGHAM | C893: ROBERTS 3 | F893: TOLSON | I893: SMAIL | L893: MILLER | N893: WITCHELL
A895: NORTHCOTE | C895: 1 | D895: 8 | E895: =C895*6+D895 -> 14 | G895: 5 | H895: 14 | I895: =G895*6+H895 -> 44 | K895: 11 | L895: 19 | M895: =K895*6+L895 -> 85 | O895: 19 | P895: 27 | Q895: =O895*6+P895 -> 141 | S895: NORTHCOTE
A896: WILLIAMSTOWN | C896: 2 | D896: 0 | E896: =C896*6+D896 -> 12 | G896: 4 | H896: 1 | I896: =G896*6+H896 -> 25 | K896: 6 | L896: 3 | M896: =K896*6+L896 -> 39 | O896: 8 | P896: 5 | Q896: =O896*6+P896 -> 53 | S896: STUART
A897: BEST PLAYERS
A898: NORTHCOTE | C898: ROSS | E898: PYE | H898: WOODS | K898: GARRETT | N898: BATES | Q898: GRAY
A899: WILLIAMSTOWN | C899: BROOKS | E899: LAWLOR | H899: PITTS | K899: POWER | N899: RAEBURN | Q899: STEBBINS
A900: GOALKICKERS
A901: NORTHCOTE | C901: SIMMONDS 5 | F901: SEYMOUR 4 | I901: GRAY 2 | K901: ROSS 2 | M901: BATES 2 | O901: WILLIAMSON | R901: GOULLET | U901: PYE | W901: McINERNEY
A902: WILLIAMSTOWN | C902: LAWLOR 5 | F902: RAEBURN 2 | I902: PITTS
A904: ROUND 17 | E904: 3RD AUGUST | J904: WEATHER | M904: COLD SHOWERS S.W. WIND | S904: PLAYED AT
D905: 1ST QTR | H905: 2ND QTR | L905: 3RD QTR | P905: FINAL | S905: CAMBERWELL
A906: COBURG | C906: 1 | D906: 6 | E906: =C906*6+D906 -> 12 | G906: 4 | H906: 9 | I906: =G906*6+H906 -> 33 | K906: 8 | L906: 10 | M906: =K906*6+L906 -> 58 | O906: 9 | P906: 14 | Q906: =O906*6+P906 -> 68 | S906: UMPIRE | X906: LADDER | AB906: ROUND | AD906: 17
A907: CAMBERWELL | C907: 2 | D907: 4 | E907: =C907*6+D907 -> 16 | G907: 4 | H907: 11 | I907: =G907*6+H907 -> 35 | K907: 6 | L907: 17 | M907: =K907*6+L907 -> 53 | O907: 7 | P907: 19 | Q907: =O907*6+P907 -> 61 | S907: GLOVER
A908: BEST PLAYERS | W908: TEAM | X908: W | Y908: L | Z908: D | AA908: FOR | AB908: AGST | AC908: % | AD908: PTS
A909: COBURG | C909: RALSTON | F909: WALLACE | I909: DUNCAN | L909: REITSCHELL | O909: HARRIS | R909: UHE
A910: CAMBERWELL | C910: WILLIAMS | F910: CLAMP | I910: TATHAM | L910: DAVIDSON | O910: FINLAYSON | R910: BRETT | W910: NORTHCOTE | X910: 15 | Y910: 2 | Z910: 0 | AA910: 1683 | AB910: 1211 | AC910: 138.98 | AD910: 60
A911: GOALKICKERS | W911: YARRAVILLE | X911: 12 | Y911: 5 | Z911: 0 | AA911: 1768 | AB911: 1221 | AC911: 144.8 | AD911: 48
A912: COBURG | C912: DUNCAN 3 | F912: LEONARD 2 | I912: HENNING | K912: VOIGHT | M912: RALSTON | P912: BROOM | W912: CAMBERWELL | X912: 11 | Y912: 6 | Z912: 0 | AA912: 1633 | AB912: 1222 | AC912: 133.63 | AD912: 44
A913: CAMBERWELL | C913: TATHAM | F913: JONES | H913: WILLIAMS | J913: LUFF | L913: HENDERSON | O913: MEEHL | Q913: DAVIDSON | W913: COBURG | X913: 10 | Y913: 6 | Z913: 1 | AA913: 1494 | AB913: 1395 | AC913: 107.1 | AD913: 42
A915: OAKLEIGH | C915: 4 | D915: 8 | E915: =C915*6+D915 -> 32 | G915: 5 | H915: 12 | I915: =G915*6+H915 -> 42 | K915: 8 | L915: 22 | M915: =K915*6+L915 -> 70 | O915: 11 | P915: 24 | Q915: =O915*6+P915 -> 90 | S915: OAKLEIGH | W915: PRESTON | X915: 10 | Y915: 6 | Z915: 1 | AA915: 1417 | AB915: 1380 | AC915: 102.68 | AD915: 42
A916: YARRAVILLE | C916: 2 | D916: 1 | E916: =C916*6+D916 -> 13 | G916: 9 | H916: 3 | I916: =G916*6+H916 -> 57 | K916: 10 | L916: 4 | M916: =K916*6+L916 -> 64 | O916: 13 | P916: 6 | Q916: =O916*6+P916 -> 84 | S916: STUART | W916: PRAHRAN | X916: 10 | Y916: 7 | Z916: 0 | AA916: 1545 | AB916: 1140 | AC916: 135.53 | AD916: 40
A917: BEST PLAYERS | W917: OAKLEIGH | X917: 9 | Y917: 7 | Z917: 1 | AA917: 1490 | AB917: 1580 | AC917: 94.3 | AD917: 38
A918: OAKLEIGH | C918: POWELL | F918: HUTCHESON | I918: WITHERS | L918: BAKER | O918: KIDD | Q918: HARRISON | W918: BRUNSWICK | X918: 8 | Y918: 9 | Z918: 0 | AA918: 1333 | AB918: 1300 | AC918: 102.54 | AD918: 32
A919: YARRAVILLE | C919: J BUCKLEY | F919: ELLIS | I919: STREETER | L919: I EVANS | O919: HOPKINS | Q919: PETERS | W919: PORT MELBOURNE | X919: 6 | Y919: 10 | Z919: 1 | AA919: 1253 | AB919: 1454 | AC919: 86.18 | AD919: 26
A920: GOALKICKERS | W920: BRIGHTON | X920: 3 | Y920: 14 | Z920: 0 | AA920: 1391 | AB920: 1688 | AC920: 82.405213270142184 | AD920: 12
A921: OAKLEIGH | C921: HARRISON 4 | F921: MORRISON 4 | I921: RYAN 2 | L921: CAMPBELL | W921: SANDRINGHAM | X921: 3 | Y921: 14 | Z921: 0 | AA921: 1206 | AB921: 1862 | AC921: 64.77 | AD921: 12
A922: YARRAVILLE | C922: J BUCKLEY 9 | F922: CAVE | H922: I EVANS | J922: LAVENDER | M922: SHEEHAN | W922: WILLIAMSTOWN | X922: 3 | Y922: 14 | Z922: 0 | AA922: 1122 | AB922: 1882 | AC922: 59.62 | AD922: 12
A924: NORTHCOTE | C924: 3 | D924: 6 | E924: =C924*6+D924 -> 24 | G924: 6 | H924: 10 | I924: =G924*6+H924 -> 46 | K924: 13 | L924: 15 | M924: =K924*6+L924 -> 93 | O924: 13 | P924: 17 | Q924: =O924*6+P924 -> 95 | S924: BRUNSWICK
A925: BRUNSWICK | C925: 3 | D925: 0 | E925: =C925*6+D925 -> 18 | G925: 8 | H925: 1 | I925: =G925*6+H925 -> 49 | K925: 9 | L925: 1 | M925: =K925*6+L925 -> 55 | O925: 12 | P925: 4 | Q925: =O925*6+P925 -> 76 | S925: LESTER
A926: BEST PLAYERS
A927: NORTHCOTE | C927: GRAY | E927: HART | H927: PYE | K927: WILLIAMSON | N927: BATES | Q927: SIMMONDS
A928: BRUNSWICK | C928: FAY | E928: DOWLING | H928: JONES | K928: McELROY | N928: FARNAN | Q928: QUINLAN
A929: GOALKICKERS
A930: NORTHCOTE | C930: SIMMONDS 3 | F930: GRAY 3 | H930: PYE 3 | J930: ROSS 2 | L930: SEYMOUR | N930: LUDLOW
A931: BRUNSWICK | C931: JONES 5 | E931: McELROY 2 | H931: DOWLING | J931: PALMER | L931: DONNELLY | N931: ELLAWAY | Q931: CLARKE
A933: PRESTON | C933: 4 | D933: 8 | E933: =C933*6+D933 -> 32 | G933: 9 | H933: 12 | I933: =G933*6+H933 -> 66 | K933: 11 | L933: 19 | M933: =K933*6+L933 -> 85 | O933: 14 | P933: 22 | Q933: =O933*6+P933 -> 106 | S933: PRESTON
A934: PORT MELBOURNE | C934: 0 | D934: 0 | E934: =C934*6+D934 -> 0 | G934: 2 | H934: 5 | I934: =G934*6+H934 -> 17 | K934: 5 | L934: 5 | M934: =K934*6+L934 -> 35 | O934: 7 | P934: 6 | Q934: =O934*6+P934 -> 48 | S934: LEWIS
A935: BEST PLAYERS
A936: PRESTON | C936: HARDING | F936: MUIR | I936: A ROBINSON | L936: HUGO | O936: HUGHSON | R936: UNDERHILL
A937: PORT MELBOURNE | C937: JULIER | F937: BLOOMER | I937: SHAPTER | L937: PLUMRIDGE | O937: HUGHES | R937: KEATING
A938: GOALKICKERS
A939: PRESTON | C939: MUIR 3 | E939: ARTHUR 3 | H939: HARDING 3 | K939: WARR 2 | M939: CAMERON 2 | P939: UNDERHILL
A940: PORT MELBOURNE | C940: TYSON 2 | E940: ALLSOP 2 | H940: KEATING | J940: SHAPTER | M940: EASTMUIR
A942: WILLIAMSTOWN | C942: 2 | D942: 5 | E942: =C942*6+D942 -> 17 | G942: 2 | H942: 5 | I942: =G942*6+H942 -> 17 | K942: 7 | L942: 10 | M942: =K942*6+L942 -> 52 | O942: 11 | P942: 11 | Q942: =O942*6+P942 -> 77 | S942: WILLIAMSTOWN
A943: SANDRINGHAM | C943: 0 | D943: 1 | E943: =C943*6+D943 -> 1 | G943: 4 | H943: 6 | I943: =G943*6+H943 -> 30 | K943: 6 | L943: 7 | M943: =K943*6+L943 -> 43 | O943: 7 | P943: 7 | Q943: =O943*6+P943 -> 49 | S943: HASSETT
A944: BEST PLAYERS
A945: WILLIAMSTOWN | C945: LAWLOR | F945: PITTS | I945: RAEBURN | L945: BROOKS | O945: HARSLEY | Q945: MARTIN
A946: SANDRINGHAM | C946: TOLSON | F946: THOMS | I946: MEEHAN | L946: MICHAELSON | O946: KEMP | Q946: SMAIL
A947: GOALKICKERS
A948: WILLIAMSTOWN | C948: LAWLOR 3 | F948: PITTS 3 | I948: TAYLOR 2 | L948: RAEBURN | O948: THOMPSON | R948: MARTIN
A949: SANDRINGHAM | C949: ROBERTS 3 | F949: SMAIL | I949: THOMS | L949: MEEHAN | O949: PAYNE
A951: PRAHRAN | C951: 3 | D951: 1 | E951: =C951*6+D951 -> 19 | G951: 8 | H951: 5 | I951: =G951*6+H951 -> 53 | K951: 14 | L951: 8 | M951: =K951*6+L951 -> 92 | O951: 19 | P951: 10 | Q951: =O951*6+P951 -> 124 | S951: ELSTERNWICK PARK
A952: BRIGHTON | C952: 2 | D952: 3 | E952: =C952*6+D952 -> 15 | G952: 4 | H952: 4 | I952: =G952*6+H952 -> 28 | K952: 8 | L952: 7 | M952: =K952*6+L952 -> 55 | O952: 11 | P952: 8 | Q952: =O952*6+P952 -> 74 | S952: DAVENPORT
A953: BEST PLAYERS
A954: PRAHRAN | C954: BRENCHLEY | F954: SMITH | I954: WHITE | L954: KOOP | O954: AVERY | R954: MURRAY
A955: BRIGHTON | C955: SHERLOCK | F955: WEBER | I955: CONNELL | L955: BOURNE | O955: BOLWELL | R955: CONDON
A956: GOALKICKERS
A957: PRAHRAN | C957: BRENCHLEY 6 | F957: KLYNE 3 | I957: JOHNSON 3 | L957: WILLIAMS 2 | O957: WESCOTT | Q957: ANDERSON | T957: MURRAY | W957: WHITE | X957: AVERY
A958: BRIGHTON | C958: BOLWELL 3 | F958: KING 2 | I958: MILLER 2 | L958: CONNELL | N958: BOURNE | P958: TOMLINS | R958: SHERLOCK
A960: ROUND 18 | E960: 10TH AUGUST | J960: WEATHER | M960: CLOUDY SHOWERS S.W. WIND | S960: PLAYED AT
D961: 1ST QTR | H961: 2ND QTR | L961: 3RD QTR | P961: FINAL | S961: YARRAVILLE
A962: CAMBERWELL | C962: 4 | D962: 4 | E962: =C962*6+D962 -> 28 | G962: 7 | H962: 6 | I962: =G962*6+H962 -> 48 | K962: 11 | L962: 9 | M962: =K962*6+L962 -> 75 | O962: 12 | P962: 10 | Q962: =O962*6+P962 -> 82 | S962: UMPIRE | X962: LADDER | AB962: ROUND | AD962: 18
A963: YARRAVILLE | C963: 0 | D963: 1 | E963: =C963*6+D963 -> 1 | G963: 3 | H963: 6 | I963: =G963*6+H963 -> 24 | K963: 6 | L963: 9 | M963: =K963*6+L963 -> 45 | O963: 6 | P963: 13 | Q963: =O963*6+P963 -> 49 | S963: GLOVER
A964: BEST PLAYERS | W964: TEAM | X964: W | Y964: L | Z964: D | AA964: FOR | AB964: AGST | AC964: % | AD964: PTS
A965: CAMBERWELL | C965: DYBALL | F965: JONES | I965: TATHAM | L965: BRETT | N965: VANTHOFF | Q965: MASON
A966: YARRAVILLE | C966: WARDEN | F966: CAVE | I966: R EVANS | L966: I EVANS | N966: ELLIS | Q966: KENNY | W966: NORTHCOTE | X966: 16 | Y966: 2 | Z966: 0 | AA966: 1854 | AB966: 1274 | AC966: 145.53 | AD966: 64
A967: GOALKICKERS | Q967: MEEHAN | W967: YARRAVILLE | X967: 12 | Y967: 6 | Z967: 0 | AA967: 1817 | AB967: 1303 | AC967: 139.45 | AD967: 48
A968: CAMBERWELL | C968: TATHAM 3 | F968: LUFF 2 | H968: DAVIDSON 2 | K968: MASON | M968: VANTHOFF | O968: HENDERSON | R968: MEEHL | W968: CAMBERWELL | X968: 12 | Y968: 6 | Z968: 0 | AA968: 1715 | AB968: 1271 | AC968: 134.93 | AD968: 48
A969: YARRAVILLE | C969: WARDEN 4 | F969: BUCKLEY 2 | W969: COBURG | X969: 11 | Y969: 6 | Z969: 1 | AA969: 1634 | AB969: 1457 | AC969: 112.15 | AD969: 46
A971: PRAHRAN | C971: 3 | D971: 3 | E971: =C971*6+D971 -> 21 | G971: 6 | H971: 7 | I971: =G971*6+H971 -> 43 | K971: 9 | L971: 8 | M971: =K971*6+L971 -> 62 | O971: 13 | P971: 13 | Q971: =O971*6+P971 -> 91 | S971: TOORAK PARK | W971: PRAHRAN | X971: 11 | Y971: 7 | Z971: 0 | AA971: 1636 | AB971: 1180 | AC971: 138.64 | AD971: 44
A972: PRESTON | C972: 1 | D972: 3 | E972: =C972*6+D972 -> 9 | G972: 1 | H972: 7 | I972: =G972*6+H972 -> 13 | K972: 3 | L972: 9 | M972: =K972*6+L972 -> 27 | O972: 5 | P972: 10 | Q972: =O972*6+P972 -> 40 | S972: LESTER | W972: PRESTON | X972: 10 | Y972: 7 | Z972: 1 | AA972: 1457 | AB972: 1471 | AC972: 99.05 | AD972: 42
A973: BEST PLAYERS | W973: OAKLEIGH | X973: 9 | Y973: 8 | Z973: 1 | AA973: 1595 | AB973: 1710 | AC973: 93.27 | AD973: 38
A974: PRAHRAN | C974: HYDE | E974: WHITEHEAD | H974: JOHNSON | K974: BRENCHLEY | N974: WHITE | Q974: KOOP | W974: BRUNSWICK | X974: 9 | Y974: 9 | Z974: 0 | AA974: 1418 | AB974: 1362 | AC974: 104.11 | AD974: 36
A975: PRESTON | C975: MUIR | E975: MURRAY | H975: CAMERON | K975: A ROBINSON | N975: WARR | Q975: HUGHSON | W975: PORT MELBOURNE | X975: 7 | Y975: 10 | Z975: 1 | AA975: 1383 | AB975: 1559 | AC975: 88.71 | AD975: 30
A976: GOALKICKERS | W976: BRIGHTON | X976: 3 | Y976: 15 | Z976: 0 | AA976: 1454 | AB976: 1859 | AC976: 78.214093598708985 | AD976: 12
A977: PRAHRAN | C977: BRENCHLEY 7 | F977: ANDERSON 2 | I977: JOHNSON 2 | L977: WHITE | N977: KLYNE | W977: SANDRINGHAM | X977: 3 | Y977: 15 | Z977: 0 | AA977: 1268 | AB977: 1947 | AC977: 65.13 | AD977: 12
A978: PRESTON | C978: HUGHSON 2 | F978: CRANE | I978: O'CONNOR | L978: MURRAY | W978: WILLIAMSTOWN | X978: 3 | Y978: 15 | Z978: 0 | AA978: 1184 | AB978: 2022 | AC978: 58.56 | AD978: 12
A980: PORT MELBOURNE | C980: 3 | D980: 4 | E980: =C980*6+D980 -> 22 | G980: 9 | H980: 8 | I980: =G980*6+H980 -> 62 | K980: 13 | L980: 12 | M980: =K980*6+L980 -> 90 | O980: 19 | P980: 16 | Q980: =O980*6+P980 -> 130 | S980: PORT MELBOURNE
A981: OAKLEIGH | C981: 5 | D981: 6 | E981: =C981*6+D981 -> 36 | G981: 7 | H981: 10 | I981: =G981*6+H981 -> 52 | K981: 11 | L981: 13 | M981: =K981*6+L981 -> 79 | O981: 15 | P981: 15 | Q981: =O981*6+P981 -> 105 | S981: GEE
A982: BEST PLAYERS
A983: PORT MELBOURNE | C983: KEATING | F983: SHAPTER | I983: TYSON | L983: GARLEPP | O983: JUREY | Q983: ATKINSON
A984: OAKLEIGH | C984: BAWDEN | F984: HARRISON | I984: MORRISON | L984: STEIGENBERGER | O984: WITHERS | Q984: HUTCHESON
A985: GOALKICKERS
A986: PORT MELBOURNE | C986: TYRELL 6 | F986: TYSON 4 | I986: SHAPTER 3 | L986: ALSOP 3 | N986: KEATING | P986: GOTZ | R986: EASTMUIR
A987: OAKLEIGH | C987: MORRISON 5 | F987: HARRISON 3 | I987: RYAN 2 | K987: BAWDON 2 | N987: WITHERS | P987: BELL | R987: CAMPBELL
A989: BRUNSWICK | C989: 3 | D989: 7 | E989: =C989*6+D989 -> 25 | G989: 5 | H989: 13 | I989: =G989*6+H989 -> 43 | K989: 10 | L989: 16 | M989: =K989*6+L989 -> 76 | O989: 11 | P989: 19 | Q989: =O989*6+P989 -> 85 | S989: BEACH ROAD
A990: SANDRINGHAM | C990: 1 | D990: 3 | E990: =C990*6+D990 -> 9 | G990: 3 | H990: 8 | I990: =G990*6+H990 -> 26 | K990: 6 | L990: 12 | M990: =K990*6+L990 -> 48 | O990: 8 | P990: 14 | Q990: =O990*6+P990 -> 62 | S990: ROFE
A991: BEST PLAYERS
A992: BRUNSWICK | C992: FAY | E992: DOWLING | I992: PALMER | L992: DONNELLY | O992: JONES | Q992: McELROY
A993: SANDRINGHAM | C993: THOMS | E993: KEMP | I993: MICHAELSON | L993: MEEHAN | O993: ROBERTS | Q993: POUND
A994: GOALKICKERS
A995: BRUNSWICK | C995: JONES 6 | F995: DOWLING | I995: PALMER | K995: GILLON | M995: KENNEDY | O995: McKERNAN
A996: SANDRINGHAM | C996: ROBERTS 3 | F996: WITCHELL 2 | I996: POUND | K996: LUNN | M996: CHALLIS
A998: COBURG | C998: 2 | D998: 5 | E998: =C998*6+D998 -> 17 | G998: 8 | H998: 7 | I998: =G998*6+H998 -> 55 | K998: 15 | L998: 11 | M998: =K998*6+L998 -> 101 | O998: 20 | P998: 20 | Q998: =O998*6+P998 -> 140 | S998: COBURG
A999: WILLIAMSTOWN | C999: 2 | D999: 2 | E999: =C999*6+D999 -> 14 | G999: 4 | H999: 2 | I999: =G999*6+H999 -> 26 | K999: 5 | L999: 6 | M999: =K999*6+L999 -> 36 | O999: 9 | P999: 8 | Q999: =O999*6+P999 -> 62 | S999: GREGORY
A1000: BEST PLAYERS
A1001: COBURG | C1001: BROOM | E1001: RALSTON | H1001: O'KEEFE | K1001: HARRIS | N1001: LEONARD | Q1001: COLLINS
A1002: WILLIAMSTOWN | C1002: BROOKS | E1002: McGILLIVRAY | H1002: LAWLOR | K1002: PITTS | N1002: RAEBURN | Q1002: WARD
A1003: GOALKICKERS
A1004: COBURG | C1004: COLLINS 5 | F1004: DUNCAN 3 | I1004: LEONARD 3 | L1004: O'KEEFE 3 | N1004: LE FANNUE 2 | Q1004: VOIGHT | S1004: RALSTON | W1004: McFARLANE | X1004: WITHERS
A1005: WILLIAMSTOWN | C1005: LAWLOR 3 | F1005: PITTS 3 | H1005: WARD | J1005: PANNELL | M1005: SMITH
A1007: NORTHCOTE | C1007: 6 | D1007: 6 | E1007: =C1007*6+D1007 -> 42 | G1007: 12 | H1007: 11 | I1007: =G1007*6+H1007 -> 83 | K1007: 18 | L1007: 18 | M1007: =K1007*6+L1007 -> 126 | O1007: 25 | P1007: 21 | Q1007: =O1007*6+P1007 -> 171 | S1007: NORTHCOTE
A1008: BRIGHTON | C1008: 0 | D1008: 1 | E1008: =C1008*6+D1008 -> 1 | G1008: 5 | H1008: 3 | I1008: =G1008*6+H1008 -> 33 | K1008: 6 | L1008: 3 | M1008: =K1008*6+L1008 -> 39 | O1008: 9 | P1008: 9 | Q1008: =O1008*6+P1008 -> 63 | S1008: JURY
A1009: BEST PLAYERS
A1010: NORTHCOTE | C1010: ROSS | E1010: SIMMONDS | H1010: GRAY | K1010: SEYMOUR | N1010: GOULLETT | Q1010: WILLIAMSON
A1011: BRIGHTON | C1011: DREW | E1011: BURTON | H1011: BOLWELL | K1011: McLEOD | N1011: CONDON | Q1011: HALLAHAN
A1012: GOALKICKERS
A1013: NORTHCOTE | C1013: SEYMOUR 7 | F1013: SIMMONDS 3 | I1013: GRAY 3 | K1013: ROSS 3 | M1013: PYE 3 | N1013: WILLIAMSON 2 | Q1013: HONIG 2 | S1013: HART | U1013: GOULLETT
A1014: BRIGHTON | C1014: McLEOD 6 | F1014: DREW | H1014: FORBES
A1016: FINALS
A1017: 1ST SEMI | E1017: 17TH AUGUST | I1017: WEATHER | L1017: FINE WEST BREEZE LATE SHOWERS | S1017: PLAYED AT
D1018: 1ST QTR | H1018: 2ND QTR | L1018: 3RD QTR | P1018: FINAL | S1018: TOORAK PARK
A1019: CAMBERWELL | C1019: 5 | D1019: 2 | E1019: =C1019*6+D1019 -> 32 | G1019: 8 | H1019: 4 | I1019: =G1019*6+H1019 -> 52 | K1019: 13 | L1019: 11 | M1019: =K1019*6+L1019 -> 89 | O1019: 20 | P1019: 13 | Q1019: =O1019*6+P1019 -> 133 | S1019: UMPIRE
A1020: COBURG | C1020: 2 | D1020: 3 | E1020: =C1020*6+D1020 -> 15 | G1020: 7 | H1020: 5 | I1020: =G1020*6+H1020 -> 47 | K1020: 9 | L1020: 6 | M1020: =K1020*6+L1020 -> 60 | O1020: 11 | P1020: 10 | Q1020: =O1020*6+P1020 -> 76 | S1020: GLOVER
A1021: BEST PLAYERS
A1022: CAMBERWELL | C1022: WILLIAMS | F1022: DAVIDSON | I1022: MEEHL | K1022: TATHAM | N1022: MASON | Q1022: MEEHAN
A1023: COBURG | C1023: RALSTON | F1023: McFARLANE | I1023: VOIGHT | K1023: HENNING | N1023: O'KEEFE | Q1023: WALLACE
A1024: GOALKICKERS
A1025: CAMBERWELL | C1025: LUFF 5 | E1025: MEEHAN 4 | H1025: TATHAM 2 | K1025: MASON 2 | M1025: MEEHL 2 | O1025: DAVIDSON 2 | R1025: VANTHOFF | U1025: HENDERSON | X1025: CLAMP
A1026: COBURG | C1026: DUNCAN 4 | F1026: O'KEEFE 3 | I1026: LEONARD 2 | L1026: VOIGHT | N1026: BROOM
A1028: 2ND SEMI | E1028: 24TH AUGUST | J1028: WEATHER | M1028: FINE LIGHT NORTH BREEZE
A1029: YARRAVILLE | C1029: 8 | D1029: 7 | E1029: =C1029*6+D1029 -> 55 | G1029: 9 | H1029: 9 | I1029: =G1029*6+H1029 -> 63 | K1029: 12 | L1029: 12 | M1029: =K1029*6+L1029 -> 84 | O1029: 15 | P1029: 14 | Q1029: =O1029*6+P1029 -> 104 | S1029: COBURG
A1030: NORTHCOTE | C1030: 3 | D1030: 1 | E1030: =C1030*6+D1030 -> 19 | G1030: 6 | H1030: 7 | I1030: =G1030*6+H1030 -> 43 | K1030: 7 | L1030: 9 | M1030: =K1030*6+L1030 -> 51 | O1030: 13 | P1030: 9 | Q1030: =O1030*6+P1030 -> 87 | S1030: GLOVER
A1031: BEST PLAYERS
A1032: YARRAVILLE | C1032: WEDGWOOD | F1032: McGRATH | I1032: WARDEN | L1032: CAVE | N1032: ELLIS | Q1032: PETERS
A1033: NORTHCOTE | C1033: BATES | F1033: PYE | I1033: WILLIAMSON | L1033: ROSS | N1033: POWELL | Q1033: GRAY
A1034: GOALKICKERS
A1035: YARRAVILLE | C1035: McGRATH 6 | F1035: BUCKLEY 2 | I1035: WARDEN 2 | L1035: STOREY 2 | N1035: STREETER | Q1035: WEDGWOOD | T1035: CASHMAN
A1036: NORTHCOTE | C1036: SEYMOUR 5 | F1036: ROSS 2 | H1036: GOULLET 2 | J1036: MEITZKE | L1036: GRAY | N1036: WILLIAMSON | Q1036: LUDLOW
A1038: PRELIMINARY FINAL | F1038: 31ST AUGUST | J1038: WEATHER | M1038: CLOUDY N.W. WIND
A1039: CAMBERWELL | C1039: 2 | D1039: 1 | E1039: =C1039*6+D1039 -> 13 | G1039: 6 | H1039: 7 | I1039: =G1039*6+H1039 -> 43 | K1039: 6 | L1039: 9 | M1039: =K1039*6+L1039 -> 45 | O1039: 9 | P1039: 18 | Q1039: =O1039*6+P1039 -> 72 | S1039: BRUNSWICK
A1040: NORTHCOTE | C1040: 2 | D1040: 8 | E1040: =C1040*6+D1040 -> 20 | G1040: 3 | H1040: 10 | I1040: =G1040*6+H1040 -> 28 | K1040: 9 | L1040: 10 | M1040: =K1040*6+L1040 -> 64 | O1040: 10 | P1040: 10 | Q1040: =O1040*6+P1040 -> 70 | S1040: GREGORY
A1041: BEST PLAYERS
A1042: CAMBERWELL | C1042: WALKER | F1042: BRETT | I1042: JONES | L1042: LUFF | N1042: MASON | Q1042: HENDERSON
A1043: NORTHCOTE | C1043: ROSS | F1043: MEITZCKE | I1043: GARRETT | L1043: PYE | N1043: HART | Q1043: BATES
A1044: GOALKICKERS
A1045: CAMBERWELL | C1045: LUFF 5 | F1045: TATHAM | I1045: MASON | K1045: WILLIAMS | N1045: DAVIDSON
A1046: NORTHCOTE | C1046: SEYMOUR 4 | F1046: SIMMONDS | I1046: GRAY | K1046: GOULLET | M1046: PYE | N1046: HONIG | P1046: LYNGCOLN
A1048: GRAND FINAL | E1048: 7TH SEPTEMBER | J1048: WEATHER | M1048: FINE COOL SOUTH WIND
A1049: YARRAVILLE | C1049: 0 | D1049: 0 | E1049: =C1049*6+D1049 -> 0 | G1049: 4 | H1049: 4 | I1049: =G1049*6+H1049 -> 28 | K1049: 6 | L1049: 6 | M1049: =K1049*6+L1049 -> 42 | O1049: 10 | P1049: 10 | Q1049: =O1049*6+P1049 -> 70 | S1049: TOORAK PARK
A1050: CAMBERWELL | C1050: 2 | D1050: 5 | E1050: =C1050*6+D1050 -> 17 | G1050: 2 | H1050: 8 | I1050: =G1050*6+H1050 -> 20 | K1050: 7 | L1050: 12 | M1050: =K1050*6+L1050 -> 54 | O1050: 8 | P1050: 13 | Q1050: =O1050*6+P1050 -> 61 | S1050: GREGORY
A1051: BEST PLAYERS
A1052: YARRAVILLE | C1052: CASHMAN | F1052: WEDGWOOD | I1052: RYAN | L1052: HOPKINS | O1052: CAVE | Q1052: STREETER
A1053: CAMBERWELL | C1053: FINLAYSON | F1053: WILLIAMS | I1053: HENDERSON | L1053: BRETT | O1053: WALKER | Q1053: CAREY
A1054: GOALKICKERS
A1055: YARRAVILLE | C1055: J BUCKLEY 3 | F1055: McGRATH 3 | I1055: CASHMAN 2 | L1055: CAVE | N1055: KENNY
A1056: CAMBERWELL | C1056: WILLIAMS 2 | F1056: LUFF 2 | I1056: MASON 2 | L1056: TATHAM | N1056: MEEHAN
A1058: TEAMS
G1059: YARRAVILLE | R1059: CAMBERWELL
A1060: BACKS | C1060: STREETER | G1060: ELLIS | J1060: PETERS | N1060: FINLAYSON | R1060: CAREY | V1060: H JONES
A1061: H-BACKS | C1061: W BUCKLEY | G1061: RYAN | J1061: RAWSON | N1061: BRETT | R1061: DYBALL | V1061: WALKER
A1062: CENTRES | C1062: R EVANS | G1062: HOPKINS | J1062: FREW | N1062: CLAMP | R1062: R WILLIAMS | V1062: PIERCE
A1063: H-FORWARDS | C1063: A EVANS | G1063: CASHMAN | J1063: KENNY | N1063: SELLECK | R1063: MEEHL | V1063: WARE
A1064: FORWARDS | C1064: STOREY | G1064: J BUCKLEY | J1064: McGRATH | N1064: MEEHAN | R1064: W LUFF | V1064: TATHAM
A1065: RUCKS | C1065: SMITH | G1065: CAVE | J1065: WEDGEWOOD | N1065: MASON | R1065: HENDERSON | V1065: VANTHOFF
A1066: RES | C1066: WILLIAMS | N1066: BEAGLEY