A1: Victorian Football Association
A2: Season 1936
A3: © Copyright Wal Williams | F3: First created: 2 November 2014
A4: Contact: joywalwi at gmail dot com | F4: Last updated: 27 January 2018 | W4: VFA Results and tables - Link to the main index page
A5: You are free to copy this document in whole or part provided that proper acknowledgement is given to the author. All rights reserved.
A7: YEAR 1936
A8: ROUND 1 | E8: 13TH APRIL | J8: WEATHER | S8: PLAYED AT
D9: 1ST QTR | H9: 2ND QTR | L9: 3RD QTR | P9: FINAL | S9: TOORAK PARK
A10: PRAHRAN | C10: 2 | D10: 4 | E10: =C10*6+D10 -> 16 | G10: 6 | H10: 10 | I10: =G10*6+H10 -> 46 | K10: 11 | L10: 17 | M10: =K10*6+L10 -> 83 | O10: 14 | P10: 21 | Q10: =O10*6+P10 -> 105 | S10: UMPIRE | X10: LADDER | AB10: ROUND | AD10: 1
A11: PORT MELBOURNE | C11: 5 | D11: 6 | E11: =C11*6+D11 -> 36 | G11: 7 | H11: 12 | I11: =G11*6+H11 -> 54 | K11: 10 | L11: 15 | M11: =K11*6+L11 -> 75 | O11: 13 | P11: 17 | Q11: =O11*6+P11 -> 95 | S11: GREGORY
A12: BEST PLAYERS | W12: TEAM | X12: W | Y12: L | Z12: D | AA12: FOR | AB12: AGST | AC12: % | AD12: PTS
A13: PRAHRAN | C13: WHITE | E13: WESCOTT | H13: LOWRY | J13: JOHNSON | M13: J WILTSHIRE | P13: WHITEHEAD
A14: PORT MELBOURNE | C14: TIMMS | E14: GOMEZ | H14: KEATING | J14: BROOKER | M14: JULIER | P14: TYSON | W14: YARRAVILLE | X14: 1 | Y14: 0 | Z14: 0 | AA14: 141 | AB14: 80 | AC14: 176.25 | AD14: 4
A15: GOALKICKERS | P15: HAWKER | W15: BRUNSWICK | X15: 1 | Y15: 0 | Z15: 0 | AA15: 124 | AB15: 89 | AC15: 139.32584269662922 | AD15: 4
A16: PRAHRAN | C16: BRENCHLEY 3 | F16: JOHNSON 3 | I16: LOWRY 2 | K16: SHARPLEY 2 | N16: KLINE | P16: BARTLETT | R16: WHITE | W16: CAMBERWELL | X16: 1 | Y16: 0 | Z16: 0 | AA16: 82 | AB16: 59 | AC16: 138.98305084745763 | AD16: 4
A17: PORT MELBOURNE | C17: GOMEZ 3 | E17: TYSON 2 | G17: TIMMS 2 | I17: TYRELL 2 | K17: CRAWSHAW | N17: BROOKER | Q17: FULTON | S17: EARL | W17: BRIGHTON | X17: 1 | Y17: 0 | Z17: 0 | AA17: 127 | AB17: 95 | AC17: 133.68421052631578 | AD17: 4
A19: BRUNSWICK | C19: 3 | D19: 2 | E19: =C19*6+D19 -> 20 | G19: 5 | H19: 5 | I19: =G19*6+H19 -> 35 | K19: 11 | L19: 12 | M19: =K19*6+L19 -> 78 | O19: 17 | P19: 22 | Q19: =O19*6+P19 -> 124 | S19: BRUNSWICK | W19: NORTHCOTE | X19: 1 | Y19: 0 | Z19: 0 | AA19: 118 | AB19: 106 | AC19: 111.32075471698113 | AD19: 4
A20: COBURG | C20: 3 | D20: 3 | E20: =C20*6+D20 -> 21 | G20: 9 | H20: 9 | I20: =G20*6+H20 -> 63 | K20: 10 | L20: 10 | M20: =K20*6+L20 -> 70 | O20: 13 | P20: 11 | Q20: =O20*6+P20 -> 89 | S20: GLOVER | W20: PRAHRAN | X20: 1 | Y20: 0 | Z20: 0 | AA20: 105 | AB20: 95 | AC20: 110.52631578947368 | AD20: 4
A21: BEST PLAYERS | W21: PORT MELBOURNE | X21: 0 | Y21: 1 | Z21: 0 | AA21: 95 | AB21: 105 | AC21: 90.476190476190482 | AD21: 0
A22: BRUNSWICK | C22: COOPER | F22: DOWLING | I22: GILLON | K22: McELROY | N22: KENNEDY | Q22: BOYD | W22: PRESTON | X22: 0 | Y22: 1 | Z22: 0 | AA22: 106 | AB22: 118 | AC22: 89.830508474576277 | AD22: 0
A23: COBURG | C23: COLLINS | F23: OLSON | I23: PEARCE | K23: KNOTT | N23: O'KEEFE | Q23: JORDAN | W23: SANDRINGHAM | X23: 0 | Y23: 1 | Z23: 0 | AA23: 95 | AB23: 127 | AC23: 74.803149606299215 | AD23: 0
A24: GOALKICKERS | W24: COBURG | X24: 0 | Y24: 1 | Z24: 0 | AA24: 89 | AB24: 124 | AC24: 71.774193548387103 | AD24: 0
A25: BRUNSWICK | C25: COOPER 8 | F25: LASKY 2 | I25: GILLON 2 | K25: MASKELL | M25: KENNEDY | P25: BOSCHEN | W25: OAKLEIGH | X25: 0 | Y25: 1 | Z25: 0 | AA25: 59 | AB25: 85 | AC25: 69.411764705882348 | AD25: 0
A26: COBURG | C26: COLLINS 7 | F26: O'KEEFE 2 | I26: HENNING | K26: HARRIS | M26: LA FANNUE | P26: RALSTON | W26: WILLIAMSTOWN | X26: 0 | Y26: 1 | Z26: 0 | AA26: 80 | AB26: 141 | AC26: 56.737588652482266 | AD26: 0
A28: BRIGHTON | C28: 9 | D28: 1 | E28: =C28*6+D28 -> 55 | G28: 11 | H28: 5 | I28: =G28*6+H28 -> 71 | K28: 15 | L28: 10 | M28: =K28*6+L28 -> 100 | O28: 19 | P28: 13 | Q28: =O28*6+P28 -> 127 | S28: ELSTERNWICK PARK
A29: SANDRINGHAM | C29: 3 | D29: 1 | E29: =C29*6+D29 -> 19 | G29: 9 | H29: 7 | I29: =G29*6+H29 -> 61 | K29: 10 | L29: 9 | M29: =K29*6+L29 -> 69 | O29: 13 | P29: 17 | Q29: =O29*6+P29 -> 95 | S29: STUART
A30: BEST PLAYERS
A31: BRIGHTON | C31: CONNELL | F31: FORBES | I31: SHERLOCK | L31: CONDON | O31: NIVEN | Q31: STEWART
A32: SANDRINGHAM | C32: MITCHELL | F32: WOODWARD | I32: TOLSON | L32: BOYD | O32: PORTER | Q32: NOSEDA
A33: GOALKICKERS
A34: BRIGHTON | C34: DREW 5 | E34: CONNELL 3 | H34: NIVEN 3 | J34: EGAN 2 | L34: DEANE 2 | N34: BOLWELL 2 | Q34: STRINGER | T34: McGRATH
A35: SANDRINGHAM | C35: WOODWARD 6 | F35: ROBERTS 3 | I35: MITCHELL 3 | L35: HEARN
A37: YARRAVILLE | C37: 3 | D37: 4 | E37: =C37*6+D37 -> 22 | G37: 10 | H37: 6 | I37: =G37*6+H37 -> 66 | K37: 12 | L37: 11 | M37: =K37*6+L37 -> 83 | O37: 21 | P37: 15 | Q37: =O37*6+P37 -> 141 | S37: YARRAVILLE
A38: WILLIAMSTOWN | C38: 5 | D38: 2 | E38: =C38*6+D38 -> 32 | G38: 7 | H38: 5 | I38: =G38*6+H38 -> 47 | K38: 9 | L38: 7 | M38: =K38*6+L38 -> 61 | O38: 12 | P38: 8 | Q38: =O38*6+P38 -> 80 | S38: CLAYTON
A39: BEST PLAYERS
A40: YARRAVILLE | C40: McGRATH | F40: LEVENS | I40: TURNER | L40: RAWSON | O40: PETERS | R40: HOPKINS
A41: WILLIAMSTOWN | C41: BROOKS | F41: MARTIN | I41: LAWLOR | L41: HAMMOND | O41: RAEBURN | R41: McGILLIVRAY
A42: GOALKICKERS
A43: YARRAVILLE | C43: McGRATH 7 | F43: BUCKLEY 6 | I43: HOPKINS 3 | L43: TURNER 3 | O43: RAWSON | Q43: WEDGWOOD
A44: WILLIAMSTOWN | C44: LAWLOR 6 | F44: R RAEBURN 4 | I44: RICHARDSON | L44: MARTIN
A46: NORTHCOTE | C46: 5 | D46: 0 | E46: =C46*6+D46 -> 30 | G46: 9 | H46: 10 | I46: =G46*6+H46 -> 64 | K46: 10 | L46: 12 | M46: =K46*6+L46 -> 72 | O46: 17 | P46: 16 | Q46: =O46*6+P46 -> 118 | S46: PRESTON
A47: PRESTON | C47: 5 | D47: 2 | E47: =C47*6+D47 -> 32 | G47: 6 | H47: 4 | I47: =G47*6+H47 -> 40 | K47: 11 | L47: 5 | M47: =K47*6+L47 -> 71 | O47: 16 | P47: 10 | Q47: =O47*6+P47 -> 106 | S47: HASSETT
A48: BEST PLAYERS
A49: NORTHCOTE | C49: RUMNEY | F49: ROSS | I49: BATES | L49: CORNELL | O49: POWELL | R49: HART
A50: PRESTON | C50: HYDE | F50: HARDING | I50: MUIR | L50: EDWARDS | O50: ROBINSON | R50: ARTHUR
A51: GOALKICKERS
A52: NORTHCOTE | C52: CORNELL 5 | F52: R ROSS 4 | I52: SEYMOUR 3 | L52: SIMMONDS 2 | O52: THORNE | Q52: WILLIAMSON | T52: ACKLAND
A53: PRESTON | C53: HYDE 3 | E53: HUGHSON 3 | H53: CRANE 3 | J53: COOPER 2 | M53: ARTHUR 2 | P53: WALSH | R53: MURRAY | U53: HARDING
A55: CAMBERWELL | C55: 3 | D55: 3 | E55: =C55*6+D55 -> 21 | G55: 5 | H55: 12 | I55: =G55*6+H55 -> 42 | K55: 6 | L55: 18 | M55: =K55*6+L55 -> 54 | O55: 10 | P55: 22 | Q55: =O55*6+P55 -> 82 | S55: CAMBERWELL
A56: OAKLEIGH | C56: 0 | D56: 6 | E56: =C56*6+D56 -> 6 | G56: 0 | H56: 6 | I56: =G56*6+H56 -> 6 | K56: 3 | L56: 9 | M56: =K56*6+L56 -> 27 | O56: 7 | P56: 17 | Q56: =O56*6+P56 -> 59 | S56: LESTER
A57: BEST PLAYERS
A58: CAMBERWELL | C58: JONES | F58: WARE | I58: A DAVIDSON | L58: O'HALLORAN | O58: TROTTER | R58: MASON
A59: OAKLEIGH | C59: WITHERS | F59: HARRISON | I59: REID | L59: KIDD | O59: WATSON | R59: HUTCHESON
A60: GOALKICKERS
A61: CAMBERWELL | C61: TROTTER 3 | F61: MASON 2 | I61: A DAVIDSON 2 | L61: T O'HALLORAN 2 | P61: WARE
A62: OAKLEIGH | C62: WITHERS | F62: HARRISON | I62: WELLS | K62: RYAN | M62: WATSON | O62: MORRISON | Q62: WILSON
A64: ROUND 2 | E64: 18TH APRIL | H64: WEATHER | K64: COLD RAIN HAIL STRONG S.W. WIND | S64: PLAYED AT
D65: 1ST QTR | H65: 2ND QTR | L65: 3RD QTR | P65: FINAL | S65: NORTHCOTE
A66: YARRAVILLE | C66: 2 | D66: 7 | E66: =C66*6+D66 -> 19 | G66: 5 | H66: 8 | I66: =G66*6+H66 -> 38 | K66: 11 | L66: 10 | M66: =K66*6+L66 -> 76 | O66: 14 | P66: 12 | Q66: =O66*6+P66 -> 96 | S66: UMPIRE | X66: LADDER | AB66: ROUND | AD66: 2
A67: NORTHCOTE | C67: 2 | D67: 3 | E67: =C67*6+D67 -> 15 | G67: 9 | H67: 6 | I67: =G67*6+H67 -> 60 | K67: 9 | L67: 6 | M67: =K67*6+L67 -> 60 | O67: 12 | P67: 9 | Q67: =O67*6+P67 -> 81 | S67: HASSETT
A68: BEST PLAYERS | W68: TEAM | X68: W | Y68: L | Z68: D | AA68: FOR | AB68: AGST | AC68: % | AD68: PTS
A69: YARRAVILLE | C69: I EVANS | F69: PETERS | I69: R EVANS | L69: RYAN | N69: W BUCKLEY | Q69: RAWSON
A70: NORTHCOTE | C70: WILLIAMSON | F70: R ROSS | I70: RUMNEY | L70: LYNGCOLN | O70: HART | Q70: HASKETT | W70: BRUNSWICK | X70: 2 | Y70: 0 | Z70: 0 | AA70: 265 | AB70: 163 | AC70: 162.57668711656441 | AD70: 8
A71: GOALKICKERS | W71: YARRAVILLE | X71: 2 | Y71: 0 | Z71: 0 | AA71: 237 | AB71: 161 | AC71: 147.20496894409939 | AD71: 8
A72: YARRAVILLE | C72: WEDGWOOD 4 | F72: McGRATH 3 | I72: TURNER 3 | K72: BONIFACE | M72: KENNY | O72: PETERS | Q72: STOREY | W72: CAMBERWELL | X72: 2 | Y72: 0 | Z72: 0 | AA72: 182 | AB72: 125 | AC72: 145.6 | AD72: 8
A73: NORTHCOTE | C73: C ROSS 3 | E73: R ROSS 2 | G73: CORNELL | I73: SEYMOUR | K73: SIMMONDS | M73: THORNE | O73: HONIG | Q73: McINERNEY | T73: ACKLAND | W73: BRIGHTON | X73: 2 | Y73: 0 | Z73: 0 | AA73: 201 | AB73: 146 | AC73: 137.67123287671234 | AD73: 8
A75: CAMBERWELL | C75: 2 | D75: 4 | E75: =C75*6+D75 -> 16 | G75: 6 | H75: 5 | I75: =G75*6+H75 -> 41 | K75: 10 | L75: 10 | M75: =K75*6+L75 -> 70 | O75: 14 | P75: 16 | Q75: =O75*6+P75 -> 100 | S75: PORT MELBOURNE | W75: PRAHRAN | X75: 2 | Y75: 0 | Z75: 0 | AA75: 203 | AB75: 161 | AC75: 126.08695652173913 | AD75: 8
A76: PORT MELBOURNE | C76: 0 | D76: 7 | E76: =C76*6+D76 -> 7 | G76: 3 | H76: 8 | I76: =G76*6+H76 -> 26 | K76: 7 | L76: 11 | M76: =K76*6+L76 -> 53 | O76: 9 | P76: 12 | Q76: =O76*6+P76 -> 66 | S76: STUART | W76: NORTHCOTE | X76: 1 | Y76: 1 | Z76: 0 | AA76: 199 | AB76: 202 | AC76: 98.514851485148512 | AD76: 4
A77: BEST PLAYERS | W77: PRESTON | X77: 1 | Y77: 1 | Z77: 0 | AA77: 187 | AB77: 195 | AC77: 95.897435897435898 | AD77: 4
A78: CAMBERWELL | C78: JONES | E78: WILLIAMS | H78: A DAVIDSON | K78: ROWE | M78: COOKE | P78: ANDERSON | W78: OAKLEIGH | X78: 0 | Y78: 2 | Z78: 0 | AA78: 136 | AB78: 166 | AC78: 81.92771084337349 | AD78: 0
A79: PORT MELBOURNE | C79: MALTBY | E79: KEATING | H79: TYRELL | K79: BLOOMER | M79: FULLARTON | P79: TYSON | W79: PORT MELBOURNE | X79: 0 | Y79: 2 | Z79: 0 | AA79: 161 | AB79: 205 | AC79: 78.54 | AD79: 0
A80: GOALKICKERS | W80: COBURG | X80: 0 | Y80: 2 | Z80: 0 | AA80: 155 | AB80: 222 | AC80: 69.819819819819813 | AD80: 0
A81: CAMBERWELL | C81: JONES 3 | E81: WILLIAMS 3 | H81: A DAVIDSON 2 | K81: COOKE 2 | M81: T O'HALLORAN 2) | Q81: TROTTER | S81: WARE | W81: SANDRINGHAM | X81: 0 | Y81: 2 | Z81: 0 | AA81: 169 | AB81: 268 | AC81: 63.059701492537314 | AD81: 0
A82: PORT MELBOURNE | C82: TYRELL 4 | F82: TIMMS 3 | I82: TYSON | K82: CRAWSHAW | W82: WILLIAMSTOWN | X82: 0 | Y82: 2 | Z82: 0 | AA82: 131 | AB82: 215 | AC82: 60.930232558139537 | AD82: 0
A84: PRAHRAN | C84: 4 | D84: 4 | E84: =C84*6+D84 -> 28 | G84: 6 | H84: 7 | I84: =G84*6+H84 -> 43 | K84: 12 | L84: 11 | M84: =K84*6+L84 -> 83 | O84: 14 | P84: 14 | Q84: =O84*6+P84 -> 98 | S84: COBURG
A85: COBURG | C85: 2 | D85: 0 | E85: =C85*6+D85 -> 12 | G85: 3 | H85: 6 | I85: =G85*6+H85 -> 24 | K85: 5 | L85: 12 | M85: =K85*6+L85 -> 42 | O85: 9 | P85: 12 | Q85: =O85*6+P85 -> 66 | S85: GREGORY
A86: BEST PLAYERS
A87: PRAHRAN | C87: WILLIAMS | F87: SHARPLEY | I87: J WILTSHIRE | M87: LOWRY | P87: SHAW | S87: HYDE
A88: COBURG | C88: WALLACE | F88: CAPUANO | I88: HARRIS | M88: COLLINS | P88: LEONARD | S88: REVILLE
A89: GOALKICKERS
A90: PRAHRAN | C90: ANDERSON 3 | F90: BARTLETT 3 | I90: LOWRY 2 | K90: WILLIAMS 2 | N90: BRENCHLEY | Q90: JOHNSON | S90: WHITE | U90: SHARPLEY
A91: COBURG | C91: COLLINS 3 | F91: LEONARD 2 | I91: O'KEEFE | K91: HARRIS | M91: HOSIE | O91: REVILLE
A93: PRESTON | C93: 3 | D93: 1 | E93: =C93*6+D93 -> 19 | G93: 4 | H93: 5 | I93: =G93*6+H93 -> 29 | K93: 7 | L93: 11 | M93: =K93*6+L93 -> 53 | O93: 11 | P93: 15 | Q93: =O93*6+P93 -> 81 | S93: OAKLEIGH
A94: OAKLEIGH | C94: 5 | D94: 1 | E94: =C94*6+D94 -> 31 | G94: 7 | H94: 7 | I94: =G94*6+H94 -> 49 | K94: 10 | L94: 8 | M94: =K94*6+L94 -> 68 | O94: 11 | P94: 11 | Q94: =O94*6+P94 -> 77 | S94: LESTER
A95: BEST PLAYERS
A96: PRESTON | C96: MUIR | E96: ROBINSON | H96: HYDE | K96: HUGO | N96: McCLELLAND | Q96: COOPER
A97: OAKLEIGH | C97: KIDD | E97: WITHERS | H97: CAMPBELL | K97: HARRISON | N97: PLUMMER | Q97: STEIGENBERGER
A98: GOALKICKERS
A99: PRESTON | C99: HYDE 5 | F99: HUGHSON 2 | I99: WALSH 2 | K99: CRANE | M99: HUGO
A100: OAKLEIGH | C100: HARRISON 4 | F100: CAMPBELL 3 | I100: WATSON | K100: DOWLER | M100: MARTIN | O100: REID
A102: BRUNSWICK | C102: 2 | D102: 1 | E102: =C102*6+D102 -> 13 | G102: 12 | H102: 9 | I102: =G102*6+H102 -> 81 | K102: 14 | L102: 10 | M102: =K102*6+L102 -> 94 | O102: 21 | P102: 15 | Q102: =O102*6+P102 -> 141 | S102: BEACH ROAD
A103: SANDRINGHAM | C103: 8 | D103: 5 | E103: =C103*6+D103 -> 53 | G103: 8 | H103: 6 | I103: =G103*6+H103 -> 54 | K103: 9 | L103: 12 | M103: =K103*6+L103 -> 66 | O103: 10 | P103: 14 | Q103: =O103*6+P103 -> 74 | S103: GEE
A104: BEST PLAYERS
A105: BRUNSWICK | C105: DOWLING | F105: VAUGHAN | I105: LASKY | L105: KENNEDY | N105: BOSCHEN | Q105: McKERNAN
A106: SANDRINGHAM | C106: WITCHELL | F106: CARTWRIGHT | I106: MICHAELSON | L106: HEARN | N106: ROBERTS | Q106: PORTER
A107: GOALKICKERS
A108: BRUNSWICK | C108: KENNEDY 5 | F108: McINNES 5 | I108: COOPER 2 | K108: BOYD 2 | M108: DOWLING 2 | P108: LASKY | R108: GILLON | U108: PALMER | X108: ELLAWAY | AB108: THOMPSON
A109: SANDRINGHAM | C109: HEARN 2 | E109: TORPEY 2 | G109: WOODWARD | J109: ROBERTS | L109: CARTWRIGHT | O109: MADDEN | Q109: MEEHAN | T109: WITCHELL
A111: BRIGHTON | C111: 4 | D111: 5 | E111: =C111*6+D111 -> 29 | G111: 4 | H111: 5 | I111: =G111*6+H111 -> 29 | K111: 10 | L111: 11 | M111: =K111*6+L111 -> 71 | O111: 10 | P111: 14 | Q111: =O111*6+P111 -> 74 | S111: WILLIAMSTOWN
A112: WILLIAMSTOWN | C112: 0 | D112: 0 | E112: =C112*6+D112 -> 0 | G112: 3 | H112: 7 | I112: =G112*6+H112 -> 25 | K112: 3 | L112: 8 | M112: =K112*6+L112 -> 26 | O112: 5 | P112: 21 | Q112: =O112*6+P112 -> 51 | S112: GLOVER
A113: BEST PLAYERS
A114: BRIGHTON | C114: DREW | F114: FORBES | I114: KING | L114: McGRATH | O114: BOURNE | R114: NIVEN
A115: WILLIAMSTOWN | C115: RICHARDSON | F115: RAEBURN | I115: BROOKS | L115: McGILLIVRAY | O115: MARTIN | R115: LAWLOR
A116: GOALKICKERS
A117: BRIGHTON | C117: DREW 3 | E117: M KING 3 | H117: STRINGER 2 | K117: NIVEN | M117: GOULLET
A118: WILLIAMSTOWN | C118: LAWLOR | E118: RICHARDSON | H118: CUTTING | J118: HAMMOND | M118: JOHNSTONE
A120: ROUND 3 | E120: 2ND MAY | J120: WEATHER | M120: FINE MILD NORTH BREEZE | S120: PLAYED AT
D121: 1ST QTR | H121: 2ND QTR | L121: 3RD QTR | P121: FINAL | S121: ELSTERNWICK PARK
A122: BRIGHTON | C122: 1 | D122: 2 | E122: =C122*6+D122 -> 8 | G122: 5 | H122: 7 | I122: =G122*6+H122 -> 37 | K122: 10 | L122: 10 | M122: =K122*6+L122 -> 70 | O122: 13 | P122: 14 | Q122: =O122*6+P122 -> 92 | S122: UMPIRE | X122: LADDER | AB122: ROUND | AD122: 3
A123: NORTHCOTE | C123: 4 | D123: 3 | E123: =C123*6+D123 -> 27 | G123: 6 | H123: 3 | I123: =G123*6+H123 -> 39 | K123: 9 | L123: 6 | M123: =K123*6+L123 -> 60 | O123: 11 | P123: 9 | Q123: =O123*6+P123 -> 75 | S123: ADAMS
A124: BEST PLAYERS | W124: TEAM | X124: W | Y124: L | Z124: D | AA124: FOR | AB124: AGST | AC124: % | AD124: PTS
A125: BRIGHTON | C125: NIVEN | F125: McGRATH | I125: WILLIAMSON | L125: CONDON | O125: DREW | Q125: TERRY
A126: NORTHCOTE | C126: ACKLAND | F126: R ROSS | I126: SEYMOUR | L126: LATHAM | O126: SMITH | Q126: GARRETT | W126: BRUNSWICK | X126: 3 | Y126: 0 | Z126: 0 | AA126: 429 | AB126: 204 | AC126: 210.29411764705881 | AD126: 12
A127: GOALKICKERS | W127: PRAHRAN | X127: 3 | Y127: 0 | Z127: 0 | AA127: 358 | AB127: 222 | AC127: 161.26126126126127 | AD127: 12
A128: BRIGHTON | C128: NIVEN 5 | F128: FORBES 3 | I128: WEBER 2 | K128: DEANE | M128: ADAMS | O128: BAKER | W128: YARRAVILLE | X128: 3 | Y128: 0 | Z128: 0 | AA128: 369 | AB128: 232 | AC128: 159.05172413793105 | AD128: 12
A129: NORTHCOTE | C129: SEYMOUR 6 | F129: R ROSS 2 | I129: BATES 2 | K129: CORNELL | W129: CAMBERWELL | X129: 3 | Y129: 0 | Z129: 0 | AA129: 290 | AB129: 209 | AC129: 138.76 | AD129: 12
A131: CAMBERWELL | C131: 3 | D131: 0 | E131: =C131*6+D131 -> 18 | G131: 9 | H131: 10 | I131: =G131*6+H131 -> 64 | K131: 10 | L131: 11 | M131: =K131*6+L131 -> 71 | O131: 15 | P131: 18 | Q131: =O131*6+P131 -> 108 | S131: PRESTON | W131: BRIGHTON | X131: 3 | Y131: 0 | Z131: 0 | AA131: 293 | AB131: 221 | AC131: 132.57918552036199 | AD131: 12
A132: PRESTON | C132: 5 | D132: 3 | E132: =C132*6+D132 -> 33 | G132: 8 | H132: 4 | I132: =G132*6+H132 -> 52 | K132: 10 | L132: 10 | M132: =K132*6+L132 -> 70 | O132: 12 | P132: 12 | Q132: =O132*6+P132 -> 84 | S132: GREGORY | W132: COBURG | X132: 1 | Y132: 2 | Z132: 0 | AA132: 296 | AB132: 297 | AC132: 99.663299663299668 | AD132: 4
A133: BEST PLAYERS | W133: NORTHCOTE | X133: 1 | Y133: 2 | Z133: 0 | AA133: 274 | AB133: 294 | AC133: 93.197278911564624 | AD133: 4
A134: CAMBERWELL | C134: MEEHL | E134: A DAVIDSON | I134: BRETT | L134: HENDERSON | O134: BOAG | Q134: WALKER | W134: PRESTON | X134: 1 | Y134: 2 | Z134: 0 | AA134: 271 | AB134: 303 | AC134: 89.438943894389439 | AD134: 4
A135: PRESTON | C135: WALSH | E135: FISHER | I135: MUIR | L135: HARDING | O135: HUGO | Q135: COOPER | W135: OAKLEIGH | X135: 0 | Y135: 3 | Z135: 0 | AA135: 207 | AB135: 298 | AC135: 69.463087248322154 | AD135: 0
A136: GOALKICKERS | W136: PORT MELBOURNE | X136: 0 | Y136: 3 | Z136: 0 | AA136: 236 | AB136: 346 | AC136: 68.21 | AD136: 0
A137: CAMBERWELL | C137: JONES 4 | E137: MEEHL 4 | G137: A DAVIDSON 3 | J137: MASON | L137: WILLIAMS | N137: COOKE | P137: MEEHAN | W137: SANDRINGHAM | X137: 0 | Y137: 3 | Z137: 0 | AA137: 230 | AB137: 423 | AC137: 54.373522458628841 | AD137: 0
A138: PRESTON | C138: FISHER 4 | E138: WALSH 3 | G138: O'CONNOR 3 | J138: DUNSTONE | M138: BEAGLEY | W138: WILLIAMSTOWN | X138: 0 | Y138: 3 | Z138: 0 | AA138: 172 | AB138: 379 | AC138: 45.382585751978894 | AD138: 0
A140: YARRAVILLE | C140: 6 | D140: 1 | E140: =C140*6+D140 -> 37 | G140: 9 | H140: 3 | I140: =G140*6+H140 -> 57 | K140: 14 | L140: 9 | M140: =K140*6+L140 -> 93 | O140: 20 | P140: 12 | Q140: =O140*6+P140 -> 132 | S140: YARRAVILLE
A141: OAKLEIGH | C141: 3 | D141: 3 | E141: =C141*6+D141 -> 21 | G141: 6 | H141: 7 | I141: =G141*6+H141 -> 43 | K141: 8 | L141: 9 | M141: =K141*6+L141 -> 57 | O141: 10 | P141: 11 | Q141: =O141*6+P141 -> 71 | S141: DAVENPORT
A142: BEST PLAYERS
A143: YARRAVILLE | C143: R EVANS | F143: McGRATH | I143: J BUCKLEY | L143: TURNER | O143: RAWSON | Q143: W BUCKLEY
A144: OAKLEIGH | C144: KIDD | F144: HEINTZ | I144: DOWLER | L144: HARRISON | O144: WILSON | Q144: ANDERSON
A145: GOALKICKERS
A146: YARRAVILLE | C146: J BUCKLEY 7 | F146: RAWSON 5 | I146: McGRATH 2 | L146: TURNER 2 | N146: WEDGWOOD | Q146: KENNY | S146: I EVANS
A147: OAKLEIGH | C147: HARRISON 5 | F147: CAMPBELL | I147: ANDERSON | L147: BAKER | N147: CHAPMAN | Q147: KIDD
A149: COBURG | C149: 3 | D149: 2 | E149: =C149*6+D149 -> 20 | G149: 8 | H149: 8 | I149: =G149*6+H149 -> 56 | K149: 11 | L149: 11 | M149: =K149*6+L149 -> 77 | O149: 20 | P149: 21 | Q149: =O149*6+P149 -> 141 | S149: COBURG
A150: PORT MELBOURNE | C150: 5 | D150: 6 | E150: =C150*6+D150 -> 36 | G150: 7 | H150: 8 | I150: =G150*6+H150 -> 50 | K150: 10 | L150: 14 | M150: =K150*6+L150 -> 74 | O150: 10 | P150: 15 | Q150: =O150*6+P150 -> 75 | S150: LESTER
A151: BEST PLAYERS
A152: COBURG | C152: COLLINS | F152: KNOTT | I152: UHE | L152: REVILLE | O152: HARRIS | Q152: GARDINER
A153: PORT MELBOURNE | C153: PLUMRIDGE | F153: MALTBY | I153: ONLEY | L153: KEATING | O153: TIMMS | Q153: HUGHES
A154: GOALKICKERS
A155: COBURG | C155: COLLINS 9 | F155: HENNING 2 | I155: REVILLE 2 | K155: ANDERSON 2 | N155: HARRIS | P155: HOSIE | R155: UHE | T155: TUCKER | W155: LA FRANCHI
A156: PORT MELBOURNE | C156: TYRELL 3 | F156: KEATING 3 | I156: GOMEZ | K156: FULTON | M156: JURY | N156: SIMMONS
A158: PRAHRAN | C158: 4 | D158: 3 | E158: =C158*6+D158 -> 27 | G158: 8 | H158: 10 | I158: =G158*6+H158 -> 58 | K158: 15 | L158: 16 | M158: =K158*6+L158 -> 106 | O158: 22 | P158: 23 | Q158: =O158*6+P158 -> 155 | S158: TOORAK PARK
A159: SANDRINGHAM | C159: 2 | D159: 1 | E159: =C159*6+D159 -> 13 | G159: 5 | H159: 2 | I159: =G159*6+H159 -> 32 | K159: 6 | L159: 3 | M159: =K159*6+L159 -> 39 | O159: 9 | P159: 7 | Q159: =O159*6+P159 -> 61 | S159: HASSETT
A160: BEST PLAYERS
A161: PRAHRAN | C161: WILLIAMS | F161: KOOP | I161: BRENCHLEY | L161: WHITE | O161: MURRAY | R161: HYDE
A162: SANDRINGHAM | C162: MEEHAN | F162: McCOMB | I162: THOMS | L162: GILLIGAN | O162: CARTWRIGHT | R162: KEMP
A163: GOALKICKERS
A164: PRAHRAN | C164: BRENCHLEY 8 | F164: WHITE 4 | H164: ANDERSON 3 | K164: BARTLETT 2 | N164: WILLIAMS 2 | Q164: MURRAY | S164: JOHNSON | V164: GRAVELL
A165: SANDRINGHAM | C165: WOODWARD 3 | F165: ROBERTS 2 | I165: CARTWRIGHT 2 | L165: MICHAELSON | O165: McCOMB
A167: BRUNSWICK | C167: 10 | D167: 6 | E167: =C167*6+D167 -> 66 | G167: 14 | H167: 13 | I167: =G167*6+H167 -> 97 | K167: 21 | L167: 16 | M167: =K167*6+L167 -> 142 | O167: 24 | P167: 20 | Q167: =O167*6+P167 -> 164 | S167: BRUNSWICK
A168: WILLIAMSTOWN | C168: 0 | D168: 2 | E168: =C168*6+D168 -> 2 | G168: 0 | H168: 5 | I168: =G168*6+H168 -> 5 | K168: 2 | L168: 10 | M168: =K168*6+L168 -> 22 | O168: 5 | P168: 11 | Q168: =O168*6+P168 -> 41 | S168: GLOVER
A169: BEST PLAYERS
A170: BRUNSWICK | C170: CLARKE | F170: PALMER | I170: McINNES | L170: GILLON | O170: DOWLING | R170: BOYD
A171: WILLIAMSTOWN | C171: WILLETT | F171: HUGHES | I171: BROOKS | L171: PATERSON | O171: HAY | R171: JERRAM
A172: GOALKICKERS
A173: BRUNSWICK | C173: McINNES 7 | F173: DOWLING 5 | I173: GILLON 3 | K173: McELROY 3 | N173: COOPER 2 | Q173: LASKY | S173: BOYD | U173: McKERNAN | X173: VAUGHAN
A174: WILLIAMSTOWN | C174: LAWLOR | F174: R RAEBURN | I174: RICHARDSON | L174: HAY | M174: PATERSON
A176: ROUND 4 | E176: 9TH MAY | J176: WEATHER | M176: FINE WARM | S176: PLAYED AT
D177: 1ST QTR | H177: 2ND QTR | L177: 3RD QTR | P177: FINAL | S177: CAMBERWELL
A178: CAMBERWELL | C178: 2 | D178: 2 | E178: =C178*6+D178 -> 14 | G178: 6 | H178: 10 | I178: =G178*6+H178 -> 46 | K178: 8 | L178: 11 | M178: =K178*6+L178 -> 59 | O178: 15 | P178: 17 | Q178: =O178*6+P178 -> 107 | S178: UMPIRE | X178: LADDER | AB178: ROUND | AD178: 4
A179: YARRAVILLE | C179: 4 | D179: 3 | E179: =C179*6+D179 -> 27 | G179: 4 | H179: 6 | I179: =G179*6+H179 -> 30 | K179: 10 | L179: 9 | M179: =K179*6+L179 -> 69 | O179: 13 | P179: 10 | Q179: =O179*6+P179 -> 88 | S179: GREGORY
A180: BEST PLAYERS | W180: TEAM | X180: W | Y180: L | Z180: D | AA180: FOR | AB180: AGST | AC180: % | AD180: PTS
A181: CAMBERWELL | C181: BRETT | E181: O'HALLORAN | I181: MASON | L181: A DAVIDSON | O181: BOAG | Q181: WARE
A182: YARRAVILLE | C182: R EVANS | E182: WARDEN | I182: TURNER | L182: W BUCKLEY | O182: FREW | Q182: RAWSON | W182: BRUNSWICK | X182: 4 | Y182: 0 | Z182: 0 | AA182: 495 | AB182: 267 | AC182: 185.3932584269663 | AD182: 16
A183: GOALKICKERS | P183: A DAVIDSON | W183: PRAHRAN | X183: 4 | Y183: 0 | Z183: 0 | AA183: 443 | AB183: 297 | AC183: 149.15824915824916 | AD183: 16
A184: CAMBERWELL | C184: T O'HALLORAN 4 | F184: WILLIAMS 3 | I184: JONES 2 | K184: MEEHL 2 | M184: MASON | O184: MEEHAN | Q184: H DAVIDSON | W184: CAMBERWELL | X184: 4 | Y184: 0 | Z184: 0 | AA184: 397 | AB184: 297 | AC184: 133.67 | AD184: 16
A185: YARRAVILLE | C185: McGRATH 3 | F185: J BUCKLEY 2 | I185: TURNER 2 | K185: WARDEN 2 | N185: RAWSON | P185: WEDGWOOD | S185: I EVANS | W185: BRIGHTON | X185: 4 | Y185: 0 | Z185: 0 | AA185: 397 | AB185: 309 | AC185: 128.47896440129449 | AD185: 16
P186: R EVANS
A187: BRUNSWICK | C187: 4 | D187: 3 | E187: =C187*6+D187 -> 27 | G187: 5 | H187: 4 | I187: =G187*6+H187 -> 34 | K187: 7 | L187: 7 | M187: =K187*6+L187 -> 49 | O187: 9 | P187: 12 | Q187: =O187*6+P187 -> 66 | S187: NORTHCOTE | W187: YARRAVILLE | X187: 3 | Y187: 1 | Z187: 0 | AA187: 457 | AB187: 339 | AC187: 134.80825958702064 | AD187: 12
A188: NORTHCOTE | C188: 2 | D188: 1 | E188: =C188*6+D188 -> 13 | G188: 5 | H188: 4 | I188: =G188*6+H188 -> 34 | K188: 6 | L188: 6 | M188: =K188*6+L188 -> 42 | O188: 9 | P188: 9 | Q188: =O188*6+P188 -> 63 | S188: GLOVER | W188: COBURG | X188: 2 | Y188: 2 | Z188: 0 | AA188: 431 | AB188: 403 | AC188: 106.94789081885857 | AD188: 8
A189: BEST PLAYERS | W189: NORTHCOTE | X189: 1 | Y189: 3 | Z189: 0 | AA189: 337 | AB189: 360 | AC189: 93.611111111111114 | AD189: 4
A190: BRUNSWICK | C190: VAUGHAN | F190: KENNEDY | I190: McELROY | L190: CHEESMAN | O190: DOWLING | Q190: LEE | W190: PRESTON | X190: 1 | Y190: 3 | Z190: 0 | AA190: 349 | AB190: 395 | AC190: 88.35443037974683 | AD190: 4
A191: NORTHCOTE | C191: WILLIAMSON | F191: POWELL | I191: R ROSS | L191: ACKLAND | O191: BATES | Q191: HONIG | W191: PORT MELBOURNE | X191: 1 | Y191: 3 | Z191: 0 | AA191: 328 | AB191: 424 | AC191: 77.36 | AD191: 4
A192: GOALKICKERS | W192: OAKLEIGH | X192: 0 | Y192: 4 | Z192: 0 | AA192: 295 | AB192: 402 | AC192: 73.383084577114431 | AD192: 0
A193: BRUNSWICK | C193: COOPER 4 | F193: LASKY | H193: GILLON | J193: BOYD | L193: McINNES | N193: DOWLING | W193: SANDRINGHAM | X193: 0 | Y193: 4 | Z193: 0 | AA193: 336 | AB193: 558 | AC193: 60.215053763440864 | AD193: 0
A194: NORTHCOTE | C194: R ROSS 2 | F194: SEYMOUR 2 | I194: WILLIAMSON 2 | L194: ACKLAND | N194: RUMNEY | P194: SIMPSON | W194: WILLIAMSTOWN | X194: 0 | Y194: 4 | Z194: 0 | AA194: 247 | AB194: 464 | AC194: 53.232758620689658 | AD194: 0
A196: BRIGHTON | C196: 7 | D196: 2 | E196: =C196*6+D196 -> 44 | G196: 9 | H196: 2 | I196: =G196*6+H196 -> 56 | K196: 11 | L196: 6 | M196: =K196*6+L196 -> 72 | O196: 16 | P196: 8 | Q196: =O196*6+P196 -> 104 | S196: OAKLEIGH
A197: OAKLEIGH | C197: 5 | D197: 2 | E197: =C197*6+D197 -> 32 | G197: 7 | H197: 11 | I197: =G197*6+H197 -> 53 | K197: 11 | L197: 14 | M197: =K197*6+L197 -> 80 | O197: 12 | P197: 16 | Q197: =O197*6+P197 -> 88 | S197: DAVENPORT
A198: BEST PLAYERS
A199: BRIGHTON | C199: NIVEN | E199: McLEOD | H199: DEANE | K199: ROSENBROCK | N199: BOURNE | Q199: STEWART
A200: OAKLEIGH | C200: BAKER | E200: WATSON | H200: KENNEDY | K200: CRAMERI | N200: WITHERS | Q200: ANDERSON
A201: GOALKICKERS
A202: BRIGHTON | C202: NIVEN 6 | F202: BOURNE 3 | I202: McLEOD 3 | L202: DREW | N202: DEANE | P202: FORBES | R202: WEBER
A203: OAKLEIGH | C203: MORRISON 3 | F203: KENNEDY 3 | I203: RYAN 2 | L203: CAMPBELL | N203: BAKER | P203: ANDERSON | R203: CRAMERI
A205: PORT MELBOURNE | C205: 3 | D205: 7 | E205: =C205*6+D205 -> 25 | G205: 5 | H205: 11 | I205: =G205*6+H205 -> 41 | K205: 10 | L205: 17 | M205: =K205*6+L205 -> 77 | O205: 12 | P205: 20 | Q205: =O205*6+P205 -> 92 | S205: PORT MELBOURNE
A206: PRESTON | C206: 0 | D206: 5 | E206: =C206*6+D206 -> 5 | G206: 6 | H206: 6 | I206: =G206*6+H206 -> 42 | K206: 8 | L206: 8 | M206: =K206*6+L206 -> 56 | O206: 11 | P206: 12 | Q206: =O206*6+P206 -> 78 | S206: HASSETT
A207: BEST PLAYERS
A208: PORT MELBOURNE | C208: PLUMRIDGE | F208: MALTBY | I208: KEATING | L208: TYSON | O208: WOODS | R208: FULTON
A209: PRESTON | C209: WALSH | F209: GALE | I209: EDWARDS | L209: MUIR | O209: O'CONNOR | R209: HUGO
A210: GOALKICKERS
A211: PORT MELBOURNE | C211: ALDRIDGE 4 | F211: TYSON 2 | I211: KEATING 2 | L211: TYRELL | N211: FULTON | P211: HUGHES | R211: MCBETH
A212: PRESTON | C212: WARR 6 | F212: FISHER 4 | I212: WALSH
A214: COBURG | C214: 4 | D214: 1 | E214: =C214*6+D214 -> 25 | G214: 11 | H214: 10 | I214: =G214*6+H214 -> 76 | K214: 15 | L214: 11 | M214: =K214*6+L214 -> 101 | O214: 20 | P214: 15 | Q214: =O214*6+P214 -> 135 | S214: BEACH ROAD
A215: SANDRINGHAM | C215: 3 | D215: 5 | E215: =C215*6+D215 -> 23 | G215: 6 | H215: 6 | I215: =G215*6+H215 -> 42 | K215: 11 | L215: 13 | M215: =K215*6+L215 -> 79 | O215: 15 | P215: 16 | Q215: =O215*6+P215 -> 106 | S215: ADAMS
A216: BEST PLAYERS
A217: COBURG | C217: HENNING | F217: WALLACE | I217: REVILLE | L217: WHITNALL | O217: UHE | R217: COLLINS
A218: SANDRINGHAM | C218: CARTWIGHT | F218: WOODWARD | I218: TOLSON | L218: McCOMB | O218: THOMS | R218: HEARN
A219: GOALKICKERS
A220: COBURG | C220: COLLINS 12 | F220: NASH 3 | I220: HARRIS 2 | L220: TUCKER 2 | O220: HOSIE
A221: SANDRINGHAM | C221: McCOMB 4 | F221: WOODWARD 3 | I221: HEARN 3 | L221: CARTWRIGHT 3 | O221: DAVIS | Q221: TOLSON
A223: PRAHRAN | C223: 2 | D223: 3 | E223: =C223*6+D223 -> 15 | G223: 8 | H223: 7 | I223: =G223*6+H223 -> 55 | K223: 10 | L223: 7 | M223: =K223*6+L223 -> 67 | O223: 12 | P223: 13 | Q223: =O223*6+P223 -> 85 | S223: WILLIAMSTOWN
A224: WILLIAMSTOWN | C224: 2 | D224: 7 | E224: =C224*6+D224 -> 19 | G224: 4 | H224: 8 | I224: =G224*6+H224 -> 32 | K224: 8 | L224: 13 | M224: =K224*6+L224 -> 61 | O224: 10 | P224: 15 | Q224: =O224*6+P224 -> 75 | S224: LESTER
A225: BEST PLAYERS
A226: PRAHRAN | C226: GRAVELL | F226: WHITE | I226: HYDE | L226: LOWRY | N226: BRENCHLEY | Q226: WILTSHIRE
A227: WILLIAMSTOWN | C227: HUGGINS | F227: LAWLOR | I227: RICHARDSON | L227: WARD | N227: BROOKS | Q227: JERRAM
A228: GOALKICKERS
A229: PRAHRAN | C229: BRENCHLEY 5 | F229: LOWRY 2 | I229: FLEMING 2 | L229: JOHNSTON | N229: WHITE | P229: GRAVELL | R229: MURRAY
A230: WILLIAMSTOWN | C230: LAWLOR 4 | F230: R RAEBURN 3 | I230: RICHARDSON | L230: BENNETT | N230: HUGGINS
A232: ROUND 5 | E232: 16TH MAY | J232: WEATHER | M232: FINE MILD | S232: PLAYED AT
D233: 1ST QTR | H233: 2ND QTR | L233: 3RD QTR | P233: FINAL | S233: ELSTERNWICK PARK
A234: BRIGHTON | C234: 5 | D234: 1 | E234: =C234*6+D234 -> 31 | G234: 9 | H234: 3 | I234: =G234*6+H234 -> 57 | K234: 13 | L234: 6 | M234: =K234*6+L234 -> 84 | O234: 19 | P234: 7 | Q234: =O234*6+P234 -> 121 | S234: UMPIRE | X234: LADDER | AB234: ROUND | AD234: 5
A235: CAMBERWELL | C235: 8 | D235: 2 | E235: =C235*6+D235 -> 50 | G235: 11 | H235: 2 | I235: =G235*6+H235 -> 68 | K235: 15 | L235: 5 | M235: =K235*6+L235 -> 95 | O235: 18 | P235: 9 | Q235: =O235*6+P235 -> 117 | S235: DAVENPORT
A236: BEST PLAYERS | W236: TEAM | X236: W | Y236: L | Z236: D | AA236: FOR | AB236: AGST | AC236: % | AD236: PTS
A237: BRIGHTON | C237: DEANE | E237: DREW | H237: O'HALLORAN | K237: NIVEN | N237: GOULLET | Q237: BAKER
A238: CAMBERWELL | C238: JONES | E238: WILLIAMS | H238: VANTHOFF | K238: A DAVIDSON | N238: WILSON | Q238: O'HALLORAN | W238: BRUNSWICK | X238: 5 | Y238: 0 | Z238: 0 | AA238: 676 | AB238: 347 | AC238: 194.81268011527376 | AD238: 20
A239: GOALKICKERS | W239: PRAHRAN | X239: 5 | Y239: 0 | Z239: 0 | AA239: 536 | AB239: 387 | AC239: 138.50129198966408 | AD239: 20
A240: BRIGHTON | C240: NIVEN 6 | E240: DEANE 5 | G240: PENNY 3 | I240: DREW | J240: McGRATH | M240: GOULLET | O240: FORBES | Q240: McLEOD | W240: BRIGHTON | X240: 5 | Y240: 0 | Z240: 0 | AA240: 518 | AB240: 426 | AC240: 121.6 | AD240: 20
A241: CAMBERWELL | C241: JONES 8 | E241: A DAVIDSON 2 | H241: T O'HALLORAN 2 | L241: WILLIAMS 2 | O241: VANTHOFF 2 | R241: WILSON | W241: CAMBERWELL | X241: 4 | Y241: 1 | Z241: 0 | AA241: 514 | AB241: 418 | AC241: 122.97 | AD241: 16
Q242: WARE
A243: PRAHRAN | C243: 2 | D243: 3 | E243: =C243*6+D243 -> 15 | G243: 7 | H243: 7 | I243: =G243*6+H243 -> 49 | K243: 10 | L243: 11 | M243: =K243*6+L243 -> 71 | O243: 13 | P243: 15 | Q243: =O243*6+P243 -> 93 | S243: TOORAK PARK | W243: COBURG | X243: 3 | Y243: 2 | Z243: 0 | AA243: 564 | AB243: 455 | AC243: 123.95604395604396 | AD243: 12
A244: NORTHCOTE | C244: 5 | D244: 3 | E244: =C244*6+D244 -> 33 | G244: 5 | H244: 6 | I244: =G244*6+H244 -> 36 | K244: 9 | L244: 10 | M244: =K244*6+L244 -> 64 | O244: 13 | P244: 12 | Q244: =O244*6+P244 -> 90 | S244: LEWIS | W244: YARRAVILLE | X244: 3 | Y244: 2 | Z244: 0 | AA244: 536 | AB244: 456 | AC244: 117.54385964912281 | AD244: 12
A245: BEST PLAYERS | W245: PRESTON | X245: 2 | Y245: 3 | Z245: 0 | AA245: 466 | AB245: 474 | AC245: 98.312236286919827 | AD245: 8
A246: PRAHRAN | C246: WHITE | E246: HYDE | H246: ANDERSON | K246: WHITEHEAD | N246: SMITH | Q246: KOOP | W246: NORTHCOTE | X246: 1 | Y246: 4 | Z246: 0 | AA246: 427 | AB246: 453 | AC246: 94.260485651214125 | AD246: 4
A247: NORTHCOTE | C247: BATES | E247: HASKETT | H247: HONIG | K247: THORN | N247: DOWNIE | Q247: HART | W247: PORT MELBOURNE | X247: 1 | Y247: 4 | Z247: 0 | AA247: 392 | AB247: 517 | AC247: 75.82 | AD247: 4
A248: GOALKICKERS | W248: SANDRINGHAM | X248: 1 | Y248: 4 | Z248: 0 | AA248: 429 | AB248: 622 | AC248: 68.971061093247584 | AD248: 4
A249: PRAHRAN | C249: WHITE 5 | F249: ANDERSON 3 | I249: TROTTER 2 | L249: SHARPLEY | N249: FLEMING | P249: WHITEHEAD | W249: OAKLEIGH | X249: 0 | Y249: 5 | Z249: 0 | AA249: 375 | AB249: 583 | AC249: 64.322469982847338 | AD249: 0
A250: NORTHCOTE | C250: SEYMOUR 4 | F250: R ROSS 2 | I250: SIMMONDS 2 | L250: DOWNIE 2 | N250: THORNE | P250: HONIG | R250: O'KEEFE | W250: WILLIAMSTOWN | X250: 0 | Y250: 5 | Z250: 0 | AA250: 299 | AB250: 597 | AC250: 50.083752093802346 | AD250: 0
A252: PRESTON | C252: 4 | D252: 1 | E252: =C252*6+D252 -> 25 | G252: 8 | H252: 3 | I252: =G252*6+H252 -> 51 | K252: 11 | L252: 6 | M252: =K252*6+L252 -> 72 | O252: 18 | P252: 9 | Q252: =O252*6+P252 -> 117 | S252: YARRAVILLE
A253: YARRAVILLE | C253: 3 | D253: 3 | E253: =C253*6+D253 -> 21 | G253: 5 | H253: 3 | I253: =G253*6+H253 -> 33 | K253: 9 | L253: 9 | M253: =K253*6+L253 -> 63 | O253: 11 | P253: 13 | Q253: =O253*6+P253 -> 79 | S253: ADAMS
A254: BEST PLAYERS
A255: PRESTON | C255: HYDE | E255: WARR | H255: HUGO | K255: BEAGLEY | N255: FISHER | Q255: HARDING
A256: YARRAVILLE | C256: PARKS | E256: STREETER | H256: WEDGWOOD | K256: McGRATH | N256: RAWSON | Q256: McGREGOR
A257: GOALKICKERS
A258: PRESTON | C258: FISHER 6 | F258: WARR 5 | I258: BEAGLEY 2 | L258: HUGHSON | N258: MURRAY | P258: DUNSTONE | R258: HARDING | U258: MUIR
A259: YARRAVILLE | C259: McGRATH 3 | F259: RAWSON 3 | I259: McGREGOR 2 | L259: BUCKLEY | N259: WEDGWOOD | Q259: PETERS
A261: SANDRINGHAM | C261: 2 | D261: 11 | E261: =C261*6+D261 -> 23 | G261: 5 | H261: 14 | I261: =G261*6+H261 -> 44 | K261: 8 | L261: 16 | M261: =K261*6+L261 -> 64 | O261: 12 | P261: 21 | Q261: =O261*6+P261 -> 93 | S261: BEACH ROAD
A262: PORT MELBOURNE | C262: 0 | D262: 2 | E262: =C262*6+D262 -> 2 | G262: 2 | H262: 6 | I262: =G262*6+H262 -> 18 | K262: 5 | L262: 12 | M262: =K262*6+L262 -> 42 | O262: 8 | P262: 16 | Q262: =O262*6+P262 -> 64 | S262: GLOVER
A263: BEST PLAYERS
A264: SANDRINGHAM | C264: MADDEN | F264: TOLSON | I264: HEARN | L264: THOMS | O264: KEMP | R264: McCOMB
A265: PORT MELBOURNE | C265: PLUMRIDGE | F265: PAYNE | I265: WOODS | L265: TYSON | O265: ALDRIDGE | R265: TYRELL
A266: GOALKICKERS
A267: SANDRINGHAM | C267: MCCOMB 3 | F267: TOLSON 3 | I267: HEARN 2 | K267: CARTWRIGHT 2 | N267: WOODWARD | Q267: TORPEY
A268: PORT MELBOURNE | C268: TYRELL 2 | F268: FORREST 2 | I268: FULTON | K268: McBETH | M268: JONES | O268: RUSSO
A270: COBURG | C270: 9 | D270: 5 | E270: =C270*6+D270 -> 59 | G270: 12 | H270: 8 | I270: =G270*6+H270 -> 80 | K270: 15 | L270: 9 | M270: =K270*6+L270 -> 99 | O270: 20 | P270: 13 | Q270: =O270*6+P270 -> 133 | S270: COBURG
A271: WILLIAMSTOWN | C271: 1 | D271: 4 | E271: =C271*6+D271 -> 10 | G271: 4 | H271: 8 | I271: =G271*6+H271 -> 32 | K271: 4 | L271: 12 | M271: =K271*6+L271 -> 36 | O271: 6 | P271: 16 | Q271: =O271*6+P271 -> 52 | S271: LESTER
A272: BEST PLAYERS
A273: COBURG | C273: REVILLE | F273: WHITFORD | I273: McFARLANE | L273: ANDERSON | O273: GARDINER | R273: REITSCHEL
A274: WILLIAMSTOWN | C274: HUGGINS | F274: JERRAM | I274: PATERSON | L274: MARTIN | O274: RICHARDSON | R274: BROOKS
A275: GOALKICKERS
A276: COBURG | C276: COLLINS 6 | F276: NASH 5 | H276: REVILLE 3 | J276: TUCKER 3 | M276: HOSIE 2 | O276: ANDERSON
A277: WILLIAMSTOWN | C277: RICHARDSON 2 | F277: PATERSON 2 | I277: HUGGINS | K277: HYDE
A279: BRUNSWICK | C279: 3 | D279: 7 | E279: =C279*6+D279 -> 25 | G279: 13 | H279: 8 | I279: =G279*6+H279 -> 86 | K279: 20 | L279: 14 | M279: =K279*6+L279 -> 134 | O279: 27 | P279: 19 | Q279: =O279*6+P279 -> 181 | S279: BRUNSWICK
A280: OAKLEIGH | C280: 2 | D280: 2 | E280: =C280*6+D280 -> 14 | G280: 4 | H280: 3 | I280: =G280*6+H280 -> 27 | K280: 8 | L280: 4 | M280: =K280*6+L280 -> 52 | O280: 12 | P280: 8 | Q280: =O280*6+P280 -> 80 | S280: HASSETT
A281: BEST PLAYERS
A282: BRUNSWICK | C282: McKAY | F282: DOWLING | I282: COOPER | L282: FAY | O282: LASKY | R282: McINNES
A283: OAKLEIGH | C283: WITHERS | F283: RYAN | I283: CRAMERI | L283: POWELL | O283: HUTCHESON | R283: KIDD
A284: GOALKICKERS
A285: BRUNSWICK | C285: COOPER 11 | F285: McINNES 6 | I285: LASKY 3 | K285: CHEESEMAN 2 | N285: GILLON | P285: BOYD | R285: KENNEDY | U285: McELROY | X285: QUINN
A286: OAKLEIGH | C286: ANDERSON 3 | F286: McDERMOTT 3 | I286: RYAN 2 | K286: KIDD 2 | M286: WELLS | O286: KENNEDY
A288: ROUND 6 | E288: 23RD MAY | J288: WEATHER | M288: FINE MILD NORTH BREEZE | S288: PLAYED AT
D289: 1ST QTR | H289: 2ND QTR | L289: 3RD QTR | P289: FINAL | S289: CAMBERWELL
A290: BRUNSWICK | C290: 2 | D290: 7 | E290: =C290*6+D290 -> 19 | G290: 8 | H290: 10 | I290: =G290*6+H290 -> 58 | K290: 12 | L290: 16 | M290: =K290*6+L290 -> 88 | O290: 19 | P290: 20 | Q290: =O290*6+P290 -> 134 | S290: UMPIRE | X290: LADDER | AB290: ROUND | AD290: 6
A291: CAMBERWELL | C291: 3 | D291: 8 | E291: =C291*6+D291 -> 26 | G291: 7 | H291: 11 | I291: =G291*6+H291 -> 53 | K291: 9 | L291: 15 | M291: =K291*6+L291 -> 69 | O291: 10 | P291: 19 | Q291: =O291*6+P291 -> 79 | S291: GLOVER
A292: BEST PLAYERS | W292: TEAM | X292: W | Y292: L | Z292: D | AA292: FOR | AB292: AGST | AC292: % | AD292: PTS
A293: BRUNSWICK | C293: DOWLING | F293: McINNES | I293: LASKY | L293: CLARKE | N293: BOYD | Q293: MASKELL
A294: CAMBERWELL | C294: VANTHOFF | F294: WILSON | I294: A DAVIDSON | L294: BRETT | N294: H DAVIDSON | Q294: WARE | W294: BRUNSWICK | X294: 6 | Y294: 0 | Z294: 0 | AA294: 810 | AB294: 426 | AC294: 190.14084507042253 | AD294: 24
A295: GOALKICKERS | Q295: McELROY | S295: QUINN | W295: PRAHRAN | X295: 6 | Y295: 0 | Z295: 0 | AA295: 656 | AB295: 475 | AC295: 138.10526315789474 | AD295: 24
A296: BRUNSWICK | C296: McINNES 5 | F296: COOPER 3 | I296: BOYD 3 | K296: LASKY 2 | M296: GILLON | O296: KENNEDY | Q296: BOSCHEN | S296: DOWLING | W296: BRIGHTON | X296: 5 | Y296: 1 | Z296: 0 | AA296: 588 | AB296: 515 | AC296: 114.17 | AD296: 20
A297: CAMBERWELL | C297: JONES 3 | E297: WILLIAMS 2 | H297: MASON | J297: A DAVIDSON | M297: WARE | O297: MEEHAN | Q297: VANTHOFF | W297: YARRAVILLE | X297: 4 | Y297: 2 | Z297: 0 | AA297: 651 | AB297: 542 | AC297: 120.11070110701107 | AD297: 16
A299: PRESTON | C299: 5 | D299: 2 | E299: =C299*6+D299 -> 32 | G299: 8 | H299: 5 | I299: =G299*6+H299 -> 53 | K299: 10 | L299: 10 | M299: =K299*6+L299 -> 70 | O299: 13 | P299: 11 | Q299: =O299*6+P299 -> 89 | S299: PRESTON | W299: CAMBERWELL | X299: 4 | Y299: 2 | Z299: 0 | AA299: 593 | AB299: 552 | AC299: 107.43 | AD299: 16
A300: BRIGHTON | C300: 4 | D300: 2 | E300: =C300*6+D300 -> 26 | G300: 7 | H300: 5 | I300: =G300*6+H300 -> 47 | K300: 8 | L300: 7 | M300: =K300*6+L300 -> 55 | O300: 10 | P300: 10 | Q300: =O300*6+P300 -> 70 | S300: GREGORY | W300: COBURG | X300: 3 | Y300: 3 | Z300: 0 | AA300: 670 | AB300: 565 | AC300: 118.58407079646018 | AD300: 12
A301: BEST PLAYERS | W301: PRESTON | X301: 3 | Y301: 3 | Z301: 0 | AA301: 555 | AB301: 544 | AC301: 102.02205882352941 | AD301: 12
A302: PRESTON | C302: HYDE | E302: CANNAWAY | H302: WARR | K302: HARDING | N302: CLARKE | Q302: HUGO | W302: NORTHCOTE | X302: 2 | Y302: 4 | Z302: 0 | AA302: 537 | AB302: 559 | AC302: 96.064400715563508 | AD302: 8
A303: BRIGHTON | C303: DREW | E303: HALLAHAN | H303: BAKER | K303: McGRATH | N303: WEBER | Q303: GOULLET | W303: PORT MELBOURNE | X303: 1 | Y303: 5 | Z303: 0 | AA303: 478 | AB303: 632 | AC303: 75.63 | AD303: 4
A304: GOALKICKERS | W304: SANDRINGHAM | X304: 1 | Y304: 5 | Z304: 0 | AA304: 484 | AB304: 684 | AC304: 70.760233918128648 | AD304: 4
A305: PRESTON | C305: MURRAY 4 | F305: FISHER 3 | I305: WARR 3 | K305: MUIR 2 | M305: DUNSTONE | W305: WILLIAMSTOWN | X305: 1 | Y305: 5 | Z305: 0 | AA305: 361 | AB305: 652 | AC305: 55.368098159509202 | AD305: 4
A306: BRIGHTON | C306: DREW 3 | E306: MILLER 2 | G306: McLEOD 2 | I306: EGAN | J306: DEANE | L306: GOULLET | W306: OAKLEIGH | X306: 0 | Y306: 6 | Z306: 0 | AA306: 463 | AB306: 703 | AC306: 65.860597439544804 | AD306: 0
A308: NORTHCOTE | C308: 2 | D308: 3 | E308: =C308*6+D308 -> 15 | G308: 9 | H308: 6 | I308: =G308*6+H308 -> 60 | K308: 15 | L308: 11 | M308: =K308*6+L308 -> 101 | O308: 16 | P308: 14 | Q308: =O308*6+P308 -> 110 | S308: NORTHCOTE
A309: COBURG | C309: 6 | D309: 5 | E309: =C309*6+D309 -> 41 | G309: 9 | H309: 6 | I309: =G309*6+H309 -> 60 | K309: 13 | L309: 11 | M309: =K309*6+L309 -> 89 | O309: 15 | P309: 16 | Q309: =O309*6+P309 -> 106 | S309: ADAMS
A310: BEST PLAYERS
A311: NORTHCOTE | C311: LUDLOW | F311: BATES | I311: WILLIAMSON | L311: SEYMOUR | O311: HASKETT | Q311: O'KEEFE
A312: COBURG | C312: REVILLE | F312: WHITFIELD | I312: JORDAN | L312: COLLINS | O312: KNOTT | Q312: McFARLANE
A313: GOALKICKERS
A314: NORTHCOTE | C314: SEYMOUR 6 | F314: GRAY 3 | H314: R ROSS 2 | J314: WILLIAMSON | M314: HONIG | O314: SIMPSON | Q314: O'KEEFE
A315: COBURG | C315: COLLINS 7 | F315: NASH 3 | H315: KNOTT 3 | J315: BELL 2
A317: YARRAVILLE | C317: 5 | D317: 1 | E317: =C317*6+D317 -> 31 | G317: 8 | H317: 3 | I317: =G317*6+H317 -> 51 | K317: 12 | L317: 6 | M317: =K317*6+L317 -> 78 | O317: 18 | P317: 7 | Q317: =O317*6+P317 -> 115 | S317: PORT MELBOURNE
A318: PORT MELBOURNE | C318: 4 | D318: 3 | E318: =C318*6+D318 -> 27 | G318: 6 | H318: 5 | I318: =G318*6+H318 -> 41 | K318: 8 | L318: 9 | M318: =K318*6+L318 -> 57 | O318: 12 | P318: 14 | Q318: =O318*6+P318 -> 86 | S318: LESTER
A319: BEST PLAYERS
A320: YARRAVILLE | C320: WARDEN | F320: STREETER | I320: CAVE | L320: McGREGOR | O320: RAWSON | R320: PARKS
A321: PORT MELBOURNE | C321: PLUMRIDGE | F321: HUGHES | I321: TYSON | L321: FARNAN | O321: WOODS | R321: ALDRIDGE
A322: GOALKICKERS
A323: YARRAVILLE | C323: TURNER 4 | F323: WARDEN 4 | I323: J BUCKLEY 2 | L323: RAWSON 2 | N323: STOREY 2 | Q323: McGREGOR 2 | T323: KENNY | V323: REYNOLDS
A324: PORT MELBOURNE | C324: ALDRIDGE 5 | F324: CRAWSHAW 3 | I324: TYSON 2 | K324: TYRELL | M324: McBETH
A326: WILLIAMSTOWN | C326: 2 | D326: 2 | E326: =C326*6+D326 -> 14 | G326: 5 | H326: 7 | I326: =G326*6+H326 -> 37 | K326: 7 | L326: 11 | M326: =K326*6+L326 -> 53 | O326: 8 | P326: 14 | Q326: =O326*6+P326 -> 62 | S326: WILLIAMSTOWN
A327: SANDRINGHAM | C327: 4 | D327: 3 | E327: =C327*6+D327 -> 27 | G327: 5 | H327: 6 | I327: =G327*6+H327 -> 36 | K327: 5 | L327: 7 | M327: =K327*6+L327 -> 37 | O327: 8 | P327: 7 | Q327: =O327*6+P327 -> 55 | S327: WALKER
A328: BEST PLAYERS
A329: WILLIAMSTOWN | C329: HUGGINS | F329: BROOKS | I329: S RAEBURN | M329: PATERSON | P329: WILLETT | S329: CUTTING
A330: SANDRINGHAM | C330: THOMS | F330: MITCHELL | I330: CARTWRIGHT | M330: WOODWARD | P330: MICHAELSON | S330: MEEHAN
A331: GOALKICKERS
A332: WILLIAMSTOWN | C332: S RAEBURN 4 | F332: RICHARDSON | I332: PATERSON | L332: HYDE | N332: KAUFMAN
A333: SANDRINGHAM | C333: HEARN 3 | F333: CARTWRIGHT 3 | J333: WOODWARD | M333: TORPEY
A335: PRAHRAN | C335: 5 | D335: 3 | E335: =C335*6+D335 -> 33 | G335: 12 | H335: 5 | I335: =G335*6+H335 -> 77 | K335: 13 | L335: 8 | M335: =K335*6+L335 -> 86 | O335: 18 | P335: 12 | Q335: =O335*6+P335 -> 120 | S335: OAKLEIGH
A336: OAKLEIGH | C336: 5 | D336: 3 | E336: =C336*6+D336 -> 33 | G336: 8 | H336: 10 | I336: =G336*6+H336 -> 58 | K336: 10 | L336: 16 | M336: =K336*6+L336 -> 76 | O336: 12 | P336: 16 | Q336: =O336*6+P336 -> 88 | S336: LEWIS
A337: BEST PLAYERS
A338: PRAHRAN | C338: HAWKINS | F338: WHITEHEAD | I338: HYDE | M338: WILTSHIRE | P338: FLEMING | S338: SMITH
A339: OAKLEIGH | C339: CRAMERI | F339: BAKER | I339: ANDERSON | M339: SMEDLEY | P339: BELL | S339: PLUMMER
A340: GOALKICKERS
A341: PRAHRAN | C341: HAWKINS 10 | F341: LOWRY | H341: SHARPLEY | J341: BARTLETT | M341: WHITE | O341: ANDERSON | R341: GRAVELL | U341: FLEMING | X341: DIXON
A342: OAKLEIGH | C342: BELL 4 | F342: CRAMERI 3 | I342: WITHERS | K342: RYAN | M342: BAKER | O342: LEWIS | Q342: SMEDLEY
A344: ROUND 7 | E344: 30TH MAY | J344: WEATHER | M344: FINE STRONG NORTH WIND | S344: PLAYED AT
D345: 1ST QTR | H345: 2ND QTR | L345: 3RD QTR | P345: FINAL | S345: ELSTERNWICK PARK
A346: BRIGHTON | C346: 5 | D346: 4 | E346: =C346*6+D346 -> 34 | G346: 8 | H346: 5 | I346: =G346*6+H346 -> 53 | K346: 9 | L346: 12 | M346: =K346*6+L346 -> 66 | O346: 13 | P346: 16 | Q346: =O346*6+P346 -> 94 | S346: UMPIRE | X346: LADDER | AB346: ROUND | AD346: 7
A347: YARRAVILLE | C347: 2 | D347: 1 | E347: =C347*6+D347 -> 13 | G347: 8 | H347: 4 | I347: =G347*6+H347 -> 52 | K347: 10 | L347: 4 | M347: =K347*6+L347 -> 64 | O347: 12 | P347: 7 | Q347: =O347*6+P347 -> 79 | S347: WALKER
A348: BEST PLAYERS | W348: TEAM | X348: W | Y348: L | Z348: D | AA348: FOR | AB348: AGST | AC348: % | AD348: PTS
A349: BRIGHTON | C349: GOULLET | F349: DREW | I349: WEBER | L349: PENNY | O349: EGAN | Q349: BAKER
A350: YARRAVILLE | C350: RYAN | F350: RAWSON | I350: WARDEN | L350: BONIFACE | O350: STREETER | Q350: McGRATH | W350: BRUNSWICK | X350: 7 | Y350: 0 | Z350: 0 | AA350: 904 | AB350: 506 | AC350: 178.65612648221344 | AD350: 28
A351: GOALKICKERS | W351: PRAHRAN | X351: 6 | Y351: 1 | Z351: 0 | AA351: 738 | AB351: 562 | AC351: 131.3167259786477 | AD351: 24
A352: BRIGHTON | C352: DREW 5 | F352: PENNY 3 | I352: ADAMS 2 | L352: McGRATH | O352: BAKER | Q352: McLEOD | W352: BRIGHTON | X352: 6 | Y352: 1 | Z352: 0 | AA352: 682 | AB352: 594 | AC352: 114.81 | AD352: 24
A353: YARRAVILLE | C353: RAWSON 4 | F353: TURNER 2 | I353: BONIFACE 2 | L353: WARDEN 2 | O353: BUCKLEY | Q353: REYNOLDS | W353: CAMBERWELL | X353: 5 | Y353: 2 | Z353: 0 | AA353: 680 | AB353: 634 | AC353: 107.26 | AD353: 20
A355: CAMBERWELL | C355: 2 | D355: 1 | E355: =C355*6+D355 -> 13 | G355: 10 | H355: 6 | I355: =G355*6+H355 -> 66 | K355: 11 | L355: 7 | M355: =K355*6+L355 -> 73 | O355: 13 | P355: 9 | Q355: =O355*6+P355 -> 87 | S355: TOORAK PARK | W355: COBURG | X355: 4 | Y355: 3 | Z355: 0 | AA355: 813 | AB355: 649 | AC355: 125.26964560862866 | AD355: 16
A356: PRAHRAN | C356: 5 | D356: 4 | E356: =C356*6+D356 -> 34 | G356: 6 | H356: 4 | I356: =G356*6+H356 -> 40 | K356: 10 | L356: 12 | M356: =K356*6+L356 -> 72 | O356: 11 | P356: 16 | Q356: =O356*6+P356 -> 82 | S356: HASSETT | W356: YARRAVILLE | X356: 4 | Y356: 3 | Z356: 0 | AA356: 730 | AB356: 636 | AC356: 114.77987421383648 | AD356: 16
A357: BEST PLAYERS | W357: PRESTON | X357: 3 | Y357: 4 | Z357: 0 | AA357: 635 | AB357: 638 | AC357: 99.529780564263319 | AD357: 12
A358: CAMBERWELL | C358: O'HALLORAN | F358: VANTHOFF | I358: WALKER | L358: BRETT | N358: YOULL | Q358: MEEHAN | W358: NORTHCOTE | X358: 3 | Y358: 4 | Z358: 0 | AA358: 632 | AB358: 635 | AC358: 99.527559055118104 | AD358: 12
A359: PRAHRAN | C359: HYDE | F359: WHITE | I359: WHITEHEAD | L359: LOWRY | N359: MURRAY | Q359: SMITH | W359: WILLIAMSTOWN | X359: 2 | Y359: 5 | Z359: 0 | AA359: 467 | AB359: 746 | AC359: 62.600536193029491 | AD359: 8
A360: GOALKICKERS | Q360: BRETT | W360: PORT MELBOURNE | X360: 1 | Y360: 6 | Z360: 0 | AA360: 572 | AB360: 738 | AC360: 77.51 | AD360: 4
A361: CAMBERWELL | C361: T O'HALLORAN 3 | F361: A DAVIDSON 2 | I361: JONES 2 | K361: WILSON 2 | M361: COOKE | O361: H DAVIDSON | R361: VANTHOFF | W361: SANDRINGHAM | X361: 1 | Y361: 6 | Z361: 0 | AA361: 560 | AB361: 779 | AC361: 71.887034659820287 | AD361: 4
A362: PRAHRAN | C362: ANDERSON 3 | F362: HAWKINS 3 | I362: SHARPLEY 2 | L362: WHITE | N362: GRAVELL | P362: HYDE | W362: OAKLEIGH | X362: 0 | Y362: 7 | Z362: 0 | AA362: 547 | AB362: 846 | AC362: 64.657210401891248 | AD362: 0
A364: BRUNSWICK | C364: 2 | D364: 8 | E364: =C364*6+D364 -> 20 | G364: 6 | H364: 11 | I364: =G364*6+H364 -> 47 | K364: 12 | L364: 19 | M364: =K364*6+L364 -> 91 | O364: 12 | P364: 22 | Q364: =O364*6+P364 -> 94 | S364: BRUNSWICK
A365: PRESTON | C365: 2 | D365: 1 | E365: =C365*6+D365 -> 13 | G365: 5 | H365: 4 | I365: =G365*6+H365 -> 34 | K365: 8 | L365: 6 | M365: =K365*6+L365 -> 54 | O365: 11 | P365: 14 | Q365: =O365*6+P365 -> 80 | S365: LESTER
A366: BEST PLAYERS
A367: BRUNSWICK | C367: McELROY | F367: DOWLING | I367: LASKY | L367: MASKELL | O367: QUINN | R367: McINNES
A368: PRESTON | C368: HYDE | F368: MASLIN | I368: WARR | L368: CLARKE | O368: MURAY | R368: CANNAWAY
A369: GOALKICKERS
A370: BRUNSWICK | C370: COOPER 3 | F370: McINNES 3 | I370: GILLON 2 | K370: LASKY | M370: DOWLING | O370: McELROY | Q370: QUINN
A371: PRESTON | C371: FISHER 3 | F371: WARR 3 | H371: HUGHSON 2 | K371: DUNSTONE 2 | N371: MURRAY
A373: NORTHCOTE | C373: 4 | D373: 2 | E373: =C373*6+D373 -> 26 | G373: 9 | H373: 3 | I373: =G373*6+H373 -> 57 | K373: 10 | L373: 7 | M373: =K373*6+L373 -> 67 | O373: 14 | P373: 11 | Q373: =O373*6+P373 -> 95 | S373: BEACH ROAD
A374: SANDRINGHAM | C374: 2 | D374: 2 | E374: =C374*6+D374 -> 14 | G374: 7 | H374: 4 | I374: =G374*6+H374 -> 46 | K374: 9 | L374: 4 | M374: =K374*6+L374 -> 58 | O374: 12 | P374: 4 | Q374: =O374*6+P374 -> 76 | S374: STUART
A375: BEST PLAYERS
A376: NORTHCOTE | C376: WILLIAMSON | F376: GARRETT | I376: O'KEEFE | L376: GRAY | O376: BATES | R376: LYNGCOLN
A377: SANDRINGHAM | C377: MITCHELL | F377: HEARN | I377: MILLER | L377: MICHAELSON | O377: TORPEY | R377: THOMS
A378: GOALKICKERS
A379: NORTHCOTE | C379: SEYMOUR 4 | F379: GRAY 3 | H379: SIMMONDS 2 | K379: WILLIAMSON 2 | N379: R ROSS | P379: HONIG | R379: DOWNIE
A380: SANDRINGHAM | C380: WOODWARD 3 | F380: McCOMB 3 | I380: CARTWRIGHT 2 | L380: HEARN | N380: RICHARDSON | Q380: DAVIS | S380: POUND
A382: WILLIAMSTOWN | C382: 6 | D382: 8 | E382: =C382*6+D382 -> 44 | G382: 7 | H382: 11 | I382: =G382*6+H382 -> 53 | K382: 13 | L382: 16 | M382: =K382*6+L382 -> 94 | O382: 15 | P382: 16 | Q382: =O382*6+P382 -> 106 | S382: WILLIAMSTOWN
A383: PORT MELBOURNE | C383: 1 | D383: 1 | E383: =C383*6+D383 -> 7 | G383: 6 | H383: 8 | I383: =G383*6+H383 -> 44 | K383: 7 | L383: 8 | M383: =K383*6+L383 -> 50 | O383: 14 | P383: 10 | Q383: =O383*6+P383 -> 94 | S383: LEWIS
A384: BEST PLAYERS
A385: WILLIAMSTOWN | C385: BROOKS | F385: KAUFMAN | I385: S RAEBURN | L385: LAWLOR | O385: PATERSON | R385: HUGGINS
A386: PORT MELBOURNE | C386: ALDRIDGE | F386: TYSON | I386: RUSSO | L386: ONLEY | O386: McBETH | R386: KEATING
A387: GOALKICKERS
A388: WILLIAMSTOWN | C388: LAWLOR 6 | F388: PATERSON 4 | I388: R RAEBURN 3 | L388: S RAEBURN | O388: DELLER
A389: PORT MELBOURNE | C389: TYSON 4 | F389: ALDRIDGE 3 | I389: CRAWSHAW 2 | L389: KEATING 2 | N389: TYRELL | P389: McBETH | R389: RUSSO
A391: COBURG | C391: 5 | D391: 8 | E391: =C391*6+D391 -> 38 | G391: 8 | H391: 8 | I391: =G391*6+H391 -> 56 | K391: 15 | L391: 16 | M391: =K391*6+L391 -> 106 | O391: 21 | P391: 17 | Q391: =O391*6+P391 -> 143 | S391: COBURG
A392: OAKLEIGH | C392: 2 | D392: 0 | E392: =C392*6+D392 -> 12 | G392: 7 | H392: 8 | I392: =G392*6+H392 -> 50 | K392: 9 | L392: 9 | M392: =K392*6+L392 -> 63 | O392: 12 | P392: 12 | Q392: =O392*6+P392 -> 84 | S392: GREGORY
A393: BEST PLAYERS
A394: COBURG | C394: COLLINS | F394: WALLACE | I394: WHITFIELD | L394: KNOTT | O394: McFARLANE | R394: BELL
A395: OAKLEIGH | C395: WITHERS | F395: REID | I395: CRAMERI | L395: CHAPMAN | O395: HEINTZ | R395: BAKER
A396: GOALKICKERS
A397: COBURG | C397: COLLINS 10 | F397: NASH 6 | I397: HARRIS | K397: REVILLE | M397: LA FRANCHI | P397: KNOTT | R397: HILL
A398: OAKLEIGH | C398: CHAPMAN 3 | F398: BELL 2 | H398: HEINTZ 2 | J398: ANDERSON | M398: KENNEDY | O398: CRAMERI | Q398: POWELL
A400: ROUND 8 | E400: 6TH JUNE | J400: WEATHER | M400: CLOUDY BUT FINE S.W. BREEZE | S400: PLAYED AT
D401: 1ST QTR | H401: 2ND QTR | L401: 3RD QTR | P401: FINAL | S401: CAMBERWELL
A402: CAMBERWELL | C402: 5 | D402: 2 | E402: =C402*6+D402 -> 32 | G402: 9 | H402: 11 | I402: =G402*6+H402 -> 65 | K402: 11 | L402: 13 | M402: =K402*6+L402 -> 79 | O402: 17 | P402: 17 | Q402: =O402*6+P402 -> 119 | S402: UMPIRE | X402: LADDER | AB402: ROUND | AD402: 8
A403: COBURG | C403: 6 | D403: 2 | E403: =C403*6+D403 -> 38 | G403: 8 | H403: 4 | I403: =G403*6+H403 -> 52 | K403: 15 | L403: 6 | M403: =K403*6+L403 -> 96 | O403: 16 | P403: 8 | Q403: =O403*6+P403 -> 104 | S403: LEWIS
A404: BEST PLAYERS | W404: TEAM | X404: W | Y404: L | Z404: D | AA404: FOR | AB404: AGST | AC404: % | AD404: PTS
A405: CAMBERWELL | C405: H DAVIDSON | F405: JONES | I405: BRETT | K405: HENDERSON | N405: WARE | Q405: A DAVIDSON
A406: COBURG | C406: HENNING | F406: REVILLE | I406: COLLINS | K406: NASH | N406: ANDERSON | Q406: BROOM | W406: BRUNSWICK | X406: 8 | Y406: 0 | Z406: 0 | AA406: 1025 | AB406: 588 | AC406: 174.31972789115648 | AD406: 32
A407: GOALKICKERS | W407: BRIGHTON | X407: 7 | Y407: 1 | Z407: 0 | AA407: 760 | AB407: 658 | AC407: 115.5 | AD407: 28
A408: CAMBERWELL | C408: JONES 8 | E408: H DAVIDSON 3 | H408: WARE 2 | J408: A DAVIDSON | M408: T O'HALLORAN | P408: MEEHAN | R408: WILSON | W408: PRAHRAN | X408: 6 | Y408: 2 | Z408: 0 | AA408: 815 | AB408: 668 | AC408: 122.0059880239521 | AD408: 24
A409: COBURG | C409: COLLINS 5 | F409: HENNING 3 | I409: NASH 3 | K409: REVILLE 2 | M409: HARRIS | O409: LA FRANCHI | R409: HILL | W409: CAMBERWELL | X409: 6 | Y409: 2 | Z409: 0 | AA409: 799 | AB409: 738 | AC409: 108.27 | AD409: 24
A411: BRUNSWICK | C411: 5 | D411: 5 | E411: =C411*6+D411 -> 35 | G411: 7 | H411: 5 | I411: =G411*6+H411 -> 47 | K411: 13 | L411: 6 | M411: =K411*6+L411 -> 84 | O411: 19 | P411: 7 | Q411: =O411*6+P411 -> 121 | S411: YARRAVILLE | W411: COBURG | X411: 4 | Y411: 4 | Z411: 0 | AA411: 917 | AB411: 768 | AC411: 119.40104166666667 | AD411: 16
A412: YARRAVILLE | C412: 1 | D412: 1 | E412: =C412*6+D412 -> 7 | G412: 5 | H412: 8 | I412: =G412*6+H412 -> 38 | K412: 8 | L412: 9 | M412: =K412*6+L412 -> 57 | O412: 11 | P412: 16 | Q412: =O412*6+P412 -> 82 | S412: GREGORY | W412: NORTHCOTE | X412: 4 | Y412: 4 | Z412: 0 | AA412: 777 | AB412: 688 | AC412: 112.93604651162791 | AD412: 16
A413: BEST PLAYERS | W413: YARRAVILLE | X413: 4 | Y413: 4 | Z413: 0 | AA413: 812 | AB413: 757 | AC413: 107.26552179656539 | AD413: 16
A414: BRUNSWICK | C414: FAY | E414: DOWLING | H414: QUINN | K414: COOPER | N414: VAUGHAN | Q414: LASKY | W414: PRESTON | X414: 4 | Y414: 4 | Z414: 0 | AA414: 741 | AB414: 715 | AC414: 103.63636363636364 | AD414: 16
A415: YARRAVILLE | C415: TUENER | E415: COLEMAN | H415: McGRATH | K415: CAVE | N415: W BUCKLEY | Q415: ELLIS | W415: SANDRINGHAM | X415: 2 | Y415: 6 | Z415: 0 | AA415: 678 | AB415: 886 | AC415: 76.52370203160271 | AD415: 8
A416: GOALKICKERS | O416: McELROY | Q416: PALMER | W416: WILLIAMSTOWN | X416: 2 | Y416: 6 | Z416: 0 | AA416: 520 | AB416: 891 | AC416: 58.361391694725029 | AD416: 8
A417: BRUNSWICK | C417: COOPER 6 | E417: LASKY 3 | G417: KENNEDY 2 | J417: McINNES 2 | M417: DOWLING 2 | P417: GILLON | R417: BOYD | W417: PORT MELBOURNE | X417: 1 | Y417: 7 | Z417: 0 | AA417: 636 | AB417: 816 | AC417: 77.94 | AD417: 4
A418: YARRAVILLE | C418: TURNER 4 | F418: PENNY 3 | H418: RAWSON 2 | K418: KENNY | M418: STREETER | W418: OAKLEIGH | X418: 0 | Y418: 8 | Z418: 0 | AA418: 654 | AB418: 964 | AC418: 67.842323651452276 | AD418: 0
A420: PRESTON | C420: 6 | D420: 4 | E420: =C420*6+D420 -> 40 | G420: 9 | H420: 6 | I420: =G420*6+H420 -> 60 | K420: 12 | L420: 14 | M420: =K420*6+L420 -> 86 | O420: 15 | P420: 16 | Q420: =O420*6+P420 -> 106 | S420: PRESTON
A421: PRAHRAN | C421: 1 | D421: 5 | E421: =C421*6+D421 -> 11 | G421: 5 | H421: 9 | I421: =G421*6+H421 -> 39 | K421: 5 | L421: 10 | M421: =K421*6+L421 -> 40 | O421: 10 | P421: 17 | Q421: =O421*6+P421 -> 77 | S421: GLOVER
A422: BEST PLAYERS
A423: PRESTON | C423: HYDE | F423: MURRAY | I423: HUGO | K423: CLACK | N423: HUGHSON | Q423: DUNSTONE
A424: PRAHRAN | C424: WESCOTT | F424: SHARPLEY | I424: KOOP | K424: WILTSHIRE | N424: MURRAY | Q424: HAWKER
A425: GOALKICKERS
A426: PRESTON | C426: MURRAY 5 | F426: DUNSTONE 3 | I426: HARDING 3 | L426: FISHER 2 | N426: HUGHSON | Q426: WARR
A427: PRAHRAN | C427: HAWKINS 6 | F427: ANDERSON 2 | I427: BARTLETT | L427: WHITE
A429: NORTHCOTE | C429: 3 | D429: 8 | E429: =C429*6+D429 -> 26 | G429: 9 | H429: 10 | I429: =G429*6+H429 -> 64 | K429: 16 | L429: 11 | M429: =K429*6+L429 -> 107 | O429: 22 | P429: 13 | Q429: =O429*6+P429 -> 145 | S429: NORTHCOTE
A430: WILLIAMSTOWN | C430: 2 | D430: 1 | E430: =C430*6+D430 -> 13 | G430: 5 | H430: 3 | I430: =G430*6+H430 -> 33 | K430: 6 | L430: 5 | M430: =K430*6+L430 -> 41 | O430: 8 | P430: 5 | Q430: =O430*6+P430 -> 53 | S430: STUART
A431: BEST PLAYERS
A432: NORTHCOTE | C432: R ROSS | F432: GRAY | I432: O'KEEFE | L432: SEYMOUR | O432: HONIG | R432: WILLIAMSON
A433: WILLIAMSTOWN | C433: PATERSON | F433: DELLER | I433: JERRAM | L433: RICHARDSON | O433: LAWLOR | R433: S RAEBURN
A434: GOALKICKERS
A435: NORTHCOTE | C435: R ROSS 6 | F435: SEYMOUR 5 | I435: GRAY 3 | K435: LUDLOW 3 | N435: HONIG 2 | P435: SIMMONDS | R435: DOWNIE | V435: O'KEEFE
A436: WILLIAMSTOWN | C436: LAWLOR 3 | F436: R RAEBURN 2 | I436: RICHARDSON | L436: KAUFMAN | N436: DELLER
A438: SANDRINGHAM | C438: 3 | D438: 2 | E438: =C438*6+D438 -> 20 | G438: 8 | H438: 4 | I438: =G438*6+H438 -> 52 | K438: 15 | L438: 6 | M438: =K438*6+L438 -> 96 | O438: 18 | P438: 10 | Q438: =O438*6+P438 -> 118 | S438: OAKLEIGH
A439: OAKLEIGH | C439: 5 | D439: 5 | E439: =C439*6+D439 -> 35 | G439: 8 | H439: 7 | I439: =G439*6+H439 -> 55 | K439: 12 | L439: 8 | M439: =K439*6+L439 -> 80 | O439: 15 | P439: 17 | Q439: =O439*6+P439 -> 107 | S439: WALKER
A440: BEST PLAYERS
A441: SANDRINGHAM | C441: CARTWRIGHT | F441: POUND | I441: CHRISTIE | L441: THOMS | O441: HEARN | Q441: MILLER
A442: OAKLEIGH | C442: HEINTZ | F442: CRAMERI | I442: ANDERSON | L442: WITHERS | O442: BAKER | Q442: MOORE
A443: GOALKICKERS
A444: SANDRINGHAM | C444: CHRISTIE 5 | F444: CARTWRIGHT 3 | J444: THOMS 3 | M444: MICHAELSON 2 | P444: HEARN | R444: TORPEY | U444: McCOMB | X444: TOLSON | AA444: WITCHELL
A445: OAKLEIGH | C445: HEINTZ 6 | F445: CRAMERI 4 | I445: ANDERSON | L445: BAKER | N445: KENNEDY | Q445: WILMOT | T445: MOORE
A447: BRIGHTON | C447: 3 | D447: 7 | E447: =C447*6+D447 -> 25 | G447: 7 | H447: 8 | I447: =G447*6+H447 -> 50 | K447: 9 | L447: 14 | M447: =K447*6+L447 -> 68 | O447: 10 | P447: 18 | Q447: =O447*6+P447 -> 78 | S447: ELSTERNWICK PARK
A448: PORT MELBOURNE | C448: 1 | D448: 1 | E448: =C448*6+D448 -> 7 | G448: 6 | H448: 5 | I448: =G448*6+H448 -> 41 | K448: 8 | L448: 6 | M448: =K448*6+L448 -> 54 | O448: 9 | P448: 10 | Q448: =O448*6+P448 -> 64 | S448: HASSETT
A449: BEST PLAYERS
A450: BRIGHTON | C450: WEBER | E450: PENNY | H450: GOULLET | K450: DEANE | N450: WILLIAMSON | Q450: CONNELL
A451: PORT MELBOURNE | C451: WOODS | E451: PLUMRIDGE | H451: CRAWSHAW | K451: DAVIS | N451: TYRELL | Q451: TYSON
A452: GOALKICKERS
A453: BRIGHTON | C453: DREW 2 | E453: NIVEN 2 | G453: GOULLET 2 | J453: CONNELL | L453: DEANE | N453: ADAMS | P453: PENNY
A454: PORT MELBOURNE | C454: ALDRIDGE 3 | F454: KEATING 2 | I454: EASTMUIR 2 | L454: TYSON | N454: RUSSO
A456: ROUND 9 | E456: 13TH JUNE | G456: WEATHER | I456: COLD CLOUDY SCATTERED SHOWERS STRONG SOUTH WIND | S456: PLAYED AT
D457: 1ST QTR | H457: 2ND QTR | L457: 3RD QTR | P457: FINAL | S457: BRUNSWICK
A458: BRUNSWICK | C458: 5 | D458: 3 | E458: =C458*6+D458 -> 33 | G458: 9 | H458: 11 | I458: =G458*6+H458 -> 65 | K458: 11 | L458: 12 | M458: =K458*6+L458 -> 78 | O458: 12 | P458: 15 | Q458: =O458*6+P458 -> 87 | S458: UMPIRE | X458: LADDER | AB458: ROUND | AD458: 9
A459: BRIGHTON | C459: 1 | D459: 3 | E459: =C459*6+D459 -> 9 | G459: 3 | H459: 3 | I459: =G459*6+H459 -> 21 | K459: 8 | L459: 7 | M459: =K459*6+L459 -> 55 | O459: 11 | P459: 9 | Q459: =O459*6+P459 -> 75 | S459: LESTER
A460: BEST PLAYERS | W460: TEAM | X460: W | Y460: L | Z460: D | AA460: FOR | AB460: AGST | AC460: % | AD460: PTS
A461: BRUNSWICK | C461: McINNES | F461: LASKY | I461: FAY | K461: DOWLING | N461: CLARKE | Q461: QUINN
A462: BRIGHTON | C462: DEANE | F462: DREW | I462: PENNY | K462: EDWARDS | N462: CONNELL | Q462: EGAN | W462: BRUNSWICK | X462: 9 | Y462: 0 | Z462: 0 | AA462: 1112 | AB462: 663 | AC462: 167.72247360482655 | AD462: 36
A463: GOALKICKERS | W463: PRAHRAN | X463: 7 | Y463: 2 | Z463: 0 | AA463: 902 | AB463: 731 | AC463: 123.39261285909713 | AD463: 28
A464: BRUNSWICK | C464: McINNES 5 | F464: LASKY 3 | I464: BOYD | K464: McELROY | M464: McKERNAN | P464: QUINN | W464: CAMBERWELL | X464: 7 | Y464: 2 | Z464: 0 | AA464: 940 | AB464: 827 | AC464: 113.66 | AD464: 28
A465: BRIGHTON | C465: DEANE 5 | F465: PENNY 3 | I465: DREW | K465: CONNELL | M465: GOULLET | W465: BRIGHTON | X465: 7 | Y465: 2 | Z465: 0 | AA465: 835 | AB465: 745 | AC465: 112.08 | AD465: 28
A467: PRAHRAN | C467: 4 | D467: 4 | E467: =C467*6+D467 -> 28 | G467: 5 | H467: 10 | I467: =G467*6+H467 -> 40 | K467: 9 | L467: 16 | M467: =K467*6+L467 -> 70 | O467: 11 | P467: 21 | Q467: =O467*6+P467 -> 87 | S467: TOORAK PARK | W467: COBURG | X467: 5 | Y467: 4 | Z467: 0 | AA467: 1054 | AB467: 872 | AC467: 120.87155963302752 | AD467: 20
A468: YARRAVILLE | C468: 2 | D468: 0 | E468: =C468*6+D468 -> 12 | G468: 4 | H468: 5 | I468: =G468*6+H468 -> 29 | K468: 5 | L468: 6 | M468: =K468*6+L468 -> 36 | O468: 9 | P468: 9 | Q468: =O468*6+P468 -> 63 | S468: GLOVER | W468: NORTHCOTE | X468: 5 | Y468: 4 | Z468: 0 | AA468: 844 | AB468: 729 | AC468: 115.77503429355281 | AD468: 20
A469: BEST PLAYERS | W469: YARRAVILLE | X469: 4 | Y469: 5 | Z469: 0 | AA469: 875 | AB469: 844 | AC469: 103.67298578199052 | AD469: 16
A470: PRAHRAN | C470: SMITH | F470: KOOP | I470: HYDE | K470: FLEMING | N470: WILLIAMS | Q470: MURRAY | W470: PRESTON | X470: 4 | Y470: 5 | Z470: 0 | AA470: 845 | AB470: 852 | AC470: 99.178403755868544 | AD470: 16
A471: YARRAVILLE | C471: RAWSON | F471: STREETER | I471: COLEMAN | K471: FREW | N471: McGRATH | Q471: BONIFACE | W471: WILLIAMSTOWN | X471: 3 | Y471: 6 | Z471: 0 | AA471: 565 | AB471: 933 | AC471: 60.557341907824224 | AD471: 12
A472: GOALKICKERS | W472: SANDRINGHAM | X472: 2 | Y472: 7 | Z472: 0 | AA472: 767 | AB472: 1027 | AC472: 74.683544303797461 | AD472: 8
A473: PRAHRAN | C473: HAWKINS 3 | F473: ANDERSON 2 | I473: WILLIAMS 2 | L473: GRAVELL 2 | O473: JOHNSTON | Q473: FLEMING | W473: PORT MELBOURNE | X473: 1 | Y473: 8 | Z473: 0 | AA473: 677 | AB473: 883 | AC473: 76.67 | AD473: 4
A474: YARRAVILLE | C474: TURNER 2 | F474: RAWSON 2 | I474: BONIFACE 2 | L474: HOWARTH 2 | O474: KENNY | Q474: FREW | W474: OAKLEIGH | X474: 0 | Y474: 9 | Z474: 0 | AA474: 696 | AB474: 1009 | AC474: 68.979187314172449 | AD474: 0
A476: COBURG | C476: 7 | D476: 1 | E476: =C476*6+D476 -> 43 | G476: 13 | H476: 4 | I476: =G476*6+H476 -> 82 | K476: 16 | L476: 8 | M476: =K476*6+L476 -> 104 | O476: 20 | P476: 17 | Q476: =O476*6+P476 -> 137 | S476: COBURG
A477: PRESTON | C477: 8 | D477: 4 | E477: =C477*6+D477 -> 52 | G477: 9 | H477: 4 | I477: =G477*6+H477 -> 58 | K477: 13 | L477: 12 | M477: =K477*6+L477 -> 90 | O477: 15 | P477: 14 | Q477: =O477*6+P477 -> 104 | S477: STUART
A478: BEST PLAYERS
A479: COBURG | C479: COLLINS | F479: REVILLE | I479: HARRIS | L479: ATKINSON | O479: WALLACE | R479: WHITFIELD
A480: PRESTON | C480: WARR | F480: QUINLAN | I480: DUNSTONE | L480: MUIR | O480: MURRAY | R480: O'CONNOR
A481: GOALKICKERS
A482: COBURG | C482: COLLINS 8 | F482: REVILLE 4 | I482: NASH 4 | K482: ATKINSON 2 | N482: HARRIS | P482: HAMILTON
A483: PRESTON | C483: WARR 5 | F483: FISHER 3 | I483: DUNSTONE 3 | L483: O'CONNOR 2 | O483: MURRAY | Q483: HARDING
A485: WILLIAMSTOWN | C485: 0 | D485: 1 | E485: =C485*6+D485 -> 1 | G485: 3 | H485: 9 | I485: =G485*6+H485 -> 27 | K485: 4 | L485: 13 | M485: =K485*6+L485 -> 37 | O485: 5 | P485: 15 | Q485: =O485*6+P485 -> 45 | S485: WILLIAMSTOWN
A486: OAKLEIGH | C486: 3 | D486: 3 | E486: =C486*6+D486 -> 21 | G486: 6 | H486: 4 | I486: =G486*6+H486 -> 40 | K486: 6 | L486: 5 | M486: =K486*6+L486 -> 41 | O486: 6 | P486: 6 | Q486: =O486*6+P486 -> 42 | S486: GREGORY
A487: BEST PLAYERS
A488: WILLIAMSTOWN | C488: HUGGINS | F488: MARTIN | I488: KAUFMAN | L488: LAWLOR | O488: PATERSON | R488: JERRAM
A489: OAKLEIGH | C489: HUTCHESON | F489: WATSON | I489: BELL | L489: CRAMERI | O489: WITHERS | R489: CHAPMAN
A490: GOALKICKERS
A491: WILLIAMSTOWN | C491: LAWLOR 2 | F491: R RAEBURN | I491: PATERSON | L491: KAUFMAN
A492: OAKLEIGH | C492: WELLS 2 | F492: WITHERS | I492: ANDERSON | L492: CHAPMAN | O492: CRAMERI
A494: CAMBERWELL | C494: 7 | D494: 4 | E494: =C494*6+D494 -> 46 | G494: 11 | H494: 6 | I494: =G494*6+H494 -> 72 | K494: 19 | L494: 12 | M494: =K494*6+L494 -> 126 | O494: 21 | P494: 15 | Q494: =O494*6+P494 -> 141 | S494: BEACH ROAD
A495: SANDRINGHAM | C495: 0 | D495: 0 | E495: =C495*6+D495 -> 0 | G495: 6 | H495: 9 | I495: =G495*6+H495 -> 45 | K495: 8 | L495: 10 | M495: =K495*6+L495 -> 58 | O495: 12 | P495: 17 | Q495: =O495*6+P495 -> 89 | S495: HASSETT
A496: BEST PLAYERS
A497: CAMBERWELL | C497: WARE | E497: JONES | H497: TATHAM | K497: HENDERSON | O497: ROWE | R497: A DAVIDSON
A498: SANDRINGHAM | C498: THOMS | E498: HEARN | H498: MILLER | K498: CHRISTIE | O498: WITCHELL | R498: KEMP
A499: GOALKICKERS
A500: CAMBERWELL | C500: JONES 5 | E500: A DAVIDSON 3 | H500: H DAVIDSON 3 | K500: WARE 2 | M500: WILSON 2 | O500: TATHAM 2 | R500: MEEHAN 2 | U500: T O'HALLORAN | X500: YOUL
A501: SANDRINGHAM | C501: DAVIS 3 | E501: CHRISTIE 2 | H501: THOMS 2 | J501: KENNEDY 2 | M501: MITCHELL | O501: CARTWRIGHT | R501: TOLSON
A503: NORTHCOTE | C503: 2 | D503: 3 | E503: =C503*6+D503 -> 15 | G503: 5 | H503: 8 | I503: =G503*6+H503 -> 38 | K503: 7 | L503: 15 | M503: =K503*6+L503 -> 57 | O503: 8 | P503: 19 | Q503: =O503*6+P503 -> 67 | S503: NORTHCOTE
A504: PORT MELBOURNE | C504: 4 | D504: 0 | E504: =C504*6+D504 -> 24 | G504: 4 | H504: 0 | I504: =G504*6+H504 -> 24 | K504: 5 | L504: 3 | M504: =K504*6+L504 -> 33 | O504: 6 | P504: 5 | Q504: =O504*6+P504 -> 41 | S504: LEWIS
A505: BEST PLAYERS
A506: NORTHCOTE | C506: WILLIAMSON | F506: GARRETT | I506: ACKLAND | L506: R ROSS | O506: O'SHEA | R506: GRAY
A507: PORT MELBOURNE | C507: JULIER | F507: McBETH | I507: DAVIS | L507: PLUMRIDGE | O507: CRAWSHAW | R507: TYSON
A508: GOALKICKERS
A509: NORTHCOTE | C509: SEYMOUR 6 | F509: DOWNIE | I509: O'KEEFE
A510: PORT MELBOURNE | C510: TYSON 2 | F510: CRAWSHAW 2 | J510: ALDRIDGE | M510: JULIEN
A512: ROUND 10 | E512: 20TH JUNE | J512: WEATHER | M512: FINE COLD | S512: PLAYED AT
D513: 1ST QTR | H513: 2ND QTR | L513: 3RD QTR | P513: FINAL | S513: ELSTERNWICK PARK
A514: PRAHRAN | C514: 4 | D514: 4 | E514: =C514*6+D514 -> 28 | G514: 8 | H514: 11 | I514: =G514*6+H514 -> 59 | K514: 13 | L514: 12 | M514: =K514*6+L514 -> 90 | O514: 17 | P514: 12 | Q514: =O514*6+P514 -> 114 | S514: UMPIRE | X514: LADDER | AB514: ROUND | AD514: 10
A515: BRIGHTON | C515: 4 | D515: 1 | E515: =C515*6+D515 -> 25 | G515: 7 | H515: 3 | I515: =G515*6+H515 -> 45 | K515: 9 | L515: 8 | M515: =K515*6+L515 -> 62 | O515: 13 | P515: 12 | Q515: =O515*6+P515 -> 90 | S515: GREGORY
A516: BEST PLAYERS | W516: TEAM | X516: W | Y516: L | Z516: D | AA516: FOR | AB516: AGST | AC516: % | AD516: PTS
A517: PRAHRAN | C517: WILLIAMS | F517: SHARPLEY | I517: LOWRY | L517: KOOP | N517: HAWKINS | Q517: MURRAY
A518: BRIGHTON | C518: PENNY | F518: DEANE | I518: STEWART | L518: HALLAHAN | N518: CONNELL | Q518: EDWARDS | W518: BRUNSWICK | X518: 10 | Y518: 0 | Z518: 0 | AA518: 1270 | AB518: 745 | AC518: 170.46979865771812 | AD518: 40
A519: GOALKICKERS | W519: PRAHRAN | X519: 8 | Y519: 2 | Z519: 0 | AA519: 1016 | AB519: 821 | AC519: 123.75152253349573 | AD519: 32
A520: PRAHRAN | C520: HAWKINS 5 | F520: WHITE 3 | I520: AVERY 3 | K520: LOWRY 2 | M520: SHARPLEY 2 | P520: GRAVELL | W520: CAMBERWELL | X520: 8 | Y520: 2 | Z520: 0 | AA520: 1096 | AB520: 907 | AC520: 120.84 | AD520: 32
A521: BRIGHTON | C521: DREW 4 | E521: CONNELL 3 | H521: DEANE 2 | J521: McGRATH | M521: GOULLET | O521: PENNY | Q521: RUDD | W521: BRIGHTON | X521: 7 | Y521: 3 | Z521: 0 | AA521: 925 | AB521: 859 | AC521: 107.68 | AD521: 28
A523: COBURG | C523: 2 | D523: 4 | E523: =C523*6+D523 -> 16 | G523: 6 | H523: 8 | I523: =G523*6+H523 -> 44 | K523: 9 | L523: 15 | M523: =K523*6+L523 -> 69 | O523: 12 | P523: 20 | Q523: =O523*6+P523 -> 92 | S523: YARRAVILLE | W523: COBURG | X523: 6 | Y523: 4 | Z523: 0 | AA523: 1146 | AB523: 944 | AC523: 121.39830508474576 | AD523: 24
A524: YARRAVILLE | C524: 2 | D524: 3 | E524: =C524*6+D524 -> 15 | G524: 4 | H524: 7 | I524: =G524*6+H524 -> 31 | K524: 6 | L524: 9 | M524: =K524*6+L524 -> 45 | O524: 10 | P524: 12 | Q524: =O524*6+P524 -> 72 | S524: LEWIS | W524: NORTHCOTE | X524: 6 | Y524: 4 | Z524: 0 | AA524: 948 | AB524: 811 | AC524: 116.89 | AD524: 24
A525: BEST PLAYERS | W525: PRESTON | X525: 5 | Y525: 5 | Z525: 0 | AA525: 984 | AB525: 941 | AC525: 104.56960680127524 | AD525: 20
A526: COBURG | C526: REVILLE | F526: HENNING | I526: WALLACE | L526: NASH | N526: BROOM | Q526: RICHARDSON | W526: YARRAVILLE | X526: 4 | Y526: 6 | Z526: 0 | AA526: 947 | AB526: 936 | AC526: 101.17521367521367 | AD526: 16
A527: YARRAVILLE | C527: STREETER | F527: PARKS | I527: TURNER | L527: KENNY | N527: HOWARTH | Q527: H SMITH | W527: WILLIAMSTOWN | X527: 3 | Y527: 7 | Z527: 0 | AA527: 645 | AB527: 1089 | AC527: 59.228650137741049 | AD527: 12
A528: GOALKICKERS | W528: SANDRINGHAM | X528: 2 | Y528: 8 | Z528: 0 | AA528: 856 | AB528: 1166 | AC528: 73.413379073756431 | AD528: 8
A529: COBURG | C529: COLLINS 4 | F529: NASH 4 | I529: HENNING 2 | L529: ATKINSON 2 | W529: PORT MELBOURNE | X529: 1 | Y529: 9 | Z529: 0 | AA529: 759 | AB529: 1041 | AC529: 72.91 | AD529: 4
A530: YARRAVILLE | C530: WEDGWOOD 3 | F530: HOWARTH 3 | I530: HOPKINS 2 | L530: TURNER | N530: RYAN | W530: OAKLEIGH | X530: 0 | Y530: 10 | Z530: 0 | AA530: 778 | AB530: 1113 | AC530: 69.9 | AD530: 0
A532: PRESTON | C532: 3 | D532: 8 | E532: =C532*6+D532 -> 26 | G532: 7 | H532: 11 | I532: =G532*6+H532 -> 53 | K532: 14 | L532: 15 | M532: =K532*6+L532 -> 99 | O532: 20 | P532: 19 | Q532: =O532*6+P532 -> 139 | S532: PRESTON
A533: SANDRINGHAM | C533: 1 | D533: 2 | E533: =C533*6+D533 -> 8 | G533: 4 | H533: 6 | I533: =G533*6+H533 -> 30 | K533: 9 | L533: 9 | M533: =K533*6+L533 -> 63 | O533: 13 | P533: 11 | Q533: =O533*6+P533 -> 89 | S533: LESTER
A534: BEST PLAYERS
A535: PRESTON | C535: WARR | F535: FISHER | I535: MUIR | L535: MURRAY | O535: HARDING | R535: DUNSTONE
A536: SANDRINGHAM | C536: MITCHELL | F536: THOMS | I536: TOLSON | L536: NOSEDA | O536: KEMP | R536: McCOMB
A537: GOALKICKERS
A538: PRESTON | C538: WARR 7 | F538: FISHER 6 | I538: DUNSTONE 2 | L538: HUGHSON | N538: MURRAY | P538: HARDING | R538: MUIR | T538: O'CONNOR
A539: SANDRINGHAM | C539: DAVIS 3 | F539: TOLSON 3 | I539: McCOMB 2 | L539: CHRISTIE 2 | O539: CARTWRIGHT 2 | S539: MICHAELSON
A541: CAMBERWELL | C541: 7 | D541: 5 | E541: =C541*6+D541 -> 47 | G541: 13 | H541: 12 | I541: =G541*6+H541 -> 90 | K541: 15 | L541: 14 | M541: =K541*6+L541 -> 104 | O541: 23 | P541: 18 | Q541: =O541*6+P541 -> 156 | S541: CAMBERWELL
A542: WILLIAMSTOWN | C542: 5 | D542: 3 | E542: =C542*6+D542 -> 33 | G542: 6 | H542: 5 | I542: =G542*6+H542 -> 41 | K542: 9 | L542: 12 | M542: =K542*6+L542 -> 66 | O542: 11 | P542: 14 | Q542: =O542*6+P542 -> 80 | S542: STUART
A543: BEST PLAYERS
A544: CAMBERWELL | C544: WALKER | F544: FINLAYSON | I544: ROWE | L544: WILLIAMS | O544: TATHAM | R544: WARE
A545: WILLIAMSTOWN | C545: HUGGINS | F545: BROOKS | I545: MARTIN | L545: PATERSON | O545: ROWAN | R545: HEDLEY
A546: GOALKICKERS
A547: CAMBERWELL | C547: TATHAM 8 | F547: JONES 5 | H547: A DAVIDSON 3 | K547: T O'HALLORAN 2 | N547: PIERCE 2 | P547: MASON | R547: H DAVIDSON | V547: J O'HALLORAN
A548: WILLIAMSTOWN | C548: RICHARDSON 4 | F548: PITT 4 | H548: HEADLEY 2 | K548: LAWLOR
A550: NORTHCOTE | C550: 3 | D550: 8 | E550: =C550*6+D550 -> 26 | G550: 8 | H550: 8 | I550: =G550*6+H550 -> 56 | K550: 11 | L550: 11 | M550: =K550*6+L550 -> 77 | O550: 15 | P550: 14 | Q550: =O550*6+P550 -> 104 | S550: OAKLEIGH
A551: OAKLEIGH | C551: 3 | D551: 7 | E551: =C551*6+D551 -> 25 | G551: 5 | H551: 7 | I551: =G551*6+H551 -> 37 | K551: 7 | L551: 9 | M551: =K551*6+L551 -> 51 | O551: 11 | P551: 16 | Q551: =O551*6+P551 -> 82 | S551: HASSETT
A552: BEST PLAYERS
A553: NORTHCOTE | C553: O'KEEFE | E553: GRAY | H553: O'SHEA | K553: DOWNIE | N553: BATES | Q553: WILLIAMSON
A554: OAKLEIGH | C554: BAKER | E554: CHAPMAN | H554: HARRISON | K554: HUTCHESON | N554: HEINTZ | Q554: CRAMERI
A555: GOALKICKERS
A556: NORTHCOTE | C556: SEYMOUR 4 | F556: O'KEEFE 3 | I556: GRAY 3 | L556: CORNELL | N556: WILLIAMSON | Q556: HONIG | S556: DOWNIE | U556: O'SHEA
A557: OAKLEIGH | C557: HEINTZ 5 | F557: WILMOT 2 | I557: HARRISON | L557: CAMPBELL | N557: ANDERSON | Q557: CHAPMAN
A559: BRUNSWICK | C559: 1 | D559: 9 | E559: =C559*6+D559 -> 15 | G559: 8 | H559: 17 | I559: =G559*6+H559 -> 65 | K559: 14 | L559: 26 | M559: =K559*6+L559 -> 110 | O559: 21 | P559: 32 | Q559: =O559*6+P559 -> 158 | S559: BRUNSWICK
A560: PORT MELBOURNE | C560: 3 | D560: 4 | E560: =C560*6+D560 -> 22 | G560: 4 | H560: 4 | I560: =G560*6+H560 -> 28 | K560: 10 | L560: 6 | M560: =K560*6+L560 -> 66 | O560: 12 | P560: 10 | Q560: =O560*6+P560 -> 82 | S560: GLOVER
A561: BEST PLAYERS
A562: BRUNSWICK | C562: McINNES | F562: DOWLING | I562: FAY | L562: KENNEDY | O562: CLARKE | R562: McELROY
A563: PORT MELBOURNE | C563: KEATING | F563: PLUMRIDGE | I563: McBETH | L563: JULIER | O563: PAYNE | R563: CRAWSHAW
A564: GOALKICKERS
A565: BRUNSWICK | C565: McINNES 6 | F565: McELROY 4 | I565: COOPER 3 | K565: DOWLING 2 | N565: GILLON | P565: BOYD | R565: KENNEDY | U565: McKERNAN | X565: QUINN | Z565: CRAWFORD
A566: PORT MELBOURNE | C566: KEATING 4 | F566: CRAWSHAW 3 | I566: TIMMS | K566: ALDRIDGE | M566: RUSSO | O566: CHANDLER | R566: MALONEY
A568: ROUND 11 | E568: 27TH JUNE | H568: WEATHER | J568: COOL CLOUDY BUT FINE S.W. WIND GROUNDS BAD | S568: PLAYED AT
D569: 1ST QTR | H569: 2ND QTR | L569: 3RD QTR | P569: FINAL | S569: TOORAK PARK
A570: BRUNSWICK | C570: 4 | D570: 3 | E570: =C570*6+D570 -> 27 | G570: 6 | H570: 4 | I570: =G570*6+H570 -> 40 | K570: 8 | L570: 7 | M570: =K570*6+L570 -> 55 | O570: 13 | P570: 12 | Q570: =O570*6+P570 -> 90 | S570: UMPIRE | X570: LADDER | AB570: ROUND | AD570: 11
A571: PRAHRAN | C571: 1 | D571: 1 | E571: =C571*6+D571 -> 7 | G571: 5 | H571: 1 | I571: =G571*6+H571 -> 31 | K571: 10 | L571: 4 | M571: =K571*6+L571 -> 64 | O571: 11 | P571: 6 | Q571: =O571*6+P571 -> 72 | S571: GREGORY
A572: BEST PLAYERS | W572: TEAM | X572: W | Y572: L | Z572: D | AA572: FOR | AB572: AGST | AC572: % | AD572: PTS
A573: BRUNSWICK | C573: DOWLING | F573: FAY | I573: McELROY | L573: McKERNAN | O573: QUINN | Q573: CLARKE
A574: PRAHRAN | C574: WILLIAMS | F574: JOHNSON | I574: WILTSHIRE | L574: ANDERSON | O574: WHITE | Q574: GRAVELL | W574: BRUNSWICK | X574: 11 | Y574: 0 | Z574: 0 | AA574: 1360 | AB574: 817 | AC574: 166.4626682986536 | AD574: 44
A575: GOALKICKERS | O575: KENNEDY | Q575: CLARKE | W575: CAMBERWELL | X575: 9 | Y575: 2 | Z575: 0 | AA575: 1168 | AB575: 978 | AC575: 119.43 | AD575: 36
A576: BRUNSWICK | C576: COOPER 2 | E576: GILLON 2 | G576: DONNELLY 2 | J576: DOWLING 2 | M576: THOMPSON | P576: McELROY | R576: QUINN | W576: PRAHRAN | X576: 8 | Y576: 3 | Z576: 0 | AA576: 1088 | AB576: 911 | AC576: 119.42919868276618 | AD576: 32
A577: PRAHRAN | C577: HAWKINS 6 | F577: JOHNSTON 2 | I577: LOWRY | K577: ANDERSON | W577: COBURG | X577: 7 | Y577: 4 | Z577: 0 | AA577: 1257 | AB577: 1004 | AC577: 125.199203187251 | AD577: 28
A579: COBURG | C579: 2 | D579: 2 | E579: =C579*6+D579 -> 14 | G579: 6 | H579: 7 | I579: =G579*6+H579 -> 43 | K579: 9 | L579: 9 | M579: =K579*6+L579 -> 63 | O579: 16 | P579: 15 | Q579: =O579*6+P579 -> 111 | S579: COBURG | W579: BRIGHTON | X579: 7 | Y579: 4 | Z579: 0 | AA579: 985 | AB579: 970 | AC579: 101.55 | AD579: 28
A580: BRIGHTON | C580: 2 | D580: 2 | E580: =C580*6+D580 -> 14 | G580: 6 | H580: 3 | I580: =G580*6+H580 -> 39 | K580: 8 | L580: 11 | M580: =K580*6+L580 -> 59 | O580: 8 | P580: 12 | Q580: =O580*6+P580 -> 60 | S580: STUART | W580: NORTHCOTE | X580: 6 | Y580: 5 | Z580: 0 | AA580: 1019 | AB580: 883 | AC580: 115.4 | AD580: 24
A581: BEST PLAYERS | W581: PRESTON | X581: 5 | Y581: 6 | Z581: 0 | AA581: 1070 | AB581: 1037 | AC581: 103.18225650916104 | AD581: 20
A582: COBURG | C582: REVILLE | F582: WHITFIELD | I582: WALLACE | L582: McKEY | N582: JORDAN | Q582: HENNING | W582: YARRAVILLE | X582: 4 | Y582: 7 | Z582: 0 | AA582: 1049 | AB582: 1056 | AC582: 99.337121212121218 | AD582: 16
A583: BRIGHTON | C583: HINDSON | F583: CONDON | I583: GOULLET | L583: RUDD | N583: PENNY | Q583: WEBER | W583: WILLIAMSTOWN | X583: 4 | Y583: 7 | Z583: 0 | AA583: 741 | AB583: 1175 | AC583: 63.063829787234042 | AD583: 16
A584: GOALKICKERS | W584: SANDRINGHAM | X584: 3 | Y584: 8 | Z584: 0 | AA584: 976 | AB584: 1268 | AC584: 76.971608832807576 | AD584: 12
A585: COBURG | C585: REVILLE 6 | F585: COLLINS 4 | I585: NASH 3 | K585: HENNING | M585: HARRIS | O585: ANDERSON | W585: OAKLEIGH | X585: 1 | Y585: 10 | Z585: 0 | AA585: 895 | AB585: 1209 | AC585: 74.03 | AD585: 4
A586: BRIGHTON | C586: NIVEN 3 | F586: PENNY 3 | I586: DREW | K586: McLEOD | W586: PORT MELBOURNE | X586: 1 | Y586: 10 | Z586: 0 | AA586: 855 | AB586: 1158 | AC586: 73.83 | AD586: 4
A588: CAMBERWELL | C588: 3 | D588: 1 | E588: =C588*6+D588 -> 19 | G588: 5 | H588: 2 | I588: =G588*6+H588 -> 32 | K588: 5 | L588: 4 | M588: =K588*6+L588 -> 34 | O588: 11 | P588: 6 | Q588: =O588*6+P588 -> 72 | S588: NORTHCOTE
A589: NORTHCOTE | C589: 3 | D589: 5 | E589: =C589*6+D589 -> 23 | G589: 5 | H589: 9 | I589: =G589*6+H589 -> 39 | K589: 6 | L589: 10 | M589: =K589*6+L589 -> 46 | O589: 10 | P589: 11 | Q589: =O589*6+P589 -> 71 | S589: LEWIS
A590: BEST PLAYERS
A591: CAMBERWELL | C591: BRETT | F591: HENDERSON | I591: WILLIAMS | L591: A DAVIDSON | O591: H DAVIDSON | R591: WALKER
A592: NORTHCOTE | C592: GARRETT | F592: WOODS | I592: O'KEEFE | L592: HART | O592: ACKLAND | R592: BATES
A593: GOALKICKERS
A594: CAMBERWELL | C594: JONES 4 | F594: TATHAM 4 | I594: T O'HALLORAN | L594: WILLIAMS | N594: MEEHAN
A595: NORTHCOTE | C595: SEYMOUR 4 | F595: DOWNIE 3 | I595: R ROSS | K595: WILLIAMSON | N595: HONIG | P595: KENNEDY
A597: WILLIAMSTOWN | C597: 3 | D597: 1 | E597: =C597*6+D597 -> 19 | G597: 9 | H597: 8 | I597: =G597*6+H597 -> 62 | K597: 12 | L597: 9 | M597: =K597*6+L597 -> 81 | O597: 14 | P597: 12 | Q597: =O597*6+P597 -> 96 | S597: WILLIAMSTOWN
A598: PRESTON | C598: 3 | D598: 9 | E598: =C598*6+D598 -> 27 | G598: 7 | H598: 9 | I598: =G598*6+H598 -> 51 | K598: 12 | L598: 11 | M598: =K598*6+L598 -> 83 | O598: 12 | P598: 14 | Q598: =O598*6+P598 -> 86 | S598: HASSETT
A599: BEST PLAYERS
A600: WILLIAMSTOWN | C600: HUGGINS | E600: BROOKS | H600: MARTIN | K600: DELLER | N600: ROBERTSON | Q600: PATERSON
A601: PRESTON | C601: CLACK | E601: WARR | H601: HARDING | K601: FISHER | N601: HUGHSON | Q601: QUINLAN
A602: GOALKICKERS
A603: WILLIAMSTOWN | C603: ROBINSON 3 | F603: LAWLOR 2 | I603: RICHARDSON 2 | L603: PATERSON 2 | O603: GREEN 2 | Q603: DELLER | S603: PITT | U603: WILLETT
A604: PRESTON | C604: FISHER 6 | F604: WARR 2 | I604: O'CONNOR 2 | L604: DUNSTONE | O604: HARDING
A606: SANDRINGHAM | C606: 5 | D606: 5 | E606: =C606*6+D606 -> 35 | G606: 8 | H606: 7 | I606: =G606*6+H606 -> 55 | K606: 13 | L606: 14 | M606: =K606*6+L606 -> 92 | O606: 17 | P606: 18 | Q606: =O606*6+P606 -> 120 | S606: BEACH ROAD
A607: YARRAVILLE | C607: 4 | D607: 4 | E607: =C607*6+D607 -> 28 | G607: 9 | H607: 13 | I607: =G607*6+H607 -> 67 | K607: 12 | L607: 16 | M607: =K607*6+L607 -> 88 | O607: 14 | P607: 18 | Q607: =O607*6+P607 -> 102 | S607: GLOVER
A608: BEST PLAYERS
A609: SANDRINGHAM | C609: MEEHAN | F609: THOMS | I609: CRACKNELL | L609: WITCHELL | O609: CARTWRIGHT | R609: TOLSON
A610: YARRAVILLE | C610: RAWSON | F610: I EVANS | I610: PETERS | L610: TURNER | O610: COLEMAN | R610: RYAN
A611: GOALKICKERS
A612: SANDRINGHAM | C612: CARTWRIGHT 5 | F612: WOODWARD 2 | I612: MEEHAN 2 | L612: WITCHELL 2 | O612: McCOMB 2 | R612: MICHAELSON | V612: DAVIS | X612: TOLSON | Z612: BOYD
A613: YARRAVILLE | C613: TURNER 3 | F613: HOWARTH 3 | I613: CAVE 3 | K613: PARKES 3 | M613: HOPKINS | O613: RAWSON
A615: OAKLEIGH | C615: 4 | D615: 3 | E615: =C615*6+D615 -> 27 | G615: 8 | H615: 7 | I615: =G615*6+H615 -> 55 | K615: 14 | L615: 10 | M615: =K615*6+L615 -> 94 | O615: 17 | P615: 15 | Q615: =O615*6+P615 -> 117 | S615: PORT MELBOURNE
A616: PORT MELBOURNE | C616: 4 | D616: 4 | E616: =C616*6+D616 -> 28 | G616: 10 | H616: 8 | I616: =G616*6+H616 -> 68 | K616: 12 | L616: 11 | M616: =K616*6+L616 -> 83 | O616: 14 | P616: 12 | Q616: =O616*6+P616 -> 96 | S616: LESTER
A617: BEST PLAYERS
A618: OAKLEIGH | C618: HARRISON | F618: ANDERSON | I618: CRAMERI | L618: CHAPMAN | O618: BAKER | Q618: WITHERS
A619: PORT MELBOURNE | C619: KEATING | F619: ALDRIDGE | I619: TIMMS | L619: CRAWSHAW | O619: TYSON | Q619: McBETH
A620: GOALKICKERS
A621: OAKLEIGH | C621: HARRISON 6 | F621: ANDERSON 5 | I621: CRAMERI 2 | L621: HEINTZ 2 | N621: KENNEDY | Q621: POWELL
A622: PORT MELBOURNE | C622: CRAWSHAW 6 | F622: ALDRIDGE 3 | I622: TIMMS 2 | L622: TYSON | N622: KEATING | Q622: MALONEY
A624: ROUND 12 | E624: 4TH JULY | H624: WEATHER | K624: RAIN NORTH WIND GROUNDS WATERLOGGED | S624: PLAYED AT
D625: 1ST QTR | H625: 2ND QTR | L625: 3RD QTR | P625: FINAL | S625: COBURG
A626: BRUNSWICK | C626: 2 | D626: 0 | E626: =C626*6+D626 -> 12 | G626: 6 | H626: 9 | I626: =G626*6+H626 -> 45 | K626: 7 | L626: 10 | M626: =K626*6+L626 -> 52 | O626: 11 | P626: 11 | Q626: =O626*6+P626 -> 77 | S626: UMPIRE | X626: LADDER | AB626: ROUND | AD626: 12
A627: COBURG | C627: 2 | D627: 4 | E627: =C627*6+D627 -> 16 | G627: 3 | H627: 4 | I627: =G627*6+H627 -> 22 | K627: 7 | L627: 11 | M627: =K627*6+L627 -> 53 | O627: 7 | P627: 12 | Q627: =O627*6+P627 -> 54 | S627: GLOVER
A628: BEST PLAYERS | W628: TEAM | X628: W | Y628: L | Z628: D | AA628: FOR | AB628: AGST | AC628: % | AD628: PTS
A629: BRUNSWICK | C629: FAY | F629: DOWLING | I629: LASKY | K629: KENNEDY | N629: CLARKE | Q629: McELROY
A630: COBURG | C630: WALLACE | F630: NASH | I630: REVILLE | K630: HARRIS | N630: HARBINSON | Q630: McKEY | W630: BRUNSWICK | X630: 12 | Y630: 0 | Z630: 0 | AA630: 1437 | AB630: 871 | AC630: 164.98277841561423 | AD630: 48
A631: GOALKICKERS | W631: PRAHRAN | X631: 9 | Y631: 3 | Z631: 0 | AA631: 1225 | AB631: 944 | AC631: 129.76694915254237 | AD631: 36
A632: BRUNSWICK | C632: GILLON 2 | F632: McINNES 2 | I632: DOWLING 2 | L632: McELROY 2 | N632: COOPER | P632: LASKY | R632: DONNELLY | W632: CAMBERWELL | X632: 9 | Y632: 3 | Z632: 0 | AA632: 1252 | AB632: 1077 | AC632: 116.25 | AD632: 36
A633: COBURG | C633: NASH 4 | F633: HARRIS | H633: WHITFIELD | J633: SHENFIELD | W633: BRIGHTON | X633: 8 | Y633: 4 | Z633: 0 | AA633: 1095 | AB633: 1050 | AC633: 104.29 | AD633: 32
A635: PRESTON | C635: 0 | D635: 5 | E635: =C635*6+D635 -> 5 | G635: 4 | H635: 8 | I635: =G635*6+H635 -> 32 | K635: 5 | L635: 10 | M635: =K635*6+L635 -> 40 | O635: 7 | P635: 14 | Q635: =O635*6+P635 -> 56 | S635: NORTHCOTE | W635: COBURG | X635: 7 | Y635: 5 | Z635: 0 | AA635: 1311 | AB635: 1081 | AC635: 121.27659574468085 | AD635: 28
A636: NORTHCOTE | C636: 0 | D636: 2 | E636: =C636*6+D636 -> 2 | G636: 2 | H636: 5 | I636: =G636*6+H636 -> 17 | K636: 4 | L636: 7 | M636: =K636*6+L636 -> 31 | O636: 5 | P636: 8 | Q636: =O636*6+P636 -> 38 | S636: GREGORY | W636: NORTHCOTE | X636: 6 | Y636: 6 | Z636: 0 | AA636: 1057 | AB636: 939 | AC636: 112.57 | AD636: 24
A637: BEST PLAYERS | W637: PRESTON | X637: 6 | Y637: 6 | Z637: 0 | AA637: 1126 | AB637: 1075 | AC637: 104.74418604651163 | AD637: 24
A638: PRESTON | C638: FISHER | F638: CANNAWAY | I638: BROWN | L638: COOPER | O638: CLACK | Q638: WARR | W638: WILLIAMSTOWN | X638: 5 | Y638: 7 | Z638: 0 | AA638: 797 | AB638: 1215 | AC638: 65.596707818930042 | AD638: 20
A639: NORTHCOTE | C639: HOLDEN | F639: POWELL | I639: ACKLAND | L639: SMITH | O639: GRAY | Q639: SIMMONDS | W639: YARRAVILLE | X639: 4 | Y639: 8 | Z639: 0 | AA639: 1089 | AB639: 1112 | AC639: 97.931654676258987 | AD639: 16
A640: GOALKICKERS | W640: SANDRINGHAM | X640: 3 | Y640: 9 | Z640: 0 | AA640: 1056 | AB640: 1378 | AC640: 76.632801161103046 | AD640: 12
A641: PRESTON | C641: FISHER 3 | F641: HUGHSON | I641: HUGO | K641: WARR | M641: DUNSTONE | W641: OAKLEIGH | X641: 2 | Y641: 10 | Z641: 0 | AA641: 994 | AB641: 1293 | AC641: 76.88 | AD641: 8
A642: NORTHCOTE | C642: SIMMONDS 3 | F642: WILLIAMSON | I642: DOWNIE | W642: PORT MELBOURNE | X642: 1 | Y642: 11 | Z642: 0 | AA642: 888 | AB642: 1295 | AC642: 68.57 | AD642: 4
A644: WILLIAMSTOWN | C644: 1 | D644: 8 | E644: =C644*6+D644 -> 14 | G644: 2 | H644: 9 | I644: =G644*6+H644 -> 21 | K644: 7 | L644: 14 | M644: =K644*6+L644 -> 56 | O644: 7 | P644: 14 | Q644: =O644*6+P644 -> 56 | S644: WILLIAMSTOWN
A645: YARRAVILLE | C645: 1 | D645: 1 | E645: =C645*6+D645 -> 7 | G645: 4 | H645: 7 | I645: =G645*6+H645 -> 31 | K645: 4 | L645: 7 | M645: =K645*6+L645 -> 31 | O645: 4 | P645: 16 | Q645: =O645*6+P645 -> 40 | S645: LESTER
A646: BEST PLAYERS
A647: WILLIAMSTOWN | C647: BROOKS | F647: MARTIN | I647: HUGGINS | L647: TAYLOR | O647: LAWLOR | R647: PITT
A648: YARRAVILLE | C648: WEDGWOOD | F648: McGRATH | I648: CAVE | L648: EVANS | O648: PARKS | R648: TURNER
A649: GOALKICKERS
A650: WILLIAMSTOWN | C650: LAWLOR 3 | F650: PITT | H650: TAYLOR | J650: RICHARDSON | M650: KAUFMAN
A651: YARRAVILLE | C651: TURNER | F651: WEDGWOOD | I651: BUCKLEY | L651: EVANS
A653: BRIGHTON | C653: 4 | D653: 13 | E653: =C653*6+D653 -> 37 | G653: 4 | H653: 16 | I653: =G653*6+H653 -> 40 | K653: 11 | L653: 26 | M653: =K653*6+L653 -> 92 | O653: 14 | P653: 26 | Q653: =O653*6+P653 -> 110 | S653: BEACH ROAD
A654: SANDRINGHAM | C654: 1 | D654: 1 | E654: =C654*6+D654 -> 7 | G654: 6 | H654: 6 | I654: =G654*6+H654 -> 42 | K654: 7 | L654: 6 | M654: =K654*6+L654 -> 48 | O654: 12 | P654: 8 | Q654: =O654*6+P654 -> 80 | S654: HASSETT
A655: BEST PLAYERS
A656: BRIGHTON | C656: PENNY | E656: GOULLET | H656: EGAN | K656: WILLIAMSON | N656: HINDSON | Q656: WEBER
A657: SANDRINGHAM | C657: THOMS | E657: TORPY | H657: CARTWRIGHT | K657: J NOSEDA | N657: MICHAELSON | Q657: MITCHELL
A658: GOALKICKERS
A659: BRIGHTON | C659: NIVEN 5) | F659: DEANE 2 | I659: McGRATH 2 | L659: RUDD 2 | N659: DREW | P659: MILLER | R659: WILLIAMSON
A660: SANDRINGHAM | C660: CARTWRIGHT 3 | F660: WOODWARD 2 | I660: TORPEY 2 | L660: DAVIS 2 | N660: ROBERTS | P660: WITCHELL | R660: CHRISTIE | U660: BOYD
A662: PRAHRAN | C662: 6 | D662: 2 | E662: =C662*6+D662 -> 38 | G662: 8 | H662: 8 | I662: =G662*6+H662 -> 56 | K662: 15 | L662: 13 | M662: =K662*6+L662 -> 103 | O662: 20 | P662: 17 | Q662: =O662*6+P662 -> 137 | S662: PORT MELBOURNE
A663: PORT MELBOURNE | C663: 1 | D663: 0 | E663: =C663*6+D663 -> 6 | G663: 2 | H663: 1 | I663: =G663*6+H663 -> 13 | K663: 2 | L663: 1 | M663: =K663*6+L663 -> 13 | O663: 5 | P663: 3 | Q663: =O663*6+P663 -> 33 | S663: STUART
A664: BEST PLAYERS
A665: PRAHRAN | C665: WESCOTT | F665: FLEMING | I665: KOOP | L665: WHITE | O665: HAWKINS | R665: LOWRY
A666: PORT MELBOURNE | C666: TYSON | F666: JULIER | I666: McBETH | L666: MALONEY | O666: TYRELL | R666: KEATING
A667: GOALKICKERS
A668: PRAHRAN | C668: HAWKINS 8 | F668: WHITE 4 | I668: BRENCHLEY 3 | L668: ANDERSON 3 | O668: FLEMING | Q668: KENNEDY
A669: PORT MELBOURNE | C669: KEATING 2 | F669: TYSON | I669: MCBETH | L669: CRAWSHAW
A671: OAKLEIGH | C671: 1 | D671: 7 | E671: =C671*6+D671 -> 13 | G671: 6 | H671: 8 | I671: =G671*6+H671 -> 44 | K671: 9 | L671: 9 | M671: =K671*6+L671 -> 63 | O671: 15 | P671: 9 | Q671: =O671*6+P671 -> 99 | S671: OAKLEIGH
A672: CAMBERWELL | C672: 4 | D672: 4 | E672: =C672*6+D672 -> 28 | G672: 7 | H672: 6 | I672: =G672*6+H672 -> 48 | K672: 10 | L672: 14 | M672: =K672*6+L672 -> 74 | O672: 13 | P672: 6 | Q672: =O672*6+P672 -> 84 | S672: LEWIS
A673: BEST PLAYERS
A674: OAKLEIGH | C674: HEINTZ | F674: BAKER | I674: CHAPMAN | L674: HARRISON | O674: RYAN | R674: HUTCHESON
A675: CAMBERWELL | C675: WILLIAMS | F675: WARE | I675: FINLAYSON | L675: JONES | O675: VANTHOFF | R675: KIDD
A676: GOALKICKERS
A677: OAKLEIGH | C677: HEINTZ 5 | F677: CAMPBELL 3) | I677: WILMOT 3 | L677: HARRISON 2 | O677: ANDERSON | Q677: KENNEDY
A678: CAMBERWELL | C678: T O'HALLORAN 3 | G678: JONES 3 | I678: A DAVIDSON 2 | L678: WARE 2 | N678: MEEHAN | P678: VANTHOFF | S678: WILSON
A680: ROUND 13 | E680: 11TH JULY | J680: WEATHER | M680: CLOUDY BUT FINE WEST BREEZE | S680: PLAYED AT
D681: 1ST QTR | H681: 2ND QTR | L681: 3RD QTR | P681: FINAL | S681: TOORAK PARK
A682: PRAHRAN | C682: 5 | D682: 2 | E682: =C682*6+D682 -> 32 | G682: 8 | H682: 2 | I682: =G682*6+H682 -> 50 | K682: 12 | L682: 4 | M682: =K682*6+L682 -> 76 | O682: 16 | P682: 6 | Q682: =O682*6+P682 -> 102 | S682: UMPIRE | X682: LADDER | AB682: ROUND | AD682: 13
A683: COBURG | C683: 3 | D683: 2 | E683: =C683*6+D683 -> 20 | G683: 7 | H683: 3 | I683: =G683*6+H683 -> 45 | K683: 10 | L683: 6 | M683: =K683*6+L683 -> 66 | O683: 12 | P683: 12 | Q683: =O683*6+P683 -> 84 | S683: LEWIS
A684: BEST PLAYERS | W684: TEAM | X684: W | Y684: L | Z684: D | AA684: FOR | AB684: AGST | AC684: % | AD684: PTS
A685: PRAHRAN | C685: WILLIAMS | F685: HAWKINS | I685: WHITE | L685: FLEMING | O685: SMITH | Q685: LOWRY
A686: COBURG | C686: McKEY | F686: WALLACE | I686: HARBINSON | L686: WHITFIELD | O686: KNOTT | Q686: REVILLE | W686: BRUNSWICK | X686: 13 | Y686: 0 | Z686: 0 | AA686: 1624 | AB686: 936 | AC686: 173.5042735042735 | AD686: 52
A687: GOALKICKERS | W687: PRAHRAN | X687: 10 | Y687: 3 | Z687: 0 | AA687: 1327 | AB687: 1028 | AC687: 129.08560311284046 | AD687: 40
A688: PRAHRAN | C688: HAWKINS 7 | F688: BRENCHLEY 3 | I688: ANDERSON 2 | L688: KENNEDY 2 | O688: WHITE | Q688: MURRAY | W688: CAMBERWELL | X688: 10 | Y688: 3 | Z688: 0 | AA688: 1411 | AB688: 1131 | AC688: 124.76 | AD688: 40
A689: COBURG | C689: COLLINS 6 | F689: REVILLE 2 | I689: NASH | K689: KNOTT | M689: WHITFIELD | P689: McKEY | W689: BRIGHTON | X689: 9 | Y689: 4 | Z689: 0 | AA689: 1158 | AB689: 1104 | AC689: 104.89 | AD689: 36
A691: BRIGHTON | C691: 2 | D691: 5 | E691: =C691*6+D691 -> 17 | G691: 5 | H691: 10 | I691: =G691*6+H691 -> 40 | K691: 6 | L691: 15 | M691: =K691*6+L691 -> 51 | O691: 8 | P691: 15 | Q691: =O691*6+P691 -> 63 | S691: ELSTERNWICK PARK | W691: COBURG | X691: 7 | Y691: 6 | Z691: 0 | AA691: 1395 | AB691: 1183 | AC691: 117.92054099746407 | AD691: 28
A692: WILLIAMSTOWN | C692: 1 | D692: 0 | E692: =C692*6+D692 -> 6 | G692: 4 | H692: 2 | I692: =G692*6+H692 -> 26 | K692: 6 | L692: 3 | M692: =K692*6+L692 -> 39 | O692: 8 | P692: 6 | Q692: =O692*6+P692 -> 54 | S692: GLOVER | W692: NORTHCOTE | X692: 7 | Y692: 6 | Z692: 0 | AA692: 1167 | AB692: 1000 | AC692: 116.7 | AD692: 28
A693: BEST PLAYERS | W693: PRESTON | X693: 7 | Y693: 6 | Z693: 0 | AA693: 1247 | AB693: 1176 | AC693: 106.0374149659864 | AD693: 28
A694: BRIGHTON | C694: BAKER | E694: HALLAHAN | I694: WEBER | L694: ROSENBROCK | O694: PENNY | Q694: GOTTSCHE | W694: WILLIAMSTOWN | X694: 5 | Y694: 8 | Z694: 0 | AA694: 851 | AB694: 1278 | AC694: 66.58841940532082 | AD694: 20
A695: WILLIAMSTOWN | C695: BROOKS | E695: LAWLOR | I695: PATERSON | L695: ROBERTSON | O695: DELLER | Q695: RAEBURN | W695: YARRAVILLE | X695: 4 | Y695: 9 | Z695: 0 | AA695: 1150 | AB695: 1222 | AC695: 94.10801963993454 | AD695: 16
A696: GOALKICKERS | W696: SANDRINGHAM | X696: 3 | Y696: 10 | Z696: 0 | AA696: 1121 | AB696: 1565 | AC696: 71.629392971246006 | AD696: 12
A697: BRIGHTON | C697: DEANE 2 | F697: PENNY 2 | I697: NIVEN | K697: WEBER | M697: RUDD | O697: GOTTSCHE | W697: OAKLEIGH | X697: 2 | Y697: 11 | Z697: 0 | AA697: 1095 | AB697: 1414 | AC697: 77.44 | AD697: 8
A698: WILLIAMSTOWN | C698: LAWLOR 3 | F698: PATERSON 2 | I698: ROBERTSON 2 | L698: RICHARDSON | W698: PORT MELBOURNE | X698: 1 | Y698: 12 | Z698: 0 | AA698: 942 | AB698: 1454 | AC698: 64.79 | AD698: 4
A700: NORTHCOTE | C700: 4 | D700: 7 | E700: =C700*6+D700 -> 31 | G700: 8 | H700: 9 | I700: =G700*6+H700 -> 57 | K700: 12 | L700: 11 | M700: =K700*6+L700 -> 83 | O700: 16 | P700: 14 | Q700: =O700*6+P700 -> 110 | S700: YARRAVILLE
A701: YARRAVILLE | C701: 1 | D701: 5 | E701: =C701*6+D701 -> 11 | G701: 4 | H701: 7 | I701: =G701*6+H701 -> 31 | K701: 6 | L701: 9 | M701: =K701*6+L701 -> 45 | O701: 8 | P701: 13 | Q701: =O701*6+P701 -> 61 | S701: GREGORY
A702: BEST PLAYERS
A703: NORTHCOTE | C703: R ROSS | E703: WILLIAMSON | H703: ACKLAND | K703: GARRETT | N703: HART | Q703: SMITH
A704: YARRAVILLE | C704: PETERS | E704: McGRATH | H704: RYAN | K704: HOPKINS | N704: WEDGWOOD | Q704: PARKS
A705: GOALKICKERS
A706: NORTHCOTE | C706: SEYMOUR 5 | F706: HONIG 3 | I706: SIMMONDS 2 | L706: DOWNIE 2 | N706: O'SHEA | P706: SMITH | R706: R ROSS | U706: GRAY
A707: YARRAVILLE | C707: BUCKLEY 2 | F707: HOWARTH 2 | I707: WEDGWOOD 2 | L707: HOPKINS | N707: HALL
A709: PRESTON | C709: 3 | D709: 8 | E709: =C709*6+D709 -> 26 | G709: 6 | H709: 12 | I709: =G709*6+H709 -> 48 | K709: 11 | L709: 19 | M709: =K709*6+L709 -> 85 | O709: 17 | P709: 19 | Q709: =O709*6+P709 -> 121 | S709: PRESTON
A710: OAKLEIGH | C710: 6 | D710: 1 | E710: =C710*6+D710 -> 37 | G710: 10 | H710: 4 | I710: =G710*6+H710 -> 64 | K710: 11 | L710: 6 | M710: =K710*6+L710 -> 72 | O710: 15 | P710: 11 | Q710: =O710*6+P710 -> 101 | S710: STUART
A711: BEST PLAYERS
A712: PRESTON | C712: COOK | F712: FISHER | I712: HARDING | L712: COOPER | O712: HYDE | Q712: O'CONNOR
A713: OAKLEIGH | C713: HUTCHESON | F713: CRAMERI | I713: BAKER | L713: WILMOTT | O713: CHAPMAN | Q713: WITHERS
A714: GOALKICKERS
A715: PRESTON | C715: FISHER 6 | F715: HARDING 3 | I715: DUNSTONE 3 | L715: HUGO 2 | N715: WARR 2 | P715: HYDE
A716: OAKLEIGH | C716: ANDERSON 5 | F716: CHAPMAN 3 | I716: CAMPBELL 2 | L716: HEINTZ 2 | N716: HARRISON | Q716: KENNEDY | T716: WILMOT
A718: CAMBERWELL | C718: 8 | D718: 2 | E718: =C718*6+D718 -> 50 | G718: 16 | H718: 10 | I718: =G718*6+H718 -> 106 | K718: 16 | L718: 19 | M718: =K718*6+L718 -> 115 | O718: 23 | P718: 21 | Q718: =O718*6+P718 -> 159 | S718: CAMBERWELL
A719: PORT MELBOURNE | C719: 3 | D719: 1 | E719: =C719*6+D719 -> 19 | G719: 5 | H719: 2 | I719: =G719*6+H719 -> 32 | K719: 7 | L719: 3 | M719: =K719*6+L719 -> 45 | O719: 8 | P719: 6 | Q719: =O719*6+P719 -> 54 | S719: ROBERTS
A720: BEST PLAYERS
A721: CAMBERWELL | C721: JONES | E721: WILSON | H721: T O'HALLORAN | L721: WALKER | O721: A DAVIDSON | R721: WILLIAMS
A722: PORT MELBOURNE | C722: PAYNE | E722: PLUMRIDGE | H722: ONLEY | L722: KEATING | O722: ALDRIDGE | R722: McBETH
A723: GOALKICKERS
A724: CAMBERWELL | C724: MASON 5 | E724: A DAVIDSON 4 | H724: T O'HALLORAN 4 | L724: JONES 3 | N724: TATHAM 3 | Q724: MEEHAN | S724: H DAVIDSON | W724: PIERCE | X724: WILLIAMS
A725: PORT MELBOURNE | C725: CRAWSHAW 2 | G725: DAVIS 2 | I725: KEATING | K725: ALDRIDGE | M725: TANNER | O725: WOODS
A727: BRUNSWICK | C727: 8 | D727: 5 | E727: =C727*6+D727 -> 53 | G727: 13 | H727: 9 | I727: =G727*6+H727 -> 87 | K727: 21 | L727: 15 | M727: =K727*6+L727 -> 141 | O727: 28 | P727: 19 | Q727: =O727*6+P727 -> 187 | S727: BRUNSWICK
A728: SANDRINGHAM | C728: 2 | D728: 4 | E728: =C728*6+D728 -> 16 | G728: 4 | H728: 5 | I728: =G728*6+H728 -> 29 | K728: 5 | L728: 9 | M728: =K728*6+L728 -> 39 | O728: 9 | P728: 11 | Q728: =O728*6+P728 -> 65 | S728: LESTER
A729: BEST PLAYERS
A730: BRUNSWICK | C730: COOPER | E730: McELROY | H730: FAY | L730: DOWLING | O730: QUINN | R730: LASKY
A731: SANDRINGHAM | C731: KEMP | E731: McCOMB | H731: WOODWARD | L731: TORPY | O731: J NOSEDA | R731: T NOSEDA
A732: GOALKICKERS
A733: BRUNSWICK | C733: COOPER 16 | F733: GILLON 3 | I733: McELROY 3 | L733: LASKY 2 | N733: McINNES 2 | Q733: BOYD | S733: DONNELLY
A734: SANDRINGHAM | C734: WOODWARD 2 | F734: MICHAELSON 2 | J734: MCCOMB 2 | M734: MITCHELL | O734: CARTWRIGHT | R734: DAVIS
A736: ROUND 14 | E736: 18TH JULY | J736: WEATHER | M736: COLD CLOUDY S.W. WIND | S736: PLAYED AT
D737: 1ST QTR | H737: 2ND QTR | L737: 3RD QTR | P737: FINAL | S737: NORTHCOTE
A738: NORTHCOTE | C738: 6 | D738: 4 | E738: =C738*6+D738 -> 40 | G738: 6 | H738: 7 | I738: =G738*6+H738 -> 43 | K738: 10 | L738: 13 | M738: =K738*6+L738 -> 73 | O738: 14 | P738: 15 | Q738: =O738*6+P738 -> 99 | S738: UMPIRE | X738: LADDER | AB738: ROUND | AD738: 14
A739: BRIGHTON | C739: 3 | D739: 2 | E739: =C739*6+D739 -> 20 | G739: 8 | H739: 6 | I739: =G739*6+H739 -> 54 | K739: 10 | L739: 6 | M739: =K739*6+L739 -> 66 | O739: 13 | P739: 9 | Q739: =O739*6+P739 -> 87 | S739: LEWIS
A740: BEST PLAYERS | W740: TEAM | X740: W | Y740: L | Z740: D | AA740: FOR | AB740: AGST | AC740: % | AD740: PTS
A741: NORTHCOTE | C741: HART | E741: GARRETT | H741: WILLIAMSON | L741: ACKLAND | O741: O'KEEFE | Q741: BATES
A742: BRIGHTON | C742: WEBER | E742: GOULLET | H742: HALLAHAN | L742: DEANE | O742: CONNELL | Q742: CONDON | W742: BRUNSWICK | X742: 14 | Y742: 0 | Z742: 0 | AA742: 1707 | AB742: 997 | AC742: 171.21 | AD742: 56
A743: GOALKICKERS | W743: PRAHRAN | X743: 11 | Y743: 3 | Z743: 0 | AA743: 1453 | AB743: 1089 | AC743: 133.42516069788797 | AD743: 44
A744: NORTHCOTE | C744: BATES 5 | E744: R ROSS 2 | G744: SIMMONDS 2 | J744: SMITH 2 | L744: CORNELL | N744: O'KEEFE | P744: HART | W744: CAMBERWELL | X744: 11 | Y744: 3 | Z744: 0 | AA744: 1510 | AB744: 1216 | AC744: 124.18 | AD744: 44
A745: BRIGHTON | C745: NIVEN 5 | E745: CONNELL 3 | H745: DEANE 2 | J745: DREW | L745: PENNY | N745: GOTTSCHE | W745: BRIGHTON | X745: 9 | Y745: 5 | Z745: 0 | AA745: 1245 | AB745: 1203 | AC745: 103.49 | AD745: 36
A747: CAMBERWELL | C747: 0 | D747: 1 | E747: =C747*6+D747 -> 1 | G747: 6 | H747: 8 | I747: =G747*6+H747 -> 44 | K747: 8 | L747: 7 | M747: =K747*6+L747 -> 55 | O747: 15 | P747: 9 | Q747: =O747*6+P747 -> 99 | S747: CAMBERWELL | W747: COBURG | X747: 8 | Y747: 6 | Z747: 0 | AA747: 1528 | AB747: 1248 | AC747: 122.43589743589743 | AD747: 32
A748: PRESTON | C748: 7 | D748: 8 | E748: =C748*6+D748 -> 50 | G748: 9 | H748: 11 | I748: =G748*6+H748 -> 65 | K748: 11 | L748: 17 | M748: =K748*6+L748 -> 83 | O748: 11 | P748: 19 | Q748: =O748*6+P748 -> 85 | S748: GLOVER | W748: NORTHCOTE | X748: 8 | Y748: 6 | Z748: 0 | AA748: 1266 | AB748: 1087 | AC748: 116.47 | AD748: 32
A749: BEST PLAYERS | W749: PRESTON | X749: 7 | Y749: 7 | Z749: 0 | AA749: 1332 | AB749: 1275 | AC749: 104.47058823529412 | AD749: 28
A750: CAMBERWELL | C750: JONES | F750: A DAVIDSON | I750: WILSON | K750: WARE | N750: HENDERSON | Q750: CLAMP | W750: WILLIAMSTOWN | X750: 5 | Y750: 9 | Z750: 0 | AA750: 912 | AB750: 1361 | AC750: 67.01 | AD750: 20
A751: PRESTON | C751: HARDING | F751: MUIR | I751: WARR | K751: DUNSTONE | N751: COOPER | Q751: GALE | W751: YARRAVILLE | X751: 4 | Y751: 10 | Z751: 0 | AA751: 1228 | AB751: 1353 | AC751: 90.761271249076131 | AD751: 16
A752: GOALKICKERS | W752: OAKLEIGH | X752: 3 | Y752: 11 | Z752: 0 | AA752: 1226 | AB752: 1492 | AC752: 82.17 | AD752: 12
A753: CAMBERWELL | C753: T O'HALLORAN 4 | G753: A DAVIDSON 3) | J753: JONES 3 | L753: TATHAM 3 | O753: MASON | Q753: WARE | W753: SANDRINGHAM | X753: 3 | Y753: 11 | Z753: 0 | AA753: 1182 | AB753: 1691 | AC753: 69.899467770549975 | AD753: 12
A754: PRESTON | C754: WARR 4 | F754: FISHER 3 | I754: HUGHSON 2 | L754: HARDING | W754: PORT MELBOURNE | X754: 1 | Y754: 13 | Z754: 0 | AA754: 1007 | AB754: 1587 | AC754: 63.45 | AD754: 4
A756: OAKLEIGH | C756: 3 | D756: 10 | E756: =C756*6+D756 -> 28 | G756: 9 | H756: 11 | I756: =G756*6+H756 -> 65 | K756: 15 | L756: 22 | M756: =K756*6+L756 -> 112 | O756: 18 | P756: 23 | Q756: =O756*6+P756 -> 131 | S756: OAKLEIGH
A757: YARRAVILLE | C757: 1 | D757: 1 | E757: =C757*6+D757 -> 7 | G757: 5 | H757: 6 | I757: =G757*6+H757 -> 36 | K757: 7 | L757: 9 | M757: =K757*6+L757 -> 51 | O757: 11 | P757: 12 | Q757: =O757*6+P757 -> 78 | S757: GREGORY
A758: BEST PLAYERS
A759: OAKLEIGH | C759: WITHERS | F759: HARRISON | I759: ANDERSON | L759: BELL | O759: ASH | Q759: HUTCHESON
A760: YARRAVILLE | C760: WEDGWOOD | F760: McGRATH | I760: COPPOCK | L760: CAVE | O760: RAWSON | Q760: RYAN
A761: GOALKICKERS
A762: OAKLEIGH | C762: ANDERSON 5 | F762: HEINTZ 5 | I762: HARRISON 4 | L762: CHAPMAN 2 | O762: CAMPBELL | R762: KENNEDY
A763: YARRAVILLE | C763: TURNER 5 | F763: RAWSON 3 | I763: McGRATH 2 | L763: WEDGWOOD
A765: BRUNSWICK | C765: 4 | D765: 2 | E765: =C765*6+D765 -> 26 | G765: 4 | H765: 5 | I765: =G765*6+H765 -> 29 | K765: 10 | L765: 8 | M765: =K765*6+L765 -> 68 | O765: 12 | P765: 11 | Q765: =O765*6+P765 -> 83 | S765: WILLIAMSTOWN
A766: WILLIAMSTOWN | C766: 2 | D766: 2 | E766: =C766*6+D766 -> 14 | G766: 4 | H766: 4 | I766: =G766*6+H766 -> 28 | K766: 5 | L766: 4 | M766: =K766*6+L766 -> 34 | O766: 9 | P766: 7 | Q766: =O766*6+P766 -> 61 | S766: FORD
A767: BEST PLAYERS
A768: BRUNSWICK | C768: FAY | E768: LASKY | I768: BOSCHEN | L768: McINNES | O768: CLARKE | Q768: VAUGHAN
A769: WILLIAMSTOWN | C769: BROOKS | E769: RICHARDSON | I769: KAUFMAN | L769: PATERSON | O769: DELLER | Q769: ROWAN
A770: GOALKICKERS
A771: BRUNSWICK | C771: COOPER 4 | F771: McINNES 4 | I771: LASKY 2 | L771: BOYD | N771: DOWLING
A772: WILLIAMSTOWN | C772: LAWLOR 3 | F772: R RAEBURN | I772: PATERSON | L772: DELLER | N772: GREEN | P772: ROBERTSON | S772: ROWAN
A774: COBURG | C774: 0 | D774: 0 | E774: =C774*6+D774 -> 0 | G774: 6 | H774: 12 | I774: =G774*6+H774 -> 48 | K774: 8 | L774: 15 | M774: =K774*6+L774 -> 63 | O774: 19 | P774: 19 | Q774: =O774*6+P774 -> 133 | S774: PORT MELBOURNE
A775: PORT MELBOURNE | C775: 3 | D775: 10 | E775: =C775*6+D775 -> 28 | G775: 3 | H775: 10 | I775: =G775*6+H775 -> 28 | K775: 7 | L775: 15 | M775: =K775*6+L775 -> 57 | O775: 8 | P775: 17 | Q775: =O775*6+P775 -> 65 | S775: LESTER
A776: BEST PLAYERS
A777: COBURG | C777: ANDERSON | F777: COLLINS | I777: WALLACE | L777: DIXON | O777: DUNCAN | R777: SHENFIELD
A778: PORT MELBOURNE | C778: BLOOMER | F778: ALDRIDGE | I778: TYSON | L778: MURRAY | O778: FARNAN | R778: ONLEY
A779: GOALKICKERS
A780: COBURG | C780: COLLINS 11 | F780: NASH 2 | I780: KNIGHT 2 | L780: ANDERSON 2 | O780: REVILLE | R780: WHITFIELD
A781: PORT MELBOURNE | C781: ALDRIDGE 3 | F781: TYSON | I781: KEATING | L781: FARNAN | O781: TRACEY | R781: DAVIS
A783: PRAHRAN | C783: 2 | D783: 7 | E783: =C783*6+D783 -> 19 | G783: 11 | H783: 13 | I783: =G783*6+H783 -> 79 | K783: 13 | L783: 15 | M783: =K783*6+L783 -> 93 | O783: 18 | P783: 18 | Q783: =O783*6+P783 -> 126 | S783: BEACH ROAD
A784: SANDRINGHAM | C784: 1 | D784: 3 | E784: =C784*6+D784 -> 9 | G784: 2 | H784: 5 | I784: =G784*6+H784 -> 17 | K784: 6 | L784: 6 | M784: =K784*6+L784 -> 42 | O784: 8 | P784: 13 | Q784: =O784*6+P784 -> 61 | S784: STUART
A785: BEST PLAYERS
A786: PRAHRAN | C786: FLEMING | F786: WILTSHIRE | I786: HAWKINS | M786: BRENCHLEY | P786: HYDE | R786: WHITEHEAD
A787: SANDRINGHAM | C787: THOMS | F787: McCOMB | I787: CARTWRIGHT | M787: T NOSEDA | P787: DAVIS | R787: WOODWARD
A788: GOALKICKERS
A789: PRAHRAN | C789: HAWKINS 10 | F789: THOMPSON 3 | I789: BRENCHLEY 2 | L789: WHITE 2 | N789: WILTSHIRE
A790: SANDRINGHAM | C790: MICHAELSON 3 | F790: McCOMB 2 | I790: MITCHELL | L790: TORPEY | N790: CHRISTIE
A792: ROUND 15 | E792: 25TH JULY | J792: WEATHER | M792: RAIN GROUNDS HEAVY | S792: PLAYED AT
D793: 1ST QTR | H793: 2ND QTR | L793: 3RD QTR | P793: FINAL | S793: BRUNSWICK
A794: NORTHCOTE | C794: 5 | D794: 1 | E794: =C794*6+D794 -> 31 | G794: 11 | H794: 4 | I794: =G794*6+H794 -> 70 | K794: 11 | L794: 8 | M794: =K794*6+L794 -> 74 | O794: 14 | P794: 10 | Q794: =O794*6+P794 -> 94 | S794: UMPIRE | X794: LADDER | AB794: ROUND | AD794: 15
A795: BRUNSWICK | C795: 1 | D795: 3 | E795: =C795*6+D795 -> 9 | G795: 2 | H795: 4 | I795: =G795*6+H795 -> 16 | K795: 5 | L795: 8 | M795: =K795*6+L795 -> 38 | O795: 7 | P795: 10 | Q795: =O795*6+P795 -> 52 | S795: GREGORY
A796: BEST PLAYERS | W796: TEAM | X796: W | Y796: L | Z796: D | AA796: FOR | AB796: AGST | AC796: % | AD796: PTS
A797: NORTHCOTE | C797: R ROSS | E797: HART | H797: BATES | K797: GRAY | N797: O'KEEFE | Q797: LYNGCOLN
A798: BRUNSWICK | C798: FAY | E798: DOWLING | H798: CLARKE | K798: VAUGHAN | N798: BOYD | Q798: McKERNAN | W798: BRUNSWICK | X798: 14 | Y798: 1 | Z798: 0 | AA798: 1759 | AB798: 1091 | AC798: 161.23 | AD798: 56
A799: GOALKICKERS | W799: PRAHRAN | X799: 12 | Y799: 3 | Z799: 0 | AA799: 1550 | AB799: 1139 | AC799: 136.08428446005269 | AD799: 48
A800: NORTHCOTE | C800: BATES 5 | F800: R ROSS 2 | I800: SEYMOUR 2 | L800: SIMMONDS 2 | O800: CORNELL | Q800: O'KEEFE | S800: GRAY | W800: CAMBERWELL | X800: 12 | Y800: 3 | Z800: 0 | AA800: 1631 | AB800: 1297 | AC800: 125.75 | AD800: 48
A801: BRUNSWICK | C801: McINNES 3 | F801: COOPER | I801: LASKY | K801: DOWLING | N801: PALMER | W801: COBURG | X801: 9 | Y801: 6 | Z801: 0 | AA801: 1728 | AB801: 1268 | AC801: 136.27760252365931 | AD801: 36
A803: CAMBERWELL | C803: 7 | D803: 4 | E803: =C803*6+D803 -> 46 | G803: 10 | H803: 8 | I803: =G803*6+H803 -> 68 | K803: 15 | L803: 10 | M803: =K803*6+L803 -> 100 | O803: 18 | P803: 13 | Q803: =O803*6+P803 -> 121 | S803: YARRAVILLE | W803: NORTHCOTE | X803: 9 | Y803: 6 | Z803: 0 | AA803: 1360 | AB803: 1139 | AC803: 119.41 | AD803: 36
A804: YARRAVILLE | C804: 3 | D804: 5 | E804: =C804*6+D804 -> 23 | G804: 5 | H804: 8 | I804: =G804*6+H804 -> 38 | K804: 8 | L804: 12 | M804: =K804*6+L804 -> 60 | O804: 11 | P804: 15 | Q804: =O804*6+P804 -> 81 | S804: LESTER | W804: BRIGHTON | X804: 9 | Y804: 6 | Z804: 0 | AA804: 1311 | AB804: 1297 | AC804: 101.08 | AD804: 36
A805: BEST PLAYERS | W805: PRESTON | X805: 8 | Y805: 7 | Z805: 0 | AA805: 1416 | AB805: 1314 | AC805: 107.76255707762557 | AD805: 32
A806: CAMBERWELL | C806: FINLAYSON | F806: WARE | I806: JONES | L806: WILLIAMS | O806: BRETT | Q806: HENDERSON | W806: WILLIAMSTOWN | X806: 5 | Y806: 10 | Z806: 0 | AA806: 962 | AB806: 1458 | AC806: 65.9 | AD806: 20
A807: YARRAVILLE | C807: WEDGWOOD | F807: McGRATH | I807: J BUCKLEY | L807: TURNER | O807: EVANS | Q807: RYAN | W807: YARRAVILLE | X807: 4 | Y807: 11 | Z807: 0 | AA807: 1309 | AB807: 1474 | AC807: 88.805970149253724 | AD807: 16
A808: GOALKICKERS | P808: WILLIAMS | R808: MEEHAN | W808: OAKLEIGH | X808: 4 | Y808: 11 | Z808: 0 | AA808: 1320 | AB808: 1558 | AC808: 84.72 | AD808: 16
A809: CAMBERWELL | C809: JONES 4 | E809: WARE 3 | G809: T O'HALLORAN 3 | J809: TATHAM 2 | M809: PIERCE 2 | O809: MASON | Q809: A DAVIDSON | W809: SANDRINGHAM | X809: 3 | Y809: 12 | Z809: 0 | AA809: 1202 | AB809: 1891 | AC809: 63.564251718667371 | AD809: 12
A810: YARRAVILLE | C810: J BUCKLEY 4 | F810: TURNER 4 | I810: RAWSON 2 | L810: McGRATH | W810: PORT MELBOURNE | X810: 1 | Y810: 14 | Z810: 0 | AA810: 1046 | AB810: 1671 | AC810: 62.6 | AD810: 4
A812: PRAHRAN | C812: 4 | D812: 5 | E812: =C812*6+D812 -> 29 | G812: 6 | H812: 8 | I812: =G812*6+H812 -> 44 | K812: 10 | L812: 11 | M812: =K812*6+L812 -> 71 | O812: 14 | P812: 13 | Q812: =O812*6+P812 -> 97 | S812: TOORAK PARK
A813: WILLIAMSTOWN | C813: 0 | D813: 3 | E813: =C813*6+D813 -> 3 | G813: 2 | H813: 7 | I813: =G813*6+H813 -> 19 | K813: 5 | L813: 13 | M813: =K813*6+L813 -> 43 | O813: 6 | P813: 14 | Q813: =O813*6+P813 -> 50 | S813: STUART
A814: BEST PLAYERS
A815: PRAHRAN | C815: LOWRY | F815: WHITE | I815: ANDERSON | L815: FLEMING | O815: HYDE | R815: KOOP
A816: WILLIAMSTOWN | C816: PATERSON | F816: JERRAM | I816: BROOKS | L816: MARTIN | O816: HUGGINS | R816: RAEBURN
A817: GOALKICKERS
A818: PRAHRAN | C818: WHITE 4 | F818: ANDERSON 4 | I818: HAWKINS 3 | L818: WILLIAMS | N818: KENNEDY | P818: THOMPSON
A819: WILLIAMSTOWN | C819: LAWLOR 2 | F819: PATERSON 2 | I819: KAUFMAN | L819: HARRIS
A821: OAKLEIGH | C821: 4 | D821: 3 | E821: =C821*6+D821 -> 27 | G821: 5 | H821: 6 | I821: =G821*6+H821 -> 36 | K821: 11 | L821: 8 | M821: =K821*6+L821 -> 74 | O821: 14 | P821: 10 | Q821: =O821*6+P821 -> 94 | S821: ELSTERNWICK PARK
A822: BRIGHTON | C822: 1 | D822: 2 | E822: =C822*6+D822 -> 8 | G822: 3 | H822: 7 | I822: =G822*6+H822 -> 25 | K822: 9 | L822: 9 | M822: =K822*6+L822 -> 63 | O822: 9 | P822: 12 | Q822: =O822*6+P822 -> 66 | S822: GLOVER
A823: BEST PLAYERS
A824: OAKLEIGH | C824: BAKER | E824: CHAPMAN | H824: HARRISON | K824: HEINTZ | N824: CAMPBELL | Q824: WITHERS
A825: BRIGHTON | C825: PENNY | E825: WEBER | H825: BAKER | K825: CONNELL | N825: GOULLET | Q825: STEWART
A826: GOALKICKERS
A827: OAKLEIGH | C827: HEINTZ 7 | F827: HARRISON 2 | I827: ANDERSON 2 | L827: CAMPBELL | N827: CHAPMAN | Q827: CRAMERI
A828: BRIGHTON | C828: CONNELL 5 | F828: PENNY 3 | I828: MILLER
A830: PRESTON | C830: 3 | D830: 7 | E830: =C830*6+D830 -> 25 | G830: 3 | H830: 13 | I830: =G830*6+H830 -> 31 | K830: 8 | L830: 18 | M830: =K830*6+L830 -> 66 | O830: 10 | P830: 24 | Q830: =O830*6+P830 -> 84 | S830: PRESTON
A831: PORT MELBOURNE | C831: 1 | D831: 1 | E831: =C831*6+D831 -> 7 | G831: 2 | H831: 4 | I831: =G831*6+H831 -> 16 | K831: 3 | L831: 6 | M831: =K831*6+L831 -> 24 | O831: 5 | P831: 9 | Q831: =O831*6+P831 -> 39 | S831: LEWIS
A832: BEST PLAYERS
A833: PRESTON | C833: BEAGLEY | F833: MASLEN | I833: HYDE | K833: WARR | N833: MUIR | Q833: DUNSTONE
A834: PORT MELBOURNE | C834: PLUMRIDGE | F834: KEATING | I834: TYSON | K834: ONLEY | N834: MALONEY | Q834: RUSSELL
A835: GOALKICKERS
A836: PRESTON | C836: WARR 3 | E836: MURRAY 2 | H836: BEAGLEY 2 | K836: DUNSTONE 2 | N836: CLACK
A837: PORT MELBOURNE | C837: TYSON 2 | E837: ALDRIDGE | H837: DAVIS | K837: WOODS
A839: COBURG | C839: 8 | D839: 10 | E839: =C839*6+D839 -> 58 | G839: 17 | H839: 19 | I839: =G839*6+H839 -> 121 | K839: 25 | L839: 23 | M839: =K839*6+L839 -> 173 | O839: 29 | P839: 26 | Q839: =O839*6+P839 -> 200 | S839: COBURG
A840: SANDRINGHAM | C840: 0 | D840: 2 | E840: =C840*6+D840 -> 2 | G840: 0 | H840: 2 | I840: =G840*6+H840 -> 2 | K840: 2 | L840: 2 | M840: =K840*6+L840 -> 14 | O840: 3 | P840: 2 | Q840: =O840*6+P840 -> 20 | S840: HASSETT
A841: BEST PLAYERS
A842: COBURG | C842: BELL | F842: HARRIS | I842: WHITFIELD | L842: REVILLE | O842: NASH | R842: COLLINS
A843: SANDRINGHAM | C843: T NOSEDA | F843: TOLSON | I843: THOMS | L843: CARTWRIGHT | O843: WITCHELL | R843: MITCHELL
A844: GOALKICKERS
A845: COBURG | C845: COLLINS 16 | F845: NASH 7 | I845: HENNING 4 | L845: REVILLE | N845: HAMILTON
A846: SANDRINGHAM | C846: MITCHELL 2 | F846: WOODWARD
A848: ROUND 16 | E848: 1ST AUGUST | J848: WEATHER | M848: FINE | S848: PLAYED AT
D849: 1ST QTR | H849: 2ND QTR | L849: 3RD QTR | P849: FINAL | S849: NORTHCOTE
A850: NORTHCOTE | C850: 3 | D850: 3 | E850: =C850*6+D850 -> 21 | G850: 7 | H850: 5 | I850: =G850*6+H850 -> 47 | K850: 10 | L850: 9 | M850: =K850*6+L850 -> 69 | O850: 13 | P850: 11 | Q850: =O850*6+P850 -> 89 | S850: UMPIRE | X850: LADDER | AB850: ROUND | AD850: 16
A851: PRAHRAN | C851: 3 | D851: 5 | E851: =C851*6+D851 -> 23 | G851: 7 | H851: 7 | I851: =G851*6+H851 -> 49 | K851: 10 | L851: 10 | M851: =K851*6+L851 -> 70 | O851: 13 | P851: 11 | Q851: =O851*6+P851 -> 89 | S851: LESTER
A852: BEST PLAYERS | W852: TEAM | X852: W | Y852: L | Z852: D | AA852: FOR | AB852: AGST | AC852: % | AD852: PTS
A853: NORTHCOTE | C853: R ROSS | E853: O'KEEFE | H853: POWELL | K853: LYNGCOLN | N853: HART | Q853: GRAY
A854: PRAHRAN | C854: LOWRY | E854: MURRAY | H854: GRAVELL | K854: JOHNSON | N854: KENNEDY | Q854: HYDE | W854: BRUNSWICK | X854: 15 | Y854: 1 | Z854: 0 | AA854: 1863 | AB854: 1190 | AC854: 156.55 | AD854: 60
A855: GOALKICKERS | W855: PRAHRAN | X855: 12 | Y855: 3 | Z855: 1 | AA855: 1639 | AB855: 1228 | AC855: 133.46905537459284 | AD855: 50
A856: NORTHCOTE | C856: R ROSS 2 | E856: SEYMOUR 2 | H856: SIMMONDS 2 | K856: BATES 2 | M856: DOWNIE 2 | O856: THORNE | Q856: O'KEEFE | S856: WAGNER | W856: CAMBERWELL | X856: 12 | Y856: 4 | Z856: 0 | AA856: 1710 | AB856: 1380 | AC856: 123.91 | AD856: 48
A857: PRAHRAN | C857: HAWKINS 5 | F857: ANDERSON 3 | I857: WHITE | K857: KENNEDY | M857: THOMPSON | P857: GRAVELL | R857: MURRAY | W857: BRIGHTON | X857: 10 | Y857: 6 | Z857: 0 | AA857: 1394 | AB857: 1376 | AC857: 101.31 | AD857: 40
A859: BRIGHTON | C859: 4 | D859: 3 | E859: =C859*6+D859 -> 27 | G859: 5 | H859: 5 | I859: =G859*6+H859 -> 35 | K859: 7 | L859: 7 | M859: =K859*6+L859 -> 49 | O859: 12 | P859: 11 | Q859: =O859*6+P859 -> 83 | S859: CAMBERWELL | W859: NORTHCOTE | X859: 9 | Y859: 6 | Z859: 1 | AA859: 1449 | AB859: 1228 | AC859: 118 | AD859: 38
A860: CAMBERWELL | C860: 3 | D860: 5 | E860: =C860*6+D860 -> 23 | G860: 7 | H860: 9 | I860: =G860*6+H860 -> 51 | K860: 7 | L860: 10 | M860: =K860*6+L860 -> 52 | O860: 11 | P860: 13 | Q860: =O860*6+P860 -> 79 | S860: STUART | W860: COBURG | X860: 9 | Y860: 7 | Z860: 0 | AA860: 1794 | AB860: 1351 | AC860: 132.79052553663954 | AD860: 36
A861: BEST PLAYERS | W861: PRESTON | X861: 9 | Y861: 7 | Z861: 0 | AA861: 1550 | AB861: 1384 | AC861: 111.99421965317919 | AD861: 36
A862: BRIGHTON | C862: CONDON | E862: DEANE | H862: DREW | K862: CONNELL | N862: HINDSON | Q862: EGAN | W862: WILLIAMSTOWN | X862: 6 | Y862: 10 | Z862: 0 | AA862: 1045 | AB862: 1524 | AC862: 68.57 | AD862: 24
A863: CAMBERWELL | C863: WARE | E863: H DAVIDSON | H863: A DAVIDSON | K863: WILLIAMS | N863: O'HALLORAN | Q863: FINLAYSON | W863: YARRAVILLE | X863: 4 | Y863: 12 | Z863: 0 | AA863: 1379 | AB863: 1608 | AC863: 85.758706467661696 | AD863: 16
A864: GOALKICKERS | W864: OAKLEIGH | X864: 4 | Y864: 12 | Z864: 0 | AA864: 1419 | AB864: 1662 | AC864: 85.38 | AD864: 16
A865: BRIGHTON | C865: DREW 5 | E865: NIVEN 2 | G865: PENNY 2 | I865: CONNELL | K865: GOULLET | M865: MILLER | W865: SANDRINGHAM | X865: 3 | Y865: 13 | Z865: 0 | AA865: 1262 | AB865: 1997 | AC865: 63.19479218828242 | AD865: 12
A866: CAMBERWELL | C866: T O'HALLORAN 4 | G866: A DAVIDSON 2 | J866: H DAVIDSON | M866: VANTHOFF | O866: WILSON | Q866: TATHAM | S866: PIERCE | W866: PORT MELBOURNE | X866: 2 | Y866: 14 | Z866: 0 | AA866: 1152 | AB866: 1731 | AC866: 66.55 | AD866: 8
A868: PRESTON | C868: 1 | D868: 6 | E868: =C868*6+D868 -> 12 | G868: 7 | H868: 11 | I868: =G868*6+H868 -> 53 | K868: 12 | L868: 16 | M868: =K868*6+L868 -> 88 | O868: 19 | P868: 20 | Q868: =O868*6+P868 -> 134 | S868: PRESTON
A869: YARRAVILLE | C869: 3 | D869: 3 | E869: =C869*6+D869 -> 21 | G869: 5 | H869: 4 | I869: =G869*6+H869 -> 34 | K869: 10 | L869: 4 | M869: =K869*6+L869 -> 64 | O869: 11 | P869: 4 | Q869: =O869*6+P869 -> 70 | S869: HASSETT
A870: BEST PLAYERS
A871: PRESTON | C871: GALE | F871: WALSH | I871: DUNSTONE | L871: HYDE | O871: HUGO | Q871: FISHER
A872: YARRAVILLE | C872: J BUCKLEY | F872: WEDGWOOD | I872: STREETER | L872: RAWSON | O872: TURNER | Q872: PENNY
A873: GOALKICKERS
A874: PRESTON | C874: FISHER 7 | E874: DUNSTONE 3 | H874: COOPER 2 | J874: WALSH 2 | M874: HYDE | N874: HUGO | P874: BEAGLEY | R874: HARDING | U874: MUIR
A875: YARRAVILLE | C875: J BUCKLEY 6 | F875: PARKES 2 | I875: TURNER | K875: RAWSON | M875: RYAN
A877: WILLIAMSTOWN | C877: 2 | D877: 3 | E877: =C877*6+D877 -> 15 | G877: 5 | H877: 4 | I877: =G877*6+H877 -> 34 | K877: 10 | L877: 8 | M877: =K877*6+L877 -> 68 | O877: 12 | P877: 11 | Q877: =O877*6+P877 -> 83 | S877: WILLIAMSTOWN
A878: COBURG | C878: 2 | D878: 3 | E878: =C878*6+D878 -> 15 | G878: 7 | H878: 6 | I878: =G878*6+H878 -> 48 | K878: 8 | L878: 6 | M878: =K878*6+L878 -> 54 | O878: 10 | P878: 6 | Q878: =O878*6+P878 -> 66 | S878: LESTER
A879: BEST PLAYERS
A880: WILLIAMSTOWN | C880: HUGGINS | F880: JERRAM | I880: BROOKS | L880: KAUFMAN | O880: HARRIS | R880: ROWAN
A881: COBURG | C881: HENNING | F881: BROOM | I881: ANDERSON | L881: COLLINS | O881: SHENFIELD | R881: NASH
A882: GOALKICKERS
A883: WILLIAMSTOWN | C883: LAWLOR 5 | F883: RICHARDSON 3 | J883: PATERSON | M883: ROBERTSON | P883: ROWAN | R883: HARRIS
A884: COBURG | C884: COLLINS 4 | F884: NASH 2 | I884: ATKINSON 2 | M884: HENNING | P884: REVILLE
A886: PORT MELBOURNE | C886: 3 | D886: 3 | E886: =C886*6+D886 -> 21 | G886: 6 | H886: 6 | I886: =G886*6+H886 -> 42 | K886: 12 | L886: 9 | M886: =K886*6+L886 -> 81 | O886: 15 | P886: 16 | Q886: =O886*6+P886 -> 106 | S886: PORT MELBOURNE
A887: SANDRINGHAM | C887: 1 | D887: 0 | E887: =C887*6+D887 -> 6 | G887: 3 | H887: 2 | I887: =G887*6+H887 -> 20 | K887: 7 | L887: 4 | M887: =K887*6+L887 -> 46 | O887: 9 | P887: 6 | Q887: =O887*6+P887 -> 60 | S887: GREGORY
A888: BEST PLAYERS
A889: PORT MELBOURNE | C889: KEATING | F889: EASTMUIR | I889: ALDRIDGE | L889: TYSON | O889: PAYNE | R889: McBETH
A890: SANDRINGHAM | C890: TORPY | F890: MICHAELSON | I890: CARTWRIGHT | L890: THOMS | O890: KEMP | R890: McCOMB
A891: GOALKICKERS
A892: PORT MELBOURNE | C892: TYSON 5 | F892: KEATING 4 | I892: EASTMUIR 3 | L892: ALDRIDGE 2 | O892: WOODS
A893: SANDRINGHAM | C893: McCOMB 3 | F893: CARTWRIGHT 2 | J893: KENNEDY 2 | M893: TORPEY | O893: DAVIS
A895: BRUNSWICK | C895: 5 | D895: 4 | E895: =C895*6+D895 -> 34 | G895: 7 | H895: 10 | I895: =G895*6+H895 -> 52 | K895: 13 | L895: 13 | M895: =K895*6+L895 -> 91 | O895: 15 | P895: 14 | Q895: =O895*6+P895 -> 104 | S895: OAKLEIGH
A896: OAKLEIGH | C896: 4 | D896: 3 | E896: =C896*6+D896 -> 27 | G896: 8 | H896: 4 | I896: =G896*6+H896 -> 52 | K896: 11 | L896: 7 | M896: =K896*6+L896 -> 73 | O896: 15 | P896: 9 | Q896: =O896*6+P896 -> 99 | S896: LEWIS
A897: BEST PLAYERS
A898: BRUNSWICK | C898: DOWLING | F898: McKAY | I898: COOPER | L898: FAY | O898: BOYD | R898: McELROY
A899: OAKLEIGH | C899: WITHERS | F899: HUTCHESON | I899: CHAPMAN | L899: BAKER | O899: WILMOTT | R899: HEINTZ
A900: GOALKICKERS
A901: BRUNSWICK | C901: COOPER 3 | F901: McINNES 3 | I901: GILLON 2 | L901: McELROY 2 | N901: WINTER 2 | Q901: BOYD | S901: KENNEDY | V901: DOWLING
A902: OAKLEIGH | C902: HEINTZ 4 | F902: ANDERSON 3 | I902: HARRISON 2 | L902: REID 2 | N902: CHAPMAN 2 | Q902: KENNEDY | S902: SMITH
A904: ROUND 17 | E904: 8TH AUGUST | J904: WEATHER | M904: FINE MILD NORTH WIND | S904: PLAYED AT
D905: 1ST QTR | H905: 2ND QTR | L905: 3RD QTR | P905: FINAL | S905: BRUNSWICK
A906: BRUNSWICK | C906: 2 | D906: 2 | E906: =C906*6+D906 -> 14 | G906: 5 | H906: 8 | I906: =G906*6+H906 -> 38 | K906: 5 | L906: 13 | M906: =K906*6+L906 -> 43 | O906: 10 | P906: 19 | Q906: =O906*6+P906 -> 79 | S906: UMPIRE | X906: LADDER | AB906: ROUND | AD906: 17
A907: CAMBERWELL | C907: 3 | D907: 3 | E907: =C907*6+D907 -> 21 | G907: 6 | H907: 6 | I907: =G907*6+H907 -> 42 | K907: 10 | L907: 10 | M907: =K907*6+L907 -> 70 | O907: 11 | P907: 10 | Q907: =O907*6+P907 -> 76 | S907: LEWIS
A908: BEST PLAYERS | W908: TEAM | X908: W | Y908: L | Z908: D | AA908: FOR | AB908: AGST | AC908: % | AD908: PTS
A909: BRUNSWICK | C909: DOWLING | F909: LASKY | I909: QUINN | L909: PALMER | O909: COOPER | Q909: CLARKE
A910: CAMBERWELL | C910: LATHAM | F910: JONES | I910: MEEHAN | L910: A DAVIDSON | O910: SELLECK | Q910: WARE | W910: BRUNSWICK | X910: 16 | Y910: 1 | Z910: 0 | AA910: 1942 | AB910: 1266 | AC910: 153.4 | AD910: 64
A911: GOALKICKERS | W911: PRAHRAN | X911: 13 | Y911: 3 | Z911: 1 | AA911: 1801 | AB911: 1283 | AC911: 140.37412314886984 | AD911: 54
A912: BRUNSWICK | C912: GARDINER 3 | F912: COOPER 2 | I912: WINTER 2 | K912: KENNEDY | M912: McINNES | O912: DOWLING | W912: CAMBERWELL | X912: 12 | Y912: 5 | Z912: 0 | AA912: 1786 | AB912: 1459 | AC912: 122.41 | AD912: 48
A913: CAMBERWELL | C913: A DAVIDSON 4 | F913: T O'HALLORAN 2 | J913: TATHAM 2 | M913: MEEHAN | O913: H DAVIDSON | R913: SELLECK | W913: BRIGHTON | X913: 11 | Y913: 6 | Z913: 0 | AA913: 1486 | AB913: 1437 | AC913: 103.41 | AD913: 44
A915: NORTHCOTE | C915: 3 | D915: 10 | E915: =C915*6+D915 -> 28 | G915: 4 | H915: 14 | I915: =G915*6+H915 -> 38 | K915: 13 | L915: 21 | M915: =K915*6+L915 -> 99 | O915: 15 | P915: 22 | Q915: =O915*6+P915 -> 112 | S915: COBURG | W915: NORTHCOTE | X915: 10 | Y915: 6 | Z915: 1 | AA915: 1561 | AB915: 1287 | AC915: 121.29 | AD915: 42
A916: COBURG | C916: 0 | D916: 3 | E916: =C916*6+D916 -> 3 | G916: 2 | H916: 6 | I916: =G916*6+H916 -> 18 | K916: 3 | L916: 6 | M916: =K916*6+L916 -> 24 | O916: 7 | P916: 17 | Q916: =O916*6+P916 -> 59 | S916: GREGORY | W916: COBURG | X916: 9 | Y916: 8 | Z916: 0 | AA916: 1853 | AB916: 1463 | AC916: 126.65755297334245 | AD916: 36
A917: BEST PLAYERS | W917: PRESTON | X917: 9 | Y917: 8 | Z917: 0 | AA917: 1611 | AB917: 1476 | AC917: 109.14634146341463 | AD917: 36
A918: NORTHCOTE | C918: ACKLAND | F918: WILLIAMSON | I918: SEYMOUR | L918: GRAY | O918: R ROSS | Q918: BATES | W918: WILLIAMSTOWN | X918: 6 | Y918: 11 | Z918: 0 | AA918: 1108 | AB918: 1609 | AC918: 68.86 | AD918: 24
A919: COBURG | C919: HENNING | F919: WALLACE | I919: BROOM | L919: DIXON | O919: LEONARD | Q919: SHENFIELD | W919: YARRAVILLE | X919: 5 | Y919: 12 | Z919: 0 | AA919: 1574 | AB919: 1697 | AC919: 92.751915144372418 | AD919: 20
A920: GOALKICKERS | W920: OAKLEIGH | X920: 4 | Y920: 13 | Z920: 0 | AA920: 1474 | AB920: 1824 | AC920: 80.81 | AD920: 16
A921: NORTHCOTE | C921: SEYMOUR 5 | F921: THORNE 3 | I921: R ROSS 2 | K921: GRAY 2 | M921: HONIG | O921: BATES | Q921: DOWNIE | W921: SANDRINGHAM | X921: 4 | Y921: 13 | Z921: 0 | AA921: 1347 | AB921: 2060 | AC921: 65.388349514563103 | AD921: 16
A922: COBURG | C922: NASH 3 | F922: LEONARD | I922: REVILLE | K922: BRAGG | M922: DUNCAN | W922: PORT MELBOURNE | X922: 2 | Y922: 15 | Z922: 0 | AA922: 1241 | AB922: 1926 | AC922: 64.43 | AD922: 8
A924: BRIGHTON | C924: 1 | D924: 3 | E924: =C924*6+D924 -> 9 | G924: 4 | H924: 9 | I924: =G924*6+H924 -> 33 | K924: 6 | L924: 12 | M924: =K924*6+L924 -> 48 | O924: 12 | P924: 20 | Q924: =O924*6+P924 -> 92 | S924: ELSTERNWICK PARK
A925: PRESTON | C925: 2 | D925: 6 | E925: =C925*6+D925 -> 18 | G925: 5 | H925: 8 | I925: =G925*6+H925 -> 38 | K925: 8 | L925: 12 | M925: =K925*6+L925 -> 60 | O925: 8 | P925: 13 | Q925: =O925*6+P925 -> 61 | S925: STUART
A926: BEST PLAYERS
A927: BRIGHTON | C927: DEANE | F927: PENNY | I927: CONDON | L927: WILLIAMSON | O927: DREW | Q927: HALLAHAN
A928: PRESTON | C928: O'CONNOR | F928: DUNSTONE | I928: HYDE | L928: MUIR | O928: BROWN | Q928: GALE
A929: GOALKICKERS
A930: BRIGHTON | C930: NIVEN 4 | F930: DREW 2 | I930: MILLER 2 | K930: RUDD 2 | M930: CONNELL | O930: HONE
A931: PRESTON | C931: FISHER 4 | F931: BROWN 2 | I931: WARR | K931: DUNSTONE
A933: SANDRINGHAM | C933: 5 | D933: 5 | E933: =C933*6+D933 -> 35 | G933: 6 | H933: 6 | I933: =G933*6+H933 -> 42 | K933: 9 | L933: 13 | M933: =K933*6+L933 -> 67 | O933: 12 | P933: 13 | Q933: =O933*6+P933 -> 85 | S933: BEACH ROAD
A934: WILLIAMSTOWN | C934: 1 | D934: 0 | E934: =C934*6+D934 -> 6 | G934: 5 | H934: 6 | I934: =G934*6+H934 -> 36 | K934: 6 | L934: 8 | M934: =K934*6+L934 -> 44 | O934: 8 | P934: 15 | Q934: =O934*6+P934 -> 63 | S934: HASSETT
A935: BEST PLAYERS
A936: SANDRINGHAM | C936: THOMS | F936: KEMP | I936: MITCHELL | L936: TOLSON | O936: WITCHELL | R936: J NOSEDA
A937: WILLIAMSTOWN | C937: HUGGINS | F937: RICHARDSON | I937: DELLER | L937: PATERSON | O937: TAYLOR | R937: HEDLEY
A938: GOALKICKERS
A939: SANDRINGHAM | C939: WOODWARD 2 | F939: CARTWRIGHT 2 | J939: WITCHELL 2 | M939: MITCHELL | O939: TORPEY | Q939: MICHAELSON | T939: McCOMB | W939: TOLSON | X939: POUND
A940: WILLIAMSTOWN | C940: RICHARDSON | F940: PATERSON | I940: HUGGINS | K940: KAUFMAN | M940: HEADLEY | O940: PITT | Q940: WILLETT | T940: ROBERTSON
A942: YARRAVILLE | C942: 11 | D942: 6 | E942: =C942*6+D942 -> 72 | G942: 11 | H942: 6 | I942: =G942*6+H942 -> 72 | K942: 22 | L942: 13 | M942: =K942*6+L942 -> 145 | O942: 30 | P942: 15 | Q942: =O942*6+P942 -> 195 | S942: YARRAVILLE
A943: PORT MELBOURNE | C943: 0 | D943: 0 | E943: =C943*6+D943 -> 0 | G943: 9 | H943: 10 | I943: =G943*6+H943 -> 64 | K943: 9 | L943: 10 | M943: =K943*6+L943 -> 64 | O943: 12 | P943: 17 | Q943: =O943*6+P943 -> 89 | S943: GLOVER
A944: BEST PLAYERS
A945: YARRAVILLE | C945: WEDGWOOD | F945: McGRATH | I945: CAVE | L945: EVANS | O945: PARKS | Q945: KENNY
A946: PORT MELBOURNE | C946: NUGENT | F946: RUSSO | I946: TYSON | L946: PLUMRIDGE | O946: KEATING | Q946: PAYNE
A947: GOALKICKERS
A948: YARRAVILLE | C948: BUCKLEY 9 | F948: McGRATH 6 | I948: PARKES 4 | K948: RAWSON 3 | N948: WEDGWOOD 3 | Q948: TURNER 2 | T948: KENNY 2 | W948: I EVANS
A949: PORT MELBOURNE | C949: NUGENT 4 | F949: KEATING 2 | I949: TYSON | K949: ALDRIDGE | M949: McBETH | O949: EASTMUIR | Q949: RUSSO | S949: RUSSELL
A951: PRAHRAN | C951: 4 | D951: 4 | E951: =C951*6+D951 -> 28 | G951: 11 | H951: 15 | I951: =G951*6+H951 -> 81 | K951: 16 | L951: 19 | M951: =K951*6+L951 -> 115 | O951: 23 | P951: 24 | Q951: =O951*6+P951 -> 162 | S951: TOORAK PARK
A952: OAKLEIGH | C952: 4 | D952: 5 | E952: =C952*6+D952 -> 29 | G952: 5 | H952: 5 | I952: =G952*6+H952 -> 35 | K952: 6 | L952: 6 | M952: =K952*6+L952 -> 42 | O952: 8 | P952: 7 | Q952: =O952*6+P952 -> 55 | S952: LESTER
A953: BEST PLAYERS
A954: PRAHRAN | C954: HAWKINS | F954: SMITH | I954: FLEMING | L954: LOWRY | O954: KOOP | Q954: WILLIAMS
A955: OAKLEIGH | C955: WATSON | F955: KENNEDY | I955: ANDERSON | L955: G RYAN | O955: HEINTZ | Q955: WILMOTT
A956: GOALKICKERS
A957: PRAHRAN | C957: HAWKINS 8 | F957: BRENCHLEY 3 | I957: KENNEDY 3 | L957: WHITE 2 | N957: GRAVELL 2 | Q957: JOHNSTON | T957: ANDERSON | W957: WILLIAMS | X957: MURRAY | Z957: THOMPSON
A958: OAKLEIGH | C958: ANDERSON 3 | F958: HEINTZ 3 | I958: REID | K958: BAKER
A960: ROUND 18 | E960: 15TH AUGUST | J960: WEATHER | M960: CLOUDY BUT FINE N.E. GALE | S960: PLAYED AT
D961: 1ST QTR | H961: 2ND QTR | L961: 3RD QTR | P961: FINAL | S961: CAMBERWELL
A962: PRAHRAN | C962: 6 | D962: 4 | E962: =C962*6+D962 -> 40 | G962: 6 | H962: 4 | I962: =G962*6+H962 -> 40 | K962: 14 | L962: 10 | M962: =K962*6+L962 -> 94 | O962: 14 | P962: 11 | Q962: =O962*6+P962 -> 95 | S962: UMPIRE | X962: LADDER | AB962: ROUND | AD962: 18
A963: CAMBERWELL | C963: 0 | D963: 0 | E963: =C963*6+D963 -> 0 | G963: 4 | H963: 7 | I963: =G963*6+H963 -> 31 | K963: 5 | L963: 7 | M963: =K963*6+L963 -> 37 | O963: 12 | P963: 14 | Q963: =O963*6+P963 -> 86 | S963: FORD
A964: BEST PLAYERS | W964: TEAM | X964: W | Y964: L | Z964: D | AA964: FOR | AB964: AGST | AC964: % | AD964: PTS
A965: PRAHRAN | C965: KOOP | F965: HYDE | I965: HAWKINS | L965: WILLIAMS | O965: MURRAY | Q965: WILTSHIRE
A966: CAMBERWELL | C966: FINLAYSON | F966: TATHAM | I966: O'HALLORAN | L966: SELLECK | O966: BRETT | Q966: BOAG | W966: BRUNSWICK | X966: 16 | Y966: 2 | Z966: 0 | AA966: 2063 | AB966: 1395 | AC966: 147.89 | AD966: 64
A967: GOALKICKERS | W967: PRAHRAN | X967: 14 | Y967: 3 | Z967: 1 | AA967: 1896 | AB967: 1369 | AC967: 138.49525200876553 | AD967: 58
A968: PRAHRAN | C968: ANDERSON 5 | F968: WHITE 2 | H968: HAWKINS 2 | K968: THOMPSON 2 | N968: GRANDISON 2 | Q968: BRENCHLEY | W968: CAMBERWELL | X968: 12 | Y968: 6 | Z968: 0 | AA968: 1872 | AB968: 1554 | AC968: 120.46 | AD968: 48
A969: CAMBERWELL | C969: TATHAM 5 | F969: T O'HALLORAN 4 | J969: WARE | L969: JONES | N969: WALKER | W969: NORTHCOTE | X969: 11 | Y969: 6 | Z969: 1 | AA969: 1639 | AB969: 1339 | AC969: 122.4 | AD969: 46
A971: PRESTON | C971: 0 | D971: 1 | E971: =C971*6+D971 -> 1 | G971: 10 | H971: 10 | I971: =G971*6+H971 -> 70 | K971: 10 | L971: 11 | M971: =K971*6+L971 -> 71 | O971: 18 | P971: 21 | Q971: =O971*6+P971 -> 129 | S971: PRESTON | W971: BRIGHTON | X971: 11 | Y971: 7 | Z971: 0 | AA971: 1545 | AB971: 1501 | AC971: 102.93 | AD971: 44
A972: BRUNSWICK | C972: 8 | D972: 3 | E972: =C972*6+D972 -> 51 | G972: 8 | H972: 3 | I972: =G972*6+H972 -> 51 | K972: 17 | L972: 19 | M972: =K972*6+L972 -> 121 | O972: 17 | P972: 19 | Q972: =O972*6+P972 -> 121 | S972: LESTER | W972: PRESTON | X972: 10 | Y972: 8 | Z972: 0 | AA972: 1740 | AB972: 1597 | AC972: 108.9542892924233 | AD972: 40
A973: BEST PLAYERS | W973: COBURG | X973: 9 | Y973: 9 | Z973: 0 | AA973: 1920 | AB973: 1562 | AC973: 122.91933418693982 | AD973: 36
A974: PRESTON | C974: MASLEN | F974: HYDE | I974: MUIR | L974: UNDERHILL | O974: HARDING | Q974: PAYNE | W974: WILLIAMSTOWN | X974: 7 | Y974: 11 | Z974: 0 | AA974: 1185 | AB974: 1632 | AC974: 72.61 | AD974: 28
A975: BRUNSWICK | C975: CLARKE | F975: DOWLING | I975: McINNES | L975: FAY | O975: McELROY | Q975: GILLON | W975: YARRAVILLE | X975: 6 | Y975: 12 | Z975: 0 | AA975: 1638 | AB975: 1756 | AC975: 93.280182232346235 | AD975: 24
A976: GOALKICKERS | Q976: UNDERHILL | W976: OAKLEIGH | X976: 5 | Y976: 13 | Z976: 0 | AA976: 1573 | AB976: 1891 | AC976: 83.18 | AD976: 20
A977: PRESTON | C977: HYDE 6 | E977: WALSH 3 | G977: QUINLAN 3 | J977: HARDING 2 | M977: HUGHSON | O977: COOPER | Q977: WHITECHURCH | W977: SANDRINGHAM | X977: 4 | Y977: 14 | Z977: 0 | AA977: 1399 | AB977: 2138 | AC977: 65.434985968194567 | AD977: 16
A978: BRUNSWICK | C978: McINNES 6 | F978: COOPER 2 | I978: BOYD 2 | K978: CLARKE 2 | M978: DOWLING | O978: THOMPSON | R978: WINTER | W978: PORT MELBOURNE | X978: 2 | Y978: 16 | Z978: 0 | AA978: 1264 | AB978: 2003 | AC978: 63.11 | AD978: 8
Q979: GARDINER | T979: DAVIS
A980: YARRAVILLE | C980: 1 | D980: 2 | E980: =C980*6+D980 -> 8 | G980: 4 | H980: 12 | I980: =G980*6+H980 -> 36 | K980: 4 | L980: 12 | M980: =K980*6+L980 -> 36 | O980: 7 | P980: 22 | Q980: =O980*6+P980 -> 64 | S980: YARRAVILLE
A981: BRIGHTON | C981: 4 | D981: 9 | E981: =C981*6+D981 -> 33 | G981: 4 | H981: 9 | I981: =G981*6+H981 -> 33 | K981: 7 | L981: 16 | M981: =K981*6+L981 -> 58 | O981: 7 | P981: 17 | Q981: =O981*6+P981 -> 59 | S981: GREGORY
A982: BEST PLAYERS
A983: YARRAVILLE | C983: RYAN | E983: McGRATH | I983: PETERS | L983: WEDGWOOD | O983: EVANS | Q983: STREETER
A984: BRIGHTON | C984: PENNY | E984: BAKER | I984: EGAN | L984: HALLAHAN | O984: DREW | Q984: STEWART
A985: GOALKICKERS
A986: YARRAVILLE | C986: RAWSON 2 | F986: RYAN 2 | I986: HALL 2 | K986: I EVANS
A987: BRIGHTON | C987: DREW 2 | F987: CONNELL 2 | I987: NIVEN | K987: GOULLET | M987: MILLER
A989: NORTHCOTE | C989: 1 | D989: 3 | E989: =C989*6+D989 -> 9 | G989: 4 | H989: 5 | I989: =G989*6+H989 -> 29 | K989: 10 | L989: 7 | M989: =K989*6+L989 -> 67 | O989: 11 | P989: 12 | Q989: =O989*6+P989 -> 78 | S989: NORTHCOTE
A990: SANDRINGHAM | C990: 1 | D990: 2 | E990: =C990*6+D990 -> 8 | G990: 2 | H990: 4 | I990: =G990*6+H990 -> 16 | K990: 3 | L990: 6 | M990: =K990*6+L990 -> 24 | O990: 7 | P990: 10 | Q990: =O990*6+P990 -> 52 | S990: HASSETT
A991: BEST PLAYERS
A992: NORTHCOTE | C992: WILLIAMSON | F992: LYNGCOLN | I992: BATES | L992: SIMMONDS | O992: WOODS | R992: POWELL
A993: SANDRINGHAM | C993: MITCHELL | F993: J NOSEDA | I993: T NOSEDA | L993: CARTWRIGHT | O993: TOLSON | R993: KEMP
A994: GOALKICKERS
A995: NORTHCOTE | C995: SEYMOUR 4 | F995: SIMMONDS 2 | I995: LYNGCOLN 2 | L995: HONIG | N995: DOWNIE | P995: WAGNER
A996: SANDRINGHAM | C996: WOODWARD 2 | F996: POUND 2 | I996: WITCHELL | L996: TOLSON | N996: LOVE
A998: OAKLEIGH | C998: 5 | D998: 1 | E998: =C998*6+D998 -> 31 | G998: 8 | H998: 6 | I998: =G998*6+H998 -> 54 | K998: 10 | L998: 10 | M998: =K998*6+L998 -> 70 | O998: 14 | P998: 15 | Q998: =O998*6+P998 -> 99 | S998: OAKLEIGH
A999: COBURG | C999: 5 | D999: 2 | E999: =C999*6+D999 -> 32 | G999: 6 | H999: 6 | I999: =G999*6+H999 -> 42 | K999: 9 | L999: 12 | M999: =K999*6+L999 -> 66 | O999: 9 | P999: 13 | Q999: =O999*6+P999 -> 67 | S999: LEWIS
A1000: BEST PLAYERS
A1001: OAKLEIGH | C1001: CRAMERI | F1001: HARRISON | I1001: ANDERSON | L1001: HEINTZ | O1001: REID | Q1001: WILLIAMS
A1002: COBURG | C1002: HENNING | F1002: REVILLE | I1002: SHENFIELD | L1002: COLLINS | O1002: NASH | Q1002: THURGOOD
A1003: GOALKICKERS
A1004: OAKLEIGH | C1004: HEINTZ 5 | F1004: HARRISON 3 | I1004: REID 2 | K1004: CAMPBELL | M1004: ANDERSON | P1004: KENNEDY | R1004: CRAMERI
A1005: COBURG | C1005: COLLINS 4 | F1005: NASH 3 | I1005: HENNING | K1005: THURGOOD
A1007: WILLIAMSTOWN | C1007: 0 | D1007: 2 | E1007: =C1007*6+D1007 -> 2 | G1007: 6 | H1007: 5 | I1007: =G1007*6+H1007 -> 41 | K1007: 6 | L1007: 6 | M1007: =K1007*6+L1007 -> 42 | O1007: 11 | P1007: 11 | Q1007: =O1007*6+P1007 -> 77 | S1007: PORT MELBOURNE
A1008: PORT MELBOURNE | C1008: 0 | D1008: 6 | E1008: =C1008*6+D1008 -> 6 | G1008: 0 | H1008: 7 | I1008: =G1008*6+H1008 -> 7 | K1008: 1 | L1008: 10 | M1008: =K1008*6+L1008 -> 16 | O1008: 2 | P1008: 11 | Q1008: =O1008*6+P1008 -> 23 | S1008: STUART
A1009: BEST PLAYERS
A1010: WILLIAMSTOWN | C1010: HUGGINS | F1010: JERRAM | I1010: BROOKS | L1010: KAUFMAN | O1010: LAWLOR | R1010: PATERSON
A1011: PORT MELBOURNE | C1011: TYSON | F1011: RUSSO | I1011: BLOOMER | L1011: KEATING | O1011: EASTMUIR | R1011: FARNAN
A1012: GOALKICKERS
A1013: WILLIAMSTOWN | C1013: LAWLOR 7 | F1013: GREEN 2 | I1013: PATERSON | L1013: HARRIS
A1014: PORT MELBOURNE | C1014: KEATING | F1014: FARNAN
A1016: FINALS
A1017: 1ST SEMI | E1017: 22ND AUGUST | J1017: WEATHER | M1017: COLD SHOWERS WEST WIND
D1018: 1ST QTR | H1018: 2ND QTR | L1018: 3RD QTR | P1018: FINAL
A1019: NORTHCOTE | C1019: 7 | D1019: 6 | E1019: =C1019*6+D1019 -> 48 | G1019: 10 | H1019: 6 | I1019: =G1019*6+H1019 -> 66 | K1019: 13 | L1019: 10 | M1019: =K1019*6+L1019 -> 88 | O1019: 18 | P1019: 15 | Q1019: =O1019*6+P1019 -> 123 | S1019: TOORAK PARK
A1020: CAMBERWELL | C1020: 1 | D1020: 3 | E1020: =C1020*6+D1020 -> 9 | G1020: 4 | H1020: 7 | I1020: =G1020*6+H1020 -> 31 | K1020: 6 | L1020: 13 | M1020: =K1020*6+L1020 -> 49 | O1020: 8 | P1020: 16 | Q1020: =O1020*6+P1020 -> 64 | S1020: GREGORY
A1021: BEST PLAYERS
A1022: NORTHCOTE | C1022: GRAY | F1022: HART | I1022: SMITH | L1022: R ROSS | O1022: BATES | R1022: POWELL
A1023: CAMBERWELL | C1023: A DAVIDSON | F1023: WALKER | I1023: FINLAYSON | L1023: PIERCE | O1023: H JONES
A1024: GOALKICKERS
A1025: NORTHCOTE | C1025: BATES 5 | F1025: GRAY 4 | H1025: R ROSS 3 | J1025: SEYMOUR 2 | M1025: DOWNIE 2 | P1025: HONIG | R1025: SMITH
A1026: CAMBERWELL | C1026: A DAVIDSON 2 | F1026: T O'HALLORAN 2 | J1026: MEEHAN 2 | M1026: MASON | O1026: WILLIAMS
A1028: 2ND SEMI | E1028: 29TH AUGUST | J1028: WEATHER | M1028: FINE SOUTH BREEZE
A1029: PRAHRAN | C1029: 3 | D1029: 4 | E1029: =C1029*6+D1029 -> 22 | G1029: 7 | H1029: 10 | I1029: =G1029*6+H1029 -> 52 | K1029: 9 | L1029: 12 | M1029: =K1029*6+L1029 -> 66 | O1029: 15 | P1029: 18 | Q1029: =O1029*6+P1029 -> 108 | S1029: TOORAK PARK
A1030: BRUNSWICK | C1030: 3 | D1030: 6 | E1030: =C1030*6+D1030 -> 24 | G1030: 6 | H1030: 7 | I1030: =G1030*6+H1030 -> 43 | K1030: 12 | L1030: 13 | M1030: =K1030*6+L1030 -> 85 | O1030: 14 | P1030: 14 | Q1030: =O1030*6+P1030 -> 98 | S1030: GREGORY
A1031: BEST PLAYERS
A1032: PRAHRAN | C1032: HAWKINS | F1032: LOWRY | I1032: THOMPSON | L1032: WHITE | O1032: MURRAY | R1032: WHITEHEAD
A1033: BRUNSWICK | C1033: McELROY | F1033: DOWLING | I1033: McINNES | L1033: CLARKE | O1033: FAY | R1033: BOSCHENM
A1034: GOALKICKERS
A1035: PRAHRAN | C1035: HAWKINS 7 | F1035: WHITE 2 | I1035: THOMPSON 2 | L1035: BRENCHLEY | O1035: LOWRY | Q1035: GRAVELL | T1035: FLEMING
A1036: BRUNSWICK | C1036: McINNES 3 | F1036: McELROY 3 | I1036: COOPER 2 | K1036: LASKY 2 | M1036: DOWLING 2 | P1036: BOYD | R1036: DONNELLY
A1038: PRELIMINARY FINAL | F1038: 5TH SEPTEMBER | K1038: WEATHER | N1038: FINE MILD
A1039: NORTHCOTE | C1039: 6 | D1039: 2 | E1039: =C1039*6+D1039 -> 38 | G1039: 9 | H1039: 5 | I1039: =G1039*6+H1039 -> 59 | K1039: 10 | L1039: 8 | M1039: =K1039*6+L1039 -> 68 | O1039: 14 | P1039: 10 | Q1039: =O1039*6+P1039 -> 94 | S1039: BRUNSWICK
A1040: BRUNSWICK | C1040: 1 | D1040: 4 | E1040: =C1040*6+D1040 -> 10 | G1040: 4 | H1040: 7 | I1040: =G1040*6+H1040 -> 31 | K1040: 8 | L1040: 10 | M1040: =K1040*6+L1040 -> 58 | O1040: 9 | P1040: 13 | Q1040: =O1040*6+P1040 -> 67 | S1040: LEWIS
A1041: BEST PLAYERS
A1042: NORTHCOTE | C1042: SMITH | F1042: BATES | I1042: R ROSS | L1042: POWELL | O1042: GARRETT | R1042: GRAY
A1043: BRUNSWICK | C1043: BOSCHEN | F1043: CLARKE | I1043: McELROY | L1043: DOWLING | O1043: COOPER | R1043: BOYD
A1044: GOALKICKERS
A1045: NORTHCOTE | C1045: BATES 5 | F1045: O'KEEFE 3 | I1045: SEYMOUR 2 | L1045: HONIG 2 | N1045: GRAY 2
A1046: BRUNSWICK | C1046: GILLON 3 | F1046: COOPER 2 | I1046: KENNEDY | K1046: BOSCHEN | M1046: DOWLING
A1048: GRAND FINAL | E1048: 12TH SEPTEMBER | J1048: WEATHER | M1048: FINE WEST BREEZE
A1049: NORTHCOTE | C1049: 7 | D1049: 2 | E1049: =C1049*6+D1049 -> 44 | G1049: 7 | H1049: 4 | I1049: =G1049*6+H1049 -> 46 | K1049: 13 | L1049: 6 | M1049: =K1049*6+L1049 -> 84 | O1049: 19 | P1049: 6 | Q1049: =O1049*6+P1049 -> 120 | S1049: TOORAK PARK
A1050: PRAHRAN | C1050: 1 | D1050: 3 | E1050: =C1050*6+D1050 -> 9 | G1050: 8 | H1050: 8 | I1050: =G1050*6+H1050 -> 56 | K1050: 11 | L1050: 10 | M1050: =K1050*6+L1050 -> 76 | O1050: 15 | P1050: 15 | Q1050: =O1050*6+P1050 -> 105 | S1050: GREGORY
A1051: BEST PLAYERS
A1052: NORTHCOTE | C1052: R ROSS | F1052: SEYMOUR | I1052: GRAY | L1052: GARRETT | O1052: BATES | R1052: O'KEEFE
A1053: PRAHRAN | C1053: WHITE | F1053: HYDE | I1053: LOWRY | L1053: HAWKINS | O1053: WILLIAMS | R1053: JOHNSON
A1054: GOALKICKERS
A1055: NORTHCOTE | C1055: R ROSS 5 | F1055: SEYMOUR 4 | I1055: BATES 3 | K1055: GRAY 3 | M1055: DOWNIE 2 | O1055: O'KEEFE | Q1055: HART
A1056: PRAHRAN | C1056: HAWKINS 4 | F1056: WHITE 4 | I1056: GRAVELL 3 | L1056: HYDE 2 | N1056: THOMPSON 2
A1058: TEAMS
G1059: NORTHCOTE | R1059: PRAHRAN
A1060: BACKS | C1060: LYNGCOLN | G1060: HOLDEN | K1060: ACKLAND | O1060: WESCOTT | R1060: KOOP | W1060: J WILTSHIRE
A1061: H-BACKS | C1061: LUDLOW | G1061: WILLIAMSON | K1061: WOODS | O1061: GRANDISON | R1061: HYDE | W1061: WHITECHURCH
A1062: CENTRES | C1062: GARRETT | G1062: HART | K1062: WEGNER | O1062: MURRAY | R1062: LOWRY | W1062: F SMITH
A1063: H-FORWARDS | C1063: O'SHEA | G1063: SMITH | K1063: DOWNIE | O1063: ANDERSON | R1063: N WILLIAMS | W1063: BRENCHLEY
A1064: FORWARDS | C1064: SEYMOUR | G1064: BATES | K1064: GRAY | O1064: JOHNSON | R1064: HAWKINS | W1064: GRAVELL
A1065: RUCKS | C1065: O'KEEFE | G1065: HONIG | K1065: ROSS | O1065: FLEMING | R1065: THOMPSON | W1065: WHITE
A1066: RES | C1066: CORNELL | O1066: KENNEDY
A1068: OTHER MATCHES | E1068: 29TH JUNE | J1068: WEATHER | M1068: RAIN A.M. GROUND WET
A1069: V.F.L. | C1069: 6 | D1069: 5 | E1069: =C1069*6+D1069 -> 41 | G1069: 6 | H1069: 7 | I1069: =G1069*6+H1069 -> 43 | K1069: 12 | L1069: 15 | M1069: =K1069*6+L1069 -> 87 | O1069: 16 | P1069: 21 | Q1069: =O1069*6+P1069 -> 117 | S1069: MCG
A1070: V.F.A. | C1070: 6 | D1070: 3 | E1070: =C1070*6+D1070 -> 39 | G1070: 7 | H1070: 6 | I1070: =G1070*6+H1070 -> 48 | K1070: 7 | L1070: 7 | M1070: =K1070*6+L1070 -> 49 | O1070: 10 | P1070: 10 | Q1070: =O1070*6+P1070 -> 70 | S1070: GLOVER | U1070: BLACKBURN
A1071: BEST PLAYERS
A1072: V.F.L. | C1072: FORBES | F1072: MATTHEWS | I1072: COLLIER | K1072: BEAMES | M1072: LA FONTAINE | P1072: HALE
A1073: V.F.A. | C1073: N WILLIAMS | F1073: FAY | I1073: BRETT | K1073: BATES | M1073: McELROY | P1073: RAWSON
A1074: GOALKICKERS
A1075: V.F.L. | C1075: MOHR 5 | F1075: COLLIER 3 | I1075: SHEA 2 | K1075: FORBES 2 | M1075: MOORE | O1075: WARE | Q1075: BENTLEY | T1075: HARDIMAN
A1076: V.F.A. | C1076: COLLINS 3 | F1076: McGRATH 2 | I1076: RAWSON 2 | L1076: McELROY | N1076: WARR | P1076: N WILLIAMS
A1078: TEAMS
G1079: V.F.A. | T1079: V.F.L.
A1080: BACKS | C1080: BOYD (B'WICK) | G1080: FAY (B'WICK) | L1080: ACKLAND (N'COTE) | Q1080: DYER | V1080: REGAN | X1080: GAUDION
A1081: H-BACKS | C1081: BATES (N'COTE) | G1081: HYDE (P'HAN ) | L1081: BRETT (C'WELL) | Q1081: LLOYD | V1081: HICKEY | X1081: HALE
A1082: CENTRES | C1082: JULIER (P.M.) | G1082: R WILLIAMS (C'WELL) | L1082: MURRAY (P'HAN) | Q1082: MATTHEWS | V1082: LA FONTAINE | X1082: RANDALL
A1083: H-FORWARDS | C1083: RAWSON (Y'VILLE) | G1083: WILLIAMSON (N'COTE) | L1083: McELROY (B'WICK) | Q1083: BENTLEY | V1083: MOHR | X1083: FORBES
A1084: FORWARDS | C1084: JONES (C'WELL) | G1084: COLLINS (COB) | L1084: WARR (P'TON) | Q1084: SHEA | V1084: MOORE | X1084: REYNOLDS
A1085: RUCKS | C1085: GOULLET (B'TON) | G1085: N WILLIAMS (P'HAN ) | L1085: McGRATH (Y'VILLE) | Q1085: A COLLIER | V1085: WARE | X1085: BEAMES
A1086: RES | C1086: McBETH (P.M.) | Q1086: HARDIMAN
E1088: 24TH SEPTEMBER (NIGHT GAME) | L1088: WEATHER | O1088: COLD CLOUDY LIGHT SHOWERS S.W. WIND
A1089: V.F.L. | E1089: =C1089*6+D1089 -> 0 | G1089: 6 | H1089: 4 | I1089: =G1089*6+H1089 -> 40 | M1089: =K1089*6+L1089 -> 0 | O1089: 14 | P1089: 15 | Q1089: =O1089*6+P1089 -> 99 | S1089: OLYMPIC PARK
A1090: V.F.A. | E1090: =C1090*6+D1090 -> 0 | G1090: 7 | H1090: 7 | I1090: =G1090*6+H1090 -> 49 | M1090: =K1090*6+L1090 -> 0 | O1090: 10 | P1090: 10 | Q1090: =O1090*6+P1090 -> 70 | S1090: BLACKBURN | V1090: LESTER
A1091: BEST PLAYERS
A1092: V.F.L. | C1092: BUNTON | F1092: BENTLEY | I1092: MORRISON | L1092: RYAN | N1092: MOHR | Q1092: REYNOLDS
A1093: V.F.A. | C1093: HUGGINS | F1093: BATES | I1093: COLLINS | L1093: WHITE | N1093: CLARKE
A1094: GOALKICKERS
A1095: V.F.L. | C1095: MOHR 4 | F1095: TITUS 4 | I1095: BENTLEY 3 | L1095: WEBSTER | N1095: MILLS | P1095: BUNTON
A1096: V.F.A. | C1096: COLLINS 4 | F1096: RAWSON 2 | I1096: WHITE 2 | L1096: O'KEEFE | N1096: ACKLAND
A1098: TEAMS
H1099: V.F.A. | U1099: V.F.L.
A1100: BACKS | C1100: J WILTSHIRE (P'HAN) | H1100: A HYDE (P'TON) | M1100: ACKLAND (N'COTE) | R1100: CURCIO | V1100: LLOYD | X1100: GAUDION
A1101: H-BACKS | C1101: J WHITEHEAD (P'HAN) | H1101: WILLIAMSON (N'COTE) | M1101: FLEMING (P'HAN) | R1101: LONSDALE | V1101: D RYAN | X1101: DAVIS
A1102: CENTRES | C1102: CLARKE (B'WICK) | H1102: LOWRY (P'HAN) | M1102: McBETH (P.M) | R1102: J RYAN | V1102: J CORDNER | X1102: REYNOLDS
A1103: H-FORWARDS | C1103: TURNER | H1103: BATES (N'COTE) | M1103: O'KEEFE | R1103: TITUS | V1103: MORRISON | X1103: BUNTON
A1104: FORWARDS | C1104: HAWKINS (P'HAN) | H1104: COLLINS (COB) | M1104: GRAY (N'COTE) | R1104: WEBSTER | V1104: MOHR | X1104: MARTIN
A1105: RUCKS | C1105: WILLIAMS (P'HAN) | H1105: HUGGINS | M1105: WHITE (P'HAN ) | R1105: BENTLEY | V1105: MILLS | X1105: FORBES
A1106: RES | C1106: MURRAY | R1106: SPINKS | V1106: ELLIS | X1106: HALLAHAN