A1: Victorian Football Association
A2: Season 1937
A3: © Copyright Wal Williams | F3: First created: 2 November 2014
A4: Contact: joywalwi at gmail dot com | F4: Last updated: 27 January 2018 | W4: VFA Results and tables - Link to the main index page
A5: You are free to copy this document in whole or part provided that proper acknowledgement is given to the author. All rights reserved.
A7: YEAR 1937
A8: ROUND 1 | E8: 17TH APRIL | J8: WEATHER | M8: FINE | S8: PLAYED AT
D9: 1ST QTR | H9: 2ND QTR | L9: 3RD QTR | P9: FINAL | S9: TOORAK PARK
A10: PRAHRAN | C10: 3 | D10: 8 | E10: =C10*6+D10 -> 26 | G10: 8 | H10: 17 | I10: =G10*6+H10 -> 65 | K10: 11 | L10: 22 | M10: =K10*6+L10 -> 88 | O10: 17 | P10: 31 | Q10: =O10*6+P10 -> 133 | S10: UMPIRE | X10: LADDER | AB10: ROUND | AD10: 1
A11: PORT MELBOURNE | C11: 3 | D11: 4 | E11: =C11*6+D11 -> 22 | G11: 3 | H11: 7 | I11: =G11*6+H11 -> 25 | K11: 8 | L11: 9 | M11: =K11*6+L11 -> 57 | O11: 10 | P11: 13 | Q11: =O11*6+P11 -> 73 | S11: GLOVER
A12: BEST PLAYERS | W12: TEAM | X12: W | Y12: L | Z12: D | AA12: FOR | AB12: AGST | AC12: % | AD12: PTS
A13: PRAHRAN | C13: LOWRY | F13: WHITE | I13: JOHNSON | L13: SHAW | N13: WILKINSON | Q13: MURRAY
A14: PORT MELBOURNE | C14: EASTMUIR | F14: BISSETT | I14: JULIER | L14: RUSDEN | N14: DOBSON | Q14: PAYNE | W14: PRAHRAN | X14: 1 | Y14: 0 | Z14: 0 | AA14: 133 | AB14: 73 | AC14: 182.1917808219178 | AD14: 4
A15: GOALKICKERS | P15: BRENCHLEY | W15: BRIGHTON | X15: 1 | Y15: 0 | Z15: 0 | AA15: 134 | AB15: 74 | AC15: 181.08108108108109 | AD15: 4
A16: PRAHRAN | C16: HAWKINS 6 | F16: WHITE 4 | H16: WILKINSON 2 | K16: GRAVELL | M16: WILTSHIRE | O16: WILLIAMS | Q16: THOMPSON | W16: BRUNSWICK | X16: 1 | Y16: 0 | Z16: 0 | AA16: 158 | AB16: 97 | AC16: 162.88659793814432 | AD16: 4
A17: PORT MELBOURNE | C17: RUSDEN 4 | F17: DOBSON 3 | I17: HUTTON | K17: FULTON | M17: EASTMUIR | W17: YARRAVILLE | X17: 1 | Y17: 0 | Z17: 0 | AA17: 73 | AB17: 48 | AC17: 152.08333333333334 | AD17: 4
A19: YARRAVILLE | C19: 1 | D19: 5 | E19: =C19*6+D19 -> 11 | G19: 3 | H19: 13 | I19: =G19*6+H19 -> 31 | K19: 5 | L19: 15 | M19: =K19*6+L19 -> 45 | O19: 9 | P19: 19 | Q19: =O19*6+P19 -> 73 | S19: WILLIAMSTOWN | W19: OAKLEIGH | X19: 1 | Y19: 0 | Z19: 0 | AA19: 98 | AB19: 65 | AC19: 150.76923076923077 | AD19: 4
A20: WILLIAMSTOWN | C20: 1 | D20: 4 | E20: =C20*6+D20 -> 10 | G20: 3 | H20: 5 | I20: =G20*6+H20 -> 23 | K20: 5 | L20: 6 | M20: =K20*6+L20 -> 36 | O20: 7 | P20: 6 | Q20: =O20*6+P20 -> 48 | S20: CLAYTON | W20: NORTHCOTE | X20: 1 | Y20: 0 | Z20: 0 | AA20: 72 | AB20: 63 | AC20: 114.28571428571429 | AD20: 4
A21: BEST PLAYERS | W21: PRESTON | X21: 0 | Y21: 1 | Z21: 0 | AA21: 63 | AB21: 72 | AC21: 87.5 | AD21: 0
A22: YARRAVILLE | C22: WEDGWOOD | F22: McGRATH | I22: JAMES | L22: TURNER | N22: RYAN | Q22: ELLIS | W22: CAMBERWELL | X22: 0 | Y22: 1 | Z22: 0 | AA22: 65 | AB22: 98 | AC22: 66.326530612244895 | AD22: 0
A23: WILLIAMSTOWN | C23: ROBERTSON | F23: HUGGINS | I23: JERRAM | L23: BROOKS | N23: RICHARDSON | Q23: PATERSON | W23: WILLIAMSTOWN | X23: 0 | Y23: 1 | Z23: 0 | AA23: 48 | AB23: 73 | AC23: 65.753424657534254 | AD23: 0
A24: GOALKICKERS | W24: COBURG | X24: 0 | Y24: 1 | Z24: 0 | AA24: 97 | AB24: 158 | AC24: 61.392405063291136 | AD24: 0
A25: YARRAVILLE | C25: McGRATH 4 | F25: RAWSON 2 | I25: TORRENS | L25: WEDGWOOD | O25: PARKS | W25: SANDRINGHAM | X25: 0 | Y25: 1 | Z25: 0 | AA25: 74 | AB25: 134 | AC25: 55.223880597014926 | AD25: 0
A26: WILLIAMSTOWN | C26: ROBERTSON 4 | F26: LAWLER | I26: HUGGINS | L26: EARLE | W26: PORT MELBOURNE | X26: 0 | Y26: 1 | Z26: 0 | AA26: 73 | AB26: 133 | AC26: 54.887218045112782 | AD26: 0
A28: NORTHCOTE | C28: 3 | D28: 3 | E28: =C28*6+D28 -> 21 | G28: 5 | H28: 9 | I28: =G28*6+H28 -> 39 | K28: 6 | L28: 10 | M28: =K28*6+L28 -> 46 | O28: 10 | P28: 12 | Q28: =O28*6+P28 -> 72 | S28: NORTHCOTE
A29: PRESTON | C29: 2 | D29: 3 | E29: =C29*6+D29 -> 15 | G29: 4 | H29: 7 | I29: =G29*6+H29 -> 31 | K29: 7 | L29: 13 | M29: =K29*6+L29 -> 55 | O29: 8 | P29: 15 | Q29: =O29*6+P29 -> 63 | S29: GREGORY
A30: BEST PLAYERS
A31: NORTHCOTE | C31: HART | E31: WEGNER | H31: C ROSS | K31: LYNGCOLN | N31: SMITH | Q31: O'KEEFE
A32: PRESTON | C32: MUIR | E32: HARDING | H32: DUNSTONE | K32: HYDE | N32: MURRAY | Q32: WILKINS
A33: GOALKICKERS
A34: NORTHCOTE | C34: SMITH 4 | F34: McINERNEY | I34: HONIG | K34: O'KEEFE | N34: DOWNIE | P34: CORNELL | R34: MEITZCKE
A35: PRESTON | C35: WILKINS 2 | F35: FISHER | I35: WALKER | K35: HUGHSON | N35: WALSH | P35: MURRAY | R35: HARDING
A37: BRUNSWICK | C37: 13 | D37: 2 | E37: =C37*6+D37 -> 80 | G37: 16 | H37: 5 | I37: =G37*6+H37 -> 101 | K37: 24 | L37: 6 | M37: =K37*6+L37 -> 150 | O37: 25 | P37: 8 | Q37: =O37*6+P37 -> 158 | S37: COBURG
A38: COBURG | C38: 0 | D38: 1 | E38: =C38*6+D38 -> 1 | G38: 4 | H38: 8 | I38: =G38*6+H38 -> 32 | K38: 7 | L38: 11 | M38: =K38*6+L38 -> 53 | O38: 13 | P38: 19 | Q38: =O38*6+P38 -> 97 | S38: STUART
A39: BEST PLAYERS
A40: BRUNSWICK | C40: McINNES | F40: DOWLING | I40: COOPER | L40: McELROY | O40: FAY | R40: CLARKE
A41: COBURG | C41: REVILLE | F41: DIXON | I41: NASH | L41: HENNING | O41: HENDERSON | R41: WHITFIELD
A42: GOALKICKERS
A43: BRUNSWICK | C43: CLARKE 5 | F43: McINNES 5 | I43: COOPER 4 | K43: BOYD 2 | M43: McELROY 2 | P43: DONNELLY 2 | S43: DOWLING 2 | W43: TOONE 2 | X43: KENNEDY
A44: COBURG | C44: NASH 3 | E44: DIXON 2 | G44: LEAHY 2 | I44: HENNING | K44: SHENFIELD | M44: REVILLE | O44: LEONARD | Q44: HAMILTON | T44: ELLAWAY
A46: OAKLEIGH | C46: 1 | D46: 6 | E46: =C46*6+D46 -> 12 | G46: 3 | H46: 9 | I46: =G46*6+H46 -> 27 | K46: 7 | L46: 12 | M46: =K46*6+L46 -> 54 | O46: 14 | P46: 14 | Q46: =O46*6+P46 -> 98 | S46: OAKLEIGH
A47: CAMBERWELL | C47: 1 | D47: 1 | E47: =C47*6+D47 -> 7 | G47: 4 | H47: 6 | I47: =G47*6+H47 -> 30 | K47: 6 | L47: 8 | M47: =K47*6+L47 -> 44 | O47: 9 | P47: 11 | Q47: =O47*6+P47 -> 65 | S47: LEWIS
A48: BEST PLAYERS
A49: OAKLEIGH | C49: WITHERS | E49: WELLS | H49: ANDERSON | K49: HUTCHESON | N49: HEINTZ | Q49: ASH
A50: CAMBERWELL | C50: ONLEY | E50: TATHAM | H50: BRETT | K50: WILLIAMS | N50: SELLECK | Q50: A DAVIDSON
A51: GOALKICKERS
A52: OAKLEIGH | C52: HEINTZ 5 | F52: ANDERSON 4 | I52: CAMPBELL 3 | L52: DOWLER | N52: G RYAN
A53: CAMBERWELL | C53: TATHAM 3 | F53: WILKS 2 | I53: SALVIS | K53: YOUL | M53: SELLECK | O53: SEELENMEYER
A55: BRIGHTON | C55: 6 | D55: 5 | E55: =C55*6+D55 -> 41 | G55: 8 | H55: 6 | I55: =G55*6+H55 -> 54 | K55: 13 | L55: 10 | M55: =K55*6+L55 -> 88 | O55: 20 | P55: 14 | Q55: =O55*6+P55 -> 134 | S55: BEACH ROAD
A56: SANDRINGHAM | C56: 4 | D56: 3 | E56: =C56*6+D56 -> 27 | G56: 8 | H56: 9 | I56: =G56*6+H56 -> 57 | K56: 8 | L56: 10 | M56: =K56*6+L56 -> 58 | O56: 10 | P56: 14 | Q56: =O56*6+P56 -> 74 | S56: LESTER
A57: BEST PLAYERS
A58: BRIGHTON | C58: DREW | E58: NIVEN | H58: CONNELL | K58: WEBER | N58: CONDON | Q58: PENNY
A59: SANDRINGHAM | C59: McCOY | E59: MEEHAN | H59: POUND | K59: ROBERTS | N59: THOMS | Q59: FOSTER
A60: GOALKICKERS
A61: BRIGHTON | C61: DREW 10 | F61: NIVEN 3 | H61: FITCHER | J61: PENNY | L61: DEANE | N61: MILLER | P61: BAKER | R61: GOULLET | U61: WEBER
A62: SANDRINGHAM | C62: POUND 3 | F62: ROBERTS 2 | I62: McCOMB 2 | L62: MEEHAN | N62: CARTWRIGHT | Q62: CRACKNELL
A64: ROUND 2 | E64: 24TH APRIL | J64: WEATHER | M64: CLOUDY BUT FINE & MILD | S64: PLAYED AT
D65: 1ST QTR | H65: 2ND QTR | L65: 3RD QTR | P65: FINAL | S65: YARRAVILLE
A66: YARRAVILLE | C66: 6 | D66: 4 | E66: =C66*6+D66 -> 40 | G66: 8 | H66: 6 | I66: =G66*6+H66 -> 54 | K66: 11 | L66: 9 | M66: =K66*6+L66 -> 75 | O66: 13 | P66: 14 | Q66: =O66*6+P66 -> 92 | S66: UMPIRE | X66: LADDER | AB66: ROUND | AD66: 2
A67: PRAHRAN | C67: 3 | D67: 3 | E67: =C67*6+D67 -> 21 | G67: 4 | H67: 8 | I67: =G67*6+H67 -> 32 | K67: 6 | L67: 8 | M67: =K67*6+L67 -> 44 | O67: 7 | P67: 13 | Q67: =O67*6+P67 -> 55 | S67: LEWIS
A68: BEST PLAYERS | W68: TEAM | X68: W | Y68: L | Z68: D | AA68: FOR | AB68: AGST | AC68: % | AD68: PTS
A69: YARRAVILLE | C69: RAWSON | E69: KELLY | H69: TURNER | K69: WEDGWOOD | N69: FREW | Q69: ELLIS
A70: PRAHRAN | C70: KOOP | E70: FLEMING | H70: TABATEAU | K70: JOHNSON | N70: SHAW | Q70: THOMPSON | W70: BRIGHTON | X70: 2 | Y70: 0 | Z70: 0 | AA70: 256 | AB70: 157 | AC70: 163.05732484076432 | AD70: 8
A71: GOALKICKERS | W71: YARRAVILLE | X71: 2 | Y71: 0 | Z71: 0 | AA71: 165 | AB71: 103 | AC71: 160.19417475728156 | AD71: 8
A72: YARRAVILLE | C72: RAWSON 4 | F72: KELLY 4 | H72: McGRATH 2 | K72: TURNER | M72: PARKS | O72: WEDGWOOD | W72: NORTHCOTE | X72: 2 | Y72: 0 | Z72: 0 | AA72: 165 | AB72: 154 | AC72: 107.14285714285714 | AD72: 8
A73: PRAHRAN | C73: THOMPSON 2 | F73: BRENCHLEY | I73: GRAVELL | K73: WILTSHIRE | N73: WILKINSON | Q73: HAWKINS | W73: PRESTON | X73: 1 | Y73: 1 | Z73: 0 | AA73: 193 | AB73: 146 | AC73: 132.1917808219178 | AD73: 4
A75: BRIGHTON | C75: 4 | D75: 4 | E75: =C75*6+D75 -> 28 | G75: 7 | H75: 9 | I75: =G75*6+H75 -> 51 | K75: 14 | L75: 16 | M75: =K75*6+L75 -> 100 | O75: 17 | P75: 20 | Q75: =O75*6+P75 -> 122 | S75: ELSTERNWICK PARK | W75: BRUNSWICK | X75: 1 | Y75: 1 | Z75: 0 | AA75: 249 | AB75: 190 | AC75: 131.05263157894737 | AD75: 4
A76: OAKLEIGH | C76: 2 | D76: 2 | E76: =C76*6+D76 -> 14 | G76: 5 | H76: 5 | I76: =G76*6+H76 -> 35 | K76: 7 | L76: 7 | M76: =K76*6+L76 -> 49 | O76: 12 | P76: 11 | Q76: =O76*6+P76 -> 83 | S76: GREGORY | W76: PRAHRAN | X76: 1 | Y76: 1 | Z76: 0 | AA76: 188 | AB76: 165 | AC76: 113.93939393939394 | AD76: 4
A77: BEST PLAYERS | W77: OAKLEIGH | X77: 1 | Y77: 1 | Z77: 0 | AA77: 181 | AB77: 187 | AC77: 96.791443850267385 | AD77: 4
A78: BRIGHTON | C78: CONNELL | F78: PENNY | H78: DREW | K78: MILLER | N78: HINDSON | Q78: STEWART | W78: COBURG | X78: 1 | Y78: 1 | Z78: 0 | AA78: 220 | AB78: 263 | AC78: 83.650190114068437 | AD78: 4
A79: OAKLEIGH | C79: HUTCHESON | F79: ASH | H79: WATSON | K79: WILLIAMS | N79: ANDERSON | Q79: KENNEDY | W79: PORT MELBOURNE | X79: 1 | Y79: 1 | Z79: 0 | AA79: 148 | AB79: 204 | AC79: 72.549019607843135 | AD79: 4
A80: GOALKICKERS | O80: WILLIAMSON | W80: CAMBERWELL | X80: 0 | Y80: 2 | Z80: 0 | AA80: 170 | AB80: 221 | AC80: 76.92307692307692 | AD80: 0
A81: BRIGHTON | C81: DREW 4 | E81: BOLWELL 3 | H81: FITCHER 3 | J81: DEANE 2 | L81: PENNY | N81: MILLER | P81: BAKER | R81: HONE | W81: SANDRINGHAM | X81: 0 | Y81: 2 | Z81: 0 | AA81: 145 | AB81: 209 | AC81: 69.377990430622006 | AD81: 0
A82: OAKLEIGH | C82: HEINTZ 3 | E82: ANDERSON 3 | H82: CRAMERI 2 | J82: HARRISON | M82: RYAN | N82: CAMPBELL | Q82: BAILEY | W82: WILLIAMSTOWN | X82: 0 | Y82: 2 | Z82: 0 | AA82: 122 | AB82: 203 | AC82: 60.098522167487687 | AD82: 0
A84: NORTHCOTE | C84: 3 | D84: 2 | E84: =C84*6+D84 -> 20 | G84: 8 | H84: 5 | I84: =G84*6+H84 -> 53 | K84: 11 | L84: 7 | M84: =K84*6+L84 -> 73 | O84: 14 | P84: 9 | Q84: =O84*6+P84 -> 93 | S84: BRUNSWICK
A85: BRUNSWICK | C85: 6 | D85: 3 | E85: =C85*6+D85 -> 39 | G85: 9 | H85: 5 | I85: =G85*6+H85 -> 59 | K85: 10 | L85: 10 | M85: =K85*6+L85 -> 70 | O85: 13 | P85: 13 | Q85: =O85*6+P85 -> 91 | S85: CLAYTON
A86: BEST PLAYERS
A87: NORTHCOTE | C87: O'KEEFE | F87: R ROSS | I87: SMITH | L87: HART | N87: HOLDEN | Q87: LYNGCOLN
A88: BRUNSWICK | C88: DOWLING | F88: KANNGEISER | I88: McGRATH | L88: FAY | N88: PALMER | Q88: BOYD
A89: GOALKICKERS
A90: NORTHCOTE | C90: SIMMONDS 3 | F90: SEYMOUR 3 | I90: DOWNIE 2 | K90: O'KEEFE 2 | M90: LYNGCOLN 2 | P90: C ROSS | R90: O'SHEA
A91: BRUNSWICK | C91: DOWLING 3 | F91: TOONE 3 | I91: COOPER 2 | K91: McELROY 2 | N91: McINNES | P91: BOYD | R91: BOSCHEN
A93: PRESTON | C93: 2 | D93: 1 | E93: =C93*6+D93 -> 13 | G93: 6 | H93: 9 | I93: =G93*6+H93 -> 45 | K93: 11 | L93: 14 | M93: =K93*6+L93 -> 80 | O93: 19 | P93: 16 | Q93: =O93*6+P93 -> 130 | S93: PRESTON
A94: WILLIAMSTOWN | C94: 3 | D94: 6 | E94: =C94*6+D94 -> 24 | G94: 6 | H94: 7 | I94: =G94*6+H94 -> 43 | K94: 8 | L94: 10 | M94: =K94*6+L94 -> 58 | O94: 10 | P94: 14 | Q94: =O94*6+P94 -> 74 | S94: STUART
A95: BEST PLAYERS
A96: PRESTON | C96: FISHER | F96: HYDE | I96: LATHAM | L96: HARDING | O96: MASLEN | Q96: DOWLING
A97: WILLIAMSTOWN | C97: HUGGINS | F97: JERRAM | I97: HEDLEY | L97: HARLAND | O97: BROOKS
A98: GOALKICKERS
A99: PRESTON | C99: FISHER 8 | F99: WALKER 3 | I99: HUGHSON 3 | L99: LATHAM 2 | O99: GILBERT 2 | R99: HARDING
A100: WILLIAMSTOWN | C100: HEDLEY 5 | F100: LAWLOR 3 | I100: WILLETT | L100: HENDERSON
A102: COBURG | C102: 6 | D102: 5 | E102: =C102*6+D102 -> 41 | G102: 9 | H102: 7 | I102: =G102*6+H102 -> 61 | K102: 16 | L102: 13 | M102: =K102*6+L102 -> 109 | O102: 18 | P102: 15 | Q102: =O102*6+P102 -> 123 | S102: CAMBERWELL
A103: CAMBERWELL | C103: 2 | D103: 2 | E103: =C103*6+D103 -> 14 | G103: 10 | H103: 8 | I103: =G103*6+H103 -> 68 | K103: 12 | L103: 10 | M103: =K103*6+L103 -> 82 | O103: 15 | P103: 15 | Q103: =O103*6+P103 -> 105 | S103: GEE
A104: BEST PLAYERS
A105: COBURG | C105: DIXON | F105: JORDAN | I105: REVILLE | L105: SCANLON | O105: BROOM | R105: LEONARD
A106: CAMBERWELL | C106: WILLIAMS | F106: A DAVIDSON | I106: BRETT | L106: WALKER | O106: MEEHAN | R106: WILSON
A107: GOALKICKERS
A108: COBURG | C108: BROOM 6 | E108: LEE 3 | G108: REVILLE 3 | J108: HENNING 3 | M108: DIXON | O108: LEONARD | Q108: LA FRANCHI
A109: CAMBERWELL | C109: WILSON 4 | E109: SALVIS 2 | G109: WILLIAMS 2 | J109: A DAVIDSON 2 | M109: TATHAM | O109: WILKS | Q109: SEELENMEYER | T109: MEEHAN | W109: WHITE
A111: PORT MELBOURNE | C111: 3 | D111: 5 | E111: =C111*6+D111 -> 23 | G111: 3 | H111: 8 | I111: =G111*6+H111 -> 26 | K111: 7 | L111: 12 | M111: =K111*6+L111 -> 54 | O111: 10 | P111: 15 | Q111: =O111*6+P111 -> 75 | S111: PORT MELBOURNE
A112: SANDRINGHAM | C112: 2 | D112: 6 | E112: =C112*6+D112 -> 18 | G112: 3 | H112: 12 | I112: =G112*6+H112 -> 30 | K112: 5 | L112: 13 | M112: =K112*6+L112 -> 43 | O112: 9 | P112: 17 | Q112: =O112*6+P112 -> 71 | S112: GLOVER
A113: BEST PLAYERS
A114: PORT MELBOURNE | C114: BISSETT | E114: PAYNE | H114: GOSS | K114: McBETH | N114: FULTON | Q114: RUSSO
A115: SANDRINGHAM | C115: FREY | E115: MADDEN | H115: MITCHELL | K115: CARTWRIGHT | N115: SAUNDERS | Q115: MEEHAN
A116: GOALKICKERS
A117: PORT MELBOURNE | C117: RUSDEN 4 | F117: GOSS 2 | I117: FORREST | K117: FAIRWEATHER | O117: EASTMUIR | R117: FULTON
A118: SANDRINGHAM | C118: POUND 2 | F118: MITCHELL 2 | I118: FREY | K118: ABRAHAMS | N118: McCOMB | P118: WOODWARD | S118: CARTWRIGHT
A120: ROUND 3 | E120: 1ST MAY | H120: WEATHER | K120: CLOUDY S.W. WIND LIGHT SHOWERS | S120: PLAYED AT
D121: 1ST QTR | H121: 2ND QTR | L121: 3RD QTR | P121: FINAL | S121: TOORAK PARK
A122: PRAHRAN | C122: 3 | D122: 6 | E122: =C122*6+D122 -> 24 | G122: 6 | H122: 12 | I122: =G122*6+H122 -> 48 | K122: 15 | L122: 18 | M122: =K122*6+L122 -> 108 | O122: 19 | P122: 22 | Q122: =O122*6+P122 -> 136 | S122: UMPIRE | X122: LADDER | AB122: ROUND | AD122: 3
A123: PRESTON | C123: 2 | D123: 1 | E123: =C123*6+D123 -> 13 | G123: 5 | H123: 2 | I123: =G123*6+H123 -> 32 | K123: 6 | L123: 2 | M123: =K123*6+L123 -> 38 | O123: 11 | P123: 11 | Q123: =O123*6+P123 -> 77 | S123: CLAYTON
A124: BEST PLAYERS | W124: TEAM | X124: W | Y124: L | Z124: D | AA124: FOR | AB124: AGST | AC124: % | AD124: PTS
A125: PRAHRAN | C125: LOWRY | E125: WHITE | H125: GRAVELL | K125: WILLIAMS | N125: JOHNSON | Q125: THOMPSON
A126: PRESTON | C126: LATHAM | E126: MURRAY | H126: MUIR | K126: DUNSTONE | N126: GILBERT | Q126: BEAGLEY | W126: YARRAVILLE | X126: 3 | Y126: 0 | Z126: 0 | AA126: 271 | AB126: 148 | AC126: 183.1081081081081 | AD126: 12
A127: GOALKICKERS | W127: NORTHCOTE | X127: 3 | Y127: 0 | Z127: 0 | AA127: 294 | AB127: 226 | AC127: 130.08849557522123 | AD127: 12
A128: PRAHRAN | C128: HAWKINS 5 | F128: BRENCHLEY 4 | I128: WHITE 3 | K128: LOWRY 2 | M128: ANDERSON 2 | P128: THOMPSON 2 | S128: GRAVELL | W128: PRAHRAN | X128: 2 | Y128: 1 | Z128: 0 | AA128: 324 | AB128: 242 | AC128: 133.88429752066116 | AD128: 8
A129: PRESTON | C129: FISHER 5 | F129: GILBERT 2 | I129: WALSH 2 | K129: DUNSTONE | M129: WILKINS | W129: BRIGHTON | X129: 2 | Y129: 1 | Z129: 0 | AA129: 362 | AB129: 271 | AC129: 133.57933579335793 | AD129: 8
A131: COBURG | C131: 2 | D131: 7 | E131: =C131*6+D131 -> 19 | G131: 10 | H131: 11 | I131: =G131*6+H131 -> 71 | K131: 13 | L131: 16 | M131: =K131*6+L131 -> 94 | O131: 16 | P131: 18 | Q131: =O131*6+P131 -> 114 | S131: COBURG | W131: BRUNSWICK | X131: 2 | Y131: 1 | Z131: 0 | AA131: 319 | AB131: 253 | AC131: 126.08695652173913 | AD131: 8
A132: BRIGHTON | C132: 3 | D132: 4 | E132: =C132*6+D132 -> 22 | G132: 8 | H132: 8 | I132: =G132*6+H132 -> 56 | K132: 12 | L132: 6 | M132: =K132*6+L132 -> 78 | O132: 14 | P132: 22 | Q132: =O132*6+P132 -> 106 | S132: LEWIS | W132: COBURG | X132: 2 | Y132: 1 | Z132: 0 | AA132: 334 | AB132: 369 | AC132: 90.514905149051486 | AD132: 8
A133: BEST PLAYERS | W133: PRESTON | X133: 1 | Y133: 2 | Z133: 0 | AA133: 270 | AB133: 282 | AC133: 95.744680851063833 | AD133: 4
A134: COBURG | C134: REVILLE | E134: JORDAN | H134: SHENFIELD | K134: GAUDION | N134: LA FRANCHI | Q134: BROOM | W134: OAKLEIGH | X134: 1 | Y134: 2 | Z134: 0 | AA134: 257 | AB134: 285 | AC134: 90.175438596491233 | AD134: 4
A135: BRIGHTON | C135: PENNY | E135: WEBER | H135: GOULLET | K135: CONDON | N135: WILLIAMSON | Q135: DREW | W135: SANDRINGHAM | X135: 1 | Y135: 2 | Z135: 0 | AA135: 243 | AB135: 285 | AC135: 85.263157894736835 | AD135: 4
A136: GOALKICKERS | W136: PORT MELBOURNE | X136: 1 | Y136: 2 | Z136: 0 | AA136: 193 | AB136: 310 | AC136: 62.258064516129032 | AD136: 4
A137: COBURG | C137: BROOM 5 | F137: NASH 4 | I137: LEONARD 3 | L137: DIXON 2 | N137: GARRICK | P137: HENNING | W137: CAMBERWELL | X137: 0 | Y137: 3 | Z137: 0 | AA137: 242 | AB137: 350 | AC137: 69.142857142857139 | AD137: 0
A138: BRIGHTON | C138: DREW 3 | E138: FITCHER 2 | G138: PENNY 2 | I138: DEANE 2 | K138: MILLER 2 | M138: BOLWELL 2 | P138: WILLIAMSON | W138: WILLIAMSTOWN | X138: 0 | Y138: 3 | Z138: 0 | AA138: 185 | AB138: 273 | AC138: 67.765567765567766 | AD138: 0
A140: YARRAVILLE | C140: 4 | D140: 0 | E140: =C140*6+D140 -> 24 | G140: 6 | H140: 6 | I140: =G140*6+H140 -> 42 | K140: 9 | L140: 10 | M140: =K140*6+L140 -> 64 | O140: 15 | P140: 16 | Q140: =O140*6+P140 -> 106 | S140: YARRAVILLE
A141: PORT MELBOURNE | C141: 1 | D141: 2 | E141: =C141*6+D141 -> 8 | G141: 3 | H141: 4 | I141: =G141*6+H141 -> 22 | K141: 5 | L141: 8 | M141: =K141*6+L141 -> 38 | O141: 6 | P141: 9 | Q141: =O141*6+P141 -> 45 | S141: GREGORY
A142: BEST PLAYERS
A143: YARRAVILLE | C143: STREETER | F143: FREW | I143: RYAN | L143: JAMES | O143: McGRATH | R143: RAWSON
A144: PORT MELBOURNE | C144: GOSS | F144: LONGHURST | I144: MALONEY | L144: WOODS | O144: KEATING | R144: PAYNE
A145: GOALKICKERS
A146: YARRAVILLE | C146: KELLY 5 | E146: WEDGWOOD 3 | H146: McGRATH 2 | K146: TURNER 2 | M146: PETERS | O146: KENNEDY | Q146: RAWSON
A147: PORT MELBOURNE | C147: ANGWIN 3 | F147: LEE 2 | H147: KEATING
A149: SANDRINGHAM | C149: 2 | D149: 2 | E149: =C149*6+D149 -> 14 | G149: 10 | H149: 8 | I149: =G149*6+H149 -> 68 | K149: 10 | L149: 11 | M149: =K149*6+L149 -> 71 | O149: 13 | P149: 20 | Q149: =O149*6+P149 -> 98 | S149: OAKLEIGH
A150: OAKLEIGH | C150: 4 | D150: 8 | E150: =C150*6+D150 -> 32 | G150: 4 | H150: 11 | I150: =G150*6+H150 -> 35 | K150: 8 | L150: 18 | M150: =K150*6+L150 -> 66 | O150: 9 | P150: 22 | Q150: =O150*6+P150 -> 76 | S150: FORD
A151: BEST PLAYERS
A152: SANDRINGHAM | C152: CARTWRIGHT | F152: WITCHELL | I152: FOSTER | L152: McCOMB | O152: BURNS | R152: MITCHELL
A153: OAKLEIGH | C153: WITHERS | F153: CRAMERI | I153: POWELL | L153: CAMPBELL | O153: ANDERSON | R153: HARRISON
A154: GOALKICKERS
A155: SANDRINGHAM | C155: BURNS 4 | F155: CARTWRIGHT 3 | J155: McCOMB 2 | M155: POUND 2 | O155: DAVIS | Q155: TOLSON
A156: OAKLEIGH | C156: CAMPBELL 3 | F156: NOLAN 2 | I156: CRAMERI 2 | L156: DOWLER | N156: KENNEDY
A158: BRUNSWICK | C158: 0 | D158: 0 | E158: =C158*6+D158 -> 0 | G158: 6 | H158: 4 | I158: =G158*6+H158 -> 40 | K158: 7 | L158: 4 | M158: =K158*6+L158 -> 46 | O158: 10 | P158: 10 | Q158: =O158*6+P158 -> 70 | S158: WILLIAMSTOWN
A159: WILLIAMSTOWN | C159: 5 | D159: 6 | E159: =C159*6+D159 -> 36 | G159: 5 | H159: 6 | I159: =G159*6+H159 -> 36 | K159: 8 | L159: 15 | M159: =K159*6+L159 -> 63 | O159: 8 | P159: 15 | Q159: =O159*6+P159 -> 63 | S159: LESTER
A160: BEST PLAYERS
A161: BRUNSWICK | C161: DOWLING | F161: GILLON | I161: FAY | L161: McINNES | O161: TURNER | R161: DAVIS
A162: WILLIAMSTOWN | C162: HUGGINS | F162: BROOKS | I162: HARLAND | L162: LAWLOR | O162: PATERSON | R162: GREEN
A163: GOALKICKERS
A164: BRUNSWICK | C164: GILLON 4 | F164: McINNES 3 | I164: BOYD | K164: McELROY | M164: DOWLING
A165: WILLIAMSTOWN | C165: ROBERTSON 2 | F165: PATERSON 2 | I165: WILLETT 2 | L165: DELLER | N165: RAEBURN
A167: NORTHCOTE | C167: 11 | D167: 6 | E167: =C167*6+D167 -> 72 | G167: 14 | H167: 7 | I167: =G167*6+H167 -> 91 | K167: 18 | L167: 13 | M167: =K167*6+L167 -> 121 | O167: 19 | P167: 15 | Q167: =O167*6+P167 -> 129 | S167: NORTHCOTE
A168: CAMBERWELL | C168: 1 | D168: 0 | E168: =C168*6+D168 -> 6 | G168: 4 | H168: 4 | I168: =G168*6+H168 -> 28 | K168: 6 | L168: 6 | M168: =K168*6+L168 -> 42 | O168: 10 | P168: 12 | Q168: =O168*6+P168 -> 72 | S168: GLOVER
A169: BEST PLAYERS
A170: NORTHCOTE | C170: DOWNIE | F170: HOLDEN | I170: HART | L170: O'KEEFE | O170: R ROSS | R170: MEITZCKE
A171: CAMBERWELL | C171: BRETT | F171: SPIERS | I171: FINLAYSON | L171: WILLIAMS | O171: SEELENMEYER | R171: YOUL
A172: GOALKICKERS
A173: NORTHCOTE | C173: SEYMOUR 6 | F173: MEITZCKE 4 | I173: O'KEEFE 3 | K173: R ROSS 3 | M173: LYNGCOLN 2 | P173: HONIG
A174: CAMBERWELL | C174: TATHAM 3 | F174: WILLIAMS 3 | I174: SALVIS | K174: SEELENMEYER | N174: A DAVIDSON | Q174: OLNEY
A176: ROUND 4 | E176: 8TH MAY | J176: WEATHER | M176: COOL CLOUDY S.W. WIND | S176: PLAYED AT
D177: 1ST QTR | H177: 2ND QTR | L177: 3RD QTR | P177: FINAL | S177: ELSTERNWICK PARK
A178: BRIGHTON | C178: 0 | D178: 5 | E178: =C178*6+D178 -> 5 | G178: 4 | H178: 7 | I178: =G178*6+H178 -> 31 | K178: 6 | L178: 10 | M178: =K178*6+L178 -> 46 | O178: 11 | P178: 17 | Q178: =O178*6+P178 -> 83 | S178: UMPIRE | X178: LADDER | AB178: ROUND | AD178: 4
A179: NORTHCOTE | C179: 2 | D179: 4 | E179: =C179*6+D179 -> 16 | G179: 3 | H179: 5 | I179: =G179*6+H179 -> 23 | K179: 6 | L179: 6 | M179: =K179*6+L179 -> 42 | O179: 6 | P179: 7 | Q179: =O179*6+P179 -> 43 | S179: LESTER
A180: BEST PLAYERS | W180: TEAM | X180: W | Y180: L | Z180: D | AA180: FOR | AB180: AGST | AC180: % | AD180: PTS
A181: BRIGHTON | C181: EGAN | E181: DREW | H181: FITCHER | K181: NIVEN | N181: BAKER | Q181: DEANE
A182: NORTHCOTE | C182: O'KEEFE | E182: ACKLAND | H182: HOLDEN | K182: HONIG | N182: SIMMONDS | Q182: HART | W182: YARRAVILLE | X182: 4 | Y182: 0 | Z182: 0 | AA182: 364 | AB182: 207 | AC182: 175.84541062801932 | AD182: 16
A183: GOALKICKERS | W183: BRIGHTON | X183: 3 | Y183: 1 | Z183: 0 | AA183: 445 | AB183: 314 | AC183: 141.71974522292993 | AD183: 12
A184: BRIGHTON | C184: FITCHER 4 | F184: DREW 3 | I184: DEAN 2 | L184: BOLWELL 2 | W184: PRAHRAN | X184: 3 | Y184: 1 | Z184: 0 | AA184: 408 | AB184: 313 | AC184: 130.3514376996805 | AD184: 12
A185: NORTHCOTE | C185: O'KEEFE 2 | F185: NEWMAN 2 | I185: McNAMARA | L185: MEITZCKE | W185: NORTHCOTE | X185: 3 | Y185: 1 | Z185: 0 | AA185: 337 | AB185: 309 | AC185: 109.06148867313915 | AD185: 12
A187: PRAHRAN | C187: 3 | D187: 4 | E187: =C187*6+D187 -> 22 | G187: 4 | H187: 4 | I187: =G187*6+H187 -> 28 | K187: 10 | L187: 9 | M187: =K187*6+L187 -> 69 | O187: 12 | P187: 12 | Q187: =O187*6+P187 -> 84 | S187: BRUNSWICK | W187: BRUNSWICK | X187: 2 | Y187: 2 | Z187: 0 | AA187: 390 | AB187: 337 | AC187: 115.72700296735906 | AD187: 8
A188: BRUNSWICK | C188: 1 | D188: 1 | E188: =C188*6+D188 -> 7 | G188: 2 | H188: 7 | I188: =G188*6+H188 -> 19 | K188: 2 | L188: 11 | M188: =K188*6+L188 -> 23 | O188: 9 | P188: 17 | Q188: =O188*6+P188 -> 71 | S188: LEWIS | W188: SANDRINGHAM | X188: 2 | Y188: 2 | Z188: 0 | AA188: 348 | AB188: 377 | AC188: 92.307692307692307 | AD188: 8
A189: BEST PLAYERS | W189: COBURG | X189: 2 | Y189: 2 | Z189: 0 | AA189: 426 | AB189: 474 | AC189: 89.87341772151899 | AD189: 8
A190: PRAHRAN | C190: LOWRY | E190: GRAVELL | H190: JOHNSON | K190: HAWKINS | N190: BARTLETT | Q190: THOMPSON | W190: PORT MELBOURNE | X190: 2 | Y190: 2 | Z190: 0 | AA190: 273 | AB190: 370 | AC190: 73.78378378378379 | AD190: 8
A191: BRUNSWICK | C191: FAY | E191: BOYD | H191: TOONE | K191: CLARKE | N191: GILLON | Q191: VAUGHAN | W191: PRESTON | X191: 1 | Y191: 3 | Z191: 0 | AA191: 329 | AB191: 375 | AC191: 87.733333333333334 | AD191: 4
A192: GOALKICKERS | P192: WILLIAMS | W192: OAKLEIGH | X192: 1 | Y192: 3 | Z192: 0 | AA192: 317 | AB192: 365 | AC192: 86.849315068493155 | AD192: 4
A193: PRAHRAN | C193: THOMPSON 4 | F193: BARTLETT 2 | I193: GRAVELL 2 | L193: WILKINSON | N193: HAWKINS | Q193: BRENCHLEY | W193: CAMBERWELL | X193: 1 | Y193: 3 | Z193: 0 | AA193: 344 | AB193: 444 | AC193: 77.477477477477478 | AD193: 4
A194: BRUNSWICK | C194: COOPER 2 | F194: GREEN 2 | H194: CLARKE | J194: DONNELLY | M194: GILLON | O194: MACKAY | Q194: QUIN | W194: WILLIAMSTOWN | X194: 0 | Y194: 4 | Z194: 0 | AA194: 279 | AB194: 375 | AC194: 74.4 | AD194: 0
A196: YARRAVILLE | C196: 1 | D196: 5 | E196: =C196*6+D196 -> 11 | G196: 8 | H196: 7 | I196: =G196*6+H196 -> 55 | K196: 11 | L196: 11 | M196: =K196*6+L196 -> 77 | O196: 13 | P196: 15 | Q196: =O196*6+P196 -> 93 | S196: PRESTON
A197: PRESTON | C197: 1 | D197: 3 | E197: =C197*6+D197 -> 9 | G197: 3 | H197: 5 | I197: =G197*6+H197 -> 23 | K197: 6 | L197: 8 | M197: =K197*6+L197 -> 44 | O197: 8 | P197: 11 | Q197: =O197*6+P197 -> 59 | S197: GLOVER
A198: BEST PLAYERS
A199: YARRAVILLE | C199: PETERS | E199: PARKS | H199: RYAN | K199: RAWSON | N199: KELLY | Q199: TURNER
A200: PRESTON | C200: HYDE | E200: JONES | H200: LATHAM | K200: MASLEN | N200: HUGHSON | Q200: MURRAY
A201: GOALKICKERS
A202: YARRAVILLE | C202: KELLY 4 | E202: PENNY 2 | G202: McGRATH 2 | J202: RAWSON 2 | M202: TORRENS | O202: TURNER | Q202: WEDGWOOD
A203: PRESTON | C203: LATHAM 2 | F203: HUGHSON 2 | I203: FISHER | K203: GILBERT | M203: MURRAY | O203: WALKER
A205: SANDRINGHAM | C205: 3 | D205: 4 | E205: =C205*6+D205 -> 22 | G205: 10 | H205: 8 | I205: =G205*6+H205 -> 68 | K205: 11 | L205: 11 | M205: =K205*6+L205 -> 77 | O205: 15 | P205: 15 | Q205: =O205*6+P205 -> 105 | S205: BEACH ROAD
A206: COBURG | C206: 6 | D206: 6 | E206: =C206*6+D206 -> 42 | G206: 7 | H206: 9 | I206: =G206*6+H206 -> 51 | K206: 12 | L206: 18 | M206: =K206*6+L206 -> 90 | O206: 12 | P206: 20 | Q206: =O206*6+P206 -> 92 | S206: GREGORY
A207: BEST PLAYERS
A208: SANDRINGHAM | C208: MITCHELL | F208: TOLSON | I208: FREY | L208: WITCHELL | O208: CARTWRIGHT | R208: DAVIS
A209: COBURG | C209: REVILLE | F209: GARRICK | I209: HARRISON | L209: LA FRANCHI | O209: BROOM | R209: LEAHY
A210: GOALKICKERS
A211: SANDRINGHAM | C211: McCOMB 3 | F211: TOLSON 3 | I211: CARTWRIGHT 2 | L211: BURNS 2 | N211: DAVIS 2 | P211: ABRAHAMS | S211: MITCHELL | W211: ROBERTS
A212: COBURG | C212: BROOM 4 | F212: REVILLE 2 | I212: LEAHY 2 | K212: CONLEY | M212: DIXON | O212: SHENFIELD | R212: GARRICK
A214: PORT MELBOURNE | C214: 1 | D214: 5 | E214: =C214*6+D214 -> 11 | G214: 4 | H214: 14 | I214: =G214*6+H214 -> 38 | K214: 6 | L214: 14 | M214: =K214*6+L214 -> 50 | O214: 10 | P214: 20 | Q214: =O214*6+P214 -> 80 | S214: PORT MELBOURNE
A215: OAKLEIGH | C215: 1 | D215: 5 | E215: =C215*6+D215 -> 11 | G215: 2 | H215: 8 | I215: =G215*6+H215 -> 20 | K215: 6 | L215: 10 | M215: =K215*6+L215 -> 46 | O215: 8 | P215: 12 | Q215: =O215*6+P215 -> 60 | S215: CLAYTON
A216: BEST PLAYERS
A217: PORT MELBOURNE | C217: BISSETT | F217: LONGHURST | I217: FAIRWEATHER | M217: JULIER | P217: FORREST | S217: PAYNE
A218: OAKLEIGH | C218: WITHERS | F218: HUTCHESON | I218: WATSON | M218: ASH | P218: NOLAN | S218: FISHER
A219: GOALKICKERS
A220: PORT MELBOURNE | C220: FAIRWEATHER 4 | F220: LEE 2 | H220: FORREST 2 | K220: KEATING 2
A221: OAKLEIGH | C221: NOLAN 2 | F221: FISHER | H221: ANDERSON | K221: BAKER | M221: G RYAN | O221: HARRISON | R221: DOWLER
A223: CAMBERWELL | C223: 4 | D223: 5 | E223: =C223*6+D223 -> 29 | G223: 8 | H223: 10 | I223: =G223*6+H223 -> 58 | K223: 12 | L223: 12 | M223: =K223*6+L223 -> 84 | O223: 15 | P223: 12 | Q223: =O223*6+P223 -> 102 | S223: CAMBERWELL
A224: WILLIAMSTOWN | C224: 5 | D224: 2 | E224: =C224*6+D224 -> 32 | G224: 10 | H224: 4 | I224: =G224*6+H224 -> 64 | K224: 14 | L224: 5 | M224: =K224*6+L224 -> 89 | O224: 14 | P224: 10 | Q224: =O224*6+P224 -> 94 | S224: FORD
A225: BEST PLAYERS
A226: CAMBERWELL | C226: FINLAYSON | F226: WILLIAMS | I226: A DAVIDSON | L226: MEEHAN | O226: ROWE | R226: TATHAM
A227: WILLIAMSTOWN | C227: HUGGINS | F227: JERRAM | I227: LAWLER | L227: WILLETT | O227: RICHARDSON | R227: GREEN
A228: GOALKICKERS
A229: CAMBERWELL | C229: A DAVIDSON 5 | F229: TATHAM 3 | I229: MEEHAN 2 | L229: WHITE 2 | N229: WILKS | P229: SEELENMEYER | S229: PIERCE
A230: WILLIAMSTOWN | C230: LAWLER 9 | F230: HEDLEY | H230: RICHARDSON | K230: WILLETT | M230: ROBINSON | O230: DELLER
A232: ROUND 5 | E232: 15TH MAY | J232: WEATHER | M232: CLOUDY LITTLE RAIN N.W. WIND | S232: PLAYED AT
D233: 1ST QTR | H233: 2ND QTR | L233: 3RD QTR | P233: FINAL | S233: YARRAVILLE
A234: BRUNSWICK | C234: 4 | D234: 0 | E234: =C234*6+D234 -> 24 | G234: 7 | H234: 9 | I234: =G234*6+H234 -> 51 | K234: 9 | L234: 13 | M234: =K234*6+L234 -> 67 | O234: 15 | P234: 24 | Q234: =O234*6+P234 -> 114 | S234: UMPIRE | X234: LADDER | AB234: ROUND | AD234: 5
A235: YARRAVILLE | C235: 3 | D235: 1 | E235: =C235*6+D235 -> 19 | G235: 4 | H235: 1 | I235: =G235*6+H235 -> 25 | K235: 9 | L235: 6 | M235: =K235*6+L235 -> 60 | O235: 11 | P235: 7 | Q235: =O235*6+P235 -> 73 | S235: LESTER
A236: BEST PLAYERS | W236: TEAM | X236: W | Y236: L | Z236: D | AA236: FOR | AB236: AGST | AC236: % | AD236: PTS
A237: BRUNSWICK | C237: McELROY | F237: TOONE | I237: FAY | K237: COOPER | N237: McINNES | Q237: BOYD
A238: YARRAVILLE | C238: RAWSON | F238: McGRATH | I238: JONES | K238: PETERS | N238: TORRENS | Q238: PARKS | W238: BRIGHTON | X238: 4 | Y238: 1 | Z238: 0 | AA238: 539 | AB238: 387 | AC238: 139.27648578811369 | AD238: 16
A239: GOALKICKERS | W239: YARRAVILLE | X239: 4 | Y239: 1 | Z239: 0 | AA239: 437 | AB239: 321 | AC239: 136.13707165109034 | AD239: 16
A240: BRUNSWICK | C240: McINNES 5 | F240: TOONE 5 | I240: GARDINER 2 | L240: CRAWFORD 2 | O240: McELROY | W240: PRAHRAN | X240: 4 | Y240: 1 | Z240: 0 | AA240: 531 | AB240: 393 | AC240: 135.1145038167939 | AD240: 16
A241: YARRAVILLE | C241: RAWSON 3 | F241: TORRENS 2 | I241: PETERS 2 | K241: KELLY | M241: PIRANI | O241: McGRATH | Q241: PARKS | W241: NORTHCOTE | X241: 4 | Y241: 1 | Z241: 0 | AA241: 439 | AB241: 405 | AC241: 108.39506172839506 | AD241: 16
A243: NORTHCOTE | C243: 4 | D243: 4 | E243: =C243*6+D243 -> 28 | G243: 5 | H243: 11 | I243: =G243*6+H243 -> 41 | K243: 12 | L243: 14 | M243: =K243*6+L243 -> 86 | O243: 14 | P243: 18 | Q243: =O243*6+P243 -> 102 | S243: NORTHCOTE | W243: BRUNSWICK | X243: 3 | Y243: 2 | Z243: 0 | AA243: 504 | AB243: 410 | AC243: 122.92682926829268 | AD243: 12
A244: SANDRINGHAM | C244: 1 | D244: 3 | E244: =C244*6+D244 -> 9 | G244: 6 | H244: 11 | I244: =G244*6+H244 -> 47 | K244: 9 | L244: 16 | M244: =K244*6+L244 -> 70 | O244: 13 | P244: 18 | Q244: =O244*6+P244 -> 96 | S244: LEWIS | W244: COBURG | X244: 3 | Y244: 2 | Z244: 0 | AA244: 576 | AB244: 559 | AC244: 103.04114490161002 | AD244: 12
A245: BEST PLAYERS | W245: SANDRINGHAM | X245: 2 | Y245: 3 | Z245: 0 | AA245: 444 | AB245: 479 | AC245: 92.693110647181626 | AD245: 8
A246: NORTHCOTE | C246: HOLDEN | E246: DOWNIE | H246: POWELL | K246: ROSS | N246: HONIG | Q246: SMITH | W246: PRESTON | X246: 2 | Y246: 3 | Z246: 0 | AA246: 406 | AB246: 450 | AC246: 90.222222222222229 | AD246: 8
A247: SANDRINGHAM | C247: DAVIS | E247: TOLSON | H247: MITCHELL | K247: McCOMB | N247: CARTWRIGHT | Q247: MEEHAN | W247: PORT MELBOURNE | X247: 2 | Y247: 3 | Z247: 0 | AA247: 348 | AB247: 447 | AC247: 77.852348993288587 | AD247: 8
A248: GOALKICKERS | W248: OAKLEIGH | X248: 1 | Y248: 4 | Z248: 0 | AA248: 402 | AB248: 515 | AC248: 78.05825242718447 | AD248: 4
A249: NORTHCOTE | C249: McNAMARA 5 | F249: SEYMOUR 4 | I249: SIMMONDS 2 | L249: O'KEEFE | N249: ACKLAND | Q249: ROSS | W249: CAMBERWELL | X249: 1 | Y249: 4 | Z249: 0 | AA249: 424 | AB249: 567 | AC249: 74.779541446208114 | AD249: 4
A250: SANDRINGHAM | C250: TOLSON 3 | E250: McCOMB 2 | H250: DAVIS 2 | J250: BURNS | L250: FOSTER | N250: MITCHELL | Q250: FREY | R250: POUND | T250: SUTTON | W250: WILLIAMSTOWN | X250: 0 | Y250: 5 | Z250: 0 | AA250: 352 | AB250: 469 | AC250: 75.053304904051174 | AD250: 0
A252: PRESTON | C252: 3 | D252: 8 | E252: =C252*6+D252 -> 26 | G252: 4 | H252: 11 | I252: =G252*6+H252 -> 35 | K252: 8 | L252: 14 | M252: =K252*6+L252 -> 62 | O252: 10 | P252: 17 | Q252: =O252*6+P252 -> 77 | S252: PRESTON
A253: PORT MELBOURNE | C253: 1 | D253: 1 | E253: =C253*6+D253 -> 7 | G253: 8 | H253: 6 | I253: =G253*6+H253 -> 54 | K253: 8 | L253: 9 | M253: =K253*6+L253 -> 57 | O253: 10 | P253: 15 | Q253: =O253*6+P253 -> 75 | S253: GREGORY
A254: BEST PLAYERS
A255: PRESTON | C255: MUIR | E255: MURRAY | H255: JONES | K255: CANNAWAY | N255: DOWLING | Q255: DUNSTONE
A256: PORT MELBOURNE | C256: BISSETT | E256: LONGHURST | H256: JULIER | K256: MALONEY | N256: PAYNE | Q256: McLEOD
A257: GOALKICKERS
A258: PRESTON | C258: GILBERT 3 | F258: FISHER 3 | I258: LATHAM 2 | L258: BEAGLEY | N258: MURRAY
A259: PORT MELBOURNE | C259: FORREST 3 | F259: LONGHURST 3 | I259: McLEOD 2 | L259: BISSETT | N259: RUSDEN
A261: COBURG | C261: 1 | D261: 1 | E261: =C261*6+D261 -> 7 | G261: 10 | H261: 5 | I261: =G261*6+H261 -> 65 | K261: 17 | L261: 8 | M261: =K261*6+L261 -> 110 | O261: 23 | P261: 12 | Q261: =O261*6+P261 -> 150 | S261: COBURG
A262: OAKLEIGH | C262: 6 | D262: 6 | E262: =C262*6+D262 -> 42 | G262: 7 | H262: 7 | I262: =G262*6+H262 -> 49 | K262: 11 | L262: 9 | M262: =K262*6+L262 -> 75 | O262: 12 | P262: 13 | Q262: =O262*6+P262 -> 85 | S262: LAMING
A263: BEST PLAYERS
A264: COBURG | C264: DIXON | F264: REVILLE | I264: ANDERSON | L264: NASH | O264: GARRICK | Q264: JORDAN
A265: OAKLEIGH | C265: CRAMERI | F265: WATSON | I265: NOLAN | L265: WITHERS | O265: SMITH | Q265: WILMOTT
A266: GOALKICKERS
A267: COBURG | C267: BROOM 8 | F267: NASH 4 | I267: DIXON 4 | K267: REVILLE 2 | N267: LEONARD 2 | Q267: GARRICK 2 | T267: LEAHY
A268: OAKLEIGH | C268: NOLAN 5 | F268: CRAMERI 3 | I268: CAMPBELL 2 | L268: BAKER | N268: DOWLER
A270: PRAHRAN | C270: 9 | D270: 4 | E270: =C270*6+D270 -> 58 | G270: 12 | H270: 5 | I270: =G270*6+H270 -> 77 | K270: 14 | L270: 10 | M270: =K270*6+L270 -> 94 | O270: 18 | P270: 15 | Q270: =O270*6+P270 -> 123 | S270: TOORAK PARK
A271: CAMBERWELL | C271: 1 | D271: 1 | E271: =C271*6+D271 -> 7 | G271: 7 | H271: 3 | I271: =G271*6+H271 -> 45 | K271: 11 | L271: 6 | M271: =K271*6+L271 -> 72 | O271: 12 | P271: 8 | Q271: =O271*6+P271 -> 80 | S271: STUART
A272: BEST PLAYERS
A273: PRAHRAN | C273: WHITE | E273: FLEMING | H273: WILLIAMS | K273: BAKER | N273: HAWKINS | Q273: BRENCHLEY
A274: CAMBERWELL | C274: YOUL | E274: WILLIAMS | H274: WALKER | K274: BRETT | N274: SEELENMEYER | Q274: MEEHAN
A275: GOALKICKERS
A276: PRAHRAN | C276: HAWKINS 7 | F276: WHITE 4 | H276: WILKINSON 3 | K276: BAKER 2 | M276: THOMPSON 2
A277: CAMBERWELL | C277: WHITE 4 | F277: TATHAM 3 | I277: A DAVIDSON 3 | L277: SEELENMEYER 2
A279: BRIGHTON | C279: 0 | D279: 3 | E279: =C279*6+D279 -> 3 | G279: 9 | H279: 5 | I279: =G279*6+H279 -> 59 | K279: 13 | L279: 7 | M279: =K279*6+L279 -> 85 | O279: 14 | P279: 10 | Q279: =O279*6+P279 -> 94 | S279: WILLIAMSTOWN
A280: WILLIAMSTOWN | C280: 4 | D280: 3 | E280: =C280*6+D280 -> 27 | G280: 6 | H280: 7 | I280: =G280*6+H280 -> 43 | K280: 8 | L280: 10 | M280: =K280*6+L280 -> 58 | O280: 10 | P280: 13 | Q280: =O280*6+P280 -> 73 | S280: HASSETT
A281: BEST PLAYERS
A282: BRIGHTON | C282: CONNELL | F282: KNIGHTS | I282: WEBER | L282: PENNY | O282: FITCHER | R282: MILLER
A283: WILLIAMSTOWN | C283: BROOKS | F283: HARLAND | I283: HUGGINS | L283: ROWAN | O283: LAWLER | R283: WILLETT
A284: GOALKICKERS
A285: BRIGHTON | C285: FITCHER 5 | F285: DREW 4 | I285: MILLER 3 | K285: PENNY | M285: STRINGER
A286: WILLIAMSTOWN | C286: LAWLER 4 | F286: KAUFMAN 2 | I286: HEDLEY 2 | K286: GREEN | M286: McINTYRE
A288: ROUND 6 | E288: 22ND MAY | J288: WEATHER | M288: CLOUDY BUT FINE NORTH WIND | S288: PLAYED AT
D289: 1ST QTR | H289: 2ND QTR | L289: 3RD QTR | P289: FINAL | S289: ELSTERNWICK PARK
A290: BRIGHTON | C290: 4 | D290: 12 | E290: =C290*6+D290 -> 36 | G290: 6 | H290: 14 | I290: =G290*6+H290 -> 50 | K290: 13 | L290: 17 | M290: =K290*6+L290 -> 95 | O290: 16 | P290: 17 | Q290: =O290*6+P290 -> 113 | S290: UMPIRE | X290: LADDER | AB290: ROUND | AD290: 6
A291: PRAHRAN | C291: 1 | D291: 0 | E291: =C291*6+D291 -> 6 | G291: 6 | H291: 5 | I291: =G291*6+H291 -> 41 | K291: 9 | L291: 7 | M291: =K291*6+L291 -> 61 | O291: 15 | P291: 8 | Q291: =O291*6+P291 -> 98 | S291: GREGORY
A292: BEST PLAYERS | W292: TEAM | X292: W | Y292: L | Z292: D | AA292: FOR | AB292: AGST | AC292: % | AD292: PTS
A293: BRIGHTON | C293: EGAN | E293: PENNY | H293: WEBER | K293: BOLWELL | N293: BAKER | Q293: KNIGHTS
A294: PRAHRAN | C294: BAKER | E294: JOHNSON | H294: WHITE | K294: KOOP | N294: HAWKINS | Q294: BARTLETT | W294: YARRAVILLE | X294: 5 | Y294: 1 | Z294: 0 | AA294: 513 | AB294: 366 | AC294: 140.1639344262295 | AD294: 20
A295: GOALKICKERS | W295: BRIGHTON | X295: 5 | Y295: 1 | Z295: 0 | AA295: 652 | AB295: 485 | AC295: 134.43 | AD295: 20
A296: BRIGHTON | C296: BOLWELL 5 | F296: DREW 4 | I296: PENNY 4 | L296: NIVEN 2 | N296: BAKER | W296: NORTHCOTE | X296: 5 | Y296: 1 | Z296: 0 | AA296: 530 | AB296: 456 | AC296: 116.2280701754386 | AD296: 20
A297: PRAHRAN | C297: HAWKINS 5 | F297: BAKER 5 | I297: THOMPSON 2 | L297: WHITE 2 | N297: BRENCHLEY | W297: PRAHRAN | X297: 4 | Y297: 2 | Z297: 0 | AA297: 629 | AB297: 506 | AC297: 124.31 | AD297: 16
A299: BRUNSWICK | C299: 2 | D299: 4 | E299: =C299*6+D299 -> 16 | G299: 6 | H299: 6 | I299: =G299*6+H299 -> 42 | K299: 8 | L299: 9 | M299: =K299*6+L299 -> 57 | O299: 13 | P299: 10 | Q299: =O299*6+P299 -> 88 | S299: BRUNSWICK | W299: BRUNSWICK | X299: 4 | Y299: 2 | Z299: 0 | AA299: 592 | AB299: 482 | AC299: 122.82157676348548 | AD299: 16
A300: PRESTON | C300: 3 | D300: 2 | E300: =C300*6+D300 -> 20 | G300: 4 | H300: 3 | I300: =G300*6+H300 -> 27 | K300: 6 | L300: 14 | M300: =K300*6+L300 -> 50 | O300: 9 | P300: 18 | Q300: =O300*6+P300 -> 72 | S300: GLOVER | W300: COBURG | X300: 4 | Y300: 2 | Z300: 0 | AA300: 686 | AB300: 645 | AC300: 106.35658914728683 | AD300: 16
A301: BEST PLAYERS | W301: SANDRINGHAM | X301: 3 | Y301: 3 | Z301: 0 | AA301: 589 | AB301: 567 | AC301: 103.88007054673722 | AD301: 12
A302: BRUNSWICK | C302: QUINN | E302: CLARKE | H302: McELROY | K302: FAY | N302: DOWLING | Q302: TOONE | W302: PRESTON | X302: 2 | Y302: 4 | Z302: 0 | AA302: 478 | AB302: 538 | AC302: 88.847583643122675 | AD302: 8
A303: PRESTON | C303: WALKER | E303: MURRAY | H303: JOB | K303: MASLEN | N303: MUIR | Q303: LATHAM | W303: PORT MELBOURNE | X303: 2 | Y303: 4 | Z303: 0 | AA303: 434 | AB303: 557 | AC303: 77.917414721723517 | AD303: 8
A304: GOALKICKERS | W304: OAKLEIGH | X304: 1 | Y304: 5 | Z304: 0 | AA304: 453 | AB304: 606 | AC304: 74.752475247524757 | AD304: 4
A305: BRUNSWICK | C305: McINNES 5 | F305: BOYD 2 | H305: McELROY | J305: DOWLING | L305: GILLON | N305: QUIN | P305: KANGEISER | R305: LAMPRELL | W305: CAMBERWELL | X305: 1 | Y305: 5 | Z305: 0 | AA305: 469 | AB305: 643 | AC305: 72.93934681181959 | AD305: 4
A306: PRESTON | C306: WALKER 3 | F306: MURPHY 2 | I306: HYDE | K306: GILBERT | M306: WILKINS | O306: LATHAM | W306: WILLIAMSTOWN | X306: 0 | Y306: 6 | Z306: 0 | AA306: 440 | AB306: 614 | AC306: 71.661237785016283 | AD306: 0
A308: COBURG | C308: 3 | D308: 4 | E308: =C308*6+D308 -> 22 | G308: 8 | H308: 10 | I308: =G308*6+H308 -> 58 | K308: 13 | L308: 11 | M308: =K308*6+L308 -> 89 | O308: 16 | P308: 14 | Q308: =O308*6+P308 -> 110 | S308: PORT MELBOURNE
A309: PORT MELBOURNE | C309: 2 | D309: 5 | E309: =C309*6+D309 -> 17 | G309: 3 | H309: 6 | I309: =G309*6+H309 -> 24 | K309: 10 | L309: 12 | M309: =K309*6+L309 -> 72 | O309: 12 | P309: 14 | Q309: =O309*6+P309 -> 86 | S309: LESTER
A310: BEST PLAYERS
A311: COBURG | C311: LEONARD | F311: LEAHY | I311: LA FRANCHI | L311: SHENFIELD | O311: BROOM | Q311: DIXON
A312: PORT MELBOURNE | C312: RUSDEN | F312: KEATING | I312: PAYNE | L312: O'LEARY | O312: JULIER | Q312: BLOOMER
A313: GOALKICKERS
A314: COBURG | C314: DIXON 3 | E314: LEONARD 3 | H314: BROOM 3 | J314: LEAHY 2 | L314: HENNING 2 | N314: SCANLON | Q314: NASH | S314: GARRICK
A315: PORT MELBOURNE | C315: RUSDEN 3 | F315: KEATING 3 | I315: McBETH 2 | L315: TIMS | M315: MONOHAN | O315: FORREST | Q315: McLEOD
A317: SANDRINGHAM | C317: 6 | D317: 2 | E317: =C317*6+D317 -> 38 | G317: 12 | H317: 7 | I317: =G317*6+H317 -> 79 | K317: 16 | L317: 8 | M317: =K317*6+L317 -> 104 | O317: 22 | P317: 13 | Q317: =O317*6+P317 -> 145 | S317: BEACH ROAD
A318: WILLIAMSTOWN | C318: 7 | D318: 4 | E318: =C318*6+D318 -> 46 | G318: 7 | H318: 6 | I318: =G318*6+H318 -> 48 | K318: 11 | L318: 12 | M318: =K318*6+L318 -> 78 | O318: 12 | P318: 16 | Q318: =O318*6+P318 -> 88 | S318: STIUART
A319: BEST PLAYERS
A320: SANDRINGHAM | C320: FOSTER | F320: MITCHELL | I320: McCOMB | L320: GAINGER | O320: WITCHELL | Q320: FREY
A321: WILLIAMSTOWN | C321: HUGGINS | F321: JERRAM | I321: BROOKS | L321: RICHARDSON | O321: LAWLER | Q321: RAE
A322: GOALKICKERS
A323: SANDRINGHAM | C323: TOLSON 4 | F323: McCOMB 3 | I323: DAVIS 3 | K323: FREY 3 | M323: GAINGER 3 | P323: FOSTER 2 | R323: MADDEN 2 | W323: MITCHELL | X323: POUND
A324: WILLIAMSTOWN | C324: LAWLER 6 | F324: JERRAM 2 | I324: DELLER | K324: HEDLEY | M324: McCALLUM | P324: RAE
A326: NORTHCOTE | C326: 4 | D326: 3 | E326: =C326*6+D326 -> 27 | G326: 7 | H326: 4 | I326: =G326*6+H326 -> 46 | K326: 12 | L326: 5 | M326: =K326*6+L326 -> 77 | O326: 14 | P326: 7 | Q326: =O326*6+P326 -> 91 | S326: OAKLEIGH
A327: OAKLEIGH | C327: 2 | D327: 3 | E327: =C327*6+D327 -> 15 | G327: 3 | H327: 8 | I327: =G327*6+H327 -> 26 | K327: 5 | L327: 11 | M327: =K327*6+L327 -> 41 | O327: 6 | P327: 15 | Q327: =O327*6+P327 -> 51 | S327: CLAYTON
A328: BEST PLAYERS
A329: NORTHCOTE | C329: ROSS | F329: HART | I329: HOLDEN | L329: DOWNIE | O329: MEITZCKE | R329: SMITH
A330: OAKLEIGH | C330: WILLIAMS | F330: NOLAN | I330: WILMOTT | L330: D RYAN | O330: WITHERS | R330: HUTCHESON
A331: GOALKICKERS
A332: NORTHCOTE | C332: SEYMOUR 5 | F332: ROSS 3 | H332: DOWNIE 3 | J332: O'KEEFE 2 | M332: SMITH
A333: OAKLEIGH | C333: NOLAN 6
A335: YARRAVILLE | C335: 3 | D335: 4 | E335: =C335*6+D335 -> 22 | G335: 4 | H335: 6 | I335: =G335*6+H335 -> 30 | K335: 10 | L335: 13 | M335: =K335*6+L335 -> 73 | O335: 10 | P335: 16 | Q335: =O335*6+P335 -> 76 | S335: CAMBERWELL
A336: CAMBERWELL | C336: 0 | D336: 2 | E336: =C336*6+D336 -> 2 | G336: 4 | H336: 5 | I336: =G336*6+H336 -> 29 | K336: 5 | L336: 5 | M336: =K336*6+L336 -> 35 | O336: 6 | P336: 9 | Q336: =O336*6+P336 -> 45 | S336: HASSETT
A337: BEST PLAYERS
A338: YARRAVILLE | C338: CAVE | F338: PARKS | I338: KELLY | L338: TURNER | O338: McGRATH | R338: RYAN
A339: CAMBERWELL | C339: A DAVIDSON | F339: HUNTER | I339: BRETT | L339: FINLAYSON | O339: WHITE | R339: WILLIAMS
A340: GOALKICKERS
A341: YARRAVILLE | C341: KELLY 5 | E341: TORRENS 2 | H341: KENNY | J341: JAMES | L341: McGRATH
A342: CAMBERWELL | C342: A DAVIDSON 2 | F342: TATHAM | I342: WHITE | K342: OLNEY | M342: GRIFFITHS
A344: ROUND 7 | D344: 29TH MAY | J344: WEATHER | M344: CLOUDY FRESHH SOUTH WIND | S344: PLAYED AT
D345: 1ST QTR | H345: 2ND QTR | L345: 3RD QTR | P345: FINAL | S345: YARRAVILLE
A346: YARRAVILLE | C346: 4 | D346: 5 | E346: =C346*6+D346 -> 29 | G346: 6 | H346: 8 | I346: =G346*6+H346 -> 44 | K346: 9 | L346: 19 | M346: =K346*6+L346 -> 73 | O346: 16 | P346: 23 | Q346: =O346*6+P346 -> 119 | S346: UMPIRE | X346: LADDER | AB346: ROUND | AD346: 7
A347: BRIGHTON | C347: 0 | D347: 0 | E347: =C347*6+D347 -> 0 | G347: 4 | H347: 3 | I347: =G347*6+H347 -> 27 | K347: 4 | L347: 5 | M347: =K347*6+L347 -> 29 | O347: 4 | P347: 8 | Q347: =O347*6+P347 -> 32 | S347: LEWIS
A348: BEST PLAYERS | W348: TEAM | X348: W | Y348: L | Z348: D | AA348: FOR | AB348: AGST | AC348: % | AD348: PTS
A349: YARRAVILLE | C349: PENNY | E349: McGRATH | H349: JAMES | K349: TURNER | N349: RAWSON | Q349: CAVE
A350: BRIGHTON | C350: EGAN | E350: CONNELL | H350: RUDD | K350: KNIGHTS | N350: DEANE | Q350: WILLIAMSON | W350: YARRAVILLE | X350: 6 | Y350: 1 | Z350: 0 | AA350: 632 | AB350: 398 | AC350: 158.79396984924622 | AD350: 24
A351: GOALKICKERS | W351: BRUNSWICK | X351: 5 | Y351: 2 | Z351: 0 | AA351: 696 | AB351: 531 | AC351: 131.07344632768363 | AD351: 20
A352: YARRAVILLE | C352: RAWSON 4 | F352: WEDGWOOD 4 | I352: TURNER 3 | K352: McGRATH 2 | N352: FREW | P352: JAMES | R352: PARKS | W352: PRAHRAN | X352: 5 | Y352: 2 | Z352: 0 | AA352: 713 | AB352: 585 | AC352: 121.88 | AD352: 20
A353: BRIGHTON | C353: RUDD 2 | F353: FITCHER | I353: BOLWELL | W353: BRIGHTON | X353: 5 | Y353: 2 | Z353: 0 | AA353: 684 | AB353: 604 | AC353: 113.25 | AD353: 20
A355: COBURG | C355: 3 | D355: 10 | E355: =C355*6+D355 -> 28 | G355: 4 | H355: 11 | I355: =G355*6+H355 -> 35 | K355: 6 | L355: 16 | M355: =K355*6+L355 -> 52 | O355: 10 | P355: 17 | Q355: =O355*6+P355 -> 77 | S355: NORTHCOTE | W355: COBURG | X355: 5 | Y355: 2 | Z355: 0 | AA355: 763 | AB355: 695 | AC355: 109.7841726618705 | AD355: 20
A356: NORTHCOTE | C356: 0 | D356: 2 | E356: =C356*6+D356 -> 2 | G356: 6 | H356: 5 | I356: =G356*6+H356 -> 41 | K356: 6 | L356: 5 | M356: =K356*6+L356 -> 41 | O356: 7 | P356: 8 | Q356: =O356*6+P356 -> 50 | S356: WALKER | W356: NORTHCOTE | X356: 5 | Y356: 2 | Z356: 0 | AA356: 580 | AB356: 533 | AC356: 108.81801125703565 | AD356: 20
A357: BEST PLAYERS | W357: SANDRINGHAM | X357: 3 | Y357: 4 | Z357: 0 | AA357: 668 | AB357: 651 | AC357: 102.61136712749617 | AD357: 12
A358: COBURG | C358: ELLAWAY | F358: HENNING | I358: REVILLE | L358: JORDAN | O358: MARTYN | Q358: GARRICK | W358: PRESTON | X358: 2 | Y358: 5 | Z358: 0 | AA358: 541 | AB358: 630 | AC358: 85.873015873015873 | AD358: 8
A359: NORTHCOTE | C359: MEITZCKE | F359: POWELL | I359: SIMPSON | L359: McINERNEY | O359: DOWNIE | Q359: J WEGNER | W359: CAMBERWELL | X359: 2 | Y359: 5 | Z359: 0 | AA359: 561 | AB359: 706 | AC359: 79.461756373937675 | AD359: 8
A360: GOALKICKERS | W360: PORT MELBOURNE | X360: 2 | Y360: 5 | Z360: 0 | AA360: 483 | AB360: 661 | AC360: 73.071104387291982 | AD360: 8
A361: COBURG | C361: BROOM 3 | F361: DIXON 2 | I361: ELLAWAY | K361: LEONARD | M361: REVILLE | O361: HILL | P361: MARTYN | W361: WILLIAMSTOWN | X361: 1 | Y361: 6 | Z361: 0 | AA361: 556 | AB361: 668 | AC361: 83.23353293413173 | AD361: 4
A362: NORTHCOTE | C362: SEYMOUR 2 | F362: O'KEEFE 2 | I362: ACKLAND | K362: SMITH | M362: SIMPSON | W362: OAKLEIGH | X362: 1 | Y362: 6 | Z362: 0 | AA362: 507 | AB362: 722 | AC362: 70.22160664819944 | AD362: 4
A364: PRAHRAN | C364: 2 | D364: 2 | E364: =C364*6+D364 -> 14 | G364: 5 | H364: 6 | I364: =G364*6+H364 -> 36 | K364: 8 | L364: 11 | M364: =K364*6+L364 -> 59 | O364: 12 | P364: 12 | Q364: =O364*6+P364 -> 84 | S364: TOORAK PARK
A365: SANDRINGHAM | C365: 3 | D365: 3 | E365: =C365*6+D365 -> 21 | G365: 4 | H365: 7 | I365: =G365*6+H365 -> 31 | K365: 7 | L365: 10 | M365: =K365*6+L365 -> 52 | O365: 11 | P365: 13 | Q365: =O365*6+P365 -> 79 | S365: CLAYTON
A366: BEST PLAYERS
A367: PRAHRAN | C367: THOMPSON | F367: WHITEHEAD | I367: KOOP | L367: BRENCHLEY | O367: SMITH | R367: WILKINSON
A368: SANDRINGHAM | C368: McCOY | F368: SAUNDERS | I368: MITCHELL | L368: POUND | O368: CARTWRIGHT | R368: McCOMB
A369: GOALKICKERS
A370: PRAHRAN | C370: BAKER 4 | E370: HAWKINS 4 | H370: THOMPSON 3 | K370: BARTLETT
A371: SANDRINGHAM | C371: GREY 3 | E371: CARTWRIGHT 2 | H371: MADDEN 2 | K371: ABRAHAMS | N371: DAVIS | P371: TOLSON | R371: MCCOMB
A373: BRUNSWICK | C373: 7 | D373: 4 | E373: =C373*6+D373 -> 46 | G373: 11 | H373: 6 | I373: =G373*6+H373 -> 72 | K373: 14 | L373: 10 | M373: =K373*6+L373 -> 94 | O373: 15 | P373: 14 | Q373: =O373*6+P373 -> 104 | S373: BRUNSWICK
A374: PORT MELBOURNE | C374: 0 | D374: 1 | E374: =C374*6+D374 -> 1 | G374: 2 | H374: 3 | I374: =G374*6+H374 -> 15 | K374: 3 | L374: 4 | M374: =K374*6+L374 -> 22 | O374: 7 | P374: 7 | Q374: =O374*6+P374 -> 49 | S374: HASSETT
A375: BEST PLAYERS
A376: BRUNSWICK | C376: DOWLING | F376: FAY | I376: CRAWFORD | L376: McINNES | O376: McELROY | Q376: COOPER
A377: PORT MELBOURNE | C377: BLOOMER | F377: JOHNSON | I377: PAYNE | L377: LONGHURST | O377: JULIER | Q377: TIMS
A378: GOALKICKERS
A379: BRUNSWICK | C379: McINNES 8 | F379: CRAWFORD 5 | I379: GARDINER 3 | L379: BOYD | N379: McELROY | P379: KANGEISER
A380: PORT MELBOURNE | C380: FORREST 4 | F380: LONGHURST 2 | I380: KEATING
A382: WILLIAMSTOWN | C382: 1 | D382: 2 | E382: =C382*6+D382 -> 8 | G382: 6 | H382: 7 | I382: =G382*6+H382 -> 43 | K382: 10 | L382: 11 | M382: =K382*6+L382 -> 71 | O382: 17 | P382: 14 | Q382: =O382*6+P382 -> 116 | S382: WILLIAMSTOWN
A383: OAKLEIGH | C383: 5 | D383: 4 | E383: =C383*6+D383 -> 34 | G383: 5 | H383: 5 | I383: =G383*6+H383 -> 35 | K383: 8 | L383: 6 | M383: =K383*6+L383 -> 54 | O383: 8 | P383: 6 | Q383: =O383*6+P383 -> 54 | S383: GLOVER
A384: BEST PLAYERS
A385: WILLIAMSTOWN | C385: HUGGINS | F385: BROOKS | I385: JERRAM | L385: McCALLUM | O385: WILLETT | R385: PATERSON
A386: OAKLEIGH | C386: WATSON | F386: CRAMERI | I386: ASH | L386: WITHERS | O386: HUTCHESON | R386: D RYAN
A387: GOALKICKERS
A388: WILLIAMSTOWN | C388: LAWLER 8 | F388: JERRAM 4 | I388: MCCALLUM 3 | L388: RICHARDSON | O388: PATERSON | Q388: McLEOD | S388: ROBERTSON
A389: OAKLEIGH | C389: HARRISON 3 | F389: NOLAN 2 | I389: WITHERS | K389: KENNEDY | M389: G RYAN
A391: CAMBERWELL | C391: 1 | D391: 2 | E391: =C391*6+D391 -> 8 | G391: 6 | H391: 7 | I391: =G391*6+H391 -> 43 | K391: 7 | L391: 10 | M391: =K391*6+L391 -> 52 | O391: 13 | P391: 14 | Q391: =O391*6+P391 -> 92 | S391: PRESTON
A392: PRESTON | C392: 0 | D392: 5 | E392: =C392*6+D392 -> 5 | G392: 2 | H392: 8 | I392: =G392*6+H392 -> 20 | K392: 5 | L392: 15 | M392: =K392*6+L392 -> 45 | O392: 8 | P392: 15 | Q392: =O392*6+P392 -> 63 | S392: LESTER
A393: BEST PLAYERS
A394: CAMBERWELL | C394: MEEHAN | F394: WILLIAMS | I394: SEELENMEYER | L394: TATHAM | O394: FINLAYSON | R394: WHITE
A395: PRESTON | C395: JONES | F395: HYDE | I395: MURRAY | L395: DOWLING | O395: LATHAM | R395: HASKETT
A396: GOALKICKERS
A397: CAMBERWELL | C397: WHITE 3 | F397: GRIFFITHS 3 | I397: WILKS 2 | K397: WILLIAMS 2 | N397: MEEHAN 2 | Q397: TATHAM
A398: PRESTON | C398: WALKER 2 | F398: LATHAM 2 | I398: HYDE | K398: MURRAY | M398: WALSH | O398: MUIR
A400: ROUND 8 | E400: 5TH JUNE | J400: WEATHER | M400: FINE SOUTH BREEZE | S400: PLAYED AT
D401: 1ST QTR | H401: 2ND QTR | L401: 3RD QTR | P401: FINAL | S401: BEACH ROAD
A402: SANDRINGHAM | C402: 2 | D402: 3 | E402: =C402*6+D402 -> 15 | G402: 7 | H402: 9 | I402: =G402*6+H402 -> 51 | K402: 9 | L402: 11 | M402: =K402*6+L402 -> 65 | O402: 11 | P402: 14 | Q402: =O402*6+P402 -> 80 | S402: UMPIRE | X402: LADDER | AB402: ROUND | AD402: 8
A403: YARRAVILLE | C403: 2 | D403: 3 | E403: =C403*6+D403 -> 15 | G403: 4 | H403: 5 | I403: =G403*6+H403 -> 29 | K403: 10 | L403: 9 | M403: =K403*6+L403 -> 69 | O403: 11 | P403: 13 | Q403: =O403*6+P403 -> 79 | S403: LEWIS
A404: BEST PLAYERS | W404: TEAM | X404: W | Y404: L | Z404: D | AA404: FOR | AB404: AGST | AC404: % | AD404: PTS
A405: SANDRINGHAM | C405: MITCHELL | F405: CARTWRIGHT | I405: MEEHAN | L405: McCOY | N405: SAUNDERS | Q405: WITCHELL
A406: YARRAVILLE | C406: McGRATH | F406: STREETER | I406: PARKS | L406: EVANS | N406: WEDGWOOD | Q406: ELLIS | W406: YARRAVILLE | X406: 6 | Y406: 2 | Z406: 0 | AA406: 711 | AB406: 478 | AC406: 148.74476987447699 | AD406: 24
A407: GOALKICKERS | W407: PRAHRAN | X407: 6 | Y407: 2 | Z407: 0 | AA407: 827 | AB407: 668 | AC407: 123.8 | AD407: 24
A408: SANDRINGHAM | C408: McCOMB 3 | F408: GAINGER 2 | I408: FREY 2 | K408: CARTWRIGHT | N408: DAVIS | P408: ABRAHAMS | S408: TOLSON | W408: NORTHCOTE | X408: 6 | Y408: 2 | Z408: 0 | AA408: 694 | AB408: 595 | AC408: 116.63865546218487 | AD408: 24
A409: YARRAVILLE | C409: McGRATH 5 | F409: WEDGWOOD 3 | J409: KELLY 2 | M409: RAWSON | W409: BRIGHTON | X409: 6 | Y409: 2 | Z409: 0 | AA409: 812 | AB409: 720 | AC409: 112.78 | AD409: 24
A411: BRIGHTON | C411: 8 | D411: 8 | E411: =C411*6+D411 -> 56 | G411: 9 | H411: 9 | I411: =G411*6+H411 -> 63 | K411: 13 | L411: 16 | M411: =K411*6+L411 -> 94 | O411: 18 | P411: 20 | Q411: =O411*6+P411 -> 128 | S411: ELSTERNWICK PARK | W411: COBURG | X411: 6 | Y411: 2 | Z411: 0 | AA411: 831 | AB411: 756 | AC411: 109.92063492063492 | AD411: 24
A412: PRESTON | C412: 3 | D412: 0 | E412: =C412*6+D412 -> 18 | G412: 9 | H412: 6 | I412: =G412*6+H412 -> 60 | K412: 16 | L412: 6 | M412: =K412*6+L412 -> 102 | O412: 18 | P412: 8 | Q412: =O412*6+P412 -> 116 | S412: GLOVER | W412: BRUNSWICK | X412: 5 | Y412: 3 | Z412: 0 | AA412: 792 | AB412: 628 | AC412: 126.11464968152866 | AD412: 20
A413: BEST PLAYERS | W413: SANDRINGHAM | X413: 4 | Y413: 4 | Z413: 0 | AA413: 748 | AB413: 730 | AC413: 102.46575342465754 | AD413: 16
A414: BRIGHTON | C414: SULLIVAN | F414: EGAN | I414: STEWART | L414: BAKER | N414: PENNY | Q414: FITCHER | W414: CAMBERWELL | X414: 3 | Y414: 5 | Z414: 0 | AA414: 658 | AB414: 802 | AC414: 82.044887780548635 | AD414: 12
A415: PRESTON | C415: LATHAM | F415: CLARKE | I415: MURRAY | L415: MUIR | N415: DOWLING | Q415: MASLEN | W415: PRESTON | X415: 2 | Y415: 6 | Z415: 0 | AA415: 657 | AB415: 758 | AC415: 86.675461741424797 | AD415: 8
A416: GOALKICKERS | W416: PORT MELBOURNE | X416: 2 | Y416: 6 | Z416: 0 | AA416: 545 | AB416: 775 | AC416: 70.322580645161295 | AD416: 8
A417: BRIGHTON | C417: SULLIVAN 5 | F417: MILLER 3 | I417: NIVEN 2 | K417: FITCHER 2 | M417: PENNY 2 | O417: BOLWELL 2 | R417: RUDD 2 | W417: WILLIAMSTOWN | X417: 1 | Y417: 7 | Z417: 0 | AA417: 617 | AB417: 736 | AC417: 83.831521739130437 | AD417: 4
A418: PRESTON | C418: LATHAM 4 | F418: FISHER 4 | I418: WALKER 3 | L418: DUNSTONE 2 | O418: MUIR 2 | Q418: GILBERT | S418: MURRAY | W418: OAKLEIGH | X418: 1 | Y418: 7 | Z418: 0 | AA418: 590 | AB418: 836 | AC418: 70.574162679425839 | AD418: 4
R419: WILKINS
A420: NORTHCOTE | C420: 1 | D420: 10 | E420: =C420*6+D420 -> 16 | G420: 6 | H420: 13 | I420: =G420*6+H420 -> 49 | K420: 9 | L420: 18 | M420: =K420*6+L420 -> 72 | O420: 15 | P420: 24 | Q420: =O420*6+P420 -> 114 | S420: NORTHCOTE
A421: PORT MELBOURNE | C421: 1 | D421: 4 | E421: =C421*6+D421 -> 10 | G421: 2 | H421: 5 | I421: =G421*6+H421 -> 17 | K421: 6 | L421: 7 | M421: =K421*6+L421 -> 43 | O421: 9 | P421: 8 | Q421: =O421*6+P421 -> 62 | S421: STUART
A422: BEST PLAYERS
A423: NORTHCOTE | C423: MEITZCKE | F423: DOWNIE | I423: POWELL | L423: LYNGCOLN | O423: O'KEEFE | R423: McNAMARA
A424: PORT MELBOURNE | C424: BISSETT | F424: KEATING | I424: O'LEARY | L424: TIMS | O424: RUSDEN | R424: BLOOMER
A425: GOALKICKERS
A426: NORTHCOTE | C426: SEYMOUR 8 | F426: SIMPSON 3 | I426: ROSS 2 | L426: McNAMARA | O426: O'SHEA
A427: PORT MELBOURNE | C427: KEATING 4 | F427: JOHNSON 2 | I427: LONGHURST | L427: O'LEARY | O427: McLEOD
A429: COBURG | C429: 3 | D429: 2 | E429: =C429*6+D429 -> 20 | G429: 5 | H429: 7 | I429: =G429*6+H429 -> 37 | K429: 7 | L429: 15 | M429: =K429*6+L429 -> 57 | O429: 8 | P429: 20 | Q429: =O429*6+P429 -> 68 | S429: COBURG
A430: WILLIAMSTOWN | C430: 3 | D430: 2 | E430: =C430*6+D430 -> 20 | G430: 5 | H430: 3 | I430: =G430*6+H430 -> 33 | K430: 8 | L430: 5 | M430: =K430*6+L430 -> 53 | O430: 9 | P430: 7 | Q430: =O430*6+P430 -> 61 | S430: HASSETT
A431: BEST PLAYERS
A432: COBURG | C432: HENNING | F432: REVILLE | I432: JORDAN | L432: ANDERSON | O432: BROOM | R432: MARTYN
A433: WILLIAMSTOWN | C433: BROOKS | F433: RAE | I433: LAWLER | L433: PATERSON | O433: McCALLUM | R433: CUTTING
A434: GOALKICKERS
A435: COBURG | C435: BROOM 2 | F435: SCANLON 2 | I435: REVILLE | K435: DIXON | M435: GARRICK | O435: MARTYN
A436: WILLIAMSTOWN | C436: LAWLER 4 | F436: ROBERTSON | I436: MCCALLUM | L436: JERRAM
A438: PRAHRAN | C438: 5 | D438: 6 | E438: =C438*6+D438 -> 36 | G438: 9 | H438: 6 | I438: =G438*6+H438 -> 60 | K438: 13 | L438: 8 | M438: =K438*6+L438 -> 86 | O438: 16 | P438: 18 | Q438: =O438*6+P438 -> 114 | S438: OAKLEIGH
A439: OAKLEIGH | C439: 3 | D439: 1 | E439: =C439*6+D439 -> 19 | G439: 7 | H439: 1 | I439: =G439*6+H439 -> 43 | K439: 10 | L439: 4 | M439: =K439*6+L439 -> 64 | O439: 13 | P439: 5 | Q439: =O439*6+P439 -> 83 | S439: GREGORY
A440: BEST PLAYERS
A441: PRAHRAN | C441: WILTSHIRE | F441: THOMPSON | I441: BAKER | L441: MURRAY | O441: FLEMING | R441: HAWKINS
A442: OAKLEIGH | C442: WITHERS | F442: BICKERTON | I442: DOWLER | L442: CRAMERI | O442: REID | R442: WATSON
A443: GOALKICKERS
A444: PRAHRAN | C444: HAWKINS 7 | F444: BAKER 2 | I444: THOMPSON 2 | L444: GRAVELL 2 | O444: BARTLETT | Q444: WHITE | S444: WILKINSON
A445: OAKLEIGH | C445: NOLAN 4 | F445: DOWLER 4 | I445: REID 2 | K445: G RYAN | M445: CRAMERI | O445: KENNEDY
A447: CAMBERWELL | C447: 2 | D447: 5 | E447: =C447*6+D447 -> 17 | G447: 6 | H447: 8 | I447: =G447*6+H447 -> 44 | K447: 9 | L447: 10 | M447: =K447*6+L447 -> 64 | O447: 14 | P447: 13 | Q447: =O447*6+P447 -> 97 | S447: CAMBERWELL
A448: BRUNSWICK | C448: 3 | D448: 6 | E448: =C448*6+D448 -> 24 | G448: 6 | H448: 13 | I448: =G448*6+H448 -> 49 | K448: 10 | L448: 15 | M448: =K448*6+L448 -> 75 | O448: 13 | P448: 18 | Q448: =O448*6+P448 -> 96 | S448: LESTER
A449: BEST PLAYERS
A450: CAMBERWELL | C450: FINLAYSON | F450: SEELENMEYER | J450: WILLIAMS | M450: A DAVIDSON | P450: MEEHAN | S450: TURNER
A451: BRUNSWICK | C451: COOPER | F451: McELROY | J451: McINNES | M451: DOWLING | P451: GILLON | S451: LAMPRELL
A452: GOALKICKERS
A453: CAMBERWELL | C453: TATHAM 3 | F453: GRIFFITHS 3 | I453: WILKS | K453: WILLIAMS | M453: MEEHAN | O453: WHITE | Q453: OLNEY | S453: H DAVIDSON | W453: BRETT | X453: TURNER
A454: BRUNSWICK | C454: McINNES 6 | F454: McELROY 3 | I454: TOONE | K454: GILLON | M454: MACKAY | O454: QUIN
A456: ROUND 9 | E456: 12TH JUNE | H456: WEATHER | K456: FOG TURNING TO DRIZZLE LATE AFTERNOON | S456: PLAYED AT
D457: 1ST QTR | H457: 2ND QTR | L457: 3RD QTR | P457: FINAL | S457: PRESTON
A458: SANDRINGHAM | C458: 2 | D458: 4 | E458: =C458*6+D458 -> 16 | G458: 7 | H458: 7 | I458: =G458*6+H458 -> 49 | K458: 8 | L458: 9 | M458: =K458*6+L458 -> 57 | O458: 12 | P458: 11 | Q458: =O458*6+P458 -> 83 | S458: UMPIRE | X458: LADDER | AB458: ROUND | AD458: 9
A459: PRESTON | C459: 3 | D459: 5 | E459: =C459*6+D459 -> 23 | G459: 6 | H459: 8 | I459: =G459*6+H459 -> 44 | K459: 9 | L459: 13 | M459: =K459*6+L459 -> 67 | O459: 9 | P459: 14 | Q459: =O459*6+P459 -> 68 | S459: HASSETT
A460: BEST PLAYERS | W460: TEAM | X460: W | Y460: L | Z460: D | AA460: FOR | AB460: AGST | AC460: % | AD460: PTS
A461: SANDRINGHAM | C461: McCOY | F461: FOSTER | I461: CARTWRIGHT | L461: FREY | N461: McCOMB | Q461: DOYLE
A462: PRESTON | C462: LATHAM | F462: HYDE | I462: HUGHSON | L462: DOWLING | N462: CANNAWAY | Q462: WALKER | W462: YARRAVILLE | X462: 7 | Y462: 2 | Z462: 0 | AA462: 858 | AB462: 577 | AC462: 148.7001733102253 | AD462: 28
A463: GOALKICKERS | W463: NORTHCOTE | X463: 7 | Y463: 2 | Z463: 0 | AA463: 797 | AB463: 660 | AC463: 120.75757575757575 | AD463: 28
A464: SANDRINGHAM | C464: WEBER 4 | F464: McCOMB 2 | I464: FOSTER 2 | K464: FREY | M464: CARTWRIGHT | P464: TOLSON | R464: DAVIS | W464: COBURG | X464: 7 | Y464: 2 | Z464: 0 | AA464: 908 | AB464: 827 | AC464: 109.79443772672309 | AD464: 28
A465: PRESTON | C465: HYDE 4 | F465: WALKER 2 | I465: WILKINS 2 | L465: LATHAM | W465: BRUNSWICK | X465: 6 | Y465: 3 | Z465: 0 | AA465: 886 | AB465: 698 | AC465: 126.93409742120343 | AD465: 24
A467: CAMBERWELL | C467: 3 | D467: 4 | E467: =C467*6+D467 -> 22 | G467: 6 | H467: 6 | I467: =G467*6+H467 -> 42 | K467: 10 | L467: 9 | M467: =K467*6+L467 -> 69 | O467: 16 | P467: 10 | Q467: =O467*6+P467 -> 106 | S467: PORT MELBOURNE | W467: PRAHRAN | X467: 6 | Y467: 3 | Z467: 0 | AA467: 898 | AB467: 745 | AC467: 120.54 | AD467: 24
A468: PORT MELBOURNE | C468: 4 | D468: 2 | E468: =C468*6+D468 -> 26 | G468: 7 | H468: 4 | I468: =G468*6+H468 -> 46 | K468: 9 | L468: 8 | M468: =K468*6+L468 -> 62 | O468: 9 | P468: 9 | Q468: =O468*6+P468 -> 63 | S468: LEWIS | W468: BRIGHTON | X468: 6 | Y468: 3 | Z468: 0 | AA468: 882 | AB468: 814 | AC468: 108.35 | AD468: 24
A469: BEST PLAYERS | W469: SANDRINGHAM | X469: 5 | Y469: 4 | Z469: 0 | AA469: 831 | AB469: 798 | AC469: 104.13533834586467 | AD469: 20
A470: CAMBERWELL | C470: HUNTER | F470: GRIFFITHS | I470: MEEHAN | L470: SEELENMEYER | O470: OLNEY | Q470: H DAVIDSON | W470: CAMBERWELL | X470: 4 | Y470: 5 | Z470: 0 | AA470: 764 | AB470: 865 | AC470: 88.323699421965316 | AD470: 16
A471: PORT MELBOURNE | C471: KEATING | F471: BLOOMER | I471: O'LEARY | L471: JULIER | O471: MALONEY | Q471: GOSS | W471: PRESTON | X471: 2 | Y471: 7 | Z471: 0 | AA471: 725 | AB471: 841 | AC471: 86.206896551724142 | AD471: 8
A472: GOALKICKERS | W472: PORT MELBOURNE | X472: 2 | Y472: 7 | Z472: 0 | AA472: 608 | AB472: 881 | AC472: 69.012485811577747 | AD472: 8
A473: CAMBERWELL | C473: GRIFFITHS 5 | F473: H DAVIDSON 3 | J473: TATHAM 2 | M473: SELLECK 2 | O473: MEEHAN 2 | R473: WHITE | T473: OLNEY | W473: WILLIAMSTOWN | X473: 1 | Y473: 8 | Z473: 0 | AA473: 682 | AB473: 839 | AC473: 81.287246722288444 | AD473: 4
A474: PORT MELBOURNE | C474: JEGGERS 3 | F474: FAIRWEATHER 2 | J474: KEATING | L474: JOHNSON | N474: MALONEY | P474: O'LEARY | W474: OAKLEIGH | X474: 1 | Y474: 8 | Z474: 0 | AA474: 689 | AB474: 983 | AC474: 70.091556459816886 | AD474: 4
A476: YARRAVILLE | C476: 2 | D476: 6 | E476: =C476*6+D476 -> 18 | G476: 10 | H476: 12 | I476: =G476*6+H476 -> 72 | K476: 15 | L476: 18 | M476: =K476*6+L476 -> 108 | O476: 21 | P476: 21 | Q476: =O476*6+P476 -> 147 | S476: YARRAVILLE
A477: OAKLEIGH | C477: 4 | D477: 0 | E477: =C477*6+D477 -> 24 | G477: 6 | H477: 3 | I477: =G477*6+H477 -> 39 | K477: 12 | L477: 4 | M477: =K477*6+L477 -> 76 | O477: 15 | P477: 9 | Q477: =O477*6+P477 -> 99 | S477: STUART
A478: BEST PLAYERS
A479: YARRAVILLE | C479: RAWSON | E479: CASHMAN | H479: PARKS | K479: PIRANI | N479: JAMES | Q479: KENNY
A480: OAKLEIGH | C480: NOLAN | E480: WITHERS | H480: HARRISON | K480: WATSON | N480: HEINTZ | Q480: BELL
A481: GOALKICKERS
A482: YARRAVILLE | C482: CASHMAN 8 | F482: TORRENS 3 | I482: RAWSON 3 | L482: PIRANI 2 | N482: BOGIE | P482: KENNY | R482: TURNER | U482: PARKS | X482: WEDGWOOD
A483: OAKLEIGH | C483: NOLAN 5 | F483: HARRISON 4 | I483: HEINTZ 2 | L483: REID 2 | N483: WITHERS 2
E484: 14TH JUNE | J484: WEATHER | M484: FINE N.W. BREEZE
A485: COBURG | C485: 2 | D485: 9 | E485: =C485*6+D485 -> 21 | G485: 4 | H485: 16 | I485: =G485*6+H485 -> 40 | K485: 7 | L485: 22 | M485: =K485*6+L485 -> 64 | O485: 9 | P485: 23 | Q485: =O485*6+P485 -> 77 | S485: TOORAK PARK
A486: PRAHRAN | C486: 3 | D486: 5 | E486: =C486*6+D486 -> 23 | G486: 7 | H486: 7 | I486: =G486*6+H486 -> 49 | K486: 9 | L486: 8 | M486: =K486*6+L486 -> 62 | O486: 10 | P486: 11 | Q486: =O486*6+P486 -> 71 | S486: GREGORY
A487: BEST PLAYERS
A488: COBURG | C488: GARRICK | F488: REVILLE | I488: SHENFIELD | L488: GAUDION | O488: LA FRANCHI | R488: ANDERSON
A489: PRAHRAN | C489: THOMPSON | F489: FLEMING | I489: MURRAY | L489: BAKER | O489: WHITE | R489: WALTERS
A490: GOALKICKERS
A491: COBURG | C491: DIXON 3 | F491: HENNING 2 | I491: LA FRANCHI | L491: LEONARD | N491: GARRICK | Q491: IRVINE
A492: PRAHRAN | C492: HAWKINS 3 | F492: THOMPSON 3 | I492: BRENCHLEY 3 | L492: BAKER
A494: BRUNSWICK | C494: 3 | D494: 5 | E494: =C494*6+D494 -> 23 | G494: 4 | H494: 9 | I494: =G494*6+H494 -> 33 | K494: 9 | L494: 14 | M494: =K494*6+L494 -> 68 | O494: 13 | P494: 16 | Q494: =O494*6+P494 -> 94 | S494: BRUNSWICK
A495: BRIGHTON | C495: 1 | D495: 6 | E495: =C495*6+D495 -> 12 | G495: 6 | H495: 11 | I495: =G495*6+H495 -> 47 | K495: 7 | L495: 13 | M495: =K495*6+L495 -> 55 | O495: 9 | P495: 16 | Q495: =O495*6+P495 -> 70 | S495: LESTER
A496: BEST PLAYERS
A497: BRUNSWICK | C497: MASKELL | F497: McKERNAN | I497: CLARKE | L497: McELROY | O497: McINNES | R497: BAILEY
A498: BRIGHTON | C498: EGAN | F498: DEANE | I498: NIVEN | L498: CONNELL | O498: WEBER | R498: PENNY
A499: GOALKICKERS
A500: BRUNSWICK | C500: McINNES 6 | F500: CRAWFORD 2 | I500: BOYD | J500: McELROY | L500: TOONE | N500: LAMPRELL | Q500: BAILEY
A501: BRIGHTON | C501: SULLIVAN 4 | F501: NIVEN 2 | H501: FITCHER | J501: GOULLET | L501: HINDSON
A503: NORTHCOTE | C503: 4 | D503: 4 | E503: =C503*6+D503 -> 28 | G503: 5 | H503: 7 | I503: =G503*6+H503 -> 37 | K503: 8 | L503: 11 | M503: =K503*6+L503 -> 59 | O503: 15 | P503: 13 | Q503: =O503*6+P503 -> 103 | S503: NORTHCOTE
A504: WILLIAMSTOWN | C504: 5 | D504: 1 | E504: =C504*6+D504 -> 31 | G504: 7 | H504: 2 | I504: =G504*6+H504 -> 44 | K504: 10 | L504: 2 | M504: =K504*6+L504 -> 62 | O504: 10 | P504: 5 | Q504: =O504*6+P504 -> 65 | S504: GLOVER
A505: BEST PLAYERS
A506: NORTHCOTE | C506: ROSS | E506: ACKLAND | H506: McNAMARA | K506: O'SHEA | N506: O'KEEFE | Q506: SIMPSON
A507: WILLIAMSTOWN | C507: JERRAM | E507: HARLAND | H507: McCALLUM | K507: TAYLOR | N507: RICHARDSON | Q507: GREEN
A508: GOALKICKERS
A509: NORTHCOTE | C509: O'KEEFE 4 | F509: SEYMOUR 3 | I509: SIMPSON 2 | L509: ROSS 2 | N509: O'SHEA | P509: McNAMARA | S509: ACKLAND | V509: MILLER
A510: WILLIAMSTOWN | C510: LAWLER 4 | F510: JERRAM 3 | I510: McCALLUM 2 | L510: RAE
A512: ROUND 10 | E512: 19TH JUNE | H512: WEATHER | K512: EARLY FOG THEN FINE LIGHT NORTH BREEZE | S512: PLAYED AT
D513: 1ST QTR | H513: 2ND QTR | L513: 3RD QTR | P513: FINAL | S513: COBURG
A514: YARRAVILLE | C514: 3 | D514: 5 | E514: =C514*6+D514 -> 23 | G514: 5 | H514: 6 | I514: =G514*6+H514 -> 36 | K514: 8 | L514: 9 | M514: =K514*6+L514 -> 57 | O514: 10 | P514: 13 | Q514: =O514*6+P514 -> 73 | S514: UMPIRE | X514: LADDER | AB514: ROUND | AD514: 10
A515: COBURG | C515: 1 | D515: 1 | E515: =C515*6+D515 -> 7 | G515: 1 | H515: 6 | I515: =G515*6+H515 -> 12 | K515: 4 | L515: 9 | M515: =K515*6+L515 -> 33 | O515: 6 | P515: 10 | Q515: =O515*6+P515 -> 46 | S515: GLOVER
A516: BEST PLAYERS | W516: TEAM | X516: W | Y516: L | Z516: D | AA516: FOR | AB516: AGST | AC516: % | AD516: PTS
A517: YARRAVILLE | C517: ELLIS | E517: PETERS | H517: WEDGWOOD | K517: JAMES | N517: FREW | Q517: CASHMAN
A518: COBURG | C518: HENNING | E518: BROOM | H518: JORDAN | K518: LA FRANCHI | N518: GAUDION | Q518: LEONARD | W518: YARRAVILLE | X518: 8 | Y518: 2 | Z518: 0 | AA518: 931 | AB518: 623 | AC518: 149.43820224719101 | AD518: 32
A519: GOALKICKERS | W519: NORTHCOTE | X519: 8 | Y519: 2 | Z519: 0 | AA519: 901 | AB519: 752 | AC519: 119.81382978723404 | AD519: 32
A520: YARRAVILLE | C520: CASHMAN 3 | F520: TURNER 2 | I520: TORRENS 2 | L520: BONIFACE | N520: RAWSON | Q520: KENNY | W520: BRUNSWICK | X520: 7 | Y520: 3 | Z520: 0 | AA520: 969 | AB520: 773 | AC520: 125.35575679172057 | AD520: 28
A521: COBURG | C521: LEAHY | E521: REVILLE | H521: DIXON | J521: BROOM | M521: LEONARD | P521: LA FRANCHI | W521: BRIGHTON | X521: 7 | Y521: 3 | Z521: 0 | AA521: 978 | AB521: 890 | AC521: 109.89 | AD521: 28
A523: NORTHCOTE | C523: 5 | D523: 6 | E523: =C523*6+D523 -> 36 | G523: 9 | H523: 10 | I523: =G523*6+H523 -> 64 | K523: 13 | L523: 12 | M523: =K523*6+L523 -> 90 | O523: 15 | P523: 14 | Q523: =O523*6+P523 -> 104 | S523: NORTHCOTE | W523: COBURG | X523: 7 | Y523: 3 | Z523: 0 | AA523: 954 | AB523: 900 | AC523: 106 | AD523: 28
A524: PRAHRAN | C524: 3 | D524: 1 | E524: =C524*6+D524 -> 19 | G524: 6 | H524: 3 | I524: =G524*6+H524 -> 39 | K524: 10 | L524: 6 | M524: =K524*6+L524 -> 66 | O524: 14 | P524: 8 | Q524: =O524*6+P524 -> 92 | S524: STUART | W524: PRAHRAN | X524: 6 | Y524: 4 | Z524: 0 | AA524: 990 | AB524: 849 | AC524: 116.61 | AD524: 24
A525: BEST PLAYERS | W525: SANDRINGHAM | X525: 5 | Y525: 5 | Z525: 0 | AA525: 906 | AB525: 881 | AC525: 102.83768444948922 | AD525: 20
A526: NORTHCOTE | C526: McINERNEY | F526: MEITZCKE | I526: HART | K526: ACKLAND | N526: HONIG | Q526: ROSS | W526: CAMBERWELL | X526: 4 | Y526: 6 | Z526: 0 | AA526: 840 | AB526: 961 | AC526: 87.40894901144641 | AD526: 16
A527: PRAHRAN | C527: THOMPSON | F527: SMITH | I527: WHITE | K527: WILLIAMS | N527: WHITEHEAD | Q527: KOOP | W527: WILLIAMSTOWN | X527: 2 | Y527: 8 | Z527: 0 | AA527: 781 | AB527: 918 | AC527: 85.08 | AD527: 8
A528: GOALKICKERS | W528: PRESTON | X528: 2 | Y528: 8 | Z528: 0 | AA528: 837 | AB528: 982 | AC528: 85.234215885947052 | AD528: 8
A529: NORTHCOTE | C529: O'KEEFE 6 | F529: SEYMOUR 6 | I529: DOWNIE | K529: McNAMARA | N529: O'SHEA | W529: OAKLEIGH | X529: 2 | Y529: 8 | Z529: 0 | AA529: 830 | AB529: 1095 | AC529: 75.799086757990864 | AD529: 8
A530: PRAHRAN | C530: HAWKINS 4 | F530: THOMPSON 4 | I530: BRENCHLEY 2 | L530: WHITE | N530: SMITH | P530: BAKER | R530: LOWRY | W530: PORT MELBOURNE | X530: 2 | Y530: 8 | Z530: 0 | AA530: 687 | AB530: 980 | AC530: 70.1 | AD530: 8
A532: BRUNSWICK | C532: 4 | D532: 2 | E532: =C532*6+D532 -> 26 | G532: 7 | H532: 3 | I532: =G532*6+H532 -> 45 | K532: 10 | L532: 3 | M532: =K532*6+L532 -> 63 | O532: 13 | P532: 5 | Q532: =O532*6+P532 -> 83 | S532: BEACH ROAD
A533: SANDRINGHAM | C533: 0 | D533: 3 | E533: =C533*6+D533 -> 3 | G533: 1 | H533: 6 | I533: =G533*6+H533 -> 12 | K533: 3 | L533: 9 | M533: =K533*6+L533 -> 27 | O533: 10 | P533: 15 | Q533: =O533*6+P533 -> 75 | S533: GREGORY
A534: BEST PLAYERS
A535: BRUNSWICK | C535: TOONE | F535: COOPER | I535: QUINN | L535: DAVIS | O535: McINNES | R535: McELROY
A536: SANDRINGHAM | C536: SAUNDERS | F536: MEEHAN | I536: MADDEN | L536: McCOY | O536: CARTWRIGHT | R536: FOSTER
A537: GOALKICKERS
A538: BRUNSWICK | C538: McINNES 6 | F538: McELROY 2 | I538: TOONE 2 | K538: BAILEY 2 | M538: CRAWFORD
A539: SANDRINGHAM | C539: FREY 2 | F539: TOLSON 2 | I539: CARTWRIGHT 2 | L539: ENSOR | N539: ABRAHAMS | Q539: FOSTER | S539: POUND
A541: BRIGHTON | C541: 3 | D541: 3 | E541: =C541*6+D541 -> 21 | G541: 4 | H541: 4 | I541: =G541*6+H541 -> 28 | K541: 10 | L541: 7 | M541: =K541*6+L541 -> 67 | O541: 14 | P541: 12 | Q541: =O541*6+P541 -> 96 | S541: ELSTERNWICK PARK
A542: CAMBERWELL | C542: 4 | D542: 3 | E542: =C542*6+D542 -> 27 | G542: 9 | H542: 8 | I542: =G542*6+H542 -> 62 | K542: 10 | L542: 10 | M542: =K542*6+L542 -> 70 | O542: 11 | P542: 10 | Q542: =O542*6+P542 -> 76 | S542: HASSETT
A543: BEST PLAYERS
A544: BRIGHTON | C544: SULLIVAN | F544: RECHTER | J544: HINDSON | M544: BAKER | P544: CONNELL | S544: GEORGE
A545: CAMBERWELL | C545: MEEHAN | F545: SEELENMEYER | J545: HUNTER | M545: GRIFFITH | P545: TATHAM | S545: WHITE
A546: GOALKICKERS
A547: BRIGHTON | C547: SULLIVAN 6 | F547: MILLER 2 | I547: CONNELL 2 | L547: PENNY | N547: BOLWELL | P547: RECHTER | R547: WILLIAMSON
A548: CAMBERWELL | C548: GRIFFITHS 4 | F548: TATHAM 3 | I548: MEEHAN 2 | L548: A DAVIDSON | O548: WHITE
A550: WILLIAMSTOWN | C550: 3 | D550: 4 | E550: =C550*6+D550 -> 22 | G550: 8 | H550: 7 | I550: =G550*6+H550 -> 55 | K550: 9 | L550: 12 | M550: =K550*6+L550 -> 66 | O550: 14 | P550: 15 | Q550: =O550*6+P550 -> 99 | S550: WILLIAMSTOWN
A551: PORT MELBOURNE | C551: 2 | D551: 6 | E551: =C551*6+D551 -> 18 | G551: 4 | H551: 12 | I551: =G551*6+H551 -> 36 | K551: 7 | L551: 17 | M551: =K551*6+L551 -> 59 | O551: 10 | P551: 19 | Q551: =O551*6+P551 -> 79 | S551: LESTER
A552: BEST PLAYERS
A553: WILLIAMSTOWN | C553: LALWER | F553: JERRAM | I553: BROOKS | L553: RAE | O553: PATERSON | R553: CUTTING
A554: PORT MELBOURNE | C554: CROMPTON | F554: GOSS | I554: BAKER | L554: JEFFERS | O554: FULTON | R554: GARBUTT
A555: GOALKICKERS
A556: WILLIAMSTOWN | C556: LAWLER 6 | F556: JERRAM 3 | I556: HENDERSON 3 | L556: WILLETT 2
A557: PORT MELBOURNE | C557: FAIRWEATHER 3 | G557: CROMPTON 3 | J557: GOSS 2 | L557: FULTON | N557: KEATING
A559: OAKLEIGH | C559: 10 | D559: 5 | E559: =C559*6+D559 -> 65 | G559: 14 | H559: 7 | I559: =G559*6+H559 -> 91 | K559: 17 | L559: 10 | M559: =K559*6+L559 -> 112 | O559: 21 | P559: 15 | Q559: =O559*6+P559 -> 141 | S559: OAKLEIGH
A560: PRESTON | C560: 4 | D560: 0 | E560: =C560*6+D560 -> 24 | G560: 5 | H560: 8 | I560: =G560*6+H560 -> 38 | K560: 11 | L560: 12 | M560: =K560*6+L560 -> 78 | O560: 16 | P560: 16 | Q560: =O560*6+P560 -> 112 | S560: LEWIS
A561: BEST PLAYERS
A562: OAKLEIGH | C562: HARRISON | F562: HUTCHESON | I562: CRAMERI | L562: NOLAN | O562: WATSON | R562: MAJOR
A563: PRESTON | C563: DOWLING | F563: GILBERT | I563: MURRAY | L563: HYDE | O563: LATHAM | R563: HASKETT
A564: GOALKICKERS
A565: OAKLEIGH | C565: NOLAN 7 | E565: HARRISON 4 | H565: DOWLER 3 | J565: HEINTZ 2 | M565: SMITH | O565: REID | P565: DALGLEISH | R565: WATSON | U565: KENNEDY
A566: PRESTON | C566: HYDE 7 | E566: LATHAM 5 | H566: WALKER | J566: GILBERT | L566: JOB | M566: SLEITH
A568: ROUND 11 | E568: 26TH JUNE | J568: WEATHER | M568: FINE S.E. BREEZE | S568: PLAYED AT
D569: 1ST QTR | H569: 2ND QTR | L569: 3RD QTR | P569: FINAL | S569: YARRAVILLE
A570: YARRAVILLE | C570: 3 | D570: 4 | E570: =C570*6+D570 -> 22 | G570: 4 | H570: 8 | I570: =G570*6+H570 -> 32 | K570: 8 | L570: 8 | M570: =K570*6+L570 -> 56 | O570: 11 | P570: 13 | Q570: =O570*6+P570 -> 79 | S570: UMPIRE | X570: LADDER | AB570: ROUND | AD570: 11
A571: NORTHCOTE | C571: 3 | D571: 4 | E571: =C571*6+D571 -> 22 | G571: 4 | H571: 8 | I571: =G571*6+H571 -> 32 | K571: 7 | L571: 13 | M571: =K571*6+L571 -> 55 | O571: 9 | P571: 17 | Q571: =O571*6+P571 -> 71 | S571: LEWIS
A572: BEST PLAYERS | W572: TEAM | X572: W | Y572: L | Z572: D | AA572: FOR | AB572: AGST | AC572: % | AD572: PTS
A573: YARRAVILLE | C573: WEDGWOOD | F573: BOGIE | I573: PETERS | L573: FREW | O573: KELLY | Q573: JAMES
A574: NORTHCOTE | C574: MEITZCKE | F574: O'SHEA | I574: SIMPSON | L574: O'KEEFE | O574: HART | Q574: HOLDEN | W574: YARRAVILLE | X574: 9 | Y574: 2 | Z574: 0 | AA574: 1010 | AB574: 694 | AC574: 145.53314121037465 | AD574: 36
A575: GOALKICKERS | W575: BRUNSWICK | X575: 8 | Y575: 3 | Z575: 0 | AA575: 1074 | AB575: 868 | AC575: 123.73271889400921 | AD575: 32
A576: YARRAVILLE | C576: CASHMAN 3 | F576: McGRATH 3 | I576: KENNY 2 | K576: WEDGWOOD 2 | N576: TURNER | W576: NORTHCOTE | X576: 8 | Y576: 3 | Z576: 0 | AA576: 972 | AB576: 831 | AC576: 116.96750902527076 | AD576: 32
A577: NORTHCOTE | C577: O'KEEFE 4 | F577: McNAMARA 2 | I577: SEYMOUR | K577: HONIG | M577: O'SHEA | W577: PRAHRAN | X577: 7 | Y577: 4 | Z577: 0 | AA577: 1078 | AB577: 922 | AC577: 116.92 | AD577: 28
A579: CAMBERWELL | C579: 4 | D579: 4 | E579: =C579*6+D579 -> 28 | G579: 9 | H579: 7 | I579: =G579*6+H579 -> 61 | K579: 11 | L579: 10 | M579: =K579*6+L579 -> 76 | O579: 13 | P579: 12 | Q579: =O579*6+P579 -> 90 | S579: CAMBERWELL | W579: BRIGHTON | X579: 7 | Y579: 4 | Z579: 0 | AA579: 1048 | AB579: 990 | AC579: 105.86 | AD579: 28
A580: SANDRINGHAM | C580: 3 | D580: 6 | E580: =C580*6+D580 -> 24 | G580: 6 | H580: 11 | I580: =G580*6+H580 -> 47 | K580: 7 | L580: 17 | M580: =K580*6+L580 -> 59 | O580: 9 | P580: 18 | Q580: =O580*6+P580 -> 72 | S580: GLOVER | W580: COBURG | X580: 7 | Y580: 4 | Z580: 0 | AA580: 1031 | AB580: 996 | AC580: 103.5140562248996 | AD580: 28
A581: BEST PLAYERS | W581: SANDRINGHAM | X581: 5 | Y581: 6 | Z581: 0 | AA581: 978 | AB581: 971 | AC581: 100.72090628218332 | AD581: 20
A582: CAMBERWELL | C582: HUNTER | F582: WILLIAMS | I582: A DAVIDSON | L582: TATHAM | O582: MEEHAN | Q582: ONLEY | W582: CAMBERWELL | X582: 5 | Y582: 6 | Z582: 0 | AA582: 930 | AB582: 1033 | AC582: 90.029041626331079 | AD582: 20
A583: SANDRINGHAM | C583: FOSTER | F583: SAUNDERS | I583: CARTWRIGHT | L583: GILLIGAN | O583: McCOMB | Q583: ENSOR | W583: PRESTON | X583: 3 | Y583: 8 | Z583: 0 | AA583: 933 | AB583: 1059 | AC583: 88.101983002832867 | AD583: 12
A584: GOALKICKERS | W584: PORT MELBOURNE | X584: 3 | Y584: 8 | Z584: 0 | AA584: 787 | AB584: 1050 | AC584: 74.95 | AD584: 12
A585: CAMBERWELL | C585: A DAVIDSON 5 | F585: GRIFFITHS 3 | I585: WILSON 2 | K585: WILLIAMS 2 | N585: H DAVIDSON | W585: WILLIAMSTOWN | X585: 2 | Y585: 9 | Z585: 0 | AA585: 854 | AB585: 1006 | AC585: 84.89 | AD585: 8
A586: SANDRINGHAM | C586: CARTWRIGHT 4 | F586: McCOMB | H586: WEBER | J586: ABRAHAMS | M586: TOLSON | O586: FREY | W586: OAKLEIGH | X586: 2 | Y586: 9 | Z586: 0 | AA586: 925 | AB586: 1200 | AC586: 77.083333333333329 | AD586: 8
A588: PRESTON | C588: 4 | D588: 1 | E588: =C588*6+D588 -> 25 | G588: 7 | H588: 4 | I588: =G588*6+H588 -> 46 | K588: 11 | L588: 5 | M588: =K588*6+L588 -> 71 | O588: 15 | P588: 6 | Q588: =O588*6+P588 -> 96 | S588: PRESTON
A589: COBURG | C589: 2 | D589: 2 | E589: =C589*6+D589 -> 14 | G589: 5 | H589: 5 | I589: =G589*6+H589 -> 35 | K589: 6 | L589: 9 | M589: =K589*6+L589 -> 45 | O589: 10 | P589: 17 | Q589: =O589*6+P589 -> 77 | S589: STUART
A590: BEST PLAYERS
A591: PRESTON | C591: HASKETT | F591: LATHAM | I591: HYDE | L591: MURRAY | O591: GILBERT | R591: JOB
A592: COBURG | C592: JORDAN | F592: LA FRANCHI | I592: BRAGG | L592: ANDERSON | O592: REVILLE | R592: GAUDION
A593: GOALKICKERS
A594: PRESTON | C594: WILKINS 4 | F594: HYDE 3 | I594: MURRAY 3 | L594: LATHAM 2 | N594: GILBERT 2 | Q594: SLEITH
A595: COBURG | C595: MARTYN 3 | F595: COLLINS 3 | I595: LA FRANCHI 2 | L595: REVILLE | N595: GAUDION
A597: PRAHRAN | C597: 5 | D597: 5 | E597: =C597*6+D597 -> 35 | G597: 8 | H597: 10 | I597: =G597*6+H597 -> 58 | K597: 10 | L597: 13 | M597: =K597*6+L597 -> 73 | O597: 12 | P597: 16 | Q597: =O597*6+P597 -> 88 | S597: TOORAK PARK
A598: WILLIAMSTOWN | C598: 4 | D598: 2 | E598: =C598*6+D598 -> 26 | G598: 6 | H598: 8 | I598: =G598*6+H598 -> 44 | K598: 7 | L598: 12 | M598: =K598*6+L598 -> 54 | O598: 10 | P598: 13 | Q598: =O598*6+P598 -> 73 | S598: HASSETT
A599: BEST PLAYERS
A600: PRAHRAN | C600: LOWRY | F600: GRAVELL | I600: WHITEHEAD | L600: O'LEARY | O600: KOOP | Q600: BAKER
A601: WILLIAMSTOWN | C601: CUTTING | F601: PATERSON | I601: WILLETT | L601: HUGGINS | O601: BROOKS | Q601: HARLAND
A602: GOALKICKERS
A603: PRAHRAN | C603: GRAVELL 3 | F603: HAWKINS 3 | I603: BAKER 2 | K603: THOMPSON 2 | N603: HOLDEN | P603: WHITEHEAD
A604: WILLIAMSTOWN | C604: LAWLER 3 | F604: JERRAM 2 | I604: PATERSON 2 | L604: McINTYRE | N604: RAE | P604: McCCALLUM
A606: BRUNSWICK | C606: 5 | D606: 4 | E606: =C606*6+D606 -> 34 | G606: 10 | H606: 13 | I606: =G606*6+H606 -> 73 | K606: 13 | L606: 18 | M606: =K606*6+L606 -> 96 | O606: 14 | P606: 21 | Q606: =O606*6+P606 -> 105 | S606: BRUNSWICK
A607: OAKLEIGH | C607: 4 | D607: 4 | E607: =C607*6+D607 -> 28 | G607: 9 | H607: 6 | I607: =G607*6+H607 -> 60 | K607: 11 | L607: 7 | M607: =K607*6+L607 -> 73 | O607: 14 | P607: 11 | Q607: =O607*6+P607 -> 95 | S607: GREGORY
A608: BEST PLAYERS
A609: BRUNSWICK | C609: McINNES | F609: BOYD | I609: FAY | L609: CLARKE | O609: TURNER | R609: BAILEY
A610: OAKLEIGH | C610: HARRISON | F610: WITHERS | I610: NOLAN | L610: HEINTZ | O610: CRAMERI | R610: WATSON
A611: GOALKICKERS
A612: BRUNSWICK | C612: McGINNES 10 | F612: BOYD 2 | I612: CRAWFORD 2
A613: OAKLEIGH | C613: NOLAN 4 | F613: HEINTZ 4 | I613: HARRISON 3 | L613: G RYAN 3
A615: PORT MELBOURNE | C615: 3 | D615: 2 | E615: =C615*6+D615 -> 20 | G615: 7 | H615: 6 | I615: =G615*6+H615 -> 48 | K615: 12 | L615: 8 | M615: =K615*6+L615 -> 80 | O615: 15 | P615: 10 | Q615: =O615*6+P615 -> 100 | S615: PORT MELBOURNE
A616: BRIGHTON | C616: 3 | D616: 11 | E616: =C616*6+D616 -> 29 | G616: 5 | H616: 14 | I616: =G616*6+H616 -> 44 | K616: 6 | L616: 19 | M616: =K616*6+L616 -> 55 | O616: 8 | P616: 22 | Q616: =O616*6+P616 -> 70 | S616: LESTER
A617: BEST PLAYERS
A618: PORT MELBOURNE | C618: GARBUTT | F618: BLOOMER | I618: RUSSO | L618: CROMPTON | O618: ALSOP | R618: JULIER
A619: BRIGHTON | C619: BAKER | F619: PENNY | I619: WEBER | L619: EGAN | O619: STEWART | R619: CONNELL
A620: GOALKICKERS
A621: PORT MELBOURNE | C621: FAIRWEATHER 4 | F621: FORREST 3 | I621: JEFFERS 2 | K621: CROMPTON 2 | N621: GOSS | P621: JULIER | R621: KEATING | U621: FULTON
A622: BRIGHTON | C622: DREW 2 | F622: PENNY | H622: MILLER | J622: WILLIAMSON | M622: SULLIVAN | P622: CONNELL
A624: ROUND 12 | E624: 3RD JULY | H624: WEATHER | K624: COLD SHOWERS S.W. WIND GROUNDS WET | S624: PLAYED AT
D625: 1ST QTR | H625: 2ND QTR | L625: 3RD QTR | P625: FINAL | S625: BRUNSWICK
A626: BRUNSWICK | C626: 1 | D626: 1 | E626: =C626*6+D626 -> 7 | G626: 6 | H626: 7 | I626: =G626*6+H626 -> 43 | K626: 8 | L626: 11 | M626: =K626*6+L626 -> 59 | O626: 12 | P626: 18 | Q626: =O626*6+P626 -> 90 | S626: UMPIRE | X626: LADDER | AB626: ROUND | AD626: 12
A627: COBURG | C627: 5 | D627: 6 | E627: =C627*6+D627 -> 36 | G627: 6 | H627: 8 | I627: =G627*6+H627 -> 44 | K627: 9 | L627: 10 | M627: =K627*6+L627 -> 64 | O627: 10 | P627: 13 | Q627: =O627*6+P627 -> 73 | S627: GLOVER
A628: BEST PLAYERS | W628: TEAM | X628: W | Y628: L | Z628: D | AA628: FOR | AB628: AGST | AC628: % | AD628: PTS
A629: BRUNSWICK | C629: QUINN | E629: CLARKE | H629: COOPER | K629: CRAWFORD | N629: VAUGHAN | Q629: BAILEY
A630: COBURG | C630: JORDAN | E630: MARTYN | H630: REVILLE | K630: LEONARD | N630: DIXON | Q630: HENNING | W630: YARRAVILLE | X630: 10 | Y630: 2 | Z630: 0 | AA630: 1078 | AB630: 736 | AC630: 146.46739130434781 | AD630: 40
A631: GOALKICKERS | Q631: GARDINER | W631: BRUNSWICK | X631: 9 | Y631: 3 | Z631: 0 | AA631: 1164 | AB631: 941 | AC631: 123.7 | AD631: 36
A632: BRUNSWICK | C632: McINNES 2 | F632: McELROY 2 | I632: CRAWFORD 2 | L632: BAILEY 2 | N632: BOYD | P632: GILLON | R632: QUIN | W632: NORTHCOTE | X632: 9 | Y632: 3 | Z632: 0 | AA632: 1029 | AB632: 876 | AC632: 117.46575342465754 | AD632: 36
A633: COBURG | C633: COLLINS 6 | F633: MARTYN | H633: GARRICK | J633: REVILLE | L633: ELLAWAY | W633: PRAHRAN | X633: 8 | Y633: 4 | Z633: 0 | AA633: 1170 | AB633: 990 | AC633: 118.18 | AD633: 32
A635: BRIGHTON | C635: 3 | D635: 2 | E635: =C635*6+D635 -> 20 | G635: 4 | H635: 3 | I635: =G635*6+H635 -> 27 | K635: 8 | L635: 7 | M635: =K635*6+L635 -> 55 | O635: 11 | P635: 8 | Q635: =O635*6+P635 -> 74 | S635: ELSTERNWICK PARK | W635: BRIGHTON | X635: 8 | Y635: 4 | Z635: 0 | AA635: 1122 | AB635: 1061 | AC635: 105.75 | AD635: 32
A636: SANDRINGHAM | C636: 3 | D636: 4 | E636: =C636*6+D636 -> 22 | G636: 4 | H636: 5 | I636: =G636*6+H636 -> 29 | K636: 9 | L636: 7 | M636: =K636*6+L636 -> 61 | O636: 10 | P636: 11 | Q636: =O636*6+P636 -> 71 | S636: LEWIS | W636: COBURG | X636: 7 | Y636: 5 | Z636: 0 | AA636: 1104 | AB636: 1086 | AC636: 101.66 | AD636: 28
A637: BEST PLAYERS | W637: CAMBERWELL | X637: 6 | Y637: 6 | Z637: 0 | AA637: 1027 | AB637: 1076 | AC637: 95.446096654275095 | AD637: 24
A638: BRIGHTON | C638: HALLAHAN | F638: GEORGE | I638: WEBER | K638: BAKER | N638: ROBINSON | Q638: EGAN | W638: SANDRINGHAM | X638: 5 | Y638: 7 | Z638: 0 | AA638: 1049 | AB638: 1045 | AC638: 100.38277511961722 | AD638: 20
A639: SANDRINGHAM | C639: MADDEN | F639: CARTWRIGHT | I639: McCOY | K639: STAPLETON | N639: FISHER | Q639: TOLSON | W639: PRESTON | X639: 3 | Y639: 9 | Z639: 0 | AA639: 978 | AB639: 1116 | AC639: 87.634408602150543 | AD639: 12
A640: GOALKICKERS | W640: PORT MELBOURNE | X640: 3 | Y640: 9 | Z640: 0 | AA640: 855 | AB640: 1142 | AC640: 74.87 | AD640: 12
A641: BRIGHTON | C641: BOLWELL 3 | F641: SULLIVAN 3 | I641: FITCHER 2 | L641: MILLER | N641: GOULLET | P641: RECHTER | W641: WILLIAMSTOWN | X641: 2 | Y641: 10 | Z641: 0 | AA641: 896 | AB641: 1074 | AC641: 83.43 | AD641: 8
A642: SANDRINGHAM | C642: FISHER 4 | F642: TOLSON 3 | I642: MITCHELL | K642: WEBER | M642: FREY | W642: OAKLEIGH | X642: 2 | Y642: 10 | Z642: 0 | AA642: 968 | AB642: 1297 | AC642: 74.633770239013103 | AD642: 8
A644: NORTHCOTE | C644: 4 | D644: 2 | E644: =C644*6+D644 -> 26 | G644: 6 | H644: 5 | I644: =G644*6+H644 -> 41 | K644: 7 | L644: 6 | M644: =K644*6+L644 -> 48 | O644: 8 | P644: 9 | Q644: =O644*6+P644 -> 57 | S644: PRESTON
A645: PRESTON | C645: 0 | D645: 2 | E645: =C645*6+D645 -> 2 | G645: 3 | H645: 4 | I645: =G645*6+H645 -> 22 | K645: 4 | L645: 8 | M645: =K645*6+L645 -> 32 | O645: 6 | P645: 9 | Q645: =O645*6+P645 -> 45 | S645: GREGORY
A646: BEST PLAYERS
A647: NORTHCOTE | C647: STEPHENSON | F647: MEITZCKE | I647: HART | L647: ACKLAND | O647: LYNGCOLN | R647: DOWNIE
A648: PRESTON | C648: CLARKE | F648: JOB | I648: CLACK | L648: GILBERT | O648: WALSH | R648: JONES
A649: GOALKICKERS
A650: NORTHCOTE | C650: O'KEEFE 4 | F650: GRAY | H650: DOWNIE | K650: O'SHEA | M650: SEYMOUR
A651: PRESTON | C651: GILBERT 2 | F651: HYDE 2 | H651: ROBERTSON | K651: MURRAY
A653: CAMBERWELL | C653: 3 | D653: 6 | E653: =C653*6+D653 -> 24 | G653: 8 | H653: 12 | I653: =G653*6+H653 -> 60 | K653: 8 | L653: 19 | M653: =K653*6+L653 -> 67 | O653: 12 | P653: 25 | Q653: =O653*6+P653 -> 97 | S653: CAMBERWELL
A654: OAKLEIGH | C654: 1 | D654: 0 | E654: =C654*6+D654 -> 6 | G654: 3 | H654: 2 | I654: =G654*6+H654 -> 20 | K654: 3 | L654: 4 | M654: =K654*6+L654 -> 22 | O654: 6 | P654: 7 | Q654: =O654*6+P654 -> 43 | S654: LESTER
A655: BEST PLAYERS
A656: CAMBERWELL | C656: WILLIAMS | F656: WALKER | I656: FINLAYSON | L656: HUNTER | O656: MEEHAN | R656: DELANEY
A657: OAKLEIGH | C657: D RYAN | F657: WATSON | I657: CORP | L657: WITHERS | O657: KENNEDY | R657: NOLAN
A658: GOALKICKERS
A659: CAMBERWELL | C659: WILLIAMS 4 | F659: TATHAM 2 | I659: A DAVIDSON 2 | L659: GRIFFITHS 2 | O659: WILSON | Q659: TURNER
A660: OAKLEIGH | C660: NOLAN 3 | F660: KENNEDY | I660: G RYAN | K660: CORP
A662: PRAHRAN | C662: 4 | D662: 5 | E662: =C662*6+D662 -> 29 | G662: 6 | H662: 6 | I662: =G662*6+H662 -> 42 | K662: 10 | L662: 8 | M662: =K662*6+L662 -> 68 | O662: 13 | P662: 14 | Q662: =O662*6+P662 -> 92 | S662: PORT MELBOURNE
A663: PORT MELBOURNE | C663: 1 | D663: 2 | E663: =C663*6+D663 -> 8 | G663: 3 | H663: 6 | I663: =G663*6+H663 -> 24 | K663: 7 | L663: 6 | M663: =K663*6+L663 -> 48 | O663: 10 | P663: 8 | Q663: =O663*6+P663 -> 68 | S663: STUART
A664: BEST PLAYERS
A665: PRAHRAN | C665: LOWRY | F665: FLEMING | I665: WHITE | L665: WALTERS | O665: THOMPSON | R665: GRANDISON
A666: PORT MELBOURNE | C666: GARBUTT | F666: MONOHAN | I666: KEATING | L666: FULTON | O666: O'LEARY | R666: MURRAY
A667: GOALKICKERS
A668: PRAHRAN | C668: HAWKINS 3 | F668: GRANDISON 3 | I668: WILLIAMS 3 | L668: WHITE 2 | N668: THOMPSON | Q668: HOLDEN
A669: PORT MELBOURNE | C669: FULTON 3 | F669: KEATING 3 | I669: FAIRWEATHER | L669: EASTMUIR | N669: JEFFERS | Q669: GOSS
A671: YARRAVILLE | C671: 4 | D671: 4 | E671: =C671*6+D671 -> 28 | G671: 5 | H671: 5 | I671: =G671*6+H671 -> 35 | K671: 6 | L671: 8 | M671: =K671*6+L671 -> 44 | O671: 9 | P671: 14 | Q671: =O671*6+P671 -> 68 | S671: YARRAVILLE
A672: WILLIAMSTOWN | C672: 3 | D672: 1 | E672: =C672*6+D672 -> 19 | G672: 4 | H672: 6 | I672: =G672*6+H672 -> 30 | K672: 4 | L672: 8 | M672: =K672*6+L672 -> 32 | O672: 5 | P672: 12 | Q672: =O672*6+P672 -> 42 | S672: WALKER
A673: BEST PLAYERS
A674: YARRAVILLE | C674: WEDGWOOD | F674: STREETER | I674: TURNER | L674: ELLIS | O674: RAWSON | Q674: BOGIE
A675: WILLIAMSTOWN | C675: BROOKS | F675: RAE | I675: HIRD | L675: LAWLER | O675: PATERSON | Q675: CUTTING
A676: GOALKICKERS
A677: YARRAVILLE | C677: WEDGWOOD 3 | F677: RAWSON 3 | I677: McGRATH 2 | L677: TURNER
A678: WILLIAMSTOWN | C678: LAWLER 3 | F678: ROWAN | I678: EARLE
A680: ROUND 13 | E680: 10TH JULY | H680: WEATHER | K680: CLOUDY BUT FINE STRONG NORTH WIND | S680: PLAYED AT
D681: 1ST QTR | H681: 2ND QTR | L681: 3RD QTR | P681: FINAL | S681: NORTHCOTE
A682: BRUNSWICK | C682: 6 | D682: 3 | E682: =C682*6+D682 -> 39 | G682: 6 | H682: 7 | I682: =G682*6+H682 -> 43 | K682: 10 | L682: 10 | M682: =K682*6+L682 -> 70 | O682: 12 | P682: 16 | Q682: =O682*6+P682 -> 88 | S682: UMPIRE | X682: LADDER | AB682: ROUND | AD682: 13
A683: NORTHCOTE | C683: 1 | D683: 1 | E683: =C683*6+D683 -> 7 | G683: 3 | H683: 1 | I683: =G683*6+H683 -> 19 | K683: 8 | L683: 3 | M683: =K683*6+L683 -> 51 | O683: 9 | P683: 4 | Q683: =O683*6+P683 -> 58 | S683: LEWIS
A684: BEST PLAYERS | W684: TEAM | X684: W | Y684: L | Z684: D | AA684: FOR | AB684: AGST | AC684: % | AD684: PTS
A685: BRUNSWICK | C685: VAUGHAN | F685: WATT | I685: McINNES | K685: FAY | N685: PALMER | Q685: BAILEY
A686: NORTHCOTE | C686: HART | F686: HONIG | I686: GRAY | K686: STEPHENSON | N686: SEYMOUR | Q686: LYNGCOLN | W686: YARRAVILLE | X686: 10 | Y686: 3 | Z686: 0 | AA686: 1154 | AB686: 844 | AC686: 136.72985781990522 | AD686: 40
A687: GOALKICKERS | W687: BRUNSWICK | X687: 10 | Y687: 3 | Z687: 0 | AA687: 1252 | AB687: 999 | AC687: 125.33 | AD687: 40
A688: BRUNSWICK | C688: McGINNES 6 | F688: DOWLING 2 | I688: DONNELLY | L688: McKAY | N688: GILLON | P688: BOYD | W688: PRAHRAN | X688: 9 | Y688: 4 | Z688: 0 | AA688: 1278 | AB688: 1076 | AC688: 118.77 | AD688: 36
A689: NORTHCOTE | C689: O'SHEA 2 | F689: SEYMOUR 2 | I689: HONIG | K689: GRAY | M689: McNAMARA | P689: STEPHENSON | S689: O'KEEFE | W689: NORTHCOTE | X689: 9 | Y689: 4 | Z689: 0 | AA689: 1087 | AB689: 964 | AC689: 112.75933609958506 | AD689: 36
A691: PRAHRAN | C691: 5 | D691: 0 | E691: =C691*6+D691 -> 30 | G691: 10 | H691: 2 | I691: =G691*6+H691 -> 62 | K691: 12 | L691: 2 | M691: =K691*6+L691 -> 74 | O691: 17 | P691: 6 | Q691: =O691*6+P691 -> 108 | S691: TOORAK PARK | W691: BRIGHTON | X691: 9 | Y691: 4 | Z691: 0 | AA691: 1206 | AB691: 1126 | AC691: 107.1 | AD691: 36
A692: YARRAVILLE | C692: 3 | D692: 8 | E692: =C692*6+D692 -> 26 | G692: 3 | H692: 11 | I692: =G692*6+H692 -> 29 | K692: 7 | L692: 20 | M692: =K692*6+L692 -> 62 | O692: 9 | P692: 22 | Q692: =O692*6+P692 -> 76 | S692: STUART | W692: COBURG | X692: 7 | Y692: 6 | Z692: 0 | AA692: 1196 | AB692: 1190 | AC692: 100.5 | AD692: 28
A693: BEST PLAYERS | W693: CAMBERWELL | X693: 7 | Y693: 6 | Z693: 0 | AA693: 1141 | AB693: 1168 | AC693: 97.69 | AD693: 28
A694: PRAHRAN | C694: THOMPSON | F694: KOOP | I694: WHITE | K694: JOHNSON | N694: GRAVELL | Q694: HAWKINS | W694: SANDRINGHAM | X694: 6 | Y694: 7 | Z694: 0 | AA694: 1157 | AB694: 1109 | AC694: 104.32822362488729 | AD694: 24
A695: YARRAVILLE | C695: EVANS | F695: McGRATH | I695: KELLY | K695: RAWSON | N695: PARKS | Q695: FREW | W695: WILLIAMSTOWN | X695: 3 | Y695: 10 | Z695: 0 | AA695: 970 | AB695: 1109 | AC695: 81.58 | AD695: 12
A696: GOALKICKERS | L696: WHITE | O696: GRANDISON | R696: YOUNG | W696: PRESTON | X696: 3 | Y696: 10 | Z696: 0 | AA696: 1013 | AB696: 1190 | AC696: 85.12605042016807 | AD696: 12
A697: PRAHRAN | C697: BRENCHLEY 3 | F697: HAWKINS 3 | I697: GRAVELL 2 | L697: WILLIAMS 2 | O697: THOMPSON 2 | R697: BAKER 2 | W697: PORT MELBOURNE | X697: 3 | Y697: 10 | Z697: 0 | AA697: 919 | AB697: 1250 | AC697: 73.52 | AD697: 12
A698: YARRAVILLE | C698: McGRATH 3 | F698: RAWSON 3 | I698: KELLY 2 | L698: WEDGWOOD | W698: OAKLEIGH | X698: 2 | Y698: 11 | Z698: 0 | AA698: 1033 | AB698: 1381 | AC698: 74.80086893555395 | AD698: 8
A700: CAMBERWELL | C700: 3 | D700: 3 | E700: =C700*6+D700 -> 21 | G700: 4 | H700: 4 | I700: =G700*6+H700 -> 28 | K700: 15 | L700: 9 | M700: =K700*6+L700 -> 99 | O700: 15 | P700: 14 | Q700: =O700*6+P700 -> 104 | S700: COBURG
A701: COBURG | C701: 1 | D701: 0 | E701: =C701*6+D701 -> 6 | G701: 7 | H701: 5 | I701: =G701*6+H701 -> 47 | K701: 7 | L701: 7 | M701: =K701*6+L701 -> 49 | O701: 13 | P701: 14 | Q701: =O701*6+P701 -> 92 | S701: LEWER
A702: BEST PLAYERS
A703: CAMBERWELL | C703: MEEHAN | F703: GRIFFITHS | I703: WALKER | L703: SEELENMEYER | O703: A DAVIDSON | R703: HORKINGS
A704: COBURG | C704: ANDERSON | F704: JORDAN | I704: LA FRANCHI | L704: GAUDION | O704: LEONARD | R704: EBBAGE
A705: GOALKICKERS
A706: CAMBERWELL | C706: GRIFFITHS 6 | F706: H DAVIDSON 2 | I706: A DAVIDSON 2 | L706: TATHAM 2 | N706: WILSON | P706: WILLIAMS | R706: BOAG
A707: COBURG | C707: COLLINS 5 | F707: BERRYMAN 2 | I707: LA FRANCHI 2 | L707: WHITFIELD 2 | O707: LEAHY | Q707: GAUDION
A709: SANDRINGHAM | C709: 6 | D709: 3 | E709: =C709*6+D709 -> 39 | G709: 7 | H709: 4 | I709: =G709*6+H709 -> 46 | K709: 14 | L709: 9 | M709: =K709*6+L709 -> 93 | O709: 16 | P709: 12 | Q709: =O709*6+P709 -> 108 | S709: BEACH ROAD
A710: PORT MELBOURNE | C710: 0 | D710: 3 | E710: =C710*6+D710 -> 3 | G710: 4 | H710: 9 | I710: =G710*6+H710 -> 33 | K710: 5 | L710: 9 | M710: =K710*6+L710 -> 39 | O710: 8 | P710: 16 | Q710: =O710*6+P710 -> 64 | S710: GLOVER
A711: BEST PLAYERS
A712: SANDRINGHAM | C712: MITCHELL | F712: STAPLETON | I712: SAUNDERS | L712: FISHER | O712: McCOY | R712: GILLIGAN
A713: PORT MELBOURNE | C713: DOBSON | F713: CROMPTON | I713: GARBUTT | L713: KEATING | O713: FORREST | R713: CRITCH
A714: GOALKICKERS
A715: SANDRINGHAM | C715: FISHER 5 | F715: WEBER 4 | I715: FREY 2 | K715: CARTWRIGHT 2 | O715: McCOMB | Q715: TOLSON | S715: SUTTON
A716: PORT MELBOURNE | C716: GOMEZ 4 | F716: KEATING | I716: FORREST | K716: CROMPTON | N716: FAIRWEATHER
A718: WILLIAMSTOWN | C718: 4 | D718: 4 | E718: =C718*6+D718 -> 28 | G718: 4 | H718: 6 | I718: =G718*6+H718 -> 30 | K718: 8 | L718: 12 | M718: =K718*6+L718 -> 60 | O718: 10 | P718: 14 | Q718: =O718*6+P718 -> 74 | S718: WILLIAMSTOWN
A719: PRESTON | C719: 0 | D719: 1 | E719: =C719*6+D719 -> 1 | G719: 1 | H719: 5 | I719: =G719*6+H719 -> 11 | K719: 3 | L719: 5 | M719: =K719*6+L719 -> 23 | O719: 5 | P719: 5 | Q719: =O719*6+P719 -> 35 | S719: CLAYTON
A720: BEST PLAYERS
A721: WILLIAMSTOWN | C721: LAWLER | F721: HARLAND | I721: WILLETT | L721: PATERSON | O721: McINTYRE | R721: KAUFMAN
A722: PRESTON | C722: BEAGLEY | F722: MASLEN | I722: CLARKE | L722: JOB | O722: CONSTANCE | R722: HASKETT
A723: GOALKICKERS
A724: WILLIAMSTOWN | C724: LAWLER 5 | F724: KAUFMAN 2 | I724: PATERSON | L724: HOSKING | O724: ROBERTSON
A725: PRESTON | C725: WALSH 2 | F725: MASLEN | I725: WILKINS | L725: GILBERT
A727: BRIGHTON | C727: 3 | D727: 2 | E727: =C727*6+D727 -> 20 | G727: 4 | H727: 8 | I727: =G727*6+H727 -> 32 | K727: 7 | L727: 13 | M727: =K727*6+L727 -> 55 | O727: 11 | P727: 18 | Q727: =O727*6+P727 -> 84 | S727: OAKLEIGH
A728: OAKLEIGH | C728: 3 | D728: 4 | E728: =C728*6+D728 -> 22 | G728: 5 | H728: 6 | I728: =G728*6+H728 -> 36 | K728: 7 | L728: 9 | M728: =K728*6+L728 -> 51 | O728: 9 | P728: 11 | Q728: =O728*6+P728 -> 65 | S728: GREGORY
A729: BEST PLAYERS
A730: BRIGHTON | C730: GOULLET | F730: CONNELL | I730: HINDSON | L730: EGAN | O730: WEBER | R730: BOLWELL
A731: OAKLEIGH | C731: BICKERTON | F731: WILLIAMS | I731: NOLAN | L731: CORP | O731: WATSON | R731: CRAMERI
A732: GOALKICKERS
A733: BRIGHTON | C733: BOLWELL 3 | F733: NIVEN 2 | I733: RECHTER 2 | L733: FITCHER 2 | N733: MILLER | P733: HONE
A734: OAKLEIGH | C734: NOLAN 4 | F734: CRAMERI 2 | I734: KENNEDY | L734: HEINTZ | N734: HARRISON
A736: ROUND 14 | E736: 17TH JULY | H736: WEATHER | K736: CLOUDY SOME SHOWERS STRONG N.W. WIND | S736: PLAYED AT
D737: 1ST QTR | H737: 2ND QTR | L737: 3RD QTR | P737: FINAL | S737: BRUNSWICK
A738: BRUNSWICK | C738: 5 | D738: 7 | E738: =C738*6+D738 -> 37 | G738: 7 | H738: 9 | I738: =G738*6+H738 -> 51 | K738: 9 | L738: 12 | M738: =K738*6+L738 -> 66 | O738: 12 | P738: 15 | Q738: =O738*6+P738 -> 87 | S738: UMPIRE | X738: LADDER | AB738: ROUND | AD738: 14
A739: YARRAVILLE | C739: 0 | D739: 1 | E739: =C739*6+D739 -> 1 | G739: 4 | H739: 2 | I739: =G739*6+H739 -> 26 | K739: 4 | L739: 4 | M739: =K739*6+L739 -> 28 | O739: 7 | P739: 6 | Q739: =O739*6+P739 -> 48 | S739: LEWIS
A740: BEST PLAYERS | W740: TEAM | X740: W | Y740: L | Z740: D | AA740: FOR | AB740: AGST | AC740: % | AD740: PTS
A741: BRUNSWICK | C741: McELROY | F741: FAY | I741: BOYD | K741: VAUGHAN | N741: DOWLING | Q741: CLARKE
A742: YARRAVILLE | C742: WEDGWOOD | F742: PARKS | I742: KENNY | K742: PETERS | N742: EVANS | Q742: McGRATH | W742: BRUNSWICK | X742: 11 | Y742: 3 | Z742: 0 | AA742: 1339 | AB742: 1047 | AC742: 127.89 | AD742: 44
A743: GOALKICKERS | W743: YARRAVILLE | X743: 10 | Y743: 4 | Z743: 0 | AA743: 1202 | AB743: 931 | AC743: 129.10848549946294 | AD743: 40
A744: BRUNSWICK | C744: McELROY 4 | F744: McINNES 4 | I744: DOWLING | K744: CRAWFORD | N744: BAILEY | P744: McKAY | W744: PRAHRAN | X744: 10 | Y744: 4 | Z744: 0 | AA744: 1382 | AB744: 1161 | AC744: 119.04 | AD744: 40
A745: YARRAVILLE | C745: TURNER 2 | F745: CASHMAN | I745: EVANS | K745: WEDGWOOD | N745: KELLY | P745: McGRATH | W745: BRIGHTON | X745: 10 | Y745: 4 | Z745: 0 | AA745: 1299 | AB745: 1180 | AC745: 110.08 | AD745: 40
A747: PRAHRAN | C747: 7 | D747: 4 | E747: =C747*6+D747 -> 46 | G747: 8 | H747: 14 | I747: =G747*6+H747 -> 62 | K747: 14 | L747: 14 | M747: =K747*6+L747 -> 98 | O747: 15 | P747: 14 | Q747: =O747*6+P747 -> 104 | S747: CAMBERWELL | W747: NORTHCOTE | X747: 9 | Y747: 5 | Z747: 0 | AA747: 1151 | AB747: 1029 | AC747: 111.85617103984451 | AD747: 36
A748: CAMBERWELL | C748: 0 | D748: 1 | E748: =C748*6+D748 -> 1 | G748: 6 | H748: 8 | I748: =G748*6+H748 -> 44 | K748: 8 | L748: 10 | M748: =K748*6+L748 -> 58 | O748: 13 | P748: 17 | Q748: =O748*6+P748 -> 95 | S748: CLAYTON | W748: SANDRINGHAM | X748: 7 | Y748: 7 | Z748: 0 | AA748: 1222 | AB748: 1173 | AC748: 104.17732310315431 | AD748: 28
A749: BEST PLAYERS | W749: COBURG | X749: 7 | Y749: 7 | Z749: 0 | AA749: 1268 | AB749: 1274 | AC749: 99.53 | AD749: 28
A750: PRAHRAN | C750: BAKER | F750: WHITE | I750: GRAVELL | L750: GRANDISON | O750: JOHNSON | Q750: LOWRY | W750: CAMBERWELL | X750: 7 | Y750: 7 | Z750: 0 | AA750: 1226 | AB750: 1272 | AC750: 96.38 | AD750: 28
A751: CAMBERWELL | C751: MEEHAN | F751: A DAVIDSON | I751: H DAVIDSON | L751: HUNTER | O751: WILLIAMS | Q751: FINLAYSON | W751: PORT MELBOURNE | X751: 4 | Y751: 10 | Z751: 0 | AA751: 1010 | AB751: 1306 | AC751: 77.34 | AD751: 16
A752: GOALKICKERS | W752: WILLIAMSTOWN | X752: 3 | Y752: 11 | Z752: 0 | AA752: 1024 | AB752: 1202 | AC752: 85.19 | AD752: 12
A753: PRAHRAN | C753: GRANDISON 3 | F753: HAWKINS 3 | I753: BAKER 3 | K753: GRAVELL 2 | N753: WHITE 2 | P753: THOMPSON | R753: BRENCHLEY | W753: PRESTON | X753: 3 | Y753: 11 | Z753: 0 | AA753: 1069 | AB753: 1281 | AC753: 83.45 | AD753: 12
A754: CAMBERWELL | C754: GRIFFITHS 3 | F754: H DAVIDSON 2 | I754: A DAVIDSON 2 | L754: MEEHAN 2 | N754: WILSON 2 | Q754: WILLIAMS | T754: ONLEY | W754: OAKLEIGH | X754: 3 | Y754: 11 | Z754: 0 | AA754: 1117 | AB754: 1453 | AC754: 76.875430144528565 | AD754: 12
A756: SANDRINGHAM | C756: 0 | D756: 0 | E756: =C756*6+D756 -> 0 | G756: 4 | H756: 2 | I756: =G756*6+H756 -> 26 | K756: 4 | L756: 3 | M756: =K756*6+L756 -> 27 | O756: 10 | P756: 5 | Q756: =O756*6+P756 -> 65 | S756: BEACH ROAD
A757: NORTHCOTE | C757: 3 | D757: 2 | E757: =C757*6+D757 -> 20 | G757: 3 | H757: 2 | I757: =G757*6+H757 -> 20 | K757: 8 | L757: 10 | M757: =K757*6+L757 -> 58 | O757: 9 | P757: 10 | Q757: =O757*6+P757 -> 64 | S757: LESTER
A758: BEST PLAYERS
A759: SANDRINGHAM | C759: CARTWRIGHT | F759: SUTTON | I759: SAUNDERS | L759: STAPLETON | O759: FOSTER | R759: MEEHAN
A760: NORTHCOTE | C760: HONIG | F760: HART | I760: O'SHEA | L760: HOLDEN | O760: POWELL | R760: MEITZCKE
A761: GOALKICKERS
A762: SANDRINGHAM | C762: FISHER 3 | F762: CARTWRIGHT 2 | J762: WEBER 2 | M762: MITCHELL | O762: FREY | Q762: TOLSON
A763: NORTHCOTE | C763: C ROSS 3 | F763: SEYMOUR 2 | I763: HART | K763: O'SHEA | M763: SIMMONDS | P763: HONIG
A765: BRIGHTON | C765: 5 | D765: 10 | E765: =C765*6+D765 -> 40 | G765: 6 | H765: 14 | I765: =G765*6+H765 -> 50 | K765: 11 | L765: 18 | M765: =K765*6+L765 -> 84 | O765: 12 | P765: 21 | Q765: =O765*6+P765 -> 93 | S765: ELSTERNWICK PARK
A766: WILLIAMSTOWN | C766: 0 | D766: 0 | E766: =C766*6+D766 -> 0 | G766: 3 | H766: 7 | I766: =G766*6+H766 -> 25 | K766: 3 | L766: 9 | M766: =K766*6+L766 -> 27 | O766: 6 | P766: 18 | Q766: =O766*6+P766 -> 54 | S766: GLOVER
A767: BEST PLAYERS
A768: BRIGHTON | C768: DEANE | E768: GOULLET | H768: PENNY | K768: WEBER | N768: HALLAHAN | Q768: CONDON
A769: WILLIAMSTOWN | C769: CUTTING | E769: PATERSON | H769: RAE | K769: HUGGINS | N769: LAWLER | Q769: BROOKS
A770: GOALKICKERS
A771: BRIGHTON | C771: PENNY 3 | F771: HONE 3 | H771: DEANE 2 | J771: NIVEN 2 | L771: BAKER 2
A772: WILLIAMSTOWN | C772: LAWLER 3 | F772: ROWAN 2 | I772: DELLER
A774: PORT MELBOURNE | C774: 7 | D774: 6 | E774: =C774*6+D774 -> 48 | G774: 8 | H774: 11 | I774: =G774*6+H774 -> 59 | K774: 11 | L774: 15 | M774: =K774*6+L774 -> 81 | O774: 12 | P774: 19 | Q774: =O774*6+P774 -> 91 | S774: PORT MELBOURNE
A775: PRESTON | C775: 2 | D775: 0 | E775: =C775*6+D775 -> 12 | G775: 4 | H775: 1 | I775: =G775*6+H775 -> 25 | K775: 7 | L775: 4 | M775: =K775*6+L775 -> 46 | O775: 8 | P775: 8 | Q775: =O775*6+P775 -> 56 | S775: GREGORY
A776: BEST PLAYERS
A777: PORT MELBOURNE | C777: CROMPTON | F777: O'LEARY | I777: ALSOP | L777: JULIER | O777: EASTMUIR | R777: WOODS
A778: PRESTON | C778: HASKETT | F778: JONES | I778: MURRAY | L778: WALSH | O778: MASLEN | R778: BEAGLEY
A779: GOALKICKERS
A780: PORT MELBOURNE | C780: CROMPTON 5 | F780: FAIRWEATHER 3 | J780: GOSS 3 | L780: FORREST
A781: PRESTON | C781: LATHAM 2 | F781: WALKER 2 | I781: GILBERT 2 | K781: MURRAY | M781: BEAGLEY
A783: OAKLEIGH | C783: 1 | D783: 2 | E783: =C783*6+D783 -> 8 | G783: 4 | H783: 6 | I783: =G783*6+H783 -> 30 | K783: 6 | L783: 8 | M783: =K783*6+L783 -> 44 | O783: 12 | P783: 12 | Q783: =O783*6+P783 -> 84 | S783: OAKLEIGH
A784: COBURG | C784: 3 | D784: 4 | E784: =C784*6+D784 -> 22 | G784: 5 | H784: 8 | I784: =G784*6+H784 -> 38 | K784: 7 | L784: 15 | M784: =K784*6+L784 -> 57 | O784: 9 | P784: 18 | Q784: =O784*6+P784 -> 72 | S784: STUART
A785: BEST PLAYERS
A786: OAKLEIGH | C786: WATSON | F786: HARRISON | I786: BICKERTON | L786: SMITH | O786: CORP | Q786: CRAMERI
A787: COBURG | C787: LA FRANCHI | F787: HENNING | I787: REVILLE | L787: WHITFIELD | O787: COLLINS | Q787: GARRICK
A788: GOALKICKERS
A789: OAKLEIGH | C789: NOLAN 4 | F789: HARRISON 4 | I789: HEINTZ 2 | K789: WITHERS 2
A790: COBURG | C790: LEAHY 2 | F790: LA FRANCHI 2 | I790: LEONARD 2 | L790: COLLINS | N790: REVILLE | P790: GARRICK
A792: ROUND 15 | E792: 24TH JULY | J792: WEATHER | M792: COOL CLOUDY S.W. WIND | S792: PLAYED AT
D793: 1ST QTR | H793: 2ND QTR | L793: 3RD QTR | P793: FINAL | S793: TOORAK PARK
A794: BRIGHTON | C794: 3 | D794: 2 | E794: =C794*6+D794 -> 20 | G794: 8 | H794: 6 | I794: =G794*6+H794 -> 54 | K794: 10 | L794: 8 | M794: =K794*6+L794 -> 68 | O794: 13 | P794: 11 | Q794: =O794*6+P794 -> 89 | S794: UMPIRE | X794: LADDER | AB794: ROUND | AD794: 15
A795: PRAHRAN | C795: 4 | D795: 9 | E795: =C795*6+D795 -> 33 | G795: 5 | H795: 11 | I795: =G795*6+H795 -> 41 | K795: 9 | L795: 19 | M795: =K795*6+L795 -> 73 | O795: 11 | P795: 21 | Q795: =O795*6+P795 -> 87 | S795: LEWIS
A796: BEST PLAYERS | W796: TEAM | X796: W | Y796: L | Z796: D | AA796: FOR | AB796: AGST | AC796: % | AD796: PTS
A797: BRIGHTON | C797: DEANE | E797: WILLIAMSON | H797: PENNY | K797: SULLIVAN | N797: NIVEN | Q797: FITCHER
A798: PRAHRAN | C798: LOWRY | E798: WHITE | H798: BRENCHLEY | K798: WILLIAMS | N798: THOMPSON | Q798: KOOP | W798: BRUNSWICK | X798: 12 | Y798: 3 | Z798: 0 | AA798: 1426 | AB798: 1107 | AC798: 128.82 | AD798: 48
A799: GOALKICKERS | W799: YARRAVILLE | X799: 11 | Y799: 4 | Z799: 0 | AA799: 1309 | AB799: 1002 | AC799: 130.63872255489022 | AD799: 44
A800: BRIGHTON | C800: DEAN 3 | E800: SULLIVAN 3 | H800: NIVEN 2 | J800: MILLER 2 | M800: PENNY | O800: BAKER | Q800: BOLWELL | W800: BRIGHTON | X800: 11 | Y800: 4 | Z800: 0 | AA800: 1388 | AB800: 1267 | AC800: 109.55 | AD800: 44
A801: PRAHRAN | C801: WHITE 3 | E801: HAWKINS 3 | H801: BRENCHLEY 2 | K801: THOMPSON | N801: WILLIAMS | Q801: GRANDISON | W801: NORTHCOTE | X801: 10 | Y801: 5 | Z801: 0 | AA801: 1283 | AB801: 1085 | AC801: 118.24884792626727 | AD801: 40
A803: YARRAVILLE | C803: 3 | D803: 3 | E803: =C803*6+D803 -> 21 | G803: 9 | H803: 11 | I803: =G803*6+H803 -> 65 | K803: 10 | L803: 13 | M803: =K803*6+L803 -> 73 | O803: 15 | P803: 17 | Q803: =O803*6+P803 -> 107 | S803: YARRAVILLE | W803: PRAHRAN | X803: 10 | Y803: 5 | Z803: 0 | AA803: 1469 | AB803: 1250 | AC803: 117.52 | AD803: 40
A804: CAMBERWELL | C804: 2 | D804: 6 | E804: =C804*6+D804 -> 18 | G804: 2 | H804: 7 | I804: =G804*6+H804 -> 19 | K804: 7 | L804: 14 | M804: =K804*6+L804 -> 56 | O804: 9 | P804: 17 | Q804: =O804*6+P804 -> 71 | S804: LESTER | W804: COBURG | X804: 8 | Y804: 7 | Z804: 0 | AA804: 1367 | AB804: 1349 | AC804: 101.33 | AD804: 32
A805: BEST PLAYERS | W805: SANDRINGHAM | X805: 7 | Y805: 8 | Z805: 0 | AA805: 1268 | AB805: 1247 | AC805: 101.68404170008019 | AD805: 28
A806: YARRAVILLE | C806: WEDGWOOD | F806: McGRATH | I806: RAWSON | L806: EVANS | N806: CASHMAN | Q806: PETERS | W806: CAMBERWELL | X806: 7 | Y806: 8 | Z806: 0 | AA806: 1297 | AB806: 1379 | AC806: 94.05 | AD806: 28
A807: CAMBERWELL | C807: HORKINGS | F807: FINLAYSON | I807: WILLIAMS | L807: MEEHAN | N807: BRETT | Q807: SEELENMEYER | W807: WILLIAMSTOWN | X807: 4 | Y807: 11 | Z807: 0 | AA807: 1098 | AB807: 1248 | AC807: 87.98 | AD807: 16
A808: GOALKICKERS | R808: TORRENS | W808: PORT MELBOURNE | X808: 4 | Y808: 11 | Z808: 0 | AA808: 1085 | AB808: 1405 | AC808: 77.22 | AD808: 16
A809: YARRAVILLE | C809: McGRATH 4 | F809: WEDGWOOD 2 | I809: CASHMAN 2 | L809: RAWSON 2 | N809: TURNER 2 | Q809: PENNY | S809: EVANS | W809: PRESTON | X809: 3 | Y809: 12 | Z809: 0 | AA809: 1129 | AB809: 1368 | AC809: 82.53 | AD809: 12
A810: CAMBERWELL | C810: TATHAM 4 | F810: YOUL 2 | H810: WILLIAMS 2 | K810: GRIFFITHS | W810: OAKLEIGH | X810: 3 | Y810: 12 | Z810: 0 | AA810: 1173 | AB810: 1585 | AC810: 74.00630914826499 | AD810: 12
A812: COBURG | C812: 4 | D812: 4 | E812: =C812*6+D812 -> 28 | G812: 6 | H812: 7 | I812: =G812*6+H812 -> 43 | K812: 10 | L812: 13 | M812: =K812*6+L812 -> 73 | O812: 14 | P812: 15 | Q812: =O812*6+P812 -> 99 | S812: COBURG
A813: PORT MELBOURNE | C813: 1 | D813: 2 | E813: =C813*6+D813 -> 8 | G813: 4 | H813: 7 | I813: =G813*6+H813 -> 31 | K813: 6 | L813: 9 | M813: =K813*6+L813 -> 45 | O813: 10 | P813: 15 | Q813: =O813*6+P813 -> 75 | S813: GREGORY
A814: BEST PLAYERS
A815: COBURG | C815: COLLINS | F815: SCANLON | I815: LA FRANCHI | L815: HENNING | O815: ANDERSON | R815: ELLAWAY
A816: PORT MELBOURNE | C816: KEATING | F816: CROMPTON | I816: JULIER | L816: McBETH | O816: FAIRWEATHER | R816: WOODS
A817: GOALKICKERS
A818: COBURG | C818: COLLINS 3 | F818: WHITFIELD 3 | I818: LEAHY 2 | K818: RALSTON 2 | N818: BROOM 2 | Q818: ELLAWAY | T818: LA FRANCHI
A819: PORT MELBOURNE | C819: KEATING 2 | F819: FAIRWEATHER 2 | J819: CROMPTON | M819: EASTMUIR | O819: SIMMONS | Q819: O'LEARY | T819: FORREST | W819: WOODS
A821: WILLIAMSTOWN | C821: 1 | D821: 1 | E821: =C821*6+D821 -> 7 | G821: 5 | H821: 5 | I821: =G821*6+H821 -> 35 | K821: 7 | L821: 7 | M821: =K821*6+L821 -> 49 | O821: 11 | P821: 8 | Q821: =O821*6+P821 -> 74 | S821: WILLIAMSTOWN
A822: SANDRINGHAM | C822: 3 | D822: 1 | E822: =C822*6+D822 -> 19 | G822: 4 | H822: 2 | I822: =G822*6+H822 -> 26 | K822: 5 | L822: 7 | M822: =K822*6+L822 -> 37 | O822: 6 | P822: 10 | Q822: =O822*6+P822 -> 46 | S822: APPLEBY
A823: BEST PLAYERS
A824: WILLIAMSTOWN | C824: BROOKS | F824: HARLAND | J824: TYRELL | M824: RAE | P824: LAWLER | S824: PATERSON
A825: SANDRINGHAM | C825: FOSTER | F825: MITCHELL | J825: McCOMB | M825: TOLSON | P825: MEEHAN | S825: CARTWRIGHT
A826: GOALKICKERS
A827: WILLIAMSTOWN | C827: LAWLER 4 | F827: ROBERTSON 2 | I827: MILLER | K827: DELLER | M827: PATERSON | P827: KAUFMAN | R827: GREEN
A828: SANDRINGHAM | C828: CARTWRIGHT 2 | G828: FOSTER | I828: McCOMB | K828: TOLSON | M828: WEBER
A830: NORTHCOTE | C830: 6 | D830: 2 | E830: =C830*6+D830 -> 38 | G830: 10 | H830: 7 | I830: =G830*6+H830 -> 67 | K830: 14 | L830: 14 | M830: =K830*6+L830 -> 98 | O830: 19 | P830: 18 | Q830: =O830*6+P830 -> 132 | S830: NORTHCOTE
A831: OAKLEIGH | C831: 3 | D831: 1 | E831: =C831*6+D831 -> 19 | G831: 4 | H831: 4 | I831: =G831*6+H831 -> 28 | K831: 5 | L831: 6 | M831: =K831*6+L831 -> 36 | O831: 8 | P831: 8 | Q831: =O831*6+P831 -> 56 | S831: STUART
A832: BEST PLAYERS
A833: NORTHCOTE | C833: SIMPSON | F833: WEGNER | I833: MEITZCKE | L833: SEYMOUR | O833: O'SHEA | Q833: ROSS
A834: OAKLEIGH | C834: BICKERTON | F834: CAMPBELL | I834: WILLIAMS | L834: HARRISON | O834: WATSON | Q834: D RYAN
A835: GOALKICKERS
A836: NORTHCOTE | C836: THORNE 5 | F836: O'SHEA 5 | I836: SEYMOUR 4 | L836: SIMPSON 3 | O836: ROSS | Q836: WEGNER
A837: OAKLEIGH | C837: NOLAN 3 | F837: HARRISON 2 | I837: WATSON | K837: HEINTZ | M837: CRAMERI
A839: BRUNSWICK | C839: 5 | D839: 4 | E839: =C839*6+D839 -> 34 | G839: 7 | H839: 6 | I839: =G839*6+H839 -> 48 | K839: 10 | L839: 12 | M839: =K839*6+L839 -> 72 | O839: 12 | P839: 15 | Q839: =O839*6+P839 -> 87 | S839: PRESTON
A840: PRESTON | C840: 0 | D840: 4 | E840: =C840*6+D840 -> 4 | G840: 4 | H840: 7 | I840: =G840*6+H840 -> 31 | K840: 5 | L840: 8 | M840: =K840*6+L840 -> 38 | O840: 8 | P840: 12 | Q840: =O840*6+P840 -> 60 | S840: GLOVER
A841: BEST PLAYERS
A842: BRUNSWICK | C842: DOWLING | F842: FAY | I842: QUINN | L842: CLARKE | O842: TURNER | R842: McKERNAN
A843: PRESTON | C843: JONES | F843: MURRAY | I843: DOWLING | L843: GILBERT | O843: LATHAM | R843: BEAGLEY
A844: GOALKICKERS
A845: BRUNSWICK | C845: McINNES 5 | F845: BOYD 2 | I845: GILLON 2 | K845: McELROY | M845: TOONE | O845: DAVIS
A846: PRESTON | C846: LATHAM 3 | F846: MURRAY 3 | I846: GILBERT 2
A848: ROUND 16 | E848: 31ST JULY | J848: WEATHER | M848: CLOUDY NORTH WIND | S848: PLAYED AT
D849: 1ST QTR | H849: 2ND QTR | L849: 3RD QTR | P849: FINAL | S849: ELSTERNWICK PARK
A850: BRIGHTON | C850: 3 | D850: 4 | E850: =C850*6+D850 -> 22 | G850: 4 | H850: 4 | I850: =G850*6+H850 -> 28 | K850: 8 | L850: 12 | M850: =K850*6+L850 -> 60 | O850: 9 | P850: 14 | Q850: =O850*6+P850 -> 68 | S850: UMPIRE | X850: LADDER | AB850: ROUND | AD850: 16
A851: YARRAVILLE | C851: 0 | D851: 0 | E851: =C851*6+D851 -> 0 | G851: 5 | H851: 9 | I851: =G851*6+H851 -> 39 | K851: 7 | L851: 10 | M851: =K851*6+L851 -> 52 | O851: 9 | P851: 13 | Q851: =O851*6+P851 -> 67 | S851: LEWIS
A852: BEST PLAYERS | W852: TEAM | X852: W | Y852: L | Z852: D | AA852: FOR | AB852: AGST | AC852: % | AD852: PTS
A853: BRIGHTON | C853: PENNY | F853: GEORGE | I853: WEBER | L853: BOLWELL | N853: HALLAHAN | Q853: BAKER
A854: YARRAVILLE | C854: McGRATH | F854: PARKS | I854: WEDGWOOD | L854: KELLY | N854: STREETER | Q854: EVANS | W854: BRUNSWICK | X854: 12 | Y854: 4 | Z854: 0 | AA854: 1486 | AB854: 1182 | AC854: 125.72 | AD854: 48
A855: GOALKICKERS | W855: BRIGHTON | X855: 12 | Y855: 4 | Z855: 0 | AA855: 1456 | AB855: 1334 | AC855: 109.15 | AD855: 48
A856: BRIGHTON | C856: BOLWELL 3 | F856: NIVEN | H856: DEAN | J856: MILLER | L856: GOULLET | N856: SULLIVAN | Q856: CONNELL | W856: YARRAVILLE | X856: 11 | Y856: 5 | Z856: 0 | AA856: 1376 | AB856: 1070 | AC856: 128.5981308411215 | AD856: 44
A857: YARRAVILLE | C857: McGRATH 4 | F857: CASHMAN 2 | I857: TORRENS | K857: EVANS | M857: PENNY | W857: PRAHRAN | X857: 11 | Y857: 5 | Z857: 0 | AA857: 1557 | AB857: 1320 | AC857: 117.95 | AD857: 44
A859: COBURG | C859: 3 | D859: 9 | E859: =C859*6+D859 -> 27 | G859: 5 | H859: 12 | I859: =G859*6+H859 -> 42 | K859: 8 | L859: 20 | M859: =K859*6+L859 -> 68 | O859: 11 | P859: 21 | Q859: =O859*6+P859 -> 87 | S859: COBURG | W859: NORTHCOTE | X859: 10 | Y859: 6 | Z859: 0 | AA859: 1353 | AB859: 1172 | AC859: 115.44368600682594 | AD859: 40
A860: NORTHCOTE | C860: 0 | D860: 1 | E860: =C860*6+D860 -> 1 | G860: 6 | H860: 1 | I860: =G860*6+H860 -> 37 | K860: 9 | L860: 3 | M860: =K860*6+L860 -> 57 | O860: 11 | P860: 4 | Q860: =O860*6+P860 -> 70 | S860: STUART | W860: COBURG | X860: 9 | Y860: 7 | Z860: 0 | AA860: 1454 | AB860: 1419 | AC860: 102.47 | AD860: 36
A861: BEST PLAYERS | W861: SANDRINGHAM | X861: 7 | Y861: 9 | Z861: 0 | AA861: 1338 | AB861: 1335 | AC861: 100.2247191011236 | AD861: 28
A862: COBURG | C862: JORDAN | F862: COLLINS | I862: LA FRANCHI | L862: MARTYN | N862: HENNING | Q862: HILL | W862: CAMBERWELL | X862: 7 | Y862: 9 | Z862: 0 | AA862: 1390 | AB862: 1477 | AC862: 94.11 | AD862: 28
A863: NORTHCOTE | C863: O'SHEA | F863: SIMPSON | I863: MEITZCKE | L863: HART | N863: McINERNEY | Q863: WEGNER | W863: PORT MELBOURNE | X863: 5 | Y863: 11 | Z863: 0 | AA863: 1160 | AB863: 1465 | AC863: 79.18 | AD863: 20
A864: GOALKICKERS | W864: WILLIAMSTOWN | X864: 4 | Y864: 12 | Z864: 0 | AA864: 1177 | AB864: 1370 | AC864: 85.91 | AD864: 16
A865: COBURG | C865: COLLINS 3 | F865: IRVINE 2 | I865: HILL 2 | K865: SCANLON | M865: LEAHY | O865: BROOM | Q865: MARTYN | W865: PRESTON | X865: 4 | Y865: 12 | Z865: 0 | AA865: 1227 | AB865: 1461 | AC865: 83.98 | AD865: 16
A866: NORTHCOTE | C866: THORNE 3 | F866: O'KEEFE 2 | I866: STEPHENSON 2 | L866: SIMPSON 2 | N866: O'SHEA | P866: McNAMARA | W866: OAKLEIGH | X866: 4 | Y866: 12 | Z866: 0 | AA866: 1295 | AB866: 1664 | AC866: 77.824519230769226 | AD866: 16
A868: PRAHRAN | C868: 1 | D868: 3 | E868: =C868*6+D868 -> 9 | G868: 9 | H868: 7 | I868: =G868*6+H868 -> 61 | K868: 10 | L868: 7 | M868: =K868*6+L868 -> 67 | O868: 12 | P868: 16 | Q868: =O868*6+P868 -> 88 | S868: BEACH ROAD
A869: SANDRINGHAM | C869: 5 | D869: 3 | E869: =C869*6+D869 -> 33 | G869: 5 | H869: 5 | I869: =G869*6+H869 -> 35 | K869: 8 | L869: 8 | M869: =K869*6+L869 -> 56 | O869: 10 | P869: 10 | Q869: =O869*6+P869 -> 70 | S869: LESTER
A870: BEST PLAYERS
A871: PRAHRAN | C871: THOMPSON | F871: WHITE | I871: KOOP | L871: FLEMING | O871: BOURNE | R871: BRENCHLEY
A872: SANDRINGHAM | C872: CARTWRIGHT | F872: MEEHAN | I872: GILLIGAN | L872: McCOY | O872: TOLSON | R872: FOSTER
A873: GOALKICKERS
A874: PRAHRAN | C874: THOMPSON 4 | F874: BRENCHLEY 3 | I874: BAKER 2 | K874: WHITE 2 | M874: HAWKINS
A875: SANDRINGHAM | C875: McCOMB 2 | F875: TOLSON 2 | I875: WEBER 2 | K875: FOSTER | M875: FREY | O875: SUTTON | Q875: CARTWRIGHT
A877: PRESTON | C877: 8 | D877: 7 | E877: =C877*6+D877 -> 55 | G877: 11 | H877: 8 | I877: =G877*6+H877 -> 74 | K877: 14 | L877: 14 | M877: =K877*6+L877 -> 98 | O877: 14 | P877: 14 | Q877: =O877*6+P877 -> 98 | S877: CAMBERWELL
A878: CAMBERWELL | C878: 0 | D878: 3 | E878: =C878*6+D878 -> 3 | G878: 8 | H878: 11 | I878: =G878*6+H878 -> 59 | K878: 8 | L878: 11 | M878: =K878*6+L878 -> 59 | O878: 13 | P878: 15 | Q878: =O878*6+P878 -> 93 | S878: SETTER
A879: BEST PLAYERS
A880: PRESTON | C880: BEAGLEY | F880: MUIR | I880: LATHAM | L880: MASLEN | O880: MURRAY | R880: UNDERHILL
A881: CAMBERWELL | C881: MEEHAN | F881: TATHAM | I881: WILLIAMS | L881: HORKINGS | O881: FINLAYSON | R881: TURNER
A882: GOALKICKERS
A883: PRESTON | C883: WALSH 5 | F883: UNDERHILL 3 | I883: LATHAM 2 | L883: GILBERT | N883: CONSTANCE | Q883: MUIR | S883: MURRAY
A884: CAMBERWELL | C884: WILLIAMS 4 | F884: TATHAM | H884: WILKS | J884: WHITE | L884: GRIFFITHS | N884: TURNER | P884: WALKER | R884: SPIERS | T884: FINLAYSON | X884: DELANEY
A886: OAKLEIGH | C886: 3 | D886: 5 | E886: =C886*6+D886 -> 23 | G886: 7 | H886: 8 | I886: =G886*6+H886 -> 50 | K886: 14 | L886: 12 | M886: =K886*6+L886 -> 96 | O886: 18 | P886: 14 | Q886: =O886*6+P886 -> 122 | S886: OAKLEIGH
A887: WILLIAMSTOWN | C887: 3 | D887: 3 | E887: =C887*6+D887 -> 21 | G887: 5 | H887: 7 | I887: =G887*6+H887 -> 37 | K887: 5 | L887: 10 | M887: =K887*6+L887 -> 40 | O887: 11 | P887: 13 | Q887: =O887*6+P887 -> 79 | S887: GREGORY
A888: BEST PLAYERS
A889: OAKLEIGH | C889: G RYAN | E889: HUTCHESON | I889: BICKERTON | L889: WATSON | O889: CORP | Q889: NOLAN
A890: WILLIAMSTOWN | C890: BROOKS | E890: RAE | I890: LAWLER | L890: PATERSON | O890: KAUFMAN | Q890: ROBERTSON
A891: GOALKICKERS
A892: OAKLEIGH | C892: NOLAN 5 | E892: HEINTZ 4 | G892: G RYAN 4 | I892: KENNEDY 2 | L892: LENNON 2 | N892: WATSON
A893: WILLIAMSTOWN | C893: LAWLER 6 | F893: ROBERTSON 2 | I893: KAUFMAN | K893: McINTYRE | M893: ROWAN
A895: PORT MELBOURNE | C895: 1 | D895: 1 | E895: =C895*6+D895 -> 7 | G895: 6 | H895: 6 | I895: =G895*6+H895 -> 42 | K895: 6 | L895: 7 | M895: =K895*6+L895 -> 43 | O895: 11 | P895: 9 | Q895: =O895*6+P895 -> 75 | S895: PORT MELBOURNE
A896: BRUNSWICK | C896: 2 | D896: 2 | E896: =C896*6+D896 -> 14 | G896: 3 | H896: 8 | I896: =G896*6+H896 -> 26 | K896: 5 | L896: 9 | M896: =K896*6+L896 -> 39 | O896: 8 | P896: 12 | Q896: =O896*6+P896 -> 60 | S896: GLOVER
A897: BEST PLAYERS
A898: PORT MELBOURNE | C898: PAYNE | F898: GARRETT | I898: O'LEARY | K898: MONOHAN | N898: EASTMUIR | Q898: KEATING
A899: BRUNSWICK | C899: DOWLING | F899: GILLON | I899: BOYD | K899: FAY | N899: McELROY | Q899: TURNER
A900: GOALKICKERS
A901: PORT MELBOURNE | C901: MURRAY 2 | F901: FORREST 2 | I901: KEATING 2 | L901: FAIRWEATHER 2 | P901: CROMPTON | S901: O'LEARY | V901: GOSS
A902: BRUNSWICK | C902: McINNES 5 | F902: McELROY | I902: GILLON | L902: QUIN
A904: FINALS
A905: 1ST SEMI | E905: 7TH AUGUST | J905: WEATHER | M905: FINE SOUTH BREEZE
D906: 1ST QTR | H906: 2ND QTR | L906: 3RD QTR | P906: FINAL
A907: PRAHRAN | C907: 4 | D907: 3 | E907: =C907*6+D907 -> 27 | G907: 4 | H907: 4 | I907: =G907*6+H907 -> 28 | K907: 8 | L907: 14 | M907: =K907*6+L907 -> 62 | O907: 11 | P907: 18 | Q907: =O907*6+P907 -> 84 | S907: TOORAK PARK
A908: YARRAVILLE | C908: 1 | D908: 2 | E908: =C908*6+D908 -> 8 | G908: 5 | H908: 8 | I908: =G908*6+H908 -> 38 | K908: 8 | L908: 10 | M908: =K908*6+L908 -> 58 | O908: 12 | P908: 12 | Q908: =O908*6+P908 -> 84 | S908: LEWIS
A909: BEST PLAYERS
A910: PRAHRAN | C910: JOHNSON | F910: LOWRY | I910: THOMPSON | L910: WHITE | O910: BAKER | R910: BRENCHLEY
A911: YARRAVILLE | C911: WEDGWWOD | F911: McGRATH | I911: KELLY | L911: JAMES | O911: STREETER | R911: PARKS
A912: GOALKICKERS
A913: PRAHRAN | C913: BRENCHLEY 3 | F913: ANDERSON 2 | I913: GRAVELL 2 | L913: LOWRY | N913: WHITE | P913: BAKER | R913: HAWKINS
A914: YARRAVILLE | C914: KELLY 3 | F914: McGRATH 3 | I914: WEDGWOOD 3 | L914: CASHMAN | N914: TURNER | P914: TORRENS
A916: 2ND SEMI | E916: 14TH AUGUST | J916: WEATHER | M916: FINE MILD NORTH WIND
A917: BRUNSWICK | C917: 1 | D917: 6 | E917: =C917*6+D917 -> 12 | G917: 7 | H917: 9 | I917: =G917*6+H917 -> 51 | K917: 9 | L917: 12 | M917: =K917*6+L917 -> 66 | O917: 13 | P917: 17 | Q917: =O917*6+P917 -> 95 | S917: TOORAK PARK
A918: BRIGHTON | C918: 4 | D918: 2 | E918: =C918*6+D918 -> 26 | G918: 6 | H918: 3 | I918: =G918*6+H918 -> 39 | K918: 6 | L918: 7 | M918: =K918*6+L918 -> 43 | O918: 6 | P918: 9 | Q918: =O918*6+P918 -> 45 | S918: GREGORY
A919: BEST PLAYERS
A920: BRUNSWICK | C920: McELROY | E920: DOWLING | H920: CRAWFORD | K920: BOYD | N920: QUINN | Q920: FAY
A921: BRIGHTON | C921: EGAN | E921: BOLWELL | H921: GEORGE | K921: PENNY | N921: WEBER | Q921: HINDSON
A922: GOALKICKERS
A923: BRUNSWICK | C923: McINNES 5 | F923: McELROY 2 | I923: KANGEISER 2 | L923: BAILEY 2 | N923: DOWLING | Q923: CRAWFORD
A924: BRIGHTON | C924: PENNY 2 | F924: CONNELL 2 | I924: HONE | K924: SULLIVAN
A926: 1ST SEMI REPLAY | E926: 21ST AUGUST | J926: WEATHER | M926: OVERNIGHT RAIN SOUTH BREEZE CENTRE STICKY
A927: PRAHRAN | C927: 6 | D927: 4 | E927: =C927*6+D927 -> 40 | G927: 10 | H927: 6 | I927: =G927*6+H927 -> 66 | K927: 16 | L927: 10 | M927: =K927*6+L927 -> 106 | O927: 18 | P927: 12 | Q927: =O927*6+P927 -> 120 | S927: TOORAK PARK
A928: YARRAVILLE | C928: 0 | D928: 1 | E928: =C928*6+D928 -> 1 | G928: 5 | H928: 2 | I928: =G928*6+H928 -> 32 | K928: 7 | L928: 5 | M928: =K928*6+L928 -> 47 | O928: 14 | P928: 8 | Q928: =O928*6+P928 -> 92 | S928: STUART
A929: BEST PLAYERS
A930: PRAHRAN | C930: THOMPSON | F930: WHITE | I930: ANDERSON | L930: KOOP | O930: HAWKINS | R930: LOWRY
A931: YARRAVILLE | C931: WEDGWWOD | F931: PARKS | I931: McGRATH | L931: PETERS | O931: EVANS | R931: JAMES
A932: GOALKICKERS
A933: PRAHRAN | C933: ANDERSON 5 | F933: HAWKINS 5 | I933: THOMPSON 3 | L933: WHITE 2 | N933: HOLDEN 2 | Q933: BRENCHLEY
A934: YARRAVILLE | C934: McGRATH 4 | F934: KELLY 2 | H934: RAWSON 2 | J934: TURNER 2 | M934: TORRENS | O934: EVANS | Q934: CASHMAN | T934: JAMES
A936: PRELIMINARY FINAL | F936: 28TH AUGUST | J936: WEATHER | M936: FINE MILD NORTH WIND
A937: PRAHRAN | C937: 4 | D937: 3 | E937: =C937*6+D937 -> 27 | G937: 5 | H937: 4 | I937: =G937*6+H937 -> 34 | K937: 12 | L937: 10 | M937: =K937*6+L937 -> 82 | O937: 14 | P937: 12 | Q937: =O937*6+P937 -> 96 | S937: TOORAK PARK
A938: BRIGHTON | C938: 1 | D938: 1 | E938: =C938*6+D938 -> 7 | G938: 4 | H938: 3 | I938: =G938*6+H938 -> 27 | K938: 6 | L938: 6 | M938: =K938*6+L938 -> 42 | O938: 9 | P938: 9 | Q938: =O938*6+P938 -> 63 | S938: GREGORY
A939: BEST PLAYERS
A940: PRAHRAN | C940: THOMPSON | F940: WHITE | I940: KOOP | L940: LOWRY | O940: BRENCHLEY | R940: HAWKINS
A941: BRIGHTON | C941: FITCHER | F941: BOLWELL | I941: PENNY | L941: EGAN | O941: MILLER | R941: BAKER
A942: GOALKICKERS
A943: PRAHRAN | C943: WHITE 4 | F943: HAWKINS 3 | I943: BRENCHLEY 3 | L943: GRAVELL 2 | N943: GRANDISON | Q943: MILNE
A944: BRIGHTON | C944: NIVEN 3 | F944: SULLIVAN 3 | I944: FITCHER | L944: DEANE | N944: BOLWELL
A946: GRAND FINAL | E946: 4TH SEPTEMBER | J946: WEATHER | M946: FINE LIGHT SOUTH BREEZE
A947: PRAHRAN | C947: 1 | D947: 3 | E947: =C947*6+D947 -> 9 | G947: 3 | H947: 6 | I947: =G947*6+H947 -> 24 | K947: 9 | L947: 9 | M947: =K947*6+L947 -> 63 | O947: 12 | P947: 13 | Q947: =O947*6+P947 -> 85 | S947: TOORAK PARK
A948: BRUNSWICK | C948: 3 | D948: 3 | E948: =C948*6+D948 -> 21 | G948: 6 | H948: 6 | I948: =G948*6+H948 -> 42 | K948: 10 | L948: 13 | M948: =K948*6+L948 -> 73 | O948: 11 | P948: 17 | Q948: =O948*6+P948 -> 83 | S948: STUART
A949: BEST PLAYERS
A950: PRAHRAN | C950: BOURNE | F950: BAKER | I950: HAWKINS | L950: FLEMING | O950: THOMPSON | R950: LOWRY
A951: BRUNSWICK | C951: BOYD | F951: McELROY | I951: FAY | L951: CLARKE | O951: KANNGEISER | R951: CRAWFORD
A952: GOALKICKERS
A953: PRAHRAN | C953: HAWKINS 6 | F953: THOMPSON 2 | I953: ANDERSON 2 | L953: WHITE | N953: FLEMING
A954: BRUNSWICK | C954: McINNES 3 | F954: CRAWFORD 3 | I954: GARDNER 2 | L954: McKAY | N954: DOWLING | Q954: BAILEY
A956: TEAMS
G957: PRAHRAN | S957: BRUNSWICK
A958: BACKS | C958: WALTERS | G958: KOOP | K958: WILTSHIRE | O958: VAUGHAN | S958: FAY | W958: McKERNAN
A959: H-BACKS | C959: WHITEHEAD | G959: BAKER | K959: JOHNSON | O959: DONNELLY | S959: COOPER | W959: TURNER
A960: CENTRES | C960: SMITH | G960: LOWRY | K960: BOURNE | O960: PALMER | S960: QUINN | W960: CLARKE
A961: H-FORWARDS | C961: ANDERSON | G961: WILLIAMS | K961: BRENCHLEY | O961: GARDNER | S961: McKAY | W961: KANNGEISER
A962: FORWARDS | C962: HOLDEN | G962: HAWKINS | K962: GRAVELL | O962: CRAWFORD | S962: McINNES | W962: BAILEY
A963: RUCKS | C963: FLEMING | G963: THOMPSON | K963: WHITE | O963: McELROY | S963: BOYD | W963: DOWLING
A964: RES | O964: TOONE
A966: OTHER MATCHES | E966: 19TH MAY (CORONATION DAY) | L966: WEATHER
A967: V.F.L. | C967: 4 | D967: 3 | E967: =C967*6+D967 -> 27 | G967: 13 | H967: 13 | I967: =G967*6+H967 -> 91 | K967: 19 | L967: 19 | M967: =K967*6+L967 -> 133 | O967: 26 | P967: 25 | Q967: =O967*6+P967 -> 181 | S967: ST.K
A968: V.F.A. | C968: 2 | D968: 2 | E968: =C968*6+D968 -> 14 | G968: 6 | H968: 5 | I968: =G968*6+H968 -> 41 | K968: 10 | L968: 9 | M968: =K968*6+L968 -> 69 | O968: 11 | P968: 11 | Q968: =O968*6+P968 -> 77 | S968: BELL V.F.L. 1ST HALF
A969: BEST PLAYERS | S969: GREGORY V.F.A. 2ND HALF
A970: V.F.L. | C970: MUELLER | F970: REGAN | I970: BUNTON | L970: DYER | O970: SHEA | R970: HAWKING
A971: V.F.A. | C971: McGRATH | F971: WEBER | I971: O'KEEFE | L971: LOWRY | O971: ACKLAND | R971: CARTWRIGHT
A972: GOALKICKERS
A973: V.F.L. | C973: MOHR 7 | F973: NASH 5 | I973: FORBES 4 | L973: SHEA 3 | N973: HARRIS 3 | Q973: DYER 2 | S973: MATTHEWS | W973: BUNTON
A974: V.F.A. | C974: McGRATH 2 | F974: CARTWRIGHT 2 | J974: FISHER 2 | M974: ANDERSON 2 | P974: O'KEEFE | R974: DREW | T974: RAWSON
A976: TEAMS
G977: V.F.A. | T977: V.F.L.
A978: BACKS | C978: ACKLAND (N'COTE) | G978: FAY (B'WICK) | L978: O'KEEFE (N'COTE) | Q978: MILLS | V978: REGAN | X978: ANDERSON
A979: H-BACKS | C979: POWELL (N'COTE) | G979: JOHNSON (P'HAN) | L979: MURRAY (P'TON) | Q979: HICKEY | V979: MUELLER | X979: HALE
A980: CENTRES | C980: FREW (Y'VILLE) | G980: LOWRY (P'HAN) | L980: CLARKE (B'WICK) | Q980: HAWKING | V980: LA FONTAINE | X980: MATTHEWS
A981: H-FORWARDS | C981: RAWSON (Y'VILLE) | G981: ANDERSON (OAK) | L981: McELROY (B'WICK) | Q981: SHEA | V981: NASH | X981: BUNTON
A982: FORWARDS | C982: DREW (B'TON) | G982: FISHER (P'TON) | L982: CARTWRIGHT (S'HAM) | Q982: MORRISON | V982: MOHR | X982: FORBES
A983: RUCKS | C983: HUGGINS (W'TOWN) | G983: WEBER (B'TON) | L983: McGRATH (Y'VILLE) | Q983: A COLLIER | V983: DYER | X983: HARRIS
A984: RES | Q984: DAVIS
A986: V.F.A. 2NDS VS V.F.L. 2NDS
A987: V.F.A. | C987: 2 | D987: 1 | E987: =C987*6+D987 -> 13 | G987: 3 | H987: 9 | I987: =G987*6+H987 -> 27 | K987: 5 | L987: 9 | M987: =K987*6+L987 -> 39 | O987: 6 | P987: 14 | Q987: =O987*6+P987 -> 50 | S987: ST KILDA
A988: V.F.L. | C988: 1 | D988: 4 | E988: =C988*6+D988 -> 10 | G988: 1 | H988: 4 | I988: =G988*6+H988 -> 10 | K988: 3 | L988: 8 | M988: =K988*6+L988 -> 26 | O988: 5 | P988: 11 | Q988: =O988*6+P988 -> 41 | S988: MORCOM V.F.A. 1ST HALF
A989: BEST PLAYERS | S989: POPE V.F.L. 2ND HALF
A990: V.F.A. | C990: LINES | F990: WINTER | I990: DAVIS | L990: ATKINSON | O990: LEONARD | R990: UNDERHILL
A991: V.F.L. | C991: BARKER | F991: LEASK | I991: WILLIAMS | L991: BOLGER | O991: ALLISTER
A992: GOALKICKERS
A993: V.F.A. | C993: SHARWOOD | F993: BEARD | I993: ATKINSON | L993: WINTER | O993: LEONARD | R993: McGRATH
A994: V.F.L. | C994: ALLISTER 4 | F994: RYAN
A996: TEAMS
G997: V.F.A. | V997: V.F.L.
A998: BACKS | C998: FOO (B'WICK) | G998: DAVIS (B'WICK) | L998: MOLONEY (P.M.) | Q998: BOLGER (RICH) | V998: BARKER (HAW) | X998: BARTLING (FITZ)
A999: H-BACKS | C999: CLAMP (C'WELL) | G999: WINTER (B'WICK) | L999: METHERALL (P.M.) | Q999: MILLS (MELB) | V999: PHILLIPS (S.M.) | X999: GLENISTER (FOOTS)
A1000: CENTRES | C1000: UNDERHILL (P'TON) | G1000: LINES (COB) | L1000: DAVIS (P.M.) | Q1000: McDONALD (ST K.) | V1000: MILNE (MELB) | X1000: WILLIAMS (CARL)
A1001: H-FORWARDS | C1001: LEONARD (COB) | G1001: CONNOLLY (COB) | L1001: HENDERSON (COB) | Q1001: HARPER (COLL) | V1001: ROSE (ST K.) | X1001: LANGDON (COLL)
A1002: FORWARDS | C1002: WALKER (P'TON) | G1002: BEARD (OAK) | L1002: SHARWOOD (N'COTE) | Q1002: PRICE (CARL) | V1002: ALLISTER (ESS) | X1002: RYAN (HAW)
A1003: RUCKS | C1003: WALTERS (P'HAN) | G1003: McGRATH (B'WICK) | L1003: ATKINSON (COB) | Q1003: HARTRIDGE (ST K) | V1003: STEVENSON (RICH) | X1003: LEACH (S.M.)
A1004: RES | C1004: EBBAGE (COB) | Q1004: CORNELIOUS (ESS)