A1: Victorian Football Association
A2: Season 1938
A3: © Copyright Wal Williams | F3: First created: 2 November 2014
A4: Contact: joywalwi at gmail dot com | F4: Last updated: 27 January 2018 | W4: VFA Results and tables - Link to the main index page
A5: You are free to copy this document in whole or part provided that proper acknowledgement is given to the author. All rights reserved.
A7: YEAR 1938
A8: ROUND 1 | D8: 16TH APRIL | G8: WEATHER | I8: HOT (85`F) FINE STRONG NORTH WIND DUST STORM LATE | S8: PLAYED AT
D9: 1ST QTR | H9: 2ND QTR | L9: 3RD QTR | P9: FINAL | S9: PORT MELBOURNE
A10: PRAHRAN | C10: 3 | D10: 4 | E10: =C10*6+D10 -> 22 | G10: 10 | H10: 8 | I10: =G10*6+H10 -> 68 | K10: 18 | L10: 11 | M10: =K10*6+L10 -> 119 | O10: 19 | P10: 13 | Q10: =O10*6+P10 -> 127 | S10: UMPIRE | X10: LADDER | AB10: ROUND | AD10: 1
A11: PORT MELBOURNE | C11: 0 | D11: 4 | E11: =C11*6+D11 -> 4 | G11: 2 | H11: 7 | I11: =G11*6+H11 -> 19 | K11: 4 | L11: 10 | M11: =K11*6+L11 -> 34 | O11: 12 | P11: 16 | Q11: =O11*6+P11 -> 88 | S11: GROVES
A12: BEST PLAYERS | W12: TEAM | X12: W | Y12: L | Z12: D | AA12: FOR | AB12: AGST | AC12: % | AD12: PTS
A13: PRAHRAN | C13: D MURRAY | F13: WHITEHEAD | I13: NEESON | L13: HAWKINS | O13: BOURNE | Q13: FLEMING
A14: PORT MELBOURNE | C14: TUITE | F14: LAHIFF | I14: GARBUTT | L14: EASTMUIR | O14: WOODS | Q14: PAYNE | W14: BRUNSWICK | X14: 1 | Y14: 0 | Z14: 0 | AA14: 135 | AB14: 77 | AC14: 175.32467532467533 | AD14: 4
A15: GOALKICKERS | W15: PRAHRAN | X15: 1 | Y15: 0 | Z15: 0 | AA15: 127 | AB15: 88 | AC15: 144.31818181818181 | AD15: 4
A16: PRAHRAN | C16: NEESON 6 | E16: THOMPSON 4 | H16: FLEMING 3 | J16: PORTER 2 | M16: WHITE | O16: SLADE | Q16: LOWRY | S16: BRENCHLEY | W16: NORTHCOTE | X16: 1 | Y16: 0 | Z16: 0 | AA16: 73 | AB16: 56 | AC16: 130.35714285714286 | AD16: 4
A17: PORT MELBOURNE | C17: FREYER 4 | E17: GOLDSMITH 2 | H17: BLOOMER 2 | K17: EASTMUIR | M17: TUITE | O17: NORTON | Q17: LEE | W17: CAMBERWELL | X17: 1 | Y17: 0 | Z17: 0 | AA17: 115 | AB17: 92 | AC17: 125 | AD17: 4
A19: NORTHCOTE | C19: 0 | D19: 0 | E19: =C19*6+D19 -> 0 | G19: 7 | H19: 6 | I19: =G19*6+H19 -> 48 | K19: 7 | L19: 9 | M19: =K19*6+L19 -> 51 | O19: 10 | P19: 13 | Q19: =O19*6+P19 -> 73 | S19: PRESTON | W19: BRIGHTON | X19: 1 | Y19: 0 | Z19: 0 | AA19: 85 | AB19: 70 | AC19: 121.42857142857143 | AD19: 4
A20: PRESTON | C20: 2 | D20: 8 | E20: =C20*6+D20 -> 20 | G20: 2 | H20: 10 | I20: =G20*6+H20 -> 22 | K20: 7 | L20: 12 | M20: =K20*6+L20 -> 54 | O20: 7 | P20: 14 | Q20: =O20*6+P20 -> 56 | S20: GREGORY | W20: WILLIAMSTOWN | X20: 1 | Y20: 0 | Z20: 0 | AA20: 107 | AB20: 95 | AC20: 112.63157894736842 | AD20: 4
A21: BEST PLAYERS | W21: YARRAVILLE | X21: 0 | Y21: 1 | Z21: 0 | AA21: 95 | AB21: 107 | AC21: 88.785046728971963 | AD21: 0
A22: NORTHCOTE | C22: DOWNIE | F22: STEPHENSON | I22: WEGNER | L22: HOUGHTON | O22: SMITH | Q22: HOLDEN | W22: SANDRINGHAM | X22: 0 | Y22: 1 | Z22: 0 | AA22: 70 | AB22: 85 | AC22: 82.352941176470594 | AD22: 0
A23: PRESTON | C23: MURRAY | F23: TURNER | I23: CLARKE | L23: CAMPBELL | O23: MUIR | Q23: CLACK | W23: OAKLEIGH | X23: 0 | Y23: 1 | Z23: 0 | AA23: 92 | AB23: 115 | AC23: 80 | AD23: 0
A24: GOALKICKERS | W24: PRESTON | X24: 0 | Y24: 1 | Z24: 0 | AA24: 56 | AB24: 73 | AC24: 76.712328767123282 | AD24: 0
A25: NORTHCOTE | C25: HOUGHTON 3 | F25: McNAMARA 2 | I25: THORNE | K25: DOWNIE | M25: BEERS | O25: GRAY | Q25: HART | W25: PORT MELBOURNE | X25: 0 | Y25: 1 | Z25: 0 | AA25: 88 | AB25: 127 | AC25: 69.29133858267717 | AD25: 0
A26: PRESTON | C26: ROBINSON | F26: CAMPBELL | I26: SLEITH | K26: MUIR | M26: COOPER | O26: GILBERT | Q26: WIKINS | W26: COBURG | X26: 0 | Y26: 1 | Z26: 0 | AA26: 77 | AB26: 135 | AC26: 57.037037037037038 | AD26: 0
A28: BRIGHTON | C28: 0 | D28: 1 | E28: =C28*6+D28 -> 1 | G28: 4 | H28: 10 | I28: =G28*6+H28 -> 34 | K28: 8 | L28: 13 | M28: =K28*6+L28 -> 61 | O28: 11 | P28: 19 | Q28: =O28*6+P28 -> 85 | S28: ELSTERNWICK PARK
A29: SANDRINGHAM | C29: 2 | D29: 5 | E29: =C29*6+D29 -> 17 | G29: 2 | H29: 7 | I29: =G29*6+H29 -> 19 | K29: 9 | L29: 9 | M29: =K29*6+L29 -> 63 | O29: 10 | P29: 10 | Q29: =O29*6+P29 -> 70 | S29: SETTER
A30: BEST PLAYERS
A31: BRIGHTON | C31: PENNY | F31: BOLWELL | I31: DEANE | L31: HALLAHAN | O31: JOHNSON | R31: N EGAN
A32: SANDRINGHAM | C32: TOLSON | F32: McCOY | I32: FOSTER | L32: MADDEN | O32: MILLER | R32: TORPY
A33: GOALKICKERS
A34: BRIGHTON | C34: DEANE 3 | F34: POGUE 2 | I34: PENNY 2 | L34: BOLWELL 2 | O34: J EGAN | Q34: MILLER
A35: SANDRINGHAM | C35: TOLSON 3 | F35: GAINGER 2 | I35: MITCHELL | K35: MILLER | M35: WEBER | O35: MUTIMER | Q35: EDMONDS
A37: BRUNSWICK | C37: 4 | D37: 7 | E37: =C37*6+D37 -> 31 | G37: 5 | H37: 10 | I37: =G37*6+H37 -> 40 | K37: 11 | L37: 14 | M37: =K37*6+L37 -> 80 | O37: 19 | P37: 21 | Q37: =O37*6+P37 -> 135 | S37: BRUNSWICK
A38: COBURG | C38: 1 | D38: 2 | E38: =C38*6+D38 -> 8 | G38: 6 | H38: 6 | I38: =G38*6+H38 -> 42 | K38: 10 | L38: 7 | M38: =K38*6+L38 -> 67 | O38: 11 | P38: 11 | Q38: =O38*6+P38 -> 77 | S38: LESTER
A39: BEST PLAYERS
A40: BRUNSWICK | C40: DOWLING | F40: FAY | I40: McKAY | L40: TOONE | O40: McINNES | R40: QUINN
A41: COBURG | C41: COLLINS | F41: MURRAY | I41: LA FRANCHI | L41: LEONARD | O41: BERRYMAN | R41: IRVINE
A42: GOALKICKERS
A43: BRUNSWICK | C43: McINNES 6 | F43: McKAY 3 | I43: CRAWFORD 3 | L43: BAILEY 2 | N43: TOONE 2 | P43: McGRATH | R43: DOWLING | U43: McGORLICK
A44: COBURG | C44: COLLINS 5 | F44: BERRYMAN 2 | I44: SCANLON | K44: MURRAY | M44: IRVINE | O44: GAUDION
A46: WILLIAMSTOWN | C46: 7 | D46: 6 | E46: =C46*6+D46 -> 48 | G46: 8 | H46: 7 | I46: =G46*6+H46 -> 55 | K46: 13 | L46: 14 | M46: =K46*6+L46 -> 92 | O46: 15 | P46: 17 | Q46: =O46*6+P46 -> 107 | S46: YARRAVILLE
A47: YARRAVILLE | C47: 0 | D47: 2 | E47: =C47*6+D47 -> 2 | G47: 6 | H47: 14 | I47: =G47*6+H47 -> 50 | K47: 8 | L47: 16 | M47: =K47*6+L47 -> 64 | O47: 12 | P47: 23 | Q47: =O47*6+P47 -> 95 | S47: HAYES
A48: BEST PLAYERS
A49: WILLIAMSTOWN | C49: CUTTING | F49: RAE | I49: LAWLOR | L49: PATERSON | O49: DELLER | R49: WILLETT
A50: YARRAVILLE | C50: WEDGWOOD | F50: JAMES | I50: ANDERSON | L50: PARKS | O50: KENNY | R50: FREW
A51: GOALKICKERS
A52: WILLIAMSTOWN | C52: LAWLOR 5 | F52: HEDLEY 2 | I52: PATERSON 2 | L52: DELLER | N52: JOHNSON | P52: McCALLUM | S52: CUTTING | V52: FITCH
A53: YARRAVILLE | C53: RAWSON 4 | F53: TRIBE 3 | I53: KENNY 2 | L53: WEDGWOOD | O53: TURNER | Q53: PARKS
A55: CAMBERWELL | C55: 8 | D55: 6 | E55: =C55*6+D55 -> 54 | G55: 10 | H55: 7 | I55: =G55*6+H55 -> 67 | K55: 14 | L55: 12 | M55: =K55*6+L55 -> 96 | O55: 17 | P55: 13 | Q55: =O55*6+P55 -> 115 | S55: CAMBERWELL
A56: OAKLEIGH | C56: 0 | D56: 2 | E56: =C56*6+D56 -> 2 | G56: 3 | H56: 6 | I56: =G56*6+H56 -> 24 | K56: 7 | L56: 9 | M56: =K56*6+L56 -> 51 | O56: 13 | P56: 14 | Q56: =O56*6+P56 -> 92 | S56: LEWIS
A57: BEST PLAYERS
A58: CAMBERWELL | C58: NASH | F58: WILLIAMS | I58: DAVIDSON | L58: GRIFFITHS | O58: BRETT | Q58: JONES
A59: OAKLEIGH | C59: WITHERS | F59: BELL | I59: BICKERTON | L59: HUTCHESON | O59: NOLAN | Q59: WATSON
A60: GOALKICKERS
A61: CAMBERWELL | C61: DAVIDSON 4 | F61: BRAIN 3 | H61: GRIFFITHS 3 | K61: WILLIAMS 3 | N61: SEELENMEYER | Q61: T WILKES | T61: FORD | V61: MEEHAN
A62: OAKLEIGH | C62: NOLAN 4 | F62: HARRISON | I62: G RYAN | K62: D RYAN | M62: CRAMERI | O62: WATSON | Q62: SMITH | S62: REID
A64: ROUND 2 | E64: 18TH APRIL | H64: WEATHER | K64: HEAVY SHOWERS STRONG S.W. WIND | S64: PLAYED AT
D65: 1ST QTR | H65: 2ND QTR | L65: 3RD QTR | P65: FINAL | S65: NORTHCOTE
A66: BRIGHTON | C66: 6 | D66: 4 | E66: =C66*6+D66 -> 40 | G66: 6 | H66: 9 | I66: =G66*6+H66 -> 45 | K66: 10 | L66: 13 | M66: =K66*6+L66 -> 73 | O66: 12 | P66: 15 | Q66: =O66*6+P66 -> 87 | S66: UMPIRE | X66: LADDER | AB66: ROUND | AD66: 2
A67: NORTHCOTE | C67: 2 | D67: 2 | E67: =C67*6+D67 -> 14 | G67: 6 | H67: 6 | I67: =G67*6+H67 -> 42 | K67: 6 | L67: 8 | M67: =K67*6+L67 -> 44 | O67: 10 | P67: 12 | Q67: =O67*6+P67 -> 72 | S67: HAYES
A68: BEST PLAYERS | W68: TEAM | X68: W | Y68: L | Z68: D | AA68: FOR | AB68: AGST | AC68: % | AD68: PTS
A69: BRIGHTON | C69: RUDD | E69: POGUE | H69: BOURNE | K69: GEORGE | N69: BOLWELL | Q69: PENNY
A70: NORTHCOTE | C70: RUSH | E70: HOSKING | H70: McNAMARA | K70: HART | N70: WEGNER | Q70: DOWNIE | W70: PRAHRAN | X70: 2 | Y70: 0 | Z70: 0 | AA70: 248 | AB70: 137 | AC70: 181.02189781021897 | AD70: 8
A71: GOALKICKERS | W71: CAMBERWELL | X71: 2 | Y71: 0 | Z71: 0 | AA71: 214 | AB71: 142 | AC71: 150.70422535211267 | AD71: 8
A72: BRIGHTON | C72: POGUE 5 | E72: DEANE 2 | G72: J EGAN 2 | I72: PENNY | K72: CONNELL | M72: HALLAHAN | W72: BRUNSWICK | X72: 2 | Y72: 0 | Z72: 0 | AA72: 218 | AB72: 156 | AC72: 139.74358974358975 | AD72: 8
A73: NORTHCOTE | C73: McNAMARA 3 | G73: THORNE 3 | I73: DOWNIE 2 | K73: ACKLAND | M73: MEITZCKE | W73: BRIGHTON | X73: 2 | Y73: 0 | Z73: 0 | AA73: 172 | AB73: 142 | AC73: 121.12676056338029 | AD73: 8
A75: CAMBERWELL | C75: 7 | D75: 5 | E75: =C75*6+D75 -> 47 | G75: 8 | H75: 7 | I75: =G75*6+H75 -> 55 | K75: 13 | L75: 15 | M75: =K75*6+L75 -> 93 | O75: 14 | P75: 15 | Q75: =O75*6+P75 -> 99 | S75: WILLIAMSTOWN | W75: YARRAVILLE | X75: 1 | Y75: 1 | Z75: 0 | AA75: 188 | AB75: 180 | AC75: 104.44444444444444 | AD75: 4
A76: WILLIAMSTOWN | C76: 0 | D76: 0 | E76: =C76*6+D76 -> 0 | G76: 1 | H76: 7 | I76: =G76*6+H76 -> 13 | K76: 1 | L76: 7 | M76: =K76*6+L76 -> 13 | O76: 6 | P76: 14 | Q76: =O76*6+P76 -> 50 | S76: GREGORY | W76: NORTHCOTE | X76: 1 | Y76: 1 | Z76: 0 | AA76: 145 | AB76: 143 | AC76: 101.3986013986014 | AD76: 4
A77: BEST PLAYERS | W77: OAKLEIGH | X77: 1 | Y77: 1 | Z77: 0 | AA77: 185 | AB77: 207 | AC77: 89.371980676328505 | AD77: 4
A78: CAMBERWELL | C78: BRAIN | E78: NASH | H78: DAVIDSON | K78: SEELENMEYER | N78: JONES | Q78: D WHITE | W78: WILLIAMSTOWN | X78: 1 | Y78: 1 | Z78: 0 | AA78: 157 | AB78: 194 | AC78: 80.927835051546396 | AD78: 4
A79: WILLIAMSTOWN | C79: HUGGINS | E79: WILLETT | H79: FITCH | K79: MCCALLUM | N79: PATERSON | Q79: RAE | W79: SANDRINGHAM | X79: 0 | Y79: 2 | Z79: 0 | AA79: 149 | AB79: 168 | AC79: 88.69047619047619 | AD79: 0
A80: GOALKICKERS | W80: PORT MELBOURNE | X80: 0 | Y80: 2 | Z80: 0 | AA80: 180 | AB80: 220 | AC80: 81.818181818181813 | AD80: 0
A81: CAMBERWELL | C81: BRAIN 5 | F81: NASH 4 | I81: DAVIDSON 2 | L81: D WHITE 2 | O81: J MURPHY | W81: COBURG | X81: 0 | Y81: 2 | Z81: 0 | AA81: 150 | AB81: 228 | AC81: 65.78947368421052 | AD81: 0
A82: WILLIAMSTOWN | C82: FITCH 4 | F82: PATERSON | I82: JERRAM | W82: PRESTON | X82: 0 | Y82: 2 | Z82: 0 | AA82: 105 | AB82: 194 | AC82: 54.123711340206185 | AD82: 0
A84: BRUNSWICK | C84: 6 | D84: 6 | E84: =C84*6+D84 -> 42 | G84: 6 | H84: 11 | I84: =G84*6+H84 -> 47 | K84: 10 | L84: 13 | M84: =K84*6+L84 -> 73 | O84: 11 | P84: 17 | Q84: =O84*6+P84 -> 83 | S84: BEACH ROAD
A85: SANDRINGHAM | C85: 5 | D85: 0 | E85: =C85*6+D85 -> 30 | G85: 7 | H85: 4 | I85: =G85*6+H85 -> 46 | K85: 8 | L85: 5 | M85: =K85*6+L85 -> 53 | O85: 12 | P85: 7 | Q85: =O85*6+P85 -> 79 | S85: LESTER
A86: BEST PLAYERS
A87: BRUNSWICK | C87: MASKELL | F87: QUINN | I87: FAY | L87: McGRATH | O87: TOONE | R87: DOWLING
A88: SANDRINGHAM | C88: TOLSON | F88: MCCOY | I88: SAUNDERS | L88: WEBER | O88: EDMONDS | R88: MILLER
A89: GOALKICKERS
A90: BRUNSWICK | C90: MASKELL 3 | F90: McINNES 2 | I90: TOONE 2 | K90: DOWLING | M90: CRAWFORD | P90: BOYD | R90: HUNT
A91: SANDRINGHAM | C91: TOLSON 2 | F91: MUTIMER 2 | I91: EDMONDS 2 | L91: WEBER 2 | N91: FISHER 2 | Q91: GAINGER
A93: OAKLEIGH | C93: 3 | D93: 5 | E93: =C93*6+D93 -> 23 | G93: 8 | H93: 7 | I93: =G93*6+H93 -> 55 | K93: 12 | L93: 12 | M93: =K93*6+L93 -> 84 | O93: 13 | P93: 15 | Q93: =O93*6+P93 -> 93 | S93: OAKLEIGH
A94: PORT MELBOURNE | C94: 2 | D94: 8 | E94: =C94*6+D94 -> 20 | G94: 5 | H94: 14 | I94: =G94*6+H94 -> 44 | K94: 7 | L94: 17 | M94: =K94*6+L94 -> 59 | O94: 11 | P94: 26 | Q94: =O94*6+P94 -> 92 | S94: LEWIS
A95: BEST PLAYERS
A96: OAKLEIGH | C96: NOLAN | F96: BELL | I96: WILLIAMS | L96: HARRISON | O96: HUTCHESON | R96: MUDGE
A97: PORT MELBOURNE | C97: MARSHALL | F97: FREYER | I97: ALSOP | L97: GARBUTT | O97: LAHIFF | R97: BLOOMER
A98: GOALKICKERS
A99: OAKLEIGH | C99: NOLAN 8 | F99: DRURY 2 | I99: WILMOT | K99: KENNEDY | N99: SMITH
A100: PORT MELBOURNE | C100: FREYER 6 | F100: LEE 2 | I100: LAHIFF | K100: EASTMUIR | N100: GAY
A102: YARRAVILLE | C102: 1 | D102: 2 | E102: =C102*6+D102 -> 8 | G102: 7 | H102: 3 | I102: =G102*6+H102 -> 45 | K102: 9 | L102: 4 | M102: =K102*6+L102 -> 58 | O102: 14 | P102: 9 | Q102: =O102*6+P102 -> 93 | S102: COBURG
A103: COBURG | C103: 1 | D103: 9 | E103: =C103*6+D103 -> 15 | G103: 5 | H103: 11 | I103: =G103*6+H103 -> 41 | K103: 7 | L103: 15 | M103: =K103*6+L103 -> 57 | O103: 9 | P103: 19 | Q103: =O103*6+P103 -> 73 | S103: GRAVES
A104: BEST PLAYERS
A105: YARRAVILLE | C105: PARKS | F105: ANDERSON | I105: WEDGWOOD | L105: EVANS | O105: TURNER | R105: KENNY
A106: COBURG | C106: LA FRANCHI | F106: COLLINS | I106: DIXON | L106: SHENFIELD | O106: LEONARD | R106: ESDALE
A107: GOALKICKERS
A108: YARRAVILLE | C108: PARKS 3 | F108: ROGERS 2 | I108: TRIBE 2 | K108: KENNY 2 | M108: WEDGWOOD | P108: SMITH | R108: JAMES | T108: TURNER | W108: RAWSON
A109: COBURG | C109: COLLINS 5 | F109: ESDALE 2 | I109: LA FRANCHI | L109: DIXON
A111: PRAHRAN | C111: 4 | D111: 4 | E111: =C111*6+D111 -> 28 | G111: 6 | H111: 13 | I111: =G111*6+H111 -> 49 | K111: 9 | L111: 21 | M111: =K111*6+L111 -> 75 | O111: 15 | P111: 31 | Q111: =O111*6+P111 -> 121 | S111: TOORAK PARK
A112: PRESTON | C112: 3 | D112: 7 | E112: =C112*6+D112 -> 25 | G112: 4 | H112: 8 | I112: =G112*6+H112 -> 32 | K112: 6 | L112: 11 | M112: =K112*6+L112 -> 47 | O112: 6 | P112: 13 | Q112: =O112*6+P112 -> 49 | S112: SETTER
A113: BEST PLAYERS
A114: PRAHRAN | C114: COOPER | F114: FLEMING | I114: WILTSHIRE | L114: SMITH | O114: SLADE | R114: NEESON
A115: PRESTON | C115: HASKETT | F115: CLACK | I115: MASLEN | L115: MUIR | O115: WHITECHURCH | R115: ROBINSON
A116: GOALKICKERS
A117: PRAHRAN | C117: NEESON 4 | F117: WHITE 4 | I117: THOMPSON 3 | L117: PORTER 2 | O117: WILLIAMS | R117: LOWRY
A118: PRESTON | C118: SPOKES 2 | F118: ROBINSON | I118: TURNER | L118: WILKINS | O118: COOPER
A120: ROUND 3 | E120: 23RD APRIL | J120: WEATHER | M120: FINE NORTH BREEZE | S120: PLAYED AT
D121: 1ST QTR | H121: 2ND QTR | L121: 3RD QTR | P121: FINAL | S121: ELSTERNWICK PARK
A122: BRIGHTON | C122: 3 | D122: 1 | E122: =C122*6+D122 -> 19 | G122: 9 | H122: 4 | I122: =G122*6+H122 -> 58 | K122: 11 | L122: 12 | M122: =K122*6+L122 -> 78 | O122: 14 | P122: 20 | Q122: =O122*6+P122 -> 104 | S122: UMPIRE | X122: LADDER | AB122: ROUND | AD122: 3
A123: PRAHRAN | C123: 3 | D123: 4 | E123: =C123*6+D123 -> 22 | G123: 5 | H123: 6 | I123: =G123*6+H123 -> 36 | K123: 12 | L123: 10 | M123: =K123*6+L123 -> 82 | O123: 13 | P123: 12 | Q123: =O123*6+P123 -> 90 | S123: GROVES
A124: BEST PLAYERS | W124: TEAM | X124: W | Y124: L | Z124: D | AA124: FOR | AB124: AGST | AC124: % | AD124: PTS
A125: BRIGHTON | C125: WEBER | E125: FITCHER | H125: HONE | K125: J EGAN | N125: JOHNSON | Q125: N EGAN
A126: PRAHRAN | C126: WHITE | E126: WILTSHIRE | H126: JOHNSON | K126: NEESON | N126: BRENCHLEY | Q126: HAWKINS | W126: BRUNSWICK | X126: 3 | Y126: 0 | Z126: 0 | AA126: 333 | AB126: 208 | AC126: 160.09615384615384 | AD126: 12
A127: GOALKICKERS | W127: BRIGHTON | X127: 3 | Y127: 0 | Z127: 0 | AA127: 276 | AB127: 232 | AC127: 118.96551724137932 | AD127: 12
A128: BRIGHTON | C128: PENNY 3 | F128: POGUE 3 | I128: OPREY 3 | L128: HONE 3 | O128: FITCHER 2 | W128: PRAHRAN | X128: 2 | Y128: 1 | Z128: 0 | AA128: 338 | AB128: 241 | AC128: 140.24896265560167 | AD128: 8
A129: PRAHRAN | C129: NEESON 4 | E129: WHITE 2 | G129: HAWKINS | I129: BRENCHLEY | L129: P MURRAY | N129: SLADE | P129: PORTER | R129: DIXON | W129: CAMBERWELL | X129: 2 | Y129: 1 | Z129: 0 | AA129: 326 | AB129: 283 | AC129: 115.19434628975264 | AD129: 8
Q130: THOMPSON
A131: BRUNSWICK | C131: 2 | D131: 3 | E131: =C131*6+D131 -> 15 | G131: 8 | H131: 5 | I131: =G131*6+H131 -> 53 | K131: 11 | L131: 10 | M131: =K131*6+L131 -> 76 | O131: 17 | P131: 13 | Q131: =O131*6+P131 -> 115 | S131: BRUNSWICK | W131: YARRAVILLE | X131: 2 | Y131: 1 | Z131: 0 | AA131: 310 | AB131: 282 | AC131: 109.9290780141844 | AD131: 8
A132: NORTHCOTE | C132: 2 | D132: 2 | E132: =C132*6+D132 -> 14 | G132: 3 | H132: 6 | I132: =G132*6+H132 -> 24 | K132: 6 | L132: 11 | M132: =K132*6+L132 -> 47 | O132: 6 | P132: 16 | Q132: =O132*6+P132 -> 52 | S132: SETTER | W132: OAKLEIGH | X132: 2 | Y132: 1 | Z132: 0 | AA132: 291 | AB132: 302 | AC132: 96.357615894039739 | AD132: 8
A133: BEST PLAYERS | W133: COBURG | X133: 1 | Y133: 2 | Z133: 0 | AA133: 291 | AB133: 340 | AC133: 85.588235294117652 | AD133: 4
A134: BRUNSWICK | C134: QUINN | E134: DOWLING | H134: TOONE | K134: MASKELL | N134: McGRATH | Q134: BAILEY | W134: WILLIAMSTOWN | X134: 1 | Y134: 2 | Z134: 0 | AA134: 252 | AB134: 300 | AC134: 84 | AD134: 4
A135: NORTHCOTE | C135: ROSS | E135: McINERNEY | H135: NEWMAN | K135: GRAY | N135: SMITH | Q135: THORNE | W135: NORTHCOTE | X135: 1 | Y135: 2 | Z135: 0 | AA135: 197 | AB135: 258 | AC135: 76.356589147286826 | AD135: 4
A136: GOALKICKERS | W136: PRESTON | X136: 1 | Y136: 2 | Z136: 0 | AA136: 226 | AB136: 313 | AC136: 72.204472843450475 | AD136: 4
A137: BRUNSWICK | C137: MASKELL 5 | F137: TOONE 3 | H137: BAILEY 3 | J137: McGRATH 2 | M137: McINNES 2 | P137: DOWLING | R137: McGORLICK | W137: PORT MELBOURNE | X137: 0 | Y137: 3 | Z137: 0 | AA137: 299 | AB137: 341 | AC137: 87.68328445747801 | AD137: 0
A138: NORTHCOTE | C138: THORNE 3 | F138: GRAY | H138: McNAMARA | K138: ROSS | W138: SANDRINGHAM | X138: 0 | Y138: 3 | Z138: 0 | AA138: 251 | AB138: 290 | AC138: 86.551724137931032 | AD138: 0
A140: OAKLEIGH | C140: 2 | D140: 5 | E140: =C140*6+D140 -> 17 | G140: 6 | H140: 14 | I140: =G140*6+H140 -> 50 | K140: 7 | L140: 20 | M140: =K140*6+L140 -> 62 | O140: 13 | P140: 28 | Q140: =O140*6+P140 -> 106 | S140: OAKLEIGH
A141: WILLIAMSTOWN | C141: 3 | D141: 2 | E141: =C141*6+D141 -> 20 | G141: 7 | H141: 4 | I141: =G141*6+H141 -> 46 | K141: 12 | L141: 8 | M141: =K141*6+L141 -> 80 | O141: 14 | P141: 11 | Q141: =O141*6+P141 -> 95 | S141: LESTER
A142: BEST PLAYERS
A143: OAKLEIGH | C143: SMITH | F143: NOLAN | I143: HARRISON | L143: WILMOTT | O143: MUDGE | Q143: ASH
A144: WILLIAMSTOWN | C144: JERRAM | F144: THOMAS | I144: HUGGINS | L144: McDONOUGH | O144: LAWLOR | Q144: WILLETT
A145: GOALKICKERS
A146: OAKLEIGH | C146: NOLAN 6 | F146: HARRISON 2 | I146: DRURY | K146: WILMOTT | N146: DOWLER | P146: WATSON | R146: G RYAN
A147: WILLIAMSTOWN | C147: LAWLOR 4 | F147: THOMAS 4 | I147: JERRAM 3 | L147: BROWN | N147: McCALLUM | Q147: JOHNSON
A149: PRESTON | C149: 4 | D149: 4 | E149: =C149*6+D149 -> 28 | G149: 9 | H149: 7 | I149: =G149*6+H149 -> 61 | K149: 15 | L149: 10 | M149: =K149*6+L149 -> 100 | O149: 18 | P149: 13 | Q149: =O149*6+P149 -> 121 | S149: PORT MELBOURNE
A150: PORT MELBOURNE | C150: 2 | D150: 4 | E150: =C150*6+D150 -> 16 | G150: 7 | H150: 10 | I150: =G150*6+H150 -> 52 | K150: 11 | L150: 14 | M150: =K150*6+L150 -> 80 | O150: 17 | P150: 17 | Q150: =O150*6+P150 -> 119 | S150: HAYES
A151: BEST PLAYERS
A152: PRESTON | C152: MURRAY | F152: DUNSTONE | I152: MASLEN | L152: ROACH | O152: ROBINSON | R152: WARREN
A153: PORT MELBOURNE | C153: LAHIFF | F153: PAYNE | I153: BLOOMER | L153: FREYER | O153: LA FANNUE | R153: MONOHAN
A154: GOALKICKERS
A155: PRESTON | C155: ROACH 5 | F155: WARREN 4 | I155: DUNSTONE 4 | L155: MURRAY 2 | O155: COOPER | Q155: N CAMPBELL | T155: H SMITH
A156: PORT MELBOURNE | C156: FREYER 8 | F156: LA FANNUE 6 | I156: LEE 2 | K156: LAHIFF
A158: YARRAVILLE | C158: 8 | D158: 5 | E158: =C158*6+D158 -> 53 | G158: 10 | H158: 7 | I158: =G158*6+H158 -> 67 | K158: 16 | L158: 14 | M158: =K158*6+L158 -> 110 | O158: 18 | P158: 14 | Q158: =O158*6+P158 -> 122 | S158: YARRAVILLE
A159: SANDRINGHAM | C159: 2 | D159: 1 | E159: =C159*6+D159 -> 13 | G159: 9 | H159: 7 | I159: =G159*6+H159 -> 61 | K159: 12 | L159: 10 | M159: =K159*6+L159 -> 82 | O159: 14 | P159: 18 | Q159: =O159*6+P159 -> 102 | S159: GREGORY
A160: BEST PLAYERS
A161: YARRAVILLE | C161: PARKS | E161: ANDERSON | H161: WEDGWOOD | K161: TRIBE | N161: JAMES | Q161: ROGERS
A162: SANDRINGHAM | C162: MILLER | E162: EDMONDS | H162: TOLSON | K162: WEBER | N162: GAINGER | Q162: FISHER
A163: GOALKICKERS
A164: YARRAVILLE | C164: RAWSON 5 | F164: TRIBE 4 | H164: TURNER 3 | J164: WEDGWOOD 2 | M164: PARKS | O164: EVANS | Q164: ROGERS | S164: KENNY
A165: SANDRINGHAM | C165: TOLSON 5 | F165: FISHER 3 | I165: WEBER 3 | K165: FREY 2 | M165: EDMONDS
A167: COBURG | C167: 6 | D167: 5 | E167: =C167*6+D167 -> 41 | G167: 11 | H167: 8 | I167: =G167*6+H167 -> 74 | K167: 16 | L167: 14 | M167: =K167*6+L167 -> 110 | O167: 21 | P167: 15 | Q167: =O167*6+P167 -> 141 | S167: CAMBERWELL
A168: CAMBERWELL | C168: 1 | D168: 1 | E168: =C168*6+D168 -> 7 | G168: 8 | H168: 5 | I168: =G168*6+H168 -> 53 | K168: 10 | L168: 6 | M168: =K168*6+L168 -> 66 | O168: 17 | P168: 10 | Q168: =O168*6+P168 -> 112 | S168: LEWIS
A169: BEST PLAYERS
A170: COBURG | C170: COLLINS | E170: DIXON | H170: IRVINE | K170: HENNING | N170: BERRYMAN | Q170: ESDALE
A171: CAMBERWELL | C171: NASH | E171: D WILKES | H171: LENNE | K171: MEEHAN | N171: BRETT | Q171: DAVIDSON
A172: GOALKICKERS
A173: COBURG | C173: COLLINS 9 | F173: THURGOOD 2 | I173: DIXON 2 | K173: ESDALE 2 | M173: FAY | O173: IRVINE | Q173: GAUDION | S173: WHITE | U173: JORDAN
A174: CAMBERWELL | C174: GRIFFITHS 5 | F174: NASH 4 | H174: DAVIDSON 2 | K174: BRAIN 2 | M174: BRETT | O174: FORD | Q174: JONES | S174: ROGERS
A176: ROUND 4 | E176: 30TH APRIL | J176: WEATHER | M176: FINE SOUTH BREEZE | S176: PLAYED AT
D177: 1ST QTR | H177: 2ND QTR | L177: 3RD QTR | P177: FINAL | S177: TOORAK PARK
A178: BRUNSWICK | C178: 3 | D178: 0 | E178: =C178*6+D178 -> 18 | G178: 8 | H178: 3 | I178: =G178*6+H178 -> 51 | K178: 10 | L178: 6 | M178: =K178*6+L178 -> 66 | O178: 16 | P178: 11 | Q178: =O178*6+P178 -> 107 | S178: UMPIRE | X178: LADDER | AB178: ROUND | AD178: 4
A179: PRAHRAN | C179: 6 | D179: 8 | E179: =C179*6+D179 -> 44 | G179: 7 | H179: 10 | I179: =G179*6+H179 -> 52 | K179: 13 | L179: 14 | M179: =K179*6+L179 -> 92 | O179: 15 | P179: 15 | Q179: =O179*6+P179 -> 105 | S179: LESTER
A180: BEST PLAYERS | W180: TEAM | X180: W | Y180: L | Z180: D | AA180: FOR | AB180: AGST | AC180: % | AD180: PTS
A181: BRUNSWICK | C181: CRAWFORD | F181: FAY | I181: CHALLENGER | L181: McGRATH | N181: DOWLING | Q181: McGORLICK
A182: PRAHRAN | C182: JOHNSON | F182: D MURRAY | I182: WHITE | L182: SMITH | N182: FLEMING | Q182: PORTER | W182: BRUNSWICK | X182: 4 | Y182: 0 | Z182: 0 | AA182: 440 | AB182: 313 | AC182: 140.57507987220447 | AD182: 16
A183: GOALKICKERS | W183: BRIGHTON | X183: 4 | Y183: 0 | Z183: 0 | AA183: 371 | AB183: 326 | AC183: 113.80368098159509 | AD183: 16
A184: BRUNSWICK | C184: CRAWFORD 5 | F184: BAILEY 4 | I184: MASKELL 3 | L184: McINNES 2 | N184: McKAY | P184: BOYD | W184: YARRAVILLE | X184: 3 | Y184: 1 | Z184: 0 | AA184: 395 | AB184: 355 | AC184: 111.26760563380282 | AD184: 12
A185: PRAHRAN | C185: PORTER 3 | F185: BRENCHLEY 3 | I185: NEESON 3 | L185: WHITE 2 | N185: THOMPSON 2 | Q185: GRANDISON 2 | W185: PRAHRAN | X185: 2 | Y185: 2 | Z185: 0 | AA185: 443 | AB185: 348 | AC185: 127.29885057471265 | AD185: 8
A187: COBURG | C187: 7 | D187: 6 | E187: =C187*6+D187 -> 48 | G187: 8 | H187: 8 | I187: =G187*6+H187 -> 56 | K187: 13 | L187: 15 | M187: =K187*6+L187 -> 93 | O187: 14 | P187: 18 | Q187: =O187*6+P187 -> 102 | S187: COBURG | W187: CAMBERWELL | X187: 2 | Y187: 2 | Z187: 0 | AA187: 452 | AB187: 431 | AC187: 104.87238979118329 | AD187: 8
A188: OAKLEIGH | C188: 0 | D188: 3 | E188: =C188*6+D188 -> 3 | G188: 7 | H188: 6 | I188: =G188*6+H188 -> 48 | K188: 9 | L188: 7 | M188: =K188*6+L188 -> 61 | O188: 11 | P188: 14 | Q188: =O188*6+P188 -> 80 | S188: GROVES | W188: COBURG | X188: 2 | Y188: 2 | Z188: 0 | AA188: 393 | AB188: 420 | AC188: 93.571428571428569 | AD188: 8
A189: BEST PLAYERS | W189: OAKLEIGH | X189: 2 | Y189: 2 | Z189: 0 | AA189: 371 | AB189: 404 | AC189: 91.831683168316829 | AD189: 8
A190: COBURG | C190: JORDAN | F190: HENNING | I190: PERRETT | L190: COLLINS | O190: LEONARD | Q190: DIXON | W190: SANDRINGHAM | X190: 1 | Y190: 3 | Z190: 0 | AA190: 399 | AB190: 416 | AC190: 95.913461538461533 | AD190: 4
A191: OAKLEIGH | C191: WITHERS | F191: BELL | I191: WATSON | L191: WILLIAMS | O191: CRAMERI | Q191: RUDD | W191: PORT MELBOURNE | X191: 1 | Y191: 3 | Z191: 0 | AA191: 375 | AB191: 401 | AC191: 93.516209476309228 | AD191: 4
A192: GOALKICKERS | W192: WILLIAMSTOWN | X192: 1 | Y192: 3 | Z192: 0 | AA192: 312 | AB192: 376 | AC192: 82.978723404255319 | AD192: 4
A193: COBURG | C193: COLLINS 7 | F193: DIXON 3 | I193: BERRYMAN | L193: IRVING | N193: PERRETT | P193: THURGOOD | W193: NORTHCOTE | X193: 1 | Y193: 3 | Z193: 0 | AA193: 270 | AB193: 343 | AC193: 78.717201166180757 | AD193: 4
A194: OAKLEIGH | C194: HARRISON 3 | F194: DRURY 2 | H194: CRAMERI | J194: WITHERS | L194: MUDGE | N194: NOLAN | P194: WILMOTT | R194: CORP | W194: PRESTON | X194: 1 | Y194: 3 | Z194: 0 | AA194: 320 | AB194: 408 | AC194: 78.431372549019613 | AD194: 4
A196: YARRAVILLE | C196: 2 | D196: 1 | E196: =C196*6+D196 -> 13 | G196: 6 | H196: 2 | I196: =G196*6+H196 -> 38 | K196: 10 | L196: 4 | M196: =K196*6+L196 -> 64 | O196: 13 | P196: 7 | Q196: =O196*6+P196 -> 85 | S196: NORTHCOTE
A197: NORTHCOTE | C197: 4 | D197: 4 | E197: =C197*6+D197 -> 28 | G197: 4 | H197: 12 | I197: =G197*6+H197 -> 36 | K197: 5 | L197: 16 | M197: =K197*6+L197 -> 46 | O197: 9 | P197: 19 | Q197: =O197*6+P197 -> 73 | S197: LAMING
A198: BEST PLAYERS
A199: YARRAVILLE | C199: PARKS | F199: HOWARTH | I199: TRIBE | L199: ROGERS | O199: TURNER | R199: WEDGWOOD
A200: NORTHCOTE | C200: NICHOLLS | F200: DOWNIE | I200: MEITZCKE | L200: ROSS | O200: McNAMARA | R200: HART
A201: GOALKICKERS
A202: YARRAVILLE | C202: TRIBE 4 | F202: HOWARTH 4 | I202: KENNY 2 | K202: WEDGWOOD 2 | N202: HAM
A203: NORTHCOTE | C203: THORNE 3 | F203: WEGNER 2 | I203: DOWNIE | K203: GRAY | M203: HONIG | O203: ROSS
A205: PORT MELBOURNE | C205: 0 | D205: 2 | E205: =C205*6+D205 -> 2 | G205: 6 | H205: 6 | I205: =G205*6+H205 -> 42 | K205: 7 | L205: 9 | M205: =K205*6+L205 -> 51 | O205: 10 | P205: 16 | Q205: =O205*6+P205 -> 76 | S205: WILLIAMSTOWN
A206: WILLIAMSTOWN | C206: 3 | D206: 3 | E206: =C206*6+D206 -> 21 | G206: 5 | H206: 5 | I206: =G206*6+H206 -> 35 | K206: 7 | L206: 12 | M206: =K206*6+L206 -> 54 | O206: 8 | P206: 12 | Q206: =O206*6+P206 -> 60 | S206: GREGORY
A207: BEST PLAYERS
A208: PORT MELBOURNE | C208: LAHIFF | F208: MONOHAN | I208: LE FANNUE | L208: EASTMUIR | O208: TUITE | R208: GOSS
A209: WILLIAMSTOWN | C209: THOMAS | F209: HARLAND | I209: CUTTING | L209: WILLETT | O209: PATERSON | R209: JOHNSON
A210: GOALKICKERS
A211: PORT MELBOURNE | C211: LAHIFF 3 | F211: GOSS 3 | I211: FREYER 2 | K211: LE FANNUE | N211: JONES
A212: WILLIAMSTOWN | C212: THOMAS 3 | F212: LAWLOR 2 | I212: HUGGINS | K212: DELLER | M212: PATERSON
A214: BRIGHTON | C214: 6 | D214: 10 | E214: =C214*6+D214 -> 46 | G214: 6 | H214: 11 | I214: =G214*6+H214 -> 47 | K214: 11 | L214: 21 | M214: =K214*6+L214 -> 87 | O214: 12 | P214: 23 | Q214: =O214*6+P214 -> 95 | S214: PRESTON
A215: PRESTON | C215: 2 | D215: 3 | E215: =C215*6+D215 -> 15 | G215: 4 | H215: 8 | I215: =G215*6+H215 -> 32 | K215: 8 | L215: 10 | M215: =K215*6+L215 -> 58 | O215: 13 | P215: 16 | Q215: =O215*6+P215 -> 94 | S215: LEWIS
A216: BEST PLAYERS
A217: BRIGHTON | C217: FITCHER | F217: PENNY | I217: BOLWELL | L217: RUDD | O217: CONNELL | Q217: WEBER
A218: PRESTON | C218: MURRAY | F218: JAMES | I218: CAMPBELL | L218: DOWLING | O218: ROACH | Q218: MASLEN
A219: GOALKICKERS
A220: BRIGHTON | C220: MILLER 3 | F220: PENNY 2 | I220: FITCHER 2 | L220: J EGAN 2 | O220: WEBER | Q220: BOLWELL | S220: POGUE
A221: PRESTON | C221: MURRAY 5 | F221: ROACH 3 | I221: TURNER 2 | L221: WALKER | N221: GILBERT | P221: LOWENTHAL
A223: SANDRINGHAM | C223: 1 | D223: 2 | E223: =C223*6+D223 -> 8 | G223: 9 | H223: 9 | I223: =G223*6+H223 -> 63 | K223: 13 | L223: 10 | M223: =K223*6+L223 -> 88 | O223: 22 | P223: 16 | Q223: =O223*6+P223 -> 148 | S223: BEACH ROAD
A224: CAMBERWELL | C224: 9 | D224: 4 | E224: =C224*6+D224 -> 58 | G224: 9 | H224: 5 | I224: =G224*6+H224 -> 59 | K224: 17 | L224: 11 | M224: =K224*6+L224 -> 113 | O224: 19 | P224: 12 | Q224: =O224*6+P224 -> 126 | S224: HAYES
A225: BEST PLAYERS
A226: SANDRINGHAM | C226: WEBER | E226: COMTE | H226: TOLSON | K226: EDMONDS | N226: McCOY | Q226: STAPLETON
A227: CAMBERWELL | C227: NASH | E227: LENNE | H227: TURNER | K227: DAVIDSON | N227: WHITE | Q227: ROGERS
A228: GOALKICKERS
A229: SANDRINGHAM | C229: WEBER 7 | F229: FISHER 6 | I229: FOSTER 2 | L229: TOLSON 2 | O229: EDMONDS 2 | R229: FREY 2 | U229: GAINGER
A230: CAMBERWELL | C230: NASH 10 | F230: DAVIDSON 3 | I230: HODGSON 3 | L230: MOORE | N230: WHITE | P230: BRAIN
A232: ROUND 5 | E232: 7TH MAY | J232: WEATHER | M232: FINE | S232: PLAYED AT
D233: 1ST QTR | H233: 2ND QTR | L233: 3RD QTR | P233: FINAL | S233: YARRAVILLE
A234: PRAHRAN | C234: 4 | D234: 3 | E234: =C234*6+D234 -> 27 | G234: 6 | H234: 10 | I234: =G234*6+H234 -> 46 | K234: 11 | L234: 21 | M234: =K234*6+L234 -> 87 | O234: 16 | P234: 22 | Q234: =O234*6+P234 -> 118 | S234: UMPIRE | X234: LADDER | AB234: ROUND | AD234: 5
A235: YARRAVILLE | C235: 1 | D235: 1 | E235: =C235*6+D235 -> 7 | G235: 5 | H235: 7 | I235: =G235*6+H235 -> 37 | K235: 7 | L235: 9 | M235: =K235*6+L235 -> 51 | O235: 12 | P235: 14 | Q235: =O235*6+P235 -> 86 | S235: HAYES
A236: BEST PLAYERS | W236: TEAM | X236: W | Y236: L | Z236: D | AA236: FOR | AB236: AGST | AC236: % | AD236: PTS
A237: PRAHRAN | C237: WILTSHIRE | F237: JOHNSON | I237: WHITE | K237: NEESON | N237: D MURRAY | Q237: FLEMING
A238: YARRAVILLE | C238: ANDERSON | F238: CAVE | I238: KENNY | K238: STREETER | N238: TRIBE | Q238: ROGERS | W238: BRUNSWICK | X238: 5 | Y238: 0 | Z238: 0 | AA238: 584 | AB238: 366 | AC238: 159.56284153005464 | AD238: 20
A239: GOALKICKERS | W239: BRIGHTON | X239: 4 | Y239: 0 | Z239: 1 | AA239: 492 | AB239: 447 | AC239: 110.06711409395973 | AD239: 18
A240: PRAHRAN | C240: NEESON 5 | E240: WHITE 4 | G240: BRENCHLEY 2 | J240: GRANDISON 2 | M240: MILNE | O240: PORTER | Q240: THOMPSON | W240: PRAHRAN | X240: 3 | Y240: 2 | Z240: 0 | AA240: 561 | AB240: 434 | AC240: 129.2626728110599 | AD240: 12
A241: YARRAVILLE | C241: TRIBE 4 | E241: PARKS | G241: WEDGWOOD | J241: EVANS | L241: ROGERS | N241: TURNER | P241: HOWARTH | R241: REEVES | W241: YARRAVILLE | X241: 3 | Y241: 2 | Z241: 0 | AA241: 481 | AB241: 473 | AC241: 101.69133192389006 | AD241: 12
Q242: RAWSON
A243: SANDRINGHAM | C243: 3 | D243: 2 | E243: =C243*6+D243 -> 20 | G243: 7 | H243: 6 | I243: =G243*6+H243 -> 48 | K243: 13 | L243: 8 | M243: =K243*6+L243 -> 86 | O243: 18 | P243: 12 | Q243: =O243*6+P243 -> 120 | S243: OAKLEIGH | W243: CAMBERWELL | X243: 2 | Y243: 3 | Z243: 0 | AA243: 575 | AB243: 560 | AC243: 102.67857142857143 | AD243: 8
A244: OAKLEIGH | C244: 4 | D244: 4 | E244: =C244*6+D244 -> 28 | G244: 12 | H244: 9 | I244: =G244*6+H244 -> 81 | K244: 13 | L244: 12 | M244: =K244*6+L244 -> 90 | O244: 14 | P244: 14 | Q244: =O244*6+P244 -> 98 | S244: GROVES | W244: SANDRINGHAM | X244: 2 | Y244: 3 | Z244: 0 | AA244: 519 | AB244: 514 | AC244: 100.9727626459144 | AD244: 8
A245: BEST PLAYERS | W245: COBURG | X245: 2 | Y245: 3 | Z245: 0 | AA245: 453 | AB245: 488 | AC245: 92.827868852459019 | AD245: 8
A246: SANDRINGHAM | C246: FOSTER | E246: SAUNDERS | H246: WEBER | K246: TORPY | N246: McCOY | Q246: STAPLETON | W246: OAKLEIGH | X246: 2 | Y246: 3 | Z246: 0 | AA246: 469 | AB246: 524 | AC246: 89.503816793893137 | AD246: 8
A247: OAKLEIGH | C247: REID | E247: WILLIAMS | H247: ASH | K247: HARRISON | N247: CRAMERI | Q247: NOLAN | W247: WILLIAMSTOWN | X247: 2 | Y247: 3 | Z247: 0 | AA247: 380 | AB247: 436 | AC247: 87.155963302752298 | AD247: 8
A248: GOALKICKERS | W248: NORTHCOTE | X248: 2 | Y248: 3 | Z248: 0 | AA248: 399 | AB248: 466 | AC248: 85.622317596566518 | AD248: 8
A249: SANDRINGHAM | C249: FISHER 6 | F249: WEBER 6 | I249: FREY 2 | K249: TOLSON 2 | N249: FOSTER | P249: SAUNDERS | W249: PORT MELBOURNE | X249: 1 | Y249: 3 | Z249: 1 | AA249: 496 | AB249: 522 | AC249: 95.019157088122611 | AD249: 6
A250: OAKLEIGH | C250: NOLAN 5 | F250: CRAMERI 2 | I250: HARRISON 2 | L250: WILMOTT 2 | O250: MUDGE 2 | Q250: DRURY | W250: PRESTON | X250: 1 | Y250: 4 | Z250: 0 | AA250: 373 | AB250: 552 | AC250: 67.572463768115938 | AD250: 4
A252: WILLIAMSTOWN | C252: 4 | D252: 8 | E252: =C252*6+D252 -> 32 | G252: 4 | H252: 16 | I252: =G252*6+H252 -> 40 | K252: 4 | L252: 21 | M252: =K252*6+L252 -> 45 | O252: 7 | P252: 26 | Q252: =O252*6+P252 -> 68 | S252: WILLIAMSTOWN
A253: COBURG | C253: 1 | D253: 1 | E253: =C253*6+D253 -> 7 | G253: 3 | H253: 4 | I253: =G253*6+H253 -> 22 | K253: 5 | L253: 8 | M253: =K253*6+L253 -> 38 | O253: 8 | P253: 12 | Q253: =O253*6+P253 -> 60 | S253: LEWIS
A254: BEST PLAYERS
A255: WILLIAMSTOWN | C255: CUTTING | E255: WIMOTT | H255: JAMIESON | K255: HARLAND | N255: PATERSON | Q255: JOHNSON
A256: COBURG | C256: BRAGG | E256: DIXON | H256: LEONARD | K256: HILL | N256: COLLINS | Q256: WALLACE
A257: GOALKICKERS
A258: WILLIAMSTOWN | C258: PATERSON 2 | F258: ROWAN 2 | I258: HUGGINS | L258: DELLER | N258: JAMIESON
A259: COBURG | C259: COLLINS 5 | F259: ESDALE | I259: WHITE | L259: DIXON
A261: PORT MELBOURNE | C261: 3 | D261: 1 | E261: =C261*6+D261 -> 19 | G261: 9 | H261: 3 | I261: =G261*6+H261 -> 57 | K261: 12 | L261: 8 | M261: =K261*6+L261 -> 80 | O261: 18 | P261: 13 | Q261: =O261*6+P261 -> 121 | S261: PORT MELBOURNE
A262: BRIGHTON | C262: 2 | D262: 8 | E262: =C262*6+D262 -> 20 | G262: 6 | H262: 13 | I262: =G262*6+H262 -> 49 | K262: 12 | L262: 16 | M262: =K262*6+L262 -> 88 | O262: 17 | P262: 19 | Q262: =O262*6+P262 -> 121 | S262: MALLETT
A263: BEST PLAYERS
A264: PORT MELBOURNE | C264: FREYER | E264: MONOHAN | H264: LE FANNUE | K264: LAHIFF | N264: ALSOP | Q264: GROSSMAN
A265: BRIGHTON | C265: RUDD | E265: BOLWELL | H265: GEORGE | K265: WEBER | N265: PENNY | Q265: CONNELL
A266: GOALKICKERS
A267: PORT MELBOURNE | C267: LE FANNUE 7 | F267: FREYER 6 | I267: GOSS | J267: MONOHAN | M267: FORREST | O267: GROSSMAN | R267: JONES
A268: BRIGHTON | C268: BOLWELL 6 | F268: CONNELL 4 | I268: J EGAN 3 | K268: POGUE 2 | M268: PENNY | O268: OPREY
A270: NORTHCOTE | C270: 3 | D270: 6 | E270: =C270*6+D270 -> 24 | G270: 7 | H270: 10 | I270: =G270*6+H270 -> 52 | K270: 13 | L270: 11 | M270: =K270*6+L270 -> 89 | O270: 19 | P270: 15 | Q270: =O270*6+P270 -> 129 | S270: CAMBERWELL
A271: CAMBERWELL | C271: 6 | D271: 3 | E271: =C271*6+D271 -> 39 | G271: 10 | H271: 5 | I271: =G271*6+H271 -> 65 | K271: 15 | L271: 7 | M271: =K271*6+L271 -> 97 | O271: 19 | P271: 9 | Q271: =O271*6+P271 -> 123 | S271: LESTER
A272: BEST PLAYERS
A273: NORTHCOTE | C273: ROSS | F273: HOUGHTON | I273: MEITZCKE | L273: B HART | N273: HOLDEN | Q273: SIMPSON
A274: CAMBERWELL | C274: DAVIDSON | F274: RIGERS | I274: MEEHAN | L274: JONES | N274: NASH | Q274: WILKES
A275: GOALKICKERS
A276: NORTHCOTE | C276: LAMPRELL 5 | F276: ROSS 4 | I276: THORNE 3 | L276: HOUGHTON 2 | O276: DOWNIE 2 | R276: GRAY | U276: SIMPSON | X276: SMITH
A277: CAMBERWELL | C277: NASH 5 | F277: BROWN 4 | I277: HODGSON 3 | L277: TURNER 2 | O277: ECCLES 2 | R277: DAVIDSON | U277: ROGERS | X277: MEEHAN
A279: BRUNSWICK | C279: 4 | D279: 2 | E279: =C279*6+D279 -> 26 | G279: 7 | H279: 7 | I279: =G279*6+H279 -> 49 | K279: 15 | L279: 14 | M279: =K279*6+L279 -> 104 | O279: 21 | P279: 18 | Q279: =O279*6+P279 -> 144 | S279: BRUNSWICK
A280: PRESTON | C280: 1 | D280: 7 | E280: =C280*6+D280 -> 13 | G280: 4 | H280: 12 | I280: =G280*6+H280 -> 36 | K280: 5 | L280: 13 | M280: =K280*6+L280 -> 43 | O280: 6 | P280: 17 | Q280: =O280*6+P280 -> 53 | S280: GREGORY
A281: BEST PLAYERS
A282: BRUNSWICK | C282: BAILEY | F282: McKERNAN | I282: McINNES | L282: TURNER | N282: DOWLING | Q282: McGRATH
A283: PRESTON | C283: LOWENTHAL | F283: MURRAY | I283: BEAGLEY | L283: HASKETT | N283: JOB | Q283: ROBINSON
A284: GOALKICKERS
A285: BRUNSWICK | C285: DOWLING 6 | F285: McINNES 6 | I285: McKAY 3 | K285: GARDNER | M285: QUINN | O285: BAILEY | Q285: TOONE | S285: CRAWFORD | V285: BOYD
A286: PRESTON | C286: ROBINSON 4 | F286: HARDING | I286: ROACH
A288: ROUND 6 | E288: 14TH MAY | J288: WEATHER | M288: FINE | S288: PLAYED AT
D289: 1ST QTR | H289: 2ND QTR | L289: 3RD QTR | P289: FINAL | S289: ELSTERNWICK PARK
A290: BRUNSWICK | C290: 4 | D290: 3 | E290: =C290*6+D290 -> 27 | G290: 5 | H290: 4 | I290: =G290*6+H290 -> 34 | K290: 10 | L290: 6 | M290: =K290*6+L290 -> 66 | O290: 14 | P290: 13 | Q290: =O290*6+P290 -> 97 | S290: UMPIRE | X290: LADDER | AB290: ROUND | AD290: 6
A291: BRIGHTON | C291: 3 | D291: 3 | E291: =C291*6+D291 -> 21 | G291: 7 | H291: 5 | I291: =G291*6+H291 -> 47 | K291: 10 | L291: 8 | M291: =K291*6+L291 -> 68 | O291: 13 | P291: 13 | Q291: =O291*6+P291 -> 91 | S291: GROVES
A292: BEST PLAYERS | W292: TEAM | X292: W | Y292: L | Z292: D | AA292: FOR | AB292: AGST | AC292: % | AD292: PTS
A293: BRUNSWICK | C293: McINNES | F293: BOYD | I293: COOPER | L293: FAY | N293: DOWLING | Q293: DAVIS
A294: BRIGHTON | C294: HALLAHAN | F294: PENNY | I294: HINDSON | L294: BOLWELL | N294: HONE | Q294: RUDD | W294: BRUNSWICK | X294: 6 | Y294: 0 | Z294: 0 | AA294: 681 | AB294: 457 | AC294: 149.02 | AD294: 24
A295: GOALKICKERS | W295: BRIGHTON | X295: 4 | Y295: 1 | Z295: 1 | AA295: 583 | AB295: 544 | AC295: 107.17 | AD295: 18
A296: BRUNSWICK | C296: McINNES 7 | F296: McKAY 2 | I296: QUINN 2 | L296: BOYD | N296: McGRATH | Q296: BAILEY | W296: PRAHRAN | X296: 3 | Y296: 3 | Z296: 0 | AA296: 658 | AB296: 570 | AC296: 115.44 | AD296: 12
A297: BRIGHTON | C297: BOLWELL 3 | F297: POGUE 3 | I297: FITCHER 2 | L297: PENNY 2 | N297: MILLER | P297: DEANE | R297: JOHNSON | W297: CAMBERWELL | X297: 3 | Y297: 3 | Z297: 0 | AA297: 711 | AB297: 657 | AC297: 108.22 | AD297: 12
A299: CAMBERWELL | C299: 6 | D299: 1 | E299: =C299*6+D299 -> 37 | G299: 8 | H299: 5 | I299: =G299*6+H299 -> 53 | K299: 13 | L299: 11 | M299: =K299*6+L299 -> 89 | O299: 20 | P299: 16 | Q299: =O299*6+P299 -> 136 | S299: TOORAK PARK | W299: SANDRINGHAM | X299: 3 | Y299: 3 | Z299: 0 | AA299: 673 | AB299: 656 | AC299: 102.59146341463415 | AD299: 12
A300: PRAHRAN | C300: 3 | D300: 5 | E300: =C300*6+D300 -> 23 | G300: 8 | H300: 6 | I300: =G300*6+H300 -> 54 | K300: 12 | L300: 12 | M300: =K300*6+L300 -> 84 | O300: 14 | P300: 13 | Q300: =O300*6+P300 -> 97 | S300: GREGORY | W300: COBURG | X300: 3 | Y300: 3 | Z300: 0 | AA300: 564 | AB300: 570 | AC300: 98.94736842105263 | AD300: 12
A301: BEST PLAYERS | W301: YARRAVILLE | X301: 3 | Y301: 3 | Z301: 0 | AA301: 555 | AB301: 578 | AC301: 96.020761245674734 | AD301: 12
A302: CAMBERWELL | C302: WILLIAMS | F302: SEELENMEYER | I302: ECCLES | L302: HORKINGS | N302: DAVIDSON | Q302: MILLARD | W302: NORTHCOTE | X302: 3 | Y302: 3 | Z302: 0 | AA302: 535 | AB302: 558 | AC302: 95.878136200716852 | AD302: 12
A303: PRAHRAN | C303: WHITE | F303: NEESON | I303: D MURRAY | L303: PORTER | N303: WILTSHIRE | Q303: MILNE | W303: WILLIAMSTOWN | X303: 2 | Y303: 4 | Z303: 0 | AA303: 522 | AB303: 590 | AC303: 88.474576271186436 | AD303: 8
A304: GOALKICKERS | O304: FORD | Q304: MILLARD | W304: OAKLEIGH | X304: 2 | Y304: 4 | Z304: 0 | AA304: 561 | AB304: 660 | AC304: 85 | AD304: 8
A305: CAMBERWELL | C305: WILLIAMS 4 | F305: COX 4 | H305: NASH 3 | J305: DAVIDSON 2 | M305: JONES 2 | O305: TURNER | Q305: KECK | R305: ECCLES | W305: PRESTON | X305: 2 | Y305: 4 | Z305: 0 | AA305: 478 | AB305: 626 | AC305: 76.357827476038338 | AD305: 8
A306: PRAHRAN | C306: WHITE 6 | F306: NEESON 3 | I306: LAWLOR 2 | L306: THOMPSON 2 | O306: PORTER | W306: PORT MELBOURNE | X306: 1 | Y306: 4 | Z306: 1 | AA306: 578 | AB306: 633 | AC306: 91.31121642969984 | AD306: 6
A308: SANDRINGHAM | C308: 3 | D308: 7 | E308: =C308*6+D308 -> 25 | G308: 8 | H308: 13 | I308: =G308*6+H308 -> 61 | K308: 13 | L308: 16 | M308: =K308*6+L308 -> 94 | O308: 22 | P308: 22 | Q308: =O308*6+P308 -> 154 | S308: BEACH ROAD
A309: WILLIAMSTOWN | C309: 5 | D309: 4 | E309: =C309*6+D309 -> 34 | G309: 10 | H309: 8 | I309: =G309*6+H309 -> 68 | K309: 17 | L309: 15 | M309: =K309*6+L309 -> 117 | O309: 21 | P309: 16 | Q309: =O309*6+P309 -> 142 | S309: HAYES
A310: BEST PLAYERS
A311: SANDRINGHAM | C311: SAUNDERS | F311: COMTE | I311: TOLSON | L311: MEEHAN | O311: STAPLETON | R311: FISHER
A312: WILLIAMSTOWN | C312: WALSH | F312: HARLAND | I312: PATERSON | L312: McDONOUGH | O312: THOMAS | R312: BURNETT
A313: GOALKICKERS
A314: SANDRINGHAM | C314: FISHER 6 | F314: WEBER 4 | I314: HARTNETT 3 | L314: COMTE 3 | N314: GAINGER 2 | Q314: SAUNDERS | T314: TOLSON | W314: FOSTER | X314: TORPY
A315: WILLIAMSTOWN | C315: BURNETT 5 | F315: KAUFMAN 4 | I315: RICHARDSON 4 | L315: PATERSON 3 | O315: JAMIESON 2 | R315: FITCH 2 | U315: HARLAND
A317: NORTHCOTE | C317: 6 | D317: 2 | E317: =C317*6+D317 -> 38 | G317: 13 | H317: 8 | I317: =G317*6+H317 -> 86 | K317: 15 | L317: 13 | M317: =K317*6+L317 -> 103 | O317: 20 | P317: 16 | Q317: =O317*6+P317 -> 136 | S317: NORTHCOTE
A318: OAKLEIGH | C318: 4 | D318: 3 | E318: =C318*6+D318 -> 27 | G318: 5 | H318: 7 | I318: =G318*6+H318 -> 37 | K318: 6 | L318: 12 | M318: =K318*6+L318 -> 48 | O318: 13 | P318: 14 | Q318: =O318*6+P318 -> 92 | S318: LEWIS
A319: BEST PLAYERS
A320: NORTHCOTE | C320: POWELL | F320: HOLDEN | I320: WATT | L320: ROSS | O320: SIMPSON | Q320: DOWNIE
A321: OAKLEIGH | C321: WILLIAMS | F321: HUTCHESON | I321: D RYAN | L321: DOWLER | O321: NOLAN | Q321: HARRISON
A322: GOALKICKERS
A323: NORTHCOTE | C323: DOWNIE 6 | F323: SIMPSON 4 | I323: MEITZCKE 2 | L323: LAMPRELL 2 | O323: GRAY | Q323: ROSS | S323: THORNE | V323: NEWMAN | X323: HOUGHTON
A324: OAKLEIGH | C324: NOLAN 5 | F324: DOWLER 4 | I324: HARRISON | L324: G RYAN | N324: FISCHER | P324: CRAMERI
A326: COBURG | C326: 5 | D326: 3 | E326: =C326*6+D326 -> 33 | G326: 10 | H326: 5 | I326: =G326*6+H326 -> 65 | K326: 12 | L326: 10 | M326: =K326*6+L326 -> 82 | O326: 16 | P326: 15 | Q326: =O326*6+P326 -> 111 | S326: COBURG
A327: PORT MELBOURNE | C327: 2 | D327: 3 | E327: =C327*6+D327 -> 15 | G327: 4 | H327: 8 | I327: =G327*6+H327 -> 32 | K327: 8 | L327: 8 | M327: =K327*6+L327 -> 56 | O327: 12 | P327: 10 | Q327: =O327*6+P327 -> 82 | S327: LESTER
A328: BEST PLAYERS
A329: COBURG | C329: COLLINS | F329: IRVINE | I329: PERRETT | L329: LEONARD | O329: BRAGG | Q329: RALSTON
A330: PORT MELBOURNE | C330: JONES | F330: BLOOMER | I330: LE FANNUE | L330: TUITE | O330: GOSS | Q330: ALSOP
A331: GOALKICKERS
A332: COBURG | C332: COLLINS 6 | F332: RALSTON 4 | I332: DIXON 2 | L332: HENNING 2 | O332: PERRETT 2
A333: PORT MELBOURNE | C333: FREYER 3 | F333: LAHIFF 3 | I333: FORREST 2 | L333: LE FANNUE 2 | O333: FINN | Q333: JONES
A335: PRESTON | C335: 3 | D335: 5 | E335: =C335*6+D335 -> 23 | G335: 7 | H335: 10 | I335: =G335*6+H335 -> 52 | K335: 10 | L335: 10 | M335: =K335*6+L335 -> 70 | O335: 15 | P335: 15 | Q335: =O335*6+P335 -> 105 | S335: PRESTON
A336: YARRAVILLE | C336: 0 | D336: 6 | E336: =C336*6+D336 -> 6 | G336: 4 | H336: 8 | I336: =G336*6+H336 -> 32 | K336: 8 | L336: 12 | M336: =K336*6+L336 -> 60 | O336: 10 | P336: 14 | Q336: =O336*6+P336 -> 74 | S336: SETTER
A337: BEST PLAYERS
A338: PRESTON | C338: LOWENTHAL | F338: JONES | I338: MURRAY | L338: DUNSTONE | O338: DOWLING | Q338: HASKETT
A339: YARRAVILLE | C339: PARKS | F339: RAWSON | I339: HAFFENDON | L339: FREW | O339: ROGERS | Q339: EVANS
A340: GOALKICKERS
A341: PRESTON | C341: ROACH 6 | F341: DUNSTONE 4 | I341: MURRAY 3 | L341: CAMPBELL | N341: BROWN
A342: YARRAVILLE | C342: PARKS 3 | F342: TRIBE 3 | I342: WEDGWOOD | L342: TURNER | N342: PANNELL | Q342: RAWSON
A344: ROUND 7 | E344: 21ST MAY | J344: WEATHER | M344: FINE | S344: PLAYED AT
D345: 1ST QTR | H345: 2ND QTR | L345: 3RD QTR | P345: FINAL | S345: YARRAVILLE
A346: BRIGHTON | C346: 3 | D346: 2 | E346: =C346*6+D346 -> 20 | G346: 5 | H346: 6 | I346: =G346*6+H346 -> 36 | K346: 9 | L346: 12 | M346: =K346*6+L346 -> 66 | O346: 18 | P346: 17 | Q346: =O346*6+P346 -> 125 | S346: UMPIRE | X346: LADDER | AB346: ROUND | AD346: 7
A347: YARRAVILLE | C347: 5 | D347: 5 | E347: =C347*6+D347 -> 35 | G347: 7 | H347: 6 | I347: =G347*6+H347 -> 48 | K347: 8 | L347: 12 | M347: =K347*6+L347 -> 60 | O347: 9 | P347: 13 | Q347: =O347*6+P347 -> 67 | S347: SETTER
A348: BEST PLAYERS | W348: TEAM | X348: W | Y348: L | Z348: D | AA348: FOR | AB348: AGST | AC348: % | AD348: PTS
A349: BRIGHTON | C349: PENNY | E349: HONE | G349: HALLAHAN | J349: WEBER | M349: BOLWELL | P349: N EGAN
A350: YARRAVILLE | C350: KENNY | E350: JONES | G350: BONIFACE | J350: HEFFERNAN | M350: ANDERSON | P350: BLACKMAN | W350: BRUNSWICK | X350: 7 | Y350: 0 | Z350: 0 | AA350: 816 | AB350: 547 | AC350: 149.18 | AD350: 28
A351: GOALKICKERS | Q351: CONNELL | W351: BRIGHTON | X351: 5 | Y351: 1 | Z351: 1 | AA351: 708 | AB351: 611 | AC351: 115.88 | AD351: 22
A352: BRIGHTON | C352: FITCHER 4 | E352: PENNY 4 | G352: MILLER 2 | I352: POGUE 2 | K352: BOLWELL 2 | N352: HONE | P352: WEBER | R352: JOHNSON | W352: PRAHRAN | X352: 4 | Y352: 3 | Z352: 0 | AA352: 769 | AB352: 680 | AC352: 113.09 | AD352: 16
A353: YARRAVILLE | C353: KENNY 3 | E353: TRIBE 2 | G353: BOGIE | I353: JAMES | K353: SUTTON | M353: WEDGWOOD | W353: CAMBERWELL | X353: 4 | Y353: 3 | Z353: 0 | AA353: 818 | AB353: 753 | AC353: 108.63 | AD353: 16
A355: SANDRINGHAM | C355: 4 | D355: 4 | E355: =C355*6+D355 -> 28 | G355: 6 | H355: 7 | I355: =G355*6+H355 -> 43 | K355: 8 | L355: 10 | M355: =K355*6+L355 -> 58 | O355: 15 | P355: 16 | Q355: =O355*6+P355 -> 106 | S355: COBURG | W355: NORTHCOTE | X355: 4 | Y355: 3 | Z355: 0 | AA355: 669 | AB355: 641 | AC355: 104.36817472698908 | AD355: 16
A356: COBURG | C356: 3 | D356: 5 | E356: =C356*6+D356 -> 23 | G356: 6 | H356: 11 | I356: =G356*6+H356 -> 47 | K356: 9 | L356: 19 | M356: =K356*6+L356 -> 73 | O356: 12 | P356: 23 | Q356: =O356*6+P356 -> 95 | S356: LEWIS | W356: SANDRINGHAM | X356: 4 | Y356: 3 | Z356: 0 | AA356: 779 | AB356: 751 | AC356: 103.728362183755 | AD356: 16
A357: BEST PLAYERS | W357: COBURG | X357: 3 | Y357: 4 | Z357: 0 | AA357: 659 | AB357: 676 | AC357: 97.485207100591722 | AD357: 12
A358: SANDRINGHAM | C358: STAPLETON | F358: FOSTER | I358: FREY | L358: MILLER | N358: COMTE | Q358: WEBER | W358: YARRAVILLE | X358: 3 | Y358: 4 | Z358: 0 | AA358: 622 | AB358: 703 | AC358: 88.477951635846367 | AD358: 12
A359: COBURG | C359: BERRYMAN | F359: WHITE | I359: DIXON | L359: RE | N359: SCANLON | Q359: HENNING | W359: OAKLEIGH | X359: 2 | Y359: 5 | Z359: 0 | AA359: 671 | AB359: 771 | AC359: 87.029831387808045 | AD359: 8
A360: GOALKICKERS | W360: WILLIAMSTOWN | X360: 2 | Y360: 5 | Z360: 0 | AA360: 605 | AB360: 724 | AC360: 83.563535911602216 | AD360: 8
A361: SANDRINGHAM | C361: FISHER 4 | F361: WEBER 4 | I361: COMTE 2 | K361: FREY 2 | M361: SAUNDERS | P361: FOSTER | R361: TOLSON | W361: PRESTON | X361: 2 | Y361: 5 | Z361: 0 | AA361: 574 | AB361: 733 | AC361: 78.308321964529327 | AD361: 8
A362: COBURG | C362: COLLINS 5 | F362: DIXON 2 | I362: IRVINE | K362: RALSTON | M362: JORDAN | O362: ESDALE | Q362: SCANLON | W362: PORT MELBOURNE | X362: 1 | Y362: 5 | Z362: 1 | AA362: 668 | AB362: 768 | AC362: 86.979166666666671 | AD362: 6
A364: NORTHCOTE | C364: 6 | D364: 3 | E364: =C364*6+D364 -> 39 | G364: 12 | H364: 4 | I364: =G364*6+H364 -> 76 | K364: 19 | L364: 10 | M364: =K364*6+L364 -> 124 | O364: 20 | P364: 14 | Q364: =O364*6+P364 -> 134 | S364: WILLIAMSTOWN
A365: WILLIAMSTOWN | C365: 2 | D365: 1 | E365: =C365*6+D365 -> 13 | G365: 5 | H365: 3 | I365: =G365*6+H365 -> 33 | K365: 6 | L365: 7 | M365: =K365*6+L365 -> 43 | O365: 12 | P365: 11 | Q365: =O365*6+P365 -> 83 | S365: GROVES
A366: BEST PLAYERS
A367: NORTHCOTE | C367: SIMPSON | E367: MEITZCKE | H367: LAMPRELL | K367: DOWNIE | N367: HONIG | Q367: LYNGCOLN
A368: WILLIAMSTOWN | C368: RAE | E368: HARLAND | H368: CUTTING | K368: JOHNSON | N368: JAMIESON | Q368: THOMAS
A369: GOALKICKERS
A370: NORTHCOTE | C370: DOWNIE 5 | F370: HOUGHTON 4 | I370: SIMPSON 3 | L370: MEITZCKE 3 | O370: ROSS 3 | Q370: GRAY 2
A371: WILLIAMSTOWN | C371: THOMAS 3 | F371: ROWAN 2 | I371: RICHARDSON 2 | L371: McDONOUGH 2 | O371: FITCH | Q371: BURNETT | S371: JAMIESON
A373: PRAHRAN | C373: 5 | D373: 2 | E373: =C373*6+D373 -> 32 | G373: 6 | H373: 3 | I373: =G373*6+H373 -> 39 | K373: 11 | L373: 8 | M373: =K373*6+L373 -> 74 | O373: 17 | P373: 9 | Q373: =O373*6+P373 -> 111 | S373: OAKLEIGH
A374: OAKLEIGH | C374: 2 | D374: 3 | E374: =C374*6+D374 -> 15 | G374: 5 | H374: 10 | I374: =G374*6+H374 -> 40 | K374: 10 | L374: 17 | M374: =K374*6+L374 -> 77 | O374: 15 | P374: 20 | Q374: =O374*6+P374 -> 110 | S374: GREGORY
A375: BEST PLAYERS
A376: PRAHRAN | C376: JOHNSON | F376: WHITE | I376: SMITH | L376: DREW | O376: THOMPSON | R376: NEESON
A377: OAKLEIGH | C377: ASH | F377: WATSON | I377: NOLAN | L377: CRAMERI | O377: WILSON | R377: BELL
A378: GOALKICKERS
A379: PRAHRAN | C379: THOMPSON 4 | F379: NEESON 4 | I379: PROBYN 3 | L379: PORTER 2 | N379: WHITE 2 | P379: SLADE | R379: MILNE
A380: OAKLEIGH | C380: DOWLER 6 | F380: NOLAN 5 | I380: HARRRISON 2 | L380: CRAMERI | N380: SMITH
A382: CAMBERWELL | C382: 2 | D382: 12 | E382: =C382*6+D382 -> 24 | G382: 5 | H382: 15 | I382: =G382*6+H382 -> 45 | K382: 10 | L382: 19 | M382: =K382*6+L382 -> 79 | O382: 14 | P382: 23 | Q382: =O382*6+P382 -> 107 | S382: CAMBERWELL
A383: PRESTON | C383: 4 | D383: 2 | E383: =C383*6+D383 -> 26 | G383: 8 | H383: 6 | I383: =G383*6+H383 -> 54 | K383: 11 | L383: 8 | M383: =K383*6+L383 -> 74 | O383: 14 | P383: 12 | Q383: =O383*6+P383 -> 96 | S383: LESTER
A384: BEST PLAYERS
A385: CAMBERWELL | C385: HILLARD | F385: SEELENMEYER | J385: NASH | M385: BRAIN | P385: COX | R385: DAVIDSON
A386: PRESTON | C386: WATSON | F386: MURRAY | J386: CAMPBELL | M386: JONES | P386: ROACH | R386: ROBINSON
A387: GOALKICKERS
A388: CAMBERWELL | C388: NASH 5 | F388: BRAIN 2 | I388: DAVIDSON 2 | L388: COX | N388: KECK | P388: ECCLES | R388: TURNER | U388: WILLIAMS
A389: PRESTON | C389: ROACH 6 | F389: MURRAY 4 | I389: DUNSTONE 2 | L389: ROGERS | N389: WARREN
A391: BRUNSWICK | C391: 5 | D391: 7 | E391: =C391*6+D391 -> 37 | G391: 11 | H391: 12 | I391: =G391*6+H391 -> 78 | K391: 16 | L391: 16 | M391: =K391*6+L391 -> 112 | O391: 19 | P391: 21 | Q391: =O391*6+P391 -> 135 | S391: PORT MELBOURNE
A392: PORT MELBOURNE | C392: 2 | D392: 2 | E392: =C392*6+D392 -> 14 | G392: 4 | H392: 7 | I392: =G392*6+H392 -> 31 | K392: 9 | L392: 12 | M392: =K392*6+L392 -> 66 | O392: 13 | P392: 12 | Q392: =O392*6+P392 -> 90 | S392: HAYES
A393: BEST PLAYERS
A394: BRUNSWICK | C394: DOWLING | F394: BAILEY | I394: BOYD | L394: FAY | O394: McINNES | Q394: CRAWFORD
A395: PORT MELBOURNE | C395: MONOHAN | F395: DOBSON | I395: LAHIFF | L395: EASTMUIR | O395: TUITE | Q395: ALSOP
A396: GOALKICKERS
A397: BRUNSWICK | C397: McINNES 8 | F397: BAILEY 3 | I397: CRAWFORD 2 | L397: BOYD 2 | N397: McKAY | P397: DOWLING | R397: KANNGEISER | V397: McGRATH
A398: PORT MELBOURNE | C398: FREYER 5 | F398: LE FANNUE 3 | I398: JONES 2 | L398: LAHIFF | N398: EASTMUIR | Q398: McKENZIE
A400: ROUND 8 | E400: 28TH MAY | J400: WEATHER | M400: CLOUDY WEST BREEZE | S400: PLAYED AT
D401: 1ST QTR | H401: 2ND QTR | L401: 3RD QTR | P401: FINAL | S401: ELSTERNWICK PARK
A402: BRIGHTON | C402: 5 | D402: 2 | E402: =C402*6+D402 -> 32 | G402: 13 | H402: 7 | I402: =G402*6+H402 -> 85 | K402: 16 | L402: 12 | M402: =K402*6+L402 -> 108 | O402: 22 | P402: 21 | Q402: =O402*6+P402 -> 153 | S402: UMPIRE | X402: LADDER | AB402: ROUND | AD402: 8
A403: CAMBERWELL | C403: 8 | D403: 3 | E403: =C403*6+D403 -> 51 | G403: 10 | H403: 5 | I403: =G403*6+H403 -> 65 | K403: 19 | L403: 10 | M403: =K403*6+L403 -> 124 | O403: 21 | P403: 13 | Q403: =O403*6+P403 -> 139 | S403: GREGORY
A404: BEST PLAYERS | W404: TEAM | X404: W | Y404: L | Z404: D | AA404: FOR | AB404: AGST | AC404: % | AD404: PTS
A405: BRIGHTON | C405: BOLWELL | F405: PENNY | I405: HONE | K405: HINDSON | N405: MILLER | Q405: DEANE
A406: CAMBERWELL | C406: NASH | F406: WILLIAMS | I406: LENNE | K406: HILLARD | N406: NEWTON | Q406: JONES | W406: BRUNSWICK | X406: 8 | Y406: 0 | Z406: 0 | AA406: 970 | AB406: 626 | AC406: 154.95 | AD406: 32
A407: GOALKICKERS | Q407: JOHNSON | W407: BRIGHTON | X407: 6 | Y407: 1 | Z407: 1 | AA407: 861 | AB407: 750 | AC407: 114.8 | AD407: 26
A408: BRIGHTON | C408: PENNY 6 | F408: HONE 5 | H408: BOLWELL 4 | K408: DEANE 2 | M408: CONNELL 2 | P408: MILLER | R408: FITCHER | W408: PRAHRAN | X408: 5 | Y408: 3 | Z408: 0 | AA408: 952 | AB408: 760 | AC408: 125.26 | AD408: 20
A409: CAMBERWELL | C409: NASH 12 | F409: DAVIDSON 2 | I409: WILLIAMS 2 | L409: BRAIN 2 | N409: HOWELL | P409: TURNER | R409: JONES | W409: NORTHCOTE | X409: 5 | Y409: 3 | Z409: 0 | AA409: 831 | AB409: 741 | AC409: 112.14574898785425 | AD409: 20
A411: NORTHCOTE | C411: 3 | D411: 9 | E411: =C411*6+D411 -> 27 | G411: 13 | H411: 14 | I411: =G411*6+H411 -> 92 | K411: 17 | L411: 19 | M411: =K411*6+L411 -> 121 | O411: 22 | P411: 30 | Q411: =O411*6+P411 -> 162 | S411: NORTHCOTE | W411: SANDRINGHAM | X411: 5 | Y411: 3 | Z411: 0 | AA411: 896 | AB411: 841 | AC411: 106.53983353151011 | AD411: 20
A412: COBURG | C412: 5 | D412: 5 | E412: =C412*6+D412 -> 35 | G412: 7 | H412: 6 | I412: =G412*6+H412 -> 48 | K412: 12 | L412: 10 | M412: =K412*6+L412 -> 82 | O412: 15 | P412: 10 | Q412: =O412*6+P412 -> 100 | S412: DWYER | W412: CAMBERWELL | X412: 4 | Y412: 4 | Z412: 0 | AA412: 957 | AB412: 906 | AC412: 105.63 | AD412: 16
A413: BEST PLAYERS | W413: COBURG | X413: 3 | Y413: 5 | Z413: 0 | AA413: 759 | AB413: 838 | AC413: 90.572792362768496 | AD413: 12
A414: NORTHCOTE | C414: DOWNIE | F414: ROSS | I414: McNAMARA | L414: LAMPRELL | N414: SIMMONDS | Q414: SMITH | W414: PRESTON | X414: 3 | Y414: 5 | Z414: 0 | AA414: 689 | AB414: 828 | AC414: 83.212560386473427 | AD414: 12
A415: COBURG | C415: COLLINS | F415: JORDAN | I415: RALSTON | L415: SCANLON | N415: PRESTON | Q415: PERRETT | W415: YARRAVILLE | X415: 3 | Y415: 5 | Z415: 0 | AA415: 701 | AB415: 857 | AC415: 81.796966161026845 | AD415: 12
A416: GOALKICKERS | W416: OAKLEIGH | X416: 2 | Y416: 6 | Z416: 0 | AA416: 766 | AB416: 886 | AC416: 86.455981941309261 | AD416: 8
A417: NORTHCOTE | C417: DOWNIE 12 | F417: SIMPSON 4 | I417: MEITZCKE 2 | L417: LAMPRELL 2 | O417: McNAMARA | R417: ROSS | W417: WILLIAMSTOWN | X417: 2 | Y417: 6 | Z417: 0 | AA417: 685 | AB417: 907 | AC417: 75.523704520396919 | AD417: 8
A418: COBURG | C418: COLLINS 10 | F418: IRVINE | H418: PRESTON | J418: SCANLON | M418: RALSTON | O418: BROOM | W418: PORT MELBOURNE | X418: 1 | Y418: 6 | Z418: 1 | AA418: 758 | AB418: 885 | AC418: 85.649717514124291 | AD418: 6
A420: BRUNSWICK | C420: 7 | D420: 4 | E420: =C420*6+D420 -> 46 | G420: 11 | H420: 9 | I420: =G420*6+H420 -> 75 | K420: 19 | L420: 15 | M420: =K420*6+L420 -> 129 | O420: 23 | P420: 16 | Q420: =O420*6+P420 -> 154 | S420: BRUNSWICK
A421: YARRAVILLE | C421: 1 | D421: 1 | E421: =C421*6+D421 -> 7 | G421: 7 | H421: 1 | I421: =G421*6+H421 -> 43 | K421: 9 | L421: 5 | M421: =K421*6+L421 -> 59 | O421: 12 | P421: 7 | Q421: =O421*6+P421 -> 79 | S421: GROVES
A422: BEST PLAYERS
A423: BRUNSWICK | C423: CLARKE | F423: BOYD | I423: McGRATH | L423: GARDNER | O423: COOPER | Q423: DOWLING
A424: YARRAVILLE | C424: ANDERSON | F424: HALL | I424: TRIBE | L424: STREETER | O424: HAM | Q424: WEDGWOOD
A425: GOALKICKERS
A426: BRUNSWICK | C426: McINNES 8 | F426: CRAWFORD 4 | I426: McGRATH 4 | L426: BOYD 3 | N426: GARDNER 2 | Q426: DOWLING | T426: BAILEY
A427: YARRAVILLE | C427: TRIBE 4 | F427: PERUSSICH 4 | I427: HALL 2 | L427: EVANS | N427: WEDGWOOD
A429: PRAHRAN | C429: 8 | D429: 5 | E429: =C429*6+D429 -> 53 | G429: 16 | H429: 11 | I429: =G429*6+H429 -> 107 | K429: 19 | L429: 18 | M429: =K429*6+L429 -> 132 | O429: 26 | P429: 27 | Q429: =O429*6+P429 -> 183 | S429: TOORAK PARK
A430: WILLIAMSTOWN | C430: 2 | D430: 6 | E430: =C430*6+D430 -> 18 | G430: 4 | H430: 10 | I430: =G430*6+H430 -> 34 | K430: 9 | L430: 13 | M430: =K430*6+L430 -> 67 | O430: 11 | P430: 14 | Q430: =O430*6+P430 -> 80 | S430: SETTER
A431: BEST PLAYERS
A432: PRAHRAN | C432: THOMPSON | F432: NEESON | I432: BOURNE | L432: MURRAY | O432: WHITE | Q432: JOHNSON
A433: WILLIAMSTOWN | C433: PATERSON | F433: CUTTING | I433: DELLER | L433: WARD | O433: THOMAS | Q433: JOHNSON
A434: GOALKICKERS
A435: PRAHRAN | C435: NEESON 8 | F435: THOMPSON 6 | I435: GRANDISON 4 | L435: PROBYN 4 | O435: WHITE 2 | Q435: PORTER | T435: BRENCHLEY
A436: WILLIAMSTOWN | C436: THOMAS 4 | F436: PATERSON 3 | I436: CAHILL | K436: JAMIESON | N436: WALSH | P436: McDONOUGH
A438: PRESTON | C438: 2 | D438: 6 | E438: =C438*6+D438 -> 18 | G438: 8 | H438: 9 | I438: =G438*6+H438 -> 57 | K438: 12 | L438: 14 | M438: =K438*6+L438 -> 86 | O438: 16 | P438: 19 | Q438: =O438*6+P438 -> 115 | S438: PRESTON
A439: OAKLEIGH | C439: 4 | D439: 4 | E439: =C439*6+D439 -> 28 | G439: 5 | H439: 6 | I439: =G439*6+H439 -> 36 | K439: 9 | L439: 7 | M439: =K439*6+L439 -> 61 | O439: 14 | P439: 11 | Q439: =O439*6+P439 -> 95 | S439: HAYES
A440: BEST PLAYERS
A441: PRESTON | C441: DOWLING | F441: JOB | I441: COLBANE | L441: MURRAY | O441: JONES | Q441: DUNSTONE
A442: OAKLEIGH | C442: BICKERTON | F442: HARRISON | I442: WATSON | L442: BELL | O442: SMITH | Q442: WITHERS
A443: GOALKICKERS
A444: PRESTON | C444: DUNSTONE 5 | F444: ROACH 4 | I444: MURRAY 3 | L444: WARREN 2 | O444: MUIR | Q444: GILBERT
A445: OAKLEIGH | C445: HARRISON 6 | F445: WITHERS 3 | I445: DOWLER 2) | L445: CRAMERI 2 | O445: WATSON
A447: SANDRINGHAM | C447: 5 | D447: 1 | E447: =C447*6+D447 -> 31 | G447: 10 | H447: 5 | I447: =G447*6+H447 -> 65 | K447: 11 | L447: 11 | M447: =K447*6+L447 -> 77 | O447: 16 | P447: 21 | Q447: =O447*6+P447 -> 117 | S447: BEACH ROAD
A448: PORT MELBOURNE | C448: 6 | D448: 3 | E448: =C448*6+D448 -> 39 | G448: 6 | H448: 7 | I448: =G448*6+H448 -> 43 | K448: 10 | L448: 14 | M448: =K448*6+L448 -> 74 | O448: 12 | P448: 18 | Q448: =O448*6+P448 -> 90 | S448: LEWIS
A449: BEST PLAYERS
A450: SANDRINGHAM | C450: FOSTER | F450: MITCHELL | I450: SAUNDERS | L450: WEBER | O450: FREY | R450: MILLER
A451: PORT MELBOURNE | C451: LAHIFF | F451: TUITE | I451: ALSOP | L451: FREYER | O451: BLOOMER | R451: JULIER
A452: GOALKICKERS
A453: SANDRINGHAM | C453: WEBER 5 | F453: FISHER 2 | I453: HARTNETT 2 | L453: FREY 2 | N453: FOSTER 2 | Q453: SAUNDERS | T453: COMTE | V453: TOLSON
A454: PORT MELBOURNE | C454: FREYER 5 | F454: BLOOMER 3 | I454: TUITE | K454: NIXON | M454: MARSHALL | P454: FULTON
A456: ROUND 9 | E456: 4TH JUNE | J456: WEATHER | M456: CLOUDY S.W. WIND | S456: PLAYED AT
D457: 1ST QTR | H457: 2ND QTR | L457: 3RD QTR | P457: FINAL | S457: BEACH ROAD
A458: NORTHCOTE | C458: 1 | D458: 2 | E458: =C458*6+D458 -> 8 | G458: 3 | H458: 12 | I458: =G458*6+H458 -> 30 | K458: 5 | L458: 14 | M458: =K458*6+L458 -> 44 | O458: 12 | P458: 21 | Q458: =O458*6+P458 -> 93 | S458: UMPIRE | X458: LADDER | AB458: ROUND | AD458: 9
A459: SANDRINGHAM | C459: 4 | D459: 7 | E459: =C459*6+D459 -> 31 | G459: 6 | H459: 8 | I459: =G459*6+H459 -> 44 | K459: 8 | L459: 15 | M459: =K459*6+L459 -> 63 | O459: 8 | P459: 16 | Q459: =O459*6+P459 -> 64 | S459: LESTER
A460: BEST PLAYERS | W460: TEAM | X460: W | Y460: L | Z460: D | AA460: FOR | AB460: AGST | AC460: % | AD460: PTS
A461: NORTHCOTE | C461: GRAY | E461: ROSS | H461: MEITZCKE | K461: HOLDEN | N461: McINERNEY | Q461: HART
A462: SANDRINGHAM | C462: FOSTER | E462: COMTE | H462: WITCHELL | K462: MILLER | N462: MITCHELL | Q462: SMAIL | W462: BRUNSWICK | X462: 9 | Y462: 0 | Z462: 0 | AA462: 1116 | AB462: 692 | AC462: 161.27 | AD462: 36
A463: GOALKICKERS | W463: BRIGHTON | X463: 7 | Y463: 1 | Z463: 1 | AA463: 965 | AB463: 813 | AC463: 118.7 | AD463: 30
A464: NORTHCOTE | C464: DOWNIE 3 | E464: SIMPSON 3 | H464: HOUGHTON 2 | K464: MEITZCKE | M464: McNAMARA | P464: LYNGCOLN | R464: GRAY | W464: NORTHCOTE | X464: 6 | Y464: 3 | Z464: 0 | AA464: 924 | AB464: 805 | AC464: 114.78260869565217 | AD464: 24
A465: SANDRINGHAM | C465: MILLER 2 | F465: FREY 2 | H465: WEBER | J465: GAINGER | L465: MITCHELL | N465: SAUNDERS | W465: PRAHRAN | X465: 5 | Y465: 4 | Z465: 0 | AA465: 1049 | AB465: 888 | AC465: 118.13 | AD465: 20
A467: BRUNSWICK | C467: 2 | D467: 11 | E467: =C467*6+D467 -> 23 | G467: 4 | H467: 13 | I467: =G467*6+H467 -> 37 | K467: 15 | L467: 16 | M467: =K467*6+L467 -> 106 | O467: 21 | P467: 20 | Q467: =O467*6+P467 -> 146 | S467: CAMBERWELL | W467: SANDRINGHAM | X467: 5 | Y467: 4 | Z467: 0 | AA467: 960 | AB467: 934 | AC467: 102.78372591006423 | AD467: 20
A468: CAMBERWELL | C468: 5 | D468: 1 | E468: =C468*6+D468 -> 31 | G468: 5 | H468: 2 | I468: =G468*6+H468 -> 32 | K468: 9 | L468: 7 | M468: =K468*6+L468 -> 61 | O468: 9 | P468: 12 | Q468: =O468*6+P468 -> 66 | S468: HAYES | W468: CAMBERWELL | X468: 4 | Y468: 5 | Z468: 0 | AA468: 1023 | AB468: 1052 | AC468: 97.24 | AD468: 16
A469: BEST PLAYERS | W469: COBURG | X469: 4 | Y469: 5 | Z469: 0 | AA469: 887 | AB469: 935 | AC469: 94.866310160427801 | AD469: 16
A470: BRUNSWICK | C470: McGRATH | F470: BAILEY | I470: QUINN | L470: DOWLING | O470: BOYD | Q470: McKERNAN | W470: PRESTON | X470: 4 | Y470: 5 | Z470: 0 | AA470: 833 | AB470: 917 | AC470: 90.839694656488547 | AD470: 16
A471: CAMBERWELL | C471: NASH | F471: LENNE | I471: NEWTON | L471: HOWELL | O471: BAKER | Q471: BOND | W471: YARRAVILLE | X471: 3 | Y471: 6 | Z471: 0 | AA471: 783 | AB471: 953 | AC471: 82.16159496327387 | AD471: 12
A472: GOALKICKERS | Q472: GARDNER | W472: PORT MELBOURNE | X472: 2 | Y472: 6 | Z472: 1 | AA472: 854 | AB472: 967 | AC472: 88.314374353671141 | AD472: 10
A473: BRUNSWICK | C473: BAILEY 5 | E473: McGRATH 5 | H473: DOWLING 3 | K473: McINNES 3 | M473: McKAY 2 | O473: BOYD | Q473: CRAWFORD | W473: OAKLEIGH | X473: 2 | Y473: 7 | Z473: 0 | AA473: 829 | AB473: 990 | AC473: 83.737373737373744 | AD473: 8
A474: CAMBERWELL | C474: NASH 6 | E474: BAKER | H474: FORD | J474: SYKES | W474: WILLIAMSTOWN | X474: 2 | Y474: 7 | Z474: 0 | AA474: 774 | AB474: 1051 | AC474: 73.644148430066608 | AD474: 8
A476: COBURG | C476: 2 | D476: 0 | E476: =C476*6+D476 -> 12 | G476: 9 | H476: 11 | I476: =G476*6+H476 -> 65 | K476: 11 | L476: 12 | M476: =K476*6+L476 -> 78 | O476: 18 | P476: 20 | Q476: =O476*6+P476 -> 128 | S476: COBURG
A477: PRAHRAN | C477: 3 | D477: 4 | E477: =C477*6+D477 -> 22 | G477: 5 | H477: 8 | I477: =G477*6+H477 -> 38 | K477: 12 | L477: 11 | M477: =K477*6+L477 -> 83 | O477: 14 | P477: 13 | Q477: =O477*6+P477 -> 97 | S477: GREGORY
A478: BEST PLAYERS
A479: COBURG | C479: ANDERSON | F479: ELLAWAY | I479: SCANLON | L479: COLLINS | O479: BERRYMAN | R479: JORDAN
A480: PRAHRAN | C480: JOHNSON | F480: NEESON | I480: WHITE | L480: FLEMING | O480: PORTER | R480: DREW
A481: GOALKICKERS
A482: COBURG | C482: COLLINS 9 | F482: ELLAWAY 4 | I482: IRVINE 3 | K482: DIXON | M482: RALSTON
A483: PRAHRAN | C483: NEESON 4 | F483: WHITE 3 | I483: PROBYN 2 | K483: THOMPSON | N483: BOURNE | P483: PORTER | R483: HAWKINS | U483: WILLIAMS
A485: PRESTON | C485: 4 | D485: 6 | E485: =C485*6+D485 -> 30 | G485: 9 | H485: 10 | I485: =G485*6+H485 -> 64 | K485: 12 | L485: 12 | M485: =K485*6+L485 -> 84 | O485: 21 | P485: 18 | Q485: =O485*6+P485 -> 144 | S485: WILLIAMSTOWN
A486: WILLIAMSTOWN | C486: 8 | D486: 2 | E486: =C486*6+D486 -> 50 | G486: 11 | H486: 2 | I486: =G486*6+H486 -> 68 | K486: 13 | L486: 5 | M486: =K486*6+L486 -> 83 | O486: 14 | P486: 5 | Q486: =O486*6+P486 -> 89 | S486: LEWIS
A487: BEST PLAYERS
A488: PRESTON | C488: ROACH | F488: MASLEN | I488: DOWLING | L488: ROBINSON | O488: ROSS | Q488: LOWENTHAL
A489: WILLIAMSTOWN | C489: CUTTING | F489: DELLER | I489: HARLAND | L489: CAHILL | O489: WILLETT | Q489: PATERSON
A490: GOALKICKERS
A491: PRESTON | C491: ROACH 5 | E491: ROSS 4 | G491: MURRAY 4 | I491: LOWENTHAL 2 | L491: DUNSTONE 2 | O491: GILBERT | Q491: ROBINSON | T491: WHITE | W491: MUIR
A492: WILLIAMSTOWN | C492: RAE 5 | E492: THOMAS 3 | H492: PATERSON 2 | K492: SCHURER 2 | N492: McDONALD | Q492: FITCH
A494: PORT MELBOURNE | C494: 4 | D494: 2 | E494: =C494*6+D494 -> 26 | G494: 10 | H494: 3 | I494: =G494*6+H494 -> 63 | K494: 13 | L494: 10 | M494: =K494*6+L494 -> 88 | O494: 14 | P494: 12 | Q494: =O494*6+P494 -> 96 | S494: PORT MELBOURNE
A495: YARRAVILLE | C495: 4 | D495: 2 | E495: =C495*6+D495 -> 26 | G495: 7 | H495: 5 | I495: =G495*6+H495 -> 47 | K495: 9 | L495: 6 | M495: =K495*6+L495 -> 60 | O495: 12 | P495: 10 | Q495: =O495*6+P495 -> 82 | S495: GROVES
A496: BEST PLAYERS
A497: PORT MELBOURNE | C497: TUITE | F497: FREYER | I497: HOSKINGS | L497: ALSOP | N497: LAHIFF | Q497: FULTON
A498: YARRAVILLE | C498: ANDERSON | F498: STREETER | I498: FREW | L498: WEDGWOOD | N498: TRIBE | Q498: HALL
A499: GOALKICKERS
A500: PORT MELBOURNE | C500: FREYER 6 | F500: TUITE 4 | I500: JONES 3 | K500: LAHIFF
A501: YARRAVILLE | C501: TRIBE 3 | F501: WEDGWOOD 2 | I501: PERUSSICH 2 | L501: PANNELL 2 | O501: HALL | Q501: KENNY | S501: HAM
A503: BRIGHTON | C503: 4 | D503: 4 | E503: =C503*6+D503 -> 28 | G503: 6 | H503: 10 | I503: =G503*6+H503 -> 46 | K503: 11 | L503: 15 | M503: =K503*6+L503 -> 81 | O503: 14 | P503: 20 | Q503: =O503*6+P503 -> 104 | S503: NORTHCOTE
A504: OAKLEIGH | C504: 2 | D504: 0 | E504: =C504*6+D504 -> 12 | G504: 4 | H504: 4 | I504: =G504*6+H504 -> 28 | K504: 5 | L504: 7 | M504: =K504*6+L504 -> 37 | O504: 9 | P504: 9 | Q504: =O504*6+P504 -> 63 | S504: DWYER
A505: BEST PLAYERS
A506: BRIGHTON | C506: RUDD | F506: JOHNSON | I506: BOLWELL | K506: N EGAN | N506: GEORGE | Q506: OPREY
A507: OAKLEIGH | C507: HARRISON | F507: CRAMERI | I507: ASH | K507: HUTCHESON | N507: BICKERTON | Q507: D RYAN
A508: GOALKICKERS
A509: BRIGHTON | C509: BOLWELL 4 | F509: FITCHER 2 | I509: J EGAN 2 | K509: OPREY 2 | M509: DEANE 2 | O509: MILLER | Q509: HONE
A510: OAKLEIGH | C510: HARRISON 4 | F510: SMITH 2 | I510: CRAMERI | K510: REID | M510: MAJOR
A512: ROUND 10 | E512: 11TH JUNE | J512: WEATHER | M512: FINE | S512: PLAYED AT
D513: 1ST QTR | H513: 2ND QTR | L513: 3RD QTR | P513: FINAL | S513: YARRAVILLE
A514: CAMBERWELL | C514: 5 | D514: 3 | E514: =C514*6+D514 -> 33 | G514: 8 | H514: 8 | I514: =G514*6+H514 -> 56 | K514: 11 | L514: 13 | M514: =K514*6+L514 -> 79 | O514: 15 | P514: 18 | Q514: =O514*6+P514 -> 108 | S514: UMPIRE | X514: LADDER | AB514: ROUND | AD514: 10
A515: YARRAVILLE | C515: 2 | D515: 6 | E515: =C515*6+D515 -> 18 | G515: 6 | H515: 11 | I515: =G515*6+H515 -> 47 | K515: 11 | L515: 17 | M515: =K515*6+L515 -> 83 | O515: 13 | P515: 20 | Q515: =O515*6+P515 -> 98 | S515: LESTER
A516: BEST PLAYERS | W516: TEAM | X516: W | Y516: L | Z516: D | AA516: FOR | AB516: AGST | AC516: % | AD516: PTS
A517: CAMBERWELL | C517: NASH | F517: BAKER | I517: ANDERSON | L517: T WILKES | N517: WILLIAMS | Q517: DAVIDSON
A518: YARRAVILLE | C518: WEDGWOOD | F518: PANNELL | I518: PERUSSICH | L518: TRIBE | N518: BONIFACE | Q518: SCHUTT | W518: BRUNSWICK | X518: 10 | Y518: 0 | Z518: 0 | AA518: 1279 | AB518: 809 | AC518: 158.1 | AD518: 40
A519: GOALKICKERS | W519: BRIGHTON | X519: 8 | Y519: 1 | Z519: 1 | AA519: 1091 | AB519: 901 | AC519: 121.09 | AD519: 34
A520: CAMBERWELL | C520: NASH 8 | E520: DAVIDSON 2 | H520: FORD 2 | J520: T WILKES | L520: BRAIN | N520: ANDERSON | W520: NORTHCOTE | X520: 7 | Y520: 3 | Z520: 0 | AA520: 1040 | AB520: 898 | AC520: 115.81291759465479 | AD520: 28
A521: YARRAVILLE | C521: TRIBE 6 | E521: WEDGWOOD 3 | H521: SCHUTT | J521: JONES | L521: REEVES | N521: PERUSSICH | W521: PRAHRAN | X521: 6 | Y521: 4 | Z521: 0 | AA521: 1190 | AB521: 983 | AC521: 121.06 | AD521: 24
A523: NORTHCOTE | C523: 6 | D523: 4 | E523: =C523*6+D523 -> 40 | G523: 8 | H523: 5 | I523: =G523*6+H523 -> 53 | K523: 13 | L523: 10 | M523: =K523*6+L523 -> 88 | O523: 17 | P523: 14 | Q523: =O523*6+P523 -> 116 | S523: PORT MELBOURNE | W523: CAMBERWELL | X523: 5 | Y523: 5 | Z523: 0 | AA523: 1131 | AB523: 1150 | AC523: 98.35 | AD523: 20
A524: PORT MELBOURNE | C524: 4 | D524: 0 | E524: =C524*6+D524 -> 24 | G524: 8 | H524: 2 | I524: =G524*6+H524 -> 50 | K524: 9 | L524: 5 | M524: =K524*6+L524 -> 59 | O524: 14 | P524: 9 | Q524: =O524*6+P524 -> 93 | S524: GREGORY | W524: SANDRINGHAM | X524: 5 | Y524: 5 | Z524: 0 | AA524: 1055 | AB524: 1075 | AC524: 98.139534883720927 | AD524: 20
A525: BEST PLAYERS | W525: PRESTON | X525: 5 | Y525: 5 | Z525: 0 | AA525: 968 | AB525: 1002 | AC525: 96.606786427145707 | AD525: 20
A526: NORTHCOTE | C526: POWELL | E526: McNAMARA | H526: ROSS | J526: MEITZCKE | N526: HOUGHTON | Q526: NICHOLLS | W526: COBURG | X526: 4 | Y526: 6 | Z526: 0 | AA526: 972 | AB526: 1070 | AC526: 90.841121495327101 | AD526: 16
A527: PORT MELBOURNE | C527: FREYER | E527: TUITE | H527: JONES | J527: EASTMUIR | N527: JULIER | Q527: DOBSON | W527: YARRAVILLE | X527: 3 | Y527: 7 | Z527: 0 | AA527: 881 | AB527: 1061 | AC527: 83.034872761545714 | AD527: 12
A528: GOALKICKERS | Q528: GRAY | W528: PORT MELBOURNE | X528: 2 | Y528: 7 | Z528: 1 | AA528: 947 | AB528: 1083 | AC528: 87.442289935364727 | AD528: 10
A529: NORTHCOTE | C529: HOUGHTON 4 | F529: ACKLAND 3 | I529: DOWNIE 3 | K529: MEITZCKE 3 | N529: ROSS | P529: B HART | R529: LAMPRELL | W529: OAKLEIGH | X529: 2 | Y529: 8 | Z529: 0 | AA529: 946 | AB529: 1153 | AC529: 82.046834345186468 | AD529: 8
A530: PORT MELBOURNE | C530: FREYER 7 | F530: TUITE 3 | I530: McINTYRE 2 | L530: FULTON | N530: JONES | W530: WILLIAMSTOWN | X530: 2 | Y530: 8 | Z530: 0 | AA530: 862 | AB530: 1177 | AC530: 73.23704333050128 | AD530: 8
A532: BRIGHTON | C532: 5 | D532: 2 | E532: =C532*6+D532 -> 32 | G532: 12 | H532: 5 | I532: =G532*6+H532 -> 77 | K532: 15 | L532: 10 | M532: =K532*6+L532 -> 100 | O532: 19 | P532: 12 | Q532: =O532*6+P532 -> 126 | S532: ELSTERNWICK PARK
A533: WILLIAMSTOWN | C533: 3 | D533: 3 | E533: =C533*6+D533 -> 21 | G533: 5 | H533: 8 | I533: =G533*6+H533 -> 38 | K533: 11 | L533: 9 | M533: =K533*6+L533 -> 75 | O533: 13 | P533: 10 | Q533: =O533*6+P533 -> 88 | S533: HAYES
A534: BEST PLAYERS
A535: BRIGHTON | C535: BOLWELL | F535: FITCHER | I535: NIVEN | L535: HINDSON | N535: N EGAN | Q535: RUDD
A536: WILLIAMSTOWN | C536: McDONOUGH | F536: CUTTING | I536: PATERSON | L536: GREEN | N536: QUINN | Q536: RAE
A537: GOALKICKERS
A538: BRIGHTON | C538: BOLWELL 9 | F538: TANNER 3 | I538: HONE 2 | K538: MORGAN 2 | N538: MILLER | P538: FITCHER | R538: DEANE
A539: WILLIAMSTOWN | C539: RAE 5 | F539: PATERSON 4 | I539: KAUFMAN | K539: CAHILL | M539: THOMAS | O539: QUINN
A541: BRUNSWICK | C541: 5 | D541: 5 | E541: =C541*6+D541 -> 35 | G541: 11 | H541: 10 | I541: =G541*6+H541 -> 76 | K541: 16 | L541: 19 | M541: =K541*6+L541 -> 115 | O541: 23 | P541: 25 | Q541: =O541*6+P541 -> 163 | S541: BRUNSWICK
A542: OAKLEIGH | C542: 5 | D542: 5 | E542: =C542*6+D542 -> 35 | G542: 11 | H542: 7 | I542: =G542*6+H542 -> 73 | K542: 14 | L542: 8 | M542: =K542*6+L542 -> 92 | O542: 18 | P542: 9 | Q542: =O542*6+P542 -> 117 | S542: LEWIS
A543: BEST PLAYERS
A544: BRUNSWICK | C544: BAILEY | F544: DOWLING | I544: QUINN | L544: CLARKE | O544: McKAY | R544: CHALLENGER
A545: OAKLEIGH | C545: HARRISON | F545: WATSON | I545: CRAMERI | L545: CALLESON | O545: WILMOTT | R545: HUTCHESON
A546: GOALKICKERS
A547: BRUNSWICK | C547: BAILEY 13 | F547: GILLON 2 | I547: DOWLING 2 | L547: CRAWFORD 2 | O547: TOONE | Q547: McGRATH | S547: BOYD | U547: McKAY
A548: OAKLEIGH | C548: HARRISON 7 | F548: CALLESON 4 | I548: CRAMERI 2 | L548: ASH | N548: BELL | P548: NOLAN | R548: WITHERS | U548: DOWLER
E549: 13TH JUNE | J549: WEATHER | M549: FINE MILD N.E.BREEZE
A550: PRAHRAN | C550: 8 | D550: 3 | E550: =C550*6+D550 -> 51 | G550: 11 | H550: 8 | I550: =G550*6+H550 -> 74 | K550: 17 | L550: 10 | M550: =K550*6+L550 -> 112 | O550: 21 | P550: 15 | Q550: =O550*6+P550 -> 141 | S550: TOORAK PARK
A551: SANDRINGHAM | C551: 6 | D551: 2 | E551: =C551*6+D551 -> 38 | G551: 7 | H551: 9 | I551: =G551*6+H551 -> 51 | K551: 9 | L551: 14 | M551: =K551*6+L551 -> 68 | O551: 13 | P551: 17 | Q551: =O551*6+P551 -> 95 | S551: GROVES
A552: BEST PLAYERS
A553: PRAHRAN | C553: WHITE | E553: HAWKINS | H553: FLEMING | K553: JOHNSON | N553: PORTER | Q553: SMITH
A554: SANDRINGHAM | C554: FOSTER | E554: COMTE | H554: SMAIL | K554: MILLER | N554: WITCHELL | Q554: GAINGER
A555: GOALKICKERS
A556: PRAHRAN | C556: HAWKINS 7 | F556: PORTER 5 | I556: WHITE 5 | K556: NEESON 2 | M556: RECHTER | O556: THOMPSON
A557: SANDRINGHAM | C557: FISHER 3 | F557: WITCHELL 3 | I557: WEBER 2 | K557: TOLSON | M557: FREY | N557: TORPY | P557: SAUNDERS | R557: McDONALD
A559: PRESTON | C559: 0 | D559: 1 | E559: =C559*6+D559 -> 1 | G559: 9 | H559: 5 | I559: =G559*6+H559 -> 59 | K559: 15 | L559: 8 | M559: =K559*6+L559 -> 98 | O559: 20 | P559: 15 | Q559: =O559*6+P559 -> 135 | S559: PRESTON
A560: COBURG | C560: 5 | D560: 11 | E560: =C560*6+D560 -> 41 | G560: 6 | H560: 13 | I560: =G560*6+H560 -> 49 | K560: 8 | L560: 17 | M560: =K560*6+L560 -> 65 | O560: 11 | P560: 19 | Q560: =O560*6+P560 -> 85 | S560: DWYER
A561: BEST PLAYERS
A562: PRESTON | C562: MASLEN | F562: ROACH | I562: MURRAY | L562: CLARKE | O562: A ROBINSON | R562: WALKER
A563: COBURG | C563: ANDERSON | F563: BERRYMAN | I563: WHITE | L563: THOMPSON | O563: SCANLON | R563: JORDAN
A564: GOALKICKERS
A565: PRESTON | C565: MURRAY 4 | F565: MUIR 4 | H565: A ROBINSON 4 | K565: JOB 2 | M565: ROSS 2 | O565: ROACH 2 | Q565: DOWLING | T565: WARREN
A566: COBURG | C566: COLLINS 5 | F566: ELLAWAY 2 | I566: SCANLON | K566: HENDERSON | N566: PERRETT | P566: BERRYMAN
A568: ROUND 11 | E568: 18TH JUNE | H568: WEATHER | K568: SHOWERS STRONG S.W. WIND GROUNDS SODDEN | S568: PLAYED AT
D569: 1ST QTR | H569: 2ND QTR | L569: 3RD QTR | P569: FINAL | S569: NORTHCOTE
A570: NORTHCOTE | C570: 8 | D570: 3 | E570: =C570*6+D570 -> 51 | G570: 10 | H570: 4 | I570: =G570*6+H570 -> 64 | K570: 15 | L570: 7 | M570: =K570*6+L570 -> 97 | O570: 17 | P570: 7 | Q570: =O570*6+P570 -> 109 | S570: UMPIRE | X570: LADDER | AB570: ROUND | AD570: 11
A571: PRAHRAN | C571: 1 | D571: 2 | E571: =C571*6+D571 -> 8 | G571: 6 | H571: 7 | I571: =G571*6+H571 -> 43 | K571: 6 | L571: 12 | M571: =K571*6+L571 -> 48 | O571: 12 | P571: 20 | Q571: =O571*6+P571 -> 92 | S571: LESTER
A572: BEST PLAYERS | W572: TEAM | X572: W | Y572: L | Z572: D | AA572: FOR | AB572: AGST | AC572: % | AD572: PTS
A573: NORTHCOTE | C573: NICHOLLS | F573: McNAMARA | I573: LAMPRELL | L573: McINERNEY | O573: E HART | Q573: HONIG
A574: PRAHRAN | C574: THOMPSON | F574: SMITH | I574: WHITE | L574: HAWKINS | O574: NEESON | Q574: FLEMING | W574: BRUNSWICK | X574: 11 | Y574: 0 | Z574: 0 | AA574: 1386 | AB574: 878 | AC574: 157.86 | AD574: 44
A575: GOALKICKERS | M575: SIMPSON | O575: ACKLAND | R575: E HART | W575: BRIGHTON | X575: 8 | Y575: 2 | Z575: 1 | AA575: 1153 | AB575: 1002 | AC575: 115.07 | AD575: 34
A576: NORTHCOTE | C576: SEYMOUR 4 | F576: DOWNIE 3 | I576: ROSS 3 | K576: HOUGHTON 2 | N576: McNAMARA | Q576: LAMPRELL | W576: NORTHCOTE | X576: 8 | Y576: 3 | Z576: 0 | AA576: 1149 | AB576: 990 | AC576: 116.06060606060606 | AD576: 32
A577: PRAHRAN | C577: HAWKINS 5 | F577: NEESON 2 | I577: WHITE 2 | K577: BOURNE | M577: LETTE | O577: PORTER | W577: PRAHRAN | X577: 6 | Y577: 5 | Z577: 0 | AA577: 1282 | AB577: 1092 | AC577: 117.4 | AD577: 24
A579: PRESTON | C579: 3 | D579: 7 | E579: =C579*6+D579 -> 25 | G579: 8 | H579: 11 | I579: =G579*6+H579 -> 59 | K579: 13 | L579: 17 | M579: =K579*6+L579 -> 95 | O579: 17 | P579: 20 | Q579: =O579*6+P579 -> 122 | S579: BEACH ROAD | W579: PRESTON | X579: 6 | Y579: 5 | Z579: 0 | AA579: 1090 | AB579: 1088 | AC579: 100.18382352941177 | AD579: 24
A580: SANDRINGHAM | C580: 4 | D580: 1 | E580: =C580*6+D580 -> 25 | G580: 8 | H580: 5 | I580: =G580*6+H580 -> 53 | K580: 12 | L580: 10 | M580: =K580*6+L580 -> 82 | O580: 12 | P580: 14 | Q580: =O580*6+P580 -> 86 | S580: GREGORY | W580: CAMBERWELL | X580: 5 | Y580: 6 | Z580: 0 | AA580: 1237 | AB580: 1265 | AC580: 97.79 | AD580: 20
A581: BEST PLAYERS | W581: SANDRINGHAM | X581: 5 | Y581: 6 | Z581: 0 | AA581: 1141 | AB581: 1197 | AC581: 95.32163742690058 | AD581: 20
A582: PRESTON | C582: WARREN | E582: DOWLING | H582: ROBINSON | K582: MURRAY | N582: COLBANE | Q582: HASKETT | W582: COBURG | X582: 5 | Y582: 6 | Z582: 0 | AA582: 1073 | AB582: 1132 | AC582: 94.78798586572438 | AD582: 20
A583: SANDRINGHAM | C583: McCOY | E583: COMTE | H583: MITCHELL | K583: FISHER | N583: FREY | Q583: STAPLETON | W583: PORT MELBOURNE | X583: 3 | Y583: 7 | Z583: 1 | AA583: 1062 | AB583: 1189 | AC583: 89.318755256518088 | AD583: 14
A584: GOALKICKERS | Q584: DUNSTONE | W584: OAKLEIGH | X584: 3 | Y584: 8 | Z584: 0 | AA584: 1049 | AB584: 1234 | AC584: 85.008103727714754 | AD584: 12
A585: PRESTON | C585: MUIR 4 | E585: WARREN 2 | H585: MURRAY 2 | J585: ROACH 2 | L585: DOWLING | N585: JOB | O585: ROBINSON | Q585: GILBERT | S585: ROSS | W585: YARRAVILLE | X585: 3 | Y585: 8 | Z585: 0 | AA585: 962 | AB585: 1164 | AC585: 82.646048109965633 | AD585: 12
A586: SANDRINGHAM | C586: FISHER 4 | E586: WEBER 2 | G586: ANDERSON 2 | J586: FOSTER | L586: COMTE | N586: TORPY | P586: MILLER | W586: WILLIAMSTOWN | X586: 2 | Y586: 9 | Z586: 0 | AA586: 931 | AB586: 1284 | AC586: 72.507788161993773 | AD586: 8
A588: COBURG | C588: 5 | D588: 3 | E588: =C588*6+D588 -> 33 | G588: 8 | H588: 8 | I588: =G588*6+H588 -> 56 | K588: 10 | L588: 10 | M588: =K588*6+L588 -> 70 | O588: 14 | P588: 17 | Q588: =O588*6+P588 -> 101 | S588: COBURG
A589: BRIGHTON | C589: 2 | D589: 1 | E589: =C589*6+D589 -> 13 | G589: 5 | H589: 4 | I589: =G589*6+H589 -> 34 | K589: 7 | L589: 6 | M589: =K589*6+L589 -> 48 | O589: 9 | P589: 8 | Q589: =O589*6+P589 -> 62 | S589: HAYES
A590: BEST PLAYERS
A591: COBURG | C591: COLLINS | F591: SCANLON | I591: WHITE | K591: IRVINE | N591: HENDERSON | Q591: ELLAWAY
A592: BRIGHTON | C592: HALLAHAN | F592: KEMP | I592: OPREY | K592: DEANE | N592: EGAN | Q592: CONDON
A593: GOALKICKERS
A594: COBURG | C594: COLLINS 8 | F594: ELLAWAY 2 | I594: HENDERSON | L594: SCANLON | N594: IRVINE | P594: DIXON
A595: BRIGHTON | C595: TANNER 3 | F595: OPREY 2 | I595: DEANE | K595: BOLWELL | M595: CONNELL | O595: EDMUNDS
A597: OAKLEIGH | C597: 2 | D597: 5 | E597: =C597*6+D597 -> 17 | G597: 7 | H597: 6 | I597: =G597*6+H597 -> 48 | K597: 8 | L597: 10 | M597: =K597*6+L597 -> 58 | O597: 15 | P597: 13 | Q597: =O597*6+P597 -> 103 | S597: OAKLEIGH
A598: YARRAVILLE | C598: 2 | D598: 3 | E598: =C598*6+D598 -> 15 | G598: 3 | H598: 9 | I598: =G598*6+H598 -> 27 | K598: 5 | L598: 13 | M598: =K598*6+L598 -> 43 | O598: 11 | P598: 15 | Q598: =O598*6+P598 -> 81 | S598: MERRINGTON
A599: BEST PLAYERS
A600: OAKLEIGH | C600: MUDGE | F600: BICKERTON | I600: BELL | L600: CALLESON | O600: F HUTCHESON
A601: YARRAVILLE | C601: WEDGWOOD | F601: ANDERSON | I601: PANNELL | L601: BONIFACE | O601: KENNY
A602: GOALKICKERS
A603: OAKLEIGH | C603: CALLESON 4 | F603: SMITH 3 | H603: CRAMERI 2 | K603: KENNEDY 2 | N603: WILLIAMS | Q603: CORP | R603: WITHERS | U603: HARRISON
A604: YARRAVILLE | C604: TRIBE 3 | F604: PERUSSICH 3 | I604: ROWE | K604: HALL | M604: SCHUTT | O604: WEDGWOOD | R604: KENNY
A606: PORT MELBOURNE | C606: 4 | D606: 2 | E606: =C606*6+D606 -> 26 | G606: 7 | H606: 6 | I606: =G606*6+H606 -> 48 | K606: 11 | L606: 11 | M606: =K606*6+L606 -> 77 | O606: 17 | P606: 13 | Q606: =O606*6+P606 -> 115 | S606: CAMBERWELL
A607: CAMBERWELL | C607: 4 | D607: 10 | E607: =C607*6+D607 -> 34 | G607: 7 | H607: 12 | I607: =G607*6+H607 -> 54 | K607: 13 | L607: 18 | M607: =K607*6+L607 -> 96 | O607: 14 | P607: 22 | Q607: =O607*6+P607 -> 106 | S607: GROVES
A608: BEST PLAYERS
A609: PORT MELBOURNE | C609: TUITE | E609: GARBUTT | H609: ROSS | J609: ALSOP | M609: FREYER | P609: McINTYRE
A610: CAMBERWELL | C610: NASH | E610: HORKINGS | H610: DAVIDSON | J610: WALKER | M610: BENNETT | P610: ONLEY
A611: GOALKICKERS
A612: PORT MELBOURNE | C612: FREYER 9 | F612: LEE 3 | H612: GOSS | J612: FINN | L612: JULIER | N612: EASTMUIR | Q612: RICHES
A613: CAMBERWELL | C613: BENNETT 4 | F613: NASH 3 | H613: DAVIDSON 2 | K613: BRAIN | M613: KENNY | O613: FORD | Q613: ONLEY | S613: HORKINGS
A615: BRUNSWICK | C615: 1 | D615: 4 | E615: =C615*6+D615 -> 10 | G615: 7 | H615: 10 | I615: =G615*6+H615 -> 52 | K615: 7 | L615: 10 | M615: =K615*6+L615 -> 52 | O615: 15 | P615: 17 | Q615: =O615*6+P615 -> 107 | S615: WILLIAMSTOWN
A616: WILLIAMSTOWN | C616: 3 | D616: 6 | E616: =C616*6+D616 -> 24 | G616: 5 | H616: 8 | I616: =G616*6+H616 -> 38 | K616: 9 | L616: 14 | M616: =K616*6+L616 -> 68 | O616: 9 | P616: 15 | Q616: =O616*6+P616 -> 69 | S616: DWYER
A617: BEST PLAYERS
A618: BRUNSWICK | C618: DOWLING | F618: CHALLENGER | I618: DAVIS | L618: McKERNAN | O618: TOONE | Q618: McGORLICK
A619: WILLIAMSTOWN | C619: CUTTING | F619: CAHILL | I619: WILCOX | L619: McDONOUGH | O619: THOMAS | Q619: JOHNSON
A620: GOALKICKERS
A621: BRUNSWICK | C621: DOWLING 4 | F621: McGRATH 3 | I621: McKAY 2 | K621: CRAWFORD 2 | N621: HUNT | P621: BAILEY | R621: BOYD | T621: GARDNER
A622: WILLIAMSTOWN | C622: THOMAS 3 | F622: PATERSON 2 | I622: RAE 2 | K622: JOHNSON | M622: McDONOUGH
A624: ROUND 12 | E624: 25TH JUNE | J624: WEATHER | M624: RAIN SOUTH WIND GROUNDS BAD | S624: PLAYED AT
D625: 1ST QTR | H625: 2ND QTR | L625: 3RD QTR | P625: FINAL | S625: NORTHCOTE
A626: PRESTON | C626: 2 | D626: 3 | E626: =C626*6+D626 -> 15 | G626: 2 | H626: 3 | I626: =G626*6+H626 -> 15 | K626: 8 | L626: 9 | M626: =K626*6+L626 -> 57 | O626: 9 | P626: 9 | Q626: =O626*6+P626 -> 63 | S626: UMPIRE | X626: LADDER | AB626: ROUND | AD626: 12
A627: NORTHCOTE | C627: 2 | D627: 7 | E627: =C627*6+D627 -> 19 | G627: 4 | H627: 11 | I627: =G627*6+H627 -> 35 | K627: 5 | L627: 15 | M627: =K627*6+L627 -> 45 | O627: 6 | P627: 18 | Q627: =O627*6+P627 -> 54 | S627: GROVES
A628: BEST PLAYERS | W628: TEAM | X628: W | Y628: L | Z628: D | AA628: FOR | AB628: AGST | AC628: % | AD628: PTS
A629: PRESTON | C629: CAMPBELL | F629: ROSS | I629: JOB | K629: CLARKE | N629: DOWLING | Q629: MURRAY
A630: NORTHCOTE | C630: POWELL | F630: E HART | I630: GRAY | K630: SIMPSON | N630: NICHOLLS | Q630: MEITZCKE | W630: BRUNSWICK | X630: 12 | Y630: 0 | Z630: 0 | AA630: 1474 | AB630: 963 | AC630: 153.06 | AD630: 48
A631: GOALKICKERS | W631: BRIGHTON | X631: 9 | Y631: 2 | Z631: 1 | AA631: 1256 | AB631: 1095 | AC631: 114.7 | AD631: 38
A632: PRESTON | C632: ROACH 5 | F632: MURRAY | I632: JOB | K632: GILBERT | M632: WARREN | W632: NORTHCOTE | X632: 8 | Y632: 4 | Z632: 0 | AA632: 1203 | AB632: 1053 | AC632: 114.24501424501425 | AD632: 32
A633: NORTHCOTE | C633: DOWNIE | F633: HOUGHTON | I633: MEITZCKE | K633: HONIG | M633: McNAMARA | P633: E HART | W633: PRAHRAN | X633: 7 | Y633: 5 | Z633: 0 | AA633: 1417 | AB633: 1179 | AC633: 120.17 | AD633: 28
A635: BRIGHTON | C635: 2 | D635: 1 | E635: =C635*6+D635 -> 13 | G635: 7 | H635: 11 | I635: =G635*6+H635 -> 53 | K635: 10 | L635: 15 | M635: =K635*6+L635 -> 75 | O635: 14 | P635: 19 | Q635: =O635*6+P635 -> 103 | S635: BEACH ROAD | W635: PRESTON | X635: 7 | Y635: 5 | Z635: 0 | AA635: 1153 | AB635: 1142 | AC635: 100.96322241681261 | AD635: 28
A636: SANDRINGHAM | C636: 6 | D636: 5 | E636: =C636*6+D636 -> 41 | G636: 7 | H636: 6 | I636: =G636*6+H636 -> 48 | K636: 11 | L636: 11 | M636: =K636*6+L636 -> 77 | O636: 13 | P636: 15 | Q636: =O636*6+P636 -> 93 | S636: LEWIS | W636: CAMBERWELL | X636: 6 | Y636: 6 | Z636: 0 | AA636: 1361 | AB636: 1359 | AC636: 100.15 | AD636: 24
A637: BEST PLAYERS | W637: SANDRINGHAM | X637: 5 | Y637: 7 | Z637: 0 | AA637: 1234 | AB637: 1300 | AC637: 94.92307692307692 | AD637: 20
A638: BRIGHTON | C638: WEBER | F638: FITCHER | I638: TANNER | L638: PENNY | N638: GEORGE | Q638: HONE | W638: COBURG | X638: 5 | Y638: 7 | Z638: 0 | AA638: 1158 | AB638: 1220 | AC638: 94.918032786885249 | AD638: 20
A639: SANDRINGHAM | C639: MITCHELL | F639: REGNIER | I639: ANDERSON | L639: FOSTER | N639: SAUNDERS | Q639: FREY | W639: YARRAVILLE | X639: 4 | Y639: 8 | Z639: 0 | AA639: 1037 | AB639: 1236 | AC639: 83.899676375404525 | AD639: 16
A640: GOALKICKERS | W640: PORT MELBOURNE | X640: 3 | Y640: 8 | Z640: 1 | AA640: 1149 | AB640: 1324 | AC640: 86.782477341389722 | AD640: 14
A641: BRIGHTON | C641: TANNER 4 | F641: PENNY 3 | H641: BOLWELL 2 | K641: FITCHER | M641: DEANE | O641: OPREY | Q641: HONE | S641: MILLER | W641: OAKLEIGH | X641: 3 | Y641: 9 | Z641: 0 | AA641: 1143 | AB641: 1358 | AC641: 84.167893961708401 | AD641: 12
A642: SANDRINGHAM | C642: HARTNETT 3 | F642: ANDERSON 3 | I642: TORPY (3) | K642: FISHER 2 | M642: FOSTER | O642: CHEFFERS | W642: WILLIAMSTOWN | X642: 2 | Y642: 10 | Z642: 0 | AA642: 1003 | AB642: 1359 | AC642: 73.804267844002936 | AD642: 8
A644: BRUNSWICK | C644: 4 | D644: 6 | E644: =C644*6+D644 -> 30 | G644: 8 | H644: 6 | I644: =G644*6+H644 -> 54 | K644: 12 | L644: 9 | M644: =K644*6+L644 -> 81 | O644: 13 | P644: 10 | Q644: =O644*6+P644 -> 88 | S644: COBURG
A645: COBURG | C645: 1 | D645: 1 | E645: =C645*6+D645 -> 7 | G645: 5 | H645: 4 | I645: =G645*6+H645 -> 34 | K645: 9 | L645: 6 | M645: =K645*6+L645 -> 60 | O645: 12 | P645: 13 | Q645: =O645*6+P645 -> 85 | S645: LESTER
A646: BEST PLAYERS
A647: BRUNSWICK | C647: DOWLING | E647: QUINN | H647: CLARKE | K647: CHALLENGER | N647: TOONE | Q647: BOYD
A648: COBURG | C648: BRAGG | E648: HILL | H648: DIXON | K648: ELLAWAY | N648: ANDERSON | Q648: SCANLON
A649: GOALKICKERS
A650: BRUNSWICK | C650: DOWLING 7 | F650: BAILEY 2 | I650: CRAWFORD 2 | L650: McKAY | N650: GARDNER
A651: COBURG | C651: DIXON 4 | F651: ELLAWAY 3 | I651: SCANLON 2 | L651: HENDERSON 2 | O651: WHITHAM
A653: YARRAVILLE | C653: 2 | D653: 6 | E653: =C653*6+D653 -> 18 | G653: 4 | H653: 9 | I653: =G653*6+H653 -> 33 | K653: 7 | L653: 14 | M653: =K653*6+L653 -> 56 | O653: 10 | P653: 15 | Q653: =O653*6+P653 -> 75 | S653: WILLIAMSTOWN
A654: WILLIAMSTOWN | C654: 1 | D654: 3 | E654: =C654*6+D654 -> 9 | G654: 3 | H654: 7 | I654: =G654*6+H654 -> 25 | K654: 6 | L654: 7 | M654: =K654*6+L654 -> 43 | O654: 10 | P654: 12 | Q654: =O654*6+P654 -> 72 | S654: MERRINGTON
A655: BEST PLAYERS
A656: YARRAVILLE | C656: HEFFERNAN | F656: ANDERSON | I656: CAVE | L656: BONIFACE | O656: FREW | R656: KENNY
A657: WILLIAMSTOWN | C657: CAHILL | F657: WALSH | I657: JERRAM | L657: CUTTING | O657: McDONOUGH | R657: THOMAS
A658: GOALKICKERS
A659: YARRAVILLE | C659: TRIBE 3 | F659: CAVE 3 | I659: FREW | K659: HALL | M659: KENNY | O659: WEDGWOOD
A660: WILLIAMSTOWN | C660: THOMAS 4 | F660: RAE 3 | I660: CAHILL | K660: PATERSON | N660: RICHARDSON
A662: CAMBERWELL | C662: 3 | D662: 5 | E662: =C662*6+D662 -> 23 | G662: 7 | H662: 7 | I662: =G662*6+H662 -> 49 | K662: 10 | L662: 11 | M662: =K662*6+L662 -> 71 | O662: 18 | P662: 16 | Q662: =O662*6+P662 -> 124 | S662: OAKLEIGH
A663: OAKLEIGH | C663: 3 | D663: 5 | E663: =C663*6+D663 -> 23 | G663: 6 | H663: 10 | I663: =G663*6+H663 -> 46 | K663: 11 | L663: 16 | M663: =K663*6+L663 -> 82 | O663: 13 | P663: 16 | Q663: =O663*6+P663 -> 94 | S663: DWYER
A664: BEST PLAYERS
A665: CAMBERWELL | C665: WILKES | E665: ROGERS | H665: HILLARD | K665: SEELENMEYER | O665: TURNER | R665: BENNETT
A666: OAKLEIGH | C666: NOLAN | E666: WITHERS | H666: BELL | K666: HARRISON | O666: WATSON | R666: MUDGE
A667: GOALKICKERS
A668: CAMBERWELL | C668: WILKES 4 | E668: BENNETT 4 | H668: BRAIN 3 | K668: NASH 2 | M668: TURNER 2 | O668: FORD | Q668: ONLEY | S668: HILLARD
A669: OAKLEIGH | C669: NOLAN 7 | E669: WITHERS 2 | H669: WILLIAMS 2 | K669: KENNEDY | M669: CALLESON
A671: PRAHRAN | C671: 3 | D671: 2 | E671: =C671*6+D671 -> 20 | G671: 11 | H671: 5 | I671: =G671*6+H671 -> 71 | K671: 13 | L671: 9 | M671: =K671*6+L671 -> 87 | O671: 20 | P671: 15 | Q671: =O671*6+P671 -> 135 | S671: TOORAK PARK
A672: PORT MELBOURNE | C672: 4 | D672: 4 | E672: =C672*6+D672 -> 28 | G672: 5 | H672: 5 | I672: =G672*6+H672 -> 35 | K672: 9 | L672: 15 | M672: =K672*6+L672 -> 69 | O672: 12 | P672: 15 | Q672: =O672*6+P672 -> 87 | S672: GREGORY
A673: BEST PLAYERS
A674: PRAHRAN | C674: BOURNE | F674: JOHNSON | I674: F SMITH | L674: ROBERTS | O674: MURRAY | R674: WHITE
A675: PORT MELBOURNE | C675: EASTMUIR | F675: GARBUTT | I675: TUITE | L675: RUSSO | O675: RICHES | R675: LAHIFF
A676: GOALKICKERS
A677: PRAHRAN | C677: HAWKINS 7 | F677: BRENCHLEY 4 | I677: WHITE 3 | K677: NEESON 2 | M677: THOMPSON 2 | P677: WILLIAMS | R677: LETTE
A678: PORT MELBOURNE | C678: GOSS 4 | F678: JONES 3 | I678: EASTMUIR 2 | L678: ALSOP | N678: JULIER | P678: HOSKING
A680: ROUND 13 | E680: 2ND JULY | H680: WEATHER | J680: COOL CLOUDY OCCASIONAL SHOWERS SOUTH WIND | S680: PLAYED AT
D681: 1ST QTR | H681: 2ND QTR | L681: 3RD QTR | P681: FINAL | S681: ELSTERNWICK PARK
A682: BRIGHTON | C682: 6 | D682: 2 | E682: =C682*6+D682 -> 38 | G682: 7 | H682: 2 | I682: =G682*6+H682 -> 44 | K682: 13 | L682: 6 | M682: =K682*6+L682 -> 84 | O682: 14 | P682: 7 | Q682: =O682*6+P682 -> 91 | S682: UMPIRE | X682: LADDER | AB682: ROUND | AD682: 13
A683: NORTHCOTE | C683: 1 | D683: 0 | E683: =C683*6+D683 -> 6 | G683: 4 | H683: 0 | I683: =G683*6+H683 -> 24 | K683: 4 | L683: 0 | M683: =K683*6+L683 -> 24 | O683: 10 | P683: 7 | Q683: =O683*6+P683 -> 67 | S683: GREGORY
A684: BEST PLAYERS | W684: TEAM | X684: W | Y684: L | Z684: D | AA684: FOR | AB684: AGST | AC684: % | AD684: PTS
A685: BRIGHTON | C685: HALLAHAN | F685: PENNY | I685: EGAN | K685: WEBER | N685: CONDON | Q685: KEMP
A686: NORTHCOTE | C686: McINERNEY | F686: HOLDEN | I686: SIMPSON | K686: SMITH | N686: LYNGCOLN | Q686: MEITZCKE | W686: BRUNSWICK | X686: 13 | Y686: 0 | Z686: 0 | AA686: 1558 | AB686: 1003 | AC686: 154.54 | AD686: 52
A687: GOALKICKERS | W687: BRIGHTON | X687: 10 | Y687: 2 | Z687: 1 | AA687: 1347 | AB687: 1162 | AC687: 115.92 | AD687: 42
A688: BRIGHTON | C688: OPREY 3 | E688: PENNY 3 | G688: DEANE 3 | I688: BOLWELL 2 | L688: BUCKLEY | N688: FITCHER | P688: TANNER | W688: PRAHRAN | X688: 8 | Y688: 5 | Z688: 0 | AA688: 1486 | AB688: 1236 | AC688: 120.23 | AD688: 32
A689: NORTHCOTE | C689: B HART 2 | E689: LYNGCOLN 2 | H689: GRAY 2 | J689: SEYMOUR | M689: DOWNIE | O689: LAMPRELL | Q689: SIMPSON | W689: NORTHCOTE | X689: 8 | Y689: 5 | Z689: 0 | AA689: 1270 | AB689: 1144 | AC689: 111.01398601398601 | AD689: 32
A691: PRAHRAN | C691: 1 | D691: 1 | E691: =C691*6+D691 -> 7 | G691: 5 | H691: 7 | I691: =G691*6+H691 -> 37 | K691: 6 | L691: 7 | M691: =K691*6+L691 -> 43 | O691: 9 | P691: 15 | Q691: =O691*6+P691 -> 69 | S691: PRESTON | W691: CAMBERWELL | X691: 7 | Y691: 6 | Z691: 0 | AA691: 1511 | AB691: 1450 | AC691: 104.21 | AD691: 28
A692: PRESTON | C692: 2 | D692: 2 | E692: =C692*6+D692 -> 14 | G692: 2 | H692: 2 | I692: =G692*6+H692 -> 14 | K692: 7 | L692: 7 | M692: =K692*6+L692 -> 49 | O692: 8 | P692: 9 | Q692: =O692*6+P692 -> 57 | S692: LESTER | W692: PRESTON | X692: 7 | Y692: 6 | Z692: 0 | AA692: 1210 | AB692: 1211 | AC692: 99.917423616845582 | AD692: 28
A693: BEST PLAYERS | W693: COBURG | X693: 6 | Y693: 7 | Z693: 0 | AA693: 1247 | AB693: 1256 | AC693: 99.283439490445858 | AD693: 24
A694: PRAHRAN | C694: HAWKINS | F694: JOHNSON | I694: WHITEHEAD | L694: GRAVELL | N694: ROBERTS | Q694: PORTER | W694: SANDRINGHAM | X694: 5 | Y694: 8 | Z694: 0 | AA694: 1274 | AB694: 1384 | AC694: 92.052023121387279 | AD694: 20
A695: PRESTON | C695: MASLEN | F695: HASKETT | I695: COLBANE | L695: ROACH | N695: MURRAY | Q695: MUIR | W695: PORT MELBOURNE | X695: 4 | Y695: 8 | Z695: 1 | AA695: 1239 | AB695: 1385 | AC695: 89.458483754512642 | AD695: 18
A696: GOALKICKERS | W696: YARRAVILLE | X696: 4 | Y696: 9 | Z696: 0 | AA696: 1073 | AB696: 1325 | AC696: 80.981132075471692 | AD696: 16
A697: PRAHRAN | C697: HAWKINS 4 | F697: GRAVELL 2 | I697: PORTER | K697: BRENCHLEY | N697: THOMPSON | W697: OAKLEIGH | X697: 3 | Y697: 10 | Z697: 0 | AA697: 1204 | AB697: 1448 | AC697: 83.149171270718227 | AD697: 12
A698: PRESTON | C698: MURRAY 2 | F698: MUIR 2 | H698: ROSS 2 | J698: ROACH | L698: DUNSTONE | W698: WILLIAMSTOWN | X698: 2 | Y698: 11 | Z698: 0 | AA698: 1094 | AB698: 1509 | AC698: 72.498343273691191 | AD698: 8
A700: COBURG | C700: 2 | D700: 2 | E700: =C700*6+D700 -> 14 | G700: 4 | H700: 9 | I700: =G700*6+H700 -> 33 | K700: 5 | L700: 11 | M700: =K700*6+L700 -> 41 | O700: 12 | P700: 17 | Q700: =O700*6+P700 -> 89 | S700: YARRAVILLE
A701: YARRAVILLE | C701: 2 | D701: 7 | E701: =C701*6+D701 -> 19 | G701: 2 | H701: 7 | I701: =G701*6+H701 -> 19 | K701: 4 | L701: 11 | M701: =K701*6+L701 -> 35 | O701: 4 | P701: 12 | Q701: =O701*6+P701 -> 36 | S701: LEWIS
A702: BEST PLAYERS
A703: COBURG | C703: IRVINE | E703: SCANLON | H703: HENNING | K703: RE | N703: WHITFIELD | Q703: BAMFORD
A704: YARRAVILLE | C704: CAVE | E704: ANDERSON | H704: WEDGWOOD | K704: STREETER | N704: HEFFERNAN | Q704: McVEIGH
A705: GOALKICKERS
A706: COBURG | C706: ELLAWAY 3 | F706: SCANLON 2 | I706: IRVINE 2 | K706: WHITHAM 2 | N706: ESDALE 2 | Q706: HENDERSON
A707: YARRAVILLE | C707: WEDGWOOD | F707: SCHUTT | I707: HALL | L707: EVANS
A709: BRUNSWICK | C709: 2 | D709: 1 | E709: =C709*6+D709 -> 13 | G709: 4 | H709: 3 | I709: =G709*6+H709 -> 27 | K709: 9 | L709: 6 | M709: =K709*6+L709 -> 60 | O709: 13 | P709: 6 | Q709: =O709*6+P709 -> 84 | S709: BRUNSWICK
A710: SANDRINGHAM | C710: 2 | D710: 2 | E710: =C710*6+D710 -> 14 | G710: 2 | H710: 2 | I710: =G710*6+H710 -> 14 | K710: 2 | L710: 6 | M710: =K710*6+L710 -> 18 | O710: 5 | P710: 10 | Q710: =O710*6+P710 -> 40 | S710: HAYES
A711: BEST PLAYERS
A712: BRUNSWICK | C712: TOONE | E712: BAILEY | H712: BOYD | K712: QUINN | N712: FAY | Q712: DAVIS
A713: SANDRINGHAM | C713: REGNIER | E713: McCOY | H713: MILLER | K713: SMAIL | N713: HARTNETT | Q713: FOSTER
A714: GOALKICKERS
A715: BRUNSWICK | C715: McINNES 4 | F715: BAILEY 2 | I715: McGRATH 2 | L715: BOYD | N715: CRAWFORD | Q715: McKAY | S715: GILLON | U715: QUINN
A716: SANDRINGHAM | C716: MILLER | E716: ANDERSON | H716: FISHER | J716: FOSTER | L716: HARTNETT
A718: PORT MELBOURNE | C718: 4 | D718: 4 | E718: =C718*6+D718 -> 28 | G718: 5 | H718: 6 | I718: =G718*6+H718 -> 36 | K718: 8 | L718: 14 | M718: =K718*6+L718 -> 62 | O718: 12 | P718: 18 | Q718: =O718*6+P718 -> 90 | S718: PORT MELBOURNE
A719: OAKLEIGH | C719: 1 | D719: 2 | E719: =C719*6+D719 -> 8 | G719: 1 | H719: 10 | I719: =G719*6+H719 -> 16 | K719: 3 | L719: 12 | M719: =K719*6+L719 -> 30 | O719: 8 | P719: 13 | Q719: =O719*6+P719 -> 61 | S719: GEE
A720: BEST PLAYERS
A721: PORT MELBOURNE | C721: JULIER | E721: TUITE | H721: ALSOP | K721: GARBUTT | N721: WILLIAMS | Q721: JONES
A722: OAKLEIGH | C722: BELL | E722: F HUTCHESON | H722: ASH | K722: BICKERTON | N722: MUDGE | Q722: D RYAN
A723: GOALKICKERS
A724: PORT MELBOURNE | C724: JONES 3 | E724: TUITE 2 | G724: LEE 2 | I724: FULTON 2 | K724: WILLIAMS | M724: ALSOP | O724: GOSS
A725: OAKLEIGH | C725: CALLESON 2 | F725: HARRISON 2 | I725: F HUTCHESON | L725: WILLIAMS | N725: CRAMERI | Q725: KENNEDY
A727: CAMBERWELL | C727: 3 | D727: 0 | E727: =C727*6+D727 -> 18 | G727: 12 | H727: 10 | I727: =G727*6+H727 -> 82 | K727: 15 | L727: 18 | M727: =K727*6+L727 -> 108 | O727: 21 | P727: 24 | Q727: =O727*6+P727 -> 150 | S727: CAMBERWELL
A728: WILLIAMSTOWN | C728: 3 | D728: 8 | E728: =C728*6+D728 -> 26 | G728: 6 | H728: 9 | I728: =G728*6+H728 -> 45 | K728: 12 | L728: 12 | M728: =K728*6+L728 -> 84 | O728: 13 | P728: 13 | Q728: =O728*6+P728 -> 91 | S728: GROVES
A729: BEST PLAYERS
A730: CAMBERWELL | C730: NASH | F730: HILLARD | I730: WILKES | L730: FORD | O730: BRAIN | R730: DAVIDSON
A731: WILLIAMSTOWN | C731: PATERSON | F731: RAE | I731: THOMAS | L731: JERRAM | O731: CUTTING | R731: QUINN
A732: GOALKICKERS
A733: CAMBERWELL | C733: NASH 8 | E733: BRAIN 5 | H733: DAVIDSON 3 | K733: ANDERSON 2 | N733: BENNETT | P733: FORD | R733: TURNER
A734: WILLIAMSTOWN | C734: RAE 4 | E734: PATERSON 3 | H734: TURNER 2 | J734: RICHARDSON | M734: HARLAND | O734: CAHILL | Q734: QUINN
A736: ROUND 14 | E736: 9TH JULY | J736: WEATHER | M736: FINE BUT GROUNDS BAD | S736: PLAYED AT
D737: 1ST QTR | H737: 2ND QTR | L737: 3RD QTR | P737: FINAL | S737: PRESTON
A738: CAMBERWELL | C738: 4 | D738: 5 | E738: =C738*6+D738 -> 29 | G738: 6 | H738: 8 | I738: =G738*6+H738 -> 44 | K738: 7 | L738: 10 | M738: =K738*6+L738 -> 52 | O738: 13 | P738: 15 | Q738: =O738*6+P738 -> 93 | S738: UMPIRE | X738: LADDER | AB738: ROUND | AD738: 14
A739: PRESTON | C739: 0 | D739: 4 | E739: =C739*6+D739 -> 4 | G739: 2 | H739: 8 | I739: =G739*6+H739 -> 20 | K739: 6 | L739: 10 | M739: =K739*6+L739 -> 46 | O739: 7 | P739: 14 | Q739: =O739*6+P739 -> 56 | S739: GEE
A740: BEST PLAYERS | W740: TEAM | X740: W | Y740: L | Z740: D | AA740: FOR | AB740: AGST | AC740: % | AD740: PTS
A741: CAMBERWELL | C741: BAKER | E741: DAVIDSON | H741: KECK | K741: HORKINGS | N741: HILLARD | Q741: ONLEY
A742: PRESTON | C742: CLARKE | E742: MURRAY | H742: COLBANE | K742: MASLEN | N742: BEAGLEY | Q742: HASKETT | W742: BRUNSWICK | X742: 14 | Y742: 0 | Z742: 0 | AA742: 1641 | AB742: 1077 | AC742: 152.37 | AD742: 56
A743: GOALKICKERS | W743: BRIGHTON | X743: 11 | Y743: 2 | Z743: 1 | AA743: 1459 | AB743: 1258 | AC743: 115.98 | AD743: 46
A744: CAMBERWELL | C744: DAVIDSON 4 | F744: BRAIN 4 | H744: BOND 2 | J744: ANDERSON | M744: FORD | N744: HILLARD | W744: PRAHRAN | X744: 9 | Y744: 5 | Z744: 0 | AA744: 1606 | AB744: 1319 | AC744: 121.76 | AD744: 36
A745: PRESTON | C745: ROACH 2 | F745: DUNSTONE 2 | I745: MUIR | K745: MURRAY | M745: JOB | W745: NORTHCOTE | X745: 9 | Y745: 5 | Z745: 0 | AA745: 1416 | AB745: 1203 | AC745: 117.70573566084788 | AD745: 36
A747: COBURG | C747: 7 | D747: 3 | E747: =C747*6+D747 -> 45 | G747: 11 | H747: 6 | I747: =G747*6+H747 -> 72 | K747: 17 | L747: 13 | M747: =K747*6+L747 -> 115 | O747: 19 | P747: 14 | Q747: =O747*6+P747 -> 128 | S747: BEACH ROAD | W747: CAMBERWELL | X747: 8 | Y747: 6 | Z747: 0 | AA747: 1604 | AB747: 1506 | AC747: 106.51 | AD747: 32
A748: SANDRINGHAM | C748: 1 | D748: 2 | E748: =C748*6+D748 -> 8 | G748: 8 | H748: 6 | I748: =G748*6+H748 -> 54 | K748: 10 | L748: 7 | M748: =K748*6+L748 -> 67 | O748: 13 | P748: 11 | Q748: =O748*6+P748 -> 89 | S748: GROVES | W748: COBURG | X748: 7 | Y748: 7 | Z748: 0 | AA748: 1375 | AB748: 1345 | AC748: 102.23048327137546 | AD748: 28
A749: BEST PLAYERS | W749: PRESTON | X749: 7 | Y749: 7 | Z749: 0 | AA749: 1266 | AB749: 1304 | AC749: 97.085889570552141 | AD749: 28
A750: COBURG | C750: HENNING | F750: WITHAM | I750: ELLAWAY | L750: BRAGG | N750: SCANLON | Q750: IRVINE | W750: SANDRINGHAM | X750: 5 | Y750: 9 | Z750: 0 | AA750: 1363 | AB750: 1512 | AC750: 90.145502645502646 | AD750: 20
A751: SANDRINGHAM | C751: ANDERSON | F751: MILLER | I751: FREY | L751: SMAIL | N751: SAUNDERS | Q751: COMTE | W751: PORT MELBOURNE | X751: 4 | Y751: 9 | Z751: 1 | AA751: 1313 | AB751: 1468 | AC751: 89.441416893732963 | AD751: 18
A752: GOALKICKERS | M752: JORDAN | P752: WHITE | W752: YARRAVILLE | X752: 4 | Y752: 10 | Z752: 0 | AA752: 1169 | AB752: 1437 | AC752: 81.350034794711206 | AD752: 16
A753: COBURG | C753: WITHAM 3 | F753: ELLAWAY 3 | I753: DIXON 3 | K753: SCANLON 3 | N753: IRVINE 2 | P753: BERRYMAN 2 | S753: FAY | W753: OAKLEIGH | X753: 3 | Y753: 11 | Z753: 0 | AA753: 1287 | AB753: 1568 | AC753: 82.079081632653057 | AD753: 12
A754: SANDRINGHAM | C754: ANDERSON 8 | F754: FREY 3 | H754: GAINGER | J754: HARTNETT | W754: WILLIAMSTOWN | X754: 2 | Y754: 12 | Z754: 0 | AA754: 1153 | AB754: 1655 | AC754: 69.667673716012089 | AD754: 8
A756: BRUNSWICK | C756: 3 | D756: 3 | E756: =C756*6+D756 -> 21 | G756: 5 | H756: 10 | I756: =G756*6+H756 -> 40 | K756: 8 | L756: 13 | M756: =K756*6+L756 -> 61 | O756: 11 | P756: 17 | Q756: =O756*6+P756 -> 83 | S756: BRUNSWICK
A757: PORT MELBOURNE | C757: 3 | D757: 3 | E757: =C757*6+D757 -> 21 | G757: 7 | H757: 5 | I757: =G757*6+H757 -> 47 | K757: 10 | L757: 5 | M757: =K757*6+L757 -> 65 | O757: 11 | P757: 8 | Q757: =O757*6+P757 -> 74 | S757: GREGORY
A758: BEST PLAYERS
A759: BRUNSWICK | C759: QUINN | E759: DOWLING | H759: CRAWFORD | K759: FAY | N759: McGRATH | Q759: TURNER
A760: PORT MELBOURNE | C760: LAHIFF | E760: ALSOP | H760: DOBSON | K760: BLOOMER | N760: JULIER | Q760: LEE
A761: GOALKICKERS
A762: BRUNSWICK | C762: McGRATH 3 | F762: McINNES 2 | I762: DOWLING 2 | L762: QUINN | N762: BOYD | P762: CRAWFORD | S762: KANNGEISER
A763: PORT MELBOURNE | C763: FREYER 4 | F763: JONES 2 | I763: LAHIFF 2 | L763: WILLIAMS | N763: LEE | P763: RICHES
A765: BRIGHTON | C765: 7 | D765: 3 | E765: =C765*6+D765 -> 45 | G765: 9 | H765: 4 | I765: =G765*6+H765 -> 58 | K765: 15 | L765: 9 | M765: =K765*6+L765 -> 99 | O765: 17 | P765: 10 | Q765: =O765*6+P765 -> 112 | S765: ELSTERNWICK PARK
A766: YARRAVILLE | C766: 1 | D766: 1 | E766: =C766*6+D766 -> 7 | G766: 8 | H766: 7 | I766: =G766*6+H766 -> 55 | K766: 9 | L766: 9 | M766: =K766*6+L766 -> 63 | O766: 14 | P766: 12 | Q766: =O766*6+P766 -> 96 | S766: LESTER
A767: BEST PLAYERS
A768: BRIGHTON | C768: FITCHER | F768: J EGAN | I768: CONDON | L768: WEBER | O768: OPREY | Q768: PENNY
A769: YARRAVILLE | C769: ANDERSON | F769: WEDGWOOD | I769: STREETER | L769: McVEIGH | O769: HALL | Q769: BONIFACE
A770: GOALKICKERS
A771: BRIGHTON | C771: OPREY 6 | E771: BOLWELL 3 | H771: BUCKLEY 3 | J771: MILLER 2 | M771: TANNER | O771: PENNY | Q771: DEANE
A772: YARRAVILLE | C772: TRIBE 4 | E772: HALL 3 | G772: PANNELL 2 | J772: KENNY | L772: PERUSSICH | N772: CAMPBELL | Q772: FREW | S772: McVEIGH
A774: PRAHRAN | C774: 3 | D774: 2 | E774: =C774*6+D774 -> 20 | G774: 10 | H774: 7 | I774: =G774*6+H774 -> 67 | K774: 14 | L774: 15 | M774: =K774*6+L774 -> 99 | O774: 17 | P774: 18 | Q774: =O774*6+P774 -> 120 | S774: TOORAK PARK
A775: OAKLEIGH | C775: 0 | D775: 6 | E775: =C775*6+D775 -> 6 | G775: 3 | H775: 11 | I775: =G775*6+H775 -> 29 | K775: 7 | L775: 14 | M775: =K775*6+L775 -> 56 | O775: 11 | P775: 17 | Q775: =O775*6+P775 -> 83 | S775: HAYES
A776: BEST PLAYERS
A777: PRAHRAN | C777: NEESON | E777: WHITE | H777: DREW | K777: THOMPSON | N777: FLEMING | Q777: ROBERTS
A778: OAKLEIGH | C778: ASH | E778: WILMOTT | H778: CORP | K778: KENNEDY | N778: NOLAN | Q778: HARRISON
A779: GOALKICKERS
A780: PRAHRAN | C780: WHITE 4 | E780: HAWKINS 3 | H780: NEESON 3 | K780: PORTER 3 | N780: GRAVELL 2 | Q780: THOMPSON | T780: WILLIAMS
A781: OAKLEIGH | C781: NOLAN 3 | E781: KENNEDY 2 | H781: HARRISON 2 | K781: CALLESON 2 | N781: LAW | P781: CRAMERI
A783: NORTHCOTE | C783: 9 | D783: 6 | E783: =C783*6+D783 -> 60 | G783: 13 | H783: 11 | I783: =G783*6+H783 -> 89 | K783: 20 | L783: 19 | M783: =K783*6+L783 -> 139 | O783: 21 | P783: 20 | Q783: =O783*6+P783 -> 146 | S783: NORTHCOTE
A784: WILLIAMSTOWN | C784: 1 | D784: 0 | E784: =C784*6+D784 -> 6 | G784: 3 | H784: 6 | I784: =G784*6+H784 -> 24 | K784: 6 | L784: 8 | M784: =K784*6+L784 -> 44 | O784: 8 | P784: 11 | Q784: =O784*6+P784 -> 59 | S784: LEWIS
A785: BEST PLAYERS
A786: NORTHCOTE | C786: SEYMOUR | F786: LYNGCOLN | I786: WATT | L786: STABB | O786: DOWNIE | R786: HOLDEN
A787: WILLIAMSTOWN | C787: DELLER | F787: JERRAM | I787: HARLAND | L787: CUTTING | O787: PATERSON | R787: HARRIS
A788: GOALKICKERS
A789: NORTHCOTE | C789: SEYMOUR 6 | F789: MEITZCKE 3 | I789: STABB 3 | K789: SIMPSON 3 | N789: DOWNIE 3 | Q789: NEWMAN | S789: TRIGG | U789: SMITH
A790: WILLIAMSTOWN | C790: PATERSON 3 | F790: RICHARDSON 2 | J790: RAE 2 | L790: CAHILL
A792: ROUND 15 | E792: 16TH JULY | J792: WEATHER | M792: CLOUDY BUT FINE | S792: PLAYED AT
D793: 1ST QTR | H793: 2ND QTR | L793: 3RD QTR | P793: FINAL | S793: CAMBERWELL
A794: CAMBERWELL | C794: 2 | D794: 4 | E794: =C794*6+D794 -> 16 | G794: 5 | H794: 8 | I794: =G794*6+H794 -> 38 | K794: 10 | L794: 9 | M794: =K794*6+L794 -> 69 | O794: 14 | P794: 13 | Q794: =O794*6+P794 -> 97 | S794: UMPIRE | X794: LADDER | AB794: ROUND | AD794: 15
A795: BRIGHTON | C795: 1 | D795: 8 | E795: =C795*6+D795 -> 14 | G795: 5 | H795: 11 | I795: =G795*6+H795 -> 41 | K795: 8 | L795: 20 | M795: =K795*6+L795 -> 68 | O795: 11 | P795: 21 | Q795: =O795*6+P795 -> 87 | S795: GROVES
A796: BEST PLAYERS | W796: TEAM | X796: W | Y796: L | Z796: D | AA796: FOR | AB796: AGST | AC796: % | AD796: PTS
A797: CAMBERWELL | C797: A DAVIDSON | F797: LENNE | I797: NASH | L797: BAKER | O797: KECK | Q797: TURNER
A798: BRIGHTON | C798: RUDD | F798: BOLWELL | I798: WEBER | L798: HINDSON | O798: MILLER | Q798: KEMP | W798: BRUNSWICK | X798: 14 | Y798: 1 | Z798: 0 | AA798: 1740 | AB798: 1213 | AC798: 143.45 | AD798: 56
A799: GOALKICKERS | W799: BRIGHTON | X799: 11 | Y799: 3 | Z799: 1 | AA799: 1546 | AB799: 1355 | AC799: 114.1 | AD799: 46
A800: CAMBERWELL | C800: NASH 6 | F800: DAVIDSON 3 | I800: BOND 2 | L800: FORD 2 | N800: BRAIN | W800: NORTHCOTE | X800: 10 | Y800: 5 | Z800: 0 | AA800: 1553 | AB800: 1257 | AC800: 123.54813046937151 | AD800: 40
A801: BRIGHTON | C801: BOLWELL 5 | F801: MILLER 3 | I801: CONNELL 2 | L801: J EGAN | W801: PRAHRAN | X801: 10 | Y801: 5 | Z801: 0 | AA801: 1717 | AB801: 1413 | AC801: 121.51 | AD801: 40
A803: NORTHCOTE | C803: 4 | D803: 2 | E803: =C803*6+D803 -> 26 | G803: 6 | H803: 6 | I803: =G803*6+H803 -> 42 | K803: 13 | L803: 10 | M803: =K803*6+L803 -> 88 | O803: 21 | P803: 11 | Q803: =O803*6+P803 -> 137 | S803: COBURG | W803: CAMBERWELL | X803: 9 | Y803: 6 | Z803: 0 | AA803: 1701 | AB803: 1593 | AC803: 106.78 | AD803: 36
A804: COBURG | C804: 1 | D804: 0 | E804: =C804*6+D804 -> 6 | G804: 3 | H804: 2 | I804: =G804*6+H804 -> 20 | K804: 6 | L804: 3 | M804: =K804*6+L804 -> 39 | O804: 8 | P804: 6 | Q804: =O804*6+P804 -> 54 | S804: LESTER | W804: COBURG | X804: 7 | Y804: 8 | Z804: 0 | AA804: 1429 | AB804: 1482 | AC804: 96.423751686909583 | AD804: 28
A805: BEST PLAYERS | W805: PRESTON | X805: 7 | Y805: 8 | Z805: 0 | AA805: 1367 | AB805: 1452 | AC805: 94.146005509641867 | AD805: 28
A806: NORTHCOTE | C806: LAMPRELL | F806: WATT | I806: HOLDEN | L806: GRAY | N806: SIMPSON | Q806: McINERMNEY | W806: PORT MELBOURNE | X806: 5 | Y806: 9 | Z806: 1 | AA806: 1435 | AB806: 1543 | AC806: 93.000648088139982 | AD806: 22
A807: COBURG | C807: BRAGG | F807: WHITE | I807: SCANLON | L807: RE | N807: IRVINE | Q807: ATKINSON | W807: SANDRINGHAM | X807: 5 | Y807: 10 | Z807: 0 | AA807: 1438 | AB807: 1634 | AC807: 88.004895960832314 | AD807: 20
A808: GOALKICKERS | W808: YARRAVILLE | X808: 5 | Y808: 10 | Z808: 0 | AA808: 1305 | AB808: 1536 | AC808: 84.9609375 | AD808: 20
A809: NORTHCOTE | C809: SEYMOUR 6 | F809: WATT 6 | H809: LAMPRELL 4 | K809: STABB 2 | M809: SIMPSON | O809: GRAY | Q809: NEWMAN | W809: OAKLEIGH | X809: 4 | Y809: 11 | Z809: 0 | AA809: 1435 | AB809: 1669 | AC809: 85.979628520071898 | AD809: 16
A810: COBURG | C810: GAUDION 2 | F810: HILL | H810: WHITE | J810: IRVINE | L810: SCANLON | N810: WITHAM | Q810: DIXON | W810: WILLIAMSTOWN | X810: 2 | Y810: 13 | Z810: 0 | AA810: 1247 | AB810: 1766 | AC810: 70.61155152887882 | AD810: 8
A812: PORT MELBOURNE | C812: 4 | D812: 0 | E812: =C812*6+D812 -> 24 | G812: 7 | H812: 2 | I812: =G812*6+H812 -> 44 | K812: 15 | L812: 6 | M812: =K812*6+L812 -> 96 | O812: 19 | P812: 8 | Q812: =O812*6+P812 -> 122 | S812: PORT MELBOURNE
A813: SANDRINGHAM | C813: 1 | D813: 4 | E813: =C813*6+D813 -> 10 | G813: 5 | H813: 8 | I813: =G813*6+H813 -> 38 | K813: 7 | L813: 9 | M813: =K813*6+L813 -> 51 | O813: 10 | P813: 15 | Q813: =O813*6+P813 -> 75 | S813: PARRIS
A814: BEST PLAYERS
A815: PORT MELBOURNE | C815: FREYER | F815: TUITE | I815: LAHIFF | L815: DOBSON | O815: GARBUTT | R815: JONES
A816: SANDRINGHAM | C816: ANDERSON | F816: COMTE | I816: FREY | L816: McCOY | O816: HARTNETT | R816: MILLER
A817: GOALKICKERS
A818: PORT MELBOURNE | C818: FREYER 13 | F818: LAHIFF 3 | I818: JONES | K818: RICHES | M818: TUITE
A819: SANDRINGHAM | C819: ANDERSON 4 | F819: FREY 2 | H819: HARTNETT 2 | K819: RILEY | M819: FOSTER
A821: OAKLEIGH | C821: 5 | D821: 4 | E821: =C821*6+D821 -> 34 | G821: 11 | H821: 6 | I821: =G821*6+H821 -> 72 | K821: 17 | L821: 11 | M821: =K821*6+L821 -> 113 | O821: 22 | P821: 16 | Q821: =O821*6+P821 -> 148 | S821: OAKLEIGH
A822: PRESTON | C822: 6 | D822: 0 | E822: =C822*6+D822 -> 36 | G822: 9 | H822: 5 | I822: =G822*6+H822 -> 59 | K822: 12 | L822: 7 | M822: =K822*6+L822 -> 79 | O822: 15 | P822: 11 | Q822: =O822*6+P822 -> 101 | S822: CAMERON
A823: BEST PLAYERS
A824: OAKLEIGH | C824: MUDGE | F824: LAW | I824: WATSON | L824: WILMOTT | O824: HARRISON | R824: RYAN
A825: PRESTON | C825: CAMPBELL | F825: ROACH | I825: McPHERSON | L825: HASKETT | O825: BEAGLEY | R825: MASLEN
A826: GOALKICKERS
A827: OAKLEIGH | C827: NOLAN 8 | F827: LAW 6 | H827: WILLIAMS 3 | K827: CALLESON 2 | N827: CRAMERI 2 | Q827: KENNEDY
A828: PRESTON | C828: ROACH 6 | F828: MUIR 4 | H828: GILBERT 2 | K828: QUILL 2 | M828: JOB
A830: PRAHRAN | C830: 3 | D830: 4 | E830: =C830*6+D830 -> 22 | G830: 8 | H830: 13 | I830: =G830*6+H830 -> 61 | K830: 9 | L830: 17 | M830: =K830*6+L830 -> 71 | O830: 14 | P830: 27 | Q830: =O830*6+P830 -> 111 | S830: WILLIAMSTOWN
A831: WILLIAMSTOWN | C831: 6 | D831: 4 | E831: =C831*6+D831 -> 40 | G831: 8 | H831: 5 | I831: =G831*6+H831 -> 53 | K831: 13 | L831: 8 | M831: =K831*6+L831 -> 86 | O831: 14 | P831: 10 | Q831: =O831*6+P831 -> 94 | S831: GREGORY
A832: BEST PLAYERS
A833: PRAHRAN | C833: THOMPSON | F833: NEESON | I833: ROBERTS | L833: HAWKINS | O833: GRAVELL | R833: FLEMING
A834: WILLIAMSTOWN | C834: CAHILL | F834: LAWLOR | I834: THOMAS | L834: RICHARDSON | O834: HARLAND | R834: WILLETT
A835: GOALKICKERS
A836: PRAHRAN | C836: NEESON 4 | F836: PORTER 2 | I836: BRENCHLEY 2 | L836: GRAVELL 2 | O836: WHITE 2 | Q836: TAYLOR | S836: HAWKINS
A837: WILLIAMSTOWN | C837: LAWLOR 5 | F837: KAUFMAN 3 | I837: THOMAS 3 | L837: CAHILL | N837: PATERSON | Q837: RAE
A839: YARRAVILLE | C839: 3 | D839: 8 | E839: =C839*6+D839 -> 26 | G839: 6 | H839: 10 | I839: =G839*6+H839 -> 46 | K839: 16 | L839: 14 | M839: =K839*6+L839 -> 110 | O839: 20 | P839: 16 | Q839: =O839*6+P839 -> 136 | S839: YARRAVILLE
A840: BRUNSWICK | C840: 5 | D840: 4 | E840: =C840*6+D840 -> 34 | G840: 9 | H840: 7 | I840: =G840*6+H840 -> 61 | K840: 11 | L840: 9 | M840: =K840*6+L840 -> 75 | O840: 14 | P840: 15 | Q840: =O840*6+P840 -> 99 | S840: LEWIS
A841: BEST PLAYERS
A842: YARRAVILLE | C842: HEFFERNAN | F842: SCHUTT | I842: CAVE | L842: TRIBE | O842: HALL | R842: COLLINS
A843: BRUNSWICK | C843: QUINN | F843: FAY | I843: DOWLING | L843: McINNES | O843: DAVIS | R843: BAILEY
A844: GOALKICKERS
A845: YARRAVILLE | C845: COLLINS 7 | F845: SCHUTT 5 | I845: TRIBE 3 | K845: BINNS | M845: HALL | N845: McVEIGH | P845: EVANS | R845: JONES
A846: BRUNSWICK | C846: DOWLING 4 | F846: BAILEY 3 | I846: McINNES 2 | K846: CRAWFORD 2 | N846: McGRATH | Q846: GARDNER | T846: CLARKE
A848: ROUND 16 | E848: 23RD JULY | J848: WEATHER | M848: FINE MILD NORTH WIND | S848: PLAYED AT
D849: 1ST QTR | H849: 2ND QTR | L849: 3RD QTR | P849: FINAL | S849: BRUNSWICK
A850: BRUNSWICK | C850: 3 | D850: 6 | E850: =C850*6+D850 -> 24 | G850: 7 | H850: 10 | I850: =G850*6+H850 -> 52 | K850: 13 | L850: 15 | M850: =K850*6+L850 -> 93 | O850: 18 | P850: 18 | Q850: =O850*6+P850 -> 126 | S850: UMPIRE | X850: LADDER | AB850: ROUND | AD850: 16
A851: CAMBERWELL | C851: 4 | D851: 2 | E851: =C851*6+D851 -> 26 | G851: 9 | H851: 7 | I851: =G851*6+H851 -> 61 | K851: 9 | L851: 8 | M851: =K851*6+L851 -> 62 | O851: 12 | P851: 17 | Q851: =O851*6+P851 -> 89 | S851: GREGORY
A852: BEST PLAYERS | W852: TEAM | X852: W | Y852: L | Z852: D | AA852: FOR | AB852: AGST | AC852: % | AD852: PTS
A853: BRUNSWICK | C853: DOWLING | F853: COOPER | I853: QUINN | K853: BOYD | N853: McKERNAN | Q853: CRAWFORD
A854: CAMBERWELL | C854: WALKER | F854: LENNE | I854: BRIGGS | K854: WHITEHEAD | N854: BAKER | Q854: TURNER | W854: BRUNSWICK | X854: 15 | Y854: 1 | Z854: 0 | AA854: 1866 | AB854: 1302 | AC854: 143.32 | AD854: 60
A855: GOALKICKERS | P855: McGRATH | W855: BRIGHTON | X855: 11 | Y855: 4 | Z855: 1 | AA855: 1653 | AB855: 1469 | AC855: 112.53 | AD855: 46
A856: BRUNSWICK | C856: BOYD 5 | E856: McINNES 4 | G856: BAILEY 2 | I856: McKAY 2 | K856: DOWLING 2 | N856: CHALLENGER | Q856: CRAWFORD | W856: NORTHCOTE | X856: 11 | Y856: 5 | Z856: 0 | AA856: 1716 | AB856: 1339 | AC856: 128.15533980582524 | AD856: 44
A857: CAMBERWELL | C857: NASH 5 | E857: LENNE 2 | G857: TURNER | I857: FORD | J857: BOND | L857: WHITEHEAD | O857: ANDERSON | W857: PRAHRAN | X857: 11 | Y857: 5 | Z857: 0 | AA857: 1891 | AB857: 1503 | AC857: 125.82 | AD857: 44
A859: PRAHRAN | C859: 4 | D859: 2 | E859: =C859*6+D859 -> 26 | G859: 9 | H859: 15 | I859: =G859*6+H859 -> 69 | K859: 10 | L859: 23 | M859: =K859*6+L859 -> 83 | O859: 24 | P859: 30 | Q859: =O859*6+P859 -> 174 | S859: TOORAK PARK | W859: CAMBERWELL | X859: 9 | Y859: 7 | Z859: 0 | AA859: 1790 | AB859: 1719 | AC859: 104.13 | AD859: 36
A860: COBURG | C860: 2 | D860: 7 | E860: =C860*6+D860 -> 19 | G860: 5 | H860: 8 | I860: =G860*6+H860 -> 38 | K860: 9 | L860: 12 | M860: =K860*6+L860 -> 66 | O860: 13 | P860: 12 | Q860: =O860*6+P860 -> 90 | S860: GROVES | W860: PRESTON | X860: 8 | Y860: 8 | Z860: 0 | AA860: 1487 | AB860: 1539 | AC860: 96.621182586094861 | AD860: 32
A861: BEST PLAYERS | W861: COBURG | X861: 7 | Y861: 9 | Z861: 0 | AA861: 1519 | AB861: 1656 | AC861: 91.727053140096615 | AD861: 28
A862: PRAHRAN | C862: THOMPSON | F862: WHITE | I862: HAWKINS | L862: FLEMING | O862: BOURNE | Q862: GRAVELL | W862: PORT MELBOURNE | X862: 6 | Y862: 9 | Z862: 1 | AA862: 1551 | AB862: 1654 | AC862: 93.772672309552604 | AD862: 26
A863: COBURG | C863: IRVINE | F863: SCANLON | I863: DIXON | L863: BRAGG | O863: HILL | Q863: GAUDION | W863: OAKLEIGH | X863: 5 | Y863: 11 | Z863: 0 | AA863: 1549 | AB863: 1776 | AC863: 87.218468468468473 | AD863: 20
A864: GOALKICKERS | O864: WILTSHIRE 2 | R864: FLEMING | W864: YARRAVILLE | X864: 5 | Y864: 11 | Z864: 0 | AA864: 1416 | AB864: 1652 | AC864: 85.714285714285708 | AD864: 20
A865: PRAHRAN | C865: HAWKINS 6 | F865: NEESON 4 | I865: PORTER 4 | K865: THOMPSON 3 | N865: WHITE 2 | P865: GRAVELL 2 | W865: SANDRINGHAM | X865: 5 | Y865: 11 | Z865: 0 | AA865: 1520 | AB865: 1797 | AC865: 84.585420144685585 | AD865: 20
A866: COBURG | C866: GAUDION 2 | F866: SCANLON 2 | I866: IRVINE 2 | K866: HENNING 2 | N866: FALKINGHAM | Q866: HILL | R866: WHITE | W866: WILLIAMSTOWN | X866: 2 | Y866: 14 | Z866: 0 | AA866: 1334 | AB866: 1886 | AC866: 70.731707317073173 | AD866: 8
P867: FAY | R867: DIXON
A868: PORT MELBOURNE | C868: 8 | D868: 1 | E868: =C868*6+D868 -> 49 | G868: 9 | H868: 3 | I868: =G868*6+H868 -> 57 | K868: 16 | L868: 7 | M868: =K868*6+L868 -> 103 | O868: 18 | P868: 8 | Q868: =O868*6+P868 -> 116 | S868: YARRAVILLE
A869: YARRAVILLE | C869: 3 | D869: 1 | E869: =C869*6+D869 -> 19 | G869: 9 | H869: 6 | I869: =G869*6+H869 -> 60 | K869: 10 | L869: 7 | M869: =K869*6+L869 -> 67 | O869: 16 | P869: 15 | Q869: =O869*6+P869 -> 111 | S869: LESTER
A870: BEST PLAYERS
A871: PORT MELBOURNE | C871: FREYER | F871: LAHIFF | I871: GARBUTT | L871: WOODS | O871: RUSSO | R871: BLOOMER
A872: YARRAVILLE | C872: COLLINS | F872: PENNY | I872: SCHUTT | L872: CAVE | O872: STREETER | R872: HEFFERNAN
A873: GOALKICKERS
A874: PORT MELBOURNE | C874: FREYER 8 | F874: LEE 2 | H874: RICHES 2 | J874: GOSS 2 | L874: EASTMUIR | N874: TUITE | P874: WILLIAMS | R874: LAHIFF
A875: YARRAVILLE | C875: COLLINS 5 | F875: TRIBE 4 | H875: SCHUTT 2 | J875: MCVEIGH 2 | M875: KENNY | O875: HALL | Q875: FREW
A877: NORTHCOTE | C877: 2 | D877: 7 | E877: =C877*6+D877 -> 19 | G877: 8 | H877: 13 | I877: =G877*6+H877 -> 61 | K877: 18 | L877: 22 | M877: =K877*6+L877 -> 130 | O877: 22 | P877: 31 | Q877: =O877*6+P877 -> 163 | S877: NORTHCOTE
A878: SANDRINGHAM | C878: 1 | D878: 5 | E878: =C878*6+D878 -> 11 | G878: 3 | H878: 9 | I878: =G878*6+H878 -> 27 | K878: 9 | L878: 9 | M878: =K878*6+L878 -> 63 | O878: 12 | P878: 10 | Q878: =O878*6+P878 -> 82 | S878: SETTER
A879: BEST PLAYERS
A880: NORTHCOTE | C880: SMITH | F880: SIMPSON | I880: LYNGCOLN | L880: DOWLING | O880: E HART | R880: SEYMOUR
A881: SANDRINGHAM | C881: STAPLETON | F881: CHILDS | I881: FREY | L881: TORPY | O881: ANDERSON | R881: WEBER
A882: GOALKICKERS
A883: NORTHCOTE | C883: SEYMOUR 7 | F883: SIMPSON 6 | I883: DOWNIE 2 | K883: LAMPRELL 2 | N883: ROSS | P883: NEWMAN | R883: GRAY | T883: STABB | W883: WATT
A884: SANDRINGHAM | C884: WEBER 4 | F884: ANDERSON 3 | I884: FREY 2 | K884: COMTE | M884: CHILDS | O884: FISHER
A886: PRESTON | C886: 1 | D886: 1 | E886: =C886*6+D886 -> 7 | G886: 9 | H886: 6 | I886: =G886*6+H886 -> 60 | K886: 11 | L886: 7 | M886: =K886*6+L886 -> 73 | O886: 18 | P886: 12 | Q886: =O886*6+P886 -> 120 | S886: PRESTON
A887: WILLIAMSTOWN | C887: 4 | D887: 8 | E887: =C887*6+D887 -> 32 | G887: 5 | H887: 14 | I887: =G887*6+H887 -> 44 | K887: 11 | L887: 19 | M887: =K887*6+L887 -> 85 | O887: 11 | P887: 21 | Q887: =O887*6+P887 -> 87 | S887: HAYES
A888: BEST PLAYERS
A889: PRESTON | C889: CLARKE | F889: ROACH | I889: CAMPBELL | M889: MASLEN | P889: COLBANE | S889: DUNSTONE
A890: WILLIAMSTOWN | C890: CAHILL | F890: PATERSON | I890: LAWLOR | M890: JERRAM | P890: WILCOX | S890: WILLETT
A891: GOALKICKERS
A892: PRESTON | C892: ROACH 4 | E892: WHITECHURCH 4 | I892: JOB 3 | K892: DOHERTY 2 | N892: GILBERT 2 | Q892: MUIR 2 | S892: McPHERSON
A893: WILLIAMSTOWN | C893: LAWLOR 8 | F893: PATERSON | I893: MALONEY | L893: RICHARDSON
A895: OAKLEIGH | C895: 6 | D895: 2 | E895: =C895*6+D895 -> 38 | G895: 12 | H895: 8 | I895: =G895*6+H895 -> 80 | K895: 13 | L895: 11 | M895: =K895*6+L895 -> 89 | O895: 16 | P895: 18 | Q895: =O895*6+P895 -> 114 | S895: ELSTERNWICK PARK
A896: BRIGHTON | C896: 6 | D896: 4 | E896: =C896*6+D896 -> 40 | G896: 7 | H896: 7 | I896: =G896*6+H896 -> 49 | K896: 14 | L896: 9 | M896: =K896*6+L896 -> 93 | O896: 16 | P896: 11 | Q896: =O896*6+P896 -> 107 | S896: DWYER
A897: BEST PLAYERS
A898: OAKLEIGH | C898: N HUTCHESON | F898: ASH | I898: HARRISON | M898: CORP | P898: WILMOTT | S898: RYAN
A899: BRIGHTON | C899: KEMP | F899: PENNY | I899: RUDD | M899: JOHNSON | P899: GEORGE | S899: WEBER
A900: GOALKICKERS
A901: OAKLEIGH | C901: HARRISON 5 | F901: NOLAN 4 | H901: CRAMERI 2 | J901: KENNEDY 2 | M901: ASH | N901: CORP | P901: SMITH
A902: BRIGHTON | C902: GOLDSTRAW 3 | F902: PENNY 3 | H902: BOLWELL | J902: OPREY | L902: HALLAHAN | N902: FITCHER | P902: CONNELL | R902: MILLER | U902: KEMP | W902: TANNER | X902: WEBER
A904: FINALS
A905: 1ST SEMI | E905: 30TH JULY | J905: WEATHER | M905: COLD RAIN S.W. WIND GROUND BAD
D906: 1ST QTR | H906: 2ND QTR | L906: 3RD QTR | P906: FINAL
A907: NORTHCOTE | C907: 1 | D907: 1 | E907: =C907*6+D907 -> 7 | G907: 4 | H907: 5 | I907: =G907*6+H907 -> 29 | K907: 8 | L907: 11 | M907: =K907*6+L907 -> 59 | O907: 11 | P907: 14 | Q907: =O907*6+P907 -> 80 | S907: BRUNSWICK
A908: PRAHRAN | C908: 4 | D908: 3 | E908: =C908*6+D908 -> 27 | G908: 8 | H908: 5 | I908: =G908*6+H908 -> 53 | K908: 9 | L908: 8 | M908: =K908*6+L908 -> 62 | O908: 9 | P908: 11 | Q908: =O908*6+P908 -> 65 | S908: LESTER
A909: BEST PLAYERS
A910: NORTHCOTE | C910: SEYMOUR | F910: ROSS | I910: GRAY | L910: DOWNIE | O910: POWELL | R910: HONIG
A911: PRAHRAN | C911: HAWKINS | F911: GRAVELL | I911: ROBERTS | L911: WILTSHIRE | O911: PORTER | R911: WHITE
A912: GOALKICKERS
A913: NORTHCOTE | C913: SEYMOUR 4 | F913: DOWNIE 2 | I913: LYNGCOLN 2 | L913: GRAY | N913: NEWMAN | Q913: McNAMARA
A914: PRAHRAN | C914: HAWKINS 4 | F914: PORTER 3 | I914: THOMPSON | L914: GRAVELL
A916: 2ND SEMI | E916: 6TH AUGUST | J916: WEATHER | M916: FINE STRONG NORTH WIND
A917: BRUNSWICK | C917: 6 | D917: 3 | E917: =C917*6+D917 -> 39 | G917: 8 | H917: 3 | I917: =G917*6+H917 -> 51 | K917: 13 | L917: 6 | M917: =K917*6+L917 -> 84 | O917: 16 | P917: 11 | Q917: =O917*6+P917 -> 107 | S917: TOORAK PARK
A918: BRIGHTON | C918: 1 | D918: 0 | E918: =C918*6+D918 -> 6 | G918: 5 | H918: 2 | I918: =G918*6+H918 -> 32 | K918: 8 | L918: 3 | M918: =K918*6+L918 -> 51 | O918: 10 | P918: 5 | Q918: =O918*6+P918 -> 65 | S918: GREGORY
A919: BEST PLAYERS
A920: BRUNSWICK | C920: TURNER | E920: FAY | H920: DOWLING | K920: MASKELL | N920: McINNES | Q920: BAILEY
A921: BRIGHTON | C921: EGAN | E921: KEMP | H921: HALLAHAN | K921: EDMONDS | N921: BOLWELL | Q921: BAKER
A922: GOALKICKERS
A923: BRUNSWICK | C923: DOWLING 5 | F923: McINNES 2 | I923: McGRATH 2 | L923: BOYD 2 | N923: QUINN | P923: McKAY | R923: BAILEY | U923: GARDNER | X923: MASKELL
A924: BRIGHTON | C924: MILLER 3 | F924: EDMONDS 2 | I924: CONNELL 2 | L924: BOLWELL | N924: BAKER | P924: WEBER
A926: PRELIMINARY FINAL | F926: 13TH AUGUST | J926: WEATHER | M926: FINE MILD N.W. BREEZE
A927: BRIGHTON | C927: 4 | D927: 2 | E927: =C927*6+D927 -> 26 | G927: 8 | H927: 9 | I927: =G927*6+H927 -> 57 | K927: 10 | L927: 15 | M927: =K927*6+L927 -> 75 | O927: 12 | P927: 19 | Q927: =O927*6+P927 -> 91 | S927: TOORAK PARK
A928: NORTHCOTE | C928: 3 | D928: 1 | E928: =C928*6+D928 -> 19 | G928: 7 | H928: 1 | I928: =G928*6+H928 -> 43 | K928: 11 | L928: 3 | M928: =K928*6+L928 -> 69 | O928: 11 | P928: 7 | Q928: =O928*6+P928 -> 73 | S928: GROVES
A929: BEST PLAYERS
A930: BRIGHTON | C930: HALLAHAN | F930: N EGAN | I930: DEANE | L930: GEORGE | O930: PENNY | R930: WILLIAMSON
A931: NORTHCOTE | C931: DOWNIE | F931: E HART | I931: NEWMAN | L931: SEYMOUR | O931: SIMPSON | R931: ROSS
A932: GOALKICKERS
A933: BRIGHTON | C933: TANNER 4 | F933: BAKER 3 | I933: DEANE 3 | K933: KEMP | M933: PENNY
A934: NORTHCOTE | C934: SEYMOUR 5 | F934: MEITZCKE | I934: GRAY | K934: HONIG | M934: SIMPSON | O934: McNAMARA | R934: LYNGCOLN
A936: GRAND FINAL | E936: 20TH AUGUST | J936: WEATHER | M936: FINE LIGHT SOUTH BREEZE
A937: BRUNSWICK | C937: 8 | D937: 3 | E937: =C937*6+D937 -> 51 | G937: 10 | H937: 4 | I937: =G937*6+H937 -> 64 | K937: 15 | L937: 12 | M937: =K937*6+L937 -> 102 | O937: 19 | P937: 17 | Q937: =O937*6+P937 -> 131 | S937: TOORAK PARK
A938: BRIGHTON | C938: 3 | D938: 3 | E938: =C938*6+D938 -> 21 | G938: 7 | H938: 12 | I938: =G938*6+H938 -> 54 | K938: 12 | L938: 12 | M938: =K938*6+L938 -> 84 | O938: 14 | P938: 14 | Q938: =O938*6+P938 -> 98 | S938: LESTER
A939: BEST PLAYERS
A940: BRUNSWICK | C940: TURNER | F940: McKAY | I940: DOWLING | L940: MASKELL | O940: FAY | R940: GARDNER
A941: BRIGHTON | C941: HALLAHAN | F941: DEANE | I941: FITCHER | L941: HINDSON | O941: CONNELL | R941: WEBER
A942: GOALKICKERS
A943: BRUNSWICK | C943: BAILEY 4 | F943: DOWLING 3 | I943: McINNES 3 | L943: BOYD 2 | N943: McKAY 2 | P943: CHALLENGER 2 | S943: GARDNER | W943: QUINN | X943: CRAWFORD
A944: BRIGHTON | C944: FITCHER 3 | F944: PENNY 2 | I944: MORGAN 2 | L944: CONNELL 2 | N944: OPREY 2 | P944: TANNER | R944: DEANE | T944: N EGAN
A946: TEAMS
G947: BRUNSWICK | S947: BRIGHTON
A948: BACKS | C948: MASKELL | G948: FAY | K948: McKERNAN | P948: HINDSON | U948: N EGAN | X948: GEORGE
A949: H-BACKS | C949: TURNER | G949: COOPER | K949: DAVIS | P949: CONDON | U949: HONE | X949: JOHNSON
A950: CENTRES | C950: CLARKE | G950: QUINN | K950: CHALLENGER | P950: MILLER | U950: HALLAHAN | X950: WILLIAMSON
A951: H-FORWARDS | C951: GILLON | G951: McKAY | K951: GARDNER | P951: BOLWELL | U951: CONNELL | X951: DEANE
A952: FORWARDS | C952: CRAWFORD | G952: McINNES | K952: BAILEY | P952: OPREY | U952: TANNER | X952: MORGAN
A953: RUCKS | C953: BOYD | G953: McGRATH | K953: DOWLING | P953: FITCHER | U953: WEBER | X953: PENNY
A954: RES | C954: KELTY | P954: BUCKLEY