A1: Victorian Football Association
A2: Season 1939
A3: © Copyright Wal Williams | F3: First created: 2 November 2014
A4: Contact: joywalwi at gmail dot com | F4: Last updated: 27 January 2018 | W4: VFA Results and tables - Link to the main index page
A5: You are free to copy this document in whole or part provided that proper acknowledgement is given to the author. All rights reserved.
A7: YEAR 1939
A8: ROUND 1 | E8: 15TH APRIL | J8: WEATHER | M8: COOL CLOUDY S.W. WIND | S8: PLAYED AT
D9: 1ST QTR | H9: 2ND QTR | L9: 3RD QTR | P9: FINAL | S9: TOORAK PARK
A10: PRAHRAN | C10: 6 | D10: 6 | E10: =C10*6+D10 -> 42 | G10: 13 | H10: 15 | I10: =G10*6+H10 -> 93 | K10: 17 | L10: 19 | M10: =K10*6+L10 -> 121 | O10: 25 | P10: 26 | Q10: =O10*6+P10 -> 176 | S10: UMPIRE | X10: LADDER | AB10: ROUND | AD10: 1
A11: PORT MELBOURNE | C11: 1 | D11: 1 | E11: =C11*6+D11 -> 7 | G11: 4 | H11: 4 | I11: =G11*6+H11 -> 28 | K11: 4 | L11: 9 | M11: =K11*6+L11 -> 33 | O11: 8 | P11: 12 | Q11: =O11*6+P11 -> 60 | S11: GEE
A12: BEST PLAYERS | W12: TEAM | X12: W | Y12: L | Z12: D | AA12: FOR | AB12: AGST | AC12: % | AD12: PTS
A13: PRAHRAN | C13: HAWKINS | F13: FAUL | I13: THOMPSON | L13: DREW | O13: GRAVELL | Q13: ROBERTS
A14: PORT MELBOURNE | C14: LAHIFF | F14: R MARSHALL | I14: LEE | L14: DOBSON | O14: RUSSO | Q14: CASHMAN | W14: PRAHRAN | X14: 1 | Y14: 0 | Z14: 0 | AA14: 176 | AB14: 60 | AC14: 293.33333333333331 | AD14: 4
A15: GOALKICKERS | W15: NORTHCOTE | X15: 1 | Y15: 0 | Z15: 0 | AA15: 105 | AB15: 60 | AC15: 175 | AD15: 4
A16: PRAHRAN | C16: HAWKINS 14 | F16: GRAVELL 5 | I16: WHITE 2 | K16: THOMPSON 2 | N16: BRENCHLEY | Q16: PROBYN | W16: WILLIAMSTOWN | X16: 1 | Y16: 0 | Z16: 0 | AA16: 133 | AB16: 86 | AC16: 154.65116279069767 | AD16: 4
A17: PORT MELBOURNE | C17: FREYER 3 | F17: FULTON 2 | I17: REYNOLDS | K17: OLSEN | M17: CASHMAN | W17: SANDRINGHAM | X17: 1 | Y17: 0 | Z17: 0 | AA17: 136 | AB17: 95 | AC17: 143.15789473684211 | AD17: 4
A19: NORTHCOTE | C19: 3 | D19: 8 | E19: =C19*6+D19 -> 26 | G19: 6 | H19: 11 | I19: =G19*6+H19 -> 47 | K19: 9 | L19: 15 | M19: =K19*6+L19 -> 69 | O19: 14 | P19: 21 | Q19: =O19*6+P19 -> 105 | S19: NORTHCOTE | W19: CAMBERWELL | X19: 1 | Y19: 0 | Z19: 0 | AA19: 123 | AB19: 86 | AC19: 143.02325581395348 | AD19: 4
A20: PRESTON | C20: 2 | D20: 2 | E20: =C20*6+D20 -> 14 | G20: 3 | H20: 5 | I20: =G20*6+H20 -> 23 | K20: 8 | L20: 9 | M20: =K20*6+L20 -> 57 | O20: 8 | P20: 12 | Q20: =O20*6+P20 -> 60 | S20: LEWIS | W20: BRUNSWICK | X20: 1 | Y20: 0 | Z20: 0 | AA20: 98 | AB20: 72 | AC20: 136.11111111111111 | AD20: 4
A21: BEST PLAYERS | W21: COBURG | X21: 0 | Y21: 1 | Z21: 0 | AA21: 72 | AB21: 98 | AC21: 73.469387755102048 | AD21: 0
A22: NORTHCOTE | C22: RUDDELL | F22: MEITZCKE | I22: WATT | K22: SIMPSON | N22: LAMPRELL | Q22: DOWNIE | W22: OAKLEIGH | X22: 0 | Y22: 1 | Z22: 0 | AA22: 86 | AB22: 123 | AC22: 69.918699186991873 | AD22: 0
A23: PRESTON | C23: MASLEN | F23: DOWLING | I23: WILKINS | K23: DUNHAM | N23: MORRISON | Q23: DUNSTONE | W23: BRIGHTON | X23: 0 | Y23: 1 | Z23: 0 | AA23: 95 | AB23: 136 | AC23: 69.852941176470594 | AD23: 0
A24: GOALKICKERS | W24: YARRAVILLE | X24: 0 | Y24: 1 | Z24: 0 | AA24: 86 | AB24: 133 | AC24: 64.661654135338352 | AD24: 0
A25: NORTHCOTE | C25: LAMPRELL 6 | F25: SIMPSON 3 | I25: HOSKING 3 | L25: RUSH | N25: BRETHERTON | W25: PRESTON | X25: 0 | Y25: 1 | Z25: 0 | AA25: 60 | AB25: 105 | AC25: 57.142857142857146 | AD25: 0
A26: PRESTON | C26: ROACH 3 | F26: O'BRIEN 2 | I26: MORRISON 2 | L26: DOHERTY | W26: PORT MELBOURNE | X26: 0 | Y26: 1 | Z26: 0 | AA26: 60 | AB26: 176 | AC26: 34.090909090909093 | AD26: 0
A28: SANDRINGHAM | C28: 6 | D28: 5 | E28: =C28*6+D28 -> 41 | G28: 12 | H28: 10 | I28: =G28*6+H28 -> 82 | K28: 15 | L28: 11 | M28: =K28*6+L28 -> 101 | O28: 20 | P28: 16 | Q28: =O28*6+P28 -> 136 | S28: BEACH ROAD
A29: BRIGHTON | C29: 1 | D29: 3 | E29: =C29*6+D29 -> 9 | G29: 5 | H29: 5 | I29: =G29*6+H29 -> 35 | K29: 9 | L29: 9 | M29: =K29*6+L29 -> 63 | O29: 14 | P29: 11 | Q29: =O29*6+P29 -> 95 | S29: LESTER
A30: BEST PLAYERS
A31: SANDRINGHAM | C31: FISHER | E31: ALLISTER | H31: ANDERSON | K31: WITHERS | N31: SAUNDERS | Q31: MITCHELL
A32: BRIGHTON | C32: CONNELL | E32: PENNY | H32: DEANE | K32: OPREY | N32: DAVIS | Q32: GEORGE
A33: GOALKICKERS
A34: SANDRINGHAM | C34: FISHER 7 | F34: ALLISTER 6 | I34: ANDERSON 2 | L34: WEBER 2 | N34: SMITH 2 | P34: SAUNDERS
A35: BRIGHTON | C35: GODFREY 3 | F35: OPREY 3 | H35: DEANE 2 | J35: CONNELL 2 | M35: PENNY | O35: KEMP | Q35: BOLWELL | T35: WILLIAMSON
A37: BRUNSWICK | C37: 3 | D37: 3 | E37: =C37*6+D37 -> 21 | G37: 10 | H37: 10 | I37: =G37*6+H37 -> 70 | K37: 11 | L37: 16 | M37: =K37*6+L37 -> 82 | O37: 12 | P37: 26 | Q37: =O37*6+P37 -> 98 | S37: COBURG
A38: COBURG | C38: 0 | D38: 2 | E38: =C38*6+D38 -> 2 | G38: 4 | H38: 3 | I38: =G38*6+H38 -> 27 | K38: 8 | L38: 4 | M38: =K38*6+L38 -> 52 | O38: 11 | P38: 6 | Q38: =O38*6+P38 -> 72 | S38: DWYER
A39: BEST PLAYERS
A40: BRUNSWICK | C40: TURNER | F40: DOWLING | I40: McINNES | L40: McGRATH | O40: BOYD | Q40: HARTNEY
A41: COBURG | C41: ATKINSON | F41: JOHNSON | I41: PERRETT | L41: BERRIMAN | O41: BRAGG | Q41: HENNING
A42: GOALKICKERS
A43: BRUNSWICK | C43: McINNES 6 | F43: DOWLING 3 | I43: McGRATH 2 | L43: McKAY
A44: COBURG | C44: HALL 3 | F44: HILL 3 | H44: COLLINS | J44: IRVINE | L44: PERRETT | N44: JOHNSON | P44: BERRIMAN
A46: WILLIAMSTOWN | C46: 5 | D46: 2 | E46: =C46*6+D46 -> 32 | G46: 7 | H46: 11 | I46: =G46*6+H46 -> 53 | K46: 14 | L46: 18 | M46: =K46*6+L46 -> 102 | O46: 18 | P46: 25 | Q46: =O46*6+P46 -> 133 | S46: WILLIAMSTOWN
A47: YARRAVILLE | C47: 6 | D47: 4 | E47: =C47*6+D47 -> 40 | G47: 9 | H47: 6 | I47: =G47*6+H47 -> 60 | K47: 11 | L47: 8 | M47: =K47*6+L47 -> 74 | O47: 12 | P47: 14 | Q47: =O47*6+P47 -> 86 | S47: HAYES
A48: BEST PLAYERS
A49: WILLIAMSTOWN | C49: PATERSON | F49: LAWLER | I49: McDONOUGH | L49: RICHARDSON | O49: THOMAS | Q49: CAHILL
A50: YARRAVILLE | C50: ANDERSON | F50: WEDGWOOD | I50: COLLINS | L50: TRIBE | O50: SCHUTT | Q50: EVANS
A51: GOALKICKERS
A52: WILLIAMSTOWN | C52: VALLENCE 5 | F52: PATERSON 4 | I52: LAWLER 2 | K52: THOMAS 2 | N52: JAMIESON 2 | Q52: RICHARDSON | T52: DELLER | W52: LEATHER
A53: YARRAVILLE | C53: TRIBE 4 | F53: SCHUTT 4 | I53: COLLINS 2 | L53: CHAS MATHESON | P53: WEDGWOOD
A55: CAMBERWELL | C55: 5 | D55: 5 | E55: =C55*6+D55 -> 35 | G55: 9 | H55: 9 | I55: =G55*6+H55 -> 63 | K55: 13 | L55: 13 | M55: =K55*6+L55 -> 91 | O55: 18 | P55: 15 | Q55: =O55*6+P55 -> 123 | S55: OAKLEIGH
A56: OAKLEIGH | C56: 3 | D56: 2 | E56: =C56*6+D56 -> 20 | G56: 4 | H56: 6 | I56: =G56*6+H56 -> 30 | K56: 8 | L56: 8 | M56: =K56*6+L56 -> 56 | O56: 12 | P56: 14 | Q56: =O56*6+P56 -> 86 | S56: GREGORY
A57: BEST PLAYERS
A58: CAMBERWELL | C58: FITCHER | E58: NASH | H58: NEWTON | K58: POOL | N58: HILLARD | Q58: BRIGGS
A59: OAKLEIGH | C59: BEARD | E59: WILSON | H59: MURPHY | K59: WILLIAMS | N59: NOLAN | Q59: JACKSON
A60: GOALKICKERS
A61: CAMBERWELL | C61: NASH 6 | F61: HILLARD 5 | I61: POOL 3 | K61: ANDERSON 2 | N61: BRIGGS | P61: FORD
A62: OAKLEIGH | C62: BEARD 5 | F62: MURPHY 3 | I62: POWER | K62: WILMOT | M62: BELL | N62: NOLAN
A64: ROUND 2 | E64: 22ND APRIL | J64: WEATHER | M64: FINE NORTH WIND | S64: PLAYED AT
D65: 1ST QTR | H65: 2ND QTR | L65: 3RD QTR | P65: FINAL | S65: CAMBERWELL
A66: CAMBERWELL | C66: 2 | D66: 5 | E66: =C66*6+D66 -> 17 | G66: 5 | H66: 17 | I66: =G66*6+H66 -> 47 | K66: 9 | L66: 21 | M66: =K66*6+L66 -> 75 | O66: 12 | P66: 26 | Q66: =O66*6+P66 -> 98 | S66: UMPIRE | X66: LADDER | AB66: ROUND | AD66: 2
A67: WILLIAMSTOWN | C67: 3 | D67: 4 | E67: =C67*6+D67 -> 22 | G67: 6 | H67: 5 | I67: =G67*6+H67 -> 41 | K67: 7 | L67: 5 | M67: =K67*6+L67 -> 47 | O67: 14 | P67: 11 | Q67: =O67*6+P67 -> 95 | S67: GREGORY
A68: BEST PLAYERS | W68: TEAM | X68: W | Y68: L | Z68: D | AA68: FOR | AB68: AGST | AC68: % | AD68: PTS
A69: CAMBERWELL | C69: FITCHER | F69: FARRELLY | I69: LENNIE | L69: HILLARD | N69: BRETT | Q69: TOOHEY
A70: WILLIAMSTOWN | C70: HARLAND | F70: VALLENCE | I70: McDONOUGH | L70: GLASS | N70: PATERSON | Q70: WILLETT | W70: PRAHRAN | X70: 2 | Y70: 0 | Z70: 0 | AA70: 298 | AB70: 145 | AC70: 205.51724137931035 | AD70: 8
A71: GOALKICKERS | W71: NORTHCOTE | X71: 2 | Y71: 0 | Z71: 0 | AA71: 224 | AB71: 140 | AC71: 160 | AD71: 8
A72: CAMBERWELL | C72: NASH 4 | E72: HILLARD 3 | H72: COPPINGER | J72: WARD | L72: FARRELLY | N72: POOL | P72: ANDERSON | W72: BRUNSWICK | X72: 2 | Y72: 0 | Z72: 0 | AA72: 225 | AB72: 170 | AC72: 132.35294117647058 | AD72: 8
A73: WILLIAMSTOWN | C73: VALLENCE 9 | F73: GLASS 2 | H73: McTAGGART | K73: PATERSON | M73: JAMIESON | W73: CAMBERWELL | X73: 2 | Y73: 0 | Z73: 0 | AA73: 221 | AB73: 181 | AC73: 122.09944751381215 | AD73: 8
A75: BRUNSWICK | C75: 3 | D75: 6 | E75: =C75*6+D75 -> 24 | G75: 7 | H75: 10 | I75: =G75*6+H75 -> 52 | K75: 13 | L75: 14 | M75: =K75*6+L75 -> 92 | O75: 18 | P75: 19 | Q75: =O75*6+P75 -> 127 | S75: BRUNSWICK | W75: WILLIAMSTOWN | X75: 1 | Y75: 1 | Z75: 0 | AA75: 228 | AB75: 184 | AC75: 123.91304347826087 | AD75: 4
A76: SANDRINGHAM | C76: 5 | D76: 2 | E76: =C76*6+D76 -> 32 | G76: 8 | H76: 3 | I76: =G76*6+H76 -> 51 | K76: 11 | L76: 8 | M76: =K76*6+L76 -> 74 | O76: 14 | P76: 14 | Q76: =O76*6+P76 -> 98 | S76: HAYES | W76: SANDRINGHAM | X76: 1 | Y76: 1 | Z76: 0 | AA76: 234 | AB76: 222 | AC76: 105.4054054054054 | AD76: 4
A77: BEST PLAYERS | W77: COBURG | X77: 1 | Y77: 1 | Z77: 0 | AA77: 204 | AB77: 194 | AC77: 105.15463917525773 | AD77: 4
A78: BRUNSWICK | C78: CLARKE | E78: CHALLENGER | H78: CRAWFORD | K78: McINNES | N78: DOWLING | Q78: FAY | W78: PORT MELBOURNE | X78: 1 | Y78: 1 | Z78: 0 | AA78: 144 | AB78: 246 | AC78: 58.536585365853661 | AD78: 4
A79: SANDRINGHAM | C79: ALLISTER | E79: WITHERS | H79: CARTWRIGHT | K79: MITCHELL | N79: SAUNDERS | Q79: SMAIL | W79: OAKLEIGH | X79: 0 | Y79: 2 | Z79: 0 | AA79: 156 | AB79: 207 | AC79: 75.362318840579704 | AD79: 0
A80: GOALKICKERS | O80: QUINN | Q80: KINNEAR | W80: YARRAVILLE | X80: 0 | Y80: 2 | Z80: 0 | AA80: 182 | AB80: 265 | AC80: 68.679245283018872 | AD80: 0
A81: BRUNSWICK | C81: McINNES 5 | F81: CRAWFORD 4 | I81: BOYD 2 | K81: DOWLING 2 | N81: CLARKE | P81: GARDNER | R81: BAILEY | W81: BRIGHTON | X81: 0 | Y81: 2 | Z81: 0 | AA81: 175 | AB81: 255 | AC81: 68.627450980392155 | AD81: 0
A82: SANDRINGHAM | C82: WEBER 4 | F82: ALLISTER 3 | I82: CARTWRIGHT 3 | L82: MILLER | N82: FISHER | P82: WITHERS | R82: RYAN | W82: PRESTON | X82: 0 | Y82: 2 | Z82: 0 | AA82: 145 | AB82: 227 | AC82: 63.876651982378853 | AD82: 0
A84: COBURG | C84: 8 | D84: 3 | E84: =C84*6+D84 -> 51 | G84: 10 | H84: 5 | I84: =G84*6+H84 -> 65 | K84: 16 | L84: 11 | M84: =K84*6+L84 -> 107 | O84: 20 | P84: 12 | Q84: =O84*6+P84 -> 132 | S84: YARRAVILLE
A85: YARRAVILLE | C85: 2 | D85: 4 | E85: =C85*6+D85 -> 16 | G85: 6 | H85: 13 | I85: =G85*6+H85 -> 49 | K85: 7 | L85: 14 | M85: =K85*6+L85 -> 56 | O85: 13 | P85: 18 | Q85: =O85*6+P85 -> 96 | S85: LESTER
A86: BEST PLAYERS
A87: COBURG | C87: LITTLE | F87: HENNING | I87: JOHNSON | L87: COLLINS | O87: YOUNG | R87: WELCH
A88: YARRAVILLE | C88: McVEIGH | F88: GRAY | I88: CALVERT | L88: HEFFERNAN | O88: ANDERSON | R88: WEDGWOOD
A89: GOALKICKERS
A90: COBURG | C90: COLLINS 7 | F90: WHITFIELD 4 | I90: JOHNSON 2 | L90: HALL 2 | N90: LINES | P90: LITTLE | R90: WELCH | U90: PERRETT | X90: HENNING
A91: YARRAVILLE | C91: PERUSSICH 7 | F91: SCHUTT 2 | I91: McLURE | K91: EVANS | M91: TANKARD | O91: WEDGWOOD
A93: PORT MELBOURNE | C93: 3 | D93: 4 | E93: =C93*6+D93 -> 22 | G93: 6 | H93: 7 | I93: =G93*6+H93 -> 43 | K93: 10 | L93: 17 | M93: =K93*6+L93 -> 77 | O93: 11 | P93: 18 | Q93: =O93*6+P93 -> 84 | S93: PORT MELBOURNE
A94: OAKLEIGH | C94: 2 | D94: 6 | E94: =C94*6+D94 -> 18 | G94: 6 | H94: 13 | I94: =G94*6+H94 -> 49 | K94: 6 | L94: 14 | M94: =K94*6+L94 -> 50 | O94: 9 | P94: 16 | Q94: =O94*6+P94 -> 70 | S94: MERRINGTON
A95: BEST PLAYERS
A96: PORT MELBOURNE | C96: LAHIFF | F96: ALSOP | I96: HAYES | L96: LEE | O96: FREYER | Q96: CRAWSHAW
A97: OAKLEIGH | C97: MURPHY | F97: N HUTCHESON | I97: F HUTCHESON | L97: DOWLER | O97: ASH | Q97: WILSON
A98: GOALKICKERS
A99: PORT MELBOURNE | C99: CRAWSHAW 5 | F99: FREYER 4 | I99: REYNOLDS | K99: LEE
A100: OAKLEIGH | C100: DOWLER 3 | F100: BEARD 2 | I100: SMITH | K100: CORP | M100: CLARKE | O100: MURPHY
A102: NORTHCOTE | C102: 5 | D102: 7 | E102: =C102*6+D102 -> 37 | G102: 9 | H102: 12 | I102: =G102*6+H102 -> 66 | K102: 14 | L102: 21 | M102: =K102*6+L102 -> 105 | O102: 16 | P102: 23 | Q102: =O102*6+P102 -> 119 | S102: ELSTERNWICK PARK
A103: BRIGHTON | C103: 1 | D103: 0 | E103: =C103*6+D103 -> 6 | G103: 5 | H103: 1 | I103: =G103*6+H103 -> 31 | K103: 6 | L103: 2 | M103: =K103*6+L103 -> 38 | O103: 12 | P103: 8 | Q103: =O103*6+P103 -> 80 | S103: DWYER
A104: BEST PLAYERS
A105: NORTHCOTE | C105: RUSH | E105: MEITZCKE | H105: SIMPSON | K105: E HART | N105: DOWNIE | Q105: McINERNEY
A106: BRIGHTON | C106: HONE | E106: DAVIS | H106: BUCKLEY | K106: JIM HALLAHAN | N106: GEORGE | Q106: HINDSON
A107: GOALKICKERS
A108: NORTHCOTE | C108: SIMPSON 4 | F108: LAMPRELL 3 | I108: RUSH 2 | K108: NEWMAN 2 | N108: DOWNIE 2 | Q108: B HART | S108: MEITZCKE | V108: BRETHERTON
A109: BRIGHTON | C109: JIM HALLAHAN 8 | G109: WARD 2 | I109: BUCKLEY | K109: PENNY
A111: PRAHRAN | C111: 1 | D111: 2 | E111: =C111*6+D111 -> 8 | G111: 7 | H111: 8 | I111: =G111*6+H111 -> 50 | K111: 12 | L111: 10 | M111: =K111*6+L111 -> 82 | O111: 18 | P111: 14 | Q111: =O111*6+P111 -> 122 | S111: PRESTON
A112: PRESTON | C112: 5 | D112: 4 | E112: =C112*6+D112 -> 34 | G112: 6 | H112: 5 | I112: =G112*6+H112 -> 41 | K112: 11 | L112: 10 | M112: =K112*6+L112 -> 76 | O112: 12 | P112: 13 | Q112: =O112*6+P112 -> 85 | S112: GEE
A113: BEST PLAYERS
A114: PRAHRAN | C114: THOMPSON | F114: WHITE | I114: HAWKINS | L114: PROBYN | O114: BRENCHLEY | R114: GRAVELL
A115: PRESTON | C115: MORRISON | F115: DOWLING | I115: ROACH | L115: DUNHAM | O115: CLARKE | R115: ROBERTSON
A116: GOALKICKERS
A117: PRAHRAN | C117: HAWKINS 6 | F117: PORTER 3 | I117: COLLINS 2 | L117: MURRAY 2 | O117: THOMPSON 2 | R117: TAYLOR | U117: PROBYN | X117: WHITE
A118: PRESTON | C118: MORRISON (5) | G118: WHITE | I118: JOB | J118: ROBERTSON | M118: ROACH | O118: WARREN | Q118: O'BRIEN | S118: ROSS
A120: ROUND 3 | E120: 29TH APRIL | H120: WEATHER | K120: O'NIGHT RAIN COOL CLOUDY S.W. WIND | S120: PLAYED AT
D121: 1ST QTR | H121: 2ND QTR | L121: 3RD QTR | P121: FINAL | S121: NORTHCOTE
A122: NORTHCOTE | C122: 3 | D122: 1 | E122: =C122*6+D122 -> 19 | G122: 4 | H122: 4 | I122: =G122*6+H122 -> 28 | K122: 8 | L122: 9 | M122: =K122*6+L122 -> 57 | O122: 13 | P122: 11 | Q122: =O122*6+P122 -> 89 | S122: UMPIRE | X122: LADDER | AB122: ROUND | AD122: 3
A123: BRUNSWICK | C123: 3 | D123: 4 | E123: =C123*6+D123 -> 22 | G123: 7 | H123: 8 | I123: =G123*6+H123 -> 50 | K123: 8 | L123: 11 | M123: =K123*6+L123 -> 59 | O123: 9 | P123: 13 | Q123: =O123*6+P123 -> 67 | S123: MERRINGTON
A124: BEST PLAYERS | W124: TEAM | X124: W | Y124: L | Z124: D | AA124: FOR | AB124: AGST | AC124: % | AD124: PTS
A125: NORTHCOTE | C125: E HART | F125: DRYDEN | I125: RUSH | L125: LAMPRELL | O125: SIMPSON | Q125: DOWNIE
A126: BRUNSWICK | C126: McKERNAN | F126: QUINN | I126: GARDNER | L126: RYAN | O126: BOYD | Q126: CHALLENGER | W126: PRAHRAN | X126: 3 | Y126: 0 | Z126: 0 | AA126: 393 | AB126: 226 | AC126: 173.89380530973452 | AD126: 12
A127: GOALKICKERS | W127: NORTHCOTE | X127: 3 | Y127: 0 | Z127: 0 | AA127: 313 | AB127: 207 | AC127: 151.20772946859904 | AD127: 12
A128: NORTHCOTE | C128: LAMPRELL 3 | F128: RUSH 3 | H128: DOWNIE 2 | K128: DOUGLAS | M128: SIMPSON | O128: MEITZCKE | Q128: HOSKING | S128: B HART | W128: CAMBERWELL | X128: 3 | Y128: 0 | Z128: 0 | AA128: 349 | AB128: 278 | AC128: 125.53956834532374 | AD128: 12
A129: BRUNSWICK | C129: McINNES 2 | F129: McGRATH 2 | I129: KINNEAR | K129: QUINN | M129: GARDNER | O129: DOWLING | Q129: BAILEY | W129: WILLIAMSTOWN | X129: 2 | Y129: 1 | Z129: 0 | AA129: 344 | AB129: 265 | AC129: 129.81132075471697 | AD129: 8
A131: CAMBERWELL | C131: 5 | D131: 1 | E131: =C131*6+D131 -> 31 | G131: 9 | H131: 8 | I131: =G131*6+H131 -> 62 | K131: 14 | L131: 11 | M131: =K131*6+L131 -> 95 | O131: 19 | P131: 14 | Q131: =O131*6+P131 -> 128 | S131: COBURG | W131: SANDRINGHAM | X131: 2 | Y131: 1 | Z131: 0 | AA131: 380 | AB131: 301 | AC131: 126.24584717607974 | AD131: 8
A132: COBURG | C132: 3 | D132: 3 | E132: =C132*6+D132 -> 21 | G132: 6 | H132: 7 | I132: =G132*6+H132 -> 43 | K132: 8 | L132: 9 | M132: =K132*6+L132 -> 57 | O132: 14 | P132: 13 | Q132: =O132*6+P132 -> 97 | S132: DWYER | W132: BRUNSWICK | X132: 2 | Y132: 1 | Z132: 0 | AA132: 292 | AB132: 259 | AC132: 112.74131274131274 | AD132: 8
A133: BEST PLAYERS | W133: PORT MELBOURNE | X133: 2 | Y133: 1 | Z133: 0 | AA133: 227 | AB133: 327 | AC133: 69.418960244648318 | AD133: 8
A134: CAMBERWELL | C134: BRETT | E134: LENNIE | H134: HORKINGS | K134: FITCHER | N134: TOOHEY | Q134: BOND | W134: COBURG | X134: 1 | Y134: 2 | Z134: 0 | AA134: 301 | AB134: 322 | AC134: 93.478260869565219 | AD134: 4
A135: COBURG | C135: JORDAN | E135: SCRIVEN | H135: RE | K135: BRAGG | N135: COLLINS | Q135: WHITFIELD | W135: OAKLEIGH | X135: 0 | Y135: 3 | Z135: 0 | AA135: 237 | AB135: 323 | AC135: 73.374613003095973 | AD135: 0
A136: GOALKICKERS | W136: BRIGHTON | X136: 0 | Y136: 3 | Z136: 0 | AA136: 256 | AB136: 350 | AC136: 73.142857142857139 | AD136: 0
A137: CAMBERWELL | C137: HILLARD 6 | F137: ANDERSON 4 | I137: NASH 3 | K137: FITCHER 2 | M137: POOL | N137: BOND | P137: COPPINGER | R137: BRIGGS | W137: PRESTON | X137: 0 | Y137: 3 | Z137: 0 | AA137: 226 | AB137: 310 | AC137: 72.903225806451616 | AD137: 0
A138: COBURG | C138: COLLINS 7 | F138: HALL 3 | H138: JOHNSON 2 | K138: WHITFIELD 2 | W138: YARRAVILLE | X138: 0 | Y138: 3 | Z138: 0 | AA138: 261 | AB138: 411 | AC138: 63.503649635036496 | AD138: 0
A140: SANDRINGHAM | C140: 5 | D140: 6 | E140: =C140*6+D140 -> 36 | G140: 11 | H140: 11 | I140: =G140*6+H140 -> 77 | K140: 15 | L140: 15 | M140: =K140*6+L140 -> 105 | O140: 21 | P140: 20 | Q140: =O140*6+P140 -> 146 | S140: BEACH ROAD
A141: YARRAVILLE | C141: 2 | D141: 3 | E141: =C141*6+D141 -> 15 | G141: 5 | H141: 8 | I141: =G141*6+H141 -> 38 | K141: 5 | L141: 16 | M141: =K141*6+L141 -> 46 | O141: 10 | P141: 19 | Q141: =O141*6+P141 -> 79 | S141: GEE
A142: BEST PLAYERS
A143: SANDRINGHAM | C143: WITHERS | F143: ALLISTER | I143: REGNIER | L143: WEBER | N143: CARTWRIGHT | Q143: MITCHELL
A144: YARRAVILLE | C144: ANDERSON | F144: McLURE | I144: WEDGWOOD | L144: EVANS | N144: PLUMMER | Q144: CHAS MATHESON
A145: GOALKICKERS
A146: SANDRINGHAM | C146: ALLISTER 7 | F146: CARTWRIGHT 4 | J146: WEBER 3 | L146: ANDERSON 2 | O146: FISHER 2 | Q146: MADDEN 2 | T146: SMITH
A147: YARRAVILLE | C147: CHAS MATHESON 4 | G147: PERUSSICH 3 | J147: WEDGWOOD | M147: KENNY | O147: CALVERT
A149: WILLIAMSTOWN | C149: 4 | D149: 11 | E149: =C149*6+D149 -> 35 | G149: 7 | H149: 15 | I149: =G149*6+H149 -> 57 | K149: 9 | L149: 23 | M149: =K149*6+L149 -> 77 | O149: 15 | P149: 26 | Q149: =O149*6+P149 -> 116 | S149: WILLIAMSTOWN
A150: OAKLEIGH | C150: 1 | D150: 3 | E150: =C150*6+D150 -> 9 | G150: 4 | H150: 9 | I150: =G150*6+H150 -> 33 | K150: 7 | L150: 12 | M150: =K150*6+L150 -> 54 | O150: 11 | P150: 15 | Q150: =O150*6+P150 -> 81 | S150: HAYES
A151: BEST PLAYERS
A152: WILLIAMSTOWN | C152: CUTTING | E152: THOMAS | H152: WILLETT | K152: PATERSON | N152: McDONOUGH | Q152: RICHARDSON
A153: OAKLEIGH | C153: ASH | E153: BEARD | H153: F HUTCHESON | K153: CORP | N153: DOWLER | Q153: O'DONOGHUE
A154: GOALKICKERS
A155: WILLIAMSTOWN | C155: VALLENCE 8 | F155: RICHARDSON 3 | J155: McDONOUGH 2 | N155: THOMAS | P155: PATERSON
A156: OAKLEIGH | C156: DOWLER 4 | F156: WILLS 3 | I156: JACKSON | K156: SMITH | M156: CLARKE | O156: BEARD
A158: PORT MELBOURNE | C158: 2 | D158: 3 | E158: =C158*6+D158 -> 15 | G158: 5 | H158: 6 | I158: =G158*6+H158 -> 36 | K158: 7 | L158: 8 | M158: =K158*6+L158 -> 50 | O158: 12 | P158: 11 | Q158: =O158*6+P158 -> 83 | S158: PRESTON
A159: PRESTON | C159: 1 | D159: 6 | E159: =C159*6+D159 -> 12 | G159: 5 | H159: 13 | I159: =G159*6+H159 -> 43 | K159: 8 | L159: 14 | M159: =K159*6+L159 -> 62 | O159: 11 | P159: 15 | Q159: =O159*6+P159 -> 81 | S159: LESTER
A160: BEST PLAYERS
A161: PORT MELBOURNE | C161: McBETH | E161: RICHES | H161: CASHMAN | K161: RUSSO | N161: LE FANNUE | Q161: LEE
A162: PRESTON | C162: CLARKE | E162: ROACH | H162: JOB | K162: WHITE | N162: DOWLING | Q162: ROBERTSON
A163: GOALKICKERS
A164: PORT MELBOURNE | C164: FREYER 4 | F164: LE FANNUE 3 | I164: CASHMAN 2 | L164: OLSEN | N164: LEE | P164: RICHES
A165: PRESTON | C165: MUIR 3 | F165: WHITE 3 | I165: CLARKE 2 | L165: ROACH | N165: ROBERTSON | Q165: WARREN
A167: PRAHRAN | C167: 5 | D167: 1 | E167: =C167*6+D167 -> 31 | G167: 7 | H167: 4 | I167: =G167*6+H167 -> 46 | K167: 9 | L167: 12 | M167: =K167*6+L167 -> 66 | O167: 13 | P167: 17 | Q167: =O167*6+P167 -> 95 | S167: TOORAK PARK
A168: BRIGHTON | C168: 4 | D168: 4 | E168: =C168*6+D168 -> 28 | G168: 6 | H168: 12 | I168: =G168*6+H168 -> 48 | K168: 9 | L168: 13 | M168: =K168*6+L168 -> 67 | O168: 11 | P168: 15 | Q168: =O168*6+P168 -> 81 | S168: GREGORY
A169: BEST PLAYERS
A170: PRAHRAN | C170: JOHNSON | F170: PORTER | I170: PROBYN | L170: THOMPSON | O170: MILNE | Q170: WILTSHIRE
A171: BRIGHTON | C171: HONE | F171: WARD | I171: HARVEY | L171: DAVIS | O171: PENNY | Q171: HALL
A172: GOALKICKERS
A173: PRAHRAN | C173: HAWKINS 4 | F173: THOMPSON 2 | I173: PORTER 2 | K173: WHITE 2 | M173: COLLINGS | O173: PROBYN | Q173: TAYLOR
A174: BRIGHTON | C174: BOLWELL 3 | F174: JIM HALLAHAN 2 | J174: HONE 2 | L174: CONNELL | N174: GODFREY | P174: DEANE | R174: TANNER
A176: ROUND 4 | E176: 6TH MAY | J176: WEATHER | M176: FINE S.E. BREEZE | S176: PLAYED AT
D177: 1ST QTR | H177: 2ND QTR | L177: 3RD QTR | P177: FINAL | S177: CAMBERWELL
A178: CAMBERWELL | C178: 2 | D178: 4 | E178: =C178*6+D178 -> 16 | G178: 12 | H178: 9 | I178: =G178*6+H178 -> 81 | K178: 17 | L178: 12 | M178: =K178*6+L178 -> 114 | O178: 21 | P178: 16 | Q178: =O178*6+P178 -> 142 | S178: UMPIRE | X178: LADDER | AB178: ROUND | AD178: 4
A179: SANDRINGHAM | C179: 5 | D179: 6 | E179: =C179*6+D179 -> 36 | G179: 7 | H179: 7 | I179: =G179*6+H179 -> 49 | K179: 12 | L179: 13 | M179: =K179*6+L179 -> 85 | O179: 18 | P179: 14 | Q179: =O179*6+P179 -> 122 | S179: MERRINGTON
A180: BEST PLAYERS | W180: TEAM | X180: W | Y180: L | Z180: D | AA180: FOR | AB180: AGST | AC180: % | AD180: PTS
A181: CAMBERWELL | C181: F ANDERSON | F181: HORKINGS | I181: FARRELLY | L181: FITCHER | O181: POOLE | Q181: BENNETT
A182: SANDRINGHAM | C182: REGNIER | F182: S ANDERSON | I182: SAUNDERS | L182: STAPLETON | O182: ALLISTER | Q182: CARTWRIGHT | W182: NORTHCOTE | X182: 4 | Y182: 0 | Z182: 0 | AA182: 435 | AB182: 237 | AC182: 183.54430379746836 | AD182: 16
A183: GOALKICKERS | W183: CAMBERWELL | X183: 4 | Y183: 0 | Z183: 0 | AA183: 491 | AB183: 400 | AC183: 122.75 | AD183: 16
A184: CAMBERWELL | C184: HILLARD 8 | F184: NASH 4 | H184: POOLE 3 | J184: ANDERSON 3 | M184: McPHERSON 2 | P184: BENNETT | W184: BRUNSWICK | X184: 3 | Y184: 1 | Z184: 0 | AA184: 405 | AB184: 294 | AC184: 137.75510204081633 | AD184: 12
A185: SANDRINGHAM | C185: ANDERSON 8 | F185: FISHER 5 | I185: CARTWRIGHT 3 | L185: REGNIER | N185: KENT | W185: PRAHRAN | X185: 3 | Y185: 1 | Z185: 0 | AA185: 428 | AB185: 339 | AC185: 126.25368731563422 | AD185: 12
A187: BRUNSWICK | C187: 4 | D187: 3 | E187: =C187*6+D187 -> 27 | G187: 9 | H187: 7 | I187: =G187*6+H187 -> 61 | K187: 13 | L187: 7 | M187: =K187*6+L187 -> 85 | O187: 17 | P187: 11 | Q187: =O187*6+P187 -> 113 | S187: BRUNSWICK | W187: WILLIAMSTOWN | X187: 3 | Y187: 1 | Z187: 0 | AA187: 439 | AB187: 351 | AC187: 125.07122507122507 | AD187: 12
A188: PRAHRAN | C188: 0 | D188: 1 | E188: =C188*6+D188 -> 1 | G188: 2 | H188: 4 | I188: =G188*6+H188 -> 16 | K188: 3 | L188: 7 | M188: =K188*6+L188 -> 25 | O188: 4 | P188: 11 | Q188: =O188*6+P188 -> 35 | S188: DWYER | W188: SANDRINGHAM | X188: 2 | Y188: 2 | Z188: 0 | AA188: 502 | AB188: 443 | AC188: 113.31828442437923 | AD188: 8
A189: BEST PLAYERS | W189: COBURG | X189: 2 | Y189: 2 | Z189: 0 | AA189: 424 | AB189: 425 | AC189: 99.764705882352942 | AD189: 8
A190: BRUNSWICK | C190: QUINN | F190: FAY | I190: TURNER | L190: FLETT | O190: DOWLING | Q190: McKERNAN | W190: PORT MELBOURNE | X190: 2 | Y190: 2 | Z190: 0 | AA190: 313 | AB190: 422 | AC190: 74.170616113744074 | AD190: 8
A191: PRAHRAN | C191: ROBERTS | F191: JOHNSON | I191: FLEMING | L191: THOMPSON | O191: SMITH | Q191: WHITE | W191: BRIGHTON | X191: 1 | Y191: 3 | Z191: 0 | AA191: 393 | AB191: 448 | AC191: 87.723214285714292 | AD191: 4
A192: GOALKICKERS | Q192: GARDNER | W192: OAKLEIGH | X192: 0 | Y192: 4 | Z192: 0 | AA192: 340 | AB192: 446 | AC192: 76.233183856502237 | AD192: 0
A193: BRUNSWICK | C193: McINNES 3 | F193: DOWLING 3 | I193: CRAWFORD 3 | L193: JONES 2 | N193: FLETT 2 | P193: McGRATH | R193: McKAY | W193: PRESTON | X193: 0 | Y193: 4 | Z193: 0 | AA193: 324 | AB193: 447 | AC193: 72.483221476510067 | AD193: 0
A194: PRAHRAN | C194: THOMPSON | F194: COLLINGS | I194: PORTER | L194: HAWKINS | W194: YARRAVILLE | X194: 0 | Y194: 4 | Z194: 0 | AA194: 291 | AB194: 533 | AC194: 54.596622889305813 | AD194: 0
A196: WILLIAMSTOWN | C196: 5 | D196: 8 | E196: =C196*6+D196 -> 38 | G196: 8 | H196: 10 | I196: =G196*6+H196 -> 58 | K196: 11 | L196: 16 | M196: =K196*6+L196 -> 82 | O196: 13 | P196: 17 | Q196: =O196*6+P196 -> 95 | S196: PORT MELBOURNE
A197: PORT MELBOURNE | C197: 2 | D197: 2 | E197: =C197*6+D197 -> 14 | G197: 5 | H197: 3 | I197: =G197*6+H197 -> 33 | K197: 8 | L197: 5 | M197: =K197*6+L197 -> 53 | O197: 13 | P197: 8 | Q197: =O197*6+P197 -> 86 | S197: LESTER
A198: BEST PLAYERS
A199: WILLIAMSTOWN | C199: THOMAS | E199: McDONOUGH | I199: HARLAND | L199: RICHARDSON | O199: PATERSON | R199: McTAGGART
A200: PORT MELBOURNE | C200: JULIER | E200: ALSOP | I200: RICHES | L200: DOBSON | O200: HAYES | R200: FLETCHER
A201: GOALKICKERS
A202: WILLIAMSTOWN | C202: McDONOUGH 3 | F202: RICHARDSON 3 | I202: VALLENCE 2 | L202: THOMAS 2 | N202: PATERSON | Q202: CAVE | R202: QUINN
A203: PORT MELBOURNE | C203: FREYER 5 | F203: LAHIFF 2 | H203: CRAWSHAW | K203: REYNOLDS | M203: EDWARDS | O203: JONES | Q203: EASTMUIR | T203: CASHMAN
A205: COBURG | C205: 6 | D205: 4 | E205: =C205*6+D205 -> 40 | G205: 10 | H205: 7 | I205: =G205*6+H205 -> 67 | K205: 16 | L205: 10 | M205: =K205*6+L205 -> 106 | O205: 18 | P205: 15 | Q205: =O205*6+P205 -> 123 | S205: OAKLEIGH
A206: OAKLEIGH | C206: 3 | D206: 3 | E206: =C206*6+D206 -> 21 | G206: 9 | H206: 9 | I206: =G206*6+H206 -> 63 | K206: 11 | L206: 14 | M206: =K206*6+L206 -> 80 | O206: 14 | P206: 19 | Q206: =O206*6+P206 -> 103 | S206: GREGORY
A207: BEST PLAYERS
A208: COBURG | C208: MUNDAY | E208: HALL | H208: WHITFIELD | K208: WHITE | N208: JOHNSON | Q208: RE
A209: OAKLEIGH | C209: DOWLER | E209: MURPHY | H209: A WILLIAMS | K209: ASH | N209: F HUTCHESON | Q209: RYAN
A210: GOALKICKERS
A211: COBURG | C211: COLLINS 6 | F211: MUNDAY 4 | I211: WHITE 3 | K211: JOHNSON 2 | N211: WHITFIELD 2 | Q211: JORDAN
A212: OAKLEIGH | C212: DOWLER 3 | F212: WILLIAMS 3 | I212: JACKSON 2 | L212: CALRK | N212: BEARD | P212: SMITH | R212: WILLS | T212: BELL | V212: ASH
A214: BRIGHTON | C214: 8 | D214: 0 | E214: =C214*6+D214 -> 48 | G214: 11 | H214: 4 | I214: =G214*6+H214 -> 70 | K214: 13 | L214: 8 | M214: =K214*6+L214 -> 86 | O214: 20 | P214: 17 | Q214: =O214*6+P214 -> 137 | S214: ELSTERNWICK PARK
A215: PRESTON | C215: 6 | D215: 4 | E215: =C215*6+D215 -> 40 | G215: 9 | H215: 4 | I215: =G215*6+H215 -> 58 | K215: 11 | L215: 8 | M215: =K215*6+L215 -> 74 | O215: 15 | P215: 8 | Q215: =O215*6+P215 -> 98 | S215: HAYES
A216: BEST PLAYERS
A217: BRIGHTON | C217: DAVIS | E217: JIM HALLAHAN | I217: GEORGE | L217: PENNY | O217: GODFREY | Q217: HALL
A218: PRESTON | C218: HASKETT | E218: SLEITH | I218: WARR | L218: LAWLER | O218: ROACH | Q218: MUIR
A219: GOALKICKERS
A220: BRIGHTON | C220: JIM HALLAHAN 7 | F220: PENNY 3 | H220: GODFREY 3 | J220: HONE 2 | L220: DEANE 2 | N220: HARTNETT | Q220: ROBERTSON | T220: BOLWELL
A221: PRESTON | C221: WARR 4 | F221: LAWLER 3 | I221: MORRISON 3 | L221: WHITE 2 | N221: ROACH | Q221: JOB | R221: CLARKE
A223: NORTHCOTE | C223: 0 | D223: 2 | E223: =C223*6+D223 -> 2 | G223: 7 | H223: 11 | I223: =G223*6+H223 -> 53 | K223: 14 | L223: 11 | M223: =K223*6+L223 -> 95 | O223: 17 | P223: 20 | Q223: =O223*6+P223 -> 122 | S223: YARRAVILLE
A224: YARRAVILLE | C224: 1 | D224: 5 | E224: =C224*6+D224 -> 11 | G224: 1 | H224: 7 | I224: =G224*6+H224 -> 13 | K224: 2 | L224: 11 | M224: =K224*6+L224 -> 23 | O224: 3 | P224: 12 | Q224: =O224*6+P224 -> 30 | S224: GEE
A225: BEST PLAYERS
A226: NORTHCOTE | C226: HOLDEN | F226: RUDDELL | I226: MIETZCKE | L226: NEWMAN | O226: B HART | Q226: RUSH
A227: YARRAVILLE | C227: HEFFERNAN | F227: ANDERSON | I227: STREETER | L227: REDPATH | O227: HOPKINS | Q227: SMITH
A228: GOALKICKERS
A229: NORTHCOTE | C229: B HART 4 | F229: NEWMAN 3 | I229: SIMPSON 3 | L229: DOWNIE 3 | N229: MIETZCKE 2 | Q229: RUSH 2
A230: YARRAVILLE | C230: EVANS 2 | F230: SCHUTT
A232: ROUND 5 | E232: 13TH MAY | H232: WEATHER | K232: STRONG NORTH WIND SOME LIGHT SHOWERS | S232: PLAYED AT
D233: 1ST QTR | H233: 2ND QTR | L233: 3RD QTR | P233: FINAL | S233: NORTHCOTE
A234: CAMBERWELL | C234: 6 | D234: 2 | E234: =C234*6+D234 -> 38 | G234: 11 | H234: 2 | I234: =G234*6+H234 -> 68 | K234: 15 | L234: 4 | M234: =K234*6+L234 -> 94 | O234: 15 | P234: 5 | Q234: =O234*6+P234 -> 95 | S234: UMPIRE | X234: LADDER | AB234: ROUND | AD234: 5
A235: NORTHCOTE | C235: 4 | D235: 2 | E235: =C235*6+D235 -> 26 | G235: 6 | H235: 8 | I235: =G235*6+H235 -> 44 | K235: 11 | L235: 12 | M235: =K235*6+L235 -> 78 | O235: 12 | P235: 19 | Q235: =O235*6+P235 -> 91 | S235: McALPINE
A236: BEST PLAYERS | W236: TEAM | X236: W | Y236: L | Z236: D | AA236: FOR | AB236: AGST | AC236: % | AD236: PTS
A237: CAMBERWELL | C237: POOLE | E237: NASH | H237: FITCHER | K237: ROGERS | N237: LENNIE | Q237: HILLARD
A238: NORTHCOTE | C238: RUSH | E238: SIMPSON | H238: LUDLOW | K238: NEWMAN | N238: B HART | Q238: HOLDEN | W238: CAMBERWELL | X238: 5 | Y238: 0 | Z238: 0 | AA238: 586 | AB238: 491 | AC238: 119.34826883910387 | AD238: 20
A239: GOALKICKERS | W239: NORTHCOTE | X239: 4 | Y239: 1 | Z239: 0 | AA239: 526 | AB239: 332 | AC239: 158.43373493975903 | AD239: 16
A240: CAMBERWELL | C240: NASH 5 | E240: HILLARD 5 | H240: POLLE 2 | J240: BENNETT | L240: FARRELLY | N240: WHITE | W240: PRAHRAN | X240: 4 | Y240: 1 | Z240: 0 | AA240: 591 | AB240: 432 | AC240: 136.80555555555554 | AD240: 16
A241: NORTHCOTE | C241: B HART 3 | E241: LAMPRELL 3 | H241: SIMPSON 2 | J241: NEWMAN 2 | M241: HONIG | O241: ACKLAND | W241: BRUNSWICK | X241: 4 | Y241: 1 | Z241: 0 | AA241: 511 | AB241: 392 | AC241: 130.35714285714286 | AD241: 16
A243: COBURG | C243: 7 | D243: 10 | E243: =C243*6+D243 -> 52 | G243: 9 | H243: 10 | I243: =G243*6+H243 -> 64 | K243: 16 | L243: 15 | M243: =K243*6+L243 -> 111 | O243: 21 | P243: 16 | Q243: =O243*6+P243 -> 142 | S243: COBURG | W243: WILLIAMSTOWN | X243: 3 | Y243: 2 | Z243: 0 | AA243: 549 | AB243: 493 | AC243: 111.35902636916836 | AD243: 12
A244: WILLIAMSTOWN | C244: 2 | D244: 1 | E244: =C244*6+D244 -> 13 | G244: 7 | H244: 10 | I244: =G244*6+H244 -> 52 | K244: 13 | L244: 11 | M244: =K244*6+L244 -> 89 | O244: 16 | P244: 14 | Q244: =O244*6+P244 -> 110 | S244: HAYES | W244: SANDRINGHAM | X244: 3 | Y244: 2 | Z244: 0 | AA244: 618 | AB244: 557 | AC244: 110.95152603231598 | AD244: 12
A245: BEST PLAYERS | W245: COBURG | X245: 3 | Y245: 2 | Z245: 0 | AA245: 566 | AB245: 535 | AC245: 105.79439252336448 | AD245: 12
A246: COBURG | C246: WHITFIELD | F246: SCRIVEN | I246: WHITE | K246: JORDAN | N246: COLLINS | Q246: MURRAY | W246: BRIGHTON | X246: 2 | Y246: 3 | Z246: 0 | AA246: 521 | AB246: 522 | AC246: 99.808429118773944 | AD246: 8
A247: WILLIAMSTOWN | C247: RAE | F247: OGDEN | I247: THOMAS | K247: McDONOUGH | N247: JAMIESON | Q247: WELLS | W247: PORT MELBOURNE | X247: 2 | Y247: 3 | Z247: 0 | AA247: 387 | AB247: 550 | AC247: 70.36363636363636 | AD247: 8
A248: GOALKICKERS | Q248: LONSDALE | W248: OAKLEIGH | X248: 0 | Y248: 5 | Z248: 0 | AA248: 454 | AB248: 562 | AC248: 80.782918149466198 | AD248: 0
A249: COBURG | C249: WHITE 7 | E249: COLLINS 5 | G249: JOHNSON 2 | J249: GILLON 2 | L249: HALL 2 | N249: LA FRANCHI | Q249: WHITFIELD | W249: PRESTON | X249: 0 | Y249: 5 | Z249: 0 | AA249: 422 | AB249: 553 | AC249: 76.311030741410491 | AD249: 0
A250: WILLIAMSTOWN | C250: THOMAS 6 | F250: JAMIESON 3 | I250: RICHARDSON 2 | L250: McDONOUGH 2 | O250: HARLAND | Q250: VALLENCE | T250: GLASS | W250: YARRAVILLE | X250: 0 | Y250: 5 | Z250: 0 | AA250: 384 | AB250: 696 | AC250: 55.172413793103445 | AD250: 0
A252: BRIGHTON | C252: 2 | D252: 2 | E252: =C252*6+D252 -> 14 | G252: 10 | H252: 8 | I252: =G252*6+H252 -> 68 | K252: 12 | L252: 11 | M252: =K252*6+L252 -> 83 | O252: 19 | P252: 14 | Q252: =O252*6+P252 -> 128 | S252: ELSTERNWICK PARK
A253: PORT MELBOURNE | C253: 4 | D253: 4 | E253: =C253*6+D253 -> 28 | G253: 6 | H253: 5 | I253: =G253*6+H253 -> 41 | K253: 10 | L253: 12 | M253: =K253*6+L253 -> 72 | O253: 10 | P253: 14 | Q253: =O253*6+P253 -> 74 | S253: MERRINGTON
A254: BEST PLAYERS
A255: BRIGHTON | C255: DAVIS | E255: PENNY | H255: GODFREY | K255: HONE | N255: HARTNETT | Q255: JOHNSON
A256: PORT MELBOURNE | C256: FREYER | E256: LAHIFF | H256: GOLDSMITH | K256: REYNOLDS | N256: FLETCHER | Q256: LEE
A257: GOALKICKERS
A258: BRIGHTON | C258: JIM HALLAHAN 5 | F258: PENNY 3 | H258: CONNELL 3 | J258: MORGAN 2 | M258: BOLWELL | O258: HARTNETT | Q258: DEANE | S258: GODFREY | V258: HENDER | X258: HONE
A259: PORT MELBOURNE | C259: FREYER 4 | F259: EASTMUIR | I259: FLETCHER | K259: JONES | M259: LEE | N259: RICHES | P259: LAHIFF
A261: SANDRINGHAM | C261: 3 | D261: 2 | E261: =C261*6+D261 -> 20 | G261: 6 | H261: 9 | I261: =G261*6+H261 -> 45 | K261: 10 | L261: 13 | M261: =K261*6+L261 -> 73 | O261: 16 | P261: 20 | Q261: =O261*6+P261 -> 116 | S261: BEACH ROAD
A262: OAKLEIGH | C262: 5 | D262: 9 | E262: =C262*6+D262 -> 39 | G262: 7 | H262: 11 | I262: =G262*6+H262 -> 53 | K262: 14 | L262: 17 | M262: =K262*6+L262 -> 101 | O262: 16 | P262: 18 | Q262: =O262*6+P262 -> 114 | S262: GREGORY
A263: BEST PLAYERS
A264: SANDRINGHAM | C264: ALLISTER | F264: MILLER | I264: FISHER | K264: MITCHELL | N264: REGNIER | Q264: WITHERS
A265: OAKLEIGH | C265: FISCHER | F265: DOWLER | I265: ASH | K265: LAW | N265: BELL | Q265: MURPHY
A266: GOALKICKERS
A267: SANDRINGHAM | C267: ALLISTER 4 | F267: FISHER 3 | H267: ANDERSON 2 | K267: CARTWRIGHT 2 | N267: WEBER 2 | P267: MILLER | R267: MADDEN | U267: STAPLETON
A268: OAKLEIGH | C268: DOWLER 6 | F268: BELL 2 | H268: SMITH 2 | J268: MURPHY 2 | M268: MALONEY | O268: WILLIAMS | Q268: FISCHER | S268: LAW
A270: BRUNSWICK | C270: 7 | D270: 5 | E270: =C270*6+D270 -> 47 | G270: 8 | H270: 8 | I270: =G270*6+H270 -> 56 | K270: 14 | L270: 13 | M270: =K270*6+L270 -> 97 | O270: 15 | P270: 16 | Q270: =O270*6+P270 -> 106 | S270: PRESTON
A271: PRESTON | C271: 2 | D271: 1 | E271: =C271*6+D271 -> 13 | G271: 9 | H271: 4 | I271: =G271*6+H271 -> 58 | K271: 10 | L271: 4 | M271: =K271*6+L271 -> 64 | O271: 15 | P271: 8 | Q271: =O271*6+P271 -> 98 | S271: LESTER
A272: BEST PLAYERS
A273: BRUNSWICK | C273: QUINN | F273: DOWLING | I273: JONES | K273: BOYD | N273: CLARKE | Q273: CRAWFORD
A274: PRESTON | C274: DOWLING | F274: DUNHAM | I274: COLBAN | K274: BEAGLEY | N274: ROACH | Q274: ROBERTSON
A275: GOALKICKERS
A276: BRUNSWICK | C276: McGRATH 4 | F276: CRAWFORD 2 | I276: JONES 2 | K276: McINNES 2 | N276: DOWLING | P276: BOYD | R276: MCKAY | T276: FLETT | V276: CLARKE
A277: PRESTON | C277: LAWLER 4 | F277: WARR 3 | H277: MORRISON 3 | K277: WHITE 2 | M277: ROACH | O277: WATKINS | Q277: JOB
A279: PRAHRAN | C279: 1 | D279: 11 | E279: =C279*6+D279 -> 17 | G279: 9 | H279: 19 | I279: =G279*6+H279 -> 73 | K279: 11 | L279: 23 | M279: =K279*6+L279 -> 89 | O279: 22 | P279: 31 | Q279: =O279*6+P279 -> 163 | S279: TOORAK PARK
A280: YARRAVILLE | C280: 5 | D280: 2 | E280: =C280*6+D280 -> 32 | G280: 7 | H280: 4 | I280: =G280*6+H280 -> 46 | K280: 14 | L280: 8 | M280: =K280*6+L280 -> 92 | O280: 14 | P280: 9 | Q280: =O280*6+P280 -> 93 | S280: LEWIS
A281: BEST PLAYERS
A282: PRAHRAN | C282: WHITE | F282: FLEMING | I282: PEARCE | K282: THOMPSON | N282: PROBYN | Q282: ROBERTS
A283: YARRAVILLE | C283: HEFFERNAN | F283: EVANS | I283: KELLY | K283: STREETER | N283: HOPKINS | Q283: McLURE
A284: GOALKICKERS
A285: PRAHRAN | C285: HAWKINS 7 | F285: PROBYN 4 | I285: PEARCE 4 | K285: WHITE 2 | M285: DAVEY 2 | O285: GRAVELL | Q285: BRENCHLEY | T285: THOMPSON
A286: YARRAVILLE | C286: KELLY 3 | F286: SCHUTT 3 | I286: McGRATH 2 | L286: McLURE 2 | N286: REDPATH | P286: MATHESON | S286: KENNY | U286: HOPKINS
A288: ROUND 6 | E288: 20TH MAY | J288: WEATHER | M288: RAIN N.W. WIND | S288: PLAYED AT
D289: 1ST QTR | H289: 2ND QTR | L289: 3RD QTR | P289: FINAL | S289: CAMBERWELL
A290: PRAHRAN | C290: 5 | D290: 2 | E290: =C290*6+D290 -> 32 | G290: 9 | H290: 4 | I290: =G290*6+H290 -> 58 | K290: 11 | L290: 11 | M290: =K290*6+L290 -> 77 | O290: 14 | P290: 18 | Q290: =O290*6+P290 -> 102 | S290: UMPIRE | X290: LADDER | AB290: ROUND | AD290: 6
A291: CAMBERWELL | C291: 2 | D291: 3 | E291: =C291*6+D291 -> 15 | G291: 5 | H291: 7 | I291: =G291*6+H291 -> 37 | K291: 6 | L291: 11 | M291: =K291*6+L291 -> 47 | O291: 7 | P291: 16 | Q291: =O291*6+P291 -> 58 | S291: DWYER
A292: BEST PLAYERS | W292: TEAM | X292: W | Y292: L | Z292: D | AA292: FOR | AB292: AGST | AC292: % | AD292: PTS
A293: PRAHRAN | C293: F TAYLOR | F293: ROBERTS | I293: WHITE | K293: SMITH | N293: JOHNSON | Q293: GRAVELL
A294: CAMBERWELL | C294: RANDELL | F294: FITCHER | I294: NASH | K294: ANDERSON | N294: SEELENMEYER | Q294: LENNIE | W294: NORTHCOTE | X294: 5 | Y294: 1 | Z294: 0 | AA294: 639 | AB294: 421 | AC294: 151.78147268408551 | AD294: 20
A295: GOALKICKERS | W295: PRAHRAN | X295: 5 | Y295: 1 | Z295: 0 | AA295: 693 | AB295: 490 | AC295: 141.42857142857142 | AD295: 20
A296: PRAHRAN | C296: PEARCE 4 | E296: PROBYN 2 | G296: WHITE 2 | I296: HAWKINS 2 | L296: THOMPSON 2 | O296: BRENCHLEY | R296: FLEMING | W296: BRUNSWICK | X296: 5 | Y296: 1 | Z296: 0 | AA296: 618 | AB296: 489 | AC296: 126.38036809815951 | AD296: 20
A297: CAMBERWELL | C297: NASH 3 | E297: ANDERSON 2 | H297: HILLARD 2 | W297: CAMBERWELL | X297: 5 | Y297: 1 | Z297: 0 | AA297: 644 | AB297: 593 | AC297: 108.60033726812816 | AD297: 20
A299: WILLIAMSTOWN | C299: 4 | D299: 5 | E299: =C299*6+D299 -> 29 | G299: 7 | H299: 14 | I299: =G299*6+H299 -> 56 | K299: 11 | L299: 21 | M299: =K299*6+L299 -> 87 | O299: 14 | P299: 22 | Q299: =O299*6+P299 -> 106 | S299: WILLIAMSTOWN | W299: WILLIAMSTOWN | X299: 4 | Y299: 2 | Z299: 0 | AA299: 655 | AB299: 574 | AC299: 114.11149825783973 | AD299: 16
A300: SANDRINGHAM | C300: 3 | D300: 4 | E300: =C300*6+D300 -> 22 | G300: 7 | H300: 4 | I300: =G300*6+H300 -> 46 | K300: 8 | L300: 6 | M300: =K300*6+L300 -> 54 | O300: 12 | P300: 9 | Q300: =O300*6+P300 -> 81 | S300: GREGORY | W300: COBURG | X300: 4 | Y300: 2 | Z300: 0 | AA300: 686 | AB300: 626 | AC300: 109.58466453674122 | AD300: 16
A301: BEST PLAYERS | W301: SANDRINGHAM | X301: 3 | Y301: 3 | Z301: 0 | AA301: 699 | AB301: 663 | AC301: 105.42986425339366 | AD301: 12
A302: WILLIAMSTOWN | C302: McDONOUGH | F302: FITCH | I302: RICHARDSON | L302: VALLENCE | O302: THOMAS | Q302: CAVE | W302: BRIGHTON | X302: 2 | Y302: 4 | Z302: 0 | AA302: 618 | AB302: 629 | AC302: 98.251192368839426 | AD302: 8
A303: SANDRINGHAM | C303: FISHER | F303: MILLER | I303: PETTIONA | L303: FREY | O303: WITHERS | Q303: KENT | W303: PORT MELBOURNE | X303: 2 | Y303: 4 | Z303: 0 | AA303: 478 | AB303: 670 | AC303: 71.343283582089555 | AD303: 8
A304: GOALKICKERS | W304: YARRAVILLE | X304: 1 | Y304: 5 | Z304: 0 | AA304: 495 | AB304: 791 | AC304: 62.579013906447535 | AD304: 4
A305: WILLIAMSTOWN | C305: VALLENCE 6 | F305: THOMAS 3 | I305: PATERSON | K305: CHISHOLM | M305: LEATHER | O305: CAVE | Q305: RICHARDSON | W305: OAKLEIGH | X305: 0 | Y305: 6 | Z305: 0 | AA305: 543 | AB305: 675 | AC305: 80.444444444444443 | AD305: 0
A306: SANDRINGHAM | C306: FISHER 7 | F306: CARTWRIGHT 2 | J306: RYAN | L306: FREY | N306: S ANDERSON | W306: PRESTON | X306: 0 | Y306: 6 | Z306: 0 | AA306: 517 | AB306: 664 | AC306: 77.861445783132524 | AD306: 0
A308: BRUNSWICK | C308: 5 | D308: 4 | E308: =C308*6+D308 -> 34 | G308: 10 | H308: 6 | I308: =G308*6+H308 -> 66 | K308: 12 | L308: 9 | M308: =K308*6+L308 -> 81 | O308: 16 | P308: 11 | Q308: =O308*6+P308 -> 107 | S308: BRUNSWICK
A309: BRIGHTON | C309: 3 | D309: 5 | E309: =C309*6+D309 -> 23 | G309: 4 | H309: 11 | I309: =G309*6+H309 -> 35 | K309: 7 | L309: 20 | M309: =K309*6+L309 -> 62 | O309: 12 | P309: 25 | Q309: =O309*6+P309 -> 97 | S309: McALPINE
A310: BEST PLAYERS
A311: BRUNSWICK | C311: BOYD | E311: CLARKE | H311: COOPER | K311: JONES | N311: FLETT | P311: CHALLENGER
A312: BRIGHTON | C312: HONE | E312: PENNY | H312: HARTNETT | K312: BOLWELL | N312: GEORGE | P312: MORGAN
A313: GOALKICKERS
A314: BRUNSWICK | C314: JONES 6 | E314: FLETT 5 | G314: McGRATH 2 | J314: McKAY | L314: CRAWFORD | N314: BAILEY
A315: BRIGHTON | C315: JIM HALLAHAN 4 | G315: PENNY 2 | I315: HONE 2 | K315: MORGAN | M315: HENDER | O315: BUCKLEY | Q315: CONNELL
A317: COBURG | C317: 3 | D317: 6 | E317: =C317*6+D317 -> 24 | G317: 6 | H317: 11 | I317: =G317*6+H317 -> 47 | K317: 13 | L317: 15 | M317: =K317*6+L317 -> 93 | O317: 17 | P317: 18 | Q317: =O317*6+P317 -> 120 | S317: PORT MELBOURNE
A318: PORT MELBOURNE | C318: 5 | D318: 1 | E318: =C318*6+D318 -> 31 | G318: 9 | H318: 9 | I318: =G318*6+H318 -> 63 | K318: 11 | L318: 10 | M318: =K318*6+L318 -> 76 | O318: 13 | P318: 13 | Q318: =O318*6+P318 -> 91 | S318: HAYES
A319: BEST PLAYERS
A320: COBURG | C320: HALL | E320: WHITE | H320: BRAGG | K320: BERRIMAN | N320: JOHNSON | P320: PERRETT
A321: PORT MELBOURNE | C321: McBETH | E321: LAHIFF | H321: LA FANNUE | K321: FLETCHER | N321: ALSOP | P321: LEE
A322: GOALKICKERS
A323: COBURG | C323: BERRIMAN 4 | F323: COLLINS 3 | I323: BAMFORD 3 | L323: HALL 2 | N323: GILLON 2 | Q323: WHITE 2 | T323: JOHNSON
A324: PORT MELBOURNE | C324: LA FANNUE 6 | F324: FREYER 3 | I324: ALSOP | K324: REYNOLDS | N324: McBETH | P324: EASTMUIR
A326: YARRAVILLE | C326: 6 | D326: 2 | E326: =C326*6+D326 -> 38 | G326: 10 | H326: 5 | I326: =G326*6+H326 -> 65 | K326: 12 | L326: 12 | M326: =K326*6+L326 -> 84 | O326: 15 | P326: 21 | Q326: =O326*6+P326 -> 111 | S326: YARRAVILLE
A327: PRESTON | C327: 5 | D327: 6 | E327: =C327*6+D327 -> 36 | G327: 7 | H327: 9 | I327: =G327*6+H327 -> 51 | K327: 10 | L327: 11 | M327: =K327*6+L327 -> 71 | O327: 14 | P327: 11 | Q327: =O327*6+P327 -> 95 | S327: LEWIS
A328: BEST PLAYERS
A329: YARRAVILLE | C329: STREETER | F329: B ANDERSON | I329: McLURE | L329: ALSOP | O329: KELLY | Q329: EVANS
A330: PRESTON | C330: GRAY | F330: DOWLING | I330: DUNHAM | L330: MORRISON | O330: WARR | Q330: JOB
A331: GOALKICKERS
A332: YARRAVILLE | C332: McLURE 3 | F332: KELLY 3 | I332: ALSOP 3 | K332: McGRATH 3 | N332: CAMPBELL | Q332: HOPKINS | S332: PERUSSICH
A333: PRESTON | C333: LAWLER 5 | F333: WARR 4 | I333: MORRISON | L333: WATKINS | N333: JOB | P333: ROBERTSON
A335: NORTHCOTE | C335: 3 | D335: 4 | E335: =C335*6+D335 -> 22 | G335: 6 | H335: 10 | I335: =G335*6+H335 -> 46 | K335: 11 | L335: 13 | M335: =K335*6+L335 -> 79 | O335: 15 | P335: 23 | Q335: =O335*6+P335 -> 113 | S335: OAKLEIGH
A336: OAKLEIGH | C336: 4 | D336: 3 | E336: =C336*6+D336 -> 27 | G336: 8 | H336: 5 | I336: =G336*6+H336 -> 53 | K336: 11 | L336: 10 | M336: =K336*6+L336 -> 76 | O336: 13 | P336: 11 | Q336: =O336*6+P336 -> 89 | S336: MERRINGTON
A337: BEST PLAYERS
A338: NORTHCOTE | C338: WATT | E338: SMITH | H338: B HART | K338: NEWMAN | N338: MEITZCKE | Q338: LAMPRELL
A339: OAKLEIGH | C339: WILSON | E339: WILMOTT | H339: MURPHY | K339: CORP | N339: BELL | Q339: F HUTCHESON
A340: GOALKICKERS
A341: NORTHCOTE | C341: LAMPRELL 5 | F341: DOUGLAS 4 | I341: MEITZCKE 3 | L341: DOOLAN | N341: SIMPSON | P341: RUDDELL
A342: OAKLEIGH | C342: BELL 5 | F342: DOWLER 4 | I342: MALONEY 2 | L342: CLARKE | N342: ASH
A344: ROUND 7 | E344: 27TH MAY | J344: WEATHER | M344: FINE COOL | S344: PLAYED AT
D345: 1ST QTR | H345: 2ND QTR | L345: 3RD QTR | P345: FINAL | S345: NORTHCOTE
A346: NORTHCOTE | C346: 3 | D346: 4 | E346: =C346*6+D346 -> 22 | G346: 3 | H346: 11 | I346: =G346*6+H346 -> 29 | K346: 6 | L346: 12 | M346: =K346*6+L346 -> 48 | O346: 11 | P346: 13 | Q346: =O346*6+P346 -> 79 | S346: UMPIRE | X346: LADDER | AB346: ROUND | AD346: 7
A347: WILLIAMSTOWN | C347: 2 | D347: 3 | E347: =C347*6+D347 -> 15 | G347: 3 | H347: 7 | I347: =G347*6+H347 -> 25 | K347: 5 | L347: 13 | M347: =K347*6+L347 -> 43 | O347: 7 | P347: 19 | Q347: =O347*6+P347 -> 61 | S347: HAYES
A348: BEST PLAYERS | W348: TEAM | X348: W | Y348: L | Z348: D | AA348: FOR | AB348: AGST | AC348: % | AD348: PTS
A349: NORTHCOTE | C349: SIMPSON | F349: RUDDELL | I349: DRYDEN | L349: E HART | N349: MEITZCKE | Q349: ERFURTH
A350: WILLIAMSTOWN | C350: PATERSON | F350: WILCOX | I350: CUTTING | L350: OGDEN | N350: CAVE | Q350: LEATHER | W350: PRAHRAN | X350: 6 | Y350: 1 | Z350: 0 | AA350: 851 | AB350: 568 | AC350: 149.82394366197184 | AD350: 24
A351: GOALKICKERS | W351: NORTHCOTE | X351: 6 | Y351: 1 | Z351: 0 | AA351: 718 | AB351: 482 | AC351: 148.96265560165975 | AD351: 24
A352: NORTHCOTE | C352: MEITZCKE 3 | F352: ERFURTH 3 | I352: SIMPSON 2 | L352: LAMPRELL | N352: ARCHER | P352: RUSH | W352: BRUNSWICK | X352: 6 | Y352: 1 | Z352: 0 | AA352: 721 | AB352: 564 | AC352: 127.83687943262412 | AD352: 24
A353: WILLIAMSTOWN | C353: VALLENCE 3 | F353: PATERSON 2 | I353: JAMIESON | L353: CHISHOLM | W353: COBURG | X353: 5 | Y353: 2 | Z353: 0 | AA353: 787 | AB353: 702 | AC353: 112.10826210826211 | AD353: 20
A355: COBURG | C355: 3 | D355: 7 | E355: =C355*6+D355 -> 25 | G355: 6 | H355: 11 | I355: =G355*6+H355 -> 47 | K355: 10 | L355: 19 | M355: =K355*6+L355 -> 79 | O355: 13 | P355: 23 | Q355: =O355*6+P355 -> 101 | S355: BEACH ROAD | W355: CAMBERWELL | X355: 5 | Y355: 2 | Z355: 0 | AA355: 708 | AB355: 685 | AC355: 103.35766423357664 | AD355: 20
A356: SANDRINGHAM | C356: 5 | D356: 3 | E356: =C356*6+D356 -> 33 | G356: 7 | H356: 8 | I356: =G356*6+H356 -> 50 | K356: 8 | L356: 10 | M356: =K356*6+L356 -> 58 | O356: 10 | P356: 16 | Q356: =O356*6+P356 -> 76 | S356: DWYER | W356: WILLIAMSTOWN | X356: 4 | Y356: 3 | Z356: 0 | AA356: 716 | AB356: 653 | AC356: 109.64777947932619 | AD356: 16
A357: BEST PLAYERS | W357: BRIGHTON | X357: 3 | Y357: 4 | Z357: 0 | AA357: 766 | AB357: 722 | AC357: 106.09418282548476 | AD357: 12
A358: COBURG | C358: JORDAN | F358: COLLINS | I358: LA FRANCHI | L358: WHITFIELD | O358: RE | R358: SCRIVEN | W358: SANDRINGHAM | X358: 3 | Y358: 4 | Z358: 0 | AA358: 775 | AB358: 764 | AC358: 101.43979057591623 | AD358: 12
A359: SANDRINGHAM | C359: SAUNDERS | F359: ALLISTER | I359: SMITH | L359: CARTWRIGHT | O359: STAPLETON | R359: MITCHELL | W359: PORT MELBOURNE | X359: 2 | Y359: 5 | Z359: 0 | AA359: 553 | AB359: 773 | AC359: 71.539456662354468 | AD359: 8
A360: GOALKICKERS | W360: PRESTON | X360: 1 | Y360: 6 | Z360: 0 | AA360: 609 | AB360: 728 | AC360: 83.65384615384616 | AD360: 4
A361: COBURG | C361: COLLINS 6 | F361: WHITFIELD 2 | I361: JOHNSON 2 | L361: GILLON 2 | N361: HALL | W361: YARRAVILLE | X361: 1 | Y361: 6 | Z361: 0 | AA361: 588 | AB361: 939 | AC361: 62.619808306709267 | AD361: 4
A362: SANDRINGHAM | C362: FISHER 4 | F362: CARTWRIGHT 2 | J362: WEBER | L362: ALLISTER | N362: RILEY | P362: ANDERSON | W362: OAKLEIGH | X362: 0 | Y362: 7 | Z362: 0 | AA362: 621 | AB362: 833 | AC362: 74.549819927971186 | AD362: 0
A364: BRUNSWICK | C364: 4 | D364: 6 | E364: =C364*6+D364 -> 30 | G364: 9 | H364: 8 | I364: =G364*6+H364 -> 62 | K364: 11 | L364: 15 | M364: =K364*6+L364 -> 81 | O364: 14 | P364: 19 | Q364: =O364*6+P364 -> 103 | S364: BRUNSWICK
A365: PORT MELBOURNE | C365: 2 | D365: 1 | E365: =C365*6+D365 -> 13 | G365: 4 | H365: 4 | I365: =G365*6+H365 -> 28 | K365: 8 | L365: 6 | M365: =K365*6+L365 -> 54 | O365: 11 | P365: 9 | Q365: =O365*6+P365 -> 75 | S365: LEWIS
A366: BEST PLAYERS
A367: BRUNSWICK | C367: MCKAY | E367: CRAWFORD | H367: QUINN | K367: McKERNAN | N367: FLETT | Q367: POWELL
A368: PORT MELBOURNE | C368: DOBSON | E368: FREYER | H368: JULIER | K368: RICHES | N368: FLETCHER | Q368: LAHIFF
A369: GOALKICKERS
A370: BRUNSWICK | C370: JONES 3 | F370: CRAWFORD 3 | I370: HOBBA 2 | K370: McKAY 2 | M370: QUINN | O370: BOYD | Q370: McGRATH | T370: POWELL
A371: PORT MELBOURNE | C371: FREYER 8 | F371: LA FANNUE | I371: GOSS | K371: McBETH
A373: BRIGHTON | C373: 7 | D373: 10 | E373: =C373*6+D373 -> 52 | G373: 9 | H373: 14 | I373: =G373*6+H373 -> 68 | K373: 17 | L373: 22 | M373: =K373*6+L373 -> 124 | O373: 21 | P373: 22 | Q373: =O373*6+P373 -> 148 | S373: ELSTERNWICK PARK
A374: YARRAVILLE | C374: 1 | D374: 1 | E374: =C374*6+D374 -> 7 | G374: 7 | H374: 10 | I374: =G374*6+H374 -> 52 | K374: 9 | L374: 13 | M374: =K374*6+L374 -> 67 | O374: 12 | P374: 21 | Q374: =O374*6+P374 -> 93 | S374: GREGORY
A375: BEST PLAYERS
A376: BRIGHTON | C376: HARTNETT | F376: HENDER | I376: HONE | L376: PENNY | O376: HINDSON | Q376: HALL
A377: YARRAVILLE | C377: ALSOP | F377: MATHESON | I377: McGRATH | L377: STREETER | O377: SMITH | Q377: BONIFACE
A378: GOALKICKERS
A379: BRIGHTON | C379: HENDER 5 | F379: HARTNETT 3 | I379: PENNY 2 | K379: HONE 2 | M379: DEANE 2 | O379: CONNELL 2 | R379: HALLAHAN 2 | V379: MORGAN 2 | X379: ELLIS
A380: YARRAVILLE | C380: MATHESON 4 | F380: McGRATH 3 | I380: ALSOP 2 | K380: CAMPBELL | M380: KENNY | O380: HOPKINS
A382: PRESTON | C382: 4 | D382: 4 | E382: =C382*6+D382 -> 28 | G382: 6 | H382: 5 | I382: =G382*6+H382 -> 41 | K382: 12 | L382: 7 | M382: =K382*6+L382 -> 79 | O382: 14 | P382: 8 | Q382: =O382*6+P382 -> 92 | S382: PRESTON
A383: CAMBERWELL | C383: 0 | D383: 1 | E383: =C383*6+D383 -> 1 | G383: 3 | H383: 8 | I383: =G383*6+H383 -> 26 | K383: 5 | L383: 11 | M383: =K383*6+L383 -> 41 | O383: 8 | P383: 16 | Q383: =O383*6+P383 -> 64 | S383: MERRINGTON
A384: BEST PLAYERS
A385: PRESTON | C385: WATKINS | F385: DOWLING | I385: LAWLER | L385: MILLER | O385: CLARKE | R385: SLEITH
A386: CAMBERWELL | C386: SEELENMEYER | F386: LENNIE | I386: HORKINGS | L386: CLAMP | O386: HILLARD | R386: NASH
A387: GOALKICKERS
A388: PRESTON | C388: LAWLER 5 | F388: WARR 3 | I388: MURRAY 2 | L388: ROSS 2 | N388: SEEDSMAN | Q388: BEAUMONT
A389: CAMBERWELL | C389: POOLE 2 | F389: HILLARD 2 | I389: CLAMP 2 | L389: NASH 2
A391: PRAHRAN | C391: 3 | D391: 3 | E391: =C391*6+D391 -> 21 | G391: 11 | H391: 7 | I391: =G391*6+H391 -> 73 | K391: 16 | L391: 10 | M391: =K391*6+L391 -> 106 | O391: 24 | P391: 14 | Q391: =O391*6+P391 -> 158 | S391: TOORAK PARK
A392: OAKLEIGH | C392: 6 | D392: 4 | E392: =C392*6+D392 -> 40 | G392: 6 | H392: 6 | I392: =G392*6+H392 -> 42 | K392: 10 | L392: 8 | M392: =K392*6+L392 -> 68 | O392: 11 | P392: 12 | Q392: =O392*6+P392 -> 78 | S392: PARRIS
A393: BEST PLAYERS
A394: PRAHRAN | C394: WHITE | F394: FLEMING | I394: THOMPSON | L394: GRAVELL | O394: JOHNSON | R394: BRENCHLEY
A395: OAKLEIGH | C395: F HUTCHESON | F395: WILTSHIRE | I395: MALONEY | L395: ASH | O395: WILLIAMS | R395: EVANS
A396: GOALKICKERS
A397: PRAHRAN | C397: HAWKINS 12 | F397: GRAVELL 4 | I397: WHITE 3 | K397: BRENCHLEY 2 | N397: THOMPSON | Q397: DAVEY | S397: PROBYN
A398: OAKLEIGH | C398: BELL 4 | F398: DOWLER 3 | I398: EVANS | K398: MALONEY | N398: CLARKE | P398: LANNING
A400: ROUND 8 | E400: 3RD JUNE | J400: WEATHER | M400: SHOWERS NORTH BREEZE | S400: PLAYED AT
D401: 1ST QTR | H401: 2ND QTR | L401: 3RD QTR | P401: FINAL | S401: COBURG
A402: NORTHCOTE | C402: 2 | D402: 3 | E402: =C402*6+D402 -> 15 | G402: 5 | H402: 9 | I402: =G402*6+H402 -> 39 | K402: 9 | L402: 14 | M402: =K402*6+L402 -> 68 | O402: 13 | P402: 16 | Q402: =O402*6+P402 -> 94 | S402: UMPIRE | X402: LADDER | AB402: ROUND | AD402: 8
A403: COBURG | C403: 2 | D403: 4 | E403: =C403*6+D403 -> 16 | G403: 6 | H403: 6 | I403: =G403*6+H403 -> 42 | K403: 9 | L403: 9 | M403: =K403*6+L403 -> 63 | O403: 9 | P403: 12 | Q403: =O403*6+P403 -> 66 | S403: HAYES
A404: BEST PLAYERS | W404: TEAM | X404: W | Y404: L | Z404: D | AA404: FOR | AB404: AGST | AC404: % | AD404: PTS
A405: NORTHCOTE | C405: SIMPSON | F405: RUDDELL | I405: MEITZCKE | L405: McINERNEY | O405: E HART | Q405: DRYDEN
A406: COBURG | C406: JOHNSON | F406: COLLINS | I406: RE | L406: MUNDAY | O406: PERRETT | Q406: YOUNG | W406: PRAHRAN | X406: 7 | Y406: 1 | Z406: 0 | AA406: 952 | AB406: 642 | AC406: 148.28660436137071 | AD406: 28
A407: GOALKICKERS | W407: NORTHCOTE | X407: 7 | Y407: 1 | Z407: 0 | AA407: 812 | AB407: 548 | AC407: 148.17518248175182 | AD407: 28
A408: NORTHCOTE | C408: LAMPRELL 4 | F408: SIMPSON 4 | I408: MEITZCKE 3 | L408: RUSH | N408: HOSKING | W408: BRUNSWICK | X408: 7 | Y408: 1 | Z408: 0 | AA408: 799 | AB408: 626 | AC408: 127.63578274760384 | AD408: 28
A409: COBURG | C409: COLLINS 5 | F409: GILLON 3 | I409: SCRIVEN | W409: CAMBERWELL | X409: 6 | Y409: 2 | Z409: 0 | AA409: 840 | AB409: 785 | AC409: 107.00636942675159 | AD409: 24
A411: PRAHRAN | C411: 1 | D411: 2 | E411: =C411*6+D411 -> 8 | G411: 7 | H411: 14 | I411: =G411*6+H411 -> 56 | K411: 9 | L411: 14 | M411: =K411*6+L411 -> 68 | O411: 14 | P411: 17 | Q411: =O411*6+P411 -> 101 | S411: WILLIAMSTOWN | W411: COBURG | X411: 5 | Y411: 3 | Z411: 0 | AA411: 853 | AB411: 796 | AC411: 107.1608040201005 | AD411: 20
A412: WILLIAMSTOWN | C412: 5 | D412: 7 | E412: =C412*6+D412 -> 37 | G412: 5 | H412: 12 | I412: =G412*6+H412 -> 42 | K412: 7 | L412: 23 | M412: =K412*6+L412 -> 65 | O412: 8 | P412: 26 | Q412: =O412*6+P412 -> 74 | S412: MILLER | W412: WILLIAMSTOWN | X412: 4 | Y412: 4 | Z412: 0 | AA412: 790 | AB412: 754 | AC412: 104.77453580901857 | AD412: 16
A413: BEST PLAYERS | W413: BRIGHTON | X413: 3 | Y413: 5 | Z413: 0 | AA413: 866 | AB413: 854 | AC413: 101.40515222482436 | AD413: 12
A414: PRAHRAN | C414: HAWKINS | F414: ROBERTS | I414: FAUL | L414: FLEMING | O414: WHITE | Q414: THOMPSON | W414: SANDRINGHAM | X414: 3 | Y414: 5 | Z414: 0 | AA414: 868 | AB414: 867 | AC414: 100.11534025374856 | AD414: 12
A415: WILLIAMSTOWN | C415: WILCOX | F415: RAE | I415: PATERSON | L415: GLASS | O415: CUTTING | Q415: OGDEN | W415: PORT MELBOURNE | X415: 3 | Y415: 5 | Z415: 0 | AA415: 656 | AB415: 866 | AC415: 75.750577367205537 | AD415: 12
A416: GOALKICKERS | W416: PRESTON | X416: 2 | Y416: 6 | Z416: 0 | AA416: 705 | AB416: 818 | AC416: 86.185819070904643 | AD416: 8
A417: PRAHRAN | C417: HAWKINS 7 | F417: DAVEY 2 | I417: PROBYN 2 | L417: GRAVELL | N417: FLEMING | P417: WHITE | W417: YARRAVILLE | X417: 1 | Y417: 7 | Z417: 0 | AA417: 650 | AB417: 1017 | AC417: 63.913470993117009 | AD417: 4
A418: WILLIAMSTOWN | C418: RAE 5 | F418: PATERSON 2 | I418: THOMAS | W418: OAKLEIGH | X418: 0 | Y418: 8 | Z418: 0 | AA418: 711 | AB418: 929 | AC418: 76.533907427341234 | AD418: 0
A420: CAMBERWELL | C420: 3 | D420: 7 | E420: =C420*6+D420 -> 25 | G420: 8 | H420: 15 | I420: =G420*6+H420 -> 63 | K420: 12 | L420: 26 | M420: =K420*6+L420 -> 98 | O420: 17 | P420: 30 | Q420: =O420*6+P420 -> 132 | S420: CAMBERWELL
A421: BRIGHTON | C421: 3 | D421: 4 | E421: =C421*6+D421 -> 22 | G421: 8 | H421: 8 | I421: =G421*6+H421 -> 56 | K421: 11 | L421: 12 | M421: =K421*6+L421 -> 78 | O421: 14 | P421: 16 | Q421: =O421*6+P421 -> 100 | S421: DWYER
A422: BEST PLAYERS
A423: CAMBERWELL | C423: SEELENMEYER | F423: LENNIE | I423: RANDALL | L423: HORKINGS | O423: BRETT | Q423: NASH
A424: BRIGHTON | C424: HALLAHAN | F424: ALVIN | I424: PENNY | L424: CONNELL | O424: GODFREY | Q424: WILLIAMSON
A425: GOALKICKERS
A426: CAMBERWELL | C426: HILLARD 5 | F426: POOLE 5 | I426: NASH 3 | K426: ANDERSON 2 | N426: RANDALL | Q426: FITCHER
A427: BRIGHTON | C427: HALLAHAN 7 | F427: PENNY 3 | H427: CONNELL 2 | K427: HARVEY | M427: BOLWELL
A429: PORT MELBOURNE | C429: 2 | D429: 3 | E429: =C429*6+D429 -> 15 | G429: 6 | H429: 8 | I429: =G429*6+H429 -> 44 | K429: 8 | L429: 13 | M429: =K429*6+L429 -> 61 | O429: 14 | P429: 19 | Q429: =O429*6+P429 -> 103 | S429: PORT MELBOURNE
A430: SANDRINGHAM | C430: 4 | D430: 3 | E430: =C430*6+D430 -> 27 | G430: 7 | H430: 11 | I430: =G430*6+H430 -> 53 | K430: 9 | L430: 16 | M430: =K430*6+L430 -> 70 | O430: 12 | P430: 21 | Q430: =O430*6+P430 -> 93 | S430: LEWIS
A431: BEST PLAYERS
A432: PORT MELBOURNE | C432: WOODS | F432: DOBSON | I432: FLETCHER | L432: GOLDSMITH | O432: LA FANNUE | R432: LAHIFF
A433: SANDRINGHAM | C433: STAPLETON | F433: WITHERS | I433: CARTWRIGHT | L433: TORPY | O433: FREY | R433: SMITH
A434: GOALKICKERS
A435: PORT MELBOURNE | C435: FREYER 5 | F435: LA FANNUE 5 | I435: FLETCHER 2 | L435: JEFFERS | N435: CULLEN
A436: SANDRINGHAM | C436: ANDERSON 2 | F436: FISHER 2 | H436: RYAN 2 | J436: SMITH 2 | L436: KENT | N436: CARTWRIGHT | Q436: WEBER | S436: ALLISTER
A438: PRESTON | C438: 3 | D438: 1 | E438: =C438*6+D438 -> 19 | G438: 7 | H438: 5 | I438: =G438*6+H438 -> 47 | K438: 12 | L438: 9 | M438: =K438*6+L438 -> 81 | O438: 14 | P438: 12 | Q438: =O438*6+P438 -> 96 | S438: OAKLEIGH
A439: OAKLEIGH | C439: 3 | D439: 6 | E439: =C439*6+D439 -> 24 | G439: 5 | H439: 9 | I439: =G439*6+H439 -> 39 | K439: 9 | L439: 13 | M439: =K439*6+L439 -> 67 | O439: 12 | P439: 18 | Q439: =O439*6+P439 -> 90 | S439: MERRINGTON
A440: BEST PLAYERS
A441: PRESTON | C441: MORRISON | F441: GRAY | I441: ROSS | L441: SLEITH | O441: WARR | R441: SEEDSMAN
A442: OAKLEIGH | C442: MURPHY | F442: F HUTCHESON | I442: WILSON | L442: WILLIAMS | O442: WILMOTT | R442: N HUTCHESON
A443: GOALKICKERS
A444: PRESTON | C444: ROSS 4 | E444: WARR 2 | G444: LAWLER 2 | J444: JOB 2 | L444: NORMAN | N444: STEWART | Q444: MILLER | S444: SEEDSMAN
A445: OAKLEIGH | C445: NOLAN 4 | E445: DOWLER 4 | G445: MURPHY 2 | J445: SMITH | L445: FISHER | N445: BELL | P445: BEARD
A447: BRUNSWICK | C447: 1 | D447: 5 | E447: =C447*6+D447 -> 11 | G447: 3 | H447: 12 | I447: =G447*6+H447 -> 30 | K447: 6 | L447: 14 | M447: =K447*6+L447 -> 50 | O447: 10 | P447: 18 | Q447: =O447*6+P447 -> 78 | S447: YARRAVILLE
A448: YARRAVILLE | C448: 2 | D448: 3 | E448: =C448*6+D448 -> 15 | G448: 4 | H448: 4 | I448: =G448*6+H448 -> 28 | K448: 7 | L448: 7 | M448: =K448*6+L448 -> 49 | O448: 9 | P448: 8 | Q448: =O448*6+P448 -> 62 | S448: GREGORY
A449: BEST PLAYERS
A450: BRUNSWICK | C450: BAILEY | F450: McKERNAN | I450: QUINN | L450: FAY | O450: CRAWFORD | R450: McKAY
A451: YARRAVILLE | C451: STREETER | F451: KELLY | I451: GREEN | L451: McLURE | O451: HOPKINS | R451: BONIFACE
A452: GOALKICKERS
A453: BRUNSWICK | C453: JONES 3 | E453: CRAWFORD 3 | H453: HOBBA | J453: FLETT | L453: BOYD | N453: McGRATH | Q453: POWELL
A454: YARRAVILLE | C454: LUKE 4 | E454: HOPKINS 2 | H454: McLURE | J454: WEDGWOOD | M454: PERUSSICH
A456: ROUND 9 | E456: 10TH JUNE | J456: WEATHER | M456: CLOUDY BUT FINE S.W. BREEZE | S456: PLAYED AT
D457: 1ST QTR | H457: 2ND QTR | L457: 3RD QTR | P457: FINAL | S457: BRUNSWICK
A458: BRUNSWICK | C458: 5 | D458: 2 | E458: =C458*6+D458 -> 32 | G458: 9 | H458: 8 | I458: =G458*6+H458 -> 62 | K458: 11 | L458: 12 | M458: =K458*6+L458 -> 78 | O458: 14 | P458: 15 | Q458: =O458*6+P458 -> 99 | S458: UMPIRE | X458: LADDER | AB458: ROUND | AD458: 9
A459: CAMBERWELL | C459: 0 | D459: 1 | E459: =C459*6+D459 -> 1 | G459: 2 | H459: 4 | I459: =G459*6+H459 -> 16 | K459: 5 | L459: 9 | M459: =K459*6+L459 -> 39 | O459: 8 | P459: 15 | Q459: =O459*6+P459 -> 63 | S459: LESTER
A460: BEST PLAYERS | W460: TEAM | X460: W | Y460: L | Z460: D | AA460: FOR | AB460: AGST | AC460: % | AD460: PTS
A461: BRUNSWICK | C461: JONES | F461: McGRATH | I461: BAILEY | L461: QUINN | O461: FAY | Q461: CRAWFORD
A462: CAMBERWELL | C462: RANDALL | F462: TOOHEY | I462: ANDERSON | L462: FORD | O462: BRETT | Q462: FITCHER | W462: PRAHRAN | X462: 8 | Y462: 1 | Z462: 0 | AA462: 1056 | AB462: 743 | AC462: 142.12651413189772 | AD462: 32
A463: GOALKICKERS | W463: BRUNSWICK | X463: 8 | Y463: 1 | Z463: 0 | AA463: 898 | AB463: 689 | AC463: 130.33381712626996 | AD463: 32
A464: BRUNSWICK | C464: JONES 8 | F464: FITZGIBBON 2 | I464: POWELL | K464: McGRATH | M464: CRAWFORD | P464: FLETT | W464: NORTHCOTE | X464: 7 | Y464: 2 | Z464: 0 | AA464: 890 | AB464: 644 | AC464: 138.19875776397515 | AD464: 28
A465: CAMBERWELL | C465: NASH 3 | F465: ANDERSON 2 | I465: FORD | K465: FITCHER | M465: SEELENMEYER | W465: CAMBERWELL | X465: 6 | Y465: 3 | Z465: 0 | AA465: 903 | AB465: 884 | AC465: 102.14932126696833 | AD465: 24
A467: YARRAVILLE | C467: 3 | D467: 3 | E467: =C467*6+D467 -> 21 | G467: 6 | H467: 12 | I467: =G467*6+H467 -> 48 | K467: 11 | L467: 13 | M467: =K467*6+L467 -> 79 | O467: 15 | P467: 16 | Q467: =O467*6+P467 -> 106 | S467: YARRAVILLE | W467: WILLIAMSTOWN | X467: 5 | Y467: 4 | Z467: 0 | AA467: 915 | AB467: 844 | AC467: 108.41232227488152 | AD467: 20
A468: PORT MELBOURNE | C468: 4 | D468: 2 | E468: =C468*6+D468 -> 26 | G468: 5 | H468: 3 | I468: =G468*6+H468 -> 33 | K468: 9 | L468: 6 | M468: =K468*6+L468 -> 60 | O468: 13 | P468: 6 | Q468: =O468*6+P468 -> 84 | S468: GREGORY | W468: COBURG | X468: 5 | Y468: 4 | Z468: 0 | AA468: 954 | AB468: 900 | AC468: 106 | AD468: 20
A469: BEST PLAYERS | W469: BRIGHTON | X469: 4 | Y469: 5 | Z469: 0 | AA469: 1003 | AB469: 956 | AC469: 104.9163179916318 | AD469: 16
A470: YARRAVILLE | C470: HOPKINS | F470: McLURE | I470: EVANS | L470: ALSOP | O470: SMITH | Q470: KELLY | W470: SANDRINGHAM | X470: 4 | Y470: 5 | Z470: 0 | AA470: 964 | AB470: 945 | AC470: 102.01058201058201 | AD470: 16
A471: PORT MELBOURNE | C471: DOBSON | F471: CULLEN | I471: JULIER | L471: JEFFERS | O471: HAYES | Q471: LEE | W471: PORT MELBOURNE | X471: 3 | Y471: 6 | Z471: 0 | AA471: 740 | AB471: 972 | AC471: 76.13168724279835 | AD471: 12
A472: GOALKICKERS | W472: PRESTON | X472: 2 | Y472: 7 | Z472: 0 | AA472: 795 | AB472: 943 | AC472: 84.305408271474022 | AD472: 8
A473: YARRAVILLE | C473: LUKE 4 | E473: ALSOP 3 | G473: WEDGWOOD 2 | J473: EVANS 2 | L473: McGRATH 2 | O473: McLURE | Q473: HOPKINS | W473: YARRAVILLE | X473: 2 | Y473: 7 | Z473: 0 | AA473: 756 | AB473: 1101 | AC473: 68.664850136239778 | AD473: 8
A474: PORT MELBOURNE | C474: FREYER 3 | E474: LA FANNUE 3 | H474: GOLDSMITH 2 | K474: CULLEN 2 | M474: BLOOMER | O474: JONES | Q474: LEE | W474: OAKLEIGH | X474: 0 | Y474: 9 | Z474: 0 | AA474: 813 | AB474: 1066 | AC474: 76.266416510318948 | AD474: 0
A476: WILLIAMSTOWN | C476: 4 | D476: 4 | E476: =C476*6+D476 -> 28 | G476: 10 | H476: 11 | I476: =G476*6+H476 -> 71 | K476: 14 | L476: 14 | M476: =K476*6+L476 -> 98 | O476: 18 | P476: 17 | Q476: =O476*6+P476 -> 125 | S476: PRESTON
A477: PRESTON | C477: 5 | D477: 0 | E477: =C477*6+D477 -> 30 | G477: 9 | H477: 3 | I477: =G477*6+H477 -> 57 | K477: 11 | L477: 4 | M477: =K477*6+L477 -> 70 | O477: 14 | P477: 6 | Q477: =O477*6+P477 -> 90 | S477: APPLEBY
A478: BEST PLAYERS
A479: WILLIAMSTOWN | C479: CUTTING | F479: VALLENCE | I479: PATERSON | L479: WILCOX | O479: CAVE | Q479: McDONOUGH
A480: PRESTON | C480: DUNSTONE | F480: LOWENTHAL | I480: ROSS | L480: MORRISON | O480: GRAY | Q480: DOWLING
A481: GOALKICKERS
A482: WILLIAMSTOWN | C482: VALLENCE 7 | F482: JAMIESON 3 | I482: FAIRBAIRN 3 | L482: GLASS 2 | N482: THOMAS | P482: PATERSON | R482: METHVEN
A483: PRESTON | C483: LAWLER 4 | F483: DUNSTONE 3 | I483: ROSS 3 | K483: MORRISON 2 | N483: ROACH | P483: WATKINS
E484: 12TH JUNE | J484: WEATHER | M484: FINE NORTH BREEZE
A485: PRAHRAN | C485: 1 | D485: 1 | E485: =C485*6+D485 -> 7 | G485: 8 | H485: 7 | I485: =G485*6+H485 -> 55 | K485: 12 | L485: 9 | M485: =K485*6+L485 -> 81 | O485: 15 | P485: 14 | Q485: =O485*6+P485 -> 104 | S485: TOORAK PARK
A486: COBURG | C486: 6 | D486: 6 | E486: =C486*6+D486 -> 42 | G486: 9 | H486: 7 | I486: =G486*6+H486 -> 61 | K486: 12 | L486: 9 | M486: =K486*6+L486 -> 81 | O486: 15 | P486: 11 | Q486: =O486*6+P486 -> 101 | S486: MERRINGTON
A487: BEST PLAYERS
A488: PRAHRAN | C488: WHITE | F488: FAUL | I488: FLEMING | L488: DAVEY | O488: HAWKINS | R488: F SMITH
A489: COBURG | C489: WHITFIELD | F489: BRAGG | I489: JOHNSON | L489: COLLINS | O489: LA FRANCHI | R489: SCRIVEN
A490: GOALKICKERS
A491: PRAHRAN | C491: HAWKINS 4 | F491: WHITE 4 | I491: GRAVELL 2 | L491: THOMPSON 2 | O491: PEARCE | Q491: BRENCHLEY | T491: DAVEY
A492: COBURG | C492: COLLINS 5 | F492: SCRIVEN 3 | I492: LA FRANCHI | L492: PERRETT | N492: WHITE | P492: JOHNSON | R492: MUNDAY | U492: BERRIMAN | X492: GILLON
A494: SANDRINGHAM | C494: 3 | D494: 3 | E494: =C494*6+D494 -> 21 | G494: 9 | H494: 7 | I494: =G494*6+H494 -> 61 | K494: 11 | L494: 8 | M494: =K494*6+L494 -> 74 | O494: 14 | P494: 12 | Q494: =O494*6+P494 -> 96 | S494: NORTHCOTE
A495: NORTHCOTE | C495: 6 | D495: 1 | E495: =C495*6+D495 -> 37 | G495: 7 | H495: 4 | I495: =G495*6+H495 -> 46 | K495: 9 | L495: 6 | M495: =K495*6+L495 -> 60 | O495: 12 | P495: 6 | Q495: =O495*6+P495 -> 78 | S495: PARRIS
A496: BEST PLAYERS
A497: SANDRINGHAM | C497: MITCHELL | F497: ANDERSON | I497: ALLISTER | L497: CARTWRIGHT | P497: LUDLOW | S497: SMITH
A498: NORTHCOTE | C498: HOSKING | F498: HOLDEN | I498: HISCOX | L498: RUDDELL | P498: E HART | S498: B HART
A499: GOALKICKERS
A500: SANDRINGHAM | C500: ANDERSON 5 | F500: POGUE 4 | I500: ALLISTER 3 | L500: RYAN | N500: KENT
A501: NORTHCOTE | C501: LAMPRELL 2 | F501: ARCHER 2 | I501: ACKLAND 2 | L501: SIMPSON 2 | N501: ERFURTH 2 | Q501: HISCOX | S501: MEITZCKE
A503: BRIGHTON | C503: 4 | D503: 7 | E503: =C503*6+D503 -> 31 | G503: 8 | H503: 12 | I503: =G503*6+H503 -> 60 | K503: 13 | L503: 19 | M503: =K503*6+L503 -> 97 | O503: 18 | P503: 29 | Q503: =O503*6+P503 -> 137 | S503: NORTHCOTE
A504: OAKLEIGH | C504: 3 | D504: 6 | E504: =C504*6+D504 -> 24 | G504: 8 | H504: 9 | I504: =G504*6+H504 -> 57 | K504: 12 | L504: 11 | M504: =K504*6+L504 -> 83 | O504: 15 | P504: 12 | Q504: =O504*6+P504 -> 102 | S504: HAYES
A505: BEST PLAYERS
A506: BRIGHTON | C506: DAVIS | E506: HALLAHAN | H506: DEANE | K506: WILLIAMSON | O506: WEBER | R506: PENNY
A507: OAKLEIGH | C507: WILLS | E507: DOWLER | H507: LANNING | K507: MURPHY | O507: F HUTCHESON | R507: N HUTCHESON
A508: GOALKICKERS
A509: BRIGHTON | C509: HALLAHAN 5 | F509: BIRD 3 | H509: WEBER 3 | J509: DEANE 3 | L509: HONE 2 | N509: CONNELL | P509: PENNY
A510: OAKLEIGH | C510: NOLAN 4 | E510: DOWLER 4 | H510: WILSON 2 | J510: FISCHER 2 | M510: MALONEY | O510: MURPHY | Q510: BELL
A512: ROUND 10 | E512: 17TH JUNE | H512: WEATHER | K512: VERY COLD (37') CLOUDY NORTH BREEZE | S512: PLAYED AT
D513: 1ST QTR | H513: 2ND QTR | L513: 3RD QTR | P513: FINAL | S513: WILLIAMSTOWN
A514: WILLIAMSTOWN | C514: 4 | D514: 5 | E514: =C514*6+D514 -> 29 | G514: 9 | H514: 12 | I514: =G514*6+H514 -> 66 | K514: 12 | L514: 17 | M514: =K514*6+L514 -> 89 | O514: 17 | P514: 19 | Q514: =O514*6+P514 -> 121 | S514: UMPIRE | X514: LADDER | AB514: ROUND | AD514: 10
A515: BRIGHTON | C515: 1 | D515: 4 | E515: =C515*6+D515 -> 10 | G515: 2 | H515: 8 | I515: =G515*6+H515 -> 20 | K515: 5 | L515: 15 | M515: =K515*6+L515 -> 45 | O515: 12 | P515: 18 | Q515: =O515*6+P515 -> 90 | S515: LESTER
A516: BEST PLAYERS | W516: TEAM | X516: W | Y516: L | Z516: D | AA516: FOR | AB516: AGST | AC516: % | AD516: PTS
A517: WILLIAMSTOWN | C517: VALLENCE | F517: McTAGGART | I517: THOMAS | L517: CUTTING | O517: McDONOUGH | R517: QUINN
A518: BRIGHTON | C518: DAVIS | F518: CONNELL | I518: GEORGE | L518: WILLIAMSON | O518: JIM HALLAHAN | R518: BIRD | W518: BRUNSWICK | X518: 9 | Y518: 1 | Z518: 0 | AA518: 1099 | AB518: 812 | AC518: 135.34482758620689 | AD518: 36
A519: GOALKICKERS | W519: PRAHRAN | X519: 8 | Y519: 2 | Z519: 0 | AA519: 1138 | AB519: 874 | AC519: 130.20594965675056 | AD519: 32
A520: WILLIAMSTOWN | C520: VALLENCE 7 | F520: JAMIESON 4 | I520: PATERSON 3 | L520: McTAGGART | O520: QUINN | Q520: THOMAS | W520: NORTHCOTE | X520: 7 | Y520: 3 | Z520: 0 | AA520: 957 | AB520: 723 | AC520: 132.36514522821577 | AD520: 28
A521: BRIGHTON | C521: DEANE 3 | F521: JIM HALLAHAN 3 | J521: BIRD 3 | L521: DAVIS 2 | N521: HARTNETT | W521: WILLIAMSTOWN | X521: 6 | Y521: 4 | Z521: 0 | AA521: 1036 | AB521: 934 | AC521: 110.92077087794432 | AD521: 24
A523: PORT MELBOURNE | C523: 3 | D523: 5 | E523: =C523*6+D523 -> 23 | G523: 6 | H523: 8 | I523: =G523*6+H523 -> 44 | K523: 9 | L523: 11 | M523: =K523*6+L523 -> 65 | O523: 11 | P523: 13 | Q523: =O523*6+P523 -> 79 | S523: NORTHCOTE | W523: COBURG | X523: 6 | Y523: 4 | Z523: 0 | AA523: 1044 | AB523: 983 | AC523: 106.20549338758902 | AD523: 24
A524: NORTHCOTE | C524: 3 | D524: 5 | E524: =C524*6+D524 -> 23 | G524: 7 | H524: 10 | I524: =G524*6+H524 -> 52 | K524: 8 | L524: 12 | M524: =K524*6+L524 -> 60 | O524: 9 | P524: 13 | Q524: =O524*6+P524 -> 67 | S524: MERRINGTON | W524: CAMBERWELL | X524: 6 | Y524: 4 | Z524: 0 | AA524: 1010 | AB524: 1039 | AC524: 97.21 | AD524: 24
A525: BEST PLAYERS | W525: SANDRINGHAM | X525: 5 | Y525: 5 | Z525: 0 | AA525: 1095 | AB525: 1027 | AC525: 106.62122687439143 | AD525: 20
A526: PORT MELBOURNE | C526: DOBSON | E526: EASTMUIR | H526: JULIER | K526: GOLDSMITH | N526: ALSOP | Q526: FREYER | W526: BRIGHTON | X526: 4 | Y526: 6 | Z526: 0 | AA526: 1093 | AB526: 1077 | AC526: 101.48560817084494 | AD526: 16
A527: NORTHCOTE | C527: RUDDELL | E527: HOLDEN | H527: MEITZCKE | K527: CAHILL | N527: ACKLAND | Q527: POWELL | W527: PORT MELBOURNE | X527: 4 | Y527: 6 | Z527: 0 | AA527: 819 | AB527: 1039 | AC527: 78.825794032723778 | AD527: 16
A528: GOALKICKERS | W528: YARRAVILLE | X528: 3 | Y528: 7 | Z528: 0 | AA528: 911 | AB528: 1208 | AC528: 75.41 | AD528: 12
A529: PORT MELBOURNE | C529: FREYER 6 | F529: JEFFERS 2 | I529: CULLEN | L529: LA FANNUE | O529: EASTMUIR | W529: PRESTON | X529: 2 | Y529: 8 | Z529: 0 | AA529: 878 | AB529: 1033 | AC529: 84.995159728944827 | AD529: 8
A530: NORTHCOTE | C530: ARCHER 2 | F530: O'NEILL 2 | I530: MEITZCKE 2 | L530: CAHILL 2 | O530: RUSH | W530: OAKLEIGH | X530: 0 | Y530: 10 | Z530: 0 | AA530: 936 | AB530: 1267 | AC530: 73.875295974743494 | AD530: 0
A532: SANDRINGHAM | C532: 5 | D532: 2 | E532: =C532*6+D532 -> 32 | G532: 13 | H532: 7 | I532: =G532*6+H532 -> 85 | K532: 15 | L532: 10 | M532: =K532*6+L532 -> 100 | O532: 19 | P532: 17 | Q532: =O532*6+P532 -> 131 | S532: BEACH ROAD
A533: PRAHRAN | C533: 2 | D533: 4 | E533: =C533*6+D533 -> 16 | G533: 4 | H533: 5 | I533: =G533*6+H533 -> 29 | K533: 9 | L533: 6 | M533: =K533*6+L533 -> 60 | O533: 12 | P533: 10 | Q533: =O533*6+P533 -> 82 | S533: PARRIS
A534: BEST PLAYERS
A535: SANDRINGHAM | C535: MITCHELL | F535: STAPLETON | I535: FREY | L535: FISHER | O535: REGNIER | R535: CARTWRIGHT
A536: PRAHRAN | C536: FLEMING | F536: WHITE | I536: THOMPSON | L536: JOHNSON | O536: GRAVELL | R536: BRENCHLEY
A537: GOALKICKERS
A538: SANDRINGHAM | C538: FISHER 5 | F538: ALLISTER 4 | I538: SMITH 3 | K538: S ANDERSON 3 | N538: RYAN | P538: REGNIER | R538: KENT | T538: CARTWRIGHT
A539: PRAHRAN | C539: WHITE 3 | F539: BRENCHLEY 2 | I539: GRAVELL 2 | L539: HAWKINS | N539: FAUL | P539: PROBYN | R539: W TAYLOR | U539: DAVEY
A541: COBURG | C541: 1 | D541: 2 | E541: =C541*6+D541 -> 8 | G541: 6 | H541: 2 | I541: =G541*6+H541 -> 38 | K541: 9 | L541: 7 | M541: =K541*6+L541 -> 61 | O541: 13 | P541: 12 | Q541: =O541*6+P541 -> 90 | S541: COBURG
A542: PRESTON | C542: 2 | D542: 5 | E542: =C542*6+D542 -> 17 | G542: 7 | H542: 9 | I542: =G542*6+H542 -> 51 | K542: 11 | L542: 16 | M542: =K542*6+L542 -> 82 | O542: 11 | P542: 17 | Q542: =O542*6+P542 -> 83 | S542: GREGORY
A543: BEST PLAYERS
A544: COBURG | C544: BRAGG | F544: RE | I544: SCANLON | L544: HALL | O544: WHITFIELD | R544: SCRIVEN
A545: PRESTON | C545: MORRISON | F545: WHITE | I545: GRAY | L545: JOB | O545: ROACH | R545: SLEITH
A546: GOALKICKERS
A547: COBURG | C547: COLLINS 3 | F547: MEARNS 2 | I547: TOONE 2 | K547: PERRETT | M547: SCANLON | O547: LITTLE | Q547: WHITFIELD | T547: SCRIVEN | W547: GILLON
A548: PRESTON | C548: MORRISON 3 | F548: ROACH 2 | I548: WHITE 2 | K548: JOB 2 | M548: ROBERTSON | P548: LAWLER
A550: YARRAVILLE | C550: 2 | D550: 3 | E550: =C550*6+D550 -> 15 | G550: 8 | H550: 3 | I550: =G550*6+H550 -> 51 | K550: 14 | L550: 6 | M550: =K550*6+L550 -> 90 | O550: 24 | P550: 11 | Q550: =O550*6+P550 -> 155 | S550: CAMBERWELL
A551: CAMBERWELL | C551: 5 | D551: 3 | E551: =C551*6+D551 -> 33 | G551: 8 | H551: 8 | I551: =G551*6+H551 -> 56 | K551: 15 | L551: 12 | M551: =K551*6+L551 -> 102 | O551: 15 | P551: 17 | Q551: =O551*6+P551 -> 107 | S551: HAYES
A552: BEST PLAYERS
A553: YARRAVILLE | C553: PERUSSICH | F553: McGRATH | I553: SMITH | L553: WEDGWOOD | O553: HOPKINS | R553: STREETER
A554: CAMBERWELL | C554: NASH | F554: BENNETT | I554: FITCHER | L554: LENNIE | O554: CLAMP | R554: POOLE
A555: GOALKICKERS
A556: YARRAVILLE | C556: LUKE 6 | E556: McGRATH 6 | H556: WEDGWOOD 2 | K556: HOPKINS 2 | N556: PERUSSICH 2 | Q556: CALVERT 2 | T556: KENNY | W556: REDPATH | X556: EVANS | Z556: RAWSON
A557: CAMBERWELL | C557: CLAMP 5 | E557: BENNETT 3 | H557: SEELENMEYER 2 | K557: POOLE 2 | M557: CANNINGTON | P557: HORKINGS | R557: FORD
A559: BRUNSWICK | C559: 9 | D559: 2 | E559: =C559*6+D559 -> 56 | G559: 15 | H559: 8 | I559: =G559*6+H559 -> 98 | K559: 22 | L559: 13 | M559: =K559*6+L559 -> 145 | O559: 31 | P559: 15 | Q559: =O559*6+P559 -> 201 | S559: OAKLEIGH
A560: OAKLEIGH | C560: 6 | D560: 3 | E560: =C560*6+D560 -> 39 | G560: 7 | H560: 8 | I560: =G560*6+H560 -> 50 | K560: 11 | L560: 14 | M560: =K560*6+L560 -> 80 | O560: 17 | P560: 21 | Q560: =O560*6+P560 -> 123 | S560: SCOTT
A561: BEST PLAYERS
A562: BRUNSWICK | C562: QUINN | E562: JONES | H562: FAY | K562: McINNES | N562: RYAN | Q562: CHALLENGER
A563: OAKLEIGH | C563: MURPHY | E563: WILLIAMS | H563: CLARKE | K563: FISCHER | N563: DOWLER | Q563: EVANS
A564: GOALKICKERS
A565: BRUNSWICK | C565: JONES 16 | F565: CRAWFORD 5 | I565: McINNES 4 | L565: DOWLING 2 | N565: QUINN | P565: GARDNER | R565: FITZGIBBON | V565: McGRATH
A566: OAKLEIGH | C566: CLARKE (5) | F566: DOWLER (5) | I566: NOLAN (4) | L566: GILLETT | N566: BELL | P566: F HUTCHESON
A568: ROUND 11 | E568: 24TH JUNE | H568: WEATHER | K568: COLD CLOUDY SHOWERS W WIND GROUNDS BAD | S568: PLAYED AT
D569: 1ST QTR | H569: 2ND QTR | L569: 3RD QTR | P569: FINAL | S569: TOORAK PARK
A570: NORTHCOTE | C570: 3 | D570: 1 | E570: =C570*6+D570 -> 19 | G570: 7 | H570: 6 | I570: =G570*6+H570 -> 48 | K570: 10 | L570: 8 | M570: =K570*6+L570 -> 68 | O570: 12 | P570: 13 | Q570: =O570*6+P570 -> 85 | S570: UMPIRE | X570: LADDER | AB570: ROUND | AD570: 11
A571: PRAHRAN | C571: 4 | D571: 2 | E571: =C571*6+D571 -> 26 | G571: 6 | H571: 5 | I571: =G571*6+H571 -> 41 | K571: 10 | L571: 10 | M571: =K571*6+L571 -> 70 | O571: 12 | P571: 11 | Q571: =O571*6+P571 -> 83 | S571: GREGORY
A572: BEST PLAYERS | W572: TEAM | X572: W | Y572: L | Z572: D | AA572: FOR | AB572: AGST | AC572: % | AD572: PTS
A573: NORTHCOTE | C573: SIMPSON | F573: RUDDELL | I573: MEITZCKE | L573: DOWNIE | N573: McINERNEY | Q573: RUSH
A574: PRAHRAN | C574: HAWKINS | F574: THOMPSON | I574: BRENCHLEY | L574: DREW | N574: GRAVELL | Q574: F SMITH | W574: BRUNSWICK | X574: 10 | Y574: 1 | Z574: 0 | AA574: 1242 | AB574: 901 | AC574: 137.84683684794672 | AD574: 40
A575: GOALKICKERS | W575: NORTHCOTE | X575: 8 | Y575: 3 | Z575: 0 | AA575: 1042 | AB575: 806 | AC575: 129.28039702233249 | AD575: 32
A576: NORTHCOTE | C576: RUSH 3 | F576: SIMPSON 3 | I576: LAMPRELL 2 | L576: O'NEILL 2 | N576: MEITZCKE | Q576: E HART | W576: PRAHRAN | X576: 8 | Y576: 3 | Z576: 0 | AA576: 1221 | AB576: 959 | AC576: 127.32012513034411 | AD576: 32
A577: PRAHRAN | C577: HAWKINS 6 | F577: WHITE 2 | I577: THOMPSON 2 | L577: PEARCE | N577: DAVEY | W577: CAMBERWELL | X577: 7 | Y577: 4 | Z577: 0 | AA577: 1128 | AB577: 1148 | AC577: 98.26 | AD577: 28
A579: BRUNSWICK | C579: 6 | D579: 4 | E579: =C579*6+D579 -> 40 | G579: 8 | H579: 8 | I579: =G579*6+H579 -> 56 | K579: 15 | L579: 13 | M579: =K579*6+L579 -> 103 | O579: 21 | P579: 17 | Q579: =O579*6+P579 -> 143 | S579: BRUNSWICK | W579: WILLIAMSTOWN | X579: 6 | Y579: 5 | Z579: 0 | AA579: 1125 | AB579: 1077 | AC579: 104.45682451253482 | AD579: 24
A580: WILLIAMSTOWN | C580: 1 | D580: 2 | E580: =C580*6+D580 -> 8 | G580: 8 | H580: 8 | I580: =G580*6+H580 -> 56 | K580: 10 | L580: 8 | M580: =K580*6+L580 -> 68 | O580: 13 | P580: 11 | Q580: =O580*6+P580 -> 89 | S580: HAYES | W580: COBURG | X580: 6 | Y580: 5 | Z580: 0 | AA580: 1109 | AB580: 1070 | AC580: 103.64485981308411 | AD580: 24
A581: BEST PLAYERS | W581: SANDRINGHAM | X581: 5 | Y581: 6 | Z581: 0 | AA581: 1184 | AB581: 1118 | AC581: 105.90339892665475 | AD581: 20
A582: BRUNSWICK | C582: McKAY | F582: JONES | I582: BAILEY | K582: DOWLING | N582: CRAWFORD | Q582: QUINN | W582: BRIGHTON | X582: 5 | Y582: 6 | Z582: 0 | AA582: 1180 | AB582: 1142 | AC582: 103.32749562171628 | AD582: 20
A583: WILLIAMSTOWN | C583: THOMAS | F583: CUTTING | I583: PHELAN | K583: VALLENCE | N583: WILCOX | Q583: PATERSON | W583: YARRAVILLE | X583: 4 | Y583: 7 | Z583: 0 | AA583: 1029 | AB583: 1279 | AC583: 80.5 | AD583: 16
A584: GOALKICKERS | W584: PORT MELBOURNE | X584: 4 | Y584: 7 | Z584: 0 | AA584: 928 | AB584: 1157 | AC584: 80.207433016421774 | AD584: 16
A585: BRUNSWICK | C585: JONES 9 | F585: DOWLING 5 | I585: DAVIS 4 | K585: McINNES 2 | N585: McGRATH | W585: PRESTON | X585: 3 | Y585: 8 | Z585: 0 | AA585: 969 | AB585: 1122 | AC585: 86.36363636363636 | AD585: 12
A586: WILLIAMSTOWN | C586: VALLENCE 7 | F586: THOMAS 3 | I586: FAIRBAIRN | L586: JAMIESON | N586: CAVE | W586: OAKLEIGH | X586: 0 | Y586: 11 | Z586: 0 | AA586: 1007 | AB586: 1385 | AC586: 72.707581227436819 | AD586: 0
A588: BRIGHTON | C588: 1 | D588: 1 | E588: =C588*6+D588 -> 7 | G588: 3 | H588: 9 | I588: =G588*6+H588 -> 27 | K588: 9 | L588: 11 | M588: =K588*6+L588 -> 65 | O588: 12 | P588: 15 | Q588: =O588*6+P588 -> 87 | S588: ELSTERNWICK PARK
A589: COBURG | C589: 1 | D589: 4 | E589: =C589*6+D589 -> 10 | G589: 4 | H589: 9 | I589: =G589*6+H589 -> 33 | K589: 6 | L589: 14 | M589: =K589*6+L589 -> 50 | O589: 8 | P589: 17 | Q589: =O589*6+P589 -> 65 | S589: SCOTT
A590: BEST PLAYERS
A591: BRIGHTON | C591: CONNELL | F591: ALVIN | I591: DEANE | L591: GEORGE | O591: BIRD | R591: DAVIS
A592: COBURG | C592: ATKINSON | F592: PERRETT | I592: LA FRANCHI | L592: LITTLE | O592: HALL | R592: SCRIVEN
A593: GOALKICKERS
A594: BRIGHTON | C594: HALLAHAN 3 | F594: DEANE 3 | I594: BIRD 2 | K594: WEBER 2 | M594: HARTNETT | P594: MILLER
A595: COBURG | C595: LA FRANCHI 2 | F595: SCANLON | I595: PERRETT | K595: JOHNSON | M595: COLLINS | O595: WHITE | Q595: HALL
A597: CAMBERWELL | C597: 9 | D597: 4 | E597: =C597*6+D597 -> 58 | G597: 11 | H597: 5 | I597: =G597*6+H597 -> 71 | K597: 14 | L597: 14 | M597: =K597*6+L597 -> 98 | O597: 17 | P597: 16 | Q597: =O597*6+P597 -> 118 | S597: PORT MELBOURNE
A598: PORT MELBOURNE | C598: 5 | D598: 0 | E598: =C598*6+D598 -> 30 | G598: 9 | H598: 11 | I598: =G598*6+H598 -> 65 | K598: 13 | L598: 14 | M598: =K598*6+L598 -> 92 | O598: 15 | P598: 19 | Q598: =O598*6+P598 -> 109 | S598: LESTER
A599: BEST PLAYERS
A600: CAMBERWELL | C600: NASH | E600: SEELENMEYER | I600: CANNINGTON | L600: HOPKINS | O600: BOND | Q600: FARRELLY
A601: PORT MELBOURNE | C601: DOBSON | E601: LAHIFF | I601: LA FANNUE | L601: JULIER | O601: ALSOP | Q601: CULLEN
A602: GOALKICKERS
A603: CAMBERWELL | C603: FARRELLY 5 | F603: NASH 4 | H603: CLAMP 3 | J603: BENNETT 2 | M603: SEELENMEYER | P603: FORD | R603: FITCHER
A604: PORT MELBOURNE | C604: FREYER 5 | F604: LE FANNUE 5 | I604: JEFFERS 3 | K604: EASTMUIR | M604: CULLEN
A606: YARRAVILLE | C606: 2 | D606: 7 | E606: =C606*6+D606 -> 19 | G606: 5 | H606: 11 | I606: =G606*6+H606 -> 41 | K606: 12 | L606: 17 | M606: =K606*6+L606 -> 89 | O606: 16 | P606: 22 | Q606: =O606*6+P606 -> 118 | S606: YARRAVILLE
A607: OAKLEIGH | C607: 2 | D607: 5 | E607: =C607*6+D607 -> 17 | G607: 4 | H607: 7 | I607: =G607*6+H607 -> 31 | K607: 6 | L607: 7 | M607: =K607*6+L607 -> 43 | O607: 10 | P607: 11 | Q607: =O607*6+P607 -> 71 | S607: PARRIS
A608: BEST PLAYERS
A609: YARRAVILLE | C609: LUKE | E609: ANDERSON | H609: PLUMMER | K609: KELLY | N609: STREETER | Q609: RIGGS
A610: OAKLEIGH | C610: MURPHY | E610: ASH | H610: CLARKE | K610: THOMPSON | N610: F HUTCHESON | Q610: WILLIAMS
A611: GOALKICKERS
A612: YARRAVILLE | C612: LUKE 8 | F612: McGRATH 2 | I612: ALSOPP 2 | K612: HOPKINS 2 | N612: SMITH | P612: GRAY
A613: OAKLEIGH | C613: DOWLER 5 | F613: NOLAN 3 | I613: CLARKE | K613: BELL
A615: PRESTON | C615: 3 | D615: 4 | E615: =C615*6+D615 -> 22 | G615: 6 | H615: 6 | I615: =G615*6+H615 -> 42 | K615: 10 | L615: 9 | M615: =K615*6+L615 -> 69 | O615: 13 | P615: 13 | Q615: =O615*6+P615 -> 91 | S615: PRESTON
A616: SANDRINGHAM | C616: 3 | D616: 2 | E616: =C616*6+D616 -> 20 | G616: 5 | H616: 5 | I616: =G616*6+H616 -> 35 | K616: 10 | L616: 10 | M616: =K616*6+L616 -> 70 | O616: 13 | P616: 11 | Q616: =O616*6+P616 -> 89 | S616: MERRINGTON
A617: BEST PLAYERS
A618: PRESTON | C618: WATKINS | F618: GRAY | I618: LOWENTHAL | L618: JOB | O618: MILLER | Q618: ROSS
A619: SANDRINGHAM | C619: WITHERS | F619: STAPLETON | I619: KENT | L619: ALLISTER | O619: MILLER | Q619: CARTWRIGHT
A620: GOALKICKERS
A621: PRESTON | C621: ROACH 4 | F621: DUNSTONE 2 | I621: JOB 2 | K621: ROSS | M621: WHITE | O621: BEAGLEY | Q621: MORRISON | T621: STEWART
A622: SANDRINGHAM | C622: ANDERSON 4 | F622: GRIFFITH 3 | I622: ALLISTER 2 | L622: REGNIER 2 | O622: WITHERS 2
A624: ROUND 12 | E624: 1ST JULY | H624: WEATHER | K624: COLD CLOUDY SHOWERS W WIND GROUNDS BAD | S624: PLAYED AT
D625: 1ST QTR | H625: 2ND QTR | L625: 3RD QTR | P625: FINAL | S625: ELSTERNWICK PARK
A626: BRIGHTON | C626: 2 | D626: 4 | E626: =C626*6+D626 -> 16 | G626: 2 | H626: 5 | I626: =G626*6+H626 -> 17 | K626: 8 | L626: 13 | M626: =K626*6+L626 -> 61 | O626: 10 | P626: 14 | Q626: =O626*6+P626 -> 74 | S626: UMPIRE | X626: LADDER | AB626: ROUND | AD626: 12
A627: SANDRINGHAM | C627: 1 | D627: 3 | E627: =C627*6+D627 -> 9 | G627: 8 | H627: 7 | I627: =G627*6+H627 -> 55 | K627: 8 | L627: 7 | M627: =K627*6+L627 -> 55 | O627: 11 | P627: 7 | Q627: =O627*6+P627 -> 73 | S627: MERRINGTON
A628: BEST PLAYERS | W628: TEAM | X628: W | Y628: L | Z628: D | AA628: FOR | AB628: AGST | AC628: % | AD628: PTS
A629: BRIGHTON | C629: PENNY | F629: GODFREY | I629: WILLIAMSON | L629: JOHNSON | N629: HINDSON | Q629: DAVIS
A630: SANDRINGHAM | C630: WITHERS | F630: CARTWRIGHT | I630: ALLISTER | L630: FREY | N630: MILLER | Q630: SMAIL | W630: BRUNSWICK | X630: 11 | Y630: 1 | Z630: 0 | AA630: 1351 | AB630: 998 | AC630: 135.37074148296594 | AD630: 44
A631: GOALKICKERS | W631: NORTHCOTE | X631: 9 | Y631: 3 | Z631: 0 | AA631: 1102 | AB631: 861 | AC631: 127.99070847851335 | AD631: 36
A632: BRIGHTON | C632: HALLAHAN 3 | F632: PENNY 2 | H632: HENDER | J632: GODFREY | L632: DEANE | N632: WEBER | P632: BIRD | W632: PRAHRAN | X632: 9 | Y632: 3 | Z632: 0 | AA632: 1335 | AB632: 1052 | AC632: 126.90114068441065 | AD632: 36
A633: SANDRINGHAM | C633: WEBER 3 | F633: KENT 2 | H633: WITHERS 2 | K633: RYAN | M633: ALLISTER | O633: ANDERSON | R633: FREY | W633: CAMBERWELL | X633: 8 | Y633: 4 | Z633: 0 | AA633: 1319 | AB633: 1215 | AC633: 108.56 | AD633: 32
A635: PRAHRAN | C635: 2 | D635: 4 | E635: =C635*6+D635 -> 16 | G635: 8 | H635: 5 | I635: =G635*6+H635 -> 53 | K635: 13 | L635: 10 | M635: =K635*6+L635 -> 88 | O635: 17 | P635: 12 | Q635: =O635*6+P635 -> 114 | S635: PORT MELBOURNE | W635: WILLIAMSTOWN | X635: 7 | Y635: 5 | Z635: 0 | AA635: 1282 | AB635: 1156 | AC635: 110.89965397923875 | AD635: 28
A636: PORT MELBOURNE | C636: 1 | D636: 5 | E636: =C636*6+D636 -> 11 | G636: 7 | H636: 6 | I636: =G636*6+H636 -> 48 | K636: 9 | L636: 11 | M636: =K636*6+L636 -> 65 | O636: 13 | P636: 15 | Q636: =O636*6+P636 -> 93 | S636: LESTER | W636: BRIGHTON | X636: 6 | Y636: 6 | Z636: 0 | AA636: 1254 | AB636: 1215 | AC636: 103.20987654320987 | AD636: 24
A637: BEST PLAYERS | W637: COBURG | X637: 6 | Y637: 6 | Z637: 0 | AA637: 1206 | AB637: 1179 | AC637: 102.29007633587786 | AD637: 24
A638: PRAHRAN | C638: HAWKINS | F638: BRENCHLEY | I638: F TAYLOR | L638: ROLFE | N638: WHITEHEAD | Q638: JOHNSON | W638: SANDRINGHAM | X638: 5 | Y638: 7 | Z638: 0 | AA638: 1257 | AB638: 1192 | AC638: 105.45302013422818 | AD638: 20
A639: PORT MELBOURNE | C639: LAHIFF | F639: REYNOLDS | I639: GOLDSMITH | L639: JULIER | N639: ALSOP | Q639: LEE | W639: PORT MELBOURNE | X639: 4 | Y639: 8 | Z639: 0 | AA639: 1021 | AB639: 1271 | AC639: 80.330448465774978 | AD639: 16
A640: GOALKICKERS | W640: YARRAVILLE | X640: 4 | Y640: 8 | Z640: 0 | AA640: 1108 | AB640: 1436 | AC640: 77.16 | AD640: 16
A641: PRAHRAN | C641: HAWKINS 8 | F641: ROLFE 2 | H641: FLEMING 2 | J641: DAVEY 2 | L641: GRAVELL | N641: WHITE | P641: ROBERTS | W641: PRESTON | X641: 3 | Y641: 9 | Z641: 0 | AA641: 1024 | AB641: 1182 | AC641: 86.632825719120135 | AD641: 12
A642: PORT MELBOURNE | C642: LAHIFF 5 | F642: FREYER 2 | I642: LE FANNUE | K642: JULIER | M642: RICHES | O642: EDWARDS | Q642: FLETCHER | T642: CULLEN | W642: OAKLEIGH | X642: 0 | Y642: 12 | Z642: 0 | AA642: 1074 | AB642: 1576 | AC642: 68.147208121827404 | AD642: 0
A644: CAMBERWELL | C644: 4 | D644: 5 | E644: =C644*6+D644 -> 29 | G644: 11 | H644: 9 | I644: =G644*6+H644 -> 75 | K644: 15 | L644: 17 | M644: =K644*6+L644 -> 107 | O644: 28 | P644: 23 | Q644: =O644*6+P644 -> 191 | S644: CAMBERWELL
A645: OAKLEIGH | C645: 3 | D645: 4 | E645: =C645*6+D645 -> 22 | G645: 7 | H645: 6 | I645: =G645*6+H645 -> 48 | K645: 8 | L645: 7 | M645: =K645*6+L645 -> 55 | O645: 10 | P645: 7 | Q645: =O645*6+P645 -> 67 | S645: HAYES
A646: BEST PLAYERS
A647: CAMBERWELL | C647: NASH | F647: CLAMP | I647: BENNETT | L647: HORKINGS | O647: RANDELL | R647: SEELENMEYER
A648: OAKLEIGH | C648: WILSON | F648: LANNING | I648: MALONEY | L648: F HUTCHESON | O648: MURPHY | R648: DOWLER
A649: GOALKICKERS
A650: CAMBERWELL | C650: NASH 11 | E650: CLAMP 5 | G650: FITCHER 3 | I650: FARRELLY 2 | L650: FINN 2 | N650: BENNETT | P650: CANNINGTON | S650: ANDERSON | V650: BROWN | X650: RANDALL
A651: OAKLEIGH | C651: DOWLER 3 | F651: NOLAN 2 | I651: WILMOTT 2 | L651: BICKERTON | N651: MALONEY | Q651: MURPHY
A653: NORTHCOTE | C653: 2 | D653: 4 | E653: =C653*6+D653 -> 16 | G653: 4 | H653: 6 | I653: =G653*6+H653 -> 30 | K653: 6 | L653: 12 | M653: =K653*6+L653 -> 48 | O653: 8 | P653: 12 | Q653: =O653*6+P653 -> 60 | S653: PRESTON
A654: PRESTON | C654: 1 | D654: 2 | E654: =C654*6+D654 -> 8 | G654: 5 | H654: 8 | I654: =G654*6+H654 -> 38 | K654: 5 | L654: 9 | M654: =K654*6+L654 -> 39 | O654: 7 | P654: 13 | Q654: =O654*6+P654 -> 55 | S654: GREGORY
A655: BEST PLAYERS
A656: NORTHCOTE | C656: B HART | F656: RUDDELL | I656: DOWNIE | L656: SIMPSON | O656: NEWMAN | R656: McINERNEY
A657: PRESTON | C657: DOWLING | F657: WHITE | I657: SLEITH | L657: CALRKE | O657: LOWENTHAL | R657: DUNSTONE
A658: GOALKICKERS
A659: NORTHCOTE | C659: SIMPSON 3 | F659: CAHILL | I659: LAMPRELL | L659: McINERNEY | N659: STABB | P659: DOWNIE
A660: PRESTON | C660: MORRISON 2 | F660: DUNSTONE | I660: NORMAN | L660: WHITE | N660: MILLER | P660: ROACH
E661: 8TH JULY | J661: WEATHER | M661: FINE
A662: BRUNSWICK | C662: 2 | D662: 4 | E662: =C662*6+D662 -> 16 | G662: 9 | H662: 8 | I662: =G662*6+H662 -> 62 | K662: 15 | L662: 11 | M662: =K662*6+L662 -> 101 | O662: 16 | P662: 13 | Q662: =O662*6+P662 -> 109 | S662: BRUNSWICK
A663: COBURG | C663: 3 | D663: 4 | E663: =C663*6+D663 -> 22 | G663: 7 | H663: 4 | I663: =G663*6+H663 -> 46 | K663: 7 | L663: 5 | M663: =K663*6+L663 -> 47 | O663: 15 | P663: 7 | Q663: =O663*6+P663 -> 97 | S663: SCOTT
A664: BEST PLAYERS
A665: BRUNSWICK | C665: FITZGIBBON | F665: CLARKE | I665: FAY | L665: BAILEY | O665: GARDNER | R665: CHALLENGER
A666: COBURG | C666: ATKINSON | F666: BRAGG | I666: SCRIVEN | L666: JOHNSON | O666: JORDAN | R666: COLLINS
A667: GOALKICKERS
A668: BRUNSWICK | C668: DOWLING 4 | F668: CRAWFORD 3 | I668: McINNES 3 | L668: McGRATH 2 | O668: BOYD 2 | Q668: BAILEY | S668: JONES
A669: COBURG | C669: JOHNSON 5 | F669: COLLINS 4 | I669: PERRETT 3 | L669: HALL | N669: LONDSDALE | Q669: LITTLE
A671: WILLIAMSTOWN | C671: 2 | D671: 3 | E671: =C671*6+D671 -> 15 | G671: 6 | H671: 10 | I671: =G671*6+H671 -> 46 | K671: 12 | L671: 16 | M671: =K671*6+L671 -> 88 | O671: 23 | P671: 19 | Q671: =O671*6+P671 -> 157 | S671: YARRAVILLE
A672: YARRAVILLE | C672: 5 | D672: 2 | E672: =C672*6+D672 -> 32 | G672: 6 | H672: 4 | I672: =G672*6+H672 -> 40 | K672: 9 | L672: 8 | M672: =K672*6+L672 -> 62 | O672: 11 | P672: 13 | Q672: =O672*6+P672 -> 79 | S672: PARRIS
A673: BEST PLAYERS
A674: WILLIAMSTOWN | C674: WILCOX | E674: McTAGGART | H674: PATERSON | K674: OGDEN | N674: THOMAS | Q674: McDONOUGH
A675: YARRAVILLE | C675: KELLY | E675: BONIFACE | H675: HOPKINS | K675: PERUSSICH | N675: H ANDERSON | Q675: ALSOPP
A676: GOALKICKERS
A677: WILLIAMSTOWN | C677: VALLENCE 8 | F677: JAMIESON 4 | I677: PATERSON 3 | L677: THOMAS 2 | N677: QUINN | P677: CAVE | R677: McTAGGART | V677: DELLER | Y677: FAIRBAIRN | AB677: FITCH
A678: YARRAVILLE | C678: LUKE 3 | F678: HOPKINS 2 | I678: WEDGWOOD 2 | L678: McGRATH 2 | O678: McLURE | Q678: BONIFACE
A680: ROUND 13 | E680: 8TH JULY | J680: WEATHER | M680: FINE | S680: PLAYED AT
D681: 1ST QTR | H681: 2ND QTR | L681: 3RD QTR | P681: FINAL | S681: OLYMPIC PK
A682: BRIGHTON | C682: 3 | D682: 1 | E682: =C682*6+D682 -> 19 | G682: 6 | H682: 7 | I682: =G682*6+H682 -> 43 | K682: 8 | L682: 7 | M682: =K682*6+L682 -> 55 | O682: 12 | P682: 13 | Q682: =O682*6+P682 -> 85 | S682: UMPIRE | X682: LADDER | AB682: ROUND | AD682: 13
A683: NORTHCOTE | C683: 3 | D683: 9 | E683: =C683*6+D683 -> 27 | G683: 4 | H683: 14 | I683: =G683*6+H683 -> 38 | K683: 6 | L683: 21 | M683: =K683*6+L683 -> 57 | O683: 7 | P683: 25 | Q683: =O683*6+P683 -> 67 | S683: HAYES
A684: BEST PLAYERS | W684: TEAM | X684: W | Y684: L | Z684: D | AA684: FOR | AB684: AGST | AC684: % | AD684: PTS
A685: BRIGHTON | C685: BAKER | F685: HINDSON | I685: BIRD | L685: DAVIS | N685: KEMP | Q685: CONNELL
A686: NORTHCOTE | C686: MEITZCKE | F686: POWELL | I686: NEWMAN | L686: SIMPSON | N686: McINERNEY | Q686: RUSH | W686: BRUNSWICK | X686: 12 | Y686: 1 | Z686: 0 | AA686: 1470 | AB686: 1093 | AC686: 134.49222323879232 | AD686: 48
A687: GOALKICKERS | W687: PRAHRAN | X687: 10 | Y687: 3 | Z687: 0 | AA687: 1463 | AB687: 1160 | AC687: 126.12068965517241 | AD687: 40
A688: BRIGHTON | C688: DEANE 3 | F688: HALLAHAN 3 | I688: BIRD 2 | K688: BOLWELL 2 | N688: HENDER | P688: PENNY | W688: NORTHCOTE | X688: 9 | Y688: 4 | Z688: 0 | AA688: 1169 | AB688: 946 | AC688: 123.57293868921776 | AD688: 36
A689: NORTHCOTE | C689: SEYMOUR 3 | F689: SIMPSON 2 | I689: NEESON | K689: LAMPRELL | W689: CAMBERWELL | X689: 9 | Y689: 4 | Z689: 0 | AA689: 1427 | AB689: 1303 | AC689: 109.52 | AD689: 36
A691: PRAHRAN | C691: 6 | D691: 9 | E691: =C691*6+D691 -> 45 | G691: 7 | H691: 10 | I691: =G691*6+H691 -> 52 | K691: 18 | L691: 11 | M691: =K691*6+L691 -> 119 | O691: 19 | P691: 14 | Q691: =O691*6+P691 -> 128 | S691: TOORAK PARK | W691: WILLIAMSTOWN | X691: 7 | Y691: 6 | Z691: 0 | AA691: 1370 | AB691: 1264 | AC691: 108.39 | AD691: 28
A692: PRESTON | C692: 2 | D692: 1 | E692: =C692*6+D692 -> 13 | G692: 9 | H692: 5 | I692: =G692*6+H692 -> 59 | K692: 12 | L692: 5 | M692: =K692*6+L692 -> 77 | O692: 16 | P692: 12 | Q692: =O692*6+P692 -> 108 | S692: DWYER | W692: BRIGHTON | X692: 7 | Y692: 6 | Z692: 0 | AA692: 1339 | AB692: 1282 | AC692: 104.44617784711389 | AD692: 28
A693: BEST PLAYERS | W693: COBURG | X693: 6 | Y693: 7 | Z693: 0 | AA693: 1339 | AB693: 1319 | AC693: 101.51630022744503 | AD693: 24
A694: PRAHRAN | C694: HAWKINS | F694: JOHNSON | I694: THOMPSON | L694: BOURNE | N694: WHITE | Q694: FLEMING | W694: SANDRINGHAM | X694: 5 | Y694: 8 | Z694: 0 | AA694: 1352 | AB694: 1311 | AC694: 103.12738367658277 | AD694: 20
A695: PRESTON | C695: DUNHAM | F695: WHITE | I695: ROSS | L695: MILLER | N695: NORMAN | Q695: MORRISON | W695: YARRAVILLE | X695: 5 | Y695: 8 | Z695: 0 | AA695: 1248 | AB695: 1569 | AC695: 79.54 | AD695: 20
A696: GOALKICKERS | W696: PORT MELBOURNE | X696: 4 | Y696: 9 | Z696: 0 | AA696: 1129 | AB696: 1396 | AC696: 80.873925501432666 | AD696: 16
A697: PRAHRAN | C697: HAWKINS 14 | F697: ROLFE 2 | I697: DAVEY 2 | L697: JOHNSON | S697: /DUNHAM | W697: PRESTON | X697: 3 | Y697: 10 | Z697: 0 | AA697: 1132 | AB697: 1310 | AC697: 86.412213740458014 | AD697: 12
A698: PRESTON | C698: MORRISON 4 | F698: MILLER 2 | H698: WHITE 2 | J698: ROBERTSON 2 | M698: DUNSTONE 2 | P698: ROSS | Q698: COLBAN | S698: NORMAN | W698: OAKLEIGH | X698: 1 | Y698: 12 | Z698: 0 | AA698: 1199 | AB698: 1684 | AC698: 71.199524940617579 | AD698: 4
E699: 15TH JULY | J699: WEATHER | M699: CLOUDY BUT FINE STRONG N WIND
A700: BRUNSWICK | C700: 5 | D700: 10 | E700: =C700*6+D700 -> 40 | G700: 6 | H700: 12 | I700: =G700*6+H700 -> 48 | K700: 14 | L700: 22 | M700: =K700*6+L700 -> 106 | O700: 16 | P700: 23 | Q700: =O700*6+P700 -> 119 | S700: BEACH ROAD
A701: SANDRINGHAM | C701: 0 | D701: 0 | E701: =C701*6+D701 -> 0 | G701: 8 | H701: 9 | I701: =G701*6+H701 -> 57 | K701: 8 | L701: 10 | M701: =K701*6+L701 -> 58 | O701: 13 | P701: 17 | Q701: =O701*6+P701 -> 95 | S701: PARRIS
A702: BEST PLAYERS
A703: BRUNSWICK | C703: BAILEY | F703: CRAWFORD | J703: FAY | M703: BOYD | P703: DOWLING | S703: CLARKE
A704: SANDRINGHAM | C704: SAUNDERS | F704: CARTWRIGHT | J704: SMAIL | M704: MILLER | P704: STAPLETON | S704: ANDERSON
A705: GOALKICKERS
A706: BRUNSWICK | C706: CRAWFORD 3 | F706: BAILEY 3 | I706: DOWLING 3 | L706: FLETT 2 | N706: McINNES 2 | Q706: BOYD | S706: McKAY | U706: QUINN | X706: JONES
A707: SANDRINGHAM | C707: SMITH 3 | F707: RYAN 3 | I707: ANDERSON 2 | L707: KENT | N707: LUDLOW | P707: CARTWRIGHT | S707: WITHERS | V707: SAUNDERS
A709: YARRAVILLE | C709: 9 | D709: 11 | E709: =C709*6+D709 -> 65 | G709: 11 | H709: 13 | I709: =G709*6+H709 -> 79 | K709: 18 | L709: 17 | M709: =K709*6+L709 -> 125 | O709: 20 | P709: 20 | Q709: =O709*6+P709 -> 140 | S709: COBURG
A710: COBURG | C710: 2 | D710: 1 | E710: =C710*6+D710 -> 13 | G710: 10 | H710: 9 | I710: =G710*6+H710 -> 69 | K710: 12 | L710: 10 | M710: =K710*6+L710 -> 82 | O710: 20 | P710: 13 | Q710: =O710*6+P710 -> 133 | S710: McALPINE
A711: BEST PLAYERS
A712: YARRAVILLE | C712: HOPKINS | F712: STREETER | I712: BONIFACE | L712: ALSOPP | O712: ANDERSON | R712: REDPATH
A713: COBURG | C713: JORDAN | F713: RE | I713: LITTLE | L713: COLLINS | O713: SCRIVEN | R713: WHITE
A714: GOALKICKERS
A715: YARRAVILLE | C715: TURNER 8 | F715: T SMITH 4 | I715: GREEN 2 | K715: HOPKINS 2 | N715: McGRATH 2 | Q715: ALSOPP 2
A716: COBURG | C716: COLLINS 9 | F716: LONSDALE 3 | I716: LITTLE 2 | K716: HALL 2 | M716: YOUNG | O716: PERRETT | Q716: WHITE | S716: SCANLON
A718: OAKLEIGH | C718: 6 | D718: 1 | E718: =C718*6+D718 -> 37 | G718: 12 | H718: 3 | I718: =G718*6+H718 -> 75 | K718: 14 | L718: 5 | M718: =K718*6+L718 -> 89 | O718: 19 | P718: 11 | Q718: =O718*6+P718 -> 125 | S718: OAKLEIGH
A719: PORT MELBOURNE | C719: 4 | D719: 3 | E719: =C719*6+D719 -> 27 | G719: 5 | H719: 6 | I719: =G719*6+H719 -> 36 | K719: 13 | L719: 8 | M719: =K719*6+L719 -> 86 | O719: 16 | P719: 12 | Q719: =O719*6+P719 -> 108 | S719: MERRINGTON
A720: BEST PLAYERS
A721: OAKLEIGH | C721: BELL | E721: BENNETT | H721: CORP | K721: DOWLER | N721: WILLIAMS | Q721: SMITH
A722: PORT MELBOURNE | C722: LAHIFF | E722: RUSSO | H722: GOLDSMITH | K722: LE FANNUE | N722: GOSS | Q722: McBETH
A723: GOALKICKERS
A724: OAKLEIGH | C724: DOWLER 5 | F724: MALONEY 3 | I724: GALLAUGHER 3 | L724: NOLAN 3 | N724: CORP 2 | P724: WILMOTT | R724: LAW | T724: SMITH
A725: PORT MELBOURNE | C725: LE FANNUE 6 | F725: EDWARDS 4 | I725: McBETH 2 | K725: LAHIFF 2 | M725: JONES | N725: BLACKER
A727: CAMBERWELL | C727: 2 | D727: 4 | E727: =C727*6+D727 -> 16 | G727: 7 | H727: 8 | I727: =G727*6+H727 -> 50 | K727: 9 | L727: 11 | M727: =K727*6+L727 -> 65 | O727: 15 | P727: 18 | Q727: =O727*6+P727 -> 108 | S727: WILLIAMSTOWN
A728: WILLIAMSTOWN | C728: 4 | D728: 3 | E728: =C728*6+D728 -> 27 | G728: 5 | H728: 3 | I728: =G728*6+H728 -> 33 | K728: 10 | L728: 7 | M728: =K728*6+L728 -> 67 | O728: 13 | P728: 10 | Q728: =O728*6+P728 -> 88 | S728: HAYES
A729: BEST PLAYERS
A730: CAMBERWELL | C730: NASH | F730: SEELENMEYER | J730: HOPKINS | M730: FARRELLY | P730: ANDERSON | S730: BENNETT
A731: WILLIAMSTOWN | C731: PATERSON | F731: THOMAS | J731: OGDEN | M731: CUTTING | P731: QUINN | S731: McDONOUGH
A732: GOALKICKERS
A733: CAMBERWELL | C733: NASH 8 | F733: ANDERSON 3 | I733: CLAMP 2 | K733: FARRELLY | M733: RANDALL
A734: WILLIAMSTOWN | C734: THOMAS 5 | F734: JAMIESON 3 | I734: VALLENCE 2 | L734: QUINN | N734: GLASS | P734: FITCH
A736: ROUND 14 | E736: 22ND JULY | J736: WEATHER | M736: CLOUDY BUT FINE WEST WIND | S736: PLAYED AT
D737: 1ST QTR | H737: 2ND QTR | L737: 3RD QTR | P737: FINAL | S737: BRUNSWICK
A738: BRUNSWICK | C738: 6 | D738: 5 | E738: =C738*6+D738 -> 41 | G738: 8 | H738: 8 | I738: =G738*6+H738 -> 56 | K738: 12 | L738: 15 | M738: =K738*6+L738 -> 87 | O738: 13 | P738: 17 | Q738: =O738*6+P738 -> 95 | S738: UMPIRE | X738: LADDER | AB738: ROUND | AD738: 14
A739: NORTHCOTE | C739: 1 | D739: 1 | E739: =C739*6+D739 -> 7 | G739: 5 | H739: 4 | I739: =G739*6+H739 -> 34 | K739: 8 | L739: 6 | M739: =K739*6+L739 -> 54 | O739: 10 | P739: 9 | Q739: =O739*6+P739 -> 69 | S739: McALPINE
A740: BEST PLAYERS | W740: TEAM | X740: W | Y740: L | Z740: D | AA740: FOR | AB740: AGST | AC740: % | AD740: PTS
A741: BRUNSWICK | C741: FITZGIBBON | F741: COOPER | J741: McKERNAN | M741: BOYD | P741: McKAY | R741: JONES
A742: NORTHCOTE | C742: RUSH | F742: D BRETHERTON | J742: NEESON | M742: MEITZCKE | P742: SIMPSON | R742: E HART | W742: BRUNSWICK | X742: 13 | Y742: 1 | Z742: 0 | AA742: 1565 | AB742: 1162 | AC742: 134.68158347676419 | AD742: 52
A743: GOALKICKERS | W743: PRAHRAN | X743: 10 | Y743: 4 | Z743: 0 | AA743: 1559 | AB743: 1299 | AC743: 120.01539645881448 | AD743: 40
A744: BRUNSWICK | C744: JONES 5 | F744: McINNES 3 | I744: CRAWFORD 2 | L744: DOWLING 2 | O744: BOYD | W744: NORTHCOTE | X744: 9 | Y744: 5 | Z744: 0 | AA744: 1238 | AB744: 1041 | AC744: 118.92411143131604 | AD744: 36
A745: NORTHCOTE | C745: SEYMOUR 4 | F745: E BRETHERTON 2 | J745: D BRETHERTON | N745: RUSH | P745: NEESON | R745: DOWNIE | W745: CAMBERWELL | X745: 9 | Y745: 5 | Z745: 0 | AA745: 1538 | AB745: 1423 | AC745: 108.08 | AD745: 36
A747: BRIGHTON | C747: 6 | D747: 2 | E747: =C747*6+D747 -> 38 | G747: 7 | H747: 6 | I747: =G747*6+H747 -> 48 | K747: 15 | L747: 13 | M747: =K747*6+L747 -> 103 | O747: 20 | P747: 19 | Q747: =O747*6+P747 -> 139 | S747: ELSTERNWICK PARK | W747: WILLIAMSTOWN | X747: 8 | Y747: 6 | Z747: 0 | AA747: 1544 | AB747: 1352 | AC747: 114.2 | AD747: 32
A748: PRAHRAN | C748: 4 | D748: 2 | E748: =C748*6+D748 -> 26 | G748: 8 | H748: 10 | I748: =G748*6+H748 -> 58 | K748: 10 | L748: 15 | M748: =K748*6+L748 -> 75 | O748: 13 | P748: 18 | Q748: =O748*6+P748 -> 96 | S748: PARRIS | W748: BRIGHTON | X748: 8 | Y748: 6 | Z748: 0 | AA748: 1478 | AB748: 1378 | AC748: 107.25689404934688 | AD748: 32
A749: BEST PLAYERS | W749: COBURG | X749: 7 | Y749: 7 | Z749: 0 | AA749: 1459 | AB749: 1430 | AC749: 102.02797202797203 | AD749: 28
A750: BRIGHTON | C750: HARTNETT | F750: WEBER | I750: BAKER | K750: PENNY | N750: JOHNSON | Q750: GEORGE | W750: YARRAVILLE | X750: 6 | Y750: 8 | Z750: 0 | AA750: 1375 | AB750: 1661 | AC750: 82.78 | AD750: 24
A751: PRAHRAN | C751: DAVEY | F751: JOHNSON | I751: FAUL | K751: SMITH | N751: ROBERTS | Q751: THOMPSON | W751: SANDRINGHAM | X751: 5 | Y751: 9 | Z751: 0 | AA751: 1444 | AB751: 1438 | AC751: 100.41724617524339 | AD751: 20
A752: GOALKICKERS | P752: WEBER | R752: DEANE | W752: PRESTON | X752: 4 | Y752: 10 | Z752: 0 | AA752: 1253 | AB752: 1404 | AC752: 89.245014245014247 | AD752: 16
A753: BRIGHTON | C753: HALLAHAN 5 | F753: PENNY 4 | H753: BIRD 2 | J753: DAVIS 2 | L753: BOLWELL 2 | N753: GODFREY | P753: HARTNETT | R753: MILLER | W753: PORT MELBOURNE | X753: 4 | Y753: 10 | Z753: 0 | AA753: 1223 | AB753: 1517 | AC753: 80.619644034278181 | AD753: 16
A754: PRAHRAN | C754: HAWKINS 6 | F754: DAVEY 3 | H754: THOMPSON 2 | K754: ROLFE | M754: WHITE | W754: OAKLEIGH | X754: 1 | Y754: 13 | Z754: 0 | AA754: 1287 | AB754: 1858 | AC754: 69.268030139935419 | AD754: 4
A756: COBURG | C756: 1 | D756: 4 | E756: =C756*6+D756 -> 10 | G756: 8 | H756: 9 | I756: =G756*6+H756 -> 57 | K756: 12 | L756: 13 | M756: =K756*6+L756 -> 85 | O756: 17 | P756: 18 | Q756: =O756*6+P756 -> 120 | S756: CAMBERWELL
A757: CAMBERWELL | C757: 6 | D757: 4 | E757: =C757*6+D757 -> 40 | G757: 10 | H757: 4 | I757: =G757*6+H757 -> 64 | K757: 14 | L757: 8 | M757: =K757*6+L757 -> 92 | O757: 16 | P757: 15 | Q757: =O757*6+P757 -> 111 | S757: MERRINGTON
A758: BEST PLAYERS
A759: COBURG | C759: COLLINS | E759: YOUNG | H759: SCRIVEN | K759: PRENDERGAST | O759: LITTLE | Q759: BRAGG
A760: CAMBERWELL | C760: NASH | E760: FITCHER | H760: ROGERS | K760: BENNETT | O760: BOND | Q760: HENDERSON
A761: GOALKICKERS
A762: COBURG | C762: COLLINS 9 | F762: LITTLE 2 | H762: YOUNG 2 | J762: PRENDERGAST | M762: SCANLON | O762: LA FRANCHI | R762: LONSDALE
A763: CAMBERWELL | C763: NASH 10 | F763: ANDERSON 2 | I763: BENNETT | K763: CANNINGTON | N763: FARRELLY | Q763: FITCHER
A765: YARRAVILLE | C765: 6 | D765: 3 | E765: =C765*6+D765 -> 39 | G765: 8 | H765: 10 | I765: =G765*6+H765 -> 58 | K765: 14 | L765: 18 | M765: =K765*6+L765 -> 102 | O765: 18 | P765: 19 | Q765: =O765*6+P765 -> 127 | S765: YARRAVILLE
A766: SANDRINGHAM | C766: 2 | D766: 5 | E766: =C766*6+D766 -> 17 | G766: 9 | H766: 6 | I766: =G766*6+H766 -> 60 | K766: 11 | L766: 9 | M766: =K766*6+L766 -> 75 | O766: 13 | P766: 14 | Q766: =O766*6+P766 -> 92 | S766: HAYES
A767: BEST PLAYERS
A768: YARRAVILLE | C768: TURNER | F768: ALSOPP | I768: BONIFACE | L768: GREEN | O768: T SMITH | R768: STREETER
A769: SANDRINGHAM | C769: MITCHELL | F769: STAPLETON | I769: MILLER | L769: CARTWRIGHT | O769: FREY | R769: ANDERSON
A770: GOALKICKERS
A771: YARRAVILLE | C771: T SMITH 7 | F771: TURNER 3 | I771: EVANS 2 | K771: McGRATH 2 | N771: KENNY | P771: McLURE | R771: RIGGS | T771: H SMITH
A772: SANDRINGHAM | C772: WEBER 5 | F772: RYAN 2 | I772: ANDERSON 2 | L772: BUCHANAN 2 | O772: V SMITH | Q772: KENT
A774: PRESTON | C774: 5 | D774: 10 | E774: =C774*6+D774 -> 40 | G774: 7 | H774: 13 | I774: =G774*6+H774 -> 55 | K774: 14 | L774: 17 | M774: =K774*6+L774 -> 101 | O774: 17 | P774: 19 | Q774: =O774*6+P774 -> 121 | S774: PORT MELBOURNE
A775: PORT MELBOURNE | C775: 2 | D775: 1 | E775: =C775*6+D775 -> 13 | G775: 6 | H775: 4 | I775: =G775*6+H775 -> 40 | K775: 8 | L775: 6 | M775: =K775*6+L775 -> 54 | O775: 14 | P775: 10 | Q775: =O775*6+P775 -> 94 | S775: DWYER
A776: BEST PLAYERS
A777: PRESTON | C777: MILLER | F777: WHITE | I777: DOWLING | L777: NORMAN | O777: BEAGLEY | R777: ROACH
A778: PORT MELBOURNE | C778: GOLDSMITH | F778: LAHIFF | I778: DOBSON | L778: GOSS | O778: FLETCHER | R778: JULIER
A779: GOALKICKERS
A780: PRESTON | C780: WHITE 3 | F780: CLARKE 3 | I780: DUNSTONE 3 | L780: MORRISON 2 | O780: BEAGLEY 2 | R780: MILLER 2 | U780: DUNHAM | X780: ROSS
A781: PORT MELBOURNE | C781: FREYER 3 | F781: LA FANNUE 2 | I781: GOSS 2 | K781: LEE 2 | M781: LAHIFF | O781: BLACKER | Q781: REYNOLDS | T781: WOODS | V781: EDWARDS
A783: WILLIAMSTOWN | C783: 5 | D783: 7 | E783: =C783*6+D783 -> 37 | G783: 11 | H783: 13 | I783: =G783*6+H783 -> 79 | K783: 22 | L783: 21 | M783: =K783*6+L783 -> 153 | O783: 25 | P783: 24 | Q783: =O783*6+P783 -> 174 | S783: OAKLEIGH
A784: OAKLEIGH | C784: 3 | D784: 2 | E784: =C784*6+D784 -> 20 | G784: 7 | H784: 9 | I784: =G784*6+H784 -> 51 | K784: 8 | L784: 12 | M784: =K784*6+L784 -> 60 | O784: 12 | P784: 16 | Q784: =O784*6+P784 -> 88 | S784: GREGORY
A785: BEST PLAYERS
A786: WILLIAMSTOWN | C786: VALLENCE | F786: McDONOUGH | I786: McTAGGART | L786: OGDEN | O786: CUTTING | Q786: CAVE
A787: OAKLEIGH | C787: WILMOTT | F787: SMITH | I787: ASH | L787: DOWLER | O787: LAW | Q787: CORP
A788: GOALKICKERS
A789: WILLIAMSTOWN | C789: VALLENCE 18 | F789: THOMAS 2 | I789: PATERSON | L789: FITCH | N789: MALONEY | Q789: McTAGGART | T789: GLASS
A790: OAKLEIGH | C790: DOWLER 3 | F790: CORP 3 | I790: CAMPBELL 3 | L790: SMITH 2 | N790: WILMOTT
A792: ROUND 15 | E792: 29TH JULY | J792: WEATHER | M792: FINE MILD N.W. BREEZE | S792: PLAYED AT
D793: 1ST QTR | H793: 2ND QTR | L793: 3RD QTR | P793: FINAL | S793: TOORAK PARK
A794: BRUNSWICK | C794: 2 | D794: 3 | E794: =C794*6+D794 -> 15 | G794: 4 | H794: 7 | I794: =G794*6+H794 -> 31 | K794: 9 | L794: 15 | M794: =K794*6+L794 -> 69 | O794: 17 | P794: 21 | Q794: =O794*6+P794 -> 123 | S794: UMPIRE | X794: LADDER | AB794: ROUND | AD794: 15
A795: PRAHRAN | C795: 8 | D795: 2 | E795: =C795*6+D795 -> 50 | G795: 11 | H795: 6 | I795: =G795*6+H795 -> 72 | K795: 16 | L795: 9 | M795: =K795*6+L795 -> 105 | O795: 18 | P795: 9 | Q795: =O795*6+P795 -> 117 | S795: PARRIS
A796: BEST PLAYERS | W796: TEAM | X796: W | Y796: L | Z796: D | AA796: FOR | AB796: AGST | AC796: % | AD796: PTS
A797: BRUNSWICK | C797: DOWLING | F797: JONES | I797: McINNES | L797: McGRATH | O797: HOBBA | Q797: DAVIS
A798: PRAHRAN | C798: JOHNSON | F798: FAUL | I798: FLEMING | L798: THOMPSON | O798: DAVEY | Q798: HAWKINS | W798: BRUNSWICK | X798: 14 | Y798: 1 | Z798: 0 | AA798: 1688 | AB798: 1279 | AC798: 131.97810789679437 | AD798: 56
A799: GOALKICKERS | W799: NORTHCOTE | X799: 10 | Y799: 5 | Z799: 0 | AA799: 1393 | AB799: 1113 | AC799: 125.15723270440252 | AD799: 40
A800: BRUNSWICK | C800: JONES 7 | E800: McINNES 5 | H800: McGRATH 2 | K800: FITZGIBBON | N800: DOWLING | Q800: CRAWFORD | W800: PRAHRAN | X800: 10 | Y800: 5 | Z800: 0 | AA800: 1676 | AB800: 1422 | AC800: 117.86216596343179 | AD800: 40
A801: PRAHRAN | C801: HAWKINS 6 | F801: PROBYN 3 | I801: WHITE 3 | K801: ROLFE 2 | M801: DAVEY | O801: GRAVELL | Q801: BOURNE | S801: BRENCHLEY | W801: CAMBERWELL | X801: 10 | Y801: 5 | Z801: 0 | AA801: 1670 | AB801: 1506 | AC801: 110.89 | AD801: 40
A803: NORTHCOTE | C803: 6 | D803: 4 | E803: =C803*6+D803 -> 40 | G803: 13 | H803: 12 | I803: =G803*6+H803 -> 90 | K803: 18 | L803: 14 | M803: =K803*6+L803 -> 122 | O803: 23 | P803: 17 | Q803: =O803*6+P803 -> 155 | S803: OLYMPIC PK | W803: WILLIAMSTOWN | X803: 9 | Y803: 6 | Z803: 0 | AA803: 1678 | AB803: 1434 | AC803: 117.02 | AD803: 36
A804: YARRAVILLE | C804: 2 | D804: 2 | E804: =C804*6+D804 -> 14 | G804: 4 | H804: 2 | I804: =G804*6+H804 -> 26 | K804: 9 | L804: 4 | M804: =K804*6+L804 -> 58 | O804: 11 | P804: 6 | Q804: =O804*6+P804 -> 72 | S804: DWYER | W804: COBURG | X804: 8 | Y804: 7 | Z804: 0 | AA804: 1597 | AB804: 1477 | AC804: 108.124576844956 | AD804: 32
A805: BEST PLAYERS | W805: BRIGHTON | X805: 8 | Y805: 7 | Z805: 0 | AA805: 1560 | AB805: 1505 | AC805: 103.65 | AD805: 32
A806: NORTHCOTE | C806: E HART | E806: E BRETHERTON | I806: SEYMOUR | L806: RUSH | N806: ACKLAND | Q806: POWELL | W806: YARRAVILLE | X806: 6 | Y806: 9 | Z806: 0 | AA806: 1447 | AB806: 1816 | AC806: 79.68 | AD806: 24
A807: YARRAVILLE | C807: EVANS | E807: TURNER | I807: B ANDERSON | L807: H SMITH | N807: STREETER | Q807: ALSOPP | W807: SANDRINGHAM | X807: 5 | Y807: 10 | Z807: 0 | AA807: 1527 | AB807: 1570 | AC807: 97.261146496815286 | AD807: 20
A808: GOALKICKERS | W808: PRESTON | X808: 5 | Y808: 10 | Z808: 0 | AA808: 1380 | AB808: 1486 | AC808: 92.87 | AD808: 20
A809: NORTHCOTE | C809: SEYMOUR 9 | F809: RUSH 4 | H809: E BRETHERTON 3 | L809: HISCOX 3 | N809: NEESON 2 | Q809: OLVER | S809: MEITZCKE | W809: PORT MELBOURNE | X809: 4 | Y809: 11 | Z809: 0 | AA809: 1305 | AB809: 1651 | AC809: 79.043004239854639 | AD809: 16
A810: YARRAVILLE | C810: TURNER 4 | F810: EVANS 3 | I810: GRAY | J810: T SMITH | L810: GREEN | N810: RIGGS | W810: OAKLEIGH | X810: 1 | Y810: 14 | Z810: 0 | AA810: 1334 | AB810: 1996 | AC810: 66.833667334669343 | AD810: 4
A812: CAMBERWELL | C812: 7 | D812: 5 | E812: =C812*6+D812 -> 47 | G812: 9 | H812: 7 | I812: =G812*6+H812 -> 61 | K812: 16 | L812: 17 | M812: =K812*6+L812 -> 113 | O812: 19 | P812: 18 | Q812: =O812*6+P812 -> 132 | S812: BEACH ROAD
A813: SANDRINGHAM | C813: 4 | D813: 2 | E813: =C813*6+D813 -> 26 | G813: 4 | H813: 8 | I813: =G813*6+H813 -> 32 | K813: 7 | L813: 10 | M813: =K813*6+L813 -> 52 | O813: 11 | P813: 17 | Q813: =O813*6+P813 -> 83 | S813: PAGE
A814: BEST PLAYERS
A815: CAMBERWELL | C815: BENNETT | F815: NASH | I815: ANDERSON | L815: SEELENMEYER | P815: FARRELLY | S815: RANDALL
A816: SANDRINGHAM | C816: MILLER | F816: FREY | I816: WEBER | L816: ALLISTER | P816: RYAN | S816: KENT
A817: GOALKICKERS
A818: CAMBERWELL | C818: NASH 8 | F818: FARRELLY 3 | I818: ANDERSON 3 | L818: BENNETT 2 | O818: RANDALL 2 | R818: CLAMP
A819: SANDRINGHAM | C819: ALLISTER 4 | F819: S ANDERSON 2 | J819: McINTYRE 2 | M819: WEBER | O819: CARTWRIGHT | R819: RYAN
A821: PRESTON | C821: 1 | D821: 4 | E821: =C821*6+D821 -> 10 | G821: 9 | H821: 11 | I821: =G821*6+H821 -> 65 | K821: 13 | L821: 13 | M821: =K821*6+L821 -> 91 | O821: 18 | P821: 19 | Q821: =O821*6+P821 -> 127 | S821: PRESTON
A822: BRIGHTON | C822: 5 | D822: 6 | E822: =C822*6+D822 -> 36 | G822: 6 | H822: 11 | I822: =G822*6+H822 -> 47 | K822: 9 | L822: 12 | M822: =K822*6+L822 -> 66 | O822: 11 | P822: 16 | Q822: =O822*6+P822 -> 82 | S822: MERRINGTON
A823: BEST PLAYERS
A824: PRESTON | C824: GRAY | F824: ROSS | I824: DUNSTONE | L824: DOWLING | O824: BEAGLEY | Q824: JOB
A825: BRIGHTON | C825: JOHNSON | F825: GEORGE | I825: HINDSON | L825: BAKER | O825: WEBER | Q825: GODFREY
A826: GOALKICKERS
A827: PRESTON | C827: DUNSTONE 4 | F827: ROSS 4 | H827: CLARKE 3 | K827: DUNHAM 2 | N827: MORRISON 2 | Q827: MILLER | S827: JONES | U827: NORMAN
A828: BRIGHTON | C828: BIRD 3 | F828: HALLAHAN 3 | I828: PENNY | K828: BOLWELL | M828: DEANE | O828: GODFREY | Q828: HARTNETT
A830: WILLIAMSTOWN | C830: 3 | D830: 3 | E830: =C830*6+D830 -> 21 | G830: 9 | H830: 6 | I830: =G830*6+H830 -> 60 | K830: 14 | L830: 10 | M830: =K830*6+L830 -> 94 | O830: 20 | P830: 14 | Q830: =O830*6+P830 -> 134 | S830: WILLIAMSTOWN
A831: PORT MELBOURNE | C831: 4 | D831: 1 | E831: =C831*6+D831 -> 25 | G831: 9 | H831: 4 | I831: =G831*6+H831 -> 58 | K831: 10 | L831: 6 | M831: =K831*6+L831 -> 66 | O831: 12 | P831: 10 | Q831: =O831*6+P831 -> 82 | S831: McALPINE
A832: BEST PLAYERS
A833: WILLIAMSTOWN | C833: CUTTING | F833: WILCOX | I833: McDONOUGH | L833: THOMAS | O833: OGDEN | R833: McTAGGART
A834: PORT MELBOURNE | C834: GOLDSMITH | F834: DOBSON | I834: ALSOP | L834: REYNOLDS | O834: RICHES | R834: WOODS
A835: GOALKICKERS
A836: WILLIAMSTOWN | C836: VALLENCE 6 | F836: JAMIESON 3 | I836: THOMAS 3 | L836: PATERSON 3 | O836: McTAGGART 2 | R836: GLASS | T836: MALONEY | W836: CAVE
A837: PORT MELBOURNE | C837: LE FANNUE 3 | F837: FREYER 2 | I837: LAHIFF 2 | L837: RICHES 2 | N837: ALSOP | P837: EDWARDS | S837: BLOOMER
A839: COBURG | C839: 6 | D839: 5 | E839: =C839*6+D839 -> 41 | G839: 10 | H839: 6 | I839: =G839*6+H839 -> 66 | K839: 16 | L839: 13 | M839: =K839*6+L839 -> 109 | O839: 20 | P839: 18 | Q839: =O839*6+P839 -> 138 | S839: COBURG
A840: OAKLEIGH | C840: 1 | D840: 0 | E840: =C840*6+D840 -> 6 | G840: 2 | H840: 6 | I840: =G840*6+H840 -> 18 | K840: 2 | L840: 6 | M840: =K840*6+L840 -> 18 | O840: 6 | P840: 11 | Q840: =O840*6+P840 -> 47 | S840: GREGORY
A841: BEST PLAYERS
A842: COBURG | C842: LA FRANCHI | F842: YOUNG | I842: JOHNSON | L842: JORDAN | O842: PRENDERGAST | R842: LITTLE
A843: OAKLEIGH | C843: BELL | F843: ASH | I843: CORP | L843: F HUTCHESON | O843: WILLIAMS | R843: LAW
A844: GOALKICKERS
A845: COBURG | C845: COLLINS 7 | F845: JOHNSON 4 | I845: LA FRANCHI 3 | L845: YOUNG 2 | N845: LONSDALE 2 | Q845: LITTLE | S845: PRENDERGAST
A846: OAKLEIGH | C846: CORP 2 | F846: WILSON | I846: THOMPSON | M846: EVANS | O846: LAW
A848: ROUND 16 | E848: 5TH AUGUST | J848: WEATHER | M848: CLOUDY S.E.BREEZE GROUNDS BAD | S848: PLAYED AT
D849: 1ST QTR | H849: 2ND QTR | L849: 3RD QTR | P849: FINAL | S849: CAMBERWELL
A850: NORTHCOTE | C850: 10 | D850: 1 | E850: =C850*6+D850 -> 61 | G850: 11 | H850: 4 | I850: =G850*6+H850 -> 70 | K850: 15 | L850: 7 | M850: =K850*6+L850 -> 97 | O850: 18 | P850: 10 | Q850: =O850*6+P850 -> 118 | S850: UMPIRE | X850: LADDER | AB850: ROUND | AD850: 16
A851: CAMBERWELL | C851: 5 | D851: 1 | E851: =C851*6+D851 -> 31 | G851: 11 | H851: 3 | I851: =G851*6+H851 -> 69 | K851: 14 | L851: 5 | M851: =K851*6+L851 -> 89 | O851: 17 | P851: 7 | Q851: =O851*6+P851 -> 109 | S851: MERRINGTON
A852: BEST PLAYERS | W852: TEAM | X852: W | Y852: L | Z852: D | AA852: FOR | AB852: AGST | AC852: % | AD852: PTS
A853: NORTHCOTE | C853: NEESON | E853: WEGNER | H853: SIMPSON | K853: MEITZCKE | N853: DRYDEN | Q853: HISCOX
A854: CAMBERWELL | C854: FINN | E854: CLAMP | H854: NASH | K854: HORKINGS | N854: BENNETT | Q854: BOND | W854: BRUNSWICK | X854: 14 | Y854: 2 | Z854: 0 | AA854: 1750 | AB854: 1343 | AC854: 130.30528667163068 | AD854: 56
A855: GOALKICKERS | W855: NORTHCOTE | X855: 11 | Y855: 5 | Z855: 0 | AA855: 1511 | AB855: 1222 | AC855: 123.64975450081833 | AD855: 44
A856: NORTHCOTE | C856: NEESON 9 | E856: DOWNIE 3 | G856: SIMPSON 2 | J856: E BRETHERTON | M856: SEYMOUR | O856: WEGNER | Q856: HISCOX | W856: PRAHRAN | X856: 11 | Y856: 5 | Z856: 0 | AA856: 1828 | AB856: 1529 | AC856: 119.55526487900589 | AD856: 44
A857: CAMBERWELL | C857: NASH 4 | E857: CLAMP 4 | G857: FINN 2 | I857: FARRELLY 2 | L857: ANDERSON 2 | O857: FORD | Q857: BROWN | S857: DURAND | W857: WILLIAMSTOWN | X857: 10 | Y857: 6 | Z857: 0 | AA857: 1790 | AB857: 1511 | AC857: 118.46 | AD857: 40
A859: WILLIAMSTOWN | C859: 5 | D859: 6 | E859: =C859*6+D859 -> 36 | G859: 7 | H859: 8 | I859: =G859*6+H859 -> 50 | K859: 12 | L859: 14 | M859: =K859*6+L859 -> 86 | O859: 16 | P859: 16 | Q859: =O859*6+P859 -> 112 | S859: WILLIAMSTOWN | W859: CAMBERWELL | X859: 10 | Y859: 6 | Z859: 0 | AA859: 1779 | AB859: 1624 | AC859: 109.54 | AD859: 40
A860: COBURG | C860: 3 | D860: 2 | E860: =C860*6+D860 -> 20 | G860: 8 | H860: 8 | I860: =G860*6+H860 -> 56 | K860: 9 | L860: 12 | M860: =K860*6+L860 -> 66 | O860: 10 | P860: 17 | Q860: =O860*6+P860 -> 77 | S860: LEWIS | W860: BRIGHTON | X860: 9 | Y860: 7 | Z860: 0 | AA860: 1683 | AB860: 1590 | AC860: 105.85 | AD860: 36
A861: BEST PLAYERS | W861: COBURG | X861: 8 | Y861: 8 | Z861: 0 | AA861: 1674 | AB861: 1589 | AC861: 105.34927627438641 | AD861: 32
A862: WILLIAMSTOWN | C862: McDONOUGH | F862: WILCOX | I862: PATERSON | L862: QUINN | O862: FITCH | Q862: GLASS | W862: SANDRINGHAM | X862: 6 | Y862: 10 | Z862: 0 | AA862: 1649 | AB862: 1642 | AC862: 100.42630937880634 | AD862: 24
A863: COBURG | C863: BRAGG | F863: RE | I863: SCANLON | L863: JORDAN | O863: PERRETT | Q863: HALL | W863: PRESTON | X863: 6 | Y863: 10 | Z863: 0 | AA863: 1444 | AB863: 1548 | AC863: 93.28 | AD863: 24
A864: GOALKICKERS | W864: YARRAVILLE | X864: 6 | Y864: 10 | Z864: 0 | AA864: 1554 | AB864: 1968 | AC864: 78.96 | AD864: 24
A865: WILLIAMSTOWN | C865: VALLENCE 5 | F865: THOMAS 3 | I865: JAMIESON 3 | L865: QUINN 2 | N865: SPOKES | P865: McTAGGART | S865: PATERSON | W865: PORT MELBOURNE | X865: 4 | Y865: 12 | Z865: 0 | AA865: 1390 | AB865: 1774 | AC865: 78.354002254791425 | AD865: 16
A866: COBURG | C866: PERRETT 3 | F866: JORDAN 2 | I866: YOUNG | K866: LA FRANCHI | N866: JOHNSON | P866: LITTLE | R866: GILLON | W866: OAKLEIGH | X866: 1 | Y866: 15 | Z866: 0 | AA866: 1406 | AB866: 2118 | AC866: 66.3833805476865 | AD866: 4
A868: PRAHRAN | C868: 3 | D868: 3 | E868: =C868*6+D868 -> 21 | G868: 10 | H868: 6 | I868: =G868*6+H868 -> 66 | K868: 15 | L868: 7 | M868: =K868*6+L868 -> 97 | O868: 24 | P868: 8 | Q868: =O868*6+P868 -> 152 | S868: YARRAVILLE
A869: YARRAVILLE | C869: 1 | D869: 3 | E869: =C869*6+D869 -> 9 | G869: 3 | H869: 5 | I869: =G869*6+H869 -> 23 | K869: 8 | L869: 8 | M869: =K869*6+L869 -> 56 | O869: 16 | P869: 11 | Q869: =O869*6+P869 -> 107 | S869: GREGORY
A870: BEST PLAYERS
A871: PRAHRAN | C871: HAWKINS | F871: WHITE | I871: GRAVELL | L871: DAVEY | O871: BRENCHLEY | R871: FAUL
A872: YARRAVILLE | C872: WEDGWOOD | F872: TURNER | I872: HOPKINS | L872: BONIFACE | O872: PLUMMER | R872: RIGGS
A873: GOALKICKERS
A874: PRAHRAN | C874: HAWKINS 12 | F874: WHITE 4 | I874: PROBYN 3 | L874: DAVEY 2 | O874: ROLFE 2 | R874: GRAVELL
A875: YARRAVILLE | C875: TURNER 7 | F875: LUKE 5 | I875: T SMITH 2 | L875: RIGGS | O875: KENNY
A877: BRIGHTON | C877: 6 | D877: 8 | E877: =C877*6+D877 -> 44 | G877: 7 | H877: 15 | I877: =G877*6+H877 -> 57 | K877: 13 | L877: 22 | M877: =K877*6+L877 -> 100 | O877: 16 | P877: 27 | Q877: =O877*6+P877 -> 123 | S877: PORT MELBOURNE
A878: PORT MELBOURNE | C878: 1 | D878: 4 | E878: =C878*6+D878 -> 10 | G878: 6 | H878: 7 | I878: =G878*6+H878 -> 43 | K878: 8 | L878: 8 | M878: =K878*6+L878 -> 56 | O878: 12 | P878: 13 | Q878: =O878*6+P878 -> 85 | S878: PARRIS
A879: BEST PLAYERS
A880: BRIGHTON | C880: BIRD | E880: PENNY | H880: GEORGE | K880: HENDER | N880: JIM HALLAHAN | Q880: WEBER
A881: PORT MELBOURNE | C881: FREYER | E881: DOBSON | H881: GOSS | K881: FLETCHER | N881: LAHIFF | Q881: GOLDSMITH
A882: GOALKICKERS
A883: BRIGHTON | C883: JIM HALLAHAN 7 | G883: BIRD 6 | I883: HENDER | K883: PENNY | M883: BAKER
A884: PORT MELBOURNE | C884: FREYER 5 | F884: LE FANNUE 3 | I884: OLSEN | K884: LAHIFF | M884: MARSHALL | P884: RICHES
A886: SANDRINGHAM | C886: 4 | D886: 5 | E886: =C886*6+D886 -> 29 | G886: 10 | H886: 7 | I886: =G886*6+H886 -> 67 | K886: 13 | L886: 10 | M886: =K886*6+L886 -> 88 | O886: 18 | P886: 14 | Q886: =O886*6+P886 -> 122 | S886: OAKLEIGH
A887: OAKLEIGH | C887: 3 | D887: 5 | E887: =C887*6+D887 -> 23 | G887: 4 | H887: 11 | I887: =G887*6+H887 -> 35 | K887: 8 | L887: 17 | M887: =K887*6+L887 -> 65 | O887: 9 | P887: 18 | Q887: =O887*6+P887 -> 72 | S887: McALPINE
A888: BEST PLAYERS
A889: SANDRINGHAM | C889: MITCHELL | F889: FREY | I889: LUDLOW | L889: STAPLETON | O889: SAUNDERS | R889: RYAN
A890: OAKLEIGH | C890: WILLIAMS | F890: McDERMOTT | I890: BELL | L890: WILSON | O890: ASH | R890: DOWLER
A891: GOALKICKERS
A892: SANDRINGHAM | C892: ALLISTER 4 | F892: FISHER 4 | I892: CARTWRIGHT 3 | L892: S ANDERSON 3 | O892: KENT | Q892: MILLER | S892: A ANDERSON
A893: OAKLEIGH | C893: DOWLER 4 | F893: F HUTCHESON 2 | J893: WILMOTT 2 | M893: CORP
A895: PRESTON | C895: 3 | D895: 4 | E895: =C895*6+D895 -> 22 | G895: 4 | H895: 7 | I895: =G895*6+H895 -> 31 | K895: 7 | L895: 9 | M895: =K895*6+L895 -> 51 | O895: 9 | P895: 10 | Q895: =O895*6+P895 -> 64 | S895: BRUNSWICK
A896: BRUNSWICK | C896: 4 | D896: 6 | E896: =C896*6+D896 -> 30 | G896: 6 | H896: 9 | I896: =G896*6+H896 -> 45 | K896: 6 | L896: 12 | M896: =K896*6+L896 -> 48 | O896: 8 | P896: 14 | Q896: =O896*6+P896 -> 62 | S896: LESTER
A897: BEST PLAYERS
A898: PRESTON | C898: ROSS | E898: MILLER | H898: MORRISON | K898: SLEITH | N898: ROACH | Q898: JOB
A899: BRUNSWICK | C899: QUINN | E899: CHALLENGER | H899: FAY | K899: COOPER | N899: BOYD | Q899: CRAWFORD
A900: GOALKICKERS
A901: PRESTON | C901: MILLER 4 | F901: ROSS 2 | H901: CLARKE 2 | K901: DUNHAM
A902: BRUNSWICK | C902: DOWLING 3 | F902: QUINN | H902: POWELL | J902: JONES | L902: McINNES | N902: FLETT
A904: ROUND 17 | E904: 12TH AUGUST | H904: WEATHER | K904: CLOUDY BUT FINE S WIND GROUNDS MUDDY | S904: PLAYED AT
D905: 1ST QTR | H905: 2ND QTR | L905: 3RD QTR | P905: FINAL | S905: TOORAK PARK
A906: PRAHRAN | C906: 2 | D906: 2 | E906: =C906*6+D906 -> 14 | G906: 10 | H906: 6 | I906: =G906*6+H906 -> 66 | K906: 21 | L906: 8 | M906: =K906*6+L906 -> 134 | O906: 30 | P906: 8 | Q906: =O906*6+P906 -> 188 | S906: UMPIRE | X906: LADDER | AB906: ROUND | AD906: 17
A907: CAMBERWELL | C907: 3 | D907: 6 | E907: =C907*6+D907 -> 24 | G907: 4 | H907: 9 | I907: =G907*6+H907 -> 33 | K907: 9 | L907: 10 | M907: =K907*6+L907 -> 64 | O907: 10 | P907: 13 | Q907: =O907*6+P907 -> 73 | S907: DWYER
A908: BEST PLAYERS | W908: TEAM | X908: W | Y908: L | Z908: D | AA908: FOR | AB908: AGST | AC908: % | AD908: PTS
A909: PRAHRAN | C909: DAVEY | F909: PEARCE | I909: HAWKINS | L909: THOMPSON | O909: FLEMING | Q909: BOURNE
A910: CAMBERWELL | C910: DURAND | F910: ROGERS | I910: MILNE | L910: HORKINGS | O910: NASH | Q910: CANNINGTON | W910: BRUNSWICK | X910: 14 | Y910: 3 | Z910: 0 | AA910: 1830 | AB910: 1435 | AC910: 127.53 | AD910: 56
A911: GOALKICKERS | W911: NORTHCOTE | X911: 12 | Y911: 5 | Z911: 0 | AA911: 1673 | AB911: 1292 | AC911: 129.48916408668731 | AD911: 48
A912: PRAHRAN | C912: HAWKINS 13 | F912: DAVEY 4 | H912: THOMPSON 4 | K912: PROBYN 3 | M912: BRENCHLEY 3 | P912: GRAVELL 2 | R912: FLEMING | W912: PRAHRAN | X912: 12 | Y912: 5 | Z912: 0 | AA912: 2016 | AB912: 1602 | AC912: 125.84269662921348 | AD912: 48
A913: CAMBERWELL | C913: CANNINGTON 2 | F913: NASH 2 | H913: SEELENMEYER 2 | K913: ANDERSON 2 | N913: BENNETT | P913: FARRELLY | W913: WILLIAMSTOWN | X913: 11 | Y913: 6 | Z913: 0 | AA913: 1899 | AB913: 1590 | AC913: 119.43 | AD913: 44
A915: BRIGHTON | C915: 5 | D915: 3 | E915: =C915*6+D915 -> 33 | G915: 8 | H915: 5 | I915: =G915*6+H915 -> 53 | K915: 10 | L915: 11 | M915: =K915*6+L915 -> 71 | O915: 13 | P915: 14 | Q915: =O915*6+P915 -> 92 | S915: ELSTERNWICK PARK | W915: BRIGHTON | X915: 10 | Y915: 7 | Z915: 0 | AA915: 1775 | AB915: 1670 | AC915: 106.29 | AD915: 40
A916: BRUNSWICK | C916: 3 | D916: 4 | E916: =C916*6+D916 -> 22 | G916: 6 | H916: 8 | I916: =G916*6+H916 -> 44 | K916: 9 | L916: 10 | M916: =K916*6+L916 -> 64 | O916: 11 | P916: 14 | Q916: =O916*6+P916 -> 80 | S916: GREGORY | W916: CAMBERWELL | X916: 10 | Y916: 7 | Z916: 0 | AA916: 1852 | AB916: 1812 | AC916: 102.29 | AD916: 40
A917: BEST PLAYERS | W917: COBURG | X917: 9 | Y917: 8 | Z917: 0 | AA917: 1818 | AB917: 1673 | AC917: 108.67 | AD917: 36
A918: BRIGHTON | C918: HARTNETT | F918: PENNY | I918: BIRD | K918: JOHNSON | N918: WILLIAMSON | Q918: DAVIS | W918: PRESTON | X918: 7 | Y918: 10 | Z918: 0 | AA918: 1559 | AB918: 1610 | AC918: 96.83 | AD918: 28
A919: BRUNSWICK | C919: BOYD | F919: GARDNER | I919: DAVIS | K919: McGRATH | N919: FAY | Q919: HOBBA | W919: SANDRINGHAM | X919: 6 | Y919: 11 | Z919: 0 | AA919: 1728 | AB919: 1751 | AC919: 98.686464877213027 | AD919: 24
A920: GOALKICKERS | W920: YARRAVILLE | X920: 6 | Y920: 11 | Z920: 0 | AA920: 1616 | AB920: 2083 | AC920: 77.58 | AD920: 24
A921: BRIGHTON | C921: JIM HALLAHAN 3 | G921: HENDER 2 | I921: DAVIS 2 | K921: PENNY 2 | M921: BIRD 2 | O921: WEBER | W921: PORT MELBOURNE | X921: 4 | Y921: 13 | Z921: 0 | AA921: 1474 | AB921: 1918 | AC921: 76.85 | AD921: 16
A922: BRUNSWICK | C922: JONES 3 | E922: BOYD 2 | G922: McGRATH | I922: McINNES | K922: BAILEY | M922: FLETT | O922: QUINN | Q922: FITZGIBBON | W922: OAKLEIGH | X922: 1 | Y922: 16 | Z922: 0 | AA922: 1476 | AB922: 2280 | AC922: 64.736842105263165 | AD922: 4
A924: WILLIAMSTOWN | C924: 3 | D924: 4 | E924: =C924*6+D924 -> 22 | G924: 11 | H924: 7 | I924: =G924*6+H924 -> 73 | K924: 13 | L924: 13 | M924: =K924*6+L924 -> 91 | O924: 16 | P924: 13 | Q924: =O924*6+P924 -> 109 | S924: BEACH ROAD
A925: SANDRINGHAM | C925: 4 | D925: 3 | E925: =C925*6+D925 -> 27 | G925: 8 | H925: 3 | I925: =G925*6+H925 -> 51 | K925: 10 | L925: 4 | M925: =K925*6+L925 -> 64 | O925: 12 | P925: 7 | Q925: =O925*6+P925 -> 79 | S925: PARRIS
A926: BEST PLAYERS
A927: WILLIAMSTOWN | C927: WILCOX | F927: CUTTING | I927: THOMAS | L927: PATERSON | O927: CAVE | Q927: McDONOUGH
A928: SANDRINGHAM | C928: CARTWRIGHT | F928: SAUNDERS | I928: MITCHELL | L928: STAPLETON | O928: FISHER | Q928: MILLER
A929: GOALKICKERS
A930: WILLIAMSTOWN | C930: VALLENCE 5 | F930: PATERSON 3 | I930: JAMIESON 2 | L930: CAVE 2 | N930: SPOKES | P930: QUINN | R930: GLASS | T930: McTAGGART
A931: SANDRINGHAM | C931: FISHER 4 | F931: ALLISTER 2 | I931: LUDLOW 2 | L931: A ANDERSON | O931: McINTYRE | Q931: KENT | S931: CARTWRIGHT
A933: COBURG | C933: 3 | D933: 5 | E933: =C933*6+D933 -> 23 | G933: 8 | H933: 11 | I933: =G933*6+H933 -> 59 | K933: 13 | L933: 17 | M933: =K933*6+L933 -> 95 | O933: 21 | P933: 18 | Q933: =O933*6+P933 -> 144 | S933: COBURG
A934: PORT MELBOURNE | C934: 3 | D934: 5 | E934: =C934*6+D934 -> 23 | G934: 6 | H934: 7 | I934: =G934*6+H934 -> 43 | K934: 10 | L934: 10 | M934: =K934*6+L934 -> 70 | O934: 12 | P934: 12 | Q934: =O934*6+P934 -> 84 | S934: HAYES
A935: BEST PLAYERS
A936: COBURG | C936: LITTLE | F936: JOHNSON | I936: JORDAN | L936: SCANLON | O936: ATKINSON | R936: BRAGG
A937: PORT MELBOURNE | C937: FLETCHER | F937: GOLDSMITH | I937: JOHNSON | L937: JULIER | O937: ALSOP | R937: LEE
A938: GOALKICKERS
A939: COBURG | C939: COLLINS 13 | F939: JOHNSON 3 | I939: YOUNG | K939: LA FRANCHI | N939: LITTLE | P939: WHITE | R939: TOONE
A940: PORT MELBOURNE | C940: COSHAN 6 | F940: LAHIFF 2 | I940: FREYER | K940: GOLDSMITH | N940: GOSS | P940: REYNOLDS
A942: PRESTON | C942: 4 | D942: 6 | E942: =C942*6+D942 -> 30 | G942: 7 | H942: 10 | I942: =G942*6+H942 -> 52 | K942: 12 | L942: 13 | M942: =K942*6+L942 -> 85 | O942: 17 | P942: 13 | Q942: =O942*6+P942 -> 115 | S942: PRESTON
A943: YARRAVILLE | C943: 2 | D943: 0 | E943: =C943*6+D943 -> 12 | G943: 5 | H943: 5 | I943: =G943*6+H943 -> 35 | K943: 6 | L943: 6 | M943: =K943*6+L943 -> 42 | O943: 9 | P943: 8 | Q943: =O943*6+P943 -> 62 | S943: MERRINGTON
A944: BEST PLAYERS
A945: PRESTON | C945: JOB | F945: BEAGLEY | I945: MILLER | L945: GRAY | O945: HANSCOMBE | R945: CLARKE
A946: YARRAVILLE | C946: HOPKINS | F946: PLUMMER | I946: KELLY | L946: REDPATH | O946: McLURE | R946: McGRATH
A947: GOALKICKERS
A948: PRESTON | C948: MILLER 4 | F948: DUNHAM 3 | I948: CLARKE 3 | K948: ROSS 2 | M948: SEEDSMAN 2 | P948: MORRISON | R948: DUNSTONE | U948: BEAGLEY
A949: YARRAVILLE | C949: McLURE 5 | F949: TURNER 2 | I949: EVANS | K949: ALSOPP
A951: NORTHCOTE | C951: 5 | D951: 4 | E951: =C951*6+D951 -> 34 | G951: 12 | H951: 5 | I951: =G951*6+H951 -> 77 | K951: 22 | L951: 6 | M951: =K951*6+L951 -> 138 | O951: 25 | P951: 12 | Q951: =O951*6+P951 -> 162 | S951: OLYMPIC PK
A952: OAKLEIGH | C952: 3 | D952: 2 | E952: =C952*6+D952 -> 20 | G952: 6 | H952: 7 | I952: =G952*6+H952 -> 43 | K952: 8 | L952: 8 | M952: =K952*6+L952 -> 56 | O952: 10 | P952: 10 | Q952: =O952*6+P952 -> 70 | S952: McALPINE
A953: BEST PLAYERS
A954: NORTHCOTE | C954: HART | F954: SEYMOUR | I954: MEITZCKE | L954: HISCOX | O954: POWELL | Q954: WATT
A955: OAKLEIGH | C955: BICKERTON | F955: WILLIAMS | I955: BELL | L955: LAW | O955: NOLAN | Q955: DOWLER
A956: GOALKICKERS
A957: NORTHCOTE | C957: SEYMOUR 9 | F957: NEESON 4 | I957: E BRETHERTON 4 | M957: DOWNIE 3 | O957: MEITZCKE 2 | R957: CAHILL | U957: SIMPSON | X957: HISCOX
A958: OAKLEIGH | C958: DOWLER 4 | F958: NOLAN 3 | I958: MURPHY | K958: F HUTCHESON | N958: MALONEY
A960: ROUND 18 | E960: 19TH AUGUST | H960: WEATHER | K960: CLOUDY COLD SHOWERS STRONG S.W. WIND | S960: PLAYED AT
D961: 1ST QTR | H961: 2ND QTR | L961: 3RD QTR | P961: FINAL | S961: CAMBERWELL
A962: CAMBERWELL | C962: 1 | D962: 3 | E962: =C962*6+D962 -> 9 | G962: 13 | H962: 11 | I962: =G962*6+H962 -> 89 | K962: 17 | L962: 11 | M962: =K962*6+L962 -> 113 | O962: 26 | P962: 13 | Q962: =O962*6+P962 -> 169 | S962: UMPIRE | X962: LADDER | AB962: ROUND | AD962: 18
A963: BRUNSWICK | C963: 7 | D963: 4 | E963: =C963*6+D963 -> 46 | G963: 8 | H963: 6 | I963: =G963*6+H963 -> 54 | K963: 17 | L963: 13 | M963: =K963*6+L963 -> 115 | O963: 18 | P963: 15 | Q963: =O963*6+P963 -> 123 | S963: HAYES
A964: BEST PLAYERS | W964: TEAM | X964: W | Y964: L | Z964: D | AA964: FOR | AB964: AGST | AC964: % | AD964: PTS
A965: CAMBERWELL | C965: DURAND | E965: BENNETT | H965: WHITE | K965: CLAMP | N965: RANDALL | Q965: NASH
A966: BRUNSWICK | C966: JONES | E966: FAY | H966: COOPER | K966: CRAWFORD | N966: DOWLING | Q966: McGRATH | W966: BRUNSWICK | X966: 14 | Y966: 4 | Z966: 0 | AA966: 1953 | AB966: 1604 | AC966: 121.76 | AD966: 56
A967: GOALKICKERS | W967: NORTHCOTE | X967: 13 | Y967: 5 | Z967: 0 | AA967: 1746 | AB967: 1348 | AC967: 129.52522255192878 | AD967: 52
A968: CAMBERWELL | C968: FORD 7 | E968: WHITE 6 | H968: NASH 6 | J968: RANDALL 3 | M968: CLAMP 2 | O968: FINN | P968: FARRELLY | W968: PRAHRAN | X968: 13 | Y968: 5 | Z968: 0 | AA968: 2120 | AB968: 1679 | AC968: 126.2656343061346 | AD968: 52
A969: BRUNSWICK | C969: JONES 10 | E969: CRAWFORD 3 | H969: DOWLING 2 | K969: BOYD | M969: DAVIS | O969: McINNES | W969: WILLIAMSTOWN | X969: 12 | Y969: 6 | Z969: 0 | AA969: 1971 | AB969: 1638 | AC969: 120.33 | AD969: 48
A971: PRAHRAN | C971: 4 | D971: 1 | E971: =C971*6+D971 -> 25 | G971: 6 | H971: 5 | I971: =G971*6+H971 -> 41 | K971: 10 | L971: 6 | M971: =K971*6+L971 -> 66 | O971: 15 | P971: 14 | Q971: =O971*6+P971 -> 104 | S971: COBURG | W971: BRIGHTON | X971: 11 | Y971: 7 | Z971: 0 | AA971: 1911 | AB971: 1738 | AC971: 109.95 | AD971: 44
A972: COBURG | C972: 1 | D972: 7 | E972: =C972*6+D972 -> 13 | G972: 3 | H972: 9 | I972: =G972*6+H972 -> 27 | K972: 9 | L972: 16 | M972: =K972*6+L972 -> 70 | O972: 10 | P972: 17 | Q972: =O972*6+P972 -> 77 | S972: PARRIS | W972: CAMBERWELL | X972: 11 | Y972: 7 | Z972: 0 | AA972: 2021 | AB972: 1935 | AC972: 104.49 | AD972: 44
A973: BEST PLAYERS | W973: COBURG | X973: 9 | Y973: 9 | Z973: 0 | AA973: 1895 | AB973: 1777 | AC973: 106.64 | AD973: 36
A974: PRAHRAN | C974: ROBERTS | F974: JOHNSON | H974: MURRAY | K974: FLEMING | N974: PEARCE | Q974: GRAVELL | W974: PRESTON | X974: 7 | Y974: 11 | Z974: 0 | AA974: 1607 | AB974: 1682 | AC974: 95.54 | AD974: 28
A975: COBURG | C975: SCANLON | F975: LITTLE | H975: BRAGG | K975: WHITE | N975: BERRIMAN | Q975: HALL | W975: SANDRINGHAM | X975: 6 | Y975: 12 | Z975: 0 | AA975: 1784 | AB975: 1824 | AC975: 97.807017543859644 | AD975: 24
A976: GOALKICKERS | W976: YARRAVILLE | X976: 6 | Y976: 12 | Z976: 0 | AA976: 1693 | AB976: 2206 | AC976: 76.75 | AD976: 24
A977: PRAHRAN | C977: HAWKINS 3 | F977: PROBYN 3 | I977: ROLFE 3 | K977: DAVEY 2 | M977: BRENCHLEY 2 | P977: WHITE | R977: MCNAUGHTON | W977: PORT MELBOURNE | X977: 5 | Y977: 13 | Z977: 0 | AA977: 1597 | AB977: 1995 | AC977: 80.05 | AD977: 20
A978: COBURG | C978: SCANLON 3 | F978: YOUNG 2 | I978: COLLINS 2 | K978: LITTLE 2 | M978: JOHNSON | W978: OAKLEIGH | X978: 1 | Y978: 17 | Z978: 0 | AA978: 1544 | AB978: 2416 | AC978: 63.907284768211923 | AD978: 4
A980: NORTHCOTE | C980: 3 | D980: 5 | E980: =C980*6+D980 -> 23 | G980: 4 | H980: 8 | I980: =G980*6+H980 -> 32 | K980: 8 | L980: 18 | M980: =K980*6+L980 -> 66 | O980: 9 | P980: 19 | Q980: =O980*6+P980 -> 73 | S980: BEACH ROAD
A981: SANDRINGHAM | C981: 1 | D981: 0 | E981: =C981*6+D981 -> 6 | G981: 4 | H981: 4 | I981: =G981*6+H981 -> 28 | K981: 5 | L981: 4 | M981: =K981*6+L981 -> 34 | O981: 8 | P981: 8 | Q981: =O981*6+P981 -> 56 | S981: GREGORY
A982: BEST PLAYERS
A983: NORTHCOTE | C983: MEITZCKE | F983: HART | I983: RUDDELL | L983: DOWNIE | O983: HOLDEN | R983: WATT
A984: SANDRINGHAM | C984: RYAN | F984: MITCHELL | I984: SAUNDERS | L984: McINTYRE | O984: WITHERS | R984: CARTWRIGHT
A985: GOALKICKERS
A986: NORTHCOTE | C986: LIBBIS 3 | E986: E BRETHERTON 2 | I986: SEYMOUR 2 | L986: SPRAGUE | N986: DOWNIE
A987: SANDRINGHAM | C987: KENT 3 | E987: MITCHELL | H987: ALLISTER | K987: FISHER | M987: CARTWRIGHT | P987: McINTYRE
A989: WILLIAMSTOWN | C989: 2 | D989: 2 | E989: =C989*6+D989 -> 14 | G989: 5 | H989: 9 | I989: =G989*6+H989 -> 39 | K989: 8 | L989: 10 | M989: =K989*6+L989 -> 58 | O989: 10 | P989: 12 | Q989: =O989*6+P989 -> 72 | S989: WILLIAMSTOWN
A990: PRESTON | C990: 1 | D990: 3 | E990: =C990*6+D990 -> 9 | G990: 2 | H990: 3 | I990: =G990*6+H990 -> 15 | K990: 5 | L990: 5 | M990: =K990*6+L990 -> 35 | O990: 7 | P990: 6 | Q990: =O990*6+P990 -> 48 | S990: MERRINGTON
A991: BEST PLAYERS
A992: WILLIAMSTOWN | C992: FITCH | E992: WILCOX | H992: OGDEN | K992: PATERSON | N992: MENZIES | Q992: JAMIESON
A993: PRESTON | C993: MILLER | E993: JOB | H993: NORMAN | K993: GRAY | N993: JONES
A994: GOALKICKERS
A995: WILLIAMSTOWN | C995: VALLENCE 3 | F995: JAMIESON 2 | I995: GLASS | K995: PATERSON | M995: THOMAS | O995: McTAGGART | R995: SPOKES
A996: PRESTON | C996: DUNSTONE 2 | F996: CLARKE | I996: MILLER | K996: BEAGLEY | M996: DUNHAM | O996: MORRISON
A998: PORT MELBOURNE | C998: 2 | D998: 6 | E998: =C998*6+D998 -> 18 | G998: 8 | H998: 12 | I998: =G998*6+H998 -> 60 | K998: 9 | L998: 13 | M998: =K998*6+L998 -> 67 | O998: 17 | P998: 21 | Q998: =O998*6+P998 -> 123 | S998: PORT MELBOURNE
A999: YARRAVILLE | C999: 4 | D999: 4 | E999: =C999*6+D999 -> 28 | G999: 7 | H999: 8 | I999: =G999*6+H999 -> 50 | K999: 10 | L999: 15 | M999: =K999*6+L999 -> 75 | O999: 10 | P999: 17 | Q999: =O999*6+P999 -> 77 | S999: McALPINE
A1000: BEST PLAYERS
A1001: PORT MELBOURNE | C1001: LAHIFF | E1001: FLETCHER | H1001: RICHES | K1001: GOSS | N1001: DOBSON | Q1001: FREYER
A1002: YARRAVILLE | C1002: KELLY | E1002: HOPKINS | H1002: McGRATH | K1002: B ANDERSON | N1002: TURNER | Q1002: WEDGWOOD
A1003: GOALKICKERS
A1004: PORT MELBOURNE | C1004: FREYER 6 | F1004: WOODS 3 | I1004: GOSS 3 | K1004: McBETH 2 | N1004: LAHIFF 2 | Q1004: OLSEN
A1005: YARRAVILLE | C1005: TURNER 4 | F1005: CALVERT 2 | I1005: RIGGS | K1005: WEDGWOOD | N1005: LUKE | P1005: HOPKINS
A1007: BRIGHTON | C1007: 4 | D1007: 7 | E1007: =C1007*6+D1007 -> 31 | G1007: 8 | H1007: 13 | I1007: =G1007*6+H1007 -> 61 | K1007: 14 | L1007: 17 | M1007: =K1007*6+L1007 -> 101 | O1007: 19 | P1007: 22 | Q1007: =O1007*6+P1007 -> 136 | S1007: OAKLEIGH
A1008: OAKLEIGH | C1008: 3 | D1008: 5 | E1008: =C1008*6+D1008 -> 23 | G1008: 3 | H1008: 8 | I1008: =G1008*6+H1008 -> 26 | K1008: 4 | L1008: 9 | M1008: =K1008*6+L1008 -> 33 | O1008: 9 | P1008: 14 | Q1008: =O1008*6+P1008 -> 68 | S1008: LESTER
A1009: BEST PLAYERS
A1010: BRIGHTON | C1010: BIRD | E1010: WEBER | H1010: HARTNETT | K1010: PENNY | N1010: CONNELL | Q1010: GEORGE
A1011: OAKLEIGH | C1011: NOLAN | E1011: MALONEY | H1011: WILLIAMS | K1011: WILSON | N1011: ASH | Q1011: SMITH
A1012: GOALKICKERS
A1013: BRIGHTON | C1013: PENNY 6 | F1013: BIRD 5 | I1013: JIM HALLAHAN 5 | M1013: HENDER 3
A1014: OAKLEIGH | C1014: NOLAN 3 | F1014: DOWLER 2 | I1014: WILSON | K1014: MALONEY | M1014: LAW | O1014: CLARKE
A1016: ROUND 19 | E1016: 26TH AUGUST | J1016: WEATHER | M1016: SHOWERS WEST WIND | S1016: PLAYED AT
D1017: 1ST QTR | H1017: 2ND QTR | L1017: 3RD QTR | P1017: FINAL | S1017: ELSTERNWICK PARK
A1018: WILLIAMSTOWN | C1018: 3 | D1018: 4 | E1018: =C1018*6+D1018 -> 22 | G1018: 6 | H1018: 10 | I1018: =G1018*6+H1018 -> 46 | K1018: 7 | L1018: 19 | M1018: =K1018*6+L1018 -> 61 | O1018: 14 | P1018: 23 | Q1018: =O1018*6+P1018 -> 107 | S1018: UMPIRE | X1018: LADDER | AB1018: ROUND | AD1018: 19
A1019: BRIGHTON | C1019: 2 | D1019: 2 | E1019: =C1019*6+D1019 -> 14 | G1019: 5 | H1019: 5 | I1019: =G1019*6+H1019 -> 35 | K1019: 7 | L1019: 7 | M1019: =K1019*6+L1019 -> 49 | O1019: 9 | P1019: 9 | Q1019: =O1019*6+P1019 -> 63 | S1019: HAYES
A1020: BEST PLAYERS | W1020: TEAM | X1020: W | Y1020: L | Z1020: D | AA1020: FOR | AB1020: AGST | AC1020: % | AD1020: PTS
A1021: WILLIAMSTOWN | C1021: WILCOX | F1021: OGDEN | I1021: PATERSON | L1021: JAMIESON | O1021: CAVE | Q1021: FITCH
A1022: BRIGHTON | C1022: GEORGE | F1022: BIRD | I1022: ALVIN | L1022: JOHNSON | O1022: DAVIS | Q1022: PENNY | W1022: BRUNSWICK | X1022: 15 | Y1022: 4 | Z1022: 0 | AA1022: 2191 | AB1022: 1656 | AC1022: 132.31 | AD1022: 60
A1023: GOALKICKERS | W1023: PRAHRAN | X1023: 14 | Y1023: 5 | Z1023: 0 | AA1023: 2292 | AB1023: 1765 | AC1023: 129.85835694050991 | AD1023: 56
A1024: WILLIAMSTOWN | C1024: VALLENCE 5 | F1024: QUINN 3 | H1024: PATERSON 2 | K1024: McTAGGART | N1024: FITCH | P1024: GLASS | R1024: JAMIESON | W1024: NORTHCOTE | X1024: 14 | Y1024: 5 | Z1024: 0 | AA1024: 1834 | AB1024: 1413 | AC1024: 129.79476291578203 | AD1024: 56
A1025: BRIGHTON | C1025: BIRD 3 | E1025: MILLER | G1025: JIM HALLAHAN | J1025: JACK HALLAHAN | N1025: DAVIS | P1025: BOLWELL | R1025: PENNY | W1025: WILLIAMSTOWN | X1025: 13 | Y1025: 6 | Z1025: 0 | AA1025: 2078 | AB1025: 1701 | AC1025: 122.16 | AD1025: 52
A1027: PRESTON | C1027: 2 | D1027: 3 | E1027: =C1027*6+D1027 -> 15 | G1027: 3 | H1027: 9 | I1027: =G1027*6+H1027 -> 27 | K1027: 6 | L1027: 12 | M1027: =K1027*6+L1027 -> 48 | O1027: 9 | P1027: 14 | Q1027: =O1027*6+P1027 -> 68 | S1027: PRESTON | W1027: CAMBERWELL | X1027: 12 | Y1027: 7 | Z1027: 0 | AA1027: 2146 | AB1027: 1992 | AC1027: 107.73 | AD1027: 48
A1028: COBURG | C1028: 1 | D1028: 5 | E1028: =C1028*6+D1028 -> 11 | G1028: 1 | H1028: 8 | I1028: =G1028*6+H1028 -> 14 | K1028: 3 | L1028: 10 | M1028: =K1028*6+L1028 -> 28 | O1028: 5 | P1028: 17 | Q1028: =O1028*6+P1028 -> 47 | S1028: PARRIS | W1028: BRIGHTON | X1028: 11 | Y1028: 8 | Z1028: 0 | AA1028: 1974 | AB1028: 1845 | AC1028: 106.99 | AD1028: 44
A1029: BEST PLAYERS | W1029: COBURG | X1029: 9 | Y1029: 10 | Z1029: 0 | AA1029: 1942 | AB1029: 1845 | AC1029: 105.26 | AD1029: 36
A1030: PRESTON | C1030: DUNSTONE | F1030: ROSS | H1030: GRAY | K1030: JOB | N1030: MORRISON | Q1030: DOWLING | W1030: PRESTON | X1030: 8 | Y1030: 11 | Z1030: 0 | AA1030: 1675 | AB1030: 1729 | AC1030: 96.88 | AD1030: 32
A1031: COBURG | C1031: BRAGG | F1031: HALL | H1031: MURRAY | K1031: DOHERTY | N1031: JORDAN | Q1031: RINGHOLT | W1031: SANDRINGHAM | X1031: 6 | Y1031: 13 | Z1031: 0 | AA1031: 1870 | AB1031: 1996 | AC1031: 93.687374749499 | AD1031: 24
A1032: GOALKICKERS | W1032: YARRAVILLE | X1032: 6 | Y1032: 13 | Z1032: 0 | AA1032: 1750 | AB1032: 2331 | AC1032: 75.08 | AD1032: 24
A1033: PRESTON | C1033: DUNSTONE 5 | F1033: CLARKE 2 | I1033: ROSS | K1033: JOB | W1033: PORT MELBOURNE | X1033: 5 | Y1033: 14 | Z1033: 0 | AA1033: 1662 | AB1033: 2083 | AC1033: 79.79 | AD1033: 20
A1034: COBURG | C1034: COLLINS 3 | F1034: HALL | I1034: PERRETT | W1034: OAKLEIGH | X1034: 1 | Y1034: 18 | Z1034: 0 | AA1034: 1596 | AB1034: 2654 | AC1034: 60.135644310474753 | AD1034: 4
A1036: CAMBERWELL | C1036: 1 | D1036: 3 | E1036: =C1036*6+D1036 -> 9 | G1036: 7 | H1036: 9 | I1036: =G1036*6+H1036 -> 51 | K1036: 11 | L1036: 13 | M1036: =K1036*6+L1036 -> 79 | O1036: 18 | P1036: 17 | Q1036: =O1036*6+P1036 -> 125 | S1036: YARRAVILLE
A1037: YARRAVILLE | C1037: 2 | D1037: 4 | E1037: =C1037*6+D1037 -> 16 | G1037: 3 | H1037: 5 | I1037: =G1037*6+H1037 -> 23 | K1037: 6 | L1037: 10 | M1037: =K1037*6+L1037 -> 46 | O1037: 7 | P1037: 15 | Q1037: =O1037*6+P1037 -> 57 | S1037: HARDING
A1038: BEST PLAYERS
A1039: CAMBERWELL | C1039: SEELENMEYER | F1039: NASH | I1039: BENNETT | L1039: HENDERSON | O1039: HORKINGS | R1039: FARRELLY
A1040: YARRAVILLE | C1040: LUKE | F1040: WEDGWOOD | I1040: ALSOPP | L1040: REDPATH | O1040: BONIFACE | R1040: HOPKINS
A1041: GOALKICKERS
A1042: CAMBERWELL | C1042: WHITE 5 | F1042: BROWN 5 | I1042: NASH 3 | K1042: CLAMP 2 | M1042: FINN | O1042: ANDERSON | R1042: BENNETT
A1043: YARRAVILLE | C1043: LUKE 2 | F1043: ALSOPP | I1043: McGRATH | K1043: KENNY | M1043: McKELLIN | P1043: SCHEURER
A1045: PRAHRAN | C1045: 9 | D1045: 8 | E1045: =C1045*6+D1045 -> 62 | G1045: 15 | H1045: 10 | I1045: =G1045*6+H1045 -> 100 | K1045: 22 | L1045: 15 | M1045: =K1045*6+L1045 -> 147 | O1045: 26 | P1045: 16 | Q1045: =O1045*6+P1045 -> 172 | S1045: TOORAK PARK
A1046: SANDRINGHAM | C1046: 2 | D1046: 1 | E1046: =C1046*6+D1046 -> 13 | G1046: 8 | H1046: 4 | I1046: =G1046*6+H1046 -> 52 | K1046: 10 | L1046: 5 | M1046: =K1046*6+L1046 -> 65 | O1046: 13 | P1046: 8 | Q1046: =O1046*6+P1046 -> 86 | S1046: MCALPINE
A1047: BEST PLAYERS
A1048: PRAHRAN | C1048: HAWKINS | F1048: FAUL | I1048: FLEMING | L1048: DAVEY | O1048: PEARCE | R1048: JOHNSON
A1049: SANDRINGHAM | C1049: MILLER | F1049: SAUNDERS | I1049: KENT | L1049: ALLISTER | O1049: WITHERS | R1049: FISHER
A1050: GOALKICKERS
A1051: PRAHRAN | C1051: HAWKINS 16 | F1051: PROBYN 5 | I1051: DAVEY 2 | K1051: BRENCHLEY | N1051: WHITE | P1051: ROLFE
A1052: SANDRINGHAM | C1052: ALLISTER 6 | F1052: FISHER 4 | I1052: KENT 2 | K1052: WITHERS
A1054: NORTHCOTE | C1054: 5 | D1054: 3 | E1054: =C1054*6+D1054 -> 33 | G1054: 6 | H1054: 6 | I1054: =G1054*6+H1054 -> 42 | K1054: 10 | L1054: 14 | M1054: =K1054*6+L1054 -> 74 | O1054: 12 | P1054: 16 | Q1054: =O1054*6+P1054 -> 88 | S1054: PORT MELBOURNE
A1055: PORT MELBOURNE | C1055: 0 | D1055: 0 | E1055: =C1055*6+D1055 -> 0 | G1055: 3 | H1055: 6 | I1055: =G1055*6+H1055 -> 24 | K1055: 3 | L1055: 7 | M1055: =K1055*6+L1055 -> 25 | O1055: 9 | P1055: 11 | Q1055: =O1055*6+P1055 -> 65 | S1055: GREGORY
A1056: BEST PLAYERS
A1057: NORTHCOTE | C1057: MEITZCKE | F1057: D BRETHERTON | J1057: HISCOX | M1057: DOWNIE | P1057: CAHILL | S1057: LIBBIS
A1058: PORT MELBOURNE | C1058: GOLDSMITH | F1058: FREYER | J1058: DOBSON | M1058: COSHAN | P1058: MARSHALL | S1058: RICHES
A1059: GOALKICKERS
A1060: NORTHCOTE | C1060: CAHILL 3 | F1060: SEYMOUR 2 | I1060: DOWNIE 2 | L1060: LIBBIS | N1060: HISCOX | P1060: MEITZCKE | S1060: DRYDEN | V1060: RUDDELL
A1061: PORT MELBOURNE | C1061: FREYER 2 | F1061: DOBSON 2 | I1061: ALSOP | K1061: GOLDSMITH | N1061: LAHIFF | P1061: WOODS | R1061: COSHAN
A1063: BRUNSWICK | C1063: 4 | D1063: 3 | E1063: =C1063*6+D1063 -> 27 | G1063: 16 | H1063: 10 | I1063: =G1063*6+H1063 -> 106 | K1063: 20 | L1063: 12 | M1063: =K1063*6+L1063 -> 132 | O1063: 37 | P1063: 16 | Q1063: =O1063*6+P1063 -> 238 | S1063: BRUNSWICK
A1064: OAKLEIGH | C1064: 2 | D1064: 3 | E1064: =C1064*6+D1064 -> 15 | G1064: 4 | H1064: 5 | I1064: =G1064*6+H1064 -> 29 | K1064: 6 | L1064: 7 | M1064: =K1064*6+L1064 -> 43 | O1064: 7 | P1064: 10 | Q1064: =O1064*6+P1064 -> 52 | S1064: MERRINGTON
A1065: BEST PLAYERS
A1066: BRUNSWICK | C1066: BOYD | E1066: CLARKE | H1066: CRAWFORD | K1066: DOWLING | N1066: FITZGIBBON | Q1066: FAY
A1067: OAKLEIGH | C1067: WILSON | E1067: SMITH | H1067: MURPHY | K1067: F HUTCHESON | N1067: BELL | Q1067: ASH
A1068: GOALKICKERS
A1069: BRUNSWICK | C1069: JONES 20 | F1069: BOYD 5 | H1069: DOWLING 4 | K1069: McGRATH 4 | N1069: McINNES 2 | Q1069: McKAY | S1069: CLARKE
A1070: OAKLEIGH | C1070: WILSON 3 | F1070: MALONEY 2 | I1070: MAJOR | K1070: NOLAN
A1072: ROUND 20 | E1072: 2ND SEPTEMBER | J1072: WEATHER | M1072: COOL CLOUDY STRONG S.W. WIND | S1072: PLAYED AT
D1073: 1ST QTR | H1073: 2ND QTR | L1073: 3RD QTR | P1073: FINAL | S1073: TOORAK PARK
A1074: PRAHRAN | C1074: 3 | D1074: 6 | E1074: =C1074*6+D1074 -> 24 | G1074: 8 | H1074: 8 | I1074: =G1074*6+H1074 -> 56 | K1074: 13 | L1074: 11 | M1074: =K1074*6+L1074 -> 89 | O1074: 20 | P1074: 15 | Q1074: =O1074*6+P1074 -> 135 | S1074: UMPIRE | X1074: LADDER | AB1074: ROUND | AD1074: 20
A1075: NORTHCOTE | C1075: 4 | D1075: 3 | E1075: =C1075*6+D1075 -> 27 | G1075: 6 | H1075: 3 | I1075: =G1075*6+H1075 -> 39 | K1075: 9 | L1075: 7 | M1075: =K1075*6+L1075 -> 61 | O1075: 12 | P1075: 12 | Q1075: =O1075*6+P1075 -> 84 | S1075: GREGORY
A1076: BEST PLAYERS | W1076: TEAM | X1076: W | Y1076: L | Z1076: D | AA1076: FOR | AB1076: AGST | AC1076: % | AD1076: PTS
A1077: PRAHRAN | C1077: DAVEY | F1077: WHITEHEAD | I1077: PROBYN | L1077: HAWKINS | O1077: PEARCE | Q1077: JOHNSON
A1078: NORTHCOTE | C1078: DOWNIE | F1078: HISCOX | I1078: SEYMOUR | L1078: WEGNER | O1078: DRYDEN | Q1078: NEWMAN | W1078: PRAHRAN | X1078: 15 | Y1078: 5 | Z1078: 0 | AA1078: 2427 | AB1078: 1849 | AC1078: 131.26014061654948 | AD1078: 60
A1079: GOALKICKERS | W1079: BRUNSWICK | X1079: 15 | Y1079: 5 | Z1079: 0 | AA1079: 2263 | AB1079: 1751 | AC1079: 129.24 | AD1079: 60
A1080: PRAHRAN | C1080: HAWKINS 8 | F1080: DAVEY 5 | I1080: PROBYN 5 | L1080: BRENCHLEY | O1080: ROLFE | W1080: NORTHCOTE | X1080: 14 | Y1080: 6 | Z1080: 0 | AA1080: 1918 | AB1080: 1548 | AC1080: 123.90180878552971 | AD1080: 56
A1081: NORTHCOTE | C1081: DOWNIE 4 | F1081: SEYMOUR 4 | I1081: CAHILL 2 | L1081: E BRETHERTON | O1081: HISCOX | W1081: WILLIAMSTOWN | X1081: 14 | Y1081: 6 | Z1081: 0 | AA1081: 2173 | AB1081: 1773 | AC1081: 122.56 | AD1081: 56
A1083: WILLIAMSTOWN | C1083: 5 | D1083: 3 | E1083: =C1083*6+D1083 -> 33 | G1083: 7 | H1083: 5 | I1083: =G1083*6+H1083 -> 47 | K1083: 11 | L1083: 9 | M1083: =K1083*6+L1083 -> 75 | O1083: 14 | P1083: 11 | Q1083: =O1083*6+P1083 -> 95 | S1083: WILLIAMSTOWN | W1083: CAMBERWELL | X1083: 13 | Y1083: 7 | Z1083: 0 | AA1083: 2356 | AB1083: 2045 | AC1083: 115.21 | AD1083: 52
A1084: BRUNSWICK | C1084: 1 | D1084: 1 | E1084: =C1084*6+D1084 -> 7 | G1084: 6 | H1084: 5 | I1084: =G1084*6+H1084 -> 41 | K1084: 9 | L1084: 5 | M1084: =K1084*6+L1084 -> 59 | O1084: 11 | P1084: 6 | Q1084: =O1084*6+P1084 -> 72 | S1084: HAYES | W1084: BRIGHTON | X1084: 11 | Y1084: 9 | Z1084: 0 | AA1084: 2087 | AB1084: 1987 | AC1084: 105.03 | AD1084: 44
A1085: BEST PLAYERS | W1085: COBURG | X1085: 10 | Y1085: 10 | Z1085: 0 | AA1085: 2084 | AB1085: 1958 | AC1085: 106.44 | AD1085: 40
A1086: WILLIAMSTOWN | C1086: CUTTING | F1086: SPOKES | I1086: DELLER | L1086: OGDEN | N1086: McDONOUGH | Q1086: JAMIESON | W1086: PRESTON | X1086: 9 | Y1086: 11 | Z1086: 0 | AA1086: 1810 | AB1086: 1854 | AC1086: 97.63 | AD1086: 36
A1087: BRUNSWICK | C1087: CHALLENGER | F1087: BOYD | I1087: CLARKE | L1087: FAY | N1087: BAILEY | Q1087: McKERNAN | W1087: YARRAVILLE | X1087: 7 | Y1087: 13 | Z1087: 0 | AA1087: 1888 | AB1087: 2463 | AC1087: 76.65 | AD1087: 28
A1088: GOALKICKERS | W1088: SANDRINGHAM | X1088: 6 | Y1088: 14 | Z1088: 0 | AA1088: 1995 | AB1088: 2131 | AC1088: 93.618019709056782 | AD1088: 24
A1089: WILLIAMSTOWN | C1089: VALLENCE 6 | F1089: JAMIESON 4 | I1089: SPOKES | L1089: PATERSON | N1089: THOMAS | P1089: McTAGGART | W1089: PORT MELBOURNE | X1089: 5 | Y1089: 15 | Z1089: 0 | AA1089: 1715 | AB1089: 2293 | AC1089: 74.79 | AD1089: 20
A1090: BRUNSWICK | C1090: BAILEY 3 | F1090: McINNES 3 | I1090: DOWLING 3 | L1090: BOYD | N1090: CRAWFORD | W1090: OAKLEIGH | X1090: 1 | Y1090: 19 | Z1090: 0 | AA1090: 1728 | AB1090: 2792 | AC1090: 61.891117478510026 | AD1090: 4
A1092: COBURG | C1092: 7 | D1092: 2 | E1092: =C1092*6+D1092 -> 44 | G1092: 11 | H1092: 7 | I1092: =G1092*6+H1092 -> 73 | K1092: 16 | L1092: 12 | M1092: =K1092*6+L1092 -> 108 | O1092: 21 | P1092: 16 | Q1092: =O1092*6+P1092 -> 142 | S1092: COBURG
A1093: BRIGHTON | C1093: 7 | D1093: 5 | E1093: =C1093*6+D1093 -> 47 | G1093: 10 | H1093: 11 | I1093: =G1093*6+H1093 -> 71 | K1093: 11 | L1093: 14 | M1093: =K1093*6+L1093 -> 80 | O1093: 16 | P1093: 17 | Q1093: =O1093*6+P1093 -> 113 | S1093: McALPINE
A1094: BEST PLAYERS
A1095: COBURG | C1095: JORDAN | F1095: JOHNSON | I1095: COLLINS | L1095: HALL | O1095: ATKINSON | R1095: WHITE
A1096: BRIGHTON | C1096: HARTNETT | F1096: GEORGE | I1096: JOHNSON | L1096: BOLWELL | O1096: WEBER | R1096: HENDER
A1097: GOALKICKERS
A1098: COBURG | C1098: COLLINS 12 | F1098: JOHNSON 3 | I1098: McFARLANE 2 | L1098: LITTLE | N1098: SCRIVEN | P1098: DOHERTY | R1098: BRAGG
A1099: BRIGHTON | C1099: JIM HALLAHAN 4 | G1099: HENDER 3 | J1099: BOLWELL 2 | M1099: PENNY 2 | O1099: HARVEY 2 | R1099: DAVIS 2 | U1099: BIRD
A1101: PRESTON | C1101: 4 | D1101: 3 | E1101: =C1101*6+D1101 -> 27 | G1101: 10 | H1101: 4 | I1101: =G1101*6+H1101 -> 64 | K1101: 15 | L1101: 6 | M1101: =K1101*6+L1101 -> 96 | O1101: 20 | P1101: 15 | Q1101: =O1101*6+P1101 -> 135 | S1101: BEACH ROAD
A1102: SANDRINGHAM | C1102: 5 | D1102: 3 | E1102: =C1102*6+D1102 -> 33 | G1102: 10 | H1102: 5 | I1102: =G1102*6+H1102 -> 65 | K1102: 15 | L1102: 6 | M1102: =K1102*6+L1102 -> 96 | O1102: 19 | P1102: 11 | Q1102: =O1102*6+P1102 -> 125 | S1102: MERRINGTON
A1103: BEST PLAYERS
A1104: PRESTON | C1104: DUNSTONE | F1104: BEAGLEY | I1104: ROACH | L1104: GRAY | O1104: JOB | R1104: SLEITH
A1105: SANDRINGHAM | C1105: MITCHELL | F1105: STAPLETON | I1105: ALLISTER | L1105: SAUNDERS | O1105: WITHERS | R1105: FREY
A1106: GOALKICKERS
A1107: PRESTON | C1107: DUNSTONE 7 | F1107: SEEDSMAN 3 | I1107: CLARKE 3 | K1107: BEAGLEY 2 | N1107: JOB 2 | P1107: MORRISON | R1107: LAWLER | U1107: STEWART
A1108: SANDRINGHAM | C1108: ALLISTER 6 | F1108: ANDERSON 4 | I1108: FISHER 3 | K1108: CARTWRIGHT 3 | N1108: KENT | P1108: MITCHELL | R1108: McINTYRE
A1110: YARRAVILLE | C1110: 2 | D1110: 3 | E1110: =C1110*6+D1110 -> 15 | G1110: 6 | H1110: 7 | I1110: =G1110*6+H1110 -> 43 | K1110: 15 | L1110: 9 | M1110: =K1110*6+L1110 -> 99 | O1110: 21 | P1110: 12 | Q1110: =O1110*6+P1110 -> 138 | S1110: OAKLEIGH
A1111: OAKLEIGH | C1111: 6 | D1111: 10 | E1111: =C1111*6+D1111 -> 46 | G1111: 9 | H1111: 13 | I1111: =G1111*6+H1111 -> 67 | K1111: 13 | L1111: 17 | M1111: =K1111*6+L1111 -> 95 | O1111: 18 | P1111: 24 | Q1111: =O1111*6+P1111 -> 132 | S1111: PARRIS
A1112: BEST PLAYERS
A1113: YARRAVILLE | C1113: H ANDERSON | F1113: McGRATH | I1113: ALSOPP | L1113: WEDGWOOD | O1113: HOPKINS | R1113: KELLY
A1114: OAKLEIGH | C1114: BELL | F1114: WILLIAMS | I1114: MURPHY | L1114: LAW | O1114: DOWLER | R1114: SMITH
A1115: GOALKICKERS
A1116: YARRAVILLE | C1116: LUKE 5 | F1116: ALSOPP 5 | I1116: KENNY 4 | K1116: McGRATH 3 | N1116: RIGGS | P1116: McLURE | R1116: SMITH | T1116: PERUSSICH
A1117: OAKLEIGH | C1117: DOWLER 6 | F1117: MURPHY 4 | I1117: NOLAN 2 | K1117: LAW 2 | M1117: SMITH 2 | O1117: WILLIAMS | Q1117: WILSON
A1119: CAMBERWELL | C1119: 6 | D1119: 9 | E1119: =C1119*6+D1119 -> 45 | G1119: 12 | H1119: 17 | I1119: =G1119*6+H1119 -> 89 | K1119: 21 | L1119: 19 | M1119: =K1119*6+L1119 -> 145 | O1119: 31 | P1119: 24 | Q1119: =O1119*6+P1119 -> 210 | S1119: CAMBERWELL
A1120: PORT MELBOURNE | C1120: 2 | D1120: 3 | E1120: =C1120*6+D1120 -> 15 | G1120: 5 | H1120: 6 | I1120: =G1120*6+H1120 -> 36 | K1120: 5 | L1120: 10 | M1120: =K1120*6+L1120 -> 40 | O1120: 7 | P1120: 11 | Q1120: =O1120*6+P1120 -> 53 | S1120: HARDING
A1121: BEST PLAYERS
A1122: CAMBERWELL | C1122: NASH | F1122: BENNETT | I1122: SEELENMEYER | L1122: CLAMP | O1122: TOOHEY | R1122: HENDERSON
A1123: PORT MELBOURNE | C1123: MARSHALL | F1123: REYNOLDS | I1123: RICHES | L1123: DUGGAN | O1123: ALSOP | R1123: GOLDSMITH
A1124: GOALKICKERS
A1125: CAMBERWELL | C1125: NASH 11 | E1125: CLAMP 4 | G1125: WHITE 4 | I1125: ANDERSON 3 | L1125: FORD 3 | N1125: BROWN 2 | Q1125: FINN 2 | S1125: MILNE | U1125: FARRELLY
A1126: PORT MELBOURNE | C1126: COSHAN 2 | F1126: RICHES | H1126: REYNOLDS | J1126: LAHIFF | L1126: CRITCH | N1126: DOBSON
A1128: FINALS
A1129: 1ST SEMI | E1129: 9TH SEPTEMBER | J1129: WEATHER | M1129: CLOUDY BUT FINE
D1130: 1ST QTR | H1130: 2ND QTR | L1130: 3RD QTR | P1130: FINAL
A1131: WILLIAMSTOWN | C1131: 2 | D1131: 3 | E1131: =C1131*6+D1131 -> 15 | G1131: 5 | H1131: 7 | I1131: =G1131*6+H1131 -> 37 | K1131: 8 | L1131: 10 | M1131: =K1131*6+L1131 -> 58 | O1131: 11 | P1131: 14 | Q1131: =O1131*6+P1131 -> 80 | S1131: TOORAK PARK
A1132: NORTHCOTE | C1132: 3 | D1132: 7 | E1132: =C1132*6+D1132 -> 25 | G1132: 4 | H1132: 10 | I1132: =G1132*6+H1132 -> 34 | K1132: 8 | L1132: 12 | M1132: =K1132*6+L1132 -> 60 | O1132: 10 | P1132: 14 | Q1132: =O1132*6+P1132 -> 74 | S1132: HAYES
A1133: BEST PLAYERS
A1134: WILLIAMSTOWN | C1134: PATERSON | F1134: McDONOUGH | J1134: VALLENCE | M1134: FITCH | O1134: WILCOX | R1134: OGDEN
A1135: NORTHCOTE | C1135: DRYDEN | F1135: HISCOX | J1135: MEITZCKE | M1135: HONIG | O1135: CAHILL | R1135: DOWNIE
A1136: GOALKICKERS
A1137: WILLIAMSTOWN | C1137: VALLENCE 7 | F1137: PATERSON 3 | I1137: THOMAS
A1138: NORTHCOTE | C1138: SEYMOUR 4 | F1138: CAHILL 3 | I1138: HISCOX 3
A1140: 2ND SEMI | E1140: 16TH SEPTEMBER | J1140: WEATHER | M1140: FINE & MILD
A1141: BRUNSWICK | C1141: 1 | D1141: 4 | E1141: =C1141*6+D1141 -> 10 | G1141: 6 | H1141: 7 | I1141: =G1141*6+H1141 -> 43 | K1141: 10 | L1141: 9 | M1141: =K1141*6+L1141 -> 69 | O1141: 16 | P1141: 17 | Q1141: =O1141*6+P1141 -> 113 | S1141: TOORAK PARK
A1142: PRAHRAN | C1142: 5 | D1142: 4 | E1142: =C1142*6+D1142 -> 34 | G1142: 9 | H1142: 7 | I1142: =G1142*6+H1142 -> 61 | K1142: 13 | L1142: 13 | M1142: =K1142*6+L1142 -> 91 | O1142: 16 | P1142: 13 | Q1142: =O1142*6+P1142 -> 109 | S1142: MERRINGTON
A1143: BEST PLAYERS
A1144: BRUNSWICK | C1144: CRAWFORD | F1144: BOYD | I1144: DOWLING | L1144: CHALLENGER | O1144: GARDNER | R1144: JONES
A1145: PRAHRAN | C1145: FLEMING | F1145: JOHNSON | I1145: HAWKINS | L1145: THOMPSON | O1145: WHITE | R1145: PEARCE
A1146: GOALKICKERS
A1147: BRUNSWICK | C1147: CRAWFORD 3 | F1147: JONES 3 | H1147: McINNES 3 | K1147: QUINN 2 | M1147: DOWLING 2 | P1147: BAILEY | R1147: BOYD | T1147: GARDNER
A1148: PRAHRAN | C1148: HAWKINS 5 | F1148: DAVEY 3 | H1148: THOMPSON 2 | K1148: ROLFE 2 | M1148: PROBYN | O1148: WHITE | Q1148: GRAVELL | S1148: BRENCHLEY
A1150: PRELIMINARY FINAL | F1150: 30TH SEPTEMBER | J1150: WEATHER | M1150: FINE SOUTH WIND
A1151: WILLIAMSTOWN | C1151: 4 | D1151: 8 | E1151: =C1151*6+D1151 -> 32 | G1151: 5 | H1151: 10 | I1151: =G1151*6+H1151 -> 40 | K1151: 11 | L1151: 16 | M1151: =K1151*6+L1151 -> 82 | O1151: 17 | P1151: 19 | Q1151: =O1151*6+P1151 -> 121 | S1151: TOORAK PARK
A1152: PRAHRAN | C1152: 1 | D1152: 4 | E1152: =C1152*6+D1152 -> 10 | G1152: 6 | H1152: 13 | I1152: =G1152*6+H1152 -> 49 | K1152: 7 | L1152: 16 | M1152: =K1152*6+L1152 -> 58 | O1152: 16 | P1152: 18 | Q1152: =O1152*6+P1152 -> 114 | S1152: HAYES
A1153: BEST PLAYERS
A1154: WILLIAMSTOWN | C1154: SPOKES | F1154: CAVE | I1154: VALLENCE | L1154: WILCOX | O1154: OGDEN | R1154: PATERSON
A1155: PRAHRAN | C1155: BOURNE | F1155: ROLFE | I1155: PROBYN | L1155: FAUL | O1155: HAWKINS | R1155: WHITEHEAD
A1156: GOALKICKERS
A1157: WILLIAMSTOWN | C1157: VALLENCE 8 | F1157: THOMAS 3 | I1157: CAVE 2 | K1157: JAMIESON 2 | N1157: QUINN | P1157: SPOKES
A1158: PRAHRAN | C1158: HAWKINS 9 | F1158: PROBYN 2 | I1158: ROLFE 2 | K1158: BRENCHLEY | N1158: THOMPSON | Q1158: DAVEY
A1160: GRAND FINAL | E1160: 6TH OCTOBER | J1160: WEATHER | M1160: COLD CLOUDY SHOWERS
A1161: WILLIAMSTOWN | C1161: 3 | D1161: 2 | E1161: =C1161*6+D1161 -> 20 | G1161: 4 | H1161: 9 | I1161: =G1161*6+H1161 -> 33 | K1161: 12 | L1161: 15 | M1161: =K1161*6+L1161 -> 87 | O1161: 14 | P1161: 20 | Q1161: =O1161*6+P1161 -> 104 | S1161: M.C.G.
A1162: BRUNSWICK | C1162: 4 | D1162: 5 | E1162: =C1162*6+D1162 -> 29 | G1162: 8 | H1162: 7 | I1162: =G1162*6+H1162 -> 55 | K1162: 11 | L1162: 11 | M1162: =K1162*6+L1162 -> 77 | O1162: 14 | P1162: 11 | Q1162: =O1162*6+P1162 -> 95 | S1162: HAYES
A1163: BEST PLAYERS
A1164: WILLIAMSTOWN | C1164: WILCOX | F1164: PATERSON | I1164: CHISHOLM | L1164: MENZIES | O1164: CAVE | Q1164: VALLENCE
A1165: BRUNSWICK | C1165: CHALLENGER | F1165: FAY | I1165: McINNES | L1165: DOWLING | O1165: BAILEY | Q1165: QUINN
A1166: GOALKICKERS
A1167: WILLIAMSTOWN | C1167: VALLENCE 5 | F1167: PATERSON 2 | I1167: THOMAS 2 | L1167: JAMIESON 2 | O1167: McTAGGART | R1167: QUINN | U1167: MENZIES
A1168: BRUNSWICK | C1168: JONES 4 | F1168: McINNES 3 | I1168: CRAWFORD 3 | L1168: DOWLING | O1168: McKAY
A1170: TEAMS
F1171: WILLIAMSTOWN | R1171: BRUNSWICK
A1172: BACKS | C1172: DELLER | F1172: McDONOUGH | J1172: JOHNSON | N1172: CHALLENGER | R1172: FAY | V1172: McKERNAN
A1173: H-BACKS | C1173: CUTTING | F1173: WILCOX | J1173: OGDEN | N1173: DAVIS | R1173: COOPER | V1173: FLETT
A1174: CENTRES | C1174: MENZIES | F1174: FITCH | J1174: CHISHOLM | N1174: CLARKE | R1174: QUINN | V1174: FITZGIBBON
A1175: H-FORWARDS | C1175: JAMIESON | F1175: McTAGGART | J1175: QUINN | N1175: GARDNER | R1175: McKAY | V1175: BOYD
A1176: FORWARDS | C1176: SPOKES | F1176: VALLENCE | J1176: THOMAS | N1176: CRAWFORD | R1176: McINNES | V1176: JONES
A1177: RUCKS | C1177: CAVE | F1177: GLASS | J1177: PATERSON | N1177: McGRATH | R1177: BAILEY | V1177: DOWLING
A1178: RES | C1178: WILLETT | N1178: POWELL