A1: Victorian Football Association
A2: Season 1940
A3: © Copyright Wal Williams | F3: First created: 2 November 2014
A4: Contact: joywalwi at gmail dot com | F4: Last updated: 27 January 2018 | W4: VFA Results and tables - Link to the main index page
A5: You are free to copy this document in whole or part provided that proper acknowledgement is given to the author. All rights reserved.
A7: YEAR 1940
A8: ROUND 1 | E8: 20TH APRIL | J8: WEATHER | M8: FINE MILD NORTH BREEZE | S8: PLAYED AT
D9: 1ST QTR | H9: 2ND QTR | L9: 3RD QTR | P9: FINAL | S9: BRUNSWICK
A10: BRUNSWICK | C10: 5 | D10: 4 | E10: =C10*6+D10 -> 34 | G10: 8 | H10: 6 | I10: =G10*6+H10 -> 54 | K10: 10 | L10: 11 | M10: =K10*6+L10 -> 71 | O10: 13 | P10: 15 | Q10: =O10*6+P10 -> 93 | S10: UMPIRE | X10: LADDER | AB10: ROUND | AD10: 1
A11: COBURG | C11: 1 | D11: 2 | E11: =C11*6+D11 -> 8 | G11: 2 | H11: 4 | I11: =G11*6+H11 -> 16 | K11: 6 | L11: 8 | M11: =K11*6+L11 -> 44 | O11: 7 | P11: 9 | Q11: =O11*6+P11 -> 51 | S11: PARRIS, REPLACED BY DWYER, 3RD QTR
A12: BEST PLAYERS | W12: TEAM | X12: W | Y12: L | Z12: D | AA12: FOR | AB12: AGST | AC12: % | AD12: PTS
A13: BRUNSWICK | C13: FAY | E13: McGRATH | H13: KEMP | K13: CLARKE | N13: DOWLING | Q13: HOBBA
A14: COBURG | C14: COLLINS | E14: BAINES | H14: JORDAN | K14: PRENDERGAST | N14: ATKINSON | Q14: YOUNG | W14: WILLIAMSTOWN | X14: 1 | Y14: 0 | Z14: 0 | AA14: 236 | AB14: 88 | AC14: 268.18181818181819 | AD14: 4
A15: GOALKICKERS | W15: PORT MELBOURNE | X15: 1 | Y15: 0 | Z15: 0 | AA15: 149 | AB15: 80 | AC15: 186.25 | AD15: 4
A16: BRUNSWICK | C16: JONES 5 | F16: HOBBA 3 | I16: McGRATH 2 | L16: KEMP | N16: FLETT | P16: HOBBA | W16: BRUNSWICK | X16: 1 | Y16: 0 | Z16: 0 | AA16: 93 | AB16: 51 | AC16: 182.35294117647058 | AD16: 4
A17: COBURG | C17: YOUNG 3 | F17: PRATT 2 | I17: BAINES | K17: PRENDERGAST | W17: PRESTON | X17: 1 | Y17: 0 | Z17: 0 | AA17: 103 | AB17: 65 | AC17: 158.46153846153845 | AD17: 4
A19: PORT MELBOURNE | C19: 4 | D19: 2 | E19: =C19*6+D19 -> 26 | G19: 13 | H19: 8 | I19: =G19*6+H19 -> 86 | K19: 17 | L19: 11 | M19: =K19*6+L19 -> 113 | O19: 22 | P19: 17 | Q19: =O19*6+P19 -> 149 | S19: PORT MELBOURNE | W19: BRIGHTON | X19: 1 | Y19: 0 | Z19: 0 | AA19: 138 | AB19: 91 | AC19: 151.64835164835165 | AD19: 4
A20: PRAHRAN | C20: 3 | D20: 3 | E20: =C20*6+D20 -> 21 | G20: 5 | H20: 4 | I20: =G20*6+H20 -> 34 | K20: 9 | L20: 7 | M20: =K20*6+L20 -> 61 | O20: 12 | P20: 8 | Q20: =O20*6+P20 -> 80 | S20: HAYES | W20: CAMBERWELL | X20: 1 | Y20: 0 | Z20: 0 | AA20: 138 | AB20: 120 | AC20: 115 | AD20: 4
A21: BEST PLAYERS | W21: OAKLEIGH | X21: 0 | Y21: 1 | Z21: 0 | AA21: 120 | AB21: 138 | AC21: 86.956521739130437 | AD21: 0
A22: PORT MELBOURNE | C22: LAHIFF | E22: HOSKINGS | H22: JULIER | K22: HURLEY | N22: GOLDSMITH | Q22: RICHES | W22: SANDRINGHAM | X22: 0 | Y22: 1 | Z22: 0 | AA22: 91 | AB22: 138 | AC22: 65.94202898550725 | AD22: 0
A23: PRAHRAN | C23: JOHNSON | E23: MURRAY | H23: DAVEY | K23: GRAVELL | N23: THOMPSON | Q23: BRENCHLEY | W23: NORTHCOTE | X23: 0 | Y23: 1 | Z23: 0 | AA23: 65 | AB23: 103 | AC23: 63.106796116504853 | AD23: 0
A24: GOALKICKERS | Q24: COLES | S24: RICHES | W24: COBURG | X24: 0 | Y24: 1 | Z24: 0 | AA24: 51 | AB24: 93 | AC24: 54.838709677419352 | AD24: 0
A25: PORT MELBOURNE | C25: FREYER 7 | E25: HURLEY 3 | G25: REYNOLDS 2 | J25: HOSKINGS 2 | M25: LAHIFF 2 | O25: JONES 2 | Q25: KELLY | S25: CASTLES | W25: PRAHRAN | X25: 0 | Y25: 1 | Z25: 0 | AA25: 80 | AB25: 149 | AC25: 53.691275167785236 | AD25: 0
A26: PRAHRAN | C26: WILLIAMS 3 | F26: BRENCHLEY 3 | I26: THOMPSON 2 | L26: DAVEY 2 | N26: PROBYN | P26: BOURNE | W26: YARRAVILLE | X26: 0 | Y26: 1 | Z26: 0 | AA26: 88 | AB26: 236 | AC26: 37.288135593220339 | AD26: 0
A28: BRIGHTON | C28: 2 | D28: 4 | E28: =C28*6+D28 -> 16 | G28: 11 | H28: 10 | I28: =G28*6+H28 -> 76 | K28: 16 | L28: 11 | M28: =K28*6+L28 -> 107 | O28: 20 | P28: 18 | Q28: =O28*6+P28 -> 138 | S28: ELSTERNWICK PARK
A29: SANDRINGHAM | C29: 5 | D29: 8 | E29: =C29*6+D29 -> 38 | G29: 7 | H29: 6 | I29: =G29*6+H29 -> 48 | K29: 11 | L29: 11 | M29: =K29*6+L29 -> 77 | O29: 13 | P29: 13 | Q29: =O29*6+P29 -> 91 | S29: McALPINE
A30: BEST PLAYERS
A31: BRIGHTON | C31: PENNY | E31: DAVIS | H31: HALLAHAN | K31: BOLWELL | N31: HINDSON | Q31: BIRD
A32: SANDRINGHAM | C32: KENT | E32: SAUNDERS | H32: SMAIL | K32: WITHERS | N32: McINTYRE | Q32: FISHER
A33: GOALKICKERS
A34: BRIGHTON | C34: DAVIS 4 | E34: BIRD 4 | G34: HALLAHAN 4 | J34: PENNY 3 | L34: CONNELL 2 | N34: BOLWELL 2 | Q34: FINDLAY
A35: SANDRINGHAM | C35: McINTYRE 3 | F35: FISHER 3 | H35: KENT 2 | J35: WITHERS 2 | M35: MITCHELL | O35: ALLISTER | Q35: FREY
A37: WILLIAMSTOWN | C37: 12 | D37: 8 | E37: =C37*6+D37 -> 80 | G37: 16 | H37: 9 | I37: =G37*6+H37 -> 105 | K37: 29 | L37: 18 | M37: =K37*6+L37 -> 192 | O37: 36 | P37: 20 | Q37: =O37*6+P37 -> 236 | S37: YARRAVILLE
A38: YARRAVILLE | C38: 2 | D38: 1 | E38: =C38*6+D38 -> 13 | G38: 8 | H38: 7 | I38: =G38*6+H38 -> 55 | K38: 10 | L38: 7 | M38: =K38*6+L38 -> 67 | O38: 12 | P38: 16 | Q38: =O38*6+P38 -> 88 | S38: GREGORY
A39: BEST PLAYERS
A40: WILLIAMSTOWN | C40: VALLENCE | F40: TODD | I40: JAMIESON | L40: FITCH | O40: GLASS | R40: MENZIES
A41: YARRAVILLE | C41: JONES | F41: JACK | I41: GRAY | L41: TEMPEST | O41: HOPKINS | R41: McVEIGH
A42: GOALKICKERS
A43: WILLIAMSTOWN | C43: VALLENCE 15 | F43: TODD 4 | H43: JAMIESON 4 | K43: THOMAS 3 | N43: FITCH 3 | P43: QUINN 3 | R43: SPOKES 2 | U43: CAVE | W43: RYAN
A44: YARRAVILLE | C44: LAWLER 4 | F44: HOPKINS 2 | I44: TEMPEST 2 | L44: McVEIGH | N44: PERUSSICH | Q44: PLUMMER | T44: McGRATH
A46: PRESTON | C46: 1 | D46: 1 | E46: =C46*6+D46 -> 7 | G46: 8 | H46: 10 | I46: =G46*6+H46 -> 58 | K46: 10 | L46: 11 | M46: =K46*6+L46 -> 71 | O46: 15 | P46: 13 | Q46: =O46*6+P46 -> 103 | S46: PRESTON
A47: NORTHCOTE | C47: 3 | D47: 6 | E47: =C47*6+D47 -> 24 | G47: 4 | H47: 6 | I47: =G47*6+H47 -> 30 | K47: 6 | L47: 17 | M47: =K47*6+L47 -> 53 | O47: 8 | P47: 17 | Q47: =O47*6+P47 -> 65 | S47: MERRINGTON
A48: BEST PLAYERS
A49: PRESTON | C49: MORRISON | F49: CLARKE | I49: J NORMAN | L49: DUNSTONE | O49: TAYLOR | R49: I NORMAN
A50: NORTHCOTE | C50: HISCOX | F50: DRYDEN | I50: CAHILL | L50: SANDY | O50: HOLDEN | R50: NEESON
A51: GOALKICKERS
A52: PRESTON | C52: DUNSTONE 5 | F52: CLARKE 5 | I52: DUNHAM 2 | L52: MORRISON | N52: ROSS | P52: J NORMAN
A53: NORTHCOTE | C53: NEESON 3 | F53: HISCOX 3 | I53: SANDY | L53: CAHILL
A55: CAMBERWELL | C55: 7 | D55: 9 | E55: =C55*6+D55 -> 51 | G55: 9 | H55: 11 | I55: =G55*6+H55 -> 65 | K55: 19 | L55: 17 | M55: =K55*6+L55 -> 131 | O55: 20 | P55: 18 | Q55: =O55*6+P55 -> 138 | S55: CAMBERWELL
A56: OAKLEIGH | C56: 0 | D56: 2 | E56: =C56*6+D56 -> 2 | G56: 8 | H56: 11 | I56: =G56*6+H56 -> 59 | K56: 9 | L56: 13 | M56: =K56*6+L56 -> 67 | O56: 17 | P56: 18 | Q56: =O56*6+P56 -> 120 | S56: GROVES
A57: BEST PLAYERS
A58: CAMBERWELL | C58: NASH | E58: ANDERSON | H58: FARRELLY | K58: CANNINGTON | N58: HOPKINS | Q58: CLAMP
A59: OAKLEIGH | C59: NOLAN | E59: CRAMERI | H59: SMITH | K59: BEARD | N59: DOWLER | Q59: CLARKE
A60: GOALKICKERS
A61: CAMBERWELL | C61: NASH 6 | E61: ANDERSON 4 | H61: CLAMP 3 | J61: FORD 2 | L61: FARRELLY 2 | O61: HOPKINS | Q61: WOOLFE | S61: WHITEHEAD
A62: OAKLEIGH | C62: NOLAN 6 | E62: CRAMERI 3 | H62: CLARK 2 | J62: DOWLER 2 | M62: KENNEDY | O62: BEARD | Q62: O'DONOGHUE | T62: RYAN
A64: ROUND 2 | E64: 27TH APRIL | J64: WEATHER | M64: CLOUDY BUT FINE S.E. WIND | S64: PLAYED AT
D65: 1ST QTR | H65: 2ND QTR | L65: 3RD QTR | P65: FINAL | S65: WILLIAMSTOWN
A66: WILLIAMSTOWN | C66: 1 | D66: 2 | E66: =C66*6+D66 -> 8 | G66: 4 | H66: 10 | I66: =G66*6+H66 -> 34 | K66: 13 | L66: 13 | M66: =K66*6+L66 -> 91 | O66: 20 | P66: 19 | Q66: =O66*6+P66 -> 139 | S66: UMPIRE | X66: LADDER | AB66: ROUND | AD66: 2
A67: BRIGHTON | C67: 4 | D67: 6 | E67: =C67*6+D67 -> 30 | G67: 5 | H67: 12 | I67: =G67*6+H67 -> 42 | K67: 7 | L67: 14 | M67: =K67*6+L67 -> 56 | O67: 8 | P67: 15 | Q67: =O67*6+P67 -> 63 | S67: DWYER
A68: BEST PLAYERS | W68: TEAM | X68: W | Y68: L | Z68: D | AA68: FOR | AB68: AGST | AC68: % | AD68: PTS
A69: WILLIAMSTOWN | C69: DELLER | E69: PATERSON | H69: SPOKES | K69: OGDEN | N69: GLASS | Q69: JAMIESON
A70: BRIGHTON | C70: GEORGE | E70: McINERNEY | H70: BOLWELL | K70: GODFREY | N70: HINDSON | Q70: R MILLER | W70: WILLIAMSTOWN | X70: 2 | Y70: 0 | Z70: 0 | AA70: 375 | AB70: 151 | AC70: 248.34437086092714 | AD70: 8
A71: GOALKICKERS | W71: BRUNSWICK | X71: 2 | Y71: 0 | Z71: 0 | AA71: 229 | AB71: 155 | AC71: 147.74193548387098 | AD71: 8
A72: WILLIAMSTOWN | C72: VALLENCE 6 | F72: THOMAS 4 | I72: JAMIESON 4 | L72: PATERSON 3 | O72: TODD 3 | W72: PORT MELBOURNE | X72: 2 | Y72: 0 | Z72: 0 | AA72: 272 | AB72: 189 | AC72: 143.91534391534393 | AD72: 8
A73: BRIGHTON | C73: FINDLAY 2 | F73: BOLWELL | I73: CONNELL | K73: GODFREY | M73: BIRD | O73: R MILLER | Q73: HARTNETT | W73: CAMBERWELL | X73: 2 | Y73: 0 | Z73: 0 | AA73: 252 | AB73: 214 | AC73: 117.75700934579439 | AD73: 8
A75: BRUNSWICK | C75: 4 | D75: 1 | E75: =C75*6+D75 -> 25 | G75: 7 | H75: 12 | I75: =G75*6+H75 -> 54 | K75: 13 | L75: 12 | M75: =K75*6+L75 -> 90 | O75: 20 | P75: 16 | Q75: =O75*6+P75 -> 136 | S75: OAKLEIGH | W75: PRESTON | X75: 1 | Y75: 1 | Z75: 0 | AA75: 199 | AB75: 191 | AC75: 104.18848167539267 | AD75: 4
A76: OAKLEIGH | C76: 4 | D76: 8 | E76: =C76*6+D76 -> 32 | G76: 5 | H76: 10 | I76: =G76*6+H76 -> 40 | K76: 9 | L76: 20 | M76: =K76*6+L76 -> 74 | O76: 13 | P76: 26 | Q76: =O76*6+P76 -> 104 | S76: HAYES | W76: COBURG | X76: 1 | Y76: 1 | Z76: 0 | AA76: 165 | AB76: 188 | AC76: 87.765957446808514 | AD76: 4
A77: BEST PLAYERS | W77: BRIGHTON | X77: 1 | Y77: 1 | Z77: 0 | AA77: 201 | AB77: 230 | AC77: 87.391304347826093 | AD77: 4
A78: BRUNSWICK | C78: JONES | E78: McELROY | H78: McKERNAN | K78: CRAWFORD | N78: BOYD | Q78: H QUINN | W78: PRAHRAN | X78: 1 | Y78: 1 | Z78: 0 | AA78: 206 | AB78: 245 | AC78: 84.08163265306122 | AD78: 4
A79: OAKLEIGH | C79: ASH | E79: REID | H79: CLARKE | K79: McCRORY | N79: WHITE | Q79: TOWNSEND | W79: OAKLEIGH | X79: 0 | Y79: 2 | Z79: 0 | AA79: 224 | AB79: 274 | AC79: 81.751824817518255 | AD79: 0
A80: GOALKICKERS | W80: SANDRINGHAM | X80: 0 | Y80: 2 | Z80: 0 | AA80: 200 | AB80: 261 | AC80: 76.628352490421463 | AD80: 0
A81: BRUNSWICK | C81: JONES 9 | F81: CRAWFORD 4 | I81: DOWLING 2 | L81: KEMP 2 | N81: McGRATH | P81: CLARKE | R81: McELROY | W81: NORTHCOTE | X81: 0 | Y81: 2 | Z81: 0 | AA81: 159 | AB81: 217 | AC81: 73.271889400921665 | AD81: 0
A82: OAKLEIGH | C82: McCRORY 5 | F82: NOLAN 4 | I82: WHITE 2 | L82: KENNEDY | N82: CLARK | W82: YARRAVILLE | X82: 0 | Y82: 2 | Z82: 0 | AA82: 183 | AB82: 350 | AC82: 52.285714285714285 | AD82: 0
A84: PORT MELBOURNE | C84: 5 | D84: 2 | E84: =C84*6+D84 -> 32 | G84: 9 | H84: 6 | I84: =G84*6+H84 -> 60 | K84: 14 | L84: 7 | M84: =K84*6+L84 -> 91 | O84: 19 | P84: 9 | Q84: =O84*6+P84 -> 123 | S84: BEACH ROAD
A85: SANDRINGHAM | C85: 4 | D85: 10 | E85: =C85*6+D85 -> 34 | G85: 5 | H85: 14 | I85: =G85*6+H85 -> 44 | K85: 14 | L85: 19 | M85: =K85*6+L85 -> 103 | O85: 14 | P85: 25 | Q85: =O85*6+P85 -> 109 | S85: GROVES
A86: BEST PLAYERS
A87: PORT MELBOURNE | C87: GOLDSMITH | F87: HURLEY | I87: KELLY | L87: DOBSON | O87: HAYES | Q87: LAHIFF
A88: SANDRINGHAM | C88: PETTIONA | F88: FREY | I88: ALLISTER | L88: STAPLETON | O88: ROBINSON | Q88: MCINTYRE
A89: GOALKICKERS
A90: PORT MELBOURNE | C90: FREYER 5 | F90: LAHIFF 5 | I90: HURLEY 4 | K90: COLES 2 | M90: GOLDSMITH | P90: REYNOLDS | R90: KELLY
A91: SANDRINGHAM | C91: ROBINSON 4 | F91: ALLISTER 3 | I91: McINTYRE 2 | L91: KENT | N91: WITHERS | P91: FREY | Q91: FISHER | S91: LUDLOW
A93: CAMBERWELL | C93: 4 | D93: 2 | E93: =C93*6+D93 -> 26 | G93: 8 | H93: 11 | I93: =G93*6+H93 -> 59 | K93: 12 | L93: 13 | M93: =K93*6+L93 -> 85 | O93: 16 | P93: 18 | Q93: =O93*6+P93 -> 114 | S93: NORTHCOTE
A94: NORTHCOTE | C94: 6 | D94: 2 | E94: =C94*6+D94 -> 38 | G94: 7 | H94: 4 | I94: =G94*6+H94 -> 46 | K94: 10 | L94: 10 | M94: =K94*6+L94 -> 70 | O94: 13 | P94: 16 | Q94: =O94*6+P94 -> 94 | S94: McALPINE
A95: BEST PLAYERS
A96: CAMBERWELL | C96: SEELENMEYER | F96: MILNE | I96: CLAMP | L96: FORD | O96: NASH | Q96: WOOLFE
A97: NORTHCOTE | C97: HISCOX | F97: B HART | I97: HOLDEN | L97: CAHILL | O97: NEESON | Q97: DRYDEN
A98: GOALKICKERS
A99: CAMBERWELL | C99: NASH 8 | F99: CLAMP 2 | I99: FORD 2 | K99: HARLEY | M99: CANNINGTON | P99: WHITEHEAD | S99: ANDERSON
A100: NORTHCOTE | C100: HISCOX 3 | F100: NEESON 3 | I100: CAHILL 2 | K100: B HART 2 | M100: DRYDEN | O100: SIMPSON | Q100: HOLDEN
A102: COBURG | C102: 6 | D102: 3 | E102: =C102*6+D102 -> 39 | G102: 13 | H102: 4 | I102: =G102*6+H102 -> 82 | K102: 15 | L102: 6 | M102: =K102*6+L102 -> 96 | O102: 17 | P102: 12 | Q102: =O102*6+P102 -> 114 | S102: COBURG
A103: YARRAVILLE | C103: 3 | D103: 4 | E103: =C103*6+D103 -> 22 | G103: 8 | H103: 6 | I103: =G103*6+H103 -> 54 | K103: 9 | L103: 11 | M103: =K103*6+L103 -> 65 | O103: 13 | P103: 17 | Q103: =O103*6+P103 -> 95 | S103: MERRINGTON
A104: BEST PLAYERS
A105: COBURG | C105: COLLINS | F105: PRATT | I105: PRENDERGAST | L105: BAINES | O105: RINGHOLT | R105: JORDAN
A106: YARRAVILLE | C106: TURNER | F106: HOPKINS | I106: TEMPEST | L106: BARROW | O106: PERUSSICH | R106: KENNY
A107: GOALKICKERS
A108: COBURG | C108: PRATT 12 | F108: PRENDERGAST 3 | J108: BAINES | M108: RALSTON
A109: YARRAVILLE | C109: TURNER 5 | F109: LAWLER 2 | I109: TEMPEST | K109: KENNY | M109: KELLY | O109: ALSOP | Q109: SMITH | S109: HOPKINS
A111: PRAHRAN | C111: 5 | D111: 7 | E111: =C111*6+D111 -> 37 | G111: 7 | H111: 16 | I111: =G111*6+H111 -> 58 | K111: 10 | L111: 23 | M111: =K111*6+L111 -> 83 | O111: 17 | P111: 24 | Q111: =O111*6+P111 -> 126 | S111: TOORAK PARK
A112: PRESTON | C112: 3 | D112: 1 | E112: =C112*6+D112 -> 19 | G112: 6 | H112: 6 | I112: =G112*6+H112 -> 42 | K112: 8 | L112: 9 | M112: =K112*6+L112 -> 57 | O112: 14 | P112: 12 | Q112: =O112*6+P112 -> 96 | S112: GREGORY
A113: BEST PLAYERS
A114: PRAHRAN | C114: PEARCE | F114: THOMPSON | I114: JOHNSON | L114: TAYLOR | O114: McNAUGHTON | R114: FAUL
A115: PRESTON | C115: J NORMAN | F115: MORRISON | I115: DUNSTONE | L115: GRAY | O115: DOWLING
A116: GOALKICKERS
A117: PRAHRAN | C117: ANDERS 6 | F117: O'DONNELL 5 | I117: PROBYN 3 | L117: DAVEY 2 | N117: GRAVELL
A118: PRESTON | C118: MORRISON 3 | F118: DUNSTONE 3 | I118: TAYLOR 3 | L118: DUNHAM 2 | N118: ROSS | P118: CLARKE | R118: SEEDSMAN
A120: ROUND 3 | E120: 4TH MAY | J120: WEATHER | M120: FINE CLOUDY WEST WIND | S120: PLAYED AT
D121: 1ST QTR | H121: 2ND QTR | L121: 3RD QTR | P121: FINAL | S121: PORT MELBOURNE
A122: WILLIAMSTOWN | C122: 4 | D122: 4 | E122: =C122*6+D122 -> 28 | G122: 7 | H122: 13 | I122: =G122*6+H122 -> 55 | K122: 10 | L122: 15 | M122: =K122*6+L122 -> 75 | O122: 14 | P122: 20 | Q122: =O122*6+P122 -> 104 | S122: UMPIRE | X122: LADDER | AB122: ROUND | AD122: 3
A123: PORT MELBOURNE | C123: 4 | D123: 5 | E123: =C123*6+D123 -> 29 | G123: 6 | H123: 6 | I123: =G123*6+H123 -> 42 | K123: 10 | L123: 10 | M123: =K123*6+L123 -> 70 | O123: 12 | P123: 13 | Q123: =O123*6+P123 -> 85 | S123: McALPINE
A124: BEST PLAYERS | W124: TEAM | X124: W | Y124: L | Z124: D | AA124: FOR | AB124: AGST | AC124: % | AD124: PTS
A125: WILLIAMSTOWN | C125: TODD | E125: THOMAS | H125: FITCH | K125: PATERSON | N125: OGDEN | Q125: WILCOX
A126: PORT MELBOURNE | C126: LAHIFF | E126: FREYER | H126: COLES | K126: JULIER | N126: RICHES | Q126: HOSKINGS | W126: WILLIAMSTOWN | X126: 3 | Y126: 0 | Z126: 0 | AA126: 479 | AB126: 236 | AC126: 202.96610169491527 | AD126: 12
A127: GOALKICKERS | W127: CAMBERWELL | X127: 3 | Y127: 0 | Z127: 0 | AA127: 372 | AB127: 316 | AC127: 117.72151898734177 | AD127: 12
A128: WILLIAMSTOWN | C128: VALLENCE 8 | F128: TODD 2 | I128: THOMAS 2 | L128: SPOKES | N128: JOHNSON | W128: PORT MELBOURNE | X128: 2 | Y128: 1 | Z128: 0 | AA128: 357 | AB128: 293 | AC128: 121.84300341296928 | AD128: 8
A129: PORT MELBOURNE | C129: FREYER 7 | F129: COLES 2 | I129: PLUNKETT | L129: JONES | N129: LAHIFF | W129: BRUNSWICK | X129: 2 | Y129: 1 | Z129: 0 | AA129: 331 | AB129: 275 | AC129: 120.36363636363636 | AD129: 8
A131: CAMBERWELL | C131: 1 | D131: 7 | E131: =C131*6+D131 -> 13 | G131: 8 | H131: 8 | I131: =G131*6+H131 -> 56 | K131: 13 | L131: 14 | M131: =K131*6+L131 -> 92 | O131: 17 | P131: 18 | Q131: =O131*6+P131 -> 120 | S131: CAMBERWELL | W131: PRESTON | X131: 2 | Y131: 1 | Z131: 0 | AA131: 334 | AB131: 284 | AC131: 117.6056338028169 | AD131: 8
A132: BRUNSWICK | C132: 3 | D132: 5 | E132: =C132*6+D132 -> 23 | G132: 8 | H132: 10 | I132: =G132*6+H132 -> 58 | K132: 12 | L132: 15 | M132: =K132*6+L132 -> 87 | O132: 14 | P132: 18 | Q132: =O132*6+P132 -> 102 | S132: GROVES | W132: PRAHRAN | X132: 2 | Y132: 1 | Z132: 0 | AA132: 332 | AB132: 315 | AC132: 105.39682539682539 | AD132: 8
A133: BEST PLAYERS | W133: BRIGHTON | X133: 2 | Y133: 1 | Z133: 0 | AA133: 280 | AB133: 296 | AC133: 94.594594594594597 | AD133: 8
A134: CAMBERWELL | C134: HARLEY | F134: FARRELLY | I134: HORKINGS | L134: WOOLFE | N134: ANDERSON | Q134: MILNE | W134: COBURG | X134: 1 | Y134: 2 | Z134: 0 | AA134: 231 | AB134: 267 | AC134: 86.516853932584269 | AD134: 4
A135: BRUNSWICK | C135: DOWLING | F135: McKAY | I135: KEMP | L135: JACOBS | N135: McKERNAN | Q135: FAY | W135: YARRAVILLE | X135: 1 | Y135: 2 | Z135: 0 | AA135: 330 | AB135: 443 | AC135: 74.492099322799092 | AD135: 4
A136: GOALKICKERS | W136: OAKLEIGH | X136: 0 | Y136: 3 | Z136: 0 | AA136: 317 | AB136: 421 | AC136: 75.296912114014248 | AD136: 0
A137: CAMBERWELL | C137: HARLEY 7 | F137: NASH 4 | H137: FARRELLY 2 | K137: ANDERSON 2 | N137: RANDALL | Q137: HORKINGS | W137: SANDRINGHAM | X137: 0 | Y137: 3 | Z137: 0 | AA137: 293 | AB137: 396 | AC137: 73.98989898989899 | AD137: 0
A138: BRUNSWICK | C138: DOWLING 4 | F138: JONES 3 | H138: McKAY 2 | K138: McELROY 2 | N138: COOPER | P138: R QUINN | R138: FITZGIBBON | W138: NORTHCOTE | X138: 0 | Y138: 3 | Z138: 0 | AA138: 229 | AB138: 343 | AC138: 66.763848396501459 | AD138: 0
A140: BRIGHTON | C140: 2 | D140: 6 | E140: =C140*6+D140 -> 18 | G140: 4 | H140: 7 | I140: =G140*6+H140 -> 31 | K140: 8 | L140: 12 | M140: =K140*6+L140 -> 60 | O140: 11 | P140: 13 | Q140: =O140*6+P140 -> 79 | S140: ELSTERNWICK PARK
A141: COBURG | C141: 1 | D141: 1 | E141: =C141*6+D141 -> 7 | G141: 6 | H141: 10 | I141: =G141*6+H141 -> 46 | K141: 7 | L141: 13 | M141: =K141*6+L141 -> 55 | O141: 8 | P141: 18 | Q141: =O141*6+P141 -> 66 | S141: HAYES
A142: BEST PLAYERS
A143: BRIGHTON | C143: K MILLER | F143: CONNELL | I143: HINDSON | L143: GEORGE | O143: SCOTT | R143: HARTNETT
A144: COBURG | C144: COLLINS | F144: CODY | I144: LITTLE | L144: RE | O144: R ATKINSON | R144: BAINES
A145: GOALKICKERS
A146: BRIGHTON | C146: HALLAHAN 4 | F146: DAVIS 2 | I146: BIRD 2 | K146: McINERNEY | N146: SCOTT | P146: HENDER
A147: COBURG | C147: COLLINS 2 | F147: JORDAN | I147: PRATT | K147: LITTLE | M147: HENNING | O147: PRENDERGAST | R147: D ATKINSON
A149: PRAHRAN | C149: 6 | D149: 6 | E149: =C149*6+D149 -> 42 | G149: 8 | H149: 10 | I149: =G149*6+H149 -> 58 | K149: 13 | L149: 13 | M149: =K149*6+L149 -> 91 | O149: 18 | P149: 18 | Q149: =O149*6+P149 -> 126 | S149: NORTHCOTE
A150: NORTHCOTE | C150: 3 | D150: 0 | E150: =C150*6+D150 -> 18 | G150: 6 | H150: 2 | I150: =G150*6+H150 -> 38 | K150: 9 | L150: 5 | M150: =K150*6+L150 -> 59 | O150: 10 | P150: 10 | Q150: =O150*6+P150 -> 70 | S150: PARRIS
A151: BEST PLAYERS
A152: PRAHRAN | C152: DAVEY | G152: PROBYN | J152: TAYLOR | M152: WILLIAMS | P152: BRAY | S152: GRAVELL
A153: NORTHCOTE | C153: D BRETHERTON | G153: MEITZCKE | J153: E HART | M153: B HART | P153: WATT | S153: DRYDEN
A154: GOALKICKERS
A155: PRAHRAN | C155: DAVEY 5 | E155: GRAVELL 4 | H155: THOMPSON 3 | K155: ANDERS | M155: BRAY | N155: O'DONNELL | Q155: BRENCHLEY | T155: PROBYN | W155: ROLFE
A156: NORTHCOTE | C156: BAGULEY 2 | F156: CAHILL 2 | I156: NEESON 2 | K156: KELLY 2 | M156: B HART | O156: MEITZCKE
A158: YARRAVILLE | C158: 4 | D158: 5 | E158: =C158*6+D158 -> 29 | G158: 14 | H158: 16 | I158: =G158*6+H158 -> 100 | K158: 14 | L158: 16 | M158: =K158*6+L158 -> 100 | O158: 20 | P158: 27 | Q158: =O158*6+P158 -> 147 | S158: YARRAVILLE
A159: OAKLEIGH | C159: 6 | D159: 7 | E159: =C159*6+D159 -> 43 | G159: 7 | H159: 8 | I159: =G159*6+H159 -> 50 | K159: 12 | L159: 13 | M159: =K159*6+L159 -> 85 | O159: 13 | P159: 15 | Q159: =O159*6+P159 -> 93 | S159: GEE
A160: BEST PLAYERS
A161: YARRAVILLE | C161: HOPKINS | E161: HEFFERNAN | H161: PLUMMER | K161: KELLY | N161: ROBERTSON | Q161: GARLICK
A162: OAKLEIGH | C162: SMITH | E162: BEARD | H162: WILSON | K162: McCRORY | N162: TOWNSEND | Q162: CRAMERI
A163: GOALKICKERS
A164: YARRAVILLE | C164: PERUSSICH 5 | F164: GARLICK 5 | I164: TURNER 3 | L164: HOPKINS 3 | N164: ROBERTSON 2 | Q164: EARLE | S164: McVEIGH
A165: OAKLEIGH | C165: McCRORY 5 | F165: NOLAN 2 | I165: CRAMERI 2 | L165: BEARD | N165: SMITH | P165: WHITE | R165: CLARK
A167: PRESTON | C167: 5 | D167: 1 | E167: =C167*6+D167 -> 31 | G167: 11 | H167: 7 | I167: =G167*6+H167 -> 73 | K167: 13 | L167: 12 | M167: =K167*6+L167 -> 90 | O167: 19 | P167: 21 | Q167: =O167*6+P167 -> 135 | S167: PRESTON
A168: SANDRINGHAM | C168: 4 | D168: 8 | E168: =C168*6+D168 -> 32 | G168: 6 | H168: 11 | I168: =G168*6+H168 -> 47 | K168: 10 | L168: 9 | M168: =K168*6+L168 -> 69 | O168: 12 | P168: 21 | Q168: =O168*6+P168 -> 93 | S168: MERRINGTON
A169: BEST PLAYERS
A170: PRESTON | C170: MORRISON | F170: DUNSTONE | I170: ROACH | L170: SLEITH | O170: MASLEN | R170: CALVERT
A171: SANDRINGHAM | C171: ALLISTER | F171: WITHERS | I171: FREY | L171: KENT | O171: LUDLOW | R171: MILLER
A172: GOALKICKERS
A173: PRESTON | C173: MORRISON 10 | F173: SLEITH 3 | I173: DUNSTONE 3 | L173: DUNHAM | N173: CALVERT | P173: BEAGLEY
A174: SANDRINGHAM | C174: KENT 2 | E174: ROBINSON 2 | H174: WITHERS 2 | K174: LUDLOW 2 | N174: RYAN | P174: FISHER | R174: ALLISTER | U174: MITCHELL
A176: ROUND 4 | E176: 11TH MAY | J176: WEATHER | M176: CLOUDY BUT FINE NORTH BREEZE | S176: PLAYED AT
D177: 1ST QTR | H177: 2ND QTR | L177: 3RD QTR | P177: FINAL | S177: WILLIAMSTOWN
A178: WILLIAMSTOWN | C178: 5 | D178: 8 | E178: =C178*6+D178 -> 38 | G178: 11 | H178: 9 | I178: =G178*6+H178 -> 75 | K178: 17 | L178: 13 | M178: =K178*6+L178 -> 115 | O178: 22 | P178: 17 | Q178: =O178*6+P178 -> 149 | S178: UMPIRE | X178: LADDER | AB178: ROUND | AD178: 4
A179: PRESTON | C179: 2 | D179: 1 | E179: =C179*6+D179 -> 13 | G179: 6 | H179: 6 | I179: =G179*6+H179 -> 42 | K179: 7 | L179: 9 | M179: =K179*6+L179 -> 51 | O179: 10 | P179: 13 | Q179: =O179*6+P179 -> 73 | S179: McALPINE
A180: BEST PLAYERS | W180: TEAM | X180: W | Y180: L | Z180: D | AA180: FOR | AB180: AGST | AC180: % | AD180: PTS
A181: WILLIAMSTOWN | C181: PATERSON | F181: THOMAS | I181: MENZIES | L181: WILCOX | O181: DELLER | Q181: SPOKES
A182: PRESTON | C182: CLARKE | F182: COLBAN | I182: MASLEN | L182: MORRISON | O182: WATKINS | Q182: DOWLING | W182: WILLIAMSTOWN | X182: 4 | Y182: 0 | Z182: 0 | AA182: 628 | AB182: 309 | AC182: 203.23624595469255 | AD182: 16
A183: GOALKICKERS | W183: BRUNSWICK | X183: 3 | Y183: 1 | Z183: 0 | AA183: 483 | AB183: 374 | AC183: 129.14438502673798 | AD183: 12
A184: WILLIAMSTOWN | C184: VALLENCE 9 | F184: PATERSON 4 | I184: THOMAS 3 | L184: TODD 3 | N184: JAMIESON | Q184: GLASS | S184: CAVE | W184: PRAHRAN | X184: 3 | Y184: 1 | Z184: 0 | AA184: 453 | AB184: 407 | AC184: 111.3022113022113 | AD184: 12
A185: PRESTON | C185: MORRISON 3 | F185: CLARKE 2 | I185: DUNSTONE 2 | L185: COLBAN 2 | N185: CALVERT | W185: CAMBERWELL | X185: 3 | Y185: 1 | Z185: 0 | AA185: 464 | AB185: 437 | AC185: 106.17848970251717 | AD185: 12
A187: PRAHRAN | C187: 4 | D187: 2 | E187: =C187*6+D187 -> 26 | G187: 8 | H187: 8 | I187: =G187*6+H187 -> 56 | K187: 10 | L187: 13 | M187: =K187*6+L187 -> 73 | O187: 17 | P187: 19 | Q187: =O187*6+P187 -> 121 | S187: TOORAK PARK | W187: PORT MELBOURNE | X187: 2 | Y187: 2 | Z187: 0 | AA187: 441 | AB187: 391 | AC187: 112.78772378516624 | AD187: 8
A188: CAMBERWELL | C188: 6 | D188: 2 | E188: =C188*6+D188 -> 38 | G188: 8 | H188: 3 | I188: =G188*6+H188 -> 51 | K188: 12 | L188: 13 | M188: =K188*6+L188 -> 85 | O188: 13 | P188: 14 | Q188: =O188*6+P188 -> 92 | S188: DWYER | W188: BRIGHTON | X188: 2 | Y188: 2 | Z188: 0 | AA188: 395 | AB188: 417 | AC188: 94.72 | AD188: 8
A189: BEST PLAYERS | W189: PRESTON | X189: 2 | Y189: 2 | Z189: 0 | AA189: 407 | AB189: 433 | AC189: 94 | AD189: 8
A190: PRAHRAN | C190: DAVEY | F190: BRENCHLEY | I190: HAWKINS | L190: FAUL | N190: O'DONNELL | Q190: PEARCE | W190: COBURG | X190: 2 | Y190: 2 | Z190: 0 | AA190: 329 | AB190: 351 | AC190: 93.73 | AD190: 8
A191: CAMBERWELL | C191: HOPKINS | F191: CLAMP | I191: DURAND | L191: FORD | N191: UNWIN | Q191: HARLEY | W191: OAKLEIGH | X191: 1 | Y191: 3 | Z191: 0 | AA191: 438 | AB191: 536 | AC191: 81.72 | AD191: 4
A192: GOALKICKERS | W192: NORTHCOTE | X192: 1 | Y192: 3 | Z192: 0 | AA192: 358 | AB192: 454 | AC192: 78.85 | AD192: 4
A193: PRAHRAN | C193: HAWKINS 6 | F193: BRENCHLEY 5 | I193: O'DONNELL 2 | L193: ANDERS 2 | N193: DAVEY | P193: GRAVELL | W193: YARRAVILLE | X193: 1 | Y193: 3 | Z193: 0 | AA193: 429 | AB193: 595 | AC193: 72.1 | AD193: 4
A194: CAMBERWELL | C194: HARLEY 4 | F194: TOOHEY 2 | I194: CLAMP 2 | K194: NASH 2 | M194: HENDERSON | P194: DURAND | W194: SANDRINGHAM | X194: 0 | Y194: 4 | Z194: 0 | AA194: 404 | AB194: 525 | AC194: 76.95 | AD194: 0
A196: COBURG | C196: 4 | D196: 1 | E196: =C196*6+D196 -> 25 | G196: 10 | H196: 1 | I196: =G196*6+H196 -> 61 | K196: 13 | L196: 6 | M196: =K196*6+L196 -> 84 | O196: 15 | P196: 8 | Q196: =O196*6+P196 -> 98 | S196: COBURG
A197: PORT MELBOURNE | C197: 2 | D197: 3 | E197: =C197*6+D197 -> 15 | G197: 8 | H197: 6 | I197: =G197*6+H197 -> 54 | K197: 8 | L197: 8 | M197: =K197*6+L197 -> 56 | O197: 12 | P197: 12 | Q197: =O197*6+P197 -> 84 | S197: PARRIS
A198: BEST PLAYERS
A199: COBURG | C199: COLLINS | E199: R ATKINSON | H199: IRVINE | K199: PRENDERGAST | O199: RE | Q199: MULLENGER
A200: PORT MELBOURNE | C200: JULIER | E200: LAHIFF | H200: RICHES | K200: DOBSON | O200: JONES | Q200: FRYER
A201: GOALKICKERS
A202: COBURG | C202: PRATT 8 | E202: COLLINS 2 | H202: LONSDALE 2 | K202: MULLENGER | N202: LITTLE | P202: PRENDERGAST | S202: D ATKINSON | V202: ANDERSON
A203: PORT MELBOURNE | C203: FRYER 5 | E203: PLUNKETT 2 | H203: FLETCHER | J203: LAHIFF | L203: COLES | N203: REYNOLDS | Q203: RICHES
A205: OAKLEIGH | C205: 1 | D205: 5 | E205: =C205*6+D205 -> 11 | G205: 6 | H205: 11 | I205: =G205*6+H205 -> 47 | K205: 12 | L205: 16 | M205: =K205*6+L205 -> 88 | O205: 17 | P205: 19 | Q205: =O205*6+P205 -> 121 | S205: OAKLEIGH
A206: BRIGHTON | C206: 7 | D206: 6 | E206: =C206*6+D206 -> 48 | G206: 11 | H206: 10 | I206: =G206*6+H206 -> 76 | K206: 14 | L206: 12 | M206: =K206*6+L206 -> 96 | O206: 17 | P206: 13 | Q206: =O206*6+P206 -> 115 | S206: HAYES
A207: BEST PLAYERS
A208: OAKLEIGH | C208: BEARD | E208: McCRORY | H208: LAW | J208: WILSON | M208: TOWNSEND | P208: NOLAN
A209: BRIGHTON | C209: DAVIS | E209: GEORGE | H209: BIRD | J209: HARTNETT | M209: McINERNEY | P209: CONNELL
A210: GOALKICKERS
A211: OAKLEIGH | C211: McCRORY 5 | F211: RAMSDALE 4 | I211: NOLAN 4 | K211: LAW 2 | M211: BEARD | O211: SMITH
A212: BRIGHTON | C212: JIM HALLAHAN 3 | G212: BIRD 3 | I212: CONNELL 3 | L212: GODFREY 2 | O212: JACK HALLAHAN 2 | S212: McINERNEY 2 | W212: HARTNETT | X212: DAVIS
A214: NORTHCOTE | C214: 9 | D214: 6 | E214: =C214*6+D214 -> 60 | G214: 12 | H214: 9 | I214: =G214*6+H214 -> 81 | K214: 17 | L214: 12 | M214: =K214*6+L214 -> 114 | O214: 19 | P214: 15 | Q214: =O214*6+P214 -> 129 | S214: BEACH ROAD
A215: SANDRINGHAM | C215: 1 | D215: 1 | E215: =C215*6+D215 -> 7 | G215: 6 | H215: 8 | I215: =G215*6+H215 -> 44 | K215: 11 | L215: 7 | M215: =K215*6+L215 -> 73 | O215: 15 | P215: 21 | Q215: =O215*6+P215 -> 111 | S215: GEE
A216: BEST PLAYERS
A217: NORTHCOTE | C217: E HART | E217: WHITE | H217: DRYDEN | K217: SIMPSON | N217: HOLDEN | Q217: D BRETHERTON
A218: SANDRINGHAM | C218: WITHERS | E218: HEDGE | H218: LUDLOW | K218: WITCHELL | N218: MILLER | Q218: RYAN
A219: GOALKICKERS
A220: NORTHCOTE | C220: WHITE 8 | E220: MEITZCKE 3 | H220: SIMPSON 3 | K220: McINTOSH 2 | N220: HISCOX 2 | Q220: ARCHER
A221: SANDRINGHAM | C221: WITHERS 4 | F221: KENT 3 | H221: WITCHELL | J221: FREY | L221: MILLER | N221: McINTYRE | Q221: RYAN | S221: LUDLOW | W221: HEDGE | Y221: SHARP
A223: BRUNSWICK | C223: 3 | D223: 5 | E223: =C223*6+D223 -> 23 | G223: 8 | H223: 7 | I223: =G223*6+H223 -> 55 | K223: 14 | L223: 9 | M223: =K223*6+L223 -> 93 | O223: 23 | P223: 14 | Q223: =O223*6+P223 -> 152 | S223: BRUNSWICK
A224: YARRAVILLE | C224: 2 | D224: 1 | E224: =C224*6+D224 -> 13 | G224: 6 | H224: 3 | I224: =G224*6+H224 -> 39 | K224: 13 | L224: 7 | M224: =K224*6+L224 -> 85 | O224: 15 | P224: 9 | Q224: =O224*6+P224 -> 99 | S224: MERRINGTON
A225: BEST PLAYERS
A226: BRUNSWICK | C226: DOWLING | F226: COOPER | I226: BAILEY | L226: BOYD | O226: McELROY | R226: QUINN
A227: YARRAVILLE | C227: PERUSSICH | F227: REDPATH | I227: ALSOP | L227: GRAY | O227: T SMITH | R227: EARLE
A228: GOALKICKERS
A229: BRUNSWICK | C229: DOWLING 8 | F229: JEFFREY 4 | I229: McDERMOTT 3 | L229: JONES 2 | N229: McELROY 2 | Q229: BOYD | S229: KEMP | U229: QUINN | X229: BAILEY
A230: YARRAVILLE | C230: PERUSSICH 5 | F230: ALSOP 4 | H230: TURNER 2 | J230: McVEIGH | L230: KELLY | N230: T SMITH | P230: ROBERTSON
A232: ROUND 5 | E232: 18TH MAY | J232: WEATHER | M232: COLD CLOUDY S.W. WIND | S232: PLAYED AT
D233: 1ST QTR | H233: 2ND QTR | L233: 3RD QTR | P233: FINAL | S233: ELSTERNWICK PARK
A234: BRUNSWICK | C234: 2 | D234: 5 | E234: =C234*6+D234 -> 17 | G234: 6 | H234: 6 | I234: =G234*6+H234 -> 42 | K234: 11 | L234: 11 | M234: =K234*6+L234 -> 77 | O234: 16 | P234: 11 | Q234: =O234*6+P234 -> 107 | S234: UMPIRE | X234: LADDER | AB234: ROUND | AD234: 5
A235: BRIGHTON | C235: 3 | D235: 0 | E235: =C235*6+D235 -> 18 | G235: 10 | H235: 6 | I235: =G235*6+H235 -> 66 | K235: 11 | L235: 8 | M235: =K235*6+L235 -> 74 | O235: 14 | P235: 13 | Q235: =O235*6+P235 -> 97 | S235: DWYER
A236: BEST PLAYERS | W236: TEAM | X236: W | Y236: L | Z236: D | AA236: FOR | AB236: AGST | AC236: % | AD236: PTS
A237: BRUNSWICK | C237: DOWLING | E237: QUINN | H237: HOBBA | K237: McKAY | N237: BOYD | Q237: WINTER
A238: BRIGHTON | C238: DAVIS | E238: WILLIAMSON | H238: HENDER | K238: GEORGE | N238: ALVIN | Q238: MOFFATT | W238: WILLIAMSTOWN | X238: 4 | Y238: 1 | Z238: 0 | AA238: 745 | AB238: 435 | AC238: 171.26436781609195 | AD238: 16
A239: GOALKICKERS | W239: BRUNSWICK | X239: 4 | Y239: 1 | Z239: 0 | AA239: 590 | AB239: 471 | AC239: 125.26539278131635 | AD239: 16
A240: BRUNSWICK | C240: DOWLING 6 | F240: JONES 5 | I240: JEFFREY 3 | L240: BAILEY | N240: WINTER | W240: CAMBERWELL | X240: 4 | Y240: 1 | Z240: 0 | AA240: 671 | AB240: 537 | AC240: 124.95344506517691 | AD240: 16
A241: BRIGHTON | C241: BIRD 4 | F241: DAVIS 3 | I241: HENDER 3 | L241: JIM HALLAHAN 2 | P241: FINDLAY | R241: CONNELL | W241: PRAHRAN | X241: 4 | Y241: 1 | Z241: 0 | AA241: 585 | AB241: 518 | AC241: 112.93436293436294 | AD241: 16
A243: PRESTON | C243: 2 | D243: 4 | E243: =C243*6+D243 -> 16 | G243: 4 | H243: 14 | I243: =G243*6+H243 -> 38 | K243: 5 | L243: 16 | M243: =K243*6+L243 -> 46 | O243: 9 | P243: 21 | Q243: =O243*6+P243 -> 75 | S243: PRESTON | W243: PORT MELBOURNE | X243: 3 | Y243: 2 | Z243: 0 | AA243: 620 | AB243: 484 | AC243: 128.099173553719 | AD243: 12
A244: COBURG | C244: 2 | D244: 6 | E244: =C244*6+D244 -> 18 | G244: 4 | H244: 8 | I244: =G244*6+H244 -> 32 | K244: 10 | L244: 13 | M244: =K244*6+L244 -> 73 | O244: 10 | P244: 13 | Q244: =O244*6+P244 -> 73 | S244: LEWIS | W244: PRESTON | X244: 3 | Y244: 2 | Z244: 0 | AA244: 482 | AB244: 506 | AC244: 95.256916996047437 | AD244: 12
A245: BEST PLAYERS | W245: COBURG | X245: 2 | Y245: 3 | Z245: 0 | AA245: 402 | AB245: 426 | AC245: 94.366197183098592 | AD245: 8
A246: PRESTON | C246: GRAY | F246: DEACON | I246: J NORMAN | L246: DOWLING | O246: MINNAY | Q246: MORRISON | W246: BRIGHTON | X246: 2 | Y246: 3 | Z246: 0 | AA246: 492 | AB246: 524 | AC246: 93.89312977099236 | AD246: 8
A247: COBURG | C247: MULLENGER | F247: ANDERSON | I247: COLLINS | L247: D ATKINSON | O247: BAINES | Q247: PRENDERGAST | W247: NORTHCOTE | X247: 2 | Y247: 3 | Z247: 0 | AA247: 484 | AB247: 571 | AC247: 84.763572679509636 | AD247: 8
A248: GOALKICKERS | W248: OAKLEIGH | X248: 1 | Y248: 4 | Z248: 0 | AA248: 531 | AB248: 715 | AC248: 74.265734265734267 | AD248: 4
A249: PRESTON | C249: I NORMAN 2 | F249: SEEDSMAN 2 | I249: MORRISON | L249: J NORMAN | N249: DUNSTONE | Q249: CLARKE | S249: DEACON | W249: YARRAVILLE | X249: 1 | Y249: 4 | Z249: 0 | AA249: 529 | AB249: 802 | AC249: 65.960099750623442 | AD249: 4
A250: COBURG | C250: PRATT 4 | F250: COLLINS 2 | I250: BAINES 2 | K250: JOHNSON | M250: ANDERSON | W250: SANDRINGHAM | X250: 0 | Y250: 5 | Z250: 0 | AA250: 515 | AB250: 657 | AC250: 78.386605783866059 | AD250: 0
A252: PORT MELBOURNE | C252: 9 | D252: 5 | E252: =C252*6+D252 -> 59 | G252: 16 | H252: 13 | I252: =G252*6+H252 -> 109 | K252: 19 | L252: 15 | M252: =K252*6+L252 -> 129 | O252: 26 | P252: 23 | Q252: =O252*6+P252 -> 179 | S252: PORT MELBOURNE
A253: OAKLEIGH | C253: 2 | D253: 7 | E253: =C253*6+D253 -> 19 | G253: 6 | H253: 10 | I253: =G253*6+H253 -> 46 | K253: 11 | L253: 13 | M253: =K253*6+L253 -> 79 | O253: 13 | P253: 15 | Q253: =O253*6+P253 -> 93 | S253: HAYES
A254: BEST PLAYERS
A255: PORT MELBOURNE | C255: LAHIFF | F255: FREYER | I255: RICHES | K255: KELLY | N255: GOLDSMITH | Q255: ROBERTSON
A256: OAKLEIGH | C256: DOWLER | F256: SMITH | I256: LAW | K256: RYAN | N256: ASH | Q256: THOMPSON
A257: GOALKICKERS
A258: PORT MELBOURNE | C258: FREYER 12 | F258: LAHIFF 4 | I258: PLUNKETT 3 | L258: RICHES 2 | N258: STEIGENBERGER 2 | R258: DUGGAN 2 | U258: KELLY
A259: OAKLEIGH | C259: DOWLER 7 | F259: McCRORY 2 | I259: LAW | J259: RYAN | L259: NOLAN | N259: KENNEDY
A261: CAMBERWELL | C261: 6 | D261: 2 | E261: =C261*6+D261 -> 38 | G261: 17 | H261: 6 | I261: =G261*6+H261 -> 108 | K261: 24 | L261: 12 | M261: =K261*6+L261 -> 156 | O261: 32 | P261: 15 | Q261: =O261*6+P261 -> 207 | S261: CAMBERWELL
A262: YARRAVILLE | C262: 4 | D262: 1 | E262: =C262*6+D262 -> 25 | G262: 7 | H262: 2 | I262: =G262*6+H262 -> 44 | K262: 12 | L262: 4 | M262: =K262*6+L262 -> 76 | O262: 15 | P262: 10 | Q262: =O262*6+P262 -> 100 | S262: GROVES
A263: BEST PLAYERS
A264: CAMBERWELL | C264: NASH | E264: HOPKINS | H264: FORD | K264: HENDERSON | N264: SEELENMEYER | Q264: TOOHEY
A265: YARRAVILLE | C265: HOPKINS | E265: WEDGWOOD | H265: ALSOP | K265: PLUMMER | N265: KELLY | Q265: RANN
A266: GOALKICKERS
A267: CAMBERWELL | C267: NASH 10 | F267: HOPKINS 6 | I267: HARLEY 6 | L267: CANNINGTON 3 | O267: WHITEHEAD 3 | R267: FORD 2 | U267: CLAMP 2
A268: YARRAVILLE | C268: ALSOP 4 | F268: PERUSSICH 3 | I268: TURNER 3 | L268: ROBERTSON 2 | O268: T SMITH | Q268: McVEIGH | S268: HOPKINS
A270: NORTHCOTE | C270: 5 | D270: 5 | E270: =C270*6+D270 -> 35 | G270: 11 | H270: 8 | I270: =G270*6+H270 -> 74 | K270: 15 | L270: 13 | M270: =K270*6+L270 -> 103 | O270: 18 | P270: 18 | Q270: =O270*6+P270 -> 126 | S270: NORTHCOTE
A271: WILLIAMSTOWN | C271: 4 | D271: 3 | E271: =C271*6+D271 -> 27 | G271: 7 | H271: 4 | I271: =G271*6+H271 -> 46 | K271: 17 | L271: 7 | M271: =K271*6+L271 -> 109 | O271: 18 | P271: 9 | Q271: =O271*6+P271 -> 117 | S271: MERRINGTON
A272: BEST PLAYERS
A273: NORTHCOTE | C273: MEITZCKE | F273: E HART | I273: DRYDEN | L273: WHITE | O273: HISCOX | R273: POLLARD
A274: WILLIAMSTOWN | C274: DELLER | F274: CHISHOLM | I274: HARLAND | L274: TODD | O274: THOMAS | R274: PATERSON
A275: GOALKICKERS
A276: NORTHCOTE | C276: WHITE 5 | F276: MEITZCKE 4 | I276: HISCOX 4 | K276: POLLARD | M276: VENNING | O276: E HART | Q276: POWELL | S276: McINTOSH
A277: WILLIAMSTOWN | C277: VALLENCE 6 | F277: TODD 5 | H277: SPOKES 2 | J277: PATERSON 2 | M277: THOMAS 2 | P277: CHISHOLM
A279: PRAHRAN | C279: 6 | D279: 2 | E279: =C279*6+D279 -> 38 | G279: 11 | H279: 9 | I279: =G279*6+H279 -> 75 | K279: 13 | L279: 13 | M279: =K279*6+L279 -> 91 | O279: 19 | P279: 18 | Q279: =O279*6+P279 -> 132 | S279: TOORAK PARK
A280: SANDRINGHAM | C280: 4 | D280: 6 | E280: =C280*6+D280 -> 30 | G280: 8 | H280: 9 | I280: =G280*6+H280 -> 57 | K280: 14 | L280: 19 | M280: =K280*6+L280 -> 103 | O280: 15 | P280: 21 | Q280: =O280*6+P280 -> 111 | S280: GEE
A281: BEST PLAYERS
A282: PRAHRAN | C282: FAUL | E282: WILLIAMS | H282: ANDERS | K282: PEARCE | N282: GRAVELL | Q282: WHITEHEAD
A283: SANDRINGHAM | C283: AMINDE | E283: WITHERS | H283: McINTYRE | K283: FREY | N283: SMAIL | Q283: WEBER
A284: GOALKICKERS
A285: PRAHRAN | C285: HAWKINS 9 | F285: ANDERS 5 | I285: BRENCHLEY | L285: PROBYN | N285: O'DONNELL | Q285: PEARCE | S285: DAVEY
A286: SANDRINGHAM | C286: FREY 3 | E286: WITHERS 2 | H286: LUDLOW 2 | J286: McINTYRE 2 | M286: RYAN | N286: WEBER | P286: ALLISTER | R286: HEDGE | T286: ROBINSON | W286: MORRIS
A288: ROUND 6 | E288: 25TH MAY | J288: WEATHER | M288: SHOWERS STRONG WEST WIND | S288: PLAYED AT
D289: 1ST QTR | H289: 2ND QTR | L289: 3RD QTR | P289: FINAL | S289: WILLIAMSTOWN
A290: WILLIAMSTOWN | C290: 6 | D290: 8 | E290: =C290*6+D290 -> 44 | G290: 6 | H290: 8 | I290: =G290*6+H290 -> 44 | K290: 21 | L290: 10 | M290: =K290*6+L290 -> 136 | O290: 22 | P290: 10 | Q290: =O290*6+P290 -> 142 | S290: UMPIRE | X290: LADDER | AB290: ROUND | AD290: 6
A291: PRAHRAN | C291: 0 | D291: 0 | E291: =C291*6+D291 -> 0 | G291: 1 | H291: 9 | I291: =G291*6+H291 -> 15 | K291: 1 | L291: 9 | M291: =K291*6+L291 -> 15 | O291: 7 | P291: 17 | Q291: =O291*6+P291 -> 59 | S291: MANCHESTER
A292: BEST PLAYERS | W292: TEAM | X292: W | Y292: L | Z292: D | AA292: FOR | AB292: AGST | AC292: % | AD292: PTS
A293: WILLIAMSTOWN | C293: TODD | E293: CUTTING | H293: MENZIES | K293: OGDEN | N293: GLASS | Q293: VALLENCE
A294: PRAHRAN | C294: FAUL | E294: BRENCHLEY | H294: KERLEY | K294: O'DONNELL | N294: ANDERS | Q294: TAYLOR | W294: WILLIAMSTOWN | X294: 5 | Y294: 1 | Z294: 0 | AA294: 887 | AB294: 494 | AC294: 179.55465587044534 | AD294: 20
A295: GOALKICKERS | W295: PORT MELBOURNE | X295: 4 | Y295: 2 | Z295: 0 | AA295: 704 | AB295: 566 | AC295: 124.38162544169612 | AD295: 16
A296: WILLIAMSTOWN | C296: VALLENCE 9 | F296: TODD 6 | I296: THOMAS 2 | L296: GLASS 2 | N296: COOPER | P296: HARLAND | R296: PATERSON | W296: BRUNSWICK | X296: 4 | Y296: 2 | Z296: 0 | AA296: 672 | AB296: 555 | AC296: 121.08108108108108 | AD296: 16
A297: PRAHRAN | C297: O'DONNELL 2 | F297: ANDERS 2 | I297: HAWKINS | L297: FAUL | N297: BRENCHLEY | W297: CAMBERWELL | X297: 4 | Y297: 2 | Z297: 0 | AA297: 772 | AB297: 641 | AC297: 120.43681747269891 | AD297: 16
A299: PORT MELBOURNE | C299: 7 | D299: 5 | E299: =C299*6+D299 -> 47 | G299: 8 | H299: 6 | I299: =G299*6+H299 -> 54 | K299: 11 | L299: 9 | M299: =K299*6+L299 -> 75 | O299: 12 | P299: 12 | Q299: =O299*6+P299 -> 84 | S299: BRUNSWICK | W299: PRESTON | X299: 4 | Y299: 2 | Z299: 0 | AA299: 599 | AB299: 575 | AC299: 104.17391304347827 | AD299: 16
A300: BRUNSWICK | C300: 1 | D300: 2 | E300: =C300*6+D300 -> 8 | G300: 3 | H300: 5 | I300: =G300*6+H300 -> 23 | K300: 8 | L300: 10 | M300: =K300*6+L300 -> 58 | O300: 11 | P300: 16 | Q300: =O300*6+P300 -> 82 | S300: MERRINGTON | W300: PRAHRAN | X300: 4 | Y300: 2 | Z300: 0 | AA300: 644 | AB300: 660 | AC300: 97.575757575757578 | AD300: 16
A301: BEST PLAYERS | W301: COBURG | X301: 2 | Y301: 3 | Z301: 1 | AA301: 488 | AB301: 512 | AC301: 95.3125 | AD301: 10
A302: PORT MELBOURNE | C302: LAHIFF | E302: ROBERTSON | H302: RUSSO | K302: CASTLES | N302: KELLY | Q302: FLETCHER | W302: NORTHCOTE | X302: 2 | Y302: 3 | Z302: 1 | AA302: 570 | AB302: 657 | AC302: 86.757990867579906 | AD302: 10
A303: BRUNSWICK | C303: WINTER | E303: McKAY | H303: FAY | K303: McDERMOTT | N303: BAILEY | Q303: BOYD | W303: BRIGHTON | X303: 2 | Y303: 4 | Z303: 0 | AA303: 574 | AB303: 638 | AC303: 89.968652037617559 | AD303: 8
A304: GOALKICKERS | W304: YARRAVILLE | X304: 2 | Y304: 4 | Z304: 0 | AA304: 643 | AB304: 884 | AC304: 72.737556561085967 | AD304: 8
A305: PORT MELBOURNE | C305: FREYER 5 | F305: LAHIFF 3 | I305: DOBSON 2 | L305: KELLY | N305: GOLDSMITH | W305: SANDRINGHAM | X305: 1 | Y305: 5 | Z305: 0 | AA305: 619 | AB305: 758 | AC305: 81.662269129287594 | AD305: 4
A306: BRUNSWICK | C306: JEFFREY 3 | F306: DOWLING 2 | I306: McELROY 2 | L306: BAILEY | N306: McDERMOTT | Q306: RUSSELL | S306: CRAWFORD | W306: OAKLEIGH | X306: 1 | Y306: 5 | Z306: 0 | AA306: 600 | AB306: 832 | AC306: 72.115384615384613 | AD306: 4
A308: PRESTON | C308: 2 | D308: 1 | E308: =C308*6+D308 -> 13 | G308: 10 | H308: 8 | I308: =G308*6+H308 -> 68 | K308: 13 | L308: 9 | M308: =K308*6+L308 -> 87 | O308: 17 | P308: 15 | Q308: =O308*6+P308 -> 117 | S308: OAKLEIGH
A309: OAKLEIGH | C309: 4 | D309: 5 | E309: =C309*6+D309 -> 29 | G309: 6 | H309: 6 | I309: =G309*6+H309 -> 42 | K309: 8 | L309: 12 | M309: =K309*6+L309 -> 60 | O309: 9 | P309: 15 | Q309: =O309*6+P309 -> 69 | S309: GROVES
A310: BEST PLAYERS
A311: PRESTON | C311: DOWLING | F311: MASLEN | I311: ROACH | L311: ROSS | O311: DEACON | R311: MINNEY
A312: OAKLEIGH | C312: BEARD | F312: SMITH | I312: LAW | L312: BICKERTON | O312: CORP | R312: CLARKE
A313: GOALKICKERS
A314: PRESTON | C314: ROSS 3 | E314: MORRISON 2 | H314: SEEDSMAN 2 | K314: CLARKE 2 | M314: DOWLING 2 | P314: L SLEETH | R314: J NORMAN | U314: HARGREAVES | X314: DEACON
A315: OAKLEIGH | C315: DOWLER 2 | F315: KENNEDY 2 | I315: LAW 2 | K315: McCRORY | M315: CLARK | O315: BEARD
A317: SANDRINGHAM | C317: 5 | D317: 2 | E317: =C317*6+D317 -> 32 | G317: 8 | H317: 9 | I317: =G317*6+H317 -> 57 | K317: 10 | L317: 10 | M317: =K317*6+L317 -> 70 | O317: 15 | P317: 14 | Q317: =O317*6+P317 -> 104 | S317: BEACH ROAD
A318: CAMBERWELL | C318: 5 | D318: 4 | E318: =C318*6+D318 -> 34 | G318: 9 | H318: 6 | I318: =G318*6+H318 -> 60 | K318: 13 | L318: 16 | M318: =K318*6+L318 -> 94 | O318: 14 | P318: 17 | Q318: =O318*6+P318 -> 101 | S318: LEWIS
A319: BEST PLAYERS
A320: SANDRINGHAM | C320: MILLER | E320: WEBER | H320: CARTWRIGHT | K320: McINTYRE | N320: KENT | Q320: SHARP
A321: CAMBERWELL | C321: FORD | E321: ROGERS | H321: UNWIN | K321: WHITEHEAD | N321: FINN | Q321: RANDALL
A322: GOALKICKERS
A323: SANDRINGHAM | C323: ROBINSON 4 | F323: CARTWRIGHT 3 | J323: WEBER 3 | L323: RYAN 2 | N323: ALLISTER | Q323: HEDGE | S323: KENT
A324: CAMBERWELL | C324: CLAMP 3 | F324: NASH 3 | H324: HARLEY 3 | J324: FINN 2 | L324: DURAND | N324: HORKINGS | Q324: HOPKINS
A326: COBURG | C326: 2 | D326: 3 | E326: =C326*6+D326 -> 15 | G326: 2 | H326: 7 | I326: =G326*6+H326 -> 19 | K326: 6 | L326: 16 | M326: =K326*6+L326 -> 52 | O326: 11 | P326: 20 | Q326: =O326*6+P326 -> 86 | S326: COBURG
A327: NORTHCOTE | C327: 2 | D327: 1 | E327: =C327*6+D327 -> 13 | G327: 6 | H327: 6 | I327: =G327*6+H327 -> 42 | K327: 9 | L327: 7 | M327: =K327*6+L327 -> 61 | O327: 13 | P327: 8 | Q327: =O327*6+P327 -> 86 | S327: HAYES
A328: BEST PLAYERS
A329: COBURG | C329: IRVINE | E329: RE | H329: JONES | K329: JOHNSON | N329: RINGHOLT | Q329: BAINES
A330: NORTHCOTE | C330: E HART | E330: HOLDEN | H330: HISCOX | K330: POWELL | N330: WHITE | Q330: CAHILL
A331: GOALKICKERS
A332: COBURG | C332: BAINES 3 | F332: IRVINE 2 | I332: ANDERSON 2 | L332: COLLINS 2 | N332: MILTE | P332: McILVENE
A333: NORTHCOTE | C333: WHITE 4 | F333: MEITZCKE 3 | I333: CROSBIE | K333: WARNER | M333: HISCOX | O333: VENNING | Q333: BOYD | R333: SIMPSON
A335: YARRAVILLE | C335: 0 | D335: 0 | E335: =C335*6+D335 -> 0 | G335: 8 | H335: 3 | I335: =G335*6+H335 -> 51 | K335: 11 | L335: 6 | M335: =K335*6+L335 -> 72 | O335: 17 | P335: 12 | Q335: =O335*6+P335 -> 114 | S335: YARRAVILLE
A336: BRIGHTON | C336: 5 | D336: 7 | E336: =C336*6+D336 -> 37 | G336: 5 | H336: 10 | I336: =G336*6+H336 -> 40 | K336: 9 | L336: 15 | M336: =K336*6+L336 -> 69 | O336: 11 | P336: 16 | Q336: =O336*6+P336 -> 82 | S336: McALPINE
A337: BEST PLAYERS
A338: YARRAVILLE | C338: WEDGWOOD | F338: ALSOP | I338: KENNY | L338: RANN | O338: HOPKINS | Q338: McVEIGH
A339: BRIGHTON | C339: BIRD | F339: GEORGE | I339: DAVIS | L339: HENDER | O339: FINDLAY | Q339: IVEY
A340: GOALKICKERS
A341: YARRAVILLE | C341: ALSOP 6 | E341: HOPKINS 4 | H341: WEDGWOOD 4 | K341: TURNER | M341: McVEIGH | O341: T SMITH
A342: BRIGHTON | C342: IVEY 4 | E342: BIRD 2 | H342: HENDER | J342: HUNTER | L342: CONNELL | N342: DAVIS | P342: FINDLAY
A344: ROUND 7 | E344: 1ST JUNE | J344: WEATHER | M344: CLOUDY LIGHT SHOWERS N.W. WIND | S344: PLAYED AT
D345: 1ST QTR | H345: 2ND QTR | L345: 3RD QTR | P345: FINAL | S345: PRESTON
A346: PRESTON | C346: 2 | D346: 2 | E346: =C346*6+D346 -> 14 | G346: 7 | H346: 7 | I346: =G346*6+H346 -> 49 | K346: 9 | L346: 11 | M346: =K346*6+L346 -> 65 | O346: 16 | P346: 18 | Q346: =O346*6+P346 -> 114 | S346: UMPIRE | X346: LADDER | AB346: ROUND | AD346: 7
A347: BRUNSWICK | C347: 5 | D347: 5 | E347: =C347*6+D347 -> 35 | G347: 6 | H347: 6 | I347: =G347*6+H347 -> 42 | K347: 12 | L347: 10 | M347: =K347*6+L347 -> 82 | O347: 13 | P347: 14 | Q347: =O347*6+P347 -> 92 | S347: LEWIS
A348: BEST PLAYERS | W348: TEAM | X348: W | Y348: L | Z348: D | AA348: FOR | AB348: AGST | AC348: % | AD348: PTS
A349: PRESTON | C349: GRAY | F349: MASLEN | I349: MORRISON | L349: N SLEETH | N349: A SLEITH | Q349: DUNSTONE
A350: BRUNSWICK | C350: McKERNAN | F350: DOWLING | I350: McKAY | L350: KEMP | N350: CRAWFORD | Q350: R QUINN | W350: WILLIAMSTOWN | X350: 6 | Y350: 1 | Z350: 0 | AA350: 1021 | AB350: 575 | AC350: 177.56521739130434 | AD350: 24
A351: GOALKICKERS | W351: PORT MELBOURNE | X351: 5 | Y351: 2 | Z351: 0 | AA351: 859 | AB351: 654 | AC351: 131.34556574923548 | AD351: 20
A352: PRESTON | C352: MORRISON 5 | F352: DUNSTONE 3 | I352: L SLEETH 3 | L352: ROSS 2 | N352: SEEDSMAN | Q352: CALVERT | S352: BEAGLEY | W352: PRESTON | X352: 5 | Y352: 2 | Z352: 0 | AA352: 713 | AB352: 667 | AC352: 106.89655172413794 | AD352: 20
A353: BRUNSWICK | C353: CRAWFORD 3 | F353: KEMP 2 | H353: BAILEY 2 | J353: McKAY 2 | M353: DOWLING | O353: BOYD | Q353: McELROY | S353: WINTER | W353: PRAHRAN | X353: 5 | Y353: 2 | Z353: 0 | AA353: 757 | AB353: 743 | AC353: 101.8842530282638 | AD353: 20
A355: PRAHRAN | C355: 2 | D355: 3 | E355: =C355*6+D355 -> 15 | G355: 5 | H355: 8 | I355: =G355*6+H355 -> 38 | K355: 10 | L355: 12 | M355: =K355*6+L355 -> 72 | O355: 16 | P355: 17 | Q355: =O355*6+P355 -> 113 | S355: TOORAK PARK | W355: CAMBERWELL | X355: 4 | Y355: 3 | Z355: 0 | AA355: 878 | AB355: 751 | AC355: 116.91078561917443 | AD355: 16
A356: COBURG | C356: 4 | D356: 3 | E356: =C356*6+D356 -> 27 | G356: 7 | H356: 6 | I356: =G356*6+H356 -> 48 | K356: 10 | L356: 10 | M356: =K356*6+L356 -> 70 | O356: 12 | P356: 11 | Q356: =O356*6+P356 -> 83 | S356: GROVES | W356: BRUNSWICK | X356: 4 | Y356: 3 | Z356: 0 | AA356: 764 | AB356: 669 | AC356: 114.20029895366218 | AD356: 16
A357: BEST PLAYERS | W357: NORTHCOTE | X357: 3 | Y357: 3 | Z357: 1 | AA357: 670 | AB357: 737 | AC357: 90.909090909090907 | AD357: 14
A358: PRAHRAN | C358: BRENCHLEY | F358: FAUL | H358: SMITH | K358: WHITE | N358: WHITEHEAD | Q358: JOHNSON | W358: BRIGHTON | X358: 3 | Y358: 4 | Z358: 0 | AA358: 684 | AB358: 744 | AC358: 91.935483870967744 | AD358: 12
A359: COBURG | C359: COLLINS | F359: MILTE | H359: JOHNSON | K359: MULLENGER | N359: LONSDALE | Q359: PRENDERGAST | W359: COBURG | X359: 2 | Y359: 4 | Z359: 1 | AA359: 571 | AB359: 625 | AC359: 91.36 | AD359: 10
A360: GOALKICKERS | W360: YARRAVILLE | X360: 2 | Y360: 5 | Z360: 0 | AA360: 731 | AB360: 1039 | AC360: 70.356111645813286 | AD360: 8
A361: PRAHRAN | C361: BRENCHLEY 6 | F361: ROLFE 3 | H361: O'DONNELL 2 | K361: WHITE | M361: ANDERS | O361: WILLIAMS | Q361: THOMPSON | T361: JONES | W361: SANDRINGHAM | X361: 1 | Y361: 6 | Z361: 0 | AA361: 700 | AB361: 892 | AC361: 78.47533632286995 | AD361: 4
A362: COBURG | C362: MUNDAY 4 | F362: D ATKINSON 2 | I362: COLLINS 2 | K362: PRATT | M362: R ATKINSON | P362: PRENDERGAST | S362: MULLENGER | W362: OAKLEIGH | X362: 1 | Y362: 6 | Z362: 0 | AA362: 680 | AB362: 932 | AC362: 72.961373390557938 | AD362: 4
A364: BRIGHTON | C364: 3 | D364: 3 | E364: =C364*6+D364 -> 21 | G364: 7 | H364: 10 | I364: =G364*6+H364 -> 52 | K364: 8 | L364: 12 | M364: =K364*6+L364 -> 60 | O364: 15 | P364: 20 | Q364: =O364*6+P364 -> 110 | S364: CAMBERWELL
A365: CAMBERWELL | C365: 7 | D365: 5 | E365: =C365*6+D365 -> 47 | G365: 9 | H365: 9 | I365: =G365*6+H365 -> 63 | K365: 12 | L365: 16 | M365: =K365*6+L365 -> 88 | O365: 15 | P365: 16 | Q365: =O365*6+P365 -> 106 | S365: HAYES
A366: BEST PLAYERS
A367: BRIGHTON | C367: KEMP | E367: BIRD | H367: CONNELL | K367: HENDER | N367: WILLIAMSON | Q367: BROOKS
A368: CAMBERWELL | C368: HARLEY | E368: HORKINGS | H368: HENDERSON | K368: CLAMP | N368: SEELENMEYER | Q368: NASH
A369: GOALKICKERS
A370: BRIGHTON | C370: BIRD 5 | E370: BOLWELL 3 | H370: BROOKS 2 | J370: CONNELL | L370: HALLAHAN | N370: JOHNSON | P370: HENDER | R370: SCOTT
A371: CAMBERWELL | C371: HARLEY 7 | F371: NASH 3 | I371: CLAMP | K371: HOPKINS | M371: QUILL | O371: HORNER
A373: NORTHCOTE | C373: 6 | D373: 3 | E373: =C373*6+D373 -> 39 | G373: 8 | H373: 3 | I373: =G373*6+H373 -> 51 | K373: 12 | L373: 6 | M373: =K373*6+L373 -> 78 | O373: 15 | P373: 10 | Q373: =O373*6+P373 -> 100 | S373: NORTHCOTE
A374: OAKLEIGH | C374: 2 | D374: 0 | E374: =C374*6+D374 -> 12 | G374: 7 | H374: 8 | I374: =G374*6+H374 -> 50 | K374: 9 | L374: 10 | M374: =K374*6+L374 -> 64 | O374: 11 | P374: 14 | Q374: =O374*6+P374 -> 80 | S374: MERRICK
A375: BEST PLAYERS
A376: NORTHCOTE | C376: HISCOX | E376: SIMPSON | H376: E HART | K376: VENNING | N376: WHITE | Q376: HOLDEN
A377: OAKLEIGH | C377: WEISS | E377: CRAMERI | H377: ZIMMERMAN | K377: KENNEDY | N377: BEARD | Q377: BICKERTON
A378: GOALKICKERS
A379: NORTHCOTE | C379: SIMPSON 4 | F379: WHITE 3 | I379: VENNING 3 | L379: HISCOX 2 | N379: McNAMEE 2 | Q379: POLLARD
A380: OAKLEIGH | C380: DOWLER 3 | F380: CLARKE 3 | I380: LANNING | K380: SMITH | M380: BICKERTON | P380: KENNEDY | R380: CRAMERI
A382: PORT MELBOURNE | C382: 7 | D382: 8 | E382: =C382*6+D382 -> 50 | G382: 8 | H382: 11 | I382: =G382*6+H382 -> 59 | K382: 18 | L382: 19 | M382: =K382*6+L382 -> 127 | O382: 22 | P382: 23 | Q382: =O382*6+P382 -> 155 | S382: PORT MELBOURNE
A383: YARRAVILLE | C383: 2 | D383: 1 | E383: =C383*6+D383 -> 13 | G383: 6 | H383: 8 | I383: =G383*6+H383 -> 44 | K383: 7 | L383: 11 | M383: =K383*6+L383 -> 53 | O383: 12 | P383: 16 | Q383: =O383*6+P383 -> 88 | S383: McALPINE
A384: BEST PLAYERS
A385: PORT MELBOURNE | C385: FREYER | E385: LAHIFF | H385: KELLY | K385: STEIGENBERGER | O385: ALSOP | R385: FLETCHER
A386: YARRAVILLE | C386: RANN | E386: McINTYRE | H386: PLUMMER | K386: REDPATH | O386: WEDGWOOD | R386: PERUSSICH
A387: GOALKICKERS
A388: PORT MELBOURNE | C388: FREYER 14 | F388: LAHIFF 3 | I388: STEIGENBERGER | L388: KELLY | N388: JULIER | P388: CASTLES | R388: PLUNKETT
A389: YARRAVILLE | C389: TURNER 3 | F389: McVEIGH 2 | I389: HOPKINS | K389: COLEMAN | M389: CHEGWIDDEN | P389: WEDGWOOD | S389: PERUSSICH | V389: NEILL | X389: GARLICK
A391: WILLIAMSTOWN | C391: 3 | D391: 9 | E391: =C391*6+D391 -> 27 | G391: 7 | H391: 14 | I391: =G391*6+H391 -> 56 | K391: 11 | L391: 15 | M391: =K391*6+L391 -> 81 | O391: 19 | P391: 20 | Q391: =O391*6+P391 -> 134 | S391: BEACH ROAD
A392: SANDRINGHAM | C392: 2 | D392: 2 | E392: =C392*6+D392 -> 14 | G392: 5 | H392: 9 | I392: =G392*6+H392 -> 39 | K392: 9 | L392: 14 | M392: =K392*6+L392 -> 68 | O392: 11 | P392: 15 | Q392: =O392*6+P392 -> 81 | S392: HARDING
A393: BEST PLAYERS
A394: WILLIAMSTOWN | C394: WILCOX | F394: TODD | I394: OGDEN | L394: FITCH | O394: PATERSON | R394: CAVE
A395: SANDRINGHAM | C395: McINTYRE | F395: WITCHELL | I395: KENT | L395: AMINDE | O395: MORRIS | R395: ALLISTER
A396: GOALKICKERS
A397: WILLIAMSTOWN | C397: TODD 8 | F397: VALLENCE 6 | I397: PATERSON 2 | L397: FITCH 2 | N397: COOPER
A398: SANDRINGHAM | C398: McINTYRE 5 | F398: CARTWRIGHT 3 | J398: MORRIS | L398: ROBINSON | N398: J RYAN
A400: ROUND 8 | E400: 8TH JUNE | H400: WEATHER | K400: COLD SHOWERS S.W. WIND GROUNDS WET | S400: PLAYED AT
D401: 1ST QTR | H401: 2ND QTR | L401: 3RD QTR | P401: FINAL | S401: WILLIAMSTOWN
A402: WILLIAMSTOWN | C402: 2 | D402: 8 | E402: =C402*6+D402 -> 20 | G402: 4 | H402: 10 | I402: =G402*6+H402 -> 34 | K402: 11 | L402: 21 | M402: =K402*6+L402 -> 87 | O402: 12 | P402: 25 | Q402: =O402*6+P402 -> 97 | S402: UMPIRE | X402: LADDER | AB402: ROUND | AD402: 8
A403: CAMBERWELL | C403: 1 | D403: 2 | E403: =C403*6+D403 -> 8 | G403: 5 | H403: 8 | I403: =G403*6+H403 -> 38 | K403: 5 | L403: 8 | M403: =K403*6+L403 -> 38 | O403: 12 | P403: 15 | Q403: =O403*6+P403 -> 87 | S403: KING
A404: BEST PLAYERS | W404: TEAM | X404: W | Y404: L | Z404: D | AA404: FOR | AB404: AGST | AC404: % | AD404: PTS
A405: WILLIAMSTOWN | C405: QUINN | F405: COOPER | I405: FITCH | L405: E RYAN | O405: GLASS | Q405: OGDEN
A406: CAMBERWELL | C406: HENDERSON | F406: HORKINGS | I406: FARRELLY | L406: TOOHEY | O406: HARLEY | Q406: SEELENMEYER | W406: WILLIAMSTOWN | X406: 7 | Y406: 1 | Z406: 0 | AA406: 1118 | AB406: 662 | AC406: 168.8821752265861 | AD406: 28
A407: GOALKICKERS | W407: PORT MELBOURNE | X407: 6 | Y407: 2 | Z407: 0 | AA407: 964 | AB407: 735 | AC407: 131.15646258503401 | AD407: 24
A408: WILLIAMSTOWN | C408: TODD 4 | E408: COOPER 3 | H408: PATERSON 2 | K408: VALLENCE | M408: SPOKES | O408: GLASS | W408: PRESTON | X408: 6 | Y408: 2 | Z408: 0 | AA408: 833 | AB408: 760 | AC408: 109.60526315789474 | AD408: 24
A409: CAMBERWELL | C409: NASH 5 | E409: HARLEY 2 | H409: QUILL | J409: MILNE | L409: FINN | N409: CLAMP | P409: ROWE | W409: PRAHRAN | X409: 6 | Y409: 2 | Z409: 0 | AA409: 879 | AB409: 822 | AC409: 106.93430656934306 | AD409: 24
A411: BRUNSWICK | C411: 2 | D411: 9 | E411: =C411*6+D411 -> 21 | G411: 8 | H411: 16 | I411: =G411*6+H411 -> 64 | K411: 10 | L411: 18 | M411: =K411*6+L411 -> 78 | O411: 11 | P411: 22 | Q411: =O411*6+P411 -> 88 | S411: BRUNSWICK | W411: BRUNSWICK | X411: 5 | Y411: 3 | Z411: 0 | AA411: 873 | AB411: 769 | AC411: 113.52405721716515 | AD411: 20
A412: NORTHCOTE | C412: 6 | D412: 2 | E412: =C412*6+D412 -> 38 | G412: 10 | H412: 5 | I412: =G412*6+H412 -> 65 | K412: 12 | L412: 7 | M412: =K412*6+L412 -> 79 | O412: 12 | P412: 10 | Q412: =O412*6+P412 -> 82 | S412: MERRINGTON | W412: CAMBERWELL | X412: 4 | Y412: 4 | Z412: 0 | AA412: 965 | AB412: 848 | AC412: 113.79716981132076 | AD412: 16
A413: BEST PLAYERS | W413: COBURG | X413: 3 | Y413: 4 | Z413: 1 | AA413: 659 | AB413: 693 | AC413: 95.093795093795094 | AD413: 14
A414: BRUNSWICK | C414: BOYD | E414: McELROY | H414: DOWLING | K414: DAVIS | N414: JEFFREY | Q414: FOO | W414: NORTHCOTE | X414: 3 | Y414: 4 | Z414: 1 | AA414: 770 | AB414: 846 | AC414: 91.016548463356969 | AD414: 14
A415: NORTHCOTE | C415: E HART | E415: HISCOX | H415: WHITE | K415: HODEN | N415: DRYDEN | Q415: MEITZCKE | W415: BRIGHTON | X415: 3 | Y415: 5 | Z415: 0 | AA415: 765 | AB415: 849 | AC415: 90.10600706713781 | AD415: 12
A416: GOALKICKERS | W416: YARRAVILLE | X416: 2 | Y416: 6 | Z416: 0 | AA416: 824 | AB416: 1159 | AC416: 71.095772217428816 | AD416: 8
A417: BRUNSWICK | C417: BOYD 7 | E417: FITZGIBBON | H417: CRAWFORD | K417: McELROY | N417: JEFFREY | W417: SANDRINGHAM | X417: 1 | Y417: 7 | Z417: 0 | AA417: 768 | AB417: 980 | AC417: 78.367346938775512 | AD417: 4
A418: NORTHCOTE | C418: MEITZCKE 3 | F418: McINTOSH 2 | I418: WHITE 2 | K418: HISCOX 2 | M418: McNAMEE | O418: CROSBIE | Q418: VENNING | W418: OAKLEIGH | X418: 1 | Y418: 7 | Z418: 0 | AA418: 759 | AB418: 1054 | AC418: 72.011385199240991 | AD418: 4
A419: REPLAYED | E419: 20TH JULY | J419: WEATHER | M419: EARLY SHOWERS COLD CLOUDY WEST WIND
A420: BRUNSWICK | C420: 4 | D420: 2 | E420: =C420*6+D420 -> 26 | G420: 10 | H420: 5 | I420: =G420*6+H420 -> 65 | K420: 13 | L420: 8 | M420: =K420*6+L420 -> 86 | O420: 16 | P420: 13 | Q420: =O420*6+P420 -> 109 | S420: BRUNSWICK
A421: NORTHCOTE | C421: 3 | D421: 4 | E421: =C421*6+D421 -> 22 | G421: 10 | H421: 8 | I421: =G421*6+H421 -> 68 | K421: 13 | L421: 11 | M421: =K421*6+L421 -> 89 | O421: 14 | P421: 16 | Q421: =O421*6+P421 -> 100 | S421: MERRINGTON
A422: BEST PLAYERS
A423: BRUNSWICK | C423: DOWLING | F423: BOYD | I423: WHITE | L423: McKERNAN | O423: FAY | Q423: FOO
A424: NORTHCOTE | C424: DRYDEN | F424: WATT | I424: HOLDEN | L424: MEITZCKE | O424: DOWER | Q424: HISCOX
A425: GOALKICKERS
A426: BRUNSWICK | C426: J WHITE 7 | F426: DOWLING 3 | I426: McKAY | K426: CRAWFORD | N426: STANDFIELD | Q426: JEFFREY | S426: PERRETT | V426: KEATING
A427: NORTHCOTE | C427: A WHITE 7 | F427: CAHILL 2 | I427: MEITZCKE | K427: WARNER | N427: KINGSTON | Q427: STABB | S427: HOLDEN
A429: PORT MELBOURNE | C429: 2 | D429: 4 | E429: =C429*6+D429 -> 16 | G429: 6 | H429: 11 | I429: =G429*6+H429 -> 47 | K429: 9 | L429: 16 | M429: =K429*6+L429 -> 70 | O429: 14 | P429: 21 | Q429: =O429*6+P429 -> 105 | S429: ELSTERNWICK PARK
A430: BRIGHTON | C430: 3 | D430: 2 | E430: =C430*6+D430 -> 20 | G430: 3 | H430: 6 | I430: =G430*6+H430 -> 24 | K430: 8 | L430: 11 | M430: =K430*6+L430 -> 59 | O430: 11 | P430: 15 | Q430: =O430*6+P430 -> 81 | S430: McALPINE
A431: BEST PLAYERS
A432: PORT MELBOURNE | C432: HAYES | F432: ROBERTSON | I432: GOLDSMITH | L432: KELLY | N432: JULIER | P432: LAHIFF
A433: BRIGHTON | C433: WILLIAMSON | F433: HALL | I433: RECHTER | L433: HENDER | N433: WEBER | P433: BIRD
A434: GOALKICKERS
A435: PORT MELBOURNE | C435: LAHIFF 6 | F435: FREYER 3 | I435: PLUNKETT 2 | L435: KELLY | N435: GOLDSMITH | Q435: DOBSON
A436: BRIGHTON | C436: HALLAHAN 2 | F436: BOLWELL 2 | I436: SCOTT 2 | K436: HENDER 2 | M436: BIRD | N436: RECHTER | P436: HARTNETT
A438: COBURG | C438: 1 | D438: 3 | E438: =C438*6+D438 -> 9 | G438: 5 | H438: 9 | I438: =G438*6+H438 -> 39 | K438: 6 | L438: 12 | M438: =K438*6+L438 -> 48 | O438: 12 | P438: 16 | Q438: =O438*6+P438 -> 88 | S438: COBURG
A439: SANDRINGHAM | C439: 2 | D439: 4 | E439: =C439*6+D439 -> 16 | G439: 3 | H439: 6 | I439: =G439*6+H439 -> 24 | K439: 9 | L439: 14 | M439: =K439*6+L439 -> 68 | O439: 9 | P439: 14 | Q439: =O439*6+P439 -> 68 | S439: McINTYRE
A440: BEST PLAYERS
A441: COBURG | C441: RINGHOLT | F441: JONES | I441: R ATKINSON | L441: ANDERSON | O441: MILTE | R441: YOUNG
A442: SANDRINGHAM | C442: KENT | F442: CARTWRIGHT | I442: SHARP | L442: ALLISTER | O442: McINTYRE | R442: WITCHELL
A443: GOALKICKERS
A444: COBURG | C444: PRATT 4 | F444: ANDERSON 3 | I444: COLLINS 3 | L444: YOUNG | N444: MILTE
A445: SANDRINGHAM | C445: KENT 4 | F445: ALLISTER 2 | I445: ROBINSON 2 | L445: RYAN
A447: PRESTON | C447: 4 | D447: 9 | E447: =C447*6+D447 -> 33 | G447: 7 | H447: 13 | I447: =G447*6+H447 -> 55 | K447: 13 | L447: 15 | M447: =K447*6+L447 -> 93 | O447: 17 | P447: 18 | Q447: =O447*6+P447 -> 120 | S447: YARRAVILLE
A448: YARRAVILLE | C448: 2 | D448: 2 | E448: =C448*6+D448 -> 14 | G448: 5 | H448: 9 | I448: =G448*6+H448 -> 39 | K448: 10 | L448: 11 | M448: =K448*6+L448 -> 71 | O448: 13 | P448: 15 | Q448: =O448*6+P448 -> 93 | S448: HARDING
A449: BEST PLAYERS
A450: PRESTON | C450: MORRISON | F450: ROSS | H450: DOWLING | K450: MINNEY | N450: CLARKE | Q450: NORMAN
A451: YARRAVILLE | C451: PLUMMER | F451: RANN | H451: NEILL | K451: GRAY | N451: WEDGWOOD | Q451: SEEDSMAN
A452: GOALKICKERS
A453: PRESTON | C453: MORRISON 7 | F453: L SLEETH 3 | I453: ROSS | J453: BEASLEY | L453: DUNSTONE | N453: SEEDSMAN | Q453: CLARKE | S453: DOWLING | V453: CALVERT
A454: YARRAVILLE | C454: NEILL 3 | F454: ALSOP 2 | I454: GRAY | J454: McVEIGH | L454: TUENER | N454: WEDGWOOD | Q454: HOPKINS | S454: PERUSSICH | V454: H SMITH
A456: PRAHRAN | C456: 3 | D456: 7 | E456: =C456*6+D456 -> 25 | G456: 5 | H456: 13 | I456: =G456*6+H456 -> 43 | K456: 13 | L456: 7 | M456: =K456*6+L456 -> 85 | O456: 17 | P456: 20 | Q456: =O456*6+P456 -> 122 | S456: OAKLEIGH
A457: OAKLEIGH | C457: 0 | D457: 4 | E457: =C457*6+D457 -> 4 | G457: 4 | H457: 8 | I457: =G457*6+H457 -> 32 | K457: 5 | L457: 12 | M457: =K457*6+L457 -> 42 | O457: 10 | P457: 19 | Q457: =O457*6+P457 -> 79 | S457: HAYES
A458: BEST PLAYERS
A459: PRAHRAN | C459: FAUL | E459: DAVEY | H459: PROBYN | K459: WHITEHEAD | N459: GRAVELL | Q459: WHITE
A460: OAKLEIGH | C460: WEISS | E460: BICKERTON | H460: WILSON | K460: NOLAN | N460: SMITH | Q460: RYAN
A461: GOALKICKERS
A462: PRAHRAN | C462: THOMPSON 4 | F462: DAVEY 3 | H462: GRAVELL 3 | J462: PROBYN 3 | M462: O'DONNELL | O462: WILLIAMS | Q462: ROLFE | R462: BRENCHLEY | U462: FAUL
A463: OAKLEIGH | C463: NOLAN 5 | F463: McCRORY | H463: KENNEDY | J463: PHILLIPS | M463: BEARD | O463: ASH
A465: ROUND 9 | E465: 15TH JUNE | J465: WEATHER | M465: SHOWERS SQUALLY N.W. WIND | S465: PLAYED AT
D466: 1ST QTR | H466: 2ND QTR | L466: 3RD QTR | P466: FINAL | S466: TOORAK PARK
A467: PRAHRAN | C467: 1 | D467: 2 | E467: =C467*6+D467 -> 8 | G467: 7 | H467: 13 | I467: =G467*6+H467 -> 55 | K467: 12 | L467: 16 | M467: =K467*6+L467 -> 88 | O467: 14 | P467: 18 | Q467: =O467*6+P467 -> 102 | S467: UMPIRE | X467: LADDER | AB467: ROUND | AD467: 9
A468: BRUNSWICK | C468: 5 | D468: 11 | E468: =C468*6+D468 -> 41 | G468: 6 | H468: 11 | I468: =G468*6+H468 -> 47 | K468: 10 | L468: 18 | M468: =K468*6+L468 -> 78 | O468: 12 | P468: 22 | Q468: =O468*6+P468 -> 94 | S468: MERRINGTON
A469: BEST PLAYERS | W469: TEAM | X469: W | Y469: L | Z469: D | AA469: FOR | AB469: AGST | AC469: % | AD469: PTS
A470: PRAHRAN | C470: NEWTON | E470: TUCKER | H470: THOMPSON | K470: DAVEY | N470: JOHNSON | Q470: BRENCHLEY
A471: BRUNSWICK | C471: FAY | E471: BOYD | H471: CRAWFORD | K471: DOWLING | N471: HOBBA | Q471: DAVIS | W471: WILLIAMSTOWN | X471: 8 | Y471: 1 | Z471: 0 | AA471: 1210 | AB471: 746 | AC471: 162.19839142091152 | AD471: 32
A472: GOALKICKERS | W472: PORT MELBOURNE | X472: 7 | Y472: 2 | Z472: 0 | AA472: 1097 | AB472: 849 | AC472: 129.2108362779741 | AD472: 28
A473: PRAHRAN | C473: PROBYN 5 | F473: DAVEY 3 | I473: ROLFE 3 | K473: GRAVELL 2 | N473: O'DONNELL | W473: PRESTON | X473: 7 | Y473: 2 | Z473: 0 | AA473: 948 | AB473: 873 | AC473: 108.59106529209622 | AD473: 28
A474: BRUNSWICK | C474: CRISP 4 | F474: BOYD 4 | I474: CRAWFORD 3 | L474: COOPER | W474: PRAHRAN | X474: 7 | Y474: 2 | Z474: 0 | AA474: 981 | AB474: 916 | AC474: 107.09606986899563 | AD474: 28
A476: PORT MELBOURNE | C476: 1 | D476: 6 | E476: =C476*6+D476 -> 12 | G476: 9 | H476: 13 | I476: =G476*6+H476 -> 67 | K476: 12 | L476: 16 | M476: =K476*6+L476 -> 88 | O476: 19 | P476: 19 | Q476: =O476*6+P476 -> 133 | S476: CAMBERWELL | W476: BRUNSWICK | X476: 5 | Y476: 4 | Z476: 0 | AA476: 967 | AB476: 871 | AC476: 111.02181400688863 | AD476: 20
A477: CAMBERWELL | C477: 7 | D477: 5 | E477: =C477*6+D477 -> 47 | G477: 11 | H477: 7 | I477: =G477*6+H477 -> 73 | K477: 15 | L477: 13 | M477: =K477*6+L477 -> 103 | O477: 16 | P477: 18 | Q477: =O477*6+P477 -> 114 | S477: PARRIS | W477: NORTHCOTE | X477: 4 | Y477: 4 | Z477: 1 | AA477: 846 | AB477: 905 | AC477: 93.480662983425418 | AD477: 18
A478: BEST PLAYERS | W478: CAMBERWELL | X478: 4 | Y478: 5 | Z478: 0 | AA478: 1079 | AB478: 981 | AC478: 109.98980632008156 | AD478: 16
A479: PORT MELBOURNE | C479: HAYES | F479: HURLEY | I479: KELLY | L479: PLUNKETT | O479: JULIER | Q479: CASTLES | W479: COBURG | X479: 3 | Y479: 5 | Z479: 1 | AA479: 743 | AB479: 785 | AC479: 94.649681528662427 | AD479: 14
A480: CAMBERWELL | C480: HENDERSON | F480: ANDERSON | I480: FORD | L480: CLAMP | O480: NASH | Q480: WHITEHEAD | W480: BRIGHTON | X480: 3 | Y480: 6 | Z480: 0 | AA480: 878 | AB480: 964 | AC480: 91.078838174273855 | AD480: 12
A481: GOALKICKERS | W481: OAKLEIGH | X481: 2 | Y481: 7 | Z481: 0 | AA481: 880 | AB481: 1135 | AC481: 77.533039647577098 | AD481: 8
A482: PORT MELBOURNE | C482: FREYER 7 | E482: PLUNKETT 3 | H482: CASTLES 2 | J482: DOBSON 2 | M482: ONLEY 2 | O482: KELLY | Q482: HURLEY | S482: ALSOP | W482: YARRAVILLE | X482: 2 | Y482: 7 | Z482: 0 | AA482: 883 | AB482: 1235 | AC482: 71.497975708502025 | AD482: 8
A483: CAMBERWELL | C483: NASH 4 | E483: WHITEHEAD 4 | H483: HOPKINS 3 | J483: CLAMP 2 | M483: FINN | N483: HARLEY | P483: ROWE | W483: SANDRINGHAM | X483: 1 | Y483: 8 | Z483: 0 | AA483: 849 | AB483: 1101 | AC483: 77.111716621253407 | AD483: 4
A485: WILLIAMSTOWN | C485: 4 | D485: 0 | E485: =C485*6+D485 -> 24 | G485: 12 | H485: 3 | I485: =G485*6+H485 -> 75 | K485: 13 | L485: 5 | M485: =K485*6+L485 -> 83 | O485: 14 | P485: 8 | Q485: =O485*6+P485 -> 92 | S485: WILLIAMSTOWN
A486: COBURG | C486: 3 | D486: 5 | E486: =C486*6+D486 -> 23 | G486: 6 | H486: 5 | I486: =G486*6+H486 -> 41 | K486: 10 | L486: 10 | M486: =K486*6+L486 -> 70 | O486: 12 | P486: 12 | Q486: =O486*6+P486 -> 84 | S486: GROVES
A487: BEST PLAYERS
A488: WILLIAMSTOWN | C488: TODD | F488: SPOKES | I488: WILCOX | L488: PATERSON | O488: FITCH | Q488: HARTNEY
A489: COBURG | C489: R ATKINSON | F489: PRENDERGAST | I489: IRVINE | L489: COLLINS | O489: MILTE | Q489: MULLENGER
A490: GOALKICKERS
A491: WILLIAMSTOWN | C491: TODD 7 | F491: QUINN 3 | I491: PATERSON 2 | L491: CAVE | N491: THOMAS
A492: COBURG | C492: PRATT 7 | F492: MULLENGER 3 | I492: ANDERSON | L492: MUNDAY
A494: NORTHCOTE | C494: 3 | D494: 4 | E494: =C494*6+D494 -> 22 | G494: 7 | H494: 9 | I494: =G494*6+H494 -> 51 | K494: 9 | L494: 13 | M494: =K494*6+L494 -> 67 | O494: 10 | P494: 16 | Q494: =O494*6+P494 -> 76 | S494: NORTHCOTE
A495: YARRAVILLE | C495: 1 | D495: 2 | E495: =C495*6+D495 -> 8 | G495: 1 | H495: 6 | I495: =G495*6+H495 -> 12 | K495: 7 | L495: 8 | M495: =K495*6+L495 -> 50 | O495: 8 | P495: 11 | Q495: =O495*6+P495 -> 59 | S495: McALPINE
A496: BEST PLAYERS
A497: NORTHCOTE | C497: E HART | F497: HOLDEN | I497: MEITZCKE | L497: McNAMEE | O497: DRYDEN | R497: WATT
A498: YARRAVILLE | C498: T SMITH | F498: WEDGWOOD | I498: RANN | L498: PLUMMER | O498: GARLICK | R498: GRAY
A499: GOALKICKERS
A500: NORTHCOTE | C500: HISCOX 4 | F500: WHITE 3 | I500: McNAMEE 2 | L500: SIMPSON
A501: YARRAVILLE | C501: TURNER 2 | F501: PERUSSICH 2 | I501: McVEIGH | K501: ALSOP | M501: KENNY | O501: WEDGWOOD
A503: OAKLEIGH | C503: 11 | D503: 6 | E503: =C503*6+D503 -> 72 | G503: 11 | H503: 6 | I503: =G503*6+H503 -> 72 | K503: 15 | L503: 11 | M503: =K503*6+L503 -> 101 | O503: 18 | P503: 13 | Q503: =O503*6+P503 -> 121 | S503: NORTHCOTE
A504: SANDRINGHAM | C504: 1 | D504: 1 | E504: =C504*6+D504 -> 7 | G504: 6 | H504: 15 | I504: =G504*6+H504 -> 51 | K504: 7 | L504: 15 | M504: =K504*6+L504 -> 57 | O504: 10 | P504: 21 | Q504: =O504*6+P504 -> 81 | S504: GREGORY
A505: BEST PLAYERS
A506: OAKLEIGH | C506: CRAMERI | F506: TOWNSEND | J506: WILSON | M506: McCRORY | P506: KENNEDY | S506: NOLAN
A507: SANDRINGHAM | C507: ALLISTER | F507: CARTWRIGHT | J507: EVANS | M507: WITCHELL | P507: LUDLOW | S507: SMAIL
A508: GOALKICKERS
A509: OAKLEIGH | C509: McCRORY 5 | F509: CRAMERI 4 | I509: NOLAN 3 | K509: BEARD | M509: DOWLER | O509: ASH | P509: KENNEDY | R509: WILSON | U509: SMITH
A510: SANDRINGHAM | C510: ALLISTER 3 | F510: SHARP 3 | I510: LUDLOW | L510: WEBER | N510: HEDGE | P510: TAYLOR
A512: PRESTON | C512: 0 | D512: 1 | E512: =C512*6+D512 -> 1 | G512: 10 | H512: 17 | I512: =G512*6+H512 -> 77 | K512: 10 | L512: 17 | M512: =K512*6+L512 -> 77 | O512: 16 | P512: 19 | Q512: =O512*6+P512 -> 115 | S512: PRESTON
A513: BRIGHTON | C513: 8 | D513: 10 | E513: =C513*6+D513 -> 58 | G513: 9 | H513: 10 | I513: =G513*6+H513 -> 64 | K513: 14 | L513: 21 | M513: =K513*6+L513 -> 105 | O513: 15 | P513: 23 | Q513: =O513*6+P513 -> 113 | S513: HAYES
A514: BEST PLAYERS
A515: PRESTON | C515: DUNSTONE | F515: MORRISON | I515: DOWLING | L515: DEACON | O515: SEEDSMAN | R515: MASLEN
A516: BRIGHTON | C516: WILLIAMSON | F516: DAVIS | I516: HALLAHAN | L516: CONNELL | O516: KEMP | R516: BIRD
A517: GOALKICKERS
A518: PRESTON | C518: MORRISON 5 | F518: SEEDSMAN 4 | I518: ROSS 3 | K518: DUNSTONE 2 | N518: DEACON | P518: CALVERT
A519: BRIGHTON | C519: HALLAHAN 4 | F519: DAVIS 3 | H519: BIRD 3 | J519: CONNELL 2 | M519: HENDER 2 | O519: MILLER
A521: ROUND 10 | E521: 22ND JUNE | J521: WEATHER | M521: COLD CLOUDY S.W. WIND | S521: PLAYED AT
D522: 1ST QTR | H522: 2ND QTR | L522: 3RD QTR | P522: FINAL | S522: PORT MELBOURNE
A523: PORT MELBOURNE | C523: 5 | D523: 4 | E523: =C523*6+D523 -> 34 | G523: 10 | H523: 8 | I523: =G523*6+H523 -> 68 | K523: 15 | L523: 13 | M523: =K523*6+L523 -> 103 | O523: 17 | P523: 15 | Q523: =O523*6+P523 -> 117 | S523: UMPIRE | X523: LADDER | AB523: ROUND | AD523: 10
A524: PRESTON | C524: 1 | D524: 1 | E524: =C524*6+D524 -> 7 | G524: 4 | H524: 4 | I524: =G524*6+H524 -> 28 | K524: 10 | L524: 7 | M524: =K524*6+L524 -> 67 | O524: 13 | P524: 10 | Q524: =O524*6+P524 -> 88 | S524: McNAMARA
A525: BEST PLAYERS | W525: TEAM | X525: W | Y525: L | Z525: D | AA525: FOR | AB525: AGST | AC525: % | AD525: PTS
A526: PORT MELBOURNE | C526: KELLY | E526: ROBERTSON | I526: TANNER | L526: ALSOP | O526: LAHIFF | Q526: HAYES
A527: PRESTON | C527: MASLEN | E527: DUNSTONE | I527: L SLEETH | L527: MINNEY | O527: CLARKE | Q527: DOWLING | W527: WILLIAMSTOWN | X527: 8 | Y527: 2 | Z527: 0 | AA527: 1337 | AB527: 916 | AC527: 145.96069868995633 | AD527: 32
A528: GOALKICKERS | W528: PORT MELBOURNE | X528: 8 | Y528: 2 | Z528: 0 | AA528: 1214 | AB528: 937 | AC528: 129.56243329775882 | AD528: 32
A529: PORT MELBOURNE | C529: FREYER 7 | F529: KELLY 3 | H529: LEE 2 | J529: LAHIFF 2 | M529: GOLDSMITH | P529: CASTLES | R529: DOBSON | W529: PRAHRAN | X529: 7 | Y529: 3 | Z529: 0 | AA529: 1095 | AB529: 1032 | AC529: 106.1046511627907 | AD529: 28
A530: PRESTON | C530: MORRISON 4 | F530: DUNSTONE 3 | I530: L SLEETH 3 | L530: CLARKE 2 | N530: TAYLOR | W530: PRESTON | X530: 7 | Y530: 3 | Z530: 0 | AA530: 1036 | AB530: 990 | AC530: 104.64646464646465 | AD530: 28
A532: CAMBERWELL | C532: 3 | D532: 8 | E532: =C532*6+D532 -> 26 | G532: 8 | H532: 11 | I532: =G532*6+H532 -> 59 | K532: 13 | L532: 12 | M532: =K532*6+L532 -> 90 | O532: 16 | P532: 14 | Q532: =O532*6+P532 -> 110 | S532: CAMBERWELL | W532: BRUNSWICK | X532: 6 | Y532: 4 | Z532: 0 | AA532: 1082 | AB532: 920 | AC532: 117.60869565217391 | AD532: 24
A533: COBURG | C533: 3 | D533: 2 | E533: =C533*6+D533 -> 20 | G533: 6 | H533: 6 | I533: =G533*6+H533 -> 42 | K533: 11 | L533: 11 | M533: =K533*6+L533 -> 77 | O533: 14 | P533: 18 | Q533: =O533*6+P533 -> 102 | S533: MERRINGTON | W533: CAMBERWELL | X533: 5 | Y533: 5 | Z533: 0 | AA533: 1189 | AB533: 1083 | AC533: 109.7876269621422 | AD533: 20
A534: BEST PLAYERS | W534: NORTHCOTE | X534: 4 | Y534: 5 | Z534: 1 | AA534: 967 | AB534: 1047 | AC534: 92.359121298949376 | AD534: 18
A535: CAMBERWELL | C535: HORKINGS | F535: CLAMP | J535: HOPKINS | M535: ROWE | P535: McKAY | R535: FORD | W535: BRIGHTON | X535: 4 | Y535: 6 | Z535: 0 | AA535: 1020 | AB535: 1085 | AC535: 94.009216589861751 | AD535: 16
A536: COBURG | C536: LONSDALE | F536: PRENDERGAST | J536: MILTE | M536: ANDERSON | P536: MUNDAY | W536: COBURG | X536: 3 | Y536: 6 | Z536: 1 | AA536: 845 | AB536: 895 | AC536: 94.413407821229043 | AD536: 14
A537: GOALKICKERS | W537: OAKLEIGH | X537: 3 | Y537: 7 | Z537: 0 | AA537: 1050 | AB537: 1262 | AC537: 83.2012678288431 | AD537: 12
A538: CAMBERWELL | C538: NASH 4 | E538: HARLEY 3 | G538: CLAMP 3 | I538: WHITE 3 | K538: HORKINGS | M538: ROWE | O538: FORD | W538: YARRAVILLE | X538: 3 | Y538: 7 | Z538: 0 | AA538: 999 | AB538: 1349 | AC538: 74.054855448480353 | AD538: 12
A539: COBURG | C539: PRATT 4 | E539: PRENDERGAST 2 | H539: IRVINE 2 | J539: COLLINS 2 | M539: MUNDAY | O539: ANDERSON | Q539: R ATKINSON | W539: SANDRINGHAM | X539: 1 | Y539: 9 | Z539: 0 | AA539: 898 | AB539: 1216 | AC539: 73.848684210526315 | AD539: 4
P540: THURGOOD
A541: BRIGHTON | C541: 4 | D541: 5 | E541: =C541*6+D541 -> 29 | G541: 11 | H541: 5 | I541: =G541*6+H541 -> 71 | K541: 21 | L541: 13 | M541: =K541*6+L541 -> 139 | O541: 21 | P541: 16 | Q541: =O541*6+P541 -> 142 | S541: ELSTERNWICK PARK
A542: NORTHCOTE | C542: 2 | D542: 4 | E542: =C542*6+D542 -> 16 | G542: 6 | H542: 9 | I542: =G542*6+H542 -> 45 | K542: 9 | L542: 15 | M542: =K542*6+L542 -> 69 | O542: 17 | P542: 19 | Q542: =O542*6+P542 -> 121 | S542: HAYES
A543: BEST PLAYERS
A544: BRIGHTON | C544: WEBER | E544: DAVIS | H544: GEORGE | K544: CONNELL | N544: RECHTER | Q544: WILLIAMSON
A545: NORTHCOTE | C545: WARNER | E545: DRYDEN | H545: WATT | K545: WHITE | N545: SIMPSON | Q545: MEITZCKE
A546: GOALKICKERS
A547: BRIGHTON | C547: HALLAHAN 7 | F547: CONNELL 5 | I547: MILLER 3 | K547: BIRD 3 | M547: BROOKS | O547: McINERNEY | R547: JOHNSON
A548: NORTHCOTE | C548: HISCOX 3 | F548: POLLARD 3 | I548: WARNER 3 | L548: WHITE 2 | N548: CROSBIE 2 | Q548: VENNING | S548: SIMPSON | V548: STABB | X548: MORRISON
A550: OAKLEIGH | C550: 4 | D550: 1 | E550: =C550*6+D550 -> 25 | G550: 15 | H550: 9 | I550: =G550*6+H550 -> 99 | K550: 20 | L550: 11 | M550: =K550*6+L550 -> 131 | O550: 26 | P550: 14 | Q550: =O550*6+P550 -> 170 | S550: OAKLEIGH
A551: WILLIAMSTOWN | C551: 5 | D551: 4 | E551: =C551*6+D551 -> 34 | G551: 8 | H551: 7 | I551: =G551*6+H551 -> 55 | K551: 14 | L551: 11 | M551: =K551*6+L551 -> 95 | O551: 18 | P551: 19 | Q551: =O551*6+P551 -> 127 | S551: McALPINE
A552: BEST PLAYERS
A553: OAKLEIGH | C553: KENNEDY | F553: RYAN | I553: ASH | L553: SMITH | O553: BEARD | Q553: WILSON
A554: WILLIAMSTOWN | C554: WILCOX | F554: DELLER | I554: JOHNSON | L554: BAMFORD | O554: TODD | Q554: SPOKES
A555: GOALKICKERS
A556: OAKLEIGH | C556: McCRORY 5 | F556: BEARD 5 | H556: ASH 3 | J556: CLARKE 3 | M556: KENNEDY 2 | P556: SMITH 2 | R556: REID 2 | U556: LAW | W556: O'DONOGHUE | X556: NOLAN | Z556: CRAMERI | AB556: WEISS
A557: WILLIAMSTOWN | C557: TODD 5 | F557: THOMAS 2 | I557: FITCH 2 | K557: SPOKES 2 | M557: JAMIESON 2 | P557: CAVE 2 | R557: BAMFORD | U557: HARLAND | X557: QUINN
A559: YARRAVILLE | C559: 2 | D559: 2 | E559: =C559*6+D559 -> 14 | G559: 5 | H559: 3 | I559: =G559*6+H559 -> 33 | K559: 13 | L559: 11 | M559: =K559*6+L559 -> 89 | O559: 17 | P559: 14 | Q559: =O559*6+P559 -> 116 | S559: YARRAVILLE
A560: PRAHRAN | C560: 3 | D560: 8 | E560: =C560*6+D560 -> 26 | G560: 9 | H560: 15 | I560: =G560*6+H560 -> 69 | K560: 10 | L560: 19 | M560: =K560*6+L560 -> 79 | O560: 15 | P560: 24 | Q560: =O560*6+P560 -> 114 | S560: DWYER
A561: BEST PLAYERS
A562: YARRAVILLE | C562: WEDGWOOD | F562: H SMITH | I562: ALSOP | L562: McVEIGH | O562: PERUSSICH | R562: DOHERTY
A563: PRAHRAN | C563: ROLFE | F563: NEWTON | I563: F SMITH | L563: DAVEY | O563: JOHNSON | R563: TUCKER
A564: GOALKICKERS
A565: YARRAVILLE | C565: ALSOP 7 | F565: O'HALLORAN 5 | J565: PERUSSICH 4 | M565: McINTYRE
A566: PRAHRAN | C566: WHITE 4 | F566: DAVEY 2 | I566: TUCKER 2 | L566: PROBYN 2 | N566: ROLFE 2 | P566: PEARCE 2 | R566: THOMPSON
A568: BRUNSWICK | C568: 1 | D568: 4 | E568: =C568*6+D568 -> 10 | G568: 4 | H568: 14 | I568: =G568*6+H568 -> 38 | K568: 9 | L568: 14 | M568: =K568*6+L568 -> 68 | O568: 16 | P568: 19 | Q568: =O568*6+P568 -> 115 | S568: BRUNSWICK
A569: SANDRINGHAM | C569: 2 | D569: 7 | E569: =C569*6+D569 -> 19 | G569: 3 | H569: 8 | I569: =G569*6+H569 -> 26 | K569: 5 | L569: 11 | M569: =K569*6+L569 -> 41 | O569: 6 | P569: 13 | Q569: =O569*6+P569 -> 49 | S569: GREGORY
A570: BEST PLAYERS
A571: BRUNSWICK | C571: FITZGIBBON | F571: FAY | I571: CRISP | L571: JEFFREY | O571: BOYD | Q571: McELROY
A572: SANDRINGHAM | C572: ALLISTER | F572: WESTCOTT | I572: CARTWRIGHT | L572: MORRIS | O572: AMINDE | Q572: SMAIL
A573: GOALKICKERS
A574: BRUNSWICK | C574: JONES 6 | F574: DOWLING 2 | I574: QUINN 2 | K574: CRISP | M574: McKAY | O574: KEMP | Q574: McELROY | S574: JEFFREY | U574: CLARKE
A575: SANDRINGHAM | C575: ALLISTER 2 | F575: CARTWRIGHT | I575: KENT | K575: HEDGE | M575: TAYLOR
A577: ROUND 11 | E577: 29TH JUNE | J577: WEATHER | M577: CLOUDY BUT FINE S.W.WIND | S577: PLAYED AT
D578: 1ST QTR | H578: 2ND QTR | L578: 3RD QTR | P578: FINAL | S578: WILLIAMSTOWN
A579: WILLIAMSTOWN | C579: 1 | D579: 4 | E579: =C579*6+D579 -> 10 | G579: 8 | H579: 11 | I579: =G579*6+H579 -> 59 | K579: 8 | L579: 12 | M579: =K579*6+L579 -> 60 | O579: 12 | P579: 19 | Q579: =O579*6+P579 -> 91 | S579: UMPIRE | X579: LADDER | AB579: ROUND | AD579: 11
A580: BRUNSWICK | C580: 3 | D580: 3 | E580: =C580*6+D580 -> 21 | G580: 5 | H580: 5 | I580: =G580*6+H580 -> 35 | K580: 7 | L580: 11 | M580: =K580*6+L580 -> 53 | O580: 8 | P580: 12 | Q580: =O580*6+P580 -> 60 | S580: McALPINE
A581: BEST PLAYERS | W581: TEAM | X581: W | Y581: L | Z581: D | AA581: FOR | AB581: AGST | AC581: % | AD581: PTS
A582: WILLIAMSTOWN | C582: FITCH | E582: TODD | H582: THOMAS | K582: WILCOX | N582: GLASS | Q582: CAVE
A583: BRUNSWICK | C583: BOYD | E583: McELROY | H583: QUINN | K583: DOWLING | N583: HOBBA | Q583: FITZGIBBON | W583: WILLIAMSTOWN | X583: 9 | Y583: 2 | Z583: 0 | AA583: 1428 | AB583: 976 | AC583: 146.31147540983608 | AD583: 36
A584: GOALKICKERS | W584: PORT MELBOURNE | X584: 8 | Y584: 3 | Z584: 0 | AA584: 1302 | AB584: 1047 | AC584: 124.35530085959886 | AD584: 32
A585: WILLIAMSTOWN | C585: TODD 4 | F585: THOMAS 4 | I585: VALLENCE 2 | L585: JAMIESON | N585: HARLAND | W585: PRAHRAN | X585: 8 | Y585: 3 | Z585: 0 | AA585: 1242 | AB585: 1105 | AC585: 112.39819004524887 | AD585: 32
A586: BRUNSWICK | C586: McELROY 3 | F586: DOWLING 2 | I586: BOYD | K586: PERRETT | M586: GARDNER | W586: PRESTON | X586: 8 | Y586: 3 | Z586: 0 | AA586: 1164 | AB586: 1063 | AC586: 109.50141110065852 | AD586: 32
A588: PRESTON | C588: 5 | D588: 3 | E588: =C588*6+D588 -> 33 | G588: 10 | H588: 9 | I588: =G588*6+H588 -> 69 | K588: 10 | L588: 13 | M588: =K588*6+L588 -> 73 | O588: 18 | P588: 20 | Q588: =O588*6+P588 -> 128 | S588: PRESTON | W588: BRUNSWICK | X588: 6 | Y588: 5 | Z588: 0 | AA588: 1142 | AB588: 1011 | AC588: 112.95746785361028 | AD588: 24
A589: CAMBERWELL | C589: 2 | D589: 8 | E589: =C589*6+D589 -> 20 | G589: 6 | H589: 12 | I589: =G589*6+H589 -> 48 | K589: 9 | L589: 12 | M589: =K589*6+L589 -> 66 | O589: 10 | P589: 13 | Q589: =O589*6+P589 -> 73 | S589: HAYES | W589: NORTHCOTE | X589: 5 | Y589: 5 | Z589: 1 | AA589: 1077 | AB589: 1135 | AC589: 94.889867841409696 | AD589: 22
A590: BEST PLAYERS | W590: CAMBERWELL | X590: 5 | Y590: 6 | Z590: 0 | AA590: 1262 | AB590: 1211 | AC590: 104.21139554087532 | AD590: 20
A591: PRESTON | C591: MASLEN | F591: L SLEETH | I591: DEACON | K591: DUNSTONE | N591: DOWLING | Q591: ROSS | W591: COBURG | X591: 4 | Y591: 6 | Z591: 1 | AA591: 969 | AB591: 948 | AC591: 102.21518987341773 | AD591: 18
A592: CAMBERWELL | C592: SEELENMEYER | F592: McKAY | I592: ROGERS | K592: DURAND | N592: WHITEHEAD | Q592: NASH | W592: BRIGHTON | X592: 4 | Y592: 7 | Z592: 0 | AA592: 1093 | AB592: 1232 | AC592: 88.717532467532465 | AD592: 16
A593: GOALKICKERS | W593: YARRAVILLE | X593: 4 | Y593: 7 | Z593: 0 | AA593: 1100 | AB593: 1443 | AC593: 76.230076230076236 | AD593: 16
A594: PRESTON | C594: MORRISON 4 | F594: L SLEETH 3 | I594: DUNSTONE 2 | L594: ROSS | N594: DEACON | P594: TAYLOR | R594: SEEDSMAN | W594: OAKLEIGH | X594: 3 | Y594: 8 | Z594: 0 | AA594: 1103 | AB594: 1386 | AC594: 79.58152958152958 | AD594: 12
A595: CAMBERWELL | C595: NASH 4 | F595: WHITEHEAD 2 | I595: HARLEY 2 | K595: ROWE | M595: WOOLFE | W595: SANDRINGHAM | X595: 1 | Y595: 10 | Z595: 0 | AA595: 992 | AB595: 1317 | AC595: 75.322703113135915 | AD595: 4
A597: NORTHCOTE | C597: 3 | D597: 3 | E597: =C597*6+D597 -> 21 | G597: 6 | H597: 12 | I597: =G597*6+H597 -> 48 | K597: 8 | L597: 17 | M597: =K597*6+L597 -> 65 | O597: 14 | P597: 26 | Q597: =O597*6+P597 -> 110 | S597: NORTHCOTE
A598: PORT MELBOURNE | C598: 7 | D598: 2 | E598: =C598*6+D598 -> 44 | G598: 12 | H598: 6 | I598: =G598*6+H598 -> 78 | K598: 13 | L598: 9 | M598: =K598*6+L598 -> 87 | O598: 13 | P598: 10 | Q598: =O598*6+P598 -> 88 | S598: HUGHES
A599: BEST PLAYERS
A600: NORTHCOTE | C600: MEITZCKE | F600: VENNING | I600: McNAMEE | L600: DRYDEN | O600: McINTOSH | R600: POWELL
A601: PORT MELBOURNE | C601: GOLDSMITH | F601: FREYER | I601: FLETCHER | L601: ROBERTSON | O601: PLUNKETT | R601: LEE
A602: GOALKICKERS
A603: NORTHCOTE | C603: WHITE 4 | F603: MEITZCKE 3 | I603: McNAMEE 2 | L603: STABB | N603: CROSBIE | P603: VENNING | R603: HOLDEN | U603: BAGULEY
A604: PORT MELBOURNE | C604: FREYER 9 | F604: KELLY 3 | I604: ONLEY
A606: COBURG | C606: 2 | D606: 5 | E606: =C606*6+D606 -> 17 | G606: 7 | H606: 8 | I606: =G606*6+H606 -> 50 | K606: 10 | L606: 13 | M606: =K606*6+L606 -> 73 | O606: 17 | P606: 22 | Q606: =O606*6+P606 -> 124 | S606: COBURG
A607: OAKLEIGH | C607: 3 | D607: 0 | E607: =C607*6+D607 -> 18 | G607: 4 | H607: 3 | I607: =G607*6+H607 -> 27 | K607: 6 | L607: 9 | M607: =K607*6+L607 -> 45 | O607: 7 | P607: 11 | Q607: =O607*6+P607 -> 53 | S607: GREGORY
A608: BEST PLAYERS
A609: COBURG | C609: RINGHOLT | F609: MUNDAY | I609: ANDERSON | L609: LONSDALE | O609: PRATT | R609: ATKINSON
A610: OAKLEIGH | C610: CRAMERI | F610: SMITH | I610: WILSON | L610: LAW | O610: KENNEDY | R610: REID
A611: GOALKICKERS
A612: COBURG | C612: PRATT 7 | F612: JOHNSON 3 | I612: MUNDAY 3 | L612: BEAGLEY 2 | O612: IRVINE 2
A613: OAKLEIGH | C613: LAW 2 | F613: REID | H613: BEARD | J613: ASH | L613: HOLT | N613: McCRORY
A615: YARRAVILLE | C615: 4 | D615: 7 | E615: =C615*6+D615 -> 31 | G615: 6 | H615: 7 | I615: =G615*6+H615 -> 43 | K615: 13 | L615: 11 | M615: =K615*6+L615 -> 89 | O615: 15 | P615: 11 | Q615: =O615*6+P615 -> 101 | S615: BEACH ROAD
A616: SANDRINGHAM | C616: 2 | D616: 3 | E616: =C616*6+D616 -> 15 | G616: 6 | H616: 7 | I616: =G616*6+H616 -> 43 | K616: 8 | L616: 10 | M616: =K616*6+L616 -> 58 | O616: 14 | P616: 10 | Q616: =O616*6+P616 -> 94 | S616: MERRINGTON
A617: BEST PLAYERS
A618: YARRAVILLE | C618: PLUMMER | F618: O'HALLORAN | I618: SMITH | L618: STREETER | O618: ROBERTSON | R618: McVEIGH
A619: SANDRINGHAM | C619: AMINDE | F619: MILLER | I619: CHILDS | L619: ALLISTER | O619: LUDLOW | R619: KENT
A620: GOALKICKERS
A621: YARRAVILLE | C621: O'HALLORAN 4 | F621: ALSOP 4 | H621: BROADWAY 2 | K621: ROBERTSON 2 | N621: WEDGWOOD 2 | Q621: McINTYRE
A622: SANDRINGHAM | C622: LUDLOW 4 | F622: ALLISTER 3 | I622: KENT 2 | K622: MITCHELL | M622: WITHERS | O622: ROBINSON | Q622: RYAN | S622: HOWELLS
A624: PRAHRAN | C624: 6 | D624: 1 | E624: =C624*6+D624 -> 37 | G624: 12 | H624: 7 | I624: =G624*6+H624 -> 79 | K624: 18 | L624: 10 | M624: =K624*6+L624 -> 118 | O624: 21 | P624: 21 | Q624: =O624*6+P624 -> 147 | S624: TOORAK PARK
A625: BRIGHTON | C625: 2 | D625: 7 | E625: =C625*6+D625 -> 19 | G625: 6 | H625: 7 | I625: =G625*6+H625 -> 43 | K625: 8 | L625: 12 | M625: =K625*6+L625 -> 60 | O625: 10 | P625: 13 | Q625: =O625*6+P625 -> 73 | S625: McNAMARA
A626: BEST PLAYERS
A627: PRAHRAN | C627: TUCKER | E627: DAVEY | H627: SMITH | K627: ROLFE | N627: ANDERS | Q627: NEWTON
A628: BRIGHTON | C628: BROOKS | E628: WEBER | H628: HUNTER | K628: IVEY | N628: WILLIAMSON | Q628: HALL
A629: GOALKICKERS
A630: PRAHRAN | C630: DAVEY 3 | E630: WILLIAMS 3 | H630: ANDERS 3 | J630: WHITE 3 | L630: N GRAVELL 3 | O630: ROLFE 2 | Q630: SMITH | S630: TUCKER | V630: BRENCHLEY | X630: O'DONNELL
A631: BRIGHTON | C631: HUNTER 3 | F631: BROOKS 2 | I631: MITCHELL 2 | L631: BIRD | N631: HENDER | P631: IVEY
A633: ROUND 12 | E633: 6TH JULY | J633: WEATHER | M633: FINE NORTH BREEZE | S633: PLAYED AT
D634: 1ST QTR | H634: 2ND QTR | L634: 3RD QTR | P634: FINAL | S634: TOORAK PARK
A635: PORT MELBOURNE | C635: 5 | D635: 4 | E635: =C635*6+D635 -> 34 | G635: 10 | H635: 9 | I635: =G635*6+H635 -> 69 | K635: 14 | L635: 16 | M635: =K635*6+L635 -> 100 | O635: 17 | P635: 22 | Q635: =O635*6+P635 -> 124 | S635: UMPIRE | X635: LADDER | AB635: ROUND | AD635: 12
A636: PRAHRAN | C636: 3 | D636: 1 | E636: =C636*6+D636 -> 19 | G636: 8 | H636: 7 | I636: =G636*6+H636 -> 55 | K636: 13 | L636: 10 | M636: =K636*6+L636 -> 88 | O636: 17 | P636: 17 | Q636: =O636*6+P636 -> 119 | S636: McALPINE
A637: BEST PLAYERS | W637: TEAM | X637: W | Y637: L | Z637: D | AA637: FOR | AB637: AGST | AC637: % | AD637: PTS
A638: PORT MELBOURNE | C638: JULIER | F638: GOLDSMITH | I638: LAHIFF | L638: FLETCHER | O638: GOSS | Q638: REYNOLDS
A639: PRAHRAN | C639: JOHNSON | F639: FAUL | I639: BRENCHLEY | L639: N GRAVELL | O639: WILLIAMS | Q639: DAVEY | W639: WILLIAMSTOWN | X639: 10 | Y639: 2 | Z639: 0 | AA639: 1536 | AB639: 1058 | AC639: 145.17958412098298 | AD639: 40
A640: GOALKICKERS | W640: PORT MELBOURNE | X640: 9 | Y640: 3 | Z640: 0 | AA640: 1426 | AB640: 1166 | AC640: 122.29845626072041 | AD640: 36
A641: PORT MELBOURNE | C641: FREYER 6 | F641: LAHIFF 5 | I641: KELLY 2 | K641: ALSOP | M641: DOBSON | O641: FLETCHER | Q641: JULIER | W641: PRESTON | X641: 9 | Y641: 3 | Z641: 0 | AA641: 1270 | AB641: 1151 | AC641: 110.3388357949609 | AD641: 36
A642: PRAHRAN | C642: N GRAVELL 3 | F642: ANDERS 3 | I642: ROLFE 2 | K642: WHITE 2 | M642: PEARCE 2 | O642: DAVEY 2 | Q642: WILLIAMS | W642: PRAHRAN | X642: 8 | Y642: 4 | Z642: 0 | AA642: 1361 | AB642: 1229 | AC642: 110.74043938161107 | AD642: 32
P643: BRENCHLEY | S643: BENNISON
A644: PRESTON | C644: 1 | D644: 4 | E644: =C644*6+D644 -> 10 | G644: 6 | H644: 10 | I644: =G644*6+H644 -> 46 | K644: 8 | L644: 13 | M644: =K644*6+L644 -> 61 | O644: 15 | P644: 16 | Q644: =O644*6+P644 -> 106 | S644: NORTHCOTE | W644: BRUNSWICK | X644: 6 | Y644: 6 | Z644: 0 | AA644: 1212 | AB644: 1116 | AC644: 108.60215053763442 | AD644: 24
A645: NORTHCOTE | C645: 4 | D645: 8 | E645: =C645*6+D645 -> 32 | G645: 7 | H645: 7 | I645: =G645*6+H645 -> 49 | K645: 11 | L645: 15 | M645: =K645*6+L645 -> 81 | O645: 12 | P645: 16 | Q645: =O645*6+P645 -> 88 | S645: HUGHES | W645: CAMBERWELL | X645: 6 | Y645: 6 | Z645: 0 | AA645: 1388 | AB645: 1332 | AC645: 104.2042042042042 | AD645: 24
A646: BEST PLAYERS | W646: COBURG | X646: 5 | Y646: 6 | Z646: 1 | AA646: 1074 | AB646: 1018 | AC646: 105.50098231827111 | AD646: 22
A647: PRESTON | C647: L SLEETH | F647: MASLEN | I647: DUNSTONE | L647: MINNEY | O647: MILLER | Q647: WATKINS | W647: NORTHCOTE | X647: 5 | Y647: 6 | Z647: 1 | AA647: 1165 | AB647: 1241 | AC647: 93.875906526994356 | AD647: 22
A648: NORTHCOTE | C648: HOLDEN | F648: MEITZCKE | I648: VENNING | L648: POWELL | O648: McINTOSH | Q648: HISCOX | W648: BRIGHTON | X648: 5 | Y648: 7 | Z648: 0 | AA648: 1183 | AB648: 1312 | AC648: 90.167682926829272 | AD648: 20
A649: GOALKICKERS | Q649: SEEDSMAN | W649: YARRAVILLE | X649: 4 | Y649: 8 | Z649: 0 | AA649: 1182 | AB649: 1551 | AC649: 76.208897485493225 | AD649: 16
A650: PRESTON | C650: MILLER 4 | E650: L SLEETH 3 | H650: MORRISON 2 | K650: ROSS | L650: DUNSTONE | N650: BROWN | P650: CALVERT | R650: DEACON | W650: OAKLEIGH | X650: 3 | Y650: 9 | Z650: 0 | AA650: 1224 | AB650: 1512 | AC650: 80.952380952380949 | AD650: 12
A651: NORTHCOTE | C651: MEITZCKE 3 | F651: WHITE 3 | H651: BAGULEY 3 | K651: VENNING 2 | N651: DRYDEN | W651: SANDRINGHAM | X651: 1 | Y651: 11 | Z651: 0 | AA651: 1072 | AB651: 1407 | AC651: 76.19047619047619 | AD651: 4
A653: COBURG | C653: 3 | D653: 6 | E653: =C653*6+D653 -> 24 | G653: 8 | H653: 7 | I653: =G653*6+H653 -> 55 | K653: 12 | L653: 14 | M653: =K653*6+L653 -> 86 | O653: 15 | P653: 15 | Q653: =O653*6+P653 -> 105 | S653: COBURG
A654: BRUNSWICK | C654: 1 | D654: 1 | E654: =C654*6+D654 -> 7 | G654: 2 | H654: 5 | I654: =G654*6+H654 -> 17 | K654: 6 | L654: 6 | M654: =K654*6+L654 -> 42 | O654: 10 | P654: 10 | Q654: =O654*6+P654 -> 70 | S654: GROVES
A655: BEST PLAYERS
A656: COBURG | C656: PRATT | F656: PROMNITZ | I656: R ATKINSON | M656: ANDERSON | P656: RE | R656: RINGHOLT
A657: BRUNSWICK | C657: STANDFIELD | F657: BOYD | I657: McELROY | M657: CLARKE | P657: DOWLING | R657: HOBBA
A658: GOALKICKERS
A659: COBURG | C659: PRATT 8 | F659: IRVINE 2 | I659: ANDERSON 2 | L659: LONSDALE | N659: COLLINS | P659: MUNDAY
A660: BRUNSWICK | C660: COOPER 2 | F660: JONES 2 | I660: CRISP 2 | K660: CLARKE | M660: KEATING | O660: McKAY | Q660: KEMP
A662: CAMBERWELL | C662: 5 | D662: 4 | E662: =C662*6+D662 -> 34 | G662: 10 | H662: 6 | I662: =G662*6+H662 -> 66 | K662: 15 | L662: 7 | M662: =K662*6+L662 -> 97 | O662: 19 | P662: 12 | Q662: =O662*6+P662 -> 126 | S662: OAKLEIGH
A663: OAKLEIGH | C663: 5 | D663: 2 | E663: =C663*6+D663 -> 32 | G663: 10 | H663: 7 | I663: =G663*6+H663 -> 67 | K663: 14 | L663: 11 | M663: =K663*6+L663 -> 95 | O663: 18 | P663: 13 | Q663: =O663*6+P663 -> 121 | S663: MERRINGTON
A664: BEST PLAYERS
A665: CAMBERWELL | C665: NASH | F665: SEELENMEYER | I665: CLAMP | K665: ROGERS | N665: WHITE | P665: ROWE
A666: OAKLEIGH | C666: McCRORY | F666: KENNEDY | I666: ASH | K666: LAW | N666: REID | P666: CLARKE
A667: GOALKICKERS
A668: CAMBERWELL | C668: NASH 10 | F668: HARLEY 6 | I668: SUTTON | K668: CLAMP | M668: FINN
A669: OAKLEIGH | C669: McCRORY 4 | F669: REID 3 | H669: KENNEDY 2 | K669: SMITH 2 | M669: CLARKE 2 | O669: ASH | P669: LANNING | R669: LAW | T669: THOMAS | W669: CORP
A671: BRIGHTON | C671: 3 | D671: 6 | E671: =C671*6+D671 -> 24 | G671: 5 | H671: 8 | I671: =G671*6+H671 -> 38 | K671: 9 | L671: 16 | M671: =K671*6+L671 -> 70 | O671: 12 | P671: 18 | Q671: =O671*6+P671 -> 90 | S671: BEACH ROAD
A672: SANDRINGHAM | C672: 4 | D672: 4 | E672: =C672*6+D672 -> 28 | G672: 7 | H672: 7 | I672: =G672*6+H672 -> 49 | K672: 8 | L672: 8 | M672: =K672*6+L672 -> 56 | O672: 11 | P672: 14 | Q672: =O672*6+P672 -> 80 | S672: HAYES
A673: BEST PLAYERS
A674: BRIGHTON | C674: HALL | E674: BROOKS | H674: IVEY | K674: DAVIS | M674: WILLIAMSON | P674: BIRD
A675: SANDRINGHAM | C675: HEDGE | E675: TAYLOR | H675: MILLER | K675: STOKES | M675: ALLISTER | P675: McINTYRE
A676: GOALKICKERS
A677: BRIGHTON | C677: IVEY 6 | F677: BROOKS 3 | I677: DAVIS 2 | K677: KEMP
A678: SANDRINGHAM | C678: ALLISTER 3 | F678: NOTTLE 2 | I678: TAYLOR | K678: MILLER | M678: WHEATLEY | O678: LUDLOW | Q678: AMINDE | S678: HOWELLS
A680: WILLIAMSTOWN | C680: 2 | D680: 3 | E680: =C680*6+D680 -> 15 | G680: 10 | H680: 5 | I680: =G680*6+H680 -> 65 | K680: 14 | L680: 10 | M680: =K680*6+L680 -> 94 | O680: 16 | P680: 12 | Q680: =O680*6+P680 -> 108 | S680: WILLIAMSTOWN
A681: YARRAVILLE | C681: 1 | D681: 1 | E681: =C681*6+D681 -> 7 | G681: 4 | H681: 2 | I681: =G681*6+H681 -> 26 | K681: 7 | L681: 6 | M681: =K681*6+L681 -> 48 | O681: 12 | P681: 10 | Q681: =O681*6+P681 -> 82 | S681: McNAMARA
A682: BEST PLAYERS
A683: WILLIAMSTOWN | C683: WILCOX | F683: HARLAND | I683: GLASS | L683: CAVE | N683: THOMAS | Q683: QUINN
A684: YARRAVILLE | C684: T SMITH | F684: H SMITH | I684: McVEIGH | L684: REDPATH | N684: BARROW | Q684: KENNY
A685: GOALKICKERS
A686: WILLIAMSTOWN | C686: TODD 5 | F686: VALLENCE 5 | I686: CAVE | J686: GLASS | L686: THOMAS | N686: HARLAND | Q686: QUINN | S686: JAMIESON
A687: YARRAVILLE | C687: ALSOP 5 | F687: PERUSSICH 2 | I687: ROBERTSON 2 | L687: BROADWAY | O687: O'HALLORAN | R687: H SMITH
A689: ROUND 13 | E689: 13TH JULY | J689: WEATHER | M689: COLD CLOUDY SHOWERS N.W. WIND | S689: PLAYED AT
D690: 1ST QTR | H690: 2ND QTR | L690: 3RD QTR | P690: FINAL | S690: PRESTON
A691: PRESTON | C691: 3 | D691: 2 | E691: =C691*6+D691 -> 20 | G691: 6 | H691: 11 | I691: =G691*6+H691 -> 47 | K691: 10 | L691: 15 | M691: =K691*6+L691 -> 75 | O691: 13 | P691: 18 | Q691: =O691*6+P691 -> 96 | S691: UMPIRE | X691: LADDER | AB691: ROUND | AD691: 13
A692: PRAHRAN | C692: 4 | D692: 5 | E692: =C692*6+D692 -> 29 | G692: 7 | H692: 9 | I692: =G692*6+H692 -> 51 | K692: 9 | L692: 16 | M692: =K692*6+L692 -> 70 | O692: 12 | P692: 19 | Q692: =O692*6+P692 -> 91 | S692: HAYES
A693: BEST PLAYERS | W693: TEAM | X693: W | Y693: L | Z693: D | AA693: FOR | AB693: AGST | AC693: % | AD693: PTS
A694: PRESTON | C694: CALVERT | F694: DUNSTONE | I694: MINNEY | K694: MASLEN | N694: WATKINS | Q694: GRAY
A695: PRAHRAN | C695: DAVEY | F695: TUCKER | I695: FAUL | K695: ROLFE | N695: N GRAVELL | Q695: JOHNSON | W695: WILLIAMSTOWN | X695: 11 | Y695: 2 | Z695: 0 | AA695: 1660 | AB695: 1158 | AC695: 143.35060449050087 | AD695: 44
A696: GOALKICKERS | R696: DEACON | W696: PORT MELBOURNE | X696: 10 | Y696: 3 | Z696: 0 | AA696: 1616 | AB696: 1239 | AC696: 130.42776432606942 | AD696: 40
A697: PRESTON | C697: CALVERT 2 | F697: ROACH 2 | H697: ROSS 2 | J697: DUNSTONE 2 | M697: MORRISON | O697: L SLEETH | Q697: MILLER | S697: WHITE | W697: PRESTON | X697: 10 | Y697: 3 | Z697: 0 | AA697: 1366 | AB697: 1242 | AC697: 109.98389694041867 | AD697: 40
A698: PRAHRAN | C698: DAVEY 4 | F698: ROLFE 3 | I698: N GRAVELL 3 | L698: BRENCHLEY | O698: NEWTON | W698: PRAHRAN | X698: 8 | Y698: 5 | Z698: 0 | AA698: 1452 | AB698: 1325 | AC698: 109.58490566037736 | AD698: 32
A700: NORTHCOTE | C700: 1 | D700: 6 | E700: =C700*6+D700 -> 12 | G700: 6 | H700: 10 | I700: =G700*6+H700 -> 46 | K700: 12 | L700: 13 | M700: =K700*6+L700 -> 85 | O700: 15 | P700: 19 | Q700: =O700*6+P700 -> 109 | S700: CAMBERWELL | W700: BRUNSWICK | X700: 7 | Y700: 6 | Z700: 0 | AA700: 1332 | AB700: 1174 | AC700: 113.45826235093696 | AD700: 28
A701: CAMBERWELL | C701: 5 | D701: 3 | E701: =C701*6+D701 -> 33 | G701: 7 | H701: 8 | I701: =G701*6+H701 -> 50 | K701: 11 | L701: 9 | M701: =K701*6+L701 -> 75 | O701: 12 | P701: 18 | Q701: =O701*6+P701 -> 90 | S701: MERRINGTON | W701: COBURG | X701: 6 | Y701: 6 | Z701: 1 | AA701: 1204 | AB701: 1111 | AC701: 108.37083708370837 | AD701: 26
A702: BEST PLAYERS | W702: NORTHCOTE | X702: 6 | Y702: 6 | Z702: 1 | AA702: 1274 | AB702: 1331 | AC702: 95.717505634861013 | AD702: 26
A703: NORTHCOTE | C703: HISCOX | E703: E HART | H703: DRYDEN | K703: MCNAMEE | N703: DOWER | Q703: HOLDEN | W703: CAMBERWELL | X703: 6 | Y703: 7 | Z703: 0 | AA703: 1478 | AB703: 1441 | AC703: 102.5676613462873 | AD703: 24
A704: CAMBERWELL | C704: ROGERS | E704: HENDERSON | H704: WHITE | K704: WHITEHEAD | N704: McKAY | Q704: NASH | W704: BRIGHTON | X704: 5 | Y704: 8 | Z704: 0 | AA704: 1283 | AB704: 1436 | AC704: 89.345403899721447 | AD704: 20
A705: GOALKICKERS | W705: YARRAVILLE | X705: 4 | Y705: 9 | Z705: 0 | AA705: 1275 | AB705: 1681 | AC705: 75.847709696609158 | AD705: 16
A706: NORTHCOTE | C706: WHITE 4 | E706: McNAMEE 3 | H706: MEITZCKE 3 | K706: HISCOX 2 | M706: CAHILL 2 | O706: STABB | W706: OAKLEIGH | X706: 3 | Y706: 10 | Z706: 0 | AA706: 1282 | AB706: 1632 | AC706: 78.553921568627445 | AD706: 12
A707: CAMBERWELL | C707: NASH 4 | E707: HARLEY 3 | H707: WHITEHEAD 2 | K707: CLAMP 2 | M707: SUTTON | O707: WHITE | W707: SANDRINGHAM | X707: 1 | Y707: 12 | Z707: 0 | AA707: 1145 | AB707: 1597 | AC707: 71.696931747025673 | AD707: 4
A709: BRUNSWICK | C709: 2 | D709: 10 | E709: =C709*6+D709 -> 22 | G709: 3 | H709: 15 | I709: =G709*6+H709 -> 33 | K709: 10 | L709: 21 | M709: =K709*6+L709 -> 81 | O709: 16 | P709: 24 | Q709: =O709*6+P709 -> 120 | S709: BRUNSWICK
A710: OAKLEIGH | C710: 0 | D710: 2 | E710: =C710*6+D710 -> 2 | G710: 3 | H710: 5 | I710: =G710*6+H710 -> 23 | K710: 5 | L710: 5 | M710: =K710*6+L710 -> 35 | O710: 8 | P710: 10 | Q710: =O710*6+P710 -> 58 | S710: McNAMARA
A711: BEST PLAYERS
A712: BRUNSWICK | C712: STANDFIELD | F712: DOWLING | I712: QUINN | L712: FITZGIBBON | O712: HOBBA | Q712: GARDNER
A713: OAKLEIGH | C713: WILSON | F713: CLARKE | I713: BICKERTON | L713: McCRORY | O713: WEISS | Q713: KENNEDY
A714: GOALKICKERS
A715: BRUNSWICK | C715: WHITE 4 | E715: DOWLING 4 | H715: KEMP 2 | J715: McKAY | L715: QUINN | N715: KEATING | P715: McKERNAN | R715: STANDFIELD | V715: CLARKE
A716: OAKLEIGH | C716: REID 3 | E716: McCRORY 2 | H716: BEARD 2 | J716: LAW
A718: PORT MELBOURNE | C718: 8 | D718: 6 | E718: =C718*6+D718 -> 54 | G718: 16 | H718: 9 | I718: =G718*6+H718 -> 105 | K718: 23 | L718: 12 | M718: =K718*6+L718 -> 150 | O718: 29 | P718: 16 | Q718: =O718*6+P718 -> 190 | S718: PORT MELBOURNE
A719: SANDRINGHAM | C719: 0 | D719: 4 | E719: =C719*6+D719 -> 4 | G719: 5 | H719: 7 | I719: =G719*6+H719 -> 37 | K719: 6 | L719: 9 | M719: =K719*6+L719 -> 45 | O719: 10 | P719: 13 | Q719: =O719*6+P719 -> 73 | S719: McALPINE
A720: BEST PLAYERS
A721: PORT MELBOURNE | C721: ALSOP | E721: FREYER | H721: GOLDSMITH | K721: ROBERTSON | N721: ONLEY | Q721: HURLEY
A722: SANDRINGHAM | C722: CHILDS | E722: MORRIS | H722: ROBINSON | K722: WHEATLEY | N722: SMAIL | Q722: SCOTT
A723: GOALKICKERS
A724: PORT MELBOURNE | C724: FREYER 18 | F724: CASTLES 3 | I724: HURLEY 2 | L724: LEE 2 | N724: ALLEN 2 | Q724: LAHIFF | S724: MARSHALL
A725: SANDRINGHAM | C725: NOTTLE 3 | F725: LUDLOW 3 | I725: WHEATLEY | L725: RYAN | N725: WESTCOTT | Q725: PARKE
E726: 20TH JULY | J726: WEATHER | M726: EARLY SHOWERS COLD CLOUDY W WIND
A727: COBURG | C727: 5 | D727: 3 | E727: =C727*6+D727 -> 33 | G727: 10 | H727: 8 | I727: =G727*6+H727 -> 68 | K727: 15 | L727: 15 | M727: =K727*6+L727 -> 105 | O727: 18 | P727: 22 | Q727: =O727*6+P727 -> 130 | S727: YARRAVILLE
A728: YARRAVILLE | C728: 4 | D728: 3 | E728: =C728*6+D728 -> 27 | G728: 6 | H728: 6 | I728: =G728*6+H728 -> 42 | K728: 8 | L728: 7 | M728: =K728*6+L728 -> 55 | O728: 14 | P728: 9 | Q728: =O728*6+P728 -> 93 | S728: HAYES
A729: BEST PLAYERS
A730: COBURG | C730: RINGHOLT | F730: PRATT | I730: LONSDALE | L730: R ATKINSON | O730: COLLINS | Q730: McLEY
A731: YARRAVILLE | C731: PLUMMER | F731: O'HALLORAN | I731: TEMPEST | L731: BARROW | O731: T SMITH | Q731: GARLICK
A732: GOALKICKERS
A733: COBURG | C733: PRATT 9 | F733: MUNDAY 3 | I733: COLLINS 2 | L733: McLEY | N733: HALL | P733: MILTE | R733: ANDERSON
A734: YARRAVILLE | C734: O'HALLORAN 6 | F734: ALSOP 3 | I734: RAWLINGS 3 | L734: STREETER | N734: SMITH
A736: WILLIAMSTOWN | C736: 3 | D736: 2 | E736: =C736*6+D736 -> 20 | G736: 9 | H736: 4 | I736: =G736*6+H736 -> 58 | K736: 13 | L736: 8 | M736: =K736*6+L736 -> 86 | O736: 18 | P736: 16 | Q736: =O736*6+P736 -> 124 | S736: ELSTERNWICK PARK
A737: BRIGHTON | C737: 5 | D737: 3 | E737: =C737*6+D737 -> 33 | G737: 5 | H737: 6 | I737: =G737*6+H737 -> 36 | K737: 10 | L737: 13 | M737: =K737*6+L737 -> 73 | O737: 14 | P737: 16 | Q737: =O737*6+P737 -> 100 | S737: HUGHES
A738: BEST PLAYERS
A739: WILLIAMSTOWN | C739: CUTTING | F739: HARLAND | I739: CHISHOLM | L739: JAMIESON | O739: TODD | Q739: VALLENCE
A740: BRIGHTON | C740: BROOKS | F740: HALLAHAN | I740: HALL | L740: HINDSON | O740: BIRD | Q740: CONNELL
A741: GOALKICKERS
A742: WILLIAMSTOWN | C742: VALLENCE 7 | F742: TODD 4 | I742: H RYAN 2 | L742: JAMIESON 2 | O742: CAVE | Q742: THOMAS | T742: QUINN
A743: BRIGHTON | C743: BIRD 4 | F743: IVEY 4 | I743: BROOKS 2 | L743: CONNELL 2 | O743: MILLER | Q743: HALLAHAN
A745: ROUND 14 | E745: 20TH JULY | H745: WEATHER | K745: EARLY SHOWERS COLD CLOUDY W WIND | S745: PLAYED AT
D746: 1ST QTR | H746: 2ND QTR | L746: 3RD QTR | P746: FINAL | S746: BEACH ROAD
A747: PRESTON | C747: 3 | D747: 6 | E747: =C747*6+D747 -> 24 | G747: 5 | H747: 8 | I747: =G747*6+H747 -> 38 | K747: 10 | L747: 16 | M747: =K747*6+L747 -> 76 | O747: 14 | P747: 21 | Q747: =O747*6+P747 -> 105 | S747: UMPIRE | X747: LADDER | AB747: ROUND | AD747: 14
A748: SANDRINGHAM | C748: 2 | D748: 3 | E748: =C748*6+D748 -> 15 | G748: 5 | H748: 8 | I748: =G748*6+H748 -> 38 | K748: 7 | L748: 10 | M748: =K748*6+L748 -> 52 | O748: 8 | P748: 14 | Q748: =O748*6+P748 -> 62 | S748: McALPINE
A749: BEST PLAYERS | W749: TEAM | X749: W | Y749: L | Z749: D | AA749: FOR | AB749: AGST | AC749: % | AD749: PTS
A750: PRESTON | C750: DUNSTONE | F750: CALVERT | I750: MASLEN | K750: GRAY | N750: MORRISON | Q750: DOWLING
A751: SANDRINGHAM | C751: FOLLETT | F751: CHILDS | I751: SCOTT | K751: WEBER | N751: PETTIONA | Q751: MILLER | W751: WILLIAMSTOWN | X751: 12 | Y751: 2 | Z751: 0 | AA751: 1766 | AB751: 1253 | AC751: 140.94173982442138 | AD751: 48
A752: GOALKICKERS | W752: PRESTON | X752: 11 | Y752: 3 | Z752: 0 | AA752: 1471 | AB752: 1304 | AC752: 112.80674846625767 | AD752: 44
A753: PRESTON | C753: DUNSTONE 6 | F753: ROACH 3 | H753: DEACON 2 | K753: CALVERT | M753: SEEDSMAN | P753: ROSS | W753: PORT MELBOURNE | X753: 10 | Y753: 4 | Z753: 0 | AA753: 1711 | AB753: 1345 | AC753: 127.21189591078067 | AD753: 40
A754: SANDRINGHAM | C754: KENT 2 | F754: LINDEN | H754: LUDLOW | J754: ALLISTER | M754: NOTTLE | O754: WEBER | Q754: MILLER | W754: PRAHRAN | X754: 9 | Y754: 5 | Z754: 0 | AA754: 1548 | AB754: 1416 | AC754: 109.32203389830508 | AD754: 36
E755: 27TH JULY | J755: WEATHER | M755: FINE NORTH WIND
A756: WILLIAMSTOWN | C756: 5 | D756: 10 | E756: =C756*6+D756 -> 40 | G756: 6 | H756: 11 | I756: =G756*6+H756 -> 47 | K756: 12 | L756: 14 | M756: =K756*6+L756 -> 86 | O756: 15 | P756: 16 | Q756: =O756*6+P756 -> 106 | S756: WILLIAMSTOWN | W756: BRUNSWICK | X756: 8 | Y756: 6 | Z756: 0 | AA756: 1425 | AB756: 1243 | AC756: 114.64199517296862 | AD756: 32
A757: PORT MELBOURNE | C757: 2 | D757: 0 | E757: =C757*6+D757 -> 12 | G757: 9 | H757: 5 | I757: =G757*6+H757 -> 59 | K757: 9 | L757: 7 | M757: =K757*6+L757 -> 61 | O757: 14 | P757: 11 | Q757: =O757*6+P757 -> 95 | S757: MERRINGTON | W757: COBURG | X757: 7 | Y757: 6 | Z757: 1 | AA757: 1286 | AB757: 1169 | AC757: 110.00855431993156 | AD757: 30
A758: BEST PLAYERS | W758: NORTHCOTE | X758: 6 | Y758: 7 | Z758: 1 | AA758: 1365 | AB758: 1427 | AC758: 95.655220742817093 | AD758: 26
A759: WILLIAMSTOWN | C759: CUTTING | E759: OGDEN | H759: THOMAS | K759: TODD | N759: DELLER | Q759: JAMIESON | W759: CAMBERWELL | X759: 6 | Y759: 8 | Z759: 0 | AA759: 1547 | AB759: 1534 | AC759: 100.84745762711864 | AD759: 24
A760: PORT MELBOURNE | C760: KELLY | E760: LAHIFF | H760: ROBERTSON | K760: HURLEY | N760: ALLEN | Q760: DOBSON | W760: BRIGHTON | X760: 5 | Y760: 9 | Z760: 0 | AA760: 1341 | AB760: 1518 | AC760: 88.339920948616594 | AD760: 20
A761: GOALKICKERS | W761: OAKLEIGH | X761: 4 | Y761: 10 | Z761: 0 | AA761: 1398 | AB761: 1734 | AC761: 80.622837370242209 | AD761: 16
A762: WILLIAMSTOWN | C762: TODD 6 | F762: VALLENCE 4 | I762: JAMIESON 2 | L762: H RYAN | N762: FITCH | P762: THOMAS | W762: YARRAVILLE | X762: 4 | Y762: 10 | Z762: 0 | AA762: 1377 | AB762: 1797 | AC762: 76.627712854757931 | AD762: 16
A763: PORT MELBOURNE | C763: HURLEY 4 | F763: FREYER 3 | I763: ALLEN 3 | K763: GOSS | M763: REYNOLDS | P763: KELLY | R763: LAHIFF | W763: SANDRINGHAM | X763: 1 | Y763: 13 | Z763: 0 | AA763: 1207 | AB763: 1702 | AC763: 70.916568742655699 | AD763: 4
A765: PRAHRAN | C765: 5 | D765: 4 | E765: =C765*6+D765 -> 34 | G765: 7 | H765: 6 | I765: =G765*6+H765 -> 48 | K765: 14 | L765: 11 | M765: =K765*6+L765 -> 95 | O765: 14 | P765: 12 | Q765: =O765*6+P765 -> 96 | S765: TOORAK PARK
A766: NORTHCOTE | C766: 1 | D766: 1 | E766: =C766*6+D766 -> 7 | G766: 4 | H766: 10 | I766: =G766*6+H766 -> 34 | K766: 4 | L766: 10 | M766: =K766*6+L766 -> 34 | O766: 12 | P766: 19 | Q766: =O766*6+P766 -> 91 | S766: McALPINE
A767: BEST PLAYERS
A768: PRAHRAN | C768: FAUL | E768: WILLIAMS | H768: N GRAVELL | K768: JOHNSON | N768: WHITEHEAD | Q768: TUCKER
A769: NORTHCOTE | C769: HISCOX | E769: DOWER | H769: HOLDEN | K769: E BRETHERTON | N769: POWELL | Q769: E HART
A770: GOALKICKERS
A771: PRAHRAN | C771: LYONS 4 | F771: ROLFE 3 | I771: N GRAVELL 2 | L771: BRENCHLEY | O771: FAUL | Q771: TUCKER | S771: ANDERS | U771: O'DONNELL
A772: NORTHCOTE | C772: HISCOX 3 | F772: STABB 2 | I772: CAHILL 2 | L772: GILMOUR 2 | O772: DOWER | Q772: HOLDEN | S772: WHITE
A774: BRUNSWICK | C774: 3 | D774: 5 | E774: =C774*6+D774 -> 23 | G774: 8 | H774: 6 | I774: =G774*6+H774 -> 54 | K774: 12 | L774: 9 | M774: =K774*6+L774 -> 81 | O774: 14 | P774: 9 | Q774: =O774*6+P774 -> 93 | S774: BRUNSWICK
A775: CAMBERWELL | C775: 1 | D775: 5 | E775: =C775*6+D775 -> 11 | G775: 4 | H775: 8 | I775: =G775*6+H775 -> 32 | K775: 6 | L775: 9 | M775: =K775*6+L775 -> 45 | O775: 9 | P775: 15 | Q775: =O775*6+P775 -> 69 | S775: PARRIS
A776: BEST PLAYERS
A777: BRUNSWICK | C777: STANDFIELD | F777: CLARKE | I777: QUINN | L777: FAY | O777: CRAWFORD | R777: FITZGIBBON
A778: CAMBERWELL | C778: McKAY | F778: WHITE | I778: CLEMENTS | L778: CLAMP | O778: FINN | R778: HENDERSON
A779: GOALKICKERS
A780: BRUNSWICK | C780: BOYD 4 | F780: McELROY 2 | I780: QUINN 2 | K780: WHITE 2 | M780: DOWLING 2 | P780: CRAWFORD | S780: STANDFIELD
A781: CAMBERWELL | C781: NASH 4 | F781: HARLEY 4 | I781: CLAMP
A783: COBURG | C783: 4 | D783: 7 | E783: =C783*6+D783 -> 31 | G783: 4 | H783: 8 | I783: =G783*6+H783 -> 32 | K783: 10 | L783: 15 | M783: =K783*6+L783 -> 75 | O783: 11 | P783: 16 | Q783: =O783*6+P783 -> 82 | S783: COBURG
A784: BRIGHTON | C784: 0 | D784: 3 | E784: =C784*6+D784 -> 3 | G784: 5 | H784: 9 | I784: =G784*6+H784 -> 39 | K784: 5 | L784: 11 | M784: =K784*6+L784 -> 41 | O784: 7 | P784: 16 | Q784: =O784*6+P784 -> 58 | S784: McNAMARA
A785: BEST PLAYERS
A786: COBURG | C786: COLLINS | E786: ATKINSON | H786: PROMNITZ | K786: BEAGLEY | N786: RINGHOLT | Q786: ANDERSON
A787: BRIGHTON | C787: DAVIS | E787: DYER | H787: HENDER | K787: GEORGE | N787: MILLER | Q787: HALL
A788: GOALKICKERS
A789: COBURG | C789: PRATT 2 | F789: ANDERSON 2 | I789: RINGHOLT 2 | L789: ATKINSON 2 | O789: COLLINS 2 | R789: McLEY
A790: BRIGHTON | C790: IVEY 2 | F790: MILLER | I790: DAVIS | K790: McINERNEY | N790: SCOTT | P790: BIRD
A792: OAKLEIGH | C792: 5 | D792: 7 | E792: =C792*6+D792 -> 37 | G792: 11 | H792: 8 | I792: =G792*6+H792 -> 74 | K792: 14 | L792: 11 | M792: =K792*6+L792 -> 95 | O792: 16 | P792: 20 | Q792: =O792*6+P792 -> 116 | S792: OAKLEIGH
A793: YARRAVILLE | C793: 4 | D793: 2 | E793: =C793*6+D793 -> 26 | G793: 7 | H793: 12 | I793: =G793*6+H793 -> 54 | K793: 12 | L793: 13 | M793: =K793*6+L793 -> 85 | O793: 14 | P793: 18 | Q793: =O793*6+P793 -> 102 | S793: HAYES
A794: BEST PLAYERS
A795: OAKLEIGH | C795: SMITH | F795: WILSON | I795: LAW | L795: CRAMERI | O795: McCRORY | R795: KENNEDY
A796: YARRAVILLE | C796: STREETER | F796: RAWLINGS | I796: O'HALLORAN | L796: SMITH | O796: WEDGWOOD | R796: BOLTON
A797: GOALKICKERS
A798: OAKLEIGH | C798: MCCRORY 7 | F798: CRAMERI 4 | I798: R SMITH 2 | L798: CORP 2 | N798: BEARD
A799: YARRAVILLE | C799: O'HALLORAN 3 | F799: RAWLINGS 2 | I799: TEMPEST 2 | L799: ROBERTSON | N799: WEDGWOOD | Q799: STREETER | T799: McVEIGH | V799: DOHERTY | X799: T SMITH | AA799: TYRELL
A801: ROUND 15 | E801: 3RD AUGUST | J801: WEATHER | M801: CLOUDY MILD NORTH BREEZE | S801: PLAYED AT
D802: 1ST QTR | H802: 2ND QTR | L802: 3RD QTR | P802: FINAL | S802: PRESTON
A803: WILLIAMSTOWN | C803: 2 | D803: 3 | E803: =C803*6+D803 -> 15 | G803: 7 | H803: 7 | I803: =G803*6+H803 -> 49 | K803: 11 | L803: 14 | M803: =K803*6+L803 -> 80 | O803: 16 | P803: 18 | Q803: =O803*6+P803 -> 114 | S803: UMPIRE | X803: LADDER | AB803: ROUND | AD803: 15
A804: PRESTON | C804: 1 | D804: 4 | E804: =C804*6+D804 -> 10 | G804: 4 | H804: 12 | I804: =G804*6+H804 -> 36 | K804: 8 | L804: 17 | M804: =K804*6+L804 -> 65 | O804: 13 | P804: 18 | Q804: =O804*6+P804 -> 96 | S804: HUGHES
A805: BEST PLAYERS | W805: TEAM | X805: W | Y805: L | Z805: D | AA805: FOR | AB805: AGST | AC805: % | AD805: PTS
A806: WILLIAMSTOWN | C806: FITCH | E806: DELLER | H806: NEILL | K806: E RYAN | N806: WILCOX | Q806: TODD
A807: PRESTON | C807: ROSS | E807: A SLEITH | H807: CLARKE | K807: J NORMAN | N807: MORRISON | Q807: DUNSTONE | W807: WILLIAMSTOWN | X807: 13 | Y807: 2 | Z807: 0 | AA807: 1880 | AB807: 1349 | AC807: 139.36249073387694 | AD807: 52
A808: GOALKICKERS | W808: PRESTON | X808: 11 | Y808: 4 | Z808: 0 | AA808: 1567 | AB808: 1418 | AC808: 110.50775740479548 | AD808: 44
A809: WILLIAMSTOWN | C809: VALLENCE 4 | F809: TODD 4 | H809: THOMAS 3 | J809: NEILL 2 | L809: H RYAN | N809: GLASS | P809: JAMIESON | W809: PORT MELBOURNE | X809: 10 | Y809: 5 | Z809: 0 | AA809: 1814 | AB809: 1460 | AC809: 124.24657534246575 | AD809: 40
A810: PRESTON | C810: ROSS 4 | E810: SEEDSMAN 2 | H810: DUNSTONE 2 | K810: COLBAN | M810: MILLER | O810: ROACH | Q810: I NORMAN | W810: PRAHRAN | X810: 10 | Y810: 5 | Z810: 0 | AA810: 1703 | AB810: 1514 | AC810: 112.48348745046235 | AD810: 40
P811: L SLEETH
A812: COBURG | C812: 1 | D812: 11 | E812: =C812*6+D812 -> 17 | G812: 7 | H812: 12 | I812: =G812*6+H812 -> 54 | K812: 11 | L812: 17 | M812: =K812*6+L812 -> 83 | O812: 16 | P812: 19 | Q812: =O812*6+P812 -> 115 | S812: PORT MELBOURNE | W812: BRUNSWICK | X812: 9 | Y812: 6 | Z812: 0 | AA812: 1571 | AB812: 1305 | AC812: 120.38314176245211 | AD812: 36
A813: PORT MELBOURNE | C813: 3 | D813: 2 | E813: =C813*6+D813 -> 20 | G813: 6 | H813: 6 | I813: =G813*6+H813 -> 42 | K813: 9 | L813: 9 | M813: =K813*6+L813 -> 63 | O813: 15 | P813: 13 | Q813: =O813*6+P813 -> 103 | S813: McALPINE | W813: COBURG | X813: 8 | Y813: 6 | Z813: 1 | AA813: 1401 | AB813: 1272 | AC813: 110.14150943396227 | AD813: 34
A814: BEST PLAYERS | W814: NORTHCOTE | X814: 7 | Y814: 7 | Z814: 1 | AA814: 1503 | AB814: 1505 | AC814: 99.867109634551497 | AD814: 30
A815: COBURG | C815: RE | F815: HALL | H815: COLLINS | K815: ANDERSON | N815: MILTE | Q815: PROMNITZ | W815: CAMBERWELL | X815: 6 | Y815: 9 | Z815: 0 | AA815: 1645 | AB815: 1689 | AC815: 97.394908229721736 | AD815: 24
A816: PORT MELBOURNE | C816: GOLDSMITH | F816: GOSS | H816: RICHES | K816: FLETCHER | N816: HURLEY | Q816: LAHIFF | W816: BRIGHTON | X816: 6 | Y816: 9 | Z816: 0 | AA816: 1463 | AB816: 1596 | AC816: 91.666666666666671 | AD816: 24
A817: GOALKICKERS | W817: OAKLEIGH | X817: 4 | Y817: 11 | Z817: 0 | AA817: 1476 | AB817: 1856 | AC817: 79.525862068965523 | AD817: 16
A818: COBURG | C818: COLLINS 5 | F818: ANDERSON 4 | I818: PRATT 3 | K818: BEAGLEY | M818: LONSDALE | P818: McLEY | W818: YARRAVILLE | X818: 4 | Y818: 11 | Z818: 0 | AA818: 1439 | AB818: 1943 | AC818: 74.060730828615547 | AD818: 16
A819: PORT MELBOURNE | C819: LAHIFF 3 | E819: HURLEY 3 | G819: ROBERTSON 2 | J819: HOSKING 2 | M819: RICHES | O819: GOLDSMITH | R819: SINCLAIR | V819: LEE | W819: SANDRINGHAM | X819: 1 | Y819: 14 | Z819: 0 | AA819: 1285 | AB819: 1840 | AC819: 69.836956521739125 | AD819: 4
R820: JONES
A821: PRAHRAN | C821: 7 | D821: 7 | E821: =C821*6+D821 -> 49 | G821: 11 | H821: 10 | I821: =G821*6+H821 -> 76 | K821: 16 | L821: 15 | M821: =K821*6+L821 -> 111 | O821: 23 | P821: 17 | Q821: =O821*6+P821 -> 155 | S821: CAMBERWELL
A822: CAMBERWELL | C822: 1 | D822: 2 | E822: =C822*6+D822 -> 8 | G822: 9 | H822: 8 | I822: =G822*6+H822 -> 62 | K822: 12 | L822: 11 | M822: =K822*6+L822 -> 83 | O822: 14 | P822: 14 | Q822: =O822*6+P822 -> 98 | S822: MERRINGTON
A823: BEST PLAYERS
A824: PRAHRAN | C824: PEARCE | E824: TUCKER | H824: ANDERS | K824: FAUL | N824: BRENCHLEY | Q824: TAYLOR
A825: CAMBERWELL | C825: NASH | E825: ANDERSON | H825: BOND | K825: McKAY | N825: SCALES | Q825: PLANT
A826: GOALKICKERS
A827: PRAHRAN | C827: PEARCE 9 | F827: LYONS 7 | I827: ROLFE 4 | K827: ANDERS 2 | N827: COUPE
A828: CAMBERWELL | C828: NASH 8 | F828: HURLEY 2 | I828: CLEMENTS | L828: WHITEHEAD | O828: BOND | Q828: HOPKINS
A830: BRIGHTON | C830: 7 | D830: 5 | E830: =C830*6+D830 -> 47 | G830: 12 | H830: 12 | I830: =G830*6+H830 -> 84 | K830: 14 | L830: 17 | M830: =K830*6+L830 -> 101 | O830: 17 | P830: 20 | Q830: =O830*6+P830 -> 122 | S830: ELSTERNWICK PARK
A831: OAKLEIGH | C831: 3 | D831: 2 | E831: =C831*6+D831 -> 20 | G831: 5 | H831: 5 | I831: =G831*6+H831 -> 35 | K831: 10 | L831: 7 | M831: =K831*6+L831 -> 67 | O831: 12 | P831: 6 | Q831: =O831*6+P831 -> 78 | S831: GREGORY
A832: BEST PLAYERS
A833: BRIGHTON | C833: DAVIS | F833: MILLER | I833: IVEY | L833: DYER | O833: BROOKS | Q833: HINDSON
A834: OAKLEIGH | C834: KENNEDY | F834: RYAN | I834: WILSON | L834: SMITH | O834: REID | Q834: THOMAS
A835: GOALKICKERS
A836: BRIGHTON | C836: IVEY 6 | F836: MILLER 4 | I836: CONNELL 3 | L836: DAVIS 2 | O836: HENDER | R836: ALVIN
A837: OAKLEIGH | C837: DOWLER 3 | F837: SMITH 2 | I837: LAW 2 | K837: REID 2 | M837: McCRORY 2 | P837: WILSON | R837: CRAMERI
A839: NORTHCOTE | C839: 5 | D839: 10 | E839: =C839*6+D839 -> 40 | G839: 9 | H839: 14 | I839: =G839*6+H839 -> 68 | K839: 12 | L839: 17 | M839: =K839*6+L839 -> 89 | O839: 19 | P839: 24 | Q839: =O839*6+P839 -> 138 | S839: NORTHCOTE
A840: SANDRINGHAM | C840: 4 | D840: 1 | E840: =C840*6+D840 -> 25 | G840: 5 | H840: 6 | I840: =G840*6+H840 -> 36 | K840: 9 | L840: 10 | M840: =K840*6+L840 -> 64 | O840: 11 | P840: 12 | Q840: =O840*6+P840 -> 78 | S840: PARRIS
A841: BEST PLAYERS
A842: NORTHCOTE | C842: HISCOX | E842: WATT | H842: WHITE | K842: DRYDEN | N842: GILMOUR | Q842: MEITZCKE
A843: SANDRINGHAM | C843: WEBER | E843: PETTIONA | H843: MORRIS | K843: STAMMERS | N843: SMAIL | Q843: FOLLETT
A844: GOALKICKERS
A845: NORTHCOTE | C845: WHITE 9 | F845: DRYDEN 3 | I845: HOLDEN 3 | L845: CROSBIE | N845: GILMOUR | Q845: CAHILL | T845: DOWER
A846: SANDRINGHAM | C846: ALLISTER 2 | F846: COPSEY 2 | I846: KENT 2 | L846: RYAN 2 | N846: NOTTLE | Q846: LINDEN | T846: MILLER
A848: BRUNSWICK | C848: 5 | D848: 5 | E848: =C848*6+D848 -> 35 | G848: 5 | H848: 12 | I848: =G848*6+H848 -> 42 | K848: 12 | L848: 18 | M848: =K848*6+L848 -> 90 | O848: 20 | P848: 26 | Q848: =O848*6+P848 -> 146 | S848: YARRAVILLE
A849: YARRAVILLE | C849: 3 | D849: 5 | E849: =C849*6+D849 -> 23 | G849: 6 | H849: 7 | I849: =G849*6+H849 -> 43 | K849: 8 | L849: 7 | M849: =K849*6+L849 -> 55 | O849: 9 | P849: 8 | Q849: =O849*6+P849 -> 62 | S849: GROVES
A850: BEST PLAYERS
A851: BRUNSWICK | C851: FAY | F851: KEMP | I851: CHALLENGER | L851: FOO | N851: CRAWFORD | Q851: McKERNAN
A852: YARRAVILLE | C852: WEDGWOOD | F852: O'HALLORAN | I852: ROBERTSON | L852: ALSOP | N852: PLUMMER | Q852: McVEIGH
A853: GOALKICKERS
A854: BRUNSWICK | C854: CRAWFORD 5 | F854: COOPER 4 | I854: GARDNER 2 | L854: BOYD 2 | N854: QUINN 2 | P854: CRISP 2 | R854: McELROY | U854: JEFFREY | X854: KEATING
A855: YARRAVILLE | C855: ALSOP 5 | F855: O'HALLORAN 2 | J855: BOLTON | M855: BROADWAY
A857: ROUND 16 | E857: 10TH AUGUST | J857: WEATHER | M857: FINE SOUTH WIND | S857: PLAYED AT
D858: 1ST QTR | H858: 2ND QTR | L858: 3RD QTR | P858: FINAL | S858: COBURG
A859: COBURG | C859: 7 | D859: 4 | E859: =C859*6+D859 -> 46 | G859: 8 | H859: 6 | I859: =G859*6+H859 -> 54 | K859: 11 | L859: 10 | M859: =K859*6+L859 -> 76 | O859: 13 | P859: 12 | Q859: =O859*6+P859 -> 90 | S859: UMPIRE | X859: LADDER | AB859: ROUND | AD859: 16
A860: PRESTON | C860: 2 | D860: 0 | E860: =C860*6+D860 -> 12 | G860: 4 | H860: 6 | I860: =G860*6+H860 -> 30 | K860: 7 | L860: 7 | M860: =K860*6+L860 -> 49 | O860: 13 | P860: 9 | Q860: =O860*6+P860 -> 87 | S860: McALPINE
A861: BEST PLAYERS | W861: TEAM | X861: W | Y861: L | Z861: D | AA861: FOR | AB861: AGST | AC861: % | AD861: PTS
A862: COBURG | C862: COLLINS | F862: McILVENE | I862: RE | K862: ATKINSON | N862: MUNDAY | Q862: MILTE
A863: PRESTON | C863: ROSS | F863: DUNSTONE | I863: CALVERT | K863: GRAY | N863: A SLEITH | Q863: MILLER | W863: WILLIAMSTOWN | X863: 14 | Y863: 2 | Z863: 0 | AA863: 1990 | AB863: 1423 | AC863: 139.8453970484891 | AD863: 56
A864: GOALKICKERS | W864: PORT MELBOURNE | X864: 11 | Y864: 5 | Z864: 0 | AA864: 1933 | AB864: 1554 | AC864: 124.38867438867439 | AD864: 44
A865: COBURG | C865: COLLINS 4 | F865: MUNDAY 3 | I865: PRATT 2 | K865: BROWN 2 | N865: McLEY | Q865: BEAGLEY | W865: PRAHRAN | X865: 11 | Y865: 5 | Z865: 0 | AA865: 1833 | AB865: 1606 | AC865: 114.13449564134496 | AD865: 44
A866: PRESTON | C866: MORRISON 4 | F866: ROSS 3 | I866: MILLER 2 | K866: DUNSTONE 2 | N866: CALVERT | Q866: NORMAN | W866: PRESTON | X866: 11 | Y866: 5 | Z866: 0 | AA866: 1654 | AB866: 1508 | AC866: 109.68169761273209 | AD866: 44
A868: WILLIAMSTOWN | C868: 4 | D868: 7 | E868: =C868*6+D868 -> 31 | G868: 7 | H868: 12 | I868: =G868*6+H868 -> 54 | K868: 9 | L868: 16 | M868: =K868*6+L868 -> 70 | O868: 15 | P868: 20 | Q868: =O868*6+P868 -> 110 | S868: WILLIAMSTOWN | W868: BRUNSWICK | X868: 10 | Y868: 6 | Z868: 0 | AA868: 1659 | AB868: 1374 | AC868: 120.74235807860262 | AD868: 40
A869: NORTHCOTE | C869: 4 | D869: 3 | E869: =C869*6+D869 -> 27 | G869: 6 | H869: 8 | I869: =G869*6+H869 -> 44 | K869: 9 | L869: 12 | M869: =K869*6+L869 -> 66 | O869: 10 | P869: 14 | Q869: =O869*6+P869 -> 74 | S869: MERRINGTON | W869: COBURG | X869: 9 | Y869: 6 | Z869: 1 | AA869: 1491 | AB869: 1359 | AC869: 109.71302428256071 | AD869: 38
A870: BEST PLAYERS | W870: NORTHCOTE | X870: 7 | Y870: 8 | Z870: 1 | AA870: 1577 | AB870: 1615 | AC870: 97.647058823529406 | AD870: 30
A871: WILLIAMSTOWN | C871: THOMAS | F871: NEILL | I871: OGDEN | L871: DELLER | N871: TODD | Q871: MENZIES | W871: CAMBERWELL | X871: 6 | Y871: 10 | Z871: 0 | AA871: 1762 | AB871: 1828 | AC871: 96.389496717724285 | AD871: 24
A872: NORTHCOTE | C872: CROSBIE | F872: VENNING | I872: E HART | L872: DRYDEN | N872: E BRETHERTON | Q872: WHITE | W872: BRIGHTON | X872: 6 | Y872: 10 | Z872: 0 | AA872: 1532 | AB872: 1684 | AC872: 90.973871733966746 | AD872: 24
A873: GOALKICKERS | W873: YARRAVILLE | X873: 5 | Y873: 11 | Z873: 0 | AA873: 1578 | AB873: 2060 | AC873: 76.601941747572809 | AD873: 20
A874: WILLIAMSTOWN | C874: TODD 5 | E874: VALLENCE 2 | H874: FITCH 2 | J874: NEILL 2 | L874: CAVE | N874: JAMIESON | Q874: H RYAN | V874: THOMAS | W874: OAKLEIGH | X874: 4 | Y874: 12 | Z874: 0 | AA874: 1570 | AB874: 1975 | AC874: 79.493670886075947 | AD874: 16
A875: NORTHCOTE | C875: WHITE 3 | E875: HISCOX 2 | H875: DRYDEN 2 | J875: HENDRIE 2 | M875: HOLDEN | W875: SANDRINGHAM | X875: 1 | Y875: 15 | Z875: 0 | AA875: 1377 | AB875: 1970 | AC875: 69.898477157360404 | AD875: 4
A877: BRUNSWICK | C877: 2 | D877: 5 | E877: =C877*6+D877 -> 17 | G877: 5 | H877: 7 | I877: =G877*6+H877 -> 37 | K877: 7 | L877: 14 | M877: =K877*6+L877 -> 56 | O877: 11 | P877: 22 | Q877: =O877*6+P877 -> 88 | S877: BRUNSWICK
A878: BRIGHTON | C878: 3 | D878: 1 | E878: =C878*6+D878 -> 19 | G878: 6 | H878: 4 | I878: =G878*6+H878 -> 40 | K878: 9 | L878: 6 | M878: =K878*6+L878 -> 60 | O878: 10 | P878: 9 | Q878: =O878*6+P878 -> 69 | S878: PARRIS
A879: BEST PLAYERS
A880: BRUNSWICK | C880: CRAWFORD | F880: KEMP | I880: FAY | L880: JEFFREY | O880: McKERNAN | R880: McELROY
A881: BRIGHTON | C881: MCINERNEY | F881: BROOKS | I881: HALLAHAN | L881: MILLER | O881: WEBER | R881: GEORGE
A882: GOALKICKERS
A883: BRUNSWICK | C883: DOWLING 3 | F883: BOYD 2 | I883: McELROY 2 | L883: CRAWFORD 2 | O883: CRISP | Q883: JEFFREY
A884: BRIGHTON | C884: HALLAHAN 2 | F884: CONNELL 2 | I884: DAVIS | K884: MILLER | M884: ALVIN | O884: McINERNEY | R884: WEBER | U884: IVEY
A886: YARRAVILLE | C886: 8 | D886: 4 | E886: =C886*6+D886 -> 52 | G886: 10 | H886: 6 | I886: =G886*6+H886 -> 66 | K886: 16 | L886: 15 | M886: =K886*6+L886 -> 111 | O886: 20 | P886: 19 | Q886: =O886*6+P886 -> 139 | S886: YARRAVILLE
A887: CAMBERWELL | C887: 3 | D887: 6 | E887: =C887*6+D887 -> 24 | G887: 12 | H887: 9 | I887: =G887*6+H887 -> 81 | K887: 14 | L887: 10 | M887: =K887*6+L887 -> 94 | O887: 17 | P887: 15 | Q887: =O887*6+P887 -> 117 | S887: HAYES
A888: BEST PLAYERS
A889: YARRAVILLE | C889: O'HALLORAN | F889: WEDGWOOD | I889: T SMITH | L889: HOPKINS | O889: PERUSSICH | R889: ROBERTSON
A890: CAMBERWELL | C890: SPEARS | F890: OLIVER | I890: HENDERSON | L890: ANDERSON | O890: ROWE | R890: BOND
A891: GOALKICKERS
A892: YARRAVILLE | C892: WEDGWOOD 5 | F892: O'HALLORAN 4 | I892: PERUSSICH 4 | L892: ROBERTSON 2 | O892: BROADWAY | R892: H SMITH | U892: NEIL | W892: RAWLINGS | X892: HOPKINS | AA892: BEVAN
A893: CAMBERWELL | C893: OLIVER 4 | E893: WHITEHEAD 3 | H893: BOND 3 | J893: CLEMENTS | M893: FINN | N893: McDAVITT | Q893: ROGERS | S893: HOPKINS
A895: PORT MELBOURNE | C895: 4 | D895: 7 | E895: =C895*6+D895 -> 31 | G895: 7 | H895: 11 | I895: =G895*6+H895 -> 53 | K895: 13 | L895: 16 | M895: =K895*6+L895 -> 94 | O895: 16 | P895: 23 | Q895: =O895*6+P895 -> 119 | S895: OAKLEIGH
A896: OAKLEIGH | C896: 1 | D896: 1 | E896: =C896*6+D896 -> 7 | G896: 9 | H896: 6 | I896: =G896*6+H896 -> 60 | K896: 11 | L896: 6 | M896: =K896*6+L896 -> 72 | O896: 14 | P896: 10 | Q896: =O896*6+P896 -> 94 | S896: McNAMARA
A897: BEST PLAYERS
A898: PORT MELBOURNE | C898: HURLEY | E898: LAHIFF | H898: ALSOP | K898: RICHES | N898: GOLDSMITH | Q898: TANNER
A899: OAKLEIGH | C899: REID | E899: WILSON | H899: RYAN | K899: SMITH | N899: TOWNSEND | Q899: CORP
A900: GOALKICKERS
A901: PORT MELBOURNE | C901: HURLEY 5 | F901: LAHIFF 3 | I901: LEE 2 | K901: ALLEN 2 | M901: ALSOP 2 | O901: FLETCHER | Q901: HOSKING
A902: OAKLEIGH | C902: CORP 4 | F902: DOWLER 3 | I902: McCRORY 2 | L902: CRAMERI 2 | O902: SMITH | Q902: HOLT | S902: KENNEDY
A904: PRAHRAN | C904: 3 | D904: 2 | E904: =C904*6+D904 -> 20 | G904: 11 | H904: 7 | I904: =G904*6+H904 -> 73 | K904: 12 | L904: 12 | M904: =K904*6+L904 -> 84 | O904: 19 | P904: 16 | Q904: =O904*6+P904 -> 130 | S904: BEACH ROAD
A905: SANDRINGHAM | C905: 2 | D905: 5 | E905: =C905*6+D905 -> 17 | G905: 4 | H905: 8 | I905: =G905*6+H905 -> 32 | K905: 9 | L905: 12 | M905: =K905*6+L905 -> 66 | O905: 13 | P905: 14 | Q905: =O905*6+P905 -> 92 | S905: MANCHESTER
A906: BEST PLAYERS
A907: PRAHRAN | C907: BRENCHLEY | F907: WHITEHEAD | I907: PEARCE | L907: GRAVELL | O907: PROBYN | Q907: LYONS
A908: SANDRINGHAM | C908: WEBER | F908: KENT | I908: PETTIONA | L908: MORRIS | O908: EVANS | Q908: RYAN
A909: GOALKICKERS
A910: PRAHRAN | C910: LYONS 11 | F910: ROLFE 3 | I910: PEARCE 2 | K910: PROBYN | M910: GRAVELL | O910: WHITE
A911: SANDRINGHAM | C911: ALLISTER 4 | F911: NOTTLE 2 | I911: SCOTT 2 | K911: FLEGG 2 | M911: CHILDS | O911: RYAN | Q911: TAYLOR
A913: ROUND 17 | E913: 17TH AUGUST | H913: WEATHER | K913: FINE SOUTH BREEZE GROUNDS POOR | S913: PLAYED AT
D914: 1ST QTR | H914: 2ND QTR | L914: 3RD QTR | P914: FINAL | S914: TOORAK PARK
A915: PRAHRAN | C915: 2 | D915: 3 | E915: =C915*6+D915 -> 15 | G915: 5 | H915: 5 | I915: =G915*6+H915 -> 35 | K915: 9 | L915: 8 | M915: =K915*6+L915 -> 62 | O915: 13 | P915: 14 | Q915: =O915*6+P915 -> 92 | S915: UMPIRE | X915: LADDER | AB915: ROUND | AD915: 17
A916: WILLIAMSTOWN | C916: 3 | D916: 9 | E916: =C916*6+D916 -> 27 | G916: 4 | H916: 13 | I916: =G916*6+H916 -> 37 | K916: 6 | L916: 15 | M916: =K916*6+L916 -> 51 | O916: 7 | P916: 20 | Q916: =O916*6+P916 -> 62 | S916: PARRIS
A917: BEST PLAYERS | W917: TEAM | X917: W | Y917: L | Z917: D | AA917: FOR | AB917: AGST | AC917: % | AD917: PTS
A918: PRAHRAN | C918: O'DONNELL | F918: DAVEY | I918: FAUL | K918: WHITE | N918: THOMPSON | Q918: TAYLOR
A919: WILLIAMSTOWN | C919: DELLER | F919: McDONOUGH | I919: E RYAN | K919: FITCH | N919: TODD | Q919: THOMAS | W919: WILLIAMSTOWN | X919: 14 | Y919: 3 | Z919: 0 | AA919: 2052 | AB919: 1515 | AC919: 135.44554455445544 | AD919: 56
A920: GOALKICKERS | W920: PORT MELBOURNE | X920: 12 | Y920: 5 | Z920: 0 | AA920: 2065 | AB920: 1648 | AC920: 125.30339805825243 | AD920: 48
A921: PRAHRAN | C921: LYONS 3 | F921: PEARCE 3 | I921: O'DONNELL 2 | L921: WHITE 2 | N921: WILLIAMS | Q921: DAVEY | S921: ANDERS | W921: PRAHRAN | X921: 12 | Y921: 5 | Z921: 0 | AA921: 1925 | AB921: 1668 | AC921: 115.40767386091127 | AD921: 48
A922: WILLIAMSTOWN | C922: VALLENCE 4 | F922: TODD | I922: FITCH | L922: THOMAS | W922: PRESTON | X922: 12 | Y922: 5 | Z922: 0 | AA922: 1758 | AB922: 1588 | AC922: 110.70528967254408 | AD922: 48
A924: PORT MELBOURNE | C924: 4 | D924: 5 | E924: =C924*6+D924 -> 29 | G924: 9 | H924: 12 | I924: =G924*6+H924 -> 66 | K924: 13 | L924: 14 | M924: =K924*6+L924 -> 92 | O924: 19 | P924: 18 | Q924: =O924*6+P924 -> 132 | S924: PORT MELBOURNE | W924: COBURG | X924: 10 | Y924: 6 | Z924: 1 | AA924: 1625 | AB924: 1445 | AC924: 112.45674740484429 | AD924: 42
A925: BRUNSWICK | C925: 6 | D925: 2 | E925: =C925*6+D925 -> 38 | G925: 8 | H925: 2 | I925: =G925*6+H925 -> 50 | K925: 11 | L925: 8 | M925: =K925*6+L925 -> 74 | O925: 14 | P925: 10 | Q925: =O925*6+P925 -> 94 | S925: McALPINE | W925: BRUNSWICK | X925: 10 | Y925: 7 | Z925: 0 | AA925: 1753 | AB925: 1506 | AC925: 116.40106241699867 | AD925: 40
A926: BEST PLAYERS | W926: NORTHCOTE | X926: 7 | Y926: 9 | Z926: 1 | AA926: 1663 | AB926: 1749 | AC926: 95.082904516866776 | AD926: 30
A927: PORT MELBOURNE | C927: REYNOLDS | F927: GOLDSMITH | I927: ALSOP | K927: DOBSON | N927: HAYES | Q927: ALLEN | W927: CAMBERWELL | X927: 7 | Y927: 10 | Z927: 0 | AA927: 1908 | AB927: 1928 | AC927: 98.962655601659748 | AD927: 28
A928: BRUNSWICK | C928: CRAWFORD | F928: STANDFIELD | I928: McKAY | K928: HOBBA | N928: McELROY | Q928: FOO | W928: BRIGHTON | X928: 7 | Y928: 10 | Z928: 0 | AA928: 1684 | AB928: 1766 | AC928: 95.35673839184598 | AD928: 28
A929: GOALKICKERS | W929: YARRAVILLE | X929: 5 | Y929: 12 | Z929: 0 | AA929: 1660 | AB929: 2212 | AC929: 75.045207956600365 | AD929: 20
A930: PORT MELBOURNE | C930: FREYER 7 | F930: ROBERTSON 5 | I930: ALLEN 3 | K930: REYNOLDS 2 | N930: HURLEY | P930: LEE | W930: OAKLEIGH | X930: 4 | Y930: 13 | Z930: 0 | AA930: 1650 | AB930: 2079 | AC930: 79.365079365079367 | AD930: 16
A931: BRUNSWICK | C931: CRAWFORD 4 | F931: McKAY 3 | I931: POWELL 2 | K931: DOWLING 2 | N931: CRISP | P931: McELROY | R931: QUINN | W931: SANDRINGHAM | X931: 1 | Y931: 16 | Z931: 0 | AA931: 1477 | AB931: 2116 | AC931: 69.801512287334589 | AD931: 4
A933: COBURG | C933: 4 | D933: 5 | E933: =C933*6+D933 -> 29 | G933: 10 | H933: 10 | I933: =G933*6+H933 -> 70 | K933: 14 | L933: 16 | M933: =K933*6+L933 -> 100 | O933: 19 | P933: 20 | Q933: =O933*6+P933 -> 134 | S933: NORTHCOTE
A934: NORTHCOTE | C934: 3 | D934: 4 | E934: =C934*6+D934 -> 22 | G934: 6 | H934: 6 | I934: =G934*6+H934 -> 42 | K934: 10 | L934: 11 | M934: =K934*6+L934 -> 71 | O934: 12 | P934: 14 | Q934: =O934*6+P934 -> 86 | S934: MERRINGTON
A935: BEST PLAYERS
A936: COBURG | C936: BEAGLEY | F936: JORDAN | I936: McLEY | K936: PROMNITZ | N936: MUNDAY | Q936: MURRAY
A937: NORTHCOTE | C937: E BRETHERTON | F937: HOLDEN | I937: HISCOX | K937: CROSBIE | N937: DRYDEN | Q937: WATT
A938: GOALKICKERS
A939: COBURG | C939: PRATT 6 | F939: COLLINS 3 | I939: McLEY 3 | K939: ANDERSON 3 | N939: BEAGLEY 3 | Q939: BROWN
A940: NORTHCOTE | C940: WHITE 4 | F940: HOLDEN 3 | I940: CAHILL 2 | K940: DRYDEN | M940: HENDRIE | O940: HISCOX
A942: BRIGHTON | C942: 5 | D942: 3 | E942: =C942*6+D942 -> 33 | G942: 11 | H942: 10 | I942: =G942*6+H942 -> 76 | K942: 14 | L942: 14 | M942: =K942*6+L942 -> 98 | O942: 22 | P942: 20 | Q942: =O942*6+P942 -> 152 | S942: ELSTERNWICK PARK
A943: YARRAVILLE | C943: 4 | D943: 2 | E943: =C943*6+D943 -> 26 | G943: 9 | H943: 3 | I943: =G943*6+H943 -> 57 | K943: 11 | L943: 6 | M943: =K943*6+L943 -> 72 | O943: 12 | P943: 10 | Q943: =O943*6+P943 -> 82 | S943: HUGHES
A944: BEST PLAYERS
A945: BRIGHTON | C945: SCOTT | F945: CONNELL | I945: WEBER | L945: HINDSON | O945: BUCKLEY | Q945: KING
A946: YARRAVILLE | C946: ROBERTSON | F946: GARLICK | I946: HOPKINS | L946: PLUMMER | O946: JONES | Q946: O'HALLORAN
A947: GOALKICKERS
A948: BRIGHTON | C948: CONNELL 9 | F948: DAVIS 4 | H948: KING 3 | J948: BUCKLEY 2 | M948: McINERNEY 2 | P948: ALVIN | R948: WEBER
A949: YARRAVILLE | C949: O'HALLORAN 5 | F949: DOHERTY 2 | I949: ROBERTSON 2 | L949: TEMPEST | N949: BEVAN | P949: PERUSSICH
A951: CAMBERWELL | C951: 4 | D951: 3 | E951: =C951*6+D951 -> 27 | G951: 11 | H951: 6 | I951: =G951*6+H951 -> 72 | K951: 19 | L951: 10 | M951: =K951*6+L951 -> 124 | O951: 22 | P951: 14 | Q951: =O951*6+P951 -> 146 | S951: CAMBERWELL
A952: SANDRINGHAM | C952: 3 | D952: 5 | E952: =C952*6+D952 -> 23 | G952: 7 | H952: 10 | I952: =G952*6+H952 -> 52 | K952: 8 | L952: 11 | M952: =K952*6+L952 -> 59 | O952: 14 | P952: 16 | Q952: =O952*6+P952 -> 100 | S952: GREGORY
A953: BEST PLAYERS
A954: CAMBERWELL | C954: NASH | E954: FINN | H954: HENDERSON | K954: McKAY | N954: BOND | Q954: CLEMENTS
A955: SANDRINGHAM | C955: FLEGG | E955: WEBER | H955: MILLER | K955: KENT | N955: TAYLOR | Q955: LINDEN
A956: GOALKICKERS
A957: CAMBERWELL | C957: NASH 8 | E957: HARLEY 4 | H957: CLEMENTS 3 | K957: OLIVER 2 | M957: WHITEHEAD 2 | P957: HOPKINS | R957: BOND | T957: FINN
A958: SANDRINGHAM | C958: FLEGG 6 | E958: TAYLOR 2 | H958: ALLISTER 2 | K958: RYAN | M958: LINDEN | O958: KENT | Q958: AMINDE
A960: PRESTON | C960: 2 | D960: 11 | E960: =C960*6+D960 -> 23 | G960: 6 | H960: 13 | I960: =G960*6+H960 -> 49 | K960: 11 | L960: 24 | M960: =K960*6+L960 -> 90 | O960: 13 | P960: 26 | Q960: =O960*6+P960 -> 104 | S960: PRESTON
A961: OAKLEIGH | C961: 1 | D961: 3 | E961: =C961*6+D961 -> 9 | G961: 6 | H961: 7 | I961: =G961*6+H961 -> 43 | K961: 7 | L961: 8 | M961: =K961*6+L961 -> 50 | O961: 11 | P961: 14 | Q961: =O961*6+P961 -> 80 | S961: HAYES
A962: BEST PLAYERS
A963: PRESTON | C963: MORRISON | F963: CALVERT | I963: DOWLING | L963: GRAY | O963: DUNHAM | Q963: DUNSTONE
A964: OAKLEIGH | C964: WILSON | F964: RYAN | I964: CLARKE | L964: LANNING | O964: SMITH | Q964: KENNEDY
A965: GOALKICKERS
A966: PRESTON | C966: DUNSTONE 4 | F966: MILLER 3 | I966: TAYLOR 2 | L966: MORRISON | N966: ROSS | P966: CALVERT | R966: ROACH
A967: OAKLEIGH | C967: DOWLER 3 | F967: CLARKE 2 | I967: McCRORY 2 | L967: KENNEDY | N967: SMITH | P967: BEARD | R967: CORP
A969: ROUND 18 | E969: 24TH AUGUST | J969: WEATHER | M969: FINE MILD | S969: PLAYED AT
D970: 1ST QTR | H970: 2ND QTR | L970: 3RD QTR | P970: FINAL | S970: COBURG
A971: WILLIAMSTOWN | C971: 3 | D971: 3 | E971: =C971*6+D971 -> 21 | G971: 11 | H971: 7 | I971: =G971*6+H971 -> 73 | K971: 13 | L971: 8 | M971: =K971*6+L971 -> 86 | O971: 16 | P971: 12 | Q971: =O971*6+P971 -> 108 | S971: UMPIRE | X971: LADDER | AB971: ROUND | AD971: 18
A972: COBURG | C972: 4 | D972: 2 | E972: =C972*6+D972 -> 26 | G972: 8 | H972: 3 | I972: =G972*6+H972 -> 51 | K972: 12 | L972: 8 | M972: =K972*6+L972 -> 80 | O972: 15 | P972: 9 | Q972: =O972*6+P972 -> 99 | S972: HUGHES
A973: BEST PLAYERS | W973: TEAM | X973: W | Y973: L | Z973: D | AA973: FOR | AB973: AGST | AC973: % | AD973: PTS
A974: WILLIAMSTOWN | C974: TODD | E974: WILCOX | H974: THOMAS | K974: GLASS | N974: E RYAN | Q974: MENZIES
A975: COBURG | C975: MUNDAY | E975: ATKINSON | H975: PROMNITZ | K975: McLEY | N975: JORDAN | Q975: COLLINS | W975: WILLIAMSTOWN | X975: 15 | Y975: 3 | Z975: 0 | AA975: 2160 | AB975: 1614 | AC975: 133.82899628252787 | AD975: 60
A976: GOALKICKERS | W976: PORT MELBOURNE | X976: 13 | Y976: 5 | Z976: 0 | AA976: 2194 | AB976: 1775 | AC976: 123.6056338028169 | AD976: 52
A977: WILLIAMSTOWN | C977: TODD 7 | E977: THOMAS 6 | H977: VALLENCE 2 | K977: NEILL | W977: PRESTON | X977: 13 | Y977: 5 | Z977: 0 | AA977: 1902 | AB977: 1719 | AC977: 110.6457242582897 | AD977: 52
A978: COBURG | C978: MUNDAY 5 | F978: ANDERSON 3 | I978: BEAGLEY 2 | L978: COLLINS | N978: McLEY | P978: LONSDALE | R978: PRATT | T978: MILTE | W978: PRAHRAN | X978: 12 | Y978: 6 | Z978: 0 | AA978: 1997 | AB978: 1766 | AC978: 113.08040770101925 | AD978: 48
A980: BRUNSWICK | C980: 2 | D980: 3 | E980: =C980*6+D980 -> 15 | G980: 7 | H980: 7 | I980: =G980*6+H980 -> 49 | K980: 9 | L980: 10 | M980: =K980*6+L980 -> 64 | O980: 14 | P980: 14 | Q980: =O980*6+P980 -> 98 | S980: BRUNSWICK | W980: BRUNSWICK | X980: 11 | Y980: 7 | Z980: 0 | AA980: 1851 | AB980: 1578 | AC980: 117.30038022813689 | AD980: 44
A981: PRAHRAN | C981: 4 | D981: 3 | E981: =C981*6+D981 -> 27 | G981: 4 | H981: 5 | I981: =G981*6+H981 -> 29 | K981: 8 | L981: 8 | M981: =K981*6+L981 -> 56 | O981: 10 | P981: 12 | Q981: =O981*6+P981 -> 72 | S981: GROVES | W981: COBURG | X981: 10 | Y981: 7 | Z981: 1 | AA981: 1724 | AB981: 1553 | AC981: 111.01094655505473 | AD981: 42
A982: BEST PLAYERS | W982: NORTHCOTE | X982: 7 | Y982: 10 | Z982: 1 | AA982: 1739 | AB982: 1865 | AC982: 93.243967828418235 | AD982: 30
A983: BRUNSWICK | C983: FAY | E983: CHALLENGER | H983: CRAWFORD | K983: CLARKE | N983: POWELL | Q983: JEFFREY | W983: CAMBERWELL | X983: 7 | Y983: 11 | Z983: 0 | AA983: 2035 | AB983: 2057 | AC983: 98.930481283422466 | AD983: 28
A984: PRAHRAN | C984: WHITE | E984: DAVEY | H984: FAUL | K984: WHITEHEAD | N984: JOHNSON | Q984: WILLIAMS | W984: BRIGHTON | X984: 7 | Y984: 11 | Z984: 0 | AA984: 1815 | AB984: 1910 | AC984: 95.026178010471199 | AD984: 28
A985: GOALKICKERS | W985: YARRAVILLE | X985: 6 | Y985: 12 | Z985: 0 | AA985: 1776 | AB985: 2288 | AC985: 77.622377622377627 | AD985: 24
A986: BRUNSWICK | C986: CRISP 3 | E986: CLARKE 2 | G986: CRAWFORD 2 | J986: McKAY 2 | L986: JEFFREY 2 | N986: KEMP | P986: GARDNER | R986: BAILEY | W986: OAKLEIGH | X986: 5 | Y986: 13 | Z986: 0 | AA986: 1748 | AB986: 2153 | AC986: 81.189038550859266 | AD986: 20
A987: PRAHRAN | C987: DAVEY 3 | E987: LYONS 2 | G987: ROLFE | I987: O'DONNELL | L987: PEARCE | N987: WHITE | P987: WILLIAMS | W987: SANDRINGHAM | X987: 1 | Y987: 17 | Z987: 0 | AA987: 1551 | AB987: 2214 | AC987: 70.054200542005418 | AD987: 4
A989: PORT MELBOURNE | C989: 5 | D989: 10 | E989: =C989*6+D989 -> 40 | G989: 10 | H989: 20 | I989: =G989*6+H989 -> 80 | K989: 12 | L989: 21 | M989: =K989*6+L989 -> 93 | O989: 16 | P989: 33 | Q989: =O989*6+P989 -> 129 | S989: PORT MELBOURNE
A990: CAMBERWELL | C990: 2 | D990: 3 | E990: =C990*6+D990 -> 15 | G990: 2 | H990: 8 | I990: =G990*6+H990 -> 20 | K990: 9 | L990: 15 | M990: =K990*6+L990 -> 69 | O990: 18 | P990: 19 | Q990: =O990*6+P990 -> 127 | S990: PARRIS
A991: BEST PLAYERS
A992: PORT MELBOURNE | C992: ALLEN | F992: LAHIFF | I992: CASTLES | L992: FREYER | N992: JULIER | Q992: ONLEY
A993: CAMBERWELL | C993: HENDERSON | F993: HOPKINS | I993: HARLEY | L993: CLAMP | N993: McKAY | Q993: SCALES
A994: GOALKICKERS
A995: PORT MELBOURNE | C995: FREYER 9 | F995: HURLEY 2 | I995: LAHIFF 2 | L995: ROBERTSON 2 | O995: ALLEN
A996: CAMBERWELL | C996: HARLEY 5 | F996: IRELAND 2 | I996: DINSDALE 2 | L996: OLIVER 2 | N996: CLAMP | P996: WHITEHEAD
A998: OAKLEIGH | C998: 6 | D998: 4 | E998: =C998*6+D998 -> 40 | G998: 6 | H998: 9 | I998: =G998*6+H998 -> 45 | K998: 13 | L998: 12 | M998: =K998*6+L998 -> 90 | O998: 14 | P998: 14 | Q998: =O998*6+P998 -> 98 | S998: OAKLEIGH
A999: SANDRINGHAM | C999: 2 | D999: 1 | E999: =C999*6+D999 -> 13 | G999: 4 | H999: 8 | I999: =G999*6+H999 -> 32 | K999: 6 | L999: 10 | M999: =K999*6+L999 -> 46 | O999: 10 | P999: 14 | Q999: =O999*6+P999 -> 74 | S999: McNAMARA
A1000: BEST PLAYERS
A1001: OAKLEIGH | C1001: BEARD | E1001: BICKERTON | H1001: WEISS | K1001: CORP | N1001: DOWLER | Q1001: O'DONOGHUE
A1002: SANDRINGHAM | C1002: SMAIL | E1002: AMINDE | H1002: WEBER | K1002: FLEGG | N1002: FOLLETT | Q1002: LINDEN
A1003: GOALKICKERS
A1004: OAKLEIGH | C1004: DOWLER 6 | F1004: CORP 3 | H1004: McCRORY 2 | K1004: CRAMERI | M1004: WHITE | O1004: CLARKE
A1005: SANDRINGHAM | C1005: FLEGG 3 | F1005: ALLISTER 3 | I1005: EVANS | K1005: AMINDE | M1005: CHILDS | O1005: POND
A1007: YARRAVILLE | C1007: 5 | D1007: 5 | E1007: =C1007*6+D1007 -> 35 | G1007: 8 | H1007: 9 | I1007: =G1007*6+H1007 -> 57 | K1007: 11 | L1007: 11 | M1007: =K1007*6+L1007 -> 77 | O1007: 16 | P1007: 20 | Q1007: =O1007*6+P1007 -> 116 | S1007: YARRAVILLE
A1008: NORTHCOTE | C1008: 3 | D1008: 2 | E1008: =C1008*6+D1008 -> 20 | G1008: 3 | H1008: 6 | I1008: =G1008*6+H1008 -> 24 | K1008: 8 | L1008: 11 | M1008: =K1008*6+L1008 -> 59 | O1008: 10 | P1008: 16 | Q1008: =O1008*6+P1008 -> 76 | S1008: HAYES
A1009: BEST PLAYERS
A1010: YARRAVILLE | C1010: O'HALLORAN | F1010: STREETER | I1010: KENNY | M1010: ALSOP | P1010: McVEIGH | S1010: BARROW
A1011: NORTHCOTE | C1011: VENNING | F1011: McINTOSH | I1011: E BRETHERTON | M1011: D BRETHERTON | P1011: DOWER | S1011: HISCOX
A1012: GOALKICKERS
A1013: YARRAVILLE | C1013: ALSOP 6 | E1013: STREETER 3 | H1013: ROBERTSON 2 | K1013: NEIL | L1013: McVEIGH | N1013: BEVAN | P1013: RAWLINGS | R1013: O'HALLORAN
A1014: NORTHCOTE | C1014: KINGSTON 3 | F1014: HISCOX 2 | I1014: CAHILL | K1014: DOWER | M1014: HOLDEN | O1014: DRYDEN | Q1014: McINTOSH
A1016: PRESTON | C1016: 6 | D1016: 5 | E1016: =C1016*6+D1016 -> 41 | G1016: 12 | H1016: 9 | I1016: =G1016*6+H1016 -> 81 | K1016: 15 | L1016: 14 | M1016: =K1016*6+L1016 -> 104 | O1016: 21 | P1016: 18 | Q1016: =O1016*6+P1016 -> 144 | S1016: ELSTERNWICK PARK
A1017: BRIGHTON | C1017: 6 | D1017: 4 | E1017: =C1017*6+D1017 -> 40 | G1017: 12 | H1017: 7 | I1017: =G1017*6+H1017 -> 79 | K1017: 17 | L1017: 13 | M1017: =K1017*6+L1017 -> 115 | O1017: 19 | P1017: 17 | Q1017: =O1017*6+P1017 -> 131 | S1017: McALPINE
A1018: BEST PLAYERS
A1019: PRESTON | C1019: MORRISON | F1019: CLARKE | I1019: A SLEITH | L1019: DUNSTONE | O1019: MINNEY | R1019: NORMAN
A1020: BRIGHTON | C1020: MILLER | F1020: WEBER | I1020: KING | L1020: SCOTT | O1020: WILLIAMSON | R1020: RECHTER
A1021: GOALKICKERS
A1022: PRESTON | C1022: MORRISON 9 | F1022: MILLER 3 | I1022: DUNSTONE 2 | L1022: CALVERT 2 | N1022: BROWN 2 | Q1022: TAYLOR | S1022: NORMAN | V1022: L SLEETH
A1023: BRIGHTON | C1023: CONNELL 5 | F1023: KING 4 | I1023: MILLER 3 | L1023: ALVIN 3 | N1023: DAVIS 2 | Q1023: BROOKS | S1023: McINERNEY
A1025: ROUND 19 | E1025: 31ST AUGUST | H1025: WEATHER | K1025: COLD CLOUDY N WIND SOME SHOWERS | S1025: PLAYED AT
D1026: 1ST QTR | H1026: 2ND QTR | L1026: 3RD QTR | P1026: FINAL | S1026: PRESTON
A1027: PORT MELBOURNE | C1027: 7 | D1027: 3 | E1027: =C1027*6+D1027 -> 45 | G1027: 9 | H1027: 6 | I1027: =G1027*6+H1027 -> 60 | K1027: 12 | L1027: 11 | M1027: =K1027*6+L1027 -> 83 | O1027: 14 | P1027: 12 | Q1027: =O1027*6+P1027 -> 96 | S1027: UMPIRE | X1027: LADDER | AB1027: ROUND | AD1027: 19
A1028: PRESTON | C1028: 1 | D1028: 5 | E1028: =C1028*6+D1028 -> 11 | G1028: 7 | H1028: 10 | I1028: =G1028*6+H1028 -> 52 | K1028: 9 | L1028: 12 | M1028: =K1028*6+L1028 -> 66 | O1028: 12 | P1028: 16 | Q1028: =O1028*6+P1028 -> 88 | S1028: GROVES
A1029: BEST PLAYERS | W1029: TEAM | X1029: W | Y1029: L | Z1029: D | AA1029: FOR | AB1029: AGST | AC1029: % | AD1029: PTS
A1030: PORT MELBOURNE | C1030: HOSKING | F1030: HURLEY | I1030: DOBSON | K1030: CASTLES | N1030: ROBERTSON | Q1030: ALLEN
A1031: PRESTON | C1031: ROACH | F1031: ROSS | I1031: WATKINS | K1031: TAYLOR | N1031: A SLEITH | Q1031: MILLER | W1031: WILLIAMSTOWN | X1031: 16 | Y1031: 3 | Z1031: 0 | AA1031: 2308 | AB1031: 1671 | AC1031: 138.1208856971873 | AD1031: 64
A1032: GOALKICKERS | W1032: PORT MELBOURNE | X1032: 14 | Y1032: 5 | Z1032: 0 | AA1032: 2290 | AB1032: 1863 | AC1032: 122.92002147074611 | AD1032: 56
A1033: PORT MELBOURNE | C1033: ROBERTSON 4 | F1033: FREYER 4 | I1033: LAHIFF 2 | K1033: HURLEY | M1033: CASTLES | O1033: LEE | P1033: ALLEN | W1033: PRAHRAN | X1033: 13 | Y1033: 6 | Z1033: 0 | AA1033: 2158 | AB1033: 1838 | AC1033: 117.41022850924918 | AD1033: 52
A1034: PRESTON | C1034: ROACH 5 | F1034: MORRISON 4 | I1034: DOWLING | K1034: MILLER | M1034: BROWN | W1034: PRESTON | X1034: 13 | Y1034: 6 | Z1034: 0 | AA1034: 1990 | AB1034: 1815 | AC1034: 109.64187327823691 | AD1034: 52
A1036: COBURG | C1036: 3 | D1036: 3 | E1036: =C1036*6+D1036 -> 21 | G1036: 10 | H1036: 11 | I1036: =G1036*6+H1036 -> 71 | K1036: 13 | L1036: 13 | M1036: =K1036*6+L1036 -> 91 | O1036: 22 | P1036: 19 | Q1036: =O1036*6+P1036 -> 151 | S1036: COBURG | W1036: BRUNSWICK | X1036: 12 | Y1036: 7 | Z1036: 0 | AA1036: 2005 | AB1036: 1680 | AC1036: 119.3452380952381 | AD1036: 48
A1037: CAMBERWELL | C1037: 5 | D1037: 7 | E1037: =C1037*6+D1037 -> 37 | G1037: 7 | H1037: 7 | I1037: =G1037*6+H1037 -> 49 | K1037: 12 | L1037: 9 | M1037: =K1037*6+L1037 -> 81 | O1037: 14 | P1037: 12 | Q1037: =O1037*6+P1037 -> 96 | S1037: HUGHES | W1037: COBURG | X1037: 11 | Y1037: 7 | Z1037: 1 | AA1037: 1875 | AB1037: 1649 | AC1037: 113.7052759248029 | AD1037: 46
A1038: BEST PLAYERS | W1038: NORTHCOTE | X1038: 8 | Y1038: 10 | Z1038: 1 | AA1038: 1849 | AB1038: 1947 | AC1038: 94.966615305598353 | AD1038: 34
A1039: COBURG | C1039: HALL | E1039: COLLINS | H1039: PROMNITZ | K1039: R ATKINSON | N1039: BROWN | Q1039: MILTE | W1039: CAMBERWELL | X1039: 7 | Y1039: 12 | Z1039: 0 | AA1039: 2131 | AB1039: 2208 | AC1039: 96.512681159420296 | AD1039: 28
A1040: CAMBERWELL | C1040: ROGERS | E1040: BOND | H1040: SEELENMEYER | K1040: QUILL | N1040: ROWE | Q1040: HENDERSON | W1040: BRIGHTON | X1040: 7 | Y1040: 12 | Z1040: 0 | AA1040: 1897 | AB1040: 2020 | AC1040: 93.910891089108915 | AD1040: 28
A1041: GOALKICKERS | W1041: YARRAVILLE | X1041: 6 | Y1041: 13 | Z1041: 0 | AA1041: 1848 | AB1041: 2449 | AC1041: 75.459371171906895 | AD1041: 24
A1042: COBURG | C1042: MUNDAY 5 | F1042: ANDERSON 5 | I1042: BROWN 3 | K1042: MILTE 3 | M1042: COLLINS 3 | O1042: McLEY | Q1042: BEAGLEY | S1042: LONSDALE | W1042: OAKLEIGH | X1042: 5 | Y1042: 14 | Z1042: 0 | AA1042: 1805 | AB1042: 2301 | AC1042: 78.444154715341156 | AD1042: 20
A1043: CAMBERWELL | C1043: NASH 5 | F1043: IRELAND 4 | I1043: HARLEY 3 | K1043: CLAMP | M1043: WHITEHEAD | W1043: SANDRINGHAM | X1043: 1 | Y1043: 18 | Z1043: 0 | AA1043: 1653 | AB1043: 2368 | AC1043: 69.805743243243242 | AD1043: 4
A1045: NORTHCOTE | C1045: 6 | D1045: 2 | E1045: =C1045*6+D1045 -> 38 | G1045: 11 | H1045: 6 | I1045: =G1045*6+H1045 -> 72 | K1045: 14 | L1045: 12 | M1045: =K1045*6+L1045 -> 96 | O1045: 16 | P1045: 14 | Q1045: =O1045*6+P1045 -> 110 | S1045: NORTHCOTE
A1046: BRIGHTON | C1046: 1 | D1046: 7 | E1046: =C1046*6+D1046 -> 13 | G1046: 3 | H1046: 11 | I1046: =G1046*6+H1046 -> 29 | K1046: 5 | L1046: 15 | M1046: =K1046*6+L1046 -> 45 | O1046: 11 | P1046: 16 | Q1046: =O1046*6+P1046 -> 82 | S1046: GEE
A1047: BEST PLAYERS
A1048: NORTHCOTE | C1048: WHITE | E1048: DOWER | H1048: HISCOX | K1048: MEITZCKE | N1048: CAHILL | Q1048: VENNING
A1049: BRIGHTON | C1049: WEBER | E1049: RECHTER | H1049: HALLAHAN | K1049: SPARGO | N1049: DYER | Q1049: MILLER
A1050: GOALKICKERS
A1051: NORTHCOTE | C1051: WHITE 6 | E1051: CAHILL 4 | G1051: McNAMEE 2 | J1051: HISCOX 2 | M1051: MEITZCKE | O1051: HOLDEN
A1052: BRIGHTON | C1052: DAVIS 5 | E1052: KING 2 | G1052: MILLER | J1052: SPARGO | M1052: ALVIN | O1052: MILLER
A1054: PRAHRAN | C1054: 2 | D1054: 5 | E1054: =C1054*6+D1054 -> 17 | G1054: 7 | H1054: 17 | I1054: =G1054*6+H1054 -> 59 | K1054: 10 | L1054: 22 | M1054: =K1054*6+L1054 -> 82 | O1054: 22 | P1054: 29 | Q1054: =O1054*6+P1054 -> 161 | S1054: TOORAK PARK
A1055: YARRAVILLE | C1055: 6 | D1055: 6 | E1055: =C1055*6+D1055 -> 42 | G1055: 7 | H1055: 10 | I1055: =G1055*6+H1055 -> 52 | K1055: 8 | L1055: 14 | M1055: =K1055*6+L1055 -> 62 | O1055: 9 | P1055: 18 | Q1055: =O1055*6+P1055 -> 72 | S1055: HAYES
A1056: BEST PLAYERS
A1057: PRAHRAN | C1057: WHITE | F1057: PEARCE | I1057: FAUL | L1057: DAVEY | O1057: THOMPSON | R1057: BRENCHLEY
A1058: YARRAVILLE | C1058: STREETER | F1058: RAWLINGS | I1058: PLUMMER | L1058: BOLTON | O1058: HOPKINS | R1058: McVEIGH
A1059: GOALKICKERS
A1060: PRAHRAN | C1060: LYONS 5 | E1060: WHITE 4 | G1060: DAVEY 4 | I1060: PEARCE 3 | K1060: ROLFE 3 | M1060: WILLIAMS | O1060: GRAVELL | Q1060: O'DONNELL
A1061: YARRAVILLE | C1061: RAWLINGS 2 | F1061: ALSOP 2 | H1061: ROBERTSON 2 | K1061: KENNY | M1061: HOPKINS | O1061: T SMITH
A1063: BRUNSWICK | C1063: 7 | D1063: 7 | E1063: =C1063*6+D1063 -> 49 | G1063: 10 | H1063: 17 | I1063: =G1063*6+H1063 -> 77 | K1063: 19 | L1063: 26 | M1063: =K1063*6+L1063 -> 140 | O1063: 21 | P1063: 28 | Q1063: =O1063*6+P1063 -> 154 | S1063: BEACH ROAD
A1064: SANDRINGHAM | C1064: 1 | D1064: 5 | E1064: =C1064*6+D1064 -> 11 | G1064: 6 | H1064: 9 | I1064: =G1064*6+H1064 -> 45 | K1064: 8 | L1064: 11 | M1064: =K1064*6+L1064 -> 59 | O1064: 15 | P1064: 12 | Q1064: =O1064*6+P1064 -> 102 | S1064: McALPINE
A1065: BEST PLAYERS
A1066: BRUNSWICK | C1066: CRAWFORD | F1066: JEFFREY | I1066: QUINN | K1066: McKAY | N1066: McELROY | Q1066: WHITE
A1067: SANDRINGHAM | C1067: FLEGG | F1067: CHILDS | I1067: EVANS | K1067: ALLISTER | N1067: WEBER | Q1067: AMINDE
A1068: GOALKICKERS
A1069: BRUNSWICK | C1069: WHITE 4 | E1069: CRAWFORD 4 | H1069: CRISP 3 | J1069: McKAY 2 | L1069: KEMP 2 | N1069: BOYD 2 | P1069: McELROY 2 | R1069: QUINN 2
A1070: SANDRINGHAM | C1070: FLEGG 6 | E1070: CHILDS 4 | G1070: KENT | I1070: WEBER | K1070: ALLISTER | M1070: LINDEN | O1070: POND
A1072: WILLIAMSTOWN | C1072: 4 | D1072: 6 | E1072: =C1072*6+D1072 -> 30 | G1072: 12 | H1072: 10 | I1072: =G1072*6+H1072 -> 82 | K1072: 15 | L1072: 13 | M1072: =K1072*6+L1072 -> 103 | O1072: 21 | P1072: 22 | Q1072: =O1072*6+P1072 -> 148 | S1072: WILLIAMSTOWN
A1073: OAKLEIGH | C1073: 3 | D1073: 3 | E1073: =C1073*6+D1073 -> 21 | G1073: 4 | H1073: 4 | I1073: =G1073*6+H1073 -> 28 | K1073: 5 | L1073: 9 | M1073: =K1073*6+L1073 -> 39 | O1073: 8 | P1073: 9 | Q1073: =O1073*6+P1073 -> 57 | S1073: PARRIS
A1074: BEST PLAYERS
A1075: WILLIAMSTOWN | C1075: CUTTING | F1075: TODD | I1075: DELLER | L1075: FITCH | N1075: WILCOX | Q1075: GLASS
A1076: OAKLEIGH | C1076: CRAMERI | F1076: BICKERTON | I1076: O'DONOGHUE | L1076: WILSON | N1076: LANNING | Q1076: DOWLER
A1077: GOALKICKERS
A1078: WILLIAMSTOWN | C1078: VALLENCE 7 | F1078: H RYAN 4 | I1078: TODD 4 | K1078: JAMIESON 2 | N1078: THOMAS 2 | Q1078: HARLAND 2
A1079: OAKLEIGH | C1079: DOWLER 4 | F1079: CRAMERI 2 | I1079: CLARKE | K1079: KENNEDY
A1081: ROUND 20 | E1081: 7TH SEPTEMBER | J1081: WEATHER | M1081: FINE STRONG NORTH WIND | S1081: PLAYED AT
D1082: 1ST QTR | H1082: 2ND QTR | L1082: 3RD QTR | P1082: FINAL | S1082: BRUNSWICK
A1083: BRUNSWICK | C1083: 3 | D1083: 2 | E1083: =C1083*6+D1083 -> 20 | G1083: 7 | H1083: 4 | I1083: =G1083*6+H1083 -> 46 | K1083: 11 | L1083: 11 | M1083: =K1083*6+L1083 -> 77 | O1083: 14 | P1083: 13 | Q1083: =O1083*6+P1083 -> 97 | S1083: UMPIRE | X1083: LADDER | AB1083: ROUND | AD1083: 20
A1084: WILLIAMSTOWN | C1084: 2 | D1084: 4 | E1084: =C1084*6+D1084 -> 16 | G1084: 9 | H1084: 6 | I1084: =G1084*6+H1084 -> 60 | K1084: 10 | L1084: 8 | M1084: =K1084*6+L1084 -> 68 | O1084: 14 | P1084: 8 | Q1084: =O1084*6+P1084 -> 92 | S1084: GROVES
A1085: BEST PLAYERS | W1085: TEAM | X1085: W | Y1085: L | Z1085: D | AA1085: FOR | AB1085: AGST | AC1085: % | AD1085: PTS
A1086: BRUNSWICK | C1086: CRAWFORD | F1086: HOBBA | I1086: STANDFIELD | L1086: FITZGIBBON | O1086: POWELL | R1086: McELROY
A1087: WILLIAMSTOWN | C1087: FITCH | F1087: THOMAS | I1087: TODD | L1087: CHISHOLM | O1087: McDONOUGH | R1087: HARLAND | W1087: WILLIAMSTOWN | X1087: 16 | Y1087: 4 | Z1087: 0 | AA1087: 2400 | AB1087: 1768 | AC1087: =AA1087/AB1087*100 -> 135.74660633484163 | AD1087: 64
A1088: GOALKICKERS | W1088: PORT MELBOURNE | X1088: 14 | Y1088: 6 | Z1088: 0 | AA1088: 2369 | AB1088: 1986 | AC1088: 119.28499496475327 | AD1088: 56
A1089: BRUNSWICK | C1089: CRAWFORD 3 | F1089: McELROY 3 | I1089: CLARKE 2 | K1089: WHITE 2 | M1089: GARDNER | O1089: JEFFREY | Q1089: FITZGIBBON | T1089: McKAY | W1089: PRAHRAN | X1089: 14 | Y1089: 6 | Z1089: 0 | AA1089: 2246 | AB1089: 1919 | AC1089: 117.0401250651381 | AD1089: 56
A1090: WILLIAMSTOWN | C1090: TODD 6 | F1090: VALLENCE 5 | I1090: SPOKES 2 | L1090: FITCH | W1090: PRESTON | X1090: 14 | Y1090: 6 | Z1090: 0 | AA1090: 2135 | AB1090: 1959 | AC1090: 108.98417559979582 | AD1090: 56
A1092: NORTHCOTE | C1092: 1 | D1092: 0 | E1092: =C1092*6+D1092 -> 6 | G1092: 6 | H1092: 10 | I1092: =G1092*6+H1092 -> 46 | K1092: 11 | L1092: 16 | M1092: =K1092*6+L1092 -> 82 | O1092: 17 | P1092: 21 | Q1092: =O1092*6+P1092 -> 123 | S1092: PORT MELBOURNE | W1092: BRUNSWICK | X1092: 13 | Y1092: 7 | Z1092: 0 | AA1092: 2102 | AB1092: 1772 | AC1092: =AA1092/AB1092*100 -> 118.62302483069978 | AD1092: 52
A1093: PORT MELBOURNE | C1093: 6 | D1093: 3 | E1093: =C1093*6+D1093 -> 39 | G1093: 9 | H1093: 4 | I1093: =G1093*6+H1093 -> 58 | K1093: 10 | L1093: 6 | M1093: =K1093*6+L1093 -> 66 | O1093: 12 | P1093: 7 | Q1093: =O1093*6+P1093 -> 79 | S1093: MERRINGTON | W1093: COBURG | X1093: 12 | Y1093: 7 | Z1093: 1 | AA1093: 2001 | AB1093: 1720 | AC1093: 116.33720930232558 | AD1093: 50
A1094: BEST PLAYERS | W1094: NORTHCOTE | X1094: 9 | Y1094: 10 | Z1094: 1 | AA1094: 1972 | AB1094: 2026 | AC1094: 97.334649555774931 | AD1094: 38
A1095: NORTHCOTE | C1095: E BRETHERTON | F1095: CAHILL | I1095: WHITE | K1095: McNAMEE | N1095: HOLDEN | Q1095: DRYDEN | W1095: CAMBERWELL | X1095: 7 | Y1095: 13 | Z1095: 0 | AA1095: 2275 | AB1095: 2353 | AC1095: 96.685082872928177 | AD1095: 28
A1096: PORT MELBOURNE | C1096: LAHIFF | F1096: CASTLES | I1096: RICHES | K1096: DOBSON | N1096: HURLEY | Q1096: ALSOP | W1096: BRIGHTON | X1096: 7 | Y1096: 13 | Z1096: 0 | AA1096: 1978 | AB1096: 2108 | AC1096: 93.833017077798857 | AD1096: 28
A1097: GOALKICKERS | W1097: YARRAVILLE | X1097: 7 | Y1097: 13 | Z1097: 0 | AA1097: 2022 | AB1097: 2551 | AC1097: 79.263034104272833 | AD1097: 28
A1098: NORTHCOTE | C1098: WHITE 8 | F1098: KINGSTON 3 | I1098: HISCOX 2 | K1098: McNAMEE 2 | N1098: CAHILL | P1098: HOLDEN | W1098: OAKLEIGH | X1098: 5 | Y1098: 15 | Z1098: 0 | AA1098: 1876 | AB1098: 2427 | AC1098: 77.2970745776679 | AD1098: 20
A1099: PORT MELBOURNE | C1099: FREYER 5 | F1099: HURLEY 3 | I1099: LAHIFF 2 | K1099: ALLEN 2 | W1099: SANDRINGHAM | X1099: 1 | Y1099: 19 | Z1099: 0 | AA1099: 1755 | AB1099: 2542 | AC1099: 69.040125885129825 | AD1099: 4
A1101: PRESTON | C1101: 2 | D1101: 1 | E1101: =C1101*6+D1101 -> 13 | G1101: 9 | H1101: 9 | I1101: =G1101*6+H1101 -> 63 | K1101: 14 | L1101: 12 | M1101: =K1101*6+L1101 -> 96 | O1101: 21 | P1101: 19 | Q1101: =O1101*6+P1101 -> 145 | S1101: CAMBERWELL
A1102: CAMBERWELL | C1102: 7 | D1102: 10 | E1102: =C1102*6+D1102 -> 52 | G1102: 9 | H1102: 13 | I1102: =G1102*6+H1102 -> 67 | K1102: 18 | L1102: 20 | M1102: =K1102*6+L1102 -> 128 | O1102: 20 | P1102: 24 | Q1102: =O1102*6+P1102 -> 144 | S1102: McALPINE
A1103: BEST PLAYERS
A1104: PRESTON | C1104: DOWLING | E1104: MILLER | H1104: MORRISON | K1104: DUNSTONE | N1104: MURRAY | Q1104: CLARKE
A1105: CAMBERWELL | C1105: CLAMP | E1105: BOND | H1105: SEELENMEYER | K1105: HENDERSON | N1105: IRELAND | Q1105: CANNINGTON
A1106: GOALKICKERS
A1107: PRESTON | C1107: MILLER 6 | E1107: DUNSTONE 4 | H1107: L SLEETH 3 | J1107: MORRISON 3 | M1107: BROWN 2 | O1107: MURRAY | Q1107: DOWLING | T1107: LOWENTHAL
A1108: CAMBERWELL | C1108: IRELAND 5 | F1108: CLAMP 3 | H1108: NASH 3 | J1108: BOND 2 | L1108: CLEMENTS 2 | O1108: FARRELLY | Q1108: WHITEHEAD
A1110: YARRAVILLE | C1110: 3 | D1110: 2 | E1110: =C1110*6+D1110 -> 20 | G1110: 13 | H1110: 14 | I1110: =G1110*6+H1110 -> 92 | K1110: 15 | L1110: 17 | M1110: =K1110*6+L1110 -> 107 | O1110: 25 | P1110: 24 | Q1110: =O1110*6+P1110 -> 174 | S1110: YARRAVILLE
A1111: SANDRINGHAM | C1111: 5 | D1111: 4 | E1111: =C1111*6+D1111 -> 34 | G1111: 5 | H1111: 5 | I1111: =G1111*6+H1111 -> 35 | K1111: 13 | L1111: 11 | M1111: =K1111*6+L1111 -> 89 | O1111: 14 | P1111: 18 | Q1111: =O1111*6+P1111 -> 102 | S1111: PARRIS
A1112: BEST PLAYERS
A1113: YARRAVILLE | C1113: STREETER | F1113: ALSOP | I1113: O'HALLORAN | L1113: HOPKINS | O1113: McVEIGH | Q1113: BEVAN
A1114: SANDRINGHAM | C1114: SMAIL | F1114: MILLER | I1114: AMINDE | L1114: ALLISTER | O1114: FOLLETT | Q1114: FLEGG
A1115: GOALKICKERS
A1116: YARRAVILLE | C1116: ALSOPP 13 | F1116: HOPKINS 4 | I1116: ROBERTSON 3 | L1116: BEVAN | N1116: PERUSSICH | Q1116: RAWLINGS | T1116: McVEIGH | W1116: O'HALLORAN
A1117: SANDRINGHAM | C1117: FLEGG 3 | F1117: ALLISTER 3 | I1117: WESTCOTT 3 | L1117: MILLER 2 | N1117: SMITH | Q1117: CHILDS | S1117: KENT
A1119: COBURG | C1119: 4 | D1119: 5 | E1119: =C1119*6+D1119 -> 29 | G1119: 5 | H1119: 7 | I1119: =G1119*6+H1119 -> 37 | K1119: 9 | L1119: 14 | M1119: =K1119*6+L1119 -> 68 | O1119: 18 | P1119: 18 | Q1119: =O1119*6+P1119 -> 126 | S1119: OAKLEIGH
A1120: OAKLEIGH | C1120: 2 | D1120: 4 | E1120: =C1120*6+D1120 -> 16 | G1120: 5 | H1120: 9 | I1120: =G1120*6+H1120 -> 39 | K1120: 6 | L1120: 12 | M1120: =K1120*6+L1120 -> 48 | O1120: 9 | P1120: 17 | Q1120: =O1120*6+P1120 -> 71 | S1120: VEAL
A1121: BEST PLAYERS
A1122: COBURG | C1122: COLLINS | E1122: McLEY | H1122: ATKINSON | K1122: JORDAN | N1122: MUNDAY | Q1122: PROMNITZ
A1123: OAKLEIGH | C1123: WEISS | E1123: CRAMERI | H1123: WILSON | K1123: LAW | N1123: KENNEDY | Q1123: BEARD
A1124: GOALKICKERS
A1125: COBURG | C1125: MUNDAY 4 | F1125: ANDERSON 4 | I1125: COLLINS 2 | K1125: McLEY | M1125: BEAGLEY | O1125: McILVENE
A1126: OAKLEIGH | C1126: DOWLER 3 | F1126: McCRORY 2 | I1126: SMITH | K1126: WARD | M1126: LAW | O1126: CLARKE
A1128: PRAHRAN | C1128: 0 | D1128: 1 | E1128: =C1128*6+D1128 -> 1 | G1128: 2 | H1128: 10 | I1128: =G1128*6+H1128 -> 22 | K1128: 2 | L1128: 10 | M1128: =K1128*6+L1128 -> 22 | O1128: 12 | P1128: 16 | Q1128: =O1128*6+P1128 -> 88 | S1128: ELSTERNWICK PARK
A1129: BRIGHTON | C1129: 5 | D1129: 5 | E1129: =C1129*6+D1129 -> 35 | G1129: 6 | H1129: 6 | I1129: =G1129*6+H1129 -> 42 | K1129: 11 | L1129: 8 | M1129: =K1129*6+L1129 -> 74 | O1129: 12 | P1129: 9 | Q1129: =O1129*6+P1129 -> 81 | S1129: HAYES
A1130: BEST PLAYERS
A1131: PRAHRAN | C1131: BRENCHLEY | F1131: FAUL | H1131: WILLIAMS | K1131: WHITEHEAD | N1131: GRAVELL | Q1131: TUCKER
A1132: BRIGHTON | C1132: McINERNEY | F1132: SCOTT | H1132: DAVIS | K1132: HINDSON | N1132: HALL | Q1132: MOFFATT
A1133: GOALKICKERS
A1134: PRAHRAN | C1134: LYONS 5 | F1134: HAWKINS 2 | I1134: ROLFE | K1134: PEARCE | M1134: BRENCHLEY | P1134: WHITE | R1134: PROBYN
A1135: BRIGHTON | C1135: McINERNEY 2 | F1135: BOLWELL 2 | I1135: MILLER 2 | K1135: DAVIS 2 | M1135: KING | N1135: WILLIAMSON | Q1135: MOFFATT | T1135: FINDLAY
A1137: FINALS
A1138: 1ST SEMI | E1138: 14TH SEPTEMBER | J1138: WEATHER | M1138: CLOUDY BUT FINE WEST WIND
D1139: 1ST QTR | H1139: 2ND QTR | L1139: 3RD QTR | P1139: FINAL
A1140: PRAHRAN | C1140: 0 | D1140: 6 | E1140: =C1140*6+D1140 -> 6 | G1140: 5 | H1140: 15 | I1140: =G1140*6+H1140 -> 45 | K1140: 10 | L1140: 17 | M1140: =K1140*6+L1140 -> 77 | O1140: 16 | P1140: 26 | Q1140: =O1140*6+P1140 -> 122 | S1140: TOORAK PARK
A1141: PRESTON | C1141: 4 | D1141: 3 | E1141: =C1141*6+D1141 -> 27 | G1141: 8 | H1141: 7 | I1141: =G1141*6+H1141 -> 55 | K1141: 12 | L1141: 11 | M1141: =K1141*6+L1141 -> 83 | O1141: 17 | P1141: 11 | Q1141: =O1141*6+P1141 -> 113 | S1141: HAYES
A1142: BEST PLAYERS
A1143: PRAHRAN | C1143: WHITE | F1143: BRENCHLEY | J1143: NEWTON | M1143: BOURNE | P1143: ROLFE | R1143: DAVEY
A1144: PRESTON | C1144: MASLEN | F1144: L SLEETH | J1144: ROSS | M1144: DOWLING | P1144: MILLER | R1144: NORMAN
A1145: GOALKICKERS
A1146: PRAHRAN | C1146: LYONS 5 | E1146: THOMPSON 2 | H1146: WHITE 2 | J1146: GRAVELL 2 | M1146: DAVEY | O1146: BOURNE | Q1146: O'DONNELL | T1146: ROLFE | W1146: HAWKINS
A1147: PRESTON | C1147: L SLEETH 5 | F1147: MILLER 4 | I1147: MORRISON 3 | L1147: CALVERT 2 | N1147: BROWN | P1147: ROACH | R1147: ROSS
A1149: 2ND SEMI | E1149: 21ST SEPTEMBER | J1149: WEATHER | M1149: CLOUDY UNSETTLED LATE RAIN EAST WIND
A1150: PORT MELBOURNE | C1150: 7 | D1150: 2 | E1150: =C1150*6+D1150 -> 44 | G1150: 14 | H1150: 5 | I1150: =G1150*6+H1150 -> 89 | K1150: 23 | L1150: 10 | M1150: =K1150*6+L1150 -> 148 | O1150: 24 | P1150: 14 | Q1150: =O1150*6+P1150 -> 158 | S1150: TOORAK PARK
A1151: WILLIAMSTOWN | C1151: 3 | D1151: 4 | E1151: =C1151*6+D1151 -> 22 | G1151: 5 | H1151: 9 | I1151: =G1151*6+H1151 -> 39 | K1151: 8 | L1151: 12 | M1151: =K1151*6+L1151 -> 60 | O1151: 13 | P1151: 14 | Q1151: =O1151*6+P1151 -> 92 | S1151: HAYES
A1152: BEST PLAYERS
A1153: PORT MELBOURNE | C1153: KELLY | E1153: CASTLES | H1153: FREYER | K1153: LAHIFF | N1153: ROBERTSON | Q1153: DOBSON
A1154: WILLIAMSTOWN | C1154: DELLER | E1154: CUTTING | H1154: WILCOX | K1154: E RYAN | N1154: THOMAS | Q1154: PATERSON
A1155: GOALKICKERS
A1156: PORT MELBOURNE | C1156: FREYER 12 | F1156: LAHIFF 5 | I1156: HOSKING 2 | L1156: ROBERTSON 2 | O1156: GODFREDSON | R1156: HURLEY | U1156: REYNOLDS
A1157: WILLIAMSTOWN | C1157: VALLENCE 4 | F1157: TODD 3 | I1157: THOMAS 2 | L1157: CHISHOLM | O1157: FITCH | Q1157: NEILL | S1157: CAVE
A1159: PRELIMINARY FINAL | F1159: 26TH SEPTEMBER | J1159: WEATHER | M1159: CLOUDY SHOWERS S.W. BREEZE
A1160: PRAHRAN | C1160: 3 | D1160: 4 | E1160: =C1160*6+D1160 -> 22 | G1160: 6 | H1160: 8 | I1160: =G1160*6+H1160 -> 44 | K1160: 11 | L1160: 12 | M1160: =K1160*6+L1160 -> 78 | O1160: 15 | P1160: 21 | Q1160: =O1160*6+P1160 -> 111 | S1160: TOORAK PARK
A1161: WILLIAMSTOWN | C1161: 0 | D1161: 5 | E1161: =C1161*6+D1161 -> 5 | G1161: 4 | H1161: 11 | I1161: =G1161*6+H1161 -> 35 | K1161: 9 | L1161: 14 | M1161: =K1161*6+L1161 -> 68 | O1161: 11 | P1161: 16 | Q1161: =O1161*6+P1161 -> 82 | S1161: HATES
A1162: BEST PLAYERS
A1163: PRAHRAN | C1163: LYONS | E1163: WHITE | H1163: FAUL | K1163: NEWTON | N1163: BRENCHLEY | Q1163: PROBYN
A1164: WILLIAMSTOWN | C1164: GLASS | E1164: WILCOX | H1164: DELLER | K1164: CUTTING | N1164: THOMAS | Q1164: PATERSON
A1165: GOALKICKERS
A1166: PRAHRAN | C1166: LYONS 7 | F1166: WHITE 3 | I1166: DAVEY 2 | K1166: ROLFE 2 | M1166: TUCKER
A1167: WILLIAMSTOWN | C1167: VALLENCE 5 | F1167: TODD 3 | I1167: THOMAS | K1167: PATERSON
A1169: GRAND FINAL | E1169: 5TH OCTOBER | J1169: WEATHER | M1169: FINE WARM HUMID
A1170: PORT MELBOURNE | C1170: 4 | D1170: 8 | E1170: =C1170*6+D1170 -> 32 | G1170: 11 | H1170: 12 | I1170: =G1170*6+H1170 -> 78 | K1170: 17 | L1170: 18 | M1170: =K1170*6+L1170 -> 120 | O1170: 23 | P1170: 22 | Q1170: =O1170*6+P1170 -> 160 | S1170: M.C.G.
A1171: PRAHRAN | C1171: 2 | D1171: 5 | E1171: =C1171*6+D1171 -> 17 | G1171: 9 | H1171: 7 | I1171: =G1171*6+H1171 -> 61 | K1171: 12 | L1171: 8 | M1171: =K1171*6+L1171 -> 80 | O1171: 17 | P1171: 11 | Q1171: =O1171*6+P1171 -> 113 | S1171: HAYES
A1172: BEST PLAYERS
A1173: PORT MELBOURNE | C1173: FREYER | F1173: ROBERTSON | I1173: HURLEY | K1173: JULIER | N1173: LAHIFF | Q1173: TANNER
A1174: PRAHRAN | C1174: HAWKINS | F1174: THOMPSON | I1174: DAVEY | K1174: LYONS | N1174: WILLIAMS | Q1174: O'DONNELL
A1175: GOALKICKERS
A1176: PORT MELBOURNE | C1176: FREYER 12 | F1176: HURLEY 5 | I1176: ROBERTSON 4 | L1176: LAHIFF | N1176: CASTLES
A1177: PRAHRAN | C1177: LYONS 9 | F1177: HAWKINS 3 | I1177: O'DONNELL 2 | L1177: WHITE 2 | N1177: GRAVELL
A1179: TEAMS
G1180: PORT MELBOURNE | S1180: PRAHRAN
A1181: BACKS: | D1181: GOSS | G1181: DOBSON | K1181: FLETCHER | O1181: WHITEHEAD | S1181: BRENCHLEY | W1181: PROBYN
A1182: H-BACKS: | D1182: ONLEY | G1182: HAYES | K1182: TANNER | O1182: JOHNSON | S1182: NEWTON | W1182: FAUL
A1183: CENTRES: | D1183: JULIER | G1183: KELLY | K1183: ALSOP | O1183: F SMITH | S1183: TUCKER | W1183: TAYLOR
A1184: H-FORWARDS: | D1184: ALLEN | G1184: ROBERTSON | K1184: CASTLES | O1184: ROLFE | S1184: DAVEY | W1184: HAWKINS
A1185: FORWARDS: | D1185: HURLEY | G1185: FREYER | K1185: HOSKING | O1185: N GRAVELL | S1185: LYONS | W1185: O'DONNELL
A1186: RUCKS: | D1186: REYNOLDS | G1186: RICHES | K1186: LAHIFF | O1186: THOMPSON | S1186: WILLIAMS | W1186: WHITE
A1187: 19TH MAN | D1187: LEE | O1187: ANDERS