A1: Victorian Football Association
A2: Season 1941
A3: © Copyright Wal Williams | F3: First created: 2 November 2014
A4: Contact: joywalwi at gmail dot com | F4: Last updated: 27 January 2018 | W4: VFA Results and tables - Link to the main index page
A5: You are free to copy this document in whole or part provided that proper acknowledgement is given to the author. All rights reserved.
A7: YEAR 1941
A8: ROUND 1 | E8: 14TH APRIL | J8: WEATHER | M8: FINE WARM NORTH WIND | S8: PLAYED AT
D9: 1ST QTR | H9: 2ND QTR | L9: 3RD QTR | P9: FINAL | S9: COBURG
A10: COBURG | C10: 12 | D10: 3 | E10: =C10*6+D10 -> 75 | G10: 15 | H10: 6 | I10: =G10*6+H10 -> 96 | K10: 24 | L10: 10 | M10: =K10*6+L10 -> 154 | O10: 28 | P10: 13 | Q10: =O10*6+P10 -> 181 | S10: UMPIRE | X10: LADDER | AB10: ROUND | AD10: 1
A11: BRUNSWICK | C11: 2 | D11: 1 | E11: =C11*6+D11 -> 13 | G11: 6 | H11: 9 | I11: =G11*6+H11 -> 45 | K11: 9 | L11: 11 | M11: =K11*6+L11 -> 65 | O11: 12 | P11: 20 | Q11: =O11*6+P11 -> 92 | S11: PREST
A12: BEST PLAYERS | W12: TEAM | X12: W | Y12: L | Z12: D | AA12: FOR | AB12: AGST | AC12: % | AD12: PTS
A13: COBURG | C13: COLLINS | F13: PRATT | I13: ESDALE | K13: MURRAY | N13: SITCH | Q13: ATKINSON
A14: BRUNSWICK | C14: CRAWFORD | F14: COOLEY | I14: FAY | K14: JEFFREY | N14: HOBBA | Q14: DOWLING | W14: WILLIAMSTOWN | X14: 1 | Y14: 0 | Z14: 0 | AA14: 183 | AB14: 63 | AC14: 290.48 | AD14: 4
A15: GOALKICKERS | W15: COBURG | X15: 1 | Y15: 0 | Z15: 0 | AA15: 181 | AB15: 92 | AC15: 196.7391304347826 | AD15: 4
A16: COBURG | C16: COLLINS 8 | F16: PRATT 8 | H16: MULLENGER 5 | K16: ESDALE 4 | M16: LONSDALE | O16: BROWN | Q16: CRAIG | W16: PRESTON | X16: 1 | Y16: 0 | Z16: 0 | AA16: 141 | AB16: 86 | AC16: 163.95348837209303 | AD16: 4
A17: BRUNSWICK | C17: CRAWFORD 4 | F17: DOWLING 2 | I17: JEFFREY 2 | K17: McKERNAN 2 | N17: McELROY | P17: CAMPBELL | W17: BRIGHTON | X17: 1 | Y17: 0 | Z17: 0 | AA17: 132 | AB17: 85 | AC17: 155.29411764705881 | AD17: 4
A19: OAKLEIGH | C19: 5 | D19: 4 | E19: =C19*6+D19 -> 34 | G19: 9 | H19: 7 | I19: =G19*6+H19 -> 61 | K19: 14 | L19: 13 | M19: =K19*6+L19 -> 97 | O19: 20 | P19: 21 | Q19: =O19*6+P19 -> 141 | S19: OAKLEIGH | W19: OAKLEIGH | X19: 1 | Y19: 0 | Z19: 0 | AA19: 141 | AB19: 96 | AC19: 146.875 | AD19: 4
A20: CAMBERWELL | C20: 5 | D20: 3 | E20: =C20*6+D20 -> 33 | G20: 9 | H20: 9 | I20: =G20*6+H20 -> 63 | K20: 10 | L20: 11 | M20: =K20*6+L20 -> 71 | O20: 14 | P20: 12 | Q20: =O20*6+P20 -> 96 | S20: BATT | W20: PRAHRAN | X20: 1 | Y20: 0 | Z20: 0 | AA20: 93 | AB20: 83 | AC20: 112.04819277108433 | AD20: 4
A21: BEST PLAYERS | W21: PORT MELBOURNE | X21: 0 | Y21: 1 | Z21: 0 | AA21: 83 | AB21: 93 | AC21: 89.247311827956992 | AD21: 0
A22: OAKLEIGH | C22: KENNEDY | F22: CLARKE | I22: REID | K22: JARRETT | N22: O'DONOGHUE | Q22: MILLS | W22: CAMBERWELL | X22: 0 | Y22: 1 | Z22: 0 | AA22: 96 | AB22: 141 | AC22: 68.085106382978722 | AD22: 0
A23: CAMBERWELL | C23: FARRELLY | F23: ROWE | I23: QUILL | K23: SEELENMEYER | N23: McKAY | Q23: JORGENSON | W23: SANDRINGHAM | X23: 0 | Y23: 1 | Z23: 0 | AA23: 85 | AB23: 132 | AC23: 64.393939393939391 | AD23: 0
A24: GOALKICKERS | W24: NORTHCOTE | X24: 0 | Y24: 1 | Z24: 0 | AA24: 86 | AB24: 141 | AC24: 60.99290780141844 | AD24: 0
A25: OAKLEIGH | C25: REID 6 | E25: KENNEDY 5 | H25: C WATSON 3 | K25: JARRETT 3 | N25: BRENCHLEY 2 | Q25: WILMOT 2 | W25: BRUNSWICK | X25: 0 | Y25: 1 | Z25: 0 | AA25: 92 | AB25: 181 | AC25: 50.828729281767956 | AD25: 0
A26: CAMBERWELL | C26: NASH 4 | E26: McKAY 3 | G26: JORGENSON 2 | J26: QUILL | L26: ANDERSON | N26: WOOLF | P26: ROWE | R26: SCALES | W26: YARRAVILLE | X26: 0 | Y26: 1 | Z26: 0 | AA26: 63 | AB26: 183 | AC26: 34.43 | AD26: 0
A28: BRIGHTON | C28: 6 | D28: 6 | E28: =C28*6+D28 -> 42 | G28: 10 | H28: 9 | I28: =G28*6+H28 -> 69 | K28: 18 | L28: 16 | M28: =K28*6+L28 -> 124 | O28: 19 | P28: 18 | Q28: =O28*6+P28 -> 132 | S28: BEACH ROAD
A29: SANDRINGHAM | C29: 3 | D29: 1 | E29: =C29*6+D29 -> 19 | G29: 5 | H29: 5 | I29: =G29*6+H29 -> 35 | K29: 9 | L29: 7 | M29: =K29*6+L29 -> 61 | O29: 12 | P29: 13 | Q29: =O29*6+P29 -> 85 | S29: APPLEBY
A30: BEST PLAYERS
A31: BRIGHTON | C31: FROUDE | E31: MELVIN | H31: HALLAHAN | K31: BUCKLEY | N31: WILLIAMSON | Q31: McINDOE
A32: SANDRINGHAM | C32: SMAIL | E32: FOLLETT | H32: MILLER | K32: ALLISTER | N32: COPSEY | Q32: FLETT
A33: GOALKICKERS
A34: BRIGHTON | C34: CONDON 5 | F34: LUCAS 4 | H34: McINDOE 3 | K34: MELVIN 2 | M34: STANHOPE | O34: SPARGO | Q34: HALLAHAN | T34: ELLIS | V34: KEMP
A35: SANDRINGHAM | C35: FLEGG 4 | F35: ALLISTER 3 | I35: CARTWRIGHT 3 | M35: SMAIL | O35: PRICE
A37: PRESTON | C37: 7 | D37: 8 | E37: =C37*6+D37 -> 50 | G37: 12 | H37: 16 | I37: =G37*6+H37 -> 88 | K37: 14 | L37: 17 | M37: =K37*6+L37 -> 101 | O37: 20 | P37: 21 | Q37: =O37*6+P37 -> 141 | S37: NORTHCOTE
A38: NORTHCOTE | C38: 3 | D38: 2 | E38: =C38*6+D38 -> 20 | G38: 5 | H38: 5 | I38: =G38*6+H38 -> 35 | K38: 8 | L38: 7 | M38: =K38*6+L38 -> 55 | O38: 13 | P38: 8 | Q38: =O38*6+P38 -> 86 | S38: MANCHESTER
A39: BEST PLAYERS
A40: PRESTON | C40: EVERETT | F40: DEACON | I40: CLARK | L40: ROSS | O40: CALVERT | R40: LYNCH
A41: NORTHCOTE | C41: VENNING | F41: HOLDEN | I41: OLVER | L41: E HART | O41: DOWER | R41: WATT
A42: GOALKICKERS
A43: PRESTON | C43: EVERETT 4 | F43: ROSS 4 | H43: SEEDSMAN 3 | K43: DUNSTONE 3 | N43: LYNCH 3 | P43: LEISHMAN | R43: NORMAN | U43: HIND
A44: NORTHCOTE | C44: WHITE 4 | F44: OLVER 3 | I44: SIMPSON 3 | L44: STABB | N44: HOLDEN | P44: CAHILL
A46: PRAHRAN | C46: 3 | D46: 1 | E46: =C46*6+D46 -> 19 | G46: 6 | H46: 9 | I46: =G46*6+H46 -> 45 | K46: 7 | L46: 13 | M46: =K46*6+L46 -> 55 | O46: 13 | P46: 15 | Q46: =O46*6+P46 -> 93 | S46: TOORAK PARK
A47: PORT MELBOURNE | C47: 1 | D47: 10 | E47: =C47*6+D47 -> 16 | G47: 3 | H47: 14 | I47: =G47*6+H47 -> 32 | K47: 6 | L47: 18 | M47: =K47*6+L47 -> 54 | O47: 10 | P47: 23 | Q47: =O47*6+P47 -> 83 | S47: MERRINGTON
A48: BEST PLAYERS
A49: PRAHRAN | C49: FAUL | E49: WILLIAMS | H49: JOHNSON | K49: WHITEHEAD | N49: TUCKER | Q49: GRAVELL
A50: PORT MELBOURNE | C50: HAYES | E50: CASTLES | H50: HOSKING | K50: GOSS | N50: ALSOP | Q50: FREYER
A51: GOALKICKERS
A52: PRAHRAN | C52: LYONS 6 | F52: GRAVELL 3 | I52: O'DONNELL 2 | L52: TUCKER | N52: PEARCE
A53: PORT MELBOURNE | C53: FREYER 6 | F53: ALLEN 2 | I53: KELLY | K53: HOSKING
A55: WILLIAMSTOWN | C55: 6 | D55: 3 | E55: =C55*6+D55 -> 39 | G55: 13 | H55: 10 | I55: =G55*6+H55 -> 88 | K55: 18 | L55: 11 | M55: =K55*6+L55 -> 119 | O55: 28 | P55: 15 | Q55: =O55*6+P55 -> 183 | S55: WILLIAMSTOWN
A56: YARRAVILLE | C56: 3 | D56: 2 | E56: =C56*6+D56 -> 20 | G56: 5 | H56: 5 | I56: =G56*6+H56 -> 35 | K56: 8 | L56: 9 | M56: =K56*6+L56 -> 57 | O56: 9 | P56: 9 | Q56: =O56*6+P56 -> 63 | S56: PARRIS
A57: BEST PLAYERS
A58: WILLIAMSTOWN | C58: TODD | E58: FITCH | H58: GLASS | K58: FOTHERGILL | N58: CHISHOLM | Q58: GEORGE
A59: YARRAVILLE | C59: SCHUTT | E59: B McVEIGH | H59: RANN | K59: PERUSSICH | N59: RAWLINGS | Q59: KENNY
A60: GOALKICKERS
A61: WILLIAMSTOWN | C61: VALLENCE 11 | F61: TODD 7 | I61: GEORGE 6 | L61: MARSHAM 2 | O61: HARRIS | Q61: FOTHERGILL
A62: YARRAVILLE | C62: PERUSSICH 3 | F62: RAWLINGS 2 | I62: ALSOP 2 | L62: O'HALLORAN | O62: DOHERTY
A64: ROUND 2 | E64: 19TH APRIL | J64: WEATHER | M64: FINE SULTRY NORTH BREEZE | S64: PLAYED AT
D65: 1ST QTR | H65: 2ND QTR | L65: 3RD QTR | P65: FINAL | S65: ELSTERNWICK PARK
A66: BRIGHTON | C66: 1 | D66: 2 | E66: =C66*6+D66 -> 8 | G66: 7 | H66: 13 | I66: =G66*6+H66 -> 55 | K66: 10 | L66: 13 | M66: =K66*6+L66 -> 73 | O66: 16 | P66: 20 | Q66: =O66*6+P66 -> 116 | S66: UMPIRE | X66: LADDER | AB66: ROUND | AD66: 2
A67: OAKLEIGH | C67: 7 | D67: 6 | E67: =C67*6+D67 -> 48 | G67: 9 | H67: 7 | I67: =G67*6+H67 -> 61 | K67: 14 | L67: 14 | M67: =K67*6+L67 -> 98 | O67: 16 | P67: 18 | Q67: =O67*6+P67 -> 114 | S67: PREST
A68: BEST PLAYERS | W68: TEAM | X68: W | Y68: L | Z68: D | AA68: FOR | AB68: AGST | AC68: % | AD68: PTS
A69: BRIGHTON | C69: HALLAHAN | F69: CONNELL | I69: FROUDE | L69: CONDON | N69: MELVIN | Q69: McINDOE
A70: OAKLEIGH | C70: HUTCHESON | F70: KENNEDY | I70: O'DONOGHUE | L70: J HALL | N70: WEISS | Q70: BRENCHLEY | W70: PRESTON | X70: 2 | Y70: 0 | Z70: 0 | AA70: 351 | AB70: 153 | AC70: 229.41176470588235 | AD70: 8
A71: GOALKICKERS | W71: COBURG | X71: 2 | Y71: 0 | Z71: 0 | AA71: 322 | AB71: 175 | AC71: 184 | AD71: 8
A72: BRIGHTON | C72: CONNELL 5 | F72: CONDON 5 | I72: McINDOE 3 | L72: LUCAS 3 | W72: PRAHRAN | X72: 2 | Y72: 0 | Z72: 0 | AA72: 297 | AB72: 200 | AC72: 148.5 | AD72: 8
A73: OAKLEIGH | C73: COLLINS 4 | F73: BRENCHLEY 3 | I73: WATSON 3 | L73: REID 2 | N73: J HALL | P73: JARRETT | R73: WILMOT | W73: BRIGHTON | X73: 2 | Y73: 0 | Z73: 0 | AA73: 248 | AB73: 199 | AC73: 124.62311557788945 | AD73: 8
Q74: KENNEDY
A75: PRAHRAN | C75: 1 | D75: 2 | E75: =C75*6+D75 -> 8 | G75: 13 | H75: 13 | I75: =G75*6+H75 -> 91 | K75: 18 | L75: 20 | M75: =K75*6+L75 -> 128 | O75: 29 | P75: 30 | Q75: =O75*6+P75 -> 204 | S75: CAMBERWELL | W75: WILLIAMSTOWN | X75: 1 | Y75: 1 | Z75: 0 | AA75: 270 | AB75: 202 | AC75: 133.66 | AD75: 4
A76: CAMBERWELL | C76: 9 | D76: 5 | E76: =C76*6+D76 -> 59 | G76: 10 | H76: 5 | I76: =G76*6+H76 -> 65 | K76: 16 | L76: 7 | M76: =K76*6+L76 -> 103 | O76: 18 | P76: 9 | Q76: =O76*6+P76 -> 117 | S76: BATT | W76: PORT MELBOURNE | X76: 1 | Y76: 1 | Z76: 0 | AA76: 222 | AB76: 180 | AC76: 123.33333333333333 | AD76: 4
A77: BEST PLAYERS | W77: OAKLEIGH | X77: 1 | Y77: 1 | Z77: 0 | AA77: 255 | AB77: 212 | AC77: 120.28301886792453 | AD77: 4
A78: PRAHRAN | C78: GRAVELL | F78: PROBYN | I78: WHITE | L78: BENNISON | O78: PEARCE | R78: FAUL | W78: BRUNSWICK | X78: 1 | Y78: 1 | Z78: 0 | AA78: 199 | AB78: 256 | AC78: 77.734375 | AD78: 4
A79: CAMBERWELL | C79: TOOHEY | F79: JORGENSON | I79: HORKINGS | L79: NASH | O79: ANDERSON | R79: HENDERSON | W79: NORTHCOTE | X79: 0 | Y79: 2 | Z79: 0 | AA79: 161 | AB79: 248 | AC79: 64.91935483870968 | AD79: 0
A80: GOALKICKERS | W80: CAMBERWELL | X80: 0 | Y80: 2 | Z80: 0 | AA80: 213 | AB80: 345 | AC80: 61.74 | AD80: 0
A81: PRAHRAN | C81: GRAVELL 8 | F81: DAVEY 5 | H81: PEARCE 4 | J81: O'DONNELL 4 | M81: WHITE 3 | O81: LYONS 3 | Q81: PROBYN | S81: BULGER | W81: YARRAVILLE | X81: 0 | Y81: 2 | Z81: 0 | AA81: 146 | AB81: 324 | AC81: 45.06 | AD81: 0
A82: CAMBERWELL | C82: NASH 9 | E82: JORGENSON 3 | H82: IRELAND 2 | J82: WOOLF | L82: HORKINGS | N82: FARRELLY | Q82: McKAY | W82: SANDRINGHAM | X82: 0 | Y82: 2 | Z82: 0 | AA82: 152 | AB82: 342 | AC82: 44.444444444444443 | AD82: 0
A84: PORT MELBOURNE | C84: 2 | D84: 3 | E84: =C84*6+D84 -> 15 | G84: 7 | H84: 4 | I84: =G84*6+H84 -> 46 | K84: 14 | L84: 5 | M84: =K84*6+L84 -> 89 | O84: 22 | P84: 7 | Q84: =O84*6+P84 -> 139 | S84: PORT MELBOURNE
A85: WILLIAMSTOWN | C85: 5 | D85: 8 | E85: =C85*6+D85 -> 38 | G85: 6 | H85: 11 | I85: =G85*6+H85 -> 47 | K85: 7 | L85: 16 | M85: =K85*6+L85 -> 58 | O85: 11 | P85: 21 | Q85: =O85*6+P85 -> 87 | S85: GROVES
A86: BEST PLAYERS
A87: PORT MELBOURNE | C87: HAYES | E87: ROBERTSON | H87: JULIER | K87: STEIGENBERGER | O87: CASTLES | Q87: ALSOP
A88: WILLIAMSTOWN | C88: E RYAN | E88: HARRIS | H88: FOTHERGILL | K88: TODD | O88: CUTTING | Q88: WILCOX
A89: GOALKICKERS
A90: PORT MELBOURNE | C90: FREYER 10 | F90: ROBERTSON 4 | I90: ALLEN 4 | K90: JULIER 2 | M90: LAHIFF | O90: RICHES
A91: WILLIAMSTOWN | C91: TODD 6 | F91: FOTHERGILL 3 | I91: VALLENCE | K91: BENNETT
A93: BRUNSWICK | C93: 3 | D93: 4 | E93: =C93*6+D93 -> 22 | G93: 9 | H93: 11 | I93: =G93*6+H93 -> 65 | K93: 10 | L93: 12 | M93: =K93*6+L93 -> 72 | O93: 15 | P93: 17 | Q93: =O93*6+P93 -> 107 | S93: BRUNSWICK
A94: NORTHCOTE | C94: 4 | D94: 2 | E94: =C94*6+D94 -> 26 | G94: 5 | H94: 5 | I94: =G94*6+H94 -> 35 | K94: 8 | L94: 12 | M94: =K94*6+L94 -> 60 | O94: 10 | P94: 15 | Q94: =O94*6+P94 -> 75 | S94: MANCHESTER
A95: BEST PLAYERS
A96: BRUNSWICK | C96: CRAWFORD | G96: COOLEY | I96: FAY | L96: JONES | P96: BOYD | R96: DOWLING
A97: NORTHCOTE | C97: D BRETHERTON | G97: WARNER | I97: KINGSTON | L97: E BRETHERTON | P97: E HART | R97: SIMPSON
A98: GOALKICKERS
A99: BRUNSWICK | C99: JONES 4 | E99: McELROY 4 | H99: DOWLING 3 | K99: BAILEY | M99: BOYD | N99: COOLEY | P99: CRAWFORD
A100: NORTHCOTE | C100: KINGSTON 5 | F100: WHITE 2 | I100: CAHILL | K100: McINTOSH | N100: McNAMEE
A102: PRESTON | C102: 5 | D102: 2 | E102: =C102*6+D102 -> 32 | G102: 12 | H102: 9 | I102: =G102*6+H102 -> 81 | K102: 19 | L102: 15 | M102: =K102*6+L102 -> 129 | O102: 32 | P102: 18 | Q102: =O102*6+P102 -> 210 | S102: PRESTON
A103: SANDRINGHAM | C103: 6 | D103: 4 | E103: =C103*6+D103 -> 40 | G103: 7 | H103: 7 | I103: =G103*6+H103 -> 49 | K103: 8 | L103: 13 | M103: =K103*6+L103 -> 61 | O103: 9 | P103: 13 | Q103: =O103*6+P103 -> 67 | S103: MERRINGTON
A104: BEST PLAYERS
A105: PRESTON | C105: ROSS | E105: LYNCH | H105: EVERETT | K105: ROACH | M105: CALVERT | P105: TAYLOR
A106: SANDRINGHAM | C106: FLEGG | E106: ALLISTER | H106: COPSEY | K106: EVANS | M106: WEBER | P106: LEISHMAN
A107: GOALKICKERS
A108: PRESTON | C108: TAYLOR 7 | F108: LYNCH 7 | I108: DUNSTONE 5 | L108: ROSS 4 | N108: BROWN 3 | Q108: NORMAN 2 | T108: CALVERT 2 | X108: EVERETT | AA108: SEEDSMAN
A109: SANDRINGHAM | C109: KENT 3 | F109: ALLISTER 3 | I109: FLEGG 2 | K109: WEBER
A111: COBURG | C111: 8 | D111: 4 | E111: =C111*6+D111 -> 52 | G111: 12 | H111: 5 | I111: =G111*6+H111 -> 77 | K111: 18 | L111: 11 | M111: =K111*6+L111 -> 119 | O111: 21 | P111: 15 | Q111: =O111*6+P111 -> 141 | S111: YARRAVILLE
A112: YARRAVILLE | C112: 1 | D112: 3 | E112: =C112*6+D112 -> 9 | G112: 6 | H112: 12 | I112: =G112*6+H112 -> 48 | K112: 8 | L112: 14 | M112: =K112*6+L112 -> 62 | O112: 11 | P112: 17 | Q112: =O112*6+P112 -> 83 | S112: APPLEBY
A113: BEST PLAYERS
A114: COBURG | C114: PRATT | F114: SITCH | I114: COLLINS | L114: MULLENGER | O114: R WILSON | R114: GLENISTER
A115: YARRAVILLE | C115: O'HALLORAN | F115: STREETER | I115: D WILSON | L115: RANN | O115: B McVEIGH | R115: KENNY
A116: GOALKICKERS
A117: COBURG | C117: PRATT 10 | F117: COLLINS 4 | I117: MULLENGER 2 | L117: GLENISTER | N117: MILTE | P117: HORE | R117: ESDALE | U117: BROWN
A118: YARRAVILLE | C118: ALSOP 5 | F118: PERUSSICH 3 | I118: WARDEN 2 | L118: B McVEIGH
A120: ROUND 3 | E120: 26TH APRIL | H120: WEATHER | K120: LIGHT SHOWERS STRONG S.W. WIND | S120: PLAYED AT
D121: 1ST QTR | H121: 2ND QTR | L121: 3RD QTR | P121: FINAL | S121: TOORAK PARK
A122: PRAHRAN | C122: 2 | D122: 3 | E122: =C122*6+D122 -> 15 | G122: 11 | H122: 8 | I122: =G122*6+H122 -> 74 | K122: 12 | L122: 11 | M122: =K122*6+L122 -> 83 | O122: 22 | P122: 16 | Q122: =O122*6+P122 -> 148 | S122: UMPIRE | X122: LADDER | AB122: ROUND | AD122: 3
A123: BRIGHTON | C123: 7 | D123: 4 | E123: =C123*6+D123 -> 46 | G123: 7 | H123: 6 | I123: =G123*6+H123 -> 48 | K123: 8 | L123: 10 | M123: =K123*6+L123 -> 58 | O123: 9 | P123: 13 | Q123: =O123*6+P123 -> 67 | S123: APPLEBY
A124: BEST PLAYERS | W124: TEAM | X124: W | Y124: L | Z124: D | AA124: FOR | AB124: AGST | AC124: % | AD124: PTS
A125: PRAHRAN | C125: PEARCE | F125: LYONS | I125: PROBYN | L125: JOHNSON | N125: THOMPSON | Q125: FAUL
A126: BRIGHTON | C126: HALLAHAN | F126: FROUDE | I126: MCINDOE | L126: HALL | N126: WILLIAMSON | Q126: MELVIN | W126: PRESTON | X126: 3 | Y126: 0 | Z126: 0 | AA126: 448 | AB126: 244 | AC126: 183.60655737704917 | AD126: 12
A127: GOALKICKERS | W127: PRAHRAN | X127: 3 | Y127: 0 | Z127: 0 | AA127: 445 | AB127: 267 | AC127: 166.67 | AD127: 12
A128: PRAHRAN | C128: PEARCE 8 | E128: LYONS 7 | G128: O'DONNELL 2 | J128: WILLIAMS | M128: BULGER | O128: WHITE | Q128: GRAVELL | S128: PROBYN | W128: COBURG | X128: 2 | Y128: 1 | Z128: 0 | AA128: 391 | AB128: 249 | AC128: 157.02811244979921 | AD128: 8
A129: BRIGHTON | C129: LUCAS 4 | F129: CONNELL | I129: CONDON | K129: FINDLAY | M129: WALSH | O129: KING | W129: BRUNSWICK | X129: 2 | Y129: 1 | Z129: 0 | AA129: 382 | AB129: 295 | AC129: 129.4915254237288 | AD129: 8
A131: WILLIAMSTOWN | C131: 1 | D131: 4 | E131: =C131*6+D131 -> 10 | G131: 4 | H131: 11 | I131: =G131*6+H131 -> 35 | K131: 6 | L131: 18 | M131: =K131*6+L131 -> 54 | O131: 9 | P131: 20 | Q131: =O131*6+P131 -> 74 | S131: WILLIAMSTOWN | W131: WILLIAMSTOWN | X131: 2 | Y131: 1 | Z131: 0 | AA131: 344 | AB131: 271 | AC131: 126.94 | AD131: 8
A132: COBURG | C132: 1 | D132: 3 | E132: =C132*6+D132 -> 9 | G132: 3 | H132: 4 | I132: =G132*6+H132 -> 22 | K132: 9 | L132: 5 | M132: =K132*6+L132 -> 59 | O132: 10 | P132: 9 | Q132: =O132*6+P132 -> 69 | S132: MANCHESTER | W132: PORT MELBOURNE | X132: 2 | Y132: 1 | Z132: 0 | AA132: 319 | AB132: 267 | AC132: 119.47565543071161 | AD132: 8
A133: BEST PLAYERS | W133: BRIGHTON | X133: 2 | Y133: 1 | Z133: 0 | AA133: 315 | AB133: 347 | AC133: 90.778097982708928 | AD133: 8
A134: WILLIAMSTOWN | C134: FOTHERGILL | F134: FITCH | I134: TODD | K134: LE SUEUR | N134: WILCOX | Q134: COOPER | W134: OAKLEIGH | X134: 1 | Y134: 2 | Z134: 0 | AA134: 346 | AB134: 309 | AC134: 111.97411003236246 | AD134: 4
A135: COBURG | C135: ATKINSON | F135: LONSDALE | I135: PRATT | K135: MULLENGER | N135: PROMNITZ | Q135: WILSON | W135: NORTHCOTE | X135: 1 | Y135: 2 | Z135: 0 | AA135: 275 | AB135: 303 | AC135: 90.759075907590756 | AD135: 4
A136: GOALKICKERS | W136: CAMBERWELL | X136: 0 | Y136: 3 | Z136: 0 | AA136: 300 | AB136: 442 | AC136: 67.87 | AD136: 0
A137: WILLIAMSTOWN | C137: TODD 3 | F137: GLASS 2 | I137: FOTHERGILL | L137: GEORGE | N137: VALLENCE | Q137: FITCH | W137: YARRAVILLE | X137: 0 | Y137: 3 | Z137: 0 | AA137: 201 | AB137: 438 | AC137: 45.89 | AD137: 0
A138: COBURG | C138: PRATT 5 | F138: BROWN 2 | I138: HORE 2 | K138: ESDALE | W138: SANDRINGHAM | X138: 0 | Y138: 3 | Z138: 0 | AA138: 191 | AB138: 525 | AC138: 36.38095238095238 | AD138: 0
A140: PRESTON | C140: 0 | D140: 3 | E140: =C140*6+D140 -> 3 | G140: 4 | H140: 9 | I140: =G140*6+H140 -> 33 | K140: 8 | L140: 11 | M140: =K140*6+L140 -> 59 | O140: 13 | P140: 19 | Q140: =O140*6+P140 -> 97 | S140: OAKLEIGH
A141: OAKLEIGH | C141: 1 | D141: 9 | E141: =C141*6+D141 -> 15 | G141: 3 | H141: 15 | I141: =G141*6+H141 -> 33 | K141: 9 | L141: 19 | M141: =K141*6+L141 -> 73 | O141: 11 | P141: 25 | Q141: =O141*6+P141 -> 91 | S141: BATT
A142: BEST PLAYERS
A143: PRESTON | C143: NORMAN | F143: MASLEN | I143: MINNEY | L143: LYNCH | O143: CLARKE | Q143: ROSS
A144: OAKLEIGH | C144: O'DONOGHUE | F144: HALL | I144: COMERFORD | L144: BRENCHLEY | O144: WEISS | Q144: BEARD
A145: GOALKICKERS
A146: PRESTON | C146: LYNCH 2 | E146: EVERETT 2 | G146: TAYLOR 2 | I146: DUNSTONE | K146: CALVERT | M146: ROSS | N146: NORMAN | P146: DOWLING | R146: BROWN | U146: SEEDSMAN
A147: OAKLEIGH | C147: HALL 5 | F147: BRENCHLEY 2 | J147: WATSON 2 | M147: WILMOT | O147: BEARD
A149: BRUNSWICK | C149: 6 | D149: 3 | E149: =C149*6+D149 -> 39 | G149: 19 | H149: 9 | I149: =G149*6+H149 -> 123 | K149: 22 | L149: 14 | M149: =K149*6+L149 -> 146 | O149: 27 | P149: 21 | Q149: =O149*6+P149 -> 183 | S149: BEACH ROAD
A150: SANDRINGHAM | C150: 1 | D150: 4 | E150: =C150*6+D150 -> 10 | G150: 1 | H150: 6 | I150: =G150*6+H150 -> 12 | K150: 2 | L150: 13 | M150: =K150*6+L150 -> 25 | O150: 4 | P150: 15 | Q150: =O150*6+P150 -> 39 | S150: MERRINGTON
A151: BEST PLAYERS
A152: BRUNSWICK | C152: CRAWFORD | F152: McELROY | I152: JONES | L152: DOWLING | O152: FAY | Q152: COOLEY
A153: SANDRINGHAM | C153: ALLISTER | F153: NAMM | I153: WEBER | L153: LINDEN | O153: CAVE | Q153: MILLER
A154: GOALKICKERS
A155: BRUNSWICK | C155: McELROY 11 | F155: JONES 5 | H155: DOWLING 4 | J155: BAILEY 3 | L155: FAY | M155: COOLEY | O155: CRAWFORD | R155: CAMPBELL
A156: SANDRINGHAM | C156: PRICE 2 | F156: KENT | H156: AMINDE
A158: NORTHCOTE | C158: 1 | D158: 4 | E158: =C158*6+D158 -> 10 | G158: 6 | H158: 12 | I158: =G158*6+H158 -> 48 | K158: 11 | L158: 14 | M158: =K158*6+L158 -> 80 | O158: 16 | P158: 18 | Q158: =O158*6+P158 -> 114 | S158: NORTHCOTE
A159: YARRAVILLE | C159: 1 | D159: 2 | E159: =C159*6+D159 -> 8 | G159: 1 | H159: 3 | I159: =G159*6+H159 -> 9 | K159: 4 | L159: 6 | M159: =K159*6+L159 -> 30 | O159: 8 | P159: 7 | Q159: =O159*6+P159 -> 55 | S159: GREGORY
A160: BEST PLAYERS
A161: NORTHCOTE | C161: STREETER | F161: SCHUTT | I161: WILSON | L161: KENNY | O161: T SMITH | R161: O'HALLORAN
A162: YARRAVILLE | C162: SIMPSON | F162: WARNER | I162: DOWER | L162: ATKINSON | O162: E BRETHERTON | R162: WHITE
A163: GOALKICKERS
A164: NORTHCOTE | C164: WHITE 8 | F164: ATKINSON 3 | I164: DUDLEY 2 | L164: KINGSTON | O164: McNAMEE | R164: SIMPSON
A165: YARRAVILLE | C165: ALSOP 4 | F165: RANN 2 | I165: McLAREN | L165: SCHUTT
A167: PORT MELBOURNE | C167: 2 | D167: 2 | E167: =C167*6+D167 -> 14 | G167: 7 | H167: 8 | I167: =G167*6+H167 -> 50 | K167: 12 | L167: 12 | M167: =K167*6+L167 -> 84 | O167: 13 | P167: 19 | Q167: =O167*6+P167 -> 97 | S167: PORT MELBOURNE
A168: CAMBERWELL | C168: 4 | D168: 2 | E168: =C168*6+D168 -> 26 | G168: 6 | H168: 7 | I168: =G168*6+H168 -> 43 | K168: 9 | L168: 15 | M168: =K168*6+L168 -> 69 | O168: 12 | P168: 15 | Q168: =O168*6+P168 -> 87 | S168: GROVES
A169: BEST PLAYERS
A170: PORT MELBOURNE | C170: ROBERTSON | F170: LAHIFF | I170: STEIGENBERGER | M170: RICHES | O170: TANNER | R170: GOLDSMITH
A171: CAMBERWELL | C171: NASH | F171: AUSTEN | I171: ANDERSON | M171: FARRELLY | O171: OLIVER | R171: SEELENMEYER
A172: GOALKICKERS
A173: PORT MELBOURNE | C173: ROBERTSON 5 | F173: ALLEN 2 | I173: LAHIFF 2 | K173: GOLDSMITH | N173: CASTLES | P173: RICHES | R173: GODFREDSON
A174: CAMBERWELL | C174: NASH 6 | F174: McKAY 2 | I174: OLIVER 2 | K174: FINN | M174: McPHERSON
A176: ROUND 4 | E176: 3RD MAY | J176: WEATHER | M176: FINE MILD | S176: PLAYED AT
D177: 1ST QTR | H177: 2ND QTR | L177: 3RD QTR | P177: FINAL | S177: PRESTON
A178: PRESTON | C178: 6 | D178: 5 | E178: =C178*6+D178 -> 41 | G178: 8 | H178: 7 | I178: =G178*6+H178 -> 55 | K178: 10 | L178: 13 | M178: =K178*6+L178 -> 73 | O178: 14 | P178: 16 | Q178: =O178*6+P178 -> 100 | S178: UMPIRE | X178: LADDER | AB178: ROUND | AD178: 4
A179: PRAHRAN | C179: 4 | D179: 1 | E179: =C179*6+D179 -> 25 | G179: 7 | H179: 8 | I179: =G179*6+H179 -> 50 | K179: 10 | L179: 15 | M179: =K179*6+L179 -> 75 | O179: 13 | P179: 17 | Q179: =O179*6+P179 -> 95 | S179: GROVES
A180: BEST PLAYERS | W180: TEAM | X180: W | Y180: L | Z180: D | AA180: FOR | AB180: AGST | AC180: % | AD180: PTS
A181: PRESTON | C181: LEISHMAN | F181: LYNCH | I181: MASLEN | K181: MINNEY | N181: DEACON | Q181: ROSS
A182: PRAHRAN | C182: JOHNSON | F182: NEWTON | I182: FAUL | K182: THOMPSON | N182: BENNISON | Q182: PEARCE | W182: PRESTON | X182: 4 | Y182: 0 | Z182: 0 | AA182: 548 | AB182: 339 | AC182: 161.65191740412979 | AD182: 16
A183: GOALKICKERS | W183: COBURG | X183: 3 | Y183: 1 | Z183: 0 | AA183: 543 | AB183: 320 | AC183: 169.6875 | AD183: 12
A184: PRESTON | C184: LYNCH 4 | E184: ROSS 2 | G184: DUNSTONE 2 | J184: TAYLOR 2 | M184: LEISHMAN | O184: DOWLING | Q184: DEACON | S184: BROWN | W184: PRAHRAN | X184: 3 | Y184: 1 | Z184: 0 | AA184: 540 | AB184: 367 | AC184: 147.14 | AD184: 12
A185: PRAHRAN | C185: PEARCE 3 | E185: DAVEY 3 | G185: BULGER 2 | I185: O'DONNELL 2 | L185: WILLIAMS | N185: WHITE | P185: LYONS | W185: BRUNSWICK | X185: 3 | Y185: 1 | Z185: 0 | AA185: 534 | AB185: 397 | AC185: 134.5088161209068 | AD185: 12
A187: PORT MELBOURNE | C187: 1 | D187: 7 | E187: =C187*6+D187 -> 13 | G187: 9 | H187: 11 | I187: =G187*6+H187 -> 65 | K187: 12 | L187: 12 | M187: =K187*6+L187 -> 84 | O187: 15 | P187: 18 | Q187: =O187*6+P187 -> 108 | S187: ELSTERNWICK PARK | W187: PORT MELBOURNE | X187: 3 | Y187: 1 | Z187: 0 | AA187: 427 | AB187: 337 | AC187: 126.70623145400593 | AD187: 12
A188: BRIGHTON | C188: 1 | D188: 9 | E188: =C188*6+D188 -> 15 | G188: 3 | H188: 11 | I188: =G188*6+H188 -> 29 | K188: 6 | L188: 13 | M188: =K188*6+L188 -> 49 | O188: 9 | P188: 16 | Q188: =O188*6+P188 -> 70 | S188: GREGORY | W188: WILLIAMSTOWN | X188: 3 | Y188: 1 | Z188: 0 | AA188: 466 | AB188: 392 | AC188: 118.88 | AD188: 12
A189: BEST PLAYERS | W189: BRIGHTON | X189: 2 | Y189: 2 | Z189: 0 | AA189: 385 | AB189: 455 | AC189: 84.615384615384613 | AD189: 8
A190: PORT MELBOURNE | C190: DOBSON | E190: GOLDSMITH | H190: LAHIFF | K190: HURLEY | N190: ROBERTSON | Q190: STEIGENBERGER | W190: OAKLEIGH | X190: 1 | Y190: 3 | Z190: 0 | AA190: 448 | AB190: 461 | AC190: 97.180043383947933 | AD190: 4
A191: BRIGHTON | C191: MELVIN | E191: HALLAHAN | H191: McINDOE | K191: HALL | N191: FROUDE | Q191: CONDON | W191: NORTHCOTE | X191: 1 | Y191: 3 | Z191: 0 | AA191: 346 | AB191: 455 | AC191: 76.043956043956044 | AD191: 4
A192: GOALKICKERS | Q192: HOSKING | W192: YARRAVILLE | X192: 1 | Y192: 3 | Z192: 0 | AA192: 346 | AB192: 544 | AC192: 63.6 | AD192: 4
A193: PORT MELBOURNE | C193: ROBERTSON 4 | F193: HURLEY 4 | I193: LAHIFF 2 | K193: FAIRWEATHER | N193: ALLEN | P193: REYNOLDS | R193: RICHES | W193: CAMBERWELL | X193: 0 | Y193: 4 | Z193: 0 | AA193: 421 | AB193: 564 | AC193: 74.65 | AD193: 0
A194: BRIGHTON | C194: MELVIN 3 | F194: CONDON 3 | I194: LUCAS | K194: McINDOE | M194: HARLEY | W194: SANDRINGHAM | X194: 0 | Y194: 4 | Z194: 0 | AA194: 297 | AB194: 670 | AC194: 44.328358208955223 | AD194: 0
A196: BRUNSWICK | C196: 8 | D196: 4 | E196: =C196*6+D196 -> 52 | G196: 11 | H196: 7 | I196: =G196*6+H196 -> 73 | K196: 17 | L196: 11 | M196: =K196*6+L196 -> 113 | O196: 23 | P196: 14 | Q196: =O196*6+P196 -> 152 | S196: BRUNSWICK
A197: OAKLEIGH | C197: 3 | D197: 3 | E197: =C197*6+D197 -> 21 | G197: 5 | H197: 9 | I197: =G197*6+H197 -> 39 | K197: 6 | L197: 13 | M197: =K197*6+L197 -> 49 | O197: 14 | P197: 18 | Q197: =O197*6+P197 -> 102 | S197: GEE
A198: BEST PLAYERS
A199: BRUNSWICK | C199: McELROY | F199: POWELL | I199: FAY | L199: GARDNER | O199: CRAWFORD | R199: HOBBA
A200: OAKLEIGH | C200: MARTIN | F200: BRENCHLEY | I200: WEISS | L200: REID | O200: KENNEDY | R200: LANNING
A201: GOALKICKERS
A202: BRUNSWICK | C202: WHITE 6 | F202: McELROY 5 | I202: DOWLING 4 | L202: CRAWFORD 2 | O202: GARDNER 2 | R202: WEBSTER 2 | V202: TOONE | X202: SCRIVEN
A203: OAKLEIGH | C203: TANNER 5 | F203: KENNEDY 3 | I203: BRENCHLEY 3 | L203: BEARD | N203: REID | P203: THOMPSON
A205: YARRAVILLE | C205: 5 | D205: 3 | E205: =C205*6+D205 -> 33 | G205: 9 | H205: 15 | I205: =G205*6+H205 -> 69 | K205: 14 | L205: 16 | M205: =K205*6+L205 -> 100 | O205: 21 | P205: 19 | Q205: =O205*6+P205 -> 145 | S205: YARRAVILLE
A206: SANDRINGHAM | C206: 5 | D206: 9 | E206: =C206*6+D206 -> 39 | G206: 9 | H206: 9 | I206: =G206*6+H206 -> 63 | K206: 13 | L206: 12 | M206: =K206*6+L206 -> 90 | O206: 15 | P206: 16 | Q206: =O206*6+P206 -> 106 | S206: BATT
A207: BEST PLAYERS
A208: YARRAVILLE | C208: WARDEN | F208: O'HALLORAN | I208: RAWLINGS | L208: TEMPEST | O208: SCHUTT | Q208: GARLICK
A209: SANDRINGHAM | C209: ALLISTER | F209: LINDEN | I209: WEBER | L209: CHAPPLE | O209: DINGLE | Q209: FOLLETT
A210: GOALKICKERS
A211: YARRAVILLE | C211: WARDEN 5 | F211: O'HALLORAN 4 | J211: TEMPEST 3 | M211: SCHUTT 3 | O211: T SMITH 2 | Q211: RAWLINGS | T211: KENNY | W211: BEVAN | X211: STREETER
A212: SANDRINGHAM | C212: ALLISTER 4 | F212: CHAPPLE 3 | I212: SCOTT 2 | K212: CAVE | M212: NOTTLE | O212: LINDEN | Q212: PRICE | S212: WEBER | U212: POLLARD
A214: COBURG | C214: 3 | D214: 3 | E214: =C214*6+D214 -> 21 | G214: 10 | H214: 10 | I214: =G214*6+H214 -> 70 | K214: 16 | L214: 15 | M214: =K214*6+L214 -> 111 | O214: 22 | P214: 20 | Q214: =O214*6+P214 -> 152 | S214: COBURG
A215: NORTHCOTE | C215: 4 | D215: 2 | E215: =C215*6+D215 -> 26 | G215: 6 | H215: 5 | I215: =G215*6+H215 -> 41 | K215: 8 | L215: 10 | M215: =K215*6+L215 -> 58 | O215: 10 | P215: 11 | Q215: =O215*6+P215 -> 71 | S215: APPLEBY
A216: BEST PLAYERS
A217: COBURG | C217: ATKINSON | F217: COLLINS | I217: MILTE | L217: PRATT | N217: BROWN | Q217: PROMNITZ
A218: NORTHCOTE | C218: HISCOX | F218: WALLIS | I218: R BAGULEY | L218: DOWER | N218: HART | Q218: DRYDEN
A219: GOALKICKERS
A220: COBURG | C220: PRATT 13 | F220: COLLINS 3 | I220: BROWN 2 | K220: ESDALE | M220: HALL | N220: MULLENGER | Q220: MILTE
A221: NORTHCOTE | C221: WHITE 3 | F221: LAMBOURN 2 | I221: SIMPSON 2 | L221: E BRETHERTON | O221: HISCOX | Q221: OLIVER
A223: WILLIAMSTOWN | C223: 5 | D223: 3 | E223: =C223*6+D223 -> 33 | G223: 8 | H223: 10 | I223: =G223*6+H223 -> 58 | K223: 13 | L223: 14 | M223: =K223*6+L223 -> 92 | O223: 17 | P223: 20 | Q223: =O223*6+P223 -> 122 | S223: CAMBERWELL
A224: CAMBERWELL | C224: 4 | D224: 5 | E224: =C224*6+D224 -> 29 | G224: 6 | H224: 14 | I224: =G224*6+H224 -> 50 | K224: 11 | L224: 16 | M224: =K224*6+L224 -> 82 | O224: 17 | P224: 19 | Q224: =O224*6+P224 -> 121 | S224: MERRINGTON
A225: BEST PLAYERS
A226: WILLIAMSTOWN | C226: TODD | E226: FOTHERGILL | H226: GLASS | K226: CHISHOLM | M226: VALLENCE | P226: FITCH
A227: CAMBERWELL | C227: NASH | E227: HORKINGS | H227: JORGENSON | K227: TOOHEY | M227: FINN | P227: SEELENMEYER
A228: GOALKICKERS
A229: WILLIAMSTOWN | C229: VALLENCE 6 | F229: TODD 4 | H229: FOTHERGILL 3 | K229: GLASS 2 | M229: FITCH | O229: GEORGE
A230: CAMBERWELL | C230: NASH 8 | F230: AUSTEN 3 | I230: CLAMP 2 | K230: WHITEHEAD 2 | N230: HENDERSON | Q230: BOND
A232: ROUND 5 | E232: 10TH MAY | H232: WEATHER | K232: SHOWERS COOL STRONG S.W. WIND | S232: PLAYED AT
D233: 1ST QTR | H233: 2ND QTR | L233: 3RD QTR | P233: FINAL | S233: TOORAK PARK
A234: PRAHRAN | C234: 3 | D234: 6 | E234: =C234*6+D234 -> 24 | G234: 5 | H234: 13 | I234: =G234*6+H234 -> 43 | K234: 10 | L234: 14 | M234: =K234*6+L234 -> 74 | O234: 15 | P234: 17 | Q234: =O234*6+P234 -> 107 | S234: UMPIRE | X234: LADDER | AB234: ROUND | AD234: 5
A235: BRUNSWICK | C235: 5 | D235: 2 | E235: =C235*6+D235 -> 32 | G235: 8 | H235: 3 | I235: =G235*6+H235 -> 51 | K235: 11 | L235: 12 | M235: =K235*6+L235 -> 78 | O235: 13 | P235: 15 | Q235: =O235*6+P235 -> 93 | S235: GROVES
A236: BEST PLAYERS | W236: TEAM | X236: W | Y236: L | Z236: D | AA236: FOR | AB236: AGST | AC236: % | AD236: PTS
A237: PRAHRAN | C237: TUCKER | E237: RAYMENT | H237: WILLIAMS | K237: JOHNSON | N237: PROBYN | Q237: FAUL
A238: BRUNSWICK | C238: FAY | E238: POWELL | H238: STANDFIELD | K238: CHALLENGER | N238: WEBSTER | Q238: McKERNAN | W238: COBURG | X238: 4 | Y238: 1 | Z238: 0 | AA238: 712 | AB238: 392 | AC238: 181.63265306122449 | AD238: 16
A239: GOALKICKERS | W239: PRAHRAN | X239: 4 | Y239: 1 | Z239: 0 | AA239: 647 | AB239: 460 | AC239: 140.65 | AD239: 16
A240: PRAHRAN | C240: BULGER 4 | F240: PEARCE 3 | I240: O'DONNELL 3 | L240: DAVEY 2 | N240: GRAVELL 2 | Q240: WHITE | W240: PRESTON | X240: 4 | Y240: 1 | Z240: 0 | AA240: 627 | AB240: 452 | AC240: 138.71681415929203 | AD240: 16
A241: BRUNSWICK | C241: WEBSTER 3 | F241: TOONE 2 | H241: CRAWFORD 2 | K241: CRISP | M241: KEMP | N241: DOWLING | P241: McELROY | R241: WHITE | W241: PORT MELBOURNE | X241: 4 | Y241: 1 | Z241: 0 | AA241: 540 | AB241: 416 | AC241: 129.80769230769232 | AD241: 16
Q242: GARDNER
A243: PORT MELBOURNE | C243: 9 | D243: 4 | E243: =C243*6+D243 -> 58 | G243: 9 | H243: 6 | I243: =G243*6+H243 -> 60 | K243: 14 | L243: 16 | M243: =K243*6+L243 -> 100 | O243: 16 | P243: 17 | Q243: =O243*6+P243 -> 113 | S243: PORT MELBOURNE | W243: WILLIAMSTOWN | X243: 4 | Y243: 1 | Z243: 0 | AA243: 583 | AB243: 453 | AC243: 128.7 | AD243: 16
A244: PRESTON | C244: 2 | D244: 0 | E244: =C244*6+D244 -> 12 | G244: 8 | H244: 3 | I244: =G244*6+H244 -> 51 | K244: 9 | L244: 5 | M244: =K244*6+L244 -> 59 | O244: 12 | P244: 7 | Q244: =O244*6+P244 -> 79 | S244: BATT | W244: BRUNSWICK | X244: 3 | Y244: 2 | Z244: 0 | AA244: 627 | AB244: 504 | AC244: 124.4047619047619 | AD244: 12
A245: BEST PLAYERS | W245: OAKLEIGH | X245: 2 | Y245: 3 | Z245: 0 | AA245: 570 | AB245: 571 | AC245: 99.824868651488615 | AD245: 8
A246: PORT MELBOURNE | C246: LAHIFF | E246: GOSS | H246: HURLRY | K246: ONLEY | N246: HOSKING | Q246: ROBERTSON | W246: BRIGHTON | X246: 2 | Y246: 3 | Z246: 0 | AA246: 499 | AB246: 581 | AC246: 85.88640275387263 | AD246: 8
A247: PRESTON | C247: LYNCH | E247: MATTHEWS | H247: HARRY | K247: MASLEN | N247: STEWART | Q247: DEACON | W247: CAMBERWELL | X247: 1 | Y247: 4 | Z247: 0 | AA247: 547 | AB247: 678 | AC247: 80.68 | AD247: 4
A248: GOALKICKERS | W248: NORTHCOTE | X248: 1 | Y248: 4 | Z248: 0 | AA248: 407 | AB248: 572 | AC248: 71.15384615384616 | AD248: 4
A249: PORT MELBOURNE | C249: LAHIFF 6 | F249: HURLEY 4 | I249: FAIRWEATHER 3 | M249: KELLY | O249: RICHES | Q249: ROBERTSON | W249: YARRAVILLE | X249: 1 | Y249: 4 | Z249: 0 | AA249: 456 | AB249: 666 | AC249: 68.47 | AD249: 4
A250: PRESTON | C250: LYNCH 6 | F250: DUNSTONE 2 | I250: LEISHMAN | L250: ROSS | N250: SEEDSMAN | Q250: TAYLOR | W250: SANDRINGHAM | X250: 0 | Y250: 5 | Z250: 0 | AA250: 369 | AB250: 839 | AC250: 43.980929678188318 | AD250: 0
A252: WILLIAMSTOWN | C252: 5 | D252: 6 | E252: =C252*6+D252 -> 36 | G252: 6 | H252: 7 | I252: =G252*6+H252 -> 43 | K252: 13 | L252: 14 | M252: =K252*6+L252 -> 92 | O252: 17 | P252: 15 | Q252: =O252*6+P252 -> 117 | S252: WILLIAMSTOWN
A253: NORTHCOTE | C253: 1 | D253: 1 | E253: =C253*6+D253 -> 7 | G253: 4 | H253: 7 | I253: =G253*6+H253 -> 31 | K253: 6 | L253: 7 | M253: =K253*6+L253 -> 43 | O253: 8 | P253: 13 | Q253: =O253*6+P253 -> 61 | S253: APPLEBY
A254: BEST PLAYERS
A255: WILLIAMSTOWN | C255: FOTHERGILL | F255: DELLER | I255: CUTTING | L255: GLASS | O255: JOHNSON | R255: TAYLOR
A256: NORTHCOTE | C256: SIMPSON | F256: E HART | I256: HISCOX | L256: DOWER | O256: D BRETHERTON | R256: E BRETHERTON
A257: GOALKICKERS
A258: WILLIAMSTOWN | C258: FOTHERGILL 6 | F258: GREEN 3 | H258: VALLENCE 3 | K258: JAMIESON 2 | N258: GLASS | P258: COOPER | R258: HARRIS
A259: NORTHCOTE | C259: SIMPSON (2) | F259: WHITE (2) | H259: KINGSTON | K259: ATKINSON | N259: HISCOX | P259: D BRETHERTON
A261: OAKLEIGH | C261: 3 | D261: 4 | E261: =C261*6+D261 -> 22 | G261: 10 | H261: 12 | I261: =G261*6+H261 -> 72 | K261: 11 | L261: 15 | M261: =K261*6+L261 -> 81 | O261: 17 | P261: 20 | Q261: =O261*6+P261 -> 122 | S261: OAKLEIGH
A262: YARRAVILLE | C262: 8 | D262: 3 | E262: =C262*6+D262 -> 51 | G262: 12 | H262: 4 | I262: =G262*6+H262 -> 76 | K262: 14 | L262: 7 | M262: =K262*6+L262 -> 91 | O262: 17 | P262: 8 | Q262: =O262*6+P262 -> 110 | S262: MERRINGTON
A263: BEST PLAYERS
A264: OAKLEIGH | C264: KENNEDY | F264: McALLISTER | I264: HUTCHESON | L264: BICKERTON | O264: LANNING | Q264: WATSON
A265: YARRAVILLE | C265: O'HALLORAN | F265: SCHUTT | I265: STREETER | L265: RANN | O265: WILSON | Q265: WARDEN
A266: GOALKICKERS
A267: OAKLEIGH | C267: KENNEDY 3 | F267: CLARKE 3 | I267: McKENZIE 3 | L267: TANNER 2 | N267: WATSON 2 | Q267: HALL | S267: McALLISTER | V267: BEARD | X267: BRENCHLEY
A268: YARRAVILLE | C268: WARDEN 5 | F268: NEILL 4 | I268: CRAWFORD 3 | L268: B McVEIGH 2 | O268: SCHUTT | Q268: RAWLINGS | T268: KENNY
A270: CAMBERWELL | C270: 4 | D270: 6 | E270: =C270*6+D270 -> 30 | G270: 9 | H270: 11 | I270: =G270*6+H270 -> 65 | K270: 13 | L270: 14 | M270: =K270*6+L270 -> 92 | O270: 18 | P270: 18 | Q270: =O270*6+P270 -> 126 | S270: CAMBERWELL
A271: BRIGHTON | C271: 3 | D271: 5 | E271: =C271*6+D271 -> 23 | G271: 8 | H271: 12 | I271: =G271*6+H271 -> 60 | K271: 10 | L271: 19 | M271: =K271*6+L271 -> 79 | O271: 15 | P271: 24 | Q271: =O271*6+P271 -> 114 | S271: GEE
A272: BEST PLAYERS
A273: CAMBERWELL | C273: HORKINGS | F273: L NASH | I273: SHARPLES | L273: ANDERSON | O273: HOPKINS | Q273: FINN
A274: BRIGHTON | C274: HALLAHAN | F274: BUCKLEY | I274: CONDON | L274: NASH | O274: HUNTER | Q274: KING
A275: GOALKICKERS
A276: CAMBERWELL | C276: L NASH 8 | F276: HOPKINS 3 | I276: AUSTEN 2 | L276: JORGENSON 2 | O276: BOND | Q276: ROSS | S276: CLAMP
A277: BRIGHTON | C277: HARLEY 6 | F277: KING 3 | I277: HUNTER 2 | L277: CONDON | N277: HALL | P277: WALSH | R277: J NASH
A279: COBURG | C279: 7 | D279: 1 | E279: =C279*6+D279 -> 43 | G279: 14 | H279: 4 | I279: =G279*6+H279 -> 88 | K279: 21 | L279: 6 | M279: =K279*6+L279 -> 132 | O279: 26 | P279: 13 | Q279: =O279*6+P279 -> 169 | S279: BEACH ROAD
A280: SANDRINGHAM | C280: 2 | D280: 2 | E280: =C280*6+D280 -> 14 | G280: 4 | H280: 3 | I280: =G280*6+H280 -> 27 | K280: 6 | L280: 5 | M280: =K280*6+L280 -> 41 | O280: 11 | P280: 6 | Q280: =O280*6+P280 -> 72 | S280: GREGORY
A281: BEST PLAYERS
A282: COBURG | C282: PRATT | E282: GLENISTER | H282: WILSON | K282: MULLENGER | N282: PROMNITZ | Q282: LONSDALE
A283: SANDRINGHAM | C283: MILLER | E283: PETTIONA | H283: ALLISTER | K283: COPSEY | N283: NAMM | Q283: CAVE
A284: GOALKICKERS
A285: COBURG | C285: PRATT 12 | F285: GLENISTER 5 | I285: MULLENGER 3 | L285: HORE 2 | N285: BROWN (2) | Q285: COLLINS | S285: McLEY
A286: SANDRINGHAM | C286: ALLISTER 5 | F286: CHAPPLE 2 | I286: PETTIONA | L286: LINDEN | N286: POND | P286: SMAIL
A288: ROUND 6 | E288: 17TH MAY | H288: WEATHER | K288: COOL CLOUDY BUT FINE S.W. BREEZE | S288: PLAYED AT
D289: 1ST QTR | H289: 2ND QTR | L289: 3RD QTR | P289: FINAL | S289: BRUNSWICK
A290: BRUNSWICK | C290: 5 | D290: 6 | E290: =C290*6+D290 -> 36 | G290: 8 | H290: 9 | I290: =G290*6+H290 -> 57 | K290: 10 | L290: 12 | M290: =K290*6+L290 -> 72 | O290: 12 | P290: 14 | Q290: =O290*6+P290 -> 86 | S290: UMPIRE | X290: LADDER | AB290: ROUND | AD290: 6
A291: PORT MELBOURNE | C291: 3 | D291: 2 | E291: =C291*6+D291 -> 20 | G291: 5 | H291: 4 | I291: =G291*6+H291 -> 34 | K291: 10 | L291: 6 | M291: =K291*6+L291 -> 66 | O291: 12 | P291: 12 | Q291: =O291*6+P291 -> 84 | S291: PARRIS
A292: BEST PLAYERS | W292: TEAM | X292: W | Y292: L | Z292: D | AA292: FOR | AB292: AGST | AC292: % | AD292: PTS
A293: BRUNSWICK | C293: FAY | E293: CHALLENGER | I293: McKERNAN | L293: STANDFIELD | O293: HOBBA | Q293: GARDNER
A294: PORT MELBOURNE | C294: HAYES | E294: LAHIFF | I294: TANNER | L294: CASTLES | O294: HURLEY | Q294: ALSOP | W294: COBURG | X294: 5 | Y294: 1 | Z294: 0 | AA294: 858 | AB294: 500 | AC294: 171.6 | AD294: 20
A295: GOALKICKERS | W295: PRAHRAN | X295: 5 | Y295: 1 | Z295: 0 | AA295: 803 | AB295: 522 | AC295: 153.83 | AD295: 20
A296: BRUNSWICK | C296: HUGHES 5 | F296: HUNTER 2 | I296: WEBSTER 2 | L296: CRISP | N296: DOWLING | Q296: McELROY | W296: PRESTON | X296: 5 | Y296: 1 | Z296: 0 | AA296: 765 | AB296: 555 | AC296: 137.83783783783784 | AD296: 20
A297: PORT MELBOURNE | C297: HURLEY 4 | F297: LAHIFF 3 | I297: PANNELL 2 | L297: FAIRWEATHER | O297: GOLDSMITH | R297: CASTLES | W297: WILLIAMSTOWN | X297: 5 | Y297: 1 | Z297: 0 | AA297: 707 | AB297: 563 | AC297: 125.58 | AD297: 20
A299: WILLIAMSTOWN | C299: 6 | D299: 5 | E299: =C299*6+D299 -> 41 | G299: 9 | H299: 6 | I299: =G299*6+H299 -> 60 | K299: 17 | L299: 10 | M299: =K299*6+L299 -> 112 | O299: 19 | P299: 10 | Q299: =O299*6+P299 -> 124 | S299: ELSTERNWICK PARK | W299: PORT MELBOURNE | X299: 4 | Y299: 2 | Z299: 0 | AA299: 624 | AB299: 502 | AC299: 124.30278884462152 | AD299: 16
A300: BRIGHTON | C300: 2 | D300: 1 | E300: =C300*6+D300 -> 13 | G300: 11 | H300: 7 | I300: =G300*6+H300 -> 73 | K300: 14 | L300: 8 | M300: =K300*6+L300 -> 92 | O300: 16 | P300: 14 | Q300: =O300*6+P300 -> 110 | S300: PREST | W300: BRUNSWICK | X300: 4 | Y300: 2 | Z300: 0 | AA300: 713 | AB300: 588 | AC300: 121.25850340136054 | AD300: 16
A301: BEST PLAYERS | W301: OAKLEIGH | X301: 2 | Y301: 4 | Z301: 0 | AA301: 678 | AB301: 717 | AC301: 94.560669456066947 | AD301: 8
A302: WILLIAMSTOWN | C302: FOTHERGILL | F302: DELLER | I302: GLASS | L302: WILCOX | O302: RYAN | Q302: TAYLOR | W302: BRIGHTON | X302: 2 | Y302: 4 | Z302: 0 | AA302: 609 | AB302: 705 | AC302: 86.38297872340425 | AD302: 8
A303: BRIGHTON | C303: MELVIN | F303: HALLAHAN | I303: LUCAS | L303: ALVIN | O303: SCOTT | Q303: DEAN | W303: NORTHCOTE | X303: 2 | Y303: 4 | Z303: 0 | AA303: 531 | AB303: 631 | AC303: 84.152139461172737 | AD303: 8
A304: GOALKICKERS | W304: CAMBERWELL | X304: 1 | Y304: 5 | Z304: 0 | AA304: 650 | AB304: 816 | AC304: 79.66 | AD304: 4
A305: WILLIAMSTOWN | C305: FOTHERGILL 7 | F305: GLASS 4 | H305: TAYLOR 4 | J305: VALLENCE 2 | M305: McTAGGART | P305: JAMIESON | W305: YARRAVILLE | X305: 1 | Y305: 5 | Z305: 0 | AA305: 518 | AB305: 822 | AC305: 63.02 | AD305: 4
A306: BRIGHTON | C306: HARLEY 3 | F306: DEAN 3 | H306: HUNTER 3 | J306: CONDON 2 | M306: KING 2 | O306: SCOTT 2 | Q306: WEBER | W306: SANDRINGHAM | X306: 0 | Y306: 6 | Z306: 0 | AA306: 428 | AB306: 963 | AC306: 44.444444444444443 | AD306: 0
A308: COBURG | C308: 2 | D308: 2 | E308: =C308*6+D308 -> 14 | G308: 11 | H308: 7 | I308: =G308*6+H308 -> 73 | K308: 15 | L308: 11 | M308: =K308*6+L308 -> 101 | O308: 21 | P308: 20 | Q308: =O308*6+P308 -> 146 | S308: COBURG
A309: OAKLEIGH | C309: 8 | D309: 4 | E309: =C309*6+D309 -> 52 | G309: 9 | H309: 6 | I309: =G309*6+H309 -> 60 | K309: 12 | L309: 11 | M309: =K309*6+L309 -> 83 | O309: 16 | P309: 12 | Q309: =O309*6+P309 -> 108 | S309: GREGORY
A310: BEST PLAYERS
A311: COBURG | C311: HALL | F311: COLLINS | I311: PRATT | L311: LONSDALE | O311: ATKINSON | R311: SITCH
A312: OAKLEIGH | C312: BICKERTON | F312: WEISS | I312: REID | L312: HALL | O312: BRENCHLEY | R312: WATSON
A313: GOALKICKERS
A314: COBURG | C314: PRATT 7 | F314: COLLINS 4 | I314: MULLENGER 3 | L314: McLEY 2 | N314: LONSDALE 2 | Q314: GLENISTER | T314: HALL | V314: HORE
A315: OAKLEIGH | C315: WATSON 4 | F315: HALL 3 | I315: BRENCHLEY 3 | L315: TANNER 3 | N315: CLARKE | P315: JARRETT | R315: WHITE
A317: PRESTON | C317: 4 | D317: 5 | E317: =C317*6+D317 -> 29 | G317: 14 | H317: 7 | I317: =G317*6+H317 -> 91 | K317: 16 | L317: 12 | M317: =K317*6+L317 -> 108 | O317: 20 | P317: 18 | Q317: =O317*6+P317 -> 138 | S317: PRESTON
A318: CAMBERWELL | C318: 5 | D318: 3 | E318: =C318*6+D318 -> 33 | G318: 8 | H318: 6 | I318: =G318*6+H318 -> 54 | K318: 11 | L318: 9 | M318: =K318*6+L318 -> 75 | O318: 15 | P318: 13 | Q318: =O318*6+P318 -> 103 | S318: BATT
A319: BEST PLAYERS
A320: PRESTON | C320: LYNCH | E320: NORMAN | H320: MASLEN | K320: DOWLING | N320: ROSS | Q320: CALVERT
A321: CAMBERWELL | C321: NASH | E321: HOPKINS | H321: AUSTEN | K321: FINN | N321: HORKINGS | Q321: ANDERSON
A322: GOALKICKERS
A323: PRESTON | C323: LYNCH 9 | F323: DUNSTONE 3 | I323: ROSS 2 | K323: DOWLING 2 | N323: NORMAN 2 | Q323: SEEDSMAN 2
A324: CAMBERWELL | C324: NASH 8 | F324: HOPKINS 3 | I324: AUSTEN 2 | L324: WHITEHEAD 2
A326: NORTHCOTE | C326: 8 | D326: 1 | E326: =C326*6+D326 -> 49 | G326: 12 | H326: 8 | I326: =G326*6+H326 -> 80 | K326: 16 | L326: 13 | M326: =K326*6+L326 -> 109 | O326: 18 | P326: 16 | Q326: =O326*6+P326 -> 124 | S326: NORTHCOTE
A327: SANDRINGHAM | C327: 1 | D327: 2 | E327: =C327*6+D327 -> 8 | G327: 3 | H327: 4 | I327: =G327*6+H327 -> 22 | K327: 3 | L327: 7 | M327: =K327*6+L327 -> 25 | O327: 8 | P327: 11 | Q327: =O327*6+P327 -> 59 | S327: MERRINGTON
A328: BEST PLAYERS
A329: NORTHCOTE | C329: E HART | E329: E BRETHERTON | I329: ALLEN | L329: WHITE | O329: ATKINSON | R329: HISCOX
A330: SANDRINGHAM | C330: MILLER | E330: ALLISTER | I330: NAMM | L330: LINDEN | O330: POND | R330: SCOTT
A331: GOALKICKERS
A332: NORTHCOTE | C332: WHITE 10 | F332: ATKINSON 5 | I332: O BAGULEY | L332: DUNCAN | N332: LEMPRIERE
A333: SANDRINGHAM | C333: ALLISTER 3 | F333: POND 2 | H333: DINGLE | J333: SCOTT | L333: WEBER
A335: PRAHRAN | C335: 2 | D335: 1 | E335: =C335*6+D335 -> 13 | G335: 9 | H335: 11 | I335: =G335*6+H335 -> 65 | K335: 12 | L335: 13 | M335: =K335*6+L335 -> 85 | O335: 23 | P335: 18 | Q335: =O335*6+P335 -> 156 | S335: YARRAVILLE
A336: YARRAVILLE | C336: 2 | D336: 7 | E336: =C336*6+D336 -> 19 | G336: 4 | H336: 9 | I336: =G336*6+H336 -> 33 | K336: 8 | L336: 13 | M336: =K336*6+L336 -> 61 | O336: 8 | P336: 14 | Q336: =O336*6+P336 -> 62 | S336: APPLEBY
A337: BEST PLAYERS
A338: PRAHRAN | C338: LYONS | E338: WILLIAMS | H338: RAYMENT | K338: THOMPSON | N338: JOHNSON | Q338: TUCKER
A339: YARRAVILLE | C339: KENNY | E339: B McVEIGH | H339: NEILL | K339: WILSON | N339: STREETER | Q339: DAY
A340: GOALKICKERS
A341: PRAHRAN | C341: LYONS 11 | F341: O'DONNELL 4 | I341: GRAVELL 3 | L341: WILLIAMS 2 | O341: DAVEY | Q341: ROLFE | S341: WHITE
A342: YARRAVILLE | C342: NEILL 2 | F342: ROBERTSON 2 | I342: B McVEIGH | L342: CRAWFORD | O342: H SMITH | Q342: RAWLINGS
A344: ROUND 7 | E344: 24TH MAY | J344: WEATHER | M344: SHOWERS COOL S.W. WIND | S344: PLAYED AT
D345: 1ST QTR | H345: 2ND QTR | L345: 3RD QTR | P345: FINAL | S345: TOORAK PARK
A346: PRAHRAN | C346: 7 | D346: 3 | E346: =C346*6+D346 -> 45 | G346: 15 | H346: 10 | I346: =G346*6+H346 -> 100 | K346: 21 | L346: 12 | M346: =K346*6+L346 -> 138 | O346: 25 | P346: 17 | Q346: =O346*6+P346 -> 167 | S346: UMPIRE | X346: LADDER | AB346: ROUND | AD346: 7
A347: COBURG | C347: 5 | D347: 2 | E347: =C347*6+D347 -> 32 | G347: 7 | H347: 6 | I347: =G347*6+H347 -> 48 | K347: 13 | L347: 12 | M347: =K347*6+L347 -> 90 | O347: 19 | P347: 15 | Q347: =O347*6+P347 -> 129 | S347: BATT
A348: BEST PLAYERS | W348: TEAM | X348: W | Y348: L | Z348: D | AA348: FOR | AB348: AGST | AC348: % | AD348: PTS
A349: PRAHRAN | C349: LYONS | F349: TUCKER | I349: RAYMENT | L349: WILLIAMS | O349: FAUL | Q349: JOHNSON
A350: COBURG | C350: MULLENGER | F350: SMITH | I350: WILSON | L350: PRATT | O350: McLEY | Q350: McILVENE | W350: WILLIAMSTOWN | X350: 6 | Y350: 1 | Z350: 0 | AA350: 900 | AB350: 589 | AC350: 152.8 | AD350: 24
A351: GOALKICKERS | W351: PRAHRAN | X351: 6 | Y351: 1 | Z351: 0 | AA351: 970 | AB351: 651 | AC351: 149 | AD351: 24
A352: PRAHRAN | C352: LYONS 11 | E352: WHITE 3 | G352: DAVEY 3 | I352: BOURNE 2 | K352: PEARCE 2 | M352: ROLFE 2 | O352: WILLIAMS | Q352: THOMPSON | W352: PRESTON | X352: 6 | Y352: 1 | Z352: 0 | AA352: 911 | AB352: 677 | AC352: 134.5642540620384 | AD352: 24
A353: COBURG | C353: PRATT 7 | E353: MULLENGER 3 | H353: COLLINS 2 | J353: McLEY 2 | L353: MILTE 2 | N353: McILVENE 2 | Q353: BROWN | W353: COBURG | X353: 5 | Y353: 2 | Z353: 0 | AA353: 987 | AB353: 667 | AC353: 147.98 | AD353: 20
A355: PRESTON | C355: 5 | D355: 1 | E355: =C355*6+D355 -> 31 | G355: 7 | H355: 5 | I355: =G355*6+H355 -> 47 | K355: 12 | L355: 8 | M355: =K355*6+L355 -> 80 | O355: 22 | P355: 14 | Q355: =O355*6+P355 -> 146 | S355: ELSTERNWICK PARK | W355: PORT MELBOURNE | X355: 5 | Y355: 2 | Z355: 0 | AA355: 776 | AB355: 555 | AC355: 139.81981981981983 | AD355: 20
A356: BRIGHTON | C356: 5 | D356: 1 | E356: =C356*6+D356 -> 31 | G356: 12 | H356: 2 | I356: =G356*6+H356 -> 74 | K356: 13 | L356: 5 | M356: =K356*6+L356 -> 83 | O356: 19 | P356: 8 | Q356: =O356*6+P356 -> 122 | S356: APPLEBY | W356: BRUNSWICK | X356: 4 | Y356: 3 | Z356: 0 | AA356: 815 | AB356: 711 | AC356: 114.62728551336146 | AD356: 16
A357: BEST PLAYERS | W357: OAKLEIGH | X357: 3 | Y357: 4 | Z357: 0 | AA357: 760 | AB357: 797 | AC357: 95.357590966122956 | AD357: 12
A358: PRESTON | C358: LYNCH | E358: DEACON | H358: MASLEN | K358: NORMAN | N358: DOWLING | Q358: EVERETT | W358: BRIGHTON | X358: 2 | Y358: 5 | Z358: 0 | AA358: 731 | AB358: 851 | AC358: 85.89894242068155 | AD358: 8
A359: BRIGHTON | C359: FROUDE | E359: HALLAHAN | H359: BUCKLEY | K359: WILLIAMSON | N359: MELVIN | Q359: ALVIN | W359: NORTHCOTE | X359: 2 | Y359: 5 | Z359: 0 | AA359: 611 | AB359: 713 | AC359: 85.694249649368871 | AD359: 8
A360: GOALKICKERS | W360: CAMBERWELL | X360: 2 | Y360: 5 | Z360: 0 | AA360: 773 | AB360: 918 | AC360: 84.2 | AD360: 8
A361: PRESTON | C361: LYNCH 10 | E361: DOWLING 4 | H361: LEISHMAN 2 | K361: DUNSTONE 2 | N361: CONNELLY 2 | Q361: J NORMAN | T361: BOYD | W361: YARRAVILLE | X361: 1 | Y361: 6 | Z361: 0 | AA361: 571 | AB361: 974 | AC361: 58.62 | AD361: 4
A362: BRIGHTON | C362: CONDON 4 | F362: HUNTER 4 | I362: SCOTT 3 | K362: NASH 2 | M362: DEAN 2 | O362: JACKSON | Q362: KING | S362: HARLEY | W362: SANDRINGHAM | X362: 0 | Y362: 7 | Z362: 0 | AA362: 454 | AB362: 1156 | AC362: 39.273356401384085 | AD362: 0
R363: MELVIN
A364: OAKLEIGH | C364: 2 | D364: 3 | E364: =C364*6+D364 -> 15 | G364: 5 | H364: 9 | I364: =G364*6+H364 -> 39 | K364: 6 | L364: 11 | M364: =K364*6+L364 -> 47 | O364: 11 | P364: 16 | Q364: =O364*6+P364 -> 82 | S364: OAKLEIGH
A365: NORTHCOTE | C365: 2 | D365: 3 | E365: =C365*6+D365 -> 15 | G365: 5 | H365: 7 | I365: =G365*6+H365 -> 37 | K365: 7 | L365: 9 | M365: =K365*6+L365 -> 51 | O365: 11 | P365: 14 | Q365: =O365*6+P365 -> 80 | S365: MERRINGTON
A366: BEST PLAYERS
A367: OAKLEIGH | C367: D RYAN | E367: COMERFORD | I367: BRENCHLEY | L367: KENNEDY | O367: McKENZIE | R367: COOMONS
A368: NORTHCOTE | C368: E HART | E368: DOWER | I368: DRYDEN | L368: HARLAND | O368: DUNCAN | R368: WHITE
A369: GOALKICKERS
A370: OAKLEIGH | C370: COMMONS 3 | F370: BRENCHLEY 2 | I370: TANNER | K370: REID | L370: KENNEDY | N370: COMERFORD | Q370: McKENZIE | T370: HALL
A371: NORTHCOTE | C371: WHITE 5 | F371: DUNCAN 2 | I371: CAHILL 2 | L371: DRYDEN | N371: ALLEN
A373: CAMBERWELL | C373: 7 | D373: 2 | E373: =C373*6+D373 -> 44 | G373: 11 | H373: 7 | I373: =G373*6+H373 -> 73 | K373: 13 | L373: 7 | M373: =K373*6+L373 -> 85 | O373: 19 | P373: 9 | Q373: =O373*6+P373 -> 123 | S373: CAMBERWELL
A374: BRUNSWICK | C374: 3 | D374: 5 | E374: =C374*6+D374 -> 23 | G374: 5 | H374: 11 | I374: =G374*6+H374 -> 41 | K374: 9 | L374: 20 | M374: =K374*6+L374 -> 74 | O374: 13 | P374: 24 | Q374: =O374*6+P374 -> 102 | S374: PRENDERGAST
A375: BEST PLAYERS
A376: CAMBERWELL | C376: NASH | E376: SEELENMEYER | H376: AUSTEN | K376: KENNETT | N376: HORKINGS | Q376: McPHERSON
A377: BRUNSWICK | C377: R QUINN | E377: KEMP | H377: CHALLENGER | K377: McELROY | N377: WINTER | Q377: WEBSTER
A378: GOALKICKERS
A379: CAMBERWELL | C379: NASH 9 | E379: McPHERSON 3 | H379: BOND | J379: AUSTEN | L379: HOPKINS | N379: TOOHEY | P379: CLAMP | R379: WHITEHEAD | U379: ALLEN
A380: BRUNSWICK | C380: CRISP 3 | E380: DOWLING 3 | H380: WHITE 3 | J380: WINTER 2 | M380: McELROY | O380: HUNTER
A382: PORT MELBOURNE | C382: 7 | D382: 6 | E382: =C382*6+D382 -> 48 | G382: 14 | H382: 10 | I382: =G382*6+H382 -> 94 | K382: 17 | L382: 13 | M382: =K382*6+L382 -> 115 | O382: 22 | P382: 20 | Q382: =O382*6+P382 -> 152 | S382: PORT MELBOURNE
A383: YARRAVILLE | C383: 1 | D383: 3 | E383: =C383*6+D383 -> 9 | G383: 2 | H383: 7 | I383: =G383*6+H383 -> 19 | K383: 5 | L383: 15 | M383: =K383*6+L383 -> 45 | O383: 6 | P383: 17 | Q383: =O383*6+P383 -> 53 | S383: MANCHESTER
A384: BEST PLAYERS
A385: PORT MELBOURNE | C385: FREYER | F385: ALLLEN | I385: REYNOLDS | L385: FAIRWEATHER | P385: LAHIFF | R385: ALSOP
A386: YARRAVILLE | C386: O'HALLORAN | F386: T SMITH | I386: DAY | L386: KENNY | P386: RANN | R386: ROBERTSON
A387: GOALKICKERS
A388: PORT MELBOURNE | C388: FREYER 14 | F388: HURLEY 2 | I388: ALLEN 2 | K388: LAHIFF | M388: FAIRWEATHER | P388: GOLDSMITH | R388: SEARLE
A389: YARRAVILLE | C389: WARDEN 3 | F389: ROBERTSON | I389: T SMITH | K389: WILLIAMSON
A391: WILLIAMSTOWN | C391: 3 | D391: 1 | E391: =C391*6+D391 -> 19 | G391: 15 | H391: 7 | I391: =G391*6+H391 -> 97 | K391: 22 | L391: 11 | M391: =K391*6+L391 -> 143 | O391: 29 | P391: 19 | Q391: =O391*6+P391 -> 193 | S391: WILLIAMSTOWN
A392: SANDRINGHAM | C392: 0 | D392: 5 | E392: =C392*6+D392 -> 5 | G392: 1 | H392: 5 | I392: =G392*6+H392 -> 11 | K392: 3 | L392: 6 | M392: =K392*6+L392 -> 24 | O392: 3 | P392: 8 | Q392: =O392*6+P392 -> 26 | S392: GREGORY
A393: BEST PLAYERS
A394: WILLIAMSTOWN | C394: VALLENCE | F394: FOTHERGILL | I394: JOHNSON | L394: LE SUEUR | O394: COOPER | Q394: TAYLOR
A395: SANDRINGHAM | C395: MILLER | F395: COPSEY | I395: NAMM | L395: LINDEN | O395: ALLISTER | Q395: BLAND
A396: GOALKICKERS
A397: WILLIAMSTOWN | C397: VALLENCE 20 | F397: FOTHERGILL 2 | I397: I McTAGGART 2 | L397: JAMIESON 2 | O397: LE SUEUR | Q397: TAYLOR | S397: GLASS
A398: SANDRINGHAM | C398: ALLISTER 2 | F398: PETTIONA
A400: ROUND 8 | E400: 31ST MAY | J400: WEATHER | M400: FINE NORTH WIND | S400: PLAYED AT
D401: 1ST QTR | H401: 2ND QTR | L401: 3RD QTR | P401: FINAL | S401: PRESTON
A402: PRESTON | C402: 3 | D402: 7 | E402: =C402*6+D402 -> 25 | G402: 4 | H402: 10 | I402: =G402*6+H402 -> 34 | K402: 11 | L402: 14 | M402: =K402*6+L402 -> 80 | O402: 15 | P402: 19 | Q402: =O402*6+P402 -> 109 | S402: UMPIRE | X402: LADDER | AB402: ROUND | AD402: 8
A403: WILLIAMSTOWN | C403: 4 | D403: 2 | E403: =C403*6+D403 -> 26 | G403: 11 | H403: 5 | I403: =G403*6+H403 -> 71 | K403: 13 | L403: 6 | M403: =K403*6+L403 -> 84 | O403: 15 | P403: 8 | Q403: =O403*6+P403 -> 98 | S403: GREGORY
A404: BEST PLAYERS | W404: TEAM | X404: W | Y404: L | Z404: D | AA404: FOR | AB404: AGST | AC404: % | AD404: PTS
A405: PRESTON | C405: NORMAN | E405: LYNCH | H405: DEACON | K405: DOWLING | N405: MATTHEWS | Q405: CONNELLY
A406: WILLIAMSTOWN | C406: WILCOX | E406: FOTHERGILL | H406: DELLER | K406: GLASS | N406: JOHNSON | Q406: A McTAGGART | W406: PRAHRAN | X406: 7 | Y406: 1 | Z406: 0 | AA406: 1074 | AB406: 721 | AC406: 148.96 | AD406: 28
A407: GOALKICKERS | W407: PRESTON | X407: 7 | Y407: 1 | Z407: 0 | AA407: 1020 | AB407: 775 | AC407: 131.61290322580646 | AD407: 28
A408: PRESTON | C408: LYNCH 10 | F408: CONNELLY 3 | I408: DOWLING | K408: BOYD | W408: COBURG | X408: 6 | Y408: 2 | Z408: 0 | AA408: 1089 | AB408: 756 | AC408: 144.05 | AD408: 24
A409: WILLIAMSTOWN | C409: VALLENCE 5 | F409: FOTHERGILL 3 | I409: I McTAGGART 3 | M409: JAMIESON | O409: SALVAS | Q409: GLASS | S409: MARSHAM | W409: WILLIAMSTOWN | X409: 6 | Y409: 2 | Z409: 0 | AA409: 998 | AB409: 698 | AC409: 142.98 | AD409: 24
A411: COBURG | C411: 0 | D411: 3 | E411: =C411*6+D411 -> 3 | G411: 9 | H411: 10 | I411: =G411*6+H411 -> 64 | K411: 9 | L411: 14 | M411: =K411*6+L411 -> 68 | O411: 14 | P411: 18 | Q411: =O411*6+P411 -> 102 | S411: COBURG | W411: PORT MELBOURNE | X411: 5 | Y411: 3 | Z411: 0 | AA411: 865 | AB411: 657 | AC411: 131.65905631659055 | AD411: 20
A412: PORT MELBOURNE | C412: 6 | D412: 5 | E412: =C412*6+D412 -> 41 | G412: 6 | H412: 8 | I412: =G412*6+H412 -> 44 | K412: 8 | L412: 12 | M412: =K412*6+L412 -> 60 | O412: 12 | P412: 17 | Q412: =O412*6+P412 -> 89 | S412: PRENDERGAST | W412: BRUNSWICK | X412: 5 | Y412: 3 | Z412: 0 | AA412: 932 | AB412: 775 | AC412: 120.25806451612904 | AD412: 20
A413: BEST PLAYERS | W413: OAKLEIGH | X413: 4 | Y413: 4 | Z413: 0 | AA413: 917 | AB413: 869 | AC413: 105.52 | AD413: 16
A414: COBURG | C414: McLEY | E414: R ATKINSON | H414: COLLINS | K414: PROMNITZ | N414: HALL | Q414: WILSON | W414: CAMBERWELL | X414: 3 | Y414: 5 | Z414: 0 | AA414: 892 | AB414: 1028 | AC414: 86.77 | AD414: 12
A415: PORT MELBOURNE | C415: LAHIFF | E415: GOLDSMITH | H415: HAYES | K415: CASTLES | N415: ALSOP | Q415: FAIRWEATHER | W415: NORTHCOTE | X415: 2 | Y415: 6 | Z415: 0 | AA415: 681 | AB415: 817 | AC415: 83.353733170134646 | AD415: 8
A416: GOALKICKERS | W416: BRIGHTON | X416: 2 | Y416: 6 | Z416: 0 | AA416: 795 | AB416: 968 | AC416: 82.128099173553721 | AD416: 8
A417: COBURG | C417: PRATT 5 | E417: SITCH 3 | H417: LINEGAR 2 | K417: COLLINS | M417: McLEY | O417: MILTE | Q417: BROWN | W417: YARRAVILLE | X417: 1 | Y417: 7 | Z417: 0 | AA417: 681 | AB417: 1093 | AC417: 62.31 | AD417: 4
A418: PORT MELBOURNE | C418: FAIRWEATHER 2 | F418: STEIGENBERGER 2 | J418: REYNOLDS | M418: GOLDSMITH | P418: CASTLES | R418: DOBSON | W418: SANDRINGHAM | X418: 0 | Y418: 8 | Z418: 0 | AA418: 526 | AB418: 1313 | AC418: 40.06 | AD418: 0
M419: HURLEY | O419: SEARLE | Q419: ALSOP | S419: ALLEN
A420: BRUNSWICK | C420: 3 | D420: 7 | E420: =C420*6+D420 -> 25 | G420: 7 | H420: 11 | I420: =G420*6+H420 -> 53 | K420: 13 | L420: 18 | M420: =K420*6+L420 -> 96 | O420: 16 | P420: 21 | Q420: =O420*6+P420 -> 117 | S420: BRUNSWICK
A421: BRIGHTON | C421: 2 | D421: 1 | E421: =C421*6+D421 -> 13 | G421: 3 | H421: 4 | I421: =G421*6+H421 -> 22 | K421: 6 | L421: 6 | M421: =K421*6+L421 -> 42 | O421: 9 | P421: 10 | Q421: =O421*6+P421 -> 64 | S421: MERRINGTON
A422: BEST PLAYERS
A423: BRUNSWICK | C423: STANDFIELD | F423: HOBBA | I423: SMITH | L423: WINTER | O423: COOLEY | R423: POWELL
A424: BRIGHTON | C424: HALLAHAN | F424: FROUDE | I424: ALVIN | L424: SCOTT | O424: NAASH | R424: WEBER
A425: GOALKICKERS
A426: BRUNSWICK | C426: POWELL 5 | F426: HUNTER 3 | I426: CRISP 2 | K426: HUGHES 2 | M426: QUINN | O426: WHITE | Q426: STANDFIELD | T426: WEBSTER
A427: BRIGHTON | C427: HUNTER 2 | F427: HARLEY 2 | I427: HALL 2 | K427: HALLAHAN | N427: JACKSON | P427: KING
A429: CAMBERWELL | C429: 3 | D429: 2 | E429: =C429*6+D429 -> 20 | G429: 8 | H429: 9 | I429: =G429*6+H429 -> 57 | K429: 12 | L429: 9 | M429: =K429*6+L429 -> 81 | O429: 18 | P429: 11 | Q429: =O429*6+P429 -> 119 | S429: YARRAVILLE
A430: YARRAVILLE | C430: 5 | D430: 4 | E430: =C430*6+D430 -> 34 | G430: 8 | H430: 5 | I430: =G430*6+H430 -> 53 | K430: 14 | L430: 11 | M430: =K430*6+L430 -> 95 | O430: 16 | P430: 14 | Q430: =O430*6+P430 -> 110 | S430: GROVES
A431: BEST PLAYERS
A432: CAMBERWELL | C432: HORKINGS | F432: SEELENMEYER | I432: KENNETT | L432: CLAMP | N432: McPHERSON | Q432: WHITEHEAD
A433: YARRAVILLE | C433: O'HALLORAN | F433: RANN | I433: PERUSSICH | L433: DOHERTY | N433: T SMITH | Q433: B McVEIGH
A434: GOALKICKERS
A435: CAMBERWELL | C435: NASH 4 | E435: McPHERSON 3 | H435: WHITEHEAD 2 | K435: HOPKINS 2 | N435: CLAMP 2 | P435: AUSTEN | R435: McKAY | T435: ALLEN | W435: SEELENMEYER | X435: SHARPLES
A436: YARRAVILLE | C436: WARDEN 4 | E436: T SMITH 3 | G436: RANN 2 | I436: BEVAN 2 | K436: B McVEIGH | M436: PERUSSICH | O436: WILLIAMSON | R436: H SMITH | U436: ROBERTSON
A438: PRAHRAN | C438: 2 | D438: 4 | E438: =C438*6+D438 -> 16 | G438: 5 | H438: 7 | I438: =G438*6+H438 -> 37 | K438: 7 | L438: 11 | M438: =K438*6+L438 -> 53 | O438: 15 | P438: 14 | Q438: =O438*6+P438 -> 104 | S438: NORTHCOTE
A439: NORTHCOTE | C439: 2 | D439: 4 | E439: =C439*6+D439 -> 16 | G439: 3 | H439: 10 | I439: =G439*6+H439 -> 28 | K439: 5 | L439: 11 | M439: =K439*6+L439 -> 41 | O439: 9 | P439: 16 | Q439: =O439*6+P439 -> 70 | S439: BATT
A440: BEST PLAYERS
A441: PRAHRAN | C441: PROBYN | E441: JOHNSON | H441: WHITEHEAD | K441: MAHON | N441: PEARCE | Q441: BENNISON
A442: NORTHCOTE | C442: DOWER | E442: WALLIS | H442: ALLEN | K442: E HART | N442: E BRETHERTON | Q442: D BRETHERTON
A443: GOALKICKERS
A444: PRAHRAN | C444: LYONS 4 | F444: WHITE 4 | I444: PEARCE 3 | L444: NEWTON | N444: TUCKER | P444: GRAVELL | S444: ROLFE
A445: NORTHCOTE | C445: WHITE 4 | F445: HISCOX 4 | I445: DUNCAN
A447: OAKLEIGH | C447: 3 | D447: 3 | E447: =C447*6+D447 -> 21 | G447: 12 | H447: 5 | I447: =G447*6+H447 -> 77 | K447: 18 | L447: 20 | M447: =K447*6+L447 -> 128 | O447: 22 | P447: 25 | Q447: =O447*6+P447 -> 157 | S447: BEACH ROAD
A448: SANDRINGHAM | C448: 0 | D448: 2 | E448: =C448*6+D448 -> 2 | G448: 6 | H448: 6 | I448: =G448*6+H448 -> 42 | K448: 8 | L448: 8 | M448: =K448*6+L448 -> 56 | O448: 10 | P448: 12 | Q448: =O448*6+P448 -> 72 | S448: APPLEBY
A449: BEST PLAYERS
A450: OAKLEIGH | C450: WEISS | E450: HALL | H450: COMERFORD | K450: BICKERTON | N450: THOMPSON | Q450: BRENCHLEY
A451: SANDRINGHAM | C451: FOLLETT | E451: WEBER | H451: LUCAS | K451: LINDEN | N451: DINGLE | Q451: POND
A452: GOALKICKERS
A453: OAKLEIGH | C453: TAYLOR 6 | E453: COMMONS 3 | H453: HALL 3 | J453: BRENCHLEY 2 | M453: KENNEDY 2 | P453: COMERFORD 2 | S453: O'DONOGHUE | W453: CLARKE | X453: TANNER | Z453: WILLS
A454: SANDRINGHAM | C454: PRICE 3 | E454: LUCAS 2 | G454: POND 2 | I454: ALLISTER | K454: BACKMAN | M454: CAVE
A456: ROUND 9 | E456: 7TH JUNE | H456: WEATHER | K456: CLOUDY BUT MAINLY FINE NORTH BREEZE | S456: PLAYED AT
D457: 1ST QTR | H457: 2ND QTR | L457: 3RD QTR | P457: FINAL | S457: PRESTON
A458: PRESTON | C458: 0 | D458: 3 | E458: =C458*6+D458 -> 3 | G458: 5 | H458: 14 | I458: =G458*6+H458 -> 44 | K458: 7 | L458: 17 | M458: =K458*6+L458 -> 59 | O458: 11 | P458: 22 | Q458: =O458*6+P458 -> 88 | S458: UMPIRE | X458: LADDER | AB458: ROUND | AD458: 9
A459: BRUNSWICK | C459: 5 | D459: 6 | E459: =C459*6+D459 -> 36 | G459: 7 | H459: 8 | I459: =G459*6+H459 -> 50 | K459: 10 | L459: 15 | M459: =K459*6+L459 -> 75 | O459: 11 | P459: 18 | Q459: =O459*6+P459 -> 84 | S459: MERRINGTON
A460: BEST PLAYERS | W460: TEAM | X460: W | Y460: L | Z460: D | AA460: FOR | AB460: AGST | AC460: % | AD460: PTS
A461: PRESTON | C461: DAWSON | E461: DEACON | H461: DUNSTONE | K461: EVERETT | N461: MASLEN | Q461: LOWENTHAL
A462: BRUNSWICK | C462: COOLEY | E462: FAY | H462: WEBSTER | K462: CRISP | N462: KEMP | Q462: HOBBA | W462: PRAHRAN | X462: 8 | Y462: 1 | Z462: 0 | AA462: 1260 | AB462: 792 | AC462: 159.09 | AD462: 32
A463: GOALKICKERS | W463: PRESTON | X463: 8 | Y463: 1 | Z463: 0 | AA463: 1108 | AB463: 859 | AC463: 128.9871944121071 | AD463: 32
A464: PRESTON | C464: DAWSON 5 | F464: BOYD 2 | I464: DUNSTONE 2 | L464: LYNCH | N464: DEACON | W464: WILLIAMSTOWN | X464: 6 | Y464: 2 | Z464: 0 | AA464: 998 | AB464: 698 | AC464: 142.98 | AD464: 24
A465: BRUNSWICK | C465: COOLEY 3 | F465: HUNTER 3 | I465: WEBSTER 2 | L465: CRISP 2 | N465: CRAWFORD | W465: COBURG | X465: 6 | Y465: 3 | Z465: 0 | AA465: 1227 | AB465: 905 | AC465: 135.58 | AD465: 24
A467: CAMBERWELL | C467: 5 | D467: 0 | E467: =C467*6+D467 -> 30 | G467: 14 | H467: 3 | I467: =G467*6+H467 -> 87 | K467: 19 | L467: 6 | M467: =K467*6+L467 -> 120 | O467: 23 | P467: 11 | Q467: =O467*6+P467 -> 149 | S467: CAMBERWELL | W467: PORT MELBOURNE | X467: 6 | Y467: 3 | Z467: 0 | AA467: 1002 | AB467: 750 | AC467: 133.6 | AD467: 24
A468: COBURG | C468: 4 | D468: 8 | E468: =C468*6+D468 -> 32 | G468: 9 | H468: 11 | I468: =G468*6+H468 -> 65 | K468: 16 | L468: 13 | M468: =K468*6+L468 -> 109 | O468: 20 | P468: 18 | Q468: =O468*6+P468 -> 138 | S468: PRENDERGAST | W468: BRUNSWICK | X468: 5 | Y468: 4 | Z468: 0 | AA468: 1016 | AB468: 863 | AC468: 117.72885283893395 | AD468: 20
A469: BEST PLAYERS | W469: OAKLEIGH | X469: 4 | Y469: 4 | Z469: 0 | AA469: 917 | AB469: 869 | AC469: 105.52 | AD469: 16
A470: CAMBERWELL | C470: SHARPLES | F470: CLAMP | H470: SEELENMEYER | K470: NASH | N470: JORGENSON | Q470: WHITEHEAD | W470: CAMBERWELL | X470: 4 | Y470: 5 | Z470: 0 | AA470: 1041 | AB470: 1166 | AC470: 89.28 | AD470: 16
A471: COBURG | C471: R ATKINSON | F471: SITCH | H471: McLEY | K471: MULLENGER | N471: COLLINS | Q471: HORE | W471: BRIGHTON | X471: 3 | Y471: 6 | Z471: 0 | AA471: 902 | AB471: 1025 | AC471: 88 | AD471: 12
A472: GOALKICKERS | W472: NORTHCOTE | X472: 2 | Y472: 7 | Z472: 0 | AA472: 774 | AB472: 954 | AC472: 81.132075471698116 | AD472: 8
A473: CAMBERWELL | C473: NASH 8 | E473: JORGENSON 5 | H473: CLAMP 5 | J473: WHITEHEAD 2 | M473: BOND | N473: ALLEN | P473: AUSTEN | W473: YARRAVILLE | X473: 1 | Y473: 8 | Z473: 0 | AA473: 738 | AB473: 1200 | AC473: 60.75 | AD473: 4
A474: COBURG | C474: COLLINS 4 | E474: MULLENGER 4 | H474: McLEY 3 | J474: LEE 2 | L474: BROWN 2 | N474: LINEGER 2 | Q474: HORE | S474: HALL | W474: SANDRINGHAM | X474: 0 | Y474: 9 | Z474: 0 | AA474: 597 | AB474: 1499 | AC474: 39.83 | AD474: 0
P475: LONSDALE
A476: PORT MELBOURNE | C476: 6 | D476: 6 | E476: =C476*6+D476 -> 42 | G476: 9 | H476: 11 | I476: =G476*6+H476 -> 65 | K476: 14 | L476: 15 | M476: =K476*6+L476 -> 99 | O476: 20 | P476: 17 | Q476: =O476*6+P476 -> 137 | S476: PORT MELBOURNE
A477: NORTHCOTE | C477: 1 | D477: 5 | E477: =C477*6+D477 -> 11 | G477: 6 | H477: 8 | I477: =G477*6+H477 -> 44 | K477: 9 | L477: 12 | M477: =K477*6+L477 -> 66 | O477: 13 | P477: 15 | Q477: =O477*6+P477 -> 93 | S477: APPLEBY
A478: BEST PLAYERS
A479: PORT MELBOURNE | C479: LAHIFF | E479: HAYES | H479: GOLDSMITH | K479: ALSOP | M479: HURLEY | P479: TANNER
A480: NORTHCOTE | C480: DOWER | E480: CAHILL | H480: E HART | K480: ALLEN | M480: DRYDEN | P480: HISCOX
A481: GOALKICKERS
A482: PORT MELBOURNE | C482: FREYER 7 | F482: LAHIFF 3 | I482: FAIRWEATHER 3 | M482: CRAMERI 2 | P482: HURLEY 2 | S482: JULIER | U482: PANNELL | X482: ALLEN
A483: NORTHCOTE | C483: WHITE 4 | F483: CAHILL 4 | I483: DUNCAN 2 | L483: DOWER 2 | O483: E HART
A485: BRIGHTON | C485: 3 | D485: 3 | E485: =C485*6+D485 -> 21 | G485: 10 | H485: 13 | I485: =G485*6+H485 -> 73 | K485: 10 | L485: 15 | M485: =K485*6+L485 -> 75 | O485: 14 | P485: 23 | Q485: =O485*6+P485 -> 107 | S485: ELSTERNWICK PARK
A486: YARRAVILLE | C486: 2 | D486: 4 | E486: =C486*6+D486 -> 16 | G486: 3 | H486: 4 | I486: =G486*6+H486 -> 22 | K486: 5 | L486: 19 | M486: =K486*6+L486 -> 49 | O486: 6 | P486: 21 | Q486: =O486*6+P486 -> 57 | S486: GREGORY
A487: BEST PLAYERS
A488: BRIGHTON | C488: HALLAHAN | F488: JONES | I488: SCOTT | L488: WEBER | N488: PAGE | Q488: HAGGIS
A489: YARRAVILLE | C489: B McVEIGH | F489: ROBERTSON | I489: STREETER | L489: H SMITH | N489: T SMITH | Q489: O'HALLORAN
A490: GOALKICKERS
A491: BRIGHTON | C491: HAGGIS 3 | F491: FROUDE 2 | I491: JONES 2 | K491: KING 2 | M491: CONDON | O491: HUNTER | Q491: SCOTT | S491: WEBER | U491: NASH
A492: YARRAVILLE | C492: RANN | F492: ROBERTSON | I492: WARDEN | K492: WILLIAMSON | N492: KENNY | P492: T SMITH
A494: PRAHRAN | C494: 10 | D494: 5 | E494: =C494*6+D494 -> 65 | G494: 18 | H494: 8 | I494: =G494*6+H494 -> 116 | K494: 23 | L494: 15 | M494: =K494*6+L494 -> 153 | O494: 28 | P494: 18 | Q494: =O494*6+P494 -> 186 | S494: TOORAK PARK
A495: SANDRINGHAM | C495: 0 | D495: 5 | E495: =C495*6+D495 -> 5 | G495: 4 | H495: 7 | I495: =G495*6+H495 -> 31 | K495: 5 | L495: 7 | M495: =K495*6+L495 -> 37 | O495: 10 | P495: 11 | Q495: =O495*6+P495 -> 71 | S495: GROVES
A496: BEST PLAYERS
A497: PRAHRAN | C497: LYONS | E497: PEARCE | H497: WILLIAMS | K497: PROBYN | N497: GRAVELL | Q497: WHITEHEAD
A498: SANDRINGHAM | C498: CAVE | E498: ALLISTER | H498: WEBER | K498: COPSEY | N498: PRICE | Q498: LUCAS
A499: GOALKICKERS
A500: PRAHRAN | C500: LYONS 10 | F500: PEARCE 6 | I500: GRAVELL 4 | L500: WHITE 3 | N500: WILLIAMS 3 | Q500: ROLFE | S500: O'DONNELL
A501: SANDRINGHAM | C501: PRICE 3 | F501: LINDEN | H501: WEBER | J501: LUCAS | L501: DINGLE | N501: BLAND | P501: FOLLETT | R501: ALLISTER
A503: WILLIAMSTOWN | C503: 6 | D503: 4 | E503: =C503*6+D503 -> 40 | G503: 12 | H503: 4 | I503: =G503*6+H503 -> 76 | K503: 20 | L503: 11 | M503: =K503*6+L503 -> 131 | O503: 26 | P503: 15 | Q503: =O503*6+P503 -> 171 | S503: NORTHCOTE
A504: OAKLEIGH | C504: 2 | D504: 1 | E504: =C504*6+D504 -> 13 | G504: 9 | H504: 5 | I504: =G504*6+H504 -> 59 | K504: 10 | L504: 9 | M504: =K504*6+L504 -> 69 | O504: 15 | P504: 13 | Q504: =O504*6+P504 -> 103 | S504: BATT
A505: BEST PLAYERS
A506: WILLIAMSTOWN | C506: FOTHERGILL | F506: A McTAGGART | I506: WILCOX | L506: JOHNSON | O506: JAMIESON | R506: WILCOX
A507: OAKLEIGH | C507: REID | F507: HALL | I507: BRENCHLEY | L507: MARTIN | O507: KENNEDY | R507: WILSON
A508: GOALKICKERS
A509: WILLIAMSTOWN | C509: VALLENCE 9 | F509: FOTHERGILL 4 | I509: A McTAGGART 4 | M509: SALVAS 4 | O509: JAMIESON 3 | R509: THOMAS 2
A510: OAKLEIGH | C510: MOORE 3 | F510: BRENCHLEY 2 | I510: McKENZIE 2 | L510: KENNEDY 2 | O510: TAYLOR 2 | Q510: COMERFORD | T510: HALL | V510: REID | X510: CLARKE
A512: ROUND 10 | D512: 14TH JUNE | J512: WEATHER | M512: FINE | S512: PLAYED AT
D513: 1ST QTR | H513: 2ND QTR | L513: 3RD QTR | P513: FINAL | S513: WILLIAMSTOWN
A514: WILLIAMSTOWN | C514: 6 | D514: 8 | E514: =C514*6+D514 -> 44 | G514: 8 | H514: 13 | I514: =G514*6+H514 -> 61 | K514: 12 | L514: 17 | M514: =K514*6+L514 -> 89 | O514: 15 | P514: 19 | Q514: =O514*6+P514 -> 109 | S514: UMPIRE | X514: LADDER | AB514: ROUND | AD514: 10
A515: BRUNSWICK | C515: 4 | D515: 2 | E515: =C515*6+D515 -> 26 | G515: 9 | H515: 8 | I515: =G515*6+H515 -> 62 | K515: 10 | L515: 12 | M515: =K515*6+L515 -> 72 | O515: 14 | P515: 13 | Q515: =O515*6+P515 -> 97 | S515: PRENDERGAST
A516: BEST PLAYERS | W516: TEAM | X516: W | Y516: L | Z516: D | AA516: FOR | AB516: AGST | AC516: % | AD516: PTS
A517: WILLIAMSTOWN | C517: FOTHERGILL | F517: SCOTT | I517: PATTINSON | L517: CUTTING | N517: JOHNSON | Q517: GREEN
A518: BRUNSWICK | C518: BAKER | F518: STANDFIELD | I518: CRAWFORD | L518: CRISP | N518: WINTER | Q518: QUINN | W518: PRAHRAN | X518: 9 | Y518: 1 | Z518: 0 | AA518: 1358 | AB518: 866 | AC518: 156.81 | AD518: 36
A519: GOALKICKERS | W519: PRESTON | X519: 9 | Y519: 1 | Z519: 0 | AA519: 1264 | AB519: 931 | AC519: 135.76799140708914 | AD519: 36
A520: WILLIAMSTOWN | C520: FOTHERGILL 7 | F520: GREEN 6 | I520: I McTAGGART | L520: GLASS | W520: PORT MELBOURNE | X520: 7 | Y520: 3 | Z520: 0 | AA520: 1165 | AB520: 816 | AC520: 142.76960784313727 | AD520: 28
A521: BRUNSWICK | C521: CRAWFORD 3 | F521: CRISP 3 | I521: McELROY 2 | L521: COOLEY 2 | N521: POWELL 2 | Q521: WEBSTER 2 | W521: COBURG | X521: 7 | Y521: 3 | Z521: 0 | AA521: 1358 | AB521: 972 | AC521: 139.71 | AD521: 28
A523: COBURG | C523: 6 | D523: 7 | E523: =C523*6+D523 -> 43 | G523: 12 | H523: 9 | I523: =G523*6+H523 -> 81 | K523: 17 | L523: 14 | M523: =K523*6+L523 -> 116 | O523: 18 | P523: 23 | Q523: =O523*6+P523 -> 131 | S523: COBURG | W523: WILLIAMSTOWN | X523: 7 | Y523: 2 | Z523: 0 | AA523: 1107 | AB523: 795 | AC523: 139.25 | AD523: 28
A524: BRIGHTON | C524: 3 | D524: 0 | E524: =C524*6+D524 -> 18 | G524: 5 | H524: 2 | I524: =G524*6+H524 -> 32 | K524: 8 | L524: 4 | M524: =K524*6+L524 -> 52 | O524: 10 | P524: 7 | Q524: =O524*6+P524 -> 67 | S524: BATT | W524: BRUNSWICK | X524: 5 | Y524: 5 | Z524: 0 | AA524: 1113 | AB524: 972 | AC524: 114.50617283950618 | AD524: 20
A525: BEST PLAYERS | W525: CAMBERWELL | X525: 5 | Y525: 5 | Z525: 0 | AA525: 1159 | AB525: 1254 | AC525: 92.42 | AD525: 20
A526: COBURG | C526: LONSDALE | F526: COLLINS | I526: McLEY | K526: BROWN | N526: PROMNITZ | Q526: R ATKINSON | W526: OAKLEIGH | X526: 4 | Y526: 5 | Z526: 0 | AA526: 991 | AB526: 967 | AC526: 102.48 | AD526: 16
A527: BRIGHTON | C527: JONES | F527: HUNTER | I527: HALL | K527: WILLIAMSON | N527: HALLAHAN | Q527: CONDON | W527: BRIGHTON | X527: 3 | Y527: 7 | Z527: 0 | AA527: 969 | AB527: 1156 | AC527: 83.82352941176471 | AD527: 12
A528: GOALKICKERS | W528: NORTHCOTE | X528: 2 | Y528: 8 | Z528: 0 | AA528: 862 | AB528: 1072 | AC528: 80.410447761194035 | AD528: 8
A529: COBURG | C529: COLLINS 5 | F529: PRATT 5 | I529: BROWN 4 | L529: MULLENGER 2 | O529: LINEGAR | Q529: McKAY | W529: YARRAVILLE | X529: 1 | Y529: 9 | Z529: 0 | AA529: 810 | AB529: 1356 | AC529: 59.73 | AD529: 4
A530: BRIGHTON | C530: HAGGIS 3 | F530: WEBER 3 | I530: CONDON 2 | L530: NASH | N530: HUNTER | W530: SANDRINGHAM | X530: 0 | Y530: 10 | Z530: 0 | AA530: 663 | AB530: 1662 | AC530: 39.89 | AD530: 0
A532: CAMBERWELL | C532: 5 | D532: 3 | E532: =C532*6+D532 -> 33 | G532: 9 | H532: 10 | I532: =G532*6+H532 -> 64 | K532: 12 | L532: 12 | M532: =K532*6+L532 -> 84 | O532: 17 | P532: 16 | Q532: =O532*6+P532 -> 118 | S532: NORTHCOTE
A533: NORTHCOTE | C533: 3 | D533: 6 | E533: =C533*6+D533 -> 24 | G533: 7 | H533: 9 | I533: =G533*6+H533 -> 51 | K533: 9 | L533: 12 | M533: =K533*6+L533 -> 66 | O533: 12 | P533: 16 | Q533: =O533*6+P533 -> 88 | S533: MEYER
A534: BEST PLAYERS
A535: CAMBERWELL | C535: KENNETT | F535: BOND | I535: HORKINGS | L535: EWINS | N535: SEELENMEYER | Q535: SHARPLES
A536: NORTHCOTE | C536: DOWER | F536: WHITE | I536: WALLIS | L536: BAGULEY | N536: ALLEN | Q536: MORGAN
A537: GOALKICKERS
A538: CAMBERWELL | C538: JORGENSON 4 | F538: NASH 2 | H538: BOND 2 | J538: HENDERSON 2 | M538: TAYLOR 2 | O538: FINN 2 | Q538: OLIVER | S538: ALLEN | U538: CLAMP
A539: NORTHCOTE | C539: WHITE 5 | F539: ALLEN 3 | H539: E HART 2 | J539: DUNCAN | L539: HISCOX
A541: PORT MELBOURNE | C541: 3 | D541: 3 | E541: =C541*6+D541 -> 21 | G541: 10 | H541: 6 | I541: =G541*6+H541 -> 66 | K541: 18 | L541: 12 | M541: =K541*6+L541 -> 120 | O541: 25 | P541: 13 | Q541: =O541*6+P541 -> 163 | S541: BEACH ROAD
A542: SANDRINGHAM | C542: 3 | D542: 4 | E542: =C542*6+D542 -> 22 | G542: 4 | H542: 5 | I542: =G542*6+H542 -> 29 | K542: 5 | L542: 10 | M542: =K542*6+L542 -> 40 | O542: 9 | P542: 12 | Q542: =O542*6+P542 -> 66 | S542: GREGORY
A543: BEST PLAYERS
A544: PORT MELBOURNE | C544: FREYER | E544: ONLEY | H544: DOBSON | L544: MARSHALL | N544: ROBERTSON | Q544: HURLEY
A545: SANDRINGHAM | C545: NAMM | E545: McCOY | H545: EVANS | L545: LUCAS | N545: LINDEN | Q545: PRICE
A546: GOALKICKERS
A547: PORT MELBOURNE | C547: FREYER 13 | F547: HURLEY 3 | I547: CRAMERI 3 | L547: ROBERTSON 2 | O547: RICHES 2 | Q547: FAIRWEATHER | U547: PANNELL
A548: SANDRINGHAM | C548: PRICE 5 | F548: WEBER | I548: LUCAS | L548: BACKMAN | O548: POND
A550: PRESTON | C550: 5 | D550: 2 | E550: =C550*6+D550 -> 32 | G550: 11 | H550: 7 | I550: =G550*6+H550 -> 73 | K550: 15 | L550: 13 | M550: =K550*6+L550 -> 103 | O550: 22 | P550: 24 | Q550: =O550*6+P550 -> 156 | S550: YARRAVILLE
A551: YARRAVILLE | C551: 4 | D551: 3 | E551: =C551*6+D551 -> 27 | G551: 5 | H551: 7 | I551: =G551*6+H551 -> 37 | K551: 9 | L551: 8 | M551: =K551*6+L551 -> 62 | O551: 10 | P551: 12 | Q551: =O551*6+P551 -> 72 | S551: MERRINGTON
A552: BEST PLAYERS
A553: PRESTON | C553: BOYD | E553: NORMAN | H553: LYNCH | K553: CONNELY | N553: MASLEN | Q553: CALVERT
A554: YARRAVILLE | C554: WILSON | E554: KENNY | H554: DAY | K554: T SMITH | N554: H SMITH | Q554: WARDEN
A555: GOALKICKERS
A556: PRESTON | C556: LYNCH 8 | F556: ROSS 5 | H556: DUNSTONE 5 | K556: DEACON 2 | N556: BOYD | P556: SPOKES
A557: YARRAVILLE | C557: WARDEN 4 | F557: KENNY 2 | H557: H SMITH 2 | K557: T SMITH | M557: ROBERTSON
E558: 16TH JUNE | J558: WEATHER | M558: FINE MILD NORTH BREEZE
A559: PRAHRAN | C559: 4 | D559: 6 | E559: =C559*6+D559 -> 30 | G559: 8 | H559: 9 | I559: =G559*6+H559 -> 57 | K559: 11 | L559: 16 | M559: =K559*6+L559 -> 82 | O559: 13 | P559: 20 | Q559: =O559*6+P559 -> 98 | S559: OAKLEIGH
A560: OAKLEIGH | C560: 2 | D560: 5 | E560: =C560*6+D560 -> 17 | G560: 3 | H560: 10 | I560: =G560*6+H560 -> 28 | K560: 4 | L560: 14 | M560: =K560*6+L560 -> 38 | O560: 9 | P560: 20 | Q560: =O560*6+P560 -> 74 | S560: APPLEBY
A561: BEST PLAYERS
A562: PRAHRAN | C562: JOHNSON | F562: ROLFE | I562: WILLIAMS | L562: THOMPSON | O562: GRAVELL | R562: WHITE
A563: OAKLEIGH | C563: HALL | F563: WEISS | I563: WATSON | L563: KENNEDY | O563: McALLISTER | R563: CLARKE
A564: GOALKICKERS
A565: PRAHRAN | C565: LYONS 3 | E565: GRAVELL 2 | H565: BOURNE 2 | J565: WILLIAMS | L565: WHITE | N565: THOMPSON | Q565: O'DONNELL | T565: ROLFE | V565: MURFITT
A566: OAKLEIGH | C566: CLARKE 2 | F566: COMMONS 2 | I566: TAYLOR 2 | L566: HALL 2 | N566: COMERFORD
A568: ROUND 11 | E568: 21ST JUNE | H568: WEATHER | K568: COLD RAIN W WIND GROUNDS WATERLOGGED | S568: PLAYED AT
D569: 1ST QTR | H569: 2ND QTR | L569: 3RD QTR | P569: FINAL | S569: TOORAK PARK
A570: PRAHRAN | C570: 2 | D570: 2 | E570: =C570*6+D570 -> 14 | G570: 8 | H570: 9 | I570: =G570*6+H570 -> 57 | K570: 11 | L570: 9 | M570: =K570*6+L570 -> 75 | O570: 14 | P570: 15 | Q570: =O570*6+P570 -> 99 | S570: UMPIRE | X570: LADDER | AB570: ROUND | AD570: 11
A571: WILLIAMSTOWN | C571: 2 | D571: 7 | E571: =C571*6+D571 -> 19 | G571: 3 | H571: 9 | I571: =G571*6+H571 -> 27 | K571: 6 | L571: 14 | M571: =K571*6+L571 -> 50 | O571: 7 | P571: 15 | Q571: =O571*6+P571 -> 57 | S571: MERRINGTON
A572: BEST PLAYERS | W572: TEAM | X572: W | Y572: L | Z572: D | AA572: FOR | AB572: AGST | AC572: % | AD572: PTS
A573: PRAHRAN | C573: ROLFE | F573: BOURNE | I573: ROWELL | L573: WHITE | O573: FAUL | Q573: NEWTON
A574: WILLIAMSTOWN | C574: FOTHERGILL | F574: WILCOX | I574: JOHNSON | L574: PATTINSON | O574: THOMAS | Q574: NEW | W574: PRAHRAN | X574: 10 | Y574: 1 | Z574: 0 | AA574: 1457 | AB574: 923 | AC574: 157.85 | AD574: 40
A575: GOALKICKERS | W575: PRESTON | X575: 10 | Y575: 1 | Z575: 0 | AA575: 1368 | AB575: 993 | AC575: 137.7643504531722 | AD575: 40
A576: PRAHRAN | C576: ROLFE 5 | F576: WHITE 3 | I576: DAVEY 2 | K576: LYONS 2 | M576: PEARCE | O576: THOMPSON | W576: PORT MELBOURNE | X576: 8 | Y576: 3 | Z576: 0 | AA576: 1259 | AB576: 884 | AC576: 142.42081447963801 | AD576: 32
A577: WILLIAMSTOWN | C577: FOTHERGILL 2 | F577: VALLENCE 2 | I577: SALVAS 2 | K577: GLASS | W577: COBURG | X577: 7 | Y577: 4 | Z577: 0 | AA577: 1420 | AB577: 1076 | AC577: 131.97 | AD577: 28
A579: PRESTON | C579: 4 | D579: 7 | E579: =C579*6+D579 -> 31 | G579: 6 | H579: 8 | I579: =G579*6+H579 -> 44 | K579: 13 | L579: 13 | M579: =K579*6+L579 -> 91 | O579: 15 | P579: 14 | Q579: =O579*6+P579 -> 104 | S579: PRESTON | W579: WILLIAMSTOWN | X579: 7 | Y579: 3 | Z579: 0 | AA579: 1164 | AB579: 894 | AC579: 130.2 | AD579: 28
A580: COBURG | C580: 1 | D580: 1 | E580: =C580*6+D580 -> 7 | G580: 4 | H580: 5 | I580: =G580*6+H580 -> 29 | K580: 5 | L580: 8 | M580: =K580*6+L580 -> 38 | O580: 8 | P580: 14 | Q580: =O580*6+P580 -> 62 | S580: APPLEBY | W580: BRUNSWICK | X580: 6 | Y580: 5 | Z580: 0 | AA580: 1210 | AB580: 1015 | AC580: 119.21182266009852 | AD580: 24
A581: BEST PLAYERS | W581: CAMBERWELL | X581: 6 | Y581: 5 | Z581: 0 | AA581: 1278 | AB581: 1272 | AC581: 100.47 | AD581: 24
A582: PRESTON | C582: MATTHEWS | F582: DAWSON | I582: J NORMAN | L582: BOYD | N582: DUNSTONE | Q582: LOWENTHAL | W582: OAKLEIGH | X582: 4 | Y582: 6 | Z582: 0 | AA582: 1059 | AB582: 1061 | AC582: 99.81 | AD582: 16
A583: COBURG | C583: MURRAY | F583: GLENISTER | I583: McLEY | L583: HALL | N583: COLLINS | Q583: PROMNITZ | W583: BRIGHTON | X583: 4 | Y583: 7 | Z583: 0 | AA583: 1050 | AB583: 1210 | AC583: 86.776859504132233 | AD583: 16
A584: GOALKICKERS | W584: NORTHCOTE | X584: 2 | Y584: 9 | Z584: 0 | AA584: 916 | AB584: 1153 | AC584: 79.444926279271471 | AD584: 8
A585: PRESTON | C585: LYNCH 5 | F585: DUNSTONE 3 | I585: BOYD 2 | K585: TAYLOR 2 | N585: DEACON 2 | Q585: DAWSON | W585: YARRAVILLE | X585: 1 | Y585: 10 | Z585: 0 | AA585: 853 | AB585: 1453 | AC585: 58.71 | AD585: 4
A586: COBURG | C586: PRATT 2 | F586: COLLINS 2 | I586: HORE 2 | K586: SITCH | M586: McLEY | W586: SANDRINGHAM | X586: 0 | Y586: 11 | Z586: 0 | AA586: 681 | AB586: 1781 | AC586: 38.24 | AD586: 0
A588: PORT MELBOURNE | C588: 2 | D588: 3 | E588: =C588*6+D588 -> 15 | G588: 6 | H588: 8 | I588: =G588*6+H588 -> 44 | K588: 10 | L588: 10 | M588: =K588*6+L588 -> 70 | O588: 13 | P588: 16 | Q588: =O588*6+P588 -> 94 | S588: PORT MELBOURNE
A589: OAKLEIGH | C589: 3 | D589: 5 | E589: =C589*6+D589 -> 23 | G589: 4 | H589: 8 | I589: =G589*6+H589 -> 32 | K589: 6 | L589: 11 | M589: =K589*6+L589 -> 47 | O589: 9 | P589: 14 | Q589: =O589*6+P589 -> 68 | S589: PRENDERGAST
A590: BEST PLAYERS
A591: PORT MELBOURNE | C591: ROBERTSON | F591: FAIRWEATHER | J591: CASTLES | M591: GOLDSMITH | P591: ALSOP | R591: ONLEY
A592: OAKLEIGH | C592: HALL | F592: KENNEDY | J592: MARTIN | M592: WEISS | P592: WILSON | R592: BICKERTON
A593: GOALKICKERS
A594: PORT MELBOURNE | C594: RICHES 2 | F594: ALLEN 2 | I594: ROBERTSON 2 | L594: HURLEY 2 | N594: CASTLES 2 | Q594: FREYER | S594: LAHIFF | U594: JULIER
A595: OAKLEIGH | C595: BRENCHLEY 2 | F595: KENNEDY 2 | I595: HALL 2 | K595: WATSON | M595: COMERFORD | P595: McKENZIE
A597: BRIGHTON | C597: 3 | D597: 6 | E597: =C597*6+D597 -> 24 | G597: 4 | H597: 8 | I597: =G597*6+H597 -> 32 | K597: 8 | L597: 12 | M597: =K597*6+L597 -> 60 | O597: 11 | P597: 15 | Q597: =O597*6+P597 -> 81 | S597: ELSTERNWICK PARK
A598: NORTHCOTE | C598: 1 | D598: 3 | E598: =C598*6+D598 -> 9 | G598: 5 | H598: 8 | I598: =G598*6+H598 -> 38 | K598: 5 | L598: 8 | M598: =K598*6+L598 -> 38 | O598: 7 | P598: 12 | Q598: =O598*6+P598 -> 54 | S598: BATT
A599: BEST PLAYERS
A600: BRIGHTON | C600: BAKER | E600: MOFFATT | I600: HALLAHAN | L600: HALL | O600: JONES | Q600: NASH
A601: NORTHCOTE | C601: MORGAN | E601: DOWER | I601: WATT | L601: E HART | O601: ALLEN | Q601: McNAMARA
A602: GOALKICKERS
A603: BRIGHTON | C603: CONDON 3 | F603: JONES 2 | I603: NASH 2 | K603: MOFFATT | M603: SCOTT | O603: HARLEY | Q603: DEAN
A604: NORTHCOTE | C604: WHITE 3 | F604: HISCOX | H604: McNAMARA | K604: WARDELL | M604: ATKINSON
A606: BRUNSWICK | C606: 3 | D606: 5 | E606: =C606*6+D606 -> 23 | G606: 6 | H606: 8 | I606: =G606*6+H606 -> 44 | K606: 8 | L606: 10 | M606: =K606*6+L606 -> 58 | O606: 14 | P606: 13 | Q606: =O606*6+P606 -> 97 | S606: BRUNSWICK
A607: YARRAVILLE | C607: 2 | D607: 3 | E607: =C607*6+D607 -> 15 | G607: 3 | H607: 4 | I607: =G607*6+H607 -> 22 | K607: 6 | L607: 5 | M607: =K607*6+L607 -> 41 | O607: 6 | P607: 7 | Q607: =O607*6+P607 -> 43 | S607: GREGORY
A608: BEST PLAYERS
A609: BRUNSWICK | C609: FAY | F609: CHALLENGER | J609: GREGG | M609: WHITE | P609: McKERNAN | S609: HUNTER
A610: YARRAVILLE | C610: ROBERTSON | F610: RANN | J610: COULSON | M610: T SMITH | P610: B McVEIGH | S610: STREETER
A611: GOALKICKERS
A612: BRUNSWICK | C612: CHALLENGER 3 | F612: CRAWFORD 2 | I612: POWELL 2 | L612: WHITE 2 | N612: BAKER 2 | P612: HUNTER 2 | R612: QUINN
A613: YARRAVILLE | C613: ROBERTSON 3 | F613: WARDEN | I613: RANN | K613: BROADWAY
A615: CAMBERWELL | C615: 3 | D615: 5 | E615: =C615*6+D615 -> 23 | G615: 8 | H615: 11 | I615: =G615*6+H615 -> 59 | K615: 10 | L615: 15 | M615: =K615*6+L615 -> 75 | O615: 16 | P615: 23 | Q615: =O615*6+P615 -> 119 | S615: CAMBERWELL
A616: SANDRINGHAM | C616: 0 | D616: 2 | E616: =C616*6+D616 -> 2 | G616: 0 | H616: 4 | I616: =G616*6+H616 -> 4 | K616: 1 | L616: 6 | M616: =K616*6+L616 -> 12 | O616: 2 | P616: 6 | Q616: =O616*6+P616 -> 18 | S616: MEYER
A617: BEST PLAYERS
A618: CAMBERWELL | C618: HORKINGS | F618: WHITEHEAD | I618: TAYLOR | L618: AUSTEN | O618: SHARPLES | R618: McPHERSON
A619: SANDRINGHAM | C619: DINGLE | F619: LUCAS | I619: NAMM | L619: EVANS | O619: LINDEN | R619: NOTTLE
A620: GOALKICKERS
A621: CAMBERWELL | C621: HOPKINS 4 | F621: NASH 4 | H621: AUSTEN 3 | J621: WHITEHEAD | M621: CLAMP | O621: JORGENSON | R621: HENDERSON | V621: ANDERSON
A622: SANDRINGHAM | C622: DINGLE 2
A624: ROUND 12 | E624: 28TH JUNE | J624: WEATHER | M624: FINE | S624: PLAYED AT
D625: 1ST QTR | H625: 2ND QTR | L625: 3RD QTR | P625: FINAL | S625: PORT MELBOURNE
A626: PORT MELBOURNE | C626: 3 | D626: 5 | E626: =C626*6+D626 -> 23 | G626: 7 | H626: 11 | I626: =G626*6+H626 -> 53 | K626: 16 | L626: 15 | M626: =K626*6+L626 -> 111 | O626: 22 | P626: 20 | Q626: =O626*6+P626 -> 152 | S626: UMPIRE | X626: LADDER | AB626: ROUND | AD626: 12
A627: PRAHRAN | C627: 5 | D627: 3 | E627: =C627*6+D627 -> 33 | G627: 8 | H627: 8 | I627: =G627*6+H627 -> 56 | K627: 13 | L627: 12 | M627: =K627*6+L627 -> 90 | O627: 17 | P627: 13 | Q627: =O627*6+P627 -> 115 | S627: GROVES
A628: BEST PLAYERS | W628: TEAM | X628: W | Y628: L | Z628: D | AA628: FOR | AB628: AGST | AC628: % | AD628: PTS
A629: PORT MELBOURNE | C629: HAYES | F629: ALLEN | I629: RICHES | K629: GOLDSMITH | N629: CASTLES | Q629: ALSOP
A630: PRAHRAN | C630: THOMPSON | F630: JOHNSON | I630: WHITE | K630: WILLIAMS | N630: O'DONNELL | Q630: BULGER | W630: PRESTON | X630: 11 | Y630: 1 | Z630: 0 | AA630: 1525 | AB630: 1125 | AC630: 135.55555555555554 | AD630: 44
A631: GOALKICKERS | W631: PRAHRAN | X631: 10 | Y631: 2 | Z631: 0 | AA631: 1572 | AB631: 1075 | AC631: 146.23 | AD631: 40
A632: PORT MELBOURNE | C632: FREYER 6 | E632: ALLEN 5 | G632: ROBERTSON 4 | J632: HURLEY 4 | M632: LAHIFF | O632: FAIRWEATHER | R632: RICHES | W632: PORT MELBOURNE | X632: 9 | Y632: 3 | Z632: 0 | AA632: 1411 | AB632: 999 | AC632: 141.24 | AD632: 36
A633: PRAHRAN | C633: LYONS 5 | E633: O'DONNELL 3 | H633: PEARCE 3 | J633: ANDERS 2 | M633: DAVEY 2 | O633: WILLIAMS | Q633: WHITE | W633: WILLIAMSTOWN | X633: 8 | Y633: 3 | Z633: 0 | AA633: 1302 | AB633: 961 | AC633: 135.48 | AD633: 32
A635: COBURG | C635: 2 | D635: 6 | E635: =C635*6+D635 -> 18 | G635: 6 | H635: 10 | I635: =G635*6+H635 -> 46 | K635: 10 | L635: 18 | M635: =K635*6+L635 -> 78 | O635: 15 | P635: 21 | Q635: =O635*6+P635 -> 111 | S635: BRUNSWICK | W635: COBURG | X635: 8 | Y635: 4 | Z635: 0 | AA635: 1531 | AB635: 1171 | AC635: 130.74 | AD635: 32
A636: BRUNSWICK | C636: 4 | D636: 2 | E636: =C636*6+D636 -> 26 | G636: 8 | H636: 8 | I636: =G636*6+H636 -> 56 | K636: 12 | L636: 9 | M636: =K636*6+L636 -> 81 | O636: 14 | P636: 11 | Q636: =O636*6+P636 -> 95 | S636: MERRINGTON | W636: CAMBERWELL | X636: 7 | Y636: 5 | Z636: 0 | AA636: 1392 | AB636: 1363 | AC636: 102.13 | AD636: 28
A637: BEST PLAYERS | W637: BRUNSWICK | X637: 6 | Y637: 6 | Z637: 0 | AA637: 1305 | AB637: 1126 | AC637: 115.89698046181172 | AD637: 24
A638: COBURG | C638: RE | E638: GLENISTER | H638: COLLINS | K638: WILSON | N638: EVANS | Q638: McLEY | W638: BRIGHTON | X638: 5 | Y638: 7 | Z638: 0 | AA638: 1214 | AB638: 1278 | AC638: 94.992175273865413 | AD638: 20
A639: BRUNSWICK | C639: FAY | E639: COOLEY | H639: STANDFIELD | K639: McELROY | N639: WEBSTER | Q639: CHALLENGER | W639: OAKLEIGH | X639: 4 | Y639: 7 | Z639: 0 | AA639: 1150 | AB639: 1175 | AC639: 97.87 | AD639: 16
A640: GOALKICKERS | W640: NORTHCOTE | X640: 2 | Y640: 10 | Z640: 0 | AA640: 1048 | AB640: 1310 | AC640: 80 | AD640: 8
A641: COBURG | C641: McLEY 3 | E641: MULLENGER 3 | H641: COLLINS 3 | J641: EVANS 2 | M641: PRATT 2 | O641: GLENISTER 2 | W641: YARRAVILLE | X641: 1 | Y641: 11 | Z641: 0 | AA641: 920 | AB641: 1591 | AC641: 57.83 | AD641: 4
A642: BRUNSWICK | C642: WHITE 4 | E642: POWELL 3 | H642: COOLEY 2 | J642: WEBSTER 2 | M642: KEMP | O642: McELROY | Q642: HUNTER | W642: SANDRINGHAM | X642: 0 | Y642: 12 | Z642: 0 | AA642: 749 | AB642: 1945 | AC642: 38.51 | AD642: 0
A644: CAMBERWELL | C644: 5 | D644: 0 | E644: =C644*6+D644 -> 30 | G644: 9 | H644: 5 | I644: =G644*6+H644 -> 59 | K644: 13 | L644: 17 | M644: =K644*6+L644 -> 95 | O644: 16 | P644: 18 | Q644: =O644*6+P644 -> 114 | S644: CAMBERWELL
A645: OAKLEIGH | C645: 3 | D645: 8 | E645: =C645*6+D645 -> 26 | G645: 8 | H645: 12 | I645: =G645*6+H645 -> 60 | K645: 10 | L645: 12 | M645: =K645*6+L645 -> 72 | O645: 13 | P645: 13 | Q645: =O645*6+P645 -> 91 | S645: GREGORY
A646: BEST PLAYERS
A647: CAMBERWELL | C647: AUSTEN | E647: SHARPLES | H647: KENNETT | K647: NASH | N647: EWINS | Q647: TAYLOR
A648: OAKLEIGH | C648: WEISS | E648: MARTIN | H648: COMERFORD | K648: McKENZIE | N648: HALL | Q648: WATSON
A649: GOALKICKERS
A650: CAMBERWELL | C650: NASH 5 | F650: AUSTEN 4 | I650: JORGENSON 2 | L650: HOPKINS 2 | N650: CLAMP 2 | Q650: ANDERSON
A651: OAKLEIGH | C651: BEARD 3 | F651: BRENCHLEY 3 | I651: HALL 2 | K651: WATSON 2 | N651: McKENZIE 2 | Q651: CAUSON
A653: PRESTON | C653: 7 | D653: 6 | E653: =C653*6+D653 -> 48 | G653: 15 | H653: 7 | I653: =G653*6+H653 -> 97 | K653: 18 | L653: 10 | M653: =K653*6+L653 -> 118 | O653: 24 | P653: 13 | Q653: =O653*6+P653 -> 157 | S653: PRESTON
A654: NORTHCOTE | C654: 5 | D654: 4 | E654: =C654*6+D654 -> 34 | G654: 10 | H654: 5 | I654: =G654*6+H654 -> 65 | K654: 15 | L654: 10 | M654: =K654*6+L654 -> 100 | O654: 20 | P654: 12 | Q654: =O654*6+P654 -> 132 | S654: BATT
A655: BEST PLAYERS
A656: PRESTON | C656: BOYD | E656: LYNCH | H656: DOWLING | K656: CALVERT | N656: DEACON | Q656: CONNELLY
A657: NORTHCOTE | C657: E HART | E657: MORGAN | H657: E BRETHERTON | K657: ALLEN | N657: HISCOX | Q657: WHITE
A658: GOALKICKERS
A659: PRESTON | C659: LYNCH 12 | F659: BOYD 5 | H659: DEACON 3 | J659: DUNSTONE 2 | M659: DOWLING 2
A660: NORTHCOTE | C660: WHITE 7 | E660: ALLEN 3 | G660: McINTOSH 2 | J660: SHORTIS 2 | M660: McNAMARA 2 | P660: MORGAN | R660: HISCOX | U660: ATKINSON | X660: McNAMEE
E661: 5TH JULY | J661: WEATHER | M661: COLD SHOWERS S.W. WIND
A662: WILLIAMSTOWN | C662: 7 | D662: 7 | E662: =C662*6+D662 -> 49 | G662: 14 | H662: 9 | I662: =G662*6+H662 -> 93 | K662: 16 | L662: 13 | M662: =K662*6+L662 -> 109 | O662: 20 | P662: 18 | Q662: =O662*6+P662 -> 138 | S662: YARRAVILLE
A663: YARRAVILLE | C663: 1 | D663: 3 | E663: =C663*6+D663 -> 9 | G663: 3 | H663: 7 | I663: =G663*6+H663 -> 25 | K663: 6 | L663: 9 | M663: =K663*6+L663 -> 45 | O663: 9 | P663: 13 | Q663: =O663*6+P663 -> 67 | S663: APPLEBY
A664: BEST PLAYERS
A665: WILLIAMSTOWN | C665: FOTHERGILL | F665: MARSHAM | I665: TODD | L665: SPARGO | O665: SCOTT | Q665: WILCOX
A666: YARRAVILLE | C666: RANN | F666: B McVEIGH | I666: COULTON | L666: BEVAN | O666: WILSON | Q666: DAY
A667: GOALKICKERS
A668: WILLIAMSTOWN | C668: TODD 7 | E668: FOTHERGILL 4 | H668: VALLENCE 4 | K668: MARSHAM 2 | N668: JAMIESON | Q668: A McTAGGART | U668: GLASS
A669: YARRAVILLE | C669: BEVAN 3 | F669: F McVEIGH 2 | I669: RANN | K669: H SMITH | N669: McDONALD | Q669: PERUSSICH
E670: 12TH JULY | J670: WEATHER | M670: FINE
A671: BRIGHTON | C671: 2 | D671: 7 | E671: =C671*6+D671 -> 19 | G671: 9 | H671: 17 | I671: =G671*6+H671 -> 71 | K671: 12 | L671: 21 | M671: =K671*6+L671 -> 93 | O671: 23 | P671: 26 | Q671: =O671*6+P671 -> 164 | S671: ELSTERNWICK PARK
A672: SANDRINGHAM | C672: 2 | D672: 1 | E672: =C672*6+D672 -> 13 | G672: 4 | H672: 2 | I672: =G672*6+H672 -> 26 | K672: 10 | L672: 7 | M672: =K672*6+L672 -> 67 | O672: 10 | P672: 8 | Q672: =O672*6+P672 -> 68 | S672: PRENDERGAST
A673: BEST PLAYERS
A674: BRIGHTON | C674: JONES | E674: BAKER | H674: HALLAHAN | K674: D CONDON | N674: MOFFATT | Q674: SCOTT
A675: SANDRINGHAM | C675: CAVE | E675: EVANS | H675: NAMM | K675: LUCAS | N675: NOTTLE | Q675: BLAND
A676: GOALKICKERS
A677: BRIGHTON | C677: CARMICHAEL 4 | F677: D CONDON 4 | I677: JONES 4 | K677: HUNTER 3 | M677: SCOTT 2 | O677: HAGGIS 2 | Q677: WALSH 2 | T677: FROUDE | W677: HARLEY
A678: SANDRINGHAM | C678: LUCAS 2 | F678: CAVE | H678: CRUMP | J678: NOTTLE | L678: FOLLETT | N678: BLAND | P678: HEATH | R678: PRICE | T678: BACKMAN
A680: ROUND 13 | E680: 5TH JULY | J680: WEATHER | M680: COLD SHOWERS S.W. WIND | S680: PLAYED AT
D681: 1ST QTR | H681: 2ND QTR | L681: 3RD QTR | P681: FINAL | S681: NORTHCOTE
A682: BRUNSWICK | C682: 7 | D682: 2 | E682: =C682*6+D682 -> 44 | G682: 9 | H682: 4 | I682: =G682*6+H682 -> 58 | K682: 14 | L682: 12 | M682: =K682*6+L682 -> 96 | O682: 16 | P682: 14 | Q682: =O682*6+P682 -> 110 | S682: UMPIRE | X682: LADDER | AB682: ROUND | AD682: 13
A683: NORTHCOTE | C683: 2 | D683: 2 | E683: =C683*6+D683 -> 14 | G683: 6 | H683: 5 | I683: =G683*6+H683 -> 41 | K683: 8 | L683: 6 | M683: =K683*6+L683 -> 54 | O683: 13 | P683: 12 | Q683: =O683*6+P683 -> 90 | S683: BATT
A684: BEST PLAYERS | W684: TEAM | X684: W | Y684: L | Z684: D | AA684: FOR | AB684: AGST | AC684: % | AD684: PTS
A685: BRUNSWICK | C685: SMITH | E685: CHALLENGER | H685: GARDNER | L685: WHITE | N685: GREGG | Q685: McKERNAN
A686: NORTHCOTE | C686: DOWER | E686: E HART | H686: E BRETHERTON | L686: HISCOX | N686: McINTOSH | Q686: McNAMARA | W686: PRESTON | X686: 12 | Y686: 1 | Z686: 0 | AA686: 1616 | AB686: 1189 | AC686: 135.9125315391085 | AD686: 48
A687: GOALKICKERS | W687: PRAHRAN | X687: 10 | Y687: 3 | Z687: 0 | AA687: 1673 | AB687: 1181 | AC687: 141.66 | AD687: 40
A688: BRUNSWICK | C688: WHITE 4 | E688: COOLEY 4 | H688: CRISP 2 | J688: CRAWFORD 2 | M688: POWELL 2 | P688: QUINN | R688: STANDFIELD | W688: PORT MELBOURNE | X688: 10 | Y688: 3 | Z688: 0 | AA688: 1534 | AB688: 1119 | AC688: 137.09 | AD688: 40
A689: NORTHCOTE | C689: WHITE 3 | E689: MORGAN 2 | H689: HISCOX 2 | J689: ALLEN 2 | M689: McNAMARA 2 | P689: ATKINSON | R689: McNAMEE | W689: COBURG | X689: 9 | Y689: 4 | Z689: 0 | AA689: 1701 | AB689: 1230 | AC689: 138.29 | AD689: 36
A691: OAKLEIGH | C691: 3 | D691: 2 | E691: =C691*6+D691 -> 20 | G691: 9 | H691: 9 | I691: =G691*6+H691 -> 63 | K691: 11 | L691: 13 | M691: =K691*6+L691 -> 79 | O691: 18 | P691: 17 | Q691: =O691*6+P691 -> 125 | S691: OAKLEIGH | W691: WILLIAMSTOWN | X691: 8 | Y691: 4 | Z691: 0 | AA691: 1422 | AB691: 1084 | AC691: 131.18 | AD691: 32
A692: BRIGHTON | C692: 4 | D692: 6 | E692: =C692*6+D692 -> 30 | G692: 8 | H692: 7 | I692: =G692*6+H692 -> 55 | K692: 15 | L692: 10 | M692: =K692*6+L692 -> 100 | O692: 15 | P692: 10 | Q692: =O692*6+P692 -> 100 | S692: PRENDERGAST | W692: CAMBERWELL | X692: 8 | Y692: 5 | Z692: 0 | AA692: 1498 | AB692: 1464 | AC692: 102.32 | AD692: 32
A693: BEST PLAYERS | W693: BRUNSWICK | X693: 7 | Y693: 6 | Z693: 0 | AA693: 1415 | AB693: 1216 | AC693: 116.36513157894737 | AD693: 28
A694: OAKLEIGH | C694: WILSON | F694: WATSON | I694: McALLISTER | L694: BRENCHLEY | O694: KENNEDY | Q694: BICKERTON | W694: OAKLEIGH | X694: 5 | Y694: 7 | Z694: 0 | AA694: 1275 | AB694: 1275 | AC694: 100 | AD694: 20
A695: BRIGHTON | C695: HALLAHAN | F695: CONDON | I695: JONES | L695: HALL | O695: BAKER | Q695: MOFFAT | W695: BRIGHTON | X695: 5 | Y695: 8 | Z695: 0 | AA695: 1314 | AB695: 1403 | AC695: 93.656450463292941 | AD695: 20
A696: GOALKICKERS | R696: MOORE | T696: REID | W696: NORTHCOTE | X696: 2 | Y696: 11 | Z696: 0 | AA696: 1138 | AB696: 1420 | AC696: 80.140845070422529 | AD696: 8
A697: OAKLEIGH | C697: BRENCHLEY 3 | F697: McKENZIE 3 | I697: HALL 2 | K697: BEARD 2 | M697: WATSON 2 | P697: COMERFORD 2 | S697: KENNEDY 2 | W697: YARRAVILLE | X697: 1 | Y697: 12 | Z697: 0 | AA697: 979 | AB697: 1761 | AC697: 55.59 | AD697: 4
A698: BRIGHTON | C698: CONDON 4 | F698: CARMICHAEL 4 | J698: HARLEY 2 | M698: NASH 2 | O698: DEAN | Q698: SCOTT | S698: HALLAHAN | W698: SANDRINGHAM | X698: 0 | Y698: 13 | Z698: 0 | AA698: 813 | AB698: 2036 | AC698: 39.93 | AD698: 0
A700: PRESTON | C700: 4 | D700: 5 | E700: =C700*6+D700 -> 29 | G700: 5 | H700: 7 | I700: =G700*6+H700 -> 37 | K700: 11 | L700: 10 | M700: =K700*6+L700 -> 76 | O700: 13 | P700: 13 | Q700: =O700*6+P700 -> 91 | S700: BEACH ROAD
A701: SANDRINGHAM | C701: 2 | D701: 3 | E701: =C701*6+D701 -> 15 | G701: 4 | H701: 5 | I701: =G701*6+H701 -> 29 | K701: 7 | L701: 6 | M701: =K701*6+L701 -> 48 | O701: 9 | P701: 10 | Q701: =O701*6+P701 -> 64 | S701: GROVES
A702: BEST PLAYERS
A703: PRESTON | C703: LYNCH | E703: DOWLING | H703: TAYLOR | K703: DUNSTONE | N703: MASLEN | P703: DEACON
A704: SANDRINGHAM | C704: DINGLE | E704: CAVE | H704: BACKMAN | K704: BOURKE | N704: NAMM | P704: McCOY
A705: GOALKICKERS
A706: PRESTON | C706: LYNCH 7 | F706: DOWLING 2 | I706: DUNSTONE 2 | L706: EVERETT | N706: TAYLOR
A707: SANDRINGHAM | C707: BACKMAN 2 | F707: BAILES | H707: FOLLETT | J707: PRICE | L707: HEATH | N707: LUCAS | P707: BLAND | R707: CAVE
E708: 12TH JULY | J708: WEATHER | M708: FINE
A709: PORT MELBOURNE | C709: 5 | D709: 2 | E709: =C709*6+D709 -> 32 | G709: 10 | H709: 6 | I709: =G709*6+H709 -> 66 | K709: 12 | L709: 17 | M709: =K709*6+L709 -> 89 | O709: 17 | P709: 21 | Q709: =O709*6+P709 -> 123 | S709: WILLIAMSTOWN
A710: WILLIAMSTOWN | C710: 6 | D710: 1 | E710: =C710*6+D710 -> 37 | G710: 9 | H710: 5 | I710: =G710*6+H710 -> 59 | K710: 14 | L710: 5 | M710: =K710*6+L710 -> 89 | O710: 19 | P710: 6 | Q710: =O710*6+P710 -> 120 | S710: MEYER
A711: BEST PLAYERS
A712: PORT MELBOURNE | C712: CASTLES | F712: HAYES | I712: ONLEY | L712: LAHIFF | O712: LIVINGSTONE | R712: McBETH
A713: WILLIAMSTOWN | C713: FOTHERGILL | F713: PATTINSON | I713: SCOTT | L713: OGDEN | O713: WILCOX | R713: JOHNSON
A714: GOALKICKERS
A715: PORT MELBOURNE | C715: FREYER 4 | E715: LAHIFF 3 | G715: ROBERTSON 2 | J715: GOLDSMITH 2 | M715: ALLEN 2 | O715: RICHES | Q715: REYNOLDS | T715: LIVINGSTONE | X715: PANNELL
A716: WILLIAMSTOWN | C716: VALLENCE 5 | F716: FOTHERGILL 4 | I716: TODD 4 | K716: MARSHAM | N716: PATTINSON | Q716: GLASS | S716: JAMIESON | W716: A McTAGGART | X716: THOMAS
A718: CAMBERWELL | C718: 4 | D718: 7 | E718: =C718*6+D718 -> 31 | G718: 7 | H718: 11 | I718: =G718*6+H718 -> 53 | K718: 11 | L718: 13 | M718: =K718*6+L718 -> 79 | O718: 15 | P718: 16 | Q718: =O718*6+P718 -> 106 | S718: TOORAK PARK
A719: PRAHRAN | C719: 2 | D719: 2 | E719: =C719*6+D719 -> 14 | G719: 8 | H719: 7 | I719: =G719*6+H719 -> 55 | K719: 11 | L719: 14 | M719: =K719*6+L719 -> 80 | O719: 14 | P719: 17 | Q719: =O719*6+P719 -> 101 | S719: APPLEBY
A720: BEST PLAYERS
A721: CAMBERWELL | C721: SPINKS | E721: NASH | H721: HORKINGS | K721: McPHERSON | O721: CLAMP | Q721: FINN
A722: PRAHRAN | C722: TUCKER | E722: PEARCE | H722: THOMPSON | K722: WHITE | O722: FAUL | Q722: NEWTON
A723: GOALKICKERS
A724: CAMBERWELL | C724: NASH 7 | F724: CLAMP 3 | I724: AUSTEN | K724: HENDERSON | N724: HOPKINS | P724: FARRELLY | S724: WHITEHEAD
A725: PRAHRAN | C725: LYONS 4 | F725: ROLFE 4 | I725: WHITE 2 | K725: PEARCE 2 | N725: ROWELL | P725: MURFITT
A727: COBURG | C727: 6 | D727: 3 | E727: =C727*6+D727 -> 39 | G727: 16 | H727: 9 | I727: =G727*6+H727 -> 105 | K727: 18 | L727: 13 | M727: =K727*6+L727 -> 121 | O727: 25 | P727: 20 | Q727: =O727*6+P727 -> 170 | S727: COBURG
A728: YARRAVILLE | C728: 2 | D728: 3 | E728: =C728*6+D728 -> 15 | G728: 3 | H728: 5 | I728: =G728*6+H728 -> 23 | K728: 6 | L728: 8 | M728: =K728*6+L728 -> 44 | O728: 8 | P728: 11 | Q728: =O728*6+P728 -> 59 | S728: MERRINGTON
A729: BEST PLAYERS
A730: COBURG | C730: GLENISTER | F730: McLEY | I730: PRATT | L730: COLLINS | O730: PROMNITZ | R730: ATKINSON
A731: YARRAVILLE | C731: ROBERTSON | F731: KENNY | I731: NEIL | L731: WHITE | O731: BEVAN | R731: T SMITH
A732: GOALKICKERS
A733: COBURG | C733: PRATT 16 | F733: COLLINS 4 | I733: McLEY 3 | K733: MILTE | M733: MULLENGER
A734: YARRAVILLE | C734: F McVEIGH 3 | F734: B McvEIGH 2 | I734: ROBERTSON 2 | L734: BEVAN
A736: ROUND 14 | E736: 19TH JULY | J736: WEATHER | M736: FINE N.W. BREEZE | S736: PLAYED AT
D737: 1ST QTR | H737: 2ND QTR | L737: 3RD QTR | P737: FINAL | S737: COBURG
A738: WILLIAMSTOWN | C738: 1 | D738: 5 | E738: =C738*6+D738 -> 11 | G738: 5 | H738: 12 | I738: =G738*6+H738 -> 42 | K738: 9 | L738: 13 | M738: =K738*6+L738 -> 67 | O738: 16 | P738: 14 | Q738: =O738*6+P738 -> 110 | S738: UMPIRE | X738: LADDER | AB738: ROUND | AD738: 14
A739: COBURG | C739: 3 | D739: 1 | E739: =C739*6+D739 -> 19 | G739: 6 | H739: 3 | I739: =G739*6+H739 -> 39 | K739: 11 | L739: 8 | M739: =K739*6+L739 -> 74 | O739: 15 | P739: 9 | Q739: =O739*6+P739 -> 99 | S739: PRENDERGAST
A740: BEST PLAYERS | W740: TEAM | X740: W | Y740: L | Z740: D | AA740: FOR | AB740: AGST | AC740: % | AD740: PTS
A741: WILLIAMSTOWN | C741: FOTHERGILL | F741: WILCOX | I741: SCOTT | K741: DELLER | N741: OGDEN | Q741: SPARGO
A742: COBURG | C742: SITCH | F742: EVANS | I742: WILSON | K742: COLLINS | N742: GLENISTER | Q742: PROMNITZ | W742: PRESTON | X742: 13 | Y742: 1 | Z742: 0 | AA742: 1797 | AB742: 1260 | AC742: 142.61904761904762 | AD742: 52
A743: GOALKICKERS | W743: PRAHRAN | X743: 11 | Y743: 3 | Z743: 0 | AA743: 1871 | AB743: 1297 | AC743: 144.26 | AD743: 44
A744: WILLIAMSTOWN | C744: A McTAGGART 4 | G744: FOTHERGILL 4 | J744: TODD 3 | L744: CHISHOLM 3 | O744: VALLENCE | Q744: SALVAS | W744: PORT MELBOURNE | X744: 11 | Y744: 3 | Z744: 0 | AA744: 1661 | AB744: 1236 | AC744: 134.49 | AD744: 44
A745: COBURG | C745: PRATT 7 | F745: COLLINS 3 | I745: EVANS 2 | K745: MULLENGER | N745: BROWN | P745: WILSON | W745: COBURG | X745: 9 | Y745: 5 | Z745: 0 | AA745: 1800 | AB745: 1340 | AC745: 134.33 | AD745: 36
A747: PORT MELBOURNE | C747: 5 | D747: 6 | E747: =C747*6+D747 -> 36 | G747: 9 | H747: 11 | I747: =G747*6+H747 -> 65 | K747: 12 | L747: 12 | M747: =K747*6+L747 -> 84 | O747: 19 | P747: 13 | Q747: =O747*6+P747 -> 127 | S747: CAMBERWELL | W747: WILLIAMSTOWN | X747: 9 | Y747: 4 | Z747: 0 | AA747: 1532 | AB747: 1183 | AC747: 129.5 | AD747: 36
A748: CAMBERWELL | C748: 4 | D748: 1 | E748: =C748*6+D748 -> 25 | G748: 7 | H748: 7 | I748: =G748*6+H748 -> 49 | K748: 14 | L748: 13 | M748: =K748*6+L748 -> 97 | O748: 17 | P748: 15 | Q748: =O748*6+P748 -> 117 | S748: GROVES | W748: BRUNSWICK | X748: 8 | Y748: 6 | Z748: 0 | AA748: 1623 | AB748: 1246 | AC748: 130.25682182985554 | AD748: 32
A749: BEST PLAYERS | W749: CAMBERWELL | X749: 8 | Y749: 6 | Z749: 0 | AA749: 1615 | AB749: 1591 | AC749: 101.51 | AD749: 32
A750: PORT MELBOURNE | C750: LAHIFF | F750: CASTLES | I750: REYNOLDS | L750: ROBERTSON | O750: BARNETT | R750: TANNER | W750: OAKLEIGH | X750: 5 | Y750: 8 | Z750: 0 | AA750: 1346 | AB750: 1456 | AC750: 92.45 | AD750: 20
A751: CAMBERWELL | C751: HENDERSON | F751: WHITEHEAD | I751: NASH | L751: SPINKS | O751: HORKINGS | R751: BOND | W751: BRIGHTON | X751: 5 | Y751: 9 | Z751: 0 | AA751: 1430 | AB751: 1581 | AC751: 90.449082858950035 | AD751: 20
A752: GOALKICKERS | W752: NORTHCOTE | X752: 3 | Y752: 11 | Z752: 0 | AA752: 1265 | AB752: 1513 | AC752: 83.608724388631856 | AD752: 12
A753: PORT MELBOURNE | C753: LAHIFF 7 | E753: ROBERTSON 6 | H753: ALLEN 3 | J753: CASTLES | L753: RICHES | N753: GOLDSMITH | W753: YARRAVILLE | X753: 1 | Y753: 13 | Z753: 0 | AA753: 1072 | AB753: 1888 | AC753: 56.78 | AD753: 4
A754: CAMBERWELL | C754: NASH 4 | E754: CLAMP 4 | G754: FARRELLY 3 | J754: McKAY 2 | M754: BOND 2 | O754: WHITEHEAD 2 | W754: SANDRINGHAM | X754: 0 | Y754: 14 | Z754: 0 | AA754: 843 | AB754: 2244 | AC754: 37.57 | AD754: 0
A756: PRESTON | C756: 6 | D756: 3 | E756: =C756*6+D756 -> 39 | G756: 12 | H756: 12 | I756: =G756*6+H756 -> 84 | K756: 18 | L756: 13 | M756: =K756*6+L756 -> 121 | O756: 27 | P756: 19 | Q756: =O756*6+P756 -> 181 | S756: PRESTON
A757: OAKLEIGH | C757: 3 | D757: 3 | E757: =C757*6+D757 -> 21 | G757: 5 | H757: 4 | I757: =G757*6+H757 -> 34 | K757: 9 | L757: 5 | M757: =K757*6+L757 -> 59 | O757: 11 | P757: 5 | Q757: =O757*6+P757 -> 71 | S757: BATT
A758: BEST PLAYERS
A759: PRESTON | C759: CONNELY | F759: LYNCH | I759: EVERETT | L759: STERLING | O759: LOWENTHAL | R759: BOYD
A760: OAKLEIGH | C760: MARTIN | F760: HALL | I760: CLARKE | L760: WILSON | O760: McALLISTER | R760: COMERFORD
A761: GOALKICKERS
A762: PRESTON | C762: LYNCH 11 | F762: DOWLING 5 | I762: BOYD 4 | K762: DUNSTONE 3 | N762: CONNELLY 2 | Q762: NORMAN | S762: SEEDSMAN
A763: OAKLEIGH | C763: KENNEDY 2 | F763: HALL 2 | I763: McKENZIE 2 | L763: MOORE | N763: BRENCHLEY | Q763: HILL | S763: WEISS | U763: BEARD
A765: NORTHCOTE | C765: 3 | D765: 1 | E765: =C765*6+D765 -> 19 | G765: 11 | H765: 3 | I765: =G765*6+H765 -> 69 | K765: 15 | L765: 5 | M765: =K765*6+L765 -> 95 | O765: 20 | P765: 7 | Q765: =O765*6+P765 -> 127 | S765: YARRAVILLE
A766: YARRAVILLE | C766: 2 | D766: 6 | E766: =C766*6+D766 -> 18 | G766: 4 | H766: 7 | I766: =G766*6+H766 -> 31 | K766: 9 | L766: 11 | M766: =K766*6+L766 -> 65 | O766: 13 | P766: 15 | Q766: =O766*6+P766 -> 93 | S766: MEYER
A767: BEST PLAYERS
A768: NORTHCOTE | C768: BAGULEY | F768: DOWER | I768: HISCOX | L768: ALLEN | O768: D BRETHERTON | S768: WALLIS
A769: YARRAVILLE | C769: ROBERTSON | F769: F McVEIGH | I769: GARLICK | L769: STREETER | O769: T SMITH | S769: B McVEIGH
A770: GOALKICKERS
A771: NORTHCOTE | C771: HISCOX 6 | E771: WHITE 5 | G771: ALLEN 2 | I771: MORGAN 2 | L771: SHORTIS | N771: LEMPRIERE | Q771: E STABB | S771: ATKINSON | V771: WALLIS
A772: YARRAVILLE | C772: GARLICK 4 | F772: F McVEIGH 2 | I772: PERUSSICH 2 | L772: BEVAN | N772: COULTON | P772: McDONALD | S772: BROADWAY | V772: ROBERTSON
A774: PRAHRAN | C774: 6 | D774: 3 | E774: =C774*6+D774 -> 39 | G774: 15 | H774: 11 | I774: =G774*6+H774 -> 101 | K774: 18 | L774: 13 | M774: =K774*6+L774 -> 121 | O774: 27 | P774: 16 | Q774: =O774*6+P774 -> 178 | S774: ELSTERNWICK PARK
A775: BRIGHTON | C775: 5 | D775: 2 | E775: =C775*6+D775 -> 32 | G775: 8 | H775: 4 | I775: =G775*6+H775 -> 52 | K775: 13 | L775: 11 | M775: =K775*6+L775 -> 89 | O775: 17 | P775: 14 | Q775: =O775*6+P775 -> 116 | S775: MERRINGTON
A776: BEST PLAYERS
A777: PRAHRAN | C777: GRAVELL | F777: NEWTON | I777: MAHON | L777: FAUL | O777: PEARCE | R777: WHITE
A778: BRIGHTON | C778: HALLAHAN | F778: MOFFATT | I778: SCOTT | L778: JONES | O778: D CONDON | R778: M CONDON
A779: GOALKICKERS
A780: PRAHRAN | C780: LYONS 8 | F780: PEARCE 7 | I780: WHITE 4 | K780: GRAVELL 3 | N780: DAVEY 2 | P780: O'DONNELL | S780: WILLIAMS | V780: RAYMENT
A781: BRIGHTON | C781: D CONDON 4 | F781: CARMICHAEL 3 | J781: LUCAS 3 | L781: JONES 3 | N781: WALSH 2 | Q781: HUNTER | S781: SCOTT
A783: BRUNSWICK | C783: 5 | D783: 11 | E783: =C783*6+D783 -> 41 | G783: 17 | H783: 15 | I783: =G783*6+H783 -> 117 | K783: 22 | L783: 20 | M783: =K783*6+L783 -> 152 | O783: 30 | P783: 28 | Q783: =O783*6+P783 -> 208 | S783: BRUNSWICK
A784: SANDRINGHAM | C784: 0 | D784: 4 | E784: =C784*6+D784 -> 4 | G784: 1 | H784: 6 | I784: =G784*6+H784 -> 12 | K784: 2 | L784: 8 | M784: =K784*6+L784 -> 20 | O784: 3 | P784: 12 | Q784: =O784*6+P784 -> 30 | S784: APPLEBY
A785: BEST PLAYERS
A786: BRUNSWICK | C786: N SMITH | E786: CRAWFORD | I786: CHALLENGER | L786: BAKER | O786: COOLEY | R786: GREGG
A787: SANDRINGHAM | C787: EVANS | E787: BLAND | I787: LAVER | L787: BACKMAN | O787: NAMM | R787: CAVE
A788: GOALKICKERS
A789: BRUNSWICK | C789: COOLEY 7 | E789: WHITE 6 | G789: McELROY 6 | J789: CHALLENGER 3 | M789: WEBSTER 3 | P789: CRAWFORD 2 | S789: HOBBA | U789: SMITH | W789: FAY
A790: SANDRINGHAM | C790: WEIR | F790: BLAND | I790: McCONCHIE
A792: ROUND 15 | E792: 26TH JULY | J792: WEATHER | M792: FINE S.E.BREEZE | S792: PLAYED AT
D793: 1ST QTR | H793: 2ND QTR | L793: 3RD QTR | P793: FINAL | S793: TOORAK PARK
A794: PRAHRAN | C794: 3 | D794: 5 | E794: =C794*6+D794 -> 23 | G794: 5 | H794: 13 | I794: =G794*6+H794 -> 43 | K794: 10 | L794: 19 | M794: =K794*6+L794 -> 79 | O794: 12 | P794: 27 | Q794: =O794*6+P794 -> 99 | S794: UMPIRE | X794: LADDER | AB794: ROUND | AD794: 15
A795: PRESTON | C795: 5 | D795: 3 | E795: =C795*6+D795 -> 33 | G795: 9 | H795: 6 | I795: =G795*6+H795 -> 60 | K795: 11 | L795: 7 | M795: =K795*6+L795 -> 73 | O795: 14 | P795: 9 | Q795: =O795*6+P795 -> 93 | S795: APPLEBY
A796: BEST PLAYERS | W796: TEAM | X796: W | Y796: L | Z796: D | AA796: FOR | AB796: AGST | AC796: % | AD796: PTS
A797: PRAHRAN | C797: TUCKER | E797: FAUL | H797: MAHON | K797: THOMPSON | N797: ROWELL | Q797: WHITE
A798: PRESTON | C798: MASLEN | E798: DUNSTONE | H798: LYNCH | K798: EVERETT | N798: NORMAN | Q798: DAWSON | W798: PRESTON | X798: 13 | Y798: 2 | Z798: 0 | AA798: 1890 | AB798: 1359 | AC798: 139.0728476821192 | AD798: 52
A799: GOALKICKERS | W799: PRAHRAN | X799: 12 | Y799: 3 | Z799: 0 | AA799: 1950 | AB799: 1390 | AC799: 140.28 | AD799: 48
A800: PRAHRAN | C800: LYONS 3 | F800: O'DONNELL 3 | I800: GRAVELL 2 | L800: ROLFE 2 | N800: PEARCE | P800: MURPHY | W800: PORT MELBOURNE | X800: 12 | Y800: 3 | Z800: 0 | AA800: 1837 | AB800: 1342 | AC800: 136.89 | AD800: 48
A801: PRESTON | C801: LYNCH 7 | F801: SEEDSMAN 2 | I801: BOYD | K801: DUNSTONE | N801: EVERETT | P801: DOWLING | R801: CONNELLY | W801: COBURG | X801: 10 | Y801: 5 | Z801: 0 | AA801: 1867 | AB801: 1400 | AC801: 133.36 | AD801: 40
A803: CAMBERWELL | C803: 3 | D803: 7 | E803: =C803*6+D803 -> 25 | G803: 5 | H803: 10 | I803: =G803*6+H803 -> 40 | K803: 13 | L803: 14 | M803: =K803*6+L803 -> 92 | O803: 17 | P803: 17 | Q803: =O803*6+P803 -> 119 | S803: WILLIAMSTOWN | W803: BRUNSWICK | X803: 9 | Y803: 6 | Z803: 0 | AA803: 1725 | AB803: 1332 | AC803: 129.5045045045045 | AD803: 36
A804: WILLIAMSTOWN | C804: 4 | D804: 3 | E804: =C804*6+D804 -> 27 | G804: 10 | H804: 9 | I804: =G804*6+H804 -> 69 | K804: 13 | L804: 12 | M804: =K804*6+L804 -> 90 | O804: 16 | P804: 21 | Q804: =O804*6+P804 -> 117 | S804: GROVES | W804: WILLIAMSTOWN | X804: 9 | Y804: 5 | Z804: 0 | AA804: 1649 | AB804: 1302 | AC804: 126.65 | AD804: 36
A805: BEST PLAYERS | W805: CAMBERWELL | X805: 9 | Y805: 6 | Z805: 0 | AA805: 1734 | AB805: 1708 | AC805: 101.52 | AD805: 36
A806: CAMBERWELL | C806: McKAY | E806: BENNETT | H806: BOND | K806: SPINKS | N806: ANDERSON | Q806: CLAMP | W806: OAKLEIGH | X806: 5 | Y806: 9 | Z806: 0 | AA806: 1432 | AB806: 1558 | AC806: 91.91 | AD806: 20
A807: WILLIAMSTOWN | C807: JOHNSON | E807: FOTHERGILL | H807: WILCOX | K807: MARSHAM | N807: CHISHOLM | Q807: PATTINSON | W807: BRIGHTON | X807: 5 | Y807: 10 | Z807: 0 | AA807: 1536 | AB807: 1757 | AC807: 87.421741605008535 | AD807: 20
A808: GOALKICKERS | W808: NORTHCOTE | X808: 3 | Y808: 12 | Z808: 0 | AA808: 1325 | AB808: 1580 | AC808: 83.860759493670884 | AD808: 12
A809: CAMBERWELL | C809: BOND 5 | E809: NASH 4 | G809: ALLEN 2 | I809: JORGENSON 2 | L809: CLAMP 2 | N809: HOPKINS | P809: FINN | W809: YARRAVILLE | X809: 2 | Y809: 13 | Z809: 0 | AA809: 1201 | AB809: 1990 | AC809: 60.35 | AD809: 8
A810: WILLIAMSTOWN | C810: FOTHERGILL 5 | F810: CHISHOLM 4 | I810: SALVAS 3 | L810: VALLENCE 2 | O810: A McTAGGART | R810: FITCH | W810: SANDRINGHAM | X810: 0 | Y810: 15 | Z810: 0 | AA810: 945 | AB810: 2373 | AC810: 39.82 | AD810: 0
A812: PORT MELBOURNE | C812: 10 | D812: 8 | E812: =C812*6+D812 -> 68 | G812: 14 | H812: 11 | I812: =G812*6+H812 -> 95 | K812: 21 | L812: 16 | M812: =K812*6+L812 -> 142 | O812: 26 | P812: 20 | Q812: =O812*6+P812 -> 176 | S812: PORT MELBOURNE
A813: BRIGHTON | C813: 3 | D813: 2 | E813: =C813*6+D813 -> 20 | G813: 5 | H813: 10 | I813: =G813*6+H813 -> 40 | K813: 9 | L813: 14 | M813: =K813*6+L813 -> 68 | O813: 15 | P813: 16 | Q813: =O813*6+P813 -> 106 | S813: BATT
A814: BEST PLAYERS
A815: PORT MELBOURNE | C815: GOLDSMITH | F815: CASTLES | I815: HAYES | L815: ROBERTSON | O815: TANNER | R815: ONLEY
A816: BRIGHTON | C816: FROUDE | F816: HALL | I816: HALLAHAN | L816: WEBER | O816: CARMICHAEL | R816: JONES
A817: GOALKICKERS
A818: PORT MELBOURNE | C818: ROBERTSON 10 | F818: RICHES 5 | I818: LAHIFF 4 | K818: JULIER 3 | M818: CASTLES | O818: KELLY | Q818: GOLDSMITH | T818: BARNETT
A819: BRIGHTON | C819: CARMICHAEL 4 | F819: WEBER 3 | I819: D CONDON | K819: HAGGIS | M819: DEAN | O819: SCOTT | Q819: LUCAS | S819: PAGE | U819: ALVIN | W819: JONES
A821: BRUNSWICK | C821: 2 | D821: 3 | E821: =C821*6+D821 -> 15 | G821: 7 | H821: 8 | I821: =G821*6+H821 -> 50 | K821: 11 | L821: 13 | M821: =K821*6+L821 -> 79 | O821: 14 | P821: 18 | Q821: =O821*6+P821 -> 102 | S821: OAKLEIGH
A822: OAKLEIGH | C822: 2 | D822: 3 | E822: =C822*6+D822 -> 15 | G822: 3 | H822: 6 | I822: =G822*6+H822 -> 24 | K822: 8 | L822: 11 | M822: =K822*6+L822 -> 59 | O822: 12 | P822: 14 | Q822: =O822*6+P822 -> 86 | S822: GREGORY
A823: BEST PLAYERS
A824: BRUNSWICK | C824: McELROY | E824: GREGG | H824: CRAWFORD | K824: COOLEY | N824: HOBBA | Q824: SMITH
A825: OAKLEIGH | C825: WILSON | E825: McALLISTER | H825: KENNEDY | K825: McKENZIE | N825: HALL | Q825: CLARKE
A826: GOALKICKERS
A827: BRUNSWICK | C827: WHITE 6 | F827: WEBSTER 2 | I827: McELROY 2 | L827: COOLEY | N827: CRISP | P827: SMITH | R827: GARDNER
A828: OAKLEIGH | C828: BRENCHLEY 3 | F828: G WATSON 3 | I828: HALL 2 | K828: McKENZIE 2 | N828: KENNEDY | Q828: WHITE
A830: YARRAVILLE | C830: 5 | D830: 5 | E830: =C830*6+D830 -> 35 | G830: 9 | H830: 9 | I830: =G830*6+H830 -> 63 | K830: 16 | L830: 12 | M830: =K830*6+L830 -> 108 | O830: 19 | P830: 15 | Q830: =O830*6+P830 -> 129 | S830: BEACH ROAD
A831: SANDRINGHAM | C831: 3 | D831: 6 | E831: =C831*6+D831 -> 24 | G831: 7 | H831: 8 | I831: =G831*6+H831 -> 50 | K831: 10 | L831: 11 | M831: =K831*6+L831 -> 71 | O831: 15 | P831: 12 | Q831: =O831*6+P831 -> 102 | S831: PRENDERGAST
A832: BEST PLAYERS
A833: YARRAVILLE | C833: B McVEIGH | F833: BOASE | I833: BEVAN | L833: RANN | O833: GARLICK | R833: HILET
A834: SANDRINGHAM | C834: CAVE | F834: BACKMAN | I834: NAMM | L834: PRICE | O834: LUCAS | R834: MILLER
A835: GOALKICKERS
A836: YARRAVILLE | C836: GARLICK 9 | F836: B McVEIGH 6 | I836: McPHERSON 2 | L836: HILET | N836: BROADWAY
A837: SANDRINGHAM | C837: PRICE 5 | F837: BURNS 3 | I837: BACKMAN 2 | L837: FOLLETT 2 | O837: CAVE | Q837: LUCAS | S837: W BLAND
A839: COBURG | C839: 0 | D839: 0 | E839: =C839*6+D839 -> 0 | G839: 4 | H839: 3 | I839: =G839*6+H839 -> 27 | K839: 6 | L839: 6 | M839: =K839*6+L839 -> 42 | O839: 9 | P839: 13 | Q839: =O839*6+P839 -> 67 | S839: NORTHCOTE
A840: NORTHCOTE | C840: 0 | D840: 10 | E840: =C840*6+D840 -> 10 | G840: 5 | H840: 12 | I840: =G840*6+H840 -> 42 | K840: 6 | L840: 12 | M840: =K840*6+L840 -> 48 | O840: 7 | P840: 18 | Q840: =O840*6+P840 -> 60 | S840: BATT
A841: BEST PLAYERS
A842: COBURG | C842: PROMNITZ | G842: COLLINS | J842: McLEY | M842: EVANS | O842: SITCH | R842: WILSON
A843: NORTHCOTE | C843: E BRETHERTON | G843: McNAMARA | J843: WATT | M843: HISCOX | O843: MORGAN | R843: DRYDEN
A844: GOALKICKERS
A845: COBURG | C845: PRATT 3 | F845: GLENISTER 2 | I845: WILSON 2 | K845: COLLINS | M845: FINN
A846: NORTHCOTE | C846: WHITE 2 | F846: McINTOSH 2 | I846: E STABB | K846: MORGAN | M846: SHORTIS
A848: ROUND 16 | E848: 2ND AUGUST | J848: WEATHER | M848: FINE STRONG NORTH WIND | S848: PLAYED AT
D849: 1ST QTR | H849: 2ND QTR | L849: 3RD QTR | P849: FINAL | S849: PRESTON
A850: PORT MELBOURNE | C850: 6 | D850: 5 | E850: =C850*6+D850 -> 41 | G850: 6 | H850: 5 | I850: =G850*6+H850 -> 41 | K850: 15 | L850: 11 | M850: =K850*6+L850 -> 101 | O850: 19 | P850: 14 | Q850: =O850*6+P850 -> 128 | S850: UMPIRE | X850: LADDER | AB850: ROUND | AD850: 16
A851: PRESTON | C851: 2 | D851: 1 | E851: =C851*6+D851 -> 13 | G851: 6 | H851: 12 | I851: =G851*6+H851 -> 48 | K851: 7 | L851: 14 | M851: =K851*6+L851 -> 56 | O851: 13 | P851: 18 | Q851: =O851*6+P851 -> 96 | S851: APPLEBY
A852: BEST PLAYERS | W852: TEAM | X852: W | Y852: L | Z852: D | AA852: FOR | AB852: AGST | AC852: % | AD852: PTS
A853: PORT MELBOURNE | C853: ROBERTSON | F853: GODFREDSON | I853: LAHIFF | L853: HAYES | O853: FAIRWEATHER | R853: ALLEN
A854: PRESTON | C854: CALVERT | F854: ROSS | I854: MASLEN | L854: DEACON | O854: ROACH | R854: NORMAN | W854: PORT MELBOURNE | X854: 13 | Y854: 3 | Z854: 0 | AA854: 1965 | AB854: 1438 | AC854: 136.65 | AD854: 52
A855: GOALKICKERS | W855: PRESTON | X855: 13 | Y855: 3 | Z855: 0 | AA855: 1986 | AB855: 1487 | AC855: 133.55749831876261 | AD855: 52
A856: PORT MELBOURNE | C856: ROBERTSON 8 | F856: ALLEN 3 | H856: LIVINGSTONE 2 | K856: RICHES 2 | M856: LAHIFF 2 | O856: KELLY | Q856: GOLDSMITH | W856: PRAHRAN | X856: 12 | Y856: 4 | Z856: 0 | AA856: 2012 | AB856: 1552 | AC856: 129.64 | AD856: 48
A857: PRESTON | C857: ROSS 4 | E857: BOYD 3 | G857: LYNCH 2 | I857: DUNSTONE | L857: EVERETT | N857: ROACH | P857: NORMAN | W857: COBURG | X857: 11 | Y857: 5 | Z857: 0 | AA857: 2079 | AB857: 1427 | AC857: 145.69 | AD857: 44
A859: BRUNSWICK | C859: 7 | D859: 4 | E859: =C859*6+D859 -> 46 | G859: 11 | H859: 7 | I859: =G859*6+H859 -> 73 | K859: 22 | L859: 10 | M859: =K859*6+L859 -> 142 | O859: 25 | P859: 12 | Q859: =O859*6+P859 -> 162 | S859: BRUNSWICK | W859: BRUNSWICK | X859: 10 | Y859: 6 | Z859: 0 | AA859: 1887 | AB859: 1394 | AC859: 135.36585365853659 | AD859: 40
A860: PRAHRAN | C860: 1 | D860: 3 | E860: =C860*6+D860 -> 9 | G860: 3 | H860: 7 | I860: =G860*6+H860 -> 25 | K860: 5 | L860: 10 | M860: =K860*6+L860 -> 40 | O860: 8 | P860: 14 | Q860: =O860*6+P860 -> 62 | S860: GROVES | W860: WILLIAMSTOWN | X860: 9 | Y860: 6 | Z860: 0 | AA860: 1731 | AB860: 1415 | AC860: 122.33 | AD860: 36
A861: BEST PLAYERS | W861: CAMBERWELL | X861: 9 | Y861: 7 | Z861: 0 | AA861: 1831 | AB861: 1807 | AC861: 101.33 | AD861: 36
A862: BRUNSWICK | C862: HOBBA | E862: CRAWFORD | H862: McELROY | K862: CAMPBELL | N862: FAY | Q862: GARDNER | W862: BRIGHTON | X862: 6 | Y862: 10 | Z862: 0 | AA862: 1635 | AB862: 1854 | AC862: 88.187702265372167 | AD862: 24
A863: PRAHRAN | C863: NEWTON | E863: JOHNSON | H863: TUCKER | K863: PROBYN | N863: PEARCE | Q863: FAUL | W863: OAKLEIGH | X863: 5 | Y863: 10 | Z863: 0 | AA863: 1570 | AB863: 1688 | AC863: 93.01 | AD863: 20
A864: GOALKICKERS | O864: COOLEY 2 | R864: BAKER | W864: NORTHCOTE | X864: 4 | Y864: 12 | Z864: 0 | AA864: 1438 | AB864: 1662 | AC864: 86.522262334536705 | AD864: 16
A865: BRUNSWICK | C865: McELROY 6 | F865: CAMPBELL 4 | I865: POWELL 3 | K865: WEBSTER 3 | N865: CRISP 2 | P865: CRAWFORD 2 | S865: GREEN 2 | W865: YARRAVILLE | X865: 3 | Y865: 13 | Z865: 0 | AA865: 1331 | AB865: 2128 | AC865: 62.55 | AD865: 12
A866: PRAHRAN | C866: LYONS 3 | F866: DAVEY 2 | I866: WHITE | K866: JOHNSON | N866: PEARCE | W866: SANDRINGHAM | X866: 0 | Y866: 16 | Z866: 0 | AA866: 972 | AB866: 2585 | AC866: 37.6 | AD866: 0
A868: BRIGHTON | C868: 2 | D868: 0 | E868: =C868*6+D868 -> 12 | G868: 10 | H868: 6 | I868: =G868*6+H868 -> 66 | K868: 11 | L868: 7 | M868: =K868*6+L868 -> 73 | O868: 14 | P868: 15 | Q868: =O868*6+P868 -> 99 | S868: ELSTERNWICK PARK
A869: CAMBERWELL | C869: 9 | D869: 3 | E869: =C869*6+D869 -> 57 | G869: 10 | H869: 3 | I869: =G869*6+H869 -> 63 | K869: 15 | L869: 6 | M869: =K869*6+L869 -> 96 | O869: 15 | P869: 7 | Q869: =O869*6+P869 -> 97 | S869: MERRINGTON
A870: BEST PLAYERS
A871: BRIGHTON | C871: BAKER | E871: D CONDON | I871: PAGE | L871: WEBER | O871: FROUDE | Q871: HALLAHAN
A872: CAMBERWELL | C872: NASH | E872: ANDERSON | I872: HORKINGS | L872: BENNETT | O872: OLIVER | Q872: McKAY
A873: GOALKICKERS
A874: BRIGHTON | C874: D CONDON 6 | F874: CARMICHAEL 3 | J874: JONES 2 | L874: HARLEY | N874: WALSH | P874: N DEAN
A875: CAMBERWELL | C875: NASH 10 | F875: OLIVER 2 | I875: FINN 2 | K875: CLAMP
A877: NORTHCOTE | C877: 9 | D877: 4 | E877: =C877*6+D877 -> 58 | G877: 10 | H877: 4 | I877: =G877*6+H877 -> 64 | K877: 14 | L877: 9 | M877: =K877*6+L877 -> 93 | O877: 17 | P877: 11 | Q877: =O877*6+P877 -> 113 | S877: NORTHCOTE
A878: WILLIAMSTOWN | C878: 2 | D878: 3 | E878: =C878*6+D878 -> 15 | G878: 4 | H878: 11 | I878: =G878*6+H878 -> 35 | K878: 7 | L878: 16 | M878: =K878*6+L878 -> 58 | O878: 10 | P878: 22 | Q878: =O878*6+P878 -> 82 | S878: MANCHESTER
A879: BEST PLAYERS
A880: NORTHCOTE | C880: McNAMARA | F880: DOWER | I880: ATKINSON | L880: E BBRETHERTON | P880: WALLIS | R880: ALLEN
A881: WILLIAMSTOWN | C881: FOTHERGILL | F881: CHISHOLM | I881: LE SUEUR | L881: WILCOX | P881: BECKMAN | R881: JOHNSON
A882: GOALKICKERS
A883: NORTHCOTE | C883: ATKINSON 4 | F883: WHITE 4 | H883: ALLEN 4 | J883: McNAMMARA 2 | N883: McINTOSH 2 | Q883: CAHILL
A884: WILLIAMSTOWN | C884: CHISHOLM 3 | F884: FOTHERGILL 2 | I884: VALLENCE | K884: A McTAGGART | N884: TAYLOR | P884: TODD | R884: I McTAGGART
A886: YARRAVILLE | C886: 7 | D886: 6 | E886: =C886*6+D886 -> 48 | G886: 10 | H886: 7 | I886: =G886*6+H886 -> 67 | K886: 19 | L886: 16 | M886: =K886*6+L886 -> 130 | O886: 19 | P886: 16 | Q886: =O886*6+P886 -> 130 | S886: YARRAVILLE
A887: OAKLEIGH | C887: 0 | D887: 2 | E887: =C887*6+D887 -> 2 | G887: 4 | H887: 8 | I887: =G887*6+H887 -> 32 | K887: 6 | L887: 8 | M887: =K887*6+L887 -> 44 | O887: 10 | P887: 24 | Q887: =O887*6+P887 -> 84 | S887: PRENDERGAST
A888: BEST PLAYERS
A889: YARRAVILLE | C889: T SMITH | E889: H SMITH | H889: STREETER | K889: REILLY | N889: GARLICK | Q889: B McVEIGH
A890: OAKLEIGH | C890: HALL | E890: G WATSON | H890: BRENCHLEY | K890: MOORE | N890: McKENZIE | Q890: O'CONNOR
A891: GOALKICKERS
A892: YARRAVILLE | C892: B McVEIGH 7 | F892: H SMITH 4 | I892: REILLY 3 | K892: McPHERSON 2 | N892: GARLICK 2 | Q892: STREETER
A893: OAKLEIGH | C893: HALL 3 | E893: REID 2 | G893: G WATSON | J893: MOORE | L893: WHITE | N893: McKENZIE | Q893: LANNING
A895: COBURG | C895: 10 | D895: 7 | E895: =C895*6+D895 -> 67 | G895: 12 | H895: 9 | I895: =G895*6+H895 -> 81 | K895: 25 | L895: 11 | M895: =K895*6+L895 -> 161 | O895: 33 | P895: 14 | Q895: =O895*6+P895 -> 212 | S895: COBURG
A896: SANDRINGHAM | C896: 0 | D896: 2 | E896: =C896*6+D896 -> 2 | G896: 1 | H896: 7 | I896: =G896*6+H896 -> 13 | K896: 1 | L896: 7 | M896: =K896*6+L896 -> 13 | O896: 3 | P896: 9 | Q896: =O896*6+P896 -> 27 | S896: BATT
A897: BEST PLAYERS
A898: COBURG | C898: PRATT | E898: WILSON | H898: GLENISTER | K898: EVANS | N898: COLLINS | Q898: MULLENGER
A899: SANDRINGHAM | C899: LAVER | E899: CAVE | H899: NAMM | K899: LUCAS | N899: FOX | Q899: EVANS
A900: GOALKICKERS
A901: COBURG | C901: PRATT 22 | F901: COLLINS 4 | I901: GLENISTER 3 | L901: MULLENGER 2 | O901: McLEY | Q901: EVANS
A902: SANDRINGHAM | C902: MARSHALL | F902: CAVE | I902: LUCAS
A904: ROUND 17 | E904: 9TH AUGUST | J904: WEATHER | M904: FINE S.E. BREEZE | S904: PLAYED AT
D905: 1ST QTR | H905: 2ND QTR | L905: 3RD QTR | P905: FINAL | S905: PORT MELBOURNE
A906: PORT MELBOURNE | C906: 5 | D906: 1 | E906: =C906*6+D906 -> 31 | G906: 11 | H906: 6 | I906: =G906*6+H906 -> 72 | K906: 15 | L906: 13 | M906: =K906*6+L906 -> 103 | O906: 17 | P906: 13 | Q906: =O906*6+P906 -> 115 | S906: UMPIRE | X906: LADDER | AB906: ROUND | AD906: 17
A907: BRUNSWICK | C907: 4 | D907: 4 | E907: =C907*6+D907 -> 28 | G907: 10 | H907: 10 | I907: =G907*6+H907 -> 70 | K907: 12 | L907: 11 | M907: =K907*6+L907 -> 83 | O907: 16 | P907: 15 | Q907: =O907*6+P907 -> 111 | S907: GREGORY
A908: BEST PLAYERS | W908: TEAM | X908: W | Y908: L | Z908: D | AA908: FOR | AB908: AGST | AC908: % | AD908: PTS
A909: PORT MELBOURNE | C909: DOBSON | E909: STEIGENBERGER | I909: JULIER | L909: ALSOP | N909: ROBERTSON | Q909: HAYES
A910: BRUNSWICK | C910: KEMP | E910: FAY | I910: CRAWFORD | L910: GARDNER | N910: COOLEY | Q910: HOBBA | W910: PORT MELBOURNE | X910: 14 | Y910: 3 | Z910: 0 | AA910: 2080 | AB910: 1549 | AC910: 134.28 | AD910: 56
A911: GOALKICKERS | W911: PRAHRAN | X911: 13 | Y911: 4 | Z911: 0 | AA911: 2165 | AB911: 1587 | AC911: 135.73 | AD911: 52
A912: PORT MELBOURNE | C912: ROBERTSON 7 | F912: LAHIFF 4 | I912: KELLY 2 | K912: CASTLES 2 | N912: ALLEN 2 | W912: PRESTON | X912: 13 | Y912: 4 | Z912: 0 | AA912: 2087 | AB912: 1622 | AC912: 128.66831072749693 | AD912: 52
A913: BRUNSWICK | C913: COOLEY 4 | E913: CRISP 3 | G913: WHITE 3 | I913: POWELL 2 | K913: CRAWFORD | N913: GREEN | P913: CAMPBELL | R913: WEBSTER | W913: COBURG | X913: 12 | Y913: 5 | Z913: 0 | AA913: 2246 | AB913: 1515 | AC913: 148.25 | AD913: 48
A915: CAMBERWELL | C915: 5 | D915: 3 | E915: =C915*6+D915 -> 33 | G915: 10 | H915: 9 | I915: =G915*6+H915 -> 69 | K915: 14 | L915: 10 | M915: =K915*6+L915 -> 94 | O915: 20 | P915: 15 | Q915: =O915*6+P915 -> 135 | S915: CAMBERWELL | W915: BRUNSWICK | X915: 10 | Y915: 7 | Z915: 0 | AA915: 1998 | AB915: 1509 | AC915: 132.40556660039761 | AD915: 40
A916: PRESTON | C916: 5 | D916: 0 | E916: =C916*6+D916 -> 30 | G916: 11 | H916: 1 | I916: =G916*6+H916 -> 67 | K916: 14 | L916: 8 | M916: =K916*6+L916 -> 92 | O916: 15 | P916: 11 | Q916: =O916*6+P916 -> 101 | S916: GROVES | W916: WILLIAMSTOWN | X916: 10 | Y916: 6 | Z916: 0 | AA916: 1870 | AB916: 1507 | AC916: 124.62 | AD916: 40
A917: BEST PLAYERS | W917: CAMBERWELL | X917: 10 | Y917: 7 | Z917: 0 | AA917: 1966 | AB917: 1908 | AC917: 103.04 | AD917: 40
A918: CAMBERWELL | C918: NASH | E918: SPINKS | H918: SHARPLES | K918: ANDERSON | N918: KENNETT | P918: BOND | W918: BRIGHTON | X918: 6 | Y918: 11 | Z918: 0 | AA918: 1727 | AB918: 1993 | AC918: 86.65 | AD918: 24
A919: PRESTON | C919: DOWLING | E919: BEAUMONT | H919: MINNEY | K919: DAWSON | N919: MASLEN | P919: EVERETT | W919: NORTHCOTE | X919: 5 | Y919: 12 | Z919: 0 | AA919: 1576 | AB919: 1724 | AC919: 91.415313225058 | AD919: 20
A920: GOALKICKERS | W920: OAKLEIGH | X920: 5 | Y920: 11 | Z920: 0 | AA920: 1658 | AB920: 1855 | AC920: 89.38 | AD920: 20
A921: CAMBERWELL | C921: NASH 9 | E921: BOND 5 | H921: PETERS 2 | K921: AUSTEN | M921: SPINKS | O921: TAYLOR | Q921: OLIVER | W921: YARRAVILLE | X921: 3 | Y921: 14 | Z921: 0 | AA921: 1366 | AB921: 2283 | AC921: 59.83 | AD921: 12
A922: PRESTON | C922: LYNCH 3 | E922: DOWLING 3 | H922: DEACON 3 | K922: ROSS 2 | M922: DUNSTONE | O922: BOYD | Q922: MINNEY | S922: EVERETT | W922: SANDRINGHAM | X922: 0 | Y922: 17 | Z922: 0 | AA922: 1034 | AB922: 2723 | AC922: 37.97 | AD922: 0
A924: COBURG | C924: 4 | D924: 4 | E924: =C924*6+D924 -> 28 | G924: 7 | H924: 9 | I924: =G924*6+H924 -> 51 | K924: 14 | L924: 13 | M924: =K924*6+L924 -> 97 | O924: 25 | P924: 17 | Q924: =O924*6+P924 -> 167 | S924: OAKLEIGH
A925: OAKLEIGH | C925: 2 | D925: 11 | E925: =C925*6+D925 -> 23 | G925: 5 | H925: 14 | I925: =G925*6+H925 -> 44 | K925: 6 | L925: 15 | M925: =K925*6+L925 -> 51 | O925: 12 | P925: 16 | Q925: =O925*6+P925 -> 88 | S925: APPLEBY
A926: BEST PLAYERS
A927: COBURG | C927: PRATT | F927: WILSON | I927: MULLENGER | L927: LONSDALE | O927: BROWN | Q927: MILTE
A928: OAKLEIGH | C928: G WATSON | F928: MARTIN | I928: WEISS | L928: BRENCHLEY | O928: LANNING | Q928: BICKERTON
A929: GOALKICKERS
A930: COBURG | C930: PRATT 16 | F930: COLLINS 3 | I930: McLEY 2 | K930: EVANS 2 | M930: BROWN | O930: MULLENGER
A931: OAKLEIGH | C931: BRENCHLEY 3 | F931: G WATSON 2 | I931: WHITE 2 | K931: KENNEDY | M931: LANNING | O931: McKENZIE | Q931: HALL | R931: COMERFORD
A933: WILLIAMSTOWN | C933: 8 | D933: 4 | E933: =C933*6+D933 -> 52 | G933: 13 | H933: 8 | I933: =G933*6+H933 -> 86 | K933: 15 | L933: 17 | M933: =K933*6+L933 -> 107 | O933: 19 | P933: 25 | Q933: =O933*6+P933 -> 139 | S933: WILLIAMSTOWN
A934: BRIGHTON | C934: 3 | D934: 2 | E934: =C934*6+D934 -> 20 | G934: 7 | H934: 6 | I934: =G934*6+H934 -> 48 | K934: 10 | L934: 7 | M934: =K934*6+L934 -> 67 | O934: 14 | P934: 8 | Q934: =O934*6+P934 -> 92 | S934: MERRINGTON
A935: BEST PLAYERS
A936: WILLIAMSTOWN | C936: FOTHERGILL | F936: CHISHOLM | I936: LE SUEUR | L936: SPARGO | O936: SCOTT | Q936: VALLENCE
A937: BRIGHTON | C937: HALLAHAN | F937: PAGE | I937: BAKER | L937: HALL | O937: WEBER | Q937: NASH
A938: GOALKICKERS
A939: WILLIAMSTOWN | C939: VALLENCE 10 | F939: FOTHERGILL 4 | I939: TODD 2 | K939: LE SUEUR 2 | N939: A McTAGGART
A940: BRIGHTON | C940: CARMICHAEL 5 | F940: NASH 4 | H940: D CONDON | J940: HALLAHAN | M940: RUDD | O940: BAKER | Q940: HAGGIS
E941: 16TH AUGUST | J941: WEATHER | M941: FINE MILD BECOMING CLOUDY N.W. BREEZE
A942: NORTHCOTE | C942: 7 | D942: 7 | E942: =C942*6+D942 -> 49 | G942: 10 | H942: 10 | I942: =G942*6+H942 -> 70 | K942: 15 | L942: 19 | M942: =K942*6+L942 -> 109 | O942: 19 | P942: 24 | Q942: =O942*6+P942 -> 138 | S942: BEACH ROAD
A943: SANDRINGHAM | C943: 0 | D943: 1 | E943: =C943*6+D943 -> 1 | G943: 4 | H943: 12 | I943: =G943*6+H943 -> 36 | K943: 5 | L943: 13 | M943: =K943*6+L943 -> 43 | O943: 7 | P943: 20 | Q943: =O943*6+P943 -> 62 | S943: MERRINGTON
A944: BEST PLAYERS
A945: NORTHCOTE | C945: McNAMEE | F945: WALLIS | I945: McNAMARA | L945: HISCOX | O945: WHITE | Q945: DOWLER
A946: SANDRINGHAM | C946: MILLER | F946: NAMM | I946: WEBER | L946: CAVE | O946: LAVER | Q946: LUCAS
A947: GOALKICKERS
A948: NORTHCOTE | C948: WHITE 7 | F948: ALLEN 5 | I948: HISCOX 3 | L948: SHORTIS 2 | O948: WALLIS | R948: STABB
A949: SANDRINGHAM | C949: WEBER 3 | F949: PRICE 2 | I949: E HEATH | L949: L DINGLE
A951: PRAHRAN | C951: 4 | D951: 5 | E951: =C951*6+D951 -> 29 | G951: 13 | H951: 15 | I951: =G951*6+H951 -> 93 | K951: 17 | L951: 15 | M951: =K951*6+L951 -> 117 | O951: 23 | P951: 17 | Q951: =O951*6+P951 -> 155 | S951: TOORAK PARK
A952: YARRAVILLE | C952: 1 | D952: 1 | E952: =C952*6+D952 -> 7 | G952: 1 | H952: 1 | I952: =G952*6+H952 -> 7 | K952: 4 | L952: 3 | M952: =K952*6+L952 -> 27 | O952: 5 | P952: 5 | Q952: =O952*6+P952 -> 35 | S952: MANCHESTER
A953: BEST PLAYERS
A954: PRAHRAN | C954: BOURNE | F954: ROLFE | I954: LYONS | L954: TUCKER | O954: WHITE | Q954: PEARCE
A955: YARRAVILLE | C955: STREETER | F955: GRAY | I955: T SMITH | L955: ROBERTSON | O955: LAW | Q955: REILLY
A956: GOALKICKERS
A957: PRAHRAN | C957: LYONS 9 | F957: GRAVELL 3 | I957: PEARCE 3 | L957: WHITE 2 | N957: MURFITT 2 | Q957: MAHON 2 | T957: ROLFE | V957: WILLIAMS
A958: YARRAVILLE | C958: REILLY | F958: DOHERTY | I958: B McVEIGH | L958: T SMITH | O958: McPHERSON
A960: ROUND 18 | E960: 16TH AUGUST | H960: WEATHER | K960: FINE MILD BECOMING CLOUDY N.W. BREEZE | S960: PLAYED AT
D961: 1ST QTR | H961: 2ND QTR | L961: 3RD QTR | P961: FINAL | S961: COBURG
A962: COBURG | C962: 5 | D962: 10 | E962: =C962*6+D962 -> 40 | G962: 10 | H962: 14 | I962: =G962*6+H962 -> 74 | K962: 17 | L962: 16 | M962: =K962*6+L962 -> 118 | O962: 21 | P962: 18 | Q962: =O962*6+P962 -> 144 | S962: UMPIRE | X962: LADDER | AB962: ROUND | AD962: 18
A963: CAMBERWELL | C963: 1 | D963: 1 | E963: =C963*6+D963 -> 7 | G963: 4 | H963: 5 | I963: =G963*6+H963 -> 29 | K963: 5 | L963: 7 | M963: =K963*6+L963 -> 37 | O963: 7 | P963: 11 | Q963: =O963*6+P963 -> 53 | S963: GREGORY
A964: BEST PLAYERS | W964: TEAM | X964: W | Y964: L | Z964: D | AA964: FOR | AB964: AGST | AC964: % | AD964: PTS
A965: COBURG | C965: PRATT | F965: WILSON | I965: COLLINS | L965: GLENISTER | O965: McLEY | Q965: LONSDALE
A966: CAMBERWELL | C966: HORKINGS | F966: HENDERSON | I966: BENNETT | L966: ANDERSON | O966: SPINKS | Q966: CLAMP | W966: PRAHRAN | X966: 14 | Y966: 4 | Z966: 0 | AA966: 2300 | AB966: 1654 | AC966: 139.06 | AD966: 56
A967: GOALKICKERS | W967: PORT MELBOURNE | X967: 14 | Y967: 4 | Z967: 0 | AA967: 2167 | AB967: 1647 | AC967: 131.57 | AD967: 56
A968: COBURG | C968: PRATT 11 | F968: COLLINS 6 | I968: McLEY 2 | K968: GLENISTER | M968: HORE | W968: COBURG | X968: 13 | Y968: 5 | Z968: 0 | AA968: 2390 | AB968: 1568 | AC968: 152.42 | AD968: 52
A969: CAMBERWELL | C969: NASH 5 | F969: BOND | I969: SPINKS | W969: PRESTON | X969: 13 | Y969: 5 | Z969: 0 | AA969: 2178 | AB969: 1714 | AC969: 127.07117852975496 | AD969: 52
A971: WILLIAMSTOWN | C971: 4 | D971: 4 | E971: =C971*6+D971 -> 28 | G971: 10 | H971: 10 | I971: =G971*6+H971 -> 70 | K971: 14 | L971: 16 | M971: =K971*6+L971 -> 100 | O971: 21 | P971: 24 | Q971: =O971*6+P971 -> 150 | S971: OAKLEIGH | W971: BRUNSWICK | X971: 11 | Y971: 7 | Z971: 0 | AA971: 2090 | AB971: 1600 | AC971: 130.625 | AD971: 44
A972: OAKLEIGH | C972: 3 | D972: 5 | E972: =C972*6+D972 -> 23 | G972: 8 | H972: 8 | I972: =G972*6+H972 -> 56 | K972: 11 | L972: 13 | M972: =K972*6+L972 -> 79 | O972: 17 | P972: 15 | Q972: =O972*6+P972 -> 117 | S972: APPLEBY | W972: WILLIAMSTOWN | X972: 11 | Y972: 6 | Z972: 0 | AA972: 2020 | AB972: 1624 | AC972: 124.38 | AD972: 44
A973: BEST PLAYERS | W973: CAMBERWELL | X973: 10 | Y973: 8 | Z973: 0 | AA973: 2019 | AB973: 2052 | AC973: 98.39 | AD973: 40
A974: WILLIAMSTOWN | C974: FOTHERGILL | F974: SCOTT | I974: CHISHOLM | L974: MARSHAM | O974: FITCH | Q974: LE SUEUR | W974: NORTHCOTE | X974: 6 | Y974: 12 | Z974: 0 | AA974: 1674 | AB974: 1811 | AC974: 92.435118718939819 | AD974: 24
A975: OAKLEIGH | C975: G WATSON | F975: WILSON | I975: O'DONOGHUE | L975: BICKERTON | O975: BRENCHLEY | Q975: McKENZIE | W975: BRIGHTON | X975: 6 | Y975: 12 | Z975: 0 | AA975: 1792 | AB975: 2075 | AC975: 86.36 | AD975: 24
A976: GOALKICKERS | Q976: PATTINSON | W976: OAKLEIGH | X976: 5 | Y976: 12 | Z976: 0 | AA976: 1775 | AB976: 2005 | AC976: 88.53 | AD976: 20
A977: WILLIAMSTOWN | C977: FOTHERGILL 8 | F977: A McTAGGART 6 | J977: VALLENCE 2 | M977: BECKMAN | O977: CHISHOLM | Q977: TODD | S977: FITCH | W977: YARRAVILLE | X977: 4 | Y977: 14 | Z977: 0 | AA977: 1448 | AB977: 2348 | AC977: 59.39 | AD977: 16
A978: OAKLEIGH | C978: G WATSON 6 | F978: WHITE 3 | H978: TAYLOR 2 | J978: C WATSON | M978: BRENCHLEY | O978: COMMONS | Q978: MOORE | S978: RYAN | W978: SANDRINGHAM | X978: 0 | Y978: 18 | Z978: 0 | AA978: 1101 | AB978: 2856 | AC978: 38.55 | AD978: 0
E979: 23RD AUGUST | J979: WEATHER | M979: COLD SHOWERS SOUTH WIND | S979: McKENZIE
A980: BRUNSWICK | C980: 3 | D980: 5 | E980: =C980*6+D980 -> 23 | G980: 5 | H980: 11 | I980: =G980*6+H980 -> 41 | K980: 7 | L980: 15 | M980: =K980*6+L980 -> 57 | O980: 12 | P980: 20 | Q980: =O980*6+P980 -> 92 | S980: BRUNSWICK
A981: PRESTON | C981: 6 | D981: 2 | E981: =C981*6+D981 -> 38 | G981: 11 | H981: 4 | I981: =G981*6+H981 -> 70 | K981: 14 | L981: 6 | M981: =K981*6+L981 -> 90 | O981: 14 | P981: 7 | Q981: =O981*6+P981 -> 91 | S981: GREGORY
A982: BEST PLAYERS
A983: BRUNSWICK | C983: N SMITH | E983: FAY | H983: GREEN | K983: COOLEY | N983: KEMP | Q983: POWELL
A984: PRESTON | C984: BOYD | E984: CALVERT | H984: DAWSON | K984: EVERETT | N984: MINNEY | Q984: CURYER
A985: GOALKICKERS
A986: BRUNSWICK | C986: COOLEY 4 | E986: McELROY 3 | H986: CRAWFORD 2 | K986: JACOBS | M986: CAMPBELL | P986: WEBSTER
A987: PRESTON | C987: BOYD 4 | E987: LYNCH 2 | H987: ROACH 2 | J987: DUNSTONE 2 | M987: DEACON 2 | P987: ROSS | R987: SEEDSMAN
A989: YARRAVILLE | C989: 3 | D989: 5 | E989: =C989*6+D989 -> 23 | G989: 6 | H989: 12 | I989: =G989*6+H989 -> 48 | K989: 8 | L989: 15 | M989: =K989*6+L989 -> 63 | O989: 10 | P989: 22 | Q989: =O989*6+P989 -> 82 | S989: YARRAVILLE
A990: BRIGHTON | C990: 2 | D990: 6 | E990: =C990*6+D990 -> 18 | G990: 4 | H990: 8 | I990: =G990*6+H990 -> 32 | K990: 5 | L990: 15 | M990: =K990*6+L990 -> 45 | O990: 8 | P990: 17 | Q990: =O990*6+P990 -> 65 | S990: APPLEBY
A991: BEST PLAYERS
A992: YARRAVILLE | C992: NEIL | E992: B McVEIGH | H992: LAW | K992: H SMITH | N992: T SMITH | Q992: DOHERTY
A993: BRIGHTON | C993: WEBER | E993: AUSTIN | H993: WILLIAMSON | K993: R DEAN | N993: LUCAS | Q993: D CONDON
A994: GOALKICKERS
A995: YARRAVILLE | C995: B McVEIGH 6 | G995: H SMITH | J995: McPHERSON | M995: STREETER | P995: PERUSSICH
A996: BRIGHTON | C996: D CONDON 3 | G996: N DEAN 2 | J996: SCOTT | M996: HALLAHAN | P996: CARMICHAEL
A998: NORTHCOTE | C998: 5 | D998: 7 | E998: =C998*6+D998 -> 37 | G998: 7 | H998: 8 | I998: =G998*6+H998 -> 50 | K998: 10 | L998: 12 | M998: =K998*6+L998 -> 72 | O998: 13 | P998: 20 | Q998: =O998*6+P998 -> 98 | S998: NORTHCOTE
A999: PORT MELBOURNE | C999: 4 | D999: 2 | E999: =C999*6+D999 -> 26 | G999: 7 | H999: 5 | I999: =G999*6+H999 -> 47 | K999: 9 | L999: 11 | M999: =K999*6+L999 -> 65 | O999: 12 | P999: 15 | Q999: =O999*6+P999 -> 87 | S999: GROVES
A1000: BEST PLAYERS
A1001: NORTHCOTE | C1001: McNAMARA | F1001: E BRETHERTON | J1001: WALLIS | M1001: DOWER | P1001: McNAMEE | S1001: ALLEN
A1002: PORT MELBOURNE | C1002: FAIRWEATHER | F1002: LAFIFF | J1002: DOBSON | M1002: GOLDSMITH | P1002: RICHES | S1002: GOSS
A1003: GOALKICKERS
A1004: NORTHCOTE | C1004: WHITE 4 | E1004: ALLEN 3 | G1004: HISCOX | I1004: McNAMARA | L1004: WALLIS | N1004: CAHILL | P1004: LEMPRIERE | S1004: McINTOSH
A1005: PORT MELBOURNE | C1005: RICHES 2 | E1005: KELLY 2 | G1005: GOSS 2 | I1005: FAIRWEATHER 2 | M1005: ALLEN | O1005: LAHIFF | Q1005: ALSOP | S1005: BARNETT
A1007: PRAHRAN | C1007: 5 | D1007: 2 | E1007: =C1007*6+D1007 -> 32 | G1007: 7 | H1007: 5 | I1007: =G1007*6+H1007 -> 47 | K1007: 14 | L1007: 11 | M1007: =K1007*6+L1007 -> 95 | O1007: 19 | P1007: 19 | Q1007: =O1007*6+P1007 -> 133 | S1007: BEACH ROAD
A1008: SANDRINGHAM | C1008: 0 | D1008: 1 | E1008: =C1008*6+D1008 -> 1 | G1008: 2 | H1008: 11 | I1008: =G1008*6+H1008 -> 23 | K1008: 7 | L1008: 12 | M1008: =K1008*6+L1008 -> 54 | O1008: 9 | P1008: 13 | Q1008: =O1008*6+P1008 -> 67 | S1008: MERRINGTON
A1009: BEST PLAYERS
A1010: PRAHRAN | C1010: THOMPSON | F1010: RAYMENT | I1010: NEWTON | L1010: O'DONNELL | O1010: GRAVELL | R1010: WHITE
A1011: SANDRINGHAM | C1011: CAVE | F1011: NAMM | I1011: WEBER | L1011: BURNS | O1011: LAVER | R1011: MILLER
A1012: GOALKICKERS
A1013: PRAHRAN | C1013: LYONS 7 | F1013: PROBYN 4 | I1013: O'DONNELL 3 | L1013: WHITE 2 | N1013: WILLIAMS | Q1013: RAYMENT | T1013: JOHNSON
A1014: SANDRINGHAM | C1014: WEBER 4 | F1014: PRICE 2 | I1014: BURNS | L1014: BACKMAN | O1014: LUCAS
A1016: ROUND 19 | E1016: 30TH AUGUST | H1016: WEATHER | K1016: FINE INCREASING CLOUD NORTH WIND | S1016: PLAYED AT
D1017: 1ST QTR | H1017: 2ND QTR | L1017: 3RD QTR | P1017: FINAL | S1017: BRUNSWICK
A1018: BRUNSWICK | C1018: 3 | D1018: 7 | E1018: =C1018*6+D1018 -> 25 | G1018: 9 | H1018: 12 | I1018: =G1018*6+H1018 -> 66 | K1018: 15 | L1018: 17 | M1018: =K1018*6+L1018 -> 107 | O1018: 19 | P1018: 23 | Q1018: =O1018*6+P1018 -> 137 | S1018: UMPIRE | X1018: LADDER | AB1018: ROUND | AD1018: 19
A1019: WILLIAMSTOWN | C1019: 5 | D1019: 8 | E1019: =C1019*6+D1019 -> 38 | G1019: 7 | H1019: 9 | I1019: =G1019*6+H1019 -> 51 | K1019: 8 | L1019: 12 | M1019: =K1019*6+L1019 -> 60 | O1019: 9 | P1019: 16 | Q1019: =O1019*6+P1019 -> 70 | S1019: GROVES
A1020: BEST PLAYERS | W1020: TEAM | X1020: W | Y1020: L | Z1020: D | AA1020: FOR | AB1020: AGST | AC1020: % | AD1020: PTS
A1021: BRUNSWICK | C1021: N SMITH | F1021: FAY | I1021: COOLEY | L1021: POWELL | O1021: McELROY | Q1021: GREEN
A1022: WILLIAMSTOWN | C1022: PATTINSON | F1022: WILCOX | I1022: SCOTT | L1022: DELLER | O1022: FITCH | Q1022: A McTAGGART | W1022: PORT MELBOURNE | X1022: 15 | Y1022: 4 | Z1022: 0 | AA1022: 2454 | AB1022: 1662 | AC1022: 147.65 | AD1022: 60
A1023: GOALKICKERS | Q1023: QUINN | W1023: PRAHRAN | X1023: 15 | Y1023: 4 | Z1023: 0 | AA1023: 2435 | AB1023: 1730 | AC1023: 140.75 | AD1023: 60
A1024: BRUNSWICK | C1024: McELROY 5 | F1024: COOLEY 4 | I1024: CRAWFORD 3 | L1024: WHITE 3 | N1024: BAKER | P1024: SMITH | R1024: WEBSTER | W1024: COBURG | X1024: 14 | Y1024: 5 | Z1024: 0 | AA1024: 2535 | AB1024: 1652 | AC1024: 153.45 | AD1024: 56
A1025: WILLIAMSTOWN | C1025: VALLENCE 4 | F1025: FOTHERGILL 2 | I1025: TODD | K1025: OGDEN | M1025: SALVAS | W1025: PRESTON | X1025: 14 | Y1025: 5 | Z1025: 0 | AA1025: 2379 | AB1025: 1808 | AC1025: 131.58185840707964 | AD1025: 56
A1027: CAMBERWELL | C1027: 4 | D1027: 6 | E1027: =C1027*6+D1027 -> 30 | G1027: 8 | H1027: 7 | I1027: =G1027*6+H1027 -> 55 | K1027: 14 | L1027: 8 | M1027: =K1027*6+L1027 -> 92 | O1027: 17 | P1027: 8 | Q1027: =O1027*6+P1027 -> 110 | S1027: CAMBERWELL | W1027: BRUNSWICK | X1027: 12 | Y1027: 7 | Z1027: 0 | AA1027: 2227 | AB1027: 1670 | AC1027: 133.35329341317365 | AD1027: 48
A1028: NORTHCOTE | C1028: 3 | D1028: 4 | E1028: =C1028*6+D1028 -> 22 | G1028: 6 | H1028: 11 | I1028: =G1028*6+H1028 -> 47 | K1028: 7 | L1028: 14 | M1028: =K1028*6+L1028 -> 56 | O1028: 10 | P1028: 17 | Q1028: =O1028*6+P1028 -> 77 | S1028: BATT | W1028: WILLIAMSTOWN | X1028: 11 | Y1028: 7 | Z1028: 0 | AA1028: 2090 | AB1028: 1761 | AC1028: 118.68 | AD1028: 44
A1029: BEST PLAYERS | W1029: CAMBERWELL | X1029: 11 | Y1029: 8 | Z1029: 0 | AA1029: 2129 | AB1029: 2129 | AC1029: 100 | AD1029: 44
A1030: CAMBERWELL | C1030: TAYLOR | F1030: WHITEHEAD | I1030: NASH | L1030: BOND | O1030: AUSTEN | Q1030: SHARPLES | W1030: NORTHCOTE | X1030: 6 | Y1030: 13 | Z1030: 0 | AA1030: 1751 | AB1030: 1921 | AC1030: 91.150442477876112 | AD1030: 24
A1031: NORTHCOTE | C1031: HISCOX | F1031: WALLIS | I1031: LEMPRIERE | L1031: ALLEN | O1031: POWELL | Q1031: McNAMARA | W1031: BRIGHTON | X1031: 6 | Y1031: 13 | Z1031: 0 | AA1031: 1876 | AB1031: 2220 | AC1031: 84.5 | AD1031: 24
A1032: GOALKICKERS | W1032: OAKLEIGH | X1032: 5 | Y1032: 13 | Z1032: 0 | AA1032: 1851 | AB1032: 2140 | AC1032: 86.5 | AD1032: 20
A1033: CAMBERWELL | C1033: NASH 13 | F1033: AUSTEN | I1033: WHITEHEAD | L1033: PEGGIE | N1033: PETERS | W1033: YARRAVILLE | X1033: 4 | Y1033: 15 | Z1033: 0 | AA1033: 1542 | AB1033: 2549 | AC1033: 60.49 | AD1033: 16
A1034: NORTHCOTE | C1034: HISCOX 5 | F1034: WHITE 2 | I1034: McNAMARA | L1034: ALLEN | N1034: SHORTIS | W1034: SANDRINGHAM | X1034: 0 | Y1034: 19 | Z1034: 0 | AA1034: 1116 | AB1034: 3143 | AC1034: 35.51 | AD1034: 0
A1036: PRAHRAN | C1036: 1 | D1036: 4 | E1036: =C1036*6+D1036 -> 10 | G1036: 9 | H1036: 10 | I1036: =G1036*6+H1036 -> 64 | K1036: 13 | L1036: 12 | M1036: =K1036*6+L1036 -> 90 | O1036: 19 | P1036: 21 | Q1036: =O1036*6+P1036 -> 135 | S1036: TOORAK PARK
A1037: OAKLEIGH | C1037: 4 | D1037: 2 | E1037: =C1037*6+D1037 -> 26 | G1037: 6 | H1037: 4 | I1037: =G1037*6+H1037 -> 40 | K1037: 8 | L1037: 13 | M1037: =K1037*6+L1037 -> 61 | O1037: 10 | P1037: 16 | Q1037: =O1037*6+P1037 -> 76 | S1037: PRENDERGAST
A1038: BEST PLAYERS
A1039: PRAHRAN | C1039: NEWTON | F1039: PEARCE | I1039: WILLIAMS | L1039: THOMPSON | O1039: WHITEHEAD | R1039: ROLFE
A1040: OAKLEIGH | C1040: O'DONOGHUE | F1040: WEISS | I1040: McKENZIE | L1040: G WATSON | O1040: MARTIN | R1040: WILSON
A1041: GOALKICKERS
A1042: PRAHRAN | C1042: LYONS 5 | E1042: PEARCE 4 | G1042: ROLFE 3 | I1042: WHITE 2 | K1042: GRAVELL 2 | N1042: THOMPSON | Q1042: O'DONNELL | T1042: MURFITT
A1043: OAKLEIGH | C1043: McKENZIE 3 | F1043: WHITE 2 | H1043: BRENCHLEY | J1043: G WATSON | M1043: MARTIN | O1043: REID | P1043: HALL
A1045: COBURG | C1045: 7 | D1045: 6 | E1045: =C1045*6+D1045 -> 48 | G1045: 10 | H1045: 6 | I1045: =G1045*6+H1045 -> 66 | K1045: 18 | L1045: 16 | M1045: =K1045*6+L1045 -> 124 | O1045: 21 | P1045: 19 | Q1045: =O1045*6+P1045 -> 145 | S1045: ELSTERNWICK PARK
A1046: BRIGHTON | C1046: 1 | D1046: 1 | E1046: =C1046*6+D1046 -> 7 | G1046: 9 | H1046: 6 | I1046: =G1046*6+H1046 -> 60 | K1046: 10 | L1046: 8 | M1046: =K1046*6+L1046 -> 68 | O1046: 12 | P1046: 12 | Q1046: =O1046*6+P1046 -> 84 | S1046: MANCHESTER
A1047: BEST PLAYERS
A1048: COBURG | C1048: COLLINS | F1048: SITCH | I1048: LONG | K1048: McILVENE | N1048: McLEY | Q1048: IRVINE
A1049: BRIGHTON | C1049: HALLAHAN | F1049: LUCAS | I1049: HALL | K1049: D CONDON | N1049: FROUDE | Q1049: WEBER
A1050: GOALKICKERS
A1051: COBURG | C1051: COLLINS 6 | F1051: PRATT 5 | I1051: EVANS 5 | K1051: BEAGLEY 2 | N1051: McLEY | P1051: GLENISTER | R1051: IRVINE
A1052: BRIGHTON | C1052: ALVIN 3 | E1052: D CONDON 2 | H1052: MILLER 2 | J1052: HALLAHAN | M1052: CARMICHAEL | P1052: HAGGIS | R1052: N DEAN | U1052: JONES
A1054: PRESTON | C1054: 4 | D1054: 6 | E1054: =C1054*6+D1054 -> 30 | G1054: 15 | H1054: 18 | I1054: =G1054*6+H1054 -> 108 | K1054: 21 | L1054: 21 | M1054: =K1054*6+L1054 -> 147 | O1054: 29 | P1054: 27 | Q1054: =O1054*6+P1054 -> 201 | S1054: PRESTON
A1055: YARRAVILLE | C1055: 4 | D1055: 3 | E1055: =C1055*6+D1055 -> 27 | G1055: 5 | H1055: 5 | I1055: =G1055*6+H1055 -> 35 | K1055: 12 | L1055: 7 | M1055: =K1055*6+L1055 -> 79 | O1055: 14 | P1055: 10 | Q1055: =O1055*6+P1055 -> 94 | S1055: MERRINGTON
A1056: BEST PLAYERS
A1057: PRESTON | C1057: CONNELLY | F1057: DEACON | I1057: DAWSON | L1057: CURYER | O1057: EVERETT | R1057: DOWLING
A1058: YARRAVILLE | C1058: KENNY | F1058: ROBERTSON | I1058: RANN | L1058: T SMITH | O1058: H SMITH | R1058: McPHERSON
A1059: GOALKICKERS
A1060: PRESTON | C1060: LYNCH 12 | F1060: BOYD 4 | H1060: DUNSTONE 4 | K1060: SEEDSMAN 3 | N1060: ROSS 3 | P1060: NORMAN 2 | S1060: CURYER
A1061: YARRAVILLE | C1061: B McVEIGH 4 | F1061: WILLIAMSON 3 | J1061: PERUSSICH 2 | M1061: McDONALD | P1061: RANN | R1061: ROBERTSON | V1061: COULTON | X1061: NEIL
A1063: PORT MELBOURNE | C1063: 13 | D1063: 8 | E1063: =C1063*6+D1063 -> 86 | G1063: 20 | H1063: 11 | I1063: =G1063*6+H1063 -> 131 | K1063: 34 | L1063: 16 | M1063: =K1063*6+L1063 -> 220 | O1063: 43 | P1063: 29 | Q1063: =O1063*6+P1063 -> 287 | S1063: PORT MELBOURNE
A1064: SANDRINGHAM | C1064: 0 | D1064: 0 | E1064: =C1064*6+D1064 -> 0 | G1064: 2 | H1064: 6 | I1064: =G1064*6+H1064 -> 18 | K1064: 3 | L1064: 8 | M1064: =K1064*6+L1064 -> 26 | O1064: 7 | P1064: 9 | Q1064: =O1064*6+P1064 -> 51 | S1064: GREGORY
A1065: BEST PLAYERS
A1066: PORT MELBOURNE | C1066: JULIER | F1066: HAYES | I1066: KELLY | L1066: LAHIFF | O1066: SEARLE | R1066: CULPH
A1067: SANDRINGHAM | C1067: BECKMAN | F1067: CAVE | I1067: LAVER | L1067: DATE | O1067: AMINDE | R1067: MILLER
A1068: GOALKICKERS
A1069: PORT MELBOURNE | C1069: SEARL 12 | E1069: LAHIFF 8 | G1069: GOLDSMITH 7 | J1069: HAYES 3 | L1069: HURLEY 3 | N1069: RICHES 3 | P1069: ALLEN 2 | R1069: CULPH 2 | U1069: JULIER | W1069: GOSS | X1069: McBETH
A1070: SANDRINGHAM | C1070: BACKMAN 3 | G1070: WEBER 2 | J1070: SMITH | L1070: PRICE
A1072: ROUND 20 | E1072: 6TH SEPTEMBER | J1072: WEATHER | M1072: FINE MILD NORTH WIND | S1072: PLAYED AT
D1073: 1ST QTR | H1073: 2ND QTR | L1073: 3RD QTR | P1073: FINAL | S1073: COBURG
A1074: COBURG | C1074: 6 | D1074: 6 | E1074: =C1074*6+D1074 -> 42 | G1074: 7 | H1074: 7 | I1074: =G1074*6+H1074 -> 49 | K1074: 12 | L1074: 11 | M1074: =K1074*6+L1074 -> 83 | O1074: 15 | P1074: 17 | Q1074: =O1074*6+P1074 -> 107 | S1074: UMPIRE | X1074: LADDER | AB1074: ROUND | AD1074: 20
A1075: PRESTON | C1075: 0 | D1075: 0 | E1075: =C1075*6+D1075 -> 0 | G1075: 11 | H1075: 5 | I1075: =G1075*6+H1075 -> 71 | K1075: 13 | L1075: 7 | M1075: =K1075*6+L1075 -> 85 | O1075: 15 | P1075: 12 | Q1075: =O1075*6+P1075 -> 102 | S1075: MERRINGTON
A1076: BEST PLAYERS | W1076: TEAM | X1076: W | Y1076: L | Z1076: D | AA1076: FOR | AB1076: AGST | AC1076: % | AD1076: PTS
A1077: COBURG | C1077: IRVINE | E1077: GLENISTER | I1077: McLEY | L1077: HORE | N1077: PRATT | Q1077: PROMNITZ
A1078: PRESTON | C1078: BOYD | E1078: DEACON | I1078: CONNELLY | L1078: DAWSON | N1078: LYNCH | Q1078: DOWLING | W1078: PORT MELBOURNE | X1078: 16 | Y1078: 4 | Z1078: 0 | AA1078: 2547 | AB1078: 1753 | AC1078: 145.29 | AD1078: 64
A1079: GOALKICKERS | W1079: PRAHRAN | X1079: 16 | Y1079: 4 | Z1079: 0 | AA1079: 2545 | AB1079: 1820 | AC1079: 139.84 | AD1079: 64
A1080: COBURG | C1080: PRATT 9 | F1080: McLEY 2 | I1080: COLLINS | K1080: GLENISTER | N1080: McILVENE | Q1080: IRVINE | W1080: COBURG | X1080: 15 | Y1080: 5 | Z1080: 0 | AA1080: 2642 | AB1080: 1754 | AC1080: 150.63 | AD1080: 60
A1081: PRESTON | C1081: LYNCH 8 | F1081: DEACON 4 | I1081: DOWLING | K1081: BEAUMONT | N1081: CONNELLY | W1081: PRESTON | X1081: 14 | Y1081: 6 | Z1081: 0 | AA1081: 2481 | AB1081: 1915 | AC1081: 129.55613577023499 | AD1081: 56
A1083: PRAHRAN | C1083: 2 | D1083: 4 | E1083: =C1083*6+D1083 -> 16 | G1083: 6 | H1083: 10 | I1083: =G1083*6+H1083 -> 46 | K1083: 9 | L1083: 11 | M1083: =K1083*6+L1083 -> 65 | O1083: 16 | P1083: 14 | Q1083: =O1083*6+P1083 -> 110 | S1083: WILLIAMSTOWN | W1083: BRUNSWICK | X1083: 13 | Y1083: 7 | Z1083: 0 | AA1083: 2353 | AB1083: 1758 | AC1083: 133.84527872582481 | AD1083: 52
A1084: WILLIAMSTOWN | C1084: 3 | D1084: 4 | E1084: =C1084*6+D1084 -> 22 | G1084: 7 | H1084: 8 | I1084: =G1084*6+H1084 -> 50 | K1084: 12 | L1084: 15 | M1084: =K1084*6+L1084 -> 87 | O1084: 12 | P1084: 18 | Q1084: =O1084*6+P1084 -> 90 | S1084: PRENDERGAST | W1084: CAMBERWELL | X1084: 12 | Y1084: 8 | Z1084: 0 | AA1084: 2265 | AB1084: 2223 | AC1084: 101.89 | AD1084: 48
A1085: BEST PLAYERS | W1085: WILLIAMSTOWN | X1085: 11 | Y1085: 8 | Z1085: 0 | AA1085: 2180 | AB1085: 1871 | AC1085: 116.52 | AD1085: 44
A1086: PRAHRAN | C1086: ROLFE | F1086: THOMPSON | I1086: MAHON | L1086: WILLIAMS | O1086: NEWTON | Q1086: JOHNSON | W1086: NORTHCOTE | X1086: 7 | Y1086: 13 | Z1086: 0 | AA1086: 1860 | AB1086: 1978 | AC1086: 94.034378159757324 | AD1086: 28
A1087: WILLIAMSTOWN | C1087: FOTHERGILL | F1087: DELLER | I1087: PATTINSON | L1087: SPARGO | O1087: FITCH | Q1087: SCOTT | W1087: BRIGHTON | X1087: 6 | Y1087: 14 | Z1087: 0 | AA1087: 1933 | AB1087: 2329 | AC1087: 83 | AD1087: 24
A1088: GOALKICKERS | W1088: OAKLEIGH | X1088: 5 | Y1088: 14 | Z1088: 0 | AA1088: 1906 | AB1088: 2233 | AC1088: 85.36 | AD1088: 20
A1089: PRAHRAN | C1089: ROLFE 5 | F1089: LYONS 4 | I1089: PROBYN 3 | K1089: PEARCE 2 | M1089: GRAVELL | O1089: WILLIAMS | W1089: YARRAVILLE | X1089: 4 | Y1089: 16 | Z1089: 0 | AA1089: 1630 | AB1089: 2675 | AC1089: 60.93 | AD1089: 16
A1090: WILLIAMSTOWN | C1090: FOTHERGILL 5 | F1090: VALLENCE 3 | I1090: SALVAS 2 | K1090: I McTAGGART | N1090: TAYLOR | W1090: SANDRINGHAM | X1090: 0 | Y1090: 20 | Z1090: 0 | AA1090: 1246 | AB1090: 3279 | AC1090: 38 | AD1090: 0
A1092: NORTHCOTE | C1092: 7 | D1092: 3 | E1092: =C1092*6+D1092 -> 45 | G1092: 10 | H1092: 9 | I1092: =G1092*6+H1092 -> 69 | K1092: 13 | L1092: 15 | M1092: =K1092*6+L1092 -> 93 | O1092: 15 | P1092: 19 | Q1092: =O1092*6+P1092 -> 109 | S1092: NORTHCOTE
A1093: BRIGHTON | C1093: 1 | D1093: 5 | E1093: =C1093*6+D1093 -> 11 | G1093: 2 | H1093: 8 | I1093: =G1093*6+H1093 -> 20 | K1093: 5 | L1093: 11 | M1093: =K1093*6+L1093 -> 41 | O1093: 7 | P1093: 15 | Q1093: =O1093*6+P1093 -> 57 | S1093: PREST
A1094: BEST PLAYERS
A1095: NORTHCOTE | C1095: DOWER | F1095: McNAMARA | I1095: McNAMEE | L1095: HISCOX | O1095: E HART | Q1095: WHITE
A1096: BRIGHTON | C1096: FROUDE | F1096: WEBER | I1096: D CONDON | L1096: LUCAS | O1096: ALVIN | Q1096: HALLAHAN
A1097: GOALKICKERS
A1098: NORTHCOTE | C1098: WHITE 4 | E1098: ALLEN 4 | G1098: ATKINSON 2 | J1098: HISCOX 2 | M1098: LIBBIS | O1098: MORGAN | Q1098: McNAMARA
A1099: BRIGHTON | C1099: D CONDON 3 | G1099: CARMICHAEL 2 | K1099: WALSH | N1099: JORY
A1101: CAMBERWELL | C1101: 5 | D1101: 3 | E1101: =C1101*6+D1101 -> 33 | G1101: 8 | H1101: 9 | I1101: =G1101*6+H1101 -> 57 | K1101: 16 | L1101: 13 | M1101: =K1101*6+L1101 -> 109 | O1101: 20 | P1101: 16 | Q1101: =O1101*6+P1101 -> 136 | S1101: BEACH ROAD
A1102: SANDRINGHAM | C1102: 2 | D1102: 3 | E1102: =C1102*6+D1102 -> 15 | G1102: 9 | H1102: 5 | I1102: =G1102*6+H1102 -> 59 | K1102: 9 | L1102: 7 | M1102: =K1102*6+L1102 -> 61 | O1102: 14 | P1102: 10 | Q1102: =O1102*6+P1102 -> 94 | S1102: PARRIS
A1103: BEST PLAYERS
A1104: CAMBERWELL | C1104: TAYLOR | E1104: NASH | I1104: LEIGH | L1104: PEGGIE | O1104: BRADLEY | Q1104: SPINKS
A1105: SANDRINGHAM | C1105: LUCAS | E1105: BURNS | I1105: BACKMAN | L1105: CARTWRIGHT | O1105: MILLER | Q1105: LEADHAM
A1106: GOALKICKERS
A1107: CAMBERWELL | C1107: NASH 14 | F1107: SPINKS 3 | I1107: BRADLEY | L1107: PEGGIE | N1107: CAZALY
A1108: SANDRINGHAM | C1108: WEBER 4 | F1108: BACKMAN 3 | I1108: LUCAS 3 | K1108: CARTWRIGHT 2 | N1108: MILLER | P1108: BURNS
A1110: BRUNSWICK | C1110: 1 | D1110: 1 | E1110: =C1110*6+D1110 -> 7 | G1110: 7 | H1110: 16 | I1110: =G1110*6+H1110 -> 58 | K1110: 10 | L1110: 18 | M1110: =K1110*6+L1110 -> 78 | O1110: 17 | P1110: 24 | Q1110: =O1110*6+P1110 -> 126 | S1110: YARRAVILLE
A1111: YARRAVILLE | C1111: 5 | D1111: 1 | E1111: =C1111*6+D1111 -> 31 | G1111: 7 | H1111: 2 | I1111: =G1111*6+H1111 -> 44 | K1111: 11 | L1111: 7 | M1111: =K1111*6+L1111 -> 73 | O1111: 13 | P1111: 10 | Q1111: =O1111*6+P1111 -> 88 | S1111: GREGORY
A1112: BEST PLAYERS
A1113: BRUNSWICK | C1113: KEMP | E1113: TOONE | H1113: CRAWFORD | K1113: FAY | N1113: SMITH | Q1113: McELROY
A1114: YARRAVILLE | C1114: NEIL | E1114: KENNY | H1114: B McVEIGH | K1114: GRAY | N1114: WILSON | Q1114: COULTON
A1115: GOALKICKERS
A1116: BRUNSWICK | C1116: McELROY 6 | F1116: GARDNER 3 | I1116: WHITE 2 | K1116: COOLEY 2 | M1116: CRAWFORD | P1116: JACOBS | R1116: CRISP | T1116: WEBSTER
A1117: YARRAVILLE | C1117: EVANS 4 | F1117: B McVEIGH 3 | I1117: PERUSSICH 2 | L1117: McPHERSON 2 | O1117: ROBERTSON | R1117: LAW
A1119: PORT MELBOURNE | C1119: 4 | D1119: 8 | E1119: =C1119*6+D1119 -> 32 | G1119: 7 | H1119: 12 | I1119: =G1119*6+H1119 -> 54 | K1119: 10 | L1119: 17 | M1119: =K1119*6+L1119 -> 77 | O1119: 12 | P1119: 21 | Q1119: =O1119*6+P1119 -> 93 | S1119: OAKLEIGH
A1120: OAKLEIGH | C1120: 1 | D1120: 1 | E1120: =C1120*6+D1120 -> 7 | G1120: 2 | H1120: 7 | I1120: =G1120*6+H1120 -> 19 | K1120: 5 | L1120: 10 | M1120: =K1120*6+L1120 -> 40 | O1120: 7 | P1120: 13 | Q1120: =O1120*6+P1120 -> 55 | S1120: GROVES
A1121: BEST PLAYERS
A1122: PORT MELBOURNE | C1122: LIVINGSTONE | F1122: GOLDSMITH | I1122: ALSOP | L1122: JULIER | O1122: LAHIFF | R1122: ONLEY
A1123: OAKLEIGH | C1123: WILSON | F1123: O'DONOGHUE | I1123: MARTIN | L1123: G WATSON | O1123: COMMONS | R1123: COMERFORD
A1124: GOALKICKERS
A1125: PORT MELBOURNE | C1125: LAHIFF 3 | F1125: SEARLE 3 | I1125: HURLEY 3 | L1125: JULIER | N1125: FAIRWEATHER | Q1125: LIVINGSTONE
A1126: OAKLEIGH | C1126: McKENZIE 2 | F1126: RYAN | I1126: G WATSON | L1126: LAW | N1126: COMERFORD | Q1126: WILSON
A1128: FINALS
A1129: 1ST SEMI | E1129: 13TH SEPTEMBER | J1129: WEATHER | M1129: CLOUDY COOL BUT FINE GROUND HEAVY
D1130: 1ST QTR | H1130: 2ND QTR | L1130: 3RD QTR | P1130: FINAL
A1131: COBURG | C1131: 4 | D1131: 5 | E1131: =C1131*6+D1131 -> 29 | G1131: 8 | H1131: 11 | I1131: =G1131*6+H1131 -> 59 | K1131: 13 | L1131: 18 | M1131: =K1131*6+L1131 -> 96 | O1131: 16 | P1131: 21 | Q1131: =O1131*6+P1131 -> 117 | S1131: TOORAK PARK
A1132: PRESTON | C1132: 3 | D1132: 5 | E1132: =C1132*6+D1132 -> 23 | G1132: 6 | H1132: 10 | I1132: =G1132*6+H1132 -> 46 | K1132: 6 | L1132: 15 | M1132: =K1132*6+L1132 -> 51 | O1132: 11 | P1132: 21 | Q1132: =O1132*6+P1132 -> 87 | S1132: MERRINGTON
A1133: BEST PLAYERS
A1134: COBURG | C1134: GLENISTER | F1134: PROMNITZ | I1134: PRATT | L1134: IRVINE | O1134: HORE | Q1134: MURRAY
A1135: PRESTON | C1135: CURYER | F1135: BOYD | I1135: MINNEY | L1135: DEACON | O1135: CALVERT | Q1135: MASLEN
A1136: GOALKICKERS
A1137: COBURG | C1137: PRATT 8 | F1137: COLLINS 4 | I1137: HORE 2 | L1137: GLENISTER | N1137: IRVINE
A1138: PRESTON | C1138: LYNCH 3 | F1138: DOWLING 2 | I1138: DEACON 2 | L1138: BOYD 2 | N1138: ROSS | P1138: DUNSTONE
A1140: 2ND SEMI | E1140: 20TH SEPTEMBER | J1140: WEATHER | M1140: COLD SHOWERS STRONG SQUALLY SOUTH WIND
A1141: PORT MELBOURNE | C1141: 2 | D1141: 0 | E1141: =C1141*6+D1141 -> 12 | G1141: 8 | H1141: 8 | I1141: =G1141*6+H1141 -> 56 | K1141: 10 | L1141: 11 | M1141: =K1141*6+L1141 -> 71 | O1141: 15 | P1141: 19 | Q1141: =O1141*6+P1141 -> 109 | S1141: TOORAK PARK
A1142: PRAHRAN | C1142: 8 | D1142: 4 | E1142: =C1142*6+D1142 -> 52 | G1142: 8 | H1142: 4 | I1142: =G1142*6+H1142 -> 52 | K1142: 12 | L1142: 16 | M1142: =K1142*6+L1142 -> 88 | O1142: 15 | P1142: 17 | Q1142: =O1142*6+P1142 -> 107 | S1142: GREGORY
A1143: BEST PLAYERS
A1144: PORT MELBOURNE | C1144: FAIRWEATHER | F1144: JULIER | J1144: DOBSON | M1144: HAYES | P1144: ALSOP | R1144: LAHIFF
A1145: PRAHRAN | C1145: NEWTON | F1145: WHITEHEAD | J1145: PEARCE | M1145: WHITE | P1145: THOMPSON | R1145: JOHNSON
A1146: GOALKICKERS
A1147: PORT MELBOURNE | C1147: ALLEN 4 | F1147: SEARLE 3 | I1147: LAHIFF 2 | L1147: HURLEY 2 | O1147: RICHES 2 | Q1147: JULIER | S1147: McBETH
A1148: PRAHRAN | C1148: PEARCE 4 | F1148: LYONS 3 | I1148: PROBYN 2 | L1148: MURFITT 2 | O1148: WHITE | Q1148: GRAVELL | S1148: O'DONNELL | V1148: ROLFE
A1150: PRELIMINARY FINAL | F1150: 27TH SEPTEMBER | J1150: WEATHER | M1150: FINE SULTRY STRONG NORTH WIND
A1151: COBURG | C1151: 8 | D1151: 3 | E1151: =C1151*6+D1151 -> 51 | G1151: 14 | H1151: 7 | I1151: =G1151*6+H1151 -> 91 | K1151: 18 | L1151: 12 | M1151: =K1151*6+L1151 -> 120 | O1151: 19 | P1151: 12 | Q1151: =O1151*6+P1151 -> 126 | S1151: TOORAK PARK
A1152: PRAHRAN | C1152: 1 | D1152: 5 | E1152: =C1152*6+D1152 -> 11 | G1152: 6 | H1152: 7 | I1152: =G1152*6+H1152 -> 43 | K1152: 6 | L1152: 9 | M1152: =K1152*6+L1152 -> 45 | O1152: 13 | P1152: 17 | Q1152: =O1152*6+P1152 -> 95 | S1152: GREGORY
A1153: BEST PLAYERS
A1154: COBURG | C1154: GLENISTER | F1154: HORE | I1154: COLLINS | L1154: McILVENE | O1154: WILSON | R1154: MILTE
A1155: PRAHRAN | C1155: TUCKER | F1155: JOHNSON | I1155: MAHON | L1155: THOMPSON | O1155: RAYMENT | R1155: FAUL
A1156: GOALKICKERS
A1157: COBURG | C1157: PRATT 6 | F1157: COLLINS 4 | I1157: MILTE 2 | L1157: McLEY 2 | N1157: BANNISTER 2 | Q1157: HORE | R1157: GLENISTER | U1157: WILSON
A1158: PRAHRAN | C1158: PROBYN 3 | F1158: ROLFE 3 | I1158: THOMPSON 2 | L1158: GRAVELL 2 | N1158: TUCKER | P1158: O'DONNELL | S1158: MURFITT
A1160: GRAND FINAL | E1160: 4TH OCTOBER | J1160: WEATHER | M1160: COOL CLOUDY WEST WIND
A1161: PORT MELBOURNE | C1161: 1 | D1161: 3 | E1161: =C1161*6+D1161 -> 9 | G1161: 6 | H1161: 10 | I1161: =G1161*6+H1161 -> 46 | K1161: 9 | L1161: 12 | M1161: =K1161*6+L1161 -> 66 | O1161: 15 | P1161: 18 | Q1161: =O1161*6+P1161 -> 108 | S1161: M.C.G.
A1162: COBURG | C1162: 3 | D1162: 10 | E1162: =C1162*6+D1162 -> 28 | G1162: 3 | H1162: 14 | I1162: =G1162*6+H1162 -> 32 | K1162: 9 | L1162: 20 | M1162: =K1162*6+L1162 -> 74 | O1162: 11 | P1162: 23 | Q1162: =O1162*6+P1162 -> 89 | S1162: GROVES
A1163: BEST PLAYERS
A1164: PORT MELBOURNE | C1164: ALSOP | E1164: McBETH | H1164: FAIRWEATHER | K1164: ROBERTSON | N1164: FREYER | Q1164: HAYES
A1165: COBURG | C1165: IRVINE | E1165: PROMNITZ | H1165: WILSON | K1165: GLENISTER | N1165: HALL | Q1165: ATKINSON
A1166: GOALKICKERS
A1167: PORT MELBOURNE | C1167: FREYER 6 | F1167: ROBERTSON 6 | I1167: GOLDSMITH | L1167: HURLEY | N1167: LIVINGSTONE
A1168: COBURG | C1168: PRATT 4 | F1168: GLENISTER 2 | I1168: COLLINS | L1168: BEAGLEY | N1168: McLEY | P1168: TURNER | R1168: LONSDALE
A1170: TEAMS
G1171: PORT MELBOURNE | S1171: COBURG
A1172: BACKS | C1172: LIVINGSTON | G1172: DOBSON | K1172: GOSS | P1172: RE | S1172: PROMNITZ | W1172: ATKINSON
A1173: H-BACKS | C1173: ONLEY | G1173: HAYES | K1173: HOSKING | P1173: MURRAY | S1173: WILSON | W1173: SITCH
A1174: CENTRES | C1174: JULIER | G1174: GOLDSMITH | K1174: ALSOP | P1174: McILVENE | S1174: GLENISTER | W1174: HALL
A1175: H-FORWARDS | C1175: ALLEN | G1175: ROBERTSON | K1175: McBETH | P1175: BANNISTER | S1175: COLLINS | W1175: BEAGLEY
A1176: FORWARDS | C1176: RICHES | G1176: FREYER | K1176: HURLEY | P1176: LONSDALE | S1176: PRATT | W1176: McLEY
A1177: RUCKS | C1177: FAIRWEATHER | G1177: REYNOLDS | K1177: LAHIFF | P1177: MILTE | S1177: LONG | W1177: IRVINE
A1178: RES | C1178: BARNETT | P1178: BROWN