A1: Victorian Football Association
A2: Season 1945
A3: © Copyright Wal Williams | F3: First created: 2 November 2014
A4: Contact: joywalwi at gmail dot com | F4: Last updated: 27 January 2018 | W4: VFA Results and tables - Link to the main index page
A5: You are free to copy this document in whole or part provided that proper acknowledgement is given to the author. All rights reserved.
A7: YEAR 1945
A8: ROUND 1 | D8: 14TH APRIL | J8: WEATHER | M8: WARM SUNNY NORTH BREEZE | S8: PLAYED AT
D9: 1ST QTR | H9: 2ND QTR | L9: 3RD QTR | P9: FINAL | S9: BRUNSWICK
A10: COBURG | C10: 5 | D10: 5 | E10: =C10*6+D10 -> 35 | G10: 8 | H10: 14 | I10: =G10*6+H10 -> 62 | K10: 10 | L10: 16 | M10: =K10*6+L10 -> 76 | O10: 12 | P10: 17 | Q10: =O10*6+P10 -> 89 | S10: UMPIRE | X10: LADDER | AB10: ROUND | AD10: 1
A11: BRUNSWICK | C11: 4 | D11: 1 | E11: =C11*6+D11 -> 25 | G11: 7 | H11: 2 | I11: =G11*6+H11 -> 44 | K11: 9 | L11: 4 | M11: =K11*6+L11 -> 58 | O11: 11 | P11: 7 | Q11: =O11*6+P11 -> 73 | S11: MERRINGTON
A12: BEST PLAYERS | W12: TEAM | X12: W | Y12: L | Z12: D | AA12: FOR | AB12: AGST | AC12: % | AD12: PTS
A13: COBURG | C13: HORE | F13: MILTE | I13: MUNDAY | L13: R ATKINSON | O13: FYFFE | Q13: PERRIN
A14: BRUNSWICK | C14: PLUMMER | F14: JACOBS | I14: GILLIGAN | L14: SMITH | O14: SYNOTT | Q14: NILSON | W14: CAMBERWELL | X14: 1 | Y14: 0 | Z14: 0 | AA14: 112 | AB14: 69 | AC14: =(AA14/AB14)*100 -> 162.31884057971016 | AD14: 4
A15: GOALKICKERS | W15: PRESTON | X15: 1 | Y15: 0 | Z15: 0 | AA15: 120 | AB15: 79 | AC15: =(AA15/AB15)*100 -> 151.8987341772152 | AD15: 4
A16: COBURG | C16: ROWE 4 | F16: LONSDALE 3 | I16: HORE 2 | K16: PERRON | M16: MILTE | O16: FYFFE | W16: WILLIAMSTOWN | X16: 1 | Y16: 0 | Z16: 0 | AA16: 146 | AB16: 109 | AC16: =(AA16/AB16)*100 -> 133.94495412844037 | AD16: 4
A17: BRUNSWICK | C17: SMITH 3 | F17: GILLIGAN 3 | I17: JACOBS 2 | K17: HUNTER 2 | N17: HUGHES | W17: BRIGHTON | X17: 1 | Y17: 0 | Z17: 0 | AA17: 94 | AB17: 73 | AC17: =(AA17/AB17)*100 -> 128.76712328767124 | AD17: 4
A19: CAMBERWELL | C19: 3 | D19: 9 | E19: =C19*6+D19 -> 27 | G19: 6 | H19: 20 | I19: =G19*6+H19 -> 56 | K19: 12 | L19: 25 | M19: =K19*6+L19 -> 97 | O19: 14 | P19: 28 | Q19: =O19*6+P19 -> 112 | S19: CAMBERWELL | W19: COBURG | X19: 1 | Y19: 0 | Z19: 0 | AA19: 89 | AB19: 73 | AC19: =(AA19/AB19)*100 -> 121.91780821917808 | AD19: 4
A20: OAKLEIGH | C20: 1 | D20: 1 | E20: =C20*6+D20 -> 7 | G20: 5 | H20: 3 | I20: =G20*6+H20 -> 33 | K20: 7 | L20: 5 | M20: =K20*6+L20 -> 47 | O20: 10 | P20: 9 | Q20: =O20*6+P20 -> 69 | S20: McALPINE | W20: PORT MELBOURNE | X20: 1 | Y20: 0 | Z20: 0 | AA20: 146 | AB20: 120 | AC20: =(AA20/AB20)*100 -> 121.66666666666666 | AD20: 4
A21: BEST PLAYERS | W21: PRAHRAN | X21: 0 | Y21: 1 | Z21: 0 | AA21: 120 | AB21: 146 | AC21: =(AA21/AB21)*100 -> 82.191780821917803 | AD21: 0
A22: CAMBERWELL | C22: BRADFORD | F22: DUCKWORTH | I22: JORGENSON | L22: SEELENMEYER | O22: GRIFFIN | Q22: OLIVER | W22: BRUNSWICK | X22: 0 | Y22: 1 | Z22: 0 | AA22: 73 | AB22: 89 | AC22: =(AA22/AB22)*100 -> 82.022471910112358 | AD22: 0
A23: OAKLEIGH | C23: HALL | F23: FINN | I23: BEARD | L23: D RYAN | O23: MUDGE | Q23: RICHARDSON | W23: SANDRINGHAM | X23: 0 | Y23: 1 | Z23: 0 | AA23: 73 | AB23: 94 | AC23: =(AA23/AB23)*100 -> 77.659574468085097 | AD23: 0
A24: GOALKICKERS | W24: YARRAVILLE | X24: 0 | Y24: 1 | Z24: 0 | AA24: 109 | AB24: 146 | AC24: =(AA24/AB24)*100 -> 74.657534246575338 | AD24: 0
A25: CAMBERWELL | C25: BRADFORD 4 | F25: JORGENSON 2 | I25: OLIVER 2 | K25: GRIFFIN 2 | M25: BRYCE 2 | O25: SHEAN | Q25: HARRISON | W25: NORTHCOTE | X25: 0 | Y25: 1 | Z25: 0 | AA25: 79 | AB25: 120 | AC25: =(AA25/AB25)*100 -> 65.833333333333329 | AD25: 0
A26: OAKLEIGH | C26: FINN 3 | F26: D RYAN 2 | I26: WORRALL 2 | L26: CAMPBELL 2 | O26: MUDGE | W26: OAKLEIGH | X26: 0 | Y26: 1 | Z26: 0 | AA26: 69 | AB26: 112 | AC26: =(AA26/AB26)*100 -> 61.607142857142861 | AD26: 0
A28: BRIGHTON | C28: 1 | D28: 6 | E28: =C28*6+D28 -> 12 | G28: 6 | H28: 9 | I28: =G28*6+H28 -> 45 | K28: 9 | L28: 10 | M28: =K28*6+L28 -> 64 | O28: 13 | P28: 16 | Q28: =O28*6+P28 -> 94 | S28: ELSTERNWICK PARK
A29: SANDRINGHAM | C29: 4 | D29: 5 | E29: =C29*6+D29 -> 29 | G29: 7 | H29: 10 | I29: =G29*6+H29 -> 52 | K29: 9 | L29: 15 | M29: =K29*6+L29 -> 69 | O29: 9 | P29: 19 | Q29: =O29*6+P29 -> 73 | S29: SCANLON
A30: BEST PLAYERS
A31: BRIGHTON | C31: SPARGO | F31: MOFFATT | I31: ELLIS | L31: PLUNKETT | O31: PICKETT | R31: KENNETT
A32: SANDRINGHAM | C32: EVANS | F32: WEBB | I32: O'TOOLE | L32: WALKER | O32: McKENZIE | R32: RAY
A33: GOALKICKERS
A34: BRIGHTON | C34: VALLENCE 5 | F34: ELLIS 3 | H34: PICKETT 2 | J34: PAGE | L34: JARRETT | N34: SPARGO
A35: SANDRINGHAM | C35: McKENZIE 3 | F35: WEBB 2 | H35: MOLONEY | J35: WALKER | L35: DE VERGER | O35: MIDDLETON
A37: PRESTON | C37: 6 | D37: 5 | E37: =C37*6+D37 -> 41 | G37: 7 | H37: 5 | I37: =G37*6+H37 -> 47 | K37: 17 | L37: 10 | M37: =K37*6+L37 -> 112 | O37: 18 | P37: 12 | Q37: =O37*6+P37 -> 120 | S37: PRESTON
A38: NORTHCOTE | C38: 1 | D38: 2 | E38: =C38*6+D38 -> 8 | G38: 5 | H38: 10 | I38: =G38*6+H38 -> 40 | K38: 5 | L38: 11 | M38: =K38*6+L38 -> 41 | O38: 10 | P38: 19 | Q38: =O38*6+P38 -> 79 | S38: GREGORY
A39: BEST PLAYERS
A40: PRESTON | C40: DAWSON | F40: MASLEN | I40: BOYD | L40: CONNELLY | O40: ANDERSON | R40: BRADLEY
A41: NORTHCOTE | C41: McINTOSH | F41: H OLVER | I41: BALLANTYNE | L41: ROSS | O41: ELLIS | R41: F STABB
A42: GOALKICKERS
A43: PRESTON | C43: CONNELLY 4 | F43: MASLEN 4 | I43: BOYD 3 | K43: SEEDSMAN 3 | N43: EXELBY 2 | Q43: DAWSON | T43: WRIGHT
A44: NORTHCOTE | C44: POLGLASE 3 | F44: F STABB 2 | I44: BALLANTYNE 2 | L44: H OLVER | N44: McINTOSH | Q44: JAMES
A46: PORT MELBOURNE | C46: 8 | D46: 3 | E46: =C46*6+D46 -> 51 | G46: 9 | H46: 5 | I46: =G46*6+H46 -> 59 | K46: 18 | L46: 7 | M46: =K46*6+L46 -> 115 | O46: 22 | P46: 14 | Q46: =O46*6+P46 -> 146 | S46: OLYMPIC PARK No. 2
A47: PRAHRAN | C47: 3 | D47: 3 | E47: =C47*6+D47 -> 21 | G47: 10 | H47: 9 | I47: =G47*6+H47 -> 69 | K47: 14 | L47: 11 | M47: =K47*6+L47 -> 95 | O47: 18 | P47: 12 | Q47: =O47*6+P47 -> 120 | S47: THOMAS
A48: BEST PLAYERS
A49: PORT MELBOURNE | C49: FREYER | F49: SEARLE | I49: ROBERTSON | L49: FAIRWEATHER | P49: LAHIFF | S49: McBETH
A50: PRAHRAN | C50: GRACIE | F50: STACKPOLE | I50: BENNISON | L50: OLSEN | P50: WHITE | S50: BOOTH
A51: GOALKICKERS
A52: PORT MELBOURNE | C52: FREYER 11 | F52: ROBERTSON 4 | I52: SEARLE 2 | K52: CULPH 2 | M52: REYNOLDS 2 | P52: ALSOPP
A53: PRAHRAN | C53: STACKPOLE 5 | F53: GRACIE 4 | I53: COOPER 3 | K53: NORRIS 2 | M53: ADAMS 2 | O53: ROLFE | Q53: BOOTH
A55: WILLIAMSTOWN | C55: 6 | D55: 5 | E55: =C55*6+D55 -> 41 | G55: 14 | H55: 10 | I55: =G55*6+H55 -> 94 | K55: 16 | L55: 13 | M55: =K55*6+L55 -> 109 | O55: 22 | P55: 14 | Q55: =O55*6+P55 -> 146 | S55: YARRAVILLE
A56: YARRAVILLE | C56: 4 | D56: 4 | E56: =C56*6+D56 -> 28 | G56: 9 | H56: 5 | I56: =G56*6+H56 -> 59 | K56: 11 | L56: 11 | M56: =K56*6+L56 -> 77 | O56: 16 | P56: 13 | Q56: =O56*6+P56 -> 109 | S56: PARRIS
A57: BEST PLAYERS
A58: WILLIAMSTOWN | C58: DOWLING | F58: TODD | I58: HARLEY | L58: TORNEY | O58: HAGAN | R58: REID
A59: YARRAVILLE | C59: CAHILL | F59: SMITH | I59: BOOKER | L59: KNIGHT | O59: THOMAS | R59: LAW
A60: GOALKICKERS
A61: WILLIAMSTOWN | C61: TODD 9 | F61: DOWLING 5 | I61: HARLEY 4 | L61: I McTAGGART | O61: GLASS | Q61: HAGAN | S61: REID
A62: YARRAVILLE | C62: LAW 3 | E62: JONES 3 | G62: CAHILL 3 | I62: H RUDDELL 2 | L62: THOMAS | N62: GARLICK | P62: CASELEY | S62: HOWDEN | V62: KNIGHT
A64: ROUND 2 | D64: 21ST APRIL | J64: WEATHER | M64: WARM SULTRY SHOWERS | S64: PLAYED AT
D65: 1ST QTR | H65: 2ND QTR | L65: 3RD QTR | P65: FINAL | S65: COBURG
A66: COBURG | C66: 5 | D66: 7 | E66: =C66*6+D66 -> 37 | G66: 9 | H66: 9 | I66: =G66*6+H66 -> 63 | K66: 13 | L66: 13 | M66: =K66*6+L66 -> 91 | O66: 18 | P66: 16 | Q66: =O66*6+P66 -> 124 | S66: UMPIRE | X66: LADDER | AB66: ROUND | AD66: 2
A67: CAMBERWELL | C67: 0 | D67: 1 | E67: =C67*6+D67 -> 1 | G67: 4 | H67: 7 | I67: =G67*6+H67 -> 31 | K67: 9 | L67: 9 | M67: =K67*6+L67 -> 63 | O67: 11 | P67: 14 | Q67: =O67*6+P67 -> 80 | S67: LEE
A68: BEST PLAYERS | W68: TEAM | X68: W | Y68: L | Z68: D | AA68: FOR | AB68: AGST | AC68: % | AD68: PTS
A69: COBURG | C69: R ATKINSON | F69: PROMNITZ | I69: PERRIN | L69: CONDON | N69: LONSDALE | Q69: ROWE
A70: CAMBERWELL | C70: SEELENMEYER | F70: COLLIER | I70: BRADFORD | L70: LAWS | N70: JORGENSON | Q70: ALLEN | W70: COBURG | X70: 2 | Y70: 0 | Z70: 0 | AA70: 213 | AB70: 153 | AC70: =(AA70/AB70)*100 -> 139.21568627450981 | AD70: 8
A71: GOALKICKERS | W71: BRIGHTON | X71: 2 | Y71: 0 | Z71: 0 | AA71: 176 | AB71: 132 | AC71: =(AA71/AB71)*100 -> 133.33333333333331 | AD71: 8
A72: COBURG | C72: TITUS 5 | F72: ROWE 4 | I72: PERRIN 4 | L72: BOYLE 2 | N72: FYFFE 2 | P72: BROWN | W72: PRESTON | X72: 2 | Y72: 0 | Z72: 0 | AA72: 205 | AB72: 156 | AC72: =(AA72/AB72)*100 -> 131.41025641025641 | AD72: 8
A73: CAMBERWELL | C73: OLIVER 3 | E73: SHEAN 2 | G73: BRADFORD 2 | J73: HARRISON | M73: JORGENSON | P73: DUCKWORTH | S73: HINSON | W73: WILLIAMSTOWN | X73: 2 | Y73: 0 | Z73: 0 | AA73: 247 | AB73: 206 | AC73: =(AA73/AB73)*100 -> 119.90291262135922 | AD73: 8
A75: WILLIAMSTOWN | C75: 3 | D75: 5 | E75: =C75*6+D75 -> 23 | G75: 5 | H75: 7 | I75: =G75*6+H75 -> 37 | K75: 11 | L75: 14 | M75: =K75*6+L75 -> 80 | O75: 14 | P75: 17 | Q75: =O75*6+P75 -> 101 | S75: WILLIAMSTOWN | W75: YARRAVILLE | X75: 1 | Y75: 1 | Z75: 0 | AA75: 232 | AB75: 207 | AC75: =(AA75/AB75)*100 -> 112.07729468599035 | AD75: 4
A76: PORT MELBOURNE | C76: 2 | D76: 5 | E76: =C76*6+D76 -> 17 | G76: 8 | H76: 11 | I76: =G76*6+H76 -> 59 | K76: 8 | L76: 12 | M76: =K76*6+L76 -> 60 | O76: 13 | P76: 19 | Q76: =O76*6+P76 -> 97 | S76: THOMAS | W76: PORT MELBOURNE | X76: 1 | Y76: 1 | Z76: 0 | AA76: 243 | AB76: 221 | AC76: =(AA76/AB76)*100 -> 109.95475113122173 | AD76: 4
A77: BEST PLAYERS | W77: CAMBERWELL | X77: 1 | Y77: 1 | Z77: 0 | AA77: 192 | AB77: 193 | AC77: =(AA77/AB77)*100 -> 99.481865284974091 | AD77: 4
A78: WILLIAMSTOWN | C78: CUTTING | F78: TODD | I78: HARLEY | L78: FITCH | O78: GLASS | Q78: COCKBURN | W78: NORTHCOTE | X78: 1 | Y78: 1 | Z78: 0 | AA78: 151 | AB78: 187 | AC78: =(AA78/AB78)*100 -> 80.748663101604279 | AD78: 4
A79: PORT MELBOURNE | C79: McBETH | F79: ROBERTSON | I79: DOBSON | L79: FLETCHER | O79: LEWIS | Q79: TREMBATH | W79: BRUNSWICK | X79: 0 | Y79: 2 | Z79: 0 | AA79: 140 | AB79: 161 | AC79: =(AA79/AB79)*100 -> 86.956521739130437 | AD79: 0
A80: GOALKICKERS | W80: PRAHRAN | X80: 0 | Y80: 2 | Z80: 0 | AA80: 197 | AB80: 231 | AC80: =(AA80/AB80)*100 -> 85.281385281385283 | AD80: 0
A81: WILLIAMSTOWN | C81: TODD 8 | F81: DOWLING 3 | I81: SCARFFE 2 | L81: COCKBURN | W81: OAKLEIGH | X81: 0 | Y81: 2 | Z81: 0 | AA81: 128 | AB81: 194 | AC81: =(AA81/AB81)*100 -> 65.979381443298962 | AD81: 0
A82: PORT MELBOURNE | C82: ROBERTSON 5 | F82: FREYER 2 | H82: HOUSTEN 2 | J82: FLETCHER | L82: REYNOLDS | N82: TREMBATH | Q82: MARSHALL | W82: SANDRINGHAM | X82: 0 | Y82: 2 | Z82: 0 | AA82: 134 | AB82: 217 | AC82: =(AA82/AB82)*100 -> 61.751152073732719 | AD82: 0
A84: PRESTON | C84: 4 | D84: 5 | E84: =C84*6+D84 -> 29 | G84: 7 | H84: 12 | I84: =G84*6+H84 -> 54 | K84: 9 | L84: 13 | M84: =K84*6+L84 -> 67 | O84: 11 | P84: 19 | Q84: =O84*6+P84 -> 85 | S84: TOORAK PARK
A85: PRAHRAN | C85: 3 | D85: 5 | E85: =C85*6+D85 -> 23 | G85: 7 | H85: 10 | I85: =G85*6+H85 -> 52 | K85: 8 | L85: 16 | M85: =K85*6+L85 -> 64 | O85: 10 | P85: 17 | Q85: =O85*6+P85 -> 77 | S85: SCANLON
A86: BEST PLAYERS
A87: PRESTON | C87: BRADLEY | F87: McCARTHY | I87: BOYD | L87: McDONALD | O87: EXELBY | R87: MARTINI
A88: PRAHRAN | C88: BENNISON | F88: GRACIE | I88: AVERY | L88: LAMBORN | O88: OLSEN | R88: ROLFE
A89: GOALKICKERS
A90: PRESTON | C90: CONNELLY 3 | F90: NORMAN 2 | I90: BOYD 2 | K90: EXELBY 2 | M90: MASLEN | O90: McDONALD
A91: PRAHRAN | C91: OLSEN 3 | F91: CONROY 2 | I91: STACKPOLE 2 | L91: NORRIS | N91: ROACH | P91: ADAMS
A93: YARRAVILLE | C93: 4 | D93: 4 | E93: =C93*6+D93 -> 28 | G93: 9 | H93: 10 | I93: =G93*6+H93 -> 64 | K93: 15 | L93: 16 | M93: =K93*6+L93 -> 106 | O93: 17 | P93: 21 | Q93: =O93*6+P93 -> 123 | S93: BEACH ROAD
A94: SANDRINGHAM | C94: 4 | D94: 1 | E94: =C94*6+D94 -> 25 | G94: 5 | H94: 6 | I94: =G94*6+H94 -> 36 | K94: 8 | L94: 9 | M94: =K94*6+L94 -> 57 | O94: 8 | P94: 13 | Q94: =O94*6+P94 -> 61 | S94: MERRINGTON
A95: BEST PLAYERS
A96: YARRAVILLE | C96: LAW | E96: THOMAS | H96: JONES | K96: WRIGHT | N96: CAHILL | Q96: ELLIS
A97: SANDRINGHAM | C97: DAVIN | E97: WALKER | H97: BENNETT | K97: J MILLER | N97: MARSH | Q97: WEBB
A98: GOALKICKERS
A99: YARRAVILLE | C99: JONES 6 | F99: THOMAS 3 | I99: LAW 3 | K99: HOWDEN 2 | N99: ELLIS | P99: RANN | R99: NICHOLLS
A100: SANDRINGHAM | C100: MOLONEY 2 | F100: WALKER 2 | I100: BENNETT | K100: DE VERGER | N100: MIDDLETON | Q100: MATHESON
A102: NORTHCOTE | C102: 4 | D102: 0 | E102: =C102*6+D102 -> 24 | G102: 7 | H102: 2 | I102: =G102*6+H102 -> 44 | K102: 10 | L102: 2 | M102: =K102*6+L102 -> 62 | O102: 11 | P102: 6 | Q102: =O102*6+P102 -> 72 | S102: NORTHCOTE
A103: BRUNSWICK | C103: 1 | D103: 9 | E103: =C103*6+D103 -> 15 | G103: 3 | H103: 14 | I103: =G103*6+H103 -> 32 | K103: 5 | L103: 21 | M103: =K103*6+L103 -> 51 | O103: 7 | P103: 25 | Q103: =O103*6+P103 -> 67 | S103: STEVENSON
A104: BEST PLAYERS
A105: NORTHCOTE | C105: JORGENSON | F105: BALLANTYNE | I105: HOLDEN | L105: WALLIS | O105: DRYDEN | R105: BAGULEY
A106: BRUNSWICK | C106: HOGAN | F106: HUNTER | I106: JEFFREY | L106: HOBBA | O106: GREGG | R106: BLACKMORE
A107: GOALKICKERS
A108: NORTHCOTE | C108: JORGENSON 5 | F108: BALLANTYNE 3 | J108: BAGULEY | M108: JONES | O108: POLGLASE
A109: BRUNSWICK | C109: BLACKMORE 2 | F109: JACOBS | H109: GEISLER | J109: JEFFREY | M109: HUGHES | O109: COLLICOAT
A111: BRIGHTON | C111: 3 | D111: 2 | E111: =C111*6+D111 -> 20 | G111: 8 | H111: 6 | I111: =G111*6+H111 -> 54 | K111: 10 | L111: 9 | M111: =K111*6+L111 -> 69 | O111: 12 | P111: 10 | Q111: =O111*6+P111 -> 82 | S111: OAKLEIGH
A112: OAKLEIGH | C112: 1 | D112: 0 | E112: =C112*6+D112 -> 6 | G112: 5 | H112: 2 | I112: =G112*6+H112 -> 32 | K112: 8 | L112: 6 | M112: =K112*6+L112 -> 54 | O112: 8 | P112: 11 | Q112: =O112*6+P112 -> 59 | S112: McALPINE
A113: BEST PLAYERS
A114: BRIGHTON | C114: JARRETT | E114: KENNETT | I114: VALLENCE | L114: McINDOE | O114: KEMP | R114: WHITE
A115: OAKLEIGH | C115: BEARD | E115: BICKERTON | I115: WILLIAMS | L115: D RYAN | O115: LEWEIS | R115: MUDGE
A116: GOALKICKERS
A117: BRIGHTON | C117: VALLENCE 6 | F117: PICKETT 2 | I117: PAGE | K117: KING | M117: McINDOE | P117: SPARGO
A118: OAKLEIGH | C118: HALL 2 | F118: CAMPBELL 2 | I118: SCALES 2 | K118: WORRALL | M118: FINN
A120: ROUND 3 | D120: 28TH APRIL | J120: WEATHER | M120: FINE SOUTH EAST BREEZE | S120: PLAYED AT
D121: 1ST QTR | H121: 2ND QTR | L121: 3RD QTR | P121: FINAL | S121: ELSTERNWICK PARK
A122: BRIGHTON | C122: 2 | D122: 3 | E122: =C122*6+D122 -> 15 | G122: 9 | H122: 9 | I122: =G122*6+H122 -> 63 | K122: 9 | L122: 9 | M122: =K122*6+L122 -> 63 | O122: 14 | P122: 13 | Q122: =O122*6+P122 -> 97 | S122: UMPIRE | X122: LADDER | AB122: ROUND | AD122: 3
A123: YARRAVILLE | C123: 1 | D123: 6 | E123: =C123*6+D123 -> 12 | G123: 1 | H123: 7 | I123: =G123*6+H123 -> 13 | K123: 3 | L123: 18 | M123: =K123*6+L123 -> 36 | O123: 5 | P123: 20 | Q123: =O123*6+P123 -> 50 | S123: THOMAS
A124: BEST PLAYERS | W124: TEAM | X124: W | Y124: L | Z124: D | AA124: FOR | AB124: AGST | AC124: % | AD124: PTS
A125: BRIGHTON | C125: ALVIN | F125: WILLIAMSON | I125: KENNETT | L125: JARRETT | N125: PLUNKETT | Q125: McINDOE
A126: YARRAVILLE | C126: HOWDEN | F126: THOMAS | I126: ELLIS | L126: GARLICK | N126: J RUDDELL | Q126: KNIGHT | W126: COBURG | X126: 3 | Y126: 0 | Z126: 0 | AA126: 325 | AB126: 216 | AC126: =(AA126/AB126)*100 -> 150.46296296296296 | AD126: 12
A127: GOALKICKERS | W127: BRIGHTON | X127: 3 | Y127: 0 | Z127: 0 | AA127: 273 | AB127: 182 | AC127: =(AA127/AB127)*100 -> 150 | AD127: 12
A128: BRIGHTON | C128: ALVIN 8 | F128: PICKETT | H128: SEARLE | J128: BROWN | L128: KEMP | N128: KENNETT | Q128: PLUNKETT | W128: WILLIAMSTOWN | X128: 3 | Y128: 0 | Z128: 0 | AA128: 400 | AB128: 324 | AC128: =(AA128/AB128)*100 -> 123.45679012345678 | AD128: 12
A129: YARRAVILLE | C129: LAW 3 | F129: H RUDDELL | I129: THOMAS | W129: PORT MELBOURNE | X129: 2 | Y129: 1 | Z129: 0 | AA129: 374 | AB129: 285 | AC129: =(AA129/AB129)*100 -> 131.2280701754386 | AD129: 8
A131: WILLIAMSTOWN | C131: 11 | D131: 7 | E131: =C131*6+D131 -> 73 | G131: 15 | H131: 11 | I131: =G131*6+H131 -> 101 | K131: 20 | L131: 15 | M131: =K131*6+L131 -> 135 | O131: 23 | P131: 15 | Q131: =O131*6+P131 -> 153 | S131: PRESTON | W131: PRESTON | X131: 2 | Y131: 1 | Z131: 0 | AA131: 323 | AB131: 309 | AC131: =(AA131/AB131)*100 -> 104.53074433656957 | AD131: 8
A132: PRESTON | C132: 1 | D132: 2 | E132: =C132*6+D132 -> 8 | G132: 7 | H132: 8 | I132: =G132*6+H132 -> 50 | K132: 8 | L132: 13 | M132: =K132*6+L132 -> 61 | O132: 17 | P132: 16 | Q132: =O132*6+P132 -> 118 | S132: McALPINE | W132: NORTHCOTE | X132: 2 | Y132: 1 | Z132: 0 | AA132: 255 | AB132: 281 | AC132: =(AA132/AB132)*100 -> 90.747330960854086 | AD132: 8
A133: BEST PLAYERS | W133: BRUNSWICK | X133: 1 | Y133: 2 | Z133: 0 | AA133: 249 | AB133: 250 | AC133: =(AA133/AB133)*100 -> 99.6 | AD133: 4
A134: WILLIAMSTOWN | C134: TODD | F134: TORNEY | I134: HARLEY | L134: SCARFFE | N134: HEARN | Q134: CUTTING | W134: CAMBERWELL | X134: 1 | Y134: 2 | Z134: 0 | AA134: 286 | AB134: 297 | AC134: =(AA134/AB134)*100 -> 96.296296296296291 | AD134: 4
A135: PRESTON | C135: NORMAN | F135: BOYD | I135: MARTINI | L135: EXELBY | N135: McCARTHY | Q135: ANDERSON | W135: YARRAVILLE | X135: 1 | Y135: 2 | Z135: 0 | AA135: 282 | AB135: 304 | AC135: =(AA135/AB135)*100 -> 92.76315789473685 | AD135: 4
A136: GOALKICKERS | W136: PRAHRAN | X136: 0 | Y136: 3 | Z136: 0 | AA136: 260 | AB136: 343 | AC136: =(AA136/AB136)*100 -> 75.801749271137027 | AD136: 0
A137: WILLIAMSTOWN | C137: TODD 13 | F137: SCARFFE 3 | I137: FOX 3 | K137: HARLEY 2 | M137: GLASS | O137: FITCH | W137: SANDRINGHAM | X137: 0 | Y137: 3 | Z137: 0 | AA137: 223 | AB137: 326 | AC137: =(AA137/AB137)*100 -> 68.404907975460134 | AD137: 0
A138: PRESTON | C138: CONNELLY 8 | F138: MASLEN 3 | I138: BOYD 2 | K138: DUGGAN 2 | N138: NORMAN | P138: EXELBY | W138: OAKLEIGH | X138: 0 | Y138: 3 | Z138: 0 | AA138: 192 | AB138: 325 | AC138: =(AA138/AB138)*100 -> 59.07692307692308 | AD138: 0
A140: NORTHCOTE | C140: 2 | D140: 2 | E140: =C140*6+D140 -> 14 | G140: 6 | H140: 6 | I140: =G140*6+H140 -> 42 | K140: 8 | L140: 10 | M140: =K140*6+L140 -> 58 | O140: 15 | P140: 14 | Q140: =O140*6+P140 -> 104 | S140: NORTHCOTE
A141: CAMBERWELL | C141: 2 | D141: 6 | E141: =C141*6+D141 -> 18 | G141: 6 | H141: 9 | I141: =G141*6+H141 -> 45 | K141: 11 | L141: 14 | M141: =K141*6+L141 -> 80 | O141: 13 | P141: 16 | Q141: =O141*6+P141 -> 94 | S141: HARRIS
A142: BEST PLAYERS
A143: NORTHCOTE | C143: WALLIS | F143: McINTOSH | I143: DUDLEY | L143: STABB | O143: BAGULEY | R143: KERWIN
A144: CAMBERWELL | C144: TAYLOR | F144: WINWARD | I144: BRADFORD | L144: McDONALD | O144: JORGENSON | R144: BRYCE
A145: GOALKICKERS
A146: NORTHCOTE | C146: BAGULEY 4 | F146: JORGENSON 3 | I146: MORGAN 3 | L146: McINTOSH 2 | O146: BALLANTYNE | R146: DUDLEY | U146: CLARKE
A147: CAMBERWELL | C147: BRADFORD 4 | F147: HINSON 3 | I147: McDONALD 2 | L147: OLIVER | N147: SHEAN | P147: BRYCE | R147: HARLAND
A149: BRUNSWICK | C149: 9 | D149: 5 | E149: =C149*6+D149 -> 59 | G149: 12 | H149: 8 | I149: =G149*6+H149 -> 80 | K149: 14 | L149: 12 | M149: =K149*6+L149 -> 96 | O149: 16 | P149: 13 | Q149: =O149*6+P149 -> 109 | S149: BRUNSWICK
A150: SANDRINGHAM | C150: 1 | D150: 4 | E150: =C150*6+D150 -> 10 | G150: 5 | H150: 9 | I150: =G150*6+H150 -> 39 | K150: 8 | L150: 13 | M150: =K150*6+L150 -> 61 | O150: 12 | P150: 17 | Q150: =O150*6+P150 -> 89 | S150: HENNING
A151: BEST PLAYERS
A152: BRUNSWICK | C152: SILK | F152: PLUMMER | I152: STANDFIELD | L152: BAKER | O152: HUGHES | R152: JESSOP
A153: SANDRINGHAM | C153: BENNETT | F153: MOLONEY | I153: DE VERGER | L153: RAY | O153: McKENZIE | R153: SMAIL
A154: GOALKICKERS
A155: BRUNSWICK | C155: SILK 5 | F155: HUGHES 3 | I155: HOGAN 3 | K155: JACOBS 2 | M155: STANDFIELD | P155: EVANS | R155: GREGG
A156: SANDRINGHAM | C156: MOLONEY 4 | F156: NICHOLSON 3 | I156: MIDDLETON | L156: HOLMES | N156: McKENZIE | Q156: CHILDS | S156: STAMMERS
A158: PORT MELBOURNE | C158: 6 | D158: 10 | E158: =C158*6+D158 -> 46 | G158: 8 | H158: 10 | I158: =G158*6+H158 -> 58 | K158: 15 | L158: 15 | M158: =K158*6+L158 -> 105 | O158: 19 | P158: 17 | Q158: =O158*6+P158 -> 131 | S158: OLYMPIC PARK No. 2
A159: OAKLEIGH | C159: 2 | D159: 0 | E159: =C159*6+D159 -> 12 | G159: 6 | H159: 4 | I159: =G159*6+H159 -> 40 | K159: 6 | L159: 5 | M159: =K159*6+L159 -> 41 | O159: 9 | P159: 10 | Q159: =O159*6+P159 -> 64 | S159: MERRINGTON
A160: BEST PLAYERS
A161: PORT MELBOURNE | C161: ROBERTSON | F161: HOUSTEN | I161: FREYER | L161: LEWIS | N161: FLETCHER | Q161: LAHIFF
A162: OAKLEIGH | C162: BEARD | F162: NAISMITH | I162: FINN | L162: CAMPBELL | N162: GILBERT | Q162: D RYAN
A163: GOALKICKERS
A164: PORT MELBOURNE | C164: FREYER 11 | F164: HOUSTEN 3 | I164: ROBERTSON 3 | L164: LEWIS 2
A165: OAKLEIGH | C165: NAISMITH 3 | F165: CAMPBELL 3 | I165: BREMNER 3
A167: COBURG | C167: 4 | D167: 6 | E167: =C167*6+D167 -> 30 | G167: 6 | H167: 10 | I167: =G167*6+H167 -> 46 | K167: 10 | L167: 14 | M167: =K167*6+L167 -> 74 | O167: 16 | P167: 16 | Q167: =O167*6+P167 -> 112 | S167: TOORAK PARK
A168: PRAHRAN | C168: 2 | D168: 1 | E168: =C168*6+D168 -> 13 | G168: 5 | H168: 7 | I168: =G168*6+H168 -> 37 | K168: 6 | L168: 9 | M168: =K168*6+L168 -> 45 | O168: 8 | P168: 15 | Q168: =O168*6+P168 -> 63 | S168: GREORY
A169: BEST PLAYERS
A170: COBURG | C170: ROWE | E170: STARBUCK | H170: HORE | K170: MILTE | M170: PROMNITZ | P170: GOETZE
A171: PRAHRAN | C171: ROLFE | E171: LAMBORN | H171: ROACH | K171: WHITE | M171: R WILLIAMS | P171: GRACIE
A172: GOALKICKERS
A173: COBURG | C173: TITUS 7 | F173: PERRIN 2 | I173: CONDON 2 | L173: ROWE 2 | N173: MILTE | P173: FYFFE | R173: BOYLE
A174: PRAHRAN | C174: ROLFE 3 | F174: ROACH 2 | I174: GARDINER | L174: ADAMS | N174: GRACIE
A176: ROUND 4 | D176: 5TH MAY | J176: WEATHER | M176: FINE WARM NORTH BREEZE | S176: PLAYED AT
D177: 1ST QTR | H177: 2ND QTR | L177: 3RD QTR | P177: FINAL | S177: COBURG
A178: COBURG | C178: 3 | D178: 3 | E178: =C178*6+D178 -> 21 | G178: 11 | H178: 5 | I178: =G178*6+H178 -> 71 | K178: 14 | L178: 8 | M178: =K178*6+L178 -> 92 | O178: 21 | P178: 16 | Q178: =O178*6+P178 -> 142 | S178: UMPIRE | X178: LADDER | AB178: ROUND | AD178: 4
A179: PORT MELBOURNE | C179: 5 | D179: 5 | E179: =C179*6+D179 -> 35 | G179: 8 | H179: 6 | I179: =G179*6+H179 -> 54 | K179: 9 | L179: 9 | M179: =K179*6+L179 -> 63 | O179: 11 | P179: 9 | Q179: =O179*6+P179 -> 75 | S179: GREGORY
A180: BEST PLAYERS | W180: TEAM | X180: W | Y180: L | Z180: D | AA180: FOR | AB180: AGST | AC180: % | AD180: PTS
A181: COBURG | C181: R ATKINSON | F181: PROMNITZ | I181: D ATKINSON | L181: KENNEDY | O181: FYFFE | R181: MILTE
A182: PORT MELBOURNE | C182: DOBSON | F182: LEWIS | I182: BAKER | L182: HAYES | O182: ROBERTSON | R182: ALSOPP | W182: COBURG | X182: 4 | Y182: 0 | Z182: 0 | AA182: 467 | AB182: 291 | AC182: =(AA182/AB182)*100 -> 160.4810996563574 | AD182: 16
A183: GOALKICKERS | W183: WILLIAMSTOWN | X183: 4 | Y183: 0 | Z183: 0 | AA183: 543 | AB183: 369 | AC183: =(AA183/AB183)*100 -> 147.15447154471545 | AD183: 16
A184: COBURG | C184: TITUS 6 | E184: ROWE 5 | G184: CONDON 3 | J184: FYFFE 2 | L184: KENNEDY 2 | N184: HORE | P184: CREWTHER | R184: PERRIN | W184: PRESTON | X184: 3 | Y184: 1 | Z184: 0 | AA184: 457 | AB184: 403 | AC184: =(AA184/AB184)*100 -> 113.39950372208436 | AD184: 12
A185: PORT MELBOURNE | C185: FREYER 3 | E185: HOUSTEN 3 | H185: ROBERTSON 2 | K185: LEWIS 2 | M185: STEIGENBERGER | W185: BRIGHTON | X185: 3 | Y185: 1 | Z185: 0 | AA185: 318 | AB185: 325 | AC185: =(AA185/AB185)*100 -> 97.846153846153854 | AD185: 12
A187: WILLIAMSTOWN | C187: 5 | D187: 6 | E187: =C187*6+D187 -> 36 | G187: 9 | H187: 9 | I187: =G187*6+H187 -> 63 | K187: 14 | L187: 18 | M187: =K187*6+L187 -> 102 | O187: 20 | P187: 23 | Q187: =O187*6+P187 -> 143 | S187: WILLIAMSTOWN | W187: NORTHCOTE | X187: 3 | Y187: 1 | Z187: 0 | AA187: 349 | AB187: 361 | AC187: =(AA187/AB187)*100 -> 96.67590027700831 | AD187: 12
A188: BRIGHTON | C188: 2 | D188: 0 | E188: =C188*6+D188 -> 12 | G188: 3 | H188: 2 | I188: =G188*6+H188 -> 20 | K188: 4 | L188: 3 | M188: =K188*6+L188 -> 27 | O188: 6 | P188: 9 | Q188: =O188*6+P188 -> 45 | S188: McALPINE | W188: PORT MELBOURNE | X188: 2 | Y188: 2 | Z188: 0 | AA188: 449 | AB188: 427 | AC188: =(AA188/AB188)*100 -> 105.15222482435598 | AD188: 8
A189: BEST PLAYERS | W189: BRUNSWICK | X189: 2 | Y189: 2 | Z189: 0 | AA189: 347 | AB189: 330 | AC189: =(AA189/AB189)*100 -> 105.15151515151516 | AD189: 8
A190: WILLIAMSTOWN | C190: TORNEY | F190: SCOTT | I190: CHISHOLM | L190: WILCOX | O190: COCKBURN | R190: HEARN | W190: CAMBERWELL | X190: 1 | Y190: 3 | Z190: 0 | AA190: 366 | AB190: 395 | AC190: =(AA190/AB190)*100 -> 92.658227848101276 | AD190: 4
A191: BRIGHTON | C191: JARRETT | F191: WILLIAMSON | I191: BROWN | L191: KENNETT | O191: ORGER | R191: DOREY | W191: PRAHRAN | X191: 1 | Y191: 3 | Z191: 0 | AA191: 385 | AB191: 421 | AC191: =(AA191/AB191)*100 -> 91.448931116389559 | AD191: 4
A192: GOALKICKERS | W192: YARRAVILLE | X192: 1 | Y192: 3 | Z192: 0 | AA192: 360 | AB192: 429 | AC192: =(AA192/AB192)*100 -> 83.91608391608392 | AD192: 4
A193: WILLIAMSTOWN | C193: TODD 7 | E193: FOX 3 | G193: HARLEY 3 | I193: HAGAN 2 | K193: TORNEY 2 | M193: DOWLING 2 | P193: COCKBURN | W193: SANDRINGHAM | X193: 0 | Y193: 4 | Z193: 0 | AA193: 317 | AB193: 460 | AC193: =(AA193/AB193)*100 -> 68.913043478260875 | AD193: 0
A194: BRIGHTON | C194: BROWN 2 | E194: SEARLE | G194: ALVIN | I194: KING | J194: SPARGO | W194: OAKLEIGH | X194: 0 | Y194: 4 | Z194: 0 | AA194: 272 | AB194: 419 | AC194: =(AA194/AB194)*100 -> 64.916467780429599 | AD194: 0
A196: BRUNSWICK | C196: 4 | D196: 6 | E196: =C196*6+D196 -> 30 | G196: 8 | H196: 8 | I196: =G196*6+H196 -> 56 | K196: 11 | L196: 11 | M196: =K196*6+L196 -> 77 | O196: 13 | P196: 20 | Q196: =O196*6+P196 -> 98 | S196: CAMBERWELL
A197: CAMBERWELL | C197: 3 | D197: 5 | E197: =C197*6+D197 -> 23 | G197: 5 | H197: 10 | I197: =G197*6+H197 -> 40 | K197: 7 | L197: 15 | M197: =K197*6+L197 -> 57 | O197: 10 | P197: 20 | Q197: =O197*6+P197 -> 80 | S197: THOMAS
A198: BEST PLAYERS
A199: BRUNSWICK | C199: FARRELL | F199: PLUMMER | I199: HUGHES | K199: STANDFIELD | N199: EVANS | Q199: SILK
A200: CAMBERWELL | C200: SEELENMEYER | F200: AUSTEN | I200: PETERS | K200: JORGENSON | N200: OLIVER | Q200: HARLAND
A201: GOALKICKERS
A202: BRUNSWICK | C202: JACOBS 5 | F202: SILK 3 | H202: COLLICOAT 2 | K202: JESSOP 2 | M202: HOGAN
A203: CAMBERWELL | C203: OLIVER 3 | F203: JORGENSON 2 | I203: FERGUSON 2 | L203: McDONALD | N203: QUILL | P203: BRYCE
A205: PRAHRAN | C205: 3 | D205: 6 | E205: =C205*6+D205 -> 24 | G205: 8 | H205: 10 | I205: =G205*6+H205 -> 58 | K205: 12 | L205: 16 | M205: =K205*6+L205 -> 88 | O205: 18 | P205: 17 | Q205: =O205*6+P205 -> 125 | S205: YARRAVILLE
A206: YARRAVILLE | C206: 1 | D206: 1 | E206: =C206*6+D206 -> 7 | G206: 3 | H206: 9 | I206: =G206*6+H206 -> 27 | K206: 5 | L206: 12 | M206: =K206*6+L206 -> 42 | O206: 10 | P206: 17 | Q206: =O206*6+P206 -> 77 | S206: PARRIS
A207: BEST PLAYERS
A208: PRAHRAN | C208: BURTON | F208: CONROY | I208: WHITE | L208: ROLFE | O208: BOURKE | R208: BAKER
A209: YARRAVILLE | C209: ELLIS | F209: CAHILL | I209: SMITH | L209: KNIGHT | O209: JONES | R209: STREETER
A210: GOALKICKERS
A211: PRAHRAN | C211: BURTON 12 | F211: BUCKLEY 3 | I211: ROLFE | K211: GRACIE | M211: OLSEN
A212: YARRAVILLE | C212: CASELY 3 | F212: CAHILL 2 | I212: GARLICK | K212: VURLOW | M212: PERUSSICH | P212: H RUDDELL | S212: HOWDEN
A214: PRESTON | C214: 8 | D214: 3 | E214: =C214*6+D214 -> 51 | G214: 11 | H214: 9 | I214: =G214*6+H214 -> 75 | K214: 15 | L214: 13 | M214: =K214*6+L214 -> 103 | O214: 20 | P214: 14 | Q214: =O214*6+P214 -> 134 | S214: BEACH ROAD
A215: SANDRINGHAM | C215: 4 | D215: 3 | E215: =C215*6+D215 -> 27 | G215: 8 | H215: 4 | I215: =G215*6+H215 -> 52 | K215: 13 | L215: 11 | M215: =K215*6+L215 -> 89 | O215: 13 | P215: 16 | Q215: =O215*6+P215 -> 94 | S215: MERRINGTON
A216: BEST PLAYERS
A217: PRESTON | C217: CONNELLY | F217: ANDERSON | I217: MASLEN | L217: WALKER | O217: BROMLEY | R217: EXELBY
A218: SANDRINGHAM | C218: MIDDLETON | F218: HOLMES | I218: BENNETT | L218: J MILLER | O218: MATHESON | R218: FARRELLY
A219: GOALKICKERS
A220: PRESTON | C220: CONNELLY 12 | F220: MASLEN 4 | I220: ANDERSON | L220: DUGGAN | N220: McCARTHY | Q220: BOYD
A221: SANDRINGHAM | C221: HOLMES 6 | F221: MIDDLETON 2 | I221: FARRELLY 2 | L221: J MILLER | N221: MOLONEY | Q221: BENCRAFT
A223: NORTHCOTE | C223: 5 | D223: 5 | E223: =C223*6+D223 -> 35 | G223: 9 | H223: 7 | I223: =G223*6+H223 -> 61 | K223: 11 | L223: 9 | M223: =K223*6+L223 -> 75 | O223: 13 | P223: 16 | Q223: =O223*6+P223 -> 94 | S223: OAKLEIGH
A224: OAKLEIGH | C224: 2 | D224: 5 | E224: =C224*6+D224 -> 17 | G224: 5 | H224: 10 | I224: =G224*6+H224 -> 40 | K224: 9 | L224: 14 | M224: =K224*6+L224 -> 68 | O224: 10 | P224: 20 | Q224: =O224*6+P224 -> 80 | S224: STEVENSON
A225: BEST PLAYERS
A226: NORTHCOTE | C226: JORGENSON | F226: McINTOSH | I226: WALLIS | L226: DUDLEY | O226: MORGAN | R226: STAFFORD
A227: OAKLEIGH | C227: MUDGE | F227: LEWIS | I227: BEARD | L227: WORRALL | O227: NAISMITH | R227: RICHARDSON
A228: GOALKICKERS
A229: NORTHCOTE | C229: JORGENSON 4 | F229: MORGAN 2 | I229: GREENWOOD 2 | L229: KINDER 2 | N229: KERWIN | P229: BAGULEY | R229: ZBLESKI
A230: OAKLEIGH | C230: MUDGE 3 | F230: RICHARDSON 2 | J230: NAISMITH 2 | M230: LEWIS | O230: WORRALL | Q230: BREMNER
A232: ROUND 5 | D232: 12TH MAY | J232: WEATHER | M232: CLOUDY MILD NORTH WIND | S232: PLAYED AT
D233: 1ST QTR | H233: 2ND QTR | L233: 3RD QTR | P233: FINAL | S233: PRESTON
A234: COBURG | C234: 2 | D234: 0 | E234: =C234*6+D234 -> 12 | G234: 7 | H234: 6 | I234: =G234*6+H234 -> 48 | K234: 10 | L234: 7 | M234: =K234*6+L234 -> 67 | O234: 15 | P234: 13 | Q234: =O234*6+P234 -> 103 | S234: UMPIRE | X234: LADDER | AB234: ROUND | AD234: 5
A235: PRESTON | C235: 3 | D235: 3 | E235: =C235*6+D235 -> 21 | G235: 3 | H235: 4 | I235: =G235*6+H235 -> 22 | K235: 7 | L235: 9 | M235: =K235*6+L235 -> 51 | O235: 9 | P235: 9 | Q235: =O235*6+P235 -> 63 | S235: PARRIS
A236: BEST PLAYERS | W236: TEAM | X236: W | Y236: L | Z236: D | AA236: FOR | AB236: AGST | AC236: % | AD236: PTS
A237: COBURG | C237: FYFFE | E237: HORE | H237: R ATKINSON | K237: PERRIN | N237: PROMNITZ | Q237: GOETZE
A238: PRESTON | C238: MINNEY | E238: MARTINI | H238: BRADLEY | K238: EXELBY | N238: BROOKS | Q238: SEEDSMAN | W238: WILLIAMSTOWN | X238: 5 | Y238: 0 | Z238: 0 | AA238: 733 | AB238: 429 | AC238: =(AA238/AB238)*100 -> 170.86247086247087 | AD238: 20
A239: GOALKICKERS | W239: COBURG | X239: 5 | Y239: 0 | Z239: 0 | AA239: 570 | AB239: 354 | AC239: =(AA239/AB239)*100 -> 161.01694915254237 | AD239: 20
A240: COBURG | C240: FYFFE 3 | E240: LONSDALE 3 | H240: ROWE 2 | J240: MILTE 2 | L240: TAYLOR 2 | N240: KENNEDY | P240: PERRIN | R240: D ATKINSON | W240: NORTHCOTE | X240: 4 | Y240: 1 | Z240: 0 | AA240: 440 | AB240: 430 | AC240: =(AA240/AB240)*100 -> 102.32558139534885 | AD240: 16
A241: PRESTON | C241: CONNELLY 2 | F241: SMITH 2 | H241: MARTINI | J241: ANDERSON | M241: FRANKLIN | O241: McDONALD | R241: SEEDSMAN | W241: PORT MELBOURNE | X241: 3 | Y241: 2 | Z241: 0 | AA241: 548 | AB241: 500 | AC241: =(AA241/AB241)*100 -> 109.6 | AD241: 12
A243: NORTHCOTE | C243: 4 | D243: 7 | E243: =C243*6+D243 -> 31 | G243: 6 | H243: 9 | I243: =G243*6+H243 -> 45 | K243: 10 | L243: 16 | M243: =K243*6+L243 -> 76 | O243: 12 | P243: 19 | Q243: =O243*6+P243 -> 91 | S243: ELSTERNWICK PARK | W243: PRESTON | X243: 3 | Y243: 2 | Z243: 0 | AA243: 520 | AB243: 506 | AC243: =(AA243/AB243)*100 -> 102.76679841897234 | AD243: 12
A244: BRIGHTON | C244: 2 | D244: 0 | E244: =C244*6+D244 -> 12 | G244: 7 | H244: 4 | I244: =G244*6+H244 -> 46 | K244: 7 | L244: 5 | M244: =K244*6+L244 -> 47 | O244: 10 | P244: 9 | Q244: =O244*6+P244 -> 69 | S244: THOMAS | W244: BRIGHTON | X244: 3 | Y244: 2 | Z244: 0 | AA244: 387 | AB244: 416 | AC244: =(AA244/AB244)*100 -> 93.02884615384616 | AD244: 12
A245: BEST PLAYERS | W245: CAMBERWELL | X245: 2 | Y245: 3 | Z245: 0 | AA245: 479 | AB245: 450 | AC245: =(AA245/AB245)*100 -> 106.44444444444446 | AD245: 8
A246: NORTHCOTE | C246: McINTOSH | F246: DUDLEY | I246: ELLIS | L246: KINDER | O246: WEGNER | Q246: McLEOD | W246: BRUNSWICK | X246: 2 | Y246: 3 | Z246: 0 | AA246: 431 | AB246: 416 | AC246: =(AA246/AB246)*100 -> 103.60576923076923 | AD246: 8
A247: BRIGHTON | C247: ALVIN | F247: JARRETT | I247: KENNETT | L247: WILLIAMSON | O247: CARLAND | Q247: ORGER | W247: PRAHRAN | X247: 2 | Y247: 3 | Z247: 0 | AA247: 471 | AB247: 504 | AC247: =(AA247/AB247)*100 -> 93.452380952380949 | AD247: 8
A248: GOALKICKERS | W248: YARRAVILLE | X248: 1 | Y248: 4 | Z248: 0 | AA248: 432 | AB248: 528 | AC248: =(AA248/AB248)*100 -> 81.818181818181827 | AD248: 4
A249: NORTHCOTE | C249: KINDER 3 | E249: JORGENSON 2 | H249: MORGAN 2 | J249: McINTOSH | M249: STABB | O249: JONES | Q249: STAFFORD | T249: CLARKE | W249: SANDRINGHAM | X249: 0 | Y249: 5 | Z249: 0 | AA249: 372 | AB249: 573 | AC249: =(AA249/AB249)*100 -> 64.921465968586389 | AD249: 0
A250: BRIGHTON | C250: ALVIN 4 | F250: McINDOE 2 | I250: MOFFAT | K250: SEARLE | M250: PICKETT | O250: JONES | W250: OAKLEIGH | X250: 0 | Y250: 5 | Z250: 0 | AA250: 332 | AB250: 609 | AC250: =(AA250/AB250)*100 -> 54.515599343185549 | AD250: 0
A252: PRAHRAN | C252: 2 | D252: 3 | E252: =C252*6+D252 -> 15 | G252: 3 | H252: 6 | I252: =G252*6+H252 -> 24 | K252: 7 | L252: 10 | M252: =K252*6+L252 -> 52 | O252: 12 | P252: 14 | Q252: =O252*6+P252 -> 86 | S252: BRUNSWICK
A253: BRUNSWICK | C253: 4 | D253: 3 | E253: =C253*6+D253 -> 27 | G253: 6 | H253: 4 | I253: =G253*6+H253 -> 40 | K253: 8 | L253: 11 | M253: =K253*6+L253 -> 59 | O253: 12 | P253: 12 | Q253: =O253*6+P253 -> 84 | S253: McALPINE
A254: BEST PLAYERS
A255: PRAHRAN | C255: BOURKE | F255: LAMBORN | I255: WHITE | L255: BENNISON | O255: ROLFE | R255: SPARGO
A256: BRUNSWICK | C256: HUGHES | F256: PLUMMER | I256: STANDFIELD | L256: FARRELL | O256: BAKER | R256: SILK
A257: GOALKICKERS
A258: PRAHRAN | C258: BUCKLEY 5 | F258: ROACH 2 | I258: ROLFE | K258: OLSEN | M258: GARDINER | O258: BURTON | Q258: WHITE | S258: SPARGO
A259: BRUNSWICK | C259: SILK 3 | F259: JACOBS 2 | I259: HUGHES 2 | L259: COLLICOAT 2 | O259: LEHMAN | Q259: JEFFRIES | S259: LODDING
A261: CAMBERWELL | C261: 5 | D261: 7 | E261: =C261*6+D261 -> 37 | G261: 10 | H261: 10 | I261: =G261*6+H261 -> 70 | K261: 14 | L261: 15 | M261: =K261*6+L261 -> 99 | O261: 16 | P261: 17 | Q261: =O261*6+P261 -> 113 | S261: CAMBERWELL
A262: SANDRINGHAM | C262: 0 | D262: 2 | E262: =C262*6+D262 -> 2 | G262: 3 | H262: 8 | I262: =G262*6+H262 -> 26 | K262: 3 | L262: 9 | M262: =K262*6+L262 -> 27 | O262: 7 | P262: 13 | Q262: =O262*6+P262 -> 55 | S262: GREGORY
A263: BEST PLAYERS
A264: CAMBERWELL | C264: BRADFORD | F264: A McDONALD | I264: COLLIER | L264: PETERS | O264: SEELENMEYER | R264: QUILL
A265: SANDRINGHAM | C265: HILMES | F265: BENNETT | I265: DE VERGER | L265: BENCRAFT | O265: RAY | R265: MOLONEY
A266: GOALKICKERS
A267: CAMBERWELL | C267: DIXON 5 | F267: BRADFORD 3 | I267: QUILL 3 | K267: JORGENSON 2 | N267: BRYCE | P267: J McDONALD | S267: OLIVER
A268: SANDRINGHAM | C268: HOLMES 2 | F268: FARRELLY 2 | I268: NICHOLSON | L268: DE VERGER | O268: REID
A270: PORT MELBOURNE | C270: 4 | D270: 8 | E270: =C270*6+D270 -> 32 | G270: 7 | H270: 8 | I270: =G270*6+H270 -> 50 | K270: 14 | L270: 14 | M270: =K270*6+L270 -> 98 | O270: 14 | P270: 15 | Q270: =O270*6+P270 -> 99 | S270: YARRAVILLE
A271: YARRAVILLE | C271: 0 | D271: 0 | E271: =C271*6+D271 -> 0 | G271: 3 | H271: 2 | I271: =G271*6+H271 -> 20 | K271: 4 | L271: 2 | M271: =K271*6+L271 -> 26 | O271: 9 | P271: 19 | Q271: =O271*6+P271 -> 73 | S271: STEVENSON
A272: BEST PLAYERS
A273: PORT MELBOURNE | C273: HAYES | F273: IRVING | I273: LEWIS | L273: DOBSON | O273: FISHER | R273: STOREY
A274: YARRAVILLE | C274: MARKS | F274: STREETER | I274: PERUSSICH | L274: JONES | O274: CAHILL | R274: J RUDDELL
A275: GOALKICKERS
A276: PORT MELBOURNE | C276: IRVING 5 | F276: LEWIS 3 | I276: FRYER 2 | K276: HOUSTEN 2 | N276: MALLETT 2
A277: YARRAVILLE | C277: PERUSSICH 2 | F277: THOMAS 2 | I277: HOWDEN 2 | L277: GARLICK | N277: BELL | P277: CASELY
A279: WILLIAMSTOWN | C279: 9 | D279: 2 | E279: =C279*6+D279 -> 56 | G279: 15 | H279: 10 | I279: =G279*6+H279 -> 100 | K279: 20 | L279: 15 | M279: =K279*6+L279 -> 135 | O279: 28 | P279: 22 | Q279: =O279*6+P279 -> 190 | S279: OAKLEIGH
A280: OAKLEIGH | C280: 4 | D280: 3 | E280: =C280*6+D280 -> 27 | G280: 4 | H280: 5 | I280: =G280*6+H280 -> 29 | K280: 7 | L280: 7 | M280: =K280*6+L280 -> 49 | O280: 8 | P280: 12 | Q280: =O280*6+P280 -> 60 | S280: MERRINGTON
A281: BEST PLAYERS
A282: WILLIAMSTOWN | C282: TODD | F282: TORNEY | I282: VINALL | L282: CHISHOLM | O282: REITMAN | R282: HARLEY
A283: OAKLEIGH | C283: NAISMITH | F283: GILBERT | I283: BEARD | L283: LEWIS | O283: WORRALL | R283: CORP
A284: GOALKICKERS
A285: WILLIAMSTOWN | C285: TODD 20 | F285: HARLEY 2 | I285: FOX 2 | K285: DOWLING | M285: SCARFFE | O285: REITMAN | R285: LE SUEUR
A286: OAKLEIGH | C286: KITCHEN | F286: NAISMITH | I286: TAYLOR | K286: WAITES | M286: FINN | O286: CORP | Q286: BEARD | S286: WORRALL
A288: ROUND 6 | D288: 19TH MAY | J288: WEATHER | M288: FINE SUNNY NORTH BREEZE | S288: PLAYED AT
D289: 1ST QTR | H289: 2ND QTR | L289: 3RD QTR | P289: FINAL | S289: NORTHCOTE
A290: PORT MELBOURNE | C290: 6 | D290: 4 | E290: =C290*6+D290 -> 40 | G290: 10 | H290: 5 | I290: =G290*6+H290 -> 65 | K290: 13 | L290: 9 | M290: =K290*6+L290 -> 87 | O290: 16 | P290: 13 | Q290: =O290*6+P290 -> 109 | S290: UMPIRE | X290: LADDER | AB290: ROUND | AD290: 6
A291: NORTHCOTE | C291: 2 | D291: 2 | E291: =C291*6+D291 -> 14 | G291: 5 | H291: 3 | I291: =G291*6+H291 -> 33 | K291: 5 | L291: 11 | M291: =K291*6+L291 -> 41 | O291: 7 | P291: 14 | Q291: =O291*6+P291 -> 56 | S291: GREGORY
A292: BEST PLAYERS | W292: TEAM | X292: W | Y292: L | Z292: D | AA292: FOR | AB292: AGST | AC292: % | AD292: PTS
A293: PORT MELBOURNE | C293: SEARLE | F293: STOREY | I293: FREYER | L293: CULPH | N293: HOUSTEN | Q293: JULIER
A294: NORTHCOTE | C294: JORGENSON | F294: KINDER | I294: McINTOSH | L294: STABB | N294: MORGAN | Q294: H OLVER | W294: COBURG | X294: 6 | Y294: 0 | Z294: 0 | AA294: 742 | AB294: 396 | AC294: =(AA294/AB294)*100 -> 187.37373737373736 | AD294: 24
A295: GOALKICKERS | W295: WILLIAMSTOWN | X295: 6 | Y295: 0 | Z295: 0 | AA295: 863 | AB295: 496 | AC295: =(AA295/AB295)*100 -> 173.99193548387098 | AD295: 24
A296: PORT MELBOURNE | C296: FREYER 8 | F296: CULPH 5 | I296: HOUSTEN | K296: LEWIS | M296: MALLETT | W296: PORT MELBOURNE | X296: 4 | Y296: 2 | Z296: 0 | AA296: 657 | AB296: 556 | AC296: =(AA296/AB296)*100 -> 118.16546762589928 | AD296: 16
A297: NORTHCOTE | C297: JORGENSON 2 | F297: KINDER 2 | I297: BAGULEY | K297: McINTOSH | M297: CARNEY | W297: PRESTON | X297: 4 | Y297: 2 | Z297: 0 | AA297: 659 | AB297: 568 | AC297: =(AA297/AB297)*100 -> 116.02112676056338 | AD297: 16
A299: PRESTON | C299: 4 | D299: 3 | E299: =C299*6+D299 -> 27 | G299: 11 | H299: 8 | I299: =G299*6+H299 -> 74 | K299: 14 | L299: 13 | M299: =K299*6+L299 -> 97 | O299: 20 | P299: 19 | Q299: =O299*6+P299 -> 139 | S299: PRESTON | W299: NORTHCOTE | X299: 4 | Y299: 2 | Z299: 0 | AA299: 496 | AB299: 539 | AC299: =(AA299/AB299)*100 -> 92.022263450834885 | AD299: 16
A300: BRIGHTON | C300: 4 | D300: 1 | E300: =C300*6+D300 -> 25 | G300: 5 | H300: 3 | I300: =G300*6+H300 -> 33 | K300: 5 | L300: 7 | M300: =K300*6+L300 -> 37 | O300: 9 | P300: 8 | Q300: =O300*6+P300 -> 62 | S300: PARRIS | W300: PRAHRAN | X300: 3 | Y300: 3 | Z300: 0 | AA300: 579 | AB300: 548 | AC300: =(AA300/AB300)*100 -> 105.65693430656935 | AD300: 12
A301: BEST PLAYERS | W301: BRIGHTON | X301: 3 | Y301: 3 | Z301: 0 | AA301: 449 | AB301: 555 | AC301: =(AA301/AB301)*100 -> 80.900900900900893 | AD301: 12
A302: PRESTON | C302: CONNELLY | F302: ANDERSON | I302: EXELBY | K302: BRADLEY | N302: McCARTHY | Q302: MASLEN | W302: CAMBERWELL | X302: 2 | Y302: 4 | Z302: 0 | AA302: 566 | AB302: 553 | AC302: =(AA302/AB302)*100 -> 102.35081374321882 | AD302: 8
A303: BRIGHTON | C303: ORGER | F303: KENNETT | I303: JARRETT | K303: NUTTER | N303: McINDOE | Q303: DOREY | W303: BRUNSWICK | X303: 2 | Y303: 4 | Z303: 0 | AA303: 498 | AB303: 546 | AC303: =(AA303/AB303)*100 -> 91.208791208791212 | AD303: 8
A304: GOALKICKERS | W304: YARRAVILLE | X304: 2 | Y304: 4 | Z304: 0 | AA304: 535 | AB304: 615 | AC304: =(AA304/AB304)*100 -> 86.99186991869918 | AD304: 8
A305: PRESTON | C305: CONNELLY 11 | F305: McCARTHY 3 | I305: HUTTON 3 | L305: MINNEY | N305: SMITH | P305: BOND | W305: SANDRINGHAM | X305: 0 | Y305: 6 | Z305: 0 | AA305: 414 | AB305: 745 | AC305: =(AA305/AB305)*100 -> 55.570469798657719 | AD305: 0
A306: BRIGHTON | C306: ORGER 6 | F306: KEMP | I306: MOFFATT | K306: McINDOE | W306: OAKLEIGH | X306: 0 | Y306: 6 | Z306: 0 | AA306: 378 | AB306: 717 | AC306: =(AA306/AB306)*100 -> 52.719665271966534 | AD306: 0
A308: WILLIAMSTOWN | C308: 3 | D308: 3 | E308: =C308*6+D308 -> 21 | G308: 11 | H308: 7 | I308: =G308*6+H308 -> 73 | K308: 17 | L308: 13 | M308: =K308*6+L308 -> 115 | O308: 19 | P308: 16 | Q308: =O308*6+P308 -> 130 | S308: WILLIAMSTOWN
A309: BRUNSWICK | C309: 3 | D309: 4 | E309: =C309*6+D309 -> 22 | G309: 6 | H309: 6 | I309: =G309*6+H309 -> 42 | K309: 6 | L309: 6 | M309: =K309*6+L309 -> 42 | O309: 10 | P309: 7 | Q309: =O309*6+P309 -> 67 | S309: MERRINGTON
A310: BEST PLAYERS
A311: WILLIAMSTOWN | C311: TODD | F311: TORNEY | I311: HEARN | K311: COCKBURN | N311: CHISHOLM | Q311: SCARFFE
A312: BRUNSWICK | C312: STANDFIELD | F312: PLUMMER | I312: DRYDEN | K312: LODDING | N312: HUGHES | Q312: JESSOP
A313: GOALKICKERS
A314: WILLIAMSTOWN | C314: TODD 10 | F314: DOWLING 5 | I314: HEARN 2 | L314: FOX 2
A315: BRUNSWICK | C315: LEHMAN 2 | F315: JACOBS 2 | I315: HOGAN 2 | K315: SILK | M315: JEFFREY | O315: COLLICOAT | R315: HUGHES
A317: YARRAVILLE | C317: 5 | D317: 7 | E317: =C317*6+D317 -> 37 | G317: 8 | H317: 8 | I317: =G317*6+H317 -> 56 | K317: 12 | L317: 9 | M317: =K317*6+L317 -> 81 | O317: 15 | P317: 13 | Q317: =O317*6+P317 -> 103 | S317: YARRAVILLE
A318: CAMBERWELL | C318: 3 | D318: 5 | E318: =C318*6+D318 -> 23 | G318: 4 | H318: 11 | I318: =G318*6+H318 -> 35 | K318: 8 | L318: 16 | M318: =K318*6+L318 -> 64 | O318: 11 | P318: 21 | Q318: =O318*6+P318 -> 87 | S318: STEVENSON
A319: BEST PLAYERS
A320: YARRAVILLE | C320: SORRAGHAN | F320: STREETER | I320: PERUSSICH | L320: DAY | N320: GARLICK | Q320: CAHILL
A321: CAMBERWELL | C321: COLLIER | F321: AUSTEN | I321: BRADFORD | L321: TAYLOR | N321: A McDONALD | Q321: J McDONALD
A322: GOALKICKERS
A323: YARRAVILLE | C323: GARLICK 3 | F323: SORRAGHAN 3 | I323: THOMAS 2 | L323: PERUSSICH 2 | O323: J RUDDELL 2 | R323: CAHILL 2 | U323: HOWDEN
A324: CAMBERWELL | C324: McDONALD 5 | F324: QUILL 4 | H324: BRADFORD | K324: JORGENSON
A326: PRAHRAN | C326: 1 | D326: 5 | E326: =C326*6+D326 -> 11 | G326: 6 | H326: 9 | I326: =G326*6+H326 -> 45 | K326: 10 | L326: 15 | M326: =K326*6+L326 -> 75 | O326: 15 | P326: 18 | Q326: =O326*6+P326 -> 108 | S326: TOORAK PARK
A327: OAKLEIGH | C327: 2 | D327: 4 | E327: =C327*6+D327 -> 16 | G327: 3 | H327: 6 | I327: =G327*6+H327 -> 24 | K327: 5 | L327: 9 | M327: =K327*6+L327 -> 39 | O327: 6 | P327: 10 | Q327: =O327*6+P327 -> 46 | S327: McALPINE
A328: BEST PLAYERS
A329: PRAHRAN | C329: BENNISON | F329: CAMM | I329: BURTON | L329: GRACIE | O329: ROLFE | R329: WHITE
A330: OAKLEIGH | C330: C JANE | F330: GILBERT | I330: VEALE | L330: BEARD | O330: NAISMITH | R330: WORRALL
A331: GOALKICKERS
A332: PRAHRAN | C332: BURTON 6 | F332: STACKPOLE 4 | I332: ROACH 2 | K332: ROLFE | M332: WHITE | O332: GRACIE
A333: OAKLEIGH | C333: HORNE 2 | F333: D RYAN | H333: NAISMITH | K333: BREMNER | M333: WORRALL
A335: COBURG | C335: 8 | D335: 4 | E335: =C335*6+D335 -> 52 | G335: 11 | H335: 10 | I335: =G335*6+H335 -> 76 | K335: 19 | L335: 15 | M335: =K335*6+L335 -> 129 | O335: 25 | P335: 22 | Q335: =O335*6+P335 -> 172 | S335: COBURG
A336: SANDRINGHAM | C336: 3 | D336: 3 | E336: =C336*6+D336 -> 21 | G336: 6 | H336: 3 | I336: =G336*6+H336 -> 39 | K336: 6 | L336: 4 | M336: =K336*6+L336 -> 40 | O336: 6 | P336: 6 | Q336: =O336*6+P336 -> 42 | S336: THOMAS
A337: BEST PLAYERS
A338: COBURG | C338: FYFFE | F338: TITUS | I338: MILTE | L338: GOETZE | O338: D ATKINSON | R338: PERRIN
A339: SANDRINGHAM | C339: BENNETT | F339: DE VERGER | I339: HOLMES | L339: J MILLER | O339: McCOY | R339: DAVIN
A340: GOALKICKERS
A341: COBURG | C341: TITUS 13 | F341: ROWE 4 | I341: FYFFE 4 | K341: CONDON 2 | N341: HORE | P341: DAY
A342: SANDRINGHAM | C342: HOLMES 3 | F342: DE VERGER 2 | I342: McKENZIE
A344: ROUND 7 | D344: 26TH MAY | J344: WEATHER | M344: SOUTH WEST BREEZE | S344: PLAYED AT
D345: 1ST QTR | H345: 2ND QTR | L345: 3RD QTR | P345: FINAL | S345: OLYMPIC PARK No. 2
A346: PORT MELBOURNE | C346: 10 | D346: 5 | E346: =C346*6+D346 -> 65 | G346: 17 | H346: 9 | I346: =G346*6+H346 -> 111 | K346: 18 | L346: 11 | M346: =K346*6+L346 -> 119 | O346: 30 | P346: 17 | Q346: =O346*6+P346 -> 197 | S346: UMPIRE | X346: LADDER | AB346: ROUND | AD346: 7
A347: BRIGHTON | C347: 2 | D347: 2 | E347: =C347*6+D347 -> 14 | G347: 5 | H347: 3 | I347: =G347*6+H347 -> 33 | K347: 9 | L347: 6 | M347: =K347*6+L347 -> 60 | O347: 9 | P347: 8 | Q347: =O347*6+P347 -> 62 | S347: GREGORY
A348: BEST PLAYERS | W348: TEAM | X348: W | Y348: L | Z348: D | AA348: FOR | AB348: AGST | AC348: % | AD348: PTS
A349: PORT MELBOURNE | C349: CULPH | F349: REYNOLDS | I349: FLETCHER | L349: SEARLE | N349: HOUSTEN | Q349: HAYES
A350: BRIGHTON | C350: WILLIAMSON | F350: MARSHALL | I350: WHITE | L350: CHESTER | N350: KENNETT | Q350: MOFFATT | W350: COBURG | X350: 7 | Y350: 0 | Z350: 0 | AA350: 915 | AB350: 425 | AC350: =(AA350/AB350)*100 -> 215.29411764705881 | AD350: 28
A351: GOALKICKERS | R351: LEWIS | W351: WILLIAMSTOWN | X351: 6 | Y351: 1 | Z351: 0 | AA351: 949 | AB351: 588 | AC351: =(AA351/AB351)*100 -> 161.39455782312925 | AD351: 24
A352: PORT MELBOURNE | C352: CULPH 11 | E352: MALLETT 5 | H352: HOUSTEN 4 | J352: CRAWSHAW 3 | M352: REYNOLDS 2 | P352: TREMBATH 2 | S352: IRVING 2 | W352: PORT MELBOURNE | X352: 5 | Y352: 2 | Z352: 0 | AA352: 854 | AB352: 618 | AC352: =(AA352/AB352)*100 -> 138.18770226537217 | AD352: 20
A353: BRIGHTON | C353: MARSHALL 3 | F353: CHESTER 3 | I353: ARKINSTAL | L353: KING | N353: CAVE | W353: PRAHRAN | X353: 4 | Y353: 3 | Z353: 0 | AA353: 728 | AB353: 648 | AC353: =(AA353/AB353)*100 -> 112.34567901234568 | AD353: 16
A355: BRUNSWICK | C355: 1 | D355: 2 | E355: =C355*6+D355 -> 8 | G355: 3 | H355: 10 | I355: =G355*6+H355 -> 28 | K355: 7 | L355: 13 | M355: =K355*6+L355 -> 55 | O355: 11 | P355: 17 | Q355: =O355*6+P355 -> 83 | S355: BRUNSWICK | W355: PRESTON | X355: 4 | Y355: 3 | Z355: 0 | AA355: 685 | AB355: 651 | AC355: =(AA355/AB355)*100 -> 105.22273425499232 | AD355: 16
A356: PRESTON | C356: 0 | D356: 5 | E356: =C356*6+D356 -> 5 | G356: 0 | H356: 7 | I356: =G356*6+H356 -> 7 | K356: 2 | L356: 10 | M356: =K356*6+L356 -> 22 | O356: 2 | P356: 14 | Q356: =O356*6+P356 -> 26 | S356: MERRINGTON | W356: NORTHCOTE | X356: 4 | Y356: 3 | Z356: 0 | AA356: 594 | AB356: 666 | AC356: =(AA356/AB356)*100 -> 89.189189189189193 | AD356: 16
A357: BEST PLAYERS | W357: BRUNSWICK | X357: 3 | Y357: 4 | Z357: 0 | AA357: 581 | AB357: 560 | AC357: =(AA357/AB357)*100 -> 103.75 | AD357: 12
A358: BRUNSWICK | C358: PLUMMER | F358: SILK | I358: HUGHES | L358: STANDFIELD | O358: JESSOP | Q358: NILSON | W358: CAMBERWELL | X358: 3 | Y358: 4 | Z358: 0 | AA358: 658 | AB358: 639 | AC358: =(AA358/AB358)*100 -> 102.97339593114241 | AD358: 12
A359: PRESTON | C359: BRADLEY | F359: ANDERSON | I359: MASLEN | L359: WALSH | O359: EXELBY | Q359: MINNEY | W359: YARRAVILLE | X359: 3 | Y359: 4 | Z359: 0 | AA359: 662 | AB359: 713 | AC359: =(AA359/AB359)*100 -> 92.847124824684428 | AD359: 12
A360: GOALKICKERS | W360: BRIGHTON | X360: 3 | Y360: 4 | Z360: 0 | AA360: 511 | AB360: 752 | AC360: =(AA360/AB360)*100 -> 67.952127659574472 | AD360: 12
A361: BRUNSWICK | C361: COLLICOAT 3 | F361: LEHMAN 3 | I361: HUGHES | K361: HOGAN | M361: DRYDEN | O361: JACOBS | Q361: MANN | W361: SANDRINGHAM | X361: 0 | Y361: 7 | Z361: 0 | AA361: 512 | AB361: 894 | AC361: =(AA361/AB361)*100 -> 57.270693512304248 | AD361: 0
A362: PRESTON | C362: MINNEY 2 | W362: OAKLEIGH | X362: 0 | Y362: 7 | Z362: 0 | AA362: 407 | AB362: 890 | AC362: =(AA362/AB362)*100 -> 45.730337078651687 | AD362: 0
A364: CAMBERWELL | C364: 1 | D364: 3 | E364: =C364*6+D364 -> 9 | G364: 6 | H364: 7 | I364: =G364*6+H364 -> 43 | K364: 10 | L364: 14 | M364: =K364*6+L364 -> 74 | O364: 12 | P364: 20 | Q364: =O364*6+P364 -> 92 | S364: CAMBERWELL
A365: WILLIAMSTOWN | C365: 2 | D365: 4 | E365: =C365*6+D365 -> 16 | G365: 8 | H365: 4 | I365: =G365*6+H365 -> 52 | K365: 10 | L365: 9 | M365: =K365*6+L365 -> 69 | O365: 12 | P365: 14 | Q365: =O365*6+P365 -> 86 | S365: SCANLON
A366: BEST PLAYERS
A367: CAMBERWELL | C367: COLLIER | F367: JORGENSON | I367: SEELENMEYER | L367: BRADFORD | O367: WINWARD | R367: J McDONALD
A368: WILLIAMSTOWN | C368: TORNEY | F368: FITCH | I368: HEARN | L368: TODD | O368: SCOTT | R368: SCARFFE
A369: GOALKICKERS
A370: CAMBERWELL | C370: JORGENSON 4 | F370: BRADFORD 3 | I370: McPHERSON 2 | L370: OLIVER 2 | N370: J McDONALD
A371: WILLIAMSTOWN | C371: TODD 6 | F371: HEARN 3 | I371: COCKBURN | L371: FOX | M371: GLASS
A373: YARRAVILLE | C373: 2 | D373: 5 | E373: =C373*6+D373 -> 17 | G373: 7 | H373: 7 | I373: =G373*6+H373 -> 49 | K373: 10 | L373: 14 | M373: =K373*6+L373 -> 74 | O373: 18 | P373: 19 | Q373: =O373*6+P373 -> 127 | S373: NORTHCOTE
A374: NORTHCOTE | C374: 2 | D374: 10 | E374: =C374*6+D374 -> 22 | G374: 7 | H374: 12 | I374: =G374*6+H374 -> 54 | K374: 10 | L374: 17 | M374: =K374*6+L374 -> 77 | O374: 13 | P374: 20 | Q374: =O374*6+P374 -> 98 | S374: McALPINE
A375: BEST PLAYERS
A376: YARRAVILLE | C376: PERUSSICH | F376: JONES | I376: H RUDDELL | L376: CAHILL | O376: ELLIS | Q376: MARKS
A377: NORTHCOTE | C377: KINDER | F377: McINTOSH | I377: WEGNER | L377: MORGAN | O377: McLEOD | Q377: STABB
A378: GOALKICKERS
A379: YARRAVILLE | C379: CAHILL 5 | F379: ELLIS 4 | H379: PERUSSICH 4 | K379: BELL 2 | M379: SORRAGHAN | P379: THOMAS | R379: H RUDDELL
A380: NORTHCOTE | C380: CARNEY 3 | F380: MORGAN 2 | I380: KINDER 2 | K380: BAGULEY 2 | N380: McINTOSH | Q380: JONES | S380: STAFFORD | V380: STABB
A382: PRAHRAN | C382: 5 | D382: 2 | E382: =C382*6+D382 -> 32 | G382: 12 | H382: 11 | I382: =G382*6+H382 -> 83 | K382: 14 | L382: 14 | M382: =K382*6+L382 -> 98 | O382: 22 | P382: 17 | Q382: =O382*6+P382 -> 149 | S382: BEACH ROAD
A383: SANDRINGHAM | C383: 3 | D383: 3 | E383: =C383*6+D383 -> 21 | G383: 6 | H383: 5 | I383: =G383*6+H383 -> 41 | K383: 12 | L383: 11 | M383: =K383*6+L383 -> 83 | O383: 14 | P383: 14 | Q383: =O383*6+P383 -> 98 | S383: PARRIS
A384: BEST PLAYERS
A385: PRAHRAN | C385: CAMM | F385: STACKPOLE | I385: WHITE | K385: BENNISON | N385: GARDINER | Q385: DRIVER
A386: SANDRINGHAM | C386: DE VERGER | F386: BENNETT | I386: WALKER | K386: REID | N386: McKENZIE | Q386: MALONEY
A387: GOALKICKERS
A388: PRAHRAN | C388: STACKPOLE 7 | F388: BURTON 4 | I388: ROACH 2 | K388: JONES 2 | M388: WHITE 2 | O388: DOWLING 2 | R388: GRACIE | U388: MURFITT | X388: OLSEN
A389: SANDRINGHAM | C389: BENCRAFT 4 | F389: McKENZIE 3 | I389: MIDDLETON 3 | L389: MATHESON | O389: J MILLER | Q389: HOLMES | S389: E MILLER
A391: COBURG | C391: 9 | D391: 5 | E391: =C391*6+D391 -> 59 | G391: 13 | H391: 9 | I391: =G391*6+H391 -> 87 | K391: 22 | L391: 14 | M391: =K391*6+L391 -> 146 | O391: 26 | P391: 17 | Q391: =O391*6+P391 -> 173 | S391: OAKLEIGH
A392: OAKLEIGH | C392: 0 | D392: 3 | E392: =C392*6+D392 -> 3 | G392: 0 | H392: 7 | I392: =G392*6+H392 -> 7 | K392: 0 | L392: 7 | M392: =K392*6+L392 -> 7 | O392: 3 | P392: 11 | Q392: =O392*6+P392 -> 29 | S392: BARNES
A393: BEST PLAYERS
A394: COBURG | C394: HORE | F394: TITUS | I394: FYFFE | K394: R ATKINSON | N394: MILTE | Q394: KENNEDY
A395: OAKLEIGH | C395: WORRALL | F395: C JANE | I395: D RYAN | K395: NAISMITH | N395: RICHARDSON | Q395: BEARD
A396: GOALKICKERS
A397: COBURG | C397: TITUS 16 | F397: FYFFE 3 | I397: ROWE 2 | K397: MILTE | M397: PERRIN | O397: CONDON | Q397: CRAWFORD | T397: GOETZE
A398: OAKLEIGH | C398: HORNE | F398: GILBERT | I398: D RYAN
A400: ROUND 8 | D400: 2ND JUNE | J400: WEATHER | M400: FINE | S400: PLAYED AT
D401: 1ST QTR | H401: 2ND QTR | L401: 3RD QTR | P401: FINAL | S401: WILLIAMSTOWN
A402: WILLIAMSTOWN | C402: 6 | D402: 4 | E402: =C402*6+D402 -> 40 | G402: 12 | H402: 8 | I402: =G402*6+H402 -> 80 | K402: 16 | L402: 13 | M402: =K402*6+L402 -> 109 | O402: 19 | P402: 17 | Q402: =O402*6+P402 -> 131 | S402: UMPIRE | X402: LADDER | AB402: ROUND | AD402: 8
A403: NORTHCOTE | C403: 2 | D403: 2 | E403: =C403*6+D403 -> 14 | G403: 4 | H403: 4 | I403: =G403*6+H403 -> 28 | K403: 6 | L403: 6 | M403: =K403*6+L403 -> 42 | O403: 11 | P403: 11 | Q403: =O403*6+P403 -> 77 | S403: SCANLON
A404: BEST PLAYERS | W404: TEAM | X404: W | Y404: L | Z404: D | AA404: FOR | AB404: AGST | AC404: % | AD404: PTS
A405: WILLIAMSTOWN | C405: WILCOX | F405: TODD | I405: COCKBURN | L405: SCOTT | N405: TORNEY | Q405: CHISHOLM
A406: NORTHCOTE | C406: KINDER | F406: McINTOSH | I406: ELLIS | L406: CARNEY | N406: DOWER | Q406: STABB | W406: COBURG | X406: 8 | Y406: 0 | Z406: 0 | AA406: 1038 | AB406: 534 | AC406: =(AA406/AB406)*100 -> 194.38202247191012 | AD406: 32
A407: GOALKICKERS | W407: WILLIAMSTOWN | X407: 7 | Y407: 1 | Z407: 0 | AA407: 1080 | AB407: 665 | AC407: =(AA407/AB407)*100 -> 162.40601503759399 | AD407: 28
A408: WILLIAMSTOWN | C408: TODD 11 | F408: GLASS 2 | H408: HEARN 2 | J408: FOX | L408: HARLEY | N408: SCARFFE | Q408: COCKBURN | W408: PORT MELBOURNE | X408: 6 | Y408: 2 | Z408: 0 | AA408: 1044 | AB408: 691 | AC408: =(AA408/AB408)*100 -> 151.08538350217077 | AD408: 24
A409: NORTHCOTE | C409: CARNEY 3 | F409: DUDLEY 2 | I409: JORGENSON | K409: DALLEY | M409: BAGULEY | O409: JONES | Q409: McINTOSH | T409: ZBLESKI | W409: PRESTON | X409: 5 | Y409: 3 | Z409: 0 | AA409: 761 | AB409: 720 | AC409: =(AA409/AB409)*100 -> 105.69444444444444 | AD409: 20
A411: PRESTON | C411: 2 | D411: 0 | E411: =C411*6+D411 -> 12 | G411: 7 | H411: 0 | I411: =G411*6+H411 -> 42 | K411: 11 | L411: 3 | M411: =K411*6+L411 -> 69 | O411: 12 | P411: 4 | Q411: =O411*6+P411 -> 76 | S411: PRESTON | W411: BRUNSWICK | X411: 4 | Y411: 4 | Z411: 0 | AA411: 757 | AB411: 581 | AC411: =(AA411/AB411)*100 -> 130.29259896729778 | AD411: 16
A412: CAMBERWELL | C412: 1 | D412: 6 | E412: =C412*6+D412 -> 12 | G412: 4 | H412: 11 | I412: =G412*6+H412 -> 35 | K412: 6 | L412: 14 | M412: =K412*6+L412 -> 50 | O412: 8 | P412: 21 | Q412: =O412*6+P412 -> 69 | S412: McALPINE | W412: PRAHRAN | X412: 4 | Y412: 4 | Z412: 0 | AA412: 828 | AB412: 762 | AC412: =(AA412/AB412)*100 -> 108.66141732283465 | AD412: 16
A413: BEST PLAYERS | W413: NORTHCOTE | X413: 4 | Y413: 4 | Z413: 0 | AA413: 671 | AB413: 797 | AC413: =(AA413/AB413)*100 -> 84.190715181932234 | AD413: 16
A414: PRESTON | C414: MASLEN | F414: BRADLEY | I414: CONNELLY | L414: BOYD | N414: EXELBY | Q414: WILLOUGHBY | W414: BRIGHTON | X414: 4 | Y414: 4 | Z414: 0 | AA414: 625 | AB414: 852 | AC414: =(AA414/AB414)*100 -> 73.356807511737088 | AD414: 16
A415: CAMBERWELL | C415: AUSTEN | F415: BRADFORD | I415: COLLIER | L415: TAYLOR | N415: WINWARD | Q415: ROWE | W415: CAMBERWELL | X415: 3 | Y415: 5 | Z415: 0 | AA415: 727 | AB415: 715 | AC415: =(AA415/AB415)*100 -> 101.67832167832167 | AD415: 12
A416: GOALKICKERS | W416: YARRAVILLE | X416: 3 | Y416: 5 | Z416: 0 | AA416: 771 | AB416: 836 | AC416: =(AA416/AB416)*100 -> 92.224880382775126 | AD416: 12
A417: PRESTON | C417: MINNEY 4 | F417: CONNELLY 3 | I417: BOYD 2 | K417: EXELBY 2 | M417: McCARTHY | W417: SANDRINGHAM | X417: 0 | Y417: 8 | Z417: 0 | AA417: 585 | AB417: 1084 | AC417: =(AA417/AB417)*100 -> 53.966789667896677 | AD417: 0
A418: CAMBERWELL | C418: ROWE 2 | F418: JORGENSON 2 | I418: J McDONALD | L418: BROCKENSHIRE | O418: BRADFORD | R418: OLIVER | W418: OAKLEIGH | X418: 0 | Y418: 8 | Z418: 0 | AA418: 428 | AB418: 1066 | AC418: =(AA418/AB418)*100 -> 40.150093808630395 | AD418: 0
A420: COBURG | C420: 5 | D420: 3 | E420: =C420*6+D420 -> 33 | G420: 9 | H420: 5 | I420: =G420*6+H420 -> 59 | K420: 14 | L420: 13 | M420: =K420*6+L420 -> 97 | O420: 18 | P420: 15 | Q420: =O420*6+P420 -> 123 | S420: YARRAVILLE
A421: YARRAVILLE | C421: 5 | D421: 4 | E421: =C421*6+D421 -> 34 | G421: 9 | H421: 8 | I421: =G421*6+H421 -> 62 | K421: 11 | L421: 12 | M421: =K421*6+L421 -> 78 | O421: 16 | P421: 13 | Q421: =O421*6+P421 -> 109 | S421: PARRIS
A422: BEST PLAYERS
A423: COBURG | C423: DAY | F423: MILTE | I423: CONDON | L423: FYFFE | O423: ROWE | R423: HORE
A424: YARRAVILLE | C424: SORRAGHAN | F424: BELL | I424: CASELY | L424: H RUDDELL | O424: HOWDEN | R424: WOODS
A425: GOALKICKERS
A426: COBURG | C426: ROWE 5 | F426: PERRIN 4 | I426: TITUS 3 | K426: FYFFE 2 | M426: CONDON 2 | P426: MILTE | R426: HORE
A427: YARRAVILLE | C427: GARLICK 5 | F427: CAHILL 3 | I427: H RUDDELL 2 | L427: ELLIS 2 | N427: PERUSSICH 2 | Q427: SORRAGHAN | T427: CASELY
A429: BRIGHTON | C429: 3 | D429: 6 | E429: =C429*6+D429 -> 24 | G429: 6 | H429: 14 | I429: =G429*6+H429 -> 50 | K429: 12 | L429: 15 | M429: =K429*6+L429 -> 87 | O429: 16 | P429: 18 | Q429: =O429*6+P429 -> 114 | S429: ELSTERNWICK PARK
A430: PRAHRAN | C430: 3 | D430: 6 | E430: =C430*6+D430 -> 24 | G430: 5 | H430: 6 | I430: =G430*6+H430 -> 36 | K430: 8 | L430: 13 | M430: =K430*6+L430 -> 61 | O430: 14 | P430: 16 | Q430: =O430*6+P430 -> 100 | S430: BARNES
A431: BEST PLAYERS
A432: BRIGHTON | C432: DOREY | F432: WHITE | I432: ALVIN | L432: KENNETT | O432: HALCOMBE | R432: ORGER
A433: PRAHRAN | C433: WASTELL | F433: BENNISON | I433: CAMM | L433: BURTON | O433: GARDINER | R433: ROACH
A434: GOALKICKERS
A435: BRIGHTON | C435: ALVIN 6 | F435: CHESTER 4 | I435: KING 2 | K435: KENNETT | N435: SPARGO | P435: ARKINSTAL | S435: BROWN
A436: PRAHRAN | C436: BURTON 5 | F436: ROLFE 2 | I436: STACKPOLE 2 | L436: DRIVER | N436: DOWLING | P436: WHITE | R436: GARDINER | U436: ROACH
A438: BRUNSWICK | C438: 7 | D438: 3 | E438: =C438*6+D438 -> 45 | G438: 12 | H438: 10 | I438: =G438*6+H438 -> 82 | K438: 19 | L438: 20 | M438: =K438*6+L438 -> 134 | O438: 24 | P438: 32 | Q438: =O438*6+P438 -> 176 | S438: BRUNSWICK
A439: OAKLEIGH | C439: 1 | D439: 2 | E439: =C439*6+D439 -> 8 | G439: 1 | H439: 6 | I439: =G439*6+H439 -> 12 | K439: 2 | L439: 7 | M439: =K439*6+L439 -> 19 | O439: 2 | P439: 9 | Q439: =O439*6+P439 -> 21 | S439: GREGORY
A440: BEST PLAYERS
A441: BRUNSWICK | C441: PLUMMER | F441: JACOBS | I441: MANN | K441: HUGHES | N441: JESSOP | Q441: JEFFREY
A442: OAKLEIGH | C442: BEARD | F442: DRYDEN | I442: MUDGE | K442: VEALE | N442: WORRALL | Q442: GILBERT
A443: GOALKICKERS
A444: BRUNSWICK | C444: JACOBS 8 | E444: HUGHES 4 | H444: MANN 3 | J444: COLLICOAT 3 | M444: BRYDEN | O444: JEFFREY | Q444: LEHMAN | T444: PLUMMER | W444: FARRELL | X444: SILK
A445: OAKLEIGH | C445: NAISMITH 2
A447: PORT MELBOURNE | C447: 9 | D447: 1 | E447: =C447*6+D447 -> 55 | G447: 19 | H447: 3 | I447: =G447*6+H447 -> 117 | K447: 26 | L447: 7 | M447: =K447*6+L447 -> 163 | O447: 30 | P447: 10 | Q447: =O447*6+P447 -> 190 | S447: BEACH ROAD
A448: SANDRINGHAM | C448: 2 | D448: 3 | E448: =C448*6+D448 -> 15 | G448: 4 | H448: 3 | I448: =G448*6+H448 -> 27 | K448: 9 | L448: 6 | M448: =K448*6+L448 -> 60 | O448: 11 | P448: 7 | Q448: =O448*6+P448 -> 73 | S448: MERRINGTON
A449: BEST PLAYERS
A450: PORT MELBOURNE | C450: CULPH | F450: FREYER | I450: McBETH | K450: HOUSTEN | N450: FLETCHER | Q450: SEARLE
A451: SANDRINGHAM | C451: BENNETT | F451: J MILLER | I451: MOLONEY | K451: DE VERGER | N451: McKENZIE | Q451: BENCRAFT
A452: GOALKICKERS
A453: PORT MELBOURNE | C453: CULPH 11 | F453: FREYER 9 | I453: IRVING 3 | K453: MALLETT 3 | N453: LEWIS 2 | P453: HOUSTEN | R453: LAHIFF
A454: SANDRINGHAM | C454: McKENZIE 3 | F454: O'TOOLE 2 | I454: DE VERGER 2 | L454: BENNETT 2 | O454: MOLONEY | Q454: REID
A456: ROUND 9 | D456: 9TH JUNE | J456: WEATHER | M456: COLD WET SOUTH WIND | S456: PLAYED AT
D457: 1ST QTR | H457: 2ND QTR | L457: 3RD QTR | P457: FINAL | S457: COBURG
A458: COBURG | C458: 3 | D458: 5 | E458: =C458*6+D458 -> 23 | G458: 12 | H458: 9 | I458: =G458*6+H458 -> 81 | K458: 15 | L458: 11 | M458: =K458*6+L458 -> 101 | O458: 18 | P458: 16 | Q458: =O458*6+P458 -> 124 | S458: UMPIRE | X458: LADDER | AB458: ROUND | AD458: 9
A459: WILLIAMSTOWN | C459: 5 | D459: 1 | E459: =C459*6+D459 -> 31 | G459: 7 | H459: 2 | I459: =G459*6+H459 -> 44 | K459: 12 | L459: 3 | M459: =K459*6+L459 -> 75 | O459: 15 | P459: 7 | Q459: =O459*6+P459 -> 97 | S459: MERRINGTON
A460: BEST PLAYERS | W460: TEAM | X460: W | Y460: L | Z460: D | AA460: FOR | AB460: AGST | AC460: % | AD460: PTS
A461: COBURG | C461: R ATKINSON | F461: TITUS | I461: PERRIN | L461: MILTE | N461: ROWE | Q461: CONDON
A462: WILLIAMSTOWN | C462: FITCH | F462: TODD | I462: MATTHEWS | L462: CHISHOLM | N462: HEARN | Q462: K JOHNSON | W462: COBURG | X462: 9 | Y462: 0 | Z462: 0 | AA462: 1162 | AB462: 631 | AC462: =(AA462/AB462)*100 -> 184.15213946117274 | AD462: 36
A463: GOALKICKERS | W463: PORT MELBOURNE | X463: 7 | Y463: 2 | Z463: 0 | AA463: 1158 | AB463: 722 | AC463: =(AA463/AB463)*100 -> 160.38781163434902 | AD463: 28
A464: COBURG | C464: TITUS 8 | F464: PERRIN 3 | I464: ROWE 2 | K464: BOYLE 2 | M464: CONDON | P464: KENNEDY | R464: HORE | W464: WILLIAMSTOWN | X464: 7 | Y464: 2 | Z464: 0 | AA464: 1177 | AB464: 789 | AC464: =(AA464/AB464)*100 -> 149.17617237008872 | AD464: 28
A465: WILLIAMSTOWN | C465: TODD 10 | F465: MATTHEWS | I465: SCARFFE | K465: TORNEY | M465: ALLWOOD | P465: FITCH | W465: PRAHRAN | X465: 5 | Y465: 4 | Z465: 0 | AA465: 918 | AB465: 845 | AC465: =(AA465/AB465)*100 -> 108.63905325443788 | AD465: 20
A467: PORT MELBOURNE | C467: 2 | D467: 2 | E467: =C467*6+D467 -> 14 | G467: 9 | H467: 9 | I467: =G467*6+H467 -> 63 | K467: 13 | L467: 15 | M467: =K467*6+L467 -> 93 | O467: 16 | P467: 18 | Q467: =O467*6+P467 -> 114 | S467: OLYMPIC PARK No. 2 | W467: NORTHCOTE | X467: 5 | Y467: 4 | Z467: 0 | AA467: 813 | AB467: 847 | AC467: =(AA467/AB467)*100 -> 95.985832349468708 | AD467: 20
A468: PRESTON | C468: 1 | D468: 4 | E468: =C468*6+D468 -> 10 | G468: 3 | H468: 4 | I468: =G468*6+H468 -> 22 | K468: 4 | L468: 5 | M468: =K468*6+L468 -> 29 | O468: 4 | P468: 7 | Q468: =O468*6+P468 -> 31 | S468: THOMAS | W468: PRESTON | X468: 5 | Y468: 4 | Z468: 0 | AA468: 792 | AB468: 834 | AC468: =(AA468/AB468)*100 -> 94.964028776978409 | AD468: 20
A469: BEST PLAYERS | W469: BRIGHTON | X469: 5 | Y469: 4 | Z469: 0 | AA469: 711 | AB469: 923 | AC469: =(AA469/AB469)*100 -> 77.031419284940412 | AD469: 20
A470: PORT MELBOURNE | C470: McBETH | F470: HOUSTEN | I470: FREYER | L470: REYNOLDS | N470: SEARLE | Q470: LAHIFF | W470: BRUNSWICK | X470: 4 | Y470: 5 | Z470: 0 | AA470: 828 | AB470: 667 | AC470: =(AA470/AB470)*100 -> 124.13793103448276 | AD470: 16
A471: PRESTON | C471: ANDERSON | F471: COOPER | I471: MASLEN | L471: STERLING | N471: EXELBY | Q471: BRADLEY | W471: CAMBERWELL | X471: 3 | Y471: 6 | Z471: 0 | AA471: 810 | AB471: 805 | AC471: =(AA471/AB471)*100 -> 100.62111801242236 | AD471: 12
A472: GOALKICKERS | W472: YARRAVILLE | X472: 3 | Y472: 6 | Z472: 0 | AA472: 863 | AB472: 940 | AC472: =(AA472/AB472)*100 -> 91.808510638297875 | AD472: 12
A473: PORT MELBOURNE | C473: FREYER 6 | F473: MALLETT 3 | I473: LEWIS 2 | K473: HOUSTEN 2 | N473: EARLE | P473: McBETH | R473: LAHIFF | W473: OAKLEIGH | X473: 1 | Y473: 8 | Z473: 0 | AA473: 532 | AB473: 1158 | AC473: =(AA473/AB473)*100 -> 45.941278065630399 | AD473: 4
A474: PRESTON | C474: CONNELLY 2 | F474: WILLOUGHBY | I474: BROOKS | W474: SANDRINGHAM | X474: 0 | Y474: 9 | Z474: 0 | AA474: 635 | AB474: 1226 | AC474: =(AA474/AB474)*100 -> 51.79445350734094 | AD474: 0
A476: BRIGHTON | C476: 3 | D476: 2 | E476: =C476*6+D476 -> 20 | G476: 7 | H476: 3 | I476: =G476*6+H476 -> 45 | K476: 9 | L476: 10 | M476: =K476*6+L476 -> 64 | O476: 12 | P476: 14 | Q476: =O476*6+P476 -> 86 | S476: ELSTERNWICK PARK
A477: BRUNSWICK | C477: 4 | D477: 4 | E477: =C477*6+D477 -> 28 | G477: 7 | H477: 6 | I477: =G477*6+H477 -> 48 | K477: 9 | L477: 12 | M477: =K477*6+L477 -> 66 | O477: 9 | P477: 17 | Q477: =O477*6+P477 -> 71 | S477: MOORE
A478: BEST PLAYERS
A479: BRIGHTON | C479: DOREY | F479: WILLIAMSON | J479: LUCAS | M479: MOFFATT | P479: PAGE | S479: ORGER
A480: BRUNSWICK | C480: FARRELL | F480: SILK | J480: BAKER | M480: COLLICOAT | P480: LEHMAN | S480: PLUMMER
A481: GOALKICKERS
A482: BRIGHTON | C482: PAGE 4 | F482: ABRAHAMS 2 | I482: ARKINSTAL 2 | L482: ALVIN 2 | N482: KENNETT | Q482: BROWN
A483: BRUNSWICK | C483: MANN 3 | F483: JEFFREYS 2 | I483: JACOBS 2 | L483: GLASCOTT | N483: HOGAN
A485: PRAHRAN | C485: 3 | D485: 2 | E485: =C485*6+D485 -> 20 | G485: 7 | H485: 8 | I485: =G485*6+H485 -> 50 | K485: 10 | L485: 15 | M485: =K485*6+L485 -> 75 | O485: 12 | P485: 18 | Q485: =O485*6+P485 -> 90 | S485: TOORAK PARK
A486: CAMBERWELL | C486: 5 | D486: 6 | E486: =C486*6+D486 -> 36 | G486: 7 | H486: 10 | I486: =G486*6+H486 -> 52 | K486: 10 | L486: 12 | M486: =K486*6+L486 -> 72 | O486: 11 | P486: 17 | Q486: =O486*6+P486 -> 83 | S486: PARRIS
A487: BEST PLAYERS
A488: PRAHRAN | C488: NORRIS | F488: WHITE | I488: BURKE | L488: CAMM | O488: McMAHON | R488: STACKPOLE
A489: CAMBERWELL | C489: AUSTEN | F489: McPHERSON | I489: J McDONALD | L489: WINWARD | O489: COLLIER | R489: SEELENMEYER
A490: GOALKICKERS
A491: PRAHRAN | C491: STACKPOLE 4 | F491: WHITE 3 | I491: McMAHON 2 | L491: CONROY | N491: ROLFE | P491: GRACIE
A492: CAMBERWELL | C492: OLIVER 4 | F492: QUILL | H492: SHEAN | J492: BRADFORD | M492: HARRISON | O492: J McDONALD | R492: McPHERSON | V492: JORGENSON
A494: OAKLEIGH | C494: 5 | D494: 3 | E494: =C494*6+D494 -> 33 | G494: 7 | H494: 9 | I494: =G494*6+H494 -> 51 | K494: 14 | L494: 13 | M494: =K494*6+L494 -> 97 | O494: 15 | P494: 14 | Q494: =O494*6+P494 -> 104 | S494: OAKLEIGH
A495: YARRAVILLE | C495: 3 | D495: 4 | E495: =C495*6+D495 -> 22 | G495: 7 | H495: 4 | I495: =G495*6+H495 -> 46 | K495: 10 | L495: 6 | M495: =K495*6+L495 -> 66 | O495: 14 | P495: 8 | Q495: =O495*6+P495 -> 92 | S495: MURRAY
A496: BEST PLAYERS
A497: OAKLEIGH | C497: NAISMITH | F497: FINN | I497: BEARD | K497: HORNE | N497: RICHARDSON | Q497: MUDGE
A498: YARRAVILLE | C498: CAHILL | F498: SORRAGHAN | I498: ELLIS | K498: H RUDDELL | N498: HOWDEN | Q498: BELL
A499: GOALKICKERS
A500: OAKLEIGH | C500: NAISMITH 6 | F500: FINN 3 | H500: HORNE 3 | J500: RICHARDSON | M500: C JANE | O500: ARMSTRONG
A501: YARRAVILLE | C501: CAHILL 7 | F501: SORRAGHAN 5 | J501: BELL | L501: PERUSSICH
A503: NORTHCOTE | C503: 4 | D503: 8 | E503: =C503*6+D503 -> 32 | G503: 8 | H503: 12 | I503: =G503*6+H503 -> 60 | K503: 12 | L503: 17 | M503: =K503*6+L503 -> 89 | O503: 20 | P503: 22 | Q503: =O503*6+P503 -> 142 | S503: NORTHCOTE
A504: SANDRINGHAM | C504: 1 | D504: 4 | E504: =C504*6+D504 -> 10 | G504: 2 | H504: 4 | I504: =G504*6+H504 -> 16 | K504: 6 | L504: 7 | M504: =K504*6+L504 -> 43 | O504: 7 | P504: 8 | Q504: =O504*6+P504 -> 50 | S504: BARNES
A505: BEST PLAYERS
A506: NORTHCOTE | C506: JONES | F506: McINTOSH | I506: WEGNER | L506: STABB | O506: POLGLASE | R506: CARNEY
A507: SANDRINGHAM | C507: BENNETT | F507: BENCRAFT | I507: DE VERGER | L507: MATHESON | O507: MOLONEY | R507: REID
A508: GOALKICKERS
A509: NORTHCOTE | C509: JONES 13 | F509: CARNEY 2 | I509: ZBLESKI 2 | L509: DUDLEY | N509: POLGLASE | Q509: DRYDEN
A510: SANDRINGHAM | C510: BENCRAFT 3 | F510: McKENZIE | I510: HOLMES | K510: MOLONEY | M510: O'TOOLE
A512: ROUND 10 | D512: 16TH JUNE | J512: WEATHER | M512: MILD CLOUDY | S512: PLAYED AT
D513: 1ST QTR | H513: 2ND QTR | L513: 3RD QTR | P513: FINAL | S513: TOORAK PARK
A514: NORTHCOTE | C514: 3 | D514: 6 | E514: =C514*6+D514 -> 24 | G514: 7 | H514: 11 | I514: =G514*6+H514 -> 53 | K514: 10 | L514: 14 | M514: =K514*6+L514 -> 74 | O514: 14 | P514: 18 | Q514: =O514*6+P514 -> 102 | S514: UMPIRE | X514: LADDER | AB514: ROUND | AD514: 10
A515: PRAHRAN | C515: 3 | D515: 4 | E515: =C515*6+D515 -> 22 | G515: 6 | H515: 5 | I515: =G515*6+H515 -> 41 | K515: 9 | L515: 7 | M515: =K515*6+L515 -> 61 | O515: 14 | P515: 12 | Q515: =O515*6+P515 -> 96 | S515: SCANLON
A516: BEST PLAYERS | W516: TEAM | X516: W | Y516: L | Z516: D | AA516: FOR | AB516: AGST | AC516: % | AD516: PTS
A517: NORTHCOTE | C517: McINTOSH | F517: KINDER | I517: CLARKE | L517: DRYDEN | N517: OLVER | Q517: ELLIS
A518: PRAHRAN | C518: ROLFE | F518: BURTON | I518: BENNISON | L518: CAMM | N518: WHITE | Q518: LAMBORN | W518: COBURG | X518: 10 | Y518: 0 | Z518: 0 | AA518: 1358 | AB518: 695 | AC518: =(AA518/AB518)*100 -> 195.39568345323741 | AD518: 40
A519: GOALKICKERS | W519: WILLIAMSTOWN | X519: 8 | Y519: 2 | Z519: 0 | AA519: 1335 | AB519: 857 | AC519: =(AA519/AB519)*100 -> 155.77596266044341 | AD519: 32
A520: NORTHCOTE | C520: JONES 6 | E520: CARNEY 4 | H520: CLARKE 2 | J520: POLGLASE | M520: KINDER | W520: PORT MELBOURNE | X520: 7 | Y520: 3 | Z520: 0 | AA520: 1268 | AB520: 845 | AC520: =(AA520/AB520)*100 -> 150.05917159763314 | AD520: 28
A521: PRAHRAN | C521: BURTON 4 | F521: STACKPOLE 4 | I521: ROLFE 3 | K521: GARDINER | M521: WHITE | O521: McMAHON | W521: PRESTON | X521: 6 | Y521: 4 | Z521: 0 | AA521: 938 | AB521: 878 | AC521: =(AA521/AB521)*100 -> 106.83371298405466 | AD521: 24
A523: COBURG | C523: 3 | D523: 8 | E523: =C523*6+D523 -> 26 | G523: 7 | H523: 15 | I523: =G523*6+H523 -> 57 | K523: 18 | L523: 18 | M523: =K523*6+L523 -> 126 | O523: 29 | P523: 22 | Q523: =O523*6+P523 -> 196 | S523: COBURG | W523: NORTHCOTE | X523: 6 | Y523: 4 | Z523: 0 | AA523: 915 | AB523: 943 | AC523: =(AA523/AB523)*100 -> 97.030752916224813 | AD523: 24
A524: BRIGHTON | C524: 2 | D524: 1 | E524: =C524*6+D524 -> 13 | G524: 6 | H524: 3 | I524: =G524*6+H524 -> 39 | K524: 8 | L524: 3 | M524: =K524*6+L524 -> 51 | O524: 10 | P524: 4 | Q524: =O524*6+P524 -> 64 | S524: PARRIS | W524: BRUNSWICK | X524: 5 | Y524: 5 | Z524: 0 | AA524: 929 | AB524: 763 | AC524: =(AA524/AB524)*100 -> 121.75622542595019 | AD524: 20
A525: BEST PLAYERS | W525: PRAHRAN | X525: 5 | Y525: 5 | Z525: 0 | AA525: 1014 | AB525: 947 | AC525: =(AA525/AB525)*100 -> 107.07497360084477 | AD525: 20
A526: COBURG | C526: HORE | F526: MILTE | I526: FYFFE | L526: ROWE | O526: TITUS | Q526: PROMNITZ | W526: BRIGHTON | X526: 5 | Y526: 5 | Z526: 0 | AA526: 775 | AB526: 1119 | AC526: =(AA526/AB526)*100 -> 69.258266309204657 | AD526: 20
A527: BRIGHTON | C527: HALCOMBE | F527: BAILEY | I527: ALVIN | L527: WILLIAMSON | O527: DOREY | Q527: CHESTER | W527: CAMBERWELL | X527: 4 | Y527: 6 | Z527: 0 | AA527: 933 | AB527: 915 | AC527: =(AA527/AB527)*100 -> 101.9672131147541 | AD527: 16
A528: GOALKICKERS | W528: YARRAVILLE | X528: 3 | Y528: 7 | Z528: 0 | AA528: 959 | AB528: 1041 | AC528: =(AA528/AB528)*100 -> 92.122958693563888 | AD528: 12
A529: COBURG | C529: TITUS 14 | F529: FYFFE 7 | H529: ROWE 4 | J529: PERRIN | L529: CONDON | N529: LONSDALE | Q529: HORE | W529: OAKLEIGH | X529: 1 | Y529: 9 | Z529: 0 | AA529: 576 | AB529: 1304 | AC529: =(AA529/AB529)*100 -> 44.171779141104295 | AD529: 4
A530: BRIGHTON | C530: ALVIN 3 | F530: ELLIS 2 | H530: CHESTER 2 | K530: ABRAHAM | M530: DOREY | O530: LUCAS | W530: SANDRINGHAM | X530: 0 | Y530: 10 | Z530: 0 | AA530: 703 | AB530: 1384 | AC530: =(AA530/AB530)*100 -> 50.794797687861269 | AD530: 0
A532: BRUNSWICK | C532: 4 | D532: 7 | E532: =C532*6+D532 -> 31 | G532: 6 | H532: 11 | I532: =G532*6+H532 -> 47 | K532: 13 | L532: 15 | M532: =K532*6+L532 -> 93 | O532: 14 | P532: 17 | Q532: =O532*6+P532 -> 101 | S532: BRUNSWICK
A533: YARRAVILLE | C533: 1 | D533: 2 | E533: =C533*6+D533 -> 8 | G533: 6 | H533: 6 | I533: =G533*6+H533 -> 42 | K533: 8 | L533: 10 | M533: =K533*6+L533 -> 58 | O533: 14 | P533: 12 | Q533: =O533*6+P533 -> 96 | S533: GREGORY
A534: BEST PLAYERS
A535: BRUNSWICK | C535: PLUMMER | F535: SILK | I535: BLACKMORE | L535: COLLICOAT | O535: MANN | R535: BRYDEN
A536: YARRAVILLE | C536: BELL | F536: MARKS | I536: KNIGHT | L536: H RUDDELL | O536: SORRAGHAN | R536: HOWDEN
A537: GOALKICKERS
A538: BRUNSWICK | C538: BLACKMORE 5 | F538: BRYDEN 3 | I538: MANN 3 | L538: COLLICOAT 2 | O538: GREGG
A539: YARRAVILLE | C539: SORRAGHAN 3 | F539: HOWDEN 3 | I539: H RUDDELL 3 | L539: CAHILL 2 | O539: KNIGHT 2 | Q539: CASELY
A541: PRESTON | C541: 2 | D541: 3 | E541: =C541*6+D541 -> 15 | G541: 9 | H541: 8 | I541: =G541*6+H541 -> 62 | K541: 15 | L541: 9 | M541: =K541*6+L541 -> 99 | O541: 22 | P541: 14 | Q541: =O541*6+P541 -> 146 | S541: PRESTON
A542: OAKLEIGH | C542: 2 | D542: 2 | E542: =C542*6+D542 -> 14 | G542: 2 | H542: 5 | I542: =G542*6+H542 -> 17 | K542: 3 | L542: 7 | M542: =K542*6+L542 -> 25 | O542: 6 | P542: 8 | Q542: =O542*6+P542 -> 44 | S542: THOMAS
A543: BEST PLAYERS
A544: PRESTON | C544: ANDERSON | F544: CONNELLY | I544: MASLEN | K544: EXELBY | N544: BOYD | Q544: BRADLEY
A545: OAKLEIGH | C545: BEARD | F545: MUDGE | I545: VEALE | K545: HORNE | N545: NAISMITH | Q545: WORRALL
A546: GOALKICKERS
A547: PRESTON | C547: CONNELLY 6 | F547: ANDERSON 5 | I547: DUGGAN 5 | L547: BOYD 3 | N547: HENRY 2 | P547: EXELBY
A548: OAKLEIGH | C548: ARMSTRONG 3 | F548: HORNE 2 | I548: C JANE
A550: WILLIAMSTOWN | C550: 3 | D550: 10 | E550: =C550*6+D550 -> 28 | G550: 10 | H550: 14 | I550: =G550*6+H550 -> 74 | K550: 17 | L550: 18 | M550: =K550*6+L550 -> 120 | O550: 23 | P550: 20 | Q550: =O550*6+P550 -> 158 | S550: BEACH ROAD
A551: SANDRINGHAM | C551: 2 | D551: 1 | E551: =C551*6+D551 -> 13 | G551: 5 | H551: 3 | I551: =G551*6+H551 -> 33 | K551: 7 | L551: 4 | M551: =K551*6+L551 -> 46 | O551: 10 | P551: 8 | Q551: =O551*6+P551 -> 68 | S551: WALLMEYER
A552: BEST PLAYERS
A553: WILLIAMSTOWN | C553: SCARFFE | F553: MATTHEWS | I553: WILCOX | L553: HARLEY | O553: HEARN | R553: GLASS
A554: SANDRINGHAM | C554: BENCRAFT | F554: BENNETT | I554: J MILLER | L554: MIDDLETON | O554: MATHESON | R554: REID
A555: GOALKICKERS
A556: WILLIAMSTOWN | C556: TODD 11 | F556: GLASS 4 | I556: MATTHEWS 3 | M556: SCARFFE 3 | P556: HARLEY 2
A557: SANDRINGHAM | C557: REID 2 | E557: MATHESON 2 | H557: MIDDLETON 2 | K557: MOLONEY | M557: POLE | O557: DAVIN | Q557: McKENZIE
D558: 18TH JUNE | J558: WEATHER | M558: FINE BUT CLOUDY NORTH WIND
A559: CAMBERWELL | C559: 8 | D559: 5 | E559: =C559*6+D559 -> 53 | G559: 13 | H559: 8 | I559: =G559*6+H559 -> 86 | K559: 15 | L559: 10 | M559: =K559*6+L559 -> 100 | O559: 18 | P559: 15 | Q559: =O559*6+P559 -> 123 | S559: CAMBERWELL
A560: PORT MELBOURNE | C560: 1 | D560: 3 | E560: =C560*6+D560 -> 9 | G560: 7 | H560: 5 | I560: =G560*6+H560 -> 47 | K560: 12 | L560: 11 | M560: =K560*6+L560 -> 83 | O560: 16 | P560: 14 | Q560: =O560*6+P560 -> 110 | S560: MERRINGTON
A561: BEST PLAYERS
A562: CAMBERWELL | C562: COLLIER | F562: BRADFORD | I562: FERGUSON | L562: BRYCE | O562: McDONALD | R562: OLIVER
A563: PORT MELBOURNE | C563: SEARLE | F563: HOUSTEN | I563: FLETCHER | L563: LEWIS | O563: FREYER | R563: LAHIFF
A564: GOALKICKERS
A565: CAMBERWELL | C565: GRIFFIN 4 | F565: BRADFORD 4 | I565: OLIVER 4 | K565: HARLAND 3 | N565: McPHERSON 2 | Q565: A McDONALD
A566: PORT MELBOURNE | C566: FREYER 7 | F566: LEWIS 6 | I566: MALLETT | K566: HOUSTEN | M566: IRVING
A568: ROUND 11 | D568: 23RD JUNE | J568: WEATHER | M568: WEST WIND SHOWERS | S568: PLAYED AT
D569: 1ST QTR | H569: 2ND QTR | L569: 3RD QTR | P569: FINAL | S569: NORTHCOTE
A570: COBURG | C570: 4 | D570: 0 | E570: =C570*6+D570 -> 24 | G570: 11 | H570: 7 | I570: =G570*6+H570 -> 73 | K570: 13 | L570: 8 | M570: =K570*6+L570 -> 86 | O570: 17 | P570: 14 | Q570: =O570*6+P570 -> 116 | S570: UMPIRE | X570: LADDER | AB570: ROUND | AD570: 11
A571: NORTHCOTE | C571: 5 | D571: 6 | E571: =C571*6+D571 -> 36 | G571: 6 | H571: 6 | I571: =G571*6+H571 -> 42 | K571: 10 | L571: 16 | M571: =K571*6+L571 -> 76 | O571: 10 | P571: 18 | Q571: =O571*6+P571 -> 78 | S571: GREGORY
A572: BEST PLAYERS | W572: TEAM | X572: W | Y572: L | Z572: D | AA572: FOR | AB572: AGST | AC572: % | AD572: PTS
A573: COBURG | C573: ROWE | E573: FYFFE | H573: PERRIN | K573: PROMNITZ | N573: MILTE | Q573: TAYLOR
A574: NORTHCOTE | C574: CARNEY | E574: McINTOSH | H574: STAFFORD | K574: DRYDEN | N574: P OLVER | Q574: MATHERSON | W574: COBURG | X574: 11 | Y574: 0 | Z574: 0 | AA574: 1474 | AB574: 773 | AC574: =(AA574/AB574)*100 -> 190.68564036222512 | AD574: 44
A575: GOALKICKERS | W575: WILLIAMSTOWN | X575: 9 | Y575: 2 | Z575: 0 | AA575: 1414 | AB575: 923 | AC575: =(AA575/AB575)*100 -> 153.19609967497291 | AD575: 36
A576: COBURG | C576: FYFFE 5 | E576: ROWE 3 | G576: TITUS 3 | I576: CONDON 2 | L576: LONSDALE | N576: PERRIN | P576: LEONARD | R576: MILTE | W576: PORT MELBOURNE | X576: 8 | Y576: 3 | Z576: 0 | AA576: 1363 | AB576: 921 | AC576: =(AA576/AB576)*100 -> 147.9913137893594 | AD576: 32
A577: NORTHCOTE | C577: CARNEY 4 | F577: POLGLASE 2 | I577: KINDER 2 | L577: McINTOSH | N577: JONES | W577: PRESTON | X577: 7 | Y577: 4 | Z577: 0 | AA577: 1041 | AB577: 973 | AC577: =(AA577/AB577)*100 -> 106.98869475847894 | AD577: 28
A579: PORT MELBOURNE | C579: 4 | D579: 1 | E579: =C579*6+D579 -> 25 | G579: 9 | H579: 7 | I579: =G579*6+H579 -> 61 | K579: 11 | L579: 10 | M579: =K579*6+L579 -> 76 | O579: 12 | P579: 23 | Q579: =O579*6+P579 -> 95 | S579: BRUNSWICK | W579: NORTHCOTE | X579: 6 | Y579: 5 | Z579: 0 | AA579: 993 | AB579: 1059 | AC579: =(AA579/AB579)*100 -> 93.767705382436262 | AD579: 24
A580: BRUNSWICK | C580: 4 | D580: 5 | E580: =C580*6+D580 -> 29 | G580: 7 | H580: 7 | I580: =G580*6+H580 -> 49 | K580: 10 | L580: 10 | M580: =K580*6+L580 -> 70 | O580: 11 | P580: 10 | Q580: =O580*6+P580 -> 76 | S580: THOMAS | W580: BRUNSWICK | X580: 5 | Y580: 6 | Z580: 0 | AA580: 1005 | AB580: 858 | AC580: =(AA580/AB580)*100 -> 117.13286713286712 | AD580: 20
A581: BEST PLAYERS | W581: PRAHRAN | X581: 5 | Y581: 6 | Z581: 0 | AA581: 1080 | AB581: 1026 | AC581: =(AA581/AB581)*100 -> 105.26315789473684 | AD581: 20
A582: PORT MELBOURNE | C582: TREMBATH | F582: LEWIS | I582: SEARLE | K582: DOBSON | N582: FLETCHER | Q582: MALLETT | W582: CAMBERWELL | X582: 5 | Y582: 6 | Z582: 0 | AA582: 1009 | AB582: 982 | AC582: =(AA582/AB582)*100 -> 102.74949083503056 | AD582: 20
A583: BRUNSWICK | C583: SILK | F583: JACOBS | I583: JESSOP | K583: MANN | N583: GEISLER | Q583: CRAWFORD | W583: BRIGHTON | X583: 5 | Y583: 6 | Z583: 0 | AA583: 842 | AB583: 1195 | AC583: =(AA583/AB583)*100 -> 70.460251046025107 | AD583: 20
A584: GOALKICKERS | W584: YARRAVILLE | X584: 3 | Y584: 8 | Z584: 0 | AA584: 1054 | AB584: 1144 | AC584: =(AA584/AB584)*100 -> 92.132867132867133 | AD584: 12
A585: PORT MELBOURNE | C585: FREYER 4 | E585: HOUSTEN 2 | H585: MALLETT 2 | K585: TREMBATH | N585: TAYLOR | P585: REYNOLDS | R585: CRAWSHAW | W585: SANDRINGHAM | X585: 1 | Y585: 10 | Z585: 0 | AA585: 775 | AB585: 1436 | AC585: =(AA585/AB585)*100 -> 53.969359331476319 | AD585: 4
A586: BRUNSWICK | C586: BLACKMORE 6 | F586: JACOBS 3 | I586: CRAWFORD 2 | L586: MANN 2 | W586: OAKLEIGH | X586: 1 | Y586: 10 | Z586: 0 | AA586: 628 | AB586: 1376 | AC586: =(AA586/AB586)*100 -> 45.639534883720927 | AD586: 4
A588: WILLIAMSTOWN | C588: 5 | D588: 15 | E588: =C588*6+D588 -> 45 | G588: 5 | H588: 16 | I588: =G588*6+H588 -> 46 | K588: 10 | L588: 19 | M588: =K588*6+L588 -> 79 | O588: 10 | P588: 19 | Q588: =O588*6+P588 -> 79 | S588: WILLIAMSTOWN
A589: PRAHRAN | C589: 0 | D589: 0 | E589: =C589*6+D589 -> 0 | G589: 5 | H589: 7 | I589: =G589*6+H589 -> 37 | K589: 5 | L589: 8 | M589: =K589*6+L589 -> 38 | O589: 9 | P589: 12 | Q589: =O589*6+P589 -> 66 | S589: WALLMEYER
A590: BEST PLAYERS
A591: WILLIAMSTOWN | C591: TODD | E591: SCARFFE | H591: MATTHEWS | K591: CHISHOLM | N591: HEARN | Q591: FEATHERBY
A592: PRAHRAN | C592: ROLFE | E592: MCMAHON | H592: STACKPOLE | K592: BURTON | N592: GARDINER | Q592: CAMM
A593: GOALKICKERS
A594: WILLIAMSTOWN | C594: TODD 7 | F594: MATTHEWS | I594: HARLEY | K594: HEARN
A595: PRAHRAN | C595: STACKPOLE 3 | F595: ROACH 2 | I595: BURTON | K595: DRIVER | M595: WHITE | O595: McMAHON
A597: CAMBERWELL | C597: 3 | D597: 4 | E597: =C597*6+D597 -> 22 | G597: 5 | H597: 8 | I597: =G597*6+H597 -> 38 | K597: 8 | L597: 14 | M597: =K597*6+L597 -> 62 | O597: 10 | P597: 16 | Q597: =O597*6+P597 -> 76 | S597: ELSTERNWICK PARK
A598: BRIGHTON | C598: 4 | D598: 2 | E598: =C598*6+D598 -> 26 | G598: 5 | H598: 6 | I598: =G598*6+H598 -> 36 | K598: 9 | L598: 6 | M598: =K598*6+L598 -> 60 | O598: 10 | P598: 7 | Q598: =O598*6+P598 -> 67 | S598: SCANLON
A599: BEST PLAYERS
A600: CAMBERWELL | C600: TAYLOR | F600: COLLIER | I600: BRADFORD | L600: AUSTEN | O600: GRIFFIN | R600: SHIELDS
A601: BRIGHTON | C601: HALCOMBE | F601: PLUNKETT | I601: LUCAS | L601: ARKINSTAL | O601: BROWN | R601: ORGER
A602: GOALKICKERS
A603: CAMBERWELL | C603: DINEEN 3 | F603: BOYALL | H603: GRIFFFIN | J603: HARLAND | M603: OLIVER | O603: TAYLOR | Q603: JENSON | S603: BRADFORD
A604: BRIGHTON | C604: CHESTER 3 | F604: BROWN 2 | I604: LUCAS 2 | K604: ALVIN | M604: ELLIS | O604: ABRAHAMS
A606: SANDRINGHAM | C606: 1 | D606: 0 | E606: =C606*6+D606 -> 6 | G606: 4 | H606: 5 | I606: =G606*6+H606 -> 29 | K606: 5 | L606: 7 | M606: =K606*6+L606 -> 37 | O606: 10 | P606: 12 | Q606: =O606*6+P606 -> 72 | S606: OAKLEIGH
A607: OAKLEIGH | C607: 4 | D607: 4 | E607: =C607*6+D607 -> 28 | G607: 5 | H607: 4 | I607: =G607*6+H607 -> 34 | K607: 6 | L607: 9 | M607: =K607*6+L607 -> 45 | O607: 7 | P607: 10 | Q607: =O607*6+P607 -> 52 | S607: MERRINGTON
A608: BEST PLAYERS
A609: SANDRINGHAM | C609: J MILLER | F609: HOLMES | I609: BENCRAFT | L609: BENNETT | O609: BECK | R609: MIDDLETON
A610: OAKLEIGH | C610: BEARD | F610: GILBERT | I610: WORRALL | L610: HORNE | O610: NAISMITH | R610: MUDGE
A611: GOALKICKERS
A612: SANDRINGHAM | C612: BENCRAFT 2 | F612: HOLMES 2 | I612: MIDDLETON 2 | L612: WEBER 2 | N612: MULLINS | P612: POLE
A613: OAKLEIGH | C613: HORNE 3 | F613: NAISMITH 2 | I613: C JANE | K613: ARMSTRONG
A615: PRESTON | C615: 3 | D615: 3 | E615: =C615*6+D615 -> 21 | G615: 4 | H615: 8 | I615: =G615*6+H615 -> 32 | K615: 12 | L615: 16 | M615: =K615*6+L615 -> 88 | O615: 14 | P615: 19 | Q615: =O615*6+P615 -> 103 | S615: YARRAVILLE
A616: YARRAVILLE | C616: 4 | D616: 1 | E616: =C616*6+D616 -> 25 | G616: 8 | H616: 6 | I616: =G616*6+H616 -> 54 | K616: 11 | L616: 8 | M616: =K616*6+L616 -> 74 | O616: 14 | P616: 11 | Q616: =O616*6+P616 -> 95 | S616: PARRIS
A617: BEST PLAYERS
A618: PRESTON | C618: CONNELLY | F618: BRADLEY | I618: EXELBY | L618: McCARTHY | O618: BOYD | Q618: ANDERSON
A619: YARRAVILLE | C619: WHITE | F619: SORRAGHAN | I619: LAW | L619: MARKS | O619: CAHILL | Q619: CASELY
A620: GOALKICKERS
A621: PRESTON | C621: BOYD 5 | F621: CONNELLY 4 | I621: ANDERSON 2 | L621: McCARTHY | O621: DUGGAN | Q621: HARRIS
A622: YARRAVILLE | C622: SORRAGHAN 4 | F622: H RUDDELL 2 | I622: CAHILL 2 | K622: PERUSSICH 2 | N622: LAW | P622: HOWDEN | R622: MAHER | U622: SMITH
A624: ROUND 12 | D624: 30TH JUNE | J624: WEATHER | M624: VERY COLD STRONG NORTH GALE | S624: PLAYED AT
D625: 1ST QTR | H625: 2ND QTR | L625: 3RD QTR | P625: FINAL | S625: NORTHCOTE
A626: PRESTON | C626: 4 | D626: 0 | E626: =C626*6+D626 -> 24 | G626: 7 | H626: 5 | I626: =G626*6+H626 -> 47 | K626: 8 | L626: 7 | M626: =K626*6+L626 -> 55 | O626: 12 | P626: 17 | Q626: =O626*6+P626 -> 89 | S626: UMPIRE | X626: LADDER | AB626: ROUND | AD626: 12
A627: NORTHCOTE | C627: 2 | D627: 2 | E627: =C627*6+D627 -> 14 | G627: 3 | H627: 3 | I627: =G627*6+H627 -> 21 | K627: 4 | L627: 7 | M627: =K627*6+L627 -> 31 | O627: 5 | P627: 11 | Q627: =O627*6+P627 -> 41 | S627: SCANLON
A628: BEST PLAYERS | W628: TEAM | X628: W | Y628: L | Z628: D | AA628: FOR | AB628: AGST | AC628: % | AD628: PTS
A629: PRESTON | C629: ANDERSON | F629: EXELBY | I629: MASLEN | K629: CONNELLY | N629: BOYD | Q629: HENRY
A630: NORTHCOTE | C630: McINTOSH | F630: KINDER | I630: P OLVER | K630: H OLVER | N630: MATHERSON | Q630: ELLIS | W630: COBURG | X630: 12 | Y630: 0 | Z630: 0 | AA630: 1569 | AB630: 859 | AC630: =(AA630/AB630)*100 -> 182.65424912689176 | AD630: 48
A631: GOALKICKERS | W631: WILLIAMSTOWN | X631: 10 | Y631: 2 | Z631: 0 | AA631: 1527 | AB631: 983 | AC631: =(AA631/AB631)*100 -> 155.34079348931843 | AD631: 40
A632: PRESTON | C632: ANDERSON 4 | F632: CONNELLY 3 | I632: SEEDSMAN 2 | L632: BOYD 2 | N632: EXELBY | W632: PORT MELBOURNE | X632: 9 | Y632: 3 | Z632: 0 | AA632: 1498 | AB632: 1034 | AC632: =(AA632/AB632)*100 -> 144.87427466150871 | AD632: 36
A633: NORTHCOTE | C633: H OLVER 3 | F633: POLGLASE 2 | W633: PRESTON | X633: 8 | Y633: 4 | Z633: 0 | AA633: 1131 | AB633: 1014 | AC633: =(AA633/AB633)*100 -> 111.53846153846155 | AD633: 32
A635: COBURG | C635: 3 | D635: 4 | E635: =C635*6+D635 -> 22 | G635: 6 | H635: 12 | I635: =G635*6+H635 -> 48 | K635: 8 | L635: 14 | M635: =K635*6+L635 -> 62 | O635: 13 | P635: 17 | Q635: =O635*6+P635 -> 95 | S635: COBURG | W635: CAMBERWELL | X635: 6 | Y635: 6 | Z635: 0 | AA635: 1103 | AB635: 1075 | AC635: =(AA635/AB635)*100 -> 102.60465116279069 | AD635: 24
A636: BRUNSWICK | C636: 6 | D636: 4 | E636: =C636*6+D636 -> 40 | G636: 7 | H636: 6 | I636: =G636*6+H636 -> 48 | K636: 12 | L636: 13 | M636: =K636*6+L636 -> 85 | O636: 12 | P636: 14 | Q636: =O636*6+P636 -> 86 | S636: THOMAS | W636: NORTHCOTE | X636: 6 | Y636: 6 | Z636: 0 | AA636: 1034 | AB636: 1148 | AC636: =(AA636/AB636)*100 -> 90.069686411149831 | AD636: 24
A637: BEST PLAYERS | W637: BRUNSWICK | X637: 5 | Y637: 7 | Z637: 0 | AA637: 1091 | AB637: 953 | AC637: =(AA637/AB637)*100 -> 114.48058761804828 | AD637: 20
A638: COBURG | C638: STARBUCK | F638: ROWE | I638: HORE | K638: CREWTHER | N638: FYFFE | Q638: PERRIN | W638: PRAHRAN | X638: 5 | Y638: 7 | Z638: 0 | AA638: 1193 | AB638: 1161 | AC638: =(AA638/AB638)*100 -> 102.75624461670974 | AD638: 20
A639: BRUNSWICK | C639: MANN | F639: PLUMMER | I639: SILK | K639: GLASSCOTT | N639: COLLICOAT | Q639: GEISLER | W639: BRIGHTON | X639: 5 | Y639: 7 | Z639: 0 | AA639: 934 | AB639: 1297 | AC639: =(AA639/AB639)*100 -> 72.012336160370083 | AD639: 20
A640: GOALKICKERS | W640: YARRAVILLE | X640: 3 | Y640: 9 | Z640: 0 | AA640: 1114 | AB640: 1257 | AC640: =(AA640/AB640)*100 -> 88.623707239459023 | AD640: 12
A641: COBURG | C641: PERRIN 3 | F641: TITUS 3 | I641: ROWE 3 | K641: HORE 2 | M641: MILTE 2 | W641: SANDRINGHAM | X641: 2 | Y641: 10 | Z641: 0 | AA641: 877 | AB641: 1528 | AC641: =(AA641/AB641)*100 -> 57.395287958115183 | AD641: 8
A642: BRUNSWICK | C642: MANN 3 | E642: BLACKMORE 2 | H642: JEFFREY 2 | J642: COLLICOAT | M642: PLUMMER | O642: CRAWFORD | R642: JACOBS | W642: OAKLEIGH | X642: 1 | Y642: 11 | Z642: 0 | AA642: 721 | AB642: 1470 | AC642: =(AA642/AB642)*100 -> 49.047619047619044 | AD642: 4
Q643: HUGHES
A644: PORT MELBOURNE | C644: 0 | D644: 1 | E644: =C644*6+D644 -> 1 | G644: 6 | H644: 11 | I644: =G644*6+H644 -> 47 | K644: 8 | L644: 13 | M644: =K644*6+L644 -> 61 | O644: 19 | P644: 21 | Q644: =O644*6+P644 -> 135 | S644: TOORAK PARK
A645: PRAHRAN | C645: 7 | D645: 3 | E645: =C645*6+D645 -> 45 | G645: 8 | H645: 5 | I645: =G645*6+H645 -> 53 | K645: 14 | L645: 15 | M645: =K645*6+L645 -> 99 | O645: 16 | P645: 17 | Q645: =O645*6+P645 -> 113 | S645: WALLMEYER
A646: BEST PLAYERS
A647: PORT MELBOURNE | C647: FISHER | F647: SEARLE | I647: TREMBATH | L647: LEWIS | O647: BAKER | R647: HOUSTEN
A648: PRAHRAN | C648: STACKPOLE | F648: BENNISON | I648: BURTON | L648: WASTELL | O648: LAMBORN | R648: GODDEN
A649: GOALKICKERS
A650: PORT MELBOURNE | C650: LEWIS 7 | F650: HOUSTEN 5 | I650: MALLETT 3 | L650: TAYLOR 2 | N650: CULPH | P650: CRAWSHAW
A651: PRAHRAN | C651: STACKPOLE 8 | F651: SPARGO 2 | I651: NORRIS 2 | K651: McMAHON 2 | N651: MIGUEL | P651: ROLFE
A653: SANDRINGHAM | C653: 11 | D653: 7 | E653: =C653*6+D653 -> 73 | G653: 12 | H653: 8 | I653: =G653*6+H653 -> 80 | K653: 14 | L653: 14 | M653: =K653*6+L653 -> 98 | O653: 14 | P653: 18 | Q653: =O653*6+P653 -> 102 | S653: BEACH ROAD
A654: BRIGHTON | C654: 0 | D654: 3 | E654: =C654*6+D654 -> 3 | G654: 5 | H654: 6 | I654: =G654*6+H654 -> 36 | K654: 5 | L654: 8 | M654: =K654*6+L654 -> 38 | O654: 13 | P654: 14 | Q654: =O654*6+P654 -> 92 | S654: VINES
A655: BEST PLAYERS
A656: SANDRINGHAM | C656: HOLMES | F656: BENCRAFT | I656: J MILLER | L656: MOLONEY | O656: REID | Q656: O'TOOLE
A657: BRIGHTON | C657: STOREY | F657: CARLAND | I657: BULDT | L657: ORGER | O657: BAILEY | Q657: NUTTER
A658: GOALKICKERS
A659: SANDRINGHAM | C659: HOLMES 4 | F659: BENCRAFT 3 | I659: REYNOLDS 2 | L659: REID 2 | N659: JENNINGS | Q659: MOLONEY | T659: MIDDLETON
A660: BRIGHTON | C660: ELLIS 4 | F660: NUTTER 3 | I660: BROWN 2 | L660: KING | N660: CHESTER | P660: CARLAND | R660: BULDT
A662: CAMBERWELL | C662: 5 | D662: 3 | E662: =C662*6+D662 -> 33 | G662: 8 | H662: 4 | I662: =G662*6+H662 -> 52 | K662: 10 | L662: 10 | M662: =K662*6+L662 -> 70 | O662: 14 | P662: 10 | Q662: =O662*6+P662 -> 94 | S662: OAKLEIGH
A663: OAKLEIGH | C663: 1 | D663: 3 | E663: =C663*6+D663 -> 9 | G663: 6 | H663: 6 | I663: =G663*6+H663 -> 42 | K663: 12 | L663: 21 | M663: =K663*6+L663 -> 93 | O663: 12 | P663: 21 | Q663: =O663*6+P663 -> 93 | S663: MERRINGTON
A664: BEST PLAYERS
A665: CAMBERWELL | C665: BRADFORD | F665: OLIVER | I665: COLLIER | L665: AUSTEN | O665: JENSON | Q665: BOYALL
A666: OAKLEIGH | C666: NAISMITH | F666: BEARD | I666: WORRALL | L666: MUDGE | O666: FINN | Q666: RICHARDSON
A667: GOALKICKERS
A668: CAMBERWELL | C668: OLIVER 6 | F668: BRADFORD 3 | I668: GRIFFIN 2 | L668: McPHERSON | O668: DINEEN | Q668: JENSON
A669: OAKLEIGH | C669: BEARD 3 | E669: SEPHTON | G669: ARMSTRONG | J669: WORRALL | M669: KITCHEN | O669: O'CONNOR | Q669: FINN | S669: SCALES | U669: BREMNER | X669: NAISMITH
A671: WILLIAMSTOWN | C671: 3 | D671: 9 | E671: =C671*6+D671 -> 27 | G671: 5 | H671: 13 | I671: =G671*6+H671 -> 43 | K671: 11 | L671: 15 | M671: =K671*6+L671 -> 81 | O671: 16 | P671: 18 | Q671: =O671*6+P671 -> 114 | S671: WILLIAMSTOWN
A672: YARRAVILLE | C672: 2 | D672: 0 | E672: =C672*6+D672 -> 12 | G672: 5 | H672: 3 | I672: =G672*6+H672 -> 33 | K672: 6 | L672: 11 | M672: =K672*6+L672 -> 47 | O672: 9 | P672: 6 | Q672: =O672*6+P672 -> 60 | S672: GREGORY
A673: BEST PLAYERS
A674: WILLIAMSTOWN | C674: HEARN | E674: GLASS | H674: CHISHOLM | K674: WILCOX | N674: SPRING | Q674: SCARFFE
A675: YARRAVILLE | C675: CAHILL | E675: GARLICK | H675: SORRAGHAN | K675: PERUSSICH | N675: ELLIS | Q675: SMITH
A676: GOALKICKERS
A677: WILLIAMSTOWN | C677: TODD 7 | F677: GLASS 3 | I677: SPRING 2 | K677: HEARN | M677: CHAPMAN | O677: MATTHEWS | R677: HANLEY
A678: YARRAVILLE | C678: ELLIS 3 | F678: PERUSSICH 2 | I678: CAHILL | K678: H RUDDELL | N678: HOWDEN | Q678: BELL
A680: ROUND 13 | D680: 7TH JULY | J680: WEATHER | M680: SOUTH WEST WIND SHOWERS | S680: PLAYED AT
D681: 1ST QTR | H681: 2ND QTR | L681: 3RD QTR | P681: FINAL | S681: TOORAK PARK
A682: WILLIAMSTOWN | C682: 4 | D682: 4 | E682: =C682*6+D682 -> 28 | G682: 5 | H682: 6 | I682: =G682*6+H682 -> 36 | K682: 9 | L682: 9 | M682: =K682*6+L682 -> 63 | O682: 14 | P682: 11 | Q682: =O682*6+P682 -> 95 | S682: UMPIRE | X682: LADDER | AB682: ROUND | AD682: 13
A683: PORT MELBOURNE | C683: 1 | D683: 0 | E683: =C683*6+D683 -> 6 | G683: 1 | H683: 3 | I683: =G683*6+H683 -> 9 | K683: 4 | L683: 4 | M683: =K683*6+L683 -> 28 | O683: 6 | P683: 5 | Q683: =O683*6+P683 -> 41 | S683: MOORE
A684: BEST PLAYERS | W684: TEAM | X684: W | Y684: L | Z684: D | AA684: FOR | AB684: AGST | AC684: % | AD684: PTS
A685: WILLIAMSTOWN | C685: MATTHEWS | F685: HARRIS | I685: CHISHOLM | L685: WILSON | N685: OGDEN | Q685: CUTTING
A686: PORT MELBOURNE | C686: SEARLE | F686: DOBSON | I686: FLETCHER | L686: LEWIS | N686: TREMBATH | Q686: FISHER | W686: COBURG | X686: 13 | Y686: 0 | Z686: 0 | AA686: 1687 | AB686: 943 | AC686: =(AA686/AB686)*100 -> 178.89713679745495 | AD686: 52
A687: GOALKICKERS | W687: WILLIAMSTOWN | X687: 11 | Y687: 2 | Z687: 0 | AA687: 1622 | AB687: 1024 | AC687: =(AA687/AB687)*100 -> 158.3984375 | AD687: 44
A688: WILLIAMSTOWN | C688: HARRIS 5 | F688: TODD 5 | I688: GLASS | K688: MATTHEWS | N688: JOHNSON | Q688: SCARFFE | W688: PORT MELBOURNE | X688: 9 | Y688: 4 | Z688: 0 | AA688: 1539 | AB688: 1129 | AC688: =(AA688/AB688)*100 -> 136.3153232949513 | AD688: 36
A689: PORT MELBOURNE | C689: LEWIS 2 | F689: HOUSTEN | I689: TAYLOR | K689: MALLETT | N689: CULPH | W689: PRESTON | X689: 9 | Y689: 4 | Z689: 0 | AA689: 1232 | AB689: 1095 | AC689: =(AA689/AB689)*100 -> 112.51141552511415 | AD689: 36
A691: COBURG | C691: 7 | D691: 5 | E691: =C691*6+D691 -> 47 | G691: 11 | H691: 8 | I691: =G691*6+H691 -> 74 | K691: 15 | L691: 14 | M691: =K691*6+L691 -> 104 | O691: 17 | P691: 16 | Q691: =O691*6+P691 -> 118 | S691: CAMBERWELL | W691: BRUNSWICK | X691: 6 | Y691: 7 | Z691: 0 | AA691: 1197 | AB691: 1018 | AC691: =(AA691/AB691)*100 -> 117.58349705304518 | AD691: 24
A692: CAMBERWELL | C692: 3 | D692: 1 | E692: =C692*6+D692 -> 19 | G692: 6 | H692: 6 | I692: =G692*6+H692 -> 42 | K692: 7 | L692: 10 | M692: =K692*6+L692 -> 52 | O692: 11 | P692: 18 | Q692: =O692*6+P692 -> 84 | S692: WALLMEYER | W692: CAMBERWELL | X692: 6 | Y692: 7 | Z692: 0 | AA692: 1187 | AB692: 1193 | AC692: =(AA692/AB692)*100 -> 99.49706621961441 | AD692: 24
A693: BEST PLAYERS | W693: NORTHCOTE | X693: 6 | Y693: 7 | Z693: 0 | AA693: 1099 | AB693: 1254 | AC693: =(AA693/AB693)*100 -> 87.639553429027117 | AD693: 24
A694: COBURG | C694: PROMNITZ | F694: MILTE | I694: CREWTHER | L694: ROWE | O694: TITUS | Q694: CONDON | W694: BRIGHTON | X694: 6 | Y694: 7 | Z694: 0 | AA694: 1035 | AB694: 1371 | AC694: =(AA694/AB694)*100 -> 75.492341356673961 | AD694: 24
A695: CAMBERWELL | C695: BOYALL | F695: JENSON | I695: BRADFORD | L695: COLLIER | O695: TAYLOR | Q695: AUSTEN | W695: PRAHRAN | X695: 5 | Y695: 8 | Z695: 0 | AA695: 1274 | AB695: 1263 | AC695: =(AA695/AB695)*100 -> 100.87094220110848 | AD695: 20
A696: GOALKICKERS | W696: YARRAVILLE | X696: 4 | Y696: 9 | Z696: 0 | AA696: 1245 | AB696: 1338 | AC696: =(AA696/AB696)*100 -> 93.049327354260086 | AD696: 16
A697: COBURG | C697: TITUS 5 | E697: CREWTHER 2 | H697: ROWE 2 | J697: FYFFE 2 | L697: CONDON 2 | N697: MILTE 2 | P697: PERRIN | R697: DAY | W697: SANDRINGHAM | X697: 2 | Y697: 11 | Z697: 0 | AA697: 958 | AB697: 1659 | AC697: =(AA697/AB697)*100 -> 57.74562989752863 | AD697: 8
A698: CAMBERWELL | C698: JENSON 3 | F698: BRADFORD 2 | I698: HARLAND 2 | L698: OLIVER 2 | N698: HORKINGS | Q698: GRIFFEN | W698: OAKLEIGH | X698: 1 | Y698: 12 | Z698: 0 | AA698: 798 | AB698: 1571 | AC698: =(AA698/AB698)*100 -> 50.795671546785492 | AD698: 4
A700: BRUNSWICK | C700: 3 | D700: 2 | E700: =C700*6+D700 -> 20 | G700: 9 | H700: 6 | I700: =G700*6+H700 -> 60 | K700: 12 | L700: 10 | M700: =K700*6+L700 -> 82 | O700: 15 | P700: 16 | Q700: =O700*6+P700 -> 106 | S700: BRUNSWICK
A701: NORTHCOTE | C701: 4 | D701: 1 | E701: =C701*6+D701 -> 25 | G701: 5 | H701: 5 | I701: =G701*6+H701 -> 35 | K701: 7 | L701: 8 | M701: =K701*6+L701 -> 50 | O701: 9 | P701: 11 | Q701: =O701*6+P701 -> 65 | S701: MERRINGTON
A702: BEST PLAYERS
A703: BRUNSWICK | C703: BLACKMORE | F703: MANN | I703: STANDFIELD | L703: GEISLER | O703: FARRELL | R703: PLUMMER
A704: NORTHCOTE | C704: KINDER | F704: DUDLEY | I704: JONES | L704: McINTOSH | O704: GREENWOOD | R704: BAGULEY
A705: GOALKICKERS
A706: BRUNSWICK | C706: BLACKMORE 4 | F706: STANDFIELD 3 | I706: MANN 2 | K706: COLLICOAT 2 | N706: HOGAN 2 | Q706: JACOBS | S706: WILSON
A707: NORTHCOTE | C707: JONES 3 | F707: CARNEY 2 | I707: POLGLASE | L707: McINTOSH | N707: KINDER | P707: RUSH
A709: PRESTON | C709: 2 | D709: 4 | E709: =C709*6+D709 -> 16 | G709: 7 | H709: 10 | I709: =G709*6+H709 -> 52 | K709: 12 | L709: 12 | M709: =K709*6+L709 -> 84 | O709: 14 | P709: 18 | Q709: =O709*6+P709 -> 102 | S709: PRESTON
A710: PRAHRAN | C710: 5 | D710: 3 | E710: =C710*6+D710 -> 33 | G710: 6 | H710: 6 | I710: =G710*6+H710 -> 42 | K710: 10 | L710: 8 | M710: =K710*6+L710 -> 68 | O710: 12 | P710: 9 | Q710: =O710*6+P710 -> 81 | S710: GREGORY
A711: BEST PLAYERS
A712: PRESTON | C712: MINNEY | F712: MASLEN | I712: ANDERSON | L712: EXELBY | O712: BOYD | R712: SMETHURST
A713: PRAHRAN | C713: GARDINER | F713: CAMM | I713: ROLFE | L713: CONROY | O713: O'DONNELL | R713: WASTELL
A714: GOALKICKERS
A715: PRESTON | C715: BOYD 3 | E715: McCARTHY 2 | H715: ANDERSON 2 | K715: SMETHURST 2 | N715: EXELBY 2 | Q715: CONNELLY 2 | T715: HENRY
A716: PRAHRAN | C716: CULLEN 3 | E716: ROLFE 2 | G716: GRACIE 2 | I716: BUCKLEY | K716: O'DONNELL | M716: BURTON | O716: WHITE | Q716: GODDEN
A718: YARRAVILLE | C718: 3 | D718: 4 | E718: =C718*6+D718 -> 22 | G718: 11 | H718: 7 | I718: =G718*6+H718 -> 73 | K718: 13 | L718: 8 | M718: =K718*6+L718 -> 86 | O718: 20 | P718: 11 | Q718: =O718*6+P718 -> 131 | S718: YARRAVILLE
A719: SANDRINGHAM | C719: 2 | D719: 6 | E719: =C719*6+D719 -> 18 | G719: 3 | H719: 10 | I719: =G719*6+H719 -> 28 | K719: 9 | L719: 15 | M719: =K719*6+L719 -> 69 | O719: 11 | P719: 15 | Q719: =O719*6+P719 -> 81 | S719: THOMAS
A720: BEST PLAYERS
A721: YARRAVILLE | C721: SORRAGHAN | F721: PERUSSICH | I721: HALE | K721: ELLIS | N721: GARLICK | Q721: HOWDEN
A722: SANDRINGHAM | C722: JENNINGS | F722: J MILLER | I722: REID | K722: MOLONEY | N722: POLE | Q722: REYNOLDS
A723: GOALKICKERS
A724: YARRAVILLE | C724: ELLIS 6 | E724: HOWDEN 4 | H724: SORRAGHAN 4 | K724: PERUSSICH 3 | N724: H RUDDELL 2 | Q724: DAY
A725: SANDRINGHAM | C725: REYNOLDS 5 | F725: HOLMES 3 | I725: McKENZIE | K725: MATHESON | N725: MIDDLETON
A727: BRIGHTON | C727: 4 | D727: 3 | E727: =C727*6+D727 -> 27 | G727: 6 | H727: 13 | I727: =G727*6+H727 -> 49 | K727: 9 | L727: 15 | M727: =K727*6+L727 -> 69 | O727: 14 | P727: 17 | Q727: =O727*6+P727 -> 101 | S727: ELSTERNWICK PARK
A728: OAKLEIGH | C728: 2 | D728: 5 | E728: =C728*6+D728 -> 17 | G728: 3 | H728: 7 | I728: =G728*6+H728 -> 25 | K728: 5 | L728: 8 | M728: =K728*6+L728 -> 38 | O728: 11 | P728: 11 | Q728: =O728*6+P728 -> 77 | S728: VINE
A729: BEST PLAYERS
A730: BRIGHTON | C730: MOFFATT | F730: CROSS | I730: WILLIAMSON | L730: PAGE | N730: KING | Q730: McINDOE
A731: OAKLEIGH | C731: NAISMITH | F731: WORRALL | I731: MUDGE | L731: D JANE | N731: BEARD | Q731: VEALE
A732: GOALKICKERS
A733: BRIGHTON | C733: ALVIN 5 | F733: PAGE 4 | I733: NUTTER 2 | L733: KING | N733: McINDOE | Q733: CROSS
A734: OAKLEIGH | C734: NAISMITH 5 | F734: SCALES 2 | I734: HORNE | K734: MUDGE | M734: BEARD | O734: VEALE
A736: ROUND 14 | D736: 14TH JULY | J736: WEATHER | M736: COLD RAW DAY GROUNDS HEAVY | S736: PLAYED AT
D737: 1ST QTR | H737: 2ND QTR | L737: 3RD QTR | P737: FINAL | S737: WILLIAMSTOWN
A738: WILLIAMSTOWN | C738: 2 | D738: 2 | E738: =C738*6+D738 -> 14 | G738: 7 | H738: 5 | I738: =G738*6+H738 -> 47 | K738: 12 | L738: 10 | M738: =K738*6+L738 -> 82 | O738: 15 | P738: 15 | Q738: =O738*6+P738 -> 105 | S738: UMPIRE | X738: LADDER | AB738: ROUND | AD738: 14
A739: PRESTON | C739: 3 | D739: 1 | E739: =C739*6+D739 -> 19 | G739: 6 | H739: 3 | I739: =G739*6+H739 -> 39 | K739: 7 | L739: 6 | M739: =K739*6+L739 -> 48 | O739: 9 | P739: 7 | Q739: =O739*6+P739 -> 61 | S739: THOMAS
A740: BEST PLAYERS | W740: TEAM | X740: W | Y740: L | Z740: D | AA740: FOR | AB740: AGST | AC740: % | AD740: PTS
A741: WILLIAMSTOWN | C741: WILCOX | E741: HARLEY | H741: CUTTING | K741: SPRING | N741: TODD | Q741: OGDEN
A742: PRESTON | C742: MASLEN | E742: DEACON | H742: BROOKS | K742: ANDERSON | N742: BOYD | Q742: McDONALD | W742: COBURG | X742: 14 | Y742: 0 | Z742: 0 | AA742: 1805 | AB742: 1014 | AC742: =(AA742/AB742)*100 -> 178.00788954635109 | AD742: 56
A743: GOALKICKERS | W743: WILLIAMSTOWN | X743: 12 | Y743: 2 | Z743: 0 | AA743: 1727 | AB743: 1085 | AC743: =(AA743/AB743)*100 -> 159.17050691244239 | AD743: 48
A744: WILLIAMSTOWN | C744: TODD 6 | E744: HARRIS 4 | G744: GLASS | I744: COCKBURN | L744: SPRING | N744: HEARN | P744: SCARFFE | W744: PORT MELBOURNE | X744: 10 | Y744: 4 | Z744: 0 | AA744: 1613 | AB744: 1188 | AC744: =(AA744/AB744)*100 -> 135.77441077441077 | AD744: 40
A745: PRESTON | C745: BOYD 4 | E745: ANDERSON 2 | H745: McTAGGART | K745: SEEDSMAN | N745: CONNELLY | W745: PRESTON | X745: 9 | Y745: 5 | Z745: 0 | AA745: 1293 | AB745: 1200 | AC745: =(AA745/AB745)*100 -> 107.75 | AD745: 36
A747: CAMBERWELL | C747: 3 | D747: 5 | E747: =C747*6+D747 -> 23 | G747: 7 | H747: 5 | I747: =G747*6+H747 -> 47 | K747: 14 | L747: 8 | M747: =K747*6+L747 -> 92 | O747: 17 | P747: 10 | Q747: =O747*6+P747 -> 112 | S747: CAMBERWELL | W747: BRUNSWICK | X747: 7 | Y747: 7 | Z747: 0 | AA747: 1299 | AB747: 1102 | AC747: =(AA747/AB747)*100 -> 117.87658802177859 | AD747: 28
A748: NORTHCOTE | C748: 6 | D748: 2 | E748: =C748*6+D748 -> 38 | G748: 10 | H748: 3 | I748: =G748*6+H748 -> 63 | K748: 13 | L748: 7 | M748: =K748*6+L748 -> 85 | O748: 16 | P748: 11 | Q748: =O748*6+P748 -> 107 | S748: PARRIS | W748: CAMBERWELL | X748: 7 | Y748: 7 | Z748: 0 | AA748: 1299 | AB748: 1300 | AC748: =(AA748/AB748)*100 -> 99.92307692307692 | AD748: 28
A749: BEST PLAYERS | W749: BRIGHTON | X749: 7 | Y749: 7 | Z749: 0 | AA749: 1142 | AB749: 1461 | AC749: =(AA749/AB749)*100 -> 78.165639972621491 | AD749: 28
A750: CAMBERWELL | C750: AUSTEN | E750: BRADFORD | H750: SHIELDS | K750: BOYALL | N750: McDONALD | Q750: BRYCE | W750: NORTHCOTE | X750: 6 | Y750: 8 | Z750: 0 | AA750: 1206 | AB750: 1366 | AC750: =(AA750/AB750)*100 -> 88.286969253294288 | AD750: 24
A751: NORTHCOTE | C751: JONES | E751: H OLVER | H751: DRYDEN | K751: BARKER | N751: KINDER | Q751: POLGLASE | W751: PRAHRAN | X751: 5 | Y751: 9 | Z751: 0 | AA751: 1345 | AB751: 1381 | AC751: =(AA751/AB751)*100 -> 97.393193338160756 | AD751: 20
A752: GOALKICKERS | W752: YARRAVILLE | X752: 4 | Y752: 10 | Z752: 0 | AA752: 1335 | AB752: 1445 | AC752: =(AA752/AB752)*100 -> 92.387543252595165 | AD752: 16
A753: CAMBERWELL | C753: HARLAND 4 | F753: BRADFORD 4 | I753: SHIELDS 3 | K753: McDONALD 2 | N753: JENSON 2 | Q753: BOYALL | S753: OLIVER | W753: SANDRINGHAM | X753: 2 | Y753: 12 | Z753: 0 | AA753: 1042 | AB753: 1761 | AC753: =(AA753/AB753)*100 -> 59.170925610448613 | AD753: 8
A754: NORTHCOTE | C754: CARNEY 5 | F754: JONES 4 | I754: POLGLASE 3 | L754: RUSH 2 | N754: P OLVER | P754: KINDER | W754: OAKLEIGH | X754: 1 | Y754: 13 | Z754: 0 | AA754: 857 | AB754: 1645 | AC754: =(AA754/AB754)*100 -> 52.097264437689972 | AD754: 4
A756: COBURG | C756: 4 | D756: 5 | E756: =C756*6+D756 -> 29 | G756: 8 | H756: 9 | I756: =G756*6+H756 -> 57 | K756: 11 | L756: 15 | M756: =K756*6+L756 -> 81 | O756: 17 | P756: 16 | Q756: =O756*6+P756 -> 118 | S756: COBURG
A757: PRAHRAN | C757: 2 | D757: 1 | E757: =C757*6+D757 -> 13 | G757: 5 | H757: 5 | I757: =G757*6+H757 -> 35 | K757: 8 | L757: 6 | M757: =K757*6+L757 -> 54 | O757: 10 | P757: 11 | Q757: =O757*6+P757 -> 71 | S757: MOORE
A758: BEST PLAYERS
A759: COBURG | C759: ROWE | F759: PERRIN | I759: FYFFE | L759: PROMNITZ | O759: TITUS | R759: WILSON
A760: PRAHRAN | C760: BURTON | F760: ROACH | I760: BOURKE | L760: CAMM | O760: ROLFE | R760: WHITE
A761: GOALKICKERS
A762: COBURG | C762: TITUS 7 | E762: PERRIN 2 | G762: ROWE 2 | I762: FYFFE 2 | K762: LONSDALE | N762: WILSON | P762: KENNEDY | S762: HAZELWOOD
A763: PRAHRAN | C763: McMAHON 2 | F763: STACKPOLE 2 | I763: CULLEN 2 | K763: WHITE 2 | M763: O'DONNELL | P763: ROLFE
A765: BRIGHTON | C765: 4 | D765: 2 | E765: =C765*6+D765 -> 26 | G765: 11 | H765: 2 | I765: =G765*6+H765 -> 68 | K765: 13 | L765: 3 | M765: =K765*6+L765 -> 81 | O765: 16 | P765: 11 | Q765: =O765*6+P765 -> 107 | S765: YARRAVILLE
A766: YARRAVILLE | C766: 4 | D766: 8 | E766: =C766*6+D766 -> 32 | G766: 10 | H766: 12 | I766: =G766*6+H766 -> 72 | K766: 10 | L766: 17 | M766: =K766*6+L766 -> 77 | O766: 12 | P766: 18 | Q766: =O766*6+P766 -> 90 | S766: BARNES
A767: BEST PLAYERS
A768: BRIGHTON | C768: ALVIN | F768: KING | I768: HALCOMBE | L768: DOREY | N768: McINDOE | Q768: CARLAND
A769: YARRAVILLE | C769: SORRAGHAN | F769: PERUSSICH | I769: BELL | L769: DAY | N769: ELLIS | Q769: JONES
A770: GOALKICKERS
A771: BRIGHTON | C771: ALVIN 8 | F771: KING 3 | H771: McINDOE 2 | K771: CARLAND 2 | N771: PLUNKETT
A772: YARRAVILLE | C772: SORRAGHAN 5 | F772: PERUSSICH 2 | I772: HOWDEN 2 | L772: WHITE | N772: HALE | P772: ELLIS
A774: BRUNSWICK | C774: 6 | D774: 6 | E774: =C774*6+D774 -> 42 | G774: 9 | H774: 11 | I774: =G774*6+H774 -> 65 | K774: 11 | L774: 14 | M774: =K774*6+L774 -> 80 | O774: 14 | P774: 18 | Q774: =O774*6+P774 -> 102 | S774: BEACH ROAD
A775: SANDRINGHAM | C775: 3 | D775: 0 | E775: =C775*6+D775 -> 18 | G775: 4 | H775: 3 | I775: =G775*6+H775 -> 27 | K775: 9 | L775: 8 | M775: =K775*6+L775 -> 62 | O775: 12 | P775: 12 | Q775: =O775*6+P775 -> 84 | S775: GREGORY
A776: BEST PLAYERS
A777: BRUNSWICK | C777: CASEY | F777: HUGHES | I777: BAKER | L777: FARRELL | O777: EVANS | R777: STANDFIELD
A778: SANDRINGHAM | C778: BENNETT | F778: J MILLER | I778: HOLMES | L778: MOLONEY | O778: JENNINGS | R778: BENCRAFT
A779: GOALKICKERS
A780: BRUNSWICK | C780: HUGHES 3 | F780: BLACKMORE 3 | I780: MANN 2 | K780: CRAWFORD 2 | N780: JEFFREY | P780: JACOBS | R780: GLASSCOTT | V780: STANDFIELD
A781: SANDRINGHAM | C781: MOLONEY 3 | F781: BENCRAFT 3 | I781: BENNETT 3 | L781: HOLMES 2 | O781: JENNINGS
A783: PORT MELBOURNE | C783: 0 | D783: 6 | E783: =C783*6+D783 -> 6 | G783: 3 | H783: 12 | I783: =G783*6+H783 -> 30 | K783: 6 | L783: 16 | M783: =K783*6+L783 -> 52 | O783: 9 | P783: 20 | Q783: =O783*6+P783 -> 74 | S783: OAKLEIGH
A784: OAKLEIGH | C784: 3 | D784: 2 | E784: =C784*6+D784 -> 20 | G784: 4 | H784: 3 | I784: =G784*6+H784 -> 27 | K784: 6 | L784: 4 | M784: =K784*6+L784 -> 40 | O784: 9 | P784: 5 | Q784: =O784*6+P784 -> 59 | S784: VINES
A785: BEST PLAYERS
A786: PORT MELBOURNE | C786: McBETH | F786: REYNOLDS | I786: CRAWSHAW | L786: TAYLOR | O786: HOUSTEN | R786: FLETCHER
A787: OAKLEIGH | C787: BEARD | F787: D JANE | I787: NAISMITH | L787: FINN | O787: HORNE | R787: HILL
A788: GOALKICKERS
A789: PORT MELBOURNE | C789: LEWIS 2 | F789: REYNOLDS 2 | I789: CRAWSHAW 2 | L789: TAYLOR | N789: HOUSTEN | Q789: MALLETT
A790: OAKLEIGH | C790: NAISMITH 3 | F790: ARMSTRONG 2 | J790: FISHER | L790: BREMNER | N790: WORRALL | Q790: HORNE
A792: ROUND 15 | E792: 21ST JULY | J792: WEATHER | S792: PLAYED AT
D793: 1ST QTR | H793: 2ND QTR | L793: 3RD QTR | P793: FINAL | S793: CAMBERWELL
A794: COBURG | C794: 6 | D794: 4 | E794: =C794*6+D794 -> 40 | G794: 8 | H794: 7 | I794: =G794*6+H794 -> 55 | K794: 14 | L794: 12 | M794: =K794*6+L794 -> 96 | O794: 17 | P794: 17 | Q794: =O794*6+P794 -> 119 | S794: UMPIRE | X794: LADDER | AB794: ROUND | AD794: 15
A795: PORT MELBOURNE | C795: 0 | D795: 0 | E795: =C795*6+D795 -> 0 | G795: 4 | H795: 5 | I795: =G795*6+H795 -> 29 | K795: 6 | L795: 8 | M795: =K795*6+L795 -> 44 | O795: 9 | P795: 14 | Q795: =O795*6+P795 -> 68 | S795: VINES
A796: BEST PLAYERS | W796: TEAM | X796: W | Y796: L | Z796: D | AA796: FOR | AB796: AGST | AC796: % | AD796: PTS
A797: COBURG | C797: WILSON | E797: R ATKINSON | I797: CREWTHER | L797: FYFFE | O797: ROWE | Q797: LONSDALE
A798: PORT MELBOURNE | C798: BAKER | E798: TAYLOR | I798: SEARLE | L798: TREMBATH | O798: STOREY | Q798: JULIER | W798: COBURG | X798: 15 | Y798: 0 | Z798: 0 | AA798: 1924 | AB798: 1082 | AC798: =(AA798/AB798)*100 -> 177.81885397412199 | AD798: 60
A799: GOALKICKERS | W799: WILLIAMSTOWN | X799: 13 | Y799: 2 | Z799: 0 | AA799: 1832 | AB799: 1173 | AC799: =(AA799/AB799)*100 -> 156.18073316283034 | AD799: 52
A800: COBURG | C800: TITUS 5 | E800: FYFFE 5 | G800: MARDEN 2 | J800: ROWE 2 | L800: PERRIN | N800: CONDON | P800: CREWTHER | W800: PORT MELBOURNE | X800: 10 | Y800: 5 | Z800: 0 | AA800: 1681 | AB800: 1307 | AC800: =(AA800/AB800)*100 -> 128.6151491966335 | AD800: 40
A801: PORT MELBOURNE | C801: TAYLOR 3 | F801: CRAWSHAW 2 | J801: CULPH | L801: MALLETT | N801: LEWIS | P801: REYNOLDS | W801: PRESTON | X801: 10 | Y801: 5 | Z801: 0 | AA801: 1394 | AB801: 1267 | AC801: =(AA801/AB801)*100 -> 110.02367797947909 | AD801: 40
A803: CAMBERWELL | C803: 4 | D803: 5 | E803: =C803*6+D803 -> 29 | G803: 10 | H803: 6 | I803: =G803*6+H803 -> 66 | K803: 13 | L803: 8 | M803: =K803*6+L803 -> 86 | O803: 15 | P803: 10 | Q803: =O803*6+P803 -> 100 | S803: BRUNSWICK | W803: CAMBERWELL | X803: 8 | Y803: 7 | Z803: 0 | AA803: 1399 | AB803: 1391 | AC803: =(AA803/AB803)*100 -> 100.57512580877066 | AD803: 32
A804: BRUNSWICK | C804: 1 | D804: 3 | E804: =C804*6+D804 -> 9 | G804: 7 | H804: 3 | I804: =G804*6+H804 -> 45 | K804: 7 | L804: 3 | M804: =K804*6+L804 -> 45 | O804: 13 | P804: 13 | Q804: =O804*6+P804 -> 91 | S804: BARNES | W804: BRUNSWICK | X804: 7 | Y804: 8 | Z804: 0 | AA804: 1390 | AB804: 1202 | AC804: =(AA804/AB804)*100 -> 115.6405990016639 | AD804: 28
A805: BEST PLAYERS | W805: NORTHCOTE | X805: 7 | Y805: 8 | Z805: 0 | AA805: 1331 | AB805: 1397 | AC805: =(AA805/AB805)*100 -> 95.275590551181097 | AD805: 28
A806: CAMBERWELL | C806: BRADFORD | F806: BOYALL | I806: HARLAND | L806: AUSTEN | O806: SHIELDS | Q806: DINEEN | W806: BRIGHTON | X806: 7 | Y806: 8 | Z806: 0 | AA806: 1230 | AB806: 1566 | AC806: =(AA806/AB806)*100 -> 78.544061302681996 | AD806: 28
A807: BRUNSWICK | C807: BAKER | F807: HUGHES | I807: PLUMMER | L807: STANDFIELD | O807: CARTON | Q807: SILK | W807: PRAHRAN | X807: 6 | Y807: 9 | Z807: 0 | AA807: 1476 | AB807: 1459 | AC807: =(AA807/AB807)*100 -> 101.16518163125427 | AD807: 24
A808: GOALKICKERS | W808: YARRAVILLE | X808: 4 | Y808: 11 | Z808: 0 | AA808: 1413 | AB808: 1576 | AC808: =(AA808/AB808)*100 -> 89.657360406091371 | AD808: 16
A809: CAMBERWELL | C809: DINEEN 5 | E809: BRYCE 3 | G809: GRIFFIN 2 | I809: MATTHEWS 2 | L809: HARLAND | O809: SHIELDS | Q809: BRADFORD | W809: SANDRINGHAM | X809: 2 | Y809: 13 | Z809: 0 | AA809: 1109 | AB809: 1862 | AC809: =(AA809/AB809)*100 -> 59.559613319011817 | AD809: 8
A810: BRUNSWICK | C810: MANN 4 | E810: HUGHES 2 | G810: BLACKMORE 2 | J810: HOGAN | L810: BAKER | N810: SILK | P810: JACOBS | R810: COLLICOAT | W810: OAKLEIGH | X810: 1 | Y810: 14 | Z810: 0 | AA810: 888 | AB810: 1770 | AC810: =(AA810/AB810)*100 -> 50.169491525423723 | AD810: 4
A812: WILLIAMSTOWN | C812: 6 | D812: 6 | E812: =C812*6+D812 -> 42 | G812: 8 | H812: 7 | I812: =G812*6+H812 -> 55 | K812: 14 | L812: 12 | M812: =K812*6+L812 -> 96 | O812: 15 | P812: 15 | Q812: =O812*6+P812 -> 105 | S812: ELSTERNWICK PARK
A813: BRIGHTON | C813: 3 | D813: 1 | E813: =C813*6+D813 -> 19 | G813: 7 | H813: 6 | I813: =G813*6+H813 -> 48 | K813: 10 | L813: 6 | M813: =K813*6+L813 -> 66 | O813: 13 | P813: 10 | Q813: =O813*6+P813 -> 88 | S813: PARRIS
A814: BEST PLAYERS
A815: WILLIAMSTOWN | C815: HARLEY | F815: SPRING | I815: FEATHERBY | L815: SCARFFE | O815: CHISHOLM | R815: TORNEY
A816: BRIGHTON | C816: KING | F816: CROSS | I816: NUTTER | L816: PLUNKETT | O816: BAILEY | R816: DOREY
A817: GOALKICKERS
A818: WILLIAMSTOWN | C818: TODD 5 | F818: HARRIS 4 | I818: GLASS 2 | K818: COCKBURN | N818: HARLEY | P818: SPRING | R818: TORNEY
A819: BRIGHTON | C819: KING 5 | F819: ALVIN 3 | I819: KENNETT 3 | L819: CROSS | N819: CARROLL
A821: PRAHRAN | C821: 4 | D821: 4 | E821: =C821*6+D821 -> 28 | G821: 9 | H821: 15 | I821: =G821*6+H821 -> 69 | K821: 13 | L821: 17 | M821: =K821*6+L821 -> 95 | O821: 18 | P821: 23 | Q821: =O821*6+P821 -> 131 | S821: TOORAK PARK
A822: YARRAVILLE | C822: 2 | D822: 4 | E822: =C822*6+D822 -> 16 | G822: 5 | H822: 5 | I822: =G822*6+H822 -> 35 | K822: 9 | L822: 8 | M822: =K822*6+L822 -> 62 | O822: 11 | P822: 12 | Q822: =O822*6+P822 -> 78 | S822: MERRINGTON
A823: BEST PLAYERS
A824: PRAHRAN | C824: STACKPOLE | F824: BENNISON | I824: SPARGO | L824: ROLFE | O824: WHITE | R824: BOURKE
A825: YARRAVILLE | C825: H RUDDELL | F825: KNIGHT | I825: PERUSSICH | L825: SORRAGHAN | O825: GARLICK | R825: JONES
A826: GOALKICKERS
A827: PRAHRAN | C827: STACKPOLE 7 | F827: ADAMS 2 | I827: WHITE 2 | K827: CULLEN 2 | M827: ROLFE | O827: O'DONNELL | Q827: DOUGHTON | T827: D'OLIVER | W827: McLEAN
A828: YARRAVILLE | C828: HOWDEN 3 | F828: LEWIS 2 | I828: PERUSSICH 2 | L828: H RUDDELL | O828: ELLIS | Q828: THOMAS | S828: DAY
A830: NORTHCOTE | C830: 2 | D830: 7 | E830: =C830*6+D830 -> 19 | G830: 6 | H830: 13 | I830: =G830*6+H830 -> 49 | K830: 15 | L830: 18 | M830: =K830*6+L830 -> 108 | O830: 17 | P830: 23 | Q830: =O830*6+P830 -> 125 | S830: NORTHCOTE
A831: OAKLEIGH | C831: 1 | D831: 3 | E831: =C831*6+D831 -> 9 | G831: 2 | H831: 5 | I831: =G831*6+H831 -> 17 | K831: 3 | L831: 5 | M831: =K831*6+L831 -> 23 | O831: 4 | P831: 7 | Q831: =O831*6+P831 -> 31 | S831: GREGORY
A832: BEST PLAYERS
A833: NORTHCOTE | C833: KINDER | F833: BARKER | I833: P OLVER | L833: POLGLASE | O833: RUSH | Q833: GALE
A834: OAKLEIGH | C834: WORRALL | F834: NAISMITH | I834: C JANE | L834: MUDGE | O834: HALL | Q834: VEALE
A835: GOALKICKERS
A836: NORTHCOTE | C836: GALE 7 | F836: P OLVER 4 | I836: RUSH 3 | K836: STEIGENBERGER | N836: KINDER | P836: CARNEY
A837: OAKLEIGH | C837: NAISMITH 2 | F837: FISHER | H837: FINN
A839: PRESTON | C839: 3 | D839: 2 | E839: =C839*6+D839 -> 20 | G839: 9 | H839: 6 | I839: =G839*6+H839 -> 60 | K839: 13 | L839: 11 | M839: =K839*6+L839 -> 89 | O839: 14 | P839: 17 | Q839: =O839*6+P839 -> 101 | S839: PRESTON
A840: SANDRINGHAM | C840: 5 | D840: 3 | E840: =C840*6+D840 -> 33 | G840: 8 | H840: 3 | I840: =G840*6+H840 -> 51 | K840: 9 | L840: 5 | M840: =K840*6+L840 -> 59 | O840: 10 | P840: 7 | Q840: =O840*6+P840 -> 67 | S840: THOMSON
A841: BEST PLAYERS
A842: PRESTON | C842: DELLER | F842: MASLEN | I842: MINNEY | L842: HARRIS | O842: BOND | Q842: BOYD
A843: SANDRINGHAM | C843: BENNET | F843: REYNOLDS | I843: BECK | L843: BENCRAFT | O843: POLE | Q843: J MILLER
A844: GOALKICKERS
A845: PRESTON | C845: ANDERSON 3 | F845: HARRIS 2 | I845: McTAGGART 2 | L845: BOYD 2 | N845: MCCARTHY 2 | Q845: BOND 2 | S845: MASLEN
A846: SANDRINGHAM | C846: REYNOLDS 4 | F846: BENNETT 2 | I846: MOLONEY 2 | L846: BENCRAFT | N846: POLE
A848: ROUND 16 | D848: 28TH JULY | H848: WEATHER | K848: NORTH WEST WIND RAIN IN MORNING | S848: PLAYED AT
D849: 1ST QTR | H849: 2ND QTR | L849: 3RD QTR | P849: FINAL | S849: COBURG
A850: COBURG | C850: 8 | D850: 2 | E850: =C850*6+D850 -> 50 | G850: 9 | H850: 3 | I850: =G850*6+H850 -> 57 | K850: 12 | L850: 9 | M850: =K850*6+L850 -> 81 | O850: 14 | P850: 11 | Q850: =O850*6+P850 -> 95 | S850: UMPIRE | X850: LADDER | AB850: ROUND | AD850: 16
A851: PRESTON | C851: 1 | D851: 1 | E851: =C851*6+D851 -> 7 | G851: 3 | H851: 4 | I851: =G851*6+H851 -> 22 | K851: 3 | L851: 4 | M851: =K851*6+L851 -> 22 | O851: 6 | P851: 11 | Q851: =O851*6+P851 -> 47 | S851: WRIGHT
A852: BEST PLAYERS | W852: TEAM | X852: W | Y852: L | Z852: D | AA852: FOR | AB852: AGST | AC852: % | AD852: PTS
A853: COBURG | C853: WILSON | E853: TITUS | H853: LONSDALE | K853: ROWE | N853: FYFFE | Q853: CREWTHER
A854: PRESTON | C854: BROOKS | E854: MASLEN | H854: NORMAN | K854: MINNEY | N854: ANDERSON | Q854: HARRIS | W854: COBURG | X854: 16 | Y854: 0 | Z854: 0 | AA854: 2019 | AB854: 1129 | AC854: =(AA854/AB854)*100 -> 178.83082373782108 | AD854: 64
A855: GOALKICKERS | W855: WILLIAMSTOWN | X855: 14 | Y855: 2 | Z855: 0 | AA855: 1980 | AB855: 1190 | AC855: =(AA855/AB855)*100 -> 166.38655462184875 | AD855: 56
A856: COBURG | C856: TITUS 6 | E856: FYFFE 2 | G856: LONSDALE 2 | J856: MILTE | L856: ROWE | N856: MARDEN | Q856: CREWTHER | W856: PORT MELBOURNE | X856: 11 | Y856: 5 | Z856: 0 | AA856: 1822 | AB856: 1359 | AC856: =(AA856/AB856)*100 -> 134.06916850625458 | AD856: 44
A857: PRESTON | C857: WALSH 2 | E857: UNCLES | G857: BOYD | I857: CONNELLY | L857: ANDERSON | W857: PRESTON | X857: 10 | Y857: 6 | Z857: 0 | AA857: 1441 | AB857: 1362 | AC857: =(AA857/AB857)*100 -> 105.80029368575623 | AD857: 40
A859: NORTHCOTE | C859: 2 | D859: 5 | E859: =C859*6+D859 -> 17 | G859: 4 | H859: 9 | I859: =G859*6+H859 -> 33 | K859: 8 | L859: 12 | M859: =K859*6+L859 -> 60 | O859: 9 | P859: 12 | Q859: =O859*6+P859 -> 66 | S859: NORTHCOTE | W859: CAMBERWELL | X859: 9 | Y859: 7 | Z859: 0 | AA859: 1502 | AB859: 1465 | AC859: =(AA859/AB859)*100 -> 102.52559726962458 | AD859: 36
A860: BRIGHTON | C860: 1 | D860: 1 | E860: =C860*6+D860 -> 7 | G860: 4 | H860: 4 | I860: =G860*6+H860 -> 28 | K860: 4 | L860: 5 | M860: =K860*6+L860 -> 29 | O860: 8 | P860: 5 | Q860: =O860*6+P860 -> 53 | S860: GREGORY | W860: NORTHCOTE | X860: 8 | Y860: 8 | Z860: 0 | AA860: 1397 | AB860: 1450 | AC860: =(AA860/AB860)*100 -> 96.34482758620689 | AD860: 32
A861: BEST PLAYERS | W861: BRUNSWICK | X861: 7 | Y861: 9 | Z861: 0 | AA861: 1476 | AB861: 1291 | AC861: =(AA861/AB861)*100 -> 114.32997676219985 | AD861: 28
A862: NORTHCOTE | C862: HOLDEN | F862: KINDER | H862: P OLVER | K862: BARKER | N862: ZBLESKI | Q862: STEIGENBERGER | W862: PRAHRAN | X862: 7 | Y862: 9 | Z862: 0 | AA862: 1565 | AB862: 1545 | AC862: =(AA862/AB862)*100 -> 101.29449838187703 | AD862: 28
A863: BRIGHTON | C863: McINDOE | F863: KING | H863: CROSS | K863: PICKETT | N863: NUTTER | Q863: CARROLL | W863: BRIGHTON | X863: 7 | Y863: 9 | Z863: 0 | AA863: 1283 | AB863: 1632 | AC863: =(AA863/AB863)*100 -> 78.615196078431367 | AD863: 28
A864: GOALKICKERS | W864: YARRAVILLE | X864: 4 | Y864: 12 | Z864: 0 | AA864: 1465 | AB864: 1717 | AC864: =(AA864/AB864)*100 -> 85.323238206173556 | AD864: 16
A865: NORTHCOTE | C865: P OLVER 3 | F865: JONES 2 | H865: GALE | J865: RUSH | L865: STAFFORD | O865: POLGLASE | W865: SANDRINGHAM | X865: 2 | Y865: 14 | Z865: 0 | AA865: 1183 | AB865: 1965 | AC865: =(AA865/AB865)*100 -> 60.203562340966918 | AD865: 8
A866: BRIGHTON | C866: McINDOE 3 | F866: KING 2 | H866: NUTTER | J866: CARROLL | L866: PAGE | W866: OAKLEIGH | X866: 1 | Y866: 15 | Z866: 0 | AA866: 905 | AB866: 1918 | AC866: =(AA866/AB866)*100 -> 47.184567257559955 | AD866: 4
A868: PRAHRAN | C868: 2 | D868: 6 | E868: =C868*6+D868 -> 18 | G868: 4 | H868: 6 | I868: =G868*6+H868 -> 30 | K868: 10 | L868: 10 | M868: =K868*6+L868 -> 70 | O868: 13 | P868: 11 | Q868: =O868*6+P868 -> 89 | S868: TOORAK PARK
A869: BRUNSWICK | C869: 3 | D869: 1 | E869: =C869*6+D869 -> 19 | G869: 7 | H869: 5 | I869: =G869*6+H869 -> 47 | K869: 9 | L869: 7 | M869: =K869*6+L869 -> 61 | O869: 12 | P869: 14 | Q869: =O869*6+P869 -> 86 | S869: BARNES
A870: BEST PLAYERS
A871: PRAHRAN | C871: BENNISON | F871: WHITE | I871: McMAHON | L871: STACKPOLE | O871: CAMM | Q871: GARDINER
A872: BRUNSWICK | C872: GLASSCOTT | F872: COLLICOAT | I872: BLACKMORE | L872: HOGAN | O872: FARRELL | Q872: BAKER
A873: GOALKICKERS
A874: PRAHRAN | C874: STACKPOLE 4 | F874: McMAHON 3 | I874: ADAMS 2 | L874: O'DONNELL | O874: D'OLIVER | Q874: ROLFE | S874: CULLEN
A875: BRUNSWICK | C875: BLACKMORE 3 | F875: HAOGAN 3 | I875: JEFFREY 2 | L875: COLLICOAT 2 | O875: CASEY | Q875: HUGHES
A877: CAMBERWELL | C877: 2 | D877: 4 | E877: =C877*6+D877 -> 16 | G877: 9 | H877: 6 | I877: =G877*6+H877 -> 60 | K877: 9 | L877: 10 | M877: =K877*6+L877 -> 64 | O877: 15 | P877: 13 | Q877: =O877*6+P877 -> 103 | S877: BEACH ROAD
A878: SANDRINGHAM | C878: 1 | D878: 5 | E878: =C878*6+D878 -> 11 | G878: 2 | H878: 7 | I878: =G878*6+H878 -> 19 | K878: 7 | L878: 12 | M878: =K878*6+L878 -> 54 | O878: 10 | P878: 14 | Q878: =O878*6+P878 -> 74 | S878: MOORE
A879: BEST PLAYERS
A880: CAMBERWELL | C880: BOYALL | F880: TAYLOR | I880: BRADFORD | L880: ELLIOTT | O880: JORGENSON | R880: SHIELDS
A881: SANDRINGHAM | C881: BENCRAFT | F881: EVANS | I881: REID | L881: O'TOOLE | O881: STAMMERS | R881: HOLMES
A882: GOALKICKERS
A883: CAMBERWELL | C883: ELLIOTT 3 | F883: OLIVER 3 | I883: SHIELDS 2 | L883: JENSON 2 | N883: BRADFORD 2 | Q883: GRIFFEN 2 | T883: HARLAND
A884: SANDRINGHAM | C884: HOLMES 4 | F884: BENNETT 2 | I884: LUCAS | K884: MOLONEY | M884: BENCRAFT | P884: MIDDLETON
A886: PORT MELBOURNE | C886: 6 | D886: 9 | E886: =C886*6+D886 -> 45 | G886: 10 | H886: 12 | I886: =G886*6+H886 -> 72 | K886: 18 | L886: 20 | M886: =K886*6+L886 -> 128 | O886: 20 | P886: 21 | Q886: =O886*6+P886 -> 141 | S886: YARRAVILLE
A887: YARRAVILLE | C887: 1 | D887: 0 | E887: =C887*6+D887 -> 6 | G887: 4 | H887: 5 | I887: =G887*6+H887 -> 29 | K887: 4 | L887: 5 | M887: =K887*6+L887 -> 29 | O887: 7 | P887: 10 | Q887: =O887*6+P887 -> 52 | S887: MERRINGTON
A888: BEST PLAYERS
A889: PORT MELBOURNE | C889: HOUSTEN | F889: TAYLOR | I889: LEWIS | L889: GOLDSMITH | O889: CULPH | Q889: SEARLE
A890: YARRAVILLE | C890: GARLICK | F890: ELLIS | I890: SORRAGHAN | L890: UBERGANG | O890: KNIGHT | Q890: CASELEY
A891: GOALKICKERS
A892: PORT MELBOURNE | C892: LEWIS 5 | E892: CULPH 4 | G892: HOUSTEN 3 | J892: TAYLOR 3 | M892: FLETCHER 2 | P892: LAHIFF 2 | R892: CRAWSHAW
A893: YARRAVILLE | C893: CASELY 2 | E893: BELL 2 | G893: PERUSSICH | J893: SORRAGHAN | M893: HALE
A895: WILLIAMSTOWN | C895: 7 | D895: 9 | E895: =C895*6+D895 -> 51 | G895: 12 | H895: 10 | I895: =G895*6+H895 -> 82 | K895: 17 | L895: 14 | M895: =K895*6+L895 -> 116 | O895: 22 | P895: 16 | Q895: =O895*6+P895 -> 148 | S895: WILLIAMSTOWN
A896: OAKLEIGH | C896: 0 | D896: 0 | E896: =C896*6+D896 -> 0 | G896: 1 | H896: 2 | I896: =G896*6+H896 -> 8 | K896: 2 | L896: 4 | M896: =K896*6+L896 -> 16 | O896: 2 | P896: 5 | Q896: =O896*6+P896 -> 17 | S896: THOMAS
A897: BEST PLAYERS
A898: WILLIAMSTOWN | C898: CHISHOLM | F898: WILCOX | I898: MATTHEWS | L898: TODD | O898: HARRIS | R898: HARLEY
A899: OAKLEIGH | C899: WILLIAMS | F899: MUDGE | I899: BELL | L899: GILBERT | O899: THOMPSON | R899: D JANE
A900: GOALKICKERS
A901: WILLIAMSTOWN | C901: TODD 13 | F901: HARRIS 7 | I901: HEARN | K901: SPRING
A902: OAKLEIGH | C902: NAISMITH | G902: HORNE
A904: ROUND 17 | D904: 4TH AUGUST | J904: WEATHER | M904: GROUNDS HEAVY AFTER RAIN | S904: PLAYED AT
D905: 1ST QTR | H905: 2ND QTR | L905: 3RD QTR | P905: FINAL | S905: BRUNSWICK
A906: PORT MELBOURNE | C906: 5 | D906: 6 | E906: =C906*6+D906 -> 36 | G906: 8 | H906: 11 | I906: =G906*6+H906 -> 59 | K906: 12 | L906: 16 | M906: =K906*6+L906 -> 88 | O906: 18 | P906: 18 | Q906: =O906*6+P906 -> 126 | S906: UMPIRE | X906: LADDER | AB906: ROUND | AD906: 17
A907: NORTHCOTE | C907: 0 | D907: 1 | E907: =C907*6+D907 -> 1 | G907: 1 | H907: 4 | I907: =G907*6+H907 -> 10 | K907: 4 | L907: 7 | M907: =K907*6+L907 -> 31 | O907: 7 | P907: 9 | Q907: =O907*6+P907 -> 51 | S907: WRIGHT
A908: BEST PLAYERS | W908: TEAM | X908: W | Y908: L | Z908: D | AA908: FOR | AB908: AGST | AC908: % | AD908: PTS
A909: PORT MELBOURNE | C909: McBETH | F909: HOUSTEN | I909: LAHIFF | K909: JULIER | N909: STOREY | Q909: TAYLOR
A910: NORTHCOTE | C910: McINTOSH | F910: KINDER | I910: RUSH | K910: STAFFORD | N910: HOLDEN | Q910: H OLVER | W910: COBURG | X910: 17 | Y910: 0 | Z910: 0 | AA910: 2128 | AB910: 1159 | AC910: =(AA910/AB910)*100 -> 183.60655737704917 | AD910: 68
A911: GOALKICKERS | W911: WILLIAMSTOWN | X911: 15 | Y911: 2 | Z911: 0 | AA911: 2112 | AB911: 1270 | AC911: =(AA911/AB911)*100 -> 166.29921259842519 | AD911: 60
A912: PORT MELBOURNE | C912: LAHIFF 7 | F912: HOUSTEN 5 | I912: CULPH 3 | K912: TAYLOR | M912: LEWIS | O912: FLETCHER | W912: PORT MELBOURNE | X912: 12 | Y912: 5 | Z912: 0 | AA912: 1948 | AB912: 1410 | AC912: =(AA912/AB912)*100 -> 138.15602836879432 | AD912: 48
A913: NORTHCOTE | C913: POLGLASE 2 | F913: RUSH 2 | H913: ZBLESKI | J913: KINDER | L913: WEGNER | W913: CAMBERWELL | X913: 10 | Y913: 7 | Z913: 0 | AA913: 1619 | AB913: 1534 | AC913: =(AA913/AB913)*100 -> 105.54106910039114 | AD913: 40
A915: BRIGHTON | C915: 4 | D915: 1 | E915: =C915*6+D915 -> 25 | G915: 7 | H915: 7 | I915: =G915*6+H915 -> 49 | K915: 11 | L915: 9 | M915: =K915*6+L915 -> 75 | O915: 16 | P915: 10 | Q915: =O915*6+P915 -> 106 | S915: ELSTERNWICK PARK | W915: PRESTON | X915: 10 | Y915: 7 | Z915: 0 | AA915: 1539 | AB915: 1468 | AC915: =(AA915/AB915)*100 -> 104.83651226158037 | AD915: 40
A916: PRESTON | C916: 6 | D916: 3 | E916: =C916*6+D916 -> 39 | G916: 10 | H916: 4 | I916: =G916*6+H916 -> 64 | K916: 12 | L916: 7 | M916: =K916*6+L916 -> 79 | O916: 15 | P916: 8 | Q916: =O916*6+P916 -> 98 | S916: MERRINGTON | W916: PRAHRAN | X916: 8 | Y916: 9 | Z916: 0 | AA916: 1715 | AB916: 1683 | AC916: =(AA916/AB916)*100 -> 101.90136660724896 | AD916: 32
A917: BEST PLAYERS | W917: NORTHCOTE | X917: 8 | Y917: 9 | Z917: 0 | AA917: 1448 | AB917: 1576 | AC917: =(AA917/AB917)*100 -> 91.878172588832484 | AD917: 32
A918: BRIGHTON | C918: McINDOE | F918: ARKINSTAL | I918: WILLIAMSON | L918: BAILEY | O918: KEMP | Q918: WHITE | W918: BRIGHTON | X918: 8 | Y918: 9 | Z918: 0 | AA918: 1389 | AB918: 1730 | AC918: =(AA918/AB918)*100 -> 80.289017341040463 | AD918: 32
A919: PRESTON | C919: MASLEN | F919: McCARTHY | I919: HARRIS | L919: CONNELLY | O919: WALSH | Q919: BOYD | W919: BRUNSWICK | X919: 7 | Y919: 10 | Z919: 0 | AA919: 1556 | AB919: 1423 | AC919: =(AA919/AB919)*100 -> 109.34645115952213 | AD919: 28
A920: GOALKICKERS | W920: YARRAVILLE | X920: 4 | Y920: 13 | Z920: 0 | AA920: 1534 | AB920: 1836 | AC920: =(AA920/AB920)*100 -> 83.5511982570806 | AD920: 16
A921: BRIGHTON | C921: McINDOE 4 | F921: DOREY 4 | I921: ALVIN 3 | K921: ARKINSTAL 2 | N921: CARROLL | P921: PICKETT | R921: CHESTER | W921: SANDRINGHAM | X921: 2 | Y921: 15 | Z921: 0 | AA921: 1213 | AB921: 2074 | AC921: =(AA921/AB921)*100 -> 58.486017357762776 | AD921: 8
A922: PRESTON | C922: CONNELLY 5 | F922: McCARTHY 3 | I922: BOYD 2 | K922: DUGGAN 2 | N922: HENRY | P922: NORMAN | R922: WALSH | W922: OAKLEIGH | X922: 1 | Y922: 16 | Z922: 0 | AA922: 1043 | AB922: 2068 | AC922: =(AA922/AB922)*100 -> 50.435203094777556 | AD922: 4
A924: PRAHRAN | C924: 7 | D924: 3 | E924: =C924*6+D924 -> 45 | G924: 16 | H924: 6 | I924: =G924*6+H924 -> 102 | K924: 18 | L924: 15 | M924: =K924*6+L924 -> 123 | O924: 22 | P924: 18 | Q924: =O924*6+P924 -> 150 | S924: OAKLEIGH
A925: OAKLEIGH | C925: 4 | D925: 0 | E925: =C925*6+D925 -> 24 | G925: 8 | H925: 4 | I925: =G925*6+H925 -> 52 | K925: 15 | L925: 10 | M925: =K925*6+L925 -> 100 | O925: 21 | P925: 12 | Q925: =O925*6+P925 -> 138 | S925: THOMAS
A926: BEST PLAYERS
A927: PRAHRAN | C927: STACKPOLE | F927: WHITE | I927: D'OLIVER | L927: ROLFE | N927: BATES | Q927: CULLEN
A928: OAKLEIGH | C928: NAISMITH | F928: BEARD | I928: WORRALL | L928: WILLIAMS | N928: FINN | Q928: D JANE
A929: GOALKICKERS
A930: PRAHRAN | C930: STACKPOLE 7 | F930: WHITE 4 | I930: ADAMS 4 | K930: CULLEN 3 | M930: D'OLIVER 2 | P930: MIGUEL | R930: O'DONNELL
A931: OAKLEIGH | C931: NAISMITH 12 | F931: WORRALL 2 | I931: HORNE 2 | K931: BEARD 2 | M931: MUDGE | O931: KITCHEN | Q931: D RYAN
A933: CAMBERWELL | C933: 4 | D933: 5 | E933: =C933*6+D933 -> 29 | G933: 7 | H933: 11 | I933: =G933*6+H933 -> 53 | K933: 12 | L933: 20 | M933: =K933*6+L933 -> 92 | O933: 16 | P933: 21 | Q933: =O933*6+P933 -> 117 | S933: CAMBERWELL
A934: YARRAVILLE | C934: 2 | D934: 2 | E934: =C934*6+D934 -> 14 | G934: 6 | H934: 4 | I934: =G934*6+H934 -> 40 | K934: 7 | L934: 5 | M934: =K934*6+L934 -> 47 | O934: 10 | P934: 9 | Q934: =O934*6+P934 -> 69 | S934: GREGORY
A935: BEST PLAYERS
A936: CAMBERWELL | C936: JORGENSON | F936: JENSON | I936: BRADFORD | L936: McDONALD | N936: TAYLOR | Q936: BOYALL
A937: YARRAVILLE | C937: GARLICK | F937: DAY | I937: BROWN | L937: WHITE | N937: ELLIS | Q937: BELL
A938: GOALKICKERS
A939: CAMBERWELL | C939: ELLIOTT 4 | F939: BRADFORD 3 | I939: OLIVER 3 | K939: JENSON 3 | M939: DINEEN 2 | O939: SHIELDS
A940: YARRAVILLE | C940: CASELY 4 | F940: BELL 2 | H940: McDONALD | K940: SMITH | M940: KNIGHT | O940: H RUDDELL
E941: 11TH AUGUST | J941: WEATHER | M941: FINE SOUTH WEST WIND
A942: COBURG | C942: 2 | D942: 4 | E942: =C942*6+D942 -> 16 | G942: 6 | H942: 9 | I942: =G942*6+H942 -> 45 | K942: 9 | L942: 15 | M942: =K942*6+L942 -> 69 | O942: 15 | P942: 19 | Q942: =O942*6+P942 -> 109 | S942: BEACH ROAD
A943: SANDRINGHAM | C943: 1 | D943: 1 | E943: =C943*6+D943 -> 7 | G943: 1 | H943: 1 | I943: =G943*6+H943 -> 7 | K943: 2 | L943: 3 | M943: =K943*6+L943 -> 15 | O943: 4 | P943: 6 | Q943: =O943*6+P943 -> 30 | S943: GREGORY
A944: BEST PLAYERS
A945: COBURG | C945: ROWE | F945: CREWTHER | I945: PROMNITZ | L945: R ATKINSON | O945: MARDEN | Q945: CONDON
A946: SANDRINGHAM | C946: J MILLER | F946: BENCRAFT | I946: O'TOOLE | L946: BENNETT | O946: GRIEVES | Q946: BECK
A947: GOALKICKERS
A948: COBURG | C948: TITUS 6 | F948: LONSDALE 4 | I948: ROWE 2 | K948: CONDON | M948: PERRIN | O948: FYFFE
A949: SANDRINGHAM | C949: REYNOLDS 2 | G949: BENCRAFT | J949: BENNETT
E950: 18TH AUGUST | J950: WEATHER | M950: FINE
A951: WILLIAMSTOWN | C951: 5 | D951: 3 | E951: =C951*6+D951 -> 33 | G951: 11 | H951: 4 | I951: =G951*6+H951 -> 70 | K951: 12 | L951: 11 | M951: =K951*6+L951 -> 83 | O951: 20 | P951: 12 | Q951: =O951*6+P951 -> 132 | S951: BRUNSWICK
A952: BRUNSWICK | C952: 3 | D952: 7 | E952: =C952*6+D952 -> 25 | G952: 6 | H952: 8 | I952: =G952*6+H952 -> 44 | K952: 7 | L952: 11 | M952: =K952*6+L952 -> 53 | O952: 10 | P952: 20 | Q952: =O952*6+P952 -> 80 | S952: VINE
A953: BEST PLAYERS
A954: WILLIAMSTOWN | C954: MATTHEWS | F954: HARLEY | I954: ARCHIBALD | L954: COCKBURN | O954: SPRING | Q954: SCARFFE
A955: BRUNSWICK | C955: SILK | F955: JEFFREY | I955: EVANS | L955: STANDFIELD | O955: MANN | Q955: PLUMMER
A956: GOALKICKERS
A957: WILLIAMSTOWN | C957: TODD 6 | E957: HARRIS 5 | G957: DOWLING 3 | J957: MATTHEWS 2 | M957: GLASS | O957: SCARFFE | Q957: COCKBURN | T957: HEARN
A958: BRUNSWICK | C958: MANN 3 | E958: HOGAN 3 | G958: BAKER | I958: COLLICOAT | L958: HUGHES | N958: BRYDEN
A960: ROUND 18 | D960: 11TH AUGUST | J960: WEATHER | M960: FINE SOUTH WEST WIND | S960: PLAYED AT
D961: 1ST QTR | H961: 2ND QTR | L961: 3RD QTR | P961: FINAL | S961: WILLIAMSTOWN
A962: WILLIAMSTOWN | C962: 4 | D962: 2 | E962: =C962*6+D962 -> 26 | G962: 10 | H962: 6 | I962: =G962*6+H962 -> 66 | K962: 13 | L962: 7 | M962: =K962*6+L962 -> 85 | O962: 24 | P962: 14 | Q962: =O962*6+P962 -> 158 | S962: UMPIRE | X962: LADDER | AB962: ROUND | AD962: 18
A963: CAMBERWELL | C963: 3 | D963: 5 | E963: =C963*6+D963 -> 23 | G963: 5 | H963: 6 | I963: =G963*6+H963 -> 36 | K963: 9 | L963: 11 | M963: =K963*6+L963 -> 65 | O963: 12 | P963: 13 | Q963: =O963*6+P963 -> 85 | S963: BARNES
A964: BEST PLAYERS | W964: TEAM | X964: W | Y964: L | Z964: D | AA964: FOR | AB964: AGST | AC964: % | AD964: PTS
A965: WILLIAMSTOWN | C965: FEATHERBY | F965: DOWLING | I965: HARLEY | L965: COCKBURN | O965: MATTHEWS | R965: TEASDALE
A966: CAMBERWELL | C966: BOYALL | F966: DINEEN | I966: BRADFORD | L966: CAMPBELL | O966: SHIELDS | R966: OLIVER | W966: COBURG | X966: 18 | Y966: 0 | Z966: 0 | AA966: 2299 | AB966: 1236 | AC966: =(AA966/AB966)*100 -> 186.0032362459547 | AD966: 72
A967: GOALKICKERS | W967: WILLIAMSTOWN | X967: 16 | Y967: 2 | Z967: 0 | AA967: 2270 | AB967: 1355 | AC967: =(AA967/AB967)*100 -> 167.52767527675277 | AD967: 64
A968: WILLIAMSTOWN | C968: TODD 10 | E968: HARRIS 8 | G968: DOWLING 2 | J968: SCARFFE 2 | M968: MATTHEWS | P968: SPRING | W968: PORT MELBOURNE | X968: 13 | Y968: 5 | Z968: 0 | AA968: 2087 | AB968: 1475 | AC968: =(AA968/AB968)*100 -> 141.4915254237288 | AD968: 52
A969: CAMBERWELL | C969: BRADFORD 3 | F969: DINEEN 2 | I969: OLIVER 2 | K969: CAMPBELL 2 | N969: ELLIOTT | P969: BOYALL | R969: McDONALD | W969: PRESTON | X969: 11 | Y969: 7 | Z969: 0 | AA969: 1607 | AB969: 1528 | AC969: =(AA969/AB969)*100 -> 105.17015706806284 | AD969: 44
A971: PRESTON | C971: 2 | D971: 2 | E971: =C971*6+D971 -> 14 | G971: 5 | H971: 3 | I971: =G971*6+H971 -> 33 | K971: 8 | L971: 7 | M971: =K971*6+L971 -> 55 | O971: 10 | P971: 8 | Q971: =O971*6+P971 -> 68 | S971: PRESTON | W971: CAMBERWELL | X971: 10 | Y971: 8 | Z971: 0 | AA971: 1704 | AB971: 1692 | AC971: =(AA971/AB971)*100 -> 100.70921985815602 | AD971: 40
A972: BRUNSWICK | C972: 0 | D972: 0 | E972: =C972*6+D972 -> 0 | G972: 4 | H972: 2 | I972: =G972*6+H972 -> 26 | K972: 6 | L972: 4 | M972: =K972*6+L972 -> 40 | O972: 8 | P972: 12 | Q972: =O972*6+P972 -> 60 | S972: THOMAS | W972: PRAHRAN | X972: 9 | Y972: 9 | Z972: 0 | AA972: 1854 | AB972: 1800 | AC972: =(AA972/AB972)*100 -> 103 | AD972: 36
A973: BEST PLAYERS | W973: NORTHCOTE | X973: 9 | Y973: 9 | Z973: 0 | AA973: 1551 | AB973: 1643 | AC973: =(AA973/AB973)*100 -> 94.400486914181386 | AD973: 36
A974: PRESTON | C974: MASLEN | F974: CONNELLY | I974: ANDERSON | L974: MINNEY | N974: DUGGAN | Q974: BROOKS | W974: BRIGHTON | X974: 8 | Y974: 10 | Z974: 0 | AA974: 1454 | AB974: 1869 | AC974: =(AA974/AB974)*100 -> 77.795612627073297 | AD974: 32
A975: BRUNSWICK | C975: JESSOP | F975: STANDFIELD | I975: GEISLER | L975: PLUMMER | N975: COLLICOAT | Q975: BLACKMORE | W975: BRUNSWICK | X975: 7 | Y975: 11 | Z975: 0 | AA975: 1616 | AB975: 1491 | AC975: =(AA975/AB975)*100 -> 108.38363514419854 | AD975: 28
A976: GOALKICKERS | W976: YARRAVILLE | X976: 4 | Y976: 14 | Z976: 0 | AA976: 1601 | AB976: 1937 | AC976: =(AA976/AB976)*100 -> 82.653588022715539 | AD976: 16
A977: PRESTON | C977: DUGGAN 3 | F977: CONNELLY 3 | I977: WALSH 2 | K977: DELLER | M977: NORMAN | W977: SANDRINGHAM | X977: 2 | Y977: 16 | Z977: 0 | AA977: 1330 | AB977: 2213 | AC977: =(AA977/AB977)*100 -> 60.099412562132848 | AD977: 8
A978: BRUNSWICK | C978: BLACKMORE 5 | F978: MANN | H978: HOGAN | J978: STANDFIELD | W978: OAKLEIGH | X978: 1 | Y978: 17 | Z978: 0 | AA978: 1120 | AB978: 2239 | AC978: =(AA978/AB978)*100 -> 50.022331397945507 | AD978: 4
A980: NORTHCOTE | C980: 7 | D980: 4 | E980: =C980*6+D980 -> 46 | G980: 11 | H980: 6 | I980: =G980*6+H980 -> 72 | K980: 12 | L980: 10 | M980: =K980*6+L980 -> 82 | O980: 15 | P980: 13 | Q980: =O980*6+P980 -> 103 | S980: YARRAVILLE
A981: YARRAVILLE | C981: 1 | D981: 2 | E981: =C981*6+D981 -> 8 | G981: 3 | H981: 6 | I981: =G981*6+H981 -> 24 | K981: 4 | L981: 9 | M981: =K981*6+L981 -> 33 | O981: 9 | P981: 13 | Q981: =O981*6+P981 -> 67 | S981: WHITE
A982: BEST PLAYERS
A983: NORTHCOTE | C983: CARNEY | F983: HOLDEN | I983: McINTOSH | L983: BARKER | O983: WEGNER | R983: KINDER
A984: YARRAVILLE | C984: GARLICK | F984: BELL | I984: WOODS | L984: ELLIS | O984: SMITH | R984: PERUSSICH
A985: GOALKICKERS
A986: NORTHCOTE | C986: CARNEY 4 | F986: KINDER 3 | I986: McINTOSH 3 | L986: P OLVER 2 | N986: ZBLESKI 2 | Q986: MOORE
A987: YARRAVILLE | C987: CASELY 3 | F987: McDONALD 2 | I987: THOMAS 2 | L987: H RUDDELL | O987: LEWIS
E988: 18TH AUGUST | J988: WEATHER | M988: FINE
A989: PORT MELBOURNE | C989: 6 | D989: 3 | E989: =C989*6+D989 -> 39 | G989: 8 | H989: 5 | I989: =G989*6+H989 -> 53 | K989: 14 | L989: 17 | M989: =K989*6+L989 -> 101 | O989: 20 | P989: 19 | Q989: =O989*6+P989 -> 139 | S989: PORT MELBOURNE
A990: BRIGHTON | C990: 1 | D990: 1 | E990: =C990*6+D990 -> 7 | G990: 3 | H990: 6 | I990: =G990*6+H990 -> 24 | K990: 5 | L990: 9 | M990: =K990*6+L990 -> 39 | O990: 9 | P990: 11 | Q990: =O990*6+P990 -> 65 | S990: MERRINGTON
A991: BEST PLAYERS
A992: PORT MELBOURNE | C992: LEWIS | F992: HOUSTEN | I992: TAYLOR | L992: CULPH | O992: REYNOLDS | R992: KIMBERLEY
A993: BRIGHTON | C993: CROSS | F993: HALCOMBE | I993: DOREY | L993: McINDOE | O993: KING | R993: WILLIAMS
A994: GOALKICKERS
A995: PORT MELBOURNE | C995: CULPH 7 | E995: TAYLOR 3 | G995: LEWIS 3 | I995: CRAWSHAW 2 | L995: REYNOLDS 2 | O995: HOUSTEN 2 | R995: LAHIFF
A996: BRIGHTON | C996: McINDOE 2 | F996: ALVIN 2 | I996: WILLIAMS | K996: KING | M996: PICKETT | O996: ARKINSTAL | R996: ELLIS
A998: PRAHRAN | C998: 4 | D998: 5 | E998: =C998*6+D998 -> 29 | G998: 9 | H998: 12 | I998: =G998*6+H998 -> 66 | K998: 12 | L998: 19 | M998: =K998*6+L998 -> 91 | O998: 19 | P998: 25 | Q998: =O998*6+P998 -> 139 | S998: TOORAK PARK
A999: SANDRINGHAM | C999: 6 | D999: 0 | E999: =C999*6+D999 -> 36 | G999: 9 | H999: 1 | I999: =G999*6+H999 -> 55 | K999: 16 | L999: 7 | M999: =K999*6+L999 -> 103 | O999: 18 | P999: 9 | Q999: =O999*6+P999 -> 117 | S999: BARNES
A1000: BEST PLAYERS
A1001: PRAHRAN | C1001: O'DONNELL | F1001: ADAMS | I1001: WHITE | K1001: STACKPOLE | N1001: GARDINER | Q1001: CULLEN
A1002: SANDRINGHAM | C1002: RAY | F1002: MOLONEY | I1002: J MILLER | K1002: BENCRAFT | N1002: SLEIGH | Q1002: MIDDLETON
A1003: GOALKICKERS
A1004: PRAHRAN | C1004: STACKPOLE 7 | F1004: ADAMS 4 | I1004: ROLFE 2 | K1004: GRACIE 2 | M1004: WHITE | O1004: CULLEN | Q1004: NORRIS | S1004: D'OLIVER
A1005: SANDRINGHAM | C1005: BENCRAFT 4 | F1005: MOLONEY 3 | I1005: BENNETT 3 | L1005: HOLMES 3 | N1005: SLEIGH 2 | P1005: MIDDLETON | S1005: POLE | U1005: REYNOLDS
A1007: COBURG | C1007: 6 | D1007: 4 | E1007: =C1007*6+D1007 -> 40 | G1007: 13 | H1007: 14 | I1007: =G1007*6+H1007 -> 92 | K1007: 18 | L1007: 17 | M1007: =K1007*6+L1007 -> 125 | O1007: 24 | P1007: 27 | Q1007: =O1007*6+P1007 -> 171 | S1007: COBURG
A1008: OAKLEIGH | C1008: 3 | D1008: 3 | E1008: =C1008*6+D1008 -> 21 | G1008: 5 | H1008: 5 | I1008: =G1008*6+H1008 -> 35 | K1008: 8 | L1008: 9 | M1008: =K1008*6+L1008 -> 57 | O1008: 11 | P1008: 11 | Q1008: =O1008*6+P1008 -> 77 | S1008: WRIGHT
A1009: BEST PLAYERS
A1010: COBURG | C1010: ROWE | F1010: WILSON | I1010: ENGELEENER | L1010: KENNEDY | O1010: LONSDALE | R1010: MILTE
A1011: OAKLEIGH | C1011: NAISMITH | F1011: SEPHTON | I1011: WILLIAMS | L1011: VEALE | O1011: D RYAN | R1011: HORNE
A1012: GOALKICKERS
A1013: COBURG | C1013: FYFFE 6 | E1013: TITUS 5 | G1013: ROWE 3 | I1013: CONDON 3 | K1013: PERRIN 2 | M1013: LONSDALE 2 | P1013: STARBUCK | R1013: MILTE | T1013: DAY
A1014: OAKLEIGH | C1014: McKENZIE 4 | F1014: NAISMITH 3 | I1014: WORRALL 2 | L1014: BEARD | N1014: HORNE
A1016: ROUND 19 | E1016: 25TH AUGUST | J1016: WEATHER | M1016: COLD SHOWERS S.W. WIND | S1016: PLAYED AT
D1017: 1ST QTR | H1017: 2ND QTR | L1017: 3RD QTR | P1017: FINAL | S1017: NORTHCOTE
A1018: WILLIAMSTOWN | C1018: 1 | D1018: 3 | E1018: =C1018*6+D1018 -> 9 | G1018: 4 | H1018: 8 | I1018: =G1018*6+H1018 -> 32 | K1018: 8 | L1018: 13 | M1018: =K1018*6+L1018 -> 61 | O1018: 13 | P1018: 17 | Q1018: =O1018*6+P1018 -> 95 | S1018: UMPIRE | X1018: LADDER | AB1018: ROUND | AD1018: 19
A1019: NORTHCOTE | C1019: 5 | D1019: 3 | E1019: =C1019*6+D1019 -> 33 | G1019: 6 | H1019: 7 | I1019: =G1019*6+H1019 -> 43 | K1019: 8 | L1019: 10 | M1019: =K1019*6+L1019 -> 58 | O1019: 10 | P1019: 8 | Q1019: =O1019*6+P1019 -> 68 | S1019: WRIGHT
A1020: BEST PLAYERS | W1020: TEAM | X1020: W | Y1020: L | Z1020: D | AA1020: FOR | AB1020: AGST | AC1020: % | AD1020: PTS
A1021: WILLIAMSTOWN | C1021: TODD | F1021: WILCOX | I1021: HARLEY | L1021: SCARFFE | O1021: SPRING | Q1021: TEASDALE
A1022: NORTHCOTE | C1022: McINTOSH | F1022: CARNEY | I1022: BAKER | L1022: RUSH | O1022: HOLDEN | Q1022: STEIGENBERGER | W1022: COBURG | X1022: 19 | Y1022: 0 | Z1022: 0 | AA1022: 2405 | AB1022: 1274 | AC1022: =(AA1022/AB1022)*100 -> 188.77551020408163 | AD1022: 76
A1023: GOALKICKERS | W1023: WILLIAMSTOWN | X1023: 17 | Y1023: 2 | Z1023: 0 | AA1023: 2365 | AB1023: 1423 | AC1023: =(AA1023/AB1023)*100 -> 166.1981728742094 | AD1023: 68
A1024: WILLIAMSTOWN | C1024: TODD 9 | F1024: DOWLING 2 | I1024: SPRING | K1024: HARRIS | W1024: PORT MELBOURNE | X1024: 14 | Y1024: 5 | Z1024: 0 | AA1024: 2183 | AB1024: 1548 | AC1024: =(AA1024/AB1024)*100 -> 141.02067183462532 | AD1024: 56
A1025: NORTHCOTE | C1025: CARNEY 2 | F1025: RUSH 2 | H1025: McINTOSH | J1025: POLGLASE | M1025: DOWER | O1025: P OLVER | Q1025: ZBLESKI | W1025: PRESTON | X1025: 11 | Y1025: 8 | Z1025: 0 | AA1025: 1692 | AB1025: 1640 | AC1025: =(AA1025/AB1025)*100 -> 103.17073170731707 | AD1025: 44
A1027: CAMBERWELL | C1027: 5 | D1027: 2 | E1027: =C1027*6+D1027 -> 32 | G1027: 7 | H1027: 6 | I1027: =G1027*6+H1027 -> 48 | K1027: 10 | L1027: 10 | M1027: =K1027*6+L1027 -> 70 | O1027: 16 | P1027: 16 | Q1027: =O1027*6+P1027 -> 112 | S1027: CAMBERWELL | W1027: CAMBERWELL | X1027: 11 | Y1027: 8 | Z1027: 0 | AA1027: 1816 | AB1027: 1777 | AC1027: =(AA1027/AB1027)*100 -> 102.19471018570626 | AD1027: 44
A1028: PRESTON | C1028: 2 | D1028: 3 | E1028: =C1028*6+D1028 -> 15 | G1028: 5 | H1028: 4 | I1028: =G1028*6+H1028 -> 34 | K1028: 10 | L1028: 6 | M1028: =K1028*6+L1028 -> 66 | O1028: 13 | P1028: 7 | Q1028: =O1028*6+P1028 -> 85 | S1028: MERRINGTON | W1028: PRAHRAN | X1028: 10 | Y1028: 9 | Z1028: 0 | AA1028: 1998 | AB1028: 1887 | AC1028: =(AA1028/AB1028)*100 -> 105.88235294117648 | AD1028: 40
A1029: BEST PLAYERS | W1029: NORTHCOTE | X1029: 9 | Y1029: 10 | Z1029: 0 | AA1029: 1619 | AB1029: 1738 | AC1029: =(AA1029/AB1029)*100 -> 93.153049482163411 | AD1029: 36
A1030: CAMBERWELL | C1030: OLIVER | F1030: CAMPBELL | I1030: DINEEN | L1030: COLLIER | N1030: HARLAND | Q1030: BRADFORD | W1030: BRIGHTON | X1030: 8 | Y1030: 11 | Z1030: 0 | AA1030: 1541 | AB1030: 2013 | AC1030: =(AA1030/AB1030)*100 -> 76.552409339294584 | AD1030: 32
A1031: PRESTON | C1031: BRADLEY | F1031: WALSH | I1031: ANDERSON | L1031: BROOKS | N1031: MASLEN | Q1031: GUTHRIE | W1031: BRUNSWICK | X1031: 7 | Y1031: 12 | Z1031: 0 | AA1031: 1712 | AB1031: 1622 | AC1031: =(AA1031/AB1031)*100 -> 105.54870530209617 | AD1031: 28
A1032: GOALKICKERS | W1032: YARRAVILLE | X1032: 4 | Y1032: 15 | Z1032: 0 | AA1032: 1639 | AB1032: 2044 | AC1032: =(AA1032/AB1032)*100 -> 80.185909980430523 | AD1032: 16
A1033: CAMBERWELL | C1033: DINEEN 5 | E1033: HARLAND 4 | H1033: BRADFORD 2 | K1033: JENSON 2 | M1033: McPHERSON | P1033: OLIVER | R1033: CAMPBELL | W1033: SANDRINGHAM | X1033: 2 | Y1033: 17 | Z1033: 0 | AA1033: 1403 | AB1033: 2309 | AC1033: =(AA1033/AB1033)*100 -> 60.762234733650935 | AD1033: 8
A1034: PRESTON | C1034: CONNELLY 3 | F1034: DUGGAN 2 | I1034: DELLER 2 | K1034: NORMAN 2 | N1034: EXELBY | P1034: WALSH | R1034: BOND | T1034: MINNEY | W1034: OAKLEIGH | X1034: 2 | Y1034: 17 | Z1034: 0 | AA1034: 1251 | AB1034: 2335 | AC1034: =(AA1034/AB1034)*100 -> 53.57601713062099 | AD1034: 8
E1035: 1ST SEPTEMBER | J1035: WEATHER | M1035: FINE
A1036: PRAHRAN | C1036: 8 | D1036: 4 | E1036: =C1036*6+D1036 -> 52 | G1036: 14 | H1036: 7 | I1036: =G1036*6+H1036 -> 91 | K1036: 19 | L1036: 10 | M1036: =K1036*6+L1036 -> 124 | O1036: 22 | P1036: 12 | Q1036: =O1036*6+P1036 -> 144 | S1036: TOORAK PARK
A1037: BRIGHTON | C1037: 5 | D1037: 4 | E1037: =C1037*6+D1037 -> 34 | G1037: 7 | H1037: 4 | I1037: =G1037*6+H1037 -> 46 | K1037: 9 | L1037: 9 | M1037: =K1037*6+L1037 -> 63 | O1037: 12 | P1037: 15 | Q1037: =O1037*6+P1037 -> 87 | S1037: THOMAS
A1038: BEST PLAYERS
A1039: PRAHRAN | C1039: WHITE | F1039: STACKPOLE | I1039: D'OLIVER | L1039: BATES | O1039: LAMBORN | R1039: SPARGO
A1040: BRIGHTON | C1040: O'KEEFE | F1040: McINDOE | I1040: STOREY | L1040: K WHITE | O1040: CROSS | R1040: KING
A1041: GOALKICKERS
A1042: PRAHRAN | C1042: STACKPOLE 10 | F1042: D'OLIVER 4 | I1042: ADAMS 2 | K1042: NORRIS | M1042: McLEAN | O1042: THOMAS | Q1042: WHITE | S1042: O'DONNELL | V1042: BATES
A1043: BRIGHTON | C1043: O'KEEFE 4 | F1043: ALVIN 4 | I1043: KING | K1043: McINDOE | M1043: V WHITE | O1043: ELLIS
A1045: COBURG | C1045: 4 | D1045: 2 | E1045: =C1045*6+D1045 -> 26 | G1045: 9 | H1045: 5 | I1045: =G1045*6+H1045 -> 59 | K1045: 14 | L1045: 9 | M1045: =K1045*6+L1045 -> 93 | O1045: 15 | P1045: 16 | Q1045: =O1045*6+P1045 -> 106 | S1045: COBURG
A1046: YARRAVILLE | C1046: 1 | D1046: 3 | E1046: =C1046*6+D1046 -> 9 | G1046: 2 | H1046: 4 | I1046: =G1046*6+H1046 -> 16 | K1046: 4 | L1046: 6 | M1046: =K1046*6+L1046 -> 30 | O1046: 5 | P1046: 8 | Q1046: =O1046*6+P1046 -> 38 | S1046: GREGORY
A1047: BEST PLAYERS
A1048: COBURG | C1048: R ATKINSON | F1048: ROWE | I1048: FYFFE | L1048: WILSON | O1048: KENNEDY | R1048: PROMNITZ
A1049: YARRAVILLE | C1049: GARLICK | F1049: GRAY | I1049: ELLIS | L1049: BELL | O1049: H RUDDELL | R1049: CAHILL
A1050: GOALKICKERS
A1051: COBURG | C1051: ROWE 5 | F1051: FYFFE 3 | H1051: PATERSON 2 | K1051: CREWTHER 2 | N1051: TITUS | P1051: MARDEN | R1051: LONSDALE
A1052: YARRAVILLE | C1052: THOMAS 2 | F1052: HALE | H1052: PERUSSICH | K1052: McDONALD
E1053: 8TH SEPTEMBER | J1053: WEATHER | M1053: FINE
A1054: PORT MELBOURNE | C1054: 1 | D1054: 1 | E1054: =C1054*6+D1054 -> 7 | G1054: 5 | H1054: 8 | I1054: =G1054*6+H1054 -> 38 | K1054: 10 | L1054: 13 | M1054: =K1054*6+L1054 -> 73 | O1054: 13 | P1054: 18 | Q1054: =O1054*6+P1054 -> 96 | S1054: BEACH ROAD
A1055: SANDRINGHAM | C1055: 3 | D1055: 1 | E1055: =C1055*6+D1055 -> 19 | G1055: 8 | H1055: 3 | I1055: =G1055*6+H1055 -> 51 | K1055: 10 | L1055: 5 | M1055: =K1055*6+L1055 -> 65 | O1055: 11 | P1055: 7 | Q1055: =O1055*6+P1055 -> 73 | S1055: GREGORY
A1056: BEST PLAYERS
A1057: PORT MELBOURNE | C1057: GOLDSMITH | F1057: KELSEY | I1057: LEWIS | L1057: TAYLOR | O1057: BAKER | Q1057: DOBSON
A1058: SANDRINGHAM | C1058: BENNETT | F1058: BENCRAFT | I1058: J MILLER | L1058: MULLENS | O1058: DAVIN | Q1058: GRIEVES
A1059: GOALKICKERS
A1060: PORT MELBOURNE | C1060: TAYLOR 4 | F1060: FLETCHER 2 | I1060: LEWIS 2 | K1060: CULPH 2 | M1060: REYNOLDS | O1060: HOUSTEN | Q1060: LAHIFF
A1061: SANDRINGHAM | C1061: HOLMES 3 | F1061: DAVIN 2 | I1061: SLEIGH 2 | K1061: BENCRAFT 2 | N1061: REYNOLDS | Q1061: MIDDLETON
A1063: OAKLEIGH | C1063: 1 | D1063: 6 | E1063: =C1063*6+D1063 -> 12 | G1063: 11 | H1063: 12 | I1063: =G1063*6+H1063 -> 78 | K1063: 13 | L1063: 14 | M1063: =K1063*6+L1063 -> 92 | O1063: 19 | P1063: 17 | Q1063: =O1063*6+P1063 -> 131 | S1063: OAKLEIGH
A1064: BRUNSWICK | C1064: 3 | D1064: 3 | E1064: =C1064*6+D1064 -> 21 | G1064: 4 | H1064: 4 | I1064: =G1064*6+H1064 -> 28 | K1064: 12 | L1064: 10 | M1064: =K1064*6+L1064 -> 82 | O1064: 13 | P1064: 18 | Q1064: =O1064*6+P1064 -> 96 | S1064: BARNES
A1065: BEST PLAYERS
A1066: OAKLEIGH | C1066: BEARD | E1066: MUDGE | H1066: NAISMITH | K1066: FINN | N1066: WORRALL | Q1066: WILLIAMS
A1067: BRUNSWICK | C1067: SILK | E1067: PLUMMER | H1067: NILSON | K1067: BAKER | N1067: HUGHES | Q1067: EVANS
A1068: GOALKICKERS
A1069: OAKLEIGH | C1069: NAISMITH 10 | F1069: FINN 3 | H1069: MUDGE 2 | J1069: HILL | L1069: WORRALL | N1069: KITCHEN | P1069: D JANE
A1070: BRUNSWICK | C1070: HOGAN 5 | F1070: BLACKMORE 4 | J1070: HUGHES 2 | M1070: BAKER | O1070: GLASSCOTT
A1072: ROUND 20 | E1072: 25TH AUGUST | J1072: WEATHER | M1072: COLD SHOWERS S.W. WIND | S1072: PLAYED AT
D1073: 1ST QTR | H1073: 2ND QTR | L1073: 3RD QTR | P1073: FINAL | S1073: BRUNSWICK
A1074: BRUNSWICK | C1074: 4 | D1074: 3 | E1074: =C1074*6+D1074 -> 27 | G1074: 6 | H1074: 4 | I1074: =G1074*6+H1074 -> 40 | K1074: 10 | L1074: 8 | M1074: =K1074*6+L1074 -> 68 | O1074: 14 | P1074: 11 | Q1074: =O1074*6+P1074 -> 95 | S1074: UMPIRE | X1074: LADDER | AB1074: ROUND | AD1074: 20
A1075: BRIGHTON | C1075: 1 | D1075: 0 | E1075: =C1075*6+D1075 -> 6 | G1075: 4 | H1075: 6 | I1075: =G1075*6+H1075 -> 30 | K1075: 6 | L1075: 7 | M1075: =K1075*6+L1075 -> 43 | O1075: 8 | P1075: 9 | Q1075: =O1075*6+P1075 -> 57 | S1075: BARNES
A1076: BEST PLAYERS | W1076: TEAM | X1076: W | Y1076: L | Z1076: D | AA1076: FOR | AB1076: AGST | AC1076: % | AD1076: PTS
A1077: BRUNSWICK | C1077: GEISLER | E1077: LODDING | H1077: BAKER | K1077: STANDFIELD | N1077: SILK | Q1077: HUGHES
A1078: BRIGHTON | C1078: DOREY | E1078: PLUNKETT | H1078: KING | K1078: McINDOE | N1078: ORGER | Q1078: BAILEY | W1078: COBURG | X1078: 20 | Y1078: 0 | Z1078: 0 | AA1078: 2504 | AB1078: 1355 | AC1078: =(AA1078/AB1078)*100 -> 184.79704797047972 | AD1078: 80
A1079: GOALKICKERS | W1079: WILLIAMSTOWN | X1079: 17 | Y1079: 3 | Z1079: 0 | AA1079: 2446 | AB1079: 1522 | AC1079: =(AA1079/AB1079)*100 -> 160.70959264126151 | AD1079: 68
A1080: BRUNSWICK | C1080: HUGHES 5 | F1080: COLLICOAT 3 | I1080: MANN 2 | K1080: LEHMAN | M1080: BLACKMORE | P1080: GLASSCOTT | S1080: BAKER | W1080: PORT MELBOURNE | X1080: 15 | Y1080: 5 | Z1080: 0 | AA1080: 2294 | AB1080: 1608 | AC1080: =(AA1080/AB1080)*100 -> 142.66169154228857 | AD1080: 60
A1081: BRIGHTON | C1081: KING 3 | E1081: O'KEEFE | G1081: ALVIN | I1081: McINDOE | K1081: CARROLL | M1081: WILLIAMS | W1081: CAMBERWELL | X1081: 12 | Y1081: 8 | Z1081: 0 | AA1081: 1948 | AB1081: 1887 | AC1081: =(AA1081/AB1081)*100 -> 103.232644409115 | AD1081: 48
A1083: YARRAVILLE | C1083: 2 | D1083: 5 | E1083: =C1083*6+D1083 -> 17 | G1083: 5 | H1083: 11 | I1083: =G1083*6+H1083 -> 41 | K1083: 14 | L1083: 17 | M1083: =K1083*6+L1083 -> 101 | O1083: 23 | P1083: 19 | Q1083: =O1083*6+P1083 -> 157 | S1083: YARRAVILLE | W1083: PRESTON | X1083: 11 | Y1083: 9 | Z1083: 0 | AA1083: 1752 | AB1083: 1751 | AC1083: =(AA1083/AB1083)*100 -> 100.05711022272988 | AD1083: 44
A1084: OAKLEIGH | C1084: 1 | D1084: 2 | E1084: =C1084*6+D1084 -> 8 | G1084: 2 | H1084: 7 | I1084: =G1084*6+H1084 -> 19 | K1084: 3 | L1084: 9 | M1084: =K1084*6+L1084 -> 27 | O1084: 5 | P1084: 11 | Q1084: =O1084*6+P1084 -> 41 | S1084: GREGORY | W1084: PRAHRAN | X1084: 10 | Y1084: 10 | Z1084: 0 | AA1084: 2100 | AB1084: 2019 | AC1084: =(AA1084/AB1084)*100 -> 104.01188707280834 | AD1084: 40
A1085: BEST PLAYERS | W1085: NORTHCOTE | X1085: 10 | Y1085: 10 | Z1085: 0 | AA1085: 1753 | AB1085: 1815 | AC1085: =(AA1085/AB1085)*100 -> 96.584022038567497 | AD1085: 40
A1086: YARRAVILLE | C1086: WHITE | E1086: ELLIS | H1086: GARLICK | K1086: CAHILL | N1086: H RUDDELL | Q1086: McDONALD | W1086: BRUNSWICK | X1086: 8 | Y1086: 12 | Z1086: 0 | AA1086: 1807 | AB1086: 1679 | AC1086: =(AA1086/AB1086)*100 -> 107.62358546754021 | AD1086: 32
A1087: OAKLEIGH | C1087: MUDGE | E1087: HORNE | H1087: McKENZIE | K1087: WILLIAMS | N1087: BEARD | Q1087: VEALE | W1087: BRIGHTON | X1087: 8 | Y1087: 12 | Z1087: 0 | AA1087: 1598 | AB1087: 2108 | AC1087: =(AA1087/AB1087)*100 -> 75.806451612903231 | AD1087: 32
A1088: GOALKICKERS | W1088: YARRAVILLE | X1088: 5 | Y1088: 15 | Z1088: 0 | AA1088: 1796 | AB1088: 2086 | AC1088: =(AA1088/AB1088)*100 -> 86.097794822627037 | AD1088: 20
A1089: YARRAVILLE | C1089: CASELY 7 | E1089: PERUSSICH 6 | H1089: McDONALD 3 | K1089: WHITE 3 | M1089: SIMPSON 2 | P1089: H RUDDELL | S1089: BELL | W1089: SANDRINGHAM | X1089: 2 | Y1089: 18 | Z1089: 0 | AA1089: 1480 | AB1089: 2443 | AC1089: =(AA1089/AB1089)*100 -> 60.581252558329922 | AD1089: 8
A1090: OAKLEIGH | C1090: GILBERT 2 | F1090: HORNE | H1090: WORRALL | K1090: NAISMITH | W1090: OAKLEIGH | X1090: 2 | Y1090: 18 | Z1090: 0 | AA1090: 1292 | AB1090: 2492 | AC1090: =(AA1090/AB1090)*100 -> 51.845906902086682 | AD1090: 8
E1091: 1ST SEPTEMBER | J1091: WEATHER | M1091: FINE
A1092: NORTHCOTE | C1092: 8 | D1092: 5 | E1092: =C1092*6+D1092 -> 53 | G1092: 11 | H1092: 8 | I1092: =G1092*6+H1092 -> 74 | K1092: 15 | L1092: 17 | M1092: =K1092*6+L1092 -> 107 | O1092: 19 | P1092: 20 | Q1092: =O1092*6+P1092 -> 134 | S1092: BEACH ROAD
A1093: SANDRINGHAM | C1093: 4 | D1093: 3 | E1093: =C1093*6+D1093 -> 27 | G1093: 9 | H1093: 6 | I1093: =G1093*6+H1093 -> 60 | K1093: 11 | L1093: 8 | M1093: =K1093*6+L1093 -> 74 | O1093: 11 | P1093: 11 | Q1093: =O1093*6+P1093 -> 77 | S1093: MERRINGTON
A1094: BEST PLAYERS
A1095: NORTHCOTE | C1095: BARKER | F1095: POLGLASE | I1095: KINDER | K1095: WEGNER | N1095: CARNEY | Q1095: McINTOSH
A1096: SANDRINGHAM | C1096: BENCRAFT | F1096: REID | I1096: WEBB | K1096: J MILLER | N1096: BENNETT | Q1096: REYNOLDS
A1097: GOALKICKERS
A1098: NORTHCOTE | C1098: CARNEY 5 | F1098: POLGLASE 4 | I1098: WEGNER 2 | K1098: CLARK 2 | M1098: BARKER | O1098: McINTOSH | Q1098: KINDER | S1098: DUDLEY
A1099: SANDRINGHAM | C1099: REYNOLDS 3 | F1099: MIDDLETON 2 | I1099: MATHESON 2 | L1099: BENCRAFT 2 | O1099: SLEIGH | Q1099: MOLONEY
A1101: PORT MELBOURNE | C1101: 4 | D1101: 8 | E1101: =C1101*6+D1101 -> 32 | G1101: 10 | H1101: 14 | I1101: =G1101*6+H1101 -> 74 | K1101: 13 | L1101: 18 | M1101: =K1101*6+L1101 -> 96 | O1101: 15 | P1101: 21 | Q1101: =O1101*6+P1101 -> 111 | S1101: PRESTON
A1102: PRESTON | C1102: 2 | D1102: 4 | E1102: =C1102*6+D1102 -> 16 | G1102: 4 | H1102: 5 | I1102: =G1102*6+H1102 -> 29 | K1102: 7 | L1102: 9 | M1102: =K1102*6+L1102 -> 51 | O1102: 8 | P1102: 12 | Q1102: =O1102*6+P1102 -> 60 | S1102: BARNES
A1103: BEST PLAYERS
A1104: PORT MELBOURNE | C1104: McBETH | F1104: FLETCHER | I1104: JULIER | L1104: LAHIFF | O1104: KELSEY | R1104: KIMBERLEY
A1105: PRESTON | C1105: MASLEN | F1105: ANDERSON | I1105: BOYD | L1105: WALSH | O1105: CONNELLY | R1105: BRADLEY
A1106: GOALKICKERS
A1107: PORT MELBOURNE | C1107: CULPH 3 | F1107: FLETCHER 3 | I1107: HOUSTEN 3 | L1107: TAYLOR 3 | N1107: LAHIFF | P1107: LEWIS | R1107: KELLY
A1108: PRESTON | C1108: CONNELLY 2 | F1108: BOYD 2 | H1108: EXELBY | J1108: WALSH | L1108: SYMONS | N1108: DUGGAN
E1109: 8TH SEPTEMBER | J1109: WEATHER | M1109: FINE
A1110: COBURG | C1110: 2 | D1110: 1 | E1110: =C1110*6+D1110 -> 13 | G1110: 8 | H1110: 5 | I1110: =G1110*6+H1110 -> 53 | K1110: 11 | L1110: 6 | M1110: =K1110*6+L1110 -> 72 | O1110: 15 | P1110: 9 | Q1110: =O1110*6+P1110 -> 99 | S1110: WILLIAMSTOWN
A1111: WILLIAMSTOWN | C1111: 2 | D1111: 5 | E1111: =C1111*6+D1111 -> 17 | G1111: 3 | H1111: 5 | I1111: =G1111*6+H1111 -> 23 | K1111: 8 | L1111: 9 | M1111: =K1111*6+L1111 -> 57 | O1111: 12 | P1111: 9 | Q1111: =O1111*6+P1111 -> 81 | S1111: WRIGHT
A1112: BEST PLAYERS
A1113: COBURG | C1113: PROMNITZ | F1113: MILTE | I1113: FYFFE | L1113: HORE | O1113: R ATKINSON | R1113: DAY
A1114: WILLIAMSTOWN | C1114: WILCOX | F1114: HEARN | I1114: TEASDALE | L1114: MATTHEWS | O1114: TODD | R1114: HARLEY
A1115: GOALKICKERS
A1116: COBURG | C1116: ROWE 3 | E1116: FYFFE 2 | G1116: FRANCIS 2 | J1116: CREWTHER 2 | M1116: MARDEN | O1116: LONSDALE | Q1116: PATERSON | T1116: DAY | V1116: PERRIN | X1116: MILTE
A1117: WILLIAMSTOWN | C1117: TODD 6 | E1117: HARRIS 2 | G1117: SCARFFE 2 | J1117: MATTHEWS | M1117: GLASS
A1119: CAMBERWELL | C1119: 4 | D1119: 4 | E1119: =C1119*6+D1119 -> 28 | G1119: 7 | H1119: 11 | I1119: =G1119*6+H1119 -> 53 | K1119: 12 | L1119: 13 | M1119: =K1119*6+L1119 -> 85 | O1119: 19 | P1119: 18 | Q1119: =O1119*6+P1119 -> 132 | S1119: CAMBERWELL
A1120: PRAHRAN | C1120: 6 | D1120: 4 | E1120: =C1120*6+D1120 -> 40 | G1120: 9 | H1120: 5 | I1120: =G1120*6+H1120 -> 59 | K1120: 15 | L1120: 8 | M1120: =K1120*6+L1120 -> 98 | O1120: 17 | P1120: 8 | Q1120: =O1120*6+P1120 -> 110 | S1120: MERRINGTON
A1121: BEST PLAYERS
A1122: CAMBERWELL | C1122: COLLIER | F1122: SEELENMEYER | I1122: HARLAND | L1122: McDONALD | O1122: BRADFORD | R1122: TAYLOR
A1123: PRAHRAN | C1123: STACKPOLE | F1123: CAMM | I1123: BENNISON | L1123: GARDINER | O1123: O'DONNELL | R1123: WHITE
A1124: GOALKICKERS
A1125: CAMBERWELL | C1125: CAMPBELL 6 | F1125: DINEEN 4 | I1125: SHIELDS 2 | L1125: HARLAND 2 | O1125: BRADFORD 2 | R1125: McDONALD | U1125: BRYCE | W1125: OLIVER
A1126: PRAHRAN | C1126: STACKPOLE 8 | F1126: WHITE 3 | I1126: O'DONNELL 2 | L1126: DOUGHTON 2 | O1126: ADAMS | Q1126: McLEAN
A1128: FINALS
A1129: 1ST SEMI | D1129: 15TH SEPTEMBER | J1129: WEATHER | M1129: FINE SUNNY
D1130: 1ST QTR | H1130: 2ND QTR | L1130: 3RD QTR | P1130: FINAL
A1131: PORT MELBOURNE | C1131: 6 | D1131: 2 | E1131: =C1131*6+D1131 -> 38 | G1131: 12 | H1131: 10 | I1131: =G1131*6+H1131 -> 82 | K1131: 14 | L1131: 14 | M1131: =K1131*6+L1131 -> 98 | O1131: 23 | P1131: 17 | Q1131: =O1131*6+P1131 -> 155 | S1131: JUNCTION OVAL
A1132: CAMBERWELL | C1132: 5 | D1132: 2 | E1132: =C1132*6+D1132 -> 32 | G1132: 7 | H1132: 4 | I1132: =G1132*6+H1132 -> 46 | K1132: 13 | L1132: 9 | M1132: =K1132*6+L1132 -> 87 | O1132: 15 | P1132: 11 | Q1132: =O1132*6+P1132 -> 101 | S1132: MERRINGTON
A1133: BEST PLAYERS
A1134: PORT MELBOURNE | D1134: HOUSTEN | G1134: LEWIS | J1134: CULPH | M1134: TAYLOR | P1134: SEARLE | S1134: KELSEY
A1135: CAMBERWELL | D1135: TAYLOR | G1135: CAMPBELL | J1135: BRYCE | M1135: BRADFORD | P1135: HORKINGS | S1135: McDONALD
A1136: GOALKICKERS
A1137: PORT MELBOURNE | D1137: HOUSTEN 6 | G1137: CULPH 5 | I1137: FREYER 3 | K1137: REYNOLDS 3 | N1137: TAYLOR 2 | Q1137: LAHIFF 2 | T1137: FLETCHER | X1137: McBETH
A1138: CAMBERWELL | D1138: CAMPBELL 5 | G1138: BRYCE 2 | I1138: DINEEN 2 | K1138: AUSTEN 2 | N1138: MATTHEWS | Q1138: HARLAND | T1138: McDONALD | X1138: BRADFORD
A1140: 2ND SEMI | D1140: 22ND SEPTEMBER | J1140: WEATHER | L1140: COLD SOUTH WEST WIND SHOWERS
A1141: WILLIAMSTOWN | C1141: 4 | D1141: 5 | E1141: =C1141*6+D1141 -> 29 | G1141: 7 | H1141: 6 | I1141: =G1141*6+H1141 -> 48 | K1141: 12 | L1141: 14 | M1141: =K1141*6+L1141 -> 86 | O1141: 12 | P1141: 16 | Q1141: =O1141*6+P1141 -> 88 | S1141: JUNCTION OVAL
A1142: COBURG | C1142: 0 | D1142: 5 | E1142: =C1142*6+D1142 -> 5 | G1142: 6 | H1142: 9 | I1142: =G1142*6+H1142 -> 45 | K1142: 7 | L1142: 11 | M1142: =K1142*6+L1142 -> 53 | O1142: 8 | P1142: 23 | Q1142: =O1142*6+P1142 -> 71 | S1142: MERRINGTON
A1143: BEST PLAYERS
A1144: WILLIAMSTOWN | C1144: MATTHEWS | F1144: ARCHIBALD | I1144: RYAN | L1144: GLASS | N1144: CHAPMAN | Q1144: SPRING
A1145: COBURG | C1145: R ATKINSON | F1145: CONDON | I1145: MILTE | L1145: WILSON | N1145: HORE
A1146: GOALKICKERS
A1147: WILLIAMSTOWN | C1147: TODD 3 | E1147: MATTHEWS 2 | H1147: HARRIS 2 | J1147: HEARN | L1147: SCARFFE | N1147: DOWLING | Q1147: SPRING | S1147: GLASS
A1148: COBURG | C1148: CONDON 3 | F1148: FYFFE 2 | H1148: CREWTHER | K1148: ROWE | M1148: WILSON
A1150: PRELIMINARY FINAL | G1150: 29TH SEPTEMBER | L1150: WEATHER | O1150: RAIN SECOND HALF
A1151: PORT MELBOURNE | C1151: 3 | D1151: 3 | E1151: =C1151*6+D1151 -> 21 | G1151: 7 | H1151: 8 | I1151: =G1151*6+H1151 -> 50 | K1151: 11 | L1151: 10 | M1151: =K1151*6+L1151 -> 76 | O1151: 13 | P1151: 13 | Q1151: =O1151*6+P1151 -> 91 | S1151: JUNCTION OVAL
A1152: COBURG | C1152: 3 | D1152: 5 | E1152: =C1152*6+D1152 -> 23 | G1152: 8 | H1152: 5 | I1152: =G1152*6+H1152 -> 53 | K1152: 11 | L1152: 8 | M1152: =K1152*6+L1152 -> 74 | O1152: 13 | P1152: 11 | Q1152: =O1152*6+P1152 -> 89 | S1152: MERRINGTON
A1153: BEST PLAYERS
A1154: PORT MELBOURNE | D1154: KIMBERLEY | G1154: LIVINGSTONE | J1154: KELLY | L1154: HOUSTEN | O1154: STOREY | Q1154: TAYLOR
A1155: COBURG | D1155: R ATKINSON | G1155: PROMNITZ | J1155: TITUS | L1155: CONDON | O1155: WILSON | Q1155: ROWE
A1156: GOALKICKERS
A1157: PORT MELBOURNE | D1157: FREYER 4 | G1157: HOUSTEN 2 | J1157: LEWIS 2 | L1157: CULPH | N1157: LAHIFF | P1157: KIMBERLEY | S1157: LIVINGSTONE | W1157: DOBSON
A1158: COBURG | D1158: TITUS 6 | G1158: CONDON | I1158: HORE | K1158: LONSDALE | N1158: ROWE | P1158: CREWTHER | S1158: FRANCIS | V1158: HILL
A1160: GRAND FINAL | D1160: 6TH OCTOBER | J1160: WEATHER | L1160: FINE SOUTH WEST BREEZE
A1161: WILLIAMSTOWN | C1161: 6 | D1161: 4 | E1161: 40 | G1161: 10 | H1161: 10 | I1161: 70 | K1161: 10 | L1161: 13 | M1161: 73 | O1161: 16 | P1161: 21 | Q1161: =O1161*6+P1161 -> 117 | S1161: JUNCTION OVAL
A1162: PORT MELBOURNE | C1162: 3 | D1162: 8 | E1162: 26 | G1162: 5 | H1162: 14 | I1162: 44 | K1162: 8 | L1162: 18 | M1162: 66 | O1162: 10 | P1162: 20 | Q1162: =O1162*6+P1162 -> 80 | S1162: MERRINGTON
A1163: BEST PLAYERS
A1164: WILLIAMSTOWN | D1164: CHISHOLM | G1164: SPRING | J1164: TODD | L1164: COCKBURN | O1164: JOHNSON | Q1164: ARCHIBALD
A1165: PORT MELBOURNE | D1165: DOBSON | G1165: HOUSTEN | J1165: CULPH | L1165: STOREY | O1165: SEARLE | Q1165: KELLY
A1166: GOALKICKERS
A1167: WILLIAMSTOWN | D1167: TODD 6 | G1167: SPRING 3 | I1167: HARRIS 3 | L1167: HEARN | N1167: MATTHEWS | Q1167: GLASS | S1167: COCKBURN
A1168: PORT MELBOURNE | D1168: CULPH 4 | G1168: FREYER 2 | I1168: HOUSTEN | L1168: LIVINGSTONE | O1168: KELLY | Q1168: TAYLOR
A1170: TEAMS
G1171: WILLIAMSTOWN | S1171: PORT MELBOURNE
A1172: BACKS | C1172: HARLEY | G1172: RYAN | K1172: CHAPMAN | O1172: McBETH | S1172: SEARL | W1172: LONG
A1173: H-BACKS | C1173: CUTTING | G1173: WILCOX | K1173: JOHNSON | O1173: TREMBATH | S1173: BAKER | W1173: KELSEY
A1174: CENTRES | C1174: LE SEUER | G1174: FEATHERBY | K1174: CHISHOLM | O1174: DOBSON | S1174: GOLDSMITH | W1174: KELLY
A1175: H-FORWARDS | C1175: SPRING | G1175: HEARN | K1175: MATTHEWS | O1175: LEWIS | S1175: HOUSTON | W1175: FREYER
A1176: FORWARDS | C1176: GLASS | G1176: TODD | K1176: HARRIS | O1176: KIMBERLEY | S1176: CULPH | W1176: LAHIFF
A1177: RUCKS | C1177: ARCHIBALD | G1177: COCKBURN | K1177: DOWLING | O1177: LIVINGSTONE | S1177: STOREY | W1177: TAYLOR
A1178: RES | C1178: TEASDALE | O1178: IRVING
Q1202: ~