A1: Victorian Football Association
A2: Season 1946
A3: © Copyright Wal Williams | F3: First created: 2 November 2014
A4: Contact: joywalwi at gmail dot com | F4: Last updated: 27 January 2018 | W4: VFA Results and tables - Link to the main index page
A5: You are free to copy this document in whole or part provided that proper acknowledgement is given to the author. All rights reserved.
A7: YEAR 1946
A8: ROUND 1 | D8: 13TH APRIL | J8: WEATHER | M8: FINE | S8: PLAYED AT
D9: 1ST QTR | H9: 2ND QTR | L9: 3RD QTR | P9: FINAL | S9: COBURG
A10: COBURG | C10: 8 | D10: 3 | E10: =C10*6+D10 -> 51 | G10: 10 | H10: 5 | I10: =G10*6+H10 -> 65 | K10: 13 | L10: 11 | M10: =K10*6+L10 -> 89 | O10: 15 | P10: 12 | Q10: =O10*6+P10 -> 102 | S10: UMPIRE | X10: LADDER | AB10: ROUND | AD10: 1
A11: BRUNSWICK | C11: 2 | D11: 2 | E11: =C11*6+D11 -> 14 | G11: 6 | H11: 8 | I11: =G11*6+H11 -> 44 | K11: 7 | L11: 11 | M11: =K11*6+L11 -> 53 | O11: 8 | P11: 15 | Q11: =O11*6+P11 -> 63 | S11: MOORE
A12: BEST PLAYERS | W12: TEAM | X12: W | Y12: L | Z12: D | AA12: FOR | AB12: AGST | AC12: % | AD12: PTS
A13: COBURG | C13: FYFFE | F13: CREWTHER | I13: MILTE | K13: ATKINSON | N13: LONSDALE | Q13: PERRIN
A14: BRUNSWICK | C14: CRAWFORD | F14: MORCAM | I14: MEADE | K14: SUTTON | N14: BAGGOTT | Q14: HUGHES | W14: CAMBERWELL | X14: 1 | Y14: 0 | Z14: 0 | AA14: 172 | AB14: 85 | AC14: 202.35294117647058 | AD14: 4
A15: GOALKICKERS | W15: WILLIAMSTOWN | X15: 1 | Y15: 0 | Z15: 0 | AA15: 182 | AB15: 94 | AC15: 193.61702127659575 | AD15: 4
A16: COBURG | C16: FYFFE 4 | E16: CREWTHER 3 | H16: LONSDALE 2 | K16: MILTE 2 | M16: PERRIN | O16: WILLIAMS | Q16: MEAGHER | T16: SITCH | W16: PRAHRAN | X16: 1 | Y16: 0 | Z16: 0 | AA16: 163 | AB16: 95 | AC16: 171.57894736842104 | AD16: 4
A17: BRUNSWICK | C17: BAGGOTT 2 | F17: SMITH 2 | I17: SUTTON | K17: DOWNING | M17: MANN | O17: BAKER | W17: COBURG | X17: 1 | Y17: 0 | Z17: 0 | AA17: 102 | AB17: 63 | AC17: 161.9047619047619 | AD17: 4
A19: PRAHRAN | C19: 5 | D19: 3 | E19: =C19*6+D19 -> 33 | G19: 12 | H19: 11 | I19: =G19*6+H19 -> 83 | K19: 16 | L19: 16 | M19: =K19*6+L19 -> 112 | O19: 23 | P19: 25 | Q19: =O19*6+P19 -> 163 | S19: TOORAK PARK | W19: NORTHCOTE | X19: 1 | Y19: 0 | Z19: 0 | AA19: 75 | AB19: 57 | AC19: 131.57894736842104 | AD19: 4
A20: PORT MELBOURNE | C20: 4 | D20: 2 | E20: =C20*6+D20 -> 26 | G20: 8 | H20: 4 | I20: =G20*6+H20 -> 52 | K20: 13 | L20: 9 | M20: =K20*6+L20 -> 87 | O20: 14 | P20: 11 | Q20: =O20*6+P20 -> 95 | S20: WRIGHT | W20: BRIGHTON | X20: 1 | Y20: 0 | Z20: 0 | AA20: 111 | AB20: 85 | AC20: 130.58823529411765 | AD20: 4
A21: BEST PLAYERS | W21: SANDRINGHAM | X21: 0 | Y21: 1 | Z21: 0 | AA21: 85 | AB21: 111 | AC21: 76.576576576576571 | AD21: 0
A22: PRAHRAN | C22: WHITE | F22: GARDINER | I22: ADAMSON | L22: DAVEY | N22: ARNOTT | Q22: CAMM | W22: PRESTON | X22: 0 | Y22: 1 | Z22: 0 | AA22: 57 | AB22: 75 | AC22: 76 | AD22: 0
A23: PORT MELBOURNE | C23: FINDLAY | F23: MURPHY | I23: TAYLOR | L23: KELLY | N23: COYLE | Q23: GOSS | W23: BRUNSWICK | X23: 0 | Y23: 1 | Z23: 0 | AA23: 63 | AB23: 102 | AC23: 61.764705882352942 | AD23: 0
A24: GOALKICKERS | N24: ADAMSON | Q24: MIGHELL | W24: PORT MELBOURNE | X24: 0 | Y24: 1 | Z24: 0 | AA24: 95 | AB24: 163 | AC24: 58.282208588957054 | AD24: 0
A25: PRAHRAN | C25: LYONS 5 | E25: ARNOTT 5 | G25: STACKPOLE 3 | J25: DAVEY 3 | L25: CULLEN 2 | N25: O'DONNELL 2 | Q25: GARDINER | W25: YARRAVILLE | X25: 0 | Y25: 1 | Z25: 0 | AA25: 94 | AB25: 182 | AC25: 51.64835164835165 | AD25: 0
A26: PORT MELBOURNE | C26: HOUSTEN 5 | F26: FINDLAY 4 | I26: TAYLOR 2 | K26: MURPHY | M26: GOSS | O26: CULPH | W26: OAKLEIGH | X26: 0 | Y26: 1 | Z26: 0 | AA26: 85 | AB26: 172 | AC26: 49.418604651162788 | AD26: 0
A28: WILLIAMSTOWN | C28: 6 | D28: 3 | E28: =C28*6+D28 -> 39 | G28: 14 | H28: 10 | I28: =G28*6+H28 -> 94 | K28: 20 | L28: 14 | M28: =K28*6+L28 -> 134 | O28: 27 | P28: 20 | Q28: =O28*6+P28 -> 182 | S28: WILLIAMSTOWN
A29: YARRAVILLE | C29: 1 | D29: 3 | E29: =C29*6+D29 -> 9 | G29: 4 | H29: 10 | I29: =G29*6+H29 -> 34 | K29: 8 | L29: 17 | M29: =K29*6+L29 -> 65 | O29: 12 | P29: 22 | Q29: =O29*6+P29 -> 94 | S29: THOMAS
A30: BEST PLAYERS
A31: WILLIAMSTOWN | C31: TODD | F31: SCARFFE | I31: WELLS | L31: WILCOX | O31: FEATHERBY | R31: WILLIAMS
A32: YARRAVILLE | C32: BOOKER | F32: ELLIS | I32: SORRAGHAN | L32: RUDDELL | O32: FITCH | R32: GARLICK
A33: GOALKICKERS
A34: WILLIAMSTOWN | C34: TODD 13 | F34: HARRIS 5 | I34: SALVAS 3 | L34: DOWLING 3 | O34: JAMIESON 2 | R34: SPRING
A35: YARRAVILLE | C35: ELLIS 4 | F35: BOOKER 4 | I35: ROBB 2 | L35: SORRAGHAN | O35: VINCENT
A37: BRIGHTON | C37: 1 | D37: 5 | E37: =C37*6+D37 -> 11 | G37: 9 | H37: 12 | I37: =G37*6+H37 -> 66 | K37: 11 | L37: 15 | M37: =K37*6+L37 -> 81 | O37: 15 | P37: 21 | Q37: =O37*6+P37 -> 111 | S37: BEACH ROAD
A38: SANDRINGHAM | C38: 4 | D38: 7 | E38: =C38*6+D38 -> 31 | G38: 5 | H38: 8 | I38: =G38*6+H38 -> 38 | K38: 9 | L38: 12 | M38: =K38*6+L38 -> 66 | O38: 11 | P38: 19 | Q38: =O38*6+P38 -> 85 | S38: MERRINGTON
A39: BEST PLAYERS
A40: BRIGHTON | C40: KENNETT | F40: T NEW | I40: ORGER | L40: O'BRIEN | O40: McINDOE | R40: PEKIN
A41: SANDRINGHAM | C41: SALES | F41: LAVER | I41: ANDERS | L41: O'TOOLE | O41: BENCRAFT | R41: REID
A42: GOALKICKERS
A43: BRIGHTON | C43: VALLENCE 5 | F43: NUTTER 3 | I43: ADAMSON 2 | L43: McINDOE 2 | O43: O'BRIEN 2 | Q43: PEKIN
A44: SANDRINGHAM | C44: TOMLINS 4 | F44: REID 2 | I44: BENCRAFT 2 | L44: BENNETT | N44: PARKER | P44: POLE
A46: CAMBERWELL | C46: 7 | D46: 4 | E46: =C46*6+D46 -> 46 | G46: 17 | H46: 7 | I46: =G46*6+H46 -> 109 | K46: 22 | L46: 10 | M46: =K46*6+L46 -> 142 | O46: 26 | P46: 16 | Q46: =O46*6+P46 -> 172 | S46: OAKLEIGH
A47: OAKLEIGH | C47: 0 | D47: 4 | E47: =C47*6+D47 -> 4 | G47: 3 | H47: 6 | I47: =G47*6+H47 -> 24 | K47: 6 | L47: 10 | M47: =K47*6+L47 -> 46 | O47: 12 | P47: 13 | Q47: =O47*6+P47 -> 85 | S47: BARNES
A48: BEST PLAYERS
A49: CAMBERWELL | C49: BRYCE | E49: BOYALL | H49: BRADFORD | K49: COLLIER | N49: MAYO | Q49: KENNEDY
A50: OAKLEIGH | C50: BEARD | E50: NAISMITH | H50: HORNE | K50: MOORE | N50: E RYAN | Q50: BICKERTON
A51: GOALKICKERS
A52: CAMBERWELL | C52: MAYO 7 | E52: BRYCE 5 | G52: BRADFORD 5 | J52: JENSEN 3 | L52: HARLAND 3 | O52: LAMSDEN | Q52: BENNISON | T52: OLIVER
A53: OAKLEIGH | C53: NAISMITH 3 | F53: McKENZIE 3 | I53: MOORE 2 | K53: WORRALL 2 | N53: HORNE | P53: WATSON
A55: NORTHCOTE | C55: 4 | D55: 3 | E55: =C55*6+D55 -> 27 | G55: 5 | H55: 8 | I55: =G55*6+H55 -> 38 | K55: 7 | L55: 10 | M55: =K55*6+L55 -> 52 | O55: 10 | P55: 15 | Q55: =O55*6+P55 -> 75 | S55: NORTHCOTE
A56: PRESTON | C56: 3 | D56: 4 | E56: =C56*6+D56 -> 22 | G56: 4 | H56: 7 | I56: =G56*6+H56 -> 31 | K56: 6 | L56: 13 | M56: =K56*6+L56 -> 49 | O56: 7 | P56: 15 | Q56: =O56*6+P56 -> 57 | S56: HARDING
A57: BEST PLAYERS
A58: NORTHCOTE | C58: McNAMARA | F58: BARKER | I58: NOLAN | L58: McINTOSH | O58: JONES | R58: JOHNSON
A59: PRESTON | C59: GIBBS | F59: ANDERSON | I59: MASLEN | L59: SNELL | O59: CONNELLY | R59: BROOKS
A60: GOALKICKERS
A61: NORTHCOTE | C61: GALE 3 | F61: JONES 2 | I61: JOHNSON 2 | L61: WHITE 2 | O61: OLVER
A62: PRESTON | C62: CONNELLY 4 | F62: LEISHMAN | I62: ATKINSON | L62: DUGGAN
A64: ROUND 2 | D64: 20TH APRIL EASTER SATURDAY | L64: WEATHER | O64: NORTH WIND WARM | S64: PLAYED AT
D65: 1ST QTR | H65: 2ND QTR | L65: 3RD QTR | P65: FINAL | S65: CAMBERWELL
A66: CAMBERWELL | C66: 6 | D66: 5 | E66: =C66*6+D66 -> 41 | G66: 9 | H66: 9 | I66: =G66*6+H66 -> 63 | K66: 19 | L66: 16 | M66: =K66*6+L66 -> 130 | O66: 22 | P66: 18 | Q66: =O66*6+P66 -> 150 | S66: UMPIRE | X66: LADDER | AB66: ROUND | AD66: 2
A67: PRAHRAN | C67: 2 | D67: 2 | E67: =C67*6+D67 -> 14 | G67: 6 | H67: 6 | I67: =G67*6+H67 -> 42 | K67: 7 | L67: 9 | M67: =K67*6+L67 -> 51 | O67: 13 | P67: 15 | Q67: =O67*6+P67 -> 93 | S67: MERRINGTON
A68: BEST PLAYERS | W68: TEAM | X68: W | Y68: L | Z68: D | AA68: FOR | AB68: AGST | AC68: % | AD68: PTS
A69: CAMBERWELL | C69: BRADFORD | F69: HARLAND | I69: McDONALD | L69: HORKINS | O69: BENNISON | R69: COLLIER
A70: PRAHRAN | C70: GRAVELL | F70: GARDINER | I70: CULLEN | L70: STACKPOLE | O70: ADAMSON | R70: D'OLIVER | W70: CAMBERWELL | X70: 2 | Y70: 0 | Z70: 0 | AA70: 322 | AB70: 178 | AC70: 180.89887640449439 | AD70: 8
A71: GOALKICKERS | W71: WILLIAMSTOWN | X71: 2 | Y71: 0 | Z71: 0 | AA71: 368 | AB71: 237 | AC71: 155.27426160337552 | AD71: 8
A72: CAMBERWELL | C72: MAYO 7 | E72: BRADFORD 5 | H72: McDONALD 3 | K72: BRYCE 3 | M72: BENNISON 2 | P72: OLIVER | R72: HORKINGS | W72: COBURG | X72: 2 | Y72: 0 | Z72: 0 | AA72: 205 | AB72: 134 | AC72: 152.98507462686567 | AD72: 8
A73: PRAHRAN | C73: STACKPOLE 5 | F73: GRAVELL 2 | I73: O'DONNELL | K73: D'OLIVER | M73: ADAMSON | O73: PEARCE | Q73: CONROY | S73: CULLEN | W73: PRAHRAN | X73: 1 | Y73: 1 | Z73: 0 | AA73: 256 | AB73: 245 | AC73: 104.48979591836735 | AD73: 4
A75: BRUNSWICK | C75: 3 | D75: 1 | E75: =C75*6+D75 -> 19 | G75: 6 | H75: 9 | I75: =G75*6+H75 -> 45 | K75: 7 | L75: 12 | M75: =K75*6+L75 -> 54 | O75: 12 | P75: 17 | Q75: =O75*6+P75 -> 89 | S75: BRUNSWICK | W75: NORTHCOTE | X75: 1 | Y75: 1 | Z75: 0 | AA75: 180 | AB75: 177 | AC75: 101.69491525423729 | AD75: 4
A76: OAKLEIGH | C76: 4 | D76: 3 | E76: =C76*6+D76 -> 27 | G76: 7 | H76: 3 | I76: =G76*6+H76 -> 45 | K76: 10 | L76: 5 | M76: =K76*6+L76 -> 65 | O76: 12 | P76: 5 | Q76: =O76*6+P76 -> 77 | S76: HICKS | W76: SANDRINGHAM | X76: 1 | Y76: 1 | Z76: 0 | AA76: 183 | AB76: 180 | AC76: 101.66666666666667 | AD76: 4
A77: BEST PLAYERS | W77: BRIGHTON | X77: 1 | Y77: 1 | Z77: 0 | AA77: 254 | AB77: 271 | AC77: 93.726937269372698 | AD77: 4
A78: BRUNSWICK | C78: EVANS | E78: SILK | H78: CHALLENGER | K78: GLENISTER | N78: UPTON | Q78: CARTON | W78: BRUNSWICK | X78: 1 | Y78: 1 | Z78: 0 | AA78: 152 | AB78: 179 | AC78: 84.916201117318437 | AD78: 4
A79: OAKLEIGH | C79: BEARD | E79: WILLIAMS | H79: MATTHEWS | K79: WATSON | N79: E RYAN | Q79: WEISS | W79: PORT MELBOURNE | X79: 1 | Y79: 1 | Z79: 0 | AA79: 215 | AB79: 268 | AC79: 80.223880597014926 | AD79: 4
A80: GOALKICKERS | W80: PRESTON | X80: 0 | Y80: 2 | Z80: 0 | AA80: 126 | AB80: 173 | AC80: 72.832369942196536 | AD80: 0
A81: BRUNSWICK | C81: MANN 6 | F81: GLENISTER 2 | I81: MORCAM 2 | L81: BAKER | N81: UPTON | W81: OAKLEIGH | X81: 0 | Y81: 2 | Z81: 0 | AA81: 162 | AB81: 261 | AC81: 62.068965517241381 | AD81: 0
A82: OAKLEIGH | C82: NAISMITH 4 | F82: WATSON 3 | I82: KITCHEN 2 | L82: McKENZIE 2 | O82: O'DONOGHUE | W82: YARRAVILLE | X82: 0 | Y82: 2 | Z82: 0 | AA82: 165 | AB82: 285 | AC82: 57.89473684210526 | AD82: 0
A84: WILLIAMSTOWN | C84: 7 | D84: 1 | E84: =C84*6+D84 -> 43 | G84: 17 | H84: 5 | I84: =G84*6+H84 -> 107 | K84: 19 | L84: 7 | M84: =K84*6+L84 -> 121 | O84: 29 | P84: 12 | Q84: =O84*6+P84 -> 186 | S84: ELSTERNWICK PARK
A85: BRIGHTON | C85: 5 | D85: 8 | E85: =C85*6+D85 -> 38 | G85: 8 | H85: 16 | I85: =G85*6+H85 -> 64 | K85: 15 | L85: 25 | M85: =K85*6+L85 -> 115 | O85: 19 | P85: 29 | Q85: =O85*6+P85 -> 143 | S85: THOMAS
A86: BEST PLAYERS
A87: WILLIAMSTOWN | C87: TODD | E87: FEATHERBY | H87: WILCOX | K87: McPHERSON | N87: DOWLING | Q87: TAYLOR
A88: BRIGHTON | C88: CROSS | E88: McINDOE | H88: KENNETT | K88: DOUGLAS | N88: ADAMSON | Q88: NEW
A89: GOALKICKERS
A90: WILLIAMSTOWN | C90: TODD 11 | E90: HARRIS 7 | G90: DOWLING 3 | J90: McPHERSON 2 | M90: SPRING 2 | O90: SALVAS | Q90: WILLIAMS | T90: JAMIESON | W90: TAYLOR
A91: BRIGHTON | C91: VALLENCE 6 | F91: McINDOE 5 | I91: ADAMSON 4 | L91: DOUGLAS 2 | O91: CROSS | Q91: O'BRIEN
A93: SANDRINGHAM | C93: 3 | D93: 2 | E93: =C93*6+D93 -> 20 | G93: 11 | H93: 7 | I93: =G93*6+H93 -> 73 | K93: 11 | L93: 7 | M93: =K93*6+L93 -> 73 | O93: 14 | P93: 14 | Q93: =O93*6+P93 -> 98 | S93: PRESTON
A94: PRESTON | C94: 4 | D94: 2 | E94: =C94*6+D94 -> 26 | G94: 4 | H94: 3 | I94: =G94*6+H94 -> 27 | K94: 10 | L94: 6 | M94: =K94*6+L94 -> 66 | O94: 10 | P94: 9 | Q94: =O94*6+P94 -> 69 | S94: WRIGHT
A95: BEST PLAYERS
A96: SANDRINGHAM | C96: EVANS | E96: ZIMMER | H96: SALES | K96: RAY | N96: PARKER | Q96: TOMLINS
A97: PRESTON | C97: SNELL | E97: ANDERSON | H97: S STEWART | K97: McCARTHY | N97: MASLEN | Q97: GIBBS
A98: GOALKICKERS
A99: SANDRINGHAM | C99: ANDERS 4 | F99: PARKER 3 | I99: BENCRAFT 2 | L99: CERINI 2 | N99: WEBB | P99: MIDDLETON | S99: SCOLLARY
A100: PRESTON | C100: ANDERSON 4 | F100: WATTS 3 | I100: NORMAN | K100: DUGGAN | M100: N BOND
D101: 22ND APRIL | H101: EASTER MONDAY | L101: WEATHER | O101: WARM NORTH BREEZE
A102: PORT MELBOURNE | C102: 2 | D102: 10 | E102: =C102*6+D102 -> 22 | G102: 6 | H102: 13 | I102: =G102*6+H102 -> 49 | K102: 15 | L102: 21 | M102: =K102*6+L102 -> 111 | O102: 16 | P102: 24 | Q102: =O102*6+P102 -> 120 | S102: PORT MELBOURNE
A103: NORTHCOTE | C103: 3 | D103: 2 | E103: =C103*6+D103 -> 20 | G103: 7 | H103: 10 | I103: =G103*6+H103 -> 52 | K103: 9 | L103: 11 | M103: =K103*6+L103 -> 65 | O103: 14 | P103: 21 | Q103: =O103*6+P103 -> 105 | S103: BARNES
A104: BEST PLAYERS
A105: PORT MELBOURNE | C105: HOUSTEN | G105: FINDLAY | J105: STOREY | M105: BAKER | O105: DOBSON | R105: BUTCHER
A106: NORTHCOTE | C106: McNAMARA | G106: McINTOSH | J106: A WHITE | M106: NOLAN | O106: JOHNSTON | R106: JONES
A107: GOALKICKERS
A108: PORT MELBOURNE | C108: HOUSTEN 5 | F108: CULPH 4 | I108: FINDLAY 3 | L108: LEWIS | N108: KELLY | P108: IRVING | R108: PANNELL
A109: NORTHCOTE | C109: A WHITE 4 | F109: JOHNSTON 2 | I109: JONES 2 | K109: T WHITE 2 | N109: BRAZIER 2 | Q109: OLVER | S109: STABB
A111: COBURG | C111: 4 | D111: 13 | E111: =C111*6+D111 -> 37 | G111: 7 | H111: 16 | I111: =G111*6+H111 -> 58 | K111: 10 | L111: 21 | M111: =K111*6+L111 -> 81 | O111: 13 | P111: 25 | Q111: =O111*6+P111 -> 103 | S111: YARRAVILLE
A112: YARRAVILLE | C112: 2 | D112: 2 | E112: =C112*6+D112 -> 14 | G112: 5 | H112: 7 | I112: =G112*6+H112 -> 37 | K112: 7 | L112: 11 | M112: =K112*6+L112 -> 53 | O112: 9 | P112: 17 | Q112: =O112*6+P112 -> 71 | S112: STREETER
A113: BEST PLAYERS
A114: COBURG | C114: ATKINSON | F114: WILLIAMS | I114: FYFFE | L114: ENGELEEMER | O114: RODGERS | Q114: WALKER
A115: YARRAVILLE | C115: ROBB | F115: VINCENT | I115: McDONALD | L115: MARKS | O115: FITCH | Q115: JONES
A116: GOALKICKERS
A117: COBURG | C117: MEAGHER 4 | F117: CONDON 2 | I117: WILLIAMS 2 | L117: LONSDALE | N117: PERRIN | P117: FYFFE | R117: ENGELEEMER | V117: RODGERS
A118: YARRAVILLE | C118: ROBB 3 | F118: VINCENT 2 | I118: JONES 2 | K118: McDONALD | N118: ALVIN
A120: ROUND 3 | D120: 27TH APRIL | J120: WEATHER | M120: WEST BREEZE LIGHT RAIN | S120: PLAYED AT
D121: 1ST QTR | H121: 2ND QTR | L121: 3RD QTR | P121: FINAL | S121: NORTHCOTE
A122: CAMBERWELL | C122: 3 | D122: 7 | E122: =C122*6+D122 -> 25 | G122: 7 | H122: 8 | I122: =G122*6+H122 -> 50 | K122: 9 | L122: 11 | M122: =K122*6+L122 -> 65 | O122: 12 | P122: 15 | Q122: =O122*6+P122 -> 87 | S122: UMPIRE | X122: LADDER | AB122: ROUND | AD122: 3
A123: NORTHCOTE | C123: 5 | D123: 4 | E123: =C123*6+D123 -> 34 | G123: 8 | H123: 6 | I123: =G123*6+H123 -> 54 | K123: 9 | L123: 12 | M123: =K123*6+L123 -> 66 | O123: 12 | P123: 14 | Q123: =O123*6+P123 -> 86 | S123: BARNES
A124: BEST PLAYERS | W124: TEAM | X124: W | Y124: L | Z124: D | AA124: FOR | AB124: AGST | AC124: % | AD124: PTS
A125: CAMBERWELL | C125: BRYCE | F125: COLLIER | I125: MAYO | K125: HARLAND | N125: BRADFORD | Q125: STYLES
A126: NORTHCOTE | C126: STAFFORD | F126: T WHITE | I126: NOLAN | K126: GALE | N126: CAHILL | Q126: BARKER | W126: WILLIAMSTOWN | X126: 3 | Y126: 0 | Z126: 0 | AA126: 504 | AB126: 284 | AC126: 177.46478873239437 | AD126: 12
A127: GOALKICKERS | W127: CAMBERWELL | X127: 3 | Y127: 0 | Z127: 0 | AA127: 409 | AB127: 264 | AC127: 154.92424242424244 | AD127: 12
A128: CAMBERWELL | C128: MAYO 5 | F128: BRYCE 2 | I128: OLIVER 2 | K128: BRADFORD | N128: TAYLOR | P128: HORKINGS | W128: COBURG | X128: 2 | Y128: 1 | Z128: 0 | AA128: 285 | AB128: 224 | AC128: 127.23214285714286 | AD128: 8
A129: NORTHCOTE | C129: GALE 6 | F129: H OLVER 3 | I129: A JOHNSON | L129: A WHITE | N129: HISCOX | W129: PRAHRAN | X129: 2 | Y129: 1 | Z129: 0 | AA129: 351 | AB129: 339 | AC129: 103.53982300884955 | AD129: 8
A131: PRAHRAN | C131: 1 | D131: 4 | E131: =C131*6+D131 -> 10 | G131: 6 | H131: 8 | I131: =G131*6+H131 -> 44 | K131: 8 | L131: 10 | M131: =K131*6+L131 -> 58 | O131: 13 | P131: 17 | Q131: =O131*6+P131 -> 95 | S131: TOORAK PARK | W131: BRIGHTON | X131: 2 | Y131: 1 | Z131: 0 | AA131: 344 | AB131: 351 | AC131: 98.005698005698008 | AD131: 8
A132: BRUNSWICK | C132: 4 | D132: 6 | E132: =C132*6+D132 -> 30 | G132: 8 | H132: 13 | I132: =G132*6+H132 -> 61 | K132: 11 | L132: 14 | M132: =K132*6+L132 -> 80 | O132: 13 | P132: 16 | Q132: =O132*6+P132 -> 94 | S132: PARRIS | W132: PORT MELBOURNE | X132: 2 | Y132: 1 | Z132: 0 | AA132: 293 | AB132: 330 | AC132: 88.787878787878782 | AD132: 8
A133: BEST PLAYERS | W133: NORTHCOTE | X133: 1 | Y133: 2 | Z133: 0 | AA133: 266 | AB133: 264 | AC133: 100.75757575757575 | AD133: 4
A134: PRAHRAN | C134: BOURKE | F134: LYONS | I134: DAVEY | L134: LAMBORN | O134: GRAVELL | Q134: O'DONNELL | W134: BRUNSWICK | X134: 1 | Y134: 2 | Z134: 0 | AA134: 246 | AB134: 274 | AC134: 89.78102189781022 | AD134: 4
A135: BRUNSWICK | C135: PLUMMER | F135: MORCOM | I135: CARTON | L135: CRAWFORD | O135: SILK | Q135: SMITH | W135: SANDRINGHAM | X135: 1 | Y135: 2 | Z135: 0 | AA135: 230 | AB135: 316 | AC135: 72.784810126582272 | AD135: 4
A136: GOALKICKERS | W136: YARRAVILLE | X136: 1 | Y136: 2 | Z136: 0 | AA136: 248 | AB136: 363 | AC136: 68.319559228650135 | AD136: 4
A137: PRAHRAN | C137: LYONS 6 | F137: DAVEY 2 | I137: WHITE 2 | K137: GRAVELL | M137: ARNOTT | O137: CRAWSHAW | W137: PRESTON | X137: 0 | Y137: 3 | Z137: 0 | AA137: 188 | AB137: 251 | AC137: 74.900398406374507 | AD137: 0
A138: BRUNSWICK | C138: SMITH 4 | F138: MANN 3 | I138: CRAWFORD 3 | L138: GLENISTER 2 | O138: PRIESTLEY | W138: OAKLEIGH | X138: 0 | Y138: 3 | Z138: 0 | AA138: 240 | AB138: 344 | AC138: 69.767441860465112 | AD138: 0
A140: BRIGHTON | C140: 2 | D140: 1 | E140: =C140*6+D140 -> 13 | G140: 7 | H140: 3 | I140: =G140*6+H140 -> 45 | K140: 9 | L140: 4 | M140: =K140*6+L140 -> 58 | O140: 14 | P140: 6 | Q140: =O140*6+P140 -> 90 | S140: COBURG
A141: COBURG | C141: 5 | D141: 5 | E141: =C141*6+D141 -> 35 | G141: 7 | H141: 10 | I141: =G141*6+H141 -> 52 | K141: 9 | L141: 13 | M141: =K141*6+L141 -> 67 | O141: 11 | P141: 14 | Q141: =O141*6+P141 -> 80 | S141: THOMAS
A142: BEST PLAYERS
A143: BRIGHTON | C143: LUCAS | F143: H NEW | I143: BAILEY | L143: O'BRIEN | O143: CARROLL | S143: McINDOE
A144: COBURG | C144: FYFFE | F144: WILSON | I144: HORE | L144: KENNEDY | O144: WILLIAMS | S144: CREWTHER
A145: GOALKICKERS
A146: BRIGHTON | C146: McINDOE 5 | F146: CARROLL 3 | I146: VALLENCE 2 | L146: O'BRIEN 2 | N146: ADAMSON | Q146: PEKIN
A147: COBURG | C147: FYFFE 2 | F147: WILIAMS 2 | I147: MILTE 2 | K147: MEAGHER | M147: WALSH | O147: CONDON | Q147: KENNEDY | T147: CREWTHER
A149: YARRAVILLE | C149: 1 | D149: 0 | E149: =C149*6+D149 -> 6 | G149: 5 | H149: 7 | I149: =G149*6+H149 -> 37 | K149: 9 | L149: 9 | M149: =K149*6+L149 -> 63 | O149: 12 | P149: 11 | Q149: =O149*6+P149 -> 83 | S149: OAKLEIGH
A150: OAKLEIGH | C150: 1 | D150: 9 | E150: =C150*6+D150 -> 15 | G150: 3 | H150: 15 | I150: =G150*6+H150 -> 33 | K150: 8 | L150: 22 | M150: =K150*6+L150 -> 70 | O150: 9 | P150: 24 | Q150: =O150*6+P150 -> 78 | S150: MERRINGTON
A151: BEST PLAYERS
A152: YARRAVILLE | C152: CHALMERS | F152: ELLIS | I152: VINCENT | L152: FITCH | O152: RAWLINSON | R152: RUSSELL
A153: OAKLEIGH | C153: R FINN | F153: RICHARDSON | I153: BEARD | L153: KENNEDY | O153: O'CONNOR | R153: WILSON
A154: GOALKICKERS
A155: YARRAVILLE | C155: ELLIS 4 | F155: ROBB 2 | I155: VINCENT 2 | L155: McDONALD | O155: ALVIN | Q155: RAWLINSON | T155: SORRAGHAN
A156: OAKLEIGH | C156: S FINN 3 | F156: WATSON 2 | I156: MOORE 2 | L156: KENNEDY | O156: McKENZIE
A158: WILLIAMSTOWN | C158: 4 | D158: 6 | E158: =C158*6+D158 -> 30 | G158: 11 | H158: 10 | I158: =G158*6+H158 -> 76 | K158: 15 | L158: 14 | M158: =K158*6+L158 -> 104 | O158: 20 | P158: 16 | Q158: =O158*6+P158 -> 136 | S158: WILLIAMSTOWN
A159: SANDRINGHAM | C159: 1 | D159: 2 | E159: =C159*6+D159 -> 8 | G159: 2 | H159: 3 | I159: =G159*6+H159 -> 15 | K159: 6 | L159: 5 | M159: =K159*6+L159 -> 41 | O159: 7 | P159: 5 | Q159: =O159*6+P159 -> 47 | S159: TRAIT
A160: BEST PLAYERS
A161: WILLIAMSTOWN | C161: TODD | F161: WILCOX | I161: HARLEY | L161: HARRIS | O161: SPRING | R161: SALVAS
A162: SANDRINGHAM | C162: O'TOOLE | F162: BECK | I162: EVANS | L162: BENCRAFT | O162: PARKER | R162: WEBB
A163: GOALKICKERS
A164: WILLIAMSTOWN | C164: TODD 12 | F164: HARRIS 4 | I164: SPRING | K164: WELLS | M164: RONALD | O164: McPHERSON
A165: SANDRINGHAM | C165: TOMLINS 2 | F165: PARKER 2 | I165: ANDERS 2 | L165: BENCRAFT
A167: PORT MELBOURNE | C167: 2 | D167: 5 | E167: =C167*6+D167 -> 17 | G167: 6 | H167: 12 | I167: =G167*6+H167 -> 48 | K167: 8 | L167: 16 | M167: =K167*6+L167 -> 64 | O167: 10 | P167: 18 | Q167: =O167*6+P167 -> 78 | S167: PORT MELBOURNE
A168: PRESTON | C168: 4 | D168: 2 | E168: =C168*6+D168 -> 26 | G168: 5 | H168: 3 | I168: =G168*6+H168 -> 33 | K168: 8 | L168: 4 | M168: =K168*6+L168 -> 52 | O168: 9 | P168: 8 | Q168: =O168*6+P168 -> 62 | S168: HICKS
A169: BEST PLAYERS
A170: PORT MELBOURNE | C170: FINDLAY | F170: DOBSON | I170: FLETCHER | L170: FISHER | O170: BUTCHER | R170: STOREY
A171: PRESTON | C171: HINDS | F171: HARRY | I171: ANDERSON | L171: S STEWART | O171: LEISHMAN | R171: GIBBS
A172: GOALKICKERS
A173: PORT MELBOURNE | C173: FINDLAY 6 | F173: CULPH 2 | I173: FLETCHER 2
A174: PRESTON | C174: GIBBS 2 | E174: WARWICK 2 | H174: McBRIDE 2 | K174: DUGGAN | M174: ANDERSON | P174: LEISHMAN
A176: ROUND 4 | D176: 4TH MAY | J176: WEATHER | M176: FINE SUNNY | S176: PLAYED AT
D177: 1ST QTR | H177: 2ND QTR | L177: 3RD QTR | P177: FINAL | S177: CAMBERWELL
A178: CAMBERWELL | C178: 3 | D178: 6 | E178: =C178*6+D178 -> 24 | G178: 10 | H178: 14 | I178: =G178*6+H178 -> 74 | K178: 15 | L178: 16 | M178: =K178*6+L178 -> 106 | O178: 19 | P178: 22 | Q178: =O178*6+P178 -> 136 | S178: UMPIRE | X178: LADDER | AB178: ROUND | AD178: 4
A179: PORT MELBOURNE | C179: 3 | D179: 0 | E179: =C179*6+D179 -> 18 | G179: 6 | H179: 3 | I179: =G179*6+H179 -> 39 | K179: 10 | L179: 5 | M179: =K179*6+L179 -> 65 | O179: 13 | P179: 10 | Q179: =O179*6+P179 -> 88 | S179: WRIGHT
A180: BEST PLAYERS | W180: TEAM | X180: W | Y180: L | Z180: D | AA180: FOR | AB180: AGST | AC180: % | AD180: PTS
A181: CAMBERWELL | C181: HORKINGS | F181: BOYALL | I181: BRADFORD | L181: COLLIER | O181: MAYO | Q181: HARLAND
A182: PORT MELBOURNE | C182: FINDLAY | F182: DOBSON | I182: KELSEY | L182: HOUSTEN | O182: MURPHY | Q182: FLETCHER | W182: WILLIAMSTOWN | X182: 4 | Y182: 0 | Z182: 0 | AA182: 604 | AB182: 374 | AC182: 161.49732620320856 | AD182: 16
A183: GOALKICKERS | W183: CAMBERWELL | X183: 4 | Y183: 0 | Z183: 0 | AA183: 545 | AB183: 352 | AC183: 154.82954545454547 | AD183: 16
A184: CAMBERWELL | C184: MAYO 4 | E184: BRYCE 4 | G184: HARLAND 4 | J184: BOND 3 | L184: OLIVER 2 | N184: ANDERSON | Q184: BRADFORD | W184: BRIGHTON | X184: 3 | Y184: 1 | Z184: 0 | AA184: 477 | AB184: 475 | AC184: 100.42105263157895 | AD184: 12
A185: PORT MELBOURNE | C185: HOUSTEN 4 | F185: FINDLAY 3 | I185: CULPH 2 | K185: TAYLOR 2 | M185: KELLY | O185: DOBSON | W185: COBURG | X185: 2 | Y185: 2 | Z185: 0 | AA185: 373 | AB185: 336 | AC185: 111.01190476190476 | AD185: 8
A187: SANDRINGHAM | C187: 2 | D187: 5 | E187: =C187*6+D187 -> 17 | G187: 11 | H187: 9 | I187: =G187*6+H187 -> 75 | K187: 13 | L187: 13 | M187: =K187*6+L187 -> 91 | O187: 16 | P187: 16 | Q187: =O187*6+P187 -> 112 | S187: BEACH ROAD | W187: BRUNSWICK | X187: 2 | Y187: 2 | Z187: 0 | AA187: 373 | AB187: 340 | AC187: 109.70588235294117 | AD187: 8
A188: COBURG | C188: 2 | D188: 8 | E188: =C188*6+D188 -> 20 | G188: 5 | H188: 14 | I188: =G188*6+H188 -> 44 | K188: 8 | L188: 20 | M188: =K188*6+L188 -> 68 | O188: 11 | P188: 22 | Q188: =O188*6+P188 -> 88 | S188: BARNES | W188: PRAHRAN | X188: 2 | Y188: 2 | Z188: 0 | AA188: 475 | AB188: 476 | AC188: 99.789915966386559 | AD188: 8
A189: BEST PLAYERS | W189: SANDRINGHAM | X189: 2 | Y189: 2 | Z189: 0 | AA189: 342 | AB189: 404 | AC189: 84.653465346534659 | AD189: 8
A190: SANDRINGHAM | C190: BENCRAFT | F190: O'TOOLE | I190: TOMLINS | L190: EVANS | O190: CERINI | Q190: SIMS | W190: PORT MELBOURNE | X190: 2 | Y190: 2 | Z190: 0 | AA190: 381 | AB190: 466 | AC190: 81.759656652360519 | AD190: 8
A191: COBURG | C191: WILLIAMS | F191: CONDON | I191: WALSH | L191: HILL | O191: FYFFE | Q191: PROMNITZ | W191: YARRAVILLE | X191: 2 | Y191: 2 | Z191: 0 | AA191: 385 | AB191: 487 | AC191: 79.05544147843942 | AD191: 8
A192: GOALKICKERS | W192: NORTHCOTE | X192: 1 | Y192: 3 | Z192: 0 | AA192: 332 | AB192: 391 | AC192: 84.910485933503836 | AD192: 4
A193: SANDRINGHAM | C193: TOMLINS 6 | F193: BENCRAFT 5 | I193: SIMS 3 | K193: PARKER | M193: CERINI | W193: PRESTON | X193: 0 | Y193: 4 | Z193: 0 | AA193: 278 | AB193: 351 | AC193: 79.2022792022792 | AD193: 0
A194: COBURG | C194: WILSON 3 | F194: WILLIAMS 2 | I194: SITCH 2 | K194: HORE | M194: MILTE | O194: HILL | Q194: CONDON | W194: OAKLEIGH | X194: 0 | Y194: 4 | Z194: 0 | AA194: 364 | AB194: 477 | AC194: 76.310272536687634 | AD194: 0
A196: YARRAVILLE | C196: 3 | D196: 7 | E196: =C196*6+D196 -> 25 | G196: 10 | H196: 9 | I196: =G196*6+H196 -> 69 | K196: 18 | L196: 13 | M196: =K196*6+L196 -> 121 | O196: 20 | P196: 17 | Q196: =O196*6+P196 -> 137 | S196: YARRAVILLE
A197: PRAHRAN | C197: 7 | D197: 2 | E197: =C197*6+D197 -> 44 | G197: 13 | H197: 6 | I197: =G197*6+H197 -> 84 | K197: 17 | L197: 6 | M197: =K197*6+L197 -> 108 | O197: 19 | P197: 10 | Q197: =O197*6+P197 -> 124 | S197: THOMAS
A198: BEST PLAYERS
A199: YARRAVILLE | C199: GARDINER | F199: ELLIS | I199: McDONALD | L199: ROBB | N199: GARLICK | Q199: GRAY
A200: PRAHRAN | C200: DAVEY | F200: BATES | I200: CAMM | L200: LYONS | N200: WHITE | Q200: HANNAFORD
A201: GOALKICKERS
A202: YARRAVILLE | C202: ELLIS 7 | E202: ROBB 3 | G202: VINCENT 2 | I202: MCDONALD 2 | L202: GARLICK 2 | N202: RAWLINSON | Q202: RUDDELL | S202: MOLONEY | V202: GARRICK
A203: PRAHRAN | C203: DAVEY 5 | E203: LYONS 4 | G203: ARNOTT 3 | I203: WHITE 2 | K203: O'DONNELL 2 | N203: GARDINER | Q203: CONROY | S203: D'OLIVER
A205: BRUNSWICK | C205: 5 | D205: 7 | E205: =C205*6+D205 -> 37 | G205: 9 | H205: 11 | I205: =G205*6+H205 -> 65 | K205: 14 | L205: 17 | M205: =K205*6+L205 -> 101 | O205: 18 | P205: 19 | Q205: =O205*6+P205 -> 127 | S205: BRUNSWICK
A206: NORTHCOTE | C206: 0 | D206: 2 | E206: =C206*6+D206 -> 2 | G206: 3 | H206: 9 | I206: =G206*6+H206 -> 27 | K206: 5 | L206: 12 | M206: =K206*6+L206 -> 42 | O206: 9 | P206: 12 | Q206: =O206*6+P206 -> 66 | S206: VINES
A207: BEST PLAYERS
A208: BRUNSWICK | C208: PLUMMER | F208: CRAWFORD | I208: SMITH | L208: PRIESTLEY | O208: SUTTON | Q208: MORAM
A209: NORTHCOTE | C209: McINTOSH | F209: CRANE | I209: BARKER | L209: HISCOX | O209: NOLAN | Q209: ELLIS
A210: GOALKICKERS
A211: BRUNSWICK | C211: MANN 5 | F211: PRIESTLEY 4 | I211: CRAWFORD 4 | L211: NEWSON 3 | O211: SMITH | Q211: UPTON
A212: NORTHCOTE | C212: CRANE 5 | F212: JOHNSON | I212: CARNEY | K212: GALE | M212: WHITE
A214: BRIGHTON | C214: 3 | D214: 5 | E214: =C214*6+D214 -> 23 | G214: 9 | H214: 14 | I214: =G214*6+H214 -> 68 | K214: 16 | L214: 19 | M214: =K214*6+L214 -> 115 | O214: 19 | P214: 19 | Q214: =O214*6+P214 -> 133 | S214: ELSTERNWICK PARK
A215: OAKLEIGH | C215: 4 | D215: 5 | E215: =C215*6+D215 -> 29 | G215: 10 | H215: 5 | I215: =G215*6+H215 -> 65 | K215: 13 | L215: 8 | M215: =K215*6+L215 -> 86 | O215: 18 | P215: 16 | Q215: =O215*6+P215 -> 124 | S215: MERRINGTON
A216: BEST PLAYERS
A217: BRIGHTON | C217: McINDOE | F217: T NEW | I217: McGUIRE | L217: O'BRIEN | O217: CARROLL | R217: ORGER
A218: OAKLEIGH | C218: S FINN | F218: LANNING | I218: KENNEDY | L218: BICKERTON | O218: McKENZIE | R218: MOORE
A219: GOALKICKERS
A220: BRIGHTON | C220: O'BRIEN 5 | F220: McINDOE 4 | I220: DOUGLAS 4 | L220: ADAMSON 3 | O220: CARROLL 2 | R220: WHITE
A221: OAKLEIGH | C221: McKENZIE 5 | F221: S FINN 5 | I221: MOORE 3 | L221: WORRALL 2 | O221: O'SHEA | Q221: KENNEDY | T221: R FINN
A223: WILLIAMSTOWN | C223: 3 | D223: 5 | E223: =C223*6+D223 -> 23 | G223: 4 | H223: 6 | I223: =G223*6+H223 -> 30 | K223: 9 | L223: 9 | M223: =K223*6+L223 -> 63 | O223: 15 | P223: 10 | Q223: =O223*6+P223 -> 100 | S223: PRESTON
A224: PRESTON | C224: 3 | D224: 1 | E224: =C224*6+D224 -> 19 | G224: 8 | H224: 9 | I224: =G224*6+H224 -> 57 | K224: 10 | L224: 14 | M224: =K224*6+L224 -> 74 | O224: 12 | P224: 18 | Q224: =O224*6+P224 -> 90 | S224: HICKS
A225: BEST PLAYERS
A226: WILLIAMSTOWN | C226: RYAN | E226: WILLIAMS | H226: WILCOX | K226: MATTHEWS | N226: SPRING | Q226: SALVAS
A227: PRESTON | C227: EXELBY | E227: SNELL | H227: MASLEN | K227: C STEWART | N227: BOND | Q227: WARWICK
A228: GOALKICKERS
A229: WILLIAMSTOWN | C229: TODD 8 | F229: JAMIESON 3 | I229: SALVAS 2 | K229: WELLS | M229: MATTHEWS
A230: PRESTON | C230: WARWICK 3 | F230: LEISHMAN 2 | I230: McBRIDE 2 | L230: CONNELLY | N230: BOND | P230: McCARTHY | S230: SLEITH | U230: EXELBY
A232: ROUND 5 | D232: 11TH MAY | J232: WEATHER | M232: NORTH WEST WIND WARM | S232: PLAYED AT
D233: 1ST QTR | H233: 2ND QTR | L233: 3RD QTR | P233: FINAL | S233: COBURG
A234: COBURG | C234: 0 | D234: 2 | E234: =C234*6+D234 -> 2 | G234: 6 | H234: 6 | I234: =G234*6+H234 -> 42 | K234: 7 | L234: 9 | M234: =K234*6+L234 -> 51 | O234: 12 | P234: 14 | Q234: =O234*6+P234 -> 86 | S234: UMPIRE | X234: LADDER | AB234: ROUND | AD234: 5
A235: WILLIAMSTOWN | C235: 3 | D235: 11 | E235: =C235*6+D235 -> 29 | G235: 4 | H235: 13 | I235: =G235*6+H235 -> 37 | K235: 9 | L235: 18 | M235: =K235*6+L235 -> 72 | O235: 11 | P235: 19 | Q235: =O235*6+P235 -> 85 | S235: HICKS
A236: BEST PLAYERS | W236: TEAM | X236: W | Y236: L | Z236: D | AA236: FOR | AB236: AGST | AC236: % | AD236: PTS
A237: COBURG | C237: PROMNITZ | F237: FYFFE | I237: HORE | K237: McILVEEN | N237: WILSON | Q237: MILTE
A238: WILLIAMSTOWN | C238: HARLEY | F238: SALVAS | I238: WILCOX | K238: FEATHERBY | N238: SPRING | Q238: H McPHERSON | W238: CAMBERWELL | X238: 5 | Y238: 0 | Z238: 0 | AA238: 643 | AB238: 434 | AC238: 148.15668202764977 | AD238: 20
A239: GOALKICKERS | W239: WILLIAMSTOWN | X239: 4 | Y239: 1 | Z239: 0 | AA239: 689 | AB239: 460 | AC239: 149.78260869565219 | AD239: 16
A240: COBURG | C240: WILLIAMS 2 | F240: CREWTHER 2 | I240: MILTE 2 | K240: ENGELEEMER | N240: LONSDALE | Q240: HORE | R240: HILL | T240: SITCH | W240: BRIGHTON | X240: 4 | Y240: 1 | Z240: 0 | AA240: 611 | AB240: 545 | AC240: 112.11009174311927 | AD240: 16
A241: WILLIAMSTOWN | C241: SALVAS 3 | F241: WILLIAMS 2 | I241: RONALD 2 | L241: TODD | N241: SPRING | P241: HENRY | R241: HARRIS | W241: COBURG | X241: 3 | Y241: 2 | Z241: 0 | AA241: 459 | AB241: 421 | AC241: 109.02612826603325 | AD241: 12
A243: BRIGHTON | C243: 8 | D243: 5 | E243: =C243*6+D243 -> 53 | G243: 9 | H243: 7 | I243: =G243*6+H243 -> 61 | K243: 16 | L243: 12 | M243: =K243*6+L243 -> 108 | O243: 20 | P243: 14 | Q243: =O243*6+P243 -> 134 | S243: TOORAK PARK | W243: PORT MELBOURNE | X243: 3 | Y243: 2 | Z243: 0 | AA243: 494 | AB243: 524 | AC243: 94.274809160305338 | AD243: 12
A244: PRAHRAN | C244: 1 | D244: 2 | E244: =C244*6+D244 -> 8 | G244: 6 | H244: 4 | I244: =G244*6+H244 -> 40 | K244: 6 | L244: 5 | M244: =K244*6+L244 -> 41 | O244: 10 | P244: 10 | Q244: =O244*6+P244 -> 70 | S244: WRIGHT | W244: YARRAVILLE | X244: 3 | Y244: 2 | Z244: 0 | AA244: 500 | AB244: 580 | AC244: 86.206896551724142 | AD244: 12
A245: BEST PLAYERS | W245: BRUNSWICK | X245: 2 | Y245: 3 | Z245: 0 | AA245: 431 | AB245: 453 | AC245: 95.143487858719652 | AD245: 8
A246: BRIGHTON | C246: McINDOE | F246: BAILEY | I246: VALLENCE | L246: KENNETT | O246: O'BRIEN | Q246: ADAMSON | W246: PRAHRAN | X246: 2 | Y246: 3 | Z246: 0 | AA246: 545 | AB246: 610 | AC246: 89.344262295081961 | AD246: 8
A247: PRAHRAN | C247: LYONS | F247: FERGEUS | I247: CAMM | L247: MORROW | O247: BATES | Q247: GRAVELL | W247: SANDRINGHAM | X247: 2 | Y247: 3 | Z247: 0 | AA247: 421 | AB247: 499 | AC247: 84.368737474949896 | AD247: 8
A248: GOALKICKERS | P248: KENNETT | R248: CROSS | W248: NORTHCOTE | X248: 1 | Y248: 4 | Z248: 0 | AA248: 425 | AB248: 506 | AC248: 83.992094861660078 | AD248: 4
A249: BRIGHTON | C249: McINDOE 7 | F249: DOUGLAS 3 | I249: ADAMSON 3 | L249: VALLENCE 2 | O249: ARKINSTALL 2 | R249: CARROLL | W249: OAKLEIGH | X249: 1 | Y249: 4 | Z249: 0 | AA249: 459 | AB249: 556 | AC249: 82.553956834532372 | AD249: 4
A250: PRAHRAN | C250: LYONS 2 | E250: GRAVELL 2 | H250: CULLEN | J250: O'DONNELL | M250: FERGEUS | O250: LAMBORN | Q250: MORROW | S250: MIGHELL | W250: PRESTON | X250: 0 | Y250: 5 | Z250: 0 | AA250: 360 | AB250: 449 | AC250: 80.178173719376389 | AD250: 0
A252: PORT MELBOURNE | C252: 2 | D252: 3 | E252: =C252*6+D252 -> 15 | G252: 5 | H252: 8 | I252: =G252*6+H252 -> 38 | K252: 8 | L252: 11 | M252: =K252*6+L252 -> 59 | O252: 16 | P252: 17 | Q252: =O252*6+P252 -> 113 | S252: PORT MELBOURNE
A253: BRUNSWICK | C253: 3 | D253: 5 | E253: =C253*6+D253 -> 23 | G253: 4 | H253: 8 | I253: =G253*6+H253 -> 32 | K253: 7 | L253: 10 | M253: =K253*6+L253 -> 52 | O253: 8 | P253: 10 | Q253: =O253*6+P253 -> 58 | S253: TRAIT
A254: BEST PLAYERS
A255: PORT MELBOURNE | C255: MATTHEWS | F255: DOBSON | I255: FINDLAY | L255: REYNOLDS | O255: STOREY | R255: BUTCHER
A256: BRUNSWICK | C256: EVANS | F256: PRIESTLEY | I256: JACOBS | L256: NEWSON | O256: DAVIS | R256: HENRY
A257: GOALKICKERS
A258: PORT MELBOURNE | C258: HOUSTEN 7 | F258: FINDLAY 4 | I258: FLETCHER 3 | L258: CULPH | N258: TAYLOR | Q258: LYONS
A259: BRUNSWICK | C259: NEWSON 3 | F259: CRAWFORD | I259: GAYNOR | K259: PRIESTLEY | M259: MANN | O259: UPTON
A261: YARRAVILLE | C261: 5 | D261: 4 | E261: =C261*6+D261 -> 34 | G261: 10 | H261: 9 | I261: =G261*6+H261 -> 69 | K261: 12 | L261: 10 | M261: =K261*6+L261 -> 82 | O261: 17 | P261: 13 | Q261: =O261*6+P261 -> 115 | S261: NORTHCOTE
A262: NORTHCOTE | C262: 2 | D262: 5 | E262: =C262*6+D262 -> 17 | G262: 4 | H262: 10 | I262: =G262*6+H262 -> 34 | K262: 8 | L262: 17 | M262: =K262*6+L262 -> 65 | O262: 12 | P262: 21 | Q262: =O262*6+P262 -> 93 | S262: MERRINGTON
A263: BEST PLAYERS
A264: YARRAVILLE | C264: ROBB | F264: SORRAGHAN | I264: McDONALD | L264: GARDINER | O264: KNIGHT | Q264: ELLIS
A265: NORTHCOTE | C265: GREENHAM | F265: JONES | I265: BARKER | L265: McNAMARA | O265: STRAHAN | Q265: McINTOSH
A266: GOALKICKERS
A267: YARRAVILLE | C267: ROBB 6 | F267: PERUSSICH 3 | I267: SORRAGHAN 2 | L267: ELLIS 2 | N267: GARLICK 2 | Q267: McDONALD 2
A268: NORTHCOTE | C268: JONES 4 | F268: McINTOSH 3 | I268: KINDER | K268: McNAMARA | N268: GREENHAM | Q268: BARKER | S268: STRAHAN
A270: OAKLEIGH | C270: 4 | D270: 4 | E270: =C270*6+D270 -> 28 | G270: 6 | H270: 8 | I270: =G270*6+H270 -> 44 | K270: 10 | L270: 14 | M270: =K270*6+L270 -> 74 | O270: 13 | P270: 17 | Q270: =O270*6+P270 -> 95 | S270: OAKLEIGH
A271: SANDRINGHAM | C271: 5 | D271: 3 | E271: =C271*6+D271 -> 33 | G271: 7 | H271: 8 | I271: =G271*6+H271 -> 50 | K271: 9 | L271: 10 | M271: =K271*6+L271 -> 64 | O271: 11 | P271: 13 | Q271: =O271*6+P271 -> 79 | S271: VINES
A272: BEST PLAYERS
A273: OAKLEIGH | C273: E RYAN | E273: R FINN | H273: WILSON | K273: McKENZIE | N273: WORRALL | Q273: D RYAN
A274: SANDRINGHAM | C274: ANDERS | E274: BENCRAFT | H274: PARKER | K274: EVANS | N274: SCOLLARY | Q274: TOMLINS
A275: GOALKICKERS
A276: OAKLEIGH | C276: R FINN 4 | F276: S FINN 3 | I276: E RYAN 2 | L276: BEARD 2 | O276: McKENZIE 2
A277: SANDRINGHAM | C277: TOMLINS 4 | F277: CERINI 2 | I277: PARKER 2 | L277: BENCRAFT 2 | O277: REID
A279: CAMBERWELL | C279: 5 | D279: 2 | E279: =C279*6+D279 -> 32 | G279: 6 | H279: 8 | I279: =G279*6+H279 -> 44 | K279: 6 | L279: 11 | M279: =K279*6+L279 -> 47 | O279: 13 | P279: 20 | Q279: =O279*6+P279 -> 98 | S279: CAMBERWELL
A280: PRESTON | C280: 0 | D280: 2 | E280: =C280*6+D280 -> 2 | G280: 5 | H280: 4 | I280: =G280*6+H280 -> 34 | K280: 11 | L280: 8 | M280: =K280*6+L280 -> 74 | O280: 12 | P280: 10 | Q280: =O280*6+P280 -> 82 | S280: THOMAS
A281: BEST PLAYERS
A282: CAMBERWELL | C282: BRADFORD | F282: COLLIER | I282: SHARPLES | L282: HARLAND | O282: KENNEDY | R282: STYLES
A283: PRESTON | C283: S STEWART | F283: SLEITH | I283: SNELL | L283: MASLEN | O283: BRADLEY | R283: BOND
A284: GOALKICKERS
A285: CAMBERWELL | C285: MAYO 2 | E285: JENSEN 2 | G285: ANDERSON 2 | J285: SHIELDS 2 | M285: BOYALL | O285: BOND | Q285: HORKINGS | T285: FINN | V285: HARLAND
A286: PRESTON | C286: SLEITH 4 | F286: CONNELLY 3 | I286: DUGGAN 2 | L286: McBRIDE | N286: WARWICK | Q286: HINDS
A288: ROUND 6 | D288: 18TH MAY | H288: WEATHER | K288: SOUTH EAST WIND RAIN IN MORNING | S288: PLAYED AT
D289: 1ST QTR | H289: 2ND QTR | L289: 3RD QTR | P289: FINAL | S289: YARRAVILLE
A290: PORT MELBOURNE | C290: 4 | D290: 11 | E290: =C290*6+D290 -> 35 | G290: 6 | H290: 12 | I290: =G290*6+H290 -> 48 | K290: 12 | L290: 15 | M290: =K290*6+L290 -> 87 | O290: 12 | P290: 16 | Q290: =O290*6+P290 -> 88 | S290: UMPIRE | X290: LADDER | AB290: ROUND | AD290: 6
A291: YARRAVILLE | C291: 0 | D291: 2 | E291: =C291*6+D291 -> 2 | G291: 9 | H291: 8 | I291: =G291*6+H291 -> 62 | K291: 10 | L291: 9 | M291: =K291*6+L291 -> 69 | O291: 12 | P291: 15 | Q291: =O291*6+P291 -> 87 | S291: HICKS
A292: BEST PLAYERS | W292: TEAM | X292: W | Y292: L | Z292: D | AA292: FOR | AB292: AGST | AC292: % | AD292: PTS
A293: PORT MELBOURNE | C293: FINDLAY | E293: DOBSON | H293: BUTCHER | K293: TREMBATH | N293: FLETCHER | Q293: ALLEN
A294: YARRAVILLE | C294: ELLIS | E294: SCARFFE | H294: KNIGHT | K294: McDONALD | N294: ROBB | Q294: GARDINER | W294: CAMBERWELL | X294: 6 | Y294: 0 | Z294: 0 | AA294: 720 | AB294: 501 | AC294: 143.7125748502994 | AD294: 24
A295: GOALKICKERS | W295: WILLIAMSTOWN | X295: 5 | Y295: 1 | Z295: 0 | AA295: 795 | AB295: 543 | AC295: 146.40883977900552 | AD295: 20
A296: PORT MELBOURNE | C296: FINDLAY 5 | F296: ALLEN 2 | H296: FLETCHER 2 | K296: TREMBATH | N296: CULPH | P296: HOUSTEN | W296: BRIGHTON | X296: 4 | Y296: 1 | Z296: 1 | AA296: 699 | AB296: 633 | AC296: 110.42654028436019 | AD296: 18
A297: YARRAVILLE | C297: ELLIS 4 | F297: McDONALD 3 | I297: SORRAGHAN 3 | L297: ROBB 2 | W297: PORT MELBOURNE | X297: 4 | Y297: 2 | Z297: 0 | AA297: 582 | AB297: 611 | AC297: 95.253682487725044 | AD297: 16
A299: CAMBERWELL | C299: 3 | D299: 3 | E299: =C299*6+D299 -> 21 | G299: 6 | H299: 6 | I299: =G299*6+H299 -> 42 | K299: 6 | L299: 10 | M299: =K299*6+L299 -> 46 | O299: 11 | P299: 11 | Q299: =O299*6+P299 -> 77 | S299: BRUNSWICK | W299: COBURG | X299: 3 | Y299: 3 | Z299: 0 | AA299: 535 | AB299: 514 | AC299: 104.08560311284047 | AD299: 12
A300: BRUNSWICK | C300: 3 | D300: 4 | E300: =C300*6+D300 -> 22 | G300: 6 | H300: 9 | I300: =G300*6+H300 -> 45 | K300: 8 | L300: 11 | M300: =K300*6+L300 -> 59 | O300: 9 | P300: 13 | Q300: =O300*6+P300 -> 67 | S300: TRAIT | W300: SANDRINGHAM | X300: 3 | Y300: 3 | Z300: 0 | AA300: 568 | AB300: 612 | AC300: 92.810457516339866 | AD300: 12
A301: BEST PLAYERS | W301: YARRAVILLE | X301: 3 | Y301: 3 | Z301: 0 | AA301: 587 | AB301: 668 | AC301: 87.874251497005986 | AD301: 12
A302: CAMBERWELL | C302: BRADFORD | F302: HORKINGS | I302: HARLAND | L302: BOYALL | O302: MAYO | Q302: HERBERT | W302: BRUNSWICK | X302: 2 | Y302: 4 | Z302: 0 | AA302: 498 | AB302: 530 | AC302: 93.962264150943398 | AD302: 8
A303: BRUNSWICK | C303: PRIESTLEY | F303: DAVIS | I303: SUTTON | L303: JENNINGS | O303: UPTON | Q303: GLASSCOTT | W303: PRAHRAN | X303: 2 | Y303: 4 | Z303: 0 | AA303: 658 | AB303: 757 | AC303: 86.922060766182298 | AD303: 8
A304: GOALKICKERS | W304: NORTHCOTE | X304: 1 | Y304: 4 | Z304: 1 | AA304: 513 | AB304: 594 | AC304: 86.36363636363636 | AD304: 6
A305: CAMBERWELL | C305: MAYO 7 | F305: BRYCE | I305: BRADFORD | L305: BOYALL | N305: FINN | W305: PRESTON | X305: 1 | Y305: 5 | Z305: 0 | AA305: 453 | AB305: 525 | AC305: 86.285714285714292 | AD305: 4
A306: BRUNSWICK | C306: HENRY 3 | F306: JONES 2 | I306: GAYNOR 2 | L306: SMITH | N306: MORCOM | W306: OAKLEIGH | X306: 1 | Y306: 5 | Z306: 0 | AA306: 542 | AB306: 662 | AC306: 81.873111782477338 | AD306: 4
A308: SANDRINGHAM | C308: 4 | D308: 0 | E308: =C308*6+D308 -> 24 | G308: 12 | H308: 5 | I308: =G308*6+H308 -> 77 | K308: 17 | L308: 6 | M308: =K308*6+L308 -> 108 | O308: 22 | P308: 15 | Q308: =O308*6+P308 -> 147 | S308: BEACH RD
A309: PRAHRAN | C309: 6 | D309: 8 | E309: =C309*6+D309 -> 44 | G309: 8 | H309: 10 | I309: =G309*6+H309 -> 58 | K309: 13 | L309: 16 | M309: =K309*6+L309 -> 94 | O309: 16 | P309: 17 | Q309: =O309*6+P309 -> 113 | S309: WRIGHT
A310: BEST PLAYERS
A311: SANDRINGHAM | C311: BENCRAFT | F311: O'TOOLE | I311: TOYNE | L311: LOWRY | N311: CERINI | Q311: TOMLINS
A312: PRAHRAN | C312: GRAVELL | F312: BURGESS | I312: CAMM | L312: BATES | N312: O'DONNELL | Q312: LYONS
A313: GOALKICKERS
A314: SANDRINGHAM | C314: BENCRAFT 6 | F314: TOMLINS 5 | I314: LOWRY 4 | K314: HOLMES 2 | N314: SIMS 2 | P314: REID | Q314: ANDERS | S314: TOYNE
A315: PRAHRAN | C315: FERGEUS 5 | F315: BURGESS 4 | I315: LYONS 2 | K315: O'DONNELL | N315: McMAHON | Q315: ROLFE | S315: COOKE | U315: WHITE
A317: PRESTON | C317: 5 | D317: 2 | E317: =C317*6+D317 -> 32 | G317: 6 | H317: 2 | I317: =G317*6+H317 -> 38 | K317: 11 | L317: 8 | M317: =K317*6+L317 -> 74 | O317: 14 | P317: 9 | Q317: =O317*6+P317 -> 93 | S317: PRESTON
A318: COBURG | C318: 2 | D318: 1 | E318: =C318*6+D318 -> 13 | G318: 5 | H318: 7 | I318: =G318*6+H318 -> 37 | K318: 5 | L318: 8 | M318: =K318*6+L318 -> 38 | O318: 10 | P318: 16 | Q318: =O318*6+P318 -> 76 | S318: VINES
A319: BEST PLAYERS
A320: PRESTON | C320: SLEITH | F320: LEISHMAN | I320: C STEWART | L320: McBRIDE | N320: MASLEN | Q320: EXELBY
A321: COBURG | C321: R ATKINSON | F321: MILTE | I321: STARBUCK | L321: WILSON | N321: HEEPS | Q321: PROMNITZ
A322: GOALKICKERS
A323: PRESTON | C323: LEISHMAN 5 | F323: McBRIDE 3 | I323: SLEITH 2 | K323: EXELBY | M323: CONNELLY | O323: C STEWART | R323: HARRIS
A324: COBURG | C324: MILTE 3 | F324: CREWTHER 2 | I324: BLACKMORE | L324: MARDEN | N324: WILSON | P324: HEEPS | R324: HORE
A326: BRIGHTON | C326: 0 | D326: 1 | E326: =C326*6+D326 -> 1 | G326: 6 | H326: 8 | I326: =G326*6+H326 -> 44 | K326: 7 | L326: 9 | M326: =K326*6+L326 -> 51 | O326: 11 | P326: 22 | Q326: =O326*6+P326 -> 88 | S326: E'WICK PK
A327: NORTHCOTE | C327: 5 | D327: 7 | E327: =C327*6+D327 -> 37 | G327: 7 | H327: 7 | I327: =G327*6+H327 -> 49 | K327: 13 | L327: 10 | M327: =K327*6+L327 -> 88 | O327: 13 | P327: 10 | Q327: =O327*6+P327 -> 88 | S327: BARNES
A328: BEST PLAYERS
A329: BRIGHTON | C329: T NEW | E329: KENNETT | H329: CROSS | K329: ORGER | N329: ADAMSON | Q329: O'BRIEN
A330: NORTHCOTE | C330: NOLAN | E330: JONES | H330: BARKER | K330: McCRACKEN | N330: GREENHAM | Q330: STRAHAN
A331: GOALKICKERS
A332: BRIGHTON | C332: CARROLL 3 | F332: RICHARDSON 3 | I332: VALLENCE 2 | L332: ADAMSON | N332: O'BRIEN | P332: CROSS
A333: NORTHCOTE | C333: JONES 6 | F333: GREENHAM 3 | I333: MURPHY 2 | L333: CRANE | N333: McCRACKEN
A335: WILLIAMSTOWN | C335: 6 | D335: 9 | E335: =C335*6+D335 -> 45 | G335: 8 | H335: 14 | I335: =G335*6+H335 -> 62 | K335: 13 | L335: 17 | M335: =K335*6+L335 -> 95 | O335: 14 | P335: 22 | Q335: =O335*6+P335 -> 106 | S335: WILLIAMSTOWN
A336: OAKLEIGH | C336: 1 | D336: 2 | E336: =C336*6+D336 -> 8 | G336: 3 | H336: 6 | I336: =G336*6+H336 -> 24 | K336: 9 | L336: 10 | M336: =K336*6+L336 -> 64 | O336: 11 | P336: 17 | Q336: =O336*6+P336 -> 83 | S336: MERRINGTON
A337: BEST PLAYERS
A338: WILLIAMSTOWN | C338: SPRING | F338: TAYLOR | I338: CHISHOLM | L338: SALVAS | O338: HARLEY | R338: MATTHEWS
A339: OAKLEIGH | C339: WILSON | F339: BICKERTON | I339: WATSON | L339: BEARD | O339: KENNEDY | R339: S FINN
A340: GOALKICKERS
A341: WILLIAMSTOWN | C341: SPRING 5 | F341: TODD 3 | I341: TAYLOR 3 | L341: HARRIS | N341: WILLIAMS | Q341: MATTHEWS
A342: OAKLEIGH | C342: S FINN 3 | F342: McKENZIE 2 | I342: KENNEDY 2 | L342: R FINN | N342: WATSON | P342: BEARD | R342: ANDREW
A344: ROUND 7 | D344: 25TH MAY | J344: WEATHER | M344: NORTH WIND WARM | S344: PLAYED AT
D345: 1ST QTR | H345: 2ND QTR | L345: 3RD QTR | P345: FINAL | S345: PORT MELBOURNE
A346: PORT MELBOURNE | C346: 3 | D346: 7 | E346: =C346*6+D346 -> 25 | G346: 4 | H346: 11 | I346: =G346*6+H346 -> 35 | K346: 10 | L346: 12 | M346: =K346*6+L346 -> 72 | O346: 10 | P346: 12 | Q346: =O346*6+P346 -> 72 | S346: UMPIRE | X346: LADDER | AB346: ROUND | AD346: 7
A347: BRIGHTON | C347: 1 | D347: 5 | E347: =C347*6+D347 -> 11 | G347: 5 | H347: 13 | I347: =G347*6+H347 -> 43 | K347: 8 | L347: 15 | M347: =K347*6+L347 -> 63 | O347: 8 | P347: 20 | Q347: =O347*6+P347 -> 68 | S347: LEE
A348: BEST PLAYERS | W348: TEAM | X348: W | Y348: L | Z348: D | AA348: FOR | AB348: AGST | AC348: % | AD348: PTS
A349: PORT MELBOURNE | C349: KELSEY | F349: HOUSTEN | I349: FINDLAY | K349: REYNOLDS | N349: MURPHY | Q349: MATTHEWS
A350: BRIGHTON | C350: McGUIRE | F350: T NEW | I350: CROSS | K350: ORGER | N350: BAILEY | Q350: HALCOMBE | W350: CAMBERWELL | X350: 7 | Y350: 0 | Z350: 0 | AA350: 887 | AB350: 602 | AC350: 147.34219269102991 | AD350: 28
A351: GOALKICKERS | W351: WILLIAMSTOWN | X351: 6 | Y351: 1 | Z351: 0 | AA351: 882 | AB351: 628 | AC351: 140.44585987261146 | AD351: 24
A352: PORT MELBOURNE | C352: HOUSTEN 5 | F352: CULPH 2 | I352: ALLEN 2 | K352: FINDLAY | W352: PORT MELBOURNE | X352: 5 | Y352: 2 | Z352: 0 | AA352: 654 | AB352: 679 | AC352: 96.318114874815905 | AD352: 20
A353: BRIGHTON | C353: RICHARDSON 2 | F353: T NEW | H353: DOUGLAS | J353: CARROLL | L353: ARKINSTALL | O353: H NEW | Q353: ADAMSON | W353: BRIGHTON | X353: 4 | Y353: 2 | Z353: 1 | AA353: 767 | AB353: 705 | AC353: 108.79432624113475 | AD353: 18
A355: CAMBERWELL | C355: 7 | D355: 7 | E355: =C355*6+D355 -> 49 | G355: 14 | H355: 10 | I355: =G355*6+H355 -> 94 | K355: 21 | L355: 15 | M355: =K355*6+L355 -> 141 | O355: 25 | P355: 17 | Q355: =O355*6+P355 -> 167 | S355: CAMBERWELL | W355: COBURG | X355: 4 | Y355: 3 | Z355: 0 | AA355: 655 | AB355: 598 | AC355: 109.53177257525084 | AD355: 16
A356: YARRAVILLE | C356: 2 | D356: 3 | E356: =C356*6+D356 -> 15 | G356: 7 | H356: 10 | I356: =G356*6+H356 -> 52 | K356: 11 | L356: 11 | M356: =K356*6+L356 -> 77 | O356: 14 | P356: 17 | Q356: =O356*6+P356 -> 101 | S356: WRIGHT | W356: SANDRINGHAM | X356: 4 | Y356: 3 | Z356: 0 | AA356: 671 | AB356: 700 | AC356: 95.857142857142861 | AD356: 16
A357: BEST PLAYERS | W357: BRUNSWICK | X357: 3 | Y357: 4 | Z357: 0 | AA357: 572 | AB357: 593 | AC357: 96.458684654300171 | AD357: 12
A358: CAMBERWELL | C358: BOYALL | E358: OLIVER | H358: BRADFORD | K358: JENSEN | N358: HARLAND | Q358: SHARPLES | W358: YARRAVILLE | X358: 3 | Y358: 4 | Z358: 0 | AA358: 688 | AB358: 835 | AC358: 82.395209580838326 | AD358: 12
A359: YARRAVILLE | C359: ELLIS | E359: SCARFFE | H359: SORRAGHAN | K359: McDONALD | N359: GARLICK | Q359: ROBB | W359: PRAHRAN | X359: 2 | Y359: 5 | Z359: 0 | AA359: 743 | AB359: 844 | AC359: 88.03317535545024 | AD359: 8
A360: GOALKICKERS | W360: NORTHCOTE | X360: 1 | Y360: 5 | Z360: 1 | AA360: 601 | AB360: 697 | AC360: 86.226685796269734 | AD360: 6
A361: CAMBERWELL | C361: MAYO 6 | E361: OLIVER 6 | G361: BOYALL 5 | I361: BRADFORD 4 | L361: SHIELDS 2 | N361: JENSEN | P361: HARLAND | W361: PRESTON | X361: 1 | Y361: 6 | Z361: 0 | AA361: 516 | AB361: 599 | AC361: 86.143572621035062 | AD361: 4
A362: YARRAVILLE | C362: SORRAGHAN 4 | F362: MOLONEY 2 | I362: HARDIMAN 2 | L362: McDONALD 2 | O362: SCARFFE | Q362: MULLENGER | T362: ELLIS | W362: OAKLEIGH | X362: 1 | Y362: 6 | Z362: 0 | AA362: 626 | AB362: 782 | AC362: 80.051150895140665 | AD362: 4
A364: WILLIAMSTOWN | C364: 7 | D364: 5 | E364: =C364*6+D364 -> 47 | G364: 10 | H364: 6 | I364: =G364*6+H364 -> 66 | K364: 12 | L364: 10 | M364: =K364*6+L364 -> 82 | O364: 12 | P364: 15 | Q364: =O364*6+P364 -> 87 | S364: TOORAK PARK
A365: PRAHRAN | C365: 4 | D365: 1 | E365: =C365*6+D365 -> 25 | G365: 7 | H365: 9 | I365: =G365*6+H365 -> 51 | K365: 9 | L365: 11 | M365: =K365*6+L365 -> 65 | O365: 12 | P365: 13 | Q365: =O365*6+P365 -> 85 | S365: HICKS
A366: BEST PLAYERS
A367: WILLIAMSTOWN | C367: SALVAS | E367: VINALL | H367: TAYLOR | K367: HENRY | N367: ARCHIBALD | Q367: SPRING
A368: PRAHRAN | C368: BATES | E368: O'CONNOR | H368: WHITE | K368: CAMM | N368: FERGEUS | Q368: GRAVELL
A369: GOALKICKERS
A370: WILLIAMSTOWN | C370: TODD 4 | F370: HARRIS 3 | I370: SPRING 2 | K370: SALVAS | M370: TAYLOR | O370: CHISHOLM
A371: PRAHRAN | C371: STACKPOLE 4 | F371: DAVEY 2 | I371: CULLEN 2 | K371: FERGEUS | M371: COOKE | O371: ROLFE | Q371: McMAHON
A373: BRUNSWICK | C373: 3 | D373: 7 | E373: =C373*6+D373 -> 25 | G373: 4 | H373: 9 | I373: =G373*6+H373 -> 33 | K373: 7 | L373: 9 | M373: =K373*6+L373 -> 51 | O373: 10 | P373: 14 | Q373: =O373*6+P373 -> 74 | S373: BRUNSWICK
A374: PRESTON | C374: 3 | D374: 2 | E374: =C374*6+D374 -> 20 | G374: 4 | H374: 5 | I374: =G374*6+H374 -> 29 | K374: 8 | L374: 7 | M374: =K374*6+L374 -> 55 | O374: 9 | P374: 9 | Q374: =O374*6+P374 -> 63 | S374: MERRINGTON
A375: BEST PLAYERS
A376: BRUNSWICK | C376: BAKER | E376: SILK | H376: PRIESTLEY | K376: GLASSCOTT | N376: SUTTON | Q376: GEISLER
A377: PRESTON | C377: MASLEN | E377: SNELL | H377: S STEWART | K377: CONNELLY | N377: HINDS | Q377: LEISHMAN
A378: GOALKICKERS
A379: BRUNSWICK | C379: BAGGOTT 3 | F379: UPTON 3 | I379: PRIESTLEY 2 | L379: MORCOM | N379: JACOBS
A380: PRESTON | C380: CONNELLY 5 | F380: SLEITH | I380: G BOND | K380: HARRIS | M380: McCARTHY
A382: SANDRINGHAM | C382: 4 | D382: 2 | E382: =C382*6+D382 -> 26 | G382: 7 | H382: 3 | I382: =G382*6+H382 -> 45 | K382: 10 | L382: 6 | M382: =K382*6+L382 -> 66 | O382: 15 | P382: 13 | Q382: =O382*6+P382 -> 103 | S382: NORTHCOTE
A383: NORTHCOTE | C383: 3 | D383: 3 | E383: =C383*6+D383 -> 21 | G383: 6 | H383: 7 | I383: =G383*6+H383 -> 43 | K383: 10 | L383: 8 | M383: =K383*6+L383 -> 68 | O383: 13 | P383: 10 | Q383: =O383*6+P383 -> 88 | S383: THOMAS
A384: BEST PLAYERS
A385: SANDRINGHAM | C385: EVANS | F385: O'TOOLE | I385: LAVER | L385: BENCRAFT | O385: TOMLINS | Q385: GUILLE
A386: NORTHCOTE | C386: STAFFORD | F386: McINTOSH | I386: BARKER | L386: STRAHAN | O386: WHITE | Q386: NOLAN
A387: GOALKICKERS
A388: SANDRINGHAM | C388: BENCRAFT 4 | F388: GUILLE 2 | H388: PARKER 2 | K388: TOMLINS 2 | N388: TOYNE | P388: SIMS | Q388: POLE | R388: WEBB | T388: SLEIGH
A389: NORTHCOTE | C389: GREENHAM 3 | F389: JONES 3 | H389: McCRACKEN 2 | K389: STAFFORD | M389: WHITE | O389: MCINTOSH | Q389: KINDER | S389: MALONE
A391: COBURG | C391: 6 | D391: 7 | E391: =C391*6+D391 -> 43 | G391: 6 | H391: 12 | I391: =G391*6+H391 -> 48 | K391: 14 | L391: 18 | M391: =K391*6+L391 -> 102 | O391: 17 | P391: 18 | Q391: =O391*6+P391 -> 120 | S391: OAKLEIGH
A392: OAKLEIGH | C392: 1 | D392: 3 | E392: =C392*6+D392 -> 9 | G392: 3 | H392: 7 | I392: =G392*6+H392 -> 25 | K392: 6 | L392: 12 | M392: =K392*6+L392 -> 48 | O392: 11 | P392: 18 | Q392: =O392*6+P392 -> 84 | S392: VINES
A393: BEST PLAYERS
A394: COBURG | C394: WILLIAMS | F394: WILSON | I394: HORE | K394: TITUS | N394: LONSDALE | Q394: MILTE
A395: OAKLEIGH | C395: LANNING | F395: DRYDEN | I395: WHITE | K395: ANDREW | N395: BEARD | Q395: WALLIKER
A396: GOALKICKERS
A397: COBURG | C397: CREWTHER 4 | F397: TITUS 3 | H397: WILLIAMS 3 | K397: MARDEN 2 | N397: PERRIN | P397: ENGELEEMER | S397: WALKER | V397: CONDON
A398: OAKLEIGH | C398: McKENZIE 4 | F398: S FINN 2 | I398: BEARD 2 | K398: ANDREW | M398: WALLIKER | P398: KENNEDY
A400: ROUND 8 | D400: 1ST JUNE | J400: WEATHER | M400: SOUTH WEST WIND RAIN | S400: PLAYED AT
D401: 1ST QTR | H401: 2ND QTR | L401: 3RD QTR | P401: FINAL | S401: ELSTERNWICK PARK
A402: BRIGHTON | C402: 2 | D402: 3 | E402: =C402*6+D402 -> 15 | G402: 7 | H402: 13 | I402: =G402*6+H402 -> 55 | K402: 9 | L402: 16 | M402: =K402*6+L402 -> 70 | O402: 12 | P402: 20 | Q402: =O402*6+P402 -> 92 | S402: UMPIRE | X402: LADDER | AB402: ROUND | AD402: 8
A403: CAMBERWELL | C403: 4 | D403: 7 | E403: =C403*6+D403 -> 31 | G403: 7 | H403: 8 | I403: =G403*6+H403 -> 50 | K403: 9 | L403: 12 | M403: =K403*6+L403 -> 66 | O403: 9 | P403: 13 | Q403: =O403*6+P403 -> 67 | S403: SIMPSON
A404: BEST PLAYERS | W404: TEAM | X404: W | Y404: L | Z404: D | AA404: FOR | AB404: AGST | AC404: % | AD404: PTS
A405: BRIGHTON | C405: T NEW | F405: HUGHES | I405: ARKINSTALL | L405: ORGER | N405: KENNETT | Q405: BAILEY
A406: CAMBERWELL | C406: BRADFORD | F406: STYLES | I406: COLLIER | L406: BOYALL | N406: JENSEN | Q406: BURKHALTER | W406: WILLIAMSTOWN | X406: 7 | Y406: 1 | Z406: 0 | AA406: 976 | AB406: 682 | AC406: 143.10850439882697 | AD406: 28
A407: GOALKICKERS | R407: KENNETT | W407: CAMBERWELL | X407: 7 | Y407: 1 | Z407: 0 | AA407: 954 | AB407: 694 | AC407: 137.46397694524495 | AD407: 28
A408: BRIGHTON | C408: VALLENCE 3 | F408: HUGHES 2 | I408: ADAMSON 2 | L408: CARROLL | N408: DOUGLAS | P408: RICHARDSON | S408: PLUNKETT | W408: BRIGHTON | X408: 5 | Y408: 2 | Z408: 1 | AA408: 859 | AB408: 772 | AC408: 111.26943005181347 | AD408: 22
A409: CAMBERWELL | C409: MAYO 3 | F409: BRADFORD 2 | I409: SHIELDS 2 | L409: BRISTOWE | O409: JENSEN | W409: COBURG | X409: 5 | Y409: 3 | Z409: 0 | AA409: 721 | AB409: 663 | AC409: 108.74811463046757 | AD409: 20
A411: SANDRINGHAM | C411: 2 | D411: 3 | E411: =C411*6+D411 -> 15 | G411: 8 | H411: 13 | I411: =G411*6+H411 -> 61 | K411: 10 | L411: 13 | M411: =K411*6+L411 -> 73 | O411: 14 | P411: 13 | Q411: =O411*6+P411 -> 97 | S411: BEACH ROAD | W411: SANDRINGHAM | X411: 5 | Y411: 3 | Z411: 0 | AA411: 768 | AB411: 778 | AC411: 98.714652956298195 | AD411: 20
A412: PORT MELBOURNE | C412: 4 | D412: 3 | E412: =C412*6+D412 -> 27 | G412: 4 | H412: 3 | I412: =G412*6+H412 -> 27 | K412: 11 | L412: 8 | M412: =K412*6+L412 -> 74 | O412: 11 | P412: 12 | Q412: =O412*6+P412 -> 78 | S412: WRIGHT | W412: PORT MELBOURNE | X412: 5 | Y412: 3 | Z412: 0 | AA412: 732 | AB412: 776 | AC412: 94.329896907216494 | AD412: 20
A413: BEST PLAYERS | W413: BRUNSWICK | X413: 4 | Y413: 4 | Z413: 0 | AA413: 700 | AB413: 700 | AC413: 100 | AD413: 16
A414: SANDRINGHAM | C414: TOYNE | E414: O'TOOLE | H414: PARKER | K414: CERINI | M414: SIMS | P414: POLE | W414: YARRAVILLE | X414: 3 | Y414: 5 | Z414: 0 | AA414: 795 | AB414: 963 | AC414: 82.554517133956381 | AD414: 12
A415: PORT MELBOURNE | C415: STOREY | E415: GOLDSMITH | H415: BUTCHER | K415: FINDLAY | M415: DOBSON | P415: HOUSTEN | W415: PRESTON | X415: 2 | Y415: 6 | Z415: 0 | AA415: 650 | AB415: 644 | AC415: 100.93167701863354 | AD415: 8
A416: GOALKICKERS | W416: PRAHRAN | X416: 2 | Y416: 6 | Z416: 0 | AA416: 808 | AB416: 910 | AC416: 88.791208791208788 | AD416: 8
A417: SANDRINGHAM | C417: POLE 3 | E417: TOMLINS 2 | H417: ANDERS 2 | J417: LOWRY 2 | M417: HOLMES 2 | O417: PARKER | Q417: GUILLE | S417: SIMS | W417: NORTHCOTE | X417: 1 | Y417: 6 | Z417: 1 | AA417: 655 | AB417: 791 | AC417: 82.80657395701644 | AD417: 6
A418: PORT MELBOURNE | C418: HOUSTEN 4 | F418: ALLEN 2 | I418: MENZIES 2 | L418: FINDLAY | N418: CULPH | P418: DOBSON | W418: OAKLEIGH | X418: 1 | Y418: 7 | Z418: 0 | AA418: 671 | AB418: 916 | AC418: 73.253275109170303 | AD418: 4
A420: COBURG | C420: 4 | D420: 4 | E420: =C420*6+D420 -> 28 | G420: 7 | H420: 7 | I420: =G420*6+H420 -> 49 | K420: 7 | L420: 8 | M420: =K420*6+L420 -> 50 | O420: 9 | P420: 12 | Q420: =O420*6+P420 -> 66 | S420: COBURG
A421: PRAHRAN | C421: 3 | D421: 1 | E421: =C421*6+D421 -> 19 | G421: 4 | H421: 2 | I421: =G421*6+H421 -> 26 | K421: 7 | L421: 9 | M421: =K421*6+L421 -> 51 | O421: 9 | P421: 11 | Q421: =O421*6+P421 -> 65 | S421: BARNES
A422: BEST PLAYERS
A423: COBURG | C423: R ATKINSON | F423: WILLIAMS | I423: TITUS | L423: WILSON | O423: FYFFE | Q423: EGAN
A424: PRAHRAN | C424: GRAVELL | F424: ROWELL | I424: BATES | L424: BURGESS | O424: DAVIES | Q424: McMAHON
A425: GOALKICKERS
A426: COBURG | C426: TITUS 4 | F426: FYFFE 3 | I426: EGAN | K426: WILLIAMS
A427: PRAHRAN | C427: BURGESS 3 | F427: ARNOTT | H427: WHITE | J427: STACKPOLE | M427: NEWTON | O427: CULLEN | Q427: BLUMFIELD
A429: BRUNSWICK | C429: 1 | D429: 4 | E429: =C429*6+D429 -> 10 | G429: 9 | H429: 7 | I429: =G429*6+H429 -> 61 | K429: 12 | L429: 9 | M429: =K429*6+L429 -> 81 | O429: 19 | P429: 14 | Q429: =O429*6+P429 -> 128 | S429: YARRAVILLE
A430: YARRAVILLE | C430: 4 | D430: 4 | E430: =C430*6+D430 -> 28 | G430: 7 | H430: 6 | I430: =G430*6+H430 -> 48 | K430: 14 | L430: 13 | M430: =K430*6+L430 -> 97 | O430: 15 | P430: 17 | Q430: =O430*6+P430 -> 107 | S430: MERRINGTON
A431: BEST PLAYERS
A432: BRUNSWICK | C432: SMITH | F432: PLUMMER | I432: JACOBS | L432: DAVIS | N432: EVANS | Q432: UPTON
A433: YARRAVILLE | C433: HARDIMAN | F433: JONES | I433: GARLICK | L433: WHITE | N433: SORRAGHAN | Q433: WOODS
A434: GOALKICKERS
A435: BRUNSWICK | C435: JACOBS 4 | E435: MANN 3 | G435: SMITH 3 | I435: UPTON 3 | K435: GLASSCOTT 2 | N435: PRIESTLEY 2 | Q435: WELDON | S435: MORCOM
A436: YARRAVILLE | C436: HARDIMAN 9 | F436: SORRAGHAN 2 | I436: ELLIS | J436: ROBB | L436: SCARFFE | N436: McDONALD
A438: PRESTON | C438: 3 | D438: 4 | E438: =C438*6+D438 -> 22 | G438: 12 | H438: 10 | I438: =G438*6+H438 -> 82 | K438: 16 | L438: 16 | M438: =K438*6+L438 -> 112 | O438: 19 | P438: 20 | Q438: =O438*6+P438 -> 134 | S438: PRESTON
A439: OAKLEIGH | C439: 1 | D439: 3 | E439: =C439*6+D439 -> 9 | G439: 2 | H439: 6 | I439: =G439*6+H439 -> 18 | K439: 2 | L439: 12 | M439: =K439*6+L439 -> 24 | O439: 5 | P439: 15 | Q439: =O439*6+P439 -> 45 | S439: LEE
A440: BEST PLAYERS
A441: PRESTON | C441: EXELBY | E441: LEISHMAN | I441: SNELL | L441: C STEWART | O441: SLEITH | Q441: N BOND
A442: OAKLEIGH | C442: BEARD | E442: WILSON | I442: O'DONOGHUE | L442: McKENZIE | O442: R FINN | Q442: MOORE
A443: GOALKICKERS
A444: PRESTON | C444: N BOND 5 | E444: LEISHMAN 3 | H444: WATTS 2 | J444: HARRIS 2 | L444: SLEITH 2 | N444: G BOND | P444: S STEWART | R444: CONNELLY | U444: BROOKS | X444: EXELBY
A445: OAKLEIGH | C445: E RYAN 2 | F445: McKENZIE | I445: R FINN | K445: ANDREW
A447: WILLIAMSTOWN | C447: 1 | D447: 2 | E447: =C447*6+D447 -> 8 | G447: 7 | H447: 10 | I447: =G447*6+H447 -> 52 | K447: 8 | L447: 10 | M447: =K447*6+L447 -> 58 | O447: 13 | P447: 16 | Q447: =O447*6+P447 -> 94 | S447: WILLIAMSTOWN
A448: NORTHCOTE | C448: 4 | D448: 5 | E448: =C448*6+D448 -> 29 | G448: 4 | H448: 5 | I448: =G448*6+H448 -> 29 | K448: 6 | L448: 17 | M448: =K448*6+L448 -> 53 | O448: 6 | P448: 18 | Q448: =O448*6+P448 -> 54 | S448: VINES
A449: BEST PLAYERS
A450: WILLIAMSTOWN | C450: WILCOX | F450: MATTHEWS | I450: SALVAS | L450: TAYLOR | O450: WILLIAMS | R450: HARLEY
A451: NORTHCOTE | C451: BARKER | F451: BRAZIER | I451: MCINTOSH | L451: WILLIAMSON | O451: HISCOX | R451: CRANE
A452: GOALKICKERS
A453: WILLIAMSTOWN | C453: HARRIS 7 | F453: TODD 2 | I453: SALVAS 2 | L453: MATTHEWS | O453: TAYLOR
A454: NORTHCOTE | C454: WILLIAMSON 2 | F454: McINTOSH | I454: HISCOX | K454: JONES | M454: BRAZIER
A456: ROUND 9 | D456: 8TH JUNE | J456: WEATHER | M456: NORTH WEST WIND COLD | S456: PLAYED AT
D457: 1ST QTR | H457: 2ND QTR | L457: 3RD QTR | P457: FINAL | S457: BRUNSWICK
A458: BRUNSWICK | C458: 5 | D458: 2 | E458: =C458*6+D458 -> 32 | G458: 11 | H458: 6 | I458: =G458*6+H458 -> 72 | K458: 13 | L458: 10 | M458: =K458*6+L458 -> 88 | O458: 15 | P458: 17 | Q458: =O458*6+P458 -> 107 | S458: UMPIRE | X458: LADDER | AB458: ROUND | AD458: 9
A459: BRIGHTON | C459: 2 | D459: 2 | E459: =C459*6+D459 -> 14 | G459: 7 | H459: 3 | I459: =G459*6+H459 -> 45 | K459: 9 | L459: 4 | M459: =K459*6+L459 -> 58 | O459: 9 | P459: 8 | Q459: =O459*6+P459 -> 62 | S459: SIMPSON
A460: BEST PLAYERS | W460: TEAM | X460: W | Y460: L | Z460: D | AA460: FOR | AB460: AGST | AC460: % | AD460: PTS
A461: BRUNSWICK | C461: GLASSCOTT | F461: CRAWFORD | I461: PRIESTLEY | L461: MANN | N461: WELDON | Q461: SMITH
A462: BRIGHTON | C462: RICHARDSON | F462: HALCOMBE | I462: McGUIRE | L462: DAVEY | N462: KENNETT | Q462: ADAMSON | W462: WILLIAMSTOWN | X462: 7 | Y462: 2 | Z462: 0 | AA462: 1076 | AB462: 817 | AC462: 131.70134638922889 | AD462: 28
A463: GOALKICKERS | Q463: SILK | S463: JACOBS | W463: CAMBERWELL | X463: 7 | Y463: 2 | Z463: 0 | AA463: 1069 | AB463: 812 | AC463: 131.65024630541873 | AD463: 28
A464: BRUNSWICK | C464: MANN 5 | E464: SMITH 2 | G464: PRIESTLEY | I464: UPTON | K464: DAVIS | M464: CRAWFORD | P464: MORCOM | R464: WELDON | W464: COBURG | X464: 6 | Y464: 3 | Z464: 0 | AA464: 812 | AB464: 732 | AC464: 110.92896174863388 | AD464: 24
A465: BRIGHTON | C465: ADAMSON 3 | F465: VALLENCE | I465: DOUGLAS | K465: RICHARDSON | N465: PLUNKETT | P465: LACEY | R465: KENNETT | W465: SANDRINGHAM | X465: 6 | Y465: 3 | Z465: 0 | AA465: 886 | AB465: 893 | AC465: 99.216125419932808 | AD465: 24
A467: YARRAVILLE | C467: 4 | D467: 15 | E467: =C467*6+D467 -> 39 | G467: 7 | H467: 18 | I467: =G467*6+H467 -> 60 | K467: 12 | L467: 20 | M467: =K467*6+L467 -> 92 | O467: 13 | P467: 23 | Q467: =O467*6+P467 -> 101 | S467: YARRAVILLE | W467: PORT MELBOURNE | X467: 6 | Y467: 3 | Z467: 0 | AA467: 867 | AB467: 876 | AC467: 98.972602739726028 | AD467: 24
A468: PRESTON | C468: 2 | D468: 2 | E468: =C468*6+D468 -> 14 | G468: 5 | H468: 7 | I468: =G468*6+H468 -> 37 | K468: 6 | L468: 9 | M468: =K468*6+L468 -> 45 | O468: 13 | P468: 13 | Q468: =O468*6+P468 -> 91 | S468: HICKS | W468: BRIGHTON | X468: 5 | Y468: 3 | Z468: 1 | AA468: 921 | AB468: 879 | AC468: 104.77815699658703 | AD468: 22
A469: BEST PLAYERS | W469: BRUNSWICK | X469: 5 | Y469: 4 | Z469: 0 | AA469: 807 | AB469: 762 | AC469: 105.90551181102362 | AD469: 20
A470: YARRAVILLE | C470: RUDDELL | F470: ROBB | H470: McDONALD | K470: KNIGHT | N470: GARDNER | Q470: ELLIS | W470: YARRAVILLE | X470: 4 | Y470: 5 | Z470: 0 | AA470: 896 | AB470: 1054 | AC470: 85.009487666034161 | AD470: 16
A471: PRESTON | C471: S STEWART | F471: SNELL | H471: HARRIS | K471: MASLEN | N471: EXELBY | Q471: HINDS | W471: PRESTON | X471: 2 | Y471: 7 | Z471: 0 | AA471: 741 | AB471: 745 | AC471: 99.463087248322154 | AD471: 8
A472: GOALKICKERS | W472: PRAHRAN | X472: 2 | Y472: 7 | Z472: 0 | AA472: 880 | AB472: 1032 | AC472: 85.271317829457359 | AD472: 8
A473: YARRAVILLE | C473: HARDIMAN 4 | F473: ROBB 3 | H473: McDONALD 2 | K473: RUDDELL 2 | N473: JONES | P473: ELLIS | W473: OAKLEIGH | X473: 2 | Y473: 7 | Z473: 0 | AA473: 793 | AB473: 988 | AC473: 80.263157894736835 | AD473: 8
A474: PRESTON | C474: WATTS 4 | E474: CONNELLY 3 | H474: SLEITH 2 | J474: EXELBY | L474: HARRIS | N474: G BOND | P474: CLEMENTS | W474: NORTHCOTE | X474: 1 | Y474: 7 | Z474: 1 | AA474: 724 | AB474: 882 | AC474: 82.086167800453509 | AD474: 6
A476: OAKLEIGH | C476: 1 | D476: 2 | E476: =C476*6+D476 -> 8 | G476: 4 | H476: 10 | I476: =G476*6+H476 -> 34 | K476: 11 | L476: 11 | M476: =K476*6+L476 -> 77 | O476: 18 | P476: 14 | Q476: =O476*6+P476 -> 122 | S476: TOORAK PARK
A477: PRAHRAN | C477: 1 | D477: 4 | E477: =C477*6+D477 -> 10 | G477: 3 | H477: 9 | I477: =G477*6+H477 -> 27 | K477: 7 | L477: 16 | M477: =K477*6+L477 -> 58 | O477: 9 | P477: 18 | Q477: =O477*6+P477 -> 72 | S477: LEE
A478: BEST PLAYERS
A479: OAKLEIGH | C479: WILSON | F479: KENNEDY | I479: BICKERTON | L479: MATTHEWS | O479: S FINN | Q479: BEARD
A480: PRAHRAN | C480: GRAVELL | F480: MOLONEY | I480: WEBER | L480: O'DONNELL | O480: CAMM | Q480: NEWTON
A481: GOALKICKERS
A482: OAKLEIGH | C482: TIBBALLS 5 | F482: S FINN 3 | H482: McKENZIE 3 | K482: KENNEDY 2 | N482: CRAWSHAW 2 | Q482: E RYAN 2 | T482: GRAY
A483: PRAHRAN | C483: BURGESS 3 | F483: WALSH 2 | I483: FERGEUS | K483: DAVEY | M483: BLUMFIELD | P483: STACKPOLE
D484: 10TH JUNE | H484: VICTORY DAY | K484: WEATHER | O484: WEST WIND DULL
A485: SANDRINGHAM | C485: 4 | D485: 1 | E485: =C485*6+D485 -> 25 | G485: 9 | H485: 8 | I485: =G485*6+H485 -> 62 | K485: 12 | L485: 12 | M485: =K485*6+L485 -> 84 | O485: 17 | P485: 16 | Q485: =O485*6+P485 -> 118 | S485: CAMBERWELL
A486: CAMBERWELL | C486: 5 | D486: 8 | E486: =C486*6+D486 -> 38 | G486: 8 | H486: 10 | I486: =G486*6+H486 -> 58 | K486: 15 | L486: 16 | M486: =K486*6+L486 -> 106 | O486: 16 | P486: 19 | Q486: =O486*6+P486 -> 115 | S486: WRIGHT
A487: BEST PLAYERS
A488: SANDRINGHAM | C488: TOYNE | E488: POLE | H488: TOMLINS | K488: WEBB | N488: ANDERS | Q488: PARKER
A489: CAMBERWELL | C489: TAYLOR | E489: STYLES | H489: BOYALL | K489: OLIVER | N489: JENSEN | Q489: HORKINGS
A490: GOALKICKERS
A491: SANDRINGHAM | C491: PARKER 5 | F491: TOMLINS 3 | I491: BENCRAFT 3 | L491: HOLMES 2 | N491: BROKENSHIRE 2 | R491: GUILLE | U491: CERINI
A492: CAMBERWELL | C492: MAYO 4 | F492: COLLIER 4 | I492: JENSEN 3 | K492: BRYCE 2 | M492: BRADFORD 2 | P492: TAYLOR
A494: PORT MELBOURNE | C494: 1 | D494: 2 | E494: =C494*6+D494 -> 8 | G494: 7 | H494: 11 | I494: =G494*6+H494 -> 53 | K494: 11 | L494: 13 | M494: =K494*6+L494 -> 79 | O494: 19 | P494: 21 | Q494: =O494*6+P494 -> 135 | S494: PORT MELBOURNE
A495: WILLIAMSTOWN | C495: 2 | D495: 12 | E495: =C495*6+D495 -> 24 | G495: 4 | H495: 14 | I495: =G495*6+H495 -> 38 | K495: 10 | L495: 20 | M495: =K495*6+L495 -> 80 | O495: 12 | P495: 28 | Q495: =O495*6+P495 -> 100 | S495: MERRINGTON
A496: BEST PLAYERS
A497: PORT MELBOURNE | C497: FINDLAY | F497: HOUSTEN | I497: REYNOLDS | L497: FLETCHER | O497: KELLY | Q497: MENZIES
A498: WILLIAMSTOWN | C498: WILLIAMS | F498: MATTHEWS | I498: HARRIS | L498: WELLS | O498: SALVAS | Q498: HUGHES
A499: GOALKICKERS
A500: PORT MELBOURNE | C500: HOUSTEN 4 | F500: FINDLAY 3 | I500: LEHMANN 2 | L500: CULPH 2 | N500: REYNOLDS | Q500: KELLY | R500: PANNELL | T500: STOREY | V500: MENZIES | X500: TREMBATH | AA500: FLETCHER | AC500: BUTCHER
A501: WILLIAMSTOWN | C501: HARRIS 6 | F501: TODD 2 | I501: SALVAS 2 | L501: SPRING | N501: TAYLOR
A503: COBURG | C503: 2 | D503: 2 | E503: =C503*6+D503 -> 14 | G503: 6 | H503: 7 | I503: =G503*6+H503 -> 43 | K503: 7 | L503: 7 | M503: =K503*6+L503 -> 49 | O503: 12 | P503: 19 | Q503: =O503*6+P503 -> 91 | S503: NORTHCOTE
A504: NORTHCOTE | C504: 3 | D504: 10 | E504: =C504*6+D504 -> 28 | G504: 3 | H504: 12 | I504: =G504*6+H504 -> 30 | K504: 10 | L504: 16 | M504: =K504*6+L504 -> 76 | O504: 9 | P504: 15 | Q504: =O504*6+P504 -> 69 | S504: VINES
A505: BEST PLAYERS
A506: COBURG | C506: CONDON | E506: R ATKINSON | H506: FYFFE | K506: TITUS | N506: HORE | Q506: MILTE
A507: NORTHCOTE | C507: NOLAN | E507: STAFFORD | H507: STRAHAN | K507: DUNCAN | N507: BARKER | Q507: HISCOX
A508: GOALKICKERS
A509: COBURG | C509: TITUS 6 | F509: CREWTHER 2 | I509: MILTE 2 | K509: EGAN 2
A510: NORTHCOTE | C510: GREENHAM 2 | F510: WELLINGTON 2 | J510: STRAHAN 2 | M510: WHITE | O510: HISCOX | Q510: JONES
A512: ROUND 10 | D512: 15TH JUNE | H512: WEATHER | K512: NORTH WEST BREEZE DULL COLD RAIN | S512: PLAYED AT
D513: 1ST QTR | H513: 2ND QTR | L513: 3RD QTR | P513: FINAL | S513: COBURG
A514: COBURG | C514: 2 | D514: 2 | E514: =C514*6+D514 -> 14 | G514: 7 | H514: 9 | I514: =G514*6+H514 -> 51 | K514: 11 | L514: 14 | M514: =K514*6+L514 -> 80 | O514: 15 | P514: 16 | Q514: =O514*6+P514 -> 106 | S514: UMPIRE | X514: LADDER | AB514: ROUND | AD514: 10
A515: PORT MELBOURNE | C515: 4 | D515: 4 | E515: =C515*6+D515 -> 28 | G515: 9 | H515: 6 | I515: =G515*6+H515 -> 60 | K515: 11 | L515: 8 | M515: =K515*6+L515 -> 74 | O515: 11 | P515: 9 | Q515: =O515*6+P515 -> 75 | S515: LEE
A516: BEST PLAYERS | W516: TEAM | X516: W | Y516: L | Z516: D | AA516: FOR | AB516: AGST | AC516: % | AD516: PTS
A517: COBURG | C517: MILTE | F517: HARTRIDGE | I517: PROMNITZ | K517: CONDON | N517: LONSDALE | Q517: WILSON
A518: PORT MELBOURNE | C518: BUTCHER | F518: FINDLAY | I518: CULPH | K518: DOBSON | N518: HOUSTEN | Q518: TREMBATH | W518: WILLIAMSTOWN | X518: 7 | Y518: 2 | Z518: 1 | AA518: 1166 | AB518: 907 | AC518: 128.55567805953694 | AD518: 30
A519: GOALKICKERS | W519: CAMBERWELL | X519: 7 | Y519: 2 | Z519: 1 | AA519: 1159 | AB519: 902 | AC519: 128.49223946784923 | AD519: 30
A520: COBURG | C520: TITUS 4 | E520: HARTRIDGE 3 | H520: MILTE 2 | J520: CONDON 2 | M520: CREWTHER 2 | P520: NEGRI | R520: KENNEDY | W520: COBURG | X520: 7 | Y520: 3 | Z520: 0 | AA520: 918 | AB520: 807 | AC520: 113.75464684014869 | AD520: 28
A521: PORT MELBOURNE | C521: HOUSTEN 3 | F521: CULPH 3 | I521: FINDLAY 2 | L521: FLETCHER | N521: MENZIES | Q521: PANNELL | W521: SANDRINGHAM | X521: 7 | Y521: 3 | Z521: 0 | AA521: 990 | AB521: 973 | AC521: 101.74717368961973 | AD521: 28
A523: OAKLEIGH | C523: 4 | D523: 6 | E523: =C523*6+D523 -> 30 | G523: 9 | H523: 6 | I523: =G523*6+H523 -> 60 | K523: 12 | L523: 12 | M523: =K523*6+L523 -> 84 | O523: 14 | P523: 18 | Q523: =O523*6+P523 -> 102 | S523: OAKLEIGH | W523: BRIGHTON | X523: 6 | Y523: 3 | Z523: 1 | AA523: 1105 | AB523: 1029 | AC523: 107.38581146744411 | AD523: 26
A524: NORTHCOTE | C524: 2 | D524: 8 | E524: =C524*6+D524 -> 20 | G524: 4 | H524: 10 | I524: =G524*6+H524 -> 34 | K524: 7 | L524: 14 | M524: =K524*6+L524 -> 56 | O524: 11 | P524: 20 | Q524: =O524*6+P524 -> 86 | S524: WRIGHT | W524: PORT MELBOURNE | X524: 6 | Y524: 4 | Z524: 0 | AA524: 942 | AB524: 982 | AC524: 95.926680244399179 | AD524: 24
A525: BEST PLAYERS | W525: BRUNSWICK | X525: 5 | Y525: 5 | Z525: 0 | AA525: 887 | AB525: 866 | AC525: 102.42494226327945 | AD525: 20
A526: OAKLEIGH | C526: BEARD | E526: R FINN | H526: D RYAN | K526: BICKERTON | N526: MATTHEWS | Q526: TIBBALLS | W526: YARRAVILLE | X526: 4 | Y526: 6 | Z526: 0 | AA526: 1046 | AB526: 1238 | AC526: 84.491114701130854 | AD526: 16
A527: NORTHCOTE | C527: BARKER | E527: NOLAN | H527: JONES | K527: WELLINGTON | N527: McINTOSH | Q527: DUNCAN | W527: PRAHRAN | X527: 3 | Y527: 7 | Z527: 0 | AA527: 997 | AB527: 1128 | AC527: 88.386524822695037 | AD527: 12
A528: GOALKICKERS | Q528: CRAWSHAW | W528: OAKLEIGH | X528: 3 | Y528: 7 | Z528: 0 | AA528: 895 | AB528: 1074 | AC528: 83.333333333333329 | AD528: 12
A529: OAKLEIGH | C529: KENNEDY 3 | F529: E RYAN 2 | I529: O'CONNOR 2 | L529: R FINN 2 | N529: TIBBALLS | P529: MCKENZIE | R529: GRAY | W529: PRESTON | X529: 2 | Y529: 8 | Z529: 0 | AA529: 837 | AB529: 862 | AC529: 97.099767981438518 | AD529: 8
A530: NORTHCOTE | C530: GREENHAM 5 | F530: STRAHAN 2 | I530: McINTOSH 2 | L530: JONES | N530: HISCOX | W530: NORTHCOTE | X530: 1 | Y530: 8 | Z530: 1 | AA530: 810 | AB530: 984 | AC530: 82.317073170731703 | AD530: 6
A532: BRIGHTON | C532: 8 | D532: 8 | E532: =C532*6+D532 -> 56 | G532: 9 | H532: 16 | I532: =G532*6+H532 -> 70 | K532: 19 | L532: 22 | M532: =K532*6+L532 -> 136 | O532: 26 | P532: 28 | Q532: =O532*6+P532 -> 184 | S532: ELSTERNWICK PARK
A533: YARRAVILLE | C533: 3 | D533: 2 | E533: =C533*6+D533 -> 20 | G533: 11 | H533: 10 | I533: =G533*6+H533 -> 76 | K533: 15 | L533: 11 | M533: =K533*6+L533 -> 101 | O533: 23 | P533: 12 | Q533: =O533*6+P533 -> 150 | S533: MERRINGTON
A534: BEST PLAYERS
A535: BRIGHTON | C535: VALLENCE | F535: McINDOE | I535: HUGHES | L535: McGUIRE | O535: ADAMSON | R535: RICHARDSON
A536: YARRAVILLE | C536: ROBB | F536: HARDIMAN | I536: GARDNER | L536: McDONALD | O536: WOOD | R536: ELLIS
A537: GOALKICKERS
A538: BRIGHTON | C538: VALLENCE 8 | F538: McINDOE 5 | I538: ADAMSON 4 | L538: CARROLL 3 | N538: HUGHES 2 | Q538: O'BRIEN 2 | T538: KENNETT | W538: EVANS
A539: YARRAVILLE | C539: RUDDELL 4 | F539: ROBB 4 | H539: ELLIS 4 | J539: HARDIMAN 4 | M539: PERUSSICH 3 | P539: McDONALD | R539: MOLONEY | U539: WHITE | X539: CAESER
D540: 17TH JUNE | H540: KINGS BIRTHDAY | L540: WEATHER | O540: COLD
A541: WILLIAMSTOWN | C541: 2 | D541: 4 | E541: =C541*6+D541 -> 16 | G541: 4 | H541: 9 | I541: =G541*6+H541 -> 33 | K541: 9 | L541: 11 | M541: =K541*6+L541 -> 65 | O541: 13 | P541: 12 | Q541: =O541*6+P541 -> 90 | S541: WILLIAMSTOWN
A542: CAMBERWELL | C542: 2 | D542: 3 | E542: =C542*6+D542 -> 15 | G542: 4 | H542: 9 | I542: =G542*6+H542 -> 33 | K542: 9 | L542: 15 | M542: =K542*6+L542 -> 69 | O542: 12 | P542: 18 | Q542: =O542*6+P542 -> 90 | S542: HICKS
A543: BEST PLAYERS
A544: WILLIAMSTOWN | C544: ARCHIBALD | F544: HARLEY | I544: TAYLOR | L544: SPRING | O544: FEATHERBY | R544: MATTHEWS
A545: CAMBERWELL | C545: HERBERT | F545: BOYALL | I545: KENNEDY | L545: STYLES | O545: BRADFORD | R545: BRISTOWE
A546: GOALKICKERS
A547: WILLIAMSTOWN | C547: TODD 7 | F547: HARRIS 4 | I547: SALVAS | L547: PEACOCK
A548: CAMBERWELL | C548: HERBERT 5 | F548: BRISTOWE 3 | I548: MAYO | K548: BOYALL | M548: BRADFORD | P548: HARLAND
A550: SANDRINGHAM | C550: 3 | D550: 3 | E550: =C550*6+D550 -> 21 | G550: 6 | H550: 7 | I550: =G550*6+H550 -> 43 | K550: 9 | L550: 9 | M550: =K550*6+L550 -> 63 | O550: 15 | P550: 14 | Q550: =O550*6+P550 -> 104 | S550: BEACH ROAD
A551: BRUNSWICK | C551: 1 | D551: 7 | E551: =C551*6+D551 -> 13 | G551: 2 | H551: 10 | I551: =G551*6+H551 -> 22 | K551: 8 | L551: 16 | M551: =K551*6+L551 -> 64 | O551: 10 | P551: 20 | Q551: =O551*6+P551 -> 80 | S551: SIMPSON
A552: BEST PLAYERS
A553: SANDRINGHAM | C553: O'TOOLE | F553: EVANS | I553: ZIMMER | L553: CERINI | O553: BENCRAFT | R553: HOLMES
A554: BRUNSWICK | C554: PLUMMER | F554: GLASSCOTT | I554: FAY | L554: WELDON | O554: BAGGOTT | R554: PRIESTLEY
A555: GOALKICKERS
A556: SANDRINGHAM | C556: PARKER 3 | F556: BENCRAFT 3 | I556: POLE 2 | K556: GUILLE 2 | M556: BROKENSHIRE | P556: TOMLINS | R556: COLLINS | U556: ANDERS | X556: SCOLLARY
A557: BRUNSWICK | C557: PRIESTLEY 3 | F557: MANN 2 | H557: BAGGOTT 2 | K557: SMITH 2 | M557: JACOBS
A559: PRAHRAN | C559: 5 | D559: 2 | E559: =C559*6+D559 -> 32 | G559: 11 | H559: 4 | I559: =G559*6+H559 -> 70 | K559: 13 | L559: 5 | M559: =K559*6+L559 -> 83 | O559: 18 | P559: 9 | Q559: =O559*6+P559 -> 117 | S559: TOORAK PARK
A560: PRESTON | C560: 4 | D560: 3 | E560: =C560*6+D560 -> 27 | G560: 7 | H560: 5 | I560: =G560*6+H560 -> 47 | K560: 11 | L560: 10 | M560: =K560*6+L560 -> 76 | O560: 14 | P560: 12 | Q560: =O560*6+P560 -> 96 | S560: VINES
A561: BEST PLAYERS
A562: PRAHRAN | C562: McMAHON | F562: NEWTON | I562: CULLEN | L562: WEBER | O562: BURGESS | R562: GRAVELL
A563: PRESTON | C563: S STEWART | F563: SNELL | I563: HARRIS | L563: SLEITH | O563: BOND | R563: C STEWART
A564: GOALKICKERS
A565: PRAHRAN | C565: BLUMFIELD 4 | F565: McMAHON 3 | I565: CULLEN 2 | K565: BURGESS 2 | N565: CONROY 2 | Q565: WALSH | S565: WEBER | U565: HALLINAN | X565: WHITE | Z565: MALONEY
A566: PRESTON | C566: WATTS 4 | F566: CONNELLY 4 | I566: ANDERSON 3 | L566: HARRIS 2 | N566: LEISHMAN
A568: ROUND 11 | D568: 22ND JUNE | J568: WEATHER | M568: NORTH WEST BREEZE SUNNY | S568: PLAYED AT
D569: 1ST QTR | H569: 2ND QTR | L569: 3RD QTR | P569: FINAL | S569: CAMBERWELL
A570: CAMBERWELL | C570: 1 | D570: 5 | E570: =C570*6+D570 -> 11 | G570: 4 | H570: 8 | I570: =G570*6+H570 -> 32 | K570: 7 | L570: 17 | M570: =K570*6+L570 -> 59 | O570: 9 | P570: 22 | Q570: =O570*6+P570 -> 76 | S570: UMPIRE | X570: LADDER | AB570: ROUND | AD570: 11
A571: COBURG | C571: 1 | D571: 1 | E571: =C571*6+D571 -> 7 | G571: 6 | H571: 6 | I571: =G571*6+H571 -> 42 | K571: 7 | L571: 8 | M571: =K571*6+L571 -> 50 | O571: 9 | P571: 11 | Q571: =O571*6+P571 -> 65 | S571: MERRINGTON
A572: BEST PLAYERS | W572: TEAM | X572: W | Y572: L | Z572: D | AA572: FOR | AB572: AGST | AC572: % | AD572: PTS
A573: CAMBERWELL | C573: HERBERT | F573: BRADFORD | I573: BOYALL | L573: BENNISON | O573: STYLES | Q573: KENNEDY
A574: COBURG | C574: WILSON | F574: CREWTHER | I574: PROMNITZ | L574: MILTE | O574: CONDON | Q574: WILLIAMS | W574: CAMBERWELL | X574: 8 | Y574: 2 | Z574: 1 | AA574: 1235 | AB574: 967 | AC574: 127.71458117890383 | AD574: 34
A575: GOALKICKERS | W575: SANDRINGHAM | X575: 8 | Y575: 3 | Z575: 0 | AA575: 1107 | AB575: 1082 | AC575: 102.31053604436229 | AD575: 32
A576: CAMBERWELL | C576: HERBERT 3 | F576: BRYCE 2 | H576: BRADFORD 2 | K576: BRISTOWE | N576: JENSEN | W576: WILLIAMSTOWN | X576: 7 | Y576: 3 | Z576: 1 | AA576: 1272 | AB576: 1030 | AC576: 123.49514563106796 | AD576: 30
A577: COBURG | C577: TITUS 3 | F577: EGAN 2 | H577: HARTRIDGE | K577: MARDEN | M577: WILSON | O577: BANNISTER | W577: BRIGHTON | X577: 7 | Y577: 3 | Z577: 1 | AA577: 1249 | AB577: 1125 | AC577: 111.02222222222223 | AD577: 30
A579: SANDRINGHAM | C579: 2 | D579: 1 | E579: =C579*6+D579 -> 13 | G579: 9 | H579: 7 | I579: =G579*6+H579 -> 61 | K579: 12 | L579: 8 | M579: =K579*6+L579 -> 80 | O579: 18 | P579: 9 | Q579: =O579*6+P579 -> 117 | S579: YARRAVILLE | W579: COBURG | X579: 7 | Y579: 4 | Z579: 0 | AA579: 983 | AB579: 883 | AC579: 111.32502831257078 | AD579: 28
A580: YARRAVILLE | C580: 5 | D580: 7 | E580: =C580*6+D580 -> 37 | G580: 6 | H580: 11 | I580: =G580*6+H580 -> 47 | K580: 10 | L580: 18 | M580: =K580*6+L580 -> 78 | O580: 15 | P580: 19 | Q580: =O580*6+P580 -> 109 | S580: SIMPSON | W580: PORT MELBOURNE | X580: 7 | Y580: 4 | Z580: 0 | AA580: 1078 | AB580: 1081 | AC580: 99.722479185938951 | AD580: 28
A581: BEST PLAYERS | W581: BRUNSWICK | X581: 6 | Y581: 5 | Z581: 0 | AA581: 1010 | AB581: 972 | AC581: 103.90946502057614 | AD581: 24
A582: SANDRINGHAM | C582: PARKER | E582: CERINI | H582: POLE | K582: BROKENSHIRE | N582: SCOLLARY | Q582: ANDERS | W582: YARRAVILLE | X582: 4 | Y582: 7 | Z582: 0 | AA582: 1155 | AB582: 1355 | AC582: 85.239852398523979 | AD582: 16
A583: YARRAVILLE | C583: GARLICK | E583: WOOD | H583: ROBB | K583: GARRICK | N583: KNIGHT | Q583: McDONALD | W583: PRAHRAN | X583: 3 | Y583: 8 | Z583: 0 | AA583: 1093 | AB583: 1258 | AC583: 86.883942766295704 | AD583: 12
A584: GOALKICKERS | W584: OAKLEIGH | X584: 3 | Y584: 8 | Z584: 0 | AA584: 994 | AB584: 1210 | AC584: 82.148760330578511 | AD584: 12
A585: SANDRINGHAM | C585: PARKER 4 | E585: BENNETT 4 | H585: POLE 3 | J585: ANDERS 3 | M585: BROKENSHIRE 2 | P585: CERINI | R585: BENCRAFT | W585: NORTHCOTE | X585: 2 | Y585: 8 | Z585: 1 | AA585: 940 | AB585: 1080 | AC585: 87.037037037037038 | AD585: 10
A586: YARRAVILLE | C586: ROBB 6 | E586: HARDIMAN 3 | H586: McDONALD 2 | K586: L WHITE | M586: ELLIS | O586: PERUSSICH | R586: SORRAGHAN | W586: PRESTON | X586: 2 | Y586: 9 | Z586: 0 | AA586: 933 | AB586: 1006 | AC586: 92.74353876739562 | AD586: 8
A588: BRUNSWICK | C588: 5 | D588: 2 | E588: =C588*6+D588 -> 32 | G588: 9 | H588: 5 | I588: =G588*6+H588 -> 59 | K588: 11 | L588: 9 | M588: =K588*6+L588 -> 75 | O588: 18 | P588: 15 | Q588: =O588*6+P588 -> 123 | S588: BRUNSWICK
A589: WILLIAMSTOWN | C589: 3 | D589: 7 | E589: =C589*6+D589 -> 25 | G589: 8 | H589: 13 | I589: =G589*6+H589 -> 61 | K589: 12 | L589: 16 | M589: =K589*6+L589 -> 88 | O589: 14 | P589: 22 | Q589: =O589*6+P589 -> 106 | S589: WRIGHT
A590: BEST PLAYERS
A591: BRUNSWICK | C591: PRIESTLEY | F591: GLASSCOTT | I591: UPTON | L591: HALL | O591: BAGGOTT | R591: WELDON
A592: WILLIAMSTOWN | C592: SULLIVAN | F592: WELLS | I592: SPRING | L592: FEATHERBY | O592: SALVAS | R592: WILCOX
A593: GOALKICKERS
A594: BRUNSWICK | C594: BAGGOTT 5 | F594: PRIESTLEY 4 | I594: GLASSCOTT 3 | L594: CRAWFORD 2 | O594: UPTON | Q594: SMITH | S594: WELDON | V594: SILK
A595: WILLIAMSTOWN | C595: TODD 4 | F595: SALVAS 4 | I595: HARRIS 3 | L595: SANDELLS | O595: MATHEWS | R595: WILLIAMS
A597: NORTHCOTE | C597: 8 | D597: 1 | E597: =C597*6+D597 -> 49 | G597: 10 | H597: 3 | I597: =G597*6+H597 -> 63 | K597: 14 | L597: 5 | M597: =K597*6+L597 -> 89 | O597: 20 | P597: 10 | Q597: =O597*6+P597 -> 130 | S597: NORTHCOTE
A598: PRAHRAN | C598: 3 | D598: 1 | E598: =C598*6+D598 -> 19 | G598: 9 | H598: 5 | I598: =G598*6+H598 -> 59 | K598: 12 | L598: 6 | M598: =K598*6+L598 -> 78 | O598: 14 | P598: 12 | Q598: =O598*6+P598 -> 96 | S598: VINES
A599: BEST PLAYERS
A600: NORTHCOTE | C600: RUSH | F600: NOLAN | I600: McINTOSH | L600: McCRACKEN | O600: STRAHAN | R600: BARKER
A601: PRAHRAN | C601: ABIKHAIR | F601: O'DONNELL | I601: CONROY | L601: GRAVELL | O601: NEWTON | R601: MALONEY
A602: GOALKICKERS
A603: NORTHCOTE | C603: McINTOSH 4 | F603: STRAHAN 3 | I603: McCRACKEN 2 | L603: BOWES 2 | N603: RUSH 2 | P603: WELLINGTON 2 | S603: GREENHAM 2 | W603: BARKER | X603: KELLY | Z603: DUNCAN
A604: PRAHRAN | C604: BURGESS 4 | F604: O'CONNOR 2 | I604: McMAHON 2 | L604: WALSH | N604: CROSLING | P604: WHITE | R604: BLUMFIELD | U604: CONROY | X604: McMAHON
A606: PORT MELBOURNE | C606: 3 | D606: 3 | E606: =C606*6+D606 -> 21 | G606: 10 | H606: 4 | I606: =G606*6+H606 -> 64 | K606: 15 | L606: 9 | M606: =K606*6+L606 -> 99 | O606: 20 | P606: 16 | Q606: =O606*6+P606 -> 136 | S606: PORT MELBOURNE
A607: OAKLEIGH | C607: 2 | D607: 4 | E607: =C607*6+D607 -> 16 | G607: 6 | H607: 10 | I607: =G607*6+H607 -> 46 | K607: 7 | L607: 15 | M607: =K607*6+L607 -> 57 | O607: 13 | P607: 21 | Q607: =O607*6+P607 -> 99 | S607: BARNES
A608: BEST PLAYERS
A609: PORT MELBOURNE | C609: FINDLAY | F609: DOBSON | I609: CULPH | L609: KELSEY | O609: MURPHY | Q609: FLETCHER
A610: OAKLEIGH | C610: MATTHEWS | F610: BEARD | I610: E RYAN | L610: R FINN | O610: KELLY | Q610: BICKERTON
A611: GOALKICKERS
A612: PORT MELBOURNE | C612: CULPH 8 | F612: FINDLAY 5 | I612: KELLY 3 | L612: LEHMANN 2 | O612: HOUSTEN 2
A613: OAKLEIGH | C613: E RYAN 4 | F613: TIBBALLS 4 | I613: MCKENZIE 2 | L613: LANNING | N613: S FINN | P613: CRAWSHAW
A615: BRIGHTON | C615: 3 | D615: 6 | E615: =C615*6+D615 -> 24 | G615: 4 | H615: 13 | I615: =G615*6+H615 -> 37 | K615: 12 | L615: 27 | M615: =K615*6+L615 -> 99 | O615: 19 | P615: 30 | Q615: =O615*6+P615 -> 144 | S615: PRESTON
A616: PRESTON | C616: 2 | D616: 5 | E616: =C616*6+D616 -> 17 | G616: 6 | H616: 9 | I616: =G616*6+H616 -> 45 | K616: 6 | L616: 11 | M616: =K616*6+L616 -> 47 | O616: 13 | P616: 18 | Q616: =O616*6+P616 -> 96 | S616: LEE
A617: BEST PLAYERS
A618: BRIGHTON | C618: HALCOMBE | F618: BAILEY | I618: HUGHES | L618: McINDOE | N618: PLUNKETT | Q618: KENNETT
A619: PRESTON | C619: SLEITH | F619: MASLEN | I619: S STEWART | L619: SNELL | N619: CONNELLY | Q619: HINDS
A620: GOALKICKERS
A621: BRIGHTON | C621: McINDOE 4 | F621: VALLENCE 4 | I621: PLUNKETT 3 | L621: DOUGLAS 3 | N621: CARROLL 2 | Q621: RICHARDSON | T621: ADAMSON | W621: KENNETT
A622: PRESTON | C622: SLEITH 4 | F622: MASLEN 2 | I622: HUTCHINS 2 | L622: CONNELLY 2 | O622: BOND | Q622: HARRIS | S622: OLVER
A624: ROUND 12 | D624: 6TH JULY | J624: WEATHER | M624: NORTH WEST WIND FINE | S624: PLAYED AT
D625: 1ST QTR | H625: 2ND QTR | L625: 3RD QTR | P625: FINAL | S625: ELSTERNWICK PARK
A626: SANDRINGHAM | C626: 1 | D626: 3 | E626: =C626*6+D626 -> 9 | G626: 5 | H626: 8 | I626: =G626*6+H626 -> 38 | K626: 8 | L626: 9 | M626: =K626*6+L626 -> 57 | O626: 13 | P626: 14 | Q626: =O626*6+P626 -> 92 | S626: UMPIRE | X626: LADDER | AB626: ROUND | AD626: 12
A627: BRIGHTON | C627: 4 | D627: 6 | E627: =C627*6+D627 -> 30 | G627: 5 | H627: 10 | I627: =G627*6+H627 -> 40 | K627: 11 | L627: 12 | M627: =K627*6+L627 -> 78 | O627: 12 | P627: 12 | Q627: =O627*6+P627 -> 84 | S627: MERRINGTON
A628: BEST PLAYERS | W628: TEAM | X628: W | Y628: L | Z628: D | AA628: FOR | AB628: AGST | AC628: % | AD628: PTS
A629: SANDRINGHAM | C629: TOYNE | E629: ANDERS | I629: HOLMES | L629: O'TOOLE | O629: WEBB | Q629: SALES
A630: BRIGHTON | C630: McGUIRE | E630: HALCOMBE | I630: VALLENCE | L630: McINDOE | O630: T NEW | Q630: DOUGLAS | W630: CAMBERWELL | X630: 9 | Y630: 2 | Z630: 1 | AA630: 1364 | AB630: 1054 | AC630: 129.41176470588235 | AD630: 38
A631: GOALKICKERS | W631: SANDRINGHAM | X631: 9 | Y631: 3 | Z631: 0 | AA631: 1199 | AB631: 1166 | AC631: 102.83018867924528 | AD631: 36
A632: SANDRINGHAM | C632: BROKENSHIRE 4 | F632: HEADEN 3 | I632: ANDERS 2 | L632: HOLMES 2 | N632: BENCRAFT | Q632: POLE | W632: WILLIAMSTOWN | X632: 8 | Y632: 3 | Z632: 1 | AA632: 1407 | AB632: 1139 | AC632: 123.52941176470588 | AD632: 34
A633: BRIGHTON | C633: VALLENCE 4 | F633: DOUGLAS 2 | I633: McGUIRE 2 | L633: HUGHES 2 | N633: O'BRIEN | Q633: CARROLL | W633: COBURG | X633: 8 | Y633: 4 | Z633: 0 | AA633: 1056 | AB633: 954 | AC633: 110.69182389937107 | AD633: 32
A635: COBURG | C635: 2 | D635: 2 | E635: =C635*6+D635 -> 14 | G635: 4 | H635: 9 | I635: =G635*6+H635 -> 33 | K635: 6 | L635: 11 | M635: =K635*6+L635 -> 47 | O635: 10 | P635: 13 | Q635: =O635*6+P635 -> 73 | S635: BRUNSWICK | W635: PORT MELBOURNE | X635: 8 | Y635: 4 | Z635: 0 | AA635: 1189 | AB635: 1176 | AC635: 101.10544217687075 | AD635: 32
A636: BRUNSWICK | C636: 2 | D636: 2 | E636: =C636*6+D636 -> 14 | G636: 3 | H636: 2 | I636: =G636*6+H636 -> 20 | K636: 7 | L636: 9 | M636: =K636*6+L636 -> 51 | O636: 10 | P636: 11 | Q636: =O636*6+P636 -> 71 | S636: WRIGHT | W636: BRIGHTON | X636: 7 | Y636: 4 | Z636: 1 | AA636: 1333 | AB636: 1217 | AC636: 109.531635168447 | AD636: 30
A637: BEST PLAYERS | W637: BRUNSWICK | X637: 6 | Y637: 6 | Z637: 0 | AA637: 1081 | AB637: 1045 | AC637: 103.44497607655502 | AD637: 24
A638: COBURG | C638: STARBUCK | F638: ENGELEEMER | I638: PROMNITZ | L638: SILLITOE | O638: WILSON | Q638: MILTE | W638: YARRAVILLE | X638: 4 | Y638: 8 | Z638: 0 | AA638: 1264 | AB638: 1490 | AC638: 84.832214765100673 | AD638: 16
A639: BRUNSWICK | C639: KEMP | F639: PRIESTLEY | I639: FAY | L639: SUTTON | O639: UPTON | Q639: WELDON | W639: NORTHCOTE | X639: 3 | Y639: 8 | Z639: 1 | AA639: 1042 | AB639: 1166 | AC639: 89.36535162950257 | AD639: 14
A640: GOALKICKERS | W640: PRAHRAN | X640: 3 | Y640: 9 | Z640: 0 | AA640: 1188 | AB640: 1369 | AC640: 86.778670562454352 | AD640: 12
A641: COBURG | C641: CONDON 2 | F641: WILLIAMS 2 | I641: EGAN 2 | K641: HARTRIDGE 2 | N641: MARDEN | P641: HEEPS | W641: OAKLEIGH | X641: 3 | Y641: 9 | Z641: 0 | AA641: 1081 | AB641: 1339 | AC641: 80.731889469753554 | AD641: 12
A642: BRUNSWICK | C642: UPTON 3 | F642: BAGGOTT 2 | I642: SMITH 2 | K642: JACOBS | M642: WELDON | O642: PRIESTLEY | W642: PRESTON | X642: 2 | Y642: 10 | Z642: 0 | AA642: 1019 | AB642: 1108 | AC642: 91.967509025270758 | AD642: 8
A644: WILLIAMSTOWN | C644: 3 | D644: 1 | E644: =C644*6+D644 -> 19 | G644: 12 | H644: 3 | I644: =G644*6+H644 -> 75 | K644: 14 | L644: 5 | M644: =K644*6+L644 -> 89 | O644: 21 | P644: 9 | Q644: =O644*6+P644 -> 135 | S644: YARRAVILLE
A645: YARRAVILLE | C645: 6 | D645: 11 | E645: =C645*6+D645 -> 47 | G645: 8 | H645: 15 | I645: =G645*6+H645 -> 63 | K645: 11 | L645: 20 | M645: =K645*6+L645 -> 86 | O645: 14 | P645: 25 | Q645: =O645*6+P645 -> 109 | S645: VINES
A646: BEST PLAYERS
A647: WILLIAMSTOWN | C647: TAYLOR | F647: SALVAS | I647: MATTHEWS | L647: SHARP | O647: SULLIVAN | R647: TODD
A648: YARRAVILLE | C648: GARLICK | F648: WOOD | I648: ROBB | L648: SORRAGHAN | O648: MCKENZIE | R648: GARRICK
A649: GOALKICKERS
A650: WILLIAMSTOWN | C650: TODD 10 | F650: SHARP 4 | I650: JAMIESON 2 | L650: WILLIAMS 2 | O650: TAYLOR | Q650: HARRIS | S650: SALVAS
A651: YARRAVILLE | C651: ROBB 5 | E651: GARLICK 4 | H651: McDONALD | J651: SORRAGHAN | M651: L WHITE | O651: PERUSSICH | R651: ELLIS
A653: PORT MELBOURNE | C653: 6 | D653: 9 | E653: =C653*6+D653 -> 45 | G653: 8 | H653: 13 | I653: =G653*6+H653 -> 61 | K653: 15 | L653: 19 | M653: =K653*6+L653 -> 109 | O653: 15 | P653: 21 | Q653: =O653*6+P653 -> 111 | S653: PORT MELBOURNE
A654: PRAHRAN | C654: 2 | D654: 0 | E654: =C654*6+D654 -> 12 | G654: 7 | H654: 9 | I654: =G654*6+H654 -> 51 | K654: 8 | L654: 12 | M654: =K654*6+L654 -> 60 | O654: 13 | P654: 17 | Q654: =O654*6+P654 -> 95 | S654: BARNES
A655: BEST PLAYERS
A656: PORT MELBOURNE | C656: CULPH | E656: MANN | H656: FINDLAY | K656: HAGAN | N656: REYNOLDS | Q656: FLETCHER
A657: PRAHRAN | C657: SPRIGGS | E657: NEWTON | H657: CULLEN | K657: O'CONNOR | N657: McMAHON | Q657: WHITE
A658: GOALKICKERS
A659: PORT MELBOURNE | C659: CULPH 4 | E659: FINDLAY 4 | H659: FLETCHER 2 | K659: HAGAN | M659: MENZIES | O659: HOUSTEN | Q659: REYNOLDS | T659: TREMBATH
A660: PRAHRAN | C660: CULLEN 4 | F660: BURGESS 3 | I660: WHITE 2 | K660: WALSH 2 | M660: McMAHON | P660: HALLINAN
A662: NORTHCOTE | C662: 4 | D662: 1 | E662: =C662*6+D662 -> 25 | G662: 11 | H662: 6 | I662: =G662*6+H662 -> 72 | K662: 11 | L662: 8 | M662: =K662*6+L662 -> 74 | O662: 15 | P662: 12 | Q662: =O662*6+P662 -> 102 | S662: PRESTON
A663: PRESTON | C663: 3 | D663: 6 | E663: =C663*6+D663 -> 24 | G663: 3 | H663: 6 | I663: =G663*6+H663 -> 24 | K663: 9 | L663: 12 | M663: =K663*6+L663 -> 66 | O663: 12 | P663: 14 | Q663: =O663*6+P663 -> 86 | S663: LEE
A664: BEST PLAYERS
A665: NORTHCOTE | C665: CLARKE | E665: HISCOX | H665: STABB | K665: WELLINGTON | N665: STRAHAN | Q665: McCRACKEN
A666: PRESTON | C666: MASLEN | E666: COOLEY | H666: S STEWART | K666: HUTCHINS | N666: BOND | Q666: SNELL
A667: GOALKICKERS
A668: NORTHCOTE | C668: STRAHAN 6 | F668: McINTOSH 2 | I668: WELLINGTON 2 | L668: DUNCAN 2 | N668: BOWES | P668: JOHNSON | R668: GALE
A669: PRESTON | C669: HARRIS 3 | F669: COOLEY 2 | I669: CONNELLY 2 | L669: McBRIDE 2 | N669: SNELL | P669: S STEWART | S669: EXELBY
A671: CAMBERWELL | C671: 1 | D671: 0 | E671: =C671*6+D671 -> 6 | G671: 10 | H671: 4 | I671: =G671*6+H671 -> 64 | K671: 12 | L671: 5 | M671: =K671*6+L671 -> 77 | O671: 20 | P671: 9 | Q671: =O671*6+P671 -> 129 | S671: CAMBERWELL
A672: OAKLEIGH | C672: 4 | D672: 6 | E672: =C672*6+D672 -> 30 | G672: 6 | H672: 7 | I672: =G672*6+H672 -> 43 | K672: 10 | L672: 11 | M672: =K672*6+L672 -> 71 | O672: 12 | P672: 15 | Q672: =O672*6+P672 -> 87 | S672: SIMPSON
A673: BEST PLAYERS
A674: CAMBERWELL | C674: BRADFORD | F674: SHARPLES | I674: NAISMITH | L674: BRYCE | N674: SEELENMEYER | Q674: BRISTOWE
A675: OAKLEIGH | C675: MATTHEWS | F675: S FINN | I675: TIBBALLS | L675: STIBBARD | N675: BEARD | Q675: ANDREW
A676: GOALKICKERS
A677: CAMBERWELL | C677: BRYCE 5 | F677: BRADFORD 4 | I677: OLIVER 4 | K677: ANDERSON 2 | N677: BRISTOWE 2 | Q677: SEELENMEYER 2 | U677: BOYALL
A678: OAKLEIGH | C678: TIBBALLS 3 | F678: MCKENZIE 2 | I678: CRAWSHAW 2 | L678: STIBBARD 2 | O678: KENNEDY | Q678: S FINN | S678: ANDREW
A680: ROUND 13 | D680: 13TH JULY | J680: WEATHER | M680: GROUNDS SLIPPERY | S680: PLAYED AT
D681: 1ST QTR | H681: 2ND QTR | L681: 3RD QTR | P681: FINAL | S681: WILLIAMSTOWN
A682: WILLIAMSTOWN | C682: 5 | D682: 6 | E682: =C682*6+D682 -> 36 | G682: 7 | H682: 6 | I682: =G682*6+H682 -> 48 | K682: 12 | L682: 9 | M682: =K682*6+L682 -> 81 | O682: 15 | P682: 17 | Q682: =O682*6+P682 -> 107 | S682: UMPIRE | X682: LADDER | AB682: ROUND | AD682: 13
A683: BRIGHTON | C683: 1 | D683: 2 | E683: =C683*6+D683 -> 8 | G683: 7 | H683: 4 | I683: =G683*6+H683 -> 46 | K683: 8 | L683: 8 | M683: =K683*6+L683 -> 56 | O683: 13 | P683: 12 | Q683: =O683*6+P683 -> 90 | S683: WRIGHT
A684: BEST PLAYERS | W684: TEAM | X684: W | Y684: L | Z684: D | AA684: FOR | AB684: AGST | AC684: % | AD684: PTS
A685: WILLIAMSTOWN | C685: SULLIVAN | F685: TAYLOR | I685: ARCHIBALD | L685: HARRIS | O685: CHISHOLM | R685: CHAPMAN
A686: BRIGHTON | C686: HALCOMBE | F686: ADAMSON | I686: KENNETT | L686: DOUGLAS | O686: MCINDOE | R686: CARROLL | W686: CAMBERWELL | X686: 10 | Y686: 2 | Z686: 1 | AA686: 1474 | AB686: 1145 | AC686: 128.73362445414847 | AD686: 42
A687: GOALKICKERS | W687: WILLIAMSTOWN | X687: 9 | Y687: 3 | Z687: 1 | AA687: 1514 | AB687: 1229 | AC687: 123.18958502847843 | AD687: 38
A688: WILLIAMSTOWN | C688: HARRIS 8 | F688: TODD 5 | I688: MATTHEWS 2 | W688: COBURG | X688: 9 | Y688: 4 | Z688: 0 | AA688: 1180 | AB688: 1073 | AC688: 109.97204100652377 | AD688: 36
A689: BRIGHTON | C689: DOUGLAS 3 | F689: ADAMSON 3 | I689: CARROLL 2 | L689: McINDOE 2 | N689: VALLENCE 2 | Q689: PLUNKETT | W689: SANDRINGHAM | X689: 9 | Y689: 4 | Z689: 0 | AA689: 1289 | AB689: 1263 | AC689: 102.05859065716548 | AD689: 36
A691: COBURG | C691: 3 | D691: 9 | E691: =C691*6+D691 -> 27 | G691: 10 | H691: 11 | I691: =G691*6+H691 -> 71 | K691: 15 | L691: 14 | M691: =K691*6+L691 -> 104 | O691: 17 | P691: 22 | Q691: =O691*6+P691 -> 124 | S691: COBURG | W691: PORT MELBOURNE | X691: 9 | Y691: 4 | Z691: 0 | AA691: 1329 | AB691: 1305 | AC691: 101.83908045977012 | AD691: 36
A692: YARRAVILLE | C692: 5 | D692: 4 | E692: =C692*6+D692 -> 34 | G692: 11 | H692: 11 | I692: =G692*6+H692 -> 77 | K692: 13 | L692: 16 | M692: =K692*6+L692 -> 94 | O692: 16 | P692: 23 | Q692: =O692*6+P692 -> 119 | S692: MERRINGTON | W692: BRIGHTON | X692: 7 | Y692: 5 | Z692: 1 | AA692: 1423 | AB692: 1324 | AC692: 107.4773413897281 | AD692: 30
A693: BEST PLAYERS | W693: BRUNSWICK | X693: 6 | Y693: 7 | Z693: 0 | AA693: 1171 | AB693: 1156 | AC693: 101.29757785467127 | AD693: 24
A694: COBURG | C694: HEALY | E694: HARTRIDGE | H694: WILLIAMS | K694: ENGELEEMER | N694: WILSON | Q694: LONSDALE | W694: YARRAVILLE | X694: 4 | Y694: 9 | Z694: 0 | AA694: 1383 | AB694: 1614 | AC694: 85.687732342007436 | AD694: 16
A695: YARRAVILLE | C695: ROBB | E695: GARLICK | H695: WOOD | K695: ELLIS | N695: SORRAGHAN | Q695: S WHITE | W695: OAKLEIGH | X695: 4 | Y695: 9 | Z695: 0 | AA695: 1192 | AB695: 1429 | AC695: 83.414975507347791 | AD695: 16
A696: GOALKICKERS | W696: NORTHCOTE | X696: 3 | Y696: 9 | Z696: 1 | AA696: 1171 | AB696: 1306 | AC696: 89.663093415007651 | AD696: 14
A697: COBURG | C697: MARDEN 6 | F697: HARTRIDGE 4 | I697: HEALY 2 | K697: SILLITOE | M697: WILLIAMS | O697: MILTE | Q697: CREWTHER | T697: WALSH | W697: PRESTON | X697: 3 | Y697: 10 | Z697: 0 | AA697: 1116 | AB697: 1198 | AC697: 93.15525876460768 | AD697: 12
A698: YARRAVILLE | C698: ROBB 8 | F698: ELLIS 4 | I698: RUDDELL 2 | L698: McDONALD | O698: L WHITE | W698: PRAHRAN | X698: 3 | Y698: 10 | Z698: 0 | AA698: 1279 | AB698: 1479 | AC698: 86.477349560513858 | AD698: 12
A700: PORT MELBOURNE | C700: 4 | D700: 6 | E700: =C700*6+D700 -> 30 | G700: 11 | H700: 12 | I700: =G700*6+H700 -> 78 | K700: 16 | L700: 13 | M700: =K700*6+L700 -> 109 | O700: 20 | P700: 20 | Q700: =O700*6+P700 -> 140 | S700: NORTHCOTE
A701: NORTHCOTE | C701: 6 | D701: 5 | E701: =C701*6+D701 -> 41 | G701: 9 | H701: 6 | I701: =G701*6+H701 -> 60 | K701: 16 | L701: 11 | M701: =K701*6+L701 -> 107 | O701: 19 | P701: 15 | Q701: =O701*6+P701 -> 129 | S701: VINES
A702: BEST PLAYERS
A703: PORT MELBOURNE | C703: FINDLAY | F703: MENZIES | I703: HOUSTEN | L703: FLETCHER | O703: TREMBATH | R703: SMEE
A704: NORTHCOTE | C704: BARKER | F704: STRAHAN | I704: CLARKE | L704: McINTOSH | O704: RUSH | R704: MCCRACKEN
A705: GOALKICKERS
A706: PORT MELBOURNE | C706: FINDLAY 8 | F706: HOUSTEN 6 | I706: MENZIES 4 | L706: REYNOLDS | N706: KELLY
A707: NORTHCOTE | C707: STRAHAN 10 | F707: MCCRACKEN 2 | I707: DICKSON 2 | L707: DUNCAN | N707: McINTOSH | Q707: RUSH | S707: WHITE | U707: CASPER
A709: OAKLEIGH | C709: 5 | D709: 11 | E709: =C709*6+D709 -> 41 | G709: 6 | H709: 15 | I709: =G709*6+H709 -> 51 | K709: 9 | L709: 17 | M709: =K709*6+L709 -> 71 | O709: 15 | P709: 21 | Q709: =O709*6+P709 -> 111 | S709: OAKLEIGH
A710: BRUNSWICK | C710: 1 | D710: 2 | E710: =C710*6+D710 -> 8 | G710: 6 | H710: 6 | I710: =G710*6+H710 -> 42 | K710: 10 | L710: 8 | M710: =K710*6+L710 -> 68 | O710: 13 | P710: 12 | Q710: =O710*6+P710 -> 90 | S710: HICKS
A711: BEST PLAYERS
A712: OAKLEIGH | C712: BEARD | F712: MATTHEWS | I712: ANDREW | L712: S FINN | O712: BICKERTON | R712: E RYAN
A713: BRUNSWICK | C713: PRIESTLEY | F713: GEISLER | I713: NEWTON | L713: JENNINGS | O713: WELDON | R713: SUTTON
A714: GOALKICKERS
A715: OAKLEIGH | C715: S FINN 3 | F715: E RYAN 3 | I715: ANDREW 2 | L715: TIBBALLS 2 | O715: STIBBARD 2 | R715: KENNEDY 2 | V715: McKENZIE
A716: BRUNSWICK | C716: NEWSOM 3 | F716: PRIESTLEY 3 | I716: DOHERTY 2 | L716: SILK 2 | N716: UPTON | P716: WELDON | R716: HALL
A718: CAMBERWELL | C718: 3 | D718: 6 | E718: =C718*6+D718 -> 24 | G718: 7 | H718: 10 | I718: =G718*6+H718 -> 52 | K718: 12 | L718: 14 | M718: =K718*6+L718 -> 86 | O718: 15 | P718: 20 | Q718: =O718*6+P718 -> 110 | S718: TOORAK PARK
A719: PRAHRAN | C719: 5 | D719: 1 | E719: =C719*6+D719 -> 31 | G719: 7 | H719: 5 | I719: =G719*6+H719 -> 47 | K719: 9 | L719: 7 | M719: =K719*6+L719 -> 61 | O719: 13 | P719: 13 | Q719: =O719*6+P719 -> 91 | S719: THOMAS
A720: BEST PLAYERS
A721: CAMBERWELL | C721: McIVOR | F721: NAISMITH | I721: BRYCE | L721: BRISTOWE | O721: COLLIER | R721: BRADFORD
A722: PRAHRAN | C722: GRAVELL | F722: O'CONNOR | I722: CULLEN | L722: O'DONNELL | O722: GARDINER | R722: WHITE
A723: GOALKICKERS
A724: CAMBERWELL | C724: BRYCE 7 | F724: OLIVER 3 | I724: SEELENMEYER | L724: ANDERSON | O724: SHIELDS | Q724: BRISTOWE | T724: BRADFORD
A725: PRAHRAN | C725: O'CONNOR 3 | F725: WALSH 2 | I725: CULLEN 2 | L725: BURGESS 2 | O725: ARNOTT | Q725: BATES | S725: McMAHON | V725: D'OLIVER
A727: PRESTON | C727: 4 | D727: 3 | E727: =C727*6+D727 -> 27 | G727: 9 | H727: 6 | I727: =G727*6+H727 -> 60 | K727: 13 | L727: 8 | M727: =K727*6+L727 -> 86 | O727: 14 | P727: 13 | Q727: =O727*6+P727 -> 97 | S727: BEACH ROAD
A728: SANDRINGHAM | C728: 4 | D728: 4 | E728: =C728*6+D728 -> 28 | G728: 5 | H728: 4 | I728: =G728*6+H728 -> 34 | K728: 7 | L728: 14 | M728: =K728*6+L728 -> 56 | O728: 12 | P728: 18 | Q728: =O728*6+P728 -> 90 | S728: BARNES
A729: BEST PLAYERS
A730: PRESTON | C730: HARRIS | E730: SNELL | H730: MASLEN | K730: BRADLEY | N730: EXELBY | Q730: COOLEY
A731: SANDRINGHAM | C731: HEADEN | E731: DOREY | H731: SALES | K731: CERINI | N731: TOYNE | Q731: HOLMES
A732: GOALKICKERS
A733: PRESTON | C733: SNELL 3 | E733: COOLEY 3 | G733: McBRIDE 2 | J733: HARRIS 2 | M733: GUTHRIE 2 | P733: OLVER | R733: DUGGAN
A734: SANDRINGHAM | C734: BROKENSHIRE 4 | G734: ANDERS 2 | J734: HEADEN 2 | M734: COLLINS 2 | P734: POLE | R734: HOLMES
A736: ROUND 14 | D736: 20TH JULY | H736: WEATHER | K736: STRONG WEST GALE RAIN IN MORNING | S736: PLAYED AT
D737: 1ST QTR | H737: 2ND QTR | L737: 3RD QTR | P737: FINAL | S737: BEACH ROAD
A738: WILLIAMSTOWN | C738: 6 | D738: 5 | E738: =C738*6+D738 -> 41 | G738: 7 | H738: 7 | I738: =G738*6+H738 -> 49 | K738: 12 | L738: 10 | M738: =K738*6+L738 -> 82 | O738: 16 | P738: 11 | Q738: =O738*6+P738 -> 107 | S738: UMPIRE | X738: LADDER | AB738: ROUND | AD738: 14
A739: SANDRINGHAM | C739: 1 | D739: 0 | E739: =C739*6+D739 -> 6 | G739: 5 | H739: 1 | I739: =G739*6+H739 -> 31 | K739: 8 | L739: 2 | M739: =K739*6+L739 -> 50 | O739: 11 | P739: 3 | Q739: =O739*6+P739 -> 69 | S739: WRIGHT
A740: BEST PLAYERS | W740: TEAM | X740: W | Y740: L | Z740: D | AA740: FOR | AB740: AGST | AC740: % | AD740: PTS
A741: WILLIAMSTOWN | C741: SPRING | E741: HARRIS | H741: WILLIAMS | K741: SULLIVAN | N741: CAMERON | Q741: H McPHERSON
A742: SANDRINGHAM | C742: TOYNE | E742: O'TOOLE | H742: ZIMMER | K742: BROKENSHIRE | N742: HEADEN | Q742: BENCRAFT | W742: CAMBERWELL | X742: 11 | Y742: 2 | Z742: 1 | AA742: 1601 | AB742: 1219 | AC742: 131.33716160787532 | AD742: 46
A743: GOALKICKERS | W743: WILLIAMSTOWN | X743: 10 | Y743: 3 | Z743: 1 | AA743: 1621 | AB743: 1298 | AC743: 124.88443759630201 | AD743: 42
A744: WILLIAMSTOWN | C744: TODD 6 | E744: HARRIS 4 | G744: SHARP 3 | I744: M McPHERSON 2 | M744: SALVAS | W744: PORT MELBOURNE | X744: 10 | Y744: 4 | Z744: 0 | AA744: 1427 | AB744: 1391 | AC744: 102.58806613946801 | AD744: 40
A745: SANDRINGHAM | C745: BROKENSHIRE 3 | F745: HEADEN 2 | I745: HOLMES 2 | L745: COLLINS 2 | N745: BENCRAFT | Q745: LOWRY | W745: COBURG | X745: 9 | Y745: 5 | Z745: 0 | AA745: 1252 | AB745: 1165 | AC745: 107.46781115879828 | AD745: 36
A747: BRIGHTON | C747: 1 | D747: 0 | E747: =C747*6+D747 -> 6 | G747: 5 | H747: 6 | I747: =G747*6+H747 -> 36 | K747: 7 | L747: 10 | M747: =K747*6+L747 -> 52 | O747: 13 | P747: 14 | Q747: =O747*6+P747 -> 92 | S747: ELSTERNWICK PARK | W747: SANDRINGHAM | X747: 9 | Y747: 5 | Z747: 0 | AA747: 1358 | AB747: 1370 | AC747: 99.12408759124088 | AD747: 36
A748: COBURG | C748: 2 | D748: 4 | E748: =C748*6+D748 -> 16 | G748: 7 | H748: 8 | I748: =G748*6+H748 -> 50 | K748: 8 | L748: 12 | M748: =K748*6+L748 -> 60 | O748: 10 | P748: 12 | Q748: =O748*6+P748 -> 72 | S748: BARNES | W748: BRIGHTON | X748: 8 | Y748: 5 | Z748: 1 | AA748: 1515 | AB748: 1396 | AC748: 108.5243553008596 | AD748: 34
A749: BEST PLAYERS | W749: BRUNSWICK | X749: 7 | Y749: 7 | Z749: 0 | AA749: 1278 | AB749: 1223 | AC749: 104.4971381847915 | AD749: 28
A750: BRIGHTON | C750: MCINDOE | F750: KENNETT | I750: BAILEY | L750: DOUGLAS | N750: ORGER | Q750: McGUIRE | W750: YARRAVILLE | X750: 5 | Y750: 9 | Z750: 0 | AA750: 1493 | AB750: 1696 | AC750: 88.030660377358487 | AD750: 20
A751: COBURG | C751: HARTRIDGE | F751: HAMMOND | I751: ENGELEEMER | L751: HEALY | N751: McILVEEN | Q751: WILLIAMS | W751: OAKLEIGH | X751: 4 | Y751: 10 | Z751: 0 | AA751: 1274 | AB751: 1539 | AC751: 82.781026640675762 | AD751: 16
A752: GOALKICKERS | W752: NORTHCOTE | X752: 3 | Y752: 10 | Z752: 1 | AA752: 1245 | AB752: 1433 | AC752: 86.88066992323796 | AD752: 14
A753: BRIGHTON | C753: MCINDOE 5 | F753: VALLENCE 4 | I753: DOUGLAS 2 | L753: CARROLL | N753: PLUNKETT | W753: PRESTON | X753: 3 | Y753: 11 | Z753: 0 | AA753: 1202 | AB753: 1296 | AC753: 92.746913580246911 | AD753: 12
A754: COBURG | C754: HARTRIDGE 4 | F754: CONDON 2 | I754: WILLIAMS 2 | L754: MILTE | N754: HEALY | W754: PRAHRAN | X754: 3 | Y754: 11 | Z754: 0 | AA754: 1346 | AB754: 1586 | AC754: 84.867591424968481 | AD754: 12
A756: YARRAVILLE | C756: 7 | D756: 5 | E756: =C756*6+D756 -> 47 | G756: 11 | H756: 8 | I756: =G756*6+H756 -> 74 | K756: 14 | L756: 11 | M756: =K756*6+L756 -> 95 | O756: 16 | P756: 14 | Q756: =O756*6+P756 -> 110 | S756: YARRAVILLE
A757: OAKLEIGH | C757: 0 | D757: 3 | E757: =C757*6+D757 -> 3 | G757: 3 | H757: 4 | I757: =G757*6+H757 -> 22 | K757: 7 | L757: 12 | M757: =K757*6+L757 -> 54 | O757: 11 | P757: 16 | Q757: =O757*6+P757 -> 82 | S757: HICKS
A758: BEST PLAYERS
A759: YARRAVILLE | C759: SPENCE | F759: WOOD | I759: GARLICK | L759: SORRAGHAN | O759: MCKENZIE | R759: VINCENT
A760: OAKLEIGH | C760: CRAWSHAW | F760: S FINN | I760: BICKERTON | L760: MATTHEWS | O760: MOORE | R760: WATSON
A761: GOALKICKERS
A762: YARRAVILLE | C762: ELLIS 4 | E762: ROBB 3 | G762: RUDDELL 2 | J762: GARLICK 2 | M762: VINCENT 2 | P762: SORRAGHAN | S762: HARDIMAN | W762: L WHITE
A763: OAKLEIGH | C763: STIBBARD 3 | F763: WATSON 2 | I763: S FINN 2 | K763: McKENZIE 2 | N763: MATTHEWS | Q763: E RYAN
A765: BRUNSWICK | C765: 1 | D765: 0 | E765: =C765*6+D765 -> 6 | G765: 5 | H765: 10 | I765: =G765*6+H765 -> 40 | K765: 6 | L765: 15 | M765: =K765*6+L765 -> 51 | O765: 14 | P765: 23 | Q765: =O765*6+P765 -> 107 | S765: BRUNSWICK
A766: PRAHRAN | C766: 3 | D766: 6 | E766: =C766*6+D766 -> 24 | G766: 5 | H766: 7 | I766: =G766*6+H766 -> 37 | K766: 8 | L766: 13 | M766: =K766*6+L766 -> 61 | O766: 9 | P766: 13 | Q766: =O766*6+P766 -> 67 | S766: THOMAS
A767: BEST PLAYERS
A768: BRUNSWICK | C768: DONOGHUE | F768: MORCAM | I768: GEISLER | L768: SHAW | O768: BAGGOTT | R768: DOHERTY
A769: PRAHRAN | C769: LAMBOURN | F769: WHITE | I769: O'CONNOR | L769: HOGAN | O769: BATES | R769: SPRIGGS
A770: GOALKICKERS
A771: BRUNSWICK | C771: MORCAM 4 | F771: HENRY 2 | I771: DOHERTY 2 | L771: JACOBS 2 | N771: PRIESTLEY 2 | Q771: KEMP | S771: BAGGOTT
A772: PRAHRAN | C772: GRACIE 2 | F772: WALSH 2 | I772: O'CONNOR | K772: WHITE | M772: HALLINAN | O772: BATES | Q772: O'DONNELL | T772: O'CONNOR
A774: PORT MELBOURNE | C774: 3 | D774: 6 | E774: =C774*6+D774 -> 24 | G774: 4 | H774: 9 | I774: =G774*6+H774 -> 33 | K774: 8 | L774: 12 | M774: =K774*6+L774 -> 60 | O774: 14 | P774: 14 | Q774: =O774*6+P774 -> 98 | S774: PRESTON
A775: PRESTON | C775: 1 | D775: 3 | E775: =C775*6+D775 -> 9 | G775: 5 | H775: 8 | I775: =G775*6+H775 -> 38 | K775: 10 | L775: 12 | M775: =K775*6+L775 -> 72 | O775: 12 | P775: 14 | Q775: =O775*6+P775 -> 86 | S775: TRAIT
A776: BEST PLAYERS
A777: PORT MELBOURNE | C777: BUTCHER | E777: FINDLAY | H777: GOLDSMITH | K777: MENZIES | N777: REYNOLDS | Q777: KELSEY
A778: PRESTON | C778: SNELL | E778: FENNELL | H778: EXELBY | K778: C STEWART | N778: S STEWART | Q778: LEISHMAN]
A779: GOALKICKERS
A780: PORT MELBOURNE | C780: FINDLAY 7 | F780: CULPH 4 | I780: ARTHUR | L780: MENZIES | N780: REYNOLDS
A781: PRESTON | C781: SLEITH 4 | F781: SNELL 3 | I781: GUTHRIE 2 | L781: HARRIS 2 | N781: HINDS
A783: CAMBERWELL | C783: 6 | D783: 3 | E783: =C783*6+D783 -> 39 | G783: 9 | H783: 10 | I783: =G783*6+H783 -> 64 | K783: 15 | L783: 13 | M783: =K783*6+L783 -> 103 | O783: 18 | P783: 19 | Q783: =O783*6+P783 -> 127 | S783: CAMBERWELL
A784: NORTHCOTE | C784: 3 | D784: 4 | E784: =C784*6+D784 -> 22 | G784: 3 | H784: 8 | I784: =G784*6+H784 -> 26 | K784: 7 | L784: 15 | M784: =K784*6+L784 -> 57 | O784: 9 | P784: 20 | Q784: =O784*6+P784 -> 74 | S784: MERRINGTON
A785: BEST PLAYERS
A786: CAMBERWELL | C786: BRADFORD | F786: BOYALL | I786: SHARPLES | L786: BRYCE | O786: TAYLOR | Q786: SYKES
A787: NORTHCOTE | C787: NOLAN | F787: DUNCAN | I787: STRAHAN | L787: WEGNER | O787: RUSH | Q787: BARKER
A788: GOALKICKERS
A789: CAMBERWELL | C789: BRADFORD 6 | F789: BRYCE 3 | H789: ANDERSON 3 | K789: SEELENMEYER | N789: HORKINGS | Q789: INGRAM | T789: BRISTOWE
A790: NORTHCOTE | C790: STRAHAN 4 | F790: DUNCAN 4 | I790: WHITE
A792: ROUND 15 | D792: 27TH JULY | J792: WEATHER | M792: COLD DULL | S792: PLAYED AT
D793: 1ST QTR | H793: 2ND QTR | L793: 3RD QTR | P793: FINAL | S793: PORT MELBOURNE
A794: PORT MELBOURNE | C794: 1 | D794: 1 | E794: =C794*6+D794 -> 7 | G794: 11 | H794: 2 | I794: =G794*6+H794 -> 68 | K794: 12 | L794: 2 | M794: =K794*6+L794 -> 74 | O794: 16 | P794: 9 | Q794: =O794*6+P794 -> 105 | S794: UMPIRE | X794: LADDER | AB794: ROUND | AD794: 15
A795: CAMBERWELL | C795: 7 | D795: 5 | E795: =C795*6+D795 -> 47 | G795: 7 | H795: 8 | I795: =G795*6+H795 -> 50 | K795: 11 | L795: 16 | M795: =K795*6+L795 -> 82 | O795: 12 | P795: 16 | Q795: =O795*6+P795 -> 88 | S795: HICKS
A796: BEST PLAYERS | W796: TEAM | X796: W | Y796: L | Z796: D | AA796: FOR | AB796: AGST | AC796: % | AD796: PTS
A797: PORT MELBOURNE | C797: FLETCHER | F797: FINDLAY | I797: HOUSTEN | L797: REYNOLDS | O797: MANN | Q797: BUTCHER
A798: CAMBERWELL | C798: McIVOR | F798: BRYCE | I798: SHARPLES | L798: SEELENMEYER | O798: HERBERT | Q798: NAISMITH | W798: CAMBERWELL | X798: 11 | Y798: 3 | Z798: 1 | AA798: 1689 | AB798: 1324 | AC798: 127.56797583081571 | AD798: 46
A799: GOALKICKERS | Q799: LEWIS | W799: WILLIAMSTOWN | X799: 11 | Y799: 3 | Z799: 1 | AA799: 1737 | AB799: 1385 | AC799: 125.41516245487365 | AD799: 46
A800: PORT MELBOURNE | C800: FINDLAY 5 | F800: HOUSTEN 3 | I800: HALFPENNY 3 | L800: CULPH | N800: DOBSON | P800: FLETCHER | R800: LEHMANN | W800: PORT MELBOURNE | X800: 11 | Y800: 4 | Z800: 0 | AA800: 1532 | AB800: 1479 | AC800: 103.58350236646383 | AD800: 44
A801: CAMBERWELL | C801: BRYCE 5 | F801: HERBERT 2 | I801: BENNISON 2 | L801: ANDERSON | N801: BOYALL | P801: BRADFORD | W801: SANDRINGHAM | X801: 10 | Y801: 5 | Z801: 0 | AA801: 1466 | AB801: 1473 | AC801: 99.524779361846569 | AD801: 40
A803: SANDRINGHAM | C803: 4 | D803: 2 | E803: =C803*6+D803 -> 26 | G803: 8 | H803: 9 | I803: =G803*6+H803 -> 57 | K803: 10 | L803: 9 | M803: =K803*6+L803 -> 69 | O803: 16 | P803: 12 | Q803: =O803*6+P803 -> 108 | S803: COBURG | W803: COBURG | X803: 9 | Y803: 6 | Z803: 0 | AA803: 1355 | AB803: 1273 | AC803: 106.44147682639435 | AD803: 36
A804: COBURG | C804: 3 | D804: 7 | E804: =C804*6+D804 -> 25 | G804: 7 | H804: 10 | I804: =G804*6+H804 -> 52 | K804: 14 | L804: 12 | M804: =K804*6+L804 -> 96 | O804: 14 | P804: 19 | Q804: =O804*6+P804 -> 103 | S804: VINES | W804: BRIGHTON | X804: 8 | Y804: 6 | Z804: 1 | AA804: 1603 | AB804: 1505 | AC804: 106.51162790697674 | AD804: 34
A805: BEST PLAYERS | W805: BRUNSWICK | X805: 8 | Y805: 7 | Z805: 0 | AA805: 1414 | AB805: 1308 | AC805: 108.10397553516819 | AD805: 32
A806: SANDRINGHAM | C806: PARKER | F806: TOYNE | I806: LOWRY | L806: SALES | N806: HEADEN | Q806: O'TOOLE | W806: YARRAVILLE | X806: 6 | Y806: 9 | Z806: 0 | AA806: 1650 | AB806: 1805 | AC806: 91.412742382271475 | AD806: 24
A807: COBURG | C807: LONSDALE | F807: WILLIAMS | I807: MARDEN | L807: CONDON | N807: HARTRIDGE | Q807: CREWTHER | W807: OAKLEIGH | X807: 5 | Y807: 10 | Z807: 0 | AA807: 1383 | AB807: 1627 | AC807: 85.003073140749848 | AD807: 20
A808: GOALKICKERS | W808: NORTHCOTE | X808: 3 | Y808: 11 | Z808: 1 | AA808: 1330 | AB808: 1569 | AC808: 84.767367750159337 | AD808: 14
A809: SANDRINGHAM | C809: BROKENSHIRE 6 | G809: PARKER 5 | J809: LOWRY 4 | M809: POLE | W809: PRESTON | X809: 3 | Y809: 12 | Z809: 0 | AA809: 1289 | AB809: 1412 | AC809: 91.288951841359776 | AD809: 12
A810: COBURG | C810: HARTRIDGE 6 | G810: WILLIAMS 2 | J810: MARDEN 2 | M810: CREWTHER 2 | P810: CONDON | R810: HEALY | W810: PRAHRAN | X810: 3 | Y810: 12 | Z810: 0 | AA810: 1455 | AB810: 1743 | AC810: 83.476764199655761 | AD810: 12
A812: OAKLEIGH | C812: 4 | D812: 8 | E812: =C812*6+D812 -> 32 | G812: 6 | H812: 10 | I812: =G812*6+H812 -> 46 | K812: 13 | L812: 15 | M812: =K812*6+L812 -> 93 | O812: 15 | P812: 19 | Q812: =O812*6+P812 -> 109 | S812: OAKLEIGH
A813: BRIGHTON | C813: 1 | D813: 2 | E813: =C813*6+D813 -> 8 | G813: 5 | H813: 8 | I813: =G813*6+H813 -> 38 | K813: 5 | L813: 14 | M813: =K813*6+L813 -> 44 | O813: 12 | P813: 16 | Q813: =O813*6+P813 -> 88 | S813: THOMAS
A814: BEST PLAYERS
A815: OAKLEIGH | C815: BEARD | E815: KENNEDY | H815: WILSON | K815: E RYAN | N815: STIBBARD | Q815: MCKENZIE
A816: BRIGHTON | C816: BAILEY | E816: McGUIRE | H816: T NEW | K816: WADDELL | N816: KENNEDY | Q816: DOUGLAS
A817: GOALKICKERS
A818: OAKLEIGH | C818: McKENZIE 4 | F818: E RYAN 3 | I818: KELLY 3 | K818: ANDREW 2 | N818: STIBBARD 2 | Q818: KENNEDY
A819: BRIGHTON | C819: VALLENCE 3 | F819: WARBURTON 2 | J819: ADAMSON 2 | M819: O'BRIEN 2 | O819: HUGHES | Q819: PLUNKETT | T819: DOUGLAS
A821: BRUNSWICK | C821: 6 | D821: 2 | E821: =C821*6+D821 -> 38 | G821: 8 | H821: 6 | I821: =G821*6+H821 -> 54 | K821: 14 | L821: 13 | M821: =K821*6+L821 -> 97 | O821: 20 | P821: 16 | Q821: =O821*6+P821 -> 136 | S821: NORTHCOTE
A822: NORTHCOTE | C822: 1 | D822: 6 | E822: =C822*6+D822 -> 12 | G822: 4 | H822: 13 | I822: =G822*6+H822 -> 37 | K822: 7 | L822: 13 | M822: =K822*6+L822 -> 55 | O822: 11 | P822: 19 | Q822: =O822*6+P822 -> 85 | S822: BARNES
A823: BEST PLAYERS
A824: BRUNSWICK | C824: BAGGOTT | F824: PRIESTLEY | I824: FAY | L824: SHAW | O824: DAVIS | R824: SMITH
A825: NORTHCOTE | C825: NOLAN | F825: DUNCAN | I825: STRAHAN | L825: HISCOX | O825: DICKSON | R825: MCINTOSH
A826: GOALKICKERS
A827: BRUNSWICK | C827: BAGGOTT 9 | F827: SMITH 3 | I827: DOHERTY 2 | L827: MORCAM 2 | O827: UPTON 2 | Q827: HENRY | S827: PRIESTLEY
A828: NORTHCOTE | C828: STRAHAN 5 | F828: DICKSON 3 | I828: WHITE | K828: KELLY | M828: WELLINGTON
A830: YARRAVILLE | C830: 5 | D830: 3 | E830: =C830*6+D830 -> 33 | G830: 9 | H830: 10 | I830: =G830*6+H830 -> 64 | K830: 15 | L830: 11 | M830: =K830*6+L830 -> 101 | O830: 23 | P830: 19 | Q830: =O830*6+P830 -> 157 | S830: TOORAK PARK
A831: PRAHRAN | C831: 2 | D831: 9 | E831: =C831*6+D831 -> 21 | G831: 6 | H831: 12 | I831: =G831*6+H831 -> 48 | K831: 13 | L831: 17 | M831: =K831*6+L831 -> 95 | O831: 15 | P831: 19 | Q831: =O831*6+P831 -> 109 | S831: WRIGLEY
A832: BEST PLAYERS
A833: YARRAVILLE | C833: ELLIS | E833: GARLICK | H833: SORRAGHAN | K833: L WHITE | N833: WOOD | Q833: SPENCE
A834: PRAHRAN | C834: WHITE | E834: WALSH | H834: O'DONNELL | K834: GRACIE | N834: D'OLIVER | Q834: HOGAN
A835: GOALKICKERS
A836: YARRAVILLE | C836: ELLIS 8 | E836: McDONALD 3 | H836: ROBB 3 | J836: RUDDELL 2 | M836: VINCENT 2 | O836: L WHITE 2 | R836: HARDIMAN | U836: GARRICK | X836: PERUSSICH
A837: PRAHRAN | C837: WALSH 5 | E837: CULLEN 3 | G837: CROSLING | I837: WHITE | K837: GRACIE | M837: O'DONNELL | P837: BURGESS | R837: O'CONNOR | U837: GARDINER
A839: WILLIAMSTOWN | C839: 7 | D839: 6 | E839: =C839*6+D839 -> 48 | G839: 10 | H839: 11 | I839: =G839*6+H839 -> 71 | K839: 14 | L839: 15 | M839: =K839*6+L839 -> 99 | O839: 16 | P839: 20 | Q839: =O839*6+P839 -> 116 | S839: WILLIAMSTOWN
A840: PRESTON | C840: 3 | D840: 1 | E840: =C840*6+D840 -> 19 | G840: 6 | H840: 6 | I840: =G840*6+H840 -> 42 | K840: 7 | L840: 7 | M840: =K840*6+L840 -> 49 | O840: 13 | P840: 9 | Q840: =O840*6+P840 -> 87 | S840: MERRINGTON
A841: BEST PLAYERS
A842: WILLIAMSTOWN | C842: HARRIS | E842: CHAPMAN | H842: MATTHEWS | K842: WILLIAMS | N842: SANDELLS | Q842: TODD
A843: PRESTON | C843: SNELL | E843: EXELBY | H843: UNCLES | K843: HARRIS | N843: OLVER | Q843: BRADLEY
A844: GOALKICKERS
A845: WILLIAMSTOWN | C845: HARRIS 10 | F845: TODD 5 | H845: WELLS
A846: PRESTON | C846: OLVER 3 | F846: COOLEY 3 | I846: LATHAM 2 | L846: WILLOUGHBY 2 | O846: SNELL | Q846: GUTHRIE | T846: C STEWART
A848: ROUND 16 | D848: 3RD AUGUST | J848: WEATHER | M848: NORTH WEST BREEZE FINE | S848: PLAYED AT
D849: 1ST QTR | H849: 2ND QTR | L849: 3RD QTR | P849: FINAL | S849: WILLIAMSTOWN
A850: WILLIAMSTOWN | C850: 5 | D850: 4 | E850: =C850*6+D850 -> 34 | G850: 6 | H850: 10 | I850: =G850*6+H850 -> 46 | K850: 7 | L850: 14 | M850: =K850*6+L850 -> 56 | O850: 12 | P850: 17 | Q850: =O850*6+P850 -> 89 | S850: UMPIRE | X850: LADDER | AB850: ROUND | AD850: 16
A851: COBURG | C851: 0 | D851: 3 | E851: =C851*6+D851 -> 3 | G851: 5 | H851: 7 | I851: =G851*6+H851 -> 37 | K851: 7 | L851: 8 | M851: =K851*6+L851 -> 50 | O851: 7 | P851: 13 | Q851: =O851*6+P851 -> 55 | S851: WRIGHT
A852: BEST PLAYERS | W852: TEAM | X852: W | Y852: L | Z852: D | AA852: FOR | AB852: AGST | AC852: % | AD852: PTS
A853: WILLIAMSTOWN | C853: WILLIAMS | F853: HARLEY | I853: CHISHOLM | L853: H McPHERSON | O853: TODD | R853: RONALD
A854: COBURG | C854: HORE | F854: DAY | I854: SMITH | L854: WILLIAMS | O854: ATKINSON | R854: STARBUCK | W854: CAMBERWELL | X854: 12 | Y854: 3 | Z854: 1 | AA854: 1829 | AB854: 1404 | AC854: 130.27065527065528 | AD854: 50
A855: GOALKICKERS | W855: WILLIAMSTOWN | X855: 12 | Y855: 3 | Z855: 1 | AA855: 1826 | AB855: 1440 | AC855: 126.80555555555556 | AD855: 50
A856: WILLIAMSTOWN | C856: TODD 9 | E856: M McPHERSON | H856: HARRIS | J856: PEACOCK | W856: PORT MELBOURNE | X856: 12 | Y856: 4 | Z856: 0 | AA856: 1625 | AB856: 1560 | AC856: 104.16666666666667 | AD856: 48
A857: COBURG | C857: FYFFE 2 | E857: CONDON 2 | H857: FRANCIS | J857: HEALY | M857: HARTRIDGE | W857: SANDRINGHAM | X857: 11 | Y857: 5 | Z857: 0 | AA857: 1618 | AB857: 1561 | AC857: 103.65150544522741 | AD857: 44
A859: PORT MELBOURNE | C859: 3 | D859: 2 | E859: =C859*6+D859 -> 20 | G859: 5 | H859: 7 | I859: =G859*6+H859 -> 37 | K859: 9 | L859: 10 | M859: =K859*6+L859 -> 64 | O859: 13 | P859: 15 | Q859: =O859*6+P859 -> 93 | S859: BRUNSWICK | W859: BRIGHTON | X859: 9 | Y859: 6 | Z859: 1 | AA859: 1714 | AB859: 1595 | AC859: 107.46081504702194 | AD859: 38
A860: BRUNSWICK | C860: 2 | D860: 2 | E860: =C860*6+D860 -> 14 | G860: 6 | H860: 7 | I860: =G860*6+H860 -> 43 | K860: 10 | L860: 11 | M860: =K860*6+L860 -> 71 | O860: 11 | P860: 15 | Q860: =O860*6+P860 -> 81 | S860: HICKS | W860: COBURG | X860: 9 | Y860: 7 | Z860: 0 | AA860: 1410 | AB860: 1362 | AC860: 103.52422907488987 | AD860: 36
A861: BEST PLAYERS | W861: BRUNSWICK | X861: 8 | Y861: 8 | Z861: 0 | AA861: 1495 | AB861: 1401 | AC861: 106.7094932191292 | AD861: 32
A862: PORT MELBOURNE | C862: GILBERT | F862: FLETCHER | I862: FINDLAY | L862: KELSEY | O862: KEATING | Q862: PANNELL | W862: YARRAVILLE | X862: 7 | Y862: 9 | Z862: 0 | AA862: 1749 | AB862: 1881 | AC862: 92.982456140350877 | AD862: 28
A863: BRUNSWICK | C863: PLUMMER | F863: WELDON | I863: BAGGOTT | L863: GLASSCOTT | O863: HALL | Q863: MORCAM | W863: OAKLEIGH | X863: 5 | Y863: 11 | Z863: 0 | AA863: 1471 | AB863: 1779 | AC863: 82.686902754356382 | AD863: 20
A864: GOALKICKERS | O864: MENZIES | R864: FINDLAY | W864: NORTHCOTE | X864: 3 | Y864: 12 | Z864: 1 | AA864: 1406 | AB864: 1668 | AC864: 84.29256594724221 | AD864: 14
A865: PORT MELBOURNE | C865: FLETCHER 4 | F865: PANNELL 2 | I865: REYNOLDS | K865: DOBSON | M865: HALFPENNY | P865: BAKER | R865: HOUSTEN | W865: PRESTON | X865: 3 | Y865: 13 | Z865: 0 | AA865: 1369 | AB865: 1552 | AC865: 88.208762886597938 | AD865: 12
A866: BRUNSWICK | C866: MORCAM 4 | F866: SMITH 3 | I866: HALL 2 | K866: WELDON | M866: JACOBS | W866: PRAHRAN | X866: 3 | Y866: 13 | Z866: 0 | AA866: 1545 | AB866: 1854 | AC866: 83.333333333333329 | AD866: 12
A868: SANDRINGHAM | C868: 5 | D868: 1 | E868: =C868*6+D868 -> 31 | G868: 14 | H868: 7 | I868: =G868*6+H868 -> 91 | K868: 14 | L868: 8 | M868: =K868*6+L868 -> 92 | O868: 23 | P868: 14 | Q868: =O868*6+P868 -> 152 | S868: BEACH ROAD
A869: OAKLEIGH | C869: 4 | D869: 10 | E869: =C869*6+D869 -> 34 | G869: 4 | H869: 14 | I869: =G869*6+H869 -> 38 | K869: 8 | L869: 19 | M869: =K869*6+L869 -> 67 | O869: 11 | P869: 22 | Q869: =O869*6+P869 -> 88 | S869: THOMAS
A870: BEST PLAYERS
A871: SANDRINGHAM | C871: POLE | F871: BROKENSHIRE | I871: BENCRAFT | L871: SLEIGH | N871: LOWRY | Q871: TOYNE
A872: OAKLEIGH | C872: WILLIAMS | F872: BICKERTON | I872: CRAWSHAW | L872: KELLY | N872: D RYAN | Q872: MOORE
A873: GOALKICKERS
A874: SANDRINGHAM | C874: BROKENSHIRE 7 | F874: LOWRY 4 | I874: COLLINS 3 | K874: PARKER 3 | M874: BENCRAFT 2 | P874: POLE 2 | R874: SALES | T874: WEBB
A875: OAKLEIGH | C875: E RYAN 3 | F875: ANDREW 2 | I875: D RYAN | K875: CRAWSHAW | N875: STIBBARD | Q875: KELLY | S875: KENNEDY | V875: GILBERT
A877: YARRAVILLE | C877: 7 | D877: 5 | E877: =C877*6+D877 -> 47 | G877: 10 | H877: 8 | I877: =G877*6+H877 -> 68 | K877: 12 | L877: 14 | M877: =K877*6+L877 -> 86 | O877: 14 | P877: 15 | Q877: =O877*6+P877 -> 99 | S877: YARRAVILLE
A878: NORTHCOTE | C878: 2 | D878: 3 | E878: =C878*6+D878 -> 15 | G878: 4 | H878: 8 | I878: =G878*6+H878 -> 32 | K878: 7 | L878: 8 | M878: =K878*6+L878 -> 50 | O878: 10 | P878: 16 | Q878: =O878*6+P878 -> 76 | S878: MERRINGTON
A879: BEST PLAYERS
A880: YARRAVILLE | C880: ROBB | E880: GARLICK | H880: WOOD | K880: RUDDELL | N880: L WHITE | Q880: MCKENZIE
A881: NORTHCOTE | C881: HISCOX | E881: STAFFORD | H881: RUSH | K881: DICKSON | N881: STRAHAN | Q881: NOLAN
A882: GOALKICKERS
A883: YARRAVILLE | C883: ROBB 5 | F883: ELLIS 4 | I883: VINCENT 2 | L883: L WHITE | O883: HARDIMAN | R883: GARRICK
A884: NORTHCOTE | C884: KINDER 4 | F884: DICKSON | I884: STRAHAN | L884: E WHITE | O884: GALE | Q884: RUSH | S884: McINTOSH
A886: BRIGHTON | C886: 7 | D886: 7 | E886: =C886*6+D886 -> 49 | G886: 12 | H886: 8 | I886: =G886*6+H886 -> 80 | K886: 16 | L886: 11 | M886: =K886*6+L886 -> 107 | O886: 16 | P886: 15 | Q886: =O886*6+P886 -> 111 | S886: ELSTERNWICK PARK
A887: PRAHRAN | C887: 1 | D887: 2 | E887: =C887*6+D887 -> 8 | G887: 4 | H887: 8 | I887: =G887*6+H887 -> 32 | K887: 5 | L887: 11 | M887: =K887*6+L887 -> 41 | O887: 12 | P887: 18 | Q887: =O887*6+P887 -> 90 | S887: BARNES
A888: BEST PLAYERS
A889: BRIGHTON | C889: DOUGLAS | F889: HUGHES | I889: VALLENCE | L889: BAILEY | O889: RICHARDSON | R889: WARBURTON
A890: PRAHRAN | C890: ABIKHAIR | F890: LAMBOURN | I890: WHITE | L890: D'OLIVER | O890: O'DONNELL | R890: O'CONNOR
A891: GOALKICKERS
A892: BRIGHTON | C892: WARBURTON 4 | F892: VALLENCE 4 | I892: DOUGLAS 4 | L892: RICHARDSON 3 | O892: HUGHES
A893: PRAHRAN | C893: GRAVELL 4 | F893: WHITE 3 | H893: MALONEY | J893: BURGESS | L893: HOGAN | N893: ADAMSON | Q893: WALSH
A895: CAMBERWELL | C895: 7 | D895: 2 | E895: =C895*6+D895 -> 44 | G895: 12 | H895: 3 | I895: =G895*6+H895 -> 75 | K895: 18 | L895: 12 | M895: =K895*6+L895 -> 120 | O895: 21 | P895: 14 | Q895: =O895*6+P895 -> 140 | S895: PRESTON
A896: PRESTON | C896: 1 | D896: 1 | E896: =C896*6+D896 -> 7 | G896: 6 | H896: 7 | I896: =G896*6+H896 -> 43 | K896: 6 | L896: 8 | M896: =K896*6+L896 -> 44 | O896: 11 | P896: 14 | Q896: =O896*6+P896 -> 80 | S896: LEE
A897: BEST PLAYERS
A898: CAMBERWELL | C898: BOYALL | E898: BRISTOWE | H898: BRADFORD | K898: COLLIER | N898: SHARPLES | Q898: STYLES
A899: PRESTON | C899: EXELBY | E899: SNELL | H899: C STEWART | K899: HINDS | N899: ANDERSON | Q899: WILLOUGHBY
A900: GOALKICKERS
A901: CAMBERWELL | C901: BOYALL 7 | F901: BRYCE 4 | I901: BOND 3 | K901: BRADFORD 2 | N901: SHARPLES 2 | Q901: SHIELDS | S901: ANDERSON | V901: COLLIER
A902: PRESTON | C902: ANDERSON 3 | F902: DEACON 2 | I902: SNELL 2 | K902: BROWN | M902: DUGGAN | O902: EXELBY | Q902: UNCLES
A904: ROUND 17 | D904: 17TH AUGUST | J904: WEATHER | M904: NORTH WEST WIND | S904: PLAYED AT
D905: 1ST QTR | H905: 2ND QTR | L905: 3RD QTR | P905: FINAL | S905: CAMBERWELL
A906: CAMBERWELL | C906: 1 | D906: 1 | E906: =C906*6+D906 -> 7 | G906: 5 | H906: 10 | I906: =G906*6+H906 -> 40 | K906: 7 | L906: 13 | M906: =K906*6+L906 -> 55 | O906: 14 | P906: 21 | Q906: =O906*6+P906 -> 105 | S906: UMPIRE | X906: LADDER | AB906: ROUND | AD906: 17
A907: BRUNSWICK | C907: 5 | D907: 8 | E907: =C907*6+D907 -> 38 | G907: 6 | H907: 12 | I907: =G907*6+H907 -> 48 | K907: 8 | L907: 20 | M907: =K907*6+L907 -> 68 | O907: 8 | P907: 22 | Q907: =O907*6+P907 -> 70 | S907: VINES
A908: BEST PLAYERS | W908: TEAM | X908: W | Y908: L | Z908: D | AA908: FOR | AB908: AGST | AC908: % | AD908: PTS
A909: CAMBERWELL | C909: McIVOR | E909: HERBERT | H909: STYLES | K909: BRISTOWE | N909: BRADFORD | Q909: SHARPLES
A910: BRUNSWICK | C910: SILK | E910: GLASSCOTT | H910: WELDON | K910: SMITH | N910: PRIESTLEY | Q910: HALL | W910: CAMBERWELL | X910: 13 | Y910: 3 | Z910: 1 | AA910: 1934 | AB910: 1474 | AC910: 131.20759837177746 | AD910: 54
A911: GOALKICKERS | W911: PORT MELBOURNE | X911: 13 | Y911: 4 | Z911: 0 | AA911: 1750 | AB911: 1675 | AC911: 104.4776119402985 | AD911: 52
A912: CAMBERWELL | C912: BRADFORD 3 | F912: HERBERT 3 | I912: BRYCE 2 | K912: MAYO 2 | M912: BRISTOWE | O912: BOND | Q912: SHIELDS | S912: ANDERSON | W912: WILLIAMSTOWN | X912: 12 | Y912: 4 | Z912: 1 | AA912: 1913 | AB912: 1543 | AC912: 123.97926117952042 | AD912: 50
A913: BRUNSWICK | C913: NEWSOM 2 | F913: PRIESTLEY | I913: DONOGHUE | K913: SMITH | M913: GLASSCOTT | P913: MORCAM | R913: WELDON | W913: SANDRINGHAM | X913: 12 | Y913: 5 | Z913: 0 | AA913: 1740 | AB913: 1647 | AC913: 105.64663023679417 | AD913: 48
A915: PORT MELBOURNE | C915: 7 | D915: 3 | E915: =C915*6+D915 -> 45 | G915: 13 | H915: 10 | I915: =G915*6+H915 -> 88 | K915: 15 | L915: 10 | M915: =K915*6+L915 -> 100 | O915: 18 | P915: 17 | Q915: =O915*6+P915 -> 125 | S915: PORT MELBOURNE | W915: COBURG | X915: 10 | Y915: 7 | Z915: 0 | AA915: 1553 | AB915: 1444 | AC915: 107.54847645429363 | AD915: 40
A916: YARRAVILLE | C916: 6 | D916: 4 | E916: =C916*6+D916 -> 40 | G916: 9 | H916: 8 | I916: =G916*6+H916 -> 62 | K916: 12 | L916: 21 | M916: =K916*6+L916 -> 93 | O916: 15 | P916: 25 | Q916: =O916*6+P916 -> 115 | S916: LEE | W916: BRIGHTON | X916: 9 | Y916: 7 | Z916: 1 | AA916: 1763 | AB916: 1686 | AC916: 104.56702253855279 | AD916: 38
A917: BEST PLAYERS | W917: BRUNSWICK | X917: 8 | Y917: 9 | Z917: 0 | AA917: 1565 | AB917: 1506 | AC917: 103.91766268260292 | AD917: 32
A918: PORT MELBOURNE | C918: FINDLAY | F918: BUTCHER | I918: CULPH | L918: TREMBATH | O918: LEWSI | Q918: HALFPENNY | W918: YARRAVILLE | X918: 7 | Y918: 10 | Z918: 0 | AA918: 1864 | AB918: 2006 | AC918: 92.921236291126618 | AD918: 28
A919: YARRAVILLE | C919: HARDIMAN | F919: VINCENT | I919: SPENCE | L919: RUDDELL | O919: ROBB | Q919: YATES | W919: OAKLEIGH | X919: 6 | Y919: 11 | Z919: 0 | AA919: 1574 | AB919: 1866 | AC919: 84.351554126473744 | AD919: 24
A920: GOALKICKERS | W920: NORTHCOTE | X920: 4 | Y920: 12 | Z920: 1 | AA920: 1497 | AB920: 1717 | AC920: 87.186953989516596 | AD920: 18
A921: PORT MELBOURNE | C921: CULPH 7 | E921: MENZIES 3 | H921: FINDLAY 2 | J921: LEWIS 2 | L921: HALFPENNY 2 | O921: BUTCHER | Q921: REYNOLDS | W921: PRESTON | X921: 3 | Y921: 14 | Z921: 0 | AA921: 1451 | AB921: 1695 | AC921: 85.604719764011804 | AD921: 12
A922: YARRAVILLE | C922: ROBB 3 | E922: VINCENT 3 | H922: ELLIS 2 | J922: S WHITE 2 | M922: GARLICK | O922: SORRAGHAN | R922: L WHITE | W922: PRAHRAN | X922: 3 | Y922: 14 | Z922: 0 | AA922: 1631 | AB922: 1976 | AC922: 82.540485829959508 | AD922: 12
P923: HARDIMAN | R923: RUDDELL
A924: NORTHCOTE | C924: 2 | D924: 4 | E924: =C924*6+D924 -> 16 | G924: 8 | H924: 6 | I924: =G924*6+H924 -> 54 | K924: 11 | L924: 11 | M924: =K924*6+L924 -> 77 | O924: 13 | P924: 13 | Q924: =O924*6+P924 -> 91 | S924: NORTHCOTE
A925: BRIGHTON | C925: 0 | D925: 2 | E925: =C925*6+D925 -> 2 | G925: 1 | H925: 8 | I925: =G925*6+H925 -> 14 | K925: 2 | L925: 10 | M925: =K925*6+L925 -> 22 | O925: 6 | P925: 13 | Q925: =O925*6+P925 -> 49 | S925: THOMAS
A926: BEST PLAYERS
A927: NORTHCOTE | C927: HISCOX | E927: KINDER | H927: CRANE | K927: NOLAN | M927: RUSH | P927: McINTOSH
A928: BRIGHTON | C928: BAILEY | E928: WADDELL | H928: ROSE | K928: T NEW | M928: WARBURTON | P928: ARKINSTALL
A929: GOALKICKERS
A930: NORTHCOTE | C930: GREENHAM 4 | F930: DICKSON 2 | I930: RUSH 2 | K930: STRAHAN | M930: MCINTOSH | P930: KINDER | R930: McCRACKEN | V930: STAFFORD
A931: BRIGHTON | C931: VALLENCE 3 | F931: PLUNKETT | I931: DOUGLAS | L931: CARROLL
A933: OAKLEIGH | C933: 3 | D933: 2 | E933: =C933*6+D933 -> 20 | G933: 10 | H933: 5 | I933: =G933*6+H933 -> 65 | K933: 13 | L933: 9 | M933: =K933*6+L933 -> 87 | O933: 15 | P933: 13 | Q933: =O933*6+P933 -> 103 | S933: OAKLEIGH
A934: WILLIAMSTOWN | C934: 6 | D934: 3 | E934: =C934*6+D934 -> 39 | G934: 7 | H934: 7 | I934: =G934*6+H934 -> 49 | K934: 10 | L934: 12 | M934: =K934*6+L934 -> 72 | O934: 12 | P934: 15 | Q934: =O934*6+P934 -> 87 | S934: MERRINGTON
A935: BEST PLAYERS
A936: OAKLEIGH | C936: MATTHEWS | F936: KELLY | I936: WILSON | L936: GLASS | N936: E RYAN | Q936: WATSON
A937: WILLIAMSTOWN | C937: WILLIAMS | F937: WELLS | I937: PEACOCK | L937: STEWART | N937: M McPHERSON | Q937: HARRIS
A938: GOALKICKERS
A939: OAKLEIGH | C939: E RYAN 5 | E939: GLASS 2 | G939: STIBBARD 2 | J939: McKENZIE | M939: WATSON | O939: O'DONOGHUE | R939: ANDREW | U939: KELLY | X939: O'CONNOR
A940: WILLIAMSTOWN | C940: HARRIS 6 | F940: TODD 3 | I940: M McPHERSON | M940: MATTHEWS | P940: STEWART
A942: COBURG | C942: 4 | D942: 9 | E942: =C942*6+D942 -> 33 | G942: 6 | H942: 11 | I942: =G942*6+H942 -> 47 | K942: 17 | L942: 15 | M942: =K942*6+L942 -> 117 | O942: 21 | P942: 17 | Q942: =O942*6+P942 -> 143 | S942: COBURG
A943: PRESTON | C943: 1 | D943: 2 | E943: =C943*6+D943 -> 8 | G943: 4 | H943: 7 | I943: =G943*6+H943 -> 31 | K943: 4 | L943: 10 | M943: =K943*6+L943 -> 34 | O943: 11 | P943: 16 | Q943: =O943*6+P943 -> 82 | S943: BARNES
A944: BEST PLAYERS
A945: COBURG | C945: CONDON | E945: ATKINSON | H945: SILLITOE | K945: KENNEDY | N945: STARBUCK | Q945: MILTE
A946: PRESTON | C946: SNELL | E946: BRADLEY | H946: C STEWART | K946: MASLEN | N946: EXELBY | Q946: WILLOUGHBY
A947: GOALKICKERS
A948: COBURG | C948: HARTRIDGE 6 | F948: CONDON 6 | I948: ENGELEEMER 3 | L948: SILLITOE 2 | N948: MILTE | P948: MARDEN | R948: KENNEDY | U948: CREWTHER
A949: PRESTON | C949: BROWN 2 | F949: McCARTHY 2 | I949: MASLEN 2 | L949: SNELL | N949: DEACON | P949: HARRIS | R949: DUGGAN | U949: GUTHRIE
A951: SANDRINGHAM | C951: 2 | D951: 2 | E951: =C951*6+D951 -> 14 | G951: 10 | H951: 5 | I951: =G951*6+H951 -> 65 | K951: 13 | L951: 7 | M951: =K951*6+L951 -> 85 | O951: 18 | P951: 14 | Q951: =O951*6+P951 -> 122 | S951: TOORAK PARK
A952: PRAHRAN | C952: 3 | D952: 7 | E952: =C952*6+D952 -> 25 | G952: 3 | H952: 9 | I952: =G952*6+H952 -> 27 | K952: 11 | L952: 13 | M952: =K952*6+L952 -> 79 | O952: 12 | P952: 14 | Q952: =O952*6+P952 -> 86 | S952: WRIGHT
A953: BEST PLAYERS
A954: SANDRINGHAM | C954: SLEIGH | F954: TOYNE | I954: BROKENSHIRE | L954: TOMLINS | O954: ANDERS | R954: PARKER
A955: PRAHRAN | C955: ABIKHAIR | F955: NEWTON | I955: MORROW | L955: WALSH | O955: O'DONNELL | R955: GARDINER
A956: GOALKICKERS
A957: SANDRINGHAM | C957: BROKENSHIRE 8 | F957: LOWRY 3 | I957: ANDERS 3 | L957: COLLINS 2 | N957: PARKER 2
A958: PRAHRAN | C958: WALSH 3 | F958: GRAVELL 2 | I958: BATES 2 | K958: MALONEY 2 | N958: WHITE | P958: O'DONNELL | S958: McMAHON
A960: ROUND 18 | D960: 24TH AUGUST | H960: WEATHER | K960: NORTH WEST BREEZE RAIN BEFORE GAMES | S960: PLAYED AT
D961: 1ST QTR | H961: 2ND QTR | L961: 3RD QTR | P961: FINAL | S961: WILLIAMSTOWN
A962: WILLIAMSTOWN | C962: 5 | D962: 1 | E962: =C962*6+D962 -> 31 | G962: 9 | H962: 5 | I962: =G962*6+H962 -> 59 | K962: 12 | L962: 11 | M962: =K962*6+L962 -> 83 | O962: 17 | P962: 12 | Q962: =O962*6+P962 -> 114 | S962: UMPIRE | X962: LADDER | AB962: ROUND | AD962: 18
A963: PORT MELBOURNE | C963: 3 | D963: 6 | E963: =C963*6+D963 -> 24 | G963: 8 | H963: 9 | I963: =G963*6+H963 -> 57 | K963: 12 | L963: 15 | M963: =K963*6+L963 -> 87 | O963: 15 | P963: 17 | Q963: =O963*6+P963 -> 107 | S963: LEE
A964: BEST PLAYERS | W964: TEAM | X964: W | Y964: L | Z964: D | AA964: FOR | AB964: AGST | AC964: % | AD964: PTS
A965: WILLIAMSTOWN | C965: HARRIS | E965: WILLIAMS | I965: HARLEY | L965: M MCPHERSON | O965: WILCOX | Q965: TODD
A966: PORT MELBOURNE | C966: FINDLAY | E966: MENZIES | I966: SEARLE | L966: MANN | O966: LEWIS | Q966: FLETCHER | W966: CAMBERWELL | X966: 14 | Y966: 3 | Z966: 1 | AA966: 2025 | AB966: 1561 | AC966: 129.72453555413196 | AD966: 58
A967: GOALKICKERS | W967: WILLIAMSTOWN | X967: 13 | Y967: 4 | Z967: 1 | AA967: 2027 | AB967: 1650 | AC967: 122.84848484848484 | AD967: 54
A968: WILLIAMSTOWN | C968: TODD 6 | E968: HARRIS 4 | G968: MATTHEWS 2 | J968: SALVAS 2 | M968: SMITH | O968: WILLIAMS | Q968: WELLS | W968: PORT MELBOURNE | X968: 13 | Y968: 5 | Z968: 0 | AA968: 1857 | AB968: 1789 | AC968: 103.80100614868641 | AD968: 52
A969: PORT MELBOURNE | C969: FINDLAY 7 | F969: CULPH 2 | I969: MENZIES 2 | L969: FLETCHER 2 | O969: LEWIS | Q969: HALFPENNY | W969: SANDRINGHAM | X969: 12 | Y969: 6 | Z969: 0 | AA969: 1827 | AB969: 1738 | AC969: 105.12082853855006 | AD969: 48
A971: CAMBERWELL | C971: 4 | D971: 5 | E971: =C971*6+D971 -> 29 | G971: 7 | H971: 9 | I971: =G971*6+H971 -> 51 | K971: 12 | L971: 15 | M971: =K971*6+L971 -> 87 | O971: 12 | P971: 19 | Q971: =O971*6+P971 -> 91 | S971: BEACH ROAD | W971: COBURG | X971: 11 | Y971: 7 | Z971: 0 | AA971: 1658 | AB971: 1499 | AC971: 110.60707138092062 | AD971: 44
A972: SANDRINGHAM | C972: 1 | D972: 4 | E972: =C972*6+D972 -> 10 | G972: 8 | H972: 8 | I972: =G972*6+H972 -> 56 | K972: 11 | L972: 11 | M972: =K972*6+L972 -> 77 | O972: 12 | P972: 15 | Q972: =O972*6+P972 -> 87 | S972: WRIGHT | W972: BRIGHTON | X972: 10 | Y972: 7 | Z972: 1 | AA972: 1919 | AB972: 1787 | AC972: 107.38668158925573 | AD972: 42
A973: BEST PLAYERS | W973: BRUNSWICK | X973: 8 | Y973: 10 | Z973: 0 | AA973: 1666 | AB973: 1662 | AC973: 100.24067388688327 | AD973: 32
A974: CAMBERWELL | C974: McIVOR | F974: BRISTOWE | J974: BRYCE | M974: BOYALL | O974: HERBERT | Q974: BRADFORD | W974: YARRAVILLE | X974: 7 | Y974: 11 | Z974: 0 | AA974: 1960 | AB974: 2123 | AC974: 92.322185586434287 | AD974: 28
A975: SANDRINGHAM | C975: LOWRY | F975: BROKENSHIRE | J975: TOMLINS | M975: PARKER | O975: HEADEN | Q975: CERINI | W975: OAKLEIGH | X975: 6 | Y975: 12 | Z975: 0 | AA975: 1690 | AB975: 1990 | AC975: 84.924623115577887 | AD975: 24
A976: GOALKICKERS | W976: NORTHCOTE | X976: 4 | Y976: 13 | Z976: 1 | AA976: 1552 | AB976: 1822 | AC976: 85.181119648737649 | AD976: 18
A977: CAMBERWELL | C977: BRADFORD 4 | F977: BOYCE 3 | I977: BOYALL | K977: SHIELDS | M977: HERBERT | O977: MAYO | Q977: COLLIER | W977: PRESTON | X977: 4 | Y977: 14 | Z977: 0 | AA977: 1568 | AB977: 1791 | AC977: 87.548855388051365 | AD977: 16
A978: SANDRINGHAM | C978: BROKENSHIRE 4 | F978: LOWRY 4 | I978: HEADEN 2 | K978: PARKER | M978: ANDERS | W978: PRAHRAN | X978: 4 | Y978: 14 | Z978: 0 | AA978: 1755 | AB978: 2092 | AC978: 83.891013384321226 | AD978: 16
A980: BRIGHTON | C980: 5 | D980: 4 | E980: =C980*6+D980 -> 34 | G980: 9 | H980: 11 | I980: =G980*6+H980 -> 65 | K980: 13 | L980: 12 | M980: =K980*6+L980 -> 90 | O980: 23 | P980: 18 | Q980: =O980*6+P980 -> 156 | S980: ELSTERNWICK PARK
A981: BRUNSWICK | C981: 4 | D981: 5 | E981: =C981*6+D981 -> 29 | G981: 7 | H981: 8 | I981: =G981*6+H981 -> 50 | K981: 13 | L981: 14 | M981: =K981*6+L981 -> 92 | O981: 14 | P981: 17 | Q981: =O981*6+P981 -> 101 | S981: TRAIT
A982: BEST PLAYERS
A983: BRIGHTON | C983: VALLENCE | F983: DOUGLAS | I983: McINDOE | L983: ORGER | O983: MOFFATT | R983: McGUIRE
A984: BRUNSWICK | C984: SMITH | F984: NEWSOM | I984: SILK | L984: SHAW | O984: UPTON | R984: WELDON
A985: GOALKICKERS
A986: BRIGHTON | C986: VALLENCE 9 | F986: ADAMSON 6 | I986: McINDOE 3 | L986: DOUGLAS 2 | O986: WARBURTON | R986: PLUNKETT | U986: MOFFATT
A987: BRUNSWICK | C987: NEWSOM 6 | F987: WELDON 2 | I987: SMITH 2 | K987: UPTON | M987: CARTON | O987: PLUMMER | R987: CHALLENGER
A989: PRESTON | C989: 5 | D989: 6 | E989: =C989*6+D989 -> 36 | G989: 6 | H989: 8 | I989: =G989*6+H989 -> 44 | K989: 14 | L989: 8 | M989: =K989*6+L989 -> 92 | O989: 18 | P989: 9 | Q989: =O989*6+P989 -> 117 | S989: PRESTON
A990: YARRAVILLE | C990: 2 | D990: 1 | E990: =C990*6+D990 -> 13 | G990: 7 | H990: 7 | I990: =G990*6+H990 -> 49 | K990: 9 | L990: 10 | M990: =K990*6+L990 -> 64 | O990: 14 | P990: 12 | Q990: =O990*6+P990 -> 96 | S990: SMITHWICK
A991: BEST PLAYERS
A992: PRESTON | C992: EXELBY | E992: COOLEY | H992: SNELL | K992: MASLEN | N992: BRADLEY | Q992: FRANKLIN
A993: YARRAVILLE | C993: YATES | E993: ROBB | H993: MOLONEY | K993: WOOD | N993: GARDINER | Q993: SPENCE
A994: GOALKICKERS
A995: PRESTON | C995: ANDERSON 6 | F995: COOLEY 5 | I995: McCARTHY 2 | L995: SNELL 2 | N995: EXELBY 2 | Q995: UNCLES
A996: YARRAVILLE | C996: ELLIS 3 | F996: RUDDELL 3 | I996: VINCENT 3 | L996: GARLICK 2 | N996: L WHITE | P996: HARDIMAN
A998: PRAHRAN | C998: 5 | D998: 2 | E998: =C998*6+D998 -> 32 | G998: 8 | H998: 7 | I998: =G998*6+H998 -> 55 | K998: 13 | L998: 11 | M998: =K998*6+L998 -> 89 | O998: 18 | P998: 16 | Q998: =O998*6+P998 -> 124 | S998: OAKLEIGH
A999: OAKLEIGH | C999: 4 | D999: 10 | E999: =C999*6+D999 -> 34 | G999: 9 | H999: 14 | I999: =G999*6+H999 -> 68 | K999: 13 | L999: 17 | M999: =K999*6+L999 -> 95 | O999: 16 | P999: 20 | Q999: =O999*6+P999 -> 116 | S999: BARNES
A1000: BEST PLAYERS
A1001: PRAHRAN | C1001: HOGAN | F1001: WHITE | I1001: O'DONNELL | L1001: MORROW | O1001: ABIKHAIR | R1001: GARDINER
A1002: OAKLEIGH | C1002: MATTHEWS | F1002: KELLY | I1002: BICKERTON | L1002: WILLIAMS | O1002: O'CONNOR | R1002: GLASS
A1003: GOALKICKERS
A1004: PRAHRAN | C1004: WHITE 5 | E1004: HAWKINS 4 | H1004: O'CONNOR 2 | K1004: O'DONNELL 2 | N1004: WALSH 2 | Q1004: BURGESS | S1004: BATES | U1004: CULLEN
A1005: OAKLEIGH | C1005: KELLY 4 | E1005: ANDREW 3 | H1005: McKENZIE 2 | K1005: O'DONOGHUE 2 | N1005: GLASS | P1005: STIBBARD | R1005: KENNEDY | U1005: S FINN | W1005: WATSON
A1007: COBURG | C1007: 2 | D1007: 5 | E1007: =C1007*6+D1007 -> 17 | G1007: 7 | H1007: 7 | I1007: =G1007*6+H1007 -> 49 | K1007: 10 | L1007: 13 | M1007: =K1007*6+L1007 -> 73 | O1007: 14 | P1007: 21 | Q1007: =O1007*6+P1007 -> 105 | S1007: COBURG
A1008: NORTHCOTE | C1008: 2 | D1008: 3 | E1008: =C1008*6+D1008 -> 15 | G1008: 5 | H1008: 4 | I1008: =G1008*6+H1008 -> 34 | K1008: 8 | L1008: 6 | M1008: =K1008*6+L1008 -> 54 | O1008: 8 | P1008: 7 | Q1008: =O1008*6+P1008 -> 55 | S1008: VINES
A1009: BEST PLAYERS
A1010: COBURG | C1010: CREWTHER | F1010: HARTRIDGE | I1010: WILLIAMS | L1010: HORE | N1010: LONSDALE | Q1010: ATKINSON
A1011: NORTHCOTE | C1011: HISCOX | F1011: NOLAN | I1011: CRANE | L1011: KELLY | N1011: McINTOSH | Q1011: GREENWOOD
A1012: GOALKICKERS
A1013: COBURG | C1013: HARTRIDGE 3 | F1013: WILLIAMS 3 | I1013: WALSH 3 | K1013: CREWTHER 2 | N1013: ENGELEEMER | Q1013: MARDEN | S1013: CONDON
A1014: NORTHCOTE | C1014: GREENHAM 4 | F1014: STRAHAN | I1014: McINTOSH | L1014: DICKSON | N1014: WHITE
A1016: ROUND 19 | D1016: 31ST AUGUST | S1016: PLAYED AT
D1017: 1ST QTR | H1017: 2ND QTR | L1017: 3RD QTR | P1017: FINAL | S1017: CAMBERWELL
A1018: CAMBERWELL | C1018: 4 | D1018: 5 | E1018: =C1018*6+D1018 -> 29 | G1018: 8 | H1018: 9 | I1018: =G1018*6+H1018 -> 57 | K1018: 12 | L1018: 12 | M1018: =K1018*6+L1018 -> 84 | O1018: 20 | P1018: 16 | Q1018: =O1018*6+P1018 -> 136 | S1018: UMPIRE | X1018: LADDER | AB1018: ROUND | AD1018: 19
A1019: WILLIAMSTOWN | C1019: 3 | D1019: 5 | E1019: =C1019*6+D1019 -> 23 | G1019: 5 | H1019: 8 | I1019: =G1019*6+H1019 -> 38 | K1019: 6 | L1019: 10 | M1019: =K1019*6+L1019 -> 46 | O1019: 11 | P1019: 15 | Q1019: =O1019*6+P1019 -> 81 | S1019: WRIGHT
A1020: BEST PLAYERS | W1020: TEAM | X1020: W | Y1020: L | Z1020: D | AA1020: FOR | AB1020: AGST | AC1020: % | AD1020: PTS
A1021: CAMBERWELL | C1021: HERBERT | F1021: NAISMITH | I1021: BRYCE | K1021: BURKHALTER | N1021: McIVOR | Q1021: HORKINGS
A1022: WILLIAMSTOWN | C1022: MATTHEWS | F1022: WILLIAMS | I1022: HARLEY | K1022: WELLS | N1022: SPRING | Q1022: SALVAS | W1022: CAMBERWELL | X1022: 15 | Y1022: 3 | Z1022: 1 | AA1022: 2161 | AB1022: 1642 | AC1022: 131.60779537149818 | AD1022: 62
A1023: GOALKICKERS | W1023: WILLIAMSTOWN | X1023: 13 | Y1023: 5 | Z1023: 1 | AA1023: 2108 | AB1023: 1786 | AC1023: 118.02911534154535 | AD1023: 54
A1024: CAMBERWELL | C1024: BRYCE 5 | E1024: SHIELDS 4 | G1024: HERBERT 4 | J1024: BRADFORD 2 | M1024: OLIVER 2 | O1024: ANDERSON | Q1024: BRISTOWE | T1024: BOND | W1024: SANDRINGHAM | X1024: 13 | Y1024: 6 | Z1024: 0 | AA1024: 1926 | AB1024: 1827 | AC1024: 105.41871921182266 | AD1024: 52
A1025: WILLIAMSTOWN | C1025: HARIS 2 | E1025: SPRING 2 | G1025: SALVAS 2 | I1025: TODD 2 | K1025: MATTHEWS | N1025: STEWART | P1025: WILLIAMS | W1025: PORT MELBOURNE | X1025: 13 | Y1025: 6 | Z1025: 0 | AA1025: 1959 | AB1025: 1894 | AC1025: 103.43189017951426 | AD1025: 52
A1027: COBURG | C1027: 6 | D1027: 6 | E1027: =C1027*6+D1027 -> 42 | G1027: 9 | H1027: 12 | I1027: =G1027*6+H1027 -> 66 | K1027: 13 | L1027: 18 | M1027: =K1027*6+L1027 -> 96 | O1027: 14 | P1027: 21 | Q1027: =O1027*6+P1027 -> 105 | S1027: PORT MELBOURNE | W1027: COBURG | X1027: 12 | Y1027: 7 | Z1027: 0 | AA1027: 1763 | AB1027: 1601 | AC1027: 110.11867582760775 | AD1027: 48
A1028: PORT MELBOURNE | C1028: 3 | D1028: 2 | E1028: =C1028*6+D1028 -> 20 | G1028: 8 | H1028: 5 | I1028: =G1028*6+H1028 -> 53 | K1028: 9 | L1028: 7 | M1028: =K1028*6+L1028 -> 61 | O1028: 15 | P1028: 12 | Q1028: =O1028*6+P1028 -> 102 | S1028: THOMAAS | W1028: BRIGHTON | X1028: 10 | Y1028: 8 | Z1028: 1 | AA1028: 2001 | AB1028: 1896 | AC1028: 105.53797468354431 | AD1028: 42
A1029: BEST PLAYERS | W1029: BRUNSWICK | X1029: 8 | Y1029: 11 | Z1029: 0 | AA1029: 1755 | AB1029: 1761 | AC1029: 99.659284497444631 | AD1029: 32
A1030: COBURG | C1030: MARDEN | E1030: CONDON | H1030: CREWTHER | K1030: ATKINSON | N1030: KENNEDY | Q1030: WALSH | W1030: YARRAVILLE | X1030: 8 | Y1030: 11 | Z1030: 0 | AA1030: 2069 | AB1030: 2205 | AC1030: 93.832199546485256 | AD1030: 32
A1031: PORT MELBOURNE | C1031: CULPH | E1031: GOLDSMITH | H1031: TREMBATH | K1031: LEWIS | N1031: REYNOLDS | Q1031: FINDLAY | W1031: OAKLEIGH | X1031: 6 | Y1031: 13 | Z1031: 0 | AA1031: 1769 | AB1031: 2072 | AC1031: 85.37644787644787 | AD1031: 24
A1032: GOALKICKERS | W1032: NORTHCOTE | X1032: 5 | Y1032: 13 | Z1032: 1 | AA1032: 1634 | AB1032: 1901 | AC1032: 85.954760652288272 | AD1032: 22
A1033: COBURG | C1033: CREWTHER 4 | F1033: MARDEN 3 | I1033: HARTRIDGE 2 | L1033: ENGELEEMER 2 | O1033: WILLIAMS | Q1033: CONDON | S1033: WILSON | W1033: PRESTON | X1033: 5 | Y1033: 14 | Z1033: 0 | AA1033: 1663 | AB1033: 1870 | AC1033: 88.930481283422466 | AD1033: 20
A1034: PORT MELBOURNE | C1034: FINDLAY 5 | F1034: CULPH 3 | I1034: LEWIS 3 | K1034: REYNOLDS | M1034: TREMBATH | P1034: DOBSON | W1034: PRAHRAN | X1034: 4 | Y1034: 15 | Z1034: 0 | AA1034: 1834 | AB1034: 2187 | AC1034: 83.859167809785092 | AD1034: 16
A1036: SANDRINGHAM | C1036: 0 | D1036: 3 | E1036: =C1036*6+D1036 -> 3 | G1036: 6 | H1036: 5 | I1036: =G1036*6+H1036 -> 41 | K1036: 7 | L1036: 6 | M1036: =K1036*6+L1036 -> 48 | O1036: 15 | P1036: 9 | Q1036: =O1036*6+P1036 -> 99 | S1036: BRUNSWICK
A1037: BRUNSWICK | C1037: 2 | D1037: 8 | E1037: =C1037*6+D1037 -> 20 | G1037: 4 | H1037: 10 | I1037: =G1037*6+H1037 -> 34 | K1037: 9 | L1037: 17 | M1037: =K1037*6+L1037 -> 71 | O1037: 12 | P1037: 17 | Q1037: =O1037*6+P1037 -> 89 | S1037: MERRINGTON
A1038: BEST PLAYERS
A1039: SANDRINGHAM | C1039: BENCRAFT | F1039: LAVER | I1039: LOWRY | L1039: GRAMBEAU | O1039: HOLMES | R1039: SLEIGH
A1040: BRUNSWICK | C1040: EVANS | F1040: SILK | I1040: SHAW | L1040: SMITH | O1040: GLASSCOTT | R1040: CHALLENGER
A1041: GOALKICKERS
A1042: SANDRINGHAM | C1042: BROKENSHIRE 4 | F1042: LOWRY 3 | I1042: POLE 2 | K1042: PARKER 2 | M1042: ANDERS | O1042: BENCRAFT | R1042: CERINI | U1042: HOLMES
A1043: BRUNSWICK | C1043: UPTON 3 | F1043: BAGGOTT 2 | I1043: NEWSOM 2 | L1043: SMITH 2 | N1043: GLASSCOTT | Q1043: PRIESTLEY | T1043: HALL
A1045: YARRAVILLE | C1045: 2 | D1045: 2 | E1045: =C1045*6+D1045 -> 14 | G1045: 8 | H1045: 8 | I1045: =G1045*6+H1045 -> 56 | K1045: 9 | L1045: 11 | M1045: =K1045*6+L1045 -> 65 | O1045: 16 | P1045: 13 | Q1045: =O1045*6+P1045 -> 109 | S1045: YARRAVILLE
A1046: BRIGHTON | C1046: 3 | D1046: 7 | E1046: =C1046*6+D1046 -> 25 | G1046: 4 | H1046: 9 | I1046: =G1046*6+H1046 -> 33 | K1046: 8 | L1046: 13 | M1046: =K1046*6+L1046 -> 61 | O1046: 11 | P1046: 16 | Q1046: =O1046*6+P1046 -> 82 | S1046: BARNES
A1047: BEST PLAYERS
A1048: YARRAVILLE | C1048: McDONALD | F1048: ROBB | I1048: GARLICK | L1048: VINCENT | O1048: ELLIS | R1048: SPENCE
A1049: BRIGHTON | C1049: McINDOE | F1049: BAILEY | I1049: KENNETT | L1049: HALCOMBE | O1049: DOUGLAS | R1049: T NEW
A1050: GOALKICKERS
A1051: YARRAVILLE | C1051: McDONALD 3 | F1051: ROBB 3 | H1051: PERUSSICH 2 | K1051: SORRAGHAN 2 | N1051: VINCENT 2 | Q1051: RUDDELL | S1051: CAESAR | U1051: ELLIS
A1052: BRIGHTON | C1052: VALLENCE 4 | F1052: McINDOE 3 | I1052: DOUGLAS 2 | L1052: RICHARDSON 2
A1054: NORTHCOTE | C1054: 0 | D1054: 2 | E1054: =C1054*6+D1054 -> 2 | G1054: 6 | H1054: 6 | I1054: =G1054*6+H1054 -> 42 | K1054: 7 | L1054: 7 | M1054: =K1054*6+L1054 -> 49 | O1054: 12 | P1054: 10 | Q1054: =O1054*6+P1054 -> 82 | S1054: NORTHCOTE
A1055: OAKLEIGH | C1055: 5 | D1055: 8 | E1055: =C1055*6+D1055 -> 38 | G1055: 6 | H1055: 10 | I1055: =G1055*6+H1055 -> 46 | K1055: 10 | L1055: 12 | M1055: =K1055*6+L1055 -> 72 | O1055: 11 | P1055: 13 | Q1055: =O1055*6+P1055 -> 79 | S1055: SMITHWICK
A1056: BEST PLAYERS
A1057: NORTHCOTE | C1057: WHITE | F1057: NOLAN | I1057: MURPHY | L1057: HISCOX | O1057: DICKSON | R1057: McCRACKEN
A1058: OAKLEIGH | C1058: MATTHEWS | F1058: WEISS | I1058: WILSON | L1058: BICKERTON | O1058: CRAWSHAW | R1058: McKENZIE
A1059: GOALKICKERS
A1060: NORTHCOTE | C1060: WHITE 5 | F1060: GREENHAM 3 | J1060: KINDER | L1060: McINTOSH | O1060: McCRACKEN | R1060: RUSH
A1061: OAKLEIGH | C1061: ANDREW 3 | F1061: O'DONOGHUE 3 | J1061: FISHER 2 | M1061: WATSON | O1061: CRAWSHAW | R1061: KENNEDY
A1063: PRESTON | C1063: 4 | D1063: 3 | E1063: =C1063*6+D1063 -> 27 | G1063: 6 | H1063: 7 | I1063: =G1063*6+H1063 -> 43 | K1063: 13 | L1063: 14 | M1063: =K1063*6+L1063 -> 92 | O1063: 13 | P1063: 17 | Q1063: =O1063*6+P1063 -> 95 | S1063: PRESTON
A1064: PRAHRAN | C1064: 3 | D1064: 2 | E1064: =C1064*6+D1064 -> 20 | G1064: 8 | H1064: 5 | I1064: =G1064*6+H1064 -> 53 | K1064: 9 | L1064: 6 | M1064: =K1064*6+L1064 -> 60 | O1064: 11 | P1064: 13 | Q1064: =O1064*6+P1064 -> 79 | S1064: VINE
A1065: BEST PLAYERS
A1066: PRESTON | C1066: SNELL | F1066: BRYCE | I1066: S STEWART | L1066: BRADLEY | O1066: EXELBY | R1066: MASLEN
A1067: PRAHRAN | C1067: LAMBOURN | F1067: BOURKE | I1067: WEBER | L1067: WHITE | O1067: O'CONNOR | R1067: BURGESS
A1068: GOALKICKERS
A1069: PRESTON | C1069: GUTHRIE 3 | F1069: MCCARTHY 2 | I1069: HARRIS 2 | K1069: SNELL 2 | M1069: ANDERSON | P1069: EXELBY | R1069: COOLEY | U1069: BRYCE
A1070: PRAHRAN | C1070: WHITE 3 | E1070: WALSH | G1070: BATES | I1070: DOUGHTON | L1070: CROSLING | N1070: HAWKINS | P1070: GARDINER | R1070: O'CONNOR | U1070: BURGESS
A1072: ROUND 20 | D1072: 7TH SEPTEMBER | J1072: WEATHER | M1072: SOUTH WEST BREEZE FINE | S1072: PLAYED AT
D1073: 1ST QTR | H1073: 2ND QTR | L1073: 3RD QTR | P1073: FINAL | S1073: COBURG
A1074: COBURG | C1074: 3 | D1074: 5 | E1074: =C1074*6+D1074 -> 23 | G1074: 8 | H1074: 12 | I1074: =G1074*6+H1074 -> 60 | K1074: 15 | L1074: 18 | M1074: =K1074*6+L1074 -> 108 | O1074: 21 | P1074: 23 | Q1074: =O1074*6+P1074 -> 149 | S1074: UMPIRE | X1074: LADDER | AB1074: ROUND | AD1074: 20
A1075: CAMBERWELL | C1075: 5 | D1075: 0 | E1075: =C1075*6+D1075 -> 30 | G1075: 6 | H1075: 1 | I1075: =G1075*6+H1075 -> 37 | K1075: 7 | L1075: 5 | M1075: =K1075*6+L1075 -> 47 | O1075: 12 | P1075: 6 | Q1075: =O1075*6+P1075 -> 78 | S1075: BARNES
A1076: BEST PLAYERS | W1076: TEAM | X1076: W | Y1076: L | Z1076: D | AA1076: FOR | AB1076: AGST | AC1076: % | AD1076: PTS
A1077: COBURG | C1077: ATKINSON | F1077: WILSON | I1077: SMITH | L1077: MILTE | O1077: ENGELEEMER | R1077: PROMNITZ
A1078: CAMBERWELL | C1078: BENNISON | F1078: McIVOR | I1078: NAISMITH | L1078: BRISTOWE | O1078: TAYLOR | R1078: BOND | W1078: CAMBERWELL | X1078: 15 | Y1078: 4 | Z1078: 1 | AA1078: 2239 | AB1078: 1791 | AC1078: 125.01395868230038 | AD1078: 62
A1079: GOALKICKERS | W1079: WILLIAMSTOWN | X1079: 14 | Y1079: 5 | Z1079: 1 | AA1079: 2205 | AB1079: 1866 | AC1079: 118.16720257234726 | AD1079: 58
A1080: COBURG | C1080: CREWTHER 6 | F1080: HARTRIDGE 4 | I1080: EGAN 3 | K1080: CONDON 2 | M1080: WILLIAMS 2 | P1080: DAY | Q1080: HEALY | S1080: KENNEDY | W1080: SANDRINGHAM | X1080: 14 | Y1080: 6 | Z1080: 0 | AA1080: 2088 | AB1080: 1959 | AC1080: 106.58499234303216 | AD1080: 56
A1081: CAMBERWELL | C1081: BRYCE 3 | E1081: BOND 3 | G1081: SHIELDS 2 | I1081: OLIVER 2 | K1081: HERBERT | M1081: LAMBDEN | W1081: PORT MELBOURNE | X1081: 14 | Y1081: 6 | Z1081: 0 | AA1081: 2120 | AB1081: 2020 | AC1081: 104.95049504950495 | AD1081: 56
A1083: WILLIAMSTOWN | C1083: 5 | D1083: 4 | E1083: =C1083*6+D1083 -> 34 | G1083: 6 | H1083: 7 | I1083: =G1083*6+H1083 -> 43 | K1083: 10 | L1083: 12 | M1083: =K1083*6+L1083 -> 72 | O1083: 14 | P1083: 13 | Q1083: =O1083*6+P1083 -> 97 | S1083: WILLIAMSTOWN | W1083: COBURG | X1083: 13 | Y1083: 7 | Z1083: 0 | AA1083: 1912 | AB1083: 1679 | AC1083: 113.87730792138177 | AD1083: 52
A1084: BRUNSWICK | C1084: 0 | D1084: 3 | E1084: =C1084*6+D1084 -> 3 | G1084: 7 | H1084: 10 | I1084: =G1084*6+H1084 -> 52 | K1084: 7 | L1084: 11 | M1084: =K1084*6+L1084 -> 53 | O1084: 11 | P1084: 14 | Q1084: =O1084*6+P1084 -> 80 | S1084: TRAIT | W1084: BRIGHTON | X1084: 11 | Y1084: 8 | Z1084: 1 | AA1084: 2163 | AB1084: 2010 | AC1084: 107.61194029850746 | AD1084: 46
A1085: BEST PLAYERS | W1085: BRUNSWICK | X1085: 8 | Y1085: 12 | Z1085: 0 | AA1085: 1835 | AB1085: 1858 | AC1085: 98.762109795479006 | AD1085: 32
A1086: WILLIAMSTOWN | C1086: WELLS | E1086: FEATHERBY | H1086: HARLEY | K1086: SALVAS | N1086: H McPHERSON | Q1086: RONALD | W1086: YARRAVILLE | X1086: 8 | Y1086: 12 | Z1086: 0 | AA1086: 2201 | AB1086: 2367 | AC1086: 92.986903253062948 | AD1086: 32
A1087: BRUNSWICK | C1087: SILK | E1087: HALL | H1087: PRIESTLEY | K1087: EVANS | N1087: BAGGOTT | Q1087: GEISLER | W1087: OAKLEIGH | X1087: 6 | Y1087: 14 | Z1087: 0 | AA1087: 1895 | AB1087: 2233 | AC1087: 84.863412449619346 | AD1087: 24
A1088: GOALKICKERS | W1088: NORTHCOTE | X1088: 5 | Y1088: 14 | Z1088: 1 | AA1088: 1742 | AB1088: 2048 | AC1088: 85.05859375 | AD1088: 22
A1089: WILLIAMSTOWN | C1089: SALVAS 4 | F1089: WELLS 4 | I1089: HARRIS 3 | L1089: TODD | N1089: M McPHERSON | Q1089: RONALD | W1089: PRESTON | X1089: 5 | Y1089: 15 | Z1089: 0 | AA1089: 1777 | AB1089: 2032 | AC1089: 87.4507874015748 | AD1089: 20
A1090: BRUNSWICK | C1090: UPTON 4 | F1090: BAGGOTT 2 | I1090: DAVIS 2 | L1090: ROSS | N1090: GLASSCOTT | Q1090: SMITH | W1090: PRAHRAN | X1090: 5 | Y1090: 15 | Z1090: 0 | AA1090: 1981 | AB1090: 2295 | AC1090: 86.31808278867102 | AD1090: 20
A1092: SANDRINGHAM | C1092: 4 | D1092: 8 | E1092: =C1092*6+D1092 -> 32 | G1092: 7 | H1092: 10 | I1092: =G1092*6+H1092 -> 52 | K1092: 16 | L1092: 15 | M1092: =K1092*6+L1092 -> 111 | O1092: 24 | P1092: 18 | Q1092: =O1092*6+P1092 -> 162 | S1092: BEACH ROAD
A1093: YARRAVILLE | C1093: 6 | D1093: 6 | E1093: =C1093*6+D1093 -> 42 | G1093: 11 | H1093: 13 | I1093: =G1093*6+H1093 -> 79 | K1093: 15 | L1093: 15 | M1093: =K1093*6+L1093 -> 105 | O1093: 19 | P1093: 18 | Q1093: =O1093*6+P1093 -> 132 | S1093: SMITHWICK
A1094: BEST PLAYERS
A1095: SANDRINGHAM | C1095: BENCRAFT | F1095: TOMLINS | I1095: GRAMBEAU | L1095: LOWRY | N1095: PARKER | Q1095: WEBB
A1096: YARRAVILLE | C1096: ROBB | F1096: PERUSSICH | I1096: ELLIS | L1096: GARLICK | N1096: RUDDELL | Q1096: GARDNER
A1097: GOALKICKERS
A1098: SANDRINGHAM | C1098: TOMLINS 9 | F1098: LOWRY 5 | I1098: BENCRAFT 4 | L1098: PARKER 3 | N1098: COLLINS | P1098: HOLMES | R1098: EVANS
A1099: YARRAVILLE | C1099: ELLIS 7 | F1099: ROBB 4 | I1099: RUDDELL 4 | L1099: VINCENT 2 | N1099: PERUSSICH | Q1099: McDONALD
A1101: PORT MELBOURNE | C1101: 4 | D1101: 7 | E1101: =C1101*6+D1101 -> 31 | G1101: 10 | H1101: 9 | I1101: =G1101*6+H1101 -> 69 | K1101: 18 | L1101: 20 | M1101: =K1101*6+L1101 -> 128 | O1101: 23 | P1101: 23 | Q1101: =O1101*6+P1101 -> 161 | S1101: OAKLEIGH
A1102: OAKLEIGH | C1102: 2 | D1102: 3 | E1102: =C1102*6+D1102 -> 15 | G1102: 9 | H1102: 7 | I1102: =G1102*6+H1102 -> 61 | K1102: 12 | L1102: 12 | M1102: =K1102*6+L1102 -> 84 | O1102: 18 | P1102: 18 | Q1102: =O1102*6+P1102 -> 126 | S1102: WRIGHT
A1103: BEST PLAYERS
A1104: PORT MELBOURNE | C1104: MENZIES | F1104: MANN | I1104: FLETCHER | L1104: FINDLAY | N1104: CULPH | Q1104: KELSEY
A1105: OAKLEIGH | C1105: MATTHEWS | F1105: WEISS | I1105: CRAWSHAW | L1105: KENNEDY | N1105: BICKERTON | Q1105: STIBBARD
A1106: GOALKICKERS
A1107: PORT MELBOURNE | C1107: FINDLAY 5 | F1107: TURNER 5 | I1107: MENZIES 5 | L1107: CULPH 4 | N1107: HOUSTEN | P1107: KELLY | R1107: FLETCHER | U1107: PANNELL
A1108: OAKLEIGH | C1108: CRAWSHAW 6 | F1108: ANDREW 4 | I1108: STIBBARD 3 | L1108: E RYAN 2 | N1108: KELLY | P1108: KENNEDY | R1108: O'CONNOR
A1110: PRAHRAN | C1110: 6 | D1110: 4 | E1110: =C1110*6+D1110 -> 40 | G1110: 10 | H1110: 6 | I1110: =G1110*6+H1110 -> 66 | K1110: 18 | L1110: 7 | M1110: =K1110*6+L1110 -> 115 | O1110: 23 | P1110: 9 | Q1110: =O1110*6+P1110 -> 147 | S1110: TOORAK PARK
A1111: NORTHCOTE | C1111: 2 | D1111: 1 | E1111: =C1111*6+D1111 -> 13 | G1111: 7 | H1111: 9 | I1111: =G1111*6+H1111 -> 51 | K1111: 12 | L1111: 13 | M1111: =K1111*6+L1111 -> 85 | O1111: 15 | P1111: 18 | Q1111: =O1111*6+P1111 -> 108 | S1111: MERRINGTON
A1112: BEST PLAYERS
A1113: PRAHRAN | C1113: WEBER | F1113: ABIKHAIR | I1113: HAWKINS | L1113: BOURKE | O1113: HOGAN | R1113: WHITE
A1114: NORTHCOTE | C1114: STAFFORD | F1114: WHITE | I1114: STABB | L1114: McCRACKEN | O1114: KINDER | R1114: HISCOX
A1115: GOALKICKERS
A1116: PRAHRAN | C1116: HAWKINS 6 | F1116: CULLEN 4 | I1116: WEBER 3 | K1116: WHITE 3 | M1116: D'OLIVER 3 | O1116: BATES 2 | Q1116: GARDINER | T1116: O'CONNOR
A1117: NORTHCOTE | C1117: MCCRACKEN 4 | F1117: WHITE 3 | I1117: STRAHAN 3 | L1117: KINDER | N1117: COWAN | P1117: GREENWOOD | S1117: DICKSON | V1117: McINTOSH
A1119: BRIGHTON | C1119: 8 | D1119: 4 | E1119: =C1119*6+D1119 -> 52 | G1119: 13 | H1119: 8 | I1119: =G1119*6+H1119 -> 86 | K1119: 19 | L1119: 12 | M1119: =K1119*6+L1119 -> 126 | O1119: 25 | P1119: 12 | Q1119: =O1119*6+P1119 -> 162 | S1119: ELSTERNWICK PARK
A1120: PRESTON | C1120: 4 | D1120: 1 | E1120: =C1120*6+D1120 -> 25 | G1120: 7 | H1120: 9 | I1120: =G1120*6+H1120 -> 51 | K1120: 12 | L1120: 11 | M1120: =K1120*6+L1120 -> 83 | O1120: 16 | P1120: 18 | Q1120: =O1120*6+P1120 -> 114 | S1120: LEE
A1121: BEST PLAYERS
A1122: BRIGHTON | C1122: VALLENCE | F1122: McINDOE | I1122: KENNETT | L1122: T NEW | O1122: McGUIRE | R1122: ORGER
A1123: PRESTON | C1123: ANDERSON | F1123: MASLEN | I1123: SNELL | L1123: HARRIS | O1123: McCARTHY | R1123: PITT
A1124: GOALKICKERS
A1125: BRIGHTON | C1125: VALLENCE 11 | F1125: DOUGLAS 5 | I1125: ADAMSON 3 | L1125: RICHARDSON 2 | O1125: McINDOE 2 | R1125: WARBURTON 2
A1126: PRESTON | C1126: HINDS 4 | F1126: ANDERSON 4 | I1126: McCARTHY 3 | L1126: COOLEY 2 | N1126: SNELL | P1126: HARRIS | R1126: RICHARDSON
A1128: FINALS
A1129: 1ST SEMI | D1129: 14TH SEPTEMBER | J1129: WEATHER | M1129: SOUTH WEST BREEZE FINE
D1130: 1ST QTR | H1130: 2ND QTR | L1130: 3RD QTR | P1130: FINAL
A1131: SANDRINGHAM | C1131: 3 | D1131: 1 | E1131: =C1131*6+D1131 -> 19 | G1131: 11 | H1131: 6 | I1131: =G1131*6+H1131 -> 72 | K1131: 12 | L1131: 10 | M1131: =K1131*6+L1131 -> 82 | O1131: 18 | P1131: 14 | Q1131: =O1131*6+P1131 -> 122 | S1131: JUNCTION OVAL
A1132: PORT MELBOURNE | C1132: 3 | D1132: 6 | E1132: =C1132*6+D1132 -> 24 | G1132: 8 | H1132: 7 | I1132: =G1132*6+H1132 -> 55 | K1132: 13 | L1132: 8 | M1132: =K1132*6+L1132 -> 86 | O1132: 14 | P1132: 9 | Q1132: =O1132*6+P1132 -> 93 | S1132: MERRINGTON
A1133: BEST PLAYERS
A1134: SANDRINGHAM | C1134: TOMLINS | F1134: TOYNE | I1134: O'TOOLE | L1134: BROKENSHIRE | O1134: SALES | Q1134: EVANS
A1135: PORT MELBOURNE | C1135: FINDLAY | F1135: MENZIES | I1135: REYNOLDS | L1135: LOCK | O1135: SEARLE | Q1135: HOUSTEN
A1136: GOALKICKERS
A1137: SANDRINGHAM | C1137: BROKENSHIRE 7 | F1137: PARKER 3 | I1137: LOWRY 2 | K1137: HOLMES 2 | M1137: SALES | O1137: POLE | Q1137: ANDERS | S1137: BENCRAFT
A1138: PORT MELBOURNE | C1138: FINDLAY 8 | F1138: FLETCHER | I1138: SEARLE | K1138: CULPH | M1138: HOUSTEN | O1138: LEWIS | Q1138: MENZIES
A1140: 2ND SEMI | D1140: 21ST SEPTEMBER | J1140: WEATHER | L1140: SOUTH BREEZE LIGHT SHOWERS
A1141: CAMBERWELL | C1141: 1 | D1141: 7 | E1141: =C1141*6+D1141 -> 13 | G1141: 2 | H1141: 12 | I1141: =G1141*6+H1141 -> 24 | K1141: 6 | L1141: 13 | M1141: =K1141*6+L1141 -> 49 | O1141: 12 | P1141: 19 | Q1141: =O1141*6+P1141 -> 91 | S1141: JUNCTION OVAL
A1142: WILLIAMSTOWN | C1142: 5 | D1142: 5 | E1142: =C1142*6+D1142 -> 35 | G1142: 6 | H1142: 5 | I1142: =G1142*6+H1142 -> 41 | K1142: 8 | L1142: 11 | M1142: =K1142*6+L1142 -> 59 | O1142: 11 | P1142: 14 | Q1142: =O1142*6+P1142 -> 80 | S1142: MERRINGTON
A1143: BEST PLAYERS
A1144: CAMBERWELL | C1144: BOYALL | F1144: SHARPLES | I1144: BRADFORD | L1144: HORKINGS | O1144: COLLIER | Q1144: BRYCE
A1145: WILLIAMSTOWN | C1145: H McPHERSON | F1145: HARLEY | I1145: WILCOX | L1145: SALVAS | O1145: CHISHOLM | Q1145: CHAPMAN
A1146: GOALKICKERS
A1147: CAMBERWELL | C1147: OLIVER 5 | F1147: BRYCE 3 | I1147: BOND 2 | K1147: BRADFORD | N1147: HERBERT
A1148: WILLIAMSTOWN | C1148: WELLS 3 | F1148: SPRING 2 | I1148: HARRIS 2 | K1148: M McPHERSON 2 | N1148: CHISHOLM | Q1148: SALVAS
A1150: PRELIMINARY FINAL | G1150: 28TH SEPTEMBER | J1150: WEATHER | M1150: NORTH BREEZE DULL
A1151: SANDRINGHAM | C1151: 4 | D1151: 6 | E1151: =C1151*6+D1151 -> 30 | G1151: 8 | H1151: 11 | I1151: =G1151*6+H1151 -> 59 | K1151: 9 | L1151: 12 | M1151: =K1151*6+L1151 -> 66 | O1151: 16 | P1151: 19 | Q1151: =O1151*6+P1151 -> 115 | S1151: JUNCTION OVAL
A1152: WILLIAMSTOWN | C1152: 4 | D1152: 6 | E1152: =C1152*6+D1152 -> 30 | G1152: 7 | H1152: 11 | I1152: =G1152*6+H1152 -> 53 | K1152: 15 | L1152: 16 | M1152: =K1152*6+L1152 -> 106 | O1152: 16 | P1152: 18 | Q1152: =O1152*6+P1152 -> 114 | S1152: MERRINGTON
A1153: BEST PLAYERS
A1154: SANDRINGHAM | C1154: LOWRY | E1154: PARKER | H1154: CERINI | K1154: POLE | M1154: BENCRAFT | P1154: TOYNE
A1155: WILLIAMSTOWN | C1155: SALVAS | E1155: MATTHEWS | H1155: WILCOX | K1155: HARLEY | M1155: SPRING | P1155: WILLIAMS
A1156: GOALKICKERS
A1157: SANDRINGHAM | C1157: PARKER 6 | F1157: LOWRY 5 | I1157: BROKENSHIRE 3 | M1157: BENCRAFT | P1157: GUILLE
A1158: WILLIAMSTOWN | C1158: M McPHERSON 5 | F1158: HARRIS 5 | I1158: SPRING 2 | K1158: PEACOCK 2 | N1158: RONALD | P1158: WELLS
A1160: GRAND FINAL | D1160: 5TH OCTOBER | J1160: WEATHER | L1160: SOUTH WEST BREEZE FINE SUNNY
A1161: SANDRINGHAM | C1161: 2 | D1161: 2 | E1161: 14 | G1161: 9 | H1161: 7 | I1161: 61 | K1161: 11 | L1161: 10 | M1161: 76 | O1161: 14 | P1161: 15 | Q1161: =O1161*6+P1161 -> 99 | S1161: JUNCTION OVAL
A1162: CAMBERWELL | C1162: 6 | D1162: 7 | E1162: 43 | G1162: 6 | H1162: 9 | I1162: 45 | K1162: 11 | L1162: 12 | M1162: 78 | O1162: 13 | P1162: 14 | Q1162: =O1162*6+P1162 -> 92 | S1162: MERRINGTON
A1163: BEST PLAYERS
A1164: SANDRINGHAM | C1164: TOYNE | F1164: ANDERS | I1164: PARKER | L1164: LOWRY | N1164: CERINI | Q1164: BENCRAFT
A1165: CAMBERWELL | C1165: BRADFORD | F1165: HORKINGS | I1165: OLIVER | L1165: NAISMITH | N1165: BOYALL | Q1165: McIVOR
A1166: GOALKICKERS
A1167: SANDRINGHAM | C1167: BROKENSHIRE 4 | G1167: LOWRY 4 | J1167: PARKER 2 | M1167: BENCRAFT 2 | P1167: POLE | R1167: HOLMES
A1168: CAMBERWELL | C1168: BOND 3 | E1168: OLIVER 2 | G1168: HERBERT 2 | J1168: SHIELDS 2 | M1168: COLLIER | O1168: BRADFORD | R1168: BRISTOWE | U1168: BOYALL
A1170: OTHER MATCHES
A1172: LIGHTNING PREMIERSHIP | G1172: 29TH JUNE | K1172: WEATHER | O1172: WET MORNING CLEARED LATER
A1174: 1ST ROUND
K1175: UMPIRE | N1175: BEST | X1175: GOALS
A1176: BRIGHTON | C1176: 1 | D1176: 1 | E1176: 7 | G1176: 4 | H1176: 2 | I1176: 26 | K1176: WRIGHT | N1176: ORGER | Q1176: HUGHES | S1176: NUTTER | V1176: PLUNKETT | X1176: NUTTER 2 | AA1176: HUGHES | AC1176: MILNE
A1177: BRUNSWICK | C1177: 2 | D1177: 0 | E1177: 12 | G1177: 2 | H1177: 1 | I1177: 13 | N1177: DONOGHUE | Q1177: BAGGOTT | S1177: JACOBS | V1177: HENRY | X1177: BAGGOTT | AA1177: NEWSOM
A1179: PORT MELBOURNE | C1179: 1 | D1179: 0 | E1179: 6 | G1179: 3 | H1179: 0 | I1179: 18 | K1179: VINES | N1179: REYNOLDS | Q1179: LAHIFF | S1179: FLETCHER | V1179: CULPH | X1179: FLETCHER | AA1179: MENZIES | AC1179: CULPH
A1180: YARRAVILLE | C1180: 1 | D1180: 0 | E1180: 6 | G1180: 1 | H1180: 1 | I1180: 7 | N1180: GARLICK | Q1180: McDONALD | S1180: WILSON | V1180: GARDNER | X1180: McDONALD
A1182: PRAHRAN | C1182: 1 | D1182: 1 | E1182: 7 | G1182: 2 | H1182: 4 | I1182: 16 | K1182: BARNES | N1182: NEWTON | Q1182: CULLEN | S1182: WHITE | V1182: GRAVELL | X1182: McMAHON | AA1182: WHITE
A1183: PRESTON | C1183: 1 | D1183: 2 | E1183: 8 | G1183: 1 | H1183: 2 | I1183: 8 | N1183: MASLEN | Q1183: GUTHRIE | S1183: COOLEY | V1183: BRADLEY | X1183: COOLEY
A1185: OAKLEIGH | C1185: 1 | D1185: 0 | E1185: 6 | G1185: 2 | H1185: 2 | I1185: 14 | K1185: SIMPSON | N1185: WATSON | Q1185: WILSON | S1185: CRAWSHAW | V1185: E RYAN | X1185: CRAWSHAW | AA1185: STIBBARD
A1186: NORTHCOTE | C1186: 1 | D1186: 1 | E1186: 7 | G1186: 1 | H1186: 2 | I1186: 8 | N1186: BARKER | Q1186: BOWES | S1186: MURPHY | V1186: RUSH | X1186: BOWES
A1188: 2ND ROUND
A1190: OAKLEIGH | C1190: 1 | D1190: 0 | E1190: 6 | G1190: 2 | H1190: 3 | I1190: 15 | K1190: MERRINGTON | N1190: WILSON | Q1190: STIBBARD | S1190: J KELLY | V1190: WEISS | X1190: CRAWSHAW | AA1190: E RYAN
A1191: SANDRINGHAM | C1191: 0 | D1191: 1 | E1191: 1 | G1191: 1 | H1191: 2 | I1191: 8 | N1191: TOYNE | Q1191: ANDERS | S1191: SALES | V1191: HEADEN | X1191: BROKENSHIRE
A1193: PRAHRAN | C1193: 1 | D1193: 0 | E1193: 6 | G1193: 3 | H1193: 1 | I1193: 19 | K1193: BARNES | N1193: NEWTON | Q1193: O'CONNOR | S1193: O'DONNELL | V1193: BLUMFIELD | X1193: O'CONNOR | AA1193: BLUMFIELD | AC1193: O'DONNELL
A1194: COBURG | C1194: 0 | D1194: 1 | E1194: 1 | G1194: 1 | H1194: 1 | I1194: 7 | N1194: WALSH | Q1194: MARDEN | S1194: HOLLAND | V1194: GATH | X1194: BANNISTER
A1196: WILLIAMSTOWN | C1196: 2 | D1196: 2 | E1196: 14 | G1196: 2 | H1196: 4 | I1196: 16 | K1196: SIMPSON | N1196: HARRIS | Q1196: HARLEY | S1196: ARCHIBALD | V1196: WILCOX | X1196: HARRIS 2
A1197: PORT MELBOURNE | C1197: 1 | D1197: 0 | E1197: 6 | G1197: 2 | H1197: 2 | I1197: 14 | N1197: DOBSON | Q1197: CULPH | S1197: TREMBATH | V1197: REYNOLDS | X1197: FISHER | AA1197: CULPH
X1198: RICHARDSON | AA1198: BURNS | AC1198: O'BRIEN
A1199: BRIGHTON | C1199: 3 | D1199: 2 | E1199: 20 | G1199: 7 | H1199: 4 | I1199: 46 | K1199: VINES | N1199: HUGHES | Q1199: MILNE | S1199: NUTTER | V1199: SCOTT | X1199: MILNE 2 | AA1199: NUTTER | AC1199: SCOTT
A1200: CAMBERWELL | C1200: 1 | D1200: 0 | E1200: 6 | G1200: 1 | H1200: 1 | I1200: 7 | N1200: BOYALL | Q1200: HERBERT | S1200: ANDERSON | V1200: SHIELDS | X1200: ANDERSON
A1202: SEMI FINALS
A1204: WILLIAMSTOWN | C1204: 0 | D1204: 3 | E1204: 3 | G1204: 3 | H1204: 8 | I1204: 26 | K1204: WRIGHT | N1204: HARRIS | Q1204: MATTHEWS | S1204: SALVAS | V1204: TAYLOR | X1204: HARRIS | AA1204: TAYLOR | AC1204: SHARP
A1205: OAKLEIGH | C1205: 1 | D1205: 1 | E1205: 7 | G1205: 1 | H1205: 1 | I1205: 7 | N1205: J KELLY | Q1205: E RYAN | S1205: STIBBARD | V1205: WILSON | X1205: E RYAN
A1207: PRAHRAN | C1207: 2 | D1207: 0 | E1207: 12 | G1207: 4 | H1207: 2 | I1207: 26 | K1207: MERRINGTON | N1207: NEWTON | Q1207: GRAVELL | S1207: ARNOTT | V1207: O'DONNELL | X1207: ARNOTT 2 | AA1207: BLUMFIELD | AC1207: WALSH
A1208: BRIGHTON | C1208: 2 | D1208: 1 | E1208: 13 | G1208: 3 | H1208: 2 | I1208: 20 | N1208: RICHARDSON | Q1208: HUGHES | S1208: NUTTER | V1208: DOUGLAS | X1208: DOUGLAS 2 | AA1208: NUTTER
A1211: FINAL
X1212: HARRIS
A1213: WILLIAMSTOWN | C1213: 2 | D1213: 2 | E1213: 14 | G1213: 4 | H1213: 3 | I1213: 27 | K1213: WRIGHT | N1213: WELLS | Q1213: JAMIESON | S1213: HARRIS | V1213: SPRING | X1213: JAMIESON | AA1213: SPRING | AC1213: PEACOCK
A1214: PRAHRAN | C1214: 1 | D1214: 1 | E1214: 7 | G1214: 1 | H1214: 2 | I1214: 8 | N1214: BLUMFIELD | Q1214: NEWTON | S1214: GRAVELL | V1214: SPENCE | X1214: BLUMFIELD
A1216: 10TH AUGUST
A1218: PORT MELBOURNE | C1218: 14 | D1218: 10 | E1218: 94 | H1218: PRESTON | K1218: 14 | L1218: 27 | M1218: 111
A1219: DAYLESFORD | C1219: 7 | D1219: 16 | E1219: 58 | H1219: BENDIGO | K1219: 7 | L1219: 7 | M1219: 49