A1: Victorian Football Association
A2: Season 1947
A3: © Copyright Wal Williams | F3: First created: 2 November 2014
A4: Contact: joywalwi at gmail dot com | F4: Last updated: 27 January 2018 | W4: VFA Results and tables - Link to the main index page
A5: You are free to copy this document in whole or part provided that proper acknowledgement is given to the author. All rights reserved.
A7: YEAR 1947
A8: ROUND 1 | D8: 12TH APRIL | H8: WEATHER | K8: SOUTH WEST WIND DRIZZLING RAIN | S8: PLAYED AT
D9: 1ST QTR | H9: 2ND QTR | L9: 3RD QTR | P9: FINAL | S9: BRUNSWICK
A10: COBURG | C10: 3 | D10: 2 | E10: =C10*6+D10 -> 20 | G10: 4 | H10: 4 | I10: =G10*6+H10 -> 28 | K10: 7 | L10: 10 | M10: =K10*6+L10 -> 52 | O10: 9 | P10: 14 | Q10: =O10*6+P10 -> 68 | S10: UMPIRE | X10: LADDER | AB10: ROUND | AD10: 1
A11: BRUNSWICK | C11: 0 | D11: 3 | E11: =C11*6+D11 -> 3 | G11: 2 | H11: 7 | I11: =G11*6+H11 -> 19 | K11: 6 | L11: 11 | M11: =K11*6+L11 -> 47 | O11: 8 | P11: 16 | Q11: =O11*6+P11 -> 64 | S11: BARNES
A12: BEST PLAYERS | W12: TEAM | X12: W | Y12: L | Z12: D | AA12: FOR | AB12: AGST | AC12: % | AD12: PTS
A13: COBURG | C13: WILSON | F13: CREWTHER | I13: PLUMMER | L13: BOASE | N13: SMITH | Q13: WALSH
A14: BRUNSWICK | C14: SILK | F14: SPENCER | I14: SUTTON | L14: WELDON | N14: UPTON | Q14: CROUCH | W14: CAMBERWELL | X14: 1 | Y14: 0 | Z14: 0 | AA14: 135 | AB14: 85 | AC14: 158.8235294117647 | AD14: 4
A15: GOALKICKERS | W15: WILLIAMSTOWN | X15: 1 | Y15: 0 | Z15: 0 | AA15: 128 | AB15: 81 | AC15: 158.02469135802468 | AD15: 4
A16: COBURG | C16: CREWTHER 3 | F16: HARTRIDGE 3 | I16: QUINN 2 | K16: MILTE | W16: PORT MELBOURNE | X16: 1 | Y16: 0 | Z16: 0 | AA16: 110 | AB16: 80 | AC16: 137.5 | AD16: 4
A17: BRUNSWICK | C17: SMITH 3 | F17: GEMMELL 2 | I17: UPTON | K17: PRIESTLEY | M17: WELDON | W17: BRIGHTON | X17: 1 | Y17: 0 | Z17: 0 | AA17: 145 | AB17: 123 | AC17: 117.88617886178862 | AD17: 4
A19: BRIGHTON | C19: 11 | D19: 6 | E19: =C19*6+D19 -> 72 | G19: 15 | H19: 7 | I19: =G19*6+H19 -> 97 | K19: 20 | L19: 13 | M19: =K19*6+L19 -> 133 | O19: 22 | P19: 13 | Q19: =O19*6+P19 -> 145 | S19: ELSTENWICK PARK | W19: NORTHCOTE | X19: 1 | Y19: 0 | Z19: 0 | AA19: 54 | AB19: 50 | AC19: 108 | AD19: 4
A20: SANDRINGHAM | C20: 1 | D20: 3 | E20: =C20*6+D20 -> 9 | G20: 8 | H20: 9 | I20: =G20*6+H20 -> 57 | K20: 9 | L20: 11 | M20: =K20*6+L20 -> 65 | O20: 18 | P20: 15 | Q20: =O20*6+P20 -> 123 | S20: VINES | W20: COBURG | X20: 1 | Y20: 0 | Z20: 0 | AA20: 68 | AB20: 64 | AC20: 106.25 | AD20: 4
A21: BEST PLAYERS | W21: BRUNSWICK | X21: 0 | Y21: 1 | Z21: 0 | AA21: 64 | AB21: 68 | AC21: 94.117647058823536 | AD21: 0
A22: BRIGHTON | C22: RICHARDSON | F22: WARBURTON | I22: McINDOE | L22: KENNETT | N22: DOUGLAS | Q22: MAGUIRE | W22: PRESTON | X22: 0 | Y22: 1 | Z22: 0 | AA22: 50 | AB22: 54 | AC22: 92.592592592592595 | AD22: 0
A23: SANDRINGHAM | C23: TOYNE | F23: TOMLINS | I23: PARKER | L23: GRAMBEAU | N23: BROKENSHIRE | Q23: COLLINS | W23: SANDRINGHAM | X23: 0 | Y23: 1 | Z23: 0 | AA23: 123 | AB23: 145 | AC23: 84.827586206896555 | AD23: 0
A24: GOALKICKERS | W24: PRAHRAN | X24: 0 | Y24: 1 | Z24: 0 | AA24: 80 | AB24: 110 | AC24: 72.727272727272734 | AD24: 0
A25: BRIGHTON | C25: WARBURTON 6 | F25: DOUGLAS 4 | I25: RICHARDSON 3 | L25: McINDOE 3 | N25: HEIMS 3 | P25: GREEN 2 | R25: TAPLIN | W25: YARRAVILLE | X25: 0 | Y25: 1 | Z25: 0 | AA25: 81 | AB25: 128 | AC25: 63.28125 | AD25: 0
A26: SANDRINGHAM | C26: BROKENSHIRE 8 | F26: HOLMES 3 | I26: PARKER 3 | L26: LOWRY 2 | N26: EVANS | P26: COLLINS | W26: OAKLEIGH | X26: 0 | Y26: 1 | Z26: 0 | AA26: 85 | AB26: 135 | AC26: 62.962962962962962 | AD26: 0
A28: NORTHCOTE | C28: 1 | D28: 4 | E28: =C28*6+D28 -> 10 | G28: 5 | H28: 7 | I28: =G28*6+H28 -> 37 | K28: 7 | L28: 8 | M28: =K28*6+L28 -> 50 | O28: 7 | P28: 12 | Q28: =O28*6+P28 -> 54 | S28: PRESTON
A29: PRESTON | C29: 1 | D29: 5 | E29: =C29*6+D29 -> 11 | G29: 1 | H29: 7 | I29: =G29*6+H29 -> 13 | K29: 4 | L29: 10 | M29: =K29*6+L29 -> 34 | O29: 6 | P29: 14 | Q29: =O29*6+P29 -> 50 | S29: THOMAS
A30: BEST PLAYERS
A31: NORTHCOTE | C31: HISCOX | F31: ATKINSON | I31: WHITE | L31: ARMOUR | N31: MURPHY | Q31: STAFFORD
A32: PRESTON | C32: BLACKMORE | F32: PASCOE | I32: S STEWART | L32: EVANS | N32: CONROY | Q32: FITT
A33: GOALKICKERS
A34: NORTHCOTE | C34: McINTOSH 2 | G34: STAFFORD 2 | J34: MURPHY | M34: WHITE | O34: DICKSON
A35: PRESTON | C35: PRITCHARD 2 | G35: CONNELLY | J35: BRYCE | M35: OLVER | O35: BLACKMAN
A37: WILLIAMSTOWN | C37: 3 | D37: 0 | E37: =C37*6+D37 -> 18 | G37: 6 | H37: 8 | I37: =G37*6+H37 -> 44 | K37: 10 | L37: 19 | M37: =K37*6+L37 -> 79 | O37: 17 | P37: 26 | Q37: =O37*6+P37 -> 128 | S37: YARRAVILLE
A38: YARRAVILLE | C38: 6 | D38: 4 | E38: =C38*6+D38 -> 40 | G38: 6 | H38: 5 | I38: =G38*6+H38 -> 41 | K38: 9 | L38: 6 | M38: =K38*6+L38 -> 60 | O38: 12 | P38: 9 | Q38: =O38*6+P38 -> 81 | S38: MOORE
A39: BEST PLAYERS
A40: WILLIAMSTOWN | C40: SALVAS | F40: WILCOX | I40: TODD | L40: M McPHERSON | O40: HARLEY | R40: McRAE
A41: YARRAVILLE | C41: HARDIMAN | F41: RUDDELL | I41: McLEOD | L41: McASEY | O41: McDONALD | R41: VINCENT
A42: GOALKICKERS
A43: WILLIAMSTOWN | C43: TODD 5 | F43: HARRIS 4 | I43: DOWLING 3 | L43: M McPHERSON 3 | P43: McRAE | R43: CHAPMAN
A44: YARRAVILLE | C44: HARDIMAN 3 | F44: McASEY 3 | I44: SCARFFE 2 | L44: VINCENT 2 | N44: McDONALD | Q44: RUDDELL
A46: CAMBERWELL | C46: 6 | D46: 4 | E46: =C46*6+D46 -> 40 | G46: 12 | H46: 6 | I46: =G46*6+H46 -> 78 | K46: 18 | L46: 10 | M46: =K46*6+L46 -> 118 | O46: 20 | P46: 15 | Q46: =O46*6+P46 -> 135 | S46: CAMBERWELL
A47: OAKLEIGH | C47: 2 | D47: 4 | E47: =C47*6+D47 -> 16 | G47: 6 | H47: 11 | I47: =G47*6+H47 -> 47 | K47: 6 | L47: 15 | M47: =K47*6+L47 -> 51 | O47: 11 | P47: 19 | Q47: =O47*6+P47 -> 85 | S47: MERRINGTON
A48: BEST PLAYERS
A49: CAMBERWELL | C49: BOHAN | F49: OLIVER | I49: CAMPBELL | L49: BRADFORD | O49: SHARPLES | R49: BOYALL
A50: OAKLEIGH | C50: RUNDELL | F50: E RYAN | I50: MATTHEWS | L50: SANDAY | O50: JORY | R50: BEARD
A51: GOALKICKERS
A52: CAMBERWELL | C52: OLIVER 5 | F52: BRADFORD 5 | I52: CAMPBELL 4 | L52: HERBERT 2 | O52: BOHAN 2 | Q52: McDONALD | T52: BOYALL
A53: OAKLEIGH | C53: RUNDELL 4 | F53: JORY 3 | I53: E RYAN 2 | L53: D WATSON | O53: PERKINS
A55: PORT MELBOURNE | C55: 3 | D55: 5 | E55: =C55*6+D55 -> 23 | G55: 8 | H55: 9 | I55: =G55*6+H55 -> 57 | K55: 12 | L55: 12 | M55: =K55*6+L55 -> 84 | O55: 16 | P55: 14 | Q55: =O55*6+P55 -> 110 | S55: PORT MELBOURNE
A56: PRAHRAN | C56: 4 | D56: 4 | E56: =C56*6+D56 -> 28 | G56: 8 | H56: 7 | I56: =G56*6+H56 -> 55 | K56: 10 | L56: 12 | M56: =K56*6+L56 -> 72 | O56: 11 | P56: 14 | Q56: =O56*6+P56 -> 80 | S56: WRIGHT
A57: BEST PLAYERS
A58: PORT MELBOURNE | C58: BAKER | F58: HOUSTON | I58: STEEL | L58: REYNOLDS | O58: SEARLE | R58: MENZIES
A59: PRAHRAN | C59: ADAMS | F59: McMAHON | I59: NEWTON | L59: CAMM | O59: O'CONNOR | R59: WALSH
A60: GOALKICKERS
A61: PORT MELBOURNE | C61: HOUSTON 4 | F61: FINDLAY 4 | I61: MENZIES 3 | L61: CULPH | N61: REYNOLDS | Q61: GILBERT | S61: LUGG | U61: HOULIHAN
A62: PRAHRAN | C62: STACKPOLE 3 | F62: KIDD 3 | I62: WALSH 2 | L62: SPRIGGS | N62: O'CONNOR | Q62: BURGESS
A64: ROUND 2 | D64: 19TH APRIL | J64: WEATHER | M64: NORTH BREEZE WARM CLOUDY | S64: PLAYED AT
D65: 1ST QTR | H65: 2ND QTR | L65: 3RD QTR | P65: FINAL | S65: WILLIAMSTOWN
A66: WILLIAMSTOWN | C66: 5 | D66: 0 | E66: =C66*6+D66 -> 30 | G66: 8 | H66: 2 | I66: =G66*6+H66 -> 50 | K66: 14 | L66: 6 | M66: =K66*6+L66 -> 90 | O66: 17 | P66: 7 | Q66: =O66*6+P66 -> 109 | S66: UMPIRE | X66: LADDER | AB66: ROUND | AD66: 2
A67: CAMBERWELL | C67: 3 | D67: 2 | E67: =C67*6+D67 -> 20 | G67: 9 | H67: 7 | I67: =G67*6+H67 -> 61 | K67: 11 | L67: 10 | M67: =K67*6+L67 -> 76 | O67: 13 | P67: 20 | Q67: =O67*6+P67 -> 98 | S67: BARNES
A68: BEST PLAYERS | W68: TEAM | X68: W | Y68: L | Z68: D | AA68: FOR | AB68: AGST | AC68: % | AD68: PTS
A69: WILLIAMSTOWN | C69: FEATHERBY | F69: DOWLING | I69: HARLEY | L69: HARRIS | O69: WILLIAMS | Q69: TODD
A70: CAMBERWELL | C70: NAISMITH | F70: OLIVER | I70: ROCHFORD | L70: McDONALD | O70: HERBERT | Q70: STYLES | W70: PORT MELBOURNE | X70: 2 | Y70: 0 | Z70: 0 | AA70: 226 | AB70: 154 | AC70: 146.75324675324674 | AD70: 8
A71: GOALKICKERS | W71: WILLIAMSTOWN | X71: 2 | Y71: 0 | Z71: 0 | AA71: 237 | AB71: 179 | AC71: 132.4022346368715 | AD71: 8
A72: WILLIAMSTOWN | C72: TODD 5 | E72: DOWLING 4 | H72: M McPHERSON 3 | L72: HARRIS 2 | N72: WILLIAMS | Q72: McRAE | S72: STEWART | W72: COBURG | X72: 2 | Y72: 0 | Z72: 0 | AA72: 228 | AB72: 175 | AC72: 130.28571428571428 | AD72: 8
A73: CAMBERWELL | C73: OLIVER 5 | F73: CAMPBELL 2 | I73: McDONALD 2 | L73: HERBERT 2 | N73: BRYCE | P73: BOYALL | W73: CAMBERWELL | X73: 1 | Y73: 1 | Z73: 0 | AA73: 233 | AB73: 194 | AC73: 120.10309278350516 | AD73: 4
A75: PORT MELBOURNE | C75: 3 | D75: 5 | E75: =C75*6+D75 -> 23 | G75: 8 | H75: 10 | I75: =G75*6+H75 -> 58 | K75: 9 | L75: 15 | M75: =K75*6+L75 -> 69 | O75: 16 | P75: 20 | Q75: =O75*6+P75 -> 116 | S75: NORTHCOTE | W75: BRUNSWICK | X75: 1 | Y75: 1 | Z75: 0 | AA75: 184 | AB75: 166 | AC75: 110.8433734939759 | AD75: 4
A76: NORTHCOTE | C76: 3 | D76: 2 | E76: =C76*6+D76 -> 20 | G76: 4 | H76: 2 | I76: =G76*6+H76 -> 26 | K76: 7 | L76: 10 | M76: =K76*6+L76 -> 52 | O76: 10 | P76: 14 | Q76: =O76*6+P76 -> 74 | S76: MERRINGTON | W76: OAKLEIGH | X76: 1 | Y76: 1 | Z76: 0 | AA76: 219 | AB76: 208 | AC76: 105.28846153846153 | AD76: 4
A77: BEST PLAYERS | W77: SANDRINGHAM | X77: 1 | Y77: 1 | Z77: 0 | AA77: 268 | AB77: 258 | AC77: 103.87596899224806 | AD77: 4
A78: PORT MELBOURNE | C78: CULPH | E78: MENZIES | H78: GILBERT | K78: LEWIS | M78: HOUSTON | P78: HOULIHAN | W78: BRIGHTON | X78: 1 | Y78: 1 | Z78: 0 | AA78: 256 | AB78: 283 | AC78: 90.459363957597176 | AD78: 4
A79: NORTHCOTE | C79: HISCOX | E79: McINTOSH | H79: ATKINSON | K79: WHITE | M79: BARRETT | P79: KINDER | W79: NORTHCOTE | X79: 1 | Y79: 1 | Z79: 0 | AA79: 128 | AB79: 166 | AC79: 77.108433734939766 | AD79: 4
A80: GOALKICKERS | W80: PRAHRAN | X80: 0 | Y80: 2 | Z80: 0 | AA80: 178 | AB80: 230 | AC80: 77.391304347826093 | AD80: 0
A81: PORT MELBOURNE | C81: FINDLAY 5 | F81: CULPH 4 | I81: HOUSTON 4 | L81: REYNOLDS | N81: MENZIES | P81: LEWIS | W81: YARRAVILLE | X81: 0 | Y81: 2 | Z81: 0 | AA81: 194 | AB81: 273 | AC81: 71.062271062271066 | AD81: 0
A82: NORTHCOTE | C82: McINTOSH 2 | F82: MALONE 2 | I82: KINDER 2 | K82: WHITE | M82: BALDWIN | O82: DUNACAN | Q82: CASPAR | W82: PRESTON | X82: 0 | Y82: 2 | Z82: 0 | AA82: 123 | AB82: 188 | AC82: 65.425531914893611 | AD82: 0
A84: COBURG | C84: 1 | D84: 1 | E84: =C84*6+D84 -> 7 | G84: 10 | H84: 5 | I84: =G84*6+H84 -> 65 | K84: 14 | L84: 7 | M84: =K84*6+L84 -> 91 | O84: 25 | P84: 10 | Q84: =O84*6+P84 -> 160 | S84: COBURG
A85: BRIGHTON | C85: 5 | D85: 7 | E85: =C85*6+D85 -> 37 | G85: 7 | H85: 9 | I85: =G85*6+H85 -> 51 | K85: 10 | L85: 13 | M85: =K85*6+L85 -> 73 | O85: 16 | P85: 15 | Q85: =O85*6+P85 -> 111 | S85: SMITHWICK
A86: BEST PLAYERS
A87: COBURG | C87: SMITH | F87: CONDON | I87: QUINN | L87: WILSON | O87: CREWTHER | R87: McILVEEN
A88: BRIGHTON | C88: DOUGLAS | F88: ADAMSON | I88: McINDOE | L88: PLUNKETT | O88: ROSE | R88: TURNER
A89: GOALKICKERS
A90: COBURG | C90: CONDON 7 | F90: CREWTHER 7 | I90: ROGAN 2 | K90: QUINN 2 | M90: MILTE 2 | O90: McILVEEN | Q90: STARBUCK | T90: HEALY | V90: WALSH | X90: SILLITOE
A91: BRIGHTON | C91: DOUGLAS 7 | F91: ADAMSON 4 | I91: WARBURTON 3 | L91: HEIMS | N91: MAGUIRE
A93: BRUNSWICK | C93: 4 | D93: 7 | E93: =C93*6+D93 -> 31 | G93: 9 | H93: 11 | I93: =G93*6+H93 -> 65 | K93: 11 | L93: 14 | M93: =K93*6+L93 -> 80 | O93: 17 | P93: 18 | Q93: =O93*6+P93 -> 120 | S93: TOORAK PARK
A94: PRAHRAN | C94: 5 | D94: 2 | E94: =C94*6+D94 -> 32 | G94: 9 | H94: 5 | I94: =G94*6+H94 -> 59 | K94: 10 | L94: 12 | M94: =K94*6+L94 -> 72 | O94: 14 | P94: 14 | Q94: =O94*6+P94 -> 98 | S94: SIMPSON
A95: BEST PLAYERS
A96: BRUNSWICK | C96: N SMITH | F96: GEMMELL | I96: SILK | L96: KENT | O96: SPENCER | R96: PRIESTLEY
A97: PRAHRAN | C97: SPRIGGS | F97: FERGEUS | I97: GARVIN | L97: BURGESS | O97: McMAHON | R97: HOGAN
A98: GOALKICKERS
A99: BRUNSWICK | C99: GEMMELL 5 | F99: UPTON 4 | I99: SMITH 2 | K99: CROUCH 2 | N99: PRIESTLEY | Q99: BAGGOTT | S99: GLASSCOTT | V99: KEMP
A100: PRAHRAN | C100: BURGESS 6 | F100: FERGEUS 2 | I100: O'DONNELL | K100: WALSH | M100: WEBER | O100: COOK | Q100: MONOHAN | T100: HALLINAN
A102: SANDRINGHAM | C102: 5 | D102: 7 | E102: =C102*6+D102 -> 37 | G102: 12 | H102: 12 | I102: =G102*6+H102 -> 84 | K102: 16 | L102: 18 | M102: =K102*6+L102 -> 114 | O102: 21 | P102: 19 | Q102: =O102*6+P102 -> 145 | S102: BEACH ROAD
A103: YARRAVILLE | C103: 5 | D103: 2 | E103: =C103*6+D103 -> 32 | G103: 7 | H103: 9 | I103: =G103*6+H103 -> 51 | K103: 12 | L103: 14 | M103: =K103*6+L103 -> 86 | O103: 16 | P103: 17 | Q103: =O103*6+P103 -> 113 | S103: WRIGHT
A104: BEST PLAYERS
A105: SANDRINGHAM | C105: TOYNE | F105: TOMLINS | I105: O'TOOLE | L105: BENCRAFT | O105: IRVINE | R105: PARKER
A106: YARRAVILLE | C106: McLEOD | F106: GARRICK | I106: McDONALD | L106: MITCHELL | O106: MAZEY | R106: BELL
A107: GOALKICKERS
A108: SANDRINGHAM | C108: PARKER 7 | F108: BENCRAFT 6 | I108: BROKENSHIRE 2 | M108: EVANS 2 | O108: SIMS | Q108: HARPER | S108: HOLMES | U108: COLLINS
A109: YARRAVILLE | C109: PHILLIPS 4 | F109: VINCENT 4 | I109: BELL 3 | K109: THOMAS 2 | N109: RUDDELL | P109: McDONALD | S109: SPENCE
A111: OAKLEIGH | C111: 3 | D111: 2 | E111: =C111*6+D111 -> 20 | G111: 8 | H111: 6 | I111: =G111*6+H111 -> 54 | K111: 13 | L111: 16 | M111: =K111*6+L111 -> 94 | O111: 19 | P111: 20 | Q111: =O111*6+P111 -> 134 | S111: OAKLEIGH
A112: PRESTON | C112: 4 | D112: 1 | E112: =C112*6+D112 -> 25 | G112: 5 | H112: 2 | I112: =G112*6+H112 -> 32 | K112: 8 | L112: 5 | M112: =K112*6+L112 -> 53 | O112: 11 | P112: 7 | Q112: =O112*6+P112 -> 73 | S112: VINES
A113: BEST PLAYERS
A114: OAKLEIGH | C114: MERRIMAN | F114: E RYAN | I114: KELLY | L114: JORY | O114: MATTHEWS | R114: GRAY
A115: PRESTON | C115: BLACKMAN | F115: DUNSTAN | I115: MASLEN | L115: OLVER | O115: S STEWART | R115: PASCOE
A116: GOALKICKERS
A117: OAKLEIGH | C117: CRAWSHAW 4 | F117: MERRIMAN 4 | I117: E RYAN 4 | K117: KELLY 2 | M117: RUNDELL 2 | P117: BAXTER 2 | S117: JORY
A118: PRESTON | C118: PRITCHARD 5 | F118: OLVER 2 | I118: MASLEN | K118: BRYCE | M118: HARRISON | P118: DUNSTAN
A120: ROUND 3 | D120: 26TH APRIL | J120: WEATHER | M120: SOUTH WIND GROUNDS SLIPPERY | S120: PLAYED AT
D121: 1ST QTR | H121: 2ND QTR | L121: 3RD QTR | P121: FINAL | S121: COBURG
A122: COBURG | C122: 7 | D122: 5 | E122: =C122*6+D122 -> 47 | G122: 8 | H122: 8 | I122: =G122*6+H122 -> 56 | K122: 13 | L122: 18 | M122: =K122*6+L122 -> 96 | O122: 16 | P122: 20 | Q122: =O122*6+P122 -> 116 | S122: UMPIRE | X122: LADDER | AB122: ROUND | AD122: 3
A123: CAMBERWELL | C123: 3 | D123: 2 | E123: =C123*6+D123 -> 20 | G123: 7 | H123: 8 | I123: =G123*6+H123 -> 50 | K123: 8 | L123: 11 | M123: =K123*6+L123 -> 59 | O123: 11 | P123: 15 | Q123: =O123*6+P123 -> 81 | S123: MERRINGTON
A124: BEST PLAYERS | W124: TEAM | X124: W | Y124: L | Z124: D | AA124: FOR | AB124: AGST | AC124: % | AD124: PTS
A125: COBURG | C125: WILSON | F125: CREWTHER | I125: SMITH | K125: KENNEDY | N125: MILTE | Q125: QUINN
A126: CAMBERWELL | C126: TAYLOR | F126: SHARPLES | I126: BRADFORD | K126: OLIVER | N126: SEELENMEYER | Q126: McDONALD | W126: WILLIAMSTOWN | X126: 3 | Y126: 0 | Z126: 0 | AA126: 374 | AB126: 240 | AC126: 155.83333333333334 | AD126: 12
A127: GOALKICKERS | W127: COBURG | X127: 3 | Y127: 0 | Z127: 0 | AA127: 344 | AB127: 256 | AC127: 134.375 | AD127: 12
A128: COBURG | C128: CREWTHER 7 | F128: ROGAN 4 | I128: QUINN 2 | L128: MILTE | N128: O'KEEFE | P128: STARBUCK | W128: SANDRINGHAM | X128: 2 | Y128: 1 | Z128: 0 | AA128: 387 | AB128: 353 | AC128: 109.63172804532577 | AD128: 8
A129: CAMBERWELL | C129: CAMPBELL 4 | F129: OLIVER 4 | I129: HERBERT 2 | L129: BOHAN | W129: BRUNSWICK | X129: 2 | Y129: 1 | Z129: 0 | AA129: 307 | AB129: 286 | AC129: 107.34265734265735 | AD129: 8
A131: BRUNSWICK | C131: 3 | D131: 3 | E131: =C131*6+D131 -> 21 | G131: 9 | H131: 5 | I131: =G131*6+H131 -> 59 | K131: 14 | L131: 9 | M131: =K131*6+L131 -> 93 | O131: 19 | P131: 9 | Q131: =O131*6+P131 -> 123 | S131: OAKLEIGH | W131: PORT MELBOURNE | X131: 2 | Y131: 1 | Z131: 0 | AA131: 351 | AB131: 329 | AC131: 106.68693009118542 | AD131: 8
A132: OAKLEIGH | C132: 6 | D132: 6 | E132: =C132*6+D132 -> 42 | G132: 11 | H132: 9 | I132: =G132*6+H132 -> 75 | K132: 16 | L132: 10 | M132: =K132*6+L132 -> 106 | O132: 17 | P132: 18 | Q132: =O132*6+P132 -> 120 | S132: MOORE | W132: BRIGHTON | X132: 2 | Y132: 1 | Z132: 0 | AA132: 431 | AB132: 408 | AC132: 105.63725490196079 | AD132: 8
A133: BEST PLAYERS | W133: OAKLEIGH | X133: 1 | Y133: 2 | Z133: 0 | AA133: 339 | AB133: 331 | AC133: 102.41691842900302 | AD133: 4
A134: BRUNSWICK | C134: BAGGOTT | F134: SPENCER | I134: CROUCH | K134: UPTON | N134: SILK | Q134: SPENCER | W134: CAMBERWELL | X134: 1 | Y134: 2 | Z134: 0 | AA134: 314 | AB134: 310 | AC134: 101.29032258064517 | AD134: 4
A135: OAKLEIGH | C135: JORY | F135: E RYAN | I135: WILSON | K135: MERRIMAN | N135: BEARD | Q135: MATTHEWS | W135: PRAHRAN | X135: 1 | Y135: 2 | Z135: 0 | AA135: 319 | AB135: 330 | AC135: 96.666666666666671 | AD135: 4
A136: GOALKICKERS | Q136: BAGGOTT | W136: NORTHCOTE | X136: 1 | Y136: 2 | Z136: 0 | AA136: 189 | AB136: 303 | AC136: 62.376237623762378 | AD136: 4
A137: BRUNSWICK | C137: CROUCH 5 | E137: SMITH 4 | G137: UPTON 2 | I137: MATHERS 2 | L137: PRIESTLEY 2 | O137: GEMMELL | Q137: HUNTLY | S137: KEMP | W137: YARRAVILLE | X137: 0 | Y137: 3 | Z137: 0 | AA137: 294 | AB137: 414 | AC137: 71.014492753623188 | AD137: 0
A138: OAKLEIGH | C138: MERRIMAN 4 | F138: JORY 4 | H138: CRAWSHAW 3 | K138: RUNDELL 3 | N138: E RYAN 2 | Q138: SANDAY | W138: PRESTON | X138: 0 | Y138: 3 | Z138: 0 | AA138: 218 | AB138: 307 | AC138: 71.009771986970691 | AD138: 0
A140: BRIGHTON | C140: 2 | D140: 6 | E140: =C140*6+D140 -> 18 | G140: 9 | H140: 12 | I140: =G140*6+H140 -> 66 | K140: 16 | L140: 18 | M140: =K140*6+L140 -> 114 | O140: 25 | P140: 25 | Q140: =O140*6+P140 -> 175 | S140: ELSTERNWICK PARK
A141: PORT MELBOURNE | C141: 7 | D141: 4 | E141: =C141*6+D141 -> 46 | G141: 10 | H141: 6 | I141: =G141*6+H141 -> 66 | K141: 15 | L141: 9 | M141: =K141*6+L141 -> 99 | O141: 19 | P141: 11 | Q141: =O141*6+P141 -> 125 | S141: WRIGHT
A142: BEST PLAYERS
A143: BRIGHTON | C143: TURNER | F143: BAILEY | I143: PINDER | L143: DOUGLAS | O143: McINDOE | R143: WARBURTON
A144: PORT MELBOURNE | C144: BUTCHER | F144: FINDLAY | I144: HOUSTON | L144: MENZIES | O144: MANN | R144: KEATING
A145: GOALKICKERS
A146: BRIGHTON | C146: WARBURTON 9 | F146: RICHARDSON 5 | I146: DOUGLAS 4 | L146: McINDOE 2 | N146: PLUNKETT 2 | Q146: ADAMSON 2 | T146: WILLIAMSON
A147: PORT MELBOURNE | C147: HOUSTON 6 | F147: FINDLAY 4 | I147: CULPH 4 | K147: MENZIES 2 | N147: LEWIS | P147: KEATING | R147: REYNOLDS
A149: PRAHRAN | C149: 6 | D149: 5 | E149: =C149*6+D149 -> 41 | G149: 12 | H149: 6 | I149: =G149*6+H149 -> 78 | K149: 17 | L149: 11 | M149: =K149*6+L149 -> 113 | O149: 21 | P149: 15 | Q149: =O149*6+P149 -> 141 | S149: TOORAK PARK
A150: YARRAVILLE | C150: 3 | D150: 3 | E150: =C150*6+D150 -> 21 | G150: 8 | H150: 7 | I150: =G150*6+H150 -> 55 | K150: 12 | L150: 10 | M150: =K150*6+L150 -> 82 | O150: 14 | P150: 16 | Q150: =O150*6+P150 -> 100 | S150: BARNES
A151: BEST PLAYERS
A152: PRAHRAN | C152: BURGESS | F152: NEWTON | I152: O'DONNELL | L152: ADAMS | O152: FERGEUS | R152: HOGAN
A153: YARRAVILLE | C153: PHILLIPS | F153: YATES | I153: RUDDELL | L153: McLEOD | O153: GARRICK | R153: McASEY
A154: GOALKICKERS
A155: PRAHRAN | C155: BURGESS 6 | F155: O'DONNELL 3 | I155: McMAHON 2 | L155: FERGEUS 2 | N155: KYNE 2 | P155: WALSH | R155: GRAVELL | U155: MOLONEY | X155: MONOHAN | AA155: D'OLIVER
A156: YARRAVILLE | C156: PHILLIPS 8 | F156: THOMAS 2 | I156: HARDIMAN | L156: GARRICK | N156: MOLONEY | P156: VINCENT
A158: SANDRINGHAM | C158: 6 | D158: 3 | E158: =C158*6+D158 -> 39 | G158: 9 | H158: 5 | I158: =G158*6+H158 -> 59 | K158: 14 | L158: 5 | M158: =K158*6+L158 -> 89 | O158: 19 | P158: 5 | Q158: =O158*6+P158 -> 119 | S158: PRESTON
A159: PRESTON | C159: 1 | D159: 3 | E159: =C159*6+D159 -> 9 | G159: 7 | H159: 11 | I159: =G159*6+H159 -> 53 | K159: 10 | L159: 13 | M159: =K159*6+L159 -> 73 | O159: 13 | P159: 17 | Q159: =O159*6+P159 -> 95 | S159: SIMPSON
A160: BEST PLAYERS
A161: SANDRINGHAM | C161: PARKER | F161: TOYNE | I161: SALES | L161: COLLINS | O161: GRAMBEAU | R161: HARPER
A162: PRESTON | C162: LEISHMAN | F162: S STEWART | I162: PASCOE | L162: CONROY | O162: EVANS | R162: PRITCHARD
A163: GOALKICKERS
A164: SANDRINGHAM | C164: HARPER 5 | F164: PARKER 4 | I164: BROKENSHIRE 4 | M164: COLLINS 3 | P164: SIMS 2
A165: PRESTON | C165: PRITCHARD 5 | F165: MASLEN 3 | I165: CONROY 2 | K165: HARRISON | M165: PASCOE | O165: OLVER
A167: WILLIAMSTOWN | C167: 4 | D167: 2 | E167: =C167*6+D167 -> 26 | G167: 7 | H167: 4 | I167: =G167*6+H167 -> 46 | K167: 13 | L167: 7 | M167: =K167*6+L167 -> 85 | O167: 21 | P167: 11 | Q167: =O167*6+P167 -> 137 | S167: WILLIAMSTOWN
A168: NORTHCOTE | C168: 2 | D168: 3 | E168: =C168*6+D168 -> 15 | G168: 5 | H168: 5 | I168: =G168*6+H168 -> 35 | K168: 6 | L168: 9 | M168: =K168*6+L168 -> 45 | O168: 8 | P168: 13 | Q168: =O168*6+P168 -> 61 | S168: THOMAS
A169: BEST PLAYERS
A170: WILLIAMSTOWN | C170: HARLEY | F170: McPHERSON | I170: SALVAS | L170: MATTHEWS | O170: WILCOX | R170: HARRIS
A171: NORTHCOTE | C171: WHITE | F171: CASPAR | I171: HISCOX | L171: BARKER | O171: DICKSON | R171: McCRACKEN
A172: GOALKICKERS
A173: WILLIAMSTOWN | C173: HARRIS 6 | F173: McPHERSON 5 | I173: TODD 4 | K173: SALVAS 2 | M173: SPRING 2 | O173: DOWLING 2
A174: NORTHCOTE | C174: DICKSON 2 | F174: STRAHAN 2 | I174: McINTOSH 2 | L174: WHITE | N174: McCRACKEN
A176: ROUND 4 | D176: 3RD MAY | J176: WEATHER | M176: NORTH WEST WIND FINE & SUNNY | S176: PLAYED AT
D177: 1ST QTR | H177: 2ND QTR | L177: 3RD QTR | P177: FINAL | S177: BEACH ROAD
A178: SANDRINGHAM | C178: 6 | D178: 3 | E178: =C178*6+D178 -> 39 | G178: 14 | H178: 4 | I178: =G178*6+H178 -> 88 | K178: 19 | L178: 8 | M178: =K178*6+L178 -> 122 | O178: 20 | P178: 14 | Q178: =O178*6+P178 -> 134 | S178: UMPIRE | X178: LADDER | AB178: ROUND | AD178: 4
A179: COBURG | C179: 4 | D179: 3 | E179: =C179*6+D179 -> 27 | G179: 6 | H179: 10 | I179: =G179*6+H179 -> 46 | K179: 11 | L179: 17 | M179: =K179*6+L179 -> 83 | O179: 15 | P179: 19 | Q179: =O179*6+P179 -> 109 | S179: MERRINGTON
A180: BEST PLAYERS | W180: TEAM | X180: W | Y180: L | Z180: D | AA180: FOR | AB180: AGST | AC180: % | AD180: PTS
A181: SANDRINGHAM | C181: TOMLINS | F181: TOYNE | I181: HARPER | L181: ANDERS | N181: GRAMBEAU | Q181: COLLINS
A182: COBURG | C182: ROGAN | F182: HERBERT | I182: WILSON | L182: QUINN | N182: PLUMMER | Q182: WALSH | W182: WILLIAMSTOWN | X182: 4 | Y182: 0 | Z182: 0 | AA182: 473 | AB182: 316 | AC182: 149.68354430379748 | AD182: 16
A183: GOALKICKERS | W183: BRIGHTON | X183: 3 | Y183: 1 | Z183: 0 | AA183: 586 | AB183: 504 | AC183: 116.26984126984127 | AD183: 12
A184: SANDRINGHAM | C184: HARPER 7 | F184: TOMLINS 5 | I184: PARKER 3 | K184: ANDERS 2 | M184: BENCRAFT | O184: COLLINS | Q184: BROKENSHIRE | W184: COBURG | X184: 3 | Y184: 1 | Z184: 0 | AA184: 453 | AB184: 390 | AC184: 116.15384615384616 | AD184: 12
A185: COBURG | C185: ROGAN 4 | F185: CREWTHER 3 | I185: MILTE 2 | K185: JORGENSON 2 | N185: LONSDALE | Q185: WILSON | S185: O'KEEFE | W185: SANDRINGHAM | X185: 3 | Y185: 1 | Z185: 0 | AA185: 521 | AB185: 462 | AC185: 112.77056277056278 | AD185: 12
R186: QUINN
A187: WILLIAMSTOWN | C187: 3 | D187: 3 | E187: =C187*6+D187 -> 21 | G187: 9 | H187: 6 | I187: =G187*6+H187 -> 60 | K187: 12 | L187: 6 | M187: =K187*6+L187 -> 78 | O187: 15 | P187: 9 | Q187: =O187*6+P187 -> 99 | S187: BRUNSWICK | W187: PORT MELBOURNE | X187: 3 | Y187: 1 | Z187: 0 | AA187: 492 | AB187: 447 | AC187: 110.06711409395973 | AD187: 12
A188: BRUNSWICK | C188: 2 | D188: 5 | E188: =C188*6+D188 -> 17 | G188: 2 | H188: 11 | I188: =G188*6+H188 -> 23 | K188: 6 | L188: 15 | M188: =K188*6+L188 -> 51 | O188: 9 | P188: 22 | Q188: =O188*6+P188 -> 76 | S188: BARNES | W188: PRAHRAN | X188: 2 | Y188: 2 | Z188: 0 | AA188: 425 | AB188: 403 | AC188: 105.4590570719603 | AD188: 8
A189: BEST PLAYERS | W189: CAMBERWELL | X189: 2 | Y189: 2 | Z189: 0 | AA189: 432 | AB189: 412 | AC189: 104.85436893203884 | AD189: 8
A190: WILLIAMSTOWN | C190: SAMPSON | F190: FEATHERBY | I190: SALVAS | L190: McPHERSON | O190: HARLEY | Q190: WILCOX | W190: BRUNSWICK | X190: 2 | Y190: 2 | Z190: 0 | AA190: 383 | AB190: 385 | AC190: 99.480519480519476 | AD190: 8
A191: BRUNSWICK | C191: N SMITH | F191: A SHAW | I191: BAGGOTT | L191: UPTON | O191: STANLEY | Q191: PRIESTLEY | W191: OAKLEIGH | X191: 1 | Y191: 3 | Z191: 0 | AA191: 457 | AB191: 472 | AC191: 96.822033898305079 | AD191: 4
A192: GOALKICKERS | W192: NORTHCOTE | X192: 1 | Y192: 3 | Z192: 0 | AA192: 291 | AB192: 421 | AC192: 69.121140142517817 | AD192: 4
A193: WILLIAMSTOWN | C193: McPHERSON 5 | F193: HARRIS 3 | I193: McRAE 3 | K193: TODD 2 | M193: PEACOCK | O193: RAWLINSON | W193: PRESTON | X193: 0 | Y193: 4 | Z193: 0 | AA193: 291 | AB193: 413 | AC193: 70.460048426150124 | AD193: 0
A194: BRUNSWICK | C194: UPTON 2 | F194: N SMITH 2 | I194: GEMMELL | K194: R SHAW | M194: BAGGOTT | O194: HUNTLY | Q194: CROUCH | W194: YARRAVILLE | X194: 0 | Y194: 4 | Z194: 0 | AA194: 390 | AB194: 569 | AC194: 68.541300527240779 | AD194: 0
A196: PORT MELBOURNE | C196: 7 | D196: 1 | E196: =C196*6+D196 -> 43 | G196: 11 | H196: 15 | I196: =G196*6+H196 -> 81 | K196: 13 | L196: 18 | M196: =K196*6+L196 -> 96 | O196: 20 | P196: 21 | Q196: =O196*6+P196 -> 141 | S196: PORT MELBOURNE
A197: OAKLEIGH | C197: 4 | D197: 9 | E197: =C197*6+D197 -> 33 | G197: 9 | H197: 12 | I197: =G197*6+H197 -> 66 | K197: 14 | L197: 20 | M197: =K197*6+L197 -> 104 | O197: 16 | P197: 22 | Q197: =O197*6+P197 -> 118 | S197: MOORE
A198: BEST PLAYERS
A199: PORT MELBOURNE | C199: FINDLAY | F199: CULPH | I199: BUTCHER | L199: LEWIS | O199: BAKER | R199: STEEL
A200: OAKLEIGH | C200: E RYAN | F200: S FINN | I200: R FINN | L200: JORY | O200: PAY | R200: GRAY
A201: GOALKICKERS
A202: PORT MELBOURNE | C202: FINDLAY 8 | F202: CULPH 6 | I202: HOUSTON 2 | L202: STEEL | N202: LEWIS | P202: MURPHY | R202: HOULIHAN
A203: OAKLEIGH | C203: KELLY 4 | F203: MERRIMAN 3 | I203: R FINN 3 | K203: S FINN 2 | M203: JORY | N203: ANDREW | P203: RUNDELL | R203: DONNELLY
A205: CAMBERWELL | C205: 1 | D205: 7 | E205: =C205*6+D205 -> 13 | G205: 9 | H205: 14 | I205: =G205*6+H205 -> 68 | K205: 10 | L205: 17 | M205: =K205*6+L205 -> 77 | O205: 16 | P205: 22 | Q205: =O205*6+P205 -> 118 | S205: CAMBERWELL
A206: NORTHCOTE | C206: 5 | D206: 2 | E206: =C206*6+D206 -> 32 | G206: 6 | H206: 5 | I206: =G206*6+H206 -> 41 | K206: 9 | L206: 15 | M206: =K206*6+L206 -> 69 | O206: 14 | P206: 18 | Q206: =O206*6+P206 -> 102 | S206: LAKE
A207: BEST PLAYERS
A208: CAMBERWELL | C208: SHARPLES | F208: McIVOR | I208: NAISMITH | L208: BRISTOWE | O208: BURKEHALTER | R208: BOHAN
A209: NORTHCOTE | C209: McINTOSH | F209: HISCOX | I209: ATKINSON | L209: STRAHAN | O209: MURPHY | R209: CASPAR
A210: GOALKICKERS
A211: CAMBERWELL | C211: OLIVER 4 | E211: McDONALD 3 | H211: COOK 2 | J211: BOHAN 2 | L211: CAMPBELL 2 | O211: BRISTOWE | Q211: McIVOR | S211: BRADFORD
A212: NORTHCOTE | C212: STRAHAN 5 | F212: McINTOSH 2 | I212: WHITE 2 | K212: DICKSON | M212: WHITECHURCH | P212: BALDWIN | R212: MURPHY | U212: MALONE
A214: PRAHRAN | C214: 5 | D214: 3 | E214: =C214*6+D214 -> 33 | G214: 11 | H214: 4 | I214: =G214*6+H214 -> 70 | K214: 14 | L214: 8 | M214: =K214*6+L214 -> 92 | O214: 16 | P214: 10 | Q214: =O214*6+P214 -> 106 | S214: PRESTON
A215: PRESTON | C215: 2 | D215: 3 | E215: =C215*6+D215 -> 15 | G215: 5 | H215: 7 | I215: =G215*6+H215 -> 37 | K215: 7 | L215: 10 | M215: =K215*6+L215 -> 52 | O215: 10 | P215: 13 | Q215: =O215*6+P215 -> 73 | S215: WRIGHT
A216: BEST PLAYERS
A217: PRAHRAN | C217: SPRIGGS | F217: NEWTON | I217: GARVIN | L217: ADAMS | O217: O'DONNELL | R217: HOGAN
A218: PRESTON | C218: LEISHMAN | F218: BLACKMAN | I218: PRITCHARD | L218: MASLEN | O218: HINDS | R218: CONROY
A219: GOALKICKERS
A220: PRAHRAN | C220: BURGESS 3 | F220: WALSH 3 | I220: O'DONNELL 2 | L220: YATES 2 | N220: KYNE 2 | P220: McMAHON 2 | S220: CROSSLING | W220: SPRIGGS
A221: PRESTON | C221: PRITCHARD 4 | F221: HINDS 2 | I221: FLETCHER | L221: CONROY | N221: MASLEN | Q221: HARRISON
A223: BRIGHTON | C223: 6 | D223: 5 | E223: =C223*6+D223 -> 41 | G223: 10 | H223: 14 | I223: =G223*6+H223 -> 74 | K223: 16 | L223: 21 | M223: =K223*6+L223 -> 117 | O223: 22 | P223: 23 | Q223: =O223*6+P223 -> 155 | S223: YARRAVILLE
A224: YARRAVILLE | C224: 3 | D224: 3 | E224: =C224*6+D224 -> 21 | G224: 7 | H224: 8 | I224: =G224*6+H224 -> 50 | K224: 11 | L224: 10 | M224: =K224*6+L224 -> 76 | O224: 14 | P224: 12 | Q224: =O224*6+P224 -> 96 | S224: THOMAS
A225: BEST PLAYERS
A226: BRIGHTON | C226: TURNER | F226: DOUGLAS | I226: McINDOE | L226: WARBURTON | O226: PLUNKETT | R226: ORGER
A227: YARRAVILLE | C227: PHILLIPS | F227: THOMAS | I227: RUDDELL | L227: VINCENT | O227: WOOD | R227: McLEOD
A228: GOALKICKERS
A229: BRIGHTON | C229: DOUGLAS 9 | F229: WARBURTON 5 | I229: McINDOE 3 | L229: RICHARDSON 2 | O229: ADAMSON | Q229: WILLIAMSON | T229: GOLDSMITH
A230: YARRAVILLE | C230: PHILLIPS 6 | F230: McDONALD 4 | I230: THOMAS 2 | L230: McLEOD | N230: RUDDELL
A232: ROUND 5 | D232: 10TH MAY | J232: WEATHER | M232: DULL CLOUDY NO WIND | S232: PLAYED AT
D233: 1ST QTR | H233: 2ND QTR | L233: 3RD QTR | P233: FINAL | S233: PORT MELBOURNE
A234: PORT MELBOURNE | C234: 5 | D234: 3 | E234: =C234*6+D234 -> 33 | G234: 7 | H234: 6 | I234: =G234*6+H234 -> 48 | K234: 16 | L234: 13 | M234: =K234*6+L234 -> 109 | O234: 20 | P234: 16 | Q234: =O234*6+P234 -> 136 | S234: UMPIRE | X234: LADDER | AB234: ROUND | AD234: 5
A235: WILLIAMSTOWN | C235: 2 | D235: 1 | E235: =C235*6+D235 -> 13 | G235: 7 | H235: 6 | I235: =G235*6+H235 -> 48 | K235: 10 | L235: 6 | M235: =K235*6+L235 -> 66 | O235: 16 | P235: 10 | Q235: =O235*6+P235 -> 106 | S235: BARNES
A236: BEST PLAYERS | W236: TEAM | X236: W | Y236: L | Z236: D | AA236: FOR | AB236: AGST | AC236: % | AD236: PTS
A237: PORT MELBOURNE | C237: BUTCHER | F237: CULPH | I237: FINDLAY | L237: HOUSTON | N237: FERGUSON | Q237: MANN
A238: WILLIAMSTOWN | C238: HARLEY | F238: SALVAS | I238: McPHERSON | L238: DOWLING | N238: WILCOX | Q238: MATTHEWS | W238: WILLIAMSTOWN | X238: 4 | Y238: 1 | Z238: 0 | AA238: 579 | AB238: 452 | AC238: 128.09734513274336 | AD238: 16
A239: GOALKICKERS | Q239: REYNOLDS | W239: COBURG | X239: 4 | Y239: 1 | Z239: 0 | AA239: 597 | AB239: 504 | AC239: 118.45238095238095 | AD239: 16
A240: PORT MELBOURNE | C240: FINDLAY 7 | F240: CULPH 4 | H240: TREMBATH 2 | K240: HOULIHAN 2 | N240: MENZIES 2 | Q240: HOUSTON | S240: MURPHY | W240: PORT MELBOURNE | X240: 4 | Y240: 1 | Z240: 0 | AA240: 628 | AB240: 553 | AC240: 113.5623869801085 | AD240: 16
A241: WILLIAMSTOWN | C241: TODD 6 | E241: DOWLING 5 | H241: HARRIS 2 | J241: McRAE | L241: McPHERSON | O241: RAWLINSON | W241: CAMBERWELL | X241: 3 | Y241: 2 | Z241: 0 | AA241: 557 | AB241: 488 | AC241: 114.13934426229508 | AD241: 12
A243: BRUNSWICK | C243: 9 | D243: 1 | E243: =C243*6+D243 -> 55 | G243: 16 | H243: 5 | I243: =G243*6+H243 -> 101 | K243: 22 | L243: 6 | M243: =K243*6+L243 -> 138 | O243: 24 | P243: 9 | Q243: =O243*6+P243 -> 153 | S243: BRUNSWICK | W243: BRUNSWICK | X243: 3 | Y243: 2 | Z243: 0 | AA243: 536 | AB243: 476 | AC243: 112.60504201680672 | AD243: 12
A244: BRIGHTON | C244: 4 | D244: 4 | E244: =C244*6+D244 -> 28 | G244: 5 | H244: 6 | I244: =G244*6+H244 -> 36 | K244: 9 | L244: 15 | M244: =K244*6+L244 -> 69 | O244: 12 | P244: 19 | Q244: =O244*6+P244 -> 91 | S244: VINES | W244: SANDRINGHAM | X244: 3 | Y244: 2 | Z244: 0 | AA244: 637 | AB244: 603 | AC244: 105.63847429519072 | AD244: 12
A245: BEST PLAYERS | W245: PRAHRAN | X245: 3 | Y245: 2 | Z245: 0 | AA245: 494 | AB245: 469 | AC245: 105.33049040511727 | AD245: 12
A246: BRUNSWICK | C246: GEMMELL | F246: PRIESTLEY | I246: GEISLER | L246: UPTON | O246: EVANS | Q246: MATHERS | W246: BRIGHTON | X246: 3 | Y246: 2 | Z246: 0 | AA246: 677 | AB246: 657 | AC246: 103.0441400304414 | AD246: 12
A247: BRIGHTON | C247: McINDOE | F247: ADAMSON | I247: WARBURTON | L247: RICHARDSON | O247: TURNER | Q247: DOUGLAS | W247: OAKLEIGH | X247: 2 | Y247: 3 | Z247: 0 | AA247: 598 | AB247: 588 | AC247: 101.70068027210884 | AD247: 8
A248: GOALKICKERS | W248: NORTHCOTE | X248: 1 | Y248: 4 | Z248: 0 | AA248: 357 | AB248: 490 | AC248: 72.857142857142861 | AD248: 4
A249: BRUNSWICK | C249: GEMMELL 7 | F249: UPTON 6 | I249: STANLEY 6 | L249: BAGGOTT 2 | O249: PRIESTLEY 2 | R249: HENRYS | W249: YARRAVILLE | X249: 0 | Y249: 5 | Z249: 0 | AA249: 504 | AB249: 713 | AC249: 70.687237026647963 | AD249: 0
A250: BRIGHTON | C250: RICHARDSON 4 | F250: WARBURTON 2 | J250: HEIMS 2 | L250: DOUGLAS 2 | O250: McINDOE 2 | W250: PRESTON | X250: 0 | Y250: 5 | Z250: 0 | AA250: 367 | AB250: 538 | AC250: 68.215613382899633 | AD250: 0
A252: OAKLEIGH | C252: 5 | D252: 4 | E252: =C252*6+D252 -> 34 | G252: 9 | H252: 10 | I252: =G252*6+H252 -> 64 | K252: 14 | L252: 14 | M252: =K252*6+L252 -> 98 | O252: 21 | P252: 15 | Q252: =O252*6+P252 -> 141 | S252: BEACH ROAD
A253: SANDRINGHAM | C253: 2 | D253: 7 | E253: =C253*6+D253 -> 19 | G253: 6 | H253: 10 | I253: =G253*6+H253 -> 46 | K253: 12 | L253: 14 | M253: =K253*6+L253 -> 86 | O253: 16 | P253: 20 | Q253: =O253*6+P253 -> 116 | S253: LAKE
A254: BEST PLAYERS
A255: OAKLEIGH | C255: WILSON | F255: PERKINS | I255: ANDREW | L255: R FINN | O255: E RYAN | Q255: NOONAN
A256: SANDRINGHAM | C256: COLLINS | F256: TOMLINS | I256: HISCOCK | L256: BENCRAFT | O256: PARKER | Q256: TOYNE
A257: GOALKICKERS
A258: OAKLEIGH | C258: DONNELLY 5 | F258: R FINN 5 | I258: ANDREW 3 | L258: MERRIMAN 3 | O258: NOONAN 2 | R258: BECKWITH | U258: S FINN | X258: O'DONOGHUE
A259: SANDRINGHAM | C259: BROKENSHIRE 7 | F259: TOMLINS 2 | I259: HARPER 2 | K259: BENCRAFT 2 | N259: PARKER 2 | Q259: WEBB
A261: PRAHRAN | C261: 2 | D261: 5 | E261: =C261*6+D261 -> 17 | G261: 5 | H261: 8 | I261: =G261*6+H261 -> 38 | K261: 6 | L261: 11 | M261: =K261*6+L261 -> 47 | O261: 9 | P261: 15 | Q261: =O261*6+P261 -> 69 | S261: NORTHCOTE
A262: NORTHCOTE | C262: 3 | D262: 3 | E262: =C262*6+D262 -> 21 | G262: 4 | H262: 4 | I262: =G262*6+H262 -> 28 | K262: 8 | L262: 9 | M262: =K262*6+L262 -> 57 | O262: 9 | P262: 12 | Q262: =O262*6+P262 -> 66 | S262: MOORE
A263: BEST PLAYERS
A264: PRAHRAN | C264: HOGAN | F264: O'DONNELL | I264: ADAMS | L264: FERGEUS | O264: WALSH | Q264: JONES
A265: NORTHCOTE | C265: GREENHAM | F265: McINTOSH | I265: STRAHAN | L265: ARMOUR | O265: BARKER | Q265: HISCOX
A266: GOALKICKERS
A267: PRAHRAN | C267: O'DONNELL 2 | F267: FERGEUS 2 | I267: KIDD 2 | L267: SPRIGGS | N267: MONOHAN
A268: NORTHCOTE | C268: STRAHAN 5 | F268: WHITE | I268: DOWDELL | L268: DICKSON | N268: McINTOSH
A270: CAMBERWELL | C270: 1 | D270: 3 | E270: =C270*6+D270 -> 9 | G270: 10 | H270: 14 | I270: =G270*6+H270 -> 74 | K270: 13 | L270: 18 | M270: =K270*6+L270 -> 96 | O270: 17 | P270: 23 | Q270: =O270*6+P270 -> 125 | S270: CAMBERWELL
A271: PRESTON | C271: 2 | D271: 4 | E271: =C271*6+D271 -> 16 | G271: 7 | H271: 5 | I271: =G271*6+H271 -> 47 | K271: 7 | L271: 8 | M271: =K271*6+L271 -> 50 | O271: 11 | P271: 10 | Q271: =O271*6+P271 -> 76 | S271: MERRINGTON
A272: BEST PLAYERS
A273: CAMBERWELL | C273: BOHAN | F273: SHARPLES | I273: McIVOR | L273: CAMPBELL | O273: JENSEN | R273: NAISMITH
A274: PRESTON | C274: LEISHMAN | F274: MASLEN | I274: FITT | L274: BRADLEY | O274: C STEWART | R274: CONNELLY
A275: GOALKICKERS
A276: CAMBERWELL | C276: CAMPBELL 6 | F276: OLIVER 4 | I276: BRADFORD 4 | L276: BOHAN | N276: KING | P276: HERBERT
A277: PRESTON | C277: MASLEN 5 | F277: PRITCHARD 3 | I277: CONNELLY 2 | L277: DUNSTAN
A279: COBURG | C279: 5 | D279: 8 | E279: =C279*6+D279 -> 38 | G279: 8 | H279: 19 | I279: =G279*6+H279 -> 67 | K279: 15 | L279: 20 | M279: =K279*6+L279 -> 110 | O279: 20 | P279: 24 | Q279: =O279*6+P279 -> 144 | S279: YARRAVILLE
A280: YARRAVILLE | C280: 4 | D280: 6 | E280: =C280*6+D280 -> 30 | G280: 8 | H280: 11 | I280: =G280*6+H280 -> 59 | K280: 14 | L280: 14 | M280: =K280*6+L280 -> 98 | O280: 16 | P280: 18 | Q280: =O280*6+P280 -> 114 | S280: WRIGHT
A281: BEST PLAYERS
A282: COBURG | C282: PLUMMER | F282: KENNEDY | I282: PRENDERGAST | L282: SMITH | O282: STARBUCK | R282: MILTE
A283: YARRAVILLE | C283: SPENCE | F283: ROBERTSON | I283: PHILLIPS | L283: McLEOD | O283: McDONALD | R283: YATES
A284: GOALKICKERS
A285: COBURG | C285: CREWTHER 5 | F285: MILTE 4 | H285: LONSDALE 2 | K285: ROGAN 2 | M285: CONDON 2 | O285: McILVEEN 2 | R285: HIBBERT | U285: PRENDERGAST | X285: WALSH
A286: YARRAVILLE | C286: PHILLIPS 4 | F286: ROBERTSON 4 | I286: SPENCE 3 | K286: MALBON 2 | N286: GARRICK | P286: THOMAS | R286: McDONALD
A288: ROUND 6 | D288: 17TH MAY | J288: WEATHER | M288: WEST BREEZE DULL WARM | S288: PLAYED AT
D289: 1ST QTR | H289: 2ND QTR | L289: 3RD QTR | P289: FINAL | S289: COBURG
A290: PORT MELBOURNE | C290: 2 | D290: 4 | E290: =C290*6+D290 -> 16 | G290: 7 | H290: 8 | I290: =G290*6+H290 -> 50 | K290: 9 | L290: 11 | M290: =K290*6+L290 -> 65 | O290: 15 | P290: 14 | Q290: =O290*6+P290 -> 104 | S290: UMPIRE | X290: LADDER | AB290: ROUND | AD290: 6
A291: COBURG | C291: 4 | D291: 6 | E291: =C291*6+D291 -> 30 | G291: 5 | H291: 8 | I291: =G291*6+H291 -> 38 | K291: 10 | L291: 10 | M291: =K291*6+L291 -> 70 | O291: 13 | P291: 11 | Q291: =O291*6+P291 -> 89 | S291: MERRINGTON
A292: BEST PLAYERS | W292: TEAM | X292: W | Y292: L | Z292: D | AA292: FOR | AB292: AGST | AC292: % | AD292: PTS
A293: PORT MELBOURNE | C293: BUTCHER | F293: TREMBATH | I293: LEWIS | K293: MANN | N293: CULPH | Q293: REYNOLDS
A294: COBURG | C294: PLUMMER | F294: WILSON | I294: PRENDERGAST | L294: WILKINSON | O294: SMITH | Q294: WALKER | W294: WILLIAMSTOWN | X294: 5 | Y294: 1 | Z294: 0 | AA294: 713 | AB294: 536 | AC294: 133.02238805970148 | AD294: 20
A295: GOALKICKERS | W295: PORT MELBOURNE | X295: 5 | Y295: 1 | Z295: 0 | AA295: 732 | AB295: 642 | AC295: 114.01869158878505 | AD295: 20
A296: PORT MELBOURNE | C296: LEWIS 6 | E296: CULPH 3 | G296: THOMS 2 | I296: HOUSTON 2 | L296: REYNOLDS | N296: FINDLAY | W296: BRUNSWICK | X296: 4 | Y296: 2 | Z296: 0 | AA296: 644 | AB296: 549 | AC296: 117.30418943533698 | AD296: 16
A297: COBURG | C297: ROGAN 3 | E297: WILKINSON 2 | H297: KENNEDY 2 | J297: WALSH 2 | L297: NUNN | N297: CONDON | P297: CREWTHER | R297: PRENDERGAST | W297: COBURG | X297: 4 | Y297: 2 | Z297: 0 | AA297: 686 | AB297: 608 | AC297: 112.82894736842105 | AD297: 16
A299: WILLIAMSTOWN | C299: 3 | D299: 4 | E299: =C299*6+D299 -> 22 | G299: 9 | H299: 10 | I299: =G299*6+H299 -> 64 | K299: 16 | L299: 10 | M299: =K299*6+L299 -> 106 | O299: 20 | P299: 14 | Q299: =O299*6+P299 -> 134 | S299: WILLIAMSTOWN | W299: PRAHRAN | X299: 4 | Y299: 2 | Z299: 0 | AA299: 596 | AB299: 561 | AC299: 106.23885918003565 | AD299: 16
A300: SANDRINGHAM | C300: 3 | D300: 3 | E300: =C300*6+D300 -> 21 | G300: 6 | H300: 6 | I300: =G300*6+H300 -> 42 | K300: 8 | L300: 11 | M300: =K300*6+L300 -> 59 | O300: 11 | P300: 18 | Q300: =O300*6+P300 -> 84 | S300: MOORE | W300: CAMBERWELL | X300: 3 | Y300: 3 | Z300: 0 | AA300: 649 | AB300: 590 | AC300: 110 | AD300: 12
A301: BEST PLAYERS | W301: OAKLEIGH | X301: 3 | Y301: 3 | Z301: 0 | AA301: 754 | AB301: 688 | AC301: 109.59302325581395 | AD301: 12
A302: WILLIAMSTOWN | C302: SALVAS | F302: WILCOX | I302: TODD | K302: McPHERSON | N302: HARLEY | Q302: DOWLING | W302: BRIGHTON | X302: 3 | Y302: 3 | Z302: 0 | AA302: 782 | AB302: 779 | AC302: 100.38510911424903 | AD302: 12
A303: SANDRINGHAM | C303: COLLINS | F303: WHITE | I303: TOYNE | K303: BENCRAFT | N303: PARKER | Q303: IRVINE | W303: SANDRINGHAM | X303: 3 | Y303: 3 | Z303: 0 | AA303: 721 | AB303: 737 | AC303: 97.829036635006787 | AD303: 12
A304: GOALKICKERS | O304: RAWLINSON | R304: BOND | W304: PRESTON | X304: 1 | Y304: 5 | Z304: 0 | AA304: 489 | AB304: 643 | AC304: 76.049766718507001 | AD304: 4
A305: WILLIAMSTOWN | C305: TODD 4 | E305: CHISHOLM 3 | H305: PEACOCK 3 | J305: McPHERSON 3 | M305: BERNARD 2 | P305: DOWLING 2 | R305: SALVAS | W305: NORTHCOTE | X305: 1 | Y305: 5 | Z305: 0 | AA305: 430 | AB305: 598 | AC305: 71.906354515050168 | AD305: 4
A306: SANDRINGHAM | C306: PARKER 3 | E306: BROKENSHIRE 3 | H306: COLLINS | J306: HARPER | L306: WHITE | N306: BENCRAFT | Q306: CERINI | W306: YARRAVILLE | X306: 0 | Y306: 6 | Z306: 0 | AA306: 604 | AB306: 869 | AC306: 69.505178365937866 | AD306: 0
A308: PRAHRAN | C308: 5 | D308: 2 | E308: =C308*6+D308 -> 32 | G308: 7 | H308: 5 | I308: =G308*6+H308 -> 47 | K308: 12 | L308: 9 | M308: =K308*6+L308 -> 81 | O308: 15 | P308: 12 | Q308: =O308*6+P308 -> 102 | S308: TOORAK PARK
A309: CAMBERWELL | C309: 3 | D309: 2 | E309: =C309*6+D309 -> 20 | G309: 4 | H309: 9 | I309: =G309*6+H309 -> 33 | K309: 10 | L309: 10 | M309: =K309*6+L309 -> 70 | O309: 13 | P309: 14 | Q309: =O309*6+P309 -> 92 | S309: BARNES
A310: BEST PLAYERS
A311: PRAHRAN | C311: FERGEUS | F311: McMAHON | I311: SPRIGGS | L311: NEWTON | O311: GRAVELL | R311: BOURKE
A312: CAMBERWELL | C312: NAISMITH | F312: DEMPSTER | I312: McIVOR | L312: BRISTOWE | O312: BRADFORD | R312: BOYALL
A313: GOALKICKERS
A314: PRAHRAN | C314: FERGEUS 7 | F314: MONOHAN 2 | I314: RYAN | K314: O'DONNELL | N314: BURGESS | P314: COREY | R314: McMAHON | U314: NORRIS
A315: CAMBERWELL | C315: CAMPBELL 5 | F315: OLIVER 3 | I315: BRADFORD 2 | L315: BRISTOWE | N315: BOYALL | P315: BOHAN
A317: OAKLEIGH | C317: 3 | D317: 4 | E317: =C317*6+D317 -> 22 | G317: 10 | H317: 7 | I317: =G317*6+H317 -> 67 | K317: 17 | L317: 10 | M317: =K317*6+L317 -> 112 | O317: 24 | P317: 12 | Q317: =O317*6+P317 -> 156 | S317: OAKLEIGH
A318: YARRAVILLE | C318: 2 | D318: 7 | E318: =C318*6+D318 -> 19 | G318: 4 | H318: 10 | I318: =G318*6+H318 -> 34 | K318: 7 | L318: 13 | M318: =K318*6+L318 -> 55 | O318: 14 | P318: 16 | Q318: =O318*6+P318 -> 100 | S318: WRIGHT
A319: BEST PLAYERS
A320: OAKLEIGH | C320: JORY | F320: BEARD | I320: WILSON | L320: D RYAN | O320: S FINN | R320: GRAY
A321: YARRAVILLE | C321: WATKINS | F321: SPENCE | I321: RUDDELL | L321: SCARFFE | O321: GARRICK | R321: ROBERTSON
A322: GOALKICKERS
A323: OAKLEIGH | C323: DONNELLY 6 | F323: S FINN 4 | I323: JORY 4 | K323: R FINN 3 | M323: NOONAN 3 | P323: MERRIMAN 2 | S323: ANDREW | V323: PERKINS
A324: YARRAVILLE | C324: PHILLIPS 4 | F324: HARRIS 4 | I324: SPENCE 2 | K324: MALBON 2 | N324: ROBERTSON | Q324: SCARFFE
A326: BRUNSWICK | C326: 0 | D326: 3 | E326: =C326*6+D326 -> 3 | G326: 3 | H326: 11 | I326: =G326*6+H326 -> 29 | K326: 8 | L326: 13 | M326: =K326*6+L326 -> 61 | O326: 15 | P326: 18 | Q326: =O326*6+P326 -> 108 | S326: NORTHCOTE
A327: NORTHCOTE | C327: 5 | D327: 3 | E327: =C327*6+D327 -> 33 | G327: 7 | H327: 6 | I327: =G327*6+H327 -> 48 | K327: 9 | L327: 6 | M327: =K327*6+L327 -> 60 | O327: 11 | P327: 7 | Q327: =O327*6+P327 -> 73 | S327: VINES
A328: BEST PLAYERS
A329: BRUNSWICK | C329: R SHAW | F329: SMITH | I329: BAGGOTT | L329: SILK | O329: TANKARD | R329: GLASSCOTT
A330: NORTHCOTE | C330: HISCOX | F330: STRAHAN | I330: ATKINSON | L330: McINTOSH | O330: CASPAR | R330: BALDWIN
A331: GOALKICKERS
A332: BRUNSWICK | C332: SMITH 3 | E332: GEMMELL 3 | H332: STANLEY 2 | J332: BAGGOTT 2 | M332: TANKARD | O332: PRIESTLEY | Q332: HENRYS | S332: JOHNSON | V332: R SHAW
A333: NORTHCOTE | C333: GALLAGHER 3 | F333: STRAHAN 3 | I333: BALDWIN 2 | L333: WHITECHURCH 2 | P333: McINTOSH
A335: PRESTON | C335: 4 | D335: 3 | E335: =C335*6+D335 -> 27 | G335: 7 | H335: 4 | I335: =G335*6+H335 -> 46 | K335: 8 | L335: 7 | M335: =K335*6+L335 -> 55 | O335: 18 | P335: 14 | Q335: =O335*6+P335 -> 122 | S335: ELSTERNWICK PARK
A336: BRIGHTON | C336: 4 | D336: 5 | E336: =C336*6+D336 -> 29 | G336: 8 | H336: 8 | I336: =G336*6+H336 -> 56 | K336: 13 | L336: 12 | M336: =K336*6+L336 -> 90 | O336: 15 | P336: 15 | Q336: =O336*6+P336 -> 105 | S336: LAKE
A337: BEST PLAYERS
A338: PRESTON | C338: S STEWART | F338: PRITCHARD | I338: OLVER | L338: EVANS | N338: BLACKMAN | Q338: LEISHMAN
A339: BRIGHTON | C339: DOUGLAS | F339: TAPLIN | I339: WARBURTON | L339: ORGER | N339: RICHARDSON | Q339: TURNER
A340: GOALKICKERS
A341: PRESTON | C341: PRITCHARD 9 | F341: GRINDELL 3 | I341: OLVER | K341: FITT | L341: HARRISON | N341: HINES | P341: CONROY | R341: DEACON
A342: BRIGHTON | C342: WARBURTON 6 | F342: DOUGLAS 4 | I342: TAPLIN 2 | K342: ADAMSON 2 | N342: RICHARDSON
A344: ROUND 7 | D344: 24TH MAY | J344: WEATHER | M344: NORT WEST BREEZE FINE SUNNY | S344: PLAYED AT
D345: 1ST QTR | H345: 2ND QTR | L345: 3RD QTR | P345: FINAL | S345: WILLIAMSTOWN
A346: PRAHRAN | C346: 2 | D346: 4 | E346: =C346*6+D346 -> 16 | G346: 5 | H346: 9 | I346: =G346*6+H346 -> 39 | K346: 10 | L346: 13 | M346: =K346*6+L346 -> 73 | O346: 14 | P346: 15 | Q346: =O346*6+P346 -> 99 | S346: UMPIRE | X346: LADDER | AB346: ROUND | AD346: 7
A347: WILLIAMSTOWN | C347: 5 | D347: 2 | E347: =C347*6+D347 -> 32 | G347: 7 | H347: 8 | I347: =G347*6+H347 -> 50 | K347: 8 | L347: 11 | M347: =K347*6+L347 -> 59 | O347: 11 | P347: 14 | Q347: =O347*6+P347 -> 80 | S347: MERRINGTON
A348: BEST PLAYERS | W348: TEAM | X348: W | Y348: L | Z348: D | AA348: FOR | AB348: AGST | AC348: % | AD348: PTS
A349: PRAHRAN | C349: GARVIN | F349: NEWTON | I349: McMAHON | L349: FERGEUS | O349: HOGAN | Q349: O'DONNELL
A350: WILLIAMSTOWN | C350: CHISHOLM | F350: WILCOX | I350: WILLIAMS | L350: SPRING | O350: TODD | Q350: HARLEY | W350: PORT MELBOURNE | X350: 6 | Y350: 1 | Z350: 0 | AA350: 868 | AB350: 747 | AC350: 116.19812583668005 | AD350: 24
A351: GOALKICKERS | W351: WILLIAMSTOWN | X351: 5 | Y351: 2 | Z351: 0 | AA351: 793 | AB351: 635 | AC351: 124.88188976377953 | AD351: 20
A352: PRAHRAN | C352: WALSH 3 | E352: NORRIS 2 | G352: FERGEUS 2 | I352: MONOHAN 2 | L352: GARVIN 2 | N352: O'DONNELL | Q352: RYAN | R352: McMAHON | W352: BRUNSWICK | X352: 5 | Y352: 2 | Z352: 0 | AA352: 752 | AB352: 644 | AC352: 116.77018633540372 | AD352: 20
A353: WILLIAMSTOWN | C353: TODD 5 | E353: BERNARD 2 | H353: BOND 2 | J353: SPRING | L353: McPHERSON | W353: PRAHRAN | X353: 5 | Y353: 2 | Z353: 0 | AA353: 695 | AB353: 641 | AC353: 108.42433697347894 | AD353: 20
A355: BRUNSWICK | C355: 3 | D355: 2 | E355: =C355*6+D355 -> 20 | G355: 5 | H355: 8 | I355: =G355*6+H355 -> 38 | K355: 11 | L355: 12 | M355: =K355*6+L355 -> 78 | O355: 15 | P355: 18 | Q355: =O355*6+P355 -> 108 | S355: BRUNSWICK | W355: COBURG | X355: 4 | Y355: 3 | Z355: 0 | AA355: 752 | AB355: 687 | AC355: 109.46142649199417 | AD355: 16
A356: CAMBERWELL | C356: 3 | D356: 4 | E356: =C356*6+D356 -> 22 | G356: 6 | H356: 6 | I356: =G356*6+H356 -> 42 | K356: 11 | L356: 9 | M356: =K356*6+L356 -> 75 | O356: 14 | P356: 11 | Q356: =O356*6+P356 -> 95 | S356: BARNES | W356: BRIGHTON | X356: 4 | Y356: 3 | Z356: 0 | AA356: 928 | AB356: 857 | AC356: 108.28471411901984 | AD356: 16
A357: BEST PLAYERS | W357: SANDRINGHAM | X357: 4 | Y357: 3 | Z357: 0 | AA357: 838 | AB357: 810 | AC357: 103.45679012345678 | AD357: 16
A358: BRUNSWICK | C358: SMITH | F358: GEISLER | I358: PRIESTLEY | L358: R SHAW | O358: SILK | Q358: SPENCER | W358: CAMBERWELL | X358: 3 | Y358: 4 | Z358: 0 | AA358: 744 | AB358: 698 | AC358: 106.59025787965616 | AD358: 12
A359: CAMBERWELL | C359: SHARPLES | F359: STYLES | I359: NAISMITH | L359: McIVOR | O359: BOHAN | Q359: BRADFORD | W359: OAKLEIGH | X359: 3 | Y359: 4 | Z359: 0 | AA359: 832 | AB359: 834 | AC359: 99.760191846522787 | AD359: 12
A360: GOALKICKERS | P360: HUNTLY | R360: CROUCH | W360: PRESTON | X360: 2 | Y360: 5 | Z360: 0 | AA360: 568 | AB360: 709 | AC360: 80.112834978843438 | AD360: 8
A361: BRUNSWICK | C361: UPTON 3 | E361: STANLEY 3 | H361: PRIESTLEY 2 | K361: BAGGOTT 2 | N361: GEMMELL | P361: TANKARD | R361: MATHERS | W361: NORTHCOTE | X361: 1 | Y361: 6 | Z361: 0 | AA361: 503 | AB361: 715 | AC361: 70.349650349650346 | AD361: 4
A362: CAMBERWELL | C362: BRADFORD 4 | F362: McDONALD 3 | I362: CAMPBELL 2 | L362: OLIVER 2 | N362: BOHAN | P362: BAYLISS | R362: KINDER | W362: YARRAVILLE | X362: 0 | Y362: 7 | Z362: 0 | AA362: 709 | AB362: 1005 | AC362: 70.547263681592042 | AD362: 0
A364: BRIGHTON | C364: 3 | D364: 7 | E364: =C364*6+D364 -> 25 | G364: 4 | H364: 15 | I364: =G364*6+H364 -> 39 | K364: 10 | L364: 19 | M364: =K364*6+L364 -> 79 | O364: 20 | P364: 26 | Q364: =O364*6+P364 -> 146 | S364: OAKLEIGH
A365: OAKLEIGH | C365: 5 | D365: 3 | E365: =C365*6+D365 -> 33 | G365: 5 | H365: 3 | I365: =G365*6+H365 -> 33 | K365: 9 | L365: 10 | M365: =K365*6+L365 -> 64 | O365: 11 | P365: 12 | Q365: =O365*6+P365 -> 78 | S365: WRIGHT
A366: BEST PLAYERS
A367: BRIGHTON | C367: DOUGLAS | F367: TURNER | I367: ADAMSON | L367: BAILEY | O367: ROSE | R367: CRAVEN
A368: OAKLEIGH | C368: WILSON | F368: COATES | I368: JORY | L368: BEARD | O368: CRAWSHAW | R368: GRAY
A369: GOALKICKERS
A370: BRIGHTON | C370: ADAMSON 6 | F370: DOUGLAS 5 | I370: HEIMS 3 | K370: McINDOE 3 | N370: TAPLIN | P370: RICHARDSON | S370: GOLDSMITH
A371: OAKLEIGH | C371: CRAWSHAW 3 | F371: JORY 2 | H371: ANDREW 2 | K371: DONNELLY | M371: S FINN | O371: BAXTER | Q371: NOONAN
A373: SANDRINGHAM | C373: 6 | D373: 13 | E373: =C373*6+D373 -> 49 | G373: 9 | H373: 14 | I373: =G373*6+H373 -> 68 | K373: 14 | L373: 17 | M373: =K373*6+L373 -> 101 | O373: 16 | P373: 21 | Q373: =O373*6+P373 -> 117 | S373: BEACH ROAD
A374: NORTHCOTE | C374: 1 | D374: 1 | E374: =C374*6+D374 -> 7 | G374: 3 | H374: 6 | I374: =G374*6+H374 -> 24 | K374: 4 | L374: 9 | M374: =K374*6+L374 -> 33 | O374: 10 | P374: 13 | Q374: =O374*6+P374 -> 73 | S374: MOORE
A375: BEST PLAYERS
A376: SANDRINGHAM | C376: TOMLINS | F376: SALES | I376: HEADEN | L376: TOYNE | O376: GRAMBEAU | R376: BENCRAFT
A377: NORTHCOTE | C377: CASPAR | F377: HISCOX | I377: BALDWIN | L377: WHITE | O377: GREENHAM | R377: KINDER
A378: GOALKICKERS
A379: SANDRINGHAM | C379: BROKENSHIRE 3 | F379: WHITE 3 | H379: SIMS 2 | J379: HEADEN 2 | M379: BENCRAFT | O379: CERINI | Q379: COLLINS | S379: BROWN | U379: TOMLINS | W379: HARPER
A380: NORTHCOTE | C380: BALDWIN 3 | F380: STRAHAN 2 | I380: GALLAGHER | L380: WHITE | N380: McINTOSH | Q380: McCRACKEN | T380: ARMOUR
A382: PRESTON | C382: 1 | D382: 3 | E382: =C382*6+D382 -> 9 | G382: 6 | H382: 13 | I382: =G382*6+H382 -> 49 | K382: 8 | L382: 17 | M382: =K382*6+L382 -> 65 | O382: 10 | P382: 19 | Q382: =O382*6+P382 -> 79 | S382: PRESTON
A383: COBURG | C383: 3 | D383: 2 | E383: =C383*6+D383 -> 20 | G383: 3 | H383: 3 | I383: =G383*6+H383 -> 21 | K383: 7 | L383: 8 | M383: =K383*6+L383 -> 50 | O383: 9 | P383: 12 | Q383: =O383*6+P383 -> 66 | S383: McGAW
A384: BEST PLAYERS
A385: PRESTON | C385: LEISHMAN | F385: DUNSTAN | I385: LEHMANN | L385: FITT | N385: CONROY | P385: MASLEN
A386: COBURG | C386: WILSON | F386: PROMNITZ | I386: WILLIS | L386: MILTE | N386: QUINN | P386: WALSH
A387: GOALKICKERS
A388: PRESTON | C388: PRITCHARD 3 | F388: MASLEN 3 | I388: GRINDELL 2 | L388: DUNSTAN | N388: CONROY
A389: COBURG | C389: LONSDALE 3 | F389: ROGAN 2 | I389: WALSH | K389: MILTE | M389: CREWTHER | P389: PRENDERGAST
A391: PORT MELBOURNE | C391: 6 | D391: 4 | E391: =C391*6+D391 -> 40 | G391: 12 | H391: 8 | I391: =G391*6+H391 -> 80 | K391: 13 | L391: 12 | M391: =K391*6+L391 -> 90 | O391: 20 | P391: 16 | Q391: =O391*6+P391 -> 136 | S391: PORT MELBOURNE
A392: YARRAVILLE | C392: 3 | D392: 1 | E392: =C392*6+D392 -> 19 | G392: 3 | H392: 7 | I392: =G392*6+H392 -> 25 | K392: 12 | L392: 8 | M392: =K392*6+L392 -> 80 | O392: 16 | P392: 9 | Q392: =O392*6+P392 -> 105 | S392: THOMAS
A393: BEST PLAYERS
A394: PORT MELBOURNE | C394: BUTCHER | F394: FINDLAY | I394: THOMS | L394: HOUSTON | N394: TREMBETH | Q394: MANN
A395: YARRAVILLE | C395: GARLICK | F395: SCARFFE | I395: HILET | L395: SPENCE | N395: PHILLIPS | Q395: GARRICK
A396: GOALKICKERS
A397: PORT MELBOURNE | C397: THOMS 6 | F397: FINDLAY 4 | I397: CULPH 3 | K397: HOUSTON 2 | N397: LEWIS 2 | P397: MENZIES 2 | S397: MURPHY
A398: YARRAVILLE | C398: HARRIS 3 | F398: GARRICK 3 | I398: SCARFFE 3 | L398: SPENCE 2 | N398: McDONALD 2 | Q398: PHILLIPS 2 | T398: THOMAS
A400: ROUND 8 | D400: 31ST MAY | J400: WEATHER | M400: FOGGY RAIN COLD | S400: PLAYED AT
D401: 1ST QTR | H401: 2ND QTR | L401: 3RD QTR | P401: FINAL | S401: COBURG
A402: WILLIAMSTOWN | C402: 4 | D402: 2 | E402: =C402*6+D402 -> 26 | G402: 8 | H402: 8 | I402: =G402*6+H402 -> 56 | K402: 11 | L402: 8 | M402: =K402*6+L402 -> 74 | O402: 15 | P402: 10 | Q402: =O402*6+P402 -> 100 | S402: UMPIRE | X402: LADDER | AB402: ROUND | AD402: 8
A403: COBURG | C403: 3 | D403: 2 | E403: =C403*6+D403 -> 20 | G403: 6 | H403: 6 | I403: =G403*6+H403 -> 42 | K403: 11 | L403: 13 | M403: =K403*6+L403 -> 79 | O403: 14 | P403: 15 | Q403: =O403*6+P403 -> 99 | S403: MOORE
A404: BEST PLAYERS | W404: TEAM | X404: W | Y404: L | Z404: D | AA404: FOR | AB404: AGST | AC404: % | AD404: PTS
A405: WILLIAMSTOWN | C405: SALVAS | E405: CHISHOLM | H405: DOWLING | K405: BERNARD | N405: SPRING | Q405: PEACOCK
A406: COBURG | C406: MILTE | E406: WALKER | H406: WALSH | K406: CONDON | N406: STARBUCK | Q406: PLUMMER | W406: WILLIAMSTOWN | X406: 6 | Y406: 2 | Z406: 0 | AA406: 893 | AB406: 734 | AC406: 121.66212534059946 | AD406: 24
A407: GOALKICKERS | W407: PORT MELBOURNE | X407: 6 | Y407: 2 | Z407: 0 | AA407: 954 | AB407: 886 | AC407: 107.67494356659142 | AD407: 24
A408: WILLIAMSTOWN | C408: DOWLING 4 | F408: McPHERSON 3 | I408: BOND 2 | K408: TODD 2 | M408: BERNARD 2 | P408: SPRING | W408: PRAHRAN | X408: 6 | Y408: 2 | Z408: 0 | AA408: 858 | AB408: 798 | AC408: 107.5187969924812 | AD408: 24
A409: COBURG | C409: QUINN 4 | F409: CONDON 3 | I409: MILTE 2 | K409: ROGAN 2 | M409: WESTCOTT | P409: SILLITOE | R409: CREWTHER | W409: BRUNSWICK | X409: 5 | Y409: 3 | Z409: 0 | AA409: 839 | AB409: 759 | AC409: 110.54018445322794 | AD409: 20
A411: PRAHRAN | C411: 1 | D411: 3 | E411: =C411*6+D411 -> 9 | G411: 13 | H411: 9 | I411: =G411*6+H411 -> 87 | K411: 19 | L411: 14 | M411: =K411*6+L411 -> 128 | O411: 24 | P411: 19 | Q411: =O411*6+P411 -> 163 | S411: ELSTERNWICK PARK | W411: SANDRINGHAM | X411: 5 | Y411: 3 | Z411: 0 | AA411: 953 | AB411: 897 | AC411: 106.24303232998885 | AD411: 20
A412: BRIGHTON | C412: 7 | D412: 6 | E412: =C412*6+D412 -> 48 | G412: 12 | H412: 8 | I412: =G412*6+H412 -> 80 | K412: 15 | L412: 12 | M412: =K412*6+L412 -> 102 | O412: 23 | P412: 19 | Q412: =O412*6+P412 -> 157 | S412: WRIGHT | W412: CAMBERWELL | X412: 4 | Y412: 4 | Z412: 0 | AA412: 883 | AB412: 784 | AC412: 112.62755102040816 | AD412: 16
A413: BEST PLAYERS | W413: COBURG | X413: 4 | Y413: 4 | Z413: 0 | AA413: 851 | AB413: 787 | AC413: 108.13214739517154 | AD413: 16
A414: PRAHRAN | C414: FERGEUS | F414: SPRIGGS | I414: HOGAN | K414: MONOHAN | N414: BURGESS | Q414: GARVIN | W414: BRIGHTON | X414: 4 | Y414: 4 | Z414: 0 | AA414: 1085 | AB414: 1020 | AC414: 106.37254901960785 | AD414: 16
A415: BRIGHTON | C415: ADAMSON | F415: DOUGLAS | I415: HEIMS | K415: BAILEY | N415: McINDOE | Q415: TURNER | W415: OAKLEIGH | X415: 4 | Y415: 4 | Z415: 0 | AA415: 938 | AB415: 922 | AC415: 101.7353579175705 | AD415: 16
A416: GOALKICKERS | O416: GARVIN | R416: ROACH | W416: PRESTON | X416: 2 | Y416: 6 | Z416: 0 | AA416: 672 | AB416: 851 | AC416: 78.96592244418332 | AD416: 8
A417: PRAHRAN | C417: FERGEUS 5 | F417: McMAHON 3 | I417: RYAN 3 | K417: WALSH 3 | M417: BURGESS 3 | O417: MONOHAN 3 | R417: KYNE 2 | W417: YARRAVILLE | X417: 1 | Y417: 7 | Z417: 0 | AA417: 851 | AB417: 1109 | AC417: 76.735798016230845 | AD417: 4
A418: BRIGHTON | C418: DOUGLAS 8 | F418: ADAMSON 6 | I418: WARBURTON 3 | L418: McINDOE 2 | N418: RICHARDSON | Q418: TAPLIN | S418: HEIMS | W418: NORTHCOTE | X418: 1 | Y418: 7 | Z418: 0 | AA418: 591 | AB418: 821 | AC418: 71.985383678440925 | AD418: 4
Q419: CONROY
A420: SANDRINGHAM | C420: 5 | D420: 7 | E420: =C420*6+D420 -> 37 | G420: 10 | H420: 9 | I420: =G420*6+H420 -> 69 | K420: 14 | L420: 10 | M420: =K420*6+L420 -> 94 | O420: 17 | P420: 13 | Q420: =O420*6+P420 -> 115 | S420: BEACH ROAD
A421: BRUNSWICK | C421: 3 | D421: 2 | E421: =C421*6+D421 -> 20 | G421: 7 | H421: 5 | I421: =G421*6+H421 -> 47 | K421: 11 | L421: 8 | M421: =K421*6+L421 -> 74 | O421: 12 | P421: 15 | Q421: =O421*6+P421 -> 87 | S421: MERRINGTON
A422: BEST PLAYERS
A423: SANDRINGHAM | C423: HARPER | F423: TOMLINS | I423: TOYNE | K423: BENCRAFT | N423: O'TOOLE | Q423: EVANS
A424: BRUNSWICK | C424: PRIESTLEY | F424: R SHAW | I424: KEMP | K424: GEISLER | N424: SPENCER | Q424: SILK
A425: GOALKICKERS
A426: SANDRINGHAM | C426: TOMLINS 5 | F426: HARPER 4 | I426: BENCRAFT 3 | L426: WHITE 3 | N426: HEADEN | P426: BERTOTTO
A427: BRUNSWICK | C427: PRIESTLEY 4 | F427: CROUCH 3 | I427: BAGGOTT 2 | L427: STANLEY | N427: TANKARD | Q427: UPTON
A429: CAMBERWELL | C429: 5 | D429: 6 | E429: =C429*6+D429 -> 36 | G429: 13 | H429: 13 | I429: =G429*6+H429 -> 91 | K429: 15 | L429: 15 | M429: =K429*6+L429 -> 105 | O429: 20 | P429: 19 | Q429: =O429*6+P429 -> 139 | S429: CAMBERWELL
A430: PORT MELBOURNE | C430: 4 | D430: 2 | E430: =C430*6+D430 -> 26 | G430: 6 | H430: 5 | I430: =G430*6+H430 -> 41 | K430: 9 | L430: 11 | M430: =K430*6+L430 -> 65 | O430: 12 | P430: 14 | Q430: =O430*6+P430 -> 86 | S430: McGAW
A431: BEST PLAYERS
A432: CAMBERWELL | C432: CAMPBELL | F432: McDONALD | I432: BOHAN | K432: BRISTOWE | N432: BRADFORD | Q432: NAISMITH
A433: PORT MELBOURNE | C433: BUTCHER | F433: MANN | I433: FINDLAY | K433: CULPH | N433: HOUSTON | Q433: LEWIS
A434: GOALKICKERS
A435: CAMBERWELL | C435: McDONALD 7 | F435: BRYCE 3 | H435: HERBERT 2 | J435: BRADFORD 2 | M435: KINDER 2 | O435: BOYALL | Q435: SHARPLES | T435: BOHAN | W435: CAMPBELL
A436: PORT MELBOURNE | C436: FINDLAY 5 | F436: CULPH 4 | I436: HOUSTON 2 | L436: LEWIS
A438: OAKLEIGH | C438: 3 | D438: 5 | E438: =C438*6+D438 -> 23 | G438: 7 | H438: 7 | I438: =G438*6+H438 -> 49 | K438: 12 | L438: 12 | M438: =K438*6+L438 -> 84 | O438: 15 | P438: 16 | Q438: =O438*6+P438 -> 106 | S438: NORTHCOTE
A439: NORTHCOTE | C439: 4 | D439: 1 | E439: =C439*6+D439 -> 25 | G439: 8 | H439: 7 | I439: =G439*6+H439 -> 55 | K439: 9 | L439: 8 | M439: =K439*6+L439 -> 62 | O439: 13 | P439: 10 | Q439: =O439*6+P439 -> 88 | S439: BARNES
A440: BEST PLAYERS
A441: OAKLEIGH | C441: DONNELLY | F441: SANDAY | I441: COATES | L441: TEMME | N441: R FINN | Q441: JORY
A442: NORTHCOTE | C442: BALDWIN | F442: HISCOX | I442: GALLAGHER | L442: MALONE | N442: McINTOSH | Q442: ARMOUR
A443: GOALKICKERS
A444: OAKLEIGH | C444: DONNELLY 7 | F444: MERRIMAN 2 | I444: R FINN 2 | K444: S FINN 2 | M444: E RYAN | O444: PAY
A445: NORTHCOTE | C445: McINTOSH 3 | F445: BALDWIN 2 | I445: WHITECHURCH 2 | M445: CAIN 2 | O445: ATKINSON | Q445: STRAHAN | T445: MALONE | W445: GALLAGHER
A447: YARRAVILLE | C447: 3 | D447: 3 | E447: =C447*6+D447 -> 21 | G447: 9 | H447: 9 | I447: =G447*6+H447 -> 63 | K447: 13 | L447: 13 | M447: =K447*6+L447 -> 91 | O447: 20 | P447: 22 | Q447: =O447*6+P447 -> 142 | S447: YARRAVILLE
A448: PRESTON | C448: 7 | D448: 4 | E448: =C448*6+D448 -> 46 | G448: 9 | H448: 8 | I448: =G448*6+H448 -> 62 | K448: 13 | L448: 9 | M448: =K448*6+L448 -> 87 | O448: 15 | P448: 14 | Q448: =O448*6+P448 -> 104 | S448: THOMAS
A449: BEST PLAYERS
A450: YARRAVILLE | C450: SPENCE | F450: PHILLIPS | I450: HARRIS | L450: CAESAR | O450: MALBON | R450: REID
A451: PRESTON | C451: BLACKMAN | F451: DUGGAN | I451: BRYCE | L451: DUNSTAN | O451: LEISHMAN | R451: HINES
A452: GOALKICKERS
A453: YARRAVILLE | C453: HARRIS 6 | F453: SPENCE 5 | I453: SCARFFE 3 | L453: PHILLIPS 2 | O453: RUDDELL | Q453: CAESAR | S453: McDONALD | V453: REID
A454: PRESTON | C454: BRYCE 5 | F454: HARRISON 3 | I454: CONNELLY 2 | L454: PRITCHARD 2 | O454: DEACON | Q454: LEHMANN | T454: GRINDELL
A456: ROUND 9 | D456: 7TH JUNE | J456: WEATHER | M456: SOUTH WEST BREEZE COLD | S456: PLAYED AT
D457: 1ST QTR | H457: 2ND QTR | L457: 3RD QTR | P457: FINAL | S457: BRUNSWICK
A458: BRUNSWICK | C458: 5 | D458: 4 | E458: =C458*6+D458 -> 34 | G458: 6 | H458: 8 | I458: =G458*6+H458 -> 44 | K458: 9 | L458: 13 | M458: =K458*6+L458 -> 67 | O458: 12 | P458: 21 | Q458: =O458*6+P458 -> 93 | S458: UMPIRE | X458: LADDER | AA458: ROUND | AD458: 9
A459: PORT MELBOURNE | C459: 4 | D459: 8 | E459: =C459*6+D459 -> 32 | G459: 9 | H459: 13 | I459: =G459*6+H459 -> 67 | K459: 11 | L459: 20 | M459: =K459*6+L459 -> 86 | O459: 12 | P459: 21 | Q459: =O459*6+P459 -> 93 | S459: MERRINGTON
A460: BEST PLAYERS | W460: TEAM | X460: W | Y460: L | Z460: D | AA460: FOR | AB460: AGST | AC460: % | AD460: PTS
A461: BRUNSWICK | C461: PRIESTLEY | F461: SMITH | I461: SILK | K461: CHALLENGER | N461: GEMMILL | Q461: CROUCH
A462: PORT MELBOURNE | C462: FINDLAY | F462: MENZIES | I462: STEEL | K462: MANN | N462: BAKER | Q462: HOUSTON | W462: WILLIAMSTOWN | X462: 7 | Y462: 2 | Z462: 0 | AA462: 983 | AB462: 822 | AC462: 119.58637469586375 | AD462: 28
A463: GOALKICKERS | W463: PORT MELBOURNE | X463: 6 | Y463: 2 | Z463: 1 | AA463: 1047 | AB463: 979 | AC463: 106.94586312563841 | AD463: 26
A464: BRUNSWICK | C464: CROUCH 5 | F464: PRIESTLEY 4 | I464: SMITH 2 | L464: HENRYS | W464: SANDRINGHAM | X464: 6 | Y464: 3 | Z464: 0 | AA464: 1057 | AB464: 975 | AC464: 108.41025641025641 | AD464: 24
A465: PORT MELBOURNE | C465: FINDLAY 6 | F465: THOMS 3 | I465: HOUSTON 2 | L465: SNELL | W465: PRAHRAN | X465: 6 | Y465: 3 | Z465: 0 | AA465: 936 | AB465: 902 | AC465: 103.76940133037694 | AD465: 24
A467: SANDRINGHAM | C467: 3 | D467: 3 | E467: =C467*6+D467 -> 21 | G467: 5 | H467: 7 | I467: =G467*6+H467 -> 37 | K467: 9 | L467: 14 | M467: =K467*6+L467 -> 68 | O467: 15 | P467: 14 | Q467: =O467*6+P467 -> 104 | S467: TOORAK PARK | W467: BRUNSWICK | X467: 5 | Y467: 3 | Z467: 1 | AA467: 932 | AB467: 852 | AC467: 109.38967136150235 | AD467: 22
A468: PRAHRAN | C468: 2 | D468: 3 | E468: =C468*6+D468 -> 15 | G468: 5 | H468: 9 | I468: =G468*6+H468 -> 39 | K468: 7 | L468: 9 | M468: =K468*6+L468 -> 51 | O468: 11 | P468: 12 | Q468: =O468*6+P468 -> 78 | S468: McGAW | W468: BRIGHTON | X468: 5 | Y468: 4 | Z468: 0 | AA468: 1225 | AB468: 1140 | AC468: 107.45614035087719 | AD468: 20
A469: BEST PLAYERS | W469: OAKLEIGH | X469: 5 | Y469: 4 | Z469: 0 | AA469: 1028 | AB469: 1008 | AC469: 101.98412698412699 | AD469: 20
A470: SANDRINGHAM | C470: PATTERSON | F470: HEADEN | I470: HARPER | K470: TOMLINS | N470: SALES | Q470: WEBB | W470: CAMBERWELL | X470: 4 | Y470: 5 | Z470: 0 | AA470: 1003 | AB470: 924 | AC470: 108.54978354978356 | AD470: 16
A471: PRAHRAN | C471: OVERS | F471: FERGEUS | I471: BURGESS | K471: GROVE | N471: YATES | Q471: ROACH | W471: COBURG | X471: 4 | Y471: 5 | Z471: 0 | AA471: 937 | AB471: 877 | AC471: 106.84150513112886 | AD471: 16
A472: GOALKICKERS | Q472: COLLINS | W472: PRESTON | X472: 2 | Y472: 7 | Z472: 0 | AA472: 760 | AB472: 941 | AC472: 80.765143464399571 | AD472: 8
A473: SANDRINGHAM | C473: HARPER 3 | E473: BENCRAFT 3 | H473: PATTERSON 2 | K473: BROKENSHIRE 2 | N473: HAGER 2 | P473: CERINI | R473: HEADEN | W473: YARRAVILLE | X473: 2 | Y473: 7 | Z473: 0 | AA473: 937 | AB473: 1178 | AC473: 79.541595925297116 | AD473: 8
A474: PRAHRAN | C474: FERGEUS 3 | F474: BURGESS 2 | I474: OVERS 2 | K474: GROVE | M474: WALSH | O474: McMAHON | R474: MONOHAN | W474: NORTHCOTE | X474: 1 | Y474: 8 | Z474: 0 | AA474: 660 | AB474: 907 | AC474: 72.767364939360533 | AD474: 4
A476: BRIGHTON | C476: 2 | D476: 8 | E476: =C476*6+D476 -> 20 | G476: 10 | H476: 16 | I476: =G476*6+H476 -> 76 | K476: 13 | L476: 17 | M476: =K476*6+L476 -> 95 | O476: 19 | P476: 26 | Q476: =O476*6+P476 -> 140 | S476: ELSTERNWICK PARK
A477: CAMBERWELL | C477: 4 | D477: 5 | E477: =C477*6+D477 -> 29 | G477: 5 | H477: 10 | I477: =G477*6+H477 -> 40 | K477: 16 | L477: 17 | M477: =K477*6+L477 -> 113 | O477: 17 | P477: 18 | Q477: =O477*6+P477 -> 120 | S477: MOORE
A478: BEST PLAYERS
A479: BRIGHTON | C479: McINDOE | F479: BAILEY | I479: ADAMSON | L479: HEIMS | O479: NEW | R479: WARBURTON
A480: CAMBERWELL | C480: BOHAN | F480: McDONALD | I480: DEMPSTER | L480: BRADFORD | O480: BRISTOWE | R480: HOGAN
A481: GOALKICKERS
A482: BRIGHTON | C482: McINDOE 6 | F482: WARBURTON 4 | J482: DOUGLAS 3 | M482: RICHARDSON 2 | P482: ADAMSON 2 | S482: GRATTIDGE | V482: PINDER
A483: CAMBERWELL | C483: McDONALD 5 | F483: BOHAN 4 | I483: HERBERT 2 | L483: BRADFORD 2 | O483: HOGAN 2 | Q483: BRYCE | S483: CAMPBELL
A485: OAKLEIGH | C485: 2 | D485: 5 | E485: =C485*6+D485 -> 17 | G485: 7 | H485: 7 | I485: =G485*6+H485 -> 49 | K485: 9 | L485: 12 | M485: =K485*6+L485 -> 66 | O485: 12 | P485: 18 | Q485: =O485*6+P485 -> 90 | S485: OAKLEIGH
A486: COBURG | C486: 1 | D486: 4 | E486: =C486*6+D486 -> 10 | G486: 6 | H486: 8 | I486: =G486*6+H486 -> 44 | K486: 9 | L486: 12 | M486: =K486*6+L486 -> 66 | O486: 12 | P486: 14 | Q486: =O486*6+P486 -> 86 | S486: BARNES
A487: BEST PLAYERS
A488: OAKLEIGH | C488: WILSON | F488: WILLIAMS | I488: JORY | L488: DONNELLY | O488: ANDREW | R488: COATES
A489: COBURG | C489: MILTE | F489: WALKER | I489: WILSON | L489: QUINN | O489: CONDON | R489: PROMNITZ
A490: GOALKICKERS
A491: OAKLEIGH | C491: DONNELLY 5 | F491: ANDREW 2 | I491: R FINN | K491: S FINN | M491: E RYAN | O491: JORY | Q491: TEMME
A492: COBURG | C492: CONDON 5 | F492: CREWTHER 2 | I492: QUINN 2 | K492: WILKINSON 2 | N492: MILTE
A494: YARRAVILLE | C494: 4 | D494: 0 | E494: =C494*6+D494 -> 24 | G494: 10 | H494: 6 | I494: =G494*6+H494 -> 66 | K494: 10 | L494: 8 | M494: =K494*6+L494 -> 68 | O494: 12 | P494: 14 | Q494: =O494*6+P494 -> 86 | S494: YARRAVILLE
A495: NORTHCOTE | C495: 1 | D495: 9 | E495: =C495*6+D495 -> 15 | G495: 4 | H495: 11 | I495: =G495*6+H495 -> 35 | K495: 7 | L495: 20 | M495: =K495*6+L495 -> 62 | O495: 8 | P495: 21 | Q495: =O495*6+P495 -> 69 | S495: WRIGHT
A496: BEST PLAYERS
A497: YARRAVILLE | C497: HARDIMAN | F497: SPENCE | I497: GARLICK | L497: SING | N497: SCARFFE | Q497: SAIT
A498: NORTHCOTE | C498: HISCOX | F498: ARMOUR | I498: CASPAR | L498: MURPHY | N498: STRAHAN | Q498: KINDER
A499: GOALKICKERS
A500: YARRAVILLE | C500: SPENCE 5 | F500: McDONALD 3 | I500: PHILLIPS 2 | L500: HARRIS | N500: SCARFFE
A501: NORTHCOTE | C501: BALDWIN 3 | F501: KINDER 3 | I501: WHITE | K501: DOWDELL
A503: WILLIAMSTOWN | C503: 3 | D503: 3 | E503: =C503*6+D503 -> 21 | G503: 7 | H503: 5 | I503: =G503*6+H503 -> 47 | K503: 11 | L503: 7 | M503: =K503*6+L503 -> 73 | O503: 13 | P503: 12 | Q503: =O503*6+P503 -> 90 | S503: NORTHCOTE
A504: PRESTON | C504: 2 | D504: 4 | E504: =C504*6+D504 -> 16 | G504: 9 | H504: 6 | I504: =G504*6+H504 -> 60 | K504: 10 | L504: 9 | M504: =K504*6+L504 -> 69 | O504: 12 | P504: 16 | Q504: =O504*6+P504 -> 88 | S504: THOMAS
A505: BEST PLAYERS
A506: WILLIAMSTOWN | C506: SAMPSON | F506: HARLEY | I506: SPRING | L506: CHAPMAN | O506: SANDELLS | R506: WILCOX
A507: PRESTON | C507: LEISHMAN | F507: LEYDEN | I507: CONNELLY | L507: BLACKMAN | O507: GUNNING | R507: BRADLEY
A508: GOALKICKERS
A509: WILLIAMSTOWN | C509: SPRING 4 | F509: TODD 3 | I509: McPHERSON 3 | L509: BERNARD | N509: DOWLING | Q509: BOND
A510: PRESTON | C510: LEYDEN 3 | F510: PRITCHARD 2 | I510: MASLEN 2 | L510: CONROY | N510: BRYCE | P510: EXELBY | R510: GRINDELL | U510: S STEWART
A512: ROUND 10 | D512: 14TH JUNE | H512: WEATHER | K512: NORTH BREEZE FINE | S512: PLAYED AT
D513: 1ST QTR | H513: 2ND QTR | L513: 3RD QTR | P513: FINAL | S513: PORT MELBOURNE
A514: SANDRINGHAM | C514: 1 | D514: 6 | E514: =C514*6+D514 -> 12 | G514: 3 | H514: 9 | I514: =G514*6+H514 -> 27 | K514: 7 | L514: 10 | M514: =K514*6+L514 -> 52 | O514: 11 | P514: 14 | Q514: =O514*6+P514 -> 80 | S514: UMPIRE | X514: LADDER | AA514: ROUND | AD514: 10
A515: PORT MELBOURNE | C515: 4 | D515: 2 | E515: =C515*6+D515 -> 26 | G515: 5 | H515: 5 | I515: =G515*6+H515 -> 35 | K515: 11 | L515: 8 | M515: =K515*6+L515 -> 74 | O515: 11 | P515: 11 | Q515: =O515*6+P515 -> 77 | S515: BARNES
A516: BEST PLAYERS | W516: TEAM | X516: W | Y516: L | Z516: D | AA516: FOR | AB516: AGST | AC516: % | AD516: PTS
A517: SANDRINGHAM | C517: COLLINS | F517: HEADEN | I517: WEBB | K517: GRAMBEAU | N517: SALES | Q517: PATTERSON
A518: PORT MELBOURNE | C518: BUTCHER | F518: MANN | I518: BAKER | K518: LEWIS | N518: FINDLAY | Q518: HAGEN | W518: WILLIAMSTOWN | X518: 8 | Y518: 2 | Z518: 0 | AA518: 1080 | AB518: 902 | AC518: 119.73392461197339 | AD518: 32
A519: GOALKICKERS | W519: SANDRINGHAM | X519: 7 | Y519: 3 | Z519: 0 | AA519: 1137 | AB519: 1052 | AC519: 108.07984790874525 | AD519: 28
A520: SANDRINGHAM | C520: BENCRAFT 3 | F520: TOMLINS 2 | I520: HARPER 2 | K520: BROKENSHIRE | N520: HAGER | P520: COLLINS | R520: PATTERSON | W520: PRAHRAN | X520: 7 | Y520: 3 | Z520: 0 | AA520: 1066 | AB520: 1002 | AC520: 106.38722554890219 | AD520: 28
A521: PORT MELBOURNE | C521: FINDLAY 4 | F521: CULPH 3 | I521: THOMS 2 | K521: THOMPSON | N521: HALL | W521: BRUNSWICK | X521: 6 | Y521: 3 | Z521: 1 | AA521: 1031 | AB521: 934 | AC521: 110.38543897216275 | AD521: 26
A523: BRUNSWICK | C523: 5 | D523: 1 | E523: =C523*6+D523 -> 31 | G523: 8 | H523: 8 | I523: =G523*6+H523 -> 56 | K523: 10 | L523: 16 | M523: =K523*6+L523 -> 76 | O523: 13 | P523: 21 | Q523: =O523*6+P523 -> 99 | S523: BRUNSWICK | W523: PORT MELBOURNE | X523: 6 | Y523: 3 | Z523: 1 | AA523: 1124 | AB523: 1059 | AC523: 106.13786591123701 | AD523: 26
A524: PRESTON | C524: 5 | D524: 4 | E524: =C524*6+D524 -> 34 | G524: 6 | H524: 6 | I524: =G524*6+H524 -> 42 | K524: 7 | L524: 8 | M524: =K524*6+L524 -> 50 | O524: 12 | P524: 10 | Q524: =O524*6+P524 -> 82 | S524: EGAN | W524: COBURG | X524: 5 | Y524: 5 | Z524: 0 | AA524: 1061 | AB524: 935 | AC524: 113.475935828877 | AD524: 20
A525: BEST PLAYERS | W525: CAMBERWELL | X525: 5 | Y525: 5 | Z525: 0 | AA525: 1110 | AB525: 1030 | AC525: 107.76699029126213 | AD525: 20
A526: BRUNSWICK | C526: SMITH | F526: SILK | I526: WHELAN | L526: UPTON | N526: R SHAW | Q526: BAGGOTT | W526: BRIGHTON | X526: 5 | Y526: 5 | Z526: 0 | AA526: 1305 | AB526: 1237 | AC526: 105.49717057396929 | AD526: 20
A527: PRESTON | C527: LEYDEN | F527: BLACKMAN | I527: MASLEN | L527: FITT | N527: S STEWART | Q527: LEISHMAN | W527: OAKLEIGH | X527: 5 | Y527: 5 | Z527: 0 | AA527: 1128 | AB527: 1138 | AC527: 99.121265377855892 | AD527: 20
A528: GOALKICKERS | W528: YARRAVILLE | X528: 2 | Y528: 8 | Z528: 0 | AA528: 1043 | AB528: 1285 | AC528: 81.167315175097272 | AD528: 8
A529: BRUNSWICK | C529: UPTON 5 | F529: BAGGOTT 3 | I529: GEMMELL 2 | L529: SMITH | N529: PRIESTLEY | Q529: TANKARD | W529: PRESTON | X529: 2 | Y529: 8 | Z529: 0 | AA529: 842 | AB529: 1040 | AC529: 80.961538461538467 | AD529: 8
A530: PRESTON | C530: MASLEN 4 | F530: S STEWART 3 | I530: LEYDEN 3 | K530: CONNELLY | M530: PRITCHARD | W530: NORTHCOTE | X530: 1 | Y530: 9 | Z530: 0 | AA530: 718 | AB530: 1031 | AC530: 69.641125121241515 | AD530: 4
E531: 16TH JUNE | I531: STRONG NORTH GALE
A532: WILLIAMSTOWN | C532: 1 | D532: 3 | E532: =C532*6+D532 -> 9 | G532: 7 | H532: 11 | I532: =G532*6+H532 -> 53 | K532: 9 | L532: 12 | M532: =K532*6+L532 -> 66 | O532: 14 | P532: 13 | Q532: =O532*6+P532 -> 97 | S532: WILLIAMSTOWN
A533: BRIGHTON | C533: 3 | D533: 6 | E533: =C533*6+D533 -> 24 | G533: 3 | H533: 8 | I533: =G533*6+H533 -> 26 | K533: 8 | L533: 12 | M533: =K533*6+L533 -> 60 | O533: 11 | P533: 14 | Q533: =O533*6+P533 -> 80 | S533: MERRINGTON
A534: BEST PLAYERS
A535: WILLIAMSTOWN | C535: HARLEY | F535: DOWLING | I535: BERNARD | L535: BOND | N535: WILLIAMS | Q535: CHAPMAN
A536: BRIGHTON | C536: GOLDSMITH | F536: WILLIAMSON | I536: GRATTIDGE | L536: TURNER | N536: BAILEY | Q536: ADAMSON
A537: GOALKICKERS
A538: WILLIAMSTOWN | C538: TODD 6 | F538: SPRING 3 | I538: McRAE 2 | L538: BERNARD | N538: McPHERSON | Q538: BOND
A539: BRIGHTON | C539: DOUGLAS 3 | F539: GOLDSMITH 2 | I539: GRATTIDGE 2 | L539: McINDOE | N539: PINDER | P539: WARBURTON | S539: ROSE
A541: PRAHRAN | C541: 2 | D541: 1 | E541: =C541*6+D541 -> 13 | G541: 6 | H541: 6 | I541: =G541*6+H541 -> 42 | K541: 14 | L541: 7 | M541: =K541*6+L541 -> 91 | O541: 19 | P541: 16 | Q541: =O541*6+P541 -> 130 | S541: TOORAK PARK
A542: OAKLEIGH | C542: 2 | D542: 10 | E542: =C542*6+D542 -> 22 | G542: 5 | H542: 14 | I542: =G542*6+H542 -> 44 | K542: 10 | L542: 18 | M542: =K542*6+L542 -> 78 | O542: 13 | P542: 22 | Q542: =O542*6+P542 -> 100 | S542: SMITHWICK
A543: BEST PLAYERS
A544: PRAHRAN | C544: FERGEUS | F544: MONOHAN | I544: GARVIN | L544: NEWTON | O544: BUTTLING | R544: GROVE
A545: OAKLEIGH | C545: DONNELY | F545: E RYAN | I545: R FINN | L545: POWER | O545: PAY | R545: JORY
A546: GOALKICKERS
A547: PRAHRAN | C547: MONOHAN 6 | F547: FERGEUS 4 | I547: WALSH 3 | K547: BURGESS 2 | N547: GROVE 2 | P547: KYNE | R547: McMAHON
A548: OAKLEIGH | C548: DONNELLY 6 | F548: R FINN 2 | I548: E RYAN 2 | L548: PERKINS 2 | O548: SHEA
A550: CAMBERWELL | C550: 6 | D550: 6 | E550: =C550*6+D550 -> 42 | G550: 6 | H550: 8 | I550: =G550*6+H550 -> 44 | K550: 12 | L550: 20 | M550: =K550*6+L550 -> 92 | O550: 14 | P550: 23 | Q550: =O550*6+P550 -> 107 | S550: CAMBERWELL
A551: YARRAVILLE | C551: 1 | D551: 2 | E551: =C551*6+D551 -> 8 | G551: 7 | H551: 5 | I551: =G551*6+H551 -> 47 | K551: 7 | L551: 5 | M551: =K551*6+L551 -> 47 | O551: 16 | P551: 10 | Q551: =O551*6+P551 -> 106 | S551: McGAW
A552: BEST PLAYERS
A553: CAMBERWELL | C553: HOGAN | F553: McDONALD | I553: BRADFORD | L553: McIVOR | O553: KINDER | R553: BOYALL
A554: YARRAVILLE | C554: SPENCE | F554: HARRIS | I554: SING | L554: GARLICK | O554: GARRICK | R554: HARDIMAN
A555: GOALKICKERS
A556: CAMBERWELL | C556: BRYCE 4 | F556: McDONALD 4 | I556: HOGAN 3 | L556: OLIVER | N556: KINDER | P556: BOYALL
A557: YARRAVILLE | C557: HARRIS 7 | F557: HARDIMAN 2 | I557: PHILLIPS 2 | L557: GARRICK 2 | O557: McASEY 2 | R557: SPENCE
A559: COBURG | C559: 4 | D559: 5 | E559: =C559*6+D559 -> 29 | G559: 11 | H559: 11 | I559: =G559*6+H559 -> 77 | K559: 13 | L559: 12 | M559: =K559*6+L559 -> 90 | O559: 18 | P559: 16 | Q559: =O559*6+P559 -> 124 | S559: NORTHCOTE
A560: NORTHCOTE | C560: 5 | D560: 2 | E560: =C560*6+D560 -> 32 | G560: 6 | H560: 5 | I560: =G560*6+H560 -> 41 | K560: 6 | L560: 13 | M560: =K560*6+L560 -> 49 | O560: 7 | P560: 16 | Q560: =O560*6+P560 -> 58 | S560: THOMAS
A561: BEST PLAYERS
A562: COBURG | C562: JAMES | F562: MILTE | I562: PRENDERGAST | L562: CLAPTON | O562: QUINN | R562: CONDON
A563: NORTHCOTE | C563: WHITE | F563: HISCOX | I563: GREENWOOD | L563: BALDWIN | O563: GREENHAM | R563: CASPAR
A564: GOALKICKERS
A565: COBURG | C565: CLAPTON 5 | F565: QUINN 3 | I565: JAMES 3 | K565: CONDON 2 | N565: CREWTHER 2 | Q565: MILTE 2 | S565: WILSON
A566: NORTHCOTE | C566: WHITE 4 | F566: McINTOSH 2 | I566: GALLAGHER
A568: ROUND 11 | D568: 21ST JUNE | J568: WEATHER | M568: STONG NORTH WEST WIND | S568: PLAYED AT
D569: 1ST QTR | H569: 2ND QTR | L569: 3RD QTR | P569: FINAL | S569: COBURG
A570: COBURG | C570: 1 | D570: 0 | E570: =C570*6+D570 -> 6 | G570: 7 | H570: 9 | I570: =G570*6+H570 -> 51 | K570: 8 | L570: 9 | M570: =K570*6+L570 -> 57 | O570: 15 | P570: 17 | Q570: =O570*6+P570 -> 107 | S570: UMPIRE | X570: LADDER | AA570: ROUND | AD570: 11
A571: PRAHRAN | C571: 3 | D571: 9 | E571: =C571*6+D571 -> 27 | G571: 4 | H571: 15 | I571: =G571*6+H571 -> 39 | K571: 10 | L571: 24 | M571: =K571*6+L571 -> 84 | O571: 11 | P571: 26 | Q571: =O571*6+P571 -> 92 | S571: SMITHWICK
A572: BEST PLAYERS | W572: TEAM | X572: W | Y572: L | Z572: D | AA572: FOR | AB572: AGST | AC572: % | AD572: PTS
A573: COBURG | C573: PROMNITZ | F573: CONDON | I573: PLUMMER | L573: QUINN | N573: STARBUCK | Q573: CLAPTON
A574: PRAHRAN | C574: FERGEUS | F574: GARVIN | I574: WALSH | L574: ROACH | N574: GROVE | Q574: NEWTON | W574: WILLIAMSTOWN | X574: 8 | Y574: 3 | Z574: 0 | AA574: 1168 | AB574: 992 | AC574: 117.74193548387096 | AD574: 32
A575: GOALKICKERS | W575: BRUNSWICK | X575: 7 | Y575: 3 | Z575: 1 | AA575: 1157 | AB575: 1031 | AC575: 112.22114451988361 | AD575: 30
A576: COBURG | C576: CONDON 6 | F576: CLAPTON 3 | I576: WESTCOTT 2 | L576: QUINN 2 | O576: JAMES | Q576: MILTE | W576: PORT MELBOURNE | X576: 7 | Y576: 3 | Z576: 1 | AA576: 1243 | AB576: 1145 | AC576: 108.5589519650655 | AD576: 30
A577: PRAHRAN | C577: WALSH 3 | F577: OPREY 3 | I577: FERGEUS 2 | L577: MONOHAN | O577: BURGESS | Q577: D'OLIVER | W577: SANDRINGHAM | X577: 7 | Y577: 4 | Z577: 0 | AA577: 1237 | AB577: 1155 | AC577: 107.0995670995671 | AD577: 28
A579: CAMBERWELL | C579: 1 | D579: 5 | E579: =C579*6+D579 -> 11 | G579: 6 | H579: 18 | I579: =G579*6+H579 -> 54 | K579: 7 | L579: 21 | M579: =K579*6+L579 -> 63 | O579: 12 | P579: 31 | Q579: =O579*6+P579 -> 103 | S579: BEACH ROAD | W579: PRAHRAN | X579: 7 | Y579: 4 | Z579: 0 | AA579: 1158 | AB579: 1109 | AC579: 104.41839495040577 | AD579: 28
A580: SANDRINGHAM | C580: 6 | D580: 5 | E580: =C580*6+D580 -> 41 | G580: 7 | H580: 6 | I580: =G580*6+H580 -> 48 | K580: 14 | L580: 15 | M580: =K580*6+L580 -> 99 | O580: 14 | P580: 16 | Q580: =O580*6+P580 -> 100 | S580: WRIGHT | W580: COBURG | X580: 6 | Y580: 5 | Z580: 0 | AA580: 1168 | AB580: 1027 | AC580: 113.72930866601753 | AD580: 24
A581: BEST PLAYERS | W581: CAMBERWELL | X581: 6 | Y581: 5 | Z581: 0 | AA581: 1213 | AB581: 1130 | AC581: 107.34513274336283 | AD581: 24
A582: CAMBERWELL | C582: McIVOR | F582: BOYALL | I582: BRISTOWE | L582: BRYCE | N582: BRADFORD | Q582: BOHAN | W582: BRIGHTON | X582: 6 | Y582: 5 | Z582: 0 | AA582: 1413 | AB582: 1321 | AC582: 106.96442089326268 | AD582: 24
A583: SANDRINGHAM | C583: TOYNE | F583: WEBB | I583: O'TOOLE | L583: CERINI | N583: HEADEN | Q583: GRAMBEAU | W583: OAKLEIGH | X583: 6 | Y583: 5 | Z583: 0 | AA583: 1218 | AB583: 1226 | AC583: 99.347471451876018 | AD583: 24
A584: GOALKICKERS | W584: YARRAVILLE | X584: 2 | Y584: 9 | Z584: 0 | AA584: 1140 | AB584: 1411 | AC584: 80.793763288447906 | AD584: 8
A585: CAMBERWELL | C585: BRYCE 3 | E585: HERBERT 2 | H585: BOHAN 2 | J585: BRADFORD 2 | M585: KINDER | O585: McIVOR | W585: PRESTON | X585: 2 | Y585: 9 | Z585: 0 | AA585: 928 | AB585: 1159 | AC585: 80.069025021570326 | AD585: 8
A586: SANDRINGHAM | C586: BROKENSHIRE 3 | F586: TOMLINS 3 | I586: HARPER 3 | K586: COLLINS 2 | M586: HEADEN | O586: CERINI | Q586: BENCRAFT | W586: NORTHCOTE | X586: 1 | Y586: 10 | Z586: 0 | AA586: 802 | AB586: 1139 | AC586: 70.412642669007909 | AD586: 4
A588: BRUNSWICK | C588: 7 | D588: 10 | E588: =C588*6+D588 -> 52 | G588: 8 | H588: 10 | I588: =G588*6+H588 -> 58 | K588: 17 | L588: 16 | M588: =K588*6+L588 -> 118 | O588: 18 | P588: 18 | Q588: =O588*6+P588 -> 126 | S588: YARRAVILLE
A589: YARRAVILLE | C589: 0 | D589: 1 | E589: =C589*6+D589 -> 1 | G589: 8 | H589: 5 | I589: =G589*6+H589 -> 53 | K589: 8 | L589: 6 | M589: =K589*6+L589 -> 54 | O589: 14 | P589: 13 | Q589: =O589*6+P589 -> 97 | S589: BARNES
A590: BEST PLAYERS
A591: BRUNSWICK | C591: SMITH | F591: BAGGOTT | I591: GENNILL | L591: CROUCH | O591: STANLEY | R591: POWELL
A592: YARRAVILLE | C592: HARRIS | F592: HARDIMAN | I592: WATKINS | L592: MALBON | O592: SING | R592: SPENCE
A593: GOALKICKERS
A594: BRUNSWICK | C594: BAGGOTT 5 | F594: STANLEY 3 | I594: CROUCH 2 | L594: GEMMILL 2 | O594: POWELL 2 | Q594: CAPUANO | T594: UPTON | W594: CHALLENGER | X594: SILK
A595: YARRAVILLE | C595: HARRIS 4 | F595: MERRICK 2 | I595: FAIRFULL 2 | L595: MITCHELL 2 | O595: SAIT | Q595: HARDIMAN | T595: GARRICK | W595: McASEY
A597: BRIGHTON | C597: 7 | D597: 11 | E597: =C597*6+D597 -> 53 | G597: 7 | H597: 13 | I597: =G597*6+H597 -> 55 | K597: 13 | L597: 17 | M597: =K597*6+L597 -> 95 | O597: 15 | P597: 18 | Q597: =O597*6+P597 -> 108 | S597: ELSTERNWICK PARK
A598: NORTHCOTE | C598: 0 | D598: 1 | E598: =C598*6+D598 -> 1 | G598: 5 | H598: 11 | I598: =G598*6+H598 -> 41 | K598: 8 | L598: 12 | M598: =K598*6+L598 -> 60 | O598: 11 | P598: 18 | Q598: =O598*6+P598 -> 84 | S598: EGAN
A599: BEST PLAYERS
A600: BRIGHTON | C600: DOUGLAS | F600: HALL | I600: GRATTIDGE | L600: TURNER | N600: HEIMS | Q600: BAILEY
A601: NORTHCOTE | C601: ARMOUR | F601: GREENWOOD | I601: GALLAGHER | L601: HINES | N601: HISCOX | Q601: McINTOSH
A602: GOALKICKERS
A603: BRIGHTON | C603: DOUGLAS 5 | F603: RICHARDSON 3 | I603: WARBURTON 2 | L603: ADAMSON 2 | O603: HEIMS | Q603: ROSE | S603: GRATTIDGE
A604: NORTHCOTE | C604: ARMOUR 5 | F604: McINTOSH 2 | I604: BALDWIN | L604: DOWDELL | N604: GALLAGHER | Q604: MALONE
A606: PORT MELBOURNE | C606: 9 | D606: 6 | E606: =C606*6+D606 -> 60 | G606: 10 | H606: 7 | I606: =G606*6+H606 -> 67 | K606: 17 | L606: 10 | M606: =K606*6+L606 -> 112 | O606: 18 | P606: 11 | Q606: =O606*6+P606 -> 119 | S606: PRESTON
A607: PRESTON | C607: 2 | D607: 0 | E607: =C607*6+D607 -> 12 | G607: 8 | H607: 5 | I607: =G607*6+H607 -> 53 | K607: 8 | L607: 5 | M607: =K607*6+L607 -> 53 | O607: 12 | P607: 14 | Q607: =O607*6+P607 -> 86 | S607: MERRINGTON
A608: BEST PLAYERS
A609: PORT MELBOURNE | C609: FINDLAY | F609: BUTCHER | I609: MENZIES | L609: TREMBATH | O609: HOUSTON | R609: LOCK
A610: PRESTON | C610: CONROY | F610: BRYCE | I610: HINDS | L610: S STEWART | O610: BLACKMAN | R610: DUNSTAN
A611: GOALKICKERS
A612: PORT MELBOURNE | C612: FINDLAY 6 | F612: CULPH 4 | I612: THOMS 3 | K612: HOUSTON 2 | N612: MENZIES | P612: TREMBATH | S612: SNELL
A613: PRESTON | C613: BRYCE 6 | F613: LEYDEN 2 | I613: MASLEN | K613: DUNSTAN | N613: GOLDIN | P613: GRINDELL
A615: OAKLEIGH | C615: 2 | D615: 3 | E615: =C615*6+D615 -> 15 | G615: 4 | H615: 9 | I615: =G615*6+H615 -> 33 | K615: 5 | L615: 12 | M615: =K615*6+L615 -> 42 | O615: 12 | P615: 18 | Q615: =O615*6+P615 -> 90 | S615: OAKLEIGH
A616: WILLIAMSTOWN | C616: 3 | D616: 4 | E616: =C616*6+D616 -> 22 | G616: 5 | H616: 10 | I616: =G616*6+H616 -> 40 | K616: 8 | L616: 15 | M616: =K616*6+L616 -> 63 | O616: 12 | P616: 16 | Q616: =O616*6+P616 -> 88 | S616: McGAW
A617: BEST PLAYERS
A618: OAKLEIGH | C618: JORY | F618: GRAY | I618: WILSON | L618: BAXTER | O618: E RYAN | R618: O'DONOGHUE
A619: WILLIAMSTOWN | C619: CAMERON | F619: HARLEY | I619: WILLIAMS | L619: PEACOCK | O619: DOWLING | R619: SAMPSON
A620: GOALKICKERS
A621: OAKLEIGH | C621: DONNELLY 4 | F621: MERRIMAN 3 | I621: R FINN 2 | K621: O'DONOGHUE | N621: ANDREW | P621: POWER
A622: WILLIAMSTOWN | C622: TODD 4 | F622: DOWLING 3 | I622: McPHERSON 3 | L622: PEACOCK 2
A624: ROUND 12 | D624: 28TH JUNE | J624: WEATHER | M624: WEST BREEZE FINE | S624: PLAYED AT
D625: 1ST QTR | H625: 2ND QTR | L625: 3RD QTR | P625: FINAL | S625: TOORAK PARK
A626: PRAHRAN | C626: 4 | D626: 6 | E626: =C626*6+D626 -> 30 | G626: 8 | H626: 10 | I626: =G626*6+H626 -> 58 | K626: 13 | L626: 17 | M626: =K626*6+L626 -> 95 | O626: 18 | P626: 19 | Q626: =O626*6+P626 -> 127 | S626: UMPIRE | X626: LADDER | AA626: ROUND | AD626: 12
A627: PORT MELBOURNE | C627: 4 | D627: 1 | E627: =C627*6+D627 -> 25 | G627: 9 | H627: 6 | I627: =G627*6+H627 -> 60 | K627: 10 | L627: 9 | M627: =K627*6+L627 -> 69 | O627: 15 | P627: 15 | Q627: =O627*6+P627 -> 105 | S627: MERRINGTON
A628: BEST PLAYERS | W628: TEAM | X628: W | Y628: L | Z628: D | AA628: FOR | AB628: AGST | AC628: % | AD628: PTS
A629: PRAHRAN | C629: SPRIGGS | F629: FERGEUS | I629: BOURKE | L629: GARVIN | N629: MORROW | Q629: WALSH
A630: PORT MELBOURNE | C630: THOMS | F630: FINDLAY | I630: HOUSTON | L630: WALSH | N630: BAKER | Q630: BUTCHER | W630: WILLIAMSTOWN | X630: 9 | Y630: 3 | Z630: 0 | AA630: 1285 | AB630: 1073 | AC630: 119.75768872320596 | AD630: 36
A631: GOALKICKERS | W631: BRUNSWICK | X631: 8 | Y631: 3 | Z631: 1 | AA631: 1253 | AB631: 1113 | AC631: 112.57861635220125 | AD631: 34
A632: PRAHRAN | C632: WALSH 5 | E632: OPREY 5 | G632: MORROW 2 | J632: BURGESS 2 | M632: MONOHAN 2 | P632: O'DONNELL | R632: GARVIN | W632: PRAHRAN | X632: 8 | Y632: 4 | Z632: 0 | AA632: 1285 | AB632: 1214 | AC632: 105.85 | AD632: 32
A633: PORT MELBOURNE | C633: THOMS 5 | F633: CULPH 5 | I633: FINDLAY 4 | L633: STEEL | W633: PORT MELBOURNE | X633: 7 | Y633: 4 | Z633: 1 | AA633: 1348 | AB633: 1272 | AC633: 105.97 | AD633: 30
A635: BRUNSWICK | C635: 3 | D635: 2 | E635: =C635*6+D635 -> 20 | G635: 10 | H635: 4 | I635: =G635*6+H635 -> 64 | K635: 12 | L635: 7 | M635: =K635*6+L635 -> 79 | O635: 14 | P635: 12 | Q635: =O635*6+P635 -> 96 | S635: COBURG | W635: CAMBERWELL | X635: 7 | Y635: 5 | Z635: 0 | AA635: 1346 | AB635: 1222 | AC635: 110.14729950900164 | AD635: 28
A636: COBURG | C636: 4 | D636: 1 | E636: =C636*6+D636 -> 25 | G636: 6 | H636: 1 | I636: =G636*6+H636 -> 37 | K636: 12 | L636: 3 | M636: =K636*6+L636 -> 75 | O636: 13 | P636: 4 | Q636: =O636*6+P636 -> 82 | S636: McGAW | W636: BRIGHTON | X636: 7 | Y636: 5 | Z636: 0 | AA636: 1548 | AB636: 1427 | AC636: 108.47932725998598 | AD636: 28
A637: BEST PLAYERS | W637: SANDRINGHAM | X637: 7 | Y637: 5 | Z637: 0 | AA637: 1343 | AB637: 1290 | AC637: 104.10852713178295 | AD637: 28
A638: BRUNSWICK | C638: BAGGOTT | F638: CROUCH | I638: SMITH | L638: UPTON | N638: PRIESTLEY | Q638: GLASSCOTT | W638: COBURG | X638: 6 | Y638: 6 | Z638: 0 | AA638: 1250 | AB638: 1123 | AC638: 111.30899376669635 | AD638: 24
A639: COBURG | C639: QUINN | F639: PRENDERGAST | I639: MILTE | L639: CLAPTON | N639: JAMES | Q639: WALKER | W639: OAKLEIGH | X639: 6 | Y639: 6 | Z639: 0 | AA639: 1310 | AB639: 1359 | AC639: 96.3944076526858 | AD639: 24
A640: GOALKICKERS | W640: PRESTON | X640: 2 | Y640: 10 | Z640: 0 | AA640: 995 | AB640: 1228 | AC640: 81.026058631921828 | AD640: 8
A641: BRUNSWICK | C641: CROUCH 5 | F641: UPTON 3 | I641: PRIESTLEY 2 | L641: SMITH | N641: POWELL | P641: HENRYS | R641: STANLEY | W641: YARRAVILLE | X641: 2 | Y641: 10 | Z641: 0 | AA641: 1221 | AB641: 1528 | AC641: 79.90837696335079 | AD641: 8
A642: COBURG | C642: WILKINSON 3 | F642: JAMES 3 | I642: QUINN 2 | K642: CLAPTON 2 | N642: PRENDERGAST | Q642: MILTE | S642: McILVEEN | W642: NORTHCOTE | X642: 2 | Y642: 10 | Z642: 0 | AA642: 871 | AB642: 1206 | AC642: 72.222222222222229 | AD642: 8
A644: BRIGHTON | C644: 5 | D644: 9 | E644: =C644*6+D644 -> 39 | G644: 7 | H644: 14 | I644: =G644*6+H644 -> 56 | K644: 11 | L644: 22 | M644: =K644*6+L644 -> 88 | O644: 18 | P644: 27 | Q644: =O644*6+P644 -> 135 | S644: BEACH ROAD
A645: SANDRINGHAM | C645: 3 | D645: 2 | E645: =C645*6+D645 -> 20 | G645: 9 | H645: 3 | I645: =G645*6+H645 -> 57 | K645: 11 | L645: 8 | M645: =K645*6+L645 -> 74 | O645: 16 | P645: 10 | Q645: =O645*6+P645 -> 106 | S645: EGAN
A646: BEST PLAYERS
A647: BRIGHTON | C647: WILLIAMSON | F647: DOUGLAS | I647: WARBURTON | L647: BAILEY | N647: CRAVEN | Q647: McINDOE
A648: SANDRINGHAM | C648: TOYNE | F648: TOMLINS | I648: BROKENSHIRE | L648: PATTERSON | N648: COLLINS | Q648: BENCRAFT
A649: GOALKICKERS
A650: BRIGHTON | C650: WARBURTON 6 | F650: DOUGLAS 5 | I650: McINDOE 3 | L650: ADAMSON 2 | O650: GRATTIDGE | R650: HEIMS
A651: SANDRINGHAM | C651: BROKENSHIRE 6 | F651: TOMLINS 3 | I651: COLLINS 2 | L651: CREINI | N651: PARKER | P651: PATTERSON | S651: BENCRAFT | V651: HARPER
A653: CAMBERWELL | C653: 3 | D653: 7 | E653: =C653*6+D653 -> 25 | G653: 5 | H653: 11 | I653: =G653*6+H653 -> 41 | K653: 14 | L653: 18 | M653: =K653*6+L653 -> 102 | O653: 18 | P653: 25 | Q653: =O653*6+P653 -> 133 | S653: OAKLEIGH
A654: OAKLEIGH | C654: 3 | D654: 4 | E654: =C654*6+D654 -> 22 | G654: 3 | H654: 11 | I654: =G654*6+H654 -> 29 | K654: 7 | L654: 16 | M654: =K654*6+L654 -> 58 | O654: 11 | P654: 26 | Q654: =O654*6+P654 -> 92 | S654: LEE
A655: BEST PLAYERS
A656: CAMBERWELL | C656: OLIVER | F656: McIVOR | I656: BRADFORD | L656: STYLES | N656: NAISMITH | Q656: BOYALL
A657: OAKLEIGH | C657: HARRISON | F657: WILSON | I657: GRAY | L657: JORY | N657: TEMME | Q657: ANDREW
A658: GOALKICKERS
A659: CAMBERWELL | C659: BRYCE 6 | F659: BRADFORD 4 | I659: BOHAN 3 | K659: BOYALL 2 | M659: MCDONALD 2 | P659: OLIVER
A660: OAKLEIGH | C660: E RYAN 4 | F660: DONNELLY 3 | I660: JORY | K660: ANDREW | M660: O'DONOGHUE | P660: BAXTER
A662: NORTHCOTE | C662: 5 | D662: 1 | E662: =C662*6+D662 -> 31 | G662: 7 | H662: 5 | I662: =G662*6+H662 -> 47 | K662: 7 | L662: 7 | M662: =K662*6+L662 -> 49 | O662: 10 | P662: 9 | Q662: =O662*6+P662 -> 69 | S662: NORTHCOTE
A663: PRESTON | C663: 5 | D663: 5 | E663: =C663*6+D663 -> 35 | G663: 5 | H663: 9 | I663: =G663*6+H663 -> 39 | K663: 6 | L663: 14 | M663: =K663*6+L663 -> 50 | O663: 8 | P663: 19 | Q663: =O663*6+P663 -> 67 | S663: WRIGHT
A664: BEST PLAYERS
A665: NORTHCOTE | C665: HISCOX | F665: ARMOUR | I665: CASPAR | L665: BALDWIN | O665: DON KING | R665: DOWDELL
A666: PRESTON | C666: LEYDEN | F666: MASLEN | I666: HINDS | L666: LEISHMAN | O666: DUNSTAN | R666: FITT
A667: GOALKICKERS
A668: NORTHCOTE | C668: GALLAGHER 4 | F668: ARMOUR 3 | I668: WHITE | K668: DOWDELL | M668: BALDWIN
A669: PRESTON | C669: LEYDEN 4 | F669: BRYCE 3 | I669: HARRISON
A671: WILLIAMSTOWN | C671: 3 | D671: 2 | E671: =C671*6+D671 -> 20 | G671: 9 | H671: 5 | I671: =G671*6+H671 -> 59 | K671: 11 | L671: 7 | M671: =K671*6+L671 -> 73 | O671: 17 | P671: 15 | Q671: =O671*6+P671 -> 117 | S671: WILLIAMSTOWN
A672: YARRAVILLE | C672: 6 | D672: 1 | E672: =C672*6+D672 -> 37 | G672: 7 | H672: 3 | I672: =G672*6+H672 -> 45 | K672: 12 | L672: 6 | M672: =K672*6+L672 -> 78 | O672: 12 | P672: 9 | Q672: =O672*6+P672 -> 81 | S672: BARNES
A673: BEST PLAYERS
A674: WILLIAMSTOWN | C674: EVANS | F674: SAMPSON | I674: WILLIAMS | L674: NELSON | O674: DOWLING | R674: SALVAS
A675: YARRAVILLE | C675: HARDIMAN | F675: GARRICK | I675: SPENCE | L675: SAIT | O675: PHILLIPS | R675: SCARFFE
A676: GOALKICKERS
A677: WILLIAMSTOWN | C677: DOWLING 5 | F677: PEACOCK 3 | I677: TODD 2 | K677: McRAE 2 | M677: SPRING 2 | O677: WILLIAMS | Q677: McPHERSON | T677: SANDELLS
A678: YARRAVILLE | C678: PHILLIPS 3 | F678: SPENCE 3 | I678: MCASEY 2 | L678: MITCHELL | N678: MERRICK | P678: SCARFFE | R678: HARRIS
A680: ROUND 13 | D680: 5TH JULY | J680: WEATHER | M680: WEST BREEZE FINE | S680: PLAYED AT
D681: 1ST QTR | H681: 2ND QTR | L681: 3RD QTR | P681: FINAL | S681: BRUNSWICK
A682: PRAHRAN | C682: 1 | D682: 0 | E682: =C682*6+D682 -> 6 | G682: 7 | H682: 4 | I682: =G682*6+H682 -> 46 | K682: 8 | L682: 6 | M682: =K682*6+L682 -> 54 | O682: 14 | P682: 12 | Q682: =O682*6+P682 -> 96 | S682: UMPIRE | X682: LADDER | AB682: ROUND | AD682: 13
A683: BRUNSWICK | C683: 1 | D683: 8 | E683: =C683*6+D683 -> 14 | G683: 3 | H683: 9 | I683: =G683*6+H683 -> 27 | K683: 10 | L683: 16 | M683: =K683*6+L683 -> 76 | O683: 11 | P683: 19 | Q683: =O683*6+P683 -> 85 | S683: McGAW
A684: BEST PLAYERS | W684: TEAM | X684: W | Y684: L | Z684: D | AA684: FOR | AB684: AGST | AC684: % | AD684: PTS
A685: PRAHRAN | C685: OPREY | F685: NEWTON | I685: FERGEUS | L685: ROACH | N685: BUTTLING | Q685: HOGAN
A686: BRUNSWICK | C686: PRIESTLEY | F686: UPTON | I686: BAGGOTT | L686: R SHAW | N686: STANLEY | Q686: BRADLEY | W686: WILLIAMSTOWN | X686: 10 | Y686: 3 | Z686: 0 | AA686: 1361 | AB686: 1136 | AC686: 119.80633802816901 | AD686: 40
A687: GOALKICKERS | W687: PRAHRAN | X687: 9 | Y687: 4 | Z687: 0 | AA687: 1381 | AB687: 1299 | AC687: 106.31 | AD687: 36
A688: PRAHRAN | C688: OPREY 5 | E688: WALSH 2 | G688: MCMAHON 2 | J688: MONOHAN 2 | M688: KYNE | N688: O'DONNELL | Q688: BURGESS | W688: BRUNSWICK | X688: 8 | Y688: 4 | Z688: 1 | AA688: 1338 | AB688: 1209 | AC688: 110.66997518610422 | AD688: 34
A689: BRUNSWICK | C689: PRIESTLEY 3 | F689: BAGGOTT 3 | I689: STANLEY 3 | L689: CROUCH | N689: UPTON | W689: PORT MELBOURNE | X689: 8 | Y689: 4 | Z689: 1 | AA689: 1482 | AB689: 1352 | AC689: 109.62 | AD689: 34
A691: WILLIAMSTOWN | C691: 2 | D691: 5 | E691: =C691*6+D691 -> 17 | G691: 5 | H691: 8 | I691: =G691*6+H691 -> 38 | K691: 7 | L691: 11 | M691: =K691*6+L691 -> 53 | O691: 10 | P691: 16 | Q691: =O691*6+P691 -> 76 | S691: CAMBERWELL | W691: BRIGHTON | X691: 8 | Y691: 5 | Z691: 0 | AA691: 1644 | AB691: 1504 | AC691: 109.30851063829788 | AD691: 32
A692: CAMBERWELL | C692: 2 | D692: 1 | E692: =C692*6+D692 -> 13 | G692: 7 | H692: 6 | I692: =G692*6+H692 -> 48 | K692: 8 | L692: 8 | M692: =K692*6+L692 -> 56 | O692: 9 | P692: 9 | Q692: =O692*6+P692 -> 63 | S692: WRIGHT | W692: SANDRINGHAM | X692: 8 | Y692: 5 | Z692: 0 | AA692: 1449 | AB692: 1333 | AC692: 108.70217554388597 | AD692: 32
A693: BEST PLAYERS | W693: CAMBERWELL | X693: 7 | Y693: 6 | Z693: 0 | AA693: 1409 | AB693: 1298 | AC693: 108.55161787365178 | AD693: 28
A694: WILLIAMSTOWN | C694: FEATHERBY | F694: MATTHEWS | I694: WILLIAMS | L694: TODD | N694: WILCOX | Q694: McPHERSON | W694: COBURG | X694: 6 | Y694: 7 | Z694: 0 | AA694: 1327 | AB694: 1219 | AC694: 108.8597210828548 | AD694: 24
A695: CAMBERWELL | C695: BRADFORD | F695: BOYALL | I695: BOHAN | L695: NAISMITH | N695: SEELENMEYER | Q695: HERBERT | W695: OAKLEIGH | X695: 6 | Y695: 7 | Z695: 0 | AA695: 1389 | AB695: 1441 | AC695: 96.391394864677309 | AD695: 24
A696: GOALKICKERS | W696: PRESTON | X696: 3 | Y696: 10 | Z696: 0 | AA696: 1077 | AB696: 1307 | AC696: 82.402448355011472 | AD696: 12
A697: WILLIAMSTOWN | C697: McPHERSON 3 | F697: PEACOCK 2 | I697: DOWLING 2 | L697: TODD | N697: McRAE | P697: SPRING | W697: YARRAVILLE | X697: 2 | Y697: 11 | Z697: 0 | AA697: 1264 | AB697: 1634 | AC697: 77.356181150550796 | AD697: 8
A698: CAMBERWELL | C698: BRADFORD 2 | F698: MCDONALD 2 | I698: HERBERT | K698: HOGAN | M698: CAMPBELL | O698: STYLES | Q698: BRISTOWE | W698: NORTHCOTE | X698: 2 | Y698: 11 | Z698: 0 | AA698: 951 | AB698: 1340 | AC698: 70.97014925373135 | AD698: 8
A700: BRIGHTON | C700: 4 | D700: 4 | E700: =C700*6+D700 -> 28 | G700: 7 | H700: 14 | I700: =G700*6+H700 -> 56 | K700: 9 | L700: 22 | M700: =K700*6+L700 -> 76 | O700: 12 | P700: 24 | Q700: =O700*6+P700 -> 96 | S700: ELSTERNWICK PARK
A701: COBURG | C701: 5 | D701: 3 | E701: =C701*6+D701 -> 33 | G701: 7 | H701: 6 | I701: =G701*6+H701 -> 48 | K701: 8 | L701: 9 | M701: =K701*6+L701 -> 57 | O701: 11 | P701: 11 | Q701: =O701*6+P701 -> 77 | S701: MERRINGTON
A702: BEST PLAYERS
A703: BRIGHTON | C703: HEIMS | F703: WILLIAMSON | I703: TURNER | L703: NEW | N703: ADAMSON | Q703: McINDOE
A704: COBURG | C704: GILBERT | F704: ROGAN | I704: LONSDALE | L704: DEMPSEY | N704: CONDON | Q704: McILVEEN
A705: GOALKICKERS
A706: BRIGHTON | C706: McINDOE 5 | F706: HALL 2 | I706: DOUGLAS 2 | L706: WARBURTON | O706: NEW | Q706: ADAMSON
A707: COBURG | C707: JAMES 4 | F707: CONDON 2 | I707: MILTE 2 | L707: QUINN | N707: CREWTHER | Q707: WESTCOTT
A709: PRESTON | C709: 2 | D709: 2 | E709: =C709*6+D709 -> 14 | G709: 6 | H709: 8 | I709: =G709*6+H709 -> 44 | K709: 8 | L709: 12 | M709: =K709*6+L709 -> 60 | O709: 11 | P709: 16 | Q709: =O709*6+P709 -> 82 | S709: PRESTON
A710: OAKLEIGH | C710: 4 | D710: 6 | E710: =C710*6+D710 -> 30 | G710: 5 | H710: 12 | I710: =G710*6+H710 -> 42 | K710: 7 | L710: 15 | M710: =K710*6+L710 -> 57 | O710: 10 | P710: 19 | Q710: =O710*6+P710 -> 79 | S710: BARNES
A711: BEST PLAYERS
A712: PRESTON | C712: FITT | E712: BLACKMAN | I712: LEISHMAN | L712: LEYDEN | N712: GOLDIN | Q712: EXELBY
A713: OAKLEIGH | C713: POWER | E713: E RYAN | I713: R FINN | L713: JORY | N713: KELLY | Q713: WILSON
A714: GOALKICKERS
A715: PRESTON | C715: LEYDEN 2 | F715: McCARTHY 2 | I715: GRINDALL 2 | L715: POTTER 2 | N715: FITT 2 | P715: CONNELLY
A716: OAKLEIGH | C716: ANDREW 2 | F716: R FINN 2 | I716: POWER 2 | K716: E RYAN | M716: DONNELLY | O716: O'DONOGHUE | R716: KELLY
A718: SANDRINGHAM | C718: 3 | D718: 4 | E718: =C718*6+D718 -> 22 | G718: 7 | H718: 7 | I718: =G718*6+H718 -> 49 | K718: 9 | L718: 10 | M718: =K718*6+L718 -> 64 | O718: 14 | P718: 22 | Q718: =O718*6+P718 -> 106 | S718: YARRAVILLE
A719: YARRAVILLE | C719: 1 | D719: 2 | E719: =C719*6+D719 -> 8 | G719: 3 | H719: 5 | I719: =G719*6+H719 -> 23 | K719: 4 | L719: 7 | M719: =K719*6+L719 -> 31 | O719: 5 | P719: 13 | Q719: =O719*6+P719 -> 43 | S719: EGAN
A720: BEST PLAYERS
A721: SANDRINGHAM | C721: PATTERSON | F721: TOMLINS | I721: SALES | L721: TOYNE | N721: ANDERS | Q721: IRVING
A722: YARRAVILLE | C722: ELDRIDGE | F722: SPENCE | I722: GARLICK | L722: HARRIS | N722: JACKSON | Q722: FAIRFULL
A723: GOALKICKERS
A724: SANDRINGHAM | C724: BROKENSHIRE 3 | F724: HAGER 3 | I724: ANDERS 3 | K724: BENCRAFT 2 | N724: PATTERSON | Q724: CERINI | S724: HEADEN
A725: YARRAVILLE | C725: PHILLIPS 2 | F725: SPENCE 2 | I725: HARRIS
A727: PORT MELBOURNE | C727: 4 | D727: 3 | E727: =C727*6+D727 -> 27 | G727: 13 | H727: 9 | I727: =G727*6+H727 -> 87 | K727: 15 | L727: 11 | M727: =K727*6+L727 -> 101 | O727: 20 | P727: 14 | Q727: =O727*6+P727 -> 134 | S727: PORT MELBOURNE
A728: NORTHCOTE | C728: 5 | D728: 5 | E728: =C728*6+D728 -> 35 | G728: 5 | H728: 5 | I728: =G728*6+H728 -> 35 | K728: 11 | L728: 7 | M728: =K728*6+L728 -> 73 | O728: 12 | P728: 8 | Q728: =O728*6+P728 -> 80 | S728: LEE
A729: BEST PLAYERS
A730: PORT MELBOURNE | C730: FINDLAY | F730: MENZIES | I730: LEWIS | K730: HOUSTON | N730: WALSH | Q730: THOMS
A731: NORTHCOTE | C731: BALDWIN | F731: ARMOUR | I731: WHITE | K731: CASPAR | N731: ATKINSON | Q731: DES KING
A732: GOALKICKERS
A733: PORT MELBOURNE | C733: FINDLAY 8 | F733: HOUSTON 4 | I733: CULPH 2 | K733: THOMS 2 | M733: LEWIS 2 | O733: MURPHY | Q733: MENZIES
A734: NORTHCOTE | C734: ARMOUR 5 | F734: PETRIE | H734: WHITE | J734: DOWDELL | M734: CASPAR | O734: BALDWIN | Q734: McINTOSH | T734: WOOLNOUGH
A736: ROUND 14 | D736: 12TH JULY | J736: WEATHER | M736: STRONG NORTH WEST WIND | S736: PLAYED AT
D737: 1ST QTR | H737: 2ND QTR | L737: 3RD QTR | P737: FINAL | S737: PORT MELBOURNE
A738: PORT MELBOURNE | C738: 7 | D738: 4 | E738: =C738*6+D738 -> 46 | G738: 8 | H738: 6 | I738: =G738*6+H738 -> 54 | K738: 13 | L738: 10 | M738: =K738*6+L738 -> 88 | O738: 14 | P738: 11 | Q738: =O738*6+P738 -> 95 | S738: UMPIRE | X738: LADDER | AB738: ROUND | AD738: 14
A739: BRIGHTON | C739: 1 | D739: 4 | E739: =C739*6+D739 -> 10 | G739: 6 | H739: 10 | I739: =G739*6+H739 -> 46 | K739: 6 | L739: 12 | M739: =K739*6+L739 -> 48 | O739: 7 | P739: 17 | Q739: =O739*6+P739 -> 59 | S739: BARNES
A740: BEST PLAYERS | W740: TEAM | X740: W | Y740: L | Z740: D | AA740: FOR | AB740: AGST | AC740: % | AD740: PTS
A741: PORT MELBOURNE | C741: FINDLAY | F741: THOMS | I741: LEWIS | K741: CULPH | N741: HOUSTON | Q741: STEEL
A742: BRIGHTON | C742: McINDOE | F742: HEIMS | I742: TURNER | K742: WILLIAMSON | N742: BIBBY | Q742: HALL | W742: WILLIAMSTOWN | X742: 11 | Y742: 3 | Z742: 0 | AA742: 1455 | AB742: 1219 | AC742: 119.36013125512716 | AD742: 44
A743: GOALKICKERS | W743: PORT MELBOURNE | X743: 9 | Y743: 4 | Z743: 1 | AA743: 1577 | AB743: 1411 | AC743: 111.76 | AD743: 38
A744: PORT MELBOURNE | C744: LEWIS 3 | F744: CULPH 3 | I744: HOUSTON 3 | L744: FINDLAY 3 | N744: THOMS 2 | W744: BRUNSWICK | X744: 9 | Y744: 4 | Z744: 1 | AA744: 1412 | AB744: 1258 | AC744: 112.241653418124 | AD744: 38
A745: BRIGHTON | C745: WARBURTON 4 | F745: ADAMSON | I745: McINDOE | L745: HALL | W745: SANDRINGHAM | X745: 9 | Y745: 5 | Z745: 0 | AA745: 1532 | AB745: 1410 | AC745: 108.65248226950355 | AD745: 36
A747: CAMBERWELL | C747: 4 | D747: 8 | E747: =C747*6+D747 -> 32 | G747: 4 | H747: 9 | I747: =G747*6+H747 -> 33 | K747: 11 | L747: 21 | M747: =K747*6+L747 -> 87 | O747: 13 | P747: 23 | Q747: =O747*6+P747 -> 101 | S747: CAMBERWELL | W747: PRAHRAN | X747: 9 | Y747: 5 | Z747: 0 | AA747: 1451 | AB747: 1389 | AC747: 104.46 | AD747: 36
A748: COBURG | C748: 3 | D748: 3 | E748: =C748*6+D748 -> 21 | G748: 5 | H748: 15 | I748: =G748*6+H748 -> 45 | K748: 7 | L748: 15 | M748: =K748*6+L748 -> 57 | O748: 10 | P748: 16 | Q748: =O748*6+P748 -> 76 | S748: EGAN | W748: CAMBERWELL | X748: 8 | Y748: 6 | Z748: 0 | AA748: 1510 | AB748: 1374 | AC748: 109.8981077147016 | AD748: 32
A749: BEST PLAYERS | W749: BRIGHTON | X749: 8 | Y749: 6 | Z749: 0 | AA749: 1703 | AB749: 1599 | AC749: 106.5040650406504 | AD749: 32
A750: CAMBERWELL | C750: McDONALD | F750: BOHAN | I750: McIVOR | K750: DEMPSTER | N750: BOYALL | Q750: JENSEN | W750: COBURG | X750: 6 | Y750: 8 | Z750: 0 | AA750: 1403 | AB750: 1320 | AC750: 106.28787878787878 | AD750: 24
A751: COBURG | C751: ROGAN | F751: McILVEEN | I751: PRENDERGAST | L751: PROMNITZ | N751: STARBUCK | Q751: WALKER | W751: OAKLEIGH | X751: 6 | Y751: 8 | Z751: 0 | AA751: 1438 | AB751: 1515 | AC751: 94.917491749174914 | AD751: 24
A752: GOALKICKERS | W752: PRESTON | X752: 3 | Y752: 11 | Z752: 0 | AA752: 1154 | AB752: 1390 | AC752: 83.021582733812949 | AD752: 12
A753: CAMBERWELL | C753: McDONALD 5 | F753: JENSEN 2 | I753: HOGAN 2 | K753: BOYALL | M753: BOHAN | O753: OLIVER | Q753: KINDER | W753: YARRAVILLE | X753: 3 | Y753: 11 | Z753: 0 | AA753: 1354 | AB753: 1704 | AC753: 79.460093896713616 | AD753: 12
A754: COBURG | C754: JORGENSON 3 | F754: ROGAN | H754: JAMES | J754: MILTE | L754: MCILVEEN | N754: WALSH | P754: WESTCOTT | R754: PRENDERGAST | W754: NORTHCOTE | X754: 2 | Y754: 12 | Z754: 0 | AA754: 1034 | AB754: 1434 | AC754: 72.105997210599725 | AD754: 8
A756: BRUNSWICK | C756: 3 | D756: 3 | E756: =C756*6+D756 -> 21 | G756: 7 | H756: 5 | I756: =G756*6+H756 -> 47 | K756: 9 | L756: 10 | M756: =K756*6+L756 -> 64 | O756: 10 | P756: 14 | Q756: =O756*6+P756 -> 74 | S756: BRUNSWICK
A757: OAKLEIGH | C757: 1 | D757: 3 | E757: =C757*6+D757 -> 9 | G757: 2 | H757: 7 | I757: =G757*6+H757 -> 19 | K757: 5 | L757: 11 | M757: =K757*6+L757 -> 41 | O757: 6 | P757: 13 | Q757: =O757*6+P757 -> 49 | S757: THOMAS
A758: BEST PLAYERS
A759: BRUNSWICK | C759: SMITH | F759: WHELAN | I759: UPTON | K759: CHALLENGER | N759: MATHERS | Q759: GLASSCOTT
A760: OAKLEIGH | C760: SANDAY | F760: WILSON | I760: KELLY | K760: WEISS | N760: HARRISON | Q760: BAXTER
A761: GOALKICKERS
A762: BRUNSWICK | C762: UPTON 3 | F762: STANLEY 3 | I762: R SHAW | K762: POWELL | M762: WELDON | O762: WHELAN
A763: OAKLEIGH | C763: BEARD 2 | F763: KELLY 2 | I763: R FINN | K763: POWER
A765: SANDRINGHAM | C765: 4 | D765: 5 | E765: =C765*6+D765 -> 29 | G765: 4 | H765: 7 | I765: =G765*6+H765 -> 31 | K765: 9 | L765: 17 | M765: =K765*6+L765 -> 71 | O765: 11 | P765: 17 | Q765: =O765*6+P765 -> 83 | S765: BEACH ROAD
A766: PRESTON | C766: 1 | D766: 1 | E766: =C766*6+D766 -> 7 | G766: 6 | H766: 7 | I766: =G766*6+H766 -> 43 | K766: 7 | L766: 7 | M766: =K766*6+L766 -> 49 | O766: 11 | P766: 11 | Q766: =O766*6+P766 -> 77 | S766: McGAW
A767: BEST PLAYERS
A768: SANDRINGHAM | C768: COLLINS | F768: EVANS | I768: BENCRAFT | L768: WEBB | O768: TOMLINS | R768: IRVINE
A769: PRESTON | C769: EXELBY | F769: LEHMANN | I769: S STEWART | L769: CONROY | O769: LEISHMAN | R769: McCARTHY
A770: GOALKICKERS
A771: SANDRINGHAM | C771: BROKENSHIRE 4 | F771: WHITE 2 | I771: PARKER | K771: HAGER | M771: BENCRAFT | O771: COLLINS | Q771: PATTERSON
A772: PRESTON | C772: POTTER 2 | F772: MASLEN 2 | I772: HINDS | K772: EXELBY | M772: GRIDELL | O772: LEHMANN | Q772: LEYDEN | S772: DUNSTAN | V772: BRYCE
A774: YARRAVILLE | C774: 3 | D774: 7 | E774: =C774*6+D774 -> 25 | G774: 5 | H774: 9 | I774: =G774*6+H774 -> 39 | K774: 12 | L774: 16 | M774: =K774*6+L774 -> 88 | O774: 12 | P774: 18 | Q774: =O774*6+P774 -> 90 | S774: YARRAVILLE
A775: PRAHRAN | C775: 0 | D775: 1 | E775: =C775*6+D775 -> 1 | G775: 5 | H775: 7 | I775: =G775*6+H775 -> 37 | K775: 6 | L775: 8 | M775: =K775*6+L775 -> 44 | O775: 9 | P775: 16 | Q775: =O775*6+P775 -> 70 | S775: MERRINGTON
A776: BEST PLAYERS
A777: YARRAVILLE | C777: ELDRIDGE | F777: SPENCE | I777: PHILLIPS | L777: FAIRFULL | O777: HARRIS | R777: GARLICK
A778: PRAHRAN | C778: GARVIN | F778: MONOHAN | I778: NEWTON | L778: SPRIGGS | O778: FERGEUS | R778: HOGAN
A779: GOALKICKERS
A780: YARRAVILLE | C780: PHILLIPS 6 | F780: SAIT 2 | H780: HARDIMAN 2 | K780: SPENCE | M780: HARRIS
A781: PRAHRAN | C781: GROVE 2 | F781: MONOHAN 2 | I781: WINBERG | K781: GARVIN | M781: McMAHON | O781: OPREY | Q781: WALSH
A783: WILLIAMSTOWN | C783: 3 | D783: 5 | E783: =C783*6+D783 -> 23 | G783: 3 | H783: 8 | I783: =G783*6+H783 -> 26 | K783: 8 | L783: 15 | M783: =K783*6+L783 -> 63 | O783: 12 | P783: 22 | Q783: =O783*6+P783 -> 94 | S783: NORTHCOTE
A784: NORTHCOTE | C784: 3 | D784: 5 | E784: =C784*6+D784 -> 23 | G784: 5 | H784: 11 | I784: =G784*6+H784 -> 41 | K784: 9 | L784: 15 | M784: =K784*6+L784 -> 69 | O784: 11 | P784: 17 | Q784: =O784*6+P784 -> 83 | S784: LEE
A785: BEST PLAYERS
A786: WILLIAMSTOWN | C786: DOWLING | F786: HARLEY | I786: WILLIAMS | L786: MATTHEWS | O786: EVANS | R786: SALVAS
A787: NORTHCOTE | C787: McINTOSH | F787: McCRACKEN | I787: PETRIE | L787: GREENHAM | O787: DUNN | R787: HISCOX
A788: GOALKICKERS
A789: WILLIAMSTOWN | C789: SPRING 3 | F789: DOWLING 2 | I789: EVANS 2 | K789: LYONS 2 | M789: SALVAS | O789: TODD | Q789: McRAE
A790: NORTHCOTE | C790: PETRIE 4 | F790: McINTOSH 3 | I790: GALLAGHER 3 | L790: LEMPRIERE
A792: ROUND 15 | D792: 19TH JULY | H792: WEATHER | K792: COLD DRIZZLING RAIN GROUNDS HEAVY | S792: PLAYED AT
D793: 1ST QTR | H793: 2ND QTR | L793: 3RD QTR | P793: FINAL | S793: WILLIAMSTOWN
A794: WILLIAMSTOWN | C794: 5 | D794: 7 | E794: =C794*6+D794 -> 37 | G794: 7 | H794: 9 | I794: =G794*6+H794 -> 51 | K794: 11 | L794: 12 | M794: =K794*6+L794 -> 78 | O794: 19 | P794: 20 | Q794: =O794*6+P794 -> 134 | S794: UMPIRE | X794: LADDER | AB794: ROUND | AD794: 15
A795: BRUNSWICK | C795: 4 | D795: 1 | E795: =C795*6+D795 -> 25 | G795: 6 | H795: 11 | I795: =G795*6+H795 -> 47 | K795: 7 | L795: 14 | M795: =K795*6+L795 -> 56 | O795: 8 | P795: 16 | Q795: =O795*6+P795 -> 64 | S795: LEE
A796: BEST PLAYERS | W796: TEAM | X796: W | Y796: L | Z796: D | AA796: FOR | AB796: AGST | AC796: % | AD796: PTS
A797: WILLIAMSTOWN | C797: SCOTT | F797: SAMPSON | I797: WILCOX | K797: SPRING | N797: DOWLING | Q797: SALVAS
A798: BRUNSWICK | C798: PRIESTLEY | F798: KEMP | I798: WELDON | K798: BAGGOTT | N798: UPTON | Q798: GLASSCOTT | W798: WILLIAMSTOWN | X798: 12 | Y798: 3 | Z798: 0 | AA798: 1589 | AB798: 1283 | AC798: 123.85035074045207 | AD798: 48
A799: GOALKICKERS | W799: PORT MELBOURNE | X799: 10 | Y799: 4 | Z799: 1 | AA799: 1675 | AB799: 1496 | AC799: 111.97 | AD799: 42
A800: WILLIAMSTOWN | C800: SPRING 5 | E800: TODD 4 | G800: McPHERSON 4 | J800: SALVAS 2 | M800: PEACOCK 2 | P800: DOWLING 2 | W800: SANDRINGHAM | X800: 10 | Y800: 5 | Z800: 0 | AA800: 1633 | AB800: 1464 | AC800: 111.54371584699453 | AD800: 40
A801: BRUNSWICK | C801: PRIESTLEY 3 | F801: UPTON 2 | I801: WHELAN | L801: STANLEY | O801: CROUCH | W801: BRUNSWICK | X801: 9 | Y801: 5 | Z801: 1 | AA801: 1476 | AB801: 1392 | AC801: 106.03448275862068 | AD801: 38
A803: SANDRINGHAM | C803: 4 | D803: 4 | E803: =C803*6+D803 -> 28 | G803: 9 | H803: 11 | I803: =G803*6+H803 -> 65 | K803: 12 | L803: 14 | M803: =K803*6+L803 -> 86 | O803: 14 | P803: 17 | Q803: =O803*6+P803 -> 101 | S803: COBURG | W803: BRIGHTON | X803: 9 | Y803: 6 | Z803: 0 | AA803: 1857 | AB803: 1677 | AC803: 110.7334525939177 | AD803: 36
A804: COBURG | C804: 2 | D804: 5 | E804: =C804*6+D804 -> 17 | G804: 3 | H804: 5 | I804: =G804*6+H804 -> 23 | K804: 6 | L804: 8 | M804: =K804*6+L804 -> 44 | O804: 7 | P804: 12 | Q804: =O804*6+P804 -> 54 | S804: BARNES | W804: CAMBERWELL | X804: 9 | Y804: 6 | Z804: 0 | AA804: 1595 | AB804: 1448 | AC804: 110.15193370165746 | AD804: 36
A805: BEST PLAYERS | W805: PRAHRAN | X805: 9 | Y805: 6 | Z805: 0 | AA805: 1533 | AB805: 1473 | AC805: 104.07 | AD805: 36
A806: SANDRINGHAM | C806: BENCRAFT | F806: TOYNE | I806: PATTERSON | L806: BROKENSHIRE | O806: WEBB | Q806: TOMLINS | W806: COBURG | X806: 6 | Y806: 9 | Z806: 0 | AA806: 1457 | AB806: 1421 | AC806: 102.53342716396904 | AD806: 24
A807: COBURG | C807: WALKER | F807: JORGENSON | I807: GILBERT | L807: DEMPSEY | O807: PROMNITZ | Q807: PRENDERGAST | W807: OAKLEIGH | X807: 6 | Y807: 9 | Z807: 0 | AA807: 1523 | AB807: 1613 | AC807: 94.420334779913205 | AD807: 24
A808: GOALKICKERS | W808: PRESTON | X808: 4 | Y808: 11 | Z808: 0 | AA808: 1238 | AB808: 1472 | AC808: 84.103260869565219 | AD808: 16
A809: SANDRINGHAM | C809: BROKENSHIRE 5 | F809: CERINI 2 | H809: PARKER 2 | J809: BENCRAFT 2 | M809: REGNIER | O809: ANDERS | Q809: WEBB | W809: YARRAVILLE | X809: 3 | Y809: 12 | Z809: 0 | AA809: 1432 | AB809: 1858 | AC809: 77.072120559741663 | AD809: 12
A810: COBURG | C810: JORGENSON 4 | F810: PRENDERGAST 2 | J810: JAMES | W810: NORTHCOTE | X810: 2 | Y810: 13 | Z810: 0 | AA810: 1108 | AB810: 1519 | AC810: 72.942725477287695 | AD810: 8
A812: PRESTON | C812: 2 | D812: 2 | E812: =C812*6+D812 -> 14 | G812: 7 | H812: 3 | I812: =G812*6+H812 -> 45 | K812: 10 | L812: 5 | M812: =K812*6+L812 -> 65 | O812: 13 | P812: 6 | Q812: =O812*6+P812 -> 84 | S812: TOORAK PARK
A813: PRAHRAN | C813: 3 | D813: 1 | E813: =C813*6+D813 -> 19 | G813: 8 | H813: 4 | I813: =G813*6+H813 -> 52 | K813: 9 | L813: 7 | M813: =K813*6+L813 -> 61 | O813: 12 | P813: 10 | Q813: =O813*6+P813 -> 82 | S813: WRIGHT
A814: BEST PLAYERS
A815: PRESTON | C815: EXELBY | F815: HOPGOOD | I815: S STEWART | L815: PRITCHARD | O815: RIDDELL | Q815: POTTER
A816: PRAHRAN | C816: FERGEUS | F816: BURGESS | I816: BOURKE | L816: YATES | O816: OPREY | Q816: WALSH
A817: GOALKICKERS
A818: PRESTON | C818: POTTER 5 | F818: McCARTHY 3 | I818: EXELBY 2 | L818: LEISHMAN | O818: HINDS | Q818: LEYDEN
A819: PRAHRAN | C819: OPREY 5 | F819: FERGEUS 2 | I819: BURGESS 2 | L819: MONOHAN | O819: McMAHON | Q819: WALSH
A821: BRIGHTON | C821: 5 | D821: 2 | E821: =C821*6+D821 -> 32 | G821: 9 | H821: 6 | I821: =G821*6+H821 -> 60 | K821: 13 | L821: 14 | M821: =K821*6+L821 -> 92 | O821: 22 | P821: 22 | Q821: =O821*6+P821 -> 154 | S821: ELSTERNWICK PARK
A822: YARRAVILLE | C822: 1 | D822: 7 | E822: =C822*6+D822 -> 13 | G822: 5 | H822: 12 | I822: =G822*6+H822 -> 42 | K822: 10 | L822: 15 | M822: =K822*6+L822 -> 75 | O822: 10 | P822: 18 | Q822: =O822*6+P822 -> 78 | S822: McGAW
A823: BEST PLAYERS
A824: BRIGHTON | C824: WARBURTON | F824: ADAMSON | I824: McINDOE | L824: CAVANAGH | O824: WILLIAMSON | R824: TURNER
A825: YARRAVILLE | C825: HARDIMAN | F825: PHILLIPS | I825: HARRIS | L825: MITCHELL | O825: McASEY | R825: FAIRFULL
A826: GOALKICKERS
A827: BRIGHTON | C827: WARBURTON 9 | F827: ADAMSON 5 | I827: McINDOE 4 | L827: DOUGLAS 2 | O827: HEIMS | Q827: CAVANAGH
A828: YARRAVILLE | C828: PHILLIPS 4 | F828: HARDIMAN 2 | I828: LAW 2 | K828: HARRIS | M828: McASEY
A830: PORT MELBOURNE | C830: 4 | D830: 0 | E830: =C830*6+D830 -> 24 | G830: 8 | H830: 5 | I830: =G830*6+H830 -> 53 | K830: 11 | L830: 9 | M830: =K830*6+L830 -> 75 | O830: 14 | P830: 14 | Q830: =O830*6+P830 -> 98 | S830: OAKLEIGH
A831: OAKLEIGH | C831: 3 | D831: 4 | E831: =C831*6+D831 -> 22 | G831: 6 | H831: 7 | I831: =G831*6+H831 -> 43 | K831: 10 | L831: 10 | M831: =K831*6+L831 -> 70 | O831: 12 | P831: 13 | Q831: =O831*6+P831 -> 85 | S831: MERRINGTON
A832: BEST PLAYERS
A833: PORT MELBOURNE | C833: BUTCHER | F833: FINDLAY | I833: THOMS | L833: BAKER | O833: LEWIS | R833: MENZIES
A834: OAKLEIGH | C834: BAXTER | F834: R FINN | I834: SANDAY | L834: HARRISON | O834: WILSON | R834: ANDREW
A835: GOALKICKERS
A836: PORT MELBOURNE | C836: THOMS 5 | F836: HOUSTON 3 | I836: FINDLAY 2 | L836: CULPH 2 | N836: MURPHY | P836: LEWIS
A837: OAKLEIGH | C837: DONNELLY 3 | F837: NOONAN | H837: E RYAN | J837: ANDREW | L837: KELLY | N837: RAWLINGS | Q837: TUDOR | S837: R FINN | U837: POWER | X837: BAXTER
A839: CAMBERWELL | C839: 3 | D839: 4 | E839: =C839*6+D839 -> 22 | G839: 8 | H839: 4 | I839: =G839*6+H839 -> 52 | K839: 12 | L839: 7 | M839: =K839*6+L839 -> 79 | O839: 12 | P839: 13 | Q839: =O839*6+P839 -> 85 | S839: NORTHCOTE
A840: NORTHCOTE | C840: 1 | D840: 0 | E840: =C840*6+D840 -> 6 | G840: 6 | H840: 0 | I840: =G840*6+H840 -> 36 | K840: 8 | L840: 4 | M840: =K840*6+L840 -> 52 | O840: 11 | P840: 8 | Q840: =O840*6+P840 -> 74 | S840: EGAN
A841: BEST PLAYERS
A842: CAMBERWELL | C842: BOYALL | F842: BRADFORD | I842: BRYCE | L842: McDONALD | O842: CAMPBELL | R842: McIVOR
A843: NORTHCOTE | C843: HISCOX | F843: GREENHAM | I843: McINTOSH | L843: McCRACKEN | O843: CASPAR | R843: LEMPRIERE
A844: GOALKICKERS
A845: CAMBERWELL | C845: McDONALD 4 | F845: BOHAN 3 | I845: BRYCE 2 | K845: BRADFORD | N845: CAMPBELL | Q845: COLLIER
A846: NORTHCOTE | C846: McCRACKEN 4 | F846: McINTOSH 2 | I846: LEMPRIERE 2 | L846: PETRIE 2 | N846: BALDWIN
A848: ROUND 16 | D848: 26TH JULY | J848: WEATHER | M848: WEST BREEZE DULL COLD | S848: PLAYED AT
D849: 1ST QTR | H849: 2ND QTR | L849: 3RD QTR | P849: FINAL | S849: WILLIAMSTOWN
A850: WILLIAMSTOWN | C850: 5 | D850: 5 | E850: =C850*6+D850 -> 35 | G850: 7 | H850: 7 | I850: =G850*6+H850 -> 49 | K850: 12 | L850: 11 | M850: =K850*6+L850 -> 83 | O850: 15 | P850: 20 | Q850: =O850*6+P850 -> 110 | S850: UMPIRE | X850: LADDER | AB850: ROUND | AD850: 16
A851: PORT MELBOURNE | C851: 0 | D851: 5 | E851: =C851*6+D851 -> 5 | G851: 9 | H851: 11 | I851: =G851*6+H851 -> 65 | K851: 10 | L851: 15 | M851: =K851*6+L851 -> 75 | O851: 12 | P851: 13 | Q851: =O851*6+P851 -> 85 | S851: MERRINGTON
A852: BEST PLAYERS | W852: TEAM | X852: W | Y852: L | Z852: D | AA852: FOR | AB852: AGST | AC852: % | AD852: PTS
A853: WILLIAMSTOWN | C853: WILLIAMS | F853: DOWLING | I853: SAMPSON | L853: TODD | N853: SALVAS | Q853: CAMERON
A854: PORT MELBOURNE | C854: FINDLAY | F854: BUTCHER | I854: MANN | L854: REYNOLDS | N854: TREMBATH | W854: WILLIAMSTOWN | X854: 13 | Y854: 3 | Z854: 0 | AA854: 1699 | AB854: 1368 | AC854: 124.19590643274854 | AD854: 52
A855: GOALKICKERS | W855: SANDRINGHAM | X855: 11 | Y855: 5 | Z855: 0 | AA855: 1723 | AB855: 1533 | AC855: 112.39399869536855 | AD855: 44
A856: WILLIAMSTOWN | C856: SALVAS 5 | F856: DOWLING 4 | I856: TODD 3 | L856: McPHERSON 2 | O856: WILLIAMS | W856: PORT MELBOURNE | X856: 10 | Y856: 5 | Z856: 1 | AA856: 1760 | AB856: 1606 | AC856: 109.59 | AD856: 42
A857: PORT MELBOURNE | C857: FINDLAY 4 | F857: CULPH 3 | I857: THOMS 2 | L857: HOULIHAN | N857: HOUSTON | Q857: MURPHY | W857: BRIGHTON | X857: 10 | Y857: 6 | Z857: 0 | AA857: 1978 | AB857: 1767 | AC857: 111.94114318053198 | AD857: 40
A859: BRIGHTON | C859: 5 | D859: 3 | E859: =C859*6+D859 -> 33 | G859: 8 | H859: 5 | I859: =G859*6+H859 -> 53 | K859: 10 | L859: 14 | M859: =K859*6+L859 -> 74 | O859: 17 | P859: 19 | Q859: =O859*6+P859 -> 121 | S859: ELSTERNWICK PARK | W859: PRAHRAN | X859: 10 | Y859: 6 | Z859: 0 | AA859: 1713 | AB859: 1540 | AC859: 111.23 | AD859: 40
A860: BRUNSWICK | C860: 1 | D860: 2 | E860: =C860*6+D860 -> 8 | G860: 5 | H860: 6 | I860: =G860*6+H860 -> 36 | K860: 8 | L860: 9 | M860: =K860*6+L860 -> 57 | O860: 13 | P860: 12 | Q860: =O860*6+P860 -> 90 | S860: LEE | W860: BRUNSWICK | X860: 9 | Y860: 6 | Z860: 1 | AA860: 1566 | AB860: 1513 | AC860: 103.50297422339722 | AD860: 38
A861: BEST PLAYERS | W861: CAMBERWELL | X861: 9 | Y861: 7 | Z861: 0 | AA861: 1700 | AB861: 1555 | AC861: 109.32475884244373 | AD861: 36
A862: BRIGHTON | C862: TURNER | E862: McINDOE | H862: WILLIAMSON | K862: BIBBY | N862: RICHARDSON | Q862: DOUGLAS | W862: COBURG | X862: 6 | Y862: 10 | Z862: 0 | AA862: 1591 | AB862: 1596 | AC862: 99.686716791979947 | AD862: 24
A863: BRUNSWICK | C863: SHAW | E863: POWELL | H863: BAGGOTT | K863: WELDON | N863: SMITH | Q863: CROUCH | W863: OAKLEIGH | X863: 6 | Y863: 10 | Z863: 0 | AA863: 1592 | AB863: 1703 | AC863: 93.482090428655312 | AD863: 24
A864: GOALKICKERS | W864: PRESTON | X864: 5 | Y864: 11 | Z864: 0 | AA864: 1345 | AB864: 1577 | AC864: 85.288522511097014 | AD864: 20
A865: BRIGHTON | C865: DOUGLAS 8 | F865: WARBURTON 5 | J865: WILLIAMSON 2 | N865: McINDOE | Q865: RICHARDSON | W865: YARRAVILLE | X865: 4 | Y865: 12 | Z865: 0 | AA865: 1607 | AB865: 1992 | AC865: 80.672690763052202 | AD865: 16
A866: BRUNSWICK | C866: BAGGOTT 7 | F866: STANLEY 2 | I866: GEMMELL | K866: UPTON | M866: SMITH | O866: CROUCH | W866: NORTHCOTE | X866: 2 | Y866: 14 | Z866: 0 | AA866: 1175 | AB866: 1699 | AC866: 69.158328428487351 | AD866: 8
A868: SANDRINGHAM | C868: 2 | D868: 6 | E868: =C868*6+D868 -> 18 | G868: 5 | H868: 12 | I868: =G868*6+H868 -> 42 | K868: 7 | L868: 14 | M868: =K868*6+L868 -> 56 | O868: 12 | P868: 18 | Q868: =O868*6+P868 -> 90 | S868: OAKLEIGH
A869: OAKLEIGH | C869: 3 | D869: 1 | E869: =C869*6+D869 -> 19 | G869: 6 | H869: 4 | I869: =G869*6+H869 -> 40 | K869: 7 | L869: 5 | M869: =K869*6+L869 -> 47 | O869: 10 | P869: 9 | Q869: =O869*6+P869 -> 69 | S869: EGAN
A870: BEST PLAYERS
A871: SANDRINGHAM | C871: TOMLINS | F871: PATTERSON | I871: COLLINS | L871: O'TOOLE | O871: EVANS | R871: WEBB
A872: OAKLEIGH | C872: WILSON | F872: POWER | I872: SANDAY | L872: GRAY | O872: RAWLINGS | R872: RUNDELL
A873: GOALKICKERS
A874: SANDRINGHAM | C874: ANDERS 3 | F874: TOMLINS 3 | I874: COLLINS 2 | L874: REGNIER 2 | N874: PARKER | P874: IRVINE
A875: OAKLEIGH | C875: DONNELLY 4 | F875: POWER 2 | I875: RAWLINGS | L875: RUNDELL | N875: MERRIMAN | Q875: TUDOR
A877: PRESTON | C877: 5 | D877: 6 | E877: =C877*6+D877 -> 36 | G877: 6 | H877: 10 | I877: =G877*6+H877 -> 46 | K877: 11 | L877: 13 | M877: =K877*6+L877 -> 79 | O877: 15 | P877: 17 | Q877: =O877*6+P877 -> 107 | S877: PRESTON
A878: CAMBERWELL | C878: 1 | D878: 3 | E878: =C878*6+D878 -> 9 | G878: 5 | H878: 9 | I878: =G878*6+H878 -> 39 | K878: 7 | L878: 13 | M878: =K878*6+L878 -> 55 | O878: 15 | P878: 15 | Q878: =O878*6+P878 -> 105 | S878: WRIGHT
A879: BEST PLAYERS
A880: PRESTON | C880: MASLEN | F880: POTTER | I880: S STEWART | L880: BLACKMAN | O880: DUNSTAN | R880: LEISHMAN
A881: CAMBERWELL | C881: BOYALL | F881: McIVOR | I881: CAMPBELL | L881: JENSEN | O881: COLLIER | R881: McDONALD
A882: GOALKICKERS
A883: PRESTON | C883: POTTER 7 | F883: McCARTHY 2 | I883: HARRISON 2 | L883: CONROY | N883: BRYCE | P883: GOLDIN | R883: DUNSTAN
A884: CAMBERWELL | C884: HOGAN 3 | F884: McDONALD 3 | I884: JENSEN 2 | K884: McIVOR 2 | M884: BOYALL | O884: HERBERT | Q884: CAMPBELL | T884: BRYCE | W884: KENNEDY
A886: YARRAVILLE | C886: 4 | D886: 2 | E886: =C886*6+D886 -> 26 | G886: 10 | H886: 6 | I886: =G886*6+H886 -> 66 | K886: 17 | L886: 9 | M886: =K886*6+L886 -> 111 | O886: 27 | P886: 13 | Q886: =O886*6+P886 -> 175 | S886: COBURG
A887: COBURG | C887: 9 | D887: 7 | E887: =C887*6+D887 -> 61 | G887: 14 | H887: 10 | I887: =G887*6+H887 -> 94 | K887: 17 | L887: 13 | M887: =K887*6+L887 -> 115 | O887: 20 | P887: 14 | Q887: =O887*6+P887 -> 134 | S887: BARNES
A888: BEST PLAYERS
A889: YARRAVILLE | C889: HARRIS | F889: HARDIMAN | I889: WOOD | K889: McASEY | N889: FAIRFULL | Q889: McLEOD
A890: COBURG | C890: PRENDERGAST | F890: JORGENSON | I890: McLEAN | K890: WILSON | N890: ROGAN | Q890: GILBERT
A891: GOALKICKERS
A892: YARRAVILLE | C892: HARRIS 10 | F892: PHILLIPS 6 | I892: SPENCE 4 | K892: GARRICK 3 | N892: HARDIMAN 3 | Q892: FAIRFULL
A893: COBURG | C893: JORGENSON 8 | F893: ROGAN 3 | I893: PRENDERGAST 3 | L893: MILTE 2 | N893: WALSH 2 | Q893: JAMES 2
A895: PRAHRAN | C895: 5 | D895: 5 | E895: =C895*6+D895 -> 35 | G895: 14 | H895: 7 | I895: =G895*6+H895 -> 91 | K895: 18 | L895: 11 | M895: =K895*6+L895 -> 119 | O895: 27 | P895: 18 | Q895: =O895*6+P895 -> 180 | S895: TOORAK PARK
A896: NORTHCOTE | C896: 6 | D896: 4 | E896: =C896*6+D896 -> 40 | G896: 8 | H896: 4 | I896: =G896*6+H896 -> 52 | K896: 10 | L896: 5 | M896: =K896*6+L896 -> 65 | O896: 10 | P896: 7 | Q896: =O896*6+P896 -> 67 | S896: THOMAS
A897: BEST PLAYERS
A898: PRAHRAN | C898: FERGEUS | F898: BURGESS | I898: GROVE | K898: OVERS | N898: SPRIGGS | Q898: WALSH
A899: NORTHCOTE | C899: MURPHY | F899: ATKINSON | I899: DUNN | K899: DES KING | N899: KINDER | Q899: WHITE
A900: GOALKICKERS
A901: PRAHRAN | C901: MORROW 5 | F901: WALSH 5 | I901: FERGEUS 4 | L901: OPREY 3 | N901: BURGESS 3 | Q901: MOLONEY 3 | T901: GROVE 2 | W901: OVERS | X901: MONOHAN
A902: NORTHCOTE | C902: WHITE 3 | F902: PETRIE 2 | I902: ARMOUR | K902: McINTOSH | N902: GALLAGHER | Q902: CASPAR | S902: McCRACKEN
A904: ROUND 17 | D904: 2ND AUGUST | H904: WEATHER | K904: STRONG NORTH WEST WIND CLOUDY | S904: PLAYED AT
D905: 1ST QTR | H905: 2ND QTR | L905: 3RD QTR | P905: FINAL | S905: BEACH RD
A906: SANDRINGHAM | C906: 0 | D906: 0 | E906: =C906*6+D906 -> 0 | G906: 4 | H906: 6 | I906: =G906*6+H906 -> 30 | K906: 5 | L906: 7 | M906: =K906*6+L906 -> 37 | O906: 12 | P906: 15 | Q906: =O906*6+P906 -> 87 | S906: UMPIRE | X906: LADDER | AB906: ROUND | AD906: 17
A907: WILLIAMSTOWN | C907: 2 | D907: 12 | E907: =C907*6+D907 -> 24 | G907: 2 | H907: 13 | I907: =G907*6+H907 -> 25 | K907: 6 | L907: 20 | M907: =K907*6+L907 -> 56 | O907: 6 | P907: 23 | Q907: =O907*6+P907 -> 59 | S907: MERRINGTON
A908: BEST PLAYERS | W908: TEAM | X908: W | Y908: L | Z908: D | AA908: FOR | AB908: AGST | AC908: % | AD908: PTS
A909: SANDRINGHAM | C909: TOYNE | F909: SLEIGH | I909: SALES | K909: PARKER | N909: TOMLINS | Q909: PATTERSON
A910: WILLIAMSTOWN | C910: LYON | F910: McRAE | I910: EVANS | K910: WILLIAMS | N910: SALVAS | Q910: McPHERSON | W910: WILLIAMSTOWN | X910: 13 | Y910: 4 | Z910: 0 | AA910: 1758 | AB910: 1455 | AC910: 120.82474226804123 | AD910: 52
A911: GOALKICKERS | W911: SANDRINGHAM | X911: 12 | Y911: 5 | Z911: 0 | AA911: 1810 | AB911: 1592 | AC911: 113.69346733668341 | AD911: 48
A912: SANDRINGHAM | C912: PARKER 5 | F912: BROKENSHIRE 3 | J912: HARPER 2 | M912: REGNIER | O912: POLE | W912: PORT MELBOURNE | X912: 11 | Y912: 5 | Z912: 1 | AA912: 1868 | AB912: 1650 | AC912: 113.21 | AD912: 46
A913: WILLIAMSTOWN | C913: McPHERSON 2 | F913: BERNARD | I913: SALVAS | K913: SPRING | M913: TODD | W913: PRAHRAN | X913: 11 | Y913: 6 | Z913: 0 | AA913: 1828 | AB913: 1640 | AC913: 111.46 | AD913: 44
A915: PRAHRAN | C915: 4 | D915: 8 | E915: =C915*6+D915 -> 32 | G915: 6 | H915: 9 | I915: =G915*6+H915 -> 45 | K915: 15 | L915: 18 | M915: =K915*6+L915 -> 108 | O915: 16 | P915: 19 | Q915: =O915*6+P915 -> 115 | S915: CAMBERWELL | W915: BRUNSWICK | X915: 10 | Y915: 6 | Z915: 1 | AA915: 1656 | AB915: 1576 | AC915: 105.07614213197969 | AD915: 42
A916: CAMBERWELL | C916: 2 | D916: 0 | E916: =C916*6+D916 -> 12 | G916: 4 | H916: 6 | I916: =G916*6+H916 -> 30 | K916: 5 | L916: 7 | M916: =K916*6+L916 -> 37 | O916: 14 | P916: 16 | Q916: =O916*6+P916 -> 100 | S916: BARNES | W916: BRIGHTON | X916: 10 | Y916: 7 | Z916: 0 | AA916: 2041 | AB916: 1865 | AC916: 109.43699731903486 | AD916: 40
A917: BEST PLAYERS | W917: CAMBERWELL | X917: 9 | Y917: 8 | Z917: 0 | AA917: 1800 | AB917: 1670 | AC917: 107.78443113772455 | AD917: 36
A918: PRAHRAN | C918: FERGEUS | F918: SPRIGGS | I918: OPREY | K918: NEWTON | N918: GROVE | Q918: BOURKE | W918: COBURG | X918: 6 | Y918: 11 | Z918: 0 | AA918: 1635 | AB918: 1704 | AC918: 95.950704225352112 | AD918: 24
A919: CAMBERWELL | C919: BOYALL | F919: McDONALD | I919: JENSEN | K919: COOK | N919: McIVOR | Q919: BRADFORD | W919: OAKLEIGH | X919: 6 | Y919: 11 | Z919: 0 | AA919: 1660 | AB919: 1820 | AC919: 91.208791208791212 | AD919: 24
A920: GOALKICKERS | W920: PRESTON | X920: 6 | Y920: 11 | Z920: 0 | AA920: 1443 | AB920: 1640 | AC920: 87.987804878048777 | AD920: 24
A921: PRAHRAN | C921: OPREY 6 | F921: FERGEUS 3 | I921: GROVE 2 | K921: NEWTON 2 | N921: MORROW | P921: WALSH | R921: MONOHAN | W921: YARRAVILLE | X921: 5 | Y921: 12 | Z921: 0 | AA921: 1724 | AB921: 2060 | AC921: 83.689320388349515 | AD921: 20
A922: CAMBERWELL | C922: BRADFORD 3 | F922: BOHAN 3 | H922: JENSEN 3 | J922: BRYCE | L922: McIVOR | N922: McDONALD | Q922: COLLIER | S922: BRISTOWE | W922: NORTHCOTE | X922: 2 | Y922: 15 | Z922: 0 | AA922: 1238 | AB922: 1789 | AC922: 69.200670765790946 | AD922: 8
A924: PORT MELBOURNE | C924: 3 | D924: 1 | E924: =C924*6+D924 -> 19 | G924: 8 | H924: 8 | I924: =G924*6+H924 -> 56 | K924: 12 | L924: 9 | M924: =K924*6+L924 -> 81 | O924: 15 | P924: 18 | Q924: =O924*6+P924 -> 108 | S924: PORT MELBOURNE
A925: COBURG | C925: 2 | D925: 2 | E925: =C925*6+D925 -> 14 | G925: 2 | H925: 2 | I925: =G925*6+H925 -> 14 | K925: 3 | L925: 6 | M925: =K925*6+L925 -> 24 | O925: 6 | P925: 8 | Q925: =O925*6+P925 -> 44 | S925: McGAW
A926: BEST PLAYERS
A927: PORT MELBOURNE | C927: HOUSTON | F927: FINDLAY | I927: FERGUSON | L927: MANN | O927: WALSH | R927: REYNOLDS
A928: COBURG | C928: MILTE | F928: QUINN | I928: SMITH | L928: STARBUCK | O928: CONDON | R928: DEMPSEY
A929: GOALKICKERS
A930: PORT MELBOURNE | C930: FINDLAY 4 | F930: HOUSTON 4 | I930: CULPH 3 | K930: THOMS 3 | M930: LEWIS
A931: COBURG | C931: CONDON 2 | F931: JAMES | H931: MILTE | J931: McBRIDE | M931: DEMPSEY
A933: YARRAVILLE | C933: 12 | D933: 12 | E933: =C933*6+D933 -> 84 | G933: 12 | H933: 12 | I933: =G933*6+H933 -> 84 | K933: 15 | L933: 27 | M933: =K933*6+L933 -> 117 | O933: 15 | P933: 27 | Q933: =O933*6+P933 -> 117 | S933: YARRAVILLE
A934: OAKLEIGH | C934: 0 | D934: 1 | E934: =C934*6+D934 -> 1 | G934: 6 | H934: 4 | I934: =G934*6+H934 -> 40 | K934: 6 | L934: 5 | M934: =K934*6+L934 -> 41 | O934: 9 | P934: 14 | Q934: =O934*6+P934 -> 68 | S934: EGAN
A935: BEST PLAYERS
A936: YARRAVILLE | C936: HARDIMAN | F936: SPENCE | I936: McASEY | L936: FAIRFULL | O936: GARRICK | R936: GARLICK
A937: OAKLEIGH | C937: E RYAN | F937: WILSON | I937: WEISS | L937: JORY | O937: GRAY | R937: RUNDELL
A938: GOALKICKERS
A939: YARRAVILLE | C939: PHILLIPS 3 | F939: HARRIS 3 | I939: HARDIMAN 2 | L939: McASEY 2 | N939: SPENCE 2 | P939: GARRICK | R939: CAESAR | U939: HILET
A940: OAKLEIGH | C940: JORY 2 | F940: BECKWITH 2 | I940: BAXTER 2 | L940: KELLY | N940: PERKINS | P940: RUNDELL
A942: PRESTON | C942: 5 | D942: 11 | E942: =C942*6+D942 -> 41 | G942: 5 | H942: 11 | I942: =G942*6+H942 -> 41 | K942: 13 | L942: 13 | M942: =K942*6+L942 -> 91 | O942: 14 | P942: 14 | Q942: =O942*6+P942 -> 98 | S942: PRESTON
A943: BRIGHTON | C943: 1 | D943: 1 | E943: =C943*6+D943 -> 7 | G943: 4 | H943: 6 | I943: =G943*6+H943 -> 30 | K943: 5 | L943: 9 | M943: =K943*6+L943 -> 39 | O943: 8 | P943: 15 | Q943: =O943*6+P943 -> 63 | S943: THOMAS
A944: BEST PLAYERS
A945: PRESTON | C945: LEISHMAN | F945: PRITCHARD | I945: BLACKMAN | L945: MASLEN | O945: EXELBY | R945: S STEWART
A946: BRIGHTON | C946: TURNER | F946: DOUGLAS | I946: HEIMS | L946: GOLDSMITH | O946: RICHARDSON | R946: BAILEY
A947: GOALKICKERS
A948: PRESTON | C948: POTTER 4 | F948: BRYCE 3 | I948: MASLEN 3 | L948: McCARTHY | N948: CONROY | P948: RIDDELL | R948: HINES
A949: BRIGHTON | C949: DOUGLAS 3 | F949: ADAMSON 2 | I949: McINDOE 2 | L949: GOLDSMITH
A951: BRUNSWICK | C951: 4 | D951: 2 | E951: =C951*6+D951 -> 26 | G951: 8 | H951: 4 | I951: =G951*6+H951 -> 52 | K951: 11 | L951: 9 | M951: =K951*6+L951 -> 75 | O951: 13 | P951: 12 | Q951: =O951*6+P951 -> 90 | S951: BRUNSWICK
A952: NORTHCOTE | C952: 3 | D952: 2 | E952: =C952*6+D952 -> 20 | G952: 7 | H952: 5 | I952: =G952*6+H952 -> 47 | K952: 8 | L952: 5 | M952: =K952*6+L952 -> 53 | O952: 9 | P952: 9 | Q952: =O952*6+P952 -> 63 | S952: WRIGHT
A953: BEST PLAYERS
A954: BRUNSWICK | C954: BAGGOTT | F954: UPTON | I954: PRIESTLEY | L954: HENRYS | O954: STANLEY | R954: SUTTON
A955: NORTHCOTE | C955: HISCOX | F955: CASPAR | I955: McINTOSH | L955: DUNN | O955: PRTRIE | R955: HINES
A956: GOALKICKERS
A957: BRUNSWICK | C957: HENRYS 3 | F957: STANLEY 2 | I957: BAGGOTT 2 | L957: POWELL 2 | O957: SMITH | Q957: R SHAW | S957: UPTON | U957: PRIESTLEY
A958: NORTHCOTE | C958: McINTOSH 4 | F958: PETRIE 2 | I958: GALLAGHER | L958: McCCRACKEN | O958: WHITE
A960: ROUND 18 | D960: 9TH AUGUST | J960: WEATHER | M960: NORTH WEST WIND COLD | S960: PLAYED AT
D961: 1ST QTR | H961: 2ND QTR | L961: 3RD QTR | P961: FINAL | S961: TOORAK PARK
A962: PRAHRAN | C962: 6 | D962: 6 | E962: =C962*6+D962 -> 42 | G962: 10 | H962: 11 | I962: =G962*6+H962 -> 71 | K962: 14 | L962: 16 | M962: =K962*6+L962 -> 100 | O962: 21 | P962: 23 | Q962: =O962*6+P962 -> 149 | S962: UMPIRE | X962: LADDER | AB962: ROUND | AD962: 18
A963: WILLIAMSTOWN | C963: 4 | D963: 5 | E963: =C963*6+D963 -> 29 | G963: 9 | H963: 6 | I963: =G963*6+H963 -> 60 | K963: 14 | L963: 9 | M963: =K963*6+L963 -> 93 | O963: 18 | P963: 13 | Q963: =O963*6+P963 -> 121 | S963: THOMAS
A964: BEST PLAYERS | W964: TEAM | X964: W | Y964: L | Z964: D | AA964: FOR | AB964: AGST | AC964: % | AD964: PTS
A965: PRAHRAN | C965: FERGEUS | F965: MONOHAN | I965: McMAHON | L965: NEWTON | O965: BUTTLING | R965: BURGESS
A966: WILLIAMSTOWN | C966: BERNARD | F966: TODD | I966: WILLIAMS | L966: HARLEY | O966: DOWLING | R966: McRAE | W966: WILLIAMSTOWN | X966: 13 | Y966: 5 | Z966: 0 | AA966: 1879 | AB966: 1604 | AC966: 117.14463840399003 | AD966: 52
A967: GOALKICKERS | P967: MOLONEY | W967: SANDRINGHAM | X967: 13 | Y967: 5 | Z967: 0 | AA967: 1908 | AB967: 1657 | AC967: 115.14785757392879 | AD967: 52
A968: PRAHRAN | C968: MONHAN 6 | F968: WALSH 4 | I968: BURGESS 3 | L968: OPREY 3 | N968: MORROW 3 | Q968: GROVE | S968: FERGEUS | W968: PORT MELBOURNE | X968: 12 | Y968: 5 | Z968: 1 | AA968: 1995 | AB968: 1760 | AC968: 113.35 | AD968: 50
A969: WILLIAMSTOWN | C969: BERNARD 5 | F969: TODD 5 | H969: SALVAS 3 | K969: DOWLING 2 | N969: McPHERSON | Q969: EVANS | S969: BOND | W969: PRAHRAN | X969: 12 | Y969: 6 | Z969: 0 | AA969: 1977 | AB969: 1761 | AC969: 112.27 | AD969: 48
A971: CAMBERWELL | C971: 5 | D971: 10 | E971: =C971*6+D971 -> 40 | G971: 9 | H971: 13 | I971: =G971*6+H971 -> 67 | K971: 12 | L971: 18 | M971: =K971*6+L971 -> 90 | O971: 18 | P971: 23 | Q971: =O971*6+P971 -> 131 | S971: CAMBERWELL | W971: BRIGHTON | X971: 11 | Y971: 7 | Z971: 0 | AA971: 2199 | AB971: 1930 | AC971: 113.93782383419689 | AD971: 44
A972: BRUNSWICK | C972: 1 | D972: 5 | E972: =C972*6+D972 -> 11 | G972: 11 | H972: 9 | I972: =G972*6+H972 -> 75 | K972: 13 | L972: 11 | M972: =K972*6+L972 -> 89 | O972: 17 | P972: 17 | Q972: =O972*6+P972 -> 119 | S972: WRIGHT | W972: BRUNSWICK | X972: 10 | Y972: 7 | Z972: 1 | AA972: 1775 | AB972: 1707 | AC972: 103.98359695371998 | AD972: 42
A973: BEST PLAYERS | W973: CAMBERWELL | X973: 10 | Y973: 8 | Z973: 0 | AA973: 1931 | AB973: 1789 | AC973: 107.93739519284516 | AD973: 40
A974: CAMBERWELL | C974: BOYALL | F974: CAMPBELL | I974: McDONALD | L974: NAISMITH | O974: BOHAN | Q974: JENSEN | W974: COBURG | X974: 6 | Y974: 11 | Z974: 1 | AA974: 1719 | AB974: 1788 | AC974: 96.140939597315437 | AD974: 26
A975: BRUNSWICK | C975: WHELAN | F975: SMITH | I975: PRIESTLEY | L975: GEISLER | O975: HEWITT | Q975: UPTON | W975: PRESTON | X975: 6 | Y975: 11 | Z975: 1 | AA975: 1527 | AB975: 1724 | AC975: 88.573085846867755 | AD975: 26
A976: GOALKICKERS | W976: OAKLEIGH | X976: 6 | Y976: 12 | Z976: 0 | AA976: 1725 | AB976: 1978 | AC976: 87.20930232558139 | AD976: 24
A977: CAMBERWELL | C977: BOHAN 6 | E977: McDONALD 3 | H977: McIVOR 2 | J977: OLIVER 2 | L977: HOGAN 2 | N977: CAMPBELL | Q977: HERBERT | S977: COLLIER | W977: YARRAVILLE | X977: 5 | Y977: 13 | Z977: 0 | AA977: 1834 | AB977: 2187 | AC977: 83.859167809785092 | AD977: 20
A978: BRUNSWICK | C978: UPTON 3 | E978: SMITH 3 | G978: PRIESTLEY 2 | J978: STANLEY 2 | M978: POWELL 2 | O978: WELDON 2 | Q978: HENRYS | S978: STEWART | W978: NORTHCOTE | X978: 2 | Y978: 16 | Z978: 0 | AA978: 1303 | AB978: 1887 | AC978: 69.051404345521988 | AD978: 8
Q979: JOHNSON
A980: BRIGHTON | C980: 3 | D980: 4 | E980: =C980*6+D980 -> 22 | G980: 9 | H980: 11 | I980: =G980*6+H980 -> 65 | K980: 15 | L980: 15 | M980: =K980*6+L980 -> 105 | O980: 23 | P980: 20 | Q980: =O980*6+P980 -> 158 | S980: ELSTERNWICK PARK
A981: OAKLEIGH | C981: 3 | D981: 3 | E981: =C981*6+D981 -> 21 | G981: 6 | H981: 5 | I981: =G981*6+H981 -> 41 | K981: 8 | L981: 12 | M981: =K981*6+L981 -> 60 | O981: 8 | P981: 17 | Q981: =O981*6+P981 -> 65 | S981: MERRINGTON
A982: BEST PLAYERS
A983: BRIGHTON | C983: TURNER | F983: ADAMSON | I983: BAILEY | L983: HEIMS | N983: CRAVEN | Q983: McINDOE
A984: OAKLEIGH | C984: WILSON | F984: GRAY | I984: E RYAN | L984: SANDAY | N984: TUDOR | Q984: PAY
A985: GOALKICKERS
A986: BRIGHTON | C986: ADAMSON 6 | F986: WARBURTON 4 | I986: McINDOE 4 | L986: DOUGLAS 3 | O986: GOLDSMITH 2 | R986: CAVANAGH 2 | V986: HALL | X986: BIBBY
A987: OAKLEIGH | C987: PAY 2 | F987: TUDOR 2 | I987: R FINN | K987: RUNDELL | M987: JORY | O987: BECKWITH
A989: COBURG | C989: 1 | D989: 1 | E989: =C989*6+D989 -> 7 | G989: 4 | H989: 5 | I989: =G989*6+H989 -> 29 | K989: 7 | L989: 9 | M989: =K989*6+L989 -> 51 | O989: 12 | P989: 12 | Q989: =O989*6+P989 -> 84 | S989: COBURG
A990: PRESTON | C990: 5 | D990: 5 | E990: =C990*6+D990 -> 35 | G990: 6 | H990: 13 | I990: =G990*6+H990 -> 49 | K990: 8 | L990: 17 | M990: =K990*6+L990 -> 65 | O990: 11 | P990: 18 | Q990: =O990*6+P990 -> 84 | S990: EGAN
A991: BEST PLAYERS
A992: COBURG | C992: McILVEEN | F992: SMITH | I992: PROMNITZ | L992: QUINN | O992: MILTE | R992: WILSON
A993: PRESTON | C993: PRITCHARD | F993: MASLEN | I993: LEISHMAN | L993: S STEWART | O993: RIDDELL | R993: BLACKMAN
A994: GOALKICKERS
A995: COBURG | C995: QUINN 4 | F995: CONDON 3 | I995: MILTE | K995: EGAN | M995: PRENDERGAST | P995: WALSH | R995: JORGENSON
A996: PRESTON | C996: MASLEN 3 | F996: HARRISON 2 | I996: POTTER 2 | K996: EXELBY | M996: CONNELLY | P996: CONROY | R996: PASCOE
A998: PORT MELBOURNE | C998: 6 | D998: 6 | E998: =C998*6+D998 -> 42 | G998: 10 | H998: 8 | I998: =G998*6+H998 -> 68 | K998: 19 | L998: 11 | M998: =K998*6+L998 -> 125 | O998: 19 | P998: 13 | Q998: =O998*6+P998 -> 127 | S998: YARRAVILLE
A999: YARRAVILLE | C999: 2 | D999: 1 | E999: =C999*6+D999 -> 13 | G999: 7 | H999: 4 | I999: =G999*6+H999 -> 46 | K999: 11 | L999: 5 | M999: =K999*6+L999 -> 71 | O999: 17 | P999: 8 | Q999: =O999*6+P999 -> 110 | S999: LEE
A1000: BEST PLAYERS
A1001: PORT MELBOURNE | C1001: FERGUSON | F1001: MANN | I1001: CULPH | L1001: MURPHY | O1001: LEWIS | Q1001: MENZIES
A1002: YARRAVILLE | C1002: GARLICK | F1002: SCARFFE | I1002: GARRICK | L1002: SPENCE | O1002: SAIT | Q1002: HILET
A1003: GOALKICKERS
A1004: PORT MELBOURNE | C1004: CULPH 6 | F1004: LEWIS 5 | I1004: FINDLAY 3 | L1004: HOULIHAN 2 | O1004: HOUSTON | R1004: FERGUSON | U1004: MURPHY
A1005: YARRAVILLE | C1005: SPENCE 5 | F1005: HARDIMAN 3 | I1005: SCARFFE 3 | L1005: HARRIS 3 | O1005: PHILLIPS 2 | R1005: HILET
A1007: SANDRINGHAM | C1007: 1 | D1007: 5 | E1007: =C1007*6+D1007 -> 11 | G1007: 4 | H1007: 8 | I1007: =G1007*6+H1007 -> 32 | K1007: 7 | L1007: 9 | M1007: =K1007*6+L1007 -> 51 | O1007: 14 | P1007: 14 | Q1007: =O1007*6+P1007 -> 98 | S1007: NORTHCOTE
A1008: NORTHCOTE | C1008: 2 | D1008: 4 | E1008: =C1008*6+D1008 -> 16 | G1008: 6 | H1008: 8 | I1008: =G1008*6+H1008 -> 44 | K1008: 9 | L1008: 12 | M1008: =K1008*6+L1008 -> 66 | O1008: 9 | P1008: 11 | Q1008: =O1008*6+P1008 -> 65 | S1008: McGAW
A1009: BEST PLAYERS
A1010: SANDRINGHAM | C1010: TOYNE | F1010: PATTERSON | I1010: PARKER | L1010: EVANS | O1010: ANDERS | R1010: SLEIGH
A1011: NORTHCOTE | C1011: KEN MURPHY | F1011: ATKINSON | I1011: McINTOSH | L1011: CASPAR | O1011: GREENHAM | R1011: RUSH
A1012: GOALKICKERS
A1013: SANDRINGHAM | C1013: HARPER 4 | F1013: ANDERS 3 | I1013: PARKER 2 | L1013: REGNIER 2 | O1013: BROKENSHIRE 2 | S1013: BENCRAFT
A1014: NORTHCOTE | C1014: ARMOUR 5 | F1014: GALE 2 | I1014: PETRIE | K1014: GALLAGHER
A1016: ROUND 19 | D1016: 16TH AUGUST | J1016: WEATHER | M1016: SOUTH BREEZE RAIN IN MORNING | S1016: PLAYED AT
D1017: 1ST QTR | H1017: 2ND QTR | L1017: 3RD QTR | P1017: FINAL | S1017: TOORAK PARK
A1018: PRAHRAN | C1018: 1 | D1018: 3 | E1018: =C1018*6+D1018 -> 9 | G1018: 5 | H1018: 12 | I1018: =G1018*6+H1018 -> 42 | K1018: 8 | L1018: 16 | M1018: =K1018*6+L1018 -> 64 | O1018: 15 | P1018: 20 | Q1018: =O1018*6+P1018 -> 110 | S1018: UMPIRE | X1018: LADDER | AB1018: ROUND | AD1018: 19
A1019: BRIGHTON | C1019: 3 | D1019: 11 | E1019: =C1019*6+D1019 -> 29 | G1019: 6 | H1019: 14 | I1019: =G1019*6+H1019 -> 50 | K1019: 14 | L1019: 17 | M1019: =K1019*6+L1019 -> 101 | O1019: 14 | P1019: 20 | Q1019: =O1019*6+P1019 -> 104 | S1019: WRIGHT
A1020: BEST PLAYERS | W1020: TEAM | X1020: W | Y1020: L | Z1020: D | AA1020: FOR | AB1020: AGST | AC1020: % | AD1020: PTS
A1021: PRAHRAN | C1021: HILL | F1021: BURGESS | I1021: MORROW | K1021: MOMOHAN | N1021: FERGEUS | Q1021: GROVE
A1022: BRIGHTON | C1022: WILLIAMSON | F1022: BAILEY | I1022: HALL | K1022: McINDOE | N1022: GLASSCOTT | Q1022: TURNER | W1022: WILLIAMSTOWN | X1022: 14 | Y1022: 5 | Z1022: 0 | AA1022: 1985 | AB1022: 1677 | AC1022: 118.36612999403697 | AD1022: 56
A1023: GOALKICKERS | O1023: GRAY | Q1023: OVERS | W1023: PORT MELBOURNE | X1023: 13 | Y1023: 5 | Z1023: 1 | AA1023: 2130 | AB1023: 1810 | AC1023: 117.68 | AD1023: 54
A1024: PRAHRAN | C1024: MORROW 3 | F1024: FERGEUS 2 | I1024: MONOHAN 2 | L1024: MOLONEY 2 | O1024: OPREY 2 | Q1024: CULLEN | S1024: BURGESS | W1024: SANDRINGHAM | X1024: 13 | Y1024: 6 | Z1024: 0 | AA1024: 1951 | AB1024: 1713 | AC1024: 113.89375364856976 | AD1024: 52
A1025: BRIGHTON | C1025: McINDOE 5 | F1025: DOUGLAS 4 | I1025: HALL 3 | K1025: WARBURTON | N1025: PINDER | W1025: PRAHRAN | X1025: 13 | Y1025: 6 | Z1025: 0 | AA1025: 2087 | AB1025: 1865 | AC1025: 111.9 | AD1025: 52
A1027: BRUNSWICK | C1027: 2 | D1027: 1 | E1027: =C1027*6+D1027 -> 13 | G1027: 4 | H1027: 2 | I1027: =G1027*6+H1027 -> 26 | K1027: 6 | L1027: 4 | M1027: =K1027*6+L1027 -> 40 | O1027: 8 | P1027: 8 | Q1027: =O1027*6+P1027 -> 56 | S1027: BRUNSWICK | W1027: BRUNSWICK | X1027: 11 | Y1027: 7 | Z1027: 1 | AA1027: 1831 | AB1027: 1750 | AC1027: 104.62857142857143 | AD1027: 46
A1028: SANDRINGHAM | C1028: 1 | D1028: 4 | E1028: =C1028*6+D1028 -> 10 | G1028: 1 | H1028: 10 | I1028: =G1028*6+H1028 -> 16 | K1028: 2 | L1028: 15 | M1028: =K1028*6+L1028 -> 27 | O1028: 4 | P1028: 19 | Q1028: =O1028*6+P1028 -> 43 | S1028: McGAW | W1028: BRIGHTON | X1028: 11 | Y1028: 8 | Z1028: 0 | AA1028: 2303 | AB1028: 2040 | AC1028: 112.8921568627451 | AD1028: 44
A1029: BEST PLAYERS | W1029: CAMBERWELL | X1029: 10 | Y1029: 9 | Z1029: 0 | AA1029: 1981 | AB1029: 1924 | AC1029: 102.96257796257797 | AD1029: 40
A1030: BRUNSWICK | C1030: GEISLER | F1030: GLASSCOTT | I1030: R SHAW | L1030: POWELL | N1030: WELDON | Q1030: S STEWART | W1030: OAKLEIGH | X1030: 7 | Y1030: 12 | Z1030: 0 | AA1030: 1808 | AB1030: 2059 | AC1030: 87.809616318601257 | AD1030: 28
A1031: SANDRINGHAM | C1031: PARKER | F1031: COLLINS | I1031: PATTERSON | L1031: SALES | N1031: O'TOOLE | Q1031: IRVINE | W1031: COBURG | X1031: 6 | Y1031: 12 | Z1031: 1 | AA1031: 1792 | AB1031: 1894 | AC1031: 94.614572333685317 | AD1031: 26
A1032: GOALKICKERS | W1032: PRESTON | X1032: 6 | Y1032: 12 | Z1032: 1 | AA1032: 1628 | AB1032: 1830 | AC1032: 88.961748633879779 | AD1032: 26
A1033: BRUNSWICK | C1033: POWELL 3 | F1033: UPTON 2 | I1033: PRIESTLEY | L1033: HENRYS | N1033: WELDON | W1033: YARRAVILLE | X1033: 6 | Y1033: 13 | Z1033: 0 | AA1033: 1940 | AB1033: 2288 | AC1033: 84.790209790209786 | AD1033: 24
A1034: SANDRINGHAM | C1034: PARKER 2 | F1034: COLLINS | I1034: BROKENSHIRE | W1034: NORTHCOTE | X1034: 2 | Y1034: 17 | Z1034: 0 | AA1034: 1384 | AB1034: 1970 | AC1034: 70.253807106598984 | AD1034: 8
A1036: PORT MELBOURNE | C1036: 4 | D1036: 7 | E1036: =C1036*6+D1036 -> 31 | G1036: 9 | H1036: 13 | I1036: =G1036*6+H1036 -> 67 | K1036: 13 | L1036: 17 | M1036: =K1036*6+L1036 -> 95 | O1036: 19 | P1036: 21 | Q1036: =O1036*6+P1036 -> 135 | S1036: PORT MELBOURNE
A1037: CAMBERWELL | C1037: 1 | D1037: 5 | E1037: =C1037*6+D1037 -> 11 | G1037: 3 | H1037: 9 | I1037: =G1037*6+H1037 -> 27 | K1037: 5 | L1037: 12 | M1037: =K1037*6+L1037 -> 42 | O1037: 6 | P1037: 14 | Q1037: =O1037*6+P1037 -> 50 | S1037: THOMAS
A1038: BEST PLAYERS
A1039: PORT MELBOURNE | C1039: FINDLAY | F1039: FERGUSON | I1039: MANN | L1039: BUTCHER | O1039: MURPHY | Q1039: BAKER
A1040: CAMBERWELL | C1040: BOYALL | F1040: SHARPLES | I1040: NAISMITH | L1040: CAMPBELL | O1040: McIVOR | Q1040: BOHAN
A1041: GOALKICKERS
A1042: PORT MELBOURNE | C1042: FINDLAY 6 | F1042: HOUSTON 5 | I1042: LEWIS 2 | K1042: MURPHY 2 | N1042: WORRALL 2 | Q1042: HARRISON | T1042: MENZIES
A1043: CAMBERWELL | C1043: COLLIER 2 | F1043: BOHAN | H1043: JENSEN | J1043: SEELENMEYER | M1043: MCIVOR
A1045: WILLIAMSTOWN | C1045: 4 | D1045: 4 | E1045: =C1045*6+D1045 -> 28 | G1045: 9 | H1045: 8 | I1045: =G1045*6+H1045 -> 62 | K1045: 11 | L1045: 13 | M1045: =K1045*6+L1045 -> 79 | O1045: 15 | P1045: 16 | Q1045: =O1045*6+P1045 -> 106 | S1045: WILLIAMSTOWN
A1046: COBURG | C1046: 2 | D1046: 5 | E1046: =C1046*6+D1046 -> 17 | G1046: 5 | H1046: 9 | I1046: =G1046*6+H1046 -> 39 | K1046: 8 | L1046: 11 | M1046: =K1046*6+L1046 -> 59 | O1046: 10 | P1046: 13 | Q1046: =O1046*6+P1046 -> 73 | S1046: EGAN
A1047: BEST PLAYERS
A1048: WILLIAMSTOWN | C1048: DOWLING | F1048: SALVAS | I1048: HARLEY | L1048: TODD | O1048: McRAE | R1048: SPRING
A1049: COBURG | C1049: QUINN | F1049: MILTE | I1049: CONDON | L1049: PROMNITZ | O1049: HOGAN | R1049: ENGELEEMER
A1050: GOALKICKERS
A1051: WILLIAMSTOWN | C1051: SPRING 4 | F1051: McPHERSON 3 | I1051: DOWLING 3 | L1051: TODD 2 | N1051: BERNARD 2 | Q1051: SCOTT
A1052: COBURG | C1052: QUINN 2 | F1052: CONDON 2 | I1052: WILSON 2 | L1052: LONSDALE | N1052: ROGAN | P1052: MILTE | R1052: WALSH
A1054: YARRAVILLE | C1054: 4 | D1054: 2 | E1054: =C1054*6+D1054 -> 26 | G1054: 8 | H1054: 4 | I1054: =G1054*6+H1054 -> 52 | K1054: 15 | L1054: 5 | M1054: =K1054*6+L1054 -> 95 | O1054: 16 | P1054: 10 | Q1054: =O1054*6+P1054 -> 106 | S1054: PRESTON
A1055: PRESTON | C1055: 5 | D1055: 2 | E1055: =C1055*6+D1055 -> 32 | G1055: 6 | H1055: 10 | I1055: =G1055*6+H1055 -> 46 | K1055: 8 | L1055: 13 | M1055: =K1055*6+L1055 -> 61 | O1055: 14 | P1055: 17 | Q1055: =O1055*6+P1055 -> 101 | S1055: MERRINGTON
A1056: BEST PLAYERS
A1057: YARRAVILLE | C1057: PHILLIPS | F1057: HARRIS | I1057: ELDRIDGE | L1057: SCAEFFE | O1057: SPENCE | R1057: FAIRFULL
A1058: PRESTON | C1058: PRITCHARD | F1058: HINDS | I1058: HOPGOOD | L1058: LEYDEN | O1058: HARRISON | R1058: POTTER
A1059: GOALKICKERS
A1060: YARRAVILLE | C1060: PHILLIPS 5 | F1060: HARRISON 3 | I1060: SCARFFE 2 | L1060: HARRIS 2 | N1060: SPENCE 2 | P1060: McASEY | R1060: GARRICK
A1061: PRESTON | C1061: POTTER 7 | F1061: CONROY 2 | I1061: HARRISON | K1061: DUNSTAN | M1061: PASCOE | O1061: GOLDIN | Q1061: MASLEN
A1063: OAKLEIGH | C1063: 3 | D1063: 7 | E1063: =C1063*6+D1063 -> 25 | G1063: 6 | H1063: 9 | I1063: =G1063*6+H1063 -> 45 | K1063: 9 | L1063: 10 | M1063: =K1063*6+L1063 -> 64 | O1063: 12 | P1063: 11 | Q1063: =O1063*6+P1063 -> 83 | S1063: OAKLEIGH
A1064: NORTHCOTE | C1064: 2 | D1064: 3 | E1064: =C1064*6+D1064 -> 15 | G1064: 4 | H1064: 10 | I1064: =G1064*6+H1064 -> 34 | K1064: 8 | L1064: 12 | M1064: =K1064*6+L1064 -> 60 | O1064: 11 | P1064: 15 | Q1064: =O1064*6+P1064 -> 81 | S1064: JOHNS
A1065: BEST PLAYERS
A1066: OAKLEIGH | C1066: BAXTER | F1066: WILSON | I1066: R FINN | L1066: HORWILL | O1066: E RYAN | R1066: SANDAY
A1067: NORTHCOTE | C1067: McINTOSH | F1067: SCOTT | I1067: WHITE | L1067: GALLAGHER | O1067: HISCOX | R1067: FARRELL
A1068: GOALKICKERS
A1069: OAKLEIGH | C1069: POWER 3 | F1069: TUDOR 2 | I1069: RUNDELL 2 | L1069: MERRIMAN 2 | O1069: PERKINS | Q1069: RAY | S1069: NOONAN
A1070: NORTHCOTE | C1070: McINTOSH 4 | F1070: FARRELL 2 | I1070: ARMOUR | K1070: MCCRACKEN | N1070: GALLAGHER | Q1070: KINDER | S1070: POWELL
A1072: ROUND 20 | D1072: 23TH AUGUST | J1072: WEATHER | M1072: COLD DULL RAIN ALL MORNING | S1072: PLAYED AT
D1073: 1ST QTR | H1073: 2ND QTR | L1073: 3RD QTR | P1073: FINAL | S1073: BEACH ROAD
A1074: SANDRINGHAM | C1074: 2 | D1074: 4 | E1074: =C1074*6+D1074 -> 16 | G1074: 5 | H1074: 10 | I1074: =G1074*6+H1074 -> 40 | K1074: 12 | L1074: 19 | M1074: =K1074*6+L1074 -> 91 | O1074: 16 | P1074: 23 | Q1074: =O1074*6+P1074 -> 119 | S1074: UMPIRE | X1074: LADDER | AB1074: ROUND | AD1074: 20
A1075: PRAHRAN | C1075: 6 | D1075: 6 | E1075: =C1075*6+D1075 -> 42 | G1075: 8 | H1075: 10 | I1075: =G1075*6+H1075 -> 58 | K1075: 12 | L1075: 12 | M1075: =K1075*6+L1075 -> 84 | O1075: 14 | P1075: 14 | Q1075: =O1075*6+P1075 -> 98 | S1075: WRIGHT
A1076: BEST PLAYERS | W1076: TEAM | X1076: W | Y1076: L | Z1076: D | AA1076: FOR | AB1076: AGST | AC1076: % | AD1076: PTS
A1077: SANDRINGHAM | C1077: PATTERSON | F1077: BROKENSHIRE | I1077: GRAMBEAU | L1077: WEBB | N1077: TOYNE | Q1077: BENCRAFT
A1078: PRAHRAN | C1078: BOURKE | F1078: GROVE | I1078: WINBERG | L1078: MORROW | N1078: FERGEUS | Q1078: MONOHAN | W1078: WILLIAMSTOWN | X1078: 15 | Y1078: 5 | Z1078: 0 | AA1078: 2123 | AB1078: 1782 | AC1078: 119.1358024691358 | AD1078: 60
A1079: GOALKICKERS | W1079: PORT MELBOURNE | X1079: 14 | Y1079: 5 | Z1079: 1 | AA1079: 2261 | AB1079: 1912 | AC1079: 118.25 | AD1079: 58
A1080: SANDRINGHAM | C1080: BROKENSHIRE 6 | F1080: BENCRAFT 3 | I1080: PARKER 2 | K1080: TOMLINS 2 | N1080: POLE 2 | P1080: COLLINS | W1080: SANDRINGHAM | X1080: 14 | Y1080: 6 | Z1080: 0 | AA1080: 2070 | AB1080: 1811 | AC1080: 114.30149088901159 | AD1080: 56
A1081: PRAHRAN | C1081: GROVE 5 | E1081: FERGEUS 2 | H1081: WINBERG 2 | J1081: OPREY 2 | L1081: MORROW | N1081: MONOHAN | Q1081: BURGESS | W1081: PRAHRAN | X1081: 13 | Y1081: 7 | Z1081: 0 | AA1081: 2185 | AB1081: 1984 | AC1081: 110.13 | AD1081: 52
A1083: PORT MELBOURNE | C1083: 6 | D1083: 4 | E1083: =C1083*6+D1083 -> 40 | G1083: 9 | H1083: 7 | I1083: =G1083*6+H1083 -> 61 | K1083: 17 | L1083: 9 | M1083: =K1083*6+L1083 -> 111 | O1083: 20 | P1083: 11 | Q1083: =O1083*6+P1083 -> 131 | S1083: PORT MELBOURNE | W1083: BRIGHTON | X1083: 12 | Y1083: 8 | Z1083: 0 | AA1083: 2415 | AB1083: 2128 | AC1083: 113.48684210526316 | AD1083: 48
A1084: BRUNSWICK | C1084: 2 | D1084: 3 | E1084: =C1084*6+D1084 -> 15 | G1084: 4 | H1084: 7 | I1084: =G1084*6+H1084 -> 31 | K1084: 7 | L1084: 11 | M1084: =K1084*6+L1084 -> 53 | O1084: 14 | P1084: 18 | Q1084: =O1084*6+P1084 -> 102 | S1084: MOORE | W1084: BRUNSWICK | X1084: 11 | Y1084: 8 | Z1084: 1 | AA1084: 1933 | AB1084: 1881 | AC1084: 102.76 | AD1084: 46
A1085: BEST PLAYERS | W1085: CAMBERWELL | X1085: 10 | Y1085: 10 | Z1085: 0 | AA1085: 2069 | AB1085: 2036 | AC1085: 101.62 | AD1085: 40
A1086: PORT MELBOURNE | C1086: CULPH | E1086: MANN | H1086: THOMS | K1086: SEARLE | N1086: BUTCHER | Q1086: FINDLAY | W1086: OAKLEIGH | X1086: 8 | Y1086: 12 | Z1086: 0 | AA1086: 1930 | AB1086: 2121 | AC1086: 90.99 | AD1086: 32
A1087: BRUNSWICK | C1087: R SHAW | E1087: UPTON | H1087: BRADLEY | K1087: SUTTON | N1087: POWELL | Q1087: STEWART | W1087: COBURG | X1087: 6 | Y1087: 13 | Z1087: 1 | AA1087: 1854 | AB1087: 2016 | AC1087: 91.96 | AD1087: 26
A1088: GOALKICKERS | W1088: PRESTON | X1088: 6 | Y1088: 13 | Z1088: 1 | AA1088: 1733 | AB1088: 1968 | AC1088: 88.06 | AD1088: 26
A1089: PORT MELBOURNE | C1089: CULPH 10 | F1089: THOMS 4 | I1089: FINDLAY 3 | L1089: HOUSTON 3 | R1089: / WELDON | W1089: YARRAVILLE | X1089: 6 | Y1089: 14 | Z1089: 0 | AA1089: 2000 | AB1089: 2397 | AC1089: 83.77 | AD1089: 24
A1090: BRUNSWICK | C1090: PRIESTLEY 3 | F1090: POWELL 3 | I1090: SMITH 2 | K1090: GEISLER | M1090: UPTON | O1090: HENRYS | Q1090: STANLEY | S1090: CROUCH | W1090: NORTHCOTE | X1090: 3 | Y1090: 17 | Z1090: 0 | AA1090: 1493 | AB1090: 2038 | AC1090: 73.26 | AD1090: 12
A1092: BRIGHTON | C1092: 3 | D1092: 4 | E1092: =C1092*6+D1092 -> 22 | G1092: 10 | H1092: 10 | I1092: =G1092*6+H1092 -> 70 | K1092: 14 | L1092: 17 | M1092: =K1092*6+L1092 -> 101 | O1092: 15 | P1092: 22 | Q1092: =O1092*6+P1092 -> 112 | S1092: CAMBERWELL
A1093: CAMBERWELL | C1093: 5 | D1093: 3 | E1093: =C1093*6+D1093 -> 33 | G1093: 7 | H1093: 6 | I1093: =G1093*6+H1093 -> 48 | K1093: 9 | L1093: 11 | M1093: =K1093*6+L1093 -> 65 | O1093: 12 | P1093: 16 | Q1093: =O1093*6+P1093 -> 88 | S1093: THOMAS
A1094: BEST PLAYERS
A1095: BRIGHTON | C1095: WILLIAMSON | F1095: HEIMS | I1095: McINDOE | L1095: DOUGLAS | O1095: T NEW | R1095: HALL
A1096: CAMBERWELL | C1096: BOYALL | F1096: McIVOR | I1096: JENSEN | L1096: McDONALD | O1096: NAISMITH | R1096: HERBERT
A1097: GOALKICKERS
A1098: BRIGHTON | C1098: McINDOE 4 | F1098: HALL 3 | I1098: HEIMS 3 | K1098: WARBURTON 2 | N1098: DOUGLAS 2 | Q1098: T NEW
A1099: CAMBERWELL | C1099: McIVOR 4 | F1099: BOHAN 3 | I1099: BOYALL 2 | K1099: BRISTOWE | N1099: CAMPBELL | Q1099: McDONALD
A1101: OAKLEIGH | C1101: 4 | D1101: 1 | E1101: =C1101*6+D1101 -> 25 | G1101: 6 | H1101: 2 | I1101: =G1101*6+H1101 -> 38 | K1101: 12 | L1101: 4 | M1101: =K1101*6+L1101 -> 76 | O1101: 19 | P1101: 8 | Q1101: =O1101*6+P1101 -> 122 | S1101: COBURG
A1102: COBURG | C1102: 3 | D1102: 1 | E1102: =C1102*6+D1102 -> 19 | G1102: 5 | H1102: 9 | I1102: =G1102*6+H1102 -> 39 | K1102: 6 | L1102: 11 | M1102: =K1102*6+L1102 -> 47 | O1102: 8 | P1102: 14 | Q1102: =O1102*6+P1102 -> 62 | S1102: JONES
A1103: BEST PLAYERS
A1104: OAKLEIGH | C1104: E RYAN | F1104: ANDREW | I1104: SANDAY | L1104: S FINN | O1104: BAXTER | R1104: KELLY
A1105: COBURG | C1105: BUCKLEY | F1105: WALKER | I1105: DEMPSEY | L1105: WALSH | O1105: QUINN | R1105: PROMNITZ
A1106: GOALKICKERS
A1107: OAKLEIGH | C1107: ANDREW 4 | F1107: RUNDELL 3 | I1107: BAXTER 3 | K1107: DONNELLY 2 | N1107: KELLY 2 | P1107: POWER 2 | R1107: TUDOR | T1107: PERKINS | W1107: NOONAN
A1108: COBURG | C1108: QUINN 2 | F1108: CONDON 2 | I1108: JORGENSON | L1108: ROGAN | N1108: DEMPSEY | P1108: MILTE
A1110: NORTHCOTE | C1110: 4 | D1110: 8 | E1110: =C1110*6+D1110 -> 32 | G1110: 6 | H1110: 14 | I1110: =G1110*6+H1110 -> 50 | K1110: 11 | L1110: 17 | M1110: =K1110*6+L1110 -> 83 | O1110: 14 | P1110: 25 | Q1110: =O1110*6+P1110 -> 109 | S1110: NORTHCOTE
A1111: YARRAVILLE | C1111: 2 | D1111: 2 | E1111: =C1111*6+D1111 -> 14 | G1111: 5 | H1111: 5 | I1111: =G1111*6+H1111 -> 35 | K1111: 9 | L1111: 8 | M1111: =K1111*6+L1111 -> 62 | O1111: 10 | P1111: 8 | Q1111: =O1111*6+P1111 -> 68 | S1111: JOHNS
A1112: BEST PLAYERS
A1113: NORTHCOTE | C1113: ATKINSON | F1113: SCOTT | I1113: CASPAR | K1113: HINES | M1113: ARMOUR | P1113: KINDER
A1114: YARRAVILLE | C1114: SPENCE | F1114: HARRIS | I1114: McASEY | K1114: GARRICK | M1114: GARLICK | P1114: MALBON
A1115: GOALKICKERS
A1116: NORTHCOTE | C1116: FARRELL 4 | F1116: McCRACKEN 3 | I1116: McINTOSH 2 | L1116: GALLAGHER 2 | O1116: DOWDELL | Q1116: ARMOUR | S1116: KINDER
A1117: YARRAVILLE | C1117: MCASEY 3 | F1117: SPENCE 3 | I1117: HARRIS | K1117: GARRICK | M1117: THOMAS | O1117: PHILLIPS
A1119: WILLIAMSTOWN | C1119: 5 | D1119: 2 | E1119: =C1119*6+D1119 -> 32 | G1119: 14 | H1119: 7 | I1119: =G1119*6+H1119 -> 91 | K1119: 16 | L1119: 9 | M1119: =K1119*6+L1119 -> 105 | O1119: 21 | P1119: 12 | Q1119: =O1119*6+P1119 -> 138 | S1119: WILLIAMSTOWN
A1120: PRESTON | C1120: 3 | D1120: 2 | E1120: =C1120*6+D1120 -> 20 | G1120: 6 | H1120: 3 | I1120: =G1120*6+H1120 -> 39 | K1120: 12 | L1120: 4 | M1120: =K1120*6+L1120 -> 76 | O1120: 16 | P1120: 9 | Q1120: =O1120*6+P1120 -> 105 | S1120: MERRINGTON
A1121: BEST PLAYERS
A1122: WILLIAMSTOWN | C1122: WILLIAMS | F1122: SPRING | I1122: TODD | K1122: TAYLOR | N1122: DOWLING | Q1122: HARLEY
A1123: PRESTON | C1123: POTTER | F1123: LEHMANN | I1123: HOPGOOD | K1123: LEISHMAN | N1123: BLACKMAN | Q1123: J CONNELLY
A1124: GOALKICKERS
A1125: WILLIAMSTOWN | C1125: McPHERSON 4 | F1125: BERNARD 4 | I1125: SPRING 4 | K1125: TODD 3 | M1125: WILLIAMS 2 | P1125: SALVAS 2 | R1125: DOWLING 2
A1126: PRESTON | C1126: POTTER 8 | F1126: DUNSTAN 2 | I1126: CONROY 2 | K1126: HARRISON 2 | N1126: C STEWART | Q1126: BLACKMAN
A1128: ROUND 21 | D1128: 30TH AUGUST | J1128: WEATHER | M1128: WEST BREEZE FINE SUNNY | S1128: PLAYED AT
D1129: 1ST QTR | H1129: 2ND QTR | L1129: 3RD QTR | P1129: FINAL | S1129: BEACH ROAD
A1130: PORT MELBOURNE | C1130: 5 | D1130: 6 | E1130: =C1130*6+D1130 -> 36 | G1130: 7 | H1130: 10 | I1130: =G1130*6+H1130 -> 52 | K1130: 12 | L1130: 20 | M1130: =K1130*6+L1130 -> 92 | O1130: 17 | P1130: 26 | Q1130: =O1130*6+P1130 -> 128 | S1130: UMPIRE | X1130: LADDER | AB1130: ROUND | AD1130: 21
A1131: SANDRINGHAM | C1131: 3 | D1131: 2 | E1131: =C1131*6+D1131 -> 20 | G1131: 10 | H1131: 7 | I1131: =G1131*6+H1131 -> 67 | K1131: 14 | L1131: 7 | M1131: =K1131*6+L1131 -> 91 | O1131: 17 | P1131: 10 | Q1131: =O1131*6+P1131 -> 112 | S1131: MERRINGTON
A1132: BEST PLAYERS | W1132: TEAM | X1132: W | Y1132: L | Z1132: D | AA1132: FOR | AB1132: AGST | AC1132: % | AD1132: PTS
A1133: PORT MELBOURNE | C1133: SEXTON | F1133: MURPHY | I1133: HOUSTON | L1133: MANN | N1133: THOMAS | Q1133: FINDLAY
A1134: SANDRINGHAM | C1134: TOMLINS | F1134: BROKENSHIRE | I1134: PATTERSON | L1134: TOYNE | N1134: LAVER | Q1134: WEBB | W1134: PORT MELBOURNE | X1134: 15 | Y1134: 5 | Z1134: 1 | AA1134: 2389 | AB1134: 2024 | AC1134: 118.03 | AD1134: 62
A1135: GOALKICKERS | W1135: WILLIAMSTOWN | X1135: 15 | Y1135: 6 | Z1135: 0 | AA1135: 2232 | AB1135: 1962 | AC1135: 113.76 | AD1135: 60
A1136: PORT MELBOURNE | C1136: FINDLAY 6 | F1136: THOMS 6 | I1136: CULPH 2 | L1136: LEWIS 2 | N1136: MURPHY | W1136: SANDRINGHAM | X1136: 14 | Y1136: 7 | Z1136: 0 | AA1136: 2182 | AB1136: 1939 | AC1136: 112.53223310985044 | AD1136: 56
A1137: SANDRINGHAM | C1137: BROKENSHIRE 7 | F1137: TOMLINS 6 | I1137: BENCRAFT 2 | L1137: CERINI | N1137: PATTERSON | W1137: PRAHRAN | X1137: 13 | Y1137: 7 | Z1137: 1 | AA1137: 2311 | AB1137: 2110 | AC1137: 109.53 | AD1137: 54
A1139: BRIGHTON | C1139: 4 | D1139: 4 | E1139: =C1139*6+D1139 -> 28 | G1139: 11 | H1139: 9 | I1139: =G1139*6+H1139 -> 75 | K1139: 20 | L1139: 12 | M1139: =K1139*6+L1139 -> 132 | O1139: 27 | P1139: 18 | Q1139: =O1139*6+P1139 -> 180 | S1139: ELSTERNWICK PARK | W1139: BRIGHTON | X1139: 13 | Y1139: 8 | Z1139: 0 | AA1139: 2595 | AB1139: 2237 | AC1139: 116 | AD1139: 52
A1140: WILLIAMSTOWN | C1140: 5 | D1140: 7 | E1140: =C1140*6+D1140 -> 37 | G1140: 8 | H1140: 9 | I1140: =G1140*6+H1140 -> 57 | K1140: 9 | L1140: 17 | M1140: =K1140*6+L1140 -> 71 | O1140: 15 | P1140: 9 | Q1140: =O1140*6+P1140 -> 99 | S1140: WRIGHT | W1140: BRUNSWICK | X1140: 11 | Y1140: 9 | Z1140: 1 | AA1140: 2030 | AB1140: 2027 | AC1140: 100.14800197335964 | AD1140: 46
A1141: BEST PLAYERS | W1141: CAMBERWELL | X1141: 10 | Y1141: 11 | Z1141: 0 | AA1141: 2144 | AB1141: 2166 | AC1141: 98.984302862419213 | AD1141: 40
A1142: BRIGHTON | C1142: DOUGLAS | F1142: WILLIAMSON | I1142: NEW | L1142: TURNER | O1142: McINDOE | Q1142: ADAMSON | W1142: OAKLEIGH | X1142: 8 | Y1142: 12 | Z1142: 1 | AA1142: 2056 | AB1142: 2247 | AC1142: 91.499777481085886 | AD1142: 34
A1143: WILLIAMSTOWN | C1143: MCRAE | F1143: PEACOCK | I1143: MATTHEWS | L1143: MCPHERSON | O1143: WILLIAMS | Q1143: DOWLING | W1143: COBURG | X1143: 7 | Y1143: 13 | Z1143: 1 | AA1143: 1981 | AB1143: 2129 | AC1143: 93.048379520901833 | AD1143: 30
A1144: GOALKICKERS | M1144: PLUNKETT | P1144: CRAVEN | R1144: HALL | W1144: PRESTON | X1144: 7 | Y1144: 13 | Z1144: 1 | AA1144: 1879 | AB1144: 2065 | AC1144: 90.992736077481837 | AD1144: 30
A1145: BRIGHTON | C1145: DOUGLAS 9 | F1145: NEW 4 | H1145: ADAMSON 3 | K1145: McINDOE 3 | N1145: WARBURTON 2 | Q1145: PINDER 2 | S1145: CAVANAGH | W1145: YARRAVILLE | X1145: 7 | Y1145: 14 | Z1145: 0 | AA1145: 2138 | AB1145: 2472 | AC1145: 86.488673139158578 | AD1145: 28
A1146: WILLIAMSTOWN | C1146: TODD 3 | E1146: MCPHERSON 2 | H1146: SPRING 2 | J1146: DOWLING 2 | M1146: PEACOCK 2 | P1146: LYONS 2 | R1146: BERNARD | W1146: NORTHCOTE | X1146: 3 | Y1146: 18 | Z1146: 0 | AA1146: 1606 | AB1146: 2165 | AC1146: 74.180138568129337 | AD1146: 12
Q1147: WILLIAMS
A1148: OAKLEIGH | C1148: 8 | D1148: 3 | E1148: =C1148*6+D1148 -> 51 | G1148: 11 | H1148: 6 | I1148: =G1148*6+H1148 -> 72 | K1148: 15 | L1148: 8 | M1148: =K1148*6+L1148 -> 98 | O1148: 19 | P1148: 12 | Q1148: =O1148*6+P1148 -> 126 | S1148: OAKLEIGH
A1149: PRAHRAN | C1149: 2 | D1149: 2 | E1149: =C1149*6+D1149 -> 14 | G1149: 9 | H1149: 7 | I1149: =G1149*6+H1149 -> 61 | K1149: 15 | L1149: 8 | M1149: =K1149*6+L1149 -> 98 | O1149: 19 | P1149: 12 | Q1149: =O1149*6+P1149 -> 126 | S1149: THOMAS
A1150: BEST PLAYERS
A1151: OAKLEIGH | C1151: WILSON | F1151: E RYAN | I1151: PERKINS | L1151: BECKWITH | O1151: NOONAN | R1151: RUNDELL
A1152: PRAHRAN | C1152: HILL | F1152: GROVE | I1152: GARVIN | L1152: FERGEUS | O1152: MONOHAN | R1152: MCMAHON
A1153: GOALKICKERS
A1154: OAKLEIGH | C1154: DONNELLY 4 | F1154: KELLY 4 | H1154: RUNDELL 3 | J1154: MERRIMAN 2 | M1154: NOONAN 2 | P1154: ANDREW | R1154: BAXTER | U1154: R FINN | W1154: BECKWITH
A1155: PRAHRAN | C1155: BURGESS 4 | F1155: MONOHAN 3 | I1155: GROVE 3 | K1155: FERGEUS 3 | N1155: GARVIN 2 | Q1155: McMAHON 2 | T1155: OPREY | V1155: WINBERG
A1157: PRESTON | C1157: 6 | D1157: 2 | E1157: =C1157*6+D1157 -> 38 | G1157: 9 | H1157: 3 | I1157: =G1157*6+H1157 -> 57 | K1157: 19 | L1157: 7 | M1157: =K1157*6+L1157 -> 121 | O1157: 23 | P1157: 8 | Q1157: =O1157*6+P1157 -> 146 | S1157: PRESTON
A1158: BRUNSWICK | C1158: 2 | D1158: 4 | E1158: =C1158*6+D1158 -> 16 | G1158: 9 | H1158: 5 | I1158: =G1158*6+H1158 -> 59 | K1158: 12 | L1158: 6 | M1158: =K1158*6+L1158 -> 78 | O1158: 15 | P1158: 7 | Q1158: =O1158*6+P1158 -> 97 | S1158: McGAW
A1159: BEST PLAYERS
A1160: PRESTON | C1160: POTTER | F1160: HARRISON | I1160: CONROY | L1160: MASLEN | O1160: BLACKMAN | R1160: C STEWART
A1161: BRUNSWICK | C1161: PEIESTLEY | F1161: POWELL | I1161: R SHAW | L1161: BAGGOTT | O1161: WHELAN | R1161: GEISLER
A1162: GOALKICKERS
A1163: PRESTON | C1163: POTTER 9 | F1163: CONROY 3 | I1163: HARRISON 3 | L1163: EXELBY 2 | N1163: MASLEN 2 | Q1163: GOLDIN 2 | T1163: LEHMANN | W1163: BRYCE
A1164: BRUNSWICK | C1164: POWELL 5 | F1164: PRIESTLEY 5 | I1164: BAGGOTT 2 | L1164: CAPUANO | N1164: WHELAN | P1164: JOHNSON
A1166: COBURG | C1166: 4 | D1166: 2 | E1166: =C1166*6+D1166 -> 26 | G1166: 10 | H1166: 9 | I1166: =G1166*6+H1166 -> 69 | K1166: 14 | L1166: 12 | M1166: =K1166*6+L1166 -> 96 | O1166: 18 | P1166: 19 | Q1166: =O1166*6+P1166 -> 127 | S1166: COBURG
A1167: NORTHCOTE | C1167: 6 | D1167: 4 | E1167: =C1167*6+D1167 -> 40 | G1167: 9 | H1167: 6 | I1167: =G1167*6+H1167 -> 60 | K1167: 11 | L1167: 13 | M1167: =K1167*6+L1167 -> 79 | O1167: 16 | P1167: 17 | Q1167: =O1167*6+P1167 -> 113 | S1167: HIRST
A1168: BEST PLAYERS
A1169: COBURG | C1169: WILSON | F1169: STARBUCK | I1169: QUINN | L1169: CONDON | N1169: WALSH | P1169: PROMNITZ
A1170: NORTHCOTE | C1170: CASPAR | F1170: GREENWOOD | I1170: MCINTOSH | L1170: HISCOX | N1170: KINDER | P1170: POWELL
A1171: GOALKICKERS
A1172: COBURG | C1172: QUINN 4 | E1172: WILSON 4 | H1172: MILTE 2 | J1172: BUCKLEY 2 | M1172: WADE 2 | O1172: DEMPSEY | Q1172: WALSH | S1172: WESTCOTT | V1172: ENGELEEMER
A1173: NORTHCOTE | C1173: GREENWOOD 5 | F1173: McINTOSH 4 | I1173: MCCRACKEN 3 | L1173: GALLAGHER | O1173: POWELL | Q1173: KINDER | S1173: ATKINSON
A1175: YARRAVILLE | C1175: 4 | D1175: 4 | E1175: =C1175*6+D1175 -> 28 | G1175: 8 | H1175: 10 | I1175: =G1175*6+H1175 -> 58 | K1175: 13 | L1175: 14 | M1175: =K1175*6+L1175 -> 92 | O1175: 19 | P1175: 16 | Q1175: =O1175*6+P1175 -> 130 | S1175: YARRAVILLE
A1176: CAMBERWELL | C1176: 2 | D1176: 2 | E1176: =C1176*6+D1176 -> 14 | G1176: 4 | H1176: 7 | I1176: =G1176*6+H1176 -> 31 | K1176: 7 | L1176: 14 | M1176: =K1176*6+L1176 -> 56 | O1176: 10 | P1176: 15 | Q1176: =O1176*6+P1176 -> 75 | S1176: MOORE
A1177: BEST PLAYERS
A1178: YARRAVILLE | C1178: MALBON | F1178: HARRIS | I1178: FAIRFALL | L1178: HARDIMAN | O1178: SCARFFE | Q1178: SPENCE
A1179: CAMBERWELL | C1179: JENSEN | F1179: McIVOR | I1179: BRYCE | L1179: KENNEDY | O1179: BOHAN | Q1179: STUBBS
A1180: GOALKICKERS
A1181: YARRAVILLE | C1181: HARRIS 7 | F1181: SCARFFE 5 | I1181: PHILLIPS 2 | L1181: LANG 2 | N1181: CAVE | P1181: McASEY | R1181: GARRICK
A1182: CAMBERWELL | C1182: BOHAN 4 | F1182: BRYCE 2 | I1182: McIVOR | K1182: McDONALD | N1182: CAMPBELL | Q1182: JENSEN
A1184: ROUND 22 | D1184: 6TH SEPTEMBER | J1184: WEATHER | M1184: SOUTH WEST BREEZE FINE SUNNY | S1184: PLAYED AT
D1185: 1ST QTR | H1185: 2ND QTR | L1185: 3RD QTR | P1185: FINAL | S1185: CAMBERWELL
A1186: SANDRINGHAM | C1186: 3 | D1186: 2 | E1186: =C1186*6+D1186 -> 20 | G1186: 9 | H1186: 9 | I1186: =G1186*6+H1186 -> 63 | K1186: 10 | L1186: 11 | M1186: =K1186*6+L1186 -> 71 | O1186: 13 | P1186: 19 | Q1186: =O1186*6+P1186 -> 97 | S1186: UMPIRE | X1186: LADDER | AB1186: ROUND | AD1186: 22
A1187: CAMBERWELL | C1187: 3 | D1187: 6 | E1187: =C1187*6+D1187 -> 24 | G1187: 5 | H1187: 8 | I1187: =G1187*6+H1187 -> 38 | K1187: 8 | L1187: 14 | M1187: =K1187*6+L1187 -> 62 | O1187: 10 | P1187: 16 | Q1187: =O1187*6+P1187 -> 76 | S1187: EGAN
A1188: BEST PLAYERS | W1188: TEAM | X1188: W | Y1188: L | Z1188: D | AA1188: FOR | AB1188: AGST | AC1188: % | AD1188: PTS
A1189: SANDRINGHAM | C1189: GRAMBEAU | F1189: O'TOOLE | I1189: BROKENSHIRE | L1189: TOMLINS | N1189: PARKER | Q1189: PATTERSON
A1190: CAMBERWELL | C1190: TAYLOR | F1190: JENSEN | I1190: HERBERT | L1190: McIVOR | N1190: STUBBS | Q1190: BOYALL | W1190: WILLIAMSTOWN | X1190: 16 | Y1190: 6 | Z1190: 0 | AA1190: 2326 | AB1190: 2042 | AC1190: 113.91 | AD1190: 64
A1191: GOALKICKERS | W1191: PORT MELBOURNE | X1191: 15 | Y1191: 5 | Z1191: 1 | AA1191: 2389 | AB1191: 2024 | AC1191: 118.03 | AD1191: 62
A1192: SANDRINGHAM | C1192: BROKENSHIRE 4 | F1192: TOMLINS 3 | I1192: PARKER 3 | L1192: CERINI 2 | N1192: GUILLE | W1192: SANDRINGHAM | X1192: 15 | Y1192: 7 | Z1192: 0 | AA1192: 2279 | AB1192: 2015 | AC1192: 113.10173697270471 | AD1192: 60
A1193: CAMBERWELL | C1193: BRYCE 3 | F1193: ROCHFORD 2 | I1193: HERBERT 2 | L1193: BOYALL | N1193: McIVOR | P1193: JENSEN | W1193: PRAHRAN | X1193: 14 | Y1193: 7 | Z1193: 1 | AA1193: 2420 | AB1193: 2181 | AC1193: 110.96 | AD1193: 58
A1195: WILLIAMSTOWN | C1195: 2 | D1195: 3 | E1195: =C1195*6+D1195 -> 15 | G1195: 4 | H1195: 9 | I1195: =G1195*6+H1195 -> 33 | K1195: 7 | L1195: 15 | M1195: =K1195*6+L1195 -> 57 | O1195: 12 | P1195: 22 | Q1195: =O1195*6+P1195 -> 94 | S1195: WILLIAMSTOWN | W1195: BRIGHTON | X1195: 13 | Y1195: 9 | Z1195: 0 | AA1195: 2693 | AB1195: 2359 | AC1195: 114.15 | AD1195: 52
A1196: OAKLEIGH | C1196: 2 | D1196: 5 | E1196: =C1196*6+D1196 -> 17 | G1196: 6 | H1196: 12 | I1196: =G1196*6+H1196 -> 48 | K1196: 8 | L1196: 16 | M1196: =K1196*6+L1196 -> 64 | O1196: 10 | P1196: 20 | Q1196: =O1196*6+P1196 -> 80 | S1196: WRIGHT | W1196: BRUNSWICK | X1196: 12 | Y1196: 9 | Z1196: 1 | AA1196: 2166 | AB1196: 2126 | AC1196: 101.88 | AD1196: 50
A1197: BEST PLAYERS | W1197: CAMBERWELL | X1197: 10 | Y1197: 12 | Z1197: 0 | AA1197: 2220 | AB1197: 2263 | AC1197: 98.099867432611575 | AD1197: 40
A1198: WILLIAMSTOWN | C1198: SALVAS | F1198: SPRING | I1198: FEATHERBY | L1198: SAMPSON | O1198: HARLEY | Q1198: TODD | W1198: OAKLEIGH | X1198: 8 | Y1198: 13 | Z1198: 1 | AA1198: 2136 | AB1198: 2341 | AC1198: 91.243058521999146 | AD1198: 34
A1199: OAKLEIGH | C1199: GRAY | F1199: R FINN | I1199: COATES | L1199: MERRIMAN | O1199: WILSON | Q1199: NOONAN | W1199: COBURG | X1199: 7 | Y1199: 14 | Z1199: 1 | AA1199: 2052 | AB1199: 2238 | AC1199: 91.689008042895438 | AD1199: 30
A1200: GOALKICKERS | W1200: PRESTON | X1200: 7 | Y1200: 13 | Z1200: 1 | AA1200: 1879 | AB1200: 2065 | AC1200: 90.992736077481837 | AD1200: 30
A1201: WILLIAMSTOWN | C1201: SPRING 3 | E1201: SALVAS 2 | G1201: DOWLING 2 | J1201: BERNARD | L1201: PEACOCK | N1201: TODD | P1201: McPHERSON | R1201: SCOTT | W1201: YARRAVILLE | X1201: 7 | Y1201: 15 | Z1201: 0 | AA1201: 2237 | AB1201: 2608 | AC1201: 85.77 | AD1201: 28
A1202: OAKLEIGH | C1202: RUNDELL 4 | F1202: MERRIMAN 2 | I1202: PAY | K1202: ANDREW | M1202: KELLY | O1202: DONNELLY | W1202: NORTHCOTE | X1202: 4 | Y1202: 18 | Z1202: 0 | AA1202: 1728 | AB1202: 2263 | AC1202: 76.358815731330097 | AD1202: 16
A1204: PRAHRAN | C1204: 3 | D1204: 4 | E1204: =C1204*6+D1204 -> 22 | G1204: 10 | H1204: 8 | I1204: =G1204*6+H1204 -> 68 | K1204: 10 | L1204: 13 | M1204: =K1204*6+L1204 -> 73 | O1204: 15 | P1204: 19 | Q1204: =O1204*6+P1204 -> 109 | S1204: TOORAK PARK
A1205: COBURG | C1205: 2 | D1205: 3 | E1205: =C1205*6+D1205 -> 15 | G1205: 3 | H1205: 5 | I1205: =G1205*6+H1205 -> 23 | K1205: 7 | L1205: 7 | M1205: =K1205*6+L1205 -> 49 | O1205: 10 | P1205: 11 | Q1205: =O1205*6+P1205 -> 71 | S1205: HARRINGTON
A1206: BEST PLAYERS
A1207: PRAHRAN | C1207: FERGEUS | F1207: McMAHON | I1207: OPREY | K1207: ROACH | N1207: BUTTLING | Q1207: YATES
A1208: COBURG | C1208: PROMNITZ | F1208: MILTE | I1208: ROGAN | K1208: QUINN | N1208: PLUMMER | Q1208: WESTCOTT
A1209: GOALKICKERS
A1210: PRAHRAN | C1210: MONOHAN 3 | F1210: OPREY 3 | H1210: FERGEUS 3 | K1210: MORROW 2 | N1210: BURGESS | P1210: GROVE | R1210: SPRIGGS | U1210: OVERS
A1211: COBURG | C1211: MILTE 3 | F1211: WESTCOTT 3 | I1211: ROGAN 2 | K1211: DEMPSEY | M1211: WILSON
A1213: BRUNSWICK | C1213: 6 | D1213: 4 | E1213: =C1213*6+D1213 -> 40 | G1213: 9 | H1213: 7 | I1213: =G1213*6+H1213 -> 61 | K1213: 13 | L1213: 11 | M1213: =K1213*6+L1213 -> 89 | O1213: 20 | P1213: 17 | Q1213: =O1213*6+P1213 -> 137 | S1213: BRUNSWICK
A1214: YARRAVILLE | C1214: 4 | D1214: 2 | E1214: =C1214*6+D1214 -> 26 | G1214: 7 | H1214: 4 | I1214: =G1214*6+H1214 -> 46 | K1214: 10 | L1214: 7 | M1214: =K1214*6+L1214 -> 67 | O1214: 15 | P1214: 9 | Q1214: =O1214*6+P1214 -> 99 | S1214: JOHNS
A1215: BEST PLAYERS
A1216: BRUNSWICK | C1216: PRIESTLEY | F1216: SMITH | I1216: SILK | K1216: SUTTON | N1216: CAPUANO | Q1216: BAGGOTT
A1217: YARRAVILLE | C1217: SING | F1217: ELDRIDGE | I1217: SPENCE | K1217: HARDIMAN | N1217: PHILLIPS | Q1217: FAIRFALL
A1218: GOALKICKERS
A1219: BRUNSWICK | C1219: SMITH 4 | E1219: UPTON 4 | G1219: POWELL 3 | I1219: PRIESTLEY 3 | L1219: GLASSCOTT 3 | O1219: CAPUANO 2 | R1219: WATERS
A1220: YARRAVILLE | C1220: PHILLIPS 8 | F1220: SPENCE 3 | I1220: CAVE | K1220: FAIRFULL | N1220: SCARFFE | Q1220: HARRIS
A1222: NORTHCOTE | C1222: 3 | D1222: 6 | E1222: =C1222*6+D1222 -> 24 | G1222: 8 | H1222: 13 | I1222: =G1222*6+H1222 -> 61 | K1222: 14 | L1222: 17 | M1222: =K1222*6+L1222 -> 101 | O1222: 17 | P1222: 20 | Q1222: =O1222*6+P1222 -> 122 | S1222: NORTHCOTE
A1223: BRIGHTON | C1223: 5 | D1223: 2 | E1223: =C1223*6+D1223 -> 32 | G1223: 8 | H1223: 4 | I1223: =G1223*6+H1223 -> 52 | K1223: 11 | L1223: 5 | M1223: =K1223*6+L1223 -> 71 | O1223: 15 | P1223: 8 | Q1223: =O1223*6+P1223 -> 98 | S1223: THOMAS
A1224: BEST PLAYERS
A1225: NORTHCOTE | C1225: McINTOSH | F1225: HISCOX | I1225: GREENWOOD | L1225: ARMOUR | O1225: CASPAR | Q1225: BALDWIN
A1226: BRIGHTON | C1226: DOUGLAS | F1226: TURNER | I1226: ADAMSON | L1226: WILLIAMSON | O1226: ORGER | Q1226: HEIMS
A1227: GOALKICKERS
A1228: NORTHCOTE | C1228: BALDWIN 3 | F1228: MCINTOSH 3 | I1228: GREENWOOD 2 | L1228: ARMOUR 2 | N1228: FARRELL 2 | Q1228: MCCRACKEN 2 | U1228: WHITE 2 | X1228: KINDER
A1229: BRIGHTON | C1229: DOUGLAS 8 | F1229: CAVANAGH 2 | I1229: CONROY | K1229: ADAMSON | M1229: NEW | O1229: TURNER | Q1229: McINDOE
A1231: PORT MELBOURNE | C1231: 3 | D1231: 5 | E1231: =C1231*6+D1231 -> 23 | G1231: 7 | H1231: 12 | I1231: =G1231*6+H1231 -> 54 | K1231: 11 | L1231: 16 | M1231: =K1231*6+L1231 -> 82 | O1231: 16 | P1231: 22 | Q1231: =O1231*6+P1231 -> 118 | S1231: PORT MELBOURNE
A1232: PRESTON | C1232: 4 | D1232: 3 | E1232: =C1232*6+D1232 -> 27 | G1232: 7 | H1232: 6 | I1232: =G1232*6+H1232 -> 48 | K1232: 11 | L1232: 10 | M1232: =K1232*6+L1232 -> 76 | O1232: 12 | P1232: 11 | Q1232: =O1232*6+P1232 -> 83 | S1232: BARNES
A1233: BEST PLAYERS
A1234: PORT MELBOURNE | C1234: SEARLE | F1234: REYNOLDS | I1234: BUTCHER | L1234: THOMS | O1234: LEWIS | R1234: FINDLAY
A1235: PRESTON | C1235: DUNSTAN | F1235: S STEWART | I1235: HINDS | L1235: BRYCE | O1235: BLACKMAN | R1235: GOLDIN
A1236: GOALKICKERS
A1237: PORT MELBOURNE | C1237: CULPH 8 | F1237: FINDLAY 3 | I1237: THOMS 3 | L1237: LOCK | N1237: HOUSTON
A1238: PRESTON | C1238: BRYCE 3 | F1238: DUNSTAN 3 | I1238: GOLDIN 2 | L1238: EXELBY 2 | N1238: HARRISON | Q1238: MASLEN
A1240: FINALS
A1241: 1ST SEMI | D1241: 13TH SEPTEMBER | J1241: WEATHER | L1241: NORTH WIND MILD SUNNY
A1242: SANDRINGHAM | C1242: 1 | D1242: 3 | E1242: =C1242*6+D1242 -> 9 | G1242: 3 | H1242: 4 | I1242: =G1242*6+H1242 -> 22 | K1242: 7 | L1242: 5 | M1242: =K1242*6+L1242 -> 47 | O1242: 10 | P1242: 8 | Q1242: 68 | S1242: JUNCTION OVAL
A1243: PRAHRAN | C1243: 2 | D1243: 7 | E1243: =C1243*6+D1243 -> 19 | G1243: 4 | H1243: 8 | I1243: =G1243*6+H1243 -> 32 | K1243: 6 | L1243: 15 | M1243: =K1243*6+L1243 -> 51 | O1243: 6 | P1243: 16 | Q1243: 52 | S1243: MERRINGTON
A1244: BEST PLAYERS
A1245: SANDRINGHAM | C1245: GRAMBEAU | F1245: TOMLINS | I1245: EVANS | L1245: WEBB | N1245: TOYNE | P1245: CERINI
A1246: PRAHRAN | C1246: ROACH | F1246: SPRIGGS | I1246: MCMAHON | L1246: NEWTON | N1246: BURGESS | P1246: GROVE
A1247: GOALKICKERS
A1248: SANDRINGHAM | C1248: BROKENSHIRE 3 | F1248: CERINI 2 | H1248: WEBB | J1248: PARKER | L1248: TOMLINS | N1248: GRAMBEAU | Q1248: COLLINS
A1249: PRAHRAN | C1249: FERGEUS 2 | F1249: GROVE | H1249: McMAHON | J1249: BURGESS | L1249: OPREY
A1251: 2ND SEMI | C1251: 20TH SEPTEMBER | J1251: WEATHER | L1251: SOUTH WEST BREEZE COOL FINE
A1252: PORT MELBOURNE | C1252: 2 | D1252: 6 | E1252: =C1252*6+D1252 -> 18 | G1252: 11 | H1252: 8 | I1252: =G1252*6+H1252 -> 74 | K1252: 14 | L1252: 9 | M1252: =K1252*6+L1252 -> 93 | O1252: 20 | P1252: 19 | Q1252: 139 | S1252: JUNCTION OVAL
A1253: WILLIAMSTOWN | C1253: 7 | D1253: 4 | E1253: =C1253*6+D1253 -> 46 | G1253: 8 | H1253: 8 | I1253: =G1253*6+H1253 -> 56 | K1253: 13 | L1253: 15 | M1253: =K1253*6+L1253 -> 93 | O1253: 15 | P1253: 20 | Q1253: 110 | S1253: MERRINGTON
A1254: BEST PLAYERS
A1255: PORT MELBOURNE | C1255: CULPH | F1255: REYNOLDS | I1255: LEWIS | K1255: MANN | N1255: BAKER | Q1255: TREMBATH
A1256: WILLIAMSTOWN | C1256: DOWLING | F1256: TODD | I1256: McRAE | K1256: MATTHEWS | N1256: McPHERSON | Q1256: SPRING
A1257: GOALKICKERS
A1258: PORT MELBOURNE | C1258: CULPH 7 | F1258: FINDLAY 4 | I1258: HOUSTON 4 | L1258: LEWIS 3 | N1258: MURPHY | P1258: FERGUSON
A1259: WILLIAMSTOWN | C1259: TODD 6 | F1259: McPHERSON 3 | I1259: SPRING | K1259: WILLIAMS | M1259: EVANS | O1259: PEACOCK | Q1259: DOWLING | T1259: CAMERON
A1261: PRELIMINARY FINAL | F1261: 27TH SEPTEMBER | K1261: WEATHER | M1261: NORTH WIND MILD SUNNY
A1262: SANDRINGHAM | C1262: 3 | D1262: 3 | E1262: =C1262*6+D1262 -> 21 | G1262: 6 | H1262: 11 | I1262: =G1262*6+H1262 -> 47 | K1262: 9 | L1262: 13 | M1262: =K1262*6+L1262 -> 67 | O1262: 16 | P1262: 21 | Q1262: 117 | S1262: JUNCTION OVAL
A1263: WILLIAMSTOWN | C1263: 8 | D1263: 3 | E1263: =C1263*6+D1263 -> 51 | G1263: 9 | H1263: 7 | I1263: =G1263*6+H1263 -> 61 | K1263: 14 | L1263: 14 | M1263: =K1263*6+L1263 -> 98 | O1263: 16 | P1263: 18 | Q1263: 114 | S1263: MERRINGTON
A1264: BEST PLAYERS
A1265: SANDRINGHAM | C1265: GRAMBEAU | F1265: COLLINS | I1265: PARKER | L1265: PATTERSON | O1265: SALES | R1265: TOYNE
A1266: WILLIAMSTOWN | C1266: PEACOCK | F1266: WILCOX | I1266: TODD | L1266: SPRING | O1266: SAMPSON | R1266: HARLEY
A1267: GOALKICKERS
A1268: SANDRINGHAM | C1268: TOMLINS 5 | F1268: COLLINS 4 | I1268: BROKENSHIRE 2 | L1268: BENCRAFT | N1268: PARKER | P1268: SALES | R1268: CERINI | T1268: PATTERSON
A1269: WILLIAMSTOWN | C1269: TODD 4 | F1269: McPHERSON 3 | I1269: DOWLING 3 | L1269: SPRING 3 | N1269: PEACOCK 2 | Q1269: SALVAS
A1271: GRAND FINAL | D1271: 4TH OCTOBER | J1271: WEATHER | L1271: NO WIND HEAVY RAIN
A1272: PORT MELBOURNE | C1272: 6 | D1272: 3 | E1272: 39 | G1272: 9 | H1272: 5 | I1272: 59 | K1272: 12 | L1272: 11 | M1272: 83 | O1272: 15 | P1272: 13 | Q1272: 103 | S1272: JUNCTION OVAL
A1273: SANDRINGHAM | C1273: 1 | D1273: 1 | E1273: 7 | G1273: 5 | H1273: 5 | I1273: 35 | K1273: 6 | L1273: 7 | M1273: 43 | O1273: 11 | P1273: 8 | Q1273: 74 | S1273: BARNES
A1274: BEST PLAYERS
A1275: PORT MELBOURNE | C1275: FINDLAY | F1275: HOUSTON | I1275: THOMS | L1275: BUTCHER | O1275: BAKER | R1275: LEWIS
A1276: SANDRINGHAM | C1276: TOYNE | F1276: PATTERSON | I1276: WEBB | L1276: TOMLINS | O1276: COLLINS | R1276: EVANS
A1277: GOALKICKERS
A1278: PORT MELBOURNE | C1278: HOUSTON 5 | F1278: THOMS 3 | I1278: FINDLAY 3 | L1278: REYNOLDS | N1278: CULPH | P1278: LEWIS | R1278: MURPHY
A1279: SANDRINGHAM | C1279: BROKENSHIRE 3 | F1279: COLLINS 3 | I1279: PARKER 2 | L1279: SALES | N1279: TOYNE | P1279: GUILLE
A1281: OTHER GAME | E1281: 16TH JUNE
A1282: V.F.A | C1282: 5 | D1282: 0 | E1282: =C1282*6+D1282 -> 30 | G1282: 10 | H1282: 4 | I1282: =G1282*6+H1282 -> 64 | M1282: =K1282*6+L1282 -> 0 | O1282: 17 | P1282: 5 | Q1282: 107 | S1282: GOLDEN SQUARE
A1283: BENDIGO | C1283: 5 | D1283: 2 | E1283: =C1283*6+D1283 -> 32 | G1283: 11 | H1283: 4 | I1283: =G1283*6+H1283 -> 70 | M1283: =K1283*6+L1283 -> 0 | O1283: 19 | P1283: 7 | Q1283: 121
A1284: BEST PLAYERS
A1285: V.F.A | C1285: TOYNE | F1285: PRITCHARD | I1285: DUNSTAN | L1285: ENGELEEMER | O1285: BRADLEY | R1285: RAWLINSON
A1286: BENDIGO | C1286: EGAN | F1286: BROKENSHIRE | I1286: BLACKMAN | L1286: TUPPER | O1286: DAVIDSON | R1286: BENNETT
A1287: GOALKICKERS
A1288: V.F.A | C1288: PRITCHARD 9 | F1288: TOYNE 2 | I1288: GREENLAND | L1288: CERINI | N1288: HARRISON | Q1288: DUNSTAN | T1288: JENSEN | V1288: FITT
A1289: BENDIGO | C1289: BROKENSHIRE 10 | F1289: TUPPER 3 | I1289: BLACKMAN 2 | L1289: EGAN 2 | N1289: RANKINS | Q1289: BENNETT