A1: Victorian Football Association
A2: Season 1948
A3: © Copyright Wal Williams | F3: First created: 2 November 2014
A4: Contact: joywalwi at gmail dot com | F4: Last updated: 27 January 2018 | W4: VFA Results and tables - Link to the main index page
A5: You are free to copy this document in whole or part provided that proper acknowledgement is given to the author. All rights reserved.
A7: YEAR 1948
A8: ROUND 1 | D8: 17TH APRIL | J8: WEATHER | M8: SOUTH EAST WIND FINE | S8: PLAYED AT
D9: 1ST QTR | H9: 2ND QTR | L9: 3RD QTR | P9: FINAL | S9: ELSTENWICK PARK
A10: PRAHRAN | C10: 8 | D10: 5 | E10: =C10*6+D10 -> 53 | G10: 11 | H10: 6 | I10: =G10*6+H10 -> 72 | K10: 19 | L10: 10 | M10: =K10*6+L10 -> 124 | O10: 24 | P10: 13 | Q10: =O10*6+P10 -> 157 | S10: UMPIRE | X10: LADDER | AB10: ROUND | AD10: 1
A11: PORT MELBOURNE | C11: 3 | D11: 6 | E11: =C11*6+D11 -> 24 | G11: 9 | H11: 13 | I11: =G11*6+H11 -> 67 | K11: 11 | L11: 17 | M11: =K11*6+L11 -> 83 | O11: 18 | P11: 23 | Q11: =O11*6+P11 -> 131 | S11: THOMAS
A12: BEST PLAYERS | W12: TEAM | X12: W | Y12: L | Z12: D | AA12: FOR | AB12: AGST | AC12: % | AD12: PTS
A13: PRAHRAN | C13: DYER | F13: GARVIN | I13: WOODS | L13: JONES | N13: O'NEILL | Q13: HILL
A14: PORT MELBOURNE | C14: HOULIHAN | F14: SEXTON | I14: REYNOLDS | L14: CULPH | N14: LEWIS | Q14: BLAKE | W14: WILLIAMSTOWN | X14: 1 | Y14: 0 | Z14: 0 | AA14: 132 | AB14: 76 | AC14: 173.68421052631578 | AD14: 4
A15: GOALKICKERS | W15: BRUNSWICK | X15: 1 | Y15: 0 | Z15: 0 | AA15: 114 | AB15: 90 | AC15: 126.66666666666667 | AD15: 4
A16: PRAHRAN | C16: WOODS 8 | F16: DYER 6 | H16: O'NEILL 3 | J16: MORROW 3 | M16: FERGEUS 2 | P16: BURGESS | R16: OVERS | W16: PRAHRAN | X16: 1 | Y16: 0 | Z16: 0 | AA16: 157 | AB16: 131 | AC16: 119.84732824427481 | AD16: 4
A17: PORT MELBOURNE | C17: CULPH 5 | F17: HOUSTON 5 | I17: HOULIHAN 2 | L17: LEWIS 2 | N17: FINDLAY 2 | Q17: MURPHY | S17: EGAN | W17: PRESTON | X17: 1 | Y17: 0 | Z17: 0 | AA17: 154 | AB17: 133 | AC17: 115.78947368421052 | AD17: 4
A19: BRUNSWICK | C19: 4 | D19: 3 | E19: =C19*6+D19 -> 27 | G19: 9 | H19: 4 | I19: =G19*6+H19 -> 58 | K19: 13 | L19: 11 | M19: =K19*6+L19 -> 89 | O19: 17 | P19: 12 | Q19: =O19*6+P19 -> 114 | S19: COBURG | W19: CAMBERWELL | X19: 1 | Y19: 0 | Z19: 0 | AA19: 115 | AB19: 103 | AC19: 111.65048543689321 | AD19: 4
A20: COBURG | C20: 3 | D20: 3 | E20: =C20*6+D20 -> 21 | G20: 8 | H20: 7 | I20: =G20*6+H20 -> 55 | K20: 9 | L20: 10 | M20: =K20*6+L20 -> 64 | O20: 12 | P20: 18 | Q20: =O20*6+P20 -> 90 | S20: MERRINGTON | W20: BRIGHTON | X20: 1 | Y20: 0 | Z20: 0 | AA20: 100 | AB20: 99 | AC20: 101.01010101010101 | AD20: 4
A21: BEST PLAYERS | W21: NORTHCOTE | X21: 0 | Y21: 1 | Z21: 0 | AA21: 99 | AB21: 100 | AC21: 99 | AD21: 0
A22: BRUNSWICK | C22: R SHAW | F22: PRIESTLEY | I22: McLEOD | L22: BAGGOTT | N22: POWER | Q22: SPENCER | W22: OAKLEIGH | X22: 0 | Y22: 1 | Z22: 0 | AA22: 103 | AB22: 115 | AC22: 89.565217391304344 | AD22: 0
A23: COBURG | C23: ROGAN | F23: FEWKES | I23: STARBUCK | L23: BUCKLEY | N23: CONDON | Q23: SMITH | W23: SANDRINGHAM | X23: 0 | Y23: 1 | Z23: 0 | AA23: 133 | AB23: 154 | AC23: 86.36363636363636 | AD23: 0
A24: GOALKICKERS | W24: PORT MELBOURNE | X24: 0 | Y24: 1 | Z24: 0 | AA24: 131 | AB24: 157 | AC24: 83.439490445859875 | AD24: 0
A25: BRUNSWICK | C25: BAGGOTT 5 | F25: PRIESTLEY 3 | I25: POWELL 3 | K25: SPENCER 2 | N25: McLEOD 2 | Q25: SUTTON | S25: SMITH | W25: COBURG | X25: 0 | Y25: 1 | Z25: 0 | AA25: 90 | AB25: 114 | AC25: 78.94736842105263 | AD25: 0
A26: COBURG | C26: ROGAN 4 | F26: WILKINSON 2 | I26: WALSH | K26: WILLIS | M26: WALKER | O26: QUINN | Q26: CLAPTON | S26: CONDON | W26: YARRAVILLE | X26: 0 | Y26: 1 | Z26: 0 | AA26: 76 | AB26: 132 | AC26: 57.575757575757578 | AD26: 0
A28: PRESTON | C28: 4 | D28: 5 | E28: =C28*6+D28 -> 29 | G28: 8 | H28: 10 | I28: =G28*6+H28 -> 58 | K28: 16 | L28: 15 | M28: =K28*6+L28 -> 111 | O28: 23 | P28: 16 | Q28: =O28*6+P28 -> 154 | S28: BEACH ROAD
A29: SANDRINGHAM | C29: 5 | D29: 2 | E29: =C29*6+D29 -> 32 | G29: 14 | H29: 7 | I29: =G29*6+H29 -> 91 | K29: 15 | L29: 11 | M29: =K29*6+L29 -> 101 | O29: 20 | P29: 13 | Q29: =O29*6+P29 -> 133 | S29: EGAN
A30: BEST PLAYERS
A31: PRESTON | C31: HINDS | F31: PRITCHARD | I31: KERLIN | K31: S STEWART | N31: LEISHMAN | Q31: BLACKMAN
A32: SANDRINGHAM | C32: TOYNE | F32: PATTERSON | I32: B HARPER | K32: M GRAMBEAU | N32: RUSSELL | Q32: R GRAMBEAU
A33: GOALKICKERS
A34: PRESTON | C34: POTTER 7 | F34: BRYCE 4 | I34: BROWN 3 | K34: DUNSTAN 3 | N34: BLACKMAN 3 | Q34: KERLIN 2 | T34: MEARS
A35: SANDRINGHAM | C35: B HARPER 7 | F35: BENNETT 3 | I35: PATTERSON 3 | L35: COPELAND 2 | O35: HEADEN 2 | Q35: WHITE 2 | T35: BENCRAFT
A37: WILLIAMSTOWN | C37: 2 | D37: 6 | E37: =C37*6+D37 -> 18 | G37: 8 | H37: 15 | I37: =G37*6+H37 -> 63 | K37: 11 | L37: 19 | M37: =K37*6+L37 -> 85 | O37: 18 | P37: 24 | Q37: =O37*6+P37 -> 132 | S37: WILLIAMSTOWN
A38: YARRAVILLE | C38: 2 | D38: 3 | E38: =C38*6+D38 -> 15 | G38: 3 | H38: 4 | I38: =G38*6+H38 -> 22 | K38: 7 | L38: 13 | M38: =K38*6+L38 -> 55 | O38: 10 | P38: 16 | Q38: =O38*6+P38 -> 76 | S38: WRIGHT
A39: BEST PLAYERS
A40: WILLIAMSTOWN | C40: TODD | F40: M McPHEROSN | I40: A WILLIAMS | L40: KNOTT | O40: SALVAS | R40: McRAE
A41: YARRAVILLE | C41: FAIRFULL | F41: PHILLIPS | I41: HARRIS | L41: SCARFFE | O41: MORRIS | R41: WOOD
A42: GOALKICKERS
A43: WILLIAMSTOWN | C43: TODD 10 | F43: M McPHERSON 4 | J43: A WILLIAMS 2 | N43: KNOTT | P43: DOWLING
A44: YARRAVILLE | C44: PHILLIPS 3 | F44: HARRIS 2 | I44: SCARFFE 2 | L44: FAIRFULL | N44: MORRIS | P44: PARKER
A46: CAMBERWELL | C46: 4 | D46: 1 | E46: =C46*6+D46 -> 25 | G46: 6 | H46: 3 | I46: =G46*6+H46 -> 39 | K46: 11 | L46: 7 | M46: =K46*6+L46 -> 73 | O46: 18 | P46: 7 | Q46: =O46*6+P46 -> 115 | S46: OAKLEIGH
A47: OAKLEIGH | C47: 0 | D47: 7 | E47: =C47*6+D47 -> 7 | G47: 4 | H47: 10 | I47: =G47*6+H47 -> 34 | K47: 10 | L47: 17 | M47: =K47*6+L47 -> 77 | O47: 14 | P47: 19 | Q47: =O47*6+P47 -> 103 | S47: BARNES
A48: BEST PLAYERS
A49: CAMBERWELL | C49: CRACKNELL | F49: SEELENMEYER | I49: BOHAN | K49: J BRADFORD | N49: McIVOR | Q49: MACE
A50: OAKLEIGH | C50: HORNE | F50: DONNELLY | I50: JORY | K50: BAXTER | N50: HORWILL | Q50: NOONAN
A51: GOALKICKERS
A52: CAMBERWELL | C52: CRACKNELL 7 | F52: HERBERT 3 | I52: BOHAN 3 | K52: McDONALD 2 | N52: J BRADFORD | Q52: G BRADFORD | T52: STUBBS
A53: OAKLEIGH | C53: JORY 5 | F53: DONNELLY 4 | I53: HORNE 4 | K53: RUNDELL
A55: BRIGHTON | C55: 4 | D55: 4 | E55: =C55*6+D55 -> 28 | G55: 7 | H55: 6 | I55: =G55*6+H55 -> 48 | K55: 11 | L55: 10 | M55: =K55*6+L55 -> 76 | O55: 15 | P55: 10 | Q55: =O55*6+P55 -> 100 | S55: NORTHCOTE
A56: NORTHCOTE | C56: 4 | D56: 1 | E56: =C56*6+D56 -> 25 | G56: 8 | H56: 9 | I56: =G56*6+H56 -> 57 | K56: 12 | L56: 11 | M56: =K56*6+L56 -> 83 | O56: 14 | P56: 15 | Q56: =O56*6+P56 -> 99 | S56: JOHNS
A57: BEST PLAYERS
A58: BRIGHTON | C58: WARBURTON | F58: WILLIAMSON | I58: BURKE | K58: HALL | N58: STRETTON | Q58: ADAMSON
A59: NORTHCOTE | C59: GREENHAM | F59: CASPAR | I59: McINTOSH | K59: HISCOX | N59: POWELL | Q59: KNIGHT
A60: GOALKICKERS
A61: BRIGHTON | C61: WARBURTON 7 | F61: ADAMSON 3 | I61: DOUGLAS 2 | L61: STRETTON | N61: T NEW | P61: COMBER
A62: NORTHCOTE | C62: BOYLE 2 | E62: WHITECHURCH 2 | I62: POWELL 2 | K62: FARRELL 2 | N62: HINES | P62: STABB | R62: McCRACKEN | V62: KNIGHT
A64: ROUND 2 | D64: 24TH APRIL | G64: WEATHER | J64: DULL DRIZZLING RAIN IN MORNING GROUNDS SLIPPERY | S64: PLAYED AT
D65: 1ST QTR | H65: 2ND QTR | L65: 3RD QTR | P65: FINAL | S65: CAMBERWELL
A66: PRAHRAN | C66: 0 | D66: 6 | E66: =C66*6+D66 -> 6 | G66: 5 | H66: 14 | I66: =G66*6+H66 -> 44 | K66: 6 | L66: 19 | M66: =K66*6+L66 -> 55 | O66: 13 | P66: 19 | Q66: =O66*6+P66 -> 97 | S66: UMPIRE | X66: LADDER | AB66: ROUND | AD66: 2
A67: CAMBERWELL | C67: 3 | D67: 5 | E67: =C67*6+D67 -> 23 | G67: 4 | H67: 6 | I67: =G67*6+H67 -> 30 | K67: 6 | L67: 11 | M67: =K67*6+L67 -> 47 | O67: 8 | P67: 13 | Q67: =O67*6+P67 -> 61 | S67: JOHNS
A68: BEST PLAYERS | W68: TEAM | X68: W | Y68: L | Z68: D | AA68: FOR | AB68: AGST | AC68: % | AD68: PTS
A69: PRAHRAN | C69: DYER | F69: NEWTON | I69: BOURKE | K69: WOODS | N69: YATES | P69: GARVIN
A70: CAMBERWELL | C70: McIVOR | F70: STUBBS | I70: BOHAN | K70: KINDER | N70: PAGE | P70: COOK | W70: WILLIAMSTOWN | X70: 2 | Y70: 0 | Z70: 0 | AA70: 248 | AB70: 185 | AC70: 134.05405405405406 | AD70: 8
A71: GOALKICKERS | W71: PRAHRAN | X71: 2 | Y71: 0 | Z71: 0 | AA71: 254 | AB71: 192 | AC71: 132.29166666666666 | AD71: 8
A72: PRAHRAN | C72: WOODS 6 | F72: DYER 2 | I72: BURGESS 2 | L72: MORROW 2 | O72: NORRIS | W72: BRIGHTON | X72: 2 | Y72: 0 | Z72: 0 | AA72: 215 | AB72: 199 | AC72: 108.04020100502512 | AD72: 8
A73: CAMBERWELL | C73: BOHAN 3 | F73: McDONALD | I73: KINDER | K73: FLOWERS | M73: BRISTOWE | P73: STUBBS | W73: NORTHCOTE | X73: 1 | Y73: 1 | Z73: 0 | AA73: 205 | AB73: 164 | AC73: 125 | AD73: 4
A75: OAKLEIGH | C75: 5 | D75: 7 | E75: =C75*6+D75 -> 37 | G75: 7 | H75: 9 | I75: =G75*6+H75 -> 51 | K75: 12 | L75: 16 | M75: =K75*6+L75 -> 88 | O75: 13 | P75: 18 | Q75: =O75*6+P75 -> 96 | S75: PRESTON | W75: BRUNSWICK | X75: 1 | Y75: 1 | Z75: 0 | AA75: 223 | AB75: 206 | AC75: 108.25242718446601 | AD75: 4
A76: PRESTON | C76: 2 | D76: 2 | E76: =C76*6+D76 -> 14 | G76: 6 | H76: 5 | I76: =G76*6+H76 -> 41 | K76: 8 | L76: 5 | M76: =K76*6+L76 -> 53 | O76: 14 | P76: 9 | Q76: =O76*6+P76 -> 93 | S76: McGAW | W76: PRESTON | X76: 1 | Y76: 1 | Z76: 0 | AA76: 247 | AB76: 229 | AC76: 107.86026200873363 | AD76: 4
A77: BEST PLAYERS | W77: SANDRINGHAM | X77: 1 | Y77: 1 | Z77: 0 | AA77: 231 | AB77: 239 | AC77: 96.65271966527196 | AD77: 4
A78: OAKLEIGH | C78: JORY | F78: R FINN | I78: DONNELLY | K78: NOONAN | N78: RUNDELL | Q78: BAXTER | W78: OAKLEIGH | X78: 1 | Y78: 1 | Z78: 0 | AA78: 199 | AB78: 208 | AC78: 95.67307692307692 | AD78: 4
A79: PRESTON | C79: POTTER | F79: R BRYCE | I79: MEARS | K79: DUNSTAN | N79: HINDS | Q79: KERLIN | W79: CAMBERWELL | X79: 1 | Y79: 1 | Z79: 0 | AA79: 176 | AB79: 200 | AC79: 88 | AD79: 4
A80: GOALKICKERS | W80: PORT MELBOURNE | X80: 0 | Y80: 2 | Z80: 0 | AA80: 216 | AB80: 255 | AC80: 84.705882352941174 | AD80: 0
A81: OAKLEIGH | C81: JORY 3 | E81: RUNDELL 2 | H81: NOONAN 2 | J81: DONNELLY 2 | M81: HORNE 2 | O81: PERKINS | Q81: SCOTT | W81: COBURG | X81: 0 | Y81: 2 | Z81: 0 | AA81: 190 | AB81: 229 | AC81: 82.969432314410483 | AD81: 0
A82: PRESTON | C82: POTTER 5 | E82: DUNSTAN 2 | H82: R BRYCE 2 | J82: MEARS | L82: FITT | M82: HINDS | O82: GOLDIN | Q82: KERLIN | W82: YARRAVILLE | X82: 0 | Y82: 2 | Z82: 0 | AA82: 140 | AB82: 238 | AC82: 58.823529411764703 | AD82: 0
A84: SANDRINGHAM | C84: 3 | D84: 2 | E84: =C84*6+D84 -> 20 | G84: 9 | H84: 3 | I84: =G84*6+H84 -> 57 | K84: 13 | L84: 5 | M84: =K84*6+L84 -> 83 | O84: 15 | P84: 8 | Q84: =O84*6+P84 -> 98 | S84: PORT MELBOURNE
A85: PORT MELBOURNE | C85: 5 | D85: 4 | E85: =C85*6+D85 -> 34 | G85: 8 | H85: 5 | I85: =G85*6+H85 -> 53 | K85: 12 | L85: 9 | M85: =K85*6+L85 -> 81 | O85: 12 | P85: 13 | Q85: =O85*6+P85 -> 85 | S85: MERRINGTON
A86: BEST PLAYERS
A87: SANDRINGHAM | C87: TOYNE | F87: PATTERSON | I87: BENCRAFT | L87: COPELAND | O87: ELLIOTT | R87: WEBB
A88: PORT MELBOURNE | C88: LEWIS | F88: REYNOLDS | I88: STEEL | L88: HOUSTON | O88: SEARLE | R88: BAKER
A89: GOALKICKERS
A90: SANDRINGHAM | C90: CERINI 4 | F90: BENCRAFT 4 | I90: B HARPER 3 | L90: ELLIOTT 2 | O90: BENNETT | R90: PATTERSON
A91: PORT MELBOURNE | C91: LEWIS 4 | F91: HOUSTON 3 | I91: FINDLAY 2 | L91: HOULIHAN | O91: HARRISON | R91: EGAN
A93: BRIGHTON | C93: 7 | D93: 5 | E93: =C93*6+D93 -> 47 | G93: 9 | H93: 11 | I93: =G93*6+H93 -> 65 | K93: 15 | L93: 17 | M93: =K93*6+L93 -> 107 | O93: 16 | P93: 19 | Q93: =O93*6+P93 -> 115 | S93: ELSTERNWICK PARK
A94: COBURG | C94: 1 | D94: 1 | E94: =C94*6+D94 -> 7 | G94: 8 | H94: 7 | I94: =G94*6+H94 -> 55 | K94: 8 | L94: 9 | M94: =K94*6+L94 -> 57 | O94: 14 | P94: 16 | Q94: =O94*6+P94 -> 100 | S94: THOMAS
A95: BEST PLAYERS
A96: BRIGHTON | C96: ADAMSON | F96: HOWE | I96: McINDOE | L96: BURKE | O96: HALL | R96: WILLIAMSON
A97: COBURG | C97: ROGAN | F97: BUCKLEY | I97: WILLIS | L97: WALSH | O97: STARBUCK | R97: FEWKES
A98: GOALKICKERS
A99: BRIGHTON | C99: ADAMSON 6 | F99: McINDOE 3 | I99: HOWE 2 | K99: DOUGLAS 2 | N99: PLUNKETT | Q99: STRETTON | T99: WARBURTON
A100: COBURG | C100: ROGAN 4 | F100: BUCKLEY 3 | I100: WILLIS 2 | K100: STARBUCK | N100: QUINN | P100: JAMES | R100: McLEAN | U100: WALSH
D101: 26TH APRIL | H101: WEATHER | K101: DULL NO WIND
A102: WILLIAMSTOWN | C102: 3 | D102: 5 | E102: =C102*6+D102 -> 23 | G102: 8 | H102: 11 | I102: =G102*6+H102 -> 59 | K102: 14 | L102: 12 | M102: =K102*6+L102 -> 96 | O102: 17 | P102: 14 | Q102: =O102*6+P102 -> 116 | S102: BRUNSWICK
A103: BRUNSWICK | C103: 3 | D103: 4 | E103: =C103*6+D103 -> 22 | G103: 7 | H103: 8 | I103: =G103*6+H103 -> 50 | K103: 12 | L103: 12 | M103: =K103*6+L103 -> 84 | O103: 16 | P103: 13 | Q103: =O103*6+P103 -> 109 | S103: BARNES
A104: BEST PLAYERS
A105: WILLIAMSTOWN | C105: M McPHERSON | F105: CHAPMAN | I105: G WILLIAMS | L105: A WILLIAMS | O105: SAMPSON | R105: DANCKERT
A106: BRUNSWICK | C106: R SHAW | F106: STANLEY | I106: SMITH | L106: PRIESTLEY | O106: GEISLER | R106: NAISMITH
A107: GOALKICKERS
A108: WILLIAMSTOWN | C108: M McPHERSON 4 | F108: TODD 2 | H108: SALVAS 2 | J108: A WILLIAMS 2 | M108: G WILLIAMS 2 | P108: DOWLING 2 | S108: COLLINS 2 | W108: PEACOCK
A109: BRUNSWICK | C109: STANLEY 4 | F109: SMITH 3 | H109: POWELL 3 | J109: BAGGOTT | M109: PRIESTLEY | O109: R SHAW | Q109: WHELAN | S109: CROUCH | V109: McLEOD
A111: NORTHCOTE | C111: 1 | D111: 6 | E111: =C111*6+D111 -> 12 | G111: 4 | H111: 9 | I111: =G111*6+H111 -> 33 | K111: 14 | L111: 13 | M111: =K111*6+L111 -> 97 | O111: 15 | P111: 16 | Q111: =O111*6+P111 -> 106 | S111: YARRAVILLE
A112: YARRAVILLE | C112: 3 | D112: 2 | E112: =C112*6+D112 -> 20 | G112: 6 | H112: 6 | I112: =G112*6+H112 -> 42 | K112: 6 | L112: 8 | M112: =K112*6+L112 -> 44 | O112: 9 | P112: 10 | Q112: =O112*6+P112 -> 64 | S112: EGAN
A113: BEST PLAYERS
A114: NORTHCOTE | C114: HISCOX | F114: KNIGHT | I114: NASH | L114: FARRELL | O114: McINTOSH | R114: WHITE
A115: YARRAVILLE | C115: GARLICK | F115: FAIRFULL | I115: MORRIS | L115: SING | O115: HARDIMAN | R115: SCARFFE
A116: GOALKICKERS
A117: NORTHCOTE | C117: NASH 6 | F117: FARRELL 3 | I117: McINTOSH 2 | L117: GALE | N117: STABB | P117: WOOLNOUGH | S117: KNIGHT
A118: YARRAVILLE | C118: PHILLIPS 3 | F118: SCARFFE 2 | I118: RUDDELL 2 | L118: PARKER | N118: FAIRFULL
A120: ROUND 3 | D120: 1ST MAY | J120: WEATHER | M120: WARM SUNNY NO WIND | S120: PLAYED AT
D121: 1ST QTR | H121: 2ND QTR | L121: 3RD QTR | P121: FINAL | S121: OAKLEIGH
A122: BRIGHTON | C122: 1 | D122: 5 | E122: =C122*6+D122 -> 11 | G122: 7 | H122: 12 | I122: =G122*6+H122 -> 54 | K122: 9 | L122: 15 | M122: =K122*6+L122 -> 69 | O122: 17 | P122: 22 | Q122: =O122*6+P122 -> 124 | S122: UMPIRE | X122: LADDER | AB122: ROUND | AD122: 3
A123: OAKLEIGH | C123: 3 | D123: 4 | E123: =C123*6+D123 -> 22 | G123: 4 | H123: 6 | I123: =G123*6+H123 -> 30 | K123: 11 | L123: 8 | M123: =K123*6+L123 -> 74 | O123: 13 | P123: 9 | Q123: =O123*6+P123 -> 87 | S123: MERRINGTON
A124: BEST PLAYERS | W124: TEAM | X124: W | Y124: L | Z124: D | AA124: FOR | AB124: AGST | AC124: % | AD124: PTS
A125: BRIGHTON | C125: PINDER | F125: WILLIAMSON | I125: WARBURTON | L125: COMBER | N125: McASEY | Q125: McINDOE
A126: OAKLEIGH | C126: NOONAN | F126: BEARD | I126: HORNE | L126: BAXTER | N126: JORY | Q126: HARRISON | W126: BRIGHTON | X126: 3 | Y126: 0 | Z126: 0 | AA126: 339 | AB126: 286 | AC126: 118.53146853146853 | AD126: 12
A127: GOALKICKERS | P127: CONROY | R127: STRETTON | W127: NORTHCOTE | X127: 2 | Y127: 1 | Z127: 0 | AA127: 303 | AB127: 252 | AC127: 120.23809523809524 | AD127: 8
A128: BRIGHTON | C128: HOWE 4 | E128: WARBURTON 3 | H128: McINDOE 2 | J128: DOUGLAS 2 | M128: PERRY | O128: PINDER | Q128: PICKERING | T128: BURKE | W128: PRAHRAN | X128: 2 | Y128: 1 | Z128: 0 | AA128: 342 | AB128: 290 | AC128: 117.93103448275862 | AD128: 8
A129: OAKLEIGH | C129: HORNE 3 | F129: MILGATE 3 | I129: NOONAN 2 | L129: RUNDELL 2 | O129: JORY | Q129: BAXTER | S129: WILLIAMS | W129: BRUNSWICK | X129: 2 | Y129: 1 | Z129: 0 | AA129: 330 | AB129: 281 | AC129: 117.43772241992883 | AD129: 8
A131: CAMBERWELL | C131: 10 | D131: 7 | E131: =C131*6+D131 -> 67 | G131: 12 | H131: 10 | I131: =G131*6+H131 -> 82 | K131: 17 | L131: 14 | M131: =K131*6+L131 -> 116 | O131: 19 | P131: 17 | Q131: =O131*6+P131 -> 131 | S131: BEACH ROAD | W131: WILLIAMSTOWN | X131: 2 | Y131: 1 | Z131: 0 | AA131: 326 | AB131: 283 | AC131: 115.19434628975264 | AD131: 8
A132: SANDRINGHAM | C132: 0 | D132: 5 | E132: =C132*6+D132 -> 5 | G132: 4 | H132: 11 | I132: =G132*6+H132 -> 35 | K132: 10 | L132: 16 | M132: =K132*6+L132 -> 76 | O132: 15 | P132: 23 | Q132: =O132*6+P132 -> 113 | S132: BARNES | W132: CAMBERWELL | X132: 2 | Y132: 1 | Z132: 0 | AA132: 307 | AB132: 313 | AC132: 98.08306709265176 | AD132: 8
A133: BEST PLAYERS | W133: PRESTON | X133: 1 | Y133: 2 | Z133: 0 | AA133: 322 | AB133: 336 | AC133: 95.833333333333329 | AD133: 4
A134: CAMBERWELL | C134: G BRADFORD | F134: BOHAN | I134: McIVOR | K134: COOK | N134: PAGE | Q134: SHELLEY | W134: PORT MELBOURNE | X134: 1 | Y134: 2 | Z134: 0 | AA134: 314 | AB134: 333 | AC134: 94.294294294294289 | AD134: 4
A135: SANDRINGHAM | C135: PATTERSON | F135: TOYNE | I135: SLEIGH | K135: BENCRAFT | N135: HEADEN | Q135: B HARPER | W135: SANDRINGHAM | X135: 1 | Y135: 2 | Z135: 0 | AA135: 344 | AB135: 370 | AC135: 92.972972972972968 | AD135: 4
A136: GOALKICKERS | W136: OAKLEIGH | X136: 1 | Y136: 2 | Z136: 0 | AA136: 286 | AB136: 332 | AC136: 86.144578313253007 | AD136: 4
A137: CAMBERWELL | C137: BOHAN 8 | E137: G BRADFORD 3 | H137: SHELLEY 2 | J137: McDONALD 2 | M137: BRISTOWE 2 | P137: STUBBS | R137: UNSTEAD | W137: YARRAVILLE | X137: 1 | Y137: 2 | Z137: 0 | AA137: 227 | AB137: 305 | AC137: 74.426229508196727 | AD137: 4
A138: SANDRINGHAM | C138: B HARPER 6 | F138: BENCRAFT 4 | I138: CERINI | K138: HEADEN | M138: COPELAND | P138: BENNETT | R138: TOYNE | W138: COBURG | X138: 0 | Y138: 3 | Z138: 0 | AA138: 257 | AB138: 316 | AC138: 81.329113924050631 | AD138: 0
C139: 8TH MAY | G139: WEATHER | J139: SOUTH WEST WIND SHOWERS COLD
A140: BRUNSWICK | C140: 3 | D140: 5 | E140: =C140*6+D140 -> 23 | G140: 10 | H140: 8 | I140: =G140*6+H140 -> 68 | K140: 12 | L140: 8 | M140: =K140*6+L140 -> 80 | O140: 16 | P140: 11 | Q140: =O140*6+P140 -> 107 | S140: PRESTON
A141: PRESTON | C141: 2 | D141: 3 | E141: =C141*6+D141 -> 15 | G141: 4 | H141: 5 | I141: =G141*6+H141 -> 29 | K141: 9 | L141: 11 | M141: =K141*6+L141 -> 65 | O141: 10 | P141: 15 | Q141: =O141*6+P141 -> 75 | S141: MERRINGTON
A142: BEST PLAYERS
A143: BRUNSWICK | C143: BAGGOTT | F143: GLASSCOTT | I143: HALL | K143: SMITH | N143: POWELL | Q143: WHELAN
A144: PRESTON | C144: DUNSTAN | F144: BLACKMAN | I144: MEARS | K144: POTTER | N144: PRITCHARD | Q144: LEHMANN
A145: GOALKICKERS
A146: BRUNSWICK | C146: BAGGOTT 7 | F146: POWELL 3 | I146: PRIESTLEY 2 | L146: ROGERS | N146: STANLEY | Q146: RINGROSE | T146: McLEOD
A147: PRESTON | C147: POTTER 4 | F147: GOLDIN 3 | I147: DUNSTAN 2 | L147: GRINDELL
C148: 15TH MAY | I148: WEATHER | L148: NORTH WIND DULL CLOUDY VERY COLD
A149: NORTHCOTE | C149: 2 | D149: 0 | E149: =C149*6+D149 -> 12 | G149: 8 | H149: 12 | I149: =G149*6+H149 -> 60 | K149: 8 | L149: 16 | M149: =K149*6+L149 -> 64 | O149: 12 | P149: 26 | Q149: =O149*6+P149 -> 98 | S149: ELSTERNWICK PARK
A150: PRAHRAN | C150: 4 | D150: 9 | E150: =C150*6+D150 -> 33 | G150: 4 | H150: 11 | I150: =G150*6+H150 -> 35 | K150: 10 | L150: 15 | M150: =K150*6+L150 -> 75 | O150: 12 | P150: 16 | Q150: =O150*6+P150 -> 88 | S150: WRIGHT
A151: BEST PLAYERS
A152: NORTHCOTE | C152: FARRELL | E152: HISCOX | H152: WHITE | K152: McINTOSH | N152: KNIGHT | Q152: CASPAR
A153: PRAHRAN | C153: HILL | E153: JONES | H153: NEWTON | K153: D'OLIVER | N153: ROACH | Q153: OVERS
A154: GOALKICKERS
A155: NORTHCOTE | C155: WALLIS 3 | E155: WHITE 2 | G155: PAWSEY (2) | J155: NASH | L155: McINTOSH | O155: KNIGHT | Q155: CASPAR | S155: STABB
A156: PRAHRAN | C156: McCULLOCH 3 | F156: NORRIS 3 | I156: OVERS | K156: O'NEILL | M156: NEWTON | O156: GROVE | Q156: YATES | S156: WALSH
A158: YARRAVILLE | C158: 5 | D158: 7 | E158: =C158*6+D158 -> 37 | G158: 6 | H158: 8 | I158: =G158*6+H158 -> 44 | K158: 12 | L158: 15 | M158: =K158*6+L158 -> 87 | O158: 12 | P158: 15 | Q158: =O158*6+P158 -> 87 | S158: YARRAVILLE
A159: COBURG | C159: 1 | D159: 5 | E159: =C159*6+D159 -> 11 | G159: 6 | H159: 10 | I159: =G159*6+H159 -> 46 | K159: 6 | L159: 12 | M159: =K159*6+L159 -> 48 | O159: 8 | P159: 19 | Q159: =O159*6+P159 -> 67 | S159: EGAN
A160: BEST PLAYERS
A161: YARRAVILLE | C161: TESTRAIL | F161: HARRIS | I161: HARDIMAN | L161: MORRIS | O161: RUDDEL | R161: COLLINS
A162: COBURG | C162: QUINN | F162: WILSON | I162: ROGAN | L162: JAMES | O162: BUCKLEY | R162: WADE
A163: GOALKICKERS
A164: YARRAVILLE | C164: HARDIMAN 3 | F164: HARRIS 2 | I164: TESTRAIL 2 | L164: PHILLIPS | N164: WOOD | P164: MALBON | R164: RUNDELL | U164: COLLINS
A165: COBURG | C165: ROGAN 3 | F165: JAMES 2 | I165: BUCKLEY | K165: CONDON | M165: McILVEEN
A167: PORT MELBOURNE | C167: 6 | D167: 3 | E167: =C167*6+D167 -> 39 | G167: 6 | H167: 4 | I167: =G167*6+H167 -> 40 | K167: 12 | L167: 8 | M167: =K167*6+L167 -> 80 | O167: 15 | P167: 8 | Q167: =O167*6+P167 -> 98 | S167: PORT MELBOURNE
A168: WILLIAMSTOWN | C168: 1 | D168: 3 | E168: =C168*6+D168 -> 9 | G168: 5 | H168: 5 | I168: =G168*6+H168 -> 35 | K168: 7 | L168: 7 | M168: =K168*6+L168 -> 49 | O168: 11 | P168: 12 | Q168: =O168*6+P168 -> 78 | S168: MERRINGTON
A169: BEST PLAYERS
A170: PORT MELBOURNE | C170: TUCKER | F170: REYNOLDS | I170: BAKER | L170: CULPH | O170: MANN | Q170: FINDLAY
A171: WILLIAMSTOWN | C171: SAMPSON | F171: DANCKERT | I171: MATTHEWS | L171: PEACOCK | O171: TODD | Q171: CAMERON
A172: GOALKICKERS
A173: PORT MELBOURNE | C173: HOUSTON 4 | F173: CULPH 4 | I173: FINDLAY 2 | L173: HOULIHAN 2 | O173: LEWIS | Q173: REYNOLDS | T173: TUCKER
A174: WILLIAMSTOWN | C174: TODD 4 | E174: SALVAS 2 | H174: M McPHERSON | K174: COLLINS | M174: PEACOCK | O174: SCOTT | Q174: G WILLIAMS
A176: ROUND 4 | D176: 1ST MAY | J176: WEATHER | M176: WARM SUNNY NO WIND | S176: PLAYED AT
D177: 1ST QTR | H177: 2ND QTR | L177: 3RD QTR | P177: FINAL | S177: ELSTERNWICK PARK
A178: PRESTON | C178: 4 | D178: 2 | E178: =C178*6+D178 -> 26 | G178: 9 | H178: 9 | I178: =G178*6+H178 -> 63 | K178: 16 | L178: 13 | M178: =K178*6+L178 -> 109 | O178: 22 | P178: 14 | Q178: =O178*6+P178 -> 146 | S178: UMPIRE | X178: LADDER | AB178: ROUND | AD178: 4
A179: PRAHRAN | C179: 6 | D179: 4 | E179: =C179*6+D179 -> 40 | G179: 10 | H179: 11 | I179: =G179*6+H179 -> 71 | K179: 12 | L179: 15 | M179: =K179*6+L179 -> 87 | O179: 15 | P179: 19 | Q179: =O179*6+P179 -> 109 | S179: EGAN
A180: BEST PLAYERS | W180: TEAM | X180: W | Y180: L | Z180: D | AA180: FOR | AB180: AGST | AC180: % | AD180: PTS
A181: PRESTON | C181: MEARS | F181: S STEWART | I181: BLACKMAN | L181: LEISHMAN | O181: FITT | Q181: DUNCAN
A182: PRAHRAN | C182: GARVIN | F182: DYER | I182: O'NEILL | L182: SPRIGGS | O182: WOODS | Q182: HILL | W182: BRIGHTON | X182: 4 | Y182: 0 | Z182: 0 | AA182: 460 | AB182: 332 | AC182: 138.55421686746988 | AD182: 16
A183: GOALKICKERS | P183: S STEWART | W183: NORTHCOTE | X183: 3 | Y183: 1 | Z183: 0 | AA183: 431 | AB183: 314 | AC183: 137.26114649681529 | AD183: 12
A184: PRESTON | C184: POTTER 6 | E184: R BRYCE 5 | H184: MEARS 3 | J184: DUNSTAN 2 | M184: PRITCHARD 2 | P184: K BRYCE 2 | R184: BLACKMAN | W184: BRUNSWICK | X184: 3 | Y184: 1 | Z184: 0 | AA184: 405 | AB184: 344 | AC184: 117.73255813953489 | AD184: 12
A185: PRAHRAN | C185: WOODS 5 | E185: MORROW 2 | H185: OPREY 2 | J185: BURGESS | L185: O'NEILL | N185: DYER | P185: GARVIN | R185: NEWTON | W185: WILLIAMSTOWN | X185: 2 | Y185: 2 | Z185: 0 | AA185: 393 | AB185: 353 | AC185: 111.3314447592068 | AD185: 8
Q186: WALSH
A187: COBURG | C187: 7 | D187: 2 | E187: =C187*6+D187 -> 44 | G187: 9 | H187: 8 | I187: =G187*6+H187 -> 62 | K187: 14 | L187: 10 | M187: =K187*6+L187 -> 94 | O187: 18 | P187: 18 | Q187: =O187*6+P187 -> 126 | S187: COBURG | W187: PRESTON | X187: 2 | Y187: 2 | Z187: 0 | AA187: 468 | AB187: 445 | AC187: 105.1685393258427 | AD187: 8
A188: PORT MELBOURNE | C188: 5 | D188: 3 | E188: =C188*6+D188 -> 33 | G188: 9 | H188: 7 | I188: =G188*6+H188 -> 61 | K188: 14 | L188: 11 | M188: =K188*6+L188 -> 95 | O188: 16 | P188: 12 | Q188: =O188*6+P188 -> 108 | S188: JOHNS | W188: PRAHRAN | X188: 2 | Y188: 2 | Z188: 0 | AA188: 451 | AB188: 436 | AC188: 103.44036697247707 | AD188: 8
A189: BEST PLAYERS | W189: CAMBERWELL | X189: 2 | Y189: 2 | Z189: 0 | AA189: 370 | AB189: 388 | AC189: 95.360824742268036 | AD189: 8
A190: COBURG | C190: ROGAN | F190: CONDON | I190: QUINN | K190: STARBUCK | N190: WALSH | Q190: JAMES | W190: OAKLEIGH | X190: 2 | Y190: 2 | Z190: 0 | AA190: 356 | AB190: 399 | AC190: 89.22305764411027 | AD190: 8
A191: PORT MELBOURNE | C191: HOUSTON | F191: BAKER | I191: EGAN | K191: TUCKER | N191: REYNOLDS | Q191: BLAKE | W191: PORT MELBOURNE | X191: 1 | Y191: 3 | Z191: 0 | AA191: 422 | AB191: 459 | AC191: 91.938997821350767 | AD191: 4
A192: GOALKICKERS | W192: COBURG | X192: 1 | Y192: 3 | Z192: 0 | AA192: 383 | AB192: 424 | AC192: 90.330188679245282 | AD192: 4
A193: COBURG | C193: ROGAN 7 | E193: JAMES 4 | G193: BUCKLEY 2 | J193: HARTRIDGE 2 | M193: CONDON | O193: WADE | Q193: R WILKINSON | W193: SANDRINGHAM | X193: 1 | Y193: 3 | Z193: 0 | AA193: 406 | AB193: 498 | AC193: 81.52610441767068 | AD193: 4
A194: PORT MELBOURNE | C194: HOUSTON 6 | F194: EGAN 3 | H194: FINDLAY 2 | J194: STEEL | L194: HOULIHAN | N194: LEWIS | P194: TUCKER | R194: HARRISON | W194: YARRAVILLE | X194: 1 | Y194: 3 | Z194: 0 | AA194: 273 | AB194: 426 | AC194: 64.08450704225352 | AD194: 4
D195: 8TH MAY | G195: WEATHER | J195: SOUTH WEST WIND SHOWERS COLD
A196: NORTHCOTE | C196: 8 | D196: 9 | E196: =C196*6+D196 -> 57 | G196: 11 | H196: 10 | I196: =G196*6+H196 -> 76 | K196: 17 | L196: 18 | M196: =K196*6+L196 -> 120 | O196: 18 | P196: 20 | Q196: =O196*6+P196 -> 128 | S196: NORTHCOTE
A197: SANDRINGHAM | C197: 3 | D197: 1 | E197: =C197*6+D197 -> 19 | G197: 6 | H197: 3 | I197: =G197*6+H197 -> 39 | K197: 7 | L197: 3 | M197: =K197*6+L197 -> 45 | O197: 9 | P197: 8 | Q197: =O197*6+P197 -> 62 | S197: JOHNS
A198: BEST PLAYERS
A199: NORTHCOTE | C199: McINTOSH | F199: GALLAGHER | I199: POWELL | L199: WHITE | O199: FARRELL | Q199: KNIGHT
A200: SANDRINGHAM | C200: PARKER | F200: TOYNE | I200: POTTER | L200: B HARPER | O200: SLEIGH | Q200: BROWN
A201: GOALKICKERS
A202: NORTHCOTE | C202: WHITE 5 | F202: NASH 3 | H202: McINTOSH 3 | K202: FARRELL 2 | N202: KNIGHT 2 | Q202: GALE | R202: STABB | T202: POWELL
A203: SANDRINGHAM | C203: PARKER 3 | F203: B HARPER 2 | I203: HEADEN | K203: BENCRAFT | M203: M GRAMBEAU | P203: BENNETT
A205: OAKLEIGH | C205: 1 | D205: 6 | E205: =C205*6+D205 -> 12 | G205: 1 | H205: 7 | I205: =G205*6+H205 -> 13 | K205: 9 | L205: 15 | M205: =K205*6+L205 -> 69 | O205: 9 | P205: 16 | Q205: =O205*6+P205 -> 70 | S205: WILLIAMSTOWN
A206: WILLIAMSTOWN | C206: 1 | D206: 4 | E206: =C206*6+D206 -> 10 | G206: 5 | H206: 8 | I206: =G206*6+H206 -> 38 | K206: 5 | L206: 9 | M206: =K206*6+L206 -> 39 | O206: 9 | P206: 13 | Q206: =O206*6+P206 -> 67 | S206: DEAGAN
A207: BEST PLAYERS
A208: OAKLEIGH | C208: NOONAN | F208: E RYAN | I208: JORY | L208: RUNDELL | O208: PAY | Q208: SMEATON
A209: WILLIAMSTOWN | C209: M McPHERSON | F209: DANCKERT | I209: A WILLIAMS | L209: DOWLING | O209: WILCOX | Q209: PEACOCK
A210: GOALKICKERS
A211: OAKLEIGH | C211: RUNDELL 2 | F211: NOONAN | H211: SMEATON | J211: WILLIAMS | M211: HORNE | O211: MILGATE | Q211: JORY | S211: PERKINS
A212: WILLIAMSTOWN | C212: M McPHERSON 3 | G212: A WILLIAMS 2 | J212: DOWLING 2 | M212: PEACOCK | O212: TODD
A214: BRIGHTON | C214: 3 | D214: 6 | E214: =C214*6+D214 -> 24 | G214: 8 | H214: 12 | I214: =G214*6+H214 -> 60 | K214: 12 | L214: 15 | M214: =K214*6+L214 -> 87 | O214: 16 | P214: 25 | Q214: =O214*6+P214 -> 121 | S214: ELSTERNWICK PARK
A215: YARRAVILLE | C215: 2 | D215: 1 | E215: =C215*6+D215 -> 13 | G215: 3 | H215: 6 | I215: =G215*6+H215 -> 24 | K215: 6 | L215: 8 | M215: =K215*6+L215 -> 44 | O215: 6 | P215: 10 | Q215: =O215*6+P215 -> 46 | S215: BARNES
A216: BEST PLAYERS
A217: BRIGHTON | C217: PINDER | F217: McINDOE | I217: WILLIAMSON | L217: COMBER | O217: HOWE | R217: STRETTON
A218: YARRAVILLE | C218: TESTRAIL | F218: MORRIS | I218: WOODS | L218: BRITT | O218: GARLICK | R218: COLLINS
A219: GOALKICKERS
A220: BRIGHTON | C220: McINDOE 8 | F220: DOUGLAS 4 | I220: HOWE 2 | K220: HEIMS | M220: PINDER
A221: YARRAVILLE | C221: SCARFFE 2 | F221: PHILLIPS 2 | I221: TESTRAIL | K221: RUDDELL
C222: 15TH MAY | I222: WEATHER | L222: NORTH WIND DULL CLOUDY VERY COLD
A223: BRUNSWICK | C223: 2 | D223: 2 | E223: =C223*6+D223 -> 14 | G223: 6 | H223: 7 | I223: =G223*6+H223 -> 43 | K223: 8 | L223: 12 | M223: =K223*6+L223 -> 60 | O223: 10 | P223: 15 | Q223: =O223*6+P223 -> 75 | S223: BRUNSWICK
A224: CAMBERWELL | C224: 3 | D224: 6 | E224: =C224*6+D224 -> 24 | G224: 4 | H224: 6 | I224: =G224*6+H224 -> 30 | K224: 8 | L224: 6 | M224: =K224*6+L224 -> 54 | O224: 9 | P224: 9 | Q224: =O224*6+P224 -> 63 | S224: JOHNS
A225: BEST PLAYERS
A226: BRUNSWICK | C226: R SHAW | F226: GLASSCOTT | I226: SMITH | L226: BAGGOTT | O226: HENRYS | R226: PRIESTLEY
A227: CAMBERWELL | C227: STUBBS | F227: McIVOR | I227: FURLONG | L227: MACE | O227: McDONALD | R227: MILLER
A228: GOALKICKERS
A229: BRUNSWICK | C229: BAGGOTT 5 | F229: GOODALL 2 | I229: HENRYS | K229: STANLEY | M229: PRIESTLEY
A230: CAMBERWELL | C230: BOHAN 2 | F230: McDONALD 2 | I230: PAGE 2 | K230: COOK | M230: G BRADFORD | P230: MACE
A232: ROUND 5 | D232: 22ND MAY | H232: WEATHER | K232: STRONG NORTH WEST WIND DULL COLD | S232: PLAYED AT
D233: 1ST QTR | H233: 2ND QTR | L233: 3RD QTR | P233: FINAL | S233: ELSTERNWICK PARK
A234: BRIGHTON | C234: 3 | D234: 1 | E234: =C234*6+D234 -> 19 | G234: 8 | H234: 8 | I234: =G234*6+H234 -> 56 | K234: 11 | L234: 9 | M234: =K234*6+L234 -> 75 | O234: 14 | P234: 16 | Q234: =O234*6+P234 -> 100 | S234: UMPIRE | X234: LADDER | AB234: ROUND | AD234: 5
A235: WILLIAMSTOWN | C235: 4 | D235: 5 | E235: =C235*6+D235 -> 29 | G235: 4 | H235: 5 | I235: =G235*6+H235 -> 29 | K235: 8 | L235: 12 | M235: =K235*6+L235 -> 60 | O235: 10 | P235: 14 | Q235: =O235*6+P235 -> 74 | S235: EGAN
A236: BEST PLAYERS | W236: TEAM | X236: W | Y236: L | Z236: D | AA236: FOR | AB236: AGST | AC236: % | AD236: PTS
A237: BRIGHTON | C237: McINDOE | F237: WILLIAMSON | I237: HOWE | L237: WARBURTON | O237: STRETTON | R237: HALL
A238: WILLIAMSTOWN | C238: WILCOX | F238: COLLINS | I238: MATTHEWS | L238: CAMERON | O238: PEACOCK | R238: BISHOP | W238: BRIGHTON | X238: 5 | Y238: 0 | Z238: 0 | AA238: 560 | AB238: 406 | AC238: 137.93103448275863 | AD238: 20
A239: GOALKICKERS | R239: CONROY | W239: BRUNSWICK | X239: 4 | Y239: 1 | Z239: 0 | AA239: 538 | AB239: 432 | AC239: 124.53703703703704 | AD239: 16
A240: BRIGHTON | C240: ADAMSON 3 | F240: McINDOE 3 | I240: DOUGLAS 2 | L240: WARBURTON 2 | O240: HOWE | Q240: STRETTON | T240: T NEW | W240: NORTHCOTE | X240: 3 | Y240: 2 | Z240: 0 | AA240: 494 | AB240: 388 | AC240: 127.31958762886597 | AD240: 12
A241: WILLIAMSTOWN | C241: TODD 4 | F241: PEACOCK 2 | I241: WILCOX | K241: SCOTT | M241: M McPHERSON | P241: COLLINS | W241: PRESTON | X241: 3 | Y241: 2 | Z241: 0 | AA241: 542 | AB241: 508 | AC241: 106.69291338582677 | AD241: 12
A243: PRESTON | C243: 5 | D243: 3 | E243: =C243*6+D243 -> 33 | G243: 6 | H243: 4 | I243: =G243*6+H243 -> 40 | K243: 10 | L243: 13 | M243: =K243*6+L243 -> 73 | O243: 10 | P243: 14 | Q243: =O243*6+P243 -> 74 | S243: PRESTON | W243: CAMBERWELL | X243: 3 | Y243: 2 | Z243: 0 | AA243: 496 | AB243: 477 | AC243: 103.9832285115304 | AD243: 12
A244: NORTHCOTE | C244: 1 | D244: 0 | E244: =C244*6+D244 -> 6 | G244: 3 | H244: 4 | I244: =G244*6+H244 -> 22 | K244: 3 | L244: 6 | M244: =K244*6+L244 -> 24 | O244: 9 | P244: 9 | Q244: =O244*6+P244 -> 63 | S244: WRIGHT | W244: OAKLEIGH | X244: 3 | Y244: 2 | Z244: 0 | AA244: 485 | AB244: 490 | AC244: 98.979591836734699 | AD244: 12
A245: BEST PLAYERS | W245: WILLIAMSTOWN | X245: 2 | Y245: 3 | Z245: 0 | AA245: 467 | AB245: 453 | AC245: 103.09050772626932 | AD245: 8
A246: PRESTON | C246: LEISHMAN | F246: DUNSTAN | I246: S STEWART | L246: CONNELLY | N246: R BRYCE | Q246: K BRYCE | W246: COBURG | X246: 2 | Y246: 3 | Z246: 0 | AA246: 504 | AB246: 505 | AC246: 99.801980198019805 | AD246: 8
A247: NORTHCOTE | C247: DUNN | F247: HISCOX | I247: GREENHAM | L247: STABB | N247: McCRACKEN | Q247: McINTOSH | W247: PRAHRAN | X247: 2 | Y247: 3 | Z247: 0 | AA247: 532 | AB247: 557 | AC247: 95.511669658886888 | AD247: 8
A248: GOALKICKERS | W248: PORT MELBOURNE | X248: 1 | Y248: 4 | Z248: 0 | AA248: 511 | AB248: 585 | AC248: 87.350427350427353 | AD248: 4
A249: PRESTON | C249: R BRYCE 2 | F249: POTTER 2 | I249: PRITCHARD | K249: GOLDIN | M249: MORRIS | O249: CONNELLY | Q249: BROWN | S249: BLACKMAN | W249: SANDRINGHAM | X249: 1 | Y249: 4 | Z249: 0 | AA249: 494 | AB249: 631 | AC249: 78.288431061806662 | AD249: 4
A250: NORTHCOTE | C250: NASH 4 | F250: POWELL | H250: McCRACKEN | K250: STABB | M250: KNIGHT | O250: FARRELL | W250: YARRAVILLE | X250: 1 | Y250: 4 | Z250: 0 | AA250: 364 | AB250: 555 | AC250: 65.585585585585591 | AD250: 4
A252: COBURG | C252: 3 | D252: 2 | E252: =C252*6+D252 -> 20 | G252: 11 | H252: 5 | I252: =G252*6+H252 -> 71 | K252: 12 | L252: 11 | M252: =K252*6+L252 -> 83 | O252: 17 | P252: 19 | Q252: =O252*6+P252 -> 121 | S252: COBURG
A253: PRAHRAN | C253: 3 | D253: 5 | E253: =C253*6+D253 -> 23 | G253: 5 | H253: 6 | I253: =G253*6+H253 -> 36 | K253: 10 | L253: 13 | M253: =K253*6+L253 -> 73 | O253: 11 | P253: 15 | Q253: =O253*6+P253 -> 81 | S253: BARNES
A254: BEST PLAYERS
A255: COBURG | C255: WILSON | F255: ROGAN | I255: JAMES | K255: QUINN | N255: WALSH | P255: WILKINSON
A256: PRAHRAN | C256: WOODS | F256: OPREY | I256: NEWTON | K256: MASTERTON | N256: DRIVER | P256: WALSH
A257: GOALKICKERS
A258: COBURG | C258: ROGAN 6 | E258: WILSON 2 | H258: JAMES 2 | J258: HARTRIDGE 2 | M258: QUINN 2 | O258: CAHIR | Q258: BUCKLEY | T258: WILKINSON
A259: PRAHRAN | C259: WOOD 2 | F259: OPREY 2 | H259: NEWTON 2 | J259: DRIVER 2 | M259: GROVE | O259: O'NEILL | Q259: BERRIMAN
A261: CAMBERWELL | C261: 8 | D261: 9 | E261: =C261*6+D261 -> 57 | G261: 11 | H261: 10 | I261: =G261*6+H261 -> 76 | K261: 15 | L261: 12 | M261: =K261*6+L261 -> 102 | O261: 17 | P261: 24 | Q261: =O261*6+P261 -> 126 | S261: CAMBERWELL
A262: PORT MELBOURNE | C262: 2 | D262: 2 | E262: =C262*6+D262 -> 14 | G262: 6 | H262: 8 | I262: =G262*6+H262 -> 44 | K262: 8 | L262: 11 | M262: =K262*6+L262 -> 59 | O262: 12 | P262: 17 | Q262: =O262*6+P262 -> 89 | S262: MILLER
A263: BEST PLAYERS
A264: CAMBERWELL | C264: McIVOR | F264: BOHAN | I264: G BRADFORD | L264: COOK | N264: MILLER | P264: STUBBS
A265: PORT MELBOURNE | C265: LOCK | F265: MANN | I265: HOUSTON | L265: FINDLAY | N265: BLAKE | P265: BAKER
A266: GOALKICKERS
A267: CAMBERWELL | C267: PAGE 5 | F267: BOHAN 4 | I267: G BRADFORD 3 | M267: McDONALD 3 | P267: MONOHAN 2
A268: PORT MELBOURNE | C268: HOUSTON 5 | F268: FINDLAY 2 | I268: EGAN | J268: CULPH | L268: HOULIHAN | N268: LEWIS | P268: LOCK
A270: OAKLEIGH | C270: 6 | D270: 10 | E270: =C270*6+D270 -> 46 | G270: 9 | H270: 14 | I270: =G270*6+H270 -> 68 | K270: 17 | L270: 21 | M270: =K270*6+L270 -> 123 | O270: 18 | P270: 21 | Q270: =O270*6+P270 -> 129 | S270: YARRAVILLE
A271: YARRAVILLE | C271: 1 | D271: 0 | E271: =C271*6+D271 -> 6 | G271: 7 | H271: 6 | I271: =G271*6+H271 -> 48 | K271: 7 | L271: 6 | M271: =K271*6+L271 -> 48 | O271: 13 | P271: 13 | Q271: =O271*6+P271 -> 91 | S271: LEE
A272: BEST PLAYERS
A273: OAKLEIGH | C273: R FINN | F273: SMEATON | I273: WILLIAMS | L273: DONNELLY | O273: BAXTER | R273: NOONAN
A274: YARRAVILLE | C274: GARLICK | F274: HARDIMAN | I274: JONES | L274: MILLER | O274: McLEOD | R274: RUDDELL
A275: GOALKICKERS
A276: OAKLEIGH | C276: NOONAN 6 | F276: R FINN 4 | I276: JORY 3 | K276: SMEATON 2 | N276: MILGATE | P276: GRAY | R276: RUNDELL
A277: YARRAVILLE | C277: HARDIMAN 5 | F277: HARRIS 3 | I277: MILLER 2 | K277: McLEOD 2 | N277: PHILLIPS
A279: BRUNSWICK | C279: 3 | D279: 1 | E279: =C279*6+D279 -> 19 | G279: 11 | H279: 8 | I279: =G279*6+H279 -> 74 | K279: 12 | L279: 10 | M279: =K279*6+L279 -> 82 | O279: 18 | P279: 25 | Q279: =O279*6+P279 -> 133 | S279: BEACH ROAD
A280: SANDRINGHAM | C280: 7 | D280: 6 | E280: =C280*6+D280 -> 48 | G280: 8 | H280: 6 | I280: =G280*6+H280 -> 54 | K280: 11 | L280: 21 | M280: =K280*6+L280 -> 87 | O280: 11 | P280: 22 | Q280: =O280*6+P280 -> 88 | S280: MERRINGTON
A281: BEST PLAYERS
A282: BRUNSWICK | C282: R SHAW | F282: PRIESTLEY | I282: WHELAN | L282: BAGGOTT | N282: POWELL | Q282: McLEOD
A283: SANDRINGHAM | C283: PARKER | F283: BENCRAFT | I283: THOMAS | L283: TOYNE | N283: HISCOCK | Q283: CERINI
A284: GOALKICKERS
A285: BRUNSWICK | C285: POWELL 4 | F285: STANLEY 3 | I285: McLEOD 3 | K285: PRIESTLEY 2 | N285: KYNE 2 | P285: N SMITH | R285: WHELAN | U285: HENRYS | X285: BAGGOTT
A286: SANDRINGHAM | C286: PARKER 6 | F286: CERINI 2 | I286: REID | K286: HISCOCK | M286: BENCRAFT
A288: ROUND 6 | D288: 5TH JUNE | F288: (POSTPONED 29TH MAY) | K288: WEATHER | O288: NORTH WIND FINE | S288: PLAYED AT
D289: 1ST QTR | H289: 2ND QTR | L289: 3RD QTR | P289: FINAL | S289: NORTHCOTE
A290: BRUNSWICK | C290: 4 | D290: 8 | E290: =C290*6+D290 -> 32 | G290: 8 | H290: 11 | I290: =G290*6+H290 -> 59 | K290: 11 | L290: 16 | M290: =K290*6+L290 -> 82 | O290: 16 | P290: 19 | Q290: =O290*6+P290 -> 115 | S290: UMPIRE | X290: LADDER | AB290: ROUND | AD290: 6
A291: NORTHCOTE | C291: 2 | D291: 1 | E291: =C291*6+D291 -> 13 | G291: 6 | H291: 3 | I291: =G291*6+H291 -> 39 | K291: 8 | L291: 5 | M291: =K291*6+L291 -> 53 | O291: 10 | P291: 8 | Q291: =O291*6+P291 -> 68 | S291: MILLER
A292: BEST PLAYERS | W292: TEAM | X292: W | Y292: L | Z292: D | AA292: FOR | AB292: AGST | AC292: % | AD292: PTS
A293: BRUNSWICK | C293: BAGGOTT | F293: GLASSCOTT | I293: THOMAS | L293: McLEOD | N293: BRADLEY | Q293: R SHAW
A294: NORTHCOTE | C294: CASPAR | F294: McINTOSH | I294: FARRELL | L294: PAWSEY | N294: GALLAGHER | Q294: HINES | W294: BRUNSWICK | X294: 5 | Y294: 1 | Z294: 0 | AA294: 653 | AB294: 500 | AC294: 130.6 | AD294: 20
A295: GOALKICKERS | W295: BRIGHTON | X295: 5 | Y295: 1 | Z295: 0 | AA295: 670 | AB295: 526 | AC295: 127.3764258555133 | AD295: 20
A296: BRUNSWICK | C296: BAGGOTT 5 | F296: BRADLEY 3 | I296: POWELL 2 | K296: McLEOD 2 | M296: STANLEY | O296: PRIESTLEY | Q296: SMITH | S296: WHELAN | W296: CAMBERWELL | X296: 4 | Y296: 2 | Z296: 0 | AA296: 615 | AB296: 583 | AC296: 105.48885077186964 | AD296: 16
A297: NORTHCOTE | C297: PAWSEY 3 | F297: WHITE 2 | I297: NASH 2 | K297: McCRACKEN | N297: McINTOSH | Q297: POWELL | W297: OAKLEIGH | X297: 4 | Y297: 2 | Z297: 0 | AA297: 625 | AB297: 599 | AC297: 104.34056761268781 | AD297: 16
A299: CAMBERWELL | C299: 5 | D299: 5 | E299: =C299*6+D299 -> 35 | G299: 7 | H299: 11 | I299: =G299*6+H299 -> 53 | K299: 10 | L299: 17 | M299: =K299*6+L299 -> 77 | O299: 16 | P299: 23 | Q299: =O299*6+P299 -> 119 | S299: CAMBERWELL | W299: NORTHCOTE | X299: 3 | Y299: 3 | Z299: 0 | AA299: 562 | AB299: 503 | AC299: 111.72962226640159 | AD299: 12
A300: PRESTON | C300: 5 | D300: 6 | E300: =C300*6+D300 -> 36 | G300: 7 | H300: 7 | I300: =G300*6+H300 -> 49 | K300: 12 | L300: 14 | M300: =K300*6+L300 -> 86 | O300: 14 | P300: 22 | Q300: =O300*6+P300 -> 106 | S300: BARNES | W300: WILLIAMSTOWN | X300: 3 | Y300: 3 | Z300: 0 | AA300: 580 | AB300: 537 | AC300: 108.0074487895717 | AD300: 12
A301: BEST PLAYERS | W301: PRESTON | X301: 3 | Y301: 3 | Z301: 0 | AA301: 648 | AB301: 627 | AC301: 103.34928229665071 | AD301: 12
A302: CAMBERWELL | C302: G BRADFORD | F302: McCREACHAN | I302: KENNEDY | L302: BOHAN | N302: McIVOR | Q302: HERBERT | W302: PRAHRAN | X302: 3 | Y302: 3 | Z302: 0 | AA302: 670 | AB302: 676 | AC302: 99.112426035502963 | AD302: 12
A303: PRESTON | C303: BLACKMAN | F303: DUNSTAN | I303: S STEWART | L303: PRITCHARD | N303: POTTER | Q303: K BRYCE | W303: COBURG | X303: 2 | Y303: 4 | Z303: 0 | AA303: 613 | AB303: 645 | AC303: 95.038759689922486 | AD303: 8
A304: GOALKICKERS | W304: PORT MELBOURNE | X304: 2 | Y304: 4 | Z304: 0 | AA304: 631 | AB304: 695 | AC304: 90.791366906474821 | AD304: 8
A305: CAMBERWELL | C305: G BRADFORD 6 | F305: HERBERT 3 | I305: BOHAN 3 | K305: McDONALD 3 | N305: MONOHAN | W305: SANDRINGHAM | X305: 1 | Y305: 5 | Z305: 0 | AA305: 578 | AB305: 744 | AC305: 77.688172043010752 | AD305: 4
A306: PRESTON | C306: DUNSTAN 4 | F306: NATHAN 3 | I306: R BRYCE 2 | L306: POTTER 2 | N306: CONNELLY 2 | Q306: BLACKMAN | W306: YARRAVILLE | X306: 1 | Y306: 5 | Z306: 0 | AA306: 483 | AB306: 693 | AC306: 69.696969696969703 | AD306: 4
A308: OAKLEIGH | C308: 2 | D308: 5 | E308: =C308*6+D308 -> 17 | G308: 9 | H308: 8 | I308: =G308*6+H308 -> 62 | K308: 16 | L308: 12 | M308: =K308*6+L308 -> 108 | O308: 21 | P308: 14 | Q308: =O308*6+P308 -> 140 | S308: OAKLEIGH
A309: COBURG | C309: 2 | D309: 4 | E309: =C309*6+D309 -> 16 | G309: 7 | H309: 8 | I309: =G309*6+H309 -> 50 | K309: 12 | L309: 11 | M309: =K309*6+L309 -> 83 | O309: 15 | P309: 19 | Q309: =O309*6+P309 -> 109 | S309: LEE
A310: BEST PLAYERS
A311: OAKLEIGH | C311: DONNELLY | F311: LE LIEVRE | I311: E RYAN | L311: BEARD | N311: MILGATE | Q311: BAXTER
A312: COBURG | C312: WALSH | F312: ROGAN | I312: JAMES | L312: STARBUCK | N312: WILSON | Q312: QUINN
A313: GOALKICKERS
A314: OAKLEIGH | C314: MILGATE 6 | F314: SMEATON 3 | I314: RUNDELL 3 | L314: E RYAN 2 | N314: JORY 2 | P314: NOONAN 2 | S314: R FINN 2 | V314: JAMES
A315: COBURG | C315: WILSON 3 | F315: ROGAN 3 | I315: JAMES 3 | K315: CONDON 2 | N315: HARTRIDGE 2 | Q315: BUCKLEY | S315: QUINN
A317: PRAHRAN | C317: 2 | D317: 4 | E317: =C317*6+D317 -> 16 | G317: 8 | H317: 9 | I317: =G317*6+H317 -> 57 | K317: 14 | L317: 14 | M317: =K317*6+L317 -> 98 | O317: 20 | P317: 18 | Q317: =O317*6+P317 -> 138 | S317: ELSTERNWICK PARK
A318: YARRAVILLE | C318: 7 | D318: 4 | E318: =C318*6+D318 -> 46 | G318: 9 | H318: 5 | I318: =G318*6+H318 -> 59 | K318: 15 | L318: 12 | M318: =K318*6+L318 -> 102 | O318: 17 | P318: 17 | Q318: =O318*6+P318 -> 119 | S318: McGAW
A319: BEST PLAYERS
A320: PRAHRAN | C320: BUTTLING | F320: WALSH | I320: JONES | L320: McCULLOCH | O320: GARVIN | Q320: NEWTON
A321: YARRAVILLE | C321: HARDIMAN | F321: WOOD | I321: TESTRAIL | L321: SAIT | O321: MALBON | Q321: COLLINS
A322: GOALKICKERS
A323: PRAHRAN | C323: McCULLOCH 5 | F323: WOODS 4 | I323: RYAN 3 | K323: MASTERTON 3 | N323: DRIVER 2 | P323: WALSH | R323: NEWTON | U323: OPREY
A324: YARRAVILLE | C324: HARDIMAN 7 | F324: RUDDELL 2 | I324: HARRIS 2 | K324: CRANAGE 2 | N324: TESTRAIL | P324: MILLER | R324: PHILLIPS | U324: COLLINS
A326: WILLIAMSTOWN | C326: 5 | D326: 3 | E326: =C326*6+D326 -> 33 | G326: 8 | H326: 7 | I326: =G326*6+H326 -> 55 | K326: 12 | L326: 15 | M326: =K326*6+L326 -> 87 | O326: 15 | P326: 23 | Q326: =O326*6+P326 -> 113 | S326: WILLIAMSTOWN
A327: SANDRINGHAM | C327: 3 | D327: 0 | E327: =C327*6+D327 -> 18 | G327: 8 | H327: 2 | I327: =G327*6+H327 -> 50 | K327: 11 | L327: 2 | M327: =K327*6+L327 -> 68 | O327: 13 | P327: 6 | Q327: =O327*6+P327 -> 84 | S327: WRIGHT
A328: BEST PLAYERS
A329: WILLIAMSTOWN | C329: TODD | E329: A WILLIAMS | H329: G WILLIAMS | K329: CAMERON | N329: M McPHERSON | Q329: PEACOCK
A330: SANDRINGHAM | C330: TOYNE | E330: PATTERSON | H330: PARKER | K330: STANLEY | N330: COPELAND | Q330: B HARPER
A331: GOALKICKERS
A332: WILLIAMSTOWN | C332: TODD 4 | E332: M McPHERSON 4 | I332: PEACOCK 3 | L332: SALVAS | N332: A WILLIAMS | Q332: TAYLOR | S332: WALKER
A333: SANDRINGHAM | C333: B HARPER 6 | F333: PARKER 2 | I333: COPELAND 2 | L333: PATTERSON | O333: CERINI | Q333: BENCRAFT
A335: PORT MELBOURNE | C335: 6 | D335: 3 | E335: =C335*6+D335 -> 39 | G335: 11 | H335: 11 | I335: =G335*6+H335 -> 77 | K335: 14 | L335: 15 | M335: =K335*6+L335 -> 99 | O335: 17 | P335: 18 | Q335: =O335*6+P335 -> 120 | S335: PORT MELBOURNE
A336: BRIGHTON | C336: 6 | D336: 5 | E336: =C336*6+D336 -> 41 | G336: 10 | H336: 15 | I336: =G336*6+H336 -> 75 | K336: 12 | L336: 17 | M336: =K336*6+L336 -> 89 | O336: 15 | P336: 20 | Q336: =O336*6+P336 -> 110 | S336: MERRINGTON
A337: BEST PLAYERS
A338: PORT MELBOURNE | C338: FINDLAY | F338: CULPH | J338: HOUSTON | M338: BUTCHER | P338: LEWIS | S338: MANN
A339: BRIGHTON | C339: McINDOE | F339: WARBURTON | J339: DOUGLAS | M339: PICKERING | P339: WILLIAMSON | S339: ADAMSON
A340: GOALKICKERS
A341: PORT MELBOURNE | C341: FINDLAY 6 | F341: HOUSTON 4 | I341: LEWIS 4 | K341: EGAN 2 | M341: CULPH
A342: BRIGHTON | C342: DOUGLAS 5 | F342: ADAMSON 5 | I342: McINDOE 3 | L342: WARBURTON 2
A344: ROUND 7 | D344: 12TH JUNE | J344: WEATHER | M344: SOUTH EAST BREEZE COLD | S344: PLAYED AT
D345: 1ST QTR | H345: 2ND QTR | L345: 3RD QTR | P345: FINAL | S345: PRESTON
A346: PRESTON | C346: 4 | D346: 3 | E346: =C346*6+D346 -> 27 | G346: 8 | H346: 12 | I346: =G346*6+H346 -> 60 | K346: 10 | L346: 15 | M346: =K346*6+L346 -> 75 | O346: 18 | P346: 19 | Q346: =O346*6+P346 -> 127 | S346: UMPIRE | X346: LADDER | AB346: ROUND | AD346: 7
A347: COBURG | C347: 5 | D347: 4 | E347: =C347*6+D347 -> 34 | G347: 7 | H347: 8 | I347: =G347*6+H347 -> 50 | K347: 10 | L347: 13 | M347: =K347*6+L347 -> 73 | O347: 14 | P347: 15 | Q347: =O347*6+P347 -> 99 | S347: McGAW
A348: BEST PLAYERS | W348: TEAM | X348: W | Y348: L | Z348: D | AA348: FOR | AB348: AGST | AC348: % | AD348: PTS
A349: PRESTON | C349: S STEWART | F349: NATHAN | I349: CONNELLY | L349: FITT | N349: BLACKMAN | Q349: CUGLEY
A350: COBURG | C350: McLEAN | F350: WILKINSON | I350: SMITH | L350: ROGAN | N350: BUCKLEY | Q350: WALKER | W350: BRIGHTON | X350: 6 | Y350: 1 | Z350: 0 | AA350: 799 | AB350: 579 | AC350: 137.99654576856651 | AD350: 24
A351: GOALKICKERS | W351: BRUNSWICK | X351: 6 | Y351: 1 | Z351: 0 | AA351: 777 | AB351: 579 | AC351: 134.19689119170985 | AD351: 24
A352: PRESTON | C352: FITT 4 | E352: POTTER 3 | G352: NATHAN 2 | I352: R BRYCE 2 | K352: CUGLEY 2 | M352: DUNSTAN 2 | P352: CONNELLY 2 | S352: BLACKMAN | W352: OAKLEIGH | X352: 5 | Y352: 2 | Z352: 0 | AA352: 766 | AB352: 694 | AC352: 110.37463976945244 | AD352: 20
A353: COBURG | C353: WILKINSON 3 | F353: McLEAN 2 | I353: BUCKLEY 2 | L353: ROGAN 2 | N353: WILSON 2 | Q353: CONDON 2 | T353: WALSH | W353: CAMBERWELL | X353: 5 | Y353: 2 | Z353: 0 | AA353: 721 | AB353: 682 | AC353: 105.71847507331378 | AD353: 20
A355: BRUNSWICK | C355: 4 | D355: 4 | E355: =C355*6+D355 -> 28 | G355: 9 | H355: 6 | I355: =G355*6+H355 -> 60 | K355: 16 | L355: 10 | M355: =K355*6+L355 -> 106 | O355: 18 | P355: 16 | Q355: =O355*6+P355 -> 124 | S355: BRUNSWICK | W355: NORTHCOTE | X355: 4 | Y355: 3 | Z355: 0 | AA355: 623 | AB355: 563 | AC355: 110.65719360568383 | AD355: 16
A356: PRAHRAN | C356: 3 | D356: 4 | E356: =C356*6+D356 -> 22 | G356: 6 | H356: 6 | I356: =G356*6+H356 -> 42 | K356: 8 | L356: 9 | M356: =K356*6+L356 -> 57 | O356: 11 | P356: 13 | Q356: =O356*6+P356 -> 79 | S356: MERRINGTON | W356: PRESTON | X356: 4 | Y356: 3 | Z356: 0 | AA356: 775 | AB356: 726 | AC356: 106.74931129476585 | AD356: 16
A357: BEST PLAYERS | W357: WILLIAMSTOWN | X357: 3 | Y357: 4 | Z357: 0 | AA357: 640 | AB357: 598 | AC357: 107.02341137123746 | AD357: 12
A358: BRUNSWICK | C358: SMITH | F358: BAGGOTT | I358: RINGROSE | L358: POWER | N358: PRIESTLEY | Q358: GEISLER | W358: PRAHRAN | X358: 3 | Y358: 4 | Z358: 0 | AA358: 749 | AB358: 800 | AC358: 93.625 | AD358: 12
A359: PRAHRAN | C359: FERGEUS | F359: KEEGAN | I359: McCULLOCH | L359: DOREY | N359: GARVIN | Q359: MASTERTON | W359: COBURG | X359: 2 | Y359: 5 | Z359: 0 | AA359: 712 | AB359: 772 | AC359: 92.2279792746114 | AD359: 8
A360: GOALKICKERS | W360: PORT MELBOURNE | X360: 2 | Y360: 5 | Z360: 0 | AA360: 726 | AB360: 836 | AC360: 86.84210526315789 | AD360: 8
A361: BRUNSWICK | C361: BAGGOTT 6 | F361: RINGROSE 4 | I361: PRIESTLEY 3 | L361: SMITH 2 | N361: BRADLEY 2 | Q361: ROGERS | W361: YARRAVILLE | X361: 1 | Y361: 6 | Z361: 0 | AA361: 582 | AB361: 799 | AC361: 72.841051314142675 | AD361: 4
A362: PRAHRAN | C362: FERGEUS 3 | F362: WOODS 3 | I362: McCULLOCH 2 | L362: NEWTON | N362: OPREY | P362: GARVIN | W362: SANDRINGHAM | X362: 1 | Y362: 6 | Z362: 0 | AA362: 631 | AB362: 873 | AC362: 72.279495990836196 | AD362: 4
A364: CAMBERWELL | C364: 7 | D364: 6 | E364: =C364*6+D364 -> 48 | G364: 10 | H364: 8 | I364: =G364*6+H364 -> 68 | K364: 10 | L364: 10 | M364: =K364*6+L364 -> 70 | O364: 15 | P364: 16 | Q364: =O364*6+P364 -> 106 | S364: YARRAVILLE
A365: YARRAVILLE | C365: 3 | D365: 2 | E365: =C365*6+D365 -> 20 | G365: 10 | H365: 6 | I365: =G365*6+H365 -> 66 | K365: 13 | L365: 11 | M365: =K365*6+L365 -> 89 | O365: 14 | P365: 15 | Q365: =O365*6+P365 -> 99 | S365: MILLER
A366: BEST PLAYERS
A367: CAMBERWELL | C367: STUBBS | F367: G BRADFORD | I367: HERBERT | L367: FLETCHER | O367: McIVOR | R367: BOHAN
A368: YARRAVILLE | C368: RUDDELL | F368: WOOD | I368: HARDIMAN | L368: GARLICK | O368: TESTRAIL | R368: ROBERTSON
A369: GOALKICKERS
A370: CAMBERWELL | C370: STUBBS 5 | F370: G BRADFORD 4 | J370: PAGE 2 | M370: McDONALD 2 | P370: HANNAN | R370: BOHAN
A371: YARRAVILLE | C371: PHILLIPS 3 | F371: HARRIS 3 | I371: TESTRAIL 2 | L371: MILLER 2 | N371: CRANAGE | Q371: MORRIS | S371: HARDIMAN | V371: McASEY
D372: 14TH JUNE | J372: WEATHER | M372: VERY COLD FOGGY
A373: NORTHCOTE | C373: 1 | D373: 2 | E373: =C373*6+D373 -> 8 | G373: 4 | H373: 8 | I373: =G373*6+H373 -> 32 | K373: 7 | L373: 13 | M373: =K373*6+L373 -> 55 | O373: 8 | P373: 13 | Q373: =O373*6+P373 -> 61 | S373: NORTHCOTE
A374: WILLIAMSTOWN | C374: 0 | D374: 4 | E374: =C374*6+D374 -> 4 | G374: 3 | H374: 6 | I374: =G374*6+H374 -> 24 | K374: 6 | L374: 6 | M374: =K374*6+L374 -> 42 | O374: 8 | P374: 12 | Q374: =O374*6+P374 -> 60 | S374: LEE
A375: BEST PLAYERS
A376: NORTHCOTE | C376: HISCOX | F376: HINES | I376: FARRELL | L376: PAWSEY | O376: McINTOSH | R376: NASH
A377: WILLIAMSTOWN | C377: CAMERON | F377: DANCKERT | I377: SAMPSON | L377: M McPHERSON | O377: KEATING
A378: GOALKICKERS
A379: NORTHCOTE | C379: McINTOSH 3 | F379: PAWSEY 2 | I379: FARRELL | L379: GALE | N379: WHITE
A380: WILLIAMSTOWN | C380: REDMOND 2 | F380: TODD 2 | I380: KEATING 2 | L380: M McPHERSON
A382: OAKLEIGH | C382: 5 | D382: 2 | E382: =C382*6+D382 -> 32 | G382: 11 | H382: 11 | I382: =G382*6+H382 -> 77 | K382: 15 | L382: 14 | M382: =K382*6+L382 -> 104 | O382: 20 | P382: 21 | Q382: =O382*6+P382 -> 141 | S382: OAKLEIGH
A383: PORT MELBOURNE | C383: 1 | D383: 6 | E383: =C383*6+D383 -> 12 | G383: 5 | H383: 7 | I383: =G383*6+H383 -> 37 | K383: 10 | L383: 8 | M383: =K383*6+L383 -> 68 | O383: 14 | P383: 11 | Q383: =O383*6+P383 -> 95 | S383: EGAN
A384: BEST PLAYERS
A385: OAKLEIGH | C385: GRAY | F385: MILGATE | I385: R FINN | L385: BEARD | O385: BELL | Q385: WILLIAMS
A386: PORT MELBOURNE | C386: HOUSTON | F386: BAKER | I386: WOODBRIDGE | L386: REYNOLDS | O386: CULPH | Q386: MANN
A387: GOALKICKERS
A388: OAKLEIGH | C388: MILGATE 7 | F388: R FINN 3 | H388: RUNDELL 3 | J388: SMEATON 3 | M388: NOONAN 2 | P388: JORY | Q388: E RYAN
A389: PORT MELBOURNE | C389: HOUSTON 4 | F389: FINDLAY 3 | I389: HOULIHAN 3 | L389: LEWIS 2 | N389: CULPH 2
A391: BRIGHTON | C391: 3 | D391: 5 | E391: =C391*6+D391 -> 23 | G391: 9 | H391: 11 | I391: =G391*6+H391 -> 65 | K391: 14 | L391: 11 | M391: =K391*6+L391 -> 95 | O391: 19 | P391: 15 | Q391: =O391*6+P391 -> 129 | S391: ELSTERNWICK PARK
A392: SANDRINGHAM | C392: 2 | D392: 1 | E392: =C392*6+D392 -> 13 | G392: 4 | H392: 3 | I392: =G392*6+H392 -> 27 | K392: 7 | L392: 7 | M392: =K392*6+L392 -> 49 | O392: 7 | P392: 11 | Q392: =O392*6+P392 -> 53 | S392: JOHNS
A393: BEST PLAYERS
A394: BRIGHTON | C394: McINDOE | F394: ADAMSON | I394: DOUGLAS | L394: WILLIAMSON | O394: HALL | R394: RIDDELL
A395: SANDRINGHAM | C395: TOYNE | F395: PARKER | I395: CERINI | L395: R GRAMBEAU | O395: PATTERSON | R395: BENCRAFT
A396: GOALKICKERS
A397: BRIGHTON | C397: McINDOE 7 | F397: ADAMSON 3 | I397: DOUGLAS 3 | L397: HOWE 2 | N397: BURKE | P397: PICKERING | R397: WILLIAMSON | V397: PINDER
A398: SANDRINGHAM | C398: PARKER 2 | F398: PATTERSON 2 | I398: BENNETT | L398: CERINI | N398: BRIGHTON
A400: ROUND 8 | D400: 19TH JUNE | H400: WEATHER | K400: LIGHT NORTH BREEZE FINE & SUNNY | S400: PLAYED AT
D401: 1ST QTR | H401: 2ND QTR | L401: 3RD QTR | P401: FINAL | S401: ELSTERNWICK PARK
A402: CAMBERWELL | C402: 1 | D402: 1 | E402: =C402*6+D402 -> 7 | G402: 7 | H402: 8 | I402: =G402*6+H402 -> 50 | K402: 12 | L402: 11 | M402: =K402*6+L402 -> 83 | O402: 19 | P402: 16 | Q402: =O402*6+P402 -> 130 | S402: UMPIRE | X402: LADDER | AB402: ROUND | AD402: 8
A403: BRIGHTON | C403: 6 | D403: 2 | E403: =C403*6+D403 -> 38 | G403: 9 | H403: 8 | I403: =G403*6+H403 -> 62 | K403: 13 | L403: 17 | M403: =K403*6+L403 -> 95 | O403: 16 | P403: 20 | Q403: =O403*6+P403 -> 116 | S403: MERRINGTON
A404: BEST PLAYERS | W404: TEAM | X404: W | Y404: L | Z404: D | AA404: FOR | AB404: AGST | AC404: % | AD404: PTS
A405: CAMBERWELL | C405: G BRADFORD | F405: STUBBS | I405: KENNEDY | L405: HERBERT | O405: FURLONG | Q405: BOHAN
A406: BRIGHTON | C406: ADAMSON | F406: DOUGLAS | I406: McINDOE | L406: STRETTON | O406: COMBER | Q406: HOWE | W406: BRUNSWICK | X406: 7 | Y406: 1 | Z406: 0 | AA406: 895 | AB406: 669 | AC406: 133.78 | AD406: 28
A407: GOALKICKERS | P407: McCREACHAN | W407: BRIGHTON | X407: 6 | Y407: 2 | Z407: 0 | AA407: 915 | AB407: 709 | AC407: 129.05500705218617 | AD407: 24
A408: CAMBERWELL | C408: BOHAN 5 | E408: FURLONG 5 | H408: G BRADFORD 3 | K408: McDONALD 2 | N408: MONOHAN | Q408: HANNAN | S408: STUBBS | W408: CAMBERWELL | X408: 6 | Y408: 2 | Z408: 0 | AA408: 851 | AB408: 798 | AC408: 106.64160401002506 | AD408: 24
A409: BRIGHTON | C409: ADAMSON 5 | F409: HOWE 3 | H409: COMBER 2 | J409: DOUGLAS 2 | M409: McINDOE 2 | P409: STRETTON | R409: RIDDELL | W409: PRESTON | X409: 5 | Y409: 3 | Z409: 0 | AA409: 912 | AB409: 850 | AC409: 107.29411764705883 | AD409: 20
A411: WILLIAMSTOWN | C411: 3 | D411: 3 | E411: =C411*6+D411 -> 21 | G411: 12 | H411: 5 | I411: =G411*6+H411 -> 77 | K411: 18 | L411: 11 | M411: =K411*6+L411 -> 119 | O411: 24 | P411: 15 | Q411: =O411*6+P411 -> 159 | S411: WILLIAMSTOWN | W411: OAKLEIGH | X411: 5 | Y411: 3 | Z411: 0 | AA411: 863 | AB411: 853 | AC411: 101.17233294255568 | AD411: 20
A412: PRAHRAN | C412: 2 | D412: 6 | E412: =C412*6+D412 -> 18 | G412: 4 | H412: 8 | I412: =G412*6+H412 -> 32 | K412: 6 | L412: 12 | M412: =K412*6+L412 -> 48 | O412: 7 | P412: 16 | Q412: =O412*6+P412 -> 58 | S412: McGAW | W412: WILLIAMSTOWN | X412: 4 | Y412: 4 | Z412: 0 | AA412: 799 | AB412: 656 | AC412: 121.79878048780488 | AD412: 16
A413: BEST PLAYERS | W413: NORTHCOTE | X413: 4 | Y413: 4 | Z413: 0 | AA413: 696 | AB413: 654 | AC413: 106.42201834862385 | AD413: 16
A414: WILLIAMSTOWN | C414: SALVAS | E414: FEATHERBY | H414: CAMERON | K414: TODD | N414: M McPHERSON | Q414: COLLINS | W414: COBURG | X414: 3 | Y414: 5 | Z414: 0 | AA414: 803 | AB414: 845 | AC414: 95.029585798816569 | AD414: 12
A415: PRAHRAN | C415: WALSH | E415: NEWTON | H415: DYER | K415: GARVIN | N415: WOODS | Q415: BUTTLING | W415: PRAHRAN | X415: 3 | Y415: 5 | Z415: 0 | AA415: 807 | AB415: 959 | AC415: 84.15015641293013 | AD415: 12
A416: GOALKICKERS | W416: PORT MELBOURNE | X416: 2 | Y416: 6 | Z416: 0 | AA416: 850 | AB416: 973 | AC416: 87.358684480986639 | AD416: 8
A417: WILLIAMSTOWN | C417: SALVAS 6 | F417: TODD 6 | H417: WALKER 4 | J417: M McPHERSON 3 | N417: PEACOCK 2 | Q417: COLLINS 2 | V417: RYAN | W417: SANDRINGHAM | X417: 2 | Y417: 6 | Z417: 0 | AA417: 790 | AB417: 970 | AC417: 81.44329896907216 | AD417: 8
A418: PRAHRAN | C418: WOODS 3 | F418: McCULLOCH 2 | J418: DYER | L418: FERGEUS | W418: YARRAVILLE | X418: 1 | Y418: 7 | Z418: 0 | AA418: 672 | AB418: 917 | AC418: 73.28 | AD418: 4
A420: COBURG | C420: 2 | D420: 10 | E420: =C420*6+D420 -> 22 | G420: 4 | H420: 13 | I420: =G420*6+H420 -> 37 | K420: 8 | L420: 17 | M420: =K420*6+L420 -> 65 | O420: 12 | P420: 19 | Q420: =O420*6+P420 -> 91 | S420: COBURG
A421: NORTHCOTE | C421: 2 | D421: 0 | E421: =C421*6+D421 -> 12 | G421: 6 | H421: 7 | I421: =G421*6+H421 -> 43 | K421: 7 | L421: 9 | M421: =K421*6+L421 -> 51 | O421: 10 | P421: 13 | Q421: =O421*6+P421 -> 73 | S421: EGAN
A422: BEST PLAYERS
A423: COBURG | C423: WALSH | F423: SMITH | I423: FEWKES | L423: McLEAN | O423: R WILKINSON | S423: ROGAN
A424: NORTHCOTE | C424: PAWSEY | F424: WHITE | I424: GREENHAM | L424: FARRELL | O424: KNIGHT | S424: HINES
A425: GOALKICKERS
A426: COBURG | C426: R WILKINSON 4 | F426: FEWKES 3 | I426: McLEAN 3 | L426: GILBERT | N426: ROGAN
A427: NORTHCOTE | C427: PAWSEY 2 | F427: KNIGHT 2 | I427: FARRELL | K427: NASH | M427: GALE | N427: GREENHAM | Q427: McINTOSH | T427: WHITE
A429: PRESTON | C429: 4 | D429: 6 | E429: =C429*6+D429 -> 30 | G429: 12 | H429: 12 | I429: =G429*6+H429 -> 84 | K429: 17 | L429: 15 | M429: =K429*6+L429 -> 117 | O429: 20 | P429: 17 | Q429: =O429*6+P429 -> 137 | S429: PORT MELBOURNE
A430: PORT MELBOURNE | C430: 7 | D430: 5 | E430: =C430*6+D430 -> 47 | G430: 11 | H430: 7 | I430: =G430*6+H430 -> 73 | K430: 14 | L430: 10 | M430: =K430*6+L430 -> 94 | O430: 18 | P430: 16 | Q430: =O430*6+P430 -> 124 | S430: MILLER
A431: BEST PLAYERS
A432: PRESTON | C432: POTTER | F432: MEARS | I432: R BRYCE | L432: NATHAN | N432: BLACKMAN | Q432: FITT
A433: PORT MELBOURNE | C433: BUTCHER | F433: HOUSTON | I433: TRAINER | L433: CULPH | N433: MANN | Q433: LEWIS
A434: GOALKICKERS
A435: PRESTON | C435: POTTER 7 | F435: DUNSTONE 4 | I435: K BRYCE 3 | L435: NATHAN 3 | O435: MEARS 2 | Q435: BLACKMAN
A436: PORT MELBOURNE | C436: HOUSTON 6 | F436: CULPH 4 | I436: LEWIS 3 | L436: FINDLAY 3 | O436: BOWER | Q436: HAGAN
A438: BRUNSWICK | C438: 4 | D438: 4 | E438: =C438*6+D438 -> 28 | G438: 7 | H438: 11 | I438: =G438*6+H438 -> 53 | K438: 13 | L438: 13 | M438: =K438*6+L438 -> 91 | O438: 17 | P438: 16 | Q438: =O438*6+P438 -> 118 | S438: YARRAVILLE
A439: YARRAVILLE | C439: 8 | D439: 4 | E439: =C439*6+D439 -> 52 | G439: 9 | H439: 4 | I439: =G439*6+H439 -> 58 | K439: 12 | L439: 8 | M439: =K439*6+L439 -> 80 | O439: 13 | P439: 13 | Q439: =O439*6+P439 -> 91 | S439: BARNES
A440: BEST PLAYERS
A441: BRUNSWICK | C441: SMITH | F441: R SHAW | I441: KYNE | K441: BAGGOTT | N441: POWELL | Q441: SILK
A442: YARRAVILLE | C442: HARDIMAN | F442: PHILLIPS | I442: McLEOD | K442: CAIN | N442: FAIRFALL | Q442: HARRIS
A443: GOALKICKERS
A444: BRUNSWICK | C444: SMITH 6 | E444: RINGROSE 3 | H444: POWELL 2 | J444: BAGGOTT 2 | M444: WHELAN | O444: McLEOD | Q444: KYNE | S444: PRIESTLEY
A445: YARRAVILLE | C445: HARDIMAN 6 | F445: PHILLIPS 3 | I445: COLLINS 2 | L445: HARRIS | N445: ROBERTSON
A447: SANDRINGHAM | C447: 4 | D447: 2 | E447: =C447*6+D447 -> 26 | G447: 14 | H447: 4 | I447: =G447*6+H447 -> 88 | K447: 15 | L447: 6 | M447: =K447*6+L447 -> 96 | O447: 25 | P447: 9 | Q447: =O447*6+P447 -> 159 | S447: BEACH ROAD
A448: OAKLEIGH | C448: 4 | D448: 5 | E448: =C448*6+D448 -> 29 | G448: 9 | H448: 10 | I448: =G448*6+H448 -> 64 | K448: 12 | L448: 20 | M448: =K448*6+L448 -> 92 | O448: 12 | P448: 25 | Q448: =O448*6+P448 -> 97 | S448: WRIGHT
A449: BEST PLAYERS
A450: SANDRINGHAM | C450: B HARPER | F450: HISCOCK | I450: M GRAMBEAU | L450: PARKER | N450: PATTERSON | Q450: CLARKE
A451: OAKLEIGH | C451: RUNDELL | F451: R FINN | I451: GRAY | L451: NOONAN | N451: WILLIAMS | Q451: JORY
A452: GOALKICKERS
A453: SANDRINGHAM | C453: HISCOCK 6 | F453: B HARPER 6 | I453: BENCRAFT 3 | L453: PARKER 3 | N453: BENNETT 2 | Q453: M GRAMBEAU 2 | U453: WEBB 2 | X453: TURNER
A454: OAKLEIGH | C454: RUNDELL 4 | F454: WILLIAMS 2 | I454: JORY 2 | K454: S FINN | M454: BAXTER | O454: MILGATE | Q454: R FINN
A456: ROUND 9 | D456: 26TH JUNE | G456: WEATHER | J456: SOUTH WEST WIND OVERNIGHT RAIN GROUNDS HEAVY | S456: PLAYED AT
D457: 1ST QTR | H457: 2ND QTR | L457: 3RD QTR | P457: FINAL | S457: OAKLEIGH
A458: BRUNSWICK | C458: 2 | D458: 9 | E458: =C458*6+D458 -> 21 | G458: 3 | H458: 12 | I458: =G458*6+H458 -> 30 | K458: 7 | L458: 16 | M458: =K458*6+L458 -> 58 | O458: 12 | P458: 17 | Q458: =O458*6+P458 -> 89 | S458: UMPIRE | X458: LADDER | AB458: ROUND | AD458: 9
A459: OAKLEIGH | C459: 2 | D459: 1 | E459: =C459*6+D459 -> 13 | G459: 8 | H459: 6 | I459: =G459*6+H459 -> 54 | K459: 9 | L459: 12 | M459: =K459*6+L459 -> 66 | O459: 10 | P459: 17 | Q459: =O459*6+P459 -> 77 | S459: MILLER
A460: BEST PLAYERS | W460: TEAM | X460: W | Y460: L | Z460: D | AA460: FOR | AB460: AGST | AC460: % | AD460: PTS
A461: BRUNSWICK | C461: SMITH | E461: POWELL | H461: PRIESTLEY | K461: WHELAN | N461: BRADLEY | Q461: GLASSCOTT
A462: OAKLEIGH | C462: BEARD | E462: RUNDELL | H462: SCOTT | K462: TEMME | N462: SMEATON | Q462: PAY | W462: BRUNSWICK | X462: 8 | Y462: 1 | Z462: 0 | AA462: 984 | AB462: 746 | AC462: 131.9 | AD462: 32
A463: GOALKICKERS | W463: BRIGHTON | X463: 6 | Y463: 3 | Z463: 0 | AA463: 1004 | AB463: 824 | AC463: 121.84466019417475 | AD463: 24
A464: BRUNSWICK | C464: POWELL 5 | F464: SMITH 3 | H464: STANLEY | J464: PRIESTLEY | M464: POWER | O464: KYNE | W464: PRESTON | X464: 6 | Y464: 3 | Z464: 0 | AA464: 1052 | AB464: 932 | AC464: 112.87553648068669 | AD464: 24
A465: OAKLEIGH | C465: RUNDELL 4 | F465: SCOTT 2 | H465: MILGATE 2 | J465: SMEATON | M465: S FINN | W465: CAMBERWELL | X465: 6 | Y465: 3 | Z465: 0 | AA465: 929 | AB465: 897 | AC465: 103.56744704570791 | AD465: 24
A467: WILLIAMSTOWN | C467: 4 | D467: 2 | E467: =C467*6+D467 -> 26 | G467: 10 | H467: 7 | I467: =G467*6+H467 -> 67 | K467: 11 | L467: 10 | M467: =K467*6+L467 -> 76 | O467: 14 | P467: 15 | Q467: =O467*6+P467 -> 99 | S467: CAMBERWELL | W467: WILLIAMSTOWN | X467: 5 | Y467: 4 | Z467: 0 | AA467: 898 | AB467: 734 | AC467: 122.34332425068119 | AD467: 20
A468: CAMBERWELL | C468: 6 | D468: 2 | E468: =C468*6+D468 -> 38 | G468: 8 | H468: 5 | I468: =G468*6+H468 -> 53 | K468: 8 | L468: 10 | M468: =K468*6+L468 -> 58 | O468: 11 | P468: 12 | Q468: =O468*6+P468 -> 78 | S468: WRIGHT | W468: NORTHCOTE | X468: 5 | Y468: 4 | Z468: 0 | AA468: 812 | AB468: 733 | AC468: 110.77762619372442 | AD468: 20
A469: BEST PLAYERS | W469: OAKLEIGH | X469: 5 | Y469: 4 | Z469: 0 | AA469: 940 | AB469: 942 | AC469: 99.787685774946922 | AD469: 20
A470: WILLIAMSTOWN | C470: M McPHERSON | F470: PEACOCK | I470: COLLINS | L470: CAMERON | O470: TODD | Q470: SALVAS | W470: PRAHRAN | X470: 4 | Y470: 5 | Z470: 0 | AA470: 922 | AB470: 1048 | AC470: 87.977099236641223 | AD470: 16
A471: CAMBERWELL | C471: FURLONG | F471: BOHAN | I471: HANNAM | L471: G BRADFORD | O471: UNSTEAD | Q471: MONOHAN | W471: COBURG | X471: 3 | Y471: 5 | Z471: 0 | AA471: 877 | AB471: 922 | AC471: 95.119305856832966 | AD471: 12
A472: GOALKICKERS | W472: SANDRINGHAM | X472: 2 | Y472: 6 | Z472: 0 | AA472: 867 | AB472: 1044 | AC472: 83.045977011494259 | AD472: 8
A473: WILLIAMSTOWN | C473: COLLINS 4 | F473: PEACOCK 3 | I473: M McPHERSON 3 | M473: SALVAS 2 | O473: REDMOND | Q473: WALKER | W473: PORT MELBOURNE | X473: 2 | Y473: 7 | Z473: 0 | AA473: 929 | AB473: 1089 | AC473: 85.307621671258033 | AD473: 8
A474: CAMBERWELL | C474: BOHAN 5 | F474: HANNAM 2 | I474: FURLONG 2 | L474: PAGE | N474: MONOHAN | W474: YARRAVILLE | X474: 1 | Y474: 8 | Z474: 0 | AA474: 756 | AB474: 1057 | AC474: 71.52 | AD474: 4
A476: NORTHCOTE | C476: 3 | D476: 4 | E476: =C476*6+D476 -> 22 | G476: 6 | H476: 6 | I476: =G476*6+H476 -> 42 | K476: 15 | L476: 10 | M476: =K476*6+L476 -> 100 | O476: 17 | P476: 14 | Q476: =O476*6+P476 -> 116 | S476: PORT MELBOURNE
A477: PORT MELBOURNE | C477: 1 | D477: 4 | E477: =C477*6+D477 -> 10 | G477: 5 | H477: 6 | I477: =G477*6+H477 -> 36 | K477: 7 | L477: 9 | M477: =K477*6+L477 -> 51 | O477: 11 | P477: 13 | Q477: =O477*6+P477 -> 79 | S477: McGAW
A478: BEST PLAYERS
A479: NORTHCOTE | C479: PAWSEY | F479: STABB | I479: DUNCAN | L479: HINES | O479: POWELL | R479: McINTOSH
A480: PORT MELBOURNE | C480: HOUSTON | F480: BAKER | I480: AUSTIN | L480: BLAKE | O480: BUTCHER | R480: FINDLAY
A481: GOALKICKERS
A482: NORTHCOTE | C482: PAWSEY 6 | F482: DUNCAN 5 | I482: NASH 2 | K482: WHITE | M482: KNIGHT | O482: GREENHAM | R482: McINTOSH
A483: PORT MELBOURNE | C483: HOUSTON 5 | F483: AUSTIN 2 | I483: HOULIHAN | L483: FINDLAY | N483: CULPH | P483: OLDMAN
A485: SANDRINGHAM | C485: 3 | D485: 3 | E485: =C485*6+D485 -> 21 | G485: 6 | H485: 4 | I485: =G485*6+H485 -> 40 | K485: 11 | L485: 9 | M485: =K485*6+L485 -> 75 | O485: 11 | P485: 11 | Q485: =O485*6+P485 -> 77 | S485: BEACH ROAD | V485: DECLARED NO GAME
A486: COBURG | C486: 0 | D486: 6 | E486: =C486*6+D486 -> 6 | G486: 5 | H486: 12 | I486: =G486*6+H486 -> 42 | K486: 8 | L486: 13 | M486: =K486*6+L486 -> 61 | O486: 9 | P486: 20 | Q486: =O486*6+P486 -> 74 | S486: LEE | V486: FINAL SIREN SOUNDED EARLY
A487: BEST PLAYERS | V487: MATCH NOT REPLAYED
A488: SANDRINGHAM | C488: TOYNE | F488: PATTERSON | I488: PARKER | K488: BENCRAFT | N488: HISCOCK | Q488: RIPPON | V488: AS BOTH SIDES WERE NOT
A489: COBURG | C489: CONDON | F489: FEWKES | I489: SMITH | K489: WALKER | N489: McLEAN | Q489: QUINN | V489: IN FINALS CONTENTION
A490: GOALKICKERS
A491: SANDRINGHAM | C491: HISCOCK 5 | F491: BENCRAFT 2 | I491: B HARPER 2 | L491: PARKER | N491: CERINI
A492: COBURG | C492: FEWKES 4 | F492: CONDON 4 | I492: R WILKINSON
A494: PRAHRAN | C494: 5 | D494: 4 | E494: =C494*6+D494 -> 34 | G494: 7 | H494: 4 | I494: =G494*6+H494 -> 46 | K494: 14 | L494: 6 | M494: =K494*6+L494 -> 90 | O494: 18 | P494: 7 | Q494: =O494*6+P494 -> 115 | S494: ELSTERNWICK PARK
A495: BRIGHTON | C495: 2 | D495: 2 | E495: =C495*6+D495 -> 14 | G495: 5 | H495: 10 | I495: =G495*6+H495 -> 40 | K495: 8 | L495: 14 | M495: =K495*6+L495 -> 62 | O495: 12 | P495: 17 | Q495: =O495*6+P495 -> 89 | S495: BARNES
A496: BEST PLAYERS
A497: PRAHRAN | C497: DYER | F497: McCULLOCH | I497: NEWTON | L497: MORROW | O497: KEEGAN | Q497: GARVIN
A498: BRIGHTON | C498: ADAMSON | F498: McINDOE | I498: WILLIAMSON | L498: COMBER | O498: HEIMS | Q498: DOUGLAS
A499: GOALKICKERS
A500: PRAHRAN | C500: McCULLOCH 7 | F500: DYER 6 | H500: NEWTON 2 | J500: MASTERTON | M500: WOODS | O500: OVERS
A501: BRIGHTON | C501: ADAMSON 5 | F501: HOWE 2 | H501: HEIMS | J501: DOUGLAS | L501: McINDOE | N501: STRETTON | Q501: WARBURTON
A503: PRESTON | C503: 3 | D503: 5 | E503: =C503*6+D503 -> 23 | G503: 8 | H503: 11 | I503: =G503*6+H503 -> 59 | K503: 15 | L503: 16 | M503: =K503*6+L503 -> 106 | O503: 20 | P503: 20 | Q503: =O503*6+P503 -> 140 | S503: NORTHCOTE
A504: YARRAVILLE | C504: 6 | D504: 2 | E504: =C504*6+D504 -> 38 | G504: 6 | H504: 4 | I504: =G504*6+H504 -> 40 | K504: 8 | L504: 7 | M504: =K504*6+L504 -> 55 | O504: 12 | P504: 10 | Q504: =O504*6+P504 -> 82 | S504: EGAN
A505: BEST PLAYERS
A506: PRESTON | C506: CONNELLY | F506: POTTER | I506: K BRYCE | L506: GOLDIN | O506: FITT | Q506: MEARS
A507: YARRAVILLE | C507: HARDIMAN | F507: MALBON | I507: McLEOD | L507: MILLER | O507: MORRIS | Q507: MORGAN
A508: GOALKICKERS
A509: PRESTON | C509: POTTER 6 | F509: MEARS 4 | I509: CONNELLY 3 | L509: K BRYCE 2 | N509: NATHAN 2 | Q509: FITT | S509: GOLDIN | U509: BROWN
A510: YARRAVILLE | C510: HARDIMAN 5 | F510: MILLER 4 | I510: MORGAN 2 | L510: HARRIS
A512: ROUND 10 | D512: 3RD JULY | H512: WEATHER | K512: LIGHT SOUTH WEST BREEZE COLD DULL | S512: PLAYED AT
D513: 1ST QTR | H513: 2ND QTR | L513: 3RD QTR | P513: FINAL | S513: PRESTON
A514: PRESTON | C514: 6 | D514: 5 | E514: =C514*6+D514 -> 41 | G514: 11 | H514: 9 | I514: =G514*6+H514 -> 75 | K514: 17 | L514: 13 | M514: =K514*6+L514 -> 115 | O514: 21 | P514: 19 | Q514: =O514*6+P514 -> 145 | S514: UMPIRE | X514: LADDER | AB514: ROUND | AD514: 10
A515: BRIGHTON | C515: 3 | D515: 6 | E515: =C515*6+D515 -> 24 | G515: 7 | H515: 9 | I515: =G515*6+H515 -> 51 | K515: 9 | L515: 15 | M515: =K515*6+L515 -> 69 | O515: 11 | P515: 20 | Q515: =O515*6+P515 -> 86 | S515: BARNES
A516: BEST PLAYERS | W516: TEAM | X516: W | Y516: L | Z516: D | AA516: FOR | AB516: AGST | AC516: % | AD516: PTS
A517: PRESTON | C517: BLACKMAN | F517: MEARS | I517: S STEWART | L517: POTTER | N517: RIDDELL | Q517: MASLEN
A518: BRIGHTON | C518: STRETTON | F518: DOUGLAS | I518: TURNER | L518: CRAVEN | N518: WARBURTON | Q518: McINDOE | W518: BRUNSWICK | X518: 9 | Y518: 1 | Z518: 0 | AA518: 1107 | AB518: 834 | AC518: 132.73 | AD518: 36
A519: GOALKICKERS | W519: PRESTON | X519: 7 | Y519: 3 | Z519: 0 | AA519: 1197 | AB519: 1018 | AC519: 117.58349705304519 | AD519: 28
A520: PRESTON | C520: POTTER 6 | F520: NATHAN 5 | I520: MEARS 4 | K520: GOLDIN 3 | M520: S STEWART | P520: R BRYCE | R520: K BRYCE | W520: WILLIAMSTOWN | X520: 6 | Y520: 4 | Z520: 0 | AA520: 1028 | AB520: 840 | AC520: 122.38095238095238 | AD520: 24
A521: BRIGHTON | C521: WARBURTON 4 | F521: HOWE 2 | H521: PICKERING 2 | K521: DOUGLAS | M521: McINDOE | O521: ADAMSON | W521: NORTHCOTE | X521: 6 | Y521: 4 | Z521: 0 | AA521: 921 | AB521: 814 | AC521: 113.14496314496314 | AD521: 24
A523: NORTHCOTE | C523: 2 | D523: 6 | E523: =C523*6+D523 -> 18 | G523: 6 | H523: 12 | I523: =G523*6+H523 -> 48 | K523: 13 | L523: 21 | M523: =K523*6+L523 -> 99 | O523: 14 | P523: 25 | Q523: =O523*6+P523 -> 109 | S523: NORTHCOTE | W523: BRIGHTON | X523: 6 | Y523: 4 | Z523: 0 | AA523: 1090 | AB523: 969 | AC523: 112.48710010319917 | AD523: 24
A524: CAMBERWELL | C524: 5 | D524: 2 | E524: =C524*6+D524 -> 32 | G524: 8 | H524: 6 | I524: =G524*6+H524 -> 54 | K524: 10 | L524: 9 | M524: =K524*6+L524 -> 69 | O524: 11 | P524: 15 | Q524: =O524*6+P524 -> 81 | S524: MERRINGTON | W524: OAKLEIGH | X524: 6 | Y524: 4 | Z524: 0 | AA524: 1054 | AB524: 1047 | AC524: 100.66857688634192 | AD524: 24
A525: BEST PLAYERS | W525: CAMBERWELL | X525: 6 | Y525: 4 | Z525: 0 | AA525: 1010 | AB525: 1006 | AC525: 100.3976143141153 | AD525: 24
A526: NORTHCOTE | C526: DUNCAN | F526: NASH | I526: CASPAR | L526: FARRELL | N526: HINES | Q526: STABB | W526: PRAHRAN | X526: 4 | Y526: 6 | Z526: 0 | AA526: 1027 | AB526: 1162 | AC526: 88.382099827882953 | AD526: 16
A527: CAMBERWELL | C527: STUBBS | F527: BOHAN | I527: G BRADFORD | L527: MILLER | N527: McDONALD | Q527: FURLONG | W527: COBURG | X527: 3 | Y527: 6 | Z527: 0 | AA527: 983 | AB527: 1052 | AC527: 93.441064638783274 | AD527: 12
A528: GOALKICKERS | W528: SANDRINGHAM | X528: 3 | Y528: 6 | Z528: 0 | AA528: 991 | AB528: 1157 | AC528: 85.652549697493512 | AD528: 12
A529: NORTHCOTE | C529: DUNCAN 5 | F529: NASH 3 | H529: KEN MURPHY 2 | K529: FARRELL | M529: KNIGHT | O529: McINTOSH | Q529: POWELL | W529: PORT MELBOURNE | X529: 2 | Y529: 8 | Z529: 0 | AA529: 1017 | AB529: 1212 | AC529: 83.910891089108915 | AD529: 8
A530: CAMBERWELL | C530: BOHAN 7 | F530: STUBBS | H530: COOK | J530: McDONALD | M530: HOGAN | W530: YARRAVILLE | X530: 1 | Y530: 9 | Z530: 0 | AA530: 867 | AB530: 1181 | AC530: 73.41 | AD530: 4
A532: OAKLEIGH | C532: 4 | D532: 3 | E532: =C532*6+D532 -> 27 | G532: 8 | H532: 9 | I532: =G532*6+H532 -> 57 | K532: 12 | L532: 13 | M532: =K532*6+L532 -> 85 | O532: 16 | P532: 18 | Q532: =O532*6+P532 -> 114 | S532: ELSTERNWICK PARK
A533: PRAHRAN | C533: 2 | D533: 8 | E533: =C533*6+D533 -> 20 | G533: 6 | H533: 10 | I533: =G533*6+H533 -> 46 | K533: 10 | L533: 13 | M533: =K533*6+L533 -> 73 | O533: 14 | P533: 21 | Q533: =O533*6+P533 -> 105 | S533: McGAW
A534: BEST PLAYERS
A535: OAKLEIGH | C535: BEARD | F535: SMEATON | I535: BRISTOWE | L535: DONNELLY | O535: R FINN | R535: PERKINS
A536: PRAHRAN | C536: MORROW | F536: NEWTON | I536: JONES | L536: WALSH | O536: McCULLOCH | R536: BOURKE
A537: GOALKICKERS
A538: OAKLEIGH | C538: MILGATE 3 | F538: PERKINS 3 | I538: BRISTOWE 2 | L538: DOWLING 2 | O538: SMEATON 2 | R538: JORY 2 | U538: BAXTER | X538: R FINN
A539: PRAHRAN | C539: McCULLOCH 6 | F539: OVERS 2 | H539: DYER 2 | J539: NEWTON 2 | M539: PERKINS | O539: KEEGAN
A541: WILLIAMSTOWN | C541: 4 | D541: 5 | E541: =C541*6+D541 -> 29 | G541: 12 | H541: 10 | I541: =G541*6+H541 -> 82 | K541: 16 | L541: 12 | M541: =K541*6+L541 -> 108 | O541: 19 | P541: 16 | Q541: =O541*6+P541 -> 130 | S541: COBURG
A542: COBURG | C542: 2 | D542: 5 | E542: =C542*6+D542 -> 17 | G542: 6 | H542: 7 | I542: =G542*6+H542 -> 43 | K542: 10 | L542: 14 | M542: =K542*6+L542 -> 74 | O542: 14 | P542: 22 | Q542: =O542*6+P542 -> 106 | S542: MILLER
A543: BEST PLAYERS
A544: WILLIAMSTOWN | C544: M McPHERSON | G544: COLLINS | J544: SAMPSON | M544: WILCOX | O544: FEATHERBY | R544: G WILLIAMS
A545: COBURG | C545: McLEAN | G545: WALKER | J545: JAMES | M545: WILSON | O545: CONDON | R545: STARBUCK
A546: GOALKICKERS
A547: WILLIAMSTOWN | C547: REDMOND 5 | F547: M McPHERSON 4 | J547: COLLINS 3 | M547: PEACOCK 2 | P547: WALKER | R547: A WILLIAMS | V547: TODD | X547: FEATHERBY | AA547: WADE
A548: COBURG | C548: McLEAN 5 | F548: FEWKES 3 | I548: CONDON 2 | L548: ROGAN | N548: WILKINSON | Q548: DRAPER | S548: WALSH
A550: SANDRINGHAM | C550: 2 | D550: 6 | E550: =C550*6+D550 -> 18 | G550: 6 | H550: 14 | I550: =G550*6+H550 -> 50 | K550: 13 | L550: 20 | M550: =K550*6+L550 -> 98 | O550: 17 | P550: 22 | Q550: =O550*6+P550 -> 124 | S550: YARRAVILLE
A551: YARRAVILLE | C551: 1 | D551: 3 | E551: =C551*6+D551 -> 9 | G551: 8 | H551: 7 | I551: =G551*6+H551 -> 55 | K551: 12 | L551: 11 | M551: =K551*6+L551 -> 83 | O551: 16 | P551: 17 | Q551: =O551*6+P551 -> 113 | S551: EGAN
A552: BEST PLAYERS
A553: SANDRINGHAM | C553: TOYNE | F553: BENCRAFT | I553: BENNETT | L553: B HARPER | O553: CLARKE | R553: DEMPSTER
A554: YARRAVILLE | C554: MILLER | F554: McASEY | I554: COLLINS | L554: PHILLIPS | O554: HARDIMAN | R554: GARLICK
A555: GOALKICKERS
A556: SANDRINGHAM | C556: HISCOCK 5 | F556: BENCRAFT 3 | I556: CERINI 2 | K556: PARKER 2 | M556: B HARPER 2 | P556: FREEMAN | R556: BENNETT | U556: PATTERSON
A557: YARRAVILLE | C557: PHILLIPS 5 | F557: HARDIMAN 4 | I557: MILLER 3 | K557: McASEY 2 | M557: SCARFFE | O557: HARRIS
A559: BRUNSWICK | C559: 2 | D559: 2 | E559: =C559*6+D559 -> 14 | G559: 6 | H559: 9 | I559: =G559*6+H559 -> 45 | K559: 13 | L559: 13 | M559: =K559*6+L559 -> 91 | O559: 17 | P559: 21 | Q559: =O559*6+P559 -> 123 | S559: BRUNSWICK
A560: PORT MELBOURNE | C560: 2 | D560: 5 | E560: =C560*6+D560 -> 17 | G560: 7 | H560: 5 | I560: =G560*6+H560 -> 47 | K560: 11 | L560: 7 | M560: =K560*6+L560 -> 73 | O560: 13 | P560: 10 | Q560: =O560*6+P560 -> 88 | S560: JOHNS
A561: BEST PLAYERS
A562: BRUNSWICK | C562: SILK | F562: STANLEY | I562: SPENCER | L562: POWELL | O562: SMITH | Q562: McLEOD
A563: PORT MELBOURNE | C563: CULPH | F563: HOUSTON | I563: TRAINER | L563: BUTCHER | O563: SEXTON | Q563: BAKER
A564: GOALKICKERS
A565: BRUNSWICK | C565: POWELL 5 | F565: STANLEY 3 | I565: PRIESTLEY 3 | L565: BAGGOTT 2 | O565: HALL 2 | Q565: SMITH | S565: KYNE
A566: PORT MELBOURNE | C566: HOUSTON 3 | F566: LEWIS 2 | H566: AUSTIN 2 | J566: FINDLAY 2 | M566: FLETCHER | O566: SEXTON | Q566: HOULIHAN | T566: BAKER
A568: ROUND 11 | D568: 10TH JULY | J568: WEATHER | M568: NORTH WEST WIND SUNNY COLD | S568: PLAYED AT
D569: 1ST QTR | H569: 2ND QTR | L569: 3RD QTR | P569: FINAL | S569: WILLIAMSTOWN
A570: WILLIAMSTOWN | C570: 6 | D570: 7 | E570: =C570*6+D570 -> 43 | G570: 8 | H570: 8 | I570: =G570*6+H570 -> 56 | K570: 13 | L570: 13 | M570: =K570*6+L570 -> 91 | O570: 15 | P570: 16 | Q570: =O570*6+P570 -> 106 | S570: UMPIRE | X570: LADDER | AB570: ROUND | AD570: 11
A571: PRESTON | C571: 1 | D571: 2 | E571: =C571*6+D571 -> 8 | G571: 5 | H571: 5 | I571: =G571*6+H571 -> 35 | K571: 6 | L571: 6 | M571: =K571*6+L571 -> 42 | O571: 9 | P571: 11 | Q571: =O571*6+P571 -> 65 | S571: JOHNS
A572: BEST PLAYERS | W572: TEAM | X572: W | Y572: L | Z572: D | AA572: FOR | AB572: AGST | AC572: % | AD572: PTS
A573: WILLIAMSTOWN | C573: CAMERON | F573: SAMPSON | I573: SALVAS | K573: COLLINS | M573: M McPHERSON | Q573: REDMOND
A574: PRESTON | C574: BLACKMAN | F574: POTTER | I574: K BRYCE | K574: FITT | M574: MASLEN | Q574: CONNELLY | W574: BRUNSWICK | X574: 9 | Y574: 2 | Z574: 0 | AA574: 1210 | AB574: 965 | AC574: 125.39 | AD574: 36
A575: GOALKICKERS | W575: WILLIAMSTOWN | X575: 7 | Y575: 4 | Z575: 0 | AA575: 1134 | AB575: 905 | AC575: 125.30386740331491 | AD575: 28
A576: WILLIAMSTOWN | C576: M McPHERSON 5 | F576: COLLINS 3 | I576: SALVAS 2 | K576: WALKER 2 | N576: REDMOND 2 | Q576: A WILLIAMS | W576: BRIGHTON | X576: 7 | Y576: 4 | Z576: 0 | AA576: 1221 | AB576: 1072 | AC576: 113.9 | AD576: 28
A577: PRESTON | C577: POTTER 3 | F577: K BRYCE 2 | I577: MEARS | K577: FITT | M577: BROWN | O577: NATHAN | W577: PRESTON | X577: 7 | Y577: 4 | Z577: 0 | AA577: 1262 | AB577: 1124 | AC577: 112.27758007117438 | AD577: 28
A579: BRIGHTON | C579: 4 | D579: 4 | E579: =C579*6+D579 -> 28 | G579: 11 | H579: 11 | I579: =G579*6+H579 -> 77 | K579: 13 | L579: 16 | M579: =K579*6+L579 -> 94 | O579: 18 | P579: 23 | Q579: =O579*6+P579 -> 131 | S579: ELSTERNWICK PARK | W579: OAKLEIGH | X579: 7 | Y579: 4 | Z579: 0 | AA579: 1157 | AB579: 1116 | AC579: 103.67383512544802 | AD579: 28
A580: BRUNSWICK | C580: 5 | D580: 6 | E580: =C580*6+D580 -> 36 | G580: 7 | H580: 9 | I580: =G580*6+H580 -> 51 | K580: 11 | L580: 19 | M580: =K580*6+L580 -> 85 | O580: 13 | P580: 25 | Q580: =O580*6+P580 -> 103 | S580: MILLER | W580: CAMBERWELL | X580: 7 | Y580: 4 | Z580: 0 | AA580: 1113 | AB580: 1107 | AC580: 100.5420054200542 | AD580: 28
A581: BEST PLAYERS | W581: NORTHCOTE | X581: 6 | Y581: 5 | Z581: 0 | AA581: 990 | AB581: 917 | AC581: 107.96074154852781 | AD581: 24
A582: BRIGHTON | C582: NEW | F582: WARBURTON | I582: E TURNER | K582: DOUGLAS | N582: RIDDELL | Q582: McINDOE | W582: SANDRINGHAM | X582: 4 | Y582: 6 | Z582: 0 | AA582: 1089 | AB582: 1240 | AC582: 87.822580645161295 | AD582: 16
A583: BRUNSWICK | C583: THOMAS | F583: SMITH | I583: POWELL | K583: TONKS | N583: WHELAN | Q583: GEISLER | W583: PRAHRAN | X583: 4 | Y583: 7 | Z583: 0 | AA583: 1110 | AB583: 1260 | AC583: 88.095238095238102 | AD583: 16
A584: GOALKICKERS | Q584: HOWE | W584: COBURG | X584: 3 | Y584: 7 | Z584: 0 | AA584: 1084 | AB584: 1155 | AC584: 93.852813852813853 | AD584: 12
A585: BRIGHTON | C585: WARBURTON 7 | F585: DOUGLAS 4 | I585: McINDOE 2 | L585: PLUNKETT | N585: ADAMSON | Q585: NEW | R585: PICKERING | W585: PORT MELBOURNE | X585: 3 | Y585: 8 | Z585: 0 | AA585: 1131 | AB585: 1293 | AC585: 87.470997679814388 | AD585: 12
A586: BRUNSWICK | C586: POWELL 5 | F586: STANLEY 3 | I586: BAGGOTT 2 | L586: THOMAS | N586: R SHAW | P586: PRIESTLEY | W586: YARRAVILLE | X586: 1 | Y586: 10 | Z586: 0 | AA586: 948 | AB586: 1295 | AC586: 73.2 | AD586: 4
A588: OAKLEIGH | C588: 5 | D588: 2 | E588: =C588*6+D588 -> 32 | G588: 10 | H588: 9 | I588: =G588*6+H588 -> 69 | K588: 12 | L588: 12 | M588: =K588*6+L588 -> 84 | O588: 14 | P588: 19 | Q588: =O588*6+P588 -> 103 | S588: OAKLEIGH
A589: NORTHCOTE | C589: 4 | D589: 7 | E589: =C589*6+D589 -> 31 | G589: 5 | H589: 7 | I589: =G589*6+H589 -> 37 | K589: 7 | L589: 14 | M589: =K589*6+L589 -> 56 | O589: 9 | P589: 15 | Q589: =O589*6+P589 -> 69 | S589: EGAN
A590: BEST PLAYERS
A591: OAKLEIGH | C591: BEARD | F591: DOWLING | I591: S FINN | K591: SMEATON | N591: PAY | P591: RUNDELL
A592: NORTHCOTE | C592: STABB | F592: POWELL | I592: FARRELL | K592: NASH | N592: HISCOX | P592: CASPAR
A593: GOALKICKERS
A594: OAKLEIGH | C594: DOWLING 4 | F594: SCOTT 4 | I594: MILGATE 3 | L594: SMEATON | N594: BAXTER | P594: R FINN
A595: NORTHCOTE | C595: DUNCAN 4 | F595: KNIGHT 3 | I595: STABB | K595: WHITE
A597: SANDRINGHAM | C597: 3 | D597: 3 | E597: =C597*6+D597 -> 21 | G597: 8 | H597: 13 | I597: =G597*6+H597 -> 61 | K597: 9 | L597: 14 | M597: =K597*6+L597 -> 68 | O597: 13 | P597: 20 | Q597: =O597*6+P597 -> 98 | S597: BEACH ROAD
A598: PRAHRAN | C598: 3 | D598: 4 | E598: =C598*6+D598 -> 22 | G598: 5 | H598: 4 | I598: =G598*6+H598 -> 34 | K598: 11 | L598: 8 | M598: =K598*6+L598 -> 74 | O598: 12 | P598: 11 | Q598: =O598*6+P598 -> 83 | S598: MERRINGTON
A599: BEST PLAYERS
A600: SANDRINGHAM | C600: HISCOCK | F600: TOYNE | H600: B HARPER | K600: PATTERSON | N600: M GRAMBEAU | Q600: DEMPSTER
A601: PRAHRAN | C601: McCULLOCH | F601: DYER | H601: ADAMSON | K601: NEWTON | N601: MORRIS | Q601: GARVIN
A602: GOALKICKERS
A603: SANDRINGHAM | C603: HISCOCK 5 | F603: B HARPER 3 | I603: BENCRAFT 2 | L603: PARKER 2 | N603: M GRAMBEAU
A604: PRAHRAN | C604: McCULLOCH 4 | F604: FERGEUS 3 | I604: DYER 3 | K604: ADAMSON | N604: KEEGAN
A606: CAMBERWELL | C606: 2 | D606: 1 | E606: =C606*6+D606 -> 13 | G606: 7 | H606: 8 | I606: =G606*6+H606 -> 50 | K606: 8 | L606: 9 | M606: =K606*6+L606 -> 57 | O606: 15 | P606: 13 | Q606: =O606*6+P606 -> 103 | S606: CAMBERWELL
A607: COBURG | C607: 5 | D607: 5 | E607: =C607*6+D607 -> 35 | G607: 6 | H607: 6 | I607: =G607*6+H607 -> 42 | K607: 13 | L607: 10 | M607: =K607*6+L607 -> 88 | O607: 15 | P607: 11 | Q607: =O607*6+P607 -> 101 | S607: JONES
A608: BEST PLAYERS
A609: CAMBERWELL | C609: G BRADFORD | F609: HERBERT | I609: MILLER | L609: FLETCHER | O609: BOHAN | Q609: BURKEHALTER
A610: COBURG | C610: FEWKES | F610: ROGAN | I610: CONDON | L610: SPIERS | O610: EGAN | Q610: JAMES
A611: GOALKICKERS
A612: CAMBERWELL | C612: BOHAN 6 | F612: HERBERT 4 | I612: STUBBS 2 | L612: G BRADFORD | O612: MONOHAN | R612: COOK
A613: COBURG | C613: FEWKES 5 | F613: CONDON 3 | I613: BUCKLEY 2 | L613: EGAN 2 | O613: ROGAN 2 | R613: McILVEEN
A615: PORT MELBOURNE | C615: 6 | D615: 6 | E615: =C615*6+D615 -> 42 | G615: 8 | H615: 10 | I615: =G615*6+H615 -> 58 | K615: 15 | L615: 15 | M615: =K615*6+L615 -> 105 | O615: 16 | P615: 18 | Q615: =O615*6+P615 -> 114 | S615: PORT MELBOURNE
A616: YARRAVILLE | C616: 3 | D616: 3 | E616: =C616*6+D616 -> 21 | G616: 5 | H616: 7 | I616: =G616*6+H616 -> 37 | K616: 7 | L616: 11 | M616: =K616*6+L616 -> 53 | O616: 11 | P616: 15 | Q616: =O616*6+P616 -> 81 | S616: BARNES
A617: BEST PLAYERS
A618: PORT MELBOURNE | C618: CULPH | E618: LEWIS | H618: BUTCHER | K618: FINDLAY | N618: SEARLE | Q618: SEXTON
A619: YARRAVILLE | C619: PHILLIPS | E619: SCARFFE | H619: MORGAN | K619: HARRIS | N619: HARDIMAN | Q619: WOOD
A620: GOALKICKERS
A621: PORT MELBOURNE | C621: FINDLAY 5 | F621: CULPH 4 | I621: LEWIS 3 | K621: SEXTON 2 | M621: HOULIHAN 2
A622: YARRAVILLE | C622: PHILLIPS 6 | F622: HARDIMAN | I622: HARRIS | K622: MILLER | M622: RUDDELL | O622: CRANAGE
A624: ROUND 12 | D624: 17TH JULY | J624: WEATHER | M624: SOUTH EAST WIND SUNNY COLD | S624: PLAYED AT
D625: 1ST QTR | H625: 2ND QTR | L625: 3RD QTR | P625: FINAL | S625: ELSTERNWICK PARK
A626: NORTHCOTE | C626: 3 | D626: 5 | E626: =C626*6+D626 -> 23 | G626: 5 | H626: 8 | I626: =G626*6+H626 -> 38 | K626: 10 | L626: 13 | M626: =K626*6+L626 -> 73 | O626: 14 | P626: 14 | Q626: =O626*6+P626 -> 98 | S626: UMPIRE | X626: LADDER | AB626: ROUND | AD626: 12
A627: BRIGHTON | C627: 3 | D627: 4 | E627: =C627*6+D627 -> 22 | G627: 6 | H627: 6 | I627: =G627*6+H627 -> 42 | K627: 8 | L627: 10 | M627: =K627*6+L627 -> 58 | O627: 13 | P627: 14 | Q627: =O627*6+P627 -> 92 | S627: JOHNS
A628: BEST PLAYERS | W628: TEAM | X628: W | Y628: L | Z628: D | AA628: FOR | AB628: AGST | AC628: % | AD628: PTS
A629: NORTHCOTE | C629: McINTOSH | F629: PAWSEY | I629: GALLAGHER | L629: CASPAR | N629: DUNCAN | Q629: HISCOX
A630: BRIGHTON | C630: McINDOE | F630: STRETTON | I630: BOURKE | L630: PERYY | N630: WARBURTON | Q630: PICKERING | W630: BRUNSWICK | X630: 10 | Y630: 2 | Z630: 0 | AA630: 1381 | AB630: 1028 | AC630: 134.34 | AD630: 40
A631: GOALKICKERS | W631: WILLIAMSTOWN | X631: 8 | Y631: 4 | Z631: 0 | AA631: 1268 | AB631: 981 | AC631: 129.25586136595311 | AD631: 32
A632: NORTHCOTE | C632: PAWSEY 3 | F632: MCINTOSH 3 | I632: DUNCAN 2 | L632: WHITE 2 | N632: KNIGHT 2 | Q632: MURPHY | S632: PHILLIPS | W632: PRESTON | X632: 8 | Y632: 4 | Z632: 0 | AA632: 1370 | AB632: 1206 | AC632: 113.59867330016584 | AD632: 32
A633: BRIGHTON | C633: DOUGLAS 4 | F633: PICKERING 4 | I633: McINDOE 2 | L633: WARBURTON 2 | O633: BOURKE | W633: CAMBERWELL | X633: 8 | Y633: 4 | Z633: 0 | AA633: 1238 | AB633: 1186 | AC633: 104.38 | AD633: 32
A635: CAMBERWELL | C635: 5 | D635: 8 | E635: =C635*6+D635 -> 38 | G635: 8 | H635: 8 | I635: =G635*6+H635 -> 56 | K635: 15 | L635: 11 | M635: =K635*6+L635 -> 101 | O635: 19 | P635: 11 | Q635: =O635*6+P635 -> 125 | S635: CAMBERWELL | W635: BRIGHTON | X635: 7 | Y635: 5 | Z635: 0 | AA635: 1313 | AB635: 1170 | AC635: 112.22 | AD635: 28
A636: OAKLEIGH | C636: 0 | D636: 3 | E636: =C636*6+D636 -> 3 | G636: 5 | H636: 8 | I636: =G636*6+H636 -> 38 | K636: 7 | L636: 11 | M636: =K636*6+L636 -> 53 | O636: 10 | P636: 19 | Q636: =O636*6+P636 -> 79 | S636: MILLER | W636: NORTHCOTE | X636: 7 | Y636: 5 | Z636: 0 | AA636: 1088 | AB636: 1009 | AC636: 107.82953419226958 | AD636: 28
A637: BEST PLAYERS | W637: OAKLEIGH | X637: 7 | Y637: 5 | Z637: 0 | AA637: 1236 | AB637: 1241 | AC637: 99.6 | AD637: 28
A638: CAMBERWELL | C638: BOHAN | F638: McIVOR | I638: BENNISON | L638: FLOWERS | N638: FLETCHER | Q638: BENDLE | W638: PRAHRAN | X638: 5 | Y638: 7 | Z638: 0 | AA638: 1227 | AB638: 1365 | AC638: 89.89 | AD638: 20
A639: OAKLEIGH | C639: TEMME | F639: WILLIAMS | I639: E RYAN | L639: GRAY | N639: DOWLING | Q639: BEARD | W639: SANDRINGHAM | X639: 4 | Y639: 7 | Z639: 0 | AA639: 1171 | AB639: 1348 | AC639: 86.869436201780417 | AD639: 16
A640: GOALKICKERS | Q640: FURLONG | W640: PORT MELBOURNE | X640: 3 | Y640: 9 | Z640: 0 | AA640: 1236 | AB640: 1410 | AC640: 87.66 | AD640: 12
A641: CAMBERWELL | C641: BOHAN 5 | E641: G BRADFORD 3 | H641: BENNISON 3 | K641: PAGE 2 | M641: COOK 2 | O641: FLOWERS | Q641: MONOHAN | T641: HERBERT | W641: COBURG | X641: 3 | Y641: 8 | Z641: 0 | AA641: 1147 | AB641: 1326 | AC641: 86.50075414781297 | AD641: 12
A642: OAKLEIGH | C642: SCOTT 2 | F642: SMEATON 2 | I642: MILGATE 2 | L642: HORWILL 2 | O642: WILLIAMS | Q642: JORY | W642: YARRAVILLE | X642: 1 | Y642: 11 | Z642: 0 | AA642: 1024 | AB642: 1429 | AC642: 71.66 | AD642: 4
A644: PRESTON | C644: 6 | D644: 0 | E644: =C644*6+D644 -> 36 | G644: 8 | H644: 2 | I644: =G644*6+H644 -> 50 | K644: 14 | L644: 3 | M644: =K644*6+L644 -> 87 | O644: 17 | P644: 6 | Q644: =O644*6+P644 -> 108 | S644: PRESTON
A645: SANDRINGHAM | C645: 3 | D645: 4 | E645: =C645*6+D645 -> 22 | G645: 6 | H645: 6 | I645: =G645*6+H645 -> 42 | K645: 9 | L645: 8 | M645: =K645*6+L645 -> 62 | O645: 12 | P645: 10 | Q645: =O645*6+P645 -> 82 | S645: BARNES
A646: BEST PLAYERS
A647: PRESTON | C647: NATHAN | F647: MEARS | I647: BLACKMAN | L647: POTTER | O647: MASLEN | R647: S STEWART
A648: SANDRINGHAM | C648: HISCOCK | F648: BENCRAFT | I648: TOYNE | L648: BRIGHTON | O648: R GRAMBEAU | R648: M GRAMBEAU
A649: GOALKICKERS
A650: PRESTON | C650: NATHAN 7 | F650: POTTER 5 | I650: CUGLEY | K650: MEARS | M650: BROWN | O650: S STEWART | R650: R BRYCE
A651: SANDRINGHAM | C651: HISCOCK 10 | F651: BENNETT | I651: CERINI
A653: PRAHRAN | C653: 2 | D653: 2 | E653: =C653*6+D653 -> 14 | G653: 8 | H653: 11 | I653: =G653*6+H653 -> 59 | K653: 12 | L653: 12 | M653: =K653*6+L653 -> 84 | O653: 17 | P653: 15 | Q653: =O653*6+P653 -> 117 | S653: PORT MELBOURNE
A654: PORT MELBOURNE | C654: 4 | D654: 5 | E654: =C654*6+D654 -> 29 | G654: 6 | H654: 6 | I654: =G654*6+H654 -> 42 | K654: 12 | L654: 12 | M654: =K654*6+L654 -> 84 | O654: 15 | P654: 15 | Q654: =O654*6+P654 -> 105 | S654: EGAN
A655: BEST PLAYERS
A656: PRAHRAN | C656: GARVIN | F656: McCULLOCH | I656: DYER | L656: ROACH | O656: NEWTON | Q656: MORROW
A657: PORT MELBOURNE | C657: FINDLAY | F657: BUTCHER | I657: HOUSTON | L657: FLETCHER | O657: LEWIS | Q657: SEXTON
A658: GOALKICKERS
A659: PRAHRAN | C659: McCULLOCH 7 | F659: DYER 5 | H659: FERGEUS | J659: MASTERTON | M659: GARVIN | O659: ADAMSON | Q659: OPREY
A660: PORT MELBOURNE | C660: HOUSTON 5 | F660: LEWIS 4 | H660: FINDLAY 3 | J660: HOULIHAN 2 | M660: SEXTON
A662: BRUNSWICK | C662: 7 | D662: 4 | E662: =C662*6+D662 -> 46 | G662: 13 | H662: 14 | I662: =G662*6+H662 -> 92 | K662: 19 | L662: 16 | M662: =K662*6+L662 -> 130 | O662: 25 | P662: 21 | Q662: =O662*6+P662 -> 171 | S662: BRUNSWICK
A663: COBURG | C663: 4 | D663: 3 | E663: =C663*6+D663 -> 27 | G663: 6 | H663: 5 | I663: =G663*6+H663 -> 41 | K663: 8 | L663: 8 | M663: =K663*6+L663 -> 56 | O663: 8 | P663: 15 | Q663: =O663*6+P663 -> 63 | S663: McGAW
A664: BEST PLAYERS
A665: BRUNSWICK | C665: R SHAW | F665: SMITH | I665: BAGGOTT | L665: THOMAS | O665: POWELL | Q665: RINGROSE
A666: COBURG | C666: WILSON | F666: WALSH | I666: QUINN | L666: CONDON | O666: BUCKLEY | Q666: STARBUCK
A667: GOALKICKERS
A668: BRUNSWICK | C668: BAGGOTT 7 | F668: POWELL 4 | I668: PRIESTLEY 3 | L668: RINGROSE 3 | O668: SMITH 3 | Q668: HENRYS | S668: GEISLER | U668: HALL | W668: THOMAS | X668: WHELAN
A669: COBURG | C669: WILSON 3 | F669: HOLLAND 2 | I669: FEWKES 2 | L669: CONDON
A671: WILLIAMSTOWN | C671: 2 | D671: 4 | E671: =C671*6+D671 -> 16 | G671: 7 | H671: 8 | I671: =G671*6+H671 -> 50 | K671: 15 | L671: 11 | M671: =K671*6+L671 -> 101 | O671: 20 | P671: 14 | Q671: =O671*6+P671 -> 134 | S671: YARRAVILLE
A672: YARRAVILLE | C672: 2 | D672: 2 | E672: =C672*6+D672 -> 14 | G672: 6 | H672: 5 | I672: =G672*6+H672 -> 41 | K672: 7 | L672: 7 | M672: =K672*6+L672 -> 49 | O672: 11 | P672: 10 | Q672: =O672*6+P672 -> 76 | S672: MERRINGTON
A673: BEST PLAYERS
A674: WILLIAMSTOWN | C674: M McPHERSON | F674: SALVAS | I674: REDMOND | L674: WILCOX | N674: PEACOCK | Q674: COLLINS
A675: YARRAVILLE | C675: PHILLIPS | F675: WOOD | I675: SAIT | L675: SPENCE | N675: COLLINS | Q675: HARRIS
A676: GOALKICKERS
A677: WILLIAMSTOWN | C677: PEACOCK 5 | F677: COLLINS 4 | I677: REDMOND 3 | L677: M McPHERSON 3 | P677: SALVAS 3 | S677: WALKER 2
A678: YARRAVILLE | C678: HARRIS 4 | F678: PHILLIPS 3 | I678: RUDDELL 2 | L678: SPENCE | N678: TESTRAIL
A680: ROUND 13 | D680: 24TH JULY | J680: WEATHER | M680: NORTH WIND FINE SUNNY | S680: PLAYED AT
D681: 1ST QTR | H681: 2ND QTR | L681: 3RD QTR | P681: FINAL | S681: WILLIAMSTOWN
A682: WILLIAMSTOWN | C682: 2 | D682: 3 | E682: =C682*6+D682 -> 15 | G682: 3 | H682: 8 | I682: =G682*6+H682 -> 26 | K682: 6 | L682: 10 | M682: =K682*6+L682 -> 46 | O682: 14 | P682: 19 | Q682: =O682*6+P682 -> 103 | S682: UMPIRE | X682: LADDER | AB682: ROUND | AD682: 13
A683: BRUNSWICK | C683: 3 | D683: 6 | E683: =C683*6+D683 -> 24 | G683: 5 | H683: 9 | I683: =G683*6+H683 -> 39 | K683: 8 | L683: 14 | M683: =K683*6+L683 -> 62 | O683: 11 | P683: 15 | Q683: =O683*6+P683 -> 81 | S683: BARNES
A684: BEST PLAYERS | W684: TEAM | X684: W | Y684: L | Z684: D | AA684: FOR | AB684: AGST | AC684: % | AD684: PTS
A685: WILLIAMSTOWN | C685: REDMOND | F685: PEACOCK | I685: CHAPMAN | L685: WALKER | N685: SHEAHAN | Q685: McRAE
A686: BRUNSWICK | C686: THOMAS | F686: BAGGOTT | I686: SMITH | L686: WHELAN | N686: SHAW | Q686: PRIESTLEY | W686: BRUNSWICK | X686: 10 | Y686: 3 | Z686: 0 | AA686: 1462 | AB686: 1131 | AC686: 129.27 | AD686: 40
A687: GOALKICKERS | Q687: RYAN | W687: WILLIAMSTOWN | X687: 9 | Y687: 4 | Z687: 0 | AA687: 1371 | AB687: 1062 | AC687: 129.09604519774012 | AD687: 36
A688: WILLIAMSTOWN | C688: COLLINS 3 | F688: REDMOND 3 | I688: M McPHERSON 3 | M688: CHAPMAN | O688: WILLIAMS | Q688: WALKER | S688: TODD | W688: BRIGHTON | X688: 8 | Y688: 5 | Z688: 0 | AA688: 1448 | AB688: 1277 | AC688: 113.39 | AD688: 32
A689: BRUNSWICK | C689: BAGGOTT 4 | F689: PRIESTLEY 2 | I689: POWELL 2 | L689: KYNE | N689: RINGROSE | Q689: McLEOD | W689: NORTHCOTE | X689: 8 | Y689: 5 | Z689: 0 | AA689: 1234 | AB689: 1098 | AC689: 112.38615664845173 | AD689: 32
A691: OAKLEIGH | C691: 5 | D691: 3 | E691: =C691*6+D691 -> 33 | G691: 11 | H691: 9 | I691: =G691*6+H691 -> 75 | K691: 16 | L691: 15 | M691: =K691*6+L691 -> 111 | O691: 18 | P691: 19 | Q691: =O691*6+P691 -> 127 | S691: OAKLEIGH | W691: PRESTON | X691: 8 | Y691: 5 | Z691: 0 | AA691: 1462 | AB691: 1333 | AC691: 109.6774193548387 | AD691: 32
A692: PRESTON | C692: 5 | D692: 4 | E692: =C692*6+D692 -> 34 | G692: 9 | H692: 7 | I692: =G692*6+H692 -> 61 | K692: 10 | L692: 10 | M692: =K692*6+L692 -> 70 | O692: 13 | P692: 14 | Q692: =O692*6+P692 -> 92 | S692: MERRINGTON | W692: OAKLEIGH | X692: 8 | Y692: 5 | Z692: 0 | AA692: 1363 | AB692: 1333 | AC692: 102.25 | AD692: 32
A693: BEST PLAYERS | W693: CAMBERWELL | X693: 8 | Y693: 5 | Z693: 0 | AA693: 1349 | AB693: 1331 | AC693: 101.35 | AD693: 32
A694: OAKLEIGH | C694: SCOTT | F694: BAXTER | I694: DONNELLY | L694: TEMME | N694: GRAY | Q694: BRISTOWE | W694: PRAHRAN | X694: 6 | Y694: 7 | Z694: 0 | AA694: 1372 | AB694: 1476 | AC694: 92.95 | AD694: 24
A695: PRESTON | C695: BLACKMAN | F695: LARDI | I695: PRITCHARD | L695: MEARS | N695: S STEWART | Q695: MASLEN | W695: PORT MELBOURNE | X695: 4 | Y695: 9 | Z695: 0 | AA695: 1384 | AB695: 1533 | AC695: 90.28 | AD695: 16
A696: GOALKICKERS | W696: SANDRINGHAM | X696: 4 | Y696: 8 | Z696: 0 | AA696: 1294 | AB696: 1496 | AC696: 86.497326203208559 | AD696: 16
A697: OAKLEIGH | C697: SCOTT 7 | E697: BRISTOWE 3 | H697: RUNDELL 2 | J697: NOONAN 2 | M697: E RYAN | O697: KELLY | Q697: R FINN | S697: PERKINS | W697: COBURG | X697: 3 | Y697: 9 | Z697: 0 | AA697: 1252 | AB697: 1461 | AC697: 85.69 | AD697: 12
A698: PRESTON | C698: MEARS 3 | E698: POTTER 3 | G698: LARDI 2 | I698: BROWN 2 | K698: R BRYCE | M698: WALKER | O698: S STEWART | W698: YARRAVILLE | X698: 1 | Y698: 12 | Z698: 0 | AA698: 1113 | AB698: 1575 | AC698: 70.67 | AD698: 4
A700: PRAHRAN | C700: 5 | D700: 4 | E700: =C700*6+D700 -> 34 | G700: 11 | H700: 8 | I700: =G700*6+H700 -> 74 | K700: 16 | L700: 13 | M700: =K700*6+L700 -> 109 | O700: 21 | P700: 19 | Q700: =O700*6+P700 -> 145 | S700: ELSTERNWICK PARK
A701: CAMBERWELL | C701: 4 | D701: 5 | E701: =C701*6+D701 -> 29 | G701: 6 | H701: 8 | I701: =G701*6+H701 -> 44 | K701: 13 | L701: 11 | M701: =K701*6+L701 -> 89 | O701: 16 | P701: 15 | Q701: =O701*6+P701 -> 111 | S701: WRIGHT
A702: BEST PLAYERS
A703: PRAHRAN | C703: WALSH | F703: McCULLOCH | I703: MORROW | L703: GARVIN | N703: OVERS | Q703: COLLS
A704: CAMBERWELL | C704: MILLER | F704: G BRADFORD | I704: COOK | L704: STUBBS | N704: ROCHFORD | Q704: BENDLE
A705: GOALKICKERS
A706: PRAHRAN | C706: McCULLOCH 6 | F706: DYER 5 | H706: FERGEUS 4 | J706: WALSH | L706: GARVIN | N706: NEWTON | P706: BUTTLING | R706: MASTERTON | V706: COLLS
A707: CAMBERWELL | C707: G BRADFORD 4 | F707: FURLONG 3 | I707: STUBBS 2 | K707: BENDLE 2 | M707: BOHAN 2 | O707: HERBERT | Q707: COOK | S707: BENNISON
A709: PORT MELBOURNE | C709: 3 | D709: 3 | E709: =C709*6+D709 -> 21 | G709: 10 | H709: 5 | I709: =G709*6+H709 -> 65 | K709: 18 | L709: 6 | M709: =K709*6+L709 -> 114 | O709: 23 | P709: 10 | Q709: =O709*6+P709 -> 148 | S709: BEACH ROAD
A710: SANDRINGHAM | C710: 2 | D710: 3 | E710: =C710*6+D710 -> 15 | G710: 6 | H710: 8 | I710: =G710*6+H710 -> 44 | K710: 11 | L710: 11 | M710: =K710*6+L710 -> 77 | O710: 18 | P710: 15 | Q710: =O710*6+P710 -> 123 | S710: McGAW
A711: BEST PLAYERS
A712: PORT MELBOURNE | C712: HOUSTON | F712: CULPH | I712: FINDLAY | L712: HOULIHAN | O712: TRAINER | R712: BAKER
A713: SANDRINGHAM | C713: TOYNE | F713: R GRAMBEAU | I713: B HARPER | L713: HISCOCK | O713: BENCRAFT | R713: PATTERSON
A714: GOALKICKERS
A715: PORT MELBOURNE | C715: HOUSTON 10 | F715: FINDLAY 6 | I715: CULPH 2 | K715: HOULIHAN 2 | N715: REYNOLDS | Q715: WOODBRIDGE | T715: PARKER
A716: SANDRINGHAM | C716: HISCOCK 9 | F716: B HARPER 3 | I716: BENCRAFT 2 | L716: CLARKE | N716: BENNETT | Q716: PATTERSON | T716: SLEIGH
A718: BRIGHTON | C718: 4 | D718: 7 | E718: =C718*6+D718 -> 31 | G718: 9 | H718: 12 | I718: =G718*6+H718 -> 66 | K718: 12 | L718: 19 | M718: =K718*6+L718 -> 91 | O718: 18 | P718: 27 | Q718: =O718*6+P718 -> 135 | S718: COBURG
A719: COBURG | C719: 1 | D719: 4 | E719: =C719*6+D719 -> 10 | G719: 7 | H719: 9 | I719: =G719*6+H719 -> 51 | K719: 13 | L719: 9 | M719: =K719*6+L719 -> 87 | O719: 15 | P719: 15 | Q719: =O719*6+P719 -> 105 | S719: EGAN
A720: BEST PLAYERS
A721: BRIGHTON | C721: BURKE | F721: DOUGLAS | I721: ADAMSON | L721: PICKERING | O721: McASEY | Q721: McINDOE
A722: COBURG | C722: CONDON | F722: HEEPS | I722: EGAN | L722: QUINN | O722: WADE | Q722: WALSH
A723: GOALKICKERS
A724: BRIGHTON | C724: DOUGLAS 7 | F724: BURKE 5 | I724: PICKERING 2 | L724: WARBURTON | O724: PINDER | Q724: PLUNKETT | T724: ADAMSON
A725: COBURG | C725: CONDON 4 | F725: R WILKINSON 3 | J725: EGAN 2 | L725: WADE 2 | N725: BUCKLEY 2 | Q725: FEWKES 2
A727: NORTHCOTE | C727: 4 | D727: 4 | E727: =C727*6+D727 -> 28 | G727: 8 | H727: 9 | I727: =G727*6+H727 -> 57 | K727: 15 | L727: 17 | M727: =K727*6+L727 -> 107 | O727: 21 | P727: 20 | Q727: =O727*6+P727 -> 146 | S727: NORTHCOTE
A728: YARRAVILLE | C728: 5 | D728: 3 | E728: =C728*6+D728 -> 33 | G728: 7 | H728: 4 | I728: =G728*6+H728 -> 46 | K728: 7 | L728: 6 | M728: =K728*6+L728 -> 48 | O728: 13 | P728: 11 | Q728: =O728*6+P728 -> 89 | S728: MILLER
A729: BEST PLAYERS
A730: NORTHCOTE | C730: NASH | E730: WHITE | H730: DUNCAN | K730: STABB | N730: HISCOX | Q730: McINTOSH
A731: YARRAVILLE | C731: LAW | E731: YATES | H731: PHILLIPS | K731: MALBON | N731: STONE | Q731: TESTRAIL
A732: GOALKICKERS
A733: NORTHCOTE | C733: WHITE 6 | E733: NASH 4 | G733: DUNCAN 3 | J733: PAWSEY 2 | M733: KNIGHT 2 | O733: McINTOSH 2 | R733: GALLAGHER | V733: STABB
A734: YARRAVILLE | C734: PHILLIPS 5 | F734: TESTRAIL 4 | I734: SCARFFE 3 | L734: HARRIS
A736: ROUND 14 | D736: 31ST JULY | J736: WEATHER | M736: NORTH EAST BREEZE RAIN COLD | S736: PLAYED AT
D737: 1ST QTR | H737: 2ND QTR | L737: 3RD QTR | P737: FINAL | S737: BRUNSWICK
A738: BRUNSWICK | C738: 3 | D738: 6 | E738: =C738*6+D738 -> 24 | G738: 6 | H738: 10 | I738: =G738*6+H738 -> 46 | K738: 9 | L738: 15 | M738: =K738*6+L738 -> 69 | O738: 11 | P738: 20 | Q738: =O738*6+P738 -> 86 | S738: UMPIRE | X738: LADDER | AB738: ROUND | AD738: 14
A739: PRESTON | C739: 2 | D739: 1 | E739: =C739*6+D739 -> 13 | G739: 6 | H739: 5 | I739: =G739*6+H739 -> 41 | K739: 6 | L739: 6 | M739: =K739*6+L739 -> 42 | O739: 10 | P739: 10 | Q739: =O739*6+P739 -> 70 | S739: MILLER
A740: BEST PLAYERS | W740: TEAM | X740: W | Y740: L | Z740: D | AA740: FOR | AB740: AGST | AC740: % | AD740: PTS
A741: BRUNSWICK | C741: SHAW | F741: BAGGOTT | I741: THOMAS | L741: POWELL | N741: WHELAN | Q741: PRIESTLEY
A742: PRESTON | C742: C STEWART | F742: PRITCHARD | I742: MEARS | L742: K BRYCE | N742: PASCOE | Q742: RIDDELL | W742: BRUNSWICK | X742: 11 | Y742: 3 | Z742: 0 | AA742: 1548 | AB742: 1201 | AC742: 128.89 | AD742: 44
A743: GOALKICKERS | W743: WILLIAMSTOWN | X743: 10 | Y743: 4 | Z743: 0 | AA743: 1513 | AB743: 1125 | AC743: 134.48888888888888 | AD743: 40
A744: BRUNSWICK | C744: POWELL 3 | F744: BAGGOTT 2 | I744: PRIESTLEY 2 | L744: KYNE | N744: RINGROSE | P744: STANLEY | R744: HENRYS | W744: NORTHCOTE | X744: 9 | Y744: 5 | Z744: 0 | AA744: 1368 | AB744: 1188 | AC744: 115.15151515151516 | AD744: 36
A745: PRESTON | C745: NATHAN 3 | F745: POTTER 2 | I745: R BRYCE 2 | L745: GOLDIN | N745: LARDI | P745: CUGLEY | W745: BRIGHTON | X745: 9 | Y745: 5 | Z745: 0 | AA745: 1607 | AB745: 1396 | AC745: 115.11 | AD745: 36
A747: BRIGHTON | C747: 4 | D747: 3 | E747: =C747*6+D747 -> 27 | G747: 10 | H747: 6 | I747: =G747*6+H747 -> 66 | K747: 14 | L747: 10 | M747: =K747*6+L747 -> 94 | O747: 24 | P747: 15 | Q747: =O747*6+P747 -> 159 | S747: ELSTERNWICK PARK | W747: PRESTON | X747: 8 | Y747: 6 | Z747: 0 | AA747: 1532 | AB747: 1419 | AC747: 107.96335447498238 | AD747: 32
A748: OAKLEIGH | C748: 5 | D748: 4 | E748: =C748*6+D748 -> 34 | G748: 8 | H748: 6 | I748: =G748*6+H748 -> 54 | K748: 12 | L748: 12 | M748: =K748*6+L748 -> 84 | O748: 18 | P748: 13 | Q748: =O748*6+P748 -> 121 | S748: BARNES | W748: OAKLEIGH | X748: 8 | Y748: 6 | Z748: 0 | AA748: 1484 | AB748: 1492 | AC748: 99.46 | AD748: 32
A749: BEST PLAYERS | W749: CAMBERWELL | X749: 8 | Y749: 6 | Z749: 0 | AA749: 1439 | AB749: 1450 | AC749: 99.24 | AD749: 32
A750: BRIGHTON | C750: WARBURTON | F750: WILLIAMSON | I750: DOUGLAS | L750: ADAMSON | N750: STRETTON | Q750: E TURNER | W750: PRAHRAN | X750: 6 | Y750: 8 | Z750: 0 | AA750: 1462 | AB750: 1610 | AC750: 90.81 | AD750: 24
A751: OAKLEIGH | C751: RUNDELL | F751: SMEATON | I751: BRISTOWE | L751: SCOTT | N751: LE LIEVRE | Q751: WILLIAMS | W751: SANDRINGHAM | X751: 5 | Y751: 8 | Z751: 0 | AA751: 1413 | AB751: 1586 | AC751: 89.092055485498108 | AD751: 20
A752: GOALKICKERS | W752: PORT MELBOURNE | X752: 4 | Y752: 10 | Z752: 0 | AA752: 1447 | AB752: 1675 | AC752: 86.39 | AD752: 16
A753: BRIGHTON | C753: DOUGLAS 8 | F753: WARBURTON 6 | J753: ADAMSON 5 | M753: McINDOE 3 | P753: STRETTON | R753: PERRY | W753: COBURG | X753: 3 | Y753: 10 | Z753: 0 | AA753: 1359 | AB753: 1575 | AC753: 86.29 | AD753: 12
A754: OAKLEIGH | C754: RUNDELL 5 | F754: SCOTT 4 | I754: R FINN 3 | K754: SMEATON 3 | N754: BRISTOWE 2 | Q754: KELLY | W754: YARRAVILLE | X754: 2 | Y754: 12 | Z754: 0 | AA754: 1227 | AB754: 1682 | AC754: 72.95 | AD754: 8
A756: NORTHCOTE | C756: 6 | D756: 3 | E756: =C756*6+D756 -> 39 | G756: 10 | H756: 9 | I756: =G756*6+H756 -> 69 | K756: 15 | L756: 12 | M756: =K756*6+L756 -> 102 | O756: 20 | P756: 14 | Q756: =O756*6+P756 -> 134 | S756: NORTHCOTE
A757: PRAHRAN | C757: 5 | D757: 0 | E757: =C757*6+D757 -> 30 | G757: 7 | H757: 4 | I757: =G757*6+H757 -> 46 | K757: 11 | L757: 6 | M757: =K757*6+L757 -> 72 | O757: 13 | P757: 12 | Q757: =O757*6+P757 -> 90 | S757: MERRINGTON
A758: BEST PLAYERS
A759: NORTHCOTE | C759: PAWSEY | F759: CASPAR | I759: NASH | K759: DUNCAN | N759: STABB | Q759: McINTOSH
A760: PRAHRAN | C760: MORROW | F760: FERGEUS | I760: BOURKE | K760: NEWTON | N760: OPREY | Q760: DYER
A761: GOALKICKERS
A762: NORTHCOTE | C762: DUNCAN 5 | F762: NASH 5 | H762: PAWSEY 4 | K762: MURPHY 3 | N762: McINTOSH | Q762: WALLIS | S762: DUNN
A763: PRAHRAN | C763: OPREY 3 | F763: WOOD 2 | H763: FERGEUS 2 | K763: DYER | M763: SHRIMPTON | P763: NEWTON | R763: WALSH | U763: MASTERTON | X763: GARVIN
A765: SANDRINGHAM | C765: 2 | D765: 2 | E765: =C765*6+D765 -> 14 | G765: 8 | H765: 9 | I765: =G765*6+H765 -> 57 | K765: 11 | L765: 11 | M765: =K765*6+L765 -> 77 | O765: 17 | P765: 17 | Q765: =O765*6+P765 -> 119 | S765: CAMBERWELL
A766: CAMBERWELL | C766: 5 | D766: 4 | E766: =C766*6+D766 -> 34 | G766: 5 | H766: 6 | I766: =G766*6+H766 -> 36 | K766: 8 | L766: 10 | M766: =K766*6+L766 -> 58 | O766: 13 | P766: 12 | Q766: =O766*6+P766 -> 90 | S766: EGAN
A767: BEST PLAYERS
A768: SANDRINGHAM | C768: TOYNE | F768: PATTERSON | I768: BENCRAFT | L768: B HARPER | N768: STANLEY | Q768: HISCOCK
A769: CAMBERWELL | C769: BOHAN | F769: STUBBS | I769: UNSTEAD | L769: COOK | N769: HERBERT | Q769: McIVOR
A770: GOALKICKERS
A771: SANDRINGHAM | C771: HISCOCK 7 | F771: B HARPER 5 | I771: BENCRAFT 3 | L771: SLEIGH | N771: STANLEY
A772: CAMBERWELL | C772: BOHAN 5 | F772: CRACKNELL 3 | I772: PAGE 2 | K772: UNSTEAD | M772: COOK | O772: G BRADFORD
A774: YARRAVILLE | C774: 2 | D774: 1 | E774: =C774*6+D774 -> 13 | G774: 10 | H774: 5 | I774: =G774*6+H774 -> 65 | K774: 13 | L774: 7 | M774: =K774*6+L774 -> 85 | O774: 17 | P774: 12 | Q774: =O774*6+P774 -> 114 | S774: COBURG
A775: COBURG | C775: 7 | D775: 2 | E775: =C775*6+D775 -> 44 | G775: 11 | H775: 5 | I775: =G775*6+H775 -> 71 | K775: 15 | L775: 13 | M775: =K775*6+L775 -> 103 | O775: 15 | P775: 17 | Q775: =O775*6+P775 -> 107 | S775: McGAW
A776: BEST PLAYERS
A777: YARRAVILLE | C777: MALBON | F777: HARRIS | I777: YATES | L777: STONE | N777: GARLICK | Q777: PHILLIPS
A778: COBURG | C778: WADE | F778: WILLIS | I778: McILVEEN | L778: JAMES | N778: QUINN | Q778: CONDON
A779: GOALKICKERS
A780: YARRAVILLE | C780: HARRIS 6 | F780: PHILLIPS 6 | I780: SING 3 | K780: SCARFFE | M780: CAIN
A781: COBURG | C781: WADE 4 | F781: CONDON 4 | I781: WILSON 2 | K781: JAMES | M781: HOLLAND | O781: WILKINSON | R781: BUCKLEY | U781: SMITH
A783: WILLIAMSTOWN | C783: 4 | D783: 2 | E783: =C783*6+D783 -> 26 | G783: 8 | H783: 9 | I783: =G783*6+H783 -> 57 | K783: 14 | L783: 18 | M783: =K783*6+L783 -> 102 | O783: 20 | P783: 22 | Q783: =O783*6+P783 -> 142 | S783: WILLIAMSTOWN
A784: PORT MELBOURNE | C784: 2 | D784: 2 | E784: =C784*6+D784 -> 14 | G784: 4 | H784: 5 | I784: =G784*6+H784 -> 29 | K784: 8 | L784: 7 | M784: =K784*6+L784 -> 55 | O784: 9 | P784: 9 | Q784: =O784*6+P784 -> 63 | S784: WRIGHT
A785: BEST PLAYERS
A786: WILLIAMSTOWN | C786: COLLINS | F786: SALVAS | I786: CAMERON | L786: TODD | N786: WILLIAMS | Q786: REDMOND
A787: PORT MELBOURNE | C787: HOUSTON | F787: BUTCHER | I787: FINDLAY | L787: MILLER | N787: LEWIS | Q787: BAKER
A788: GOALKICKERS
A789: WILLIAMSTOWN | C789: COLLINS 8 | F789: SALVAS 4 | I789: TODD 3 | K789: REDMOND 2 | N789: WILLIAMS 2 | Q789: M McPHERSON
A790: PORT MELBOURNE | C790: FINDLAY 2 | F790: LEWIS 2 | I790: BOWER 2 | K790: HOUSTON | M790: HOULIHAN | P790: REYNOLDS
A792: ROUND 15 | D792: 7TH AUGUST | J792: WEATHER | M792: NORTH BREEZE FINE WARM | S792: PLAYED AT
D793: 1ST QTR | H793: 2ND QTR | L793: 3RD QTR | P793: FINAL | S793: OAKLEIGH
A794: WILLIAMSTOWN | C794: 3 | D794: 2 | E794: =C794*6+D794 -> 20 | G794: 5 | H794: 11 | I794: =G794*6+H794 -> 41 | K794: 7 | L794: 14 | M794: =K794*6+L794 -> 56 | O794: 14 | P794: 17 | Q794: =O794*6+P794 -> 101 | S794: UMPIRE | X794: LADDER | AB794: ROUND | AD794: 15
A795: OAKLEIGH | C795: 4 | D795: 10 | E795: =C795*6+D795 -> 34 | G795: 7 | H795: 12 | I795: =G795*6+H795 -> 54 | K795: 9 | L795: 12 | M795: =K795*6+L795 -> 66 | O795: 13 | P795: 14 | Q795: =O795*6+P795 -> 92 | S795: EGAN
A796: BEST PLAYERS | W796: TEAM | X796: W | Y796: L | Z796: D | AA796: FOR | AB796: AGST | AC796: % | AD796: PTS
A797: WILLIAMSTOWN | C797: WILCOX | F797: SAMPSON | I797: DANCKERT | L797: WILLIAMS | O797: McRAE | Q797: FEATHERBY
A798: OAKLEIGH | C798: DONNELLY | F798: TEMME | I798: SCOTT | L798: BRISTOWE | O798: PERKINS | Q798: R FINN | W798: BRUNSWICK | X798: 12 | Y798: 3 | Z798: 0 | AA798: 1665 | AB798: 1301 | AC798: 127.98 | AD798: 48
A799: GOALKICKERS | O799: SALVAS | Q799: SHEAHAN | W799: WILLIAMSTOWN | X799: 11 | Y799: 4 | Z799: 0 | AA799: 1614 | AB799: 1217 | AC799: 132.62119967132293 | AD799: 44
A800: WILLIAMSTOWN | C800: REDMOND 4 | F800: WALKER 2 | I800: TODD 2 | K800: PEACOCK 2 | N800: MATTHEWS | Q800: M McPHERSON | W800: BRIGHTON | X800: 10 | Y800: 5 | Z800: 0 | AA800: 1736 | AB800: 1522 | AC800: 114.06 | AD800: 40
A801: OAKLEIGH | C801: RUNDELL 3 | F801: SCOTT 3 | I801: SMEATON 3 | L801: BRISTOWE 2 | O801: MUNYARD | R801: PERKINS | W801: NORTHCOTE | X801: 9 | Y801: 6 | Z801: 0 | AA801: 1485 | AB801: 1311 | AC801: 113.27231121281464 | AD801: 36
A803: BRUNSWICK | C803: 4 | D803: 9 | E803: =C803*6+D803 -> 33 | G803: 7 | H803: 11 | I803: =G803*6+H803 -> 53 | K803: 14 | L803: 16 | M803: =K803*6+L803 -> 100 | O803: 16 | P803: 21 | Q803: =O803*6+P803 -> 117 | S803: CAMBERWELL | W803: PRESTON | X803: 9 | Y803: 6 | Z803: 0 | AA803: 1643 | AB803: 1490 | AC803: 110.26845637583892 | AD803: 36
A804: CAMBERWELL | C804: 3 | D804: 1 | E804: =C804*6+D804 -> 19 | G804: 9 | H804: 6 | I804: =G804*6+H804 -> 60 | K804: 11 | L804: 7 | M804: =K804*6+L804 -> 73 | O804: 15 | P804: 10 | Q804: =O804*6+P804 -> 100 | S804: MERRINGTON | W804: OAKLEIGH | X804: 8 | Y804: 7 | Z804: 0 | AA804: 1576 | AB804: 1593 | AC804: 98.93 | AD804: 32
A805: BEST PLAYERS | W805: CAMBERWELL | X805: 8 | Y805: 7 | Z805: 0 | AA805: 1539 | AB805: 1567 | AC805: 98.21 | AD805: 32
A806: BRUNSWICK | C806: WHELAN | F806: RINGROSE | I806: SHAW | K806: PRIESTLEY | N806: SILK | Q806: SPENCER | W806: SANDRINGHAM | X806: 6 | Y806: 8 | Z806: 0 | AA806: 1536 | AB806: 1703 | AC806: 90.193775689958898 | AD806: 24
A807: CAMBERWELL | C807: MILLER | F807: G BRADFORD | I807: COOK | K807: JENSEN | N807: HERBERT | Q807: BENNISON] | W807: PRAHRAN | X807: 6 | Y807: 9 | Z807: 0 | AA807: 1533 | AB807: 1721 | AC807: 89.08 | AD807: 24
A808: GOALKICKERS | W808: PORT MELBOURNE | X808: 5 | Y808: 10 | Z808: 0 | AA808: 1550 | AB808: 1760 | AC808: 88.07 | AD808: 20
A809: BRUNSWICK | C809: RINGROSE 6 | F809: McLEOD 2 | I809: BRADLEY 2 | L809: HENRYS 2 | N809: WHELAN | P809: POWER | R809: PRIESTLEY | W809: COBURG | X809: 3 | Y809: 11 | Z809: 0 | AA809: 1444 | AB809: 1678 | AC809: 86.05 | AD809: 12
A810: CAMBERWELL | C810: G BRADFORD 5 | F810: STUBBS 5 | I810: COOK 2 | K810: BOHAN | M810: BENNISON | O810: CRACKNELL | W810: YARRAVILLE | X810: 2 | Y810: 13 | Z810: 0 | AA810: 1353 | AB810: 1811 | AC810: 74.71 | AD810: 8
A812: SANDRINGHAM | C812: 3 | D812: 1 | E812: =C812*6+D812 -> 19 | G812: 11 | H812: 4 | I812: =G812*6+H812 -> 70 | K812: 12 | L812: 6 | M812: =K812*6+L812 -> 78 | O812: 19 | P812: 9 | Q812: =O812*6+P812 -> 123 | S812: BEACH ROAD
A813: NORTHCOTE | C813: 6 | D813: 4 | E813: =C813*6+D813 -> 40 | G813: 7 | H813: 5 | I813: =G813*6+H813 -> 47 | K813: 16 | L813: 9 | M813: =K813*6+L813 -> 105 | O813: 17 | P813: 15 | Q813: =O813*6+P813 -> 117 | S813: WRIGHT
A814: BEST PLAYERS
A815: SANDRINGHAM | C815: PATTERSON | F815: BENCRAFT | I815: HISCOCK | L815: TOYNE | N815: BENNETT | Q815: B HARPER
A816: NORTHCOTE | C816: HISCOX | F816: KNIGHT | I816: GREENWOOD | L816: PAWSEY | N816: CASPAR | Q816: McINTOSH
A817: GOALKICKERS
A818: SANDRINGHAM | C818: HISCOCK 6 | F818: B HARPER 5 | I818: BENCRAFT 4 | L818: CLARKE | N818: M GRAMBEAU | Q818: PARKER | S818: BENNET
A819: NORTHCOTE | C819: GREENWOOD 6 | F819: PAWSEY 3 | I819: KNIGHT 3 | K819: FREAKE | M819: KEV MURPHY | P819: CASPAR | R819: DUNCAN | U819: HISCOX
A821: PRESTON | C821: 2 | D821: 7 | E821: =C821*6+D821 -> 19 | G821: 5 | H821: 10 | I821: =G821*6+H821 -> 40 | K821: 12 | L821: 20 | M821: =K821*6+L821 -> 92 | O821: 15 | P821: 21 | Q821: =O821*6+P821 -> 111 | S821: PRESTON
A822: PRAHRAN | C822: 3 | D822: 0 | E822: =C822*6+D822 -> 18 | G822: 5 | H822: 5 | I822: =G822*6+H822 -> 35 | K822: 5 | L822: 6 | M822: =K822*6+L822 -> 36 | O822: 10 | P822: 11 | Q822: =O822*6+P822 -> 71 | S822: BARNES
A823: BEST PLAYERS
A824: PRESTON | C824: MASLEN | F824: LARDI | I824: PRITCHARD | L824: NATHAN | N824: GOLDIN | Q824: S STEWART
A825: PRAHRAN | C825: FERGEUS | F825: McCULLOCH | I825: MORROW | L825: DYER | N825: SHRIMPTON | Q825: BUTTLING
A826: GOALKICKERS
A827: PRESTON | C827: GOLDIN 3 | F827: POTTER 3 | I827: NATHAN 3 | L827: CONNELLY 2 | O827: MEARS 2 | Q827: CUGLEY | S827: LARDI
A828: PRAHRAN | C828: DYER 3 | F828: FERGEUS | H828: ROACH | J828: JACOBY | L828: WALSH | N828: McCULLOCH | Q828: NEWTON | S828: SHRIMPTON
A830: PORT MELBOURNE | C830: 3 | D830: 3 | E830: =C830*6+D830 -> 21 | G830: 3 | H830: 6 | I830: =G830*6+H830 -> 24 | K830: 10 | L830: 9 | M830: =K830*6+L830 -> 69 | O830: 15 | P830: 13 | Q830: =O830*6+P830 -> 103 | S830: PORT MELBOURNE
A831: COBURG | C831: 0 | D831: 0 | E831: =C831*6+D831 -> 0 | G831: 6 | H831: 8 | I831: =G831*6+H831 -> 44 | K831: 10 | L831: 11 | M831: =K831*6+L831 -> 71 | O831: 12 | P831: 13 | Q831: =O831*6+P831 -> 85 | S831: MILLER
A832: BEST PLAYERS
A833: PORT MELBOURNE | C833: BUTCHER | F833: SEXTON | I833: McNAUGHTON | L833: FINDLAY | O833: LEWIS | Q833: HARRISON
A834: COBURG | C834: WILSON | F834: EGAN | I834: HEEPS | L834: STARBUCK | O834: GILBERT | Q834: CONDON
A835: GOALKICKERS
A836: PORT MELBOURNE | C836: SEXTON 4 | F836: LEWIS 4 | I836: FINDLAY 3 | L836: HOULIHAN 2 | O836: TUCKER | Q836: MILLER
A837: COBURG | C837: EGAN 4 | E837: JORGENSON 2 | H837: H WILKINSON | K837: WADE | M837: WILSON | O837: R WILKINSON | R837: HOLLAND | U837: CONDON
A839: BRIGHTON | C839: 3 | D839: 1 | E839: =C839*6+D839 -> 19 | G839: 8 | H839: 10 | I839: =G839*6+H839 -> 58 | K839: 11 | L839: 10 | M839: =K839*6+L839 -> 76 | O839: 19 | P839: 15 | Q839: =O839*6+P839 -> 129 | S839: YARRAVILLE
A840: YARRAVILLE | C840: 5 | D840: 7 | E840: =C840*6+D840 -> 37 | G840: 7 | H840: 8 | I840: =G840*6+H840 -> 50 | K840: 15 | L840: 17 | M840: =K840*6+L840 -> 107 | O840: 18 | P840: 18 | Q840: =O840*6+P840 -> 126 | S840: McGAW
A841: BEST PLAYERS
A842: BRIGHTON | C842: WARBURTON | F842: ADAMSON | I842: McINDOE | L842: DOUGLAS | O842: WILLIAMSON | R842: ROSE
A843: YARRAVILLE | C843: PHILLIPS | F843: HARDIMAN | I843: HARRIS | L843: MITCHELL | O843: TESTRAIL | R843: McASEY
A844: GOALKICKERS
A845: BRIGHTON | C845: WARBURTON 7 | F845: DOUGLAS 3 | I845: ADAMSON 3 | L845: McINDOE 3 | O845: PICKERING | Q845: McASEY | S845: PINDER
A846: YARRAVILLE | C846: PHILLIPS 6 | F846: TESTRAIL 4 | I846: McASEY 3 | L846: HARDIMAN 2 | O846: MAHER | Q846: SING | S846: COLLINS
A848: ROUND 16 | D848: 14TH AUGUST | H848: WEATHER | K848: FIERCE NORTH WEST GALES (62 M.P.H.) | S848: PLAYED AT
D849: 1ST QTR | H849: 2ND QTR | L849: 3RD QTR | P849: FINAL | S849: WILLIAMSTOWN
A850: WILLIAMSTOWN | C850: 3 | D850: 6 | E850: =C850*6+D850 -> 24 | G850: 4 | H850: 7 | I850: =G850*6+H850 -> 31 | K850: 7 | L850: 14 | M850: =K850*6+L850 -> 56 | O850: 8 | P850: 16 | Q850: =O850*6+P850 -> 64 | S850: UMPIRE | X850: LADDER | AB850: ROUND | AD850: 16
A851: BRIGHTON | C851: 0 | D851: 1 | E851: =C851*6+D851 -> 1 | G851: 1 | H851: 6 | I851: =G851*6+H851 -> 12 | K851: 1 | L851: 6 | M851: =K851*6+L851 -> 12 | O851: 6 | P851: 9 | Q851: =O851*6+P851 -> 45 | S851: MERRINGTON
A852: BEST PLAYERS | W852: TEAM | X852: W | Y852: L | Z852: D | AA852: FOR | AB852: AGST | AC852: % | AD852: PTS
A853: WILLIAMSTOWN | C853: CHAPMAN | F853: CAMERON | I853: TODD | K853: MATTHEWS | N853: WALKER | Q853: WILCOX
A854: BRIGHTON | C854: STRETTON | F854: HEIMS | I854: E TURNER | K854: PICKERING | N854: PINDER | Q854: BURKE | W854: BRUNSWICK | X854: 13 | Y854: 3 | Z854: 0 | AA854: 1745 | AB854: 1347 | AC854: 129.55 | AD854: 52
A855: GOALKICKERS | W855: WILLIAMSTOWN | X855: 12 | Y855: 4 | Z855: 0 | AA855: 1678 | AB855: 1262 | AC855: 132.9635499207607 | AD855: 48
A856: WILLIAMSTOWN | C856: M McPHERSON 2 | G856: TODD | I856: SALVAS | K856: MATTHEWS | N856: REDMOND | Q856: PEACOCK | S856: WALKER | W856: NORTHCOTE | X856: 10 | Y856: 6 | Z856: 0 | AA856: 1548 | AB856: 1335 | AC856: 115.95505617977528 | AD856: 40
A857: BRIGHTON | C857: WARBURTON 2 | G857: DOUGLAS 2 | J857: ADAMSON | M857: McINDOE | W857: BRIGHTON | X857: 10 | Y857: 6 | Z857: 0 | AA857: 1781 | AB857: 1586 | AC857: 112.3 | AD857: 40
A859: NORTHCOTE | C859: 3 | D859: 0 | E859: =C859*6+D859 -> 18 | G859: 3 | H859: 3 | I859: =G859*6+H859 -> 21 | K859: 5 | L859: 7 | M859: =K859*6+L859 -> 37 | O859: 9 | P859: 9 | Q859: =O859*6+P859 -> 63 | S859: NORTHCOTE | W859: PRESTON | X859: 9 | Y859: 7 | Z859: 0 | AA859: 1667 | AB859: 1553 | AC859: 107.34063103670316 | AD859: 36
A860: PRESTON | C860: 0 | D860: 1 | E860: =C860*6+D860 -> 1 | G860: 3 | H860: 2 | I860: =G860*6+H860 -> 20 | K860: 3 | L860: 4 | M860: =K860*6+L860 -> 22 | O860: 3 | P860: 6 | Q860: =O860*6+P860 -> 24 | S860: WRIGHT | W860: OAKLEIGH | X860: 9 | Y860: 7 | Z860: 0 | AA860: 1661 | AB860: 1641 | AC860: 101.22 | AD860: 36
A861: BEST PLAYERS | W861: CAMBERWELL | X861: 9 | Y861: 7 | Z861: 0 | AA861: 1596 | AB861: 1607 | AC861: 99.32 | AD861: 36
A862: NORTHCOTE | C862: WALLIS | F862: CASPAR | I862: BAKER | K862: McINTOSH | N862: CRANE | Q862: HINDS | W862: SANDRINGHAM | X862: 6 | Y862: 9 | Z862: 0 | AA862: 1582 | AB862: 1783 | AC862: 88.726864834548508 | AD862: 24
A863: PRESTON | C863: C STEWART | F863: GOLDIN | I863: MEARS | K863: PAWSEY | N863: S STEWART | Q863: BLACKMAN | W863: PRAHRAN | X863: 6 | Y863: 10 | Z863: 0 | AA863: 1623 | AB863: 1833 | AC863: 88.54 | AD863: 24
A864: GOALKICKERS | W864: PORT MELBOURNE | X864: 5 | Y864: 11 | Z864: 0 | AA864: 1590 | AB864: 1817 | AC864: 87.51 | AD864: 20
A865: NORTHCOTE | C865: DUNCAN 2 | F865: GREENWOOD 2 | I865: KNIGHT | K865: McINTOSH | M865: FARRELL | O865: NASH | Q865: PAWSEY | W865: COBURG | X865: 4 | Y865: 11 | Z865: 0 | AA865: 1556 | AB865: 1768 | AC865: 88.01 | AD865: 16
A866: PRESTON | C866: MEARS | F866: C STEWART | J866: FITT | W866: YARRAVILLE | X866: 2 | Y866: 14 | Z866: 0 | AA866: 1401 | AB866: 1896 | AC866: 73.89 | AD866: 8
A868: BRUNSWICK | C868: 3 | D868: 4 | E868: =C868*6+D868 -> 22 | G868: 8 | H868: 6 | I868: =G868*6+H868 -> 54 | K868: 9 | L868: 10 | M868: =K868*6+L868 -> 64 | O868: 11 | P868: 14 | Q868: =O868*6+P868 -> 80 | S868: BRUNSWICK
A869: SANDRINGHAM | C869: 1 | D869: 0 | E869: =C869*6+D869 -> 6 | G869: 4 | H869: 1 | I869: =G869*6+H869 -> 25 | K869: 6 | L869: 2 | M869: =K869*6+L869 -> 38 | O869: 7 | P869: 4 | Q869: =O869*6+P869 -> 46 | S869: EGAN
A870: BEST PLAYERS
A871: BRUNSWICK | C871: WHELAN | F871: PRIESTLEY | I871: BAGGOTT | L871: SILK | N871: NEILSON | Q871: SHAW
A872: SANDRINGHAM | C872: M GRAMBEAU | F872: TOYNE | I872: BRIGHTON | L872: BENCRAFT | N872: HISCOCK | Q872: RIPPON
A873: GOALKICKERS
A874: BRUNSWICK | C874: BAGGOTT 4 | F874: POWELL 3 | I874: SMITH | K874: PRIESTLEY | N874: STANLEY | Q874: RINGROSE
A875: SANDRINGHAM | C875: BENCRAFT 3 | F875: HISCOCK 2 | I875: TOYNE | K875: HOLMES
A877: CAMBERWELL | C877: 1 | D877: 5 | E877: =C877*6+D877 -> 11 | G877: 2 | H877: 6 | I877: =G877*6+H877 -> 18 | K877: 5 | L877: 13 | M877: =K877*6+L877 -> 43 | O877: 7 | P877: 15 | Q877: =O877*6+P877 -> 57 | S877: PORT MELBOURNE
A878: PORT MELBOURNE | C878: 0 | D878: 0 | E878: =C878*6+D878 -> 0 | G878: 4 | H878: 2 | I878: =G878*6+H878 -> 26 | K878: 4 | L878: 3 | M878: =K878*6+L878 -> 27 | O878: 6 | P878: 4 | Q878: =O878*6+P878 -> 40 | S878: BARNES
A879: BEST PLAYERS
A880: CAMBERWELL | C880: G BRADFORD | F880: BOHAN | I880: UNSTEAD | L880: McDONALD | N880: ROCHFORD | Q880: BENNISON
A881: PORT MELBOURNE | C881: FINDLAY | F881: HOUSTON | I881: TUCKER | L881: HALL | N881: BAKER | Q881: BUTCHER
A882: GOALKICKERS
A883: CAMBERWELL | C883: G BRADFORD 2 | F883: McDONALD | I883: JENSEN | K883: BOHAN | M883: BENNISON | P883: COOK
A884: PORT MELBOURNE | C884: FINDLAY 2 | F884: HOUSTON 2 | I884: FLETCHER | K884: HOULIHAN
A886: COBURG | C886: 7 | D886: 8 | E886: =C886*6+D886 -> 50 | G886: 9 | H886: 14 | I886: =G886*6+H886 -> 68 | K886: 16 | L886: 15 | M886: =K886*6+L886 -> 111 | O886: 16 | P886: 16 | Q886: =O886*6+P886 -> 112 | S886: ELSTERNWICK PARK
A887: PRAHRAN | C887: 2 | D887: 2 | E887: =C887*6+D887 -> 14 | G887: 7 | H887: 8 | I887: =G887*6+H887 -> 50 | K887: 10 | L887: 14 | M887: =K887*6+L887 -> 74 | O887: 11 | P887: 24 | Q887: =O887*6+P887 -> 90 | S887: MILLER
A888: BEST PLAYERS
A889: COBURG | C889: FEWKES | F889: H WILKINSON | I889: ROGAN | L889: WILSON | O889: CONDON | Q889: STARBUCK
A890: PRAHRAN | C890: FERGEUS | F890: DYER | I890: DRIVER | L890: McCULLOCH | O890: OPREY | Q890: GARVIN
A891: GOALKICKERS
A892: COBURG | C892: HOLLAND 3 | F892: FEWKES 3 | I892: WILSON 2 | K892: H WILKINSON 2 | N892: ROGAN 2 | P892: EGAN | R892: QUINN | T892: R WILKINSON | X892: CONDON
A893: PRAHRAN | C893: FERGEUS 5 | F893: DYER 3 | H893: McCULLOCH 2 | K893: OPREY
A895: OAKLEIGH | C895: 5 | D895: 3 | E895: =C895*6+D895 -> 33 | G895: 8 | H895: 6 | I895: =G895*6+H895 -> 54 | K895: 9 | L895: 11 | M895: =K895*6+L895 -> 65 | O895: 11 | P895: 19 | Q895: =O895*6+P895 -> 85 | S895: OAKLEIGH
A896: YARRAVILLE | C896: 1 | D896: 2 | E896: =C896*6+D896 -> 8 | G896: 4 | H896: 2 | I896: =G896*6+H896 -> 26 | K896: 6 | L896: 5 | M896: =K896*6+L896 -> 41 | O896: 7 | P896: 6 | Q896: =O896*6+P896 -> 48 | S896: JOHNS
A897: BEST PLAYERS
A898: OAKLEIGH | C898: MUNYARD | F898: NOONAN | I898: SMEATON | L898: POWER | N898: BRISTOWE | Q898: TEMME
A899: YARRAVILLE | C899: GARLICK | F899: SCARFFE | I899: LAW | L899: MILLER | N899: SING | Q899: CAIN
A900: GOALKICKERS
A901: OAKLEIGH | C901: SCOTT 2 | E901: NOONAN 2 | H901: RUNDELL 2 | K901: DOWLING | M901: MUNYARD | O901: R FINN | Q901: BRISTOWE | T901: BAXTER
A902: YARRAVILLE | C902: HARDIMAN 2 | F902: SCARFFE | H902: PHILLIPS | J902: McASEY | L902: CAIN | N902: MILLER
A904: ROUND 17 | D904: 21ST AUGUST | J904: WEATHER | M904: FINE RAIN BEFORE MATCHES | S904: PLAYED AT
D905: 1ST QTR | H905: 2ND QTR | L905: 3RD QTR | P905: FINAL | S905: BRUNSWICK
A906: BRUNSWICK | C906: 3 | D906: 4 | E906: =C906*6+D906 -> 22 | G906: 9 | H906: 11 | I906: =G906*6+H906 -> 65 | K906: 13 | L906: 12 | M906: =K906*6+L906 -> 90 | O906: 18 | P906: 16 | Q906: =O906*6+P906 -> 124 | S906: UMPIRE | X906: LADDER | AB906: ROUND | AD906: 17
A907: NORTHCOTE | C907: 3 | D907: 4 | E907: =C907*6+D907 -> 22 | G907: 4 | H907: 5 | I907: =G907*6+H907 -> 29 | K907: 10 | L907: 10 | M907: =K907*6+L907 -> 70 | O907: 11 | P907: 14 | Q907: =O907*6+P907 -> 80 | S907: BARNES
A908: BEST PLAYERS | W908: TEAM | X908: W | Y908: L | Z908: D | AA908: FOR | AB908: AGST | AC908: % | AD908: PTS
A909: BRUNSWICK | C909: SHAW | E909: BAGGOTT | H909: PRIESTLEY | K909: STANLEY | N909: GEISLER | Q909: GLASSCOTT
A910: NORTHCOTE | C910: CASPAR | E910: HINES | H910: KNIGHT | K910: HISCOX | N910: NASH | Q910: GALLAGHER | W910: BRUNSWICK | X910: 14 | Y910: 3 | Z910: 0 | AA910: 1869 | AB910: 1427 | AC910: 130.97 | AD910: 56
A911: GOALKICKERS | W911: WILLIAMSTOWN | X911: 13 | Y911: 4 | Z911: 0 | AA911: 1791 | AB911: 1360 | AC911: 131.69 | AD911: 52
A912: BRUNSWICK | C912: BAGGOTT 6 | F912: STANLEY 4 | I912: PRIESTLEY 4 | L912: BRADLEY 2 | O912: POWELL 2 | W912: BRIGHTON | X912: 11 | Y912: 6 | Z912: 0 | AA912: 1924 | AB912: 1703 | AC912: 112.98 | AD912: 44
A913: NORTHCOTE | C913: NASH 5 | F913: KEV MURPHY | I913: McINTOSH | K913: DUNCAN | M913: GREENWOOD | P913: PAWSEY | R913: BAKER | W913: NORTHCOTE | X913: 10 | Y913: 7 | Z913: 0 | AA913: 1628 | AB913: 1459 | AC913: 111.5832762165867 | AD913: 40
A915: PRESTON | C915: 0 | D915: 1 | E915: =C915*6+D915 -> 1 | G915: 8 | H915: 5 | I915: =G915*6+H915 -> 53 | K915: 10 | L915: 6 | M915: =K915*6+L915 -> 66 | O915: 14 | P915: 9 | Q915: =O915*6+P915 -> 93 | S915: PRESTON | W915: PRESTON | X915: 10 | Y915: 7 | Z915: 0 | AA915: 1760 | AB915: 1644 | AC915: 107.0559610705596 | AD915: 40
A916: CAMBERWELL | C916: 5 | D916: 4 | E916: =C916*6+D916 -> 34 | G916: 6 | H916: 5 | I916: =G916*6+H916 -> 41 | K916: 13 | L916: 7 | M916: =K916*6+L916 -> 85 | O916: 14 | P916: 7 | Q916: =O916*6+P916 -> 91 | S916: MERRINGTON | W916: OAKLEIGH | X916: 9 | Y916: 8 | Z916: 0 | AA916: 1763 | AB916: 1762 | AC916: 100.06 | AD916: 36
A917: BEST PLAYERS | W917: CAMBERWELL | X917: 9 | Y917: 8 | Z917: 0 | AA917: 1687 | AB917: 1700 | AC917: 99.24 | AD917: 36
A918: PRESTON | C918: BLACKMAN | F918: MEARS | H918: HINDS | K918: NATHAN | N918: POTTER | Q918: GOLDIN | W918: SANDRINGHAM | X918: 6 | Y918: 10 | Z918: 0 | AA918: 1680 | AB918: 1896 | AC918: 88.61 | AD918: 24
A919: CAMBERWELL | C919: STUBBS | F919: JENSEN | H919: KENNEDY | K919: MILLER | N919: McDONALD | Q919: FLETCHER | W919: PRAHRAN | X919: 6 | Y919: 11 | Z919: 0 | AA919: 1718 | AB919: 1986 | AC919: 86.51 | AD919: 24
A920: GOALKICKERS | W920: COBURG | X920: 5 | Y920: 11 | Z920: 0 | AA920: 1677 | AB920: 1870 | AC920: 89.68 | AD920: 20
A921: PRESTON | C921: MEARS 4 | F921: POTTER 4 | I921: NATHAN 3 | L921: GOLDIN 2 | N921: BROWN | W921: PORT MELBOURNE | X921: 5 | Y921: 12 | Z921: 0 | AA921: 1707 | AB921: 1960 | AC921: 87.09 | AD921: 20
A922: CAMBERWELL | C922: STUBBS 3 | E922: BOHAN 2 | G922: G BRADFORD 2 | J922: McIVOR 2 | M922: FURLONG 2 | P922: McDONALD | R922: McCREACHAN | W922: YARRAVILLE | X922: 3 | Y922: 14 | Z922: 0 | AA922: 1554 | AB922: 1991 | AC922: 78.05 | AD922: 12
P923: BENNISON
A924: WILLIAMSTOWN | C924: 4 | D924: 5 | E924: =C924*6+D924 -> 29 | G924: 8 | H924: 7 | I924: =G924*6+H924 -> 55 | K924: 13 | L924: 11 | M924: =K924*6+L924 -> 89 | O924: 16 | P924: 17 | Q924: =O924*6+P924 -> 113 | S924: BEACH ROAD
A925: SANDRINGHAM | C925: 5 | D925: 2 | E925: =C925*6+D925 -> 32 | G925: 7 | H925: 6 | I925: =G925*6+H925 -> 48 | K925: 11 | L925: 11 | M925: =K925*6+L925 -> 77 | O925: 14 | P925: 14 | Q925: =O925*6+P925 -> 98 | S925: MILLER
A926: BEST PLAYERS
A927: WILLIAMSTOWN | C927: MATTHEWS | F927: M McPHERSON | I927: WILCOX | L927: WILLIAMS | O927: TODD | Q927: CHAPMAN
A928: SANDRINGHAM | C928: BENCRAFT | F928: HISCOCK | I928: B HARPER | L928: PATTERSON | O928: WEBB | Q928: RIPPON
A929: GOALKICKERS
A930: WILLIAMSTOWN | C930: WILLIAMS 3 | F930: MATTHEWS 3 | I930: REDMOND 3 | L930: SALVAS 2 | N930: PEACOCK 2 | Q930: M McPHERSON | U930: TODD | W930: WALKER
A931: SANDRINGHAM | C931: HISCOCK 3 | F931: B HARPER 2 | I931: TOYNE 2 | K931: M GRAMBEAU 2 | N931: HOLMES 2 | Q931: CERINI | S931: PATTERSON | W931: BENNETT
A933: YARRAVILLE | C933: 6 | D933: 7 | E933: =C933*6+D933 -> 43 | G933: 10 | H933: 9 | I933: =G933*6+H933 -> 69 | K933: 16 | L933: 12 | M933: =K933*6+L933 -> 108 | O933: 23 | P933: 15 | Q933: =O933*6+P933 -> 153 | S933: YARRAVILLE
A934: PRAHRAN | C934: 4 | D934: 0 | E934: =C934*6+D934 -> 24 | G934: 6 | H934: 0 | I934: =G934*6+H934 -> 36 | K934: 9 | L934: 5 | M934: =K934*6+L934 -> 59 | O934: 14 | P934: 11 | Q934: =O934*6+P934 -> 95 | S934: McGAW
A935: BEST PLAYERS
A936: YARRAVILLE | C936: RUDDELL | F936: LAW | H936: McASEY | K936: FAIRFALL | N936: HARRIS | Q936: SALT
A937: PRAHRAN | C937: WOOD | F937: DYER | H937: OVERS | K937: ROACH | N937: BOURKE | Q937: FERGEUS
A938: GOALKICKERS
A939: YARRAVILLE | C939: PHILLIPS 7 | F939: RUDDELL 3 | I939: MILLER 2 | K939: McASEY 2 | M939: TESTRAIL 2 | P939: SCARFFE 2 | R939: LAW 2 | U939: MORRIS 2 | X939: SING
A940: PRAHRAN | C940: DYER 4 | F940: FERGEUS 4 | I940: McCULLOCH 4 | L940: NORRIS | N940: WOOD
A942: COBURG | C942: 3 | D942: 3 | E942: =C942*6+D942 -> 21 | G942: 10 | H942: 14 | I942: =G942*6+H942 -> 74 | K942: 11 | L942: 15 | M942: =K942*6+L942 -> 81 | O942: 17 | P942: 19 | Q942: =O942*6+P942 -> 121 | S942: COBURG
A943: OAKLEIGH | C943: 4 | D943: 4 | E943: =C943*6+D943 -> 28 | G943: 5 | H943: 13 | I943: =G943*6+H943 -> 43 | K943: 9 | L943: 21 | M943: =K943*6+L943 -> 75 | O943: 13 | P943: 24 | Q943: =O943*6+P943 -> 102 | S943: JONES
A944: BEST PLAYERS
A945: COBURG | C945: SMITH | F945: QUINN | I945: ROGAN | K945: WILSON | N945: CONDON | Q945: STARBUCK
A946: OAKLEIGH | C946: RUNDELL | F946: PERKINS | I946: WENN | K946: NOONAN | N946: BAXTER | Q946: BRISTOWE
A947: GOALKICKERS
A948: COBURG | C948: WILSON 5 | F948: CONDON 4 | I948: ROGAN 3 | K948: QUINN 2 | M948: FEWKES 2 | O948: McILVEEN
A949: OAKLEIGH | C949: WENN 3 | E949: RUNDELL 3 | H949: BRISTOWE 3 | K949: NOONAN 2 | N949: GRAY | P949: SMEATON
A951: BRIGHTON | C951: 6 | D951: 1 | E951: =C951*6+D951 -> 37 | G951: 10 | H951: 5 | I951: =G951*6+H951 -> 65 | K951: 16 | L951: 7 | M951: =K951*6+L951 -> 103 | O951: 22 | P951: 11 | Q951: =O951*6+P951 -> 143 | S951: ELSTERNWICK PARK
A952: PORT MELBOURNE | C952: 2 | D952: 3 | E952: =C952*6+D952 -> 15 | G952: 4 | H952: 4 | I952: =G952*6+H952 -> 28 | K952: 11 | L952: 8 | M952: =K952*6+L952 -> 74 | O952: 17 | P952: 15 | Q952: =O952*6+P952 -> 117 | S952: WRIGHT
A953: BEST PLAYERS
A954: BRIGHTON | C954: WARBURTON | F954: DOUGLAS | I954: STRETTON | L954: McINDOE | O954: PINDER | R954: WILLIAMSON
A955: PORT MELBOURNE | C955: HOUSTON | F955: BUTCHER | I955: MILLER | L955: TRAINER | O955: REYNOLDS | R955: W MURRAY
A956: GOALKICKERS
A957: BRIGHTON | C957: WARBURTON 8 | F957: McINDOE 4 | I957: DOUGLAS 3 | L957: PINDER 3 | N957: ADAMSON 2 | Q957: HEIMS | S957: BURKE
A958: PORT MELBOURNE | C958: HOUSTON 8 | F958: TREMBATH 3 | I958: TRAINER 3 | L958: FINDLAY | N958: WOODBRIDGE | Q958: LEWIS
A960: ROUND 18 | D960: 28TH AUGUST | H960: WEATHER | K960: FINE SUNNY LIGHT NORTH BREEZE | S960: PLAYED AT
D961: 1ST QTR | H961: 2ND QTR | L961: 3RD QTR | P961: FINAL | S961: WILLIAMSTOWN
A962: WILLIAMSTOWN | C962: 2 | D962: 5 | E962: =C962*6+D962 -> 17 | G962: 6 | H962: 9 | I962: =G962*6+H962 -> 45 | K962: 13 | L962: 12 | M962: =K962*6+L962 -> 90 | O962: 16 | P962: 14 | Q962: =O962*6+P962 -> 110 | S962: UMPIRE | X962: LADDER | AB962: ROUND | AD962: 18
A963: NORTHCOTE | C963: 2 | D963: 2 | E963: =C963*6+D963 -> 14 | G963: 4 | H963: 3 | I963: =G963*6+H963 -> 27 | K963: 5 | L963: 4 | M963: =K963*6+L963 -> 34 | O963: 7 | P963: 5 | Q963: =O963*6+P963 -> 47 | S963: WRIGHT
A964: BEST PLAYERS | W964: TEAM | X964: W | Y964: L | Z964: D | AA964: FOR | AB964: AGST | AC964: % | AD964: PTS
A965: WILLIAMSTOWN | C965: MATHEWS | F965: DANCKERT | I965: M McPHERSON | L965: WILLIAMS | O965: TODD | Q965: McRAE
A966: NORTHCOTE | C966: HISCOX | F966: PAWSEY | I966: HINES | L966: WHITE | O966: NASH | Q966: O'DONOGHUE | W966: BRUNSWICK | X966: 15 | Y966: 3 | Z966: 0 | AA966: 1984 | AB966: 1533 | AC966: 129.42 | AD966: 60
A967: GOALKICKERS | R967: WALKER | W967: WILLIAMSTOWN | X967: 14 | Y967: 4 | Z967: 0 | AA967: 1901 | AB967: 1407 | AC967: 135.11 | AD967: 56
A968: WILLIAMSTOWN | C968: TODD 4 | E968: M McPHERSON 3 | I968: WILLIAMS 2 | L968: MATTHEWS 2 | O968: REDMOND 2 | R968: SALVAS 2 | W968: BRIGHTON | X968: 11 | Y968: 7 | Z968: 0 | AA968: 2054 | AB968: 1841 | AC968: 111.57 | AD968: 44
A969: NORTHCOTE | C969: WHITE 2 | E969: PAWSEY 2 | H969: KEV MURPHY 2 | K969: NASH | W969: PRESTON | X969: 11 | Y969: 7 | Z969: 0 | AA969: 1897 | AB969: 1760 | AC969: 107.78409090909091 | AD969: 44
A971: SANDRINGHAM | C971: 4 | D971: 2 | E971: =C971*6+D971 -> 26 | G971: 10 | H971: 8 | I971: =G971*6+H971 -> 68 | K971: 15 | L971: 13 | M971: =K971*6+L971 -> 103 | O971: 20 | P971: 18 | Q971: =O971*6+P971 -> 138 | S971: BEACH ROAD | W971: NORTHCOTE | X971: 10 | Y971: 8 | Z971: 0 | AA971: 1675 | AB971: 1569 | AC971: 106.75589547482473 | AD971: 40
A972: BRIGHTON | C972: 7 | D972: 7 | E972: =C972*6+D972 -> 49 | G972: 9 | H972: 12 | I972: =G972*6+H972 -> 66 | K972: 14 | L972: 19 | M972: =K972*6+L972 -> 103 | O972: 18 | P972: 22 | Q972: =O972*6+P972 -> 130 | S972: JOHNS | W972: OAKLEIGH | X972: 10 | Y972: 8 | Z972: 0 | AA972: 1933 | AB972: 1840 | AC972: 105.05 | AD972: 40
A973: BEST PLAYERS | W973: CAMBERWELL | X973: 10 | Y973: 8 | Z973: 0 | AA973: 1807 | AB973: 1798 | AC973: 100.5 | AD973: 40
A974: SANDRINGHAM | C974: BENCRAFT | F974: PATTERSON | I974: HISCOCK | K974: RUSSELL | N974: M GRAMBEAU | Q974: TOYNE | W974: SANDRINGHAM | X974: 7 | Y974: 10 | Z974: 0 | AA974: 1818 | AB974: 2026 | AC974: 89.73 | AD974: 28
A975: BRIGHTON | C975: STRETTON | F975: PINDER | I975: DOUGLAS | K975: WARRBURTON | N975: ADAMSON | Q975: McINDOE | W975: PRAHRAN | X975: 6 | Y975: 12 | Z975: 0 | AA975: 1824 | AB975: 2101 | AC975: 86.15 | AD975: 24
A976: GOALKICKERS | W976: COBURG | X976: 5 | Y976: 12 | Z976: 0 | AA976: 1793 | AB976: 2007 | AC976: 89.34 | AD976: 20
A977: SANDRINGHAM | C977: BENCRAFT 8 | F977: HISCOCK 5 | I977: M GRAMBEAU 2 | L977: HOLMES 2 | N977: R GRAMBEAU | Q977: B HARPER | T977: SLEIGH | W977: PORT MELBOURNE | X977: 5 | Y977: 13 | Z977: 0 | AA977: 1785 | AB977: 2130 | AC977: 83.8 | AD977: 20
A978: BRIGHTON | C978: WARBURTON 6 | F978: DOUGLAS 4 | I978: McINDOE 3 | L978: HEIMS 2 | N978: ADAMSON | Q978: PINDER | S978: STRETTON | W978: YARRAVILLE | X978: 3 | Y978: 15 | Z978: 0 | AA978: 1652 | AB978: 2111 | AC978: 78.26 | AD978: 12
A980: BRUNSWICK | C980: 2 | D980: 4 | E980: =C980*6+D980 -> 16 | G980: 7 | H980: 14 | I980: =G980*6+H980 -> 56 | K980: 10 | L980: 15 | M980: =K980*6+L980 -> 75 | O980: 16 | P980: 19 | Q980: =O980*6+P980 -> 115 | S980: ELSTERNWICK PARK
A981: PRAHRAN | C981: 3 | D981: 7 | E981: =C981*6+D981 -> 25 | G981: 6 | H981: 9 | I981: =G981*6+H981 -> 45 | K981: 13 | L981: 12 | M981: =K981*6+L981 -> 90 | O981: 15 | P981: 16 | Q981: =O981*6+P981 -> 106 | S981: McGAW
A982: BEST PLAYERS
A983: BRUNSWICK | C983: BRADLEY | F983: GLASSCOTT | I983: McLEOD | L983: PRIESTLEY | O983: SHAW | Q983: HENRYS
A984: PRAHRAN | C984: GARVIN | F984: McCULLOCH | I984: BOURKE | L984: DYER | O984: WOOD | Q984: FERGEUS
A985: GOALKICKERS
A986: BRUNSWICK | C986: PRIESTLEY 3 | F986: HENRYS 3 | I986: STANLEY 3 | L986: SHAW 2 | N986: BRADLEY 2 | Q986: SPENCER | S986: RINGROSE | V986: POWELL
A987: PRAHRAN | C987: McCULLOCH 5 | F987: WOOD 3 | I987: GARVIN 2 | L987: OPREY 2 | N987: FERGEUS | Q987: DYER | S987: MASTERTON
A989: PRESTON | C989: 7 | D989: 3 | E989: =C989*6+D989 -> 45 | G989: 13 | H989: 4 | I989: =G989*6+H989 -> 82 | K989: 20 | L989: 9 | M989: =K989*6+L989 -> 129 | O989: 21 | P989: 11 | Q989: =O989*6+P989 -> 137 | S989: COBURG
A990: COBURG | C990: 2 | D990: 1 | E990: =C990*6+D990 -> 13 | G990: 5 | H990: 4 | I990: =G990*6+H990 -> 34 | K990: 10 | L990: 5 | M990: =K990*6+L990 -> 65 | O990: 18 | P990: 8 | Q990: =O990*6+P990 -> 116 | S990: BARNES
A991: BEST PLAYERS
A992: PRESTON | C992: MEARS | F992: BLACKMAN | I992: GOLDIN | K992: DAVIES | N992: LARDI | Q992: POTTER
A993: COBURG | C993: GILBERT | F993: ROGAN | I993: WALSH | K993: CONDON | N993: QUINN | Q993: WILKINSON
A994: GOALKICKERS
A995: PRESTON | C995: POTTER 7 | F995: GOLDIN 5 | I995: MEARS 3 | K995: LARDI 3 | M995: BROWN 2 | O995: NATHAN
A996: COBURG | C996: ROGAN 5 | F996: QUINN 4 | I996: CONDON 4 | K996: WALSH 2 | M996: FEWKES | O996: BARTLETT | Q996: STARBUCK
A998: OAKLEIGH | C998: 8 | D998: 7 | E998: =C998*6+D998 -> 55 | G998: 13 | H998: 11 | I998: =G998*6+H998 -> 89 | K998: 16 | L998: 20 | M998: =K998*6+L998 -> 116 | O998: 24 | P998: 26 | Q998: =O998*6+P998 -> 170 | S998: PORT MELBOURNE
A999: PORT MELBOURNE | C999: 0 | D999: 4 | E999: =C999*6+D999 -> 4 | G999: 5 | H999: 6 | I999: =G999*6+H999 -> 36 | K999: 9 | L999: 8 | M999: =K999*6+L999 -> 62 | O999: 11 | P999: 12 | Q999: =O999*6+P999 -> 78 | S999: MERRINGTON
A1000: BEST PLAYERS
A1001: OAKLEIGH | C1001: WENN | F1001: R FINN | I1001: RUNDELL | L1001: E RYAN | O1001: TEMME | Q1001: SMEATON
A1002: PORT MELBOURNE | C1002: BUTCHER | F1002: HOUSTON | I1002: SEXTON | L1002: TRAINER | O1002: BAKER | Q1002: BOWER
A1003: GOALKICKERS
A1004: OAKLEIGH | C1004: WENN 6 | E1004: SMEATON 4 | H1004: R FINN 4 | J1004: RUNDELL 4 | M1004: WILLIAMS 2 | P1004: JORY | Q1004: DANIELS | S1004: BRISTOWE | V1004: BELL
A1005: PORT MELBOURNE | C1005: HOUSTON 5 | F1005: BOWER 2 | I1005: TRAINER 2 | L1005: LEWIS | N1005: MURRAY
A1007: CAMBERWELL | C1007: 2 | D1007: 5 | E1007: =C1007*6+D1007 -> 17 | G1007: 6 | H1007: 8 | I1007: =G1007*6+H1007 -> 44 | K1007: 13 | L1007: 9 | M1007: =K1007*6+L1007 -> 87 | O1007: 17 | P1007: 18 | Q1007: =O1007*6+P1007 -> 120 | S1007: CAMBERWELL
A1008: YARRAVILLE | C1008: 7 | D1008: 4 | E1008: =C1008*6+D1008 -> 46 | G1008: 9 | H1008: 6 | I1008: =G1008*6+H1008 -> 60 | K1008: 14 | L1008: 11 | M1008: =K1008*6+L1008 -> 95 | O1008: 14 | P1008: 14 | Q1008: =O1008*6+P1008 -> 98 | S1008: MILLER
A1009: BEST PLAYERS
A1010: CAMBERWELL | C1010: FLETCHER | F1010: MILLER | I1010: STUBBS | L1010: JENSEN | N1010: McIVOR | Q1010: ROCHFORD
A1011: YARRAVILLE | C1011: GARLICK | F1011: PHILLIPS | I1011: HARRIS | L1011: MILLER | N1011: SCARFFE | Q1011: RUDDELL
A1012: GOALKICKERS
A1013: CAMBERWELL | C1013: McIVOR 6 | F1013: McDONALD 5 | I1013: BENBOW 2 | L1013: McCREACHAN 2 | O1013: JENSEN | Q1013: STUBBS
A1014: YARRAVILLE | C1014: PHILLIPS 6 | F1014: SING 2 | H1014: HARRIS 2 | J1014: RUDDELL | L1014: TESTRAIL | N1014: SCARFFE | P1014: MORRIS
A1016: ROUND 19 | D1016: 4TH SEPTEMBER | J1016: WEATHER | M1016: DULL LIGHT RAIN BEFORE START | S1016: PLAYED AT
D1017: 1ST QTR | H1017: 2ND QTR | L1017: 3RD QTR | P1017: FINAL | S1017: CAMBERWELL
A1018: BRIGHTON | C1018: 5 | D1018: 3 | E1018: =C1018*6+D1018 -> 33 | G1018: 10 | H1018: 11 | I1018: =G1018*6+H1018 -> 71 | K1018: 12 | L1018: 13 | M1018: =K1018*6+L1018 -> 85 | O1018: 15 | P1018: 18 | Q1018: =O1018*6+P1018 -> 108 | S1018: UMPIRE | X1018: LADDER | AB1018: ROUND | AD1018: 19
A1019: CAMBERWELL | C1019: 10 | D1019: 3 | E1019: =C1019*6+D1019 -> 63 | G1019: 12 | H1019: 3 | I1019: =G1019*6+H1019 -> 75 | K1019: 15 | L1019: 6 | M1019: =K1019*6+L1019 -> 96 | O1019: 15 | P1019: 8 | Q1019: =O1019*6+P1019 -> 98 | S1019: MERRINGTON
A1020: BEST PLAYERS | W1020: TEAM | X1020: W | Y1020: L | Z1020: D | AA1020: FOR | AB1020: AGST | AC1020: % | AD1020: PTS
A1021: BRIGHTON | C1021: E TURNER | F1021: PICKERING | I1021: RIPPON | L1021: BURKE | O1021: HEIMS | Q1021: WARBURTON
A1022: CAMBERWELL | C1022: STUBBS | F1022: McIVOR | I1022: McDONALD | L1022: HERBERT | O1022: STYLES | Q1022: KENNEDY | W1022: BRUNSWICK | X1022: 16 | Y1022: 3 | Z1022: 0 | AA1022: 2157 | AB1022: 1624 | AC1022: 132.82 | AD1022: 64
A1023: GOALKICKERS | W1023: WILLIAMSTOWN | X1023: 15 | Y1023: 4 | Z1023: 0 | AA1023: 1988 | AB1023: 1490 | AC1023: 133.42 | AD1023: 60
A1024: BRIGHTON | C1024: WARBURTON 4 | F1024: BURKE 4 | I1024: McINDOE 3 | L1024: DOUGLAS 2 | O1024: HEIMS | Q1024: ADAMSON | W1024: BRIGHTON | X1024: 12 | Y1024: 7 | Z1024: 0 | AA1024: 2162 | AB1024: 1939 | AC1024: 111.5 | AD1024: 48
A1025: CAMBERWELL | C1025: McDONALD 5 | F1025: McIVOR 3 | I1025: BERBETA 2 | L1025: COOK 2 | N1025: JENSEN | P1025: BENBOW | R1025: STUBBS | W1025: PRESTON | X1025: 12 | Y1025: 7 | Z1025: 0 | AA1025: 2040 | AB1025: 1864 | AC1025: 109.44206008583691 | AD1025: 48
A1027: OAKLEIGH | C1027: 6 | D1027: 9 | E1027: =C1027*6+D1027 -> 45 | G1027: 11 | H1027: 15 | I1027: =G1027*6+H1027 -> 81 | K1027: 15 | L1027: 20 | M1027: =K1027*6+L1027 -> 110 | O1027: 20 | P1027: 26 | Q1027: =O1027*6+P1027 -> 146 | S1027: OAKLEIGH | W1027: OAKLEIGH | X1027: 11 | Y1027: 8 | Z1027: 0 | AA1027: 2079 | AB1027: 1911 | AC1027: 108.79 | AD1027: 44
A1028: SANDRINGHAM | C1028: 2 | D1028: 2 | E1028: =C1028*6+D1028 -> 14 | G1028: 4 | H1028: 6 | I1028: =G1028*6+H1028 -> 30 | K1028: 7 | L1028: 9 | M1028: =K1028*6+L1028 -> 51 | O1028: 10 | P1028: 11 | Q1028: =O1028*6+P1028 -> 71 | S1028: WRIGHT | W1028: NORTHCOTE | X1028: 11 | Y1028: 8 | Z1028: 0 | AA1028: 1785 | AB1028: 1646 | AC1028: 108.44471445929526 | AD1028: 44
A1029: BEST PLAYERS | W1029: CAMBERWELL | X1029: 10 | Y1029: 9 | Z1029: 0 | AA1029: 1905 | AB1029: 1906 | AC1029: 99.95 | AD1029: 40
A1030: OAKLEIGH | C1030: R FINN | F1030: E RYAN | I1030: WENN | K1030: BAXTER | N1030: PERKINS | Q1030: WEISS | W1030: SANDRINGHAM | X1030: 7 | Y1030: 11 | Z1030: 0 | AA1030: 1889 | AB1030: 2172 | AC1030: 86.97 | AD1030: 28
A1031: SANDRINGHAM | C1031: B HARPER | F1031: PATTERSON | I1031: HISCOCK | K1031: BENCRAFT | N1031: DEMPSTER | Q1031: SLEIGH | W1031: PRAHRAN | X1031: 6 | Y1031: 13 | Z1031: 0 | AA1031: 1907 | AB1031: 2188 | AC1031: 87.16 | AD1031: 24
A1032: GOALKICKERS | W1032: COBURG | X1032: 5 | Y1032: 13 | Z1032: 0 | AA1032: 1870 | AB1032: 2117 | AC1032: 88.33 | AD1032: 20
A1033: OAKLEIGH | C1033: SMEATON 5 | F1033: WENN 5 | I1033: R FINN 5 | K1033: BRISTOWE 3 | N1033: RUNDELL | P1033: JORY | W1033: PORT MELBOURNE | X1033: 5 | Y1033: 14 | Z1033: 0 | AA1033: 1889 | AB1033: 2273 | AC1033: 83.11 | AD1033: 20
A1034: SANDRINGHAM | C1034: HISCOCK 3 | F1034: B HARPER 2 | I1034: HOLMES | K1034: BENNETT | M1034: REID | N1034: CLARKE | P1034: M GRAMBEAU | W1034: YARRAVILLE | X1034: 3 | Y1034: 16 | Z1034: 0 | AA1034: 1743 | AB1034: 2284 | AC1034: 76.31 | AD1034: 12
A1036: NORTHCOTE | C1036: 3 | D1036: 2 | E1036: =C1036*6+D1036 -> 20 | G1036: 7 | H1036: 8 | I1036: =G1036*6+H1036 -> 50 | K1036: 12 | L1036: 10 | M1036: =K1036*6+L1036 -> 82 | O1036: 16 | P1036: 14 | Q1036: =O1036*6+P1036 -> 110 | S1036: NORTHCOTE
A1037: COBURG | C1037: 7 | D1037: 1 | E1037: =C1037*6+D1037 -> 43 | G1037: 8 | H1037: 2 | I1037: =G1037*6+H1037 -> 50 | K1037: 11 | L1037: 4 | M1037: =K1037*6+L1037 -> 70 | O1037: 12 | P1037: 5 | Q1037: =O1037*6+P1037 -> 77 | S1037: JOHNS
A1038: BEST PLAYERS
A1039: NORTHCOTE | C1039: PAWSEY | F1039: KNIGHT | I1039: KEN MURPHY | L1039: McINTOSH | O1039: HISCOX | Q1039: O'DONOHUE
A1040: COBURG | C1040: GILBERT | F1040: ROGAN | I1040: STARBUCK | L1040: WALSH | O1040: JAMES | Q1040: BUCKLEY
A1041: GOALKICKERS
A1042: NORTHCOTE | C1042: PAWSEY 5 | F1042: KEN MURPHY 3 | I1042: McINTOSH 2 | L1042: DUNCAN 2 | N1042: NASH 2 | P1042: KNIGHT | R1042: BAKER
A1043: COBURG | C1043: ROGAN 4 | F1043: JAMES 4 | I1043: CONDON | K1043: WALSH | M1043: QUINN | O1043: FEWKES
A1045: PRESTON | C1045: 7 | D1045: 7 | E1045: =C1045*6+D1045 -> 49 | G1045: 10 | H1045: 11 | I1045: =G1045*6+H1045 -> 71 | K1045: 19 | L1045: 14 | M1045: =K1045*6+L1045 -> 128 | O1045: 21 | P1045: 17 | Q1045: =O1045*6+P1045 -> 143 | S1045: PRESTON
A1046: PORT MELBOURNE | C1046: 1 | D1046: 1 | E1046: =C1046*6+D1046 -> 7 | G1046: 8 | H1046: 8 | I1046: =G1046*6+H1046 -> 56 | K1046: 10 | L1046: 12 | M1046: =K1046*6+L1046 -> 72 | O1046: 15 | P1046: 14 | Q1046: =O1046*6+P1046 -> 104 | S1046: MILLER
A1047: BEST PLAYERS
A1048: PRESTON | C1048: BLACKMAN | F1048: POTTER | I1048: MEARS | L1048: GOLDIN | O1048: LEHMANN | R1048: HINDS
A1049: PORT MELBOURNE | C1049: HOUSTON | F1049: HOULIHAN | I1049: BUTCHER | L1049: RICHARDSON | O1049: TRAINER | R1049: LEWIS
A1050: GOALKICKERS
A1051: PRESTON | C1051: POTTER 6 | E1051: GOLDIN 3 | G1051: MEARS 3 | I1051: NATHAN 3 | L1051: BROWN 2 | N1051: C STEWART | Q1051: S STEWART | T1051: CUGLEY | V1051: FITT
A1052: PORT MELBOURNE | C1052: RICHARDSON 4 | F1052: FLETCHER 3 | I1052: TRAINER 3 | L1052: HOUSTON 2 | O1052: HOULIHAN 2 | R1052: EGAN
A1054: WILLIAMSTOWN | C1054: 3 | D1054: 8 | E1054: =C1054*6+D1054 -> 26 | G1054: 4 | H1054: 12 | I1054: =G1054*6+H1054 -> 36 | K1054: 9 | L1054: 23 | M1054: =K1054*6+L1054 -> 77 | O1054: 10 | P1054: 27 | Q1054: =O1054*6+P1054 -> 87 | S1054: ELSTERNWICK PARK
A1055: PRAHRAN | C1055: 1 | D1055: 3 | E1055: =C1055*6+D1055 -> 9 | G1055: 4 | H1055: 10 | I1055: =G1055*6+H1055 -> 34 | K1055: 5 | L1055: 10 | M1055: =K1055*6+L1055 -> 40 | O1055: 12 | P1055: 11 | Q1055: =O1055*6+P1055 -> 83 | S1055: BARNES
A1056: BEST PLAYERS
A1057: WILLIAMSTOWN | C1057: McRAE | E1057: CAMERON | H1057: FEATHERBY | K1057: MATTHEWS | N1057: M McPHERSON | R1057: PEACOCK
A1058: PRAHRAN | C1058: FERGEUS | E1058: O'NEILL | H1058: BOURKE | K1058: McCULLOCH | N1058: YATES | R1058: MORROW
A1059: GOALKICKERS
A1060: WILLIAMSTOWN | C1060: TODD 2 | E1060: MATTHEWS 2 | H1060: SALVAS | J1060: McRAE | L1060: FEATHERBY | N1060: M McPHERSON | Q1060: PEACOCK | S1060: WALKER
A1061: PRAHRAN | C1061: McCULLOCH 5 | F1061: DYER 2 | H1061: MASTERTON 2 | K1061: FERGEUS 2 | N1061: WOOD
A1063: BRUNSWICK | C1063: 5 | D1063: 2 | E1063: =C1063*6+D1063 -> 32 | G1063: 10 | H1063: 9 | I1063: =G1063*6+H1063 -> 69 | K1063: 16 | L1063: 13 | M1063: =K1063*6+L1063 -> 109 | O1063: 25 | P1063: 23 | Q1063: =O1063*6+P1063 -> 173 | S1063: BRUNSWICK
A1064: YARRAVILLE | C1064: 6 | D1064: 2 | E1064: =C1064*6+D1064 -> 38 | G1064: 10 | H1064: 2 | I1064: =G1064*6+H1064 -> 62 | K1064: 12 | L1064: 6 | M1064: =K1064*6+L1064 -> 78 | O1064: 14 | P1064: 7 | Q1064: =O1064*6+P1064 -> 91 | S1064: EGAN
A1065: BEST PLAYERS
A1066: BRUNSWICK | C1066: RINGROSE | F1066: SHAW | I1066: BAGGOTT | L1066: McLEOD | O1066: GLASSCOTT | S1066: HENRYS
A1067: YARRAVILLE | C1067: RUDDELL | F1067: HARRIS | I1067: HARDIMAN | L1067: SALT | O1067: SCARFFE | S1067: MILLER
A1068: GOALKICKERS
A1069: BRUNSWICK | C1069: RINGROSE 6 | F1069: BAGGOTT 5 | I1069: PRIESTLEY 4 | L1069: POWELL 3 | N1069: BRADLEY 2 | Q1069: HENRYS 2 | T1069: HALL | V1069: KYNE | X1069: DENMEAD
A1070: YARRAVILLE | C1070: PHILLIPS 5 | F1070: HARRIS 4 | I1070: SING 2 | K1070: MILLER | M1070: McASEY | O1070: HARDIMAN
A1072: ROUND 20 | D1072: 11TH SEPTEMBER | J1072: WEATHER | M1072: NORTH BREEZE MILD CLOUDY | S1072: PLAYED AT
D1073: 1ST QTR | H1073: 2ND QTR | L1073: 3RD QTR | P1073: FINAL | S1073: BRUNSWICK
A1074: OAKLEIGH | C1074: 4 | D1074: 4 | E1074: =C1074*6+D1074 -> 28 | G1074: 10 | H1074: 8 | I1074: =G1074*6+H1074 -> 68 | K1074: 11 | L1074: 13 | M1074: =K1074*6+L1074 -> 79 | O1074: 12 | P1074: 16 | Q1074: =O1074*6+P1074 -> 88 | S1074: UMPIRE | X1074: LADDER | AB1074: ROUND | AD1074: 20
A1075: BRUNSWICK | C1075: 4 | D1075: 3 | E1075: =C1075*6+D1075 -> 27 | G1075: 4 | H1075: 5 | I1075: =G1075*6+H1075 -> 29 | K1075: 5 | L1075: 7 | M1075: =K1075*6+L1075 -> 37 | O1075: 8 | P1075: 13 | Q1075: =O1075*6+P1075 -> 61 | S1075: MERRINGTON
A1076: BEST PLAYERS | W1076: TEAM | X1076: W | Y1076: L | Z1076: D | AA1076: FOR | AB1076: AGST | AC1076: % | AD1076: PTS
A1077: OAKLEIGH | C1077: DEAYTON | F1077: BAXTER | I1077: BRISTOWE | L1077: BEARD | N1077: WILLIAMS | Q1077: E RYAN
A1078: BRUNSWICK | C1078: GEISLER | F1078: PRIESTLEY | I1078: SILK | L1078: HALL | N1078: BAGGOTT | Q1078: McLEOD | W1078: WILLIAMSTOWN | X1078: 16 | Y1078: 4 | Z1078: 0 | AA1078: 2133 | AB1078: 1543 | AC1078: 138.24 | AD1078: 64
A1079: GOALKICKERS | W1079: BRUNSWICK | X1079: 16 | Y1079: 4 | Z1079: 0 | AA1079: 2218 | AB1079: 1712 | AC1079: 129.56 | AD1079: 64
A1080: OAKLEIGH | C1080: BRISTOWE 4 | F1080: R FINN 2 | I1080: WENN 2 | K1080: DONNELLY | M1080: WILLIAMS | O1080: PERKINS | Q1080: SMEATON | W1080: BRIGHTON | X1080: 13 | Y1080: 7 | Z1080: 0 | AA1080: 2313 | AB1080: 2037 | AC1080: 113.55 | AD1080: 52
A1081: BRUNSWICK | C1081: PRIESTLEY 2 | F1081: BAGGOTT 2 | I1081: POWELL 2 | K1081: McLEOD | M1081: BRADLEY | W1081: NORTHCOTE | X1081: 12 | Y1081: 8 | Z1081: 0 | AA1081: 1925 | AB1081: 1724 | AC1081: 111.66 | AD1081: 48
A1083: WILLIAMSTOWN | C1083: 3 | D1083: 0 | E1083: =C1083*6+D1083 -> 18 | G1083: 9 | H1083: 5 | I1083: =G1083*6+H1083 -> 59 | K1083: 11 | L1083: 12 | M1083: =K1083*6+L1083 -> 78 | O1083: 21 | P1083: 19 | Q1083: =O1083*6+P1083 -> 145 | S1083: WILLIAMSTOWN | W1083: OAKLEIGH | X1083: 12 | Y1083: 8 | Z1083: 0 | AA1083: 2167 | AB1083: 1972 | AC1083: 109.89 | AD1083: 48
A1084: CAMBERWELL | C1084: 4 | D1084: 6 | E1084: =C1084*6+D1084 -> 30 | G1084: 6 | H1084: 6 | I1084: =G1084*6+H1084 -> 42 | K1084: 7 | L1084: 7 | M1084: =K1084*6+L1084 -> 49 | O1084: 7 | P1084: 11 | Q1084: =O1084*6+P1084 -> 53 | S1084: MOORE | W1084: PRESTON | X1084: 12 | Y1084: 8 | Z1084: 0 | AA1084: 2146 | AB1084: 1971 | AC1084: 108.87874175545409 | AD1084: 48
A1085: BEST PLAYERS | W1085: CAMBERWELL | X1085: 10 | Y1085: 10 | Z1085: 0 | AA1085: 1958 | AB1085: 2051 | AC1085: 95.47 | AD1085: 40
A1086: WILLIAMSTOWN | C1086: M McPHERSON | G1086: TODD | I1086: MATTHEWS | L1086: CAMERON | N1086: RYAN | Q1086: WALKER | W1086: SANDRINGHAM | X1086: 7 | Y1086: 12 | Z1086: 0 | AA1086: 1977 | AB1086: 2314 | AC1086: 85.44 | AD1086: 28
A1087: CAMBERWELL | C1087: BOHAN | G1087: McIVOR | I1087: COOK | L1087: JENSEN | N1087: McDONALD | Q1087: STUBBS | W1087: COBURG | X1087: 6 | Y1087: 13 | Z1087: 0 | AA1087: 2012 | AB1087: 2205 | AC1087: 91.25 | AD1087: 24
A1088: GOALKICKERS | W1088: PRAHRAN | X1088: 6 | Y1088: 14 | Z1088: 0 | AA1088: 2005 | AB1088: 2339 | AC1088: 85.72 | AD1088: 24
A1089: WILLIAMSTOWN | C1089: M McPHERSON 6 | F1089: MATTHEWS 5 | I1089: McRAE 3 | K1089: TODD 3 | M1089: WALKER 2 | P1089: RYAN | R1089: WILLIAMS | W1089: PORT MELBOURNE | X1089: 5 | Y1089: 15 | Z1089: 0 | AA1089: 1967 | AB1089: 2413 | AC1089: 81.52 | AD1089: 20
A1090: CAMBERWELL | C1090: BOHAN 3 | F1090: JENSEN | H1090: HERBERT | J1090: McDONALD | M1090: McIVOR | W1090: YARRAVILLE | X1090: 4 | Y1090: 16 | Z1090: 0 | AA1090: 1850 | AB1090: 2390 | AC1090: 77.41 | AD1090: 16
A1092: BRIGHTON | C1092: 3 | D1092: 6 | E1092: =C1092*6+D1092 -> 24 | G1092: 10 | H1092: 12 | I1092: =G1092*6+H1092 -> 72 | K1092: 11 | L1092: 18 | M1092: =K1092*6+L1092 -> 84 | O1092: 21 | P1092: 25 | Q1092: =O1092*6+P1092 -> 151 | S1092: ELSTERNWICK PARK
A1093: PRAHRAN | C1093: 6 | D1093: 4 | E1093: =C1093*6+D1093 -> 40 | G1093: 7 | H1093: 10 | I1093: =G1093*6+H1093 -> 52 | K1093: 11 | L1093: 12 | M1093: =K1093*6+L1093 -> 78 | O1093: 14 | P1093: 14 | Q1093: =O1093*6+P1093 -> 98 | S1093: WRIGHT
A1094: BEST PLAYERS
A1095: BRIGHTON | C1095: McINDOE | F1095: WARBURTON | I1095: McASEY | L1095: WILLIAMSON | O1095: STRETTON | R1095: E TURNER
A1096: PRAHRAN | C1096: DYER | F1096: MORROW | I1096: FERGEUS | L1096: GARVIN | O1096: ROACH | R1096: O'NEILL
A1097: GOALKICKERS
A1098: BRIGHTON | C1098: McINDOE 7 | F1098: WARBURTON 3 | J1098: DOUGLAS 3 | M1098: ADAMSON 2 | P1098: PLUNKETT 2 | S1098: STRETTON | V1098: PINDER | X1098: BURKE | Z1098: COMBER
A1099: PRAHRAN | C1099: DYER 6 | F1099: FERGEUS 3 | I1099: P WALSH | K1099: GARVIN | M1099: MASTERTON | P1099: OPREY | R1099: McCULLOCH
A1101: COBURG | C1101: 6 | D1101: 6 | E1101: =C1101*6+D1101 -> 42 | G1101: 9 | H1101: 9 | I1101: =G1101*6+H1101 -> 63 | K1101: 15 | L1101: 17 | M1101: =K1101*6+L1101 -> 107 | O1101: 20 | P1101: 22 | Q1101: =O1101*6+P1101 -> 142 | S1101: COBURG
A1102: SANDRINGHAM | C1102: 1 | D1102: 2 | E1102: =C1102*6+D1102 -> 8 | G1102: 8 | H1102: 11 | I1102: =G1102*6+H1102 -> 59 | K1102: 12 | L1102: 15 | M1102: =K1102*6+L1102 -> 87 | O1102: 12 | P1102: 16 | Q1102: =O1102*6+P1102 -> 88 | S1102: JOHNS
A1103: BEST PLAYERS
A1104: COBURG | C1104: WILSON | F1104: WALKER | J1104: JAMES | M1104: BUCKLEY | P1104: SMITH | S1104: ROGAN
A1105: SANDRINGHAM | C1105: HISCOCK | F1105: M GRAMBEAU | J1105: PATTERSON | M1105: STANLEY | P1105: RUSSELL | S1105: HOLMES
A1106: GOALKICKERS
A1107: COBURG | C1107: JAMES 7 | E1107: BUCKLEY 4 | H1107: ROGAN 2 | J1107: WALSH 2 | M1107: WILSON | O1107: QUINN | Q1107: CONDON | S1107: McILVEEN | V1107: SPIERS
A1108: SANDRINGHAM | C1108: HISCOCK 6 | F1108: HOLMES 3 | I1108: B HARPER | K1108: REID | M1108: BENCRAFT
A1110: NORTHCOTE | C1110: 5 | D1110: 7 | E1110: =C1110*6+D1110 -> 37 | G1110: 9 | H1110: 9 | I1110: =G1110*6+H1110 -> 63 | K1110: 17 | L1110: 13 | M1110: =K1110*6+L1110 -> 115 | O1110: 20 | P1110: 20 | Q1110: =O1110*6+P1110 -> 140 | S1110: NORTHCOTE
A1111: PORT MELBOURNE | C1111: 3 | D1111: 1 | E1111: =C1111*6+D1111 -> 19 | G1111: 5 | H1111: 3 | I1111: =G1111*6+H1111 -> 33 | K1111: 9 | L1111: 6 | M1111: =K1111*6+L1111 -> 60 | O1111: 11 | P1111: 12 | Q1111: =O1111*6+P1111 -> 78 | S1111: EGAN
A1112: BEST PLAYERS
A1113: NORTHCOTE | C1113: PAWSEY | F1113: KNIGHT | I1113: NASH | K1113: GREENHAM | N1113: STABB | Q1113: HINES
A1114: PORT MELBOURNE | C1114: LEWIS | F1114: FLETCHER | I1114: EGAN | K1114: BUTCHER | N1114: TUCKER | Q1114: OLDMAN
A1115: GOALKICKERS
A1116: NORTHCOTE | C1116: KNIGHT 5 | E1116: PAWSEY 4 | H1116: NASH 3 | J1116: KEN MURPHY 2 | N1116: DUNCAN 2 | Q1116: SCOTT | S1116: BAKER | U1116: McINTOSH | X1116: WALLIS
A1117: PORT MELBOURNE | C1117: EGAN 3 | F1117: HARRISON 3 | I1117: LEWIS 3 | K1117: BOWER | M1117: FLETCHER
A1119: YARRAVILLE | C1119: 2 | D1119: 2 | E1119: =C1119*6+D1119 -> 14 | G1119: 8 | H1119: 9 | I1119: =G1119*6+H1119 -> 57 | K1119: 11 | L1119: 12 | M1119: =K1119*6+L1119 -> 78 | O1119: 15 | P1119: 17 | Q1119: =O1119*6+P1119 -> 107 | S1119: YARRAVILLE
A1120: PRESTON | C1120: 8 | D1120: 2 | E1120: =C1120*6+D1120 -> 50 | G1120: 11 | H1120: 6 | I1120: =G1120*6+H1120 -> 72 | K1120: 15 | L1120: 8 | M1120: =K1120*6+L1120 -> 98 | O1120: 16 | P1120: 10 | Q1120: =O1120*6+P1120 -> 106 | S1120: BARNES
A1121: BEST PLAYERS
A1122: YARRAVILLE | C1122: SCARFFE | F1122: HARRIS | I1122: MILLER | L1122: PHILLIPS | O1122: CRANAGE | R1122: TESTRAIL
A1123: PRESTON | C1123: RIDDELL | F1123: NATHAN | I1123: POTTER | L1123: GOLDIN | O1123: MEARS | R1123: CONNELLY
A1124: GOALKICKERS
A1125: YARRAVILLE | C1125: SCARFFE 3 | F1125: PHILLIPS 3 | I1125: MILLER 3 | K1125: HARRIS 2 | M1125: RUDDELL 2 | P1125: MAHER | R1125: McASEY
A1126: PRESTON | C1126: NATHAN 5 | F1126: POTTER 4 | I1126: GOLDIN 4 | K1126: MEARS 2 | M1126: CONNELLY
A1128: FINALS
A1129: 1ST SEMI | D1129: 18TH SEPTEMBER | I1129: WEATHER | K1129: SOUTH WEST BREEZE FINE SUNNY
D1130: 1ST QTR | H1130: 2ND QTR | L1130: 3RD QTR | P1130: FINAL
A1131: BRIGHTON | C1131: 5 | D1131: 4 | E1131: =C1131*6+D1131 -> 34 | G1131: 8 | H1131: 12 | I1131: =G1131*6+H1131 -> 60 | K1131: 9 | L1131: 16 | M1131: =K1131*6+L1131 -> 70 | O1131: 17 | P1131: 23 | Q1131: =O1131*6+P1131 -> 125 | S1131: JUNCTION OVAL
A1132: NORTHCOTE | C1132: 3 | D1132: 4 | E1132: =C1132*6+D1132 -> 22 | G1132: 6 | H1132: 8 | I1132: =G1132*6+H1132 -> 44 | K1132: 8 | L1132: 11 | M1132: =K1132*6+L1132 -> 59 | O1132: 12 | P1132: 13 | Q1132: =O1132*6+P1132 -> 85 | S1132: MERRINGTON
A1133: BEST PLAYERS
A1134: BRIGHTON | C1134: ROSE | F1134: WILLIAMSON | J1134: McINDOE | M1134: WARBURTON | P1134: E TURNER | S1134: STRETTON
A1135: NORTHCOTE | C1135: WALLIS | F1135: FARRELL | J1135: CRANE | M1135: BAKER | P1135: HINES | S1135: NASH
A1136: GOALKICKERS
A1137: BRIGHTON | C1137: WARBURTON 6 | F1137: McINDOE 4 | I1137: DOUGLAS 2 | L1137: BURKE 2 | N1137: STRETTON | Q1137: ADAMSON | T1137: HEIMS
A1138: NORTHCOTE | C1138: NASH 5 | F1138: WALLIS 3 | I1138: SCOTT 2 | K1138: PAWSEY | M1138: HISCOX
A1140: 2ND SEMI | D1140: 25TH SEPTEMBER | I1140: WEATHER | K1140: SOUTH WEST BREEZE FINE SUNNY
A1141: WILLIAMSTOWN | C1141: 5 | D1141: 4 | E1141: =C1141*6+D1141 -> 34 | G1141: 9 | H1141: 6 | I1141: =G1141*6+H1141 -> 60 | K1141: 10 | L1141: 8 | M1141: =K1141*6+L1141 -> 68 | O1141: 17 | P1141: 13 | Q1141: =O1141*6+P1141 -> 115 | S1141: JUNCTION OVAL
A1142: BRUNSWICK | C1142: 0 | D1142: 7 | E1142: =C1142*6+D1142 -> 7 | G1142: 2 | H1142: 11 | I1142: =G1142*6+H1142 -> 23 | K1142: 7 | L1142: 17 | M1142: =K1142*6+L1142 -> 59 | O1142: 9 | P1142: 20 | Q1142: =O1142*6+P1142 -> 74 | S1142: MERRINGTON
A1143: BEST PLAYERS
A1144: WILLIAMSTOWN | C1144: CAMERON | F1144: WILCOX | I1144: WILLIAMS | L1144: PEACOCK | O1144: McRAE | R1144: CHAPMAN
A1145: BRUNSWICK | C1145: RINGROSE | F1145: GEISLER | I1145: TONKES | L1145: SMITH | O1145: GLASSCOTT | R1145: PRIESTLEY
A1146: GOALKICKERS
A1147: WILLIAMSTOWN | C1147: TODD 3 | E1147: REDMOND 3 | H1147: COLLINS 3 | K1147: M McPHERSON 2 | O1147: MATTHEWS 2 | R1147: PEACOCK 2 | V1147: SALVAS 2
A1148: BRUNSWICK | C1148: RINGROSE 2 | F1148: POWELL 2 | I1148: SMITH 2 | K1148: CROUCH | M1148: BAGGOTT | O1148: HENRYS
A1150: PRELIMINARY FINAL | F1150: 2ND OCTOBER | J1150: WEATHER | L1150: SOUTH EAST WIND FINE GROUND WET
A1151: BRIGHTON | C1151: 3 | D1151: 3 | E1151: =C1151*6+D1151 -> 21 | G1151: 5 | H1151: 9 | I1151: =G1151*6+H1151 -> 39 | K1151: 10 | L1151: 10 | M1151: =K1151*6+L1151 -> 70 | O1151: 14 | P1151: 16 | Q1151: =O1151*6+P1151 -> 100 | S1151: JUNCTION OVAL
A1152: BRUNSWICK | C1152: 5 | D1152: 4 | E1152: =C1152*6+D1152 -> 34 | G1152: 7 | H1152: 5 | I1152: =G1152*6+H1152 -> 47 | K1152: 11 | L1152: 9 | M1152: =K1152*6+L1152 -> 75 | O1152: 12 | P1152: 14 | Q1152: =O1152*6+P1152 -> 86 | S1152: MERRINGTON
A1153: BEST PLAYERS
A1154: BRIGHTON | C1154: WILLIAMSON | G1154: McASEY | J1154: ROSE | L1154: ADAMSON | O1154: WARBURTON | R1154: BURKE
A1155: BRUNSWICK | C1155: GEISLER | G1155: GLASSCOTT | J1155: SMITH | L1155: TONKES | O1155: JENKINS | R1155: CROUCH
A1156: GOALKICKERS
A1157: BRIGHTON | C1157: DOUGLAS 5 | F1157: WARBURTON 5 | J1157: ADAMSON | M1157: BURKE | O1157: McINDOE | Q1157: PICKERING
A1158: BRUNSWICK | C1158: POWELL 3 | F1158: BAGGOTT 3 | I1158: JENKINS 2 | K1158: STANLEY 2 | N1158: RINGROSE | Q1158: SMITH
A1160: GRAND FINAL | D1160: 9TH OCTOBER | I1160: WEATHER | K1160: SOUTH WIND LIGHT RAIN
A1161: BRIGHTON | C1161: 2 | D1161: 4 | E1161: 16 | G1161: 7 | H1161: 7 | I1161: 49 | K1161: 10 | L1161: 10 | M1161: 70 | O1161: 13 | P1161: 16 | Q1161: =O1161*6+P1161 -> 94 | S1161: JUNCTION OVAL
A1162: WILLIAMSTOWN | C1162: 4 | D1162: 3 | E1162: 27 | G1162: 7 | H1162: 4 | I1162: 46 | K1162: 9 | L1162: 6 | M1162: 60 | O1162: 13 | P1162: 7 | Q1162: =O1162*6+P1162 -> 85 | S1162: MERRINGTON
A1163: BEST PLAYERS
A1164: BRIGHTON | C1164: DOUGLAS | F1164: McASEY | I1164: HEIMS | L1164: STRETTON | O1164: ADAMSON | R1164: McINDOE
A1165: WILLIAMSTOWN | C1165: WILCOX | F1165: M McPHERSON | I1165: MATTHEWS | L1165: SAMPSON | O1165: SHEAHAN | R1165: CAMERON
A1166: GOALKICKERS
A1167: BRIGHTON | C1167: DOUGLAS 4 | F1167: WARBURTON 3 | J1167: HEIMS 2 | M1167: BURKE 2 | O1167: ADAMSON | R1167: McINDOE
A1168: WILLIAMSTOWN | C1168: M McPHERSON 3 | F1168: SALVAS 3 | I1168: REDMOND 3 | L1168: MATTHEWS 2 | O1168: TODD | Q1168: PEACOCK