A1: Victorian Football Association
A2: Season 1949
A3: © Copyright Wal Williams | F3: First created: 2 November 2014
A4: Contact: joywalwi at gmail dot com | F4: Last updated: 27 January 2018 | W4: VFA Results and tables - Link to the main index page
A5: You are free to copy this document in whole or part provided that proper acknowledgement is given to the author. All rights reserved.
A7: YEAR 1949
A8: ROUND 1 | D8: 16TH APRIL | H8: EASTER SATURDAY | L8: WEATHER | P8: FINE AND SUNNY | S8: PLAYED AT
D9: 1ST QTR | H9: 2ND QTR | L9: 3RD QTR | P9: FINAL | S9: PORT MELBOURNE
A10: COBURG | C10: 1 | D10: 5 | E10: =C10*6+D10 -> 11 | G10: 7 | H10: 7 | I10: =G10*6+H10 -> 49 | K10: 10 | L10: 8 | M10: =K10*6+L10 -> 68 | O10: 12 | P10: 11 | Q10: =O10*6+P10 -> 83 | S10: UMPIRE | X10: LADDER | AB10: ROUND | AD10: 1
A11: PORT MELBOURNE | C11: 6 | D11: 4 | E11: =C11*6+D11 -> 40 | G11: 7 | H11: 6 | I11: =G11*6+H11 -> 48 | K11: 8 | L11: 10 | M11: =K11*6+L11 -> 58 | O11: 11 | P11: 16 | Q11: =O11*6+P11 -> 82 | S11: JOHNS
A12: BEST PLAYERS | W12: TEAM | X12: W | Y12: L | Z12: D | AA12: FOR | AB12: AGST | AC12: % | AD12: PTS
A13: COBURG | C13: EQUID | F13: HOGAN | I13: PRENDERGAST | L13: CLAPTON | N13: FLEGG | Q13: CHUBB
A14: PORT MELBOURNE | C14: CULPH | F14: HOUSTON | I14: CLEARY | L14: WELLS | N14: HOULIHAN | Q14: AUSTIN | W14: OAKLEIGH | X14: 1 | Y14: 0 | Z14: 0 | AA14: 159 | AB14: 77 | AC14: 206.49350649350649 | AD14: 4
A15: GOALKICKERS | P15: JAMES | R15: FLEGG | W15: BRIGHTON | X15: 1 | Y15: 0 | Z15: 0 | AA15: 113 | AB15: 66 | AC15: 171.21212121212122 | AD15: 4
A16: COBURG | C16: WALSH 2 | E16: ROGAN 2 | G16: CLAPTON 2 | J16: HOLBROOK | M16: PRENDERGAST | P16: EQUID | R16: McILVEEN | W16: PRAHRAN | X16: 1 | Y16: 0 | Z16: 0 | AA16: 113 | AB16: 76 | AC16: 148.68421052631578 | AD16: 4
A17: PORT MELBOURNE | C17: CULPH 4 | E17: HOUSTON 3 | H17: LEWIS | J17: HOULIHAN | M17: EGAN | O17: WELLS | W17: WILLIAMSTOWN | X17: 1 | Y17: 0 | Z17: 0 | AA17: 92 | AB17: 79 | AC17: 116.45569620253164 | AD17: 4
A19: PRAHRAN | C19: 4 | D19: 2 | E19: =C19*6+D19 -> 26 | G19: 10 | H19: 6 | I19: =G19*6+H19 -> 66 | K19: 13 | L19: 9 | M19: =K19*6+L19 -> 87 | O19: 17 | P19: 11 | Q19: =O19*6+P19 -> 113 | S19: BRUNSWICK | W19: YARRAVILLE | X19: 1 | Y19: 0 | Z19: 0 | AA19: 113 | AB19: 108 | AC19: 104.62962962962963 | AD19: 4
A20: BRUNSWICK | C20: 1 | D20: 3 | E20: =C20*6+D20 -> 9 | G20: 2 | H20: 9 | I20: =G20*6+H20 -> 21 | K20: 5 | L20: 12 | M20: =K20*6+L20 -> 42 | O20: 10 | P20: 16 | Q20: =O20*6+P20 -> 76 | S20: WRIGHT | W20: COBURG | X20: 1 | Y20: 0 | Z20: 0 | AA20: 83 | AB20: 82 | AC20: 101.21951219512195 | AD20: 4
A21: BEST PLAYERS | W21: PORT MELBOURNE | X21: 0 | Y21: 1 | Z21: 0 | AA21: 82 | AB21: 83 | AC21: 98.795180722891573 | AD21: 0
A22: PRAHRAN | C22: O'BRIEN | F22: FERGEUS | I22: McCULLOCH | L22: OPRAY | N22: WALSH | Q22: COLLS | W22: NORTHCOTE | X22: 0 | Y22: 1 | Z22: 0 | AA22: 108 | AB22: 113 | AC22: 95.575221238938056 | AD22: 0
A23: BRUNSWICK | C23: SMITH | F23: SHAW | I23: GEISLER | L23: MAHER | N23: RINGROSE | Q23: SILK | W23: PRESTON | X23: 0 | Y23: 1 | Z23: 0 | AA23: 79 | AB23: 92 | AC23: 85.869565217391298 | AD23: 0
A24: GOALKICKERS | W24: BRUNSWICK | X24: 0 | Y24: 1 | Z24: 0 | AA24: 76 | AB24: 113 | AC24: 67.256637168141594 | AD24: 0
A25: PRAHRAN | C25: O'BRIEN 7 | F25: McCULLOCH 5 | I25: SHRIMPTON 2 | L25: FERGEUS 2 | N25: WOOD | W25: SANDRINGHAM | X25: 0 | Y25: 1 | Z25: 0 | AA25: 66 | AB25: 113 | AC25: 58.407079646017699 | AD25: 0
A26: BRUNSWICK | C26: RINGROSE 3 | F26: SMITH 2 | I26: GEISLER 2) | L26: JENKINS | N26: MAHER | P26: HORDER | W26: CAMBERWELL | X26: 0 | Y26: 1 | Z26: 0 | AA26: 77 | AB26: 159 | AC26: 48.427672955974842 | AD26: 0
A28: YARRAVILLE | C28: 0 | D28: 0 | E28: =C28*6+D28 -> 0 | G28: 7 | H28: 4 | I28: =G28*6+H28 -> 46 | K28: 11 | L28: 6 | M28: =K28*6+L28 -> 72 | O28: 17 | P28: 11 | Q28: =O28*6+P28 -> 113 | S28: YARRAVILLE
A29: NORTHCOTE | C29: 5 | D29: 10 | E29: =C29*6+D29 -> 40 | G29: 9 | H29: 12 | I29: =G29*6+H29 -> 66 | K29: 12 | L29: 20 | M29: =K29*6+L29 -> 92 | O29: 14 | P29: 24 | Q29: =O29*6+P29 -> 108 | S29: SMITHWICK
A30: BEST PLAYERS
A31: YARRAVILLE | C31: PHILLIPS | F31: MILLER | I31: CRANAGE | L31: SCARFFE | O31: SALT | Q31: SING
A32: NORTHCOTE | C32: NASH | F32: PAWSEY | I32: DUNCAN | L32: BAKER | O32: HINES | Q32: WHITE
A33: GOALKICKERS
A34: YARRAVILLE | C34: PHILLIPS 9 | F34: MILLER 3 | I34: BAXTER | K34: SCARFFE | M34: RUDDELL | O34: SING | Q34: ROHLEDER
A35: NORTHCOTE | C35: PAWSEY 4 | F35: DUNCAN 3 | I35: STABB 2 | K35: MURPHY 2 | N35: WHITE | P35: CASPAR | R35: NASH
D36: 18TH APRIL | H36: EASTER MONDAY | M36: WEATHER | Q36: NORTH WIND WARM AND SUNNY
A37: OAKLEIGH | C37: 6 | D37: 12 | E37: =C37*6+D37 -> 48 | G37: 11 | H37: 16 | I37: =G37*6+H37 -> 82 | K37: 20 | L37: 21 | M37: =K37*6+L37 -> 141 | O37: 22 | P37: 27 | Q37: =O37*6+P37 -> 159 | S37: CAMBERWELL
A38: CAMBERWELL | C38: 1 | D38: 3 | E38: =C38*6+D38 -> 9 | G38: 6 | H38: 8 | I38: =G38*6+H38 -> 44 | K38: 6 | L38: 10 | M38: =K38*6+L38 -> 46 | O38: 11 | P38: 11 | Q38: =O38*6+P38 -> 77 | S38: STREETER
A39: BEST PLAYERS
A40: OAKLEIGH | C40: WENN | F40: BOYLE | I40: R FINN | L40: BAXTER | O40: WILLIAMS | R40: RUNDELL
A41: CAMBERWELL | C41: STUBBS | F41: SHARPLES | I41: KENNEDY | L41: CRACKNELL | O41: HESTER | R41: UNSTEAD
A42: GOALKICKERS
A43: OAKLEIGH | C43: WENN 8 | F43: SMEATON 5 | I43: RUNDELL 3 | L43: R FINN 3 | N43: PERKINS 2 | Q43: PAY
A44: CAMBERWELL | C44: CRACKNELL 4 | F44: STUBBS 3 | I44: McIVOR | K44: BOHAN | M44: ROCHFORD | P44: HERBERT
A46: WILLIAMSTOWN | C46: 3 | D46: 6 | E46: =C46*6+D46 -> 24 | G46: 4 | H46: 7 | I46: =G46*6+H46 -> 31 | K46: 10 | L46: 12 | M46: =K46*6+L46 -> 72 | O46: 13 | P46: 14 | Q46: =O46*6+P46 -> 92 | S46: PRESTON
A47: PRESTON | C47: 0 | D47: 1 | E47: =C47*6+D47 -> 1 | G47: 3 | H47: 7 | I47: =G47*6+H47 -> 25 | K47: 6 | L47: 10 | M47: =K47*6+L47 -> 46 | O47: 11 | P47: 13 | Q47: =O47*6+P47 -> 79 | S47: MILLER
A48: BEST PLAYERS
A49: WILLIAMSTOWN | C49: McRAE | F49: TODD | I49: DANCKERT | L49: SAMPSON | O49: FEATHERBY | R49: CAMERON
A50: PRESTON | C50: BLACKMAN | F50: LEISHMAN | I50: MASLEN | L50: WHITFIELD | O50: GOLDIN | R50: HUBBER
A51: GOALKICKERS
A52: WILLIAMSTOWN | C52: TODD 6 | F52: WALKER 3 | I52: McRAE 2 | K52: ABBERTON | N52: COLLINS
A53: PRESTON | C53: NATHAN 3 | F53: DUNCAN 3 | I53: WHITFIELD | L53: GOLDIN | N53: O'LEARY | P53: HARRISON | R53: MEARS
A55: BRIGHTON | C55: 0 | D55: 3 | E55: =C55*6+D55 -> 3 | G55: 6 | H55: 8 | I55: =G55*6+H55 -> 44 | K55: 9 | L55: 13 | M55: =K55*6+L55 -> 67 | O55: 15 | P55: 23 | Q55: =O55*6+P55 -> 113 | S55: ELSTERNWICK PARK
A56: SANDRINGHAM | C56: 2 | D56: 6 | E56: =C56*6+D56 -> 18 | G56: 3 | H56: 8 | I56: =G56*6+H56 -> 26 | K56: 7 | L56: 12 | M56: =K56*6+L56 -> 54 | O56: 9 | P56: 12 | Q56: =O56*6+P56 -> 66 | S56: BARNES
A57: BEST PLAYERS
A58: BRIGHTON | C58: E TURNER | F58: BURKE | I58: PICKERING | L58: WARBURTON | O58: HOWE | Q58: T NEW
A59: SANDRINGHAM | C59: WEBB | F59: MOLAN | I59: BROWN | L59: ANDREW | O59: BURKE | Q59: CLARKE
A60: GOALKICKERS
A61: BRIGHTON | C61: HOWE 4 | F61: WARBURTON 4 | J61: PICKERING 3 | M61: PINDER 2 | O61: STRETTON | Q61: ADAMSON
A62: SANDRINGHAM | C62: HISCOCK 5 | F62: CLARKE 2 | I62: MOLAN | K62: CERINI
A64: ROUND 2 | D64: 23RD APRIL | H64: WEATHER | K64: SOUTH BREEZE SHOWERS COLD MISTY | S64: PLAYED AT
D65: 1ST QTR | H65: 2ND QTR | L65: 3RD QTR | P65: FINAL | S65: OAKLEIGH
A66: OAKLEIGH | C66: 3 | D66: 7 | E66: =C66*6+D66 -> 25 | G66: 7 | H66: 15 | I66: =G66*6+H66 -> 57 | K66: 15 | L66: 25 | M66: =K66*6+L66 -> 115 | O66: 21 | P66: 35 | Q66: =O66*6+P66 -> 161 | S66: UMPIRE | X66: LADDER | AB66: ROUND | AD66: 2
A67: YARRAVILLE | C67: 2 | D67: 1 | E67: =C67*6+D67 -> 13 | G67: 6 | H67: 3 | I67: =G67*6+H67 -> 39 | K67: 6 | L67: 4 | M67: =K67*6+L67 -> 40 | O67: 6 | P67: 7 | Q67: =O67*6+P67 -> 43 | S67: JOHNS
A68: BEST PLAYERS | W68: TEAM | X68: W | Y68: L | Z68: D | AA68: FOR | AB68: AGST | AC68: % | AD68: PTS
A69: OAKLEIGH | C69: SMEATON | F69: R FINN | I69: BEARD | K69: DEAYTON | N69: POWER | Q69: WILLIAMS
A70: YARRAVILLE | C70: YATES | F70: SALT | I70: MILLER | K70: RUDDELL | N70: ROHLEDER | Q70: PHILLIPS | W70: OAKLEIGH | X70: 2 | Y70: 0 | Z70: 0 | AA70: 320 | AB70: 120 | AC70: 266.66666666666669 | AD70: 8
A71: GOALKICKERS | Q71: JORY | W71: PRAHRAN | X71: 2 | Y71: 0 | Z71: 0 | AA71: 246 | AB71: 154 | AC71: 159.74025974025975 | AD71: 8
A72: OAKLEIGH | C72: WENN 5 | E72: SMEATON 4 | H72: RYAN 3 | J72: R FINN 3 | L72: DEAYTON 2 | N72: PERKINS | P72: WILLIAMS | R72: BRISTOWE | W72: BRIGHTON | X72: 2 | Y72: 0 | Z72: 0 | AA72: 235 | AB72: 166 | AC72: 141.56626506024097 | AD72: 8
A73: YARRAVILLE | C73: PHILLIPS | E73: THOMAS | G73: MILLER | I73: RUDDELL | L73: YEWERS | N73: ROHLEDER | W73: WILLIAMSTOWN | X73: 2 | Y73: 0 | Z73: 0 | AA73: 188 | AB73: 163 | AC73: 115.33742331288343 | AD73: 8
A75: PRAHRAN | C75: 5 | D75: 1 | E75: =C75*6+D75 -> 31 | G75: 10 | H75: 9 | I75: =G75*6+H75 -> 69 | K75: 14 | L75: 10 | M75: =K75*6+L75 -> 94 | O75: 20 | P75: 13 | Q75: =O75*6+P75 -> 133 | S75: TOORAK PARK | W75: COBURG | X75: 1 | Y75: 1 | Z75: 0 | AA75: 166 | AB75: 168 | AC75: 98.80952380952381 | AD75: 4
A76: PORT MELBOURNE | C76: 3 | D76: 3 | E76: =C76*6+D76 -> 21 | G76: 4 | H76: 5 | I76: =G76*6+H76 -> 29 | K76: 8 | L76: 8 | M76: =K76*6+L76 -> 56 | O76: 11 | P76: 12 | Q76: =O76*6+P76 -> 78 | S76: STRETTON | W76: SANDRINGHAM | X76: 1 | Y76: 1 | Z76: 0 | AA76: 194 | AB76: 199 | AC76: 97.48743718592965 | AD76: 4
A77: BEST PLAYERS | W77: CAMBERWELL | X77: 1 | Y77: 1 | Z77: 0 | AA77: 163 | AB77: 242 | AC77: 67.355371900826441 | AD77: 4
A78: PRAHRAN | C78: ROACH | F78: WALSH | I78: SHRIMPTON | L78: FERGEUS | N78: O'BRIEN | Q78: McCULLOCH | W78: YARRAVILLE | X78: 1 | Y78: 1 | Z78: 0 | AA78: 156 | AB78: 269 | AC78: 57.992565055762078 | AD78: 4
A79: PORT MELBOURNE | C79: BUTCHER | F79: ARGOON | I79: DRINAN | L79: CULPH | N79: WOODBRIDGE | Q79: WELLS | W79: NORTHCOTE | X79: 0 | Y79: 2 | Z79: 0 | AA79: 208 | AB79: 235 | AC79: 88.510638297872347 | AD79: 0
A80: GOALKICKERS | W80: BRUNSWICK | X80: 0 | Y80: 2 | Z80: 0 | AA80: 160 | AB80: 209 | AC80: 76.555023923444978 | AD80: 0
A81: PRAHRAN | C81: McCULLOCH 6 | F81: SHRIMPTON 4 | I81: CAMPBELL 3 | L81: FERGEUS 2 | N81: O'BRIEN 2 | Q81: WOOD 2 | S81: BURGESS | W81: PRESTON | X81: 0 | Y81: 2 | Z81: 0 | AA81: 165 | AB81: 220 | AC81: 75 | AD81: 0
A82: PORT MELBOURNE | C82: HOUSTON 4 | F82: CULPH 3 | H82: WELLS 2 | J82: SEXTON | L82: WOODBRIDGE | W82: PORT MELBOURNE | X82: 0 | Y82: 2 | Z82: 0 | AA82: 160 | AB82: 216 | AC82: 74.074074074074076 | AD82: 0
A84: BRIGHTON | C84: 4 | D84: 3 | E84: =C84*6+D84 -> 27 | G84: 8 | H84: 8 | I84: =G84*6+H84 -> 56 | K84: 13 | L84: 16 | M84: =K84*6+L84 -> 94 | O84: 17 | P84: 20 | Q84: =O84*6+P84 -> 122 | S84: NORTHCOTE
A85: NORTHCOTE | C85: 4 | D85: 6 | E85: =C85*6+D85 -> 30 | G85: 10 | H85: 7 | I85: =G85*6+H85 -> 67 | K85: 11 | L85: 10 | M85: =K85*6+L85 -> 76 | O85: 15 | P85: 10 | Q85: =O85*6+P85 -> 100 | S85: IRVING
A86: BEST PLAYERS
A87: BRIGHTON | C87: WARBURTON | F87: ADAMSON | I87: PICKERING | L87: HALL | N87: BURKE | Q87: McASEY
A88: NORTHCOTE | C88: PAWSEY | F88: R STABB | I88: CASPAR | L88: WHITE | N88: HINES | Q88: MURPHY
A89: GOALKICKERS
A90: BRIGHTON | C90: WARBURTON 7 | F90: ADAMSON 5 | I90: PLUNKETT 2 | L90: PICKERING | O90: BURKE | Q90: HOWE
A91: NORTHCOTE | C91: PAWSEY 4 | F91: WHITE 4 | I91: DUNCAN 2 | L91: NASH 2 | N91: McINTOSH 2 | Q91: MURPHY
A93: SANDRINGHAM | C93: 3 | D93: 3 | E93: =C93*6+D93 -> 21 | G93: 10 | H93: 6 | I93: =G93*6+H93 -> 66 | K93: 14 | L93: 10 | M93: =K93*6+L93 -> 94 | O93: 19 | P93: 14 | Q93: =O93*6+P93 -> 128 | S93: BEACH ROAD
A94: PRESTON | C94: 2 | D94: 5 | E94: =C94*6+D94 -> 17 | G94: 4 | H94: 7 | I94: =G94*6+H94 -> 31 | K94: 11 | L94: 8 | M94: =K94*6+L94 -> 74 | O94: 13 | P94: 8 | Q94: =O94*6+P94 -> 86 | S94: WRIGHT
A95: BEST PLAYERS
A96: SANDRINGHAM | C96: McFEE | F96: HISCOCK | I96: B HARPER | L96: R HARPER | O96: TOYNE | Q96: BROWN
A97: PRESTON | C97: BLACKMAN | F97: C STEWART | I97: WALDRON | L97: NATHAN | O97: MEARS | Q97: POTTER
A98: GOALKICKERS
A99: SANDRINGHAM | C99: HISCOCK 5 | F99: B HARPER 4 | I99: McFEE 4 | K99: ANDREWS 2 | N99: CARMOD 2 | Q99: R HARPER | S99: McLEOD
A100: PRESTON | C100: NATHAN 2 | F100: POTTER 2 | I100: MEARS 2 | K100: BLACKMAN | N100: CONNELY | P100: C STEWART | R100: DUNGAN | U100: WALDRON | X100: BRYCE | Z100: GOLDIN
A102: CAMBERWELL | C102: 2 | D102: 4 | E102: =C102*6+D102 -> 16 | G102: 4 | H102: 11 | I102: =G102*6+H102 -> 35 | K102: 5 | L102: 16 | M102: =K102*6+L102 -> 46 | O102: 10 | P102: 26 | Q102: =O102*6+P102 -> 86 | S102: COBURG
A103: COBURG | C103: 5 | D103: 9 | E103: =C103*6+D103 -> 39 | G103: 9 | H103: 11 | I103: =G103*6+H103 -> 65 | K103: 11 | L103: 15 | M103: =K103*6+L103 -> 81 | O103: 11 | P103: 17 | Q103: =O103*6+P103 -> 83 | S103: SMITHWICK
A104: BEST PLAYERS
A105: CAMBERWELL | C105: COOK | E105: JENSEN | H105: UNSTEAD | K105: STUBBS | N105: MILLER | Q105: BOHAN
A106: COBURG | C106: EQUID | E106: JAMES | H106: ROGAN | K106: HEEPS | N106: CAIRNS | Q106: FEWKES
A107: GOALKICKERS
A108: CAMBERWELL | C108: MILGATE 3 | F108: CRACKNELL 2 | I108: BOHAN | K108: JENSEN | M108: DUFF | N108: STUBBS | P108: BENBOW
A109: COBURG | C109: JAMES 4 | F109: FEWKES 3 | I109: ROGAN 3 | K109: WALSH
A111: WILLIAMSTOWN | C111: 1 | D111: 4 | E111: =C111*6+D111 -> 10 | G111: 5 | H111: 10 | I111: =G111*6+H111 -> 40 | K111: 7 | L111: 15 | M111: =K111*6+L111 -> 57 | O111: 13 | P111: 18 | Q111: =O111*6+P111 -> 96 | S111: WILLIAMSTOWN
A112: BRUNSWICK | C112: 4 | D112: 3 | E112: =C112*6+D112 -> 27 | G112: 4 | H112: 5 | I112: =G112*6+H112 -> 29 | K112: 10 | L112: 9 | M112: =K112*6+L112 -> 69 | O112: 12 | P112: 12 | Q112: =O112*6+P112 -> 84 | S112: BARNES
A113: BEST PLAYERS
A114: WILLIAMSTOWN | C114: WALKER | F114: COLLINS | I114: FEATHERBY | L114: TODD | N114: STRANG | Q114: BERNARD
A115: BRUNSWICK | C115: SHAW | F115: PRIESTLEY | I115: HALL | L115: McIVOR | N115: GEISLER | Q115: WARD
A116: GOALKICKERS
A117: WILLIAMSTOWN | C117: TODD 6 | F117: COLLINS 2 | I117: WALKER 2 | L117: McRAE | N117: H TAYLOR | Q117: REDMOND
A118: BRUNSWICK | C118: SMITH 4 | F118: PRIESTLEY 3 | I118: CROUCH 2 | L118: HORDER 2 | N118: HENRYS | Q118: RINGROSE
A120: ROUND 3 | D120: 30TH APRIL | J120: WEATHER | M120: NORTH WIND WARM AND SUNNY | S120: PLAYED AT
D121: 1ST QTR | H121: 2ND QTR | L121: 3RD QTR | P121: FINAL | S121: ELSTERNWICK PARK
A122: BRIGHTON | C122: 1 | D122: 3 | E122: =C122*6+D122 -> 9 | G122: 3 | H122: 17 | I122: =G122*6+H122 -> 35 | K122: 3 | L122: 19 | M122: =K122*6+L122 -> 37 | O122: 11 | P122: 25 | Q122: =O122*6+P122 -> 91 | S122: UMPIRE | X122: LADDER | AB122: ROUND | AD122: 3
A123: OAKLEIGH | C123: 6 | D123: 4 | E123: =C123*6+D123 -> 40 | G123: 6 | H123: 4 | I123: =G123*6+H123 -> 40 | K123: 11 | L123: 11 | M123: =K123*6+L123 -> 77 | O123: 11 | P123: 12 | Q123: =O123*6+P123 -> 78 | S123: BARNES
A124: BEST PLAYERS | W124: TEAM | X124: W | Y124: L | Z124: D | AA124: FOR | AB124: AGST | AC124: % | AD124: PTS
A125: BRIGHTON | C125: CONROY | E125: E TURNER | H125: WARBURTON | K125: WILLIAMSON | N125: MCINDOE | Q125: NEW
A126: OAKLEIGH | C126: BEARD | E126: TEMME | H126: R FINN | K126: RYAN | N126: SMEATON | Q126: DONNELLY | W126: BRIGHTON | X126: 3 | Y126: 0 | Z126: 0 | AA126: 326 | AB126: 244 | AC126: 133.60655737704917 | AD126: 12
A127: GOALKICKERS | W127: OAKLEIGH | X127: 2 | Y127: 1 | Z127: 0 | AA127: 398 | AB127: 211 | AC127: 188.62559241706163 | AD127: 8
A128: BRIGHTON | C128: WARBURTON 4 | F128: ADAMSON 2 | I128: PINDER | K128: HOWE | M128: McINDOE | O128: NEW | Q128: RIDDELL | W128: PRAHRAN | X128: 2 | Y128: 1 | Z128: 0 | AA128: 362 | AB128: 291 | AC128: 124.4 | AD128: 8
A129: OAKLEIGH | C129: R FINN 4 | F129: SMEATON 2 | I129: EDWARDS 2 | L129: JORY | N129: WENN | P129: MUNYARD | W129: COBURG | X129: 2 | Y129: 1 | Z129: 0 | AA129: 303 | AB129: 284 | AC129: 106.69 | AD129: 8
A131: COBURG | C131: 2 | D131: 2 | E131: =C131*6+D131 -> 14 | G131: 8 | H131: 6 | I131: =G131*6+H131 -> 54 | K131: 10 | L131: 10 | M131: =K131*6+L131 -> 70 | O131: 20 | P131: 17 | Q131: =O131*6+P131 -> 137 | S131: TOORAK PARK | W131: WILLIAMSTOWN | X131: 2 | Y131: 1 | Z131: 0 | AA131: 265 | AB131: 254 | AC131: 104.33070866141732 | AD131: 8
A132: PRAHRAN | C132: 7 | D132: 5 | E132: =C132*6+D132 -> 47 | G132: 10 | H132: 6 | I132: =G132*6+H132 -> 66 | K132: 16 | L132: 11 | M132: =K132*6+L132 -> 107 | O132: 17 | P132: 14 | Q132: =O132*6+P132 -> 116 | S132: IRVING | W132: CAMBERWELL | X132: 2 | Y132: 1 | Z132: 0 | AA132: 259 | AB132: 313 | AC132: 82.74760383386581 | AD132: 8
A133: BEST PLAYERS | W133: SANDRINGHAM | X133: 1 | Y133: 2 | Z133: 0 | AA133: 257 | AB133: 274 | AC133: 93.795620437956202 | AD133: 4
A134: COBURG | C134: JAMES | F134: JORGENSON | I134: FLEGG | K134: EQUID | N134: McILVEEN | Q134: ROGAN | W134: PRESTON | X134: 1 | Y134: 2 | Z134: 0 | AA134: 268 | AB134: 309 | AC134: 86.73 | AD134: 4
A135: PRAHRAN | C135: HILL | F135: McCULLOCH | I135: WALSH | K135: MORROW | N135: O'BRIEN | Q135: JONES | W135: BRUNSWICK | X135: 1 | Y135: 2 | Z135: 0 | AA135: 235 | AB135: 272 | AC135: 86.397058823529406 | AD135: 4
A136: GOALKICKERS | W136: PORT MELBOURNE | X136: 1 | Y136: 2 | Z136: 0 | AA136: 251 | AB136: 293 | AC136: 85.665529010238913 | AD136: 4
A137: COBURG | C137: JAMES 6 | E137: JORGENSON 5 | H137: CLAPTON 4 | K137: ROGAN 2 | M137: CONDON | O137: McILVEEN | Q137: FEWKES | W137: YARRAVILLE | X137: 1 | Y137: 2 | Z137: 0 | AA137: 227 | AB137: 365 | AC137: 62.19178082191781 | AD137: 4
A138: PRAHRAN | C138: McCULLOCH 6 | F138: O'BRIEN 3 | I138: FERGEUS 3 | L138: CAMPBELL 2 | O138: JONES 2 | Q138: BURGESS | W138: NORTHCOTE | X138: 0 | Y138: 3 | Z138: 0 | AA138: 297 | AB138: 338 | AC138: 87.87 | AD138: 0
A140: CAMBERWELL | C140: 0 | D140: 1 | E140: =C140*6+D140 -> 1 | G140: 5 | H140: 6 | I140: =G140*6+H140 -> 36 | K140: 8 | L140: 8 | M140: =K140*6+L140 -> 56 | O140: 14 | P140: 12 | Q140: =O140*6+P140 -> 96 | S140: YARRAVILLE
A141: YARRAVILLE | C141: 6 | D141: 9 | E141: =C141*6+D141 -> 45 | G141: 7 | H141: 9 | I141: =G141*6+H141 -> 51 | K141: 9 | L141: 14 | M141: =K141*6+L141 -> 68 | O141: 9 | P141: 17 | Q141: =O141*6+P141 -> 71 | S141: SMITHWICK
A142: BEST PLAYERS
A143: CAMBERWELL | C143: STUBBS | F143: BOHAN | I143: SHARPLES | L143: MILLER | N143: HERBERT | Q143: UNSTEAD
A144: YARRAVILLE | C144: RUDDELL | F144: TURNER | I144: McASEY | L144: SALT | N144: MILLER | Q144: HART
A145: GOALKICKERS
A146: CAMBERWELL | C146: BOHAN 4 | F146: FINNEGAN 3 | I146: MILGATE 2 | L146: HERBERT 2 | N146: STUBBS 2 | Q146: ROCHFORD
A147: YARRAVILLE | C147: PHILLIPS 2 | F147: MILLER 2 | I147: THOMAS | K147: McDONALD | N147: RUDDELL | P147: ROHLEDER | R147: TURNER
A149: BRUNSWICK | C149: 3 | D149: 6 | E149: =C149*6+D149 -> 24 | G149: 4 | H149: 10 | I149: =G149*6+H149 -> 34 | K149: 7 | L149: 19 | M149: =K149*6+L149 -> 61 | O149: 9 | P149: 21 | Q149: =O149*6+P149 -> 75 | S149: BRUNSWICK
A150: SANDRINGHAM | C150: 2 | D150: 1 | E150: =C150*6+D150 -> 13 | G150: 3 | H150: 5 | I150: =G150*6+H150 -> 23 | K150: 6 | L150: 6 | M150: =K150*6+L150 -> 42 | O150: 9 | P150: 9 | Q150: =O150*6+P150 -> 63 | S150: JOHNS
A151: BEST PLAYERS
A152: BRUNSWICK | C152: McIVOR | F152: PRIESTLEY | I152: SHAW | L152: GLASSCOTT | O152: HENRYS | Q152: CROUCH
A153: SANDRINGHAM | C153: TOYNE | F153: WEBB | I153: HISCOCK | L153: CERINI | O153: McLEOD | Q153: DEMPSTER
A154: GOALKICKERS
A155: BRUNSWICK | C155: NEILSON 3 | F155: CROUCH 2 | I155: HORDER | K155: SMITH | M155: KUHL | O155: SHAW
A156: SANDRINGHAM | C156: HISCOCK 4 | F156: B HARPER 2 | I156: CERINI | K156: McLEOD | M156: TOYNE
A158: PRESTON | C158: 1 | D158: 0 | E158: =C158*6+D158 -> 6 | G158: 10 | H158: 6 | I158: =G158*6+H158 -> 66 | K158: 11 | L158: 8 | M158: =K158*6+L158 -> 74 | O158: 15 | P158: 13 | Q158: =O158*6+P158 -> 103 | S158: PRESTON
A159: NORTHCOTE | C159: 5 | D159: 7 | E159: =C159*6+D159 -> 37 | G159: 7 | H159: 7 | I159: =G159*6+H159 -> 49 | K159: 12 | L159: 14 | M159: =K159*6+L159 -> 86 | O159: 12 | P159: 17 | Q159: =O159*6+P159 -> 89 | S159: STREETER
A160: BEST PLAYERS
A161: PRESTON | C161: HINES | F161: FITT | I161: SWEET | K161: MEARS | N161: POTTER | Q161: NATHAN
A162: NORTHCOTE | C162: HISCOX | F162: PAWSEY | I162: DUNCAN | K162: R STABB | N162: CASPAR | Q162: WALLIS
A163: GOALKICKERS
A164: PRESTON | C164: POTTER 3 | F164: NATHAN 3 | I164: GOLDIN 2 | K164: BLACKMAN 2 | N164: MEARS | P164: FITT | Q164: CONNELLY | S164: HINES | V164: WHITFIELD
A165: NORTHCOTE | C165: PAWSEY 5 | F165: DUNCAN 2 | I165: R STABB | K165: WHITE | M165: MURPHY | O165: NASH | Q165: WHITECHURCH
A167: PORT MELBOURNE | C167: 1 | D167: 4 | E167: =C167*6+D167 -> 10 | G167: 5 | H167: 9 | I167: =G167*6+H167 -> 39 | K167: 8 | L167: 10 | M167: =K167*6+L167 -> 58 | O167: 13 | P167: 13 | Q167: =O167*6+P167 -> 91 | S167: PORT MELBOURNE
A168: WILLIAMSTOWN | C168: 2 | D168: 2 | E168: =C168*6+D168 -> 14 | G168: 6 | H168: 5 | I168: =G168*6+H168 -> 41 | K168: 8 | L168: 10 | M168: =K168*6+L168 -> 58 | O168: 11 | P168: 11 | Q168: =O168*6+P168 -> 77 | S168: WRIGHT
A169: BEST PLAYERS
A170: PORT MELBOURNE | C170: HOUSTON | F170: TRAINER | I170: REYNOLDS | L170: CLEARY | N170: BUTCHER | Q170: WILSON
A171: WILLIAMSTOWN | C171: McPHERSON | F171: WALKER | I171: MOLYNEUX | L171: SAMPSON | N171: K TAYLOR | Q171: WILLIAMS
A172: GOALKICKERS
A173: PORT MELBOURNE | C173: HOUSTON 4 | F173: TRAINER 3 | I173: CULPH 2 | K173: LEWIS 2 | M173: WOODBRIDGE | P173: REYNOLDS
A174: WILLIAMSTOWN | C174: TODD 6 | F174: McPHERSON 2 | I174: McRAE | K174: MATTHEWS | N174: REDMOND
A176: ROUND 4 | D176: 7TH MAY | H176: WEATHER | K176: SOUTH WIND COLD FINE GROUNDS WET | S176: PLAYED AT
D177: 1ST QTR | H177: 2ND QTR | L177: 3RD QTR | P177: FINAL | S177: WILLIAMSTOWN
A178: WILLIAMSTOWN | C178: 4 | D178: 5 | E178: =C178*6+D178 -> 29 | G178: 7 | H178: 6 | I178: =G178*6+H178 -> 48 | K178: 10 | L178: 14 | M178: =K178*6+L178 -> 74 | O178: 15 | P178: 16 | Q178: =O178*6+P178 -> 106 | S178: UMPIRE | X178: LADDER | AB178: ROUND | AD178: 4
A179: PRAHRAN | C179: 4 | D179: 4 | E179: =C179*6+D179 -> 28 | G179: 9 | H179: 7 | I179: =G179*6+H179 -> 61 | K179: 11 | L179: 7 | M179: =K179*6+L179 -> 73 | O179: 14 | P179: 9 | Q179: =O179*6+P179 -> 93 | S179: WRIGHT
A180: BEST PLAYERS | W180: TEAM | X180: W | Y180: L | Z180: D | AA180: FOR | AB180: AGST | AC180: % | AD180: PTS
A181: WILLIAMSTOWN | C181: MOLYNEUX | F181: COLLINS | I181: McPHERSON | L181: STRANG | N181: TODD | Q181: REDMOND
A182: PRAHRAN | C182: O'BRIEN | F182: McCULLOCH | I182: MORROW | L182: BURGESS | N182: FERGEUS | Q182: CAMPBELL | W182: BRIGHTON | X182: 4 | Y182: 0 | Z182: 0 | AA182: 413 | AB182: 326 | AC182: 126.68711656441718 | AD182: 16
A183: GOALKICKERS | W183: OAKLEIGH | X183: 3 | Y183: 1 | Z183: 0 | AA183: 506 | AB183: 298 | AC183: 169.79865771812081 | AD183: 12
A184: WILLIAMSTOWN | C184: TODD 5 | E184: COLLINS 4 | G184: McPHERSON 3 | J184: REDMOND 2 | M184: BERNARD | W184: WILLIAMSTOWN | X184: 3 | Y184: 1 | Z184: 0 | AA184: 371 | AB184: 347 | AC184: 106.9164265129683 | AD184: 12
A185: PRAHRAN | C185: BURGESS 4 | F185: O'BRIEN 3 | I185: MCCULLOCH 3 | L185: FERGEUS 2 | N185: SHRIMPTON | Q185: CAMPBELL | W185: COBURG | X185: 3 | Y185: 1 | Z185: 0 | AA185: 430 | AB185: 406 | AC185: 107.88 | AD185: 12
A187: BRIGHTON | C187: 0 | D187: 2 | E187: =C187*6+D187 -> 2 | G187: 4 | H187: 5 | I187: =G187*6+H187 -> 29 | K187: 7 | L187: 8 | M187: =K187*6+L187 -> 50 | O187: 12 | P187: 15 | Q187: =O187*6+P187 -> 87 | S187: CAMBERWELL | W187: PRAHRAN | X187: 2 | Y187: 2 | Z187: 0 | AA187: 455 | AB187: 397 | AC187: 114.61 | AD187: 8
A188: CAMBERWELL | C188: 7 | D188: 7 | E188: =C188*6+D188 -> 49 | G188: 8 | H188: 9 | I188: =G188*6+H188 -> 57 | K188: 11 | L188: 15 | M188: =K188*6+L188 -> 81 | O188: 11 | P188: 16 | Q188: =O188*6+P188 -> 82 | S188: JOHNS | W188: SANDRINGHAM | X188: 2 | Y188: 2 | Z188: 0 | AA188: 349 | AB188: 352 | AC188: 99.147727272727266 | AD188: 8
A189: BEST PLAYERS | W189: BRUNSWICK | X189: 2 | Y189: 2 | Z189: 0 | AA189: 299 | AB189: 329 | AC189: 90.881458966565347 | AD189: 8
A190: BRIGHTON | C190: NEW | F190: E TURNER | I190: PINDER | L190: McASEY | N190: PICKERING | Q190: WILLIAMSON | W190: CAMBERWELL | X190: 2 | Y190: 2 | Z190: 0 | AA190: 341 | AB190: 400 | AC190: 85.25 | AD190: 8
A191: CAMBERWELL | C191: SHARPLES | F191: FINNEGAN | I191: BENBOW | L191: STUBBS | N191: MILLER | Q191: KENNEDY | W191: PORT MELBOURNE | X191: 1 | Y191: 3 | Z191: 0 | AA191: 329 | AB191: 385 | AC191: 85.454545454545453 | AD191: 4
A192: GOALKICKERS | W192: PRESTON | X192: 1 | Y192: 3 | Z192: 0 | AA192: 355 | AB192: 417 | AC192: 85.13 | AD192: 4
A193: BRIGHTON | C193: WARBURTON 3 | F193: BURKE 3 | H193: McINDOE 2 | J193: PLUNKETT | M193: PICKERING | O193: ADAMSON | Q193: PINDER | W193: YARRAVILLE | X193: 1 | Y193: 3 | Z193: 0 | AA193: 349 | AB193: 492 | AC193: 70.934959349593498 | AD193: 4
A194: CAMBERWELL | C194: FINNEGAN 3 | F194: ROCHFORD 2 | I194: BOHAN 2 | K194: MILLER | M194: MILGATE | O194: JENSEN | Q194: FURLONG | W194: NORTHCOTE | X194: 0 | Y194: 4 | Z194: 0 | AA194: 354 | AB194: 402 | AC194: 88.06 | AD194: 0
A196: OAKLEIGH | C196: 1 | D196: 2 | E196: =C196*6+D196 -> 8 | G196: 7 | H196: 9 | I196: =G196*6+H196 -> 51 | K196: 13 | L196: 14 | M196: =K196*6+L196 -> 92 | O196: 15 | P196: 18 | Q196: =O196*6+P196 -> 108 | S196: OAKLEIGH
A197: PRESTON | C197: 6 | D197: 4 | E197: =C197*6+D197 -> 40 | G197: 6 | H197: 5 | I197: =G197*6+H197 -> 41 | K197: 9 | L197: 6 | M197: =K197*6+L197 -> 60 | O197: 13 | P197: 9 | Q197: =O197*6+P197 -> 87 | S197: JONES
A198: BEST PLAYERS
A199: OAKLEIGH | C199: BOYLE | F199: TEMME | I199: JORY | K199: BEARD | N199: BAXTER | Q199: PAY
A200: PRESTON | C200: MEARS | F200: BLACKMAN | I200: BRYCE | K200: MASLEN | N200: GOLDIN | Q200: WHITFIELD
A201: GOALKICKERS
A202: OAKLEIGH | C202: WENN 4 | F202: PAY 3 | H202: RYAN 2 | J202: SMEATON 2 | M202: RUNDELL 2 | P202: JORY | R202: R FINN
A203: PRESTON | C203: GOLDIN 5 | F203: NATHAN 4 | I203: PRITCHARD 2 | L203: MEARS | N203: BROWN
A205: SANDRINGHAM | C205: 1 | D205: 1 | E205: =C205*6+D205 -> 7 | G205: 5 | H205: 9 | I205: =G205*6+H205 -> 39 | K205: 8 | L205: 14 | M205: =K205*6+L205 -> 62 | O205: 12 | P205: 20 | Q205: =O205*6+P205 -> 92 | S205: BEACH ROAD
A206: PORT MELBOURNE | C206: 3 | D206: 5 | E206: =C206*6+D206 -> 23 | G206: 5 | H206: 7 | I206: =G206*6+H206 -> 37 | K206: 10 | L206: 11 | M206: =K206*6+L206 -> 71 | O206: 11 | P206: 12 | Q206: =O206*6+P206 -> 78 | S206: STREETER
A207: BEST PLAYERS
A208: SANDRINGHAM | C208: R HARPER | F208: GRAMBEAU | I208: B HARPER | L208: McFEE | N208: TOYNE | Q208: HISCOCK
A209: PORT MELBOURNE | C209: CULPH | F209: CLEARY | I209: HOUSTON | L209: TRAINER | N209: WOODBRIDGE | Q209: MULLANE
A210: GOALKICKERS
A211: SANDRINGHAM | C211: HISCOCK 3 | F211: HOLMES 3 | I211: B HARPER 2 | L211: R HARPER 2 | O211: GRAMBEAU | R211: McFEE
A212: PORT MELBOURNE | C212: HOUSTON 3 | F212: TRAINER 3 | I212: CULPH 2 | K212: LEWIS 2 | M212: WOODBRIDGE
A214: BRUNSWICK | C214: 0 | D214: 0 | E214: =C214*6+D214 -> 0 | G214: 4 | H214: 2 | I214: =G214*6+H214 -> 26 | K214: 6 | L214: 3 | M214: =K214*6+L214 -> 39 | O214: 10 | P214: 4 | Q214: =O214*6+P214 -> 64 | S214: NORTHCOTE
A215: NORTHCOTE | C215: 2 | D215: 4 | E215: =C215*6+D215 -> 16 | G215: 4 | H215: 7 | I215: =G215*6+H215 -> 31 | K215: 4 | L215: 12 | M215: =K215*6+L215 -> 36 | O215: 7 | P215: 15 | Q215: =O215*6+P215 -> 57 | S215: IRVING
A216: BEST PLAYERS
A217: BRUNSWICK | C217: SHAW | F217: GLASSCOTT | I217: HARDIMAN | L217: SPENCER | O217: SMITH | Q217: McIVOR
A218: NORTHCOTE | C218: PAWSEY | F218: HINES | I218: McINTOSH | L218: STABB | O218: BAKER | Q218: CASPAR
A219: GOALKICKERS
A220: BRUNSWICK | C220: HARDIMAN 3 | F220: SPENCER 3 | I220: PRIESTLEY | L220: NEILSON | N220: SMITH | P220: CROUCH
A221: NORTHCOTE | C221: PAWSEY 3 | F221: DUNCAN 2 | I221: McINTOSH 2
A223: COBURG | C223: 4 | D223: 2 | E223: =C223*6+D223 -> 26 | G223: 10 | H223: 10 | I223: =G223*6+H223 -> 70 | K223: 12 | L223: 14 | M223: =K223*6+L223 -> 86 | O223: 18 | P223: 19 | Q223: =O223*6+P223 -> 127 | S223: COBURG
A224: YARRAVILLE | C224: 6 | D224: 4 | E224: =C224*6+D224 -> 40 | G224: 9 | H224: 7 | I224: =G224*6+H224 -> 61 | K224: 16 | L224: 11 | M224: =K224*6+L224 -> 107 | O224: 18 | P224: 14 | Q224: =O224*6+P224 -> 122 | S224: BARNES
A225: BEST PLAYERS
A226: COBURG | C226: JORGENSON | F226: JAMES | I226: EQUID | L226: CONDON | O226: HEEPS | Q226: CLAPTON
A227: YARRAVILLE | C227: COLLINS | F227: RUDDELL | I227: MILLER | L227: SALT | O227: MASON | Q227: ORR
A228: GOALKICKERS
A229: COBURG | C229: JORGENSON 7 | F229: JAMES 5 | I229: CLAPTON 3 | L229: CONDON | N229: ROGAN | P229: FLEGG
A230: YARRAVILLE | C230: COLLINS 6 | F230: RUDDELL 4 | I230: MILLER 3 | K230: TESTRAIL 2 | N230: McASEY 2 | Q230: BERNARD
A232: ROUND 5 | D232: 14TH MAY | J232: WEATHER | M232: NORTH WEST WIND DULL | S232: PLAYED AT
D233: 1ST QTR | H233: 2ND QTR | L233: 3RD QTR | P233: FINAL | S233: WILLIAMSTOWN
A234: WILLIAMSTOWN | C234: 6 | D234: 4 | E234: =C234*6+D234 -> 40 | G234: 8 | H234: 5 | I234: =G234*6+H234 -> 53 | K234: 12 | L234: 9 | M234: =K234*6+L234 -> 81 | O234: 14 | P234: 11 | Q234: =O234*6+P234 -> 95 | S234: UMPIRE | X234: LADDER | AB234: ROUND | AD234: 5
A235: COBURG | C235: 1 | D235: 1 | E235: =C235*6+D235 -> 7 | G235: 7 | H235: 6 | I235: =G235*6+H235 -> 48 | K235: 7 | L235: 6 | M235: =K235*6+L235 -> 48 | O235: 13 | P235: 9 | Q235: =O235*6+P235 -> 87 | S235: BARNES
A236: BEST PLAYERS | W236: TEAM | X236: W | Y236: L | Z236: D | AA236: FOR | AB236: AGST | AC236: % | AD236: PTS
A237: WILLIAMSTOWN | C237: MOLNEUX | F237: MATTHEWS | I237: REDMOND | L237: STRANG | N237: WILLIAMS | Q237: McPHERSON
A238: COBURG | C238: CLAPTON | F238: WILSON | I238: ROGAN | L238: WALSH | N238: EQUID | Q238: CONDON | W238: BRIGHTON | X238: 5 | Y238: 0 | Z238: 0 | AA238: 548 | AB238: 437 | AC238: 125.40045766590389 | AD238: 20
A239: GOALKICKERS | W239: OAKLEIGH | X239: 4 | Y239: 1 | Z239: 0 | AA239: 597 | AB239: 382 | AC239: 156.282722513089 | AD239: 16
A240: WILLIAMSTOWN | C240: TODD 4 | F240: COLLINS 4 | I240: MOLYNEUX 4 | L240: BERNARD | O240: McPHERSON | W240: WILLIAMSTOWN | X240: 4 | Y240: 1 | Z240: 0 | AA240: 466 | AB240: 434 | AC240: 107.37327188940093 | AD240: 16
A241: COBURG | C241: JORGENSON 4 | F241: JAMES 3 | I241: WALSH 2 | K241: EGAN | M241: CLAPTON | P241: EQUID | R241: CONDON | W241: PRAHRAN | X241: 3 | Y241: 2 | Z241: 0 | AA241: 565 | AB241: 503 | AC241: 112.33 | AD241: 12
A243: PRAHRAN | C243: 3 | D243: 2 | E243: =C243*6+D243 -> 20 | G243: 9 | H243: 13 | I243: =G243*6+H243 -> 67 | K243: 10 | L243: 15 | M243: =K243*6+L243 -> 75 | O243: 15 | P243: 20 | Q243: =O243*6+P243 -> 110 | S243: TOORAK PARK | W243: COBURG | X243: 3 | Y243: 2 | Z243: 0 | AA243: 517 | AB243: 501 | AC243: 103.19 | AD243: 12
A244: SANDRINGHAM | C244: 5 | D244: 4 | E244: =C244*6+D244 -> 34 | G244: 6 | H244: 8 | I244: =G244*6+H244 -> 44 | K244: 14 | L244: 13 | M244: =K244*6+L244 -> 97 | O244: 15 | P244: 16 | Q244: =O244*6+P244 -> 106 | S244: THOMAS | W244: SANDRINGHAM | X244: 2 | Y244: 3 | Z244: 0 | AA244: 455 | AB244: 462 | AC244: 98.484848484848484 | AD244: 8
A245: BEST PLAYERS | W245: BRUNSWICK | X245: 2 | Y245: 3 | Z245: 0 | AA245: 383 | AB245: 420 | AC245: 91.19047619047619 | AD245: 8
A246: PRAHRAN | C246: WALSH | F246: WOOD | I246: FERGEUS | L246: KEEGAN | N246: JONES | Q246: BURGESS | W246: PRESTON | X246: 2 | Y246: 3 | Z246: 0 | AA246: 442 | AB246: 486 | AC246: 90.94736842105263 | AD246: 8
A247: SANDRINGHAM | C247: McFEE | F247: RUSSELL | I247: HISCOCK | L247: TOYNE | N247: R HARPER | Q247: B HARPER | W247: PORT MELBOURNE | X247: 2 | Y247: 3 | Z247: 0 | AA247: 411 | AB247: 462 | AC247: 88.961038961038966 | AD247: 8
A248: GOALKICKERS | W248: CAMBERWELL | X248: 2 | Y248: 3 | Z248: 0 | AA248: 410 | AB248: 487 | AC248: 84.188911704312119 | AD248: 8
A249: PRAHRAN | C249: McCULLOCH 4 | F249: KEEGAN 4 | I249: FERGEUS 3 | L249: WOOD 2 | N249: BURGESS 2 | W249: YARRAVILLE | X249: 1 | Y249: 4 | Z249: 0 | AA249: 460 | AB249: 627 | AC249: 73.365231259968098 | AD249: 4
A250: SANDRINGHAM | C250: HISCOCK 5 | F250: B HARPER 3 | I250: R HARPER 2 | L250: McFEE 2 | N250: TOYNE | P250: ANDREW | R250: CERINI | W250: NORTHCOTE | X250: 0 | Y250: 5 | Z250: 0 | AA250: 431 | AB250: 484 | AC250: 89.05 | AD250: 0
A252: OAKLEIGH | C252: 5 | D252: 2 | E252: =C252*6+D252 -> 32 | G252: 7 | H252: 5 | I252: =G252*6+H252 -> 47 | K252: 11 | L252: 6 | M252: =K252*6+L252 -> 72 | O252: 13 | P252: 13 | Q252: =O252*6+P252 -> 91 | S252: BRUNSWICK
A253: BRUNSWICK | C253: 1 | D253: 10 | E253: =C253*6+D253 -> 16 | G253: 5 | H253: 14 | I253: =G253*6+H253 -> 44 | K253: 9 | L253: 21 | M253: =K253*6+L253 -> 75 | O253: 10 | P253: 24 | Q253: =O253*6+P253 -> 84 | S253: MILLER
A254: BEST PLAYERS
A255: OAKLEIGH | C255: TEMME | F255: BEARD | I255: WENN | L255: R FINN | N255: PERKINS | Q255: RYAN
A256: BRUNSWICK | C256: SHAW | F256: GEISLER | I256: WHELAN | L256: SMITH | N256: HARDIMAN | Q256: PRIESTLEY
A257: GOALKICKERS
A258: OAKLEIGH | C258: SCOTT 4 | F258: R FINN 3 | I258: WENN 3 | K258: SMEATON | N258: JORY | P258: PAY
A259: BRUNSWICK | C259: HARDIMAN 6 | F259: SPENCER | I259: SMITH | K259: CROUCH | M259: PRIESTLEY
A261: PRESTON | C261: 3 | D261: 7 | E261: =C261*6+D261 -> 25 | G261: 4 | H261: 9 | I261: =G261*6+H261 -> 33 | K261: 11 | L261: 13 | M261: =K261*6+L261 -> 79 | O261: 12 | P261: 15 | Q261: =O261*6+P261 -> 87 | S261: PRESTON
A262: CAMBERWELL | C262: 0 | D262: 3 | E262: =C262*6+D262 -> 3 | G262: 1 | H262: 11 | I262: =G262*6+H262 -> 17 | K262: 3 | L262: 16 | M262: =K262*6+L262 -> 34 | O262: 8 | P262: 21 | Q262: =O262*6+P262 -> 69 | S262: WRIGHT
A263: BEST PLAYERS
A264: PRESTON | C264: BLACKMAN | F264: HARRISON | I264: PRITCHARD | L264: HINES | O264: GOLDIN | R264: SWEET
A265: CAMBERWELL | C265: BOHAN | F265: HERBERT | I265: MILLER | L265: FINNEGAN | O265: SHARPLES | R265: UNSTEAD
A266: GOALKICKERS
A267: PRESTON | C267: PRITCHARD 5 | F267: NATHAN 3 | I267: GOLDIN 2 | L267: MEARS | N267: BLACKMAN
A268: CAMBERWELL | C268: HERBERT 2 | F268: BOHAN 2 | I268: CRACKNELL | L268: FURLONG | N268: FINNEGAN | Q268: JOUBERT
A270: PORT MELBOURNE | C270: 2 | D270: 2 | E270: =C270*6+D270 -> 14 | G270: 6 | H270: 4 | I270: =G270*6+H270 -> 40 | K270: 8 | L270: 7 | M270: =K270*6+L270 -> 55 | O270: 12 | P270: 10 | Q270: =O270*6+P270 -> 82 | S270: PORT MELBOURNE
A271: NORTHCOTE | C271: 4 | D271: 4 | E271: =C271*6+D271 -> 28 | G271: 4 | H271: 6 | I271: =G271*6+H271 -> 30 | K271: 11 | L271: 10 | M271: =K271*6+L271 -> 76 | O271: 11 | P271: 11 | Q271: =O271*6+P271 -> 77 | S271: JONES
A272: BEST PLAYERS
A273: PORT MELBOURNE | C273: DRINAN | F273: CULPH | I273: MURRAY | L273: TRAINER | N273: CLEARY | Q273: LEWIS
A274: NORTHCOTE | C274: R STABB | F274: PAWSEY | I274: McINTOSH | L274: HISCOX | N274: CASPAR | Q274: HINES
A275: GOALKICKERS
A276: PORT MELBOURNE | C276: CULPH 6 | F276: TRAINER 2 | I276: WOODBRIDGE 2 | L276: HOUSTON | N276: BLOOM
A277: NORTHCOTE | C277: PAWSEY 3 | F277: McINTOSH 3 | I277: WHITE 2 | K277: KEN MURPHY | N277: R STABB | P277: WHITECHURCH
A279: BRIGHTON | C279: 4 | D279: 1 | E279: =C279*6+D279 -> 25 | G279: 12 | H279: 11 | I279: =G279*6+H279 -> 83 | K279: 13 | L279: 13 | M279: =K279*6+L279 -> 91 | O279: 20 | P279: 15 | Q279: =O279*6+P279 -> 135 | S279: ELSTERNWICK PARK
A280: YARRAVILLE | C280: 6 | D280: 11 | E280: =C280*6+D280 -> 47 | G280: 7 | H280: 14 | I280: =G280*6+H280 -> 56 | K280: 11 | L280: 25 | M280: =K280*6+L280 -> 91 | O280: 14 | P280: 27 | Q280: =O280*6+P280 -> 111 | S280: IRVING
A281: BEST PLAYERS
A282: BRIGHTON | C282: HALL | F282: McINDOE | I282: McASEY | L282: HOWE | N282: LUMMIS | Q282: PICKERING
A283: YARRAVILLE | C283: MILLER | F283: SALT | I283: YATES | L283: RUDDELL | N283: McASEY | Q283: MALBON
A284: GOALKICKERS
A285: BRIGHTON | C285: McINDOE 5 | F285: WARBURTON 5 | J285: LUMMIS 3 | M285: BURKE 2 | O285: HOWE 2 | Q285: ADAMSON | S285: PLUNKETT | W285: PICKERING
A286: YARRAVILLE | C286: MILLER 4 | F286: S McASEY 3 | I286: COLLINS 2 | L286: RUDDELL 2 | O286: BERNARD | Q286: McDONALD | T286: TESTRAIL
A288: ROUND 6 | D288: 21ST MAY | J288: WEATHER | M288: SOUTH EAST WIND FINE AND SUNNY | S288: PLAYED AT
D289: 1ST QTR | H289: 2ND QTR | L289: 3RD QTR | P289: FINAL | S289: COBURG
A290: BRIGHTON | C290: 2 | D290: 6 | E290: =C290*6+D290 -> 18 | G290: 8 | H290: 8 | I290: =G290*6+H290 -> 56 | K290: 13 | L290: 10 | M290: =K290*6+L290 -> 88 | O290: 16 | P290: 14 | Q290: =O290*6+P290 -> 110 | S290: UMPIRE | X290: LADDER | AB290: ROUND | AD290: 6
A291: COBURG | C291: 3 | D291: 1 | E291: =C291*6+D291 -> 19 | G291: 6 | H291: 3 | I291: =G291*6+H291 -> 39 | K291: 10 | L291: 6 | M291: =K291*6+L291 -> 66 | O291: 12 | P291: 10 | Q291: =O291*6+P291 -> 82 | S291: IRVING
A292: BEST PLAYERS | W292: TEAM | X292: W | Y292: L | Z292: D | AA292: FOR | AB292: AGST | AC292: % | AD292: PTS
A293: BRIGHTON | C293: CRAVEN | F293: E TURNER | I293: PINDER | L293: McASEY | N293: WILLIAMSON | Q293: WARBURTON
A294: COBURG | C294: JORGENSON | F294: CAHIR | I294: STARBUCK | L294: EQUID | N294: WILKINSON | Q294: FLEGG | W294: BRIGHTON | X294: 6 | Y294: 0 | Z294: 0 | AA294: 658 | AB294: 519 | AC294: 126.78227360308286 | AD294: 24
A295: GOALKICKERS | W295: WILLIAMSTOWN | X295: 5 | Y295: 1 | Z295: 0 | AA295: 570 | AB295: 490 | AC295: 116.32653061224489 | AD295: 20
A296: BRIGHTON | C296: WARBURTON 7 | F296: PLUNKETT 3 | I296: McINDOE 2 | L296: ADAMSON 2 | O296: WILLIAMSON | R296: HOWE | W296: OAKLEIGH | X296: 4 | Y296: 2 | Z296: 0 | AA296: 683 | AB296: 473 | AC296: 144.39746300211416 | AD296: 16
A297: COBURG | C297: JORGENSON 6 | F297: EQUID 2 | I297: STARBUCK | L297: ROGAN | N297: CLAPTON | Q297: JAMES | W297: PRAHRAN | X297: 3 | Y297: 3 | Z297: 0 | AA297: 644 | AB297: 625 | AC297: 103.04 | AD297: 12
A299: WILLIAMSTOWN | C299: 2 | D299: 2 | E299: =C299*6+D299 -> 14 | G299: 5 | H299: 10 | I299: =G299*6+H299 -> 40 | K299: 6 | L299: 16 | M299: =K299*6+L299 -> 52 | O299: 14 | P299: 20 | Q299: =O299*6+P299 -> 104 | S299: BEACH ROAD | W299: COBURG | X299: 3 | Y299: 3 | Z299: 0 | AA299: 599 | AB299: 611 | AC299: 98.04 | AD299: 12
A300: SANDRINGHAM | C300: 3 | D300: 2 | E300: =C300*6+D300 -> 20 | G300: 5 | H300: 2 | I300: =G300*6+H300 -> 32 | K300: 8 | L300: 7 | M300: =K300*6+L300 -> 55 | O300: 8 | P300: 8 | Q300: =O300*6+P300 -> 56 | S300: WRIGHT | W300: BRUNSWICK | X300: 3 | Y300: 3 | Z300: 0 | AA300: 461 | AB300: 476 | AC300: 96.85 | AD300: 12
A301: BEST PLAYERS | W301: PORT MELBOURNE | X301: 3 | Y301: 3 | Z301: 0 | AA301: 502 | AB301: 548 | AC301: 91.605839416058387 | AD301: 12
A302: WILLIAMSTOWN | C302: FEATHERBY | F302: REDMOND | I302: MOLYNEUX | L302: DANCKERT | O302: COLLINS | Q302: STRANG | W302: SANDRINGHAM | X302: 2 | Y302: 4 | Z302: 0 | AA302: 511 | AB302: 566 | AC302: 90.282685512367493 | AD302: 8
A303: SANDRINGHAM | C303: McFEE | F303: B HARPER | I303: RUSSELL | L303: HEADON | O303: MOLLAN | Q303: M GRAMBEAU | W303: PRESTON | X303: 2 | Y303: 4 | Z303: 0 | AA303: 523 | AB303: 591 | AC303: 88.49 | AD303: 8
A304: GOALKICKERS | W304: CAMBERWELL | X304: 2 | Y304: 4 | Z304: 0 | AA304: 466 | AB304: 565 | AC304: 82.48 | AD304: 8
A305: WILLIAMSTOWN | C305: TODD 5 | E305: COLLINS 4 | H305: SALVAS 2 | J305: ABBERTON | M305: REDMOND | P305: McPHERSON | W305: YARRAVILLE | X305: 2 | Y305: 4 | Z305: 0 | AA305: 565 | AB305: 708 | AC305: 79.802259887005647 | AD305: 8
A306: SANDRINGHAM | C306: R HARPER 2 | F306: B HARPER 2 | I306: M GRAMBEAU | L306: MOLAN | N306: HISCOCK | P306: McFEE | W306: NORTHCOTE | X306: 1 | Y306: 5 | Z306: 0 | AA306: 553 | AB306: 563 | AC306: 98.22 | AD306: 4
A308: BRUNSWICK | C308: 4 | D308: 5 | E308: =C308*6+D308 -> 29 | G308: 7 | H308: 7 | I308: =G308*6+H308 -> 49 | K308: 10 | L308: 11 | M308: =K308*6+L308 -> 71 | O308: 11 | P308: 12 | Q308: =O308*6+P308 -> 78 | S308: CAMBERWELL
A309: CAMBERWELL | C309: 1 | D309: 1 | E309: =C309*6+D309 -> 7 | G309: 2 | H309: 6 | I309: =G309*6+H309 -> 18 | K309: 2 | L309: 9 | M309: =K309*6+L309 -> 21 | O309: 6 | P309: 20 | Q309: =O309*6+P309 -> 56 | S309: JONES
A310: BEST PLAYERS
A311: BRUNSWICK | C311: WHELAN | F311: SHAW | I311: PRIESTLEY | L311: CROUCH | N311: HARDIMAN | Q311: SPENCER
A312: CAMBERWELL | C312: STUBBS | F312: DUFF | I312: CRACKNELL | L312: JENSEN | N312: ROCHFORD | Q312: HERBERT
A313: GOALKICKERS
A314: BRUNSWICK | C314: SMITH 2 | E314: HARDIMAN 2 | H314: PRIESTLEY 2 | K314: NEILSON | M314: POWER | O314: SPENCER | Q314: WARD | S314: WHELAN
A315: CAMBERWELL | C315: BOHAN 2 | F315: GIBBS | H315: CRACKNELL | K315: DUFF | M315: STUBBS
A317: YARRAVILLE | C317: 3 | D317: 2 | E317: =C317*6+D317 -> 20 | G317: 7 | H317: 6 | I317: =G317*6+H317 -> 48 | K317: 12 | L317: 7 | M317: =K317*6+L317 -> 79 | O317: 16 | P317: 9 | Q317: =O317*6+P317 -> 105 | S317: YARRAVILLE
A318: PRESTON | C318: 4 | D318: 4 | E318: =C318*6+D318 -> 28 | G318: 8 | H318: 7 | I318: =G318*6+H318 -> 55 | K318: 8 | L318: 9 | M318: =K318*6+L318 -> 57 | O318: 11 | P318: 15 | Q318: =O318*6+P318 -> 81 | S318: H BARNES
A319: BEST PLAYERS
A320: YARRAVILLE | C320: TESTRAIL | F320: BERNARD | I320: GARLICK | L320: McASEY | O320: COLLINS | Q320: RUDDELL
A321: PRESTON | C321: BLACKMAN | F321: BRYCE | I321: NATHAN | L321: PRITCHARD | O321: MEARS | Q321: MEESE
A322: GOALKICKERS
A323: YARRAVILLE | C323: TESTRAIL 6 | F323: COLLINS 5 | I323: McASEY 2 | L323: BERNARD | N323: MILLER | P323: RUDDELL
A324: PRESTON | C324: PRITCHARD 5 | F324: NATHAN 2 | I324: CLIFFORD 2 | L324: MEARS | N324: GOLDIN
A326: PORT MELBOURNE | C326: 6 | D326: 6 | E326: =C326*6+D326 -> 42 | G326: 7 | H326: 7 | I326: =G326*6+H326 -> 49 | K326: 12 | L326: 13 | M326: =K326*6+L326 -> 85 | O326: 13 | P326: 13 | Q326: =O326*6+P326 -> 91 | S326: OAKLEIGH
A327: OAKLEIGH | C327: 1 | D327: 2 | E327: =C327*6+D327 -> 8 | G327: 4 | H327: 13 | I327: =G327*6+H327 -> 37 | K327: 5 | L327: 19 | M327: =K327*6+L327 -> 49 | O327: 10 | P327: 26 | Q327: =O327*6+P327 -> 86 | S327: THOMAS
A328: BEST PLAYERS
A329: PORT MELBOURNE | C329: CLEARY | F329: BLOOM | I329: WILSON | L329: DRINAN | N329: HOUSTON | Q329: KELSEY
A330: OAKLEIGH | C330: EDWARDS | F330: TEMME | I330: WILLIAMS | L330: DEAYTON | N330: WATSON | Q330: JORY
A331: GOALKICKERS
A332: PORT MELBOURNE | C332: HOUSTON 3 | F332: BLOOM 2 | I332: WELLS 2 | K332: LEWIS 2 | M332: MURRAY 2 | P332: BUTCHER | R332: CULPH
A333: OAKLEIGH | C333: SMEATON 4 | F333: WENN 2 | I333: R FINN 2 | K333: JORY | M333: SCOTT
A335: NORTHCOTE | C335: 6 | D335: 7 | E335: =C335*6+D335 -> 43 | G335: 11 | H335: 10 | I335: =G335*6+H335 -> 76 | K335: 16 | L335: 17 | M335: =K335*6+L335 -> 113 | O335: 17 | P335: 20 | Q335: =O335*6+P335 -> 122 | S335: NORTHCOTE
A336: PRAHRAN | C336: 1 | D336: 2 | E336: =C336*6+D336 -> 8 | G336: 8 | H336: 4 | I336: =G336*6+H336 -> 52 | K336: 9 | L336: 4 | M336: =K336*6+L336 -> 58 | O336: 12 | P336: 7 | Q336: =O336*6+P336 -> 79 | S336: STREETER
A337: BEST PLAYERS
A338: NORTHCOTE | C338: PAWSEY | F338: R STABB | I338: KEN MURPHY | L338: KINDER | O338: BRUNNEN | R338: WALLIS
A339: PRAHRAN | C339: ARMSTRONG | F339: McCULLOCH | I339: O'BRIEN | L339: MORROW | O339: CAMPBELL | R339: FERGEUS
A340: GOALKICKERS
A341: NORTHCOTE | C341: PAWSEY 5 | F341: NASH 3 | H341: WHITE 2 | J341: WOOLNOUGH 2 | M341: R STABB | O341: WALLIS | Q341: GREENWOOD | T341: BRUNNEN | W341: KEN MURPHY
A342: PRAHRAN | C342: McCULLOCH 4 | F342: BURGESS 3 | I342: O'BRIEN 3 | K342: WOOD | M342: KEEGAN
A344: ROUND 7 | D344: 28TH MAY | J344: WEATHER | M344: SOUTH BREEZE RAIN COLD DULL | S344: PLAYED AT
D345: 1ST QTR | H345: 2ND QTR | L345: 3RD QTR | P345: FINAL | S345: TOORAK PARK
A346: OAKLEIGH | C346: 4 | D346: 5 | E346: =C346*6+D346 -> 29 | G346: 8 | H346: 12 | I346: =G346*6+H346 -> 60 | K346: 12 | L346: 14 | M346: =K346*6+L346 -> 86 | O346: 17 | P346: 17 | Q346: =O346*6+P346 -> 119 | S346: UMPIRE | X346: LADDER | AB346: ROUND | AD346: 7
A347: PRAHRAN | C347: 4 | D347: 2 | E347: =C347*6+D347 -> 26 | G347: 8 | H347: 4 | I347: =G347*6+H347 -> 52 | K347: 13 | L347: 4 | M347: =K347*6+L347 -> 82 | O347: 17 | P347: 8 | Q347: =O347*6+P347 -> 110 | S347: BARNES
A348: BEST PLAYERS | W348: TEAM | X348: W | Y348: L | Z348: D | AA348: FOR | AB348: AGST | AC348: % | AD348: PTS
A349: OAKLEIGH | C349: GRAY | F349: DONNELLY | I349: BAXTER | L349: RAWLINGS | O349: RUNDELL | Q349: DEAYTON
A350: PRAHRAN | C350: McCULLOCH | F350: FERGEUS | I350: MORROW | L350: BURGESS | O350: JONES | Q350: WOOD | W350: WILLIAMSTOWN | X350: 6 | Y350: 1 | Z350: 0 | AA350: 700 | AB350: 554 | AC350: 126.35 | AD350: 24
A351: GOALKICKERS | W351: BRIGHTON | X351: 6 | Y351: 1 | Z351: 0 | AA351: 757 | AB351: 645 | AC351: 117.36434108527132 | AD351: 24
A352: OAKLEIGH | C352: SMEATON 5 | F352: WENN 4 | I352: RAWLINGS 4 | L352: JURY 2 | N352: RUNDELL | P352: PARRY | W352: OAKLEIGH | X352: 5 | Y352: 2 | Z352: 0 | AA352: 802 | AB352: 583 | AC352: 137.56432246998284 | AD352: 20
A353: PRAHRAN | C353: McCULLOCH 7 | F353: FURLONG 3 | I353: BURGESS 3 | L353: LENZ 2 | N353: WOOD | P353: KEEGAN | W353: BRUNSWICK | X353: 4 | Y353: 3 | Z353: 0 | AA353: 605 | AB353: 554 | AC353: 109.21 | AD353: 16
A355: COBURG | C355: 5 | D355: 4 | E355: =C355*6+D355 -> 34 | G355: 11 | H355: 9 | I355: =G355*6+H355 -> 75 | K355: 14 | L355: 13 | M355: =K355*6+L355 -> 97 | O355: 19 | P355: 17 | Q355: =O355*6+P355 -> 131 | S355: BEACH ROAD | W355: COBURG | X355: 4 | Y355: 3 | Z355: 0 | AA355: 730 | AB355: 687 | AC355: 106.26 | AD355: 16
A356: SANDRINGHAM | C356: 2 | D356: 2 | E356: =C356*6+D356 -> 14 | G356: 7 | H356: 4 | I356: =G356*6+H356 -> 46 | K356: 8 | L356: 9 | M356: =K356*6+L356 -> 57 | O356: 11 | P356: 10 | Q356: =O356*6+P356 -> 76 | S356: JOHNS | W356: PRAHRAN | X356: 3 | Y356: 4 | Z356: 0 | AA356: 754 | AB356: 744 | AC356: 101.34 | AD356: 12
A357: BEST PLAYERS | W357: PRESTON | X357: 3 | Y357: 4 | Z357: 0 | AA357: 649 | AB357: 690 | AC357: 94.06 | AD357: 12
A358: COBURG | C358: EQUID | E358: JORGENSON | H358: HEEPS | K358: STARBUCK | N358: ROGAN | Q358: JAMES | W358: CAMBERWELL | X358: 3 | Y358: 4 | Z358: 0 | AA358: 556 | AB358: 619 | AC358: 89.82 | AD358: 12
A359: SANDRINGHAM | C359: McFEE | E359: RUSSELL | H359: B HARPER | K359: RIPPON | N359: DEMPSTER | Q359: R HARPER | W359: PORT MELBOURNE | X359: 3 | Y359: 4 | Z359: 0 | AA359: 556 | AB359: 638 | AC359: 87.147335423197489 | AD359: 12
A360: GOALKICKERS | Q360: CONDON | W360: SANDRINGHAM | X360: 2 | Y360: 5 | Z360: 0 | AA360: 587 | AB360: 697 | AC360: 84.218077474892397 | AD360: 8
A361: COBURG | C361: JORGENSON 7 | F361: JAMES 4 | H361: ROGAN 2 | J361: HARTNEY | L361: CLAPTON | N361: EQUID | P361: WADE | R361: WILKINSON | W361: YARRAVILLE | X361: 2 | Y361: 5 | Z361: 0 | AA361: 643 | AB361: 852 | AC361: 75.46948356807512 | AD361: 8
A362: SANDRINGHAM | C362: B HARPER 5 | F362: McFEE 3 | H362: HISCOCK 2 | K362: HOLMES | W362: NORTHCOTE | X362: 1 | Y362: 6 | Z362: 0 | AA362: 617 | AB362: 693 | AC362: 89.03 | AD362: 4
A364: CAMBERWELL | C364: 1 | D364: 3 | E364: =C364*6+D364 -> 9 | G364: 8 | H364: 10 | I364: =G364*6+H364 -> 58 | K364: 9 | L364: 12 | M364: =K364*6+L364 -> 66 | O364: 12 | P364: 18 | Q364: =O364*6+P364 -> 90 | S364: PORT MELBOURNE
A365: PORT MELBOURNE | C365: 2 | D365: 0 | E365: =C365*6+D365 -> 12 | G365: 4 | H365: 5 | I365: =G365*6+H365 -> 29 | K365: 6 | L365: 6 | M365: =K365*6+L365 -> 42 | O365: 7 | P365: 12 | Q365: =O365*6+P365 -> 54 | S365: WRIGHT
A366: BEST PLAYERS
A367: CAMBERWELL | C367: STUBBS | F367: MILLER | I367: LOVETT | K367: JENSEN | N367: SHARPLES | Q367: UNSTEAD
A368: PORT MELBOURNE | C368: WELLS | F368: BUTCHER | I368: KELSEY | K368: HOUSTON | N368: WILSON | Q368: ARGOON
A369: GOALKICKERS
A370: CAMBERWELL | C370: MILGATE 4 | F370: BENBOW 2 | I370: FINNEGAN 2 | L370: STUBBS | N370: BOHAN | P370: HERBERT | R370: JENSEN
A371: PORT MELBOURNE | C371: HOUSTON 2 | F371: WELLS 2 | I371: CULPH | K371: BLOOM | M371: WOODBRIDGE
A373: BRUNSWICK | C373: 6 | D373: 4 | E373: =C373*6+D373 -> 40 | G373: 8 | H373: 12 | I373: =G373*6+H373 -> 60 | K373: 16 | L373: 19 | M373: =K373*6+L373 -> 115 | O373: 20 | P373: 24 | Q373: =O373*6+P373 -> 144 | S373: BRUNSWICK
A374: YARRAVILLE | C374: 2 | D374: 3 | E374: =C374*6+D374 -> 15 | G374: 6 | H374: 9 | I374: =G374*6+H374 -> 45 | K374: 7 | L374: 12 | M374: =K374*6+L374 -> 54 | O374: 10 | P374: 18 | Q374: =O374*6+P374 -> 78 | S374: THOMAS
A375: BEST PLAYERS
A376: BRUNSWICK | C376: WHELAN | F376: PRIESTLEY | I376: SPENCER | L376: GEISLER | N376: SMITH | Q376: NEILSON
A377: YARRAVILLE | C377: GODDARD | F377: YEWERS | I377: FAIRFULL | L377: McASEY | N377: BERNARD | Q377: ORR
A378: GOALKICKERS
A379: BRUNSWICK | C379: SPENCER 4 | F379: POWELL 4 | I379: WARD 4 | K379: HARDIMAN 3 | N379: SMITH 2 | P379: NEILSON 2 | S379: PRIESTLEY
A380: YARRAVILLE | C380: McASEY 3 | F380: THOMAS 2 | I380: COLLINS 2 | L380: McDONALD 2 | O380: TESTRAIL
A382: PRESTON | C382: 3 | D382: 2 | E382: =C382*6+D382 -> 20 | G382: 9 | H382: 4 | I382: =G382*6+H382 -> 58 | K382: 14 | L382: 5 | M382: =K382*6+L382 -> 89 | O382: 19 | P382: 12 | Q382: =O382*6+P382 -> 126 | S382: PRESTON
A383: BRIGHTON | C383: 5 | D383: 5 | E383: =C383*6+D383 -> 35 | G383: 8 | H383: 7 | I383: =G383*6+H383 -> 55 | K383: 13 | L383: 14 | M383: =K383*6+L383 -> 92 | O383: 14 | P383: 15 | Q383: =O383*6+P383 -> 99 | S383: JONES
A384: BEST PLAYERS
A385: PRESTON | C385: NATHAN | F385: HINES | I385: HIND | K385: PRITCHARD | N385: MEARS | Q385: BLACKMAN
A386: BRIGHTON | C386: ADAMSON | F386: McINDOE | I386: RIDDELL | K386: WILLIAMSON | N386: HEIMS | Q386: PLUNKETT
A387: GOALKICKERS
A388: PRESTON | C388: NATHAN 5 | F388: PRITCHARD 5 | I388: GOLDIN 3 | K388: BRYCE 2 | M388: HINES 2 | O388: MEARS 2
A389: BRIGHTON | C389: ADAMSON 4 | F389: WARBURTON 3 | J389: HEIMS 2 | L389: McINDOE 2 | N389: HOWE | P389: CONROY | R389: PLUNKETT
A391: WILLIAMSTOWN | C391: 4 | D391: 1 | E391: =C391*6+D391 -> 25 | G391: 10 | H391: 6 | I391: =G391*6+H391 -> 66 | K391: 16 | L391: 10 | M391: =K391*6+L391 -> 106 | O391: 19 | P391: 16 | Q391: =O391*6+P391 -> 130 | S391: WILLIAMSTOWN
A392: NORTHCOTE | C392: 2 | D392: 1 | E392: =C392*6+D392 -> 13 | G392: 7 | H392: 3 | I392: =G392*6+H392 -> 45 | K392: 8 | L392: 7 | M392: =K392*6+L392 -> 55 | O392: 9 | P392: 10 | Q392: =O392*6+P392 -> 64 | S392: IRVING
A393: BEST PLAYERS
A394: WILLIAMSTOWN | C394: COLLINS | F394: McPHERSON | I394: MOLYNEAUX | L394: REDMOND | N394: SAMPSON | Q394: WILLIAMS
A395: NORTHCOTE | C395: CASPAR | F395: KINDER | I395: WHITE | L395: NASH | N395: MURPHY | Q395: GREENWOOD
A396: GOALKICKERS
A397: WILLIAMSTOWN | C397: McPHERSON 5 | F397: COLLINS 4 | I397: BERNARD 2 | L397: ABBERTON 2 | O397: REDMOND 2 | R397: SALVAS | U397: FEATHERBY | X397: WALKER | AA397: MOLYNEUX
A398: NORTHCOTE | C398: GREENWOOD 3 | F398: NASH 2 | I398: PAWSEY | L398: MURPHY
A400: ROUND 8 | D400: 4TH JUNE | H400: WEATHER | K400: SOUTH EAST WIND COLD GROUNDS DAMP | S400: PLAYED AT
D401: 1ST QTR | H401: 2ND QTR | L401: 3RD QTR | P401: FINAL | S401: OAKLEIGH
A402: OAKLEIGH | C402: 5 | D402: 2 | E402: =C402*6+D402 -> 32 | G402: 8 | H402: 9 | I402: =G402*6+H402 -> 57 | K402: 10 | L402: 12 | M402: =K402*6+L402 -> 72 | O402: 11 | P402: 18 | Q402: =O402*6+P402 -> 84 | S402: UMPIRE | X402: LADDER | AB402: ROUND | AD402: 8
A403: WILLIAMSTOWN | C403: 3 | D403: 2 | E403: =C403*6+D403 -> 20 | G403: 3 | H403: 3 | I403: =G403*6+H403 -> 21 | K403: 6 | L403: 6 | M403: =K403*6+L403 -> 42 | O403: 9 | P403: 9 | Q403: =O403*6+P403 -> 63 | S403: JONES
A404: BEST PLAYERS | W404: TEAM | X404: W | Y404: L | Z404: D | AA404: FOR | AB404: AGST | AC404: % | AD404: PTS
A405: OAKLEIGH | C405: WENN | F405: R FINN | I405: PERKINS | L405: BOYLE | N405: WATSON | Q405: WILLIAMS
A406: WILLIAMSTOWN | C406: SAMPSON | F406: CHAPMAN | I406: WALKER | L406: ABBERTON | N406: DANCKERT | Q406: CAMERON | W406: OAKLEIGH | X406: 6 | Y406: 2 | Z406: 0 | AA406: 886 | AB406: 646 | AC406: 137.15170278637771 | AD406: 24
A407: GOALKICKERS | W407: WILLIAMSTOWN | X407: 6 | Y407: 2 | Z407: 0 | AA407: 763 | AB407: 638 | AC407: 119.59 | AD407: 24
A408: OAKLEIGH | C408: SMEATON 3 | F408: R FINN 3 | I408: HILL 2 | K408: WENN 2 | M408: WILLIAMS | W408: BRIGHTON | X408: 6 | Y408: 2 | Z408: 0 | AA408: 835 | AB408: 762 | AC408: 109.58005249343832 | AD408: 24
A409: WILLIAMSTOWN | C409: ABBERTON 4 | F409: WALKER 2 | I409: SALVAS | K409: McPHERSON | N409: BISHOP | W409: BRUNSWICK | X409: 5 | Y409: 3 | Z409: 0 | AA409: 722 | AB409: 632 | AC409: 114.24 | AD409: 20
A411: BRUNSWICK | C411: 4 | D411: 5 | E411: =C411*6+D411 -> 29 | G411: 11 | H411: 7 | I411: =G411*6+H411 -> 73 | K411: 17 | L411: 14 | M411: =K411*6+L411 -> 116 | O411: 17 | P411: 15 | Q411: =O411*6+P411 -> 117 | S411: ELSTERNWICK PARK | W411: COBURG | X411: 5 | Y411: 3 | Z411: 0 | AA411: 833 | AB411: 752 | AC411: 110.77 | AD411: 20
A412: BRIGHTON | C412: 2 | D412: 0 | E412: =C412*6+D412 -> 12 | G412: 4 | H412: 6 | I412: =G412*6+H412 -> 30 | K412: 5 | L412: 7 | M412: =K412*6+L412 -> 37 | O412: 10 | P412: 18 | Q412: =O412*6+P412 -> 78 | S412: WRIGHT | W412: PRAHRAN | X412: 4 | Y412: 4 | Z412: 0 | AA412: 847 | AB412: 832 | AC412: 101.8 | AD412: 16
A413: BEST PLAYERS | W413: PORT MELBOURNE | X413: 4 | Y413: 4 | Z413: 0 | AA413: 695 | AB413: 738 | AC413: 94.173441734417338 | AD413: 16
A414: BRUNSWICK | C414: NEILSON | F414: POWELL | I414: PRIESTLEY | L414: SHAW | N414: SPENCER | Q414: WHELAN | W414: CAMBERWELL | X414: 3 | Y414: 5 | Z414: 0 | AA414: 644 | AB414: 712 | AC414: 90.45 | AD414: 12
A415: BRIGHTON | C415: E TURNER | F415: CONROY | I415: PINDER | L415: L BURNS | N415: WARBURTON | Q415: ADAMSON | W415: PRESTON | X415: 3 | Y415: 5 | Z415: 0 | AA415: 714 | AB415: 793 | AC415: 90.04 | AD415: 12
A416: GOALKICKERS | O416: NEILSON | R416: RINGROSE | W416: NORTHCOTE | X416: 2 | Y416: 6 | Z416: 0 | AA416: 686 | AB416: 738 | AC416: 92.95 | AD416: 8
A417: BRUNSWICK | C417: POWELL 5 | F417: PRIESTLEY 2 | I417: SMITH 2 | K417: WARD 2 | M417: WHELAN | O417: MAHER | Q417: HARDIMAN | T417: SPENCER | W417: SANDRINGHAM | X417: 2 | Y417: 6 | Z417: 0 | AA417: 632 | AB417: 766 | AC417: 82.506527415143609 | AD417: 8
A418: BRIGHTON | C418: WARBURTON 4 | F418: McINDOE 2 | I418: ADAMSON | L418: HOWE | N418: J BURNS | P418: L BURNS | W418: YARRAVILLE | X418: 2 | Y418: 6 | Z418: 0 | AA418: 743 | AB418: 991 | AC418: 74.974772956609485 | AD418: 8
A420: COBURG | C420: 1 | D420: 7 | E420: =C420*6+D420 -> 13 | G420: 4 | H420: 8 | I420: =G420*6+H420 -> 32 | K420: 9 | L420: 15 | M420: =K420*6+L420 -> 69 | O420: 14 | P420: 19 | Q420: =O420*6+P420 -> 103 | S420: COBURG
A421: PRESTON | C421: 0 | D421: 2 | E421: =C421*6+D421 -> 2 | G421: 4 | H421: 9 | I421: =G421*6+H421 -> 33 | K421: 6 | L421: 12 | M421: =K421*6+L421 -> 48 | O421: 8 | P421: 17 | Q421: =O421*6+P421 -> 65 | S421: IRVING
A422: BEST PLAYERS
A423: COBURG | C423: HOLBROOK | F423: EQUID | I423: CLAPTON | L423: CONDON | O423: CAHIR | Q423: WADE
A424: PRESTON | C424: BLACKMAN | F424: HIND | I424: LALOR | L424: MASLEN | O424: NATHAN | Q424: SWEET
A425: GOALKICKERS
A426: COBURG | C426: JORGENSON 6 | F426: JAMES 2 | I426: CONDON 2 | L426: HOLBROOK 2 | O426: ROGAN | Q426: CLAPTON
A427: PRESTON | C427: MEARS 3 | F427: PRITCHARD 2 | I427: BLACKMAN | L427: NATHAN | O427: GOLDIN
A429: PRAHRAN | C429: 3 | D429: 0 | E429: =C429*6+D429 -> 18 | G429: 9 | H429: 5 | I429: =G429*6+H429 -> 59 | K429: 11 | L429: 5 | M429: =K429*6+L429 -> 71 | O429: 14 | P429: 9 | Q429: =O429*6+P429 -> 93 | S429: CAMBERWELL
A430: CAMBERWELL | C430: 4 | D430: 5 | E430: =C430*6+D430 -> 29 | G430: 6 | H430: 5 | I430: =G430*6+H430 -> 41 | K430: 9 | L430: 13 | M430: =K430*6+L430 -> 67 | O430: 12 | P430: 16 | Q430: =O430*6+P430 -> 88 | S430: THOMAS
A431: BEST PLAYERS
A432: PRAHRAN | C432: WALSH | F432: LENZ | I432: BURGESS | L432: FERGEUS | O432: HILL | R432: JONES
A433: CAMBERWELL | C433: JENSEN | F433: BOHAN | I433: COOKE | L433: LOVETT | O433: CRACKNELL | R433: MILLER
A434: GOALKICKERS
A435: PRAHRAN | C435: LENZ 5 | F435: BURGESS 2 | I435: FERGEUS 2 | L435: KEEGAN 2 | O435: McCULLOCH 2 | S435: MARSH
A436: CAMBERWELL | C436: MILGATE 4 | F436: CRACKNELL 2 | I436: JENSEN 2 | K436: HERBERT | M436: FINNEGAN | O436: UNSTEAD | Q436: BENBOW
A438: PORT MELBOURNE | C438: 4 | D438: 3 | E438: =C438*6+D438 -> 27 | G438: 11 | H438: 6 | I438: =G438*6+H438 -> 72 | K438: 14 | L438: 8 | M438: =K438*6+L438 -> 92 | O438: 21 | P438: 13 | Q438: =O438*6+P438 -> 139 | S438: YARRAVILLE
A439: YARRAVILLE | C439: 8 | D439: 0 | E439: =C439*6+D439 -> 48 | G439: 10 | H439: 1 | I439: =G439*6+H439 -> 61 | K439: 14 | L439: 8 | M439: =K439*6+L439 -> 92 | O439: 15 | P439: 10 | Q439: =O439*6+P439 -> 100 | S439: JONES
A440: BEST PLAYERS
A441: PORT MELBOURNE | C441: LEWIS | F441: WELLS | I441: McGEE | L441: BLOOM | O441: MURRAY | R441: WOODBEIDGE
A442: YARRAVILLE | C442: PHILLIPS | F442: McDONALD | I442: COLLINS | L442: TESTRAIL | O442: WOOD | R442: YEWERS
A443: GOALKICKERS
A444: PORT MELBOURNE | C444: HOUSTON 5 | F444: LEWIS 5 | H444: BLOOM 5 | J444: McGEE 3 | L444: EGAN | N444: WELLS | P444: WILSON
A445: YARRAVILLE | C445: PHILLIPS 5 | F445: COLLINS 4 | I445: THOMAS 2 | L445: McDONALD 2 | O445: MILLER 2
A447: NORTHCOTE | C447: 3 | D447: 2 | E447: =C447*6+D447 -> 20 | G447: 4 | H447: 5 | I447: =G447*6+H447 -> 29 | K447: 8 | L447: 11 | M447: =K447*6+L447 -> 59 | O447: 9 | P447: 15 | Q447: =O447*6+P447 -> 69 | S447: NORTHCOTE
A448: SANDRINGHAM | C448: 3 | D448: 3 | E448: =C448*6+D448 -> 21 | G448: 4 | H448: 6 | I448: =G448*6+H448 -> 30 | K448: 5 | L448: 7 | M448: =K448*6+L448 -> 37 | O448: 6 | P448: 9 | Q448: =O448*6+P448 -> 45 | S448: BARNES
A449: BEST PLAYERS
A450: NORTHCOTE | C450: HISCOX | F450: PAWSEY | I450: McINTOSH | L450: CASPAR | O450: WALLIS | R450: KINDER
A451: SANDRINGHAM | C451: R HARPER | F451: McFEE | I451: GUILLE | L451: McLEOD | O451: R GRAMBEAU | R451: BROWN
A452: GOALKICKERS
A453: NORTHCOTE | C453: WHITE 2 | F453: PAWSEY 2 | I453: NASH 2 | K453: BRUNNEN | M453: STABB | O453: McINTOSH
A454: SANDRINGHAM | C454: HISCOCK 2 | F454: GUILLE 2 | I454: McFEE | K454: SLEIGH
A456: ROUND 9 | D456: 11TH JUNE | I456: WEATHER | L456: SOUTH WEST BREEZE FINE AND SUNNY | S456: PLAYED AT
D457: 1ST QTR | H457: 2ND QTR | L457: 3RD QTR | P457: FINAL | S457: BRUNSWICK
A458: BRUNSWICK | C458: 4 | D458: 7 | E458: =C458*6+D458 -> 31 | G458: 9 | H458: 11 | I458: =G458*6+H458 -> 65 | K458: 15 | L458: 15 | M458: =K458*6+L458 -> 105 | O458: 17 | P458: 16 | Q458: =O458*6+P458 -> 118 | S458: UMPIRE | X458: LADDER | AB458: ROUND | AD458: 9
A459: PRESTON | C459: 3 | D459: 2 | E459: =C459*6+D459 -> 20 | G459: 6 | H459: 9 | I459: =G459*6+H459 -> 45 | K459: 6 | L459: 9 | M459: =K459*6+L459 -> 45 | O459: 15 | P459: 13 | Q459: =O459*6+P459 -> 103 | S459: JONES
A460: BEST PLAYERS | W460: TEAM | X460: W | Y460: L | Z460: D | AA460: FOR | AB460: AGST | AC460: % | AD460: PTS
A461: BRUNSWICK | C461: SMITH | F461: McIVOR | I461: HENRYS | L461: GEISLER | N461: HARDIMAN | Q461: KUHL
A462: PRESTON | C462: BLACKMAN | F462: BAKER | I462: MASLEN | L462: HIND | N462: NATHAN | Q462: LEISHMAN | W462: OAKLEIGH | X462: 7 | Y462: 2 | Z462: 0 | AA462: 980 | AB462: 735 | AC462: 133.33333333333334 | AD462: 28
A463: GOALKICKERS | W463: WILLIAMSTOWN | X463: 7 | Y463: 2 | Z463: 0 | AA463: 835 | AB463: 691 | AC463: 120.84 | AD463: 28
A464: BRUNSWICK | C464: HARDIMAN 4 | F464: SMITH 4 | H464: SPENCER 3 | J464: POWELL 2 | M464: PRIESTLEY 2 | P464: MAHER | R464: NEILSON | W464: BRUNSWICK | X464: 6 | Y464: 3 | Z464: 0 | AA464: 840 | AB464: 735 | AC464: 114.29 | AD464: 24
A465: PRESTON | C465: PRITCHARD 6 | F465: LALOR 3 | H465: DUNSTAN 3 | K465: NATHAN | M465: MASLEN | O465: CLIFFORD | W465: BRIGHTON | X465: 6 | Y465: 3 | Z465: 0 | AA465: 893 | AB465: 828 | AC465: 107.85024154589372 | AD465: 24
A467: NORTHCOTE | C467: 3 | D467: 3 | E467: =C467*6+D467 -> 21 | G467: 6 | H467: 5 | I467: =G467*6+H467 -> 41 | K467: 8 | L467: 10 | M467: =K467*6+L467 -> 58 | O467: 10 | P467: 13 | Q467: =O467*6+P467 -> 73 | S467: NORTHCOTE | W467: COBURG | X467: 5 | Y467: 3 | Z467: 1 | AA467: 906 | AB467: 825 | AC467: 109.82 | AD467: 22
A468: COBURG | C468: 2 | D468: 1 | E468: =C468*6+D468 -> 13 | G468: 8 | H468: 7 | I468: =G468*6+H468 -> 55 | K468: 11 | L468: 7 | M468: =K468*6+L468 -> 73 | O468: 11 | P468: 7 | Q468: =O468*6+P468 -> 73 | S468: WRIGHT | W468: PRAHRAN | X468: 5 | Y468: 4 | Z468: 0 | AA468: 979 | AB468: 951 | AC468: 102.94 | AD468: 20
A469: BEST PLAYERS | W469: PORT MELBOURNE | X469: 5 | Y469: 4 | Z469: 0 | AA469: 761 | AB469: 796 | AC469: 95.603015075376888 | AD469: 20
A470: NORTHCOTE | C470: WHITE | E470: CRANE | H470: PAWSEY | K470: GREENWOOD | N470: DUFF | Q470: HINES | W470: PRESTON | X470: 3 | Y470: 6 | Z470: 0 | AA470: 817 | AB470: 911 | AC470: 89.68 | AD470: 12
A471: COBURG | C471: EQUID | E471: CLAPTON | H471: JAMES | K471: WILKINSON | N471: HOLBROOK | Q471: HEEPS | W471: CAMBERWELL | X471: 3 | Y471: 6 | Z471: 0 | AA471: 697 | AB471: 784 | AC471: 88.9 | AD471: 12
A472: GOALKICKERS | W472: NORTHCOTE | X472: 2 | Y472: 6 | Z472: 1 | AA472: 759 | AB472: 811 | AC472: 93.59 | AD472: 10
A473: NORTHCOTE | C473: PAWSEY 3 | F473: McINTOSH 2 | I473: WHITE 2 | K473: GREENWOOD | N473: KINDER | P473: BRUNNEN | W473: SANDRINGHAM | X473: 2 | Y473: 7 | Z473: 0 | AA473: 721 | AB473: 860 | AC473: 83.837209302325576 | AD473: 8
A474: COBURG | C474: JAMES 5 | F474: JORGENSON 2 | I474: WILSON | K474: BRADLEY | M474: CLAYTON | O474: WADE | W474: YARRAVILLE | X474: 2 | Y474: 7 | Z474: 0 | AA474: 862 | AB474: 1123 | AC474: 76.758682101513799 | AD474: 8
A476: OAKLEIGH | C476: 6 | D476: 4 | E476: =C476*6+D476 -> 40 | G476: 9 | H476: 8 | I476: =G476*6+H476 -> 62 | K476: 12 | L476: 12 | M476: =K476*6+L476 -> 84 | O476: 13 | P476: 16 | Q476: =O476*6+P476 -> 94 | S476: BEACH ROAD
A477: SANDRINGHAM | C477: 3 | D477: 3 | E477: =C477*6+D477 -> 21 | G477: 6 | H477: 6 | I477: =G477*6+H477 -> 42 | K477: 9 | L477: 9 | M477: =K477*6+L477 -> 63 | O477: 13 | P477: 11 | Q477: =O477*6+P477 -> 89 | S477: THOMAS
A478: BEST PLAYERS
A479: OAKLEIGH | C479: WENN | F479: BAXTER | I479: WILLIAMS | L479: RAWLINGS | O479: BOYLE | R479: TEMME
A480: SANDRINGHAM | C480: R HARPER | F480: CERINI | I480: B HARPER | L480: McLEOD | O480: BENCRAFT | R480: GUILLE
A481: GOALKICKERS
A482: OAKLEIGH | C482: RAWLINGS 4 | F482: SCOTT 3 | I482: SMEATON 2 | L482: WILLIAMS | N482: RUNDELL | P482: WENN | R482: PAY
A483: SANDRINGHAM | C483: B HARPER 4 | F483: R HARPER 3 | I483: CERINI 2 | K483: NAGLE | M483: STANLEY | O483: GILBERT | Q483: BENCRAFT
D484: 13TH JUNE | H484: KINGS BIRTHDAY | M484: WEATHER | Q484: COLD DULL NO WIND
A485: PORT MELBOURNE | C485: 1 | D485: 3 | E485: =C485*6+D485 -> 9 | G485: 3 | H485: 7 | I485: =G485*6+H485 -> 25 | K485: 6 | L485: 8 | M485: =K485*6+L485 -> 44 | O485: 9 | P485: 12 | Q485: =O485*6+P485 -> 66 | S485: PORT MELBOURNE
A486: BRIGHTON | C486: 2 | D486: 3 | E486: =C486*6+D486 -> 15 | G486: 4 | H486: 6 | I486: =G486*6+H486 -> 30 | K486: 7 | L486: 8 | M486: =K486*6+L486 -> 50 | O486: 8 | P486: 10 | Q486: =O486*6+P486 -> 58 | S486: IRVING
A487: BEST PLAYERS
A488: PORT MELBOURNE | C488: CLEARY | F488: CULPH | I488: MURPHY | L488: WILSON | O488: KELSEY | R488: MURRAY
A489: BRIGHTON | C489: E TURNER | F489: MOORE | I489: CRAVEN | L489: McASEY | O489: McINDOE | R489: L BURNS
A490: GOALKICKERS
A491: PORT MELBOURNE | C491: CULPH 5 | F491: HOUSTON 2 | I491: LEWIS | K491: BLOOM
A492: BRIGHTON | C492: J BURNS 3 | F492: L BURNS 2 | I492: CRAVEN 2 | L492: FOSTER
A494: WILLIAMSTOWN | C494: 2 | D494: 3 | E494: =C494*6+D494 -> 15 | G494: 3 | H494: 8 | I494: =G494*6+H494 -> 26 | K494: 8 | L494: 9 | M494: =K494*6+L494 -> 57 | O494: 10 | P494: 12 | Q494: =O494*6+P494 -> 72 | S494: WILLIAMSTOWN
A495: CAMBERWELL | C495: 0 | D495: 3 | E495: =C495*6+D495 -> 3 | G495: 2 | H495: 6 | I495: =G495*6+H495 -> 18 | K495: 4 | L495: 13 | M495: =K495*6+L495 -> 37 | O495: 6 | P495: 17 | Q495: =O495*6+P495 -> 53 | S495: JOHNS
A496: BEST PLAYERS
A497: WILLIAMSTOWN | C497: WILLIAMS | F497: MATTHEWS | I497: McRAE | K497: STRANG | N497: FEATHERBY | Q497: MOLYNEUX
A498: CAMBERWELL | C498: FLETCHER | F498: MILLER | I498: BOHAN | K498: LOVETT | N498: ROCHFORD | Q498: GIBBS
A499: GOALKICKERS
A500: WILLIAMSTOWN | C500: McPHERSON 3 | F500: STRANG 3 | I500: MOLYNEUX 2 | L500: BERNARD | N500: SALVAS
A501: CAMBERWELL | C501: GIBBS 2 | F501: MILGATE 2 | I501: JENSEN | K501: FINNEGAN
A503: PRAHRAN | C503: 6 | D503: 6 | E503: =C503*6+D503 -> 42 | G503: 11 | H503: 13 | I503: =G503*6+H503 -> 79 | K503: 16 | L503: 19 | M503: =K503*6+L503 -> 115 | O503: 18 | P503: 24 | Q503: =O503*6+P503 -> 132 | S503: NORTHCOTE
A504: YARRAVILLE | C504: 4 | D504: 3 | E504: =C504*6+D504 -> 27 | G504: 10 | H504: 3 | I504: =G504*6+H504 -> 63 | K504: 15 | L504: 10 | M504: =K504*6+L504 -> 100 | O504: 18 | P504: 11 | Q504: =O504*6+P504 -> 119 | S504: BARNES
A505: BEST PLAYERS
A506: PRAHRAN | C506: FERGEUS | F506: WOOD | I506: McCULLOCH | L506: MARSH | O506: BURGESS | R506: JONES
A507: YARRAVILLE | C507: GARLICK | F507: COLLINS | I507: PHILLIPS | L507: GWYNNE | O507: McASEY | R507: McDONALD
A508: GOALKICKERS
A509: PRAHRAN | C509: BURGESS 4 | F509: FERGEUS 4 | I509: McCULLOCH 3 | L509: LENZ 2 | N509: WOOD 2 | P509: COLLS | R509: QUINN | T509: MARSH
A510: YARRAVILLE | C510: COLLINS 5 | F510: PHILLIPS 4 | I510: McASEY 3 | L510: BERNARD 2 | O510: McDONALD 2 | R510: YEWERS | V510: MALBON
A512: ROUND 10 | D512: 18TH JUNE | J512: WEATHER | M512: COLD MISTY DULL NO WIND | S512: PLAYED AT
D513: 1ST QTR | H513: 2ND QTR | L513: 3RD QTR | P513: FINAL | S513: BRUNSWICK
A514: COBURG | C514: 5 | D514: 1 | E514: =C514*6+D514 -> 31 | G514: 8 | H514: 4 | I514: =G514*6+H514 -> 52 | K514: 13 | L514: 6 | M514: =K514*6+L514 -> 84 | O514: 16 | P514: 7 | Q514: =O514*6+P514 -> 103 | S514: UMPIRE | X514: LADDER | AB514: ROUND | AD514: 10
A515: BRUNSWICK | C515: 2 | D515: 3 | E515: =C515*6+D515 -> 15 | G515: 4 | H515: 7 | I515: =G515*6+H515 -> 31 | K515: 7 | L515: 12 | M515: =K515*6+L515 -> 54 | O515: 13 | P515: 17 | Q515: =O515*6+P515 -> 95 | S515: BARNES
A516: BEST PLAYERS | W516: TEAM | X516: W | Y516: L | Z516: D | AA516: FOR | AB516: AGST | AC516: % | AD516: PTS
A517: COBURG | C517: JAMES | F517: BRADLEY | I517: EQUID | K517: FEWKES | N517: WILSON | Q517: HOLBROOK
A518: BRUNSWICK | C518: HENRYS | F518: SPENCER | I518: SILK | K518: POWELL | N518: RINGROSE | Q518: WHELAN | W518: OAKLEIGH | X518: 8 | Y518: 2 | Z518: 0 | AA518: 1113 | AB518: 804 | AC518: 138.43283582089552 | AD518: 32
A519: GOALKICKERS | P519: JORGENSON | R519: WILKINSON | W519: WILLIAMSTOWN | X519: 8 | Y519: 2 | Z519: 0 | AA519: 943 | AB519: 785 | AC519: 120.13 | AD519: 32
A520: COBURG | C520: JAMES 5 | E520: CONDON 2 | G520: CLAPTON 2 | J520: EQUID | L520: WILSON | N520: BRADLEY | P520: GOODRICH | R520: WALSH | W520: BRIGHTON | X520: 7 | Y520: 3 | Z520: 0 | AA520: 1010 | AB520: 924 | AC520: 109.30735930735931 | AD520: 28
A521: BRUNSWICK | C521: WARD 4 | E521: POWELL 3 | G521: HARDIMAN 2 | J521: KUHL | L521: SPENCER | N521: RINGROSE | Q521: SMITH | W521: COBURG | X521: 6 | Y521: 3 | Z521: 1 | AA521: 1009 | AB521: 920 | AC521: 109.67 | AD521: 26
A523: BRIGHTON | C523: 2 | D523: 3 | E523: =C523*6+D523 -> 15 | G523: 8 | H523: 9 | I523: =G523*6+H523 -> 57 | K523: 11 | L523: 10 | M523: =K523*6+L523 -> 76 | O523: 17 | P523: 15 | Q523: =O523*6+P523 -> 117 | S523: ELSTERNWICK PARK | W523: BRUNSWICK | X523: 6 | Y523: 4 | Z523: 0 | AA523: 935 | AB523: 838 | AC523: 111.58 | AD523: 24
A524: PRAHRAN | C524: 3 | D524: 5 | E524: =C524*6+D524 -> 23 | G524: 7 | H524: 11 | I524: =G524*6+H524 -> 53 | K524: 11 | L524: 15 | M524: =K524*6+L524 -> 81 | O524: 13 | P524: 18 | Q524: =O524*6+P524 -> 96 | S524: JONES | W524: PRAHRAN | X524: 5 | Y524: 5 | Z524: 0 | AA524: 1075 | AB524: 1068 | AC524: 100.66 | AD524: 20
A525: BEST PLAYERS | W525: PORT MELBOURNE | X525: 5 | Y525: 5 | Z525: 0 | AA525: 860 | AB525: 896 | AC525: 95.982142857142861 | AD525: 20
A526: BRIGHTON | C526: HOWE | E526: McINDOE | H526: E TURNER | K526: FOSTER | N526: NEW | Q526: McASEY | W526: CAMBERWELL | X526: 4 | Y526: 6 | Z526: 0 | AA526: 815 | AB526: 858 | AC526: 94.99 | AD526: 16
A527: PRAHRAN | C527: HILL | E527: WOOD | H527: BURGESS | K527: MARSH | N527: ARMSTRONG | Q527: McCULLOCH | W527: PRESTON | X527: 4 | Y527: 6 | Z527: 0 | AA527: 917 | AB527: 1010 | AC527: 90.79 | AD527: 16
A528: GOALKICKERS | W528: NORTHCOTE | X528: 2 | Y528: 7 | Z528: 1 | AA528: 828 | AB528: 944 | AC528: 87.71 | AD528: 10
A529: BRIGHTON | C529: McINDOE 5 | F529: HOWE 4 | H529: FOSTER 3 | J529: WARBURTON 2 | N529: LUMMIS | P529: COMBER | R529: PICKERING | W529: SANDRINGHAM | X529: 2 | Y529: 8 | Z529: 0 | AA529: 795 | AB529: 978 | AC529: 81.288343558282207 | AD529: 8
A530: PRAHRAN | C530: McCULLOCH 4 | F530: BURGESS 3 | I530: O'BRIEN 2 | K530: WOOD | M530: LENZ | O530: OPRAY | Q530: FERGEUS | W530: YARRAVILLE | X530: 2 | Y530: 8 | Z530: 0 | AA530: 956 | AB530: 1231 | AC530: 77.660438667749801 | AD530: 8
A532: PRESTON | C532: 2 | D532: 5 | E532: =C532*6+D532 -> 17 | G532: 6 | H532: 11 | I532: =G532*6+H532 -> 47 | K532: 9 | L532: 15 | M532: =K532*6+L532 -> 69 | O532: 13 | P532: 22 | Q532: =O532*6+P532 -> 100 | S532: PRESTON
A533: PORT MELBOURNE | C533: 2 | D533: 1 | E533: =C533*6+D533 -> 13 | G533: 8 | H533: 3 | I533: =G533*6+H533 -> 51 | K533: 12 | L533: 6 | M533: =K533*6+L533 -> 78 | O533: 15 | P533: 9 | Q533: =O533*6+P533 -> 99 | S533: JOHNS
A534: BEST PLAYERS
A535: PRESTON | C535: BRYCE | F535: BLACKMAN | I535: SWEET | L535: GOLDIN | O535: HIND | R535: MEARS
A536: PORT MELBOURNE | C536: SEXTON | F536: CLEARY | I536: DRINAN | L536: BLOOM | O536: MURRAY | R536: MULLANE
A537: GOALKICKERS
A538: PRESTON | C538: MEARS 3 | F538: LALOR 2 | I538: HINES 2 | K538: FOSTER 2 | M538: BRYCE | O538: GOLDIN | Q538: DUNGAN
A539: PORT MELBOURNE | C539: CULPH 4 | F539: LEWIS 4 | I539: BLOOM 3 | K539: SEXTON 2 | N539: HOUSTON 2
A541: CAMBERWELL | C541: 4 | D541: 3 | E541: =C541*6+D541 -> 27 | G541: 7 | H541: 7 | I541: =G541*6+H541 -> 49 | K541: 10 | L541: 9 | M541: =K541*6+L541 -> 69 | O541: 17 | P541: 16 | Q541: =O541*6+P541 -> 118 | S541: CAMBERWELL
A542: SANDRINGHAM | C542: 2 | D542: 5 | E542: =C542*6+D542 -> 17 | G542: 4 | H542: 8 | I542: =G542*6+H542 -> 32 | K542: 9 | L542: 12 | M542: =K542*6+L542 -> 66 | O542: 10 | P542: 14 | Q542: =O542*6+P542 -> 74 | S542: WRIGHT
A543: BEST PLAYERS
A544: CAMBERWELL | C544: MILGATE | F544: MILLER | I544: DUFF | L544: BOHAN | O544: UNSTEAD | R544: LOVETT
A545: SANDRINGHAM | C545: R HARPER | F545: STANLEY | I545: B HARPER | L545: McFEE | O545: GUILLE | R545: ANDERSON
A546: GOALKICKERS
A547: CAMBERWELL | C547: MILGATE 7 | F547: BOHAN 3 | I547: STUBBS 2 | L547: FINNEGAN 2 | O547: DUFF | Q547: SHARPLES | S547: JENSEN
A548: SANDRINGHAM | C548: HISCOCK 4 | F548: McFEE 2 | I548: BENCRAFT | L548: B HARPER | O548: ARNEY | Q548: HOLMES
A550: OAKLEIGH | C550: 5 | D550: 3 | E550: =C550*6+D550 -> 33 | G550: 7 | H550: 9 | I550: =G550*6+H550 -> 51 | K550: 11 | L550: 17 | M550: =K550*6+L550 -> 83 | O550: 19 | P550: 19 | Q550: =O550*6+P550 -> 133 | S550: OAKLEIGH
A551: NORTHCOTE | C551: 1 | D551: 3 | E551: =C551*6+D551 -> 9 | G551: 5 | H551: 5 | I551: =G551*6+H551 -> 35 | K551: 6 | L551: 9 | M551: =K551*6+L551 -> 45 | O551: 9 | P551: 15 | Q551: =O551*6+P551 -> 69 | S551: STREETER
A552: BEST PLAYERS
A553: OAKLEIGH | C553: WENN | F553: LEANE | I553: JORY | L553: RAWLINGS | O553: BOYLE | R553: BEARD
A554: NORTHCOTE | C554: STABB | F554: NASH | I554: CASPAR | L554: BRUNNEN | O554: McINTOSH | R554: DUNN
A555: GOALKICKERS
A556: OAKLEIGH | C556: WENN 5 | E556: LEANE 4 | G556: JORY 4 | I556: HILL 2 | K556: SCOTT | M556: RAWLINGS | O556: WILLIAMS | Q556: BAXTER
A557: NORTHCOTE | C557: NASH 3 | E557: McINTOSH 2 | H557: STABB 2 | J557: PAWSEY | M557: CAREY
A559: WILLIAMSTOWN | C559: 4 | D559: 4 | E559: =C559*6+D559 -> 28 | G559: 7 | H559: 5 | I559: =G559*6+H559 -> 47 | K559: 11 | L559: 10 | M559: =K559*6+L559 -> 76 | O559: 16 | P559: 12 | Q559: =O559*6+P559 -> 108 | S559: YARRAVILLE
A560: YARRAVILLE | C560: 1 | D560: 1 | E560: =C560*6+D560 -> 7 | G560: 6 | H560: 4 | I560: =G560*6+H560 -> 40 | K560: 11 | L560: 5 | M560: =K560*6+L560 -> 71 | O560: 14 | P560: 10 | Q560: =O560*6+P560 -> 94 | S560: THOMAS
A561: BEST PLAYERS
A562: WILLIAMSTOWN | C562: MOLYNEUX | F562: WELLS | I562: WALKER | L562: STRANG | O562: McPHERSON | R562: McRAE
A563: YARRAVILLE | C563: PHILLIPS | F563: COLLINS | I563: MALBON | L563: BERNARD | O563: GARLICK | R563: WATTS
A564: GOALKICKERS
A565: WILLIAMSTOWN | C565: COLLINS 4 | F565: McPHERSON 3 | I565: MOLYNEUX 3 | L565: McRAE 2 | N565: STRANG 2 | Q565: WALKER | S565: ABBERTON
A566: YARRAVILLE | C566: PHILLIPS 6 | F566: COLLINS 4 | I566: MALBON | K566: McASEY | M566: MALONEY | O566: ROHLEDER
A568: ROUND 11 | D568: 25TH JUNE | J568: WEATHER | M568: NORTH WEST WIND COLD | S568: PLAYED AT
D569: 1ST QTR | H569: 2ND QTR | L569: 3RD QTR | P569: FINAL | S569: WILLIAMSTOWN
A570: WILLIAMSTOWN | C570: 6 | D570: 4 | E570: =C570*6+D570 -> 40 | G570: 11 | H570: 4 | I570: =G570*6+H570 -> 70 | K570: 13 | L570: 7 | M570: =K570*6+L570 -> 85 | O570: 16 | P570: 9 | Q570: =O570*6+P570 -> 105 | S570: UMPIRE | X570: LADDER | AB570: ROUND | AD570: 11
A571: BRIGHTON | C571: 3 | D571: 2 | E571: =C571*6+D571 -> 20 | G571: 6 | H571: 3 | I571: =G571*6+H571 -> 39 | K571: 6 | L571: 4 | M571: =K571*6+L571 -> 40 | O571: 8 | P571: 7 | Q571: =O571*6+P571 -> 55 | S571: JONES
A572: BEST PLAYERS | W572: TEAM | X572: W | Y572: L | Z572: D | AA572: FOR | AB572: AGST | AC572: % | AD572: PTS
A573: WILLIAMSTOWN | C573: McPHERSON | F573: FEATHERBY | I573: WALKER | L573: McRAE | N573: COLLINS | Q573: MATTHEWS
A574: BRIGHTON | C574: HOWE | F574: E TURNER | I574: LUMMAS | L574: MOORE | N574: PICKERING | Q574: HILL | W574: WILLIAMSTOWN | X574: 9 | Y574: 2 | Z574: 0 | AA574: 1048 | AB574: 840 | AC574: 124.76 | AD574: 36
A575: GOALKICKERS | W575: OAKLEIGH | X575: 8 | Y575: 3 | Z575: 0 | AA575: 1190 | AB575: 891 | AC575: 133.55780022446689 | AD575: 32
A576: WILLIAMSTOWN | C576: McPHERSON 5 | F576: TODD 4 | H576: McRAE 2 | J576: COLLINS 2 | M576: STRANG | O576: ABBERTON | Q576: WALKER | W576: COBURG | X576: 7 | Y576: 3 | Z576: 1 | AA576: 1096 | AB576: 997 | AC576: 109.93 | AD576: 30
A577: BRIGHTON | C577: HOWE 2 | F577: McINDOE 2 | I577: MOORE 2 | L577: LUMMAS | N577: WARBURTON | W577: BRIGHTON | X577: 7 | Y577: 4 | Z577: 0 | AA577: 1065 | AB577: 1029 | AC577: 103.5 | AD577: 28
A579: COBURG | C579: 3 | D579: 2 | E579: =C579*6+D579 -> 20 | G579: 10 | H579: 5 | I579: =G579*6+H579 -> 65 | K579: 10 | L579: 6 | M579: =K579*6+L579 -> 66 | O579: 12 | P579: 15 | Q579: =O579*6+P579 -> 87 | S579: COBURG | W579: BRUNSWICK | X579: 6 | Y579: 5 | Z579: 0 | AA579: 988 | AB579: 933 | AC579: 105.89 | AD579: 24
A580: OAKLEIGH | C580: 2 | D580: 2 | E580: =C580*6+D580 -> 14 | G580: 2 | H580: 4 | I580: =G580*6+H580 -> 16 | K580: 9 | L580: 13 | M580: =K580*6+L580 -> 67 | O580: 10 | P580: 17 | Q580: =O580*6+P580 -> 77 | S580: WRIGHT | W580: PORT MELBOURNE | X580: 6 | Y580: 5 | Z580: 0 | AA580: 955 | AB580: 949 | AC580: 100.6322444678609 | AD580: 24
A581: BEST PLAYERS | W581: PRAHRAN | X581: 5 | Y581: 6 | Z581: 0 | AA581: 1144 | AB581: 1138 | AC581: 100.53 | AD581: 20
A582: COBURG | C582: JAMES | E582: FEWKES | H582: WILSON | K582: CONDON | N582: ROGAN | Q582: CAHIR | W582: CAMBERWELL | X582: 5 | Y582: 6 | Z582: 0 | AA582: 877 | AB582: 906 | AC582: 96.8 | AD582: 20
A583: OAKLEIGH | C583: HILL | E583: TEMME | H583: DONNELLY | K583: WILLIAMS | N583: SCOTT | Q583: POWER | W583: PRESTON | X583: 5 | Y583: 6 | Z583: 0 | AA583: 987 | AB583: 1079 | AC583: 91.47 | AD583: 20
A584: GOALKICKERS | W584: SANDRINGHAM | X584: 3 | Y584: 8 | Z584: 0 | AA584: 924 | AB584: 1053 | AC584: 87.75 | AD584: 12
A585: COBURG | C585: JAMES 5 | F585: ROGAN 2 | I585: JORGENSON 2 | L585: CLAPTON | N585: CONDON | P585: WALSH | W585: NORTHCOTE | X585: 2 | Y585: 8 | Z585: 1 | AA585: 876 | AB585: 1006 | AC585: 87.08 | AD585: 10
A586: OAKLEIGH | C586: HILL 4 | F586: JORY 2 | I586: PERKINS | K586: WENN | M586: BAXTER | O586: SCOTT | W586: YARRAVILLE | X586: 2 | Y586: 9 | Z586: 0 | AA586: 1031 | AB586: 1360 | AC586: 75.81 | AD586: 8
A588: PORT MELBOURNE | C588: 5 | D588: 6 | E588: =C588*6+D588 -> 36 | G588: 7 | H588: 9 | I588: =G588*6+H588 -> 51 | K588: 13 | L588: 11 | M588: =K588*6+L588 -> 89 | O588: 14 | P588: 11 | Q588: =O588*6+P588 -> 95 | S588: PORT MELBOURNE
A589: BRUNSWICK | C589: 1 | D589: 2 | E589: =C589*6+D589 -> 8 | G589: 4 | H589: 7 | I589: =G589*6+H589 -> 31 | K589: 5 | L589: 8 | M589: =K589*6+L589 -> 38 | O589: 7 | P589: 11 | Q589: =O589*6+P589 -> 53 | S589: THOMAS
A590: BEST PLAYERS
A591: PORT MELBOURNE | C591: BLOOM | F591: CLEARY | I591: KELSEY | L591: MULLANE | O591: MURRAY | R591: LEWIS
A592: BRUNSWICK | C592: STANLEY | F592: McIVOR | I592: POWELL | L592: SPENCER | O592: TAYLOR | R592: WHELAN
A593: GOALKICKERS
A594: PORT MELBOURNE | C594: BLOOM 4 | E594: LEWIS 3 | G594: CULPH 2 | I594: PERRETT | K594: MULLANE | M594: MURRAY | O594: REYNOLDS | Q594: EGAN
A595: BRUNSWICK | C595: POWELL 3 | F595: SPENCER 2 | I595: NEILSON | K595: McIVOR
A597: PRESTON | C597: 6 | D597: 3 | E597: =C597*6+D597 -> 39 | G597: 6 | H597: 6 | I597: =G597*6+H597 -> 42 | K597: 7 | L597: 15 | M597: =K597*6+L597 -> 57 | O597: 9 | P597: 16 | Q597: =O597*6+P597 -> 70 | S597: TOORAK PARK
A598: PRAHRAN | C598: 1 | D598: 1 | E598: =C598*6+D598 -> 7 | G598: 8 | H598: 5 | I598: =G598*6+H598 -> 53 | K598: 9 | L598: 7 | M598: =K598*6+L598 -> 61 | O598: 10 | P598: 9 | Q598: =O598*6+P598 -> 69 | S598: IRVING
A599: BEST PLAYERS
A600: PRESTON | C600: BLACKMAN | F600: HINES | I600: LEISHMAN | L600: MASLEN | O600: MEARS | R600: BRYCE
A601: PRAHRAN | C601: WALSH | F601: FERGEUS | I601: JONES | L601: HILL | O601: OPRAY | R601: MCCULLOCH
A602: GOALKICKERS
A603: PRESTON | C603: HINES 3 | F603: PRITCHARD 2 | I603: MEARS | K603: DUNGAN | N603: LALOR | P603: SWEET
A604: PRAHRAN | C604: WALSH 3 | F604: McCULLOCH 3 | J604: BURGESS 2 | M604: O'BRIEN | O604: LENZ
A606: CAMBERWELL | C606: 2 | D606: 3 | E606: =C606*6+D606 -> 15 | G606: 4 | H606: 4 | I606: =G606*6+H606 -> 28 | K606: 9 | L606: 6 | M606: =K606*6+L606 -> 60 | O606: 9 | P606: 8 | Q606: =O606*6+P606 -> 62 | S606: NORTHCOTE
A607: NORTHCOTE | C607: 1 | D607: 0 | E607: =C607*6+D607 -> 6 | G607: 2 | H607: 3 | I607: =G607*6+H607 -> 15 | K607: 3 | L607: 9 | M607: =K607*6+L607 -> 27 | O607: 6 | P607: 12 | Q607: =O607*6+P607 -> 48 | S607: STREETER
A608: BEST PLAYERS
A609: CAMBERWELL | C609: WAKE | F609: BOHAN | I609: LOVETT | L609: PHILPOTT | O609: MILGATE | R609: JENSEN
A610: NORTHCOTE | C610: STABB | F610: HISCOX | I610: PAWSEY | L610: SEARLE | O610: BRUNNEN | R610: WHITE
A611: GOALKICKERS
A612: CAMBERWELL | C612: BOHAN 4 | F612: MILGATE 3 | I612: PHILPOTT | K612: JENSEN
A613: NORTHCOTE | C613: PAWSEY 3 | F613: NASH | H613: CAREY | J613: BRUNNEN
A615: SANDRINGHAM | C615: 2 | D615: 3 | E615: =C615*6+D615 -> 15 | G615: 11 | H615: 8 | I615: =G615*6+H615 -> 74 | K615: 14 | L615: 8 | M615: =K615*6+L615 -> 92 | O615: 19 | P615: 15 | Q615: =O615*6+P615 -> 129 | S615: BEACH ROAD
A616: YARRAVILLE | C616: 5 | D616: 6 | E616: =C616*6+D616 -> 36 | G616: 5 | H616: 6 | I616: =G616*6+H616 -> 36 | K616: 10 | L616: 12 | M616: =K616*6+L616 -> 72 | O616: 10 | P616: 15 | Q616: =O616*6+P616 -> 75 | S616: BARNES
A617: BEST PLAYERS
A618: SANDRINGHAM | C618: BENCRAFT | F618: McFEE | I618: HISCOCK | L618: R HARPER | O618: WEBB | R618: B HARPER
A619: YARRAVILLE | C619: McASEY | F619: MALBON | I619: GARLICK | L619: COLLINS | O619: ROHLEDER | R619: GWYNNE
A620: GOALKICKERS
A621: SANDRINGHAM | C621: McFEE 6 | F621: HISCOCK 6 | I621: BENCRAFT 2 | L621: NEWTON 2 | O621: B HARPER | Q621: R HARPER | T621: ARNEY
A622: YARRAVILLE | C622: McASEY 5 | F622: COLLINS 2 | I622: HICKEY | K622: PHILLIPS | M622: SCARFFE
A624: ROUND 12 | D624: 2ND JULY | J624: WEATHER | M624: COLD DULL NO WIND | S624: PLAYED AT
D625: 1ST QTR | H625: 2ND QTR | L625: 3RD QTR | P625: FINAL | S625: COBURG
A626: COBURG | C626: 3 | D626: 5 | E626: =C626*6+D626 -> 23 | G626: 7 | H626: 10 | I626: =G626*6+H626 -> 52 | K626: 11 | L626: 12 | M626: =K626*6+L626 -> 78 | O626: 12 | P626: 14 | Q626: =O626*6+P626 -> 86 | S626: UMPIRE | X626: LADDER | AB626: ROUND | AD626: 12
A627: PORT MELBOURNE | C627: 3 | D627: 6 | E627: =C627*6+D627 -> 24 | G627: 6 | H627: 10 | I627: =G627*6+H627 -> 46 | K627: 6 | L627: 12 | M627: =K627*6+L627 -> 48 | O627: 9 | P627: 13 | Q627: =O627*6+P627 -> 67 | S627: JONES
A628: BEST PLAYERS | W628: TEAM | X628: W | Y628: L | Z628: D | AA628: FOR | AB628: AGST | AC628: % | AD628: PTS
A629: COBURG | C629: WADE | F629: CONDON | I629: HEEPS | L629: STARBUCK | O629: JAMES | Q629: WALSH
A630: PORT MELBOURNE | C630: REYNOLDS | F630: MURRAY | I630: McNAUGHTON | L630: CLEARY | O630: WILSON | Q630: SEXTON | W630: WILLIAMSTOWN | X630: 10 | Y630: 2 | Z630: 0 | AA630: 1163 | AB630: 929 | AC630: 125.19 | AD630: 40
A631: GOALKICKERS | W631: COBURG | X631: 8 | Y631: 3 | Z631: 1 | AA631: 1182 | AB631: 1064 | AC631: 110.09 | AD631: 34
A632: COBURG | C632: JAMES 6 | F632: JORGENSON 2 | I632: CONDON 2 | L632: CLAPTON | N632: BRADLEY | W632: OAKLEIGH | X632: 8 | Y632: 4 | Z632: 0 | AA632: 1281 | AB632: 985 | AC632: 130.05076142131981 | AD632: 32
A633: PORT MELBOURNE | C633: EGAN 3 | F633: BLOOM 2 | I633: HOUSTON 2 | L633: LEWIS | N633: CULPH | W633: BRIGHTON | X633: 8 | Y633: 4 | Z633: 0 | AA633: 1153 | AB633: 1101 | AC633: 104.72 | AD633: 32
A635: BRUNSWICK | C635: 7 | D635: 0 | E635: =C635*6+D635 -> 42 | G635: 11 | H635: 2 | I635: =G635*6+H635 -> 68 | K635: 13 | L635: 5 | M635: =K635*6+L635 -> 83 | O635: 18 | P635: 6 | Q635: =O635*6+P635 -> 114 | S635: TOORAK PARK | W635: BRUNSWICK | X635: 7 | Y635: 5 | Z635: 0 | AA635: 1102 | AB635: 1022 | AC635: 107.83 | AD635: 28
A636: PRAHRAN | C636: 3 | D636: 2 | E636: =C636*6+D636 -> 20 | G636: 8 | H636: 6 | I636: =G636*6+H636 -> 54 | K636: 9 | L636: 6 | M636: =K636*6+L636 -> 60 | O636: 13 | P636: 11 | Q636: =O636*6+P636 -> 89 | S636: WRIGHT | W636: PORT MELBOURNE | X636: 6 | Y636: 6 | Z636: 0 | AA636: 1022 | AB636: 1035 | AC636: 98.74396135265701 | AD636: 24
A637: BEST PLAYERS | W637: CAMBERWELL | X637: 6 | Y637: 6 | Z637: 0 | AA637: 971 | AB637: 997 | AC637: 97.39 | AD637: 24
A638: BRUNSWICK | C638: McIVOR | E638: SPENCER | H638: WHELAN | K638: HENRYS | N638: GEISLER | Q638: MAHER | W638: PRAHRAN | X638: 5 | Y638: 7 | Z638: 0 | AA638: 1233 | AB638: 1252 | AC638: 98.48 | AD638: 20
A639: PRAHRAN | C639: COLLS | E639: CRAWLEY | H639: ARMSTRONG | K639: OPRAY | N639: MATSON | Q639: McCULLOCH | W639: PRESTON | X639: 5 | Y639: 7 | Z639: 0 | AA639: 1076 | AB639: 1194 | AC639: 90.12 | AD639: 20
A640: GOALKICKERS | W640: NORTHCOTE | X640: 3 | Y640: 8 | Z640: 1 | AA640: 1002 | AB640: 1070 | AC640: 93.64 | AD640: 14
A641: BRUNSWICK | C641: JONES 6 | F641: SPENCER 6 | I641: MAHER 2 | K641: WARD | M641: KUHL | O641: NEILSON | Q641: WHELAN | W641: SANDRINGHAM | X641: 3 | Y641: 9 | Z641: 0 | AA641: 996 | AB641: 1141 | AC641: 87.29 | AD641: 12
A642: PRAHRAN | C642: McCULLOCH 4 | F642: WALSH 4 | I642: BURGESS 2 | L642: ARMSTRONG | O642: CAMPBELL | Q642: OPRAY | W642: YARRAVILLE | X642: 2 | Y642: 10 | Z642: 0 | AA642: 1095 | AB642: 1486 | AC642: 73.69 | AD642: 8
A644: CAMBERWELL | C644: 5 | D644: 3 | E644: =C644*6+D644 -> 33 | G644: 8 | H644: 7 | I644: =G644*6+H644 -> 55 | K644: 10 | L644: 14 | M644: =K644*6+L644 -> 74 | O644: 13 | P644: 16 | Q644: =O644*6+P644 -> 94 | S644: OAKLEIGH
A645: OAKLEIGH | C645: 1 | D645: 4 | E645: =C645*6+D645 -> 10 | G645: 5 | H645: 11 | I645: =G645*6+H645 -> 41 | K645: 8 | L645: 16 | M645: =K645*6+L645 -> 64 | O645: 11 | P645: 25 | Q645: =O645*6+P645 -> 91 | S645: STREETER
A646: BEST PLAYERS
A647: CAMBERWELL | C647: FINNEGAN | F647: HERBERT | I647: MILGATE | L647: ROCHFORD | O647: GIBBS | R647: MILLER
A648: OAKLEIGH | C648: WATSON | F648: HILL | I648: TEMME | L648: JORY | O648: RAWLINGS | R648: SMEATON
A649: GOALKICKERS
A650: CAMBERWELL | C650: FINNEGAN 4 | F650: MILGATE 3 | I650: ROCHFORD 2 | L650: GIBBS 2 | N650: UNSTEAD | Q650: HANMAN
A651: OAKLEIGH | C651: RAWLINGS 4 | F651: LEANE 2 | I651: JORY 2 | K651: NEWTON 2 | N651: BAXTER
A653: NORTHCOTE | C653: 3 | D653: 2 | E653: =C653*6+D653 -> 20 | G653: 12 | H653: 6 | I653: =G653*6+H653 -> 78 | K653: 14 | L653: 7 | M653: =K653*6+L653 -> 91 | O653: 19 | P653: 12 | Q653: =O653*6+P653 -> 126 | S653: NORTHCOTE
A654: YARRAVILLE | C654: 0 | D654: 2 | E654: =C654*6+D654 -> 2 | G654: 2 | H654: 4 | I654: =G654*6+H654 -> 16 | K654: 6 | L654: 10 | M654: =K654*6+L654 -> 46 | O654: 9 | P654: 10 | Q654: =O654*6+P654 -> 64 | S654: ROBINSON
A655: BEST PLAYERS
A656: NORTHCOTE | C656: PAWSEY | F656: McINTOSH | I656: WHITE | L656: CRANE | O656: HISCOX | Q656: STABB
A657: YARRAVILLE | C657: SALT | F657: PHILLIPS | I657: FAIRFULL | L657: YEWERS | O657: WATT | Q657: COLLINS
A658: GOALKICKERS
A659: NORTHCOTE | C659: McINTOSH 4 | F659: WHITE 4 | I659: PAWSEY 3 | L659: BEST 2 | N659: POWELL 2 | Q659: WHITECHURCH 2 | U659: KEN MURPHY | X659: NASH
A660: YARRAVILLE | C660: PHILLIPS 6 | F660: MILLER 2 | I660: FAIRFULL
A662: BRIGHTON | C662: 6 | D662: 2 | E662: =C662*6+D662 -> 38 | G662: 8 | H662: 5 | I662: =G662*6+H662 -> 53 | K662: 11 | L662: 7 | M662: =K662*6+L662 -> 73 | O662: 13 | P662: 10 | Q662: =O662*6+P662 -> 88 | S662: BEACH ROAD
A663: SANDRINGHAM | C663: 3 | D663: 2 | E663: =C663*6+D663 -> 20 | G663: 5 | H663: 6 | I663: =G663*6+H663 -> 36 | K663: 6 | L663: 12 | M663: =K663*6+L663 -> 48 | O663: 9 | P663: 18 | Q663: =O663*6+P663 -> 72 | S663: IRVING
A664: BEST PLAYERS
A665: BRIGHTON | C665: WARBURTON | F665: E TURNER | I665: NEW | K665: ALLEN | N665: MALLOY | Q665: PINDER
A666: SANDRINGHAM | C666: RUSSELL | F666: GRAMBEAU | I666: ANDERSON | K666: BENCRAFT | N666: R HARPER | Q666: WEBB
A667: GOALKICKERS
A668: BRIGHTON | C668: WARBURTON 7 | F668: ADAMSON 3 | I668: KINDER 2 | K668: PICKERING
A669: SANDRINGHAM | C669: BENCRAFT 2 | F669: B HARPER 2 | I669: McFEE 2 | K669: WEBB | M669: CERINI | O669: HISCOCK
A671: WILLIAMSTOWN | C671: 3 | D671: 0 | E671: =C671*6+D671 -> 18 | G671: 8 | H671: 8 | I671: =G671*6+H671 -> 56 | K671: 12 | L671: 13 | M671: =K671*6+L671 -> 85 | O671: 16 | P671: 19 | Q671: =O671*6+P671 -> 115 | S671: WILLIAMSTOWN
A672: PRESTON | C672: 6 | D672: 2 | E672: =C672*6+D672 -> 38 | G672: 8 | H672: 2 | I672: =G672*6+H672 -> 50 | K672: 12 | L672: 10 | M672: =K672*6+L672 -> 82 | O672: 13 | P672: 11 | Q672: =O672*6+P672 -> 89 | S672: THOMAS
A673: BEST PLAYERS
A674: WILLIAMSTOWN | C674: TODD | F674: McRAE | I674: WELLS | K674: SALVAS | N674: McPHERSON | Q674: DANCKERT
A675: PRESTON | C675: NATHAN | F675: GOLDIN | I675: MEARS | K675: BRYCE | N675: HINES | Q675: LEHMANN
A676: GOALKICKERS
A677: WILLIAMSTOWN | C677: TODD 7 | F677: ABBERTON 2 | I677: McPHERSON 2 | L677: MCRAE 2 | N677: COLLINS | P677: CHAPMAN | R677: WALKER
A678: PRESTON | C678: GOLDIN 4 | F678: NATHAN 3 | I678: MEARS 2 | K678: DUNGAN 2 | N678: HINES | P678: LEHMANN
A680: ROUND 13 | D680: 9TH JULY | J680: WEATHER | M680: NORTH WEST WIND FINE SUNNY | S680: PLAYED AT
D681: 1ST QTR | H681: 2ND QTR | L681: 3RD QTR | P681: FINAL | S681: BRUNSWICK
A682: BRUNSWICK | C682: 4 | D682: 1 | E682: =C682*6+D682 -> 25 | G682: 5 | H682: 3 | I682: =G682*6+H682 -> 33 | K682: 6 | L682: 8 | M682: =K682*6+L682 -> 44 | O682: 8 | P682: 11 | Q682: =O682*6+P682 -> 59 | S682: UMPIRE | X682: LADDER | AB682: ROUND | AD682: 13
A683: WILLIAMSTOWN | C683: 2 | D683: 2 | E683: =C683*6+D683 -> 14 | G683: 5 | H683: 6 | I683: =G683*6+H683 -> 36 | K683: 5 | L683: 7 | M683: =K683*6+L683 -> 37 | O683: 5 | P683: 10 | Q683: =O683*6+P683 -> 40 | S683: ROBINSON
A684: BEST PLAYERS | W684: TEAM | X684: W | Y684: L | Z684: D | AA684: FOR | AB684: AGST | AC684: % | AD684: PTS
A685: BRUNSWICK | C685: WHELAN | F685: KUHL | I685: SHAW | K685: McIVOR | N685: GEISLER | Q685: YEA
A686: WILLIAMSTOWN | C686: SAMPSON | F686: DANCKERT | I686: WILCOX | K686: WILLIAMS | N686: McRAE | Q686: McPHERSON | W686: WILLIAMSTOWN | X686: 10 | Y686: 3 | Z686: 0 | AA686: 1203 | AB686: 988 | AC686: 121.76 | AD686: 40
A687: GOALKICKERS | W687: OAKLEIGH | X687: 9 | Y687: 4 | Z687: 0 | AA687: 1361 | AB687: 1058 | AC687: 128.6389413988658 | AD687: 36
A688: BRUNSWICK | C688: KUHL | E688: WARD | G688: WHELAN | I688: PRIESTLEY | K688: CROUCH | M688: NEILSON | O688: SPENCER | Q688: HENRYS | W688: BRIGHTON | X688: 9 | Y688: 4 | Z688: 0 | AA688: 1289 | AB688: 1181 | AC688: 109.14 | AD688: 36
A689: WILLIAMSTOWN | C689: TODD 3 | F689: McPHERSON | I689: COLLINS | W689: COBURG | X689: 8 | Y689: 4 | Z689: 1 | AA689: 1267 | AB689: 1150 | AC689: 110.17 | AD689: 34
A691: CAMBERWELL | C691: 6 | D691: 3 | E691: =C691*6+D691 -> 39 | G691: 7 | H691: 7 | I691: =G691*6+H691 -> 49 | K691: 12 | L691: 12 | M691: =K691*6+L691 -> 84 | O691: 12 | P691: 14 | Q691: =O691*6+P691 -> 86 | S691: CAMBERWELL | W691: BRUNSWICK | X691: 8 | Y691: 5 | Z691: 0 | AA691: 1161 | AB691: 1062 | AC691: 109.32 | AD691: 32
A692: COBURG | C692: 1 | D692: 2 | E692: =C692*6+D692 -> 8 | G692: 9 | H692: 5 | I692: =G692*6+H692 -> 59 | K692: 10 | L692: 7 | M692: =K692*6+L692 -> 67 | O692: 12 | P692: 13 | Q692: =O692*6+P692 -> 85 | S692: IRVING | W692: PORT MELBOURNE | X692: 7 | Y692: 6 | Z692: 0 | AA692: 1098 | AB692: 1100 | AC692: 99.818181818181813 | AD692: 28
A693: BEST PLAYERS | W693: CAMBERWELL | X693: 7 | Y693: 6 | Z693: 0 | AA693: 1057 | AB693: 1082 | AC693: 97.69 | AD693: 28
A694: CAMBERWELL | C694: HERBERT | F694: FINNEGAN | I694: MILER | L694: BOHAN | N694: MILGATE | Q694: DUFF | W694: PRESTON | X694: 6 | Y694: 7 | Z694: 0 | AA694: 1200 | AB694: 1258 | AC694: 95.39 | AD694: 24
A695: COBURG | C695: EQUID | F695: CONDON | I695: JORGENSON | L695: WALSH | N695: JAMES | Q695: CLAPTON | W695: PRAHRAN | X695: 5 | Y695: 8 | Z695: 0 | AA695: 1298 | AB695: 1328 | AC695: 97.74 | AD695: 20
A696: GOALKICKERS | W696: NORTHCOTE | X696: 3 | Y696: 9 | Z696: 1 | AA696: 1082 | AB696: 1206 | AC696: 89.72 | AD696: 14
A697: CAMBERWELL | C697: MILGATE 4 | F697: HERBERT 3 | I697: JENSEN 2 | K697: FINNEGAN | M697: PHILPOTT | O697: BOHAN | W697: SANDRINGHAM | X697: 3 | Y697: 10 | Z697: 0 | AA697: 1060 | AB697: 1265 | AC697: 83.79 | AD697: 12
A698: COBURG | C698: JAMES 4 | F698: JORGENSON 4 | I698: CONDON 2 | L698: ROGAN 2 | W698: YARRAVILLE | X698: 2 | Y698: 11 | Z698: 0 | AA698: 1168 | AB698: 1566 | AC698: 74.58 | AD698: 8
A700: PORT MELBOURNE | C700: 2 | D700: 8 | E700: =C700*6+D700 -> 20 | G700: 6 | H700: 9 | I700: =G700*6+H700 -> 45 | K700: 10 | L700: 14 | M700: =K700*6+L700 -> 74 | O700: 10 | P700: 16 | Q700: =O700*6+P700 -> 76 | S700: PORT MELBOURNE
A701: PRAHRAN | C701: 1 | D701: 2 | E701: =C701*6+D701 -> 8 | G701: 4 | H701: 4 | I701: =G701*6+H701 -> 28 | K701: 7 | L701: 5 | M701: =K701*6+L701 -> 47 | O701: 9 | P701: 11 | Q701: =O701*6+P701 -> 65 | S701: STREETER
A702: BEST PLAYERS
A703: PORT MELBOURNE | C703: MULLANE | F703: CLEARY | I703: EGAN | L703: MURRAY | O703: BLOOM | R703: CULPH
A704: PRAHRAN | C704: LENZ | F704: WOOD | I704: FERGEUS | L704: HILL | O704: KEEGAN | R704: WALSH
A705: GOALKICKERS
A706: PORT MELBOURNE | C706: CULPH 4 | F706: MURRAY 2 | I706: EGAN | K706: SEXTON | M706: LEWIS | O706: REYNOLDS
A707: PRAHRAN | C707: LENZ 5 | F707: McCULLOCH 2 | J707: FERGEUS | M707: CAMPBELL
A709: PRESTON | C709: 11 | D709: 9 | E709: =C709*6+D709 -> 75 | G709: 11 | H709: 11 | I709: =G709*6+H709 -> 77 | K709: 17 | L709: 20 | M709: =K709*6+L709 -> 122 | O709: 17 | P709: 22 | Q709: =O709*6+P709 -> 124 | S709: PRESTON
A710: SANDRINGHAM | C710: 0 | D710: 0 | E710: =C710*6+D710 -> 0 | G710: 4 | H710: 11 | I710: =G710*6+H710 -> 35 | K710: 4 | L710: 11 | M710: =K710*6+L710 -> 35 | O710: 8 | P710: 16 | Q710: =O710*6+P710 -> 64 | S710: JONES
A711: BEST PLAYERS
A712: PRESTON | C712: BLACKMAN | F712: NATHAN | I712: BRYCE | L712: C STEWART | O712: LEISHMAN | R712: HINES
A713: SANDRINGHAM | C713: R HARPER | F713: B HARPER | I713: STANLEY | L713: McFEE | O713: McLEOD | R713: ANDRESON
A714: GOALKICKERS
A715: PRESTON | C715: NATHAN 5 | F715: FOSTER 3 | I715: BLACKMAN 2 | L715: DUNGAN 2 | N715: MEARS 2 | P715: HINES | R715: BRYCE | T715: CONNELLY
A716: SANDRINGHAM | C716: McFEE 2 | F716: BENCRAFT 2 | I716: B HARPER | K716: DEMPSTER | N716: ANDRESON | Q716: HISCOCK
A718: BRIGHTON | C718: 3 | D718: 2 | E718: =C718*6+D718 -> 20 | G718: 10 | H718: 11 | I718: =G718*6+H718 -> 71 | K718: 12 | L718: 12 | M718: =K718*6+L718 -> 84 | O718: 19 | P718: 22 | Q718: =O718*6+P718 -> 136 | S718: ELSTERNWICK PARK
A719: NORTHCOTE | C719: 4 | D719: 6 | E719: =C719*6+D719 -> 30 | G719: 5 | H719: 8 | I719: =G719*6+H719 -> 38 | K719: 8 | L719: 16 | M719: =K719*6+L719 -> 64 | O719: 10 | P719: 20 | Q719: =O719*6+P719 -> 80 | S719: THOMAS
A720: BEST PLAYERS
A721: BRIGHTON | C721: McINDOE | F721: HOWE | I721: WARBURTON | L721: RIDDELL | O721: SHALESS | Q721: ALLEN
A722: NORTHCOTE | C722: CRANE | F722: McINTOSH | I722: POWELL | L722: CASPAR | O722: HINES | Q722: HISCOX
A723: GOALKICKERS
A724: BRIGHTON | C724: WARBURTON 5 | F724: HOWE 5 | H724: ADAMSON 4 | K724: McINDOE 2 | N724: SHALLESS | Q724: CONROY | S724: J BURNS
A725: NORTHCOTE | C725: McINTOSH 2 | F725: WHITE 2 | H725: WHITECHURCH 2 | L725: POWELL | N725: BRUNNEN | Q725: SEARLE | S725: GREENWOOD
A727: OAKLEIGH | C727: 2 | D727: 11 | E727: =C727*6+D727 -> 23 | G727: 2 | H727: 13 | I727: =G727*6+H727 -> 25 | K727: 10 | L727: 20 | M727: =K727*6+L727 -> 80 | O727: 10 | P727: 20 | Q727: =O727*6+P727 -> 80 | S727: YARRAVILLE
A728: YARRAVILLE | C728: 0 | D728: 1 | E728: =C728*6+D728 -> 1 | G728: 5 | H728: 7 | I728: =G728*6+H728 -> 37 | K728: 6 | L728: 9 | M728: =K728*6+L728 -> 45 | O728: 10 | P728: 13 | Q728: =O728*6+P728 -> 73 | S728: WRIGHT
A729: BEST PLAYERS
A730: OAKLEIGH | C730: HILL | F730: BOYLE | I730: DONNELLY | L730: BAXTER | O730: JORY | Q730: LEANE
A731: YARRAVILLE | C731: WOOD | F731: BERNARD | I731: SCARFFE | L731: YEWERS | O731: HICKEY | Q731: YATES
A732: GOALKICKERS
A733: OAKLEIGH | C733: SMEATON 2 | F733: LEANE 2 | I733: MARION 2 | L733: JORY | N733: HILL | P733: PERKINS | R733: NEWTON
A734: YARRAVILLE | C734: McASEY 3 | F734: PHILLIPS 2 | I734: COLLINS 2 | L734: SCARFFE | N734: HICKEY | P734: MILLER
A736: ROUND 14 | D736: 16TH JULY | H736: WEATHER | K736: NORTH WIND DULL RAIN IN 2ND HALF | S736: PLAYED AT
D737: 1ST QTR | H737: 2ND QTR | L737: 3RD QTR | P737: FINAL | S737: OAKLEIGH
A738: BRIGHTON | C738: 2 | D738: 2 | E738: =C738*6+D738 -> 14 | G738: 7 | H738: 2 | I738: =G738*6+H738 -> 44 | K738: 8 | L738: 4 | M738: =K738*6+L738 -> 52 | O738: 14 | P738: 11 | Q738: =O738*6+P738 -> 95 | S738: UMPIRE | X738: LADDER | AB738: ROUND | AD738: 14
A739: OAKLEIGH | C739: 5 | D739: 5 | E739: =C739*6+D739 -> 35 | G739: 8 | H739: 5 | I739: =G739*6+H739 -> 53 | K739: 11 | L739: 11 | M739: =K739*6+L739 -> 77 | O739: 13 | P739: 12 | Q739: =O739*6+P739 -> 90 | S739: ROBINSON
A740: BEST PLAYERS | W740: TEAM | X740: W | Y740: L | Z740: D | AA740: FOR | AB740: AGST | AC740: % | AD740: PTS
A741: BRIGHTON | C741: McINDOE | F741: E TURNER | I741: PLUNKETT | L741: PINDER | O741: SLEIGH | Q741: LUMMIS
A742: OAKLEIGH | C742: DONNELLY | F742: DEAYTON | I742: WATSON | L742: PERKINS | O742: JORY | Q742: WENN | W742: WILLIAMSTOWN | X742: 11 | Y742: 3 | Z742: 0 | AA742: 1279 | AB742: 1054 | AC742: 121.35 | AD742: 44
A743: GOALKICKERS | W743: BRIGHTON | X743: 10 | Y743: 4 | Z743: 0 | AA743: 1384 | AB743: 1271 | AC743: 108.89 | AD743: 40
A744: BRIGHTON | C744: McINDOE 4 | F744: WARBURTON 3 | I744: HOWE 2 | K744: ADAMSON 2 | N744: J BURNS 2 | Q744: PINDER | W744: COBURG | X744: 9 | Y744: 4 | Z744: 1 | AA744: 1363 | AB744: 1236 | AC744: 110.28 | AD744: 38
A745: OAKLEIGH | C745: WENN 6 | F745: SMEATON 2 | I745: RAWLINGS | K745: R FIIN | M745: WILLIAMS | O745: DEAYTON | Q745: HALL | W745: OAKLEIGH | X745: 9 | Y745: 5 | Z745: 0 | AA745: 1451 | AB745: 1153 | AC745: 125.84562012142237 | AD745: 36
A747: WILLIAMSTOWN | C747: 3 | D747: 5 | E747: =C747*6+D747 -> 23 | G747: 8 | H747: 7 | I747: =G747*6+H747 -> 55 | K747: 9 | L747: 9 | M747: =K747*6+L747 -> 63 | O747: 10 | P747: 16 | Q747: =O747*6+P747 -> 76 | S747: WILLIAMSTOWN | W747: BRUNSWICK | X747: 8 | Y747: 5 | Z747: 1 | AA747: 1260 | AB747: 1161 | AC747: 108.53 | AD747: 34
A748: PORT MELBOURNE | C748: 6 | D748: 2 | E748: =C748*6+D748 -> 38 | G748: 7 | H748: 6 | I748: =G748*6+H748 -> 48 | K748: 9 | L748: 10 | M748: =K748*6+L748 -> 64 | O748: 9 | P748: 12 | Q748: =O748*6+P748 -> 66 | S748: WRIGHT | W748: CAMBERWELL | X748: 8 | Y748: 6 | Z748: 0 | AA748: 1235 | AB748: 1205 | AC748: 102.49 | AD748: 32
A749: BEST PLAYERS | W749: PORT MELBOURNE | X749: 7 | Y749: 7 | Z749: 0 | AA749: 1164 | AB749: 1176 | AC749: 98.979591836734699 | AD749: 28
A750: WILLIAMSTOWN | C750: WELLS | E750: McPHERSON | H750: SAMPSON | K750: McRAE | N750: COLLINS | Q750: WILCOX | W750: PRESTON | X750: 7 | Y750: 7 | Z750: 0 | AA750: 1300 | AB750: 1318 | AC750: 98.63 | AD750: 28
A751: PORT MELBOURNE | C751: LEWIS | E751: CLEARY | H751: BLOOM | K751: DRINAN | N751: AUSTIN | Q751: MULLANE | W751: PRAHRAN | X751: 5 | Y751: 9 | Z751: 0 | AA751: 1384 | AB751: 1424 | AC751: 97.19 | AD751: 20
A752: GOALKICKERS | W752: NORTHCOTE | X752: 3 | Y752: 10 | Z752: 1 | AA752: 1142 | AB752: 1306 | AC752: 87.44 | AD752: 14
A753: WILLIAMSTOWN | C753: TODD 3 | F753: McPHERSON 2 | I753: WALKER 2 | L753: COLLINS 2 | N753: MATTHEWS | W753: SANDRINGHAM | X753: 3 | Y753: 10 | Z753: 1 | AA753: 1159 | AB753: 1364 | AC753: 84.97 | AD753: 14
A754: PORT MELBOURNE | C754: AUSTIN 4 | F754: CULPH 2 | I754: LEWIS 2 | K754: BAKER | W754: YARRAVILLE | X754: 2 | Y754: 12 | Z754: 0 | AA754: 1295 | AB754: 1740 | AC754: 74.43 | AD754: 8
A756: COBURG | C756: 3 | D756: 4 | E756: =C756*6+D756 -> 22 | G756: 10 | H756: 7 | I756: =G756*6+H756 -> 67 | K756: 12 | L756: 8 | M756: =K756*6+L756 -> 80 | O756: 14 | P756: 12 | Q756: =O756*6+P756 -> 96 | S756: COBURG
A757: PRAHRAN | C757: 2 | D757: 4 | E757: =C757*6+D757 -> 16 | G757: 4 | H757: 10 | I757: =G757*6+H757 -> 34 | K757: 9 | L757: 13 | M757: =K757*6+L757 -> 67 | O757: 11 | P757: 20 | Q757: =O757*6+P757 -> 86 | S757: STREETER
A758: BEST PLAYERS
A759: COBURG | C759: STARBUCK | F759: ROGAN | I759: CONDON | L759: WILSON | N759: WADE | Q759: SPENCER
A760: PRAHRAN | C760: MORROW | F760: KEEGAN | I760: McCULLOCH | L760: WALSH | N760: MATSON | Q760: BURGESS
A761: GOALKICKERS
A762: COBURG | C762: JAMES 4 | F762: ROGAN 3 | I762: WILSON 2 | L762: JORGENSON 2 | O762: CONDON 2 | R762: WALSH
A763: PRAHRAN | C763: McCULLOCH 4 | F763: MORROW 3 | I763: BURGESS 2 | L763: ARMSTRONG | O763: QUINN
A765: PRESTON | C765: 5 | D765: 5 | E765: =C765*6+D765 -> 35 | G765: 10 | H765: 7 | I765: =G765*6+H765 -> 67 | K765: 14 | L765: 9 | M765: =K765*6+L765 -> 93 | O765: 15 | P765: 10 | Q765: =O765*6+P765 -> 100 | S765: NORTHCOTE
A766: NORTHCOTE | C766: 3 | D766: 1 | E766: =C766*6+D766 -> 19 | G766: 6 | H766: 3 | I766: =G766*6+H766 -> 39 | K766: 8 | L766: 5 | M766: =K766*6+L766 -> 53 | O766: 9 | P766: 6 | Q766: =O766*6+P766 -> 60 | S766: IRVING
A767: BEST PLAYERS
A768: PRESTON | C768: DUNGAN | F768: STEWART | I768: PRITCHARD | L768: NATHAN | N768: BLACKMAN | Q768: GOLDIN
A769: NORTHCOTE | C769: HISCOX | F769: McINTOSH | I769: CASPAR | L769: PAWSEY | N769: WHITECHURCH | Q769: WHITE
A770: GOALKICKERS
A771: PRESTON | C771: DUNGAN 6 | F771: BRYCE 3 | H771: FOSTER 2 | J771: MEARS 2 | M771: BLACKMAN | P771: NATHAN
A772: NORTHCOTE | C772: PAWSEY 4 | F772: WHITECHURCH 2 | J772: McINTOSH 2 | M772: McBRIDE
A774: CAMBERWELL | C774: 9 | D774: 5 | E774: =C774*6+D774 -> 59 | G774: 12 | H774: 10 | I774: =G774*6+H774 -> 82 | K774: 24 | L774: 17 | M774: =K774*6+L774 -> 161 | O774: 26 | P774: 22 | Q774: =O774*6+P774 -> 178 | S774: CAMBERWELL
A775: YARRAVILLE | C775: 5 | D775: 0 | E775: =C775*6+D775 -> 30 | G775: 9 | H775: 7 | I775: =G775*6+H775 -> 61 | K775: 9 | L775: 8 | M775: =K775*6+L775 -> 62 | O775: 18 | P775: 15 | Q775: =O775*6+P775 -> 123 | S775: JONES
A776: BEST PLAYERS
A777: CAMBERWELL | C777: BOHAN | F777: FINNEGAN | I777: STUBBS | K777: MILLER | N777: HERBERT | Q777: MILGATE
A778: YARRAVILLE | C778: PHILLIPS | F778: MILLER | I778: SALT | K778: COLLINS | N778: GARLICK | Q778: MALBON
A779: GOALKICKERS
A780: CAMBERWELL | C780: FINNEGAN 6 | F780: BOHAN 5 | I780: MILGATE 5 | L780: HERBERT 3 | N780: JENSEN 3 | P780: HANMAN 2 | R780: UNSTEAD | U780: SHARPLES
A781: YARRAVILLE | C781: PHILLIPS 6 | F781: COLLINS 3 | I781: WATTS 3 | K781: MILLER 2 | M781: EDWARDS | O781: SCARFFE | Q781: McASEY | S781: HICKEY
A783: SANDRINGHAM | C783: 5 | D783: 9 | E783: =C783*6+D783 -> 39 | G783: 6 | H783: 11 | I783: =G783*6+H783 -> 47 | K783: 11 | L783: 17 | M783: =K783*6+L783 -> 83 | O783: 13 | P783: 21 | Q783: =O783*6+P783 -> 99 | S783: BEACH ROAD
A784: BRUNSWICK | C784: 1 | D784: 1 | E784: =C784*6+D784 -> 7 | G784: 7 | H784: 6 | I784: =G784*6+H784 -> 48 | K784: 10 | L784: 8 | M784: =K784*6+L784 -> 68 | O784: 14 | P784: 15 | Q784: =O784*6+P784 -> 99 | S784: THOMAS
A785: BEST PLAYERS
A786: SANDRINGHAM | C786: RUSSELL | F786: BENCRAFT | I786: HEADEN | L786: McRAE | N786: R HARPER | Q786: BROWN
A787: BRUNSWICK | C787: McIVOR | F787: HENRYS | I787: SPENCER | L787: WHELAN | N787: SHAW | Q787: GLASSCOTT
A788: GOALKICKERS
A789: SANDRINGHAM | C789: R HARPER 3 | F789: B HARPER 2 | I789: CERINI 2 | K789: GILBERT | M789: ARNEY | O789: HISCOCK | Q789: BENCRAFT | T789: McFEE | W789: NEWTON
A790: BRUNSWICK | C790: SPENCER 4 | F790: JONES 3 | I790: KUHL 3 | K790: MAHER | M790: SHAW | O790: PRIESTLEY | Q790: McIVOR
A792: ROUND 15 | D792: 23RD JULY | J792: WEATHER | M792: NO WIND DULL HEAVY GROUNDS | S792: PLAYED AT
D793: 1ST QTR | H793: 2ND QTR | L793: 3RD QTR | P793: FINAL | S793: ELSTERNWICK PARK
A794: BRIGHTON | C794: 2 | D794: 1 | E794: =C794*6+D794 -> 13 | G794: 5 | H794: 13 | I794: =G794*6+H794 -> 43 | K794: 10 | L794: 19 | M794: =K794*6+L794 -> 79 | O794: 15 | P794: 25 | Q794: =O794*6+P794 -> 115 | S794: UMPIRE | X794: LADDER | AB794: ROUND | AD794: 15
A795: CAMBERWELL | C795: 6 | D795: 3 | E795: =C795*6+D795 -> 39 | G795: 9 | H795: 7 | I795: =G795*6+H795 -> 61 | K795: 12 | L795: 10 | M795: =K795*6+L795 -> 82 | O795: 12 | P795: 13 | Q795: =O795*6+P795 -> 85 | S795: WRIGHT
A796: BEST PLAYERS | W796: TEAM | X796: W | Y796: L | Z796: D | AA796: FOR | AB796: AGST | AC796: % | AD796: PTS
A797: BRIGHTON | C797: McINDOE | E797: G TURNER | H797: WARBURTON | K797: WILLIAMSON | N797: J BURNS | Q797: LUMMIS
A798: CAMBERWELL | C798: BOHAN | E798: MILGATE | H798: SHARPLES | K798: COOK | N798: FLETCHER | Q798: ROCHFORD | W798: WILLIAMSTOWN | X798: 11 | Y798: 4 | Z798: 0 | AA798: 1379 | AB798: 1180 | AC798: 116.86 | AD798: 44
A799: GOALKICKERS | W799: BRIGHTON | X799: 11 | Y799: 4 | Z799: 0 | AA799: 1499 | AB799: 1356 | AC799: 110.55 | AD799: 44
A800: BRIGHTON | C800: WARBURTON 6 | G800: ADAMSON 4 | J800: HOWE 2 | L800: NEW | N800: SHALLESS | Q800: J BURNS | W800: COBURG | X800: 10 | Y800: 4 | Z800: 1 | AA800: 1457 | AB800: 1323 | AC800: 110.13 | AD800: 42
A801: CAMBERWELL | C801: MILGATE 6 | G801: BOHAN 5 | J801: SHARPLES | W801: OAKLEIGH | X801: 10 | Y801: 5 | Z801: 0 | AA801: 1548 | AB801: 1233 | AC801: 125.54744525547446 | AD801: 40
A803: OAKLEIGH | C803: 7 | D803: 8 | E803: =C803*6+D803 -> 50 | G803: 10 | H803: 9 | I803: =G803*6+H803 -> 69 | K803: 12 | L803: 16 | M803: =K803*6+L803 -> 88 | O803: 13 | P803: 19 | Q803: =O803*6+P803 -> 97 | S803: PRESTON | W803: BRUNSWICK | X803: 9 | Y803: 5 | Z803: 1 | AA803: 1373 | AB803: 1199 | AC803: 114.51 | AD803: 38
A804: PRESTON | C804: 2 | D804: 3 | E804: =C804*6+D804 -> 15 | G804: 5 | H804: 8 | I804: =G804*6+H804 -> 38 | K804: 9 | L804: 10 | M804: =K804*6+L804 -> 64 | O804: 11 | P804: 14 | Q804: =O804*6+P804 -> 80 | S804: STREETER | W804: PORT MELBOURNE | X804: 8 | Y804: 7 | Z804: 0 | AA804: 1295 | AB804: 1254 | AC804: 103.26953748006379 | AD804: 32
A805: BEST PLAYERS | W805: CAMBERWELL | X805: 8 | Y805: 7 | Z805: 0 | AA805: 1320 | AB805: 1320 | AC805: 100 | AD805: 32
A806: OAKLEIGH | C806: WENN | F806: WILLIAMS | I806: TIVENDALE | L806: BOYLE | N806: EDWARDS | Q806: PERKINS | W806: PRESTON | X806: 7 | Y806: 8 | Z806: 0 | AA806: 1380 | AB806: 1415 | AC806: 97.53 | AD806: 28
A807: PRESTON | C807: BLACKMAN | F807: BRYCE | I807: LEISHMAN | L807: STEWART | N807: NATHAN | Q807: HIND | W807: PRAHRAN | X807: 6 | Y807: 9 | Z807: 0 | AA807: 1510 | AB807: 1524 | AC807: 99.08 | AD807: 24
A808: GOALKICKERS | W808: NORTHCOTE | X808: 3 | Y808: 11 | Z808: 1 | AA808: 1180 | AB808: 1419 | AC808: 83.16 | AD808: 14
A809: OAKLEIGH | C809: TIVENDALE 3 | F809: WENN 2 | H809: RAWLINGS 2 | K809: BAXTER | M809: WILLIAMS | O809: MARION | Q809: EDWARDS | S809: LEANE | W809: SANDRINGHAM | X809: 3 | Y809: 11 | Z809: 1 | AA809: 1237 | AB809: 1495 | AC809: 82.74 | AD809: 14
A810: PRESTON | C810: NATHAN 4 | F810: GOLDIN 2 | I810: BRYCE 2 | K810: MEARS | M810: HINES | O810: DUNGAN | W810: YARRAVILLE | X810: 2 | Y810: 13 | Z810: 0 | AA810: 1378 | AB810: 1838 | AC810: 74.97 | AD810: 8
A812: PRAHRAN | C812: 3 | D812: 2 | E812: =C812*6+D812 -> 20 | G812: 9 | H812: 4 | I812: =G812*6+H812 -> 58 | K812: 14 | L812: 9 | M812: =K812*6+L812 -> 93 | O812: 18 | P812: 18 | Q812: =O812*6+P812 -> 126 | S812: TOORAK PARK
A813: WILLIAMSTOWN | C813: 7 | D813: 3 | E813: =C813*6+D813 -> 45 | G813: 10 | H813: 7 | I813: =G813*6+H813 -> 67 | K813: 11 | L813: 9 | M813: =K813*6+L813 -> 75 | O813: 15 | P813: 10 | Q813: =O813*6+P813 -> 100 | S813: ROBINSON
A814: BEST PLAYERS
A815: PRAHRAN | C815: ARMSTRONG | F815: WOOD | I815: WALSH | L815: BURGESS | N815: McCULLOCH | Q815: SHILLABEER
A816: WILLIAMSTOWN | C816: SAMPSON | F816: WALKER | I816: McPHERSON | L816: COLLINS | N816: TODD | Q816: WILCOX
A817: GOALKICKERS
A818: PRAHRAN | C818: WALSH 5 | F818: McCULLOCH 4 | I818: FERGEUS 4 | L818: WOOD 3 | N818: MORROW | Q818: BURGESS
A819: WILLIAMSTOWN | C819: TODD 6 | F819: COLLINS 4 | I819: McPHERSON 2 | L819: ABBERTON | N819: WALKER | P819: STRANG
A821: PORT MELBOURNE | C821: 6 | D821: 6 | E821: =C821*6+D821 -> 42 | G821: 10 | H821: 8 | I821: =G821*6+H821 -> 68 | K821: 15 | L821: 10 | M821: =K821*6+L821 -> 100 | O821: 19 | P821: 17 | Q821: =O821*6+P821 -> 131 | S821: PORT MELBOURNE
A822: SANDRINGHAM | C822: 1 | D822: 3 | E822: =C822*6+D822 -> 9 | G822: 4 | H822: 7 | I822: =G822*6+H822 -> 31 | K822: 11 | L822: 8 | M822: =K822*6+L822 -> 74 | O822: 11 | P822: 12 | Q822: =O822*6+P822 -> 78 | S822: JONES
A823: BEST PLAYERS
A824: PORT MELBOURNE | C824: BLOOM | F824: MURRAY | I824: DRINAN | L824: CLEARY | N824: AUSTIN | Q824: PERRETT
A825: SANDRINGHAM | C825: ANDRESON | F825: R HARPER | I825: DEMPSTER | L825: CAMPBELL | N825: HEADEN | Q825: GUILLE
A826: GOALKICKERS
A827: PORT MELBOURNE | C827: AUSTIN 5 | F827: PERRETT 4 | I827: BLOOM 4 | K827: SEXTON 2 | M827: MURRAY 2 | P827: CULPH 2
A828: SANDRINGHAM | C828: R HARPER 3 | F828: ANDRESSON 3 | I828: HISCOX 2 | K828: CERINI | M828: N BENCRAFT | P828: McFEE
A830: BRUNSWICK | C830: 1 | D830: 5 | E830: =C830*6+D830 -> 11 | G830: 5 | H830: 9 | I830: =G830*6+H830 -> 39 | K830: 9 | L830: 13 | M830: =K830*6+L830 -> 67 | O830: 15 | P830: 23 | Q830: =O830*6+P830 -> 113 | S830: BRUNSWICK
A831: NORTHCOTE | C831: 1 | D831: 3 | E831: =C831*6+D831 -> 9 | G831: 3 | H831: 5 | I831: =G831*6+H831 -> 23 | K831: 3 | L831: 11 | M831: =K831*6+L831 -> 29 | O831: 4 | P831: 14 | Q831: =O831*6+P831 -> 38 | S831: THOMAS
A832: BEST PLAYERS
A833: BRUNSWICK | C833: SHAW | E833: MCIVOR | H833: GEISLER | K833: RINGROSE | N833: SPENCER | Q833: YEA
A834: NORTHCOTE | C834: CASPAR | E834: PAWSEY | H834: WHITECHURCH | K834: POWELL | N834: STAFFORD | Q834: KINDER
A835: GOALKICKERS
A836: BRUNSWICK | C836: SPENCER 3 | F836: KUHL 3 | H836: RINGROSE 3 | K836: HARDIMAN 2 | N836: SHAW | P836: NEILSON | R836: HENRYS | U836: PRIESTLEY
A837: NORTHCOTE | C837: PAWSEY 2 | F837: KINDER | H837: KING
A839: COBURG | C839: 0 | D839: 5 | E839: =C839*6+D839 -> 5 | G839: 8 | H839: 14 | I839: =G839*6+H839 -> 62 | K839: 11 | L839: 19 | M839: =K839*6+L839 -> 85 | O839: 12 | P839: 22 | Q839: =O839*6+P839 -> 94 | S839: YARRAVILLE
A840: YARRAVILLE | C840: 4 | D840: 7 | E840: =C840*6+D840 -> 31 | G840: 7 | H840: 10 | I840: =G840*6+H840 -> 52 | K840: 9 | L840: 20 | M840: =K840*6+L840 -> 74 | O840: 11 | P840: 21 | Q840: =O840*6+P840 -> 87 | S840: IRVING
A841: BEST PLAYERS
A842: COBURG | C842: EQUID | F842: JORGENSON | I842: ROGAN | K842: HOLBROOK | N842: WALSH | Q842: WILSON
A843: YARRAVILLE | C843: MALBON | F843: WOODS | I843: PHILLIPS | K843: COLLINS | N843: SCAEFFE | Q843: CRANAGE
A844: GOALKICKERS
A845: COBURG | C845: JAMES 3 | F845: JORGENSON 3 | I845: EQUID 2 | K845: ROGAN 2 | M845: CLAPTON | O845: DIXON
A846: YARRAVILLE | C846: PHILLIPS 5 | F846: SCARFFE 3 | I846: McASEY | K846: HICKEY | M846: EDWARDS
A848: ROUND 16 | D848: 30TH JULY | J848: WEATHER | M848: NORTH WEST WIND SUNNY | S848: PLAYED AT
D849: 1ST QTR | H849: 2ND QTR | L849: 3RD QTR | P849: FINAL | S849: COBURG
A850: WILLIAMSTOWN | C850: 5 | D850: 6 | E850: =C850*6+D850 -> 36 | G850: 7 | H850: 7 | I850: =G850*6+H850 -> 49 | K850: 12 | L850: 17 | M850: =K850*6+L850 -> 89 | O850: 17 | P850: 17 | Q850: =O850*6+P850 -> 119 | S850: UMPIRE | X850: LADDER | AB850: ROUND | AD850: 16
A851: COBURG | C851: 0 | D851: 1 | E851: =C851*6+D851 -> 1 | G851: 6 | H851: 7 | I851: =G851*6+H851 -> 43 | K851: 8 | L851: 7 | M851: =K851*6+L851 -> 55 | O851: 12 | P851: 13 | Q851: =O851*6+P851 -> 85 | S851: WRIGHT
A852: BEST PLAYERS | W852: TEAM | X852: W | Y852: L | Z852: D | AA852: FOR | AB852: AGST | AC852: % | AD852: PTS
A853: WILLIAMSTOWN | C853: MOLYNEUX | F853: WELLS | I853: McPHERSON | L853: WILCOX | N853: FEATHERBY | Q853: MATTHEWS
A854: COBURG | C854: JAMES | F854: WILSON | I854: ROGAN | L854: CLAPTON | N854: HOLBROOK | Q854: EQUID | W854: WILLIAMSTOWN | X854: 12 | Y854: 4 | Z854: 0 | AA854: 1498 | AB854: 1265 | AC854: 118.42 | AD854: 48
A855: GOALKICKERS | W855: BRIGHTON | X855: 12 | Y855: 4 | Z855: 0 | AA855: 1605 | AB855: 1450 | AC855: 110.69 | AD855: 48
A856: WILLIAMSTOWN | C856: TODD 5 | E856: McPHERSON 4 | H856: WALKER 3 | J856: COLLINS 2 | M856: MOLYNEUX | P856: BERNARD | R856: BARKER | W856: OAKLEIGH | X856: 11 | Y856: 5 | Z856: 0 | AA856: 1690 | AB856: 1312 | AC856: 128.8109756097561 | AD856: 44
A857: COBURG | C857: JAMES 3 | E857: WILSON 3 | H857: ROGAN 2 | J857: CLAPTON | L857: STARBUCK | N857: EQUID | P857: JORGENSON | W857: COBURG | X857: 10 | Y857: 5 | Z857: 1 | AA857: 1542 | AB857: 1442 | AC857: 106.93 | AD857: 42
A859: OAKLEIGH | C859: 4 | D859: 3 | E859: =C859*6+D859 -> 27 | G859: 9 | H859: 6 | I859: =G859*6+H859 -> 60 | K859: 14 | L859: 10 | M859: =K859*6+L859 -> 94 | O859: 21 | P859: 16 | Q859: =O859*6+P859 -> 142 | S859: OAKLEIGH | W859: BRUNSWICK | X859: 9 | Y859: 6 | Z859: 1 | AA859: 1452 | AB859: 1341 | AC859: 108.28 | AD859: 38
A860: BRUNSWICK | C860: 4 | D860: 5 | E860: =C860*6+D860 -> 29 | G860: 5 | H860: 7 | I860: =G860*6+H860 -> 37 | K860: 9 | L860: 11 | M860: =K860*6+L860 -> 65 | O860: 11 | P860: 13 | Q860: =O860*6+P860 -> 79 | S860: JONES | W860: PORT MELBOURNE | X860: 9 | Y860: 7 | Z860: 0 | AA860: 1408 | AB860: 1320 | AC860: 106.66666666666667 | AD860: 36
A861: BEST PLAYERS | W861: CAMBERWELL | X861: 9 | Y861: 7 | Z861: 0 | AA861: 1440 | AB861: 1403 | AC861: 102.64 | AD861: 36
A862: OAKLEIGH | C862: WILLIAMS | F862: BAXTER | I862: DEAYTON | L862: SMEATON | N862: BOYLE | Q862: SCOTT | W862: PRESTON | X862: 7 | Y862: 9 | Z862: 0 | AA862: 1463 | AB862: 1535 | AC862: 95.31 | AD862: 28
A863: BRUNSWICK | C863: McIVOR | F863: WHELAN | I863: SPENCER | L863: YEA | N863: HENRYS | Q863: SHAW | W863: PRAHRAN | X863: 6 | Y863: 10 | Z863: 0 | AA863: 1611 | AB863: 1639 | AC863: 98.29 | AD863: 24
A864: GOALKICKERS | W864: SANDRINGHAM | X864: 4 | Y864: 11 | Z864: 1 | AA864: 1362 | AB864: 1596 | AC864: 85.34 | AD864: 18
A865: OAKLEIGH | C865: R FINN 5 | E865: SCOTT 5 | G865: EDWARDS 3 | J865: WENN 2 | L865: TIVENDALE 2 | O865: DEAYTON | Q865: GRAY | R865: HILL | T865: MARIAN | W865: NORTHCOTE | X865: 3 | Y865: 12 | Z865: 1 | AA865: 1246 | AB865: 1532 | AC865: 81.33 | AD865: 14
A866: BRUNSWICK | C866: SHAW 2 | E866: POWELL 2 | H866: SPENCER 2 | J866: ROGERS 2 | M866: HENRYS | O866: RINGROSE | Q866: KUHL | W866: YARRAVILLE | X866: 2 | Y866: 14 | Z866: 0 | AA866: 1472 | AB866: 1944 | AC866: 75.72 | AD866: 8
A868: CAMBERWELL | C868: 8 | D868: 5 | E868: =C868*6+D868 -> 53 | G868: 9 | H868: 7 | I868: =G868*6+H868 -> 61 | K868: 14 | L868: 15 | M868: =K868*6+L868 -> 99 | O868: 17 | P868: 18 | Q868: =O868*6+P868 -> 120 | S868: CAMBERWELL
A869: PRESTON | C869: 1 | D869: 4 | E869: =C869*6+D869 -> 10 | G869: 3 | H869: 9 | I869: =G869*6+H869 -> 27 | K869: 5 | L869: 10 | M869: =K869*6+L869 -> 40 | O869: 11 | P869: 17 | Q869: =O869*6+P869 -> 83 | S869: THOMAS
A870: BEST PLAYERS
A871: CAMBERWELL | C871: ROCHFORD | F871: HERBERT | I871: BOHAN | L871: MILLER | N871: JENSEN | Q871: SHARPLES
A872: PRESTON | C872: BRYCE | F872: HIND | I872: BLACKMAN | L872: FOSTER | N872: C STEART | Q872: LALOR
A873: GOALKICKERS
A874: CAMBERWELL | C874: HERBERT 3 | F874: BOHAN 3 | H874: MILGATE 3 | J874: BENBOW 2 | M874: JENSEN 2 | O874: GIBBS | Q874: ROCHFORD | T874: DUFF | V874: PHILPOTT
A875: PRESTON | C875: DUNGAN 3 | F875: BRYCE 2 | H875: FOSTER 2 | J875: LALOR | L875: POTTER | N875: LEHMANN | Q875: BROWN
A877: SANDRINGHAM | C877: 7 | D877: 3 | E877: =C877*6+D877 -> 45 | G877: 10 | H877: 4 | I877: =G877*6+H877 -> 64 | K877: 16 | L877: 11 | M877: =K877*6+L877 -> 107 | O877: 17 | P877: 13 | Q877: =O877*6+P877 -> 115 | S877: BEACH ROAD
A878: PRAHRAN | C878: 0 | D878: 1 | E878: =C878*6+D878 -> 1 | G878: 5 | H878: 5 | I878: =G878*6+H878 -> 35 | K878: 8 | L878: 5 | M878: =K878*6+L878 -> 53 | O878: 15 | P878: 11 | Q878: =O878*6+P878 -> 101 | S878: STREETER
A879: BEST PLAYERS
A880: SANDRINGHAM | C880: R HARPER | F880: HEADEN | I880: N BENCRAFT | L880: ANDREW | O880: MCLEOD | Q880: GUILLE
A881: PRAHRAN | C881: MORROW | F881: McCULLOCH | I881: CAMPBELL | L881: WALSH | O881: FERGEUS | Q881: LENZ
A882: GOALKICKERS
A883: SANDRINGHAM | C883: R HARPER 7 | F883: N BENCRAFT 5 | J883: CERINI 2 | L883: GILBERT | N883: HISCOCK | Q883: ANDREW | S883: ARNEY
A884: PRAHRAN | C884: McCULLOCH 5 | F884: LENZ 2 | H884: WOOD 2 | J884: MORROW 2 | M884: ADAMSON | O884: WALSH | Q884: QUINN | S884: OPRAY
A886: PORT MELBOURNE | C886: 3 | D886: 6 | E886: =C886*6+D886 -> 24 | G886: 7 | H886: 10 | I886: =G886*6+H886 -> 52 | K886: 14 | L886: 14 | M886: =K886*6+L886 -> 98 | O886: 16 | P886: 17 | Q886: =O886*6+P886 -> 113 | S886: NORTHCOTE
A887: NORTHCOTE | C887: 1 | D887: 3 | E887: =C887*6+D887 -> 9 | G887: 5 | H887: 6 | I887: =G887*6+H887 -> 36 | K887: 6 | L887: 6 | M887: =K887*6+L887 -> 42 | O887: 9 | P887: 12 | Q887: =O887*6+P887 -> 66 | S887: IRVING
A888: BEST PLAYERS
A889: PORT MELBOURNE | C889: KELSEY | F889: ARGOON | I889: AUSTIN | K889: CULPH | N889: EGAN | Q889: MURRAY
A890: NORTHCOTE | C890: CASPAR | F890: MCINTOSH | I890: STABB | K890: HISCOX | N890: CRANE | Q890: DUNN
A891: GOALKICKERS
A892: PORT MELBOURNE | C892: AUSTIN 6 | F892: LEWIS 3 | I892: EGAN 2 | K892: CULPH 2 | M892: BLOOM | O892: REYNOLDS | Q892: MURRAY
A893: NORTHCOTE | C893: KINDER 4 | F893: McINTOSH 2 | I893: GREENWOOD | L893: CASPAR | N893: BRUNNEN
A895: BRIGHTON | C895: 6 | D895: 1 | E895: =C895*6+D895 -> 37 | G895: 8 | H895: 2 | I895: =G895*6+H895 -> 50 | K895: 15 | L895: 7 | M895: =K895*6+L895 -> 97 | O895: 16 | P895: 10 | Q895: =O895*6+P895 -> 106 | S895: YARRAVILLE
A896: YARRAVILLE | C896: 1 | D896: 3 | E896: =C896*6+D896 -> 9 | G896: 9 | H896: 10 | I896: =G896*6+H896 -> 64 | K896: 10 | L896: 11 | M896: =K896*6+L896 -> 71 | O896: 13 | P896: 16 | Q896: =O896*6+P896 -> 94 | S896: ROBINSON
A897: BEST PLAYERS
A898: BRIGHTON | C898: McINDOE | F898: J BURNS | I898: HOWE | L898: WARBURTON | O898: ADAMSON | R898: NEW
A899: YARRAVILLE | C899: SCARFFE | F899: PHILLIPS | I899: MALBON | L899: McASEY | O899: WATTS | R899: YATES
A900: GOALKICKERS
A901: BRIGHTON | C901: MCINDOE 6 | F901: WARBURTON 4 | J901: ADAMSON 2 | M901: NEW | O901: PINDER | Q901: SHALLESS | T901: HOWE
A902: YARRAVILLE | C902: PHILLIPS 5 | F902: SCARFFE 3 | I902: TURNER 2 | L902: BERNARD | N902: McASEY | P902: COLLINS
A904: ROUND 17 | D904: 6TH AUGUST | J904: WEATHER | M904: WEST WIND FINE & SUNNY | S904: PLAYED AT
D905: 1ST QTR | H905: 2ND QTR | L905: 3RD QTR | P905: FINAL | S905: ELSTERNWICK PARK
A906: COBURG | C906: 5 | D906: 5 | E906: =C906*6+D906 -> 35 | G906: 7 | H906: 8 | I906: =G906*6+H906 -> 50 | K906: 10 | L906: 12 | M906: =K906*6+L906 -> 72 | O906: 16 | P906: 16 | Q906: =O906*6+P906 -> 112 | S906: UMPIRE | X906: LADDER | AB906: ROUND | AD906: 17
A907: BRIGHTON | C907: 1 | D907: 5 | E907: =C907*6+D907 -> 11 | G907: 4 | H907: 12 | I907: =G907*6+H907 -> 36 | K907: 7 | L907: 16 | M907: =K907*6+L907 -> 58 | O907: 11 | P907: 18 | Q907: =O907*6+P907 -> 84 | S907: THOMAS
A908: BEST PLAYERS | W908: TEAM | X908: W | Y908: L | Z908: D | AA908: FOR | AB908: AGST | AC908: % | AD908: PTS
A909: COBURG | C909: HEEPS | F909: HOLBROOK | I909: EQUID | K909: CLAPTON | N909: JAMES | Q909: STARBUCK
A910: BRIGHTON | C910: McINDOE | F910: HEIMS | I910: McASEY | K910: MULLOY | N910: E TURNER | Q910: CONROY | W910: WILLIAMSTOWN | X910: 13 | Y910: 4 | Z910: 0 | AA910: 1633 | AB910: 1336 | AC910: 122.23 | AD910: 52
A911: GOALKICKERS | W911: OAKLEIGH | X911: 12 | Y911: 5 | Z911: 0 | AA911: 1779 | AB911: 1392 | AC911: 127.80172413793103 | AD911: 48
A912: COBURG | C912: JORGENSON 5 | F912: EQUID 3 | H912: STARBUCK 2 | K912: ROGAN 2 | M912: CLAPTON | O912: BRADLEY | Q912: WILKINSON | T912: JAMES | W912: BRIGHTON | X912: 12 | Y912: 5 | Z912: 0 | AA912: 1689 | AB912: 1562 | AC912: 108.13 | AD912: 48
A913: BRIGHTON | C913: McINDOE 4 | F913: LUMMIS 2 | I913: J BURNS 2 | L913: WARBURTON | O913: PERRY | Q913: HEIMS | W913: COBURG | X913: 11 | Y913: 5 | Z913: 1 | AA913: 1654 | AB913: 1526 | AC913: 108.39 | AD913: 46
A915: OAKLEIGH | C915: 2 | D915: 6 | E915: =C915*6+D915 -> 18 | G915: 7 | H915: 11 | I915: =G915*6+H915 -> 53 | K915: 9 | L915: 15 | M915: =K915*6+L915 -> 69 | O915: 12 | P915: 17 | Q915: =O915*6+P915 -> 89 | S915: PORT MELBOURNE | W915: CAMBERWELL | X915: 10 | Y915: 7 | Z915: 0 | AA915: 1517 | AB915: 1473 | AC915: 102.99 | AD915: 40
A916: PORT MELBOURNE | C916: 6 | D916: 3 | E916: =C916*6+D916 -> 39 | G916: 8 | H916: 4 | I916: =G916*6+H916 -> 52 | K916: 10 | L916: 10 | M916: =K916*6+L916 -> 70 | O916: 11 | P916: 14 | Q916: =O916*6+P916 -> 80 | S916: ROBINSON | W916: BRUNSWICK | X916: 9 | Y916: 7 | Z916: 1 | AA916: 1522 | AB916: 1418 | AC916: 107.33 | AD916: 38
A917: BEST PLAYERS | W917: PORT MELBOURNE | X917: 9 | Y917: 8 | Z917: 0 | AA917: 1488 | AB917: 1409 | AC917: 105.60681334279631 | AD917: 36
A918: OAKLEIGH | C918: DONNELLY | F918: WENN | I918: BOYLE | L918: SCOTT | O918: BAXTER | Q918: SMEATON | W918: PRESTON | X918: 8 | Y918: 9 | Z918: 0 | AA918: 1574 | AB918: 1602 | AC918: 98.25 | AD918: 32
A919: PORT MELBOURNE | C919: LEWIS | F919: CLEARY | I919: SEXTON | L919: WOODBRIDGE | O919: BLOOM | Q919: DRINAN | W919: PRAHRAN | X919: 6 | Y919: 11 | Z919: 0 | AA919: 1689 | AB919: 1723 | AC919: 98.03 | AD919: 24
A920: GOALKICKERS | W920: NORTHCOTE | X920: 4 | Y920: 12 | Z920: 1 | AA920: 1330 | AB920: 1610 | AC920: 82.61 | AD920: 18
A921: OAKLEIGH | C921: SCOTT 5 | F921: TIVENDALE 2 | I921: EDWARDS 2 | L921: WENN | N921: MARIAN | P921: WATSON | W921: SANDRINGHAM | X921: 4 | Y921: 12 | Z921: 1 | AA921: 1423 | AB921: 1731 | AC921: 82.21 | AD921: 18
A922: PORT MELBOURNE | C922: LEWIS 5 | F922: SEXTON 2 | I922: BLOOM 2 | L922: CULPH | N922: AUSTIN | W922: YARRAVILLE | X922: 2 | Y922: 15 | Z922: 0 | AA922: 1539 | AB922: 2055 | AC922: 74.89 | AD922: 8
A924: CAMBERWELL | C924: 0 | D924: 1 | E924: =C924*6+D924 -> 1 | G924: 6 | H924: 6 | I924: =G924*6+H924 -> 42 | K924: 8 | L924: 7 | M924: =K924*6+L924 -> 55 | O924: 11 | P924: 11 | Q924: =O924*6+P924 -> 77 | S924: BRUNSWICK
A925: BRUNSWICK | C925: 2 | D925: 4 | E925: =C925*6+D925 -> 16 | G925: 5 | H925: 6 | I925: =G925*6+H925 -> 36 | K925: 10 | L925: 8 | M925: =K925*6+L925 -> 68 | O925: 10 | P925: 10 | Q925: =O925*6+P925 -> 70 | S925: IRVINE
A926: BEST PLAYERS
A927: CAMBERWELL | C927: JENSEN | F927: LOVETT | I927: MILLER | L927: SHARPLES | O927: STUBBS | R927: BOHAN
A928: BRUNSWICK | C928: MCIVOR | F928: CROUCH | I928: GEISLER | L928: SPENCER | O928: TAYLOR | R928: KUHL
A929: GOALKICKERS
A930: CAMBERWELL | C930: BOHAN 4 | F930: MILGATE 4 | I930: PHILPOTT 2 | L930: DUFF
A931: BRUNSWICK | C931: SPENCER 3 | F931: HARDIMAN 2 | I931: SMITH | K931: RINGROSE | M931: WHELAN | O931: CROUCH | Q931: PRIESTLEY
A933: NORTHCOTE | C933: 5 | D933: 7 | E933: =C933*6+D933 -> 37 | G933: 7 | H933: 11 | I933: =G933*6+H933 -> 53 | K933: 8 | L933: 16 | M933: =K933*6+L933 -> 64 | O933: 11 | P933: 18 | Q933: =O933*6+P933 -> 84 | S933: TOORAK PARK
A934: PRAHRAN | C934: 2 | D934: 3 | E934: =C934*6+D934 -> 15 | G934: 6 | H934: 7 | I934: =G934*6+H934 -> 43 | K934: 7 | L934: 9 | M934: =K934*6+L934 -> 51 | O934: 11 | P934: 12 | Q934: =O934*6+P934 -> 78 | S934: JOHNS
A935: BEST PLAYERS
A936: NORTHCOTE | C936: BRUNNEN | F936: CASPAR | I936: PHILLIPS | L936: DUNN | O936: E WHITE | R936: SEARLE
A937: PRAHRAN | C937: FERGEUS | F937: MORROW | I937: OPRAY | L937: CAMPBELL | O937: WALSH | R937: COLLS
A938: GOALKICKERS
A939: NORTHCOTE | C939: BRUNNEN 2 | F939: SEARLE 2 | I939: CASPAR 2 | K939: KINDER | M939: E WHITE | O939: STABB | Q939: CAREY | S939: MCINTOSH
A940: PRAHRAN | C940: BURGESS 3 | F940: McCULLOCH 2 | I940: FERGEUS 2 | L940: MORROW 2 | O940: WOOD | Q940: MATSON
A942: PRESTON | C942: 8 | D942: 3 | E942: =C942*6+D942 -> 51 | G942: 10 | H942: 6 | I942: =G942*6+H942 -> 66 | K942: 15 | L942: 13 | M942: =K942*6+L942 -> 103 | O942: 16 | P942: 15 | Q942: =O942*6+P942 -> 111 | S942: PRESTON
A943: YARRAVILLE | C943: 1 | D943: 0 | E943: =C943*6+D943 -> 6 | G943: 3 | H943: 3 | I943: =G943*6+H943 -> 21 | K943: 5 | L943: 6 | M943: =K943*6+L943 -> 36 | O943: 9 | P943: 13 | Q943: =O943*6+P943 -> 67 | S943: IRVING
A944: BEST PLAYERS
A945: PRESTON | C945: HIND | E945: LALOR | H945: MEARS | J945: BLACKMAN | N945: FOSTER | Q945: DUNGAN
A946: YARRAVILLE | C946: SALT | E946: PHILLIPS | H946: CRANAGE | J946: MALBON | N946: ORR | Q946: SCARFFE
A947: GOALKICKERS
A948: PRESTON | C948: MEARS 5 | F948: LALOR 5 | I948: POTTER 2 | K948: FOSTER 2 | M948: HIND | N948: GOLDIN
A949: YARRAVILLE | C949: PHILLIPS 3 | F949: SCARFFE 3 | I949: ORR | K949: FAIRFULL | N949: COLLINS
A951: WILLIAMSTOWN | C951: 7 | D951: 7 | E951: =C951*6+D951 -> 49 | G951: 7 | H951: 9 | I951: =G951*6+H951 -> 51 | K951: 14 | L951: 18 | M951: =K951*6+L951 -> 102 | O951: 19 | P951: 21 | Q951: =O951*6+P951 -> 135 | S951: WILLIAMSTOWN
A952: SANDRINGHAM | C952: 0 | D952: 1 | E952: =C952*6+D952 -> 1 | G952: 4 | H952: 8 | I952: =G952*6+H952 -> 32 | K952: 5 | L952: 10 | M952: =K952*6+L952 -> 40 | O952: 9 | P952: 17 | Q952: =O952*6+P952 -> 71 | S952: STREETER
A953: BEST PLAYERS
A954: WILLIAMSTOWN | C954: WELLS | F954: MATTHEWS | I954: TODD | K954: McPHERSON | N954: REDMOND | Q954: BERNARD
A955: SANDRINGHAM | C955: McFEE | F955: ANDRESON | I955: GUILLE | K955: TURNBULL | N955: ANDREW | Q955: CERINI
A956: GOALKICKERS
A957: WILLIAMSTOWN | C957: TODD 6 | E957: McPHERSON 6 | H957: REDMOND 3 | K957: MOLYNEUX | N957: COLLINS | P957: McRAE | R957: WALKER
A958: SANDRINGHAM | C958: McFEE 3 | E958: HICKFORD 2 | H958: HISCOCK 2 | K958: BENCRAFT | M958: ARNEY
A960: ROUND 18 | D960: 13TH AUGUST | J960: WEATHER | M960: FINE & SUNNY NO WIND | S960: PLAYED AT
D961: 1ST QTR | H961: 2ND QTR | L961: 3RD QTR | P961: FINAL | S961: CAMBERWELL
A962: CAMBERWELL | C962: 4 | D962: 6 | E962: =C962*6+D962 -> 30 | G962: 5 | H962: 10 | I962: =G962*6+H962 -> 40 | K962: 10 | L962: 12 | M962: =K962*6+L962 -> 72 | O962: 14 | P962: 16 | Q962: =O962*6+P962 -> 100 | S962: UMPIRE | X962: LADDER | AB962: ROUND | AD962: 18
A963: PORT MELBOURNE | C963: 4 | D963: 1 | E963: =C963*6+D963 -> 25 | G963: 6 | H963: 4 | I963: =G963*6+H963 -> 40 | K963: 10 | L963: 6 | M963: =K963*6+L963 -> 66 | O963: 13 | P963: 6 | Q963: =O963*6+P963 -> 84 | S963: THOMAS
A964: BEST PLAYERS | W964: TEAM | X964: W | Y964: L | Z964: D | AA964: FOR | AB964: AGST | AC964: % | AD964: PTS
A965: CAMBERWELL | C965: JENSEN | F965: COOK | I965: ROCHFORD | L965: STUBBS | N965: PHILPOTT | Q965: LOVETT
A966: PORT MELBOURNE | C966: L PARKER | F966: LEWIS | I966: CLEARY | L966: ARGOON | N966: AUSTIN | Q966: WILSON | W966: OAKLEIGH | X966: 13 | Y966: 5 | Z966: 0 | AA966: 1909 | AB966: 1492 | AC966: 127.94906166219839 | AD966: 52
A967: GOALKICKERS | W967: WILLIAMSTOWN | X967: 13 | Y967: 5 | Z967: 0 | AA967: 1703 | AB967: 1433 | AC967: 118.84 | AD967: 52
A968: CAMBERWELL | C968: ROCHFORD 3 | F968: MILGATE 2 | I968: STUBBS 2 | K968: BENBOW | M968: FINNEGAN | O968: JENSEN | Q968: GIBBS | R968: PHILPOTT | W968: BRIGHTON | X968: 13 | Y968: 5 | Z968: 0 | AA968: 1823 | AB968: 1667 | AC968: 109.36 | AD968: 52
A969: PORT MELBOURNE | C969: LEWIS 4 | E969: AUSTIN 2 | G969: ARGOON | I969: WILSON | K969: PERRETT | M969: HOULIHAN | O969: SEXTON | Q969: WOODBRIDGE | T969: MURPHY | W969: COBURG | X969: 12 | Y969: 5 | Z969: 1 | AA969: 1759 | AB969: 1605 | AC969: 109.6 | AD969: 50
A971: BRIGHTON | C971: 5 | D971: 3 | E971: =C971*6+D971 -> 33 | G971: 9 | H971: 9 | I971: =G971*6+H971 -> 63 | K971: 15 | L971: 13 | M971: =K971*6+L971 -> 103 | O971: 20 | P971: 14 | Q971: =O971*6+P971 -> 134 | S971: ELSTERNWICK PARK | W971: CAMBERWELL | X971: 11 | Y971: 7 | Z971: 0 | AA971: 1617 | AB971: 1557 | AC971: 103.85 | AD971: 44
A972: PRESTON | C972: 4 | D972: 4 | E972: =C972*6+D972 -> 28 | G972: 8 | H972: 6 | I972: =G972*6+H972 -> 54 | K972: 13 | L972: 8 | M972: =K972*6+L972 -> 86 | O972: 16 | P972: 9 | Q972: =O972*6+P972 -> 105 | S972: ROBINSON | W972: BRUNSWICK | X972: 10 | Y972: 7 | Z972: 1 | AA972: 1658 | AB972: 1490 | AC972: 111.28 | AD972: 42
A973: BEST PLAYERS | W973: PORT MELBOURNE | X973: 9 | Y973: 9 | Z973: 0 | AA973: 1572 | AB973: 1509 | AC973: 104.17495029821073 | AD973: 36
A974: BRIGHTON | C974: MULLOY | E974: HOWE | H974: NEW | K974: CONROY | N974: WARBURTON | Q974: G TURNER | W974: PRESTON | X974: 8 | Y974: 10 | Z974: 0 | AA974: 1679 | AB974: 1736 | AC974: 96.72 | AD974: 32
A975: PRESTON | C975: GOLDIN | E975: LALOR | H975: HARRISON | K975: THOMPSON | N975: PRITCHARD | Q975: SWEET | W975: PRAHRAN | X975: 6 | Y975: 12 | Z975: 0 | AA975: 1789 | AB975: 1853 | AC975: 96.55 | AD975: 24
A976: GOALKICKERS | W976: NORTHCOTE | X976: 5 | Y976: 12 | Z976: 1 | AA976: 1427 | AB976: 1680 | AC976: 84.94 | AD976: 22
A977: BRIGHTON | C977: HOWE 7 | E977: ADAMSON 5 | H977: WARBURTON 5 | K977: J BURNS 2 | N977: PICKERING | W977: SANDRINGHAM | X977: 4 | Y977: 13 | Z977: 1 | AA977: 1502 | AB977: 1836 | AC977: 81.81 | AD977: 18
A978: PRESTON | C978: PRITCHARD 4 | F978: DUNGAN 3 | I978: MASLEN 2 | K978: LALOR 2 | M978: MEARS | O978: BROWN | Q978: BLACKMAN | T978: STEWART | W978: YARRAVILLE | X978: 2 | Y978: 16 | Z978: 0 | AA978: 1611 | AB978: 2191 | AC978: 73.53 | AD978: 8
S979: BRYCE
A980: OAKLEIGH | C980: 5 | D980: 3 | E980: =C980*6+D980 -> 33 | G980: 13 | H980: 5 | I980: =G980*6+H980 -> 83 | K980: 15 | L980: 8 | M980: =K980*6+L980 -> 98 | O980: 20 | P980: 10 | Q980: =O980*6+P980 -> 130 | S980: OAKLEIGH
A981: PRAHRAN | C981: 2 | D981: 4 | E981: =C981*6+D981 -> 16 | G981: 7 | H981: 6 | I981: =G981*6+H981 -> 48 | K981: 10 | L981: 10 | M981: =K981*6+L981 -> 70 | O981: 14 | P981: 16 | Q981: =O981*6+P981 -> 100 | S981: STREETER
A982: BEST PLAYERS
A983: OAKLEIGH | C983: SCOTT | F983: EDWARDS | I983: MARIAN | K983: DONNELLY | N983: HILL | Q983: R FINN
A984: PRAHRAN | C984: McCULLOCH | F984: OPRAY | I984: HILL | K984: BURGESS | N984: WOOD | Q984: MATSON
A985: GOALKICKERS
A986: OAKLEIGH | C986: SCOTT 7 | F986: TIVENDALE 3 | I986: WENN 3 | K986: EDWARDS 3 | N986: MARIAN | P986: HILL | Q986: WILLIAMS | T986: PARRY
A987: PRAHRAN | C987: McCULLOCH 6 | F987: WOOD 4 | I987: QUINN | K987: BURGESS | M987: LENZ | O987: OPRAY
A989: BRUNSWICK | C989: 5 | D989: 4 | E989: =C989*6+D989 -> 34 | G989: 10 | H989: 9 | I989: =G989*6+H989 -> 69 | K989: 14 | L989: 14 | M989: =K989*6+L989 -> 98 | O989: 19 | P989: 22 | Q989: =O989*6+P989 -> 136 | S989: YARRAVILLE
A990: YARRAVILLE | C990: 2 | D990: 2 | E990: =C990*6+D990 -> 14 | G990: 5 | H990: 7 | I990: =G990*6+H990 -> 37 | K990: 8 | L990: 8 | M990: =K990*6+L990 -> 56 | O990: 10 | P990: 12 | Q990: =O990*6+P990 -> 72 | S990: JOHNS
A991: BEST PLAYERS
A992: BRUNSWICK | C992: SHAW | F992: NEILSON | I992: HARDIMAN | L992: SPENCER | N992: GLASSCOTT | Q992: ALEXANDER
A993: YARRAVILLE | C993: GODDARD | F993: SCARFFE | I993: SALT | L993: PARK | N993: McASEY | Q993: WOODS
A994: GOALKICKERS
A995: BRUNSWICK | C995: HARDIMAN 8 | F995: SPENCER 4 | I995: PRIESTLEY | K995: RINGROSE | M995: HALL | O995: SLATTERY | Q995: KUHL
A996: YARRAVILLE | C996: SCARFFE 5 | F996: PHILLIPS 2 | I996: TESTRAIL | K996: COLLINS | M996: THOMPSON
A998: COBURG | C998: 3 | D998: 6 | E998: =C998*6+D998 -> 24 | G998: 7 | H998: 9 | I998: =G998*6+H998 -> 51 | K998: 10 | L998: 15 | M998: =K998*6+L998 -> 75 | O998: 14 | P998: 21 | Q998: =O998*6+P998 -> 105 | S998: COBURG
A999: SANDRINGHAM | C999: 3 | D999: 4 | E999: =C999*6+D999 -> 22 | G999: 8 | H999: 7 | I999: =G999*6+H999 -> 55 | K999: 10 | L999: 10 | M999: =K999*6+L999 -> 70 | O999: 11 | P999: 13 | Q999: =O999*6+P999 -> 79 | S999: WRIGHT
A1000: BEST PLAYERS
A1001: COBURG | C1001: EQUID | F1001: FEWKES | I1001: STARBUCK | L1001: CONDON | O1001: JAMES | Q1001: WILSON
A1002: SANDRINGHAM | C1002: N BENCRAFT | F1002: R HARPER | I1002: NEWTON | L1002: CAMPBELL | O1002: McFEE | Q1002: ANDRESSON
A1003: GOALKICKERS
A1004: COBURG | C1004: JAMES 6 | F1004: CONDON 3 | I1004: WILSON 2 | L1004: JORGENSON | O1004: ROGAN | Q1004: EQUID
A1005: SANDRINGHAM | C1005: R HARPER 4 | F1005: N BENCRAFT 3 | I1005: HISCOCK 2 | L1005: McFEE | N1005: GILBERT
A1007: NORTHCOTE | C1007: 2 | D1007: 3 | E1007: =C1007*6+D1007 -> 15 | G1007: 5 | H1007: 6 | I1007: =G1007*6+H1007 -> 36 | K1007: 10 | L1007: 11 | M1007: =K1007*6+L1007 -> 71 | O1007: 14 | P1007: 13 | Q1007: =O1007*6+P1007 -> 97 | S1007: NORTHCOTE
A1008: WILLIAMSTOWN | C1008: 5 | D1008: 2 | E1008: =C1008*6+D1008 -> 32 | G1008: 7 | H1008: 4 | I1008: =G1008*6+H1008 -> 46 | K1008: 7 | L1008: 6 | M1008: =K1008*6+L1008 -> 48 | O1008: 10 | P1008: 10 | Q1008: =O1008*6+P1008 -> 70 | S1008: JONES
A1009: BEST PLAYERS
A1010: NORTHCOTE | C1010: CASPAR | F1010: PAWSEY | I1010: McINTOSH | L1010: STABB | N1010: CRANE | Q1010: GALLAGHER
A1011: WILLIAMSTOWN | C1011: McPHERSON | F1011: WELLS | I1011: WALKER | L1011: McRAE | N1011: MOLYNEUX | Q1011: WILCOX
A1012: GOALKICKERS
A1013: NORTHCOTE | C1013: NASH 2 | E1013: CASPAR 2 | H1013: STABB 2 | J1013: E WHITE 2 | M1013: PAWSEY 2 | P1013: McINTOSH | R1013: KINDER | U1013: CAREY
A1014: WILLIAMSTOWN | C1014: TODD 3 | E1014: WALKER 3 | H1014: McPHERSON 2 | K1014: STRANG | M1014: ABBERTON
A1016: ROUND 19 | D1016: 20TH AUGUST | J1016: WEATHER | M1016: COLD SOUTH WEST WIND SHOWERS | S1016: PLAYED AT
D1017: 1ST QTR | H1017: 2ND QTR | L1017: 3RD QTR | P1017: FINAL | S1017: WILLIAMSTOWN
A1018: WILLIAMSTOWN | C1018: 2 | D1018: 0 | E1018: =C1018*6+D1018 -> 12 | G1018: 4 | H1018: 15 | I1018: =G1018*6+H1018 -> 39 | K1018: 5 | L1018: 16 | M1018: =K1018*6+L1018 -> 46 | O1018: 9 | P1018: 23 | Q1018: =O1018*6+P1018 -> 77 | S1018: UMPIRE | X1018: LADDER | AB1018: ROUND | AD1018: 19
A1019: OAKLEIGH | C1019: 5 | D1019: 9 | E1019: =C1019*6+D1019 -> 39 | G1019: 5 | H1019: 11 | I1019: =G1019*6+H1019 -> 41 | K1019: 8 | L1019: 22 | M1019: =K1019*6+L1019 -> 70 | O1019: 8 | P1019: 22 | Q1019: =O1019*6+P1019 -> 70 | S1019: IRVING
A1020: BEST PLAYERS | W1020: TEAM | X1020: W | Y1020: L | Z1020: D | AA1020: FOR | AB1020: AGST | AC1020: % | AD1020: PTS
A1021: WILLIAMSTOWN | C1021: SAMPSON | F1021: McPHERSON | I1021: McRAE | K1021: DANCKERT | N1021: FEATHERBY | Q1021: BERNARD
A1022: OAKLEIGH | C1022: EDWARDS | F1022: PERKINS | I1022: BOYLE | K1022: DONNELLY | N1022: SMEATON | Q1022: BAXTER | W1022: WILLIAMSTOWN | X1022: 14 | Y1022: 5 | Z1022: 0 | AA1022: 1780 | AB1022: 1503 | AC1022: 118.43 | AD1022: 56
A1023: GOALKICKERS | W1023: BRIGHTON | X1023: 14 | Y1023: 5 | Z1023: 0 | AA1023: 1894 | AB1023: 1729 | AC1023: 109.54 | AD1023: 56
A1024: WILLIAMSTOWN | C1024: McPHERSON 3 | F1024: WELLS | H1024: FEATHERBY | J1024: WILLIAMS | M1024: STRANG | O1024: WALKER | Q1024: MOLYNEUX | W1024: COBURG | X1024: 13 | Y1024: 5 | Z1024: 1 | AA1024: 1870 | AB1024: 1689 | AC1024: 110.72 | AD1024: 54
A1025: OAKLEIGH | C1025: EDWARDS 3 | F1025: WENN 2 | I1025: R FINN 2 | K1025: BOYLE | W1025: OAKLEIGH | X1025: 13 | Y1025: 6 | Z1025: 0 | AA1025: 1979 | AB1025: 1569 | AC1025: 126.13129381771829 | AD1025: 52
A1027: BRIGHTON | C1027: 5 | D1027: 0 | E1027: =C1027*6+D1027 -> 30 | G1027: 5 | H1027: 3 | I1027: =G1027*6+H1027 -> 33 | K1027: 9 | L1027: 9 | M1027: =K1027*6+L1027 -> 63 | O1027: 10 | P1027: 11 | Q1027: =O1027*6+P1027 -> 71 | S1027: BRUNSWICK | W1027: CAMBERWELL | X1027: 12 | Y1027: 7 | Z1027: 0 | AA1027: 1692 | AB1027: 1618 | AC1027: 104.57 | AD1027: 48
A1028: BRUNSWICK | C1028: 1 | D1028: 3 | E1028: =C1028*6+D1028 -> 9 | G1028: 3 | H1028: 8 | I1028: =G1028*6+H1028 -> 26 | K1028: 5 | L1028: 10 | M1028: =K1028*6+L1028 -> 40 | O1028: 8 | P1028: 14 | Q1028: =O1028*6+P1028 -> 62 | S1028: JONES | W1028: BRUNSWICK | X1028: 10 | Y1028: 8 | Z1028: 1 | AA1028: 1720 | AB1028: 1561 | AC1028: 110.19 | AD1028: 42
A1029: BEST PLAYERS | W1029: PORT MELBOURNE | X1029: 10 | Y1029: 9 | Z1029: 0 | AA1029: 1678 | AB1029: 1577 | AC1029: 106.40456563094483 | AD1029: 40
A1030: BRIGHTON | C1030: E TURNER | F1030: HOWE | H1030: McASEY | K1030: HALL | N1030: BURKE | Q1030: ADAMSON | W1030: PRESTON | X1030: 8 | Y1030: 11 | Z1030: 0 | AA1030: 1763 | AB1030: 1847 | AC1030: 95.45 | AD1030: 32
A1031: BRUNSWICK | C1031: GEISLER | F1031: SHAW | H1031: NEILSON | K1031: KUHL | N1031: JENKINS | Q1031: McIVOR | W1031: PRAHRAN | X1031: 6 | Y1031: 13 | Z1031: 0 | AA1031: 1850 | AB1031: 1928 | AC1031: 95.95 | AD1031: 24
A1032: GOALKICKERS | W1032: NORTHCOTE | X1032: 5 | Y1032: 13 | Z1032: 1 | AA1032: 1485 | AB1032: 1761 | AC1032: 84.33 | AD1032: 22
A1033: BRIGHTON | C1033: WARBURTON 4 | F1033: HOWE 2 | H1033: ADAMSON | J1033: HEIMS | L1033: O'ROURKE | N1033: SHALLESS | W1033: SANDRINGHAM | X1033: 5 | Y1033: 13 | Z1033: 1 | AA1033: 1583 | AB1033: 1894 | AC1033: 83.58 | AD1033: 22
A1034: BRUNSWICK | C1034: RINGROSE 3 | F1034: SPENCER 2 | I1034: KUHL 2 | K1034: HARDIMAN | W1034: YARRAVILLE | X1034: 2 | Y1034: 17 | Z1034: 0 | AA1034: 1683 | AB1034: 2293 | AC1034: 73.4 | AD1034: 8
A1036: COBURG | C1036: 4 | D1036: 4 | E1036: =C1036*6+D1036 -> 28 | G1036: 7 | H1036: 5 | I1036: =G1036*6+H1036 -> 47 | K1036: 13 | L1036: 7 | M1036: =K1036*6+L1036 -> 85 | O1036: 17 | P1036: 9 | Q1036: =O1036*6+P1036 -> 111 | S1036: PRESTON
A1037: PRESTON | C1037: 3 | D1037: 0 | E1037: =C1037*6+D1037 -> 18 | G1037: 7 | H1037: 4 | I1037: =G1037*6+H1037 -> 46 | K1037: 9 | L1037: 5 | M1037: =K1037*6+L1037 -> 59 | O1037: 13 | P1037: 6 | Q1037: =O1037*6+P1037 -> 84 | S1037: JOHNS
A1038: BEST PLAYERS
A1039: COBURG | C1039: CONDON | F1039: EQUID | I1039: WILSON | L1039: FEWKES | O1039: CLAPTON | R1039: ARMSTRONG
A1040: PRESTON | C1040: BLACKMAN | F1040: LEHMANN | I1040: BAKER | L1040: BRYCE | O1040: STEWART | R1040: THOMPSON
A1041: GOALKICKERS
A1042: COBURG | C1042: EQUID 4 | F1042: JORGENSON 4 | I1042: JAMES 3 | K1042: CONDON 2 | N1042: CLAPTON 2 | Q1042: WALKER | S1042: STARBUCK
A1043: PRESTON | C1043: NATHAN 3 | F1043: DUNGAN 3 | I1043: MEARS 2 | K1043: LALOR | M1043: BAKER | O1043: GOLDIN | Q1043: BLACKMAN | T1043: BRYCE
A1045: CAMBERWELL | C1045: 4 | D1045: 5 | E1045: =C1045*6+D1045 -> 29 | G1045: 4 | H1045: 8 | I1045: =G1045*6+H1045 -> 32 | K1045: 7 | L1045: 12 | M1045: =K1045*6+L1045 -> 54 | O1045: 10 | P1045: 15 | Q1045: =O1045*6+P1045 -> 75 | S1045: TOORAK PARK
A1046: PRAHRAN | C1046: 1 | D1046: 0 | E1046: =C1046*6+D1046 -> 6 | G1046: 5 | H1046: 4 | I1046: =G1046*6+H1046 -> 34 | K1046: 8 | L1046: 6 | M1046: =K1046*6+L1046 -> 54 | O1046: 9 | P1046: 7 | Q1046: =O1046*6+P1046 -> 61 | S1046: BARKER
A1047: BEST PLAYERS
A1048: CAMBERWELL | C1048: MILLER | F1048: JENSEN | I1048: LOVETT | L1048: COOK | O1048: PHILPOTT | R1048: STUBBS
A1049: PRAHRAN | C1049: HILL | F1049: FERGEUS | I1049: WALSH | L1049: MORROW | O1049: BURGESS | R1049: YATES
A1050: GOALKICKERS
A1051: CAMBERWELL | C1051: STUBBS 3 | F1051: MILGATE 2 | I1051: PHILPOTT 2 | L1051: JENSEN | N1051: GIBBS | P1051: BOHAN
A1052: PRAHRAN | C1052: MORROW 2 | F1052: SHILLABEER | I1052: WOOD | K1052: BURGESS | M1052: McCULLOCH | P1052: WALSH | R1052: LENZ | T1052: FERGEUS
A1054: SANDRINGHAM | C1054: 4 | D1054: 6 | E1054: =C1054*6+D1054 -> 30 | G1054: 7 | H1054: 9 | I1054: =G1054*6+H1054 -> 51 | K1054: 10 | L1054: 14 | M1054: =K1054*6+L1054 -> 74 | O1054: 11 | P1054: 15 | Q1054: =O1054*6+P1054 -> 81 | S1054: BEACH ROAD
A1055: NORTHCOTE | C1055: 1 | D1055: 3 | E1055: =C1055*6+D1055 -> 9 | G1055: 6 | H1055: 4 | I1055: =G1055*6+H1055 -> 40 | K1055: 6 | L1055: 5 | M1055: =K1055*6+L1055 -> 41 | O1055: 8 | P1055: 10 | Q1055: =O1055*6+P1055 -> 58 | S1055: STREETER
A1056: BEST PLAYERS
A1057: SANDRINGHAM | C1057: ANDRESON | F1057: TURNBULL | I1057: McFEE | L1057: McLEOD | O1057: R HARPER | R1057: HEADEN
A1058: NORTHCOTE | C1058: SEARLE | F1058: CRANE | I1058: KINDER | L1058: PAWSEY | O1058: HINES | R1058: E WHITE
A1059: GOALKICKERS
A1060: SANDRINGHAM | C1060: R HARPER 5 | F1060: NEWTON 2 | I1060: CERINI | K1060: BENCRAFT | M1060: HISCOCK | O1060: GILBERT
A1061: NORTHCOTE | C1061: E WHITE 2 | F1061: KINDER 2 | I1061: SEARLE 2 | K1061: PAWSEY 2
A1063: PORT MELBOURNE | C1063: 5 | D1063: 3 | E1063: =C1063*6+D1063 -> 33 | G1063: 6 | H1063: 6 | I1063: =G1063*6+H1063 -> 42 | K1063: 13 | L1063: 14 | M1063: =K1063*6+L1063 -> 92 | O1063: 14 | P1063: 22 | Q1063: =O1063*6+P1063 -> 106 | S1063: PORT MELBOURNE
A1064: YARRAVILLE | C1064: 3 | D1064: 4 | E1064: =C1064*6+D1064 -> 22 | G1064: 6 | H1064: 8 | I1064: =G1064*6+H1064 -> 44 | K1064: 6 | L1064: 9 | M1064: =K1064*6+L1064 -> 45 | O1064: 9 | P1064: 14 | Q1064: =O1064*6+P1064 -> 68 | S1064: WRIGHT
A1065: BEST PLAYERS
A1066: PORT MELBOURNE | C1066: DRINAN | F1066: CLEARY | I1066: BAKER | L1066: SEXTON | O1066: LEWIS | R1066: N PARKER
A1067: YARRAVILLE | C1067: GARLICK | F1067: COLLINS | I1067: WOODS | L1067: WATTS | O1067: MALBON | R1067: GODDARD
A1068: GOALKICKERS
A1069: PORT MELBOURNE | C1069: LEWIS 3 | E1069: CULPH 3 | G1069: SEXTON 2 | I1069: PERRETT 2 | K1069: WOODBRIDGE | N1069: HOULIHAN | Q1069: BAKER | S1069: HOUSTON
A1070: YARRAVILLE | C1070: COLLINS 3 | F1070: MCASEY 3 | I1070: PHILLIPS | K1070: HICKEY | M1070: ORR
A1072: ROUND 20 | D1072: 27TH AUGUST | J1072: WEATHER | M1072: SOUTH WIND FINE & SUNNY | S1072: PLAYED AT
D1073: 1ST QTR | H1073: 2ND QTR | L1073: 3RD QTR | P1073: FINAL | S1073: CAMBERWELL
A1074: WILLIAMSTOWN | C1074: 2 | D1074: 2 | E1074: =C1074*6+D1074 -> 14 | G1074: 10 | H1074: 6 | I1074: =G1074*6+H1074 -> 66 | K1074: 16 | L1074: 9 | M1074: =K1074*6+L1074 -> 105 | O1074: 23 | P1074: 17 | Q1074: =O1074*6+P1074 -> 155 | S1074: UMPIRE | X1074: LADDER | AB1074: ROUND | AD1074: 20
A1075: CAMBERWELL | C1075: 2 | D1075: 4 | E1075: =C1075*6+D1075 -> 16 | G1075: 4 | H1075: 7 | I1075: =G1075*6+H1075 -> 31 | K1075: 9 | L1075: 12 | M1075: =K1075*6+L1075 -> 66 | O1075: 9 | P1075: 13 | Q1075: =O1075*6+P1075 -> 67 | S1075: WRIGHT
A1076: BEST PLAYERS | W1076: TEAM | X1076: W | Y1076: L | Z1076: D | AA1076: FOR | AB1076: AGST | AC1076: % | AD1076: PTS
A1077: WILLIAMSTOWN | C1077: FEATHERBY | F1077: TODD | H1077: MOLYNEUX | K1077: McPHERSON | N1077: McRAE | Q1077: WILCOX
A1078: CAMBERWELL | C1078: STUBBS | F1078: DUFF | H1078: MILGATE | K1078: ROCHFORD | N1078: JENSEN | Q1078: MILLER | W1078: WILLIAMSTOWN | X1078: 15 | Y1078: 5 | Z1078: 0 | AA1078: 1935 | AB1078: 1570 | AC1078: 123.25 | AD1078: 60
A1079: GOALKICKERS | W1079: BRIGHTON | X1079: 15 | Y1079: 5 | Z1079: 0 | AA1079: 2035 | AB1079: 1792 | AC1079: 113.56 | AD1079: 60
A1080: WILLIAMSTOWN | C1080: TODD 11 | F1080: McPHERSON 4 | I1080: MOLYNEUX 3 | L1080: ABBERTON 2 | O1080: BARKER 2 | Q1080: WALKER | W1080: OAKLEIGH | X1080: 14 | Y1080: 6 | Z1080: 0 | AA1080: 2198 | AB1080: 1614 | AC1080: 136.18339529120198 | AD1080: 56
A1081: CAMBERWELL | C1081: MILGATE 3 | F1081: TAYLOR 2 | I1081: BOHAN | K1081: STUBBS | M1081: JENSEN | O1081: BENBOW | W1081: COBURG | X1081: 13 | Y1081: 6 | Z1081: 1 | AA1081: 1935 | AB1081: 1798 | AC1081: 107.62 | AD1081: 54
A1083: BRIGHTON | C1083: 4 | D1083: 3 | E1083: =C1083*6+D1083 -> 27 | G1083: 11 | H1083: 9 | I1083: =G1083*6+H1083 -> 75 | K1083: 15 | L1083: 13 | M1083: =K1083*6+L1083 -> 103 | O1083: 21 | P1083: 15 | Q1083: =O1083*6+P1083 -> 141 | S1083: ELSTERNWICK PARK | W1083: CAMBERWELL | X1083: 12 | Y1083: 8 | Z1083: 0 | AA1083: 1759 | AB1083: 1773 | AC1083: 99.21 | AD1083: 48
A1084: PORT MELBOURNE | C1084: 3 | D1084: 2 | E1084: =C1084*6+D1084 -> 20 | G1084: 5 | H1084: 3 | I1084: =G1084*6+H1084 -> 33 | K1084: 7 | L1084: 6 | M1084: =K1084*6+L1084 -> 48 | O1084: 9 | P1084: 9 | Q1084: =O1084*6+P1084 -> 63 | S1084: IRVING | W1084: BRUNSWICK | X1084: 11 | Y1084: 8 | Z1084: 1 | AA1084: 1876 | AB1084: 1640 | AC1084: 114.39 | AD1084: 46
A1085: BEST PLAYERS | W1085: PORT MELBOURNE | X1085: 10 | Y1085: 10 | Z1085: 0 | AA1085: 1741 | AB1085: 1718 | AC1085: 101.33876600698487 | AD1085: 40
A1086: BRIGHTON | C1086: WARBURTON | F1086: McASEY | I1086: O'ROURKE | L1086: PINDER | O1086: E TURNER | R1086: HOWE | W1086: PRESTON | X1086: 8 | Y1086: 12 | Z1086: 0 | AA1086: 1842 | AB1086: 2003 | AC1086: 91.96 | AD1086: 32
A1087: PORT MELBOURNE | C1087: CLEARY | F1087: PERRETT | I1087: HOUSTON | L1087: L PARKER | O1087: DRINAN | R1087: LEWIS | W1087: PRAHRAN | X1087: 7 | Y1087: 13 | Z1087: 0 | AA1087: 1983 | AB1087: 1995 | AC1087: 99.4 | AD1087: 28
A1088: GOALKICKERS | W1088: NORTHCOTE | X1088: 6 | Y1088: 13 | Z1088: 1 | AA1088: 1594 | AB1088: 1826 | AC1088: 87.29 | AD1088: 26
A1089: BRIGHTON | C1089: WARBURTON 8 | F1089: HOWE 4 | H1089: O'ROURKE 3 | K1089: SHALLESS 2 | N1089: ADAMSON 2 | Q1089: PINDER | S1089: CONROY | W1089: SANDRINGHAM | X1089: 5 | Y1089: 14 | Z1089: 1 | AA1089: 1628 | AB1089: 2113 | AC1089: 77.05 | AD1089: 22
A1090: PORT MELBOURNE | C1090: BATTY 3 | F1090: LEWIS 2 | I1090: HOUSTON 2 | L1090: PERRETT | N1090: SEXTON | W1090: YARRAVILLE | X1090: 2 | Y1090: 18 | Z1090: 0 | AA1090: 1746 | AB1090: 2430 | AC1090: 71.85 | AD1090: 8
A1092: BRUNSWICK | C1092: 3 | D1092: 3 | E1092: =C1092*6+D1092 -> 21 | G1092: 10 | H1092: 8 | I1092: =G1092*6+H1092 -> 68 | K1092: 16 | L1092: 11 | M1092: =K1092*6+L1092 -> 107 | O1092: 23 | P1092: 18 | Q1092: =O1092*6+P1092 -> 156 | S1092: PRESTON
A1093: PRESTON | C1093: 5 | D1093: 3 | E1093: =C1093*6+D1093 -> 33 | G1093: 8 | H1093: 3 | I1093: =G1093*6+H1093 -> 51 | K1093: 10 | L1093: 7 | M1093: =K1093*6+L1093 -> 67 | O1093: 12 | P1093: 7 | Q1093: =O1093*6+P1093 -> 79 | S1093: ROBINSON
A1094: BEST PLAYERS
A1095: BRUNSWICK | C1095: SHAW | F1095: MCIVOR | I1095: RINGROSE | L1095: WHELAN | O1095: SPENCER | R1095: CROUCH
A1096: PRESTON | C1096: BLACKMAN | F1096: LEHMANN | I1096: PRITCHARD | L1096: GOLDIN | O1096: HARRISON | R1096: LALOR
A1097: GOALKICKERS
A1098: BRUNSWICK | C1098: RINGROSE 7 | F1098: HARDIMAN 5 | I1098: KUHL 2 | K1098: SPENCER 2 | N1098: MAHER 2 | Q1098: WARD 2 | S1098: STANLEY | W1098: SLATTERY | Y1098: TAYLOR
A1099: PRESTON | C1099: NATHAN 3 | F1099: GOLDIN 2 | I1099: LEHMANN 2 | L1099: BLACKMAN | N1099: BRYCE | P1099: MEESE | R1099: BAKER | U1099: DUNGAN
A1101: PRAHRAN | C1101: 3 | D1101: 2 | E1101: =C1101*6+D1101 -> 20 | G1101: 7 | H1101: 8 | I1101: =G1101*6+H1101 -> 50 | K1101: 12 | L1101: 13 | M1101: =K1101*6+L1101 -> 85 | O1101: 19 | P1101: 19 | Q1101: =O1101*6+P1101 -> 133 | S1101: YARRAVILLE
A1102: YARRAVILLE | C1102: 2 | D1102: 2 | E1102: =C1102*6+D1102 -> 14 | G1102: 4 | H1102: 3 | I1102: =G1102*6+H1102 -> 27 | K1102: 6 | L1102: 10 | M1102: =K1102*6+L1102 -> 46 | O1102: 9 | P1102: 13 | Q1102: =O1102*6+P1102 -> 67 | S1102: STREETER
A1103: BEST PLAYERS
A1104: PRAHRAN | C1104: FERGEUS | F1104: McCULLOCH | I1104: OVERS | L1104: WALSH | O1104: HILL | R1104: YATES
A1105: YARRAVILLE | C1105: WOODS | F1105: McDONALD | I1105: ROHLEDER | L1105: SALT | O1105: SCARFFE | R1105: MALBON
A1106: GOALKICKERS
A1107: PRAHRAN | C1107: McCULLOCH 9 | F1107: LENZ 2 | H1107: QUINN 2 | J1107: MORROW 2 | M1107: FERGEUS 2 | P1107: WALSH | R1107: WOOD
A1108: YARRAVILLE | C1108: SCARFFE 3 | F1108: PHILLIPS 2 | I1108: COLLINS 2 | L1108: ROHLEDER | N1108: TESTRAIL
A1110: NORTHCOTE | C1110: 3 | D1110: 3 | E1110: =C1110*6+D1110 -> 21 | G1110: 7 | H1110: 9 | I1110: =G1110*6+H1110 -> 51 | K1110: 14 | L1110: 11 | M1110: =K1110*6+L1110 -> 95 | O1110: 16 | P1110: 13 | Q1110: =O1110*6+P1110 -> 109 | S1110: COBURG
A1111: COBURG | C1111: 4 | D1111: 1 | E1111: =C1111*6+D1111 -> 25 | G1111: 6 | H1111: 3 | I1111: =G1111*6+H1111 -> 39 | K1111: 8 | L1111: 7 | M1111: =K1111*6+L1111 -> 55 | O1111: 9 | P1111: 11 | Q1111: =O1111*6+P1111 -> 65 | S1111: BARKER
A1112: BEST PLAYERS
A1113: NORTHCOTE | C1113: PAWSEY | F1113: CRANE | I1113: STABB | L1113: R WHITE | O1113: E WHITE | R1113: STAFFORD
A1114: COBURG | C1114: HOLBROOK | F1114: REICHELT | I1114: STARBUCK | L1114: JORGENSON | O1114: HEEPS | R1114: CONDON
A1115: GOALKICKERS
A1116: NORTHCOTE | C1116: PAWSEY 3 | F1116: E WHITE 2 | I1116: CASPAR 2 | K1116: McINTOSH 2 | N1116: KINDER 2 | Q1116: COLLINS 2 | T1116: BRUNNEN | W1116: STABB | X1116: R WHITE
A1117: COBURG | C1117: JAMES 6 | F1117: JORGENSON 3
A1119: OAKLEIGH | C1119: 7 | D1119: 6 | E1119: =C1119*6+D1119 -> 48 | G1119: 15 | H1119: 12 | I1119: =G1119*6+H1119 -> 102 | K1119: 26 | L1119: 17 | M1119: =K1119*6+L1119 -> 173 | O1119: 32 | P1119: 27 | Q1119: =O1119*6+P1119 -> 219 | S1119: OAKLEIGH
A1120: SANDRINGHAM | C1120: 1 | D1120: 0 | E1120: =C1120*6+D1120 -> 6 | G1120: 2 | H1120: 3 | I1120: =G1120*6+H1120 -> 15 | K1120: 4 | L1120: 5 | M1120: =K1120*6+L1120 -> 29 | O1120: 6 | P1120: 9 | Q1120: =O1120*6+P1120 -> 45 | S1120: JOHNS
A1121: BEST PLAYERS
A1122: OAKLEIGH | C1122: WENN | F1122: RYAN | I1122: BAXTER | L1122: LEANE | O1122: EDWARDS | R1122: SCOTT
A1123: SANDRINGHAM | C1123: R HARPER | F1123: McFEE | I1123: GUILLE | L1123: SKINNER | O1123: LAVER | R1123: HISCOCK
A1124: GOALKICKERS
A1125: OAKLEIGH | C1125: WENN 10 | E1125: SCOTT 6 | G1125: EDWARDS 4 | J1125: HILL 3 | L1125: LEANE 3 | N1125: BAXTER 2 | Q1125: NEWTON 2 | T1125: RAWLINGS | W1125: R FINN
A1126: SANDRINGHAM | C1126: R HARPER 2 | F1126: HISCOCK 2 | I1126: McFEE | K1126: SKINNER
A1128: ROUND 21 | D1128: 3RD SEPTEMBER | G1128: WEATHER | J1128: SOUTH WEST WIND HEAVY SHOWERS GROUNDS HEAVY | S1128: PLAYED AT
D1129: 1ST QTR | H1129: 2ND QTR | L1129: 3RD QTR | P1129: FINAL | S1129: COBURG
A1130: BRUNSWICK | C1130: 2 | D1130: 5 | E1130: =C1130*6+D1130 -> 17 | G1130: 8 | H1130: 8 | I1130: =G1130*6+H1130 -> 56 | K1130: 9 | L1130: 11 | M1130: =K1130*6+L1130 -> 65 | O1130: 14 | P1130: 12 | Q1130: =O1130*6+P1130 -> 96 | S1130: UMPIRE | X1130: LADDER | AB1130: ROUND | AD1130: 21
A1131: COBURG | C1131: 3 | D1131: 2 | E1131: =C1131*6+D1131 -> 20 | G1131: 8 | H1131: 4 | I1131: =G1131*6+H1131 -> 52 | K1131: 9 | L1131: 6 | M1131: =K1131*6+L1131 -> 60 | O1131: 10 | P1131: 8 | Q1131: =O1131*6+P1131 -> 68 | S1131: IRVING
A1132: BEST PLAYERS | W1132: TEAM | X1132: W | Y1132: L | Z1132: D | AA1132: FOR | AB1132: AGST | AC1132: % | AD1132: PTS
A1133: BRUNSWICK | C1133: PRIESTLEY | F1133: SPENCER | I1133: HALL | L1133: GEISLER | N1133: SHAW | Q1133: SMITH
A1134: COBURG | C1134: EQUID | F1134: STARBUCK | I1134: CLAPTON | L1134: CAHIR | N1134: HEEPS | Q1134: CONDON | W1134: WILLIAMSTOWN | X1134: 16 | Y1134: 5 | Z1134: 0 | AA1134: 2037 | AB1134: 1664 | AC1134: 122.42 | AD1134: 64
A1135: GOALKICKERS | W1135: OAKLEIGH | X1135: 15 | Y1135: 6 | Z1135: 0 | AA1135: 2320 | AB1135: 1703 | AC1135: 136.23018203170875 | AD1135: 60
A1136: BRUNSWICK | C1136: SPENCER 4 | F1136: KUHL 3 | H1136: PRIESTLEY 2 | K1136: RINGROSE 2 | N1136: HARDIMAN | Q1136: WHELAN | S1136: WARD | W1136: BRIGHTON | X1136: 15 | Y1136: 6 | Z1136: 0 | AA1136: 2116 | AB1136: 1920 | AC1136: 110.21 | AD1136: 60
A1137: COBURG | C1137: CONDON 2 | F1137: ROGAN 2 | I1137: CLAPTON 2 | L1137: JORGENSON | N1137: STARBUCK | Q1137: JAMES | S1137: GLEESON | W1137: COBURG | X1137: 13 | Y1137: 7 | Z1137: 1 | AA1137: 2003 | AB1137: 1894 | AC1137: 105.76 | AD1137: 54
A1139: PORT MELBOURNE | C1139: 2 | D1139: 3 | E1139: =C1139*6+D1139 -> 15 | G1139: 4 | H1139: 7 | I1139: =G1139*6+H1139 -> 31 | K1139: 11 | L1139: 12 | M1139: =K1139*6+L1139 -> 78 | O1139: 18 | P1139: 17 | Q1139: =O1139*6+P1139 -> 125 | S1139: PORT MELBOURNE | W1139: BRUNSWICK | X1139: 12 | Y1139: 8 | Z1139: 1 | AA1139: 1972 | AB1139: 1708 | AC1139: 115.46 | AD1139: 50
A1140: PRESTON | C1140: 0 | D1140: 8 | E1140: =C1140*6+D1140 -> 8 | G1140: 3 | H1140: 11 | I1140: =G1140*6+H1140 -> 29 | K1140: 5 | L1140: 13 | M1140: =K1140*6+L1140 -> 43 | O1140: 8 | P1140: 14 | Q1140: =O1140*6+P1140 -> 62 | S1140: JOHNS | W1140: CAMBERWELL | X1140: 12 | Y1140: 9 | Z1140: 0 | AA1140: 1871 | AB1140: 1892 | AC1140: 98.89 | AD1140: 48
A1141: BEST PLAYERS | W1141: PORT MELBOURNE | X1141: 11 | Y1141: 10 | Z1141: 0 | AA1141: 1866 | AB1141: 1780 | AC1141: 104.8314606741573 | AD1141: 44
A1142: PORT MELBOURNE | C1142: DRINAN | F1142: CULPH | I1142: L PARKER | L1142: CLEARY | O1142: WOODBRIDGE | R1142: HOUSTON | W1142: PRAHRAN | X1142: 8 | Y1142: 13 | Z1142: 0 | AA1142: 2111 | AB1142: 2076 | AC1142: 101.69 | AD1142: 32
A1143: PRESTON | C1143: THOMPSON | F1143: BLACKMAN | I1143: PRITCHARD | L1143: BRADFORD | O1143: STEWART | R1143: PASCOE | W1143: PRESTON | X1143: 8 | Y1143: 13 | Z1143: 0 | AA1143: 1904 | AB1143: 2128 | AC1143: 89.47 | AD1143: 32
A1144: GOALKICKERS | W1144: NORTHCOTE | X1144: 6 | Y1144: 14 | Z1144: 1 | AA1144: 1683 | AB1144: 1948 | AC1144: 86.4 | AD1144: 26
A1145: PORT MELBOURNE | C1145: CULPH 5 | E1145: LEWIS 4 | G1145: HOUSTON 3 | J1145: MURPHY 2 | M1145: N PARKER | O1145: SEXTON | Q1145: HOULIHAN | S1145: WILSON | W1145: SANDRINGHAM | X1145: 6 | Y1145: 14 | Z1145: 1 | AA1145: 1747 | AB1145: 2225 | AC1145: 78.52 | AD1145: 26
A1146: PRESTON | C1146: DUNGAN 4 | F1146: BRADFORD 2 | I1146: MEESE 2 | W1146: YARRAVILLE | X1146: 2 | Y1146: 19 | Z1146: 0 | AA1146: 1840 | AB1146: 2532 | AC1146: 72.67 | AD1146: 8
A1148: SANDRINGHAM | C1148: 2 | D1148: 4 | E1148: =C1148*6+D1148 -> 16 | G1148: 5 | H1148: 7 | I1148: =G1148*6+H1148 -> 37 | K1148: 8 | L1148: 6 | M1148: =K1148*6+L1148 -> 54 | O1148: 17 | P1148: 17 | Q1148: =O1148*6+P1148 -> 119 | S1148: BEACH ROAD
A1149: CAMBERWELL | C1149: 7 | D1149: 4 | E1149: =C1149*6+D1149 -> 46 | G1149: 13 | H1149: 7 | I1149: =G1149*6+H1149 -> 85 | K1149: 16 | L1149: 14 | M1149: =K1149*6+L1149 -> 110 | O1149: 16 | P1149: 16 | Q1149: =O1149*6+P1149 -> 112 | S1149: ROBINSON
A1150: BEST PLAYERS
A1151: SANDRINGHAM | C1151: NEWTON | F1151: STANLEY | I1151: N BENCRAFT | L1151: GUILLE | O1151: McFEE | Q1151: R HARPER
A1152: CAMBERWELL | C1152: STUBBS | F1152: MILLER | I1152: MILGATE | L1152: HERBERT | O1152: BOHAN | Q1152: PHILPOTT
A1153: GOALKICKERS
A1154: SANDRINGHAM | C1154: N BENCRAFT 4 | F1154: NEWTON 3 | I1154: McFEE 2 | K1154: GUILLE 2 | M1154: HISCOCK 2 | P1154: TURNBULL 2 | S1154: STANLEY | W1154: GILBERT
A1155: CAMBERWELL | C1155: MILGATE 5 | F1155: STUBBS 3 | I1155: BOHAN 3 | K1155: PHILPOTT 3 | N1155: JENSEN | P1155: BENBOW
A1157: PRAHRAN | C1157: 4 | D1157: 4 | E1157: =C1157*6+D1157 -> 28 | G1157: 9 | H1157: 12 | I1157: =G1157*6+H1157 -> 66 | K1157: 15 | L1157: 12 | M1157: =K1157*6+L1157 -> 102 | O1157: 19 | P1157: 14 | Q1157: =O1157*6+P1157 -> 128 | S1157: TOORAK PARK
A1158: BRIGHTON | C1158: 4 | D1158: 3 | E1158: =C1158*6+D1158 -> 27 | G1158: 7 | H1158: 3 | I1158: =G1158*6+H1158 -> 45 | K1158: 8 | L1158: 10 | M1158: =K1158*6+L1158 -> 58 | O1158: 11 | P1158: 15 | Q1158: =O1158*6+P1158 -> 81 | S1158: BARKER
A1159: BEST PLAYERS
A1160: PRAHRAN | C1160: FERGEUS | F1160: WOOD | I1160: OPRAY | L1160: SHILLABEER | O1160: WALSH | Q1160: MORROW
A1161: BRIGHTON | C1161: WARBURTON | F1161: E TURNER | I1161: PLUNKETT | L1161: G TURNER | O1161: NEW | Q1161: HILL
A1162: GOALKICKERS
A1163: PRAHRAN | C1163: McCULLOCH 4 | F1163: BURGESS 4 | I1163: WOOD 3 | K1163: WALSH 3 | M1163: SHILLABEER 3 | P1163: CAMPBELL 2
A1164: BRIGHTON | C1164: WARBURTON 7 | F1164: SHALLESS 2 | I1164: O'ROURKE | K1164: STRAUGHAN
A1166: OAKLEIGH | C1166: 6 | D1166: 8 | E1166: =C1166*6+D1166 -> 44 | G1166: 10 | H1166: 15 | I1166: =G1166*6+H1166 -> 75 | K1166: 13 | L1166: 16 | M1166: =K1166*6+L1166 -> 94 | O1166: 17 | P1166: 20 | Q1166: =O1166*6+P1166 -> 122 | S1166: NORTHCOTE
A1167: NORTHCOTE | C1167: 1 | D1167: 3 | E1167: =C1167*6+D1167 -> 9 | G1167: 4 | H1167: 4 | I1167: =G1167*6+H1167 -> 28 | K1167: 7 | L1167: 11 | M1167: =K1167*6+L1167 -> 53 | O1167: 12 | P1167: 17 | Q1167: =O1167*6+P1167 -> 89 | S1167: WRIGHT
A1168: BEST PLAYERS
A1169: OAKLEIGH | C1169: RYAN | F1169: SCOTT | I1169: DEAYTON | L1169: WILLIAMS | O1169: EDWARDS | R1169: HILL
A1170: NORTHCOTE | C1170: E WHITE | F1170: POWELL | I1170: PAWSEY | L1170: KINDER | O1170: STABB | R1170: GREENWOOD
A1171: GOALKICKERS
A1172: OAKLEIGH | C1172: SCOTT 9 | F1172: EDWARDS 3 | I1172: HILL 3 | K1172: MARIAN 2
A1173: NORTHCOTE | C1173: PAWSEY 5 | F1173: STABB 2 | I1173: McINTOSH | K1173: GREENWOOD | N1173: STAFFORD | Q1173: WHITECHURCH | U1173: GALLAGHER
A1175: WILLIAMSTOWN | C1175: 3 | D1175: 5 | E1175: =C1175*6+D1175 -> 23 | G1175: 5 | H1175: 9 | I1175: =G1175*6+H1175 -> 39 | K1175: 13 | L1175: 17 | M1175: =K1175*6+L1175 -> 95 | O1175: 14 | P1175: 18 | Q1175: =O1175*6+P1175 -> 102 | S1175: WILLIAMSTOWN
A1176: YARRAVILLE | C1176: 1 | D1176: 1 | E1176: =C1176*6+D1176 -> 7 | G1176: 4 | H1176: 5 | I1176: =G1176*6+H1176 -> 29 | K1176: 4 | L1176: 5 | M1176: =K1176*6+L1176 -> 29 | O1176: 14 | P1176: 10 | Q1176: =O1176*6+P1176 -> 94 | S1176: THOMAS
A1177: BEST PLAYERS
A1178: WILLIAMSTOWN | C1178: ABBERTON | F1178: WALKER | I1178: McPHERSON | L1178: WELLS | N1178: FEATHERBY | Q1178: McRAE
A1179: YARRAVILLE | C1179: MCASEY | F1179: GWYNNE | I1179: MASON | L1179: ORR | N1179: TESTRAIL | Q1179: COLLINS
A1180: GOALKICKERS
A1181: WILLIAMSTOWN | C1181: McPHERSON 5 | F1181: TODD 3 | I1181: PEACOCK 2 | L1181: ABBERTON | N1181: WILLIAMS | Q1181: REDMOND | T1181: WALKER
A1182: YARRAVILLE | C1182: PHILLIPS 4 | F1182: MCASEY 3 | I1182: SCARFFE 3 | L1182: COLLINS 2 | N1182: ROHLEDER 2
A1184: FINALS
A1185: 1ST SEMI | C1185: 10TH SEPTEMBER | I1185: WEATHER | K1185: SOUTH WEST BREEZE COOL DULL
D1186: 1ST QTR | H1186: 2ND QTR | L1186: 3RD QTR | P1186: FINAL
A1187: BRIGHTON | C1187: 3 | D1187: 3 | E1187: =C1187*6+D1187 -> 21 | G1187: 5 | H1187: 5 | I1187: =G1187*6+H1187 -> 35 | K1187: 13 | L1187: 9 | M1187: =K1187*6+L1187 -> 87 | O1187: 14 | P1187: 15 | Q1187: =O1187*6+P1187 -> 99 | S1187: JUNCTION OVAL
A1188: COBURG | C1188: 2 | D1188: 2 | E1188: =C1188*6+D1188 -> 14 | G1188: 4 | H1188: 6 | I1188: =G1188*6+H1188 -> 30 | K1188: 7 | L1188: 6 | M1188: =K1188*6+L1188 -> 48 | O1188: 11 | P1188: 8 | Q1188: =O1188*6+P1188 -> 74 | S1188: WRIGHT
A1189: BEST PLAYERS
A1190: BRIGHTON | C1190: O'ROURKE | F1190: WARBURTON | I1190: E TURNER | L1190: HALL | O1190: PINDER | R1190: CONROY
A1191: COBURG | C1191: HOLBROOK | F1191: WADE | I1191: CONDON | L1191: WALSH | O1191: STARBUCK | R1191: JORGENSON
A1192: GOALKICKERS
A1193: BRIGHTON | C1193: WARBURTON 7 | F1193: ADAMSON 3 | I1193: HOWE 2 | L1193: HEIMS | N1193: PINDER
A1194: COBURG | C1194: JAMES 4 | F1194: JORGENSON 3 | I1194: CLAPTON 2 | L1194: ROGAN 2
A1196: 2ND SEMI | C1196: 17TH SEPTEMBER | I1196: WEATHER | K1196: WEST BREEZE FINE & SUNNY
A1197: WILLIAMSTOWN | C1197: 2 | D1197: 2 | E1197: =C1197*6+D1197 -> 14 | G1197: 5 | H1197: 6 | I1197: =G1197*6+H1197 -> 36 | K1197: 10 | L1197: 8 | M1197: =K1197*6+L1197 -> 68 | O1197: 14 | P1197: 13 | Q1197: =O1197*6+P1197 -> 97 | S1197: JUNCTION OVAL
A1198: OAKLEIGH | C1198: 5 | D1198: 4 | E1198: =C1198*6+D1198 -> 34 | G1198: 9 | H1198: 8 | I1198: =G1198*6+H1198 -> 62 | K1198: 13 | L1198: 12 | M1198: =K1198*6+L1198 -> 90 | O1198: 13 | P1198: 14 | Q1198: =O1198*6+P1198 -> 92 | S1198: WRIGHT
A1199: BEST PLAYERS
A1200: WILLIAMSTOWN | C1200: SAMPSON | F1200: WELLS | I1200: DANCKERT | L1200: McPHERSON | O1200: FEATHERBY | R1200: WILCOX
A1201: OAKLEIGH | C1201: RYAN | F1201: WILLIAMS | I1201: BOYLE | L1201: SMEATON | O1201: DEAYTON | R1201: HILL
A1202: GOALKICKERS
A1203: WILLIAMSTOWN | C1203: TODD 7 | F1203: McPHERSON 3 | I1203: WILLIAMS 2 | L1203: ABBERTON | N1203: STRANG
A1204: OAKLEIGH | C1204: EDWARDS 3 | F1204: SCOTT 3 | I1204: SMEATON 2 | L1204: WENN | N1204: R FINN | P1204: HILL | Q1204: WILLIAMS | T1204: MARIAN
A1206: PRELIMINARY FINAL | F1206: 24TH SEPTEMBER | J1206: WEATHER | L1206: SOUTH BREEZE FINE & SUNNY
A1207: OAKLEIGH | C1207: 6 | D1207: 4 | E1207: =C1207*6+D1207 -> 40 | G1207: 7 | H1207: 10 | I1207: =G1207*6+H1207 -> 52 | K1207: 12 | L1207: 14 | M1207: =K1207*6+L1207 -> 86 | O1207: 14 | P1207: 16 | Q1207: =O1207*6+P1207 -> 100 | S1207: JUNCTION OVAL
A1208: BRIGHTON | C1208: 2 | D1208: 2 | E1208: =C1208*6+D1208 -> 14 | G1208: 7 | H1208: 5 | I1208: =G1208*6+H1208 -> 47 | K1208: 9 | L1208: 7 | M1208: =K1208*6+L1208 -> 61 | O1208: 12 | P1208: 13 | Q1208: =O1208*6+P1208 -> 85 | S1208: WRIGHT
A1209: BEST PLAYERS
A1210: OAKLEIGH | C1210: RYAN | F1210: TEMME | I1210: BOYLE | L1210: WATSON | O1210: EDWARDS | R1210: RAWLINGS
A1211: BRIGHTON | C1211: McASEY | F1211: ADAMSON | I1211: WILLIAMS | L1211: WARBURTON | O1211: E TURNER | R1211: NEW
A1212: GOALKICKERS
A1213: OAKLEIGH | C1213: EDWARDS 4 | F1213: SCOTT 3 | I1213: RAWLINGS 2 | L1213: PERKINS | N1213: LEANE | P1213: WILLIAMS | R1213: WENN | U1213: HILL
A1214: BRIGHTON | C1214: WARBURTON 4 | G1214: ADAMSON 3 | J1214: McINDOE 2 | M1214: HOWE | O1214: HEIMS | Q1214: O'ROURKE
A1216: GRAND FINAL | D1216: 1ST OCTOBER | I1216: WEATHER | K1216: NORTH WIND DULL
A1217: WILLIAMSTOWN | C1217: 1 | D1217: 2 | E1217: 8 | G1217: 2 | H1217: 2 | I1217: 14 | K1217: 7 | L1217: 3 | M1217: 45 | O1217: 10 | P1217: 5 | Q1217: =O1217*6+P1217 -> 65 | S1217: JUNCTION OVAL
A1218: OAKLEIGH | C1218: 2 | D1218: 3 | E1218: 15 | G1218: 5 | H1218: 9 | I1218: 39 | K1218: 6 | L1218: 12 | M1218: 48 | O1218: 8 | P1218: 14 | Q1218: =O1218*6+P1218 -> 62 | S1218: WRIGHT
A1219: BEST PLAYERS
A1220: WILLIAMSTOWN | C1220: WILCOX | F1220: WELLS | I1220: DANCKERT | L1220: CAMERON | O1220: SALVAS | R1220: TODD
A1221: OAKLEIGH | C1221: RYAN | F1221: BOYLE | I1221: WATSON | L1221: EDWARDS | O1221: DONNELLY | R1221: R FINN
A1222: GOALKICKERS
A1223: WILLIAMSTOWN | C1223: TODD 5 | F1223: WALKER 2 | I1223: MOLYNEUX | L1223: BERNARD | O1223: ABBERTON
A1224: OAKLEIGH | C1224: WATSON 2 | F1224: SMEATON 2 | I1224: EDWARDS | L1224: R FINN | N1224: WENN | P1224: SCOTT