A1: Victorian Football Association
A2: Season 1950
A3: © Copyright Wal Williams | F3: First created: 2 November 2014
A4: Contact: joywalwi at gmail dot com | F4: Last updated: 27 January 2018 | W4: VFA Results and tables - Link to the main index page
A5: You are free to copy this document in whole or part provided that proper acknowledgement is given to the author. All rights reserved.
A7: YEAR 1950
A8: ROUND 1 | D8: 22ND APRIL | J8: WEATHER | M8: SOUTH WIND COLD DULL | S8: PLAYED AT
D9: 1ST QTR | H9: 2ND QTR | L9: 3RD QTR | P9: FINAL | S9: TOORAK PARK
A10: PRAHRAN | C10: 3 | D10: 3 | E10: =C10*6+D10 -> 21 | G10: 10 | H10: 4 | I10: =G10*6+H10 -> 64 | K10: 14 | L10: 9 | M10: =K10*6+L10 -> 93 | O10: 24 | P10: 12 | Q10: =O10*6+P10 -> 156 | S10: UMPIRE | X10: LADDER | AB10: ROUND | AD10: 1
A11: YARRAVILLE | C11: 5 | D11: 2 | E11: =C11*6+D11 -> 32 | G11: 7 | H11: 4 | I11: =G11*6+H11 -> 46 | K11: 12 | L11: 5 | M11: =K11*6+L11 -> 77 | O11: 12 | P11: 6 | Q11: =O11*6+P11 -> 78 | S11: JOHNS
A12: BEST PLAYERS | W12: TEAM | X12: W | Y12: L | Z12: D | AA12: FOR | AB12: AGST | AC12: % | AD12: PTS
A13: PRAHRAN | C13: CHARLESTON | F13: MORROW | I13: FERGEUS | L13: LENZ | N13: OPRAY | Q13: BURGESS
A14: YARRAVILLE | C14: SEITZ | F14: ROHLEDER | I14: ORR | L14: PHILLIPS | N14: McASEY | Q14: TURNER | W14: PRAHRAN | X14: 1 | Y14: 0 | Z14: 0 | AA14: 156 | AB14: 78 | AC14: 200 | AD14: 4
A15: GOALKICKERS | Q15: SHILLABEER | W15: OAKLEIGH | X15: 1 | Y15: 0 | Z15: 0 | AA15: 136 | AB15: 68 | AC15: 200 | AD15: 4
A16: PRAHRAN | C16: CHARLESTON 5 | F16: BURGESS 5 | I16: LENZ 5 | K16: WALSH 4 | M16: MORROW 2 | P16: FERGEUS | R16: ARMSTRONG | W16: BRUNSWICK | X16: 1 | Y16: 0 | Z16: 0 | AA16: 72 | AB16: 63 | AC16: 114.28571428571429 | AD16: 4
A17: YARRAVILLE | C17: PHIILIPS 4 | F17: ROHLEDER 3 | I17: TURNER 2 | K17: McASEY 2 | M17: SORRAGHAN | W17: BRIGHTON | X17: 1 | Y17: 0 | Z17: 0 | AA17: 113 | AB17: 102 | AC17: 110.78431372549019 | AD17: 4
A19: BRUNSWICK | C19: 5 | D19: 6 | E19: =C19*6+D19 -> 36 | G19: 6 | H19: 9 | I19: =G19*6+H19 -> 45 | K19: 10 | L19: 12 | M19: =K19*6+L19 -> 72 | O19: 10 | P19: 12 | Q19: =O19*6+P19 -> 72 | S19: WILLIAMSTOWN | W19: PORT MELBOURNE | X19: 1 | Y19: 0 | Z19: 0 | AA19: 96 | AB19: 91 | AC19: 105.49450549450549 | AD19: 4
A20: WILLIAMSTOWN | C20: 1 | D20: 0 | E20: =C20*6+D20 -> 6 | G20: 4 | H20: 2 | I20: =G20*6+H20 -> 26 | K20: 4 | L20: 5 | M20: =K20*6+L20 -> 29 | O20: 9 | P20: 9 | Q20: =O20*6+P20 -> 63 | S20: WRIGHT | W20: NORTHCOTE | X20: 1 | Y20: 0 | Z20: 0 | AA20: 66 | AB20: 65 | AC20: 101.53846153846153 | AD20: 4
A21: BEST PLAYERS | W21: CAMBERWELL | X21: 0 | Y21: 1 | Z21: 0 | AA21: 65 | AB21: 66 | AC21: 98.484848484848484 | AD21: 0
A22: BRUNSWICK | C22: SPENCER | F22: PRIESTLEY | I22: JONES | L22: POLLARD | N22: HORDER | Q22: WHELAN | W22: COBURG | X22: 0 | Y22: 1 | Z22: 0 | AA22: 91 | AB22: 96 | AC22: 94.791666666666671 | AD22: 0
A23: WILLIAMSTOWN | C23: MAY | F23: FEATHERBY | I23: ABBERTON | L23: McPHERSON | N23: WALKER | Q23: FOWLER | W23: SANDRINGHAM | X23: 0 | Y23: 1 | Z23: 0 | AA23: 102 | AB23: 113 | AC23: 90.26548672566372 | AD23: 0
A24: GOALKICKERS | W24: WILLIAMSTOWN | X24: 0 | Y24: 1 | Z24: 0 | AA24: 63 | AB24: 72 | AC24: 87.5 | AD24: 0
A25: BRUNSWICK | C25: SPENCER 3 | F25: MAHER 2 | I25: SHAW 2 | L25: PRIESTLEY | N25: LEOPOLD | P25: HORDER | W25: PRESTON | X25: 0 | Y25: 1 | Z25: 0 | AA25: 68 | AB25: 136 | AC25: 50 | AD25: 0
A26: WILLIAMSTOWN | C26: FOWLER 4 | F26: DULLARD 2 | I26: ABBERTON 2 | L26: McPHERSON | W26: YARRAVILLE | X26: 0 | Y26: 1 | Z26: 0 | AA26: 78 | AB26: 156 | AC26: 50 | AD26: 0
A28: OAKLEIGH | C28: 4 | D28: 3 | E28: =C28*6+D28 -> 27 | G28: 11 | H28: 9 | I28: =G28*6+H28 -> 75 | K28: 15 | L28: 13 | M28: =K28*6+L28 -> 103 | O28: 20 | P28: 16 | Q28: =O28*6+P28 -> 136 | S28: OAKLEIGH
A29: PRESTON | C29: 4 | D29: 1 | E29: =C29*6+D29 -> 25 | G29: 8 | H29: 4 | I29: =G29*6+H29 -> 52 | K29: 10 | L29: 5 | M29: =K29*6+L29 -> 65 | O29: 10 | P29: 8 | Q29: =O29*6+P29 -> 68 | S29: IRVING
A30: BEST PLAYERS
A31: OAKLEIGH | C31: NAISMITH | F31: BAXTER | I31: SCOTT | L31: WILLIAMS | O31: BOYLE | Q31: JORY
A32: PRESTON | C32: NATHAN | F32: MEARS | I32: LEHMANN | L32: PRITCHARD | O32: GOLDIN | Q32: DUNGAN
A33: GOALKICKERS
A34: OAKLEIGH | C34: NAISMITH 9 | F34: PERKINS 3 | I34: JORY 3 | K34: TINDAL 2 | M34: SCOTT | O34: EDWARDS | Q34: MARIAN
A35: PRESTON | C35: NATHAN 4 | F35: MEARS 2 | I35: GOLDIN 2 | K35: DUNGAN | M35: K BRYCE
A37: NORTHCOTE | C37: 1 | D37: 4 | E37: =C37*6+D37 -> 10 | G37: 4 | H37: 7 | I37: =G37*6+H37 -> 31 | K37: 5 | L37: 9 | M37: =K37*6+L37 -> 39 | O37: 9 | P37: 12 | Q37: =O37*6+P37 -> 66 | S37: NORTHCOTE
A38: CAMBERWELL | C38: 3 | D38: 3 | E38: =C38*6+D38 -> 21 | G38: 5 | H38: 7 | I38: =G38*6+H38 -> 37 | K38: 7 | L38: 9 | M38: =K38*6+L38 -> 51 | O38: 9 | P38: 11 | Q38: =O38*6+P38 -> 65 | S38: ROBINSON
A39: BEST PLAYERS
A40: NORTHCOTE | C40: PAWSEY | E40: WHITECHURCH | H40: KINDER | K40: BRUNNEN | N40: GALLAGHER | Q40: SEARL
A41: CAMBERWELL | C41: JENSEN | E41: STUBBS | H41: SHARPLES | K41: BOHAN | N41: BENBOW | Q41: ROCHFORD
A42: GOALKICKERS
A43: NORTHCOTE | C43: WHITECHURCH 3 | F43: FORSTER 2 | I43: PAWSEY 2 | L43: NASH | N43: FISHER
A44: CAMBERWELL | C44: ROCHFORD 3 | F44: BOHAN 2 | I44: BENBOW 2 | L44: STUBBS | N44: MILGATE
A46: PORT MELBOURNE | C46: 5 | D46: 5 | E46: =C46*6+D46 -> 35 | G46: 8 | H46: 8 | I46: =G46*6+H46 -> 56 | K46: 13 | L46: 10 | M46: =K46*6+L46 -> 88 | O46: 14 | P46: 12 | Q46: =O46*6+P46 -> 96 | S46: COBURG
A47: COBURG | C47: 4 | D47: 0 | E47: =C47*6+D47 -> 24 | G47: 11 | H47: 4 | I47: =G47*6+H47 -> 70 | K47: 11 | L47: 7 | M47: =K47*6+L47 -> 73 | O47: 13 | P47: 13 | Q47: =O47*6+P47 -> 91 | S47: MILNE
A48: BEST PLAYERS
A49: PORT MELBOURNE | C49: CONDON | F49: WILSON | I49: CULPH | L49: LEWIS | N49: McNAUGHTON | Q49: REYNOLDS
A50: COBURG | C50: EQUID | F50: JAMES | I50: R WILKINSON | L50: GATH | N50: CHUBB | Q50: CAHIR
A51: GOALKICKERS
A52: PORT MELBOURNE | C52: CULPH 4 | F52: CONDON 4 | I52: LEWIS 3 | K52: EVEREST | M52: BAKER | O52: WALSH
A53: COBURG | C53: JAMES 6 | F53: R WILKINSON 2 | J53: EQUID 2 | L53: H WILKINSON 2 | O53: ROGAN
A55: BRIGHTON | C55: 5 | D55: 4 | E55: =C55*6+D55 -> 34 | G55: 6 | H55: 5 | I55: =G55*6+H55 -> 41 | K55: 14 | L55: 9 | M55: =K55*6+L55 -> 93 | O55: 17 | P55: 11 | Q55: =O55*6+P55 -> 113 | S55: BEACH ROAD
A56: SANDRINGHAM | C56: 4 | D56: 0 | E56: =C56*6+D56 -> 24 | G56: 10 | H56: 6 | I56: =G56*6+H56 -> 66 | K56: 10 | L56: 6 | M56: =K56*6+L56 -> 66 | O56: 15 | P56: 12 | Q56: =O56*6+P56 -> 102 | S56: BARKER
A57: BEST PLAYERS
A58: BRIGHTON | C58: E TURNER | F58: WARBURTON | I58: COMBER | L58: HEIMS | N58: BURKE | Q58: PERKINS
A59: SANDRINGHAM | C59: B HARPER | F59: DIXON | I59: BENCRAFT | L59: RIPPON | N59: COLLINS | Q59: R HARPER
A60: GOALKICKERS
A61: BRIGHTON | C61: WARBURTON 5 | F61: HOWE 3 | I61: ADAMSON 2 | L61: HEIMS 2 | N61: PLUNKETT | Q61: LUMMIS | S61: CONROY | V61: FREEMAN | X61: BURKE
A62: SANDRINGHAM | C62: B HARPER 8 | F62: COLLINS 2 | I62: BENCRAFT 2 | L62: GILBERT | N62: R HARPER | Q62: CERINI
A64: ROUND 2 | D64: 29TH APRIL | J64: WEATHER | M64: NORTH EAST BREEZE WARM SUNNY | S64: PLAYED AT
D65: 1ST QTR | H65: 2ND QTR | L65: 3RD QTR | P65: FINAL | S65: BRUNSWICK
A66: BRUNSWICK | C66: 3 | D66: 2 | E66: =C66*6+D66 -> 20 | G66: 4 | H66: 5 | I66: =G66*6+H66 -> 29 | K66: 9 | L66: 7 | M66: =K66*6+L66 -> 61 | O66: 10 | P66: 10 | Q66: =O66*6+P66 -> 70 | S66: UMPIRE | X66: LADDER | AB66: ROUND | AD66: 2
A67: PRAHRAN | C67: 1 | D67: 4 | E67: =C67*6+D67 -> 10 | G67: 4 | H67: 11 | I67: =G67*6+H67 -> 35 | K67: 7 | L67: 16 | M67: =K67*6+L67 -> 58 | O67: 7 | P67: 20 | Q67: =O67*6+P67 -> 62 | S67: IRVING
A68: BEST PLAYERS | W68: TEAM | X68: W | Y68: L | Z68: D | AA68: FOR | AB68: AGST | AC68: % | AD68: PTS
A69: BRUNSWICK | C69: GEISLER | F69: SPENCER | I69: PRIESTLEY | L69: JONES | O69: SHAW | Q69: YEA
A70: PRAHRAN | C70: ARMSTRONG | F70: MASTERTON | I70: BURGESS | L70: JONES | O70: LENZ | Q70: OPRAY | W70: BRIGHTON | X70: 2 | Y70: 0 | Z70: 0 | AA70: 217 | AB70: 162 | AC70: 133.95061728395061 | AD70: 8
A71: GOALKICKERS | W71: PORT MELBOURNE | X71: 2 | Y71: 0 | Z71: 0 | AA71: 203 | AB71: 161 | AC71: 126.08695652173913 | AD71: 8
A72: BRUNSWICK | C72: SPENCER 4 | F72: CHAPMAN 3 | I72: PRIESTLEY 2 | L72: JONES | W72: BRUNSWICK | X72: 2 | Y72: 0 | Z72: 0 | AA72: 142 | AB72: 125 | AC72: 113.6 | AD72: 8
A73: PRAHRAN | C73: BURGESS 3 | F73: LENZ 2 | I73: MORROW | L73: CHARLESTON | W73: PRAHRAN | X73: 1 | Y73: 1 | Z73: 0 | AA73: 218 | AB73: 148 | AC73: 147.29729729729729 | AD73: 4
A75: BRIGHTON | C75: 3 | D75: 5 | E75: =C75*6+D75 -> 23 | G75: 7 | H75: 12 | I75: =G75*6+H75 -> 54 | K75: 10 | L75: 16 | M75: =K75*6+L75 -> 76 | O75: 14 | P75: 20 | Q75: =O75*6+P75 -> 104 | S75: ELSTERNWICK PARK | W75: COBURG | X75: 1 | Y75: 1 | Z75: 0 | AA75: 232 | AB75: 158 | AC75: 146.83544303797467 | AD75: 4
A76: OAKLEIGH | C76: 2 | D76: 6 | E76: =C76*6+D76 -> 18 | G76: 3 | H76: 8 | I76: =G76*6+H76 -> 26 | K76: 5 | L76: 9 | M76: =K76*6+L76 -> 39 | O76: 8 | P76: 12 | Q76: =O76*6+P76 -> 60 | S76: WRIGHT | W76: CAMBERWELL | X76: 1 | Y76: 1 | Z76: 0 | AA76: 162 | AB76: 129 | AC76: 125.58 | AD76: 4
A77: BEST PLAYERS | W77: OAKLEIGH | X77: 1 | Y77: 1 | Z77: 0 | AA77: 196 | AB77: 172 | AC77: 113.95348837209302 | AD77: 4
A78: BRIGHTON | C78: PERKINS | F78: NEW | I78: E TURNER | L78: G TURNER | O78: HEIMS | Q78: MCASEY | W78: WILLIAMSTOWN | X78: 1 | Y78: 1 | Z78: 0 | AA78: 165 | AB78: 157 | AC78: 105.1 | AD78: 4
A79: OAKLEIGH | C79: RYAN | F79: WATSON | I79: POWER | L79: GRAY | O79: JORY | Q79: WILLIAMS | W79: NORTHCOTE | X79: 1 | Y79: 1 | Z79: 0 | AA79: 136 | AB79: 172 | AC79: 79.069767441860463 | AD79: 4
A80: GOALKICKERS | W80: SANDRINGHAM | X80: 0 | Y80: 2 | Z80: 0 | AA80: 165 | AB80: 210 | AC80: 78.57 | AD80: 0
A81: BRIGHTON | C81: WARBURTON 5 | F81: ADAMSON 4 | I81: PERKINS | K81: HEIMS | M81: HOWE | O81: BURKE | Q81: PICKERING | W81: PRESTON | X81: 0 | Y81: 2 | Z81: 0 | AA81: 153 | AB81: 238 | AC81: 64.29 | AD81: 0
A82: OAKLEIGH | C82: NAISMITH 2 | F82: WILLIAMS | I82: BAXTER | K82: BENSON | M82: RAWLINGS | P82: EVANS | W82: YARRAVILLE | X82: 0 | Y82: 2 | Z82: 0 | AA82: 140 | AB82: 297 | AC82: 47.138047138047135 | AD82: 0
A84: PORT MELBOURNE | C84: 4 | D84: 2 | E84: =C84*6+D84 -> 26 | G84: 7 | H84: 4 | I84: =G84*6+H84 -> 46 | K84: 12 | L84: 7 | M84: =K84*6+L84 -> 79 | O84: 16 | P84: 11 | Q84: =O84*6+P84 -> 107 | S84: PORT MELBOURNE
A85: NORTHCOTE | C85: 5 | D85: 5 | E85: =C85*6+D85 -> 35 | G85: 6 | H85: 9 | I85: =G85*6+H85 -> 45 | K85: 8 | L85: 14 | M85: =K85*6+L85 -> 62 | O85: 9 | P85: 16 | Q85: =O85*6+P85 -> 70 | S85: BARKER
A86: BEST PLAYERS
A87: PORT MELBOURNE | C87: CULPH | F87: JOHNSON | I87: PARKER | L87: LEWIS | O87: RAMSAY | Q87: STOREY
A88: NORTHCOTE | C88: HISCOX | F88: O'KEEFE | I88: FORSTER | L88: STABB | O88: WILSON | Q88: HINES
A89: GOALKICKERS
A90: PORT MELBOURNE | C90: CULPH 7 | F90: PARKER 3 | I90: EVEREST 2 | L90: WALSH 2 | N90: LEWIS | P90: RAMSAY
A91: NORTHCOTE | C91: WHITE 3 | F91: FISHER 2 | I91: PAWSEY 2 | L91: BEST | N91: WHITECHURCH
A93: CAMBERWELL | C93: 5 | D93: 3 | E93: =C93*6+D93 -> 33 | G93: 7 | H93: 7 | I93: =G93*6+H93 -> 49 | K93: 10 | L93: 9 | M93: =K93*6+L93 -> 69 | O93: 14 | P93: 13 | Q93: =O93*6+P93 -> 97 | S93: CAMBERWELL
A94: SANDRINGHAM | C94: 1 | D94: 4 | E94: =C94*6+D94 -> 10 | G94: 4 | H94: 9 | I94: =G94*6+H94 -> 33 | K94: 5 | L94: 14 | M94: =K94*6+L94 -> 44 | O94: 8 | P94: 15 | Q94: =O94*6+P94 -> 63 | S94: MILNE
A95: BEST PLAYERS
A96: CAMBERWELL | C96: STYLES | F96: BOHAN | I96: BENBOW | L96: MILGATE | O96: RUDDELL | R96: KENNEDY
A97: SANDRINGHAM | C97: GRAMBEAU | F97: DIXON | I97: JONES | L97: R HARPER | O97: GUILLE | R97: B HARPER
A98: GOALKICKERS
A99: CAMBERWELL | C99: MILGATE 5 | F99: ROSENBROCK 3 | I99: JENSEN 2 | K99: BOHAN 2 | M99: HOOD | O99: SCHNEIDER
A100: SANDRINGHAM | C100: B HARPER 2 | F100: R HARPER 2 | I100: COLLINS | K100: GILBERT | M100: BENCRAFT | O100: GUILLE
A102: COBURG | C102: 7 | D102: 6 | E102: =C102*6+D102 -> 48 | G102: 12 | H102: 9 | I102: =G102*6+H102 -> 81 | K102: 16 | L102: 15 | M102: =K102*6+L102 -> 111 | O102: 20 | P102: 21 | Q102: =O102*6+P102 -> 141 | S102: YARRAVILLE
A103: YARRAVILLE | C103: 0 | D103: 3 | E103: =C103*6+D103 -> 3 | G103: 2 | H103: 9 | I103: =G103*6+H103 -> 21 | K103: 4 | L103: 10 | M103: =K103*6+L103 -> 34 | O103: 8 | P103: 14 | Q103: =O103*6+P103 -> 62 | S103: ROBINSON
A104: BEST PLAYERS
A105: COBURG | C105: ROGAN | F105: HOLBROOK | I105: R WILKINSON | L105: VARNEY | O105: EQUID | Q105: STARBUCK
A106: YARRAVILLE | C106: ROHLEDER | F106: WOODS | I106: PHILLIPS | L106: GWYNN | O106: IRWIN | Q106: MALBON
A107: GOALKICKERS
A108: COBURG | C108: ROGAN 5 | F108: JAMES 4 | H108: JORGENSON 4 | K108: H WILKINSON 3 | N108: R WILKINSON 2 | R108: EQUID | T108: CHUBB
A109: YARRAVILLE | C109: IRWIN 3 | F109: PHILLIPS 2 | I109: ROHLEDER | L109: McASEY | N109: SEITZ
A111: WILLIAMSTOWN | C111: 2 | D111: 3 | E111: =C111*6+D111 -> 15 | G111: 7 | H111: 10 | I111: =G111*6+H111 -> 52 | K111: 11 | L111: 11 | M111: =K111*6+L111 -> 77 | O111: 14 | P111: 18 | Q111: =O111*6+P111 -> 102 | S111: PRESTON
A112: PRESTON | C112: 4 | D112: 2 | E112: =C112*6+D112 -> 26 | G112: 6 | H112: 3 | I112: =G112*6+H112 -> 39 | K112: 9 | L112: 4 | M112: =K112*6+L112 -> 58 | O112: 13 | P112: 7 | Q112: =O112*6+P112 -> 85 | S112: JOHNS
A113: BEST PLAYERS
A114: WILLIAMSTOWN | C114: SALVAS | F114: DULLARD | I114: MOLYNEUX | L114: BERNARD | O114: BARKER | R114: McPHERSON
A115: PRESTON | C115: LEISHMAN | F115: GOLDIN | I115: PRITCHARD | L115: LEHMANN | O115: BRADFORD | R115: KEENE
A116: GOALKICKERS
A117: WILLIAMSTOWN | C117: DULLARD 3 | F117: BARKER 3 | I117: MOLYNEUX 2 | L117: McPHERSON 2 | O117: MAY 2 | Q117: FOWLER | S117: ABBERTON
A118: PRESTON | C118: BRADFORD 3 | F118: GOLDIN 2 | I118: PASCOE 2 | K118: KEENE 2 | M118: R BRYCE 2 | O118: WHITFIELD | Q118: NATHAN
A120: ROUND 3 | D120: 6TH MAY | J120: WEATHER | M120: LIGHT RAIN IN MORNING | S120: PLAYED AT
D121: 1ST QTR | H121: 2ND QTR | L121: 3RD QTR | P121: FINAL | S121: OAKLEIGH
A122: OAKLEIGH | C122: 1 | D122: 4 | E122: =C122*6+D122 -> 10 | G122: 2 | H122: 8 | I122: =G122*6+H122 -> 20 | K122: 9 | L122: 8 | M122: =K122*6+L122 -> 62 | O122: 11 | P122: 13 | Q122: =O122*6+P122 -> 79 | S122: UMPIRE | X122: LADDER | AB122: ROUND | AD122: 3
A123: CAMBERWELL | C123: 2 | D123: 5 | E123: =C123*6+D123 -> 17 | G123: 4 | H123: 6 | I123: =G123*6+H123 -> 30 | K123: 7 | L123: 12 | M123: =K123*6+L123 -> 54 | O123: 8 | P123: 14 | Q123: =O123*6+P123 -> 62 | S123: BOWDEN
A124: BEST PLAYERS | W124: TEAM | X124: W | Y124: L | Z124: D | AA124: FOR | AB124: AGST | AC124: % | AD124: PTS
A125: OAKLEIGH | C125: RYAN | E125: SCOTT | H125: BAXTER | K125: TINDAL | N125: HALE | Q125: SMEATON
A126: CAMBERWELL | C126: LOVETT | E126: JENSEN | H126: STYLES | K126: BOHAN | N126: MILGATE | Q126: FLETCHER | W126: PORT MELBOURNE | X126: 3 | Y126: 0 | Z126: 0 | AA126: 291 | AB126: 231 | AC126: 125.97402597402598 | AD126: 12
A127: GOALKICKERS | W127: BRUNSWICK | X127: 3 | Y127: 0 | Z127: 0 | AA127: 240 | AB127: 198 | AC127: 121.21212121212122 | AD127: 12
A128: OAKLEIGH | C128: NAISMITH 4 | F128: WILLIAMS 2 | I128: J WATSON 2 | L128: SCOTT | N128: SMEATON | Q128: GRAY | W128: PRAHRAN | X128: 2 | Y128: 1 | Z128: 0 | AA128: 290 | AB128: 198 | AC128: 146.46464646464648 | AD128: 8
A129: CAMBERWELL | C129: BOHAN 3 | F129: MILGATE 2 | I129: WOOD | K129: FINNEGAN | N129: DUFF | W129: COBURG | X129: 2 | Y129: 1 | Z129: 0 | AA129: 332 | AB129: 249 | AC129: 133.33333333333334 | AD129: 8
A131: WILLIAMSTOWN | C131: 0 | D131: 3 | E131: =C131*6+D131 -> 3 | G131: 5 | H131: 8 | I131: =G131*6+H131 -> 38 | K131: 5 | L131: 9 | M131: =K131*6+L131 -> 39 | O131: 10 | P131: 12 | Q131: =O131*6+P131 -> 72 | S131: WILLIAMSTOWN | W131: OAKLEIGH | X131: 2 | Y131: 1 | Z131: 0 | AA131: 275 | AB131: 234 | AC131: 117.52136752136752 | AD131: 8
A132: BRIGHTON | C132: 3 | D132: 1 | E132: =C132*6+D132 -> 19 | G132: 4 | H132: 3 | I132: =G132*6+H132 -> 27 | K132: 8 | L132: 6 | M132: =K132*6+L132 -> 54 | O132: 8 | P132: 6 | Q132: =O132*6+P132 -> 54 | S132: IRVING | W132: BRIGHTON | X132: 2 | Y132: 1 | Z132: 0 | AA132: 271 | AB132: 234 | AC132: 115.81196581196581 | AD132: 8
A133: BEST PLAYERS | W133: WILLIAMSTOWN | X133: 2 | Y133: 1 | Z133: 0 | AA133: 237 | AB133: 211 | AC133: 112.32 | AD133: 8
A134: WILLIAMSTOWN | C134: DANCKERT | F134: CAMERON | I134: MOLYNEUX | L134: WILLIAMS | O134: SAMPSON | Q134: McPHERSON | W134: CAMBERWELL | X134: 1 | Y134: 2 | Z134: 0 | AA134: 224 | AB134: 208 | AC134: 107.69 | AD134: 4
A135: BRIGHTON | C135: G TURNER | F135: McASEY | I135: McINDOE | L135: HALL | O135: NEW | Q135: FREEMAN | W135: NORTHCOTE | X135: 1 | Y135: 2 | Z135: 0 | AA135: 227 | AB135: 272 | AC135: 83.455882352941174 | AD135: 4
A136: GOALKICKERS | W136: SANDRINGHAM | X136: 0 | Y136: 3 | Z136: 0 | AA136: 235 | AB136: 298 | AC136: 78.86 | AD136: 0
A137: WILLIAMSTOWN | C137: MOLYNEUX 3 | F137: ABBERTON 3 | I137: McPHERSON 2 | L137: SALVAS 2 | W137: PRESTON | X137: 0 | Y137: 3 | Z137: 0 | AA137: 203 | AB137: 310 | AC137: 65.48 | AD137: 0
A138: BRIGHTON | C138: WARBURTON 3 | F138: McINDOE 3 | I138: HOWE | K138: ADAMSON | W138: YARRAVILLE | X138: 0 | Y138: 3 | Z138: 0 | AA138: 213 | AB138: 395 | AC138: 53.924050632911396 | AD138: 0
A140: COBURG | C140: 5 | D140: 3 | E140: =C140*6+D140 -> 33 | G140: 5 | H140: 5 | I140: =G140*6+H140 -> 35 | K140: 11 | L140: 12 | M140: =K140*6+L140 -> 78 | O140: 14 | P140: 16 | Q140: =O140*6+P140 -> 100 | S140: NORTHCOTE
A141: NORTHCOTE | C141: 3 | D141: 4 | E141: =C141*6+D141 -> 22 | G141: 6 | H141: 10 | I141: =G141*6+H141 -> 46 | K141: 10 | L141: 10 | M141: =K141*6+L141 -> 70 | O141: 13 | P141: 13 | Q141: =O141*6+P141 -> 91 | S141: ROBINSON
A142: BEST PLAYERS
A143: COBURG | C143: JAMES | F143: STARBUCK | I143: HEEPS | K143: HOLBROOK | N143: SPENCER | Q143: WADE
A144: NORTHCOTE | C144: PAWSEY | F144: HISCOX | I144: WHITE | K144: GALLAGHER | N144: FAHEY | Q144: POWELL
A145: GOALKICKERS
A146: COBURG | C146: JAMES 5 | F146: JORGENSON 3 | I146: ROGAN 2 | K146: R WILKINSON 2 | N146: H WILKINSON | Q146: VARNEY
A147: NORTHCOTE | C147: PAWSEY 5 | F147: WHITECHURCH 4 | J147: WHITE | L147: O'KEEFE | N147: FORSTER | Q147: GALLAGHER
A149: PORT MELBOURNE | C149: 5 | D149: 5 | E149: =C149*6+D149 -> 35 | G149: 7 | H149: 7 | I149: =G149*6+H149 -> 49 | K149: 10 | L149: 11 | M149: =K149*6+L149 -> 71 | O149: 12 | P149: 16 | Q149: =O149*6+P149 -> 88 | S149: BEACH ROAD
A150: SANDRINGHAM | C150: 3 | D150: 1 | E150: =C150*6+D150 -> 19 | G150: 5 | H150: 5 | I150: =G150*6+H150 -> 35 | K150: 9 | L150: 7 | M150: =K150*6+L150 -> 61 | O150: 10 | P150: 10 | Q150: =O150*6+P150 -> 70 | S150: JOHNS
A151: BEST PLAYERS
A152: PORT MELBOURNE | C152: WILSON | F152: JOHNSON | I152: CULPH | K152: ARGOON | N152: DRINAN | Q152: WALSH
A153: SANDRINGHAM | C153: DIXON | F153: McFEE | I153: B HARPER | K153: BENCRAFT | N153: RIPPON | Q153: GUILLE
A154: GOALKICKERS
A155: PORT MELBOURNE | C155: CULPH 4 | F155: LEWIS 3 | I155: BLOOM 2 | K155: WALSH | M155: CONDON | O155: STOREY
A156: SANDRINGHAM | C156: B HARPER 5 | F156: McFEE 3 | I156: GUILLE | K156: JONES
A158: PRAHRAN | C158: 1 | D158: 1 | E158: =C158*6+D158 -> 7 | G158: 4 | H158: 6 | I158: =G158*6+H158 -> 30 | K158: 9 | L158: 13 | M158: =K158*6+L158 -> 67 | O158: 9 | P158: 18 | Q158: =O158*6+P158 -> 72 | S158: TOORAK PARK
A159: PRESTON | C159: 2 | D159: 5 | E159: =C159*6+D159 -> 17 | G159: 2 | H159: 8 | I159: =G159*6+H159 -> 20 | K159: 3 | L159: 10 | M159: =K159*6+L159 -> 28 | O159: 6 | P159: 14 | Q159: =O159*6+P159 -> 50 | S159: BARKER
A160: BEST PLAYERS
A161: PRAHRAN | C161: MORROW | F161: MASTERTON | J161: COLLS | L161: HILL | N161: FERGEUS | Q161: WALSH
A162: PRESTON | C162: STEWART | F162: JOHNSON | J162: FISHER | L162: GOLDIN | N162: PASCOE | Q162: HINES
A163: GOALKICKERS
A164: PRAHRAN | C164: MORROW 4 | F164: WALSH | H164: CHARLESTON | K164: FERGEUS | M164: LENZ | O164: MASTERTON
A165: PRESTON | C165: GOLDIN 2 | F165: LALOR | I165: HINES | K165: BRADFORD | N165: DONALD
A167: BRUNSWICK | C167: 4 | D167: 1 | E167: =C167*6+D167 -> 25 | G167: 8 | H167: 6 | I167: =G167*6+H167 -> 54 | K167: 13 | L167: 9 | M167: =K167*6+L167 -> 87 | O167: 14 | P167: 14 | Q167: =O167*6+P167 -> 98 | S167: BRUNSWICK
A168: YARRAVILLE | C168: 0 | D168: 3 | E168: =C168*6+D168 -> 3 | G168: 2 | H168: 6 | I168: =G168*6+H168 -> 18 | K168: 5 | L168: 7 | M168: =K168*6+L168 -> 37 | O168: 10 | P168: 13 | Q168: =O168*6+P168 -> 73 | S168: MILNE
A169: BEST PLAYERS
A170: BRUNSWICK | C170: SPENCER | F170: PRIESTLEY | J170: McIVOR | L170: GEISLER | O170: JONES | Q170: YEA
A171: YARRAVILLE | C171: PHILLIPS | F171: IRWIN | J171: WEBB | L171: MALBON | O171: GODDARD | Q171: WAGHORN
A172: GOALKICKERS
A173: BRUNSWICK | C173: SPENCER 5 | F173: PRIESTLEY 2 | I173: HOWARD 2 | L173: JONES 2 | N173: MAHER 2 | Q173: CAREY
A174: YARRAVILLE | C174: PHILLIPS 4 | F174: WEBB 2 | H174: WAGHORN 2 | K174: MCASEY | M174: MADDOCKS
A176: ROUND 4 | D176: 13TH MAY | J176: WEATHER | M176: DULL LIGHT RAIN IN MORNING | S176: PLAYED AT
D177: 1ST QTR | H177: 2ND QTR | L177: 3RD QTR | P177: FINAL | S177: PORT MELBOURNE
A178: OAKLEIGH | C178: 5 | D178: 7 | E178: =C178*6+D178 -> 37 | G178: 8 | H178: 12 | I178: =G178*6+H178 -> 60 | K178: 11 | L178: 16 | M178: =K178*6+L178 -> 82 | O178: 11 | P178: 17 | Q178: =O178*6+P178 -> 83 | S178: UMPIRE | X178: LADDER | AB178: ROUND | AD178: 4
A179: PORT MELBOURNE | C179: 5 | D179: 1 | E179: =C179*6+D179 -> 31 | G179: 6 | H179: 4 | I179: =G179*6+H179 -> 40 | K179: 7 | L179: 8 | M179: =K179*6+L179 -> 50 | O179: 11 | P179: 8 | Q179: =O179*6+P179 -> 74 | S179: MILNE
A180: BEST PLAYERS | W180: TEAM | X180: W | Y180: L | Z180: D | AA180: FOR | AB180: AGST | AC180: % | AD180: PTS
A181: OAKLEIGH | C181: RYAN | F181: WILLIAMS | I181: TEMME | L181: HALE | N181: BAXTER | Q181: TINDAL
A182: PORT MELBOURNE | C182: DRINAN | F182: JOHNSON | I182: McNAUGHTON | L182: BLOOM | N182: KELSEY | Q182: WILSON | W182: BRUNSWICK | X182: 4 | Y182: 0 | Z182: 0 | AA182: 334 | AB182: 248 | AC182: 134.67741935483872 | AD182: 16
A183: GOALKICKERS | W183: WILLIAMSTOWN | X183: 3 | Y183: 1 | Z183: 0 | AA183: 341 | AB183: 281 | AC183: 121.35 | AD183: 12
A184: OAKLEIGH | C184: NAISMITH 4 | F184: CUNNINGHAM 3 | J184: WENN 2 | L184: HALE | N184: GRAY | W184: BRIGHTON | X184: 3 | Y184: 1 | Z184: 0 | AA184: 383 | AB184: 318 | AC184: 120.44025157232704 | AD184: 12
A185: PORT MELBOURNE | C185: CULPH 5 | F185: LEWIS 2 | H185: WALSH | J185: BLOOM | L185: EVEREST | N185: REYNOLDS | W185: PORT MELBOURNE | X185: 3 | Y185: 1 | Z185: 0 | AA185: 365 | AB185: 314 | AC185: 116.24203821656052 | AD185: 12
A187: BRIGHTON | C187: 2 | D187: 7 | E187: =C187*6+D187 -> 19 | G187: 8 | H187: 12 | I187: =G187*6+H187 -> 60 | K187: 12 | L187: 20 | M187: =K187*6+L187 -> 92 | O187: 15 | P187: 22 | Q187: =O187*6+P187 -> 112 | S187: ELSTERNWICK PARK | W187: OAKLEIGH | X187: 3 | Y187: 1 | Z187: 0 | AA187: 358 | AB187: 308 | AC187: 116.23376623376623 | AD187: 12
A188: PRAHRAN | C188: 2 | D188: 4 | E188: =C188*6+D188 -> 16 | G188: 7 | H188: 7 | I188: =G188*6+H188 -> 49 | K188: 7 | L188: 9 | M188: =K188*6+L188 -> 51 | O188: 12 | P188: 12 | Q188: =O188*6+P188 -> 84 | S188: ROBINSON | W188: COBURG | X188: 2 | Y188: 2 | Z188: 0 | AA188: 405 | AB188: 333 | AC188: 121.62162162162163 | AD188: 8
A189: BEST PLAYERS | W189: PRAHRAN | X189: 2 | Y189: 2 | Z189: 0 | AA189: 374 | AB189: 310 | AC189: 120.64516129032258 | AD189: 8
A190: BRIGHTON | C190: HALL | F190: PICKERING | I190: PERKINS | L190: NEW | N190: E TURNER | Q190: HOWE | W190: NORTHCOTE | X190: 2 | Y190: 2 | Z190: 0 | AA190: 319 | AB190: 363 | AC190: 87.878787878787875 | AD190: 8
A191: PRAHRAN | C191: HARVEY | F191: MATSON | I191: OPRAY | L191: WOOD | N191: O'CONNOR | Q191: KEEGAN | W191: CAMBERWELL | X191: 1 | Y191: 3 | Z191: 0 | AA191: 294 | AB191: 312 | AC191: 94.23 | AD191: 4
A192: GOALKICKERS | W192: SANDRINGHAM | X192: 1 | Y192: 3 | Z192: 0 | AA192: 319 | AB192: 371 | AC192: 85.98 | AD192: 4
A193: BRIGHTON | C193: HALL 4 | F193: HOWE 4 | I193: PICKERING 3 | L193: WILLS 3 | N193: HEIMS | W193: PRESTON | X193: 0 | Y193: 4 | Z193: 0 | AA193: 253 | AB193: 404 | AC193: 62.62 | AD193: 0
A194: PRAHRAN | C194: HARVEY 5 | F194: WOOD 4 | I194: MORROW 2 | L194: KEEGAN | W194: YARRAVILLE | X194: 0 | Y194: 4 | Z194: 0 | AA194: 304 | AB194: 487 | AC194: 62.422997946611908 | AD194: 0
A196: WILLIAMSTOWN | C196: 1 | D196: 4 | E196: =C196*6+D196 -> 10 | G196: 4 | H196: 11 | I196: =G196*6+H196 -> 35 | K196: 9 | L196: 17 | M196: =K196*6+L196 -> 71 | O196: 14 | P196: 20 | Q196: =O196*6+P196 -> 104 | S196: CAMBERWELL
A197: CAMBERWELL | C197: 5 | D197: 2 | E197: =C197*6+D197 -> 32 | G197: 6 | H197: 3 | I197: =G197*6+H197 -> 39 | K197: 9 | L197: 8 | M197: =K197*6+L197 -> 62 | O197: 10 | P197: 10 | Q197: =O197*6+P197 -> 70 | S197: JOHNS
A198: BEST PLAYERS
A199: WILLIAMSTOWN | C199: FEATHERBY | F199: MOLYNEUX | I199: CAMERON | L199: VERNON | N199: BARKER | Q199: SALVAS
A200: CAMBERWELL | C200: LOVETT | F200: WAKE | I200: STUBBS | L200: BOHAN | N200: JENSEN | Q200: FLETCHER
A201: GOALKICKERS
A202: WILLIAMSTOWN | C202: DULLARD 4 | F202: VERNON 3 | I202: BERNARD 2 | L202: McRAE 2 | N202: McPHERSON | Q202: SALVAS | S202: WALKER
A203: CAMBERWELL | C203: STUBBS 2 | F203: BOHAN 2 | I203: JENSEN 2 | K203: DUFF | M203: FINNEGAN | O203: LUMSDEN | Q203: ROSENBROCK
A205: NORTHCOTE | C205: 4 | D205: 7 | E205: =C205*6+D205 -> 31 | G205: 8 | H205: 8 | I205: =G205*6+H205 -> 56 | K205: 9 | L205: 11 | M205: =K205*6+L205 -> 65 | O205: 13 | P205: 14 | Q205: =O205*6+P205 -> 92 | S205: YARRAVILLE
A206: YARRAVILLE | C206: 3 | D206: 6 | E206: =C206*6+D206 -> 24 | G206: 8 | H206: 14 | I206: =G206*6+H206 -> 62 | K206: 9 | L206: 16 | M206: =K206*6+L206 -> 70 | O206: 12 | P206: 19 | Q206: =O206*6+P206 -> 91 | S206: BOWDEN
A207: BEST PLAYERS
A208: NORTHCOTE | C208: SEARL | E208: WHITE | H208: PAWSEY | K208: HISCOX | N208: GALLAGHER | Q208: WHITECHURCH
A209: YARRAVILLE | C209: SEITZ | E209: ROHLEDER | H209: MADDOCKS | K209: LAW | N209: WAGHORN | Q209: WEBB
A210: GOALKICKERS
A211: NORTHCOTE | C211: PAWSEY 5 | F211: WHITECHURCH 3 | J211: STAFFORD | M211: GREENWOOD | P211: E WHITE | R211: STABB | U211: McGREGOR
A212: YARRAVILLE | C212: MADDOCKS 3 | F212: PHILLIPS 3 | I212: WAGHORN 2 | L212: JARRY | N212: McASEY | P212: McBEAN
A214: SANDRINGHAM | C214: 2 | D214: 5 | E214: =C214*6+D214 -> 17 | G214: 4 | H214: 5 | I214: =G214*6+H214 -> 29 | K214: 8 | L214: 10 | M214: =K214*6+L214 -> 58 | O214: 12 | P214: 12 | Q214: =O214*6+P214 -> 84 | S214: COBURG
A215: COBURG | C215: 4 | D215: 5 | E215: =C215*6+D215 -> 29 | G215: 6 | H215: 11 | I215: =G215*6+H215 -> 47 | K215: 8 | L215: 12 | M215: =K215*6+L215 -> 60 | O215: 10 | P215: 13 | Q215: =O215*6+P215 -> 73 | S215: IRVING
A216: BEST PLAYERS
A217: SANDRINGHAM | C217: M GRAMBEAU | G217: McFEE | J217: BENCRAFT | M217: STANLEY | P217: COLLINS | R217: McLEOD
A218: COBURG | C218: McTAGGART | G218: STARBUCK | J218: EQUID | M218: WADE | P218: BROWN | R218: CAHIR
A219: GOALKICKERS
A220: SANDRINGHAM | C220: McFEE 4 | E220: COLLINS 3 | G220: B HARPER 3 | J220: BENCRAFT 2
A221: COBURG | C221: ROGAN 3 | E221: JAMES 3 | G221: JORGENSON 2 | J221: R WILKINSON | M221: VARNEY
A223: BRUNSWICK | C223: 2 | D223: 4 | E223: =C223*6+D223 -> 16 | G223: 7 | H223: 5 | I223: =G223*6+H223 -> 47 | K223: 11 | L223: 13 | M223: =K223*6+L223 -> 79 | O223: 13 | P223: 16 | Q223: =O223*6+P223 -> 94 | S223: PRESTON
A224: PRESTON | C224: 3 | D224: 1 | E224: =C224*6+D224 -> 19 | G224: 4 | H224: 4 | I224: =G224*6+H224 -> 28 | K224: 5 | L224: 6 | M224: =K224*6+L224 -> 36 | O224: 7 | P224: 8 | Q224: =O224*6+P224 -> 50 | S224: BARKER
A225: BEST PLAYERS
A226: BRUNSWICK | C226: SHAW | F226: SPENCER | I226: MAHER | L226: GEISLER | O226: McIVOR | R226: YEA
A227: PRESTON | C227: LEISHMAN | F227: NATHAN | I227: BRADFORD | L227: PRITCHARD | O227: DONALD | R227: STEWART
A228: GOALKICKERS
A229: BRUNSWICK | C229: SPENCER 3 | F229: NEILSON 3 | I229: MAHER 2 | K229: HORDER 2 | N229: JONES | P229: HOWARD | R229: POLLARD
A230: PRESTON | C230: NATHAN 3 | F230: GOLDIN 2 | I230: DONALD | K230: BRYCE
A232: ROUND 5 | D232: 20TH MAY | J232: WEATHER | M232: COLD RAIN NO WIND | S232: PLAYED AT
D233: 1ST QTR | H233: 2ND QTR | L233: 3RD QTR | P233: FINAL | S233: BRUNSWICK
A234: BRUNSWICK | C234: 4 | D234: 1 | E234: =C234*6+D234 -> 25 | G234: 6 | H234: 7 | I234: =G234*6+H234 -> 43 | K234: 7 | L234: 10 | M234: =K234*6+L234 -> 52 | O234: 10 | P234: 14 | Q234: =O234*6+P234 -> 74 | S234: UMPIRE | X234: LADDER | AB234: ROUND | AD234: 5
A235: BRIGHTON | C235: 4 | D235: 3 | E235: =C235*6+D235 -> 27 | G235: 4 | H235: 5 | I235: =G235*6+H235 -> 29 | K235: 5 | L235: 9 | M235: =K235*6+L235 -> 39 | O235: 7 | P235: 12 | Q235: =O235*6+P235 -> 54 | S235: BOWDEN
A236: BEST PLAYERS | W236: TEAM | X236: W | Y236: L | Z236: D | AA236: FOR | AB236: AGST | AC236: % | AD236: PTS
A237: BRUNSWICK | C237: SPENCER | F237: SHAW | H237: GEPHART | K237: PRIESTLEY | N237: WHELAN | Q237: TAYLOR
A238: BRIGHTON | C238: McINDOE | F238: HALL | H238: RIDDELL | K238: G TURNER | N238: BURNS | Q238: HEIMS | W238: BRUNSWICK | X238: 5 | Y238: 0 | Z238: 0 | AA238: 408 | AB238: 302 | AC238: 135.09933774834437 | AD238: 20
A239: GOALKICKERS | W239: WILLIAMSTOWN | X239: 4 | Y239: 1 | Z239: 0 | AA239: 424 | AB239: 352 | AC239: 120.45 | AD239: 16
A240: BRUNSWICK | C240: GEPHART 5 | F240: SPENCER 2 | I240: PRIESTLEY | K240: HORDER | M240: McIVOR | W240: PRAHRAN | X240: 3 | Y240: 2 | Z240: 0 | AA240: 461 | AB240: 386 | AC240: 119.43005181347151 | AD240: 12
A241: BRIGHTON | C241: BURNS 2 | F241: McINDOE | I241: WILLS | K241: WARBURTON | N241: HEIMS | P241: HOWE | W241: COBURG | X241: 3 | Y241: 2 | Z241: 0 | AA241: 496 | AB241: 418 | AC241: 118.66028708133972 | AD241: 12
A243: WILLIAMSTOWN | C243: 2 | D243: 0 | E243: =C243*6+D243 -> 12 | G243: 5 | H243: 3 | I243: =G243*6+H243 -> 33 | K243: 8 | L243: 9 | M243: =K243*6+L243 -> 57 | O243: 12 | P243: 11 | Q243: =O243*6+P243 -> 83 | S243: WILLIAMSTOWN | W243: BRIGHTON | X243: 3 | Y243: 2 | Z243: 0 | AA243: 437 | AB243: 392 | AC243: 111.4795918367347 | AD243: 12
A244: PORT MELBOURNE | C244: 4 | D244: 2 | E244: =C244*6+D244 -> 26 | G244: 7 | H244: 3 | I244: =G244*6+H244 -> 45 | K244: 9 | L244: 4 | M244: =K244*6+L244 -> 58 | O244: 11 | P244: 5 | Q244: =O244*6+P244 -> 71 | S244: BARKER | W244: OAKLEIGH | X244: 3 | Y244: 2 | Z244: 0 | AA244: 443 | AB244: 399 | AC244: 111.02756892230576 | AD244: 12
A245: BEST PLAYERS | W245: PORT MELBOURNE | X245: 3 | Y245: 2 | Z245: 0 | AA245: 436 | AB245: 397 | AC245: 109.82367758186398 | AD245: 12
A246: WILLIAMSTOWN | C246: SAMPSON | F246: DANCKERT | I246: BERNARD | K246: MOLYNEUX | N246: VERNON | Q246: DULLARD | W246: SANDRINGHAM | X246: 2 | Y246: 3 | Z246: 0 | AA246: 427 | AB246: 435 | AC246: 98.16 | AD246: 8
A247: PORT MELBOURNE | C247: TUCKER | F247: DRINAN | I247: LEWIS | K247: BLOOM | N247: ATKINSON | Q247: CULPH | W247: NORTHCOTE | X247: 2 | Y247: 3 | Z247: 0 | AA247: 383 | AB247: 471 | AC247: 81.316348195329084 | AD247: 8
A248: GOALKICKERS | W248: CAMBERWELL | X248: 1 | Y248: 4 | Z248: 0 | AA248: 370 | AB248: 399 | AC248: 92.73 | AD248: 4
A249: WILLIAMSTOWN | C249: DULLARD 4 | F249: VERNON | H249: WALKER | J249: McRAE | L249: SALVAS | N249: MOLYNEUX | Q249: ABBERTON | S249: BERNARD | W249: YARRAVILLE | X249: 1 | Y249: 4 | Z249: 0 | AA249: 374 | AB249: 553 | AC249: 67.631103074141052 | AD249: 4
A250: PORT MELBOURNE | C250: LEWIS 4 | F250: CULPH 3 | I250: BLOOM 2 | L250: RAMSAY | N250: BULPITT | W250: PRESTON | X250: 0 | Y250: 5 | Z250: 0 | AA250: 319 | AB250: 474 | AC250: 67.3 | AD250: 0
A252: COBURG | C252: 4 | D252: 1 | E252: =C252*6+D252 -> 25 | G252: 5 | H252: 6 | I252: =G252*6+H252 -> 36 | K252: 11 | L252: 7 | M252: =K252*6+L252 -> 73 | O252: 14 | P252: 7 | Q252: =O252*6+P252 -> 91 | S252: OAKLEIGH
A253: OAKLEIGH | C253: 4 | D253: 1 | E253: =C253*6+D253 -> 25 | G253: 8 | H253: 7 | I253: =G253*6+H253 -> 55 | K253: 9 | L253: 11 | M253: =K253*6+L253 -> 65 | O253: 12 | P253: 13 | Q253: =O253*6+P253 -> 85 | S253: CLEARY
A254: BEST PLAYERS
A255: COBURG | C255: WADE | F255: WALKER | I255: ROGAN | K255: JAMES | N255: STARBUCK | Q255: McTAGGART
A256: OAKLEIGH | C256: WENN | F256: WILLIAMS | I256: HILL | K256: GRAY | N256: BENSON | Q256: POWER
A257: GOALKICKERS
A258: COBURG | C258: JAMES 5 | F258: BRIAR 3 | I258: ROGAN 3 | K258: STARBUCK 2 | N258: JORGENSON
A259: OAKLEIGH | C259: NAISMITH 3 | F259: BENSON 2 | I259: WENN 2 | K259: HILL 2 | M259: GRAY | O259: SCOTT | Q259: J WATSON
A261: PRAHRAN | C261: 2 | D261: 3 | E261: =C261*6+D261 -> 15 | G261: 5 | H261: 11 | I261: =G261*6+H261 -> 41 | K261: 9 | L261: 18 | M261: =K261*6+L261 -> 72 | O261: 11 | P261: 21 | Q261: =O261*6+P261 -> 87 | S261: TOORAK PARK
A262: CAMBERWELL | C262: 5 | D262: 1 | E262: =C262*6+D262 -> 31 | G262: 6 | H262: 1 | I262: =G262*6+H262 -> 37 | K262: 9 | L262: 5 | M262: =K262*6+L262 -> 59 | O262: 11 | P262: 10 | Q262: =O262*6+P262 -> 76 | S262: IRVING
A263: BEST PLAYERS
A264: PRAHRAN | C264: OPRAY | F264: HARVEY | I264: WALSH | K264: LENZ | N264: MASTERTON | Q264: QUINN
A265: CAMBERWELL | C265: MILGATE | F265: WAKE | I265: STUBBS | K265: LUMSDEN | N265: COOK | Q265: FLETCHER
A266: GOALKICKERS
A267: PRAHRAN | C267: LENZ 3 | F267: HARVEY 2 | I267: WALSH 2 | K267: MASTERTON 2 | N267: WOOD | P267: CHARLESTON
A268: CAMBERWELL | C268: MILGATE 5 | F268: LUMSDEN 3 | I268: STUBBS | K268: ROCHFORD | N268: BOHAN
A270: SANDRINGHAM | C270: 5 | D270: 6 | E270: =C270*6+D270 -> 36 | G270: 8 | H270: 13 | I270: =G270*6+H270 -> 61 | K270: 11 | L270: 18 | M270: =K270*6+L270 -> 84 | O270: 15 | P270: 18 | Q270: =O270*6+P270 -> 108 | S270: BEACH ROAD
A271: NORTHCOTE | C271: 3 | D271: 2 | E271: =C271*6+D271 -> 20 | G271: 3 | H271: 7 | I271: =G271*6+H271 -> 25 | K271: 5 | L271: 10 | M271: =K271*6+L271 -> 40 | O271: 8 | P271: 16 | Q271: =O271*6+P271 -> 64 | S271: MILNE
A272: BEST PLAYERS
A273: SANDRINGHAM | C273: R HARPER | F273: RUSSELL | I273: ANDRESON | L273: BOURKE | O273: McLEOD | R273: CERINI
A274: NORTHCOTE | C274: BRUNNEN | F274: WILCOX | I274: WHITE | L274: MCGREGOR | O274: O'KEEFE | R274: PAWSEY
A275: GOALKICKERS
A276: SANDRINGHAM | C276: B HARPER 5 | F276: RUSSELL 3 | I276: CERINI 3 | K276: BENCRAFT 2 | N276: JONES | P276: McFEE
A277: NORTHCOTE | C277: O'KEEFE 4 | F277: BROWN 3 | I277: STABB
A279: YARRAVILLE | C279: 4 | D279: 4 | E279: =C279*6+D279 -> 28 | G279: 6 | H279: 6 | I279: =G279*6+H279 -> 42 | K279: 7 | L279: 14 | M279: =K279*6+L279 -> 56 | O279: 9 | P279: 16 | Q279: =O279*6+P279 -> 70 | S279: PRESTON
A280: PRESTON | C280: 2 | D280: 1 | E280: =C280*6+D280 -> 13 | G280: 6 | H280: 5 | I280: =G280*6+H280 -> 41 | K280: 6 | L280: 8 | M280: =K280*6+L280 -> 44 | O280: 9 | P280: 12 | Q280: =O280*6+P280 -> 66 | S280: JOHNS
A281: BEST PLAYERS
A282: YARRAVILLE | C282: TURNER | F282: ORR | I282: PHILLIPS | L282: ROHLEDER | O282: LAW | Q282: GODDARD
A283: PRESTON | C283: PRITCHARD | F283: DONALD | I283: STEWART | L283: PASCOE | O283: SWEET | Q283: GOLDIN
A284: GOALKICKERS
A285: YARRAVILLE | C285: PHILLIPS 6 | F285: TURNER | I285: WAGHORN | L285: ROHLEDER
A286: PRESTON | C286: GOLDIN 3 | F286: PASCOE | H286: SWEET | J286: WHITFIELD | M286: DUNGAN | O286: BRYCE | Q286: LALOR
A288: ROUND 6 | D288: 27TH MAY | H288: WEATHER | K288: DULL COLD NO WIND GROUNDS SLIPPERY | S288: PLAYED AT
D289: 1ST QTR | H289: 2ND QTR | L289: 3RD QTR | P289: FINAL | S289: PORT MELBOURNE
A290: PORT MELBOURNE | C290: 3 | D290: 2 | E290: =C290*6+D290 -> 20 | G290: 7 | H290: 8 | I290: =G290*6+H290 -> 50 | K290: 9 | L290: 13 | M290: =K290*6+L290 -> 67 | O290: 11 | P290: 16 | Q290: =O290*6+P290 -> 82 | S290: UMPIRE | X290: LADDER | AB290: ROUND | AD290: 6
A291: PRAHRAN | C291: 2 | D291: 4 | E291: =C291*6+D291 -> 16 | G291: 7 | H291: 6 | I291: =G291*6+H291 -> 48 | K291: 10 | L291: 10 | M291: =K291*6+L291 -> 70 | O291: 11 | P291: 11 | Q291: =O291*6+P291 -> 77 | S291: CLEARY
A292: BEST PLAYERS | W292: TEAM | X292: W | Y292: L | Z292: D | AA292: FOR | AB292: AGST | AC292: % | AD292: PTS
A293: PORT MELBOURNE | C293: CLEARY | E293: CULPH | H293: LEWIS | K293: BLOOM | N293: JOHNSON | Q293: DRINAN
A294: PRAHRAN | C294: WALSH | E294: KEEGAN | H294: HARVEY | K294: MASTERTON | N294: WOOD | Q294: OVERS | W294: BRUNSWICK | X294: 5 | Y294: 1 | Z294: 0 | AA294: 479 | AB294: 385 | AC294: 124.42 | AD294: 20
A295: GOALKICKERS | W295: COBURG | X295: 4 | Y295: 2 | Z295: 0 | AA295: 636 | AB295: 469 | AC295: 135.60767590618337 | AD295: 16
A296: PORT MELBOURNE | C296: CULPH 5 | F296: LEWIS 2 | I296: BLOOM 2 | K296: STOREY | M296: REYNOLDS | W296: BRIGHTON | X296: 4 | Y296: 2 | Z296: 0 | AA296: 595 | AB296: 441 | AC296: 134.92 | AD296: 16
A297: PRAHRAN | C297: WALSH 3 | F297: WOOD 2 | I297: HARVEY 2 | K297: MASTERTON | N297: SHILLABEER | Q297: CHARLESTON | T297: QUINN | W297: OAKLEIGH | X297: 4 | Y297: 2 | Z297: 0 | AA297: 505 | AB297: 446 | AC297: 113.22869955156951 | AD297: 16
A299: OAKLEIGH | C299: 3 | D299: 4 | E299: =C299*6+D299 -> 22 | G299: 6 | H299: 6 | I299: =G299*6+H299 -> 42 | K299: 8 | L299: 10 | M299: =K299*6+L299 -> 58 | O299: 8 | P299: 14 | Q299: =O299*6+P299 -> 62 | S299: NORTHCOTE | W299: PORT MELBOURNE | X299: 4 | Y299: 2 | Z299: 0 | AA299: 518 | AB299: 474 | AC299: 109.28270042194093 | AD299: 16
A300: NORTHCOTE | C300: 2 | D300: 2 | E300: =C300*6+D300 -> 14 | G300: 4 | H300: 5 | I300: =G300*6+H300 -> 29 | K300: 5 | L300: 9 | M300: =K300*6+L300 -> 39 | O300: 6 | P300: 11 | Q300: =O300*6+P300 -> 47 | S300: BARKER | W300: WILLIAMSTOWN | X300: 4 | Y300: 2 | Z300: 0 | AA300: 475 | AB300: 492 | AC300: 96.54 | AD300: 16
A301: BEST PLAYERS | W301: PRAHRAN | X301: 3 | Y301: 3 | Z301: 0 | AA301: 538 | AB301: 468 | AC301: 114.95726495726495 | AD301: 12
A302: OAKLEIGH | C302: SCOTT | E302: NAISMITH | H302: PERKINS | K302: CUNNINGHAM | N302: J WATSON | Q302: TINDAL | W302: SANDRINGHAM | X302: 3 | Y302: 3 | Z302: 0 | AA302: 503 | AB302: 500 | AC302: 100.6 | AD302: 12
A303: NORTHCOTE | C303: PAWSEY | E303: HINES | H303: WHITECHURCH | K303: HISCOX | N303: STABB | Q303: KINDER | W303: CAMBERWELL | X303: 2 | Y303: 4 | Z303: 0 | AA303: 453 | AB303: 470 | AC303: 96.38 | AD303: 8
A304: GOALKICKERS | W304: NORTHCOTE | X304: 2 | Y304: 4 | Z304: 0 | AA304: 430 | AB304: 533 | AC304: 80.67542213883678 | AD304: 8
A305: OAKLEIGH | C305: NAISMITH 5 | F305: EDWARDS | I305: SCOTT | K305: GRAY | W305: YARRAVILLE | X305: 1 | Y305: 5 | Z305: 0 | AA305: 439 | AB305: 629 | AC305: 69.793322734499199 | AD305: 4
A306: NORTHCOTE | C306: BROWN 2 | F306: E WHITE | I306: GALLAGHER | L306: PAWSEY | N306: HINES | W306: PRESTON | X306: 0 | Y306: 6 | Z306: 0 | AA306: 368 | AB306: 632 | AC306: 58.23 | AD306: 0
A308: SANDRINGHAM | C308: 3 | D308: 5 | E308: =C308*6+D308 -> 23 | G308: 5 | H308: 7 | I308: =G308*6+H308 -> 37 | K308: 7 | L308: 7 | M308: =K308*6+L308 -> 49 | O308: 11 | P308: 10 | Q308: =O308*6+P308 -> 76 | S308: YARRAVILLE
A309: YARRAVILLE | C309: 1 | D309: 3 | E309: =C309*6+D309 -> 9 | G309: 6 | H309: 3 | I309: =G309*6+H309 -> 39 | K309: 9 | L309: 6 | M309: =K309*6+L309 -> 60 | O309: 9 | P309: 11 | Q309: =O309*6+P309 -> 65 | S309: IRVING
A310: BEST PLAYERS
A311: SANDRINGHAM | C311: NEWTON | F311: R HARPER | I311: ANDRESON | L311: M GRAMBEAU | O311: COLLINS | Q311: McLEOD
A312: YARRAVILLE | C312: NICHOLLS | F312: JONES | I312: SEITZ | L312: GODDARD | O312: LAW | Q312: WEBB
A313: GOALKICKERS
A314: SANDRINGHAM | C314: R HARPER 2 | F314: JONES 2 | H314: BENCRAFT 2 | K314: B HARPER 2 | N314: BEARD | P314: COLLINS | R314: RUSSELL
A315: YARRAVILLE | C315: PHILLIPS 3 | F315: JARRY 2 | H315: CRANAGE | J315: WEBB | L315: MCASEY | N315: MADDOCKS
A317: COBURG | C317: 0 | D317: 5 | E317: =C317*6+D317 -> 5 | G317: 9 | H317: 13 | I317: =G317*6+H317 -> 67 | K317: 13 | L317: 16 | M317: =K317*6+L317 -> 94 | O317: 20 | P317: 20 | Q317: =O317*6+P317 -> 140 | S317: COBURG
A318: WILLIAMSTOWN | C318: 1 | D318: 2 | E318: =C318*6+D318 -> 8 | G318: 4 | H318: 2 | I318: =G318*6+H318 -> 26 | K318: 6 | L318: 8 | M318: =K318*6+L318 -> 44 | O318: 7 | P318: 9 | Q318: =O318*6+P318 -> 51 | S318: BOWDEN
A319: BEST PLAYERS
A320: COBURG | C320: EQUID | F320: JAMES | I320: WADE | L320: ROGAN | O320: HEEPS | Q320: STARBUCK
A321: WILLIAMSTOWN | C321: SALVAS | F321: DANCKERT | I321: MATTHEWS | L321: SAMPSON | O321: WALKER | Q321: DULLARD
A322: GOALKICKERS
A323: COBURG | C323: JAMES 8 | E323: JORGENSON 4 | H323: R WILKINSON 2 | K323: STARBUCK 2 | N323: McTAGGART 2 | Q323: BRIAR | R323: ROGAN
A324: WILLIAMSTOWN | C324: DULLARD 3 | F324: SALVAS 2 | I324: MATTHEWS | L324: BERNARD
A326: BRIGHTON | C326: 5 | D326: 5 | E326: =C326*6+D326 -> 35 | G326: 12 | H326: 11 | I326: =G326*6+H326 -> 83 | K326: 16 | L326: 18 | M326: =K326*6+L326 -> 114 | O326: 22 | P326: 26 | Q326: =O326*6+P326 -> 158 | S326: ELSTERNWICK PARK
A327: PRESTON | C327: 1 | D327: 2 | E327: =C327*6+D327 -> 8 | G327: 3 | H327: 4 | I327: =G327*6+H327 -> 22 | K327: 7 | L327: 7 | M327: =K327*6+L327 -> 49 | O327: 7 | P327: 7 | Q327: =O327*6+P327 -> 49 | S327: MILNE
A328: BEST PLAYERS
A329: BRIGHTON | C329: WARBURTON | F329: E TURNER | I329: ADAMSON | L329: NEW | N329: HEIMS | Q329: McINDOE
A330: PRESTON | C330: PRITCHARD | F330: WALKER | I330: SWEET | L330: DONALD | N330: BRYCE | Q330: GOLDIN
A331: GOALKICKERS
A332: BRIGHTON | C332: WARBURTON 13 | F332: ADAMSON 4 | I332: J BURNS 2 | K332: PICKERING | M332: HEIMS | O332: L BURNS
A333: PRESTON | C333: GOLDIN 3 | F333: BRYCE 2 | I333: L SWEET | K333: PASCOE
A335: CAMBERWELL | C335: 1 | D335: 5 | E335: =C335*6+D335 -> 11 | G335: 5 | H335: 6 | I335: =G335*6+H335 -> 36 | K335: 9 | L335: 15 | M335: =K335*6+L335 -> 69 | O335: 11 | P335: 17 | Q335: =O335*6+P335 -> 83 | S335: CAMBERWELL
A336: BRUNSWICK | C336: 2 | D336: 5 | E336: =C336*6+D336 -> 17 | G336: 7 | H336: 9 | I336: =G336*6+H336 -> 51 | K336: 7 | L336: 11 | M336: =K336*6+L336 -> 53 | O336: 10 | P336: 11 | Q336: =O336*6+P336 -> 71 | S336: JOHNS
A337: BEST PLAYERS
A338: CAMBERWELL | C338: HERBERT | F338: STUBBS | I338: BOHAN | L338: DONALD | O338: ROCHFORD | R338: LUMSDEN
A339: BRUNSWICK | C339: SPENCER | F339: NEILSON | I339: McIVOR | L339: GEISLER | O339: PRIESTLEY | R339: HORDER
A340: GOALKICKERS
A341: CAMBERWELL | C341: MILGATE 2 | F341: ROCHFORD 2 | I341: DONALD 2 | L341: BOHAN 2 | N341: STUBBS 2 | Q341: LUMSDEN
A342: BRUNSWICK | C342: SPENCER 4 | F342: HORDER 3 | I342: GEPHART | L342: PRIESTLEY | N342: MAHER
A344: ROUND 7 | D344: 3RD JUNE | J344: WEATHER | M344: COLD DULL NO WIND | S344: PLAYED AT
D345: 1ST QTR | H345: 2ND QTR | L345: 3RD QTR | P345: FINAL | S345: BRUNSWICK
A346: PORT MELBOURNE | C346: 3 | D346: 0 | E346: =C346*6+D346 -> 18 | G346: 6 | H346: 2 | I346: =G346*6+H346 -> 38 | K346: 8 | L346: 5 | M346: =K346*6+L346 -> 53 | O346: 8 | P346: 8 | Q346: =O346*6+P346 -> 56 | S346: UMPIRE | X346: LADDER | AB346: ROUND | AD346: 7
A347: BRUNSWICK | C347: 1 | D347: 4 | E347: =C347*6+D347 -> 10 | G347: 3 | H347: 7 | I347: =G347*6+H347 -> 25 | K347: 5 | L347: 9 | M347: =K347*6+L347 -> 39 | O347: 7 | P347: 12 | Q347: =O347*6+P347 -> 54 | S347: MILNE
A348: BEST PLAYERS | W348: TEAM | X348: W | Y348: L | Z348: D | AA348: FOR | AB348: AGST | AC348: % | AD348: PTS
A349: PORT MELBOURNE | C349: CLEARY | F349: BLOOM | I349: LEWIS | K349: STOREY | N349: JOHNSON | Q349: CULPH
A350: BRUNSWICK | C350: PRIESTLEY | F350: CHAPMAN | I350: YEA | K350: McCORKELL | N350: WHELAN | Q350: McIVOR | W350: BRIGHTON | X350: 5 | Y350: 2 | Z350: 0 | AA350: 739 | AB350: 518 | AC350: 142.66 | AD350: 20
A351: GOALKICKERS | W351: COBURG | X351: 5 | Y351: 2 | Z351: 0 | AA351: 748 | AB351: 551 | AC351: 135.75317604355718 | AD351: 20
A352: PORT MELBOURNE | C352: LEWIS 3 | F352: CULPH 2 | I352: BLOOM 2 | L352: WOODBRIDGE | W352: BRUNSWICK | X352: 5 | Y352: 2 | Z352: 0 | AA352: 533 | AB352: 441 | AC352: 120.86 | AD352: 20
A353: BRUNSWICK | C353: PRIESTLEY 3 | F353: McIVOR | I353: CHAPMAN | L353: MAHER | N353: McCORKELL | W353: OAKLEIGH | X353: 5 | Y353: 2 | Z353: 0 | AA353: 609 | AB353: 525 | AC353: 116 | AD353: 20
A355: COBURG | C355: 3 | D355: 1 | E355: =C355*6+D355 -> 19 | G355: 6 | H355: 6 | I355: =G355*6+H355 -> 42 | K355: 13 | L355: 9 | M355: =K355*6+L355 -> 87 | O355: 17 | P355: 10 | Q355: =O355*6+P355 -> 112 | S355: TOORAK PARK | W355: WILLIAMSTOWN | X355: 5 | Y355: 2 | Z355: 0 | AA355: 608 | AB355: 556 | AC355: 109.35 | AD355: 20
A356: PRAHRAN | C356: 5 | D356: 2 | E356: =C356*6+D356 -> 32 | G356: 9 | H356: 7 | I356: =G356*6+H356 -> 61 | K356: 10 | L356: 8 | M356: =K356*6+L356 -> 68 | O356: 11 | P356: 16 | Q356: =O356*6+P356 -> 82 | S356: JOHNS | W356: PORT MELBOURNE | X356: 5 | Y356: 2 | Z356: 0 | AA356: 574 | AB356: 528 | AC356: 108.71212121212122 | AD356: 20
A357: BEST PLAYERS | W357: PRAHRAN | X357: 3 | Y357: 4 | Z357: 0 | AA357: 620 | AB357: 580 | AC357: 106.89655172413794 | AD357: 12
A358: COBURG | C358: JAMES | F358: FEWKES | I358: STARBUCK | L358: HOLBROOK | O358: EQUID | Q358: WALKER | W358: CAMBERWELL | X358: 3 | Y358: 4 | Z358: 0 | AA358: 523 | AB358: 536 | AC358: 97.54 | AD358: 12
A359: PRAHRAN | C359: CAMPBELL | F359: HARVEY | I359: COLLS | L359: OPRAY | O359: WALSH | Q359: JONES | W359: SANDRINGHAM | X359: 3 | Y359: 4 | Z359: 0 | AA359: 582 | AB359: 604 | AC359: 96.36 | AD359: 12
A360: GOALKICKERS | W360: NORTHCOTE | X360: 2 | Y360: 5 | Z360: 0 | AA360: 494 | AB360: 666 | AC360: 74.174174174174169 | AD360: 8
A361: COBURG | C361: JAMES 9 | F361: JORGENSON 4 | I361: BRIAR 2 | K361: ROGAN | M361: HOLBROOK | W361: YARRAVILLE | X361: 1 | Y361: 6 | Z361: 0 | AA361: 516 | AB361: 773 | AC361: 66.75 | AD361: 4
A362: PRAHRAN | C362: HARVEY 3 | F362: LAMB 2 | I362: BURGESS 2 | L362: MASTERTON 2 | O362: WOOD | Q362: TREGONNING | W362: PRESTON | X362: 0 | Y362: 7 | Z362: 0 | AA362: 434 | AB362: 702 | AC362: 61.82 | AD362: 0
A364: OAKLEIGH | C364: 4 | D364: 3 | E364: =C364*6+D364 -> 27 | G364: 11 | H364: 6 | I364: =G364*6+H364 -> 72 | K364: 13 | L364: 7 | M364: =K364*6+L364 -> 85 | O364: 16 | P364: 8 | Q364: =O364*6+P364 -> 104 | S364: OAKLEIGH
A365: SANDRINGHAM | C365: 4 | D365: 5 | E365: =C365*6+D365 -> 29 | G365: 5 | H365: 7 | I365: =G365*6+H365 -> 37 | K365: 10 | L365: 11 | M365: =K365*6+L365 -> 71 | O365: 11 | P365: 13 | Q365: =O365*6+P365 -> 79 | S365: BOWDEN
A366: BEST PLAYERS
A367: OAKLEIGH | C367: BAXTER | F367: C WATSON | I367: NAISMITH | L367: PERKINS | O367: J WATSON | R367: SCOTT
A368: SANDRINGHAM | C368: B HARPER | F368: JONES | I368: CERINI | L368: BENCRAFT | O368: SHEARS | R368: M GRAMBEAU
A369: GOALKICKERS
A370: OAKLEIGH | C370: RYAN 3 | E370: NAISMITH 3 | H370: J WATSON 2 | K370: C WATSON 2 | N370: DEAYTON | P370: PERKINS | R370: EDWARDS | U370: HALE | W370: BAXTER | X370: BRUCE
A371: SANDRINGHAM | C371: B HARPER 7 | F371: RUSSELL 2 | I371: BENCRAFT | K371: CERINI
A373: WILLIAMSTOWN | C373: 2 | D373: 9 | E373: =C373*6+D373 -> 21 | G373: 7 | H373: 12 | I373: =G373*6+H373 -> 54 | K373: 16 | L373: 15 | M373: =K373*6+L373 -> 111 | O373: 19 | P373: 19 | Q373: =O373*6+P373 -> 133 | S373: WILLIAMSTOWN
A374: NORTHCOTE | C374: 1 | D374: 1 | E374: =C374*6+D374 -> 7 | G374: 5 | H374: 7 | I374: =G374*6+H374 -> 37 | K374: 6 | L374: 10 | M374: =K374*6+L374 -> 46 | O374: 8 | P374: 16 | Q374: =O374*6+P374 -> 64 | S374: CLEARY
A375: BEST PLAYERS
A376: WILLIAMSTOWN | C376: ABBERTON | F376: WALKER | I376: BERNARD | L376: MOLYNEUX | O376: TWIST | Q376: DANCKERT
A377: NORTHCOTE | C377: WHITECHURCH | F377: PAWSEY | I377: POWELL | L377: HISCOX | O377: SEARL | Q377: STABB
A378: GOALKICKERS
A379: WILLIAMSTOWN | C379: WALKER 8 | F379: TWIST 3 | H379: MOLYNEUX 2 | K379: MATTHEWS 2 | N379: WILLIAMS | Q379: ROGERS | S379: DULLARD | W379: BERNARD
A380: NORTHCOTE | C380: MURPHY 2 | F380: POWELL 2 | I380: PAWSEY | K380: BRUNNEN | M380: WHITECHURCH | P380: KINDER
A382: CAMBERWELL | C382: 3 | D382: 1 | E382: =C382*6+D382 -> 19 | G382: 6 | H382: 6 | I382: =G382*6+H382 -> 42 | K382: 7 | L382: 8 | M382: =K382*6+L382 -> 50 | O382: 10 | P382: 10 | Q382: =O382*6+P382 -> 70 | S382: PRESTON
A383: PRESTON | C383: 4 | D383: 5 | E383: =C383*6+D383 -> 29 | G383: 6 | H383: 6 | I383: =G383*6+H383 -> 42 | K383: 9 | L383: 10 | M383: =K383*6+L383 -> 64 | O383: 9 | P383: 12 | Q383: =O383*6+P383 -> 66 | S383: IRVING
A384: BEST PLAYERS
A385: CAMBERWELL | C385: STUBBS | G385: LOVETT | J385: KENNEDY | M385: HERBERT | P385: UNSTEAD | R385: BOHAN
A386: PRESTON | C386: JACK THOMPSON | G386: PRITCHARD | J386: K SWEET | M386: LEHMANN | P386: BRADFORD | R386: DUNGAN
A387: GOALKICKERS
A388: CAMBERWELL | C388: STUBBS 4 | F388: BENBOW 2 | I388: MILGATE 2 | L388: BOHAN | N388: FINNEGAN
A389: PRESTON | C389: BRADFORD 3 | F389: LEHMANN 2 | I389: DUNGAN 2 | L389: GOLDIN | N389: JIM THOMPSON
A391: BRIGHTON | C391: 3 | D391: 2 | E391: =C391*6+D391 -> 20 | G391: 9 | H391: 9 | I391: =G391*6+H391 -> 63 | K391: 14 | L391: 13 | M391: =K391*6+L391 -> 97 | O391: 21 | P391: 18 | Q391: =O391*6+P391 -> 144 | S391: ELSTERNWICK PARK
A392: YARRAVILLE | C392: 3 | D392: 3 | E392: =C392*6+D392 -> 21 | G392: 4 | H392: 4 | I392: =G392*6+H392 -> 28 | K392: 9 | L392: 11 | M392: =K392*6+L392 -> 65 | O392: 11 | P392: 11 | Q392: =O392*6+P392 -> 77 | S392: BARKER
A393: BEST PLAYERS
A394: BRIGHTON | C394: PERKINS | F394: McINDOE | I394: J BURNS | L394: HALL | N394: ADAMSON | Q394: BURKE
A395: YARRAVILLE | C395: GODDARD | F395: SEITZ | I395: MADDOCKS | L395: JONES | N395: McASEY | Q395: LAW
A396: GOALKICKERS
A397: BRIGHTON | C397: ADAMSON 6 | F397: McINDOE 5 | I397: J BURNS 5 | L397: WARBURTON 4 | O397: L BURNS
A398: YARRAVILLE | C398: PHILLIPS 3 | F398: MADDOCKS 3 | I398: McASEY 2 | L398: IRWIN | N398: JARRY | P398: WAGHORN
A400: ROUND 8 | D400: 10TH JUNE | H400: WEATHER | K400: SOUTH EAST BREEZE RAIN IN 3RD QUARTER | S400: PLAYED AT
D401: 1ST QTR | H401: 2ND QTR | L401: 3RD QTR | P401: FINAL | S401: BEACH ROAD
A402: SANDRINGHAM | C402: 1 | D402: 5 | E402: =C402*6+D402 -> 11 | G402: 8 | H402: 8 | I402: =G402*6+H402 -> 56 | K402: 12 | L402: 14 | M402: =K402*6+L402 -> 86 | O402: 17 | P402: 16 | Q402: =O402*6+P402 -> 118 | S402: UMPIRE | X402: LADDER | AB402: ROUND | AD402: 8
A403: WILLIAMSTOWN | C403: 2 | D403: 2 | E403: =C403*6+D403 -> 14 | G403: 6 | H403: 7 | I403: =G403*6+H403 -> 43 | K403: 9 | L403: 8 | M403: =K403*6+L403 -> 62 | O403: 13 | P403: 12 | Q403: =O403*6+P403 -> 90 | S403: JOHNS
A404: BEST PLAYERS | W404: TEAM | X404: W | Y404: L | Z404: D | AA404: FOR | AB404: AGST | AC404: % | AD404: PTS
A405: SANDRINGHAM | C405: COLLINS | F405: R HARPER | I405: STANLEY | L405: BURKE | O405: M GRAMBEAU | R405: BROWN
A406: WILLIAMSTOWN | C406: DANCKERT | F406: MOLYNEUX | I406: TAYLOR | L406: McLAREN | O406: DORGAN | R406: WALKER | W406: BRIGHTON | X406: 6 | Y406: 2 | Z406: 0 | AA406: 847 | AB406: 561 | AC406: 150.98 | AD406: 24
A407: GOALKICKERS | W407: BRUNSWICK | X407: 6 | Y407: 2 | Z407: 0 | AA407: 605 | AB407: 507 | AC407: 119.33 | AD407: 24
A408: SANDRINGHAM | C408: COLLINS 5 | F408: McFEE 4 | I408: CERINI 3 | K408: B HARPER 2 | N408: BENCRAFT 2 | Q408: R HARPER | W408: OAKLEIGH | X408: 6 | Y408: 2 | Z408: 0 | AA408: 717 | AB408: 611 | AC408: 117.34860883797054 | AD408: 24
A409: WILLIAMSTOWN | C409: WALKER 6 | F409: ABBERTON 2 | I409: TAYLOR 2 | L409: MAY | M409: WILLIAMS | P409: BARKER | W409: PORT MELBOURNE | X409: 6 | Y409: 2 | Z409: 0 | AA409: 663 | AB409: 577 | AC409: 114.90467937608319 | AD409: 24
A411: PRAHRAN | C411: 3 | D411: 7 | E411: =C411*6+D411 -> 25 | G411: 7 | H411: 12 | I411: =G411*6+H411 -> 54 | K411: 10 | L411: 12 | M411: =K411*6+L411 -> 72 | O411: 10 | P411: 18 | Q411: =O411*6+P411 -> 78 | S411: NORTHCOTE | W411: COBURG | X411: 5 | Y411: 3 | Z411: 0 | AA411: 814 | AB411: 623 | AC411: 130.65810593900483 | AD411: 20
A412: NORTHCOTE | C412: 1 | D412: 1 | E412: =C412*6+D412 -> 7 | G412: 3 | H412: 2 | I412: =G412*6+H412 -> 20 | K412: 7 | L412: 9 | M412: =K412*6+L412 -> 51 | O412: 9 | P412: 12 | Q412: =O412*6+P412 -> 66 | S412: BOWDEN | W412: WILLIAMSTOWN | X412: 5 | Y412: 3 | Z412: 0 | AA412: 698 | AB412: 674 | AC412: 103.56 | AD412: 20
A413: BEST PLAYERS | W413: PRAHRAN | X413: 4 | Y413: 4 | Z413: 0 | AA413: 698 | AB413: 646 | AC413: 108.04953560371517 | AD413: 16
A414: PRAHRAN | C414: OPRAY | F414: HARVEY | I414: MATSON | L414: McCULLOCH | O414: JONES | Q414: MASTERTON | W414: SANDRINGHAM | X414: 4 | Y414: 4 | Z414: 0 | AA414: 700 | AB414: 694 | AC414: 100.86 | AD414: 16
A415: NORTHCOTE | C415: WHITECHURCH | F415: WHITE | I415: POWELL | L415: BRUNNEN | O415: KINDER | Q415: WOOLNOUGH | W415: CAMBERWELL | X415: 3 | Y415: 5 | Z415: 0 | AA415: 566 | AB415: 644 | AC415: 87.89 | AD415: 12
A416: GOALKICKERS | W416: NORTHCOTE | X416: 2 | Y416: 6 | Z416: 0 | AA416: 560 | AB416: 744 | AC416: 75.268817204301072 | AD416: 8
A417: PRAHRAN | C417: McCULLOCH 3 | F417: WOOD 2 | I417: MORROW 2 | L417: LAMB | N417: CHIPP | P417: BURGESS | W417: YARRAVILLE | X417: 1 | Y417: 7 | Z417: 0 | AA417: 602 | AB417: 881 | AC417: 68.33 | AD417: 4
A418: NORTHCOTE | C418: BRUNNEN 2 | F418: BROWN 2 | I418: O'KEEFE | K418: STABB | M418: CRANE | O418: WHITE | Q418: PHILLPIS | W418: PRESTON | X418: 0 | Y418: 8 | Z418: 0 | AA418: 483 | AB418: 791 | AC418: 61.06 | AD418: 0
A420: PORT MELBOURNE | C420: 5 | D420: 4 | E420: =C420*6+D420 -> 34 | G420: 10 | H420: 10 | I420: =G420*6+H420 -> 70 | K420: 11 | L420: 13 | M420: =K420*6+L420 -> 79 | O420: 12 | P420: 17 | Q420: =O420*6+P420 -> 89 | S420: PORT MELBOURNE
A421: PRESTON | C421: 4 | D421: 1 | E421: =C421*6+D421 -> 25 | G421: 4 | H421: 4 | I421: =G421*6+H421 -> 28 | K421: 5 | L421: 5 | M421: =K421*6+L421 -> 35 | O421: 7 | P421: 7 | Q421: =O421*6+P421 -> 49 | S421: ROBINSON
A422: BEST PLAYERS
A423: PORT MELBOURNE | C423: AUSTIN | F423: BLOOM | I423: DRINAN | L423: S TUCKER | O423: STOREY | Q423: WALSH
A424: PRESTON | C424: BRADFORD | F424: LAWTON | I424: GOLDIN | L424: JEFFREY | O424: HINES | Q424: FERGEUS
A425: GOALKICKERS
A426: PORT MELBOURNE | C426: AUSTIN 7 | F426: WALSH 2 | I426: WOODBRIDGE | L426: McDONALD | O426: BLOOM
A427: PRESTON | C427: DUNGAN 2 | F427: NATHAN 2 | I427: J BRADFORD 2 | L427: GOLDIN
D428: 12TH JUNE | H428: KINGS BIRTHDAY | M428: WEATHER | Q428: FOGGY NO WIND
A429: BRUNSWICK | C429: 3 | D429: 3 | E429: =C429*6+D429 -> 21 | G429: 6 | H429: 5 | I429: =G429*6+H429 -> 41 | K429: 7 | L429: 9 | M429: =K429*6+L429 -> 51 | O429: 10 | P429: 12 | Q429: =O429*6+P429 -> 72 | S429: COBURG
A430: COBURG | C430: 5 | D430: 0 | E430: =C430*6+D430 -> 30 | G430: 9 | H430: 6 | I430: =G430*6+H430 -> 60 | K430: 9 | L430: 10 | M430: =K430*6+L430 -> 64 | O430: 9 | P430: 12 | Q430: =O430*6+P430 -> 66 | S430: CLEARY
A431: BEST PLAYERS
A432: BRUNSWICK | C432: PRIESTLEY | F432: STANLEY | I432: McIVOR | L432: SHAW | N432: HENRYS | Q432: TAYLOR
A433: COBURG | C433: FEWKES | F433: ROGAN | I433: SMITH | L433: JAMES | N433: WADE | Q433: BRIAR
A434: GOALKICKERS
A435: BRUNSWICK | C435: STANLEY 5 | F435: CHAPMAN 3 | I435: MAHER | K435: HOWARD
A436: COBURG | C436: JAMES 4 | F436: JORGENSON 2 | I436: ROGAN 2 | K436: R WILKINSON
A438: BRIGHTON | C438: 4 | D438: 3 | E438: =C438*6+D438 -> 27 | G438: 10 | H438: 8 | I438: =G438*6+H438 -> 68 | K438: 11 | L438: 18 | M438: =K438*6+L438 -> 84 | O438: 14 | P438: 24 | Q438: =O438*6+P438 -> 108 | S438: CAMBERWELL
A439: CAMBERWELL | C439: 2 | D439: 3 | E439: =C439*6+D439 -> 15 | G439: 4 | H439: 5 | I439: =G439*6+H439 -> 29 | K439: 5 | L439: 9 | M439: =K439*6+L439 -> 39 | O439: 5 | P439: 13 | Q439: =O439*6+P439 -> 43 | S439: MILNE
A440: BEST PLAYERS
A441: BRIGHTON | C441: ADAMSON | F441: E TURNER | I441: PERKINS | L441: NEW | N441: McASEY | Q441: J BURNS
A442: CAMBERWELL | C442: FLETCHER | F442: UNSTEAD | I442: WAKE | L442: KENNEDY | N442: STUBBS | Q442: DUFF
A443: GOALKICKERS
A444: BRIGHTON | C444: ADAMSON 3 | F444: J BURNS 3 | I444: L BURNS 2 | L444: HOWE 2 | N444: WILLS 2 | P444: PICKERING | R444: PLUNKETT
A445: CAMBERWELL | C445: DUFF 3 | F445: DONALD 2
A447: OAKLEIGH | C447: 2 | D447: 4 | E447: =C447*6+D447 -> 16 | G447: 7 | H447: 11 | I447: =G447*6+H447 -> 53 | K447: 12 | L447: 16 | M447: =K447*6+L447 -> 88 | O447: 14 | P447: 24 | Q447: =O447*6+P447 -> 108 | S447: YARRAVILLE
A448: YARRAVILLE | C448: 3 | D448: 7 | E448: =C448*6+D448 -> 25 | G448: 3 | H448: 12 | I448: =G448*6+H448 -> 30 | K448: 7 | L448: 14 | M448: =K448*6+L448 -> 56 | O448: 12 | P448: 14 | Q448: =O448*6+P448 -> 86 | S448: HUGHES
A449: BEST PLAYERS
A450: OAKLEIGH | C450: TINDAL | F450: NAISMITH | I450: A SCOTT | L450: BRUCE | N450: WATSON | Q450: WENN
A451: YARRAVILLE | C451: MALBON | F451: CRANAGE | I451: BROWN | L451: McBEAN | N451: MADDOCKS | Q451: ORR
A452: GOALKICKERS
A453: OAKLEIGH | C453: NAISMITH 7 | F453: WENN 2 | I453: SCOTT | K453: DEAYTON | M453: J WATSON | O453: PERKINS | Q453: EDWARDS
A454: YARRAVILLE | C454: WAGHORN 4 | F454: CRANAGE 3 | I454: MADDOCKS 2 | L454: IRWIN 2 | N454: McASEY
A456: ROUND 9 | D456: 17TH JUNE | J456: WEATHER | M456: SOUTH BREEZE COLD DULL | S456: PLAYED AT
D457: 1ST QTR | H457: 2ND QTR | L457: 3RD QTR | P457: FINAL | S457: ELSTERNWICK PARK
A458: PORT MELBOURNE | C458: 7 | D458: 2 | E458: =C458*6+D458 -> 44 | G458: 10 | H458: 4 | I458: =G458*6+H458 -> 64 | K458: 14 | L458: 5 | M458: =K458*6+L458 -> 89 | O458: 17 | P458: 5 | Q458: =O458*6+P458 -> 107 | S458: UMPIRE | X458: LADDER | AB458: ROUND | AD458: 9
A459: BRIGHTON | C459: 1 | D459: 3 | E459: =C459*6+D459 -> 9 | G459: 5 | H459: 10 | I459: =G459*6+H459 -> 40 | K459: 9 | L459: 14 | M459: =K459*6+L459 -> 68 | O459: 15 | P459: 15 | Q459: =O459*6+P459 -> 105 | S459: JOHNS
A460: BEST PLAYERS | W460: TEAM | X460: W | Y460: L | Z460: D | AA460: FOR | AB460: AGST | AC460: % | AD460: PTS
A461: PORT MELBOURNE | C461: LEWIS | F461: BLOOM | I461: WILSON | L461: HOULIHAN | O461: McNAUGHTON | R461: DRINAN
A462: BRIGHTON | C462: McINDOE | F462: MORRIS | I462: ADAMSON | L462: PERKINS | O462: NEW | R462: CONROY | W462: BRUNSWICK | X462: 7 | Y462: 2 | Z462: 0 | AA462: 686 | AB462: 564 | AC462: 121.63 | AD462: 28
A463: GOALKICKERS | W463: PORT MELBOURNE | X463: 7 | Y463: 2 | Z463: 0 | AA463: 770 | AB463: 682 | AC463: 112.90322580645162 | AD463: 28
A464: PORT MELBOURNE | C464: LEWIS 6 | E464: CULPH 3 | G464: HOULIHAN 2 | J464: BLOOM 2 | M464: BATTY | O464: REYNOLDS | Q464: AUSTIN | S464: S TUCKER | W464: BRIGHTON | X464: 6 | Y464: 3 | Z464: 0 | AA464: 952 | AB464: 668 | AC464: 142.51 | AD464: 24
A465: BRIGHTON | C465: ADAMSON 6 | F465: WARBURTON 5 | J465: McINDOE 2 | M465: LUMMIS | O465: J BURNS | W465: COBURG | X465: 6 | Y465: 3 | Z465: 0 | AA465: 892 | AB465: 692 | AC465: 128.90173410404626 | AD465: 24
A467: WILLIAMSTOWN | C467: 3 | D467: 5 | E467: =C467*6+D467 -> 23 | G467: 9 | H467: 5 | I467: =G467*6+H467 -> 59 | K467: 10 | L467: 6 | M467: =K467*6+L467 -> 66 | O467: 12 | P467: 9 | Q467: =O467*6+P467 -> 81 | S467: WILLIAMSTOWN | W467: WILLIAMSTOWN | X467: 6 | Y467: 3 | Z467: 0 | AA467: 779 | AB467: 700 | AC467: 111.29 | AD467: 24
A468: OAKLEIGH | C468: 0 | D468: 2 | E468: =C468*6+D468 -> 2 | G468: 1 | H468: 4 | I468: =G468*6+H468 -> 10 | K468: 2 | L468: 7 | M468: =K468*6+L468 -> 19 | O468: 3 | P468: 8 | Q468: =O468*6+P468 -> 26 | S468: MILNE | W468: OAKLEIGH | X468: 6 | Y468: 3 | Z468: 0 | AA468: 743 | AB468: 692 | AC468: 107.3699421965318 | AD468: 24
A469: BEST PLAYERS | W469: SANDRINGHAM | X469: 5 | Y469: 4 | Z469: 0 | AA469: 793 | AB469: 774 | AC469: 102.45 | AD469: 20
A470: WILLIAMSTOWN | C470: MOLYNEUX | F470: DANCKERT | I470: WALKER | L470: ABBERTON | O470: SALVAS | Q470: FEATHERBY | W470: PRAHRAN | X470: 4 | Y470: 5 | Z470: 0 | AA470: 778 | AB470: 739 | AC470: 105.27740189445196 | AD470: 16
A471: OAKLEIGH | C471: TEMME | F471: SCOTT | I471: C WATSON | L471: CUNNINGHAM | O471: DEAYTON | Q471: WILLIAMS | W471: CAMBERWELL | X471: 4 | Y471: 5 | Z471: 0 | AA471: 671 | AB471: 714 | AC471: 93.98 | AD471: 16
A472: GOALKICKERS | W472: NORTHCOTE | X472: 2 | Y472: 7 | Z472: 0 | AA472: 617 | AB472: 825 | AC472: 74.79 | AD472: 8
A473: WILLIAMSTOWN | C473: WALKER 7 | F473: ABBERTON 2 | I473: MOLYNEUX | L473: BARKER | N473: TAYLOR | W473: YARRAVILLE | X473: 1 | Y473: 8 | Z473: 0 | AA473: 672 | AB473: 986 | AC473: 68.15 | AD473: 4
A474: OAKLEIGH | C474: WILLIAMS 2 | F474: J WATSON | W474: PRESTON | X474: 0 | Y474: 9 | Z474: 0 | AA474: 552 | AB474: 869 | AC474: 63.52 | AD474: 0
A476: SANDRINGHAM | C476: 5 | D476: 5 | E476: =C476*6+D476 -> 35 | G476: 7 | H476: 7 | I476: =G476*6+H476 -> 49 | K476: 10 | L476: 10 | M476: =K476*6+L476 -> 70 | O476: 13 | P476: 15 | Q476: =O476*6+P476 -> 93 | S476: TOORAK PARK
A477: PRAHRAN | C477: 1 | D477: 3 | E477: =C477*6+D477 -> 9 | G477: 6 | H477: 4 | I477: =G477*6+H477 -> 40 | K477: 8 | L477: 6 | M477: =K477*6+L477 -> 54 | O477: 12 | P477: 8 | Q477: =O477*6+P477 -> 80 | S477: HUGHES
A478: BEST PLAYERS
A479: SANDRINGHAM | C479: BENCRAFT | F479: B HARPER | I479: M GRAMBEAU | L479: R HARPER | O479: STANLEY | Q479: McFEE
A480: PRAHRAN | C480: WALSH | F480: BURGESS | I480: OPRAY | L480: MASTERTON | O480: HARVEY | Q480: ARMSTRONG
A481: GOALKICKERS
A482: SANDRINGHAM | C482: B HARPER 5 | F482: McFEE 4 | I482: BENCRAFT 2 | L482: R HARPER | N482: COLLINS
A483: PRAHRAN | C483: BURGESS 5 | F483: WALSH 3 | I483: McCULLOCH 3 | L483: WOOD
A485: CAMBERWELL | C485: 5 | D485: 4 | E485: =C485*6+D485 -> 34 | G485: 8 | H485: 9 | I485: =G485*6+H485 -> 57 | K485: 13 | L485: 14 | M485: =K485*6+L485 -> 92 | O485: 15 | P485: 15 | Q485: =O485*6+P485 -> 105 | S485: CAMBERWELL
A486: YARRAVILLE | C486: 0 | D486: 2 | E486: =C486*6+D486 -> 2 | G486: 3 | H486: 4 | I486: =G486*6+H486 -> 22 | K486: 4 | L486: 6 | M486: =K486*6+L486 -> 30 | O486: 10 | P486: 10 | Q486: =O486*6+P486 -> 70 | S486: CLEARY
A487: BEST PLAYERS
A488: CAMBERWELL | C488: STUBBS | F488: DUFF | I488: SCHNEIDER | L488: KENNEDY | O488: HEATLEY | R488: WAKE
A489: YARRAVILLE | C489: NICHOLLS | F489: LAW | I489: MCASEY | L489: SEITZ | O489: ROHLEDER | R489: ORR
A490: GOALKICKERS
A491: CAMBERWELL | C491: SCHNEIDER 3 | F491: MILGATE 3 | I491: STUBBS 3 | K491: MILNE 3 | M491: HERBERT | O491: DONALD | Q491: DUFF
A492: YARRAVILLE | C492: PHILLIPS 4 | F492: McASEY 2 | I492: MADDOCKS | L492: BROWN | N492: CRANAGE | Q492: SEITZ
A494: COBURG | C494: 5 | D494: 1 | E494: =C494*6+D494 -> 31 | G494: 8 | H494: 5 | I494: =G494*6+H494 -> 53 | K494: 9 | L494: 5 | M494: =K494*6+L494 -> 59 | O494: 12 | P494: 6 | Q494: =O494*6+P494 -> 78 | S494: PRESTON
A495: PRESTON | C495: 2 | D495: 7 | E495: =C495*6+D495 -> 19 | G495: 3 | H495: 10 | I495: =G495*6+H495 -> 28 | K495: 6 | L495: 14 | M495: =K495*6+L495 -> 50 | O495: 9 | P495: 15 | Q495: =O495*6+P495 -> 69 | S495: BOWDEN
A496: BEST PLAYERS
A497: COBURG | C497: JORGENSON | F497: FEWKES | I497: STARBUCK | L497: WADE | O497: SMITH | Q497: HEEPS
A498: PRESTON | C498: LEISHMAN | F498: NATHAN | I498: GOLDIN | L498: PASCOE | O498: FERGEUS | Q498: PRITCHARD
A499: GOALKICKERS
A500: COBURG | C500: JORGENSON 8 | F500: JAMES | I500: H WILKINSON | L500: McTAGGART | O500: MANGELS
A501: PRESTON | C501: BRADFORD 3 | F501: DONALD 2 | I501: HINES | K501: NATHAN | M501: PASCOE | O501: K SWEET
A503: BRUNSWICK | C503: 4 | D503: 2 | E503: =C503*6+D503 -> 26 | G503: 7 | H503: 5 | I503: =G503*6+H503 -> 47 | K503: 10 | L503: 7 | M503: =K503*6+L503 -> 67 | O503: 12 | P503: 9 | Q503: =O503*6+P503 -> 81 | S503: NORTHCOTE
A504: NORTHCOTE | C504: 1 | D504: 3 | E504: =C504*6+D504 -> 9 | G504: 2 | H504: 9 | I504: =G504*6+H504 -> 21 | K504: 4 | L504: 13 | M504: =K504*6+L504 -> 37 | O504: 7 | P504: 15 | Q504: =O504*6+P504 -> 57 | S504: IRVING
A505: BEST PLAYERS
A506: BRUNSWICK | C506: McIVOR | F506: MAHER | I506: TAYLOR | L506: CHAPMAN | N506: McCALLUM | Q506: STANLEY
A507: NORTHCOTE | C507: HISCOX | F507: WHITECHURCH | I507: WOOLNOUGH | L507: KNIGHT | N507: BRUNNEN | Q507: POWELL
A508: GOALKICKERS
A509: BRUNSWICK | C509: STANLEY 4 | F509: CHAPMAN 3 | I509: HORDER 2 | L509: McIVOR 2 | O509: HOWARD
A510: NORTHCOTE | C510: BROWN 3 | F510: STABB 2 | I510: KNIGHT | K510: PAWSEY
A512: ROUND 10 | D512: 24TH JUNE | J512: WEATHER | M512: DENSE FOG NO WIND | S512: PLAYED AT
D513: 1ST QTR | H513: 2ND QTR | L513: 3RD QTR | P513: FINAL | S513: COBURG
A514: BRIGHTON | C514: 2 | D514: 3 | E514: =C514*6+D514 -> 15 | G514: 4 | H514: 8 | I514: =G514*6+H514 -> 32 | K514: 7 | L514: 15 | M514: =K514*6+L514 -> 57 | O514: 10 | P514: 16 | Q514: =O514*6+P514 -> 76 | S514: UMPIRE | X514: LADDER | AB514: ROUND | AD514: 10
A515: COBURG | C515: 0 | D515: 1 | E515: =C515*6+D515 -> 1 | G515: 3 | H515: 5 | I515: =G515*6+H515 -> 23 | K515: 4 | L515: 9 | M515: =K515*6+L515 -> 33 | O515: 8 | P515: 12 | Q515: =O515*6+P515 -> 60 | S515: BARKER
A516: BEST PLAYERS | W516: TEAM | X516: W | Y516: L | Z516: D | AA516: FOR | AB516: AGST | AC516: % | AD516: PTS
A517: BRIGHTON | C517: McINDOE | F517: HALL | I517: ADAMSON | L517: J BURNS | N517: L BURNS | Q517: PICKERING
A518: COBURG | C518: STARBUCK | F518: HOLBROOK | I518: FEWKES | L518: SMITH | N518: GILBERT | Q518: EQUID | W518: BRIGHTON | X518: 7 | Y518: 3 | Z518: 0 | AA518: 1028 | AB518: 728 | AC518: 141.21 | AD518: 28
A519: GOALKICKERS | W519: BRUNSWICK | X519: 7 | Y519: 3 | Z519: 0 | AA519: 764 | AB519: 647 | AC519: 118.08 | AD519: 28
A520: BRIGHTON | C520: ADAMSON 2 | F520: McINDOE 2 | I520: BURKE 2 | K520: SHERMAN | M520: J BURNS | O520: MORRIS | Q520: WARBURTON | W520: WILLIAMSTOWN | X520: 7 | Y520: 3 | Z520: 0 | AA520: 872 | AB520: 774 | AC520: 112.66 | AD520: 28
A521: COBURG | C521: EQUID 3 | F521: JORGENSON 2 | I521: R WILKINSON 2 | L521: MANGELS | W521: PORT MELBOURNE | X521: 7 | Y521: 3 | Z521: 0 | AA521: 825 | AB521: 750 | AC521: 110 | AD521: 28
A523: OAKLEIGH | C523: 5 | D523: 5 | E523: =C523*6+D523 -> 35 | G523: 9 | H523: 9 | I523: =G523*6+H523 -> 63 | K523: 11 | L523: 19 | M523: =K523*6+L523 -> 85 | O523: 15 | P523: 23 | Q523: =O523*6+P523 -> 113 | S523: OAKLEIGH | W523: OAKLEIGH | X523: 7 | Y523: 3 | Z523: 0 | AA523: 856 | AB523: 781 | AC523: 109.60307298335468 | AD523: 28
A524: PRAHRAN | C524: 1 | D524: 5 | E524: =C524*6+D524 -> 11 | G524: 6 | H524: 9 | I524: =G524*6+H524 -> 45 | K524: 9 | L524: 9 | M524: =K524*6+L524 -> 63 | O524: 13 | P524: 11 | Q524: =O524*6+P524 -> 89 | S524: IRVING | W524: COBURG | X524: 6 | Y524: 4 | Z524: 0 | AA524: 952 | AB524: 768 | AC524: 123.95833333333333 | AD524: 24
A525: BEST PLAYERS | W525: SANDRINGHAM | X525: 6 | Y525: 4 | Z525: 0 | AA525: 876 | AB525: 852 | AC525: 102.82 | AD525: 24
A526: OAKLEIGH | C526: WILLIAMS | F526: WENN | I526: BAXTER | L526: WHITE | O526: TEMME | Q526: CUNNINGHAM | W526: CAMBERWELL | X526: 5 | Y526: 5 | Z526: 0 | AA526: 739 | AB526: 769 | AC526: 96.1 | AD526: 20
A527: PRAHRAN | C527: WALSH | F527: MORROW | I527: BURGESS | L527: MASTERTON | O527: OPRAY | Q527: WOOD | W527: PRAHRAN | X527: 4 | Y527: 6 | Z527: 0 | AA527: 867 | AB527: 852 | AC527: 101.7605633802817 | AD527: 16
A528: GOALKICKERS | W528: NORTHCOTE | X528: 2 | Y528: 8 | Z528: 0 | AA528: 684 | AB528: 925 | AC528: 73.95 | AD528: 8
A529: OAKLEIGH | C529: WENN 4 | E529: WHITE 2 | G529: NAISMITH 2 | J529: EDWARDS 2 | M529: SCOTT 2 | O529: LAMBERT 2 | R529: WILLIAMS | W529: YARRAVILLE | X529: 1 | Y529: 9 | Z529: 0 | AA529: 746 | AB529: 1079 | AC529: 69.14 | AD529: 4
A530: PRAHRAN | C530: WALSH 6 | E530: WOOD 2 | G530: BURGESS | I530: McCULLOCH | L530: MATSON | N530: ARMSTRONG | Q530: HARVEY | W530: PRESTON | X530: 1 | Y530: 9 | Z530: 0 | AA530: 652 | AB530: 936 | AC530: 69.66 | AD530: 4
A532: SANDRINGHAM | C532: 2 | D532: 4 | E532: =C532*6+D532 -> 16 | G532: 9 | H532: 7 | I532: =G532*6+H532 -> 61 | K532: 11 | L532: 9 | M532: =K532*6+L532 -> 75 | O532: 12 | P532: 11 | Q532: =O532*6+P532 -> 83 | S532: BEACH ROAD
A533: BRUNSWICK | C533: 2 | D533: 3 | E533: =C533*6+D533 -> 15 | G533: 4 | H533: 8 | I533: =G533*6+H533 -> 32 | K533: 7 | L533: 14 | M533: =K533*6+L533 -> 56 | O533: 10 | P533: 18 | Q533: =O533*6+P533 -> 78 | S533: BOWDEN
A534: BEST PLAYERS
A535: SANDRINGHAM | C535: M GRAMBEAU | F535: B HARPER | I535: BROWN | L535: McFEE | N535: R HARPER | Q535: BENCRAFT
A536: BRUNSWICK | C536: TAYLOR | F536: GEISLER | I536: SPENCER | L536: McIVOR | N536: NEILSON | Q536: PRIESTLEY
A537: GOALKICKERS
A538: SANDRINGHAM | C538: B HARPER 6 | F538: McFEE 2 | H538: JONES 2 | J538: R HARPER | M538: BENCRAFT
A539: BRUNSWICK | C539: SPENCER 3 | F539: McIVOR 2 | I539: HOWARD | K539: HENRYS | M539: PRIESTLEY | O539: NEILSON | Q539: MAHER
A541: PRESTON | C541: 3 | D541: 1 | E541: =C541*6+D541 -> 19 | G541: 9 | H541: 7 | I541: =G541*6+H541 -> 61 | K541: 15 | L541: 10 | M541: =K541*6+L541 -> 100 | O541: 15 | P541: 10 | Q541: =O541*6+P541 -> 100 | S541: NORTHCOTE
A542: NORTHCOTE | C542: 4 | D542: 3 | E542: =C542*6+D542 -> 27 | G542: 4 | H542: 3 | I542: =G542*6+H542 -> 27 | K542: 6 | L542: 5 | M542: =K542*6+L542 -> 41 | O542: 10 | P542: 7 | Q542: =O542*6+P542 -> 67 | S542: JOHNS
A543: BEST PLAYERS
A544: PRESTON | C544: BRADFORD | F544: PRITCHARD | I544: LAWTON | L544: STEWART | O544: GOLDIN | Q544: O'CONNOR
A545: NORTHCOTE | C545: PAWSEY | F545: BROWN | I545: STABB | L545: WOOLNOUGH | O545: POWELL | Q545: BRUNNEN
A546: GOALKICKERS
A547: PRESTON | C547: BRADFORD 4 | F547: NATHAN 3 | I547: O'CONNOR 2 | L547: GOLDIN 2 | N547: LAWTON 2 | Q547: DONALD | S547: FERGEUS
A548: NORTHCOTE | C548: FAHEY 3 | F548: WHITE 2 | I548: EAST | J548: W COLLINS | M548: KINDER | O548: BROWN | Q548: PAWSEY
A550: WILLIAMSTOWN | C550: 3 | D550: 3 | E550: =C550*6+D550 -> 21 | G550: 7 | H550: 5 | I550: =G550*6+H550 -> 47 | K550: 10 | L550: 5 | M550: =K550*6+L550 -> 65 | O550: 13 | P550: 15 | Q550: =O550*6+P550 -> 93 | S550: WILLIAMSTOWN
A551: YARRAVILLE | C551: 3 | D551: 4 | E551: =C551*6+D551 -> 22 | G551: 8 | H551: 6 | I551: =G551*6+H551 -> 54 | K551: 10 | L551: 7 | M551: =K551*6+L551 -> 67 | O551: 11 | P551: 8 | Q551: =O551*6+P551 -> 74 | S551: BAKER
A552: BEST PLAYERS
A553: WILLIAMSTOWN | C553: FEATHERBY | F553: WALKER | I553: BERNARD | L553: ABBERTON | O553: MOLYNEUX | R553: SALVAS
A554: YARRAVILLE | C554: SEITZ | F554: NICHOLLS | I554: TURNER | L554: MADDOCKS | O554: GWYNNE | R554: ROHLEDER
A555: GOALKICKERS
A556: WILLIAMSTOWN | C556: WALKER 6 | F556: DULLARD 3 | I556: ABBERTON 2 | L556: SALVAS | N556: THOMAS
A557: YARRAVILLE | C557: IRWIN 3 | F557: McASEY 2 | I557: MADDOCKS 2 | L557: TURNER 2 | O557: SALT | Q557: PHILLIPS
A559: CAMBERWELL | C559: 0 | D559: 3 | E559: =C559*6+D559 -> 3 | G559: 3 | H559: 5 | I559: =G559*6+H559 -> 23 | K559: 9 | L559: 6 | M559: =K559*6+L559 -> 60 | O559: 10 | P559: 8 | Q559: =O559*6+P559 -> 68 | S559: PORT MELBOURNE
A560: PORT MELBOURNE | C560: 1 | D560: 1 | E560: =C560*6+D560 -> 7 | G560: 3 | H560: 2 | I560: =G560*6+H560 -> 20 | K560: 6 | L560: 5 | M560: =K560*6+L560 -> 41 | O560: 8 | P560: 7 | Q560: =O560*6+P560 -> 55 | S560: HUGHES
A561: BEST PLAYERS
A562: CAMBERWELL | C562: STUBBS | E562: BOHAN | H562: STYLES | K562: BENBOW | N562: SHARPLES | Q562: GIBB
A563: PORT MELBOURNE | C563: CULPH | E563: CLEARY | H563: RAMSAY | K563: LEWIS | N563: McNAUGHTON | Q563: DRINAN
A564: GOALKICKERS
A565: CAMBERWELL | C565: GIBB 3 | E565: BOHAN | G565: BENBOW | I565: ROSENBROCK | L565: MILNE | N565: MILGATE | P565: SCHNEIDER | S565: STUBBS
A566: PORT MELBOURNE | C566: CULPH 6 | F566: LEWIS 2
A568: ROUND 11 | D568: 1ST JULY | J568: WEATHER | M568: NORTH WIND FINE SUNNY | S568: PLAYED AT
D569: 1ST QTR | H569: 2ND QTR | L569: 3RD QTR | P569: FINAL | S569: BRUNSWICK
A570: OAKLEIGH | C570: 4 | D570: 3 | E570: =C570*6+D570 -> 27 | G570: 6 | H570: 3 | I570: =G570*6+H570 -> 39 | K570: 10 | L570: 8 | M570: =K570*6+L570 -> 68 | O570: 11 | P570: 12 | Q570: =O570*6+P570 -> 78 | S570: UMPIRE | X570: LADDER | AB570: ROUND | AD570: 11
A571: BRUNSWICK | C571: 4 | D571: 2 | E571: =C571*6+D571 -> 26 | G571: 6 | H571: 11 | I571: =G571*6+H571 -> 47 | K571: 9 | L571: 14 | M571: =K571*6+L571 -> 68 | O571: 10 | P571: 16 | Q571: =O571*6+P571 -> 76 | S571: CLEARY
A572: BEST PLAYERS | W572: TEAM | X572: W | Y572: L | Z572: D | AA572: FOR | AB572: AGST | AC572: % | AD572: PTS
A573: OAKLEIGH | C573: WATSON | F573: TINDAL | I573: POWER | L573: BOYLE | N573: PERKINS | Q573: SCOTT
A574: BRUNSWICK | C574: SPENCER | F574: SHAW | I574: PRIESTLEY | L574: McIVOR | N574: HORDER | Q574: TAYLOR | W574: BRIGHTON | X574: 8 | Y574: 3 | Z574: 0 | AA574: 1152 | AB574: 789 | AC574: 146.01 | AD574: 32
A575: GOALKICKERS | W575: PORT MELBOURNE | X575: 8 | Y575: 3 | Z575: 0 | AA575: 911 | AB575: 821 | AC575: 110.96224116930573 | AD575: 32
A576: OAKLEIGH | C576: BOYLE 3 | E576: WATSON 2 | H576: NAISMITH 2 | K576: WILLIAMS | M576: WENN | O576: EDWARDS | Q576: NEWTON | W576: OAKLEIGH | X576: 8 | Y576: 3 | Z576: 0 | AA576: 934 | AB576: 857 | AC576: 108.98483080513419 | AD576: 32
A577: BRUNSWICK | C577: SPENCER 5 | F577: HORDER 2 | I577: McIVOR 2 | K577: PRIESTLEY | W577: COBURG | X577: 7 | Y577: 4 | Z577: 0 | AA577: 1039 | AB577: 840 | AC577: 123.69047619047619 | AD577: 28
A579: COBURG | C579: 2 | D579: 2 | E579: =C579*6+D579 -> 14 | G579: 7 | H579: 7 | I579: =G579*6+H579 -> 49 | K579: 9 | L579: 10 | M579: =K579*6+L579 -> 64 | O579: 12 | P579: 15 | Q579: =O579*6+P579 -> 87 | S579: CAMBERWELL | W579: BRUNSWICK | X579: 7 | Y579: 4 | Z579: 0 | AA579: 840 | AB579: 725 | AC579: 115.86 | AD579: 28
A580: CAMBERWELL | C580: 3 | D580: 9 | E580: =C580*6+D580 -> 27 | G580: 4 | H580: 15 | I580: =G580*6+H580 -> 39 | K580: 7 | L580: 22 | M580: =K580*6+L580 -> 64 | O580: 8 | P580: 24 | Q580: =O580*6+P580 -> 72 | S580: IRVING | W580: WILLIAMSTOWN | X580: 7 | Y580: 4 | Z580: 0 | AA580: 919 | AB580: 868 | AC580: 105.88 | AD580: 28
A581: BEST PLAYERS | W581: SANDRINGHAM | X581: 7 | Y581: 4 | Z581: 0 | AA581: 977 | AB581: 929 | AC581: 105.17 | AD581: 28
A582: COBURG | C582: ROGAN | E582: WADE | H582: STARBUCK | K582: HOLBROOK | N582: FEWKES | Q582: WESTHEAD | W582: PRAHRAN | X582: 5 | Y582: 6 | Z582: 0 | AA582: 961 | AB582: 899 | AC582: 106.89655172413794 | AD582: 20
A583: CAMBERWELL | C583: STUBBS | E583: BOHAN | H583: HERBERT | K583: GIBB | N583: WAKE | Q583: SHARPLES | W583: CAMBERWELL | X583: 5 | Y583: 6 | Z583: 0 | AA583: 811 | AB583: 856 | AC583: 94.74 | AD583: 20
A584: GOALKICKERS | W584: NORTHCOTE | X584: 2 | Y584: 9 | Z584: 0 | AA584: 745 | AB584: 1049 | AC584: 71.02 | AD584: 8
A585: COBURG | C585: R WILKINSON 3 | F585: JORGENSON 2 | I585: JAMES 2 | K585: ROGAN 2 | M585: BRIAR 2 | O585: VARNEY | W585: PRESTON | X585: 1 | Y585: 10 | Z585: 0 | AA585: 729 | AB585: 1037 | AC585: 70.3 | AD585: 4
A586: CAMBERWELL | C586: BOHAN 3 | F586: HERBERT 2 | I586: GIBB | K586: COOK | M586: MILGATE | W586: YARRAVILLE | X586: 1 | Y586: 10 | Z586: 0 | AA586: 817 | AB586: 1165 | AC586: 70.13 | AD586: 4
A588: PRAHRAN | C588: 5 | D588: 4 | E588: =C588*6+D588 -> 34 | G588: 5 | H588: 4 | I588: =G588*6+H588 -> 34 | K588: 10 | L588: 10 | M588: =K588*6+L588 -> 70 | O588: 14 | P588: 10 | Q588: =O588*6+P588 -> 94 | S588: TOORAK PARK
A589: WILLIAMSTOWN | C589: 2 | D589: 0 | E589: =C589*6+D589 -> 12 | G589: 5 | H589: 5 | I589: =G589*6+H589 -> 35 | K589: 5 | L589: 5 | M589: =K589*6+L589 -> 35 | O589: 6 | P589: 11 | Q589: =O589*6+P589 -> 47 | S589: BOWDEN
A590: BEST PLAYERS
A591: PRAHRAN | C591: OPRAY | F591: BURGESS | I591: COLLS | L591: CAMPBELL | O591: LENZ | Q591: WALSH
A592: WILLIAMSTOWN | C592: DANCKERT | F592: MATTHEWS | I592: ABBERTON | L592: MOLYNEUX | O592: SALVAS | Q592: WILLIAMS
A593: GOALKICKERS
A594: PRAHRAN | C594: BURGESS 5 | F594: LENZ 4 | I594: HARVEY 3 | L594: LAMB | N594: WALSH
A595: WILLIAMSTOWN | C595: WALKER 3 | F595: MATTHEWS | I595: MOLYNEUX | L595: SALVAS
A597: SANDRINGHAM | C597: 1 | D597: 1 | E597: =C597*6+D597 -> 7 | G597: 7 | H597: 5 | I597: =G597*6+H597 -> 47 | K597: 9 | L597: 6 | M597: =K597*6+L597 -> 60 | O597: 15 | P597: 11 | Q597: =O597*6+P597 -> 101 | S597: PRESTON
A598: PRESTON | C598: 4 | D598: 6 | E598: =C598*6+D598 -> 30 | G598: 6 | H598: 6 | I598: =G598*6+H598 -> 42 | K598: 10 | L598: 10 | M598: =K598*6+L598 -> 70 | O598: 11 | P598: 11 | Q598: =O598*6+P598 -> 77 | S598: MILNE
A599: BEST PLAYERS
A600: SANDRINGHAM | C600: R HARPER | F600: M GRAMBEAU | I600: WRIGHT-SMITH | L600: ANDRESON | O600: McFEE | R600: COLLINS
A601: PRESTON | C601: BRADFORD | F601: DONALD | I601: O'CONNOR | L601: HINES | O601: STEWART | R601: NATHAN
A602: GOALKICKERS
A603: SANDRINGHAM | C603: McFEE 3 | F603: B HARPER 3 | I603: R HARPER 3 | L603: BENCRAFT 2 | O603: ANDRESON | Q603: CERINI | S603: COLLINS | V603: JONES
A604: PRESTON | C604: NATHAN 2 | F604: DONALD 2 | I604: O'CONNOR 2 | L604: HINES 2 | N604: PASCOE | P604: GOLDIN | R604: BRADFORD
A606: PORT MELBOURNE | C606: 1 | D606: 1 | E606: =C606*6+D606 -> 7 | G606: 6 | H606: 11 | I606: =G606*6+H606 -> 47 | K606: 6 | L606: 12 | M606: =K606*6+L606 -> 48 | O606: 11 | P606: 20 | Q606: =O606*6+P606 -> 86 | S606: YARRAVILLE
A607: YARRAVILLE | C607: 4 | D607: 4 | E607: =C607*6+D607 -> 28 | G607: 5 | H607: 4 | I607: =G607*6+H607 -> 34 | K607: 9 | L607: 10 | M607: =K607*6+L607 -> 64 | O607: 10 | P607: 11 | Q607: =O607*6+P607 -> 71 | S607: JOHNS
A608: BEST PLAYERS
A609: PORT MELBOURNE | C609: DRINAN | F609: JOHNSON | I609: LEWIS | L609: BLOOM | N609: CLEARY | Q609: McDONALD
A610: YARRAVILLE | C610: LAW | F610: SALT | I610: MADDOCKS | L610: TAYLOR | N610: SEITZ | Q610: GODDARD
A611: GOALKICKERS
A612: PORT MELBOURNE | C612: LEWIS 4 | F612: JOHNSON 2 | I612: BLOOM 2 | K612: CULPH | M612: HOULIHAN | O612: McDONALD
A613: YARRAVILLE | C613: IRWIN 2 | E613: SALT 2 | G613: MADDOCKS 2 | J613: PHILLIPS | L613: MCASEY | N613: JARRY | P613: WEBB
A615: BRIGHTON | C615: 3 | D615: 0 | E615: =C615*6+D615 -> 18 | G615: 9 | H615: 8 | I615: =G615*6+H615 -> 62 | K615: 10 | L615: 13 | M615: =K615*6+L615 -> 73 | O615: 17 | P615: 22 | Q615: =O615*6+P615 -> 124 | S615: ELSTERNWICK PARK
A616: NORTHCOTE | C616: 4 | D616: 3 | E616: =C616*6+D616 -> 27 | G616: 5 | H616: 3 | I616: =G616*6+H616 -> 33 | K616: 8 | L616: 6 | M616: =K616*6+L616 -> 54 | O616: 9 | P616: 7 | Q616: =O616*6+P616 -> 61 | S616: BAKER
A617: BEST PLAYERS
A618: BRIGHTON | C618: NEW | F618: PERKINS | I618: E TURNER | K618: ADAMSON | N618: RIDDELL | Q618: McINDOE
A619: NORTHCOTE | C619: PAWSEY | F619: BEST | I619: WALLIS | K619: BROWN | N619: WOOLNOUGH | Q619: STABB
A620: GOALKICKERS
A621: BRIGHTON | C621: ADAMSON 6 | F621: WILLS 5 | I621: McINDOE 2 | L621: J BURNS 2 | O621: HOWE | Q621: PERRY
A622: NORTHCOTE | C622: STABB 3 | F622: PAWSEY 2 | I622: KINDER | K622: FAHEY | M622: WOOLNOUGH | P622: J COLLINS
A624: ROUND 12 | D624: 8TH JULY | J624: WEATHER | M624: WEST WIND DULL COLD | S624: PLAYED AT
D625: 1ST QTR | H625: 2ND QTR | L625: 3RD QTR | P625: FINAL | S625: PORT MELBOURNE
A626: PORT MELBOURNE | C626: 4 | D626: 7 | E626: =C626*6+D626 -> 31 | G626: 8 | H626: 9 | I626: =G626*6+H626 -> 57 | K626: 12 | L626: 15 | M626: =K626*6+L626 -> 87 | O626: 14 | P626: 17 | Q626: =O626*6+P626 -> 101 | S626: UMPIRE | X626: LADDER | AB626: ROUND | AD626: 12
A627: COBURG | C627: 1 | D627: 2 | E627: =C627*6+D627 -> 8 | G627: 4 | H627: 6 | I627: =G627*6+H627 -> 30 | K627: 6 | L627: 8 | M627: =K627*6+L627 -> 44 | O627: 9 | P627: 11 | Q627: =O627*6+P627 -> 65 | S627: BOWDEN
A628: BEST PLAYERS | W628: TEAM | X628: W | Y628: L | Z628: D | AA628: FOR | AB628: AGST | AC628: % | AD628: PTS
A629: PORT MELBOURNE | C629: ATKINSON | F629: LEWIS | I629: AUSTIN | L629: DRINAN | O629: MURRAY | Q629: JOHNSON
A630: COBURG | C630: ROGAN | F630: STARBUCK | I630: R WILKINSON | L630: WADE | O630: GILBERT | Q630: CORNELL | W630: BRIGHTON | X630: 9 | Y630: 3 | Z630: 0 | AA630: 1269 | AB630: 863 | AC630: 147.05 | AD630: 36
A631: GOALKICKERS | W631: PORT MELBOURNE | X631: 9 | Y631: 3 | Z631: 0 | AA631: 1012 | AB631: 886 | AC631: 114.22121896162528 | AD631: 36
A632: PORT MELBOURNE | C632: AUSTIN 4 | F632: ATKINSON 4 | I632: LEWIS 3 | K632: MURRAY 2 | N632: HOULIHAN | W632: OAKLEIGH | X632: 9 | Y632: 3 | Z632: 0 | AA632: 1018 | AB632: 902 | AC632: 112.86031042128603 | AD632: 36
A633: COBURG | C633: R WILKINSON 3 | F633: BRIAR 2 | H633: ROGAN 2 | J633: EQUID | L633: DRAPER | W633: BRUNSWICK | X633: 8 | Y633: 4 | Z633: 0 | AA633: 909 | AB633: 781 | AC633: 116.39 | AD633: 32
A635: BRUNSWICK | C635: 1 | D635: 2 | E635: =C635*6+D635 -> 8 | G635: 5 | H635: 4 | I635: =G635*6+H635 -> 34 | K635: 9 | L635: 6 | M635: =K635*6+L635 -> 60 | O635: 10 | P635: 9 | Q635: =O635*6+P635 -> 69 | S635: BRUNSWICK | W635: COBURG | X635: 7 | Y635: 5 | Z635: 0 | AA635: 1104 | AB635: 941 | AC635: 117.32199787460149 | AD635: 28
A636: WILLIAMSTOWN | C636: 1 | D636: 3 | E636: =C636*6+D636 -> 9 | G636: 3 | H636: 5 | I636: =G636*6+H636 -> 23 | K636: 5 | L636: 7 | M636: =K636*6+L636 -> 37 | O636: 8 | P636: 8 | Q636: =O636*6+P636 -> 56 | S636: JOHNS | W636: WILLIAMSTOWN | X636: 7 | Y636: 5 | Z636: 0 | AA636: 975 | AB636: 937 | AC636: 104.06 | AD636: 28
A637: BEST PLAYERS | W637: SANDRINGHAM | X637: 7 | Y637: 5 | Z637: 0 | AA637: 1051 | AB637: 1046 | AC637: 100.48 | AD637: 28
A638: BRUNSWICK | C638: SHAW | F638: GEISLER | I638: McIVOR | L638: TAYLOR | O638: JONES | Q638: SPENCER | W638: PRAHRAN | X638: 6 | Y638: 6 | Z638: 0 | AA638: 1077 | AB638: 969 | AC638: 111.14551083591331 | AD638: 24
A639: WILLIAMSTOWN | C639: SAMPSON | F639: MOLYNEUX | I639: BERNARD | L639: ABBERTON | O639: WALKER | Q639: MATTHEWS | W639: CAMBERWELL | X639: 6 | Y639: 6 | Z639: 0 | AA639: 919 | AB639: 937 | AC639: 98.08 | AD639: 24
A640: GOALKICKERS | W640: NORTHCOTE | X640: 2 | Y640: 10 | Z640: 0 | AA640: 826 | AB640: 1157 | AC640: 71.39 | AD640: 8
A641: BRUNSWICK | C641: McIVOR 3 | F641: MARSH 3 | I641: PRIESTLEY | L641: SPENCER | N641: BYRNE | P641: SHAW | W641: YARRAVILLE | X641: 1 | Y641: 11 | Z641: 0 | AA641: 887 | AB641: 1281 | AC641: 69.24 | AD641: 4
A642: WILLIAMSTOWN | C642: WALKER 5 | F642: MATTHEWS | I642: DULLARD | L642: MOLYNEUX | W642: PRESTON | X642: 1 | Y642: 11 | Z642: 0 | AA642: 774 | AB642: 1121 | AC642: 69.05 | AD642: 4
A644: BRIGHTON | C644: 3 | D644: 1 | E644: =C644*6+D644 -> 19 | G644: 7 | H644: 4 | I644: =G644*6+H644 -> 46 | K644: 10 | L644: 6 | M644: =K644*6+L644 -> 66 | O644: 18 | P644: 9 | Q644: =O644*6+P644 -> 117 | S644: ELSTERNWICK PARK
A645: SANDRINGHAM | C645: 2 | D645: 2 | E645: =C645*6+D645 -> 14 | G645: 4 | H645: 3 | I645: =G645*6+H645 -> 27 | K645: 8 | L645: 6 | M645: =K645*6+L645 -> 54 | O645: 11 | P645: 8 | Q645: =O645*6+P645 -> 74 | S645: CLEARY
A646: BEST PLAYERS
A647: BRIGHTON | C647: McINDOE | F647: WARBURTON | I647: PICKERING | L647: NEW | O647: PERKINS | R647: RIDDELL
A648: SANDRINGHAM | C648: STANLEY | F648: TROOD | I648: R HARPER | L648: M GRAMBEAU | O648: BENCRAFT | R648: McFEE
A649: GOALKICKERS
A650: BRIGHTON | C650: WARBURTON 6 | F650: PICKERING 4 | I650: ADAMSON 4 | L650: McINDOE 2 | O650: MORRIS 2
A651: SANDRINGHAM | C651: R HARPER 4 | F651: B HARPER 3 | I651: McFEE 2 | L651: BENCRAFT | O651: JONES
A653: CAMBERWELL | C653: 2 | D653: 2 | E653: =C653*6+D653 -> 14 | G653: 5 | H653: 14 | I653: =G653*6+H653 -> 44 | K653: 6 | L653: 20 | M653: =K653*6+L653 -> 56 | O653: 14 | P653: 24 | Q653: =O653*6+P653 -> 108 | S653: CAMBERWELL
A654: NORTHCOTE | C654: 3 | D654: 5 | E654: =C654*6+D654 -> 23 | G654: 4 | H654: 5 | I654: =G654*6+H654 -> 29 | K654: 8 | L654: 7 | M654: =K654*6+L654 -> 55 | O654: 12 | P654: 9 | Q654: =O654*6+P654 -> 81 | S654: MILNE
A655: BEST PLAYERS
A656: CAMBERWELL | C656: STUBBS | F656: HERBERT | I656: BENBOW | L656: BOHAN | O656: COOK | Q656: ROCHFORD
A657: NORTHCOTE | C657: DUNGAN | F657: MURPHY | I657: EAST | L657: WALLIS | O657: POWELL | Q657: GREENLAND
A658: GOALKICKERS
A659: CAMBERWELL | C659: HERBERT 4 | F659: MILGATE 3 | I659: STUBBS 3 | L659: SCHNEIDER 2 | O659: ROSENBROCK | R659: DUFF
A660: NORTHCOTE | C660: DUNGAN 6 | F660: KINDER 2 | I660: BEST | J660: PAWSEY | L660: McGREGOR | O660: FAHEY
A662: PRAHRAN | C662: 2 | D662: 1 | E662: =C662*6+D662 -> 13 | G662: 8 | H662: 12 | I662: =G662*6+H662 -> 60 | K662: 13 | L662: 18 | M662: =K662*6+L662 -> 96 | O662: 16 | P662: 20 | Q662: =O662*6+P662 -> 116 | S662: YARRAVILLE
A663: YARRAVILLE | C663: 5 | D663: 5 | E663: =C663*6+D663 -> 35 | G663: 5 | H663: 4 | I663: =G663*6+H663 -> 34 | K663: 7 | L663: 5 | M663: =K663*6+L663 -> 47 | O663: 10 | P663: 10 | Q663: =O663*6+P663 -> 70 | S663: IRVING
A664: BEST PLAYERS
A665: PRAHRAN | C665: HARVEY | F665: JONES | I665: MATSON | L665: COLLS | N665: MORROW | Q665: BURGESS
A666: YARRAVILLE | C666: MALBON | F666: TAYLOR | I666: CRANAGE | L666: GODDARD | N666: LAW | Q666: SALT
A667: GOALKICKERS
A668: PRAHRAN | C668: BURGESS 4 | F668: HARVEY 2 | I668: SHILLABEER 2 | L668: LENZ 2 | N668: WOOD 2 | P668: ROACH | R668: KINNABURGH | V668: R GRAMBEAU | X668: MASTERTON
A669: YARRAVILLE | C669: PHILLIPS 4 | F669: SALT 2 | I669: TAYLOR | K669: McASEY | M669: JARRY | O669: MADDOCKS
A671: OAKLEIGH | C671: 2 | D671: 4 | E671: =C671*6+D671 -> 16 | G671: 7 | H671: 6 | I671: =G671*6+H671 -> 48 | K671: 8 | L671: 9 | M671: =K671*6+L671 -> 57 | O671: 12 | P671: 12 | Q671: =O671*6+P671 -> 84 | S671: PRESTON
A672: PRESTON | C672: 3 | D672: 2 | E672: =C672*6+D672 -> 20 | G672: 3 | H672: 6 | I672: =G672*6+H672 -> 24 | K672: 5 | L672: 7 | M672: =K672*6+L672 -> 37 | O672: 6 | P672: 9 | Q672: =O672*6+P672 -> 45 | S672: BAKER
A673: BEST PLAYERS
A674: OAKLEIGH | C674: WENN | E674: WILLIAMS | H674: RYAN | K674: CUNNINGHAM | N674: J WATSON | Q674: POWER
A675: PRESTON | C675: FERGEUS | E675: LEISHMAN | H675: LAWTON | K675: O'CONNOR | N675: L SWEET | Q675: WALKER
A676: GOALKICKERS
A677: OAKLEIGH | C677: J WATSON 3 | F677: LAMBERT 3 | I677: RYAN 3 | K677: WENN 2 | M677: EDWARDS
A678: PRESTON | C678: GOLDIN 2 | F678: O'CONNOR 2 | I678: FERGEUS | K678: L SWEET
A680: ROUND 13 | D680: 15TH JULY | J680: WEATHER | M680: COLD FINE SUNNY | S680: PLAYED AT
D681: 1ST QTR | H681: 2ND QTR | L681: 3RD QTR | P681: FINAL | S681: OAKLEIGH
A682: OAKLEIGH | C682: 2 | D682: 9 | E682: =C682*6+D682 -> 21 | G682: 4 | H682: 12 | I682: =G682*6+H682 -> 36 | K682: 8 | L682: 14 | M682: =K682*6+L682 -> 62 | O682: 10 | P682: 18 | Q682: =O682*6+P682 -> 78 | S682: UMPIRE | X682: LADDER | AB682: ROUND | AD682: 13
A683: BRIGHTON | C683: 1 | D683: 2 | E683: =C683*6+D683 -> 8 | G683: 4 | H683: 5 | I683: =G683*6+H683 -> 29 | K683: 6 | L683: 12 | M683: =K683*6+L683 -> 48 | O683: 8 | P683: 15 | Q683: =O683*6+P683 -> 63 | S683: JOHNS
A684: BEST PLAYERS | W684: TEAM | X684: W | Y684: L | Z684: D | AA684: FOR | AB684: AGST | AC684: % | AD684: PTS
A685: OAKLEIGH | C685: C WATSON | F685: BAXTER | I685: TINDAL | K685: BOYLE | N685: WENN | Q685: SCOTT
A686: BRIGHTON | C686: PERKINS | F686: JOUBERT | I686: RIDDELL | K686: McINDOE | N686: PERRY | Q686: PLUNKETT | W686: PORT MELBOURNE | X686: 10 | Y686: 3 | Z686: 0 | AA686: 1166 | AB686: 939 | AC686: 124.17465388711395 | AD686: 40
A687: GOALKICKERS | W687: OAKLEIGH | X687: 10 | Y687: 3 | Z687: 0 | AA687: 1096 | AB687: 965 | AC687: 113.57512953367876 | AD687: 40
A688: OAKLEIGH | C688: SCOTT 2 | E688: RYAN 2 | G688: HOWELL | I688: LAMBERT | K688: J WATSON | M688: C WATSON | P688: WENN | R688: WILLIAMS | W688: BRIGHTON | X688: 9 | Y688: 4 | Z688: 0 | AA688: 1332 | AB688: 941 | AC688: 141.55 | AD688: 36
A689: BRIGHTON | C689: McINDOE 3 | F689: WARBURTON 3 | J689: ADAMSON 2 | W689: COBURG | X689: 8 | Y689: 5 | Z689: 0 | AA689: 1230 | AB689: 1030 | AC689: 119.41747572815534 | AD689: 32
A691: PRAHRAN | C691: 4 | D691: 2 | E691: =C691*6+D691 -> 26 | G691: 8 | H691: 6 | I691: =G691*6+H691 -> 54 | K691: 12 | L691: 10 | M691: =K691*6+L691 -> 82 | O691: 20 | P691: 11 | Q691: =O691*6+P691 -> 131 | S691: TOORAK PARK | W691: WILLIAMSTOWN | X691: 8 | Y691: 5 | Z691: 0 | AA691: 1077 | AB691: 994 | AC691: 108.35 | AD691: 32
A692: BRUNSWICK | C692: 3 | D692: 1 | E692: =C692*6+D692 -> 19 | G692: 6 | H692: 5 | I692: =G692*6+H692 -> 41 | K692: 9 | L692: 8 | M692: =K692*6+L692 -> 62 | O692: 9 | P692: 12 | Q692: =O692*6+P692 -> 66 | S692: BAKER | W692: BRUNSWICK | X692: 8 | Y692: 5 | Z692: 0 | AA692: 975 | AB692: 912 | AC692: 106.91 | AD692: 32
A693: BEST PLAYERS | W693: PRAHRAN | X693: 7 | Y693: 6 | Z693: 0 | AA693: 1208 | AB693: 1035 | AC693: 116.71497584541063 | AD693: 28
A694: PRAHRAN | C694: OPRAY | F694: BURGESS | I694: R GRAMBEAU | L694: ARMSTRONG | O694: WALSH | Q694: MATSON | W694: CAMBERWELL | X694: 7 | Y694: 6 | Z694: 0 | AA694: 1014 | AB694: 1014 | AC694: 100 | AD694: 28
A695: BRUNSWICK | C695: SPENCER | F695: MARSH | I695: GEISLER | L695: McIVOR | O695: JONES | Q695: PRIESTLEY | W695: SANDRINGHAM | X695: 7 | Y695: 6 | Z695: 0 | AA695: 1128 | AB695: 1141 | AC695: 98.86 | AD695: 28
A696: GOALKICKERS | Q696: HARVEY | W696: NORTHCOTE | X696: 2 | Y696: 11 | Z696: 0 | AA696: 879 | AB696: 1311 | AC696: 67.05 | AD696: 8
A697: PRAHRAN | C697: BURGESS 7 | F697: WALSH 5 | I697: VILLANI 2 | L697: R GRAMBEAU 2 | O697: SHILLABEER 2 | R697: MATSON | W697: YARRAVILLE | X697: 1 | Y697: 12 | Z697: 0 | AA697: 976 | AB697: 1407 | AC697: 69.37 | AD697: 4
A698: BRUNSWICK | C698: McIVOR 3 | F698: MARSH 2 | I698: STANLEY | K698: SPENCER | M698: HORDER | O698: PRIESTLEY | W698: PRESTON | X698: 1 | Y698: 12 | Z698: 0 | AA698: 831 | AB698: 1223 | AC698: 67.95 | AD698: 4
A700: CAMBERWELL | C700: 5 | D700: 2 | E700: =C700*6+D700 -> 32 | G700: 9 | H700: 8 | I700: =G700*6+H700 -> 62 | K700: 11 | L700: 8 | M700: =K700*6+L700 -> 74 | O700: 14 | P700: 11 | Q700: =O700*6+P700 -> 95 | S700: BEACH ROAD
A701: SANDRINGHAM | C701: 4 | D701: 7 | E701: =C701*6+D701 -> 31 | G701: 6 | H701: 9 | I701: =G701*6+H701 -> 45 | K701: 8 | L701: 15 | M701: =K701*6+L701 -> 63 | O701: 10 | P701: 17 | Q701: =O701*6+P701 -> 77 | S701: BOWDEN
A702: BEST PLAYERS
A703: CAMBERWELL | C703: STUBBS | F703: MOORE | I703: MILGATE | L703: SHARPLES | O703: McLELLAN | R703: WAKE
A704: SANDRINGHAM | C704: BOURKE | F704: B HARPER | I704: M GRAMBEAU | L704: BENCRAFT | O704: R HARPER | R704: SHEARS
A705: GOALKICKERS
A706: CAMBERWELL | C706: MILGATE 5 | F706: HERBERT 3 | I706: MOORE 2 | K706: STUBBS | M706: COOK | N706: PATTERSON | Q706: BENBOW
A707: SANDRINGHAM | C707: B HARPER 3 | F707: McFEE 2 | I707: BENCRAFT 2 | L707: JONES | N707: CERINI | P707: M GRAMBEAU
A709: COBURG | C709: 4 | D709: 5 | E709: =C709*6+D709 -> 29 | G709: 10 | H709: 9 | I709: =G709*6+H709 -> 69 | K709: 14 | L709: 9 | M709: =K709*6+L709 -> 93 | O709: 19 | P709: 12 | Q709: =O709*6+P709 -> 126 | S709: COBURG
A710: YARRAVILLE | C710: 3 | D710: 3 | E710: =C710*6+D710 -> 21 | G710: 7 | H710: 8 | I710: =G710*6+H710 -> 50 | K710: 11 | L710: 10 | M710: =K710*6+L710 -> 76 | O710: 13 | P710: 11 | Q710: =O710*6+P710 -> 89 | S710: MILNE
A711: BEST PLAYERS
A712: COBURG | C712: WADE | E712: R WILKINSON | H712: FEWKES | K712: LIVERSHA | N712: ROGAN | Q712: GILBERT
A713: YARRAVILLE | C713: SALT | E713: THOMPSON | H713: McASEY | K713: EDWARDS | N713: NICHOLLS | Q713: MALBON
A714: GOALKICKERS
A715: COBURG | C715: R WILKINSON 5 | F715: GILBERT 4 | I715: ROGAN 3 | K715: BRIAR 2 | M715: DRAPER 2 | O715: JAMES | Q715: LIVERSHA | S715: VARNEY
A716: YARRAVILLE | C716: McASEY 4 | F716: BAGLIN 3 | I716: PHILLIPS 2 | L716: IRWIN | N716: SEITZ | P716: YATES | R716: EDWARDS
A718: WILLIAMSTOWN | C718: 3 | D718: 5 | E718: =C718*6+D718 -> 23 | G718: 7 | H718: 6 | I718: =G718*6+H718 -> 48 | K718: 11 | L718: 10 | M718: =K718*6+L718 -> 76 | O718: 15 | P718: 12 | Q718: =O718*6+P718 -> 102 | S718: WILLIAMSTOWN
A719: PRESTON | C719: 3 | D719: 0 | E719: =C719*6+D719 -> 18 | G719: 3 | H719: 4 | I719: =G719*6+H719 -> 22 | K719: 6 | L719: 9 | M719: =K719*6+L719 -> 45 | O719: 7 | P719: 15 | Q719: =O719*6+P719 -> 57 | S719: CLEARY
A720: BEST PLAYERS
A721: WILLIAMSTOWN | C721: SAMPSON | F721: WALKER | I721: ABBERTON | L721: MOLYNEAUX | O721: WOOKEY | R721: DANCKERT
A722: PRESTON | C722: PRITCHARD | F722: GOLDIN | I722: SWEET | L722: PASCOE | O722: SIMONS | R722: JOHNSON
A723: GOALKICKERS
A724: WILLIAMSTOWN | C724: WALKER 8 | F724: RENNIE 2 | I724: WILLIAMS 2 | L724: ABBERTON | O724: SALVAS | Q724: DULLARD
A725: PRESTON | C725: BRADFORD 3 | F725: SIMONS 2 | I725: SWEET | K725: LAWTON
A727: PORT MELBOURNE | C727: 3 | D727: 4 | E727: =C727*6+D727 -> 22 | G727: 10 | H727: 9 | I727: =G727*6+H727 -> 69 | K727: 12 | L727: 15 | M727: =K727*6+L727 -> 87 | O727: 23 | P727: 16 | Q727: =O727*6+P727 -> 154 | S727: NORTHCOTE
A728: NORTHCOTE | C728: 2 | D728: 3 | E728: =C728*6+D728 -> 15 | G728: 5 | H728: 8 | I728: =G728*6+H728 -> 38 | K728: 4 | L728: 13 | M728: =K728*6+L728 -> 37 | O728: 6 | P728: 17 | Q728: =O728*6+P728 -> 53 | S728: IRVING
A729: BEST PLAYERS
A730: PORT MELBOURNE | C730: AUSTIN | F730: JOHNSON | I730: WILSON | L730: DRINAN | O730: LEWIS | Q730: WALSH
A731: NORTHCOTE | C731: POWELL | F731: GREENWOOD | I731: O'KEEFE | L731: GALLAGHER | O731: PAWSEY | Q731: WOOLNOUGH
A732: GOALKICKERS
A733: PORT MELBOURNE | C733: AUSTIN 11 | F733: LEWIS 5 | I733: WALSH 3 | K733: HOULIHAN 2 | N733: McDONALD | Q733: PARKER
A734: NORTHCOTE | C734: GREENWOOD 2 | F734: PAWSEY | H734: E WHITE | J734: DUNGAN | L734: MURPHY
A736: ROUND 14 | D736: 22ND JULY | H736: WEATHER | K736: SOUTH WIND SHOWERS GROUNDS HEAVY | S736: PLAYED AT
D737: 1ST QTR | H737: 2ND QTR | L737: 3RD QTR | P737: FINAL | S737: ELSTERNWICK PARK
A738: WILLIAMSTOWN | C738: 2 | D738: 8 | E738: =C738*6+D738 -> 20 | G738: 3 | H738: 9 | I738: =G738*6+H738 -> 27 | K738: 9 | L738: 13 | M738: =K738*6+L738 -> 67 | O738: 9 | P738: 14 | Q738: =O738*6+P738 -> 68 | S738: UMPIRE | X738: LADDER | AB738: ROUND | AD738: 14
A739: BRIGHTON | C739: 0 | D739: 4 | E739: =C739*6+D739 -> 4 | G739: 2 | H739: 13 | I739: =G739*6+H739 -> 25 | K739: 3 | L739: 14 | M739: =K739*6+L739 -> 32 | O739: 6 | P739: 24 | Q739: =O739*6+P739 -> 60 | S739: BOWDEN
A740: BEST PLAYERS | W740: TEAM | X740: W | Y740: L | Z740: D | AA740: FOR | AB740: AGST | AC740: % | AD740: PTS
A741: WILLIAMSTOWN | C741: MOLYNEUX | F741: WALKER | I741: SALVAS | L741: SAMPSON | O741: BERNARD | Q741: WOOKEY
A742: BRIGHTON | C742: E TURNER | F742: NEW | I742: CONROY | L742: L BURNS | O742: BURKE | Q742: PLUNKETT | W742: PORT MELBOURNE | X742: 11 | Y742: 3 | Z742: 0 | AA742: 1255 | AB742: 1017 | AC742: 123.40216322517207 | AD742: 44
A743: GOALKICKERS | W743: OAKLEIGH | X743: 11 | Y743: 3 | Z743: 0 | AA743: 1155 | AB743: 1002 | AC743: 115.26946107784431 | AD743: 44
A744: WILLIAMSTOWN | C744: WALKER 5 | F744: MOLYNEUX 2 | I744: WILLIAMS | L744: MATTHEWS | W744: BRIGHTON | X744: 9 | Y744: 5 | Z744: 0 | AA744: 1392 | AB744: 1009 | AC744: 137.96 | AD744: 36
A745: BRIGHTON | C745: HOWE 3 | F745: HALL 2 | I745: PERKINS | W745: COBURG | X745: 9 | Y745: 5 | Z745: 0 | AA745: 1320 | AB745: 1071 | AC745: 123.24929971988796 | AD745: 36
A747: OAKLEIGH | C747: 3 | D747: 7 | E747: =C747*6+D747 -> 25 | G747: 3 | H747: 7 | I747: =G747*6+H747 -> 25 | K747: 8 | L747: 11 | M747: =K747*6+L747 -> 59 | O747: 8 | P747: 11 | Q747: =O747*6+P747 -> 59 | S747: CAMBERWELL | W747: WILLIAMSTOWN | X747: 9 | Y747: 5 | Z747: 0 | AA747: 1145 | AB747: 1054 | AC747: 108.63 | AD747: 36
A748: CAMBERWELL | C748: 0 | D748: 1 | E748: =C748*6+D748 -> 1 | G748: 4 | H748: 7 | I748: =G748*6+H748 -> 31 | K748: 4 | L748: 9 | M748: =K748*6+L748 -> 33 | O748: 4 | P748: 13 | Q748: =O748*6+P748 -> 37 | S748: IRVING | W748: BRUNSWICK | X748: 9 | Y748: 5 | Z748: 0 | AA748: 1090 | AB748: 1008 | AC748: 108.13 | AD748: 36
A749: BEST PLAYERS | W749: PRAHRAN | X749: 7 | Y749: 7 | Z749: 0 | AA749: 1279 | AB749: 1127 | AC749: 113.48713398402839 | AD749: 28
A750: OAKLEIGH | C750: C WATSON | F750: TEMME | I750: TINDAL | K750: PERKINS | N750: NAISMITH | Q750: BAXTER | W750: SANDRINGHAM | X750: 7 | Y750: 7 | Z750: 0 | AA750: 1206 | AB750: 1230 | AC750: 98.05 | AD750: 28
A751: CAMBERWELL | C751: SHARPLES | F751: STYLES | I751: MOORE | K751: SCHNEIDER | N751: ROCHFORD | Q751: STUBBS | W751: CAMBERWELL | X751: 7 | Y751: 7 | Z751: 0 | AA751: 1051 | AB751: 1073 | AC751: 97.95 | AD751: 28
A752: GOALKICKERS | W752: PRESTON | X752: 2 | Y752: 12 | Z752: 0 | AA752: 923 | AB752: 1294 | AC752: 71.33 | AD752: 8
A753: OAKLEIGH | C753: NAISMITH 2 | F753: RAWLINGS 2 | I753: RYAN | K753: SCOTT | M753: J WATSON | P753: BRUCE | W753: NORTHCOTE | X753: 2 | Y753: 12 | Z753: 0 | AA753: 920 | AB753: 1401 | AC753: 65.67 | AD753: 8
A754: CAMBERWELL | C754: GIBB | E754: MOORE | G754: ROSENBROCK | J754: MILGATE | W754: YARRAVILLE | X754: 1 | Y754: 13 | Z754: 0 | AA754: 1072 | AB754: 1522 | AC754: 70.43 | AD754: 4
A756: COBURG | C756: 0 | D756: 3 | E756: =C756*6+D756 -> 3 | G756: 7 | H756: 11 | I756: =G756*6+H756 -> 53 | K756: 8 | L756: 11 | M756: =K756*6+L756 -> 59 | O756: 12 | P756: 18 | Q756: =O756*6+P756 -> 90 | S756: COBURG
A757: NORTHCOTE | C757: 4 | D757: 3 | E757: =C757*6+D757 -> 27 | G757: 5 | H757: 4 | I757: =G757*6+H757 -> 34 | K757: 5 | L757: 5 | M757: =K757*6+L757 -> 35 | O757: 6 | P757: 5 | Q757: =O757*6+P757 -> 41 | S757: CLEARY
A758: BEST PLAYERS
A759: COBURG | C759: R WILKINSON | F759: EQUID | H759: CORNELL | K759: GILBERT | N759: ROGAN | Q759: WESTHEAD
A760: NORTHCOTE | C760: R WHITE | F760: BEST | H760: O'KEEFE | K760: POWELL | N760: STAFFORD | Q760: MURPHY
A761: GOALKICKERS
A762: COBURG | C762: GILBERT 3 | F762: R WILKINSON 3 | J762: ROGAN 3 | L762: EQUID 2 | N762: DRAPER
A763: NORTHCOTE | C763: STAFFORD 2 | F763: MURPHY | H763: CRANE | J763: BEST | L763: DUNGAN
D764: 29TH JULY | J764: WEATHER | M764: SOUTH WEST WIND COLD HEAVY SHOWERS
A765: PORT MELBOURNE | C765: 3 | D765: 4 | E765: =C765*6+D765 -> 22 | G765: 7 | H765: 7 | I765: =G765*6+H765 -> 49 | K765: 12 | L765: 7 | M765: =K765*6+L765 -> 79 | O765: 13 | P765: 11 | Q765: =O765*6+P765 -> 89 | S765: PORT MELBOURNE
A766: SANDRINGHAM | C766: 2 | D766: 3 | E766: =C766*6+D766 -> 15 | G766: 6 | H766: 3 | I766: =G766*6+H766 -> 39 | K766: 8 | L766: 5 | M766: =K766*6+L766 -> 53 | O766: 12 | P766: 6 | Q766: =O766*6+P766 -> 78 | S766: MILNE
A767: BEST PLAYERS
A768: PORT MELBOURNE | C768: STOREY | F768: REYNOLDS | I768: ATKINSON | L768: AUSTIN | N768: CLEARY | Q768: DRINAN
A769: SANDRINGHAM | C769: B HARPER | F769: SHEARS | I769: BOURKE | L769: ARNEY | N769: STANLEY | Q769: TURNBULL
A770: GOALKICKERS
A771: PORT MELBOURNE | C771: CLEARY 4 | F771: AUSTIN 4 | I771: ATKINSON 3 | L771: REYNOLDS | N771: MURRAY
A772: SANDRINGHAM | C772: B HARPER 6 | F772: McFEE 3 | I772: ARNEY | K772: CERINI | M772: R HARPER
A774: PRESTON | C774: 4 | D774: 2 | E774: =C774*6+D774 -> 26 | G774: 8 | H774: 2 | I774: =G774*6+H774 -> 50 | K774: 12 | L774: 8 | M774: =K774*6+L774 -> 80 | O774: 14 | P774: 8 | Q774: =O774*6+P774 -> 92 | S774: PRESTON
A775: PRAHRAN | C775: 3 | D775: 3 | E775: =C775*6+D775 -> 21 | G775: 5 | H775: 6 | I775: =G775*6+H775 -> 36 | K775: 5 | L775: 9 | M775: =K775*6+L775 -> 39 | O775: 10 | P775: 11 | Q775: =O775*6+P775 -> 71 | S775: JOHNS
A776: BEST PLAYERS
A777: PRESTON | C777: BRADFORD | F777: WALKER | I777: LEISHMAN | L777: LAWTON | O777: L SWEET | R777: FERGEUS
A778: PRAHRAN | C778: WOOD | F778: COLLS | I778: BURGESS | L778: HAYRES | O778: MASTERTON | R778: CAMPBELL
A779: GOALKICKERS
A780: PRESTON | C780: BRADFORD 5 | F780: CROCKER 3 | I780: LAWTON 3 | L780: HARRISON | N780: L SWEET | P780: GOLDIN
A781: PRAHRAN | C781: BURGESS 3 | F781: MORROW 2 | I781: MASTERTON 2 | L781: WOOD 2 | N781: R GRAMBEAU
A783: BRUNSWICK | C783: 5 | D783: 5 | E783: =C783*6+D783 -> 35 | G783: 8 | H783: 8 | I783: =G783*6+H783 -> 56 | K783: 8 | L783: 13 | M783: =K783*6+L783 -> 61 | O783: 16 | P783: 19 | Q783: =O783*6+P783 -> 115 | S783: YARRAVILLE
A784: YARRAVILLE | C784: 2 | D784: 5 | E784: =C784*6+D784 -> 17 | G784: 6 | H784: 11 | I784: =G784*6+H784 -> 47 | K784: 13 | L784: 12 | M784: =K784*6+L784 -> 90 | O784: 14 | P784: 12 | Q784: =O784*6+P784 -> 96 | S784: BAKER
A785: BEST PLAYERS
A786: BRUNSWICK | C786: SPENCER | F786: GEISLER | I786: McCALLUM | L786: HENRYS | N786: NEILSON | Q786: STANLEY
A787: YARRAVILLE | C787: PHILLIPS | F787: CRANAGE | I787: SALT | L787: ORR | N787: LAW | Q787: ROHLEDER
A788: GOALKICKERS
A789: BRUNSWICK | C789: SPENCER 5 | F789: McCALLUM 3 | I789: NORRIS 2 | K789: McIVOR | M789: NEILSON | O789: GEPHART | Q789: JONES | R789: MAHER | U789: THOMPSON
A790: YARRAVILLE | C790: PHILLIPS 6 | F790: EDWARDS 3 | I790: McASEY 3 | K790: TAYLOR | M790: SALT
A792: ROUND 15 | D792: 5TH AUGUST | H792: WEATHER | K792: SOUTH WEST WIND COLD HEAVY SHOWERS | S792: PLAYED AT
D793: 1ST QTR | H793: 2ND QTR | L793: 3RD QTR | P793: FINAL | S793: OAKLEIGH
A794: OAKLEIGH | C794: 1 | D794: 11 | E794: =C794*6+D794 -> 17 | G794: 1 | H794: 14 | I794: =G794*6+H794 -> 20 | K794: 3 | L794: 16 | M794: =K794*6+L794 -> 34 | O794: 3 | P794: 19 | Q794: =O794*6+P794 -> 37 | S794: UMPIRE | X794: LADDER | AB794: ROUND | AD794: 15
A795: PORT MELBOURNE | C795: 0 | D795: 7 | E795: =C795*6+D795 -> 7 | G795: 0 | H795: 9 | I795: =G795*6+H795 -> 9 | K795: 2 | L795: 13 | M795: =K795*6+L795 -> 25 | O795: 3 | P795: 14 | Q795: =O795*6+P795 -> 32 | S795: BOWDEN
A796: BEST PLAYERS | W796: TEAM | X796: W | Y796: L | Z796: D | AA796: FOR | AB796: AGST | AC796: % | AD796: PTS
A797: OAKLEIGH | C797: C WATSON | F797: TEMME | I797: CUNNINGHAM | L797: WILLIAMS | N797: BAXTER | Q797: PERKINS
A798: PORT MELBOURNE | C798: DRINAN | F798: LEWIS | I798: WALSH | L798: JOHNSON | N798: ATKINSON | Q798: CLEARY | W798: OAKLEIGH | X798: 12 | Y798: 3 | Z798: 0 | AA798: 1192 | AB798: 1034 | AC798: 115.28046421663443 | AD798: 48
A799: GOALKICKERS | W799: PORT MELBOURNE | X799: 11 | Y799: 4 | Z799: 0 | AA799: 1287 | AB799: 1054 | AC799: 122.10626185958255 | AD799: 44
A800: OAKLEIGH | C800: WENN | E800: NAISMITH | H800: SCOTT | W800: WILLIAMSTOWN | X800: 10 | Y800: 5 | Z800: 0 | AA800: 1206 | AB800: 1113 | AC800: 108.36 | AD800: 40
A801: PORT MELBOURNE | C801: WALSH | E801: ATKINSON | H801: AUSTIN | W801: BRIGHTON | X801: 9 | Y801: 6 | Z801: 0 | AA801: 1453 | AB801: 1071 | AC801: 135.67 | AD801: 36
A803: PRAHRAN | C803: 1 | D803: 0 | E803: =C803*6+D803 -> 6 | G803: 4 | H803: 5 | I803: =G803*6+H803 -> 29 | K803: 6 | L803: 6 | M803: =K803*6+L803 -> 42 | O803: 9 | P803: 8 | Q803: =O803*6+P803 -> 62 | S803: TOORAK PARK | W803: COBURG | X803: 9 | Y803: 6 | Z803: 0 | AA803: 1402 | AB803: 1176 | AC803: 119.21768707482993 | AD803: 36
A804: BRIGHTON | C804: 2 | D804: 5 | E804: =C804*6+D804 -> 17 | G804: 4 | H804: 6 | I804: =G804*6+H804 -> 30 | K804: 7 | L804: 10 | M804: =K804*6+L804 -> 52 | O804: 8 | P804: 13 | Q804: =O804*6+P804 -> 61 | S804: BAKER | W804: BRUNSWICK | X804: 9 | Y804: 6 | Z804: 0 | AA804: 1134 | AB804: 1110 | AC804: 102.16 | AD804: 36
A805: BEST PLAYERS | W805: PRAHRAN | X805: 8 | Y805: 7 | Z805: 0 | AA805: 1341 | AB805: 1188 | AC805: 112.87878787878788 | AD805: 32
A806: PRAHRAN | C806: HARVEY | F806: MASTERTON | I806: WOOD | L806: R GRAMBEAU | O806: OVERS | Q806: ARMSTRONG | W806: SANDRINGHAM | X806: 8 | Y806: 7 | Z806: 0 | AA806: 1311 | AB806: 1312 | AC806: 99.92 | AD806: 32
A807: BRIGHTON | C807: McINDOE | F807: PICKERING | I807: L BURNS | L807: MULLOY | O807: HOWE | Q807: PLUNKETT | W807: CAMBERWELL | X807: 7 | Y807: 8 | Z807: 0 | AA807: 1110 | AB807: 1134 | AC807: 97.88 | AD807: 28
A808: GOALKICKERS | W808: PRESTON | X808: 3 | Y808: 12 | Z808: 0 | AA808: 1025 | AB808: 1338 | AC808: 76.61 | AD808: 12
A809: PRAHRAN | C809: BURGESS 2 | F809: SHILLABEER 2 | I809: WOOD 2 | K809: MASTERTON 2 | N809: LENZ | W809: NORTHCOTE | X809: 3 | Y809: 12 | Z809: 0 | AA809: 991 | AB809: 1452 | AC809: 68.25 | AD809: 12
A810: BRIGHTON | C810: HOWE 3 | F810: ADAMSON 2 | I810: McINDOE | K810: RIDDELL | M810: MULLOY | W810: YARRAVILLE | X810: 1 | Y810: 14 | Z810: 0 | AA810: 1123 | AB810: 1593 | AC810: 70.5 | AD810: 4
A812: WILLIAMSTOWN | C812: 4 | D812: 9 | E812: =C812*6+D812 -> 33 | G812: 4 | H812: 11 | I812: =G812*6+H812 -> 35 | K812: 7 | L812: 19 | M812: =K812*6+L812 -> 61 | O812: 7 | P812: 19 | Q812: =O812*6+P812 -> 61 | S812: WILLIAMSTOWN
A813: CAMBERWELL | C813: 0 | D813: 0 | E813: =C813*6+D813 -> 0 | G813: 6 | H813: 8 | I813: =G813*6+H813 -> 44 | K813: 6 | L813: 8 | M813: =K813*6+L813 -> 44 | O813: 8 | P813: 11 | Q813: =O813*6+P813 -> 59 | S813: MILNE
A814: BEST PLAYERS
A815: WILLIAMSTOWN | C815: SAMPSON | F815: TAYLOR | I815: MOLYNEUX | L815: WALKER | N815: WOOKEY | Q815: MAY
A816: CAMBERWELL | C816: STUBBS | F816: LOVETT | I816: BOHAN | L816: WAKE | N816: SCHNEIDER | Q816: PATERSON
A817: GOALKICKERS
A818: WILLIAMSTOWN | C818: WALKER 4 | F818: TAYLOR 2 | I818: DULLARD
A819: CAMBERWELL | C819: MOORE 2 | F819: COOK | H819: GIBBS | J819: STUBBS | L819: MILGATE | N819: PATERSON | Q819: McCULLOCH
A821: SANDRINGHAM | C821: 3 | D821: 4 | E821: =C821*6+D821 -> 22 | G821: 7 | H821: 12 | I821: =G821*6+H821 -> 54 | K821: 9 | L821: 12 | M821: =K821*6+L821 -> 66 | O821: 15 | P821: 15 | Q821: =O821*6+P821 -> 105 | S821: BEACH ROAD
A822: COBURG | C822: 2 | D822: 4 | E822: =C822*6+D822 -> 16 | G822: 4 | H822: 5 | I822: =G822*6+H822 -> 29 | K822: 9 | L822: 13 | M822: =K822*6+L822 -> 67 | O822: 11 | P822: 16 | Q822: =O822*6+P822 -> 82 | S822: JOHNS
A823: BEST PLAYERS
A824: SANDRINGHAM | C824: M GRAMBEAU | F824: RUSSELL | I824: BENCRAFT | L824: R HARPER | O824: COLLINS | R824: ANDRESON
A825: COBURG | C825: JAMES | F825: ROGAN | I825: BRIAR | L825: HOLBROOK | O825: JORGENSON | R825: MOSLEY
A826: GOALKICKERS
A827: SANDRINGHAM | C827: M GRAMBEAU 3 | F827: BENCRAFT 3 | I827: RUSSELL 2 | L827: WRIGHT-SMITH 2 | P827: CERINI 2 | R827: COLLINS | U827: ARNEY | W827: B HARPER
A828: COBURG | C828: JAMES 4 | F828: ROGAN 3 | I828: JORGENSON 2 | L828: LEVERSHA | O828: BRIAR
A830: NORTHCOTE | C830: 2 | D830: 2 | E830: =C830*6+D830 -> 14 | G830: 7 | H830: 6 | I830: =G830*6+H830 -> 48 | K830: 7 | L830: 8 | M830: =K830*6+L830 -> 50 | O830: 10 | P830: 11 | Q830: =O830*6+P830 -> 71 | S830: NORTHCOTE
A831: YARRAVILLE | C831: 3 | D831: 3 | E831: =C831*6+D831 -> 21 | G831: 4 | H831: 6 | I831: =G831*6+H831 -> 30 | K831: 7 | L831: 8 | M831: =K831*6+L831 -> 50 | O831: 7 | P831: 9 | Q831: =O831*6+P831 -> 51 | S831: CLEARY
A832: BEST PLAYERS
A833: NORTHCOTE | C833: PAWSEY | E833: HISCOX | H833: STAFFORD | K833: SEARL | N833: POWELL | Q833: FAHEY
A834: YARRAVILLE | C834: ORR | E834: EDWARDS | H834: IRWIN | K834: TAYLOR | N834: GODDARD | Q834: CRANAGE
A835: GOALKICKERS
A836: NORTHCOTE | C836: PAWSEY 4 | F836: DUNGAN 2 | I836: R WHITE | K836: POWELL | M836: DOWNS | O836: CRANE
A837: YARRAVILLE | C837: EDWARDS 3 | F837: PHILLIPS 2 | I837: ORR | K837: McASEY
A839: PRESTON | C839: 3 | D839: 2 | E839: =C839*6+D839 -> 20 | G839: 9 | H839: 8 | I839: =G839*6+H839 -> 62 | K839: 11 | L839: 9 | M839: =K839*6+L839 -> 75 | O839: 15 | P839: 12 | Q839: =O839*6+P839 -> 102 | S839: BRUNSWICK
A840: BRUNSWICK | C840: 3 | D840: 3 | E840: =C840*6+D840 -> 21 | G840: 3 | H840: 5 | I840: =G840*6+H840 -> 23 | K840: 4 | L840: 5 | M840: =K840*6+L840 -> 29 | O840: 6 | P840: 8 | Q840: =O840*6+P840 -> 44 | S840: IRVING
A841: BEST PLAYERS
A842: PRESTON | C842: FERGEUS | E842: BRADFORD | H842: GOLDIN | K842: NATHAN | N842: LEISHMAN | Q842: STEWART
A843: BRUNSWICK | C843: MARSH | E843: WHELAN | H843: HENRYS | K843: GEISLER | N843: PRIESTLEY | Q843: THOMPSON
A844: GOALKICKERS
A845: PRESTON | C845: BRADFORD 5 | F845: GOLDIN 4 | I845: NATHAN 3 | L845: SWEET 2 | N845: SIMONS
A846: BRUNSWICK | C846: SPENCER 3 | F846: PRIESTLEY | I846: THOMPSON | L846: WHELAN
A848: ROUND 16 | D848: 12TH AUGUST | J848: WEATHER | M848: NORTH WIND FINE SUNNY | S848: PLAYED AT
D849: 1ST QTR | H849: 2ND QTR | L849: 3RD QTR | P849: FINAL | S849: PORT MELBOURNE
A850: PORT MELBOURNE | C850: 3 | D850: 2 | E850: =C850*6+D850 -> 20 | G850: 8 | H850: 7 | I850: =G850*6+H850 -> 55 | K850: 10 | L850: 11 | M850: =K850*6+L850 -> 71 | O850: 14 | P850: 16 | Q850: =O850*6+P850 -> 100 | S850: UMPIRE | X850: LADDER | AB850: ROUND | AD850: 16
A851: WILLIAMSTOWN | C851: 2 | D851: 3 | E851: =C851*6+D851 -> 15 | G851: 2 | H851: 5 | I851: =G851*6+H851 -> 17 | K851: 5 | L851: 11 | M851: =K851*6+L851 -> 41 | O851: 8 | P851: 11 | Q851: =O851*6+P851 -> 59 | S851: CLEARY
A852: BEST PLAYERS | W852: TEAM | X852: W | Y852: L | Z852: D | AA852: FOR | AB852: AGST | AC852: % | AD852: PTS
A853: PORT MELBOURNE | C853: DRINAN | F853: CLEARY | I853: STOREY | K853: AUSTIN | N853: WILSON | Q853: LEWIS
A854: WILLIAMSTOWN | C854: MATTHEWS | F854: WILLIAMS | I854: WALKER | K854: McRAE | N854: DULLARD | Q854: ABBERTON | W854: PORT MELBOURNE | X854: 12 | Y854: 4 | Z854: 0 | AA854: 1387 | AB854: 1113 | AC854: 124.61814914645103 | AD854: 48
A855: GOALKICKERS | W855: OAKLEIGH | X855: 12 | Y855: 4 | Z855: 0 | AA855: 1271 | AB855: 1122 | AC855: 113.27985739750446 | AD855: 48
A856: PORT MELBOURNE | C856: LEWIS 6 | E856: CAZALY 2 | H856: AUSTIN 2 | J856: PERRETT | L856: ATKINSON | O856: WALSH | Q856: MURRAY | W856: COBURG | X856: 10 | Y856: 6 | Z856: 0 | AA856: 1490 | AB856: 1255 | AC856: 118.72509960159363 | AD856: 40
A857: WILLIAMSTOWN | C857: TAYLOR 2 | F857: WALKER 2 | I857: MATTHEWS 2 | L857: MOLYNEUX | O857: WILLIAMS | W857: WILLIAMSTOWN | X857: 10 | Y857: 6 | Z857: 0 | AA857: 1265 | AB857: 1213 | AC857: 104.29 | AD857: 40
A859: COBURG | C859: 2 | D859: 1 | E859: =C859*6+D859 -> 13 | G859: 9 | H859: 2 | I859: =G859*6+H859 -> 56 | K859: 12 | L859: 3 | M859: =K859*6+L859 -> 75 | O859: 14 | P859: 4 | Q859: =O859*6+P859 -> 88 | S859: COBURG | W859: BRIGHTON | X859: 9 | Y859: 6 | Z859: 1 | AA859: 1543 | AB859: 1161 | AC859: 132.9 | AD859: 38
A860: OAKLEIGH | C860: 4 | D860: 5 | E860: =C860*6+D860 -> 29 | G860: 6 | H860: 7 | I860: =G860*6+H860 -> 43 | K860: 7 | L860: 8 | M860: =K860*6+L860 -> 50 | O860: 11 | P860: 13 | Q860: =O860*6+P860 -> 79 | S860: BAKER | W860: BRUNSWICK | X860: 9 | Y860: 6 | Z860: 1 | AA860: 1224 | AB860: 1200 | AC860: 102 | AD860: 38
A861: BEST PLAYERS | W861: PRAHRAN | X861: 9 | Y861: 7 | Z861: 0 | AA861: 1428 | AB861: 1269 | AC861: 112.52955082742317 | AD861: 36
A862: COBURG | C862: ROGAN | F862: FEWKES | I862: WADE | K862: SPENCER | N862: BRIAR | Q862: JAMES | W862: SANDRINGHAM | X862: 9 | Y862: 7 | Z862: 0 | AA862: 1440 | AB862: 1360 | AC862: 105.26 | AD862: 36
A863: OAKLEIGH | C863: SCOTT | F863: C WATSON | I863: PERKINS | K863: TINDAL | N863: HOWELL | Q863: LAMBERT | W863: CAMBERWELL | X863: 7 | Y863: 9 | Z863: 0 | AA863: 1191 | AB863: 1221 | AC863: 97.54 | AD863: 28
A864: GOALKICKERS | W864: PRESTON | X864: 3 | Y864: 13 | Z864: 0 | AA864: 1097 | AB864: 1436 | AC864: 76.39 | AD864: 12
A865: COBURG | C865: ROGAN 5 | E865: JAMES 4 | G865: BRIAR | I865: WESTHEAD | L865: JORGENSON | N865: R WILKINSON | Q865: VARNEY | W865: NORTHCOTE | X865: 3 | Y865: 13 | Z865: 0 | AA865: 1039 | AB865: 1581 | AC865: 65.72 | AD865: 12
A866: OAKLEIGH | C866: BRUCE 2 | E866: HOWELL 2 | G866: WENN 2 | I866: SCOTT | K866: NAISMITH | M866: BURCH | O866: LAMBERT | Q866: DONNELLY | W866: YARRAVILLE | X866: 2 | Y866: 14 | Z866: 0 | AA866: 1221 | AB866: 1665 | AC866: 73.33 | AD866: 8
A868: BRIGHTON | C868: 4 | D868: 4 | E868: =C868*6+D868 -> 28 | G868: 6 | H868: 6 | I868: =G868*6+H868 -> 42 | K868: 12 | L868: 15 | M868: =K868*6+L868 -> 87 | O868: 12 | P868: 18 | Q868: =O868*6+P868 -> 90 | S868: ELSTERNWICK PARK
A869: BRUNSWICK | C869: 2 | D869: 1 | E869: =C869*6+D869 -> 13 | G869: 8 | H869: 7 | I869: =G869*6+H869 -> 55 | K869: 10 | L869: 7 | M869: =K869*6+L869 -> 67 | O869: 12 | P869: 18 | Q869: =O869*6+P869 -> 90 | S869: BOWDEN
A870: BEST PLAYERS
A871: BRIGHTON | C871: FREEMAN | F871: HOWE | I871: NEW | K871: RIDDELL | N871: E TURNER | Q871: McINDOE
A872: BRUNSWICK | C872: GEISLER | F872: STANLEY | I872: HENRYS | K872: WHELAN | N872: PRIESTLEY | Q872: TAYLOR
A873: GOALKICKERS
A874: BRIGHTON | C874: HOWE 4 | E874: WARBURTON 2 | H874: PICKERING | J874: ADAMSON | M874: HEIMS | O874: McINDOE | Q874: BURKE | S874: E TURNER
A875: BRUNSWICK | C875: McIVOR 3 | F875: JONES 3 | H875: STANLEY 3 | J875: WHELAN | L875: PRIESTLEY | O875: HENRYS
A877: PRAHRAN | C877: 2 | D877: 4 | E877: =C877*6+D877 -> 16 | G877: 8 | H877: 7 | I877: =G877*6+H877 -> 55 | K877: 8 | L877: 8 | M877: =K877*6+L877 -> 56 | O877: 13 | P877: 9 | Q877: =O877*6+P877 -> 87 | S877: CAMBERWELL
A878: CAMBERWELL | C878: 6 | D878: 4 | E878: =C878*6+D878 -> 40 | G878: 8 | H878: 8 | I878: =G878*6+H878 -> 56 | K878: 12 | L878: 9 | M878: =K878*6+L878 -> 81 | O878: 12 | P878: 9 | Q878: =O878*6+P878 -> 81 | S878: ROBINSON
A879: BEST PLAYERS
A880: PRAHRAN | C880: MATSON | F880: MORROW | I880: WALSH | K880: SHILLABEER | N880: R GRAMBEAU | Q880: MASTERTON
A881: CAMBERWELL | C881: STUBBS | F881: BOHAN | I881: LOVETT | K881: SCHNEIDER | N881: McCULLOCH | Q881: ROCHFORD
A882: GOALKICKERS
A883: PRAHRAN | C883: BURGESS 5 | F883: LENZ 3 | H883: WALSH | J883: MASTERTON | M883: SHILLABEER | P883: R GRAMBEAU | S883: JONES
A884: CAMBERWELL | C884: BOHAN 4 | F884: MILGATE 2 | I884: SCHNEIDER | L884: COOK | N884: PATERSON | Q884: GIBB | R884: McCULLOCH | W884: STUBBS
A886: YARRAVILLE | C886: 2 | D886: 1 | E886: =C886*6+D886 -> 13 | G886: 11 | H886: 5 | I886: =G886*6+H886 -> 71 | K886: 11 | L886: 8 | M886: =K886*6+L886 -> 74 | O886: 14 | P886: 14 | Q886: =O886*6+P886 -> 98 | S886: YARRAVILLE
A887: PRESTON | C887: 5 | D887: 3 | E887: =C887*6+D887 -> 33 | G887: 5 | H887: 3 | I887: =G887*6+H887 -> 33 | K887: 10 | L887: 6 | M887: =K887*6+L887 -> 66 | O887: 11 | P887: 6 | Q887: =O887*6+P887 -> 72 | S887: MILNE
A888: BEST PLAYERS
A889: YARRAVILLE | C889: IRWIN | F889: SALT | I889: SEITZ | K889: WAGHORN | N889: PHILLIPS | Q889: McASEY
A890: PRESTON | C890: FERGEUS | F890: NATHAN | I890: COOPER | K890: BRADFORD | N890: WALKER | Q890: L SWEET
A891: GOALKICKERS
A892: YARRAVILLE | C892: PHILLIPS 4 | F892: WAGHORN 4 | I892: McASEY 3 | K892: IRWIN 2 | M892: SEITZ
A893: PRESTON | C893: BRADFORD 4 | F893: LAWTON 2 | I893: GOLDIN | K893: PRITCHARD | N893: NATHAN | P893: L SWEET | R893: SIMONS
A895: SANDRINGHAM | C895: 0 | D895: 3 | E895: =C895*6+D895 -> 3 | G895: 7 | H895: 9 | I895: =G895*6+H895 -> 51 | K895: 12 | L895: 16 | M895: =K895*6+L895 -> 88 | O895: 18 | P895: 21 | Q895: =O895*6+P895 -> 129 | S895: NORTHCOTE
A896: NORTHCOTE | C896: 2 | D896: 1 | E896: =C896*6+D896 -> 13 | G896: 3 | H896: 2 | I896: =G896*6+H896 -> 20 | K896: 3 | L896: 4 | M896: =K896*6+L896 -> 22 | O896: 7 | P896: 6 | Q896: =O896*6+P896 -> 48 | S896: IRVING
A897: BEST PLAYERS
A898: SANDRINGHAM | C898: BENCRAFT | F898: STANLEY | I898: RUSSELL | K898: M GRAMBEAU | N898: ARNEY | Q898: BROWN
A899: NORTHCOTE | C899: HISCOX | F899: PAWSEY | I899: KINDER | K899: STAFFORD | N899: POWELL | Q899: BEST
A900: GOALKICKERS
A901: SANDRINGHAM | C901: B HARPER 4 | F901: BENCRAFT 2 | I901: RUSSELL 2 | K901: WRIGHT-SMITH 2 | N901: ARNEY 2 | P901: BOURKE 2 | R901: COLLINS 2 | V901: McFEE
A902: NORTHCOTE | C902: DUNGAN 4 | F902: STAFFORD 2 | I902: PAWSEY
A904: ROUND 17 | D904: 19TH AUGUST | J904: WEATHER | M904: SOUTH BREEZE MILD DULL | S904: PLAYED AT
D905: 1ST QTR | H905: 2ND QTR | L905: 3RD QTR | P905: FINAL | S905: WILLIAMSTOWN
A906: WILLIAMSTOWN | C906: 2 | D906: 3 | E906: =C906*6+D906 -> 15 | G906: 7 | H906: 8 | I906: =G906*6+H906 -> 50 | K906: 9 | L906: 11 | M906: =K906*6+L906 -> 65 | O906: 11 | P906: 13 | Q906: =O906*6+P906 -> 79 | S906: UMPIRE | X906: LADDER | AB906: ROUND | AD906: 17
A907: COBURG | C907: 0 | D907: 0 | E907: =C907*6+D907 -> 0 | G907: 2 | H907: 5 | I907: =G907*6+H907 -> 17 | K907: 8 | L907: 8 | M907: =K907*6+L907 -> 56 | O907: 10 | P907: 10 | Q907: =O907*6+P907 -> 70 | S907: BOWDEN
A908: BEST PLAYERS | W908: TEAM | X908: W | Y908: L | Z908: D | AA908: FOR | AB908: AGST | AC908: % | AD908: PTS
A909: WILLIAMSTOWN | C909: BERNARD | F909: ABBERTON | I909: SAMPSON | L909: TAYLOR | O909: McRAE | Q909: WALKER
A910: COBURG | C910: WADE | F910: BRIAR | I910: GILBERT | L910: WESTHEAD | O910: SPENCER | Q910: EQUID | W910: OAKLEIGH | X910: 13 | Y910: 4 | Z910: 0 | AA910: 1414 | AB910: 1182 | AC910: 119.62774957698815 | AD910: 52
A911: GOALKICKERS | W911: PORT MELBOURNE | X911: 12 | Y911: 5 | Z911: 0 | AA911: 1449 | AB911: 1197 | AC911: 121.05263157894737 | AD911: 48
A912: WILLIAMSTOWN | C912: WALKER 4 | F912: TAYLOR 4 | I912: DULLARD 2 | L912: BERNARD | W912: WILLIAMSTOWN | X912: 11 | Y912: 6 | Z912: 0 | AA912: 1344 | AB912: 1283 | AC912: 104.75 | AD912: 44
A913: COBURG | C913: BRIAR 4 | F913: JAMES 3 | I913: JORGENSON 2 | L913: R WILKINSON | W913: BRIGHTON | X913: 10 | Y913: 6 | Z913: 1 | AA913: 1650 | AB913: 1216 | AC913: 135.69 | AD913: 42
A915: PRAHRAN | C915: 3 | D915: 1 | E915: =C915*6+D915 -> 19 | G915: 4 | H915: 6 | I915: =G915*6+H915 -> 30 | K915: 7 | L915: 8 | M915: =K915*6+L915 -> 50 | O915: 12 | P915: 12 | Q915: =O915*6+P915 -> 84 | S915: TOORAK PARK | W915: BRUNSWICK | X915: 10 | Y915: 6 | Z915: 1 | AA915: 1298 | AB915: 1269 | AC915: 102.29 | AD915: 42
A916: PORT MELBOURNE | C916: 4 | D916: 4 | E916: =C916*6+D916 -> 28 | G916: 6 | H916: 6 | I916: =G916*6+H916 -> 42 | K916: 7 | L916: 9 | M916: =K916*6+L916 -> 51 | O916: 8 | P916: 14 | Q916: =O916*6+P916 -> 62 | S916: MILNE | W916: COBURG | X916: 10 | Y916: 7 | Z916: 0 | AA916: 1560 | AB916: 1334 | AC916: 116.9415292353823 | AD916: 40
A917: BEST PLAYERS | W917: PRAHRAN | X917: 10 | Y917: 7 | Z917: 0 | AA917: 1512 | AB917: 1331 | AC917: 113.59879789631856 | AD917: 40
A918: PRAHRAN | C918: HARVEY | E918: CAMPBELL | H918: R GRAMBEAU | K918: SHILLABEER | N918: JONES | Q918: COLLS | W918: SANDRINGHAM | X918: 10 | Y918: 7 | Z918: 0 | AA918: 1531 | AB918: 1443 | AC918: 106.1 | AD918: 40
A919: PORT MELBOURNE | C919: BATTY | E919: CLEARY | H919: STOREY | K919: CULPH | N919: WALSH | Q919: JOHNSON | W919: CAMBERWELL | X919: 7 | Y919: 10 | Z919: 0 | AA919: 1260 | AB919: 1295 | AC919: 97.3 | AD919: 28
A920: GOALKICKERS | W920: PRESTON | X920: 3 | Y920: 14 | Z920: 0 | AA920: 1152 | AB920: 1543 | AC920: 74.66 | AD920: 12
A921: PRAHRAN | C921: BURGESS 3 | F921: HARVEY 3 | I921: SHILLABEER 2 | L921: MASTERTON 2 | O921: R GRAMBEAU | R921: WALSH | W921: NORTHCOTE | X921: 3 | Y921: 14 | Z921: 0 | AA921: 1099 | AB921: 1724 | AC921: 63.75 | AD921: 12
A922: PORT MELBOURNE | C922: LEWIS 2 | F922: CULPH 2 | I922: AUSTIN | K922: BATTY | M922: WALSH | O922: PARKER | W922: YARRAVILLE | X922: 2 | Y922: 15 | Z922: 0 | AA922: 1304 | AB922: 1756 | AC922: 74.26 | AD922: 8
A924: BRUNSWICK | C924: 4 | D924: 2 | E924: =C924*6+D924 -> 26 | G924: 8 | H924: 7 | I924: =G924*6+H924 -> 55 | K924: 9 | L924: 13 | M924: =K924*6+L924 -> 67 | O924: 10 | P924: 14 | Q924: =O924*6+P924 -> 74 | S924: BRUNSWICK
A925: CAMBERWELL | C925: 3 | D925: 2 | E925: =C925*6+D925 -> 20 | G925: 3 | H925: 9 | I925: =G925*6+H925 -> 27 | K925: 5 | L925: 12 | M925: =K925*6+L925 -> 42 | O925: 9 | P925: 15 | Q925: =O925*6+P925 -> 69 | S925: IRVINE
A926: BEST PLAYERS
A927: BRUNSWICK | C927: TAYLOR | F927: GEISLER | I927: HORDER | L927: PRIESTLEY | O927: MARSH | Q927: STANLEY
A928: CAMBERWELL | C928: COOK | F928: SCHNEIDER | I928: LOVETT | L928: DUFF | O928: GIBBS | Q928: STUBBS
A929: GOALKICKERS
A930: BRUNSWICK | C930: STANLEY 2 | F930: McIVOR 2 | I930: PRIESTLEY | K930: SPENCER | M930: NORRIS | O930: WHELAN | Q930: HENRYS | S930: MARSH
A931: CAMBERWELL | C931: DUFF 2 | F931: STUBBS 2 | I931: SCHNEIDER | K931: GIBBS | M931: MOORE | O931: PHILPOTT | Q931: McCULLOCH
A933: BRIGHTON | C933: 6 | D933: 4 | E933: =C933*6+D933 -> 40 | G933: 9 | H933: 8 | I933: =G933*6+H933 -> 62 | K933: 10 | L933: 14 | M933: =K933*6+L933 -> 74 | O933: 15 | P933: 17 | Q933: =O933*6+P933 -> 107 | S933: PRESTON
A934: PRESTON | C934: 3 | D934: 2 | E934: =C934*6+D934 -> 20 | G934: 4 | H934: 4 | I934: =G934*6+H934 -> 28 | K934: 5 | L934: 5 | M934: =K934*6+L934 -> 35 | O934: 8 | P934: 7 | Q934: =O934*6+P934 -> 55 | S934: BARKER
A935: BEST PLAYERS
A936: BRIGHTON | C936: McINDOE | F936: ADAMSON | I936: JOUBERT | K936: G TURNER | N936: FREEMAN | Q936: HEIMS
A937: PRESTON | C937: NATHAN | F937: FERGEUS | I937: GOLDIN | K937: PRITCHARD | N937: BRADFORD | Q937: BROWN
A938: GOALKICKERS
A939: BRIGHTON | C939: ADAMSON 6 | F939: McINDOE 4 | I939: HOWE 3 | K939: WARBURTON | N939: PICKERING
A940: PRESTON | C940: LAWTON 2 | F940: JEFFREY 2 | I940: FERGEUS | K940: BRADFORD | N940: DAWSON | P940: GOLDIN
A942: SANDRINGHAM | C942: 4 | D942: 7 | E942: =C942*6+D942 -> 31 | G942: 10 | H942: 12 | I942: =G942*6+H942 -> 72 | K942: 12 | L942: 14 | M942: =K942*6+L942 -> 86 | O942: 12 | P942: 19 | Q942: =O942*6+P942 -> 91 | S942: BEACH ROAD
A943: YARRAVILLE | C943: 5 | D943: 4 | E943: =C943*6+D943 -> 34 | G943: 7 | H943: 8 | I943: =G943*6+H943 -> 50 | K943: 8 | L943: 9 | M943: =K943*6+L943 -> 57 | O943: 12 | P943: 11 | Q943: =O943*6+P943 -> 83 | S943: CLEARY
A944: BEST PLAYERS
A945: SANDRINGHAM | C945: B HARPER | F945: RUSSELL | I945: R HARPER | L945: BENCRAFT | O945: SHEARS | Q945: HEADON
A946: YARRAVILLE | C946: McCANN | F946: SALT | I946: GWYNNE | L946: ROHLEDER | O946: PHILLIPS | Q946: JONES
A947: GOALKICKERS
A948: SANDRINGHAM | C948: B HARPER 6 | F948: RUSSELL 2 | I948: SHEARS | K948: HEADON | M948: WRIGHT-SMITH | P948: BENCRAFT
A949: YARRAVILLE | C949: PHILLIPS 5 | F949: SALT 2 | I949: McCANN | K949: WEBB | M949: McASEY | O949: MADDOCKS | R949: IRWIN
A951: OAKLEIGH | C951: 5 | D951: 2 | E951: =C951*6+D951 -> 32 | G951: 12 | H951: 4 | I951: =G951*6+H951 -> 76 | K951: 14 | L951: 8 | M951: =K951*6+L951 -> 92 | O951: 21 | P951: 17 | Q951: =O951*6+P951 -> 143 | S951: OAKLEIGH
A952: NORTHCOTE | C952: 1 | D952: 3 | E952: =C952*6+D952 -> 9 | G952: 5 | H952: 6 | I952: =G952*6+H952 -> 36 | K952: 6 | L952: 11 | M952: =K952*6+L952 -> 47 | O952: 8 | P952: 12 | Q952: =O952*6+P952 -> 60 | S952: ROBINSON
A953: BEST PLAYERS
A954: OAKLEIGH | C954: POWER | F954: BRUCE | I954: BAXTER | L954: HILL | N954: LAMBERT | Q954: J WATSON
A955: NORTHCOTE | C955: HISCOX | F955: GALLAGHER | I955: POWELL | L955: MURPHY | N955: KINDER | Q955: STAFFORD
A956: GOALKICKERS
A957: OAKLEIGH | C957: J WATSON 5 | F957: LAMBERT 4 | I957: WENN 3 | K957: SCOTT 2 | M957: HILL 2 | O957: EDWARDS 2 | R957: HOWELL 2 | V957: RAWLINGS
A958: NORTHCOTE | C958: DUNGAN 2 | F958: WALLIS | H958: E WHITE | J958: GALLAGHER | M958: STAFFORD | O958: CRANE | Q958: BEST
A960: ROUND 18 | D960: 26TH AUGUST | J960: WEATHER | M960: NORTH WIND FINE | S960: PLAYED AT
D961: 1ST QTR | H961: 2ND QTR | L961: 3RD QTR | P961: FINAL | S961: PORT MELBOURNE
A962: PORT MELBOURNE | C962: 4 | D962: 9 | E962: =C962*6+D962 -> 33 | G962: 4 | H962: 10 | I962: =G962*6+H962 -> 34 | K962: 7 | L962: 16 | M962: =K962*6+L962 -> 58 | O962: 9 | P962: 20 | Q962: =O962*6+P962 -> 74 | S962: UMPIRE | X962: LADDER | AB962: ROUND | AD962: 18
A963: BRUNSWICK | C963: 2 | D963: 2 | E963: =C963*6+D963 -> 14 | G963: 3 | H963: 7 | I963: =G963*6+H963 -> 25 | K963: 5 | L963: 9 | M963: =K963*6+L963 -> 39 | O963: 8 | P963: 12 | Q963: =O963*6+P963 -> 60 | S963: ROBINSON
A964: BEST PLAYERS | W964: TEAM | X964: W | Y964: L | Z964: D | AA964: FOR | AB964: AGST | AC964: % | AD964: PTS
A965: PORT MELBOURNE | C965: STOREY | F965: DRINAN | I965: LEWIS | L965: RAMSAY | N965: ATKINSON | Q965: AUSTIN
A966: BRUNSWICK | C966: WHELAN | F966: GEISLER | I966: SPENCER | L966: HENRYS | N966: PRIESTLEY | Q966: MORRISON | W966: OAKLEIGH | X966: 14 | Y966: 4 | Z966: 0 | AA966: 1489 | AB966: 1244 | AC966: 119.69453376205787 | AD966: 56
A967: GOALKICKERS | W967: PORT MELBOURNE | X967: 13 | Y967: 5 | Z967: 0 | AA967: 1523 | AB967: 1257 | AC967: 121.16149562450279 | AD967: 52
A968: PORT MELBOURNE | C968: CULPH 5 | F968: LEWIS 2 | I968: BATTY | K968: STOREY | W968: WILLIAMSTOWN | X968: 12 | Y968: 6 | Z968: 0 | AA968: 1434 | AB968: 1359 | AC968: 105.52 | AD968: 48
A969: BRUNSWICK | C969: SPENCER 4 | F969: MARSH 2 | I969: McCALLUM | L969: HORDER | W969: BRIGHTON | X969: 11 | Y969: 6 | Z969: 1 | AA969: 1767 | AB969: 1298 | AC969: 136.13 | AD969: 46
A971: COBURG | C971: 4 | D971: 4 | E971: =C971*6+D971 -> 28 | G971: 5 | H971: 6 | I971: =G971*6+H971 -> 36 | K971: 9 | L971: 9 | M971: =K971*6+L971 -> 63 | O971: 9 | P971: 9 | Q971: =O971*6+P971 -> 63 | S971: COBURG | W971: COBURG | X971: 11 | Y971: 7 | Z971: 0 | AA971: 1623 | AB971: 1392 | AC971: 116.59482758620689 | AD971: 44
A972: PRAHRAN | C972: 1 | D972: 1 | E972: =C972*6+D972 -> 7 | G972: 5 | H972: 4 | I972: =G972*6+H972 -> 34 | K972: 6 | L972: 9 | M972: =K972*6+L972 -> 45 | O972: 7 | P972: 16 | Q972: =O972*6+P972 -> 58 | S972: JOHNS | W972: BRUNSWICK | X972: 10 | Y972: 7 | Z972: 1 | AA972: 1358 | AB972: 1343 | AC972: 101.11 | AD972: 42
A973: BEST PLAYERS | W973: PRAHRAN | X973: 10 | Y973: 8 | Z973: 0 | AA973: 1570 | AB973: 1394 | AC973: 112.62553802008608 | AD973: 40
A974: COBURG | C974: WADE | F974: GILBERT | I974: ROGAN | L974: CAHIR | N974: FEWKES | Q974: WESTHEAD | W974: SANDRINGHAM | X974: 10 | Y974: 8 | Z974: 0 | AA974: 1593 | AB974: 1518 | AC974: 104.94 | AD974: 40
A975: PRAHRAN | C975: CAMPBELL | F975: ARMSTRONG | I975: MASTERTON | L975: MORROW | N975: HARVEY | Q975: YATES | W975: CAMBERWELL | X975: 8 | Y975: 10 | Z975: 0 | AA975: 1363 | AB975: 1357 | AC975: 100.44 | AD975: 32
A976: GOALKICKERS | W976: PRESTON | X976: 3 | Y976: 15 | Z976: 0 | AA976: 1214 | AB976: 1646 | AC976: 73.75 | AD976: 12
A977: COBURG | C977: ROGAN 3 | F977: BRIAR 2 | I977: GILBERT 2 | L977: R WILKINSON | O977: JAMES | W977: NORTHCOTE | X977: 3 | Y977: 15 | Z977: 0 | AA977: 1175 | AB977: 1814 | AC977: 64.77 | AD977: 12
A978: PRAHRAN | C978: MASTERTON 2 | F978: WALSH | H978: BURGESS | J978: R GRAMBEAU | M978: LENZ | O978: WOOD | W978: YARRAVILLE | X978: 2 | Y978: 16 | Z978: 0 | AA978: 1386 | AB978: 1873 | AC978: 74 | AD978: 8
A980: OAKLEIGH | C980: 6 | D980: 6 | E980: =C980*6+D980 -> 42 | G980: 7 | H980: 10 | I980: =G980*6+H980 -> 52 | K980: 8 | L980: 18 | M980: =K980*6+L980 -> 66 | O980: 9 | P980: 21 | Q980: =O980*6+P980 -> 75 | S980: BEACH ROAD
A981: SANDRINGHAM | C981: 2 | D981: 2 | E981: =C981*6+D981 -> 14 | G981: 5 | H981: 11 | I981: =G981*6+H981 -> 41 | K981: 5 | L981: 15 | M981: =K981*6+L981 -> 45 | O981: 7 | P981: 20 | Q981: =O981*6+P981 -> 62 | S981: BOWDEN
A982: BEST PLAYERS
A983: OAKLEIGH | C983: BAXTER | F983: WILLIAMS | I983: EDWARDS | L983: HILL | N983: J WATSON | Q983: TINDAL
A984: SANDRINGHAM | C984: BENCRAFT | F984: M GRAMBEAU | I984: R HARPER | L984: SHEARS | N984: HEADON | Q984: GUILLE
A985: GOALKICKERS
A986: OAKLEIGH | C986: J WATSON 3 | F986: EDWARDS 2 | I986: BRUCE | K986: SCOTT | M986: LAMBERT | O986: HILL
A987: SANDRINGHAM | C987: R HARPER 4 | F987: BENCRAFT | I987: SHEARS | K987: RUSSELL
A989: CAMBERWELL | C989: 3 | D989: 7 | E989: =C989*6+D989 -> 25 | G989: 3 | H989: 11 | I989: =G989*6+H989 -> 29 | K989: 11 | L989: 21 | M989: =K989*6+L989 -> 87 | O989: 13 | P989: 25 | Q989: =O989*6+P989 -> 103 | S989: CAMBERWELL
A990: PRESTON | C990: 0 | D990: 0 | E990: =C990*6+D990 -> 0 | G990: 3 | H990: 4 | I990: =G990*6+H990 -> 22 | K990: 3 | L990: 5 | M990: =K990*6+L990 -> 23 | O990: 9 | P990: 8 | Q990: =O990*6+P990 -> 62 | S990: CLEARY
A991: BEST PLAYERS
A992: CAMBERWELL | C992: STUBBS | F992: COOK | I992: SCHNEIDER | L992: STYLES | N992: WAKE | Q992: McCULLOCH
A993: PRESTON | C993: PASCOE | F993: GOLDIN | I993: BRADFORD | L993: L SWEET | N993: JOHNSON | Q993: THOMPSON
A994: GOALKICKERS
A995: CAMBERWELL | C995: STUBBS 5 | F995: DUFF 3 | I995: SCHNEIDER 2 | L995: MOORE | N995: COOK | P995: McCULLOCH
A996: PRESTON | C996: BRADFORD 3 | F996: COOPER 2 | I996: LAWTON | K996: FERGEUS | M996: GOLDIN | O996: DAWSON
A998: WILLIAMSTOWN | C998: 4 | D998: 8 | E998: =C998*6+D998 -> 32 | G998: 7 | H998: 11 | I998: =G998*6+H998 -> 53 | K998: 9 | L998: 13 | M998: =K998*6+L998 -> 67 | O998: 12 | P998: 18 | Q998: =O998*6+P998 -> 90 | S998: NORTHCOTE
A999: NORTHCOTE | C999: 2 | D999: 0 | E999: =C999*6+D999 -> 12 | G999: 5 | H999: 0 | I999: =G999*6+H999 -> 30 | K999: 9 | L999: 3 | M999: =K999*6+L999 -> 57 | O999: 12 | P999: 4 | Q999: =O999*6+P999 -> 76 | S999: MILNE
A1000: BEST PLAYERS
A1001: WILLIAMSTOWN | C1001: WILLIAMS | F1001: DANCKERT | I1001: MATTHEWS | L1001: TAYLOR | O1001: SAMPSON | Q1001: BERNARD
A1002: NORTHCOTE | C1002: STAFFORD | F1002: WOOLNOUGH | I1002: PAWSEY | L1002: WALLIS | O1002: FAHEY | Q1002: HISCOX
A1003: GOALKICKERS
A1004: WILLIAMSTOWN | C1004: WALKER 5 | F1004: WILLIAMS 2 | I1004: VERNON 2 | L1004: TAYLOR | N1004: SALVAS | P1004: ABBERTON
A1005: NORTHCOTE | C1005: STAFFORD 3 | F1005: DUNGAN 3 | I1005: WALLIS 3 | K1005: WOOLNOUGH | N1005: PAWSEY | P1005: MURPHY
A1007: BRIGHTON | C1007: 7 | D1007: 4 | E1007: =C1007*6+D1007 -> 46 | G1007: 9 | H1007: 4 | I1007: =G1007*6+H1007 -> 58 | K1007: 15 | L1007: 8 | M1007: =K1007*6+L1007 -> 98 | O1007: 18 | P1007: 9 | Q1007: =O1007*6+P1007 -> 117 | S1007: YARRAVILLE
A1008: YARRAVILLE | C1008: 2 | D1008: 2 | E1008: =C1008*6+D1008 -> 14 | G1008: 6 | H1008: 8 | I1008: =G1008*6+H1008 -> 44 | K1008: 6 | L1008: 8 | M1008: =K1008*6+L1008 -> 44 | O1008: 11 | P1008: 16 | Q1008: =O1008*6+P1008 -> 82 | S1008: IRVING
A1009: BEST PLAYERS
A1010: BRIGHTON | C1010: McINDOE | F1010: ADAMSON | I1010: RIDDELL | L1010: NEW | N1010: E TURNER | Q1010: HOWE
A1011: YARRAVILLE | C1011: IRWIN | F1011: MCASEY | I1011: GWYNNE | L1011: MALBON | N1011: GODDARD | Q1011: JONES
A1012: GOALKICKERS
A1013: BRIGHTON | C1013: ADAMSON 6 | F1013: McINDOE 6 | I1013: HOWE 4 | K1013: SHERMAN 2
A1014: YARRAVILLE | C1014: IRWIN 4 | F1014: McASEY 3 | I1014: SALT 3 | K1014: McCANN
A1016: ROUND 19 | D1016: 2ND SEPTEMBER | H1016: WEATHER | K1016: SOUTH WEST WIND COLD HEAVY SHOWERS | S1016: PLAYED AT
D1017: 1ST QTR | H1017: 2ND QTR | L1017: 3RD QTR | P1017: FINAL | S1017: BRUNSWICK
A1018: COBURG | C1018: 1 | D1018: 2 | E1018: =C1018*6+D1018 -> 8 | G1018: 6 | H1018: 6 | I1018: =G1018*6+H1018 -> 42 | K1018: 6 | L1018: 7 | M1018: =K1018*6+L1018 -> 43 | O1018: 12 | P1018: 14 | Q1018: =O1018*6+P1018 -> 86 | S1018: UMPIRE | X1018: LADDER | AB1018: ROUND | AD1018: 19
A1019: BRUNSWICK | C1019: 6 | D1019: 7 | E1019: =C1019*6+D1019 -> 43 | G1019: 6 | H1019: 8 | I1019: =G1019*6+H1019 -> 44 | K1019: 9 | L1019: 15 | M1019: =K1019*6+L1019 -> 69 | O1019: 9 | P1019: 15 | Q1019: =O1019*6+P1019 -> 69 | S1019: BOWDEN
A1020: BEST PLAYERS | W1020: TEAM | X1020: W | Y1020: L | Z1020: D | AA1020: FOR | AB1020: AGST | AC1020: % | AD1020: PTS
A1021: COBURG | C1021: WADE | F1021: WESTHEAD | I1021: BRIAR | L1021: EQUID | N1021: FEWKES | Q1021: SPENCER
A1022: BRUNSWICK | C1022: WHELAN | F1022: TAYLOR | I1022: PRIESTLEY | L1022: SPENCER | N1022: GEISLER | Q1022: MARSH | W1022: OAKLEIGH | X1022: 15 | Y1022: 4 | Z1022: 0 | AA1022: 1601 | AB1022: 1304 | AC1022: 122.7760736196319 | AD1022: 60
A1023: GOALKICKERS | W1023: PORT MELBOURNE | X1023: 14 | Y1023: 5 | Z1023: 0 | AA1023: 1599 | AB1023: 1285 | AC1023: 124.43579766536965 | AD1023: 56
A1024: COBURG | C1024: JAMES 3 | F1024: EQUID 3 | I1024: R WILKINSON 2 | L1024: ROGAN 2 | N1024: BRIAR 2 | W1024: WILLIAMSTOWN | X1024: 13 | Y1024: 6 | Z1024: 0 | AA1024: 1486 | AB1024: 1410 | AC1024: 105.39 | AD1024: 52
A1025: BRUNSWICK | C1025: SPENCER 3 | F1025: CHAPMAN 2 | I1025: HORDER 2 | L1025: JENKINS | N1025: RADFORD | W1025: BRIGHTON | X1025: 12 | Y1025: 6 | Z1025: 1 | AA1025: 1852 | AB1025: 1330 | AC1025: 139.25 | AD1025: 50
A1027: WILLIAMSTOWN | C1027: 4 | D1027: 8 | E1027: =C1027*6+D1027 -> 32 | G1027: 4 | H1027: 8 | I1027: =G1027*6+H1027 -> 32 | K1027: 6 | L1027: 16 | M1027: =K1027*6+L1027 -> 52 | O1027: 6 | P1027: 16 | Q1027: =O1027*6+P1027 -> 52 | S1027: WILLIAMSTOWN | W1027: COBURG | X1027: 12 | Y1027: 7 | Z1027: 0 | AA1027: 1709 | AB1027: 1461 | AC1027: 116.97467488021903 | AD1027: 48
A1028: SANDRINGHAM | C1028: 1 | D1028: 1 | E1028: =C1028*6+D1028 -> 7 | G1028: 3 | H1028: 7 | I1028: =G1028*6+H1028 -> 25 | K1028: 3 | L1028: 7 | M1028: =K1028*6+L1028 -> 25 | O1028: 7 | P1028: 9 | Q1028: =O1028*6+P1028 -> 51 | S1028: CLEARY | W1028: BRUNSWICK | X1028: 10 | Y1028: 8 | Z1028: 1 | AA1028: 1427 | AB1028: 1429 | AC1028: 99.86 | AD1028: 42
A1029: BEST PLAYERS | W1029: PRAHRAN | X1029: 10 | Y1029: 9 | Z1029: 0 | AA1029: 1621 | AB1029: 1446 | AC1029: 112.10235131396958 | AD1029: 40
A1030: WILLIAMSTOWN | C1030: MAY | E1030: ABBERTON | H1030: BERNARD | K1030: TAYLOR | N1030: FEATHERBY | Q1030: WOOKEY | W1030: SANDRINGHAM | X1030: 10 | Y1030: 9 | Z1030: 0 | AA1030: 1644 | AB1030: 1570 | AC1030: 104.71 | AD1030: 40
A1031: SANDRINGHAM | C1031: BOURKE | E1031: BENCRAFT | H1031: RUSSELL | K1031: R HARPER | N1031: STANLEY | Q1031: McFEE | W1031: CAMBERWELL | X1031: 8 | Y1031: 11 | Z1031: 0 | AA1031: 1395 | AB1031: 1442 | AC1031: 96.74 | AD1031: 32
A1032: GOALKICKERS | W1032: NORTHCOTE | X1032: 4 | Y1032: 15 | Z1032: 0 | AA1032: 1227 | AB1032: 1865 | AC1032: 65.79 | AD1032: 16
A1033: WILLIAMSTOWN | C1033: TAYLOR 2 | F1033: ABBERTON 2 | I1033: FEATHERBY | L1033: WALKER | W1033: PRESTON | X1033: 3 | Y1033: 16 | Z1033: 0 | AA1033: 1242 | AB1033: 1722 | AC1033: 72.13 | AD1033: 12
A1034: SANDRINGHAM | C1034: RUSSELL 2 | F1034: BENCRAFT | I1034: BOURKE | K1034: McFEE | M1034: ANDRESON | O1034: COLLINS | W1034: YARRAVILLE | X1034: 2 | Y1034: 17 | Z1034: 0 | AA1034: 1446 | AB1034: 1985 | AC1034: 72.85 | AD1034: 8
A1036: BRIGHTON | C1036: 0 | D1036: 4 | E1036: =C1036*6+D1036 -> 4 | G1036: 5 | H1036: 5 | I1036: =G1036*6+H1036 -> 35 | K1036: 6 | L1036: 7 | M1036: =K1036*6+L1036 -> 43 | O1036: 12 | P1036: 13 | Q1036: =O1036*6+P1036 -> 85 | S1036: ELSTERNWICK PARK
A1037: CAMBERWELL | C1037: 0 | D1037: 4 | E1037: =C1037*6+D1037 -> 4 | G1037: 1 | H1037: 5 | I1037: =G1037*6+H1037 -> 11 | K1037: 3 | L1037: 6 | M1037: =K1037*6+L1037 -> 24 | O1037: 4 | P1037: 8 | Q1037: =O1037*6+P1037 -> 32 | S1037: JOHNS
A1038: BEST PLAYERS
A1039: BRIGHTON | C1039: E TURNER | F1039: FREEMAN | I1039: BURKE | L1039: JOUBERT | O1039: HOWE | Q1039: CONROY
A1040: CAMBERWELL | C1040: SCHNEIDER | F1040: MOORE | I1040: WAKE | L1040: STUBBS | O1040: LOVETT | Q1040: MILGATE
A1041: GOALKICKERS
A1042: BRIGHTON | C1042: ADAMSON 4 | F1042: HOWE 3 | I1042: WARBURTON | L1042: McINDOE | N1042: SHERMAN | Q1042: NEW | R1042: PERKINS
A1043: CAMBERWELL | C1043: MOORE 2 | F1043: ROSENBROCK | I1043: FARRELL
A1045: NORTHCOTE | C1045: 3 | D1045: 1 | E1045: =C1045*6+D1045 -> 19 | G1045: 4 | H1045: 3 | I1045: =G1045*6+H1045 -> 27 | K1045: 5 | L1045: 7 | M1045: =K1045*6+L1045 -> 37 | O1045: 7 | P1045: 10 | Q1045: =O1045*6+P1045 -> 52 | S1045: TOORAK PARK
A1046: PRAHRAN | C1046: 2 | D1046: 7 | E1046: =C1046*6+D1046 -> 19 | G1046: 2 | H1046: 8 | I1046: =G1046*6+H1046 -> 20 | K1046: 4 | L1046: 10 | M1046: =K1046*6+L1046 -> 34 | O1046: 6 | P1046: 15 | Q1046: =O1046*6+P1046 -> 51 | S1046: MILNE
A1047: BEST PLAYERS
A1048: NORTHCOTE | C1048: POWELL | F1048: HISCOX | I1048: PAWSEY | L1048: STAFFORD | O1048: WALLIS | Q1048: BRUNNEN
A1049: PRAHRAN | C1049: HARVEY | F1049: CHIPP | I1049: OVERS | L1049: SHILLABEER | O1049: WOOD | Q1049: BOYD
A1050: GOALKICKERS
A1051: NORTHCOTE | C1051: PAWSEY 3 | F1051: STAFFORD 2 | I1051: KINDER | K1051: WALLIS
A1052: PRAHRAN | C1052: WOOD 2 | F1052: HARVEY 2 | I1052: BURGESS | K1052: CAMPBELL
A1054: PORT MELBOURNE | C1054: 3 | D1054: 2 | E1054: =C1054*6+D1054 -> 20 | G1054: 5 | H1054: 2 | I1054: =G1054*6+H1054 -> 32 | K1054: 7 | L1054: 8 | M1054: =K1054*6+L1054 -> 50 | O1054: 11 | P1054: 10 | Q1054: =O1054*6+P1054 -> 76 | S1054: PRESTON
A1055: PRESTON | C1055: 0 | D1055: 2 | E1055: =C1055*6+D1055 -> 2 | G1055: 1 | H1055: 7 | I1055: =G1055*6+H1055 -> 13 | K1055: 1 | L1055: 7 | M1055: =K1055*6+L1055 -> 13 | O1055: 3 | P1055: 10 | Q1055: =O1055*6+P1055 -> 28 | S1055: IRVING
A1056: BEST PLAYERS
A1057: PORT MELBOURNE | C1057: CLEARY | E1057: DRINAN | H1057: WILSON | K1057: ATKINSON | N1057: BATTY | Q1057: WALSH
A1058: PRESTON | C1058: COOPER | E1058: NATHAN | H1058: FERGEUS | K1058: BRADFORD | N1058: LEHAMNN | Q1058: JOHNSON
A1059: GOALKICKERS
A1060: PORT MELBOURNE | C1060: WALSH 4 | F1060: LEWIS 2 | I1060: A TUCKER 2 | L1060: CULPH | N1060: McDONALD | Q1060: ARGOON
A1061: PRESTON | C1061: GOLDIN | F1061: CROCKER | I1061: LEHMANN
A1063: OAKLEIGH | C1063: 8 | D1063: 4 | E1063: =C1063*6+D1063 -> 52 | G1063: 8 | H1063: 9 | I1063: =G1063*6+H1063 -> 57 | K1063: 13 | L1063: 16 | M1063: =K1063*6+L1063 -> 94 | O1063: 16 | P1063: 16 | Q1063: =O1063*6+P1063 -> 112 | S1063: OAKLEIGH
A1064: YARRAVILLE | C1064: 0 | D1064: 4 | E1064: =C1064*6+D1064 -> 4 | G1064: 5 | H1064: 12 | I1064: =G1064*6+H1064 -> 42 | K1064: 6 | L1064: 14 | M1064: =K1064*6+L1064 -> 50 | O1064: 7 | P1064: 18 | Q1064: =O1064*6+P1064 -> 60 | S1064: ROBINSON
A1065: BEST PLAYERS
A1066: OAKLEIGH | C1066: TEMME | F1066: SCOTT | I1066: BAXTER | L1066: WENN | O1066: C WATSON | R1066: DEAYTON
A1067: YARRAVILLE | C1067: GWYNNE | F1067: SEITZ | I1067: EDWARDS | L1067: GODDARD | O1067: McCANN | R1067: TAYLOR
A1068: GOALKICKERS
A1069: OAKLEIGH | C1069: WENN 5 | E1069: SCOTT 2 | G1069: J WATSON 2 | J1069: EDWARDS 2 | M1069: LAMBERT 2 | P1069: BAXTER | R1069: HILL | T1069: HOWELL
A1070: YARRAVILLE | C1070: IRWIN 2 | F1070: WAGHORN 2 | I1070: PHILLIPS | K1070: ORR | L1070: EDWARDS
A1072: FINALS
A1073: 1ST SEMI | D1073: 9TH SEPTEMBER | J1073: WEATHER | M1073: RAIN
D1074: 1ST QTR | H1074: 2ND QTR | L1074: 3RD QTR | P1074: FINAL
A1075: BRIGHTON | C1075: 4 | D1075: 3 | E1075: =C1075*6+D1075 -> 27 | G1075: 7 | H1075: 6 | I1075: =G1075*6+H1075 -> 48 | K1075: 10 | L1075: 9 | M1075: =K1075*6+L1075 -> 69 | O1075: 15 | P1075: 12 | Q1075: =O1075*6+P1075 -> 102 | S1075: JUNCTION OVAL
A1076: WILLIAMSTOWN | C1076: 1 | D1076: 6 | E1076: =C1076*6+D1076 -> 12 | G1076: 2 | H1076: 6 | I1076: =G1076*6+H1076 -> 18 | K1076: 8 | L1076: 9 | M1076: =K1076*6+L1076 -> 57 | O1076: 9 | P1076: 10 | Q1076: =O1076*6+P1076 -> 64 | S1076: BOWDEN
A1077: BEST PLAYERS
A1078: BRIGHTON | C1078: WARBURTON | F1078: E TURNER | I1078: G TURNER | L1078: PERKINS | O1078: ADAMSON | R1078: HOWE
A1079: WILLIAMSTOWN | C1079: WOOKEY | F1079: DULLARD | I1079: McRAE | L1079: SAMPSON | O1079: SALVAS | R1079: BERNARD
A1080: GOALKICKERS
A1081: BRIGHTON | C1081: ADAMSON 7 | F1081: HOWE 3 | I1081: WARBURTON 2 | L1081: PICKERING 2 | O1081: SHERMAN
A1082: WILLIAMSTOWN | C1082: WALKER 5 | F1082: DULLARD 2 | I1082: BARKER | K1082: TAYLOR
A1084: 2ND SEMI | D1084: 16TH SEPTEMBER | J1084: WEATHER | M1084: NORTH WIND SUNNY
A1085: OAKLEIGH | C1085: 1 | D1085: 1 | E1085: =C1085*6+D1085 -> 7 | G1085: 6 | H1085: 6 | I1085: =G1085*6+H1085 -> 42 | K1085: 10 | L1085: 7 | M1085: =K1085*6+L1085 -> 67 | O1085: 12 | P1085: 15 | Q1085: =O1085*6+P1085 -> 87 | S1085: JUNCTION OVAL
A1086: PORT MELBOURNE | C1086: 5 | D1086: 3 | E1086: =C1086*6+D1086 -> 33 | G1086: 6 | H1086: 5 | I1086: =G1086*6+H1086 -> 41 | K1086: 10 | L1086: 9 | M1086: =K1086*6+L1086 -> 69 | O1086: 11 | P1086: 10 | Q1086: =O1086*6+P1086 -> 76 | S1086: CLEARY
A1087: BEST PLAYERS
A1088: OAKLEIGH | C1088: RYAN | F1088: TEMME | I1088: J WATSON | L1088: TINDAL | O1088: WENN | R1088: EDWARDS
A1089: PORT MELBOURNE | C1089: TUCKER | F1089: STOREY | I1089: CULPH | L1089: CLEARY | O1089: DRINAN | R1089: WALSH
A1090: GOALKICKERS
A1091: OAKLEIGH | C1091: J WATSON 5 | F1091: EDWARDS 3 | I1091: SCOTT 2 | K1091: WENN | M1091: PERKINS
A1092: PORT MELBOURNE | C1092: CULPH 5 | F1092: STOREY | H1092: BATTY | J1092: HOULIHAN | M1092: LEWIS | O1092: ATKINSON | R1092: AUSTIN
A1094: PRELIMINARY FINAL | F1094: 23RD SEPTEMBER | J1094: WEATHER | L1094: SOUTH WEST BREEZE RAIN IN 3RD QUARTER
A1095: PORT MELBOURNE | C1095: 4 | D1095: 2 | E1095: =C1095*6+D1095 -> 26 | G1095: 6 | H1095: 4 | I1095: =G1095*6+H1095 -> 40 | K1095: 8 | L1095: 4 | M1095: =K1095*6+L1095 -> 52 | O1095: 11 | P1095: 6 | Q1095: =O1095*6+P1095 -> 72 | S1095: JUNCTION OVAL
A1096: BRIGHTON | C1096: 5 | D1096: 3 | E1096: =C1096*6+D1096 -> 33 | G1096: 5 | H1096: 5 | I1096: =G1096*6+H1096 -> 35 | K1096: 6 | L1096: 9 | M1096: =K1096*6+L1096 -> 45 | O1096: 8 | P1096: 12 | Q1096: =O1096*6+P1096 -> 60 | S1096: CLEARY
A1097: BEST PLAYERS
A1098: PORT MELBOURNE | C1098: STOREY | F1098: DRINAN | I1098: KELSEY | L1098: LEWIS | O1098: JOHNSON | R1098: WOODS
A1099: BRIGHTON | C1099: BURKE | F1099: E TURNER | I1099: WARBURTON | L1099: ADAMSON | O1099: McINDOE | R1099: PERKINS
A1100: GOALKICKERS
A1101: PORT MELBOURNE | C1101: LEWIS 4 | F1101: AUSTIN 2 | I1101: HOULIHAN | L1101: BATTY | N1101: WILSON | P1101: ARGOON | R1101: STOREY
A1102: BRIGHTON | C1102: McINDOE 4 | F1102: ADAMSON 3 | I1102: PICKERING
A1104: GRAND FINAL | D1104: 30TH SEPTEMBER | I1104: WEATHER | K1104: NORTH WEST WIND SUNNY RAIN BEFORE GAME
A1105: OAKLEIGH | C1105: 5 | D1105: 5 | E1105: 35 | G1105: 6 | H1105: 8 | I1105: 44 | K1105: 13 | L1105: 9 | M1105: 87 | O1105: 13 | P1105: 9 | Q1105: =O1105*6+P1105 -> 87 | S1105: JUNCTION OVAL
A1106: PORT MELBOURNE | C1106: 2 | D1106: 0 | E1106: 12 | G1106: 6 | H1106: 8 | I1106: 44 | K1106: 7 | L1106: 11 | M1106: 53 | O1106: 9 | P1106: 14 | Q1106: =O1106*6+P1106 -> 68 | S1106: CLEARY
A1107: BEST PLAYERS
A1108: OAKLEIGH | C1108: RYAN | F1108: EDWARDS | I1108: C WATSON | L1108: BAXTER | O1108: TEMME | R1108: DEAYTON
A1109: PORT MELBOURNE | C1109: WOODBRIDGE | F1109: AUSTIN | I1109: ATKINSON | L1109: LEWIS | O1109: BATTY | R1109: DRINAN
A1110: GOALKICKERS
A1111: OAKLEIGH | C1111: EDWARDS 3 | F1111: HILL 3 | I1111: LAMBERT 2 | L1111: DEAYTON | N1111: CUNNINGHAM | Q1111: C WATSON | T1111: J WATSON | W1111: HOWELL
A1112: PORT MELBOURNE | C1112: LEWIS 4 | F1112: WOODBRIDGE 2 | J1112: ATKINSON | M1112: WALSH | O1112: CULPH