A1: Victorian Football Association
A2: Season 1951
A3: © Copyright Wal Williams | F3: First created: 2 November 2014
A4: Contact: joywalwi at gmail dot com | F4: Last updated: 27 January 2018 | W4: VFA Results and tables - Link to the main index page
A5: You are free to copy this document in whole or part provided that proper acknowledgement is given to the author. All rights reserved.
A7: YEAR 1951
A8: ROUND 1 | E8: 21ST APRIL | J8: WEATHER | M8: SOUTH WIND COLD | S8: PLAYED AT
D9: 1ST QTR | H9: 2ND QTR | L9: 3RD QTR | P9: FINAL | S9: YARRAVILLE | X9: LADDER | AB9: ROUND | AD9: 1
A10: WILLIAMSTOWN | C10: 4 | D10: 4 | E10: =C10*6+D10 -> 28 | G10: 8 | H10: 10 | I10: =G10*6+H10 -> 58 | K10: 12 | L10: 17 | M10: =K10*6+L10 -> 89 | O10: 19 | P10: 21 | Q10: =O10*6+P10 -> 135 | S10: UMPIRE
A11: YARRAVILLE | C11: 2 | D11: 1 | E11: =C11*6+D11 -> 13 | G11: 4 | H11: 3 | I11: =G11*6+H11 -> 27 | K11: 5 | L11: 3 | M11: =K11*6+L11 -> 33 | O11: 6 | P11: 8 | Q11: =O11*6+P11 -> 44 | S11: IRVING | W11: TEAM | X11: W | Y11: L | Z11: D | AA11: FOR | AB11: AGST | AC11: % | AD11: PTS
A12: BEST PLAYERS
A13: WILLIAMSTOWN | C13: POOLE | E13: GUNN | H13: WALKER | K13: DULLARD | N13: MOLYNEUX | Q13: WOOKEY | W13: WILLIAMSTOWN | X13: 1 | Y13: 0 | Z13: 0 | AA13: 135 | AB13: 44 | AC13: 306.81818181818181 | AD13: 4
A14: YARRAVILLE | C14: MASON | E14: PHILLIPS | H14: HOUSTON | K14: ROHLEDER | N14: TEASDALE | Q14: GODDARD | W14: SANDRINGHAM | X14: 1 | Y14: 0 | Z14: 0 | AA14: 139 | AB14: 63 | AC14: 220.63492063492063 | AD14: 4
A15: GOALKICKERS | W15: PRESTON | X15: 1 | Y15: 0 | Z15: 0 | AA15: 110 | AB15: 51 | AC15: 215.68627450980392 | AD15: 4
A16: WILLIAMSTOWN | C16: POOLE 6 | E16: WALKER 4 | H16: GUNN 3 | J16: DULLARD 2 | M16: MOLYNEUX 2 | P16: AULD 2 | W16: PORT MELBOURNE | X16: 1 | Y16: 0 | Z16: 0 | AA16: 106 | AB16: 75 | AC16: 141.33333333333334 | AD16: 4
A17: YARRAVILLE | C17: TEASDALE 2 | F17: McASEY | H17: HICKEY | J17: MASON | L17: HOUSTON
W18: PRAHRAN | X18: 1 | Y18: 0 | Z18: 0 | AA18: 120 | AB18: 87 | AC18: 137.93 | AD18: 4
A19: NORTHCOTE | C19: 2 | D19: 2 | E19: =C19*6+D19 -> 14 | G19: 7 | H19: 8 | I19: =G19*6+H19 -> 50 | K19: 9 | L19: 10 | M19: =K19*6+L19 -> 64 | O19: 10 | P19: 14 | Q19: =O19*6+P19 -> 74 | S19: CAMBERWELL | W19: NORTHCOTE | X19: 1 | Y19: 0 | Z19: 0 | AA19: 74 | AB19: 57 | AC19: 129.82456140350877 | AD19: 4
A20: CAMBERWELL | C20: 2 | D20: 3 | E20: =C20*6+D20 -> 15 | G20: 3 | H20: 5 | I20: =G20*6+H20 -> 23 | K20: 6 | L20: 7 | M20: =K20*6+L20 -> 43 | O20: 8 | P20: 9 | Q20: =O20*6+P20 -> 57 | S20: BOWDEN | W20: OAKLEIGH | X20: 1 | Y20: 0 | Z20: 0 | AA20: 82 | AB20: 80 | AC20: 102.5 | AD20: 4
A21: BEST PLAYERS | W21: BRIGHTON | X21: 0 | Y21: 1 | Z21: 0 | AA21: 80 | AB21: 82 | AC21: 97.560975609756099 | AD21: 0
A22: NORTHCOTE | C22: WOOLNOUGH | F22: STAFFORD | I22: PAWSEY | L22: HISCOX | N22: DUNGAN | Q22: STABB | W22: CAMBERWELL | X22: 0 | Y22: 1 | Z22: 0 | AA22: 57 | AB22: 74 | AC22: 77.027027027027032 | AD22: 0
A23: CAMBERWELL | C23: LOVETT | F23: STUBBS | I23: MILGATE | L23: BOHAN | N23: ROCHFORD | Q23: KANE | W23: BRUNSWICK | X23: 0 | Y23: 1 | Z23: 0 | AA23: 87 | AB23: 120 | AC23: 72.5 | AD23: 0
A24: GOALKICKERS | W24: COBURG | X24: 0 | Y24: 1 | Z24: 0 | AA24: 75 | AB24: 106 | AC24: 70.754716981132077 | AD24: 0
A25: NORTHCOTE | C25: DUNGAN 3 | F25: PAWSEY | H25: STABB | J25: BEST | L25: KINDER | N25: E WHITE | P25: POWELL | R25: STAFFORD | W25: BOX HILL | X25: 0 | Y25: 1 | Z25: 0 | AA25: 51 | AB25: 110 | AC25: 46.363636363636367 | AD25: 0
A26: CAMBERWELL | C26: MILGATE 3 | F26: HORWILL 2 | I26: ALLEN | K26: McFEE | M26: BOHAN | W26: MOORABBIN | X26: 0 | Y26: 1 | Z26: 0 | AA26: 63 | AB26: 139 | AC26: 45.323741007194243 | AD26: 0
W27: YARRAVILLE | X27: 0 | Y27: 1 | Z27: 0 | AA27: 44 | AB27: 135 | AC27: 32.592592592592595 | AD27: 0
A28: PORT MELBOURNE | C28: 2 | D28: 4 | E28: =C28*6+D28 -> 16 | G28: 6 | H28: 7 | I28: =G28*6+H28 -> 43 | K28: 13 | L28: 5 | M28: =K28*6+L28 -> 83 | O28: 15 | P28: 16 | Q28: =O28*6+P28 -> 106 | S28: PORT MELBOURNE
A29: COBURG | C29: 1 | D29: 1 | E29: =C29*6+D29 -> 7 | G29: 7 | H29: 6 | I29: =G29*6+H29 -> 48 | K29: 7 | L29: 6 | M29: =K29*6+L29 -> 48 | O29: 11 | P29: 9 | Q29: =O29*6+P29 -> 75 | S29: MILNE
A30: BEST PLAYERS
A31: PORT MELBOURNE | C31: WOODBRIDGE | F31: JOHNSON | I31: McDONALD | L31: MILLER | O31: AUSTIN | Q31: CLEARY
A32: COBURG | C32: ROGAN | F32: BRYAR | I32: EQUID | L32: STARBUCK | O32: S WILSON | Q32: LEVERSHA
A33: GOALKICKERS
A34: PORT MELBOURNE | C34: MILLER 5 | F34: AUSTIN 4 | I34: CLEARY 2 | L34: WALSH 2 | O34: PENDLEBURY | R34: McDONALD
A35: COBURG | C35: JAMES 4 | F35: BRYAR 3 | I35: ROGAN 2 | L35: BURMEISTER | O35: EGAN
A37: PRAHRAN | C37: 3 | D37: 1 | E37: =C37*6+D37 -> 19 | G37: 8 | H37: 3 | I37: =G37*6+H37 -> 51 | K37: 11 | L37: 6 | M37: =K37*6+L37 -> 72 | O37: 18 | P37: 12 | Q37: =O37*6+P37 -> 120 | S37: BRUNSWICK
A38: BRUNSWICK | C38: 4 | D38: 5 | E38: =C38*6+D38 -> 29 | G38: 9 | H38: 6 | I38: =G38*6+H38 -> 60 | K38: 12 | L38: 12 | M38: =K38*6+L38 -> 84 | O38: 12 | P38: 15 | Q38: =O38*6+P38 -> 87 | S38: JOHNS
A39: BEST PLAYERS
A40: PRAHRAN | C40: MORROW | F40: LENZ | I40: BURGESS | L40: WOOD | N40: McCULLOCH | Q40: HARVEY
A41: BRUNSWICK | C41: PRIESTLEY | F41: SPENCER | I41: McCORKELLE | L41: SHAW | N41: STANLEY | Q41: MARCH
A42: GOALKICKERS
A43: PRAHRAN | C43: BURGESS 4 | E43: WALSH 3 | G43: MORROW 3 | J43: McCULLOCH 2 | M43: HARVEY 2 | O43: SHILLABEER | R43: ARMSTRONG | W43: LENZ | X43: WOOD
A44: BRUNSWICK | C44: PRIESTLEY 3 | F44: SPENCER 3 | I44: BUTLER | K44: HOWARD | M44: STANLEY | O44: BRENNAN | Q44: NEILSON | S44: POLLARD
A46: PRESTON | C46: 6 | D46: 4 | E46: =C46*6+D46 -> 40 | G46: 8 | H46: 6 | I46: =G46*6+H46 -> 54 | K46: 14 | L46: 10 | M46: =K46*6+L46 -> 94 | O46: 16 | P46: 14 | Q46: =O46*6+P46 -> 110 | S46: PRESTON
A47: BOX HILL | C47: 2 | D47: 0 | E47: =C47*6+D47 -> 12 | G47: 4 | H47: 2 | I47: =G47*6+H47 -> 26 | K47: 6 | L47: 6 | M47: =K47*6+L47 -> 42 | O47: 7 | P47: 9 | Q47: =O47*6+P47 -> 51 | S47: MERRINGTON
A48: BEST PLAYERS
A49: PRESTON | C49: L SWEET | F49: PASCOE | I49: BRADFORD | L49: HORDER | O49: POTTER | R49: HARRISON
A50: BOX HILL | C50: GREEN | F50: MIHAN | I50: VANCE | L50: HENDERSON | O50: COGHLAN | R50: KRONK
A51: GOALKICKERS
A52: PRESTON | C52: POTTER 6 | F52: BRADFORD 3 | I52: NATHAN 2 | L52: DAVIES 2 | N52: L SWEET 2 | Q52: HORDER
A53: BOX HILL | C53: MAIDMENT 3 | F53: MIHAN 2 | I53: COGHLAN | K53: HENDERSON
A55: SANDRINGHAM | C55: 3 | D55: 6 | E55: =C55*6+D55 -> 24 | G55: 7 | H55: 11 | I55: =G55*6+H55 -> 53 | K55: 12 | L55: 15 | M55: =K55*6+L55 -> 87 | O55: 20 | P55: 19 | Q55: =O55*6+P55 -> 139 | S55: CHELT
A56: MOORABBIN | C56: 4 | D56: 4 | E56: =C56*6+D56 -> 28 | G56: 5 | H56: 7 | I56: =G56*6+H56 -> 37 | K56: 7 | L56: 7 | M56: =K56*6+L56 -> 49 | O56: 9 | P56: 9 | Q56: =O56*6+P56 -> 63 | S56: WRIGHT
A57: BEST PLAYERS
A58: SANDRINGHAM | C58: GRAMBEAU | F58: BENCRAFT | I58: JOSEPH | L58: SHEARS | N58: B HARPER | Q58: STANLEY
A59: MOORABBIN | C59: WILSON | F59: CARPENTER | I59: MURNANE | L59: GOODES | N59: BLAIR | Q59: ANTONIE
A60: GOALKICKERS
A61: SANDRINGHAM | C61: B HARPER 7 | F61: RUSSELL 4 | I61: JONES 3 | K61: COLLINS 2 | M61: GRAMBEAU | P61: BRIGHTON | R61: HANMAN | U61: CERINI
A62: MOORABBIN | C62: WILSON 4 | F62: McFARLANE 2 | I62: MURNANE 2 | L62: BLAIR
A64: OAKLEIGH | C64: 3 | D64: 4 | E64: =C64*6+D64 -> 22 | G64: 6 | H64: 8 | I64: =G64*6+H64 -> 44 | K64: 9 | L64: 8 | M64: =K64*6+L64 -> 62 | O64: 12 | P64: 10 | Q64: =O64*6+P64 -> 82 | S64: ELSTERNWICK PARK
A65: BRIGHTON | C65: 4 | D65: 5 | E65: =C65*6+D65 -> 29 | G65: 6 | H65: 8 | I65: =G65*6+H65 -> 44 | K65: 9 | L65: 13 | M65: =K65*6+L65 -> 67 | O65: 11 | P65: 14 | Q65: =O65*6+P65 -> 80 | S65: CLEARY
A66: BEST PLAYERS
A67: OAKLEIGH | C67: STREETER | F67: EDWARDS | I67: PERKINS | L67: TINDAL | O67: C WATSON | R67: BOYLE
A68: BRIGHTON | C68: NEW | F68: BLACKMORE | I68: G TURNER | L68: ADAMSON | O68: HOWE | R68: JOUBERT
A69: GOALKICKERS
A70: OAKLEIGH | C70: J WATSON 3 | F70: STREETER 3 | I70: EDWARDS 2 | L70: PERKINS | N70: SCOTT | P70: HILL | Q70: W WILLIAMS
A71: BRIGHTON | C71: ADAMSON 3 | F71: HOWE 2 | H71: BURKE | J71: EMBLETON | M71: L BURNS | O71: PLUNKETT | Q71: G TURNER | T71: PICKERING
A73: ROUND 2 | E73: 28TH APRIL | J73: WEATHER | O73: FINE | S73: PLAYED AT
D74: 1ST QTR | H74: 2ND QTR | L74: 3RD QTR | P74: FINAL | S74: WILLIAMSTOWN
A75: WILLIAMSTOWN | C75: 1 | D75: 2 | E75: =C75*6+D75 -> 8 | G75: 11 | H75: 5 | I75: =G75*6+H75 -> 71 | K75: 15 | L75: 8 | M75: =K75*6+L75 -> 98 | O75: 19 | P75: 11 | Q75: =O75*6+P75 -> 125 | S75: UMPIRE | X75: LADDER | AB75: ROUND | AD75: 2
A76: PRESTON | C76: 3 | D76: 7 | E76: =C76*6+D76 -> 25 | G76: 3 | H76: 10 | I76: =G76*6+H76 -> 28 | K76: 7 | L76: 12 | M76: =K76*6+L76 -> 54 | O76: 12 | P76: 16 | Q76: =O76*6+P76 -> 88 | S76: BOWDEN
A77: BEST PLAYERS | W77: TEAM | X77: W | Y77: L | Z77: D | AA77: FOR | AB77: AGST | AC77: % | AD77: PTS
A78: WILLIAMSTOWN | C78: WALKER | F78: GUNN | I78: ABBERTON | L78: MOLYNEUX | O78: DULLARD | R78: WOOKEY
A79: PRESTON | C79: BRADFORD | F79: RUTHVEN | I79: RYAN | L79: TURNER | O79: HORDER | R79: NATHAN | W79: WILLIAMSTOWN | X79: 2 | Y79: 0 | Z79: 0 | AA79: 260 | AB79: 132 | AC79: 196.96969696969697 | AD79: 8
A80: GOALKICKERS | W80: NORTHCOTE | X80: 2 | Y80: 0 | Z80: 0 | AA80: 150 | AB80: 100 | AC80: 150 | AD80: 8
A81: WILLIAMSTOWN | C81: WALKER 9 | F81: GUNN 5 | I81: DULLARD 2 | L81: ABBERTON | N81: MOLYNEUX | Q81: BARKER | W81: SANDRINGHAM | X81: 2 | Y81: 0 | Z81: 0 | AA81: 267 | AB81: 188 | AC81: 142.02127659574469 | AD81: 8
A82: PRESTON | C82: NATHAN 4 | F82: BRADFORD 3 | I82: CUGLEY 3 | L82: HORDER | N82: RUTHVEN | W82: PRAHRAN | X82: 2 | Y82: 0 | Z82: 0 | AA82: 209 | AB82: 160 | AC82: 130.63 | AD82: 8
A84: SANDRINGHAM | C84: 7 | D84: 4 | E84: =C84*6+D84 -> 46 | G84: 13 | H84: 5 | I84: =G84*6+H84 -> 83 | K84: 17 | L84: 5 | M84: =K84*6+L84 -> 107 | O84: 20 | P84: 8 | Q84: =O84*6+P84 -> 128 | S84: BEACH ROAD | W84: OAKLEIGH | X84: 2 | Y84: 0 | Z84: 0 | AA84: 187 | AB84: 160 | AC84: 116.875 | AD84: 8
A85: PORT MELBOURNE | C85: 6 | D85: 0 | E85: =C85*6+D85 -> 36 | G85: 12 | H85: 3 | I85: =G85*6+H85 -> 75 | K85: 17 | L85: 4 | M85: =K85*6+L85 -> 106 | O85: 20 | P85: 5 | Q85: =O85*6+P85 -> 125 | S85: CLEARY | W85: COBURG | X85: 1 | Y85: 1 | Z85: 0 | AA85: 212 | AB85: 163 | AC85: 130.06134969325154 | AD85: 4
A86: BEST PLAYERS | W86: PORT MELBOURNE | X86: 1 | Y86: 1 | Z86: 0 | AA86: 231 | AB86: 203 | AC86: 113.79310344827586 | AD86: 4
A87: SANDRINGHAM | C87: B HARPER | F87: BENCRAFT | I87: HISCOCK | L87: RUSSELL | O87: CERINI | Q87: GRAMBEAU | W87: PRESTON | X87: 1 | Y87: 1 | Z87: 0 | AA87: 198 | AB87: 176 | AC87: 112.5 | AD87: 4
A88: PORT MELBOURNE | C88: AUSTIN | F88: DRINAN | I88: RAMSAY | L88: CARIS | O88: STOREY | Q88: CLEARY | W88: BRUNSWICK | X88: 1 | Y88: 1 | Z88: 0 | AA88: 136 | AB88: 144 | AC88: 94.44 | AD88: 4
A89: GOALKICKERS | W89: BRIGHTON | X89: 0 | Y89: 2 | Z89: 0 | AA89: 153 | AB89: 171 | AC89: 89.473684210526315 | AD89: 0
A90: SANDRINGHAM | C90: B HARPER 9 | F90: BENCRAFT 4 | I90: RUSSELL 3 | L90: JONES 2 | N90: HISCOCK | P90: GRAMBEAU | W90: MOORABBIN | X90: 0 | Y90: 2 | Z90: 0 | AA90: 143 | AB90: 244 | AC90: 58.606557377049178 | AD90: 0
A91: PORT MELBOURNE | C91: AUSTIN 5 | E91: CLEARY 4 | G91: WALSH 3 | I91: RAMSAY 3 | L91: McDONALD 2 | O91: PENDLEBURY | R91: CARIS | T91: MILLER | W91: CAMBERWELL | X91: 0 | Y91: 2 | Z91: 0 | AA91: 114 | AB91: 211 | AC91: 54.028436018957343 | AD91: 0
W92: BOX HILL | X92: 0 | Y92: 2 | Z92: 0 | AA92: 75 | AB92: 159 | AC92: 47.169811320754718 | AD92: 0
W93: YARRAVILLE | X93: 0 | Y93: 2 | Z93: 0 | AA93: 87 | AB93: 211 | AC93: 41.232227488151658 | AD93: 0
A94: PRAHRAN | C94: 5 | D94: 3 | E94: =C94*6+D94 -> 33 | G94: 10 | H94: 7 | I94: =G94*6+H94 -> 67 | K94: 11 | L94: 7 | M94: =K94*6+L94 -> 73 | O94: 13 | P94: 11 | Q94: =O94*6+P94 -> 89 | S94: TOORAK PARK
A95: BRIGHTON | C95: 4 | D95: 2 | E95: =C95*6+D95 -> 26 | G95: 6 | H95: 3 | I95: =G95*6+H95 -> 39 | K95: 9 | L95: 11 | M95: =K95*6+L95 -> 65 | O95: 10 | P95: 13 | Q95: =O95*6+P95 -> 73 | S95: MERRINGTON
A96: BEST PLAYERS
A97: PRAHRAN | C97: ARMSTRONG | F97: HARVEY | I97: YATES | L97: WALSH | N97: SHILLABEER | Q97: MASTERTON
A98: BRIGHTON | C98: FREEMAN | F98: E TURNER | I98: ADAMSON | L98: BURKE | N98: WILLS | Q98: NEW
A99: GOALKICKERS
A100: PRAHRAN | C100: WALSH 3 | F100: HARVEY 3 | I100: McCULLOCH 2 | L100: WOODS 2 | N100: ARMSTRONG | Q100: MORROW | T100: LENZ
A101: BRIGHTON | C101: WILLS 3 | F101: ADAMSON 2 | I101: HOWE 2 | K101: BURKE | M101: CLARKE | O101: MOLLOY
A103: COBURG | C103: 4 | D103: 1 | E103: =C103*6+D103 -> 25 | G103: 6 | H103: 4 | I103: =G103*6+H103 -> 40 | K103: 14 | L103: 7 | M103: =K103*6+L103 -> 91 | O103: 21 | P103: 11 | Q103: =O103*6+P103 -> 137 | S103: COBURG
A104: CAMBERWELL | C104: 3 | D104: 4 | E104: =C104*6+D104 -> 22 | G104: 4 | H104: 7 | I104: =G104*6+H104 -> 31 | K104: 6 | L104: 9 | M104: =K104*6+L104 -> 45 | O104: 8 | P104: 9 | Q104: =O104*6+P104 -> 57 | S104: WRIGHT
A105: BEST PLAYERS
A106: COBURG | C106: JAMES | E106: SPENCER | H106: FEWKES | J106: BRYAR | M106: ROGAN | Q106: EVANS
A107: CAMBERWELL | C107: BOHAN | E107: STUBBS | H107: McFEE | J107: ROCHFORD | M107: HORWILL | Q107: MILGATE
A108: GOALKICKERS
A109: COBURG | C109: JAMES 12 | F109: EVANS 4 | I109: BRYAR 3 | K109: LEVERSHA | M109: EGAN
A110: CAMBERWELL | C110: MILGATE 4 | F110: McFEE 3 | I110: SCHNEIDER
A112: BRUNSWICK | C112: 1 | D112: 5 | E112: =C112*6+D112 -> 11 | G112: 4 | H112: 11 | I112: =G112*6+H112 -> 35 | K112: 5 | L112: 11 | M112: =K112*6+L112 -> 41 | O112: 6 | P112: 13 | Q112: =O112*6+P112 -> 49 | S112: BOX HILL
A113: BOX HILL | C113: 0 | D113: 2 | E113: =C113*6+D113 -> 2 | G113: 0 | H113: 2 | I113: =G113*6+H113 -> 2 | K113: 3 | L113: 3 | M113: =K113*6+L113 -> 21 | O113: 3 | P113: 6 | Q113: =O113*6+P113 -> 24 | S113: IRVING
A114: BEST PLAYERS
A115: BRUNSWICK | C115: GEISLER | F115: TAYLOR | I115: YEA | K115: RADFORD | N115: PRIESTLEY | Q115: DUNSTAN
A116: BOX HILL | C116: BRISBANE | F116: CURTAIN | I116: MOLLER | K116: VANCE | N116: GREEN | Q116: KRONK
A117: GOALKICKERS
A118: BRUNSWICK | C118: MARCH 3 | F118: WEIR 2 | I118: SEYMOUR
A119: BOX HILL | C119: MAIDMENT 2 | G119: S PARKS
A121: OAKLEIGH | C121: 2 | D121: 1 | E121: =C121*6+D121 -> 13 | G121: 5 | H121: 6 | I121: =G121*6+H121 -> 36 | K121: 12 | L121: 7 | M121: =K121*6+L121 -> 79 | O121: 16 | P121: 9 | Q121: =O121*6+P121 -> 105 | S121: OAKLEIGH
A122: MOORABBIN | C122: 3 | D122: 3 | E122: =C122*6+D122 -> 21 | G122: 5 | H122: 9 | I122: =G122*6+H122 -> 39 | K122: 7 | L122: 11 | M122: =K122*6+L122 -> 53 | O122: 11 | P122: 14 | Q122: =O122*6+P122 -> 80 | S122: JOHNS
A123: BEST PLAYERS
A124: OAKLEIGH | C124: SCOTT | F124: EDWARDS | I124: PERKINS | K124: H WILLIAMS | N124: BOYLE | Q124: STREETER
A125: MOORABBIN | C125: RICHARDSON | F125: BLAIR | I125: COPSEY | K125: WILSON | N125: STOKES | Q125: ANTONIE
A126: GOALKICKERS
A127: OAKLEIGH | C127: J WATSON 3 | F127: EDWARDS 3 | I127: H WILLIAMS 3 | L127: SCOTT 2 | N127: HILL 2 | P127: PERKINS | R127: HOWELL | U127: STREETER
A128: MOORABBIN | C128: RICHARDSON 4 | F128: MURNANE 2 | I128: BAKER | K128: BLAIR | M128: WILSON | O128: McFARLANE | R128: ANTONIE
A130: NORTHCOTE | C130: 2 | D130: 8 | E130: =C130*6+D130 -> 20 | G130: 4 | H130: 9 | I130: =G130*6+H130 -> 33 | K130: 6 | L130: 13 | M130: =K130*6+L130 -> 49 | O130: 10 | P130: 16 | Q130: =O130*6+P130 -> 76 | S130: NORTHCOTE
A131: YARRAVILLE | C131: 1 | D131: 2 | E131: =C131*6+D131 -> 8 | G131: 3 | H131: 6 | I131: =G131*6+H131 -> 24 | K131: 6 | L131: 7 | M131: =K131*6+L131 -> 43 | O131: 6 | P131: 7 | Q131: =O131*6+P131 -> 43 | S131: ROBINSON
A132: BEST PLAYERS
A133: NORTHCOTE | C133: PAWSEY | F133: WHITECHURCH | J133: HISCOX | M133: BUTLER | O133: COLLINS | R133: BEST
A134: YARRAVILLE | C134: McCANN | F134: McASEY | J134: SEITZ | M134: SMITH | O134: ROHLEDER | R134: PHILLIPS
A135: GOALKICKERS
A136: NORTHCOTE | C136: PAWSEY 3 | F136: DUNGAN 2 | I136: STAFFORD | K136: COLLINS | M136: KINDER | O136: BUCKLEY | Q136: BEST
A137: YARRAVILLE | C137: PHILLIPS 2 | F137: MASON 2 | I137: McCANN 2
A139: ROUND 3 | E139: 5TH MAY | J139: WEATHER | O139: NORTH WIND DULL | S139: PLAYED AT
D140: 1ST QTR | H140: 2ND QTR | L140: 3RD QTR | P140: FINAL | S140: NORTHCOTE
A141: WILLIAMSTOWN | C141: 1 | D141: 4 | E141: =C141*6+D141 -> 10 | G141: 4 | H141: 5 | I141: =G141*6+H141 -> 29 | K141: 7 | L141: 8 | M141: =K141*6+L141 -> 50 | O141: 11 | P141: 9 | Q141: =O141*6+P141 -> 75 | S141: UMPIRE | X141: LADDER | AB141: ROUND | AD141: 3
A142: NORTHCOTE | C142: 5 | D142: 1 | E142: =C142*6+D142 -> 31 | G142: 6 | H142: 3 | I142: =G142*6+H142 -> 39 | K142: 9 | L142: 4 | M142: =K142*6+L142 -> 58 | O142: 10 | P142: 6 | Q142: =O142*6+P142 -> 66 | S142: CLEARY
A143: BEST PLAYERS | W143: TEAM | X143: W | Y143: L | Z143: D | AA143: FOR | AB143: AGST | AC143: % | AD143: PTS
A144: WILLIAMSTOWN | C144: WOOKEY | E144: WELLS | H144: MOLYNEUX | K144: WILLIAMS | N144: ABBERTON | Q144: DULLARD
A145: NORTHCOTE | C145: BEST | E145: PAWSEY | H145: WHITECHURCH | K145: DEANS | N145: McGREGOR | Q145: BRUNNEN | W145: WILLIAMSTOWN | X145: 3 | Y145: 0 | Z145: 0 | AA145: 335 | AB145: 198 | AC145: 169.1919191919192 | AD145: 12
A146: GOALKICKERS | W146: SANDRINGHAM | X146: 3 | Y146: 0 | Z146: 0 | AA146: 400 | AB146: 268 | AC146: 149.25373134328359 | AD146: 12
A147: WILLIAMSTOWN | C147: WALKER 4 | F147: ABBERTON 2 | I147: DULLARD 2 | L147: BARKER | N147: WOOKEY | P147: MOLYNEUX | W147: PRAHRAN | X147: 3 | Y147: 0 | Z147: 0 | AA147: 348 | AB147: 274 | AC147: 127.01 | AD147: 12
A148: NORTHCOTE | C148: BEST 4 | F148: COLLINS 2 | I148: McGREGOR | L148: BUCKLEY | N148: R WHITE | P148: WHITECHURCH | W148: COBURG | X148: 2 | Y148: 1 | Z148: 0 | AA148: 312 | AB148: 237 | AC148: 131.65 | AD148: 8
A150: PORT MELBOURNE | C150: 4 | D150: 7 | E150: =C150*6+D150 -> 31 | G150: 4 | H150: 14 | I150: =G150*6+H150 -> 38 | K150: 8 | L150: 16 | M150: =K150*6+L150 -> 64 | O150: 12 | P150: 18 | Q150: =O150*6+P150 -> 90 | S150: PORT MELBOURNE | W150: PORT MELBOURNE | X150: 2 | Y150: 1 | Z150: 0 | AA150: 321 | AB150: 245 | AC150: 131.0204081632653 | AD150: 8
A151: OAKLEIGH | C151: 2 | D151: 2 | E151: =C151*6+D151 -> 14 | G151: 2 | H151: 7 | I151: =G151*6+H151 -> 19 | K151: 3 | L151: 8 | M151: =K151*6+L151 -> 26 | O151: 5 | P151: 12 | Q151: =O151*6+P151 -> 42 | W151: NORTHCOTE | X151: 2 | Y151: 1 | Z151: 0 | AA151: 216 | AB151: 175 | AC151: 123.42857142857143 | AD151: 8
A152: BEST PLAYERS | W152: BRUNSWICK | X152: 2 | Y152: 1 | Z152: 0 | AA152: 208 | AB152: 198 | AC152: 105.05 | AD152: 8
A153: PORT MELBOURNE | C153: CLEARY | E153: STOREY | H153: WALSH | K153: McDONALD | N153: WILSON | Q153: JOHNSON | W153: OAKLEIGH | X153: 2 | Y153: 1 | Z153: 0 | AA153: 229 | AB153: 250 | AC153: 91.6 | AD153: 8
A154: OAKLEIGH | C154: PERKINS | E154: BOYLE | H154: JOHNSON | K154: EDWARDS | N154: HOWELL | Q154: STREETER | W154: BRIGHTON | X154: 1 | Y154: 2 | Z154: 0 | AA154: 317 | AB154: 218 | AC154: 145.41284403669724 | AD154: 4
A155: GOALKICKERS | W155: PRESTON | X155: 1 | Y155: 2 | Z155: 0 | AA155: 252 | AB155: 248 | AC155: 101.61290322580645 | AD155: 4
A156: PORT MELBOURNE | C156: WALSH 3 | F156: McDONALD 2 | I156: LEWIS 2 | K156: AUSTIN 2 | M156: CLEARY | O156: DOYLE | Q156: RAMSAY | W156: MOORABBIN | X156: 0 | Y156: 3 | Z156: 0 | AA156: 257 | AB156: 383 | AC156: 67.101827676240205 | AD156: 0
A157: OAKLEIGH | C157: J WATSON 2 | F157: STREETER | I157: EDWARDS | L157: HOWELL | W157: CAMBERWELL | X157: 0 | Y157: 3 | Z157: 0 | AA157: 194 | AB157: 344 | AC157: 56.395348837209305 | AD157: 0
W158: YARRAVILLE | X158: 0 | Y158: 3 | Z158: 0 | AA158: 161 | AB158: 311 | AC158: 51.77 | AD158: 0
A159: BRUNSWICK | C159: 1 | D159: 2 | E159: =C159*6+D159 -> 8 | G159: 4 | H159: 6 | I159: =G159*6+H159 -> 30 | K159: 9 | L159: 11 | M159: =K159*6+L159 -> 65 | O159: 10 | P159: 12 | Q159: =O159*6+P159 -> 72 | S159: BRUNSWICK | W159: BOX HILL | X159: 0 | Y159: 3 | Z159: 0 | AA159: 122 | AB159: 323 | AC159: 37.77089783281734 | AD159: 0
A160: PRESTON | C160: 4 | D160: 1 | E160: =C160*6+D160 -> 25 | G160: 5 | H160: 2 | I160: =G160*6+H160 -> 32 | K160: 5 | L160: 3 | M160: =K160*6+L160 -> 33 | O160: 8 | P160: 6 | Q160: =O160*6+P160 -> 54 | S160: RICHARDSON
A161: BEST PLAYERS
A162: BRUNSWICK | C162: SPENCER | F162: YEA | H162: RADFORD | K162: DELAHUNT | N162: BUTLER | Q162: McCORKELLE
A163: PRESTON | C163: L WALKER | F163: L SWEET | H163: PASCOE | K163: COOPER | N163: RUTHVEN | Q163: BRADFORD
A164: GOALKICKERS
A165: BRUNSWICK | C165: SPENCER 4 | F165: JONES 2 | H165: DUNSTAN | J165: DELAHUNT | M165: WEIR | O165: YEA
A166: PRESTON | C166: BRADFORD 3 | F166: G WALKER 3 | I166: L SWEET | K166: RUTHVEN
A168: BRIGHTON | C168: 3 | D168: 3 | E168: =C168*6+D168 -> 21 | G168: 14 | H168: 13 | I168: =G168*6+H168 -> 97 | K168: 15 | L168: 17 | M168: =K168*6+L168 -> 107 | O168: 23 | P168: 26 | Q168: =O168*6+P168 -> 164 | S168: ELSTERNWICK PARK
A169: BOX HILL | C169: 3 | D169: 3 | E169: =C169*6+D169 -> 21 | G169: 3 | H169: 4 | I169: =G169*6+H169 -> 22 | K169: 6 | L169: 11 | M169: =K169*6+L169 -> 47 | O169: 6 | P169: 11 | Q169: =O169*6+P169 -> 47 | S169: WRIGHT
A170: BEST PLAYERS
A171: BRIGHTON | C171: CONDON | E171: NEW | H171: HOWE | K171: BURKE | N171: WILLS | Q171: MARINI
A172: BOX HILL | C172: GREEN | E172: W COGHLAN | H172: HOUGHTON | K172: S PARKS | N172: NICHOLLS | Q172: MOLLER
A173: GOALKICKERS
A174: BRIGHTON | C174: CONDON 7 | F174: BURKE 4 | H174: ADAMSON 4 | K174: HOWE 2 | M174: PICKERING 2 | P174: WILLS | R174: MARINI | U174: NEW | W174: LE GRIFFIN
A175: BOX HILL | C175: S PARKS 2 | F175: MIHAN | H175: MOLLER | J175: MAIDMENT | M175: HOUGHTON
A177: PRAHRAN | C177: 4 | D177: 1 | E177: =C177*6+D177 -> 25 | G177: 10 | H177: 5 | I177: =G177*6+H177 -> 65 | K177: 14 | L177: 7 | M177: =K177*6+L177 -> 91 | O177: 21 | P177: 13 | Q177: =O177*6+P177 -> 139 | S177: CHELT
A178: MOORABBIN | C178: 6 | D178: 8 | E178: =C178*6+D178 -> 44 | G178: 9 | H178: 10 | I178: =G178*6+H178 -> 64 | K178: 12 | L178: 17 | M178: =K178*6+L178 -> 89 | O178: 16 | P178: 18 | Q178: =O178*6+P178 -> 114 | S178: BOWDEN
A179: BEST PLAYERS
A180: PRAHRAN | C180: McCOMSKIE | F180: YATES | I180: McCULLOCH | L180: WALSH | N180: KRUSE | Q180: ARMSTRONG
A181: MOORABBIN | C181: STOKES | F181: ARNFIELD | I181: MURNANE | L181: BOYD | N181: JACOBS | Q181: BLAIR
A182: GOALKICKERS
A183: PRAHRAN | C183: McCULLOCH 5 | F183: WALSH 3 | I183: HARVEY 3 | K183: KRUSE 2 | M183: McCOMSKIE 2 | P183: BURGESS 2 | R183: SHILLABEER 2 | W183: HAWKINS | X183: MORROW
A184: MOORABBIN | C184: BLAIR 4 | E184: WILSON 3 | G184: ARNFIELD 2 | J184: BOYD 2 | L184: PHILLIPS | N184: MURNANE | Q184: PARNELL | S184: ANTONIE | V184: BAKER
A186: COBURG | C186: 2 | D186: 0 | E186: =C186*6+D186 -> 12 | G186: 8 | H186: 2 | I186: =G186*6+H186 -> 50 | K186: 8 | L186: 4 | M186: =K186*6+L186 -> 52 | O186: 15 | P186: 10 | Q186: =O186*6+P186 -> 100 | S186: YARRAVILLE
A187: YARRAVILLE | C187: 5 | D187: 8 | E187: =C187*6+D187 -> 38 | G187: 5 | H187: 9 | I187: =G187*6+H187 -> 39 | K187: 7 | L187: 20 | M187: =K187*6+L187 -> 62 | O187: 9 | P187: 20 | Q187: =O187*6+P187 -> 74 | S187: JOHNS
A188: BEST PLAYERS
A189: COBURG | C189: EQUID | E189: ROGAN | H189: GILBERT | K189: BRYAR | N189: FEWKES | Q189: SPENCER
A190: YARRAVILLE | C190: SEITZ | E190: NICHOLLS | H190: MASON | K190: JONES | N190: SALT | Q190: McASEY
A191: GOALKICKERS
A192: COBURG | C192: BURMEISTER 3 | F192: ROGAN 2 | H192: BRYAR 2 | J192: JAMES 2 | L192: STARBUCK 2 | O192: EQUID | Q192: GILBERT | S192: EGAN | U192: R WILKINSON
A193: YARRAVILLE | C193: MASON 3 | F193: McCANN 2 | I193: McASEY | K193: SEITZ | M193: SALT | O193: HICKEY
A195: SANDRINGHAM | C195: 4 | D195: 0 | E195: =C195*6+D195 -> 24 | G195: 12 | H195: 3 | I195: =G195*6+H195 -> 75 | K195: 13 | L195: 3 | M195: =K195*6+L195 -> 81 | O195: 21 | P195: 7 | Q195: =O195*6+P195 -> 133 | S195: CAMBERWELL
A196: CAMBERWELL | C196: 1 | D196: 4 | E196: =C196*6+D196 -> 10 | G196: 4 | H196: 6 | I196: =G196*6+H196 -> 30 | K196: 10 | L196: 11 | M196: =K196*6+L196 -> 71 | O196: 11 | P196: 14 | Q196: =O196*6+P196 -> 80 | S196: IRVING
A197: BEST PLAYERS
A198: SANDRINGHAM | C198: B HARPER | F198: GRAMBEAU | I198: RUSSELL | L198: R HARPER | O198: BENCRAFT | R198: HANMAN
A199: CAMBERWELL | C199: ROHFORD | F199: McFEE | I199: I McLELLAN | L199: MILGATE | O199: KANE | R199: HEATLEY
A200: GOALKICKERS
A201: SANDRINGHAM | C201: B HARPER 9 | F201: BENCRAFT 3 | I201: GRAMBEAU 3 | L201: RUSSELL 2 | N201: R HARPER 2 | Q201: WALKER | S201: CERINI
A202: CAMBERWELL | C202: MILGATE 4 | F202: McFEE 4 | H202: MOORE | J202: I McLELLAN | M202: BOHAN
A204: ROUND 4 | E204: 12TH MAY | J204: WEATHER | O204: NORTH WEST WIND | S204: PLAYED AT
D205: 1ST QTR | H205: 2ND QTR | L205: 3RD QTR | P205: FINAL | S205: TOORAK PARK
A206: PORT MELBOURNE | C206: 1 | D206: 5 | E206: =C206*6+D206 -> 11 | G206: 7 | H206: 8 | I206: =G206*6+H206 -> 50 | K206: 8 | L206: 9 | M206: =K206*6+L206 -> 57 | O206: 13 | P206: 14 | Q206: =O206*6+P206 -> 92 | S206: UMPIRE | X206: LADDER | AB206: ROUND | AD206: 4
A207: PRAHRAN | C207: 2 | D207: 3 | E207: =C207*6+D207 -> 15 | G207: 2 | H207: 5 | I207: =G207*6+H207 -> 17 | K207: 6 | L207: 8 | M207: =K207*6+L207 -> 44 | O207: 9 | P207: 8 | Q207: =O207*6+P207 -> 62 | S207: JOHNS
A208: BEST PLAYERS | W208: TEAM | X208: W | Y208: L | Z208: D | AA208: FOR | AB208: AGST | AC208: % | AD208: PTS
A209: PORT MELBOURNE | C209: DRINAN | F209: AUSTIN | I209: WILSON | L209: S TUCKER | N209: RAMSAY | Q209: MULLANE
A210: PRAHRAN | C210: WALSH | F210: MORROW | I210: MASTERTON | L210: YATES | N210: ARMSTRONG | Q210: BURGESS | W210: WILLIAMSTOWN | X210: 4 | Y210: 0 | Z210: 0 | AA210: 437 | AB210: 270 | AC210: 161.85185185185185 | AD210: 16
A211: GOALKICKERS | W211: SANDRINGHAM | X211: 4 | Y211: 0 | Z211: 0 | AA211: 518 | AB211: 330 | AC211: 156.96969696969697 | AD211: 16
A212: PORT MELBOURNE | C212: AUSTIN 5 | F212: McDONALD 4 | I212: WALSH 2 | K212: RAMSAY 2 | W212: PORT MELBOURNE | X212: 3 | Y212: 1 | Z212: 0 | AA212: 413 | AB212: 307 | AC212: 134.52768729641693 | AD212: 12
A213: PRAHRAN | C213: BURGESS 3 | F213: WALSH | H213: HARVEY | J213: ARMSTRONG | M213: McCOMSKIE | P213: JONES | R213: SHILLABEER | W213: NORTHCOTE | X213: 3 | Y213: 1 | Z213: 0 | AA213: 293 | AB213: 251 | AC213: 116.73306772908367 | AD213: 12
A215: NORTHCOTE | C215: 5 | D215: 4 | E215: =C215*6+D215 -> 34 | G215: 6 | H215: 6 | I215: =G215*6+H215 -> 42 | K215: 10 | L215: 10 | M215: =K215*6+L215 -> 70 | O215: 11 | P215: 11 | Q215: =O215*6+P215 -> 77 | S215: COBURG | W215: PRAHRAN | X215: 3 | Y215: 1 | Z215: 0 | AA215: 410 | AB215: 366 | AC215: 112.02 | AD215: 12
A216: COBURG | C216: 1 | D216: 5 | E216: =C216*6+D216 -> 11 | G216: 3 | H216: 14 | I216: =G216*6+H216 -> 32 | K216: 5 | L216: 15 | M216: =K216*6+L216 -> 45 | O216: 9 | P216: 22 | Q216: =O216*6+P216 -> 76 | S216: RICHARDSON | W216: OAKLEIGH | X216: 3 | Y216: 1 | Z216: 0 | AA216: 338 | AB216: 313 | AC216: 107.98722044728434 | AD216: 12
A217: BEST PLAYERS | W217: BRIGHTON | X217: 2 | Y217: 2 | Z217: 0 | AA217: 436 | AB217: 302 | AC217: 144.37086092715231 | AD217: 8
A218: NORTHCOTE | C218: PAWSEY | E218: STABB | H218: POWELL | K218: McGREGOR | N218: WOOLNOUGH | Q218: HINES | W218: COBURG | X218: 2 | Y218: 2 | Z218: 0 | AA218: 388 | AB218: 314 | AC218: 123.57 | AD218: 8
A219: COBURG | C219: EVANS | E219: ROGAN | H219: BRYAR | K219: BURMEISTER | N219: SPENCER | Q219: STARBUCK | W219: BRUNSWICK | X219: 2 | Y219: 2 | Z219: 0 | AA219: 280 | AB219: 300 | AC219: 93.33 | AD219: 8
A220: GOALKICKERS | W220: PRESTON | X220: 1 | Y220: 3 | Z220: 0 | AA220: 336 | AB220: 367 | AC220: 91.553133514986371 | AD220: 4
A221: NORTHCOTE | C221: PAWSEY 5 | F221: KINDER 2 | I221: WHITECHURCH | L221: BEST | N221: STABB | P221: COLLINS | W221: MOORABBIN | X221: 1 | Y221: 3 | Z221: 0 | AA221: 353 | AB221: 451 | AC221: 78.270509977827047 | AD221: 4
A222: COBURG | C222: BRYAR 5 | F222: EVANS 2 | I222: JAMES | K222: EQUID | W222: CAMBERWELL | X222: 0 | Y222: 4 | Z222: 0 | AA222: 257 | AB222: 453 | AC222: 56.732891832229583 | AD222: 0
W223: YARRAVILLE | X223: 0 | Y223: 4 | Z223: 0 | AA223: 223 | AB223: 429 | AC223: 51.98 | AD223: 0
A224: WILLIAMSTOWN | C224: 5 | D224: 2 | E224: =C224*6+D224 -> 32 | G224: 9 | H224: 3 | I224: =G224*6+H224 -> 57 | K224: 13 | L224: 6 | M224: =K224*6+L224 -> 84 | O224: 15 | P224: 12 | Q224: =O224*6+P224 -> 102 | S224: WILLIAMSTOWN | W224: BOX HILL | X224: 0 | Y224: 4 | Z224: 0 | AA224: 190 | AB224: 419 | AC224: 45.346062052505964 | AD224: 0
A225: BRUNSWICK | C225: 3 | D225: 1 | E225: =C225*6+D225 -> 19 | G225: 6 | H225: 1 | I225: =G225*6+H225 -> 37 | K225: 10 | L225: 3 | M225: =K225*6+L225 -> 63 | O225: 11 | P225: 6 | Q225: =O225*6+P225 -> 72 | S225: MERRINGTON
A226: BEST PLAYERS
A227: WILLIAMSTOWN | C227: WOOKEY | F227: WALKER | I227: DULLARD | L227: WELLS | N227: MOLYNEUX | Q227: AULD
A228: BRUNSWICK | C228: SPENCER | F228: SEYMOUR | I228: POLLARD | L228: YEA | N228: GEISLER | Q228: DUNSTAN
A229: GOALKICKERS
A230: WILLIAMSTOWN | C230: WALKER 6 | F230: AULD 3 | I230: DULLARD 3 | L230: MOLYNEUX | O230: BARKER | Q230: ABBERTON
A231: BRUNSWICK | C231: SPENCER 4 | F231: DUNSTAN 3 | I231: WEIR 2 | K231: JONES | M231: SEYMOUR
A233: BRIGHTON | C233: 9 | D233: 4 | E233: =C233*6+D233 -> 58 | G233: 10 | H233: 7 | I233: =G233*6+H233 -> 67 | K233: 17 | L233: 11 | M233: =K233*6+L233 -> 113 | O233: 18 | P233: 11 | Q233: =O233*6+P233 -> 119 | S233: PTON
A234: PRESTON | C234: 0 | D234: 0 | E234: =C234*6+D234 -> 0 | G234: 3 | H234: 5 | I234: =G234*6+H234 -> 23 | K234: 5 | L234: 6 | M234: =K234*6+L234 -> 36 | O234: 12 | P234: 12 | Q234: =O234*6+P234 -> 84 | S234: IRVING
A235: BEST PLAYERS
A236: BRIGHTON | C236: CONDON | F236: HOWE | I236: MARINI | L236: ADAMSON | O236: E TURNER | R236: BURKE
A237: PRESTON | C237: BRADFORD | F237: L WALKER | I237: HARVEY | L237: HARRISON | O237: MEARS | R237: PASCOE
A238: GOALKICKERS
A239: BRIGHTON | C239: HOWE 4 | F239: CONDON 4 | I239: WILLS 3 | K239: ADAMSON 2 | N239: BURKE 2 | P239: MARINI | R239: PICKERING | U239: McASEY
A240: PRESTON | C240: HARVEY 4 | F240: BRADFORD 3 | I240: GOLDIN | K240: MEARS | M240: G WALKER | O240: JEFFREY | Q240: LAURIE
A242: OAKLEIGH | C242: 5 | D242: 3 | E242: =C242*6+D242 -> 33 | G242: 9 | H242: 4 | I242: =G242*6+H242 -> 58 | K242: 14 | L242: 8 | M242: =K242*6+L242 -> 92 | O242: 16 | P242: 13 | Q242: =O242*6+P242 -> 109 | S242: OAKLEIGH
A243: CAMBERWELL | C243: 2 | D243: 5 | E243: =C243*6+D243 -> 17 | G243: 4 | H243: 10 | I243: =G243*6+H243 -> 34 | K243: 7 | L243: 13 | M243: =K243*6+L243 -> 55 | O243: 8 | P243: 15 | Q243: =O243*6+P243 -> 63 | S243: WRIGHT
A244: BEST PLAYERS
A245: OAKLEIGH | C245: J WATSON | F245: TEMME | I245: LAMBERT | L245: SCOTT | O245: C WATSON | R245: SCULLIN
A246: CAMBERWELL | C246: McFEE | F246: MILGATE | I246: DUFF | L246: HEATLEY | O246: CARTER | R246: BENBOW
A247: GOALKICKERS
A248: OAKLEIGH | C248: J WATSON 7 | F248: SCOTT 3 | H248: LAMBERT 2 | K248: W WILLIAMS | N248: EDWARDS | Q248: WENN | S248: HOWELL
A249: CAMBERWELL | C249: MILGATE 5 | F249: McFEE | H249: BOHAN | K249: ROSENBROCK
A251: MOORABBIN | C251: 5 | D251: 5 | E251: =C251*6+D251 -> 35 | G251: 7 | H251: 9 | I251: =G251*6+H251 -> 51 | K251: 12 | L251: 16 | M251: =K251*6+L251 -> 88 | O251: 13 | P251: 18 | Q251: =O251*6+P251 -> 96 | S251: BOX HILL
A252: BOX HILL | C252: 0 | D252: 1 | E252: =C252*6+D252 -> 1 | G252: 5 | H252: 4 | I252: =G252*6+H252 -> 34 | K252: 6 | L252: 8 | M252: =K252*6+L252 -> 44 | O252: 9 | P252: 14 | Q252: =O252*6+P252 -> 68 | S252: CLEARY
A253: BEST PLAYERS
A254: MOORABBIN | C254: RICHARDSON | F254: BOYD | I254: ARNFIELD | L254: PARNELL | O254: CARPENTER | R254: HOCKING
A255: BOX HILL | C255: MAIDMENT | F255: W COGHLAN | I255: GREEN | L255: HOUGHTON | O255: HEALY | R255: S PARKS
A256: GOALKICKERS
A257: MOORABBIN | C257: RICHARDSON 4 | F257: BOYD 2 | H257: HOCKING 2 | J257: PARNELL 2 | M257: MURNANE | O257: STOKES | Q257: ARNFIELD
A258: BOX HILL | C258: S PARKS 3 | F258: GREEN | H258: HARWOOD | J258: CONQUIT | M258: W COGHLAN | P258: HENDERSON | S258: MAIDMENT
A260: SANDRINGHAM | C260: 5 | D260: 7 | E260: =C260*6+D260 -> 37 | G260: 7 | H260: 7 | I260: =G260*6+H260 -> 49 | K260: 13 | L260: 13 | M260: =K260*6+L260 -> 91 | O260: 17 | P260: 16 | Q260: =O260*6+P260 -> 118 | S260: BEACH ROAD
A261: YARRAVILLE | C261: 0 | D261: 0 | E261: =C261*6+D261 -> 0 | G261: 6 | H261: 3 | I261: =G261*6+H261 -> 39 | K261: 6 | L261: 3 | M261: =K261*6+L261 -> 39 | O261: 9 | P261: 8 | Q261: =O261*6+P261 -> 62 | S261: BOWDEN
A262: BEST PLAYERS
A263: SANDRINGHAM | C263: R HARPER | F263: BOURKE | I263: RUSSELL | L263: JONES | N263: BENCRAFT | Q263: GUILLE
A264: YARRAVILLE | C264: CRANAGE | F264: ROHLEDER | I264: SEITZ | L264: MASON | N264: BODSWORTH | Q264: SALT
A265: GOALKICKERS
A266: SANDRINGHAM | C266: RUSSELL 3 | F266: B HARPER 3 | I266: COLLINS 2 | K266: JONES 2 | M266: BENCRAFT 2 | P266: CERINI 2 | R266: BOURKE | U266: R HARPER | X266: GRAMBEAU
A267: YARRAVILLE | C267: SALT 2 | F267: THOMPSON 2 | I267: PHILLIPS | K267: MALBON | M267: TEASDALE | P267: BODSWORTH | S267: MASON
A269: ROUND 5 | E269: 19TH MAY | J269: WEATHER | O269: FINE & SUNNY | S269: PLAYED AT
D270: 1ST QTR | H270: 2ND QTR | L270: 3RD QTR | P270: FINAL | S270: NORTHCOTE
A271: SANDRINGHAM | C271: 1 | D271: 5 | E271: =C271*6+D271 -> 11 | G271: 3 | H271: 8 | I271: =G271*6+H271 -> 26 | K271: 7 | L271: 12 | M271: =K271*6+L271 -> 54 | O271: 9 | P271: 14 | Q271: =O271*6+P271 -> 68 | S271: UMPIRE | X271: LADDER | AB271: ROUND | AD271: 5
A272: NORTHCOTE | C272: 6 | D272: 2 | E272: =C272*6+D272 -> 38 | G272: 7 | H272: 4 | I272: =G272*6+H272 -> 46 | K272: 7 | L272: 8 | M272: =K272*6+L272 -> 50 | O272: 8 | P272: 11 | Q272: =O272*6+P272 -> 59 | S272: JOHNS
A273: BEST PLAYERS | W273: TEAM | X273: W | Y273: L | Z273: D | AA273: FOR | AB273: AGST | AC273: % | AD273: PTS
A274: SANDRINGHAM | C274: GRAMBEAU | F274: BENCRAFT | I274: GUILLE | L274: BOURKE | N274: RUSSELL | Q274: B HARPER
A275: NORTHCOTE | C275: BUCKLEY | F275: HISCOX | I275: McGREGOR | L275: PAWSEY | N275: COLLINS | Q275: K WHITECHURCH | W275: SANDRINGHAM | X275: 5 | Y275: 0 | Z275: 0 | AA275: 586 | AB275: 389 | AC275: 150.6426735218509 | AD275: 20
A276: GOALKICKERS | W276: WILLIAMSTOWN | X276: 5 | Y276: 0 | Z276: 0 | AA276: 511 | AB276: 341 | AC276: 149.85337243401759 | AD276: 20
A277: SANDRINGHAM | C277: B HARPER 4 | F277: COLLINS | H277: BENCRAFT | J277: BOURKE | L277: JOSEPHS | N277: CERINI | W277: PORT MELBOURNE | X277: 4 | Y277: 1 | Z277: 0 | AA277: 550 | AB277: 337 | AC277: 163.20474777448072 | AD277: 16
A278: NORTHCOTE | C278: PAWSEY 3 | F278: McGREGOR 2 | I278: K WHITECHURCH 2 | M278: KINDER | W278: PRAHRAN | X278: 4 | Y278: 1 | Z278: 0 | AA278: 518 | AB278: 434 | AC278: 119.35 | AD278: 16
A280: WILLIAMSTOWN | C280: 3 | D280: 3 | E280: =C280*6+D280 -> 21 | G280: 5 | H280: 6 | I280: =G280*6+H280 -> 36 | K280: 9 | L280: 9 | M280: =K280*6+L280 -> 63 | O280: 10 | P280: 14 | Q280: =O280*6+P280 -> 74 | S280: COBURG | W280: BRIGHTON | X280: 3 | Y280: 2 | Z280: 0 | AA280: 543 | AB280: 383 | AC280: 141.77545691906005 | AD280: 12
A281: COBURG | C281: 2 | D281: 1 | E281: =C281*6+D281 -> 13 | G281: 6 | H281: 4 | I281: =G281*6+H281 -> 40 | K281: 8 | L281: 8 | M281: =K281*6+L281 -> 56 | O281: 10 | P281: 11 | Q281: =O281*6+P281 -> 71 | S281: BAKER | W281: NORTHCOTE | X281: 3 | Y281: 2 | Z281: 0 | AA281: 352 | AB281: 319 | AC281: 110.34482758620689 | AD281: 12
A282: BEST PLAYERS | W282: OAKLEIGH | X282: 3 | Y282: 2 | Z282: 0 | AA282: 424 | AB282: 405 | AC282: 104.69135802469135 | AD282: 12
A283: WILLIAMSTOWN | C283: DULLARD | F283: SALVAS | I283: FEATHERBY | L283: MOLYNEUX | O283: AULD | Q283: GARDNER | W283: COBURG | X283: 2 | Y283: 3 | Z283: 0 | AA283: 459 | AB283: 388 | AC283: 118.3 | AD283: 8
A284: COBURG | C284: ROGAN | F284: CORNELL | I284: SPENCER | L284: HEWES | O284: FEWKES | Q284: WILSON | W284: PRESTON | X284: 2 | Y284: 3 | Z284: 0 | AA284: 473 | AB284: 462 | AC284: 102.38095238095238 | AD284: 8
A285: GOALKICKERS | W285: BRUNSWICK | X285: 2 | Y285: 3 | Z285: 0 | AA285: 361 | AB285: 407 | AC285: 88.7 | AD285: 8
A286: WILLIAMSTOWN | C286: WALKER 3 | F286: DULLARD 2 | I286: SALVAS | K286: ROBERTSON | N286: AULD | P286: WELLS | R286: BARKER | W286: MOORABBIN | X286: 1 | Y286: 4 | Z286: 0 | AA286: 448 | AB286: 588 | AC286: 76.19047619047619 | AD286: 4
A287: COBURG | C287: ROGAN 3 | F287: HEWES 2 | I287: EVANS | K287: WILSON | M287: BURMEISTER | P287: STARBUCK | R287: WALKER | W287: YARRAVILLE | X287: 1 | Y287: 4 | Z287: 0 | AA287: 315 | AB287: 515 | AC287: 61.17 | AD287: 4
W288: CAMBERWELL | X288: 0 | Y288: 5 | Z288: 0 | AA288: 325 | AB288: 561 | AC288: 57.932263814616753 | AD288: 0
A289: BRIGHTON | C289: 5 | D289: 3 | E289: =C289*6+D289 -> 33 | G289: 9 | H289: 6 | I289: =G289*6+H289 -> 60 | K289: 14 | L289: 9 | M289: =K289*6+L289 -> 93 | O289: 16 | P289: 11 | Q289: =O289*6+P289 -> 107 | S289: ELSTERNWICK PARK | W289: BOX HILL | X289: 0 | Y289: 5 | Z289: 0 | AA289: 220 | AB289: 556 | AC289: 39.568345323741006 | AD289: 0
A290: BRUNSWICK | C290: 2 | D290: 0 | E290: =C290*6+D290 -> 12 | G290: 6 | H290: 9 | I290: =G290*6+H290 -> 45 | K290: 8 | L290: 12 | M290: =K290*6+L290 -> 60 | O290: 11 | P290: 15 | Q290: =O290*6+P290 -> 81 | S290: IRVING
A291: BEST PLAYERS
A292: BRIGHTON | C292: G TURNER | F292: JOUBERT | I292: ADAMSON | L292: CONDON | O292: E TURNER | Q292: MARINI
A293: BRUNSWICK | C293: SPENCER | F293: NEILSON | I293: ARMSTRONG | L293: PRIESTLEY | O293: YEA | Q293: TAYLOR
A294: GOALKICKERS
A295: BRIGHTON | C295: CONDON 6 | F295: ADAMSON 5 | I295: MARINI 2 | L295: HOWE | N295: NEW | P295: BURKE
A296: BRUNSWICK | C296: SPENCER 5 | F296: STANLEY 2 | I296: ARMSTRONG 2 | L296: MAY | N296: BRENNAN
A298: PRESTON | C298: 2 | D298: 4 | E298: =C298*6+D298 -> 16 | G298: 8 | H298: 7 | I298: =G298*6+H298 -> 55 | K298: 12 | L298: 9 | M298: =K298*6+L298 -> 81 | O298: 21 | P298: 11 | Q298: =O298*6+P298 -> 137 | S298: CHELT
A299: MOORABBIN | C299: 3 | D299: 2 | E299: =C299*6+D299 -> 20 | G299: 7 | H299: 5 | I299: =G299*6+H299 -> 47 | K299: 10 | L299: 7 | M299: =K299*6+L299 -> 67 | O299: 14 | P299: 11 | Q299: =O299*6+P299 -> 95 | S299: RICHARDSON
A300: BEST PLAYERS
A301: PRESTON | C301: HARVEY | F301: RUTHVEN | I301: HENRYS | L301: PASCOE | O301: LAURIE | R301: GOLDIN
A302: MOORABBIN | C302: CARPENTER | F302: RICHARDSON | I302: COPSEY | L302: STOKES | O302: FARRELL | R302: HOCKING
A303: GOALKICKERS
A304: PRESTON | C304: HARVEY 10 | F304: RUTHVEN 4 | I304: CROCKER 2 | L304: BRADFORD 2 | O304: GOLDIN 2 | Q304: MEARS
A305: MOORABBIN | C305: ARNFIELD 4 | F305: RICHARDSON 4 | J305: HOCKING 2 | M305: WILSON | O305: STOKES | Q305: SMITH | S305: PARNELL
A307: PRAHRAN | C307: 3 | D307: 1 | E307: =C307*6+D307 -> 19 | G307: 5 | H307: 3 | I307: =G307*6+H307 -> 33 | K307: 8 | L307: 7 | M307: =K307*6+L307 -> 55 | O307: 16 | P307: 12 | Q307: =O307*6+P307 -> 108 | S307: CAMBERWELL
A308: CAMBERWELL | C308: 2 | D308: 3 | E308: =C308*6+D308 -> 15 | G308: 4 | H308: 4 | I308: =G308*6+H308 -> 28 | K308: 9 | L308: 7 | M308: =K308*6+L308 -> 61 | O308: 10 | P308: 8 | Q308: =O308*6+P308 -> 68 | S308: CLEARY
A309: BEST PLAYERS
A310: PRAHRAN | C310: KRUSE | E310: HARVEY | H310: McCOMSKIE | K310: CAMPBELL | N310: MORROW | Q310: MATSON
A311: CAMBERWELL | C311: DUFF | E311: MILGATE | H311: I McLELLAN | K311: BOHAN | N311: BURKEHALTER | Q311: SCHNEIDER
A312: GOALKICKERS
A313: PRAHRAN | C313: KRUSE 6 | F313: HARVEY 2 | I313: MORROW 2 | L313: McCOMSKIE 2 | O313: BURGESS 2 | R313: WALSH 2
A314: CAMBERWELL | C314: MILGATE 4 | F314: MOORE 3 | I314: BOHAN 2 | K314: HEATLEY
A316: YARRAVILLE | C316: 2 | D316: 1 | E316: =C316*6+D316 -> 13 | G316: 7 | H316: 6 | I316: =G316*6+H316 -> 48 | K316: 10 | L316: 10 | M316: =K316*6+L316 -> 70 | O316: 13 | P316: 14 | Q316: =O316*6+P316 -> 92 | S316: YARRAVILLE
A317: OAKLEIGH | C317: 3 | D317: 5 | E317: =C317*6+D317 -> 23 | G317: 6 | H317: 7 | I317: =G317*6+H317 -> 43 | K317: 7 | L317: 12 | M317: =K317*6+L317 -> 54 | O317: 12 | P317: 14 | Q317: =O317*6+P317 -> 86 | S317: WRIGHT
A318: BEST PLAYERS
A319: YARRAVILLE | C319: SALT | F319: GWYNNE | I319: HICKEY | K319: MASON | N319: PHILLIPS | Q319: CRANAGE
A320: OAKLEIGH | C320: J WATSON | F320: SCOTT | I320: HOWELL | K320: BOYLE | N320: TEMME | Q320: TINDAL
A321: GOALKICKERS
A322: YARRAVILLE | C322: HICKEY 4 | F322: BAGLIN 3 | I322: BODSWORTH 2 | L322: SALT | N322: MASON | P322: McCANN | R322: PHILLIPS
A323: OAKLEIGH | C323: J WATSON 4 | F323: SCOTT 2 | I323: HILL 2 | K323: LAMBERT | M323: EDWARDS | O323: WENN | Q323: C WATSON
A325: PORT MELBOURNE | C325: 5 | D325: 6 | E325: =C325*6+D325 -> 36 | G325: 9 | H325: 10 | I325: =G325*6+H325 -> 64 | K325: 14 | L325: 14 | M325: =K325*6+L325 -> 98 | O325: 19 | P325: 23 | Q325: =O325*6+P325 -> 137 | S325: PORT MELBOURNE
A326: BOX HILL | C326: 1 | D326: 4 | E326: =C326*6+D326 -> 10 | G326: 1 | H326: 9 | I326: =G326*6+H326 -> 15 | K326: 2 | L326: 10 | M326: =K326*6+L326 -> 22 | O326: 3 | P326: 12 | Q326: =O326*6+P326 -> 30 | S326: BOWDEN
A327: BEST PLAYERS
A328: PORT MELBOURNE | C328: JOHNSON | F328: MILLER | I328: CARIS | K328: CLEARY | N328: DOYLE | Q328: McDONALD
A329: BOX HILL | C329: W COGHLAN | F329: S PARKS | I329: KRONK | K329: MAIDMENT | N329: DUNCAN | Q329: VANCE
A330: GOALKICKERS
A331: PORT MELBOURNE | C331: McDONALD 5 | F331: RAMSAY 4 | I331: MILLER 4 | K331: DOYLE 3 | M331: CLEARY 2 | P331: WALSH
A332: BOX HILL | C332: MAIDMENT 2 | F332: W COGHLAN
A334: ROUND 6 | E334: 26TH MAY | J334: WEATHER | M334: NORTH WEST WIND COLD | S334: PLAYED AT
D335: 1ST QTR | H335: 2ND QTR | L335: 3RD QTR | P335: FINAL | S335: WILLIAMSTOWN
A336: BRIGHTON | C336: 2 | D336: 2 | E336: =C336*6+D336 -> 14 | G336: 5 | H336: 7 | I336: =G336*6+H336 -> 37 | K336: 8 | L336: 8 | M336: =K336*6+L336 -> 56 | O336: 8 | P336: 18 | Q336: =O336*6+P336 -> 66 | S336: UMPIRE | X336: LADDER | AB336: ROUND | AD336: 6
A337: WILLIAMSTOWN | C337: 2 | D337: 6 | E337: =C337*6+D337 -> 18 | G337: 4 | H337: 9 | I337: =G337*6+H337 -> 33 | K337: 6 | L337: 14 | M337: =K337*6+L337 -> 50 | O337: 8 | P337: 16 | Q337: =O337*6+P337 -> 64 | S337: WRIGHT
A338: BEST PLAYERS | W338: TEAM | X338: W | Y338: L | Z338: D | AA338: FOR | AB338: AGST | AC338: % | AD338: PTS
A339: BRIGHTON | C339: CONDON | F339: E TURNER | I339: BURKE | L339: NEW | N339: FREEMAN | Q339: PLUNKETT
A340: WILLIAMSTOWN | C340: DULLARD | F340: WELLS | I340: ROGERS | L340: AULD | N340: MOLYNEUX | Q340: SAMPSON | W340: SANDRINGHAM | X340: 6 | Y340: 0 | Z340: 0 | AA340: 687 | AB340: 452 | AC340: 151.99115044247787 | AD340: 24
A341: GOALKICKERS | W341: WILLIAMSTOWN | X341: 5 | Y341: 1 | Z341: 0 | AA341: 575 | AB341: 407 | AC341: 141.27764127764127 | AD341: 20
A342: BRIGHTON | C342: CONDON 4 | F342: MARINI | I342: ADAMSON | L342: WILLS | N342: HOWE | W342: PRAHRAN | X342: 5 | Y342: 1 | Z342: 0 | AA342: 618 | AB342: 517 | AC342: 119.54 | AD342: 20
A343: WILLIAMSTOWN | C343: DULLARD 3 | F343: GUNN 2 | I343: SALVAS | L343: AULD | N343: TAYLOR | W343: PORT MELBOURNE | X343: 4 | Y343: 1 | Z343: 1 | AA343: 615 | AB343: 402 | AC343: 152.98507462686567 | AD343: 18
A345: OAKLEIGH | C345: 2 | D345: 3 | E345: =C345*6+D345 -> 15 | G345: 5 | H345: 5 | I345: =G345*6+H345 -> 35 | K345: 9 | L345: 8 | M345: =K345*6+L345 -> 62 | O345: 13 | P345: 15 | Q345: =O345*6+P345 -> 93 | S345: OAKLEIGH | W345: BRIGHTON | X345: 4 | Y345: 2 | Z345: 0 | AA345: 609 | AB345: 447 | AC345: 136.24161073825502 | AD345: 16
A346: NORTHCOTE | C346: 0 | D346: 1 | E346: =C346*6+D346 -> 1 | G346: 0 | H346: 4 | I346: =G346*6+H346 -> 4 | K346: 2 | L346: 6 | M346: =K346*6+L346 -> 18 | O346: 4 | P346: 9 | Q346: =O346*6+P346 -> 33 | S346: BOWDEN | W346: OAKLEIGH | X346: 4 | Y346: 2 | Z346: 0 | AA346: 517 | AB346: 438 | AC346: 118.03652968036529 | AD346: 16
A347: BEST PLAYERS | W347: BRUNSWICK | X347: 3 | Y347: 3 | Z347: 0 | AA347: 434 | AB347: 442 | AC347: 98.19 | AD347: 12
A348: OAKLEIGH | C348: HILL | E348: WENN | H348: HOWELL | K348: PERKINS | N348: J WATSON | Q348: BOYLE | W348: NORTHCOTE | X348: 3 | Y348: 3 | Z348: 0 | AA348: 385 | AB348: 412 | AC348: 93.446601941747574 | AD348: 12
A349: NORTHCOTE | C349: HISCOX | E349: PAWSEY | H349: WHITECHURCH | K349: BUCKLEY | N349: FARRELL | Q349: MURPHY | W349: PRESTON | X349: 2 | Y349: 3 | Z349: 1 | AA349: 538 | AB349: 527 | AC349: 102.08728652751424 | AD349: 10
A350: GOALKICKERS | W350: COBURG | X350: 2 | Y350: 4 | Z350: 0 | AA350: 522 | AB350: 489 | AC350: 106.75 | AD350: 8
A351: OAKLEIGH | C351: J WATSON 4 | F351: EDWARDS 3 | I351: WENN 2 | K351: PERKINS 2 | N351: HILL | P351: RAWLINGS | W351: MOORABBIN | X351: 1 | Y351: 5 | Z351: 0 | AA351: 483 | AB351: 661 | AC351: 73.071104387291982 | AD351: 4
A352: NORTHCOTE | C352: McGREGOR 2 | F352: POWELL | H352: DUNGAN | W352: YARRAVILLE | X352: 1 | Y352: 5 | Z352: 0 | AA352: 398 | AB352: 615 | AC352: 64.72 | AD352: 4
W353: CAMBERWELL | X353: 1 | Y353: 5 | Z353: 0 | AA353: 385 | AB353: 602 | AC353: 63.95 | AD353: 4
A354: SANDRINGHAM | C354: 8 | D354: 8 | E354: =C354*6+D354 -> 56 | G354: 8 | H354: 8 | I354: =G354*6+H354 -> 56 | K354: 14 | L354: 16 | M354: =K354*6+L354 -> 100 | O354: 14 | P354: 17 | Q354: =O354*6+P354 -> 101 | S354: BEACH ROAD | W354: BOX HILL | X354: 0 | Y354: 6 | Z354: 0 | AA354: 261 | AB354: 616 | AC354: 42.37 | AD354: 0
A355: COBURG | C355: 1 | D355: 2 | E355: =C355*6+D355 -> 8 | G355: 4 | H355: 11 | I355: =G355*6+H355 -> 35 | K355: 4 | L355: 13 | M355: =K355*6+L355 -> 37 | O355: 7 | P355: 21 | Q355: =O355*6+P355 -> 63 | S355: RICHARDSON
A356: BEST PLAYERS
A357: SANDRINGHAM | C357: SHEARS | F357: BENCRAFT | I357: B HARPER | L357: BOURKE | N357: McGRATH | Q357: RUSSELL
A358: COBURG | C358: STARBUCK | F358: BALLANTYNE | I358: JONES | L358: SPENCER | N358: VARNEY | Q358: CORNELL
A359: GOALKICKERS
A360: SANDRINGHAM | C360: B HARPER 7 | F360: BENCRAFT 2 | I360: RUSSELL 2 | L360: BEARD | N360: COLLINS | Q360: HISCOCK
A361: COBURG | C361: BURMEISTER 2 | F361: BRYAR | H361: VARNEY | J361: JAMES | L361: BALLANTYNE | O361: WILSON
A363: PRESTON | C363: 2 | D363: 1 | E363: =C363*6+D363 -> 13 | G363: 7 | H363: 9 | I363: =G363*6+H363 -> 51 | K363: 8 | L363: 11 | M363: =K363*6+L363 -> 59 | O363: 9 | P363: 11 | Q363: =O363*6+P363 -> 65 | S363: PRESTON
A364: PORT MELBOURNE | C364: 6 | D364: 3 | E364: =C364*6+D364 -> 39 | G364: 7 | H364: 3 | I364: =G364*6+H364 -> 45 | K364: 10 | L364: 5 | M364: =K364*6+L364 -> 65 | O364: 10 | P364: 5 | Q364: =O364*6+P364 -> 65 | S364: MERRINGTON
A365: BEST PLAYERS
A366: PRESTON | C366: HARVEY | F366: NATHAN | I366: G WALKER | L366: BRADFORD | O366: LAURIE | Q366: MEARS
A367: PORT MELBOURNE | C367: CLEARY | F367: MILLER | I367: STOREY | L367: JOHNSON | O367: MURRAY | Q367: AUSTIN
A368: GOALKICKERS
A369: PRESTON | C369: HARVEY 3 | F369: MEARS 2 | I369: BRADFORD 2 | L369: F CHARD | N369: NATHAN
A370: PORT MELBOURNE | C370: AUSTIN 3 | F370: MILLER 2 | I370: STOREY 2 | L370: MURRAY | N370: LOWRIE | P370: WOODBRIDGE
A372: BRUNSWICK | C372: 3 | D372: 2 | E372: =C372*6+D372 -> 20 | G372: 4 | H372: 6 | I372: =G372*6+H372 -> 30 | K372: 7 | L372: 10 | M372: =K372*6+L372 -> 52 | O372: 10 | P372: 13 | Q372: =O372*6+P372 -> 73 | S372: BRUNSWICK
A373: MOORABBIN | C373: 1 | D373: 5 | E373: =C373*6+D373 -> 11 | G373: 3 | H373: 5 | I373: =G373*6+H373 -> 23 | K373: 4 | L373: 11 | M373: =K373*6+L373 -> 35 | O373: 4 | P373: 11 | Q373: =O373*6+P373 -> 35 | S373: CLEARY
A374: BEST PLAYERS
A375: BRUNSWICK | C375: PRIESTLEY | F375: SPENCER | I375: NEILSON | L375: DUNSTAN | O375: RADFORD | Q375: YEA
A376: MOORABBIN | C376: COPSEY | F376: STOKES | I376: BLAIR | L376: CARPENTER | O376: BOYD | Q376: GILDER
A377: GOALKICKERS
A378: BRUNSWICK | C378: SPENCER 6 | G378: DUNSTAN 4
A379: MOORABBIN | C379: RICHARDSON 3 | G379: STOKES
A381: PRAHRAN | C381: 2 | D381: 4 | E381: =C381*6+D381 -> 16 | G381: 7 | H381: 11 | I381: =G381*6+H381 -> 53 | K381: 7 | L381: 11 | M381: =K381*6+L381 -> 53 | O381: 14 | P381: 16 | Q381: =O381*6+P381 -> 100 | S381: TOORAK PARK
A382: YARRAVILLE | C382: 3 | D382: 5 | E382: =C382*6+D382 -> 23 | G382: 3 | H382: 6 | I382: =G382*6+H382 -> 24 | K382: 11 | L382: 11 | M382: =K382*6+L382 -> 77 | O382: 12 | P382: 11 | Q382: =O382*6+P382 -> 83 | S382: IRVING
A383: BEST PLAYERS
A384: PRAHRAN | C384: ARMSTRONG | F384: BUTLING | I384: HARVEY | K384: MORROW | N384: SHILLABEER | Q384: BURGESS
A385: YARRAVILLE | C385: McASEY | F385: ROHLEDER | I385: McCANN | K385: CRANAGE | N385: ELDRIDGE | Q385: MASON
A386: GOALKICKERS
A387: PRAHRAN | C387: HARVEY 5 | F387: MORROW 2 | I387: SHILLABEER 2 | L387: McCOMSKIE 2 | O387: BURGESS | Q387: KRUSE | S387: WORRALL
A388: YARRAVILLE | C388: HICKEY 3 | F388: MASON 3 | I388: PHILLIPS 3 | L388: BODSWORTH | O388: ROHLEDER | R388: BAGLIN
A390: CAMBERWELL | C390: 1 | D390: 2 | E390: =C390*6+D390 -> 8 | G390: 5 | H390: 7 | I390: =G390*6+H390 -> 37 | K390: 5 | L390: 11 | M390: =K390*6+L390 -> 41 | O390: 8 | P390: 12 | Q390: =O390*6+P390 -> 60 | S390: BOX HILL
A391: BOX HILL | C391: 3 | D391: 7 | E391: =C391*6+D391 -> 25 | G391: 3 | H391: 7 | I391: =G391*6+H391 -> 25 | K391: 5 | L391: 9 | M391: =K391*6+L391 -> 39 | O391: 5 | P391: 11 | Q391: =O391*6+P391 -> 41 | S391: MILNE
A392: BEST PLAYERS
A393: CAMBERWELL | C393: FLETCHER | F393: ROCHFORD | I393: MILGATE | L393: DUFF | N393: CALLAHAN | Q393: LUMSDEN
A394: BOX HILL | C394: W COGHLAN | F394: CURTAIN | I394: GREEN | L394: VANCE | N394: HOUGHTON | Q394: MIHAN
A395: GOALKICKERS
A396: CAMBERWELL | C396: MILGATE 4 | F396: SCHNEIDER 2 | I396: BOHAN | K396: FLETCHER
A397: BOX HILL | C397: W COGHLAN 2 | F397: GREEN | H397: MAIDMENT | K397: HOUGHTON
A399: ROUND 7 | E399: 2ND JUNE | J399: WEATHER | O399: FINE & SUNNY | S399: PLAYED AT
D400: 1ST QTR | H400: 2ND QTR | L400: 3RD QTR | P400: FINAL | S400: BEACH ROAD
A401: SANDRINGHAM | C401: 2 | D401: 2 | E401: =C401*6+D401 -> 14 | G401: 6 | H401: 7 | I401: =G401*6+H401 -> 43 | K401: 8 | L401: 11 | M401: =K401*6+L401 -> 59 | O401: 12 | P401: 16 | Q401: =O401*6+P401 -> 88 | S401: UMPIRE | X401: LADDER | AB401: ROUND | AD401: 7
A402: WILLIAMSTOWN | C402: 1 | D402: 6 | E402: =C402*6+D402 -> 12 | G402: 3 | H402: 8 | I402: =G402*6+H402 -> 26 | K402: 8 | L402: 11 | M402: =K402*6+L402 -> 59 | O402: 12 | P402: 12 | Q402: =O402*6+P402 -> 84 | S402: BOWDEN
A403: BEST PLAYERS | W403: TEAM | X403: W | Y403: L | Z403: D | AA403: FOR | AB403: AGST | AC403: % | AD403: PTS
A404: SANDRINGHAM | C404: MADSON | F404: BENCRAFT | I404: GRAMBEAU | L404: ANDRESON | O404: CERINI | Q404: B HARPER
A405: WILLIAMSTOWN | C405: WELLS | F405: G WILLIAMS | I405: DULLARD | L405: MOLYNEUX | O405: GUNN | Q405: SAMPSON | W405: SANDRINGHAM | X405: 7 | Y405: 0 | Z405: 0 | AA405: 775 | AB405: 536 | AC405: 144.58955223880596 | AD405: 28
A406: GOALKICKERS | W406: PORT MELBOURNE | X406: 5 | Y406: 1 | Z406: 1 | AA406: 745 | AB406: 457 | AC406: 163.01969365426694 | AD406: 22
A407: SANDRINGHAM | C407: B HARPER 3 | F407: BENCRAFT 2 | I407: BOURKE 2 | K407: RUSSELL | M407: HISCOCK | O407: BRIGHTON | Q407: COLLINS | S407: JOSEPHS | W407: BRIGHTON | X407: 5 | Y407: 2 | Z407: 0 | AA407: 736 | AB407: 535 | AC407: 137.57009345794393 | AD407: 20
A408: WILLIAMSTOWN | C408: DULLARD 3 | F408: GUNN 2 | H408: MOLYNEUX 2 | K408: BARKER | M408: WALKER | O408: TAYLOR | Q408: AULD | S408: WELLS | W408: OAKLEIGH | X408: 5 | Y408: 2 | Z408: 0 | AA408: 659 | AB408: 486 | AC408: 135.59670781893004 | AD408: 20
A410: PORT MELBOURNE | C410: 4 | D410: 6 | E410: =C410*6+D410 -> 30 | G410: 6 | H410: 11 | I410: =G410*6+H410 -> 47 | K410: 13 | L410: 17 | M410: =K410*6+L410 -> 95 | O410: 18 | P410: 22 | Q410: =O410*6+P410 -> 130 | S410: PORT MELBOURNE | W410: WILLIAMSTOWN | X410: 5 | Y410: 2 | Z410: 0 | AA410: 659 | AB410: 495 | AC410: 133.13131313131314 | AD410: 20
A411: BRUNSWICK | C411: 4 | D411: 4 | E411: =C411*6+D411 -> 28 | G411: 5 | H411: 7 | I411: =G411*6+H411 -> 37 | K411: 6 | L411: 9 | M411: =K411*6+L411 -> 45 | O411: 7 | P411: 13 | Q411: =O411*6+P411 -> 55 | S411: WRIGHT | W411: PRAHRAN | X411: 5 | Y411: 2 | Z411: 0 | AA411: 673 | AB411: 588 | AC411: 114.46 | AD411: 20
A412: BEST PLAYERS | W412: NORTHCOTE | X412: 4 | Y412: 3 | Z412: 0 | AA412: 456 | AB412: 467 | AC412: 97.644539614561026 | AD412: 16
A413: PORT MELBOURNE | C413: R ATKINSON | F413: MURRAY | I413: KELSEY | L413: WILSON | N413: MULLANE | Q413: McDONALD | W413: PRESTON | X413: 2 | Y413: 3 | Z413: 2 | AA413: 600 | AB413: 589 | AC413: 101.86757215619694 | AD413: 12
A414: BRUNSWICK | C414: NEILSON | F414: SPENCER | I414: SEYMOUR | L414: RYAN | N414: TAYLOR | Q414: GEISLER | W414: BRUNSWICK | X414: 3 | Y414: 4 | Z414: 0 | AA414: 489 | AB414: 572 | AC414: 85.49 | AD414: 12
A415: GOALKICKERS | P415: RAWLINGS | W415: COBURG | X415: 2 | Y415: 5 | Z415: 0 | AA415: 570 | AB415: 631 | AC415: 90.33 | AD415: 8
A416: PORT MELBOURNE | C416: McDONALD 3 | F416: AUSTIN 3 | H416: DOYLE 3 | J416: CLEARY 2 | M416: MILLER 2 | O416: JOHNSON 2 | R416: R ATKINSON 2 | W416: YARRAVILLE | X416: 2 | Y416: 5 | Z416: 0 | AA416: 546 | AB416: 643 | AC416: 84.91 | AD416: 8
A417: BRUNSWICK | C417: WEIR 2 | F417: DELAHUNT 2 | I417: SPENCER | K417: STANLEY | M417: DUNSTAN | W417: CAMBERWELL | X417: 1 | Y417: 5 | Z417: 1 | AA417: 447 | AB417: 664 | AC417: 67.32 | AD417: 6
W418: MOORABBIN | X418: 1 | Y418: 6 | Z418: 0 | AA418: 571 | AB418: 788 | AC418: 72.461928934010146 | AD418: 4
A419: NORTHCOTE | C419: 2 | D419: 0 | E419: =C419*6+D419 -> 12 | G419: 4 | H419: 2 | I419: =G419*6+H419 -> 26 | K419: 5 | L419: 5 | M419: =K419*6+L419 -> 35 | O419: 11 | P419: 5 | Q419: =O419*6+P419 -> 71 | S419: NORTHCOTE | W419: BOX HILL | X419: 0 | Y419: 7 | Z419: 0 | AA419: 289 | AB419: 764 | AC419: 37.83 | AD419: 0
A420: PRAHRAN | C420: 3 | D420: 4 | E420: =C420*6+D420 -> 22 | G420: 6 | H420: 7 | I420: =G420*6+H420 -> 43 | K420: 7 | L420: 11 | M420: =K420*6+L420 -> 53 | O420: 7 | P420: 13 | Q420: =O420*6+P420 -> 55 | S420: RICHARDSON
A421: BEST PLAYERS
A422: NORTHCOTE | C422: HISCOX | F422: PAWSEY | I422: McGREGOR | L422: ALDRIDGE | O422: E WHITE | Q422: WOOLNOUGH
A423: PRAHRAN | C423: MASTERTON | F423: CAMPBELL | I423: SHILLABEER | L423: COLLS | O423: BURGESS | Q423: ARMSTRONG
A424: GOALKICKERS
A425: NORTHCOTE | C425: DEANS 3 | F425: PAWSEY 2 | I425: E WHITE 2 | L425: KINDER 2 | O425: McGREGOR | R425: POWELL
A426: PRAHRAN | C426: BURGESS 2 | F426: KRUSE 2 | I426: SHILLABEER | L426: MASTERTON | O426: MORROW
A428: OAKLEIGH | C428: 6 | D428: 7 | E428: =C428*6+D428 -> 43 | G428: 12 | H428: 8 | I428: =G428*6+H428 -> 80 | K428: 17 | L428: 15 | M428: =K428*6+L428 -> 117 | O428: 20 | P428: 22 | Q428: =O428*6+P428 -> 142 | S428: COBURG
A429: COBURG | C429: 3 | D429: 0 | E429: =C429*6+D429 -> 18 | G429: 3 | H429: 4 | I429: =G429*6+H429 -> 22 | K429: 5 | L429: 5 | M429: =K429*6+L429 -> 35 | O429: 7 | P429: 6 | Q429: =O429*6+P429 -> 48 | S429: MERRINGTON
A430: BEST PLAYERS
A431: OAKLEIGH | C431: PERKINS | F431: SCOTT | I431: J WATSON | L431: WENN | O431: HOWELL | R431: STREETER
A432: COBURG | C432: ROGAN | F432: SPENCER | I432: CORNELL | L432: STARBUCK | O432: HEWES | R432: GILBERT
A433: GOALKICKERS
A434: OAKLEIGH | C434: J WATSON 7 | F434: STREETER 3 | I434: HILL 3 | K434: EDWARDS 2 | N434: WILLIAMS | Q434: SCOTT | S434: PERKINS | U434: BAXTER | X434: WENN
A435: COBURG | C435: EVANS 2 | F435: JAMES 2 | I435: HEWES | K435: VARNEY | M435: ROGAN
A437: BRIGHTON | C437: 8 | D437: 4 | E437: =C437*6+D437 -> 52 | G437: 11 | H437: 10 | I437: =G437*6+H437 -> 76 | K437: 16 | L437: 13 | M437: =K437*6+L437 -> 109 | O437: 18 | P437: 19 | Q437: =O437*6+P437 -> 127 | S437: CHELT
A438: MOORABBIN | C438: 2 | D438: 3 | E438: =C438*6+D438 -> 15 | G438: 5 | H438: 7 | I438: =G438*6+H438 -> 37 | K438: 7 | L438: 12 | M438: =K438*6+L438 -> 54 | O438: 12 | P438: 16 | Q438: =O438*6+P438 -> 88 | S438: MILNE
A439: BEST PLAYERS
A440: BRIGHTON | C440: BURKE | F440: CONDON | I440: PLUNKETT | L440: PERKINS | O440: CONROY | Q440: HALL
A441: MOORABBIN | C441: BOYD | F441: BLAIR | I441: HOCKING | L441: SMITH | O441: PARNELL | Q441: COPSEY
A442: GOALKICKERS
A443: BRIGHTON | C443: HALL 4 | F443: CONDON 3 | I443: ADAMSON 3 | L443: HOWE 2 | N443: MARINI 2 | Q443: BURKE 2 | S443: NEW | U443: PINDER
A444: MOORABBIN | C444: BOYD 3 | E444: SMITH 2 | G444: HOCKING 2 | J444: WILSON 2 | M444: PARNELL | O444: GODDEN | Q444: CARPENTER
A446: CAMBERWELL | C446: 1 | D446: 2 | E446: =C446*6+D446 -> 8 | G446: 3 | H446: 6 | I446: =G446*6+H446 -> 24 | K446: 3 | L446: 9 | M446: =K446*6+L446 -> 27 | O446: 8 | P446: 14 | Q446: =O446*6+P446 -> 62 | S446: CAMBERWELL
A447: PRESTON | C447: 2 | D447: 3 | E447: =C447*6+D447 -> 15 | G447: 3 | H447: 7 | I447: =G447*6+H447 -> 25 | K447: 7 | L447: 12 | M447: =K447*6+L447 -> 54 | O447: 8 | P447: 14 | Q447: =O447*6+P447 -> 62 | S447: JOHNS
A448: BEST PLAYERS
A449: CAMBERWELL | C449: ROCHFORD | F449: CALLAHAN | I449: DUFF | K449: LUMSDEN | N449: STUBBS | Q449: BENBOW
A450: PRESTON | C450: BRADFORD | F450: L WALKER | I450: R SHAW | K450: K CHARD | N450: HARVEY | Q450: LAURIE
A451: GOALKICKERS
A452: CAMBERWELL | C452: MILGATE 2 | F452: BOHAN 2 | I452: LUMSDEN 2 | L452: HAWKINS | N452: LOVETT
A453: PRESTON | C453: HARVEY 3 | F453: L SWEET 2 | I453: MEARS | K453: BRADFORD | N453: R SHAW
A455: YARRAVILLE | C455: 6 | D455: 2 | E455: =C455*6+D455 -> 38 | G455: 15 | H455: 5 | I455: =G455*6+H455 -> 95 | K455: 17 | L455: 9 | M455: =K455*6+L455 -> 111 | O455: 23 | P455: 10 | Q455: =O455*6+P455 -> 148 | S455: YARRAVILLE
A456: BOX HILL | C456: 0 | D456: 2 | E456: =C456*6+D456 -> 2 | G456: 0 | H456: 4 | I456: =G456*6+H456 -> 4 | K456: 3 | L456: 8 | M456: =K456*6+L456 -> 26 | O456: 3 | P456: 10 | Q456: =O456*6+P456 -> 28 | S456: CLEARY
A457: BEST PLAYERS
A458: YARRAVILLE | C458: MASON | F458: SALT | I458: ROHLEDER | L458: McCANN | O458: SEITZ | R458: HICKEY
A459: BOX HILL | C459: W COGHLAN | F459: KRONK | I459: BARROW | L459: VANCE | O459: MAIDMENT | R459: CURTAIN
A460: GOALKICKERS
A461: YARRAVILLE | C461: HICKEY 7 | F461: BODSWORTH 5 | J461: MASON 4 | M461: McCANN 3 | P461: SALT 2 | R461: GWYNNE | V461: ~
A462: BOX HILL | C462: MAIDMENT 2 | F462: HENDERSON
A464: ROUND 8 | E464: 9TH JUNE | J464: WEATHER | O464: FINE | S464: PLAYED AT
D465: 1ST QTR | H465: 2ND QTR | L465: 3RD QTR | P465: FINAL | S465: OAKLEIGH
A466: OAKLEIGH | C466: 4 | D466: 1 | E466: =C466*6+D466 -> 25 | G466: 9 | H466: 5 | I466: =G466*6+H466 -> 59 | K466: 12 | L466: 12 | M466: =K466*6+L466 -> 84 | O466: 20 | P466: 13 | Q466: =O466*6+P466 -> 133 | S466: UMPIRE | X466: LADDER | AB466: ROUND | AD466: 8
A467: SANDRINGHAM | C467: 1 | D467: 7 | E467: =C467*6+D467 -> 13 | G467: 5 | H467: 12 | I467: =G467*6+H467 -> 42 | K467: 10 | L467: 17 | M467: =K467*6+L467 -> 77 | O467: 16 | P467: 18 | Q467: =O467*6+P467 -> 114 | S467: CLEARY
A468: BEST PLAYERS | W468: TEAM | X468: W | Y468: L | Z468: D | AA468: FOR | AB468: AGST | AC468: % | AD468: PTS
A469: OAKLEIGH | C469: STREETER | F469: J WATSON | I469: BOYLE | K469: SCOTT | N469: PERKINS | Q469: W WILLIAMS
A470: SANDRINGHAM | C470: B HARPER | F470: BENCRAFT | I470: R HARPER | K470: RUSSELL | N470: COLLINS | Q470: GRAMBEAU | W470: SANDRINGHAM | X470: 7 | Y470: 1 | Z470: 0 | AA470: 889 | AB470: 669 | AC470: 132.88490284005979 | AD470: 28
A471: GOALKICKERS | W471: PORT MELBOURNE | X471: 6 | Y471: 1 | Z471: 1 | AA471: 855 | AB471: 519 | AC471: 164.73988439306359 | AD471: 26
A472: OAKLEIGH | C472: J WATSON 5 | F472: STREETER 5 | I472: SCOTT 2 | K472: HOWELL 2 | M472: HILL 2 | O472: JOHNSON | Q472: PERKINS | S472: RAWLINGS | W472: WILLIAMSTOWN | X472: 6 | Y472: 2 | Z472: 0 | AA472: 770 | AB472: 559 | AC472: 137.74597495527729 | AD472: 24
A473: SANDRINGHAM | C473: B HARPER 9 | F473: BENCRAFT 2 | I473: BOURKE 2 | K473: COLLINS | M473: RUSSELL | O473: RAEBURN | W473: OAKLEIGH | X473: 6 | Y473: 2 | Z473: 0 | AA473: 792 | AB473: 600 | AC473: 132 | AD473: 24
A475: PRAHRAN | C475: 4 | D475: 7 | E475: =C475*6+D475 -> 31 | G475: 11 | H475: 9 | I475: =G475*6+H475 -> 75 | K475: 17 | L475: 16 | M475: =K475*6+L475 -> 118 | O475: 22 | P475: 21 | Q475: =O475*6+P475 -> 153 | S475: TOORAK PARK | W475: PRAHRAN | X475: 6 | Y475: 2 | Z475: 0 | AA475: 826 | AB475: 703 | AC475: 117.5 | AD475: 24
A476: COBURG | C476: 4 | D476: 4 | E476: =C476*6+D476 -> 28 | G476: 11 | H476: 5 | I476: =G476*6+H476 -> 71 | K476: 15 | L476: 9 | M476: =K476*6+L476 -> 99 | O476: 17 | P476: 13 | Q476: =O476*6+P476 -> 115 | S476: BOWDEN | W476: BRIGHTON | X476: 5 | Y476: 3 | Z476: 0 | AA476: 798 | AB476: 645 | AC476: 123.72093023255815 | AD476: 20
A477: BEST PLAYERS | W477: NORTHCOTE | X477: 5 | Y477: 3 | Z477: 0 | AA477: 552 | AB477: 517 | AC477: 106.76982591876209 | AD477: 20
A478: PRAHRAN | C478: MORROW | F478: HARVEY | I478: WALSH | K478: LETTS | N478: BUTTLING | Q478: JONES | W478: PRESTON | X478: 3 | Y478: 3 | Z478: 2 | AA478: 715 | AB478: 652 | AC478: 109.66257668711657 | AD478: 16
A479: COBURG | C479: STARBUCK | F479: R WILKINSON | I479: ROGAN | K479: CORNELL | N479: WALKER | Q479: HEWES | W479: BRUNSWICK | X479: 4 | Y479: 4 | Z479: 0 | AA479: 585 | AB479: 625 | AC479: 93.6 | AD479: 16
A480: GOALKICKERS | K480: WOOD | M480: MASTERTON | P480: SHILLABEER | S480: MATSON | W480: COBURG | X480: 2 | Y480: 6 | Z480: 0 | AA480: 685 | AB480: 784 | AC480: 87.37 | AD480: 8
A481: PRAHRAN | C481: HARVEY 7 | E481: MORROW 3 | H481: LETTS 3 | J481: WORRALL 2 | M481: WALSH | O481: ARMSTRONG | R481: KRUSE | W481: YARRAVILLE | X481: 2 | Y481: 6 | Z481: 0 | AA481: 609 | AB481: 758 | AC481: 80.34 | AD481: 8
A482: COBURG | C482: ROGAN 4 | E482: BURMEISTER 4 | H482: JAMES 2 | J482: H WILKINSON 2 | N482: HEWES 2 | P482: EVANS 2 | R482: R WILKINSON | W482: CAMBERWELL | X482: 1 | Y482: 6 | Z482: 1 | AA482: 500 | AB482: 760 | AC482: 65.79 | AD482: 6
W483: MOORABBIN | X483: 1 | Y483: 7 | Z483: 0 | AA483: 635 | AB483: 899 | AC483: 70.634037819799772 | AD483: 4
A484: PRESTON | C484: 3 | D484: 4 | E484: =C484*6+D484 -> 22 | G484: 8 | H484: 8 | I484: =G484*6+H484 -> 56 | K484: 12 | L484: 11 | M484: =K484*6+L484 -> 83 | O484: 17 | P484: 13 | Q484: =O484*6+P484 -> 115 | S484: PRESTON | W484: BOX HILL | X484: 0 | Y484: 8 | Z484: 0 | AA484: 339 | AB484: 860 | AC484: 39.42 | AD484: 0
A485: YARRAVILLE | C485: 1 | D485: 4 | E485: =C485*6+D485 -> 10 | G485: 4 | H485: 5 | I485: =G485*6+H485 -> 29 | K485: 8 | L485: 6 | M485: =K485*6+L485 -> 54 | O485: 9 | P485: 9 | Q485: =O485*6+P485 -> 63 | S485: WRIGHT
A486: BEST PLAYERS
A487: PRESTON | C487: PRITCHARD | F487: BRADFORD | I487: HARVEY | L487: PASCOE | O487: K CHARD | Q487: RUTHVEN
A488: YARRAVILLE | C488: CRANAGE | F488: MASON | I488: JONES | L488: HARGREAVES | O488: McBEAN | Q488: McASEY
A489: GOALKICKERS
A490: PRESTON | C490: HARVEY 5 | F490: BRADFORD 4 | I490: F CHARD 4 | L490: K CHARD 2 | O490: NATHAN 2
A491: YARRAVILLE | C491: MASON 3 | F491: HICKEY 2 | I491: HARGREAVES 2 | L491: BODSWORTH | O491: TESTRAIL
A493: WILLIAMSTOWN | C493: 5 | D493: 6 | E493: =C493*6+D493 -> 36 | G493: 9 | H493: 15 | I493: =G493*6+H493 -> 69 | K493: 12 | L493: 18 | M493: =K493*6+L493 -> 90 | O493: 15 | P493: 21 | Q493: =O493*6+P493 -> 111 | S493: WILLIAMSTOWN
A494: MOORABBIN | C494: 4 | D494: 2 | E494: =C494*6+D494 -> 26 | G494: 6 | H494: 6 | I494: =G494*6+H494 -> 42 | K494: 8 | L494: 7 | M494: =K494*6+L494 -> 55 | O494: 9 | P494: 10 | Q494: =O494*6+P494 -> 64 | S494: MILNE
A495: BEST PLAYERS
A496: WILLIAMSTOWN | C496: MOLYNEUX | F496: FEATHERBY | I496: WALKER | L496: ABBERTON | O496: GUNN | Q496: ROGERS
A497: MOORABBIN | C497: ANDREW | F497: COPSEY | I497: GILBERT | L497: CARPENTER | O497: PARNELL | Q497: GILDER
A498: GOALKICKERS
A499: WILLIAMSTOWN | C499: WALKER 5 | F499: MOLYNEUX 4 | I499: GUNN 3 | K499: ABBERTON | N499: AULD | P499: WELLS
A500: MOORABBIN | C500: HOCKING 5 | F500: GODDEN 2 | I500: GILBERT | K500: BAKER
E501: 11TH JUNE | J501: KINGS BIRTHDAY | N501: WEATHER | R501: LIGHT RAIN
A502: PORT MELBOURNE | C502: 5 | D502: 4 | E502: =C502*6+D502 -> 34 | G502: 10 | H502: 7 | I502: =G502*6+H502 -> 67 | K502: 14 | L502: 10 | M502: =K502*6+L502 -> 94 | O502: 16 | P502: 14 | Q502: =O502*6+P502 -> 110 | S502: ELSTERNWICK PARK
A503: BRIGHTON | C503: 0 | D503: 2 | E503: =C503*6+D503 -> 2 | G503: 3 | H503: 5 | I503: =G503*6+H503 -> 23 | K503: 6 | L503: 7 | M503: =K503*6+L503 -> 43 | O503: 9 | P503: 8 | Q503: =O503*6+P503 -> 62 | S503: NORTHCOTE
A504: BEST PLAYERS
A505: PORT MELBOURNE | C505: DRINAN | F505: KELSEY | I505: STOREY | K505: MILLER | N505: MURRAY | Q505: S TUCKER
A506: BRIGHTON | C506: PLUNKETT | F506: E TURNER | I506: JOUBERT | K506: CONROY | N506: RIDDELL | Q506: NEW
A507: GOALKICKERS
A508: PORT MELBOURNE | C508: R ATKINSON 4 | F508: AUSTIN 4 | I508: DOYLE 3 | K508: MURRAY 2 | N508: JOHNSON | P508: CLEARY | R508: McDONALD
A509: BRIGHTON | C509: WILLS 2 | F509: BLACKMORE 2 | J509: NEW 2 | L509: PINDER 2 | N509: CONDON
A511: BRUNSWICK | C511: 3 | D511: 6 | E511: =C511*6+D511 -> 24 | G511: 6 | H511: 8 | I511: =G511*6+H511 -> 44 | K511: 12 | L511: 8 | M511: =K511*6+L511 -> 80 | O511: 14 | P511: 12 | Q511: =O511*6+P511 -> 96 | S511: BRUNSWICK
A512: CAMBERWELL | C512: 1 | D512: 0 | E512: =C512*6+D512 -> 6 | G512: 3 | H512: 3 | I512: =G512*6+H512 -> 21 | K512: 6 | L512: 5 | M512: =K512*6+L512 -> 41 | O512: 8 | P512: 5 | Q512: =O512*6+P512 -> 53 | S512: IRVING
A513: BEST PLAYERS
A514: BRUNSWICK | C514: STANLEY | F514: DUNSTAN | I514: TAYLOR | K514: BUTLER | N514: POLLARD | Q514: WEIR
A515: CAMBERWELL | C515: BOHAN | F515: BEDFORD | I515: LOVETT | K515: SCHNEIDER | N515: FLETCHER | Q515: STUBBS
A516: GOALKICKERS
A517: BRUNSWICK | C517: SPENCER 3 | F517: BUTLER 3 | I517: STANLEY 3 | L517: WEIR 2 | N517: DUNSTAN | P517: SEYMOUR | R517: THORNTON
A518: CAMBERWELL | C518: BOHAN 4 | F518: FLETCHER 2 | I518: MILGATE | K518: SCHNEIDER
A520: NORTHCOTE | C520: 2 | D520: 3 | E520: =C520*6+D520 -> 15 | G520: 5 | H520: 4 | I520: =G520*6+H520 -> 34 | K520: 8 | L520: 6 | M520: =K520*6+L520 -> 54 | O520: 14 | P520: 12 | Q520: =O520*6+P520 -> 96 | S520: BOX HILL
A521: BOX HILL | C521: 4 | D521: 1 | E521: =C521*6+D521 -> 25 | G521: 5 | H521: 3 | I521: =G521*6+H521 -> 33 | K521: 6 | L521: 7 | M521: =K521*6+L521 -> 43 | O521: 7 | P521: 8 | Q521: =O521*6+P521 -> 50 | S521: MERRINGTON
A522: BEST PLAYERS
A523: NORTHCOTE | C523: HISCOX | F523: McGREGOR | I523: DEANS | K523: KNOWLES | N523: CRADDOCK | Q523: PAWSEY
A524: BOX HILL | C524: W COGHLAN | F524: MIHAN | I524: GREEN | K524: MAIDMENT | N524: MURDOCK | Q524: CURTAIN
A525: GOALKICKERS
A526: NORTHCOTE | C526: CRADDOCK 3 | F526: PAWSEY 3 | I526: DEANS 3 | K526: KNOWLES | M526: FARRELL | O526: BUCKLEY | Q526: DUNGAN | T526: KINDER
A527: BOX HILL | C527: MAIDMENT 3 | F527: R THOMPSON | I527: KRONK | K527: W COGHLAN | N527: JACOBS
A529: ROUND 9 | E529: 16TH JUNE | J529: WEATHER | M529: SOUTH EAST BREEZE FINE | S529: PLAYED AT
D530: 1ST QTR | H530: 2ND QTR | L530: 3RD QTR | P530: FINAL | S530: OAKLEIGH
A531: OAKLEIGH | C531: 0 | D531: 4 | E531: =C531*6+D531 -> 4 | G531: 5 | H531: 8 | I531: =G531*6+H531 -> 38 | K531: 7 | L531: 10 | M531: =K531*6+L531 -> 52 | O531: 13 | P531: 12 | Q531: =O531*6+P531 -> 90 | S531: CAMBERWELL | X531: LADDER | AB531: ROUND | AD531: 9
A532: WILLIAMSTOWN | C532: 5 | D532: 6 | E532: =C532*6+D532 -> 36 | G532: 6 | H532: 8 | I532: =G532*6+H532 -> 44 | K532: 10 | L532: 14 | M532: =K532*6+L532 -> 74 | O532: 11 | P532: 15 | Q532: =O532*6+P532 -> 81 | S532: WRIGHT
A533: BEST PLAYERS | W533: TEAM | X533: W | Y533: L | Z533: D | AA533: FOR | AB533: AGST | AC533: % | AD533: PTS
A534: OAKLEIGH | C534: RAWLINGS | F534: POWER | I534: TEMME | K534: TINDAL | N534: BOYLE | Q534: J WATSON
A535: WILLIAMSTOWN | C535: G WILLIAMS | F535: WELLS | I535: DULLARD | K535: MOLYNEUX | N535: WALKER | Q535: WOOKEY | W535: SANDRINGHAM | X535: 8 | Y535: 1 | Z535: 0 | AA535: 971 | AB535: 712 | AC535: 136.37640449438203 | AD535: 32
A536: GOALKICKERS | W536: PORT MELBOURNE | X536: 7 | Y536: 1 | Z536: 1 | AA536: 993 | AB536: 586 | AC536: 169.45392491467578 | AD536: 30
A537: OAKLEIGH | C537: J WATSON 4 | F537: HILL 3 | H537: SCOTT 2 | J537: RAWLINGS | M537: STREETER | O537: EDWARDS | Q537: JOHNSON | W537: OAKLEIGH | X537: 7 | Y537: 2 | Z537: 0 | AA537: 882 | AB537: 681 | AC537: 129.51541850220264 | AD537: 28
A538: WILLIAMSTOWN | C538: WALKER 4 | F538: AULD 2 | H538: DULLARD 2 | K538: DUNN | M538: MOLYNEUX | P538: W WILLIAMS | W538: WILLIAMSTOWN | X538: 6 | Y538: 3 | Z538: 0 | AA538: 851 | AB538: 649 | AC538: 131.12480739599383 | AD538: 24
A540: SANDRINGHAM | C540: 1 | D540: 4 | E540: =C540*6+D540 -> 10 | G540: 3 | H540: 5 | I540: =G540*6+H540 -> 23 | K540: 8 | L540: 6 | M540: =K540*6+L540 -> 54 | O540: 12 | P540: 10 | Q540: =O540*6+P540 -> 82 | S540: BEACH ROAD | W540: BRIGHTON | X540: 6 | Y540: 3 | Z540: 0 | AA540: 910 | AB540: 736 | AC540: 123.64130434782609 | AD540: 24
A541: PRAHRAN | C541: 1 | D541: 3 | E541: =C541*6+D541 -> 9 | G541: 2 | H541: 8 | I541: =G541*6+H541 -> 20 | K541: 3 | L541: 11 | M541: =K541*6+L541 -> 29 | O541: 5 | P541: 13 | Q541: =O541*6+P541 -> 43 | S541: MILNE | W541: NORTHCOTE | X541: 6 | Y541: 3 | Z541: 0 | AA541: 635 | AB541: 567 | AC541: 111.99294532627866 | AD541: 24
A542: BEST PLAYERS | W542: PRAHRAN | X542: 6 | Y542: 3 | Z542: 0 | AA542: 869 | AB542: 785 | AC542: 110.7 | AD542: 24
A543: SANDRINGHAM | C543: RUSSELL | F543: GRAMBEAU | I543: BENCRAFT | L543: JONES | N543: HISCOCK | Q543: BRIGHTON | W543: PRESTON | X543: 3 | Y543: 4 | Z543: 2 | AA543: 765 | AB543: 735 | AC543: 104.08163265306122 | AD543: 16
A544: PRAHRAN | C544: BUTLING | F544: WORRALL | I544: CAMPBELL | L544: WALSH | N544: JONES | Q544: HARVEY | W544: BRUNSWICK | X544: 4 | Y544: 5 | Z544: 0 | AA544: 642 | AB544: 700 | AC544: 91.71 | AD544: 16
A545: GOALKICKERS | W545: COBURG | X545: 3 | Y545: 6 | Z545: 0 | AA545: 824 | AB545: 855 | AC545: 96.37 | AD545: 12
A546: SANDRINGHAM | C546: B HARPER 6 | F546: BENCRAFT 3 | I546: COLLINS | K546: BURRINGTON | N546: HANMAN | W546: YARRAVILLE | X546: 3 | Y546: 6 | Z546: 0 | AA546: 684 | AB546: 815 | AC546: 83.93 | AD546: 12
A547: PRAHRAN | C547: WORRALL 3 | F547: HARVEY | I547: BURGESS | W547: CAMBERWELL | X547: 1 | Y547: 7 | Z547: 1 | AA547: 591 | AB547: 872 | AC547: 67.78 | AD547: 6
W548: MOORABBIN | X548: 1 | Y548: 8 | Z548: 0 | AA548: 702 | AB548: 1037 | AC548: 67.695274831243978 | AD548: 4
A549: NORTHCOTE | C549: 3 | D549: 7 | E549: =C549*6+D549 -> 25 | G549: 4 | H549: 11 | I549: =G549*6+H549 -> 35 | K549: 8 | L549: 18 | M549: =K549*6+L549 -> 66 | O549: 10 | P549: 23 | Q549: =O549*6+P549 -> 83 | S549: NORTHCOTE | W549: BOX HILL | X549: 0 | Y549: 9 | Z549: 0 | AA549: 410 | AB549: 999 | AC549: 41.04 | AD549: 0
A550: PRESTON | C550: 2 | D550: 2 | E550: =C550*6+D550 -> 14 | G550: 5 | H550: 3 | I550: =G550*6+H550 -> 33 | K550: 6 | L550: 5 | M550: =K550*6+L550 -> 41 | O550: 7 | P550: 8 | Q550: =O550*6+P550 -> 50 | S550: CLEARY
A551: BEST PLAYERS
A552: NORTHCOTE | C552: McGREGOR | F552: DEANS | I552: STABB | L552: PAWSEY | N552: KNOWLES | Q552: WHITECHURCH
A553: PRESTON | C553: HENRYS | F553: F CHARD | I553: NATHAN | L553: HARVEY | N553: BRADFORD | Q553: CHISHOLM
A554: GOALKICKERS
A555: NORTHCOTE | C555: WHITECHURCH 2 | F555: DEANS 2 | H555: FARRELL 2 | J555: McGREGOR | M555: WOOLNOUGH | P555: PAWSEY | R555: CRADDOCK
A556: PRESTON | C556: F CHARD 2 | F556: RUTHVEN 2 | I556: HARVEY | K556: NATHAN | M556: BRADFORD
A558: YARRAVILLE | C558: 1 | D558: 3 | E558: =C558*6+D558 -> 9 | G558: 3 | H558: 5 | I558: =G558*6+H558 -> 23 | K558: 7 | L558: 7 | M558: =K558*6+L558 -> 49 | O558: 11 | P558: 9 | Q558: =O558*6+P558 -> 75 | S558: YARRAVILLE
A559: BRUNSWICK | C559: 1 | D559: 2 | E559: =C559*6+D559 -> 8 | G559: 3 | H559: 6 | I559: =G559*6+H559 -> 24 | K559: 6 | L559: 8 | M559: =K559*6+L559 -> 44 | O559: 8 | P559: 9 | Q559: =O559*6+P559 -> 57 | S559: MERRINGTON
A560: BEST PLAYERS
A561: YARRAVILLE | C561: CRANAGE | F561: McASEY | I561: MASON | L561: MURPHY | N561: HICKEY | Q561: SEITZ
A562: BRUNSWICK | C562: SPENCER | F562: WHELAN | I562: POLLARD | L562: NEILSON | N562: WEOR | Q562: TAYLOR
A563: GOALKICKERS
A564: YARRAVILLE | C564: HICKEY 6 | F564: LEES 3 | I564: BODSWORTH | L564: McCANN
A565: BRUNSWICK | C565: SPENCER 5 | F565: THORNTON | I565: McCALLUM | L565: BUTLER
A567: BRIGHTON | C567: 4 | D567: 8 | E567: =C567*6+D567 -> 32 | G567: 6 | H567: 10 | I567: =G567*6+H567 -> 46 | K567: 12 | L567: 13 | M567: =K567*6+L567 -> 85 | O567: 16 | P567: 16 | Q567: =O567*6+P567 -> 112 | S567: CAMBERWELL
A568: CAMBERWELL | C568: 4 | D568: 2 | E568: =C568*6+D568 -> 26 | G568: 7 | H568: 10 | I568: =G568*6+H568 -> 52 | K568: 9 | L568: 12 | M568: =K568*6+L568 -> 66 | O568: 13 | P568: 13 | Q568: =O568*6+P568 -> 91 | S568: BOWDEN
A569: BEST PLAYERS
A570: BRIGHTON | C570: CONDON | F570: PLUNKETT | I570: NEW | L570: MARINI | O570: PICKERING | R570: G TURNER
A571: CAMBERWELL | C571: LOVETT | F571: MARION | I571: HEATLEY | L571: BEDFORD | O571: BENBOW | R571: DUFF
A572: GOALKICKERS
A573: BRIGHTON | C573: NEW 5 | F573: CONDON 4 | I573: MARINI 2 | K573: HOWE 2 | M573: G TURNER | O573: CLARKE | Q573: MORRIS
A574: CAMBERWELL | C574: MOORE 3 | F574: MILGATE 3 | I574: DUFF | J574: ROSENBROCK | M574: STUBBS | O574: BEDFORD | Q574: MARION | S574: SCHNEIDER
A576: COBURG | C576: 3 | D576: 2 | E576: =C576*6+D576 -> 20 | G576: 9 | H576: 3 | I576: =G576*6+H576 -> 57 | K576: 14 | L576: 11 | M576: =K576*6+L576 -> 95 | O576: 21 | P576: 13 | Q576: =O576*6+P576 -> 139 | S576: COBURG
A577: BOX HILL | C577: 2 | D577: 3 | E577: =C577*6+D577 -> 15 | G577: 4 | H577: 11 | I577: =G577*6+H577 -> 35 | K577: 6 | L577: 15 | M577: =K577*6+L577 -> 51 | O577: 9 | P577: 17 | Q577: =O577*6+P577 -> 71 | S577: JOHNS
A578: BEST PLAYERS
A579: COBURG | C579: ROGAN | F579: FEWKES | I579: STARBUCK | L579: CORNELL | N579: GILBERT | Q579: HEWES
A580: BOX HILL | C580: GREEN | F580: N THOMPSON | I580: VANCE | L580: MIHAN | N580: W COGHLAN | Q580: HOUGHTON
A581: GOALKICKERS
A582: COBURG | C582: BURMEISTER 5 | F582: EVANS 4 | H582: ROGAN 3 | J582: HEWES 3 | L582: VARNEY 2 | N582: R WILKINSON 2 | R582: H WILKINSON | V582: JAMES
A583: BOX HILL | C583: MAIDMENT 2 | F583: MIHAN 2 | I583: WRIGHT 2 | K583: W COGHLAN | N583: THOMPSON | Q583: VANCE
A585: PORT MELBOURNE | C585: 0 | D585: 3 | E585: =C585*6+D585 -> 3 | G585: 7 | H585: 15 | I585: =G585*6+H585 -> 57 | K585: 15 | L585: 17 | M585: =K585*6+L585 -> 107 | O585: 20 | P585: 18 | Q585: =O585*6+P585 -> 138 | S585: PORT MELBOURNE
A586: MOORABBIN | C586: 3 | D586: 4 | E586: =C586*6+D586 -> 22 | G586: 3 | H586: 5 | I586: =G586*6+H586 -> 23 | K586: 6 | L586: 10 | M586: =K586*6+L586 -> 46 | O586: 9 | P586: 13 | Q586: =O586*6+P586 -> 67 | S586: IRVING
A587: BEST PLAYERS
A588: PORT MELBOURNE | C588: WILSON | F588: MULLANE | I588: MURRAY | K588: JOHNSON | N588: DRINAN | Q588: ATKINSON
A589: MOORABBIN | C589: STOKES | F589: ANDREW | I589: D'OLIVER | K589: BLAIR | N589: HOCKING | Q589: GILDER
A590: GOALKICKERS
A591: PORT MELBOURNE | C591: AUSTIN 5 | F591: MURRAY 5 | I591: ATKINSON 4 | L591: DOYLE 3 | N591: McDONALD 2 | Q591: MILLER
A592: MOORABBIN | C592: BLAIR 2 | F592: HOCKING 2 | I592: CARPENTER 2 | L592: SMITH | N592: WILSON | P592: TOBIN
A594: ROUND 10 | E594: 23RD JUNE | J594: WEATHER | M594: NORTH WEST BREEZE DULL | S594: PLAYED AT
D595: 1ST QTR | H595: 2ND QTR | L595: 3RD QTR | P595: FINAL | S595: WILLIAMSTOWN
A596: WILLIAMSTOWN | C596: 4 | D596: 2 | E596: =C596*6+D596 -> 26 | G596: 7 | H596: 5 | I596: =G596*6+H596 -> 47 | K596: 8 | L596: 7 | M596: =K596*6+L596 -> 55 | O596: 13 | P596: 9 | Q596: =O596*6+P596 -> 87 | S596: UMPIRE | X596: LADDER | AB596: ROUND | AD596: 10
A597: PORT MELBOURNE | C597: 1 | D597: 5 | E597: =C597*6+D597 -> 11 | G597: 3 | H597: 6 | I597: =G597*6+H597 -> 24 | K597: 4 | L597: 13 | M597: =K597*6+L597 -> 37 | O597: 9 | P597: 18 | Q597: =O597*6+P597 -> 72 | S597: BOWDEN
A598: BEST PLAYERS | W598: TEAM | X598: W | Y598: L | Z598: D | AA598: FOR | AB598: AGST | AC598: % | AD598: PTS
A599: WILLIAMSTOWN | C599: WALKER | F599: MOLYNEUX | I599: POOLE | K599: WELLS | N599: BARKER | Q599: SAMPSON
A600: PORT MELBOURNE | C600: DRINAN | F600: JOHNSON | I600: MILLER | K600: ATKINSON | N600: CLEARY | Q600: MULLANE | W600: SANDRINGHAM | X600: 9 | Y600: 1 | Z600: 0 | AA600: 1118 | AB600: 777 | AC600: 143.88674388674389 | AD600: 36
A601: GOALKICKERS | W601: PORT MELBOURNE | X601: 7 | Y601: 2 | Z601: 1 | AA601: 1065 | AB601: 673 | AC601: 158.24665676077265 | AD601: 30
A602: WILLIAMSTOWN | C602: WALKER 6 | F602: TAYLOR 2 | I602: DULLARD | K602: MOLYNEUX | N602: BARKER | P602: ABBERTON | S602: GUNN | W602: WILLIAMSTOWN | X602: 7 | Y602: 3 | Z602: 0 | AA602: 938 | AB602: 721 | AC602: 130.09708737864077 | AD602: 28
A603: PORT MELBOURNE | C603: MILLER 3 | F603: CLEARY 2 | I603: McDONALD 2 | L603: WALSH | N603: AUSTIN | W603: OAKLEIGH | X603: 7 | Y603: 3 | Z603: 0 | AA603: 946 | AB603: 773 | AC603: 122.38033635187581 | AD603: 28
A605: PRAHRAN | C605: 3 | D605: 2 | E605: =C605*6+D605 -> 20 | G605: 6 | H605: 10 | I605: =G605*6+H605 -> 46 | K605: 10 | L605: 17 | M605: =K605*6+L605 -> 77 | O605: 12 | P605: 20 | Q605: =O605*6+P605 -> 92 | S605: TOORAK PARK | W605: PRAHRAN | X605: 7 | Y605: 3 | Z605: 0 | AA605: 961 | AB605: 849 | AC605: 113.19 | AD605: 28
A606: OAKLEIGH | C606: 4 | D606: 5 | E606: =C606*6+D606 -> 29 | G606: 6 | H606: 5 | I606: =G606*6+H606 -> 41 | K606: 9 | L606: 8 | M606: =K606*6+L606 -> 62 | O606: 9 | P606: 10 | Q606: =O606*6+P606 -> 64 | S606: MERRINGTON | W606: NORTHCOTE | X606: 7 | Y606: 3 | Z606: 0 | AA606: 689 | AB606: 618 | AC606: 111.48867313915858 | AD606: 28
A607: BEST PLAYERS | W607: BRIGHTON | X607: 6 | Y607: 4 | Z607: 0 | AA607: 1016 | AB607: 847 | AC607: 119.95277449822905 | AD607: 24
A608: PRAHRAN | C608: CAMPBELL | F608: ARMSTRONG | I608: WALSH | K608: HARVEY | N608: BUTLING | Q608: WORRALL | W608: PRESTON | X608: 4 | Y608: 4 | Z608: 2 | AA608: 855 | AB608: 816 | AC608: 104.77941176470588 | AD608: 20
A609: OAKLEIGH | C609: HILL | F609: TINDAL | I609: POWER | K609: DALMAIN | N609: HOWELL | Q609: STREETER | W609: BRUNSWICK | X609: 4 | Y609: 6 | Z609: 0 | AA609: 693 | AB609: 754 | AC609: 91.91 | AD609: 16
A610: GOALKICKERS | Q610: JONES | W610: YARRAVILLE | X610: 4 | Y610: 6 | Z610: 0 | AA610: 795 | AB610: 921 | AC610: 86.32 | AD610: 16
A611: PRAHRAN | C611: MORROW 3 | F611: HARVEY 2 | I611: McCULLOCH 2 | L611: ELLIS | M611: WALSH | O611: SHILLABEER | R611: WORRALL | W611: COBURG | X611: 3 | Y611: 7 | Z611: 0 | AA611: 905 | AB611: 945 | AC611: 95.77 | AD611: 12
A612: OAKLEIGH | C612: JOHNSON 2 | F612: J WATSON 2 | I612: HILL 2 | K612: SCOTT | M612: STREETER | O612: C WATSON | W612: MOORABBIN | X612: 2 | Y612: 8 | Z612: 0 | AA612: 798 | AB612: 1118 | AC612: 71.37745974955277 | AD612: 8
W613: CAMBERWELL | X613: 1 | Y613: 8 | Z613: 1 | AA613: 672 | AB613: 968 | AC613: 69.42 | AD613: 6
A614: NORTHCOTE | C614: 3 | D614: 1 | E614: =C614*6+D614 -> 19 | G614: 3 | H614: 4 | I614: =G614*6+H614 -> 22 | K614: 5 | L614: 7 | M614: =K614*6+L614 -> 37 | O614: 7 | P614: 12 | Q614: =O614*6+P614 -> 54 | S614: BRUNSWICK | W614: BOX HILL | X614: 0 | Y614: 10 | Z614: 0 | AA614: 475 | AB614: 1146 | AC614: 41.45 | AD614: 0
A615: BRUNSWICK | C615: 3 | D615: 3 | E615: =C615*6+D615 -> 21 | G615: 6 | H615: 5 | I615: =G615*6+H615 -> 41 | K615: 6 | L615: 9 | M615: =K615*6+L615 -> 45 | O615: 7 | P615: 9 | Q615: =O615*6+P615 -> 51 | S615: WRIGHT
A616: BEST PLAYERS
A617: NORTHCOTE | C617: HISCOX | F617: POWELL | I617: PAWSEY | L617: KINDER | O617: CRADDOCK | R617: HINES
A618: BRUNSWICK | C618: WHELAN | F618: STANLEY | I618: POLLARD | L618: TAYLOR | O618: NEILSON | R618: MAY
A619: GOALKICKERS
A620: NORTHCOTE | C620: PAWSEY 3 | F620: WHITECHURCH | I620: BUCKLEY | K620: McGREGOR | N620: KNOWLES
A621: BRUNSWICK | C621: McFARLANE 4 | G621: WEIR | I621: MAY | K621: SPENCER
A623: PRESTON | C623: 2 | D623: 3 | E623: =C623*6+D623 -> 15 | G623: 6 | H623: 4 | I623: =G623*6+H623 -> 40 | K623: 9 | L623: 11 | M623: =K623*6+L623 -> 65 | O623: 12 | P623: 18 | Q623: =O623*6+P623 -> 90 | S623: PRESTON
A624: COBURG | C624: 3 | D624: 1 | E624: =C624*6+D624 -> 19 | G624: 6 | H624: 5 | I624: =G624*6+H624 -> 41 | K624: 9 | L624: 5 | M624: =K624*6+L624 -> 59 | O624: 12 | P624: 9 | Q624: =O624*6+P624 -> 81 | S624: MILNE
A625: BEST PLAYERS
A626: PRESTON | C626: PASCOE | F626: F CHARD | I626: BRADFORD | L626: COOPER | O626: HARVEY | R626: MEARS
A627: COBURG | C627: LEVERSHA | F627: ROGAN | I627: STARBUCK | L627: VARNEY | O627: CORNELL | R627: WALKER
A628: GOALKICKERS
A629: PRESTON | C629: HARVEY 4 | F629: F CHARD 4 | I629: BRADFORD 2 | L629: K CHARD | N629: SHAW
A630: COBURG | C630: ROGAN 4 | E630: EVANS 2 | G630: VARNEY | I630: BURMEISTER | L630: LAVERSHA | N630: HEWES | P630: H WILKINSON | S630: CLARKSON
A632: MOORABBIN | C632: 3 | D632: 6 | E632: =C632*6+D632 -> 24 | G632: 5 | H632: 9 | I632: =G632*6+H632 -> 39 | K632: 10 | L632: 12 | M632: =K632*6+L632 -> 72 | O632: 13 | P632: 18 | Q632: =O632*6+P632 -> 96 | S632: CHELT
A633: CAMBERWELL | C633: 2 | D633: 3 | E633: =C633*6+D633 -> 15 | G633: 3 | H633: 11 | I633: =G633*6+H633 -> 29 | K633: 8 | L633: 14 | M633: =K633*6+L633 -> 62 | O633: 11 | P633: 15 | Q633: =O633*6+P633 -> 81 | S633: JOHNS
A634: BEST PLAYERS
A635: MOORABBIN | C635: GILBERT | F635: GILDER | I635: TOBIAS | L635: BOYD | O635: LEARY | R635: STOKES
A636: CAMBERWELL | C636: DUFF | F636: SCHNEIDER | I636: MILGATE | L636: McCULLOCH | O636: ROSENBROCK | R636: McFEE
A637: GOALKICKERS
A638: MOORABBIN | C638: ARNFIELD 3 | F638: BOYD 3 | I638: DUNSCOMBE 2 | L638: MURNANE 2 | O638: STOKES 2 | Q638: ANTONIE
A639: CAMBERWELL | C639: McCULLOCH 2 | F639: MILGATE 2 | I639: ROSENBROCK 2 | L639: DUFF | N639: MARION | P639: FARRELL | R639: STUBBS | U639: LUMSDEN
A641: YARRAVILLE | C641: 3 | D641: 1 | E641: =C641*6+D641 -> 19 | G641: 5 | H641: 6 | I641: =G641*6+H641 -> 36 | K641: 8 | L641: 10 | M641: =K641*6+L641 -> 58 | O641: 16 | P641: 15 | Q641: =O641*6+P641 -> 111 | S641: ELSTERNWICK PARK
A642: BRIGHTON | C642: 6 | D642: 7 | E642: =C642*6+D642 -> 43 | G642: 8 | H642: 11 | I642: =G642*6+H642 -> 59 | K642: 12 | L642: 16 | M642: =K642*6+L642 -> 88 | O642: 15 | P642: 16 | Q642: =O642*6+P642 -> 106 | S642: CLEARY
A643: BEST PLAYERS
A644: YARRAVILLE | C644: MASON | F644: PHILLIPS | I644: NICHOLLS | L644: SEITZ | O644: MURPHY | R644: HICKEY
A645: BRIGHTON | C645: MORRIS | F645: PLUNKETT | I645: HOWE | L645: CLARKE | O645: NEW | R645: RIDDELL
A646: GOALKICKERS
A647: YARRAVILLE | C647: PHILLIPS 5 | F647: HICKEY 3 | I647: LEES 3 | K647: McCANN 2 | N647: MASON 2 | Q647: BODSWORTH
A648: BRIGHTON | C648: NEW 6 | F648: MORRIS 4 | I648: HOWE 2 | K648: CONDON 2 | N648: MARINI
A650: SANDRINGHAM | C650: 3 | D650: 5 | E650: =C650*6+D650 -> 23 | G650: 11 | H650: 6 | I650: =G650*6+H650 -> 72 | K650: 18 | L650: 9 | M650: =K650*6+L650 -> 117 | O650: 23 | P650: 9 | Q650: =O650*6+P650 -> 147 | S650: B.H
A651: BOX HILL | C651: 1 | D651: 1 | E651: =C651*6+D651 -> 7 | G651: 3 | H651: 3 | I651: =G651*6+H651 -> 21 | K651: 6 | L651: 3 | M651: =K651*6+L651 -> 39 | O651: 10 | P651: 5 | Q651: =O651*6+P651 -> 65 | S651: IRVING
A652: BEST PLAYERS
A653: SANDRINGHAM | C653: HISCOCK | F653: B HARPER | I653: BRIGHTON | L653: BENCRAFT | O653: GUILLE | Q653: N JONES
A654: BOX HILL | C654: GREEN | F654: CONQUIT | I654: CURTAIN | L654: VANCE | O654: HEALY | Q654: LEHMANN
A655: GOALKICKERS
A656: SANDRINGHAM | C656: B HARPER 9 | F656: HISCOCK 5 | I656: SUTHERLAND 3 | L656: BENCRAFT 2 | O656: COLLINS | Q656: WRIGHT-SMITH | U656: BURRINGTON | X656: HANMAN
A657: BOX HILL | C657: MAIDMENT 7 | F657: VANCE | H657: COGHLAN | J657: HIND
A659: ROUND 11 | E659: 30TH JUNE | J659: WEATHER | M659: SOUTH EAST WIND COLD | S659: PLAYED AT
D660: 1ST QTR | H660: 2ND QTR | L660: 3RD QTR | P660: FINAL | S660: TOORAK PARK
A661: PRAHRAN | C661: 3 | D661: 1 | E661: =C661*6+D661 -> 19 | G661: 6 | H661: 5 | I661: =G661*6+H661 -> 41 | K661: 8 | L661: 5 | M661: =K661*6+L661 -> 53 | O661: 13 | P661: 8 | Q661: =O661*6+P661 -> 86 | S661: UMPIRE | X661: LADDER | AB661: ROUND | AD661: 11
A662: WILLIAMSTOWN | C662: 2 | D662: 4 | E662: =C662*6+D662 -> 16 | G662: 4 | H662: 4 | I662: =G662*6+H662 -> 28 | K662: 8 | L662: 7 | M662: =K662*6+L662 -> 55 | O662: 11 | P662: 9 | Q662: =O662*6+P662 -> 75 | S662: MILNE
A663: BEST PLAYERS | W663: TEAM | X663: W | Y663: L | Z663: D | AA663: FOR | AB663: AGST | AC663: % | AD663: PTS
A664: PRAHRAN | C664: YATES | F664: COLLS | I664: GRAMBEAU | L664: CAMPBELL | O664: ELLIS | Q664: MORGAN
A665: WILLIAMSTOWN | C665: CALLAHAN | F665: SAMPSON | I665: ROGERS | L665: ABBERTON | O665: GUNN | Q665: MOLYNEUX | W665: SANDRINGHAM | X665: 10 | Y665: 1 | Z665: 0 | AA665: 1231 | AB665: 857 | AC665: 143.64060676779462 | AD665: 40
A666: GOALKICKERS | W666: PORT MELBOURNE | X666: 8 | Y666: 2 | Z666: 1 | AA666: 1178 | AB666: 759 | AC666: 155.20421607378128 | AD666: 34
A667: PRAHRAN | C667: ELLIS 3 | E667: MORROW 2 | H667: HARVEY 2 | J667: MASTERTON 2 | M667: GRAMBEAU | P667: ARMSTRONG | W667: OAKLEIGH | X667: 8 | Y667: 3 | Z667: 0 | AA667: 1134 | AB667: 829 | AC667: 136.79131483715321 | AD667: 32
A668: WILLIAMSTOWN | C668: WALKER 3 | F668: AULD 2 | H668: DULLARD | J668: ABBERTON | M668: BARKER | O668: WOOKEY | Q668: MOLYNEUX | T668: TAYLOR | W668: PRAHRAN | X668: 8 | Y668: 3 | Z668: 0 | AA668: 1047 | AB668: 924 | AC668: 113.31 | AD668: 32
A670: BRIGHTON | C670: 2 | D670: 6 | E670: =C670*6+D670 -> 18 | G670: 6 | H670: 9 | I670: =G670*6+H670 -> 45 | K670: 7 | L670: 10 | M670: =K670*6+L670 -> 52 | O670: 9 | P670: 14 | Q670: =O670*6+P670 -> 68 | S670: NORTHCOTE | W670: WILLIAMSTOWN | X670: 7 | Y670: 4 | Z670: 0 | AA670: 1013 | AB670: 807 | AC670: 125.5266418835192 | AD670: 28
A671: NORTHCOTE | C671: 2 | D671: 4 | E671: =C671*6+D671 -> 16 | G671: 3 | H671: 4 | I671: =G671*6+H671 -> 22 | K671: 6 | L671: 7 | M671: =K671*6+L671 -> 43 | O671: 9 | P671: 8 | Q671: =O671*6+P671 -> 62 | S671: MERRINGTON | W671: BRIGHTON | X671: 7 | Y671: 4 | Z671: 0 | AA671: 1084 | AB671: 909 | AC671: 119.25192519251925 | AD671: 28
A672: BEST PLAYERS | W672: NORTHCOTE | X672: 7 | Y672: 4 | Z672: 0 | AA672: 751 | AB672: 686 | AC672: 109.47521865889213 | AD672: 28
A673: BRIGHTON | C673: HOWE | F673: BURKE | I673: CLARKE | L673: G TURNER | O673: PERKINS | Q673: PINDER | W673: PRESTON | X673: 4 | Y673: 5 | Z673: 2 | AA673: 935 | AB673: 929 | AC673: 100.64585575888051 | AD673: 20
A674: NORTHCOTE | C674: PAWSEY | F674: KNOWLES | I674: STAFFORD | L674: STABB | O674: COLLINS | Q674: BRUNNEN | W674: BRUNSWICK | X674: 5 | Y674: 6 | Z674: 0 | AA674: 751 | AB674: 809 | AC674: 92.83 | AD674: 20
A675: GOALKICKERS | W675: YARRAVILLE | X675: 5 | Y675: 6 | Z675: 0 | AA675: 912 | AB675: 1005 | AC675: 90.75 | AD675: 20
A676: BRIGHTON | C676: ADAMSON 3 | F676: EMBLETON 2 | I676: HOWE 2 | L676: SINCLAIR | O676: MORRIS | W676: COBURG | X676: 3 | Y676: 8 | Z676: 0 | AA676: 960 | AB676: 1003 | AC676: 95.71 | AD676: 12
A677: NORTHCOTE | C677: PAWSEY 3 | F677: KNOWLES 2 | I677: WHITECHURCH | L677: WOOLNOUGH | O677: DEANS | W677: MOORABBIN | X677: 2 | Y677: 9 | Z677: 0 | AA677: 882 | AB677: 1235 | AC677: 71.417004048582996 | AD677: 8
W678: CAMBERWELL | X678: 1 | Y678: 9 | Z678: 1 | AA678: 758 | AB678: 1081 | AC678: 70.12 | AD678: 6
A679: OAKLEIGH | C679: 8 | D679: 4 | E679: =C679*6+D679 -> 52 | G679: 15 | H679: 13 | I679: =G679*6+H679 -> 103 | K679: 22 | L679: 17 | M679: =K679*6+L679 -> 149 | O679: 28 | P679: 20 | Q679: =O679*6+P679 -> 188 | S679: OAKLEIGH | W679: BOX HILL | X679: 0 | Y679: 11 | Z679: 0 | AA679: 531 | AB679: 1334 | AC679: 39.81 | AD679: 0
A680: BOX HILL | C680: 2 | D680: 2 | E680: =C680*6+D680 -> 14 | G680: 4 | H680: 7 | I680: =G680*6+H680 -> 31 | K680: 6 | L680: 11 | M680: =K680*6+L680 -> 47 | O680: 7 | P680: 14 | Q680: =O680*6+P680 -> 56 | S680: WRIGHT
A681: BEST PLAYERS
A682: OAKLEIGH | C682: BAXTER | F682: J WATSON | I682: WENN | K682: TINDAL | N682: CUNNINGHAM | Q682: BOYLE
A683: BOX HILL | C683: MIHAN | F683: CURTAIN | I683: GREEN | K683: VANCE | N683: KRONK | Q683: HOUGHTON
A684: GOALKICKERS
A685: OAKLEIGH | C685: J WATSON 12 | F685: WENN 5 | H685: HOWELL 3 | J685: EDWARDS 3 | M685: STREETER 2 | P685: H WILLIAMS | S685: C WATSON | W685: JOHNSON
A686: BOX HILL | C686: MAIDMENT 3 | F686: ANDERSON | I686: MIHAN | K686: WRIGHT | M686: LEHMANN
A688: PORT MELBOURNE | C688: 4 | D688: 7 | E688: =C688*6+D688 -> 31 | G688: 6 | H688: 15 | I688: =G688*6+H688 -> 51 | K688: 12 | L688: 21 | M688: =K688*6+L688 -> 93 | O688: 15 | P688: 23 | Q688: =O688*6+P688 -> 113 | S688: CAMBERWELL
A689: CAMBERWELL | C689: 2 | D689: 0 | E689: =C689*6+D689 -> 12 | G689: 6 | H689: 5 | I689: =G689*6+H689 -> 41 | K689: 7 | L689: 8 | M689: =K689*6+L689 -> 50 | O689: 12 | P689: 14 | Q689: =O689*6+P689 -> 86 | S689: CLEARY
A690: BEST PLAYERS
A691: PORT MELBOURNE | C691: RAMSAY | F691: CLEARY | I691: AUSTIN | L691: STOREY | O691: MILLER | R691: JOHNSON
A692: CAMBERWELL | C692: BOHAN | F692: MILGATE | I692: STUBBS | L692: MARION | O692: HEATLEY | R692: FARRELL
A693: GOALKICKERS
A694: PORT MELBOURNE | C694: AUSTIN 4 | F694: MILLER 3 | I694: JOHNSON 2 | L694: STOREY 2 | N694: McDONALD 2 | Q694: MURRAY | S694: CLEARY
A695: CAMBERWELL | C695: MILGATE 5 | F695: FARRELL 2 | I695: GRIBBLE | K695: ROSENBROCK | N695: MARION | P695: COOK | R695: MOORE
E696: 7TH JULY | K696: WEATHER | P696: SOUTH WEST WIND COLD
A697: SANDRINGHAM | C697: 5 | D697: 1 | E697: =C697*6+D697 -> 31 | G697: 9 | H697: 4 | I697: =G697*6+H697 -> 58 | K697: 11 | L697: 6 | M697: =K697*6+L697 -> 72 | O697: 17 | P697: 11 | Q697: =O697*6+P697 -> 113 | S697: BEACH ROAD
A698: PRESTON | C698: 4 | D698: 3 | E698: =C698*6+D698 -> 27 | G698: 5 | H698: 4 | I698: =G698*6+H698 -> 34 | K698: 12 | L698: 6 | M698: =K698*6+L698 -> 78 | O698: 12 | P698: 8 | Q698: =O698*6+P698 -> 80 | S698: BOWDEN
A699: BEST PLAYERS
A700: SANDRINGHAM | C700: GUILLE | F700: BENCRAFT | I700: R HARPER | L700: RUSSELL | O700: GRAMBEAU | R700: HISCOCK
A701: PRESTON | C701: BRADFORD | F701: HENRYS | I701: ALLAN | L701: PRITCHARD | O701: GOLDIN | R701: SWEET
A702: GOALKICKERS
A703: SANDRINGHAM | C703: WRIGHT-SMITH 4 | F703: B HARPER 3 | I703: HISCOCK 3 | L703: BENCRAFT 2 | O703: N JONES 2 | Q703: SUTHERLAND | T703: TURNBULL | W703: BURRINGTON
A704: PRESTON | C704: ALLAN 2 | E704: GOLDIN 2 | G704: F CHARD 2 | J704: CUGLEY | L704: L SWEET | N704: HARVEY | P704: NATHAN | R704: RUTHVEN | U704: BRADFORD
A706: BRUNSWICK | C706: 4 | D706: 4 | E706: =C706*6+D706 -> 28 | G706: 4 | H706: 7 | I706: =G706*6+H706 -> 31 | K706: 7 | L706: 15 | M706: =K706*6+L706 -> 57 | O706: 7 | P706: 16 | Q706: =O706*6+P706 -> 58 | S706: COBURG
A707: COBURG | C707: 2 | D707: 3 | E707: =C707*6+D707 -> 15 | G707: 4 | H707: 13 | I707: =G707*6+H707 -> 37 | K707: 4 | L707: 17 | M707: =K707*6+L707 -> 41 | O707: 6 | P707: 19 | Q707: =O707*6+P707 -> 55 | S707: IRVING
A708: BEST PLAYERS
A709: BRUNSWICK | C709: TAYLOR | F709: STANLEY | I709: WEIR | L709: GEISLER | O709: SPENCER | R709: WHELAN
A710: COBURG | C710: FEWKES | F710: WILSON | I710: H WILKINSON | L710: EQUID | O710: STARBUCK | R710: LAVERSHA
A711: GOALKICKERS
A712: BRUNSWICK | C712: SPENCER 2 | F712: WEIR 2 | I712: McFARLANE 2 | L712: ARMSTRONG
A713: COBURG | C713: JAMES 3 | F713: LAVERSHA | I713: ROGAN | K713: H WILKINSON
A715: YARRAVILLE | C715: 4 | D715: 7 | E715: =C715*6+D715 -> 31 | G715: 6 | H715: 7 | I715: =G715*6+H715 -> 43 | K715: 13 | L715: 15 | M715: =K715*6+L715 -> 93 | O715: 17 | P715: 15 | Q715: =O715*6+P715 -> 117 | S715: YARRAVILLE
A716: MOORABBIN | C716: 0 | D716: 2 | E716: =C716*6+D716 -> 2 | G716: 4 | H716: 4 | I716: =G716*6+H716 -> 28 | K716: 5 | L716: 5 | M716: =K716*6+L716 -> 35 | O716: 13 | P716: 6 | Q716: =O716*6+P716 -> 84 | S716: JOHNS
A717: BEST PLAYERS
A718: YARRAVILLE | C718: MASON | F718: CRANAGE | I718: SEITZ | L718: ELDRIDGE | O718: PHILLIPS | R718: HICKEY
A719: MOORABBIN | C719: STOKES | F719: COPSEY | I719: CARPENTER | L719: RICHARDSON | O719: GILBERT | R719: BAKER
A720: GOALKICKERS
A721: YARRAVILLE | C721: PHILLIPS 4 | F721: HICKEY 4 | I721: MASON 3 | K721: SEITZ 2 | M721: HARGREAVES 2 | P721: McCANN | R721: ROHLEDER
A722: MOORABBIN | C722: MURNANE 4 | F722: STOKES 2 | I722: CARPENTER 2 | L722: RICHARDSON 2 | O722: BAKER | Q722: ANDREW | S722: BLAIR
A724: ROUND 12 | E724: 14TH JULY | J724: WEATHER | M724: NORTH WIND COLD RAIN | S724: PLAYED AT
D725: 1ST QTR | H725: 2ND QTR | L725: 3RD QTR | P725: FINAL | S725: PRESTON
A726: PRESTON | C726: 7 | D726: 3 | E726: =C726*6+D726 -> 45 | G726: 8 | H726: 6 | I726: =G726*6+H726 -> 54 | K726: 14 | L726: 12 | M726: =K726*6+L726 -> 96 | O726: 17 | P726: 15 | Q726: =O726*6+P726 -> 117 | S726: UMPIRE | X726: LADDER | AB726: ROUND | AD726: 12
A727: OAKLEIGH | C727: 1 | D727: 6 | E727: =C727*6+D727 -> 12 | G727: 7 | H727: 8 | I727: =G727*6+H727 -> 50 | K727: 8 | L727: 9 | M727: =K727*6+L727 -> 57 | O727: 11 | P727: 13 | Q727: =O727*6+P727 -> 79 | S727: JOHNS
A728: BEST PLAYERS | W728: TEAM | X728: W | Y728: L | Z728: D | AA728: FOR | AB728: AGST | AC728: % | AD728: PTS
A729: PRESTON | C729: NATHAN | E729: GOLDIN | H729: BRADFORD | K729: F CHARD | N729: RYAN | Q729: HARVEY
A730: OAKLEIGH | C730: SCOTT | E730: DALZIEL | H730: J WATSON | K730: C WATSON | N730: CUNNINGHAM | Q730: TINDAL | W730: SANDRINGHAM | X730: 10 | Y730: 2 | Z730: 0 | AA730: 1289 | AB730: 925 | AC730: 139.35135135135135 | AD730: 40
A731: GOALKICKERS | W731: PORT MELBOURNE | X731: 9 | Y731: 2 | Z731: 1 | AA731: 1268 | AB731: 817 | AC731: 155.20195838433293 | AD731: 38
A732: PRESTON | C732: HARVEY 6 | E732: F CHARD 3 | H732: GOLDIN 2 | J732: BRADFORD 2 | M732: K CHARD | O732: HARRISON | Q732: LAURIE | S732: NATHAN | W732: PRAHRAN | X732: 9 | Y732: 3 | Z732: 0 | AA732: 1173 | AB732: 1001 | AC732: 117.18 | AD732: 36
A733: OAKLEIGH | C733: J WATSON 5 | F733: CUNNINGHAM 2 | J733: EDWARDS | M733: WILLIAMS | O733: DALZIEL | Q733: JOHNSON | W733: WILLIAMSTOWN | X733: 8 | Y733: 4 | Z733: 0 | AA733: 1158 | AB733: 858 | AC733: 134.96503496503496 | AD733: 32
A735: BRUNSWICK | C735: 3 | D735: 3 | E735: =C735*6+D735 -> 21 | G735: 6 | H735: 3 | I735: =G735*6+H735 -> 39 | K735: 7 | L735: 5 | M735: =K735*6+L735 -> 47 | O735: 10 | P735: 8 | Q735: =O735*6+P735 -> 68 | S735: BRUNSWICK | W735: OAKLEIGH | X735: 8 | Y735: 4 | Z735: 0 | AA735: 1213 | AB735: 946 | AC735: 128.22410147991545 | AD735: 32
A736: SANDRINGHAM | C736: 2 | D736: 2 | E736: =C736*6+D736 -> 14 | G736: 4 | H736: 6 | I736: =G736*6+H736 -> 30 | K736: 8 | L736: 9 | M736: =K736*6+L736 -> 57 | O736: 8 | P736: 10 | Q736: =O736*6+P736 -> 58 | S736: WRIGHT | W736: BRIGHTON | X736: 8 | Y736: 4 | Z736: 0 | AA736: 1187 | AB736: 1007 | AC736: 117.87487586891757 | AD736: 32
A737: BEST PLAYERS | W737: NORTHCOTE | X737: 8 | Y737: 4 | Z737: 0 | AA737: 860 | AB737: 770 | AC737: 111.68831168831169 | AD737: 32
A738: BRUNSWICK | C738: PRIESTLEY | F738: MULLENGER | I738: YEA | L738: DUNSTAN | O738: WEIR | Q738: GEISLER | W738: PRESTON | X738: 5 | Y738: 5 | Z738: 2 | AA738: 1052 | AB738: 1008 | AC738: 104.36507936507937 | AD738: 24
A739: SANDRINGHAM | C739: HANMAN | F739: BRIGHTON | I739: R HARPER | L739: HISCOCK | O739: STANLEY | Q739: BENCRAFT | W739: BRUNSWICK | X739: 6 | Y739: 6 | Z739: 0 | AA739: 819 | AB739: 867 | AC739: 94.46 | AD739: 24
A740: GOALKICKERS | W740: YARRAVILLE | X740: 5 | Y740: 7 | Z740: 0 | AA740: 970 | AB740: 1095 | AC740: 88.58 | AD740: 20
A741: BRUNSWICK | C741: WEIR 4 | F741: DUNSTAN 2 | I741: DELAHUNT 2 | L741: ARMSTRONG | O741: McFARLANE | W741: COBURG | X741: 3 | Y741: 9 | Z741: 0 | AA741: 1058 | AB741: 1106 | AC741: 95.66 | AD741: 12
A742: SANDRINGHAM | C742: HISCOCK 4 | F742: WALKER | I742: BURINGTON | L742: COLLINS | O742: BENCRAFT | W742: MOORABBIN | X742: 2 | Y742: 10 | Z742: 0 | AA742: 966 | AB742: 1344 | AC742: 71.875 | AD742: 8
W743: CAMBERWELL | X743: 1 | Y743: 10 | Z743: 1 | AA743: 809 | AB743: 1226 | AC743: 65.99 | AD743: 6
A744: PORT MELBOURNE | C744: 1 | D744: 4 | E744: =C744*6+D744 -> 10 | G744: 6 | H744: 6 | I744: =G744*6+H744 -> 42 | K744: 9 | L744: 10 | M744: =K744*6+L744 -> 64 | O744: 13 | P744: 12 | Q744: =O744*6+P744 -> 90 | S744: PORT MELBOURNE | W744: BOX HILL | X744: 0 | Y744: 12 | Z744: 0 | AA744: 608 | AB744: 1460 | AC744: 41.64 | AD744: 0
A745: YARRAVILLE | C745: 1 | D745: 3 | E745: =C745*6+D745 -> 9 | G745: 1 | H745: 4 | I745: =G745*6+H745 -> 10 | K745: 6 | L745: 8 | M745: =K745*6+L745 -> 44 | O745: 8 | P745: 10 | Q745: =O745*6+P745 -> 58 | S745: BOWDEN
A746: BEST PLAYERS
A747: PORT MELBOURNE | C747: CLEARY | F747: MILLER | I747: WOODBRIDGE | L747: AUSTIN | N747: JOHNSON | Q747: RAMSAY
A748: YARRAVILLE | C748: ELDRIDGE | F748: McCANN | I748: BODSWORTH | L748: SALT | N748: McBEAN | Q748: MASON
A749: GOALKICKERS
A750: PORT MELBOURNE | C750: WALSH 3 | F750: LEWIS 3 | H750: RAMSAY 2 | J750: JOHNSON | L750: MILLER | N750: AUSTIN | P750: DOYLE | R750: McDONALD
A751: YARRAVILLE | C751: HICKEY 3 | F751: BODSWORTH 2 | J751: MASON 2 | M751: McCANN
A753: BRIGHTON | C753: 6 | D753: 2 | E753: =C753*6+D753 -> 38 | G753: 7 | H753: 5 | I753: =G753*6+H753 -> 47 | K753: 14 | L753: 11 | M753: =K753*6+L753 -> 95 | O753: 15 | P753: 13 | Q753: =O753*6+P753 -> 103 | S753: ELSTERNWICK PARK
A754: COBURG | C754: 2 | D754: 4 | E754: =C754*6+D754 -> 16 | G754: 8 | H754: 8 | I754: =G754*6+H754 -> 56 | K754: 8 | L754: 11 | M754: =K754*6+L754 -> 59 | O754: 14 | P754: 14 | Q754: =O754*6+P754 -> 98 | S754: MILNE
A755: BEST PLAYERS
A756: BRIGHTON | C756: E TURNER | F756: HOWE | I756: RIDDELL | L756: PERKINS | O756: JOUBERT | R756: EMBLETON
A757: COBURG | C757: FEWKES | F757: STARBUCK | I757: MANGELS | L757: GILBERT | O757: WILSON | R757: CANNING
A758: GOALKICKERS
A759: BRIGHTON | C759: ADAMSON 3 | F759: EMBLETON 2 | I759: PICKERING 2 | L759: HOWE 2 | N759: PERKINS | P759: PINDER | R759: MARINI | U759: McASEY | X759: BURKE | Z759: G TURNER
A760: COBURG | C760: EQUID 2 | E760: EVANS 2 | G760: R WILKINSON 2 | J760: BRYAR | L760: JAMES | N760: STARBUCK | Q760: HEWES | S760: GILBERT | U760: LEVERSHA | X760: WILSON | Z760: CANNING
A762: NORTHCOTE | C762: 2 | D762: 4 | E762: =C762*6+D762 -> 16 | G762: 7 | H762: 7 | I762: =G762*6+H762 -> 49 | K762: 10 | L762: 7 | M762: =K762*6+L762 -> 67 | O762: 16 | P762: 13 | Q762: =O762*6+P762 -> 109 | S762: CHELT
A763: MOORABBIN | C763: 2 | D763: 8 | E763: =C763*6+D763 -> 20 | G763: 3 | H763: 10 | I763: =G763*6+H763 -> 28 | K763: 9 | L763: 15 | M763: =K763*6+L763 -> 69 | O763: 11 | P763: 18 | Q763: =O763*6+P763 -> 84 | S763: RICHARDSON
A764: BEST PLAYERS
A765: NORTHCOTE | C765: WOOLNOUGH | F765: HINES | H765: CRADDOCK | K765: PAWSEY | N765: LAWTON | Q765: SAUNDERS
A766: MOORABBIN | C766: GILBERT | F766: COPSEY | H766: STOKES | K766: RICHARDSON | N766: DODDS | Q766: D'OLIVER
A767: GOALKICKERS
A768: NORTHCOTE | C768: SAUNDERS 4 | F768: WOOLNOUGH 3 | J768: DEANS 3 | L768: PAWSEY 2 | N768: CRADDOCK 2 | Q768: STABB | S768: DUNGAN
A769: MOORABBIN | C769: RICHARDSON 3 | F769: STOKES 2 | I769: ANDREW 2 | L769: BAKER | N769: GOODES | P769: MURNANE | R769: JACOBS
A771: WILLIAMSTOWN | C771: 7 | D771: 6 | E771: =C771*6+D771 -> 48 | G771: 9 | H771: 12 | I771: =G771*6+H771 -> 66 | K771: 17 | L771: 18 | M771: =K771*6+L771 -> 120 | O771: 21 | P771: 19 | Q771: =O771*6+P771 -> 145 | S771: WILLIAMSTOWN
A772: CAMBERWELL | C772: 1 | D772: 0 | E772: =C772*6+D772 -> 6 | G772: 1 | H772: 2 | I772: =G772*6+H772 -> 8 | K772: 4 | L772: 4 | M772: =K772*6+L772 -> 28 | O772: 7 | P772: 9 | Q772: =O772*6+P772 -> 51 | S772: MERRINGTON
A773: BEST PLAYERS
A774: WILLIAMSTOWN | C774: MOLYNEUX | F774: DULLARD | I774: W WILLIAMS | L774: ALLANSON | O774: TAYLOR | R774: WALKER
A775: CAMBERWELL | C775: HEATLEY | F775: BOHAN | I775: STUBBS | L775: MARION | O775: GRIBBLE | R775: CARTER
A776: GOALKICKERS
A777: WILLIAMSTOWN | C777: MOLYNEUX 6 | F777: WALKER 5 | I777: TAYLOR 5 | K777: DULLARD 3 | N777: GUNN | P777: SHEAHAN
A778: CAMBERWELL | C778: MILGATE 2 | F778: HEATLEY | I778: COOK | K778: CARTER | M778: FARRELL | O778: GRIBBLE
A780: PRAHRAN | C780: 5 | D780: 6 | E780: =C780*6+D780 -> 36 | G780: 9 | H780: 13 | I780: =G780*6+H780 -> 67 | K780: 13 | L780: 16 | M780: =K780*6+L780 -> 94 | O780: 17 | P780: 24 | Q780: =O780*6+P780 -> 126 | S780: B.H
A781: BOX HILL | C781: 2 | D781: 6 | E781: =C781*6+D781 -> 18 | G781: 6 | H781: 6 | I781: =G781*6+H781 -> 42 | K781: 10 | L781: 10 | M781: =K781*6+L781 -> 70 | O781: 11 | P781: 11 | Q781: =O781*6+P781 -> 77 | S781: IRVING
A782: BEST PLAYERS
A783: PRAHRAN | C783: HARVEY | E783: ELLIS | H783: MORROW | K783: SHILLABEER | N783: McCULLOCH | Q783: YATES
A784: BOX HILL | C784: GREEN | E784: VANCE | H784: W COGHLAN | K784: MOLLER | N784: WRIGHT | Q784: KRONK
A785: GOALKICKERS
A786: PRAHRAN | C786: HARVEY 6 | F786: ELLIS 4 | H786: McCULLOCH 3 | K786: SHILLABEER 2 | N786: MORROW | P786: KRUSE
A787: BOX HILL | C787: MAIDMENT 6 | F787: WRIGHT 2 | I787: MIHAN | K787: MOLLER | M787: VANCE
A789: ROUND 13 | E789: 21ST JULY | H789: WEATHER | K789: SOUTH WEST WIND COLD GROUNDS HEAVY | S789: PLAYED AT
D790: 1ST QTR | H790: 2ND QTR | L790: 3RD QTR | P790: FINAL | S790: BEACH ROAD
A791: SANDRINGHAM | C791: 4 | D791: 1 | E791: =C791*6+D791 -> 25 | G791: 9 | H791: 3 | I791: =G791*6+H791 -> 57 | K791: 10 | L791: 6 | M791: =K791*6+L791 -> 66 | O791: 12 | P791: 9 | Q791: =O791*6+P791 -> 81 | S791: UMPIRE | X791: LADDER | AB791: ROUND | AD791: 13
A792: BRIGHTON | C792: 3 | D792: 1 | E792: =C792*6+D792 -> 19 | G792: 6 | H792: 2 | I792: =G792*6+H792 -> 38 | K792: 7 | L792: 7 | M792: =K792*6+L792 -> 49 | O792: 8 | P792: 10 | Q792: =O792*6+P792 -> 58 | S792: MERRINGTON
A793: BEST PLAYERS | W793: TEAM | X793: W | Y793: L | Z793: D | AA793: FOR | AB793: AGST | AC793: % | AD793: PTS
A794: SANDRINGHAM | C794: R HARPER | F794: GRAMBEAU | I794: B HARPER | L794: STANLEY | N794: BOURKE | Q794: TURNBULL
A795: BRIGHTON | C795: PINDER | F795: CLARKE | I795: EMBLETON | L795: NEW | N795: PERKINS | Q795: E TURNER | W795: SANDRINGHAM | X795: 11 | Y795: 2 | Z795: 0 | AA795: 1370 | AB795: 983 | AC795: 139.36927772126145 | AD795: 44
A796: GOALKICKERS | W796: PORT MELBOURNE | X796: 10 | Y796: 2 | Z796: 1 | AA796: 1342 | AB796: 861 | AC796: 155.86527293844367 | AD796: 42
A797: SANDRINGHAM | C797: B HARPER 4 | F797: GRAMBEAU 3 | I797: WALKER 2 | L797: BOURKE | N797: BENCRAFT | Q797: BURRINGTON | W797: PRAHRAN | X797: 10 | Y797: 3 | Z797: 0 | AA797: 1268 | AB797: 1053 | AC797: 120.42 | AD797: 40
A798: BRIGHTON | C798: NEW 3 | E798: CONDON 2 | H798: PERKINS | J798: EMBLETON | M798: PICKERING | W798: WILLIAMSTOWN | X798: 8 | Y798: 4 | Z798: 1 | AA798: 1214 | AB798: 914 | AC798: 132.82275711159738 | AD798: 34
A800: PORT MELBOURNE | C800: 7 | D800: 3 | E800: =C800*6+D800 -> 45 | G800: 8 | H800: 5 | I800: =G800*6+H800 -> 53 | K800: 9 | L800: 11 | M800: =K800*6+L800 -> 65 | O800: 10 | P800: 14 | Q800: =O800*6+P800 -> 74 | S800: NORTHCOTE | W800: OAKLEIGH | X800: 8 | Y800: 4 | Z800: 1 | AA800: 1261 | AB800: 994 | AC800: 126.86116700201207 | AD800: 34
A801: NORTHCOTE | C801: 1 | D801: 3 | E801: =C801*6+D801 -> 9 | G801: 4 | H801: 5 | I801: =G801*6+H801 -> 29 | K801: 4 | L801: 6 | M801: =K801*6+L801 -> 30 | O801: 6 | P801: 8 | Q801: =O801*6+P801 -> 44 | S801: BOWDEN | W801: BRIGHTON | X801: 8 | Y801: 5 | Z801: 0 | AA801: 1245 | AB801: 1088 | AC801: 114.43014705882354 | AD801: 32
A802: BEST PLAYERS | W802: NORTHCOTE | X802: 8 | Y802: 5 | Z802: 0 | AA802: 904 | AB802: 844 | AC802: 107.1090047393365 | AD802: 32
A803: PORT MELBOURNE | C803: DRINAN | F803: MILLER | I803: MULLANE | L803: KELSEY | N803: WOODBRIDGE | Q803: MURRAY | W803: BRUNSWICK | X803: 6 | Y803: 6 | Z803: 1 | AA803: 867 | AB803: 915 | AC803: 94.75 | AD803: 26
A804: NORTHCOTE | C804: HISCOX | F804: LAWTON | I804: WOOLNOUGH | L804: DEANS | N804: HINES | Q804: POWELL | W804: PRESTON | X804: 5 | Y804: 6 | Z804: 2 | AA804: 1104 | AB804: 1103 | AC804: 100.09066183136899 | AD804: 24
A805: GOALKICKERS | W805: YARRAVILLE | X805: 6 | Y805: 7 | Z805: 0 | AA805: 1040 | AB805: 1141 | AC805: 91.15 | AD805: 24
A806: PORT MELBOURNE | C806: MILLER 4 | F806: AUSTIN 2 | I806: ATKINSON 2 | L806: McDONALD | N806: MURRAY | W806: COBURG | X806: 4 | Y806: 9 | Z806: 0 | AA806: 1141 | AB806: 1178 | AC806: 96.86 | AD806: 16
A807: NORTHCOTE | C807: HISCOX 2 | F807: DUNGAN 2 | I807: DEANS | K807: STABB | W807: MOORABBIN | X807: 2 | Y807: 11 | Z807: 0 | AA807: 1038 | AB807: 1427 | AC807: 72.740014015416961 | AD807: 8
W808: CAMBERWELL | X808: 1 | Y808: 11 | Z808: 1 | AA808: 855 | AB808: 1296 | AC808: 65.97 | AD808: 6
A809: PRAHRAN | C809: 4 | D809: 5 | E809: =C809*6+D809 -> 29 | G809: 7 | H809: 6 | I809: =G809*6+H809 -> 48 | K809: 10 | L809: 10 | M809: =K809*6+L809 -> 70 | O809: 14 | P809: 11 | Q809: =O809*6+P809 -> 95 | S809: TOORAK PARK | W809: BOX HILL | X809: 0 | Y809: 12 | Z809: 1 | AA809: 664 | AB809: 1516 | AC809: 43.8 | AD809: 2
A810: PRESTON | C810: 1 | D810: 4 | E810: =C810*6+D810 -> 10 | G810: 6 | H810: 6 | I810: =G810*6+H810 -> 42 | K810: 7 | L810: 8 | M810: =K810*6+L810 -> 50 | O810: 7 | P810: 10 | Q810: =O810*6+P810 -> 52 | S810: CLEARY
A811: BEST PLAYERS
A812: PRAHRAN | C812: COLLS | F812: MORROW | I812: KRUSE | L812: WALSH | O812: GALLAGHER | R812: ELLIS
A813: PRESTON | C813: BRADFORD | F813: HENRYS | I813: GOLDIN | L813: COOPER | O813: K CHARD | R813: HARRISON
A814: GOALKICKERS
A815: PRAHRAN | C815: MORROW 4 | F815: ELLIS 3 | H815: HARVEY 2 | J815: McCULLOCH 2 | M815: WALSH | O815: WOOD | Q815: ARMSTRONG
A816: PRESTON | C816: GOLDIN 3 | F816: MEARS 2 | I816: HARRISON | L816: ALLAN
A818: OAKLEIGH | C818: 1 | D818: 7 | E818: =C818*6+D818 -> 13 | G818: 3 | H818: 8 | I818: =G818*6+H818 -> 26 | K818: 5 | L818: 15 | M818: =K818*6+L818 -> 45 | O818: 5 | P818: 18 | Q818: =O818*6+P818 -> 48 | S818: OAKLEIGH
A819: BRUNSWICK | C819: 0 | D819: 3 | E819: =C819*6+D819 -> 3 | G819: 1 | H819: 6 | I819: =G819*6+H819 -> 12 | K819: 3 | L819: 8 | M819: =K819*6+L819 -> 26 | O819: 6 | P819: 12 | Q819: =O819*6+P819 -> 48 | S819: MILNE
A820: BEST PLAYERS
A821: OAKLEIGH | C821: SCOTT | E821: DALZIEL | H821: BOYLE | K821: J WATSON | N821: TEMME | Q821: BAXTER
A822: BRUNSWICK | C822: WEIR | E822: TAYLOR | H822: GEISLER | K822: ARMSTRONG | N822: POLLARD | Q822: PLANT
A823: GOALKICKERS
A824: OAKLEIGH | C824: SCOTT 3 | F824: J WATSON | I824: WENN
A825: BRUNSWICK | C825: WEIR 3 | F825: SPENCER 2 | I825: McFARLANE
A827: YARRAVILLE | C827: 3 | D827: 2 | E827: =C827*6+D827 -> 20 | G827: 6 | H827: 4 | I827: =G827*6+H827 -> 40 | K827: 9 | L827: 7 | M827: =K827*6+L827 -> 61 | O827: 10 | P827: 10 | Q827: =O827*6+P827 -> 70 | S827: YARRAVILLE
A828: CAMBERWELL | C828: 0 | D828: 1 | E828: =C828*6+D828 -> 1 | G828: 2 | H828: 6 | I828: =G828*6+H828 -> 18 | K828: 5 | L828: 8 | M828: =K828*6+L828 -> 38 | O828: 6 | P828: 10 | Q828: =O828*6+P828 -> 46 | S828: RICHARDSON
A829: BEST PLAYERS
A830: YARRAVILLE | C830: McASEY | F830: ELDRIDGE | I830: McCANN | L830: BAGLIN | N830: ROHLEDER | Q830: BODSWORTH
A831: CAMBERWELL | C831: BOHAN | F831: SCHNEIDER | I831: MARION | L831: FLETCHER | N831: BEDFORD | Q831: WILLIAMS
A832: GOALKICKERS
A833: YARRAVILLE | C833: MASON 2 | F833: BAGLIN 2 | I833: HICKEY 2 | K833: BODSWORTH | N833: PHILLIPS | P833: LEES | Q833: SEITZ
A834: CAMBERWELL | C834: MILGATE | E834: COOK | G834: ROSENBROCK | J834: MOORE | M834: MARION | O834: SCHNEIDER
A836: COBURG | C836: 2 | D836: 2 | E836: =C836*6+D836 -> 14 | G836: 4 | H836: 7 | I836: =G836*6+H836 -> 31 | K836: 10 | L836: 8 | M836: =K836*6+L836 -> 68 | O836: 12 | P836: 11 | Q836: =O836*6+P836 -> 83 | S836: COBURG
A837: MOORABBIN | C837: 2 | D837: 1 | E837: =C837*6+D837 -> 13 | G837: 5 | H837: 3 | I837: =G837*6+H837 -> 33 | K837: 9 | L837: 8 | M837: =K837*6+L837 -> 62 | O837: 10 | P837: 12 | Q837: =O837*6+P837 -> 72 | S837: SMYTH
A838: BEST PLAYERS
A839: COBURG | C839: STARBUCK | F839: FEWKES | I839: JAMES | K839: LEVERSHA | N839: H WILKINSON | Q839: EQUID
A840: MOORABBIN | C840: MURNANE | F840: RICHARDSON | I840: BOYD | K840: LEARY | N840: NORMAN | Q840: GILBERT
A841: GOALKICKERS
A842: COBURG | C842: JAMES 5 | F842: HEWES 3 | I842: CANNING 2 | L842: STARBUCK 2
A843: MOORABBIN | C843: MURNANE 5 | F843: GILBERT | H843: LEARY | J843: PATMAN | M843: RICHARDSON | P843: HOCKING
A845: BOX HILL | C845: 3 | D845: 0 | E845: =C845*6+D845 -> 18 | G845: 5 | H845: 1 | I845: =G845*6+H845 -> 31 | K845: 7 | L845: 5 | M845: =K845*6+L845 -> 47 | O845: 8 | P845: 8 | Q845: =O845*6+P845 -> 56 | S845: B.H
A846: WILLIAMSTOWN | C846: 4 | D846: 0 | E846: =C846*6+D846 -> 24 | G846: 5 | H846: 3 | I846: =G846*6+H846 -> 33 | K846: 6 | L846: 6 | M846: =K846*6+L846 -> 42 | O846: 8 | P846: 8 | Q846: =O846*6+P846 -> 56 | S846: JOHNS
A847: BEST PLAYERS
A848: BOX HILL | C848: HAMMOND | F848: GREEN | I848: VANCE | L848: W COGHLAN | O848: LEISHMAN | R848: KRONK
A849: WILLIAMSTOWN | C849: ALLANSON | F849: WALKER | I849: MOLYNEUX | L849: SHEAHAN | O849: GUNN | R849: W WILLIAMS
A850: GOALKICKERS
A851: BOX HILL | C851: MAIDMENT 3 | F851: O'REILLY | I851: W COGHLAN | L851: WRIGHT | N851: KRONK | P851: CURTAIN
A852: WILLIAMSTOWN | C852: WALKER 5 | F852: GUNN | H852: POOLE | J852: MOLYNEUX
A854: ROUND 14 | E854: 28TH JULY | J854: WEATHER | O854: WEST BREEZE FINE | S854: PLAYED AT
D855: 1ST QTR | H855: 2ND QTR | L855: 3RD QTR | P855: FINAL | S855: PORT MELBOURNE
A856: PORT MELBOURNE | C856: 2 | D856: 2 | E856: =C856*6+D856 -> 14 | G856: 10 | H856: 6 | I856: =G856*6+H856 -> 66 | K856: 11 | L856: 8 | M856: =K856*6+L856 -> 74 | O856: 20 | P856: 13 | Q856: =O856*6+P856 -> 133 | S856: UMPIRE | X856: LADDER | AB856: ROUND | AD856: 14
A857: SANDRINGHAM | C857: 5 | D857: 2 | E857: =C857*6+D857 -> 32 | G857: 6 | H857: 6 | I857: =G857*6+H857 -> 42 | K857: 10 | L857: 12 | M857: =K857*6+L857 -> 72 | O857: 12 | P857: 15 | Q857: =O857*6+P857 -> 87 | S857: CLEARY
A858: BEST PLAYERS | W858: TEAM | X858: W | Y858: L | Z858: D | AA858: FOR | AB858: AGST | AC858: % | AD858: PTS
A859: PORT MELBOURNE | C859: JOHNSON | F859: CLEARY | I859: DRINAN | L859: LOWRIE | O859: MURRAY | R859: WALSH
A860: SANDRINGHAM | C860: BOURKE | F860: R HARPER | I860: HISCOCK | L860: GRAMBEAU | O860: B HARPER | R860: MADSEN | W860: PORT MELBOURNE | X860: 11 | Y860: 2 | Z860: 1 | AA860: 1475 | AB860: 948 | AC860: 155.59071729957805 | AD860: 46
A861: GOALKICKERS | W861: SANDRINGHAM | X861: 11 | Y861: 3 | Z861: 0 | AA861: 1457 | AB861: 1116 | AC861: 130.55555555555554 | AD861: 44
A862: PORT MELBOURNE | C862: WALSH 6 | F862: LOWRIE 5 | I862: MILLER 3 | K862: DOYLE 3 | M862: ATKINSON 2 | P862: LAFFEY | W862: PRAHRAN | X862: 11 | Y862: 3 | Z862: 0 | AA862: 1339 | AB862: 1118 | AC862: 119.77 | AD862: 44
A863: SANDRINGHAM | C863: B HARPER 3 | F863: GRAMBEAU 2 | I863: BENCRAFT | K863: WALKER | M863: R HARPER | O863: HANMAN | Q863: HISCOXK | S863: BURRINGTON | W863: OAKLEIGH | X863: 9 | Y863: 4 | Z863: 1 | AA863: 1431 | AB863: 1048 | AC863: 136.54580152671755 | AD863: 38
R864: G JONES
A865: PRAHRAN | C865: 3 | D865: 6 | E865: =C865*6+D865 -> 24 | G865: 7 | H865: 6 | I865: =G865*6+H865 -> 48 | K865: 9 | L865: 6 | M865: =K865*6+L865 -> 60 | O865: 10 | P865: 11 | Q865: =O865*6+P865 -> 71 | S865: ELSTERNWICK PARK | W865: WILLIAMSTOWN | X865: 8 | Y865: 5 | Z865: 1 | AA865: 1289 | AB865: 1009 | AC865: 127.75024777006938 | AD865: 34
A866: BRIGHTON | C866: 2 | D866: 6 | E866: =C866*6+D866 -> 18 | G866: 4 | H866: 9 | I866: =G866*6+H866 -> 33 | K866: 7 | L866: 10 | M866: =K866*6+L866 -> 52 | O866: 9 | P866: 11 | Q866: =O866*6+P866 -> 65 | S866: SMYTH | W866: BRIGHTON | X866: 8 | Y866: 6 | Z866: 0 | AA866: 1310 | AB866: 1159 | AC866: 113.02847282139776 | AD866: 32
A867: BEST PLAYERS | W867: NORTHCOTE | X867: 8 | Y867: 6 | Z867: 0 | AA867: 942 | AB867: 929 | AC867: 101.4 | AD867: 32
A868: PRAHRAN | C868: ARMSTRONG | F868: HARVEY | H868: KRUSE | K868: COLLS | N868: GRAMBEAU | Q868: McCULLOCH | W868: BRUNSWICK | X868: 7 | Y868: 6 | Z868: 1 | AA868: 990 | AB868: 982 | AC868: 100.81 | AD868: 30
A869: BRIGHTON | C869: FREEMAN | F869: NEW | H869: RIDDELL | K869: EMBLETON | N869: BLACKMORE | Q869: CLARKE | W869: PRESTON | X869: 6 | Y869: 6 | Z869: 2 | AA869: 1199 | AB869: 1178 | AC869: 101.78268251273344 | AD869: 28
A870: GOALKICKERS | W870: YARRAVILLE | X870: 7 | Y870: 7 | Z870: 0 | AA870: 1125 | AB870: 1179 | AC870: 95.42 | AD870: 28
A871: PRAHRAN | C871: McCULLOCH 4 | F871: WALSH 2 | I871: HARVEY 2 | L871: ELLIS | N871: KRUSE | W871: COBURG | X871: 5 | Y871: 9 | Z871: 0 | AA871: 1226 | AB871: 1252 | AC871: 97.92 | AD871: 20
A872: BRIGHTON | C872: ADAMSON 3 | F872: PINDER 2 | I872: EMBLETON | L872: NEW | N872: CONDON | Q872: MORRIS | W872: MOORABBIN | X872: 2 | Y872: 12 | Z872: 0 | AA872: 1092 | AB872: 1597 | AC872: 68.378209142141515 | AD872: 8
W873: CAMBERWELL | X873: 1 | Y873: 12 | Z873: 1 | AA873: 929 | AB873: 1381 | AC873: 67.27 | AD873: 6
A874: PRESTON | C874: 0 | D874: 2 | E874: =C874*6+D874 -> 2 | G874: 4 | H874: 7 | I874: =G874*6+H874 -> 31 | K874: 5 | L874: 10 | M874: =K874*6+L874 -> 40 | O874: 14 | P874: 11 | Q874: =O874*6+P874 -> 95 | S874: PRESTON | W874: BOX HILL | X874: 0 | Y874: 13 | Z874: 1 | AA874: 731 | AB874: 1639 | AC874: 44.6 | AD874: 2
A875: WILLIAMSTOWN | C875: 5 | D875: 6 | E875: =C875*6+D875 -> 36 | G875: 7 | H875: 9 | I875: =G875*6+H875 -> 51 | K875: 9 | L875: 13 | M875: =K875*6+L875 -> 67 | O875: 10 | P875: 15 | Q875: =O875*6+P875 -> 75 | S875: MERRINGTON
A876: BEST PLAYERS
A877: PRESTON | C877: MEARS | F877: PRITCHARD | I877: PASCOE | L877: GOLDIN | O877: NATHAN | R877: SWEET
A878: WILLIAMSTOWN | C878: CALLAHAN | F878: DULLARD | I878: POOLE | L878: WALKER | O878: ABBERTON | R878: SAMPSON
A879: GOALKICKERS
A880: PRESTON | C880: F CHARD 5 | F880: MEARS 3 | I880: CUGLEY 3 | K880: SWEET | M880: NATHAN | O880: K CHARD | Q880: GOLDIN
A881: WILLIAMSTOWN | C881: WALKER 5 | F881: DULLARD 2 | I881: MOLYNEUX | L881: AULD | N881: GUNN
A883: YARRAVILLE | C883: 2 | D883: 5 | E883: =C883*6+D883 -> 17 | G883: 5 | H883: 10 | I883: =G883*6+H883 -> 40 | K883: 10 | L883: 15 | M883: =K883*6+L883 -> 75 | O883: 11 | P883: 19 | Q883: =O883*6+P883 -> 85 | S883: YARRAVILLE
A884: NORTHCOTE | C884: 1 | D884: 2 | E884: =C884*6+D884 -> 8 | G884: 2 | H884: 5 | I884: =G884*6+H884 -> 17 | K884: 2 | L884: 8 | M884: =K884*6+L884 -> 20 | O884: 4 | P884: 14 | Q884: =O884*6+P884 -> 38 | S884: MILNE
A885: BEST PLAYERS
A886: YARRAVILLE | C886: PHILLIPS | F886: ROHLEDER | I886: McASEY | L886: NICHOLLS | O886: BODSWORTH | R886: SEITZ
A887: NORTHCOTE | C887: KNOWLES | F887: HINES | I887: POWELL | L887: STAFFORD | O887: BUCKLEY | R887: FARRELL
A888: GOALKICKERS
A889: YARRAVILLE | C889: PHILLIPS 5 | F889: BAGLIN 2 | I889: HARGREAVES | L889: HICKEY | N889: MASON | Q889: BODSWORTH
A890: NORTHCOTE | C890: DEANS 2 | F890: BEST | I890: SAUNDERS
A892: COBURG | C892: 3 | D892: 6 | E892: =C892*6+D892 -> 24 | G892: 6 | H892: 8 | I892: =G892*6+H892 -> 44 | K892: 8 | L892: 12 | M892: =K892*6+L892 -> 60 | O892: 11 | P892: 19 | Q892: =O892*6+P892 -> 85 | S892: CAMBERWELL
A893: CAMBERWELL | C893: 3 | D893: 0 | E893: =C893*6+D893 -> 18 | G893: 8 | H893: 2 | I893: =G893*6+H893 -> 50 | K893: 8 | L893: 5 | M893: =K893*6+L893 -> 53 | O893: 11 | P893: 8 | Q893: =O893*6+P893 -> 74 | S893: WRIGHT
A894: BEST PLAYERS
A895: COBURG | C895: FEWKES | F895: ROGAN | I895: PRICE | K895: STARBUCK | N895: CANNING | Q895: EQUID
A896: CAMBERWELL | C896: MILGATE | F896: BENBOW | I896: MOORE | K896: CARTER | N896: COOK | Q896: FLETCHER
A897: GOALKICKERS
A898: COBURG | C898: EQUID 3 | F898: JAMES 2 | I898: ROGAN | K898: BRYAR | M898: STARBUCK | O898: H WILKINSON | R898: HEWES | T898: CANNING
A899: CAMBERWELL | C899: MILGATE 5 | F899: MOORE 3 | I899: CARTER | K899: McFEE | M899: ROCHFORD
A901: BRUNSWICK | C901: 2 | D901: 5 | E901: =C901*6+D901 -> 17 | G901: 10 | H901: 12 | I901: =G901*6+H901 -> 72 | K901: 12 | L901: 14 | M901: =K901*6+L901 -> 86 | O901: 17 | P901: 21 | Q901: =O901*6+P901 -> 123 | S901: BRUNSWICK
A902: BOX HILL | C902: 2 | D902: 3 | E902: =C902*6+D902 -> 15 | G902: 4 | H902: 3 | I902: =G902*6+H902 -> 27 | K902: 7 | L902: 6 | M902: =K902*6+L902 -> 48 | O902: 10 | P902: 7 | Q902: =O902*6+P902 -> 67 | S902: RICHARDSON
A903: BEST PLAYERS
A904: BRUNSWICK | C904: WHELAN | F904: SPENCER | I904: DUNSTAN | L904: WEIR | N904: TAYLOR | Q904: POLLARD
A905: BOX HILL | C905: MIHAN | F905: W COGHLAN | I905: WRIGHT | L905: HEALY | N905: HIND | Q905: CURTAIN
A906: GOALKICKERS
A907: BRUNSWICK | C907: McFARLANE 3 | F907: SEYMOUR 3 | I907: DUNSTAN 2 | L907: SPENCER 2 | N907: STANLEY 2 | Q907: WEIR | S907: MULLENGER | W907: CAREY | X907: RYAN | Z907: WHELAN
A908: BOX HILL | C908: W COGHLAN 3 | F908: MIHAN 2 | I908: WRIGHT | K908: CURTAIN | M908: MAIDMENT | P908: JORDAN | R908: B COGHLAN
A910: OAKLEIGH | C910: 4 | D910: 4 | E910: =C910*6+D910 -> 28 | G910: 12 | H910: 8 | I910: =G910*6+H910 -> 80 | K910: 19 | L910: 11 | M910: =K910*6+L910 -> 125 | O910: 26 | P910: 14 | Q910: =O910*6+P910 -> 170 | S910: CHELT
A911: MOORABBIN | C911: 2 | D911: 2 | E911: =C911*6+D911 -> 14 | G911: 5 | H911: 8 | I911: =G911*6+H911 -> 38 | K911: 5 | L911: 8 | M911: =K911*6+L911 -> 38 | O911: 7 | P911: 12 | Q911: =O911*6+P911 -> 54 | S911: JOHNS
A912: BEST PLAYERS
A913: OAKLEIGH | C913: POWER | E913: SCOTT | G913: CUNNINGHAM | K913: C WATSON | N913: BOYLE | Q913: HILL
A914: MOORABBIN | C914: DODDS | E914: BOYD | G914: RICHARDSON | K914: HOCKING | N914: COPSEY | Q914: D'OLIVER
A915: GOALKICKERS
A916: OAKLEIGH | C916: EDWARDS 4 | F916: SCOTT 4 | H916: HILL 4 | J916: STREETER 3 | M916: J WATSON 3 | P916: W WILLIAMS 3 | T916: RICKERT 2 | X916: BAXTER | Z916: PERKINS | AB916: HOWELL
A917: MOORABBIN | C917: DODDS 3 | F917: PATEMAN | I917: MURNANE | L917: GOODES | N917: BOYD
A919: ROUND 15 | E919: 4TH AUGUST | J919: WEATHER | M919: COLD WIND LIGHT RAIN | S919: PLAYED AT
D920: 1ST QTR | H920: 2ND QTR | L920: 3RD QTR | P920: FINAL | S920: OAKLEIGH
A921: PORT MELBOURNE | C921: 1 | D921: 6 | E921: =C921*6+D921 -> 12 | G921: 2 | H921: 8 | I921: =G921*6+H921 -> 20 | K921: 7 | L921: 14 | M921: =K921*6+L921 -> 56 | O921: 10 | P921: 16 | Q921: =O921*6+P921 -> 76 | S921: UMPIRE | X921: LADDER | AB921: ROUND | AD921: 15
A922: OAKLEIGH | C922: 1 | D922: 2 | E922: =C922*6+D922 -> 8 | G922: 4 | H922: 9 | I922: =G922*6+H922 -> 33 | K922: 5 | L922: 10 | M922: =K922*6+L922 -> 40 | O922: 6 | P922: 13 | Q922: =O922*6+P922 -> 49 | S922: MERRINGTON
A923: BEST PLAYERS | W923: TEAM | X923: W | Y923: L | Z923: D | AA923: FOR | AB923: AGST | AC923: % | AD923: PTS
A924: PORT MELBOURNE | C924: WALSH | E924: LAFFEY | H924: CLEARY | K924: MILLER | N924: JOHNSON | Q924: ATKINSON
A925: OAKLEIGH | C925: TEMME | E925: BAXTER | H925: WILLIAMS | K925: EDWARDS | N925: HILL | Q925: STREETER | W925: PORT MELBOURNE | X925: 12 | Y925: 2 | Z925: 1 | AA925: 1551 | AB925: 997 | AC925: 155.56670010030089 | AD925: 50
A926: GOALKICKERS | W926: SANDRINGHAM | X926: 12 | Y926: 3 | Z926: 0 | AA926: 1552 | AB926: 1154 | AC926: 134.49 | AD926: 48
A927: PORT MELBOURNE | C927: WALSH 5 | F927: MILLER 2 | I927: LAFFEY 2 | L927: AUSTIN | W927: PRAHRAN | X927: 12 | Y927: 3 | Z927: 0 | AA927: 1436 | AB927: 1183 | AC927: 121.39 | AD927: 48
A928: OAKLEIGH | C928: J WATSON 2 | F928: STREETER 2 | I928: W WILLIAMS | L928: RICKERT | W928: OAKLEIGH | X928: 9 | Y928: 5 | Z928: 1 | AA928: 1480 | AB928: 1124 | AC928: 131.67259786476868 | AD928: 38
A930: NORTHCOTE | C930: 2 | D930: 8 | E930: =C930*6+D930 -> 20 | G930: 4 | H930: 10 | I930: =G930*6+H930 -> 34 | K930: 6 | L930: 15 | M930: =K930*6+L930 -> 51 | O930: 9 | P930: 17 | Q930: =O930*6+P930 -> 71 | S930: WILLIAMSTOWN | W930: BRIGHTON | X930: 9 | Y930: 6 | Z930: 0 | AA930: 1428 | AB930: 1218 | AC930: 117.24137931034483 | AD930: 36
A931: WILLIAMSTOWN | C931: 1 | D931: 3 | E931: =C931*6+D931 -> 9 | G931: 6 | H931: 5 | I931: =G931*6+H931 -> 41 | K931: 6 | L931: 6 | M931: =K931*6+L931 -> 42 | O931: 8 | P931: 10 | Q931: =O931*6+P931 -> 58 | S931: CLEARY | W931: NORTHCOTE | X931: 9 | Y931: 6 | Z931: 0 | AA931: 1013 | AB931: 987 | AC931: 102.63 | AD931: 36
A932: BEST PLAYERS | W932: WILLIAMSTOWN | X932: 8 | Y932: 6 | Z932: 1 | AA932: 1347 | AB932: 1080 | AC932: 124.72222222222223 | AD932: 34
A933: NORTHCOTE | C933: KNOWLES | F933: PAWSEY | I933: STAFFORD | L933: WOOLNOUGH | O933: DOWNS | R933: BOWES | W933: BRUNSWICK | X933: 8 | Y933: 6 | Z933: 1 | AA933: 1065 | AB933: 1054 | AC933: 101.04 | AD933: 34
A934: WILLIAMSTOWN | C934: ALLANSON | F934: W WILLIAMS | I934: G WILLIAMS | L934: CALLAHAN | O934: MOLYNEUX | R934: SHEAHAN | W934: PRESTON | X934: 6 | Y934: 7 | Z934: 2 | AA934: 1271 | AB934: 1253 | AC934: 101.4365522745411 | AD934: 28
A935: GOALKICKERS | W935: YARRAVILLE | X935: 7 | Y935: 8 | Z935: 0 | AA935: 1168 | AB935: 1245 | AC935: 93.82 | AD935: 28
A936: NORTHCOTE | C936: SAUNDERS 3 | F936: PAWSEY 2 | I936: WHITECHURCH | L936: E WHITE | N936: WOOLNOUGH | Q936: BROWN | W936: COBURG | X936: 6 | Y936: 9 | Z936: 0 | AA936: 1292 | AB936: 1295 | AC936: 99.77 | AD936: 24
A937: WILLIAMSTOWN | C937: WALKER 2 | F937: SHEAHAN 2 | I937: DULLARD 2 | L937: AULD | N937: ABBERTON | W937: MOORABBIN | X937: 2 | Y937: 13 | Z937: 0 | AA937: 1157 | AB937: 1694 | AC937: 68.299881936245569 | AD937: 8
W938: CAMBERWELL | X938: 1 | Y938: 13 | Z938: 1 | AA938: 967 | AB938: 1476 | AC938: 65.51 | AD938: 6
A939: BRUNSWICK | C939: 4 | D939: 7 | E939: =C939*6+D939 -> 31 | G939: 4 | H939: 7 | I939: =G939*6+H939 -> 31 | K939: 8 | L939: 10 | M939: =K939*6+L939 -> 58 | O939: 10 | P939: 15 | Q939: =O939*6+P939 -> 75 | S939: PRESTON | W939: BOX HILL | X939: 0 | Y939: 14 | Z939: 1 | AA939: 790 | AB939: 1757 | AC939: 44.96 | AD939: 2
A940: PRESTON | C940: 1 | D940: 0 | E940: =C940*6+D940 -> 6 | G940: 7 | H940: 3 | I940: =G940*6+H940 -> 45 | K940: 9 | L940: 5 | M940: =K940*6+L940 -> 59 | O940: 11 | P940: 6 | Q940: =O940*6+P940 -> 72 | S940: IRVING
A941: BEST PLAYERS
A942: BRUNSWICK | C942: WEIR | F942: TAYLOR | I942: WHELAN | L942: GEISLER | N942: DUNSTAN | Q942: ARMSTRONG
A943: PRESTON | C943: K CHARD | F943: MEARS | I943: HARVEY | L943: HENRYS | N943: PRITCHARD | Q943: COOPER
A944: GOALKICKERS
A945: BRUNSWICK | C945: McFARLANE 4 | F945: SPENCER 3 | I945: WHELAN | K945: NEILSON | M945: DUNSTAN
A946: PRESTON | C946: HARVEY 5 | F946: F CHARD 3 | I946: NATHAN | K946: MEARS | M946: BRADFORD
A948: COBURG | C948: 0 | D948: 1 | E948: =C948*6+D948 -> 1 | G948: 2 | H948: 6 | I948: =G948*6+H948 -> 18 | K948: 5 | L948: 10 | M948: =K948*6+L948 -> 40 | O948: 9 | P948: 12 | Q948: =O948*6+P948 -> 66 | S948: COBURG
A949: YARRAVILLE | C949: 3 | D949: 4 | E949: =C949*6+D949 -> 22 | G949: 3 | H949: 6 | I949: =G949*6+H949 -> 24 | K949: 5 | L949: 9 | M949: =K949*6+L949 -> 39 | O949: 5 | P949: 13 | Q949: =O949*6+P949 -> 43 | S949: SMYTH
A950: BEST PLAYERS
A951: COBURG | C951: HEWES | F951: FEWKES | I951: McTAGGART | L951: PRICE | N951: STARBUCK | Q951: MANGELS
A952: YARRAVILLE | C952: ELDRIDGE | F952: NICHOLLS | I952: CRANAGE | L952: SEITZ | N952: PHILLIPS | Q952: MURPHY
A953: GOALKICKERS
A954: COBURG | C954: HEWES 4 | F954: JAMES 2 | I954: H WILKINSON 2 | M954: EQUID
A955: YARRAVILLE | C955: MASON 2 | F955: HICKEY 2 | I955: PHILLIPS
A957: BRIGHTON | C957: 4 | D957: 8 | E957: =C957*6+D957 -> 32 | G957: 9 | H957: 9 | I957: =G957*6+H957 -> 63 | K957: 12 | L957: 17 | M957: =K957*6+L957 -> 89 | O957: 16 | P957: 22 | Q957: =O957*6+P957 -> 118 | S957: BOX HILL
A958: BOX HILL | C958: 1 | D958: 2 | E958: =C958*6+D958 -> 8 | G958: 6 | H958: 5 | I958: =G958*6+H958 -> 41 | K958: 6 | L958: 5 | M958: =K958*6+L958 -> 41 | O958: 9 | P958: 5 | Q958: =O958*6+P958 -> 59 | S958: RICHARDSON
A959: BEST PLAYERS
A960: BRIGHTON | C960: ADAMSON | F960: MARINI | I960: SINCLAIR | L960: RIDDELL | N960: CONDON | Q960: E TURNER
A961: BOX HILL | C961: GREEN | F961: MAIDMENT | I961: HAMMOND | L961: KRONK | N961: LEISHMAN | Q961: VANCE
A962: GOALKICKERS
A963: BRIGHTON | C963: ADAMSON 5 | F963: SINCLAIR 4 | I963: CONDON 2 | L963: HOWE 2 | N963: PICKERING | Q963: PINDER
A964: BOX HILL | C964: MAIDMENT 4 | F964: W COGHLAN | I964: KRONK | K964: GREEN | M964: COLLINS | P964: WRIGHT
A966: PRAHRAN | C966: 5 | D966: 2 | E966: =C966*6+D966 -> 32 | G966: 9 | H966: 3 | I966: =G966*6+H966 -> 57 | K966: 12 | L966: 9 | M966: =K966*6+L966 -> 81 | O966: 14 | P966: 13 | Q966: =O966*6+P966 -> 97 | S966: TOORAK PARK
A967: MOORABBIN | C967: 5 | D967: 5 | E967: =C967*6+D967 -> 35 | G967: 5 | H967: 9 | I967: =G967*6+H967 -> 39 | K967: 7 | L967: 12 | M967: =K967*6+L967 -> 54 | O967: 8 | P967: 17 | Q967: =O967*6+P967 -> 65 | S967: BOWDEN
A968: BEST PLAYERS
A969: PRAHRAN | C969: MORROW | F969: ELLIS | I969: KRUSE | L969: WALSH | N969: SHILLABEER | Q969: ARMSTRONG
A970: MOORABBIN | C970: RICHARDSON | F970: ANDREW | I970: DODDS | L970: COPSEY | N970: BAKER | Q970: CARPENTER
A971: GOALKICKERS
A972: PRAHRAN | C972: MORROW 3 | F972: KRUSE 2 | H972: HARVEY 2 | J972: ELLIS 2 | L972: McCULLOCH | O972: ARMSTRONG | R972: KINNABURGH | W972: CHIPP | X972: WALSH
A973: MOORABBIN | C973: RICHARDSON 3 | F973: DODDS 2 | I973: PHILLIPS 2 | L973: BAKER
A975: SANDRINGHAM | C975: 2 | D975: 2 | E975: =C975*6+D975 -> 14 | G975: 7 | H975: 10 | I975: =G975*6+H975 -> 52 | K975: 9 | L975: 14 | M975: =K975*6+L975 -> 68 | O975: 13 | P975: 17 | Q975: =O975*6+P975 -> 95 | S975: BEACH ROAD
A976: CAMBERWELL | C976: 1 | D976: 1 | E976: =C976*6+D976 -> 7 | G976: 3 | H976: 3 | I976: =G976*6+H976 -> 21 | K976: 5 | L976: 4 | M976: =K976*6+L976 -> 34 | O976: 5 | P976: 9 | Q976: =O976*6+P976 -> 39 | S976: MILNE
A977: BEST PLAYERS
A978: SANDRINGHAM | C978: GUILLE | F978: GRAMBEAU | I978: G JONES | L978: RUSSELL | O978: B HARPER | R978: R HARPER
A979: CAMBERWELL | C979: ROCHFORD | F979: ALLEN | I979: SCHNEIDER | L979: MARION | O979: BOHAN | R979: FLETCHER
A980: GOALKICKERS
A981: SANDRINGHAM | C981: B HARPER 5 | F981: GRAMBEAU 4 | I981: BURRINGTON 2 | L981: G JONES | O981: HISCOCK
A982: CAMBERWELL | C982: SCHNEIDER 2 | F982: ROCHFORD | I982: DUFF | K982: MILGATE
A984: ROUND 16 | E984: 11TH AUGUST | I984: WEATHER | L984: SOUTH WEST WIND COLD SHOWERS | S984: PLAYED AT
D985: 1ST QTR | H985: 2ND QTR | L985: 3RD QTR | P985: FINAL | S985: PORT MELBOURNE
A986: PRAHRAN | C986: 1 | D986: 3 | E986: =C986*6+D986 -> 9 | G986: 4 | H986: 7 | I986: =G986*6+H986 -> 31 | K986: 7 | L986: 11 | M986: =K986*6+L986 -> 53 | O986: 13 | P986: 14 | Q986: =O986*6+P986 -> 92 | S986: UMPIRE | X986: LADDER | AB986: ROUND | AD986: 16
A987: PORT MELBOURNE | C987: 3 | D987: 4 | E987: =C987*6+D987 -> 22 | G987: 8 | H987: 7 | I987: =G987*6+H987 -> 55 | K987: 10 | L987: 11 | M987: =K987*6+L987 -> 71 | O987: 12 | P987: 13 | Q987: =O987*6+P987 -> 85 | S987: WRIGHT
A988: BEST PLAYERS | W988: TEAM | X988: W | Y988: L | Z988: D | AA988: FOR | AB988: AGST | AC988: % | AD988: PTS
A989: PRAHRAN | C989: SHILLABEER | F989: MORROW | I989: KINNABURGH | L989: KRUSE | N989: ARMSTRONG | Q989: JONES
A990: PORT MELBOURNE | C990: STOREY | F990: ATKINSON | I990: MURRAY | L990: MILLER | N990: JOHNSON | Q990: DRINAN | W990: SANDRINGHAM | X990: 13 | Y990: 3 | Z990: 0 | AA990: 1648 | AB990: 1201 | AC990: 137.22 | AD990: 52
A991: GOALKICKERS | W991: PRAHRAN | X991: 13 | Y991: 3 | Z991: 0 | AA991: 1528 | AB991: 1268 | AC991: 120.5 | AD991: 52
A992: PRAHRAN | C992: SHILLABEER 5 | F992: MORROW 2 | I992: KINNABURGH 2 | L992: McCULLOCH 2 | O992: LENZ | Q992: ARMSTRONG | W992: PORT MELBOURNE | X992: 12 | Y992: 3 | Z992: 1 | AA992: 1636 | AB992: 1089 | AC992: 150.22956841138659 | AD992: 50
A993: PORT MELBOURNE | C993: ATKINSON 3 | F993: WALSH 3 | I993: MURRAY 2 | L993: LOWRIE 2 | N993: McDONALD | Q993: MILLER | W993: OAKLEIGH | X993: 10 | Y993: 5 | Z993: 1 | AA993: 1581 | AB993: 1196 | AC993: 132.19063545150502 | AD993: 42
A995: BRIGHTON | C995: 1 | D995: 1 | E995: =C995*6+D995 -> 7 | G995: 7 | H995: 6 | I995: =G995*6+H995 -> 48 | K995: 10 | L995: 10 | M995: =K995*6+L995 -> 70 | O995: 16 | P995: 18 | Q995: =O995*6+P995 -> 114 | S995: ELSTERNWICK PARK | W995: BRIGHTON | X995: 10 | Y995: 6 | Z995: 0 | AA995: 1542 | AB995: 1314 | AC995: 117.35159817351598 | AD995: 40
A996: PRESTON | C996: 6 | D996: 3 | E996: =C996*6+D996 -> 39 | G996: 10 | H996: 8 | I996: =G996*6+H996 -> 68 | K996: 12 | L996: 12 | M996: =K996*6+L996 -> 84 | O996: 14 | P996: 12 | Q996: =O996*6+P996 -> 96 | S996: MERRINGTON | W996: WILLIAMSTOWN | X996: 9 | Y996: 6 | Z996: 1 | AA996: 1443 | AB996: 1155 | AC996: 124.94 | AD996: 38
A997: BEST PLAYERS | W997: NORTHCOTE | X997: 9 | Y997: 7 | Z997: 0 | AA997: 1091 | AB997: 1081 | AC997: 100.93 | AD997: 36
A998: BRIGHTON | C998: MARINI | F998: G TURNER | I998: RIDDELL | L998: BURKE | N998: PINDER | Q998: MORRIS | W998: BRUNSWICK | X998: 8 | Y998: 7 | Z998: 1 | AA998: 1140 | AB998: 1150 | AC998: 99.13 | AD998: 34
A999: PRESTON | C999: PRITCHARD | F999: L SWEET | I999: F CHARD | L999: MEARS | N999: HARVEY | Q999: SHAW | W999: COBURG | X999: 7 | Y999: 9 | Z999: 0 | AA999: 1386 | AB999: 1373 | AC999: 100.95 | AD999: 28
A1000: GOALKICKERS | R1000: MORRIS | W1000: PRESTON | X1000: 6 | Y1000: 8 | Z1000: 2 | AA1000: 1367 | AB1000: 1367 | AC1000: 100 | AD1000: 28
A1001: BRIGHTON | C1001: MARINI 3 | E1001: SINCLAIR 3 | H1001: HOWE 3 | J1001: G TURNER 2 | M1001: PINDER | O1001: EMBLETON | Q1001: CONDON | S1001: BURKE | W1001: YARRAVILLE | X1001: 7 | Y1001: 9 | Z1001: 0 | AA1001: 1215 | AB1001: 1341 | AC1001: 90.6 | AD1001: 28
A1002: PRESTON | C1002: HARVEY 6 | F1002: MEARS 3 | I1002: NATHAN 2 | L1002: F CHARD | N1002: CUGLEY | P1002: SHAW | W1002: MOORABBIN | X1002: 3 | Y1002: 13 | Z1002: 0 | AA1002: 1278 | AB1002: 1773 | AC1002: 72.081218274111677 | AD1002: 12
W1003: CAMBERWELL | X1003: 1 | Y1003: 14 | Z1003: 1 | AA1003: 1039 | AB1003: 1577 | AC1003: 65.88 | AD1003: 6
A1004: WILLIAMSTOWN | C1004: 4 | D1004: 3 | E1004: =C1004*6+D1004 -> 27 | G1004: 4 | H1004: 9 | I1004: =G1004*6+H1004 -> 33 | K1004: 6 | L1004: 16 | M1004: =K1004*6+L1004 -> 52 | O1004: 13 | P1004: 18 | Q1004: =O1004*6+P1004 -> 96 | S1004: BRUNSWICK | W1004: BOX HILL | X1004: 0 | Y1004: 15 | Z1004: 1 | AA1004: 869 | AB1004: 1878 | AC1004: 46.27 | AD1004: 2
A1005: BRUNSWICK | C1005: 3 | D1005: 3 | E1005: =C1005*6+D1005 -> 21 | G1005: 4 | H1005: 10 | I1005: =G1005*6+H1005 -> 34 | K1005: 8 | L1005: 11 | M1005: =K1005*6+L1005 -> 59 | O1005: 10 | P1005: 15 | Q1005: =O1005*6+P1005 -> 75 | S1005: SMYTH
A1006: BEST PLAYERS
A1007: WILLIAMSTOWN | C1007: G WILLIAMS | F1007: ALLANSON | I1007: WOOKEY | L1007: GARDNER | O1007: CALLAHAN | R1007: POOLE
A1008: BRUNSWICK | C1008: WHELAN | F1008: TAYLOR | I1008: GEISLER | L1008: SPENCER | O1008: WEIR | R1008: MAY
A1009: GOALKICKERS
A1010: WILLIAMSTOWN | C1010: WALKER 5 | F1010: G WILLIAMS 3 | J1010: ABBERTON 2 | M1010: W WILLIAMS | P1010: GUNN | R1010: MOLYNEUX
A1011: BRUNSWICK | C1011: ARMSTRONG 3 | F1011: WEIR 2 | H1011: MULLENGER 2 | K1011: SEYMOUR | M1011: WHELAN | O1011: McFARLANE
A1013: MOORABBIN | C1013: 9 | D1013: 2 | E1013: =C1013*6+D1013 -> 56 | G1013: 10 | H1013: 4 | I1013: =G1013*6+H1013 -> 64 | K1013: 13 | L1013: 9 | M1013: =K1013*6+L1013 -> 87 | O1013: 18 | P1013: 13 | Q1013: =O1013*6+P1013 -> 121 | S1013: CHELT
A1014: BOX HILL | C1014: 1 | D1014: 1 | E1014: =C1014*6+D1014 -> 7 | G1014: 7 | H1014: 6 | I1014: =G1014*6+H1014 -> 48 | K1014: 10 | L1014: 8 | M1014: =K1014*6+L1014 -> 68 | O1014: 12 | P1014: 7 | Q1014: =O1014*6+P1014 -> 79 | S1014: JOHNS
A1015: BEST PLAYERS
A1016: MOORABBIN | C1016: D'OLIVER | E1016: MURNANE | H1016: RICHARDSON | K1016: BOYD | N1016: COPSEY | Q1016: GILDER
A1017: BOX HILL | C1017: GREEN | E1017: VANCE | H1017: KRONK | K1017: WRIGHT | N1017: HEALY | Q1017: HAMMOND
A1018: GOALKICKERS
A1019: MOORABBIN | C1019: MURNANE 5 | F1019: LINSDELL 3 | I1019: DODDS 3 | K1019: PHILLIPS 2 | M1019: GOODES | O1019: BOYD | Q1019: RICHARDSON | T1019: STOKES | W1019: JONES
A1020: BOX HILL | C1020: WRIGHT 3 | F1020: MIHAN 2 | I1020: MAIDMENT 2 | L1020: O'REILLY | N1020: VANCE | P1020: KRONK | R1020: W COGHLAN | V1020: HEALY
A1022: COBURG | C1022: 5 | D1022: 4 | E1022: =C1022*6+D1022 -> 34 | G1022: 7 | H1022: 8 | I1022: =G1022*6+H1022 -> 50 | K1022: 10 | L1022: 8 | M1022: =K1022*6+L1022 -> 68 | O1022: 14 | P1022: 10 | Q1022: =O1022*6+P1022 -> 94 | S1022: NORTHCOTE
A1023: NORTHCOTE | C1023: 1 | D1023: 3 | E1023: =C1023*6+D1023 -> 9 | G1023: 5 | H1023: 5 | I1023: =G1023*6+H1023 -> 35 | K1023: 8 | L1023: 9 | M1023: =K1023*6+L1023 -> 57 | O1023: 11 | P1023: 12 | Q1023: =O1023*6+P1023 -> 78 | S1023: RICHARDSON
A1024: BEST PLAYERS
A1025: COBURG | C1025: H WILKINSON | F1025: STARBUCK | I1025: McTAGGART | L1025: WALKER | N1025: FEWKES | Q1025: HEWES
A1026: NORTHCOTE | C1026: ALDRIDGE | F1026: HISCOX | I1026: HINES | L1026: FARRELL | N1026: LAWTON | Q1026: VAINS
A1027: GOALKICKERS
A1028: COBURG | C1028: H WILKINSON 4 | F1028: R WILKINSON 3 | J1028: HEWES 3 | L1028: EQUID | N1028: BRYAR | P1028: STARBUCK | S1028: JAMES
A1029: NORTHCOTE | C1029: FARRELL 4 | F1029: SAUNDERS 3 | I1029: WHITE 3 | K1029: HISCOX
A1031: SANDRINGHAM | C1031: 4 | D1031: 8 | E1031: =C1031*6+D1031 -> 32 | G1031: 5 | H1031: 13 | I1031: =G1031*6+H1031 -> 43 | K1031: 10 | L1031: 14 | M1031: =K1031*6+L1031 -> 74 | O1031: 13 | P1031: 18 | Q1031: =O1031*6+P1031 -> 96 | S1031: YARRAVILLE
A1032: YARRAVILLE | C1032: 0 | D1032: 3 | E1032: =C1032*6+D1032 -> 3 | G1032: 3 | H1032: 7 | I1032: =G1032*6+H1032 -> 25 | K1032: 4 | L1032: 8 | M1032: =K1032*6+L1032 -> 32 | O1032: 6 | P1032: 11 | Q1032: =O1032*6+P1032 -> 47 | S1032: IRVING
A1033: BEST PLAYERS
A1034: SANDRINGHAM | C1034: R HARPER | F1034: G JONES | I1034: HISCOCK | L1034: RUSSELL | N1034: B HARPER | Q1034: WALKER
A1035: YARRAVILLE | C1035: MASON | F1035: SALT | I1035: McASEY | L1035: CRANAGE | N1035: ROHLEDER | Q1035: McCANN
A1036: GOALKICKERS
A1037: SANDRINGHAM | C1037: B HARPER 5 | F1037: HISCOCK 2 | I1037: BURRINGTON | L1037: RUSSELL | N1037: GRAMBEAU | Q1037: G JONES | S1037: BENCRAFT | V1037: COLLINS
A1038: YARRAVILLE | C1038: HICKEY 3 | F1038: BAGLIN 3 | I1038: PHILLIPS
A1040: OAKLEIGH | C1040: 6 | D1040: 4 | E1040: =C1040*6+D1040 -> 40 | G1040: 10 | H1040: 10 | I1040: =G1040*6+H1040 -> 70 | K1040: 12 | L1040: 13 | M1040: =K1040*6+L1040 -> 85 | O1040: 14 | P1040: 17 | Q1040: =O1040*6+P1040 -> 101 | S1040: CAMBERWELL
A1041: CAMBERWELL | C1041: 2 | D1041: 1 | E1041: =C1041*6+D1041 -> 13 | G1041: 6 | H1041: 2 | I1041: =G1041*6+H1041 -> 38 | K1041: 8 | L1041: 4 | M1041: =K1041*6+L1041 -> 52 | O1041: 11 | P1041: 6 | Q1041: =O1041*6+P1041 -> 72 | S1041: CLEARY
A1042: BEST PLAYERS
A1043: OAKLEIGH | C1043: TINDAL | F1043: BAXTER | I1043: JOHNSON | L1043: EDWARDS | O1043: STREETER | R1043: SCOTT
A1044: CAMBERWELL | C1044: FLETCHER | F1044: ROCHFORD | I1044: ALLEN | L1044: MILGATE | O1044: HEATLEY | R1044: MARION
A1045: GOALKICKERS
A1046: OAKLEIGH | C1046: J WATSON 4 | F1046: EDWARDS 4 | I1046: STREETER 2 | L1046: SCOTT 2 | N1046: TINDAL | P1046: RICKERT
A1047: CAMBERWELL | C1047: MILGATE 4 | F1047: SCHNEIDER 2 | I1047: ROCHFORD 2 | L1047: DUFF | N1047: MARION | P1047: CARTER
A1049: ROUND 17 | E1049: 18TH AUGUST | J1049: WEATHER | O1049: DULL LIGHT RAIN | S1049: PLAYED AT
D1050: 1ST QTR | H1050: 2ND QTR | L1050: 3RD QTR | P1050: FINAL | S1050: BEACH ROAD
A1051: NORTHCOTE | C1051: 1 | D1051: 3 | E1051: =C1051*6+D1051 -> 9 | G1051: 3 | H1051: 5 | I1051: =G1051*6+H1051 -> 23 | K1051: 4 | L1051: 9 | M1051: =K1051*6+L1051 -> 33 | O1051: 11 | P1051: 10 | Q1051: =O1051*6+P1051 -> 76 | S1051: UMPIRE | X1051: LADDER | AB1051: ROUND | AD1051: 17
A1052: SANDRINGHAM | C1052: 3 | D1052: 2 | E1052: =C1052*6+D1052 -> 20 | G1052: 7 | H1052: 6 | I1052: =G1052*6+H1052 -> 48 | K1052: 7 | L1052: 12 | M1052: =K1052*6+L1052 -> 54 | O1052: 10 | P1052: 14 | Q1052: =O1052*6+P1052 -> 74 | S1052: MERRINGTON
A1053: BEST PLAYERS | W1053: TEAM | X1053: W | Y1053: L | Z1053: D | AA1053: FOR | AB1053: AGST | AC1053: % | AD1053: PTS
A1054: NORTHCOTE | C1054: HINES | E1054: SAUNDERS | H1054: ALDRIDGE | K1054: STABB | N1054: HISCOX | Q1054: PAWSEY
A1055: SANDRINGHAM | C1055: G JONES | E1055: ANDRESON | H1055: R HARPER | K1055: TURNBULL | N1055: BOURKE | Q1055: N JONES | W1055: PRAHRAN | X1055: 14 | Y1055: 3 | Z1055: 0 | AA1055: 1620 | AB1055: 1340 | AC1055: 120.9 | AD1055: 56
A1056: GOALKICKERS | W1056: PORT MELBOURNE | X1056: 13 | Y1056: 3 | Z1056: 1 | AA1056: 1717 | AB1056: 1153 | AC1056: 148.91587163920209 | AD1056: 54
A1057: NORTHCOTE | C1057: SAUNDERS 5 | F1057: E WHITE 2 | I1057: DEANS 2 | K1057: PAWSEY 2 | W1057: SANDRINGHAM | X1057: 13 | Y1057: 4 | Z1057: 0 | AA1057: 1722 | AB1057: 1277 | AC1057: 134.85 | AD1057: 52
A1058: SANDRINGHAM | C1058: B HARPER 3 | F1058: BURRINGTON 2 | J1058: CERINI | L1058: RUSSELL | N1058: G JONES | P1058: BOURKE | R1058: COLLINS | W1058: OAKLEIGH | X1058: 11 | Y1058: 5 | Z1058: 1 | AA1058: 1738 | AB1058: 1257 | AC1058: 138.26571201272873 | AD1058: 46
A1060: BRUNSWICK | C1060: 0 | D1060: 2 | E1060: =C1060*6+D1060 -> 2 | G1060: 4 | H1060: 5 | I1060: =G1060*6+H1060 -> 29 | K1060: 5 | L1060: 7 | M1060: =K1060*6+L1060 -> 37 | O1060: 9 | P1060: 8 | Q1060: =O1060*6+P1060 -> 62 | S1060: BRUNSWICK | W1060: BRIGHTON | X1060: 10 | Y1060: 7 | Z1060: 0 | AA1060: 1603 | AB1060: 1376 | AC1060: 116.49709302325581 | AD1060: 40
A1061: BRIGHTON | C1061: 6 | D1061: 5 | E1061: =C1061*6+D1061 -> 41 | G1061: 7 | H1061: 12 | I1061: =G1061*6+H1061 -> 54 | K1061: 7 | L1061: 13 | M1061: =K1061*6+L1061 -> 55 | O1061: 8 | P1061: 13 | Q1061: =O1061*6+P1061 -> 61 | S1061: CLEARY | W1061: NORTHCOTE | X1061: 10 | Y1061: 7 | Z1061: 0 | AA1061: 1167 | AB1061: 1155 | AC1061: 101.03 | AD1061: 40
A1062: BEST PLAYERS | W1062: WILLIAMSTOWN | X1062: 9 | Y1062: 7 | Z1062: 1 | AA1062: 1530 | AB1062: 1249 | AC1062: 122.5 | AD1062: 38
A1063: BRUNSWICK | C1063: TAYLOR | E1063: SPENCER | H1063: WHELAN | K1063: DUNSTAN | N1063: GEISLER | Q1063: RYAN | W1063: BRUNSWICK | X1063: 9 | Y1063: 7 | Z1063: 1 | AA1063: 1202 | AB1063: 1211 | AC1063: 99.26 | AD1063: 38
A1064: BRIGHTON | C1064: NEW | E1064: PINDER | H1064: PLUNKETT | K1064: E TURNER | N1064: JOUBERT | Q1064: PERKINS | W1064: PRESTON | X1064: 7 | Y1064: 8 | Z1064: 2 | AA1064: 1461 | AB1064: 1422 | AC1064: 102.74261603375527 | AD1064: 32
A1065: GOALKICKERS | W1065: COBURG | X1065: 8 | Y1065: 9 | Z1065: 0 | AA1065: 1480 | AB1065: 1460 | AC1065: 101.37 | AD1065: 32
A1066: BRUNSWICK | C1066: McFARLANE 2 | F1066: SPENCER 2 | I1066: WHELAN | K1066: WEIR | M1066: SEYMOUR | O1066: ARMSTRONG | R1066: DUNSTAN | W1066: YARRAVILLE | X1066: 7 | Y1066: 10 | Z1066: 0 | AA1066: 1276 | AB1066: 1498 | AC1066: 85.18 | AD1066: 28
A1067: BRIGHTON | C1067: ADAMSON 2 | F1067: CONDON 2 | I1067: PINDER 2 | K1067: NEW | M1067: PICKERING | W1067: MOORABBIN | X1067: 3 | Y1067: 14 | Z1067: 0 | AA1067: 1333 | AB1067: 1867 | AC1067: 71.397964649169793 | AD1067: 12
W1068: CAMBERWELL | X1068: 1 | Y1068: 15 | Z1068: 1 | AA1068: 1111 | AB1068: 1669 | AC1068: 66.57 | AD1068: 6
A1069: COBURG | C1069: 3 | D1069: 3 | E1069: =C1069*6+D1069 -> 21 | G1069: 4 | H1069: 11 | I1069: =G1069*6+H1069 -> 35 | K1069: 9 | L1069: 14 | M1069: =K1069*6+L1069 -> 68 | O1069: 13 | P1069: 16 | Q1069: =O1069*6+P1069 -> 94 | S1069: WILLIAMSTOWN | W1069: BOX HILL | X1069: 0 | Y1069: 16 | Z1069: 1 | AA1069: 933 | AB1069: 1959 | AC1069: 47.62 | AD1069: 2
A1070: WILLIAMSTOWN | C1070: 5 | D1070: 6 | E1070: =C1070*6+D1070 -> 36 | G1070: 8 | H1070: 10 | I1070: =G1070*6+H1070 -> 58 | K1070: 9 | L1070: 12 | M1070: =K1070*6+L1070 -> 66 | O1070: 12 | P1070: 15 | Q1070: =O1070*6+P1070 -> 87 | S1070: WRIGHT
A1071: BEST PLAYERS
A1072: COBURG | C1072: EVANS | F1072: EQUID | I1072: McTAGGART | L1072: STARBUCK | O1072: H WILKINSON | R1072: GILBERT
A1073: WILLIAMSTOWN | C1073: SAMPSON | F1073: WALKER | I1073: ROGERS | L1073: WOOKEY | O1073: McLAREN | R1073: ABBERTON
A1074: GOALKICKERS
A1075: COBURG | C1075: H WILKINSON 5 | F1075: R WILKINSON 3 | J1075: CLARKSON 2 | M1075: JAMES 2 | O1075: HEWES
A1076: WILLIAMSTOWN | C1076: WALKER 5 | F1076: TAYLOR 4 | I1076: ABBERTON | L1076: G WILLIAMS | O1076: W WILLIAMS
A1078: PRESTON | C1078: 2 | D1078: 3 | E1078: =C1078*6+D1078 -> 15 | G1078: 6 | H1078: 5 | I1078: =G1078*6+H1078 -> 41 | K1078: 9 | L1078: 8 | M1078: =K1078*6+L1078 -> 62 | O1078: 13 | P1078: 16 | Q1078: =O1078*6+P1078 -> 94 | S1078: PRESTON
A1079: MOORABBIN | C1079: 4 | D1079: 2 | E1079: =C1079*6+D1079 -> 26 | G1079: 4 | H1079: 5 | I1079: =G1079*6+H1079 -> 29 | K1079: 6 | L1079: 6 | M1079: =K1079*6+L1079 -> 42 | O1079: 8 | P1079: 7 | Q1079: =O1079*6+P1079 -> 55 | S1079: SMYTH
A1080: BEST PLAYERS
A1081: PRESTON | C1081: SHAW | E1081: HENRYS | H1081: WALKER | K1081: PRITCHARD | N1081: BRADFORD | Q1081: F CHARD
A1082: MOORABBIN | C1082: JACOBS | E1082: D'OLIVER | H1082: GILDER | K1082: GOODES | N1082: BOYD | Q1082: NORMAN
A1083: GOALKICKERS
A1084: PRESTON | C1084: BRADFORD 3 | F1084: MEARS 3 | I1084: HARVEY 3 | K1084: F CHARD 2 | N1084: CROCKER | P1084: GOLDIN
A1085: MOORABBIN | C1085: SUTHERLAND 2 | F1085: STOKES 2 | I1085: SAUNDERS | L1085: GOODES | N1085: MURNANE | Q1085: DODDS
A1087: OAKLEIGH | C1087: 9 | D1087: 5 | E1087: =C1087*6+D1087 -> 59 | G1087: 12 | H1087: 6 | I1087: =G1087*6+H1087 -> 78 | K1087: 18 | L1087: 8 | M1087: =K1087*6+L1087 -> 116 | O1087: 24 | P1087: 13 | Q1087: =O1087*6+P1087 -> 157 | S1087: OAKLEIGH
A1088: YARRAVILLE | C1088: 2 | D1088: 3 | E1088: =C1088*6+D1088 -> 15 | G1088: 5 | H1088: 6 | I1088: =G1088*6+H1088 -> 36 | K1088: 7 | L1088: 7 | M1088: =K1088*6+L1088 -> 49 | O1088: 9 | P1088: 7 | Q1088: =O1088*6+P1088 -> 61 | S1088: RICHARDSON
A1089: BEST PLAYERS
A1090: OAKLEIGH | C1090: W WILLIAMS | F1090: STREETER | I1090: J WATSON | L1090: BAXTER | O1090: HILL | R1090: RICKERT
A1091: YARRAVILLE | C1091: McASEY | F1091: MASON | I1091: GWYNNE | L1091: ROHLEDER | O1091: ELDRIDGE | R1091: SALT
A1092: GOALKICKERS
A1093: OAKLEIGH | C1093: J WATSON 6 | F1093: STREETER 6 | I1093: RICKERT 4 | K1093: SCOTT 2 | M1093: HILL 2 | O1093: W WILLIAMS | R1093: TINDAL | U1093: CUNNINGHAM | X1093: EDWARDS
A1094: YARRAVILLE | C1094: MASON 4 | F1094: SALT | H1094: McASEY | J1094: HICKEY | L1094: BODSWORTH | O1094: McBEAN
A1096: PRAHRAN | C1096: 2 | D1096: 2 | E1096: =C1096*6+D1096 -> 14 | G1096: 3 | H1096: 6 | I1096: =G1096*6+H1096 -> 24 | K1096: 8 | L1096: 8 | M1096: =K1096*6+L1096 -> 56 | O1096: 13 | P1096: 14 | Q1096: =O1096*6+P1096 -> 92 | S1096: TOORAK PARK
A1097: CAMBERWELL | C1097: 3 | D1097: 1 | E1097: =C1097*6+D1097 -> 19 | G1097: 6 | H1097: 4 | I1097: =G1097*6+H1097 -> 40 | K1097: 8 | L1097: 4 | M1097: =K1097*6+L1097 -> 52 | O1097: 11 | P1097: 6 | Q1097: =O1097*6+P1097 -> 72 | S1097: JOHNS
A1098: BEST PLAYERS
A1099: PRAHRAN | C1099: GRAMBEAU | F1099: WALSH | I1099: BUTLING | L1099: KRUSE | O1099: YATES | R1099: BURGESS
A1100: CAMBERWELL | C1100: HEATLEY | F1100: BOHAN | I1100: CARTER | L1100: BENBOW | O1100: BEDFORD | R1100: FLETCHER
A1101: GOALKICKERS
A1102: PRAHRAN | C1102: KRUSE 3 | E1102: McCULLOCH 2 | H1102: BURGESS 2 | J1102: KINNABURGH 2 | M1102: ARMSTRONG | P1102: WALSH | R1102: SHILLABEER | V1102: MORROW
A1103: CAMBERWELL | C1103: MILGATE 5 | F1103: MOORE 2 | I1103: McFEE | K1103: ROCHFORD | N1103: ROSENBROCK | Q1103: MARION
A1105: PORT MELBOURNE | C1105: 5 | D1105: 4 | E1105: =C1105*6+D1105 -> 34 | G1105: 5 | H1105: 9 | I1105: =G1105*6+H1105 -> 39 | K1105: 6 | L1105: 10 | M1105: =K1105*6+L1105 -> 46 | O1105: 11 | P1105: 15 | Q1105: =O1105*6+P1105 -> 81 | S1105: B.H
A1106: BOX HILL | C1106: 5 | D1106: 2 | E1106: =C1106*6+D1106 -> 32 | G1106: 7 | H1106: 4 | I1106: =G1106*6+H1106 -> 46 | K1106: 9 | L1106: 9 | M1106: =K1106*6+L1106 -> 63 | O1106: 9 | P1106: 10 | Q1106: =O1106*6+P1106 -> 64 | S1106: IRVING
A1107: BEST PLAYERS
A1108: PORT MELBOURNE | C1108: KELSEY | E1108: R ATKINSON | I1108: LAFFEY | L1108: WOODBRIDGE | O1108: DRINAN | R1108: MURRAY
A1109: BOX HILL | C1109: GREEN | E1109: LEISHMAN | I1109: MURDOCK | L1109: MAIDMENT | O1109: HAMMOND | R1109: MIHAN
A1110: GOALKICKERS
A1111: PORT MELBOURNE | C1111: AUSTIN 3 | F1111: R ATKINSON 2 | J1111: MILLER 2 | M1111: LAFFEY | O1111: WALSH | Q1111: LOWRIE | S1111: STOREY
A1112: BOX HILL | C1112: HAMMOND 3 | F1112: MAIDMENT 2 | I1112: HOUGHTON | L1112: COLLINS | N1112: MIHAN | P1112: VANCE
A1114: ROUND 18 | E1114: 25TH AUGUST | J1114: WEATHER | O1114: FINE & SUNNY | S1114: PLAYED AT
D1115: 1ST QTR | H1115: 2ND QTR | L1115: 3RD QTR | P1115: FINAL | S1115: NORTHCOTE
A1116: OAKLEIGH | C1116: 4 | D1116: 6 | E1116: =C1116*6+D1116 -> 30 | G1116: 5 | H1116: 8 | I1116: =G1116*6+H1116 -> 38 | K1116: 9 | L1116: 15 | M1116: =K1116*6+L1116 -> 69 | O1116: 11 | P1116: 16 | Q1116: =O1116*6+P1116 -> 82 | S1116: UMPIRE | X1116: LADDER | AB1116: ROUND | AD1116: 18
A1117: NORTHCOTE | C1117: 5 | D1117: 0 | E1117: =C1117*6+D1117 -> 30 | G1117: 9 | H1117: 4 | I1117: =G1117*6+H1117 -> 58 | K1117: 9 | L1117: 7 | M1117: =K1117*6+L1117 -> 61 | O1117: 9 | P1117: 12 | Q1117: =O1117*6+P1117 -> 66 | S1117: IRVING
A1118: BEST PLAYERS | W1118: TEAM | X1118: W | Y1118: L | Z1118: D | AA1118: FOR | AB1118: AGST | AC1118: % | AD1118: PTS
A1119: OAKLEIGH | C1119: J WATSON | F1119: POWER | I1119: PERKINS | L1119: STREETER | O1119: VAINS | Q1119: DALMANN
A1120: NORTHCOTE | C1120: SAUNDERS | F1120: HISCOX | I1120: DUNGAN | L1120: BUCKLEY | O1120: PAWSEY | Q1120: WOOLNOUGH | W1120: PRAHRAN | X1120: 15 | Y1120: 3 | Z1120: 0 | AA1120: 1724 | AB1120: 1426 | AC1120: 120.9 | AD1120: 60
A1121: GOALKICKERS | W1121: PORT MELBOURNE | X1121: 14 | Y1121: 3 | Z1121: 1 | AA1121: 1844 | AB1121: 1215 | AC1121: 151.76954732510288 | AD1121: 58
A1122: OAKLEIGH | C1122: J WATSON 4 | F1122: EDWARDS 2 | I1122: STREETER 2 | L1122: SCOTT | N1122: LAMBERT | Q1122: RICKERT | W1122: SANDRINGHAM | X1122: 13 | Y1122: 5 | Z1122: 0 | AA1122: 1803 | AB1122: 1418 | AC1122: 127.15 | AD1122: 52
A1123: NORTHCOTE | C1123: SAUNDERS 5 | F1123: WOOLNOUGH 2 | J1123: DEANS | L1123: PAWSEY | W1123: OAKLEIGH | X1123: 12 | Y1123: 5 | Z1123: 1 | AA1123: 1820 | AB1123: 1323 | AC1123: 137.56613756613757 | AD1123: 50
A1125: BRIGHTON | C1125: 2 | D1125: 7 | E1125: =C1125*6+D1125 -> 19 | G1125: 8 | H1125: 10 | I1125: =G1125*6+H1125 -> 58 | K1125: 11 | L1125: 13 | M1125: =K1125*6+L1125 -> 79 | O1125: 20 | P1125: 17 | Q1125: =O1125*6+P1125 -> 137 | S1125: ELSTERNWICK PARK | W1125: BRIGHTON | X1125: 11 | Y1125: 7 | Z1125: 0 | AA1125: 1740 | AB1125: 1484 | AC1125: 117.25067385444744 | AD1125: 44
A1126: WILLIAMSTOWN | C1126: 4 | D1126: 1 | E1126: =C1126*6+D1126 -> 25 | G1126: 8 | H1126: 2 | I1126: =G1126*6+H1126 -> 50 | K1126: 12 | L1126: 6 | M1126: =K1126*6+L1126 -> 78 | O1126: 17 | P1126: 6 | Q1126: =O1126*6+P1126 -> 108 | S1126: JOHNS | W1126: BRUNSWICK | X1126: 10 | Y1126: 7 | Z1126: 1 | AA1126: 1295 | AB1126: 1280 | AC1126: 101.17 | AD1126: 42
A1127: BEST PLAYERS | W1127: NORTHCOTE | X1127: 10 | Y1127: 8 | Z1127: 0 | AA1127: 1233 | AB1127: 1237 | AC1127: 99.68 | AD1127: 40
A1128: BRIGHTON | C1128: ADAMSON | F1128: NEW | I1128: E TURNER | L1128: G TURNER | O1128: BURKE | Q1128: PINDER | W1128: WILLIAMSTOWN | X1128: 9 | Y1128: 8 | Z1128: 1 | AA1128: 1638 | AB1128: 1386 | AC1128: 118.18 | AD1128: 38
A1129: WILLIAMSTOWN | C1129: ABBERTON | F1129: WALKER | I1129: DULLARD | L1129: MOLYNEUX | O1129: McLAREN | Q1129: ALLANSON | W1129: COBURG | X1129: 9 | Y1129: 9 | Z1129: 0 | AA1129: 1621 | AB1129: 1541 | AC1129: 105.19 | AD1129: 36
A1130: GOALKICKERS | W1130: PRESTON | X1130: 7 | Y1130: 9 | Z1130: 2 | AA1130: 1523 | AB1130: 1549 | AC1130: 98.321497740477724 | AD1130: 32
A1131: BRIGHTON | C1131: ADAMSON 8 | F1131: SINCLAIR 5 | I1131: BURKE 2 | K1131: PINDER 2 | M1131: G TURNER | O1131: CLARKE | Q1131: EMBLETON | W1131: YARRAVILLE | X1131: 7 | Y1131: 11 | Z1131: 0 | AA1131: 1362 | AB1131: 1602 | AC1131: 85.02 | AD1131: 28
A1132: WILLIAMSTOWN | C1132: WALKER 5 | F1132: ABBERTON 4 | I1132: GUNN 2 | K1132: PATON | M1132: MOLYNEUX | O1132: G WILLIAMS | R1132: BARKER | W1132: MOORABBIN | X1132: 3 | Y1132: 15 | Z1132: 0 | AA1132: 1402 | AB1132: 1960 | AC1132: 71.530612244897952 | AD1132: 12
Q1133: SHEAHAN | S1133: TAYLOR | W1133: CAMBERWELL | X1133: 2 | Y1133: 15 | Z1133: 1 | AA1133: 1249 | AB1133: 1788 | AC1133: 69.85 | AD1133: 10
A1134: PORT MELBOURNE | C1134: 5 | D1134: 4 | E1134: =C1134*6+D1134 -> 34 | G1134: 12 | H1134: 7 | I1134: =G1134*6+H1134 -> 79 | K1134: 16 | L1134: 12 | M1134: =K1134*6+L1134 -> 108 | O1134: 19 | P1134: 13 | Q1134: =O1134*6+P1134 -> 127 | S1134: PORT MELBOURNE | W1134: BOX HILL | X1134: 0 | Y1134: 17 | Z1134: 1 | AA1134: 1052 | AB1134: 2097 | AC1134: 50.17 | AD1134: 2
A1135: PRESTON | C1135: 2 | D1135: 2 | E1135: =C1135*6+D1135 -> 14 | G1135: 3 | H1135: 5 | I1135: =G1135*6+H1135 -> 23 | K1135: 4 | L1135: 11 | M1135: =K1135*6+L1135 -> 35 | O1135: 8 | P1135: 14 | Q1135: =O1135*6+P1135 -> 62 | S1135: MILNE
A1136: BEST PLAYERS
A1137: PORT MELBOURNE | C1137: JOHNSON | F1137: MILLER | I1137: WALSH | K1137: CARIS | N1137: DRINAN | Q1137: CLEARY
A1138: PRESTON | C1138: MEARS | F1138: PRITCHARD | I1138: NATHAN | K1138: BRADFORD | N1138: SHAW | Q1138: WALKER
A1139: GOALKICKERS
A1140: PORT MELBOURNE | C1140: WALSH 6 | F1140: MILLER 5 | I1140: McDONALD 3 | L1140: LOWRIE 2 | N1140: MURRAY | P1140: RAMSAY | R1140: STOREY
A1141: PRESTON | C1141: F CHARD 3 | F1141: MEARS 2 | I1141: NATHAN | K1141: COOPER | M1141: K SWEET
A1143: COBURG | C1143: 3 | D1143: 4 | E1143: =C1143*6+D1143 -> 22 | G1143: 11 | H1143: 10 | I1143: =G1143*6+H1143 -> 76 | K1143: 16 | L1143: 12 | M1143: =K1143*6+L1143 -> 108 | O1143: 21 | P1143: 15 | Q1143: =O1143*6+P1143 -> 141 | S1143: COBURG
A1144: SANDRINGHAM | C1144: 2 | D1144: 3 | E1144: =C1144*6+D1144 -> 15 | G1144: 4 | H1144: 6 | I1144: =G1144*6+H1144 -> 30 | K1144: 6 | L1144: 15 | M1144: =K1144*6+L1144 -> 51 | O1144: 10 | P1144: 21 | Q1144: =O1144*6+P1144 -> 81 | S1144: CLEARY
A1145: BEST PLAYERS
A1146: COBURG | C1146: HEWES | E1146: CANNING | H1146: ROGAN | K1146: GILBERT | N1146: EVANS | Q1146: EQUID
A1147: SANDRINGHAM | C1147: BOURKE | E1147: BEARD | H1147: GRAMBEAU | K1147: STANLEY | N1147: BENCRAFT | Q1147: BURRINGTON
A1148: GOALKICKERS
A1149: COBURG | C1149: HEWES 4 | E1149: ROGAN 4 | G1149: CANNING 2 | J1149: JAMES 2 | L1149: CLARKSON 2 | O1149: H WILKINSON 2 | R1149: LEVERSHA 2 | V1149: STARBUCK | X1149: WILSON | Z1149: EVANS
A1150: SANDRINGHAM | C1150: B HARPER 3 | F1150: HISCOCK 2 | I1150: WALKER | K1150: BEARD | M1150: BOURKE | O1150: GRAMBEAU | R1150: G JONES
A1152: CAMBERWELL | C1152: 8 | D1152: 3 | E1152: =C1152*6+D1152 -> 51 | G1152: 11 | H1152: 7 | I1152: =G1152*6+H1152 -> 73 | K1152: 17 | L1152: 12 | M1152: =K1152*6+L1152 -> 114 | O1152: 21 | P1152: 12 | Q1152: =O1152*6+P1152 -> 138 | S1152: CAMBERWELL
A1153: BOX HILL | C1153: 3 | D1153: 1 | E1153: =C1153*6+D1153 -> 19 | G1153: 8 | H1153: 3 | I1153: =G1153*6+H1153 -> 51 | K1153: 12 | L1153: 6 | M1153: =K1153*6+L1153 -> 78 | O1153: 18 | P1153: 11 | Q1153: =O1153*6+P1153 -> 119 | S1153: RICHARDSON
A1154: BEST PLAYERS
A1155: CAMBERWELL | C1155: McFEE | E1155: ROCHFORD | H1155: BENBOW | K1155: BEDFORD | N1155: MILGATE | Q1155: TAYLOR
A1156: BOX HILL | C1156: WRIGHT | E1156: O'REILLY | H1156: VANCE | K1156: KRONK | N1156: GREEN | Q1156: CONQUIT
A1157: GOALKICKERS
A1158: CAMBERWELL | C1158: McFEE 5 | F1158: MILGATE 5 | I1158: SCHNEIDER 4 | L1158: ROCHFORD 4 | O1158: TAYLOR 2 | R1158: ROSENBROCK
A1159: BOX HILL | C1159: MAIDMENT 6 | F1159: WRIGHT 5 | I1159: O'REILLY 3 | L1159: GOODWIN | N1159: HOUGHTON | Q1159: KRONK | S1159: MIHAN
A1161: BRUNSWICK | C1161: 3 | D1161: 7 | E1161: =C1161*6+D1161 -> 25 | G1161: 5 | H1161: 14 | I1161: =G1161*6+H1161 -> 44 | K1161: 8 | L1161: 17 | M1161: =K1161*6+L1161 -> 65 | O1161: 12 | P1161: 21 | Q1161: =O1161*6+P1161 -> 93 | S1161: CHELT
A1162: MOORABBIN | C1162: 5 | D1162: 2 | E1162: =C1162*6+D1162 -> 32 | G1162: 7 | H1162: 3 | I1162: =G1162*6+H1162 -> 45 | K1162: 8 | L1162: 8 | M1162: =K1162*6+L1162 -> 56 | O1162: 10 | P1162: 9 | Q1162: =O1162*6+P1162 -> 69 | S1162: MERRINGTON
A1163: BEST PLAYERS
A1164: BRUNSWICK | C1164: DUNSTAN | F1164: SPENCER | I1164: MUNRO | L1164: ROLFS | O1164: TAYLOR | R1164: WHELAN
A1165: MOORABBIN | C1165: BOYD | F1165: MURNANE | I1165: NORMAN | L1165: STOKES | O1165: COPSEY | R1165: GOODES
A1166: GOALKICKERS
A1167: BRUNSWICK | C1167: McFARLANE 4 | F1167: DUNSTAN 3 | I1167: WEIR 2 | K1167: PRIESTLEY | M1167: SPENCER | O1167: MULLENGER
A1168: MOORABBIN | C1168: MURNANE 3 | F1168: SUTHERLAND 2 | J1168: RICHARDSON | M1168: JACOBS | O1168: SMITH | Q1168: ANTONIE | S1168: STOKES
A1170: PRAHRAN | C1170: 4 | D1170: 4 | E1170: =C1170*6+D1170 -> 28 | G1170: 11 | H1170: 5 | I1170: =G1170*6+H1170 -> 71 | K1170: 15 | L1170: 6 | M1170: =K1170*6+L1170 -> 96 | O1170: 16 | P1170: 8 | Q1170: =O1170*6+P1170 -> 104 | S1170: YARRAVILLE
A1171: YARRAVILLE | C1171: 3 | D1171: 5 | E1171: =C1171*6+D1171 -> 23 | G1171: 5 | H1171: 8 | I1171: =G1171*6+H1171 -> 38 | K1171: 8 | L1171: 9 | M1171: =K1171*6+L1171 -> 57 | O1171: 12 | P1171: 14 | Q1171: =O1171*6+P1171 -> 86 | S1171: SMYTH
A1172: BEST PLAYERS
A1173: PRAHRAN | C1173: YATES | E1173: McCULLOCH | H1173: BURGESS | K1173: SHILLABEER | N1173: KINNABURGH | Q1173: JAMES
A1174: YARRAVILLE | C1174: MASON | E1174: BODSWORTH | H1174: MALBON | K1174: McASEY | N1174: KINDER | Q1174: MURPHY
A1175: GOALKICKERS
A1176: PRAHRAN | C1176: McCULLOCH 6 | F1176: SHILLABEER 2 | I1176: KINNABURGH 2 | L1176: MORROW 2 | N1176: BURGESS 2 | Q1176: KRUSE | S1176: WALSH
A1177: YARRAVILLE | C1177: MASON 3 | F1177: PHILLIPS 3 | I1177: HICKEY 3 | K1177: BODSWORTH 2 | N1177: KINDER
A1179: ROUND 19 | E1179: 1ST SEPTEMBER | I1179: WEATHER | K1179: NORTH WEST WIND RAIN IN NORTHERN SUBURBS | S1179: PLAYED AT
D1180: 1ST QTR | H1180: 2ND QTR | L1180: 3RD QTR | P1180: FINAL | S1180: BRUNSWICK
A1181: PORT MELBOURNE | C1181: 0 | D1181: 3 | E1181: =C1181*6+D1181 -> 3 | G1181: 4 | H1181: 6 | I1181: =G1181*6+H1181 -> 30 | K1181: 7 | L1181: 16 | M1181: =K1181*6+L1181 -> 58 | O1181: 8 | P1181: 18 | Q1181: =O1181*6+P1181 -> 66 | S1181: UMPIRE | X1181: LADDER | AB1181: ROUND | AD1181: 19
A1182: BRUNSWICK | C1182: 4 | D1182: 4 | E1182: =C1182*6+D1182 -> 28 | G1182: 4 | H1182: 5 | I1182: =G1182*6+H1182 -> 29 | K1182: 7 | L1182: 7 | M1182: =K1182*6+L1182 -> 49 | O1182: 8 | P1182: 10 | Q1182: =O1182*6+P1182 -> 58 | S1182: JOHNS
A1183: BEST PLAYERS | W1183: TEAM | X1183: W | Y1183: L | Z1183: D | AA1183: FOR | AB1183: AGST | AC1183: % | AD1183: PTS
A1184: PORT MELBOURNE | C1184: JOHNSON | F1184: WOODBRIDGE | I1184: MILLER | L1184: RAMSAY | N1184: KELSEY | Q1184: DRINAN
A1185: BRUNSWICK | C1185: WHELAN | F1185: NEILSON | I1185: SPENCER | L1185: TAYLOR | N1185: PRIESTLEY | Q1185: POLLARD | W1185: PRAHRAN | X1185: 16 | Y1185: 3 | Z1185: 0 | AA1185: 1838 | AB1185: 1478 | AC1185: 124.36 | AD1185: 64
A1186: GOALKICKERS | W1186: PORT MELBOURNE | X1186: 15 | Y1186: 3 | Z1186: 1 | AA1186: 1910 | AB1186: 1273 | AC1186: 150.03927729772192 | AD1186: 62
A1187: PORT MELBOURNE | C1187: ATKINSON 2 | F1187: MILLER 2 | I1187: CULPH | K1187: MURRAY | M1187: RAMSAY | O1187: McDONALD | W1187: SANDRINGHAM | X1187: 14 | Y1187: 5 | Z1187: 0 | AA1187: 1883 | AB1187: 1498 | AC1187: 125.7 | AD1187: 56
A1188: BRUNSWICK | C1188: McFARLANE 2 | F1188: WHELAN 2 | I1188: SPENCER | K1188: POLLARD | M1188: WEIR | O1188: PRIESTLEY | W1188: OAKLEIGH | X1188: 13 | Y1188: 5 | Z1188: 1 | AA1188: 1934 | AB1188: 1403 | AC1188: 137.84746970776908 | AD1188: 54
A1190: PRAHRAN | C1190: 3 | D1190: 1 | E1190: =C1190*6+D1190 -> 19 | G1190: 9 | H1190: 7 | I1190: =G1190*6+H1190 -> 61 | K1190: 14 | L1190: 10 | M1190: =K1190*6+L1190 -> 94 | O1190: 17 | P1190: 12 | Q1190: =O1190*6+P1190 -> 114 | S1190: TOORAK PARK | W1190: BRIGHTON | X1190: 12 | Y1190: 7 | Z1190: 0 | AA1190: 1825 | AB1190: 1567 | AC1190: 116.46458200382897 | AD1190: 48
A1191: NORTHCOTE | C1191: 5 | D1191: 2 | E1191: =C1191*6+D1191 -> 32 | G1191: 5 | H1191: 3 | I1191: =G1191*6+H1191 -> 33 | K1191: 6 | L1191: 7 | M1191: =K1191*6+L1191 -> 43 | O1191: 7 | P1191: 10 | Q1191: =O1191*6+P1191 -> 52 | S1191: CLEARY | W1191: BRUNSWICK | X1191: 10 | Y1191: 8 | Z1191: 1 | AA1191: 1353 | AB1191: 1346 | AC1191: 100.52 | AD1191: 42
A1192: BEST PLAYERS | W1192: NORTHCOTE | X1192: 10 | Y1192: 9 | Z1192: 0 | AA1192: 1285 | AB1192: 1351 | AC1192: 95.11 | AD1192: 40
A1193: PRAHRAN | C1193: WALSH | F1193: ARMSTRONG | I1193: BURGESS | L1193: McCULLOCH | O1193: YATES | Q1193: HARVEY | W1193: WILLIAMSTOWN | X1193: 9 | Y1193: 9 | Z1193: 1 | AA1193: 1718 | AB1193: 1466 | AC1193: 117.19 | AD1193: 38
A1194: NORTHCOTE | C1194: HISCOX | F1194: DEANS | I1194: STAFFORD | L1194: WOOLNOUGH | O1194: E WHITE | Q1194: KNOWLES | W1194: COBURG | X1194: 9 | Y1194: 10 | Z1194: 0 | AA1194: 1701 | AB1194: 1655 | AC1194: 102.78 | AD1194: 36
A1195: GOALKICKERS | M1195: KRUSE | O1195: CHIPP | Q1195: KINNABURGH | W1195: PRESTON | X1195: 8 | Y1195: 9 | Z1195: 2 | AA1195: 1594 | AB1195: 1614 | AC1195: 98.760842627013631 | AD1195: 36
A1196: PRAHRAN | C1196: McCULLOCH 5 | F1196: BURGESS 3 | I1196: WALSH 2 | K1196: HARVEY | M1196: WORRALL | O1196: ARMSTRONG | R1196: SHILLABEER | W1196: YARRAVILLE | X1196: 8 | Y1196: 11 | Z1196: 0 | AA1196: 1466 | AB1196: 1638 | AC1196: 89.5 | AD1196: 32
A1197: NORTHCOTE | C1197: TULL 2 | F1197: E WHITE | H1197: SAUNDERS | J1197: STAFFORD | M1197: KNOWLES | O1197: FARRELLY | W1197: MOORABBIN | X1197: 3 | Y1197: 16 | Z1197: 0 | AA1197: 1485 | AB1197: 2045 | AC1197: 72.616136919315409 | AD1197: 12
W1198: CAMBERWELL | X1198: 2 | Y1198: 16 | Z1198: 1 | AA1198: 1314 | AB1198: 1859 | AC1198: 70.68 | AD1198: 10
A1199: SANDRINGHAM | C1199: 2 | D1199: 3 | E1199: =C1199*6+D1199 -> 15 | G1199: 6 | H1199: 4 | I1199: =G1199*6+H1199 -> 40 | K1199: 10 | L1199: 7 | M1199: =K1199*6+L1199 -> 67 | O1199: 12 | P1199: 8 | Q1199: =O1199*6+P1199 -> 80 | S1199: WILLIAMSTOWN | W1199: BOX HILL | X1199: 0 | Y1199: 18 | Z1199: 1 | AA1199: 1088 | AB1199: 2201 | AC1199: 49.43 | AD1199: 2
A1200: WILLIAMSTOWN | C1200: 1 | D1200: 6 | E1200: =C1200*6+D1200 -> 12 | G1200: 4 | H1200: 11 | I1200: =G1200*6+H1200 -> 35 | K1200: 7 | L1200: 13 | M1200: =K1200*6+L1200 -> 55 | O1200: 8 | P1200: 20 | Q1200: =O1200*6+P1200 -> 68 | S1200: MERRINGTON
A1201: BEST PLAYERS
A1202: SANDRINGHAM | C1202: GRAMBEAU | F1202: COLLINS | I1202: HISCOCK | L1202: B HARPER | N1202: R HARPER | Q1202: STANLEY
A1203: WILLIAMSTOWN | C1203: G WILLIAMS | F1203: W WILLIAMS | I1203: ALLANSON | L1203: DAVIES | N1203: WOOKEY | Q1203: MOLYNEUX
A1204: GOALKICKERS
A1205: SANDRINGHAM | C1205: B HARPER 5 | F1205: HISCOCK 2 | I1205: CERINI 2 | K1205: GRAMBEAU | N1205: COLLINS | P1205: BENCRAFT
A1206: WILLIAMSTOWN | C1206: WALKER 5 | F1206: TAYLOR | H1206: POOLE | J1206: MOLYNEUX
A1208: OAKLEIGH | C1208: 4 | D1208: 5 | E1208: =C1208*6+D1208 -> 29 | G1208: 6 | H1208: 8 | I1208: =G1208*6+H1208 -> 44 | K1208: 12 | L1208: 10 | M1208: =K1208*6+L1208 -> 82 | O1208: 17 | P1208: 12 | Q1208: =O1208*6+P1208 -> 114 | S1208: OAKLEIGH
A1209: COBURG | C1209: 2 | D1209: 2 | E1209: =C1209*6+D1209 -> 14 | G1209: 6 | H1209: 5 | I1209: =G1209*6+H1209 -> 41 | K1209: 9 | L1209: 5 | M1209: =K1209*6+L1209 -> 59 | O1209: 12 | P1209: 8 | Q1209: =O1209*6+P1209 -> 80 | S1209: MILNE
A1210: BEST PLAYERS
A1211: OAKLEIGH | C1211: BOYLE | F1211: BAXTER | I1211: POWER | L1211: J WATSON | O1211: PERKINS | R1211: WILLIAMS
A1212: COBURG | C1212: McTAGGART | F1212: ROGAN | I1212: JAMES | L1212: EVANS | O1212: LAVERSHA | R1212: GILBERT
A1213: GOALKICKERS
A1214: OAKLEIGH | C1214: J WATSON 5 | F1214: STREETER 4 | I1214: EDWARDS 3 | L1214: HILL | M1214: WILLIAMS | O1214: LAMBERT | Q1214: RICKERT | S1214: HOWELL
A1215: COBURG | C1215: ROGAN 4 | F1215: JAMES 3 | I1215: CANNING 2 | L1215: EVANS | N1215: HEWES | P1215: CLAPTON
A1217: PRESTON | C1217: 2 | D1217: 0 | E1217: =C1217*6+D1217 -> 12 | G1217: 6 | H1217: 10 | I1217: =G1217*6+H1217 -> 46 | K1217: 7 | L1217: 13 | M1217: =K1217*6+L1217 -> 55 | O1217: 9 | P1217: 17 | Q1217: =O1217*6+P1217 -> 71 | S1217: PRESTON
A1218: CAMBERWELL | C1218: 5 | D1218: 2 | E1218: =C1218*6+D1218 -> 32 | G1218: 6 | H1218: 2 | I1218: =G1218*6+H1218 -> 38 | K1218: 7 | L1218: 5 | M1218: =K1218*6+L1218 -> 47 | O1218: 10 | P1218: 5 | Q1218: =O1218*6+P1218 -> 65 | S1218: IRVING
A1219: BEST PLAYERS
A1220: PRESTON | C1220: PRITCHARD | F1220: BRADFORD | I1220: KING | K1220: HENRYS | N1220: F CHARD | Q1220: GOLDIN
A1221: CAMBERWELL | C1221: BOHAN | F1221: COOK | I1221: BENBOW | K1221: CARTER | N1221: SCHNEIDER | Q1221: LITTLE
A1222: GOALKICKERS
A1223: PRESTON | C1223: BRADFORD 2 | F1223: F CHARD 2 | I1223: CUGLEY | K1223: KING | M1223: HARVEY | O1223: CROCKER | Q1223: K CHARD
A1224: CAMBERWELL | C1224: COOK 3 | F1224: MILGATE 3 | I1224: McFEE 2 | K1224: TAYLOR | M1224: ROCHFORD
A1226: YARRAVILLE | C1226: 5 | D1226: 6 | E1226: =C1226*6+D1226 -> 36 | G1226: 9 | H1226: 7 | I1226: =G1226*6+H1226 -> 61 | K1226: 13 | L1226: 12 | M1226: =K1226*6+L1226 -> 90 | O1226: 15 | P1226: 14 | Q1226: =O1226*6+P1226 -> 104 | S1226: BOX HILL
A1227: BOX HILL | C1227: 1 | D1227: 0 | E1227: =C1227*6+D1227 -> 6 | G1227: 2 | H1227: 2 | I1227: =G1227*6+H1227 -> 14 | K1227: 2 | L1227: 3 | M1227: =K1227*6+L1227 -> 15 | O1227: 5 | P1227: 6 | Q1227: =O1227*6+P1227 -> 36 | S1227: WRIGHT
A1228: BEST PLAYERS
A1229: YARRAVILLE | C1229: BODSWORTH | F1229: MASON | I1229: McASEY | K1229: GWYNNE | N1229: CRANAGE | Q1229: MALBON
A1230: BOX HILL | C1230: HOUGHTON | F1230: W COGHLAN | I1230: MURDOCK | K1230: GOODWIN | N1230: COLLINS | Q1230: HAMMOND
A1231: GOALKICKERS
A1232: YARRAVILLE | C1232: BODSWORTH 4 | F1232: MASON 4 | I1232: McBEAN 3 | L1232: PHILLIPS 3 | N1232: GODDARD
A1233: BOX HILL | C1233: MAIDMENT 3 | F1233: HOUGHTON | I1233: ANDERSON
A1235: BRIGHTON | C1235: 2 | D1235: 3 | E1235: =C1235*6+D1235 -> 15 | G1235: 9 | H1235: 9 | I1235: =G1235*6+H1235 -> 63 | K1235: 11 | L1235: 11 | M1235: =K1235*6+L1235 -> 77 | O1235: 12 | P1235: 13 | Q1235: =O1235*6+P1235 -> 85 | S1235: ELSTERNWICK PARK
A1236: MOORABBIN | C1236: 3 | D1236: 5 | E1236: =C1236*6+D1236 -> 23 | G1236: 4 | H1236: 6 | I1236: =G1236*6+H1236 -> 30 | K1236: 9 | L1236: 9 | M1236: =K1236*6+L1236 -> 63 | O1236: 12 | P1236: 11 | Q1236: =O1236*6+P1236 -> 83 | S1236: BARKER
A1237: BEST PLAYERS
A1238: BRIGHTON | C1238: CONROY | F1238: EMBLETON | J1238: PINDER | L1238: G TURNER | O1238: ADAMSON | R1238: PERKINS
A1239: MOORABBIN | C1239: MURNANE | F1239: RICHARDSON | J1239: GILDER | L1239: BOYD | O1239: JONES | R1239: JACOBS
A1240: GOALKICKERS
A1241: BRIGHTON | C1241: SINCLAIR 3 | F1241: EMBLETON 2 | I1241: ADAMSON 2 | L1241: PINDER | N1241: CLARKE | P1241: G TURNER | R1241: MARINI | U1241: MALLOY
A1242: MOORABBIN | C1242: MURNANE 5 | F1242: RICHARDSON 4 | J1242: JONES 2 | L1242: STOKES
A1244: ROUND 20 | E1244: 8TH SEPTEMBER | J1244: WEATHER | M1244: NORTH WIND SUNNY | S1244: PLAYED AT
D1245: 1ST QTR | H1245: 2ND QTR | L1245: 3RD QTR | P1245: FINAL | S1245: BEACH ROAD
A1246: SANDRINGHAM | C1246: 9 | D1246: 9 | E1246: =C1246*6+D1246 -> 63 | G1246: 13 | H1246: 11 | I1246: =G1246*6+H1246 -> 89 | K1246: 18 | L1246: 13 | M1246: =K1246*6+L1246 -> 121 | O1246: 20 | P1246: 14 | Q1246: =O1246*6+P1246 -> 134 | S1246: UMPIRE | X1246: LADDER | AB1246: ROUND | AD1246: 20
A1247: OAKLEIGH | C1247: 0 | D1247: 0 | E1247: =C1247*6+D1247 -> 0 | G1247: 8 | H1247: 4 | I1247: =G1247*6+H1247 -> 52 | K1247: 10 | L1247: 4 | M1247: =K1247*6+L1247 -> 64 | O1247: 11 | P1247: 15 | Q1247: =O1247*6+P1247 -> 81 | S1247: CLEARY
A1248: BEST PLAYERS | W1248: TEAM | X1248: W | Y1248: L | Z1248: D | AA1248: FOR | AB1248: AGST | AC1248: % | AD1248: PTS
A1249: SANDRINGHAM | C1249: R HARPER | F1249: G JONES | I1249: GRAMBEAU | L1249: ANDRESON | N1249: BENCRAFT | Q1249: BOURKE
A1250: OAKLEIGH | C1250: SCOTT | F1250: JOHNSON | I1250: EDWARDS | L1250: RICKERT | N1250: WILLIAMS | Q1250: CUNNINGHAM | W1250: PORT MELBOURNE | X1250: 16 | Y1250: 3 | Z1250: 1 | AA1250: 2028 | AB1250: 1322 | AC1250: 153.40393343419063 | AD1250: 66
A1251: GOALKICKERS | Q1251: WALKER | W1251: PRAHRAN | X1251: 16 | Y1251: 4 | Z1251: 0 | AA1251: 1900 | AB1251: 1560 | AC1251: 121.79 | AD1251: 64
A1252: SANDRINGHAM | C1252: B HARPER 4 | F1252: GRAMBEAU 4 | I1252: BENCRAFT 3 | L1252: G JONES 3 | N1252: BOURKE 2 | Q1252: HISCOCK 2 | T1252: CERINI | W1252: SANDRINGHAM | X1252: 15 | Y1252: 5 | Z1252: 0 | AA1252: 2017 | AB1252: 1579 | AC1252: 127.74 | AD1252: 60
A1253: OAKLEIGH | C1253: J WATSON 3 | F1253: RICKERT 2 | I1253: EDWARDS 2 | L1253: SCOTT 2 | N1253: PERKINS | P1253: GRAY | W1253: OAKLEIGH | X1253: 13 | Y1253: 6 | Z1253: 1 | AA1253: 2015 | AB1253: 1537 | AC1253: 131.09954456733897 | AD1253: 54
A1255: WILLIAMSTOWN | C1255: 6 | D1255: 3 | E1255: =C1255*6+D1255 -> 39 | G1255: 6 | H1255: 8 | I1255: =G1255*6+H1255 -> 44 | K1255: 10 | L1255: 13 | M1255: =K1255*6+L1255 -> 73 | O1255: 11 | P1255: 16 | Q1255: =O1255*6+P1255 -> 82 | S1255: WILLIAMSTOWN | W1255: BRIGHTON | X1255: 12 | Y1255: 8 | Z1255: 0 | AA1255: 1874 | AB1255: 1685 | AC1255: 111.21661721068249 | AD1255: 48
A1256: PRAHRAN | C1256: 1 | D1256: 2 | E1256: =C1256*6+D1256 -> 8 | G1256: 4 | H1256: 5 | I1256: =G1256*6+H1256 -> 29 | K1256: 6 | L1256: 7 | M1256: =K1256*6+L1256 -> 43 | O1256: 8 | P1256: 14 | Q1256: =O1256*6+P1256 -> 62 | S1256: SMITHWICK | W1256: NORTHCOTE | X1256: 11 | Y1256: 9 | Z1256: 0 | AA1256: 1418 | AB1256: 1384 | AC1256: 102.46 | AD1256: 44
A1257: BEST PLAYERS | W1257: WILLIAMSTOWN | X1257: 10 | Y1257: 9 | Z1257: 1 | AA1257: 1800 | AB1257: 1528 | AC1257: 117.8 | AD1257: 42
A1258: WILLIAMSTOWN | C1258: DULLARD | F1258: SAMPSON | I1258: ALLANSON | L1258: SHEAHAN | O1258: GUNN | Q1258: W WILLIAMS | W1258: BRUNSWICK | X1258: 10 | Y1258: 9 | Z1258: 1 | AA1258: 1443 | AB1258: 1437 | AC1258: 100.42 | AD1258: 42
A1259: PRAHRAN | C1259: HARVEY | F1259: YATES | I1259: ARMSTRONG | L1259: SHILLABEER | O1259: OVERS | Q1259: COLLS | W1259: COBURG | X1259: 10 | Y1259: 10 | Z1259: 0 | AA1259: 1770 | AB1259: 1688 | AC1259: 104.86 | AD1259: 40
A1260: GOALKICKERS | W1260: PRESTON | X1260: 8 | Y1260: 10 | Z1260: 2 | AA1260: 1627 | AB1260: 1683 | AC1260: 96.672608437314324 | AD1260: 36
A1261: WILLIAMSTOWN | C1261: DULLARD 4 | F1261: WALKER 3 | I1261: SMITH 2 | K1261: GUNN | M1261: POOLE | W1261: YARRAVILLE | X1261: 9 | Y1261: 11 | Z1261: 0 | AA1261: 1554 | AB1261: 1724 | AC1261: 90.14 | AD1261: 36
A1262: PRAHRAN | C1262: ELLIS 2 | F1262: McCULLOCH 2 | I1262: MORROW | K1262: HARVEY | M1262: ARMSTRONG | P1262: WORRALL | W1262: CAMBERWELL | X1262: 3 | Y1262: 16 | Z1262: 1 | AA1262: 1405 | AB1262: 1949 | AC1262: 72.09 | AD1262: 14
W1263: MOORABBIN | X1263: 3 | Y1263: 17 | Z1263: 0 | AA1263: 1571 | AB1263: 2133 | AC1263: 73.652133145804029 | AD1263: 12
A1264: PORT MELBOURNE | C1264: 4 | D1264: 3 | E1264: =C1264*6+D1264 -> 27 | G1264: 8 | H1264: 11 | I1264: =G1264*6+H1264 -> 59 | K1264: 11 | L1264: 15 | M1264: =K1264*6+L1264 -> 81 | O1264: 16 | P1264: 22 | Q1264: =O1264*6+P1264 -> 118 | S1264: PORT MELBOURNE | W1264: BOX HILL | X1264: 0 | Y1264: 19 | Z1264: 1 | AA1264: 1121 | AB1264: 2334 | AC1264: 48.03 | AD1264: 2
A1265: BRIGHTON | C1265: 4 | D1265: 1 | E1265: =C1265*6+D1265 -> 25 | G1265: 5 | H1265: 4 | I1265: =G1265*6+H1265 -> 34 | K1265: 6 | L1265: 6 | M1265: =K1265*6+L1265 -> 42 | O1265: 7 | P1265: 7 | Q1265: =O1265*6+P1265 -> 49 | S1265: MERRINGTON
A1266: BEST PLAYERS
A1267: PORT MELBOURNE | C1267: JOHNSON | F1267: WOODBRIDGE | I1267: CLEARY | L1267: MILLER | N1267: WALSH | Q1267: KELSEY
A1268: BRIGHTON | C1268: E TURNER | F1268: BURKE | I1268: G TURNER | L1268: CLARKE | N1268: PERKINS | Q1268: CONROY
A1269: GOALKICKERS
A1270: PORT MELBOURNE | C1270: MURRAY 4 | F1270: AUSTIN 3 | I1270: DOYLE 3 | K1270: MILLER 3 | M1270: WALSH | O1270: ATKINSON | R1270: LAFFEY
A1271: BRIGHTON | C1271: SINCLAIR 2 | F1271: LINDEN 2 | I1271: CLARKE | K1271: PINDER | M1271: BURKE
A1273: COBURG | C1273: 1 | D1273: 3 | E1273: =C1273*6+D1273 -> 9 | G1273: 5 | H1273: 10 | I1273: =G1273*6+H1273 -> 40 | K1273: 6 | L1273: 13 | M1273: =K1273*6+L1273 -> 49 | O1273: 8 | P1273: 21 | Q1273: =O1273*6+P1273 -> 69 | S1273: COBURG
A1274: PRESTON | C1274: 1 | D1274: 3 | E1274: =C1274*6+D1274 -> 9 | G1274: 2 | H1274: 4 | I1274: =G1274*6+H1274 -> 16 | K1274: 2 | L1274: 5 | M1274: =K1274*6+L1274 -> 17 | O1274: 4 | P1274: 9 | Q1274: =O1274*6+P1274 -> 33 | S1274: BARKER
A1275: BEST PLAYERS
A1276: COBURG | C1276: STARBUCK | F1276: FEWKES | I1276: McTAGGART | L1276: PHELAN | O1276: ROGAN | R1276: CLAPTON
A1277: PRESTON | C1277: L SWEET | F1277: HENRYS | I1277: BROWN | L1277: JEFFREY | O1277: K CHARD | R1277: BRADFORD
A1278: GOALKICKERS
A1279: COBURG | C1279: H WILKINSON 3 | F1279: ROGAN 2 | I1279: JAMES | K1279: CLAPTON | M1279: CLARKSON
A1280: PRESTON | C1280: BRADFORD | F1280: CROCKER | I1280: WALKER | K1280: F CHARD
A1282: YARRAVILLE | C1282: 1 | D1282: 0 | E1282: =C1282*6+D1282 -> 6 | G1282: 7 | H1282: 3 | I1282: =G1282*6+H1282 -> 45 | K1282: 9 | L1282: 3 | M1282: =K1282*6+L1282 -> 57 | O1282: 14 | P1282: 4 | Q1282: =O1282*6+P1282 -> 88 | S1282: CHELT
A1283: MOORABBIN | C1283: 6 | D1283: 4 | E1283: =C1283*6+D1283 -> 40 | G1283: 8 | H1283: 9 | I1283: =G1283*6+H1283 -> 57 | K1283: 10 | L1283: 13 | M1283: =K1283*6+L1283 -> 73 | O1283: 12 | P1283: 14 | Q1283: =O1283*6+P1283 -> 86 | S1283: MILNE
A1284: BEST PLAYERS
A1285: YARRAVILLE | C1285: NICHOLLS | F1285: HICKEY | I1285: MASON | L1285: CRANAGE | O1285: GWYNNE | R1285: MALBON
A1286: MOORABBIN | C1286: PHILLIPS | F1286: STOKES | I1286: HOCKING | L1286: ANTONIE | O1286: MURNANE | R1286: RICHARDSON
A1287: GOALKICKERS
A1288: YARRAVILLE | C1288: HICKEY 5 | F1288: PHILLIPS 3 | I1288: MASON 3 | L1288: BODSWORTH 2 | P1288: COOK
A1289: MOORABBIN | C1289: MURNANE 4 | F1289: STOKES 3 | I1289: WILSON 2 | L1289: SUTHERLAND | O1289: ANTONIE | Q1289: SMITH
A1291: CAMBERWELL | C1291: 3 | D1291: 5 | E1291: =C1291*6+D1291 -> 23 | G1291: 5 | H1291: 9 | I1291: =G1291*6+H1291 -> 39 | K1291: 10 | L1291: 13 | M1291: =K1291*6+L1291 -> 73 | O1291: 13 | P1291: 13 | Q1291: =O1291*6+P1291 -> 91 | S1291: CAMBERWELL
A1292: BRUNSWICK | C1292: 0 | D1292: 3 | E1292: =C1292*6+D1292 -> 3 | G1292: 7 | H1292: 5 | I1292: =G1292*6+H1292 -> 47 | K1292: 9 | L1292: 6 | M1292: =K1292*6+L1292 -> 60 | O1292: 13 | P1292: 12 | Q1292: =O1292*6+P1292 -> 90 | S1292: WRIGHT
A1293: BEST PLAYERS
A1294: CAMBERWELL | C1294: ROCHFORD | F1294: BOHAN | I1294: McFEE | L1294: BEDFORD | O1294: SCHNEIDER | R1294: MILGATE
A1295: BRUNSWICK | C1295: SPENCER | F1295: STANLEY | I1295: YEA | L1295: CAREY | O1295: WEIR | R1295: POLLARD
A1296: GOALKICKERS
A1297: CAMBERWELL | C1297: MILGATE 5 | F1297: McFEE 2 | I1297: SCHNEIDER 2 | L1297: ROCHFORD 2 | O1297: McCULLOCH | R1297: TAYLOR
A1298: BRUNSWICK | C1298: SPENCER 3 | F1298: STANLEY 3 | I1298: DUNSTAN 2 | L1298: WEIR | N1298: ARMSTRONG | Q1298: McFARLANE | T1298: GEISLER | V1298: PRIESTLEY
A1300: NORTHCOTE | C1300: 3 | D1300: 3 | E1300: =C1300*6+D1300 -> 21 | G1300: 12 | H1300: 6 | I1300: =G1300*6+H1300 -> 78 | K1300: 15 | L1300: 10 | M1300: =K1300*6+L1300 -> 100 | O1300: 20 | P1300: 13 | Q1300: =O1300*6+P1300 -> 133 | S1300: NORTHCOTE
A1301: BOX HILL | C1301: 1 | D1301: 5 | E1301: =C1301*6+D1301 -> 11 | G1301: 2 | H1301: 5 | I1301: =G1301*6+H1301 -> 17 | K1301: 2 | L1301: 6 | M1301: =K1301*6+L1301 -> 18 | O1301: 4 | P1301: 9 | Q1301: =O1301*6+P1301 -> 33 | S1301: IRVING
A1302: BEST PLAYERS
A1303: NORTHCOTE | C1303: HISCOX | F1303: DEANS | I1303: DUNGAN | L1303: WOOLNOUGH | O1303: SAUNDERS | R1303: KNOWLES
A1304: BOX HILL | C1304: W COGHLAN | F1304: LEISHMAN | I1304: VANCE | L1304: GREEN | O1304: WRIGHT | R1304: MIHAN
A1305: GOALKICKERS
A1306: NORTHCOTE | C1306: DUNGAN 8 | F1306: DEANS 3 | I1306: E WHITE 3 | L1306: K FISHER 2 | O1306: WOOLNOUGH | R1306: KNOWLES | U1306: MURPHY | X1306: SAUNDERS
A1307: BOX HILL | C1307: WRIGHT 3 | F1307: MIHAN
A1309: FINALS
A1310: 1ST SEMI | E1310: 15TH SEPTEMBER | J1310: WEATHER | N1310: SOUTH WEST WIND FINE
A1311: OAKLEIGH | C1311: 3 | D1311: 5 | E1311: =C1311*6+D1311 -> 23 | G1311: 6 | H1311: 5 | I1311: =G1311*6+H1311 -> 41 | K1311: 9 | L1311: 10 | M1311: =K1311*6+L1311 -> 64 | O1311: 15 | P1311: 11 | Q1311: =O1311*6+P1311 -> 101 | S1311: JUNCTION OVAL
A1312: SANDRINGHAM | C1312: 4 | D1312: 5 | E1312: =C1312*6+D1312 -> 29 | G1312: 8 | H1312: 9 | I1312: =G1312*6+H1312 -> 57 | K1312: 8 | L1312: 13 | M1312: =K1312*6+L1312 -> 61 | O1312: 11 | P1312: 16 | Q1312: =O1312*6+P1312 -> 82 | S1312: MERRINGTON
A1313: BEST PLAYERS
A1314: OAKLEIGH | C1314: SCOTT | F1314: TINDAL | I1314: BOYLE | L1314: RICKERT | O1314: JOHNSON | R1314: HILL
A1315: SANDRINGHAM | C1315: R HARPER | F1315: G JONES | I1315: BRIGHTON | L1315: HISCOCK | O1315: WALKER | R1315: COLLINS
A1316: GOALKICKERS
A1317: OAKLEIGH | C1317: SCOTT 6 | F1317: J WATSON 3 | I1317: TINDAL 3 | L1317: EDWARDS | N1317: W WILLIAMS | Q1317: RICKERT
A1318: SANDRINGHAM | C1318: B HARPER 3 | F1318: G JONES 3 | I1318: HISCOCK 2 | L1318: COLLINS 2 | N1318: BENCRAFT
A1320: 2ND SEMI | D1320: 22ND SEPTEMBER | J1320: WEATHER | M1320: SOUTH EAST BREEZE DULL GROUND HEAVY
A1321: PRAHRAN | C1321: 4 | D1321: 2 | E1321: =C1321*6+D1321 -> 26 | G1321: 12 | H1321: 8 | I1321: =G1321*6+H1321 -> 80 | K1321: 13 | L1321: 12 | M1321: =K1321*6+L1321 -> 90 | O1321: 19 | P1321: 19 | Q1321: =O1321*6+P1321 -> 133 | S1321: JUNCTION OVAL
A1322: PORT MELBOURNE | C1322: 4 | D1322: 5 | E1322: =C1322*6+D1322 -> 29 | G1322: 4 | H1322: 5 | I1322: =G1322*6+H1322 -> 29 | K1322: 9 | L1322: 10 | M1322: =K1322*6+L1322 -> 64 | O1322: 12 | P1322: 13 | Q1322: =O1322*6+P1322 -> 85 | S1322: CLEARY
A1323: BEST PLAYERS
A1324: PRAHRAN | D1324: MORROW | G1324: CAMPBELL | J1324: SHILLABEER | M1324: YATES | O1324: ARMSTRONG | R1324: GRAMBEAU
A1325: PORT MELBOURNE | D1325: WALSH | G1325: JOHNSON | J1325: STOREY | M1325: CARIS | O1325: MURRAY | R1325: RAMSAY
A1326: GOALKICKERS
A1327: PRAHRAN | D1327: HARVEY 5 | G1327: SHILLABEER 3 | J1327: MORROW 3 | M1327: McCULLOCH 3 | P1327: WALSH 2 | R1327: KRUSE | T1327: BURGESS | W1327: KINNABURGH
A1328: PORT MELBOURNE | D1328: McDONALD 2 | G1328: WALSH 2 | I1328: DOYLE 2 | K1328: MILLER | M1328: STOREY | O1328: MURRAY | Q1328: AUSTIN | S1328: ATKINSON | V1328: RAMSAY
A1330: PRELIMINARY FINAL | F1330: 29TH SEPTEMBER | K1330: WEATHER | N1330: SOUTH WEST WIND
A1331: PORT MELBOURNE | C1331: 3 | D1331: 2 | E1331: =C1331*6+D1331 -> 20 | G1331: 4 | H1331: 5 | I1331: =G1331*6+H1331 -> 29 | K1331: 6 | L1331: 7 | M1331: =K1331*6+L1331 -> 43 | O1331: 9 | P1331: 10 | Q1331: =O1331*6+P1331 -> 64 | S1331: JUNCTION OVAL
A1332: OAKLEIGH | C1332: 3 | D1332: 1 | E1332: =C1332*6+D1332 -> 19 | G1332: 5 | H1332: 5 | I1332: =G1332*6+H1332 -> 35 | K1332: 6 | L1332: 6 | M1332: =K1332*6+L1332 -> 42 | O1332: 8 | P1332: 9 | Q1332: =O1332*6+P1332 -> 57 | S1332: MERRINGTON
A1333: BEST PLAYERS
A1334: PORT MELBOURNE | D1334: AUSTIN | F1334: JOHNSON | I1334: WILSON | L1334: MURRAY | N1334: STOREY | Q1334: TUCKER
A1335: OAKLEIGH | D1335: TEMME | F1335: BOYLE | I1335: POWER | L1335: PERKINS | N1335: STREETER | Q1335: VAINS
A1336: GOALKICKERS
A1337: PORT MELBOURNE | D1337: MILLER 3 | F1337: AUSTIN 2 | I1337: WALSH | K1337: MURRAY | M1337: LOWRIE | O1337: JOHNSON
A1338: OAKLEIGH | D1338: PERKINS 2 | F1338: SCOTT 2 | I1338: BAXTER | K1338: J WATSON | M1338: TINDAL | O1338: HALL
A1340: GRAND FINAL | E1340: 6TH OCTOBER | J1340: WEATHER | M1340: FINE & WARM
A1341: PRAHRAN | C1341: 1 | D1341: 6 | E1341: 12 | G1341: 4 | H1341: 8 | I1341: 32 | K1341: 8 | L1341: 9 | M1341: 57 | O1341: 11 | P1341: 13 | Q1341: =O1341*6+P1341 -> 79 | S1341: JUNCTION OVAL
A1342: PORT MELBOURNE | C1342: 2 | D1342: 1 | E1342: 13 | G1342: 4 | H1342: 2 | I1342: 26 | K1342: 8 | L1342: 6 | M1342: 54 | O1342: 10 | P1342: 10 | Q1342: =O1342*6+P1342 -> 70 | S1342: MERRINGTON
A1343: BEST PLAYERS
A1344: PRAHRAN | D1344: OVERS | G1344: BUTLING | J1344: YATES | M1344: JONES | O1344: COLLS | Q1344: SHILLABEER
A1345: PORT MELBOURNE | D1345: JOHNSON | G1345: TUCKER | J1345: WOODBRIDGE | M1345: MILLER | O1345: CLEARY | Q1345: ATKINSON
A1346: GOALKICKERS
A1347: PRAHRAN | D1347: BURGESS 3 | G1347: SHILLABEER 2 | J1347: McCULLOCH 2 | M1347: WALSH | O1347: WORRALL | Q1347: GRAMBEAU | T1347: HARVEY
A1348: PORT MELBOURNE | D1348: MILLER 5 | G1348: WALSH 2 | J1348: MURRAY | M1348: LOWRIE | O1348: LAFFEY
E1350: 9TH MAY
A1351: S.A. | C1351: 10 | D1351: 4 | E1351: 64 | G1351: 15 | H1351: 10 | I1351: 100 | K1351: 21 | L1351: 14 | M1351: 140 | O1351: 28 | P1351: 19 | Q1351: 187 | S1351: ADELAIDE OVAL
A1352: V.F.A. | C1352: 4 | D1352: 4 | E1352: 28 | G1352: 5 | H1352: 6 | I1352: 36 | K1352: 12 | L1352: 8 | M1352: 80 | O1352: 13 | P1352: 14 | Q1352: 92
A1353: BEST PLAYERS
A1354: S.A. | D1354: HANK | G1354: BOYD | I1354: WHITTAKER | L1354: WILLIAMS | O1354: PHILLIPS | Q1354: MARRIOTT
A1355: V.F.A. | D1355: ROGAN | G1355: MORROW | I1355: PRIESTLEY | L1355: WALSH | O1355: HARPER | Q1355: TUCKER
A1356: GOALKICKERS
A1357: S.A. | D1357: CHURCHETT 10 | G1357: A'COURT 4 | I1357: WILLIAMS 3 | L1357: BOYD 3 | N1357: WHITTAKER 3 | Q1357: PHILLIPS 2 | T1357: HANK 2 | W1357: MARRIOTT
A1358: V.F.A. | D1358: HARPER 4 | G1358: ROGAN 4 | I1358: PRIESTLEY 2 | L1358: MORROW | N1358: WALSH | P1358: NEW
E1359: 30TH JUNE
A1360: V.F.A. | C1360: 6 | D1360: 3 | E1360: =C1360*6+D1360 -> 39 | G1360: 13 | H1360: 9 | I1360: =G1360*6+H1360 -> 87 | K1360: 18 | L1360: 11 | M1360: =K1360*6+L1360 -> 119 | O1360: 26 | P1360: 15 | Q1360: =O1360*6+P1360 -> 171 | S1360: NTH HOB
A1361: TASMANIA | C1361: 3 | D1361: 2 | E1361: =C1361*6+D1361 -> 20 | G1361: 7 | H1361: 3 | I1361: =G1361*6+H1361 -> 45 | K1361: 9 | L1361: 5 | M1361: =K1361*6+L1361 -> 59 | O1361: 12 | P1361: 11 | Q1361: =O1361*6+P1361 -> 83 | S1361: JAMIESON (V.F.L.)
A1362: BEST PLAYERS
A1363: V.F.A. | C1363: B HARPER | F1363: SPENCER | I1363: WHELAN | L1363: BOYD | N1363: PERKINS | Q1363: CONDON
A1364: TASMANIA | C1364: McCLEMENTS | F1364: HUGHES | I1364: R RUSSELL | L1364: PEPPER | N1364: ROUGH | Q1364: REID
A1365: GOALKICKERS
A1366: V.F.A. | C1366: B HARPER 8 | F1366: CONDON 6 | I1366: RUSSELL 4 | L1366: G WILLIAMS 2 | O1366: SPENCER 2 | Q1366: BOYD | R1366: M GRAMBEAU | W1366: ROGAN | X1366: MULLANE
A1367: TASMANIA | C1367: PEPPER 5 | F1367: McCLEMENTS 4 | J1367: GARWOOD | M1367: CASHIN | O1367: REID
E1368: 14TH JULY
A1369: V.F.A. | C1369: 6 | D1369: 3 | E1369: =C1369*6+D1369 -> 39 | G1369: 12 | H1369: 5 | I1369: =G1369*6+H1369 -> 77 | K1369: 14 | L1369: 9 | M1369: =K1369*6+L1369 -> 93 | O1369: 20 | P1369: 17 | Q1369: =O1369*6+P1369 -> 137 | S1369: MANUKA OVAL (A.C.T.)
A1370: AUST AM | C1370: 4 | D1370: 3 | E1370: =C1370*6+D1370 -> 27 | G1370: 6 | H1370: 5 | I1370: =G1370*6+H1370 -> 41 | K1370: 11 | L1370: 11 | M1370: =K1370*6+L1370 -> 77 | O1370: 12 | P1370: 12 | Q1370: =O1370*6+P1370 -> 84 | S1370: MCMURRAY (V.F.L.)
A1371: BEST PLAYERS
A1372: V.F.A. | C1372: WHELAN | F1372: HILL | I1372: HISCOX | L1372: CONDON | N1372: WENN | Q1372: SPENCER
A1373: AUST AM | C1373: BIRTLES | F1373: CLARKE | I1373: HIBBINS | L1373: MARTIN | N1373: ARNOLD | Q1373: THOMAS
A1374: GOALKICKERS
A1375: V.F.A. | C1375: B HARPER 6 | F1375: WENN 5 | I1375: HILL 3 | K1375: SPENCER 2 | N1375: CONDON 2 | Q1375: WHELAN | T1375: NEW
A1376: AUST AM | C1376: HIBBINS 4 | F1376: MARTIN 4 | I1376: MORONE | K1376: BIRTLES | M1376: B JUDD | O1376: MEREDITH