A1: Victorian Football Association
A2: Season 1952
A3: © Copyright Wal Williams | F3: First created: 2 November 2014
A4: Contact: joywalwi at gmail dot com | F4: Last updated: 27 January 2018 | W4: VFA Results and tables - Link to the main index page
A5: You are free to copy this document in whole or part provided that proper acknowledgement is given to the author. All rights reserved.
A7: YEAR 1952
A8: ROUND 1 | E8: 19TH APRIL | I8: WEATHER | L8: SOUTH WEST WIND COLD RAIN | S8: PLAYED AT
D9: 1ST QTR | H9: 2ND QTR | L9: 3RD QTR | P9: FINAL | S9: TOORAK PARK
A10: PRAHRAN | C10: 2 | D10: 4 | E10: =C10*6+D10 -> 16 | G10: 4 | H10: 12 | I10: =G10*6+H10 -> 36 | K10: 8 | L10: 13 | M10: =K10*6+L10 -> 61 | O10: 12 | P10: 17 | Q10: =O10*6+P10 -> 89 | S10: UMPIRE | X10: LADDER | AB10: ROUND | AD10: 1
A11: PRESTON | C11: 3 | D11: 5 | E11: =C11*6+D11 -> 23 | G11: 9 | H11: 6 | I11: =G11*6+H11 -> 60 | K11: 12 | L11: 10 | M11: =K11*6+L11 -> 82 | O11: 13 | P11: 10 | Q11: =O11*6+P11 -> 88 | S11: MERRINGTON
A12: BEST PLAYERS | W12: TEAM | X12: W | Y12: L | Z12: D | AA12: FOR | AB12: AGST | AC12: % | AD12: PTS
A13: PRAHRAN | C13: GALLAGHER | F13: OVERS | I13: KRUSE | K13: H BOYD | N13: HARVEY | Q13: COURTNEY
A14: PRESTON | C14: F CHARD | F14: BRADFORD | I14: COOPER | K14: O'CONNOR | N14: LALOR | Q14: HENRYS | W14: PORT MELBOURNE | X14: 1 | Y14: 0 | Z14: 0 | AA14: 104 | AB14: 47 | AC14: 221.27659574468086 | AD14: 4
A15: GOALKICKERS | W15: SANDRINGHAM | X15: 1 | Y15: 0 | Z15: 0 | AA15: 76 | AB15: 45 | AC15: 168.88888888888889 | AD15: 4
A16: PRAHRAN | C16: McCULLOCH 4 | F16: HARVEY 3 | I16: KRUSE 2 | K16: COURTNEY 2 | N16: SHILLABEER | W16: CAMBERWELL | X16: 1 | Y16: 0 | Z16: 0 | AA16: 51 | AB16: 38 | AC16: 134.21052631578948 | AD16: 4
A17: PRESTON | C17: F CHARD 4 | F17: HARVEY 3 | I17: BRADFORD 2 | L17: FOLEY | N17: MOORE | P17: BATEMAN | R17: GOLDIN | W17: MOORABBIN | X17: 1 | Y17: 0 | Z17: 0 | AA17: 68 | AB17: 52 | AC17: 130.76923076923077 | AD17: 4
A19: YARRAVILLE | C19: 2 | D19: 4 | E19: =C19*6+D19 -> 16 | G19: 8 | H19: 7 | I19: =G19*6+H19 -> 55 | K19: 12 | L19: 7 | M19: =K19*6+L19 -> 79 | O19: 13 | P19: 11 | Q19: =O19*6+P19 -> 89 | S19: BOX HILL | W19: YARRAVILLE | X19: 1 | Y19: 0 | Z19: 0 | AA19: 89 | AB19: 77 | AC19: 115.58441558441558 | AD19: 4
A20: BOX HILL | C20: 4 | D20: 2 | E20: =C20*6+D20 -> 26 | G20: 6 | H20: 3 | I20: =G20*6+H20 -> 39 | K20: 9 | L20: 7 | M20: =K20*6+L20 -> 61 | O20: 11 | P20: 11 | Q20: =O20*6+P20 -> 77 | S20: MILNE | W20: PRAHRAN | X20: 1 | Y20: 0 | Z20: 0 | AA20: 89 | AB20: 88 | AC20: 101.13636363636364 | AD20: 4
A21: BEST PLAYERS | W21: BRUNSWICK | X21: 1 | Y21: 0 | Z21: 0 | AA21: 0 | AB21: 0 | AC21: 0 | AD21: 4
A22: YARRAVILLE | C22: PHILLIPS | E22: JONES | H22: MASON | K22: CRANAGE | N22: WAGHORNE | Q22: LEES | W22: PRESTON | X22: 0 | Y22: 1 | Z22: 0 | AA22: 88 | AB22: 89 | AC22: 98.876404494382029 | AD22: 0
A23: BOX HILL | C23: MORRIS | E23: GREEN | H23: MAIDMENT | K23: O'ROURKE | N23: VANCE | Q23: HOUGHTON | W23: BOX HILL | X23: 0 | Y23: 1 | Z23: 0 | AA23: 77 | AB23: 89 | AC23: 86.516853932584269 | AD23: 0
A24: GOALKICKERS | W24: NORTHCOTE | X24: 0 | Y24: 1 | Z24: 0 | AA24: 52 | AB24: 68 | AC24: 76.470588235294116 | AD24: 0
A25: YARRAVILLE | C25: PHILLIPS 6 | F25: MASON 3 | I25: WAGHORNE 2 | L25: BODSWORTH | O25: LEES | W25: COBURG | X25: 0 | Y25: 1 | Z25: 0 | AA25: 38 | AB25: 51 | AC25: 74.509803921568633 | AD25: 0
A26: BOX HILL | C26: MAIDMENT 4 | F26: WRIGHT 3 | I26: O'ROURKE 2 | L26: HOUGHTON | O26: LEISHMAN | W26: BRIGHTON | X26: 0 | Y26: 1 | Z26: 0 | AA26: 45 | AB26: 76 | AC26: 59.210526315789473 | AD26: 0
W27: WILLIAMSTOWN | X27: 0 | Y27: 1 | Z27: 0 | AA27: 47 | AB27: 104 | AC27: 45.192307692307693 | AD27: 0
A28: MOORABBIN | C28: 2 | D28: 2 | E28: =C28*6+D28 -> 14 | G28: 5 | H28: 7 | I28: =G28*6+H28 -> 37 | K28: 5 | L28: 11 | M28: =K28*6+L28 -> 41 | O28: 9 | P28: 14 | Q28: =O28*6+P28 -> 68 | S28: NORTHCOTE | W28: OAKLEIGH | X28: 0 | Y28: 1 | Z28: 0 | AA28: 0 | AB28: 0 | AC28: 0 | AD28: 0
A29: NORTHCOTE | C29: 2 | D29: 1 | E29: =C29*6+D29 -> 13 | G29: 5 | H29: 2 | I29: =G29*6+H29 -> 32 | K29: 6 | L29: 9 | M29: =K29*6+L29 -> 45 | O29: 7 | P29: 10 | Q29: =O29*6+P29 -> 52 | S29: ROACH
A30: BEST PLAYERS
A31: MOORABBIN | C31: MURNANE | F31: McKENZIE | I31: OSTLE | L31: DODDS | N31: BAKER | Q31: BOYD
A32: NORTHCOTE | C32: PAWSEY | F32: HINES | I32: KNOWLES | L32: BRUNNEN | N32: WHITECHURCH | Q32: STABB
A33: GOALKICKERS
A34: MOORABBIN | C34: MURNANE 3 | F34: CAMPBELL 2 | I34: RICHARDSON 2 | L34: COATES | N34: REID
A35: NORTHCOTE | C35: PAWSEY 4 | F35: HOLT 2 | H35: DEANS
A37: SANDRINGHAM | C37: 4 | D37: 6 | E37: =C37*6+D37 -> 30 | G37: 5 | H37: 9 | I37: =G37*6+H37 -> 39 | K37: 9 | L37: 14 | M37: =K37*6+L37 -> 68 | O37: 10 | P37: 16 | Q37: =O37*6+P37 -> 76 | S37: BEACH ROAD
A38: BRIGHTON | C38: 1 | D38: 2 | E38: =C38*6+D38 -> 8 | G38: 3 | H38: 6 | I38: =G38*6+H38 -> 24 | K38: 5 | L38: 6 | M38: =K38*6+L38 -> 36 | O38: 6 | P38: 9 | Q38: =O38*6+P38 -> 45 | S38: IRVING
A39: BEST PLAYERS
A40: SANDRINGHAM | C40: G JONES | F40: RUSSO | I40: MILLER | K40: ANDRESON | N40: RUSSELL | Q40: HISCOCK
A41: BRIGHTON | C41: MARINI | F41: ALEXANDER | I41: K EMBLETON | L41: G JOUBERT | O41: BURKE | Q41: FREEMAN
A42: GOALKICKERS
A43: SANDRINGHAM | C43: HANMAN 2 | F43: G JONES 2 | I43: HISCOCK 2 | L43: SHIPP | N43: McINTYRE | Q43: B HARPER | T43: MCGRATH
A44: BRIGHTON | C44: MARINI 3 | F44: A JOUBERT 2 | I44: ALEXANDER
A46: CAMBERWELL | C46: 0 | D46: 2 | E46: =C46*6+D46 -> 2 | G46: 2 | H46: 3 | I46: =G46*6+H46 -> 15 | K46: 2 | L46: 6 | M46: =K46*6+L46 -> 18 | O46: 7 | P46: 9 | Q46: =O46*6+P46 -> 51 | S46: COBURG
A47: COBURG | C47: 3 | D47: 2 | E47: =C47*6+D47 -> 20 | G47: 3 | H47: 7 | I47: =G47*6+H47 -> 25 | K47: 4 | L47: 11 | M47: =K47*6+L47 -> 35 | O47: 4 | P47: 14 | Q47: =O47*6+P47 -> 38 | S47: CLEARY
A48: BEST PLAYERS
A49: CAMBERWELL | C49: MARIAN | F49: BEDFORD | I49: BOHAN | L49: BRADLEY | O49: HARRIOTT | R49: McFEE
A50: COBURG | C50: H WILKINSON | F50: JAMES | I50: FEWKES | L50: CONDON | O50: STARBUCK | R50: GILBERT
A51: GOALKICKERS
A52: CAMBERWELL | C52: BRADLEY 2 | F52: MARIAN 2 | I52: McCULLOCH | L52: YOUNG | N52: McFEE
A53: COBURG | C53: JAMES | F53: R WILKINSON | J53: STARBUCK | M53: BURMEISTER
A55: PORT MELBOURNE | C55: 1 | D55: 2 | E55: =C55*6+D55 -> 8 | G55: 5 | H55: 5 | I55: =G55*6+H55 -> 35 | K55: 7 | L55: 5 | M55: =K55*6+L55 -> 47 | O55: 15 | P55: 14 | Q55: =O55*6+P55 -> 104 | S55: WILLIAMSTOWN
A56: WILLIAMSTOWN | C56: 1 | D56: 4 | E56: =C56*6+D56 -> 10 | G56: 3 | H56: 4 | I56: =G56*6+H56 -> 22 | K56: 6 | L56: 11 | M56: =K56*6+L56 -> 47 | O56: 6 | P56: 11 | Q56: =O56*6+P56 -> 47 | S56: JOHNS
A57: BEST PLAYERS
A58: PORT MELBOURNE | C58: HOULIHAN | F58: MILLER | I58: STONE | L58: MURRAY | O58: JOHNSON | R58: DOYLE
A59: WILLIAMSTOWN | C59: G WILLIAMS | F59: WOOKEY | I59: MOLYNEUX | L59: HOGAN | O59: B WILLIAMS | R59: CALLAHAN
A60: GOALKICKERS
A61: PORT MELBOURNE | C61: WALSH 4 | F61: DOYLE 3 | I61: BONNETT 2 | L61: MILLER 2 | N61: OWENS | P61: HOULIHAN | R61: CARIS | T61: MURRAY
A62: WILLIAMSTOWN | C62: WALKER 2 | F62: W WILLIAMS 2 | J62: HOGAN | L62: CALLAHAN
A64: OAKLEIGH * | C64: 4 | D64: 1 | E64: =C64*6+D64 -> 25 | G64: 9 | H64: 4 | I64: =G64*6+H64 -> 58 | K64: 11 | L64: 7 | M64: =K64*6+L64 -> 73 | O64: 14 | P64: 10 | Q64: =O64*6+P64 -> 94 | S64: OAKLEIGH | W64: * MATCH AWARDED TO
A65: BRUNSWICK | C65: 1 | D65: 3 | E65: =C65*6+D65 -> 9 | G65: 2 | H65: 5 | I65: =G65*6+H65 -> 17 | K65: 4 | L65: 8 | M65: =K65*6+L65 -> 32 | O65: 4 | P65: 9 | Q65: =O65*6+P65 -> 33 | S65: RICHARDSON | W65: BRUNSWICK AS OAKLEIGH
A66: BEST PLAYERS | W66: PLAYED TWO INELIGBLE
A67: OAKLEIGH | C67: HILL | E67: J WATSON | H67: STREETER | K67: VAINS | N67: EDWARDS | Q67: RICKERT | W67: PLAYERS
A68: BRUNSWICK | C68: YEA | E68: WEIR | H68: J RYAN | K68: MAY | N68: ALLEN | Q68: NEILSON | W68: SCORES NOT INCLUDED
A69: GOALKICKERS | W69: IN LADDER
A70: OAKLEIGH | C70: J WATSON 6 | F70: STREETER 4 | I70: EDWARDS 2 | L70: RICKERT | N70: WENN
A71: BRUNSWICK | C71: STANLEY | F71: WEIR | H71: TAYLOR | J71: MULLENGER
A73: ROUND 2 | E73: 26TH APRIL | J73: WEATHER | O73: NO WIND DULL | S73: PLAYED AT
D74: 1ST QTR | H74: 2ND QTR | L74: 3RD QTR | P74: FINAL | S74: MOORABBIN
A75: MOORABBIN | C75: 4 | D75: 3 | E75: =C75*6+D75 -> 27 | G75: 8 | H75: 5 | I75: =G75*6+H75 -> 53 | K75: 8 | L75: 9 | M75: =K75*6+L75 -> 57 | O75: 11 | P75: 18 | Q75: =O75*6+P75 -> 84 | S75: UMPIRE | X75: LADDER | AB75: ROUND | AD75: 2
A76: SANDRINGHAM | C76: 3 | D76: 2 | E76: =C76*6+D76 -> 20 | G76: 4 | H76: 4 | I76: =G76*6+H76 -> 28 | K76: 6 | L76: 4 | M76: =K76*6+L76 -> 40 | O76: 10 | P76: 6 | Q76: =O76*6+P76 -> 66 | S76: RICHARDSON
A77: BEST PLAYERS | W77: TEAM | X77: W | Y77: L | Z77: D | AA77: FOR | AB77: AGST | AC77: % | AD77: PTS
A78: MOORABBIN | C78: REID | E78: BOYD | H78: MCKENZIE | K78: LEITCH | N78: COPSEY | Q78: McFARLANE
A79: SANDRINGHAM | C79: BOURKE | E79: RUSSELL | H79: SHEARS | K79: G JONES | N79: GUILLE | Q79: JOSEPHS | W79: BRUNSWICK | X79: 2 | Y79: 0 | Z79: 0 | AA79: 131 | AB79: 66 | AC79: 200 | AD79: 8
A80: GOALKICKERS | W80: PORT MELBOURNE | X80: 2 | Y80: 0 | Z80: 0 | AA80: 215 | AB80: 141 | AC80: 152.48226950354609 | AD80: 8
A81: MOORABBIN | C81: DICKENSON 3 | F81: MURNANE 2 | I81: MCFARLANE 2 | L81: JONES 2 | N81: ADDIS | P81: RICHARDSON | W81: MOORABBIN | X81: 2 | Y81: 0 | Z81: 0 | AA81: 152 | AB81: 118 | AC81: 128.81355932203391 | AD81: 8
A82: SANDRINGHAM | C82: B HARPER 3 | F82: G JONES 2 | I82: JOSEPHS 2 | L82: McINTYRE | N82: McGRATH | Q82: WALKER | W82: YARRAVILLE | X82: 2 | Y82: 0 | Z82: 0 | AA82: 171 | AB82: 151 | AC82: 113.24503311258277 | AD82: 8
A84: YARRAVILLE | C84: 3 | D84: 8 | E84: =C84*6+D84 -> 26 | G84: 7 | H84: 9 | I84: =G84*6+H84 -> 51 | K84: 9 | L84: 11 | M84: =K84*6+L84 -> 65 | O84: 11 | P84: 16 | Q84: =O84*6+P84 -> 82 | S84: YARRAVILLE | W84: OAKLEIGH | X84: 1 | Y84: 1 | Z84: 0 | AA84: 120 | AB84: 69 | AC84: 171.42857142857142 | AD84: 4
A85: PRAHRAN | C85: 3 | D85: 0 | E85: =C85*6+D85 -> 18 | G85: 4 | H85: 3 | I85: =G85*6+H85 -> 27 | K85: 8 | L85: 5 | M85: =K85*6+L85 -> 53 | O85: 11 | P85: 8 | Q85: =O85*6+P85 -> 74 | S85: IRVING | W85: NORTHCOTE | X85: 1 | Y85: 1 | Z85: 0 | AA85: 152 | AB85: 136 | AC85: 111.76470588235294 | AD85: 4
A86: BEST PLAYERS | W86: SANDRINGHAM | X86: 1 | Y86: 1 | Z86: 0 | AA86: 142 | AB86: 129 | AC86: 110.07751937984496 | AD86: 4
A87: YARRAVILLE | C87: BODSWORTH | F87: ELDRIDGE | I87: PHILLIPS | L87: MASON | O87: NICHOLLS | R87: SEITZ | W87: PRESTON | X87: 1 | Y87: 1 | Z87: 0 | AA87: 195 | AB87: 192 | AC87: 101.5625 | AD87: 4
A88: PRAHRAN | C88: ARMSTRONG | F88: YATES | I88: MORONE | L88: SHILLABEER | O88: COURTNEY | R88: KRUSE | W88: PRAHRAN | X88: 1 | Y88: 1 | Z88: 0 | AA88: 163 | AB88: 170 | AC88: 95.882352941176464 | AD88: 4
A89: GOALKICKERS | W89: CAMBERWELL | X89: 1 | Y89: 1 | Z89: 0 | AA89: 119 | AB89: 138 | AC89: 86.231884057971016 | AD89: 4
A90: YARRAVILLE | C90: PHILLIPS 3 | F90: WAGHORNE 3 | I90: MASON 2 | K90: SEITZ | M90: BODSWORTH | P90: LEES | W90: COBURG | X90: 0 | Y90: 2 | Z90: 0 | AA90: 132 | AB90: 162 | AC90: 81.481481481481481 | AD90: 0
A91: PRAHRAN | C91: COURTNEY 2 | F91: KRUSE 2 | H91: MORROW 2 | J91: BOHAN | L91: SHILLABEER | N91: HARVEY | P91: ARMSTRONG | S91: McCULLOCH | W91: WILLIAMSTOWN | X91: 0 | Y91: 2 | Z91: 0 | AA91: 150 | AB91: 211 | AC91: 71.090047393364927 | AD91: 0
W92: BOX HILL | X92: 0 | Y92: 2 | Z92: 0 | AA92: 143 | AB92: 220 | AC92: 65 | AD92: 0
A93: BRUNSWICK | C93: 3 | D93: 2 | E93: =C93*6+D93 -> 20 | G93: 8 | H93: 8 | I93: =G93*6+H93 -> 56 | K93: 15 | L93: 11 | M93: =K93*6+L93 -> 101 | O93: 19 | P93: 17 | Q93: =O93*6+P93 -> 131 | S93: BRUNSWICK | W93: BRIGHTON | X93: 0 | Y93: 2 | Z93: 0 | AA93: 114 | AB93: 196 | AC93: 58.163265306122447 | AD93: 0
A94: BOX HILL | C94: 2 | D94: 1 | E94: =C94*6+D94 -> 13 | G94: 5 | H94: 3 | I94: =G94*6+H94 -> 33 | K94: 7 | L94: 5 | M94: =K94*6+L94 -> 47 | O94: 10 | P94: 6 | Q94: =O94*6+P94 -> 66 | S94: BAWDEN
A95: BEST PLAYERS
A96: BRUNSWICK | C96: WEIR | F96: J RYAN | I96: R RYAN | L96: MORGAN | N96: TAYLOR | Q96: STANLEY
A97: BOX HILL | C97: KRONK | F97: PARKS | I97: MAIDMENT | L97: MORRIS | N97: COGHLAN | Q97: O'NEILL
A98: GOALKICKERS
A99: BRUNSWICK | C99: J RYAN 7 | E99: WEIR 4 | G99: R RYAN 2 | I99: MAY 2 | K99: ARMSTRONG | N99: SEYMOUR | P99: STANLEY | R99: WHEELER
A100: BOX HILL | C100: MAIDMENT 3 | F100: COGHLAN 2 | I100: MORRIS 2 | L100: WILLIAMS | N100: WRIGHT | P100: VANCE
A102: NORTHCOTE | C102: 2 | D102: 2 | E102: =C102*6+D102 -> 14 | G102: 6 | H102: 6 | I102: =G102*6+H102 -> 42 | K102: 10 | L102: 13 | M102: =K102*6+L102 -> 73 | O102: 14 | P102: 16 | Q102: =O102*6+P102 -> 100 | S102: CAMBERWELL
A103: CAMBERWELL | C103: 2 | D103: 1 | E103: =C103*6+D103 -> 13 | G103: 4 | H103: 4 | I103: =G103*6+H103 -> 28 | K103: 6 | L103: 6 | M103: =K103*6+L103 -> 42 | O103: 10 | P103: 8 | Q103: =O103*6+P103 -> 68 | S103: MILNE
A104: BEST PLAYERS
A105: NORTHCOTE | C105: PAWSEY | F105: KNOWLES | I105: NOLAN | L105: VAINS | N105: WHITECHURCH | Q105: HINES
A106: CAMBERWELL | C106: BOHAN | F106: MARIAN | I106: FLETCHER | L106: BRADLEY | N106: BENBOW | Q106: McFEE
A107: GOALKICKERS
A108: NORTHCOTE | C108: PAWSEY 4 | F108: WHITECHURCH 3 | J108: HOLT 3 | L108: STABB 2 | N108: KNOWLES | Q108: DEANS
A109: CAMBERWELL | C109: BRADLEY 3 | F109: MARIAN 3 | I109: McFEE 2 | K109: ROSENBROCK | N109: MILGATE
A111: OAKLEIGH | C111: 5 | D111: 5 | E111: =C111*6+D111 -> 35 | G111: 10 | H111: 14 | I111: =G111*6+H111 -> 74 | K111: 14 | L111: 17 | M111: =K111*6+L111 -> 101 | O111: 16 | P111: 24 | Q111: =O111*6+P111 -> 120 | S111: ELSTERNWICK PARK
A112: BRIGHTON | C112: 2 | D112: 2 | E112: =C112*6+D112 -> 14 | G112: 5 | H112: 4 | I112: =G112*6+H112 -> 34 | K112: 6 | L112: 6 | M112: =K112*6+L112 -> 42 | O112: 10 | P112: 9 | Q112: =O112*6+P112 -> 69 | S112: ROACH
A113: BEST PLAYERS
A114: OAKLEIGH | C114: CUNNINGHAM | F114: SCOTT | I114: J WATSON | L114: BAXTER | N114: STREETER | Q114: RICKERT
A115: BRIGHTON | C115: BURKE | F115: ALEXANDER | I115: PERKINS | L115: R EMBLETON | O115: RIDDELL | Q115: PERRY
A116: GOALKICKERS
A117: OAKLEIGH | C117: J WATSON 4 | F117: STREETER 4 | I117: EDWARDS 3 | L117: SCOTT 3 | N117: CADMAN | Q117: HILL
A118: BRIGHTON | C118: ALEXANDER 3 | F118: R EMBLETON | I118: MARINI | K118: PLUNKETT | M118: BURKE | O118: K EMBLETON | R118: LE GRIFFIN | U118: CLARKE
A120: PRESTON | C120: 4 | D120: 4 | E120: =C120*6+D120 -> 28 | G120: 5 | H120: 6 | I120: =G120*6+H120 -> 36 | K120: 9 | L120: 7 | M120: =K120*6+L120 -> 61 | O120: 16 | P120: 11 | Q120: =O120*6+P120 -> 107 | S120: PRESTON
A121: WILLIAMSTOWN | C121: 2 | D121: 3 | E121: =C121*6+D121 -> 15 | G121: 6 | H121: 8 | I121: =G121*6+H121 -> 44 | K121: 11 | L121: 15 | M121: =K121*6+L121 -> 81 | O121: 14 | P121: 19 | Q121: =O121*6+P121 -> 103 | S121: CLEARY
A122: BEST PLAYERS
A123: PRESTON | C123: BRADFORD | F123: O'CONNOR | I123: DAWSON | L123: BEST | N123: HENRYS | Q123: PASCOE
A124: WILLIAMSTOWN | C124: HOGAN | F124: H SIMPSON | I124: W WILLIAMS | L124: ROGERS | N124: WALKER | Q124: DULLARD
A125: GOALKICKERS
A126: PRESTON | C126: BRADFORD 6 | F126: BATEMAN 3 | I126: F CHARD 2 | L126: LALOR 2 | N126: JEFFREY | P126: O'CONNOR
A127: WILLIAMSTOWN | C127: W WILLIAMS 4 | F127: WALKER 3 | I127: DAVIES 3 | K127: B WILLIAMS | N127: H SIMPSON | Q127: SMITH | S127: MOLYNEUX
A129: PORT MELBOURNE | C129: 7 | D129: 4 | E129: =C129*6+D129 -> 46 | G129: 12 | H129: 6 | I129: =G129*6+H129 -> 78 | K129: 14 | L129: 7 | M129: =K129*6+L129 -> 91 | O129: 17 | P129: 9 | Q129: =O129*6+P129 -> 111 | S129: PORT MELBOURNE
A130: COBURG | C130: 4 | D130: 1 | E130: =C130*6+D130 -> 25 | G130: 7 | H130: 1 | I130: =G130*6+H130 -> 43 | K130: 11 | L130: 3 | M130: =K130*6+L130 -> 69 | O130: 15 | P130: 4 | Q130: =O130*6+P130 -> 94 | S130: MERRINGTON
A131: BEST PLAYERS
A132: PORT MELBOURNE | C132: MURRAY | F132: STOREY | I132: JOHNSON | L132: BONNETT | O132: STONE | R132: WOODS
A133: COBURG | C133: HEWES | F133: ROGAN | I133: EQUID | L133: STARBUCK | O133: CANNING | R133: HAMILTON
A134: GOALKICKERS
A135: PORT MELBOURNE | C135: DOYLE 3 | E135: MILLER 3 | G135: STONE 3 | I135: BONNETT 2 | L135: HOULIHAN 2 | O135: MURRAY | Q135: WALSH | S135: CARIS | U135: OWENS
A136: COBURG | C136: ROGAN 4 | E136: HEWES 3 | G136: McSWEENEY 2 | J136: JAMES 2 | L136: CANNING | N136: H WILKINSON | Q136: HAMILTON | T136: EVANS
A138: ROUND 3 | E138: 3RD MAY | J138: WEATHER | M138: FINE SUNNY GROUNDS HEAVY | S138: PLAYED AT
D139: 1ST QTR | H139: 2ND QTR | L139: 3RD QTR | P139: FINAL | S139: OAKLEIGH
A140: OAKLEIGH | C140: 3 | D140: 1 | E140: =C140*6+D140 -> 19 | G140: 7 | H140: 3 | I140: =G140*6+H140 -> 45 | K140: 12 | L140: 4 | M140: =K140*6+L140 -> 76 | O140: 17 | P140: 8 | Q140: =O140*6+P140 -> 110 | S140: UMPIRE | X140: LADDER | AB140: ROUND | AD140: 3
A141: MOORABBIN | C141: 1 | D141: 3 | E141: =C141*6+D141 -> 9 | G141: 4 | H141: 6 | I141: =G141*6+H141 -> 30 | K141: 7 | L141: 7 | M141: =K141*6+L141 -> 49 | O141: 8 | P141: 8 | Q141: =O141*6+P141 -> 56 | S141: MERRINGTON
A142: BEST PLAYERS | W142: TEAM | X142: W | Y142: L | Z142: D | AA142: FOR | AB142: AGST | AC142: % | AD142: PTS
A143: OAKLEIGH | C143: EDWARDS | F143: RICKERT | I143: TEMME | K143: HOWELL | N143: W WILLIAMS | Q143: SCOTT
A144: MOORABBIN | C144: BOYD | F144: OSTLE | I144: JONES | K144: McKENZIE | N144: COPSEY | Q144: BARNES | W144: PORT MELBOURNE | X144: 3 | Y144: 0 | Z144: 0 | AA144: 269 | AB144: 184 | AC144: 146.19565217391303 | AD144: 12
A145: GOALKICKERS | W145: YARRAVILLE | X145: 3 | Y145: 0 | Z145: 0 | AA145: 270 | AB145: 237 | AC145: 113.92405063291139 | AD145: 12
A146: OAKLEIGH | C146: YOUNG 6 | E146: EDWARDS 4 | H146: RICKERT 3 | J146: SCOTT | L146: STREETER | N146: GUY | P146: W WILLIAMS | W146: OAKLEIGH | X146: 2 | Y146: 1 | Z146: 0 | AA146: 230 | AB146: 125 | AC146: 182.53968253968253 | AD146: 8
A147: MOORABBIN | C147: MURNANE 3 | F147: RICHARDSON 2 | J147: BOYD | L147: DICKENSON | O147: BARNES | W147: BRUNSWICK | X147: 2 | Y147: 1 | Z147: 0 | AA147: 196 | AB147: 135 | AC147: 145.92592592592592 | AD147: 8
A149: PORT MELBOURNE | C149: 3 | D149: 7 | E149: =C149*6+D149 -> 25 | G149: 4 | H149: 9 | I149: =G149*6+H149 -> 33 | K149: 5 | L149: 16 | M149: =K149*6+L149 -> 46 | O149: 6 | P149: 18 | Q149: =O149*6+P149 -> 54 | S149: NORTHCOTE | W149: PRAHRAN | X149: 2 | Y149: 1 | Z149: 0 | AA149: 232 | AB149: 235 | AC149: 98.723404255319153 | AD149: 8
A150: NORTHCOTE | C150: 1 | D150: 3 | E150: =C150*6+D150 -> 9 | G150: 2 | H150: 6 | I150: =G150*6+H150 -> 18 | K150: 3 | L150: 9 | M150: =K150*6+L150 -> 27 | O150: 5 | P150: 13 | Q150: =O150*6+P150 -> 43 | S150: IRVING | W150: CAMBERWELL | X150: 2 | Y150: 1 | Z150: 0 | AA150: 195 | AB150: 213 | AC150: 91.549295774647888 | AD150: 8
A151: BEST PLAYERS | W151: MOORABBIN | X151: 2 | Y151: 1 | Z151: 0 | AA151: 208 | AB151: 228 | AC151: 91.228070175438603 | AD151: 8
A152: PORT MELBOURNE | C152: CROFT | F152: JOHNSON | I152: LAFFEY | K152: WOODS | N152: MURRAY | Q152: STONE | W152: SANDRINGHAM | X152: 1 | Y152: 2 | Z152: 0 | AA152: 217 | AB152: 205 | AC152: 105.85365853658537 | AD152: 4
A153: NORTHCOTE | C153: KNOWLES | F153: NOLAN | I153: DEANS | K153: WHITECHURCH | N153: HISCOX | Q153: PAWSEY | W153: NORTHCOTE | X153: 1 | Y153: 2 | Z153: 0 | AA153: 195 | AB153: 190 | AC153: 102.63157894736842 | AD153: 4
A154: GOALKICKERS | W154: PRESTON | X154: 1 | Y154: 2 | Z154: 0 | AA154: 281 | AB154: 291 | AC154: 96.56357388316151 | AD154: 4
A155: PORT MELBOURNE | C155: MURRAY 2 | F155: STONE | H155: LAFFEY | J155: WALSH | L155: MILLER | W155: WILLIAMSTOWN | X155: 1 | Y155: 2 | Z155: 0 | AA155: 267 | AB155: 302 | AC155: 88.410596026490069 | AD155: 4
A156: NORTHCOTE | C156: PAWSEY | E156: DEANS | G156: McGREGOR | J156: PURDON | M156: E WHITE | W156: BOX HILL | X156: 1 | Y156: 2 | Z156: 0 | AA156: 229 | AB156: 304 | AC156: 75.328947368421055 | AD156: 4
W157: COBURG | X157: 0 | Y157: 3 | Z157: 0 | AA157: 223 | AB157: 279 | AC157: 79.928315412186379 | AD157: 0
A158: YARRAVILLE | C158: 3 | D158: 3 | E158: =C158*6+D158 -> 21 | G158: 7 | H158: 7 | I158: =G158*6+H158 -> 49 | K158: 12 | L158: 8 | M158: =K158*6+L158 -> 80 | O158: 14 | P158: 15 | Q158: =O158*6+P158 -> 99 | S158: YARRAVILLE | W158: BRIGHTON | X158: 0 | Y158: 3 | Z158: 0 | AA158: 198 | AB158: 282 | AC158: 70.212765957446805 | AD158: 0
A159: PRESTON | C159: 6 | D159: 4 | E159: =C159*6+D159 -> 40 | G159: 9 | H159: 4 | I159: =G159*6+H159 -> 58 | K159: 12 | L159: 7 | M159: =K159*6+L159 -> 79 | O159: 13 | P159: 8 | Q159: =O159*6+P159 -> 86 | S159: MILNE
A160: BEST PLAYERS
A161: YARRAVILLE | C161: JONES | F161: SEITZ | I161: WAGHORNE | L161: MITCHELL | O161: COOK | Q161: BODSWORTH
A162: PRESTON | C162: CROCKER | F162: BRADFORD | I162: PRITCHARD | L162: COOPER | O162: DEACON | Q162: DAWSON
A163: GOALKICKERS
A164: YARRAVILLE | C164: WAGHORNE 6 | F164: PHILLIPS 3 | I164: MASON 3 | K164: SEITZ | M164: BODSWORTH
A165: PRESTON | C165: CROCKER 5 | F165: F CHARD 2 | I165: FOLEY 2 | K165: O'CONNOR | M165: DEACON | O165: BRADFORD | R165: BATEMAN
A167: PRAHRAN | C167: 1 | D167: 4 | E167: =C167*6+D167 -> 10 | G167: 6 | H167: 6 | I167: =G167*6+H167 -> 42 | K167: 9 | L167: 9 | M167: =K167*6+L167 -> 63 | O167: 10 | P167: 9 | Q167: =O167*6+P167 -> 69 | S167: TOORAK PARK
A168: BRUNSWICK | C168: 1 | D168: 1 | E168: =C168*6+D168 -> 7 | G168: 3 | H168: 5 | I168: =G168*6+H168 -> 23 | K168: 3 | L168: 6 | M168: =K168*6+L168 -> 24 | O168: 9 | P168: 11 | Q168: =O168*6+P168 -> 65 | S168: ROACH
A169: BEST PLAYERS
A170: PRAHRAN | C170: McCULLOCH | F170: HARVEY | I170: KRUSE | K170: BUTLING | N170: ARMSTRONG | Q170: YATES
A171: BRUNSWICK | C171: POLLARD | F171: WHEELER | I171: MUNRO | K171: NEILSON | N171: MORGAN | Q171: ARMSTRONG
A172: GOALKICKERS
A173: PRAHRAN | C173: McCULLOCH 6 | F173: COURTNEY 2 | I173: BOHAN | K173: MORROW
A174: BRUNSWICK | C174: J RYAN 3 | F174: WEIR 2 | H174: WHEELER | J174: R RYAN | L174: SEYMOUR | N174: ARMSTRONG
A176: CAMBERWELL | C176: 2 | D176: 1 | E176: =C176*6+D176 -> 13 | G176: 6 | H176: 3 | I176: =G176*6+H176 -> 39 | K176: 6 | L176: 4 | M176: =K176*6+L176 -> 40 | O176: 11 | P176: 10 | Q176: =O176*6+P176 -> 76 | S176: BEACH ROAD
A177: SANDRINGHAM | C177: 3 | D177: 3 | E177: =C177*6+D177 -> 21 | G177: 4 | H177: 4 | I177: =G177*6+H177 -> 28 | K177: 10 | L177: 9 | M177: =K177*6+L177 -> 69 | O177: 11 | P177: 9 | Q177: =O177*6+P177 -> 75 | S177: SMYTH
A178: BEST PLAYERS
A179: CAMBERWELL | C179: BOHAN | F179: ALLAN | I179: LOVETT | L179: McFEE | N179: HAYES | Q179: MARIAN
A180: SANDRINGHAM | C180: BRIGHTON | F180: G JONES | I180: RUSSELL | L180: HISCOCK | N180: SCANLAN | Q180: ANDRESON
A181: GOALKICKERS
A182: CAMBERWELL | C182: McFEE 3 | F182: MILGATE 2 | I182: ROSENBROCK 2 | L182: HAYES 2 | N182: MARIAN | P182: COOK
A183: SANDRINGHAM | C183: B HARPER 4 | F183: G JONES 2 | I183: McINTYRE 2 | L183: BOURKE 2 | O183: HISCOCK
A185: WILLIAMSTOWN | C185: 5 | D185: 4 | E185: =C185*6+D185 -> 34 | G185: 6 | H185: 4 | I185: =G185*6+H185 -> 40 | K185: 13 | L185: 12 | M185: =K185*6+L185 -> 90 | O185: 17 | P185: 15 | Q185: =O185*6+P185 -> 117 | S185: COBURG
A186: COBURG | C186: 3 | D186: 1 | E186: =C186*6+D186 -> 19 | G186: 9 | H186: 8 | I186: =G186*6+H186 -> 62 | K186: 12 | L186: 9 | M186: =K186*6+L186 -> 81 | O186: 13 | P186: 13 | Q186: =O186*6+P186 -> 91 | S186: RICHARDSON
A187: BEST PLAYERS
A188: WILLIAMSTOWN | C188: AULD | E188: W WILLIAMS | H188: CAMERON | K188: DULLARD | N188: H SIMPSON | Q188: B WILLIAMS
A189: COBURG | C189: EVANS | E189: JAMES | H189: FEWKES | K189: H WILKINSON | N189: STARBUCK | Q189: CANNING
A190: GOALKICKERS
A191: WILLIAMSTOWN | C191: WALKER 6 | F191: DULLARD 3 | I191: W WILLIAMS 2 | L191: AULD 2 | N191: H SIMPSON | Q191: ALLANSON | T191: DAVIES | V191: WOOKEY
A192: COBURG | C192: JAMES 5 | F192: H WILKINSON 2 | J192: R WILKINSON | M192: ROGAN | O192: CANNING | Q192: HEWES | S192: LEVERSHA | V192: EVANS
A194: BOX HILL | C194: 4 | D194: 3 | E194: =C194*6+D194 -> 27 | G194: 7 | H194: 4 | I194: =G194*6+H194 -> 46 | K194: 10 | L194: 14 | M194: =K194*6+L194 -> 74 | O194: 12 | P194: 14 | Q194: =O194*6+P194 -> 86 | S194: B.H
A195: BRIGHTON | C195: 0 | D195: 6 | E195: =C195*6+D195 -> 6 | G195: 4 | H195: 8 | I195: =G195*6+H195 -> 32 | K195: 7 | L195: 10 | M195: =K195*6+L195 -> 52 | O195: 12 | P195: 12 | Q195: =O195*6+P195 -> 84 | S195: CLEARY
A196: BEST PLAYERS
A197: BOX HILL | C197: GREEN | F197: MORRIS | I197: VANCE | L197: KRONK | O197: HENDERSON | R197: B COGHLAN
A198: BRIGHTON | C198: PICKERING | F198: PERKINS | I198: ALEXANDER | L198: K EMBLETON | O198: R EMBLETON | R198: FREEMAN
A199: GOALKICKERS
A200: BOX HILL | C200: MAIDMENT 4 | F200: B COGHLAN 2 | I200: HENDERSON 2 | L200: JEFFERS | N200: VANCE | P200: MORRIS | R200: GARDINER
A201: BRIGHTON | C201: PICKERING 5 | F201: TURNER | H201: PERKINS | J201: ALEXANDER | M201: R EMBLETON | P201: BURKE | R201: O'MEARA | U201: LE GRIFFIN
A203: ROUND 4 | E203: 10TH MAY | J203: WEATHER | O203: FINE & SUNNY | S203: PLAYED AT
D204: 1ST QTR | H204: 2ND QTR | L204: 3RD QTR | P204: FINAL | S204: BRUNSWICK
A205: BRUNSWICK | C205: 3 | D205: 2 | E205: =C205*6+D205 -> 20 | G205: 6 | H205: 3 | I205: =G205*6+H205 -> 39 | K205: 7 | L205: 9 | M205: =K205*6+L205 -> 51 | O205: 8 | P205: 13 | Q205: =O205*6+P205 -> 61 | S205: UMPIRE | X205: LADDER | AB205: ROUND | AD205: 4
A206: YARRAVILLE | C206: 1 | D206: 3 | E206: =C206*6+D206 -> 9 | G206: 1 | H206: 5 | I206: =G206*6+H206 -> 11 | K206: 1 | L206: 5 | M206: =K206*6+L206 -> 11 | O206: 4 | P206: 10 | Q206: =O206*6+P206 -> 34 | S206: RICHARDSON
A207: BEST PLAYERS | W207: TEAM | X207: W | Y207: L | Z207: D | AA207: FOR | AB207: AGST | AC207: % | AD207: PTS
A208: BRUNSWICK | C208: YEA | F208: NEILSON | I208: ARMSTRONG | L208: WEIR | N208: MAY | Q208: ROLFS
A209: YARRAVILLE | C209: ROHLEDER | F209: NICHOLLS | I209: VANDERFEEN | L209: MASON | N209: ELDRIDGE | Q209: CRANAGE | W209: PORT MELBOURNE | X209: 4 | Y209: 0 | Z209: 0 | AA209: 350 | AB209: 226 | AC209: 154.86725663716814 | AD209: 16
A210: GOALKICKERS | W210: OAKLEIGH | X210: 3 | Y210: 1 | Z210: 0 | AA210: 351 | AB210: 193 | AC210: 180.9278350515464 | AD210: 12
A211: BRUNSWICK | C211: WEIR 3 | E211: ARMSTRONG 2 | I211: NEILSON | K211: STANLEY | M211: SEYMOUR | W211: BRUNSWICK | X211: 3 | Y211: 1 | Z211: 0 | AA211: 257 | AB211: 169 | AC211: 152.66272189349112 | AD211: 12
A212: YARRAVILLE | C212: SEITZ | E212: BODSWORTH | H212: SALT | J212: B WILLIAMS | W212: PRAHRAN | X212: 3 | Y212: 1 | Z212: 0 | AA212: 367 | AB212: 309 | AC212: 118.77022653721683 | AD212: 12
A214: OAKLEIGH | C214: 2 | D214: 4 | E214: =C214*6+D214 -> 16 | G214: 10 | H214: 7 | I214: =G214*6+H214 -> 67 | K214: 13 | L214: 8 | M214: =K214*6+L214 -> 86 | O214: 18 | P214: 13 | Q214: =O214*6+P214 -> 121 | S214: CAMBERWELL | W214: YARRAVILLE | X214: 3 | Y214: 1 | Z214: 0 | AA214: 304 | AB214: 298 | AC214: 102.01342281879195 | AD214: 12
A215: CAMBERWELL | C215: 3 | D215: 1 | E215: =C215*6+D215 -> 19 | G215: 5 | H215: 3 | I215: =G215*6+H215 -> 33 | K215: 8 | L215: 8 | M215: =K215*6+L215 -> 56 | O215: 10 | P215: 8 | Q215: =O215*6+P215 -> 68 | S215: ROACH | W215: MOORABBIN | X215: 3 | Y215: 1 | Z215: 0 | AA215: 280 | AB215: 290 | AC215: 96.551724137931032 | AD215: 12
A216: BEST PLAYERS | W216: NORTHCOTE | X216: 2 | Y216: 2 | Z216: 0 | AA216: 276 | AB216: 263 | AC216: 104.94296577946768 | AD216: 8
A217: OAKLEIGH | C217: WENN | E217: JOHNSON | H217: W WILLIAMS | K217: TINDAL | N217: LAMBERT | Q217: HOWELL | W217: CAMBERWELL | X217: 2 | Y217: 2 | Z217: 0 | AA217: 263 | AB217: 334 | AC217: 78.742514970059887 | AD217: 8
A218: CAMBERWELL | C218: McFEE | E218: BEDFORD | H218: BOHAN | K218: BRADLEY | N218: MARIAN | Q218: CALLAHAN | W218: COBURG | X218: 1 | Y218: 3 | Z218: 0 | AA218: 342 | AB218: 351 | AC218: 97.435897435897431 | AD218: 4
A219: GOALKICKERS | W219: SANDRINGHAM | X219: 1 | Y219: 3 | Z219: 0 | AA219: 259 | AB219: 286 | AC219: 90.55944055944056 | AD219: 4
A220: OAKLEIGH | C220: WENN 5 | E220: JOHNSON 5 | H220: YOUNG 2 | J220: EDWARDS 2 | M220: NEWTON 2 | P220: BOTTEN | R220: LAMBERT | W220: WILLIAMSTOWN | X220: 1 | Y220: 3 | Z220: 0 | AA220: 340 | AB220: 383 | AC220: 88.772845953002616 | AD220: 4
A221: CAMBERWELL | C221: MARIAN 3 | F221: McFEE 2 | I221: ROSENBROCK 2 | M221: MILGATE | O221: HEDLEY | Q221: HAYES | W221: PRESTON | X221: 1 | Y221: 3 | Z221: 0 | AA221: 353 | AB221: 410 | AC221: 86.097560975609753 | AD221: 4
W222: BOX HILL | X222: 1 | Y222: 3 | Z222: 0 | AA222: 291 | AB222: 376 | AC222: 77.393617021276597 | AD222: 4
A223: PORT MELBOURNE | C223: 3 | D223: 4 | E223: =C223*6+D223 -> 22 | G223: 5 | H223: 7 | I223: =G223*6+H223 -> 37 | K223: 8 | L223: 13 | M223: =K223*6+L223 -> 61 | O223: 11 | P223: 15 | Q223: =O223*6+P223 -> 81 | S223: PORT MELBOURNE | W223: BRIGHTON | X223: 0 | Y223: 4 | Z223: 0 | AA223: 272 | AB223: 417 | AC223: 65.227817745803364 | AD223: 0
A224: SANDRINGHAM | C224: 2 | D224: 1 | E224: =C224*6+D224 -> 13 | G224: 5 | H224: 4 | I224: =G224*6+H224 -> 34 | K224: 5 | L224: 8 | M224: =K224*6+L224 -> 38 | O224: 5 | P224: 12 | Q224: =O224*6+P224 -> 42 | S224: SMYTH
A225: BEST PLAYERS
A226: PORT MELBOURNE | C226: JOHNSON | F226: A MILLER | I226: B MILLER | L226: WILSON | O226: MURRAY | Q226: OWENS
A227: SANDRINGHAM | C227: GUILLE | F227: SHEARS | I227: B HARPER | L227: SCANLAN | O227: RUSSO | Q227: SHIPP
A228: GOALKICKERS
A229: PORT MELBOURNE | C229: B MILLER 4 | F229: WALSH 3 | I229: A MILLER | K229: MURRAY | M229: DOYLE | O229: BONNETT
A230: SANDRINGHAM | C230: B HARPER 3 | F230: HISCOCK | I230: SHIPP
A232: NORTHCOTE | C232: 1 | D232: 4 | E232: =C232*6+D232 -> 10 | G232: 5 | H232: 8 | I232: =G232*6+H232 -> 38 | K232: 9 | L232: 12 | M232: =K232*6+L232 -> 66 | O232: 11 | P232: 15 | Q232: =O232*6+P232 -> 81 | S232: WILLIAMSTOWN
A233: WILLIAMSTOWN | C233: 4 | D233: 4 | E233: =C233*6+D233 -> 28 | G233: 8 | H233: 5 | I233: =G233*6+H233 -> 53 | K233: 10 | L233: 7 | M233: =K233*6+L233 -> 67 | O233: 11 | P233: 7 | Q233: =O233*6+P233 -> 73 | S233: MERRINGTON
A234: BEST PLAYERS
A235: NORTHCOTE | C235: PURDON | F235: WOOLNOUGH | I235: DUNGAN | L235: PAWSEY | O235: POWELL | Q235: KNOWLES
A236: WILLIAMSTOWN | C236: H SIMPSON | F236: W WILLIAMS | I236: POOLE | L236: DULLARD | O236: COLLINS | Q236: WOOKEY
A237: GOALKICKERS
A238: NORTHCOTE | C238: PURDON 4 | F238: DUNGAN 3 | I238: PAWSEY 2 | L238: WOOLNOUGH | O238: PAYNTER
A239: WILLIAMSTOWN | C239: WALKER 4 | F239: W WILLIAMS 3 | J239: POOLE | L239: AULD | N239: DULLARD | Q239: COLLINS
A241: COBURG | C241: 3 | D241: 3 | E241: =C241*6+D241 -> 21 | G241: 7 | H241: 9 | I241: =G241*6+H241 -> 51 | K241: 10 | L241: 15 | M241: =K241*6+L241 -> 75 | O241: 16 | P241: 23 | Q241: =O241*6+P241 -> 119 | S241: PRESTON
A242: PRESTON | C242: 4 | D242: 2 | E242: =C242*6+D242 -> 26 | G242: 6 | H242: 5 | I242: =G242*6+H242 -> 41 | K242: 9 | L242: 8 | M242: =K242*6+L242 -> 62 | O242: 10 | P242: 12 | Q242: =O242*6+P242 -> 72 | S242: SMYTH
A243: BEST PLAYERS
A244: COBURG | C244: ROGAN | F244: H WILKINSON | I244: EQUID | L244: WALKER | N244: STARBUCK | Q244: CANNING
A245: PRESTON | C245: PASCOE | F245: BRADFORD | I245: BEST | L245: LALOR | N245: HENRYS | Q245: HUNTER
A246: GOALKICKERS
A247: COBURG | C247: ROGAN 5 | F247: EQUID 4 | I247: H WILKINSON 3 | M247: LEVERSHA 2 | P247: JAMES | R247: R WILKINSON
A248: PRESTON | C248: LALOR 3 | F248: BRADFORD 2 | I248: CROCKER | K248: FOLEY | M248: F CHARD | O248: DEACON | Q248: BATEMAN
A250: MOORABBIN | C250: 1 | D250: 8 | E250: =C250*6+D250 -> 14 | G250: 3 | H250: 15 | I250: =G250*6+H250 -> 33 | K250: 6 | L250: 21 | M250: =K250*6+L250 -> 57 | O250: 8 | P250: 24 | Q250: =O250*6+P250 -> 72 | S250: MOORABBIN
A251: BOX HILL | C251: 1 | D251: 2 | E251: =C251*6+D251 -> 8 | G251: 5 | H251: 4 | I251: =G251*6+H251 -> 34 | K251: 6 | L251: 5 | M251: =K251*6+L251 -> 41 | O251: 9 | P251: 8 | Q251: =O251*6+P251 -> 62 | S251: MILNE
A252: BEST PLAYERS
A253: MOORABBIN | C253: BROWN | F253: BOYD | I253: COPSEY | L253: D'OLIVER | O253: McKENZIE | R253: DUNSCOMBE
A254: BOX HILL | C254: MORRIS | F254: VANCE | I254: KRONK | L254: COGHLAN | O254: GARDINER | R254: GREEN
A255: GOALKICKERS
A256: MOORABBIN | C256: BROWN 2 | F256: BOYD | H256: McKENZIE | J256: TRESIZE | L256: DICKENSON | O256: RICHARDSON | R256: DUNSCOMBE
A257: BOX HILL | C257: COGHLAN 4 | F257: VANCE 4 | I257: MORRIS
A259: PRAHRAN | C259: 3 | D259: 4 | E259: =C259*6+D259 -> 22 | G259: 12 | H259: 5 | I259: =G259*6+H259 -> 77 | K259: 18 | L259: 9 | M259: =K259*6+L259 -> 117 | O259: 20 | P259: 15 | Q259: =O259*6+P259 -> 135 | S259: ELSTERNWICK PARK
A260: BRIGHTON | C260: 3 | D260: 3 | E260: =C260*6+D260 -> 21 | G260: 5 | H260: 6 | I260: =G260*6+H260 -> 36 | K260: 10 | L260: 7 | M260: =K260*6+L260 -> 67 | O260: 11 | P260: 8 | Q260: =O260*6+P260 -> 74 | S260: IRVING
A261: BEST PLAYERS
A262: PRAHRAN | C262: HARVEY | F262: CHIPP | I262: COURTNEY | L262: WALSH | O262: MORROW | R262: YATES
A263: BRIGHTON | C263: PLUNKETT | F263: MEE | I263: O'MEARA | L263: ALEXANDER | O263: BURKE | R263: PERKINS
A264: GOALKICKERS
A265: PRAHRAN | C265: HARVEY 5 | E265: MORROW 3 | H265: MCCULLOCH 2 | K265: COURTNEY 2 | N265: SHILLABEER 2 | Q265: KRUSE 2 | S265: BOHAN | U265: GALLAGHER | X265: WALSH | Z265: GRAMBEAU
A266: BRIGHTON | C266: O'MEARA 3 | F266: MEE 3 | H266: SHERMAN | J266: BURKE | L266: HALL | N266: LE GRIFFIN | Q266: ALEXANDER
A268: ROUND 5 | E268: 17TH MAY | I268: WEATHER | L268: SOUTH WEST WIND LIGHT SHOWERS | S268: PLAYED AT
D269: 1ST QTR | H269: 2ND QTR | L269: 3RD QTR | P269: FINAL | S269: OAKLEIGH
A270: PORT MELBOURNE | C270: 1 | D270: 3 | E270: =C270*6+D270 -> 9 | G270: 3 | H270: 7 | I270: =G270*6+H270 -> 25 | K270: 5 | L270: 9 | M270: =K270*6+L270 -> 39 | O270: 10 | P270: 12 | Q270: =O270*6+P270 -> 72 | S270: UMPIRE | X270: LADDER | AB270: ROUND | AD270: 5
A271: OAKLEIGH | C271: 1 | D271: 5 | E271: =C271*6+D271 -> 11 | G271: 4 | H271: 9 | I271: =G271*6+H271 -> 33 | K271: 7 | L271: 13 | M271: =K271*6+L271 -> 55 | O271: 9 | P271: 17 | Q271: =O271*6+P271 -> 71 | S271: CLEARY
A272: BEST PLAYERS | W272: TEAM | X272: W | Y272: L | Z272: D | AA272: FOR | AB272: AGST | AC272: % | AD272: PTS
A273: PORT MELBOURNE | C273: WALSH | F273: JOHNSON | I273: LEEHANE | L273: WILSON | O273: OWENS | Q273: A MILLER
A274: OAKLEIGH | C274: BAXTER | F274: GUY | I274: JOHNSON | L274: STREETER | O274: LAMBERT | Q274: TEMME | W274: PORT MELBOURNE | X274: 5 | Y274: 0 | Z274: 0 | AA274: 422 | AB274: 297 | AC274: 142.08754208754209 | AD274: 20
A275: GOALKICKERS | W275: BRUNSWICK | X275: 4 | Y275: 1 | Z275: 0 | AA275: 351 | AB275: 241 | AC275: 146.05809128630705 | AD275: 16
A276: PORT MELBOURNE | C276: WALSH 4 | F276: BONNETT 3 | I276: OWENS 2 | L276: BOWER | W276: PRAHRAN | X276: 4 | Y276: 1 | Z276: 0 | AA276: 464 | AB276: 367 | AC276: 126.43051771117166 | AD276: 16
A277: OAKLEIGH | C277: NEWTON 4 | F277: HOWELL 2 | I277: STREETER | L277: RICKERT | O277: EDWARDS | W277: YARRAVILLE | X277: 4 | Y277: 1 | Z277: 0 | AA277: 410 | AB277: 356 | AC277: 115.1685393258427 | AD277: 16
A279: PRAHRAN | C279: 3 | D279: 2 | E279: =C279*6+D279 -> 20 | G279: 6 | H279: 6 | I279: =G279*6+H279 -> 42 | K279: 8 | L279: 8 | M279: =K279*6+L279 -> 56 | O279: 14 | P279: 13 | Q279: =O279*6+P279 -> 97 | S279: TOORAK PARK | W279: OAKLEIGH | X279: 3 | Y279: 2 | Z279: 0 | AA279: 422 | AB279: 265 | AC279: 158.64661654135338 | AD279: 12
A280: MOORABBIN | C280: 1 | D280: 8 | E280: =C280*6+D280 -> 14 | G280: 5 | H280: 11 | I280: =G280*6+H280 -> 41 | K280: 5 | L280: 13 | M280: =K280*6+L280 -> 43 | O280: 7 | P280: 16 | Q280: =O280*6+P280 -> 58 | S280: MERRINGTON | W280: CAMBERWELL | X280: 3 | Y280: 2 | Z280: 0 | AA280: 348 | AB280: 389 | AC280: 89.460154241645242 | AD280: 12
A281: BEST PLAYERS | W281: MOORABBIN | X281: 3 | Y281: 2 | Z281: 0 | AA281: 338 | AB281: 387 | AC281: 87.338501291989658 | AD281: 12
A282: PRAHRAN | C282: COURTNEY | F282: HARVEY | I282: OVERS | K282: G JONES | N282: GRAMBEAU | Q282: KRUSE | W282: COBURG | X282: 2 | Y282: 3 | Z282: 0 | AA282: 413 | AB282: 410 | AC282: 100.73170731707317 | AD282: 8
A283: MOORABBIN | C283: McKENZIE | F283: DUNSCOMBE | I283: REID | K283: OSTLE | N283: DICKENSON | Q283: BAKER | W283: NORTHCOTE | X283: 2 | Y283: 3 | Z283: 0 | AA283: 335 | AB283: 334 | AC283: 100.29940119760479 | AD283: 8
A284: GOALKICKERS | Q284: SHILLABEER | W284: SANDRINGHAM | X284: 2 | Y284: 3 | Z284: 0 | AA284: 351 | AB284: 367 | AC284: 95.640326975476839 | AD284: 8
A285: PRAHRAN | C285: McCULLOCH 4 | F285: MORROW 2 | I285: HARVEY 2 | K285: BOHAN 2 | M285: G JONES | O285: COURTNEY | Q285: CONNINGSBY | W285: WILLIAMSTOWN | X285: 1 | Y285: 4 | Z285: 0 | AA285: 421 | AB285: 475 | AC285: 88.631578947368425 | AD285: 4
A286: MOORABBIN | C286: REID 2 | F286: CALDWELL | I286: BOYD | K286: DICKENSON | N286: JONES | P286: DUNSCOMBE | W286: PRESTON | X286: 1 | Y286: 4 | Z286: 0 | AA286: 425 | AB286: 504 | AC286: 84.325396825396822 | AD286: 4
W287: BOX HILL | X287: 1 | Y287: 4 | Z287: 0 | AA287: 346 | AB287: 461 | AC287: 75.054229934924081 | AD287: 4
A288: COBURG | C288: 3 | D288: 3 | E288: =C288*6+D288 -> 21 | G288: 3 | H288: 5 | I288: =G288*6+H288 -> 23 | K288: 5 | L288: 9 | M288: =K288*6+L288 -> 39 | O288: 10 | P288: 11 | Q288: =O288*6+P288 -> 71 | S288: NORTHCOTE | W288: BRIGHTON | X288: 0 | Y288: 5 | Z288: 0 | AA288: 330 | AB288: 523 | AC288: 63.097514340344169 | AD288: 0
A289: NORTHCOTE | C289: 0 | D289: 6 | E289: =C289*6+D289 -> 6 | G289: 3 | H289: 10 | I289: =G289*6+H289 -> 28 | K289: 4 | L289: 13 | M289: =K289*6+L289 -> 37 | O289: 7 | P289: 17 | Q289: =O289*6+P289 -> 59 | S289: MILNE
A290: BEST PLAYERS
A291: COBURG | C291: STARBUCK | F291: CANNING | I291: CONDON | L291: WALKER | O291: ROGAN | Q291: JAMES
A292: NORTHCOTE | C292: KNOWLES | F292: DEANS | I292: HINES | L292: R WHITE | O292: STABB | Q292: STEINTHAL
A293: GOALKICKERS
A294: COBURG | C294: R WILKINSON 3 | F294: JAMES 2 | H294: CANNING | J294: McTAGGART | M294: ROGAN | O294: EVANS | Q294: BRYAR
A295: NORTHCOTE | C295: COLLINS 2 | F295: KNOWLES | I295: WHITECHURCH | L295: STABB | N295: R WHITE | Q295: McGREGOR
A297: SANDRINGHAM | C297: 4 | D297: 3 | E297: =C297*6+D297 -> 27 | G297: 6 | H297: 4 | I297: =G297*6+H297 -> 40 | K297: 11 | L297: 9 | M297: =K297*6+L297 -> 75 | O297: 13 | P297: 14 | Q297: =O297*6+P297 -> 92 | S297: BEACH ROAD
A298: WILLIAMSTOWN | C298: 3 | D298: 2 | E298: =C298*6+D298 -> 20 | G298: 6 | H298: 6 | I298: =G298*6+H298 -> 42 | K298: 8 | L298: 8 | M298: =K298*6+L298 -> 56 | O298: 11 | P298: 15 | Q298: =O298*6+P298 -> 81 | S298: IRVING
A299: BEST PLAYERS
A300: SANDRINGHAM | C300: BOURKE | F300: RUSSELL | I300: B HARPER | L300: SHEARS | O300: ANDRESON | R300: RUSSO
A301: WILLIAMSTOWN | C301: W WILLIAMS | F301: DULLARD | I301: POOLE | L301: SHEAHAN | O301: HESLOP | R301: MOLYNEUX
A302: GOALKICKERS
A303: SANDRINGHAM | C303: B HARPER 6 | F303: HISCOCK 3 | I303: G JONES 2 | L303: SCANLON | N303: BOURKE
A304: WILLIAMSTOWN | C304: WALKER 3 | F304: DULLARD 3 | I304: HOWARD 2 | L304: CANNIE | N304: W WILLIAMS | Q304: MOLYNEUX
A306: CAMBERWELL | C306: 4 | D306: 1 | E306: =C306*6+D306 -> 25 | G306: 6 | H306: 4 | I306: =G306*6+H306 -> 40 | K306: 8 | L306: 10 | M306: =K306*6+L306 -> 58 | O306: 12 | P306: 13 | Q306: =O306*6+P306 -> 85 | S306: BOX HILL
A307: BOX HILL | C307: 2 | D307: 1 | E307: =C307*6+D307 -> 13 | G307: 3 | H307: 2 | I307: =G307*6+H307 -> 20 | K307: 6 | L307: 6 | M307: =K307*6+L307 -> 42 | O307: 8 | P307: 7 | Q307: =O307*6+P307 -> 55 | S307: RICHARDSON
A308: BEST PLAYERS
A309: CAMBERWELL | C309: MARIAN | F309: McFEE | I309: LITTLE | L309: BRADLEY | O309: BOHAN | R309: FLETCHER
A310: BOX HILL | C310: IRVINE | F310: GARDINER | I310: KRONK | L310: VANCE | O310: HAMMOND | R310: MAIDMENT
A311: GOALKICKERS
A312: CAMBERWELL | C312: MARIAN 4 | F312: LITTLE 3 | I312: MCFEE 3 | L312: HAYES | N312: ROSENBROCK
A313: BOX HILL | C313: MAIDMENT 3 | F313: PARKS 2 | I313: O'ROURKE | L313: GARDINER | N313: MORRIS
A315: YARRAVILLE | C315: 6 | D315: 1 | E315: =C315*6+D315 -> 37 | G315: 10 | H315: 3 | I315: =G315*6+H315 -> 63 | K315: 15 | L315: 8 | M315: =K315*6+L315 -> 98 | O315: 16 | P315: 10 | Q315: =O315*6+P315 -> 106 | S315: YARRAVILLE
A316: BRIGHTON | C316: 0 | D316: 3 | E316: =C316*6+D316 -> 3 | G316: 1 | H316: 4 | I316: =G316*6+H316 -> 10 | K316: 4 | L316: 5 | M316: =K316*6+L316 -> 29 | O316: 8 | P316: 10 | Q316: =O316*6+P316 -> 58 | S316: SMYTH
A317: BEST PLAYERS
A318: YARRAVILLE | C318: SEITZ | F318: BODSWORTH | I318: HARGREAVES | L318: MASON | O318: MURPHY | R318: MITCHELL
A319: BRIGHTON | C319: BLACKMORE | F319: PERKINS | I319: PLUNKETT | L319: R EMBLETON | O319: G TURNER | R319: RIDDELL
A320: GOALKICKERS
A321: YARRAVILLE | C321: SEITZ 4 | E321: BODSWORTH 3 | H321: MASON 3 | J321: HARGREAVES 3 | N321: PHILLIPS | P321: M McBEAN | S321: ELDRIDGE
A322: BRIGHTON | C322: G TURNER 3 | F322: LE GRIFFIN 2 | I322: R EMBLETON | L322: ALEXANDER | O322: COURTNEY
A324: BRUNSWICK | C324: 4 | D324: 7 | E324: =C324*6+D324 -> 31 | G324: 8 | H324: 8 | I324: =G324*6+H324 -> 56 | K324: 11 | L324: 10 | M324: =K324*6+L324 -> 76 | O324: 13 | P324: 16 | Q324: =O324*6+P324 -> 94 | S324: BRUNSWICK
A325: PRESTON | C325: 4 | D325: 0 | E325: =C325*6+D325 -> 24 | G325: 7 | H325: 1 | I325: =G325*6+H325 -> 43 | K325: 8 | L325: 3 | M325: =K325*6+L325 -> 51 | O325: 11 | P325: 6 | Q325: =O325*6+P325 -> 72 | S325: ROACH
A326: BEST PLAYERS
A327: BRUNSWICK | C327: SEYMOUR | F327: WEIR | I327: ROLFS | L327: NEILSON | O327: POLLARD | R327: STANLEY
A328: PRESTON | C328: BRADFORD | F328: HENRYS | I328: DEACON | L328: NATHAN | O328: FOLEY | R328: PRITCHARD
A329: GOALKICKERS
A330: BRUNSWICK | C330: STANLEY 4 | F330: SEYMOUR 3 | I330: WEIR 2 | K330: DUNSTAN 2 | N330: ARMSTRONG | Q330: WHEELER
A331: PRESTON | C331: LALOR 3 | F331: BRADFORD 3 | I331: HARVEY 3 | L331: FOLEY | N331: HARRISON
A333: ROUND 6 | E333: 24TH MAY | I333: WEATHER | L333: NO WIND FINE GROUNDS HEAVY | S333: PLAYED AT
D334: 1ST QTR | H334: 2ND QTR | L334: 3RD QTR | P334: FINAL | S334: CAMBERWELL
A335: CAMBERWELL | C335: 5 | D335: 4 | E335: =C335*6+D335 -> 34 | G335: 9 | H335: 5 | I335: =G335*6+H335 -> 59 | K335: 12 | L335: 7 | M335: =K335*6+L335 -> 79 | O335: 16 | P335: 8 | Q335: =O335*6+P335 -> 104 | S335: UMPIRE | X335: LADDER | AB335: ROUND | AD335: 6
A336: PRAHRAN | C336: 2 | D336: 1 | E336: =C336*6+D336 -> 13 | G336: 3 | H336: 4 | I336: =G336*6+H336 -> 22 | K336: 8 | L336: 9 | M336: =K336*6+L336 -> 57 | O336: 10 | P336: 14 | Q336: =O336*6+P336 -> 74 | S336: SMYTH
A337: BEST PLAYERS | W337: TEAM | X337: W | Y337: L | Z337: D | AA337: FOR | AB337: AGST | AC337: % | AD337: PTS
A338: CAMBERWELL | C338: MCFEE | E338: J BOHAN | H338: MARIAN | K338: LITTLE | N338: BRADLEY | Q338: DUNNACHIE
A339: PRAHRAN | C339: KRUSE | E339: HARVEY | H339: MORROW | K339: GRAMBEAU | N339: OVERS | Q339: SHILLABEER | W339: PORT MELBOURNE | X339: 6 | Y339: 0 | Z339: 0 | AA339: 570 | AB339: 376 | AC339: 151.59574468085106 | AD339: 24
A340: GOALKICKERS | W340: BRUNSWICK | X340: 5 | Y340: 1 | Z340: 0 | AA340: 440 | AB340: 308 | AC340: 143.18181818181819 | AD340: 20
A341: CAMBERWELL | C341: McFEE 6 | E341: MARIAN 3 | H341: LITTLE 3 | J341: HAYES | L341: BENBOW | N341: ROSENBROCK | Q341: HEDLEY | W341: YARRAVILLE | X341: 5 | Y341: 1 | Z341: 0 | AA341: 503 | AB341: 444 | AC341: 113.28828828828829 | AD341: 20
A342: PRAHRAN | C342: SHILLABEER 2 | F342: HARVEY 2 | I342: COURTNEY 2 | L342: MORROW | N342: CONNINGSBY | Q342: McCULLOCH | T342: BEATON | W342: OAKLEIGH | X342: 4 | Y342: 2 | Z342: 0 | AA342: 491 | AB342: 323 | AC342: 151.54320987654322 | AD342: 16
A344: YARRAVILLE | C344: 1 | D344: 6 | E344: =C344*6+D344 -> 12 | G344: 6 | H344: 9 | I344: =G344*6+H344 -> 45 | K344: 9 | L344: 12 | M344: =K344*6+L344 -> 66 | O344: 12 | P344: 21 | Q344: =O344*6+P344 -> 93 | S344: MOORABBIN | W344: PRAHRAN | X344: 4 | Y344: 2 | Z344: 0 | AA344: 538 | AB344: 471 | AC344: 114.22505307855626 | AD344: 16
A345: MOORABBIN | C345: 3 | D345: 0 | E345: =C345*6+D345 -> 18 | G345: 7 | H345: 1 | I345: =G345*6+H345 -> 43 | K345: 9 | L345: 7 | M345: =K345*6+L345 -> 61 | O345: 13 | P345: 10 | Q345: =O345*6+P345 -> 88 | S345: CLEARY | W345: CAMBERWELL | X345: 4 | Y345: 2 | Z345: 0 | AA345: 452 | AB345: 463 | AC345: 97.624190064794817 | AD345: 16
A346: BEST PLAYERS | W346: COBURG | X346: 3 | Y346: 3 | Z346: 0 | AA346: 501 | AB346: 463 | AC346: 108.207343412527 | AD346: 12
A347: YARRAVILLE | C347: ROHLEDER | F347: SEITZ | I347: BODSWORTH | L347: S JONES | N347: PHILLIPS | Q347: R McBEAN | W347: MOORABBIN | X347: 3 | Y347: 3 | Z347: 0 | AA347: 426 | AB347: 480 | AC347: 88.75 | AD347: 12
A348: MOORABBIN | C348: COPSEY | F348: STANLEY | I348: DUNSCOMBE | L348: BROWN | N348: GILDER | Q348: ANTONIE | W348: NORTHCOTE | X348: 2 | Y348: 4 | Z348: 0 | AA348: 406 | AB348: 419 | AC348: 96.897374701670643 | AD348: 8
A349: GOALKICKERS | S349: SEITZ | W349: SANDRINGHAM | X349: 2 | Y349: 4 | Z349: 0 | AA349: 404 | AB349: 455 | AC349: 88.791208791208788 | AD349: 8
A350: YARRAVILLE | C350: BODSWORTH 2 | F350: PHILLIPS 2 | I350: HARGREAVES 2 | L350: R McBEAN 2 | O350: MASON | Q350: ROHLEDER | T350: SALT | W350: PRESTON | X350: 2 | Y350: 4 | Z350: 0 | AA350: 510 | AB350: 575 | AC350: 88.695652173913047 | AD350: 8
A351: MOORABBIN | C351: BROWN 6 | F351: McKENZIE 2 | I351: JONES 2 | K351: BOYD | M351: DUNSCOMBE | P351: MURNANE | W351: WILLIAMSTOWN | X351: 1 | Y351: 5 | Z351: 0 | AA351: 479 | AB351: 544 | AC351: 88.05147058823529 | AD351: 4
W352: BOX HILL | X352: 1 | Y352: 5 | Z352: 0 | AA352: 425 | AB352: 609 | AC352: 69.786535303776688 | AD352: 4
A353: COBURG | C353: 2 | D353: 6 | E353: =C353*6+D353 -> 18 | G353: 6 | H353: 8 | I353: =G353*6+H353 -> 44 | K353: 8 | L353: 10 | M353: =K353*6+L353 -> 58 | O353: 12 | P353: 16 | Q353: =O353*6+P353 -> 88 | S353: COBURG | W353: BRIGHTON | X353: 0 | Y353: 6 | Z353: 0 | AA353: 397 | AB353: 612 | AC353: 64.869281045751634 | AD353: 0
A354: SANDRINGHAM | C354: 2 | D354: 2 | E354: =C354*6+D354 -> 14 | G354: 4 | H354: 5 | I354: =G354*6+H354 -> 29 | K354: 7 | L354: 10 | M354: =K354*6+L354 -> 52 | O354: 7 | P354: 11 | Q354: =O354*6+P354 -> 53 | S354: MERRINGTON
A355: BEST PLAYERS
A356: COBURG | C356: EVANS | F356: STARBUCK | I356: WALKER | L356: R WILKINSON | O356: LONDON | R356: JAMES
A357: SANDRINGHAM | C357: RUSSO | F357: ANDRESON | I357: MILLER | L357: SCANLON | O357: TREVERTON | R357: G JONES
A358: GOALKICKERS
A359: COBURG | C359: JAMES 5 | F359: EVANS 2 | I359: R WILKINSON 2 | M359: CANNING | O359: McTAGGART | R359: ROGAN
A360: SANDRINGHAM | C360: B HARPER 4 | F360: FLEMING | I360: RUSSELL | K360: G JONES
A362: PRESTON | C362: 4 | D362: 1 | E362: =C362*6+D362 -> 25 | G362: 8 | H362: 1 | I362: =G362*6+H362 -> 49 | K362: 10 | L362: 4 | M362: =K362*6+L362 -> 64 | O362: 13 | P362: 7 | Q362: =O362*6+P362 -> 85 | S362: PRESTON
A363: NORTHCOTE | C363: 3 | D363: 3 | E363: =C363*6+D363 -> 21 | G363: 6 | H363: 6 | I363: =G363*6+H363 -> 42 | K363: 7 | L363: 9 | M363: =K363*6+L363 -> 51 | O363: 10 | P363: 11 | Q363: =O363*6+P363 -> 71 | S363: IRVING
A364: BEST PLAYERS
A365: PRESTON | C365: LALOR | F365: BRADFORD | I365: HARVEY | L365: BEST | O365: F CHARD | R365: HARRISON
A366: NORTHCOTE | C366: McGREGOR | F366: HISCOX | I366: DUNGAN | L366: PAWSEY | O366: COLLINS | R366: POWELL
A367: GOALKICKERS
A368: PRESTON | C368: LALOR 5 | F368: GOLDIN 2 | I368: F CHARD 2 | L368: HARVEY 2 | O368: HAYES | Q368: FOLEY
A369: NORTHCOTE | C369: DUNGAN 3 | F369: PAWSEY 2 | I369: PURDON 2 | L369: KNOWLES | O369: BUCKLEY | Q369: COLLINS
A371: OAKLEIGH | C371: 0 | D371: 2 | E371: =C371*6+D371 -> 2 | G371: 3 | H371: 7 | I371: =G371*6+H371 -> 25 | K371: 4 | L371: 12 | M371: =K371*6+L371 -> 36 | O371: 8 | P371: 21 | Q371: =O371*6+P371 -> 69 | S371: WILLIAMSTOWN
A372: WILLIAMSTOWN | C372: 2 | D372: 5 | E372: =C372*6+D372 -> 17 | G372: 5 | H372: 6 | I372: =G372*6+H372 -> 36 | K372: 7 | L372: 10 | M372: =K372*6+L372 -> 52 | O372: 8 | P372: 10 | Q372: =O372*6+P372 -> 58 | S372: MILNE
A373: BEST PLAYERS
A374: OAKLEIGH | C374: STREETER | F374: SCOTT | I374: H WILLIAMS | L374: TEMME | O374: SAVORY | R374: RICKERT
A375: WILLIAMSTOWN | C375: G WILLIAMS | F375: ROGERS | I375: CALLAHAN | L375: MUNDAY | O375: MOLYNEUX | R375: W WILLIAMS
A376: GOALKICKERS
A377: OAKLEIGH | C377: STREETER 4 | F377: RICKERT 2 | I377: CADMAN | L377: SAVORY
A378: WILLIAMSTOWN | C378: WALKER 3 | F378: W WILLIAMS 3 | J378: G WILLIAMS | M378: DULLARD
A380: BRUNSWICK | C380: 6 | D380: 4 | E380: =C380*6+D380 -> 40 | G380: 7 | H380: 6 | I380: =G380*6+H380 -> 48 | K380: 10 | L380: 13 | M380: =K380*6+L380 -> 73 | O380: 12 | P380: 17 | Q380: =O380*6+P380 -> 89 | S380: ELSTERNWICK PARK
A381: BRIGHTON | C381: 0 | D381: 0 | E381: =C381*6+D381 -> 0 | G381: 6 | H381: 2 | I381: =G381*6+H381 -> 38 | K381: 7 | L381: 6 | M381: =K381*6+L381 -> 48 | O381: 10 | P381: 7 | Q381: =O381*6+P381 -> 67 | S381: BAGULEY
A382: BEST PLAYERS
A383: BRUNSWICK | C383: SEYMOUR | F383: YEA | I383: ROLFS | L383: J RYAN | O383: ARMSTRONG | R383: NEILSON
A384: BRIGHTON | C384: FREEMAN | F384: PERKINS | I384: PLUNKETT | L384: ALEXANDER | O384: HOWE | R384: CONROY
A385: GOALKICKERS
A386: BRUNSWICK | C386: J RYAN 4 | F386: STANLEY 3 | I386: R RYAN 3 | L386: ARMSTRONG | O386: MULLENGER
A387: BRIGHTON | C387: HARDY 3 | F387: HOWE 2 | I387: ALEXANDER | L387: PERKINS | N387: PICKERING | Q387: COURTNEY | T387: BURKE
A389: PORT MELBOURNE | C389: 6 | D389: 4 | E389: =C389*6+D389 -> 40 | G389: 11 | H389: 7 | I389: =G389*6+H389 -> 73 | K389: 18 | L389: 13 | M389: =K389*6+L389 -> 121 | O389: 22 | P389: 16 | Q389: =O389*6+P389 -> 148 | S389: PORT MELBOURNE
A390: BOX HILL | C390: 4 | D390: 4 | E390: =C390*6+D390 -> 28 | G390: 6 | H390: 6 | I390: =G390*6+H390 -> 42 | K390: 9 | L390: 10 | M390: =K390*6+L390 -> 64 | O390: 11 | P390: 13 | Q390: =O390*6+P390 -> 79 | S390: RICHARDSON
A391: BEST PLAYERS
A392: PORT MELBOURNE | C392: BONNETT | F392: A MILLER | I392: CROFT | L392: B MILLER | N392: WILSON | Q392: WALSH
A393: BOX HILL | C393: MORRIS | F393: GARDINER | I393: COGHLAN | L393: KRONK | N393: HAMMOND | Q393: WEBB
A394: GOALKICKERS
A395: PORT MELBOURNE | C395: BONNETT 8 | F395: A MILLER 5 | I395: B MILLER 3 | L395: BOWER 2 | N395: STOCKER 2 | Q395: HOULIHAN | T395: MURRAY
A396: BOX HILL | C396: O'ROURKE 3 | F396: MORRIS 3 | I396: WEBB 2 | K396: GARDINER | M396: COGHLAN | O396: MAIDMENT
A398: ROUND 7 | E398: 31ST MAY | J398: WEATHER | M398: SOUTH WEST WIND RAIN | S398: PLAYED AT
D399: 1ST QTR | H399: 2ND QTR | L399: 3RD QTR | P399: FINAL | S399: TOORAK PARK
A400: PORT MELBOURNE | C400: 0 | D400: 7 | E400: =C400*6+D400 -> 7 | G400: 1 | H400: 9 | I400: =G400*6+H400 -> 15 | K400: 6 | L400: 12 | M400: =K400*6+L400 -> 48 | O400: 10 | P400: 17 | Q400: =O400*6+P400 -> 77 | S400: UMPIRE | X400: LADDER | AB400: ROUND | AD400: 7
A401: PRAHRAN | C401: 1 | D401: 4 | E401: =C401*6+D401 -> 10 | G401: 4 | H401: 7 | I401: =G401*6+H401 -> 31 | K401: 6 | L401: 8 | M401: =K401*6+L401 -> 44 | O401: 8 | P401: 12 | Q401: =O401*6+P401 -> 60 | S401: BOWDEN
A402: BEST PLAYERS | W402: TEAM | X402: W | Y402: L | Z402: D | AA402: FOR | AB402: AGST | AC402: % | AD402: PTS
A403: PORT MELBOURNE | C403: HOULIHAN | F403: STOREY | I403: WILSON | L403: B MILLER | O403: A MILLER | R403: CARIS
A404: PRAHRAN | C404: KRUSE | F404: YATES | I404: HARVEY | L404: SHILLABEER | O404: McCULLOCH | R404: CONNINGSBY | W404: PORT MELBOURNE | X404: 7 | Y404: 0 | Z404: 0 | AA404: 647 | AB404: 436 | AC404: 148.39449541284404 | AD404: 28
A405: GOALKICKERS | W405: YARRAVILLE | X405: 6 | Y405: 1 | Z405: 0 | AA405: 555 | AB405: 481 | AC405: 115.38461538461539 | AD405: 24
A406: PORT MELBOURNE | C406: BONNETT 3 | F406: B MILLER 2 | I406: WALSH 2 | K406: A MILLER | M406: HOULIHAN | P406: BOWER | W406: BRUNSWICK | X406: 5 | Y406: 2 | Z406: 0 | AA406: 585 | AB406: 382 | AC406: 132.4607329842932 | AD406: 20
A407: PRAHRAN | C407: HARVEY 4 | F407: KRUSE | H407: McCULLOCH | K407: SHILLABEER | N407: CONNINGSBY | W407: OAKLEIGH | X407: 4 | Y407: 3 | Z407: 0 | AA407: 563 | AB407: 433 | AC407: 129.72350230414747 | AD407: 16
A409: YARRAVILLE | C409: 0 | D409: 0 | E409: =C409*6+D409 -> 0 | G409: 2 | H409: 5 | I409: =G409*6+H409 -> 17 | K409: 5 | L409: 7 | M409: =K409*6+L409 -> 37 | O409: 7 | P409: 9 | Q409: =O409*6+P409 -> 51 | S409: YARRAVILLE | W409: COBURG | X409: 4 | Y409: 3 | Z409: 0 | AA409: 611 | AB409: 535 | AC409: 114.20560747663552 | AD409: 16
A410: CAMBERWELL | C410: 1 | D410: 5 | E410: =C410*6+D410 -> 11 | G410: 3 | H410: 6 | I410: =G410*6+H410 -> 24 | K410: 4 | L410: 10 | M410: =K410*6+L410 -> 34 | O410: 4 | P410: 13 | Q410: =O410*6+P410 -> 37 | S410: IRVING | W410: PRAHRAN | X410: 4 | Y410: 3 | Z410: 0 | AA410: 598 | AB410: 548 | AC410: 109.12408759124088 | AD410: 16
A411: BEST PLAYERS | W411: CAMBERWELL | X411: 4 | Y411: 3 | Z411: 0 | AA411: 489 | AB411: 515 | AC411: 94.951456310679617 | AD411: 16
A412: YARRAVILLE | C412: ROHLEDER | F412: BODSWORTH | I412: JONES | K412: McCANN | N412: CRANAGE | Q412: COOK | W412: MOORABBIN | X412: 4 | Y412: 3 | Z412: 0 | AA412: 500 | AB412: 545 | AC412: 91.743119266055047 | AD412: 16
A413: CAMBERWELL | C413: ROSENBROCK | F413: BOHAN | I413: ALLEN | K413: MARIAN | N413: HAYES | Q413: BRADLEY | W413: PRESTON | X413: 3 | Y413: 4 | Z413: 0 | AA413: 623 | AB413: 617 | AC413: 100.97244732576985 | AD413: 12
A414: GOALKICKERS | W414: SANDRINGHAM | X414: 3 | Y414: 4 | Z414: 0 | AA414: 498 | AB414: 519 | AC414: 95.95375722543352 | AD414: 12
A415: YARRAVILLE | C415: BODSWORTH 2 | F415: ROHLEDER | I415: MITCHELL | L415: PHILLIPS | N415: SEITZ | P415: SALT | W415: NORTHCOTE | X415: 2 | Y415: 5 | Z415: 0 | AA415: 470 | AB415: 513 | AC415: 91.617933723196884 | AD415: 8
A416: CAMBERWELL | C416: HEDLEY | F416: MARIAN | I416: ROSENBROCK | L416: LITTLE | W416: BOX HILL | X416: 2 | Y416: 5 | Z416: 0 | AA416: 496 | AB416: 668 | AC416: 74.251497005988028 | AD416: 8
W417: WILLIAMSTOWN | X417: 1 | Y417: 6 | Z417: 0 | AA417: 538 | AB417: 615 | AC417: 87.479674796747972 | AD417: 4
A418: COBURG | C418: 7 | D418: 6 | E418: =C418*6+D418 -> 48 | G418: 8 | H418: 8 | I418: =G418*6+H418 -> 56 | K418: 11 | L418: 13 | M418: =K418*6+L418 -> 79 | O418: 16 | P418: 14 | Q418: =O418*6+P418 -> 110 | S418: OAKLEIGH | W418: BRIGHTON | X418: 0 | Y418: 7 | Z418: 0 | AA418: 439 | AB418: 725 | AC418: 60.551724137931032 | AD418: 0
A419: OAKLEIGH | C419: 2 | D419: 0 | E419: =C419*6+D419 -> 12 | G419: 7 | H419: 6 | I419: =G419*6+H419 -> 48 | K419: 7 | L419: 7 | M419: =K419*6+L419 -> 49 | O419: 10 | P419: 12 | Q419: =O419*6+P419 -> 72 | S419: BAGULEY
A420: BEST PLAYERS
A421: COBURG | C421: JAMES | F421: H WILKINSON | I421: R WILKINSON | L421: ROGAN | N421: GILBERT | Q421: EQUID
A422: OAKLEIGH | C422: LAMBERT | F422: SCOTT | I422: STREETER | L422: VAINS | N422: GUY | Q422: HOWELL
A423: GOALKICKERS
A424: COBURG | C424: JAMES 7 | F424: H WILKINSON 3 | J424: R WILKINSON 3 | N424: EQUID | P424: ROGAN | R424: EVANS
A425: OAKLEIGH | C425: SCOTT 4 | F425: STREETER 2 | I425: J WATSON 2 | L425: YOUNG | N425: RICKERT
A427: MOORABBIN | C427: 2 | D427: 6 | E427: =C427*6+D427 -> 18 | G427: 4 | H427: 7 | I427: =G427*6+H427 -> 31 | K427: 8 | L427: 14 | M427: =K427*6+L427 -> 62 | O427: 10 | P427: 14 | Q427: =O427*6+P427 -> 74 | S427: BRUNSWICK
A428: BRUNSWICK | C428: 0 | D428: 0 | E428: =C428*6+D428 -> 0 | G428: 5 | H428: 2 | I428: =G428*6+H428 -> 32 | K428: 5 | L428: 3 | M428: =K428*6+L428 -> 33 | O428: 9 | P428: 11 | Q428: =O428*6+P428 -> 65 | S428: MERRINGTON
A429: BEST PLAYERS
A430: MOORABBIN | C430: McKENZIE | F430: DUNSCOMBE | I430: GILDER | L430: D'OLIVER | O430: GOODES | Q430: JONES
A431: BRUNSWICK | C431: WEIR | F431: POLLARD | I431: NEILSON | L431: SEYMOUR | O431: ROLFS | Q431: STANLEY
A432: GOALKICKERS
A433: MOORABBIN | C433: BROWN 3 | F433: DICKENSON 2 | I433: SUTHERLAND | L433: JAMES | N433: McKENZIE | Q433: JONES | S433: BOYD
A434: BRUNSWICK | C434: WEIR 2 | F434: WHEELER 2 | I434: J RYAN 2 | K434: WALSH 2 | M434: STANLEY
A436: SANDRINGHAM | C436: 4 | D436: 5 | E436: =C436*6+D436 -> 29 | G436: 5 | H436: 7 | I436: =G436*6+H436 -> 37 | K436: 7 | L436: 8 | M436: =K436*6+L436 -> 50 | O436: 14 | P436: 10 | Q436: =O436*6+P436 -> 94 | S436: BEACH ROAD
A437: NORTHCOTE | C437: 1 | D437: 3 | E437: =C437*6+D437 -> 9 | G437: 5 | H437: 5 | I437: =G437*6+H437 -> 35 | K437: 8 | L437: 8 | M437: =K437*6+L437 -> 56 | O437: 9 | P437: 10 | Q437: =O437*6+P437 -> 64 | S437: RICHARDSON
A438: BEST PLAYERS
A439: SANDRINGHAM | C439: SCANLAN | F439: POTTER | I439: GUTTERIDGE | L439: B HARPER | O439: SHEARS | Q439: RUSSELL
A440: NORTHCOTE | C440: VAINS | F440: DEANS | I440: PAYNTER | L440: WOOLNOUGH | O440: HINES | Q440: PURDON
A441: GOALKICKERS
A442: SANDRINGHAM | C442: B HARPER 6 | F442: POTTER 4 | I442: FLEMING 2 | L442: WALKER | N442: WRIGHT-SMITH
A443: NORTHCOTE | C443: PURDEN 2 | F443: PAYNTER 2 | I443: DEANS 2 | K443: McGREGOR | M443: DUNGAN | O443: E WHITE
A445: BOX HILL | C445: 4 | D445: 3 | E445: =C445*6+D445 -> 27 | G445: 5 | H445: 6 | I445: =G445*6+H445 -> 36 | K445: 7 | L445: 6 | M445: =K445*6+L445 -> 48 | O445: 10 | P445: 11 | Q445: =O445*6+P445 -> 71 | S445: BOX HILL
A446: WILLIAMSTOWN | C446: 4 | D446: 2 | E446: =C446*6+D446 -> 26 | G446: 6 | H446: 4 | I446: =G446*6+H446 -> 40 | K446: 7 | L446: 9 | M446: =K446*6+L446 -> 51 | O446: 8 | P446: 11 | Q446: =O446*6+P446 -> 59 | S446: SMYTH
A447: BEST PLAYERS
A448: BOX HILL | C448: IRVINE | F448: PARKS | I448: HEALY | L448: GARDINER | O448: O'ROURKE | R448: WEBB
A449: WILLIAMSTOWN | C449: G WILLIAMS | F449: DULLARD | I449: MUNDAY | L449: ALLANSON | O449: ROGERS | R449: POOLE
A450: GOALKICKERS
A451: BOX HILL | C451: MORRIS 3 | F451: COGHLAN 2 | I451: KRONK | K451: MAIDMENT | N451: WEBB | P451: GARDINER | R451: O'ROURKE
A452: WILLIAMSTOWN | C452: G WILLIAMS 3 | F452: WALKER 2 | I452: J SIMPSON | L452: DULLARD | N452: MOLYNEUX
A454: PRESTON | C454: 3 | D454: 3 | E454: =C454*6+D454 -> 21 | G454: 8 | H454: 7 | I454: =G454*6+H454 -> 55 | K454: 11 | L454: 15 | M454: =K454*6+L454 -> 81 | O454: 16 | P454: 17 | Q454: =O454*6+P454 -> 113 | S454: PRESTON
A455: BRIGHTON | C455: 2 | D455: 3 | E455: =C455*6+D455 -> 15 | G455: 3 | H455: 4 | I455: =G455*6+H455 -> 22 | K455: 4 | L455: 8 | M455: =K455*6+L455 -> 32 | O455: 5 | P455: 12 | Q455: =O455*6+P455 -> 42 | S455: CLEARY
A456: BEST PLAYERS
A457: PRESTON | C457: BRADFORD | F457: LALOR | I457: FOLEY | L457: HARVEY | N457: HARRISON | Q457: JEFFREY
A458: BRIGHTON | C458: FREEMAN | F458: HOWE | I458: BLACKMORE | L458: PLUNKETT | N458: PICKERING | Q458: HARDY
A459: GOALKICKERS
A460: PRESTON | C460: LALOR 4 | F460: BRADFORD 3 | I460: F CHARD 3 | L460: HARVEY 3 | N460: JEFFREY 2 | Q460: BATEMAN
A461: BRIGHTON | C461: HARDY 3 | F461: COURTNEY | I461: HOWE
A463: ROUND 8 | E463: 7TH JUNE | J463: WEATHER | M463: FINE GROUNDS HEAVY | S463: PLAYED AT
D464: 1ST QTR | H464: 2ND QTR | L464: 3RD QTR | P464: FINAL | S464: PORT MELBOURNE
A465: PORT MELBOURNE | C465: 3 | D465: 2 | E465: =C465*6+D465 -> 20 | G465: 9 | H465: 6 | I465: =G465*6+H465 -> 60 | K465: 11 | L465: 8 | M465: =K465*6+L465 -> 74 | O465: 21 | P465: 13 | Q465: =O465*6+P465 -> 139 | S465: UMPIRE | X465: LADDER | AB465: ROUND | AD465: 8
A466: YARRAVILLE | C466: 5 | D466: 4 | E466: =C466*6+D466 -> 34 | G466: 7 | H466: 5 | I466: =G466*6+H466 -> 47 | K466: 8 | L466: 10 | M466: =K466*6+L466 -> 58 | O466: 9 | P466: 12 | Q466: =O466*6+P466 -> 66 | S466: SMYTH
A467: BEST PLAYERS | W467: TEAM | X467: W | Y467: L | Z467: D | AA467: FOR | AB467: AGST | AC467: % | AD467: PTS
A468: PORT MELBOURNE | C468: STOREY | E468: JOHNSON | H468: KELSEY | K468: WALSH | N468: WHARTON | Q468: B MILLER
A469: YARRAVILLE | C469: JONES | E469: WAGHORNE | H469: MITCHELL | K469: BODSWORTH | N469: NICHOLLS | Q469: PHILLIPS | W469: PORT MELBOURNE | X469: 8 | Y469: 0 | Z469: 0 | AA469: 786 | AB469: 502 | AC469: 156.57370517928288 | AD469: 32
A470: GOALKICKERS | P470: H TUCKER | R470: JOHNSON | W470: BRUNSWICK | X470: 6 | Y470: 2 | Z470: 0 | AA470: 575 | AB470: 430 | AC470: 133.95348837209303 | AD470: 24
A471: PORT MELBOURNE | C471: BONNETT 6 | F471: OWENS 3 | H471: WALSH 3 | J471: McDONALD 3 | M471: B MILLER 2 | P471: MURRAY | R471: STOREY | W471: YARRAVILLE | X471: 6 | Y471: 2 | Z471: 0 | AA471: 621 | AB471: 620 | AC471: 100.16129032258064 | AD471: 24
A472: YARRAVILLE | C472: WAGHORNE 6 | F472: PHILLIPS 2 | I472: COOK | W472: OAKLEIGH | X472: 5 | Y472: 3 | Z472: 0 | AA472: 645 | AB472: 480 | AC472: 134.0956340956341 | AD472: 20
A474: SANDRINGHAM | C474: 2 | D474: 6 | E474: =C474*6+D474 -> 18 | G474: 6 | H474: 8 | I474: =G474*6+H474 -> 44 | K474: 10 | L474: 10 | M474: =K474*6+L474 -> 70 | O474: 16 | P474: 12 | Q474: =O474*6+P474 -> 108 | S474: BEACH ROAD | W474: COBURG | X474: 5 | Y474: 3 | Z474: 0 | AA474: 753 | AB474: 595 | AC474: 126.5546218487395 | AD474: 20
A475: PRESTON | C475: 2 | D475: 1 | E475: =C475*6+D475 -> 13 | G475: 6 | H475: 3 | I475: =G475*6+H475 -> 39 | K475: 8 | L475: 6 | M475: =K475*6+L475 -> 54 | O475: 10 | P475: 9 | Q475: =O475*6+P475 -> 69 | S475: BAGULEY | W475: MOORABBIN | X475: 5 | Y475: 3 | Z475: 0 | AA475: 591 | AB475: 579 | AC475: 102.07253886010362 | AD475: 20
A476: BEST PLAYERS | W476: PRAHRAN | X476: 4 | Y476: 4 | Z476: 0 | AA476: 647 | AB476: 625 | AC476: 103.52 | AD476: 16
A477: SANDRINGHAM | C477: BOURKE | F477: B HARPER | I477: GUILLE | L477: RUSSO | N477: BENCRAFT | Q477: RUSSELL | W477: SANDRINGHAM | X477: 4 | Y477: 4 | Z477: 0 | AA477: 606 | AB477: 588 | AC477: 103.06122448979592 | AD477: 16
A478: PRESTON | C478: F CHARD | F478: BRADFORD | I478: HAYES | L478: PRITCHARD | O478: DEACON | Q478: K CHARD | W478: CAMBERWELL | X478: 4 | Y478: 4 | Z478: 0 | AA478: 537 | AB478: 585 | AC478: 91.794871794871796 | AD478: 16
A479: GOALKICKERS | W479: PRESTON | X479: 3 | Y479: 5 | Z479: 0 | AA479: 692 | AB479: 725 | AC479: 95.448275862068968 | AD479: 12
A480: SANDRINGHAM | C480: B HARPER 6 | F480: BOURKE 4 | I480: HISCOCK 2 | L480: POTTER 2 | N480: WALKER 2 | W480: WILLIAMSTOWN | X480: 2 | Y480: 6 | Z480: 0 | AA480: 615 | AB480: 664 | AC480: 92.620481927710841 | AD480: 8
A481: PRESTON | C481: F CHARD 3 | F481: K CHARD 2 | I481: BRADFORD 2 | L481: CROCKER | N481: LALOR | P481: HAYES | W481: NORTHCOTE | X481: 2 | Y481: 6 | Z481: 0 | AA481: 517 | AB481: 595 | AC481: 86.890756302521012 | AD481: 8
W482: BOX HILL | X482: 2 | Y482: 6 | Z482: 0 | AA482: 556 | AB482: 810 | AC482: 68.641975308641975 | AD482: 8
A483: COBURG | C483: 4 | D483: 4 | E483: =C483*6+D483 -> 28 | G483: 10 | H483: 10 | I483: =G483*6+H483 -> 70 | K483: 13 | L483: 14 | M483: =K483*6+L483 -> 92 | O483: 21 | P483: 16 | Q483: =O483*6+P483 -> 142 | S483: COBURG | W483: BRIGHTON | X483: 0 | Y483: 8 | Z483: 0 | AA483: 473 | AB483: 816 | AC483: 57.965686274509807 | AD483: 0
A484: BOX HILL | C484: 3 | D484: 1 | E484: =C484*6+D484 -> 19 | G484: 4 | H484: 3 | I484: =G484*6+H484 -> 27 | K484: 8 | L484: 6 | M484: =K484*6+L484 -> 54 | O484: 9 | P484: 6 | Q484: =O484*6+P484 -> 60 | S484: CLEARY
A485: BEST PLAYERS
A486: COBURG | C486: McDONALD | F486: CANNING | I486: MAHONEY | L486: H WILKINSON | O486: ROGAN | Q486: McTAGGART
A487: BOX HILL | C487: WILLIAMS | F487: GREEN | I487: COGHLAN | L487: O'NEILL | O487: MORRIS | Q487: KRONK
A488: GOALKICKERS
A489: COBURG | C489: McTAGGART 4 | F489: McDONALD 4 | I489: ROGAN 3 | K489: H WILKINSON 3 | N489: R WILKINSON 2 | R489: JAMES 2 | U489: JONES 2 | X489: CANNING
A490: BOX HILL | C490: COGHLAN 3 | F490: WILLIAMS 3 | I490: MORRIS | K490: O'NEILL | M490: THOMPSON
A492: WILLIAMSTOWN | C492: 0 | D492: 1 | E492: =C492*6+D492 -> 1 | G492: 5 | H492: 9 | I492: =G492*6+H492 -> 39 | K492: 6 | L492: 9 | M492: =K492*6+L492 -> 45 | O492: 11 | P492: 11 | Q492: =O492*6+P492 -> 77 | S492: WILLIAMSTOWN
A493: PRAHRAN | C493: 3 | D493: 5 | E493: =C493*6+D493 -> 23 | G493: 4 | H493: 6 | I493: =G493*6+H493 -> 30 | K493: 6 | L493: 13 | M493: =K493*6+L493 -> 49 | O493: 6 | P493: 13 | Q493: =O493*6+P493 -> 49 | S493: IRVING
A494: BEST PLAYERS
A495: WILLIAMSTOWN | C495: CALLAHAN | F495: W WILLIAMS | I495: ROGERS | L495: DULLARD | O495: TOZER | Q495: MOLYNEUX
A496: PRAHRAN | C496: BUTLING | F496: SHILLABEER | I496: PLAIN | L496: HARVEY | O496: OVERS | Q496: KINNIBURGH
A497: GOALKICKERS
A498: WILLIAMSTOWN | C498: WALKER 3 | F498: W WILLIAMS 3 | J498: MOLYNEUX 2 | M498: DULLARD | O498: TOZER | Q498: POOLE
A499: PRAHRAN | C499: McCULLOCH 2 | F499: KINNIBURGH | I499: CONNINGSBY | L499: PLAIN | N499: MORROW
E500: 9TH JUNE | J500: QUEENS BIRTDAY | Q500: WEATHER | U500: SOUTH WEST BREEZE
A501: BRUNSWICK | C501: 3 | D501: 2 | E501: =C501*6+D501 -> 20 | G501: 6 | H501: 4 | I501: =G501*6+H501 -> 40 | K501: 8 | L501: 6 | M501: =K501*6+L501 -> 54 | O501: 10 | P501: 10 | Q501: =O501*6+P501 -> 70 | S501: CAMBERWELL
A502: CAMBERWELL | C502: 1 | D502: 2 | E502: =C502*6+D502 -> 8 | G502: 3 | H502: 4 | I502: =G502*6+H502 -> 22 | K502: 3 | L502: 5 | M502: =K502*6+L502 -> 23 | O502: 7 | P502: 6 | Q502: =O502*6+P502 -> 48 | S502: RICHARDSON
A503: BEST PLAYERS | S503: NORTHCOTE
A504: BRUNSWICK | C504: SEYMOUR | F504: WALSH | I504: POLLARD | L504: MUNRO | N504: TAYLOR | Q504: CLUES
A505: CAMBERWELL | C505: CALLAHAN | F505: BOHAN | I505: BRADLEY | L505: HEDLEY | N505: BEDFORD | Q505: ALLAN
A506: GOALKICKERS
A507: BRUNSWICK | C507: WALSH 2 | F507: CLUES 2 | I507: STANLEY 2 | L507: MAHER 2 | N507: THORNTON | Q507: MAY
A508: CAMBERWELL | C508: BRADLEY 3 | F508: McFEE 2 | I508: HEDLEY | K508: DUFF
A510: OAKLEIGH | C510: 6 | D510: 8 | E510: =C510*6+D510 -> 44 | G510: 6 | H510: 8 | I510: =G510*6+H510 -> 44 | K510: 9 | L510: 15 | M510: =K510*6+L510 -> 69 | O510: 11 | P510: 16 | Q510: =O510*6+P510 -> 82 | S510: NORTHCOTE
A511: NORTHCOTE | C511: 1 | D511: 4 | E511: =C511*6+D511 -> 10 | G511: 3 | H511: 6 | I511: =G511*6+H511 -> 24 | K511: 3 | L511: 8 | M511: =K511*6+L511 -> 26 | O511: 5 | P511: 17 | Q511: =O511*6+P511 -> 47 | S511: MERRINGTON
A512: BEST PLAYERS
A513: OAKLEIGH | C513: STREETER | F513: EDWARDS | I513: RICKERT | L513: HILL | N513: W WILLIAMS | Q513: HOWELL
A514: NORTHCOTE | C514: POWELL | F514: HINES | I514: KNOWLES | L514: PURDON | N514: WHITECHURCH | Q514: ALDRIDGE
A515: GOALKICKERS
A516: OAKLEIGH | C516: STREETER 5 | F516: J WATSON 2 | I516: RICKERT | K516: SCOTT | M516: EDWARDS | O516: CUNNINGHAM
A517: NORTHCOTE | C517: DUFFIELD | F517: DEANS | H517: STABB | J517: NOLAN | L517: W COLLINS
A519: MOORABBIN | C519: 6 | D519: 1 | E519: =C519*6+D519 -> 37 | G519: 8 | H519: 4 | I519: =G519*6+H519 -> 52 | K519: 10 | L519: 6 | M519: =K519*6+L519 -> 66 | O519: 14 | P519: 7 | Q519: =O519*6+P519 -> 91 | S519: MOORABBIN
A520: BRIGHTON | C520: 2 | D520: 1 | E520: =C520*6+D520 -> 13 | G520: 4 | H520: 1 | I520: =G520*6+H520 -> 25 | K520: 4 | L520: 4 | M520: =K520*6+L520 -> 28 | O520: 5 | P520: 4 | Q520: =O520*6+P520 -> 34 | S520: BOWDEN
A521: BEST PLAYERS
A522: MOORABBIN | C522: MUNYARD | F522: McKENZIE | I522: BROWN | L522: GILDER | O522: REID | Q522: BOYD
A523: BRIGHTON | C523: FREEMAN | F523: PERKINS | I523: PICKERING | L523: LE GRIFFIN | O523: HOWE | Q523: SHELTON
A524: GOALKICKERS
A525: MOORABBIN | C525: REID 5 | F525: MUNYARD 2 | I525: DUNSCOMBE 2 | L525: JONES | N525: BAKER | P525: DICKENSON | S525: BROWN | U525: SUTHERLAND
A526: BRIGHTON | C526: HARDY 2 | F526: PICKERING 2 | I526: LE GRIFFIN
A528: ROUND 9 | E528: 14TH JUNE | I528: WEATHER | L528: DULL FOGGY GROUNDS HEAVY | S528: PLAYED AT
D529: 1ST QTR | H529: 2ND QTR | L529: 3RD QTR | P529: FINAL | S529: BRUNSWICK
A530: PORT MELBOURNE | C530: 2 | D530: 5 | E530: =C530*6+D530 -> 17 | G530: 5 | H530: 12 | I530: =G530*6+H530 -> 42 | K530: 15 | L530: 14 | M530: =K530*6+L530 -> 104 | O530: 16 | P530: 16 | Q530: =O530*6+P530 -> 112 | S530: UMPIRE | X530: LADDER | AB530: ROUND | AD530: 9
A531: BRUNSWICK | C531: 3 | D531: 4 | E531: =C531*6+D531 -> 22 | G531: 8 | H531: 8 | I531: =G531*6+H531 -> 56 | K531: 11 | L531: 10 | M531: =K531*6+L531 -> 76 | O531: 12 | P531: 11 | Q531: =O531*6+P531 -> 83 | S531: SMYTH
A532: BEST PLAYERS | W532: TEAM | X532: W | Y532: L | Z532: D | AA532: FOR | AB532: AGST | AC532: % | AD532: PTS
A533: PORT MELBOURNE | C533: BONNETT | F533: JOHNSON | I533: STOREY | L533: B MILLER | N533: MURRAY | Q533: CARIS
A534: BRUNSWICK | C534: STANLEY | F534: THORNTON | I534: NEILSON | L534: PLANT | N534: SEYMOUR | Q534: POLLARD | W534: PORT MELBOURNE | X534: 9 | Y534: 0 | Z534: 0 | AA534: 898 | AB534: 585 | AC534: 153.5042735042735 | AD534: 36
A535: GOALKICKERS | W535: YARRAVILLE | X535: 7 | Y535: 2 | Z535: 0 | AA535: 736 | AB535: 725 | AC535: 101.51724137931035 | AD535: 28
A536: PORT MELBOURNE | C536: BONNETT 7 | F536: B MILLER 3 | I536: A MILLER 2 | L536: MURRAY | N536: WALSH | P536: OWENS | R536: OLLE | W536: OAKLEIGH | X536: 6 | Y536: 3 | Z536: 0 | AA536: 762 | AB536: 582 | AC536: 130.70325900514581 | AD536: 24
A537: BRUNSWICK | C537: THORNTON 5 | F537: WEIR 2 | H537: STANLEY 2 | K537: CULLY | M537: LOVETT | O537: SEYMOUR | W537: COBURG | X537: 6 | Y537: 3 | Z537: 0 | AA537: 890 | AB537: 694 | AC537: 128.24207492795389 | AD537: 24
A539: COBURG | C539: 6 | D539: 3 | E539: =C539*6+D539 -> 39 | G539: 14 | H539: 6 | I539: =G539*6+H539 -> 90 | K539: 18 | L539: 10 | M539: =K539*6+L539 -> 118 | O539: 21 | P539: 11 | Q539: =O539*6+P539 -> 137 | S539: TOORAK PARK | W539: BRUNSWICK | X539: 6 | Y539: 3 | Z539: 0 | AA539: 658 | AB539: 542 | AC539: 121.58671586715867 | AD539: 24
A540: PRAHRAN | C540: 4 | D540: 0 | E540: =C540*6+D540 -> 24 | G540: 7 | H540: 7 | I540: =G540*6+H540 -> 49 | K540: 10 | L540: 11 | M540: =K540*6+L540 -> 71 | O540: 14 | P540: 15 | Q540: =O540*6+P540 -> 99 | S540: SMYTH | W540: CAMBERWELL | X540: 5 | Y540: 4 | Z540: 0 | AA540: 644 | AB540: 639 | AC540: 100.78247261345852 | AD540: 20
A541: BEST PLAYERS | W541: MOORABBIN | X541: 5 | Y541: 4 | Z541: 0 | AA541: 636 | AB541: 672 | AC541: 94.642857142857139 | AD541: 20
A542: COBURG | C542: EVANS | E542: H WILKINSON | H542: FEWKES | K542: GILBERT | N542: CANNING | Q542: JAMES | W542: PRESTON | X542: 4 | Y542: 5 | Z542: 0 | AA542: 785 | AB542: 770 | AC542: 101.94805194805195 | AD542: 16
A543: PRAHRAN | C543: COLLS | E543: JONES | H543: KRUSE | K543: BUTLING | N543: MORROW | Q543: LOUREY | W543: SANDRINGHAM | X543: 4 | Y543: 5 | Z543: 0 | AA543: 708 | AB543: 705 | AC543: 100.42553191489361 | AD543: 16
A544: GOALKICKERS | O544: GILBERT | Q544: McTAGGART | W544: PRAHRAN | X544: 4 | Y544: 5 | Z544: 0 | AA544: 746 | AB544: 762 | AC544: 97.900262467191595 | AD544: 16
A545: COBURG | C545: JAMES 5 | E545: HEWES 4 | G545: H WILKINSON 3 | J545: R WILKINSON 3 | N545: EVANS 2 | P545: EQUID | R545: BULMAN | W545: NORTHCOTE | X545: 3 | Y545: 6 | Z545: 0 | AA545: 573 | AB545: 636 | AC545: 90.094339622641513 | AD545: 12
A546: PRAHRAN | C546: MORROW 3 | F546: LOUREY 2 | I546: McCULLOCH 2 | L546: HARVEY 2 | N546: ARMSTRONG | Q546: GALLAGHER | T546: KRUSE | W546: WILLIAMSTOWN | X546: 2 | Y546: 7 | Z546: 0 | AA546: 720 | AB546: 779 | AC546: 92.426187419768937 | AD546: 8
O547: CHAPMAN | R547: SHILLABEER | W547: BOX HILL | X547: 2 | Y547: 7 | Z547: 0 | AA547: 597 | AB547: 866 | AC547: 68.937644341801388 | AD547: 8
A548: OAKLEIGH | C548: 8 | D548: 1 | E548: =C548*6+D548 -> 49 | G548: 12 | H548: 5 | I548: =G548*6+H548 -> 77 | K548: 18 | L548: 8 | M548: =K548*6+L548 -> 116 | O548: 18 | P548: 9 | Q548: =O548*6+P548 -> 117 | S548: OAKLEIGH | W548: BRIGHTON | X548: 0 | Y548: 9 | Z548: 0 | AA548: 527 | AB548: 923 | AC548: 57.096424702058506 | AD548: 0
A549: SANDRINGHAM | C549: 1 | D549: 2 | E549: =C549*6+D549 -> 8 | G549: 4 | H549: 7 | I549: =G549*6+H549 -> 31 | K549: 8 | L549: 11 | M549: =K549*6+L549 -> 59 | O549: 14 | P549: 18 | Q549: =O549*6+P549 -> 102 | S549: CLEARY
A550: BEST PLAYERS
A551: OAKLEIGH | C551: LAMBERT | F551: STREETER | I551: EDWARDS | L551: HILL | N551: HOWELL | Q551: CUNNINGHAMN
A552: SANDRINGHAM | C552: GUILLE | F552: B HARPER | I552: BOURKE | L552: WALKER | N552: BENCRAFT | Q552: MILLER
A553: GOALKICKERS
A554: OAKLEIGH | C554: EDWARDS 4 | F554: CUNNINGHAM 4 | J554: STREETER 3 | M554: ROWLANDS 3 | P554: GUY | Q554: H WILLIAMS | T554: SCOTT | V554: LAMBERT
A555: SANDRINGHAM | C555: B HARPER 6 | F555: WALKER 2 | I555: FLEMING 2 | L555: BENCRAFT 2 | O555: BOURKE | Q555: HISCOCK
A557: PRESTON | C557: 2 | D557: 3 | E557: =C557*6+D557 -> 15 | G557: 8 | H557: 8 | I557: =G557*6+H557 -> 56 | K557: 11 | L557: 11 | M557: =K557*6+L557 -> 77 | O557: 13 | P557: 15 | Q557: =O557*6+P557 -> 93 | S557: PRESTON
A558: MOORABBIN | C558: 3 | D558: 1 | E558: =C558*6+D558 -> 19 | G558: 5 | H558: 5 | I558: =G558*6+H558 -> 35 | K558: 6 | L558: 5 | M558: =K558*6+L558 -> 41 | O558: 6 | P558: 9 | Q558: =O558*6+P558 -> 45 | S558: IRVING
A559: BEST PLAYERS
A560: PRESTON | C560: BRADFORD | F560: LALOR | I560: HENRYS | L560: MANCE | N560: PRITCHARD | Q560: PASCOE
A561: MOORABBIN | C561: McKENZIE | F561: D'OLIVER | I561: REID | L561: JONES | N561: BOYD | Q561: COPSEY
A562: GOALKICKERS
A563: PRESTON | C563: LALOR 3 | F563: BRADFORD 3 | I563: HARVEY 2 | K563: DAWSON | M563: F CHARD | O563: FOLEY | Q563: JEFFREY | S563: BATEMAN
A564: MOORABBIN | C564: JONES 3 | F564: DICKENSON 2 | I564: MUNYARD
A566: NORTHCOTE | C566: 0 | D566: 6 | E566: =C566*6+D566 -> 6 | G566: 5 | H566: 11 | I566: =G566*6+H566 -> 41 | K566: 6 | L566: 14 | M566: =K566*6+L566 -> 50 | O566: 7 | P566: 14 | Q566: =O566*6+P566 -> 56 | S566: BOX HILL
A567: BOX HILL | C567: 1 | D567: 0 | E567: =C567*6+D567 -> 6 | G567: 4 | H567: 2 | I567: =G567*6+H567 -> 26 | K567: 5 | L567: 2 | M567: =K567*6+L567 -> 32 | O567: 6 | P567: 5 | Q567: =O567*6+P567 -> 41 | S567: MERRINGTON
A568: BEST PLAYERS
A569: NORTHCOTE | C569: PURDON | F569: ALDRIDGE | I569: POWELL | K569: DEANS | N569: WHITECHURCH | Q569: R WHITE
A570: BOX HILL | C570: MORRIS | F570: WEBB | I570: GREEN | K570: GARDINER | N570: PARKS | Q570: WILLIAMS
A571: GOALKICKERS
A572: NORTHCOTE | C572: WHITECHURCH | F572: PAYNTER | I572: NOLAN | K572: PAWSEY | M572: POWELL | O572: PURDON | Q572: KNOWLES
A573: BOX HILL | C573: WILLIAMS 2 | F573: MORRIS | I573: WEBB | K573: VANCE | M573: O'NEILL
A575: CAMBERWELL | C575: 4 | D575: 1 | E575: =C575*6+D575 -> 25 | G575: 12 | H575: 7 | I575: =G575*6+H575 -> 79 | K575: 14 | L575: 9 | M575: =K575*6+L575 -> 93 | O575: 16 | P575: 11 | Q575: =O575*6+P575 -> 107 | S575: ELSTERNWICK PARK
A576: BRIGHTON | C576: 3 | D576: 1 | E576: =C576*6+D576 -> 19 | G576: 4 | H576: 3 | I576: =G576*6+H576 -> 27 | K576: 7 | L576: 4 | M576: =K576*6+L576 -> 46 | O576: 8 | P576: 6 | Q576: =O576*6+P576 -> 54 | S576: BAGULEY
A577: BEST PLAYERS
A578: CAMBERWELL | C578: ROSENBROCK | F578: BEDFORD | I578: MARIAN | L578: FLETCHER | N578: CALLAHAN | Q578: HEDLEY
A579: BRIGHTON | C579: BLACKMORE | F579: BOWLES | I579: DAVIDSON | L579: TAPLIN | N579: PICKERING | Q579: HOWE
A580: GOALKICKERS
A581: CAMBERWELL | C581: McFEE 4 | E581: MARIAN 3 | H581: BRADLEY 2 | J581: LITTLE 2 | L581: BEDFORD | N581: HEDLEY | P581: BENBOW | R581: ROSENBROCK | V581: HAYES
A582: BRIGHTON | C582: HOWE 3 | F582: TAPLIN | H582: ADAMS | J582: HARDY | L582: BOWLES | N582: EMBLETON
A584: YARRAVILLE | C584: 6 | D584: 3 | E584: =C584*6+D584 -> 39 | G584: 11 | H584: 4 | I584: =G584*6+H584 -> 70 | K584: 14 | L584: 5 | M584: =K584*6+L584 -> 89 | O584: 18 | P584: 7 | Q584: =O584*6+P584 -> 115 | S584: YARRAVILLE
A585: WILLIAMSTOWN | C585: 5 | D585: 5 | E585: =C585*6+D585 -> 35 | G585: 6 | H585: 12 | I585: =G585*6+H585 -> 48 | K585: 13 | L585: 13 | M585: =K585*6+L585 -> 91 | O585: 15 | P585: 15 | Q585: =O585*6+P585 -> 105 | S585: RICHARDSON
A586: BEST PLAYERS
A587: YARRAVILLE | C587: NICHOLLS | F587: BODSWORTH | I587: JONES | L587: CRANAGE | O587: ROHLEDER | R587: SEITZ
A588: WILLIAMSTOWN | C588: CALLAHAN | F588: ROGERS | I588: DULLARD | L588: MOLYNEUX | O588: SIMPSON | R588: SHEAHAN
A589: GOALKICKERS
A590: YARRAVILLE | C590: BODSWORTH 7 | F590: WAGHORNE 4 | I590: SEITZ 3 | K590: PHILLIPS 3 | M590: MASON
A591: WILLIAMSTOWN | C591: WALKER 5 | F591: DULLARD 3 | I591: J SIMPSON 2 | L591: W WILLIAMS 2 | O591: MOLYNEUX 2 | R591: SHEAHAN
A593: ROUND 10 | E593: 21ST JUNE | J593: WEATHER | O593: RAIN GROUNDS HEAVY | S593: PLAYED AT
D594: 1ST QTR | H594: 2ND QTR | L594: 3RD QTR | P594: FINAL | S594: COBURG
A595: COBURG | C595: 4 | D595: 3 | E595: =C595*6+D595 -> 27 | G595: 9 | H595: 5 | I595: =G595*6+H595 -> 59 | K595: 10 | L595: 10 | M595: =K595*6+L595 -> 70 | O595: 11 | P595: 10 | Q595: =O595*6+P595 -> 76 | S595: UMPIRE | X595: LADDER | AB595: ROUND | AD595: 10
A596: YARRAVILLE | C596: 1 | D596: 2 | E596: =C596*6+D596 -> 8 | G596: 4 | H596: 5 | I596: =G596*6+H596 -> 29 | K596: 5 | L596: 7 | M596: =K596*6+L596 -> 37 | O596: 7 | P596: 10 | Q596: =O596*6+P596 -> 52 | S596: MERRINGTON
A597: BEST PLAYERS | W597: TEAM | X597: W | Y597: L | Z597: D | AA597: FOR | AB597: AGST | AC597: % | AD597: PTS
A598: COBURG | C598: FEWKES | F598: STARBUCK | I598: LAMBERT | L598: EQUID | O598: HEWES | Q598: JAMES
A599: YARRAVILLE | C599: MASON | F599: NICHOLLS | I599: BODSWORTH | L599: VANDERFEEN | O599: JONES | Q599: MURPHY | W599: PORT MELBOURNE | X599: 10 | Y599: 0 | Z599: 0 | AA599: 993 | AB599: 600 | AC599: 165.5 | AD599: 40
A600: GOALKICKERS | W600: COBURG | X600: 7 | Y600: 3 | Z600: 0 | AA600: 966 | AB600: 746 | AC600: 129.49061662198392 | AD600: 28
A601: COBURG | C601: JAMES 5 | F601: CANNING 2 | I601: R WILKINSON | L601: H WILKINSON | O601: EVANS | Q601: HEWES | W601: OAKLEIGH | X601: 7 | Y601: 3 | Z601: 0 | AA601: 830 | AB601: 642 | AC601: 129.08242612752721 | AD601: 28
A602: YARRAVILLE | C602: MASON 2 | F602: PHILLIPS 2 | I602: BODSWORTH | L602: SEITZ | N602: WILLIAMS | W602: BRUNSWICK | X602: 7 | Y602: 3 | Z602: 0 | AA602: 723 | AB602: 591 | AC602: 122.50423011844332 | AD602: 28
A604: CAMBERWELL | C604: 3 | D604: 1 | E604: =C604*6+D604 -> 19 | G604: 6 | H604: 2 | I604: =G604*6+H604 -> 38 | K604: 7 | L604: 2 | M604: =K604*6+L604 -> 44 | O604: 9 | P604: 3 | Q604: =O604*6+P604 -> 57 | S604: CAMBERWELL | W604: YARRAVILLE | X604: 7 | Y604: 3 | Z604: 0 | AA604: 788 | AB604: 801 | AC604: 98.377028714107368 | AD604: 28
A605: MOORABBIN | C605: 2 | D605: 3 | E605: =C605*6+D605 -> 15 | G605: 3 | H605: 4 | I605: =G605*6+H605 -> 22 | K605: 7 | L605: 10 | M605: =K605*6+L605 -> 52 | O605: 7 | P605: 10 | Q605: =O605*6+P605 -> 52 | S605: CLEARY | W605: CAMBERWELL | X605: 6 | Y605: 4 | Z605: 0 | AA605: 701 | AB605: 691 | AC605: 101.44717800289436 | AD605: 24
A606: BEST PLAYERS | W606: SANDRINGHAM | X606: 5 | Y606: 5 | Z606: 0 | AA606: 804 | AB606: 789 | AC606: 101.90114068441065 | AD606: 20
A607: CAMBERWELL | C607: BOHAN | F607: BENBOW | I607: BRADLEY | L607: McFEE | O607: BEDFORD | Q607: HEALY | W607: MOORABBIN | X607: 5 | Y607: 5 | Z607: 0 | AA607: 688 | AB607: 729 | AC607: 94.375857338820296 | AD607: 20
A608: MOORABBIN | C608: MUNYARD | F608: McKENZIE | I608: COATES | L608: D'OLIVER | O608: BROWN | Q608: STANLEY | W608: PRESTON | X608: 4 | Y608: 6 | Z608: 0 | AA608: 845 | AB608: 838 | AC608: 100.83532219570405 | AD608: 16
A609: GOALKICKERS | W609: PRAHRAN | X609: 4 | Y609: 6 | Z609: 0 | AA609: 785 | AB609: 824 | AC609: 95.266990291262132 | AD609: 16
A610: CAMBERWELL | C610: McFEE 3 | F610: ROSENBROCK | I610: HAYES | K610: BENBOW | M610: HEDLEY | O610: LITTLE | Q610: BRADLEY | W610: NORTHCOTE | X610: 4 | Y610: 6 | Z610: 0 | AA610: 635 | AB610: 675 | AC610: 94.074074074074076 | AD610: 16
A611: MOORABBIN | C611: BROWN 3 | F611: DALY | H611: GILDER | J611: BARNES | L611: ANTONIE | W611: WILLIAMSTOWN | X611: 2 | Y611: 8 | Z611: 0 | AA611: 769 | AB611: 844 | AC611: 91.113744075829388 | AD611: 8
W612: BOX HILL | X612: 2 | Y612: 8 | Z612: 0 | AA612: 681 | AB612: 962 | AC612: 70.79002079002079 | AD612: 8
A613: OAKLEIGH | C613: 3 | D613: 3 | E613: =C613*6+D613 -> 21 | G613: 6 | H613: 5 | I613: =G613*6+H613 -> 41 | K613: 9 | L613: 6 | M613: =K613*6+L613 -> 60 | O613: 10 | P613: 8 | Q613: =O613*6+P613 -> 68 | S613: OAKLEIGH | W613: BRIGHTON | X613: 0 | Y613: 10 | Z613: 0 | AA613: 542 | AB613: 1018 | AC613: 53.241650294695482 | AD613: 0
A614: PRESTON | C614: 5 | D614: 0 | E614: =C614*6+D614 -> 30 | G614: 6 | H614: 1 | I614: =G614*6+H614 -> 37 | K614: 9 | L614: 4 | M614: =K614*6+L614 -> 58 | O614: 9 | P614: 6 | Q614: =O614*6+P614 -> 60 | S614: BOWDEN
A615: BEST PLAYERS
A616: OAKLEIGH | C616: HOWELL | F616: TEMME | I616: BAXTER | L616: SCOTT | O616: POWER | Q616: EDWARDS
A617: PRESTON | C617: HARVEY | F617: BRADFORD | I617: FOLEY | L617: DEACON | O617: SWEET | Q617: JEFFREY
A618: GOALKICKERS
A619: OAKLEIGH | C619: J WATSON 3 | F619: STREETER 2 | I619: SCOTT 2 | K619: CUNNINGHAM | N619: HILL | P619: EDWARDS
A620: PRESTON | C620: HARVEY 3 | F620: F CHARD 2 | I620: FOLEY 2 | K620: BRADFORD | N620: GLOSSOP
A622: NORTHCOTE | C622: 1 | D622: 4 | E622: =C622*6+D622 -> 10 | G622: 3 | H622: 5 | I622: =G622*6+H622 -> 23 | K622: 7 | L622: 8 | M622: =K622*6+L622 -> 50 | O622: 8 | P622: 14 | Q622: =O622*6+P622 -> 62 | S622: NORTHCOTE
A623: PRAHRAN | C623: 2 | D623: 0 | E623: =C623*6+D623 -> 12 | G623: 3 | H623: 2 | I623: =G623*6+H623 -> 20 | K623: 4 | L623: 2 | M623: =K623*6+L623 -> 26 | O623: 6 | P623: 3 | Q623: =O623*6+P623 -> 39 | S623: RICHARDSON
A624: BEST PLAYERS
A625: NORTHCOTE | C625: ALDRIDGE | F625: STABB | I625: POWELL | L625: PURDON | N625: DEANS | Q625: NOLAN
A626: PRAHRAN | C626: OVERS | F626: ARMSTRONG | I626: KRUSE | L626: PLAIN | N626: COURTNEY | Q626: SHILLABEER
A627: GOALKICKERS
A628: NORTHCOTE | C628: PURDON 2 | F628: STABB 2 | I628: DAVIES | K628: GIBBS | M628: NOLAN | O628: POWELL
A629: PRAHRAN | C629: MORROW 2 | F629: KRUSE | H629: HARVEY | J629: COURTNEY | M629: OVERS
A631: SANDRINGHAM | C631: 4 | D631: 5 | E631: =C631*6+D631 -> 29 | G631: 6 | H631: 6 | I631: =G631*6+H631 -> 42 | K631: 14 | L631: 11 | M631: =K631*6+L631 -> 95 | O631: 14 | P631: 12 | Q631: =O631*6+P631 -> 96 | S631: BEACH ROAD
A632: BOX HILL | C632: 2 | D632: 0 | E632: =C632*6+D632 -> 12 | G632: 7 | H632: 3 | I632: =G632*6+H632 -> 45 | K632: 9 | L632: 5 | M632: =K632*6+L632 -> 59 | O632: 13 | P632: 6 | Q632: =O632*6+P632 -> 84 | S632: SMYTH
A633: BEST PLAYERS
A634: SANDRINGHAM | C634: BENCRAFT | F634: EVANS | H634: BOURKE | K634: POTTER | N634: SCANLAN | Q634: BRIGHTON
A635: BOX HILL | C635: GREEN | F635: WEBB | H635: W BLUNDY | K635: PARKS | N635: VANCE | Q635: MORRIS
A636: GOALKICKERS
A637: SANDRINGHAM | C637: BENCRAFT 5 | F637: B HARPER 3 | I637: HISCOCK 2 | L637: POTTER | N637: RAEBURN | Q637: BOURKE | S637: WRIGHT-SMITH
A638: BOX HILL | C638: GREEN 9 | F638: WEBB 2 | I638: COGHLAN | L638: GARDINER
A640: BRUNSWICK | C640: 3 | D640: 0 | E640: =C640*6+D640 -> 18 | G640: 6 | H640: 2 | I640: =G640*6+H640 -> 38 | K640: 7 | L640: 2 | M640: =K640*6+L640 -> 44 | O640: 10 | P640: 5 | Q640: =O640*6+P640 -> 65 | S640: WILLIAMSTOWN
A641: WILLIAMSTOWN | C641: 2 | D641: 4 | E641: =C641*6+D641 -> 16 | G641: 5 | H641: 5 | I641: =G641*6+H641 -> 35 | K641: 7 | L641: 7 | M641: =K641*6+L641 -> 49 | O641: 7 | P641: 7 | Q641: =O641*6+P641 -> 49 | S641: BAGULEY
A642: BEST PLAYERS
A643: BRUNSWICK | C643: WEIR | F643: POLLARD | I643: WHEELER | L643: MAY | O643: STANLEY | R643: NEILSON
A644: WILLIAMSTOWN | C644: ALLANSON | F644: ROGERS | I644: CALLAHAN | L644: DULLARD | O644: G WILLIAMS | R644: MOLYNEUX
A645: GOALKICKERS
A646: BRUNSWICK | C646: LOVETT 2 | F646: WEIR 2 | H646: WHEELER 2 | K646: STANLEY | M646: SEYMOUR | O646: CLUES | Q646: THORNTON
A647: WILLIAMSTOWN | C647: WALKER 2 | F647: MOLYNEUX 2 | I647: B WILLIAMS | L647: J SIMPSON | N647: SHEEHAN
A649: PORT MELBOURNE | C649: 4 | D649: 4 | E649: =C649*6+D649 -> 28 | G649: 7 | H649: 5 | I649: =G649*6+H649 -> 47 | K649: 9 | L649: 6 | M649: =K649*6+L649 -> 60 | O649: 14 | P649: 11 | Q649: =O649*6+P649 -> 95 | S649: PORT MELBOURNE
A650: BRIGHTON | C650: 0 | D650: 1 | E650: =C650*6+D650 -> 1 | G650: 0 | H650: 2 | I650: =G650*6+H650 -> 2 | K650: 1 | L650: 3 | M650: =K650*6+L650 -> 9 | O650: 2 | P650: 3 | Q650: =O650*6+P650 -> 15 | S650: IRVING
A651: BEST PLAYERS
A652: PORT MELBOURNE | C652: B MILLER | F652: BONNETT | I652: JOHNSON | L652: KELSEY | O652: WILSON | R652: STOREY
A653: BRIGHTON | C653: PERKINS | F653: BLACKMORE | I653: PLUNKETT | L653: PICKERING | O653: SHELTON | R653: SINCLAIR
A654: GOALKICKERS
A655: PORT MELBOURNE | C655: B MILLER 6 | F655: BONNETT 2 | I655: STOREY | K655: MURRAY | M655: A MILLER | O655: OWENS | Q655: LEEHANE | S655: WALSH
A656: BRIGHTON | C656: LE GRIFFIN | F656: CONROY
A658: ROUND 11 | E658: 28TH JUNE | J658: WEATHER | M658: RAIN GROUNDS HEAVY | S658: PLAYED AT
D659: 1ST QTR | H659: 2ND QTR | L659: 3RD QTR | P659: FINAL | S659: BRUNSWICK
A660: COBURG | C660: 2 | D660: 2 | E660: =C660*6+D660 -> 14 | G660: 5 | H660: 3 | I660: =G660*6+H660 -> 33 | K660: 12 | L660: 5 | M660: =K660*6+L660 -> 77 | O660: 12 | P660: 8 | Q660: =O660*6+P660 -> 80 | S660: UMPIRE | X660: LADDER | AB660: ROUND | AD660: 11
A661: BRUNSWICK | C661: 0 | D661: 1 | E661: =C661*6+D661 -> 1 | G661: 4 | H661: 6 | I661: =G661*6+H661 -> 30 | K661: 4 | L661: 6 | M661: =K661*6+L661 -> 30 | O661: 9 | P661: 10 | Q661: =O661*6+P661 -> 64 | S661: SMYTH
A662: BEST PLAYERS | W662: TEAM | X662: W | Y662: L | Z662: D | AA662: FOR | AB662: AGST | AC662: % | AD662: PTS
A663: COBURG | C663: STARBUCK | F663: FEWKES | I663: H WILKINSON | L663: HEWES | N663: EVANS | Q663: McTAGGART
A664: BRUNSWICK | C664: CLUES | F664: WEIR | I664: STANLEY | L664: POLLARD | N664: SEYMOUR | Q664: MAY | W664: PORT MELBOURNE | X664: 11 | Y664: 0 | Z664: 0 | AA664: 1034 | AB664: 637 | AC664: 162.32339089481945 | AD664: 44
A665: GOALKICKERS | R665: JAMES | W665: OAKLEIGH | X665: 8 | Y665: 3 | Z665: 0 | AA665: 879 | AB665: 673 | AC665: 130.41543026706231 | AD665: 32
A666: COBURG | C666: H WILKINSON 3 | F666: McTAGGART 2 | I666: HEWES 2 | K666: ROGAN | M666: EVANS | O666: HAMILTON | R666: R WILKINSON | W666: COBURG | X666: 8 | Y666: 3 | Z666: 0 | AA666: 1046 | AB666: 810 | AC666: 129.1358024691358 | AD666: 32
A667: BRUNSWICK | C667: CLUES 3 | F667: WEIR 2 | I667: NEILSON | K667: CULLY | M667: THORNTON | O667: LOVETT | W667: BRUNSWICK | X667: 7 | Y667: 4 | Z667: 0 | AA667: 787 | AB667: 671 | AC667: 117.43666169895678 | AD667: 28
A669: PORT MELBOURNE | C669: 1 | D669: 4 | E669: =C669*6+D669 -> 10 | G669: 5 | H669: 5 | I669: =G669*6+H669 -> 35 | K669: 6 | L669: 5 | M669: =K669*6+L669 -> 41 | O669: 6 | P669: 5 | Q669: =O669*6+P669 -> 41 | S669: MOORABBIN | W669: YARRAVILLE | X669: 7 | Y669: 4 | Z669: 0 | AA669: 826 | AB669: 848 | AC669: 97.405660377358487 | AD669: 28
A670: MOORABBIN | C670: 1 | D670: 3 | E670: =C670*6+D670 -> 9 | G670: 2 | H670: 4 | I670: =G670*6+H670 -> 16 | K670: 5 | L670: 4 | M670: =K670*6+L670 -> 34 | O670: 5 | P670: 7 | Q670: =O670*6+P670 -> 37 | S670: MERRINGTON | W670: CAMBERWELL | X670: 6 | Y670: 4 | Z670: 1 | AA670: 770 | AB670: 760 | AC670: 101.31578947368421 | AD670: 26
A671: BEST PLAYERS | W671: PRAHRAN | X671: 5 | Y671: 6 | Z671: 0 | AA671: 863 | AB671: 875 | AC671: 98.628571428571433 | AD671: 20
A672: PORT MELBOURNE | C672: JOHNSON | F672: LEEHANE | I672: B MILLER | L672: CARIS | N672: KELSEY | Q672: OWENS | W672: SANDRINGHAM | X672: 5 | Y672: 6 | Z672: 0 | AA672: 855 | AB672: 867 | AC672: 98.615916955017298 | AD672: 20
A673: MOORABBIN | C673: McKENZIE | F673: RICHARDSON | I673: STANLEY | L673: MUNYARD | N673: DICKENSON | Q673: D'OLIVER | W673: NORTHCOTE | X673: 5 | Y673: 6 | Z673: 0 | AA673: 682 | AB673: 713 | AC673: 95.652173913043484 | AD673: 20
A674: GOALKICKERS | W674: MOORABBIN | X674: 5 | Y674: 6 | Z674: 0 | AA674: 725 | AB674: 770 | AC674: 94.15584415584415 | AD674: 20
A675: PORT MELBOURNE | C675: B MILLER 2 | F675: A MILLER | I675: BONNETT | K675: OWENS | M675: ATKINSON | W675: PRESTON | X675: 4 | Y675: 6 | Z675: 1 | AA675: 914 | AB675: 907 | AC675: 100.77177508269018 | AD675: 18
A676: MOORABBIN | C676: McKENZIE 2 | F676: BOURKE | I676: DICKENSON | L676: RICHARDSON | W676: WILLIAMSTOWN | X676: 3 | Y676: 8 | Z676: 0 | AA676: 861 | AB676: 900 | AC676: 95.666666666666671 | AD676: 12
W677: BOX HILL | X677: 2 | Y677: 9 | Z677: 0 | AA677: 712 | AB677: 1011 | AC677: 70.425321463897134 | AD677: 8
A678: PRESTON | C678: 3 | D678: 5 | E678: =C678*6+D678 -> 23 | G678: 6 | H678: 6 | I678: =G678*6+H678 -> 42 | K678: 8 | L678: 11 | M678: =K678*6+L678 -> 59 | O678: 9 | P678: 15 | Q678: =O678*6+P678 -> 69 | S678: PRESTON | W678: BRIGHTON | X678: 0 | Y678: 11 | Z678: 0 | AA678: 598 | AB678: 1110 | AC678: 53.873873873873876 | AD678: 0
A679: CAMBERWELL | C679: 2 | D679: 3 | E679: =C679*6+D679 -> 15 | G679: 6 | H679: 5 | I679: =G679*6+H679 -> 41 | K679: 6 | L679: 5 | M679: =K679*6+L679 -> 41 | O679: 10 | P679: 9 | Q679: =O679*6+P679 -> 69 | S679: HARWOOD
A680: BEST PLAYERS
A681: PRESTON | C681: DEACON | F681: BRADFORD | I681: PRITCHARD | L681: SWEET | O681: HAYES | Q681: DAWSON
A682: CAMBERWELL | C682: BOHAN | F682: FLETCHER | I682: HEDLEY | L682: BRADLEY | O682: BENBOW | Q682: CALLAHAN
A683: GOALKICKERS
A684: PRESTON | C684: BRADFORD 2 | F684: FOLEY 2 | I684: LALOR 2 | L684: DAWSON | N684: PASCOE | P684: CROCKER
A685: CAMBERWELL | C685: BRADLEY 5 | F685: McFEE 2 | I685: MARIAN | L685: HEDLEY | N685: BOHAN
A687: PRAHRAN | C687: 4 | D687: 3 | E687: =C687*6+D687 -> 27 | G687: 8 | H687: 9 | I687: =G687*6+H687 -> 57 | K687: 9 | L687: 15 | M687: =K687*6+L687 -> 69 | O687: 10 | P687: 18 | Q687: =O687*6+P687 -> 78 | S687: TOORAK PARK
A688: SANDRINGHAM | C688: 3 | D688: 8 | E688: =C688*6+D688 -> 26 | G688: 4 | H688: 8 | I688: =G688*6+H688 -> 32 | K688: 4 | L688: 14 | M688: =K688*6+L688 -> 38 | O688: 6 | P688: 15 | Q688: =O688*6+P688 -> 51 | S688: IRVING
A689: BEST PLAYERS
A690: PRAHRAN | C690: KINNABURGH | F690: MORROW | I690: ARMSTRONG | L690: HARVEY | O690: WALSH | R690: GRAMBEAU
A691: SANDRINGHAM | C691: SCANLON | F691: HISCOCK | I691: BENCRAFT | L691: TREVERTON | O691: BRIGHTON | R691: SHEARS
A692: GOALKICKERS
A693: PRAHRAN | C693: MORROW 4 | F693: HART 2 | I693: LOUREY | K693: BOHAN | M693: KINNABURGH | P693: KRUSE
A694: SANDRINGHAM | C694: WRIGHT-SMITH 2 | G694: WALKER | I694: CANNY | K694: BRIGHTON | N694: BOURKE
A696: WILLIAMSTOWN | C696: 1 | D696: 0 | E696: =C696*6+D696 -> 6 | G696: 7 | H696: 3 | I696: =G696*6+H696 -> 45 | K696: 10 | L696: 5 | M696: =K696*6+L696 -> 65 | O696: 14 | P696: 8 | Q696: =O696*6+P696 -> 92 | S696: ELSTERNWICK PARK
A697: BRIGHTON | C697: 3 | D697: 5 | E697: =C697*6+D697 -> 23 | G697: 3 | H697: 6 | I697: =G697*6+H697 -> 24 | K697: 5 | L697: 8 | M697: =K697*6+L697 -> 38 | O697: 8 | P697: 8 | Q697: =O697*6+P697 -> 56 | S697: RICHARDSON
A698: BEST PLAYERS
A699: WILLIAMSTOWN | C699: CALLAHAN | F699: WOOKEY | I699: G WILLIAMS | L699: WALKER | O699: H WILLIAMS | R699: MOLYNEUX
A700: BRIGHTON | C700: BLACKMORE | F700: HOWE | I700: O'MEARA | L700: PERKINS | O700: DAVIDSON | R700: CONROY
A701: GOALKICKERS
A702: WILLIAMSTOWN | C702: WALKER 4 | F702: SMITH 2 | I702: DULLARD 2 | L702: J SIMPSON | N702: HUGHES | P702: WOOKEY | R702: TOZER | T702: B WILLIAMS | X702: MOLYNEUX
A703: BRIGHTON | C703: O'MEARA 3 | F703: CONROY | I703: LE GRIFFIN | L703: HOWE | N703: JOWETT | P703: BURRELL
A705: NORTHCOTE | C705: 0 | D705: 0 | E705: =C705*6+D705 -> 0 | G705: 3 | H705: 5 | I705: =G705*6+H705 -> 23 | K705: 3 | L705: 9 | M705: =K705*6+L705 -> 27 | O705: 6 | P705: 11 | Q705: =O705*6+P705 -> 47 | S705: YARRAVILLE
A706: YARRAVILLE | C706: 2 | D706: 3 | E706: =C706*6+D706 -> 15 | G706: 2 | H706: 4 | I706: =G706*6+H706 -> 16 | K706: 4 | L706: 5 | M706: =K706*6+L706 -> 29 | O706: 5 | P706: 8 | Q706: =O706*6+P706 -> 38 | S706: CLEARY
A707: BEST PLAYERS
A708: NORTHCOTE | C708: PURDON | F708: POWELL | I708: NOLAN | L708: COLLINS | O708: COOPER | Q708: DEAS
A709: YARRAVILLE | C709: SEITZ | F709: WAGHORNE | I709: COOK | L709: ROHLEDER | O709: MASON | Q709: VANDERFEEN
A710: GOALKICKERS
A711: NORTHCOTE | C711: COOPER 2 | F711: DUFFIELD 2 | I711: NOLAN | K711: STABB
A712: YARRAVILLE | C712: MASON 2 | F712: McCANN | I712: WAGHORNE | L712: PHILLIPS
A714: OAKLEIGH | C714: 2 | D714: 6 | E714: =C714*6+D714 -> 18 | G714: 5 | H714: 6 | I714: =G714*6+H714 -> 36 | K714: 5 | L714: 6 | M714: =K714*6+L714 -> 36 | O714: 7 | P714: 7 | Q714: =O714*6+P714 -> 49 | S714: BOX HILL
A715: BOX HILL | C715: 0 | D715: 0 | E715: =C715*6+D715 -> 0 | G715: 3 | H715: 0 | I715: =G715*6+H715 -> 18 | K715: 4 | L715: 1 | M715: =K715*6+L715 -> 25 | O715: 5 | P715: 1 | Q715: =O715*6+P715 -> 31 | S715: BAGULEY
A716: BEST PLAYERS
A717: OAKLEIGH | C717: ROWLANDS | F717: HILL | I717: SCOTT | L717: RAWLINGS | N717: TINDAL | Q717: TEMME
A718: BOX HILL | C718: H BLUNDY | F718: PARKS | I718: THOMPSON | L718: MORRIS | N718: WEBB | Q718: ANDERSON
A719: GOALKICKERS
A720: OAKLEIGH | C720: ROWLANDS 2 | F720: WATSON | H720: SCOTT | J720: W WILLIAMS | M720: RAWLINGS | P720: HILL
A721: BOX HILL | C721: GREEN 2 | F721: MORRIS | H721: COGHLAN | K721: WEBB
A723: ROUND 12 | E723: 5TH JULY | J723: WEATHER | M723: SHOWERS GROUNDS HEAVY | S723: PLAYED AT
D724: 1ST QTR | H724: 2ND QTR | L724: 3RD QTR | P724: FINAL | S724: PORT MELBOURNE
A725: PORT MELBOURNE | C725: 1 | D725: 1 | E725: =C725*6+D725 -> 7 | G725: 5 | H725: 5 | I725: =G725*6+H725 -> 35 | K725: 7 | L725: 6 | M725: =K725*6+L725 -> 48 | O725: 10 | P725: 11 | Q725: =O725*6+P725 -> 71 | S725: UMPIRE | X725: LADDER | AB725: ROUND | AD725: 12
A726: CAMBERWELL | C726: 3 | D726: 3 | E726: =C726*6+D726 -> 21 | G726: 4 | H726: 3 | I726: =G726*6+H726 -> 27 | K726: 7 | L726: 4 | M726: =K726*6+L726 -> 46 | O726: 8 | P726: 4 | Q726: =O726*6+P726 -> 52 | S726: BAGULEY
A727: BEST PLAYERS | W727: TEAM | X727: W | Y727: L | Z727: D | AA727: FOR | AB727: AGST | AC727: % | AD727: PTS
A728: PORT MELBOURNE | C728: KELSEY | F728: BONNETT | I728: STOREY | K728: B MILLER | N728: JOHNSON | Q728: LEEHANE
A729: CAMBERWELL | C729: HEDLEY | F729: HEATLEY | I729: McFEE | K729: MASON | N729: BOHAN | Q729: BRADLEY | W729: PORT MELBOURNE | X729: 12 | Y729: 0 | Z729: 0 | AA729: 1105 | AB729: 689 | AC729: 160.37735849056602 | AD729: 48
A730: GOALKICKERS | W730: COBURG | X730: 9 | Y730: 3 | Z730: 0 | AA730: 1122 | AB730: 840 | AC730: 133.57142857142858 | AD730: 36
A731: PORT MELBOURNE | C731: BONNETT 5 | F731: B MILLER | I731: LAFFEY | K731: OWENS | M731: S TUCKER | O731: WALSH | W731: OAKLEIGH | X731: 8 | Y731: 4 | Z731: 0 | AA731: 941 | AB731: 744 | AC731: 126.30872483221476 | AD731: 32
A732: CAMBERWELL | C732: HEDLEY 3 | F732: BRADLEY 2 | I732: BENDLE | K732: BEDFORD | M732: MCFEE | W732: YARRAVILLE | X732: 8 | Y732: 4 | Z732: 0 | AA732: 921 | AB732: 885 | AC732: 104.06779661016949 | AD732: 32
A734: PRAHRAN | C734: 1 | D734: 3 | E734: =C734*6+D734 -> 9 | G734: 5 | H734: 8 | I734: =G734*6+H734 -> 38 | K734: 6 | L734: 9 | M734: =K734*6+L734 -> 45 | O734: 9 | P734: 17 | Q734: =O734*6+P734 -> 71 | S734: OAKLEIGH | W734: BRUNSWICK | X734: 7 | Y734: 5 | Z734: 0 | AA734: 823 | AB734: 729 | AC734: 113.03155006858711 | AD734: 28
A735: OAKLEIGH | C735: 6 | D735: 3 | E735: =C735*6+D735 -> 39 | G735: 6 | H735: 4 | I735: =G735*6+H735 -> 40 | K735: 9 | L735: 7 | M735: =K735*6+L735 -> 61 | O735: 9 | P735: 8 | Q735: =O735*6+P735 -> 62 | S735: HARWOOD | W735: CAMBERWELL | X735: 6 | Y735: 5 | Z735: 1 | AA735: 822 | AB735: 831 | AC735: 98.91696750902527 | AD735: 26
A736: BEST PLAYERS | W736: PRAHRAN | X736: 6 | Y736: 6 | Z736: 0 | AA736: 934 | AB736: 937 | AC736: 99.679829242262542 | AD736: 24
A737: PRAHRAN | C737: ARMSTRONG | F737: JONES | I737: YATES | L737: MORROW | N737: CAMPBELL | Q737: MORONE | W737: NORTHCOTE | X737: 6 | Y737: 6 | Z737: 0 | AA737: 740 | AB737: 749 | AC737: 98.798397863818423 | AD737: 24
A738: OAKLEIGH | C738: TINDAL | F738: VAINS | I738: DONOHUE | L738: LAMBERT | N738: TEMME | Q738: HILL | W738: PRESTON | X738: 5 | Y738: 6 | Z738: 1 | AA738: 970 | AB738: 961 | AC738: 100.93652445369406 | AD738: 22
A739: GOALKICKERS | W739: SANDRINGHAM | X739: 5 | Y739: 7 | Z739: 0 | AA739: 892 | AB739: 962 | AC739: 92.723492723492726 | AD739: 20
A740: PRAHRAN | C740: MORROW 3 | F740: KINNABURGH 2 | J740: HART 2 | L740: ARMSTRONG | O740: HARVEY | W740: MOORABBIN | X740: 5 | Y740: 7 | Z740: 0 | AA740: 770 | AB740: 854 | AC740: 90.163934426229503 | AD740: 20
A741: OAKLEIGH | C741: WATSON 2 | F741: HILL 2 | H741: WENN 2 | J741: STREETER | M741: SCOTT | O741: ROWLANDS | W741: WILLIAMSTOWN | X741: 4 | Y741: 8 | Z741: 0 | AA741: 945 | AB741: 945 | AC741: 100 | AD741: 16
W742: BOX HILL | X742: 2 | Y742: 10 | Z742: 0 | AA742: 766 | AB742: 1067 | AC742: 71.790065604498594 | AD742: 8
A743: YARRAVILLE | C743: 1 | D743: 2 | E743: =C743*6+D743 -> 8 | G743: 5 | H743: 5 | I743: =G743*6+H743 -> 35 | K743: 6 | L743: 8 | M743: =K743*6+L743 -> 44 | O743: 14 | P743: 11 | Q743: =O743*6+P743 -> 95 | S743: BEACH ROAD | W743: BRIGHTON | X743: 0 | Y743: 12 | Z743: 0 | AA743: 628 | AB743: 1186 | AC743: 52.951096121416526 | AD743: 0
A744: SANDRINGHAM | C744: 3 | D744: 1 | E744: =C744*6+D744 -> 19 | G744: 3 | H744: 3 | I744: =G744*6+H744 -> 21 | K744: 5 | L744: 6 | M744: =K744*6+L744 -> 36 | O744: 5 | P744: 7 | Q744: =O744*6+P744 -> 37 | S744: CLEARY
A745: BEST PLAYERS
A746: YARRAVILLE | C746: COOK | F746: ROHLEDER | I746: PHILLIPS | L746: CRANAGE | O746: SEITZ | Q746: SMALLWOOD
A747: SANDRINGHAM | C747: BOURKE | F747: WALKER | I747: GUILLE | L747: BENCRAFT | O747: SHEARS | Q747: HISCOCK
A748: GOALKICKERS
A749: YARRAVILLE | C749: PHILLIPS 3 | F749: MASON 3 | I749: HARGREAVES 2 | L749: WAGHORNE 2 | O749: SEITZ | Q749: B WILLIAMS | T749: GWYNNE | W749: BODSWORTH
A750: SANDRINGHAM | C750: HISCOCK 3 | F750: BOURKE | I750: WRIGHT-SMITH
A752: NORTHCOTE | C752: 3 | D752: 5 | E752: =C752*6+D752 -> 23 | G752: 4 | H752: 7 | I752: =G752*6+H752 -> 31 | K752: 8 | L752: 10 | M752: =K752*6+L752 -> 58 | O752: 8 | P752: 10 | Q752: =O752*6+P752 -> 58 | S752: NORTHCOTE
A753: BRUNSWICK | C753: 1 | D753: 1 | E753: =C753*6+D753 -> 7 | G753: 5 | H753: 4 | I753: =G753*6+H753 -> 34 | K753: 5 | L753: 4 | M753: =K753*6+L753 -> 34 | O753: 5 | P753: 6 | Q753: =O753*6+P753 -> 36 | S753: RICHARDSON
A754: BEST PLAYERS
A755: NORTHCOTE | C755: ALDRIDGE | F755: PURDON | I755: POWELL | L755: WOOLNOUGH | O755: NOLAN | Q755: HINES
A756: BRUNSWICK | C756: CLUES | F756: PLANT | I756: NEILSON | L756: STANLEY | O756: WHEELER | Q756: ARMSTRONG
A757: GOALKICKERS
A758: NORTHCOTE | C758: PURDON 2 | F758: COLLINS | H758: DUFFIELD | J758: WOOLNOUGH | M758: DAVIES | O758: WHITECHURCH | R758: NOLAN
A759: BRUNSWICK | C759: SEYMOUR 2 | F759: THORNTON 2 | I759: ARMSTRONG
A761: WILLIAMSTOWN | C761: 0 | D761: 1 | E761: =C761*6+D761 -> 1 | G761: 6 | H761: 4 | I761: =G761*6+H761 -> 40 | K761: 7 | L761: 4 | M761: =K761*6+L761 -> 46 | O761: 12 | P761: 12 | Q761: =O761*6+P761 -> 84 | S761: WILLIAMSTOWN
A762: MOORABBIN | C762: 3 | D762: 5 | E762: =C762*6+D762 -> 23 | G762: 3 | H762: 6 | I762: =G762*6+H762 -> 24 | K762: 6 | L762: 9 | M762: =K762*6+L762 -> 45 | O762: 6 | P762: 9 | Q762: =O762*6+P762 -> 45 | S762: SMYTH
A763: BEST PLAYERS
A764: WILLIAMSTOWN | C764: HESLOP | F764: WALKER | I764: DULLARD | L764: CALLAHAN | O764: MOLYNEUX | R764: W WILLIAMS
A765: MOORABBIN | C765: MUNYARD | F765: STANLEY | I765: SUTHERLAND | L765: GILDER | O765: GOODES | R765: DUNSCOMBE
A766: GOALKICKERS
A767: WILLIAMSTOWN | C767: WALKER 3 | F767: MOLYNEUX 2 | I767: B WILLIAMS 2 | L767: W WILLIAMS 2 | O767: J SIMPSON | Q767: HUGHES | S767: DULLARD
A768: MOORABBIN | C768: MUNYARD 2 | F768: REID 2 | I768: DUNSCOMBE | L768: SUTHERLAND
A770: PRESTON | C770: 2 | D770: 0 | E770: =C770*6+D770 -> 12 | G770: 5 | H770: 2 | I770: =G770*6+H770 -> 32 | K770: 5 | L770: 3 | M770: =K770*6+L770 -> 33 | O770: 8 | P770: 8 | Q770: =O770*6+P770 -> 56 | S770: BOX HILL
A771: BOX HILL | C771: 2 | D771: 1 | E771: =C771*6+D771 -> 13 | G771: 2 | H771: 5 | I771: =G771*6+H771 -> 17 | K771: 7 | L771: 10 | M771: =K771*6+L771 -> 52 | O771: 7 | P771: 12 | Q771: =O771*6+P771 -> 54 | S771: MERRINGTON
A772: BEST PLAYERS
A773: PRESTON | C773: HENRYS | E773: HARVEY | H773: BRADFORD | K773: LALOR | N773: GLOSSOP | Q773: SWEET
A774: BOX HILL | C774: WEBB | E774: IRVINE | H774: VANCE | K774: GARDINER | N774: KRONK | Q774: PARKS
A775: GOALKICKERS
A776: PRESTON | C776: HARVEY 3 | F776: BRADFORD 3 | I776: HAYES | K776: BEST
A777: BOX HILL | C777: GREEN 2 | F777: THOMPSON | I777: WEBB | K777: KRONK | M777: MORRIS | O777: MAIDMENT
A779: COBURG | C779: 2 | D779: 1 | E779: =C779*6+D779 -> 13 | G779: 5 | H779: 5 | I779: =G779*6+H779 -> 35 | K779: 7 | L779: 9 | M779: =K779*6+L779 -> 51 | O779: 11 | P779: 10 | Q779: =O779*6+P779 -> 76 | S779: COBURG
A780: BRIGHTON | C780: 2 | D780: 2 | E780: =C780*6+D780 -> 14 | G780: 2 | H780: 4 | I780: =G780*6+H780 -> 16 | K780: 2 | L780: 4 | M780: =K780*6+L780 -> 16 | O780: 4 | P780: 6 | Q780: =O780*6+P780 -> 30 | S780: IRVING
A781: BEST PLAYERS
A782: COBURG | C782: GILBERT | F782: CONDON | I782: BULMAN | L782: WALKER | O782: ROGAN | Q782: EQUID
A783: BRIGHTON | C783: SINCLAIR | F783: LE GRIFFIN | I783: PERKINS | L783: BLACKMORE | O783: BURRELL | Q783: TURNER
A784: GOALKICKERS
A785: COBURG | C785: H WILKINSON 2 | F785: CANNING 2 | I785: R WILKINSON 2 | M785: JAMES 2 | O785: EQUID | Q785: BULMAN | S785: ROGAN
A786: BRIGHTON | C786: HOWE 3 | F786: K EMBLETON
A788: ROUND 13 | E788: 12TH JULY | J788: WEATHER | M788: NORTH WEST WIND HEAVY RAIN | S788: PLAYED AT
D789: 1ST QTR | H789: 2ND QTR | L789: 3RD QTR | P789: FINAL | S789: BRUNSWICK
A790: BRUNSWICK | C790: 5 | D790: 3 | E790: =C790*6+D790 -> 33 | G790: 11 | H790: 6 | I790: =G790*6+H790 -> 72 | K790: 11 | L790: 8 | M790: =K790*6+L790 -> 74 | O790: 12 | P790: 13 | Q790: =O790*6+P790 -> 85 | S790: UMPIRE | X790: LADDER | AB790: ROUND | AD790: 13
A791: SANDRINGHAM | C791: 0 | D791: 2 | E791: =C791*6+D791 -> 2 | G791: 4 | H791: 4 | I791: =G791*6+H791 -> 28 | K791: 5 | L791: 6 | M791: =K791*6+L791 -> 36 | O791: 6 | P791: 6 | Q791: =O791*6+P791 -> 42 | S791: HARWOOD
A792: BEST PLAYERS | W792: TEAM | X792: W | Y792: L | Z792: D | AA792: FOR | AB792: AGST | AC792: % | AD792: PTS
A793: BRUNSWICK | C793: SEYMOUR | F793: NEILSON | I793: CLUES | K793: STANLEY | N793: ROLFS | Q793: POLLARD
A794: SANDRINGHAM | C794: BOURKE | F794: SCANLON | I794: RUSSELL | K794: MILLER | N794: TREVERTON | Q794: G JONES | W794: PORT MELBOURNE | X794: 13 | Y794: 0 | Z794: 0 | AA794: 1213 | AB794: 740 | AC794: 163.91891891891891 | AD794: 52
A795: GOALKICKERS | W795: COBURG | X795: 10 | Y795: 3 | Z795: 0 | AA795: 1167 | AB795: 881 | AC795: 132.46311010215663 | AD795: 40
A796: BRUNSWICK | C796: CLUES 4 | F796: THORNTON 3 | I796: STANLEY 2 | L796: BAGLIN 2 | N796: ARMSTRONG | W796: OAKLEIGH | X796: 9 | Y796: 4 | Z796: 0 | AA796: 995 | AB796: 797 | AC796: 124.68671679197995 | AD796: 36
A797: SANDRINGHAM | C797: HISCOCK 2 | F797: GATES | H797: POTTER | J797: G JONES | L797: RUSSELL | W797: BRUNSWICK | X797: 8 | Y797: 5 | Z797: 0 | AA797: 908 | AB797: 771 | AC797: 117.8988326848249 | AD797: 32
A799: PRAHRAN | C799: 4 | D799: 3 | E799: =C799*6+D799 -> 27 | G799: 6 | H799: 3 | I799: =G799*6+H799 -> 39 | K799: 10 | L799: 7 | M799: =K799*6+L799 -> 67 | O799: 13 | P799: 8 | Q799: =O799*6+P799 -> 86 | S799: TOORAK PARK | W799: YARRAVILLE | X799: 8 | Y799: 5 | Z799: 0 | AA799: 974 | AB799: 939 | AC799: 103.72736954206603 | AD799: 32
A800: BOX HILL | C800: 2 | D800: 7 | E800: =C800*6+D800 -> 19 | G800: 4 | H800: 10 | I800: =G800*6+H800 -> 34 | K800: 6 | L800: 11 | M800: =K800*6+L800 -> 47 | O800: 9 | P800: 13 | Q800: =O800*6+P800 -> 67 | S800: BAGULEY | W800: CAMBERWELL | X800: 7 | Y800: 5 | Z800: 1 | AA800: 933 | AB800: 879 | AC800: 106.1433447098976 | AD800: 30
A801: BEST PLAYERS | W801: PRAHRAN | X801: 7 | Y801: 6 | Z801: 0 | AA801: 1020 | AB801: 1004 | AC801: 101.59362549800797 | AD801: 28
A802: PRAHRAN | C802: ARMSTRONG | F802: KINNABURGH | I802: HARVEY | K802: MORROW | N802: PLAIN | Q802: YATES | W802: NORTHCOTE | X802: 7 | Y802: 6 | Z802: 0 | AA802: 803 | AB802: 801 | AC802: 100.24968789013732 | AD802: 28
A803: BOX HILL | C803: IRVINE | F803: MORRIS | I803: WRIGHT | K803: GARDINER | N803: COGHLAN | Q803: H BLUNDY | W803: PRESTON | X803: 5 | Y803: 7 | Z803: 1 | AA803: 1021 | AB803: 1069 | AC803: 95.509822263797943 | AD803: 22
A804: GOALKICKERS | W804: MOORABBIN | X804: 5 | Y804: 8 | Z804: 0 | AA804: 811 | AB804: 899 | AC804: 90.211345939933253 | AD804: 20
A805: PRAHRAN | C805: HARVEY 6 | F805: KINNABURGH 3 | J805: MORROW | L805: ARMSTRONG | O805: HART | Q805: HOLLOW | W805: SANDRINGHAM | X805: 5 | Y805: 8 | Z805: 0 | AA805: 934 | AB805: 1047 | AC805: 89.207258834765994 | AD805: 20
A806: BOX HILL | C806: MAIDMENT 2 | F806: COGHLAN 2 | I806: JEFFERS 2 | L806: WEBB | N806: GREEN | P806: VANCE | W806: WILLIAMSTOWN | X806: 4 | Y806: 9 | Z806: 0 | AA806: 993 | AB806: 1056 | AC806: 94.034090909090907 | AD806: 16
W807: BOX HILL | X807: 2 | Y807: 11 | Z807: 0 | AA807: 833 | AB807: 1153 | AC807: 72.246313963573286 | AD807: 8
A808: NORTHCOTE | C808: 1 | D808: 3 | E808: =C808*6+D808 -> 9 | G808: 3 | H808: 7 | I808: =G808*6+H808 -> 25 | K808: 6 | L808: 9 | M808: =K808*6+L808 -> 45 | O808: 8 | P808: 15 | Q808: =O808*6+P808 -> 63 | S808: ELSTERNWICK PARK | W808: BRIGHTON | X808: 0 | Y808: 13 | Z808: 0 | AA808: 680 | AB808: 1249 | AC808: 54.443554843875098 | AD808: 0
A809: BRIGHTON | C809: 2 | D809: 7 | E809: =C809*6+D809 -> 19 | G809: 4 | H809: 10 | I809: =G809*6+H809 -> 34 | K809: 4 | L809: 10 | M809: =K809*6+L809 -> 34 | O809: 7 | P809: 10 | Q809: =O809*6+P809 -> 52 | S809: BOWDEN
A810: BEST PLAYERS
A811: NORTHCOTE | C811: DUFFIELD | F811: NOLAN | I811: WOOLNOUGH | L811: WHITE | N811: PURDON | Q811: WHITECHURCH
A812: BRIGHTON | C812: HALE | F812: HOWE | I812: BLACKMORE | L812: MARINI | N812: CONROY | Q812: FREEMAN
A813: GOALKICKERS
A814: NORTHCOTE | C814: DUFFIELD 4 | F814: NOLAN | H814: STABB | J814: WHITECHURCH | M814: GIBBS
A815: BRIGHTON | C815: HALE 4 | F815: HALL 2 | I815: MARINI
E816: 19TH JULY | I816: WEATHER | L816: LIGHT SHOWERS GROUNDS HEAVY & SLOPPY
A817: OAKLEIGH | C817: 2 | D817: 5 | E817: =C817*6+D817 -> 17 | G817: 5 | H817: 6 | I817: =G817*6+H817 -> 36 | K817: 6 | L817: 12 | M817: =K817*6+L817 -> 48 | O817: 7 | P817: 12 | Q817: =O817*6+P817 -> 54 | S817: YARRAVILLE
A818: YARRAVILLE | C818: 1 | D818: 4 | E818: =C818*6+D818 -> 10 | G818: 2 | H818: 7 | I818: =G818*6+H818 -> 19 | K818: 3 | L818: 8 | M818: =K818*6+L818 -> 26 | O818: 7 | P818: 11 | Q818: =O818*6+P818 -> 53 | S818: SMYTH
A819: BEST PLAYERS
A820: OAKLEIGH | C820: SCOTT | F820: VAINS | I820: W WILLIAMS | L820: WENN | N820: TINDAL | Q820: DALMANN
A821: YARRAVILLE | C821: HARGREAVES | F821: SMALLWOOD | I821: MASON | L821: LOWRIE | N821: GWYNNE | Q821: JONES
A822: GOALKICKERS
A823: OAKLEIGH | C823: WATSON 2 | F823: GUY | H823: SCOTT | J823: RICKERT | L823: EDWARDS | N823: WENN
A824: YARRAVILLE | C824: MASON 3 | F824: PHILLIPS 3 | I824: SEITZ
A826: PORT MELBOURNE | C826: 5 | D826: 3 | E826: =C826*6+D826 -> 33 | G826: 8 | H826: 6 | I826: =G826*6+H826 -> 54 | K826: 14 | L826: 7 | M826: =K826*6+L826 -> 91 | O826: 16 | P826: 12 | Q826: =O826*6+P826 -> 108 | S826: PRESTON
A827: PRESTON | C827: 2 | D827: 4 | E827: =C827*6+D827 -> 16 | G827: 5 | H827: 7 | I827: =G827*6+H827 -> 37 | K827: 6 | L827: 7 | M827: =K827*6+L827 -> 43 | O827: 7 | P827: 9 | Q827: =O827*6+P827 -> 51 | S827: CLEARY
A828: BEST PLAYERS
A829: PORT MELBOURNE | C829: JOHNSON | F829: MURRAY | I829: B MILLER | L829: BONNETT | O829: KELSEY | Q829: McDONALD
A830: PRESTON | C830: SWEET | F830: BRADFORD | I830: HENRYS | L830: HAYES | O830: FOLEY | Q830: GOLDIN
A831: GOALKICKERS
A832: PORT MELBOURNE | C832: B MILLER 4 | F832: WALSH 4 | I832: McDONALD 3 | L832: H TUCKER 3 | O832: MURRAY | Q832: BONNETT
A833: PRESTON | C833: HAYES 2 | F833: HARVEY | I833: GOLDIN | K833: DAWSON | M833: LALOR | O833: HUNTER
A835: COBURG | C835: 2 | D835: 2 | E835: =C835*6+D835 -> 14 | G835: 3 | H835: 4 | I835: =G835*6+H835 -> 22 | K835: 3 | L835: 5 | M835: =K835*6+L835 -> 23 | O835: 6 | P835: 9 | Q835: =O835*6+P835 -> 45 | S835: MOORABBIN
A836: MOORABBIN | C836: 0 | D836: 2 | E836: =C836*6+D836 -> 2 | G836: 3 | H836: 5 | I836: =G836*6+H836 -> 23 | K836: 4 | L836: 5 | M836: =K836*6+L836 -> 29 | O836: 5 | P836: 11 | Q836: =O836*6+P836 -> 41 | S836: MERRINGTON
A837: BEST PLAYERS
A838: COBURG | C838: CANNING | F838: EVANS | I838: LAMBERT | L838: McTAGGART | O838: MAHONEY | R838: CONDON
A839: MOORABBIN | C839: BOYD | F839: DICKENSON | I839: MUNYARD | L839: D'OLIVER | O839: STANLEY | R839: McKENZIE
A840: GOALKICKERS
A841: COBURG | C841: EVANS 2 | F841: McDONALD 2 | J841: JAMES | L841: STARBUCK
A842: MOORABBIN | C842: DALY 2 | F842: SUTHERLAND | J842: COAD | L842: DICKENSON
A844: CAMBERWELL | C844: 4 | D844: 2 | E844: =C844*6+D844 -> 26 | G844: 7 | H844: 6 | I844: =G844*6+H844 -> 48 | K844: 13 | L844: 8 | M844: =K844*6+L844 -> 86 | O844: 17 | P844: 9 | Q844: =O844*6+P844 -> 111 | S844: CAMBERWELL
A845: WILLIAMSTOWN | C845: 1 | D845: 2 | E845: =C845*6+D845 -> 8 | G845: 3 | H845: 6 | I845: =G845*6+H845 -> 24 | K845: 4 | L845: 10 | M845: =K845*6+L845 -> 34 | O845: 6 | P845: 12 | Q845: =O845*6+P845 -> 48 | S845: IRVING
A846: BEST PLAYERS
A847: CAMBERWELL | C847: HEDLEY | F847: BRADLEY | I847: FLETCHER | L847: BOHAN | O847: BEDFORD | R847: McFEE
A848: WILLIAMSTOWN | C848: WALKER | F848: G WILLIAMS | I848: W WILLIAMS | L848: MOLYNEUX | O848: DULLARD | R848: HOGAN
A849: GOALKICKERS
A850: CAMBERWELL | C850: BRADLEY 6 | F850: HEDLEY 4 | I850: MARIAN 2 | L850: DUFF 2 | N850: ROSENBROCK | Q850: McFEE | S850: BEDFORD
A851: WILLIAMSTOWN | C851: WALKER 3 | F851: W WILLIAMS | I851: MOLYNEUX | L851: DULLARD
A853: ROUND 14 | E853: 26TH JULY | J853: WEATHER | M853: SOUTH EAST WIND FINE | S853: PLAYED AT
D854: 1ST QTR | H854: 2ND QTR | L854: 3RD QTR | P854: FINAL | S854: BRUNSWICK
A855: BRUNSWICK | C855: 0 | D855: 1 | E855: =C855*6+D855 -> 1 | G855: 4 | H855: 8 | I855: =G855*6+H855 -> 32 | K855: 5 | L855: 9 | M855: =K855*6+L855 -> 39 | O855: 8 | P855: 16 | Q855: =O855*6+P855 -> 64 | S855: UMPIRE | X855: LADDER | AB855: ROUND | AD855: 14
A856: OAKLEIGH | C856: 6 | D856: 5 | E856: =C856*6+D856 -> 41 | G856: 6 | H856: 7 | I856: =G856*6+H856 -> 43 | K856: 6 | L856: 15 | M856: =K856*6+L856 -> 51 | O856: 6 | P856: 16 | Q856: =O856*6+P856 -> 52 | S856: MERRINGTON
A857: BEST PLAYERS | W857: TEAM | X857: W | Y857: L | Z857: D | AA857: FOR | AB857: AGST | AC857: % | AD857: PTS
A858: BRUNSWICK | C858: CLUES | F858: MORGAN | I858: STANLEY | L858: ROLFS | O858: WEIR | Q858: THORNTON
A859: OAKLEIGH | C859: W WILLAIMS | F859: LAMBERT | I859: WENN | L859: CUNNINGHAM | O859: TEMME | Q859: STREETER | W859: PORT MELBOURNE | X859: 13 | Y859: 1 | Z859: 0 | AA859: 1298 | AB859: 851 | AC859: 152.52643948296122 | AD859: 52
A860: GOALKICKERS | W860: COBURG | X860: 11 | Y860: 3 | Z860: 0 | AA860: 1257 | AB860: 902 | AC860: 139.35698447893569 | AD860: 44
A861: BRUNSWICK | C861: CLUES 3 | F861: THORNTON 2 | I861: STANLEY 2 | L861: WEIR | W861: OAKLEIGH | X861: 9 | Y861: 5 | Z861: 0 | AA861: 1047 | AB861: 861 | AC861: 121.6 | AD861: 36
A862: OAKLEIGH | C862: HILL 4 | F862: WENN | I862: STREETER | W862: BRUNSWICK | X862: 9 | Y862: 5 | Z862: 0 | AA862: 972 | AB862: 823 | AC862: 118.1 | AD862: 36
A864: COBURG | C864: 2 | D864: 7 | E864: =C864*6+D864 -> 19 | G864: 7 | H864: 10 | I864: =G864*6+H864 -> 52 | K864: 9 | L864: 16 | M864: =K864*6+L864 -> 70 | O864: 12 | P864: 18 | Q864: =O864*6+P864 -> 90 | S864: CAMBERWELL | W864: YARRAVILLE | X864: 9 | Y864: 5 | Z864: 0 | AA864: 1068 | AB864: 995 | AC864: 107.33668341708542 | AD864: 36
A865: CAMBERWELL | C865: 0 | D865: 0 | E865: =C865*6+D865 -> 0 | G865: 2 | H865: 1 | I865: =G865*6+H865 -> 13 | K865: 3 | L865: 1 | M865: =K865*6+L865 -> 19 | O865: 3 | P865: 3 | Q865: =O865*6+P865 -> 21 | S865: SMYTH | W865: PRAHRAN | X865: 8 | Y865: 6 | Z865: 0 | AA865: 1104 | AB865: 1053 | AC865: 104.84330484330485 | AD865: 32
A866: BEST PLAYERS | W866: CAMBERWELL | X866: 7 | Y866: 6 | Z866: 1 | AA866: 954 | AB866: 969 | AC866: 98.452012383900936 | AD866: 30
A867: COBURG | C867: R WILKINSON | F867: ROGAN | I867: CANNING | L867: SPARKS | N867: MAHONEY | Q867: EVANS | W867: NORTHCOTE | X867: 7 | Y867: 7 | Z867: 0 | AA867: 818 | AB867: 849 | AC867: 96.348645465253242 | AD867: 28
A868: CAMBERWELL | C868: BOHAN | F868: McFEE | I868: FLETCHER | L868: MASON | N868: CALLAHAN | Q868: BENBOW | W868: MOORABBIN | X868: 6 | Y868: 8 | Z868: 0 | AA868: 859 | AB868: 914 | AC868: 93.982494529540475 | AD868: 24
A869: GOALKICKERS | W869: SANDRINGHAM | X869: 6 | Y869: 8 | Z869: 0 | AA869: 994 | AB869: 1093 | AC869: 90.942360475754796 | AD869: 24
A870: COBURG | C870: K McODNALD 4 | F870: ROGAN 3 | I870: H WILKINSON 2 | M870: CANNING | O870: BULMAN | Q870: McTAGGART | W870: PRESTON | X870: 5 | Y870: 8 | Z870: 1 | AA870: 1070 | AB870: 1153 | AC870: 92.801387684301815 | AD870: 22
A871: CAMBERWELL | C871: BRADLEY | F871: McFEE | I871: THYNNE | W871: WILLIAMSTOWN | X871: 5 | Y871: 9 | Z871: 0 | AA871: 1104 | AB871: 1141 | AC871: 96.757230499561786 | AD871: 20
W872: BOX HILL | X872: 2 | Y872: 12 | Z872: 0 | AA872: 889 | AB872: 1247 | AC872: 71.291098636728151 | AD872: 8
A873: PRAHRAN | C873: 3 | D873: 3 | E873: =C873*6+D873 -> 21 | G873: 5 | H873: 3 | I873: =G873*6+H873 -> 33 | K873: 8 | L873: 4 | M873: =K873*6+L873 -> 52 | O873: 13 | P873: 6 | Q873: =O873*6+P873 -> 84 | S873: PRESTON | W873: BRIGHTON | X873: 0 | Y873: 14 | Z873: 0 | AA873: 726 | AB873: 1309 | AC873: 55.462184873949582 | AD873: 0
A874: PRESTON | C874: 2 | D874: 4 | E874: =C874*6+D874 -> 16 | G874: 3 | H874: 8 | I874: =G874*6+H874 -> 26 | K874: 6 | L874: 12 | M874: =K874*6+L874 -> 48 | O874: 6 | P874: 13 | Q874: =O874*6+P874 -> 49 | S874: IRVING
A875: BEST PLAYERS
A876: PRAHRAN | C876: MORROW | F876: ARMSTRONG | I876: YATES | K876: WALSH | N876: CAMPBELL | Q876: KINNABURGH
A877: PRESTON | C877: BRADFORD | F877: LALOR | I877: DAWSON | K877: HARRISON | N877: GOLDIN | Q877: HAYES
A878: GOALKICKERS
A879: PRAHRAN | C879: MORROW 5 | F879: ARMSTRONG 3 | J879: KINNABURGH 2 | N879: HART | P879: HARVEY | R879: WALSH
A880: PRESTON | C880: LALOR 2 | F880: GOLDIN | I880: CANN | K880: BRADFORD | N880: HUNTINGTON
A882: MOORABBIN | C882: 3 | D882: 0 | E882: =C882*6+D882 -> 18 | G882: 4 | H882: 3 | I882: =G882*6+H882 -> 27 | K882: 4 | L882: 5 | M882: =K882*6+L882 -> 29 | O882: 7 | P882: 6 | Q882: =O882*6+P882 -> 48 | S882: MOORABBIN
A883: NORTHCOTE | C883: 0 | D883: 1 | E883: =C883*6+D883 -> 1 | G883: 0 | H883: 1 | I883: =G883*6+H883 -> 1 | K883: 0 | L883: 3 | M883: =K883*6+L883 -> 3 | O883: 2 | P883: 3 | Q883: =O883*6+P883 -> 15 | S883: CLEARY
A884: BEST PLAYERS
A885: MOORABBIN | C885: BOYD | F885: ANTONIE | I885: D'OLIVER | K885: DICKENSON | N885: STANLEY | Q885: JONES
A886: NORTHCOTE | C886: KNOWLES | F886: PAYNTER | I886: HARTLEY | K886: WHITECHURCH | N886: STABB | Q886: POWELL
A887: GOALKICKERS
A888: MOORABBIN | C888: SUTHERLAND 2 | F888: COAD 2 | I888: JONES | K888: DICKENSON | N888: DALY
A889: NORTHCOTE | C889: DUFFIELD | F889: KNOWLES
A891: SANDRINGHAM | C891: 4 | D891: 3 | E891: =C891*6+D891 -> 27 | G891: 4 | H891: 3 | I891: =G891*6+H891 -> 27 | K891: 7 | L891: 5 | M891: =K891*6+L891 -> 47 | O891: 9 | P891: 6 | Q891: =O891*6+P891 -> 60 | S891: ELSTERNWICK PARK
A892: BRIGHTON | C892: 1 | D892: 2 | E892: =C892*6+D892 -> 8 | G892: 3 | H892: 7 | I892: =G892*6+H892 -> 25 | K892: 4 | L892: 7 | M892: =K892*6+L892 -> 31 | O892: 6 | P892: 10 | Q892: =O892*6+P892 -> 46 | S892: BOWDEN
A893: BEST PLAYERS
A894: SANDRINGHAM | C894: SCANLON | F894: WALKER | I894: BOURKE | L894: RUSSELL | N894: WOODS | Q894: GUILLE
A895: BRIGHTON | C895: CONROY | F895: BLACKMORE | I895: HOWE | L895: MARINI | N895: PLUNKETT | Q895: K EMBLETON
A896: GOALKICKERS
A897: SANDRINGHAM | C897: HISCOCK 4 | F897: GATES 2 | I897: RUSSELL | K897: WOODS | M897: HARVIE
A898: BRIGHTON | C898: CONROY 2 | F898: HOWE | H898: K EMBLETON | K898: O'MEARA | M898: HALE
A900: YARRAVILLE | C900: 4 | D900: 2 | E900: =C900*6+D900 -> 26 | G900: 6 | H900: 6 | I900: =G900*6+H900 -> 42 | K900: 13 | L900: 8 | M900: =K900*6+L900 -> 86 | O900: 14 | P900: 10 | Q900: =O900*6+P900 -> 94 | S900: YARRAVILLE
A901: BOX HILL | C901: 3 | D901: 2 | E901: =C901*6+D901 -> 20 | G901: 3 | H901: 6 | I901: =G901*6+H901 -> 24 | K901: 5 | L901: 6 | M901: =K901*6+L901 -> 36 | O901: 8 | P901: 8 | Q901: =O901*6+P901 -> 56 | S901: RICHARDSON
A902: BEST PLAYERS
A903: YARRAVILLE | C903: JONES | E903: GWYNNE | H903: PHILLIPS | K903: MURPHY | N903: ELDRIDGE | Q903: MASON
A904: BOX HILL | C904: IRVINE | E904: VANCE | H904: H BLUNDY | K904: MORRIS | N904: PARKS | Q904: GARDINER
A905: GOALKICKERS
A906: YARRAVILLE | C906: PHILLIPS 3 | E906: WAGHORNE 2 | H906: HARGREAVES 2 | K906: MASON 2 | M906: LOWRIE | O906: ELDRIDGE | Q906: HUGHES | S906: VANDERFEEN | W906: MITCHELL
A907: BOX HILL | C907: VANCE 2 | F907: MORRIS 2 | I907: GREEN | K907: KRONK | M907: WEBB | O907: COGHLAN
A909: WILLIAMSTOWN | C909: 2 | D909: 1 | E909: =C909*6+D909 -> 13 | G909: 8 | H909: 6 | I909: =G909*6+H909 -> 54 | K909: 9 | L909: 7 | M909: =K909*6+L909 -> 61 | O909: 16 | P909: 15 | Q909: =O909*6+P909 -> 111 | S909: PORT MELBOURNE
A910: PORT MELBOURNE | C910: 4 | D910: 9 | E910: =C910*6+D910 -> 33 | G910: 4 | H910: 11 | I910: =G910*6+H910 -> 35 | K910: 9 | L910: 19 | M910: =K910*6+L910 -> 73 | O910: 11 | P910: 19 | Q910: =O910*6+P910 -> 85 | S910: HARWOOD
A911: BEST PLAYERS
A912: WILLIAMSTOWN | C912: WALKER | F912: HARLEY | I912: H SIMPSON | L912: MUNDAY | O912: ROGERS | R912: HOGAN
A913: PORT MELBOURNE | C913: B MILLER | F913: CROFT | I913: MURRAY | L913: LAFFEY | O913: OWENS | R913: ATKINSON
A914: GOALKICKERS
A915: WILLIAMSTOWN | C915: WALKER 8 | F915: SMITH 2 | I915: HARLEY 2 | L915: J SIMPSON | N915: MOLYNEUX | Q915: SHEAHAN | T915: DULLARD
A916: PORT MELBOURNE | C916: A MILLER 3 | F916: LEEHANE 2 | I916: H TUCKER 2 | L916: CROFT | N916: OWENS | P916: ATKINSON | S916: SYKES
A918: ROUND 15 | E918: 2ND AUGUST | I918: WEATHER | L918: NO WIND DULL RAIN GROUNDS HEAVY | S918: PLAYED AT
D919: 1ST QTR | H919: 2ND QTR | L919: 3RD QTR | P919: FINAL | S919: COBURG
A920: COBURG | C920: 2 | D920: 4 | E920: =C920*6+D920 -> 16 | G920: 5 | H920: 10 | I920: =G920*6+H920 -> 40 | K920: 7 | L920: 11 | M920: =K920*6+L920 -> 53 | O920: 9 | P920: 11 | Q920: =O920*6+P920 -> 65 | S920: UMPIRE | X920: LADDER | AB920: ROUND | AD920: 15
A921: PORT MELBOURNE | C921: 1 | D921: 3 | E921: =C921*6+D921 -> 9 | G921: 3 | H921: 4 | I921: =G921*6+H921 -> 22 | K921: 5 | L921: 7 | M921: =K921*6+L921 -> 37 | O921: 6 | P921: 8 | Q921: =O921*6+P921 -> 44 | S921: SMYTH
A922: BEST PLAYERS | W922: TEAM | X922: W | Y922: L | Z922: D | AA922: FOR | AB922: AGST | AC922: % | AD922: PTS
A923: COBURG | C923: EQUID | F923: McTAGGART | I923: R WILKINSON | L923: FEWKES | O923: ROGAN | Q923: EVANS
A924: PORT MELBOURNE | C924: JOHNSON | F924: WILSON | I924: MURRAY | L924: B MILLER | O924: RAMSAY | Q924: CROFT | W924: PORT MELBOURNE | X924: 13 | Y924: 2 | Z924: 0 | AA924: 1342 | AB924: 916 | AC924: 146.50655021834061 | AD924: 52
A925: GOALKICKERS | W925: COBURG | X925: 12 | Y925: 3 | Z925: 0 | AA925: 1322 | AB925: 946 | AC925: 139.7463002114165 | AD925: 48
A926: COBURG | C926: McDONALD 3 | F926: ROGAN 2 | I926: EVANS | K926: H WILKINSON | N926: JAMES | W926: OAKLEIGH | X926: 10 | Y926: 5 | Z926: 0 | AA926: 1122 | AB926: 911 | AC926: 123.16 | AD926: 40
A927: PORT MELBOURNE | C927: MURRAY 3 | F927: BONNETT | I927: RAMSAY | K927: JOHNSON | W927: BRUNSWICK | X927: 10 | Y927: 5 | Z927: 0 | AA927: 1049 | AB927: 878 | AC927: 119.48 | AD927: 40
A929: PRAHRAN | C929: 3 | D929: 1 | E929: =C929*6+D929 -> 19 | G929: 5 | H929: 8 | I929: =G929*6+H929 -> 38 | K929: 9 | L929: 10 | M929: =K929*6+L929 -> 64 | O929: 10 | P929: 12 | Q929: =O929*6+P929 -> 72 | S929: TOORAK PARK | W929: PRAHRAN | X929: 9 | Y929: 6 | Z929: 0 | AA929: 1176 | AB929: 1101 | AC929: 106.81198910081744 | AD929: 36
A930: YARRAVILLE | C930: 4 | D930: 4 | E930: =C930*6+D930 -> 28 | G930: 5 | H930: 4 | I930: =G930*6+H930 -> 34 | K930: 7 | L930: 5 | M930: =K930*6+L930 -> 47 | O930: 7 | P930: 6 | Q930: =O930*6+P930 -> 48 | S930: HARWOOD | W930: YARRAVILLE | X930: 9 | Y930: 6 | Z930: 0 | AA930: 1116 | AB930: 1067 | AC930: 104.59231490159326 | AD930: 36
A931: BEST PLAYERS | W931: CAMBERWELL | X931: 8 | Y931: 6 | Z931: 1 | AA931: 1046 | AB931: 1031 | AC931: 101.45489815712899 | AD931: 34
A932: PRAHRAN | C932: KINNABURGH | F932: CAMPBELL | I932: ARMSTRONG | L932: COLLS | O932: HARVEY | Q932: JONES | W932: MOORABBIN | X932: 7 | Y932: 8 | Z932: 0 | AA932: 952 | AB932: 985 | AC932: 96.649746192893403 | AD932: 28
A933: YARRAVILLE | C933: JONES | F933: PHILLIPS | I933: VANDERFEEN | L933: CRANAGE | O933: MASON | Q933: MURPHY | W933: NORTHCOTE | X933: 7 | Y933: 8 | Z933: 0 | AA933: 880 | AB933: 941 | AC933: 93.517534537725822 | AD933: 28
A934: GOALKICKERS | W934: WILLIAMSTOWN | X934: 6 | Y934: 9 | Z934: 0 | AA934: 1223 | AB934: 1216 | AC934: 100.57565789473684 | AD934: 24
A935: PRAHRAN | C935: HART 2 | E935: HARVEY 2 | H935: KINNABURGH 2 | K935: MORROW | M935: LOUREY | O935: ARMSTRONG | R935: McCULLOCH | W935: SANDRINGHAM | X935: 6 | Y935: 9 | Z935: 0 | AA935: 1065 | AB935: 1186 | AC935: 89.797639123102869 | AD935: 24
A936: YARRAVILLE | C936: WAGHORNE 2 | F936: MASON 2 | I936: PHILLIPS | L936: HUGHES | N936: COOK | W936: PRESTON | X936: 5 | Y936: 9 | Z936: 1 | AA936: 1145 | AB936: 1272 | AC936: 90.015723270440247 | AD936: 22
W937: BOX HILL | X937: 2 | Y937: 13 | Z937: 0 | AA937: 944 | AB937: 1316 | AC937: 71.732522796352583 | AD937: 8
A938: CAMBERWELL | C938: 3 | D938: 6 | E938: =C938*6+D938 -> 24 | G938: 7 | H938: 8 | I938: =G938*6+H938 -> 50 | K938: 10 | L938: 12 | M938: =K938*6+L938 -> 72 | O938: 13 | P938: 14 | Q938: =O938*6+P938 -> 92 | S938: NORTHCOTE | W938: BRIGHTON | X938: 0 | Y938: 15 | Z938: 0 | AA938: 776 | AB938: 1384 | AC938: 56.07 | AD938: 0
A939: NORTHCOTE | C939: 1 | D939: 2 | E939: =C939*6+D939 -> 8 | G939: 2 | H939: 7 | I939: =G939*6+H939 -> 19 | K939: 5 | L939: 11 | M939: =K939*6+L939 -> 41 | O939: 8 | P939: 14 | Q939: =O939*6+P939 -> 62 | S939: RICHARDSON
A940: BEST PLAYERS
A941: CAMBERWELL | C941: BOHAN | F941: HEDLEY | I941: BEDFORD | L941: McFEE | O941: HAYES | Q941: MASON
A942: NORTHCOTE | C942: COLLINS | F942: FARRELL | I942: WOOLNOUGH | L942: WHITECHURCH | O942: NOLAN | Q942: ALDRIDGE
A943: GOALKICKERS
A944: CAMBERWELL | C944: HEDLEY 4 | F944: BRADLEY 3 | I944: McFEE 3 | K944: THYNNE | M944: HAYES | O944: YOUNG
A945: NORTHCOTE | C945: WOOLNOUGH 4 | F945: NOLAN | H945: NEWTON | J945: KNOWLES | M945: ALDRIDGE
A947: MOORABBIN | C947: 4 | D947: 1 | E947: =C947*6+D947 -> 25 | G947: 7 | H947: 4 | I947: =G947*6+H947 -> 46 | K947: 9 | L947: 10 | M947: =K947*6+L947 -> 64 | O947: 13 | P947: 15 | Q947: =O947*6+P947 -> 93 | S947: BEACH ROAD
A948: SANDRINGHAM | C948: 2 | D948: 2 | E948: =C948*6+D948 -> 14 | G948: 6 | H948: 5 | I948: =G948*6+H948 -> 41 | K948: 7 | L948: 5 | M948: =K948*6+L948 -> 47 | O948: 10 | P948: 11 | Q948: =O948*6+P948 -> 71 | S948: IRVING
A949: BEST PLAYERS
A950: MOORABBIN | C950: REID | F950: MUNYARD | I950: JONES | L950: STANLEY | N950: BOYD | Q950: D'OLIVER
A951: SANDRINGHAM | C951: SCANLON | F951: HANMAN | I951: G JONES | L951: SHEARS | N951: GUILLE | Q951: WALKER
A952: GOALKICKERS
A953: MOORABBIN | C953: REID 4 | F953: COPSEY 3 | I953: DICKENSON 2 | L953: COAD 2 | N953: MUNYARD | Q953: BROWN
A954: SANDRINGHAM | C954: HISCOCK 3 | F954: G JONES 3 | I954: WRIGHT-SMITH | L954: GATES | N954: JOSEPH | P954: N JONES
A956: WILLIAMSTOWN | C956: 4 | D956: 3 | E956: =C956*6+D956 -> 27 | G956: 11 | H956: 5 | I956: =G956*6+H956 -> 71 | K956: 15 | L956: 8 | M956: =K956*6+L956 -> 98 | O956: 18 | P956: 11 | Q956: =O956*6+P956 -> 119 | S956: WILLIAMSTOWN
A957: PRESTON | C957: 1 | D957: 2 | E957: =C957*6+D957 -> 8 | G957: 5 | H957: 4 | I957: =G957*6+H957 -> 34 | K957: 7 | L957: 7 | M957: =K957*6+L957 -> 49 | O957: 11 | P957: 9 | Q957: =O957*6+P957 -> 75 | S957: CLEARY
A958: BEST PLAYERS
A959: WILLIAMSTOWN | C959: H SIMPSON | F959: B WILLIAMS | I959: WALKER | L959: MOLYNEUX | O959: G WILLIAMS | R959: HARLEY
A960: PRESTON | C960: SWEET | F960: LALOR | I960: McLACHLAN | L960: PRITCHARD | O960: HAYES | R960: DEACON
A961: GOALKICKERS
A962: WILLIAMSTOWN | C962: WALKER 6 | F962: MOLYNEUX 3 | I962: B WILLIAMS 3 | L962: H SIMPSON 2 | O962: DULLARD | Q962: HARLEY | S962: MARTIN | U962: J SIMPSON
A963: PRESTON | C963: GOLDIN 2 | F963: BATEMAN 2 | I963: HAYES 2 | L963: HUNTINGTON 2 | O963: LALOR | Q963: K CHARD | T963: BRADFORD
A965: BRUNSWICK | C965: 1 | D965: 1 | E965: =C965*6+D965 -> 7 | G965: 3 | H965: 4 | I965: =G965*6+H965 -> 22 | K965: 5 | L965: 5 | M965: =K965*6+L965 -> 35 | O965: 10 | P965: 9 | Q965: =O965*6+P965 -> 69 | S965: BOX HILL
A966: BOX HILL | C966: 1 | D966: 3 | E966: =C966*6+D966 -> 9 | G966: 6 | H966: 4 | I966: =G966*6+H966 -> 40 | K966: 8 | L966: 7 | M966: =K966*6+L966 -> 55 | O966: 8 | P966: 7 | Q966: =O966*6+P966 -> 55 | S966: BAGULEY
A967: BEST PLAYERS
A968: BRUNSWICK | C968: CLUES | F968: SEYMOUR | I968: NEILSON | L968: STANLEY | N968: THORNTON | Q968: ROLFS
A969: BOX HILL | C969: GARDINER | F969: MORRIS | I969: MAIDMENT | L969: O'CONNELL | N969: ANDERSON | Q969: KRONK
A970: GOALKICKERS
A971: BRUNSWICK | C971: STANLEY 5 | F971: THORNTON 2 | I971: MAHER | K971: CLUES | M971: NEILSON
A972: BOX HILL | C972: WEBB 3 | F972: GARDINER 2 | I972: MORRIS 2 | L972: MAIDMENT
A974: OAKLEIGH | C974: 1 | D974: 5 | E974: =C974*6+D974 -> 11 | G974: 4 | H974: 9 | I974: =G974*6+H974 -> 33 | K974: 7 | L974: 13 | M974: =K974*6+L974 -> 55 | O974: 10 | P974: 15 | Q974: =O974*6+P974 -> 75 | S974: OAKLEIGH
A975: BRIGHTON | C975: 0 | D975: 0 | E975: =C975*6+D975 -> 0 | G975: 2 | H975: 3 | I975: =G975*6+H975 -> 15 | K975: 3 | L975: 6 | M975: =K975*6+L975 -> 24 | O975: 7 | P975: 8 | Q975: =O975*6+P975 -> 50 | S975: BOWDEN
A976: BEST PLAYERS
A977: OAKLEIGH | C977: TEMME | F977: CUNNINGHAM | I977: LAMBERT | L977: TINDAL | N977: WENN | Q977: HILL
A978: BRIGHTON | C978: TURNER | F978: BLACKMORE | I978: HARDY | L978: HOWE | N978: PLUNKETT | Q978: DAVIDSON
A979: GOALKICKERS
A980: OAKLEIGH | C980: EDWARDS 3 | F980: WENN 2 | I980: HILL 2 | K980: STREETER | N980: BAXTER | P980: CUNNINGHAM
A981: BRIGHTON | C981: HARDY 3 | F981: HOWE | H981: BURKE | J981: PICKERING | M981: TURNER
A983: ROUND 16 | E983: 9TH AUGUST | J983: WEATHER | M983: NORTH WEST WIND FINE | S983: PLAYED AT
D984: 1ST QTR | H984: 2ND QTR | L984: 3RD QTR | P984: FINAL | S984: BRUNSWICK
A985: BRUNSWICK | C985: 4 | D985: 4 | E985: =C985*6+D985 -> 28 | G985: 4 | H985: 5 | I985: =G985*6+H985 -> 29 | K985: 11 | L985: 7 | M985: =K985*6+L985 -> 73 | O985: 11 | P985: 8 | Q985: =O985*6+P985 -> 74 | S985: UMPIRE | X985: LADDER | AB985: ROUND | AD985: 16
A986: PRAHRAN | C986: 1 | D986: 1 | E986: =C986*6+D986 -> 7 | G986: 4 | H986: 8 | I986: =G986*6+H986 -> 32 | K986: 5 | L986: 11 | M986: =K986*6+L986 -> 41 | O986: 9 | P986: 13 | Q986: =O986*6+P986 -> 67 | S986: SMYTH
A987: BEST PLAYERS | W987: TEAM | X987: W | Y987: L | Z987: D | AA987: FOR | AB987: AGST | AC987: % | AD987: PTS
A988: BRUNSWICK | C988: NEILSON | F988: PARKER | I988: CULLY | L988: STANLEY | N988: SEYMOUR | Q988: POLLARD
A989: PRAHRAN | C989: ARMSTRONG | F989: JONES | I989: BUTLING | L989: PLAIN | N989: MORONE | Q989: YATES | W989: PORT MELBOURNE | X989: 14 | Y989: 2 | Z989: 0 | AA989: 1426 | AB989: 973 | AC989: 146.55704008221994 | AD989: 56
A990: GOALKICKERS | W990: COBURG | X990: 13 | Y990: 3 | Z990: 0 | AA990: 1388 | AB990: 1001 | AC990: 138.66133866133868 | AD990: 52
A991: BRUNSWICK | C991: THORNTON 4 | F991: STANLEY | I991: WEIR | J991: MULLENGER | M991: LOVETT | O991: SEYMOUR | Q991: WALSH | S991: CULLY | W991: OAKLEIGH | X991: 11 | Y991: 5 | Z991: 0 | AA991: 1207 | AB991: 958 | AC991: 125.99 | AD991: 44
A992: PRAHRAN | C992: McCULLOCH 3 | F992: MORROW 2 | I992: HART | K992: WALSH | M992: LOUREY | O992: JONES | W992: BRUNSWICK | X992: 11 | Y992: 5 | Z992: 0 | AA992: 1115 | AB992: 945 | AC992: 117.99 | AD992: 44
A994: OAKLEIGH | C994: 5 | D994: 3 | E994: =C994*6+D994 -> 33 | G994: 9 | H994: 3 | I994: =G994*6+H994 -> 57 | K994: 10 | L994: 6 | M994: =K994*6+L994 -> 66 | O994: 12 | P994: 13 | Q994: =O994*6+P994 -> 85 | S994: MOORABBIN | W994: CAMBERWELL | X994: 9 | Y994: 6 | Z994: 1 | AA994: 1122 | AB994: 1087 | AC994: 103.21987120515179 | AD994: 38
A995: MOORABBIN | C995: 3 | D995: 0 | E995: =C995*6+D995 -> 18 | G995: 5 | H995: 1 | I995: =G995*6+H995 -> 31 | K995: 6 | L995: 4 | M995: =K995*6+L995 -> 40 | O995: 7 | P995: 5 | Q995: =O995*6+P995 -> 47 | S995: HARWOOD | W995: PRAHRAN | X995: 9 | Y995: 7 | Z995: 0 | AA995: 1243 | AB995: 1175 | AC995: 105.78723404255319 | AD995: 36
A996: BEST PLAYERS | W996: YARRAVILLE | X996: 9 | Y996: 7 | Z996: 0 | AA996: 1156 | AB996: 1166 | AC996: 99.142367066895375 | AD996: 36
A997: OAKLEIGH | C997: W WILLIAMS | F997: SAVORY | I997: TEMME | L997: GUY | N997: WATSON | Q997: LAMBERT | W997: MOORABBIN | X997: 7 | Y997: 9 | Z997: 0 | AA997: 999 | AB997: 1070 | AC997: 93.364485981308405 | AD997: 28
A998: MOORABBIN | C998: GILDER | F998: REID | I998: STANLEY | L998: DALY | N998: COAD | Q998: COPSEY | W998: NORTHCOTE | X998: 7 | Y998: 9 | Z998: 0 | AA998: 937 | AB998: 1025 | AC998: 91.41463414634147 | AD998: 28
A999: GOALKICKERS | W999: PRESTON | X999: 6 | Y999: 9 | Z999: 1 | AA999: 1244 | AB999: 1312 | AC999: 94.817073170731703 | AD999: 26
A1000: OAKLEIGH | C1000: WATSON 6 | F1000: STREETER 2 | I1000: WENN 2 | K1000: SAVORY | M1000: LAMBERT | W1000: WILLIAMSTOWN | X1000: 6 | Y1000: 10 | Z1000: 0 | AA1000: 1278 | AB1000: 1282 | AC1000: 99.68798751950078 | AD1000: 24
A1001: MOORABBIN | C1001: COAD 4 | F1001: DALY 2 | I1001: REID | W1001: SANDRINGHAM | X1001: 6 | Y1001: 10 | Z1001: 0 | AA1001: 1121 | AB1001: 1262 | AC1001: 88.827258320126788 | AD1001: 24
W1002: BOX HILL | X1002: 2 | Y1002: 14 | Z1002: 0 | AA1002: 984 | AB1002: 1371 | AC1002: 71.772428884026255 | AD1002: 8
A1003: PORT MELBOURNE | C1003: 3 | D1003: 6 | E1003: =C1003*6+D1003 -> 24 | G1003: 4 | H1003: 7 | I1003: =G1003*6+H1003 -> 31 | K1003: 9 | L1003: 15 | M1003: =K1003*6+L1003 -> 69 | O1003: 11 | P1003: 18 | Q1003: =O1003*6+P1003 -> 84 | S1003: PORT MELBOURNE | W1003: BRIGHTON | X1003: 1 | Y1003: 15 | Z1003: 0 | AA1003: 831 | AB1003: 1424 | AC1003: 58.36 | AD1003: 4
A1004: NORTHCOTE | C1004: 2 | D1004: 0 | E1004: =C1004*6+D1004 -> 12 | G1004: 6 | H1004: 5 | I1004: =G1004*6+H1004 -> 41 | K1004: 7 | L1004: 5 | M1004: =K1004*6+L1004 -> 47 | O1004: 8 | P1004: 9 | Q1004: =O1004*6+P1004 -> 57 | S1004: IRVING
A1005: BEST PLAYERS
A1006: PORT MELBOURNE | C1006: JOHNSON | F1006: B MILLER | I1006: STOREY | L1006: H TUCKER | O1006: WILSON | Q1006: CROFT
A1007: NORTHCOTE | C1007: PAWSEY | F1007: NOLAN | I1007: WHITECHURCH | L1007: DEANS | O1007: FARRELL | Q1007: ALDRIDGE
A1008: GOALKICKERS
A1009: PORT MELBOURNE | C1009: B MILLER 4 | F1009: BONNETT 3 | I1009: ATKINSON | L1009: RAMSAY | N1009: AUSTIN | P1009: SYKES
A1010: NORTHCOTE | C1010: PAWSEY 3 | F1010: PURDEN 2 | I1010: NEWTON | L1010: STAFFORD | N1010: GIBBS
A1012: COBURG | C1012: 3 | D1012: 4 | E1012: =C1012*6+D1012 -> 22 | G1012: 3 | H1012: 6 | I1012: =G1012*6+H1012 -> 24 | K1012: 5 | L1012: 9 | M1012: =K1012*6+L1012 -> 39 | O1012: 9 | P1012: 12 | Q1012: =O1012*6+P1012 -> 66 | S1012: WILLIAMSTOWN
A1013: WILLIAMSTOWN | C1013: 1 | D1013: 3 | E1013: =C1013*6+D1013 -> 9 | G1013: 2 | H1013: 7 | I1013: =G1013*6+H1013 -> 19 | K1013: 4 | L1013: 10 | M1013: =K1013*6+L1013 -> 34 | O1013: 7 | P1013: 13 | Q1013: =O1013*6+P1013 -> 55 | S1013: BOWDEN
A1014: BEST PLAYERS
A1015: COBURG | C1015: ROGAN | F1015: McTAGGART | I1015: CANNING | L1015: C WALKER | O1015: H WILKINSON | R1015: R WILKINSON
A1016: WILLIAMSTOWN | C1016: G WILLIAMS | F1016: B WILLIAMS | I1016: ALLANSON | L1016: MOLYNEUX | O1016: WALKER | R1016: MUNDAY
A1017: GOALKICKERS
A1018: COBURG | C1018: ROGAN 3 | F1018: CANNING 2 | I1018: H WILKINSON 2 | M1018: McDONALD | P1018: EVANS
A1019: WILLIAMSTOWN | C1019: WALKER 5 | F1019: SMITH | I1019: WOOKEY
A1021: BRIGHTON | C1021: 2 | D1021: 1 | E1021: =C1021*6+D1021 -> 13 | G1021: 2 | H1021: 4 | I1021: =G1021*6+H1021 -> 16 | K1021: 6 | L1021: 8 | M1021: =K1021*6+L1021 -> 44 | O1021: 7 | P1021: 13 | Q1021: =O1021*6+P1021 -> 55 | S1021: ELSTERNWICK PARK
A1022: BOX HILL | C1022: 2 | D1022: 1 | E1022: =C1022*6+D1022 -> 13 | G1022: 3 | H1022: 4 | I1022: =G1022*6+H1022 -> 22 | K1022: 4 | L1022: 8 | M1022: =K1022*6+L1022 -> 32 | O1022: 5 | P1022: 10 | Q1022: =O1022*6+P1022 -> 40 | S1022: RICHARDSON
A1023: BEST PLAYERS
A1024: BRIGHTON | C1024: PERKINS | F1024: BURRELL | I1024: FREEMAN | L1024: HOWE | N1024: DAYKIN | Q1024: HALE
A1025: BOX HILL | C1025: PARKS | F1025: HOUGHTON | I1025: W BLUNDY | L1025: HEALY | N1025: COGHLAN | Q1025: IRVINE
A1026: GOALKICKERS
A1027: BRIGHTON | C1027: HARDY 2 | F1027: O'MEARA 2 | I1027: HALE 2 | K1027: BURRELL
A1028: BOX HILL | C1028: COGHLAN 3 | F1028: W BLUNDY 2
A1030: CAMBERWELL | C1030: 8 | D1030: 4 | E1030: =C1030*6+D1030 -> 52 | G1030: 10 | H1030: 5 | I1030: =G1030*6+H1030 -> 65 | K1030: 11 | L1030: 8 | M1030: =K1030*6+L1030 -> 74 | O1030: 11 | P1030: 10 | Q1030: =O1030*6+P1030 -> 76 | S1030: CAMBERWELL
A1031: SANDRINGHAM | C1031: 0 | D1031: 1 | E1031: =C1031*6+D1031 -> 1 | G1031: 5 | H1031: 5 | I1031: =G1031*6+H1031 -> 35 | K1031: 6 | L1031: 6 | M1031: =K1031*6+L1031 -> 42 | O1031: 8 | P1031: 8 | Q1031: =O1031*6+P1031 -> 56 | S1031: CLEARY
A1032: BEST PLAYERS
A1033: CAMBERWELL | C1033: KILBY | F1033: YOUNG | I1033: BOHAN | L1033: DUFF | N1033: BENBOW | Q1033: BRADLEY
A1034: SANDRINGHAM | C1034: G JONES | F1034: RUSSELL | I1034: SHIPP | L1034: GUILLE | N1034: SCANLON | Q1034: BOURKE
A1035: GOALKICKERS
A1036: CAMBERWELL | C1036: BRADLEY 3 | F1036: HAYES 2 | I1036: DUFF 2 | K1036: HEDLEY | M1036: KILBY | O1036: ALLEN | Q1036: YOUNG
A1037: SANDRINGHAM | C1037: RUSSELL 2 | F1037: POTTER 2 | I1037: G JONES | K1037: B HARPER | M1037: HISCOCK | O1037: HANMAN
A1039: PRESTON | C1039: 2 | D1039: 1 | E1039: =C1039*6+D1039 -> 13 | G1039: 5 | H1039: 5 | I1039: =G1039*6+H1039 -> 35 | K1039: 9 | L1039: 8 | M1039: =K1039*6+L1039 -> 62 | O1039: 14 | P1039: 15 | Q1039: =O1039*6+P1039 -> 99 | S1039: PRESTON
A1040: YARRAVILLE | C1040: 2 | D1040: 6 | E1040: =C1040*6+D1040 -> 18 | G1040: 3 | H1040: 6 | I1040: =G1040*6+H1040 -> 24 | K1040: 3 | L1040: 9 | M1040: =K1040*6+L1040 -> 27 | O1040: 5 | P1040: 10 | Q1040: =O1040*6+P1040 -> 40 | S1040: BAGULEY
A1041: BEST PLAYERS
A1042: PRESTON | C1042: HENRYS | F1042: GOLDIN | I1042: SWEET | K1042: PRITCHARD | N1042: LALOR | Q1042: BRADFORD
A1043: YARRAVILLE | C1043: COOK | F1043: MITCHELL | I1043: JONES | K1043: SEITZ | N1043: BODSWORTH | Q1043: PHILLIPS
A1044: GOALKICKERS
A1045: PRESTON | C1045: LALOR 3 | F1045: BRADFORD 3 | I1045: DEACON 3 | L1045: GOLDIN 2 | N1045: HAYES | P1045: BATEMAN | S1045: CANN
A1046: YARRAVILLE | C1046: PHILLIPS | F1046: LOWRIE | I1046: McBEAN | K1046: BODSWORTH | N1046: HUGHES
A1048: ROUND 17 | E1048: 16TH AUGUST | J1048: WEATHER | M1048: NORTH WIND FINE & SUNNY | S1048: PLAYED AT
D1049: 1ST QTR | H1049: 2ND QTR | L1049: 3RD QTR | P1049: FINAL | S1049: OAKLEIGH
A1050: CAMBERWELL | C1050: 0 | D1050: 4 | E1050: =C1050*6+D1050 -> 4 | G1050: 3 | H1050: 9 | I1050: =G1050*6+H1050 -> 27 | K1050: 4 | L1050: 14 | M1050: =K1050*6+L1050 -> 38 | O1050: 6 | P1050: 21 | Q1050: =O1050*6+P1050 -> 57 | S1050: UMPIRE | X1050: LADDER | AB1050: ROUND | AD1050: 17
A1051: OAKLEIGH | C1051: 1 | D1051: 7 | E1051: =C1051*6+D1051 -> 13 | G1051: 4 | H1051: 9 | I1051: =G1051*6+H1051 -> 33 | K1051: 5 | L1051: 13 | M1051: =K1051*6+L1051 -> 43 | O1051: 5 | P1051: 14 | Q1051: =O1051*6+P1051 -> 44 | S1051: SMYTH
A1052: BEST PLAYERS | W1052: TEAM | X1052: W | Y1052: L | Z1052: D | AA1052: FOR | AB1052: AGST | AC1052: % | AD1052: PTS
A1053: CAMBERWELL | C1053: HEDLEY | E1053: MASON | H1053: BOHAN | K1053: McFEE | N1053: BEDFORD | Q1053: FLETCHER
A1054: OAKLEIGH | C1054: VAINS | E1054: TINDAL | H1054: GORDON | K1054: W WILLIAMS | N1054: LAMBERT | Q1054: TEMME | W1054: PORT MELBOURNE | X1054: 15 | Y1054: 2 | Z1054: 0 | AA1054: 1502 | AB1054: 1046 | AC1054: 143.59464627151053 | AD1054: 60
A1055: GOALKICKERS | W1055: COBURG | X1055: 14 | Y1055: 3 | Z1055: 0 | AA1055: 1482 | AB1055: 1068 | AC1055: 138.76404494382024 | AD1055: 56
A1056: CAMBERWELL | C1056: YOUNG 2 | F1056: HEDLEY 2 | I1056: BRADLEY | K1056: McFEE | W1056: OAKLEIGH | X1056: 11 | Y1056: 6 | Z1056: 0 | AA1056: 1251 | AB1056: 1015 | AC1056: 123.25 | AD1056: 44
A1057: OAKLEIGH | C1057: WATSON 3 | F1057: STREETER | I1057: EDWARDS | W1057: BRUNSWICK | X1057: 11 | Y1057: 6 | Z1057: 0 | AA1057: 1188 | AB1057: 1071 | AC1057: 110.92 | AD1057: 44
A1059: YARRAVILLE | C1059: 6 | D1059: 4 | E1059: =C1059*6+D1059 -> 40 | G1059: 10 | H1059: 4 | I1059: =G1059*6+H1059 -> 64 | K1059: 18 | L1059: 10 | M1059: =K1059*6+L1059 -> 118 | O1059: 19 | P1059: 12 | Q1059: =O1059*6+P1059 -> 126 | S1059: YARRAVILLE | W1059: CAMBERWELL | X1059: 10 | Y1059: 6 | Z1059: 1 | AA1059: 1179 | AB1059: 1131 | AC1059: 104.24403183023873 | AD1059: 42
A1060: BRUNSWICK | C1060: 1 | D1060: 3 | E1060: =C1060*6+D1060 -> 9 | G1060: 3 | H1060: 6 | I1060: =G1060*6+H1060 -> 24 | K1060: 3 | L1060: 6 | M1060: =K1060*6+L1060 -> 24 | O1060: 9 | P1060: 19 | Q1060: =O1060*6+P1060 -> 73 | S1060: BOWDEN | W1060: PRAHRAN | X1060: 10 | Y1060: 7 | Z1060: 0 | AA1060: 1325 | AB1060: 1206 | AC1060: 109.86733001658375 | AD1060: 40
A1061: BEST PLAYERS | W1061: YARRAVILLE | X1061: 10 | Y1061: 7 | Z1061: 0 | AA1061: 1282 | AB1061: 1239 | AC1061: 103.47054075867635 | AD1061: 40
A1062: YARRAVILLE | C1062: JONES | F1062: BODSWORTH | I1062: WAGHORNE | L1062: CRANAGE | O1062: HUGHES | Q1062: PHILLIPS | W1062: MOORABBIN | X1062: 8 | Y1062: 9 | Z1062: 0 | AA1062: 1081 | AB1062: 1137 | AC1062: 95.074758135444156 | AD1062: 32
A1063: BRUNSWICK | C1063: STANLEY | F1063: CLUES | I1063: POLLARD | L1063: PLANT | O1063: MAHER | Q1063: THORNTON | W1063: NORTHCOTE | X1063: 8 | Y1063: 9 | Z1063: 0 | AA1063: 1033 | AB1063: 1108 | AC1063: 93.231046931407946 | AD1063: 32
A1064: GOALKICKERS | W1064: PRESTON | X1064: 6 | Y1064: 10 | Z1064: 1 | AA1064: 1311 | AB1064: 1406 | AC1064: 93.243243243243242 | AD1064: 26
A1065: YARRAVILLE | C1065: WAGHORNE 6 | F1065: PHILLIPS 4 | I1065: BODSWORTH 3 | L1065: HUGHES 3 | N1065: HARGREAVES | Q1065: VANDERFEEN | T1065: SALT | W1065: WILLIAMSTOWN | X1065: 6 | Y1065: 11 | Z1065: 0 | AA1065: 1361 | AB1065: 1378 | AC1065: 98.766328011611037 | AD1065: 24
A1066: BRUNSWICK | C1066: THORNTON 3 | F1066: DUNSTAN 2 | I1066: STANLEY | K1066: SMITH | M1066: CLUES | O1066: MULLENGER | W1066: SANDRINGHAM | X1066: 6 | Y1066: 11 | Z1066: 0 | AA1066: 1194 | AB1066: 1338 | AC1066: 89.237668161434982 | AD1066: 24
W1067: BOX HILL | X1067: 2 | Y1067: 15 | Z1067: 0 | AA1067: 1051 | AB1067: 1453 | AC1067: 72.333103922918099 | AD1067: 8
A1068: NORTHCOTE | C1068: 5 | D1068: 2 | E1068: =C1068*6+D1068 -> 32 | G1068: 5 | H1068: 5 | I1068: =G1068*6+H1068 -> 35 | K1068: 10 | L1068: 11 | M1068: =K1068*6+L1068 -> 71 | O1068: 14 | P1068: 12 | Q1068: =O1068*6+P1068 -> 96 | S1068: NORTHCOTE | W1068: BRIGHTON | X1068: 1 | Y1068: 16 | Z1068: 0 | AA1068: 862 | AB1068: 1506 | AC1068: 57.24 | AD1068: 4
A1069: WILLIAMSTOWN | C1069: 2 | D1069: 3 | E1069: =C1069*6+D1069 -> 15 | G1069: 7 | H1069: 6 | I1069: =G1069*6+H1069 -> 48 | K1069: 9 | L1069: 9 | M1069: =K1069*6+L1069 -> 63 | O1069: 12 | P1069: 11 | Q1069: =O1069*6+P1069 -> 83 | S1069: HARWOOD
A1070: BEST PLAYERS
A1071: NORTHCOTE | C1071: W COLLINS | F1071: GIBBS | I1071: DEANS | K1071: PURDON | N1071: NOLAN | Q1071: R WHITE
A1072: WILLIAMSTOWN | C1072: WALKER | F1072: MOLYNEUX | I1072: W WILLIAMS | L1072: DULLARD | N1072: J SIMPSON | Q1072: LOWRY
A1073: GOALKICKERS
A1074: NORTHCOTE | C1074: W COLLINS 5 | F1074: PURDON 4 | I1074: GIBBS 2 | K1074: R WHITE | M1074: KNOWLES | P1074: ALDRIDGE
A1075: WILLIAMSTOWN | C1075: WALKER 7 | F1075: B WILLIAMS 2 | J1075: DULLARD | M1075: H SIMPSON | P1075: MOLYNEUX
A1077: MOORABBIN | C1077: 1 | D1077: 2 | E1077: =C1077*6+D1077 -> 8 | G1077: 7 | H1077: 4 | I1077: =G1077*6+H1077 -> 46 | K1077: 10 | L1077: 7 | M1077: =K1077*6+L1077 -> 67 | O1077: 12 | P1077: 10 | Q1077: =O1077*6+P1077 -> 82 | S1077: B'H
A1078: BOX HILL | C1078: 5 | D1078: 3 | E1078: =C1078*6+D1078 -> 33 | G1078: 6 | H1078: 3 | I1078: =G1078*6+H1078 -> 39 | K1078: 9 | L1078: 4 | M1078: =K1078*6+L1078 -> 58 | O1078: 10 | P1078: 7 | Q1078: =O1078*6+P1078 -> 67 | S1078: IRVING
A1079: BEST PLAYERS
A1080: MOORABBIN | C1080: DALY | F1080: SUTHERLAND | I1080: GILDER | L1080: REID | N1080: COATES | Q1080: McKENZIE
A1081: BOX HILL | C1081: COGHLAN | F1081: LOVE | I1081: O'ROURKE | L1081: GREEN | N1081: PARKS | Q1081: HOUGHTON
A1082: GOALKICKERS
A1083: MOORABBIN | C1083: DALY 4 | F1083: COAD 3 | H1083: SUTHERLAND 2 | K1083: McFARLANE | N1083: JONES | P1083: McKENZIE
A1084: BOX HILL | C1084: COGHLAN 3 | F1084: LOVE 3 | H1084: THOMPSON 3 | K1084: MAIDMENT
A1086: COBURG | C1086: 2 | D1086: 1 | E1086: =C1086*6+D1086 -> 13 | G1086: 5 | H1086: 8 | I1086: =G1086*6+H1086 -> 38 | K1086: 8 | L1086: 11 | M1086: =K1086*6+L1086 -> 59 | O1086: 13 | P1086: 16 | Q1086: =O1086*6+P1086 -> 94 | S1086: COBURG
A1087: PRESTON | C1087: 4 | D1087: 6 | E1087: =C1087*6+D1087 -> 30 | G1087: 6 | H1087: 8 | I1087: =G1087*6+H1087 -> 44 | K1087: 8 | L1087: 12 | M1087: =K1087*6+L1087 -> 60 | O1087: 9 | P1087: 13 | Q1087: =O1087*6+P1087 -> 67 | S1087: MERRINGTON
A1088: BEST PLAYERS
A1089: COBURG | C1089: CONDON | F1089: ROGAN | I1089: MAHONEY | L1089: H WILKINSON | O1089: WALKER | Q1089: CANNING
A1090: PRESTON | C1090: HENRYS | F1090: SWEET | I1090: BRADFORD | L1090: BATEMAN | O1090: FOLEY | Q1090: CANN
A1091: GOALKICKERS
A1092: COBURG | C1092: McTAGGART 4 | F1092: ROGAN 3 | I1092: CANNING 2 | L1092: MAHONEY | N1092: H WILKINSON | Q1092: GILBERT | S1092: EVANS
A1093: PRESTON | C1093: DEACON 2 | F1093: BATEMAN 2 | I1093: HAYES | K1093: FOLEY | M1093: CANN | O1093: LALOR | Q1093: BRADFORD
A1095: PRAHRAN | C1095: 1 | D1095: 3 | E1095: =C1095*6+D1095 -> 9 | G1095: 5 | H1095: 8 | I1095: =G1095*6+H1095 -> 38 | K1095: 5 | L1095: 13 | M1095: =K1095*6+L1095 -> 43 | O1095: 11 | P1095: 16 | Q1095: =O1095*6+P1095 -> 82 | S1095: TOORAK PARK
A1096: BRIGHTON | C1096: 2 | D1096: 2 | E1096: =C1096*6+D1096 -> 14 | G1096: 2 | H1096: 3 | I1096: =G1096*6+H1096 -> 15 | K1096: 4 | L1096: 6 | M1096: =K1096*6+L1096 -> 30 | O1096: 4 | P1096: 7 | Q1096: =O1096*6+P1096 -> 31 | S1096: CLEARY
A1097: BEST PLAYERS
A1098: PRAHRAN | C1098: HARVEY | F1098: CHAPMAN | I1098: HART | L1098: COURTNEY | O1098: YATES | Q1098: CAMPBELL
A1099: BRIGHTON | C1099: BLACKMORE | F1099: PICKERING | I1099: BURRELL | L1099: O'MEARA | O1099: PERKINS | Q1099: BOWLES
A1100: GOALKICKERS
A1101: PRAHRAN | C1101: COURTNEY 5 | F1101: MORROW | I1101: JONES | K1101: HARVEY | M1101: LOUREY | O1101: MORONE | Q1101: WATTS
A1102: BRIGHTON | C1102: HARDY 2 | F1102: HALE | I1102: HOWE
A1104: PORT MELBOURNE | C1104: 3 | D1104: 3 | E1104: =C1104*6+D1104 -> 21 | G1104: 5 | H1104: 9 | I1104: =G1104*6+H1104 -> 39 | K1104: 6 | L1104: 10 | M1104: =K1104*6+L1104 -> 46 | O1104: 10 | P1104: 16 | Q1104: =O1104*6+P1104 -> 76 | S1104: BEACH ROAD
A1105: SANDRINGHAM | C1105: 1 | D1105: 7 | E1105: =C1105*6+D1105 -> 13 | G1105: 6 | H1105: 9 | I1105: =G1105*6+H1105 -> 45 | K1105: 8 | L1105: 14 | M1105: =K1105*6+L1105 -> 62 | O1105: 9 | P1105: 19 | Q1105: =O1105*6+P1105 -> 73 | S1105: RICHARDSON
A1106: BEST PLAYERS
A1107: PORT MELBOURNE | C1107: JOHNSON | F1107: BONNETT | I1107: B MILLER | L1107: BOWER | O1107: MURRAY | Q1107: WOODBRIDGE
A1108: SANDRINGHAM | C1108: GUILLE | F1108: RUSSELL | I1108: WALKER | L1108: BOURKE | O1108: SHIPP | Q1108: BENCRAFT
A1109: GOALKICKERS
A1110: PORT MELBOURNE | C1110: BONNETT 3 | F1110: B MILLER 2 | I1110: WITHERS | K1110: OWENS | M1110: SYKES | O1110: JOHNSON | Q1110: STOREY
A1111: SANDRINGHAM | C1111: B HARPER 3 | F1111: POTTER 2 | I1111: WRIGHT-SMITH | L1111: HISCOCK | N1111: RUSSELL | P1111: SCANLON
A1113: ROUND 18 | E1113: 23RD AUGUST | J1113: WEATHER | O1113: NORTH WEST WIND | S1113: PLAYED AT
D1114: 1ST QTR | H1114: 2ND QTR | L1114: 3RD QTR | P1114: FINAL | S1114: PORT MELBOURNE
A1115: PORT MELBOURNE | C1115: 1 | D1115: 4 | E1115: =C1115*6+D1115 -> 10 | G1115: 7 | H1115: 11 | I1115: =G1115*6+H1115 -> 53 | K1115: 7 | L1115: 13 | M1115: =K1115*6+L1115 -> 55 | O1115: 12 | P1115: 21 | Q1115: =O1115*6+P1115 -> 93 | S1115: UMPIRE | X1115: LADDER | AB1115: ROUND | AD1115: 18
A1116: OAKLEIGH | C1116: 3 | D1116: 6 | E1116: =C1116*6+D1116 -> 24 | G1116: 5 | H1116: 6 | I1116: =G1116*6+H1116 -> 36 | K1116: 10 | L1116: 11 | M1116: =K1116*6+L1116 -> 71 | O1116: 10 | P1116: 12 | Q1116: =O1116*6+P1116 -> 72 | S1116: MERRINGTON
A1117: BEST PLAYERS | W1117: TEAM | X1117: W | Y1117: L | Z1117: D | AA1117: FOR | AB1117: AGST | AC1117: % | AD1117: PTS
A1118: PORT MELBOURNE | C1118: MURRAY | F1118: B MILLER | I1118: LEEHANE | L1118: JOHNSON | O1118: LAFFEY | Q1118: WARD
A1119: OAKLEIGH | C1119: SAVORY | F1119: NEWTON | I1119: WENN | L1119: VAINS | O1119: HILL | Q1119: CUNNINGHAM | W1119: PORT MELBOURNE | X1119: 16 | Y1119: 2 | Z1119: 0 | AA1119: 1595 | AB1119: 1118 | AC1119: 142.6654740608229 | AD1119: 64
A1120: GOALKICKERS | W1120: COBURG | X1120: 15 | Y1120: 3 | Z1120: 0 | AA1120: 1586 | AB1120: 1119 | AC1120: 141.733690795353 | AD1120: 60
A1121: PORT MELBOURNE | C1121: BONNETT 5 | F1121: B MILLER 3 | I1121: CARIS 2 | K1121: OWENS | M1121: STOREY | W1121: CAMBERWELL | X1121: 11 | Y1121: 6 | Z1121: 1 | AA1121: 1276 | AB1121: 1192 | AC1121: 107.04697986577182 | AD1121: 46
A1122: OAKLEIGH | C1122: NEWTON 3 | F1122: WENN 2 | H1122: HILL | J1122: STREETER | M1122: DELO | N1122: DALMAN | P1122: RICKERT | W1122: OAKLEIGH | X1122: 11 | Y1122: 7 | Z1122: 0 | AA1122: 1323 | AB1122: 1108 | AC1122: 119.4 | AD1122: 44
A1124: MOORABBIN | C1124: 0 | D1124: 3 | E1124: =C1124*6+D1124 -> 3 | G1124: 4 | H1124: 8 | I1124: =G1124*6+H1124 -> 32 | K1124: 7 | L1124: 10 | M1124: =K1124*6+L1124 -> 52 | O1124: 9 | P1124: 16 | Q1124: =O1124*6+P1124 -> 70 | S1124: MOORABBIN | W1124: BRUNSWICK | X1124: 11 | Y1124: 7 | Z1124: 0 | AA1124: 1246 | AB1124: 1149 | AC1124: 108.44 | AD1124: 44
A1125: PRAHRAN | C1125: 3 | D1125: 1 | E1125: =C1125*6+D1125 -> 19 | G1125: 3 | H1125: 2 | I1125: =G1125*6+H1125 -> 20 | K1125: 3 | L1125: 4 | M1125: =K1125*6+L1125 -> 22 | O1125: 6 | P1125: 6 | Q1125: =O1125*6+P1125 -> 42 | S1125: SMYTH | W1125: YARRAVILLE | X1125: 11 | Y1125: 7 | Z1125: 0 | AA1125: 1346 | AB1125: 1298 | AC1125: 103.6979969183359 | AD1125: 44
A1126: BEST PLAYERS | W1126: PRAHRAN | X1126: 10 | Y1126: 8 | Z1126: 0 | AA1126: 1367 | AB1126: 1276 | AC1126: 107.13166144200628 | AD1126: 40
A1127: MOORABBIN | C1127: GILDER | F1127: STANLEY | I1127: McFARLANE | L1127: COAD | O1127: REID | Q1127: DALY | W1127: MOORABBIN | X1127: 9 | Y1127: 9 | Z1127: 0 | AA1127: 1151 | AB1127: 1179 | AC1127: 97.625106022052591 | AD1127: 36
A1128: PRAHRAN | C1128: HARVEY | F1128: CAMPBELL | I1128: ARMSTRONG | L1128: COLLS | O1128: YATES | Q1128: BUTLING | W1128: NORTHCOTE | X1128: 8 | Y1128: 10 | Z1128: 0 | AA1128: 1084 | AB1128: 1212 | AC1128: 89.438943894389439 | AD1128: 32
A1129: GOALKICKERS | W1129: PRESTON | X1129: 7 | Y1129: 10 | Z1129: 1 | AA1129: 1389 | AB1129: 1464 | AC1129: 94.877049180327873 | AD1129: 30
A1130: MOORABBIN | C1130: DICKENSON 3 | F1130: DALY 3 | I1130: ADDIS | K1130: COAD | M1130: REID | W1130: WILLIAMSTOWN | X1130: 7 | Y1130: 11 | Z1130: 0 | AA1130: 1537 | AB1130: 1422 | AC1130: 108.08720112517581 | AD1130: 28
A1131: PRAHRAN | C1131: COURTNEY 2 | F1131: LOUREY | I1131: HARVEY | K1131: LETTS | M1131: MORROW | W1131: SANDRINGHAM | X1131: 6 | Y1131: 12 | Z1131: 0 | AA1131: 1238 | AB1131: 1514 | AC1131: 81.770145310435936 | AD1131: 24
W1132: BOX HILL | X1132: 2 | Y1132: 16 | Z1132: 0 | AA1132: 1112 | AB1132: 1550 | AC1132: 71.741935483870961 | AD1132: 8
A1133: PRESTON | C1133: 3 | D1133: 5 | E1133: =C1133*6+D1133 -> 23 | G1133: 6 | H1133: 7 | I1133: =G1133*6+H1133 -> 43 | K1133: 7 | L1133: 13 | M1133: =K1133*6+L1133 -> 55 | O1133: 10 | P1133: 18 | Q1133: =O1133*6+P1133 -> 78 | S1133: PRESTON | W1133: BRIGHTON | X1133: 1 | Y1133: 17 | Z1133: 0 | AA1133: 921 | AB1133: 1570 | AC1133: 58.66 | AD1133: 4
A1134: BRUNSWICK | C1134: 2 | D1134: 2 | E1134: =C1134*6+D1134 -> 14 | G1134: 3 | H1134: 4 | I1134: =G1134*6+H1134 -> 22 | K1134: 6 | L1134: 4 | M1134: =K1134*6+L1134 -> 40 | O1134: 9 | P1134: 4 | Q1134: =O1134*6+P1134 -> 58 | S1134: CLEARY
A1135: BEST PLAYERS
A1136: PRESTON | C1136: BATEMAN | F1136: PRITCHARD | I1136: HENRYS | K1136: JEFFREY | N1136: COOPER | Q1136: GOLDIN
A1137: BRUNSWICK | C1137: SEYMOUR | F1137: CLUES | I1137: MAHER | K1137: LOVETT | N1137: DUNSTAN | Q1137: PARKER
A1138: GOALKICKERS
A1139: PRESTON | C1139: BRADFORD 4 | F1139: DEACON 2 | I1139: HAYES 2 | K1139: BATEMAN | M1139: GOLDIN
A1140: BRUNSWICK | C1140: THORNTON 4 | F1140: CLUES 2 | I1140: MULLENGER 2 | L1140: STANLEY
A1142: COBURG | C1142: 6 | D1142: 6 | E1142: =C1142*6+D1142 -> 42 | G1142: 8 | H1142: 8 | I1142: =G1142*6+H1142 -> 56 | K1142: 13 | L1142: 11 | M1142: =K1142*6+L1142 -> 89 | O1142: 15 | P1142: 14 | Q1142: =O1142*6+P1142 -> 104 | S1142: COBURG
A1143: NORTHCOTE | C1143: 1 | D1143: 1 | E1143: =C1143*6+D1143 -> 7 | G1143: 3 | H1143: 4 | I1143: =G1143*6+H1143 -> 22 | K1143: 4 | L1143: 5 | M1143: =K1143*6+L1143 -> 29 | O1143: 7 | P1143: 9 | Q1143: =O1143*6+P1143 -> 51 | S1143: BAGULEY
A1144: BEST PLAYERS
A1145: COBURG | C1145: R WILKINSON | F1145: WALKER | I1145: ROGAN | L1145: EQUID | N1145: LEVERSHA | Q1145: H WILKINSON
A1146: NORTHCOTE | C1146: GIBBS | F1146: COLLINS | I1146: ALDRIDGE | L1146: J VAINS | N1146: PURDON | Q1146: FARRELL
A1147: GOALKICKERS
A1148: COBURG | C1148: JAMES 4 | F1148: ROGAN 4 | I1148: EQUID 3 | K1148: McDONALD 2 | N1148: R WILKINSON | Q1148: LEVERSHA
A1149: NORTHCOTE | C1149: GIBBS 2 | F1149: PURDON 2 | I1149: R WHITE | K1149: WOOLNOUGH | N1149: PAYNTER
A1151: WILLIAMSTOWN | C1151: 7 | D1151: 5 | E1151: =C1151*6+D1151 -> 47 | G1151: 12 | H1151: 7 | I1151: =G1151*6+H1151 -> 79 | K1151: 20 | L1151: 11 | M1151: =K1151*6+L1151 -> 131 | O1151: 27 | P1151: 14 | Q1151: =O1151*6+P1151 -> 176 | S1151: WILLIAMSTOWN
A1152: SANDRINGHAM | C1152: 1 | D1152: 1 | E1152: =C1152*6+D1152 -> 7 | G1152: 2 | H1152: 2 | I1152: =G1152*6+H1152 -> 14 | K1152: 3 | L1152: 5 | M1152: =K1152*6+L1152 -> 23 | O1152: 6 | P1152: 8 | Q1152: =O1152*6+P1152 -> 44 | S1152: IRVING
A1153: BEST PLAYERS
A1154: WILLIAMSTOWN | C1154: WALKER | F1154: ALLANSON | I1154: ROGERS | L1154: B WILLIAMS | O1154: DULLARD | R1154: HOWAT
A1155: SANDRINGHAM | C1155: BOURKE | F1155: JONES | I1155: SHIPP | L1155: SHEARS | O1155: B HARPER | R1155: POTTER
A1156: GOALKICKERS
A1157: WILLIAMSTOWN | C1157: WALKER 14 | F1157: W WILLIAMS 5 | J1157: MOLYNEUX 3 | M1157: DULLARD 2 | P1157: B WILLIAMS | S1157: TAAFE | U1157: LOWRY
A1158: SANDRINGHAM | C1158: B HARPER 2 | F1158: JONES | H1158: POTTER | J1158: BENCRAFT | M1158: BOURKE
A1160: CAMBERWELL | C1160: 4 | D1160: 2 | E1160: =C1160*6+D1160 -> 26 | G1160: 8 | H1160: 7 | I1160: =G1160*6+H1160 -> 55 | K1160: 9 | L1160: 9 | M1160: =K1160*6+L1160 -> 63 | O1160: 14 | P1160: 13 | Q1160: =O1160*6+P1160 -> 97 | S1160: CAMBERWELL
A1161: BOX HILL | C1161: 4 | D1161: 7 | E1161: =C1161*6+D1161 -> 31 | G1161: 5 | H1161: 10 | I1161: =G1161*6+H1161 -> 40 | K1161: 8 | L1161: 13 | M1161: =K1161*6+L1161 -> 61 | O1161: 8 | P1161: 13 | Q1161: =O1161*6+P1161 -> 61 | S1161: BOWDEN
A1162: BEST PLAYERS
A1163: CAMBERWELL | C1163: BRADLEY | F1163: BOHAN | I1163: McFEE | L1163: MASON | O1163: CALLAHAN | R1163: THYNNE
A1164: BOX HILL | C1164: IRVINE | F1164: THOMPSON | I1164: WEBB | L1164: LOVE | O1164: COGHLAN | R1164: WRIGHT
A1165: GOALKICKERS
A1166: CAMBERWELL | C1166: BRADLEY 5 | F1166: HEDLEY 4 | I1166: McFEE 2 | L1166: ROSENBROCK | O1166: HAYES | Q1166: DUFF
A1167: BOX HILL | C1167: WEBB 2 | F1167: MORRIS 2 | I1167: W BLUNDY 2 | L1167: COGHLAN | O1167: THOMPSON
A1169: YARRAVILLE | C1169: 5 | D1169: 4 | E1169: =C1169*6+D1169 -> 34 | G1169: 7 | H1169: 6 | I1169: =G1169*6+H1169 -> 48 | K1169: 8 | L1169: 9 | M1169: =K1169*6+L1169 -> 57 | O1169: 9 | P1169: 10 | Q1169: =O1169*6+P1169 -> 64 | S1169: ELSTERNWICK PARK
A1170: BRIGHTON | C1170: 0 | D1170: 2 | E1170: =C1170*6+D1170 -> 2 | G1170: 3 | H1170: 6 | I1170: =G1170*6+H1170 -> 24 | K1170: 7 | L1170: 9 | M1170: =K1170*6+L1170 -> 51 | O1170: 8 | P1170: 11 | Q1170: =O1170*6+P1170 -> 59 | S1170: HARWOOD
A1171: BEST PLAYERS
A1172: YARRAVILLE | C1172: MITCHELL | F1172: CRANAGE | I1172: NICHOLLS | L1172: ELDRIDGE | O1172: COOK | R1172: PHILLIPS
A1173: BRIGHTON | C1173: BURRELL | F1173: PERKINS | I1173: SINCLAIR | L1173: MARINI | O1173: BOWLES | R1173: BLACKMORE
A1174: GOALKICKERS
A1175: YARRAVILLE | C1175: BODSWORTH 3 | F1175: MITCHELL 2 | I1175: WAGHORNE 2 | L1175: PHILLIPS | N1175: MASON
A1176: BRIGHTON | C1176: PLUNKETT 3 | F1176: BURKE 2 | I1176: HOWE | K1176: EMBLETON | N1176: HALE
A1178: ROUND 19 | E1178: 30TH AUGUST | J1178: WEATHER | M1178: SOUTH WEST WIND SHOWERS | S1178: PLAYED AT
D1179: 1ST QTR | H1179: 2ND QTR | L1179: 3RD QTR | P1179: FINAL | S1179: TOORAK PARK
A1180: PRAHRAN | C1180: 0 | D1180: 1 | E1180: =C1180*6+D1180 -> 1 | G1180: 7 | H1180: 8 | I1180: =G1180*6+H1180 -> 50 | K1180: 8 | L1180: 11 | M1180: =K1180*6+L1180 -> 59 | O1180: 11 | P1180: 14 | Q1180: =O1180*6+P1180 -> 80 | S1180: UMPIRE | X1180: LADDER | AB1180: ROUND | AD1180: 19
A1181: CAMBERWELL | C1181: 4 | D1181: 6 | E1181: =C1181*6+D1181 -> 30 | G1181: 4 | H1181: 6 | I1181: =G1181*6+H1181 -> 30 | K1181: 7 | L1181: 7 | M1181: =K1181*6+L1181 -> 49 | O1181: 8 | P1181: 12 | Q1181: =O1181*6+P1181 -> 60 | S1181: BAGULEY
A1182: BEST PLAYERS | W1182: TEAM | X1182: W | Y1182: L | Z1182: D | AA1182: FOR | AB1182: AGST | AC1182: % | AD1182: PTS
A1183: PRAHRAN | C1183: LETTS | F1183: PLAIN | I1183: MORROW | L1183: WALSH | N1183: BUTLING | Q1183: KRUSE
A1184: CAMBERWELL | C1184: BOHAN | F1184: FLETCHER | I1184: BENBOW | L1184: DUFF | N1184: CALLAHAN | Q1184: ROSENBROCK | W1184: PORT MELBOURNE | X1184: 17 | Y1184: 2 | Z1184: 0 | AA1184: 1746 | AB1184: 1182 | AC1184: 147.71573604060913 | AD1184: 68
A1185: GOALKICKERS | W1185: COBURG | X1185: 15 | Y1185: 4 | Z1185: 0 | AA1185: 1665 | AB1185: 1199 | AC1185: 138.86572143452878 | AD1185: 60
A1186: PRAHRAN | C1186: McCULLOCH 2 | F1186: LETTS 2 | H1186: WALSH 2 | J1186: KRUSE | L1186: ARMSTRONG | O1186: MORROW | Q1186: CAMPBELL | T1186: HARVEY | W1186: OAKLEIGH | X1186: 12 | Y1186: 7 | Z1186: 0 | AA1186: 1420 | AB1186: 1181 | AC1186: 120.24 | AD1186: 48
A1187: CAMBERWELL | C1187: HEDLEY 2 | F1187: YOUNG 2 | I1187: MARIAN | K1187: BRADLEY | M1187: BENBOW | O1187: DUFF | W1187: BRUNSWICK | X1187: 12 | Y1187: 7 | Z1187: 0 | AA1187: 1319 | AB1187: 1189 | AC1187: 110.93 | AD1187: 48
A1189: YARRAVILLE | C1189: 1 | D1189: 1 | E1189: =C1189*6+D1189 -> 7 | G1189: 6 | H1189: 7 | I1189: =G1189*6+H1189 -> 43 | K1189: 7 | L1189: 10 | M1189: =K1189*6+L1189 -> 52 | O1189: 14 | P1189: 15 | Q1189: =O1189*6+P1189 -> 99 | S1189: YARRAVILLE | W1189: YARRAVILLE | X1189: 12 | Y1189: 7 | Z1189: 0 | AA1189: 1445 | AB1189: 1359 | AC1189: 106.32818248712289 | AD1189: 48
A1190: MOORABBIN | C1190: 5 | D1190: 9 | E1190: =C1190*6+D1190 -> 39 | G1190: 5 | H1190: 10 | I1190: =G1190*6+H1190 -> 40 | K1190: 7 | L1190: 12 | M1190: =K1190*6+L1190 -> 54 | O1190: 8 | P1190: 13 | Q1190: =O1190*6+P1190 -> 61 | S1190: IRVING | W1190: CAMBERWELL | X1190: 11 | Y1190: 7 | Z1190: 1 | AA1190: 1336 | AB1190: 1272 | AC1190: 105.03144654088051 | AD1190: 46
A1191: BEST PLAYERS | W1191: PRAHRAN | X1191: 11 | Y1191: 8 | Z1191: 0 | AA1191: 1447 | AB1191: 1336 | AC1191: 108.30838323353294 | AD1191: 44
A1192: YARRAVILLE | C1192: VANDERFEEN | F1192: BODSWORTH | I1192: SMALLWOOD | L1192: NICHOLLS | O1192: CRANAGE | Q1192: PEVETT | W1192: MOORABBIN | X1192: 9 | Y1192: 10 | Z1192: 0 | AA1192: 1212 | AB1192: 1278 | AC1192: 94.835680751173712 | AD1192: 36
A1193: MOORABBIN | C1193: COAD | F1193: BROWN | I1193: DALY | L1193: STANLEY | O1193: LEITCH | Q1193: ADDIS | W1193: NORTHCOTE | X1193: 9 | Y1193: 10 | Z1193: 0 | AA1193: 1121 | AB1193: 1245 | AC1193: 90.040160642570285 | AD1193: 36
A1194: GOALKICKERS | W1194: PRESTON | X1194: 7 | Y1194: 11 | Z1194: 1 | AA1194: 1422 | AB1194: 1501 | AC1194: 94.736842105263165 | AD1194: 30
A1195: YARRAVILLE | C1195: PHILLIPS (4) | F1195: VANDERFEEN 3 | I1195: BODSWORTH 2 | L1195: WAGHORNE 2 | O1195: H MASON 2 | R1195: SALT | W1195: WILLIAMSTOWN | X1195: 7 | Y1195: 12 | Z1195: 0 | AA1195: 1612 | AB1195: 1519 | AC1195: 106.12244897959184 | AD1195: 28
A1196: MOORABBIN | C1196: COAD 2 | F1196: DALY 2 | I1196: BROWN | K1196: LEITCH | M1196: SUTHERLAND | W1196: SANDRINGHAM | X1196: 7 | Y1196: 12 | Z1196: 0 | AA1196: 1318 | AB1196: 1593 | AC1196: 82.736974262397993 | AD1196: 28
W1197: BOX HILL | X1197: 2 | Y1197: 17 | Z1197: 0 | AA1197: 1176 | AB1197: 1701 | AC1197: 69.135802469135797 | AD1197: 8
A1198: NORTHCOTE | C1198: 2 | D1198: 4 | E1198: =C1198*6+D1198 -> 16 | G1198: 2 | H1198: 7 | I1198: =G1198*6+H1198 -> 19 | K1198: 3 | L1198: 7 | M1198: =K1198*6+L1198 -> 25 | O1198: 5 | P1198: 7 | Q1198: =O1198*6+P1198 -> 37 | S1198: NORTHCOTE | W1198: BRIGHTON | X1198: 1 | Y1198: 18 | Z1198: 0 | AA1198: 961 | AB1198: 1643 | AC1198: 58.49 | AD1198: 4
A1199: PRESTON | C1199: 1 | D1199: 2 | E1199: =C1199*6+D1199 -> 8 | G1199: 1 | H1199: 5 | I1199: =G1199*6+H1199 -> 11 | K1199: 1 | L1199: 7 | M1199: =K1199*6+L1199 -> 13 | O1199: 4 | P1199: 9 | Q1199: =O1199*6+P1199 -> 33 | S1199: MILNE
A1200: BEST PLAYERS
A1201: NORTHCOTE | C1201: NOLAN | F1201: POWELL | I1201: HARTLEY | L1201: COOPER | O1201: GIBBS | Q1201: STABB
A1202: PRESTON | C1202: CROCKER | F1202: HENRYS | I1202: SWEET | L1202: McLACHLAN | O1202: JEFFREY | Q1202: PRITCHARD
A1203: GOALKICKERS
A1204: NORTHCOTE | C1204: F VAINS | F1204: HARTLEY | I1204: WHITECHURCH | L1204: PURDON | N1204: DAVIES
A1205: PRESTON | C1205: DEACON 2 | F1205: LALOR | I1205: FOLEY
A1207: OAKLEIGH | C1207: 6 | D1207: 1 | E1207: =C1207*6+D1207 -> 37 | G1207: 9 | H1207: 6 | I1207: =G1207*6+H1207 -> 60 | K1207: 12 | L1207: 9 | M1207: =K1207*6+L1207 -> 81 | O1207: 14 | P1207: 13 | Q1207: =O1207*6+P1207 -> 97 | S1207: OAKLEIGH
A1208: WILLIAMSTOWN | C1208: 4 | D1208: 0 | E1208: =C1208*6+D1208 -> 24 | G1208: 4 | H1208: 4 | I1208: =G1208*6+H1208 -> 28 | K1208: 10 | L1208: 7 | M1208: =K1208*6+L1208 -> 67 | O1208: 11 | P1208: 9 | Q1208: =O1208*6+P1208 -> 75 | S1208: RICHARDSON
A1209: BEST PLAYERS
A1210: OAKLEIGH | C1210: WENN | F1210: VAINS | I1210: TEMME | L1210: JOHNSON | O1210: HOWELL | R1210: HILL
A1211: WILLIAMSTOWN | C1211: ALLANSON | F1211: H SIMPSON | I1211: TAAFE | L1211: DULLARD | O1211: W WILLIAMS | R1211: WALKER
A1212: GOALKICKERS
A1213: OAKLEIGH | C1213: NEWTON 4 | F1213: J WATSON 3 | I1213: WENN 3 | K1213: JOHNSON | M1213: SCOTT | O1213: CUNNINGHAM | R1213: CADMAN
A1214: WILLIAMSTOWN | C1214: WALKER 4 | F1214: W WILLIAMS 3 | J1214: B WILLIAMS 2 | N1214: DULLARD | Q1214: HIBBERT
A1216: BRUNSWICK | C1216: 3 | D1216: 5 | E1216: =C1216*6+D1216 -> 23 | G1216: 7 | H1216: 9 | I1216: =G1216*6+H1216 -> 51 | K1216: 9 | L1216: 10 | M1216: =K1216*6+L1216 -> 64 | O1216: 10 | P1216: 13 | Q1216: =O1216*6+P1216 -> 73 | S1216: BRUNSWICK
A1217: BRIGHTON | C1217: 1 | D1217: 1 | E1217: =C1217*6+D1217 -> 7 | G1217: 2 | H1217: 4 | I1217: =G1217*6+H1217 -> 16 | K1217: 3 | L1217: 8 | M1217: =K1217*6+L1217 -> 26 | O1217: 5 | P1217: 10 | Q1217: =O1217*6+P1217 -> 40 | S1217: MERRINGTON
A1218: BEST PLAYERS
A1219: BRUNSWICK | C1219: MORGAN | F1219: MULLENGER | I1219: POLLARD | L1219: RADFORD | O1219: NEILSON | Q1219: SEYMOUR
A1220: BRIGHTON | C1220: HALL | F1220: PICKERING | I1220: FREEMAN | L1220: BURRELL | O1220: SINCLAIR | Q1220: BURKE
A1221: GOALKICKERS
A1222: BRUNSWICK | C1222: BAGLIN 3 | F1222: PRIESTLEY 3 | I1222: STANLEY | K1222: SEYMOUR | M1222: RADFORD | O1222: McFARLANE
A1223: BRIGHTON | C1223: PICKERING 2 | F1223: BURRELL 2 | I1223: HOWE
A1225: SANDRINGHAM | C1225: 3 | D1225: 2 | E1225: =C1225*6+D1225 -> 20 | G1225: 6 | H1225: 7 | I1225: =G1225*6+H1225 -> 43 | K1225: 8 | L1225: 7 | M1225: =K1225*6+L1225 -> 55 | O1225: 11 | P1225: 14 | Q1225: =O1225*6+P1225 -> 80 | S1225: BEACH ROAD
A1226: COBURG | C1226: 6 | D1226: 5 | E1226: =C1226*6+D1226 -> 41 | G1226: 7 | H1226: 10 | I1226: =G1226*6+H1226 -> 52 | K1226: 8 | L1226: 21 | M1226: =K1226*6+L1226 -> 69 | O1226: 9 | P1226: 25 | Q1226: =O1226*6+P1226 -> 79 | S1226: BOWDEN
A1227: BEST PLAYERS
A1228: SANDRINGHAM | C1228: EVANS | F1228: RUSSELL | I1228: BENCRAFT | L1228: JOSEPH | N1228: POTTER | Q1228: SCANLON
A1229: COBURG | C1229: LEVERSHA | F1229: R WILKINSON | I1229: H WILKINSON | L1229: JAMES | N1229: EVANS | Q1229: EQUID
A1230: GOALKICKERS
A1231: SANDRINGHAM | C1231: BENCRAFT 3 | F1231: POTTER 2 | I1231: JONES 2 | K1231: B HARPER 2 | N1231: SCANLON | Q1231: RUSSELL
A1232: COBURG | C1232: JAMES 4 | F1232: LEVERSHA 2 | I1232: ROGAN 2 | K1232: McTAGGART
A1234: PORT MELBOURNE | C1234: 6 | D1234: 13 | E1234: =C1234*6+D1234 -> 49 | G1234: 7 | H1234: 16 | I1234: =G1234*6+H1234 -> 58 | K1234: 14 | L1234: 23 | M1234: =K1234*6+L1234 -> 107 | O1234: 20 | P1234: 31 | Q1234: =O1234*6+P1234 -> 151 | S1234: B.H
A1235: BOX HILL | C1235: 1 | D1235: 0 | E1235: =C1235*6+D1235 -> 6 | G1235: 4 | H1235: 5 | I1235: =G1235*6+H1235 -> 29 | K1235: 7 | L1235: 8 | M1235: =K1235*6+L1235 -> 50 | O1235: 9 | P1235: 10 | Q1235: =O1235*6+P1235 -> 64 | S1235: SMYTH
A1236: BEST PLAYERS
A1237: PORT MELBOURNE | C1237: JOHNSON | F1237: BONNETT | I1237: MURRAY | L1237: STOREY | O1237: KELSEY | R1237: AUSTIN
A1238: BOX HILL | C1238: KRONK | F1238: LOVE | I1238: GARDINER | L1238: HOUGHTON | O1238: LEHMANN | R1238: W BLUNDY
A1239: GOALKICKERS
A1240: PORT MELBOURNE | C1240: AUSTIN 7 | F1240: BONNETT 5 | I1240: OWENS 2 | K1240: McDONALD 2 | N1240: WITHERS | P1240: POWER | R1240: H TUCKER | U1240: MURRAY
A1241: BOX HILL | C1241: MORRIS 3 | F1241: LOVE 2 | H1241: O'ROURKE | J1241: GARDINER | M1241: LEHMANN | P1241: GREEN
A1243: ROUND 20 | E1243: 6TH SEPTEMBER | K1243: WEATHER | P1243: FINE & SUNNY | S1243: PLAYED AT
D1244: 1ST QTR | H1244: 2ND QTR | L1244: 3RD QTR | P1244: FINAL | S1244: COBURG
A1245: OAKLEIGH | C1245: 1 | D1245: 1 | E1245: =C1245*6+D1245 -> 7 | G1245: 3 | H1245: 2 | I1245: =G1245*6+H1245 -> 20 | K1245: 8 | L1245: 4 | M1245: =K1245*6+L1245 -> 52 | O1245: 11 | P1245: 7 | Q1245: =O1245*6+P1245 -> 73 | S1245: UMPIRE | X1245: LADDER | AB1245: ROUND | AD1245: 20
A1246: COBURG | C1246: 1 | D1246: 3 | E1246: =C1246*6+D1246 -> 9 | G1246: 3 | H1246: 4 | I1246: =G1246*6+H1246 -> 22 | K1246: 4 | L1246: 5 | M1246: =K1246*6+L1246 -> 29 | O1246: 6 | P1246: 8 | Q1246: =O1246*6+P1246 -> 44 | S1246: IRVING
A1247: BEST PLAYERS | W1247: TEAM | X1247: W | Y1247: L | Z1247: D | AA1247: FOR | AB1247: AGST | AC1247: % | AD1247: PTS
A1248: OAKLEIGH | C1248: VAINS | E1248: CUNNINGHAM | H1248: HOWELL | K1248: HILL | N1248: NEWTON | Q1248: W WILLIAMS
A1249: COBURG | C1249: EQUID | E1249: STARBUCK | H1249: McTAGGART | K1249: ROGAN | N1249: H WILKINSON | Q1249: WALKER | W1249: PORT MELBOURNE | X1249: 18 | Y1249: 2 | Z1249: 0 | AA1249: 1911 | AB1249: 1245 | AC1249: 153.49397590361446 | AD1249: 72
A1250: GOALKICKERS | W1250: COBURG | X1250: 15 | Y1250: 5 | Z1250: 0 | AA1250: 1709 | AB1250: 1272 | AC1250: 134.35534591194968 | AD1250: 60
A1251: OAKLEIGH | C1251: CUNNINGHAM 4 | F1251: WENN 2 | I1251: RICKERT | K1251: SCOTT | M1251: WATSON | O1251: H WILLIAMS | R1251: NEWTON | W1251: OAKLEIGH | X1251: 13 | Y1251: 7 | Z1251: 0 | AA1251: 1493 | AB1251: 1227 | AC1251: 121.68 | AD1251: 52
A1252: COBURG | C1252: EVANS 2 | F1252: BULMAN | I1252: EQUID | K1252: McDONALD | N1252: H WILKINSON | W1252: YARRAVILLE | X1252: 13 | Y1252: 7 | Z1252: 0 | AA1252: 1537 | AB1252: 1434 | AC1252: 107.18270571827057 | AD1252: 52
A1254: YARRAVILLE | C1254: 7 | D1254: 5 | E1254: =C1254*6+D1254 -> 47 | G1254: 10 | H1254: 6 | I1254: =G1254*6+H1254 -> 66 | K1254: 10 | L1254: 7 | M1254: =K1254*6+L1254 -> 67 | O1254: 14 | P1254: 8 | Q1254: =O1254*6+P1254 -> 92 | S1254: CAMBERWELL | W1254: BRUNSWICK | X1254: 12 | Y1254: 8 | Z1254: 0 | AA1254: 1367 | AB1254: 1278 | AC1254: 106.96 | AD1254: 48
A1255: CAMBERWELL | C1255: 3 | D1255: 2 | E1255: =C1255*6+D1255 -> 20 | G1255: 7 | H1255: 6 | I1255: =G1255*6+H1255 -> 48 | K1255: 9 | L1255: 10 | M1255: =K1255*6+L1255 -> 64 | O1255: 10 | P1255: 15 | Q1255: =O1255*6+P1255 -> 75 | S1255: MERRINGTON | W1255: CAMBERWELL | X1255: 11 | Y1255: 8 | Z1255: 1 | AA1255: 1411 | AB1255: 1364 | AC1255: 103.44574780058652 | AD1255: 46
A1256: BEST PLAYERS | W1256: PRAHRAN | X1256: 11 | Y1256: 9 | Z1256: 0 | AA1256: 1510 | AB1256: 1501 | AC1256: 100.59960026648901 | AD1256: 44
A1257: YARRAVILLE | C1257: VANDERFEEN | F1257: J ROHLEDER | I1257: SALT | K1257: PHILLIPS | N1257: SMALLWOOD | Q1257: BODSWORTH | W1257: MOORABBIN | X1257: 10 | Y1257: 10 | Z1257: 0 | AA1257: 1301 | AB1257: 1326 | AC1257: 98.114630467571644 | AD1257: 40
A1258: CAMBERWELL | C1258: McFEE | F1258: HARRIOTT | I1258: HEDLEY | K1258: HAYES | N1258: ALLEN | Q1258: FLETCHER | W1258: NORTHCOTE | X1258: 10 | Y1258: 10 | Z1258: 0 | AA1258: 1270 | AB1258: 1320 | AC1258: 96.212121212121218 | AD1258: 40
A1259: GOALKICKERS | Q1259: WAGHORNE | W1259: WILLIAMSTOWN | X1259: 8 | Y1259: 12 | Z1259: 0 | AA1259: 1767 | AB1259: 1571 | AC1259: 112.47612985359643 | AD1259: 32
A1260: YARRAVILLE | C1260: BODSWORTH 4 | F1260: VANDERFEEN 4 | I1260: N ROHLEDER | L1260: H MASON | N1260: PHILLIPS | P1260: ELDRIDGE | R1260: SMALLWOOD | W1260: PRESTON | X1260: 7 | Y1260: 12 | Z1260: 1 | AA1260: 1495 | AB1260: 1576 | AC1260: 94.860406091370564 | AD1260: 30
A1261: CAMBERWELL | C1261: McFEE 4 | F1261: HAYES 2 | I1261: MARIAN | K1261: HEDLEY | M1261: BRADLEY | O1261: HARRIOTT | W1261: SANDRINGHAM | X1261: 7 | Y1261: 13 | Z1261: 0 | AA1261: 1393 | AB1261: 1742 | AC1261: 79.965556831228469 | AD1261: 28
W1262: BOX HILL | X1262: 2 | Y1262: 18 | Z1262: 0 | AA1262: 1228 | AB1262: 1856 | AC1262: 66.16379310344827 | AD1262: 8
A1263: MOORABBIN | C1263: 0 | D1263: 3 | E1263: =C1263*6+D1263 -> 3 | G1263: 6 | H1263: 8 | I1263: =G1263*6+H1263 -> 44 | K1263: 7 | L1263: 11 | M1263: =K1263*6+L1263 -> 53 | O1263: 12 | P1263: 17 | Q1263: =O1263*6+P1263 -> 89 | S1263: M'BINN | W1263: BRIGHTON | X1263: 2 | Y1263: 18 | Z1263: 0 | AA1263: 1036 | AB1263: 1716 | AC1263: 60.37 | AD1263: 8
A1264: BRUNSWICK | C1264: 3 | D1264: 3 | E1264: =C1264*6+D1264 -> 21 | G1264: 4 | H1264: 7 | I1264: =G1264*6+H1264 -> 31 | K1264: 6 | L1264: 10 | M1264: =K1264*6+L1264 -> 46 | O1264: 6 | P1264: 12 | Q1264: =O1264*6+P1264 -> 48 | S1264: CLEARY
A1265: BEST PLAYERS
A1266: MOORABBIN | C1266: GILDER | F1266: COPSEY | I1266: TRESIZE | L1266: McKENZIE | O1266: REID | R1266: COAD
A1267: BRUNSWICK | C1267: KENNEDY | F1267: SEYMOUR | I1267: ROLFS | L1267: PARKER | O1267: MULLENGER | R1267: CULLY
A1268: GOALKICKERS
A1269: MOORABBIN | C1269: COPSEY 3 | F1269: DALY 3 | I1269: COAD 2 | K1269: REID | M1269: TRESIZE | O1269: SUTHERLAND | R1269: JONES
A1270: BRUNSWICK | C1270: MULLENGER 2 | F1270: THORNTON 2 | I1270: DUNSTAN | L1270: KENNEDY
A1272: PORT MELBOURNE | C1272: 7 | D1272: 6 | E1272: =C1272*6+D1272 -> 48 | G1272: 9 | H1272: 9 | I1272: =G1272*6+H1272 -> 63 | K1272: 16 | L1272: 10 | M1272: =K1272*6+L1272 -> 106 | O1272: 25 | P1272: 15 | Q1272: =O1272*6+P1272 -> 165 | S1272: PORT MELBOURNE
A1273: PRAHRAN | C1273: 1 | D1273: 1 | E1273: =C1273*6+D1273 -> 7 | G1273: 4 | H1273: 8 | I1273: =G1273*6+H1273 -> 32 | K1273: 5 | L1273: 12 | M1273: =K1273*6+L1273 -> 42 | O1273: 8 | P1273: 15 | Q1273: =O1273*6+P1273 -> 63 | S1273: BOWDEN
A1274: BEST PLAYERS
A1275: PORT MELBOURNE | C1275: B MILLER | F1275: HOULIHAN | I1275: JOHNSON | L1275: MURRAY | O1275: BONNETT | Q1275: WALSH
A1276: PRAHRAN | C1276: GRAMBEAU | F1276: BUTLING | I1276: CHAPMAN | L1276: PLAIN | O1276: LETTS | Q1276: HARVEY
A1277: GOALKICKERS
A1278: PORT MELBOURNE | C1278: BONNETT 7 | F1278: B MILLER 5 | I1278: HOULIHAN 4 | L1278: AUSTIN 3 | N1278: WALSH 2 | Q1278: OWENS 2 | T1278: STOREY 2
A1279: PRAHRAN | C1279: HARVEY 2 | F1279: MORROW 2 | I1279: LETTS | K1279: WALSH | M1279: KRUSE | O1279: McCULLOCH
A1281: NORTHCOTE | C1281: 6 | D1281: 3 | E1281: =C1281*6+D1281 -> 39 | G1281: 14 | H1281: 6 | I1281: =G1281*6+H1281 -> 90 | K1281: 17 | L1281: 11 | M1281: =K1281*6+L1281 -> 113 | O1281: 22 | P1281: 17 | Q1281: =O1281*6+P1281 -> 149 | S1281: NORTHCOTE
A1282: SANDRINGHAM | C1282: 3 | D1282: 1 | E1282: =C1282*6+D1282 -> 19 | G1282: 4 | H1282: 4 | I1282: =G1282*6+H1282 -> 28 | K1282: 8 | L1282: 6 | M1282: =K1282*6+L1282 -> 54 | O1282: 11 | P1282: 9 | Q1282: =O1282*6+P1282 -> 75 | S1282: BAGULEY
A1283: BEST PLAYERS
A1284: NORTHCOTE | C1284: STABB | F1284: POWELL | I1284: GIBBS | L1284: FARRELL | O1284: HARTLEY | Q1284: PURDON
A1285: SANDRINGHAM | C1285: SHIPP | F1285: B HARPER | I1285: BOURKE | L1285: BENCRAFT | O1285: EVANS | Q1285: JONES
A1286: GOALKICKERS
A1287: NORTHCOTE | C1287: W COLLINS 5 | F1287: PAYNTER 4 | I1287: WHITECHURCH 4 | M1287: HARTLEY 3 | P1287: PURDON 2 | R1287: COOPER 2 | U1287: WOOLNOUGH | X1287: GIBBS
A1288: SANDRINGHAM | C1288: B HARPER 7 | F1288: BENCRAFT 3 | I1288: POTTER
A1290: WILLIAMSTOWN | C1290: 6 | D1290: 2 | E1290: =C1290*6+D1290 -> 38 | G1290: 12 | H1290: 4 | I1290: =G1290*6+H1290 -> 76 | K1290: 20 | L1290: 7 | M1290: =K1290*6+L1290 -> 127 | O1290: 24 | P1290: 11 | Q1290: =O1290*6+P1290 -> 155 | S1290: WILLIAMSTOWN
A1291: BOX HILL | C1291: 1 | D1291: 0 | E1291: =C1291*6+D1291 -> 6 | G1291: 7 | H1291: 1 | I1291: =G1291*6+H1291 -> 43 | K1291: 7 | L1291: 3 | M1291: =K1291*6+L1291 -> 45 | O1291: 8 | P1291: 4 | Q1291: =O1291*6+P1291 -> 52 | S1291: CARDWELL
A1292: BEST PLAYERS
A1293: WILLIAMSTOWN | C1293: WALKER | F1293: ALLANSON | I1293: H SIMPSON | L1293: MOLYNEUX | O1293: CALLAHAN | R1293: MUNDAY
A1294: BOX HILL | C1294: GARDINER | F1294: WRIGHT | I1294: MORRIS | L1294: GREEN | O1294: KRONK | R1294: COLLINS
A1295: GOALKICKERS
A1296: WILLIAMSTOWN | C1296: WALKER 16 | F1296: B WILLIAMS 4 | J1296: W WILLIAMS 2 | N1296: DULLARD | Q1296: TAAFE
A1297: BOX HILL | C1297: GARDINER 2 | F1297: MORRIS 2 | I1297: THOMPSON | L1297: WEBB | N1297: HEALY | P1297: LORD
A1299: BRIGHTON | C1299: 2 | D1299: 6 | E1299: =C1299*6+D1299 -> 18 | G1299: 5 | H1299: 7 | I1299: =G1299*6+H1299 -> 37 | K1299: 9 | L1299: 9 | M1299: =K1299*6+L1299 -> 63 | O1299: 11 | P1299: 9 | Q1299: =O1299*6+P1299 -> 75 | S1299: ELSTERNWICK PARK
A1300: PRESTON | C1300: 1 | D1300: 2 | E1300: =C1300*6+D1300 -> 8 | G1300: 5 | H1300: 3 | I1300: =G1300*6+H1300 -> 33 | K1300: 8 | L1300: 7 | M1300: =K1300*6+L1300 -> 55 | O1300: 10 | P1300: 13 | Q1300: =O1300*6+P1300 -> 73 | S1300: RICHARDSON
A1301: BEST PLAYERS
A1302: BRIGHTON | C1302: PLUNKETT | F1302: LE GRIFFIN | I1302: FEHR | K1302: HALL | N1302: BURKE | Q1302: O'MEARA
A1303: PRESTON | C1303: SWEET | F1303: HAYES | I1303: F CHARD | K1303: COOPER | N1303: HENRYS | Q1303: CANN
A1304: GOALKICKERS
A1305: BRIGHTON | C1305: PLUNKETT 2 | F1305: PICKERING 2 | I1305: LE GRIFFIN 2 | L1305: BURKE 2 | N1305: O'MEARA | P1305: HALL | R1305: FEHR
A1306: PRESTON | C1306: F CHARD 4 | F1306: CANN 2 | H1306: HAYES | J1306: FOLEY | L1306: HARRISON
A1308: FINALS
A1309: 1ST SEMI | D1309: 13TH SEPTEMBER | J1309: WEATHER | M1309: NORTH WEST BREEZE FINE
D1310: 1ST QTR | H1310: 2ND QTR | L1310: 3RD QTR | P1310: FINAL
A1311: OAKLEIGH | C1311: 7 | D1311: 4 | E1311: =C1311*6+D1311 -> 46 | G1311: 8 | H1311: 6 | I1311: =G1311*6+H1311 -> 54 | K1311: 13 | L1311: 9 | M1311: =K1311*6+L1311 -> 87 | O1311: 14 | P1311: 10 | Q1311: =O1311*6+P1311 -> 94 | S1311: JUNCTION OVAL
A1312: YARRAVILLE | C1312: 3 | D1312: 2 | E1312: =C1312*6+D1312 -> 20 | G1312: 6 | H1312: 8 | I1312: =G1312*6+H1312 -> 44 | K1312: 7 | L1312: 11 | M1312: =K1312*6+L1312 -> 53 | O1312: 13 | P1312: 15 | Q1312: =O1312*6+P1312 -> 93 | S1312: IRVING
A1313: BEST PLAYERS
A1314: OAKLEIGH | C1314: VAINS | F1314: TEMME | I1314: WENN | L1314: SCOTT | O1314: BAXTER | R1314: NEWTON
A1315: YARRAVILLE | C1315: H MASON | F1315: TAYLOR | I1315: CRANAGE | L1315: NICHOLLS | O1315: J ROHLEDER | R1315: PHILLIPS
A1316: GOALKICKERS
A1317: OAKLEIGH | C1317: SCOTT 4 | F1317: WENN 4 | I1317: WATSON 3 | L1317: NEWTON 2 | O1317: PERKINS
A1318: YARRAVILLE | C1318: H MASON 3 | F1318: PHILLIPS 3 | I1318: WAGHORNE 3 | L1318: BODSWORTH 2 | O1318: R MASON | Q1318: SMALLWOOD
A1320: 2ND SEMI | E1320: 20TH SEPTEMBER | J1320: WEATHER | N1320: STRONG WEST GALE
A1321: PORT MELBOURNE | C1321: 1 | D1321: 0 | E1321: =C1321*6+D1321 -> 6 | G1321: 3 | H1321: 2 | I1321: =G1321*6+H1321 -> 20 | K1321: 5 | L1321: 2 | M1321: =K1321*6+L1321 -> 32 | O1321: 11 | P1321: 8 | Q1321: =O1321*6+P1321 -> 74 | S1321: JUNCTION OVAL
A1322: COBURG | C1322: 1 | D1322: 6 | E1322: =C1322*6+D1322 -> 12 | G1322: 1 | H1322: 9 | I1322: =G1322*6+H1322 -> 15 | K1322: 4 | L1322: 11 | M1322: =K1322*6+L1322 -> 35 | O1322: 5 | P1322: 11 | Q1322: =O1322*6+P1322 -> 41 | S1322: IRVING
A1323: BEST PLAYERS
A1324: PORT MELBOURNE | C1324: WILSON | F1324: LEEHANE | I1324: KELSEY | L1324: JOHNSON | O1324: B MILLER | R1324: WOODBRIDGE
A1325: COBURG | C1325: STARBUCK | F1325: ROGAN | I1325: FEWKES | L1325: LAMBERT | O1325: MAHONEY | R1325: H WILKINSON
A1326: GOALKICKERS
A1327: PORT MELBOURNE | C1327: HOULIHAN 2 | F1327: B MILLER 2 | I1327: BOWER 2 | K1327: BONNETT | M1327: WALSH | O1327: AUSTIN | Q1327: JOHNSON | S1327: STOREY
A1328: COBURG | C1328: McDONALD 2 | F1328: ROGAN | H1328: CANNING | J1328: EVANS
A1330: PRELIMINARY FINAL | G1330: 27TH SEPTEMBER | K1330: WEATHER | N1330: SOUTH WEST BREEZE FINE & WARM
A1331: OAKLEIGH | C1331: 3 | D1331: 2 | E1331: =C1331*6+D1331 -> 20 | G1331: 6 | H1331: 6 | I1331: =G1331*6+H1331 -> 42 | K1331: 7 | L1331: 7 | M1331: =K1331*6+L1331 -> 49 | O1331: 11 | P1331: 11 | Q1331: =O1331*6+P1331 -> 77 | S1331: JUNCTION OVAL
A1332: COBURG | C1332: 4 | D1332: 2 | E1332: =C1332*6+D1332 -> 26 | G1332: 5 | H1332: 3 | I1332: =G1332*6+H1332 -> 33 | K1332: 8 | L1332: 9 | M1332: =K1332*6+L1332 -> 57 | O1332: 8 | P1332: 10 | Q1332: =O1332*6+P1332 -> 58 | S1332: MERRINGTON
A1333: BEST PLAYERS
A1334: OAKLEIGH | C1334: SAVORY | F1334: TINDAL | I1334: VAINS | L1334: TEMME | O1334: BAXTER | Q1334: HILL
A1335: COBURG | C1335: FEWKES | F1335: WALKER | I1335: MAHONEY | L1335: LEVERSHA | O1335: CONDON | Q1335: LAMBERT
A1336: GOALKICKERS
A1337: OAKLEIGH | C1337: WATSON 4 | F1337: SCOTT 3 | I1337: WENN 2 | K1337: H WILLIAMS | N1337: NEWTON
A1338: COBURG | C1338: JAMES 2 | F1338: CANNING | I1338: HEWES | K1338: MAHONEY | N1338: ROGAN | P1338: LEVERSHA | S1338: EVANS
A1340: GRAND FINAL | E1340: 4TH OCTOBER | K1340: WEATHER | N1340: SOUTH WEST BREEZE DULL
A1341: OAKLEIGH | C1341: 2 | D1341: 5 | E1341: 17 | G1341: 5 | H1341: 9 | I1341: 39 | K1341: 9 | L1341: 12 | M1341: 66 | O1341: 11 | P1341: 18 | Q1341: =O1341*6+P1341 -> 84 | S1341: JUNCTION OVAL
A1342: PORT MELBOURNE | C1342: 1 | D1342: 4 | E1342: 10 | G1342: 2 | H1342: 7 | I1342: 19 | K1342: 5 | L1342: 12 | M1342: 42 | O1342: 8 | P1342: 15 | Q1342: =O1342*6+P1342 -> 63 | S1342: MERRINGTON
A1343: BEST PLAYERS
A1344: OAKLEIGH | C1344: BAXTER | F1344: HILL | I1344: VAINS | L1344: TINDAL | O1344: WENN | Q1344: SAVORY
A1345: PORT MELBOURNE | C1345: JOHNSON | F1345: LEEHANE | I1345: WILSON | L1345: KELSEY | O1345: CARIS | Q1345: CROFT
A1346: GOALKICKERS
A1347: OAKLEIGH | C1347: SCOTT 4 | F1347: WENN 3 | I1347: NEWTON 2 | L1347: CUNNINGHAM | O1347: WATSON
A1348: PORT MELBOURNE | C1348: BONNETT 3 | F1348: CARIS 2 | I1348: BOWER | K1348: HOULIHAN | N1348: MURRAY