A1: Victorian Football Association
A2: Season 1953
A3: © Copyright Wal Williams | F3: First created: 2 November 2014
A4: Contact: joywalwi at gmail dot com | F4: Last updated: 27 January 2018 | W4: VFA Results and tables - Link to the main index page
A5: You are free to copy this document in whole or part provided that proper acknowledgement is given to the author. All rights reserved.
A7: YEAR 1953
A8: ROUND 1 | E8: 18TH APRIL | K8: WEATHER | N8: DULL LIGHT RAIN | S8: PLAYED AT
D9: 1ST QTR | H9: 2ND QTR | L9: 3RD QTR | P9: FINAL | S9: YARRAVILLE
A10: WILLIAMSTOWN | C10: 2 | D10: 3 | E10: =C10*6+D10 -> 15 | G10: 6 | H10: 4 | I10: =G10*6+H10 -> 40 | K10: 9 | L10: 7 | M10: =K10*6+L10 -> 61 | O10: 13 | P10: 10 | Q10: =O10*6+P10 -> 88 | S10: UMPIRE | X10: LADDER | AB10: ROUND | AD10: 1
A11: YARRAVILLE | C11: 2 | D11: 3 | E11: =C11*6+D11 -> 15 | G11: 2 | H11: 5 | I11: =G11*6+H11 -> 17 | K11: 7 | L11: 5 | M11: =K11*6+L11 -> 47 | O11: 9 | P11: 8 | Q11: =O11*6+P11 -> 62 | S11: CARDWELL
A12: BEST PLAYERS | W12: TEAM | X12: W | Y12: L | Z12: D | AA12: FOR | AB12: AGST | AC12: % | AD12: PTS
A13: WILLIAMSTOWN | C13: B WILLIAMS | F13: MUNDAY | I13: LINTON | K13: WALKER | N13: ROGERS | Q13: W WILLIAMS
A14: YARRAVILLE | C14: PHILLIPS | F14: H MASON | I14: SALT | K14: SMALLWOOD | N14: TAYLOR | Q14: BODSWORTH | W14: PORT MELBOURNE | X14: 1 | Y14: 0 | Z14: 0 | AA14: 99 | AB14: 55 | AC14: 180 | AD14: 4
A15: GOALKICKERS | W15: COBURG | X15: 1 | Y15: 0 | Z15: 0 | AA15: 88 | AB15: 57 | AC15: 154.38596491228071 | AD15: 4
A16: WILLIAMSTOWN | C16: WALKER 6 | F16: B WILLIAMS 3 | I16: W WILLIAMS 2 | L16: SHEAHAN | N16: TAAFE | W16: PRESTON | X16: 1 | Y16: 0 | Z16: 0 | AA16: 66 | AB16: 45 | AC16: 146.66666666666666 | AD16: 4
A17: YARRAVILLE | C17: H MASON 4 | F17: SMALLWOOD 2 | J17: HARGREAVES 2 | N17: BODSWORTH | W17: SANDRINGHAM | X17: 1 | Y17: 0 | Z17: 0 | AA17: 92 | AB17: 64 | AC17: 143.75 | AD17: 4
A19: MOORABBIN | C19: 2 | D19: 4 | E19: =C19*6+D19 -> 16 | G19: 4 | H19: 7 | I19: =G19*6+H19 -> 31 | K19: 6 | L19: 9 | M19: =K19*6+L19 -> 45 | O19: 6 | P19: 10 | Q19: =O19*6+P19 -> 46 | S19: MOORABBIN | W19: WILLIAMSTOWN | X19: 1 | Y19: 0 | Z19: 0 | AA19: 88 | AB19: 62 | AC19: =(+AA19/AB19)*100 -> 141.93548387096774 | AD19: 4
A20: OAKLEIGH | C20: 2 | D20: 2 | E20: =C20*6+D20 -> 14 | G20: 4 | H20: 5 | I20: =G20*6+H20 -> 29 | K20: 4 | L20: 6 | M20: =K20*6+L20 -> 30 | O20: 5 | P20: 11 | Q20: =O20*6+P20 -> 41 | S20: IRVING | W20: CAMBERWELL | X20: 1 | Y20: 0 | Z20: 0 | AA20: 52 | AB20: 43 | AC20: 120.93023255813954 | AD20: 4
A21: BEST PLAYERS | W21: MOORABBIN | X21: 1 | Y21: 0 | Z21: 0 | AA21: 46 | AB21: 41 | AC21: 112.19512195121951 | AD21: 4
A22: MOORABBIN | C22: GILDER | E22: DALY | H22: WALSH | K22: ANTONIE | N22: McKENZIE | Q22: MUNYARD | W22: OAKLEIGH | X22: 0 | Y22: 1 | Z22: 0 | AA22: 41 | AB22: 46 | AC22: 89.130434782608702 | AD22: 0
A23: OAKLEIGH | C23: TINDAL | E23: TEMME | H23: SAVORY | K23: GUY | N23: NEWTON | Q23: HILL | W23: BOX HILL | X23: 0 | Y23: 1 | Z23: 0 | AA23: 43 | AB23: 52 | AC23: 82.692307692307693 | AD23: 0
A24: GOALKICKERS | W24: YARRAVILLE | X24: 0 | Y24: 1 | Z24: 0 | AA24: 62 | AB24: 88 | AC24: =(+AA24/AB24)*100 -> 70.454545454545453 | AD24: 0
A25: MOORABBIN | C25: WALSH 2 | F25: PATTISON | I25: COAD | L25: BAKER | N25: ANTONIE | W25: BRIGHTON | X25: 0 | Y25: 1 | Z25: 0 | AA25: 64 | AB25: 92 | AC25: 69.565217391304344 | AD25: 0
A26: OAKLEIGH | C26: J WATSON 2 | F26: BLACKBURN | I26: EDWARDS | L26: NEWTON | W26: NORTHCOTE | X26: 0 | Y26: 1 | Z26: 0 | AA26: 45 | AB26: 66 | AC26: 68.181818181818187 | AD26: 0
W27: BRUNSWICK | X27: 0 | Y27: 1 | Z27: 0 | AA27: 57 | AB27: 88 | AC27: 64.772727272727266 | AD27: 0
A28: CAMBERWELL | C28: 2 | D28: 3 | E28: =C28*6+D28 -> 15 | G28: 4 | H28: 6 | I28: =G28*6+H28 -> 30 | K28: 5 | L28: 8 | M28: =K28*6+L28 -> 38 | O28: 7 | P28: 10 | Q28: =O28*6+P28 -> 52 | S28: CAMBERWELL | W28: PRAHRAN | X28: 0 | Y28: 1 | Z28: 0 | AA28: 55 | AB28: 99 | AC28: 55.555555555555557 | AD28: 0
A29: BOX HILL | C29: 0 | D29: 4 | E29: =C29*6+D29 -> 4 | G29: 0 | H29: 7 | I29: =G29*6+H29 -> 7 | K29: 4 | L29: 9 | M29: =K29*6+L29 -> 33 | O29: 5 | P29: 13 | Q29: =O29*6+P29 -> 43 | S29: CARDWELL
A30: BEST PLAYERS
A31: CAMBERWELL | C31: MASON | E31: BOHAN | H31: WAIN | K31: ALLSOP | N31: SCOTT | Q31: McGUINNESS
A32: BOX HILL | C32: MORRIS | E32: EVANS | H32: PARKS | K32: H BLUNDY | N32: HOUGHTON | Q32: HOCKEN
A33: GOALKICKERS
A34: CAMBERWELL | C34: ALLSOP 2 | F34: BURCHILL 2 | I34: SCOTT | K34: HAYES | M34: HEDLEY
A35: BOX HILL | C35: WINDOW 2 | F35: EVANS | I35: LOVE | K35: HOCKEN
A37: COBURG | C37: 6 | D37: 7 | E37: =C37*6+D37 -> 43 | G37: 7 | H37: 10 | I37: =G37*6+H37 -> 52 | K37: 11 | L37: 11 | M37: =K37*6+L37 -> 77 | O37: 12 | P37: 16 | Q37: =O37*6+P37 -> 88 | S37: BRUNSWICK
A38: BRUNSWICK | C38: 2 | D38: 1 | E38: =C38*6+D38 -> 13 | G38: 4 | H38: 6 | I38: =G38*6+H38 -> 30 | K38: 6 | L38: 10 | M38: =K38*6+L38 -> 46 | O38: 7 | P38: 15 | Q38: =O38*6+P38 -> 57 | S38: MERRINGTON
A39: BEST PLAYERS
A40: COBURG | C40: ROGAN | E40: BULMAN | H40: SPARKS | K40: WALKER | N40: R WILKINSON | Q40: McDONALD
A41: BRUNSWICK | C41: ROLFS | E41: YEA | H41: DUNSTAN | K41: SEYMOUR | N41: MUNRO | Q41: STANLEY
A42: GOALKICKERS
A43: COBURG | C43: ROGAN 4 | F43: R WILKINSON 2 | J43: HEWES 2 | M43: McTAGGART | P43: MAHONEY | R43: H WILKINSON | V43: CANNING
A44: BRUNSWICK | C44: HUNTER 2 | F44: DUNSTAN | I44: WEIR | K44: McFARLANE | N44: MULLENGER | Q44: MAY
A46: PORT MELBOURNE | C46: 3 | D46: 5 | E46: =C46*6+D46 -> 23 | G46: 7 | H46: 7 | I46: =G46*6+H46 -> 49 | K46: 11 | L46: 11 | M46: =K46*6+L46 -> 77 | O46: 14 | P46: 15 | Q46: =O46*6+P46 -> 99 | S46: PORT MELBOURNE
A47: PRAHRAN | C47: 5 | D47: 0 | E47: =C47*6+D47 -> 30 | G47: 7 | H47: 0 | I47: =G47*6+H47 -> 42 | K47: 8 | L47: 0 | M47: =K47*6+L47 -> 48 | O47: 9 | P47: 1 | Q47: =O47*6+P47 -> 55 | S47: RICHARDSON
A48: BEST PLAYERS
A49: PORT MELBOURNE | C49: MILLER | F49: STOREY | I49: WOODBRIDGE | L49: JOHNSON | O49: WALSH | Q49: BONNETT
A50: PRAHRAN | C50: CAMPBELL | F50: LOUREY | I50: C BOYD | L50: KRUSE | O50: YATES | Q50: HARVEY
A51: GOALKICKERS
A52: PORT MELBOURNE | C52: BONNETT 4 | F52: TOWNSING 2 | I52: MILLER 2 | K52: BRAGG 2 | M52: HOULIHAN | P52: MURRAY | R52: OWENS | T52: WALSH
A53: PRAHRAN | C53: HARVEY 4 | F53: BEATON 2 | I53: LOUREY (2) | K53: ELLIOTT
A55: SANDRINGHAM | C55: 5 | D55: 2 | E55: =C55*6+D55 -> 32 | G55: 9 | H55: 7 | I55: =G55*6+H55 -> 61 | K55: 11 | L55: 11 | M55: =K55*6+L55 -> 77 | O55: 13 | P55: 14 | Q55: =O55*6+P55 -> 92 | S55: ELSTERNWICK PARK
A56: BRIGHTON | C56: 1 | D56: 2 | E56: =C56*6+D56 -> 8 | G56: 3 | H56: 2 | I56: =G56*6+H56 -> 20 | K56: 4 | L56: 6 | M56: =K56*6+L56 -> 30 | O56: 9 | P56: 10 | Q56: =O56*6+P56 -> 64 | S56: BAGULEY
A57: BEST PLAYERS
A58: SANDRINGHAM | C58: JONES | E58: B HARPER | H58: BOURKE | K58: MILLER | N58: POTTER | Q58: RUSSELL
A59: BRIGHTON | C59: POUND | E59: CONROY | H59: ALEXANDER | K59: HARRINGTON | N59: CUMMINGS | Q59: FREEMAN
A60: GOALKICKERS
A61: SANDRINGHAM | C61: B HARPER 5 | F61: HANKINSON 2 | J61: JONES 2 | M61: MORONEY 2 | P61: BOURKE | R61: POTTER
A62: BRIGHTON | C62: POUND 4 | F62: HARRINGTON 2 | J62: CUMMINGS | M62: BURRELL | P62: MARINI
A64: PRESTON | C64: 3 | D64: 2 | E64: =C64*6+D64 -> 20 | G64: 7 | H64: 5 | I64: =G64*6+H64 -> 47 | K64: 7 | L64: 8 | M64: =K64*6+L64 -> 50 | O64: 9 | P64: 12 | Q64: =O64*6+P64 -> 66 | S64: PRESTON
A65: NORTHCOTE | C65: 1 | D65: 8 | E65: =C65*6+D65 -> 14 | G65: 2 | H65: 12 | I65: =G65*6+H65 -> 24 | K65: 4 | L65: 17 | M65: =K65*6+L65 -> 41 | O65: 4 | P65: 21 | Q65: =O65*6+P65 -> 45 | S65: HARWOOD
A66: BEST PLAYERS
A67: PRESTON | C67: BATEMAN | F67: HENRYS | I67: PASCOE | K67: DEACON | N67: CHARD | Q67: McLAREN
A68: NORTHCOTE | C68: PAWSEY | F68: McLAINE | I68: GIBBS | K68: O'LEARY | N68: HARTLEY | Q68: WOOLNOUGH
A69: GOALKICKERS
A70: PRESTON | C70: McLAHLAN 2 | F70: LALOR 2 | I70: CHARD 2 | K70: BATEMAN | M70: COOPER | O70: TURNER
A71: NORTHCOTE | C71: PAWSEY 2 | F71: FRANCIS | I71: HARTLEY
A73: ROUND 2 | E73: 2ND MAY | J73: WEATHER | O73: FINE & SUNNY | S73: PLAYED AT
D74: 1ST QTR | H74: 2ND QTR | L74: 3RD QTR | P74: FINAL | S74: COBURG
A75: PORT MELBOURNE | C75: 7 | D75: 2 | E75: =C75*6+D75 -> 44 | G75: 9 | H75: 5 | I75: =G75*6+H75 -> 59 | K75: 15 | L75: 8 | M75: =K75*6+L75 -> 98 | O75: 18 | P75: 13 | Q75: =O75*6+P75 -> 121 | S75: UMPIRE | X75: LADDER | AB75: ROUND | AD75: 2
A76: COBURG | C76: 3 | D76: 3 | E76: =C76*6+D76 -> 21 | G76: 3 | H76: 5 | I76: =G76*6+H76 -> 23 | K76: 6 | L76: 8 | M76: =K76*6+L76 -> 44 | O76: 8 | P76: 11 | Q76: =O76*6+P76 -> 59 | S76: IRVING
A77: BEST PLAYERS | W77: TEAM | X77: W | Y77: L | Z77: D | AA77: FOR | AB77: AGST | AC77: % | AD77: PTS
A78: PORT MELBOURNE | C78: TOWNSING | F78: FRASER | I78: MURRAY | L78: HOULIHAN | N78: WALSH | Q78: KELSEY
A79: COBURG | C79: HEWES | F79: McTAGGART | I79: R WILKINSON | L79: ROGAN | N79: McDONALD | Q79: CONDON | W79: PORT MELBOURNE | X79: 2 | Y79: 0 | Z79: 0 | AA79: 220 | AB79: 114 | AC79: 192.98245614035088 | AD79: 8
A80: GOALKICKERS | W80: WILLIAMSTOWN | X80: 2 | Y80: 0 | Z80: 0 | AA80: 225 | AB80: 119 | AC80: =(+AA80/AB80)*100 -> 189.07563025210084 | AD80: 8
A81: PORT MELBOURNE | C81: HOULIHAN 5 | F81: TOWNSING 4 | I81: WALSH 3 | K81: MURRAY 3 | N81: BONNETT 2 | Q81: OWENS | W81: MOORABBIN | X81: 1 | Y81: 0 | Z81: 1 | AA81: 102 | AB81: 97 | AC81: 105.15463917525773 | AD81: 6
A82: COBURG | C82: HEWES 5 | F82: McTAGGART 2 | J82: AITKEN | W82: BOX HILL | X82: 1 | Y82: 1 | Z82: 0 | AA82: 172 | AB82: 115 | AC82: 149.56521739130434 | AD82: 4
A84: WILLIAMSTOWN | C84: 2 | D84: 7 | E84: =C84*6+D84 -> 19 | G84: 7 | H84: 9 | I84: =G84*6+H84 -> 51 | K84: 15 | L84: 13 | M84: =K84*6+L84 -> 103 | O84: 20 | P84: 17 | Q84: =O84*6+P84 -> 137 | S84: WILLIAMSTOWN | W84: OAKLEIGH | X84: 1 | Y84: 1 | Z84: 0 | AA84: 148 | AB84: 140 | AC84: 105.71428571428571 | AD84: 4
A85: CAMBERWELL | C85: 1 | D85: 2 | E85: =C85*6+D85 -> 8 | G85: 5 | H85: 6 | I85: =G85*6+H85 -> 36 | K85: 6 | L85: 7 | M85: =K85*6+L85 -> 43 | O85: 8 | P85: 9 | Q85: =O85*6+P85 -> 57 | S85: HARWOOD | W85: PRESTON | X85: 1 | Y85: 1 | Z85: 0 | AA85: 160 | AB85: 152 | AC85: 105.26315789473684 | AD85: 4
A86: BEST PLAYERS | W86: BRUNSWICK | X86: 1 | Y86: 1 | Z86: 0 | AA86: 144 | AB86: 153 | AC86: 94.117647058823536 | AD86: 4
A87: WILLIAMSTOWN | C87: WALKER | F87: MUNDAY | I87: G WILLIAMS | L87: TAAFE | N87: LINTON | Q87: DULLARD | W87: COBURG | X87: 1 | Y87: 1 | Z87: 0 | AA87: 147 | AB87: 178 | AC87: 82.584269662921344 | AD87: 4
A88: CAMBERWELL | C88: MASON | F88: DUFF | I88: HEDLEY | L88: McFEE | N88: THYNNE | Q88: MARION | W88: SANDRINGHAM | X88: 1 | Y88: 1 | Z88: 0 | AA88: 155 | AB88: 193 | AC88: 80.310880829015545 | AD88: 4
A89: GOALKICKERS | W89: PRAHRAN | X89: 1 | Y89: 1 | Z89: 0 | AA89: 144 | AB89: 185 | AC89: 77.837837837837839 | AD89: 4
A90: WILLIAMSTOWN | C90: WALKER 8 | F90: W WILLIAMS 4 | J90: DULLARD 3 | M90: SIMPSON 2 | P90: SHEAHAN | R90: SMITH | T90: LINTON | W90: CAMBERWELL | X90: 1 | Y90: 1 | Z90: 0 | AA90: 109 | AB90: 180 | AC90: 60.555555555555557 | AD90: 4
A91: CAMBERWELL | C91: SCOTT 3 | F91: HAYES 2 | I91: BRADLEY | K91: BURCHELL | M91: McFEE | W91: YARRAVILLE | X91: 0 | Y91: 1 | Z91: 1 | AA91: 118 | AB91: 144 | AC91: =(+AA91/AB91)*100 -> 81.944444444444443 | AD91: 2
W92: BRIGHTON | X92: 0 | Y92: 2 | Z92: 0 | AA92: 150 | AB92: 181 | AC92: 82.872928176795583 | AD92: 0
A93: OAKLEIGH | C93: 6 | D93: 2 | E93: =C93*6+D93 -> 38 | G93: 9 | H93: 5 | I93: =G93*6+H93 -> 59 | K93: 12 | L93: 9 | M93: =K93*6+L93 -> 81 | O93: 16 | P93: 11 | Q93: =O93*6+P93 -> 107 | S93: OAKLEIGH | W93: NORTHCOTE | X93: 0 | Y93: 2 | Z93: 0 | AA93: 110 | AB93: 153 | AC93: 71.895424836601308 | AD93: 0
A94: PRESTON | C94: 3 | D94: 3 | E94: =C94*6+D94 -> 21 | G94: 6 | H94: 6 | I94: =G94*6+H94 -> 42 | K94: 11 | L94: 7 | M94: =K94*6+L94 -> 73 | O94: 14 | P94: 10 | Q94: =O94*6+P94 -> 94 | S94: MERRINGTON
A95: BEST PLAYERS
A96: OAKLEIGH | C96: SAVORY | F96: HILL | I96: GUY | K96: CADMAN | N96: NEWTON | Q96: W WILLIAMS
A97: PRESTON | C97: HAYES | F97: F CHARD | I97: CROCKER | K97: BATEMAN | N97: HARRISON | Q97: FOLEY
A98: GOALKICKERS
A99: OAKLEIGH | C99: NEWTON 5 | F99: CADMAN 3 | I99: EDWARDS 2 | L99: WATSON | N99: HILL | P99: H WILLIAMS | S99: SAVORY | U99: I'ANSON | X99: LAMBERT
A100: PRESTON | C100: F CHARD 5 | F100: HAYES 3 | I100: TURNER 2 | L100: FOLEY | N100: CANN | P100: BATEMAN | S100: COOPER
A102: BOX HILL | C102: 4 | D102: 2 | E102: =C102*6+D102 -> 26 | G102: 9 | H102: 5 | I102: =G102*6+H102 -> 59 | K102: 14 | L102: 8 | M102: =K102*6+L102 -> 92 | O102: 19 | P102: 15 | Q102: =O102*6+P102 -> 129 | S102: BEACH ROAD
A103: SANDRINGHAM | C103: 2 | D103: 0 | E103: =C103*6+D103 -> 12 | G103: 4 | H103: 3 | I103: =G103*6+H103 -> 27 | K103: 6 | L103: 6 | M103: =K103*6+L103 -> 42 | O103: 9 | P103: 9 | Q103: =O103*6+P103 -> 63 | S103: BARKER
A104: BEST PLAYERS
A105: BOX HILL | C105: W BLUNDY | F105: HOCKEN | I105: GREEN | L105: LOVE | N105: EVANS | Q105: WITHERDEN
A106: SANDRINGHAM | C106: WOODS | F106: JONES | I106: B HARPER | L106: MILLER | N106: BOURKE | Q106: PHILLIPS
A107: GOALKICKERS
A108: BOX HILL | C108: HOCKEN 7 | F108: EVANS 3 | I108: GREEN 3 | K108: WINDOW 2 | N108: W BLUNDY | Q108: MORRIS | S108: LOVE | U108: GARDINER
A109: SANDRINGHAM | C109: B HARPER 4 | F109: JONES 2 | I109: PHILLIPS 2 | L109: POTTER
A111: MOORABBIN | C111: 2 | D111: 3 | E111: =C111*6+D111 -> 15 | G111: 4 | H111: 7 | I111: =G111*6+H111 -> 31 | K111: 5 | L111: 8 | M111: =K111*6+L111 -> 38 | O111: 7 | P111: 14 | Q111: =O111*6+P111 -> 56 | S111: MOORABBIN
A112: YARRAVILLE | C112: 3 | D112: 2 | E112: =C112*6+D112 -> 20 | G112: 3 | H112: 4 | I112: =G112*6+H112 -> 22 | K112: 7 | L112: 8 | M112: =K112*6+L112 -> 50 | O112: 8 | P112: 8 | Q112: =O112*6+P112 -> 56 | S112: CARDWELL
A113: BEST PLAYERS
A114: MOORABBIN | C114: GILDER | F114: BAKER | I114: PATTISON | L114: WALSH | N114: STANLEY | Q114: DICKENSON
A115: YARRAVILLE | C115: SMALLWOOD | F115: HUGHES | I115: COOK | L115: MITCHELL | N115: SALT | Q115: VANDERFEEN
A116: GOALKICKERS
A117: MOORABBIN | C117: DICKENSON 3 | G117: McNEILAGE 2 | J117: ANTONIE | M117: WALSH
A118: YARRAVILLE | C118: SMALLWOOD 5 | G118: BODSWORTH | J118: COOK | L118: R MASON
A120: PRAHRAN | C120: 2 | D120: 7 | E120: =C120*6+D120 -> 19 | G120: 4 | H120: 15 | I120: =G120*6+H120 -> 39 | K120: 7 | L120: 17 | M120: =K120*6+L120 -> 59 | O120: 11 | P120: 23 | Q120: =O120*6+P120 -> 89 | S120: TOORAK PARK
A121: BRIGHTON | C121: 5 | D121: 3 | E121: =C121*6+D121 -> 33 | G121: 5 | H121: 6 | I121: =G121*6+H121 -> 36 | K121: 12 | L121: 7 | M121: =K121*6+L121 -> 79 | O121: 13 | P121: 8 | Q121: =O121*6+P121 -> 86 | S121: BARKER
A122: BEST PLAYERS
A123: PRAHRAN | C123: PLAIN | F123: ELLIOTT | I123: WALES | K123: LOUREY | N123: ARMSTRONG | Q123: YATES
A124: BRIGHTON | C124: HARRINGTON | F124: CUMMINGS | I124: RILEY | K124: CURRIE | N124: BLACKMORE | Q124: WOODS
A125: GOALKICKERS
A126: PRAHRAN | C126: HARVEY 3 | F126: C BOYD 3 | I126: SNOW 2 | K126: LOUREY | M126: KRUSE | O126: WALES
A127: BRIGHTON | C127: POUND 4 | F127: HARRINGTON 2 | J127: MARINO 2 | M127: G CONROY 2 | P127: RILEY | R127: TOOHEY | U127: BOWLES
A129: BRUNSWICK | C129: 3 | D129: 6 | E129: =C129*6+D129 -> 24 | G129: 5 | H129: 8 | I129: =G129*6+H129 -> 38 | K129: 10 | L129: 12 | M129: =K129*6+L129 -> 72 | O129: 12 | P129: 15 | Q129: =O129*6+P129 -> 87 | S129: NORTHCOTE
A130: NORTHCOTE | C130: 2 | D130: 0 | E130: =C130*6+D130 -> 12 | G130: 5 | H130: 2 | I130: =G130*6+H130 -> 32 | K130: 7 | L130: 3 | M130: =K130*6+L130 -> 45 | O130: 10 | P130: 5 | Q130: =O130*6+P130 -> 65 | S130: BAGULEY
A131: BEST PLAYERS
A132: BRUNSWICK | C132: LOVETT | F132: MAY | I132: HUNTER | L132: STANLEY | N132: SEYMOUR | Q132: YEA
A133: NORTHCOTE | C133: KNOWLES | F133: WOOLNOUGH | I133: McLAINE | L133: O'LEARY | N133: FRANCIS | Q133: STABB
A134: GOALKICKERS
A135: BRUNSWICK | C135: HUNTER 7 | F135: WEIR 3 | H135: MULLENGER | K135: STANLEY
A136: NORTHCOTE | C136: FRANCIS 3 | F136: STABB 2 | I136: E WHITE 2 | L136: PAWSEY | N136: HARTLEY | Q136: DAVIES
A138: ROUND 3 | E138: 9TH MAY | K138: WEATHER | P138: DULL FOGGY | S138: PLAYED AT
D139: 1ST QTR | H139: 2ND QTR | L139: 3RD QTR | P139: FINAL | S139: PORT MELBOURNE
A140: PORT MELBOURNE | C140: 4 | D140: 2 | E140: =C140*6+D140 -> 26 | G140: 7 | H140: 10 | I140: =G140*6+H140 -> 52 | K140: 8 | L140: 17 | M140: =K140*6+L140 -> 65 | O140: 13 | P140: 24 | Q140: =O140*6+P140 -> 102 | S140: UMPIRE | X140: LADDER | AB140: ROUND | AD140: 3
A141: MOORABBIN | C141: 1 | D141: 3 | E141: =C141*6+D141 -> 9 | G141: 1 | H141: 5 | I141: =G141*6+H141 -> 11 | K141: 2 | L141: 7 | M141: =K141*6+L141 -> 19 | O141: 4 | P141: 9 | Q141: =O141*6+P141 -> 33 | S141: E BAGULEY
A142: BEST PLAYERS | W142: TEAM | X142: W | Y142: L | Z142: D | AA142: FOR | AB142: AGST | AC142: % | AD142: PTS
A143: PORT MELBOURNE | C143: FRASER | E143: LAFFEY | H143: WOODBRIDGE | K143: STOREY | N143: BONNETT | Q143: KELSEY
A144: MOORABBIN | C144: BOYD | E144: STANLEY | H144: GILDER | K144: McKENZIE | N144: BROWN | Q144: PATTISON | W144: WILLIAMSTOWN | X144: 3 | Y144: 0 | Z144: 0 | AA144: 384 | AB144: 163 | AC144: =(+AA144/AB144)*100 -> 235.58282208588957 | AD144: 12
A145: GOALKICKERS | W145: PORT MELBOURNE | X145: 3 | Y145: 0 | Z145: 0 | AA145: 322 | AB145: 147 | AC145: 219.04761904761904 | AD145: 12
A146: PORT MELBOURNE | C146: BONNETT 5 | F146: MURRAY 3 | I146: OWENS 2 | K146: WALSH | M146: TOWNSING | P146: TUCKER | W146: BRUNSWICK | X146: 2 | Y146: 1 | Z146: 0 | AA146: 251 | AB146: 219 | AC146: 114.61187214611873 | AD146: 8
A147: MOORABBIN | C147: WALSH 2 | F147: McNEILAGE | I147: BOYD | W147: PRESTON | X147: 2 | Y147: 1 | Z147: 0 | AA147: 215 | AB147: 192 | AC147: 111.97916666666667 | AD147: 8
A149: COBURG | C149: 3 | D149: 2 | E149: =C149*6+D149 -> 20 | G149: 9 | H149: 3 | I149: =G149*6+H149 -> 57 | K149: 11 | L149: 9 | M149: =K149*6+L149 -> 75 | O149: 14 | P149: 11 | Q149: =O149*6+P149 -> 95 | S149: BOX HILL | W149: COBURG | X149: 2 | Y149: 1 | Z149: 0 | AA149: 242 | AB149: 251 | AC149: 96.414342629482078 | AD149: 8
A150: BOX HILL | C150: 2 | D150: 4 | E150: =C150*6+D150 -> 16 | G150: 7 | H150: 6 | I150: =G150*6+H150 -> 48 | K150: 8 | L150: 10 | M150: =K150*6+L150 -> 58 | O150: 10 | P150: 13 | Q150: =O150*6+P150 -> 73 | S150: MERRINGTON | W150: CAMBERWELL | X150: 2 | Y150: 1 | Z150: 0 | AA150: 202 | AB150: 259 | AC150: 77.992277992277991 | AD150: 8
A151: BEST PLAYERS | W151: OAKLEIGH | X151: 1 | Y151: 1 | Z151: 1 | AA151: 233 | AB151: 225 | AC151: 103.55555555555556 | AD151: 6
A152: COBURG | C152: HEWES | E152: ROGAN | H152: STARBUCK | K152: CONDON | N152: H WILKINSON | Q152: EVANS | W152: MOORABBIN | X152: 1 | Y152: 1 | Z152: 1 | AA152: 135 | AB152: 199 | AC152: 67.8391959798995 | AD152: 6
A153: BOX HILL | C153: GREEN | E153: JEFFERS | H153: HOCKEN | K153: MORRIS | N153: WRIGHT | Q153: TURNER | W153: BOX HILL | X153: 1 | Y153: 2 | Z153: 0 | AA153: 245 | AB153: 210 | AC153: 116.66666666666667 | AD153: 4
A154: GOALKICKERS | W154: YARRAVILLE | X154: 0 | Y154: 1 | Z154: 2 | AA154: 203 | AB154: 229 | AC154: =(+AA154/AB154)*100 -> 88.646288209606979 | AD154: 4
A155: COBURG | C155: ROGAN 5 | F155: H WILKINSON 3 | J155: HEWES 3 | M155: AITKEN 2 | O155: McDONALD | W155: PRAHRAN | X155: 1 | Y155: 2 | Z155: 0 | AA155: 184 | AB155: 240 | AC155: 76.666666666666671 | AD155: 4
A156: BOX HILL | C156: HOCKEN 5 | F156: TURNER 2 | I156: GREEN | K156: W BLUNDY | N156: LOVE | W156: SANDRINGHAM | X156: 1 | Y156: 2 | Z156: 0 | AA156: 221 | AB156: 300 | AC156: 73.666666666666671 | AD156: 4
W157: NORTHCOTE | X157: 0 | Y157: 3 | Z157: 0 | AA157: 189 | AB157: 246 | AC157: 76.829268292682926 | AD157: 0
A158: BRUNSWICK | C158: 3 | D158: 4 | E158: =C158*6+D158 -> 22 | G158: 5 | H158: 11 | I158: =G158*6+H158 -> 41 | K158: 10 | L158: 16 | M158: =K158*6+L158 -> 76 | O158: 15 | P158: 17 | Q158: =O158*6+P158 -> 107 | S158: BRUNSWICK | W158: BRIGHTON | X158: 0 | Y158: 3 | Z158: 0 | AA158: 194 | AB158: 340 | AC158: 57.058823529411768 | AD158: 0
A159: SANDRINGHAM | C159: 2 | D159: 2 | E159: =C159*6+D159 -> 14 | G159: 4 | H159: 5 | I159: =G159*6+H159 -> 29 | K159: 7 | L159: 8 | M159: =K159*6+L159 -> 50 | O159: 9 | P159: 12 | Q159: =O159*6+P159 -> 66 | S159: HARWOOD
A160: BEST PLAYERS
A161: BRUNSWICK | C161: POLLARD | F161: LOVETT | I161: HUNTER | L161: KENNEDY | O161: MAY | Q161: WHEELER
A162: SANDRINGHAM | C162: MADSEN | F162: GOODES | I162: HISCOCK | L162: SHEARS | O162: MILLER | Q162: B HARPER
A163: GOALKICKERS
A164: BRUNSWICK | C164: WHEELER 5 | F164: HUNTER 4 | I164: MULLENGER 3 | L164: STANLEY 2 | O164: SEYMOUR
A165: SANDRINGHAM | C165: B HARPER 3 | F165: HISCOCK 3 | I165: MERRIGAN 2 | L165: SHIPP
A167: PRESTON | C167: 3 | D167: 4 | E167: =C167*6+D167 -> 22 | G167: 3 | H167: 5 | I167: =G167*6+H167 -> 23 | K167: 4 | L167: 8 | M167: =K167*6+L167 -> 32 | O167: 7 | P167: 13 | Q167: =O167*6+P167 -> 55 | S167: PRESTON
A168: PRAHRAN | C168: 0 | D168: 2 | E168: =C168*6+D168 -> 2 | G168: 3 | H168: 7 | I168: =G168*6+H168 -> 25 | K168: 4 | L168: 8 | M168: =K168*6+L168 -> 32 | O168: 5 | P168: 10 | Q168: =O168*6+P168 -> 40 | S168: SMYTH
A169: BEST PLAYERS
A170: PRESTON | C170: PRITCHARD | F170: HENRYS | I170: CROCKER | L170: PASCOE | O170: FOLEY | Q170: HARRISON
A171: PRAHRAN | C171: GRAMBEAU | F171: C BOYD | I171: H BOYD | L171: WALSH | O171: HARVEY | Q171: YATES
A172: GOALKICKERS
A173: PRESTON | C173: F CHARD 2 | F173: LALOR 2 | I173: FOLEY | K173: CANN | M173: FLETCHER
A174: PRAHRAN | C174: SNOW 2 | F174: C BOYD | I174: HARVEY | K174: O'BRIEN
A176: CAMBERWELL | C176: 1 | D176: 3 | E176: =C176*6+D176 -> 9 | G176: 4 | H176: 8 | I176: =G176*6+H176 -> 32 | K176: 6 | L176: 13 | M176: =K176*6+L176 -> 49 | O176: 13 | P176: 15 | Q176: =O176*6+P176 -> 93 | S176: CAMBERWELL
A177: NORTHCOTE | C177: 3 | D177: 2 | E177: =C177*6+D177 -> 20 | G177: 4 | H177: 5 | I177: =G177*6+H177 -> 29 | K177: 9 | L177: 10 | M177: =K177*6+L177 -> 64 | O177: 11 | P177: 13 | Q177: =O177*6+P177 -> 79 | S177: BARKER
A178: BEST PLAYERS
A179: CAMBERWELL | C179: McFEE | F179: MASON | I179: BENBOW | L179: HAYES | O179: RILEY | R179: CLARKE
A180: NORTHCOTE | C180: J VAINS | F180: PAYNTER | I180: SEARLE | L180: FRANCIS | O180: E WHITE | R180: McLAINE
A181: GOALKICKERS
A182: CAMBERWELL | C182: McFEE 6 | F182: McKENZIE 3 | I182: CLARKE | K182: BENBOW | M182: ALLAN | O182: RILEY
A183: NORTHCOTE | C183: FRANCIS 4 | F183: O'LEARY 2 | I183: WHITECHURCH 2 | M183: E WHITE | O183: POWELL | Q183: KNOWLES
A185: YARRAVILLE | C185: 3 | D185: 4 | E185: =C185*6+D185 -> 22 | G185: 10 | H185: 9 | I185: =G185*6+H185 -> 69 | K185: 11 | L185: 11 | M185: =K185*6+L185 -> 77 | O185: 12 | P185: 13 | Q185: =O185*6+P185 -> 85 | S185: YARRAVILLE
A186: OAKLEIGH | C186: 3 | D186: 3 | E186: =C186*6+D186 -> 21 | G186: 5 | H186: 5 | I186: =G186*6+H186 -> 35 | K186: 7 | L186: 11 | M186: =K186*6+L186 -> 53 | O186: 12 | P186: 13 | Q186: =O186*6+P186 -> 85 | S186: IRVING
A187: BEST PLAYERS
A188: YARRAVILLE | C188: WAGHORNE | F188: TAYLOR | I188: GWYNNE | L188: PHILLIPS | N188: SMALLWOOD | Q188: N ROHLEDER
A189: OAKLEIGH | C189: TEMME | F189: CADMAN | I189: SCOTT | L189: VAINS | N189: W WILLIAMS | Q189: GRIFFITHS
A190: GOALKICKERS
A191: YARRAVILLE | C191: WAGHORNE 5 | F191: BODSWORTH 3 | J191: R T SMITH 2 | M191: SMALLWOOD | P191: PEVITT
A192: OAKLEIGH | C192: GRIFFITHS 4 | F192: CADMAN 4 | I192: BAPTIST | K192: W WILLIAMS | N192: EDWARDS | Q192: NEWTON
A194: WILLIAMSTOWN | C194: 5 | D194: 4 | E194: =C194*6+D194 -> 34 | G194: 14 | H194: 10 | I194: =G194*6+H194 -> 94 | K194: 19 | L194: 21 | M194: =K194*6+L194 -> 135 | O194: 23 | P194: 21 | Q194: =O194*6+P194 -> 159 | S194: ELSTERNWICK PARK
A195: BRIGHTON | C195: 0 | D195: 2 | E195: =C195*6+D195 -> 2 | G195: 1 | H195: 8 | I195: =G195*6+H195 -> 14 | K195: 3 | L195: 9 | M195: =K195*6+L195 -> 27 | O195: 5 | P195: 14 | Q195: =O195*6+P195 -> 44 | S195: RICHARDSON
A196: BEST PLAYERS
A197: WILLIAMSTOWN | C197: WALKER | F197: EVANS | I197: W WILLIAMS | L197: DULLARD | O197: SMITH | Q197: CALLAHAN
A198: BRIGHTON | C198: DAVIDSON | F198: TOOHEY | I198: ALEXANDER | L198: BOWLES | O198: MARINI | Q198: POUND
A199: GOALKICKERS
A200: WILLIAMSTOWN | C200: WALKER 10 | F200: W WILLIAMS 4 | J200: EVANS 3 | M200: CALLAHAN 2 | P200: LINTON 2 | R200: SMITH | T200: MARINI
A201: BRIGHTON | C201: TOOHEY 2 | F201: POUND 2 | I201: HARRINGTON
A203: ROUND 4 | E203: 16TH MAY | J203: WEATHER | M203: NORTH WEST WIND DULL | S203: PLAYED AT
D204: 1ST QTR | H204: 2ND QTR | L204: 3RD QTR | P204: FINAL | S204: WILLIAMSTOWN
A205: WILLIAMSTOWN | C205: 2 | D205: 4 | E205: =C205*6+D205 -> 16 | G205: 6 | H205: 6 | I205: =G205*6+H205 -> 42 | K205: 8 | L205: 7 | M205: =K205*6+L205 -> 55 | O205: 13 | P205: 12 | Q205: =O205*6+P205 -> 90 | S205: UMPIRE | X205: LADDER | AB205: ROUND | AD205: 4
A206: PRESTON | C206: 1 | D206: 4 | E206: =C206*6+D206 -> 10 | G206: 2 | H206: 5 | I206: =G206*6+H206 -> 17 | K206: 6 | L206: 8 | M206: =K206*6+L206 -> 44 | O206: 6 | P206: 8 | Q206: =O206*6+P206 -> 44 | S206: IRVING
A207: BEST PLAYERS | W207: TEAM | X207: W | Y207: L | Z207: D | AA207: FOR | AB207: AGST | AC207: % | AD207: PTS
A208: WILLIAMSTOWN | C208: MARTIN | F208: CALLAHAN | I208: HARLEY | L208: ROGERS | N208: SIMPSON | Q208: W WILLIAMS
A209: PRESTON | C209: BLENCOWE | F209: FOLEY | I209: HENRYS | L209: HARRISON | N209: COOPER | Q209: CROCKER | W209: WILLIAMSTOWN | X209: 4 | Y209: 0 | Z209: 0 | AA209: 474 | AB209: 207 | AC209: =(+AA209/AB209)*100 -> 228.98550724637681 | AD209: 16
A210: GOALKICKERS | W210: PORT MELBOURNE | X210: 4 | Y210: 0 | Z210: 0 | AA210: 401 | AB210: 208 | AC210: 192.78846153846155 | AD210: 16
A211: WILLIAMSTOWN | C211: W WILLIAMS 3 | F211: LINTON 3 | I211: WALKER 2 | L211: SIMPSON 2 | N211: MALONEY 2 | Q211: DULLARD | W211: COBURG | X211: 3 | Y211: 1 | Z211: 0 | AA211: 355 | AB211: 316 | AC211: 112.34177215189874 | AD211: 12
A212: PRESTON | C212: F CHARD | E212: FOLEY | G212: PASCOE | I212: LALOR | K212: CANN | M212: FLETCHER | W212: BOX HILL | X212: 2 | Y212: 2 | Z212: 0 | AA212: 327 | AB212: 287 | AC212: 113.93728222996516 | AD212: 8
A214: PORT MELBOURNE | C214: 0 | D214: 4 | E214: =C214*6+D214 -> 4 | G214: 6 | H214: 8 | I214: =G214*6+H214 -> 44 | K214: 8 | L214: 10 | M214: =K214*6+L214 -> 58 | O214: 11 | P214: 13 | Q214: =O214*6+P214 -> 79 | S214: WAGGA N.S.W. | W214: BRUNSWICK | X214: 2 | Y214: 2 | Z214: 0 | AA214: 328 | AB214: 301 | AC214: 108.97009966777409 | AD214: 8
A215: OAKLEIGH | C215: 2 | D215: 3 | E215: =C215*6+D215 -> 15 | G215: 4 | H215: 6 | I215: =G215*6+H215 -> 30 | K215: 7 | L215: 11 | M215: =K215*6+L215 -> 53 | O215: 8 | P215: 13 | Q215: =O215*6+P215 -> 61 | S215: MERRINGTON | W215: PRAHRAN | X215: 2 | Y215: 2 | Z215: 0 | AA215: 300 | AB215: 304 | AC215: 98.684210526315795 | AD215: 8
A216: BEST PLAYERS | W216: PRESTON | X216: 2 | Y216: 2 | Z216: 0 | AA216: 259 | AB216: 282 | AC216: 91.843971631205676 | AD216: 8
A217: PORT MELBOURNE | C217: JOHNSON | F217: TOWNSING | I217: BONNETT | L217: LEEHANE | N217: FRASER | Q217: FOGARTY | W217: SANDRINGHAM | X217: 2 | Y217: 2 | Z217: 0 | AA217: 306 | AB217: 372 | AC217: 82.258064516129039 | AD217: 8
A218: OAKLEIGH | C218: CUNNINGHAM | F218: EDWARDS | I218: W WILLIAMS | L218: SAVORY | N218: TINDAL | Q218: VAINS | W218: CAMBERWELL | X218: 2 | Y218: 2 | Z218: 0 | AA218: 274 | AB218: 344 | AC218: 79.651162790697668 | AD218: 8
A219: GOALKICKERS | W219: OAKLEIGH | X219: 1 | Y219: 2 | Z219: 1 | AA219: 294 | AB219: 304 | AC219: 96.71052631578948 | AD219: 6
A220: PORT MELBOURNE | C220: BONNETT 4 | F220: TOWNSING 2 | I220: MURRAY | K220: BRAGG | M220: WALSH | O220: TUCKER | Q220: ATKINSON | W220: MOORABBIN | X220: 1 | Y220: 2 | Z220: 1 | AA220: 200 | AB220: 312 | AC220: 64.102564102564102 | AD220: 6
A221: OAKLEIGH | C221: EDWARDS 3 | F221: SCOTT | I221: LAMBERT | L221: GRIFFITHS | O221: HILL | Q221: NEWTON | W221: NORTHCOTE | X221: 1 | Y221: 3 | Z221: 0 | AA221: 297 | AB221: 291 | AC221: 102.0618556701031 | AD221: 4
W222: YARRAVILLE | X222: 0 | Y222: 2 | Z222: 2 | AA222: 267 | AB222: 345 | AC222: =(+AA222/AB222)*100 -> 77.391304347826079 | AD222: 4
A223: COBURG | C223: 5 | D223: 1 | E223: =C223*6+D223 -> 31 | G223: 10 | H223: 6 | I223: =G223*6+H223 -> 66 | K223: 13 | L223: 7 | M223: =K223*6+L223 -> 85 | O223: 17 | P223: 11 | Q223: =O223*6+P223 -> 113 | S223: COBURG | W223: BRIGHTON | X223: 0 | Y223: 4 | Z223: 0 | AA223: 239 | AB223: 448 | AC223: 53.348214285714285 | AD223: 0
A224: MOORABBIN | C224: 2 | D224: 4 | E224: =C224*6+D224 -> 16 | G224: 2 | H224: 7 | I224: =G224*6+H224 -> 19 | K224: 8 | L224: 9 | M224: =K224*6+L224 -> 57 | O224: 9 | P224: 11 | Q224: =O224*6+P224 -> 65 | S224: BARKER
A225: BEST PLAYERS
A226: COBURG | C226: McDONALD | F226: WALKER | I226: R WILKINSON | L226: HEWES | O226: BULMAN | R226: MAHONEY
A227: MOORABBIN | C227: McKENZIE | F227: HANMAN | I227: DALY | L227: PATTISON | O227: BAKER | R227: OSTLE
A228: GOALKICKERS
A229: COBURG | C229: HEWES 7 | F229: R WILKINSON 5 | J229: ROGAN 2 | M229: H WILKINSON | P229: EVANS | R229: AITKEN
A230: MOORABBIN | C230: McKENZIE 2 | F230: McNEILAGE 2 | I230: DALY 2 | K230: WALSH | M230: BAKER | O230: HANMAN
A232: BOX HILL | C232: 4 | D232: 7 | E232: =C232*6+D232 -> 31 | G232: 5 | H232: 8 | I232: =G232*6+H232 -> 38 | K232: 9 | L232: 10 | M232: =K232*6+L232 -> 64 | O232: 12 | P232: 10 | Q232: =O232*6+P232 -> 82 | S232: BOX HILL
A233: BRUNSWICK | C233: 0 | D233: 1 | E233: =C233*6+D233 -> 1 | G233: 6 | H233: 6 | I233: =G233*6+H233 -> 42 | K233: 9 | L233: 6 | M233: =K233*6+L233 -> 60 | O233: 11 | P233: 11 | Q233: =O233*6+P233 -> 77 | S233: E BAGULEY
A234: BEST PLAYERS
A235: BOX HILL | C235: LOVE | F235: ALLAN | I235: WINDOW | L235: COLLINS | O235: MORRIS | R235: GARDINER
A236: BRUNSWICK | C236: HUNTER | F236: ROLFS | I236: NEILSON | L236: SEYMOUR | O236: POLLARD | R236: STANLEY
A237: GOALKICKERS
A238: BOX HILL | C238: ALLAN 3 | F238: MORRIS 3 | I238: HOCKEN 3 | L238: TURNER | N238: GARDINER | Q238: GREEN
A239: BRUNSWICK | C239: HUNTER 6 | F239: CLUES | H239: NEILSON | J239: SEYMOUR | L239: WHEELER | O239: MULLENGER
A241: PRAHRAN | C241: 6 | D241: 9 | E241: =C241*6+D241 -> 45 | G241: 9 | H241: 9 | I241: =G241*6+H241 -> 63 | K241: 10 | L241: 11 | M241: =K241*6+L241 -> 71 | O241: 17 | P241: 14 | Q241: =O241*6+P241 -> 116 | S241: TOORAK PARK
A242: YARRAVILLE | C242: 3 | D242: 2 | E242: =C242*6+D242 -> 20 | G242: 6 | H242: 8 | I242: =G242*6+H242 -> 44 | K242: 7 | L242: 8 | M242: =K242*6+L242 -> 50 | O242: 9 | P242: 10 | Q242: =O242*6+P242 -> 64 | S242: HARWOOD
A243: BEST PLAYERS
A244: PRAHRAN | C244: C BOYD | F244: WALSH | I244: KRUSE | L244: LOUREY | N244: O'BRYAN | Q244: MORONE
A245: YARRAVILLE | C245: K SMITH | F245: WAGHORNE | I245: PHILLIPS | L245: ABBEY | N245: MASON | Q245: BODSWORTH
A246: GOALKICKERS
A247: PRAHRAN | C247: ELLIOTT 5 | F247: WALSH 2 | I247: C BOYD 2 | L247: KRUSE 2 | N247: O'BRYAN 2 | Q247: LOUREY | S247: HARVEY | V247: FRITZLAFF
A248: YARRAVILLE | C248: WAGHORNE 5 | F248: MASON | H248: N ROHLEDER | K248: COOK | M248: R SMITH
A250: NORTHCOTE | C250: 3 | D250: 3 | E250: =C250*6+D250 -> 21 | G250: 7 | H250: 11 | I250: =G250*6+H250 -> 53 | K250: 11 | L250: 14 | M250: =K250*6+L250 -> 80 | O250: 15 | P250: 18 | Q250: =O250*6+P250 -> 108 | S250: NORTHCOTE
A251: BRIGHTON | C251: 1 | D251: 4 | E251: =C251*6+D251 -> 10 | G251: 2 | H251: 5 | I251: =G251*6+H251 -> 17 | K251: 4 | L251: 6 | M251: =K251*6+L251 -> 30 | O251: 6 | P251: 9 | Q251: =O251*6+P251 -> 45 | S251: ROACH
A252: BEST PLAYERS
A253: NORTHCOTE | C253: FRANCIS | F253: McLAINE | I253: STABB | L253: PAYNTER | O253: W COLLINS | R253: WOOLNOUGH
A254: BRIGHTON | C254: ALEXANDER | F254: BURRELL | I254: FREEMAN | L254: O'MEARA | O254: CURRIE | R254: SINCLAIR
A255: GOALKICKERS
A256: NORTHCOTE | C256: FRANCIS 8 | F256: AMARANT 2 | I256: POWELL | K256: PAYNTER | M256: W COLLINS | P256: McLAINE | R256: WHITECHURCH
A257: BRIGHTON | C257: MARINI 2 | F257: CURRIE | H257: RILEY | J257: POUND | L257: WOODS
A259: SANDRINGHAM | C259: 5 | D259: 1 | E259: =C259*6+D259 -> 31 | G259: 6 | H259: 4 | I259: =G259*6+H259 -> 40 | K259: 9 | L259: 6 | M259: =K259*6+L259 -> 60 | O259: 13 | P259: 7 | Q259: =O259*6+P259 -> 85 | S259: BEACH ROAD
A260: CAMBERWELL | C260: 3 | D260: 4 | E260: =C260*6+D260 -> 22 | G260: 7 | H260: 8 | I260: =G260*6+H260 -> 50 | K260: 7 | L260: 9 | M260: =K260*6+L260 -> 51 | O260: 10 | P260: 12 | Q260: =O260*6+P260 -> 72 | S260: RICHARDSON
A261: BEST PLAYERS
A262: SANDRINGHAM | C262: HARPER | F262: BOURKE | I262: GOODES | L262: SHIPP | O262: PHILLIPS | R262: RUSSO
A263: CAMBERWELL | C263: McKENZIE | F263: BOHAN | I263: MARION | L263: McFEE | O263: BENBOW | R263: WAIN
A264: GOALKICKERS
A265: SANDRINGHAM | C265: HARPER 5 | F265: MERRIGAN 2 | I265: LAING 2 | K265: BOURKE | M265: PHILLIPS | O265: SHIPP | Q265: JONES
A266: CAMBERWELL | C266: McKENZIE 3 | F266: McFEE 2 | I266: BRADLEY | K266: HAYES | M266: MARION | O266: DUFF | Q266: BENBOW
A268: ROUND 5 | E268: 23RD MAY | H268: WEATHER | K268: SOUTH WIND HEAVY RAIN GROUNDS BAD | S268: PLAYED AT
D269: 1ST QTR | H269: 2ND QTR | L269: 3RD QTR | P269: FINAL | S269: BRUNSWICK
A270: BRUNSWICK | C270: 3 | D270: 2 | E270: =C270*6+D270 -> 20 | G270: 4 | H270: 4 | I270: =G270*6+H270 -> 28 | K270: 6 | L270: 6 | M270: =K270*6+L270 -> 42 | O270: 8 | P270: 7 | Q270: =O270*6+P270 -> 55 | S270: UMPIRE | X270: LADDER | AB270: ROUND | AD270: 5
A271: WILLIAMSTOWN | C271: 0 | D271: 2 | E271: =C271*6+D271 -> 2 | G271: 0 | H271: 6 | I271: =G271*6+H271 -> 6 | K271: 0 | L271: 10 | M271: =K271*6+L271 -> 10 | O271: 3 | P271: 11 | Q271: =O271*6+P271 -> 29 | S271: MERRINGTON
A272: BEST PLAYERS | W272: TEAM | X272: W | Y272: L | Z272: D | AA272: FOR | AB272: AGST | AC272: % | AD272: PTS
A273: BRUNSWICK | C273: PLANT | E273: CLUES | H273: LOVETT | K273: WEIR | N273: YEA | Q273: NEILSON
A274: WILLIAMSTOWN | C274: TAAFE | E274: SMITH | H274: LINTON | K274: CALLAHAN | N274: W WILLIAMS | Q274: G WILLIAMS | W274: PORT MELBOURNE | X274: 5 | Y274: 0 | Z274: 0 | AA274: 449 | AB274: 235 | AC274: 191.06382978723406 | AD274: 20
A275: GOALKICKERS | W275: WILLIAMSTOWN | X275: 4 | Y275: 1 | Z275: 0 | AA275: 503 | AB275: 262 | AC275: =(+AA275/AB275)*100 -> 191.98473282442748 | AD275: 16
A276: BRUNSWICK | C276: HUNTER 4 | F276: CLUES | H276: KALAF | J276: WEIR | L276: MUNRO | W276: BRUNSWICK | X276: 3 | Y276: 2 | Z276: 0 | AA276: 383 | AB276: 330 | AC276: 116.06060606060606 | AD276: 12
A277: WILLIAMSTOWN | C277: WALKER 3 | W277: COBURG | X277: 3 | Y277: 2 | Z277: 0 | AA277: 416 | AB277: 388 | AC277: 107.21649484536083 | AD277: 12
A279: SANDRINGHAM | C279: 1 | D279: 2 | E279: =C279*6+D279 -> 8 | G279: 5 | H279: 8 | I279: =G279*6+H279 -> 38 | K279: 5 | L279: 9 | M279: =K279*6+L279 -> 39 | O279: 10 | P279: 12 | Q279: =O279*6+P279 -> 72 | S279: BEACH ROAD | W279: CAMBERWELL | X279: 3 | Y279: 2 | Z279: 0 | AA279: 367 | AB279: 412 | AC279: 89.077669902912618 | AD279: 12
A280: COBURG | C280: 2 | D280: 10 | E280: =C280*6+D280 -> 22 | G280: 3 | H280: 13 | I280: =G280*6+H280 -> 31 | K280: 7 | L280: 17 | M280: =K280*6+L280 -> 59 | O280: 7 | P280: 19 | Q280: =O280*6+P280 -> 61 | S280: IRVING | W280: SANDRINGHAM | X280: 3 | Y280: 2 | Z280: 0 | AA280: 378 | AB280: 433 | AC280: 87.297921478060047 | AD280: 12
A281: BEST PLAYERS | W281: OAKLEIGH | X281: 2 | Y281: 2 | Z281: 1 | AA281: 395 | AB281: 385 | AC281: 102.59740259740259 | AD281: 10
A282: SANDRINGHAM | C282: GOODES | F282: G JONES | I282: SHEARS | L282: MADSEN | O282: RUSSO | Q282: GUTTERIDGE | W282: MOORABBIN | X282: 2 | Y282: 2 | Z282: 1 | AA282: 256 | AB282: 335 | AC282: 76.417910447761187 | AD282: 10
A283: COBURG | C283: LAMBERT | F283: McTAGGART | I283: SPARKS | L283: R WILKINSON | O283: AITKEN | Q283: WALKER | W283: NORTHCOTE | X283: 2 | Y283: 3 | Z283: 0 | AA283: 348 | AB283: 316 | AC283: 110.12658227848101 | AD283: 8
A284: GOALKICKERS | W284: BOX HILL | X284: 2 | Y284: 3 | Z284: 0 | AA284: 352 | AB284: 338 | AC284: 104.14201183431953 | AD284: 8
A285: SANDRINGHAM | C285: G JONES 4 | F285: HARPER 2 | I285: SHIPP | K285: PHILLIPS | M285: MERRIGAN | P285: POTTER | W285: PRAHRAN | X285: 2 | Y285: 3 | Z285: 0 | AA285: 368 | AB285: 397 | AC285: 92.695214105793454 | AD285: 8
A286: COBURG | C286: HEWES 2 | F286: AITKEN 2 | I286: R WILKINSON | L286: ROGAN | N286: H WILKINSON | W286: PRESTON | X286: 2 | Y286: 3 | Z286: 0 | AA286: 282 | AB286: 338 | AC286: 83.431952662721898 | AD286: 8
W287: YARRAVILLE | X287: 0 | Y287: 3 | Z287: 2 | AA287: 294 | AB287: 393 | AC287: =(+AA287/AB287)*100 -> 74.809160305343511 | AD287: 4
A288: CAMBERWELL | C288: 2 | D288: 1 | E288: =C288*6+D288 -> 13 | G288: 6 | H288: 2 | I288: =G288*6+H288 -> 38 | K288: 9 | L288: 5 | M288: =K288*6+L288 -> 59 | O288: 14 | P288: 9 | Q288: =O288*6+P288 -> 93 | S288: CAMBERWELL | W288: BRIGHTON | X288: 0 | Y288: 5 | Z288: 0 | AA288: 320 | AB288: 549 | AC288: 58.287795992714024 | AD288: 0
A289: PRAHRAN | C289: 2 | D289: 5 | E289: =C289*6+D289 -> 17 | G289: 4 | H289: 9 | I289: =G289*6+H289 -> 33 | K289: 8 | L289: 12 | M289: =K289*6+L289 -> 60 | O289: 9 | P289: 14 | Q289: =O289*6+P289 -> 68 | S289: ROACH
A290: BEST PLAYERS
A291: CAMBERWELL | C291: McFEE | E291: McGUINNESS | H291: BOHAN | K291: BRADLEY | N291: THYNNE | Q291: DUFF
A292: PRAHRAN | C292: YATES | E292: C BOYD | H292: PLAIN | K292: WALSH | N292: KRUSE | Q292: GRAMBEAU
A293: GOALKICKERS
A294: CAMBERWELL | C294: McFEE 3 | E294: McGUINNESS 3 | H294: HEDLEY 2 | K294: SCOTT 2 | M294: McKENZIE 2 | P294: HAYES | R294: ROSENBROCK
A295: PRAHRAN | C295: KRUSE 2 | E295: HARVEY 2 | H295: FRITZLAFF | K295: LOUREY | M295: MORONE | O295: C BOYD | Q295: ELLIOTT
A297: MOORABBIN | C297: 3 | D297: 3 | E297: =C297*6+D297 -> 21 | G297: 4 | H297: 5 | I297: =G297*6+H297 -> 29 | K297: 8 | L297: 7 | M297: =K297*6+L297 -> 55 | O297: 8 | P297: 8 | Q297: =O297*6+P297 -> 56 | S297: PRESTON
A298: PRESTON | C298: 1 | D298: 2 | E298: =C298*6+D298 -> 8 | G298: 2 | H298: 3 | I298: =G298*6+H298 -> 15 | K298: 2 | L298: 5 | M298: =K298*6+L298 -> 17 | O298: 3 | P298: 5 | Q298: =O298*6+P298 -> 23 | S298: BAGULEY
A299: BEST PLAYERS
A300: MOORABBIN | C300: BROWN | F300: DALY | I300: STANLEY | L300: D'OLIVER | O300: BOURKE | R300: MUNYARD
A301: PRESTON | C301: HENRYS | F301: CROCKER | I301: SWEET | L301: HARRISON | O301: McLACHLAN | R301: DAWSON
A302: GOALKICKERS
A303: MOORABBIN | C303: CHANDLER 2 | F303: TONKIN 2 | I303: LAURIE | K303: STANLEY | M303: WALSH | O303: HANMAN
A304: PRESTON | C304: McLACHLAN 2 | F304: HART
A306: OAKLEIGH | C306: 6 | D306: 5 | E306: =C306*6+D306 -> 41 | G306: 8 | H306: 6 | I306: =G306*6+H306 -> 54 | K306: 13 | L306: 10 | M306: =K306*6+L306 -> 88 | O306: 15 | P306: 11 | Q306: =O306*6+P306 -> 101 | S306: ELSTERNWICK PARK
A307: BRIGHTON | C307: 2 | D307: 1 | E307: =C307*6+D307 -> 13 | G307: 7 | H307: 6 | I307: =G307*6+H307 -> 48 | K307: 8 | L307: 7 | M307: =K307*6+L307 -> 55 | O307: 12 | P307: 9 | Q307: =O307*6+P307 -> 81 | S307: HARWOOD
A308: BEST PLAYERS
A309: OAKLEIGH | C309: WATSON | F309: WAIN | I309: EDWARDS | L309: CADMAN | O309: BAPTIST | R309: SCOTT
A310: BRIGHTON | C310: BURRELL | F310: MARINI | I310: POUND | L310: ALEXANDER | O310: WOODS | R310: CURRIE
A311: GOALKICKERS
A312: OAKLEIGH | C312: WATSON 8 | F312: EDWARDS 2 | I312: NEWTON | K312: BAPTIST | M312: CADMAN | O312: HILL | P312: SCOTT
A313: BRIGHTON | C313: POUND 5 | F313: MARINI 3 | I313: HARRINGTON 2 | M313: BOWLES | O313: FEHR
A315: NORTHCOTE | C315: 3 | D315: 2 | E315: =C315*6+D315 -> 20 | G315: 3 | H315: 4 | I315: =G315*6+H315 -> 22 | K315: 4 | L315: 6 | M315: =K315*6+L315 -> 30 | O315: 7 | P315: 9 | Q315: =O315*6+P315 -> 51 | S315: BOX HILL
A316: BOX HILL | C316: 0 | D316: 2 | E316: =C316*6+D316 -> 2 | G316: 1 | H316: 4 | I316: =G316*6+H316 -> 10 | K316: 2 | L316: 6 | M316: =K316*6+L316 -> 18 | O316: 3 | P316: 7 | Q316: =O316*6+P316 -> 25 | S316: RICHARDSON
A317: BEST PLAYERS
A318: NORTHCOTE | C318: WHITECHURCH | F318: ALDRIDGE | I318: J VAINS | K318: CHOATE | N318: J COLLINS | Q318: SEARLE
A319: BOX HILL | C319: LOVE | F319: COLLINS | I319: KRONK | K319: HOCKEN | N319: RICHARDS | Q319: RATTRAY
A320: GOALKICKERS
A321: NORTHCOTE | C321: FRANCIS 3 | F321: AMARANT | I321: J COLLINS | L321: WHITECHURCH
A322: BOX HILL | C322: HOCKEN 2 | F322: TURNER
A324: PORT MELBOURNE | C324: 2 | D324: 2 | E324: =C324*6+D324 -> 14 | G324: 4 | H324: 2 | I324: =G324*6+H324 -> 26 | K324: 7 | L324: 5 | M324: =K324*6+L324 -> 47 | O324: 7 | P324: 6 | Q324: =O324*6+P324 -> 48 | S324: YARRAVILLE
A325: YARRAVILLE | C325: 1 | D325: 1 | E325: =C325*6+D325 -> 7 | G325: 1 | H325: 2 | I325: =G325*6+H325 -> 8 | K325: 2 | L325: 3 | M325: =K325*6+L325 -> 15 | O325: 4 | P325: 3 | Q325: =O325*6+P325 -> 27 | S325: SMYTH
A326: BEST PLAYERS
A327: PORT MELBOURNE | C327: KELSEY | F327: BONNETT | I327: STOREY | L327: MURRAY | O327: BRAGG | Q327: FRASER
A328: YARRAVILLE | C328: BODSWORTH | F328: SEITZ | I328: SMALLWOOD | L328: VANDERFEEN | O328: JONES | Q328: WOOTEN
A329: GOALKICKERS
A330: PORT MELBOURNE | C330: BRAGG 3 | F330: BONNETT 3 | I330: MILLER
A331: YARRAVILLE | C331: BODSWORTH 2 | F331: WOOTEN | I331: MARCHESI
A333: ROUND 6 | E333: 30TH MAY | J333: WEATHER | M333: NORTH WEST WIND DULL | S333: PLAYED AT
D334: 1ST QTR | H334: 2ND QTR | L334: 3RD QTR | P334: FINAL | S334: OAKLEIGH
A335: OAKLEIGH | C335: 2 | D335: 4 | E335: =C335*6+D335 -> 16 | G335: 4 | H335: 9 | I335: =G335*6+H335 -> 33 | K335: 12 | L335: 14 | M335: =K335*6+L335 -> 86 | O335: 14 | P335: 18 | Q335: =O335*6+P335 -> 102 | S335: UMPIRE | X335: LADDER | AB335: ROUND | AD335: 6
A336: CAMBERWELL | C336: 3 | D336: 2 | E336: =C336*6+D336 -> 20 | G336: 4 | H336: 5 | I336: =G336*6+H336 -> 29 | K336: 4 | L336: 9 | M336: =K336*6+L336 -> 33 | O336: 7 | P336: 12 | Q336: =O336*6+P336 -> 54 | S336: BAGULEY
A337: BEST PLAYERS | W337: TEAM | X337: W | Y337: L | Z337: D | AA337: FOR | AB337: AGST | AC337: % | AD337: PTS
A338: OAKLEIGH | C338: TINDAL | F338: TEMME | I338: LONIE | L338: SCULLIN | N338: H WILLIAMS | Q338: GUY
A339: CAMBERWELL | C339: WAIN | F339: HAYES | I339: McGUINNESS | L339: DUFF | N339: MASON | Q339: SCOTT | W339: PORT MELBOURNE | X339: 6 | Y339: 0 | Z339: 0 | AA339: 540 | AB339: 274 | AC339: 197.08029197080293 | AD339: 24
A340: GOALKICKERS | W340: WILLIAMSTOWN | X340: 5 | Y340: 1 | Z340: 0 | AA340: 612 | AB340: 337 | AC340: =(+AA340/AB340)*100 -> 181.60237388724036 | AD340: 20
A341: OAKLEIGH | C341: LONIE 4 | E341: SCOTT 3 | G341: NEWTON 2 | J341: EDWARDS 2 | M341: LAMBERT | O341: H WILLIAMS | R341: I'ANSON | W341: SANDRINGHAM | X341: 4 | Y341: 2 | Z341: 0 | AA341: 424 | AB341: 475 | AC341: 89.263157894736835 | AD341: 16
A342: CAMBERWELL | C342: MARION 2 | F342: HAYES 2 | I342: HEDLEY | K342: McFEE | M342: JOHNSON | W342: OAKLEIGH | X342: 3 | Y342: 2 | Z342: 1 | AA342: 497 | AB342: 439 | AC342: 113.21184510250569 | AD342: 14
A344: SANDRINGHAM | C344: 1 | D344: 2 | E344: =C344*6+D344 -> 8 | G344: 4 | H344: 7 | I344: =G344*6+H344 -> 31 | K344: 4 | L344: 11 | M344: =K344*6+L344 -> 35 | O344: 5 | P344: 16 | Q344: =O344*6+P344 -> 46 | S344: NORTHCOTE | W344: MOORABBIN | X344: 3 | Y344: 2 | Z344: 1 | AA344: 317 | AB344: 372 | AC344: 85.215053763440864 | AD344: 14
A345: NORTHCOTE | C345: 1 | D345: 7 | E345: =C345*6+D345 -> 13 | G345: 2 | H345: 14 | I345: =G345*6+H345 -> 26 | K345: 2 | L345: 18 | M345: =K345*6+L345 -> 30 | O345: 3 | P345: 24 | Q345: =O345*6+P345 -> 42 | S345: RICHARDSON | W345: BRUNSWICK | X345: 3 | Y345: 3 | Z345: 0 | AA345: 437 | AB345: 406 | AC345: 107.63546798029557 | AD345: 12
A346: BEST PLAYERS | W346: COBURG | X346: 3 | Y346: 3 | Z346: 0 | AA346: 492 | AB346: 481 | AC346: 102.28690228690229 | AD346: 12
A347: SANDRINGHAM | C347: RUSSO | E347: PHILLIPS | H347: G JONES | K347: MADSEN | N347: POTTER | Q347: GOODES | W347: PRAHRAN | X347: 3 | Y347: 3 | Z347: 0 | AA347: 444 | AB347: 451 | AC347: 98.447893569844794 | AD347: 12
A348: NORTHCOTE | C348: STABB | E348: KNOWLES | H348: POWELL | K348: WHITECHURCH | N348: ALDRIDGE | Q348: EVANS | W348: CAMBERWELL | X348: 3 | Y348: 3 | Z348: 0 | AA348: 421 | AB348: 514 | AC348: 81.906614785992218 | AD348: 12
A349: GOALKICKERS | W349: NORTHCOTE | X349: 2 | Y349: 4 | Z349: 0 | AA349: 390 | AB349: 362 | AC349: 107.73480662983425 | AD349: 8
A350: SANDRINGHAM | C350: POTTER 2 | F350: SHIPP | I350: HARPER | L350: PHILLIPS | W350: BOX HILL | X350: 2 | Y350: 4 | Z350: 0 | AA350: 427 | AB350: 447 | AC350: 95.525727069351234 | AD350: 8
A351: NORTHCOTE | C351: FRANCIS | F351: KNOWLES | I351: SEARLE | W351: YARRAVILLE | X351: 1 | Y351: 3 | Z351: 2 | AA351: 387 | AB351: 469 | AC351: =(+AA351/AB351)*100 -> 82.515991471215358 | AD351: 8
W352: PRESTON | X352: 2 | Y352: 4 | Z352: 0 | AA352: 321 | AB352: 429 | AC352: 74.825174825174827 | AD352: 8
A353: WILLIAMSTOWN | C353: 1 | D353: 7 | E353: =C353*6+D353 -> 13 | G353: 7 | H353: 13 | I353: =G353*6+H353 -> 55 | K353: 9 | L353: 17 | M353: =K353*6+L353 -> 71 | O353: 14 | P353: 25 | Q353: =O353*6+P353 -> 109 | S353: WILLIAMSTOWN | W353: BRIGHTON | X353: 0 | Y353: 6 | Z353: 0 | AA353: 357 | AB353: 610 | AC353: 58.524590163934427 | AD353: 0
A354: BOX HILL | C354: 2 | D354: 4 | E354: =C354*6+D354 -> 16 | G354: 4 | H354: 8 | I354: =G354*6+H354 -> 32 | K354: 6 | L354: 13 | M354: =K354*6+L354 -> 49 | O354: 10 | P354: 15 | Q354: =O354*6+P354 -> 75 | S354: MERRINGTON
A355: BEST PLAYERS
A356: WILLIAMSTOWN | C356: W WILLIAMS | F356: HARLEY | H356: WALKER | K356: CALLAHAN | N356: G WILLIAMS | Q356: MALONEY
A357: BOX HILL | C357: MORRIS | F357: GREEN | H357: TURNER | K357: JEFFERS | N357: RATTRAY | Q357: HOCKEN
A358: GOALKICKERS
A359: WILLIAMSTOWN | C359: WALKER 7 | F359: W WILLIAMS 5 | J359: LINTON | L359: SIMPSON
A360: BOX HILL | C360: HOCKEN 2 | F360: GREEN 2 | I360: WINDOW 2 | L360: TURNER | N360: GARDINER | Q360: ALLAN | S360: MORRIS
A362: PORT MELBOURNE | C362: 3 | D362: 3 | E362: =C362*6+D362 -> 21 | G362: 7 | H362: 5 | I362: =G362*6+H362 -> 47 | K362: 9 | L362: 10 | M362: =K362*6+L362 -> 64 | O362: 13 | P362: 13 | Q362: =O362*6+P362 -> 91 | S362: PORT MELBOURNE
A363: PRESTON | C363: 1 | D363: 0 | E363: =C363*6+D363 -> 6 | G363: 3 | H363: 3 | I363: =G363*6+H363 -> 21 | K363: 4 | L363: 6 | M363: =K363*6+L363 -> 30 | O363: 5 | P363: 9 | Q363: =O363*6+P363 -> 39 | S363: BARKER
A364: BEST PLAYERS
A365: PORT MELBOURNE | C365: FRASER | F365: MILLER | I365: BONNETT | L365: LEEHANE | O365: STOREY | R365: LAFFEY
A366: PRESTON | C366: CROCKER | F366: HENRYS | I366: BRADFORD | L366: PASCOE | O366: PRITCHARD | R366: JEFFREY
A367: GOALKICKERS | AI367: TEAM | AJ367: W | AK367: L | AL367: D | AM367: FOR | AN367: AGST | AO367: % | AP367: PTS
A368: PORT MELBOURNE | C368: BONNETT 6 | F368: WITHERS 2 | I368: MILLER | K368: WALSH | M368: STONE | O368: CUMBERLEDGE | R368: BRAGG
A369: PRESTON | C369: FOLEY 2 | F369: JEFFREY 2 | I369: HAYES
A371: MOORABBIN | C371: 0 | D371: 3 | E371: =C371*6+D371 -> 3 | G371: 4 | H371: 11 | I371: =G371*6+H371 -> 35 | K371: 5 | L371: 11 | M371: =K371*6+L371 -> 41 | O371: 7 | P371: 19 | Q371: =O371*6+P371 -> 61 | S371: MOORABBIN
A372: BRIGHTON | C372: 3 | D372: 3 | E372: =C372*6+D372 -> 21 | G372: 5 | H372: 5 | I372: =G372*6+H372 -> 35 | K372: 5 | L372: 7 | M372: =K372*6+L372 -> 37 | O372: 5 | P372: 7 | Q372: =O372*6+P372 -> 37 | S372: SMYTH
A373: BEST PLAYERS
A374: MOORABBIN | C374: MUNYARD | F374: CHANDLER | I374: McKENZIE | L374: BOURKE | O374: GILDER | Q374: STANLEY
A375: BRIGHTON | C375: CURRIE | F375: O'MEARA | I375: G CONROY | L375: ALEXANDER | O375: POUND | Q375: MARINI
A376: GOALKICKERS
A377: MOORABBIN | C377: CHANDLER 2 | F377: LEITCH 2 | I377: WALSH | K377: McKENZIE | M377: TONKIN
A378: BRIGHTON | C378: POUND 4 | F378: O'MEARA
A380: PRAHRAN | C380: 1 | D380: 3 | E380: =C380*6+D380 -> 9 | G380: 3 | H380: 6 | I380: =G380*6+H380 -> 24 | K380: 7 | L380: 15 | M380: =K380*6+L380 -> 57 | O380: 10 | P380: 16 | Q380: =O380*6+P380 -> 76 | S380: TOORAK PARK
A381: BRUNSWICK | C381: 2 | D381: 2 | E381: =C381*6+D381 -> 14 | G381: 5 | H381: 5 | I381: =G381*6+H381 -> 35 | K381: 6 | L381: 6 | M381: =K381*6+L381 -> 42 | O381: 7 | P381: 12 | Q381: =O381*6+P381 -> 54 | S381: IRVING
A382: BEST PLAYERS
A383: PRAHRAN | C383: KRUSE | E383: C BOYD | H383: H BOYD | K383: GRAMBEAU | N383: PLAIN | Q383: WALSH
A384: BRUNSWICK | C384: NEILSON | E384: YEA | H384: STANLEY | K384: KENNEDY | N384: ROLFS | Q384: KRUSE
A385: GOALKICKERS
A386: PRAHRAN | C386: O'BRYAN 2 | F386: KINNABURGH 2 | J386: KRUSE 2 | M386: PLAIN | O386: HARVEY | Q386: ELLIOTT | S386: WALSH
A387: BRUNSWICK | C387: MULLENGER 2 | F387: LOVETT | H387: STANLEY | J387: WEIR | L387: MAY | N387: HUNTER
A389: YARRAVILLE | C389: 5 | D389: 7 | E389: =C389*6+D389 -> 37 | G389: 6 | H389: 8 | I389: =G389*6+H389 -> 44 | K389: 12 | L389: 14 | M389: =K389*6+L389 -> 86 | O389: 13 | P389: 15 | Q389: =O389*6+P389 -> 93 | S389: COBURG
A390: COBURG | C390: 1 | D390: 2 | E390: =C390*6+D390 -> 8 | G390: 6 | H390: 7 | I390: =G390*6+H390 -> 43 | K390: 6 | L390: 7 | M390: =K390*6+L390 -> 43 | O390: 10 | P390: 16 | Q390: =O390*6+P390 -> 76 | S390: ROACH
A391: BEST PLAYERS
A392: YARRAVILLE | C392: TAYLOR | F392: SEITZ | I392: WAGHORNE | L392: SMALLWOOD | O392: HUGHES | Q392: BERRY
A393: COBURG | C393: LAMBERT | F393: STARBUCK | I393: LEVERSHA | L393: MAHONEY | O393: CONDON | Q393: ROGAN
A394: GOALKICKERS
A395: YARRAVILLE | C395: WAGHORNE 5 | F395: SMALLWOOD 3 | J395: SALT 2 | M395: GWYNNE | O395: MARCHESI | Q395: HUGHES
A396: COBURG | C396: ROGAN 2 | F396: McTAGGART 2 | J396: R WILKINSON | M396: H WILKINSON | P396: MALONEY | R396: LEVERSHA | U396: AITKEN | W396: HAMILTON
A398: ROUND 7 | E398: 6TH JUNE | J398: WEATHER | M398: NO WIND DULL GROUNDS MUDDY | S398: PLAYED AT
D399: 1ST QTR | H399: 2ND QTR | L399: 3RD QTR | P399: FINAL | S399: BEACH ROAD
A400: WILLIAMSTOWN | C400: 5 | D400: 5 | E400: =C400*6+D400 -> 35 | G400: 9 | H400: 7 | I400: =G400*6+H400 -> 61 | K400: 14 | L400: 10 | M400: =K400*6+L400 -> 94 | O400: 16 | P400: 13 | Q400: =O400*6+P400 -> 109 | S400: UMPIRE | X400: LADDER | AB400: ROUND | AD400: 7
A401: SANDRINGHAM | C401: 3 | D401: 2 | E401: =C401*6+D401 -> 20 | G401: 5 | H401: 4 | I401: =G401*6+H401 -> 34 | K401: 6 | L401: 7 | M401: =K401*6+L401 -> 43 | O401: 11 | P401: 10 | Q401: =O401*6+P401 -> 76 | S401: SMYTH
A402: BEST PLAYERS | W402: TEAM | X402: W | Y402: L | Z402: D | AA402: FOR | AB402: AGST | AC402: % | AD402: PTS
A403: WILLIAMSTOWN | C403: G WILLIAMS | F403: CALLAHAN | I403: ROGERS | L403: WALKER | O403: SIMS | Q403: MOLYNEUX
A404: SANDRINGHAM | C404: SHEARS | F404: RUSSO | I404: GUTTERIDGE | L404: HISCOCK | O404: PHILLIPS | Q404: MADSEN | W404: PORT MELBOURNE | X404: 7 | Y404: 0 | Z404: 0 | AA404: 697 | AB404: 332 | AC404: 209.93975903614458 | AD404: 28
A405: GOALKICKERS | W405: WILLIAMSTOWN | X405: 6 | Y405: 1 | Z405: 0 | AA405: 721 | AB405: 413 | AC405: =(+AA405/AB405)*100 -> 174.57627118644069 | AD405: 24
A406: WILLIAMSTOWN | C406: WALKER 7 | F406: MOLYNEUX 3 | I406: W WILLIAMS 2 | L406: DULLARD | N406: SIMS | P406: SMITH | R406: SIMPSON | W406: MOORABBIN | X406: 4 | Y406: 2 | Z406: 1 | AA406: 436 | AB406: 456 | AC406: 95.614035087719301 | AD406: 18
A407: SANDRINGHAM | C407: POTTER 3 | F407: HARPER 3 | I407: RUSSELL 2 | L407: BOURKE | N407: GATES | P407: PHILLIPS | W407: BRUNSWICK | X407: 4 | Y407: 3 | Z407: 0 | AA407: 505 | AB407: 468 | AC407: 107.90598290598291 | AD407: 16
A409: BRUNSWICK | C409: 2 | D409: 4 | E409: =C409*6+D409 -> 16 | G409: 3 | H409: 8 | I409: =G409*6+H409 -> 26 | K409: 8 | L409: 11 | M409: =K409*6+L409 -> 59 | O409: 9 | P409: 14 | Q409: =O409*6+P409 -> 68 | S409: BRUNSWICK | W409: COBURG | X409: 4 | Y409: 3 | Z409: 0 | AA409: 583 | AB409: 546 | AC409: 106.77655677655677 | AD409: 16
A410: OAKLEIGH | C410: 1 | D410: 0 | E410: =C410*6+D410 -> 6 | G410: 2 | H410: 5 | I410: =G410*6+H410 -> 17 | K410: 5 | L410: 7 | M410: =K410*6+L410 -> 37 | O410: 8 | P410: 14 | Q410: =O410*6+P410 -> 62 | S410: ROACH | W410: SANDRINGHAM | X410: 4 | Y410: 3 | Z410: 0 | AA410: 500 | AB410: 584 | AC410: 85.61643835616438 | AD410: 16
A411: BEST PLAYERS | W411: OAKLEIGH | X411: 3 | Y411: 3 | Z411: 1 | AA411: 559 | AB411: 507 | AC411: 110.25641025641026 | AD411: 14
A412: BRUNSWICK | C412: MULLENGER | F412: NEILSON | I412: LOVETT | L412: PLANT | O412: MAY | Q412: YEA | W412: PRAHRAN | X412: 3 | Y412: 4 | Z412: 0 | AA412: 524 | AB412: 534 | AC412: 98.127340823970044 | AD412: 12
A413: OAKLEIGH | C413: EDWARDS | F413: TINDAL | I413: GUY | L413: TEMME | O413: HILL | Q413: SCULLIN | W413: BOX HILL | X413: 3 | Y413: 4 | Z413: 0 | AA413: 510 | AB413: 527 | AC413: 96.774193548387103 | AD413: 12
A414: GOALKICKERS | W414: YARRAVILLE | X414: 2 | Y414: 3 | Z414: 2 | AA414: 462 | AB414: 520 | AC414: =(+AA414/AB414)*100 -> 88.84615384615384 | AD414: 12
A415: BRUNSWICK | C415: HUNTER 3 | F415: CLUES 3 | I415: KENNEDY 2 | L415: LOVETT | W415: CAMBERWELL | X415: 3 | Y415: 4 | Z415: 0 | AA415: 505 | AB415: 633 | AC415: 79.778830963665087 | AD415: 12
A416: OAKLEIGH | C416: LONIE 4 | F416: EDWARDS 2 | I416: NEWTON | L416: GARRETT | W416: NORTHCOTE | X416: 2 | Y416: 5 | Z416: 0 | AA416: 455 | AB416: 453 | AC416: 100.44150110375276 | AD416: 8
W417: PRESTON | X417: 2 | Y417: 5 | Z417: 0 | AA417: 372 | AB417: 504 | AC417: 73.80952380952381 | AD417: 8
A418: COBURG | C418: 4 | D418: 1 | E418: =C418*6+D418 -> 25 | G418: 8 | H418: 5 | I418: =G418*6+H418 -> 53 | K418: 11 | L418: 9 | M418: =K418*6+L418 -> 75 | O418: 13 | P418: 13 | Q418: =O418*6+P418 -> 91 | S418: NORTHCOTE | W418: BRIGHTON | X418: 0 | Y418: 7 | Z418: 0 | AA418: 415 | AB418: 767 | AC418: 54.10691003911343 | AD418: 0
A419: NORTHCOTE | C419: 1 | D419: 1 | E419: =C419*6+D419 -> 7 | G419: 5 | H419: 5 | I419: =G419*6+H419 -> 35 | K419: 8 | L419: 6 | M419: =K419*6+L419 -> 54 | O419: 9 | P419: 11 | Q419: =O419*6+P419 -> 65 | S419: BAGULEY
A420: BEST PLAYERS
A421: COBURG | C421: McTAGGART | F421: LEVERSHA | I421: ROGAN | L421: HEWES | O421: MAHONEY | R421: STARBUCK
A422: NORTHCOTE | C422: ALDRIDGE | F422: E WHITE | I422: PAYNTER | L422: McLAINE | O422: SEARLE | R422: HOLT
A423: GOALKICKERS
A424: COBURG | C424: ROGAN 3 | F424: HEWES 3 | I424: EVANS 2 | K424: LEVERSHA 2 | N424: McDONALD | Q424: MAHONEY | T424: McTAGGART
A425: NORTHCOTE | C425: E WHITE 3 | F425: HOLT 2 | I425: WALKER | K425: WHITECHURCH | N425: COLLINS | Q425: SEARLE
A427: MOORABBIN | C427: 2 | D427: 3 | E427: =C427*6+D427 -> 15 | G427: 5 | H427: 6 | I427: =G427*6+H427 -> 36 | K427: 13 | L427: 10 | M427: =K427*6+L427 -> 88 | O427: 17 | P427: 17 | Q427: =O427*6+P427 -> 119 | S427: CAMBERWELL
A428: CAMBERWELL | C428: 2 | D428: 5 | E428: =C428*6+D428 -> 17 | G428: 4 | H428: 5 | I428: =G428*6+H428 -> 29 | K428: 8 | L428: 8 | M428: =K428*6+L428 -> 56 | O428: 12 | P428: 12 | Q428: =O428*6+P428 -> 84 | S428: IRVING
A429: BEST PLAYERS
A430: MOORABBIN | C430: STANLEY | F430: BOYD | I430: WALSH | L430: CHANDLER | O430: DALY | Q430: TONKIN
A431: CAMBERWELL | C431: DUFF | F431: BOHAN | I431: McGUINNESS | L431: WAIN | O431: McFEE | Q431: ALLAN
A432: GOALKICKERS
A433: MOORABBIN | C433: WALSH 5 | E433: CHANDLER 2 | H433: LAURIE 2 | J433: LEHMANN 2 | M433: PATEMAN | O433: BOYD | Q433: MUNYARD | T433: LEITCH | V433: DALY | X433: N BAKER
A434: CAMBERWELL | C434: BOHAN 7 | F434: McFEE 3 | I434: SCOTT | K434: CLARKE
A436: YARRAVILLE | C436: 5 | D436: 4 | E436: =C436*6+D436 -> 34 | G436: 8 | H436: 6 | I436: =G436*6+H436 -> 54 | K436: 8 | L436: 12 | M436: =K436*6+L436 -> 60 | O436: 10 | P436: 15 | Q436: =O436*6+P436 -> 75 | S436: PRESTON
A437: PRESTON | C437: 1 | D437: 2 | E437: =C437*6+D437 -> 8 | G437: 2 | H437: 7 | I437: =G437*6+H437 -> 19 | K437: 4 | L437: 12 | M437: =K437*6+L437 -> 36 | O437: 6 | P437: 15 | Q437: =O437*6+P437 -> 51 | S437: MALLETT
A438: BEST PLAYERS
A439: YARRAVILLE | C439: SEITZ | E439: HUGHES | H439: TAYLOR | K439: NICHOLLS | N439: BERRY | Q439: PEVITT
A440: PRESTON | C440: HENRYS | E440: COOPER | H440: WALKER | K440: PASCOE | N440: JEFFREY | Q440: LALOR
A441: GOALKICKERS
A442: YARRAVILLE | C442: WAGHORNE 2 | F442: MARCHESI 2 | I442: SALT | J442: PEVITT | L442: HUGHES | N442: BODSWORTH | Q442: ABBEY | S442: N ROHLEDER
A443: PRESTON | C443: FLETCHER 2 | F443: FOLEY 2 | I443: LALOR | K443: CHISHOLM
A445: BOX HILL | C445: 3 | D445: 4 | E445: =C445*6+D445 -> 22 | G445: 7 | H445: 8 | I445: =G445*6+H445 -> 50 | K445: 9 | L445: 9 | M445: =K445*6+L445 -> 63 | O445: 12 | P445: 11 | Q445: =O445*6+P445 -> 83 | S445: B'H
A446: PRAHRAN | C446: 2 | D446: 3 | E446: =C446*6+D446 -> 15 | G446: 5 | H446: 6 | I446: =G446*6+H446 -> 36 | K446: 9 | L446: 14 | M446: =K446*6+L446 -> 68 | O446: 10 | P446: 20 | Q446: =O446*6+P446 -> 80
A447: BEST PLAYERS
A448: BOX HILL | C448: EVANS | F448: KRONK | I448: MORRIS | L448: ELLIOTT | O448: STORMER | R448: W BLUNDY
A449: PRAHRAN | C449: KINNABURGH | F449: GRAMBEAU | I449: YATES | L449: PLAIN | O449: WALES | R449: O'BRIEN
A450: GOALKICKERS
A451: BOX HILL | C451: ALLAN 2 | F451: W BLUNDY 2 | I451: MORRIS 2 | L451: EADE 2 | N451: WRIGHT | P451: GREEN | R451: KRONK | T451: TURNER
A452: PRAHRAN | C452: KINNABURGH 9 | G452: O'BRYAN
A454: PORT MELBOURNE | C454: 6 | D454: 4 | E454: =C454*6+D454 -> 40 | G454: 10 | H454: 11 | I454: =G454*6+H454 -> 71 | K454: 14 | L454: 17 | M454: =K454*6+L454 -> 101 | O454: 23 | P454: 19 | Q454: =O454*6+P454 -> 157 | S454: ELSTERNWICK PARK
A455: BRIGHTON | C455: 3 | D455: 2 | E455: =C455*6+D455 -> 20 | G455: 4 | H455: 3 | I455: =G455*6+H455 -> 27 | K455: 7 | L455: 7 | M455: =K455*6+L455 -> 49 | O455: 8 | P455: 10 | Q455: =O455*6+P455 -> 58 | S455: MERRINGTON
A456: BEST PLAYERS
A457: PORT MELBOURNE | C457: BONNETT | F457: FRASER | I457: STONE | K457: JOHNSON | N457: MILLER | Q457: WITHERS
A458: BRIGHTON | C458: CONROY | F458: POUND | I458: CURRIE | K458: MEE | N458: RILEY | Q458: BURRELL
A459: GOALKICKERS
A460: PORT MELBOURNE | C460: BONNETT 8 | F460: MILLER 5 | I460: WITHERS 3 | L460: BRAGG 2 | N460: STONE 2 | P460: JOHNSON | R460: MURRAY | U460: FRASER
A461: BRIGHTON | C461: POUND 4 | F461: RILEY | H461: CURRIE | J461: BOWLES | L461: HARRISON
A463: ROUND 8 | E463: 13TH JUNE | J463: WEATHER | M463: SOUTH WEST WIND RAIN | S463: PLAYED AT
D464: 1ST QTR | H464: 2ND QTR | L464: 3RD QTR | P464: FINAL | S464: MOORABBIN
A465: MOORABBIN | C465: 1 | D465: 2 | E465: =C465*6+D465 -> 8 | G465: 3 | H465: 5 | I465: =G465*6+H465 -> 23 | K465: 5 | L465: 7 | M465: =K465*6+L465 -> 37 | O465: 7 | P465: 17 | Q465: =O465*6+P465 -> 59 | S465: UMPIRE | X465: LADDER | AB465: ROUND | AD465: 8
A466: BRUNSWICK | C466: 2 | D466: 3 | E466: =C466*6+D466 -> 15 | G466: 3 | H466: 4 | I466: =G466*6+H466 -> 22 | K466: 8 | L466: 7 | M466: =K466*6+L466 -> 55 | O466: 8 | P466: 7 | Q466: =O466*6+P466 -> 55 | S466: MERRINGTON
A467: BEST PLAYERS | W467: TEAM | X467: W | Y467: L | Z467: D | AA467: FOR | AB467: AGST | AC467: % | AD467: PTS
A468: MOORABBIN | C468: H STANLEY | F468: GILDER | I468: WATSON | L468: WALSH | N468: CHANDLER | Q468: BOYD
A469: BRUNSWICK | C469: L STANLEY | F469: DUNSTAN | I469: NEILSON | L469: MUNRO | N469: WEIR | Q469: YEA | W469: PORT MELBOURNE | X469: 8 | Y469: 0 | Z469: 0 | AA469: 819 | AB469: 369 | AC469: 221.95121951219511 | AD469: 32
A470: GOALKICKERS | W470: WILLIAMSTOWN | X470: 7 | Y470: 1 | Z470: 0 | AA470: 832 | AB470: 485 | AC470: =(+AA470/AB470)*100 -> 171.54639175257731 | AD470: 28
A471: MOORABBIN | C471: DALY 3 | F471: CHANDLER 2 | I471: LEHMANN | L471: WALSH | W471: MOORABBIN | X471: 5 | Y471: 2 | Z471: 1 | AA471: 495 | AB471: 511 | AC471: 96.868884540117421 | AD471: 22
A472: BRUNSWICK | C472: HUNTER 3 | F472: WEIR 3 | I472: CLUES | K472: KENNEDY | W472: COBURG | X472: 5 | Y472: 3 | Z472: 0 | AA472: 666 | AB472: 590 | AC472: =(+AA472/AB472)*100 -> 112.88135593220339 | AD472: 20
A474: PRAHRAN | C474: 5 | D474: 4 | E474: =C474*6+D474 -> 34 | G474: 9 | H474: 10 | I474: =G474*6+H474 -> 64 | K474: 15 | L474: 15 | M474: =K474*6+L474 -> 105 | O474: 22 | P474: 18 | Q474: =O474*6+P474 -> 150 | S474: TOORAK PARK | W474: OAKLEIGH | X474: 4 | Y474: 3 | Z474: 1 | AA474: 692 | AB474: 590 | AC474: =(+AA474/AB474)*100 -> 117.28813559322033 | AD474: 18
A475: SANDRINGHAM | C475: 1 | D475: 5 | E475: =C475*6+D475 -> 11 | G475: 2 | H475: 5 | I475: =G475*6+H475 -> 17 | K475: 4 | L475: 5 | M475: =K475*6+L475 -> 29 | O475: 4 | P475: 8 | Q475: =O475*6+P475 -> 32 | S475: ROACH | W475: PRAHRAN | X475: 4 | Y475: 4 | Z475: 0 | AA475: 674 | AB475: 566 | AC475: 119.08127208480565 | AD475: 16
A476: BEST PLAYERS | W476: BRUNSWICK | X476: 4 | Y476: 4 | Z476: 0 | AA476: 560 | AB476: 527 | AC476: 106.2618595825427 | AD476: 16
A477: PRAHRAN | C477: ELLIOTT | E477: WALSH | H477: HARVEY | K477: WALES | N477: GRAMBEAU | Q477: KINNABURGH | W477: YARRAVILLE | X477: 3 | Y477: 3 | Z477: 2 | AA477: 520 | AB477: 570 | AC477: =(+AA477/AB477)*100 -> 91.228070175438589 | AD477: 16
A478: SANDRINGHAM | C478: EVANS | E478: GUTTERIDGE | H478: POTTER | K478: SHEARS | N478: N JONES | Q478: HISCOCK | W478: SANDRINGHAM | X478: 4 | Y478: 4 | Z478: 0 | AA478: 532 | AB478: 734 | AC478: 72.479564032697553 | AD478: 16
A479: GOALKICKERS | Q479: WALSH | W479: BOX HILL | X479: 3 | Y479: 5 | Z479: 0 | AA479: 593 | AB479: 660 | AC479: =(+AA479/AB479)*100 -> 89.848484848484844 | AD479: 12
A480: PRAHRAN | C480: ELLIOTT 6 | E480: KINNABURGH 4 | H480: HARVEY 4 | J480: KRUSE 2 | L480: LOUREY 2 | N480: PLAIN | P480: JONES | R480: O'BRYAN | W480: CAMBERWELL | X480: 3 | Y480: 5 | Z480: 0 | AA480: 542 | AB480: 755 | AC480: 71.788079470198682 | AD480: 12
A481: SANDRINGHAM | C481: POTTER 2 | F481: GATES | H481: HARPER | W481: NORTHCOTE | X481: 2 | Y481: 6 | Z481: 0 | AA481: 527 | AB481: 564 | AC481: 93.439716312056731 | AD481: 8
W482: PRESTON | X482: 2 | Y482: 6 | Z482: 0 | AA482: 416 | AB482: 587 | AC482: =(+AA482/AB482)*100 -> 70.868824531516182 | AD482: 8
A483: OAKLEIGH | C483: 4 | D483: 2 | E483: =C483*6+D483 -> 26 | G483: 9 | H483: 8 | I483: =G483*6+H483 -> 62 | K483: 11 | L483: 9 | M483: =K483*6+L483 -> 75 | O483: 20 | P483: 13 | Q483: =O483*6+P483 -> 133 | S483: OAKLEIGH | W483: BRIGHTON | X483: 0 | Y483: 8 | Z483: 0 | AA483: 465 | AB483: 825 | AC483: 56.363636363636367 | AD483: 0
A484: BOX HILL | C484: 7 | D484: 5 | E484: =C484*6+D484 -> 47 | G484: 7 | H484: 9 | I484: =G484*6+H484 -> 51 | K484: 9 | L484: 11 | M484: =K484*6+L484 -> 65 | O484: 12 | P484: 11 | Q484: =O484*6+P484 -> 83 | S484: SMYTH
A485: BEST PLAYERS
A486: OAKLEIGH | C486: HILL | F486: TONDAL | I486: STREETER | L486: LONIE | O486: EDWARDS | R486: BAPTIST
A487: BOX HILL | C487: MORRIS | F487: ALLEN | I487: EADE | L487: HOCKEN | O487: W BLUNDY | R487: KRONK
A488: GOALKICKERS
A489: OAKLEIGH | C489: STREETER 7 | F489: LONIE 5 | I489: TINDAL 4 | L489: EDWARDS 2 | O489: W WILLIAMS | R489: BAPTIST
A490: BOX HILL | C490: ALLEN 2 | E490: HOCKEN 2 | H490: MORRIS 2 | J490: COGHLAN 2 | M490: GREEN | O490: WRIGHT | Q490: KRONK | S490: EDNIE
A492: COBURG | C492: 3 | D492: 6 | E492: =C492*6+D492 -> 24 | G492: 4 | H492: 9 | I492: =G492*6+H492 -> 33 | K492: 8 | L492: 12 | M492: =K492*6+L492 -> 60 | O492: 11 | P492: 17 | Q492: =O492*6+P492 -> 83 | S492: COBURG
A493: PRESTON | C493: 0 | D493: 1 | E493: =C493*6+D493 -> 1 | G493: 3 | H493: 4 | I493: =G493*6+H493 -> 22 | K493: 3 | L493: 5 | M493: =K493*6+L493 -> 23 | O493: 6 | P493: 8 | Q493: =O493*6+P493 -> 44 | S493: IRVING
A494: BEST PLAYERS
A495: COBURG | C495: EVANS | F495: McTAGGART | I495: ROGAN | L495: BULMAN | O495: CONDON | Q495: HEWES
A496: PRESTON | C496: ANDERSON | F496: FOLEY | I496: CROCKER | L496: FLETCHER | O496: HENRYS | Q496: COOPER
A497: GOALKICKERS
A498: COBURG | C498: H WILKINSON 3 | F498: ROGAN 2 | I498: McTAGGART 2 | L498: HEWES | N498: JOHNSON | P498: LEVERSHA | R498: AITKEN
A499: PRESTON | C499: LALOR 2 | F499: WALKER | I499: HAYES | K499: MOORE | M499: FLETCHER
A501: YARRAVILLE | C501: 1 | D501: 3 | E501: =C501*6+D501 -> 9 | G501: 4 | H501: 6 | I501: =G501*6+H501 -> 30 | K501: 7 | L501: 8 | M501: =K501*6+L501 -> 50 | O501: 8 | P501: 10 | Q501: =O501*6+P501 -> 58 | S501: YARRAVILLE
A502: BRIGHTON | C502: 1 | D502: 5 | E502: =C502*6+D502 -> 11 | G502: 3 | H502: 9 | I502: =G502*6+H502 -> 27 | K502: 3 | L502: 10 | M502: =K502*6+L502 -> 28 | O502: 6 | P502: 14 | Q502: =O502*6+P502 -> 50 | S502: RICHARDSON
A503: BEST PLAYERS | S503: NORTHCOTE
A504: YARRAVILLE | C504: NICHOLLS | F504: GWYNNE | I504: ABBEY | L504: K SMITH | O504: BERRY | R504: SMALLWOOD
A505: BRIGHTON | C505: BURRELL | F505: BLACKMORE | I505: CRAIG | L505: BURRINGTON | O505: G CONROY | R505: FREEMAN
A506: GOALKICKERS
A507: YARRAVILLE | C507: ABBEY 4 | F507: PHILLIPS 2 | I507: BODSWORTH | L507: SALT
A508: BRIGHTON | C508: BURRINGTON | F508: MARINI | H508: POUND | J508: G CONROY | M508: BOWLES | O508: HOWE
A510: PORT MELBOURNE | C510: 4 | D510: 7 | E510: =C510*6+D510 -> 31 | G510: 8 | H510: 11 | I510: =G510*6+H510 -> 59 | K510: 12 | L510: 16 | M510: =K510*6+L510 -> 88 | O510: 17 | P510: 20 | Q510: =O510*6+P510 -> 122 | S510: PORT MELBOURNE
A511: CAMBERWELL | C511: 0 | D511: 0 | E511: =C511*6+D511 -> 0 | G511: 2 | H511: 3 | I511: =G511*6+H511 -> 15 | K511: 2 | L511: 5 | M511: =K511*6+L511 -> 17 | O511: 5 | P511: 7 | Q511: =O511*6+P511 -> 37 | S511: CARDWELL
A512: BEST PLAYERS
A513: PORT MELBOURNE | C513: KELSEY | F513: FRASER | I513: MURRAY | L513: WILSON | N513: JOHNSON | Q513: WOODBRIDGE
A514: CAMBERWELL | C514: WAIN | F514: HEDLEY | I514: BOHAN | L514: McFEE | N514: DUFF | Q514: THYNNE
A515: GOALKICKERS
A516: PORT MELBOURNE | C516: MILLER 5 | F516: MURRAY 5 | I516: FRASER 4 | L516: JOHNSON | N516: BONNETT | Q516: OWEN
A517: CAMBERWELL | C517: McFEE 2 | F517: BOHAN | H517: McGUINNESS | K517: CLARKE
A519: WILLIAMSTOWN | C519: 3 | D519: 1 | E519: =C519*6+D519 -> 19 | G519: 7 | H519: 3 | I519: =G519*6+H519 -> 45 | K519: 8 | L519: 5 | M519: =K519*6+L519 -> 53 | O519: 17 | P519: 9 | Q519: =O519*6+P519 -> 111 | S519: WILLIAMSTOWN
A520: NORTHCOTE | C520: 2 | D520: 4 | E520: =C520*6+D520 -> 16 | G520: 3 | H520: 4 | I520: =G520*6+H520 -> 22 | K520: 8 | L520: 6 | M520: =K520*6+L520 -> 54 | O520: 11 | P520: 6 | Q520: =O520*6+P520 -> 72 | S520: MALLETT
A521: BEST PLAYERS
A522: WILLIAMSTOWN | C522: G WILLIAMS | F522: SHEAHAN | I522: SIMPSON | M522: LINTON | P522: WOOKEY | S522: HARLEY
A523: NORTHCOTE | C523: STABB | F523: POWELL | I523: K WHITECHURCH | M523: WOOLNOUGH | P523: ALDRIDGE | S523: SEARLE
A524: GOALKICKERS
A525: WILLIAMSTOWN | C525: WALKER 6 | F525: SIMPSON 3 | I525: LINTON 2 | K525: SMITH 2 | M525: B WILLIAMS | P525: W WILLIAMS | S525: TAAFE | U525: SIMS
A526: NORTHCOTE | C526: FRANCIS 5 | F526: K WHITECHURCH 3 | J526: HOLT | L526: POWELL | N526: ARAMANT
A528: ROUND 9 | E528: 20TH JUNE | J528: WEATHER | M528: SOUTH WEST WIND RAIN | S528: PLAYED AT
D529: 1ST QTR | H529: 2ND QTR | L529: 3RD QTR | P529: FINAL | S529: WILLIAMSTOWN
A530: WILLIAMSTOWN | C530: 5 | D530: 4 | E530: =C530*6+D530 -> 34 | G530: 5 | H530: 5 | I530: =G530*6+H530 -> 35 | K530: 11 | L530: 8 | M530: =K530*6+L530 -> 74 | O530: 11 | P530: 8 | Q530: =O530*6+P530 -> 74 | S530: UMPIRE | X530: LADDER | AB530: ROUND | AD530: 9
A531: COBURG | C531: 1 | D531: 1 | E531: =C531*6+D531 -> 7 | G531: 2 | H531: 7 | I531: =G531*6+H531 -> 19 | K531: 2 | L531: 7 | M531: =K531*6+L531 -> 19 | O531: 9 | P531: 20 | Q531: =O531*6+P531 -> 74
A532: BEST PLAYERS | W532: TEAM | X532: W | Y532: L | Z532: D | AA532: FOR | AB532: AGST | AC532: % | AD532: PTS
A533: WILLIAMSTOWN | C533: DULLARD | F533: SIMPSON | I533: MOLYNEUX | L533: B WILLIAMS | O533: CALLAHAN | R533: WALKER
A534: COBURG | C534: ROGAN | F534: McDONALD | I534: LAMBERT | L534: STARBUCK | O534: H WILKINSON | R534: MALONE | W534: PORT MELBOURNE | X534: 9 | Y534: 0 | Z534: 0 | AA534: 888 | AB534: 437 | AC534: 203.20366132723112 | AD534: 36
A535: GOALKICKERS | W535: WILLIAMSTOWN | X535: 7 | Y535: 1 | Z535: 1 | AA535: 906 | AB535: 559 | AC535: =(+AA535/AB535)*100 -> 162.07513416815743 | AD535: 30
A536: WILLIAMSTOWN | C536: WALKER 5 | F536: DULLARD 2 | I536: SIMPSON 2 | L536: MULDOWNEY | O536: SMITH | W536: OAKLEIGH | X536: 5 | Y536: 3 | Z536: 1 | AA536: 782 | AB536: 628 | AC536: =(+AA536/AB536)*100 -> 124.52229299363057 | AD536: 22
A537: COBURG | C537: ROGAN 3 | F537: H WILKINSON 3 | J537: R WILKINSON | M537: JOHNSON | O537: EVANS | W537: COBURG | X537: 5 | Y537: 3 | Z537: 1 | AA537: 740 | AB537: 664 | AC537: =(+AA537/AB537)*100 -> 111.44578313253012 | AD537: 22
A539: PORT MELBOURNE | C539: 2 | D539: 1 | E539: =C539*6+D539 -> 13 | G539: 5 | H539: 13 | I539: =G539*6+H539 -> 43 | K539: 7 | L539: 14 | M539: =K539*6+L539 -> 56 | O539: 8 | P539: 21 | Q539: =O539*6+P539 -> 69 | S539: BRUNSWICK | W539: MOORABBIN | X539: 5 | Y539: 3 | Z539: 1 | AA539: 537 | AB539: 569 | AC539: 94.376098418277678 | AD539: 22
A540: BRUNSWICK | C540: 3 | D540: 4 | E540: =C540*6+D540 -> 22 | G540: 4 | H540: 4 | I540: =G540*6+H540 -> 28 | K540: 10 | L540: 6 | M540: =K540*6+L540 -> 66 | O540: 10 | P540: 8 | Q540: =O540*6+P540 -> 68 | S540: SMYTH | W540: PRAHRAN | X540: 5 | Y540: 4 | Z540: 0 | AA540: 738 | AB540: 625 | AC540: 118.08 | AD540: 20
A541: BEST PLAYERS | W541: YARRAVILLE | X541: 4 | Y541: 3 | Z541: 2 | AA541: 581 | AB541: 623 | AC541: =(+AA541/AB541)*100 -> 93.258426966292134 | AD541: 20
A542: PORT MELBOURNE | C542: LEEHANE | F542: MILLER | I542: KELSEY | K542: WILSON | N542: STONE | Q542: STOREY | W542: BRUNSWICK | X542: 4 | Y542: 5 | Z542: 0 | AA542: 628 | AB542: 596 | AC542: 105.36912751677852 | AD542: 16
A543: BRUNSWICK | C543: PLANT | F543: MULLENGER | I543: LOVETT | K543: YEA | N543: CLUES | Q543: MAHER | W543: BOX HILL | X543: 4 | Y543: 5 | Z543: 0 | AA543: 651 | AB543: 702 | AC543: =(+AA543/AB543)*100 -> 92.73504273504274 | AD543: 16
A544: GOALKICKERS | W544: SANDRINGHAM | X544: 4 | Y544: 5 | Z544: 0 | AA544: 570 | AB544: 824 | AC544: 69.174757281553397 | AD544: 16
A545: PORT MELBOURNE | C545: MILLER 3 | F545: BONNETT 2 | I545: STONE | K545: LAFFEY | M545: H TUCKER | W545: PRESTON | X545: 3 | Y545: 6 | Z545: 0 | AA545: 483 | AB545: 641 | AC545: =(+AA545/AB545)*100 -> 75.351014040561623 | AD545: 12
A546: BRUNSWICK | C546: HUNTER 3 | F546: MULLENGER 2 | I546: WEIR 2 | K546: CLUES | M546: LOVETT | O546: BREW | W546: CAMBERWELL | X546: 3 | Y546: 6 | Z546: 0 | AA546: 595 | AB546: 816 | AC546: 72.916666666666671 | AD546: 12
W547: NORTHCOTE | X547: 2 | Y547: 7 | Z547: 0 | AA547: 586 | AB547: 628 | AC547: 93.312101910828019 | AD547: 8
A548: OAKLEIGH | C548: 4 | D548: 4 | E548: =C548*6+D548 -> 28 | G548: 4 | H548: 8 | I548: =G548*6+H548 -> 32 | K548: 9 | L548: 11 | M548: =K548*6+L548 -> 65 | O548: 13 | P548: 12 | Q548: =O548*6+P548 -> 90 | S548: BEACH ROAD | W548: BRIGHTON | X548: 0 | Y548: 9 | Z548: 0 | AA548: 519 | AB548: 892 | AC548: 58.183856502242151 | AD548: 0
A549: SANDRINGHAM | C549: 2 | D549: 2 | E549: =C549*6+D549 -> 14 | G549: 3 | H549: 6 | I549: =G549*6+H549 -> 24 | K549: 3 | L549: 7 | M549: =K549*6+L549 -> 25 | O549: 5 | P549: 8 | Q549: =O549*6+P549 -> 38 | S549: MERRINGTON
A550: BEST PLAYERS
A551: OAKLEIGH | C551: HILL | F551: LAMBERT | I551: SCOTT | K551: SAVORY | N551: EDWARDS | Q551: LONIE
A552: SANDRINGHAM | C552: MADSEN | F552: RUSSO | I552: MILLER | K552: WOODS | N552: GUTTERIDGE | Q552: BOURKE
A553: GOALKICKERS
A554: OAKLEIGH | C554: LONIE 6 | F554: EDWARDS 2 | I554: SAVORY | K554: SCOTT | M554: HILL | N554: JACKSON | Q554: WATSON
A555: SANDRINGHAM | C555: HARPER 2 | F555: MILLER | I555: GATES | K555: HISCOCK
A557: YARRAVILLE | C557: 0 | D557: 2 | E557: =C557*6+D557 -> 2 | G557: 4 | H557: 8 | I557: =G557*6+H557 -> 32 | K557: 6 | L557: 11 | M557: =K557*6+L557 -> 47 | O557: 8 | P557: 13 | Q557: =O557*6+P557 -> 61 | S557: CAMBERWELL
A558: CAMBERWELL | C558: 3 | D558: 2 | E558: =C558*6+D558 -> 20 | G558: 4 | H558: 2 | I558: =G558*6+H558 -> 26 | K558: 5 | L558: 3 | M558: =K558*6+L558 -> 33 | O558: 8 | P558: 5 | Q558: =O558*6+P558 -> 53 | S558: ROACH
A559: BEST PLAYERS
A560: YARRAVILLE | C560: SEITZ | E560: BODSWORTH | H560: J ROHLEDER | K560: TAYLOR | N560: K SMITH | Q560: COOK
A561: CAMBERWELL | C561: BOHAN | E561: McFEE | H561: ALLAN | K561: McGUINNESS | N561: FLETCHER | Q561: BENSON
A562: GOALKICKERS
A563: YARRAVILLE | C563: J ROHLEDER 4 | F563: BODSWORTH | I563: R T SMITH | L563: SEITZ | N563: SMALLWOOD
A564: CAMBERWELL | C564: McGUINNES 3 | F564: YOUNG 2 | I564: BRADLEY 2 | L564: HEDLEY
A566: PRESTON | C566: 2 | D566: 3 | E566: =C566*6+D566 -> 15 | G566: 4 | H566: 4 | I566: =G566*6+H566 -> 28 | K566: 7 | L566: 6 | M566: =K566*6+L566 -> 48 | O566: 10 | P566: 7 | Q566: =O566*6+P566 -> 67 | S566: ELSTERNWICK PARK
A567: BRIGHTON | C567: 2 | D567: 0 | E567: =C567*6+D567 -> 12 | G567: 4 | H567: 2 | I567: =G567*6+H567 -> 26 | K567: 7 | L567: 5 | M567: =K567*6+L567 -> 47 | O567: 8 | P567: 6 | Q567: =O567*6+P567 -> 54 | S567: CARDWELL
A568: BEST PLAYERS
A569: PRESTON | C569: FOLEY | E569: PRITCHARD | H569: BRADFORD | K569: CANN | N569: HENRYS | Q569: CROCKER
A570: BRIGHTON | C570: CRAIG | E570: HOWE | H570: FREEMAN | K570: O'MEARA | N570: SINCLAIR | Q570: C CONROY
A571: GOALKICKERS
A572: PRESTON | C572: CANN 3 | E572: FOLEY 3 | H572: BRADFORD 2 | K572: MOORE | M572: FLETCHER
A573: BRIGHTON | C573: COURTNEY 2 | F573: HOWE 2 | I573: HARRINGTON | L573: CRAIG | N573: POUND | P573: MARINI
A575: BOX HILL | C575: 1 | D575: 3 | E575: =C575*6+D575 -> 9 | G575: 3 | H575: 5 | I575: =G575*6+H575 -> 23 | K575: 7 | L575: 8 | M575: =K575*6+L575 -> 50 | O575: 8 | P575: 10 | Q575: =O575*6+P575 -> 58 | S575: B'H
A576: MOORABBIN | C576: 2 | D576: 3 | E576: =C576*6+D576 -> 15 | G576: 4 | H576: 3 | I576: =G576*6+H576 -> 27 | K576: 5 | L576: 5 | M576: =K576*6+L576 -> 35 | O576: 6 | P576: 6 | Q576: =O576*6+P576 -> 42 | S576: MALLETT
A577: BEST PLAYERS
A578: BOX HILL | C578: MORRIS | F578: IRVINE | I578: LOVE | L578: TURNER | O578: KRONK | R578: ALLEN
A579: MOORABBIN | C579: DALY | F579: GILDER | I579: STANLEY | L579: McKENZIE | O579: LEHMANN | R579: BROWN
A580: GOALKICKERS
A581: BOX HILL | C581: ALLEN 3 | F581: HOCKEN | I581: EADE | K581: W BLUNDY | N581: EDNIE | P581: TURNER
A582: MOORABBIN | C582: McKENZIE 2 | F582: DALY 2 | I582: BOYD | K582: WALSH
A584: PRAHRAN | C584: 1 | D584: 5 | E584: =C584*6+D584 -> 11 | G584: 2 | H584: 5 | I584: =G584*6+H584 -> 17 | K584: 6 | L584: 10 | M584: =K584*6+L584 -> 46 | O584: 9 | P584: 10 | Q584: =O584*6+P584 -> 64 | S584: NORTHCOTE
A585: NORTHCOTE | C585: 0 | D585: 1 | E585: =C585*6+D585 -> 1 | G585: 4 | H585: 3 | I585: =G585*6+H585 -> 27 | K585: 4 | L585: 3 | M585: =K585*6+L585 -> 27 | O585: 9 | P585: 5 | Q585: =O585*6+P585 -> 59 | S585: IRVING
A586: BEST PLAYERS
A587: PRAHRAN | C587: HARVEY | F587: WALES | I587: COLLS | K587: O'BRYAN | N587: GRAMBEAU | Q587: H BOYD
A588: NORTHCOTE | C588: STABB | F588: ALDRIDGE | I588: J VAINS | K588: WALKER | N588: FRANCIS | Q588: McLAINE
A589: GOALKICKERS
A590: PRAHRAN | C590: O'BRYAN 3 | F590: KINNABURGH 2 | J590: WALSH | L590: WALES | N590: GRAMBEAU | Q590: LOUREY
A591: NORTHCOTE | C591: POWELL 2 | F591: FRANCIS 2 | I591: HOLT 2 | K591: AMARANT | M591: E WHITE | O591: WHITECHURCH
A593: ROUND 10 | E593: 27TH JUNE | J593: WEATHER | M593: NORTH WEST WIND RAIN 2ND HALF | S593: PLAYED AT
D594: 1ST QTR | H594: 2ND QTR | L594: 3RD QTR | P594: FINAL | S594: TOORAK PARK
A595: PRAHRAN | C595: 3 | D595: 4 | E595: =C595*6+D595 -> 22 | G595: 9 | H595: 6 | I595: =G595*6+H595 -> 60 | K595: 11 | L595: 9 | M595: =K595*6+L595 -> 75 | O595: 15 | P595: 12 | Q595: =O595*6+P595 -> 102 | S595: UMPIRE | X595: LADDER | AB595: ROUND | AD595: 10
A596: WILLIAMSTOWN | C596: 2 | D596: 6 | E596: =C596*6+D596 -> 18 | G596: 5 | H596: 8 | I596: =G596*6+H596 -> 38 | K596: 8 | L596: 19 | M596: =K596*6+L596 -> 67 | O596: 8 | P596: 22 | Q596: =O596*6+P596 -> 70 | S596: MERRINGTON
A597: BEST PLAYERS | W597: TEAM | X597: W | Y597: L | Z597: D | AA597: FOR | AB597: AGST | AC597: % | AD597: PTS
A598: PRAHRAN | C598: WALES | F598: HART | I598: WALSH | L598: PLAIN | N598: C BOYD | Q598: KINNABURGH
A599: WILLIAMSTOWN | C599: W WILLIAMS | F599: SIMPSON | I599: B WILLIAMS | L599: LINTON | N599: ROGERS | Q599: SIMS | W599: PORT MELBOURNE | X599: 10 | Y599: 0 | Z599: 0 | AA599: 1008 | AB599: 459 | AC599: 219.60784313725489 | AD599: 40
A600: GOALKICKERS | W600: WILLIAMSTOWN | X600: 7 | Y600: 2 | Z600: 1 | AA600: 976 | AB600: 661 | AC600: =(+AA600/AB600)*100 -> 147.65506807866868 | AD600: 30
A601: PRAHRAN | C601: WALSH 5 | F601: KINNABURGH 3 | J601: HARVEY 2 | M601: HART 2 | O601: ELLIOTT | Q601: MORONE | W601: COBURG | X601: 6 | Y601: 3 | Z601: 1 | AA601: 876 | AB601: 701 | AC601: =(+AA601/AB601)*100 -> 124.96433666191156 | AD601: 26
A602: WILLIAMSTOWN | C602: LINTON 2 | F602: DULLARD 2 | I602: W WILLIAMS 2 | L602: B WILLIAMS | O602: WALKER | W602: OAKLEIGH | X602: 6 | Y602: 3 | Z602: 1 | AA602: 853 | AB602: 693 | AC602: =(+AA602/AB602)*100 -> 123.08802308802309 | AD602: 26
A604: YARRAVILLE | C604: 6 | D604: 6 | E604: =C604*6+D604 -> 42 | G604: 8 | H604: 8 | I604: =G604*6+H604 -> 56 | K604: 13 | L604: 12 | M604: =K604*6+L604 -> 90 | O604: 13 | P604: 13 | Q604: =O604*6+P604 -> 91 | S604: YARRAVILLE | W604: MOORABBIN | X604: 6 | Y604: 3 | Z604: 1 | AA604: 649 | AB604: 627 | AC604: 103.50877192982456 | AD604: 26
A605: BRUNSWICK | C605: 0 | D605: 1 | E605: =C605*6+D605 -> 1 | G605: 6 | H605: 5 | I605: =G605*6+H605 -> 41 | K605: 6 | L605: 6 | M605: =K605*6+L605 -> 42 | O605: 9 | P605: 11 | Q605: =O605*6+P605 -> 65 | S605: CARDWELL | W605: PRAHRAN | X605: 6 | Y605: 4 | Z605: 0 | AA605: 840 | AB605: 695 | AC605: 120.86330935251799 | AD605: 24
A606: BEST PLAYERS | W606: YARRAVILLE | X606: 5 | Y606: 3 | Z606: 2 | AA606: 672 | AB606: 688 | AC606: =(+AA606/AB606)*100 -> 97.674418604651152 | AD606: 24
A607: YARRAVILLE | C607: SEITZ | E607: BODSWORTH | H607: SALT | K607: BERRY | N607: SMALLWOOD | Q607: NICHOLLS | W607: BRUNSWICK | X607: 4 | Y607: 6 | Z607: 0 | AA607: 693 | AB607: 687 | AC607: 100.87336244541484 | AD607: 16
A608: BRUNSWICK | C608: YEA | E608: NEILSON | H608: CLUES | K608: MAHER | N608: ROLFS | Q608: EDWARDS | W608: BOX HILL | X608: 4 | Y608: 6 | Z608: 0 | AA608: 673 | AB608: 822 | AC608: =(+AA608/AB608)*100 -> 81.873479318734795 | AD608: 16
A609: GOALKICKERS | W609: PRESTON | X609: 4 | Y609: 6 | Z609: 0 | AA609: 561 | AB609: 708 | AC609: =(+AA609/AB609)*100 -> 79.237288135593218 | AD609: 16
A610: YARRAVILLE | C610: BODSWORTH 5 | F610: SALT 3 | H610: N ROHLEDER 2 | K610: MARCHESI | N610: SEITZ | P610: SMALLWOOD | W610: SANDRINGHAM | X610: 4 | Y610: 6 | Z610: 0 | AA610: 628 | AB610: 936 | AC610: 67.09401709401709 | AD610: 16
A611: BRUNSWICK | C611: HUNTER 3 | F611: PHILLIPS 2 | I611: NEILSON | K611: LOVETT | M611: BREW | O611: MULLENGER | W611: CAMBERWELL | X611: 3 | Y611: 7 | Z611: 0 | AA611: 662 | AB611: 894 | AC611: 74.049217002237143 | AD611: 12
W612: NORTHCOTE | X612: 2 | Y612: 8 | Z612: 0 | AA612: 651 | AB612: 699 | AC612: 93.133047210300433 | AD612: 8
A613: PORT MELBOURNE | C613: 9 | D613: 2 | E613: =C613*6+D613 -> 56 | G613: 11 | H613: 4 | I613: =G613*6+H613 -> 70 | K613: 16 | L613: 10 | M613: =K613*6+L613 -> 106 | O613: 18 | P613: 12 | Q613: =O613*6+P613 -> 120 | S613: PORT MELBOURNE | W613: BRIGHTON | X613: 0 | Y613: 10 | Z613: 0 | AA613: 556 | AB613: 1028 | AC613: 54.085603112840467 | AD613: 0
A614: BOX HILL | C614: 1 | D614: 1 | E614: =C614*6+D614 -> 7 | G614: 3 | H614: 4 | I614: =G614*6+H614 -> 22 | K614: 3 | L614: 4 | M614: =K614*6+L614 -> 22 | O614: 3 | P614: 4 | Q614: =O614*6+P614 -> 22 | S614: IRVING
A615: BEST PLAYERS
A616: PORT MELBOURNE | C616: WILSON | F616: MURRAY | I616: LEEHANE | L616: KELSEY | O616: MILLER | Q616: WOODBRIDGE
A617: BOX HILL | C617: WRIGHT | F617: EDNIE | I617: MORRIS | L617: WILLIAMS | O617: KRONK | Q617: ALLEN
A618: GOALKICKERS
A619: PORT MELBOURNE | C619: BONNETT 6 | F619: OWENS 3 | I619: H TUCKER 2 | L619: STONE 2 | N619: HAMMOND 2 | Q619: MURRAY 2 | T619: WALSH
A620: BOX HILL | C620: W BLUNDY | F620: WINDOW | I620: EADE
A622: MOORABBIN | C622: 5 | D622: 4 | E622: =C622*6+D622 -> 34 | G622: 10 | H622: 7 | I622: =G622*6+H622 -> 67 | K622: 14 | L622: 10 | M622: =K622*6+L622 -> 94 | O622: 17 | P622: 10 | Q622: =O622*6+P622 -> 112 | S622: MOORABBIN
A623: SANDRINGHAM | C623: 2 | D623: 1 | E623: =C623*6+D623 -> 13 | G623: 7 | H623: 3 | I623: =G623*6+H623 -> 45 | K623: 8 | L623: 4 | M623: =K623*6+L623 -> 52 | O623: 9 | P623: 4 | Q623: =O623*6+P623 -> 58 | S623: ROACH
A624: BEST PLAYERS
A625: MOORABBIN | C625: COAD | F625: McKENZIE | I625: STANLEY | L625: BOYD | O625: DALY | Q625: PATTISON
A626: SANDRINGHAM | C626: L WOODS | F626: EVANS | I626: MILLER | L626: N JONES | O626: HARPER | Q626: GATES
A627: GOALKICKERS
A628: MOORABBIN | C628: COAD 3 | F628: CHANDLER 3 | I628: PATTISON 2 | L628: RICHARDS 2 | O628: JACK WALSH 2 | R628: DALY 2 | U628: BOYD | W628: J P WALSH | X628: LEHMANN
A629: SANDRINGHAM | C629: HARPER 4 | F629: L WOODS 3 | I629: POTTER | K629: GUILLE
A631: PRESTON | C631: 2 | D631: 2 | E631: =C631*6+D631 -> 14 | G631: 5 | H631: 8 | I631: =G631*6+H631 -> 38 | K631: 6 | L631: 9 | M631: =K631*6+L631 -> 45 | O631: 11 | P631: 12 | Q631: =O631*6+P631 -> 78 | S631: PRESTON
A632: CAMBERWELL | C632: 3 | D632: 8 | E632: =C632*6+D632 -> 26 | G632: 3 | H632: 8 | I632: =G632*6+H632 -> 26 | K632: 6 | L632: 11 | M632: =K632*6+L632 -> 47 | O632: 9 | P632: 13 | Q632: =O632*6+P632 -> 67 | S632: SMYTH
A633: BEST PLAYERS
A634: PRESTON | C634: HARRISON | F634: BRADFORD | I634: DEACON | L634: CROCKER | O634: SWEET | R634: HENRYS
A635: CAMBERWELL | C635: FLETCHER | F635: BRADLEY | I635: WAIN | L635: HEDLEY | O635: McFEE | R635: MASON
A636: GOALKICKERS
A637: PRESTON | C637: FOLEY 4 | F637: BRADFORD 3 | I637: FLETCHER | L637: McLACHLAN | O637: CANN | Q637: DEACON
A638: CAMBERWELL | C638: HEDLEY 2 | F638: McCOMBE 2 | I638: BRADLEY | K638: ROSENBROCK | N638: DUFF | P638: ALLAN | R638: McFEE
A640: OAKLEIGH | C640: 3 | D640: 2 | E640: =C640*6+D640 -> 20 | G640: 6 | H640: 6 | I640: =G640*6+H640 -> 42 | K640: 8 | L640: 8 | M640: =K640*6+L640 -> 56 | O640: 10 | P640: 11 | Q640: =O640*6+P640 -> 71 | S640: OAKLEIGH
A641: NORTHCOTE | C641: 4 | D641: 2 | E641: =C641*6+D641 -> 26 | G641: 7 | H641: 3 | I641: =G641*6+H641 -> 45 | K641: 9 | L641: 4 | M641: =K641*6+L641 -> 58 | O641: 10 | P641: 5 | Q641: =O641*6+P641 -> 65 | S641: RICHARDSON
A642: BEST PLAYERS
A643: OAKLEIGH | C643: HILL | F643: STREETER | I643: LONIE | L643: GUY | N643: TINDAL | Q643: VAINS
A644: NORTHCOTE | C644: WOOLNOUGH | F644: AMARANT | I644: WALKER | L644: PAYNTER | N644: SEARLE | Q644: GALLAGHER
A645: GOALKICKERS
A646: OAKLEIGH | C646: EDWARDS 3 | F646: STREETER 2 | I646: LONIE 2 | K646: SCOTT 2 | M646: TINDAL | O646: BAPTIST
A647: NORTHCOTE | C647: SEARLE 5 | F647: AMARANT 3 | I647: HOLT | K647: COLLINS
A649: COBURG | C649: 7 | D649: 4 | E649: =C649*6+D649 -> 46 | G649: 11 | H649: 6 | I649: =G649*6+H649 -> 72 | K649: 16 | L649: 20 | M649: =K649*6+L649 -> 116 | O649: 19 | P649: 22 | Q649: =O649*6+P649 -> 136 | S649: COBURG
A650: BRIGHTON | C650: 1 | D650: 0 | E650: =C650*6+D650 -> 6 | G650: 3 | H650: 2 | I650: =G650*6+H650 -> 20 | K650: 3 | L650: 2 | M650: =K650*6+L650 -> 20 | O650: 5 | P650: 7 | Q650: =O650*6+P650 -> 37 | S650: MALLETT
A651: BEST PLAYERS
A652: COBURG | C652: H WILKINSON | F652: ROGAN | I652: BULMAN | L652: STARBUCK | O652: LEVERSHA | R652: McTAGGART
A653: BRIGHTON | C653: BLACKMORE | F653: O'MEARA | I653: CRAIG | L653: O'DONOGHUE | O653: MARINI | R653: FREEMAN
A654: GOALKICKERS
A655: COBURG | C655: BULMAN 6 | F655: ROGAN 4 | I655: HEWES 3 | K655: H WILKINSON 2 | N655: MAHONEY | Q655: LEVERSHA | T655: BUCKLEY | W655: EVANS
A656: BRIGHTON | C656: POUND 2 | F656: TOOHEY | I656: MARINI | L656: CRAIG
A658: ROUND 11 | E658: 4TH JULY | J658: WEATHER | O658: NORTH WIND FINE | S658: PLAYED AT
D659: 1ST QTR | H659: 2ND QTR | L659: 3RD QTR | P659: FINAL | S659: WILLIAMSTOWN
A660: WILLIAMSTOWN | C660: 1 | D660: 2 | E660: =C660*6+D660 -> 8 | G660: 9 | H660: 7 | I660: =G660*6+H660 -> 61 | K660: 12 | L660: 8 | M660: =K660*6+L660 -> 80 | O660: 17 | P660: 13 | Q660: =O660*6+P660 -> 115 | S660: UMPIRE | X660: LADDER | AB660: ROUND | AD660: 11
A661: OAKLEIGH | C661: 3 | D661: 5 | E661: =C661*6+D661 -> 23 | G661: 3 | H661: 6 | I661: =G661*6+H661 -> 24 | K661: 5 | L661: 8 | M661: =K661*6+L661 -> 38 | O661: 7 | P661: 8 | Q661: =O661*6+P661 -> 50 | S661: IRVING
A662: BEST PLAYERS | W662: TEAM | X662: W | Y662: L | Z662: D | AA662: FOR | AB662: AGST | AC662: % | AD662: PTS
A663: WILLIAMSTOWN | C663: WALKER | F663: SIMPSON | I663: LINTON | L663: MUNDAY | N663: DULLARD | Q663: SHEAHAN
A664: OAKLEIGH | C664: TINDAL | F664: SAVORY | I664: WALSH | L664: HOWELL | N664: WATSON | Q664: EDWARDS | W664: PORT MELBOURNE | X664: 11 | Y664: 0 | Z664: 0 | AA664: 1196 | AB664: 502 | AC664: 238.24701195219123 | AD664: 44
A665: GOALKICKERS | W665: WILLIAMSTOWN | X665: 8 | Y665: 2 | Z665: 1 | AA665: 1091 | AB665: 711 | AC665: =(+AA665/AB665)*100 -> 153.44585091420535 | AD665: 34
A666: WILLIAMSTOWN | C666: WALKER 9 | F666: DULLARD 4 | I666: SIMPSON 2 | L666: KENT | N666: SMITH | W666: PRAHRAN | X666: 7 | Y666: 4 | Z666: 0 | AA666: 925 | AB666: 777 | AC666: 119.04761904761905 | AD666: 28
A667: OAKLEIGH | C667: SCULLIN 2 | F667: WATSON | I667: SCOTT | K667: TINDAL | M667: EDWARDS | P667: HILL | W667: YARRAVILLE | X667: 6 | Y667: 3 | Z667: 2 | AA667: 783 | AB667: 758 | AC667: =(+AA667/AB667)*100 -> 103.29815303430078 | AD667: 28
A669: PRAHRAN | C669: 0 | D669: 2 | E669: =C669*6+D669 -> 2 | G669: 5 | H669: 7 | I669: =G669*6+H669 -> 37 | K669: 9 | L669: 8 | M669: =K669*6+L669 -> 62 | O669: 12 | P669: 13 | Q669: =O669*6+P669 -> 85 | S669: TOORAK PARK | W669: COBURG | X669: 6 | Y669: 4 | Z669: 1 | AA669: 958 | AB669: 786 | AC669: =(+AA669/AB669)*100 -> 121.88295165394403 | AD669: 26
A670: COBURG | C670: 3 | D670: 6 | E670: =C670*6+D670 -> 24 | G670: 7 | H670: 7 | I670: =G670*6+H670 -> 49 | K670: 11 | L670: 7 | M670: =K670*6+L670 -> 73 | O670: 12 | P670: 10 | Q670: =O670*6+P670 -> 82 | S670: SMYTH | W670: OAKLEIGH | X670: 6 | Y670: 4 | Z670: 1 | AA670: 903 | AB670: 808 | AC670: =(+AA670/AB670)*100 -> 111.75742574257426 | AD670: 26
A671: BEST PLAYERS | W671: MOORABBIN | X671: 6 | Y671: 4 | Z671: 1 | AA671: 701 | AB671: 708 | AC671: 99.011299435028249 | AD671: 26
A672: PRAHRAN | C672: HARVEY | F672: WALES | I672: ELLIOTT | L672: KINNABURGH | O672: WALSH | Q672: CAMPBELL | W672: BRUNSWICK | X672: 5 | Y672: 6 | Z672: 0 | AA672: 775 | AB672: 755 | AC672: 102.64900662251655 | AD672: 20
A673: COBURG | C673: PHILLIPS | F673: LEVERSHA | I673: ROGAN | L673: EVANS | O673: WALKER | Q673: H WILKINSON | W673: PRESTON | X673: 4 | Y673: 7 | Z673: 0 | AA673: 629 | AB673: 790 | AC673: =(+AA673/AB673)*100 -> 79.620253164556971 | AD673: 16
A674: GOALKICKERS | W674: BOX HILL | X674: 4 | Y674: 7 | Z674: 0 | AA674: 742 | AB674: 933 | AC674: =(+AA674/AB674)*100 -> 79.528403001071808 | AD674: 16
A675: PRAHRAN | C675: HARVEY 4 | F675: KINNABURGH 3 | J675: ELLIOTT 2 | M675: WALSH | O675: CLEAR | Q675: C BOYD | W675: SANDRINGHAM | X675: 4 | Y675: 7 | Z675: 0 | AA675: 671 | AB675: 1124 | AC675: 59.697508896797153 | AD675: 16
A676: COBURG | C676: ROGAN 4 | E676: HEWES 2 | G676: EVANS 2 | I676: McTAGGART | L676: H WILKINSON | O676: AITKEN | Q676: JOHNSON | W676: NORTHCOTE | X676: 3 | Y676: 8 | Z676: 0 | AA676: 732 | AB676: 751 | AC676: 97.470039946737685 | AD676: 12
W677: CAMBERWELL | X677: 3 | Y677: 8 | Z677: 0 | AA677: 721 | AB677: 966 | AC677: 74.637681159420296 | AD677: 12
A678: BRUNSWICK | C678: 6 | D678: 6 | E678: =C678*6+D678 -> 42 | G678: 7 | H678: 8 | I678: =G678*6+H678 -> 50 | K678: 11 | L678: 8 | M678: =K678*6+L678 -> 74 | O678: 12 | P678: 10 | Q678: =O678*6+P678 -> 82 | S678: BRUNSWICK | W678: BRIGHTON | X678: 1 | Y678: 10 | Z678: 0 | AA678: 628 | AB678: 1087 | AC678: 57.773689052437902 | AD678: 4
A679: PRESTON | C679: 1 | D679: 1 | E679: =C679*6+D679 -> 7 | G679: 5 | H679: 3 | I679: =G679*6+H679 -> 33 | K679: 8 | L679: 8 | M679: =K679*6+L679 -> 56 | O679: 9 | P679: 14 | Q679: =O679*6+P679 -> 68 | S679: MALLETT
A680: BEST PLAYERS
A681: BRUNSWICK | C681: MULLENGER | F681: YEA | I681: MUNRO | L681: CLUES | N681: KALAF | Q681: POLLARD
A682: PRESTON | C682: BRADFORD | F682: PRITCHARD | I682: McLACHLAN | L682: CROCKER | N682: HARRISON | Q682: DEACON
A683: GOALKICKERS
A684: BRUNSWICK | C684: CLUES 4 | F684: KALAF 2 | I684: THORNTON 2 | L684: MULLENGER 2 | O684: MUNRO | Q684: PHILLIPS
A685: PRESTON | C685: McLACHLAN 6 | F685: CANN | I685: WALKER | L685: HAYES
A687: YARRAVILLE | C687: 3 | D687: 5 | E687: =C687*6+D687 -> 23 | G687: 11 | H687: 7 | I687: =G687*6+H687 -> 73 | K687: 14 | L687: 8 | M687: =K687*6+L687 -> 92 | O687: 17 | P687: 9 | Q687: =O687*6+P687 -> 111 | S687: BOX HILL
A688: BOX HILL | C688: 4 | D688: 4 | E688: =C688*6+D688 -> 28 | G688: 5 | H688: 4 | I688: =G688*6+H688 -> 34 | K688: 8 | L688: 7 | M688: =K688*6+L688 -> 55 | O688: 10 | P688: 9 | Q688: =O688*6+P688 -> 69 | S688: BARKER
A689: BEST PLAYERS
A690: YARRAVILLE | C690: SEITZ | E690: SALT | H690: WAGHORNE | K690: COOK | M690: BODSWORTH | P690: PEVITT
A691: BOX HILL | C691: WRIGHT | E691: LOVE | H691: TURNER | K691: MORRIS | M691: JEFFERS | P691: ALLEN
A692: GOALKICKERS
A693: YARRAVILLE | C693: SALT 5 | E693: WAGHORNE 3 | H693: BODSWORTH 2 | K693: MARCHESI 2 | N693: J ROHLEDER 2 | Q693: SEITZ | R693: SMALLWOOD | V693: N ROHLEDER
A694: BOX HILL | C694: ABBOTT 2 | F694: LEHMANN 2 | I694: ALLEN | K694: GIBB | M694: JEFFERS | O694: TURNER | Q694: KRONK | S694: EADE
A696: BRIGHTON | C696: 3 | D696: 0 | E696: =C696*6+D696 -> 18 | G696: 4 | H696: 2 | I696: =G696*6+H696 -> 26 | K696: 6 | L696: 8 | M696: =K696*6+L696 -> 44 | O696: 10 | P696: 12 | Q696: =O696*6+P696 -> 72 | S696: CAMBERWELL
A697: CAMBERWELL | C697: 3 | D697: 3 | E697: =C697*6+D697 -> 21 | G697: 5 | H697: 5 | I697: =G697*6+H697 -> 35 | K697: 6 | L697: 10 | M697: =K697*6+L697 -> 46 | O697: 8 | P697: 11 | Q697: =O697*6+P697 -> 59 | S697: RICHARDSON
A698: BEST PLAYERS
A699: BRIGHTON | C699: C CONROY | F699: HOWE | I699: WOODS | L699: CRAIG | N699: O'MEARA | Q699: ALEXANDER
A700: CAMBERWELL | C700: BOHAN | F700: ALLEN | I700: McGUINNESS | L700: DUFF | N700: McCOMBE | Q700: HOLYOAK
A701: GOALKICKERS
A702: BRIGHTON | C702: HOWE 3 | F702: ALEXANDER 2 | I702: G CONROY 2 | L702: CRAIG | N702: POUND | P702: MARINI
A703: CAMBERWELL | C703: YOUNG 2 | F703: DUFF | H703: BENBOW | J703: HEDLEY | L703: McGUINNESS | O703: McFEE | Q703: McCOMBE
A705: NORTHCOTE | C705: 2 | D705: 3 | E705: =C705*6+D705 -> 15 | G705: 4 | H705: 9 | I705: =G705*6+H705 -> 33 | K705: 6 | L705: 11 | M705: =K705*6+L705 -> 47 | O705: 11 | P705: 15 | Q705: =O705*6+P705 -> 81 | S705: NORTHCOTE
A706: MOORABBIN | C706: 1 | D706: 3 | E706: =C706*6+D706 -> 9 | G706: 5 | H706: 4 | I706: =G706*6+H706 -> 34 | K706: 6 | L706: 9 | M706: =K706*6+L706 -> 45 | O706: 7 | P706: 10 | Q706: =O706*6+P706 -> 52 | S706: CARDWELL
A707: BEST PLAYERS
A708: NORTHCOTE | C708: COLLINS | F708: PAYNTER | I708: McLAINE | L708: PAWSEY | N708: GALLAGHER | Q708: AMARANT
A709: MOORABBIN | C709: COAD | F709: BOYD | I709: McKENZIE | L709: PATTISON | N709: BROWN | Q709: WICKS
A710: GOALKICKERS
A711: NORTHCOTE | C711: COLLINS 4 | F711: SEARLE 3 | I711: HOLT 2 | K711: PAWSEY | M711: K WHITECHURCH
A712: MOORABBIN | C712: COAD 2 | F712: J P WALSH | I712: LEHMANN | K712: RICHARDS | N712: CHANDLER | Q712: PATTISON
A714: PORT MELBOURNE | C714: 6 | D714: 12 | E714: =C714*6+D714 -> 48 | G714: 16 | H714: 13 | I714: =G714*6+H714 -> 109 | K714: 23 | L714: 19 | M714: =K714*6+L714 -> 157 | O714: 27 | P714: 26 | Q714: =O714*6+P714 -> 188 | S714: BEACH ROAD
A715: SANDRINGHAM | C715: 1 | D715: 3 | E715: =C715*6+D715 -> 9 | G715: 3 | H715: 7 | I715: =G715*6+H715 -> 25 | K715: 3 | L715: 10 | M715: =K715*6+L715 -> 28 | O715: 5 | P715: 13 | Q715: =O715*6+P715 -> 43 | S715: ROACH
A716: BEST PLAYERS
A717: PORT MELBOURNE | C717: FRASER | F717: MILLER | I717: BONNETT | L717: MURRAY | O717: OWENS | R717: KELSEY
A718: SANDRINGHAM | C718: L WOODS | F718: HISCOCK | I718: GOODES | L718: HARPER | O718: HANKINSON | R718: RAEBURN
A719: GOALKICKERS
A720: PORT MELBOURNE | C720: MILLER 9 | E720: BONNETT 5 | H720: FRASER 5 | J720: HAMMOND 2 | M720: JOHNSON 2 | P720: LAFFEY | R720: S TUCKER | U720: OWENS | W720: MURRAY
A721: SANDRINGHAM | C721: HARPER 4 | F721: HANKINSON
A723: ROUND 12 | E723: 11TH JULY | J723: WEATHER | O723: FINE COLD | S723: PLAYED AT
D724: 1ST QTR | H724: 2ND QTR | L724: 3RD QTR | P724: FINAL | S724: OAKLEIGH
A725: OAKLEIGH | C725: 1 | D725: 4 | E725: =C725*6+D725 -> 10 | G725: 7 | H725: 5 | I725: =G725*6+H725 -> 47 | K725: 10 | L725: 8 | M725: =K725*6+L725 -> 68 | O725: 12 | P725: 11 | Q725: =O725*6+P725 -> 83 | S725: UMPIRE | X725: LADDER | AB725: ROUND | AD725: 12
A726: PRAHRAN | C726: 1 | D726: 3 | E726: =C726*6+D726 -> 9 | G726: 1 | H726: 6 | I726: =G726*6+H726 -> 12 | K726: 6 | L726: 9 | M726: =K726*6+L726 -> 45 | O726: 11 | P726: 12 | Q726: =O726*6+P726 -> 78 | S726: CARDWELL
A727: BEST PLAYERS | W727: TEAM | X727: W | Y727: L | Z727: D | AA727: FOR | AB727: AGST | AC727: % | AD727: PTS
A728: OAKLEIGH | C728: LAMBERT | F728: W WILLIAMS | I728: GUY | L728: VAINS | N728: SCOTT | Q728: WATSON
A729: PRAHRAN | C729: WALES | F729: JONES | I729: SHILLABEER | L729: COLLS | N729: YATES | Q729: PLAIN | W729: PORT MELBOURNE | X729: 12 | Y729: 0 | Z729: 0 | AA729: 1265 | AB729: 532 | AC729: 237.78195488721803 | AD729: 48
A730: GOALKICKERS | W730: WILLIAMSTOWN | X730: 9 | Y730: 2 | Z730: 1 | AA730: 1223 | AB730: 794 | AC730: =(+AA730/AB730)*100 -> 154.03022670025189 | AD730: 38
A731: OAKLEIGH | C731: H WILLIAMS 4 | F731: WATSON 3 | I731: LONIE 2 | K731: SCOTT | M731: LAMBERT | O731: STREETER | W731: YARRAVILLE | X731: 7 | Y731: 3 | Z731: 2 | AA731: 921 | AB731: 808 | AC731: =(+AA731/AB731)*100 -> 113.98514851485149 | AD731: 32
A732: PRAHRAN | C732: KINNABURGH 3 | F732: PLAIN 3 | H732: WALSH 3 | J732: ELLIOTT | L732: CLEAR | W732: COBURG | X732: 7 | Y732: 4 | Z732: 1 | AA732: 1018 | AB732: 825 | AC732: =(+AA732/AB732)*100 -> 123.39393939393939 | AD732: 30
A734: WILLIAMSTOWN | C734: 6 | D734: 4 | E734: =C734*6+D734 -> 40 | G734: 10 | H734: 10 | I734: =G734*6+H734 -> 70 | K734: 13 | L734: 13 | M734: =K734*6+L734 -> 91 | O734: 19 | P734: 18 | Q734: =O734*6+P734 -> 132 | S734: MOORABBIN | W734: OAKLEIGH | X734: 7 | Y734: 4 | Z734: 1 | AA734: 986 | AB734: 886 | AC734: =(+AA734/AB734)*100 -> 111.28668171557563 | AD734: 30
A735: MOORABBIN | C735: 1 | D735: 3 | E735: =C735*6+D735 -> 9 | G735: 5 | H735: 4 | I735: =G735*6+H735 -> 34 | K735: 11 | L735: 8 | M735: =K735*6+L735 -> 74 | O735: 12 | P735: 11 | Q735: =O735*6+P735 -> 83 | S735: MALLETT | W735: PRAHRAN | X735: 7 | Y735: 5 | Z735: 0 | AA735: 1003 | AB735: 860 | AC735: 116.62790697674419 | AD735: 28
A736: BEST PLAYERS | W736: MOORABBIN | X736: 6 | Y736: 5 | Z736: 1 | AA736: 784 | AB736: 840 | AC736: 93.333333333333329 | AD736: 26
A737: WILLIAMSTOWN | C737: W WILLIAMS | F737: DULLARD | I737: MUNDAY | L737: WOOKEY | N737: HENDERSON | Q737: WALKER | W737: BRUNSWICK | X737: 6 | Y737: 6 | Z737: 0 | AA737: 843 | AB737: 817 | AC737: 103.18237454100367 | AD737: 24
A738: MOORABBIN | C738: STANLEY | F738: DALY | I738: McKENZIE | L738: CHANDLER | N738: PATTISON | Q738: BROWN | W738: PRESTON | X738: 5 | Y738: 7 | Z738: 0 | AA738: 768 | AB738: 884 | AC738: =(+AA738/AB738)*100 -> 86.877828054298647 | AD738: 20
A739: GOALKICKERS | W739: BOX HILL | X739: 4 | Y739: 8 | Z739: 0 | AA739: 836 | AB739: 1072 | AC739: =(+AA739/AB739)*100 -> 77.985074626865668 | AD739: 16
A740: WILLIAMSTOWN | C740: W WILLIAMS 8 | F740: WALKER 5 | I740: LINTON 2 | K740: DULLARD 2 | N740: KENT | P740: SMITH | W740: SANDRINGHAM | X740: 4 | Y740: 8 | Z740: 0 | AA740: 722 | AB740: 1262 | AC740: 57.210776545166404 | AD740: 16
A741: MOORABBIN | C741: J P WALSH 3 | F741: RICHARDS 2 | I741: DALY 2 | K741: CHANDLER 2 | N741: BAKER | P741: COAD | R741: JOLLY | W741: NORTHCOTE | X741: 3 | Y741: 9 | Z741: 0 | AA741: 762 | AB741: 820 | AC741: 92.926829268292678 | AD741: 12
W742: CAMBERWELL | X742: 3 | Y742: 9 | Z742: 0 | AA742: 760 | AB742: 1026 | AC742: 74.074074074074076 | AD742: 12
A743: PRESTON | C743: 5 | D743: 1 | E743: =C743*6+D743 -> 31 | G743: 7 | H743: 5 | I743: =G743*6+H743 -> 47 | K743: 15 | L743: 11 | M743: =K743*6+L743 -> 101 | O743: 21 | P743: 13 | Q743: =O743*6+P743 -> 139 | S743: PRESTON | W743: BRIGHTON | X743: 1 | Y743: 11 | Z743: 0 | AA743: 690 | AB743: 1155 | AC743: 59.740259740259738 | AD743: 4
A744: BOX HILL | C744: 5 | D744: 2 | E744: =C744*6+D744 -> 32 | G744: 10 | H744: 2 | I744: =G744*6+H744 -> 62 | K744: 14 | L744: 5 | M744: =K744*6+L744 -> 89 | O744: 14 | P744: 10 | Q744: =O744*6+P744 -> 94 | S744: ROACH
A745: BEST PLAYERS
A746: PRESTON | C746: BRADFORD | F746: ANDERSON | I746: McLACHLAN | L746: K CHARD | O746: SWEET | Q746: FOLEY
A747: BOX HILL | C747: MORRIS | F747: TURNER | I747: ABBOTT | L747: ANDERSON | O747: EADE | Q747: EVANS
A748: GOALKICKERS
A749: PRESTON | C749: BRADFORD 6 | F749: FOLEY 4 | H749: CANN 3 | J749: ANDERSON 3 | M749: JEFFREY 2 | P749: HAYES | R749: HART | T749: McLACHLAN
A750: BOX HILL | C750: TURNER 4 | F750: ANDERSON 2 | I750: ABBOTT 2 | L750: EVANS | N750: EDNIE | P750: COGHLAN | R750: RATTRAY | U750: MORRIS | X750: KRONK
A752: BRUNSWICK | C752: 4 | D752: 1 | E752: =C752*6+D752 -> 25 | G752: 5 | H752: 1 | I752: =G752*6+H752 -> 31 | K752: 7 | L752: 5 | M752: =K752*6+L752 -> 47 | O752: 10 | P752: 8 | Q752: =O752*6+P752 -> 68 | S752: ELSTERNWICK PARK
A753: BRIGHTON | C753: 2 | D753: 3 | E753: =C753*6+D753 -> 15 | G753: 4 | H753: 5 | I753: =G753*6+H753 -> 29 | K753: 5 | L753: 8 | M753: =K753*6+L753 -> 38 | O753: 9 | P753: 8 | Q753: =O753*6+P753 -> 62 | S753: IRVING
A754: BEST PLAYERS
A755: BRUNSWICK | C755: FISHER | F755: HUNTER | I755: SEYMOUR | L755: PHILLIPS | O755: EDWARDS | R755: PLANT
A756: BRIGHTON | C756: RIDDELL | F756: DAVIDSON | I756: TOOHEY | L756: HOWE | O756: COURTNEY | R756: FREEMAN
A757: GOALKICKERS
A758: BRUNSWICK | C758: THORNTON 2 | F758: HUNTER 2 | I758: McFARLANE 2 | L758: MULLENGER | O758: PHILLIPS | Q758: LOVETT | S758: BREW
A759: BRIGHTON | C759: ALEXANDER 2 | F759: WOODS 2 | I759: HOWE 2 | K759: G CONROY | N759: POUND | P759: TOOHEY
A761: YARRAVILLE | C761: 6 | D761: 0 | E761: =C761*6+D761 -> 36 | G761: 12 | H761: 7 | I761: =G761*6+H761 -> 79 | K761: 17 | L761: 14 | M761: =K761*6+L761 -> 116 | O761: 20 | P761: 18 | Q761: =O761*6+P761 -> 138 | S761: YARRAVILLE
A762: SANDRINGHAM | C762: 2 | D762: 3 | E762: =C762*6+D762 -> 15 | G762: 4 | H762: 3 | I762: =G762*6+H762 -> 27 | K762: 4 | L762: 6 | M762: =K762*6+L762 -> 30 | O762: 7 | P762: 9 | Q762: =O762*6+P762 -> 51 | S762: SMYTH
A763: BEST PLAYERS
A764: YARRAVILLE | C764: SEITZ | F764: N ROHLEDER | I764: GWYNNE | L764: COOK | N764: SMALLWOOD | Q764: J ROHLEDER
A765: SANDRINGHAM | C765: L WOODS | F765: POTTER | I765: GOODES | L765: HISCOCK | N765: MADSEN | Q765: BOURKE
A766: GOALKICKERS
A767: YARRAVILLE | C767: MARCHESI 4 | F767: WAGHORNE 3 | I767: N ROHLEDER 3 | L767: R SMITH 2 | N767: BODSWORTH 2 | Q767: GWYNNE | S767: SALT | U767: SEITZ | W767: J ROHLEDER
A768: SANDRINGHAM | C768: HARPER 3 | F768: WARBURTON | I768: MORONEY | K768: CLAYTON | M768: MADSEN
A770: COBURG | C770: 1 | D770: 3 | E770: =C770*6+D770 -> 9 | G770: 5 | H770: 8 | I770: =G770*6+H770 -> 38 | K770: 7 | L770: 9 | M770: =K770*6+L770 -> 51 | O770: 8 | P770: 12 | Q770: =O770*6+P770 -> 60 | S770: COBURG
A771: CAMBERWELL | C771: 1 | D771: 1 | E771: =C771*6+D771 -> 7 | G771: 2 | H771: 2 | I771: =G771*6+H771 -> 14 | K771: 5 | L771: 2 | M771: =K771*6+L771 -> 32 | O771: 6 | P771: 3 | Q771: =O771*6+P771 -> 39 | S771: RICHARDSON
A772: BEST PLAYERS
A773: COBURG | C773: CONDON | F773: LAMBERT | I773: FEWKES | L773: CUFFE | N773: R WILKINSON | Q773: H WILKINSON
A774: CAMBERWELL | C774: HEDLEY | F774: BRADLEY | I774: ALLEN | L774: TILLEY | N774: SCHNEIDER | Q774: BOHAN
A775: GOALKICKERS
A776: COBURG | C776: CONDON 4 | F776: H WILKINSON | I776: McTAGGART | L776: AITKEN | N776: CUFFE
A777: CAMBERWELL | C777: SCHNEIDER 2 | F777: TILLEY 2 | I777: MASON | L777: HEDLEY
A779: PORT MELBOURNE | C779: 1 | D779: 6 | E779: =C779*6+D779 -> 12 | G779: 2 | H779: 10 | I779: =G779*6+H779 -> 22 | K779: 5 | L779: 13 | M779: =K779*6+L779 -> 43 | O779: 9 | P779: 15 | Q779: =O779*6+P779 -> 69 | S779: PORT MELBOURNE
A780: NORTHCOTE | C780: 0 | D780: 5 | E780: =C780*6+D780 -> 5 | G780: 0 | H780: 5 | I780: =G780*6+H780 -> 5 | K780: 1 | L780: 8 | M780: =K780*6+L780 -> 14 | O780: 3 | P780: 12 | Q780: =O780*6+P780 -> 30 | S780: MERRINGTON
A781: BEST PLAYERS
A782: PORT MELBOURNE | C782: STOREY | F782: OWENS | I782: S TUCKER | L782: KELSEY | O782: ATKINSON | S782: WILSON
A783: NORTHCOTE | C783: ALDRIDGE | F783: POWELL | I783: WOOLNOUGH | L783: ALLEN | O783: K WHITECHURCH | S783: SEARLE
A784: GOALKICKERS
A785: PORT MELBOURNE | C785: BONNETT 2 | F785: H TUCKER 2 | I785: TOWNSING 2 | L785: OWENS | N785: HAMMOND | Q785: FOGARTY
A786: NORTHCOTE | C786: COLLINS 2 | F786: COOPER
A788: ROUND 13 | E788: 18TH JULY | J788: WEATHER | O788: FINE & SUNNY | S788: PLAYED AT
D789: 1ST QTR | H789: 2ND QTR | L789: 3RD QTR | P789: FINAL | S789: WILLIAMSTOWN
A790: WILLIAMSTOWN | C790: 4 | D790: 3 | E790: =C790*6+D790 -> 27 | G790: 6 | H790: 5 | I790: =G790*6+H790 -> 41 | K790: 11 | L790: 6 | M790: =K790*6+L790 -> 72 | O790: 16 | P790: 11 | Q790: =O790*6+P790 -> 107 | S790: UMPIRE | X790: LADDER | AB790: ROUND | AD790: 13
A791: PORT MELBOURNE | C791: 3 | D791: 1 | E791: =C791*6+D791 -> 19 | G791: 7 | H791: 5 | I791: =G791*6+H791 -> 47 | K791: 10 | L791: 7 | M791: =K791*6+L791 -> 67 | O791: 12 | P791: 12 | Q791: =O791*6+P791 -> 84 | S791: SMYTH
A792: BEST PLAYERS | W792: TEAM | X792: W | Y792: L | Z792: D | AA792: FOR | AB792: AGST | AC792: % | AD792: PTS
A793: WILLIAMSTOWN | C793: LINTON | E793: SMITH | H793: HARLEY | K793: DULLARD | N793: WOOKEY | Q793: ROGERS
A794: PORT MELBOURNE | C794: STOREY | E794: WOODBRIDGE | H794: CROFT | K794: ATKINSON | N794: WILSON | Q794: LEEHANE | W794: PORT MELBOURNE | X794: 12 | Y794: 1 | Z794: 0 | AA794: 1349 | AB794: 639 | AC794: 211.11111111111111 | AD794: 48
A795: GOALKICKERS | W795: WILLIAMSTOWN | X795: 10 | Y795: 2 | Z795: 1 | AA795: 1330 | AB795: 878 | AC795: =(+AA795/AB795)*100 -> 151.48063781321184 | AD795: 42
A796: WILLIAMSTOWN | C796: LINTON 5 | F796: WALKER 4 | I796: SMITH 3 | K796: DULLARD 2 | N796: EVANS | P796: W WILLIAMS | W796: YARRAVILLE | X796: 8 | Y796: 3 | Z796: 2 | AA796: 1036 | AB796: 874 | AC796: =(+AA796/AB796)*100 -> 118.53546910755148 | AD796: 36
A797: PORT MELBOURNE | C797: BONNETT 4 | F797: ATKINSON 3 | I797: WHARTON 2 | L797: FOGARTY | N797: CROFT | P797: WALSH | W797: OAKLEIGH | X797: 8 | Y797: 4 | Z797: 1 | AA797: 1086 | AB797: 964 | AC797: =(+AA797/AB797)*100 -> 112.65560165975104 | AD797: 34
A799: OAKLEIGH | C799: 1 | D799: 3 | E799: =C799*6+D799 -> 9 | G799: 4 | H799: 7 | I799: =G799*6+H799 -> 31 | K799: 9 | L799: 10 | M799: =K799*6+L799 -> 64 | O799: 15 | P799: 10 | Q799: =O799*6+P799 -> 100 | S799: OAKLEIGH | W799: PRAHRAN | X799: 8 | Y799: 5 | Z799: 0 | AA799: 1073 | AB799: 923 | AC799: 116.2513542795233 | AD799: 32
A800: COBURG | C800: 4 | D800: 2 | E800: =C800*6+D800 -> 26 | G800: 8 | H800: 3 | I800: =G800*6+H800 -> 51 | K800: 9 | L800: 9 | M800: =K800*6+L800 -> 63 | O800: 11 | P800: 12 | Q800: =O800*6+P800 -> 78 | S800: ROACH | W800: COBURG | X800: 7 | Y800: 5 | Z800: 1 | AA800: 1096 | AB800: 925 | AC800: =(+AA800/AB800)*100 -> 118.4864864864865 | AD800: 30
A801: BEST PLAYERS | W801: BRUNSWICK | X801: 7 | Y801: 6 | Z801: 0 | AA801: 923 | AB801: 891 | AC801: 103.59147025813692 | AD801: 28
A802: OAKLEIGH | C802: SCOTT | F802: WATSON | I802: STREETER | L802: WALSH | N802: GUY | Q802: W WILLIAMS | W802: MOORABBIN | X802: 6 | Y802: 6 | Z802: 1 | AA802: 847 | AB802: 910 | AC802: 93.07692307692308 | AD802: 26
A803: COBURG | C803: R WILKINSON | F803: MAHONEY | I803: H WILKINSON | L803: EVANS | N803: BULMAN | Q803: PHILLIPS | W803: PRESTON | X803: 6 | Y803: 7 | Z803: 0 | AA803: 904 | AB803: 945 | AC803: =(+AA803/AB803)*100 -> 95.661375661375658 | AD803: 24
A804: GOALKICKERS | P804: WALSH | R804: SCULLIN | W804: BOX HILL | X804: 5 | Y804: 8 | Z804: 0 | AA804: 901 | AB804: 1121 | AC804: =(+AA804/AB804)*100 -> 80.374665477252449 | AD804: 20
A805: OAKLEIGH | C805: LONIE 3 | E805: W WILLIAMS 2 | H805: EDWARDS 2 | K805: NEWTON 2 | M805: SCOTT | O805: WATSON | Q805: BOURKE | S805: STREETER | W805: SANDRINGHAM | X805: 4 | Y805: 9 | Z805: 0 | AA805: 783 | AB805: 1398 | AC805: 56.008583690987123 | AD805: 16
A806: COBURG | C806: EVANS 3 | F806: BULMAN 2 | I806: CONDON 2 | L806: H WILKINSON 2 | P806: MAHONEY | R806: LEVERSHA | W806: NORTHCOTE | X806: 3 | Y806: 10 | Z806: 0 | AA806: 828 | AB806: 935 | AC806: 88.556149732620327 | AD806: 12
W807: CAMBERWELL | X807: 3 | Y807: 10 | Z807: 0 | AA807: 834 | AB807: 1106 | AC807: 75.406871609403254 | AD807: 12
A808: PRAHRAN | C808: 4 | D808: 4 | E808: =C808*6+D808 -> 28 | G808: 6 | H808: 6 | I808: =G808*6+H808 -> 42 | K808: 6 | L808: 7 | M808: =K808*6+L808 -> 43 | O808: 10 | P808: 10 | Q808: =O808*6+P808 -> 70 | S808: TOORAK PARK | W808: BRIGHTON | X808: 1 | Y808: 12 | Z808: 0 | AA808: 739 | AB808: 1220 | AC808: 60.57377049180328 | AD808: 4
A809: MOORABBIN | C809: 3 | D809: 1 | E809: =C809*6+D809 -> 19 | G809: 5 | H809: 3 | I809: =G809*6+H809 -> 33 | K809: 8 | L809: 7 | M809: =K809*6+L809 -> 55 | O809: 9 | P809: 9 | Q809: =O809*6+P809 -> 63 | S809: MERRINGTON
A810: BEST PLAYERS
A811: PRAHRAN | C811: KINNABURGH | F811: O'BRYAN | I811: SHILLABEER | L811: CAMPBELL | O811: HARVEY | R811: WALSH
A812: MOORABBIN | C812: McKENZIE | F812: McGOWAN | I812: D'OLIVER | L812: B BAKER | O812: WHITFIELD | R812: WALSH
A813: GOALKICKERS
A814: PRAHRAN | C814: ELLIOTT 2 | F814: LOUREY 2 | I814: KINNABURGH 2 | L814: WALSH | N814: SHILLABEER | Q814: CLEAR | S814: O'BRYAN
A815: MOORABBIN | C815: N BAKER 3 | F815: LEHMANN 2 | I815: McKENZIE | L815: WHITFIELD | N815: WALSH | P815: G BAKER
A817: BRUNSWICK | C817: 2 | D817: 4 | E817: =C817*6+D817 -> 16 | G817: 3 | H817: 10 | I817: =G817*6+H817 -> 28 | K817: 9 | L817: 12 | M817: =K817*6+L817 -> 66 | O817: 11 | P817: 14 | Q817: =O817*6+P817 -> 80 | S817: BRUNSWICK
A818: CAMBERWELL | C818: 2 | D818: 0 | E818: =C818*6+D818 -> 12 | G818: 3 | H818: 4 | I818: =G818*6+H818 -> 22 | K818: 6 | L818: 5 | M818: =K818*6+L818 -> 41 | O818: 11 | P818: 8 | Q818: =O818*6+P818 -> 74 | S818: CARDWELL
A819: BEST PLAYERS
A820: BRUNSWICK | C820: McFARLANE | F820: WALSH | I820: YEA | L820: DUNSTAN | O820: SEYMOUR | R820: KALAF
A821: CAMBERWELL | C821: THYNNE | F821: HAYES | I821: HOLYOAK | L821: BRADLEY | O821: HEDLEY | R821: McCOMB
A822: GOALKICKERS
A823: BRUNSWICK | C823: McFARLANE 5 | F823: KALAF | H823: PHILLIPS | J823: DUNSTAN | M823: HUNTER | O823: SEYMOUR | Q823: WALSH
A824: CAMBERWELL | C824: BOHAN 3 | F824: HEDLEY 2 | I824: TILLEY 2 | K824: THYNNE | M824: SCHNEIDER | P824: McCOMB | R824: HOLYOAK
A826: PRESTON | C826: 6 | D826: 4 | E826: =C826*6+D826 -> 40 | G826: 9 | H826: 8 | I826: =G826*6+H826 -> 62 | K826: 14 | L826: 13 | M826: =K826*6+L826 -> 97 | O826: 20 | P826: 16 | Q826: =O826*6+P826 -> 136 | S826: BEACH ROAD
A827: SANDRINGHAM | C827: 1 | D827: 4 | E827: =C827*6+D827 -> 10 | G827: 3 | H827: 10 | I827: =G827*6+H827 -> 28 | K827: 4 | L827: 11 | M827: =K827*6+L827 -> 35 | O827: 8 | P827: 13 | Q827: =O827*6+P827 -> 61 | S827: IRVING
A828: BEST PLAYERS
A829: PRESTON | C829: BRADFORD | F829: FOLEY | I829: WALKER | L829: JEFFREY | O829: McLACHLAN | R829: CANN
A830: SANDRINGHAM | C830: RUSSO | F830: J WOODS | I830: RUSSELL | L830: BOURKE | O830: HARPER | R830: WILSON
A831: GOALKICKERS
A832: PRESTON | C832: FOLEY 7 | F832: CANN 4 | H832: BRADFORD 3 | K832: JEFFREY 2 | M832: McLACHLAN 2 | P832: WEARNE | R832: HAYES
A833: SANDRINGHAM | C833: HARPER 6 | F833: WARBURTON | I833: POTTER
A835: BOX HILL | C835: 4 | D835: 2 | E835: =C835*6+D835 -> 26 | G835: 5 | H835: 2 | I835: =G835*6+H835 -> 32 | K835: 8 | L835: 6 | M835: =K835*6+L835 -> 54 | O835: 9 | P835: 11 | Q835: =O835*6+P835 -> 65 | S835: B.H
A836: BRIGHTON | C836: 3 | D836: 3 | E836: =C836*6+D836 -> 21 | G836: 4 | H836: 9 | I836: =G836*6+H836 -> 33 | K836: 5 | L836: 9 | M836: =K836*6+L836 -> 39 | O836: 6 | P836: 13 | Q836: =O836*6+P836 -> 49 | S836: MALLETT
A837: BEST PLAYERS
A838: BOX HILL | C838: MORRIS | F838: KRONK | I838: GIBB | L838: TURNER | O838: ALLLEN | Q838: ANDERSON
A839: BRIGHTON | C839: ALEXANDER | F839: POUND | I839: C CONROY | L839: BLACKMORE | O839: O'MEARA | Q839: FREEMAN
A840: GOALKICKERS
A841: BOX HILL | C841: ANDERSON 2 | F841: ABBOTT 2 | I841: EDNIE | K841: LEHMANN | M841: LOVE | N841: COGHLAN | P841: MORRIS
A842: BRIGHTON | C842: POUND 3 | F842: ALEXANDER | I842: COURTNEY | L842: G CONROY
A844: YARRAVILLE | C844: 5 | D844: 3 | E844: =C844*6+D844 -> 33 | G844: 8 | H844: 5 | I844: =G844*6+H844 -> 53 | K844: 13 | L844: 10 | M844: =K844*6+L844 -> 88 | O844: 17 | P844: 13 | Q844: =O844*6+P844 -> 115 | S844: NORTHCOTE
A845: NORTHCOTE | C845: 4 | D845: 2 | E845: =C845*6+D845 -> 26 | G845: 8 | H845: 4 | I845: =G845*6+H845 -> 52 | K845: 9 | L845: 6 | M845: =K845*6+L845 -> 60 | O845: 10 | P845: 6 | Q845: =O845*6+P845 -> 66 | S845: RICHARDSON
A846: BEST PLAYERS
A847: YARRAVILLE | C847: SEITZ | F847: BODSWORTH | I847: GWYNNE | L847: N ROHLEDER | O847: COOK | Q847: SMITH
A848: NORTHCOTE | C848: PAYNTER | F848: WALKER | I848: McLAINE | L848: PAWSEY | O848: COLLINS | Q848: ALLLEN
A849: GOALKICKERS
A850: YARRAVILLE | C850: BODSWORTH 5 | F850: J ROHLEDER 4 | I850: MARCHESI 3 | L850: ABBEY 2 | N850: N ROHLEDER | Q850: SMALLWOOD | U850: SEITZ
A851: NORTHCOTE | C851: K WHITECHURCH 3 | G851: PAWSEY 2 | J851: COLLINS 2 | M851: GALLAGHER | P851: J VAINS | R851: SEARLE
A853: ROUND 14 | E853: 25TH JULY | J853: WEATHER | M853: FINE BUT DULL NO WIND | S853: PLAYED AT
D854: 1ST QTR | H854: 2ND QTR | L854: 3RD QTR | P854: FINAL | S854: PORT MELBOURNE
A855: PORT MELBOURNE | C855: 1 | D855: 3 | E855: =C855*6+D855 -> 9 | G855: 2 | H855: 7 | I855: =G855*6+H855 -> 19 | K855: 4 | L855: 12 | M855: =K855*6+L855 -> 36 | O855: 5 | P855: 17 | Q855: =O855*6+P855 -> 47 | S855: UMPIRE | X855: LADDER | AB855: ROUND | AD855: 14
A856: OAKLEIGH | C856: 1 | D856: 3 | E856: =C856*6+D856 -> 9 | G856: 2 | H856: 6 | I856: =G856*6+H856 -> 18 | K856: 3 | L856: 10 | M856: =K856*6+L856 -> 28 | O856: 5 | P856: 13 | Q856: =O856*6+P856 -> 43 | S856: MERRINGTON
A857: BEST PLAYERS | W857: TEAM | X857: W | Y857: L | Z857: D | AA857: FOR | AB857: AGST | AC857: % | AD857: PTS
A858: PORT MELBOURNE | C858: KELSEY | F858: JOHNSON | I858: LEEHANE | L858: CROFT | O858: MILLER | Q858: WOODBRIDGE
A859: OAKLEIGH | C859: HOWELL | F859: TEMME | I859: SCOTT | L859: BAPTIST | O859: HILL | Q859: EDWARDS | W859: PORT MELBOURNE | X859: 13 | Y859: 1 | Z859: 0 | AA859: 1396 | AB859: 682 | AC859: 204.69208211143695 | AD859: 52
A860: GOALKICKERS | W860: WILLIAMSTOWN | X860: 11 | Y860: 2 | Z860: 1 | AA860: 1414 | AB860: 951 | AC860: =(+AA860/AB860)*100 -> 148.68559411146163 | AD860: 46
A861: PORT MELBOURNE | C861: BONNETT 3 | F861: MILLER | I861: MURRAY | W861: YARRAVILLE | X861: 9 | Y861: 3 | Z861: 2 | AA861: 1115 | AB861: 945 | AC861: =(+AA861/AB861)*100 -> 117.989417989418 | AD861: 40
A862: OAKLEIGH | C862: SCOTT 2 | F862: NEWTON 2 | I862: LONIE | W862: COBURG | X862: 8 | Y862: 5 | Z862: 1 | AA862: 1217 | AB862: 1024 | AC862: =(+AA862/AB862)*100 -> 118.84765625 | AD862: 34
A864: YARRAVILLE | C864: 1 | D864: 3 | E864: =C864*6+D864 -> 9 | G864: 7 | H864: 6 | I864: =G864*6+H864 -> 48 | K864: 10 | L864: 8 | M864: =K864*6+L864 -> 68 | O864: 11 | P864: 13 | Q864: =O864*6+P864 -> 79 | S864: Y'VILLR | W864: OAKLEIGH | X864: 8 | Y864: 5 | Z864: 1 | AA864: 1129 | AB864: 1011 | AC864: =(+AA864/AB864)*100 -> 111.67161226508409 | AD864: 34
A865: PRAHRAN | C865: 3 | D865: 3 | E865: =C865*6+D865 -> 21 | G865: 4 | H865: 6 | I865: =G865*6+H865 -> 30 | K865: 9 | L865: 9 | M865: =K865*6+L865 -> 63 | O865: 10 | P865: 11 | Q865: =O865*6+P865 -> 71 | S865: IRVING | W865: PRAHRAN | X865: 8 | Y865: 6 | Z865: 0 | AA865: 1144 | AB865: 1002 | AC865: 114.17165668662675 | AD865: 32
A866: BEST PLAYERS | W866: BRUNSWICK | X866: 8 | Y866: 6 | Z866: 0 | AA866: 1015 | AB866: 963 | AC866: 105.39979231568016 | AD866: 32
A867: YARRAVILLE | C867: SMALLWOOD | F867: SALT | I867: MARCHESI | L867: J ROHLEDER | O867: GWYNNE | R867: R J SMITH | W867: MOORABBIN | X867: 6 | Y867: 7 | Z867: 1 | AA867: 946 | AB867: 1031 | AC867: 91.755577109602328 | AD867: 26
A868: PRAHRAN | C868: LOUREY | F868: HARVEY | I868: KRUSE | L868: MORONE | O868: KINNABURGH | R868: YATES | W868: PRESTON | X868: 6 | Y868: 8 | Z868: 0 | AA868: 977 | AB868: 1029 | AC868: =(+AA868/AB868)*100 -> 94.946550048590865 | AD868: 24
A869: GOALKICKERS | W869: BOX HILL | X869: 5 | Y869: 9 | Z869: 0 | AA869: 973 | AB869: 1213 | AC869: =(+AA869/AB869)*100 -> 80.214344600164878 | AD869: 20
A870: YARRAVILLE | C870: MARCHESI 4 | F870: WAGHORNE 3 | I870: N ROHLEDER 2 | L870: R J SMITH | O870: SMALLWOOD | W870: CAMBERWELL | X870: 4 | Y870: 10 | Z870: 0 | AA870: 951 | AB870: 1180 | AC870: 80.593220338983045 | AD870: 16
A871: PRAHRAN | C871: KINNABURGH 3 | F871: WALSH 2 | I871: LOUREY | K871: ELLIOTT | M871: KRUSE | O871: HARVEY | Q871: PLAIN | W871: SANDRINGHAM | X871: 4 | Y871: 10 | Z871: 0 | AA871: 857 | AB871: 1515 | AC871: 56.567656765676567 | AD871: 16
W872: NORTHCOTE | X872: 3 | Y872: 11 | Z872: 0 | AA872: 901 | AB872: 1024 | AC872: 87.98828125 | AD872: 12
A873: COBURG | C873: 5 | D873: 0 | E873: =C873*6+D873 -> 30 | G873: 11 | H873: 2 | I873: =G873*6+H873 -> 68 | K873: 13 | L873: 4 | M873: =K873*6+L873 -> 82 | O873: 19 | P873: 7 | Q873: =O873*6+P873 -> 121 | S873: M'BINN | W873: BRIGHTON | X873: 2 | Y873: 12 | Z873: 0 | AA873: 828 | AB873: 1293 | AC873: 64.037122969837583 | AD873: 8
A874: MOORABBIN | C874: 6 | D874: 3 | E874: =C874*6+D874 -> 39 | G874: 8 | H874: 5 | I874: =G874*6+H874 -> 53 | K874: 12 | L874: 8 | M874: =K874*6+L874 -> 80 | O874: 15 | P874: 9 | Q874: =O874*6+P874 -> 99 | S874: HARWOOD
A875: BEST PLAYERS
A876: COBURG | C876: H WILKINSON | F876: MAHONEY | I876: McDONALD | L876: PHILLIPS | O876: SPARKS | R876: ROGAN
A877: MOORABBIN | C877: BOYD | F877: McKENZIE | I877: N BAKER | L877: G BAKER | O877: LEHMANN | R877: RICHARDS
A878: GOALKICKERS
A879: COBURG | C879: H WILKINSON 6 | F879: McCOLL 3 | I879: ROGAN 2 | K879: HEWES 2 | M879: AITKEN 2 | O879: EVANS 2 | Q879: R WILKINSON | T879: MAHONEY
A880: MOORABBIN | C880: RICHARDS 3 | F880: N BAKER 3 | I880: DALY 2 | K880: COAD 2 | M880: CHANDLER 2 | P880: LEHMANN | R880: G BAKER | U880: WHITFIELD
A882: BRUNSWICK | C882: 4 | D882: 2 | E882: =C882*6+D882 -> 26 | G882: 5 | H882: 3 | I882: =G882*6+H882 -> 33 | K882: 7 | L882: 13 | M882: =K882*6+L882 -> 55 | O882: 12 | P882: 20 | Q882: =O882*6+P882 -> 92 | S882: BRUNSWICK
A883: BOX HILL | C883: 4 | D883: 0 | E883: =C883*6+D883 -> 24 | G883: 6 | H883: 4 | I883: =G883*6+H883 -> 40 | K883: 8 | L883: 5 | M883: =K883*6+L883 -> 53 | O883: 11 | P883: 6 | Q883: =O883*6+P883 -> 72 | S883: ROACH
A884: BEST PLAYERS
A885: BRUNSWICK | C885: YEA | E885: KALAF | H885: WEIR | K885: POLLARD | N885: CLUES | Q885: SEYMOUR
A886: BOX HILL | C886: MORRIS | E886: LOVE | H886: COGHLAN | K886: GIBB | N886: ALLEN | Q886: IRVINE
A887: GOALKICKERS
A888: BRUNSWICK | C888: WEIR 4 | F888: CLUES 3 | I888: KALAF 3 | L888: MULLENGER | O888: STANLEY
A889: BOX HILL | C889: COGHLAN 3 | F889: RATTRAY 2 | I889: ANDERSON 2 | L889: TURNER | N889: MORRIS | P889: ABBOTT | R889: ALLLEN
A891: BRIGHTON | C891: 3 | D891: 1 | E891: =C891*6+D891 -> 19 | G891: 5 | H891: 7 | I891: =G891*6+H891 -> 37 | K891: 7 | L891: 8 | M891: =K891*6+L891 -> 50 | O891: 13 | P891: 11 | Q891: =O891*6+P891 -> 89 | S891: ELSTERNWICK PARK
A892: NORTHCOTE | C892: 4 | D892: 7 | E892: =C892*6+D892 -> 31 | G892: 5 | H892: 7 | I892: =G892*6+H892 -> 37 | K892: 7 | L892: 10 | M892: =K892*6+L892 -> 52 | O892: 10 | P892: 13 | Q892: =O892*6+P892 -> 73 | S892: SMYTH
A893: BEST PLAYERS
A894: BRIGHTON | C894: MARINI | F894: ALEXANDER | I894: BURRELL | L894: O'MEARA | O894: POUND | Q894: C CONROY
A895: NORTHCOTE | C895: ALLEN | F895: J VAINS | I895: COLLINS | L895: WOOLNOUGH | O895: STABB | Q895: PAWSEY
A896: GOALKICKERS
A897: BRIGHTON | C897: POUND 3 | F897: ALEXANDER 2 | I897: COURTNEY 2 | L897: MARINI 2 | O897: HOWE | Q897: TOOHEY | S897: C CONROY | V897: CRAIG
A898: NORTHCOTE | C898: PAWSEY 2 | F898: COLLINS 2 | I898: SEARLE 2 | L898: JOHNSON 2 | O898: FRANCIS | Q898: GIBB
A900: WILLIAMSTOWN | C900: 2 | D900: 6 | E900: =C900*6+D900 -> 18 | G900: 7 | H900: 8 | I900: =G900*6+H900 -> 50 | K900: 10 | L900: 10 | M900: =K900*6+L900 -> 70 | O900: 12 | P900: 12 | Q900: =O900*6+P900 -> 84 | S900: PRESTON
A901: PRESTON | C901: 4 | D901: 4 | E901: =C901*6+D901 -> 28 | G901: 5 | H901: 5 | I901: =G901*6+H901 -> 35 | K901: 10 | L901: 10 | M901: =K901*6+L901 -> 70 | O901: 10 | P901: 13 | Q901: =O901*6+P901 -> 73 | S901: CARDWELL
A902: BEST PLAYERS
A903: WILLIAMSTOWN | C903: LINTON | F903: SIMPSON | I903: DULLARD | L903: WOOKEY | N903: W WILLIAMS | Q903: CALLAHAN
A904: PRESTON | C904: WALKER | F904: JEFFREY | I904: BRADFORD | L904: FOLEY | N904: HENRYS | Q904: DEACON
A905: GOALKICKERS
A906: WILLIAMSTOWN | C906: G WILLIAMS 3 | F906: WALKER 3 | I906: LINTON 3 | K906: DULLARD 2 | N906: SMITH
A907: PRESTON | C907: G WALKER 3 | F907: BRADFORD 2 | I907: HAYES 2 | K907: JEFFREY | M907: CANN | O907: FOLEY
A909: CAMBERWELL | C909: 1 | D909: 3 | E909: =C909*6+D909 -> 9 | G909: 4 | H909: 7 | I909: =G909*6+H909 -> 31 | K909: 11 | L909: 10 | M909: =K909*6+L909 -> 76 | O909: 17 | P909: 15 | Q909: =O909*6+P909 -> 117 | S909: CAMBERWELL
A910: SANDRINGHAM | C910: 2 | D910: 3 | E910: =C910*6+D910 -> 15 | G910: 6 | H910: 4 | I910: =G910*6+H910 -> 40 | K910: 10 | L910: 4 | M910: =K910*6+L910 -> 64 | O910: 11 | P910: 8 | Q910: =O910*6+P910 -> 74 | S910: MALLETT
A911: BEST PLAYERS
A912: CAMBERWELL | C912: BOHAN | F912: ALSOPP | I912: HOLYOAK | L912: HEDLEY | N912: BENBOW | Q912: HAYES
A913: SANDRINGHAM | C913: J WOODS | F913: SHEARS | I913: MADSON | L913: HARPER | N913: BOURKE | Q913: RUSSO
A914: GOALKICKERS
A915: CAMBERWELL | C915: BOHAN 7 | F915: McFEE 4 | I915: HEDLEY 2 | K915: DUFF 2 | M915: HAYES | O915: McGUINNESS
A916: SANDRINGHAM | C916: HARPER 5 | F916: CLAYTON 3 | I916: HISCOCK 2 | L916: PHILLIPS
A918: ROUND 15 | E918: 1ST AUGUST | J918: WEATHER | O918: WEST WIND FINE | S918: PLAYED AT
D919: 1ST QTR | H919: 2ND QTR | L919: 3RD QTR | P919: FINAL | S919: OAKLEIGH
A920: OAKLEIGH | C920: 2 | D920: 2 | E920: =C920*6+D920 -> 14 | G920: 7 | H920: 12 | I920: =G920*6+H920 -> 54 | K920: 10 | L920: 15 | M920: =K920*6+L920 -> 75 | O920: 12 | P920: 23 | Q920: =O920*6+P920 -> 95 | S920: UMPIRE | X920: LADDER | AB920: ROUND | AD920: 15
A921: YARRAVILLE | C921: 3 | D921: 3 | E921: =C921*6+D921 -> 21 | G921: 5 | H921: 4 | I921: =G921*6+H921 -> 34 | K921: 8 | L921: 8 | M921: =K921*6+L921 -> 56 | O921: 9 | P921: 10 | Q921: =O921*6+P921 -> 64 | S921: MERRINGTON
A922: BEST PLAYERS | W922: TEAM | X922: W | Y922: L | Z922: D | AA922: FOR | AB922: AGST | AC922: % | AD922: PTS
A923: OAKLEIGH | C923: TEMME | F923: HOWELL | H923: LONIE | J923: EDWARDS | M923: W WILLIAMS | Q923: H WILLIAMS
A924: YARRAVILLE | C924: N ROHLEDER | F924: SALT | H924: K SMITH | J924: GWYNNE | M924: SMALLWOOD | Q924: WAGHORNE | W924: PORT MELBOURNE | X924: 14 | Y924: 1 | Z924: 0 | AA924: 1473 | AB924: 749 | AC924: 196.66221628838451 | AD924: 56
A925: GOALKICKERS | W925: WILLIAMSTOWN | X925: 12 | Y925: 2 | Z925: 1 | AA925: 1532 | AB925: 1004 | AC925: =(+AA925/AB925)*100 -> 152.58964143426294 | AD925: 50
A926: OAKLEIGH | C926: LONIE 3 | E926: EDWARDS 3 | H926: DELO 2 | J926: H WILLIAMS | M926: STREETER | O926: WALSH | Q926: BOURKE | W926: YARRAVILLE | X926: 9 | Y926: 4 | Z926: 2 | AA926: 1179 | AB926: 1040 | AC926: =(+AA926/AB926)*100 -> 113.36538461538461 | AD926: 40
A927: YARRAVILLE | C927: SMALLWOOD 2 | F927: MARCHESI 2 | I927: WAGHORNE | L927: SALT | M927: N ROHLEDER | P927: BODSWORTH | S927: J ROHLEDER | W927: COBURG | X927: 9 | Y927: 5 | Z927: 1 | AA927: 1309 | AB927: 1088 | AC927: =(+AA927/AB927)*100 -> 120.3125 | AD927: 38
A929: PRAHRAN | C929: 1 | D929: 6 | E929: =C929*6+D929 -> 12 | G929: 7 | H929: 9 | I929: =G929*6+H929 -> 51 | K929: 10 | L929: 10 | M929: =K929*6+L929 -> 70 | O929: 14 | P929: 12 | Q929: =O929*6+P929 -> 96 | S929: TOORAK PARK | W929: OAKLEIGH | X929: 9 | Y929: 5 | Z929: 1 | AA929: 1224 | AB929: 1075 | AC929: =(+AA929/AB929)*100 -> 113.86046511627907 | AD929: 38
A930: PRESTON | C930: 4 | D930: 2 | E930: =C930*6+D930 -> 26 | G930: 4 | H930: 4 | I930: =G930*6+H930 -> 28 | K930: 12 | L930: 9 | M930: =K930*6+L930 -> 81 | O930: 13 | P930: 10 | Q930: =O930*6+P930 -> 88 | S930: SMYTH | W930: PRAHRAN | X930: 9 | Y930: 6 | Z930: 0 | AA930: 1240 | AB930: 1090 | AC930: 113.76146788990826 | AD930: 36
A931: BEST PLAYERS | W931: BRUNSWICK | X931: 9 | Y931: 6 | Z931: 0 | AA931: 1106 | AB931: 1035 | AC931: 106.85990338164251 | AD931: 36
A932: PRAHRAN | C932: COLLS | F932: WALES | I932: KINNABURGH | L932: LOUREY | N932: YATES | Q932: HARVEY | W932: MOORABBIN | X932: 6 | Y932: 8 | Z932: 1 | AA932: 1013 | AB932: 1108 | AC932: 91.4259927797834 | AD932: 26
A933: PRESTON | C933: COOPER | F933: JEFFREY | I933: DEACON | L933: FOLEY | N933: WALKER | Q933: BRADFORD | W933: PRESTON | X933: 6 | Y933: 9 | Z933: 0 | AA933: 1065 | AB933: 1125 | AC933: =(+AA933/AB933)*100 -> 94.666666666666671 | AD933: 24
A934: GOALKICKERS | W934: CAMBERWELL | X934: 5 | Y934: 10 | Z934: 0 | AA934: 1062 | AB934: 1264 | AC934: 84.018987341772146 | AD934: 20
A935: PRAHRAN | C935: KINNABURGH 4 | F935: LOUREY 3 | I935: O'BRYAN 2 | L935: ELLIOTT 2 | N935: KRUSE | P935: C BOYD | R935: CLEAR | W935: BOX HILL | X935: 5 | Y935: 10 | Z935: 0 | AA935: 1037 | AB935: 1305 | AC935: =(+AA935/AB935)*100 -> 79.463601532567054 | AD935: 20
A936: PRESTON | C936: JEFFREY 4 | F936: FOLEY 3 | I936: CANN 2 | K936: BRADFORD 2 | N936: McLACHLAN 2 | W936: SANDRINGHAM | X936: 4 | Y936: 11 | Z936: 0 | AA936: 929 | AB936: 1606 | AC936: 57.845579078455792 | AD936: 16
W937: NORTHCOTE | X937: 3 | Y937: 12 | Z937: 0 | AA937: 985 | AB937: 1135 | AC937: 86.784140969162991 | AD937: 12
A938: PORT MELBOURNE | C938: 2 | D938: 5 | E938: =C938*6+D938 -> 17 | G938: 6 | H938: 7 | I938: =G938*6+H938 -> 43 | K938: 8 | L938: 10 | M938: =K938*6+L938 -> 58 | O938: 10 | P938: 17 | Q938: =O938*6+P938 -> 77 | S938: M'BINN | W938: BRIGHTON | X938: 2 | Y938: 13 | Z938: 0 | AA938: 881 | AB938: 1411 | AC938: 62.437987243090006 | AD938: 8
A939: MOORABBIN | C939: 3 | D939: 1 | E939: =C939*6+D939 -> 19 | G939: 6 | H939: 5 | I939: =G939*6+H939 -> 41 | K939: 8 | L939: 10 | M939: =K939*6+L939 -> 58 | O939: 9 | P939: 13 | Q939: =O939*6+P939 -> 67 | S939: IRVING
A940: BEST PLAYERS
A941: PORT MELBOURNE | C941: JOHNSON | F941: WILSON | I941: MILLER | L941: MURRAY | N941: LEEHANE | Q941: BONNETT
A942: MOORABBIN | C942: BURGE | F942: BOYD | I942: G BAKER | L942: COAD | N942: N BAKER | Q942: McKENZIE
A943: GOALKICKERS
A944: PORT MELBOURNE | C944: BONNETT 4 | F944: MILLER 3 | I944: BRAGG | K944: JOHNSON | M944: FOGARTY
A945: MOORABBIN | C945: BURGE 3 | F945: BOYD 2 | I945: WALKER | K945: N BAKER | M945: COAD | O945: CHANDLER
A947: COBURG | C947: 4 | D947: 1 | E947: =C947*6+D947 -> 25 | G947: 6 | H947: 3 | I947: =G947*6+H947 -> 39 | K947: 8 | L947: 10 | M947: =K947*6+L947 -> 58 | O947: 13 | P947: 14 | Q947: =O947*6+P947 -> 92 | S947: COBURG
A948: BOX HILL | C948: 1 | D948: 3 | E948: =C948*6+D948 -> 9 | G948: 5 | H948: 6 | I948: =G948*6+H948 -> 36 | K948: 7 | L948: 9 | M948: =K948*6+L948 -> 51 | O948: 9 | P948: 10 | Q948: =O948*6+P948 -> 64 | S948: CARDWELL
A949: BEST PLAYERS
A950: COBURG | C950: R WILKINSON | F950: CONDON | I950: STARBUCK | L950: ROGAN | N950: EVANS | Q950: BULMAN
A951: BOX HILL | C951: KRONK | F951: IRVINE | I951: EADE | L951: GIBB | N951: EDNIE | Q951: COGHLAN
A952: GOALKICKERS
A953: COBURG | C953: HEWES 3 | F953: R WILKINSON 3 | J953: BULMAN 2 | M953: CANNING | O953: EVANS | Q953: AITKEN | S953: ROGAN | U953: H WILKINSON
A954: BOX HILL | C954: ALLEN 2 | F954: W BLUNDY 2 | I954: G ANDERSON | L954: COGHLAN | N954: THOMAS | P954: NODEN | R954: TURNER
A956: BRUNSWICK | C956: 5 | D956: 1 | E956: =C956*6+D956 -> 31 | G956: 7 | H956: 2 | I956: =G956*6+H956 -> 44 | K956: 12 | L956: 5 | M956: =K956*6+L956 -> 77 | O956: 14 | P956: 7 | Q956: =O956*6+P956 -> 91 | S956: BEACH ROAD
A957: SANDRINGHAM | C957: 2 | D957: 1 | E957: =C957*6+D957 -> 13 | G957: 6 | H957: 4 | I957: =G957*6+H957 -> 40 | K957: 9 | L957: 5 | M957: =K957*6+L957 -> 59 | O957: 11 | P957: 6 | Q957: =O957*6+P957 -> 72 | S957: PITTARD
A958: BEST PLAYERS
A959: BRUNSWICK | C959: ROLFS | E959: PLANT | H959: LOVETT | K959: WEIR | N959: CLUES | Q959: MUNRO
A960: SANDRINGHAM | C960: QUEALY | E960: HISCOCK | H960: RUSSO | K960: SHIPP | N960: HOY | Q960: RUSSELL
A961: GOALKICKERS
A962: BRUNSWICK | C962: MULLENGER 3 | F962: CLUES 3 | H962: LOVETT 2 | J962: KALAF 2 | M962: McFARLANE | P962: WALSH | R962: STANLEY | U962: WEIR
A963: SANDRINGHAM | C963: HISCOCK 5 | F963: HARPER 4 | I963: CLAYTON | K963: QUEALY
A965: CAMBERWELL | C965: 6 | D965: 3 | E965: =C965*6+D965 -> 39 | G965: 7 | H965: 5 | I965: =G965*6+H965 -> 47 | K965: 14 | L965: 8 | M965: =K965*6+L965 -> 92 | O965: 17 | P965: 9 | Q965: =O965*6+P965 -> 111 | S965: NORTHCOTE
A966: NORTHCOTE | C966: 1 | D966: 2 | E966: =C966*6+D966 -> 8 | G966: 8 | H966: 8 | I966: =G966*6+H966 -> 56 | K966: 8 | L966: 12 | M966: =K966*6+L966 -> 60 | O966: 11 | P966: 18 | Q966: =O966*6+P966 -> 84 | S966: ROACH
A967: BEST PLAYERS
A968: CAMBERWELL | C968: McFEE | F968: MASON | I968: BOHAN | K968: McGUINNESS | N968: ROSENBROCK | Q968: HAYES
A969: NORTHCOTE | C969: WOOLNOUGH | F969: McLAINE | I969: HOLT | K969: F FISHER | N969: FRANCIS | Q969: DENEHY
A970: GOALKICKERS
A971: CAMBERWELL | C971: McFEE 6 | F971: BOHAN 5 | I971: McGUINNESS 3 | L971: THYNNE | N971: ROSENBROCK | Q971: DUFF
A972: NORTHCOTE | C972: PAWSEY 4 | F972: COOPER 2 | I972: WOOLNOUGH | L972: SEARLE | N972: FRANCIS | P972: McLAINE | R972: JOHNSON
A974: WILLIAMSTOWN | C974: 3 | D974: 3 | E974: =C974*6+D974 -> 21 | G974: 10 | H974: 10 | I974: =G974*6+H974 -> 70 | K974: 11 | L974: 11 | M974: =K974*6+L974 -> 77 | O974: 17 | P974: 16 | Q974: =O974*6+P974 -> 118 | S974: WILLIAMSTOWN
A975: BRIGHTON | C975: 0 | D975: 5 | E975: =C975*6+D975 -> 5 | G975: 0 | H975: 7 | I975: =G975*6+H975 -> 7 | K975: 6 | L975: 9 | M975: =K975*6+L975 -> 45 | O975: 7 | P975: 11 | Q975: =O975*6+P975 -> 53 | S975: HARWOOD
A976: BEST PLAYERS
A977: WILLIAMSTOWN | C977: SIMPSON | F977: MARTIN | I977: CALLAHAN | L977: W WILLIAMS | O977: HARLEY | R977: WALKER
A978: BRIGHTON | C978: FREEMAN | F978: WOODS | I978: HOWE | L978: BURRELL | O978: TOOHEY | R978: DAVIDSON
A979: GOALKICKERS
A980: WILLIAMSTOWN | C980: WALKER 7 | F980: W WILLIAMS 4 | J980: SIMPSON 3 | M980: LINTON 2 | O980: BARMBY
A981: BRIGHTON | C981: TOOHEY 3 | F981: POUND 2 | I981: WOODS | K981: LE GRIFFEN
A983: ROUND 16 | E983: 8TH AUGUST | J983: WEATHER | M983: FINE HEAVY SHOWER 3RD QUARTER | S983: PLAYED AT
D984: 1ST QTR | H984: 2ND QTR | L984: 3RD QTR | P984: FINAL | S984: PORT MELBOURNE
A985: COBURG | C985: 3 | D985: 2 | E985: =C985*6+D985 -> 20 | G985: 6 | H985: 7 | I985: =G985*6+H985 -> 43 | K985: 10 | L985: 10 | M985: =K985*6+L985 -> 70 | O985: 11 | P985: 17 | Q985: =O985*6+P985 -> 83 | S985: UMPIRE | X985: LADDER | AB985: ROUND | AD985: 16
A986: PORT MELBOURNE | C986: 3 | D986: 7 | E986: =C986*6+D986 -> 25 | G986: 3 | H986: 12 | I986: =G986*6+H986 -> 30 | K986: 8 | L986: 15 | M986: =K986*6+L986 -> 63 | O986: 10 | P986: 19 | Q986: =O986*6+P986 -> 79 | S986: ROACH
A987: BEST PLAYERS | W987: TEAM | X987: W | Y987: L | Z987: D | AA987: FOR | AB987: AGST | AC987: % | AD987: PTS
A988: COBURG | C988: STARBUCK | F988: BULMAN | I988: H WILKINSON | L988: McTAGGART | O988: McDONALD | R988: SPARKS
A989: PORT MELBOURNE | C989: BONNETT | F989: TUCKER | I989: LAFFEY | L989: JOHNSON | O989: LEEHANE | R989: STOREY | W989: PORT MELBOURNE | X989: 14 | Y989: 2 | Z989: 0 | AA989: 1552 | AB989: 832 | AC989: 186.53846153846155 | AD989: 56
A990: GOALKICKERS | W990: WILLIAMSTOWN | X990: 13 | Y990: 2 | Z990: 1 | AA990: 1629 | AB990: 1067 | AC990: =(+AA990/AB990)*100 -> 152.67104029990628 | AD990: 54
A991: COBURG | C991: H WILKINSON 3 | F991: ROGAN 2 | I991: BULMAN 2 | L991: McCOLL 2 | N991: HEWES | P991: R WILKINSON | W991: YARRAVILLE | X991: 10 | Y991: 4 | Z991: 2 | AA991: 1253 | AB991: 1113 | AC991: =(+AA991/AB991)*100 -> 112.57861635220125 | AD991: 44
A992: PORT MELBOURNE | C992: BONNETT 4 | F992: FRASER 3 | I992: OWENS | K992: LAFFEY | M992: FOGARTY | W992: COBURG | X992: 10 | Y992: 5 | Z992: 1 | AA992: 1392 | AB992: 1167 | AC992: =(+AA992/AB992)*100 -> 119.280205655527 | AD992: 42
A994: YARRAVILLE | C994: 1 | D994: 2 | E994: =C994*6+D994 -> 8 | G994: 5 | H994: 6 | I994: =G994*6+H994 -> 36 | K994: 7 | L994: 12 | M994: =K994*6+L994 -> 54 | O994: 10 | P994: 14 | Q994: =O994*6+P994 -> 74 | S994: YARRAVILLE | W994: PRAHRAN | X994: 10 | Y994: 6 | Z994: 0 | AA994: 1383 | AB994: 1136 | AC994: 121.74295774647888 | AD994: 40
A995: MOORABBIN | C995: 5 | D995: 5 | E995: =C995*6+D995 -> 35 | G995: 7 | H995: 8 | I995: =G995*6+H995 -> 50 | K995: 8 | L995: 13 | M995: =K995*6+L995 -> 61 | O995: 10 | P995: 13 | Q995: =O995*6+P995 -> 73 | S995: SMYTH | W995: BRUNSWICK | X995: 10 | Y995: 6 | Z995: 0 | AA995: 1165 | AB995: 1080 | AC995: 107.87037037037037 | AD995: 40
A996: BEST PLAYERS | W996: OAKLEIGH | X996: 9 | Y996: 6 | Z996: 1 | AA996: 1296 | AB996: 1162 | AC996: =(+AA996/AB996)*100 -> 111.53184165232358 | AD996: 38
A997: YARRAVILLE | C997: NICHOLLS | F997: K SMITH | I997: VANDERFEEN | L997: BODSWORTH | O997: GWYNNE | R997: SEITZ | W997: PRESTON | X997: 7 | Y997: 9 | Z997: 0 | AA997: 1152 | AB997: 1197 | AC997: =(+AA997/AB997)*100 -> 96.240601503759393 | AD997: 28
A998: MOORABBIN | C998: N BAKER | F998: D'OLIVER | I998: WHITFIELD | L998: DALY | O998: SUTHERLAND | R998: BOYD | W998: MOORABBIN | X998: 6 | Y998: 9 | Z998: 1 | AA998: 1086 | AB998: 1182 | AC998: 91.878172588832484 | AD998: 26
A999: GOALKICKERS | W999: BOX HILL | X999: 6 | Y999: 10 | Z999: 0 | AA999: 1134 | AB999: 1350 | AC999: =(+AA999/AB999)*100 -> 84 | AD999: 24
A1000: YARRAVILLE | C1000: BODSWORTH 3 | F1000: WAGHORNE 2 | I1000: WILD 2 | K1000: N ROHLEDER 2 | N1000: J ROHLEDER | W1000: CAMBERWELL | X1000: 5 | Y1000: 11 | Z1000: 0 | AA1000: 1125 | AB1000: 1361 | AC1000: 82.659808963997065 | AD1000: 20
A1001: MOORABBIN | C1001: WALKER 3 | F1001: DALY 3 | H1001: N BAKER 2 | J1001: SUTHERLAND 2 | W1001: SANDRINGHAM | X1001: 4 | Y1001: 12 | Z1001: 0 | AA1001: 974 | AB1001: 1703 | AC1001: 57.193188490898414 | AD1001: 16
W1002: NORTHCOTE | X1002: 3 | Y1002: 13 | Z1002: 0 | AA1002: 1030 | AB1002: 1194 | AC1002: 86.264656616415408 | AD1002: 12
A1003: PRESTON | C1003: 0 | D1003: 5 | E1003: =C1003*6+D1003 -> 5 | G1003: 4 | H1003: 8 | I1003: =G1003*6+H1003 -> 32 | K1003: 8 | L1003: 11 | M1003: =K1003*6+L1003 -> 59 | O1003: 12 | P1003: 15 | Q1003: =O1003*6+P1003 -> 87 | S1003: PRESTON | W1003: BRIGHTON | X1003: 2 | Y1003: 14 | Z1003: 0 | AA1003: 927 | AB1003: 1554 | AC1003: 59.65250965250965 | AD1003: 8
A1004: OAKLEIGH | C1004: 4 | D1004: 3 | E1004: =C1004*6+D1004 -> 27 | G1004: 7 | H1004: 8 | I1004: =G1004*6+H1004 -> 50 | K1004: 9 | L1004: 9 | M1004: =K1004*6+L1004 -> 63 | O1004: 10 | P1004: 12 | Q1004: =O1004*6+P1004 -> 72 | S1004: IRVING
A1005: BEST PLAYERS
A1006: PRESTON | C1006: SWEET | E1006: JEFFREY | H1006: HENRYS | K1006: BRADFORD | N1006: FOLEY | Q1006: BATEMAN
A1007: OAKLEIGH | C1007: DELO | E1007: HILL | H1007: VAINS | K1007: STREETER | N1007: W WILLIAMS | Q1007: SCULLIN
A1008: GOALKICKERS
A1009: PRESTON | C1009: LALOR 3 | F1009: BRADFORD 3 | I1009: FOLEY 3 | K1009: HART 2 | M1009: CANN
A1010: OAKLEIGH | C1010: STREETER 4 | F1010: DELO | H1010: W WILLIAMS | K1010: WALSH | M1010: H WILLIAMS | P1010: LONIE | R1010: GUY
A1012: WILLIAMSTOWN | C1012: 3 | D1012: 6 | E1012: =C1012*6+D1012 -> 24 | G1012: 6 | H1012: 9 | I1012: =G1012*6+H1012 -> 45 | K1012: 9 | L1012: 14 | M1012: =K1012*6+L1012 -> 68 | O1012: 13 | P1012: 19 | Q1012: =O1012*6+P1012 -> 97 | S1012: CAMBERWELL
A1013: CAMBERWELL | C1013: 2 | D1013: 0 | E1013: =C1013*6+D1013 -> 12 | G1013: 6 | H1013: 6 | I1013: =G1013*6+H1013 -> 42 | K1013: 8 | L1013: 8 | M1013: =K1013*6+L1013 -> 56 | O1013: 9 | P1013: 9 | Q1013: =O1013*6+P1013 -> 63 | S1013: MERRINGTON
A1014: BEST PLAYERS
A1015: WILLIAMSTOWN | C1015: SIMPSON | F1015: W WILLIAMS | I1015: MARTIN | L1015: G WILLIAMS | O1015: DULLARD | R1015: WOOKEY
A1016: CAMBERWELL | C1016: BOHAN | F1016: WAIN | I1016: FLETCHER | L1016: HEDLEY | O1016: MASON | R1016: HAYES
A1017: GOALKICKERS
A1018: WILLIAMSTOWN | C1018: W WILLIAMS 6 | F1018: SIMPSON 4 | I1018: DULLARD | K1018: WALKER | M1018: SIMS
A1019: CAMBERWELL | C1019: BOHAN 6 | F1019: HEDLEY 2 | I1019: ROSENBROCK
A1021: BOX HILL | C1021: 4 | D1021: 3 | E1021: =C1021*6+D1021 -> 27 | G1021: 9 | H1021: 6 | I1021: =G1021*6+H1021 -> 60 | K1021: 13 | L1021: 11 | M1021: =K1021*6+L1021 -> 89 | O1021: 14 | P1021: 13 | Q1021: =O1021*6+P1021 -> 97 | S1021: B.H
A1022: SANDRINGHAM | C1022: 1 | D1022: 1 | E1022: =C1022*6+D1022 -> 7 | G1022: 2 | H1022: 2 | I1022: =G1022*6+H1022 -> 14 | K1022: 4 | L1022: 4 | M1022: =K1022*6+L1022 -> 28 | O1022: 6 | P1022: 9 | Q1022: =O1022*6+P1022 -> 45 | S1022: HARWOOD
A1023: BEST PLAYERS
A1024: BOX HILL | C1024: LOVE | E1024: MORRIS | H1024: EDNIE | K1024: KRONK | N1024: TURNER | Q1024: ALLEN
A1025: SANDRINGHAM | C1025: RUSSO | E1025: J WOODS | H1025: SHIPP | K1025: HANKINSON | N1025: HARPER | Q1025: QUEALY
A1026: GOALKICKERS
A1027: BOX HILL | C1027: COGHLAN 4 | F1027: W BLUNDY 3 | I1027: ALLEN 3 | K1027: DEACON 2 | N1027: NODEN | P1027: TURNER
A1028: SANDRINGHAM | C1028: HARPER 4 | F1028: BOURKE | I1028: QUEALY
A1030: BRUNSWICK | C1030: 3 | D1030: 3 | E1030: =C1030*6+D1030 -> 21 | G1030: 4 | H1030: 6 | I1030: =G1030*6+H1030 -> 30 | K1030: 5 | L1030: 12 | M1030: =K1030*6+L1030 -> 42 | O1030: 7 | P1030: 17 | Q1030: =O1030*6+P1030 -> 59 | S1030: BRUNSWICK
A1031: NORTHCOTE | C1031: 2 | D1031: 0 | E1031: =C1031*6+D1031 -> 12 | G1031: 5 | H1031: 1 | I1031: =G1031*6+H1031 -> 31 | K1031: 6 | L1031: 3 | M1031: =K1031*6+L1031 -> 39 | O1031: 7 | P1031: 3 | Q1031: =O1031*6+P1031 -> 45 | S1031: CARDWELL
A1032: BEST PLAYERS
A1033: BRUNSWICK | C1033: MUNRO | F1033: WEIR | I1033: YEA | K1033: SEYMOUR | N1033: PLANT | Q1033: SMITH
A1034: NORTHCOTE | C1034: WOOLNOUGH | F1034: McLAINE | I1034: COOPER | K1034: ALDRIDGE | N1034: HOLT | Q1034: SEARLE
A1035: GOALKICKERS
A1036: BRUNSWICK | C1036: WEIR 6 | F1036: MULLENGER
A1037: NORTHCOTE | C1037: COOPER 2 | F1037: SEARLE 2 | I1037: HOLT 2 | K1037: PAWSEY
A1039: PRAHRAN | C1039: 4 | D1039: 4 | E1039: =C1039*6+D1039 -> 28 | G1039: 7 | H1039: 8 | I1039: =G1039*6+H1039 -> 50 | K1039: 15 | L1039: 12 | M1039: =K1039*6+L1039 -> 102 | O1039: 21 | P1039: 17 | Q1039: =O1039*6+P1039 -> 143 | S1039: ELSTERNWICK PARK
A1040: BRIGHTON | C1040: 0 | D1040: 2 | E1040: =C1040*6+D1040 -> 2 | G1040: 2 | H1040: 7 | I1040: =G1040*6+H1040 -> 19 | K1040: 3 | L1040: 7 | M1040: =K1040*6+L1040 -> 25 | O1040: 6 | P1040: 10 | Q1040: =O1040*6+P1040 -> 46 | S1040: PITTARD
A1041: BEST PLAYERS
A1042: PRAHRAN | C1042: KINNABURGH | F1042: LOUREY | I1042: HARVEY | L1042: CLEAR | N1042: H BOYD | Q1042: YATES
A1043: BRIGHTON | C1043: HOWE | F1043: C CONROY | I1043: CRAIG | L1043: RIDDELL | N1043: MARINI | Q1043: COURTNEY
A1044: GOALKICKERS
A1045: PRAHRAN | C1045: KINNABURGH 8 | F1045: O'BRYAN 4 | I1045: CLEAR 3 | K1045: LOUREY 2 | N1045: KRUSE | P1045: HARVEY | R1045: PLAIN | T1045: MORONE
A1046: BRIGHTON | C1046: MARINI | F1046: TOOHEY | I1046: HOWE | K1046: G CONROY | N1046: POUND | P1046: CURRIE
A1048: ROUND 17 | E1048: 15TH AUGUST | J1048: WEATHER | M1048: STRONG NORTH WEST WIND RAIN | S1048: PLAYED AT
D1049: 1ST QTR | H1049: 2ND QTR | L1049: 3RD QTR | P1049: FINAL | S1049: PORT MELBOURNE
A1050: PORT MELBOURNE | C1050: 5 | D1050: 2 | E1050: =C1050*6+D1050 -> 32 | G1050: 10 | H1050: 2 | I1050: =G1050*6+H1050 -> 62 | K1050: 15 | L1050: 4 | M1050: =K1050*6+L1050 -> 94 | O1050: 16 | P1050: 9 | Q1050: =O1050*6+P1050 -> 105 | S1050: UMPIRE | X1050: LADDER | AB1050: ROUND | AD1050: 17
A1051: YARRAVILLE | C1051: 1 | D1051: 6 | E1051: =C1051*6+D1051 -> 12 | G1051: 3 | H1051: 11 | I1051: =G1051*6+H1051 -> 29 | K1051: 6 | L1051: 11 | M1051: =K1051*6+L1051 -> 47 | O1051: 11 | P1051: 12 | Q1051: =O1051*6+P1051 -> 78 | S1051: MERRINGTON
A1052: BEST PLAYERS | W1052: TEAM | X1052: W | Y1052: L | Z1052: D | AA1052: FOR | AB1052: AGST | AC1052: % | AD1052: PTS
A1053: PORT MELBOURNE | C1053: MILLER | F1053: BONNETT | I1053: TUCKER | L1053: WILSON | N1053: OWENS | Q1053: LEEHANE
A1054: YARRAVILLE | C1054: MARCHESI | F1054: SEITZ | I1054: MASON | L1054: GWYNN | N1054: SMALLWOOD | Q1054: VANDERFEEN | W1054: PORT MELBOURNE | X1054: 15 | Y1054: 2 | Z1054: 0 | AA1054: 1657 | AB1054: 910 | AC1054: 182.08791208791209 | AD1054: 60
A1055: GOALKICKERS | W1055: WILLIAMSTOWN | X1055: 14 | Y1055: 2 | Z1055: 1 | AA1055: 1703 | AB1055: 1114 | AC1055: =(+AA1055/AB1055)*100 -> 152.87253141831238 | AD1055: 58
A1056: PORT MELBOURNE | C1056: MILLER 4 | F1056: BONNETT 3 | I1056: OWENS 3 | K1056: MURRAY 3 | N1056: CARIS | P1056: FOGARTY | R1056: FRASER | W1056: COBURG | X1056: 11 | Y1056: 5 | Z1056: 1 | AA1056: 1490 | AB1056: 1203 | AC1056: =(+AA1056/AB1056)*100 -> 123.85702410640067 | AD1056: 46
A1057: YARRAVILLE | C1057: J ROHLEDER 4 | F1057: MARCHESI 3 | I1057: MASON 2 | K1057: WILD | M1057: R SMITH | W1057: YARRAVILLE | X1057: 10 | Y1057: 5 | Z1057: 2 | AA1057: 1331 | AB1057: 1218 | AC1057: =(+AA1057/AB1057)*100 -> 109.27750410509032 | AD1057: 44
A1059: WILLIAMSTOWN | C1059: 3 | D1059: 6 | E1059: =C1059*6+D1059 -> 24 | G1059: 6 | H1059: 9 | I1059: =G1059*6+H1059 -> 45 | K1059: 8 | L1059: 11 | M1059: =K1059*6+L1059 -> 59 | O1059: 10 | P1059: 14 | Q1059: =O1059*6+P1059 -> 74 | S1059: WILLIAMSTOWN | W1059: PRAHRAN | X1059: 10 | Y1059: 6 | Z1059: 1 | AA1059: 1462 | AB1059: 1215 | AC1059: 120.32921810699588 | AD1059: 42
A1060: BRUNSWICK | C1060: 1 | D1060: 1 | E1060: =C1060*6+D1060 -> 7 | G1060: 2 | H1060: 4 | I1060: =G1060*6+H1060 -> 16 | K1060: 3 | L1060: 10 | M1060: =K1060*6+L1060 -> 28 | O1060: 5 | P1060: 17 | Q1060: =O1060*6+P1060 -> 47 | S1060: ROACH | W1060: OAKLEIGH | X1060: 10 | Y1060: 6 | Z1060: 1 | AA1060: 1386 | AB1060: 1190 | AC1060: =(+AA1060/AB1060)*100 -> 116.47058823529413 | AD1060: 42
A1061: BEST PLAYERS | W1061: BRUNSWICK | X1061: 10 | Y1061: 7 | Z1061: 0 | AA1061: 1212 | AB1061: 1154 | AC1061: 105.02599653379549 | AD1061: 40
A1062: WILLIAMSTOWN | C1062: W WILLIAMS | F1062: G WILLIAMS | I1062: KENT | K1062: SMITH | N1062: WOOKEY | Q1062: SIMS | W1062: MOORABBIN | X1062: 7 | Y1062: 9 | Z1062: 1 | AA1062: 1152 | AB1062: 1213 | AC1062: 94.971145919208567 | AD1062: 30
A1063: BRUNSWICK | C1063: MAHER | F1063: SEYMOUR | I1063: YEA | K1063: DUNSTAN | N1063: ROLFS | Q1063: MULLENGER | W1063: PRESTON | X1063: 7 | Y1063: 10 | Z1063: 0 | AA1063: 1183 | AB1063: 1263 | AC1063: =(+AA1063/AB1063)*100 -> 93.665874901029298 | AD1063: 28
A1064: GOALKICKERS | W1064: BOX HILL | X1064: 7 | Y1064: 10 | Z1064: 0 | AA1064: 1193 | AB1064: 1405 | AC1064: =(+AA1064/AB1064)*100 -> 84.911032028469748 | AD1064: 28
A1065: WILLIAMSTOWN | C1065: DULLARD 4 | F1065: W WILLIAMS 3 | J1065: WALKER 2 | M1065: SIMPSON | W1065: CAMBERWELL | X1065: 5 | Y1065: 11 | Z1065: 1 | AA1065: 1204 | AB1065: 1440 | AC1065: 83.611111111111114 | AD1065: 22
A1066: BRUNSWICK | C1066: MULLENGER | F1066: KALAF | H1066: HUNTER | J1066: FISHER | L1066: CLUES | W1066: SANDRINGHAM | X1066: 4 | Y1066: 13 | Z1066: 0 | AA1066: 1010 | AB1066: 1801 | AC1066: 56.079955580233204 | AD1066: 16
W1067: NORTHCOTE | X1067: 3 | Y1067: 14 | Z1067: 0 | AA1067: 1085 | AB1067: 1253 | AC1067: 86.592178770949715 | AD1067: 12
A1068: MOORABBIN | C1068: 2 | D1068: 4 | E1068: =C1068*6+D1068 -> 16 | G1068: 4 | H1068: 10 | I1068: =G1068*6+H1068 -> 34 | K1068: 5 | L1068: 14 | M1068: =K1068*6+L1068 -> 44 | O1068: 8 | P1068: 18 | Q1068: =O1068*6+P1068 -> 66 | S1068: MOORABBIN | W1068: BRIGHTON | X1068: 2 | Y1068: 15 | Z1068: 0 | AA1068: 955 | AB1068: 1644 | AC1068: 58.090024330900242 | AD1068: 8
A1069: PRESTON | C1069: 1 | D1069: 1 | E1069: =C1069*6+D1069 -> 7 | G1069: 1 | H1069: 3 | I1069: =G1069*6+H1069 -> 9 | K1069: 3 | L1069: 4 | M1069: =K1069*6+L1069 -> 22 | O1069: 4 | P1069: 7 | Q1069: =O1069*6+P1069 -> 31 | S1069: HARWOOD
A1070: BEST PLAYERS
A1071: MOORABBIN | C1071: McKENZIE | F1071: COAD | I1071: DALY | L1071: CHANDLER | O1071: LEHMANN | R1071: D'OLIVER
A1072: PRESTON | C1072: SWEET | F1072: HENRYS | I1072: ANDERSON | L1072: LALOR | O1072: BATEMAN | R1072: JEFFREY
A1073: GOALKICKERS
A1074: MOORABBIN | C1074: SUTHERLAND 3 | F1074: N BAKER 2 | I1074: COAD 2 | K1074: LEHMANN
A1075: PRESTON | C1075: CANN | E1075: FOLEY | G1075: BRADFORD | J1075: K CHARD
A1077: BOX HILL | C1077: 0 | D1077: 5 | E1077: =C1077*6+D1077 -> 5 | G1077: 2 | H1077: 8 | I1077: =G1077*6+H1077 -> 20 | K1077: 6 | L1077: 11 | M1077: =K1077*6+L1077 -> 47 | O1077: 8 | P1077: 11 | Q1077: =O1077*6+P1077 -> 59 | S1077: NORTHCOTE
A1078: NORTHCOTE | C1078: 3 | D1078: 5 | E1078: =C1078*6+D1078 -> 23 | G1078: 3 | H1078: 6 | I1078: =G1078*6+H1078 -> 24 | K1078: 4 | L1078: 10 | M1078: =K1078*6+L1078 -> 34 | O1078: 7 | P1078: 13 | Q1078: =O1078*6+P1078 -> 55 | S1078: PITTARD
A1079: BEST PLAYERS
A1080: BOX HILL | C1080: GIBB | F1080: MORRIS | I1080: EDNIE | L1080: WRIGHT | N1080: ALLEN | Q1080: DEACON
A1081: NORTHCOTE | C1081: PAWSEY | F1081: WOOLNOUGH | I1081: WALKER | L1081: SEARLE | N1081: ALDRIDGE | Q1081: POWELL
A1082: GOALKICKERS
A1083: BOX HILL | C1083: ALLEN 5 | F1083: GREEN | H1083: NODEN | J1083: W BLUNDY
A1084: NORTHCOTE | C1084: PAWSEY 4 | F1084: COOPER 2 | I1084: GOUGH
A1086: PRAHRAN | C1086: 2 | D1086: 2 | E1086: =C1086*6+D1086 -> 14 | G1086: 7 | H1086: 3 | I1086: =G1086*6+H1086 -> 45 | K1086: 10 | L1086: 4 | M1086: =K1086*6+L1086 -> 64 | O1086: 12 | P1086: 7 | Q1086: =O1086*6+P1086 -> 79 | S1086: TOORAK PARK
A1087: CAMBERWELL | C1087: 1 | D1087: 7 | E1087: =C1087*6+D1087 -> 13 | G1087: 5 | H1087: 9 | I1087: =G1087*6+H1087 -> 39 | K1087: 6 | L1087: 11 | M1087: =K1087*6+L1087 -> 47 | O1087: 11 | P1087: 13 | Q1087: =O1087*6+P1087 -> 79 | S1087: CARDWELL
A1088: BEST PLAYERS
A1089: PRAHRAN | C1089: C BOYD | E1089: HARVEY | H1089: O'BRYAN | K1089: YATES | N1089: HART | Q1089: WALSH
A1090: CAMBERWELL | C1090: McFEE | E1090: ROSENBROCK | H1090: MASON | K1090: WAIN | N1090: HAYES | Q1090: BRADLEY
A1091: GOALKICKERS
A1092: PRAHRAN | C1092: WALSH 3 | E1092: CLEAR 3 | G1092: KINNABURGH 3 | J1092: O'BRYAN 2 | M1092: HARVEY
A1093: CAMBERWELL | C1093: McGUINNESS 3 | F1093: BOHAN 2 | I1093: McFEE 2 | K1093: ALSOPP 2 | M1093: HEDLEY | O1093: ROSENBROCK
A1095: OAKLEIGH | C1095: 5 | D1095: 7 | E1095: =C1095*6+D1095 -> 37 | G1095: 9 | H1095: 7 | I1095: =G1095*6+H1095 -> 61 | K1095: 10 | L1095: 13 | M1095: =K1095*6+L1095 -> 73 | O1095: 12 | P1095: 18 | Q1095: =O1095*6+P1095 -> 90 | S1095: OAKLEIGH
A1096: BRIGHTON | C1096: 0 | D1096: 3 | E1096: =C1096*6+D1096 -> 3 | G1096: 2 | H1096: 6 | I1096: =G1096*6+H1096 -> 18 | K1096: 2 | L1096: 9 | M1096: =K1096*6+L1096 -> 21 | O1096: 3 | P1096: 10 | Q1096: =O1096*6+P1096 -> 28 | S1096: SMYTH
A1097: BEST PLAYERS
A1098: OAKLEIGH | C1098: SCULLIN | F1098: WALSH | I1098: STREETER | L1098: W WILLIAMS | O1098: GRIFFITHS | R1098: BAPTIST
A1099: BRIGHTON | C1099: ALEXANDER | F1099: COURTNEY | I1099: TOOHEY | L1099: O'MEARA | O1099: RIDDELL | R1099: MARINI
A1100: GOALKICKERS
A1101: OAKLEIGH | C1101: STREETER 5 | F1101: GRIFFITHS 3 | I1101: EDWARDS 3 | L1101: W WILLIAMS
A1102: BRIGHTON | C1102: POUND 2 | F1102: CURRIE
A1104: COBURG | C1104: 4 | D1104: 1 | E1104: =C1104*6+D1104 -> 25 | G1104: 7 | H1104: 10 | I1104: =G1104*6+H1104 -> 52 | K1104: 10 | L1104: 14 | M1104: =K1104*6+L1104 -> 74 | O1104: 13 | P1104: 20 | Q1104: =O1104*6+P1104 -> 98 | S1104: COBURG
A1105: SANDRINGHAM | C1105: 3 | D1105: 3 | E1105: =C1105*6+D1105 -> 21 | G1105: 3 | H1105: 3 | I1105: =G1105*6+H1105 -> 21 | K1105: 4 | L1105: 6 | M1105: =K1105*6+L1105 -> 30 | O1105: 5 | P1105: 6 | Q1105: =O1105*6+P1105 -> 36 | S1105: IRVING
A1106: BEST PLAYERS
A1107: COBURG | C1107: WALKER | F1107: FEWKES | I1107: PHILLIPS | L1107: H WILKINSON | O1107: SANDLANT | R1107: SPARKS
A1108: SANDRINGHAM | C1108: SHEARS | F1108: RANSOM | I1108: RUSSELL | L1108: FLEMING | O1108: RUSSO | R1108: GISSING
A1109: GOALKICKERS
A1110: COBURG | C1110: H WILKINSON 4 | F1110: ROGAN 3 | I1110: HEWES 3 | K1110: McCOLL | M1110: R WILKINSON | P1110: BULMAN
A1111: SANDRINGHAM | C1111: GISSING 2 | F1111: HARPER | I1111: QUEALY | K1111: FLEMING
A1113: ROUND 18 | E1113: 22ND AUGUST | J1113: WEATHER | M1113: SOUTH WEST WIND SHOWERS | S1113: PLAYED AT
D1114: 1ST QTR | H1114: 2ND QTR | L1114: 3RD QTR | P1114: FINAL | S1114: YARRAVILLE
A1115: YARRAVILLE | C1115: 0 | D1115: 1 | E1115: =C1115*6+D1115 -> 1 | G1115: 2 | H1115: 7 | I1115: =G1115*6+H1115 -> 19 | K1115: 3 | L1115: 8 | M1115: =K1115*6+L1115 -> 26 | O1115: 4 | P1115: 12 | Q1115: =O1115*6+P1115 -> 36 | S1115: UMPIRE | X1115: LADDER | AB1115: ROUND | AD1115: 18
A1116: COBURG | C1116: 1 | D1116: 3 | E1116: =C1116*6+D1116 -> 9 | G1116: 2 | H1116: 4 | I1116: =G1116*6+H1116 -> 16 | K1116: 2 | L1116: 6 | M1116: =K1116*6+L1116 -> 18 | O1116: 3 | P1116: 8 | Q1116: =O1116*6+P1116 -> 26 | S1116: ROACH
A1117: BEST PLAYERS | W1117: TEAM | X1117: W | Y1117: L | Z1117: D | AA1117: FOR | AB1117: AGST | AC1117: % | AD1117: PTS
A1118: YARRAVILLE | C1118: TAYLOR | F1118: SEITZ | I1118: K SMITH | K1118: VANDERFEEN | N1118: NICHOLLS | Q1118: J ROHLEDER
A1119: COBURG | C1119: H WILKINSON | F1119: R WILKINSON | I1119: AITKEN | K1119: EVANS | N1119: STARBUCK | Q1119: WALKER | W1119: PORT MELBOURNE | X1119: 16 | Y1119: 2 | Z1119: 0 | AA1119: 1739 | AB1119: 959 | AC1119: 181.33472367049009 | AD1119: 64
A1120: GOALKICKERS | W1120: WILLIAMSTOWN | X1120: 15 | Y1120: 2 | Z1120: 1 | AA1120: 1757 | AB1120: 1161 | AC1120: =(+AA1120/AB1120)*100 -> 151.33505598621878 | AD1120: 62
A1121: YARRAVILLE | C1121: MARCHESI 2 | F1121: R SMITH | I1121: J ROHLEDER | W1121: YARRAVILLE | X1121: 11 | Y1121: 5 | Z1121: 2 | AA1121: 1367 | AB1121: 1244 | AC1121: =(+AA1121/AB1121)*100 -> 109.88745980707395 | AD1121: 48
A1122: COBURG | C1122: ROGAN | F1122: H WILKINSON | I1122: LEVERSHA | W1122: COBURG | X1122: 11 | Y1122: 6 | Z1122: 1 | AA1122: 1516 | AB1122: 1239 | AC1122: =(+AA1122/AB1122)*100 -> 122.35673930589184 | AD1122: 46
A1124: PRAHRAN | C1124: 0 | D1124: 2 | E1124: =C1124*6+D1124 -> 2 | G1124: 0 | H1124: 3 | I1124: =G1124*6+H1124 -> 3 | K1124: 5 | L1124: 4 | M1124: =K1124*6+L1124 -> 34 | O1124: 8 | P1124: 6 | Q1124: =O1124*6+P1124 -> 54 | S1124: BRUNSWICK | W1124: PRAHRAN | X1124: 11 | Y1124: 6 | Z1124: 1 | AA1124: 1516 | AB1124: 1260 | AC1124: 120.31746031746032 | AD1124: 46
A1125: BRUNSWICK | C1125: 2 | D1125: 1 | E1125: =C1125*6+D1125 -> 13 | G1125: 4 | H1125: 3 | I1125: =G1125*6+H1125 -> 27 | K1125: 6 | L1125: 5 | M1125: =K1125*6+L1125 -> 41 | O1125: 6 | P1125: 9 | Q1125: =O1125*6+P1125 -> 45 | S1125: MERRINGTON | W1125: OAKLEIGH | X1125: 11 | Y1125: 6 | Z1125: 1 | AA1125: 1458 | AB1125: 1253 | AC1125: =(+AA1125/AB1125)*100 -> 116.36073423782921 | AD1125: 46
A1126: BEST PLAYERS | W1126: BRUNSWICK | X1126: 10 | Y1126: 8 | Z1126: 0 | AA1126: 1257 | AB1126: 1208 | AC1126: 104.05629139072848 | AD1126: 40
A1127: PRAHRAN | C1127: HART | F1127: WALSH | I1127: CAMPBELL | L1127: JONES | N1127: CLEAR | Q1127: ELLIOTT | W1127: MOORABBIN | X1127: 8 | Y1127: 9 | Z1127: 1 | AA1127: 1260 | AB1127: 1297 | AC1127: 97.147262914417894 | AD1127: 34
A1128: BRUNSWICK | C1128: McFARLANE | F1128: MULLENGER | I1128: ROLFS | L1128: KALAF | N1128: YEA | Q1128: BREW | W1128: PRESTON | X1128: 7 | Y1128: 11 | Z1128: 0 | AA1128: 1232 | AB1128: 1345 | AC1128: =(+AA1128/AB1128)*100 -> 91.59851301115242 | AD1128: 28
A1129: GOALKICKERS | W1129: BOX HILL | X1129: 7 | Y1129: 11 | Z1129: 0 | AA1129: 1240 | AB1129: 1459 | AC1129: =(+AA1129/AB1129)*100 -> 84.989718985606572 | AD1129: 28
A1130: PRAHRAN | C1130: ELLIOTT 3 | F1130: WALSH | H1130: SHILLABEER | K1130: CLEAR | M1130: C BOYD | O1130: GRAMBEAU | W1130: CAMBERWELL | X1130: 5 | Y1130: 12 | Z1130: 1 | AA1130: 1267 | AB1130: 1512 | AC1130: 83.796296296296291 | AD1130: 22
A1131: BRUNSWICK | C1131: WEIR 2 | F1131: KALAF | H1131: MAHER | J1131: MULLENGER | M1131: FISHER | W1131: NORTHCOTE | X1131: 4 | Y1131: 14 | Z1131: 0 | AA1131: 1166 | AB1131: 1329 | AC1131: 87.735139202407822 | AD1131: 16
W1132: SANDRINGHAM | X1132: 4 | Y1132: 14 | Z1132: 0 | AA1132: 1086 | AB1132: 1882 | AC1132: 57.704569606801279 | AD1132: 16
A1133: PORT MELBOURNE | C1133: 3 | D1133: 2 | E1133: =C1133*6+D1133 -> 20 | G1133: 5 | H1133: 5 | I1133: =G1133*6+H1133 -> 35 | K1133: 5 | L1133: 7 | M1133: =K1133*6+L1133 -> 37 | O1133: 11 | P1133: 16 | Q1133: =O1133*6+P1133 -> 82 | S1133: PRESTON | W1133: BRIGHTON | X1133: 2 | Y1133: 16 | Z1133: 0 | AA1133: 1039 | AB1133: 1752 | AC1133: 59.303652968036531 | AD1133: 8
A1134: PRESTON | C1134: 1 | D1134: 3 | E1134: =C1134*6+D1134 -> 9 | G1134: 2 | H1134: 5 | I1134: =G1134*6+H1134 -> 17 | K1134: 5 | L1134: 11 | M1134: =K1134*6+L1134 -> 41 | O1134: 6 | P1134: 13 | Q1134: =O1134*6+P1134 -> 49 | S1134: SMYTH
A1135: BEST PLAYERS
A1136: PORT MELBOURNE | C1136: JOHNSON | F1136: STONE | I1136: OWENS | L1136: McCARTHY | O1136: LEEHANE | Q1136: WOODBRIDGE
A1137: PRESTON | C1137: HENRYS | F1137: DEACON | I1137: FOLEY | L1137: BRADFORD | O1137: LALOR | Q1137: PASCOE
A1138: GOALKICKERS
A1139: PORT MELBOURNE | C1139: MURRAY 2 | F1139: OWENS 2 | I1139: WALSH 2 | K1139: MILLER | M1139: ATKINSON | O1139: BONNETT | Q1139: FRASER | S1139: BRAGG
A1140: PRESTON | C1140: CANN 3 | F1140: FOLEY 2 | I1140: BATEMAN
A1142: WILLIAMSTOWN | C1142: 1 | D1142: 5 | E1142: =C1142*6+D1142 -> 11 | G1142: 1 | H1142: 6 | I1142: =G1142*6+H1142 -> 12 | K1142: 4 | L1142: 10 | M1142: =K1142*6+L1142 -> 34 | O1142: 7 | P1142: 12 | Q1142: =O1142*6+P1142 -> 54 | S1142: BOX HILL
A1143: BOX HILL | C1143: 1 | D1143: 0 | E1143: =C1143*6+D1143 -> 6 | G1143: 3 | H1143: 1 | I1143: =G1143*6+H1143 -> 19 | K1143: 5 | L1143: 1 | M1143: =K1143*6+L1143 -> 31 | O1143: 7 | P1143: 5 | Q1143: =O1143*6+P1143 -> 47 | S1143: RICHARDSON
A1144: BEST PLAYERS
A1145: WILLIAMSTOWN | C1145: LINTON | E1145: G WILLIAMS | H1145: HARLEY | K1145: MUNDAY | N1145: WOOKEY | Q1145: CURRAN
A1146: BOX HILL | C1146: KRONK | E1146: MORRIS | H1146: LOVE | K1146: W BLUNDY | N1146: WRIGHT | Q1146: JEFFERS
A1147: GOALKICKERS
A1148: WILLIAMSTOWN | C1148: WALKER 4 | F1148: LINTON | H1148: HUGHES | J1148: DULLARD
A1149: BOX HILL | C1149: GIBB 2 | F1149: JEFFERS | H1149: GREEN | J1149: MORGAN | M1149: MORRIS | O1149: REED
A1151: NORTHCOTE | C1151: 4 | D1151: 4 | E1151: =C1151*6+D1151 -> 28 | G1151: 4 | H1151: 5 | I1151: =G1151*6+H1151 -> 29 | K1151: 9 | L1151: 8 | M1151: =K1151*6+L1151 -> 62 | O1151: 12 | P1151: 9 | Q1151: =O1151*6+P1151 -> 81 | S1151: BEACH ROAD
A1152: SANDRINGHAM | C1152: 3 | D1152: 0 | E1152: =C1152*6+D1152 -> 18 | G1152: 6 | H1152: 3 | I1152: =G1152*6+H1152 -> 39 | K1152: 7 | L1152: 9 | M1152: =K1152*6+L1152 -> 51 | O1152: 11 | P1152: 10 | Q1152: =O1152*6+P1152 -> 76 | S1152: CARDWELL
A1153: BEST PLAYERS
A1154: NORTHCOTE | C1154: HOLT | F1154: GOUGH | H1154: PAWSEY | K1154: WOOLNOUGH | N1154: POWELL | Q1154: PAYNTER
A1155: SANDRINGHAM | C1155: CLAYTON | F1155: RUSSO | H1155: HANKINSON | K1155: SHIPP | N1155: WOODS | Q1155: HARPER
A1156: GOALKICKERS
A1157: NORTHCOTE | C1157: J VAINS 3 | F1157: PAWSEY 3 | I1157: GIBBS | K1157: GOUGH | M1157: BINNS | O1157: COOPER | Q1157: POWELL
A1158: SANDRINGHAM | C1158: HARPER 6 | F1158: HISCOCK 2 | I1158: FLEMING | K1158: SHIPP | M1158: CLAYTON
A1160: OAKLEIGH | C1160: 2 | D1160: 4 | E1160: =C1160*6+D1160 -> 16 | G1160: 5 | H1160: 6 | I1160: =G1160*6+H1160 -> 36 | K1160: 8 | L1160: 12 | M1160: =K1160*6+L1160 -> 60 | O1160: 10 | P1160: 12 | Q1160: =O1160*6+P1160 -> 72 | S1160: CAMBERWELL
A1161: CAMBERWELL | C1161: 1 | D1161: 3 | E1161: =C1161*6+D1161 -> 9 | G1161: 4 | H1161: 7 | I1161: =G1161*6+H1161 -> 31 | K1161: 6 | L1161: 10 | M1161: =K1161*6+L1161 -> 46 | O1161: 8 | P1161: 15 | Q1161: =O1161*6+P1161 -> 63 | S1161: HARWOOD
A1162: BEST PLAYERS
A1163: OAKLEIGH | C1163: HILL | E1163: EDWARDS | H1163: SAVORY | K1163: WALSH | N1163: W WILLIAMS | Q1163: LAMBERT
A1164: CAMBERWELL | C1164: WAIN | E1164: EVANS | H1164: MASON | K1164: BOHAN | N1164: HAYES | Q1164: McFEE
A1165: GOALKICKERS
A1166: OAKLEIGH | C1166: W WILLIAMS 2 | F1166: EDWARDS 2 | I1166: STREETER 2 | L1166: WALSH 2 | N1166: DELO | P1166: ALTHAM
A1167: CAMBERWELL | C1167: BOHAN 4 | F1167: HEDLEY | I1167: McFEE | K1167: ROSENBROCK | N1167: McGUINNESS
A1169: MOORABBIN | C1169: 1 | D1169: 2 | E1169: =C1169*6+D1169 -> 8 | G1169: 8 | H1169: 2 | I1169: =G1169*6+H1169 -> 50 | K1169: 11 | L1169: 5 | M1169: =K1169*6+L1169 -> 71 | O1169: 16 | P1169: 12 | Q1169: =O1169*6+P1169 -> 108 | S1169: ELSTERNWICK PARK
A1170: BRIGHTON | C1170: 2 | D1170: 7 | E1170: =C1170*6+D1170 -> 19 | G1170: 5 | H1170: 10 | I1170: =G1170*6+H1170 -> 40 | K1170: 7 | L1170: 11 | M1170: =K1170*6+L1170 -> 53 | O1170: 12 | P1170: 12 | Q1170: =O1170*6+P1170 -> 84 | S1170: IRVING
A1171: BEST PLAYERS
A1172: MOORABBIN | C1172: LEHMANN | F1172: CHANDLER | I1172: D'OLIVER | L1172: WHITFIELD | O1172: G BAKER | R1172: COAD
A1173: BRIGHTON | C1173: ALEXANDER | F1173: C CONROY | I1173: BURRELL | L1173: BLACKMORE | O1173: O'DONOGHUE | R1173: MARINI
A1174: GOALKICKERS
A1175: MOORABBIN | C1175: COAD 4 | F1175: WALSH 3 | I1175: LEHMANN 3 | L1175: N BAKER 2 | O1175: DALY 2 | Q1175: RICHARDS 2
A1176: BRIGHTON | C1176: POUND 5 | F1176: HOWE 2 | I1176: PAGRAM 2 | L1176: MARINI | N1176: TOOHEY | P1176: FEHR
A1178: ROUND 19 | E1178: 29TH AUGUST | J1178: WEATHER | O1178: FINE | S1178: PLAYED AT
D1179: 1ST QTR | H1179: 2ND QTR | L1179: 3RD QTR | P1179: FINAL | S1179: OAKLEIGH
A1180: OAKLEIGH | C1180: 3 | D1180: 7 | E1180: =C1180*6+D1180 -> 25 | G1180: 8 | H1180: 9 | I1180: =G1180*6+H1180 -> 57 | K1180: 11 | L1180: 14 | M1180: =K1180*6+L1180 -> 80 | O1180: 13 | P1180: 18 | Q1180: =O1180*6+P1180 -> 96 | S1180: UMPIRE | X1180: LADDER | AB1180: ROUND | AD1180: 19
A1181: BRUNSWICK | C1181: 4 | D1181: 1 | E1181: =C1181*6+D1181 -> 25 | G1181: 4 | H1181: 7 | I1181: =G1181*6+H1181 -> 31 | K1181: 6 | L1181: 7 | M1181: =K1181*6+L1181 -> 43 | O1181: 7 | P1181: 9 | Q1181: =O1181*6+P1181 -> 51 | S1181: IRVING
A1182: BEST PLAYERS | W1182: TEAM | X1182: W | Y1182: L | Z1182: D | AA1182: FOR | AB1182: AGST | AC1182: % | AD1182: PTS
A1183: OAKLEIGH | C1183: HILL | F1183: SCULLIN | I1183: STREETER | L1183: EDWARDS | O1183: TEMME | Q1183: VAINS
A1184: BRUNSWICK | C1184: McFARLANE | F1184: BUCHANAN | I1184: DUNSTAN | L1184: KALAF | O1184: HAYES | Q1184: SEYMOUR | W1184: PORT MELBOURNE | X1184: 17 | Y1184: 2 | Z1184: 0 | AA1184: 1922 | AB1184: 1002 | AC1184: 191.81636726546907 | AD1184: 68
A1185: GOALKICKERS | Q1185: LAMBERT | W1185: WILLIAMSTOWN | X1185: 16 | Y1185: 2 | Z1185: 1 | AA1185: 1890 | AB1185: 1209 | AC1185: =(+AA1185/AB1185)*100 -> 156.32754342431764 | AD1185: 66
A1186: OAKLEIGH | C1186: STREETER 5 | F1186: CADMAN 2 | I1186: W WILLIAMS | L1186: GRIFFITHS | N1186: HILL | P1186: EDWARDS | R1186: SCULLIN | W1186: YARRAVILLE | X1186: 12 | Y1186: 5 | Z1186: 2 | AA1186: 1431 | AB1186: 1306 | AC1186: =(+AA1186/AB1186)*100 -> 109.57120980091884 | AD1186: 52
A1187: BRUNSWICK | C1187: HAYES 4 | F1187: CLUES | I1187: WEIR | K1187: MULLENGER | W1187: COBURG | X1187: 12 | Y1187: 6 | Z1187: 1 | AA1187: 1620 | AB1187: 1314 | AC1187: =(+AA1187/AB1187)*100 -> 123.28767123287672 | AD1187: 50
A1189: YARRAVILLE | C1189: 1 | D1189: 2 | E1189: =C1189*6+D1189 -> 8 | G1189: 5 | H1189: 8 | I1189: =G1189*6+H1189 -> 38 | K1189: 6 | L1189: 9 | M1189: =K1189*6+L1189 -> 45 | O1189: 9 | P1189: 10 | Q1189: =O1189*6+P1189 -> 64 | S1189: YARRAVILLE | W1189: PRAHRAN | X1189: 12 | Y1189: 6 | Z1189: 1 | AA1189: 1647 | AB1189: 1341 | AC1189: 122.81879194630872 | AD1189: 50
A1190: PRESTON | C1190: 2 | D1190: 3 | E1190: =C1190*6+D1190 -> 15 | G1190: 4 | H1190: 4 | I1190: =G1190*6+H1190 -> 28 | K1190: 6 | L1190: 7 | M1190: =K1190*6+L1190 -> 43 | O1190: 9 | P1190: 8 | Q1190: =O1190*6+P1190 -> 62 | S1190: RICHARDSON | W1190: OAKLEIGH | X1190: 12 | Y1190: 6 | Z1190: 1 | AA1190: 1554 | AB1190: 1304 | AC1190: =(+AA1190/AB1190)*100 -> 119.17177914110428 | AD1190: 50
A1191: BEST PLAYERS | W1191: BRUNSWICK | X1191: 10 | Y1191: 9 | Z1191: 0 | AA1191: 1308 | AB1191: 1304 | AC1191: 100.30674846625767 | AD1191: 40
A1192: YARRAVILLE | C1192: SALT | F1192: MARCHESI | I1192: GWYNN | L1192: PEVITT | N1192: J ROHLEDER | Q1192: NICHOLLS | W1192: MOORABBIN | X1192: 9 | Y1192: 9 | Z1192: 1 | AA1192: 1348 | AB1192: 1374 | AC1192: 98.107714701601168 | AD1192: 38
A1193: PRESTON | C1193: FOLEY | F1193: PASCOE | I1193: WEARNE | L1193: HENRYS | N1193: ANDERSON | Q1193: BRADFORD | W1193: PRESTON | X1193: 7 | Y1193: 12 | Z1193: 0 | AA1193: 1294 | AB1193: 1409 | AC1193: =(+AA1193/AB1193)*100 -> 91.838183108587643 | AD1193: 28
A1194: GOALKICKERS | W1194: BOX HILL | X1194: 7 | Y1194: 12 | Z1194: 0 | AA1194: 1321 | AB1194: 1590 | AC1194: =(+AA1194/AB1194)*100 -> 83.081761006289312 | AD1194: 28
A1195: YARRAVILLE | C1195: SALT 3 | F1195: MARCHESI 3 | I1195: R SMITH 2 | L1195: PEVITT | W1195: CAMBERWELL | X1195: 5 | Y1195: 13 | Z1195: 1 | AA1195: 1344 | AB1195: 1600 | AC1195: 84 | AD1195: 22
A1196: PRESTON | C1196: DEACON 2 | F1196: BRADFORD 2 | I1196: PASCOE 2 | L1196: HAYES | N1196: McLACHLAN | Q1196: CANN | W1196: NORTHCOTE | X1196: 4 | Y1196: 15 | Z1196: 0 | AA1196: 1241 | AB1196: 1433 | AC1196: 86.601535240753662 | AD1196: 16
W1197: SANDRINGHAM | X1197: 4 | Y1197: 15 | Z1197: 0 | AA1197: 1134 | AB1197: 2015 | AC1197: 56.277915632754343 | AD1197: 16
A1198: PRAHRAN | C1198: 4 | D1198: 2 | E1198: =C1198*6+D1198 -> 26 | G1198: 8 | H1198: 5 | I1198: =G1198*6+H1198 -> 53 | K1198: 12 | L1198: 7 | M1198: =K1198*6+L1198 -> 79 | O1198: 20 | P1198: 11 | Q1198: =O1198*6+P1198 -> 131 | S1198: TOORAK PARK | W1198: BRIGHTON | X1198: 2 | Y1198: 17 | Z1198: 0 | AA1198: 1082 | AB1198: 1935 | AC1198: 55.917312661498705 | AD1198: 8
A1199: BOX HILL | C1199: 7 | D1199: 4 | E1199: =C1199*6+D1199 -> 46 | G1199: 7 | H1199: 5 | I1199: =G1199*6+H1199 -> 47 | K1199: 8 | L1199: 13 | M1199: =K1199*6+L1199 -> 61 | O1199: 11 | P1199: 15 | Q1199: =O1199*6+P1199 -> 81 | S1199: ROACH
A1200: BEST PLAYERS
A1201: PRAHRAN | C1201: YATES | F1201: O'BRYAN | I1201: KINNABURGH | L1201: HARVEY | N1201: GRAMBEAU | Q1201: HART
A1202: BOX HILL | C1202: MORRIS | F1202: KRONK | I1202: IRVINE | L1202: LOVE | N1202: WRIGHT | Q1202: EADE
A1203: GOALKICKERS
A1204: PRAHRAN | C1204: KINNABURGH 6 | F1204: HAYES 3 | H1204: JONES 3 | J1204: ELLIOTT 2 | M1204: O'BRYAN 2 | P1204: SHILLABEER | S1204: CLARK | U1204: C BOYD | X1204: WALSH
A1205: BOX HILL | C1205: MORGAN 3 | F1205: EADE 3 | H1205: MORRIS 2 | J1205: GIBB | L1205: REED | N1205: GREEN
A1207: MOORABBIN | C1207: 4 | D1207: 5 | E1207: =C1207*6+D1207 -> 29 | G1207: 9 | H1207: 7 | I1207: =G1207*6+H1207 -> 61 | K1207: 11 | L1207: 12 | M1207: =K1207*6+L1207 -> 78 | O1207: 12 | P1207: 16 | Q1207: =O1207*6+P1207 -> 88 | S1207: MOORABBIN
A1208: CAMBERWELL | C1208: 1 | D1208: 3 | E1208: =C1208*6+D1208 -> 9 | G1208: 3 | H1208: 9 | I1208: =G1208*6+H1208 -> 27 | K1208: 6 | L1208: 9 | M1208: =K1208*6+L1208 -> 45 | O1208: 11 | P1208: 11 | Q1208: =O1208*6+P1208 -> 77 | S1208: MERRINGTON
A1209: BEST PLAYERS
A1210: MOORABBIN | C1210: McKENZIE | F1210: BOYD | I1210: COAD | K1210: RICHARDS | N1210: N BAKER | Q1210: D'OLIVER
A1211: CAMBERWELL | C1211: DUFF | F1211: BRADLEY | I1211: HEDLEY | K1211: HAYES | N1211: McFEE | Q1211: THYNNE
A1212: GOALKICKERS
A1213: MOORABBIN | C1213: RICHARDS 4 | F1213: SUTHERLAND 2 | J1213: COAD 2 | L1213: N BAKER | N1213: McGOWAN | Q1213: LEHMANN | T1213: G BAKER
A1214: CAMBERWELL | C1214: DUFF 3 | F1214: McFEE 3 | I1214: BOHAN | K1214: McGUINNESS | N1214: HEDLEY | P1214: BATTERSBY | S1214: SCHNEIDER
A1216: COBURG | C1216: 4 | D1216: 4 | E1216: =C1216*6+D1216 -> 28 | G1216: 9 | H1216: 6 | I1216: =G1216*6+H1216 -> 60 | K1216: 10 | L1216: 9 | M1216: =K1216*6+L1216 -> 69 | O1216: 15 | P1216: 14 | Q1216: =O1216*6+P1216 -> 104 | S1216: COBURG
A1217: NORTHCOTE | C1217: 2 | D1217: 1 | E1217: =C1217*6+D1217 -> 13 | G1217: 4 | H1217: 4 | I1217: =G1217*6+H1217 -> 28 | K1217: 7 | L1217: 8 | M1217: =K1217*6+L1217 -> 50 | O1217: 11 | P1217: 9 | Q1217: =O1217*6+P1217 -> 75 | S1217: HARWOOD
A1218: BEST PLAYERS
A1219: COBURG | C1219: CONDON | F1219: FEWKES | I1219: PHILLIPS | L1219: FITZPATRICK | O1219: HEWES | R1219: EVANS
A1220: NORTHCOTE | C1220: GIBBS | F1220: POWELL | I1220: PAWSEY | L1220: COLLINS | O1220: WOOLNOUGH | R1220: GOUGH
A1221: GOALKICKERS
A1222: COBURG | C1222: HEWES 5 | E1222: FITZPATRICK 3 | H1222: AITKEN 2 | J1222: EVANS | L1222: H WILKINSON | O1222: BULMAN | Q1222: ROGAN | S1222: R WILKINSON
A1223: NORTHCOTE | C1223: AMARANT 5 | F1223: GIBBS 4 | H1223: PAWSEY | J1223: FRANCIS
A1225: WILLIAMSTOWN | C1225: 5 | D1225: 5 | E1225: =C1225*6+D1225 -> 35 | G1225: 10 | H1225: 10 | I1225: =G1225*6+H1225 -> 70 | K1225: 15 | L1225: 18 | M1225: =K1225*6+L1225 -> 108 | O1225: 19 | P1225: 19 | Q1225: =O1225*6+P1225 -> 133 | S1225: WILLIAMSTOWN
A1226: SANDRINGHAM | C1226: 1 | D1226: 0 | E1226: =C1226*6+D1226 -> 6 | G1226: 2 | H1226: 3 | I1226: =G1226*6+H1226 -> 15 | K1226: 2 | L1226: 6 | M1226: =K1226*6+L1226 -> 18 | O1226: 7 | P1226: 6 | Q1226: =O1226*6+P1226 -> 48 | S1226: SMYTH
A1227: BEST PLAYERS
A1228: WILLIAMSTOWN | C1228: W WILLIAMS | F1228: SIMPSON | I1228: LINTON | L1228: G WILLIAMS | O1228: HARLEY | Q1228: SHEAHAN
A1229: SANDRINGHAM | C1229: RUSSO | F1229: RUSSELL | I1229: HANNAFORD | L1229: JONES | O1229: SHEARS | Q1229: GOODES
A1230: GOALKICKERS
A1231: WILLIAMSTOWN | C1231: WALKER 8 | F1231: LINTON 6 | I1231: CURRAN 2 | L1231: W WILLIAMS | O1231: SIMPSON | Q1231: HUGHES
A1232: SANDRINGHAM | C1232: HARPER 4 | F1232: HISCOCK | I1232: QUEALY | K1232: HOY
A1234: PORT MELBOURNE | C1234: 4 | D1234: 6 | E1234: =C1234*6+D1234 -> 30 | G1234: 6 | H1234: 11 | I1234: =G1234*6+H1234 -> 47 | K1234: 17 | L1234: 18 | M1234: =K1234*6+L1234 -> 120 | O1234: 27 | P1234: 21 | Q1234: =O1234*6+P1234 -> 183 | S1234: PORT MELBOURNE
A1235: BRIGHTON | C1235: 1 | D1235: 3 | E1235: =C1235*6+D1235 -> 9 | G1235: 2 | H1235: 7 | I1235: =G1235*6+H1235 -> 19 | K1235: 3 | L1235: 7 | M1235: =K1235*6+L1235 -> 25 | O1235: 6 | P1235: 7 | Q1235: =O1235*6+P1235 -> 43 | S1235: CARDWELL
A1236: BEST PLAYERS
A1237: PORT MELBOURNE | C1237: ATKINSON | F1237: JOHNSON | I1237: MILLER | L1237: MURRAY | O1237: LEEHANE | Q1237: BONNETT
A1238: BRIGHTON | C1238: ALEXANDER | F1238: TOOHEY | I1238: BLACKMORE | L1238: C CONROY | O1238: RIDDELL | Q1238: HOWE
A1239: GOALKICKERS
A1240: PORT MELBOURNE | C1240: BONNETT 16 | F1240: ATKINSON 5 | I1240: STONE 5 | K1240: BRAGG
A1241: BRIGHTON | C1241: CRAIG 2 | F1241: POUND 2 | I1241: FREEMAN | K1241: CATHARD
A1243: ROUND 20 | E1243: 5TH SEPTEMBER | J1243: WEATHER | M1243: STRONG NORTH WEST GALE SUNNY | S1243: PLAYED AT
D1244: 1ST QTR | H1244: 2ND QTR | L1244: 3RD QTR | P1244: FINAL | S1244: COBURG
A1245: PRAHRAN | C1245: 2 | D1245: 0 | E1245: =C1245*6+D1245 -> 12 | G1245: 7 | H1245: 8 | I1245: =G1245*6+H1245 -> 50 | K1245: 9 | L1245: 11 | M1245: =K1245*6+L1245 -> 65 | O1245: 14 | P1245: 14 | Q1245: =O1245*6+P1245 -> 98 | S1245: UMPIRE | X1245: LADDER | AB1245: ROUND | AD1245: 20
A1246: COBURG | C1246: 5 | D1246: 8 | E1246: =C1246*6+D1246 -> 38 | G1246: 5 | H1246: 9 | I1246: =G1246*6+H1246 -> 39 | K1246: 7 | L1246: 14 | M1246: =K1246*6+L1246 -> 56 | O1246: 8 | P1246: 14 | Q1246: =O1246*6+P1246 -> 62 | S1246: IRVING
A1247: BEST PLAYERS | W1247: TEAM | X1247: W | Y1247: L | Z1247: D | AA1247: FOR | AB1247: AGST | AC1247: % | AD1247: PTS
A1248: PRAHRAN | C1248: YATES | F1248: H BOYD | I1248: KRUSE | K1248: MORONE | N1248: WALES | Q1248: C BOYD
A1249: COBURG | C1249: FITZPATRICK | F1249: MAHONEY | I1249: H WILKINSON | L1249: EVANS | N1249: WALKER | Q1249: FEWKES | W1249: PORT MELBOURNE | X1249: 18 | Y1249: 2 | Z1249: 0 | AA1249: 2052 | AB1249: 1047 | AC1249: 195.98853868194843 | AD1249: 72
A1250: GOALKICKERS | Q1250: KRUSE | W1250: WILLIAMSTOWN | X1250: 16 | Y1250: 3 | Z1250: 1 | AA1250: 1939 | AB1250: 1279 | AC1250: =(+AA1250/AB1250)*100 -> 151.60281469898359 | AD1250: 66
A1251: PRAHRAN | C1251: KINNABURGH 4 | F1251: WALSH 3 | I1251: HARVEY 2 | K1251: ELLIOTT | M1251: SHILLABEER | P1251: WALES | R1251: CAMPBELL | W1251: YARRAVILLE | X1251: 13 | Y1251: 5 | Z1251: 2 | AA1251: 1542 | AB1251: 1361 | AC1251: =(+AA1251/AB1251)*100 -> 113.2990448199853 | AD1251: 56
A1252: COBURG | C1252: H WILKINSON 5 | F1252: ROGAN 2 | I1252: JAMES | W1252: PRAHRAN | X1252: 13 | Y1252: 6 | Z1252: 1 | AA1252: 1745 | AB1252: 1403 | AC1252: 124.37633642195296 | AD1252: 54
A1254: PRESTON | C1254: 5 | D1254: 8 | E1254: =C1254*6+D1254 -> 38 | G1254: 5 | H1254: 8 | I1254: =G1254*6+H1254 -> 38 | K1254: 11 | L1254: 14 | M1254: =K1254*6+L1254 -> 80 | O1254: 11 | P1254: 14 | Q1254: =O1254*6+P1254 -> 80 | S1254: PRESTON | W1254: OAKLEIGH | X1254: 13 | Y1254: 6 | Z1254: 1 | AA1254: 1667 | AB1254: 1354 | AC1254: =(+AA1254/AB1254)*100 -> 123.11669128508125 | AD1254: 54
A1255: BRUNSWICK | C1255: 1 | D1255: 0 | E1255: =C1255*6+D1255 -> 6 | G1255: 6 | H1255: 12 | I1255: =G1255*6+H1255 -> 48 | K1255: 7 | L1255: 12 | M1255: =K1255*6+L1255 -> 54 | O1255: 10 | P1255: 15 | Q1255: =O1255*6+P1255 -> 75 | S1255: MILLER | W1255: COBURG | X1255: 12 | Y1255: 7 | Z1255: 1 | AA1255: 1682 | AB1255: 1413 | AC1255: =(+AA1255/AB1255)*100 -> 119.03750884642605 | AD1255: 50
A1256: BEST PLAYERS | W1256: BRUNSWICK | X1256: 10 | Y1256: 10 | Z1256: 0 | AA1256: 1383 | AB1256: 1384 | AC1256: 99.927745664739888 | AD1256: 40
A1257: PRESTON | C1257: PASCOE | F1257: SWEET | I1257: HAYES | K1257: LALOR | M1257: JEFFREY | P1257: McLACHLAN | W1257: MOORABBIN | X1257: 9 | Y1257: 10 | Z1257: 1 | AA1257: 1436 | AB1257: 1477 | AC1257: 97.224102911306701 | AD1257: 38
A1258: BRUNSWICK | C1258: SEYMOUR | F1258: PLANT | I1258: WEIR | K1258: LOVETT | M1258: YEA | P1258: STANLEY | W1258: PRESTON | X1258: 8 | Y1258: 12 | Z1258: 0 | AA1258: 1374 | AB1258: 1484 | AC1258: =(+AA1258/AB1258)*100 -> 92.587601078167111 | AD1258: 32
A1259: GOALKICKERS | W1259: BOX HILL | X1259: 7 | Y1259: 13 | Z1259: 0 | AA1259: 1371 | AB1259: 1703 | AC1259: =(+AA1259/AB1259)*100 -> 80.504991192014103 | AD1259: 28
A1260: PRESTON | C1260: PASCOE 3 | F1260: HAYES 3 | I1260: DEACON 2 | L1260: McLACHLAN 2 | P1260: JEFFREY | W1260: CAMBERWELL | X1260: 5 | Y1260: 14 | Z1260: 1 | AA1260: 1389 | AB1260: 1730 | AC1260: 80.289017341040463 | AD1260: 22
A1261: BRUNSWICK | C1261: CLUES 3 | F1261: STANLEY 2 | I1261: KALAF | K1261: SEYMOUR | M1261: WEIR | N1261: YEA | P1261: MULLENGER | W1261: NORTHCOTE | X1261: 5 | Y1261: 15 | Z1261: 0 | AA1261: 1311 | AB1261: 1482 | AC1261: 88.461538461538467 | AD1261: 20
W1262: SANDRINGHAM | X1262: 5 | Y1262: 15 | Z1262: 0 | AA1262: 1237 | AB1262: 2103 | AC1262: 58.820732287208749 | AD1262: 20
A1263: OAKLEIGH | C1263: 4 | D1263: 10 | E1263: =C1263*6+D1263 -> 34 | G1263: 5 | H1263: 11 | I1263: =G1263*6+H1263 -> 41 | K1263: 14 | L1263: 19 | M1263: =K1263*6+L1263 -> 103 | O1263: 15 | P1263: 23 | Q1263: =O1263*6+P1263 -> 113 | S1263: BOX HILL | W1263: BRIGHTON | X1263: 2 | Y1263: 18 | Z1263: 0 | AA1263: 1137 | AB1263: 2046 | AC1263: 55.571847507331377 | AD1263: 8
A1264: BOX HILL | C1264: 1 | D1264: 0 | E1264: =C1264*6+D1264 -> 6 | G1264: 6 | H1264: 4 | I1264: =G1264*6+H1264 -> 40 | K1264: 6 | L1264: 5 | M1264: =K1264*6+L1264 -> 41 | O1264: 7 | P1264: 8 | Q1264: =O1264*6+P1264 -> 50 | S1264: MERRINGTON
A1265: BEST PLAYERS
A1266: OAKLEIGH | C1266: W WILLIAMS | F1266: STREETER | I1266: VAINS | K1266: GUY | M1266: WALSH | P1266: CADMAN
A1267: BOX HILL | C1267: MORRIS | F1267: KRONK | I1267: IRVINE | K1267: LOVE | M1267: GIBB | P1267: H BLUNDY
A1268: GOALKICKERS
A1269: OAKLEIGH | C1269: STREETER 3 | F1269: GUY 2 | H1269: W WILLIAMS 2 | K1269: WALSH 2 | M1269: HILL 2 | O1269: EDWARDS | Q1269: LONIE | S1269: H WILLIAMS | V1269: CADMAN
A1270: BOX HILL | C1270: MORRIS 2 | F1270: O'CONNELL | I1270: WITHERDEN | L1270: TURNER | N1270: MORGAN | P1270: NODEN
A1272: SANDRINGHAM | C1272: 2 | D1272: 0 | E1272: =C1272*6+D1272 -> 12 | G1272: 9 | H1272: 5 | I1272: =G1272*6+H1272 -> 59 | K1272: 9 | L1272: 5 | M1272: =K1272*6+L1272 -> 59 | O1272: 16 | P1272: 7 | Q1272: =O1272*6+P1272 -> 103 | S1272: BEACH ROAD
A1273: MOORABBIN | C1273: 7 | D1273: 7 | E1273: =C1273*6+D1273 -> 49 | G1273: 8 | H1273: 8 | I1273: =G1273*6+H1273 -> 56 | K1273: 12 | L1273: 14 | M1273: =K1273*6+L1273 -> 86 | O1273: 12 | P1273: 16 | Q1273: =O1273*6+P1273 -> 88 | S1273: SMYTH
A1274: BEST PLAYERS
A1275: SANDRINGHAM | C1275: J WOODS | F1275: HISCOCK | I1275: RANSOM | K1275: GUTTERIDGE | N1275: BOURKE | Q1275: FLEMING
A1276: MOORABBIN | C1276: STANLEY | F1276: McKENZIE | I1276: COAD | K1276: LEHMANN | N1276: WALSH | Q1276: CHANDLER
A1277: GOALKICKERS
A1278: SANDRINGHAM | C1278: J WOODS 5 | F1278: HISCOCK 3 | I1278: BOURKE 3 | L1278: HARPER 2 | N1278: RANSOM | P1278: GISSING | R1278: FLEMING
A1279: MOORABBIN | C1279: COAD 3 | F1279: LEHMANN 2 | I1279: WALSH 2 | L1279: BIRTLES 2 | N1279: SUTHERLAND | Q1279: McKENZIE | T1279: N BAKER
A1281: PORT MELBOURNE | C1281: 8 | D1281: 9 | E1281: =C1281*6+D1281 -> 57 | G1281: 9 | H1281: 9 | I1281: =G1281*6+H1281 -> 63 | K1281: 17 | L1281: 18 | M1281: =K1281*6+L1281 -> 120 | O1281: 18 | P1281: 22 | Q1281: =O1281*6+P1281 -> 130 | S1281: CAMBERWELL
A1282: CAMBERWELL | C1282: 0 | D1282: 0 | E1282: =C1282*6+D1282 -> 0 | G1282: 3 | H1282: 5 | I1282: =G1282*6+H1282 -> 23 | K1282: 3 | L1282: 6 | M1282: =K1282*6+L1282 -> 24 | O1282: 6 | P1282: 9 | Q1282: =O1282*6+P1282 -> 45 | S1282: ROACH
A1283: BEST PLAYERS
A1284: PORT MELBOURNE | C1284: MURRAY | F1284: JOHNSON | I1284: STOREY | L1284: WALSH | N1284: LEEHANE | Q1284: MILLER
A1285: CAMBERWELL | C1285: HAYES | F1285: DUFF | I1285: WAIN | L1285: BOHAN | N1285: McFEE | Q1285: THYNNE
A1286: GOALKICKERS
A1287: PORT MELBOURNE | C1287: MURRAY 5 | F1287: STONE 3 | H1287: JOHNSON 3 | K1287: MILLER 2 | M1287: BRAGG | O1287: BONNETT | Q1287: OWENS | S1287: WALSH | U1287: CARIS
A1288: CAMBERWELL | C1288: FARRELL 2 | F1288: McFEE | H1288: DUFF | J1288: BOHAN | L1288: FILBY
A1290: NORTHCOTE | C1290: 4 | D1290: 2 | E1290: =C1290*6+D1290 -> 26 | G1290: 5 | H1290: 2 | I1290: =G1290*6+H1290 -> 32 | K1290: 10 | L1290: 4 | M1290: =K1290*6+L1290 -> 64 | O1290: 11 | P1290: 4 | Q1290: =O1290*6+P1290 -> 70 | S1290: NORTHCOTE
A1291: WILLIAMSTOWN | C1291: 0 | D1291: 3 | E1291: =C1291*6+D1291 -> 3 | G1291: 4 | H1291: 8 | I1291: =G1291*6+H1291 -> 32 | K1291: 4 | L1291: 12 | M1291: =K1291*6+L1291 -> 36 | O1291: 6 | P1291: 13 | Q1291: =O1291*6+P1291 -> 49 | S1291: CARDWELL
A1292: BEST PLAYERS
A1293: NORTHCOTE | C1293: PAWSEY | F1293: STABB | I1293: J VAINS | L1293: COLLINS | O1293: WALKER | R1293: McLAINE
A1294: WILLIAMSTOWN | C1294: W WILLIAMS | F1294: HARLEY | I1294: MARTIN | L1294: MUNDAY | O1294: SMITH | R1294: SHEAHAN
A1295: GOALKICKERS
A1296: NORTHCOTE | C1296: PAWSEY 3 | F1296: GIBBS 2 | H1296: J VAINS 2 | J1296: FRANCIS 2 | M1296: COLLINS | O1296: POWELL
A1297: WILLIAMSTOWN | C1297: DULLARD 2 | F1297: EVANS | H1297: SMITH | J1297: W WILLIAMS | M1297: SIMPSON
A1299: YARRAVILLE | C1299: 2 | D1299: 9 | E1299: =C1299*6+D1299 -> 21 | G1299: 6 | H1299: 11 | I1299: =G1299*6+H1299 -> 47 | K1299: 7 | L1299: 11 | M1299: =K1299*6+L1299 -> 53 | O1299: 16 | P1299: 15 | Q1299: =O1299*6+P1299 -> 111 | S1299: ELSTERNWICK PARK
A1300: BRIGHTON | C1300: 2 | D1300: 1 | E1300: =C1300*6+D1300 -> 13 | G1300: 2 | H1300: 9 | I1300: =G1300*6+H1300 -> 21 | K1300: 7 | L1300: 11 | M1300: =K1300*6+L1300 -> 53 | O1300: 7 | P1300: 13 | Q1300: =O1300*6+P1300 -> 55 | S1300: MULLETT
A1301: BEST PLAYERS
A1302: YARRAVILLE | C1302: WAGHORNE | F1302: VANDERFEEN | I1302: COOK | L1302: MARCHESI | O1302: SEITZ | R1302: GWYNN
A1303: BRIGHTON | C1303: ALEXANDER | F1303: WOOD | I1303: CURRIE | L1303: BOWLES | O1303: BLACKMORE | R1303: STEVENS
A1304: GOALKICKERS
A1305: YARRAVILLE | C1305: WAGHORNE 4 | F1305: VANDERFEEN 3 | J1305: COOK 2 | L1305: H MASON 2 | O1305: MARCHESI 2 | R1305: SEITZ | T1305: N ROHLEDER | X1305: BODSWORTH
A1306: BRIGHTON | C1306: POUND 2 | F1306: ALEXANDER 2 | J1306: CURRIE 2 | M1306: STEVENS
A1308: FINALS
A1309: 1ST SEMI | D1309: 12TH SEPTEMBER | J1309: WEATHER | M1309: FINE
D1310: 1ST QTR | H1310: 2ND QTR | L1310: 3RD QTR | P1310: FINAL
A1311: YARRAVILLE | C1311: 3 | D1311: 3 | E1311: =C1311*6+D1311 -> 21 | G1311: 4 | H1311: 8 | I1311: =G1311*6+H1311 -> 32 | K1311: 7 | L1311: 15 | M1311: =K1311*6+L1311 -> 57 | O1311: 8 | P1311: 16 | Q1311: =O1311*6+P1311 -> 64 | S1311: JUNCTION OVAL
A1312: PRAHRAN | C1312: 3 | D1312: 2 | E1312: =C1312*6+D1312 -> 20 | G1312: 6 | H1312: 2 | I1312: =G1312*6+H1312 -> 38 | K1312: 9 | L1312: 3 | M1312: =K1312*6+L1312 -> 57 | O1312: 9 | P1312: 7 | Q1312: =O1312*6+P1312 -> 61 | S1312: IRVING
A1313: BEST PLAYERS
A1314: YARRAVILLE | C1314: NICHOLLS | F1314: SEITZ | I1314: COOK | K1314: N ROHLEDER | N1314: GWYNN | P1314: BERRY
A1315: PRAHRAN | C1315: KRUSE | F1315: KINNABURGH | I1315: JONES | K1315: YATES | N1315: WALSH | P1315: PLAIN
A1316: GOALKICKERS
A1317: YARRAVILLE | C1317: SMALLWOOD 3 | F1317: WAGHORNE 2 | I1317: N ROHLEDER 2 | L1317: MARCHESI
A1318: PRAHRAN | C1318: KINNABURGH 5 | F1318: O'BRYAN | I1318: HARVEY | K1318: ELLIOTT | M1318: KRUSE
A1320: 2ND SEMI | E1320: 19TH SEPTEMBER | J1320: WEATHER | N1320: SOUTH WIND RAIN GROUND HEAVY
A1321: PORT MELBOURNE | C1321: 4 | D1321: 3 | E1321: =C1321*6+D1321 -> 27 | G1321: 7 | H1321: 8 | I1321: =G1321*6+H1321 -> 50 | K1321: 9 | L1321: 10 | M1321: =K1321*6+L1321 -> 64 | O1321: 12 | P1321: 14 | Q1321: =O1321*6+P1321 -> 86 | S1321: JUNCTION OVAL
A1322: WILLIAMSTOWN | C1322: 3 | D1322: 0 | E1322: =C1322*6+D1322 -> 18 | G1322: 5 | H1322: 2 | I1322: =G1322*6+H1322 -> 32 | K1322: 9 | L1322: 3 | M1322: =K1322*6+L1322 -> 57 | O1322: 12 | P1322: 4 | Q1322: =O1322*6+P1322 -> 76 | S1322: IRVING
A1323: BEST PLAYERS
A1324: PORT MELBOURNE | C1324: MILLER | F1324: STOREY | I1324: WILSON | K1324: WOODBRIDGE | N1324: BRAGG | P1324: ATKINSON
A1325: WILLIAMSTOWN | C1325: W WILLIAMS | F1325: LINTON | I1325: SIMPSON | K1325: G WILLIAMS | N1325: CURRAN | P1325: CALLAHAN
A1326: GOALKICKERS
A1327: PORT MELBOURNE | C1327: MILLER 4 | F1327: BONNETT 4 | I1327: WALSH | K1327: FRASER | M1327: OWENS | O1327: BRAGG
A1328: WILLIAMSTOWN | C1328: W WILLIAMS 4 | F1328: LINTON 4 | I1328: WALKER | K1328: GRAHAM | M1328: SMITH | O1328: DULLARD
A1330: PRELIMINARY FINAL | F1330: 26TH SEPTEMBER | K1330: WEATHER | M1330: SOUTH EAST BREEZE SUNNY
A1331: YARRAVILLE | C1331: 1 | D1331: 7 | E1331: =C1331*6+D1331 -> 13 | G1331: 4 | H1331: 7 | I1331: =G1331*6+H1331 -> 31 | K1331: 10 | L1331: 10 | M1331: =K1331*6+L1331 -> 70 | O1331: 12 | P1331: 11 | Q1331: =O1331*6+P1331 -> 83 | S1331: JUNCTION OVAL
A1332: WILLIAMSTOWN | C1332: 2 | D1332: 3 | E1332: =C1332*6+D1332 -> 15 | G1332: 4 | H1332: 9 | I1332: =G1332*6+H1332 -> 33 | K1332: 7 | L1332: 12 | M1332: =K1332*6+L1332 -> 54 | O1332: 11 | P1332: 13 | Q1332: =O1332*6+P1332 -> 79 | S1332: IRVING
A1333: BEST PLAYERS
A1334: YARRAVILLE | C1334: R SMITH | F1334: TAYLOR | I1334: SALT | L1334: MARCHESI | O1334: GWYNN | R1334: VANDERFEEN
A1335: WILLIAMSTOWN | C1335: SIMPSON | F1335: LINTON | I1335: W WILLIAMS | L1335: MUNDAY | O1335: MARTIN | R1335: SHEAHAN
A1336: GOALKICKERS
A1337: YARRAVILLE | C1337: MARCHESI 4 | F1337: R SMITH 3 | I1337: SALT 2 | K1337: H MASON | M1337: BODSWORTH | P1337: WAGHORNE
A1338: WILLIAMSTOWN | C1338: W WILLIAMS 5 | F1338: SIMPSON 2 | I1338: GRAHAM | K1338: SMITH | M1338: LINTON | O1338: DULLARD
A1340: GRAND FINAL | F1340: 3RD OCTOBER | J1340: WEATHER | N1340: NORTH WEST WIND FINE
A1341: PORT MELBOURNE | C1341: 2 | D1341: 4 | E1341: 16 | G1341: 7 | H1341: 9 | I1341: 51 | K1341: 12 | L1341: 10 | M1341: 82 | O1341: 21 | P1341: 15 | Q1341: =O1341*6+P1341 -> 141 | S1341: JUNCTION OVAL
A1342: YARRAVILLE | C1342: 2 | D1342: 2 | E1342: 14 | G1342: 3 | H1342: 5 | I1342: 23 | K1342: 9 | L1342: 8 | M1342: 62 | O1342: 12 | P1342: 9 | Q1342: =O1342*6+P1342 -> 81 | S1342: IRVING
A1343: BEST PLAYERS
A1344: PORT MELBOURNE | C1344: JOHNSON | F1344: FRASER | I1344: KELSEY | L1344: WHARTON | O1344: WALSH | Q1344: MILLER
A1345: YARRAVILLE | C1345: TAYLOR | F1345: SALT | I1345: J ROHLEDER | L1345: H MASON | O1345: COOK | Q1345: N ROHLEDER
A1346: GOALKICKERS
A1347: PORT MELBOURNE | C1347: FRASER 7 | F1347: BONNETT 6 | I1347: MILLER 2 | L1347: MURRAY 2 | N1347: OWENS | P1347: LAFFEY | R1347: BRAGG | T1347: ATKINSON
A1348: YARRAVILLE | C1348: SALT 3 | F1348: SMALLWOOD 3 | J1348: H MASON 2 | M1348: N ROHLEDER 2 | P1348: MARCHESI 2