A1: Victorian Football Association
A2: Season 1954
A3: © Copyright Wal Williams | F3: First created: 2 November 2014
A4: Contact: joywalwi at gmail dot com | F4: Last updated: 27 January 2018 | W4: VFA Results and tables - Link to the main index page
A5: You are free to copy this document in whole or part provided that proper acknowledgement is given to the author. All rights reserved.
A7: YEAR 1954
A8: ROUND 1 | D8: 17TH APRIL | G8: EASTER SATURDAY | K8: WEATHER | N8: DULL COOL | S8: PLAYED AT
D9: 1ST QTR | H9: 2ND QTR | L9: 3RD QTR | P9: FINAL | S9: OAKLEIGH
A10: OAKLEIGH | C10: 3 | D10: 4 | E10: =C10*6+D10 -> 22 | G10: 10 | H10: 6 | I10: =G10*6+H10 -> 66 | K10: 12 | L10: 9 | M10: =K10*6+L10 -> 81 | O10: 13 | P10: 12 | Q10: =O10*6+P10 -> 90 | S10: UMPIRE | X10: LADDER | AB10: ROUND | AD10: 1
A11: MOORABBIN | C11: 5 | D11: 3 | E11: =C11*6+D11 -> 33 | G11: 5 | H11: 5 | I11: =G11*6+H11 -> 35 | K11: 9 | L11: 5 | M11: =K11*6+L11 -> 59 | O11: 13 | P11: 12 | Q11: =O11*6+P11 -> 90 | S11: MILLER
A12: BEST PLAYERS | W12: TEAM | X12: W | Y12: L | Z12: D | AA12: FOR | AB12: AGST | AC12: % | AD12: PTS
A13: OAKLEIGH | C13: HILL | F13: JACKSON | I13: EDWARDS | L13: WEBSTER | O13: SAVORY | Q13: BAPTIST
A14: MOORABBIN | C14: McKENZIE | F14: WALSH | I14: BOYD | L14: LEHMANN | O14: STANLEY | Q14: WICKS | W14: BRIGHTON | X14: 1 | Y14: 0 | Z14: 0 | AA14: 104 | AB14: 51 | AC14: 203.92156862745097 | AD14: 4
A15: GOALKICKERS | W15: BRUNSWICK | X15: 1 | Y15: 0 | Z15: 0 | AA15: 82 | AB15: 51 | AC15: 160.78431372549019 | AD15: 4
A16: OAKLEIGH | C16: WEBSTER 7 | F16: WALSH 2 | I16: WATSON | K16: EDWARDS | M16: SCULLIN | O16: KIGHT | W16: WILLIAMSTOWN | X16: 1 | Y16: 0 | Z16: 0 | AA16: 72 | AB16: 52 | AC16: 138.46153846153845 | AD16: 4
A17: MOORABBIN | C17: WALSH 3 | E17: RENWICK 2 | H17: N BAKER 2 | K17: WICKS 2 | M17: CLOVER | O17: BOYD | Q17: MORONEY | S17: LEHMANN | W17: BOX HILL | X17: 1 | Y17: 0 | Z17: 0 | AA17: 101 | AB17: 74 | AC17: 136.48648648648648 | AD17: 4
A19: PORT MELBOURNE | C19: 5 | D19: 3 | E19: =C19*6+D19 -> 33 | G19: 8 | H19: 6 | I19: =G19*6+H19 -> 54 | K19: 15 | L19: 9 | M19: =K19*6+L19 -> 99 | O19: 18 | P19: 14 | Q19: =O19*6+P19 -> 122 | S19: TOORAK PARK | W19: NORTHCOTE | X19: 1 | Y19: 0 | Z19: 0 | AA19: 76 | AB19: 62 | AC19: 122.58064516129032 | AD19: 4
A20: PRAHRAN | C20: 3 | D20: 3 | E20: =C20*6+D20 -> 21 | G20: 8 | H20: 6 | I20: =G20*6+H20 -> 54 | K20: 11 | L20: 7 | M20: =K20*6+L20 -> 73 | O20: 15 | P20: 10 | Q20: =O20*6+P20 -> 100 | S20: ROACH | W20: PORT MELBOURNE | X20: 1 | Y20: 0 | Z20: 0 | AA20: 122 | AB20: 100 | AC20: 122 | AD20: 4
A21: BEST PLAYERS | W21: OAKLEIGH | X21: 0 | Y21: 0 | Z21: 1 | AA21: 90 | AB21: 90 | AC21: 100 | AD21: 2
A22: PORT MELBOURNE | C22: MILLER | F22: JOHNSON | I22: WILSON | L22: WALSH | N22: OWENS | Q22: KELSEY | W22: MOORABBIN | X22: 0 | Y22: 0 | Z22: 1 | AA22: 90 | AB22: 90 | AC22: 100 | AD22: 2
A23: PRAHRAN | C23: KRUSE | F23: WALES | I23: CAMPBELL | L23: HARVEY | N23: ELLIOTT | Q23: J JONES | W23: PRAHRAN | X23: 0 | Y23: 1 | Z23: 0 | AA23: 100 | AB23: 122 | AC23: 81.967213114754102 | AD23: 0
A24: GOALKICKERS | R24: ATKINSON | W24: PRESTON | X24: 0 | Y24: 1 | Z24: 0 | AA24: 62 | AB24: 76 | AC24: 81.578947368421055 | AD24: 0
A25: PORT MELBOURNE | C25: MILLER 5 | E25: BONNETT 3 | H25: WALSH 3 | J25: JOHNSON 2 | M25: OWENS | O25: STOREY | Q25: TUCKER | S25: FRASER | W25: CAMBERWELL | X25: 0 | Y25: 1 | Z25: 0 | AA25: 74 | AB25: 101 | AC25: 73.267326732673268 | AD25: 0
A26: PRAHRAN | C26: KINNABURGH 4 | F26: ELLIOTT 4 | I26: KRUSE 3 | K26: O'BRYAN | M26: WALSH | O26: C BOYD | Q26: CLEAR | W26: YARRAVILLE | X26: 0 | Y26: 1 | Z26: 0 | AA26: 52 | AB26: 72 | AC26: 72.222222222222229 | AD26: 0
W27: COBURG | X27: 0 | Y27: 1 | Z27: 0 | AA27: 51 | AB27: 82 | AC27: 62.195121951219512 | AD27: 0
A28: BOX HILL | C28: 2 | D28: 2 | E28: =C28*6+D28 -> 14 | G28: 9 | H28: 5 | I28: =G28*6+H28 -> 59 | K28: 12 | L28: 13 | M28: =K28*6+L28 -> 85 | O28: 14 | P28: 17 | Q28: =O28*6+P28 -> 101 | S28: BOX HILL | W28: SANDRINGHAM | X28: 0 | Y28: 1 | Z28: 0 | AA28: 51 | AB28: 104 | AC28: 49.03846153846154 | AD28: 0
A29: CAMBERWELL | C29: 3 | D29: 5 | E29: =C29*6+D29 -> 23 | G29: 6 | H29: 9 | I29: =G29*6+H29 -> 45 | K29: 10 | L29: 12 | M29: =K29*6+L29 -> 72 | O29: 10 | P29: 14 | Q29: =O29*6+P29 -> 74 | S29: CARDWELL
A30: BEST PLAYERS
A31: BOX HILL | C31: HOUGHTON | F31: MORRIS | I31: TURNER | L31: GREEN | O31: ABBOTT | R31: RATTRAY
A32: CAMBERWELL | C32: McFEE | F32: BLACK | I32: CLARK | L32: McGUINNESS | O32: FLETCHER | R32: ALLSOP
A33: GOALKICKERS
A34: BOX HILL | C34: MORRIS 5 | F34: TURNER 3 | I34: ABBOTT 3 | L34: ALLEN 2 | O34: HOUGHTON
A35: CAMBERWELL | C35: LYNCH 3 | F35: McFEE 3 | I35: ALLSOP | K35: DENNION | M35: DUFF | O35: CLARK
E36: 19TH APRIL | J36: EASTER MONDAY | Q36: WEATHER | U36: FINE WARM
A37: BRIGHTON | C37: 4 | D37: 7 | E37: =C37*6+D37 -> 31 | G37: 6 | H37: 9 | I37: =G37*6+H37 -> 45 | K37: 11 | L37: 15 | M37: =K37*6+L37 -> 81 | O37: 14 | P37: 20 | Q37: =O37*6+P37 -> 104 | S37: BEACH ROAD
A38: SANDRINGHAM | C38: 2 | D38: 3 | E38: =C38*6+D38 -> 15 | G38: 5 | H38: 6 | I38: =G38*6+H38 -> 36 | K38: 5 | L38: 6 | M38: =K38*6+L38 -> 36 | O38: 7 | P38: 9 | Q38: =O38*6+P38 -> 51 | S38: RICHARDSON
A39: BEST PLAYERS
A40: BRIGHTON | C40: ALEXANDER | F40: BURRELL | I40: EMBLETON | L40: BLACKMORE | O40: O'MEARA | Q40: BURKE
A41: SANDRINGHAM | C41: SECCOMBE | F41: CLAYTON | I41: J WOODS | L41: CROFT | O41: RUSSO | Q41: HANKINSON
A42: GOALKICKERS
A43: BRIGHTON | C43: EMBLETON 3 | F43: POUND 3 | I43: BURKE 2 | K43: CRAIG 2 | M43: COOPER | O43: O'MEARA | Q43: KENNEDY | S43: COOK
A44: SANDRINGHAM | C44: HARPER 4 | F44: CLAYTON 2 | I44: MILLER
A46: BRUNSWICK | C46: 2 | D46: 4 | E46: =C46*6+D46 -> 16 | G46: 6 | H46: 5 | I46: =G46*6+H46 -> 41 | K46: 11 | L46: 5 | M46: =K46*6+L46 -> 71 | O46: 12 | P46: 10 | Q46: =O46*6+P46 -> 82 | S46: COBURG
A47: COBURG | C47: 2 | D47: 0 | E47: =C47*6+D47 -> 12 | G47: 6 | H47: 2 | I47: =G47*6+H47 -> 38 | K47: 7 | L47: 8 | M47: =K47*6+L47 -> 50 | O47: 7 | P47: 9 | Q47: =O47*6+P47 -> 51 | S47: SMYTH
A48: BEST PLAYERS
A49: BRUNSWICK | C49: McFARLANE | F49: WEIR | I49: SEYMOUR | L49: YOUNG | N49: CLUES | Q49: LEYDEN
A50: COBURG | C50: CONDON | F50: McDONALD | I50: MAHONEY | L50: FEWKES | N50: WALKER | Q50: SPARKS
A51: GOALKICKERS
A52: BRUNSWICK | C52: HAYES 3 | E52: CLUES 2 | G52: LOVETT 2 | I52: WEIR 2 | K52: SEYMOUR | M52: MULLENGER | P52: LEYDEN
A53: COBURG | C53: McDONALD 5 | F53: ROGAN | H53: McCOLL
A55: NORTHCOTE | C55: 3 | D55: 2 | E55: =C55*6+D55 -> 20 | G55: 5 | H55: 3 | I55: =G55*6+H55 -> 33 | K55: 9 | L55: 5 | M55: =K55*6+L55 -> 59 | O55: 11 | P55: 10 | Q55: =O55*6+P55 -> 76 | S55: NORTHCOTE
A56: PRESTON | C56: 3 | D56: 4 | E56: =C56*6+D56 -> 22 | G56: 6 | H56: 6 | I56: =G56*6+H56 -> 42 | K56: 7 | L56: 11 | M56: =K56*6+L56 -> 53 | O56: 8 | P56: 14 | Q56: =O56*6+P56 -> 62 | S56: MALLETT
A57: BEST PLAYERS
A58: NORTHCOTE | C58: WALKER | F58: WOOLNOUGH | I58: HISCOX | L58: POWELL | N58: FRANCIS | Q58: COLLINS
A59: PRESTON | C59: SWEET | F59: CROCKER | I59: F CHARD | L59: COOPER | N59: BRADFORD | Q59: McLACHLAN
A60: GOALKICKERS
A61: NORTHCOTE | C61: FRANCIS 5 | F61: COLLINS 2 | I61: BINNS 2 | K61: SEARLE | M61: DENEHY
A62: PRESTON | C62: F CHARD 6 | F62: BATEMAN | I62: LALOR
A64: WILLIAMSTOWN | C64: 1 | D64: 9 | E64: =C64*6+D64 -> 15 | G64: 3 | H64: 14 | I64: =G64*6+H64 -> 32 | K64: 5 | L64: 16 | M64: =K64*6+L64 -> 46 | O64: 9 | P64: 18 | Q64: =O64*6+P64 -> 72 | S64: WILLIAMSTOWN
A65: YARRAVILLE | C65: 2 | D65: 5 | E65: =C65*6+D65 -> 17 | G65: 2 | H65: 8 | I65: =G65*6+H65 -> 20 | K65: 3 | L65: 9 | M65: =K65*6+L65 -> 27 | O65: 7 | P65: 10 | Q65: =O65*6+P65 -> 52 | S65: IRVING
A66: BEST PLAYERS
A67: WILLIAMSTOWN | C67: CALLAHAN | F67: MUNDAY | I67: HARLEY | K67: LINTON | N67: RAMSAY | Q67: TAAFE
A68: YARRAVILLE | C68: J ROHLEDER | F68: VANDERFEEN | I68: WILD | K68: HARGREAVES | N68: HART | Q68: MARCHESI
A69: GOALKICKERS
A70: WILLIAMSTOWN | C70: WALKER 3 | F70: LINTON 2 | I70: TAYLOR 2 | L70: SIMS | N70: KENT
A71: YARRAVILLE | C71: MARCHESI 2 | F71: K SMITH | I71: SEITZ | K71: HARGREAVES | N71: BERRY | P71: HART
A73: ROUND 2 | E73: 24TH APRIL | J73: WEATHER | M73: STRONG NORTH WEST WIND DULL | S73: PLAYED AT
D74: 1ST QTR | H74: 2ND QTR | L74: 3RD QTR | P74: FINAL | S74: BRUNSWICK
A75: BRUNSWICK | C75: 3 | D75: 4 | E75: =C75*6+D75 -> 22 | G75: 3 | H75: 5 | I75: =G75*6+H75 -> 23 | K75: 8 | L75: 10 | M75: =K75*6+L75 -> 58 | O75: 13 | P75: 11 | Q75: =O75*6+P75 -> 89 | S75: UMPIRE | X75: LADDER | AB75: ROUND | AD75: 2
A76: NORTHCOTE | C76: 1 | D76: 1 | E76: =C76*6+D76 -> 7 | G76: 5 | H76: 7 | I76: =G76*6+H76 -> 37 | K76: 5 | L76: 9 | M76: =K76*6+L76 -> 39 | O76: 8 | P76: 16 | Q76: =O76*6+P76 -> 64 | S76: ROACH
A77: BEST PLAYERS | W77: TEAM | X77: W | Y77: L | Z77: D | AA77: FOR | AB77: AGST | AC77: % | AD77: PTS
A78: BRUNSWICK | C78: MULLENGER | F78: LOVETT | I78: HAYES | L78: CLUES | N78: RAGG | Q78: LEYDEN
A79: NORTHCOTE | C79: J VAINS | F79: HISCOX | I79: FRANCIS | L79: HOLT | N79: WOOLNOUGH | Q79: WILLIAMSON | W79: BOX HILL | X79: 2 | Y79: 0 | Z79: 0 | AA79: 271 | AB79: 123 | AC79: 220.32520325203251 | AD79: 8
A80: GOALKICKERS | W80: WILLIAMSTOWN | X80: 2 | Y80: 0 | Z80: 0 | AA80: 183 | AB80: 115 | AC80: 159.13043478260869 | AD80: 8
A81: BRUNSWICK | C81: HAYES 5 | F81: CLUES 5 | I81: LOVETT 2 | L81: SEYMOUR | W81: BRIGHTON | X81: 2 | Y81: 0 | Z81: 0 | AA81: 188 | AB81: 124 | AC81: 151.61290322580646 | AD81: 8
A82: NORTHCOTE | C82: J VAINS 2 | F82: POWELL | H82: FRANCIS | J82: WILLIAMSON | M82: MURPHY | O82: CRAWLEY | Q82: BINNS | W82: BRUNSWICK | X82: 2 | Y82: 0 | Z82: 0 | AA82: 171 | AB82: 115 | AC82: 148.69565217391303 | AD82: 8
A84: PRESTON | C84: 1 | D84: 1 | E84: =C84*6+D84 -> 7 | G84: 4 | H84: 5 | I84: =G84*6+H84 -> 29 | K84: 7 | L84: 7 | M84: =K84*6+L84 -> 49 | O84: 11 | P84: 8 | Q84: =O84*6+P84 -> 74 | S84: PRESTON | W84: PORT MELBOURNE | X84: 2 | Y84: 0 | Z84: 0 | AA84: 224 | AB84: 156 | AC84: 143.58974358974359 | AD84: 8
A85: OAKLEIGH | C85: 1 | D85: 5 | E85: =C85*6+D85 -> 11 | G85: 4 | H85: 6 | I85: =G85*6+H85 -> 30 | K85: 6 | L85: 10 | M85: =K85*6+L85 -> 46 | O85: 9 | P85: 10 | Q85: =O85*6+P85 -> 64 | S85: CARDWELL | W85: YARRAVILLE | X85: 1 | Y85: 1 | Z85: 0 | AA85: 155 | AB85: 120 | AC85: 129.16666666666666 | AD85: 4
A86: BEST PLAYERS | W86: PRESTON | X86: 1 | Y86: 1 | Z86: 0 | AA86: 136 | AB86: 140 | AC86: 97.142857142857139 | AD86: 4
A87: PRESTON | C87: HENRYS | F87: OSBORNE | I87: FOLEY | K87: CROCKER | N87: BRADFORD | Q87: BATEMAN | W87: NORTHCOTE | X87: 1 | Y87: 1 | Z87: 0 | AA87: 140 | AB87: 151 | AC87: 92.715231788079464 | AD87: 4
A88: OAKLEIGH | C88: GUY | F88: BOURKE | I88: HILL | K88: SAVORY | N88: WATSON | Q88: TINDAL | W88: OAKLEIGH | X88: 0 | Y88: 1 | Z88: 1 | AA88: 154 | AB88: 164 | AC88: 93.902439024390247 | AD88: 2
A89: GOALKICKERS | W89: MOORABBIN | X89: 0 | Y89: 1 | Z89: 1 | AA89: 138 | AB89: 193 | AC89: 71.502590673575128 | AD89: 2
A90: PRESTON | C90: LALOR 2 | F90: F CHARD 2 | I90: FOLEY 2 | K90: HARVEY | M90: BRADFORD | O90: COOPER | Q90: MOORE | S90: BATEMAN | W90: PRAHRAN | X90: 0 | Y90: 2 | Z90: 0 | AA90: 173 | AB90: 206 | AC90: 83.980582524271838 | AD90: 0
A91: OAKLEIGH | C91: WATSON 5 | F91: EDWRADS | I91: GARRETT | K91: SHAW | W91: CAMBERWELL | X91: 0 | Y91: 2 | Z91: 0 | AA91: 137 | AB91: 212 | AC91: 64.622641509433961 | AD91: 0
W92: COBURG | X92: 0 | Y92: 2 | Z92: 0 | AA92: 107 | AB92: 184 | AC92: 58.152173913043477 | AD92: 0
A93: BRIGHTON | C93: 2 | D93: 9 | E93: =C93*6+D93 -> 21 | G93: 6 | H93: 9 | I93: =G93*6+H93 -> 45 | K93: 11 | L93: 12 | M93: =K93*6+L93 -> 78 | O93: 12 | P93: 12 | Q93: =O93*6+P93 -> 84 | S93: ELSTERNWICK PARK | W93: SANDRINGHAM | X93: 0 | Y93: 2 | Z93: 0 | AA93: 100 | AB93: 274 | AC93: 36.496350364963504 | AD93: 0
A94: PRAHRAN | C94: 2 | D94: 1 | E94: =C94*6+D94 -> 13 | G94: 8 | H94: 4 | I94: =G94*6+H94 -> 52 | K94: 9 | L94: 6 | M94: =K94*6+L94 -> 60 | O94: 10 | P94: 13 | Q94: =O94*6+P94 -> 73 | S94: SMYTH
A95: BEST PLAYERS
A96: BRIGHTON | C96: ALEXANDER | F96: BLACKMORE | I96: TURNER | L96: DAVIDSON | O96: READ | Q96: JOSTLEAR
A97: PRAHRAN | C97: KRUSE | F97: YATES | I97: CLEAR | L97: PLAIN | O97: WALSH | Q97: HARVEY
A98: GOALKICKERS
A99: BRIGHTON | C99: ALEXANDER 4 | F99: KENNEDY 4 | I99: BURKE 2 | L99: REES | N99: POUND
A100: PRAHRAN | C100: KINNABURGH 4 | F100: O'BRYAN 2 | I100: HARVEY 2 | L100: WALSH | N100: ARMSTRONG
A102: YARRAVILLE | C102: 5 | D102: 6 | E102: =C102*6+D102 -> 36 | G102: 8 | H102: 7 | I102: =G102*6+H102 -> 55 | K102: 10 | L102: 10 | M102: =K102*6+L102 -> 70 | O102: 15 | P102: 13 | Q102: =O102*6+P102 -> 103 | S102: YARRAVILLE
A103: MOORABBIN | C103: 0 | D103: 0 | E103: =C103*6+D103 -> 0 | G103: 3 | H103: 0 | I103: =G103*6+H103 -> 18 | K103: 6 | L103: 1 | M103: =K103*6+L103 -> 37 | O103: 7 | P103: 6 | Q103: =O103*6+P103 -> 48 | S103: MALLETT
A104: BEST PLAYERS
A105: YARRAVILLE | C105: TREBILCOCK | F105: J ROHLEDER | I105: VANDERFEEN | L105: SEITZ | N105: HART | Q105: SALT
A106: MOORABBIN | C106: McKENZIE | F106: CLOVER | I106: MURPHY | L106: STANLEY | N106: LEHMANN | Q106: SCANLAN
A107: GOALKICKERS
A108: YARRAVILLE | C108: TREBILCOCK 7 | F108: SALT 2 | H108: WILD | J108: N ROHLEDER | M108: BERRY | O108: MARCHESI | Q108: PEVITT | S108: HART
A109: MOORABBIN | C109: SCHOFIELD 3 | F109: N BAKER 2 | I109: CLOVER | K109: FURZER
A111: WILLIAMSTOWN | C111: 4 | D111: 0 | E111: =C111*6+D111 -> 24 | G111: 8 | H111: 5 | I111: =G111*6+H111 -> 53 | K111: 10 | L111: 9 | M111: =K111*6+L111 -> 69 | O111: 16 | P111: 15 | Q111: =O111*6+P111 -> 111 | S111: CAMBERWELL
A112: CAMBERWELL | C112: 2 | D112: 4 | E112: =C112*6+D112 -> 16 | G112: 4 | H112: 5 | I112: =G112*6+H112 -> 29 | K112: 4 | L112: 7 | M112: =K112*6+L112 -> 31 | O112: 9 | P112: 9 | Q112: =O112*6+P112 -> 63 | S112: RICHARDSON
A113: BEST PLAYERS
A114: WILLIAMSTOWN | C114: WALKER | F114: LINTON | I114: TAYLOR | L114: MARTINI | N114: TAAFE | Q114: MARTIN
A115: CAMBERWELL | C115: McGUINNESS | F115: McFEE | I115: ALLSOP | L115: BLACK | N115: CUNNINGHAM | Q115: SKALBERG
A116: GOALKICKERS
A117: WILLIAMSTOWN | C117: WALKER 8 | F117: LINTON 3 | I117: TAYLOR 2 | L117: MARTIN | N117: KENT | P117: CALLAHAN
A118: CAMBERWELL | C118: McGUINNESS 4 | F118: ALLSOP | H118: McFEE | J118: McCOMB | M118: HOLYOAK | O118: BURR
A120: PORT MELBOURNE | C120: 3 | D120: 2 | E120: =C120*6+D120 -> 20 | G120: 8 | H120: 16 | I120: =G120*6+H120 -> 64 | K120: 8 | L120: 17 | M120: =K120*6+L120 -> 65 | O120: 13 | P120: 24 | Q120: =O120*6+P120 -> 102 | S120: PORT MELBOURNE
A121: COBURG | C121: 2 | D121: 2 | E121: =C121*6+D121 -> 14 | G121: 3 | H121: 3 | I121: =G121*6+H121 -> 21 | K121: 6 | L121: 13 | M121: =K121*6+L121 -> 49 | O121: 7 | P121: 14 | Q121: =O121*6+P121 -> 56 | S121: IRVING
A122: BEST PLAYERS
A123: PORT MELBOURNE | C123: WILSON | F123: KELSEY | I123: MILLER | L123: JOHNSON | O123: SHANNON | R123: BRAGG
A124: COBURG | C124: STARBUCK | F124: FEWKES | I124: CONDON | L124: H WILKINSON | O124: MAHONEY | R124: SHORT
A125: GOALKICKERS
A126: PORT MELBOURNE | C126: MILLER 3 | F126: WALSH 2 | I126: HAMMOND 2 | L126: BRAGG 2 | N126: ATKINSON 2 | Q126: JOHNSON | S126: OWENS
A127: COBURG | C127: H WILKINSON 3 | F127: McDONALD 2 | I127: McTAGGART | L127: HEWES
A129: BOX HILL | C129: 8 | D129: 6 | E129: =C129*6+D129 -> 54 | G129: 13 | H129: 8 | I129: =G129*6+H129 -> 86 | K129: 20 | L129: 13 | M129: =K129*6+L129 -> 133 | O129: 25 | P129: 20 | Q129: =O129*6+P129 -> 170 | S129: BOX HILL
A130: SANDRINGHAM | C130: 1 | D130: 1 | E130: =C130*6+D130 -> 7 | G130: 5 | H130: 4 | I130: =G130*6+H130 -> 34 | K130: 5 | L130: 6 | M130: =K130*6+L130 -> 36 | O130: 7 | P130: 7 | Q130: =O130*6+P130 -> 49 | S130: MILLER
A131: BEST PLAYERS
A132: BOX HILL | C132: WRIGHT | F132: HOUGHTON | I132: IRVINE | L132: MORRIS | O132: CALDWELL | R132: TURNER
A133: SANDRINGHAM | C133: GOODES | F133: RUSSO | I133: JONES | L133: SHEARS | O133: RANSOM | R133: HANKINSON
A134: GOALKICKERS
A135: BOX HILL | C135: MORRIS 10 | F135: TURNER 4 | I135: BEDFORD 3 | L135: ALLEN 3 | N135: ABBOTT 2 | Q135: STREET | S135: GREEN | U135: GASCOYNE
A136: SANDRINGHAM | C136: HARPER 3 | F136: MOLLOY | I136: L WOODS | L136: CROFT | N136: BEACH
A138: ROUND 3 | E138: 1ST MAY | J138: WEATHER | M138: DULL RAIN 1ST QUARTER | S138: PLAYED AT
D139: 1ST QTR | H139: 2ND QTR | L139: 3RD QTR | P139: FINAL | S139: WILLIAMSTOWN
A140: WILLIAMSTOWN | C140: 1 | D140: 4 | E140: =C140*6+D140 -> 10 | G140: 6 | H140: 8 | I140: =G140*6+H140 -> 44 | K140: 8 | L140: 12 | M140: =K140*6+L140 -> 60 | O140: 13 | P140: 20 | Q140: =O140*6+P140 -> 98 | S140: UMPIRE | X140: LADDER | AB140: ROUND | AD140: 3
A141: BRIGHTON | C141: 1 | D141: 2 | E141: =C141*6+D141 -> 8 | G141: 1 | H141: 5 | I141: =G141*6+H141 -> 11 | K141: 2 | L141: 7 | M141: =K141*6+L141 -> 19 | O141: 3 | P141: 7 | Q141: =O141*6+P141 -> 25 | S141: MALLETT
A142: BEST PLAYERS | W142: TEAM | X142: W | Y142: L | Z142: D | AA142: FOR | AB142: AGST | AC142: % | AD142: PTS
A143: WILLIAMSTOWN | C143: LINTON | F143: HARLEY | I143: MARTIN | L143: TAAFE | O143: FISHER | Q143: TAYLOR
A144: BRIGHTON | C144: FREEMAN | F144: TURNER | I144: MARINI | L144: EMBLETON | O144: O'MEARA | Q144: BURKE | W144: WILLIAMSTOWN | X144: 3 | Y144: 0 | Z144: 0 | AA144: 281 | AB144: 140 | AC144: 200.71428571428572 | AD144: 12
A145: GOALKICKERS | W145: BRUNSWICK | X145: 3 | Y145: 0 | Z145: 0 | AA145: 276 | AB145: 157 | AC145: 175.79617834394904 | AD145: 12
A146: WILLIAMSTOWN | C146: ABBERTON 3 | F146: LINTON 3 | I146: TAYLOR 2 | L146: MARTINI 2 | O146: CURRAN | Q146: MARTIN | S146: SMITH | W146: PORT MELBOURNE | X146: 3 | Y146: 0 | Z146: 0 | AA146: 358 | AB146: 222 | AC146: 161.26126126126127 | AD146: 12
A147: BRIGHTON | C147: POUND 2 | F147: KENNEDY | W147: BOX HILL | X147: 2 | Y147: 1 | Z147: 0 | AA147: 334 | AB147: 196 | AC147: 170.40816326530611 | AD147: 8
A149: YARRAVILLE | C149: 2 | D149: 1 | E149: =C149*6+D149 -> 13 | G149: 4 | H149: 1 | I149: =G149*6+H149 -> 25 | K149: 8 | L149: 5 | M149: =K149*6+L149 -> 53 | O149: 12 | P149: 7 | Q149: =O149*6+P149 -> 79 | S149: OAKLEIGH | W149: YARRAVILLE | X149: 2 | Y149: 1 | Z149: 0 | AA149: 234 | AB149: 178 | AC149: 131.46067415730337 | AD149: 8
A150: OAKLEIGH | C150: 5 | D150: 6 | E150: =C150*6+D150 -> 36 | G150: 6 | H150: 7 | I150: =G150*6+H150 -> 43 | K150: 8 | L150: 9 | M150: =K150*6+L150 -> 57 | O150: 8 | P150: 10 | Q150: =O150*6+P150 -> 58 | S150: ROACH | W150: NORTHCOTE | X150: 2 | Y150: 1 | Z150: 0 | AA150: 224 | AB150: 216 | AC150: 103.70370370370371 | AD150: 8
A151: BEST PLAYERS | W151: BRIGHTON | X151: 2 | Y151: 1 | Z151: 0 | AA151: 213 | AB151: 222 | AC151: 95.945945945945951 | AD151: 8
A152: YARRAVILLE | C152: MARCHESI | F152: PAYNE | I152: HART | L152: CONNELLY | O152: NICHOLLS | Q152: SALT | W152: PRAHRAN | X152: 1 | Y152: 2 | Z152: 0 | AA152: 266 | AB152: 281 | AC152: 94.661921708185048 | AD152: 4
A153: OAKLEIGH | C153: HILL | F153: WALSH | I153: WEBSTER | L153: EDWARDS | O153: SAVORY | Q153: WHITELAW | W153: PRESTON | X153: 1 | Y153: 2 | Z153: 0 | AA153: 211 | AB153: 233 | AC153: 90.557939914163086 | AD153: 4
A154: GOALKICKERS | W154: COBURG | X154: 1 | Y154: 2 | Z154: 0 | AA154: 180 | AB154: 247 | AC154: 72.874493927125499 | AD154: 4
A155: YARRAVILLE | C155: MARCHESI 3 | F155: CONNELLY 2 | I155: N ROHLEDER 2 | L155: HART | N155: PEVETT | P155: WILD | Q155: TREBILCOCK | T155: FRASER | W155: OAKLEIGH | X155: 0 | Y155: 2 | Z155: 1 | AA155: 212 | AB155: 243 | AC155: 87.242798353909464 | AD155: 2
A156: OAKLEIGH | C156: WALSH 2 | F156: WHITELAW 2 | I156: WEBSTER 2 | L156: COLLINS | N156: WATSON | W156: MOORABBIN | X156: 0 | Y156: 2 | Z156: 1 | AA156: 204 | AB156: 327 | AC156: 62.38532110091743 | AD156: 2
W157: CAMBERWELL | X157: 0 | Y157: 3 | Z157: 0 | AA157: 202 | AB157: 296 | AC157: 68.243243243243242 | AD157: 0
A158: PORT MELBOURNE | C158: 1 | D158: 2 | E158: =C158*6+D158 -> 8 | G158: 5 | H158: 6 | I158: =G158*6+H158 -> 36 | K158: 9 | L158: 8 | M158: =K158*6+L158 -> 62 | O158: 20 | P158: 14 | Q158: =O158*6+P158 -> 134 | S158: MOORABBIN | W158: SANDRINGHAM | X158: 0 | Y158: 3 | Z158: 0 | AA158: 142 | AB158: 379 | AC158: 37.467018469656992 | AD158: 0
A159: MOORABBIN | C159: 1 | D159: 2 | E159: =C159*6+D159 -> 8 | G159: 2 | H159: 4 | I159: =G159*6+H159 -> 16 | K159: 7 | L159: 8 | M159: =K159*6+L159 -> 50 | O159: 9 | P159: 12 | Q159: =O159*6+P159 -> 66 | S159: CARDWELL
A160: BEST PLAYERS
A161: PORT MELBOURNE | C161: WHARTON | F161: KELSEY | I161: MILLER | L161: JOHNSON | O161: WITHERS | Q161: ATKINSON
A162: MOORABBIN | C162: STANLEY | F162: BECKWITH | I162: MURPHY | L162: McKENZIE | O162: BAKER | Q162: McFARLANE
A163: GOALKICKERS
A164: PORT MELBOURNE | C164: FRASER 4 | F164: MILLER 4 | I164: ATKINSON 3 | L164: SHANNON 2 | O164: BRAGG 2 | Q164: WITHERS 2 | T164: WALSH | V164: HAMMOND | X164: CUMBERLEDGE
A165: MOORABBIN | C165: SCHOFIELD 3 | F165: DALY 2 | I165: BAKER 2 | L165: CHANDLER | O165: IMPEY
A167: PRAHRAN | C167: 3 | D167: 4 | E167: =C167*6+D167 -> 22 | G167: 6 | H167: 8 | I167: =G167*6+H167 -> 44 | K167: 9 | L167: 14 | M167: =K167*6+L167 -> 68 | O167: 12 | P167: 21 | Q167: =O167*6+P167 -> 93 | S167: TOORAK PARK
A168: PRESTON | C168: 2 | D168: 4 | E168: =C168*6+D168 -> 16 | G168: 3 | H168: 6 | I168: =G168*6+H168 -> 24 | K168: 7 | L168: 8 | M168: =K168*6+L168 -> 50 | O168: 11 | P168: 9 | Q168: =O168*6+P168 -> 75 | S168: MILLER
A169: BEST PLAYERS
A170: PRAHRAN | C170: KRUSE | F170: MORROW | I170: YATES | L170: HOLLOW | O170: KINNABURGH | R170: SHILLABEER
A171: PRESTON | C171: F CHARD | F171: HENRYS | I171: BLIZZARD | L171: FOLEY | O171: CANN | R171: BRADFORD
A172: GOALKICKERS
A173: PRAHRAN | C173: KINNABURGH 3 | F173: KRUSE 3 | I173: HARVEY 2 | L173: SNOW | N173: MORROW | Q173: O'BRYAN | S173: JONES
A174: PRESTON | C174: F CHARD 5 | F174: CANN | H174: BLIZZARD | J174: FOLEY | L174: MOORE | N174: BRADFORD | Q174: McBEAN
A176: NORTHCOTE | C176: 1 | D176: 1 | E176: =C176*6+D176 -> 7 | G176: 4 | H176: 2 | I176: =G176*6+H176 -> 26 | K176: 9 | L176: 4 | M176: =K176*6+L176 -> 58 | O176: 13 | P176: 6 | Q176: =O176*6+P176 -> 84 | S176: NORTHCOTE
A177: CAMBERWELL | C177: 3 | D177: 3 | E177: =C177*6+D177 -> 21 | G177: 5 | H177: 5 | I177: =G177*6+H177 -> 35 | K177: 6 | L177: 8 | M177: =K177*6+L177 -> 44 | O177: 9 | P177: 11 | Q177: =O177*6+P177 -> 65 | S177: SMYTH
A178: BEST PLAYERS
A179: NORTHCOTE | C179: GOUGH | F179: McLAINE | I179: DENEHY | L179: WOOLNOUGH | O179: ALDRIDGE | R179: J VAINS
A180: CAMBERWELL | C180: SKALBERG | F180: SCOTT | I180: ALLSOP | L180: HAYES | O180: YOUNG | R180: McGUINNESS
A181: GOALKICKERS
A182: NORTHCOTE | C182: BINNS 3 | E182: COLLINS 2 | H182: J VAINS 2 | J182: DEVINE | L182: GOUGH | N182: McLAINE | P182: PAYNTER | R182: MURPHY | T182: O'LEARY
A183: CAMBERWELL | C183: SCOTT 5 | F183: McGUINNES | I183: McFEE | K183: HAYES | M183: ALLSOP
A185: BRUNSWICK | C185: 3 | D185: 3 | E185: =C185*6+D185 -> 21 | G185: 7 | H185: 7 | I185: =G185*6+H185 -> 49 | K185: 12 | L185: 11 | M185: =K185*6+L185 -> 83 | O185: 15 | P185: 15 | Q185: =O185*6+P185 -> 105 | S185: BEACH ROAD
A186: SANDRINGHAM | C186: 2 | D186: 0 | E186: =C186*6+D186 -> 12 | G186: 4 | H186: 3 | I186: =G186*6+H186 -> 27 | K186: 4 | L186: 4 | M186: =K186*6+L186 -> 28 | O186: 6 | P186: 6 | Q186: =O186*6+P186 -> 42 | S186: IRVING
A187: BEST PLAYERS
A188: BRUNSWICK | C188: CARROLL | F188: CLUES | H188: LEYDEN | K188: HAYES | N188: MULLENGER | Q188: McFARLANE
A189: SANDRINGHAM | C189: BEACH | F189: RUSSO | H189: RANSOM | K189: JONES | N189: PHILLIPS | Q189: POTTER
A190: GOALKICKERS
A191: BRUNSWICK | C191: HAYES 5 | F191: CLUES 4 | I191: MULLENGER 4 | L191: SEYMOUR | N191: WEIR
A192: SANDRINGHAM | C192: BEACH 4 | F192: PHILLIPS 2
A194: COBURG | C194: 4 | D194: 2 | E194: =C194*6+D194 -> 26 | G194: 7 | H194: 3 | I194: =G194*6+H194 -> 45 | K194: 10 | L194: 5 | M194: =K194*6+L194 -> 65 | O194: 11 | P194: 7 | Q194: =O194*6+P194 -> 73 | S194: COBURG
A195: BOX HILL | C195: 3 | D195: 2 | E195: =C195*6+D195 -> 20 | G195: 5 | H195: 6 | I195: =G195*6+H195 -> 36 | K195: 7 | L195: 9 | M195: =K195*6+L195 -> 51 | O195: 9 | P195: 9 | Q195: =O195*6+P195 -> 63 | S195: HARWOOD
A196: BEST PLAYERS
A197: COBURG | C197: MAHONEY | F197: McTAGGART | I197: HORSKINS | L197: McDONALD | O197: H WILKINSON | R197: STARBUCK
A198: BOX HILL | C198: HOUGHTON | F198: REED | I198: EDNIE | L198: LOVE | O198: ALLEN | R198: MORRIS
A199: GOALKICKERS
A200: COBURG | C200: McDONALD 5 | F200: H WILKINSON 2 | J200: BUCKLEY | M200: McTAGGART | P200: KNIGHT | R200: HEWES
A201: BOX HILL | C201: MORRIS 6 | F201: BEDFORD | I201: ALLEN | K201: ABBOTT
A203: ROUND 4 | E203: 8TH MAY | I203: WEATHER | L203: WEST WIND DULL RAIN IN 2ND HALF | S203: PLAYED AT
D204: 1ST QTR | H204: 2ND QTR | L204: 3RD QTR | P204: FINAL | S204: BRUNSWICK
A205: BRUNSWICK | C205: 2 | D205: 6 | E205: =C205*6+D205 -> 18 | G205: 7 | H205: 7 | I205: =G205*6+H205 -> 49 | K205: 10 | L205: 8 | M205: =K205*6+L205 -> 68 | O205: 11 | P205: 10 | Q205: =O205*6+P205 -> 76 | S205: UMPIRE | X205: LADDER | AB205: ROUND | AD205: 4
A206: BOX HILL | C206: 1 | D206: 1 | E206: =C206*6+D206 -> 7 | G206: 5 | H206: 3 | I206: =G206*6+H206 -> 33 | K206: 5 | L206: 6 | M206: =K206*6+L206 -> 36 | O206: 11 | P206: 7 | Q206: =O206*6+P206 -> 73 | S206: SMYTH
A207: BEST PLAYERS | W207: TEAM | X207: W | Y207: L | Z207: D | AA207: FOR | AB207: AGST | AC207: % | AD207: PTS
A208: BRUNSWICK | C208: CULLY | F208: ROLFS | I208: MULLENGER | L208: SEYMOUR | O208: HAYES | Q208: MAY
A209: BOX HILL | C209: HOUGHTON | F209: WRIGHT | I209: LOVE | L209: EDNIE | O209: ALLLEN | Q209: KRONK | W209: PORT MELBOURNE | X209: 4 | Y209: 0 | Z209: 0 | AA209: 470 | AB209: 301 | AC209: 156.14617940199335 | AD209: 16
A210: GOALKICKERS | W210: BRUNSWICK | X210: 4 | Y210: 0 | Z210: 0 | AA210: 352 | AB210: 230 | AC210: 153.04347826086956 | AD210: 16
A211: BRUNSWICK | C211: HAYES 4 | F211: CLUES 2 | I211: SEYMOUR 2 | L211: MAHER | N211: WEIR | P211: MULLENGER | W211: WILLIAMSTOWN | X211: 3 | Y211: 1 | Z211: 0 | AA211: 361 | AB211: 224 | AC211: 161.16071428571428 | AD211: 12
A212: BOX HILL | C212: MORRIS 3 | F212: GREEN 2 | I212: O'CONNELL 2 | L212: TURNER 2 | O212: WEBB | Q212: EDNIE | W212: NORTHCOTE | X212: 3 | Y212: 1 | Z212: 0 | AA212: 298 | AB212: 262 | AC212: 113.74045801526718 | AD212: 12
A214: NORTHCOTE | C214: 4 | D214: 2 | E214: =C214*6+D214 -> 26 | G214: 7 | H214: 4 | I214: =G214*6+H214 -> 46 | K214: 8 | L214: 8 | M214: =K214*6+L214 -> 56 | O214: 11 | P214: 8 | Q214: =O214*6+P214 -> 74 | S214: ELSTERNWICK PARK | W214: BOX HILL | X214: 2 | Y214: 2 | Z214: 0 | AA214: 407 | AB214: 272 | AC214: 149.63235294117646 | AD214: 8
A215: BRIGHTON | C215: 2 | D215: 2 | E215: =C215*6+D215 -> 14 | G215: 3 | H215: 4 | I215: =G215*6+H215 -> 22 | K215: 4 | L215: 8 | M215: =K215*6+L215 -> 32 | O215: 6 | P215: 10 | Q215: =O215*6+P215 -> 46 | S215: MILLER | W215: YARRAVILLE | X215: 2 | Y215: 2 | Z215: 0 | AA215: 300 | AB215: 277 | AC215: 108.30324909747293 | AD215: 8
A216: BEST PLAYERS | W216: PRAHRAN | X216: 2 | Y216: 2 | Z216: 0 | AA216: 365 | AB216: 347 | AC216: 105.18731988472622 | AD216: 8
A217: NORTHCOTE | C217: ALDRIDGE | F217: FRANCIS | I217: WOOLNOUGH | L217: HOLT | N217: HISCOX | Q217: CRAWLEY | W217: PRESTON | X217: 2 | Y217: 2 | Z217: 0 | AA217: 295 | AB217: 313 | AC217: 94.249201277955265 | AD217: 8
A218: BRIGHTON | C218: READ | F218: FREEMAN | I218: O'MEARA | L218: BURRELL | N218: JOSTLEAR | Q218: TURNER | W218: BRIGHTON | X218: 2 | Y218: 2 | Z218: 0 | AA218: 259 | AB218: 296 | AC218: 87.5 | AD218: 8
A219: GOALKICKERS | W219: MOORABBIN | X219: 1 | Y219: 2 | Z219: 1 | AA219: 269 | AB219: 382 | AC219: 70.418848167539267 | AD219: 6
A220: NORTHCOTE | C220: FRANCIS 5 | F220: CRAWLEY 2 | I220: WOOLNOUGH | L220: COLLINS | N220: GOUGH | P220: WILLIAMSON | W220: CAMBERWELL | X220: 1 | Y220: 3 | Z220: 0 | AA220: 278 | AB220: 362 | AC220: 76.795580110497241 | AD220: 4
A221: BRIGHTON | C221: EMBLETON 2 | F221: COOK | H221: ALEXANDER | K221: MARINI | M221: POUND | W221: COBURG | X221: 1 | Y221: 3 | Z221: 0 | AA221: 235 | AB221: 312 | AC221: 75.320512820512818 | AD221: 4
W222: OAKLEIGH | X222: 0 | Y222: 3 | Z222: 1 | AA222: 291 | AB222: 355 | AC222: 81.971830985915489 | AD222: 2
A223: PRAHRAN | C223: 3 | D223: 1 | E223: =C223*6+D223 -> 19 | G223: 11 | H223: 6 | I223: =G223*6+H223 -> 72 | K223: 13 | L223: 10 | M223: =K223*6+L223 -> 88 | O223: 14 | P223: 15 | Q223: =O223*6+P223 -> 99 | S223: YARRAVILLE | W223: SANDRINGHAM | X223: 0 | Y223: 4 | Z223: 0 | AA223: 208 | AB223: 455 | AC223: 45.714285714285715 | AD223: 0
A224: YARRAVILLE | C224: 1 | D224: 1 | E224: =C224*6+D224 -> 7 | G224: 4 | H224: 2 | I224: =G224*6+H224 -> 26 | K224: 7 | L224: 3 | M224: =K224*6+L224 -> 45 | O224: 10 | P224: 6 | Q224: =O224*6+P224 -> 66 | S224: IRVING
A225: BEST PLAYERS
A226: PRAHRAN | C226: KRUSE | F226: J JONES | I226: ELLIOTT | L226: HARVEY | O226: SHARP | Q226: SNOW
A227: YARRAVILLE | C227: PAYNE | F227: TREBILCOCK | I227: KING | L227: K SMITH | O227: WILD | Q227: J ROHLEDER
A228: GOALKICKERS
A229: PRAHRAN | C229: ELLIOTT 3 | E229: KINNABURGH 3 | H229: MORROW 2 | K229: WALSH | M229: SHARP | O229: SNOW | Q229: O'BRYAN | S229: HARVEY | U229: CLEAR
A230: YARRAVILLE | C230: TREBILCOCK 4 | F230: HART 3 | I230: SALT | K230: N ROHLEDER | N230: PEVITT
A232: PRESTON | C232: 3 | D232: 1 | E232: =C232*6+D232 -> 19 | G232: 6 | H232: 6 | I232: =G232*6+H232 -> 42 | K232: 8 | L232: 8 | M232: =K232*6+L232 -> 56 | O232: 12 | P232: 12 | Q232: =O232*6+P232 -> 84 | S232: PRESTON
A233: WILLIAMSTOWN | C233: 5 | D233: 8 | E233: =C233*6+D233 -> 38 | G233: 7 | H233: 14 | I233: =G233*6+H233 -> 56 | K233: 9 | L233: 18 | M233: =K233*6+L233 -> 72 | O233: 10 | P233: 20 | Q233: =O233*6+P233 -> 80 | S233: GAMBLE
A234: BEST PLAYERS
A235: PRESTON | C235: FOLEY | F235: CROCKER | I235: SWEET | L235: WALKER | O235: BATEMAN | R235: HENRYS
A236: WILLIAMSTOWN | C236: SIMPSON | F236: LINTON | I236: WHITTAKER | L236: HARLEY | O236: FISHER | R236: SIMS
A237: GOALKICKERS
A238: PRESTON | C238: HAYES 4 | F238: F CHARD 4 | I238: CANN 2 | K238: BATEMAN | N238: BRADFORD
A239: WILLIAMSTOWN | C239: TAYLOR 2 | F239: SIMS 2 | H239: ABBERTON 2 | K239: LINTON | M239: GRAHAM | O239: SIMPSON | Q239: MARTIN
A241: MOORABBIN | C241: 2 | D241: 1 | E241: =C241*6+D241 -> 13 | G241: 4 | H241: 4 | I241: =G241*6+H241 -> 28 | K241: 7 | L241: 6 | M241: =K241*6+L241 -> 48 | O241: 9 | P241: 11 | Q241: =O241*6+P241 -> 65 | S241: MOORABBIN
A242: COBURG | C242: 0 | D242: 0 | E242: =C242*6+D242 -> 0 | G242: 3 | H242: 4 | I242: =G242*6+H242 -> 22 | K242: 5 | L242: 7 | M242: =K242*6+L242 -> 37 | O242: 8 | P242: 7 | Q242: =O242*6+P242 -> 55 | S242: ROACH
A243: BEST PLAYERS
A244: MOORABBIN | C244: STANLEY | F244: BECKWITH | I244: McFARLANE | L244: MURPHY | O244: LAWRENCE | R244: BARNES
A245: COBURG | C245: H WILKINSON | F245: BUCKLEY | I245: STARBUCK | L245: MAHONEY | O245: SPARKS | R245: MCTAGGART
A246: GOALKICKERS
A247: MOORABBIN | C247: SCHOFIELD 3 | F247: DALY 2 | H247: CHANDLER 2 | K247: McKENZIE | M247: CLOVER
A248: COBURG | C248: H WILKINSON 4 | F248: FITZPATRICK 3 | J248: WILLIAMS
A250: CAMBERWELL | C250: 3 | D250: 3 | E250: =C250*6+D250 -> 21 | G250: 6 | H250: 8 | I250: =G250*6+H250 -> 44 | K250: 6 | L250: 10 | M250: =K250*6+L250 -> 46 | O250: 10 | P250: 16 | Q250: =O250*6+P250 -> 76 | S250: CAMBERWELL
A251: SANDRINGHAM | C251: 3 | D251: 2 | E251: =C251*6+D251 -> 20 | G251: 5 | H251: 6 | I251: =G251*6+H251 -> 36 | K251: 7 | L251: 9 | M251: =K251*6+L251 -> 51 | O251: 9 | P251: 12 | Q251: =O251*6+P251 -> 66 | S251: CARDWELL
A252: BEST PLAYERS
A253: CAMBERWELL | C253: LYNCH | E253: JARRARD | H253: McFEE | K253: CUNNINGHAM | N253: DENNISON | Q253: DUGDALE
A254: SANDRINGHAM | C254: RUSSO | E254: RAEBURN | H254: PHILLIPS | K254: N JONES | N254: RANSOM | Q254: BEACH
A255: GOALKICKERS
A256: CAMBERWELL | C256: DENNISON 3 | F256: HOLYOAK 2 | I256: SCOTT 2 | K256: McFEE | M256: TEMPANY | O256: McCULLOCH
A257: SANDRINGHAM | C257: PHILLIPS 3 | F257: HARPER 3 | I257: BEACH | K257: WARBURTON
A259: PORT MELBOURNE | C259: 6 | D259: 6 | E259: =C259*6+D259 -> 42 | G259: 8 | H259: 8 | I259: =G259*6+H259 -> 56 | K259: 15 | L259: 13 | M259: =K259*6+L259 -> 103 | O259: 16 | P259: 16 | Q259: =O259*6+P259 -> 112 | S259: PORT MELBOURNE
A260: OAKLEIGH | C260: 1 | D260: 1 | E260: =C260*6+D260 -> 7 | G260: 6 | H260: 7 | I260: =G260*6+H260 -> 43 | K260: 7 | L260: 8 | M260: =K260*6+L260 -> 50 | O260: 11 | P260: 13 | Q260: =O260*6+P260 -> 79 | S260: HARWOOD
A261: BEST PLAYERS
A262: PORT MELBOURNE | C262: JOHNSON | F262: WILSON | I262: SHANNON | L262: BONNETT | N262: MILLER | Q262: BRAGG
A263: OAKLEIGH | C263: EDWARDS | F263: LAMBERT | I263: GUY | L263: HILL | N263: COLLINS | Q263: HOWELL
A264: GOALKICKERS
A265: PORT MELBOURNE | C265: MILLER 3 | E265: BONNETT 3 | H265: WALSH 2 | J265: ATKINSON 2 | M265: STOREY 2 | O265: DUNBAR | Q265: TUCKER | S265: JOHNSON | V265: CUMBERLEDGE
A266: OAKLEIGH | C266: EDWARDS 6 | F266: WALSH 4 | I266: WATSON
A268: ROUND 5 | E268: 15TH MAY | J268: WEATHER | O268: WEST WIND FINE | S268: PLAYED AT
D269: 1ST QTR | H269: 2ND QTR | L269: 3RD QTR | P269: FINAL | S269: WILLIAMSTOWN
A270: WILLIAMSTOWN | C270: 4 | D270: 5 | E270: =C270*6+D270 -> 29 | G270: 6 | H270: 6 | I270: =G270*6+H270 -> 42 | K270: 10 | L270: 9 | M270: =K270*6+L270 -> 69 | O270: 10 | P270: 9 | Q270: =O270*6+P270 -> 69 | S270: UMPIRE | X270: LADDER | AB270: ROUND | AD270: 5
A271: BRUNSWICK | C271: 0 | D271: 0 | E271: =C271*6+D271 -> 0 | G271: 4 | H271: 2 | I271: =G271*6+H271 -> 26 | K271: 4 | L271: 2 | M271: =K271*6+L271 -> 26 | O271: 5 | P271: 8 | Q271: =O271*6+P271 -> 38 | S271: IRVING
A272: BEST PLAYERS | W272: TEAM | X272: W | Y272: L | Z272: D | AA272: FOR | AB272: AGST | AC272: % | AD272: PTS
A273: WILLIAMSTOWN | C273: LINTON | F273: HARLEY | I273: SMITH | K273: TAAFE | N273: CALLAHAN | Q273: SIMPSON
A274: BRUNSWICK | C274: CULLY | F274: STANLEY | I274: YEA | K274: POLLARD | N274: EDWARDS | Q274: MULLENGER | W274: PORT MELBOURNE | X274: 5 | Y274: 0 | Z274: 0 | AA274: 606 | AB274: 369 | AC274: 164.22764227642276 | AD274: 20
A275: GOALKICKERS | W275: WILLIAMSTOWN | X275: 4 | Y275: 1 | Z275: 0 | AA275: 430 | AB275: 268 | AC275: 160.44776119402985 | AD275: 16
A276: WILLIAMSTOWN | C276: LINTON 4 | F276: TAYLOR 2 | I276: SMITH 2 | K276: GRAHAM | N276: TAAFE | W276: BRUNSWICK | X276: 4 | Y276: 1 | Z276: 0 | AA276: 396 | AB276: 299 | AC276: 132.44147157190636 | AD276: 16
A277: BRUNSWICK | C277: MULLENGER | F277: CLUES | I277: WEIR | K277: SEYMOUR | N277: HAYES | W277: NORTHCOTE | X277: 4 | Y277: 1 | Z277: 0 | AA277: 372 | AB277: 318 | AC277: 116.98113207547169 | AD277: 16
A279: NORTHCOTE | C279: 1 | D279: 1 | E279: =C279*6+D279 -> 7 | G279: 5 | H279: 5 | I279: =G279*6+H279 -> 35 | K279: 5 | L279: 6 | M279: =K279*6+L279 -> 36 | O279: 10 | P279: 14 | Q279: =O279*6+P279 -> 74 | S279: NORTHCOTE | W279: PRAHRAN | X279: 3 | Y279: 2 | Z279: 0 | AA279: 471 | AB279: 401 | AC279: 117.45635910224439 | AD279: 12
A280: BOX HILL | C280: 1 | D280: 5 | E280: =C280*6+D280 -> 11 | G280: 1 | H280: 8 | I280: =G280*6+H280 -> 14 | K280: 6 | L280: 13 | M280: =K280*6+L280 -> 49 | O280: 7 | P280: 14 | Q280: =O280*6+P280 -> 56 | S280: CARDWELL | W280: MOORABBIN | X280: 2 | Y280: 2 | Z280: 1 | AA280: 342 | AB280: 438 | AC280: 78.082191780821915 | AD280: 10
A281: BEST PLAYERS | W281: BOX HILL | X281: 2 | Y281: 3 | Z281: 0 | AA281: 463 | AB281: 346 | AC281: 133.81502890173411 | AD281: 8
A282: NORTHCOTE | C282: FRANCIS | F282: ALDRIDGE | I282: McLAINE | L282: COLLINS | O282: HISCOX | Q282: PAYNTER | W282: COBURG | X282: 2 | Y282: 3 | Z282: 0 | AA282: 359 | AB282: 365 | AC282: 98.356164383561648 | AD282: 8
A283: BOX HILL | C283: KRONK | F283: WRIGHT | I283: LOVE | L283: HOUGHTON | O283: GREEN | Q283: STREET | W283: PRESTON | X283: 2 | Y283: 3 | Z283: 0 | AA283: 351 | AB283: 386 | AC283: 90.932642487046635 | AD283: 8
A284: GOALKICKERS | W284: YARRAVILLE | X284: 2 | Y284: 3 | Z284: 0 | AA284: 368 | AB284: 413 | AC284: 89.104116222760297 | AD284: 8
A285: NORTHCOTE | C285: FRANCIS 3 | F285: COLLINS 3 | I285: DEVINE | K285: WOOLNOUGH | N285: HOLT | P285: WILLIAMSON | W285: BRIGHTON | X285: 2 | Y285: 3 | Z285: 0 | AA285: 326 | AB285: 417 | AC285: 78.177458033573146 | AD285: 8
A286: BOX HILL | C286: GREEN 2 | F286: TURNER | I286: EDNIE | K286: W BLUNDY | N286: MORRIS | P286: WEBB | W286: OAKLEIGH | X286: 1 | Y286: 3 | Z286: 1 | AA286: 412 | AB286: 422 | AC286: 97.630331753554501 | AD286: 6
W287: CAMBERWELL | X287: 1 | Y287: 4 | Z287: 0 | AA287: 332 | AB287: 468 | AC287: 70.940170940170944 | AD287: 4
A288: PORT MELBOURNE | C288: 7 | D288: 7 | E288: =C288*6+D288 -> 49 | G288: 10 | H288: 9 | I288: =G288*6+H288 -> 69 | K288: 17 | L288: 15 | M288: =K288*6+L288 -> 117 | O288: 20 | P288: 16 | Q288: =O288*6+P288 -> 136 | S288: PORT MELBOURNE | W288: SANDRINGHAM | X288: 0 | Y288: 5 | Z288: 0 | AA288: 261 | AB288: 579 | AC288: 45.077720207253883 | AD288: 0
A289: YARRAVILLE | C289: 0 | D289: 1 | E289: =C289*6+D289 -> 1 | G289: 2 | H289: 9 | I289: =G289*6+H289 -> 21 | K289: 3 | L289: 11 | M289: =K289*6+L289 -> 29 | O289: 9 | P289: 14 | Q289: =O289*6+P289 -> 68 | S289: ROACH
A290: BEST PLAYERS
A291: PORT MELBOURNE | C291: MILLER | F291: JOHNSON | I291: LAFFEY | K291: WHARTON | N291: KELSEY | Q291: DUNBAR
A292: YARRAVILLE | C292: VANDERFEEN | F292: CONNELLY | I292: SEITZ | K292: GWYNNE | N292: N ROHLEDER | Q292: HART
A293: GOALKICKERS
A294: PORT MELBOURNE | C294: BONNETT 8 | F294: ATKINSON 4 | I294: MILLER 2 | K294: CUMBERLEDGE 2 | N294: DUNBAR 2 | Q294: BRAGG | S294: JOHNSON
A295: YARRAVILLE | C295: TREBILCOCK 3 | F295: WILD 2 | H295: COOK | J295: CONNELLY | M295: MASON | O295: MALESA
A297: MOORABBIN | C297: 1 | D297: 1 | E297: =C297*6+D297 -> 7 | G297: 7 | H297: 3 | I297: =G297*6+H297 -> 45 | K297: 7 | L297: 5 | M297: =K297*6+L297 -> 47 | O297: 10 | P297: 13 | Q297: =O297*6+P297 -> 73 | S297: MOORABBIN
A298: PRESTON | C298: 1 | D298: 1 | E298: =C298*6+D298 -> 7 | G298: 2 | H298: 3 | I298: =G298*6+H298 -> 15 | K298: 6 | L298: 5 | M298: =K298*6+L298 -> 41 | O298: 8 | P298: 8 | Q298: =O298*6+P298 -> 56 | S298: MALLETT
A299: BEST PLAYERS
A300: MOORABBIN | C300: BROWN | F300: SCANLON | I300: MORONEY | L300: TRESIZE | O300: LEHMANN | R300: BOYD
A301: PRESTON | C301: FOLEY | F301: F CHARD | I301: SWEET | L301: WALKER | O301: McLACHLAN | R301: CROCKER
A302: GOALKICKERS
A303: MOORABBIN | C303: LEHMANN 2 | F303: TRESIZE 2 | I303: SCHOFIELD 2 | L303: CHANDLER | N303: DALY | P303: BAKER | R303: BARNES
A304: PRESTON | C304: F CHARD 5 | F304: FOLEY 2 | I304: LALOR
A306: COBURG | C306: 1 | D306: 7 | E306: =C306*6+D306 -> 13 | G306: 6 | H306: 12 | I306: =G306*6+H306 -> 48 | K306: 9 | L306: 19 | M306: =K306*6+L306 -> 73 | O306: 17 | P306: 22 | Q306: =O306*6+P306 -> 124 | S306: COBURG
A307: SANDRINGHAM | C307: 2 | D307: 3 | E307: =C307*6+D307 -> 15 | G307: 2 | H307: 5 | I307: =G307*6+H307 -> 17 | K307: 4 | L307: 7 | M307: =K307*6+L307 -> 31 | O307: 7 | P307: 11 | Q307: =O307*6+P307 -> 53 | S307: GAMBLE
A308: BEST PLAYERS
A309: COBURG | C309: McTAGGART | F309: R WILKINSON | I309: MAHONEY | L309: H WILKINSON | O309: ROGAN | Q309: FEWKES
A310: SANDRINGHAM | C310: GOODES | F310: RAEBURN | I310: CROFT | L310: JONES | O310: EVANS | Q310: POTTER
A311: GOALKICKERS
A312: COBURG | C312: MCDONALD 5 | F312: R WILKINSON 4 | J312: H WILKINSON 3 | N312: HORSKINS 3 | Q312: AITKEN 2
A313: SANDRINGHAM | C313: CROFT | E313: HARPER | G313: WARBURTON | J313: CLAYTON | M313: POTTER | O313: PHILLIPS | Q313: EVANS
A315: PRAHRAN | C315: 1 | D315: 1 | E315: =C315*6+D315 -> 7 | G315: 7 | H315: 3 | I315: =G315*6+H315 -> 45 | K315: 9 | L315: 6 | M315: =K315*6+L315 -> 60 | O315: 16 | P315: 10 | Q315: =O315*6+P315 -> 106 | S315: TOORAK PARK
A316: CAMBERWELL | C316: 0 | D316: 2 | E316: =C316*6+D316 -> 2 | G316: 3 | H316: 3 | I316: =G316*6+H316 -> 21 | K316: 7 | L316: 5 | M316: =K316*6+L316 -> 47 | O316: 8 | P316: 6 | Q316: =O316*6+P316 -> 54 | S316: MILLER
A317: BEST PLAYERS
A318: PRAHRAN | C318: KRUSE | F318: HARVEY | I318: JONES | L318: ELLIOTT | O318: HART | R318: YATES
A319: CAMBERWELL | C319: CUNNIGHAM | F319: YOUNG | I319: HAYES | L319: DUGDALE | O319: McGUINNESS | R319: MASON
A320: GOALKICKERS
A321: PRAHRAN | C321: ELLIOTT 4 | F321: MORROW 3 | I321: HART 3 | K321: HARVEY 2 | N321: CLEAR | P321: KRUSE | R321: SHARP | T321: WALSH
A322: CAMBERWELL | C322: DUGDALE 3 | F322: McGUINNESS | I322: CLARK | K322: McCULLOCH | N322: SKALBERG | Q322: TEMPANY
A324: OAKLEIGH | C324: 1 | D324: 2 | E324: =C324*6+D324 -> 8 | G324: 5 | H324: 9 | I324: =G324*6+H324 -> 39 | K324: 10 | L324: 9 | M324: =K324*6+L324 -> 69 | O324: 17 | P324: 19 | Q324: =O324*6+P324 -> 121 | S324: OAKLEIGH
A325: BRIGHTON | C325: 3 | D325: 6 | E325: =C325*6+D325 -> 24 | G325: 3 | H325: 6 | I325: =G325*6+H325 -> 24 | K325: 8 | L325: 13 | M325: =K325*6+L325 -> 61 | O325: 9 | P325: 13 | Q325: =O325*6+P325 -> 67 | S325: BREWER
A326: BEST PLAYERS
A327: OAKLEIGH | C327: WEBSTER | F327: HOWELL | I327: SAID | K327: BAPTIST | N327: COLLINS | Q327: SHAW
A328: BRIGHTON | C328: MARINI | F328: READ | I328: KERR | K328: TURNER | N328: JOSTLEAR | Q328: PICKERING
A329: GOALKICKERS
A330: OAKLEIGH | C330: WEBSTER 6 | F330: SHAW 4 | I330: EDWARDS 3 | L330: WATSON 2 | O330: WALSH | Q330: BOURKE
A331: BRIGHTON | C331: MARINI 2 | F331: POUND 2 | I331: CRAIG 2 | K331: KERR | M331: A JOWETT | P331: O'MEARA
A333: ROUND 6 | E333: 22ND MAY | J333: WEATHER | M333: SOUTH WIND DULL COLD | S333: PLAYED AT
D334: 1ST QTR | H334: 2ND QTR | L334: 3RD QTR | P334: FINAL | S334: BRUNSWICK
A335: PRAHRAN | C335: 4 | D335: 0 | E335: =C335*6+D335 -> 24 | G335: 7 | H335: 1 | I335: =G335*6+H335 -> 43 | K335: 10 | L335: 7 | M335: =K335*6+L335 -> 67 | O335: 17 | P335: 10 | Q335: =O335*6+P335 -> 112 | S335: UMPIRE | X335: LADDER | AB335: ROUND | AD335: 6
A336: BRUNSWICK | C336: 4 | D336: 5 | E336: =C336*6+D336 -> 29 | G336: 7 | H336: 7 | I336: =G336*6+H336 -> 49 | K336: 10 | L336: 9 | M336: =K336*6+L336 -> 69 | O336: 13 | P336: 11 | Q336: =O336*6+P336 -> 89 | S336: ROACH
A337: BEST PLAYERS | W337: TEAM | X337: W | Y337: L | Z337: D | AA337: FOR | AB337: AGST | AC337: % | AD337: PTS
A338: PRAHRAN | C338: MORROW | F338: ARMSTRONG | J338: SNOW | M338: HEAD | O338: PLAIN | Q338: KINNABURGH
A339: BRUNSWICK | C339: YEA | F339: MULLENGER | J339: SEYMOUR | M339: CULLY | O339: WEIR | Q339: HAYES | W339: PORT MELBOURNE | X339: 5 | Y339: 1 | Z339: 0 | AA339: 699 | AB339: 466 | AC339: 150 | AD339: 20
A340: GOALKICKERS | W340: NORTHCOTE | X340: 5 | Y340: 1 | Z340: 0 | AA340: 518 | AB340: 409 | AC340: 126.65036674816626 | AD340: 20
A341: PRAHRAN | C341: KINNABURGH 3 | F341: MORROW 3 | I341: HEAD 3 | K341: KRUSE 3 | M341: SHARP 2 | O341: ELLIOTT 2 | R341: SNOW | W341: WILLIAMSTOWN | X341: 4 | Y341: 2 | Z341: 0 | AA341: 489 | AB341: 336 | AC341: 145.53571428571428 | AD341: 16
A342: BRUNSWICK | C342: HAYES 5 | F342: MULLENGER 2 | I342: WEIR 2 | K342: CLUES | M342: STANLEY | O342: NEILSON | Q342: LOVETT | W342: PRAHRAN | X342: 4 | Y342: 2 | Z342: 0 | AA342: 583 | AB342: 490 | AC342: 118.9795918367347 | AD342: 16
A344: BOX HILL | C344: 6 | D344: 2 | E344: =C344*6+D344 -> 38 | G344: 9 | H344: 4 | I344: =G344*6+H344 -> 58 | K344: 10 | L344: 7 | M344: =K344*6+L344 -> 67 | O344: 10 | P344: 8 | Q344: =O344*6+P344 -> 68 | S344: BOX HILL | W344: BRUNSWICK | X344: 4 | Y344: 2 | Z344: 0 | AA344: 485 | AB344: 411 | AC344: 118.00486618004867 | AD344: 16
A345: WILLIAMSTOWN | C345: 0 | D345: 6 | E345: =C345*6+D345 -> 6 | G345: 2 | H345: 8 | I345: =G345*6+H345 -> 20 | K345: 4 | L345: 10 | M345: =K345*6+L345 -> 34 | O345: 8 | P345: 11 | Q345: =O345*6+P345 -> 59 | S345: IRVING | W345: MOORABBIN | X345: 3 | Y345: 2 | Z345: 1 | AA345: 487 | AB345: 498 | AC345: 97.791164658634543 | AD345: 14
A346: BEST PLAYERS | W346: BOX HILL | X346: 3 | Y346: 3 | Z346: 0 | AA346: 531 | AB346: 405 | AC346: 131.11111111111111 | AD346: 12
A347: BOX HILL | C347: HOUGHTON | F347: ABBOTT | I347: IRVINE | L347: TURNER | O347: LOVE | Q347: WRIGHT | W347: COBURG | X347: 3 | Y347: 3 | Z347: 0 | AA347: 441 | AB347: 428 | AC347: 103.03738317757009 | AD347: 12
A348: WILLIAMSTOWN | C348: LINTON | F348: MARTINI | I348: ROGERS | L348: RAMSAY | O348: WOOKEY | Q348: TAAFE | W348: PRESTON | X348: 3 | Y348: 3 | Z348: 0 | AA348: 448 | AB348: 479 | AC348: 93.528183716075162 | AD348: 12
A349: GOALKICKERS | W349: OAKLEIGH | X349: 2 | Y349: 3 | Z349: 1 | AA349: 565 | AB349: 544 | AC349: 103.86029411764706 | AD349: 10
A350: BOX HILL | C350: TURNER 3 | F350: ABBOTT 2 | I350: WRIGHT | K350: WEBB | M350: LOVE | O350: HOUGHTON | R350: MORRIS | W350: YARRAVILLE | X350: 2 | Y350: 4 | Z350: 0 | AA350: 431 | AB350: 495 | AC350: 87.070707070707073 | AD350: 8
A351: WILLIAMSTOWN | C351: MARTINI 3 | F351: WALKER 2 | I351: SIMPSON | K351: TAAFE | M351: LINTON | W351: BRIGHTON | X351: 2 | Y351: 4 | Z351: 0 | AA351: 386 | AB351: 562 | AC351: 68.683274021352318 | AD351: 8
W352: CAMBERWELL | X352: 1 | Y352: 5 | Z352: 0 | AA352: 454 | AB352: 621 | AC352: 73.107890499194852 | AD352: 4
A353: PRESTON | C353: 6 | D353: 1 | E353: =C353*6+D353 -> 37 | G353: 9 | H353: 1 | I353: =G353*6+H353 -> 55 | K353: 16 | L353: 1 | M353: =K353*6+L353 -> 97 | O353: 16 | P353: 1 | Q353: =O353*6+P353 -> 97 | S353: PRESTON | W353: SANDRINGHAM | X353: 0 | Y353: 6 | Z353: 0 | AA353: 352 | AB353: 725 | AC353: 48.551724137931032 | AD353: 0
A354: PORT MELBOURNE | C354: 3 | D354: 3 | E354: =C354*6+D354 -> 21 | G354: 7 | H354: 10 | I354: =G354*6+H354 -> 52 | K354: 9 | L354: 12 | M354: =K354*6+L354 -> 66 | O354: 13 | P354: 15 | Q354: =O354*6+P354 -> 93 | S354: GAMBLE
A355: BEST PLAYERS
A356: PRESTON | C356: FOLEY | F356: HARVEY | I356: CROCKER | L356: F CHARD | O356: SWEET | Q356: JEFFREY
A357: PORT MELBOURNE | C357: JOHNSON | F357: ATKINSON | I357: BONNETT | L357: MILLER | O357: WALSH | Q357: BRAGG
A358: GOALKICKERS
A359: PRESTON | C359: F CHARD 6 | F359: JEFFREY 4 | I359: HAYES 2 | K359: McBEAN | M359: FOLEY | O359: LALOR | Q359: COOPER
A360: PORT MELBOURNE | C360: BONNETT 3 | F360: ATKINSON 3 | I360: WALSH 2 | K360: FOGARTY | M360: CUMBERLEDGE | P360: MILLER | R360: LAFFEY | T360: STOREY
A362: COBURG | C362: 1 | D362: 2 | E362: =C362*6+D362 -> 8 | G362: 5 | H362: 8 | I362: =G362*6+H362 -> 38 | K362: 9 | L362: 8 | M362: =K362*6+L362 -> 62 | O362: 12 | P362: 10 | Q362: =O362*6+P362 -> 82 | S362: YARRAVILLE
A363: YARRAVILLE | C363: 4 | D363: 2 | E363: =C363*6+D363 -> 26 | G363: 6 | H363: 2 | I363: =G363*6+H363 -> 38 | K363: 7 | L363: 6 | M363: =K363*6+L363 -> 48 | O363: 9 | P363: 9 | Q363: =O363*6+P363 -> 63 | S363: MILLER
A364: BEST PLAYERS
A365: COBURG | C365: LEVERSHA | F365: McDONALD | I365: H WILKINSON | L365: HORSKINS | O365: STARBUCK | R365: McTAGGART
A366: YARRAVILLE | C366: TREBILCOCK | F366: GWYNNE | I366: SALT | L366: MARCHESI | O366: WILD | R366: FRASER
A367: GOALKICKERS
A368: COBURG | C368: ROGAN 3 | F368: McDONALD 3 | I368: H WILKINSON 2 | M368: R WILKINSON 2 | P368: HORSKINS | R368: McCOLL
A369: YARRAVILLE | C369: TREBILCOCK 3 | F369: HART 2 | I369: MARCHESI 2 | L369: SALT | N369: BERRY
A371: MOORABBIN | C371: 9 | D371: 3 | E371: =C371*6+D371 -> 57 | G371: 12 | H371: 7 | I371: =G371*6+H371 -> 79 | K371: 19 | L371: 10 | M371: =K371*6+L371 -> 124 | O371: 22 | P371: 13 | Q371: =O371*6+P371 -> 145 | S371: ELSTERNWICK PARK
A372: BRIGHTON | C372: 4 | D372: 2 | E372: =C372*6+D372 -> 26 | G372: 5 | H372: 6 | I372: =G372*6+H372 -> 36 | K372: 5 | L372: 7 | M372: =K372*6+L372 -> 37 | O372: 8 | P372: 12 | Q372: =O372*6+P372 -> 60 | S372: SMYTH
A373: BEST PLAYERS
A374: MOORABBIN | C374: SCHOFIELD | F374: SCANLON | I374: McKENZIE | L374: LEHMANN | O374: STANLEY | R374: K BOYD
A375: BRIGHTON | C375: TURNER | F375: EMBLETON | I375: BURRELL | L375: BLACKMORE | O375: O'MEARA | R375: CRAIG
A376: GOALKICKERS
A377: MOORABBIN | C377: SCHOFIELD 13 | G377: RENWICK 3 | J377: TRESIZE | L377: CHANDLER | N377: MORONEY | Q377: DALY | S377: LEHMANN | V377: BARNES
A378: BRIGHTON | C378: ALEXANDER 2 | F378: JOSTLEAR | I378: COCKFIELD | L378: CONROY | N378: O'MEARA | P378: MARINI | R378: LONIE
A380: OAKLEIGH | C380: 7 | D380: 6 | E380: =C380*6+D380 -> 48 | G380: 13 | H380: 9 | I380: =G380*6+H380 -> 87 | K380: 17 | L380: 11 | M380: =K380*6+L380 -> 113 | O380: 23 | P380: 15 | Q380: =O380*6+P380 -> 153 | S380: CAMBERWELL
A381: CAMBERWELL | C381: 1 | D381: 1 | E381: =C381*6+D381 -> 7 | G381: 5 | H381: 5 | I381: =G381*6+H381 -> 35 | K381: 10 | L381: 6 | M381: =K381*6+L381 -> 66 | O381: 19 | P381: 8 | Q381: =O381*6+P381 -> 122 | S381: BREWER
A382: BEST PLAYERS
A383: OAKLEIGH | C383: EDWARDS | F383: HILL | I383: WATSON | L383: SAVORY | O383: COLLINS | R383: BAPTIST
A384: CAMBERWELL | C384: McGUINNESS | F384: YOUNG | I384: HOLYOAK | L384: SCOTT | O384: ALLSOPP | R384: McFEE
A385: GOALKICKERS
A386: OAKLEIGH | C386: WEBSTER 6 | F386: WATSON 4 | I386: SHAW 4 | K386: GUY 3 | M386: EDWARDS 2 | P386: SAID | R386: BOURKE | U386: COLLINS | X386: HILL
A387: CAMBERWELL | C387: SCOTT 6 | F387: McFEE 4 | I387: ALLSOPP 4 | L387: McGUINNESS 3 | P387: DUGDALE | R387: FLETCHER
A389: NORTHCOTE | C389: 0 | D389: 5 | E389: =C389*6+D389 -> 5 | G389: 9 | H389: 9 | I389: =G389*6+H389 -> 63 | K389: 14 | L389: 13 | M389: =K389*6+L389 -> 97 | O389: 22 | P389: 14 | Q389: =O389*6+P389 -> 146 | S389: BEACH ROAD
A390: SANDRINGHAM | C390: 6 | D390: 5 | E390: =C390*6+D390 -> 41 | G390: 9 | H390: 6 | I390: =G390*6+H390 -> 60 | K390: 10 | L390: 7 | M390: =K390*6+L390 -> 67 | O390: 14 | P390: 7 | Q390: =O390*6+P390 -> 91 | S390: CARDWELL
A391: BEST PLAYERS
A392: NORTHCOTE | C392: G POWELL | F392: FRANCIS | I392: COLLINS | L392: ALDRIDGE | O392: McLAINE | Q392: STABB
A393: SANDRINGHAM | C393: GOODES | F393: CROFT | I393: PHILLIPS | L393: WOODS | O393: RUSSO | Q393: PEARSON
A394: GOALKICKERS
A395: NORTHCOTE | C395: COLLINS 6 | F395: FRANCIS 5 | I395: DEVINE 3 | K395: GOUGH 2 | M395: McLAINE 2 | P395: F VAINS | R395: G POWELL | U395: PAYNTER | X395: J VAINS
A396: SANDRINGHAM | C396: HARPER 4 | F396: RAEBURN 3 | I396: WARBURTON 3 | L396: MORONEY 2 | O396: EVANS | Q396: WOODS
A398: ROUND 7 | E398: 29TH MAY | J398: WEATHER | O398: FINE & SUNNY | S398: PLAYED AT
D399: 1ST QTR | H399: 2ND QTR | L399: 3RD QTR | P399: FINAL | S399: TOORAK PARK
A400: PRAHRAN | C400: 4 | D400: 1 | E400: =C400*6+D400 -> 25 | G400: 9 | H400: 11 | I400: =G400*6+H400 -> 65 | K400: 13 | L400: 18 | M400: =K400*6+L400 -> 96 | O400: 17 | P400: 22 | Q400: =O400*6+P400 -> 124 | S400: UMPIRE | X400: LADDER | AB400: ROUND | AD400: 7
A401: BOX HILL | C401: 5 | D401: 5 | E401: =C401*6+D401 -> 35 | G401: 9 | H401: 6 | I401: =G401*6+H401 -> 60 | K401: 14 | L401: 9 | M401: =K401*6+L401 -> 93 | O401: 16 | P401: 12 | Q401: =O401*6+P401 -> 108 | S401: GAMBLE
A402: BEST PLAYERS | W402: TEAM | X402: W | Y402: L | Z402: D | AA402: FOR | AB402: AGST | AC402: % | AD402: PTS
A403: PRAHRAN | C403: HARVEY | E403: CLEAR | H403: KINNABURGH | K403: ARMSTRONG | N403: HART | Q403: KRUSE
A404: BOX HILL | C404: IRVINE | E404: HOUGHTON | H404: TURNER | K404: MORRIS | N404: ABBOTT | Q404: LOVE | W404: PORT MELBOURNE | X404: 6 | Y404: 1 | Z404: 0 | AA404: 808 | AB404: 509 | AC404: 158.74263261296659 | AD404: 24
A405: GOALKICKERS | W405: WILLIAMSTOWN | X405: 5 | Y405: 2 | Z405: 0 | AA405: 655 | AB405: 368 | AC405: 177.9891304347826 | AD405: 20
A406: PRAHRAN | C406: KINNABURGH 6 | F406: HARVEY 4 | I406: MORROW 2 | L406: ELLIOTT 2 | N406: CLEAR | P406: KRUSE | R406: HOLLOW | W406: PRAHRAN | X406: 5 | Y406: 2 | Z406: 0 | AA406: 707 | AB406: 598 | AC406: 118.22742474916387 | AD406: 20
A407: BOX HILL | C407: MORRIS 4 | E407: ABBOTT 3 | G407: WRIGHT 3 | I407: TURNER 2 | K407: REED | M407: COGHLAN | O407: HOUGHTON | R407: LOVE | W407: NORTHCOTE | X407: 5 | Y407: 2 | Z407: 0 | AA407: 589 | AB407: 503 | AC407: 117.09741550695826 | AD407: 20
A409: COBURG | C409: 3 | D409: 3 | E409: =C409*6+D409 -> 21 | G409: 6 | H409: 5 | I409: =G409*6+H409 -> 41 | K409: 12 | L409: 13 | M409: =K409*6+L409 -> 85 | O409: 13 | P409: 16 | Q409: =O409*6+P409 -> 94 | S409: COBURG | W409: MOORABBIN | X409: 4 | Y409: 2 | Z409: 1 | AA409: 635 | AB409: 579 | AC409: 109.67184801381693 | AD409: 18
A410: NORTHCOTE | C410: 2 | D410: 3 | E410: =C410*6+D410 -> 15 | G410: 6 | H410: 6 | I410: =G410*6+H410 -> 42 | K410: 8 | L410: 7 | M410: =K410*6+L410 -> 55 | O410: 10 | P410: 11 | Q410: =O410*6+P410 -> 71 | S410: IRVING | W410: BRUNSWICK | X410: 4 | Y410: 3 | Z410: 0 | AA410: 560 | AB410: 498 | AC410: 112.44979919678715 | AD410: 16
A411: BEST PLAYERS | W411: COBURG | X411: 4 | Y411: 3 | Z411: 0 | AA411: 535 | AB411: 499 | AC411: 107.21442885771543 | AD411: 16
A412: COBURG | C412: CONDON | F412: HORSKINS | I412: R WILKINSON | L412: McCOLL | N412: H WILKINSON | Q412: HEWES | W412: PRESTON | X412: 4 | Y412: 3 | Z412: 0 | AA412: 563 | AB412: 572 | AC412: 98.426573426573427 | AD412: 16
A413: NORTHCOTE | C413: G POWELL | F413: WOOLNOUGH | I413: ALDRIDGE | L413: HISCOX | N413: McLAINE | Q413: DEVINE | W413: OAKLEIGH | X413: 3 | Y413: 3 | Z413: 1 | AA413: 652 | AB413: 619 | AC413: 105.33117932148627 | AD413: 14
A414: GOALKICKERS | R414: BUCKLEY | W414: BOX HILL | X414: 3 | Y414: 4 | Z414: 0 | AA414: 639 | AB414: 529 | AC414: 120.79395085066163 | AD414: 12
A415: COBURG | C415: ROGAN 2 | E415: HORSKINS 2 | H415: McDONALD 2 | K415: H WILKINSON 2 | N415: McCOLL 2 | Q415: R WILKINSON | T415: HEWES | W415: YARRAVILLE | X415: 2 | Y415: 5 | Z415: 0 | AA415: 524 | AB415: 610 | AC415: 85.901639344262293 | AD415: 8
A416: NORTHCOTE | C416: FRANCIS 4 | F416: COLLINS 2 | I416: DEVINE 2 | K416: G POWELL | M416: HISCOX | W416: BRIGHTON | X416: 2 | Y416: 5 | Z416: 0 | AA416: 429 | AB416: 671 | AC416: 63.934426229508198 | AD416: 8
W417: CAMBERWELL | X417: 1 | Y417: 6 | Z417: 0 | AA417: 535 | AB417: 769 | AC417: 69.570871261378414 | AD417: 4
A418: OAKLEIGH | C418: 3 | D418: 6 | E418: =C418*6+D418 -> 24 | G418: 6 | H418: 7 | I418: =G418*6+H418 -> 43 | K418: 10 | L418: 11 | M418: =K418*6+L418 -> 71 | O418: 12 | P418: 15 | Q418: =O418*6+P418 -> 87 | S418: OAKLEIGH | W418: SANDRINGHAM | X418: 0 | Y418: 7 | Z418: 0 | AA418: 384 | AB418: 891 | AC418: 43.0976430976431 | AD418: 0
A419: BRUNSWICK | C419: 3 | D419: 3 | E419: =C419*6+D419 -> 21 | G419: 7 | H419: 5 | I419: =G419*6+H419 -> 47 | K419: 9 | L419: 7 | M419: =K419*6+L419 -> 61 | O419: 11 | P419: 9 | Q419: =O419*6+P419 -> 75 | S419: MILLER
A420: BEST PLAYERS
A421: OAKLEIGH | C421: GUY | F421: COLLINS | I421: HILL | K421: WEBSTER | N421: WILLIAMS | Q421: LAMBERT
A422: BRUNSWICK | C422: POLLARD | F422: PARKER | I422: ROLFS | K422: MULLENGER | N422: SMITH | Q422: EDWARDS
A423: GOALKICKERS
A424: OAKLEIGH | C424: WEBSTER 5 | F424: SHAW 3 | I424: RYAN | K424: HILL | M424: WALSH | O424: WATSON
A425: BRUNSWICK | C425: HAYES 3 | F425: BURGESS 2 | I425: CULLY 2 | K425: SEYMOUR | M425: EDWARDS | O425: NEILSON | Q425: MULLENGER
A427: PRESTON | C427: 4 | D427: 0 | E427: =C427*6+D427 -> 24 | G427: 10 | H427: 7 | I427: =G427*6+H427 -> 67 | K427: 10 | L427: 9 | M427: =K427*6+L427 -> 69 | O427: 17 | P427: 13 | Q427: =O427*6+P427 -> 115 | S427: YARRAVILLE
A428: YARRAVILLE | C428: 5 | D428: 6 | E428: =C428*6+D428 -> 36 | G428: 10 | H428: 10 | I428: =G428*6+H428 -> 70 | K428: 13 | L428: 14 | M428: =K428*6+L428 -> 92 | O428: 13 | P428: 15 | Q428: =O428*6+P428 -> 93 | S428: CARDWELL
A429: BEST PLAYERS
A430: PRESTON | C430: FOLEY | E430: McBEAN | H430: HARVEY | K430: F CHARD | N430: BROWN | Q430: JEFFREY
A431: YARRAVILLE | C431: WILD | E431: GWYNNE | H431: N ROHLEDER | K431: VANDERFEEN | N431: K SMITH | Q431: S SMITH
A432: GOALKICKERS
A433: PRESTON | C433: F CHARD 6 | F433: FOLEY 4 | H433: McBEAN 2 | J433: LALOR 2 | L433: HAYES | N433: HART | P433: BLENCOWE
A434: YARRAVILLE | C434: K SMITH 3 | F434: HART 2 | H434: VANDERFEEN 2 | K434: TREBILCOCK 2 | N434: HUTCHESON 2 | Q434: MARCHESI | T434: CONNELLY
A436: MOORABBIN | C436: 4 | D436: 5 | E436: =C436*6+D436 -> 29 | G436: 11 | H436: 10 | I436: =G436*6+H436 -> 76 | K436: 12 | L436: 15 | M436: =K436*6+L436 -> 87 | O436: 21 | P436: 22 | Q436: =O436*6+P436 -> 148 | S436: MOORABBIN
A437: CAMBERWELL | C437: 4 | D437: 2 | E437: =C437*6+D437 -> 26 | G437: 6 | H437: 5 | I437: =G437*6+H437 -> 41 | K437: 11 | L437: 14 | M437: =K437*6+L437 -> 80 | O437: 11 | P437: 15 | Q437: =O437*6+P437 -> 81 | S437: SMYTH
A438: BEST PLAYERS
A439: MOORABBIN | C439: McKENZIE | F439: DALY | I439: BOYD | K439: SCANLON | N439: SCHOFIELD | Q439: BROWN
A440: CAMBERWELL | C440: TEMPANY | F440: McFEE | I440: SCOTT | K440: CUNNINGHAM | N440: DENNISON | Q440: DOUGLAS
A441: GOALKICKERS
A442: MOORABBIN | C442: SCHOFIELD 7 | F442: DALY 5 | H442: LEHMANN 2 | K442: MORONEY 2 | N442: McKENZIE 2 | Q442: BARNES | S442: CLOVER | U442: MARSHALL
A443: CAMBERWELL | C443: TEMPANY 3 | F443: McFEE 3 | H443: DUFF 2 | J443: ALLSOPP | L443: SCOTT | N443: HOLYOAK
A445: PORT MELBOURNE | C445: 4 | D445: 5 | E445: =C445*6+D445 -> 29 | G445: 10 | H445: 8 | I445: =G445*6+H445 -> 68 | K445: 12 | L445: 12 | M445: =K445*6+L445 -> 84 | O445: 15 | P445: 19 | Q445: =O445*6+P445 -> 109 | S445: PORT MELBOURNE
A446: BRIGHTON | C446: 1 | D446: 2 | E446: =C446*6+D446 -> 8 | G446: 3 | H446: 5 | I446: =G446*6+H446 -> 23 | K446: 5 | L446: 6 | M446: =K446*6+L446 -> 36 | O446: 6 | P446: 7 | Q446: =O446*6+P446 -> 43 | S446: HARWOOD
A447: BEST PLAYERS
A448: PORT MELBOURNE | C448: WHARTON | F448: JOHNSON | I448: BONNETT | L448: DUNBAR | O448: LAFFEY | Q448: STOREY
A449: BRIGHTON | C449: E TURNER | F449: O'MEARA | I449: COCKFIELD | L449: ALEXANDER | O449: FREEMAN | Q449: POUND
A450: GOALKICKERS
A451: PORT MELBOURNE | C451: BONNETT 7 | F451: MILLER 3 | I451: ATKINSON 2 | L451: JOHNSON | N451: BLACK | P451: BRAGG
A452: BRIGHTON | C452: ALEXANDER 5 | F452: POUND
A454: WILLIAMSTOWN | C454: 6 | D454: 5 | E454: =C454*6+D454 -> 41 | G454: 12 | H454: 7 | I454: =G454*6+H454 -> 79 | K454: 20 | L454: 11 | M454: =K454*6+L454 -> 131 | O454: 25 | P454: 16 | Q454: =O454*6+P454 -> 166 | S454: WILLIAMSTOWN
A455: SANDRINGHAM | C455: 0 | D455: 0 | E455: =C455*6+D455 -> 0 | G455: 2 | H455: 3 | I455: =G455*6+H455 -> 15 | K455: 3 | L455: 3 | M455: =K455*6+L455 -> 21 | O455: 4 | P455: 8 | Q455: =O455*6+P455 -> 32 | S455: BREWER
A456: BEST PLAYERS
A457: WILLIAMSTOWN | C457: WALKER | E457: MARTIN | H457: RAMSAY | K457: WOOKEY | N457: CALLAHAN | Q457: WHITTAKER
A458: SANDRINGHAM | C458: CROFT | E458: J WOODS | H458: PHILLIPS | K458: RUSSO | N458: HARPER | Q458: WARBURTON
A459: GOALKICKERS
A460: WILLIAMSTOWN | C460: WALKER 14 | F460: SIMPSON 3 | I460: TAYLOR 3 | L460: RAMSAY | N460: KENT | P460: EVANS | R460: BARNARD | U460: FISHER
A461: SANDRINGHAM | C461: HARPER 2 | F461: EVANS | I461: CROFT
A463: ROUND 8 | E463: 5TH JUNE | J463: WEATHER | N463: SOUTH EAST WIND COLD | S463: PLAYED AT
D464: 1ST QTR | H464: 2ND QTR | L464: 3RD QTR | P464: FINAL | S464: NORTHCOTE
A465: NORTHCOTE | C465: 4 | D465: 3 | E465: =C465*6+D465 -> 27 | G465: 6 | H465: 4 | I465: =G465*6+H465 -> 40 | K465: 7 | L465: 9 | M465: =K465*6+L465 -> 51 | O465: 10 | P465: 10 | Q465: =O465*6+P465 -> 70 | S465: UMPIRE | X465: LADDER | AB465: ROUND | AD465: 8
A466: WILLIAMSTOWN | C466: 1 | D466: 7 | E466: =C466*6+D466 -> 13 | G466: 5 | H466: 11 | I466: =G466*6+H466 -> 41 | K466: 5 | L466: 14 | M466: =K466*6+L466 -> 44 | O466: 8 | P466: 17 | Q466: =O466*6+P466 -> 65 | S466: MILLER
A467: BEST PLAYERS | W467: TEAM | X467: W | Y467: L | Z467: D | AA467: FOR | AB467: AGST | AC467: % | AD467: PTS
A468: NORTHCOTE | C468: HISCOX | F468: J VAINS | I468: GOUGH | L468: McLAINE | N468: WALKER | Q468: WOOLNOUGH
A469: WILLIAMSTOWN | C469: SIMPSON | F469: LINTON | I469: MARTIN | L469: SMITH | N469: WOOKEY | Q469: CURRAN | W469: PORT MELBOURNE | X469: 7 | Y469: 1 | Z469: 0 | AA469: 939 | AB469: 594 | AC469: 158.08080808080808 | AD469: 28
A470: GOALKICKERS | W470: NORTHCOTE | X470: 6 | Y470: 2 | Z470: 0 | AA470: 659 | AB470: 568 | AC470: 116.02112676056338 | AD470: 24
A471: NORTHCOTE | C471: SEARLE 2 | E471: FRANCIS 2 | H471: WILLIAMSON | K471: GOUGH | M471: G POWELL | O471: COLLINS | Q471: CRAWLEY | S471: DEVINE | W471: MOORABBIN | X471: 5 | Y471: 2 | Z471: 1 | AA471: 701 | AB471: 621 | AC471: 112.88244766505636 | AD471: 22
A472: WILLIAMSTOWN | C472: LINTON 3 | F472: SMITH 2 | I472: SIMPSON 2 | L472: FISHER | W472: WILLIAMSTOWN | X472: 5 | Y472: 3 | Z472: 0 | AA472: 720 | AB472: 438 | AC472: 164.38356164383561 | AD472: 20
A474: MOORABBIN | C474: 3 | D474: 3 | E474: =C474*6+D474 -> 21 | G474: 6 | H474: 7 | I474: =G474*6+H474 -> 43 | K474: 7 | L474: 11 | M474: =K474*6+L474 -> 53 | O474: 9 | P474: 12 | Q474: =O474*6+P474 -> 66 | S474: BRUNSWICK | W474: PRAHRAN | X474: 5 | Y474: 3 | Z474: 0 | AA474: 809 | AB474: 708 | AC474: 114.26553672316385 | AD474: 20
A475: BRUNSWICK | C475: 1 | D475: 2 | E475: =C475*6+D475 -> 8 | G475: 3 | H475: 5 | I475: =G475*6+H475 -> 23 | K475: 5 | L475: 9 | M475: =K475*6+L475 -> 39 | O475: 5 | P475: 12 | Q475: =O475*6+P475 -> 42 | S475: CARDWELL | W475: PRESTON | X475: 5 | Y475: 3 | Z475: 0 | AA475: 634 | AB475: 628 | AC475: 100.95541401273886 | AD475: 20
A476: BEST PLAYERS | W476: OAKLEIGH | X476: 4 | Y476: 3 | Z476: 1 | AA476: 734 | AB476: 678 | AC476: 108.25958702064896 | AD476: 18
A477: MOORABBIN | C477: LAWRENCE | F477: LEHMANN | I477: STANLEY | L477: DALY | N477: SCANLON | Q477: TRESIZE | W477: BRUNSWICK | X477: 4 | Y477: 4 | Z477: 0 | AA477: 602 | AB477: 564 | AC477: 106.73758865248227 | AD477: 16
A478: BRUNSWICK | C478: EDWARDS | F478: LOVETT | I478: ROLFS | L478: YEA | N478: WEIR | Q478: LEYDEN | W478: COBURG | X478: 4 | Y478: 4 | Z478: 0 | AA478: 591 | AB478: 570 | AC478: 103.68421052631579 | AD478: 16
A479: GOALKICKERS | W479: BOX HILL | X479: 3 | Y479: 5 | Z479: 0 | AA479: 698 | AB479: 611 | AC479: 114.23895253682488 | AD479: 12
A480: MOORABBIN | C480: DALY 3 | F480: RENWICK 2 | I480: MORONEY | K480: TRESIZE | M480: BROWN | O480: SCHOFIELD | W480: YARRAVILLE | X480: 3 | Y480: 5 | Z480: 0 | AA480: 585 | AB480: 657 | AC480: 89.041095890410958 | AD480: 12
A481: BRUNSWICK | C481: MULLENGER 2 | F481: EDWARDS | I481: WEIR | K481: O'DEA | W481: BRIGHTON | X481: 2 | Y481: 6 | Z481: 0 | AA481: 476 | AB481: 732 | AC481: 65.027322404371589 | AD481: 8
W482: CAMBERWELL | X482: 1 | Y482: 7 | Z482: 0 | AA482: 620 | AB482: 900 | AC482: 68.888888888888886 | AD482: 4
A483: PRESTON | C483: 2 | D483: 1 | E483: =C483*6+D483 -> 13 | G483: 5 | H483: 6 | I483: =G483*6+H483 -> 36 | K483: 6 | L483: 8 | M483: =K483*6+L483 -> 44 | O483: 10 | P483: 11 | Q483: =O483*6+P483 -> 71 | S483: PRESTON | W483: SANDRINGHAM | X483: 1 | Y483: 7 | Z483: 0 | AA483: 494 | AB483: 993 | AC483: 49.748237663645519 | AD483: 4
A484: COBURG | C484: 3 | D484: 2 | E484: =C484*6+D484 -> 20 | G484: 4 | H484: 3 | I484: =G484*6+H484 -> 27 | K484: 7 | L484: 5 | M484: =K484*6+L484 -> 47 | O484: 8 | P484: 8 | Q484: =O484*6+P484 -> 56 | S484: BREWER
A485: BEST PLAYERS
A486: PRESTON | C486: SWEET | F486: JEFFREY | I486: K CHARD | L486: CROCKER | O486: HENRYS | R486: F CHARD
A487: COBURG | C487: STARBUCK | F487: HORSKINS | I487: WALKER | L487: CONDON | O487: McTAGGART | R487: ROGAN
A488: GOALKICKERS
A489: PRESTON | C489: F CHARD 5 | F489: FOLEY 2 | I489: K CHARD | K489: JEFFREY | M489: BATEMAN
A490: COBURG | C490: R WILKINSON 2 | F490: HORSKINS 2 | I490: McDONALD | L490: McCOLL | N490: HEWES | P490: AITKEN
A492: OAKLEIGH | C492: 3 | D492: 4 | E492: =C492*6+D492 -> 22 | G492: 8 | H492: 9 | I492: =G492*6+H492 -> 57 | K492: 8 | L492: 9 | M492: =K492*6+L492 -> 57 | O492: 12 | P492: 10 | Q492: =O492*6+P492 -> 82 | S492: BOX HILL
A493: BOX HILL | C493: 3 | D493: 5 | E493: =C493*6+D493 -> 23 | G493: 4 | H493: 5 | I493: =G493*6+H493 -> 29 | K493: 8 | L493: 11 | M493: =K493*6+L493 -> 59 | O493: 8 | P493: 11 | Q493: =O493*6+P493 -> 59 | S493: ROACH
A494: BEST PLAYERS
A495: OAKLEIGH | C495: HILL | E495: GUY | H495: TEMME | K495: HOWELL | N495: COLLINS | Q495: WATSON
A496: BOX HILL | C496: KRONK | E496: REED | H496: LOVE | K496: WEBB | N496: HART | Q496: WRIGHT
A497: GOALKICKERS
A498: OAKLEIGH | C498: WATSON 5 | F498: LONIE 2 | H498: RYAN 2 | J498: LAMBERT | L498: COLLINS | N498: WEBSTER
A499: BOX HILL | C499: MORRIS 4 | F499: REED | H499: WEBB | J499: WRIGHT | M499: HOUGHTON
A501: YARRAVILLE | C501: 1 | D501: 1 | E501: =C501*6+D501 -> 7 | G501: 5 | H501: 8 | I501: =G501*6+H501 -> 38 | K501: 6 | L501: 9 | M501: =K501*6+L501 -> 45 | O501: 8 | P501: 13 | Q501: =O501*6+P501 -> 61 | S501: ELSTERNWICK PARK
A502: BRIGHTON | C502: 1 | D502: 4 | E502: =C502*6+D502 -> 10 | G502: 2 | H502: 5 | I502: =G502*6+H502 -> 17 | K502: 6 | L502: 8 | M502: =K502*6+L502 -> 44 | O502: 6 | P502: 11 | Q502: =O502*6+P502 -> 47 | S502: IRVING
A503: BEST PLAYERS | S503: NORTHCOTE
A504: YARRAVILLE | C504: N ROHLEDER | F504: VANDERFEEN | I504: J ROHLEDER | L504: STRONG | O504: SALT | Q504: HART
A505: BRIGHTON | C505: E TURNER | F505: JOSTLEAR | I505: FREEMAN | L505: DAVIDSON | O505: POUND | Q505: COCKFIELD
A506: GOALKICKERS
A507: YARRAVILLE | C507: HART 2 | F507: TREBILCOCK 2 | J507: STRONG 2 | M507: K SMITH | O507: CONNELLY
A508: BRIGHTON | C508: HICKMAN 2 | F508: ALEXANDER | I508: DAVIDSON | L508: POUND | N508: COCKFIELD
A510: SANDRINGHAM | C510: 2 | D510: 1 | E510: =C510*6+D510 -> 13 | G510: 7 | H510: 4 | I510: =G510*6+H510 -> 46 | K510: 11 | L510: 5 | M510: =K510*6+L510 -> 71 | O510: 17 | P510: 8 | Q510: =O510*6+P510 -> 110 | S510: BEACH ROAD
A511: PRAHRAN | C511: 3 | D511: 6 | E511: =C511*6+D511 -> 24 | G511: 8 | H511: 10 | I511: =G511*6+H511 -> 58 | K511: 12 | L511: 18 | M511: =K511*6+L511 -> 90 | O511: 14 | P511: 18 | Q511: =O511*6+P511 -> 102 | S511: HARWOOD
A512: BEST PLAYERS
A513: SANDRINGHAM | C513: J WOODS | F513: RUSSO | I513: PHILLIPS | L513: HARPER | N513: GOODES | Q513: RANSOM
A514: PRAHRAN | C514: WALES | F514: MORROW | I514: HOLLOW | L514: HART | N514: HARVEY | Q514: WALSH
A515: GOALKICKERS
A516: SANDRINGHAM | C516: HARPER 7 | F516: EVANS 4 | I516: J WOODS 3 | L516: PHILLIPS 2 | N516: WARBURTON
A517: PRAHRAN | C517: D KINNABURGH 4 | G517: MORROW 2 | J517: SHARP 2 | M517: WALSH 2 | O517: HOLLOW | Q517: HARVEY | S517: SNOW | U517: ARMSTRONG
A519: PORT MELBOURNE | C519: 3 | D519: 0 | E519: =C519*6+D519 -> 18 | G519: 8 | H519: 7 | I519: =G519*6+H519 -> 55 | K519: 13 | L519: 12 | M519: =K519*6+L519 -> 90 | O519: 19 | P519: 17 | Q519: =O519*6+P519 -> 131 | S519: CAMBERWELL
A520: CAMBERWELL | C520: 4 | D520: 5 | E520: =C520*6+D520 -> 29 | G520: 7 | H520: 7 | I520: =G520*6+H520 -> 49 | K520: 12 | L520: 9 | M520: =K520*6+L520 -> 81 | O520: 12 | P520: 13 | Q520: =O520*6+P520 -> 85 | S520: GAMBLE
A521: BEST PLAYERS
A522: PORT MELBOURNE | C522: WALSH | F522: MILLER | I522: BLACK | L522: DUNBAR | O522: SHANNON | R522: JOHNSON
A523: CAMBERWELL | C523: McFEE | F523: HAYES | I523: YOUNG | L523: MASON | O523: JARRARD | R523: ALLSOPP
A524: GOALKICKERS
A525: PORT MELBOURNE | C525: MILLER 5 | F525: SHANNON 4 | I525: DUNBAR 3 | L525: WALSH 3 | N525: ATKINSON 2 | Q525: JOHNSON | S525: OWENS
A526: CAMBERWELL | C526: McFEE 4 | F526: ALLSOPP 2 | I526: DENNISON 2 | L526: JARRARD | N526: DUGDALE | Q526: McCULLOCH | T526: CARTER
A528: ROUND 9 | E528: 12TH JUNE | I528: WEATHER | L528: SOUTH WEST WIND COLD SHOWERS | S528: PLAYED AT
D529: 1ST QTR | H529: 2ND QTR | L529: 3RD QTR | P529: FINAL | S529: COBURG
A530: WILLIAMSTOWN | C530: 2 | D530: 3 | E530: =C530*6+D530 -> 15 | G530: 6 | H530: 9 | I530: =G530*6+H530 -> 45 | K530: 11 | L530: 12 | M530: =K530*6+L530 -> 78 | O530: 12 | P530: 13 | Q530: =O530*6+P530 -> 85 | S530: UMPIRE | X530: LADDER | AB530: ROUND | AD530: 9
A531: COBURG | C531: 2 | D531: 2 | E531: =C531*6+D531 -> 14 | G531: 4 | H531: 6 | I531: =G531*6+H531 -> 30 | K531: 5 | L531: 6 | M531: =K531*6+L531 -> 36 | O531: 9 | P531: 9 | Q531: =O531*6+P531 -> 63 | S531: HARWOOD
A532: BEST PLAYERS | W532: TEAM | X532: W | Y532: L | Z532: D | AA532: FOR | AB532: AGST | AC532: % | AD532: PTS
A533: WILLIAMSTOWN | C533: SIMPSON | F533: SMITH | I533: SIMS | L533: CURRAN | O533: McLEOD | R533: TAAFE
A534: COBURG | C534: STARBUCK | F534: FEWKES | I534: CONDON | L534: SANDLANT | O534: CLARKSON | R534: LEVERSHA | W534: PORT MELBOURNE | X534: 8 | Y534: 1 | Z534: 0 | AA534: 993 | AB534: 627 | AC534: 158.3732057416268 | AD534: 32
A535: GOALKICKERS | W535: NORTHCOTE | X535: 7 | Y535: 2 | Z535: 0 | AA535: 732 | AB535: 628 | AC535: 116.56050955414013 | AD535: 28
A536: WILLIAMSTOWN | C536: SIMS 3 | F536: SMITH 3 | I536: ANDERSON 2 | L536: RAMSAY 2 | O536: KENT | Q536: SIMPSON | W536: MOORABBIN | X536: 6 | Y536: 2 | Z536: 1 | AA536: 740 | AB536: 649 | AC536: 114.0215716486903 | AD536: 26
A537: COBURG | C537: HORSKINS 2 | F537: McTAGGART 2 | J537: McDONALD | M537: CLARKSON | O537: HEWES | Q537: BUCKLEY | S537: HAYES | W537: WILLIAMSTOWN | X537: 6 | Y537: 3 | Z537: 0 | AA537: 805 | AB537: 501 | AC537: 160.67864271457086 | AD537: 24
A539: YARRAVILLE | C539: 6 | D539: 2 | E539: =C539*6+D539 -> 38 | G539: 7 | H539: 4 | I539: =G539*6+H539 -> 46 | K539: 13 | L539: 6 | M539: =K539*6+L539 -> 84 | O539: 13 | P539: 8 | Q539: =O539*6+P539 -> 86 | S539: YARRAVILLE | W539: OAKLEIGH | X539: 5 | Y539: 3 | Z539: 1 | AA539: 875 | AB539: 730 | AC539: 119.86301369863014 | AD539: 22
A540: CAMBERWELL | C540: 2 | D540: 1 | E540: =C540*6+D540 -> 13 | G540: 6 | H540: 4 | I540: =G540*6+H540 -> 40 | K540: 10 | L540: 5 | M540: =K540*6+L540 -> 65 | O540: 12 | P540: 9 | Q540: =O540*6+P540 -> 81 | S540: BREWER | W540: PRAHRAN | X540: 5 | Y540: 4 | Z540: 0 | AA540: 869 | AB540: 781 | AC540: 111.26760563380282 | AD540: 20
A541: BEST PLAYERS | W541: PRESTON | X541: 5 | Y541: 4 | Z541: 0 | AA541: 734 | AB541: 732 | AC541: 100.27322404371584 | AD541: 20
A542: YARRAVILLE | C542: VANDERFEEN | F542: STRONG | I542: SALT | L542: GWYNNE | N542: N ROHLEDER | Q542: HUTCHESON | W542: BRUNSWICK | X542: 4 | Y542: 5 | Z542: 0 | AA542: 635 | AB542: 618 | AC542: 102.75080906148867 | AD542: 16
A543: CAMBERWELL | C543: HAYES | F543: CUNNINGHAM | I543: McGUINNESS | L543: JARRAD | N543: CARTER | Q543: McFEE | W543: COBURG | X543: 4 | Y543: 5 | Z543: 0 | AA543: 654 | AB543: 655 | AC543: 99.847328244274806 | AD543: 16
A544: GOALKICKERS | W544: YARRAVILLE | X544: 4 | Y544: 5 | Z544: 0 | AA544: 671 | AB544: 738 | AC544: 90.921409214092137 | AD544: 16
A545: YARRAVILLE | C545: K SMITH 4 | F545: TREBILCOCK 2 | I545: MARCHESI 2 | L545: VANDERFEEN 2 | O545: WILLIAMS 2 | R545: HART | W545: BOX HILL | X545: 3 | Y545: 6 | Z545: 0 | AA545: 726 | AB545: 650 | AC545: 111.69230769230769 | AD545: 12
A546: CAMBERWELL | C546: CARTER 2 | E546: HOLYOAK 2 | H546: McFEE 2 | J546: DENNISON 2 | M546: McGUINNES | P546: SCOTT | R546: JARRARD | W546: BRIGHTON | X546: 3 | Y546: 6 | Z546: 0 | AA546: 580 | AB546: 832 | AC546: 69.711538461538467 | AD546: 12
Q547: ALLSOPP | W547: CAMBERWELL | X547: 1 | Y547: 8 | Z547: 0 | AA547: 701 | AB547: 986 | AC547: 71.095334685598374 | AD547: 4
A548: OAKLEIGH | C548: 6 | D548: 6 | E548: =C548*6+D548 -> 42 | G548: 7 | H548: 11 | I548: =G548*6+H548 -> 53 | K548: 13 | L548: 16 | M548: =K548*6+L548 -> 94 | O548: 20 | P548: 21 | Q548: =O548*6+P548 -> 141 | S548: OAKLEIGH | W548: SANDRINGHAM | X548: 1 | Y548: 8 | Z548: 0 | AA548: 546 | AB548: 1134 | AC548: 48.148148148148145 | AD548: 4
A549: SANDRINGHAM | C549: 2 | D549: 2 | E549: =C549*6+D549 -> 14 | G549: 5 | H549: 6 | I549: =G549*6+H549 -> 36 | K549: 7 | L549: 9 | M549: =K549*6+L549 -> 51 | O549: 7 | P549: 10 | Q549: =O549*6+P549 -> 52 | S549: SMYTH
A550: BEST PLAYERS
A551: OAKLEIGH | C551: LAMBERT | F551: COLLINS | I551: TEMME | L551: KNIGHT | N551: EDWARDS | Q551: WATSON
A552: SANDRINGHAM | C552: HARPER | F552: RUSSO | I552: CROFT | L552: WOODS | N552: PHILLIPS | Q552: SECCOMBE
A553: GOALKICKERS
A554: OAKLEIGH | C554: WATSON 4 | F554: WEBSTER 3 | I554: EDWARDS 2 | L554: RYAN 2 | N554: LAMBERT 2 | Q554: SHAW 2 | S554: SAID | U554: GUY | W554: LONIE | X554: COLLINS | Z554: HALL
A555: SANDRINGHAM | C555: HARPER 3 | F555: PHILLIPS | H555: CROFT | J555: GOODES | L555: WOOD
E556: 14TH JUNE | H556: QUEENS BIRTHDAY | L556: WEATHER | P556: NORTH WEST WIND COLD
A557: NORTHCOTE | C557: 1 | D557: 0 | E557: =C557*6+D557 -> 6 | G557: 7 | H557: 7 | I557: =G557*6+H557 -> 49 | K557: 8 | L557: 8 | M557: =K557*6+L557 -> 56 | O557: 10 | P557: 13 | Q557: =O557*6+P557 -> 73 | S557: TOORAK PARK
A558: PRAHRAN | C558: 4 | D558: 8 | E558: =C558*6+D558 -> 32 | G558: 4 | H558: 8 | I558: =G558*6+H558 -> 32 | K558: 8 | L558: 10 | M558: =K558*6+L558 -> 58 | O558: 8 | P558: 12 | Q558: =O558*6+P558 -> 60 | S558: IRVING
A559: BEST PLAYERS
A560: NORTHCOTE | C560: ALDRIDGE | F560: McLAINE | I560: STABB | K560: WOOLNOUGH | N560: WHITECHURCH | Q560: DEVINE
A561: PRAHRAN | C561: SHARP | F561: CAMPBELL | I561: YATES | K561: WALES | N561: PLAIN | Q561: HART
A562: GOALKICKERS
A563: NORTHCOTE | C563: DEVINE 3 | E563: PAYNTER | G563: GOUGH | I563: STABB | K563: SEARLE | M563: COLLINS | O563: FRANCIS | Q563: C POWELL
A564: PRAHRAN | C564: KINNABURGH 2 | G564: MORROW | I564: CLEAR | K564: WALES | M564: PLAIN | O564: HARVEY | Q564: ELLIOTT
A566: PORT MELBOURNE | C566: 2 | D566: 3 | E566: =C566*6+D566 -> 15 | G566: 2 | H566: 3 | I566: =G566*6+H566 -> 15 | K566: 6 | L566: 9 | M566: =K566*6+L566 -> 45 | O566: 7 | P566: 12 | Q566: =O566*6+P566 -> 54 | S566: PORT MELBOURNE
A567: BRUNSWICK | C567: 0 | D567: 0 | E567: =C567*6+D567 -> 0 | G567: 5 | H567: 0 | I567: =G567*6+H567 -> 30 | K567: 5 | L567: 0 | M567: =K567*6+L567 -> 30 | O567: 5 | P567: 3 | Q567: =O567*6+P567 -> 33 | S567: ROACH
A568: BEST PLAYERS
A569: PORT MELBOURNE | C569: WILSON | F569: WALSH | I569: JOHNSON | L569: STOREY | N569: WITHERS | Q569: MILLER
A570: BRUNSWICK | C570: ROLFS | F570: NEILSON | I570: MAY | L570: WEIR | N570: CLUES | Q570: POLLARD
A571: GOALKICKERS
A572: PORT MELBOURNE | C572: WALSH 4 | F572: SHANNON 2 | I572: ATKINSON
A573: BRUNSWICK | C573: NEILSON 2 | F573: WEIR | H573: HAYES | J573: MULLENGER
A575: MOORABBIN | C575: 3 | D575: 3 | E575: =C575*6+D575 -> 21 | G575: 3 | H575: 3 | I575: =G575*6+H575 -> 21 | K575: 5 | L575: 7 | M575: =K575*6+L575 -> 37 | O575: 5 | P575: 9 | Q575: =O575*6+P575 -> 39 | S575: MOORABBIN
A576: BOX HILL | C576: 0 | D576: 0 | E576: =C576*6+D576 -> 0 | G576: 1 | H576: 7 | I576: =G576*6+H576 -> 13 | K576: 1 | L576: 7 | M576: =K576*6+L576 -> 13 | O576: 3 | P576: 10 | Q576: =O576*6+P576 -> 28 | S576: MILLER
A577: BEST PLAYERS
A578: MOORABBIN | C578: SCANLON | F578: K BOYD | I578: McKENZIE | L578: LAWRENCE | O578: REID | Q578: LEHAMNN
A579: BOX HILL | C579: WEBB | F579: IRVINE | I579: MORRIS | L579: LOVE | O579: KRONK | Q579: HOUGHTON
A580: GOALKICKERS
A581: MOORABBIN | C581: K BOYD | F581: DALY | I581: BROEN | L581: McKENZIE | O581: COAD
A582: BOX HILL | C582: REED | F582: WEBB | I582: DIXON
A584: BRIGHTON | C584: 8 | D584: 8 | E584: =C584*6+D584 -> 56 | G584: 8 | H584: 10 | I584: =G584*6+H584 -> 58 | K584: 13 | L584: 14 | M584: =K584*6+L584 -> 92 | O584: 15 | P584: 14 | Q584: =O584*6+P584 -> 104 | S584: PRESTON
A585: PRESTON | C585: 0 | D585: 0 | E585: =C585*6+D585 -> 0 | G585: 9 | H585: 9 | I585: =G585*6+H585 -> 63 | K585: 9 | L585: 10 | M585: =K585*6+L585 -> 64 | O585: 14 | P585: 16 | Q585: =O585*6+P585 -> 100 | S585: HARWOOD
A586: BEST PLAYERS
A587: BRIGHTON | C587: ALEXANDER | F587: FREEMAN | I587: KERR | L587: DAVIDSON | O587: E TURNER | R587: MARINI
A588: PRESTON | C588: HAYES | F588: K CHARD | I588: WALKER | L588: LALOR | O588: CROCKER | R588: BROWN
A589: GOALKICKERS
A590: BRIGHTON | C590: ALEXANDER 3 | F590: MARINI 3 | I590: HICKMAN 3 | L590: POUND | N590: COCKFIELD | Q590: DAVIDSON | S590: CONROY | U590: KERR | W590: G TURNER
A591: PRESTON | C591: HAYES 4 | F591: F CHARD 3 | I591: FOLEY 3 | K591: LALOR 2 | M591: OSBORNE | O591: HART
A593: ROUND 10 | E593: 19TH JUNE | J593: WEATHER | M593: NORTH WEST WIND FINE & SUNNY | S593: PLAYED AT
D594: 1ST QTR | H594: 2ND QTR | L594: 3RD QTR | P594: FINAL | S594: NORTHCOTE
A595: NORTHCOTE | C595: 3 | D595: 1 | E595: =C595*6+D595 -> 19 | G595: 5 | H595: 6 | I595: =G595*6+H595 -> 36 | K595: 7 | L595: 11 | M595: =K595*6+L595 -> 53 | O595: 7 | P595: 15 | Q595: =O595*6+P595 -> 57 | S595: UMPIRE | X595: LADDER | AB595: ROUND | AD595: 10
A596: OAKLEIGH | C596: 3 | D596: 1 | E596: =C596*6+D596 -> 19 | G596: 5 | H596: 4 | I596: =G596*6+H596 -> 34 | K596: 6 | L596: 6 | M596: =K596*6+L596 -> 42 | O596: 8 | P596: 9 | Q596: =O596*6+P596 -> 57 | S596: BREWER
A597: BEST PLAYERS | W597: TEAM | X597: W | Y597: L | Z597: D | AA597: FOR | AB597: AGST | AC597: % | AD597: PTS
A598: NORTHCOTE | C598: McLAINE | F598: HISCOX | I598: STABB | L598: C POWELL | O598: DEVINE | Q598: WOOLNOUGH
A599: OAKLEIGH | C599: COLLINS | F599: BOURKE | I599: WILLIAMS | L599: WEBSTER | O599: HILL | Q599: TEMME | W599: PORT MELBOURNE | X599: 9 | Y599: 1 | Z599: 0 | AA599: 1060 | AB599: 678 | AC599: 156.34218289085547 | AD599: 36
A600: GOALKICKERS | W600: MOORABBIN | X600: 7 | Y600: 2 | Z600: 1 | AA600: 816 | AB600: 677 | AC600: 120.53175775480059 | AD600: 30
A601: NORTHCOTE | C601: FRANCIS 3 | F601: GOUGH 2 | I601: STABB | K601: COLLINS | W601: NORTHCOTE | X601: 7 | Y601: 2 | Z601: 1 | AA601: 789 | AB601: 685 | AC601: 115.18248175182482 | AD601: 30
A602: OAKLEIGH | C602: WEBSTER 4 | F602: WATSON | I602: EDWARDS | L602: HILL | N602: GUY | W602: WILLIAMSTOWN | X602: 7 | Y602: 3 | Z602: 0 | AA602: 878 | AB602: 550 | AC602: 159.63636363636363 | AD602: 28
A604: WILLIAMSTOWN | C604: 4 | D604: 6 | E604: =C604*6+D604 -> 30 | G604: 7 | H604: 7 | I604: =G604*6+H604 -> 49 | K604: 8 | L604: 11 | M604: =K604*6+L604 -> 59 | O604: 10 | P604: 13 | Q604: =O604*6+P604 -> 73 | S604: WILLIAMSTOWN | W604: OAKLEIGH | X604: 5 | Y604: 3 | Z604: 2 | AA604: 932 | AB604: 787 | AC604: 118.42439644218551 | AD604: 24
A605: PRAHRAN | C605: 1 | D605: 1 | E605: =C605*6+D605 -> 7 | G605: 4 | H605: 4 | I605: =G605*6+H605 -> 28 | K605: 5 | L605: 5 | M605: =K605*6+L605 -> 35 | O605: 7 | P605: 7 | Q605: =O605*6+P605 -> 49 | S605: HARWOOD | W605: PRESTON | X605: 6 | Y605: 4 | Z605: 0 | AA605: 858 | AB605: 778 | AC605: 110.28277634961439 | AD605: 24
A606: BEST PLAYERS | W606: PRAHRAN | X606: 5 | Y606: 5 | Z606: 0 | AA606: 918 | AB606: 854 | AC606: 107.49414519906323 | AD606: 20
A607: WILLIAMSTOWN | C607: TAYLOR | E607: HARLEY | H607: FISHER | K607: WOOKEY | N607: SIMPSON | Q607: CALLAHAN | W607: YARRAVILLE | X607: 5 | Y607: 5 | Z607: 0 | AA607: 718 | AB607: 780 | AC607: 92.051282051282058 | AD607: 20
A608: PRAHRAN | C608: PLAIN | E608: HART | H608: ARMSTRONG | K608: HOLLOW | N608: WALSH | Q608: SHILLABEER | W608: COBURG | X608: 4 | Y608: 5 | Z608: 1 | AA608: 732 | AB608: 733 | AC608: 99.863574351978173 | AD608: 18
A609: GOALKICKERS | W609: BRUNSWICK | X609: 4 | Y609: 6 | Z609: 0 | AA609: 677 | AB609: 665 | AC609: 101.80451127819549 | AD609: 16
A610: WILLIAMSTOWN | C610: ANDERSON 3 | F610: FISHER 2 | I610: TAAFE | K610: SIMS | M610: TAYLOR | O610: SIMPSON | Q610: SMITH | W610: BRIGHTON | X610: 3 | Y610: 6 | Z610: 1 | AA610: 658 | AB610: 910 | AC610: 72.307692307692307 | AD610: 14
A611: PRAHRAN | C611: KINNABURGH 3 | F611: MORROW | I611: SHARP | K611: WALSH | M611: HARVEY | W611: BOX HILL | X611: 3 | Y611: 7 | Z611: 0 | AA611: 777 | AB611: 717 | AC611: 108.36820083682008 | AD611: 12
W612: CAMBERWELL | X612: 1 | Y612: 9 | Z612: 0 | AA612: 747 | AB612: 1110 | AC612: 67.297297297297291 | AD612: 4
A613: YARRAVILLE | C613: 5 | D613: 0 | E613: =C613*6+D613 -> 30 | G613: 6 | H613: 0 | I613: =G613*6+H613 -> 36 | K613: 6 | L613: 1 | M613: =K613*6+L613 -> 37 | O613: 7 | P613: 5 | Q613: =O613*6+P613 -> 47 | S613: BRUNSWICK | W613: SANDRINGHAM | X613: 1 | Y613: 9 | Z613: 0 | AA613: 574 | AB613: 1210 | AC613: 47.438016528925623 | AD613: 4
A614: BRUNSWICK | C614: 0 | D614: 1 | E614: =C614*6+D614 -> 1 | G614: 3 | H614: 3 | I614: =G614*6+H614 -> 21 | K614: 3 | L614: 6 | M614: =K614*6+L614 -> 24 | O614: 5 | P614: 12 | Q614: =O614*6+P614 -> 42 | S614: MILLER
A615: BEST PLAYERS
A616: YARRAVILLE | C616: GWYNNE | F616: COOK | I616: NICHOLLS | L616: N ROHLEDER | O616: JONES | Q616: VANDERFEEN
A617: BRUNSWICK | C617: SEYMOUR | F617: BURGESS | I617: WEIR | L617: PARKER | O617: ROLFS | Q617: YEA
A618: GOALKICKERS
A619: YARRAVILLE | C619: HART 2 | F619: MARCHESI 2 | I619: SALT | K619: TREBILCOCK | N619: WILD
A620: BRUNSWICK | C620: CLUES 2 | F620: EDWARDS | I620: BURGESS | L620: SEYMOUR
A622: BRIGHTON | C622: 1 | D622: 0 | E622: =C622*6+D622 -> 6 | G622: 4 | H622: 6 | I622: =G622*6+H622 -> 30 | K622: 4 | L622: 8 | M622: =K622*6+L622 -> 32 | O622: 11 | P622: 12 | Q622: =O622*6+P622 -> 78 | S622: ELSTERNWICK PARK
A623: COBURG | C623: 5 | D623: 8 | E623: =C623*6+D623 -> 38 | G623: 6 | H623: 8 | I623: =G623*6+H623 -> 44 | K623: 10 | L623: 12 | M623: =K623*6+L623 -> 72 | O623: 11 | P623: 12 | Q623: =O623*6+P623 -> 78 | S623: ROACH
A624: BEST PLAYERS
A625: BRIGHTON | C625: E TURNER | F625: BLACKMORE | I625: CONROY | L625: O'MEARA | N625: CRAIG | Q625: EMBLETON
A626: COBURG | C626: SANDLANT | F626: STARBUCK | I626: FEWKES | L626: AITKEN | N626: WALKER | Q626: McDONALD
A627: GOALKICKERS
A628: BRIGHTON | C628: O'MEARA 3 | F628: EMBLETON 2 | I628: COOPER | K628: COCKFIELD | N628: MARINI | P628: CONROY | R628: HICKMAN | U628: POUND
A629: COBURG | C629: McDONALD 3 | F629: AITKEN 2 | I629: KNIGHT 2 | K629: CLARKSON | N629: MARTINI | P629: MAHONEY | R629: H WILKINSON
A631: PRESTON | C631: 1 | D631: 1 | E631: =C631*6+D631 -> 7 | G631: 8 | H631: 8 | I631: =G631*6+H631 -> 56 | K631: 10 | L631: 8 | M631: =K631*6+L631 -> 68 | O631: 18 | P631: 16 | Q631: =O631*6+P631 -> 124 | S631: CAMBERWELL
A632: CAMBERWELL | C632: 3 | D632: 7 | E632: =C632*6+D632 -> 25 | G632: 4 | H632: 7 | I632: =G632*6+H632 -> 31 | K632: 6 | L632: 10 | M632: =K632*6+L632 -> 46 | O632: 6 | P632: 10 | Q632: =O632*6+P632 -> 46 | S632: SMYTH
A633: BEST PLAYERS
A634: PRESTON | C634: FOLEY | F634: F CHARD | I634: COOPER | L634: LALOR | N634: McLACHLAN | Q634: HENRYS
A635: CAMBERWELL | C635: SKALBERG | F635: McFEE | I635: THYNNE | L635: FARRELL | N635: ALWAY | Q635: WRIGHT
A636: GOALKICKERS
A637: PRESTON | C637: F CHARD 8 | F637: LALOR 4 | I637: FOLEY 3 | K637: JEFFREY 2 | M637: COOPER
A638: CAMBERWELL | C638: ALLSOPP 2 | F638: HOLYOAK | I638: McFEE | K638: C McCULLOCH | N638: ALWAY
A640: PORT MELBOURNE | C640: 2 | D640: 5 | E640: =C640*6+D640 -> 17 | G640: 4 | H640: 11 | I640: =G640*6+H640 -> 35 | K640: 5 | L640: 13 | M640: =K640*6+L640 -> 43 | O640: 8 | P640: 19 | Q640: =O640*6+P640 -> 67 | S640: B.H
A641: BOX HILL | C641: 1 | D641: 1 | E641: =C641*6+D641 -> 7 | G641: 3 | H641: 3 | I641: =G641*6+H641 -> 21 | K641: 6 | L641: 7 | M641: =K641*6+L641 -> 43 | O641: 7 | P641: 9 | Q641: =O641*6+P641 -> 51 | S641: CARDWELL
A642: BEST PLAYERS
A643: PORT MELBOURNE | C643: WILSON | F643: JOHNSON | I643: WHARTON | L643: MILLER | N643: SHANNON | Q643: LAFFEY
A644: BOX HILL | C644: IRVINE | F644: ROBINSON | I644: DOUGLAS | L644: DEACON | N644: CAVANAGH | Q644: KRONK
A645: GOALKICKERS
A646: PORT MELBOURNE | C646: HARVEY 2 | F646: WALSH 2 | I646: DUNBAR | K646: OWENS | M646: MILLER | O646: SHANNON
A647: BOX HILL | C647: WEBB 3 | F647: ABBOTT 2 | I647: LOVE | K647: READ
A649: MOORABBIN | C649: 3 | D649: 6 | E649: =C649*6+D649 -> 24 | G649: 5 | H649: 8 | I649: =G649*6+H649 -> 38 | K649: 9 | L649: 15 | M649: =K649*6+L649 -> 69 | O649: 10 | P649: 16 | Q649: =O649*6+P649 -> 76 | S649: BEACH ROAD
A650: SANDRINGHAM | C650: 1 | D650: 0 | E650: =C650*6+D650 -> 6 | G650: 2 | H650: 4 | I650: =G650*6+H650 -> 16 | K650: 2 | L650: 4 | M650: =K650*6+L650 -> 16 | O650: 3 | P650: 10 | Q650: =O650*6+P650 -> 28 | S650: GAMBLE
A651: BEST PLAYERS
A652: MOORABBIN | C652: LAWRENCE | F652: LEHMANN | I652: MURRAY | L652: OSTLE | N652: TRESIZE | Q652: SCANLON
A653: SANDRINGHAM | C653: RUSSO | F653: SECCOMBE | I653: DELANEY | L653: CROFT | N653: HANNAFORD | Q653: RANSOM
A654: GOALKICKERS
A655: MOORABBIN | C655: SCHOFIELD 4 | F655: McFARLANE 2 | I655: DALY 2 | K655: McKENZIE | M655: COAD
A656: SANDRINGHAM | C656: EVANS | F656: WOODS | I656: HARPER
A658: ROUND 11 | E658: 26TH JUNE | J658: WEATHER | M658: NORTH WEST BREEZE FINE & SUNNY | S658: PLAYED AT
D659: 1ST QTR | H659: 2ND QTR | L659: 3RD QTR | P659: FINAL | S659: MOORABBIN
A660: MOORABBIN | C660: 4 | D660: 1 | E660: =C660*6+D660 -> 25 | G660: 5 | H660: 5 | I660: =G660*6+H660 -> 35 | K660: 8 | L660: 9 | M660: =K660*6+L660 -> 57 | O660: 8 | P660: 11 | Q660: =O660*6+P660 -> 59 | S660: UMPIRE | X660: LADDER | AB660: ROUND | AD660: 11
A661: NORTHCOTE | C661: 1 | D661: 0 | E661: =C661*6+D661 -> 6 | G661: 2 | H661: 4 | I661: =G661*6+H661 -> 16 | K661: 3 | L661: 4 | M661: =K661*6+L661 -> 22 | O661: 6 | P661: 8 | Q661: =O661*6+P661 -> 44 | S661: IRVING
A662: BEST PLAYERS | W662: TEAM | X662: W | Y662: L | Z662: D | AA662: FOR | AB662: AGST | AC662: % | AD662: PTS
A663: MOORABBIN | C663: LAWRENCE | F663: TRESIZE | I663: OSTLE | K663: BECKWITH | N663: MURRAY | Q663: STANLEY
A664: NORTHCOTE | C664: STABB | F664: WHITECHURCH | I664: J VAINS | K664: PAYNTER | N664: ALDRIDGE | Q664: DEVINE | W664: PORT MELBOURNE | X664: 10 | Y664: 1 | Z664: 0 | AA664: 1207 | AB664: 707 | AC664: 170.72135785007072 | AD664: 40
A665: GOALKICKERS | W665: MOORABBIN | X665: 8 | Y665: 2 | Z665: 1 | AA665: 875 | AB665: 721 | AC665: 121.35922330097087 | AD665: 34
A666: MOORABBIN | C666: SCHOFIELD 2 | F666: COAD 2 | I666: TRESIZE | K666: JEEVES | M666: LEHMANN | P666: DALY | W666: WILLIAMSTOWN | X666: 8 | Y666: 3 | Z666: 0 | AA666: 989 | AB666: 633 | AC666: 156.24012638230647 | AD666: 32
A667: NORTHCOTE | C667: GOUGH 2 | F667: FRANCIS | I667: WILLIAMSON | L667: DEVINE | N667: CRAWLEY | W667: NORTHCOTE | X667: 7 | Y667: 3 | Z667: 1 | AA667: 833 | AB667: 744 | AC667: 111.96236559139786 | AD667: 30
A669: WILLIAMSTOWN | C669: 4 | D669: 7 | E669: =C669*6+D669 -> 31 | G669: 6 | H669: 8 | I669: =G669*6+H669 -> 44 | K669: 13 | L669: 9 | M669: =K669*6+L669 -> 87 | O669: 16 | P669: 15 | Q669: =O669*6+P669 -> 111 | S669: OAKLEIGH | W669: PRESTON | X669: 7 | Y669: 4 | Z669: 0 | AA669: 910 | AB669: 822 | AC669: 110.70559610705597 | AD669: 28
A670: OAKLEIGH | C670: 4 | D670: 3 | E670: =C670*6+D670 -> 27 | G670: 8 | H670: 5 | I670: =G670*6+H670 -> 53 | K670: 10 | L670: 8 | M670: =K670*6+L670 -> 68 | O670: 12 | P670: 11 | Q670: =O670*6+P670 -> 83 | S670: ROACH | W670: OAKLEIGH | X670: 5 | Y670: 4 | Z670: 2 | AA670: 1015 | AB670: 898 | AC670: 113.02895322939867 | AD670: 24
A671: BEST PLAYERS | W671: YARRAVILLE | X671: 6 | Y671: 5 | Z671: 0 | AA671: 822 | AB671: 869 | AC671: 94.59148446490218 | AD671: 24
A672: WILLIAMSTOWN | C672: LINTON | F672: SIMPSON | I672: ANDERSON | L672: MARTIN | O672: HARLEY | Q672: SMITH | W672: COBURG | X672: 5 | Y672: 5 | Z672: 1 | AA672: 819 | AB672: 815 | AC672: 100.49079754601227 | AD672: 22
A673: OAKLEIGH | C673: TEMME | F673: HILL | I673: WATSON | L673: LAMBERT | O673: SAVORY | Q673: RYAN | W673: PRAHRAN | X673: 5 | Y673: 6 | Z673: 0 | AA673: 1000 | AB673: 941 | AC673: 106.26992561105207 | AD673: 20
A674: GOALKICKERS | W674: BRIGHTON | X674: 4 | Y674: 6 | Z674: 1 | AA674: 716 | AB674: 958 | AC674: 74.739039665970779 | AD674: 18
A675: WILLIAMSTOWN | C675: ANDERSON 4 | F675: LINTON 4 | I675: SMITH 4 | K675: TAYLOR | M675: SIMS | N675: SIMPSON | W675: BRUNSWICK | X675: 4 | Y675: 7 | Z675: 0 | AA675: 721 | AB675: 717 | AC675: 100.557880055788 | AD675: 16
A676: OAKLEIGH | C676: RYAN 3 | F676: WATSON 3 | I676: COLLINS 2 | L676: SAID 2 | N676: WALSH | P676: HILL | W676: BOX HILL | X676: 3 | Y676: 8 | Z676: 0 | AA676: 866 | AB676: 821 | AC676: 105.48112058465286 | AD676: 12
W677: CAMBERWELL | X677: 1 | Y677: 10 | Z677: 0 | AA677: 795 | AB677: 1168 | AC677: 68.06506849315069 | AD677: 4
A678: COBURG | C678: 1 | D678: 4 | E678: =C678*6+D678 -> 10 | G678: 4 | H678: 10 | I678: =G678*6+H678 -> 34 | K678: 7 | L678: 12 | M678: =K678*6+L678 -> 54 | O678: 12 | P678: 15 | Q678: =O678*6+P678 -> 87 | S678: COBURG | W678: SANDRINGHAM | X678: 1 | Y678: 10 | Z678: 0 | AA678: 603 | AB678: 1357 | AC678: 44.43625644804716 | AD678: 4
A679: PRAHRAN | C679: 3 | D679: 4 | E679: =C679*6+D679 -> 22 | G679: 4 | H679: 6 | I679: =G679*6+H679 -> 30 | K679: 10 | L679: 9 | M679: =K679*6+L679 -> 69 | O679: 12 | P679: 10 | Q679: =O679*6+P679 -> 82 | S679: CARDWELL
A680: BEST PLAYERS
A681: COBURG | C681: McTAGGART | F681: H WILKINSON | J681: HORSKINS | M681: STARBUCK | P681: R WILKINSON | S681: BUCKLEY
A682: PRAHRAN | C682: D KINNABURGH | G682: YATES | J682: WALSH | M682: SHILLABEER | P682: J JONES | S682: KRUSE
A683: GOALKICKERS
A684: COBURG | C684: HORSKINS 4 | F684: McDONALD 2 | I684: R WILKINSON 2 | M684: H WILKINSON | P684: FEWKES | R684: AITKEN | T684: McTAGGART
A685: PRAHRAN | C685: D KINNABURGH 7 | G685: HARVEY 2 | J685: KRUSE | L685: SHARP | N685: MORROW
A687: PRESTON | C687: 0 | D687: 6 | E687: =C687*6+D687 -> 6 | G687: 0 | H687: 7 | I687: =G687*6+H687 -> 7 | K687: 6 | L687: 13 | M687: =K687*6+L687 -> 49 | O687: 6 | P687: 16 | Q687: =O687*6+P687 -> 52 | S687: PRESTON
A688: BRUNSWICK | C688: 0 | D688: 2 | E688: =C688*6+D688 -> 2 | G688: 4 | H688: 10 | I688: =G688*6+H688 -> 34 | K688: 4 | L688: 14 | M688: =K688*6+L688 -> 38 | O688: 5 | P688: 14 | Q688: =O688*6+P688 -> 44 | S688: MALLETT
A689: BEST PLAYERS
A690: PRESTON | C690: HENRYS | E690: SWEET | H690: K CHARD | K690: CROCKER | N690: FOLEY | Q690: McLACHLAN
A691: BRUNSWICK | C691: LOVETT | E691: WEIR | H691: NEILSON | K691: ROLFS | N691: YEA | Q691: POLLARD
A692: GOALKICKERS
A693: PRESTON | C693: HAYES | E693: FOLEY | H693: F CHARD | K693: JEFFREY | N693: COOPER | Q693: BLENCOWE
A694: BRUNSWICK | C694: CLUES | E694: NEILSON | H694: MAHER | K694: SEYMOUR | N694: LEYDEN
A696: BRIGHTON | C696: 3 | D696: 2 | E696: =C696*6+D696 -> 20 | G696: 3 | H696: 2 | I696: =G696*6+H696 -> 20 | K696: 7 | L696: 6 | M696: =K696*6+L696 -> 48 | O696: 8 | P696: 10 | Q696: =O696*6+P696 -> 58 | S696: ELSTERNWICK PARK
A697: CAMBERWELL | C697: 0 | D697: 2 | E697: =C697*6+D697 -> 2 | G697: 1 | H697: 6 | I697: =G697*6+H697 -> 12 | K697: 2 | L697: 7 | M697: =K697*6+L697 -> 19 | O697: 6 | P697: 12 | Q697: =O697*6+P697 -> 48 | S697: PITTARD
A698: BEST PLAYERS
A699: BRIGHTON | C699: E TURNER | F699: COCKFIELD | I699: ALEXANDER | L699: O'MEARA | O699: READ | R699: HICKMAN
A700: CAMBERWELL | C700: KILBY | F700: THYNNE | I700: JARRARD | L700: SKALBERG | O700: FARRELL | R700: FLETCHER
A701: GOALKICKERS
A702: BRIGHTON | C702: GRIENKE 3 | F702: ALEXANDER 2 | I702: COCKFIELD | L702: PICKERING | N702: POUND
A703: CAMBERWELL | C703: KILBY | E703: FARRELL | G703: JOHNSTON | J703: McFEE | L703: THYNNE | N703: SKALBERG
A705: YARRAVILLE | C705: 5 | D705: 3 | E705: =C705*6+D705 -> 33 | G705: 7 | H705: 5 | I705: =G705*6+H705 -> 47 | K705: 15 | L705: 8 | M705: =K705*6+L705 -> 98 | O705: 15 | P705: 14 | Q705: =O705*6+P705 -> 104 | S705: YARRAVILLE
A706: BOX HILL | C706: 0 | D706: 0 | E706: =C706*6+D706 -> 0 | G706: 10 | H706: 2 | I706: =G706*6+H706 -> 62 | K706: 11 | L706: 3 | M706: =K706*6+L706 -> 69 | O706: 14 | P706: 5 | Q706: =O706*6+P706 -> 89 | S706: GAMBLE
A707: BEST PLAYERS
A708: YARRAVILLE | C708: TREBILCOCK | F708: N ROHLEDER | I708: SALT | L708: VANDERFEEN | O708: NICHOLLS | R708: GWYNNE
A709: BOX HILL | C709: WEBB | F709: HARRIS | I709: TURNER | L709: RATTRAY | O709: DEACON | R709: WRIGHT
A710: GOALKICKERS
A711: YARRAVILLE | C711: TREBILCOCK 6 | F711: MASON 2 | I711: HART 2 | K711: MARCHESI 2 | N711: GWYNNE | P711: CONNELLY | R711: K SMITH
A712: BOX HILL | C712: MORRIS 5 | F712: TURNER 5 | I712: GREEN | K712: LOVE | M712: EDNIE | O712: IRVINE
A714: PORT MELBOURNE | C714: 5 | D714: 6 | E714: =C714*6+D714 -> 36 | G714: 9 | H714: 9 | I714: =G714*6+H714 -> 63 | K714: 16 | L714: 11 | M714: =K714*6+L714 -> 107 | O714: 22 | P714: 15 | Q714: =O714*6+P714 -> 147 | S714: PORT MELBOURNE
A715: SANDRINGHAM | C715: 1 | D715: 0 | E715: =C715*6+D715 -> 6 | G715: 2 | H715: 3 | I715: =G715*6+H715 -> 15 | K715: 4 | L715: 4 | M715: =K715*6+L715 -> 28 | O715: 4 | P715: 5 | Q715: =O715*6+P715 -> 29 | S715: BREWER
A716: BEST PLAYERS
A717: PORT MELBOURNE | C717: JOHNSON | F717: STOREY | I717: WILSON | L717: MILLER | N717: SYKES | Q717: OWENS
A718: SANDRINGHAM | C718: SHEARS | F718: POTTER | I718: RANSOM | L718: RUSSO | N718: CROFT | Q718: SIMMONDS
A719: GOALKICKERS
A720: PORT MELBOURNE | C720: MILLER 8 | E720: OLDFIELD 3 | H720: BONNETT 3 | J720: SHANNON 2 | M720: WALSH 2 | O720: BLACK | Q720: JOHNSON | T720: SYKES | V720: AUDAS
A721: SANDRINGHAM | C721: HARPER 4
A723: ROUND 12 | E723: 3RD JULY | J723: WEATHER | O723: NORTH BREEZE DULL | S723: PLAYED AT
D724: 1ST QTR | H724: 2ND QTR | L724: 3RD QTR | P724: FINAL | S724: NORTHCOTE
A725: PORT MELBOURNE | C725: 4 | D725: 5 | E725: =C725*6+D725 -> 29 | G725: 8 | H725: 6 | I725: =G725*6+H725 -> 54 | K725: 9 | L725: 10 | M725: =K725*6+L725 -> 64 | O725: 13 | P725: 12 | Q725: =O725*6+P725 -> 90 | S725: UMPIRE | X725: LADDER | AB725: ROUND | AD725: 12
A726: NORTHCOTE | C726: 2 | D726: 2 | E726: =C726*6+D726 -> 14 | G726: 4 | H726: 5 | I726: =G726*6+H726 -> 29 | K726: 7 | L726: 6 | M726: =K726*6+L726 -> 48 | O726: 8 | P726: 10 | Q726: =O726*6+P726 -> 58 | S726: ROACH
A727: BEST PLAYERS | W727: TEAM | X727: W | Y727: L | Z727: D | AA727: FOR | AB727: AGST | AC727: % | AD727: PTS
A728: PORT MELBOURNE | C728: FRASER | F728: MILLER | I728: METHERALL | L728: WILSON | N728: BRAGG | Q728: WITHERS
A729: NORTHCOTE | C729: PAYNTER | F729: HISCOX | I729: WALKER | L729: HOLT | N729: COLLINS | Q729: ALDRIDGE | W729: PORT MELBOURNE | X729: 11 | Y729: 1 | Z729: 0 | AA729: 1297 | AB729: 765 | AC729: 169.54248366013073 | AD729: 44
A730: GOALKICKERS | W730: WILLIAMSTOWN | X730: 9 | Y730: 3 | Z730: 0 | AA730: 1063 | AB730: 702 | AC730: 151.42450142450141 | AD730: 36
A731: PORT MELBOURNE | C731: MILLER 4 | E731: AUDAS 2 | G731: BONNETT 2 | J731: SYKES | L731: OLDFIELD | N731: STOREY | P731: JOHNSON | R731: SHANNON | W731: MOORABBIN | X731: 8 | Y731: 3 | Z731: 1 | AA731: 944 | AB731: 795 | AC731: 118.74213836477988 | AD731: 34
A732: NORTHCOTE | C732: COLLINS 3 | F732: HUNTER 2 | I732: WOOLNOUGH | L732: JOHNSON | N732: DEVINE | W732: NORTHCOTE | X732: 7 | Y732: 4 | Z732: 1 | AA732: 891 | AB732: 834 | AC732: 106.83453237410072 | AD732: 30
A734: WILLIAMSTOWN | C734: 2 | D734: 4 | E734: =C734*6+D734 -> 16 | G734: 6 | H734: 6 | I734: =G734*6+H734 -> 42 | K734: 9 | L734: 11 | M734: =K734*6+L734 -> 65 | O734: 10 | P734: 14 | Q734: =O734*6+P734 -> 74 | S734: WILLIAMSTOWN | W734: OAKLEIGH | X734: 6 | Y734: 4 | Z734: 2 | AA734: 1158 | AB734: 1010 | AC734: 114.65346534653466 | AD734: 28
A735: MOORABBIN | C735: 0 | D735: 3 | E735: =C735*6+D735 -> 3 | G735: 3 | H735: 7 | I735: =G735*6+H735 -> 25 | K735: 5 | L735: 10 | M735: =K735*6+L735 -> 40 | O735: 9 | P735: 15 | Q735: =O735*6+P735 -> 69 | S735: BREWER | W735: PRESTON | X735: 7 | Y735: 5 | Z735: 0 | AA735: 993 | AB735: 910 | AC735: 109.12087912087912 | AD735: 28
A736: BEST PLAYERS | W736: YARRAVILLE | X736: 7 | Y736: 5 | Z736: 0 | AA736: 930 | AB736: 960 | AC736: 96.875 | AD736: 28
A737: WILLIAMSTOWN | C737: SIMPSON | F737: CALLAHAN | I737: MARTIN | L737: HARLEY | O737: ALFORD | Q737: MCLEOD | W737: COBURG | X737: 6 | Y737: 5 | Z737: 1 | AA737: 888 | AB737: 865 | AC737: 102.65895953757226 | AD737: 26
A738: MOORABBIN | C738: LEHMANN | F738: STANLEY | I738: DALY | L738: MURPHY | O738: OSTLE | Q738: LAWRENCE | W738: BRUNSWICK | X738: 5 | Y738: 7 | Z738: 0 | AA738: 788 | AB738: 748 | AC738: 105.3475935828877 | AD738: 20
A739: GOALKICKERS | W739: PRAHRAN | X739: 5 | Y739: 7 | Z739: 0 | AA739: 1112 | AB739: 1084 | AC739: 102.58302583025831 | AD739: 20
A740: WILLIAMSTOWN | C740: ABBERTON 3 | F740: LINTON 2 | I740: ALFORD 2 | K740: WALKER | M740: SIMPSON | O740: ANDERSON | W740: BRIGHTON | X740: 4 | Y740: 7 | Z740: 1 | AA740: 747 | AB740: 1025 | AC740: 72.878048780487802 | AD740: 18
A741: MOORABBIN | C741: DALY 2 | F741: TRESIZE 2 | I741: MORONEY | K741: SCHOFIELD | N741: COAD | P741: LEHMANN | R741: JEEVES | W741: BOX HILL | X741: 4 | Y741: 8 | Z741: 0 | AA741: 954 | AB741: 904 | AC741: 105.53097345132744 | AD741: 16
W742: CAMBERWELL | X742: 1 | Y742: 11 | Z742: 0 | AA742: 845 | AB742: 1237 | AC742: 68.310428455941789 | AD742: 4
A743: OAKLEIGH | C743: 9 | D743: 6 | E743: =C743*6+D743 -> 60 | G743: 14 | H743: 8 | I743: =G743*6+H743 -> 92 | K743: 18 | L743: 9 | M743: =K743*6+L743 -> 117 | O743: 22 | P743: 11 | Q743: =O743*6+P743 -> 143 | S743: TOORAK PARK | W743: SANDRINGHAM | X743: 1 | Y743: 11 | Z743: 0 | AA743: 694 | AB743: 1465 | AC743: 47.372013651877133 | AD743: 4
A744: PRAHRAN | C744: 1 | D744: 3 | E744: =C744*6+D744 -> 9 | G744: 5 | H744: 7 | I744: =G744*6+H744 -> 37 | K744: 8 | L744: 9 | M744: =K744*6+L744 -> 57 | O744: 16 | P744: 16 | Q744: =O744*6+P744 -> 112 | S744: MALLETT
A745: BEST PLAYERS
A746: OAKLEIGH | C746: SAVORY | F746: WALSH | I746: WATSON | L746: HILL | N746: EDWARDS | Q746: COLLINS
A747: PRAHRAN | C747: HARVEY | F747: KRUSE | I747: J JONES | L747: WALES | N747: HART | Q747: D KINNABURGH
A748: GOALKICKERS
A749: OAKLEIGH | C749: WALSH 5 | F749: WATSON 5 | I749: RYAN 3 | K749: EDWARDS 3 | N749: WEBSTER 3 | Q749: SHAW 2 | S749: COLLINS
A750: PRAHRAN | C750: D KINNABURGH 5 | G750: ELLIOTT 4 | J750: SHARP 4 | M750: WALSH 2 | O750: HARVEY
A752: BRUNSWICK | C752: 1 | D752: 5 | E752: =C752*6+D752 -> 11 | G752: 2 | H752: 13 | I752: =G752*6+H752 -> 25 | K752: 4 | L752: 14 | M752: =K752*6+L752 -> 38 | O752: 8 | P752: 19 | Q752: =O752*6+P752 -> 67 | S752: BRUNSWICK
A753: BRIGHTON | C753: 0 | D753: 3 | E753: =C753*6+D753 -> 3 | G753: 1 | H753: 4 | I753: =G753*6+H753 -> 10 | K753: 3 | L753: 7 | M753: =K753*6+L753 -> 25 | O753: 4 | P753: 7 | Q753: =O753*6+P753 -> 31 | S753: CARDWELL
A754: BEST PLAYERS
A755: BRUNSWICK | C755: WEIR | F755: CLUES | I755: MILBURN | L755: MAHER | N755: YEA | Q755: NEILSON
A756: BRIGHTON | C756: FREEMAN | F756: O'MEARA | I756: COOPER | L756: READ | N756: E TURNER | Q756: KERR
A757: GOALKICKERS
A758: BRUNSWICK | C758: CLUES 4 | F758: NEILSON 2 | I758: MILBURN | L758: STANLEY
A759: BRIGHTON | C759: POUND 2 | F759: KERR 2
A761: BOX HILL | C761: 9 | D761: 1 | E761: =C761*6+D761 -> 55 | G761: 9 | H761: 2 | I761: =G761*6+H761 -> 56 | K761: 12 | L761: 4 | M761: =K761*6+L761 -> 76 | O761: 14 | P761: 4 | Q761: =O761*6+P761 -> 88 | S761: B'H
A762: PRESTON | C762: 1 | D762: 5 | E762: =C762*6+D762 -> 11 | G762: 5 | H762: 7 | I762: =G762*6+H762 -> 37 | K762: 6 | L762: 8 | M762: =K762*6+L762 -> 44 | O762: 12 | P762: 11 | Q762: =O762*6+P762 -> 83 | S762: PITTARD
A763: BEST PLAYERS
A764: BOX HILL | C764: WRIGHT | F764: GREEN | I764: MORRIS | L764: H BLUNDY | O764: WEBB | Q764: TURNER
A765: PRESTON | C765: PRITCHARD | F765: COOPER | I765: FOLEY | L765: McLACHLAN | O765: SWEET | Q765: BLIZZARD
A766: GOALKICKERS
A767: BOX HILL | C767: DOUGLAS 3 | F767: WEBB 2 | H767: TURNER 2 | J767: GREEN 2 | L767: EDNIE 2 | O767: MORRIS | Q767: WEST | S767: KRONK
A768: PRESTON | C768: F CHARD 5 | F768: HAYES 3 | I768: BLIZZARD | K768: BLENCOWE | N768: LALOR | P768: McLACHLAN
A770: COBURG | C770: 1 | D770: 2 | E770: =C770*6+D770 -> 8 | G770: 4 | H770: 5 | I770: =G770*6+H770 -> 29 | K770: 6 | L770: 5 | M770: =K770*6+L770 -> 41 | O770: 10 | P770: 9 | Q770: =O770*6+P770 -> 69 | S770: CAMBERWELL
A771: CAMBERWELL | C771: 2 | D771: 3 | E771: =C771*6+D771 -> 15 | G771: 3 | H771: 3 | I771: =G771*6+H771 -> 21 | K771: 6 | L771: 7 | M771: =K771*6+L771 -> 43 | O771: 7 | P771: 8 | Q771: =O771*6+P771 -> 50 | S771: IRVING
A772: BEST PLAYERS
A773: COBURG | C773: H WILKINSON | F773: STARBUCK | I773: McDONALD | L773: AITKEN | N773: HORSKINS | Q773: McTAGGART
A774: CAMBERWELL | C774: FLETCHER | F774: JARRARD | I774: YOUNG | L774: DUFF | N774: McGUINNESS | Q774: SKALBERG
A775: GOALKICKERS
A776: COBURG | C776: H WILKINSON 3 | F776: McDONALD 3 | I776: HORSKINS 2 | L776: R WILKINSON | O776: MAHONEY
A777: CAMBERWELL | C777: McFEE 2 | E777: HOLYOAK 2 | H777: HAYES | J777: ALLSOPP | M777: MASON
A779: YARRAVILLE | C779: 2 | D779: 3 | E779: =C779*6+D779 -> 15 | G779: 10 | H779: 8 | I779: =G779*6+H779 -> 68 | K779: 12 | L779: 11 | M779: =K779*6+L779 -> 83 | O779: 15 | P779: 18 | Q779: =O779*6+P779 -> 108 | S779: BEACH ROAD
A780: SANDRINGHAM | C780: 6 | D780: 2 | E780: =C780*6+D780 -> 38 | G780: 9 | H780: 8 | I780: =G780*6+H780 -> 62 | K780: 12 | L780: 5 | M780: =K780*6+L780 -> 77 | O780: 14 | P780: 7 | Q780: =O780*6+P780 -> 91 | S780: MILLER
A781: BEST PLAYERS
A782: YARRAVILLE | C782: MASON | E782: WILD | H782: J ROHLEDER | K782: WILLIAMS | N782: K SMITH | Q782: TREBILCOCK
A783: SANDRINGHAM | C783: CROFT | E783: HARPER | H783: SIMMONDS | K783: WOODS | N783: EVANS | Q783: FLEMING
A784: GOALKICKERS
A785: YARRAVILLE | C785: TREBILCOCK 5 | F785: MASON 4 | I785: J ROHLEDER 2 | L785: HART 2 | N785: WILLIAMS | Q785: CONNELLY
A786: SANDRINGHAM | C786: HARPER 8 | F786: CROFT 2 | I786: WARBURTON | L786: RAEBURN | N786: J WOODS | Q786: BURKE
A788: ROUND 13 | E788: 10TH JULY | J788: WEATHER | O788: COLD FOGGY | S788: PLAYED AT
D789: 1ST QTR | H789: 2ND QTR | L789: 3RD QTR | P789: FINAL | S789: PORT MELBOURNE
A790: WILLIAMSTOWN | C790: 2 | D790: 7 | E790: =C790*6+D790 -> 19 | G790: 5 | H790: 12 | I790: =G790*6+H790 -> 42 | K790: 10 | L790: 13 | M790: =K790*6+L790 -> 73 | O790: 12 | P790: 19 | Q790: =O790*6+P790 -> 91 | S790: UMPIRE | X790: LADDER | AB790: ROUND | AD790: 13
A791: PORT MELBOURNE | C791: 1 | D791: 6 | E791: =C791*6+D791 -> 12 | G791: 2 | H791: 11 | I791: =G791*6+H791 -> 23 | K791: 5 | L791: 16 | M791: =K791*6+L791 -> 46 | O791: 8 | P791: 23 | Q791: =O791*6+P791 -> 71 | S791: GAMBLE
A792: BEST PLAYERS | W792: TEAM | X792: W | Y792: L | Z792: D | AA792: FOR | AB792: AGST | AC792: % | AD792: PTS
A793: WILLIAMSTOWN | C793: SIMPSON | F793: MARTIN | I793: CALLAHAN | L793: FISHER | N793: CURRAN | Q793: MUNDAY
A794: PORT MELBOURNE | C794: MILLER | F794: STOREY | I794: SYKES | L794: WILSON | N794: KELSEY | Q794: WALSH | W794: PORT MELBOURNE | X794: 11 | Y794: 2 | Z794: 0 | AA794: 1368 | AB794: 856 | AC794: 159.81308411214954 | AD794: 44
A795: GOALKICKERS | W795: WILLIAMSTOWN | X795: 10 | Y795: 3 | Z795: 0 | AA795: 1154 | AB795: 773 | AC795: 149.28848641655887 | AD795: 40
A796: WILLIAMSTOWN | C796: LINTON 3 | F796: ABBERTON 3 | I796: FISHER 2 | K796: CALLAHAN | N796: SIMPSON | P796: ANDERSON | R796: EVANS | W796: MOORABBIN | X796: 9 | Y796: 3 | Z796: 1 | AA796: 1013 | AB796: 858 | AC796: 118.06526806526807 | AD796: 38
A797: PORT MELBOURNE | C797: BONNETT 2 | F797: MILLER 2 | I797: WALSH 2 | L797: OLDFIELD | N797: ATKINSON | W797: PRESTON | X797: 8 | Y797: 5 | Z797: 0 | AA797: 1123 | AB797: 920 | AC797: 122.06521739130434 | AD797: 32
A799: YARRAVILLE | C799: 3 | D799: 4 | E799: =C799*6+D799 -> 22 | G799: 6 | H799: 6 | I799: =G799*6+H799 -> 42 | K799: 10 | L799: 12 | M799: =K799*6+L799 -> 72 | O799: 13 | P799: 12 | Q799: =O799*6+P799 -> 90 | S799: YARRAVILLE | W799: YARRAVILLE | X799: 8 | Y799: 5 | Z799: 0 | AA799: 1020 | AB799: 1013 | AC799: 100.69101678183613 | AD799: 32
A800: NORTHCOTE | C800: 2 | D800: 2 | E800: =C800*6+D800 -> 14 | G800: 3 | H800: 3 | I800: =G800*6+H800 -> 21 | K800: 6 | L800: 4 | M800: =K800*6+L800 -> 40 | O800: 8 | P800: 5 | Q800: =O800*6+P800 -> 53 | S800: PITTARD | W800: COBURG | X800: 7 | Y800: 5 | Z800: 1 | AA800: 958 | AB800: 922 | AC800: 103.90455531453362 | AD800: 30
A801: BEST PLAYERS | W801: NORTHCOTE | X801: 7 | Y801: 5 | Z801: 1 | AA801: 944 | AB801: 924 | AC801: 102.16450216450217 | AD801: 30
A802: YARRAVILLE | C802: CONNELLY | F802: GWYNNE | I802: SALT | K802: J ROHLEDER | N802: N ROHLEDER | Q802: VANDERFEEN | W802: OAKLEIGH | X802: 6 | Y802: 5 | Z802: 2 | AA802: 1215 | AB802: 1080 | AC802: 112.5 | AD802: 28
A803: NORTHCOTE | C803: STABB | F803: PAYNTER | I803: HISCOX | K803: FRANCIS | N803: C POWELL | Q803: GOUGH | W803: BRUNSWICK | X803: 6 | Y803: 7 | Z803: 0 | AA803: 888 | AB803: 841 | AC803: 105.58858501783591 | AD803: 24
A804: GOALKICKERS | W804: BOX HILL | X804: 5 | Y804: 8 | Z804: 0 | AA804: 1054 | AB804: 980 | AC804: 107.55102040816327 | AD804: 20
A805: YARRAVILLE | C805: MARCHESI 4 | F805: J ROHLEDER 3 | I805: TREBILCOCK 2 | L805: CONNELLY | N805: N ROHLEDER | Q805: MINOGUE | S805: WILD | W805: PRAHRAN | X805: 5 | Y805: 8 | Z805: 0 | AA805: 1175 | AB805: 1153 | AC805: 101.90806591500434 | AD805: 20
A806: NORTHCOTE | C806: FRANCIS 2 | F806: HUNTER 2 | I806: WOOLNOUGH | L806: C POWELL | N806: JOHNSON | Q806: G POWELL | W806: BRIGHTON | X806: 4 | Y806: 8 | Z806: 1 | AA806: 823 | AB806: 1125 | AC806: 73.155555555555551 | AD806: 18
W807: CAMBERWELL | X807: 1 | Y807: 12 | Z807: 0 | AA807: 938 | AB807: 1337 | AC807: 70.157068062827221 | AD807: 4
A808: COBURG | C808: 3 | D808: 3 | E808: =C808*6+D808 -> 21 | G808: 4 | H808: 3 | I808: =G808*6+H808 -> 27 | K808: 10 | L808: 4 | M808: =K808*6+L808 -> 64 | O808: 11 | P808: 4 | Q808: =O808*6+P808 -> 70 | S808: COBURG | W808: SANDRINGHAM | X808: 1 | Y808: 12 | Z808: 0 | AA808: 704 | AB808: 1595 | AC808: 44.137931034482762 | AD808: 4
A809: OAKLEIGH | C809: 0 | D809: 3 | E809: =C809*6+D809 -> 3 | G809: 3 | H809: 7 | I809: =G809*6+H809 -> 25 | K809: 4 | L809: 8 | M809: =K809*6+L809 -> 32 | O809: 7 | P809: 15 | Q809: =O809*6+P809 -> 57 | S809: MILLER
A810: BEST PLAYERS
A811: COBURG | C811: FEWKES | E811: McTAGGART | H811: H WILKINSON | K811: HEWES | M811: R WILKINSON | Q811: MAHONEY
A812: OAKLEIGH | C812: COLLINS | E812: H WILLIAMS | H812: SAVORY | K812: BOURKE | M812: EDWARDS | Q812: HOWELL
A813: GOALKICKERS
A814: COBURG | C814: HEWES 3 | F814: H WILKINSON 2 | J814: McDONALD 2 | M814: R WILKINSON | P814: SPARKS | R814: HORSKINS | U814: AITKEN
A815: OAKLEIGH | C815: WATSON 2 | F815: SHAW 2 | I815: WEBSTER | L815: HILL | N815: WALSH
A817: MOORABBIN | C817: 2 | D817: 4 | E817: =C817*6+D817 -> 16 | G817: 4 | H817: 6 | I817: =G817*6+H817 -> 30 | K817: 7 | L817: 6 | M817: =K817*6+L817 -> 48 | O817: 10 | P817: 9 | Q817: =O817*6+P817 -> 69 | S817: MOORABBIN
A818: PRAHRAN | C818: 1 | D818: 4 | E818: =A772*6+D818 -> 4 | G818: 5 | H818: 6 | I818: =A773*6+H818 -> 6 | K818: 8 | L818: 7 | M818: =K818*6+L818 -> 55 | O818: 9 | P818: 9 | Q818: =O818*6+P818 -> 63 | S818: CARDWELL
A819: BEST PLAYERS
A820: MOORABBIN | C820: LAWRENCE | F820: OSTLE | I820: BOYD | L820: DALY | N820: LEHMANN | Q820: BECKWITH
A821: PRAHRAN | C821: SHILLABEER | F821: ELLIOTT | I821: HARVEY | L821: KRUSE | N821: WALES | Q821: J JONES
A822: GOALKICKERS
A823: MOORABBIN | C823: SCHOFIELD 4 | F823: DALY 3 | I823: LEHMANN | L823: JEEVES | N823: COAD
A824: PRAHRAN | C824: ELLIOTT 2 | F824: KRUSE 2 | I824: MORROW | K824: HEAD | M824: SNOW | N824: SHARP | P824: D KINNABURGH
A826: BOX HILL | C826: 6 | D826: 2 | E826: =C826*6+D826 -> 38 | G826: 8 | H826: 3 | I826: =G826*6+H826 -> 51 | K826: 15 | L826: 4 | M826: =K826*6+L826 -> 94 | O826: 16 | P826: 4 | Q826: =O826*6+P826 -> 100 | S826: ELSTERNWICK PARK
A827: BRIGHTON | C827: 1 | D827: 0 | E827: =C827*6+D827 -> 6 | G827: 5 | H827: 11 | I827: =G827*6+H827 -> 41 | K827: 8 | L827: 13 | M827: =K827*6+L827 -> 61 | O827: 10 | P827: 16 | Q827: =O827*6+P827 -> 76 | S827: IRVING
A828: BEST PLAYERS
A829: BOX HILL | C829: MORRIS | F829: GREEN | I829: WEBB | K829: EDNIE | N829: IRVINE | Q829: WEST
A830: BRIGHTON | C830: TURNER | F830: KERR | I830: POUND | K830: O'MEARA | N830: CONROY | Q830: COOPER
A831: GOALKICKERS
A832: BOX HILL | C832: MORRIS 5 | F832: WEST 3 | I832: DAVIS 2 | K832: WEBB 2 | M832: EDNIE | O832: GREEN | Q832: TURNER | S832: HOUGHTON
A833: BRIGHTON | C833: EMBLETON 3 | F833: PICKERING 2 | I833: ALEXANDER | L833: CONROY | N833: MARINI | P833: GRIENKE | R833: KERR
A835: BRUNSWICK | C835: 2 | D835: 4 | E835: =C835*6+D835 -> 16 | G835: 5 | H835: 12 | I835: =G835*6+H835 -> 42 | K835: 7 | L835: 17 | M835: =K835*6+L835 -> 59 | O835: 13 | P835: 22 | Q835: =O835*6+P835 -> 100 | S835: CAMBERWELL
A836: CAMBERWELL | C836: 7 | D836: 2 | E836: =C836*6+D836 -> 44 | G836: 7 | H836: 3 | I836: =G836*6+H836 -> 45 | K836: 10 | L836: 7 | M836: =K836*6+L836 -> 67 | O836: 14 | P836: 9 | Q836: =O836*6+P836 -> 93 | S836: ROACH
A837: BEST PLAYERS
A838: BRUNSWICK | C838: WEIR | F838: SMITH | I838: STANLEY | L838: CLUES | N838: MILBURN | Q838: ROLFS
A839: CAMBERWELL | C839: HAYES | F839: DUFF | I839: DOUGLAS | L839: YOUNG | N839: McFEE | Q839: JARRARD
A840: GOALKICKERS
A841: BRUNSWICK | C841: WEIR 6 | F841: MILBURN 2 | I841: CLUES 2 | L841: LOVETT 2 | O841: HAYES
A842: CAMBERWELL | C842: DUFF 3 | F842: HOLYOAK 2 | I842: SCHNEIDER 2 | L842: McFEE 2 | N842: DUGDALE | P842: YOUNG | R842: CUNNINGHAM | V842: McCOMB
A844: PRESTON | C844: 5 | D844: 5 | E844: =C844*6+D844 -> 35 | G844: 8 | H844: 10 | I844: =G844*6+H844 -> 58 | K844: 14 | L844: 15 | M844: =K844*6+L844 -> 99 | O844: 18 | P844: 22 | Q844: =O844*6+P844 -> 130 | S844: PRESTON
A845: SANDRINGHAM | C845: 0 | D845: 0 | E845: =C845*6+D845 -> 0 | G845: 0 | H845: 2 | I845: =G845*6+H845 -> 2 | K845: 0 | L845: 2 | M845: =K845*6+L845 -> 2 | O845: 1 | P845: 4 | Q845: =O845*6+P845 -> 10 | S845: BREWER
A846: BEST PLAYERS
A847: PRESTON | C847: F CHARD | F847: FOLEY | I847: BRADFORD | L847: JEFFREY | O847: PRITCHARD | R847: SWEET
A848: SANDRINGHAM | C848: HANNAFORD | F848: WOODS | I848: POTTER | L848: RANSOM | O848: GOODES | R848: SHEARS
A849: GOALKICKERS
A850: PRESTON | C850: BRADFORD 5 | F850: HARVEY 5 | I850: JEFFREY 2 | L850: LALOR 2 | N850: COOPER 2 | Q850: HAYES | S850: FOLEY
A851: SANDRINGHAM | C851: HARPER
A853: ROUND 14 | E853: 17TH JULY | J853: WEATHER | M853: COLD GROUNDS MUDDY | S853: PLAYED AT | X853: LADDER | AB853: ROUND | AD853: 14
D854: 1ST QTR | H854: 2ND QTR | L854: 3RD QTR | P854: FINAL | S854: WILLIAMSTOWN
A855: WILLIAMSTOWN | C855: 5 | D855: 4 | E855: =C855*6+D855 -> 34 | G855: 7 | H855: 7 | I855: =G855*6+H855 -> 49 | K855: 10 | L855: 9 | M855: =K855*6+L855 -> 69 | O855: 13 | P855: 10 | Q855: =O855*6+P855 -> 88 | S855: UMPIRE | W855: TEAM | X855: W | Y855: L | Z855: D | AA855: FOR | AB855: AGST | AC855: % | AD855: PTS
A856: PRESTON | C856: 1 | D856: 1 | E856: =C856*6+D856 -> 7 | G856: 4 | H856: 5 | I856: =G856*6+H856 -> 29 | K856: 4 | L856: 6 | M856: =K856*6+L856 -> 30 | O856: 7 | P856: 7 | Q856: =O856*6+P856 -> 49 | S856: IRVING
A857: BEST PLAYERS | W857: PORT MELBOURNE | X857: 12 | Y857: 2 | Z857: 0 | AA857: 1456 | AB857: 915 | AC857: 159.12568306010928 | AD857: 48
A858: WILLIAMSTOWN | C858: SMITH | E858: CALLAHAN | H858: ALFORD | K858: MARTIN | N858: MUNDAY | Q858: LINTON | W858: WILLIAMSTOWN | X858: 11 | Y858: 3 | Z858: 0 | AA858: 1242 | AB858: 822 | AC858: 151.09489051094891 | AD858: 44
A859: PRESTON | C859: SWEET | E859: CROCKER | H859: HENRYS | K859: COOPER | N859: JEFFREY | Q859: K CHARD | W859: MOORABBIN | X859: 9 | Y859: 4 | Z859: 1 | AA859: 1057 | AB859: 913 | AC859: 115.77217962760132 | AD859: 38
A860: GOALKICKERS | W860: NORTHCOTE | X860: 8 | Y860: 5 | Z860: 1 | AA860: 1025 | AB860: 962 | AC860: 106.54885654885655 | AD860: 34
A861: WILLIAMSTOWN | C861: ALFORD 3 | F861: LINTON 2 | I861: SMITH 2 | K861: EVANS 2 | M861: SIMPSON 2 | P861: ABBERTON | R861: FISHER
A862: PRESTON | C862: F CHARD 3 | F862: HARVEY 2 | I862: LALOR | K862: BRADFORD | W862: COBURG | X862: 8 | Y862: 5 | Z862: 1 | AA862: 1013 | AB862: 966 | AC862: 104.86542443064182 | AD862: 34
W863: PRESTON | X863: 8 | Y863: 6 | Z863: 0 | AA863: 1172 | AB863: 1008 | AC863: 116.26984126984127 | AD863: 32
A864: PRAHRAN | C864: 1 | D864: 3 | E864: =C864*6+D864 -> 9 | G864: 4 | H864: 5 | I864: =G864*6+H864 -> 29 | K864: 4 | L864: 9 | M864: =K864*6+L864 -> 33 | O864: 8 | P864: 16 | Q864: =O864*6+P864 -> 64 | S864: TOORAK PARK | W864: YARRAVILLE | X864: 8 | Y864: 6 | Z864: 0 | AA864: 1074 | AB864: 1077 | AC864: 99.721448467966567 | AD864: 32
A865: YARRAVILLE | C865: 3 | D865: 4 | E865: =C865*6+D865 -> 22 | G865: 3 | H865: 5 | I865: =G865*6+H865 -> 23 | K865: 5 | L865: 10 | M865: =K865*6+L865 -> 40 | O865: 7 | P865: 12 | Q865: =O865*6+P865 -> 54 | S865: ROACH | W865: OAKLEIGH | X865: 6 | Y865: 6 | Z865: 2 | AA865: 1274 | AB865: 1168 | AC865: 109.07534246575342 | AD865: 28
A866: BEST PLAYERS | W866: BRUNSWICK | X866: 7 | Y866: 7 | Z866: 0 | AA866: 958 | AB866: 896 | AC866: 106.91964285714286 | AD866: 28
A867: PRAHRAN | C867: SHILLABEER | F867: WALSH | I867: YATES | L867: SHARP | O867: ELLIOTT | Q867: PLAIN | W867: PRAHRAN | X867: 6 | Y867: 8 | Z867: 0 | AA867: 1239 | AB867: 1207 | AC867: 102.65120132560067 | AD867: 24
A868: YARRAVILLE | C868: GWYNNE | F868: SALT | I868: VANDERFEEN | L868: NICHOLLS | O868: WILD | Q868: J ROHLEDER | W868: BOX HILL | X868: 5 | Y868: 9 | Z868: 0 | AA868: 1109 | AB868: 1050 | AC868: 105.61904761904762 | AD868: 20
A869: GOALKICKERS | W869: BRIGHTON | X869: 4 | Y869: 9 | Z869: 1 | AA869: 861 | AB869: 1206 | AC869: 71.393034825870643 | AD869: 18
A870: PRAHRAN | C870: D KINNABURGH 2 | G870: SHARP 2 | I870: SNOW 2 | K870: ELLIOTT | M870: MORROW | W870: CAMBERWELL | X870: 2 | Y870: 12 | Z870: 0 | AA870: 1048 | AB870: 1397 | AC870: 75.017895490336429 | AD870: 8
A871: YARRAVILLE | C871: MARCHESI 3 | F871: J ROHLEDER | I871: SALT | K871: MASON | M871: MINOGUE | W871: SANDRINGHAM | X871: 1 | Y871: 13 | Z871: 0 | AA871: 764 | AB871: 1705 | AC871: 44.809384164222877 | AD871: 4
A873: CAMBERWELL | C873: 5 | D873: 5 | E873: =C873*6+D873 -> 35 | G873: 8 | H873: 6 | I873: =G873*6+H873 -> 54 | K873: 13 | L873: 12 | M873: =K873*6+L873 -> 90 | O873: 16 | P873: 14 | Q873: =O873*6+P873 -> 110 | S873: BEACH ROAD
A874: SANDRINGHAM | C874: 1 | D874: 3 | E874: =C874*6+D874 -> 9 | G874: 3 | H874: 7 | I874: =G874*6+H874 -> 25 | K874: 6 | L874: 7 | M874: =K874*6+L874 -> 43 | O874: 8 | P874: 12 | Q874: =O874*6+P874 -> 60 | S874: GAMBLE
A875: BEST PLAYERS
A876: CAMBERWELL | C876: HOLYOAK | F876: DUFF | I876: TEMPANY | L876: McFEE | O876: SKALBERG | R876: JARRARD
A877: SANDRINGHAM | C877: CROFT | F877: HARPER | I877: EVANS | L877: PHILLIPS | O877: RUSSO | R877: MOLONEY
A878: GOALKICKERS
A879: CAMBERWELL | C879: HOLYOAK 7 | F879: TEMPANY 3 | I879: DUFF 2 | K879: DUGDALE 2 | N879: McFEE | P879: YOUNG
A880: SANDRINGHAM | C880: HARPER 4 | F880: TURNER 2 | I880: PHILLIPS | K880: HANNAFORD
E881: 24TH JULY | J881: WEATHER | O881: WEST WIND SHOWERS
A882: COBURG | C882: 1 | D882: 0 | E882: =C882*6+D882 -> 6 | G882: 2 | H882: 2 | I882: =G882*6+H882 -> 14 | K882: 4 | L882: 5 | M882: =K882*6+L882 -> 29 | O882: 8 | P882: 7 | Q882: =O882*6+P882 -> 55 | S882: COBURG
A883: MOORABBIN | C883: 3 | D883: 5 | E883: =C883*6+D883 -> 23 | G883: 3 | H883: 7 | I883: =G883*6+H883 -> 25 | K883: 4 | L883: 11 | M883: =K883*6+L883 -> 35 | O883: 5 | P883: 14 | Q883: =O883*6+P883 -> 44 | S883: CARDWELL
A884: BEST PLAYERS
A885: COBURG | C885: FEWKES | F885: HEWES | I885: McDONALD | L885: STARBUCK | O885: CONDON | Q885: WALKER
A886: MOORABBIN | C886: MURRAY | F886: TRESIZE | I886: LAWRENCE | L886: STANLEY | O886: BROWN | Q886: BOYD
A887: GOALKICKERS
A888: COBURG | C888: HEWES 3 | F888: McDONALD 2 | I888: HORSKINS | L888: McCOLL | N888: H WILKINSON
A889: MOORABBIN | C889: SCHOFIELD 2 | F889: JEEVES | H889: SCANLON | J889: MURRAY
A891: PORT MELBOURNE | C891: 1 | D891: 2 | E891: =C891*6+D891 -> 8 | G891: 5 | H891: 4 | I891: =G891*6+H891 -> 34 | K891: 9 | L891: 5 | M891: =K891*6+L891 -> 59 | O891: 12 | P891: 16 | Q891: =O891*6+P891 -> 88 | S891: OAKLEIGH
A892: OAKLEIGH | C892: 2 | D892: 3 | E892: =C892*6+D892 -> 15 | G892: 3 | H892: 5 | I892: =G892*6+H892 -> 23 | K892: 6 | L892: 9 | M892: =K892*6+L892 -> 45 | O892: 8 | P892: 11 | Q892: =O892*6+P892 -> 59 | S892: MALLETT
A893: BEST PLAYERS
A894: PORT MELBOURNE | C894: MILLER | F894: JOHNSON | I894: STONE | L894: BRIGGS | O894: STOREY | Q894: H TUCKER
A895: OAKLEIGH | C895: EDWARDS | F895: WILLIAMS | I895: HOWELL | L895: WATSON | O895: GUY | Q895: I'ANSON
A896: GOALKICKERS
A897: PORT MELBOURNE | C897: BONNETT 4 | F897: MILLER 3 | I897: H TUCKER 2 | L897: OWENS | N897: SYKES | P897: OLDFIELD
A898: OAKLEIGH | C898: WATSON 5 | F898: RYAN 2 | H898: WALSH
A900: BRUNSWICK | C900: 1 | D900: 3 | E900: =C900*6+D900 -> 9 | G900: 5 | H900: 6 | I900: =G900*6+H900 -> 36 | K900: 8 | L900: 9 | M900: =K900*6+L900 -> 57 | O900: 10 | P900: 10 | Q900: =O900*6+P900 -> 70 | S900: BOX HILL
A901: BOX HILL | C901: 3 | D901: 0 | E901: =C901*6+D901 -> 18 | G901: 6 | H901: 4 | I901: =G901*6+H901 -> 40 | K901: 7 | L901: 8 | M901: =K901*6+L901 -> 50 | O901: 7 | P901: 13 | Q901: =O901*6+P901 -> 55 | S901: PITTARD
A902: BEST PLAYERS
A903: BRUNSWICK | C903: YEA | E903: CLUES | H903: NEILSON | K903: YOUNG | N903: LOVETT | Q903: MILBURN
A904: BOX HILL | C904: LOVE | E904: KRONK | H904: RATTRAY | K904: GREEN | N904: MORRIS | Q904: EDNIE
A905: GOALKICKERS
A906: BRUNSWICK | C906: CLUES 3 | F906: LOVETT 3 | I906: MILBURN 2 | L906: WEIR | N906: YEA
A907: BOX HILL | C907: EDNIE 3 | F907: WEST 2 | I907: TURNER | L907: MORRIS
A909: NORTHCOTE | C909: 0 | D909: 2 | E909: =C909*6+D909 -> 2 | G909: 5 | H909: 7 | I909: =G909*6+H909 -> 37 | K909: 6 | L909: 9 | M909: =K909*6+L909 -> 45 | O909: 10 | P909: 21 | Q909: =O909*6+P909 -> 81 | S909: NORTHCOTE
A910: BRIGHTON | C910: 2 | D910: 2 | E910: =C910*6+D910 -> 14 | G910: 2 | H910: 3 | I910: =G910*6+H910 -> 15 | K910: 4 | L910: 7 | M910: =K910*6+L910 -> 31 | O910: 5 | P910: 8 | Q910: =O910*6+P910 -> 38 | S910: MILLER
A911: BEST PLAYERS
A912: NORTHCOTE | C912: STABB | F912: HISCOX | I912: WOOLNOUGH | L912: C POWELL | O912: HOLT | R912: ALDRIDGE
A913: BRIGHTON | C913: G TURNER | F913: O'MEARA | I913: READ | L913: KNIGHT | O913: BLACKMORE | R913: ALEXANDER
A914: GOALKICKERS
A915: NORTHCOTE | C915: HOLT 2 | E915: FRANCIS 2 | H915: G POWELL 2 | K915: WHITECHURCH | N915: CRAWLEY | Q915: STABB | S915: GOUGH
A916: BRIGHTON | C916: ALEXANDER 2 | F916: HICKMAN | I916: G TURNER | L916: LONIE
A918: ROUND 15 | E918: 31ST JULY | J918: WEATHER | M918: NORTH WEST WIND FINE & SUNNY | S918: PLAYED AT
D919: 1ST QTR | H919: 2ND QTR | L919: 3RD QTR | P919: FINAL | S919: PORT MELBOURNE
A920: PORT MELBOURNE | C920: 0 | D920: 4 | E920: =C920*6+D920 -> 4 | G920: 4 | H920: 10 | I920: =G920*6+H920 -> 34 | K920: 4 | L920: 13 | M920: =K920*6+L920 -> 37 | O920: 7 | P920: 14 | Q920: =O920*6+P920 -> 56 | S920: UMPIRE | X920: LADDER | AB920: ROUND | AD920: 15
A921: MOORABBIN | C921: 2 | D921: 4 | E921: =C921*6+D921 -> 16 | G921: 3 | H921: 8 | I921: =G921*6+H921 -> 26 | K921: 7 | L921: 12 | M921: =K921*6+L921 -> 54 | O921: 7 | P921: 12 | Q921: =O921*6+P921 -> 54 | S921: BREWER
A922: BEST PLAYERS | W922: TEAM | X922: W | Y922: L | Z922: D | AA922: FOR | AB922: AGST | AC922: % | AD922: PTS
A923: PORT MELBOURNE | C923: WITHERS | F923: STONE | I923: JOHNSON | L923: SYKES | N923: BONNETT | Q923: WHARTON
A924: MOORABBIN | C924: RENWICK | F924: BECKWITH | I924: MURRAY | L924: OSTLE | N924: TRESIZE | Q924: McKENZIE | W924: PORT MELBOURNE | X924: 13 | Y924: 2 | Z924: 0 | AA924: 1512 | AB924: 969 | AC924: 156.03715170278639 | AD924: 52
A925: GOALKICKERS | W925: WILLIAMSTOWN | X925: 12 | Y925: 3 | Z925: 0 | AA925: 1312 | AB925: 887 | AC925: 147.91431792559189 | AD925: 48
A926: PORT MELBOURNE | C926: BONNETT 3 | F926: SYKES | H926: SHANNON | J926: AUDAS | L926: H TUCKER | W926: MOORABBIN | X926: 9 | Y926: 5 | Z926: 1 | AA926: 1111 | AB926: 969 | AC926: 114.65428276573788 | AD926: 38
A927: MOORABBIN | C927: SCHOFIELD 2 | F927: McKENZIE | I927: BURGE | K927: RENWICK | M927: BROWN | O927: BARNES | W927: NORTHCOTE | X927: 9 | Y927: 5 | Z927: 1 | AA927: 1096 | AB927: 1014 | AC927: 108.08678500986193 | AD927: 38
A929: OAKLEIGH | C929: 1 | D929: 0 | E929: =C929*6+D929 -> 6 | G929: 7 | H929: 7 | I929: =G929*6+H929 -> 49 | K929: 7 | L929: 8 | M929: =K929*6+L929 -> 50 | O929: 11 | P929: 13 | Q929: =O929*6+P929 -> 79 | S929: YARRAVILLE | W929: COBURG | X929: 9 | Y929: 5 | Z929: 1 | AA929: 1090 | AB929: 1042 | AC929: 104.60652591170826 | AD929: 38
A930: YARRAVILLE | C930: 3 | D930: 9 | E930: =C930*6+D930 -> 27 | G930: 3 | H930: 9 | I930: =G930*6+H930 -> 27 | K930: 7 | L930: 14 | M930: =K930*6+L930 -> 56 | O930: 9 | P930: 14 | Q930: =O930*6+P930 -> 68 | S930: GAMBLE | W930: PRESTON | X930: 9 | Y930: 6 | Z930: 0 | AA930: 1252 | AB930: 1056 | AC930: 118.56060606060606 | AD930: 36
A931: BEST PLAYERS | W931: BRUNSWICK | X931: 8 | Y931: 7 | Z931: 0 | AA931: 1054 | AB931: 946 | AC931: 111.41649048625793 | AD931: 32
A932: OAKLEIGH | C932: COLLINS | F932: WILLIAMS | I932: BAPTIST | L932: GUY | N932: WATSON | Q932: HILL | W932: OAKLEIGH | X932: 7 | Y932: 6 | Z932: 2 | AA932: 1353 | AB932: 1236 | AC932: 109.46601941747574 | AD932: 32
A933: YARRAVILLE | C933: VANDERFEEN | F933: SEITZ | I933: N ROHLEDER | L933: K SMITH | N933: J ROHLEDER | Q933: WILD | W933: YARRAVILLE | X933: 8 | Y933: 7 | Z933: 0 | AA933: 1142 | AB933: 1156 | AC933: 98.788927335640139 | AD933: 32
A934: GOALKICKERS | W934: PRAHRAN | X934: 6 | Y934: 9 | Z934: 0 | AA934: 1287 | AB934: 1287 | AC934: 100 | AD934: 24
A935: OAKLEIGH | C935: WATSON 5 | F935: LONIE 2 | I935: HILL 2 | K935: WALSH | M935: GUY | W935: BOX HILL | X935: 5 | Y935: 10 | Z935: 0 | AA935: 1185 | AB935: 1127 | AC935: 105.14640638864242 | AD935: 20
A936: YARRAVILLE | C936: SEITZ 3 | F936: WILD 3 | I936: J ROHLEDER | L936: MASON | N936: MARCHESI | W936: BRIGHTON | X936: 4 | Y936: 10 | Z936: 1 | AA936: 926 | AB936: 1276 | AC936: 72.570532915360502 | AD936: 18
W937: CAMBERWELL | X937: 2 | Y937: 13 | Z937: 0 | AA937: 1100 | AB937: 1468 | AC937: 74.93188010899182 | AD937: 8
A938: PRESTON | C938: 6 | D938: 7 | E938: =C938*6+D938 -> 43 | G938: 7 | H938: 7 | I938: =G938*6+H938 -> 49 | K938: 11 | L938: 13 | M938: =K938*6+L938 -> 79 | O938: 11 | P938: 14 | Q938: =O938*6+P938 -> 80 | S938: PRESTON | W938: SANDRINGHAM | X938: 1 | Y938: 14 | Z938: 0 | AA938: 814 | AB938: 1801 | AC938: 45.197112715158248 | AD938: 4
A939: PRAHRAN | C939: 0 | D939: 1 | E939: =C939*6+D939 -> 1 | G939: 3 | H939: 5 | I939: =G939*6+H939 -> 23 | K939: 3 | L939: 6 | M939: =K939*6+L939 -> 24 | O939: 6 | P939: 12 | Q939: =O939*6+P939 -> 48 | S939: MILLER
A940: BEST PLAYERS
A941: PRESTON | C941: McLACHLAN | F941: FOLEY | I941: K CHARD | L941: SWEET | N941: CROCKER | Q941: LALOR
A942: PRAHRAN | C942: SHILLABEER | F942: J JONES | I942: YATES | L942: KRUSE | N942: WALSH | Q942: SHARP
A943: GOALKICKERS
A944: PRESTON | C944: FOLEY 4 | F944: F CHARD 3 | I944: LALOR 2 | L944: McLACHLAN | O944: BRADFORD
A945: PRAHRAN | C945: SNOW 2 | F945: HARVEY 2 | I945: ELLIOTT | L945: SHARP
A947: COBURG | C947: 1 | D947: 2 | E947: =C947*6+D947 -> 8 | G947: 5 | H947: 8 | I947: =G947*6+H947 -> 38 | K947: 6 | L947: 14 | M947: =K947*6+L947 -> 50 | O947: 10 | P947: 17 | Q947: =O947*6+P947 -> 77 | S947: BOX HILL
A948: BOX HILL | C948: 5 | D948: 3 | E948: =C948*6+D948 -> 33 | G948: 6 | H948: 5 | I948: =G948*6+H948 -> 41 | K948: 10 | L948: 9 | M948: =K948*6+L948 -> 69 | O948: 11 | P948: 10 | Q948: =O948*6+P948 -> 76 | S948: ROACH
A949: BEST PLAYERS
A950: COBURG | C950: R WIKINSON | F950: ROGAN | I950: McMAHON | L950: FEWKES | N950: H WILKINSON | Q950: CONDON
A951: BOX HILL | C951: EDNIE | F951: MORRIS | I951: LOVE | L951: KRONK | N951: IRVINE | Q951: TURNER
A952: GOALKICKERS
A953: COBURG | C953: HEWES 4 | F953: McDONALD 2 | I953: BUCKLEY 2 | L953: ROGAN | N953: H WILKINSON
A954: BOX HILL | C954: EDNIE 4 | F954: ROBINSON 3 | I954: GREEN | K954: KRONK | M954: MORRIS | O954: COGHLAN
A956: BRUNSWICK | C956: 8 | D956: 2 | E956: =C956*6+D956 -> 50 | G956: 11 | H956: 3 | I956: =G956*6+H956 -> 69 | K956: 14 | L956: 7 | M956: =K956*6+L956 -> 91 | O956: 14 | P956: 12 | Q956: =O956*6+P956 -> 96 | S956: BRUNSWICK
A957: SANDRINGHAM | C957: 0 | D957: 1 | E957: =C957*6+D957 -> 1 | G957: 5 | H957: 3 | I957: =G957*6+H957 -> 33 | K957: 5 | L957: 4 | M957: =K957*6+L957 -> 34 | O957: 7 | P957: 8 | Q957: =O957*6+P957 -> 50 | S957: IRVING
A958: BEST PLAYERS
A959: BRUNSWICK | C959: LOVETT | F959: CLUES | I959: WEIR | L959: YOUNG | O959: MULLENGER | R959: MILBURN
A960: SANDRINGHAM | C960: CROFT | F960: HARPER | I960: TURNER | L960: POTTER | O960: HANKINSON | R960: WOODS
A961: GOALKICKERS
A962: BRUNSWICK | C962: WEIR 4 | F962: CLUES 3 | I962: HAYES 2 | K962: MULLENGER | N962: NEILSON | P962: LOVETT | R962: CARROLL | U962: MILBURN
A963: SANDRINGHAM | C963: HARPER 3 | F963: RAEBURN 2 | I963: TURNER | K963: PHILLIPS
A965: NORTHCOTE | C965: 0 | D965: 2 | E965: =C965*6+D965 -> 2 | G965: 4 | H965: 10 | I965: =G965*6+H965 -> 34 | K965: 4 | L965: 13 | M965: =K965*6+L965 -> 37 | O965: 9 | P965: 17 | Q965: =O965*6+P965 -> 71 | S965: CAMBERWELL
A966: CAMBERWELL | C966: 0 | D966: 6 | E966: =C966*6+D966 -> 6 | G966: 2 | H966: 8 | I966: =G966*6+H966 -> 20 | K966: 6 | L966: 14 | M966: =K966*6+L966 -> 50 | O966: 6 | P966: 16 | Q966: =O966*6+P966 -> 52 | S966: MALLETT
A967: BEST PLAYERS
A968: NORTHCOTE | C968: DEVINE | F968: WOOLNOUGH | I968: HISCOX | L968: WALKER | O968: C POWELL | R968: COLLINS
A969: CAMBERWELL | C969: JOHNSON | F969: SKALBERG | I969: LOVETT | L969: TEMPANY | O969: DUFF | R969: McGUINESS
A970: GOALKICKERS
A971: NORTHCOTE | C971: DEVINE 3 | F971: WOOLNOUGH 3 | J971: CRAWLEY 2 | M971: G POWELL
A972: CAMBERWELL | C972: McGUINNESS 3 | F972: TEMPANY 2 | I972: DUGDALE
A974: WILLIAMSTOWN | C974: 3 | D974: 0 | E974: =C974*6+D974 -> 18 | G974: 7 | H974: 5 | I974: =G974*6+H974 -> 47 | K974: 8 | L974: 7 | M974: =K974*6+L974 -> 55 | O974: 10 | P974: 10 | Q974: =O974*6+P974 -> 70 | S974: ELSTERNWICK PARK
A975: BRIGHTON | C975: 2 | D975: 8 | E975: =C975*6+D975 -> 20 | G975: 3 | H975: 11 | I975: =G975*6+H975 -> 29 | K975: 8 | L975: 16 | M975: =K975*6+L975 -> 64 | O975: 8 | P975: 17 | Q975: =O975*6+P975 -> 65 | S975: CARDWELL
A976: BEST PLAYERS
A977: WILLIAMSTOWN | C977: WOOKEY | F977: SIMPSON | I977: MUNDAY | L977: WHITTAKER | O977: KENT | Q977: LINTON
A978: BRIGHTON | C978: BLACKMORE | F978: JOSTLEAR | I978: PICKERING | L978: ALEXANDER | O978: KERR | Q978: HICKMAN
A979: GOALKICKERS
A980: WILLIAMSTOWN | C980: ALFORD 3 | F980: WOOKEY 2 | I980: LINTON | K980: SIMPSON | M980: ABBERTON | P980: EVANS | R980: FISHER
A981: BRIGHTON | C981: PICKERING 2 | F981: POUND | H981: KNIGHT | J981: ALEXANDER | M981: KERR | O981: HICKMAN | Q981: LONIE
A983: ROUND 16 | E983: 7TH AUGUST | J983: WEATHER | M983: RAIN FIRST 3 QUARTERS | S983: PLAYED AT
D984: 1ST QTR | H984: 2ND QTR | L984: 3RD QTR | P984: FINAL | S984: COBURG
A985: COBURG | C985: 6 | D985: 4 | E985: =C985*6+D985 -> 40 | G985: 9 | H985: 7 | I985: =G985*6+H985 -> 61 | K985: 13 | L985: 11 | M985: =K985*6+L985 -> 89 | O985: 15 | P985: 16 | Q985: =O985*6+P985 -> 106 | S985: UMPIRE | X985: LADDER | AB985: ROUND | AD985: 16
A986: PORT MELBOURNE | C986: 1 | D986: 5 | E986: =C986*6+D986 -> 11 | G986: 2 | H986: 9 | I986: =G986*6+H986 -> 21 | K986: 4 | L986: 11 | M986: =K986*6+L986 -> 35 | O986: 7 | P986: 12 | Q986: =O986*6+P986 -> 54 | S986: IRVING
A987: BEST PLAYERS | W987: TEAM | X987: W | Y987: L | Z987: D | AA987: FOR | AB987: AGST | AC987: % | AD987: PTS
A988: COBURG | C988: McCOLL | E988: McDONALD | H988: ROGAN | K988: MATTHEWS | N988: H WILKINSON | Q988: WILLIAMS
A989: PORT MELBOURNE | C989: WITHERS | E989: WILSON | H989: JOHNSON | K989: SHANNON | N989: WALSH | Q989: AUDAS | W989: WILLIAMSTOWN | X989: 13 | Y989: 3 | Z989: 0 | AA989: 1420 | AB989: 929 | AC989: 152.8525296017223 | AD989: 52
A990: GOALKICKERS | W990: PORT MELBOURNE | X990: 13 | Y990: 3 | Z990: 0 | AA990: 1566 | AB990: 1075 | AC990: 145.67441860465115 | AD990: 52
A991: COBURG | C991: McDONALD 4 | F991: ROGAN 4 | I991: H WILKINSON 3 | M991: WILLIAMS 2 | P991: BUCKLEY | R991: KNIGHT | W991: MOORABBIN | X991: 10 | Y991: 5 | Z991: 1 | AA991: 1219 | AB991: 1008 | AC991: 120.93253968253968 | AD991: 42
A992: PORT MELBOURNE | C992: SYKES 2 | E992: WALSH | G992: BRIGGS | I992: SHANNON | K992: MILLER | M992: H TUCKER | W992: NORTHCOTE | X992: 10 | Y992: 5 | Z992: 1 | AA992: 1176 | AB992: 1075 | AC992: 109.3953488372093 | AD992: 42
A994: NORTHCOTE | C994: 5 | D994: 2 | E994: =C994*6+D994 -> 32 | G994: 5 | H994: 5 | I994: =G994*6+H994 -> 35 | K994: 7 | L994: 12 | M994: =K994*6+L994 -> 54 | O994: 11 | P994: 14 | Q994: =O994*6+P994 -> 80 | S994: NORTHCOTE | W994: COBURG | X994: 10 | Y994: 5 | Z994: 1 | AA994: 1196 | AB994: 1096 | AC994: 109.12408759124088 | AD994: 42
A995: BRUNSWICK | C995: 1 | D995: 1 | E995: =C995*6+D995 -> 7 | G995: 4 | H995: 7 | I995: =G995*6+H995 -> 31 | K995: 7 | L995: 8 | M995: =K995*6+L995 -> 50 | O995: 8 | P995: 13 | Q995: =O995*6+P995 -> 61 | S995: E BREWER | W995: PRESTON | X995: 10 | Y995: 6 | Z995: 0 | AA995: 1341 | AB995: 1114 | AC995: 120.3770197486535 | AD995: 40
A996: BEST PLAYERS | W996: BRUNSWICK | X996: 8 | Y996: 8 | Z996: 0 | AA996: 1115 | AB996: 1026 | AC996: 108.67446393762184 | AD996: 32
A997: NORTHCOTE | C997: STABB | E997: C POWELL | H997: COLLINS | K997: GIBBS | M997: WOOLNOUGH | Q997: WALKER | W997: OAKLEIGH | X997: 7 | Y997: 7 | Z997: 2 | AA997: 1411 | AB997: 1325 | AC997: 106.49056603773585 | AD997: 32
A998: BRUNSWICK | C998: YEA | E998: WEIR | H998: ROLFS | K998: MAHER | M998: YOUNG | Q998: MILBURN | W998: YARRAVILLE | X998: 8 | Y998: 8 | Z998: 0 | AA998: 1181 | AB998: 1264 | AC998: 93.433544303797461 | AD998: 32
A999: GOALKICKERS | W999: PRAHRAN | X999: 7 | Y999: 9 | Z999: 0 | AA999: 1371 | AB999: 1342 | AC999: 102.16095380029806 | AD999: 28
A1000: NORTHCOTE | C1000: GIBBS 3 | E1000: CRAWLEY 2 | H1000: WOOLNOUGH | K1000: FRANCIS | M1000: COLLINS | O1000: WHITECHURCH | R1000: POWELL | T1000: DEVINE | W1000: BOX HILL | X1000: 6 | Y1000: 10 | Z1000: 0 | AA1000: 1278 | AB1000: 1174 | AC1000: 108.85860306643953 | AD1000: 24
A1001: BRUNSWICK | C1001: WEIR 2 | E1001: STANLEY 2 | H1001: CLUES | J1001: MILBURN | M1001: PARKER | O1001: BURGESS | W1001: BRIGHTON | X1001: 4 | Y1001: 11 | Z1001: 1 | AA1001: 981 | AB1001: 1360 | AC1001: 72.132352941176464 | AD1001: 18
W1002: CAMBERWELL | X1002: 2 | Y1002: 14 | Z1002: 0 | AA1002: 1142 | AB1002: 1576 | AC1002: 72.461928934010146 | AD1002: 8
A1003: PRESTON | C1003: 3 | D1003: 2 | E1003: =C1003*6+D1003 -> 20 | G1003: 9 | H1003: 5 | I1003: =G1003*6+H1003 -> 59 | K1003: 10 | L1003: 9 | M1003: =K1003*6+L1003 -> 69 | O1003: 13 | P1003: 11 | Q1003: =O1003*6+P1003 -> 89 | S1003: OAKLEIGH | W1003: SANDRINGHAM | X1003: 1 | Y1003: 15 | Z1003: 0 | AA1003: 861 | AB1003: 1894 | AC1003: 45.459345300950368 | AD1003: 4
A1004: OAKLEIGH | C1004: 4 | D1004: 4 | E1004: =C1004*6+D1004 -> 28 | G1004: 6 | H1004: 7 | I1004: =G1004*6+H1004 -> 43 | K1004: 6 | L1004: 12 | M1004: =K1004*6+L1004 -> 48 | O1004: 7 | P1004: 16 | Q1004: =O1004*6+P1004 -> 58 | S1004: ROACH
A1005: BEST PLAYERS
A1006: PRESTON | C1006: BRADFORD | F1006: K CHARD | I1006: McLACHLAN | L1006: SWEET | O1006: HARVEY | Q1006: PRITCHARD
A1007: OAKLEIGH | C1007: COLLINS | F1007: WATSON | I1007: SHAW | L1007: WALSH | O1007: SAID | Q1007: SUTHERLAND
A1008: GOALKICKERS
A1009: PRESTON | C1009: BRADFORD 5 | F1009: F CHARD 4 | I1009: FOLEY 2 | K1009: McLACHLAN | N1009: JEFFREY
A1010: OAKLEIGH | C1010: SHAW 2 | F1010: I'ANSON 2 | I1010: LONIE | K1010: WATSON | M1010: COLLINS
A1012: MOORABBIN | C1012: 1 | D1012: 2 | E1012: =C1012*6+D1012 -> 8 | G1012: 5 | H1012: 12 | I1012: =G1012*6+H1012 -> 42 | K1012: 10 | L1012: 15 | M1012: =K1012*6+L1012 -> 75 | O1012: 15 | P1012: 18 | Q1012: =O1012*6+P1012 -> 108 | S1012: MOORABBIN
A1013: YARRAVILLE | C1013: 2 | D1013: 6 | E1013: =C1013*6+D1013 -> 18 | G1013: 3 | H1013: 8 | I1013: =G1013*6+H1013 -> 26 | K1013: 4 | L1013: 9 | M1013: =K1013*6+L1013 -> 33 | O1013: 5 | P1013: 9 | Q1013: =O1013*6+P1013 -> 39 | S1013: PITTARD
A1014: BEST PLAYERS
A1015: MOORABBIN | C1015: OSTLE | F1015: RENWICK | I1015: LAWRENCE | L1015: STANLEY | O1015: TRESIZE | R1015: SCHOFIELD
A1016: YARRAVILLE | C1016: J ROHLEDER | F1016: JONES | I1016: WILD | L1016: CONNELLY | O1016: NICHOLLS | R1016: SEITZ
A1017: GOALKICKERS
A1018: MOORABBIN | C1018: SCHOFIELD 4 | F1018: LEHMANN 3 | I1018: RENWICK 2 | L1018: CHANDLER 2 | O1018: BURGE 2 | Q1018: MURPHY | S1018: TRESIZE
A1019: YARRAVILLE | C1019: CONNELLY | F1019: SEITZ | H1019: MINOGUE | J1019: HUGHES | M1019: WALLIS
A1021: PRAHRAN | C1021: 3 | D1021: 5 | E1021: =C1021*6+D1021 -> 23 | G1021: 7 | H1021: 8 | I1021: =G1021*6+H1021 -> 50 | K1021: 9 | L1021: 15 | M1021: =K1021*6+L1021 -> 69 | O1021: 11 | P1021: 18 | Q1021: =O1021*6+P1021 -> 84 | S1021: TOORAK PARK
A1022: BRIGHTON | C1022: 1 | D1022: 3 | E1022: =C1022*6+D1022 -> 9 | G1022: 4 | H1022: 3 | I1022: =G1022*6+H1022 -> 27 | K1022: 6 | L1022: 5 | M1022: =K1022*6+L1022 -> 41 | O1022: 8 | P1022: 7 | Q1022: =O1022*6+P1022 -> 55 | S1022: GAMBLE
A1023: BEST PLAYERS
A1024: PRAHRAN | C1024: D KINNABURGH | G1024: YATES | I1024: HARVEY | L1024: WALSH | O1024: BURNS | R1024: KRUSE
A1025: BRIGHTON | C1025: O'MEARA | G1025: MEE | I1025: ALEXANDER | L1025: KERR | O1025: HICKMAN | R1025: JOSTLEAR
A1026: GOALKICKERS
A1027: PRAHRAN | C1027: D KINNABURGH 5 | G1027: SHARP 2 | I1027: HARVEY | K1027: BURNS | M1027: CLEAR | O1027: KRUSE
A1028: BRIGHTON | C1028: KNIGHT 2 | F1028: GRIENKE 2 | I1028: BURKE 2 | K1028: CONROY | M1028: POUND
A1030: BOX HILL | C1030: 4 | D1030: 4 | E1030: =C1030*6+D1030 -> 28 | G1030: 9 | H1030: 10 | I1030: =G1030*6+H1030 -> 64 | K1030: 10 | L1030: 15 | M1030: =K1030*6+L1030 -> 75 | O1030: 12 | P1030: 21 | Q1030: =O1030*6+P1030 -> 93 | S1030: BEACH ROAD
A1031: SANDRINGHAM | C1031: 3 | D1031: 2 | E1031: =C1031*6+D1031 -> 20 | G1031: 4 | H1031: 3 | I1031: =G1031*6+H1031 -> 27 | K1031: 6 | L1031: 5 | M1031: =K1031*6+L1031 -> 41 | O1031: 7 | P1031: 5 | Q1031: =O1031*6+P1031 -> 47 | S1031: D BREWER
A1032: BEST PLAYERS
A1033: BOX HILL | C1033: WEBB | F1033: GREEN | I1033: KRONK | L1033: TURNER | N1033: DEACON | Q1033: H BLUNDY
A1034: SANDRINGHAM | C1034: HARPER | F1034: RNASOM | I1034: HANKINSON | L1034: RUSSO | N1034: WOODS | Q1034: RAEBURN
A1035: GOALKICKERS
A1036: BOX HILL | C1036: TURNER 3 | F1036: MORRIS 3 | I1036: WEBB 3 | K1036: GREEN 2 | M1036: H BLUNDY
A1037: SANDRINGHAM | C1037: HARPER 4 | F1037: TURNER | I1037: PHILLIPS | L1037: HANKINSON
A1039: WILLIAMSTOWN | C1039: 6 | D1039: 8 | E1039: =C1039*6+D1039 -> 44 | G1039: 8 | H1039: 10 | I1039: =G1039*6+H1039 -> 58 | K1039: 14 | L1039: 16 | M1039: =K1039*6+L1039 -> 100 | O1039: 15 | P1039: 18 | Q1039: =O1039*6+P1039 -> 108 | S1039: WILLIAMSTOWN
A1040: CAMBERWELL | C1040: 0 | D1040: 2 | E1040: =C1040*6+D1040 -> 2 | G1040: 0 | H1040: 3 | I1040: =G1040*6+H1040 -> 3 | K1040: 2 | L1040: 4 | M1040: =K1040*6+L1040 -> 16 | O1040: 6 | P1040: 6 | Q1040: =O1040*6+P1040 -> 42 | S1040: CARDWELL
A1041: BEST PLAYERS
A1042: WILLIAMSTOWN | C1042: SMITH | E1042: SIMPSON | H1042: WALKER | K1042: ALFORD | N1042: LINTON | Q1042: MARTIN
A1043: CAMBERWELL | C1043: McFEE | E1043: SCHNEIDER | H1043: ALWAY | K1043: HOLYOAK | N1043: WRIGHT | Q1043: KILBY
A1044: GOALKICKERS
A1045: WILLIAMSTOWN | C1045: WALKER 6 | F1045: ALFORD 3 | I1045: SIMPSON 2 | L1045: LINTON 2 | N1045: SMITH | P1045: EVANS
A1046: CAMBERWELL | C1046: McFEE 2 | E1046: HOLYOAK 2 | H1046: ALLSOPP | J1046: DUGDALE
A1048: ROUND 17 | E1048: 14TH AUGUST | J1048: WEATHER | O1048: FINE | S1048: PLAYED AT
D1049: 1ST QTR | H1049: 2ND QTR | L1049: 3RD QTR | P1049: FINAL | S1049: PRESTON
A1050: PRESTON | C1050: 3 | D1050: 3 | E1050: =C1050*6+D1050 -> 21 | G1050: 5 | H1050: 6 | I1050: =G1050*6+H1050 -> 36 | K1050: 9 | L1050: 7 | M1050: =K1050*6+L1050 -> 61 | O1050: 11 | P1050: 9 | Q1050: =O1050*6+P1050 -> 75 | S1050: UMPIRE | X1050: LADDER | AB1050: ROUND | AD1050: 17
A1051: MOORABBIN | C1051: 3 | D1051: 2 | E1051: =C1051*6+D1051 -> 20 | G1051: 3 | H1051: 5 | I1051: =G1051*6+H1051 -> 23 | K1051: 7 | L1051: 8 | M1051: =K1051*6+L1051 -> 50 | O1051: 8 | P1051: 12 | Q1051: =O1051*6+P1051 -> 60 | S1051: GAMBLE
A1052: BEST PLAYERS | W1052: TEAM | X1052: W | Y1052: L | Z1052: D | AA1052: FOR | AB1052: AGST | AC1052: % | AD1052: PTS
A1053: PRESTON | C1053: BRADFORD | F1053: SWEET | I1053: HENRYS | L1053: K CHARD | O1053: COOPER | Q1053: PRITCHARD
A1054: MOORABBIN | C1054: BOYD | F1054: STANLEY | I1054: MANIE | L1054: LAWRENCE | O1054: CLOVER | Q1054: SCANLON | W1054: WILLIAMSTOWN | X1054: 14 | Y1054: 3 | Z1054: 0 | AA1054: 1511 | AB1054: 999 | AC1054: 151.25125125125126 | AD1054: 56
A1055: GOALKICKERS | W1055: PORT MELBOURNE | X1055: 14 | Y1055: 3 | Z1055: 0 | AA1055: 1676 | AB1055: 1161 | AC1055: 144.35831180017226 | AD1055: 56
A1056: PRESTON | C1056: BRADFORD 6 | F1056: F CHARD 2 | I1056: JEFFREY 2 | L1056: HART | W1056: COBURG | X1056: 11 | Y1056: 5 | Z1056: 1 | AA1056: 1311 | AB1056: 1158 | AC1056: 113.21243523316062 | AD1056: 46
A1057: MOORABBIN | C1057: SCHOFIELD 2 | F1057: MANIE 2 | I1057: TRESIZE | K1057: BURGE | M1057: BARNES | O1057: LEHMANN | W1057: NORTHCOTE | X1057: 11 | Y1057: 5 | Z1057: 1 | AA1057: 1230 | AB1057: 1117 | AC1057: 110.11638316920322 | AD1057: 46
A1059: WILLIAMSTOWN | C1059: 4 | D1059: 2 | E1059: =C1059*6+D1059 -> 26 | G1059: 6 | H1059: 2 | I1059: =G1059*6+H1059 -> 38 | K1059: 9 | L1059: 7 | M1059: =K1059*6+L1059 -> 61 | O1059: 13 | P1059: 13 | Q1059: =O1059*6+P1059 -> 91 | S1059: BRUNSWICK | W1059: PRESTON | X1059: 11 | Y1059: 6 | Z1059: 0 | AA1059: 1416 | AB1059: 1174 | AC1059: 120.61328790459966 | AD1059: 44
A1060: BRUNSWICK | C1060: 4 | D1060: 4 | E1060: =C1060*6+D1060 -> 28 | G1060: 7 | H1060: 5 | I1060: =G1060*6+H1060 -> 47 | K1060: 10 | L1060: 9 | M1060: =K1060*6+L1060 -> 69 | O1060: 11 | P1060: 10 | Q1060: =O1060*6+P1060 -> 76 | S1060: PITTARD | W1060: MOORABBIN | X1060: 10 | Y1060: 6 | Z1060: 1 | AA1060: 1279 | AB1060: 1083 | AC1060: 118.09787626962142 | AD1060: 42
A1061: BEST PLAYERS | W1061: BRUNSWICK | X1061: 8 | Y1061: 9 | Z1061: 0 | AA1061: 1185 | AB1061: 1117 | AC1061: 106.08773500447627 | AD1061: 32
A1062: WILLIAMSTOWN | C1062: MUNDAY | F1062: CURRAN | I1062: SIMPSON | L1062: WOOKEY | O1062: WHITTAKER | R1062: TAAFE | W1062: PRAHRAN | X1062: 8 | Y1062: 9 | Z1062: 0 | AA1062: 1481 | AB1062: 1419 | AC1062: 104.369274136716 | AD1062: 32
A1063: BRUNSWICK | C1063: MULLENGER | F1063: WEIR | I1063: ROLFS | L1063: EDWARDS | O1063: MAY | R1063: STANLEY | W1063: OAKLEIGH | X1063: 7 | Y1063: 8 | Z1063: 2 | AA1063: 1467 | AB1063: 1425 | AC1063: 102.94736842105263 | AD1063: 32
A1064: GOALKICKERS | W1064: YARRAVILLE | X1064: 8 | Y1064: 9 | Z1064: 0 | AA1064: 1267 | AB1064: 1374 | AC1064: 92.212518195050947 | AD1064: 32
A1065: WILLIAMSTOWN | C1065: WALKER 3 | E1065: SIMPSON 3 | H1065: ALFORD 2 | J1065: WOOKEY | L1065: LINTON | N1065: CALLAHAN | Q1065: EVANS | S1065: ANDERSON | W1065: BOX HILL | X1065: 6 | Y1065: 11 | Z1065: 0 | AA1065: 1320 | AB1065: 1228 | AC1065: 107.49185667752442 | AD1065: 24
A1066: BRUNSWICK | C1066: HAYES 3 | E1066: SEYMOUR 2 | H1066: LEYDEN 2 | J1066: MULLENGER | M1066: EDWARDS | O1066: WEIR | Q1066: STANLEY | W1066: BRIGHTON | X1066: 5 | Y1066: 11 | Z1066: 1 | AA1066: 1081 | AB1066: 1416 | AC1066: 76.341807909604526 | AD1066: 22
W1067: CAMBERWELL | X1067: 2 | Y1067: 15 | Z1067: 0 | AA1067: 1219 | AB1067: 1686 | AC1067: 72.301304863582445 | AD1067: 8
A1068: PORT MELBOURNE | C1068: 4 | D1068: 2 | E1068: =C1068*6+D1068 -> 26 | G1068: 10 | H1068: 3 | I1068: =G1068*6+H1068 -> 63 | K1068: 11 | L1068: 7 | M1068: =K1068*6+L1068 -> 73 | O1068: 17 | P1068: 8 | Q1068: =O1068*6+P1068 -> 110 | S1068: YARRAVILLE | W1068: SANDRINGHAM | X1068: 1 | Y1068: 16 | Z1068: 0 | AA1068: 923 | AB1068: 2009 | AC1068: 45.943255350920857 | AD1068: 4
A1069: YARRAVILLE | C1069: 5 | D1069: 1 | E1069: =C1069*6+D1069 -> 31 | G1069: 6 | H1069: 3 | I1069: =G1069*6+H1069 -> 39 | K1069: 12 | L1069: 5 | M1069: =K1069*6+L1069 -> 77 | O1069: 13 | P1069: 8 | Q1069: =O1069*6+P1069 -> 86 | S1069: SMYTH
A1070: BEST PLAYERS
A1071: PORT MELBOURNE | C1071: McDONALD | F1071: SYKES | I1071: JOHNSON | L1071: STONE | N1071: MILLER | Q1071: WILSON
A1072: YARRAVILLE | C1072: WILD | F1072: VANDERFEEN | I1072: WALLIS | L1072: HUGHES | N1072: J ROHLEDER | Q1072: N ROHLEDER
A1073: GOALKICKERS
A1074: PORT MELBOURNE | C1074: McDONALD 8 | F1074: SYKES 3 | I1074: DUNBAR 2 | L1074: BLACK | N1074: STOREY | P1074: SHANNON | R1074: JOHNSON
A1075: YARRAVILLE | C1075: HUGHES 4 | F1075: MASON 4 | I1075: CONNELLY | K1075: HART | M1075: TREBILCOCK | P1075: WALLIS | R1075: S SMITH
A1077: NORTHCOTE | C1077: 2 | D1077: 1 | E1077: =C1077*6+D1077 -> 13 | G1077: 3 | H1077: 3 | I1077: =G1077*6+H1077 -> 21 | K1077: 6 | L1077: 5 | M1077: =K1077*6+L1077 -> 41 | O1077: 7 | P1077: 12 | Q1077: =O1077*6+P1077 -> 54 | S1077: BOX HILL
A1078: BOX HILL | C1078: 2 | D1078: 4 | E1078: =C1078*6+D1078 -> 16 | G1078: 3 | H1078: 5 | I1078: =G1078*6+H1078 -> 23 | K1078: 3 | L1078: 6 | M1078: =K1078*6+L1078 -> 24 | O1078: 6 | P1078: 6 | Q1078: =O1078*6+P1078 -> 42 | S1078: ROACH
A1079: BEST PLAYERS
A1080: NORTHCOTE | C1080: HUNTER | F1080: STABB | I1080: CRAWLEY | L1080: COLLINS | O1080: WOOLNOUGH | R1080: WALKER
A1081: BOX HILL | C1081: LOVE | F1081: ROBINSON | I1081: DEACON | L1081: MORRIS | O1081: RATTRAY | R1081: TURNER
A1082: GOALKICKERS
A1083: NORTHCOTE | C1083: COLLINS 3 | F1083: FRANCIS 2 | I1083: HUNTER | K1083: CRAWLEY | M1083: G POWELL
A1084: BOX HILL | C1084: ROBINSON 2 | F1084: TURNER | I1084: GREEN | K1084: EDNIE | M1084: WEBB
A1086: PRAHRAN | C1086: 3 | D1086: 3 | E1086: =C1086*6+D1086 -> 21 | G1086: 7 | H1086: 4 | I1086: =G1086*6+H1086 -> 46 | K1086: 14 | L1086: 8 | M1086: =K1086*6+L1086 -> 92 | O1086: 17 | P1086: 8 | Q1086: =O1086*6+P1086 -> 110 | S1086: CAMBERWELL
A1087: CAMBERWELL | C1087: 2 | D1087: 4 | E1087: =C1087*6+D1087 -> 16 | G1087: 2 | H1087: 7 | I1087: =G1087*6+H1087 -> 19 | K1087: 5 | L1087: 11 | M1087: =K1087*6+L1087 -> 41 | O1087: 10 | P1087: 17 | Q1087: =O1087*6+P1087 -> 77 | S1087: D BREWER
A1088: BEST PLAYERS
A1089: PRAHRAN | C1089: YATES | F1089: HART | I1089: D KINNABURGH | M1089: KRUSE | O1089: J JONES | Q1089: HARVEY
A1090: CAMBERWELL | C1090: McGUINNES | F1090: WRIGHT | I1090: ALWAY | M1090: MILNES | O1090: HAYES | Q1090: McFEE
A1091: GOALKICKERS
A1092: PRAHRAN | C1092: D KINNABURGH 5 | G1092: KRUSE 4 | I1092: LETTS 2 | K1092: BURNS 2 | M1092: SHARP | O1092: O'BRYAN | Q1092: HARVEY | S1092: ELLIOTT
A1093: CAMBERWELL | C1093: HAYES 2 | F1093: McFEE 2 | H1093: DUGDALE 2 | K1093: TEMPANY | M1093: HOLYOAK | O1093: K JOHNSON | R1093: ALWAY
A1095: BRIGHTON | C1095: 1 | D1095: 5 | E1095: =C1095*6+D1095 -> 11 | G1095: 9 | H1095: 12 | I1095: =G1095*6+H1095 -> 66 | K1095: 10 | L1095: 12 | M1095: =K1095*6+L1095 -> 72 | O1095: 14 | P1095: 16 | Q1095: =O1095*6+P1095 -> 100 | S1095: ELSTERNWICK PARK
A1096: OAKLEIGH | C1096: 4 | D1096: 2 | E1096: =C1096*6+D1096 -> 26 | G1096: 5 | H1096: 4 | I1096: =G1096*6+H1096 -> 34 | K1096: 6 | L1096: 12 | M1096: =K1096*6+L1096 -> 48 | O1096: 7 | P1096: 14 | Q1096: =O1096*6+P1096 -> 56 | S1096: IRVING
A1097: BEST PLAYERS
A1098: BRIGHTON | C1098: O'MEARA | F1098: ALEXANDER | I1098: MEE | K1098: TURNER | N1098: FREEMAN | Q1098: PICKERING
A1099: OAKLEIGH | C1099: EDWARDS | F1099: HOWELL | I1099: GUY | K1099: LAMBERT | N1099: BAPTIST | Q1099: SAID
A1100: GOALKICKERS
A1101: BRIGHTON | C1101: ALEXANDER 2 | F1101: BURKE 2 | H1101: MEE 2 | J1101: HICKMAN 2 | M1101: GRIENKE 2 | P1101: A BOWLES | R1101: PICKERING | U1101: KNIGHT | X1101: POUND
A1102: OAKLEIGH | C1102: WATSON 3 | F1102: WALSH | H1102: LAMBERT | J1102: D'ARCY | L1102: BAPTIST
A1104: COBURG | C1104: 4 | D1104: 4 | E1104: =C1104*6+D1104 -> 28 | G1104: 8 | H1104: 10 | I1104: =G1104*6+H1104 -> 58 | K1104: 10 | L1104: 13 | M1104: =K1104*6+L1104 -> 73 | O1104: 16 | P1104: 19 | Q1104: =O1104*6+P1104 -> 115 | S1104: BEACH ROAD
A1105: SANDRINGHAM | C1105: 1 | D1105: 4 | E1105: =C1105*6+D1105 -> 10 | G1105: 4 | H1105: 6 | I1105: =G1105*6+H1105 -> 30 | K1105: 8 | L1105: 7 | M1105: =K1105*6+L1105 -> 55 | O1105: 9 | P1105: 8 | Q1105: =O1105*6+P1105 -> 62 | S1105: E BREWER
A1106: BEST PLAYERS
A1107: COBURG | C1107: McCOLL | F1107: McTAGGART | I1107: HORSKINS | L1107: SPARKS | O1107: STARBUCK | R1107: McDONALD
A1108: SANDRINGHAM | C1108: HARPER | F1108: CROFT | I1108: RUSSO | L1108: POTTER | O1108: BURMEISTER | R1108: HOY
A1109: GOALKICKERS
A1110: COBURG | C1110: McCOLL 5 | F1110: McDONALD 4 | I1110: SALTER 2 | K1110: FINLEY 2 | M1110: FEWKES | O1110: R WILKINSON | R1110: BUCKLEY
A1111: SANDRINGHAM | C1111: HARPER 5 | F1111: RANSOM | H1111: MORONEY | J1111: McMAHON | M1111: TURNER
A1113: ROUND 18 | E1113: 21ST AUGUST | J1113: WEATHER | M1113: NORTH WEST WIND RAIN | S1113: PLAYED AT
D1114: 1ST QTR | H1114: 2ND QTR | L1114: 3RD QTR | P1114: FINAL | S1114: PORT MELBOURNE
A1115: PORT MELBOURNE | C1115: 7 | D1115: 4 | E1115: =C1115*6+D1115 -> 46 | G1115: 12 | H1115: 5 | I1115: =G1115*6+H1115 -> 77 | K1115: 19 | L1115: 10 | M1115: =K1115*6+L1115 -> 124 | O1115: 19 | P1115: 11 | Q1115: =O1115*6+P1115 -> 125 | S1115: UMPIRE | X1115: LADDER | AB1115: ROUND | AD1115: 18
A1116: PRESTON | C1116: 1 | D1116: 1 | E1116: =C1116*6+D1116 -> 7 | G1116: 4 | H1116: 3 | I1116: =G1116*6+H1116 -> 27 | K1116: 6 | L1116: 4 | M1116: =K1116*6+L1116 -> 40 | O1116: 8 | P1116: 6 | Q1116: =O1116*6+P1116 -> 54 | S1116: CARDWELL
A1117: BEST PLAYERS | W1117: TEAM | X1117: W | Y1117: L | Z1117: D | AA1117: FOR | AB1117: AGST | AC1117: % | AD1117: PTS
A1118: PORT MELBOURNE | C1118: McDONALD | F1118: JOHNSON | I1118: WALSH | L1118: TUCKER | N1118: WHARTON | Q1118: WILSON
A1119: PRESTON | C1119: McBEAN | F1119: HARVEY | I1119: CROCKER | L1119: K CHARD | N1119: FOLEY | Q1119: BRADFORD | W1119: PORT MELBOURNE | X1119: 15 | Y1119: 3 | Z1119: 0 | AA1119: 1801 | AB1119: 1215 | AC1119: 148.23045267489712 | AD1119: 60
A1120: GOALKICKERS | W1120: WILLIAMSTOWN | X1120: 14 | Y1120: 4 | Z1120: 0 | AA1120: 1572 | AB1120: 1064 | AC1120: 147.74436090225564 | AD1120: 56
A1121: PORT MELBOURNE | C1121: BONNETT 5 | F1121: McDONALD 5 | I1121: WHARTON 2 | L1121: WALSH 2 | N1121: DUNBAR 2 | Q1121: BRIGGS | S1121: SYKES | W1121: NORTHCOTE | X1121: 12 | Y1121: 5 | Z1121: 1 | AA1121: 1357 | AB1121: 1160 | AC1121: 116.98275862068965 | AD1121: 50
A1122: PRESTON | C1122: F CHARD 6 | F1122: FOLEY | I1122: BRADFORD | R1122: /BLACK | W1122: COBURG | X1122: 12 | Y1122: 5 | Z1122: 1 | AA1122: 1368 | AB1122: 1195 | AC1122: 114.47698744769875 | AD1122: 50
A1124: PRAHRAN | C1124: 8 | D1124: 8 | E1124: =C1124*6+D1124 -> 56 | G1124: 10 | H1124: 9 | I1124: =G1124*6+H1124 -> 69 | K1124: 16 | L1124: 14 | M1124: =K1124*6+L1124 -> 110 | O1124: 16 | P1124: 15 | Q1124: =O1124*6+P1124 -> 111 | S1124: TOORAK PARK | W1124: MOORABBIN | X1124: 11 | Y1124: 6 | Z1124: 1 | AA1124: 1373 | AB1124: 1130 | AC1124: 121.50442477876106 | AD1124: 46
A1125: BRUNSWICK | C1125: 0 | D1125: 4 | E1125: =C1125*6+D1125 -> 4 | G1125: 5 | H1125: 11 | I1125: =G1125*6+H1125 -> 41 | K1125: 7 | L1125: 13 | M1125: =K1125*6+L1125 -> 55 | O1125: 11 | P1125: 20 | Q1125: =O1125*6+P1125 -> 86 | S1125: D BREWER | W1125: PRESTON | X1125: 11 | Y1125: 7 | Z1125: 0 | AA1125: 1470 | AB1125: 1299 | AC1125: 113.16397228637413 | AD1125: 44
A1126: BEST PLAYERS | W1126: PRAHRAN | X1126: 9 | Y1126: 9 | Z1126: 0 | AA1126: 1592 | AB1126: 1505 | AC1126: 105.78073089700996 | AD1126: 36
A1127: PRAHRAN | C1127: KRUSE | F1127: O'BRYAN | I1127: WALSH | L1127: HARVEY | O1127: H BOYD | Q1127: SHILLABEER | W1127: OAKLEIGH | X1127: 8 | Y1127: 8 | Z1127: 2 | AA1127: 1576 | AB1127: 1491 | AC1127: 105.700871898055 | AD1127: 36
A1128: BRUNSWICK | C1128: LEYDEN | F1128: STANLEY | I1128: MILBURN | L1128: SEYMOUR | O1128: YEA | Q1128: ROLFS | W1128: BRUNSWICK | X1128: 8 | Y1128: 10 | Z1128: 0 | AA1128: 1271 | AB1128: 1228 | AC1128: 103.50162866449512 | AD1128: 32
A1129: GOALKICKERS | W1129: YARRAVILLE | X1129: 8 | Y1129: 10 | Z1129: 0 | AA1129: 1304 | AB1129: 1431 | AC1129: 91.125087351502444 | AD1129: 32
A1130: PRAHRAN | C1130: D KINNABURGH 4 | G1130: KRUSE 3 | I1130: CLEAR 2 | K1130: H BOYD 2 | M1130: HARVEY 2 | P1130: ELLIOTT | R1130: SHARP | T1130: LETTS | W1130: BOX HILL | X1130: 7 | Y1130: 11 | Z1130: 0 | AA1130: 1385 | AB1130: 1289 | AC1130: 107.44763382467029 | AD1130: 28
A1131: BRUNSWICK | C1131: LEYDEN 4 | F1131: WEIR 2 | H1131: SEYMOUR | J1131: MILBURN | L1131: LOVETT | N1131: MULLENGER | Q1131: NEILSON | W1131: BRIGHTON | X1131: 5 | Y1131: 12 | Z1131: 1 | AA1131: 1128 | AB1131: 1510 | AC1131: 74.701986754966882 | AD1131: 22
W1132: CAMBERWELL | X1132: 2 | Y1132: 16 | Z1132: 0 | AA1132: 1285 | AB1132: 1795 | AC1132: 71.587743732590525 | AD1132: 8
A1133: COBURG | C1133: 1 | D1133: 6 | E1133: =C1133*6+D1133 -> 12 | G1133: 5 | H1133: 11 | I1133: =G1133*6+H1133 -> 41 | K1133: 5 | L1133: 12 | M1133: =K1133*6+L1133 -> 42 | O1133: 6 | P1133: 21 | Q1133: =O1133*6+P1133 -> 57 | S1133: COBURG | W1133: SANDRINGHAM | X1133: 1 | Y1133: 17 | Z1133: 0 | AA1133: 966 | AB1133: 2136 | AC1133: 45.224719101123597 | AD1133: 4
A1134: YARRAVILLE | C1134: 1 | D1134: 7 | E1134: =C1134*6+D1134 -> 13 | G1134: 2 | H1134: 7 | I1134: =G1134*6+H1134 -> 19 | K1134: 3 | L1134: 10 | M1134: =K1134*6+L1134 -> 28 | O1134: 4 | P1134: 13 | Q1134: =O1134*6+P1134 -> 37 | S1134: ROACH
A1135: BEST PLAYERS
A1136: COBURG | C1136: R WILKINSON | F1136: STARBUCK | I1136: FEWKES | L1136: WALKER | N1136: H WILKINSON | Q1136: HORSKINS
A1137: YARRAVILLE | C1137: NICHOLLS | F1137: VANDERFEEN | I1137: K SMITH | L1137: JONES | N1137: CONNELLY | Q1137: HART
A1138: GOALKICKERS
A1139: COBURG | C1139: HEWES 2 | F1139: R WILKINSON | I1139: ROGAN | K1139: BUCKLEY | N1139: H WILKINSON
A1140: YARRAVILLE | C1140: TREBILCOCK | F1140: WILD | I1140: SEITZ | K1140: HUTCHESON
A1142: MOORABBIN | C1142: 2 | D1142: 2 | E1142: =C1142*6+D1142 -> 14 | G1142: 7 | H1142: 10 | I1142: =G1142*6+H1142 -> 52 | K1142: 8 | L1142: 13 | M1142: =K1142*6+L1142 -> 61 | O1142: 13 | P1142: 16 | Q1142: =O1142*6+P1142 -> 94 | S1142: MOORABBIN
A1143: BRIGHTON | C1143: 3 | D1143: 4 | E1143: =C1143*6+D1143 -> 22 | G1143: 3 | H1143: 4 | I1143: =G1143*6+H1143 -> 22 | K1143: 5 | L1143: 4 | M1143: =K1143*6+L1143 -> 34 | O1143: 7 | P1143: 5 | Q1143: =O1143*6+P1143 -> 47 | S1143: E BREWER
A1144: BEST PLAYERS
A1145: MOORABBIN | C1145: LAWRENCE | F1145: SCHOFIELD | I1145: DALY | L1145: RENWICK | O1145: STANLEY | Q1145: LEHMANN
A1146: BRIGHTON | C1146: POUND | F1146: TURNER | I1146: BLACKMORE | L1146: EMBLETON | O1146: MEE | Q1146: PICKERING
A1147: GOALKICKERS
A1148: MOORABBIN | C1148: SCHOFIELD 6 | F1148: RENWICK 3 | I1148: LEHMANN | K1148: BARNES | M1148: CHANDLER | P1148: MANIE
A1149: BRIGHTON | C1149: PICKERING 2 | F1149: POUND | H1149: GRIENKE | J1149: MARINI | L1149: CONROY | N1149: CURRIE
A1151: BOX HILL | C1151: 4 | D1151: 1 | E1151: =C1151*6+D1151 -> 25 | G1151: 6 | H1151: 4 | I1151: =G1151*6+H1151 -> 40 | K1151: 9 | L1151: 5 | M1151: =K1151*6+L1151 -> 59 | O1151: 10 | P1151: 5 | Q1151: =O1151*6+P1151 -> 65 | S1151: WILLIAMSTOWN
A1152: WILLIAMSTOWN | C1152: 5 | D1152: 1 | E1152: =C1152*6+D1152 -> 31 | G1152: 8 | H1152: 4 | I1152: =G1152*6+H1152 -> 52 | K1152: 8 | L1152: 8 | M1152: =K1152*6+L1152 -> 56 | O1152: 8 | P1152: 13 | Q1152: =O1152*6+P1152 -> 61 | S1152: IRVING
A1153: BEST PLAYERS
A1154: BOX HILL | C1154: EDNIE | F1154: LOVE | I1154: KRONK | L1154: WEBB | O1154: GREEN | Q1154: NICHOLSON
A1155: WILLIAMSTOWN | C1155: ANDERSON | F1155: LINTON | I1155: WHITTAKER | L1155: SIMPSON | O1155: RAMSAY | Q1155: CALLAHAN
A1156: GOALKICKERS
A1157: BOX HILL | C1157: GREEN 3 | F1157: WEBB 2 | I1157: ABBOTT 2 | L1157: EDNIE 2 | O1157: CALDWELL
A1158: WILLIAMSTOWN | C1158: SIMPSON 2 | F1158: LINTON 2 | I1158: WALKER 2 | L1158: ANDERSON | O1158: CALLAHAN
A1160: OAKLEIGH | C1160: 3 | D1160: 5 | E1160: =C1160*6+D1160 -> 23 | G1160: 7 | H1160: 6 | I1160: =G1160*6+H1160 -> 48 | K1160: 13 | L1160: 10 | M1160: =K1160*6+L1160 -> 88 | O1160: 16 | P1160: 13 | Q1160: =O1160*6+P1160 -> 109 | S1160: OAKLEIGH
A1161: CAMBERWELL | C1161: 2 | D1161: 1 | E1161: =C1161*6+D1161 -> 13 | G1161: 5 | H1161: 4 | I1161: =G1161*6+H1161 -> 34 | K1161: 6 | L1161: 7 | M1161: =K1161*6+L1161 -> 43 | O1161: 9 | P1161: 12 | Q1161: =O1161*6+P1161 -> 66 | S1161: BAILES
A1162: BEST PLAYERS
A1163: OAKLEIGH | C1163: HILL | E1163: COLLINS | H1163: JACKSON | K1163: EDWARDS | N1163: HOWELL | Q1163: LAMBERT
A1164: CAMBERWELL | C1164: MASON | E1164: SKALBERG | H1164: DUFF | K1164: TEMPANY | N1164: MILNES | Q1164: McCOMB
A1165: GOALKICKERS
A1166: OAKLEIGH | C1166: BURTON 4 | F1166: JACKSON 3 | I1166: WALSH 3 | K1166: COLLINS 2 | N1166: BAPTIST 2 | Q1166: HILL | R1166: SHAW
A1167: CAMBERWELL | C1167: McCOMB 3 | F1167: HOLYOAK 2 | I1167: DUFF | K1167: McFEE | M1167: DUGDALE | O1167: YOUNG
A1169: NORTHCOTE | C1169: 3 | D1169: 4 | E1169: =C1169*6+D1169 -> 22 | G1169: 9 | H1169: 7 | I1169: =G1169*6+H1169 -> 61 | K1169: 16 | L1169: 9 | M1169: =K1169*6+L1169 -> 105 | O1169: 19 | P1169: 13 | Q1169: =O1169*6+P1169 -> 127 | S1169: NORTHCOTE
A1170: SANDRINGHAM | C1170: 1 | D1170: 3 | E1170: =C1170*6+D1170 -> 9 | G1170: 1 | H1170: 3 | I1170: =G1170*6+H1170 -> 9 | K1170: 4 | L1170: 5 | M1170: =K1170*6+L1170 -> 29 | O1170: 6 | P1170: 7 | Q1170: =O1170*6+P1170 -> 43 | S1170: HARWOOD
A1171: BEST PLAYERS
A1172: NORTHCOTE | C1172: HUNTER | F1172: STABB | I1172: WOOLNOUGH | L1172: DEVINE | O1172: WHITECHURCH | S1172: GIBBS
A1173: SANDRINGHAM | C1173: POTTER | F1173: WOODS | I1173: MORONEY | L1173: HANKINSON | O1173: McMAHON | S1173: CROFT
A1174: GOALKICKERS
A1175: NORTHCOTE | C1175: FRANCIS 5 | F1175: HUNTER 4 | I1175: G POWELL 3 | L1175: GIBBS 2 | N1175: DEVINE 2 | Q1175: WOOLNOUGH 2 | U1175: CRAWLEY
A1176: SANDRINGHAM | C1176: HARPER 2 | F1176: TURNER | I1176: HOY | K1176: RANSOM | M1176: CLAYTON
A1178: ROUND 19 | E1178: 28TH AUGUST | J1178: WEATHER | O1178: FINE | S1178: PLAYED AT
D1179: 1ST QTR | H1179: 2ND QTR | L1179: 3RD QTR | P1179: FINAL | S1179: NORTHCOTE
A1180: NORTHCOTE | C1180: 1 | D1180: 3 | E1180: =C1180*6+D1180 -> 9 | G1180: 4 | H1180: 7 | I1180: =G1180*6+H1180 -> 31 | K1180: 6 | L1180: 12 | M1180: =K1180*6+L1180 -> 48 | O1180: 7 | P1180: 15 | Q1180: =O1180*6+P1180 -> 57 | S1180: UMPIRE | X1180: LADDER | AB1180: ROUND | AD1180: 19
A1181: COBURG | C1181: 1 | D1181: 3 | E1181: =C1181*6+D1181 -> 9 | G1181: 2 | H1181: 3 | I1181: =G1181*6+H1181 -> 15 | K1181: 5 | L1181: 6 | M1181: =K1181*6+L1181 -> 36 | O1181: 8 | P1181: 7 | Q1181: =O1181*6+P1181 -> 55 | S1181: IRVING
A1182: BEST PLAYERS | W1182: TEAM | X1182: W | Y1182: L | Z1182: D | AA1182: FOR | AB1182: AGST | AC1182: % | AD1182: PTS
A1183: NORTHCOTE | C1183: WHITECHURCH | F1183: DEVINE | I1183: WOOLNOUGH | L1183: CRAWLEY | N1183: ALDRIDGE | Q1183: WRIGHT
A1184: COBURG | C1184: STARBUCK | F1184: MATTHEWS | I1184: H WILKINSON | L1184: HEWES | N1184: SANDLANT | Q1184: HORSKINS | W1184: PORT MELBOURNE | X1184: 16 | Y1184: 3 | Z1184: 0 | AA1184: 1892 | AB1184: 1296 | AC1184: 145.98765432098764 | AD1184: 64
A1185: GOALKICKERS | W1185: WILLIAMSTOWN | X1185: 15 | Y1185: 4 | Z1185: 0 | AA1185: 1733 | AB1185: 1098 | AC1185: 157.83242258652095 | AD1185: 60
A1186: NORTHCOTE | C1186: WRIGHT 3 | F1186: HUNTER 2 | I1186: WOOLNOUGH | L1186: FRANCIS | W1186: NORTHCOTE | X1186: 13 | Y1186: 5 | Z1186: 1 | AA1186: 1414 | AB1186: 1215 | AC1186: 116.37860082304526 | AD1186: 54
A1187: COBURG | C1187: H WILKINSON 4 | F1187: ROGAN | H1187: McDONALD | K1187: WILLIAMS | N1187: McCOLL | W1187: MOORABBIN | X1187: 12 | Y1187: 6 | Z1187: 1 | AA1187: 1502 | AB1187: 1207 | AC1187: 124.44076222038112 | AD1187: 50
A1189: BRUNSWICK | C1189: 2 | D1189: 3 | E1189: =C1189*6+D1189 -> 15 | G1189: 6 | H1189: 8 | I1189: =G1189*6+H1189 -> 44 | K1189: 7 | L1189: 13 | M1189: =K1189*6+L1189 -> 55 | O1189: 11 | P1189: 17 | Q1189: =O1189*6+P1189 -> 83 | S1189: BRUNSWICK | W1189: COBURG | X1189: 12 | Y1189: 6 | Z1189: 1 | AA1189: 1423 | AB1189: 1252 | AC1189: 113.65814696485623 | AD1189: 50
A1190: OAKLEIGH | C1190: 2 | D1190: 5 | E1190: =C1190*6+D1190 -> 17 | G1190: 3 | H1190: 7 | I1190: =G1190*6+H1190 -> 25 | K1190: 4 | L1190: 11 | M1190: =K1190*6+L1190 -> 35 | O1190: 11 | P1190: 16 | Q1190: =O1190*6+P1190 -> 82 | S1190: HARWOOD | W1190: PRESTON | X1190: 12 | Y1190: 7 | Z1190: 0 | AA1190: 1549 | AB1190: 1367 | AC1190: 113.31382589612289 | AD1190: 48
A1191: BEST PLAYERS | W1191: OAKLEIGH | X1191: 8 | Y1191: 9 | Z1191: 2 | AA1191: 1658 | AB1191: 1574 | AC1191: 105.33672172808132 | AD1191: 36
A1192: BRUNSWICK | C1192: ROLFS | F1192: CLUES | I1192: WEIR | L1192: MILBURN | O1192: MAY | Q1192: STANLEY | W1192: PRAHRAN | X1192: 9 | Y1192: 10 | Z1192: 0 | AA1192: 1664 | AB1192: 1599 | AC1192: 104.0650406504065 | AD1192: 36
A1193: OAKLEIGH | C1193: DALMAN | F1193: COLLINS | I1193: LAMBERT | L1193: GUY | O1193: GORDON | Q1193: BAPTIST | W1193: BRUNSWICK | X1193: 9 | Y1193: 10 | Z1193: 0 | AA1193: 1354 | AB1193: 1310 | AC1193: 103.3587786259542 | AD1193: 36
A1194: GOALKICKERS | W1194: BOX HILL | X1194: 8 | Y1194: 11 | Z1194: 0 | AA1194: 1479 | AB1194: 1361 | AC1194: 108.67009551800147 | AD1194: 32
A1195: BRUNSWICK | C1195: HAYES 4 | F1195: CLUES 3 | I1195: MULLENGER | L1195: MILBURN | N1195: WEIR | P1195: LOVETT | W1195: YARRAVILLE | X1195: 8 | Y1195: 11 | Z1195: 0 | AA1195: 1372 | AB1195: 1510 | AC1195: 90.860927152317885 | AD1195: 32
A1196: OAKLEIGH | C1196: SHAW 4 | F1196: BURTON 2 | I1196: SAID 2 | K1196: COLLINS | M1196: T WALSH | O1196: WATSON | W1196: BRIGHTON | X1196: 5 | Y1196: 13 | Z1196: 1 | AA1196: 1209 | AB1196: 1601 | AC1196: 75.515302935665204 | AD1196: 22
W1197: CAMBERWELL | X1197: 2 | Y1197: 17 | Z1197: 0 | AA1197: 1362 | AB1197: 1924 | AC1197: 70.79002079002079 | AD1197: 8
A1198: PRESTON | C1198: 0 | D1198: 1 | E1198: =C1198*6+D1198 -> 1 | G1198: 2 | H1198: 8 | I1198: =G1198*6+H1198 -> 20 | K1198: 6 | L1198: 10 | M1198: =K1198*6+L1198 -> 46 | O1198: 10 | P1198: 19 | Q1198: =O1198*6+P1198 -> 79 | S1198: PRESTON | W1198: SANDRINGHAM | X1198: 1 | Y1198: 18 | Z1198: 0 | AA1198: 1000 | AB1198: 2297 | AC1198: 43.535045711797999 | AD1198: 4
A1199: YARRAVILLE | C1199: 3 | D1199: 5 | E1199: =C1199*6+D1199 -> 23 | G1199: 4 | H1199: 5 | I1199: =G1199*6+H1199 -> 29 | K1199: 5 | L1199: 14 | M1199: =K1199*6+L1199 -> 44 | O1199: 9 | P1199: 14 | Q1199: =O1199*6+P1199 -> 68 | S1199: E BREWER
A1200: BEST PLAYERS
A1201: PRESTON | C1201: SWEET | F1201: CROCKER | I1201: K CHARD | L1201: PRITCHARD | O1201: BRADFORD | R1201: LALOR
A1202: YARRAVILLE | C1202: K SMITH | F1202: MASON | I1202: J ROHLEDER | L1202: CHARLES | O1202: JONES | R1202: WILLIAMS
A1203: GOALKICKERS
A1204: PRESTON | C1204: K CHARD 3 | F1204: F CHARD 2 | I1204: JEFFREY | K1204: FOLEY | M1204: BLIZZARD | O1204: COOPER | Q1204: BRADFORD
A1205: YARRAVILLE | C1205: MASON 2 | F1205: WILLIAMS 2 | I1205: WALLIS | K1205: WILD | M1205: BEECH | O1205: HUGHES | Q1205: N ROHLEDER
A1207: BOX HILL | C1207: 4 | D1207: 8 | E1207: =C1207*6+D1207 -> 32 | G1207: 6 | H1207: 8 | I1207: =G1207*6+H1207 -> 44 | K1207: 13 | L1207: 10 | M1207: =K1207*6+L1207 -> 88 | O1207: 14 | P1207: 10 | Q1207: =O1207*6+P1207 -> 94 | S1207: BOX HILL
A1208: PRAHRAN | C1208: 0 | D1208: 3 | E1208: =C1208*6+D1208 -> 3 | G1208: 3 | H1208: 7 | I1208: =G1208*6+H1208 -> 25 | K1208: 5 | L1208: 11 | M1208: =K1208*6+L1208 -> 41 | O1208: 9 | P1208: 18 | Q1208: =O1208*6+P1208 -> 72 | S1208: CARLTON
A1209: BEST PLAYERS
A1210: BOX HILL | C1210: TURNER | F1210: EDNIE | I1210: GREEN | L1210: WRIGHT | O1210: NICHOLS0ON | R1210: PINKERTON
A1211: PRAHRAN | C1211: KRUSE | F1211: SHILLABEER | I1211: PLAIN | L1211: O'BRYAN | O1211: WALSH | R1211: YATES
A1212: GOALKICKERS
A1213: BOX HILL | C1213: TURNER 3 | F1213: EDNIE 3 | H1213: ABBOTT 2 | J1213: DOUGLAS 2 | M1213: GREEN 2 | O1213: WEBB | Q1213: MORRIS
A1214: PRAHRAN | C1214: D KINNABURGH 3 | G1214: ELLIOTT 2 | J1214: BOYD | L1214: LETTS | N1214: KRUSE | P1214: WALSH
A1216: MOORABBIN | C1216: 4 | D1216: 2 | E1216: =C1216*6+D1216 -> 26 | G1216: 9 | H1216: 6 | I1216: =G1216*6+H1216 -> 60 | K1216: 15 | L1216: 12 | M1216: =K1216*6+L1216 -> 102 | O1216: 19 | P1216: 15 | Q1216: =O1216*6+P1216 -> 129 | S1216: CAMBERWELL
A1217: CAMBERWELL | C1217: 2 | D1217: 3 | E1217: =C1217*6+D1217 -> 15 | G1217: 5 | H1217: 6 | I1217: =G1217*6+H1217 -> 36 | K1217: 8 | L1217: 6 | M1217: =K1217*6+L1217 -> 54 | O1217: 11 | P1217: 11 | Q1217: =O1217*6+P1217 -> 77 | S1217: CARDWELL
A1218: BEST PLAYERS
A1219: MOORABBIN | C1219: SCHOFIELD | F1219: SCANLON | I1219: DALY | L1219: TRESIZE | N1219: STANLEY | Q1219: BECKWITH
A1220: CAMBERWELL | C1220: MASON | F1220: MILNES | I1220: JARRARD | L1220: WRIGHT | N1220: ALWAY | Q1220: ALLSOPP
A1221: GOALKICKERS
A1222: MOORABBIN | C1222: SCHOFIELD 14 | F1222: DALY 3 | I1222: McKENZIE | L1222: BROWN
A1223: CAMBERWELL | C1223: McFEE 3 | F1223: TEMPANY 3 | I1223: HAYES 2 | K1223: HOLYOAK | M1223: McCOMB | O1223: ALLSOPP
A1225: PORT MELBOURNE | C1225: 8 | D1225: 3 | E1225: =C1225*6+D1225 -> 51 | G1225: 10 | H1225: 6 | I1225: =G1225*6+H1225 -> 66 | K1225: 13 | L1225: 12 | M1225: =K1225*6+L1225 -> 90 | O1225: 13 | P1225: 13 | Q1225: =O1225*6+P1225 -> 91 | S1225: ELSTERNWICK PARK
A1226: BRIGHTON | C1226: 4 | D1226: 3 | E1226: =C1226*6+D1226 -> 27 | G1226: 5 | H1226: 6 | I1226: =G1226*6+H1226 -> 36 | K1226: 7 | L1226: 9 | M1226: =K1226*6+L1226 -> 51 | O1226: 11 | P1226: 15 | Q1226: =O1226*6+P1226 -> 81 | S1226: GAMBLE
A1227: BEST PLAYERS
A1228: PORT MELBOURNE | C1228: BRIGGS | E1228: STOREY | H1228: STONE | K1228: HARVEY | N1228: KELSEY | Q1228: JOHNSON
A1229: BRIGHTON | C1229: KERR | E1229: JOSTLEAR | H1229: E TURNER | K1229: O'MEARA | N1229: BLACKMORE | Q1229: HICKMAN
A1230: GOALKICKERS
A1231: PORT MELBOURNE | C1231: BRIGGS 4 | F1231: BONNETT 3 | I1231: SYKES 2 | K1231: HARVEY 2 | M1231: DUNBAR | O1231: JOHNSON
A1232: BRIGHTON | C1232: CURRIE 2 | F1232: PICKERING 2 | I1232: CRAIG 2 | K1232: POUND 2 | M1232: ALEXANDER | P1232: KNIGHT | R1232: HICKMAN
A1234: WILLIAMSTOWN | C1234: 10 | D1234: 5 | E1234: =C1234*6+D1234 -> 65 | G1234: 16 | H1234: 9 | I1234: =G1234*6+H1234 -> 105 | K1234: 20 | L1234: 9 | M1234: =K1234*6+L1234 -> 129 | O1234: 25 | P1234: 11 | Q1234: =O1234*6+P1234 -> 161 | S1234: BEACH ROAD
A1235: SANDRINGHAM | C1235: 2 | D1235: 1 | E1235: =C1235*6+D1235 -> 13 | G1235: 4 | H1235: 1 | I1235: =G1235*6+H1235 -> 25 | K1235: 4 | L1235: 5 | M1235: =K1235*6+L1235 -> 29 | O1235: 4 | P1235: 10 | Q1235: =O1235*6+P1235 -> 34 | S1235: D BREWER
A1236: BEST PLAYERS
A1237: WILLIAMSTOWN | C1237: GRAHAM | F1237: ABBERTON | I1237: MUNDAY | L1237: LINTON | O1237: TAYLOR | Q1237: ANDERSON
A1238: SANDRINGHAM | C1238: FLEMING | F1238: HOY | I1238: PHILLIPS | L1238: HANNAFORD | O1238: CROFT | Q1238: MILLER
A1239: GOALKICKERS
A1240: WILLIAMSTOWN | C1240: GRAHAM 6 | F1240: LINTON 6 | I1240: ANDERSON 5 | L1240: ABBERTON 4 | O1240: TAYLOR 2 | Q1240: SIMPSON | S1240: SMITH | U1240: SIMS
A1241: SANDRINGHAM | C1241: CLAYTON | F1241: HARPER | I1241: J WOODS | L1241: FLEMING
A1243: ROUND 20 | E1243: 4TH SEPTEMBER | M1243: WEATHER
D1244: 1ST QTR | H1244: 2ND QTR | L1244: 3RD QTR | P1244: FINAL | S1244: PLAYED AT
A1245: WILLIAMSTOWN | C1245: 3 | D1245: 3 | E1245: =C1245*6+D1245 -> 21 | G1245: 5 | H1245: 4 | I1245: =G1245*6+H1245 -> 34 | K1245: 6 | L1245: 7 | M1245: =K1245*6+L1245 -> 43 | O1245: 7 | P1245: 8 | Q1245: =O1245*6+P1245 -> 50 | S1245: WILLIAMSTOWN | X1245: LADDER | AB1245: ROUND | AD1245: 20
A1246: NORTHCOTE | C1246: 0 | D1246: 2 | E1246: =C1246*6+D1246 -> 2 | G1246: 1 | H1246: 5 | I1246: =G1246*6+H1246 -> 11 | K1246: 4 | L1246: 6 | M1246: =K1246*6+L1246 -> 30 | O1246: 6 | P1246: 13 | Q1246: =O1246*6+P1246 -> 49 | S1246: UMPIRE
A1247: BEST PLAYERS | S1247: CARDWELL | W1247: TEAM | X1247: W | Y1247: L | Z1247: D | AA1247: FOR | AB1247: AGST | AC1247: % | AD1247: PTS
A1248: WILLIAMSTOWN | C1248: CALLAHAN | F1248: MUNDAY | I1248: TAAFE | K1248: CURRAN | N1248: SIMPSON | Q1248: WHITTAKER
A1249: NORTHCOTE | C1249: VAINS | F1249: POWELL | I1249: WHITECHURCH | L1249: HOLT | N1249: WALKER | Q1249: ALDRIDGE | W1249: PORT MELBOURNE | X1249: 17 | Y1249: 3 | Z1249: 0 | AA1249: 2047 | AB1249: 1359 | AC1249: 150.62545989698307 | AD1249: 68
A1250: GOALKICKERS | W1250: WILLIAMSTOWN | X1250: 16 | Y1250: 4 | Z1250: 0 | AA1250: 1783 | AB1250: 1147 | AC1250: 155.44899738448126 | AD1250: 64
A1251: WILLIAMSTOWN | C1251: GRAHAM 3 | F1251: LINTON | H1251: ABBERTON | J1251: TAYLOR | L1251: SMITH | W1251: MOORABBIN | X1251: 13 | Y1251: 6 | Z1251: 1 | AA1251: 1700 | AB1251: 1241 | AC1251: 136.98630136986301 | AD1251: 54
A1252: NORTHCOTE | C1252: FRANCIS 2 | F1252: WRIGHT 2 | I1252: WOOLNOUGH | L1252: PURDON | W1252: NORTHCOTE | X1252: 13 | Y1252: 6 | Z1252: 1 | AA1252: 1463 | AB1252: 1265 | AC1252: 115.65217391304348 | AD1252: 54
A1254: PRAHRAN | C1254: 6 | D1254: 2 | E1254: =C1254*6+D1254 -> 38 | G1254: 8 | H1254: 4 | I1254: =G1254*6+H1254 -> 52 | K1254: 9 | L1254: 4 | M1254: =K1254*6+L1254 -> 58 | O1254: 17 | P1254: 5 | Q1254: =O1254*6+P1254 -> 107 | S1254: TOORAK PARK | W1254: PRESTON | X1254: 13 | Y1254: 7 | Z1254: 0 | AA1254: 1659 | AB1254: 1426 | AC1254: 116.33941093969145 | AD1254: 52
A1255: COBURG | C1255: 3 | D1255: 4 | E1255: =C1255*6+D1255 -> 22 | G1255: 6 | H1255: 7 | I1255: =G1255*6+H1255 -> 43 | K1255: 10 | L1255: 12 | M1255: =K1255*6+L1255 -> 72 | O1255: 12 | P1255: 15 | Q1255: =O1255*6+P1255 -> 87 | S1255: GAMBLE | W1255: COBURG | X1255: 12 | Y1255: 7 | Z1255: 1 | AA1255: 1510 | AB1255: 1359 | AC1255: 111.11111111111111 | AD1255: 50
A1256: BEST PLAYERS | W1256: PRAHRAN | X1256: 10 | Y1256: 10 | Z1256: 0 | AA1256: 1771 | AB1256: 1686 | AC1256: 105.04151838671412 | AD1256: 40
A1257: PRAHRAN | C1257: D KINNABURGH | F1257: KRUSE | I1257: YATES | L1257: PLAIN | N1257: CLEAR | P1257: SHILLABEER | W1257: BOX HILL | X1257: 9 | Y1257: 11 | Z1257: 0 | AA1257: 1582 | AB1257: 1459 | AC1257: 108.43043180260452 | AD1257: 36
A1258: COBURG | C1258: ROGAN | F1258: HEWES | I1258: SANDLANT | L1258: WALKER | N1258: McCOLL | P1258: STARBUCK | W1258: OAKLEIGH | X1258: 8 | Y1258: 10 | Z1258: 2 | AA1258: 1756 | AB1258: 1677 | AC1258: 104.71079308288611 | AD1258: 36
A1259: GOALKICKERS | W1259: BRUNSWICK | X1259: 9 | Y1259: 11 | Z1259: 0 | AA1259: 1413 | AB1259: 1420 | AC1259: 99.507042253521121 | AD1259: 36
A1260: PRAHRAN | C1260: D KINNABURGH 7 | G1260: HARVEY 2 | I1260: SHARP 2 | K1260: J JONES 2 | M1260: KRUSE 2 | O1260: ELLIOTT | Q1260: BURNS | W1260: YARRAVILLE | X1260: 9 | Y1260: 11 | Z1260: 0 | AA1260: 1460 | AB1260: 1580 | AC1260: 92.405063291139243 | AD1260: 36
A1261: COBURG | C1261: HEWES 4 | F1261: ROGAN 4 | I1261: R WILKINSON | L1261: McCOLL | N1261: McDONALD | Q1261: H WILKINSON | W1261: BRIGHTON | X1261: 5 | Y1261: 14 | Z1261: 1 | AA1261: 1279 | AB1261: 1689 | AC1261: 75.725281231497931 | AD1261: 22
W1262: CAMBERWELL | X1262: 2 | Y1262: 18 | Z1262: 0 | AA1262: 1425 | AB1262: 2079 | AC1262: 68.542568542568546 | AD1262: 8
A1263: PRESTON | C1263: 3 | D1263: 2 | E1263: =C1263*6+D1263 -> 20 | G1263: 7 | H1263: 10 | I1263: =G1263*6+H1263 -> 52 | K1263: 10 | L1263: 10 | M1263: =K1263*6+L1263 -> 70 | O1263: 16 | P1263: 14 | Q1263: =O1263*6+P1263 -> 110 | S1263: BRUNSWICK | W1263: SANDRINGHAM | X1263: 1 | Y1263: 19 | Z1263: 0 | AA1263: 1034 | AB1263: 2495 | AC1263: 41.442885771543089 | AD1263: 4
A1264: BRUNSWICK | C1264: 1 | D1264: 7 | E1264: =C1264*6+D1264 -> 13 | G1264: 2 | H1264: 10 | I1264: =G1264*6+H1264 -> 22 | K1264: 6 | L1264: 13 | M1264: =K1264*6+L1264 -> 49 | O1264: 7 | P1264: 17 | Q1264: =O1264*6+P1264 -> 59 | S1264: IRVING
A1265: BEST PLAYERS
A1266: PRESTON | C1266: FOLEY | F1266: PRITCHARD | I1266: BRADFORD | L1266: LALOR | N1266: F CHARD | Q1266: K CHARD
A1267: BRUNSWICK | C1267: POLLARD | F1267: DUNSTAN | I1267: MAY | L1267: LEYDEN | N1267: WEIR | Q1267: NEILSON
A1268: GOALKICKERS
A1269: PRESTON | C1269: F CHARD 8 | F1269: FOLEY 5 | I1269: JEFFREY 2 | L1269: BRADFORD
A1270: BRUNSWICK | C1270: LOVETT 3 | F1270: MILBURN | I1270: BURGESS | L1270: YOUNG | N1270: LEYDEN
A1272: BOX HILL | C1272: 3 | D1272: 3 | E1272: =C1272*6+D1272 -> 21 | G1272: 9 | H1272: 10 | I1272: =G1272*6+H1272 -> 64 | K1272: 10 | L1272: 12 | M1272: =K1272*6+L1272 -> 72 | O1272: 15 | P1272: 13 | Q1272: =O1272*6+P1272 -> 103 | S1272: OAKLEIGH
A1273: OAKLEIGH | C1273: 3 | D1273: 1 | E1273: =C1273*6+D1273 -> 19 | G1273: 8 | H1273: 3 | I1273: =G1273*6+H1273 -> 51 | K1273: 13 | L1273: 6 | M1273: =K1273*6+L1273 -> 84 | O1273: 15 | P1273: 8 | Q1273: =O1273*6+P1273 -> 98 | S1273: E BREWER
A1274: BEST PLAYERS
A1275: BOX HILL | C1275: MORRIS | E1275: TURNER | H1275: KRONK | K1275: ABBOTT | N1275: EDNIE | Q1275: DOUGLAS
A1276: OAKLEIGH | C1276: COLLINS | E1276: SAID | H1276: SHAW | K1276: HILL | N1276: WATSON | Q1276: LAMBERT
A1277: GOALKICKERS
A1278: BOX HILL | C1278: MORRIS 6 | F1278: TURNER 4 | I1278: ABBOTT 3 | L1278: EDNIE | N1278: WEBB
A1279: OAKLEIGH | C1279: SAID 6 | F1279: SHAW 4 | I1279: WATSON 2 | L1279: G WALSH | N1279: HILL | P1279: T WALSH
A1281: YARRAVILLE | C1281: 3 | D1281: 3 | E1281: =C1281*6+D1281 -> 21 | G1281: 6 | H1281: 7 | I1281: =G1281*6+H1281 -> 43 | K1281: 10 | L1281: 9 | M1281: =K1281*6+L1281 -> 69 | O1281: 12 | P1281: 16 | Q1281: =O1281*6+P1281 -> 88 | S1281: YARRAVILLE
A1282: BRIGHTON | C1282: 2 | D1282: 1 | E1282: =C1282*6+D1282 -> 13 | G1282: 3 | H1282: 2 | I1282: =G1282*6+H1282 -> 20 | K1282: 5 | L1282: 6 | M1282: =K1282*6+L1282 -> 36 | O1282: 10 | P1282: 10 | Q1282: =O1282*6+P1282 -> 70 | S1282: SMYTH
A1283: BEST PLAYERS
A1284: YARRAVILLE | C1284: JONES | F1284: WILD | H1284: SEITZ | K1284: N ROHLEDER | N1284: VANDERFEEN | Q1284: HART
A1285: BRIGHTON | C1285: ALEXANDER | F1285: READ | H1285: BLACKMORE | K1285: E TURNER | N1285: KERR | Q1285: PICKERING
A1286: GOALKICKERS
A1287: YARRAVILLE | C1287: MASON 2 | F1287: N ROHLEDER 2 | J1287: HART 2 | L1287: WALLIS 2 | N1287: CHARLES | P1287: TREBILCOCK | S1287: HUGHES | U1287: SMITH
A1288: BRIGHTON | C1288: ALEXANDER 3 | F1288: HICKMAN 3 | I1288: PICKERING 2 | L1288: CRAIG | N1288: CURRIE
A1290: MOORABBIN | C1290: 5 | D1290: 2 | E1290: =C1290*6+D1290 -> 32 | G1290: 15 | H1290: 5 | I1290: =G1290*6+H1290 -> 95 | K1290: 21 | L1290: 11 | M1290: =K1290*6+L1290 -> 137 | O1290: 31 | P1290: 12 | Q1290: =O1290*6+P1290 -> 198 | S1290: MOORABBIN
A1291: SANDRINGHAM | C1291: 1 | D1291: 1 | E1291: =C1291*6+D1291 -> 7 | G1291: 3 | H1291: 1 | I1291: =G1291*6+H1291 -> 19 | K1291: 4 | L1291: 2 | M1291: =K1291*6+L1291 -> 26 | O1291: 5 | P1291: 4 | Q1291: =O1291*6+P1291 -> 34 | S1291: HARWOOD
A1292: BEST PLAYERS
A1293: MOORABBIN | C1293: SCHOFIELD | F1293: RENWICK | I1293: STANLEY | L1293: LEHMANN | O1293: MORONEY | R1293: MANIE
A1294: SANDRINGHAM | C1294: SIMMONDS | F1294: FLEMING | I1294: HANNAFORD | L1294: CROFT | O1294: BURMEISTER | R1294: PHILLIPS
A1295: GOALKICKERS
A1296: MOORABBIN | C1296: SCHOFIELD 22 | F1296: RENWICK 3 | I1296: DALY 3 | K1296: MANIE | M1296: CLOVER | O1296: MORONEY
A1297: SANDRINGHAM | C1297: SIMMONDS 3 | F1297: MILLER | I1297: SECCOMBE
A1299: PORT MELBOURNE | C1299: 10 | D1299: 7 | E1299: =C1299*6+D1299 -> 67 | G1299: 14 | H1299: 11 | I1299: =G1299*6+H1299 -> 95 | K1299: 22 | L1299: 18 | M1299: =K1299*6+L1299 -> 150 | O1299: 22 | P1299: 23 | Q1299: =O1299*6+P1299 -> 155 | S1299: PORT MELBOURNE
A1300: CAMBERWELL | C1300: 1 | D1300: 1 | E1300: =C1300*6+D1300 -> 7 | G1300: 4 | H1300: 5 | I1300: =G1300*6+H1300 -> 29 | K1300: 5 | L1300: 7 | M1300: =K1300*6+L1300 -> 37 | O1300: 9 | P1300: 9 | Q1300: =O1300*6+P1300 -> 63 | S1300: ROACH
A1301: BEST PLAYERS
A1302: PORT MELBOURNE | C1302: MILLER | F1302: SYKES | I1302: BONNETT | L1302: JOHNSON | O1302: WHARTON | R1302: WILSON
A1303: CAMBERWELL | C1303: CUNNINGHAM | F1303: MILNES | I1303: HAYES | L1303: McFEE | O1303: SKALBERG | R1303: McCOMB
A1304: GOALKICKERS
A1305: PORT MELBOURNE | C1305: BONNETT 4 | F1305: SYKES 3 | I1305: DUNBAR 3 | L1305: McDONALD 2 | O1305: OWENS 2 | Q1305: BLACK | S1305: JOHNSON | V1305: WHARTON
A1306: CAMBERWELL | C1306: McCOMB 3 | F1306: HOLYOAK 2 | I1306: McFEE | K1306: JARRARD | M1306: TEMPANY | O1306: SCHNEIDER
A1308: FINALS
A1309: 1ST SEMI | D1309: 11TH SEPTEMBER | H1309: WEATHER | L1309: STRONG NORTH WEST WIND CLOUDY
D1310: 1ST QTR | H1310: 2ND QTR | L1310: 3RD QTR | P1310: FINAL
A1311: NORTHCOTE | C1311: 5 | D1311: 12 | E1311: =C1311*6+D1311 -> 42 | G1311: 5 | H1311: 12 | I1311: =G1311*6+H1311 -> 42 | K1311: 9 | L1311: 16 | M1311: =K1311*6+L1311 -> 70 | O1311: 12 | P1311: 18 | Q1311: =O1311*6+P1311 -> 90 | S1311: JUNCTION OVAL
A1312: MOORABBIN | C1312: 0 | D1312: 0 | E1312: =C1312*6+D1312 -> 0 | G1312: 3 | H1312: 4 | I1312: =G1312*6+H1312 -> 22 | K1312: 4 | L1312: 4 | M1312: =K1312*6+L1312 -> 28 | O1312: 6 | P1312: 8 | Q1312: =O1312*6+P1312 -> 44 | S1312: CARDWELL
A1313: BEST PLAYERS
A1314: NORTHCOTE | C1314: DEVINE | F1314: STABB | I1314: HISCOX | L1314: GIBBS | O1314: ALDRIDGE | R1314: WALKER
A1315: MOORABBIN | C1315: McKENZIE | F1315: SCANLON | I1315: OSTLE | L1315: BECKWITH | O1315: TRESIZE | R1315: CLOVER
A1316: GOALKICKERS
A1317: NORTHCOTE | C1317: GIBBS 5 | F1317: HUNTER 2 | I1317: FRANCIS | K1317: PAYNTER | M1317: WOOLNOUGH | P1317: CRAWLEY | R1317: WRIGHT
A1318: MOORABBIN | C1318: DALY 2 | F1318: SCHOFIELD | I1318: COAD | K1318: CLOVER | M1318: MANIE
A1320: 2ND SEMI | E1320: 18TH SEPTEMBER | J1320: WEATHER | M1320: SUNSHINE & SHOWERS
A1321: PORT MELBOURNE | C1321: 2 | D1321: 2 | E1321: =C1321*6+D1321 -> 14 | G1321: 5 | H1321: 5 | I1321: =G1321*6+H1321 -> 35 | K1321: 6 | L1321: 8 | M1321: =K1321*6+L1321 -> 44 | O1321: 7 | P1321: 12 | Q1321: =O1321*6+P1321 -> 54 | S1321: JUNCTION OVAL
A1322: WILLIAMSTOWN | C1322: 4 | D1322: 4 | E1322: =C1322*6+D1322 -> 28 | G1322: 4 | H1322: 6 | I1322: =G1322*6+H1322 -> 30 | K1322: 4 | L1322: 9 | M1322: =K1322*6+L1322 -> 33 | O1322: 5 | P1322: 12 | Q1322: =O1322*6+P1322 -> 42 | S1322: IRVING
A1323: BEST PLAYERS
A1324: PORT MELBOURNE | C1324: JOHNSON | F1324: WILSON | I1324: WITHERS | L1324: KELSEY | O1324: STONE | R1324: MILLER
A1325: WILLIAMSTOWN | C1325: MARTIN | F1325: WOOKEY | I1325: CALLAHAN | L1325: WHITTAKER | O1325: LINTON | R1325: SIMPSON
A1326: GOALKICKERS
A1327: PORT MELBOURNE | C1327: BONNETT 3 | F1327: McDONALD 2 | I1327: MILLER | K1327: SYKES
A1328: WILLIAMSTOWN | C1328: WALKER 2 | F1328: MARTIN | I1328: ALFORD | K1328: SMITH
A1330: PRELIMINARY FINAL | G1330: 25TH SEPTEMBER | L1330: WEATHER | N1330: SOUTH WEST WIND FINE & SUNNY
A1331: WILLIAMSTOWN | C1331: 5 | D1331: 2 | E1331: =C1331*6+D1331 -> 32 | G1331: 11 | H1331: 4 | I1331: =G1331*6+H1331 -> 70 | K1331: 13 | L1331: 4 | M1331: =K1331*6+L1331 -> 82 | O1331: 17 | P1331: 11 | Q1331: =O1331*6+P1331 -> 113 | S1331: JUNCTION OVAL
A1332: NORTHCOTE | C1332: 3 | D1332: 1 | E1332: =C1332*6+D1332 -> 19 | G1332: 5 | H1332: 2 | I1332: =G1332*6+H1332 -> 32 | K1332: 8 | L1332: 11 | M1332: =K1332*6+L1332 -> 59 | O1332: 10 | P1332: 12 | Q1332: =O1332*6+P1332 -> 72 | S1332: E BREWER
A1333: BEST PLAYERS
A1334: WILLIAMSTOWN | C1334: SIMPSON | F1334: ALFORD | I1334: ANDERSON | L1334: MARTIN | O1334: LINTON | Q1334: CALLAHAN
A1335: NORTHCOTE | C1335: PURDON | F1335: STABB | I1335: DEVINE | L1335: WOOLNOUGH | O1335: VAINS | Q1335: WRIGHT
A1336: GOALKICKERS
A1337: WILLIAMSTOWN | C1337: ANDERSON 5 | F1337: ALFORD 4 | I1337: LINTON 4 | L1337: SMITH | N1337: SIMPSON | Q1337: FISHER | S1337: KENT
A1338: NORTHCOTE | C1338: FRANCIS 2 | F1338: COLLINS 2 | I1338: HUNTER 2 | L1338: GIBBS | N1338: DEVINE | Q1338: PURDON | S1338: WOOLNOUGH
A1340: GRAND FINAL | E1340: 2ND OCTOBER | J1340: WEATHER | M1340: SOUTH WIND FINE
A1341: WILLIAMSTOWN | C1341: 4 | D1341: 7 | E1341: 31 | G1341: 6 | H1341: 9 | I1341: 45 | K1341: 10 | L1341: 16 | M1341: 76 | O1341: 11 | P1341: 20 | Q1341: =O1341*6+P1341 -> 86 | S1341: JUNCTION OVAL
A1342: PORT MELBOURNE | C1342: 0 | D1342: 1 | E1342: 1 | G1342: 4 | H1342: 3 | I1342: 27 | K1342: 5 | L1342: 4 | M1342: 34 | O1342: 7 | P1342: 12 | Q1342: =O1342*6+P1342 -> 54 | S1342: IRVING
A1343: BEST PLAYERS
A1344: WILLIAMSTOWN | C1344: SIMPSON | F1344: ALFORD | I1344: HARLEY | L1344: FISHER | O1344: CURRAN | R1344: LEIGH
A1345: PORT MELBOURNE | C1345: WILSON | F1345: STOREY | I1345: JOHNSON | L1345: METHERALL | O1345: KELSEY | R1345: WHARTON
A1346: GOALKICKERS
A1347: WILLIAMSTOWN | C1347: ALFORD 3 | F1347: SIMPSON 3 | I1347: FISHER 2 | K1347: ANDERSON | N1347: KENT | P1347: LINTON
A1348: PORT MELBOURNE | C1348: BONNETT 3 | F1348: WHARTON | I1348: OWENS | K1348: McDONALD | N1348: WALSH
A1351: YEAR 1954
A1352: CARNIVAL MATCHES
A1353: 1ST MATCH
A1354: V.F.A. | C1354: 2 | D1354: 3 | E1354: =C1354*6+D1354 -> 15 | G1354: 6 | H1354: 11 | I1354: =G1354*6+H1354 -> 47 | K1354: 9 | L1354: 14 | M1354: =K1354*6+L1354 -> 68 | O1354: 11 | P1354: 18 | Q1354: =O1354*6+P1354 -> 84
A1355: TAS | C1355: 1 | D1355: 3 | E1355: =C1355*6+D1355 -> 9 | G1355: 2 | H1355: 7 | I1355: =G1355*6+H1355 -> 19 | K1355: 3 | L1355: 8 | M1355: =K1355*6+L1355 -> 26 | O1355: 5 | P1355: 11 | Q1355: =O1355*6+P1355 -> 41
A1356: BEST PLAYERS
A1357: V.F.A. | C1357: FRASER | F1357: SAVORY | I1357: JOHNSON | L1357: KRUSE | O1357: MILLER | R1357: HEWES
A1358: TAS | C1358: McCLEMENTS | F1358: STOKES | I1358: CASHION | L1358: LEEDHAM | O1358: McCANKIE | R1358: HAWKSLEY
A1359: GOALKICKERS
A1360: V.F.A. | C1360: FRASER 3 | F1360: KRUSE 2 | I1360: HEWES 2 | L1360: SIMPSON | N1360: MILLER | P1360: JOHNSON | R1360: MURRAY
A1361: TAS | C1361: McCLEMENTS 2 | G1361: McCANKIE | J1361: PARSONS | M1361: CASHION
A1363: TEAM
A1364: BACKS | C1364: TEMME | F1364: HENRYS | I1364: SIMPSON
A1365: H-BACKS | C1365: GILDER | F1365: TINDAL | I1365: G WILLIAMS
A1366: CENTRES | C1366: SAVORY | F1366: McDONALD | I1366: GRAMBEAU
A1367: H-FORWARDS | C1367: HILL | F1367: FRASER | I1367: HUGHES
A1368: FORWARDS | C1368: KRUSE | F1368: FRANCIS | I1368: ROGAN
A1369: RUCKS | C1369: JOHNSON | F1369: MURRAY | I1369: MILLER
A1370: RES | C1370: TAYLOR | I1370: McFEE
A1372: 2ND MATCH
A1373: V.F.L. | C1373: 3 | D1373: 4 | E1373: =C1373*6+D1373 -> 22 | G1373: 8 | H1373: 10 | I1373: =G1373*6+H1373 -> 58 | K1373: 12 | L1373: 11 | M1373: =K1373*6+L1373 -> 83 | O1373: 16 | P1373: 13 | Q1373: =O1373*6+P1373 -> 109
A1374: V.F.A. | C1374: 2 | D1374: 3 | E1374: =C1374*6+D1374 -> 15 | G1374: 6 | H1374: 4 | I1374: =G1374*6+H1374 -> 40 | K1374: 10 | L1374: 8 | M1374: =K1374*6+L1374 -> 68 | O1374: 11 | P1374: 10 | Q1374: =O1374*6+P1374 -> 76
A1375: BEST PLAYERS
A1376: V.F.L. | C1376: HOWELL | F1376: HUTCHISON | I1376: HANDS | L1376: CLARKE | O1376: WRIGHT | R1376: SUTTON
A1377: V.F.A. | C1377: G WILLIAMS | F1377: JOHNSON | I1377: MILLER | L1377: KRUSE | O1377: NEILSON | R1377: SAVORY
A1378: GOALKICKERS
A1379: V.F.L. | C1379: HOWELL 3 | F1379: HUTCHISON 3 | I1379: WRIGHT 2 | K1379: FLANAGAN 2 | N1379: TURNER | P1379: JARRAD | R1379: HANDS | T1379: CRANE | V1379: TAYLOR | X1379: McKENZIE
A1380: V.F.A. | C1380: SIMPSON 3 | F1380: MILLER 3 | I1380: HEWES 2 | L1380: FRASER 2 | O1380: ROGAN
A1382: TEAMS
F1383: V.F.A. | P1383: V.F.L.
A1384: BACKS | C1384: TEMME | F1384: HENRYS | I1384: NEILSON | M1384: STEPHEN | P1384: PHILLIPS | S1384: TAYLOR
A1385: H-BACKS | C1385: GILDER | F1385: TINDAL | I1385: G WILLIAMS | M1385: ROWE | P1385: ARNOLD | S1385: JARRARD
A1386: CENTRES | C1386: SAVORY | F1386: TAYLOR | I1386: GRAMBEAU | M1386: PEARSON | P1386: CLARKE | S1386: HEALEY
A1387: H-FORWARDS | C1387: HILL | F1387: FRASER | I1387: BOYD | M1387: TURNER | P1387: CLEGG | S1387: McKENZIE
A1388: FORWARDS | C1388: KRUSE | F1388: SIMPSON | I1388: ROGAN | M1388: WRIGHT | P1388: FLANAGAN | S1388: SUTTON
A1389: RUCKS | C1389: JOHNSON | F1389: MURRAY | I1389: MILLER | M1389: HOWELL | P1389: GALE | S1389: HUTCHISON
A1390: RES | C1390: HEWES | I1390: McFEE | M1390: SMITH | S1390: CRANE
A1392: 3RD MATCH
A1393: S.A. | C1393: 2 | D1393: 0 | E1393: =C1393*6+D1393 -> 12 | G1393: 7 | H1393: 5 | I1393: =G1393*6+H1393 -> 47 | K1393: 9 | L1393: 5 | M1393: =K1393*6+L1393 -> 59 | O1393: 16 | P1393: 8 | Q1393: =O1393*6+P1393 -> 104
A1394: V.F.A. | C1394: 2 | D1394: 4 | E1394: =C1394*6+D1394 -> 16 | G1394: 5 | H1394: 7 | I1394: =G1394*6+H1394 -> 37 | K1394: 7 | L1394: 10 | M1394: =K1394*6+L1394 -> 52 | O1394: 7 | P1394: 11 | Q1394: =O1394*6+P1394 -> 53
A1395: BEST PLAYERS
A1396: S.A. | C1396: FITZGERALD | F1396: THOMPSON | I1396: DEANE | K1396: HANKS | N1396: WILLIAMS | Q1396: LYNCH
A1397: V.F.A. | C1397: HILL | F1397: STABB | I1397: MILLER | K1397: MCFEE | N1397: TEMME | Q1397: ROLFS
A1398: GOALKICKERS
A1399: S.A. | C1399: THOMPSON 6 | F1399: WHITTAKER 2 | I1399: DEANE 2 | K1399: WILLIAMS 2 | N1399: WALKER | P1399: DAVIES | R1399: COUELLIA | U1399: LYNCH
A1400: V.F.A. | C1400: SIMPSON 2 | F1400: McFEE 2 | I1400: HILL | K1400: MILLER | M1400: KRUSE
A1402: TEAMS
F1403: V.F.A. | P1403: S.A.
A1404: BACKS | C1404: TEMME | F1404: HENRYS | I1404: NEILSON | M1404: GRIFFIN | P1404: ABBLEY | S1404: COUELLIA
A1405: H-BACKS | C1405: G WILLIAMS | F1405: TINDAL | I1405: GILDER | M1405: ROBERTS | P1405: FITZGERALD | S1405: SASCHE
A1406: CENTRES | C1406: BOYD | F1406: STABB | I1406: SAVORY | M1406: LYNCH | P1406: HANKS | S1406: LUKE
A1407: H-FORWARDS | C1407: HEWES | F1407: FRASER | I1407: HILL | M1407: DAVIES | P1407: DEANE | S1407: GOODCHILD
A1408: FORWARDS | C1408: McFEE | F1408: SIMPSON | I1408: KRUSE | M1408: WHITAKER | P1408: THOMPSON | S1408: HALL
A1409: RUCKS | C1409: JOHNSON | F1409: DUFF | I1409: MILLER | M1409: MARRIOTT | P1409: WALKER | S1409: WILLIAMS
A1410: RES | B1410: FROM | D1410: ROLFS | F1410: McDONALD | I1410: FRANCIS | M1410: PROUD | S1410: HEAD
F1411: ROGAN
A1413: 4TH MATCH
A1414: W.A. | C1414: 3 | D1414: 3 | E1414: =C1414*6+D1414 -> 21 | G1414: 5 | H1414: 4 | I1414: =G1414*6+H1414 -> 34 | K1414: 11 | L1414: 6 | M1414: =K1414*6+L1414 -> 72 | O1414: 12 | P1414: 8 | Q1414: =O1414*6+P1414 -> 80
A1415: V.F.A. | C1415: 2 | D1415: 2 | E1415: =C1415*6+D1415 -> 14 | G1415: 3 | H1415: 7 | I1415: =G1415*6+H1415 -> 25 | K1415: 5 | L1415: 9 | M1415: =K1415*6+L1415 -> 39 | O1415: 8 | P1415: 14 | Q1415: =O1415*6+P1415 -> 62
A1416: BEST PLAYERS
A1417: W.A. | C1417: McINTOSH | F1417: MARSH | I1417: SCHOFIELD | L1417: PARENTICH | O1417: J CLARKE
A1418: V.F.A. | C1418: NEILSON | F1418: MILLER | I1418: JOHNSON | L1418: MURRAY | O1418: BOYD | R1418: McFEE
A1419: GOALKICKERS
A1420: W.A. | C1420: MARSH 3 | F1420: SHEEDY 2 | I1420: SMITH 2 | K1420: J CLARKE 2 | N1420: SPENCER | Q1420: LONDON | S1420: MUNRO
A1421: V.F.A. | C1421: MURRAY 2 | F1421: McFEE | H1421: BOYD | J1421: SIMPSON | M1421: FRANCIS | P1421: HEWES | R1421: KRUSE
A1423: TEAMS
F1424: V.F.A. | P1424: W.A.
A1425: BACKS | C1425: TEMME | F1425: ROLFS | I1425: NEILSON | M1425: PRICE | P1425: CAPORN | S1425: RAKICH
A1426: H-BACKS | C1426: GILDER | F1426: TINDAL | I1426: G WILLIAMS | M1426: HELLIER | P1426: SPARROW | S1426: SCHOFIELD
A1427: CENTRES | C1427: SAVORY | F1427: STABB | I1427: H BOYD | M1427: COLGAN | P1427: PARENTICH | S1427: HARPER
A1428: H-FORWARDS | C1428: DUFF | F1428: SIMPSON | I1428: HEWES | M1428: MARINKO | P1428: MUNRO | S1428: SHEEDY
A1429: FORWARDS | C1429: KRUSE | F1429: FRANCIS | I1429: McFEE | M1429: SMITH | P1429: J CLARKE | S1429: CARTER
A1430: RUCKS | C1430: MURRAY | F1430: JOHNSON | I1430: MILLER | M1430: McINTOSH | P1430: SPENCER | S1430: MARSH
A1431: RES | C1431: McDONALD | I1431: ROGAN | M1431: McNAMARA | S1431: LONDON