A1: Victorian Football Association
A2: Season 1955
A3: © Copyright Wal Williams | F3: First created: 2 November 2014
A4: Contact: joywalwi at gmail dot com | F4: Last updated: 27 January 2018 | W4: VFA Results and tables - Link to the main index page
A5: You are free to copy this document in whole or part provided that proper acknowledgement is given to the author. All rights reserved.
A7: YEAR 1955
A8: ROUND 1 | E8: 16TH APRIL | J8: WEATHER | O8: FINE & SUNNY | S8: PLAYED AT
D9: 1ST QTR | H9: 2ND QTR | L9: 3RD QTR | P9: FINAL | S9: PRESTON
A10: PRESTON | C10: 2 | D10: 4 | E10: =C10*6+D10 -> 16 | G10: 7 | H10: 9 | I10: =G10*6+H10 -> 51 | K10: 11 | L10: 12 | M10: =K10*6+L10 -> 78 | O10: 13 | P10: 19 | Q10: =O10*6+P10 -> 97 | S10: UMPIRE | X10: LADDER | AB10: ROUND | AD10: 1
A11: SANDRINGHAM | C11: 3 | D11: 4 | E11: =C11*6+D11 -> 22 | G11: 5 | H11: 8 | I11: =G11*6+H11 -> 38 | K11: 5 | L11: 13 | M11: =K11*6+L11 -> 43 | O11: 9 | P11: 17 | Q11: =O11*6+P11 -> 71 | S11: GAMBLE
A12: BEST PLAYERS | W12: TEAM | X12: W | Y12: L | Z12: D | AA12: FOR | AB12: AGST | AC12: % | AD12: PTS
A13: PRESTON | C13: CROCKER | F13: FOLEY | I13: F CHARD | L13: SWEET | N13: McBEAN | Q13: HENRYS
A14: SANDRINGHAM | C14: DAVIDSON | F14: GELAVIS | I14: MORONEY | L14: HARPER | N14: RANSOM | Q14: KRAUSE | W14: PORT MELBOURNE | X14: 1 | Y14: 0 | Z14: 0 | AA14: 113 | AB14: 66 | AC14: 171.21212121212122 | AD14: 4
A15: GOALKICKERS | W15: WILLIAMSTOWN | X15: 1 | Y15: 0 | Z15: 0 | AA15: 120 | AB15: 77 | AC15: 155.84415584415584 | AD15: 4
A16: PRESTON | C16: F CHARD 5 | F16: OSBORNE 3 | I16: McBEAN 2 | L16: FOLEY 2 | O16: LALOR | W16: PRESTON | X16: 1 | Y16: 0 | Z16: 0 | AA16: 97 | AB16: 71 | AC16: 136.61971830985917 | AD16: 4
A17: SANDRINGHAM | C17: HARPER 3 | F17: GELAVIS 3 | I17: DAVIDSON 2 | L17: McMAHON | W17: OAKLEIGH | X17: 1 | Y17: 0 | Z17: 0 | AA17: 92 | AB17: 70 | AC17: 131.42857142857142 | AD17: 4
A19: PORT MELBOURNE | C19: 3 | D19: 3 | E19: =C19*6+D19 -> 21 | G19: 6 | H19: 7 | I19: =G19*6+H19 -> 43 | K19: 9 | L19: 7 | M19: =K19*6+L19 -> 61 | O19: 17 | P19: 11 | Q19: =O19*6+P19 -> 113 | S19: PORT MELBOURNE | W19: MOORABBIN | X19: 1 | Y19: 0 | Z19: 0 | AA19: 67 | AB19: 52 | AC19: 128.84615384615384 | AD19: 4
A20: BOX HILL | C20: 4 | D20: 3 | E20: =C20*6+D20 -> 27 | G20: 6 | H20: 5 | I20: =G20*6+H20 -> 41 | K20: 8 | L20: 11 | M20: =K20*6+L20 -> 59 | O20: 9 | P20: 12 | Q20: =O20*6+P20 -> 66 | S20: ROBINSON | W20: PRAHRAN | X20: 1 | Y20: 0 | Z20: 0 | AA20: 104 | AB20: 97 | AC20: 107.21649484536083 | AD20: 4
A21: BEST PLAYERS | W21: BRIGHTON | X21: 1 | Y21: 0 | Z21: 0 | AA21: 66 | AB21: 64 | AC21: 103.125 | AD21: 4
A22: PORT MELBOURNE | C22: STOREY | E22: JOHNSON | H22: WALSH | K22: ROSEWARNE | N22: BONNETT | Q22: MILLER | W22: NORTHCOTE | X22: 0 | Y22: 1 | Z22: 0 | AA22: 64 | AB22: 66 | AC22: 96.969696969696969 | AD22: 0
A23: BOX HILL | C23: WEBB | E23: HOUGHTON | H23: WRIGHT | K23: McMAHON | N23: KRONK | Q23: LOVE | W23: CAMBERWELL | X23: 0 | Y23: 1 | Z23: 0 | AA23: 97 | AB23: 104 | AC23: 93.269230769230774 | AD23: 0
A24: GOALKICKERS | W24: COBURG | X24: 0 | Y24: 1 | Z24: 0 | AA24: 52 | AB24: 67 | AC24: 77.611940298507463 | AD24: 0
A25: PORT MELBOURNE | C25: BONNETT 6 | F25: WALSH 4 | I25: OLDFIELD 2 | L25: SUMMERS 2 | O25: JOHNSON | Q25: DUNBAR | S25: MILLER | W25: BRUNSWICK | X25: 0 | Y25: 1 | Z25: 0 | AA25: 70 | AB25: 92 | AC25: 76.086956521739125 | AD25: 0
A26: BOX HILL | C26: WEBB 4 | F26: ABBOTT | H26: HOUGHTON | J26: GREEN | L26: COGHLAN | N26: BROWN | W26: SANDRINGHAM | X26: 0 | Y26: 1 | Z26: 0 | AA26: 71 | AB26: 97 | AC26: 73.19587628865979 | AD26: 0
W27: YARRAVILLE | X27: 0 | Y27: 1 | Z27: 0 | AA27: 77 | AB27: 120 | AC27: 64.166666666666671 | AD27: 0
A28: PRAHRAN | C28: 2 | D28: 3 | E28: =C28*6+D28 -> 15 | G28: 6 | H28: 5 | I28: =G28*6+H28 -> 41 | K28: 13 | L28: 6 | M28: =K28*6+L28 -> 84 | O28: 16 | P28: 8 | Q28: =O28*6+P28 -> 104 | S28: CAMBERWELL | W28: BOX HILL | X28: 0 | Y28: 1 | Z28: 0 | AA28: 66 | AB28: 113 | AC28: 58.407079646017699 | AD28: 0
A29: CAMBERWELL | C29: 1 | D29: 2 | E29: =C29*6+D29 -> 8 | G29: 3 | H29: 5 | I29: =G29*6+H29 -> 23 | K29: 6 | L29: 5 | M29: =K29*6+L29 -> 41 | O29: 14 | P29: 13 | Q29: =O29*6+P29 -> 97 | S29: CARLTON
A30: BEST PLAYERS
A31: PRAHRAN | C31: HARVEY | E31: KINNABURGH | H31: H BOYD | K31: R WILSON | N31: SHILLABEER | Q31: JONES
A32: CAMBERWELL | C32: HAYES | E32: McFEE | H32: ALLSOP | K32: DUGDALE | N32: YOUNG | Q32: TEMPANY
A33: GOALKICKERS
A34: PRAHRAN | C34: KINNABURGH 6 | F34: HARVEY 3 | I34: R WILSON 3 | L34: ELLIOTT 3 | O34: MORROW
A35: CAMBERWELL | C35: HEDLEY 6 | F35: ALLSOP 4 | I35: DUGDALE 4
A37: WILLIAMSTOWN | C37: 5 | D37: 6 | E37: =C37*6+D37 -> 36 | G37: 8 | H37: 14 | I37: =G37*6+H37 -> 62 | K37: 11 | L37: 15 | M37: =K37*6+L37 -> 81 | O37: 17 | P37: 18 | Q37: =O37*6+P37 -> 120 | S37: YARRAVILLE
A38: YARRAVILLE | C38: 2 | D38: 3 | E38: =C38*6+D38 -> 15 | G38: 6 | H38: 5 | I38: =G38*6+H38 -> 41 | K38: 9 | L38: 7 | M38: =K38*6+L38 -> 61 | O38: 11 | P38: 11 | Q38: =O38*6+P38 -> 77 | S38: ROACH
A39: BEST PLAYERS
A40: WILLIAMSTOWN | C40: LINTON | E40: TAAFE | H40: CALLAHAN | K40: CURRAN | N40: SIMS | Q40: WOOKEY
A41: YARRAVILLE | C41: TAYLOR | E41: HART | H41: J ROHLEDER | K41: MARCHESI | N41: MASON | Q41: SMALLWOOD
A42: GOALKICKERS
A43: WILLIAMSTOWN | C43: LINTON 7 | F43: ANDERSON 3 | I43: FISHER | K43: SIMS | M43: CALLAHAN | O43: SMITH | Q43: KENT | R43: McPHERSON | V43: EVANS
A44: YARRAVILLE | C44: MASON 3 | F44: HART 2 | H44: WILD 2 | J44: MARCHESI | M44: DRIVER | O44: WILLIAMS | Q44: SMALLWOOD
A46: BRIGHTON | C46: 5 | D46: 4 | E46: =C46*6+D46 -> 34 | G46: 6 | H46: 6 | I46: =G46*6+H46 -> 42 | K46: 8 | L46: 11 | M46: =K46*6+L46 -> 59 | O46: 9 | P46: 12 | Q46: =O46*6+P46 -> 66 | S46: ELSTERNWICK PARK
A47: NORTHCOTE | C47: 2 | D47: 2 | E47: =C47*6+D47 -> 14 | G47: 5 | H47: 4 | I47: =G47*6+H47 -> 34 | K47: 5 | L47: 5 | M47: =K47*6+L47 -> 35 | O47: 9 | P47: 10 | Q47: =O47*6+P47 -> 64 | S47: BREWER
A48: BEST PLAYERS
A49: BRIGHTON | C49: FREEMAN | F49: O'MEARA | I49: TURNER | L49: ALEXANDER | O49: POUND | Q49: BLENKINSOP
A50: NORTHCOTE | C50: ALDRIDGE | F50: REID | I50: GIBBS | L50: WALKER | O50: PAYNTER | Q50: WRIGHT
A51: GOALKICKERS
A52: BRIGHTON | C52: GRIENKE 2 | F52: POUND 2 | I52: W COOPER 2 | L52: STEVENS 2 | O52: KNIGHT
A53: NORTHCOTE | C53: FRANCIS 3 | F53: GIBBS 2 | I53: WRIGHT 2 | L53: REID | N53: TULL
A55: OAKLEIGH | C55: 3 | D55: 5 | E55: =C55*6+D55 -> 23 | G55: 6 | H55: 9 | I55: =G55*6+H55 -> 45 | K55: 8 | L55: 10 | M55: =K55*6+L55 -> 58 | O55: 13 | P55: 14 | Q55: =O55*6+P55 -> 92 | S55: BRUNSWICK
A56: BRUNSWICK | C56: 2 | D56: 0 | E56: =C56*6+D56 -> 12 | G56: 6 | H56: 4 | I56: =G56*6+H56 -> 40 | K56: 7 | L56: 10 | M56: =K56*6+L56 -> 52 | O56: 10 | P56: 10 | Q56: =O56*6+P56 -> 70 | S56: MALLETT
A57: BEST PLAYERS
A58: OAKLEIGH | C58: HOWELL | F58: G WALSH | I58: ANDERSON | L58: TEMME | N58: HILL | Q58: BURTON
A59: BRUNSWICK | C59: WEIR | F59: PHIPPS | I59: NEILSON | L59: YEA | N59: SEYMOUR | Q59: MULLENGER
A60: GOALKICKERS
A61: OAKLEIGH | C61: HOWELL 4 | F61: G WALSH 4 | I61: ANDERSON 3 | L61: HILL | N61: SAID
A62: BRUNSWICK | C62: LOVETT 3 | F62: SIMPSON 2 | I62: WEIR | J62: SEYMOUR | M62: PHIPPS | O62: HAYES | Q62: DAVIES
A64: MOORABBIN | C64: 0 | D64: 4 | E64: =C64*6+D64 -> 4 | G64: 1 | H64: 7 | I64: =G64*6+H64 -> 13 | K64: 5 | L64: 13 | M64: =K64*6+L64 -> 43 | O64: 8 | P64: 19 | Q64: =O64*6+P64 -> 67 | S64: MOORABBIN
A65: COBURG | C65: 2 | D65: 2 | E65: =C65*6+D65 -> 14 | G65: 2 | H65: 6 | I65: =G65*6+H65 -> 18 | K65: 5 | L65: 7 | M65: =K65*6+L65 -> 37 | O65: 7 | P65: 10 | Q65: =O65*6+P65 -> 52 | S65: IRVING
A66: BEST PLAYERS
A67: MOORABBIN | C67: GREEN | F67: STANLEY | I67: DYNON | L67: CLOVER | O67: TREZISE | R67: OSTLE
A68: COBURG | C68: MAHONEY | F68: CONDON | I68: FEWKES | L68: McTAGGART | O68: STARBUCK | R68: SANDLANT
A69: GOALKICKERS
A70: MOORABBIN | C70: DALY 5 | F70: ARNFIELD 2 | I70: BARNES
A71: COBURG | C71: JONES 4 | F71: ROGAN | I71: McMAHON | L71: CANNAN
A73: ROUND 2 | E73: 23RD APRIL | J73: WEATHER | O73: NORTH WEST WIND | S73: PLAYED AT
D74: 1ST QTR | H74: 2ND QTR | L74: 3RD QTR | P74: FINAL | S74: WILLIAMSTOWN
A75: PRESTON | C75: 3 | D75: 1 | E75: =C75*6+D75 -> 19 | G75: 3 | H75: 5 | I75: =G75*6+H75 -> 23 | K75: 6 | L75: 7 | M75: =K75*6+L75 -> 43 | O75: 12 | P75: 10 | Q75: =O75*6+P75 -> 82 | S75: UMPIRE | X75: LADDER | AB75: ROUND | AD75: 2
A76: WILLIAMSTOWN | C76: 2 | D76: 2 | E76: =C76*6+D76 -> 14 | G76: 4 | H76: 12 | I76: =G76*6+H76 -> 36 | K76: 5 | L76: 16 | M76: =K76*6+L76 -> 46 | O76: 9 | P76: 20 | Q76: =O76*6+P76 -> 74 | S76: IRVING
A77: BEST PLAYERS | W77: TEAM | X77: W | Y77: L | Z77: D | AA77: FOR | AB77: AGST | AC77: % | AD77: PTS
A78: PRESTON | C78: WALKER | F78: BRADFORD | I78: JONES | K78: CROCKER | N78: F CHARD | Q78: LALOR
A79: WILLIAMSTOWN | C79: H SIMPSON | F79: SMITH | I79: TAAFE | K79: LINTON | N79: CURRAN | Q79: WHITTAKER | W79: MOORABBIN | X79: 2 | Y79: 0 | Z79: 0 | AA79: 213 | AB79: 129 | AC79: 165.11627906976744 | AD79: 8
A80: GOALKICKERS | W80: PORT MELBOURNE | X80: 2 | Y80: 0 | Z80: 0 | AA80: 242 | AB80: 151 | AC80: 160.26490066225165 | AD80: 8
A81: PRESTON | C81: F CHARD 4 | F81: BRADFORD 3 | I81: LALOR 2 | K81: McBEAN | M81: FOLEY | O81: WATT | W81: PRAHRAN | X81: 2 | Y81: 0 | Z81: 0 | AA81: 205 | AB81: 148 | AC81: 138.51351351351352 | AD81: 8
A82: WILLIAMSTOWN | C82: LINTON 4 | F82: SIMS 2 | I82: FISHER | K82: SMITH | M82: ANDERSON | W82: PRESTON | X82: 2 | Y82: 0 | Z82: 0 | AA82: 179 | AB82: 145 | AC82: 123.44827586206897 | AD82: 8
A84: PRAHRAN | C84: 4 | D84: 2 | E84: =C84*6+D84 -> 26 | G84: 9 | H84: 11 | I84: =G84*6+H84 -> 65 | K84: 10 | L84: 13 | M84: =K84*6+L84 -> 73 | O84: 14 | P84: 17 | Q84: =O84*6+P84 -> 101 | S84: TOORAK PARK | W84: WILLIAMSTOWN | X84: 1 | Y84: 1 | Z84: 0 | AA84: 194 | AB84: 159 | AC84: 122.0125786163522 | AD84: 4
A85: BRIGHTON | C85: 0 | D85: 5 | E85: =C85*6+D85 -> 5 | G85: 0 | H85: 5 | I85: =G85*6+H85 -> 5 | K85: 3 | L85: 9 | M85: =K85*6+L85 -> 27 | O85: 7 | P85: 9 | Q85: =O85*6+P85 -> 51 | S85: ROBINSON | W85: OAKLEIGH | X85: 1 | Y85: 1 | Z85: 0 | AA85: 166 | AB85: 155 | AC85: 107.09677419354838 | AD85: 4
A86: BEST PLAYERS | W86: NORTHCOTE | X86: 1 | Y86: 1 | Z86: 0 | AA86: 150 | AB86: 146 | AC86: 102.73972602739725 | AD86: 4
A87: PRAHRAN | C87: SHILLABEER | F87: HARVEY | I87: WILSON | L87: SHARP | N87: H BOYD | Q87: MORROW | W87: CAMBERWELL | X87: 1 | Y87: 1 | Z87: 0 | AA87: 182 | AB87: 178 | AC87: 102.24719101123596 | AD87: 4
A88: BRIGHTON | C88: ALEXANDER | F88: BLACKMORE | I88: BOWLES | L88: O'MEARA | N88: JOSTLEAR | Q88: POUND | W88: BRUNSWICK | X88: 1 | Y88: 1 | Z88: 0 | AA88: 156 | AB88: 174 | AC88: 89.65517241379311 | AD88: 4
A89: GOALKICKERS | W89: BRIGHTON | X89: 1 | Y89: 1 | Z89: 0 | AA89: 117 | AB89: 165 | AC89: 70.909090909090907 | AD89: 4
A90: PRAHRAN | C90: BURNS 3 | E90: SHARP 3 | G90: WILSON 2 | I90: HARVEY 2 | K90: KINNABURGH 2 | N90: MORROW | Q90: ELLIOTT | W90: COBURG | X90: 0 | Y90: 2 | Z90: 0 | AA90: 134 | AB90: 153 | AC90: 87.58169934640523 | AD90: 0
A91: BRIGHTON | C91: POUND 2 | F91: TURNER 2 | I91: O'MEARA | K91: GRIENKE | M91: HICKMAN | W91: YARRAVILLE | X91: 0 | Y91: 2 | Z91: 0 | AA91: 157 | AB91: 206 | AC91: 76.213592233009706 | AD91: 0
W92: SANDRINGHAM | X92: 0 | Y92: 2 | Z92: 0 | AA92: 156 | AB92: 226 | AC92: 69.026548672566378 | AD92: 0
A93: CAMBERWELL | C93: 2 | D93: 1 | E93: =C93*6+D93 -> 13 | G93: 6 | H93: 2 | I93: =G93*6+H93 -> 38 | K93: 9 | L93: 4 | M93: =K93*6+L93 -> 58 | O93: 13 | P93: 7 | Q93: =O93*6+P93 -> 85 | S93: OAKLEIGH | W93: BOX HILL | X93: 0 | Y93: 2 | Z93: 0 | AA93: 143 | AB93: 259 | AC93: 55.212355212355213 | AD93: 0
A94: OAKLEIGH | C94: 2 | D94: 4 | E94: =C94*6+D94 -> 16 | G94: 6 | H94: 7 | I94: =G94*6+H94 -> 43 | K94: 8 | L94: 12 | M94: =K94*6+L94 -> 60 | O94: 10 | P94: 14 | Q94: =O94*6+P94 -> 74 | S94: E BREWER
A95: BEST PLAYERS
A96: CAMBERWELL | C96: HOLYOAK | F96: HEDLEY | I96: MASON | L96: McFEE | N96: McKAIGE | Q96: DEAGAN
A97: OAKLEIGH | C97: TEMME | F97: GUY | I97: WILLIAMS | L97: HILL | N97: LAMBERT | Q97: HOWELL
A98: GOALKICKERS
A99: CAMBERWELL | C99: HOLYOAK 5 | F99: HAYES | H99: MILNE | J99: KIRBY | L99: McFEE | N99: HEDLEY | P99: McGUINNESS | S99: TEMPANY | V99: ALLSOP
A100: OAKLEIGH | C100: SAID 3 | F100: HOWELL 3 | I100: GUY 2 | K100: COLLINS | M100: LANE
A102: BRUNSWICK | C102: 4 | D102: 2 | E102: =C102*6+D102 -> 26 | G102: 6 | H102: 3 | I102: =G102*6+H102 -> 39 | K102: 9 | L102: 8 | M102: =K102*6+L102 -> 62 | O102: 12 | P102: 14 | Q102: =O102*6+P102 -> 86 | S102: COBURG
A103: COBURG | C103: 1 | D103: 2 | E103: =C103*6+D103 -> 8 | G103: 5 | H103: 6 | I103: =G103*6+H103 -> 36 | K103: 8 | L103: 8 | M103: =K103*6+L103 -> 56 | O103: 12 | P103: 10 | Q103: =O103*6+P103 -> 82 | S103: CARLTON
A104: BEST PLAYERS
A105: BRUNSWICK | C105: LOVETT | F105: JAMES | I105: MAY | K105: WEIR | N105: SEYMOUR | Q105: HAYES
A106: COBURG | C106: GILL | F106: CONDON | I106: WALKER | K106: McTAGGART | N106: H WILKINSON | Q106: HEWES
A107: GOALKICKERS
A108: BRUNSWICK | C108: JAMES 5 | F108: HAYES 2 | I108: LEYDEN | K108: WEIR | M108: WALL | O108: MULLENGER | R108: SEYMOUR
A109: COBURG | C109: JONES 4 | F109: HEWES 2 | I109: H WILKINSON 2 | M109: SPARKS | O109: CANNAN | Q109: McMAHON | T109: ROGAN
A111: NORTHCOTE | C111: 3 | D111: 0 | E111: =C111*6+D111 -> 18 | G111: 8 | H111: 6 | I111: =G111*6+H111 -> 54 | K111: 8 | L111: 10 | M111: =K111*6+L111 -> 58 | O111: 12 | P111: 14 | Q111: =O111*6+P111 -> 86 | S111: NORTHCOTE
A112: YARRAVILLE | C112: 2 | D112: 3 | E112: =C112*6+D112 -> 15 | G112: 3 | H112: 6 | I112: =G112*6+H112 -> 24 | K112: 8 | L112: 6 | M112: =K112*6+L112 -> 54 | O112: 11 | P112: 14 | Q112: =O112*6+P112 -> 80 | S112: GAMBLE
A113: BEST PLAYERS
A114: NORTHCOTE | C114: GIBBS | E114: WOOLNOUGH | H114: WRIGHT | K114: POWELL | N114: ALDRIDGE | Q114: COLLINS
A115: YARRAVILLE | C115: MASON | E115: SMALLWOOD | H115: VANDERFEEN | K115: SMITH | N115: N ROHLEDER | Q115: PAYNE
A116: GOALKICKERS
A117: NORTHCOTE | C117: FRANCIS 4 | F117: CRAWLEY 2 | I117: JOHNSON 2 | L117: COLLINS 2 | O117: POWELL | Q117: GIBBS
A118: YARRAVILLE | C118: HUGHES 3 | F118: J ROHLEDER | I118: SMITH | K118: MASON | M118: DRIVER | O118: MARCHESI | Q118: WALLIS | S118: SMALLWOOD | W118: BEECH
A120: MOORABBIN | C120: 3 | D120: 5 | E120: =C120*6+D120 -> 23 | G120: 8 | H120: 9 | I120: =G120*6+H120 -> 57 | K120: 14 | L120: 15 | M120: =K120*6+L120 -> 99 | O120: 21 | P120: 20 | Q120: =O120*6+P120 -> 146 | S120: B.H
A121: BOX HILL | C121: 4 | D121: 3 | E121: =C121*6+D121 -> 27 | G121: 6 | H121: 7 | I121: =G121*6+H121 -> 43 | K121: 7 | L121: 10 | M121: =K121*6+L121 -> 52 | O121: 11 | P121: 11 | Q121: =O121*6+P121 -> 77 | S121: MALLETT
A122: BEST PLAYERS
A123: MOORABBIN | C123: DYNON | F123: GILDER | I123: MORONEY | L123: RENWICK | N123: SCHOFIELD | Q123: ARNFIELD
A124: BOX HILL | C124: WRIGHT | F124: JOHNSON | I124: WEBB | L124: GREEN | N124: KRONK | Q124: LOVE
A125: GOALKICKERS
A126: MOORABBIN | C126: SCHOFIELD 8 | F126: MORONEY 3 | I126: RENWICK 3 | L126: CLOVER 2 | N126: McGAW 2 | Q126: DALY 2 | S126: DYNON
A127: BOX HILL | C127: JOHNSON 4 | F127: GREEN 3 | I127: DUNN 2 | L127: KRONK | N127: LONSDALE
A129: PORT MELBOURNE | C129: 4 | D129: 1 | E129: =C129*6+D129 -> 25 | G129: 7 | H129: 4 | I129: =G129*6+H129 -> 46 | K129: 16 | L129: 10 | M129: =K129*6+L129 -> 106 | O129: 19 | P129: 15 | Q129: =O129*6+P129 -> 129 | S129: BEACH ROAD
A130: SANDRINGHAM | C130: 4 | D130: 6 | E130: =C130*6+D130 -> 30 | G130: 7 | H130: 8 | I130: =G130*6+H130 -> 50 | K130: 10 | L130: 12 | M130: =K130*6+L130 -> 72 | O130: 11 | P130: 19 | Q130: =O130*6+P130 -> 85 | S130: ROACH
A131: BEST PLAYERS
A132: PORT MELBOURNE | C132: LAFFEY | F132: STOREY | I132: WILSON | L132: SHANNON | O132: JOHNSON | R132: WALSH
A133: SANDRINGHAM | C133: DAVIDSON | F133: CONNINGSBY | I133: CROFT | L133: HARPER | O133: FLETCHER | R133: RANSOM
A134: GOALKICKERS
A135: PORT MELBOURNE | C135: BONNETT 6 | F135: ROSEWARNE 4 | I135: WALSH 3 | K135: McDONALD 2 | N135: SUMMERS 2 | Q135: DUNBAR | S135: SHANNON
A136: SANDRINGHAM | C136: DAVIDSON 6 | F136: HARPER 5
A138: ROUND 3 | E138: 30TH APRIL | J138: WEATHER | O138: FOGGY DULL | S138: PLAYED AT
D139: 1ST QTR | H139: 2ND QTR | L139: 3RD QTR | P139: FINAL | S139: PORT MELBOURNE
A140: PORT MELBOURNE | C140: 6 | D140: 2 | E140: =C140*6+D140 -> 38 | G140: 12 | H140: 7 | I140: =G140*6+H140 -> 79 | K140: 14 | L140: 13 | M140: =K140*6+L140 -> 97 | O140: 15 | P140: 17 | Q140: =O140*6+P140 -> 107 | S140: UMPIRE | X140: LADDER | AB140: ROUND | AD140: 3
A141: PRESTON | C141: 4 | D141: 4 | E141: =C141*6+D141 -> 28 | G141: 7 | H141: 12 | I141: =G141*6+H141 -> 54 | K141: 9 | L141: 13 | M141: =K141*6+L141 -> 67 | O141: 13 | P141: 19 | Q141: =O141*6+P141 -> 97 | S141: MALLETT
A142: BEST PLAYERS | W142: TEAM | X142: W | Y142: L | Z142: D | AA142: FOR | AB142: AGST | AC142: % | AD142: PTS
A143: PORT MELBOURNE | C143: JOHNSON | F143: METHERALL | I143: WALSH | L143: WILSON | O143: BONNETT | Q143: SHANNON
A144: PRESTON | C144: FOLEY | F144: BRADFORD | I144: K CHARD | L144: McLACHLAN | O144: LALOR | Q144: McBEAN | W144: MOORABBIN | X144: 3 | Y144: 0 | Z144: 0 | AA144: 327 | AB144: 195 | AC144: 167.69230769230768 | AD144: 12
A145: GOALKICKERS | W145: PORT MELBOURNE | X145: 3 | Y145: 0 | Z145: 0 | AA145: 349 | AB145: 248 | AC145: 140.7258064516129 | AD145: 12
A146: PORT MELBOURNE | C146: BONNETT 4 | F146: McDONALD 3 | I146: WALSH 3 | K146: ROSEWARNE 2 | N146: OLDFIELD | P146: SHANNON | R146: BAILLIE | W146: PRAHRAN | X146: 3 | Y146: 0 | Z146: 0 | AA146: 332 | AB146: 244 | AC146: 136.0655737704918 | AD146: 12
A147: PRESTON | C147: BRADFORD 4 | F147: LALOR 2 | I147: F CHARD 2 | L147: BENNETT 2 | N147: McBEAN | P147: FOLEY | R147: WATT | W147: OAKLEIGH | X147: 2 | Y147: 1 | Z147: 0 | AA147: 280 | AB147: 204 | AC147: 137.25490196078431 | AD147: 8
A149: WILLIAMSTOWN | C149: 4 | D149: 1 | E149: =C149*6+D149 -> 25 | G149: 7 | H149: 6 | I149: =G149*6+H149 -> 48 | K149: 11 | L149: 13 | M149: =K149*6+L149 -> 79 | O149: 14 | P149: 18 | Q149: =O149*6+P149 -> 102 | S149: NORTHCOTE | W149: WILLIAMSTOWN | X149: 2 | Y149: 1 | Z149: 0 | AA149: 296 | AB149: 229 | AC149: 129.25764192139738 | AD149: 8
A150: NORTHCOTE | C150: 5 | D150: 5 | E150: =C150*6+D150 -> 35 | G150: 9 | H150: 6 | I150: =G150*6+H150 -> 60 | K150: 9 | L150: 6 | M150: =K150*6+L150 -> 60 | O150: 10 | P150: 10 | Q150: =O150*6+P150 -> 70 | S150: SMYTH | W150: PRESTON | X150: 2 | Y150: 1 | Z150: 0 | AA150: 276 | AB150: 252 | AC150: 109.52380952380952 | AD150: 8
A151: BEST PLAYERS | W151: BRUNSWICK | X151: 2 | Y151: 1 | Z151: 0 | AA151: 269 | AB151: 250 | AC151: 107.6 | AD151: 8
A152: WILLIAMSTOWN | C152: SIMPSON | F152: MARTIN | I152: TAAFE | L152: SMITH | N152: LINTON | Q152: ANDERSON | W152: COBURG | X152: 1 | Y152: 2 | Z152: 0 | AA152: 275 | AB152: 219 | AC152: 125.57077625570776 | AD152: 4
A153: NORTHCOTE | C153: FRANCIS | F153: PURDON | I153: GIBBS | L153: POWELL | N153: STANLEY | Q153: STABB | W153: NORTHCOTE | X153: 1 | Y153: 2 | Z153: 0 | AA153: 220 | AB153: 248 | AC153: 88.709677419354833 | AD153: 4
A154: GOALKICKERS | W154: CAMBERWELL | X154: 1 | Y154: 2 | Z154: 0 | AA154: 248 | AB154: 319 | AC154: 77.742946708463947 | AD154: 4
A155: WILLIAMSTOWN | C155: ANDERSON 5 | F155: SIMPSON 4 | I155: LINTON 2 | K155: MARTIN | M155: SMITH | O155: GEAR | W155: BRIGHTON | X155: 1 | Y155: 2 | Z155: 0 | AA155: 166 | AB155: 279 | AC155: 59.498207885304659 | AD155: 4
A156: NORTHCOTE | C156: FRANCIS 5 | F156: PURDON 2 | I156: WRIGHT | K156: COLLINS | M156: STABB | W156: YARRAVILLE | X156: 0 | Y156: 3 | Z156: 0 | AA156: 253 | AB156: 333 | AC156: 75.97597597597597 | AD156: 0
W157: SANDRINGHAM | X157: 0 | Y157: 3 | Z157: 0 | AA157: 222 | AB157: 340 | AC157: 65.294117647058826 | AD157: 0
A158: OAKLEIGH | C158: 1 | D158: 3 | E158: =C158*6+D158 -> 9 | G158: 8 | H158: 5 | I158: =G158*6+H158 -> 53 | K158: 12 | L158: 10 | M158: =K158*6+L158 -> 82 | O158: 16 | P158: 18 | Q158: =O158*6+P158 -> 114 | S158: ELSTERNWICK PARK | W158: BOX HILL | X158: 0 | Y158: 3 | Z158: 0 | AA158: 219 | AB158: 372 | AC158: 58.87096774193548 | AD158: 0
A159: BRIGHTON | C159: 1 | D159: 3 | E159: =C159*6+D159 -> 9 | G159: 3 | H159: 6 | I159: =G159*6+H159 -> 24 | K159: 6 | L159: 8 | M159: =K159*6+L159 -> 44 | O159: 6 | P159: 13 | Q159: =O159*6+P159 -> 49 | S159: ROACH
A160: BEST PLAYERS
A161: OAKLEIGH | C161: HOWELL | F161: TEMME | I161: COLLINS | L161: LONIE | O161: HILL | Q161: GUY
A162: BRIGHTON | C162: ALEXANDER | F162: FREEMAN | I162: WAIN | L162: STEVENS | O162: GRIENKE | Q162: KNIGHT
A163: GOALKICKERS
A164: OAKLEIGH | C164: HOWELL 8 | F164: LONIE 3 | H164: SHAW 2 | J164: COLLINS | L164: SCOTT | N164: ANDERSON
A165: BRIGHTON | C165: GRIENKE 4 | F165: WAIN 2
A167: COBURG | C167: 8 | D167: 4 | E167: =C167*6+D167 -> 52 | G167: 13 | H167: 10 | I167: =G167*6+H167 -> 88 | K167: 17 | L167: 13 | M167: =K167*6+L167 -> 115 | O167: 20 | P167: 21 | Q167: =O167*6+P167 -> 141 | S167: CAMBERWELL
A168: CAMBERWELL | C168: 1 | D168: 4 | E168: =C168*6+D168 -> 10 | G168: 4 | H168: 6 | I168: =G168*6+H168 -> 30 | K168: 7 | L168: 9 | M168: =K168*6+L168 -> 51 | O168: 9 | P168: 12 | Q168: =O168*6+P168 -> 66 | S168: GAMBLE
A169: BEST PLAYERS
A170: COBURG | C170: HEWES | F170: STARBUCK | I170: GILL | L170: HORSKINS | O170: ROGAN | R170: SHORT
A171: CAMBERWELL | C171: MASON | F171: WEST | I171: TEMPANY | L171: ALLSOP | O171: McGUINNES | R171: HEDLEY
A172: GOALKICKERS
A173: COBURG | C173: HEWES 9 | F173: ROGAN 3 | I173: HORSKINS 3 | L173: J BRENNAN 2 | O173: MAHONEY | Q173: SHORT | S173: STARBUCK
A174: CAMBERWELL | C174: McGUINNESS 3 | F174: HOLYOAK 2 | I174: HEIL | K174: McFEE | M174: TEMPANY | O174: COOKE
A176: BRUNSWICK | C176: 2 | D176: 3 | E176: =C176*6+D176 -> 15 | G176: 6 | H176: 9 | I176: =G176*6+H176 -> 45 | K176: 13 | L176: 14 | M176: =K176*6+L176 -> 92 | O176: 16 | P176: 17 | Q176: =O176*6+P176 -> 113 | S176: BRUNSWICK
A177: BOX HILL | C177: 1 | D177: 2 | E177: =C177*6+D177 -> 8 | G177: 5 | H177: 4 | I177: =G177*6+H177 -> 34 | K177: 9 | L177: 8 | M177: =K177*6+L177 -> 62 | O177: 11 | P177: 10 | Q177: =O177*6+P177 -> 76 | S177: IRVING
A178: BEST PLAYERS
A179: BRUNSWICK | C179: McFARLANE | F179: SEYMOUR | I179: WEIR | K179: MULLENGER | N179: JAMES | Q179: EDWARDS
A180: BOX HILL | C180: HOUGHTON | F180: CALDWELL | I180: IRVINE | K180: KRONK | N180: STREET | Q180: DUNN
A181: GOALKICKERS
A182: BRUNSWICK | C182: JAMES 5 | E182: HAYES 4 | G182: CLUES 2 | I182: WEIR 2 | K182: SEYMOUR | M182: MULLENGER | P182: LOVETT
A183: BOX HILL | C183: DUNN 3 | E183: WEBB 3 | G183: BROWN 2 | I183: GREEN | K183: JOHNSON | M183: WITHERDEN
A185: PRAHRAN | C185: 2 | D185: 5 | E185: =C185*6+D185 -> 17 | G185: 8 | H185: 10 | I185: =G185*6+H185 -> 58 | K185: 12 | L185: 16 | M185: =K185*6+L185 -> 88 | O185: 18 | P185: 19 | Q185: =O185*6+P185 -> 127 | S185: YARRAVILLE
A186: YARRAVILLE | C186: 2 | D186: 6 | E186: =C186*6+D186 -> 18 | G186: 6 | H186: 7 | I186: =G186*6+H186 -> 43 | K186: 10 | L186: 8 | M186: =K186*6+L186 -> 68 | O186: 14 | P186: 12 | Q186: =O186*6+P186 -> 96 | S186: BREWER
A187: BEST PLAYERS
A188: PRAHRAN | C188: HARVEY | E188: WILSON | H188: HOLLOW | K188: KINNABURGH | N188: CLEAR | Q188: SHARP
A189: YARRAVILLE | C189: WILD | E189: HEMPEL | H189: MARCHESI | K189: N ROHLEDER | N189: SMALLWOOD | Q189: S JONES
A190: GOALKICKERS
A191: PRAHRAN | C191: KINNABURGH 11 | G191: SHARP 3 | I191: HARVEY 2 | L191: BURNS | N191: ELLIOTT
A192: YARRAVILLE | C192: SMALLWOOD 4 | G192: WILD 4 | I192: MASON 4 | L192: VANDERFEEN | O192: PEVETT
A194: MOORABBIN | C194: 2 | D194: 3 | E194: =C194*6+D194 -> 15 | G194: 6 | H194: 13 | I194: =G194*6+H194 -> 49 | K194: 12 | L194: 15 | M194: =K194*6+L194 -> 87 | O194: 15 | P194: 24 | Q194: =O194*6+P194 -> 114 | S194: MOORABBIN
A195: SANDRINGHAM | C195: 3 | D195: 3 | E195: =C195*6+D195 -> 21 | G195: 5 | H195: 4 | I195: =G195*6+H195 -> 34 | K195: 10 | L195: 6 | M195: =K195*6+L195 -> 66 | O195: 10 | P195: 6 | Q195: =O195*6+P195 -> 66 | S195: ROBINSON
A196: BEST PLAYERS
A197: MOORABBIN | C197: LAWRENCE | F197: LEHMANN | I197: SCHOFIELD | L197: RENWICK | O197: MURPHY | Q197: DYNON
A198: SANDRINGHAM | C198: DAVIDSON | F198: GELAVIS | I198: W McMAHON | L198: JOHNSON | O198: FLEMING | Q198: HARPER
A199: GOALKICKERS
A200: MOORABBIN | C200: SCHOFIELD 8 | F200: McGAW 3 | I200: RENWICK 2 | L200: MORONEY 2
A201: SANDRINGHAM | C201: HARPER 4 | F201: DAVIDSON 2 | I201: W McMAHON 2 | L201: GELAVIS 2
A203: ROUND 4 | E203: 7TH MAY | J203: WEATHER | M203: SOUTH WEST WIND FINE | S203: PLAYED AT
D204: 1ST QTR | H204: 2ND QTR | L204: 3RD QTR | P204: FINAL | S204: WILLIAMSTOWN
A205: WILLIAMSTOWN | C205: 2 | D205: 1 | E205: =C205*6+D205 -> 13 | G205: 7 | H205: 6 | I205: =G205*6+H205 -> 48 | K205: 10 | L205: 7 | M205: =K205*6+L205 -> 67 | O205: 13 | P205: 11 | Q205: =O205*6+P205 -> 89 | S205: UMPIRE | X205: LADDER | AB205: ROUND | AD205: 4
A206: PORT MELBOURNE | C206: 4 | D206: 5 | E206: =C206*6+D206 -> 29 | G206: 5 | H206: 6 | I206: =G206*6+H206 -> 36 | K206: 11 | L206: 9 | M206: =K206*6+L206 -> 75 | O206: 12 | P206: 13 | Q206: =O206*6+P206 -> 85 | S206: ROACH
A207: BEST PLAYERS | W207: TEAM | X207: W | Y207: L | Z207: D | AA207: FOR | AB207: AGST | AC207: % | AD207: PTS
A208: WILLIAMSTOWN | C208: LINTON | F208: MARTIN | I208: CALLAHAN | L208: McPHERSON | O208: GEAR | Q208: E BEITZEL
A209: PORT MELBOURNE | C209: WHARTON | F209: WILSON | I209: BRAGG | L209: SHANNON | O209: BONNETT | Q209: WALSH | W209: MOORABBIN | X209: 4 | Y209: 0 | Z209: 0 | AA209: 399 | AB209: 261 | AC209: 152.87356321839081 | AD209: 16
A210: GOALKICKERS | W210: PORT MELBOURNE | X210: 3 | Y210: 1 | Z210: 0 | AA210: 434 | AB210: 337 | AC210: 128.7833827893175 | AD210: 12
A211: WILLIAMSTOWN | C211: McPHERSON 3 | F211: LINTON 3 | I211: ANDERSON 2 | L211: GEAR 2 | N211: WOOKEY | Q211: EVANS | S211: SIMPSON | W211: PRAHRAN | X211: 3 | Y211: 1 | Z211: 0 | AA211: 405 | AB211: 318 | AC211: 127.35849056603773 | AD211: 12
A212: PORT MELBOURNE | C212: BONNETT 4 | F212: WALSH 4 | I212: MILLER 2 | K212: BLACK | M212: OLDFIELD | O212: McDONALD | R212: ALLEN | W212: WILLIAMSTOWN | X212: 3 | Y212: 1 | Z212: 0 | AA212: 385 | AB212: 314 | AC212: 122.61146496815287 | AD212: 12
A214: MOORABBIN | C214: 3 | D214: 6 | E214: =C214*6+D214 -> 24 | G214: 6 | H214: 7 | I214: =G214*6+H214 -> 43 | K214: 8 | L214: 7 | M214: =K214*6+L214 -> 55 | O214: 10 | P214: 12 | Q214: =O214*6+P214 -> 72 | S214: PRESTON | W214: BRUNSWICK | X214: 3 | Y214: 1 | Z214: 0 | AA214: 384 | AB214: 323 | AC214: 118.88544891640866 | AD214: 12
A215: PRESTON | C215: 1 | D215: 2 | E215: =C215*6+D215 -> 8 | G215: 1 | H215: 7 | I215: =G215*6+H215 -> 13 | K215: 5 | L215: 9 | M215: =K215*6+L215 -> 39 | O215: 9 | P215: 12 | Q215: =O215*6+P215 -> 66 | S215: BREWER | W215: COBURG | X215: 2 | Y215: 2 | Z215: 0 | AA215: 379 | AB215: 283 | AC215: 133.92226148409895 | AD215: 8
A216: BEST PLAYERS | W216: OAKLEIGH | X216: 2 | Y216: 2 | Z216: 0 | AA216: 335 | AB216: 276 | AC216: 121.37681159420291 | AD216: 8
A217: MOORABBIN | C217: TREZISE | F217: McGAW | I217: MORONEY | L217: DYNON | N217: RENWICK | Q217: GREEN | W217: PRESTON | X217: 2 | Y217: 2 | Z217: 0 | AA217: 342 | AB217: 324 | AC217: 105.55555555555556 | AD217: 8
A218: PRESTON | C218: HENRYS | F218: F CHARD | I218: DAWSON | L218: CUSACK | N218: BRADFORD | Q218: SWEET | W218: NORTHCOTE | X218: 2 | Y218: 2 | Z218: 0 | AA218: 294 | AB218: 321 | AC218: 91.588785046728972 | AD218: 8
A219: GOALKICKERS | W219: YARRAVILLE | X219: 1 | Y219: 3 | Z219: 0 | AA219: 325 | AB219: 388 | AC219: 83.762886597938149 | AD219: 4
A220: MOORABBIN | C220: SCHOFIELD 3 | F220: MORONEY 2 | I220: MANIE | K220: RENWICK | M220: McGAW | O220: LEHMANN | Q220: CLOVER | W220: BOX HILL | X220: 1 | Y220: 3 | Z220: 0 | AA220: 315 | AB220: 426 | AC220: 73.943661971830991 | AD220: 4
A221: PRESTON | C221: F CHARD 4 | F221: COOPER 2 | I221: BRADFORD | L221: DEVERALL | O221: CANN | W221: CAMBERWELL | X221: 1 | Y221: 3 | Z221: 0 | AA221: 302 | AB221: 415 | AC221: 72.771084337349393 | AD221: 4
W222: BRIGHTON | X222: 1 | Y222: 3 | Z222: 0 | AA222: 230 | AB222: 383 | AC222: 60.052219321148826 | AD222: 4
A223: NORTHCOTE | C223: 1 | D223: 2 | E223: =C223*6+D223 -> 8 | G223: 8 | H223: 5 | I223: =G223*6+H223 -> 53 | K223: 9 | L223: 5 | M223: =K223*6+L223 -> 59 | O223: 11 | P223: 8 | Q223: =O223*6+P223 -> 74 | S223: TOORAK PARK | W223: SANDRINGHAM | X223: 0 | Y223: 4 | Z223: 0 | AA223: 295 | AB223: 455 | AC223: 64.835164835164832 | AD223: 0
A224: PRAHRAN | C224: 3 | D224: 4 | E224: =C224*6+D224 -> 22 | G224: 4 | H224: 7 | I224: =G224*6+H224 -> 31 | K224: 8 | L224: 12 | M224: =K224*6+L224 -> 60 | O224: 10 | P224: 13 | Q224: =O224*6+P224 -> 73 | S224: ROWE
A225: BEST PLAYERS
A226: NORTHCOTE | C226: JOHNSON | F226: FRANCIS | I226: WALKER | L226: WILLIAMSON | O226: GIBBS | Q226: PURDON
A227: PRAHRAN | C227: C BOYD | F227: KINNABURGH | I227: H BOYD | L227: SHILLABEER | O227: JONES | Q227: R WILSON
A228: GOALKICKERS
A229: NORTHCOTE | C229: FRANCIS 3 | F229: JOHNSON 2 | I229: CRAWLEY | K229: PURDON | M229: POWELL | O229: WRIGHT | Q229: COLLINS | S229: WOOLNOUGH
A230: PRAHRAN | C230: KINNABURGH 4 | F230: HARVEY 2 | I230: C BOYD 2 | L230: ELLIOTT | N230: HART
A232: COBURG | C232: 3 | D232: 5 | E232: =C232*6+D232 -> 23 | G232: 7 | H232: 7 | I232: =G232*6+H232 -> 49 | K232: 11 | L232: 12 | M232: =K232*6+L232 -> 78 | O232: 14 | P232: 20 | Q232: =O232*6+P232 -> 104 | S232: COBURG
A233: BRIGHTON | C233: 3 | D233: 2 | E233: =C233*6+D233 -> 20 | G233: 4 | H233: 2 | I233: =G233*6+H233 -> 26 | K233: 5 | L233: 6 | M233: =K233*6+L233 -> 36 | O233: 9 | P233: 10 | Q233: =O233*6+P233 -> 64 | S233: SMYTH
A234: BEST PLAYERS
A235: COBURG | C235: JONES | E235: STARBUCK | I235: MAHONEY | L235: HEWES | N235: GILL | Q235: MILES
A236: BRIGHTON | C236: KNIGHT | E236: WOOLSTENCROFT | I236: BLACKMORE | L236: HEATLEY | N236: STEVENS | Q236: FREEMAN
A237: GOALKICKERS
A238: COBURG | C238: JONES 4 | E238: H WILKINSON 3 | I238: HEWES 3 | L238: ROGAN | N238: J BRENNAN | Q238: MILES | S238: BOND
A239: BRIGHTON | C239: HEATLEY 3 | F239: GRIENKE 2 | I239: WOOLSTENCROFT | M239: BLENKINSOP | P239: PRETTY | R239: WAIN
A241: BOX HILL | C241: 6 | D241: 6 | E241: =C241*6+D241 -> 42 | G241: 9 | H241: 8 | I241: =G241*6+H241 -> 62 | K241: 11 | L241: 11 | M241: =K241*6+L241 -> 77 | O241: 14 | P241: 12 | Q241: =O241*6+P241 -> 96 | S241: BOX HILL
A242: CAMBERWELL | C242: 2 | D242: 2 | E242: =C242*6+D242 -> 14 | G242: 5 | H242: 3 | I242: =G242*6+H242 -> 33 | K242: 6 | L242: 5 | M242: =K242*6+L242 -> 41 | O242: 8 | P242: 6 | Q242: =O242*6+P242 -> 54 | S242: ROBINSON
A243: BEST PLAYERS
A244: BOX HILL | C244: GREEN | F244: HOUGHTON | I244: KRONK | L244: STREET | O244: RATTRAY | Q244: CALDWELL
A245: CAMBERWELL | C245: MASON | F245: HEDLEY | I245: McGUINNESS | L245: YOUNG | O245: HAYES | Q245: McKAIGE
A246: GOALKICKERS
A247: BOX HILL | C247: BROWN 6 | F247: HOUGHTON 3 | I247: DUNN 2 | K247: REID | M247: WEBB | O247: INGLETON
A248: CAMBERWELL | C248: McGUINNESS 2 | F248: WEST | H248: MILNE | J248: ALLSOP | L248: LANE | N248: TEMPANY | Q248: YOUNG
A250: BRUNSWICK | C250: 4 | D250: 2 | E250: =C250*6+D250 -> 26 | G250: 11 | H250: 2 | I250: =G250*6+H250 -> 68 | K250: 12 | L250: 8 | M250: =K250*6+L250 -> 80 | O250: 17 | P250: 13 | Q250: =O250*6+P250 -> 115 | S250: BEACH ROAD
A251: SANDRINGHAM | C251: 3 | D251: 4 | E251: =C251*6+D251 -> 22 | G251: 7 | H251: 6 | I251: =G251*6+H251 -> 48 | K251: 9 | L251: 8 | M251: =K251*6+L251 -> 62 | O251: 10 | P251: 13 | Q251: =O251*6+P251 -> 73 | S251: GAMBLE
A252: BEST PLAYERS
A253: BRUNSWICK | C253: EDWARDS | F253: JAMES | I253: SIMPSON | L253: LEYDEN | O253: ROLFS | R253: HAYES
A254: SANDRINGHAM | C254: CONNINGSBY | F254: DAVIDSON | I254: CROFT | L254: RANSOM | O254: McMAHON | R254: GELAVIS
A255: GOALKICKERS
A256: BRUNSWICK | C256: HAYES 4 | F256: WEIR 3 | H256: LOVETT 2 | J256: SIMPSON 2 | M256: SEYMOUR 2 | P256: MULLENGER 2 | S256: NEILSON | V256: JAMES
A257: SANDRINGHAM | C257: HARPER 3 | F257: ADAMS 2 | I257: GELAVIS | K257: W McMAHON | N257: DAVIDSON | Q257: G CLARKE | S257: SECCOMBE
A259: YARRAVILLE | C259: 2 | D259: 4 | E259: =C259*6+D259 -> 16 | G259: 6 | H259: 7 | I259: =G259*6+H259 -> 43 | K259: 7 | L259: 9 | M259: =K259*6+L259 -> 51 | O259: 10 | P259: 12 | Q259: =O259*6+P259 -> 72 | S259: OAKLEIGH
A260: OAKLEIGH | C260: 3 | D260: 3 | E260: =C260*6+D260 -> 21 | G260: 4 | H260: 6 | I260: =G260*6+H260 -> 30 | K260: 5 | L260: 9 | M260: =K260*6+L260 -> 39 | O260: 7 | P260: 13 | Q260: =O260*6+P260 -> 55 | S260: IRVING
A261: BEST PLAYERS
A262: YARRAVILLE | C262: J ROHLEDER | F262: JONES | I262: WILD | K262: VANDERFEEN | N262: K SMITH | Q262: N ROHLEDER
A263: OAKLEIGH | C263: HILL | F263: NEWPORT | I263: COLLINS | K263: LAMBERT | N263: SCOTT | Q263: TEMME
A264: GOALKICKERS
A265: YARRAVILLE | C265: WILD 4 | F265: J ROHLEDER 3 | I265: MASON | K265: HART | M265: SMALLWOOD
A266: OAKLEIGH | C266: ANDERSON 2 | F266: LAMBERT | H266: COLLINS | J266: SCOTT | L266: LONIE | N266: HILL
A268: ROUND 5 | E268: 14TH MAY | J268: WEATHER | O268: NORTH WEST WIND | S268: PLAYED AT
D269: 1ST QTR | H269: 2ND QTR | L269: 3RD QTR | P269: FINAL | S269: MOORABBIN
A270: PORT MELBOURNE | C270: 2 | D270: 4 | E270: =C270*6+D270 -> 16 | G270: 4 | H270: 5 | I270: =G270*6+H270 -> 29 | K270: 8 | L270: 7 | M270: =K270*6+L270 -> 55 | O270: 8 | P270: 9 | Q270: =O270*6+P270 -> 57 | S270: UMPIRE | X270: LADDER | AB270: ROUND | AD270: 5
A271: MOORABBIN | C271: 2 | D271: 1 | E271: =C271*6+D271 -> 13 | G271: 4 | H271: 2 | I271: =G271*6+H271 -> 26 | K271: 6 | L271: 6 | M271: =K271*6+L271 -> 42 | O271: 7 | P271: 11 | Q271: =O271*6+P271 -> 53 | S271: IRVING
A272: BEST PLAYERS | W272: TEAM | X272: W | Y272: L | Z272: D | AA272: FOR | AB272: AGST | AC272: % | AD272: PTS
A273: PORT MELBOURNE | C273: JOHNSON | F273: WHARTON | I273: WILSON | L273: HARVEY | N273: ATKINSON | Q273: SHANNON
A274: MOORABBIN | C274: TREZISE | F274: MURPHY | I274: GREEN | L274: McGAW | N274: BARNES | Q274: SCHOFIELD | W274: MOORABBIN | X274: 4 | Y274: 1 | Z274: 0 | AA274: 452 | AB274: 318 | AC274: 142.13836477987422 | AD274: 16
A275: GOALKICKERS | W275: WILLIAMSTOWN | X275: 4 | Y275: 1 | Z275: 0 | AA275: 493 | AB275: 391 | AC275: 126.08695652173913 | AD275: 16
A276: PORT MELBOURNE | C276: BONNETT 3 | F276: ROSEWARNE 2 | I276: ATKINSON | K276: H TUCKER | M276: WALSH | W276: PORT MELBOURNE | X276: 4 | Y276: 1 | Z276: 0 | AA276: 491 | AB276: 390 | AC276: 125.8974358974359 | AD276: 16
A277: MOORABBIN | C277: SCHOFIELD 3 | F277: MORONEY 2 | I277: MANIE | K277: SUTHERLAND | W277: COBURG | X277: 3 | Y277: 2 | Z277: 0 | AA277: 452 | AB277: 344 | AC277: 131.3953488372093 | AD277: 12
A279: WILLIAMSTOWN | C279: 2 | D279: 6 | E279: =C279*6+D279 -> 18 | G279: 5 | H279: 10 | I279: =G279*6+H279 -> 40 | K279: 10 | L279: 17 | M279: =K279*6+L279 -> 77 | O279: 15 | P279: 18 | Q279: =O279*6+P279 -> 108 | S279: TOORAK PARK | W279: OAKLEIGH | X279: 3 | Y279: 2 | Z279: 0 | AA279: 405 | AB279: 342 | AC279: 118.42105263157895 | AD279: 12
A280: PRAHRAN | C280: 2 | D280: 5 | E280: =C280*6+D280 -> 17 | G280: 6 | H280: 7 | I280: =G280*6+H280 -> 43 | K280: 8 | L280: 8 | M280: =K280*6+L280 -> 56 | O280: 11 | P280: 11 | Q280: =O280*6+P280 -> 77 | S280: SMYTH | W280: PRAHRAN | X280: 3 | Y280: 2 | Z280: 0 | AA280: 482 | AB280: 426 | AC280: 113.14553990610328 | AD280: 12
A281: BEST PLAYERS | W281: BRUNSWICK | X281: 3 | Y281: 2 | Z281: 0 | AA281: 444 | AB281: 402 | AC281: 110.45 | AD281: 12
A282: WILLIAMSTOWN | C282: LINTON | F282: CALLAHAN | I282: SIMS | L282: EVANS | O282: SIMPSON | Q282: RAMSAY | W282: PRESTON | X282: 3 | Y282: 2 | Z282: 0 | AA282: 421 | AB282: 384 | AC282: 109.64 | AD282: 12
A283: PRAHRAN | C283: ROY JONES | F283: ELLIOTT | I283: HEALEY | L283: SHILLABEER | O283: H BOYD | Q283: C BOYD | W283: NORTHCOTE | X283: 2 | Y283: 3 | Z283: 0 | AA283: 360 | AB283: 391 | AC283: 92.071611253196934 | AD283: 8
A284: GOALKICKERS | W284: BOX HILL | X284: 2 | Y284: 3 | Z284: 0 | AA284: 401 | AB284: 478 | AC284: 83.891213389121333 | AD284: 8
A285: WILLIAMSTOWN | C285: LINTON 6 | F285: GEAR 2 | I285: SMITH 2 | L285: KENT 2 | N285: McPHERSON | Q285: FISHER | S285: SIMPSON | W285: YARRAVILLE | X285: 1 | Y285: 4 | Z285: 0 | AA285: 386 | AB285: 461 | AC285: 83.731019522776577 | AD285: 4
A286: PRAHRAN | C286: HARVEY 3 | F286: ELLIOTT 2 | I286: WILSON 2 | L286: KINNABURGH | O286: H BOYD | Q286: PLAIN | S286: HART | W286: SANDRINGHAM | X286: 1 | Y286: 4 | Z286: 0 | AA286: 417 | AB286: 536 | AC286: 77.798507462686572 | AD286: 4
W287: CAMBERWELL | X287: 1 | Y287: 4 | Z287: 0 | AA287: 383 | AB287: 537 | AC287: 71.322160148975797 | AD287: 4
A288: PRESTON | C288: 5 | D288: 7 | E288: =C288*6+D288 -> 37 | G288: 7 | H288: 7 | I288: =G288*6+H288 -> 49 | K288: 10 | L288: 11 | M288: =K288*6+L288 -> 71 | O288: 11 | P288: 13 | Q288: =O288*6+P288 -> 79 | S288: BRUNSWICK | W288: BRIGHTON | X288: 1 | Y288: 4 | Z288: 0 | AA288: 282 | AB288: 469 | AC288: 60.127931769722814 | AD288: 4
A289: BRUNSWICK | C289: 3 | D289: 2 | E289: =C289*6+D289 -> 20 | G289: 4 | H289: 9 | I289: =G289*6+H289 -> 33 | K289: 5 | L289: 13 | M289: =K289*6+L289 -> 43 | O289: 7 | P289: 18 | Q289: =O289*6+P289 -> 60 | S289: ROACH
A290: BEST PLAYERS
A291: PRESTON | C291: K CHARD | F291: SWEET | I291: JONES | L291: HENRYS | N291: LALOR | Q291: BRADFORD
A292: BRUNSWICK | C292: WEIR | F292: STANLEY | I292: NEILSON | L292: YEA | N292: POLLARD | Q292: CARROLL
A293: GOALKICKERS
A294: PRESTON | C294: F CHARD 2 | F294: BENNETT 2 | I294: LALOR 2 | K294: BRADFORD | N294: OSBORNE | P294: FOLEY | R294: JEFFREY | U294: WATT
A295: BRUNSWICK | C295: WEIR 4 | F295: HAYES 2 | I295: SIMPSON
A297: OAKLEIGH | C297: 0 | D297: 0 | E297: =C297*6+D297 -> 0 | G297: 5 | H297: 10 | I297: =G297*6+H297 -> 40 | K297: 9 | L297: 14 | M297: =K297*6+L297 -> 68 | O297: 9 | P297: 16 | Q297: =O297*6+P297 -> 70 | S297: NORTHCOTE
A298: NORTHCOTE | C298: 3 | D298: 7 | E298: =C298*6+D298 -> 25 | G298: 6 | H298: 9 | I298: =G298*6+H298 -> 45 | K298: 8 | L298: 12 | M298: =K298*6+L298 -> 60 | O298: 8 | P298: 18 | Q298: =O298*6+P298 -> 66 | S298: ROBINSON
A299: BEST PLAYERS
A300: OAKLEIGH | C300: GUY | E300: SHAW | H300: NEWPORT | K300: ANDERSON | N300: WALSH | Q300: LAMBERT
A301: NORTHCOTE | C301: COLLINS | E301: GIBBS | H301: ALDRIDGE | K301: WOONOUGH | N301: PURDON | Q301: FRANCIS
A302: GOALKICKERS
A303: OAKLEIGH | C303: SHAW 3 | F303: LAMBERT 2 | I303: PREECE | K303: WEBSTER | M303: LONIE | O303: SCOTT
A304: NORTHCOTE | C304: FRANCIS 2 | F304: PURDON 2 | I304: GIBBS 2 | K304: COLLINS | M304: DEVINE
A306: COBURG | C306: 2 | D306: 5 | E306: =C306*6+D306 -> 17 | G306: 6 | H306: 8 | I306: =G306*6+H306 -> 44 | K306: 7 | L306: 12 | M306: =K306*6+L306 -> 54 | O306: 10 | P306: 13 | Q306: =O306*6+P306 -> 73 | S306: YARRAVILLE
A307: YARRAVILLE | C307: 2 | D307: 3 | E307: =C307*6+D307 -> 15 | G307: 5 | H307: 6 | I307: =G307*6+H307 -> 36 | K307: 7 | L307: 8 | M307: =K307*6+L307 -> 50 | O307: 8 | P307: 13 | Q307: =O307*6+P307 -> 61 | S307: ROWE
A308: BEST PLAYERS
A309: COBURG | C309: STARBUCK | F309: GILL | I309: McTAGGART | L309: GOULLET | O309: HORSKINS | R309: H WILKINSON
A310: YARRAVILLE | C310: VANDERFEEN | F310: J ROHLEDER | I310: WILD | L310: NICHOLLS | O310: N ROHLEDER | R310: SMALLWOOD
A311: GOALKICKERS
A312: COBURG | C312: GOULLET 2 | F312: HEWES 2 | I312: JONES 2 | K312: HORSKINS 2 | N312: H WILKINSON | Q312: CANNAN
A313: YARRAVILLE | C313: HUGHES 2 | F313: SMALLWOOD 2 | J313: J ROHLEDER | M313: WILD | N313: MASON | P313: FRASER
A315: BOX HILL | C315: 3 | D315: 6 | E315: =C315*6+D315 -> 24 | G315: 4 | H315: 7 | I315: =G315*6+H315 -> 31 | K315: 9 | L315: 12 | M315: =K315*6+L315 -> 66 | O315: 12 | P315: 14 | Q315: =O315*6+P315 -> 86 | S315: ELSTERNWICK PARK
A316: BRIGHTON | C316: 1 | D316: 2 | E316: =C316*6+D316 -> 8 | G316: 3 | H316: 6 | I316: =G316*6+H316 -> 24 | K316: 5 | L316: 7 | M316: =K316*6+L316 -> 37 | O316: 7 | P316: 10 | Q316: =O316*6+P316 -> 52 | S316: GAMBLE
A317: BEST PLAYERS
A318: BOX HILL | C318: IRVINE | F318: LOVE | I318: HOUGHTON | L318: JOHNSON | O318: BROWN | Q318: DUNN
A319: BRIGHTON | C319: BLACKMORE | F319: STEVENS | I319: FREEMAN | L319: ASLING | O319: TURNER | Q319: WOOLSTENCROFT
A320: GOALKICKERS
A321: BOX HILL | C321: PINKERTON 4 | F321: JOHNSON 3 | I321: INGLETON 2 | L321: BROWN 2 | O321: DUNN
A322: BRIGHTON | C322: WAIN 2 | F322: ASLING | H322: HEATLEY | J322: PRETTY | L322: J DAVIDSON | O322: BLENKINSOP
A324: SANDRINGHAM | C324: 2 | D324: 4 | E324: =C324*6+D324 -> 16 | G324: 5 | H324: 12 | I324: =G324*6+H324 -> 42 | K324: 10 | L324: 17 | M324: =K324*6+L324 -> 77 | O324: 17 | P324: 20 | Q324: =O324*6+P324 -> 122 | S324: CAMBERWELL
A325: CAMBERWELL | C325: 2 | D325: 5 | E325: =C325*6+D325 -> 17 | G325: 3 | H325: 6 | I325: =G325*6+H325 -> 24 | K325: 9 | L325: 6 | M325: =K325*6+L325 -> 60 | O325: 12 | P325: 9 | Q325: =O325*6+P325 -> 81 | S325: MALLETT
A326: BEST PLAYERS
A327: SANDRINGHAM | C327: W CLARKE | F327: GILLIES | I327: McMAHON | L327: HARPER | O327: SECCOMBE | R327: RANSOM
A328: CAMBERWELL | C328: MASON | F328: SCHNEIDER | I328: K CLARKE | L328: HEDLEY | O328: TURNBULL | R328: HAYES
A329: GOALKICKERS
A330: SANDRINGHAM | C330: HARPER 6 | E330: SECCOMBE 2 | H330: GILLIES 2 | J330: McMAHON 2 | M330: GELAVIS | O330: G CLARKE | Q330: RANSOM | S330: DAVIDSON | V330: W CLARKE
A331: CAMBERWELL | C331: SCHNEIDER 5 | F331: TEMPANY 2 | I331: HAYES 2 | K331: WEST | M331: HEDLEY | O331: McKAIGE
A333: ROUND 6 | E333: 21ST MAY | J333: WEATHER | M333: DULL GROUNDS HEAVY | S333: PLAYED AT
D334: 1ST QTR | H334: 2ND QTR | L334: 3RD QTR | P334: FINAL | S334: WILLIAMSTOWN
A335: MOORABBIN | C335: 3 | D335: 2 | E335: =C335*6+D335 -> 20 | G335: 6 | H335: 7 | I335: =G335*6+H335 -> 43 | K335: 8 | L335: 9 | M335: =K335*6+L335 -> 57 | O335: 12 | P335: 17 | Q335: =O335*6+P335 -> 89 | S335: UMPIRE | X335: LADDER | AB335: ROUND | AD335: 6
A336: WILLIAMSTOWN | C336: 4 | D336: 2 | E336: =C336*6+D336 -> 26 | G336: 5 | H336: 5 | I336: =G336*6+H336 -> 35 | K336: 8 | L336: 10 | M336: =K336*6+L336 -> 58 | O336: 10 | P336: 11 | Q336: =O336*6+P336 -> 71 | S336: BREWER
A337: BEST PLAYERS | W337: TEAM | X337: W | Y337: L | Z337: D | AA337: FOR | AB337: AGST | AC337: % | AD337: PTS
A338: MOORABBIN | C338: GREEN | F338: McGAW | I338: STANLEY | L338: GILDER | N338: LAWRENCE | Q338: MURRAY
A339: WILLIAMSTOWN | C339: LINTON | F339: CURRAN | I339: FISHER | L339: MUNDAY | N339: SMITH | Q339: LEIGH | W339: MOORABBIN | X339: 5 | Y339: 1 | Z339: 0 | AA339: 541 | AB339: 389 | AC339: 139.0745501285347 | AD339: 20
A340: GOALKICKERS | W340: PORT MELBOURNE | X340: 5 | Y340: 1 | Z340: 0 | AA340: 587 | AB340: 483 | AC340: 121.53209109730849 | AD340: 20
A341: MOORABBIN | C341: McGAW 4 | F341: SCHOFIELD 4 | I341: MORONEY 2 | L341: LEHMANN 2 | W341: PRESTON | X341: 4 | Y341: 2 | Z341: 0 | AA341: 508 | AB341: 432 | AC341: 117.59 | AD341: 16
A342: WILLIAMSTOWN | C342: LINTON 5 | F342: SMITH 2 | I342: SIMPSON | K342: KENT | M342: McPHERSON | W342: WILLIAMSTOWN | X342: 4 | Y342: 2 | Z342: 0 | AA342: 564 | AB342: 480 | AC342: 117.5 | AD342: 16
A344: PRAHRAN | C344: 2 | D344: 2 | E344: =C344*6+D344 -> 14 | G344: 6 | H344: 3 | I344: =G344*6+H344 -> 39 | K344: 11 | L344: 5 | M344: =K344*6+L344 -> 71 | O344: 14 | P344: 11 | Q344: =O344*6+P344 -> 95 | S344: OAKLEIGH | W344: PRAHRAN | X344: 4 | Y344: 2 | Z344: 0 | AA344: 577 | AB344: 520 | AC344: 110.96153846153847 | AD344: 16
A345: OAKLEIGH | C345: 3 | D345: 2 | E345: =C345*6+D345 -> 20 | G345: 7 | H345: 6 | I345: =G345*6+H345 -> 48 | K345: 10 | L345: 7 | M345: =K345*6+L345 -> 67 | O345: 14 | P345: 10 | Q345: =O345*6+P345 -> 94 | S345: GAMBLE | W345: COBURG | X345: 3 | Y345: 3 | Z345: 0 | AA345: 528 | AB345: 422 | AC345: 125.11848341232228 | AD345: 12
A346: BEST PLAYERS | W346: OAKLEIGH | X346: 3 | Y346: 3 | Z346: 0 | AA346: 499 | AB346: 437 | AC346: 114.18764302059496 | AD346: 12
A347: PRAHRAN | C347: KINNABURGH | F347: GAZE | I347: MORROW | L347: C BOYD | N347: H BOYD | Q347: GAFFNEY | W347: BRUNSWICK | X347: 3 | Y347: 3 | Z347: 0 | AA347: 537 | AB347: 498 | AC347: 107.83 | AD347: 12
A348: OAKLEIGH | C348: LAMBERT | F348: TEMME | I348: WEBSTER | L348: SHAW | N348: SCOTT | Q348: MUNYARD | W348: NORTHCOTE | X348: 3 | Y348: 3 | Z348: 0 | AA348: 438 | AB348: 467 | AC348: 93.790149892933613 | AD348: 12
A349: GOALKICKERS | W349: BOX HILL | X349: 3 | Y349: 3 | Z349: 0 | AA349: 474 | AB349: 525 | AC349: 90.285714285714292 | AD349: 12
A350: PRAHRAN | C350: KINNABURGH 5 | F350: H BOYD 3 | I350: ELLIOTT 2 | L350: C BOYD 2 | N350: HARVEY | P350: RICKARDS | W350: SANDRINGHAM | X350: 2 | Y350: 4 | Z350: 0 | AA350: 507 | AB350: 595 | AC350: 85.210084033613441 | AD350: 8
A351: OAKLEIGH | C351: SHAW 4 | F351: HOWELL 2 | I351: PREECE 2 | K351: LAMBERT 2 | N351: COLLINS 2 | Q351: WEBSTER | T351: LONIE | W351: YARRAVILLE | X351: 1 | Y351: 5 | Z351: 0 | AA351: 433 | AB351: 534 | AC351: 81.086142322097373 | AD351: 4
W352: CAMBERWELL | X352: 1 | Y352: 5 | Z352: 0 | AA352: 431 | AB352: 624 | AC352: 69.070512820512818 | AD352: 4
A353: PORT MELBOURNE | C353: 0 | D353: 2 | E353: =C353*6+D353 -> 2 | G353: 8 | H353: 5 | I353: =G353*6+H353 -> 53 | K353: 9 | L353: 5 | M353: =K353*6+L353 -> 59 | O353: 15 | P353: 6 | Q353: =O353*6+P353 -> 96 | S353: PORT MELBOURNE | W353: BRIGHTON | X353: 1 | Y353: 5 | Z353: 0 | AA353: 341 | AB353: 559 | AC353: 61.001788908765654 | AD353: 4
A354: BRUNSWICK | C354: 1 | D354: 4 | E354: =C354*6+D354 -> 10 | G354: 4 | H354: 6 | I354: =G354*6+H354 -> 30 | K354: 10 | L354: 12 | M354: =K354*6+L354 -> 72 | O354: 13 | P354: 15 | Q354: =O354*6+P354 -> 93 | S354: ROBINSON
A355: BEST PLAYERS
A356: PORT MELBOURNE | C356: WILSON | F356: SHANNON | I356: METHERALL | L356: ALLEN | N356: WALSH | Q356: WHARTON
A357: BRUNSWICK | C357: MULLENGER | F357: YEA | I357: McFEE | L357: WEIR | N357: LEYDEN | Q357: STANLEY
A358: GOALKICKERS
A359: PORT MELBOURNE | C359: WALSH 5 | F359: BONNETT 5 | I359: SYKES 3 | L359: McDONALD | O359: ALLEN
A360: BRUNSWICK | C360: HAYES 6 | F360: McFEE 2 | I360: SIMPSON 2 | L360: PHIPPS 2 | O360: JAMES
A362: NORTHCOTE | C362: 4 | D362: 1 | E362: =C362*6+D362 -> 25 | G362: 7 | H362: 4 | I362: =G362*6+H362 -> 46 | K362: 10 | L362: 9 | M362: =K362*6+L362 -> 69 | O362: 11 | P362: 12 | Q362: =O362*6+P362 -> 78 | S362: COBURG
A363: COBURG | C363: 5 | D363: 2 | E363: =C363*6+D363 -> 32 | G363: 6 | H363: 4 | I363: =G363*6+H363 -> 40 | K363: 8 | L363: 9 | M363: =K363*6+L363 -> 57 | O363: 10 | P363: 16 | Q363: =O363*6+P363 -> 76 | S363: MALLETT
A364: BEST PLAYERS
A365: NORTHCOTE | C365: FRANCIS | E365: GOUGH | H365: DEVINE | K365: GIBBS | N365: WRIGHT | Q365: F VAINS
A366: COBURG | C366: JONES | E366: HEWES | H366: GILL | K366: McTAGGART | N366: H WILKINSON | Q366: HORSKINS
A367: GOALKICKERS
A368: NORTHCOTE | C368: FRANCIS 6 | F368: DEVINE 2 | I368: COLLINS 2 | L368: TULL
A369: COBURG | C369: HEWES 5 | F369: HORSKINS 2 | I369: H WILKINSON | L369: KNIGHT | N369: JONES
A371: BOX HILL | C371: 2 | D371: 4 | E371: =C371*6+D371 -> 16 | G371: 4 | H371: 9 | I371: =G371*6+H371 -> 33 | K371: 6 | L371: 11 | M371: =K371*6+L371 -> 47 | O371: 10 | P371: 13 | Q371: =O371*6+P371 -> 73 | S371: BOX HILL
A372: YARRAVILLE | C372: 1 | D372: 3 | E372: =C372*6+D372 -> 9 | G372: 2 | H372: 8 | I372: =G372*6+H372 -> 20 | K372: 5 | L372: 10 | M372: =K372*6+L372 -> 40 | O372: 6 | P372: 11 | Q372: =O372*6+P372 -> 47 | S372: ROACH
A373: BEST PLAYERS
A374: BOX HILL | C374: WRIGHT | F374: DUNN | H374: HOUGHTON | K374: WEBB | N374: GREEN | Q374: RATTRAY
A375: YARRAVILLE | C375: SMALLWOOD | F375: HART | H375: WILD | K375: N ROHLEDER | N375: K SMITH | Q375: S JONES
A376: GOALKICKERS
A377: BOX HILL | C377: DUNN 3 | F377: BROWN 3 | I377: JOHNSON | K377: WEBB | M377: INGLETON | O377: PINKERTON
A378: YARRAVILLE | C378: WILD 3 | F378: J ROHLEDER 2 | I378: HART
A380: SANDRINGHAM | C380: 3 | D380: 1 | E380: =C380*6+D380 -> 19 | G380: 7 | H380: 6 | I380: =G380*6+H380 -> 48 | K380: 8 | L380: 10 | M380: =K380*6+L380 -> 58 | O380: 13 | P380: 12 | Q380: =O380*6+P380 -> 90 | S380: BEACH ROAD
A381: BRIGHTON | C381: 4 | D381: 3 | E381: =C381*6+D381 -> 27 | G381: 5 | H381: 6 | I381: =G381*6+H381 -> 36 | K381: 7 | L381: 9 | M381: =K381*6+L381 -> 51 | O381: 8 | P381: 11 | Q381: =O381*6+P381 -> 59 | S381: SMYTH
A382: BEST PLAYERS
A383: SANDRINGHAM | C383: McMAHON | F383: DAVIDSON | I383: HARPER | L383: RANSOM | O383: FITZPATRICK | R383: CROFT
A384: BRIGHTON | C384: FREEMAN | F384: POUND | I384: HICKMAN | L384: I DAVIDSON | O384: STEVENS | R384: ASLING
A385: GOALKICKERS
A386: SANDRINGHAM | C386: HARPER 4 | F386: DAVIDSON 3 | I386: McMAHON 2 | L386: RANSOM 2 | N386: COGHLAN | Q386: GILLIES
A387: BRIGHTON | C387: WAIN 2 | F387: BLENKINSOP 2 | I387: KENNEDY | K387: HICKMAN | M387: ASLING | O387: COURTNEY
A389: PRESTON | C389: 5 | D389: 1 | E389: =C389*6+D389 -> 31 | G389: 9 | H389: 3 | I389: =G389*6+H389 -> 57 | K389: 9 | L389: 5 | M389: =K389*6+L389 -> 59 | O389: 13 | P389: 9 | Q389: =O389*6+P389 -> 87 | S389: PRESTON
A390: CAMBERWELL | C390: 0 | D390: 2 | E390: =C390*6+D390 -> 2 | G390: 1 | H390: 5 | I390: =G390*6+H390 -> 11 | K390: 3 | L390: 9 | M390: =K390*6+L390 -> 27 | O390: 6 | P390: 12 | Q390: =O390*6+P390 -> 48 | S390: IRVING
A391: BEST PLAYERS
A392: PRESTON | C392: HENRYS | F392: SWEET | I392: CUSACK | L392: McLACHLAN | O392: McBEAN | Q392: CROCKER
A393: CAMBERWELL | C393: CLARKE | F393: SKALBERG | I393: JOHNSON | L393: YOUNG | O393: MASON | Q393: HEDLEY
A394: GOALKICKERS
A395: PRESTON | C395: F CHARD 6 | F395: LALOR 2 | I395: FOLEY 2 | K395: BENNETT | M395: JONES | O395: BRADFORD
A396: CAMBERWELL | C396: HEDLEY 3 | F396: BENBOW | I396: McGUINNESS | L396: TURNBULL
A398: ROUND 7 | E398: 28TH MAY | J398: WEATHER | O398: NORTH WIND FINE | S398: PLAYED AT
D399: 1ST QTR | H399: 2ND QTR | L399: 3RD QTR | P399: FINAL | S399: TOORAK PARK
A400: COBURG | C400: 3 | D400: 4 | E400: =C400*6+D400 -> 22 | G400: 7 | H400: 4 | I400: =G400*6+H400 -> 46 | K400: 12 | L400: 9 | M400: =K400*6+L400 -> 81 | O400: 14 | P400: 9 | Q400: =O400*6+P400 -> 93 | S400: UMPIRE | X400: LADDER | AB400: ROUND | AD400: 7
A401: PRAHRAN | C401: 1 | D401: 0 | E401: =C401*6+D401 -> 6 | G401: 6 | H401: 2 | I401: =G401*6+H401 -> 38 | K401: 9 | L401: 2 | M401: =K401*6+L401 -> 56 | O401: 10 | P401: 9 | Q401: =O401*6+P401 -> 69 | S401: IRVING
A402: BEST PLAYERS | W402: TEAM | X402: W | Y402: L | Z402: D | AA402: FOR | AB402: AGST | AC402: % | AD402: PTS
A403: COBURG | C403: CONDON | E403: HEWES | H403: STARBUCK | K403: SANDLANT | N403: GILL | Q403: JONES
A404: PRAHRAN | C404: PLAIN | E404: HARVEY | H404: C BOYD | K404: HEALEY | N404: KINNABURGH | Q404: HART | W404: MOORABBIN | X404: 6 | Y404: 1 | Z404: 0 | AA404: 637 | AB404: 462 | AC404: 137.87878787878788 | AD404: 24
A405: GOALKICKERS | W405: PORT MELBOURNE | X405: 6 | Y405: 1 | Z405: 0 | AA405: 701 | AB405: 555 | AC405: 126.30630630630631 | AD405: 24
A406: COBURG | C406: HEWES 7 | F406: JONES 4 | I406: H WILKINSON | L406: McCOLL | W406: PRESTON | X406: 5 | Y406: 2 | Z406: 0 | AA406: 610 | AB406: 460 | AC406: 132.61 | AD406: 20
A407: PRAHRAN | C407: KINNABURGH 3 | F407: HARVEY 2 | I407: H BOYD | K407: HART | M407: C BOYD | O407: SHARP | Q407: ELLIOTT | W407: WILLIAMSTOWN | X407: 5 | Y407: 2 | Z407: 0 | AA407: 685 | AB407: 522 | AC407: 131.22605363984675 | AD407: 20
A409: WILLIAMSTOWN | C409: 5 | D409: 0 | E409: =C409*6+D409 -> 30 | G409: 9 | H409: 3 | I409: =G409*6+H409 -> 57 | K409: 13 | L409: 7 | M409: =K409*6+L409 -> 85 | O409: 18 | P409: 13 | Q409: =O409*6+P409 -> 121 | S409: OAKLEIGH | W409: COBURG | X409: 4 | Y409: 3 | Z409: 0 | AA409: 621 | AB409: 491 | AC409: 126.4765784114053 | AD409: 16
A410: OAKLEIGH | C410: 1 | D410: 2 | E410: =C410*6+D410 -> 8 | G410: 3 | H410: 6 | I410: =G410*6+H410 -> 24 | K410: 5 | L410: 7 | M410: =K410*6+L410 -> 37 | O410: 5 | P410: 12 | Q410: =O410*6+P410 -> 42 | S410: ROACH | W410: PRAHRAN | X410: 4 | Y410: 3 | Z410: 0 | AA410: 646 | AB410: 613 | AC410: 105.38336052202284 | AD410: 16
A411: BEST PLAYERS | W411: NORTHCOTE | X411: 4 | Y411: 3 | Z411: 0 | AA411: 511 | AB411: 520 | AC411: 98.269230769230774 | AD411: 16
A412: WILLIAMSTOWN | C412: LINTON | F412: SMITH | I412: SIMPSON | L412: EVANS | N412: WHITTAKER | Q412: LEIGH | W412: BRUNSWICK | X412: 3 | Y412: 4 | Z412: 0 | AA412: 610 | AB412: 594 | AC412: 102.69 | AD412: 12
A413: OAKLEIGH | C413: H WILLIAMS | F413: TEMME | I413: G WALSH | L413: HORLEY | N413: NEWPORT | Q413: SHAW | W413: OAKLEIGH | X413: 3 | Y413: 4 | Z413: 0 | AA413: 541 | AB413: 558 | AC413: 96.953405017921142 | AD413: 12
A414: GOALKICKERS | W414: BOX HILL | X414: 3 | Y414: 4 | Z414: 0 | AA414: 527 | AB414: 598 | AC414: 88.127090301003349 | AD414: 12
A415: WILLIAMSTOWN | C415: LINTON 5 | E415: ANDERSON 4 | H415: GEAR 3 | J415: KENT 2 | L415: McPHERSON | O415: SIMPSON | Q415: SMITH | S415: EVANS | W415: YARRAVILLE | X415: 2 | Y415: 5 | Z415: 0 | AA415: 537 | AB415: 609 | AC415: 88.177339901477836 | AD415: 8
A416: OAKLEIGH | C416: PREECE 2 | F416: E WALSH | I416: MUNYARD | K416: SHAW | W416: SANDRINGHAM | X416: 2 | Y416: 5 | Z416: 0 | AA416: 582 | AB416: 699 | AC416: 83.261802575107296 | AD416: 8
W417: CAMBERWELL | X417: 1 | Y417: 6 | Z417: 0 | AA417: 503 | AB417: 738 | AC417: 68.157181571815713 | AD417: 4
A418: MOORABBIN | C418: 2 | D418: 3 | E418: =C418*6+D418 -> 15 | G418: 7 | H418: 6 | I418: =G418*6+H418 -> 48 | K418: 12 | L418: 10 | M418: =K418*6+L418 -> 82 | O418: 14 | P418: 12 | Q418: =O418*6+P418 -> 96 | S418: BRUNSWICK | W418: BRIGHTON | X418: 1 | Y418: 6 | Z418: 0 | AA418: 369 | AB418: 661 | AC418: 55.824508320726174 | AD418: 4
A419: BRUNSWICK | C419: 0 | D419: 2 | E419: =C419*6+D419 -> 2 | G419: 2 | H419: 4 | I419: =G419*6+H419 -> 16 | K419: 6 | L419: 6 | M419: =K419*6+L419 -> 42 | O419: 10 | P419: 13 | Q419: =O419*6+P419 -> 73 | S419: MALLETT
A420: BEST PLAYERS
A421: MOORABBIN | C421: McGAW | E421: GILDER | H421: MORONEY | K421: STANLEY | N421: K BOYD | Q421: MURRAY
A422: BRUNSWICK | C422: YEA | E422: STANLEY | H422: MAY | K422: NEILSON | N422: LOVETT | Q422: McFEE
A423: GOALKICKERS
A424: MOORABBIN | C424: SCHOFIELD 5 | F424: MORONEY 4 | I424: McGAW 3 | L424: CHANDLER | N424: PECK
A425: BRUNSWICK | C425: McFEE 3 | F425: LOVETT 2 | I425: HAYES 2 | K425: LEYDEN | M425: JAMES | O425: CLUES
A427: NORTHCOTE | C427: 1 | D427: 5 | E427: =C427*6+D427 -> 11 | G427: 3 | H427: 7 | I427: =G427*6+H427 -> 25 | K427: 6 | L427: 9 | M427: =K427*6+L427 -> 45 | O427: 10 | P427: 13 | Q427: =O427*6+P427 -> 73 | S427: NORTHCOTE
A428: BOX HILL | C428: 0 | D428: 5 | E428: =C428*6+D428 -> 5 | G428: 1 | H428: 8 | I428: =G428*6+H428 -> 14 | K428: 3 | L428: 10 | M428: =K428*6+L428 -> 28 | O428: 7 | P428: 11 | Q428: =O428*6+P428 -> 53 | S428: SMYTH
A429: BEST PLAYERS
A430: NORTHCOTE | C430: GIBBS | E430: F VAINS | H430: WOOLNOUGH | K430: GOUGH | N430: ALDRIDGE | Q430: POWELL
A431: BOX HILL | C431: WRIGHT | E431: HOUGHTON | H431: PINKERTON | K431: STREET | N431: INGLETON | Q431: GREEN
A432: GOALKICKERS
A433: NORTHCOTE | C433: GIBBS 3 | F433: HOLT 2 | H433: DEVINE | J433: STABB | L433: PURDON | N433: FRANCIS | P433: J JOHNSON
A434: BOX HILL | C434: INGLETON 2 | F434: STREET | H434: HOUGHTON | J434: DUNN | L434: PINKERTON | N434: REYNOLDS
A436: YARRAVILLE | C436: 0 | D436: 2 | E436: =C436*6+D436 -> 2 | G436: 5 | H436: 7 | I436: =G436*6+H436 -> 37 | K436: 9 | L436: 10 | M436: =K436*6+L436 -> 64 | O436: 15 | P436: 14 | Q436: =O436*6+P436 -> 104 | S436: YARRAVILLE
A437: SANDRINGHAM | C437: 2 | D437: 4 | E437: =C437*6+D437 -> 16 | G437: 3 | H437: 5 | I437: =G437*6+H437 -> 23 | K437: 7 | L437: 11 | M437: =K437*6+L437 -> 53 | O437: 10 | P437: 15 | Q437: =O437*6+P437 -> 75 | S437: ROBINSON
A438: BEST PLAYERS
A439: YARRAVILLE | C439: VANDERFEEN | F439: WILD | H439: J ROHLEDER | K439: K SMITH | N439: MARCHESI | Q439: NICHOLLS
A440: SANDRINGHAM | C440: GELAVIS | F440: FLETCHER | I440: KRAUSE | K440: FITZPATRICK | N440: HARPER | Q440: LAFFEY
A441: GOALKICKERS
A442: YARRAVILLE | C442: VANDERFEEN 5 | F442: WILD 3 | H442: SMALLWOOD 2 | K442: J ROHLEDER 2 | N442: GARLICK | P442: MARCHESI | R442: BEECH
A443: SANDRINGHAM | C443: HARPER 5 | F443: COGHLAN 2 | I443: RANSOM | K443: BRIGHTON | M443: EVANS
A445: PRESTON | C445: 5 | D445: 7 | E445: =C445*6+D445 -> 37 | G445: 7 | H445: 12 | I445: =G445*6+H445 -> 54 | K445: 12 | L445: 16 | M445: =K445*6+L445 -> 88 | O445: 14 | P445: 18 | Q445: =O445*6+P445 -> 102 | S445: ELSTERNWICK PARK
A446: BRIGHTON | C446: 1 | D446: 1 | E446: =C446*6+D446 -> 7 | G446: 2 | H446: 2 | I446: =G446*6+H446 -> 14 | K446: 2 | L446: 2 | M446: =K446*6+L446 -> 14 | O446: 4 | P446: 4 | Q446: =O446*6+P446 -> 28 | S446: ROWE
A447: BEST PLAYERS
A448: PRESTON | C448: BRADFORD | F448: LALOR | I448: HAYES | L448: WATT | O448: McLACHLAN | R448: CROCKER
A449: BRIGHTON | C449: POUND | F449: FREEMAN | I449: KENNEDY | L449: COURTNEY | O449: I DAVIDSON | R449: STEVENS
A450: GOALKICKERS
A451: PRESTON | C451: BRADFORD 7 | F451: F CHARD 3 | I451: LALOR 3 | K451: JONES
A452: BRIGHTON | C452: BLENKINSOP | F452: EMBLETON | I452: SMITH | K452: STAFFORD
A454: PORT MELBOURNE | C454: 3 | D454: 4 | E454: =C454*6+D454 -> 22 | G454: 10 | H454: 6 | I454: =G454*6+H454 -> 66 | K454: 12 | L454: 8 | M454: =K454*6+L454 -> 80 | O454: 17 | P454: 12 | Q454: =O454*6+P454 -> 114 | S454: CAMBERWELL
A455: CAMBERWELL | C455: 4 | D455: 8 | E455: =C455*6+D455 -> 32 | G455: 5 | H455: 9 | I455: =G455*6+H455 -> 39 | K455: 7 | L455: 12 | M455: =K455*6+L455 -> 54 | O455: 10 | P455: 12 | Q455: =O455*6+P455 -> 72 | S455: BREWER
A456: BEST PLAYERS
A457: PORT MELBOURNE | C457: WILSON | F457: SYKES | I457: WHARTON | L457: FRASER | N457: METHERALL | Q457: JOHNSON
A458: CAMBERWELL | C458: CLARKE | F458: DUFF | I458: HEDLEY | L458: ALWAY | N458: SCHNEIDER | Q458: HAYES
A459: GOALKICKERS
A460: PORT MELBOURNE | C460: SYKES 5 | F460: FRASER 4 | I460: MCDONALD 2 | L460: ALLEN 2 | N460: JOHNSON | Q460: WALSH | S460: BLACK | U460: ROSEWARNE
A461: CAMBERWELL | C461: SCHNEIDER 3 | F461: TEMPANY 2 | I461: WEST | K461: HEDLEY | M461: McGUINNESS | P461: WRIGHT | R461: ALLSOP
A463: ROUND 8 | E463: 4TH JUNE | J463: WEATHER | M463: SOUTH BREEZE DULL | S463: PLAYED AT
D464: 1ST QTR | H464: 2ND QTR | L464: 3RD QTR | P464: FINAL | S464: WILLIAMSTOWN
A465: WILLIAMSTOWN | C465: 3 | D465: 1 | E465: =C465*6+D465 -> 19 | G465: 6 | H465: 9 | I465: =G465*6+H465 -> 45 | K465: 8 | L465: 12 | M465: =K465*6+L465 -> 60 | O465: 11 | P465: 15 | Q465: =O465*6+P465 -> 81 | S465: UMPIRE | X465: LADDER | AB465: ROUND | AD465: 8
A466: BRUNSWICK | C466: 2 | D466: 1 | E466: =C466*6+D466 -> 13 | G466: 4 | H466: 2 | I466: =G466*6+H466 -> 26 | K466: 7 | L466: 5 | M466: =K466*6+L466 -> 47 | O466: 10 | P466: 8 | Q466: =O466*6+P466 -> 68 | S466: IRVING
A467: BEST PLAYERS | W467: TEAM | X467: W | Y467: L | Z467: D | AA467: FOR | AB467: AGST | AC467: % | AD467: PTS
A468: WILLIAMSTOWN | C468: MARTIN | E468: LINTON | H468: CURRAN | K468: SMITH | N468: CALLAHAN | Q468: TAAFE
A469: BRUNSWICK | C469: WEIR | E469: MULLENGER | H469: ROLFS | K469: MAY | N469: STANLEY | Q469: J SIMPSON | W469: PORT MELBOURNE | X469: 7 | Y469: 1 | Z469: 0 | AA469: 836 | AB469: 591 | AC469: 141.45516074450086 | AD469: 28
A470: GOALKICKERS | W470: MOORABBIN | X470: 7 | Y470: 1 | Z470: 0 | AA470: 719 | AB470: 520 | AC470: 138.26923076923077 | AD470: 28
A471: WILLIAMSTOWN | C471: LINTON 6 | F471: WOOKEY 2 | I471: CALLAHAN | L471: ANDERSON | N471: GEAR | W471: PRESTON | X471: 6 | Y471: 2 | Z471: 0 | AA471: 742 | AB471: 534 | AC471: 138.95 | AD471: 24
A472: BRUNSWICK | C472: McFARLANE 2 | F472: J SIMPSON | I472: HAYES | K472: JAMES | M472: McFEE | N472: NEILSON | P472: MAY | Q472: LEYDEN | S472: DILLON | W472: WILLIAMSTOWN | X472: 6 | Y472: 2 | Z472: 0 | AA472: 766 | AB472: 590 | AC472: 129.83050847457628 | AD472: 24
A474: COBURG | C474: 4 | D474: 0 | E474: =C474*6+D474 -> 24 | G474: 10 | H474: 1 | I474: =G474*6+H474 -> 61 | K474: 14 | L474: 3 | M474: =K474*6+L474 -> 87 | O474: 17 | P474: 5 | Q474: =O474*6+P474 -> 107 | S474: COBURG | W474: COBURG | X474: 5 | Y474: 3 | Z474: 0 | AA474: 728 | AB474: 581 | AC474: 125.3012048192771 | AD474: 20
A475: OAKLEIGH | C475: 3 | D475: 6 | E475: =C475*6+D475 -> 24 | G475: 7 | H475: 7 | I475: =G475*6+H475 -> 49 | K475: 11 | L475: 10 | M475: =K475*6+L475 -> 76 | O475: 13 | P475: 12 | Q475: =O475*6+P475 -> 90 | S475: ROBINSON | W475: PRAHRAN | X475: 5 | Y475: 3 | Z475: 0 | AA475: 746 | AB475: 677 | AC475: 110.19202363367799 | AD475: 20
A476: BEST PLAYERS | W476: NORTHCOTE | X476: 4 | Y476: 4 | Z476: 0 | AA476: 589 | AB476: 603 | AC476: 97.678275290215595 | AD476: 16
A477: COBURG | C477: HEWES | E477: HORSKINS | H477: GILL | K477: STARBUCK | N477: McTAGGART | Q477: SHORT | W477: BRUNSWICK | X477: 3 | Y477: 5 | Z477: 0 | AA477: 678 | AB477: 675 | AC477: 100.44 | AD477: 12
A478: OAKLEIGH | C478: SCOTT | E478: NICHOLSON | H478: PREECE | K478: GORDON | N478: HOWELL | Q478: WEBSTER | W478: OAKLEIGH | X478: 3 | Y478: 5 | Z478: 0 | AA478: 631 | AB478: 665 | AC478: 94.887218045112789 | AD478: 12
A479: GOALKICKERS | W479: SANDRINGHAM | X479: 3 | Y479: 5 | Z479: 0 | AA479: 665 | AB479: 777 | AC479: 85.585585585585591 | AD479: 12
A480: COBURG | C480: HORSKINS 6 | F480: HEWES 6 | I480: JONES | K480: MILLER | M480: YORK | O480: H WILKINSON | R480: CUFFE | W480: BOX HILL | X480: 3 | Y480: 5 | Z480: 0 | AA480: 591 | AB480: 698 | AC480: 84.670487106017191 | AD480: 12
A481: OAKLEIGH | C481: SCOTT 3 | F481: NICHOLSON 3 | I481: G WALSH 2 | L481: LAMBERT 2 | O481: PREECE | Q481: SCULLIN | S481: GORDON | W481: YARRAVILLE | X481: 2 | Y481: 6 | Z481: 0 | AA481: 611 | AB481: 741 | AC481: 82.456140350877192 | AD481: 8
W482: CAMBERWELL | X482: 1 | Y482: 7 | Z482: 0 | AA482: 561 | AB482: 820 | AC482: 68.41463414634147 | AD482: 4
A483: PRAHRAN | C483: 4 | D483: 3 | E483: =C483*6+D483 -> 27 | G483: 4 | H483: 7 | I483: =G483*6+H483 -> 31 | K483: 10 | L483: 10 | M483: =K483*6+L483 -> 70 | O483: 15 | P483: 10 | Q483: =O483*6+P483 -> 100 | S483: BOX HILL | W483: BRIGHTON | X483: 1 | Y483: 7 | Z483: 0 | AA483: 405 | AB483: 796 | AC483: 50.879396984924625 | AD483: 4
A484: BOX HILL | C484: 4 | D484: 3 | E484: =C484*6+D484 -> 27 | G484: 6 | H484: 10 | I484: =G484*6+H484 -> 46 | K484: 6 | L484: 13 | M484: =K484*6+L484 -> 49 | O484: 8 | P484: 16 | Q484: =O484*6+P484 -> 64 | S484: ROWE
A485: BEST PLAYERS
A486: PRAHRAN | C486: SHILLABEER | F486: HEALEY | I486: GAFFNEY | L486: R JONES | O486: HARVEY | Q486: MORROW
A487: BOX HILL | C487: WRIGHT | F487: RATTRAY | I487: WEBB | L487: HOUGHTON | O487: GREEN | Q487: KRONK
A488: GOALKICKERS
A489: PRAHRAN | C489: KINNABURGH 6 | F489: HARVEY 3 | I489: HART | K489: W JONES | M489: SHARP | O489: CLEAR | Q489: ELLIOTT | S489: ROSS
A490: BOX HILL | C490: DUNN 3 | F490: WEBB 3 | I490: BROWN | K490: JOHNSON
A492: PRESTON | C492: 4 | D492: 0 | E492: =C492*6+D492 -> 24 | G492: 9 | H492: 4 | I492: =G492*6+H492 -> 58 | K492: 14 | L492: 6 | M492: =K492*6+L492 -> 90 | O492: 20 | P492: 12 | Q492: =O492*6+P492 -> 132 | S492: PRESTON
A493: YARRAVILLE | C493: 3 | D493: 4 | E493: =C493*6+D493 -> 22 | G493: 4 | H493: 6 | I493: =G493*6+H493 -> 30 | K493: 10 | L493: 7 | M493: =K493*6+L493 -> 67 | O493: 11 | P493: 8 | Q493: =O493*6+P493 -> 74 | S493: GAMBLE
A494: BEST PLAYERS
A495: PRESTON | C495: CUSACK | F495: SWEET | I495: McLACHLAN | L495: CROCKER | O495: G OSBORNE | R495: WATT
A496: YARRAVILLE | C496: VANDERFEEN | F496: FRASER | I496: WILD | L496: HART | O496: HUGHES | R496: MARCHESI
A497: GOALKICKERS
A498: PRESTON | C498: F CHARD 7 | F498: BRADFORD 4 | I498: LALOR 2 | K498: G OSBORNE 2 | N498: FOLEY 2 | P498: HAYES 2 | R498: WATT
A499: YARRAVILLE | C499: HUGHES 5 | F499: VANDERFEEN 3 | J499: CHARLES | M499: GARLICK | O499: FRASER
A501: SANDRINGHAM | C501: 4 | D501: 0 | E501: =C501*6+D501 -> 24 | G501: 5 | H501: 1 | I501: =G501*6+H501 -> 31 | K501: 9 | L501: 3 | M501: =K501*6+L501 -> 57 | O501: 13 | P501: 5 | Q501: =O501*6+P501 -> 83 | S501: BEACH ROAD
A502: NORTHCOTE | C502: 2 | D502: 4 | E502: =C502*6+D502 -> 16 | G502: 7 | H502: 5 | I502: =G502*6+H502 -> 47 | K502: 12 | L502: 6 | M502: =K502*6+L502 -> 78 | O502: 12 | P502: 6 | Q502: =O502*6+P502 -> 78 | S502: BREWER
A503: BEST PLAYERS | S503: NORTHCOTE
A504: SANDRINGHAM | C504: CONNINGSBY | F504: KRAUSE | I504: GELAVIS | L504: EVANS | N504: BRIGHTON | Q504: FLETCHER
A505: NORTHCOTE | C505: DEVINE | F505: SEARLE | I505: PURDON | L505: STABB | N505: ALDRIDGE | Q505: WALKER
A506: GOALKICKERS
A507: SANDRINGHAM | C507: EVANS 5 | F507: HARPER 3 | I507: RANSOM 2 | L507: FLETCHER | N507: GELAVIS | P507: SHEARER
A508: NORTHCOTE | C508: PURDON 3 | F508: FRANCIS 2 | I508: DEANE 2 | K508: TULL 2 | M508: GIBBS | O508: GOUGH | Q508: SEARLE
A510: MOORABBIN | C510: 1 | D510: 2 | E510: =C510*6+D510 -> 8 | G510: 4 | H510: 7 | I510: =G510*6+H510 -> 31 | K510: 4 | L510: 12 | M510: =K510*6+L510 -> 36 | O510: 11 | P510: 16 | Q510: =O510*6+P510 -> 82 | S510: MOORABBIN
A511: CAMBERWELL | C511: 2 | D511: 2 | E511: =C511*6+D511 -> 14 | G511: 3 | H511: 3 | I511: =G511*6+H511 -> 21 | K511: 6 | L511: 7 | M511: =K511*6+L511 -> 43 | O511: 8 | P511: 10 | Q511: =O511*6+P511 -> 58 | S511: SMYTH
A512: BEST PLAYERS
A513: MOORABBIN | C513: LAWRENCE | F513: GILDER | I513: MANIE | L513: SUTHERLAND | O513: DYNON | Q513: GREEN
A514: CAMBERWELL | C514: MASON | F514: HEDLEY | I514: DUFF | L514: SKALBERG | O514: HOLYOAK | Q514: FARRELL
A515: GOALKICKERS
A516: MOORABBIN | C516: SCHOFIELD 4 | F516: McGAW 2 | I516: MORONEY 2 | L516: BARNES | N516: SUTHERLAND | Q516: LEHMANN
A517: CAMBERWELL | C517: SCHNEIDER 2 | F517: LANE 2 | H517: HAYES | J517: McGUINNESS | M517: JOHNSON | O517: HEDLEY
A519: PORT MELBOURNE | C519: 6 | D519: 4 | E519: =C519*6+D519 -> 40 | G519: 7 | H519: 7 | I519: =G519*6+H519 -> 49 | K519: 15 | L519: 12 | M519: =K519*6+L519 -> 102 | O519: 20 | P519: 15 | Q519: =O519*6+P519 -> 135 | S519: PORT MELBOURNE
A520: BRIGHTON | C520: 3 | D520: 1 | E520: =C520*6+D520 -> 19 | G520: 5 | H520: 3 | I520: =G520*6+H520 -> 33 | K520: 5 | L520: 4 | M520: =K520*6+L520 -> 34 | O520: 5 | P520: 6 | Q520: =O520*6+P520 -> 36 | S520: ROACH
A521: BEST PLAYERS
A522: PORT MELBOURNE | C522: WHARTON | F522: ALLEN | I522: WILSON | L522: FRASER | N522: JOHNSON | Q522: SYKES
A523: BRIGHTON | C523: POUND | F523: STEVENS | I523: HICKMAN | L523: FREEMAN | N523: STAFFORD | Q523: ALEXANDER
A524: GOALKICKERS
A525: PORT MELBOURNE | C525: BONNETT 5 | F525: ALLEN 3 | H525: MITCHELL 3 | K525: McDONALD 2 | N525: FRASER 2 | Q525: SYKES 2 | S525: WITHERS | V525: HARVEY | X525: BLACK
A526: BRIGHTON | C526: STAFFORD 2 | F526: SMITH | H526: EMBLETON | K526: WOOLSTENCROFT
A528: ROUND 9 | E528: 11TH JUNE | J528: WEATHER | O528: NORTH WEST WIND | S528: PLAYED AT
D529: 1ST QTR | H529: 2ND QTR | L529: 3RD QTR | P529: FINAL | S529: NORTHCOTE
A530: PRESTON | C530: 6 | D530: 1 | E530: =C530*6+D530 -> 37 | G530: 10 | H530: 3 | I530: =G530*6+H530 -> 63 | K530: 12 | L530: 5 | M530: =K530*6+L530 -> 77 | O530: 16 | P530: 6 | Q530: =O530*6+P530 -> 102 | S530: UMPIRE | X530: LADDER | AB530: ROUND | AD530: 9
A531: NORTHCOTE | C531: 2 | D531: 3 | E531: =C531*6+D531 -> 15 | G531: 4 | H531: 4 | I531: =G531*6+H531 -> 28 | K531: 5 | L531: 5 | M531: =K531*6+L531 -> 35 | O531: 7 | P531: 6 | Q531: =O531*6+P531 -> 48 | S531: ROWE
A532: BEST PLAYERS | W532: TEAM | X532: W | Y532: L | Z532: D | AA532: FOR | AB532: AGST | AC532: % | AD532: PTS
A533: PRESTON | C533: McBEAN | F533: K CHARD | I533: G OSBORNE | L533: COOPER | N533: L SWEET | Q533: HAYES
A534: NORTHCOTE | C534: POWELL | F534: JOHNSON | I534: F VAINS | L534: TULL | N534: D STEWART | Q534: WALKER | W534: PORT MELBOURNE | X534: 8 | Y534: 1 | Z534: 0 | AA534: 945 | AB534: 675 | AC534: 140 | AD534: 32
A535: GOALKICKERS | W535: MOORABBIN | X535: 8 | Y535: 1 | Z535: 0 | AA535: 812 | AB535: 597 | AC535: 136.01340033500838 | AD535: 32
A536: PRESTON | C536: F CHARD 4 | F536: FOLEY 3 | H536: G OSBORNE 3 | K536: HAYES 2 | M536: BRADFORD 2 | P536: JONES | R536: COOPER | W536: PRESTON | X536: 7 | Y536: 2 | Z536: 0 | AA536: 844 | AB536: 582 | AC536: 145.02 | AD536: 28
A537: NORTHCOTE | C537: PURDON 2 | F537: COLLINS | H537: D STEWART | K537: JOHNSON | M537: WILLIAMSON | P537: POWELL | W537: WILLIAMSTOWN | X537: 7 | Y537: 2 | Z537: 0 | AA537: 870 | AB537: 676 | AC537: 128.69822485207101 | AD537: 28
A539: CAMBERWELL | C539: 0 | D539: 4 | E539: =C539*6+D539 -> 4 | G539: 4 | H539: 12 | I539: =G539*6+H539 -> 36 | K539: 6 | L539: 12 | M539: =K539*6+L539 -> 48 | O539: 10 | P539: 18 | Q539: =O539*6+P539 -> 78 | S539: CAMBERWELL | W539: COBURG | X539: 5 | Y539: 4 | Z539: 0 | AA539: 814 | AB539: 685 | AC539: 118.83211678832117 | AD539: 20
A540: BRUNSWICK | C540: 1 | D540: 6 | E540: =C540*6+D540 -> 12 | G540: 6 | H540: 7 | I540: =G540*6+H540 -> 43 | K540: 8 | L540: 13 | M540: =K540*6+L540 -> 61 | O540: 10 | P540: 16 | Q540: =O540*6+P540 -> 76 | S540: ROWE | W540: PRAHRAN | X540: 5 | Y540: 4 | Z540: 0 | AA540: 828 | AB540: 766 | AC540: 108.09399477806788 | AD540: 20
A541: BEST PLAYERS | W541: BOX HILL | X541: 4 | Y541: 5 | Z541: 0 | AA541: 708 | AB541: 768 | AC541: 92.1875 | AD541: 16
A542: CAMBERWELL | C542: FARRELL | F542: HEDLEY | I542: SCHNEIDER | L542: McGUINNESS | O542: MILNE | Q542: DUFF | W542: NORTHCOTE | X542: 4 | Y542: 5 | Z542: 0 | AA542: 637 | AB542: 705 | AC542: 90.354609929078009 | AD542: 16
A543: BRUNSWICK | C543: SEYMOUR | F543: ROLFS | I543: McFARLANE | L543: NEILSON | O543: LOVETT | Q543: POLLARD | W543: SANDRINGHAM | X543: 4 | Y543: 5 | Z543: 0 | AA543: 754 | AB543: 859 | AC543: 87.776484284051222 | AD543: 16
A544: GOALKICKERS | W544: BRUNSWICK | X544: 3 | Y544: 6 | Z544: 0 | AA544: 754 | AB544: 753 | AC544: 100.13 | AD544: 12
A545: CAMBERWELL | C545: SABBATUCCI 3 | F545: McGUINNESS 2 | I545: TURNBULL | L545: ALWAY | N545: HAYES | P545: BENBOW | R545: HEDLEY | W545: OAKLEIGH | X545: 3 | Y545: 6 | Z545: 0 | AA545: 701 | AB545: 782 | AC545: 89.641943734015342 | AD545: 12
A546: BRUNSWICK | C546: McFARLANE 3 | F546: WEIR 2 | I546: SEYMOUR 2 | L546: HAYES | N546: POLLARD | Q546: LEYDEN | W546: YARRAVILLE | X546: 2 | Y546: 7 | Z546: 0 | AA546: 695 | AB546: 850 | AC546: 81.764705882352942 | AD546: 8
W547: CAMBERWELL | X547: 2 | Y547: 7 | Z547: 0 | AA547: 639 | AB547: 896 | AC547: 71.32 | AD547: 8
A548: MOORABBIN | C548: 2 | D548: 5 | E548: =C548*6+D548 -> 17 | G548: 4 | H548: 8 | I548: =G548*6+H548 -> 32 | K548: 11 | L548: 13 | M548: =K548*6+L548 -> 79 | O548: 13 | P548: 15 | Q548: =O548*6+P548 -> 93 | S548: ELSTERNWICK PARK | W548: BRIGHTON | X548: 1 | Y548: 8 | Z548: 0 | AA548: 482 | AB548: 889 | AC548: 54.21822272215973 | AD548: 4
A549: BRIGHTON | C549: 2 | D549: 1 | E549: =C549*6+D549 -> 13 | G549: 6 | H549: 5 | I549: =G549*6+H549 -> 41 | K549: 9 | L549: 6 | M549: =K549*6+L549 -> 60 | O549: 11 | P549: 11 | Q549: =O549*6+P549 -> 77 | S549: GAMBLE
A550: BEST PLAYERS
A551: MOORABBIN | C551: ARNFIELD | F551: RENWICK | I551: GILDER | L551: STANLEY | O551: LEHMANN | Q551: MANIE
A552: BRIGHTON | C552: ALEXANDER | F552: POUND | I552: KENNEDY | L552: EMBLETON | O552: STEVENS | Q552: J DAVIDSON
A553: GOALKICKERS
A554: MOORABBIN | C554: MORONEY 4 | F554: RENWICK 3 | I554: SCHOFIELD 2 | L554: LEHMANN 2 | O554: MANIE | Q554: PECK
A555: BRIGHTON | C555: ALEXANDER 4 | F555: KNIGHT 2 | I555: SMITH 2 | L555: J DAVIDSON | O555: HICKMAN | Q555: STEVENS
E556: 13TH JUNE | J556: QUEENS BIRTHDAY
A557: WILLIAMSTOWN | C557: 4 | D557: 4 | E557: =C557*6+D557 -> 28 | G557: 7 | H557: 10 | I557: =G557*6+H557 -> 52 | K557: 8 | L557: 14 | M557: =K557*6+L557 -> 62 | O557: 14 | P557: 20 | Q557: =O557*6+P557 -> 104 | S557: COBURG
A558: COBURG | C558: 4 | D558: 1 | E558: =C558*6+D558 -> 25 | G558: 8 | H558: 3 | I558: =G558*6+H558 -> 51 | K558: 13 | L558: 8 | M558: =K558*6+L558 -> 86 | O558: 13 | P558: 8 | Q558: =O558*6+P558 -> 86 | S558: MALLETT
A559: BEST PLAYERS
A560: WILLIAMSTOWN | C560: CALLAHAN | F560: SIMPSON | I560: RAMSAY | L560: WOOKEY | O560: TAAFE | R560: McPHERSON
A561: COBURG | C561: ROGAN | F561: MAHONEY | I561: HEWES | L561: McTAGGART | O561: H WILKINSON | R561: STARBUCK
A562: GOALKICKERS
A563: WILLIAMSTOWN | C563: CALLAHAN 3 | F563: LINTON 2 | I563: McPHERSON 2 | L563: GEAR 2 | N563: SMITH 2 | P563: KENT | R563: WOOKEY | U563: SIMPSON
A564: COBURG | C564: ROGAN 6 | F564: HEWES 4 | I564: HORSKINS | K564: GOULLET | M564: H WILKINSON
A566: SANDRINGHAM | C566: 4 | D566: 2 | E566: =C566*6+D566 -> 26 | G566: 10 | H566: 4 | I566: =G566*6+H566 -> 64 | K566: 11 | L566: 6 | M566: =K566*6+L566 -> 72 | O566: 13 | P566: 11 | Q566: =O566*6+P566 -> 89 | S566: TOORAK PARK
A567: PRAHRAN | C567: 4 | D567: 0 | E567: =C567*6+D567 -> 24 | G567: 7 | H567: 2 | I567: =G567*6+H567 -> 44 | K567: 10 | L567: 7 | M567: =K567*6+L567 -> 67 | O567: 12 | P567: 10 | Q567: =O567*6+P567 -> 82 | S567: ROACH
A568: BEST PLAYERS
A569: SANDRINGHAM | C569: HARPER | F569: CONNINGSBY | I569: GELAVIS | L569: SHEARER | O569: McMAHON | R569: KRAUSE
A570: PRAHRAN | C570: SHARP | F570: HOLLOW | I570: H BOYD | L570: GAFFNEY | O570: HART | R570: ROSS
A571: GOALKICKERS
A572: SANDRINGHAM | C572: HARPER 8 | F572: McMAHON 2 | I572: COGHLAN | K572: RANSOM | M572: FLETCHER
A573: PRAHRAN | C573: KINNABURGH 3 | F573: H BOYD 2 | I573: SHARP 2 | K573: C BOYD | M573: ROSS | O573: CLEAR | Q573: W JONES | T573: HARVEY
A575: BOX HILL | C575: 1 | D575: 3 | E575: =C575*6+D575 -> 9 | G575: 5 | H575: 7 | I575: =G575*6+H575 -> 37 | K575: 9 | L575: 12 | M575: =K575*6+L575 -> 66 | O575: 17 | P575: 15 | Q575: =O575*6+P575 -> 117 | S575: OAKLEIGH
A576: OAKLEIGH | C576: 4 | D576: 5 | E576: =C576*6+D576 -> 29 | G576: 7 | H576: 6 | I576: =G576*6+H576 -> 48 | K576: 7 | L576: 9 | M576: =K576*6+L576 -> 51 | O576: 10 | P576: 10 | Q576: =O576*6+P576 -> 70 | S576: SMYTH
A577: BEST PLAYERS
A578: BOX HILL | C578: DUNN | F578: IRVINE | I578: GREEN | K578: LOVE | M578: RATTRAY | P578: HOUGHTON
A579: OAKLEIGH | C579: WILLIAMS | F579: TEMME | I579: HILL | K579: GUY | M579: LAMBERT | P579: WEBSTER
A580: GOALKICKERS
A581: BOX HILL | C581: DUNN 5 | F581: BROWN 5 | I581: NICHOLSON 2 | L581: JOHNSTON | N581: LONSDALE | Q581: CAVANAGH | T581: STREET | V581: W BLUNDY
A582: OAKLEIGH | C582: LAMBERT 3 | F582: SCOTT 2 | I582: HOWELL 2 | L582: HILL | M582: SCULLIN | O582: PREECE
A584: PORT MELBOURNE | C584: 7 | D584: 5 | E584: =C584*6+D584 -> 47 | G584: 13 | H584: 7 | I584: =G584*6+H584 -> 85 | K584: 14 | L584: 8 | M584: =K584*6+L584 -> 92 | O584: 16 | P584: 13 | Q584: =O584*6+P584 -> 109 | S584: YARRAVILLE
A585: YARRAVILLE | C585: 3 | D585: 4 | E585: =C585*6+D585 -> 22 | G585: 5 | H585: 6 | I585: =G585*6+H585 -> 36 | K585: 12 | L585: 10 | M585: =K585*6+L585 -> 82 | O585: 12 | P585: 12 | Q585: =O585*6+P585 -> 84 | S585: IRVING
A586: BEST PLAYERS
A587: PORT MELBOURNE | C587: SYKES | E587: MILLER | H587: BONNETT | K587: JOHNSON | N587: METHERALL | Q587: SHANNON
A588: YARRAVILLE | C588: WILD | E588: J ROHLEDER | H588: VANDERFEEN | K588: GARLICK | N588: HUGHES | Q588: FRASER
A589: GOALKICKERS
A590: PORT MELBOURNE | C590: MILLER 6 | F590: BONNETT 4 | I590: SYKES 3 | K590: ATKINSON | N590: ALLEN | P590: JOHNSON
A591: YARRAVILLE | C591: SMALLWOOD 2 | F591: GARLICK 2 | I591: HUGHES 2 | K591: WILD 2 | M591: WILCOX | O591: BEECH | Q591: MASON | S591: S SMITH
A593: ROUND 10 | E593: 18TH JUNE | J593: WEATHER | M593: RAIN GROUNDS HEAVY | S593: PLAYED AT
D594: 1ST QTR | H594: 2ND QTR | L594: 3RD QTR | P594: FINAL | S594: PRESTON
A595: PRESTON | C595: 0 | D595: 1 | E595: =C595*6+D595 -> 1 | G595: 5 | H595: 1 | I595: =G595*6+H595 -> 31 | K595: 9 | L595: 3 | M595: =K595*6+L595 -> 57 | O595: 14 | P595: 5 | Q595: =O595*6+P595 -> 89 | S595: UMPIRE | X595: LADDER | AB595: ROUND | AD595: 10
A596: PRAHRAN | C596: 2 | D596: 5 | E596: =C596*6+D596 -> 17 | G596: 3 | H596: 5 | I596: =G596*6+H596 -> 23 | K596: 3 | L596: 7 | M596: =K596*6+L596 -> 25 | O596: 6 | P596: 8 | Q596: =O596*6+P596 -> 44 | S596: MALLETT
A597: BEST PLAYERS | W597: TEAM | X597: W | Y597: L | Z597: D | AA597: FOR | AB597: AGST | AC597: % | AD597: PTS
A598: PRESTON | C598: McBEAN | F598: M SWEET | I598: BRADFORD | L598: HOWARD | N598: CROCKER | Q598: L SWEET
A599: PRAHRAN | C599: JONES | F599: HEALEY | I599: WILSON | L599: C BOYD | N599: ELLIOTT | Q599: SHARP | W599: PORT MELBOURNE | X599: 9 | Y599: 1 | Z599: 0 | AA599: 1059 | AB599: 694 | AC599: 152.5936599423631 | AD599: 36
A600: GOALKICKERS | W600: MOORABBIN | X600: 9 | Y600: 1 | Z600: 0 | AA600: 911 | AB600: 648 | AC600: 140.58641975308643 | AD600: 36
A601: PRESTON | C601: BRADFORD 4 | F601: F CHARD 3 | I601: LALOR 2 | K601: HAYES 2 | M601: FOLEY | O601: BENNETT | Q601: G OSBORNE | W601: PRESTON | X601: 8 | Y601: 2 | Z601: 0 | AA601: 933 | AB601: 626 | AC601: 149.04 | AD601: 32
A602: PRAHRAN | C602: WILSON 2 | F602: C BOYD 2 | I602: CLEAR | K602: ELLIOTT | W602: WILLIAMSTOWN | X602: 8 | Y602: 2 | Z602: 0 | AA602: 930 | AB602: 732 | AC602: 127.04918032786885 | AD602: 32
A604: BOX HILL | C604: 2 | D604: 0 | E604: =C604*6+D604 -> 12 | G604: 5 | H604: 2 | I604: =G604*6+H604 -> 32 | K604: 9 | L604: 5 | M604: =K604*6+L604 -> 59 | O604: 11 | P604: 6 | Q604: =O604*6+P604 -> 72 | S604: BOX HILL | W604: COBURG | X604: 5 | Y604: 5 | Z604: 0 | AA604: 878 | AB604: 757 | AC604: 115.98414795244386 | AD604: 20
A605: COBURG | C605: 6 | D605: 2 | E605: =C605*6+D605 -> 38 | G605: 7 | H605: 3 | I605: =G605*6+H605 -> 45 | K605: 8 | L605: 3 | M605: =K605*6+L605 -> 51 | O605: 10 | P605: 4 | Q605: =O605*6+P605 -> 64 | S605: IRVING | W605: PRAHRAN | X605: 5 | Y605: 5 | Z605: 0 | AA605: 872 | AB605: 855 | AC605: 101.98830409356725 | AD605: 20
A606: BEST PLAYERS | W606: BOX HILL | X606: 5 | Y606: 5 | Z606: 0 | AA606: 780 | AB606: 832 | AC606: 93.75 | AD606: 20
A607: BOX HILL | C607: HOUGHTON | F607: IRVINE | I607: WEBB | K607: GREEN | N607: DUNN | Q607: KRONK | W607: SANDRINGHAM | X607: 5 | Y607: 5 | Z607: 0 | AA607: 823 | AB607: 927 | AC607: 88.781014023732467 | AD607: 20
A608: COBURG | C608: STARBUCK | F608: FEWKES | I608: SHORT | K608: McTAGGART | N608: H WILKINSON | Q608: J BRENNAN | W608: BRUNSWICK | X608: 4 | Y608: 6 | Z608: 0 | AA608: 828 | AB608: 781 | AC608: 106.02 | AD608: 16
A609: GOALKICKERS | W609: NORTHCOTE | X609: 4 | Y609: 6 | Z609: 0 | AA609: 656 | AB609: 819 | AC609: 80.097680097680097 | AD609: 16
A610: BOX HILL | C610: BROWN 4 | F610: WEBB 3 | I610: NICHOLSON 2 | L610: DUNN | N610: HOUGHTON | W610: OAKLEIGH | X610: 3 | Y610: 7 | Z610: 0 | AA610: 769 | AB610: 851 | AC610: 90.364277320799061 | AD610: 12
A611: COBURG | C611: H WILKINSON 3 | F611: HEWES 2 | I611: McCOLL | K611: J BRENNAN | N611: GOULLET | Q611: ROGAN | S611: CANNAN | W611: YARRAVILLE | X611: 2 | Y611: 8 | Z611: 0 | AA611: 746 | AB611: 949 | AC611: 78.609062170706011 | AD611: 8
W612: CAMBERWELL | X612: 2 | Y612: 8 | Z612: 0 | AA612: 695 | AB612: 956 | AC612: 72.7 | AD612: 8
A613: PORT MELBOURNE | C613: 3 | D613: 6 | E613: =C613*6+D613 -> 24 | G613: 6 | H613: 12 | I613: =G613*6+H613 -> 48 | K613: 7 | L613: 16 | M613: =K613*6+L613 -> 58 | O613: 16 | P613: 18 | Q613: =O613*6+P613 -> 114 | S613: PORT MELBOURNE | W613: BRIGHTON | X613: 1 | Y613: 9 | Z613: 0 | AA613: 510 | AB613: 963 | AC613: 52.9595015576324 | AD613: 4
A614: NORTHCOTE | C614: 1 | D614: 3 | E614: =C614*6+D614 -> 9 | G614: 1 | H614: 3 | I614: =G614*6+H614 -> 9 | K614: 1 | L614: 11 | M614: =K614*6+L614 -> 17 | O614: 1 | P614: 13 | Q614: =O614*6+P614 -> 19 | S614: ROBINSON
A615: BEST PLAYERS
A616: PORT MELBOURNE | C616: JOHNSON | F616: WITHERS | I616: MILLER | L616: BRAGG | O616: FRASER | R616: ATKINSON
A617: NORTHCOTE | C617: POWELL | F617: STABB | I617: WOOLNOUGH | L617: ALDRIDGE | O617: F VAINS | R617: PURDON
A618: GOALKICKERS
A619: PORT MELBOURNE | C619: MILLER 6 | F619: BRAGG 3 | I619: BONNETT 2 | L619: ALLEN 2 | N619: FRASER | P619: SYKES | R619: OLDFIELD
A620: NORTHCOTE | C620: PURDON
A622: SANDRINGHAM | C622: 3 | D622: 1 | E622: =C622*6+D622 -> 19 | G622: 5 | H622: 4 | I622: =G622*6+H622 -> 34 | K622: 8 | L622: 9 | M622: =K622*6+L622 -> 57 | O622: 10 | P622: 9 | Q622: =O622*6+P622 -> 69 | S622: BEACH ROAD
A623: OAKLEIGH | C623: 2 | D623: 1 | E623: =C623*6+D623 -> 13 | G623: 6 | H623: 2 | I623: =G623*6+H623 -> 38 | K623: 7 | L623: 3 | M623: =K623*6+L623 -> 45 | O623: 10 | P623: 8 | Q623: =O623*6+P623 -> 68 | S623: ROWE
A624: BEST PLAYERS
A625: SANDRINGHAM | C625: CONNINSBY | F625: DAVIDSON | I625: McMAHON | L625: GELAVIS | O625: EVANS | Q625: HARPER
A626: OAKLEIGH | C626: GUY | F626: HOWELL | I626: TEMME | L626: I'ANSON | O626: HILL | Q626: WEBSTER
A627: GOALKICKERS
A628: SANDRINGHAM | C628: HARPER 4 | F628: GELAVIS 2 | I628: G CLARKE | K628: RANSOM | M628: SHEARER | O628: DAVIDSON
A629: OAKLEIGH | C629: LONIE 4 | F629: SHAW 3 | I629: NICHOLSON | L629: WEBSTER | O629: HOWELL
A631: BRUNSWICK | C631: 2 | D631: 3 | E631: =C631*6+D631 -> 15 | G631: 5 | H631: 7 | I631: =G631*6+H631 -> 37 | K631: 6 | L631: 10 | M631: =K631*6+L631 -> 46 | O631: 10 | P631: 14 | Q631: =O631*6+P631 -> 74 | S631: BRUNSWICK
A632: BRIGHTON | C632: 0 | D632: 1 | E632: =C632*6+D632 -> 1 | G632: 1 | H632: 2 | I632: =G632*6+H632 -> 8 | K632: 3 | L632: 2 | M632: =K632*6+L632 -> 20 | O632: 4 | P632: 4 | Q632: =O632*6+P632 -> 28 | S632: SMYTH/DAVIES
A633: BEST PLAYERS
A634: BRUNSWICK | C634: NEILSON | F634: POLLARD | I634: WEIR | K634: STANLEY | M634: MAY | P634: JAMES
A635: BRIGHTON | C635: POUND | F635: J DAVIDSON | I635: HICKMAN | K635: FREEMAN | M635: JOSTLEAR | P635: EMBLETON
A636: GOALKICKERS
A637: BRUNSWICK | C637: STANLEY 3 | F637: LOVETT 2 | I637: WEIR | J637: L POLLARD | M637: HAYES | O637: McFEE | Q637: DILLON
A638: BRIGHTON | C638: GRIENKE 2 | F638: KNIGHT | I638: OLARENSHAW
A640: WILLIAMSTOWN | C640: 0 | D640: 0 | E640: =C640*6+D640 -> 0 | G640: 3 | H640: 8 | I640: =G640*6+H640 -> 26 | K640: 4 | L640: 8 | M640: =K640*6+L640 -> 32 | O640: 8 | P640: 12 | Q640: =O640*6+P640 -> 60 | S640: WILLIAMSTOWN
A641: CAMBERWELL | C641: 5 | D641: 6 | E641: =C641*6+D641 -> 36 | G641: 5 | H641: 7 | I641: =G641*6+H641 -> 37 | K641: 7 | L641: 13 | M641: =K641*6+L641 -> 55 | O641: 7 | P641: 14 | Q641: =O641*6+P641 -> 56 | S641: ROACH
A642: BEST PLAYERS
A643: WILLIAMSTOWN | C643: SIMS | E643: LINTON | H643: FISHER | K643: TAAFE | N643: CURRAN | Q643: MUNDAY
A644: CAMBERWELL | C644: HEDLEY | E644: DUFF | H644: SABBATUCCI | K644: JOHNSON | N644: HOLYOAK | Q644: ALLSOP
A645: GOALKICKERS
A646: WILLIAMSTOWN | C646: McPHERSON 2 | F646: SIMPSON 2 | I646: R JONES 2 | L646: LINTON | N646: FISHER
A647: CAMBERWELL | C647: ALLSOP 2 | F647: SABBATUCCI 2 | J647: HEDLEY | L647: TURNBULL | N647: DUGDALE
A649: MOORABBIN | C649: 0 | D649: 4 | E649: =C649*6+D649 -> 4 | G649: 6 | H649: 10 | I649: =G649*6+H649 -> 46 | K649: 8 | L649: 12 | M649: =K649*6+L649 -> 60 | O649: 13 | P649: 21 | Q649: =O649*6+P649 -> 99 | S649: MOORABBIN
A650: YARRAVILLE | C650: 3 | D650: 3 | E650: =C650*6+D650 -> 21 | G650: 6 | H650: 3 | I650: =G650*6+H650 -> 39 | K650: 7 | L650: 7 | M650: =K650*6+L650 -> 49 | O650: 7 | P650: 9 | Q650: =O650*6+P650 -> 51 | S650: ALLEN
A651: BEST PLAYERS
A652: MOORABBIN | C652: LAWRENCE | F652: MORONEY | I652: ARNFIELD | L652: McGAW | O652: STANLEY | R652: OSTLE
A653: YARRAVILLE | C653: J ROHLEDER | F653: WILD | I653: JONES | L653: S SMITH | O653: MASON | R653: FRASER
A654: GOALKICKERS
A655: MOORABBIN | C655: ARNFIELD 6 | F655: McGAW 3 | I655: MORONEY 2 | L655: SCHOFIELD | N655: LEHMANN
A656: YARRAVILLE | C656: CHARLES 2 | F656: WILCOX | H656: HUGHES | J656: N ROHLEDER | M656: MASON | O656: FRASER
A658: ROUND 11 | E658: 25TH JUNE | J658: WEATHER | M658: WEST WIND GROUNDS HEAVY | S658: PLAYED AT
D659: 1ST QTR | H659: 2ND QTR | L659: 3RD QTR | P659: FINAL | S659: TOORAK PARK
A660: PORT MELBOURNE | C660: 2 | D660: 5 | E660: =C660*6+D660 -> 17 | G660: 5 | H660: 8 | I660: =G660*6+H660 -> 38 | K660: 9 | L660: 13 | M660: =K660*6+L660 -> 67 | O660: 11 | P660: 14 | Q660: =O660*6+P660 -> 80 | S660: UMPIRE | X660: LADDER | AB660: ROUND | AD660: 11
A661: PRAHRAN | C661: 3 | D661: 1 | E661: =C661*6+D661 -> 19 | G661: 5 | H661: 3 | I661: =G661*6+H661 -> 33 | K661: 7 | L661: 5 | M661: =K661*6+L661 -> 47 | O661: 11 | P661: 9 | Q661: =O661*6+P661 -> 75 | S661: ROWE
A662: BEST PLAYERS | W662: TEAM | X662: W | Y662: L | Z662: D | AA662: FOR | AB662: AGST | AC662: % | AD662: PTS
A663: PORT MELBOURNE | C663: ALLEN | F663: METHERALL | I663: J WILSON | L663: BRAGG | N663: WHARTON | Q663: MILLER
A664: PRAHRAN | C664: R WILSON | F664: C BOYD | I664: HARVEY | L664: GAFFNEY | N664: SHARP | Q664: H BOYD | W664: PORT MELBOURNE | X664: 10 | Y664: 1 | Z664: 0 | AA664: 1139 | AB664: 769 | AC664: 148.11443433029908 | AD664: 40
A665: GOALKICKERS | W665: MOORABBIN | X665: 10 | Y665: 1 | Z665: 0 | AA665: 1000 | AB665: 697 | AC665: 143.47202295552367 | AD665: 40
A666: PORT MELBOURNE | C666: MILLER 3 | F666: ALLEN 3 | I666: BONNETT 2 | L666: SUMMERS | O666: LAFFEY | Q666: McDONALD | W666: PRESTON | X666: 9 | Y666: 2 | Z666: 0 | AA666: 985 | AB666: 670 | AC666: 147.01 | AD666: 36
A667: PRAHRAN | C667: WILSON 4 | F667: SHARP 3 | I667: HARVEY 2 | L667: HART | N667: SNOW | W667: WILLIAMSTOWN | X667: 9 | Y667: 2 | Z667: 0 | AA667: 989 | AB667: 789 | AC667: 125.34854245880862 | AD667: 36
A669: WILLIAMSTOWN | C669: 2 | D669: 1 | E669: =C669*6+D669 -> 13 | G669: 5 | H669: 3 | I669: =G669*6+H669 -> 33 | K669: 6 | L669: 4 | M669: =K669*6+L669 -> 40 | O669: 9 | P669: 5 | Q669: =O669*6+P669 -> 59 | S669: BOX HILL | W669: SANDRINGHAM | X669: 6 | Y669: 5 | Z669: 0 | AA669: 892 | AB669: 993 | AC669: 89.828801611278948 | AD669: 24
A670: BOX HILL | C670: 1 | D670: 6 | E670: =C670*6+D670 -> 12 | G670: 2 | H670: 6 | I670: =G670*6+H670 -> 18 | K670: 7 | L670: 6 | M670: =K670*6+L670 -> 48 | O670: 8 | P670: 9 | Q670: =O670*6+P670 -> 57 | S670: ROBINSON | W670: COBURG | X670: 5 | Y670: 6 | Z670: 0 | AA670: 944 | AB670: 826 | AC670: 114.28571428571429 | AD670: 20
A671: BEST PLAYERS | W671: BRUNSWICK | X671: 5 | Y671: 6 | Z671: 0 | AA671: 934 | AB671: 836 | AC671: 111.72 | AD671: 20
A672: WILLIAMSTOWN | C672: MARTIN | E672: MUNDAY | H672: SIMS | K672: SIMPSON | N672: CALLAHAN | Q672: WHITTAKER | W672: PRAHRAN | X672: 5 | Y672: 6 | Z672: 0 | AA672: 947 | AB672: 935 | AC672: 101.28342245989305 | AD672: 20
A673: BOX HILL | C673: DUNN | E673: KRONK | H673: WEBB | K673: WRIGHT | N673: LOVE | Q673: IRVINE | W673: BOX HILL | X673: 5 | Y673: 6 | Z673: 0 | AA673: 837 | AB673: 891 | AC673: 93.939393939393938 | AD673: 20
A674: GOALKICKERS | W674: NORTHCOTE | X674: 4 | Y674: 7 | Z674: 0 | AA674: 705 | AB674: 908 | AC674: 77.643171806167402 | AD674: 16
A675: WILLIAMSTOWN | C675: McPHERSON 5 | F675: LINTON | H675: GEAR | J675: SIMPSON | L675: CALLAHAN | W675: OAKLEIGH | X675: 3 | Y675: 8 | Z675: 0 | AA675: 813 | AB675: 903 | AC675: 90.033222591362133 | AD675: 12
A676: BOX HILL | C676: DUNN 5 | F676: BROWN 2 | I676: NICHOLSON | W676: CAMBERWELL | X676: 3 | Y676: 8 | Z676: 0 | AA676: 769 | AB676: 1025 | AC676: 75.02 | AD676: 12
W677: YARRAVILLE | X677: 2 | Y677: 9 | Z677: 0 | AA677: 801 | AB677: 1055 | AC677: 75.924170616113742 | AD677: 8
A678: SANDRINGHAM | C678: 4 | D678: 3 | E678: =C678*6+D678 -> 27 | G678: 7 | H678: 3 | I678: =G678*6+H678 -> 45 | K678: 10 | L678: 7 | M678: =K678*6+L678 -> 67 | O678: 10 | P678: 9 | Q678: =O678*6+P678 -> 69 | S678: COBURG | W678: BRIGHTON | X678: 1 | Y678: 10 | Z678: 0 | AA678: 579 | AB678: 1037 | AC678: 55.834136933461906 | AD678: 4
A679: COBURG | C679: 0 | D679: 4 | E679: =C679*6+D679 -> 4 | G679: 3 | H679: 10 | I679: =G679*6+H679 -> 28 | K679: 7 | L679: 11 | M679: =K679*6+L679 -> 53 | O679: 9 | P679: 12 | Q679: =O679*6+P679 -> 66 | S679: ALLEN
A680: BEST PLAYERS
A681: SANDRINGHAM | C681: FITZPATRICK | F681: CONNINGSBY | I681: RANSOM | L681: EVANS | O681: W McMAHON | R681: DAVIDSON
A682: COBURG | C682: H WILKINSON | F682: GILL | I682: McCOLL | L682: HORSKINS | O682: ROGAN | R682: SHORT
A683: GOALKICKERS
A684: SANDRINGHAM | C684: EVANS 2 | F684: W McMAHON 2 | J684: RANSOM 2 | M684: HARPER 2 | O684: DAVIDSON | Q684: LAFFEY
A685: COBURG | C685: HEWES 3 | F685: ROGAN 2 | I685: H WILKINSON 2 | M685: GOULLET 2
A687: BRUNSWICK | C687: 5 | D687: 8 | E687: =C687*6+D687 -> 38 | G687: 7 | H687: 10 | I687: =G687*6+H687 -> 52 | K687: 12 | L687: 15 | M687: =K687*6+L687 -> 87 | O687: 15 | P687: 16 | Q687: =O687*6+P687 -> 106 | S687: YARRAVILLE
A688: YARRAVILLE | C688: 2 | D688: 0 | E688: =C688*6+D688 -> 12 | G688: 3 | H688: 1 | I688: =G688*6+H688 -> 19 | K688: 3 | L688: 4 | M688: =K688*6+L688 -> 22 | O688: 8 | P688: 7 | Q688: =O688*6+P688 -> 55 | S688: MALLETT
A689: BEST PLAYERS
A690: BRUNSWICK | C690: WEIR | E690: POLLARD | H690: McFARLANE | K690: LOVETT | N690: SIMPSON | Q690: SEYMOUR
A691: YARRAVILLE | C691: HUGHES | E691: NICHOLLS | H691: GARLICK | K691: N ROHLEDER | N691: JONES | Q691: WILD
A692: GOALKICKERS
A693: BRUNSWICK | C693: DILLON 5 | E693: WEIR 4 | G693: CLUES | I693: McFARLANE | L693: MULLENGER | O693: HAYES | Q693: SEYMOUR | T693: LOVETT
A694: YARRAVILLE | C694: MASON 3 | E694: HUGHES 2 | H694: FRASER | J694: ANDERSON | M694: WILCOX
A696: CAMBERWELL | C696: 6 | D696: 4 | E696: =C696*6+D696 -> 40 | G696: 8 | H696: 8 | I696: =G696*6+H696 -> 56 | K696: 9 | L696: 13 | M696: =K696*6+L696 -> 67 | O696: 10 | P696: 14 | Q696: =O696*6+P696 -> 74 | S696: ELSTERNWICK PARK
A697: BRIGHTON | C697: 1 | D697: 2 | E697: =C697*6+D697 -> 8 | G697: 4 | H697: 12 | I697: =G697*6+H697 -> 36 | K697: 6 | L697: 13 | M697: =K697*6+L697 -> 49 | O697: 9 | P697: 15 | Q697: =O697*6+P697 -> 69 | S697: BEITZEL
A698: BEST PLAYERS
A699: CAMBERWELL | C699: HOLYOAK | F699: MASON | I699: FARRELL | L699: McGUINNESS | O699: CLARKE | R699: DEAGAN
A700: BRIGHTON | C700: I DAVIDSON | F700: POUND | I700: KNIGHT | L700: BLACKMORE | O700: FREEMAN | R700: COURTNEY
A701: GOALKICKERS
A702: CAMBERWELL | C702: McGUINNESS 3 | F702: DUGDALE 2 | I702: HEDLEY 2 | L702: HOLYOAK | N702: TURNBULL | Q702: SCHNEIDER
A703: BRIGHTON | C703: FREEMAN 3 | F703: KNIGHT 2 | I703: SMITH | K703: HICKMAN | N703: JOSTLEAR | Q703: I DAVIDSON
A705: MOORABBIN | C705: 4 | D705: 4 | E705: =C705*6+D705 -> 28 | G705: 9 | H705: 6 | I705: =G705*6+H705 -> 60 | K705: 10 | L705: 10 | M705: =K705*6+L705 -> 70 | O705: 13 | P705: 11 | Q705: =O705*6+P705 -> 89 | S705: NORTHCOTE
A706: NORTHCOTE | C706: 1 | D706: 1 | E706: =C706*6+D706 -> 7 | G706: 4 | H706: 1 | I706: =G706*6+H706 -> 25 | K706: 6 | L706: 4 | M706: =K706*6+L706 -> 40 | O706: 7 | P706: 7 | Q706: =O706*6+P706 -> 49 | S706: ROACH
A707: BEST PLAYERS
A708: MOORABBIN | C708: SCHOFIELD | F708: GREEN | I708: McGAW | L708: MURPHY | O708: K BOYD | R708: GILDER
A709: NORTHCOTE | C709: J VAINS | F709: GIBBS | I709: JOHNSON | L709: GOUGH | O709: C POWELL | R709: TULL
A710: GOALKICKERS
A711: MOORABBIN | C711: SCHOFIELD 7 | F711: McGAW 3 | I711: BARNES 2 | L711: SUTHERLAND
A712: NORTHCOTE | C712: TULL 4 | E712: GOUGH | G712: GIBBS | I712: PURDON
A714: PRESTON | C714: 2 | D714: 5 | E714: =C714*6+D714 -> 17 | G714: 5 | H714: 8 | I714: =G714*6+H714 -> 38 | K714: 6 | L714: 8 | M714: =K714*6+L714 -> 44 | O714: 7 | P714: 10 | Q714: =O714*6+P714 -> 52 | S714: OAKLEIGH
A715: OAKLEIGH | C715: 1 | D715: 4 | E715: =C715*6+D715 -> 10 | G715: 3 | H715: 7 | I715: =G715*6+H715 -> 25 | K715: 5 | L715: 11 | M715: =K715*6+L715 -> 41 | O715: 5 | P715: 14 | Q715: =O715*6+P715 -> 44 | S715: BREWER
A716: BEST PLAYERS
A717: PRESTON | C717: FOLEY | E717: HENRYS | H717: BRADFORD | K717: McBEAN | N717: LALOR | Q717: OSBORNE
A718: OAKLEIGH | C718: GUY | E718: TRMME | H718: MUNYARD | K718: HILL | N718: LAMBERT | Q718: SCOTT
A719: GOALKICKERS
A720: PRESTON | C720: FOLEY 3 | E720: OSBORNE | H720: F CHARD | K720: LALOR | M720: BLAKE
A721: OAKLEIGH | C721: LONIE 2 | E721: COLLINS | H721: SHAW | K721: WEBSTER
A723: ROUND 12 | E723: 2ND JULY | J723: WEATHER | M723: SOUTH EAST BREEZE DULL | S723: PLAYED AT
D724: 1ST QTR | H724: 2ND QTR | L724: 3RD QTR | P724: FINAL | S724: PRESTON
A725: PRESTON | C725: 3 | D725: 3 | E725: =C725*6+D725 -> 21 | G725: 5 | H725: 7 | I725: =G725*6+H725 -> 37 | K725: 12 | L725: 8 | M725: =K725*6+L725 -> 80 | O725: 14 | P725: 9 | Q725: =O725*6+P725 -> 93 | S725: UMPIRE | X725: LADDER | AB725: ROUND | AD725: 12
A726: COBURG | C726: 2 | D726: 1 | E726: =C726*6+D726 -> 13 | G726: 3 | H726: 1 | I726: =G726*6+H726 -> 19 | K726: 4 | L726: 5 | M726: =K726*6+L726 -> 29 | O726: 10 | P726: 8 | Q726: =O726*6+P726 -> 68 | S726: ROBINSON
A727: BEST PLAYERS | W727: TEAM | X727: W | Y727: L | Z727: D | AA727: FOR | AB727: AGST | AC727: % | AD727: PTS
A728: PRESTON | C728: BRADFORD | F728: COOPER | I728: F CHARD | L728: CROCKER | N728: L SWEET | Q728: FOLEY
A729: COBURG | C729: SANDLANT | F729: CONDON | I729: FEWKES | L729: MAHONEY | N729: HORSKINS | Q729: H WILKINSON | W729: MOORABBIN | X729: 11 | Y729: 1 | Z729: 0 | AA729: 1115 | AB729: 752 | AC729: 148.27127659574469 | AD729: 44
A730: GOALKICKERS | Q730: JEFFREY | W730: PORT MELBOURNE | X730: 11 | Y730: 1 | Z730: 0 | AA730: 1254 | AB730: 864 | AC730: 145.13888888888889 | AD730: 44
A731: PRESTON | C731: F CHARD 4 | F731: FOLEY 2 | H731: BRADFORD 2 | K731: WATT 2 | M731: G OSBORNE | P731: LALOR | R731: K CHARD | W731: PRESTON | X731: 10 | Y731: 2 | Z731: 0 | AA731: 1078 | AB731: 738 | AC731: 146.07 | AD731: 40
A732: COBURG | C732: G McMAHON 3 | F732: HEWES 2 | I732: H WILKINSON 2 | M732: STARBUCK 2 | P732: GOULLET | W732: WILLIAMSTOWN | X732: 10 | Y732: 2 | Z732: 0 | AA732: 1099 | AB732: 816 | AC732: 134.68137254901961 | AD732: 40
A734: MOORABBIN | C734: 3 | D734: 5 | E734: =C734*6+D734 -> 23 | G734: 10 | H734: 9 | I734: =G734*6+H734 -> 69 | K734: 11 | L734: 14 | M734: =K734*6+L734 -> 80 | O734: 16 | P734: 19 | Q734: =O734*6+P734 -> 115 | S734: MOORABBIN | W734: BRUNSWICK | X734: 6 | Y734: 6 | Z734: 0 | AA734: 1018 | AB734: 876 | AC734: 116.21 | AD734: 24
A735: PRAHRAN | C735: 2 | D735: 1 | E735: =C735*6+D735 -> 13 | G735: 3 | H735: 1 | I735: =G735*6+H735 -> 19 | K735: 5 | L735: 4 | M735: =K735*6+L735 -> 34 | O735: 8 | P735: 7 | Q735: =O735*6+P735 -> 55 | S735: BEITZEL | W735: BOX HILL | X735: 6 | Y735: 6 | Z735: 0 | AA735: 959 | AB735: 979 | AC735: 97.95709908069459 | AD735: 24
A736: BEST PLAYERS | W736: SANDRINGHAM | X736: 6 | Y736: 6 | Z736: 0 | AA736: 980 | AB736: 1115 | AC736: 87.892376681614351 | AD736: 24
A737: MOORABBIN | C737: GREEN | E737: DYNON | H737: GILDER | K737: SCHOFIELD | N737: MURRAY | Q737: MORONEY | W737: COBURG | X737: 5 | Y737: 7 | Z737: 0 | AA737: 1012 | AB737: 919 | AC737: 110.11969532100109 | AD737: 20
A738: PRAHRAN | C738: GAFFNEY | E738: PLAIN | H738: WILSON | K738: ROY JONES | N738: C BOYD | Q738: HARVEY | W738: PRAHRAN | X738: 5 | Y738: 7 | Z738: 0 | AA738: 1002 | AB738: 1050 | AC738: 95.428571428571431 | AD738: 20
A739: GOALKICKERS | W739: NORTHCOTE | X739: 4 | Y739: 8 | Z739: 0 | AA739: 745 | AB739: 992 | AC739: 75.100806451612897 | AD739: 16
A740: MOORABBIN | C740: SCHOFIELD 7 | F740: LEHMANN 3 | I740: SUTHERLAND 2 | L740: MORONEY 2 | O740: McGAW | Q740: ARNFIELD | W740: OAKLEIGH | X740: 3 | Y740: 9 | Z740: 0 | AA740: 908 | AB740: 1018 | AC740: 89.194499017681736 | AD740: 12
A741: PRAHRAN | C741: HARVEY 2 | F741: WILSON 2 | I741: SNOW | K741: C BOYD | M741: KINNABURGH | P741: SHARP | W741: YARRAVILLE | X741: 3 | Y741: 9 | Z741: 0 | AA741: 868 | AB741: 1105 | AC741: 78.552036199095028 | AD741: 12
W742: CAMBERWELL | X742: 3 | Y742: 9 | Z742: 0 | AA742: 819 | AB742: 1092 | AC742: 75 | AD742: 12
A743: BOX HILL | C743: 4 | D743: 4 | E743: =C743*6+D743 -> 28 | G743: 7 | H743: 5 | I743: =G743*6+H743 -> 47 | K743: 12 | L743: 14 | M743: =K743*6+L743 -> 86 | O743: 18 | P743: 14 | Q743: =O743*6+P743 -> 122 | S743: BEACH ROAD | W743: BRIGHTON | X743: 1 | Y743: 11 | Z743: 0 | AA743: 606 | AB743: 1147 | AC743: 52.833478639930256 | AD743: 4
A744: SANDRINGHAM | C744: 6 | D744: 4 | E744: =C744*6+D744 -> 40 | G744: 7 | H744: 9 | I744: =G744*6+H744 -> 51 | K744: 8 | L744: 11 | M744: =K744*6+L744 -> 59 | O744: 12 | P744: 16 | Q744: =O744*6+P744 -> 88 | S744: MALLETT
A745: BEST PLAYERS
A746: BOX HILL | C746: DUNN | F746: GREEN | I746: HOUGHTON | L746: WEBB | N746: RATTRAY | Q746: LONSDALE
A747: SANDRINGHAM | C747: DAVIDSON | F747: CONNINGSBY | I747: KRAUSE | L747: RANSOM | N747: JOHNSON | Q747: R HARPER
A748: GOALKICKERS
A749: BOX HILL | C749: BROWN 5 | F749: LONSDALE 4 | I749: DUNN 3 | K749: LOVE 2 | M749: BLUNDY 2 | P749: WEBB 2
A750: SANDRINGHAM | C750: B HARPER 3 | F750: EVANS 3 | I750: DAVIDSON 2 | L750: RANSOM | N750: R HARPER | Q750: McMAHON | T750: G CLARKE
A752: BRUNSWICK | C752: 1 | D752: 3 | E752: =C752*6+D752 -> 9 | G752: 3 | H752: 8 | I752: =G752*6+H752 -> 26 | K752: 10 | L752: 10 | M752: =K752*6+L752 -> 70 | O752: 12 | P752: 12 | Q752: =O752*6+P752 -> 84 | S752: BRUNSWICK
A753: NORTHCOTE | C753: 1 | D753: 2 | E753: =C753*6+D753 -> 8 | G753: 3 | H753: 5 | I753: =G753*6+H753 -> 23 | K753: 4 | L753: 6 | M753: =K753*6+L753 -> 30 | O753: 5 | P753: 10 | Q753: =O753*6+P753 -> 40 | S753: IRVING
A754: BEST PLAYERS
A755: BRUNSWICK | C755: MULLENGER | F755: YEA | I755: LOVETT | K755: JAMES | N755: McFARLANE | Q755: DILLON
A756: NORTHCOTE | C756: STABB | F756: WALKER | I756: J VAINS | K756: GOUGH | N756: COLLINS | Q756: ALDRIDGE
A757: GOALKICKERS
A758: BRUNSWICK | C758: ROWE 2 | E758: CLUES 2 | G758: STANLEY 2 | J758: JAMES 2 | L758: DILLON | N758: NEILSON | P758: LOVETT | R758: WEIR
A759: NORTHCOTE | C759: GOUGH 2 | F759: TULL | H759: COLLINS | J759: WOOLNOUGH
A761: YARRAVILLE | C761: 3 | D761: 0 | E761: =C761*6+D761 -> 18 | G761: 8 | H761: 1 | I761: =G761*6+H761 -> 49 | K761: 8 | L761: 2 | M761: =K761*6+L761 -> 50 | O761: 10 | P761: 7 | Q761: =O761*6+P761 -> 67 | S761: CAMBERWELL
A762: CAMBERWELL | C762: 1 | D762: 5 | E762: =C762*6+D762 -> 11 | G762: 3 | H762: 11 | I762: =G762*6+H762 -> 29 | K762: 4 | L762: 17 | M762: =K762*6+L762 -> 41 | O762: 5 | P762: 20 | Q762: =O762*6+P762 -> 50 | S762: GODING
A763: BEST PLAYERS
A764: YARRAVILLE | C764: J ROHLEDER | F764: HUGHES | I764: ANDERSON | L764: S SMITH | O764: WILCOX | Q764: VANDERFEEN
A765: CAMBERWELL | C765: SCHNEIDER | F765: HOLYOAK | I765: DUFF | L765: DEAGAN | O765: HAYES | Q765: HEDLEY
A766: GOALKICKERS
A767: YARRAVILLE | C767: J ROHLEDER 2 | F767: HUGHES 2 | I767: S SMITH 2 | L767: WILD | N767: GARLICK | P767: MASON | R767: WILCOX
A768: CAMBERWELL | C768: MATTHEWS 2 | F768: McGUINNESS | I768: HEDLEY | K768: TURNBULL
A770: PORT MELBOURNE | C770: 1 | D770: 6 | E770: =C770*6+D770 -> 12 | G770: 3 | H770: 7 | I770: =G770*6+H770 -> 25 | K770: 12 | L770: 12 | M770: =K770*6+L770 -> 84 | O770: 16 | P770: 19 | Q770: =O770*6+P770 -> 115 | S770: PORT MELBOURNE
A771: OAKLEIGH | C771: 3 | D771: 1 | E771: =C771*6+D771 -> 19 | G771: 10 | H771: 2 | I771: =G771*6+H771 -> 62 | K771: 13 | L771: 3 | M771: =K771*6+L771 -> 81 | O771: 15 | P771: 5 | Q771: =O771*6+P771 -> 95 | S771: GAMBLE
A772: BEST PLAYERS
A773: PORT MELBOURNE | C773: STOREY | F773: WILSON | I773: MILLER | L773: SHANNON | O773: WALSH | R773: McBROOM
A774: OAKLEIGH | C774: TEMME | F774: HOWELL | I774: COLLINS | L774: GUY | O774: NICHOLSON | R774: SCOTT
A775: GOALKICKERS
A776: PORT MELBOURNE | C776: SHANNON 5 | F776: McBROOM 4 | I776: MILLER 2 | K776: YOUNG | M776: SYKES | O776: ALLEN | Q776: BONNETT | T776: WALSH
A777: OAKLEIGH | C777: SCOTT 5 | F777: HOWELL 4 | I777: SHAW 3 | K777: WEBSTER 2 | N777: NICHOLSON
A779: WILLIAMSTOWN | C779: 3 | D779: 1 | E779: =C779*6+D779 -> 19 | G779: 7 | H779: 8 | I779: =G779*6+H779 -> 50 | K779: 11 | L779: 12 | M779: =K779*6+L779 -> 78 | O779: 16 | P779: 14 | Q779: =O779*6+P779 -> 110 | S779: WILLIAMSTOWN
A780: BRIGHTON | C780: 1 | D780: 4 | E780: =C780*6+D780 -> 10 | G780: 3 | H780: 7 | I780: =G780*6+H780 -> 25 | K780: 3 | L780: 8 | M780: =K780*6+L780 -> 26 | O780: 3 | P780: 9 | Q780: =O780*6+P780 -> 27 | S780: ALLEN
A781: BEST PLAYERS
A782: WILLIAMSTOWN | C782: SIMPSON | F782: TAAFE | I782: EVANS | L782: MUNDAY | O782: SMITH | R782: CURRAN
A783: BRIGHTON | C783: J DAVIDSON | F783: POUND | I783: KNIGHT | L783: TURNER | O783: FREEMAN | R783: STEVENS
A784: GOALKICKERS
A785: WILLIAMSTOWN | C785: McPHERSON 4 | F785: LINTON 4 | I785: SIMPSON 3 | L785: SMITH | N785: FISHER | P785: CALLAHAN | S785: SIMS | U785: McTAGGART
A786: BRIGHTON | C786: ALEXANDER 2 | F786: SMITH
A788: ROUND 13 | E788: 9TH JULY | J788: WEATHER | O788: WEST BREEZE FINE | S788: PLAYED AT
D789: 1ST QTR | H789: 2ND QTR | L789: 3RD QTR | P789: FINAL | S789: BOX HILL
A790: PRESTON | C790: 6 | D790: 4 | E790: =C790*6+D790 -> 40 | G790: 11 | H790: 5 | I790: =G790*6+H790 -> 71 | K790: 13 | L790: 8 | M790: =K790*6+L790 -> 86 | O790: 15 | P790: 10 | Q790: =O790*6+P790 -> 100 | S790: UMPIRE | X790: LADDER | AA790: ROUND | AD790: 13
A791: BOX HILL | C791: 0 | D791: 1 | E791: =C791*6+D791 -> 1 | G791: 4 | H791: 3 | I791: =G791*6+H791 -> 27 | K791: 5 | L791: 5 | M791: =K791*6+L791 -> 35 | O791: 9 | P791: 10 | Q791: =O791*6+P791 -> 64 | S791: BEITZEL
A792: BEST PLAYERS | W792: TEAM | X792: W | Y792: L | Z792: D | AA792: FOR | AB792: AGST | AC792: % | AD792: PTS
A793: PRESTON | C793: FOLEY | E793: McBEAN | H793: HAYES | K793: CUSACK | N793: M SWEET | Q793: F CHARD
A794: BOX HILL | C794: EADE | E794: HOUGHTON | H794: IRVINE | K794: GREEN | N794: DUNN | Q794: NICHOLSON | W794: MOORABBIN | X794: 12 | Y794: 1 | Z794: 0 | AA794: 1213 | AB794: 815 | AC794: 148.83435582822085 | AD794: 48
A795: GOALKICKERS | W795: PORT MELBOURNE | X795: 12 | Y795: 1 | Z795: 0 | AA795: 1351 | AB795: 942 | AC795: 143.41825902335455 | AD795: 48
A796: PRESTON | C796: F CHARD 6 | F796: FOLEY 4 | H796: COOPER | J796: BRADFORD | M796: HAYES | O796: WATT | Q796: CUSACK | W796: PRESTON | X796: 11 | Y796: 2 | Z796: 0 | AA796: 1178 | AB796: 802 | AC796: 146.88 | AD796: 44
A797: BOX HILL | C797: NICHOLSON 3 | F797: BROWN 2 | I797: GREEN | K797: DUNN | M797: IRVINE | O797: LONSDALE | W797: WILLIAMSTOWN | X797: 11 | Y797: 2 | Z797: 0 | AA797: 1166 | AB797: 859 | AC797: 135.73923166472642 | AD797: 44
A799: WILLIAMSTOWN | C799: 2 | D799: 2 | E799: =C799*6+D799 -> 14 | G799: 3 | H799: 9 | I799: =G799*6+H799 -> 27 | K799: 4 | L799: 9 | M799: =K799*6+L799 -> 33 | O799: 8 | P799: 19 | Q799: =O799*6+P799 -> 67 | S799: BEACH ROAD | W799: BRUNSWICK | X799: 7 | Y799: 6 | Z799: 0 | AA799: 1117 | AB799: 964 | AC799: 115.87 | AD799: 28
A800: SANDRINGHAM | C800: 0 | D800: 2 | E800: =C800*6+D800 -> 2 | G800: 1 | H800: 3 | I800: =G800*6+H800 -> 9 | K800: 5 | L800: 5 | M800: =K800*6+L800 -> 35 | O800: 6 | P800: 7 | Q800: =O800*6+P800 -> 43 | S800: ROWE | W800: BOX HILL | X800: 6 | Y800: 7 | Z800: 0 | AA800: 1023 | AB800: 1079 | AC800: 94.810009267840599 | AD800: 24
A801: BEST PLAYERS | W801: SANDRINGHAM | X801: 6 | Y801: 7 | Z801: 0 | AA801: 1023 | AB801: 1182 | AC801: 86.548223350253807 | AD801: 24
A802: WILLIAMSTOWN | C802: TAAFE | F802: CURRAN | I802: BEITZEL | K802: SMITH | N802: LINTON | Q802: SIMPSON | W802: COBURG | X802: 5 | Y802: 8 | Z802: 0 | AA802: 1090 | AB802: 1016 | AC802: 107.28346456692914 | AD802: 20
A803: SANDRINGHAM | C803: CONNINGSBY | F803: W McMAHON | I803: GILLIES | K803: DAVIDSON | N803: RANSOM | Q803: R HARPER | W803: PRAHRAN | X803: 5 | Y803: 8 | Z803: 0 | AA803: 1090 | AB803: 1149 | AC803: 94.865100087032204 | AD803: 20
A804: GOALKICKERS | W804: YARRAVILLE | X804: 4 | Y804: 9 | Z804: 0 | AA804: 940 | AB804: 1156 | AC804: 81.31487889273356 | AD804: 16
A805: WILLIAMSTOWN | C805: LINTON 4 | F805: SIMS 2 | I805: SMITH | K805: McTAGGART | W805: CAMBERWELL | X805: 4 | Y805: 9 | Z805: 0 | AA805: 896 | AB805: 1163 | AC805: 77.04 | AD805: 16
A806: SANDRINGHAM | C806: DAVIDSON 2 | F806: W McMAHON 2 | J806: EVANS 2 | W806: NORTHCOTE | X806: 4 | Y806: 9 | Z806: 0 | AA806: 816 | AB806: 1069 | AC806: 76.333021515434993 | AD806: 16
W807: OAKLEIGH | X807: 3 | Y807: 10 | Z807: 0 | AA807: 971 | AB807: 1116 | AC807: 87.007168458781365 | AD807: 12
A808: PORT MELBOURNE | C808: 3 | D808: 1 | E808: =C808*6+D808 -> 19 | G808: 6 | H808: 10 | I808: =G808*6+H808 -> 46 | K808: 9 | L808: 11 | M808: =K808*6+L808 -> 65 | O808: 13 | P808: 19 | Q808: =O808*6+P808 -> 97 | S808: COBURG | W808: BRIGHTON | X808: 1 | Y808: 12 | Z808: 0 | AA808: 657 | AB808: 1219 | AC808: 53.896636587366693 | AD808: 4
A809: COBURG | C809: 3 | D809: 3 | E809: =C809*6+D809 -> 21 | G809: 4 | H809: 4 | I809: =G809*6+H809 -> 28 | K809: 8 | L809: 10 | M809: =K809*6+L809 -> 58 | O809: 11 | P809: 12 | Q809: =O809*6+P809 -> 78 | S809: ROACH
A810: BEST PLAYERS
A811: PORT MELBOURNE | C811: WALSH | F811: McBROOM | I811: SYKES | L811: WITHERS | O811: ALLEN | Q811: BLACK
A812: COBURG | C812: SANDLANT | F812: HEWES | I812: H WILKINSON | L812: FEWKES | O812: YORK | Q812: FITZPATRICK
A813: GOALKICKERS
A814: PORT MELBOURNE | C814: WALSH 5 | F814: McBROOM 2 | I814: SHANNON 2 | L814: ALLEN 2 | O814: BRAGG | Q814: WITHERS
A815: COBURG | C815: H WILKINSON 4 | F815: HEWES 3 | I815: MILLER | K815: FITZPATRICK | N815: GILL | P815: CONDON
A817: BRUNSWICK | C817: 2 | D817: 1 | E817: =C817*6+D817 -> 13 | G817: 7 | H817: 4 | I817: =G817*6+H817 -> 46 | K817: 8 | L817: 13 | M817: =K817*6+L817 -> 61 | O817: 13 | P817: 21 | Q817: =O817*6+P817 -> 99 | S817: TOORAK PARK
A818: PRAHRAN | C818: 8 | D818: 5 | E818: =C818*6+D818 -> 53 | G818: 11 | H818: 6 | I818: =G818*6+H818 -> 72 | K818: 12 | L818: 9 | M818: =K818*6+L818 -> 81 | O818: 13 | P818: 10 | Q818: =O818*6+P818 -> 88 | S818: GAMBLE
A819: BEST PLAYERS
A820: BRUNSWICK | C820: NEILSON | F820: McFEE | I820: ROWE | L820: YEA | O820: MAY | R820: STANLEY
A821: PRAHRAN | C821: ELLIOTT | F821: ROSS | I821: C BOYD | L821: WILSON | O821: KINNABURGH | R821: PLAIN
A822: GOALKICKERS
A823: BRUNSWICK | C823: NEILSON 3 | F823: ROWE 3 | I823: McFEE 3 | K823: STANLEY | M823: LEYDEN | O823: JAMES | Q823: CARROLL
A824: PRAHRAN | C824: KINNABURGH 5 | F824: WILSON 2 | I824: HART 2 | K824: CLEAR | M824: HARVEY | O824: SNOW | Q824: C BOYD
A826: CAMBERWELL | C826: 5 | D826: 5 | E826: =C826*6+D826 -> 35 | G826: 7 | H826: 7 | I826: =G826*6+H826 -> 49 | K826: 10 | L826: 10 | M826: =K826*6+L826 -> 70 | O826: 11 | P826: 11 | Q826: =O826*6+P826 -> 77 | S826: NORTHCOTE
A827: NORTHCOTE | C827: 1 | D827: 2 | E827: =C827*6+D827 -> 8 | G827: 4 | H827: 6 | I827: =G827*6+H827 -> 30 | K827: 5 | L827: 10 | M827: =K827*6+L827 -> 40 | O827: 10 | P827: 11 | Q827: =O827*6+P827 -> 71 | S827: MALLETT
A828: BEST PLAYERS
A829: CAMBERWELL | C829: HOLYOAK | F829: MASON | I829: SKALBERG | L829: TURNBULL | O829: SABBATUCCI | R829: HEDLEY
A830: NORTHCOTE | C830: WOOLNOUGH | F830: TULL | I830: J VAINS | L830: JOHNSON | O830: GIBBS | R830: SIMMONDS
A831: GOALKICKERS
A832: CAMBERWELL | C832: SABBATUCCI 4 | F832: MATTHEWS 3 | I832: MILNE | K832: FARRELL | M832: TOBIAS | O832: SCHNEIDER
A833: NORTHCOTE | C833: GIBBS 2 | F833: JOHNSON 2 | I833: TULL 2 | K833: WOOLNOUGH | N833: HOLT | P833: PURDON | R833: REID
A835: YARRAVILLE | C835: 3 | D835: 1 | E835: =C835*6+D835 -> 19 | G835: 3 | H835: 8 | I835: =G835*6+H835 -> 26 | K835: 5 | L835: 11 | M835: =K835*6+L835 -> 41 | O835: 9 | P835: 18 | Q835: =O835*6+P835 -> 72 | S835: YARRAVILLE
A836: BRIGHTON | C836: 4 | D836: 4 | E836: =C836*6+D836 -> 28 | G836: 4 | H836: 4 | I836: =G836*6+H836 -> 28 | K836: 6 | L836: 8 | M836: =K836*6+L836 -> 44 | O836: 7 | P836: 9 | Q836: =O836*6+P836 -> 51 | S836: IRVING
A837: BEST PLAYERS
A838: YARRAVILLE | C838: J ROHLEDER | F838: DRIVER | I838: TAYLOR | L838: JONES | N838: VANDERFEEN | Q838: HUTCHESON
A839: BRIGHTON | C839: POUND | F839: FREEMAN | I839: COURTNEY | L839: STEVENS | N839: HICKMAN | Q839: STAFFORD
A840: GOALKICKERS
A841: YARRAVILLE | C841: MASON 3 | F841: HUTCHESON | I841: WILD | K841: CHARLES | M841: TAYLOR | O841: GARLICK | Q841: GRAHAM
A842: BRIGHTON | C842: FREEMAN 2 | F842: ALEXANDER 2 | I842: WAIN | K842: HICKMAN | M842: KENT
A844: MOORABBIN | C844: 3 | D844: 4 | E844: =C844*6+D844 -> 22 | G844: 5 | H844: 5 | I844: =G844*6+H844 -> 35 | K844: 11 | L844: 10 | M844: =K844*6+L844 -> 76 | O844: 14 | P844: 14 | Q844: =O844*6+P844 -> 98 | S844: OAKLEIGH
A845: OAKLEIGH | C845: 2 | D845: 1 | E845: =C845*6+D845 -> 13 | G845: 7 | H845: 5 | I845: =G845*6+H845 -> 47 | K845: 8 | L845: 5 | M845: =K845*6+L845 -> 53 | O845: 9 | P845: 9 | Q845: =O845*6+P845 -> 63 | S845: ALLEN
A846: BEST PLAYERS
A847: MOORABBIN | C847: LAWRENCE | F847: BOYD | I847: MURPHY | L847: DYNON | N847: GREEN | P847: MORONEY
A848: OAKLEIGH | C848: GUY | F848: NICHOLSON | I848: SHAW | L848: TEMME | N848: HILL | P848: ANDERSON
A849: GOALKICKERS
A850: MOORABBIN | C850: SCHOFIELD 5 | F850: MORONEY 3 | I850: WICKS 2 | K850: BOYD 2 | M850: McGAW | O850: ARNFIELD
A851: OAKLEIGH | C851: NICHOLSON 4 | F851: HOWELL 2 | I851: SHAW | K851: EDWARDS | M851: SCOTT
A853: ROUND 14 | E853: 16TH JULY | J853: WEATHER | M853: SOUTH WEST WIND SHOWERS | S853: PLAYED AT
D854: 1ST QTR | H854: 2ND QTR | L854: 3RD QTR | P854: FINAL | S854: PRESTON
A855: PRESTON | C855: 3 | D855: 6 | E855: =C855*6+D855 -> 24 | G855: 6 | H855: 9 | I855: =G855*6+H855 -> 45 | K855: 7 | L855: 10 | M855: =K855*6+L855 -> 52 | O855: 10 | P855: 10 | Q855: =O855*6+P855 -> 70 | S855: UMPIRE | X855: LADDER | AA855: ROUND | AD855: 14
A856: WILLIAMSTOWN | C856: 1 | D856: 2 | E856: =C856*6+D856 -> 8 | G856: 2 | H856: 2 | I856: =G856*6+H856 -> 14 | K856: 3 | L856: 5 | M856: =K856*6+L856 -> 23 | O856: 4 | P856: 7 | Q856: =O856*6+P856 -> 31 | S856: IRVING
A857: BEST PLAYERS | W857: TEAM | X857: W | Y857: L | Z857: D | AA857: FOR | AB857: AGST | AC857: % | AD857: PTS
A858: PRESTON | C858: L SWEET | F858: McBEAN | I858: BRADFORD | L858: CROCKER | N858: HOWARD | Q858: McLACHLAN
A859: WILLIAMSTOWN | C859: CALLAHAN | F859: CURRAN | I859: OUTEN | L859: BEITZEL | N859: GEAR | Q859: TAAFE | W859: PORT MELBOURNE | X859: 13 | Y859: 1 | Z859: 0 | AA859: 1502 | AB859: 1036 | AC859: 144.98069498069498 | AD859: 52
A860: GOALKICKERS | W860: PRESTON | X860: 12 | Y860: 2 | Z860: 0 | AA860: 1248 | AB860: 833 | AC860: 149.82 | AD860: 48
A861: PRESTON | C861: BRADFORD 4 | F861: F CHARD 2 | I861: LALOR | K861: HOWARD | M861: HAYES | O861: FOLEY | W861: MOORABBIN | X861: 12 | Y861: 2 | Z861: 0 | AA861: 1285 | AB861: 889 | AC861: 144.54443194600674 | AD861: 48
A862: WILLIAMSTOWN | C862: EVANS 5 | F862: GEAR | H862: FISHER | J862: LINTON | W862: WILLIAMSTOWN | X862: 11 | Y862: 3 | Z862: 0 | AA862: 1197 | AB862: 929 | AC862: 128.84822389666309 | AD862: 44
A864: BOX HILL | C864: 1 | D864: 1 | E864: =C864*6+D864 -> 7 | G864: 4 | H864: 4 | I864: =G864*6+H864 -> 28 | K864: 6 | L864: 5 | M864: =K864*6+L864 -> 41 | O864: 11 | P864: 8 | Q864: =O864*6+P864 -> 74 | S864: MOORABBIN | W864: BRUNSWICK | X864: 8 | Y864: 6 | Z864: 0 | AA864: 1201 | AB864: 1033 | AC864: 116.26 | AD864: 32
A865: MOORABBIN | C865: 6 | D865: 2 | E865: =C865*6+D865 -> 38 | G865: 8 | H865: 4 | I865: =G865*6+H865 -> 52 | K865: 11 | L865: 6 | M865: =K865*6+L865 -> 72 | O865: 11 | P865: 6 | Q865: =O865*6+P865 -> 72 | S865: BEECH | W865: BOX HILL | X865: 7 | Y865: 7 | Z865: 0 | AA865: 1097 | AB865: 1151 | AC865: 95.308427454387484 | AD865: 28
A866: BEST PLAYERS | W866: PRAHRAN | X866: 6 | Y866: 8 | Z866: 0 | AA866: 1156 | AB866: 1199 | AC866: 96.413678065054214 | AD866: 24
A867: BOX HILL | C867: INGLETON | F867: DUNN | I867: IRVINE | L867: BROWN | N867: WEBB | Q867: RATTRAY | W867: SANDRINGHAM | X867: 6 | Y867: 8 | Z867: 0 | AA867: 1117 | AB867: 1333 | AC867: 83.795948987246817 | AD867: 24
A868: MOORABBIN | C868: McGAW | F868: MURRAY | I868: MORONEY | L868: SCHOFIELD | N868: LAWRENCE | Q868: DYNON | W868: COBURG | X868: 5 | Y868: 9 | Z868: 0 | AA868: 1159 | AB868: 1100 | AC868: 105.36363636363636 | AD868: 20
A869: GOALKICKERS | W869: YARRAVILLE | X869: 5 | Y869: 9 | Z869: 0 | AA869: 994 | AB869: 1180 | AC869: 84.237288135593218 | AD869: 20
A870: BOX HILL | C870: INGLETON 4 | F870: DUNN 3 | I870: NICHOLSON 2 | L870: WEBB | N870: BROWN | W870: OAKLEIGH | X870: 4 | Y870: 10 | Z870: 0 | AA870: 1037 | AB870: 1177 | AC870: 88.105352591333897 | AD870: 16
A871: MOORABBIN | C871: SCHOFIELD 5 | F871: McGAW 2 | I871: MORONEY 2 | L871: LEHMANN | N871: MANIE | W871: CAMBERWELL | X871: 4 | Y871: 10 | Z871: 0 | AA871: 957 | AB871: 1229 | AC871: 77.87 | AD871: 16
W872: NORTHCOTE | X872: 4 | Y872: 10 | Z872: 0 | AA872: 840 | AB872: 1123 | AC872: 74.799643811219951 | AD872: 16
A873: PORT MELBOURNE | C873: 7 | D873: 5 | E873: =C873*6+D873 -> 47 | G873: 11 | H873: 15 | I873: =G873*6+H873 -> 81 | K873: 13 | L873: 21 | M873: =K873*6+L873 -> 99 | O873: 21 | P873: 25 | Q873: =O873*6+P873 -> 151 | S873: PORT MELBOURNE | W873: BRIGHTON | X873: 1 | Y873: 13 | Z873: 0 | AA873: 707 | AB873: 1285 | AC873: 55.019455252918291 | AD873: 4
A874: SANDRINGHAM | C874: 3 | D874: 3 | E874: =C874*6+D874 -> 21 | G874: 7 | H874: 5 | I874: =G874*6+H874 -> 47 | K874: 10 | L874: 7 | M874: =K874*6+L874 -> 67 | O874: 14 | P874: 10 | Q874: =O874*6+P874 -> 94 | S874: BEITZEL
A875: BEST PLAYERS
A876: PORT MELBOURNE | C876: ALLEN | F876: STOREY | I876: WITHERS | L876: McBROOM | O876: FRASER | Q876: LEWIS
A877: SANDRINGHAM | C877: C JOHNSTON | F877: LAFFEY | I877: CONNINGSBY | L877: FITZPATRICK | O877: FLETCHER | Q877: GILLIES
A878: GOALKICKERS
A879: PORT MELBOURNE | C879: TEMPLETON 5 | F879: ALLEN 4 | H879: WALSH 3 | J879: SHANNON 2 | M879: FRASER 2 | O879: McBROOM 2 | R879: MILLER 2 | U879: SYKES
A880: SANDRINGHAM | C880: McMAHON 3 | F880: WARBURTON 3 | J880: CLAYTON 2 | M880: RANSOM 2 | P880: W CLARKE | R880: FLETCHER | U880: BRIGHTON | X880: G CLARKE
A882: BRUNSWICK | C882: 5 | D882: 4 | E882: =C882*6+D882 -> 34 | G882: 8 | H882: 4 | I882: =G882*6+H882 -> 52 | K882: 10 | L882: 6 | M882: =K882*6+L882 -> 66 | O882: 12 | P882: 12 | Q882: =O882*6+P882 -> 84 | S882: BRUNSWICK
A883: COBURG | C883: 3 | D883: 2 | E883: =C883*6+D883 -> 20 | G883: 6 | H883: 6 | I883: =G883*6+H883 -> 42 | K883: 7 | L883: 8 | M883: =K883*6+L883 -> 50 | O883: 10 | P883: 9 | Q883: =O883*6+P883 -> 69 | S883: ALLEN
A884: BEST PLAYERS
A885: BRUNSWICK | C885: MULLENGER | F885: EDWARDS | I885: JAMES | L885: WEIR | O885: NEILSON | R885: YEA
A886: COBURG | C886: McMAHON | F886: GOULLET | I886: MAHONEY | L886: HORSKINS | O886: H WILKINSON | R886: SHORT
A887: GOALKICKERS
A888: BRUNSWICK | C888: WEIR 4 | F888: JAMES 3 | I888: ROWE 3 | K888: McMAHON | N888: CLUES
A889: COBURG | C889: HEWES 5 | F889: MILES 2 | I889: H WILKINSON 2 | M889: BUCKLEY
A891: YARRAVILLE | C891: 2 | D891: 5 | E891: =C891*6+D891 -> 17 | G891: 4 | H891: 6 | I891: =G891*6+H891 -> 30 | K891: 6 | L891: 9 | M891: =K891*6+L891 -> 45 | O891: 7 | P891: 12 | Q891: =O891*6+P891 -> 54 | S891: YARRAVILLE
A892: NORTHCOTE | C892: 0 | D892: 0 | E892: =C892*6+D892 -> 0 | G892: 2 | H892: 1 | I892: =G892*6+H892 -> 13 | K892: 3 | L892: 4 | M892: =K892*6+L892 -> 22 | O892: 3 | P892: 6 | Q892: =O892*6+P892 -> 24 | S892: ROBINSON
A893: BEST PLAYERS
A894: YARRAVILLE | C894: VANDERFEEN | F894: PAYNE | I894: K SMITH | L894: J ROHLEDER | O894: COCKRAM | R894: GARLICK
A895: NORTHCOTE | C895: HOLT | F895: PAYNTER | I895: SIMMONS | L895: WALKER | O895: CRAWLEY | R895: DENEHY
A896: GOALKICKERS
A897: YARRAVILLE | C897: MASON 2 | F897: HUGHES 2 | I897: PAYNE | K897: COCKRAM | M897: CHARLES
A898: NORTHCOTE | C898: CRAWLEY | F898: TULL | I898: WRIGHT
A900: OAKLEIGH | C900: 2 | D900: 4 | E900: =C900*6+D900 -> 16 | G900: 4 | H900: 10 | I900: =G900*6+H900 -> 34 | K900: 5 | L900: 13 | M900: =K900*6+L900 -> 43 | O900: 8 | P900: 18 | Q900: =O900*6+P900 -> 66 | S900: CAMBERWELL
A901: CAMBERWELL | C901: 5 | D901: 5 | E901: =C901*6+D901 -> 35 | G901: 5 | H901: 7 | I901: =G901*6+H901 -> 37 | K901: 6 | L901: 11 | M901: =K901*6+L901 -> 47 | O901: 8 | P901: 13 | Q901: =O901*6+P901 -> 61 | S901: GAMBLE
A902: BEST PLAYERS
A903: OAKLEIGH | C903: HILL | F903: TEMME | I903: WILLIAMS | L903: LONIE | O903: NICHOLSON | R903: SHAW
A904: CAMBERWELL | C904: TURNBULL | F904: DUFF | I904: MASON | L904: SCHNEIDER | O904: DEAGAN | R904: MILNE
A905: GOALKICKERS
A906: OAKLEIGH | C906: LONIE 3 | E906: BURTON | G906: NICHOLSON | J906: HOWELL | L906: SHAW | N906: DONOHUE
A907: CAMBERWELL | C907: MATTHEWS 2 | F907: SCHNEIDER 2 | I907: HAYES | K907: HEDLEY | M907: MASON | O907: DUGDALE
A909: PRAHRAN | C909: 3 | D909: 7 | E909: =C909*6+D909 -> 25 | G909: 5 | H909: 11 | I909: =G909*6+H909 -> 41 | K909: 7 | L909: 11 | M909: =K909*6+L909 -> 53 | O909: 9 | P909: 12 | Q909: =O909*6+P909 -> 66 | S909: ELSTERNWICK PARK
A910: BRIGHTON | C910: 0 | D910: 3 | E910: =C910*6+D910 -> 3 | G910: 1 | H910: 9 | I910: =G910*6+H910 -> 15 | K910: 3 | L910: 9 | M910: =K910*6+L910 -> 27 | O910: 6 | P910: 14 | Q910: =O910*6+P910 -> 50 | S910: MALLETT
A911: BEST PLAYERS
A912: PRAHRAN | C912: SHILLABEER | F912: SNOW | I912: SHARP | L912: H BOYD | O912: WILSON | R912: KINNABURGH
A913: BRIGHTON | C913: POUND | F913: FREEMAN | I913: JOSTLEAR | L913: ALEXANDER | O913: DAVIDSON | R913: SPINKS
A914: GOALKICKERS
A915: PRAHRAN | C915: KINNABURGH 5 | G915: HARVEY 2 | J915: ELLIOTT | L915: SNOW
A916: BRIGHTON | C916: ALEXANDER 2 | G916: FREEMAN 2 | J916: WAIN | L916: HICKMAN
A918: ROUND 15 | E918: 23RD JULY | J918: WEATHER | M918: NORTH WEST BREEZE FINE & SUNNY | S918: PLAYED AT
D919: 1ST QTR | H919: 2ND QTR | L919: 3RD QTR | P919: FINAL | S919: PRESTON
A920: PRESTON | C920: 1 | D920: 2 | E920: =C920*6+D920 -> 8 | G920: 6 | H920: 4 | I920: =G920*6+H920 -> 40 | K920: 10 | L920: 7 | M920: =K920*6+L920 -> 67 | O920: 12 | P920: 10 | Q920: =O920*6+P920 -> 82 | S920: UMPIRE | X920: LADDER | AA920: ROUND | AD920: 15
A921: PORT MELBOURNE | C921: 2 | D921: 3 | E921: =C921*6+D921 -> 15 | G921: 5 | H921: 4 | I921: =G921*6+H921 -> 34 | K921: 7 | L921: 4 | M921: =K921*6+L921 -> 46 | O921: 10 | P921: 10 | Q921: =O921*6+P921 -> 70 | S921: ROACH
A922: BEST PLAYERS | W922: TEAM | X922: W | Y922: L | Z922: D | AA922: FOR | AB922: AGST | AC922: % | AD922: PTS
A923: PRESTON | C923: HENRYS | F923: CROCKER | I923: L SWEET | L923: CUSACK | N923: BRADFORD | Q923: HAYES
A924: PORT MELBOURNE | C924: JOHNSON | F924: METHERALL | I924: BRAGG | L924: BLACK | N924: LEWIS | Q924: MILLER | W924: PRESTON | X924: 13 | Y924: 2 | Z924: 0 | AA924: 1330 | AB924: 903 | AC924: 147.29 | AD924: 52
A925: GOALKICKERS | W925: MOORABBIN | X925: 13 | Y925: 2 | Z925: 0 | AA925: 1411 | AB925: 972 | AC925: 145.16460905349794 | AD925: 52
A926: PRESTON | C926: HOWARD 3 | F926: F CHARD 3 | I926: HAYES 2 | K926: FOLEY 2 | M926: JEFFREY | O926: BRADFORD | W926: PORT MELBOURNE | X926: 13 | Y926: 2 | Z926: 0 | AA926: 1572 | AB926: 1118 | AC926: 140.608228980322 | AD926: 52
A927: PORT MELBOURNE | C927: BRAGG 3 | F927: MILLER 2 | I927: FRASER 2 | K927: TEMPLETON | N927: WALSH | P927: McBROOM | W927: WILLIAMSTOWN | X927: 12 | Y927: 3 | Z927: 0 | AA927: 1323 | AB927: 996 | AC927: 132.83132530120483 | AD927: 48
A929: BRUNSWICK | C929: 2 | D929: 5 | E929: =C929*6+D929 -> 17 | G929: 5 | H929: 7 | I929: =G929*6+H929 -> 37 | K929: 7 | L929: 10 | M929: =K929*6+L929 -> 52 | O929: 11 | P929: 10 | Q929: =O929*6+P929 -> 76 | S929: BOX HILL | W929: BRUNSWICK | X929: 9 | Y929: 6 | Z929: 0 | AA929: 1277 | AB929: 1073 | AC929: 119.01 | AD929: 36
A930: BOX HILL | C930: 3 | D930: 1 | E930: =C930*6+D930 -> 19 | G930: 4 | H930: 2 | I930: =G930*6+H930 -> 26 | K930: 6 | L930: 3 | M930: =K930*6+L930 -> 39 | O930: 6 | P930: 4 | Q930: =O930*6+P930 -> 40 | S930: IRVING | W930: PRAHRAN | X930: 7 | Y930: 8 | Z930: 0 | AA930: 1251 | AB930: 1263 | AC930: 99.049881235154388 | AD930: 28
A931: BEST PLAYERS | W931: BOX HILL | X931: 7 | Y931: 8 | Z931: 0 | AA931: 1137 | AB931: 1227 | AC931: 92.665036674816619 | AD931: 28
A932: BRUNSWICK | C932: JAMES | E932: WEIR | H932: McFEE | K932: CARROLL | N932: MULLENGER | Q932: EDWARDS | W932: COBURG | X932: 6 | Y932: 9 | Z932: 0 | AA932: 1281 | AB932: 1188 | AC932: 107.82828282828282 | AD932: 24
A933: BOX HILL | C933: WRIGHT | E933: BROWN | H933: INGLETON | K933: IRVINE | N933: RATTRAY | Q933: HOUGHTON | W933: SANDRINGHAM | X933: 6 | Y933: 9 | Z933: 0 | AA933: 1200 | AB933: 1459 | AC933: 82.248115147361204 | AD933: 24
A934: GOALKICKERS | W934: OAKLEIGH | X934: 5 | Y934: 10 | Z934: 0 | AA934: 1114 | AB934: 1233 | AC934: 90.348742903487434 | AD934: 20
A935: BRUNSWICK | C935: McFEE 3 | F935: CLUES 2 | H935: JAMES 2 | J935: NEILSON 2 | M935: ROWE | O935: STANLEY | W935: YARRAVILLE | X935: 5 | Y935: 10 | Z935: 0 | AA935: 1058 | AB935: 1275 | AC935: 82.980392156862749 | AD935: 20
A936: BOX HILL | C936: BROWN 4 | F936: NICHOLSON | I936: DUNN | W936: CAMBERWELL | X936: 4 | Y936: 11 | Z936: 0 | AA936: 1045 | AB936: 1351 | AC936: 77.35 | AD936: 16
W937: NORTHCOTE | X937: 4 | Y937: 11 | Z937: 0 | AA937: 907 | AB937: 1249 | AC937: 72.618094475580463 | AD937: 16
A938: MOORABBIN | C938: 6 | D938: 4 | E938: =C938*6+D938 -> 40 | G938: 7 | H938: 13 | I938: =G938*6+H938 -> 55 | K938: 14 | L938: 20 | M938: =K938*6+L938 -> 104 | O938: 17 | P938: 24 | Q938: =O938*6+P938 -> 126 | S938: BEACH ROAD | W938: BRIGHTON | X938: 1 | Y938: 14 | Z938: 0 | AA938: 763 | AB938: 1362 | AC938: 56.020558002936859 | AD938: 4
A939: SANDRINGHAM | C939: 4 | D939: 2 | E939: =C939*6+D939 -> 26 | G939: 9 | H939: 3 | I939: =G939*6+H939 -> 57 | K939: 12 | L939: 4 | M939: =K939*6+L939 -> 76 | O939: 13 | P939: 5 | Q939: =O939*6+P939 -> 83 | S939: ROBINSON
A940: BEST PLAYERS
A941: MOORABBIN | C941: DYNON | F941: RENWICK | I941: MANIE | K941: MORONEY | N941: LAWRENCE | Q941: GREEN
A942: SANDRINGHAM | C942: CONNINGSBY | F942: McMAHON | I942: KRAUSE | K942: TURNER | N942: SHEARER | Q942: DAVIDSON
A943: GOALKICKERS
A944: MOORABBIN | C944: SCHOFIELD 4 | F944: CLOVER 2 | I944: MORONEY 2 | L944: RENWICK 2 | N944: McGAW 2 | Q944: DALY | R944: MANIE | T944: DYNON | V944: BARNES | X944: SUTHERLAND
A945: SANDRINGHAM | C945: McMAHON 4 | F945: WARBURTON 2 | J945: FLETCHER 2 | M945: G CLARKE 2 | P945: KRAUSE | R945: FITZPATRICK | V945: SHEARER
A947: PRAHRAN | C947: 3 | D947: 3 | E947: =C947*6+D947 -> 21 | G947: 6 | H947: 3 | I947: =G947*6+H947 -> 39 | K947: 11 | L947: 7 | M947: =K947*6+L947 -> 73 | O947: 14 | P947: 11 | Q947: =O947*6+P947 -> 95 | S947: TOORAK PARK
A948: YARRAVILLE | C948: 1 | D948: 9 | E948: =C948*6+D948 -> 15 | G948: 2 | H948: 16 | I948: =G948*6+H948 -> 28 | K948: 4 | L948: 18 | M948: =K948*6+L948 -> 42 | O948: 7 | P948: 22 | Q948: =O948*6+P948 -> 64 | S948: ALLEN
A949: BEST PLAYERS
A950: PRAHRAN | C950: SHILLABEER | F950: HARVEY | I950: ROSS | L950: WILSON | N950: HEALEY | Q950: KINNABURGH
A951: YARRAVILLE | C951: J ROHLEDER | F951: TAYLOR | I951: N ROHLEDER | L951: MASON | N951: DRIVER | Q951: WILD
A952: GOALKICKERS
A953: PRAHRAN | C953: KINNABURGH 4 | F953: WILSON 2 | I953: JONES 2 | L953: HARVEY 2 | O953: HART 2 | Q953: SNOW | S953: CLEAR
A954: YARRAVILLE | C954: HUGHES 2 | F954: MASON 2 | I954: N ROHLEDER | L954: COCKRAM | O954: CHARLES
A956: COBURG | C956: 6 | D956: 1 | E956: =C956*6+D956 -> 37 | G956: 9 | H956: 3 | I956: =G956*6+H956 -> 57 | K956: 13 | L956: 10 | M956: =K956*6+L956 -> 88 | O956: 18 | P956: 14 | Q956: =O956*6+P956 -> 122 | S956: COBURG
A957: CAMBERWELL | C957: 3 | D957: 1 | E957: =C957*6+D957 -> 19 | G957: 8 | H957: 6 | I957: =G957*6+H957 -> 54 | K957: 10 | L957: 6 | M957: =K957*6+L957 -> 66 | O957: 13 | P957: 10 | Q957: =O957*6+P957 -> 88 | S957: BEITZEL
A958: BEST PLAYERS
A959: COBURG | C959: MAHONEY | F959: FEWKES | I959: HORSKINS | L959: HEWES | N959: B McMAHON | Q959: SANDLANT
A960: CAMBERWELL | C960: CLARKE | F960: JOHNSON | I960: HOLYOAK | L960: BENBOW | N960: TURNBULL | Q960: DUFF
A961: GOALKICKERS
A962: COBURG | C962: HEWES 7 | F962: JONES 4 | H962: H WILKINSON 3 | K962: MAHONEY 2 | N962: MILES | P962: FITZPATRICK
A963: CAMBERWELL | C963: MATTHEWS 4 | F963: BENBOW 3 | I963: TURNBULL | K963: SCHNEIDER | N963: DUGDALE | P963: YOUNG | R963: DUFF | T963: HEDLEY
A965: OAKLEIGH | C965: 3 | D965: 2 | E965: =C965*6+D965 -> 20 | G965: 5 | H965: 6 | I965: =G965*6+H965 -> 36 | K965: 6 | L965: 8 | M965: =K965*6+L965 -> 44 | O965: 11 | P965: 11 | Q965: =O965*6+P965 -> 77 | S965: OAKLEIGH
A966: BRIGHTON | C966: 3 | D966: 4 | E966: =C966*6+D966 -> 22 | G966: 7 | H966: 5 | I966: =G966*6+H966 -> 47 | K966: 7 | L966: 7 | M966: =K966*6+L966 -> 49 | O966: 8 | P966: 8 | Q966: =O966*6+P966 -> 56 | S966: BARNETT
A967: BEST PLAYERS
A968: OAKLEIGH | C968: GUY | F968: HOWELL | I968: COLLINS | L968: LAMBERT | N968: MUNYARD | Q968: SCOTT
A969: BRIGHTON | C969: TURNER | F969: KNIGHT | I969: POUND | L969: STEVENS | N969: GRIENKE | Q969: KENT
A970: GOALKICKERS
A971: OAKLEIGH | C971: MUNYARD 3 | F971: NEWPORT 2 | I971: LONIE 2 | K971: SHAW | M971: NICHOLSON | P971: HOWELL | R971: GUY
A972: BRIGHTON | C972: GRIENKE 3 | F972: COURTNEY | I972: DAVIDSON | K972: JOSTLEAR | M972: KNIGHT | O972: FREEMAN
A974: WILLIAMSTOWN | C974: 4 | D974: 3 | E974: =C974*6+D974 -> 27 | G974: 9 | H974: 4 | I974: =G974*6+H974 -> 58 | K974: 14 | L974: 9 | M974: =K974*6+L974 -> 93 | O974: 19 | P974: 12 | Q974: =O974*6+P974 -> 126 | S974: WILLIAMSTOWN
A975: NORTHCOTE | C975: 1 | D975: 2 | E975: =C975*6+D975 -> 8 | G975: 3 | H975: 4 | I975: =G975*6+H975 -> 22 | K975: 7 | L975: 9 | M975: =K975*6+L975 -> 51 | O975: 9 | P975: 13 | Q975: =O975*6+P975 -> 67 | S975: GAMBLE
A976: BEST PLAYERS
A977: WILLIAMSTOWN | C977: WOOKEY | F977: LINTON | I977: MARTIN | K977: ANDERSON | N977: SIMS | Q977: MUNDAY
A978: NORTHCOTE | C978: WOOLNOUGH | F978: McLAINE | I978: DEVINE | K978: PAYNTER | N978: POWELL | Q978: TULL
A979: GOALKICKERS
A980: WILLIAMSTOWN | C980: LINTON 5 | F980: ANDERSON 5 | I980: GEAR 4 | K980: JONES 3 | M980: WOOKEY | O980: McTAGGART
A981: NORTHCOTE | C981: STABB 2 | F981: J JOHNSON 2 | I981: DEVINE 2 | K981: ROMARI | M981: GIBBS | O981: COLLINS
A983: ROUND 16 | E983: 30TH JULY | J983: WEATHER | M983: SOUTH WEST WIND SHOWERS COLD | S983: PLAYED AT
D984: 1ST QTR | H984: 2ND QTR | L984: 3RD QTR | P984: FINAL | S984: MOORABBIN
A985: PRESTON | C985: 0 | D985: 1 | E985: =C985*6+D985 -> 1 | G985: 7 | H985: 8 | I985: =G985*6+H985 -> 50 | K985: 9 | L985: 9 | M985: =K985*6+L985 -> 63 | O985: 11 | P985: 13 | Q985: =O985*6+P985 -> 79 | S985: UMPIRE | X985: LADDER | AA985: ROUND | AD985: 16
A986: MOORABBIN | C986: 6 | D986: 8 | E986: =C986*6+D986 -> 44 | G986: 7 | H986: 8 | I986: =G986*6+H986 -> 50 | K986: 11 | L986: 9 | M986: =K986*6+L986 -> 75 | O986: 11 | P986: 10 | Q986: =O986*6+P986 -> 76 | S986: BEITZEL
A987: BEST PLAYERS | W987: TEAM | X987: W | Y987: L | Z987: D | AA987: FOR | AB987: AGST | AC987: % | AD987: PTS
A988: PRESTON | C988: M SWEET | F988: HAYES | I988: LALOR | K988: MILBURN | N988: COOPER | Q988: K CHARD
A989: MOORABBIN | C989: MORONEY | F989: SUTHERLAND | I989: DYNON | K989: MANIE | N989: CLOVER | Q989: MURRAY | W989: PRESTON | X989: 14 | Y989: 2 | Z989: 0 | AA989: 1409 | AB989: 979 | AC989: 143.92 | AD989: 56
A990: GOALKICKERS | W990: PORT MELBOURNE | X990: 14 | Y990: 2 | Z990: 0 | AA990: 1643 | AB990: 1160 | AC990: 141.63793103448276 | AD990: 56
A991: PRESTON | C991: LALOR 3 | F991: FOLEY 2 | H991: HAYES 2 | J991: L SWEET | L991: F CHARD | N991: BRADFORD | Q991: COOPER | W991: MOORABBIN | X991: 13 | Y991: 3 | Z991: 0 | AA991: 1487 | AB991: 1051 | AC991: 141.48430066603234 | AD991: 52
A992: MOORABBIN | C992: SUTHERLAND 3 | F992: SCHOFIELD 2 | I992: MORONEY 2 | L992: RENWICK | N992: McGAW | P992: DYNON | R992: CLOVER | W992: WILLIAMSTOWN | X992: 12 | Y992: 4 | Z992: 0 | AA992: 1365 | AB992: 1067 | AC992: 127.92877225866917 | AD992: 48
A994: PORT MELBOURNE | C994: 1 | D994: 2 | E994: =C994*6+D994 -> 8 | G994: 6 | H994: 5 | I994: =G994*6+H994 -> 41 | K994: 7 | L994: 5 | M994: =K994*6+L994 -> 47 | O994: 10 | P994: 11 | Q994: =O994*6+P994 -> 71 | S994: PORT MELBOURNE | W994: BRUNSWICK | X994: 10 | Y994: 6 | Z994: 0 | AA994: 1389 | AB994: 1121 | AC994: 123.91 | AD994: 40
A995: WILLIAMSTOWN | C995: 1 | D995: 3 | E995: =C995*6+D995 -> 9 | G995: 1 | H995: 9 | I995: =G995*6+H995 -> 15 | K995: 4 | L995: 12 | M995: =K995*6+L995 -> 36 | O995: 5 | P995: 12 | Q995: =O995*6+P995 -> 42 | S995: ROBINSON | W995: PRAHRAN | X995: 8 | Y995: 8 | Z995: 0 | AA995: 1312 | AB995: 1318 | AC995: 99.544764795144161 | AD995: 32
A996: BEST PLAYERS | W996: BOX HILL | X996: 8 | Y996: 8 | Z996: 0 | AA996: 1188 | AB996: 1254 | AC996: 94.736842105263165 | AD996: 32
A997: PORT MELBOURNE | C997: WILSON | F997: FRASER | I997: WITHERS | K997: BONNETT | N997: SHANNON | Q997: METHERALL | W997: COBURG | X997: 7 | Y997: 9 | Z997: 0 | AA997: 1395 | AB997: 1262 | AC997: 110.53882725832013 | AD997: 28
A998: WILLIAMSTOWN | C998: KENT | F998: MARTIN | I998: LINTON | K998: RAMSAY | N998: BEITZEL | Q998: WOOKEY | W998: YARRAVILLE | X998: 6 | Y998: 10 | Z998: 0 | AA998: 1128 | AB998: 1320 | AC998: 85.454545454545453 | AD998: 24
A999: GOALKICKERS | W999: SANDRINGHAM | X999: 6 | Y999: 10 | Z999: 0 | AA999: 1248 | AB999: 1571 | AC999: 79.439847231063013 | AD999: 24
A1000: PORT MELBOURNE | C1000: BONNETT 4 | F1000: McBROOM | I1000: SHANNON | K1000: LEWIS | M1000: MILLER | O1000: WALSH | Q1000: ALLEN | W1000: OAKLEIGH | X1000: 5 | Y1000: 11 | Z1000: 0 | AA1000: 1159 | AB1000: 1303 | AC1000: 88.948580199539521 | AD1000: 20
A1001: WILLIAMSTOWN | C1001: MUNDAY 2 | F1001: LINTON | H1001: SIMPSON | J1001: ANDERSON | W1001: CAMBERWELL | X1001: 4 | Y1001: 12 | Z1001: 0 | AA1001: 1072 | AB1001: 1402 | AC1001: 76.46 | AD1001: 16
W1002: NORTHCOTE | X1002: 4 | Y1002: 12 | Z1002: 0 | AA1002: 962 | AB1002: 1310 | AC1002: 73.435114503816791 | AD1002: 16
A1003: BRUNSWICK | C1003: 3 | D1003: 3 | E1003: =C1003*6+D1003 -> 21 | G1003: 6 | H1003: 9 | I1003: =G1003*6+H1003 -> 45 | K1003: 11 | L1003: 13 | M1003: =K1003*6+L1003 -> 79 | O1003: 15 | P1003: 22 | Q1003: =O1003*6+P1003 -> 112 | S1003: BRUNSWICK | W1003: BRIGHTON | X1003: 1 | Y1003: 15 | Z1003: 0 | AA1003: 837 | AB1003: 1476 | AC1003: 56.707317073170735 | AD1003: 4
A1004: SANDRINGHAM | C1004: 1 | D1004: 3 | E1004: =C1004*6+D1004 -> 9 | G1004: 3 | H1004: 3 | I1004: =G1004*6+H1004 -> 21 | K1004: 6 | L1004: 6 | M1004: =K1004*6+L1004 -> 42 | O1004: 7 | P1004: 6 | Q1004: =O1004*6+P1004 -> 48 | S1004: ROWE
A1005: BEST PLAYERS
A1006: BRUNSWICK | C1006: WEIR | F1006: MCFARLANE | I1006: CARROLL | L1006: STANLEY | N1006: NEILSON | Q1006: DILLON
A1007: SANDRINGHAM | C1007: DAVIDSON | F1007: CLARKE | I1007: JOHNSTON | L1007: BRIGHTON | N1007: McMAHON | Q1007: SHEARER
A1008: GOALKICKERS
A1009: BRUNSWICK | C1009: McFEE 3 | E1009: WEIR 3 | G1009: HAYES 2 | I1009: STANLEY 2 | L1009: CLUES 2 | N1009: NEILSON | P1009: McMAHON | R1009: DILLON
A1010: SANDRINGHAM | C1010: R HARPER 4 | F1010: McMAHON 2 | I1010: RANSOM
A1012: YARRAVILLE | C1012: 2 | D1012: 4 | E1012: =C1012*6+D1012 -> 16 | G1012: 3 | H1012: 8 | I1012: =G1012*6+H1012 -> 26 | K1012: 7 | L1012: 13 | M1012: =K1012*6+L1012 -> 55 | O1012: 9 | P1012: 16 | Q1012: =O1012*6+P1012 -> 70 | S1012: YARRAVILLE
A1013: OAKLEIGH | C1013: 0 | D1013: 2 | E1013: =C1013*6+D1013 -> 2 | G1013: 1 | H1013: 5 | I1013: =G1013*6+H1013 -> 11 | K1013: 1 | L1013: 6 | M1013: =K1013*6+L1013 -> 12 | O1013: 6 | P1013: 9 | Q1013: =O1013*6+P1013 -> 45 | S1013: BREWER
A1014: BEST PLAYERS
A1015: YARRAVILLE | C1015: DRIVER | F1015: VANDERFEEN | I1015: WILD | K1015: COCKRAM | N1015: TAYLOR | Q1015: J ROHLEDER
A1016: OAKLEIGH | C1016: BAPTIST | F1016: COLLINS | I1016: TEMME | K1016: GUY | N1016: WILLIAMS | Q1016: LAMBERT
A1017: GOALKICKERS
A1018: YARRAVILLE | C1018: WILD 2 | E1018: HUTCHESON | H1018: S SMITH | J1018: WILCOX | M1018: CORORAN | O1018: TAYLOR | Q1018: N ROHLEDER | T1018: COOK
A1019: OAKLEIGH | C1019: HOWELL 2 | F1019: LONIE | H1019: WALSH | J1019: NICHOLSON | M1019: MUNYARD
A1021: BOX HILL | C1021: 1 | D1021: 1 | E1021: =C1021*6+D1021 -> 7 | G1021: 4 | H1021: 6 | I1021: =G1021*6+H1021 -> 30 | K1021: 5 | L1021: 7 | M1021: =K1021*6+L1021 -> 37 | O1021: 7 | P1021: 9 | Q1021: =O1021*6+P1021 -> 51 | S1021: CAMBERWELL
A1022: CAMBERWELL | C1022: 0 | D1022: 3 | E1022: =C1022*6+D1022 -> 3 | G1022: 0 | H1022: 5 | I1022: =G1022*6+H1022 -> 5 | K1022: 1 | L1022: 6 | M1022: =K1022*6+L1022 -> 12 | O1022: 3 | P1022: 9 | Q1022: =O1022*6+P1022 -> 27 | S1022: BARNETT
A1023: BEST PLAYERS
A1024: BOX HILL | C1024: RATTRAY | F1024: IRVINE | I1024: BROWN | L1024: DUNN | N1024: HOUGHTON | Q1024: LOVE
A1025: CAMBERWELL | C1025: K CLARKE | F1025: DEAGAN | I1025: TURNBULL | L1025: HEDLEY | N1025: HOLYOAK | Q1025: K JOHNSON
A1026: GOALKICKERS
A1027: BOX HILL | C1027: BROWN 4 | F1027: DUNN | H1027: EADE | J1027: WEBB
A1028: CAMBERWELL | C1028: HEDLEY 2 | F1028: TEMPANY
A1030: COBURG | C1030: 7 | D1030: 7 | E1030: =C1030*6+D1030 -> 49 | G1030: 9 | H1030: 8 | I1030: =G1030*6+H1030 -> 62 | K1030: 12 | L1030: 16 | M1030: =K1030*6+L1030 -> 88 | O1030: 16 | P1030: 18 | Q1030: =O1030*6+P1030 -> 114 | S1030: ELSTERNWICK PARK
A1031: BRIGHTON | C1031: 1 | D1031: 1 | E1031: =C1031*6+D1031 -> 7 | G1031: 5 | H1031: 7 | I1031: =G1031*6+H1031 -> 37 | K1031: 7 | L1031: 7 | M1031: =K1031*6+L1031 -> 49 | O1031: 11 | P1031: 8 | Q1031: =O1031*6+P1031 -> 74 | S1031: ROACH
A1032: BEST PLAYERS
A1033: COBURG | C1033: HEWES | E1033: FEWKES | H1033: MAHONEY | K1033: MILLER | N1033: SANDLANT | Q1033: H WILKINSON
A1034: BRIGHTON | C1034: STEVENS | E1034: TURNER | H1034: POUND | K1034: COCKFIELD | N1034: BOWLES | Q1034: ALEXANDER
A1035: GOALKICKERS
A1036: COBURG | C1036: H WILKINSON 4 | F1036: HEWES 4 | I1036: R BRENNAN 2 | L1036: MILLER 2 | N1036: THORNTON 2 | Q1036: MAHONEY | T1036: GOULLET
A1037: BRIGHTON | C1037: ALEXANDER 3 | F1037: BOWLES 3 | I1037: ASLING | K1037: HICKMAN | M1037: PRETTY | O1037: COURTNEY | R1037: JOSTLEAR
A1039: PRAHRAN | C1039: 1 | D1039: 1 | E1039: =C1039*6+D1039 -> 7 | G1039: 4 | H1039: 2 | I1039: =G1039*6+H1039 -> 26 | K1039: 5 | L1039: 3 | M1039: =K1039*6+L1039 -> 33 | O1039: 9 | P1039: 7 | Q1039: =O1039*6+P1039 -> 61 | S1039: NORTHCOTE
A1040: NORTHCOTE | C1040: 3 | D1040: 3 | E1040: =C1040*6+D1040 -> 21 | G1040: 6 | H1040: 7 | I1040: =G1040*6+H1040 -> 43 | K1040: 6 | L1040: 11 | M1040: =K1040*6+L1040 -> 47 | O1040: 7 | P1040: 13 | Q1040: =O1040*6+P1040 -> 55 | S1040: IRVING
A1041: BEST PLAYERS
A1042: PRAHRAN | C1042: SHILLABEER | F1042: GAZE | I1042: ELLIOTT | L1042: ROSS | N1042: PLAIN | Q1042: CLEAR
A1043: NORTHCOTE | C1043: STABB | F1043: GOUGH | I1043: GIBBS | L1043: J VAINS | N1043: DENEHY | Q1043: F VAINS
A1044: GOALKICKERS
A1045: PRAHRAN | C1045: CLEAR 2 | F1045: HEAD 2 | I1045: WILSON | K1045: ELLIOTT | M1045: RICKARDS | O1045: W JONES | Q1045: SNOW
A1046: NORTHCOTE | C1046: GIBBS 2 | F1046: McLAINE 2 | I1046: STABB | K1046: HOLT | M1046: COLLINS
A1048: ROUND 17 | E1048: 6TH AUGUST | J1048: WEATHER | M1048: STRONG NORTH WEST WIND | S1048: PLAYED AT
D1049: 1ST QTR | H1049: 2ND QTR | L1049: 3RD QTR | P1049: FINAL | S1049: PORT MELBOURNE
A1050: PORT MELBOURNE | C1050: 2 | D1050: 4 | E1050: =C1050*6+D1050 -> 16 | G1050: 4 | H1050: 10 | I1050: =G1050*6+H1050 -> 34 | K1050: 9 | L1050: 13 | M1050: =K1050*6+L1050 -> 67 | O1050: 10 | P1050: 16 | Q1050: =O1050*6+P1050 -> 76 | S1050: UMPIRE | X1050: LADDER | AB1050: ROUND | AD1050: 17
A1051: MOORABBIN | C1051: 0 | D1051: 2 | E1051: =C1051*6+D1051 -> 2 | G1051: 5 | H1051: 4 | I1051: =G1051*6+H1051 -> 34 | K1051: 5 | L1051: 5 | M1051: =K1051*6+L1051 -> 35 | O1051: 8 | P1051: 9 | Q1051: =O1051*6+P1051 -> 57 | S1051: IRVING
A1052: BEST PLAYERS | W1052: TEAM | X1052: W | Y1052: L | Z1052: D | AA1052: FOR | AB1052: AGST | AC1052: % | AD1052: PTS
A1053: PORT MELBOURNE | C1053: METHERALL | F1053: JOHNSON | I1053: WILSON | L1053: MILLER | O1053: STOREY | Q1053: ATKINSON
A1054: MOORABBIN | C1054: LAWRENCE | F1054: GILDER | I1054: RENWICK | L1054: CLOVER | O1054: MANIE | Q1054: OSTLE | W1054: PORT MELBOURNE | X1054: 15 | Y1054: 2 | Z1054: 0 | AA1054: 1719 | AB1054: 1217 | AC1054: 141.24897288414132 | AD1054: 60
A1055: GOALKICKERS | W1055: PRESTON | X1055: 14 | Y1055: 3 | Z1055: 0 | AA1055: 1465 | AB1055: 1070 | AC1055: 136.92 | AD1055: 56
A1056: PORT MELBOURNE | C1056: MILLER 2 | F1056: LEWIS 2 | I1056: WALSH 2 | K1056: TUCKER | M1056: SHANNON | O1056: McBROOM | Q1056: BONNETT | W1056: MOORABBIN | X1056: 13 | Y1056: 4 | Z1056: 0 | AA1056: 1544 | AB1056: 1127 | AC1056: 137.00088731144632 | AD1056: 52
A1057: MOORABBIN | C1057: RENWICK 2 | F1057: McGAW 2 | I1057: MANIE | K1057: SUTHERLAND | N1057: SCHOFIELD | Q1057: BRENNAN | W1057: WILLIAMSTOWN | X1057: 13 | Y1057: 4 | Z1057: 0 | AA1057: 1460 | AB1057: 1099 | AC1057: 132.84804367606915 | AD1057: 52
A1059: BRUNSWICK | C1059: 7 | D1059: 2 | E1059: =C1059*6+D1059 -> 44 | G1059: 9 | H1059: 3 | I1059: =G1059*6+H1059 -> 57 | K1059: 11 | L1059: 12 | M1059: =K1059*6+L1059 -> 78 | O1059: 13 | P1059: 13 | Q1059: =O1059*6+P1059 -> 91 | S1059: PRESTON | W1059: BRUNSWICK | X1059: 11 | Y1059: 6 | Z1059: 0 | AA1059: 1480 | AB1059: 1177 | AC1059: 125.74 | AD1059: 44
A1060: PRESTON | C1060: 2 | D1060: 1 | E1060: =C1060*6+D1060 -> 13 | G1060: 5 | H1060: 3 | I1060: =G1060*6+H1060 -> 33 | K1060: 5 | L1060: 3 | M1060: =K1060*6+L1060 -> 33 | O1060: 8 | P1060: 8 | Q1060: =O1060*6+P1060 -> 56 | S1060: BARNETT | W1060: BOX HILL | X1060: 9 | Y1060: 8 | Z1060: 0 | AA1060: 1273 | AB1060: 1293 | AC1060: 98.453209590100542 | AD1060: 36
A1061: BEST PLAYERS | W1061: COBURG | X1061: 8 | Y1061: 9 | Z1061: 0 | AA1061: 1475 | AB1061: 1322 | AC1061: 111.57337367624811 | AD1061: 32
A1062: BRUNSWICK | C1062: McFEE | F1062: MAY | I1062: WEIR | L1062: MULLENGER | O1062: ROLFS | Q1062: NEILSON | W1062: PRAHRAN | X1062: 8 | Y1062: 9 | Z1062: 0 | AA1062: 1344 | AB1062: 1413 | AC1062: 95.116772823779186 | AD1062: 32
A1063: PRESTON | C1063: BRADFORD | F1063: FOLEY | I1063: CROCKER | L1063: HENRYS | O1063: CUSACK | Q1063: HOBAN | W1063: SANDRINGHAM | X1063: 7 | Y1063: 10 | Z1063: 0 | AA1063: 1328 | AB1063: 1629 | AC1063: 81.522406384284835 | AD1063: 28
A1064: GOALKICKERS | W1064: YARRAVILLE | X1064: 6 | Y1064: 11 | Z1064: 0 | AA1064: 1188 | AB1064: 1400 | AC1064: 84.857142857142861 | AD1064: 24
A1065: BRUNSWICK | C1065: WEIR 4 | F1065: McFEE 3 | H1065: HAYES 2 | J1065: STANLEY | M1065: NEILSON | O1065: CLUES | Q1065: POLLARD | W1065: OAKLEIGH | X1065: 5 | Y1065: 12 | Z1065: 0 | AA1065: 1206 | AB1065: 1378 | AC1065: 87.518142235123364 | AD1065: 20
A1066: PRESTON | C1066: HOWARD 2 | F1066: FOLEY | H1066: MEREDITH | K1066: COOPER | M1066: K CHARD | O1066: HOBAN | Q1066: WEARNE | W1066: NORTHCOTE | X1066: 5 | Y1066: 12 | Z1066: 0 | AA1066: 1037 | AB1066: 1357 | AC1066: 76.418570375829034 | AD1066: 20
W1067: CAMBERWELL | X1067: 4 | Y1067: 13 | Z1067: 0 | AA1067: 1130 | AB1067: 1482 | AC1067: 76.25 | AD1067: 16
A1068: WILLIAMSTOWN | C1068: 2 | D1068: 2 | E1068: =C1068*6+D1068 -> 14 | G1068: 6 | H1068: 3 | I1068: =G1068*6+H1068 -> 39 | K1068: 13 | L1068: 5 | M1068: =K1068*6+L1068 -> 83 | O1068: 15 | P1068: 5 | Q1068: =O1068*6+P1068 -> 95 | S1068: WILLIAMSTOWN | W1068: BRIGHTON | X1068: 1 | Y1068: 16 | Z1068: 0 | AA1068: 876 | AB1068: 1561 | AC1068: 56.117873158231902 | AD1068: 4
A1069: PRAHRAN | C1069: 0 | D1069: 1 | E1069: =C1069*6+D1069 -> 1 | G1069: 2 | H1069: 5 | I1069: =G1069*6+H1069 -> 17 | K1069: 2 | L1069: 5 | M1069: =K1069*6+L1069 -> 17 | O1069: 4 | P1069: 8 | Q1069: =O1069*6+P1069 -> 32 | S1069: BEITZEL
A1070: BEST PLAYERS
A1071: WILLIAMSTOWN | C1071: RAMSAY | F1071: CURRAN | I1071: EVANS | L1071: LAURIE | N1071: MARTIN | Q1071: SIMPSON
A1072: PRAHRAN | C1072: ROY JONES | F1072: HART | I1072: SHILLABEER | L1072: ELLIOTT | N1072: CLEAR | Q1072: PAYNE
A1073: GOALKICKERS
A1074: WILLIAMSTOWN | C1074: LINTON 4 | F1074: McPHERSON 3 | I1074: FISHER 3 | K1074: SIMPSON 3 | N1074: EVANS | P1074: GEAR
A1075: PRAHRAN | C1075: KINNABURGH 2 | G1075: H BOYD | I1075: ELLIOTT
A1077: COBURG | C1077: 4 | D1077: 1 | E1077: =C1077*6+D1077 -> 25 | G1077: 6 | H1077: 10 | I1077: =G1077*6+H1077 -> 46 | K1077: 8 | L1077: 11 | M1077: =K1077*6+L1077 -> 59 | O1077: 11 | P1077: 14 | Q1077: =O1077*6+P1077 -> 80 | S1077: COBURG
A1078: YARRAVILLE | C1078: 3 | D1078: 5 | E1078: =C1078*6+D1078 -> 23 | G1078: 5 | H1078: 6 | I1078: =G1078*6+H1078 -> 36 | K1078: 8 | L1078: 10 | M1078: =K1078*6+L1078 -> 58 | O1078: 8 | P1078: 12 | Q1078: =O1078*6+P1078 -> 60 | S1078: ROWE
A1079: BEST PLAYERS
A1080: COBURG | C1080: MATTHEWS | F1080: MAHONEY | I1080: SANDLANT | L1080: H WILKINSON | O1080: HORSKINS | R1080: B McMAHON
A1081: YARRAVILLE | C1081: S SMITH | F1081: R SMITH | I1081: MASON | L1081: FRASER | O1081: J ROHLEDER | R1081: COCKRAM
A1082: GOALKICKERS
A1083: COBURG | C1083: HEWES 4 | F1083: H WILKINSON 2 | J1083: GOULLET 2 | M1083: HORSKINS | O1083: MILLER | Q1083: FITZPATRICK
A1084: YARRAVILLE | C1084: J ROHLEDER 2 | F1084: MASON | H1084: WILD | J1084: DRIVER | L1084: HUGHES | N1084: GARLICK | P1084: VANDERFEEN
A1086: SANDRINGHAM | C1086: 4 | D1086: 6 | E1086: =C1086*6+D1086 -> 30 | G1086: 4 | H1086: 8 | I1086: =G1086*6+H1086 -> 32 | K1086: 8 | L1086: 19 | M1086: =K1086*6+L1086 -> 67 | O1086: 10 | P1086: 20 | Q1086: =O1086*6+P1086 -> 80 | S1086: BEACH ROAD
A1087: CAMBERWELL | C1087: 0 | D1087: 0 | E1087: =C1087*6+D1087 -> 0 | G1087: 3 | H1087: 4 | I1087: =G1087*6+H1087 -> 22 | K1087: 5 | L1087: 5 | M1087: =K1087*6+L1087 -> 35 | O1087: 8 | P1087: 10 | Q1087: =O1087*6+P1087 -> 58 | S1087: BREWER
A1088: BEST PLAYERS
A1089: SANDRINGHAM | C1089: CONNINGSBY | F1089: BRIGHTON | I1089: DAVIDSON | L1089: WARD | N1089: FLEMING | Q1089: RANSOM
A1090: CAMBERWELL | C1090: HOLYOAK | F1090: TURNBULL | I1090: K CLARKE | L1090: SCHNEIDER | N1090: TOBIAS | Q1090: DEAGAN
A1091: GOALKICKERS
A1092: SANDRINGHAM | C1092: R HARPER 2 | F1092: FLEMING 2 | I1092: SHEARER 2 | L1092: BRIGHTON 2 | O1092: DAVIDSON | Q1092: McMAHON
A1093: CAMBERWELL | C1093: SCHNEIDER 4 | F1093: HEDLEY | I1093: WRIGHT | L1093: YOUNG | O1093: TURNBULL
A1095: NORTHCOTE | C1095: 2 | D1095: 4 | E1095: =C1095*6+D1095 -> 16 | G1095: 3 | H1095: 6 | I1095: =G1095*6+H1095 -> 24 | K1095: 8 | L1095: 7 | M1095: =K1095*6+L1095 -> 55 | O1095: 11 | P1095: 9 | Q1095: =O1095*6+P1095 -> 75 | S1095: OAKLEIGH
A1096: OAKLEIGH | C1096: 2 | D1096: 1 | E1096: =C1096*6+D1096 -> 13 | G1096: 2 | H1096: 4 | I1096: =G1096*6+H1096 -> 16 | K1096: 4 | L1096: 6 | M1096: =K1096*6+L1096 -> 30 | O1096: 6 | P1096: 11 | Q1096: =O1096*6+P1096 -> 47 | S1096: ROACH
A1097: BEST PLAYERS
A1098: NORTHCOTE | C1098: DENEHY | F1098: TULL | I1098: ROMARI | L1098: DEVINE | O1098: GIBBS | Q1098: F VAINS
A1099: OAKLEIGH | C1099: WILLIAMS | F1099: COLLINS | I1099: LAMBERT | L1099: SCOTT | O1099: HOWELL | Q1099: I'ANSON
A1100: GOALKICKERS
A1101: NORTHCOTE | C1101: ROMARI 4 | F1101: TULL 3 | H1101: PURDON 2 | K1101: DEVINE | M1101: GIBBS
A1102: OAKLEIGH | C1102: SCOTT 2 | F1102: HOWELL 2 | I1102: BURTON | K1102: D'ARCY
A1104: BOX HILL | C1104: 0 | D1104: 2 | E1104: =C1104*6+D1104 -> 2 | G1104: 2 | H1104: 6 | I1104: =G1104*6+H1104 -> 18 | K1104: 6 | L1104: 6 | M1104: =K1104*6+L1104 -> 42 | O1104: 12 | P1104: 13 | Q1104: =O1104*6+P1104 -> 85 | S1104: BOX HILL
A1105: BRIGHTON | C1105: 3 | D1105: 1 | E1105: =C1105*6+D1105 -> 19 | G1105: 3 | H1105: 1 | I1105: =G1105*6+H1105 -> 19 | K1105: 5 | L1105: 3 | M1105: =K1105*6+L1105 -> 33 | O1105: 6 | P1105: 3 | Q1105: =O1105*6+P1105 -> 39 | S1105: ROBINSON
A1106: BEST PLAYERS
A1107: BOX HILL | C1107: DUNN | E1107: HOUGHTON | H1107: GREEN | K1107: STREET | N1107: LOVE | Q1107: RATTRAY
A1108: BRIGHTON | C1108: TURNER | E1108: POUND | H1108: J DAVIDSON | K1108: ALEXANDER | N1108: JOSTLEAR | Q1108: KENT
A1109: GOALKICKERS
A1110: BOX HILL | C1110: DUNN 3 | E1110: INGLETON 3 | H1110: BROWN 2 | J1110: NODEN 2 | M1110: RATTRAY | O1110: MADDEN
A1111: BRIGHTON | C1111: ALEXANDER 2 | F1111: HICKMAN | I1111: J DAVIDSON | L1111: I DAVIDSON | O1111: KENT
A1113: ROUND 18 | E1113: 13TH AUGUST | J1113: WEATHER | M1113: NORTH WEST WIND SUNNY | S1113: PLAYED AT
D1114: 1ST QTR | H1114: 2ND QTR | L1114: 3RD QTR | P1114: FINAL | S1114: MOORABBIN
A1115: WILLIAMSTOWN | C1115: 3 | D1115: 2 | E1115: =C1115*6+D1115 -> 20 | G1115: 9 | H1115: 5 | I1115: =G1115*6+H1115 -> 59 | K1115: 14 | L1115: 8 | M1115: =K1115*6+L1115 -> 92 | O1115: 15 | P1115: 14 | Q1115: =O1115*6+P1115 -> 104 | S1115: UMPIRE | X1115: LADDER | AB1115: ROUND | AD1115: 18
A1116: MOORABBIN | C1116: 3 | D1116: 4 | E1116: =C1116*6+D1116 -> 22 | G1116: 5 | H1116: 6 | I1116: =G1116*6+H1116 -> 36 | K1116: 12 | L1116: 8 | M1116: =K1116*6+L1116 -> 80 | O1116: 14 | P1116: 11 | Q1116: =O1116*6+P1116 -> 95 | S1116: BARNETT
A1117: BEST PLAYERS | W1117: TEAM | X1117: W | Y1117: L | Z1117: D | AA1117: FOR | AB1117: AGST | AC1117: % | AD1117: PTS
A1118: WILLIAMSTOWN | C1118: SIMS | F1118: LINTON | I1118: MARTIN | L1118: CURRAN | N1118: FISHER | Q1118: OUTEN
A1119: MOORABBIN | C1119: RENWICK | F1119: SUTHERLAND | I1119: MORONEY | L1119: DYNON | N1119: GREEN | Q1119: BRENNAN | W1119: PORT MELBOURNE | X1119: 15 | Y1119: 2 | Z1119: 1 | AA1119: 1818 | AB1119: 1316 | AC1119: 138.14589665653494 | AD1119: 62
A1120: GOALKICKERS | W1120: PRESTON | X1120: 15 | Y1120: 3 | Z1120: 0 | AA1120: 1576 | AB1120: 1127 | AC1120: 139.84 | AD1120: 60
A1121: WILLIAMSTOWN | C1121: FISHER 3 | F1121: McPHERSON 3 | I1121: EVANS 3 | K1121: LINTON 2 | M1121: SMITH 2 | O1121: GEAR | Q1121: TAAFE | W1121: WILLIAMSTOWN | X1121: 14 | Y1121: 4 | Z1121: 0 | AA1121: 1564 | AB1121: 1194 | AC1121: 130.98827470686768 | AD1121: 56
A1122: MOORABBIN | C1122: SCHOFIELD 4 | F1122: RENWICK 3 | I1122: SUTHERLAND 2 | L1122: DYNON 2 | N1122: BOYD | P1122: McGAW | R1122: LEHMANN | W1122: MOORABBIN | X1122: 13 | Y1122: 5 | Z1122: 0 | AA1122: 1639 | AB1122: 1231 | AC1122: 133.14378554021121 | AD1122: 52
A1124: BRUNSWICK | C1124: 4 | D1124: 3 | E1124: =C1124*6+D1124 -> 27 | G1124: 6 | H1124: 4 | I1124: =G1124*6+H1124 -> 40 | K1124: 12 | L1124: 6 | M1124: =K1124*6+L1124 -> 78 | O1124: 15 | P1124: 9 | Q1124: =O1124*6+P1124 -> 99 | S1124: BRUNSWICK | W1124: BRUNSWICK | X1124: 11 | Y1124: 6 | Z1124: 1 | AA1124: 1579 | AB1124: 1276 | AC1124: 123.75 | AD1124: 46
A1125: PORT MELBOURNE | C1125: 2 | D1125: 5 | E1125: =C1125*6+D1125 -> 17 | G1125: 7 | H1125: 11 | I1125: =G1125*6+H1125 -> 53 | K1125: 9 | L1125: 13 | M1125: =K1125*6+L1125 -> 67 | O1125: 14 | P1125: 15 | Q1125: =O1125*6+P1125 -> 99 | S1125: ROACH | W1125: COBURG | X1125: 9 | Y1125: 9 | Z1125: 0 | AA1125: 1551 | AB1125: 1378 | AC1125: 112.5544267053701 | AD1125: 36
A1126: BEST PLAYERS | W1126: BOX HILL | X1126: 9 | Y1126: 9 | Z1126: 0 | AA1126: 1354 | AB1126: 1386 | AC1126: 97.691197691197686 | AD1126: 36
A1127: BRUNSWICK | C1127: CLUES | F1127: DILLON | I1127: MULLENGER | L1127: MCFEE | N1127: POLLARD | Q1127: McFARLANE | W1127: PRAHRAN | X1127: 9 | Y1127: 9 | Z1127: 0 | AA1127: 1426 | AB1127: 1463 | AC1127: 97.47 | AD1127: 36
A1128: PORT MELBOURNE | C1128: JOHNSON | F1128: SYKES | I1128: MILLER | L1128: BONNETT | N1128: McDONALD | Q1128: BRAGG | W1128: SANDRINGHAM | X1128: 8 | Y1128: 10 | Z1128: 0 | AA1128: 1426 | AB1128: 1707 | AC1128: 83.538371411833623 | AD1128: 32
A1129: GOALKICKERS | W1129: YARRAVILLE | X1129: 7 | Y1129: 11 | Z1129: 0 | AA1129: 1281 | AB1129: 1481 | AC1129: 86.495611073598923 | AD1129: 28
A1130: BRUNSWICK | C1130: CLUES 6 | F1130: HAYES 4 | I1130: DILLON 3 | L1130: CARROLL | N1130: MCFEE | W1130: OAKLEIGH | X1130: 5 | Y1130: 13 | Z1130: 0 | AA1130: 1256 | AB1130: 1460 | AC1130: 86.03 | AD1130: 20
A1131: PORT MELBOURNE | C1131: BONNETT 4 | F1131: SYKES 4 | I1131: WALSH 3 | L1131: JOHNSON 2 | O1131: MILLER | W1131: NORTHCOTE | X1131: 5 | Y1131: 13 | Z1131: 0 | AA1131: 1093 | AB1131: 1433 | AC1131: 76.273551988834612 | AD1131: 20
W1132: CAMBERWELL | X1132: 4 | Y1132: 14 | Z1132: 0 | AA1132: 1187 | AB1132: 1593 | AC1132: 74.51 | AD1132: 16
A1133: YARRAVILLE | C1133: 2 | D1133: 2 | E1133: =C1133*6+D1133 -> 14 | G1133: 8 | H1133: 5 | I1133: =G1133*6+H1133 -> 53 | K1133: 10 | L1133: 12 | M1133: =K1133*6+L1133 -> 72 | O1133: 13 | P1133: 15 | Q1133: =O1133*6+P1133 -> 93 | S1133: YARRAVILLE | W1133: BRIGHTON | X1133: 1 | Y1133: 17 | Z1133: 0 | AA1133: 954 | AB1133: 1659 | AC1133: 57.504520795660035 | AD1133: 4
A1134: BOX HILL | C1134: 7 | D1134: 3 | E1134: =C1134*6+D1134 -> 45 | G1134: 8 | H1134: 3 | I1134: =G1134*6+H1134 -> 51 | K1134: 11 | L1134: 7 | M1134: =K1134*6+L1134 -> 73 | O1134: 12 | P1134: 9 | Q1134: =O1134*6+P1134 -> 81 | S1134: BREWER
A1135: BEST PLAYERS
A1136: YARRAVILLE | C1136: K SMITH | F1136: HUGHES | I1136: VANDERFEEN | L1136: R SMITH | O1136: WILCOX | Q1136: JONES
A1137: BOX HILL | C1137: GREEN | F1137: WEBB | I1137: DEACON | L1137: WTIGHT | O1137: DUNN | Q1137: NICHOLSON
A1138: GOALKICKERS
A1139: YARRAVILLE | C1139: WILCOX 5 | F1139: WILD 2 | H1139: HUGHES | J1139: FRASER | L1139: VANDERFEEN | O1139: DRIVER | Q1139: COOK | S1139: GARLICK
A1140: BOX HILL | C1140: BROWN 4 | F1140: WEBB 2 | H1140: DUNN 2 | J1140: INGLETON 2 | M1140: NODEN 2
A1142: PRAHRAN | C1142: 4 | D1142: 4 | E1142: =C1142*6+D1142 -> 28 | G1142: 7 | H1142: 6 | I1142: =G1142*6+H1142 -> 48 | K1142: 8 | L1142: 6 | M1142: =K1142*6+L1142 -> 54 | O1142: 12 | P1142: 10 | Q1142: =O1142*6+P1142 -> 82 | S1142: TOORAK PARK
A1143: OAKLEIGH | C1143: 3 | D1143: 1 | E1143: =C1143*6+D1143 -> 19 | G1143: 3 | H1143: 6 | I1143: =G1143*6+H1143 -> 24 | K1143: 5 | L1143: 12 | M1143: =K1143*6+L1143 -> 42 | O1143: 6 | P1143: 14 | Q1143: =O1143*6+P1143 -> 50 | S1143: ROBINSON
A1144: BEST PLAYERS
A1145: PRAHRAN | C1145: GAZE | E1145: SIMPSON | H1145: HARVEY | K1145: SHILLABEER | N1145: WILSON | Q1145: PLAIN
A1146: OAKLEIGH | C1146: COLLINS | E1146: NICHOLSON | H1146: LAMBERT | K1146: GUY | N1146: SCOTT | Q1146: BURCH
A1147: GOALKICKERS
A1148: PRAHRAN | C1148: KINNABURGH 2 | F1148: HARVEY 2 | I1148: WILSON 2 | K1148: SIMPSON | M1148: SHARP | O1148: CLEAR | Q1148: ELLIOTT | S1148: HART | U1148: RICKARDS
A1149: OAKLEIGH | C1149: NICHOLSON 2 | F1149: LONIE 2 | I1149: SCOTT | K1149: WEBSTER
A1151: SANDRINGHAM | C1151: 2 | D1151: 3 | E1151: =C1151*6+D1151 -> 15 | G1151: 8 | H1151: 8 | I1151: =G1151*6+H1151 -> 56 | K1151: 12 | L1151: 11 | M1151: =K1151*6+L1151 -> 83 | O1151: 14 | P1151: 14 | Q1151: =O1151*6+P1151 -> 98 | S1151: ELSTERNWICK PARK
A1152: BRIGHTON | C1152: 5 | D1152: 3 | E1152: =C1152*6+D1152 -> 33 | G1152: 6 | H1152: 4 | I1152: =G1152*6+H1152 -> 40 | K1152: 9 | L1152: 4 | M1152: =K1152*6+L1152 -> 58 | O1152: 12 | P1152: 6 | Q1152: =O1152*6+P1152 -> 78 | S1152: IRVNG
A1153: BEST PLAYERS
A1154: SANDRINGHAM | C1154: R HARPER | F1154: HAMBLY | I1154: GRUMLEY | K1154: SHEARER | N1154: McMAHON | Q1154: KRAUSE
A1155: BRIGHTON | C1155: I DAVIDSON | F1155: EMBLETON | I1155: POUND | K1155: STEVENS | N1155: TURNER | Q1155: PRETTY
A1156: GOALKICKERS
A1157: SANDRINGHAM | C1157: R HARPER 7 | F1157: McMAHON 3 | I1157: FLETCHER 2 | L1157: RANSOM | N1157: SHEARER
A1158: BRIGHTON | C1158: I DAVIDSON 8 | F1158: GRIENKE 2 | I1158: ALEXANDER | L1158: KENT
A1160: COBURG | C1160: 2 | D1160: 4 | E1160: =C1160*6+D1160 -> 16 | G1160: 6 | H1160: 4 | I1160: =G1160*6+H1160 -> 40 | K1160: 11 | L1160: 7 | M1160: =K1160*6+L1160 -> 73 | O1160: 11 | P1160: 10 | Q1160: =O1160*6+P1160 -> 76 | S1160: NORTHCOTE
A1161: NORTHCOTE | C1161: 1 | D1161: 2 | E1161: =C1161*6+D1161 -> 8 | G1161: 3 | H1161: 7 | I1161: =G1161*6+H1161 -> 25 | K1161: 6 | L1161: 8 | M1161: =K1161*6+L1161 -> 44 | O1161: 7 | P1161: 14 | Q1161: =O1161*6+P1161 -> 56 | S1161: SMYTH
A1162: BEST PLAYERS
A1163: COBURG | C1163: MAHINEY | F1163: SANDLANT | I1163: HEWES | K1163: H WILKINSON | N1163: B McMAHON | Q1163: SHORT
A1164: NORTHCOTE | C1164: STABB | F1164: WOOLNOUGH | I1164: PURDON | K1164: GIBBS | N1164: WALKER | Q1164: BOOTH
A1165: GOALKICKERS
A1166: COBURG | C1166: HEWES 6 | F1166: GOULLET 2 | I1166: YORK | K1166: MAHONEY | M1166: FITZPATRICK
A1167: NORTHCOTE | C1167: ROMARI 3 | F1167: DEVINE 2 | I1167: JOHNSTON | L1167: GIBBS
A1169: PRESTON | C1169: 1 | D1169: 2 | E1169: =C1169*6+D1169 -> 8 | G1169: 8 | H1169: 6 | I1169: =G1169*6+H1169 -> 54 | K1169: 13 | L1169: 8 | M1169: =K1169*6+L1169 -> 86 | O1169: 16 | P1169: 15 | Q1169: =O1169*6+P1169 -> 111 | S1169: CAMBERWELL
A1170: CAMBERWELL | C1170: 2 | D1170: 7 | E1170: =C1170*6+D1170 -> 19 | G1170: 3 | H1170: 8 | I1170: =G1170*6+H1170 -> 26 | K1170: 5 | L1170: 12 | M1170: =K1170*6+L1170 -> 42 | O1170: 7 | P1170: 15 | Q1170: =O1170*6+P1170 -> 57 | S1170: ROWE
A1171: BEST PLAYERS
A1172: PRESTON | C1172: HENRYS | E1172: BRADFORD | H1172: LALOR | K1172: CROCKER | N1172: COOPER | Q1172: CUSACK
A1173: CAMBERWELL | C1173: MASON | E1173: YOUNG | H1173: K JOHNSON | K1173: HOLYOAK | N1173: DEAGAN | Q1173: K CLARKE
A1174: GOALKICKERS
A1175: PRESTON | C1175: HOWARD 4 | F1175: LALOR 3 | H1175: HAYES 2 | J1175: BRADFORD 2 | M1175: LITTLE 2 | O1175: JEFFREY | Q1175: FOLEY | S1175: WATT
A1176: CAMBERWELL | C1176: MATTHEWS 3 | F1176: DUFF | H1176: LANE | J1176: SCHNEIDER | M1176: HEDLEY
A1178: ROUND 19 | E1178: 20TH AUGUST | J1178: WEATHER | M1178: NORTH WEST WIND MORNING RAIN | S1178: PLAYED AT
D1179: 1ST QTR | H1179: 2ND QTR | L1179: 3RD QTR | P1179: FINAL | S1179: MOORABBIN
A1180: MOORABBIN | C1180: 5 | D1180: 4 | E1180: =C1180*6+D1180 -> 34 | G1180: 6 | H1180: 4 | I1180: =G1180*6+H1180 -> 40 | K1180: 9 | L1180: 4 | M1180: =K1180*6+L1180 -> 58 | O1180: 9 | P1180: 4 | Q1180: =O1180*6+P1180 -> 58 | S1180: UMPIRE | X1180: LADDER | AB1180: ROUND | AD1180: 19
A1181: BRUNSWICK | C1181: 1 | D1181: 1 | E1181: =C1181*6+D1181 -> 7 | G1181: 4 | H1181: 4 | I1181: =G1181*6+H1181 -> 28 | K1181: 4 | L1181: 5 | M1181: =K1181*6+L1181 -> 29 | O1181: 7 | P1181: 6 | Q1181: =O1181*6+P1181 -> 48 | S1181: BREWER
A1182: BEST PLAYERS | W1182: TEAM | X1182: W | Y1182: L | Z1182: D | AA1182: FOR | AB1182: AGST | AC1182: % | AD1182: PTS
A1183: MOORABBIN | C1183: DYNON | E1183: SCHOFIELD | H1183: MURPHY | K1183: A BOYD | N1183: LAWRENCE | Q1183: TREZISE
A1184: BRUNSWICK | C1184: WEIR | E1184: McFEE | H1184: DILLON | K1184: EDWARDS | N1184: YEA | Q1184: MAY | W1184: PORT MELBOURNE | X1184: 16 | Y1184: 2 | Z1184: 1 | AA1184: 1896 | AB1184: 1388 | AC1184: 136.59942363112393 | AD1184: 66
A1185: GOALKICKERS | W1185: PRESTON | X1185: 16 | Y1185: 3 | Z1185: 0 | AA1185: 1657 | AB1185: 1159 | AC1185: 142.97 | AD1185: 64
A1186: MOORABBIN | C1186: SCHOFIELD 6 | F1186: BRENNAN 2 | I1186: MURPHY | W1186: WILLIAMSTOWN | X1186: 15 | Y1186: 4 | Z1186: 0 | AA1186: 1668 | AB1186: 1213 | AC1186: 137.51030502885408 | AD1186: 60
A1187: BRUNSWICK | C1187: McFEE 2 | F1187: LOVETT 2 | I1187: DILLON | K1187: NEILSON | M1187: McMAHON | W1187: MOORABBIN | X1187: 14 | Y1187: 5 | Z1187: 0 | AA1187: 1697 | AB1187: 1279 | AC1187: 132.6817826426896 | AD1187: 56
A1189: COBURG | C1189: 3 | D1189: 5 | E1189: =C1189*6+D1189 -> 23 | G1189: 5 | H1189: 6 | I1189: =G1189*6+H1189 -> 36 | K1189: 9 | L1189: 12 | M1189: =K1189*6+L1189 -> 66 | O1189: 13 | P1189: 12 | Q1189: =O1189*6+P1189 -> 90 | S1189: COBURG | W1189: BRUNSWICK | X1189: 11 | Y1189: 7 | Z1189: 1 | AA1189: 1627 | AB1189: 1334 | AC1189: 121.96 | AD1189: 46
A1190: PRAHRAN | C1190: 0 | D1190: 2 | E1190: =C1190*6+D1190 -> 2 | G1190: 4 | H1190: 5 | I1190: =G1190*6+H1190 -> 29 | K1190: 4 | L1190: 5 | M1190: =K1190*6+L1190 -> 29 | O1190: 6 | P1190: 9 | Q1190: =O1190*6+P1190 -> 45 | S1190: IRVING | W1190: COBURG | X1190: 10 | Y1190: 9 | Z1190: 0 | AA1190: 1641 | AB1190: 1423 | AC1190: 115.31974701335207 | AD1190: 40
A1191: BEST PLAYERS | W1191: BOX HILL | X1191: 10 | Y1191: 9 | Z1191: 0 | AA1191: 1413 | AB1191: 1438 | AC1191: 98.261474269819189 | AD1191: 40
A1192: COBURG | C1192: H WILKINSON | F1192: MILES | I1192: SHORT | L1192: B McMAHON | O1192: HEWES | Q1192: MATTHEWS | W1192: PRAHRAN | X1192: 9 | Y1192: 10 | Z1192: 0 | AA1192: 1471 | AB1192: 1553 | AC1192: 94.72 | AD1192: 36
A1193: PRAHRAN | C1193: GAZE | F1193: GAFFNEY | I1193: R JONES | L1193: HARVEY | O1193: PLAIN | Q1193: ELLIOTT | W1193: YARRAVILLE | X1193: 8 | Y1193: 11 | Z1193: 0 | AA1193: 1362 | AB1193: 1560 | AC1193: 87.307692307692307 | AD1193: 32
A1194: GOALKICKERS | W1194: SANDRINGHAM | X1194: 8 | Y1194: 11 | Z1194: 0 | AA1194: 1505 | AB1194: 1788 | AC1194: 84.172259507829978 | AD1194: 32
A1195: COBURG | C1195: HEWES 7 | F1195: H WILKINSON 2 | J1195: GOULLET 2 | M1195: STUBBS | O1195: HORSKINS | W1195: OAKLEIGH | X1195: 5 | Y1195: 14 | Z1195: 0 | AA1195: 1275 | AB1195: 1564 | AC1195: 81.52 | AD1195: 20
A1196: PRAHRAN | C1196: WILSON 2 | F1196: ELLIOTT | H1196: CLEAR | J1196: HEALEY | L1196: KINNABURGH | W1196: NORTHCOTE | X1196: 5 | Y1196: 14 | Z1196: 0 | AA1196: 1145 | AB1196: 1492 | AC1196: 76.742627345844511 | AD1196: 20
W1197: CAMBERWELL | X1197: 4 | Y1197: 15 | Z1197: 0 | AA1197: 1259 | AB1197: 1671 | AC1197: 75.34 | AD1197: 16
A1198: YARRAVILLE | C1198: 0 | D1198: 2 | E1198: =C1198*6+D1198 -> 2 | G1198: 7 | H1198: 12 | I1198: =G1198*6+H1198 -> 54 | K1198: 9 | L1198: 12 | M1198: =K1198*6+L1198 -> 66 | O1198: 11 | P1198: 15 | Q1198: =O1198*6+P1198 -> 81 | S1198: BEACH ROAD | W1198: BRIGHTON | X1198: 1 | Y1198: 18 | Z1198: 0 | AA1198: 986 | AB1198: 1740 | AC1198: 56.666666666666664 | AD1198: 4
A1199: SANDRINGHAM | C1199: 5 | D1199: 7 | E1199: =C1199*6+D1199 -> 37 | G1199: 6 | H1199: 7 | I1199: =G1199*6+H1199 -> 43 | K1199: 11 | L1199: 11 | M1199: =K1199*6+L1199 -> 77 | O1199: 11 | P1199: 13 | Q1199: =O1199*6+P1199 -> 79 | S1199: BARNETT
A1200: BEST PLAYERS
A1201: YARRAVILLE | C1201: MITCHELL | F1201: FRASER | I1201: GARLICK | K1201: VANDERFEEN | N1201: WILD | Q1201: HUTCHESON
A1202: SANDRINGHAM | C1202: BRIGHTON | F1202: KRAUSE | I1202: EVANS | K1202: WARD | N1202: SHEARER | Q1202: FLETCHER
A1203: GOALKICKERS
A1204: YARRAVILLE | C1204: VANDERFEEN 3 | F1204: WILCOX 2 | I1204: WILD 2 | K1204: GARLICK 2 | N1204: MASON 2
A1205: SANDRINGHAM | C1205: EVANS 4 | E1205: CLARKE | G1205: RANSOM | I1205: R HARPER | K1205: McMAHON | M1205: FLEMING | O1205: HAMBLY | Q1205: FLETCHER
A1207: BOX HILL | C1207: 6 | D1207: 0 | E1207: =C1207*6+D1207 -> 36 | G1207: 8 | H1207: 0 | I1207: =G1207*6+H1207 -> 48 | K1207: 9 | L1207: 3 | M1207: =K1207*6+L1207 -> 57 | O1207: 9 | P1207: 5 | Q1207: =O1207*6+P1207 -> 59 | S1207: BOX HILL
A1208: NORTHCOTE | C1208: 1 | D1208: 1 | E1208: =C1208*6+D1208 -> 7 | G1208: 5 | H1208: 4 | I1208: =G1208*6+H1208 -> 34 | K1208: 5 | L1208: 8 | M1208: =K1208*6+L1208 -> 38 | O1208: 7 | P1208: 10 | Q1208: =O1208*6+P1208 -> 52 | S1208: ROACH
A1209: BEST PLAYERS
A1210: BOX HILL | C1210: DUNN | F1210: LOVE | H1210: EADE | K1210: NICHOLSON | N1210: GASCOYNE | Q1210: IRVINE
A1211: NORTHCOTE | C1211: ALDRIDGE | F1211: TULL | H1211: STABB | K1211: WOOLNOUGH | N1211: COLLINS | Q1211: C POWELL
A1212: GOALKICKERS
A1213: BOX HILL | C1213: DUNN 4 | F1213: EADE 3 | H1213: NODEN | J1213: BLENHEIM
A1214: NORTHCOTE | C1214: COLLINS 2 | F1214: GIBBS 2 | H1214: ROMARI 2 | K1214: JOHNSON
A1216: WILLIAMSTOWN | C1216: 2 | D1216: 3 | E1216: =C1216*6+D1216 -> 15 | G1216: 7 | H1216: 6 | I1216: =G1216*6+H1216 -> 48 | K1216: 11 | L1216: 8 | M1216: =K1216*6+L1216 -> 74 | O1216: 15 | P1216: 14 | Q1216: =O1216*6+P1216 -> 104 | S1216: WILLIAMSTOWN
A1217: OAKLEIGH | C1217: 1 | D1217: 1 | E1217: =C1217*6+D1217 -> 7 | G1217: 1 | H1217: 3 | I1217: =G1217*6+H1217 -> 9 | K1217: 2 | L1217: 7 | M1217: =K1217*6+L1217 -> 19 | O1217: 2 | P1217: 7 | Q1217: =O1217*6+P1217 -> 19 | S1217: ROWE
A1218: BEST PLAYERS
A1219: WILLIAMSTOWN | C1219: LINTON | F1219: OUTEN | I1219: TAAFE | L1219: JONES | N1219: CURRAN | Q1219: BEITZEL
A1220: OAKLEIGH | C1220: SCOTT | F1220: GUY | I1220: COLLINS | L1220: I'ANSON | N1220: STANBOROUGH | Q1220: BAPTIST
A1221: GOALKICKERS
A1222: WILLIAMSTOWN | C1222: LINTON 4 | F1222: McPHERSON 4 | I1222: WHITTAKER 2 | L1222: GEAR 2 | N1222: SMITH 2 | Q1222: FISHER
A1223: OAKLEIGH | C1223: DOQUILLE | F1223: LONIE
A1225: PORT MELBOURNE | C1225: 2 | D1225: 1 | E1225: =C1225*6+D1225 -> 13 | G1225: 6 | H1225: 3 | I1225: =G1225*6+H1225 -> 39 | K1225: 7 | L1225: 4 | M1225: =K1225*6+L1225 -> 46 | O1225: 12 | P1225: 6 | Q1225: =O1225*6+P1225 -> 78 | S1225: PORT MELBOURNE
A1226: CAMBERWELL | C1226: 1 | D1226: 3 | E1226: =C1226*6+D1226 -> 9 | G1226: 2 | H1226: 5 | I1226: =G1226*6+H1226 -> 17 | K1226: 8 | L1226: 11 | M1226: =K1226*6+L1226 -> 59 | O1226: 10 | P1226: 12 | Q1226: =O1226*6+P1226 -> 72 | S1226: ROBINSON
A1227: BEST PLAYERS
A1228: PORT MELBOURNE | C1228: JOHNSON | F1228: LEWIS | I1228: BONNETT | L1228: WITHERS | N1228: ATKINSON | Q1228: STOREY
A1229: CAMBERWELL | C1229: HOLYOAK | F1229: MASON | I1229: HEDLEY | L1229: BENBOW | N1229: DEAGAN | Q1229: YOUNG
A1230: GOALKICKERS
A1231: PORT MELBOURNE | C1231: BONNETT 5 | F1231: McBROOM 4 | I1231: MILLER 2 | L1231: SYKES
A1232: CAMBERWELL | C1232: HEDLEY 2 | F1232: WRIGHT 2 | I1232: MASON 2 | K1232: McGUINNESS | N1232: YOUNG | P1232: TURNBULL | S1232: BENBOW
A1234: PRESTON | C1234: 5 | D1234: 8 | E1234: =C1234*6+D1234 -> 38 | G1234: 6 | H1234: 9 | I1234: =G1234*6+H1234 -> 45 | K1234: 10 | L1234: 13 | M1234: =K1234*6+L1234 -> 73 | O1234: 11 | P1234: 15 | Q1234: =O1234*6+P1234 -> 81 | S1234: PRESTON
A1235: BRIGHTON | C1235: 0 | D1235: 0 | E1235: =C1235*6+D1235 -> 0 | G1235: 2 | H1235: 7 | I1235: =G1235*6+H1235 -> 19 | K1235: 2 | L1235: 7 | M1235: =K1235*6+L1235 -> 19 | O1235: 3 | P1235: 14 | Q1235: =O1235*6+P1235 -> 32 | S1235: ALLEN
A1236: BEST PLAYERS
A1237: PRESTON | C1237: BRADFORD | F1237: McLACHLAN | I1237: LALOR | L1237: McBEAN | N1237: CUSACK | Q1237: K CHARD
A1238: BRIGHTON | C1238: STEVENS | F1238: TURNER | I1238: JOSTLEAR | L1238: PRETTY | N1238: GRIENKE | Q1238: ALEXANDER
A1239: GOALKICKERS
A1240: PRESTON | C1240: BRADFORD 3 | F1240: LALOR 2 | I1240: HOWARD 2 | L1240: WATT | N1240: HOBAN | P1240: MILLS | R1240: FOLEY
A1241: BRIGHTON | C1241: CARROLL 2 | F1241: ALEXANDER
A1243: ROUND 20 | E1243: 27TH AUGUST | J1243: WEATHER | O1243: NORTH WEST WIND | S1243: PLAYED AT
D1244: 1ST QTR | H1244: 2ND QTR | L1244: 3RD QTR | P1244: FINAL | S1244: WILLIAMSTOWN
A1245: WILLIAMSTOWN | C1245: 3 | D1245: 2 | E1245: =C1245*6+D1245 -> 20 | G1245: 11 | H1245: 6 | I1245: =G1245*6+H1245 -> 72 | K1245: 15 | L1245: 9 | M1245: =K1245*6+L1245 -> 99 | O1245: 18 | P1245: 13 | Q1245: =O1245*6+P1245 -> 121 | S1245: UMPIRE | X1245: LADDER | AB1245: ROUND | AD1245: 20
A1246: BOX HILL | C1246: 2 | D1246: 5 | E1246: =C1246*6+D1246 -> 17 | G1246: 3 | H1246: 6 | I1246: =G1246*6+H1246 -> 24 | K1246: 5 | L1246: 9 | M1246: =K1246*6+L1246 -> 39 | O1246: 6 | P1246: 12 | Q1246: =O1246*6+P1246 -> 48 | S1246: IRVING
A1247: BEST PLAYERS | W1247: TEAM | X1247: W | Y1247: L | Z1247: D | AA1247: FOR | AB1247: AGST | AC1247: % | AD1247: PTS
A1248: WILLIAMSTOWN | C1248: MARTIN | F1248: CURRAN | I1248: LINTON | L1248: JONES | N1248: SMITH | Q1248: EVANS
A1249: BOX HILL | C1249: DUNN | F1249: RATTRAY | I1249: GREEN | L1249: NODEN | N1249: BLENHEIM | Q1249: WRIGHT | W1249: PORT MELBOURNE | X1249: 17 | Y1249: 2 | Z1249: 1 | AA1249: 2061 | AB1249: 1442 | AC1249: 142.92649098474342 | AD1249: 70
A1250: GOALKICKERS | W1250: PRESTON | X1250: 17 | Y1250: 3 | Z1250: 0 | AA1250: 1767 | AB1250: 1235 | AC1250: 143.08 | AD1250: 68
A1251: WILLIAMSTOWN | C1251: LINTON 6 | F1251: SIMPSON 5 | I1251: FISHER 3 | K1251: GEAR 2 | M1251: CALLAHAN | P1251: JONES | W1251: WILLIAMSTOWN | X1251: 16 | Y1251: 4 | Z1251: 0 | AA1251: 1789 | AB1251: 1261 | AC1251: 141.87153053132434 | AD1251: 64
A1252: BOX HILL | C1252: NODEN | E1252: DUNN | G1252: BROWN | I1252: BLENHEIM | L1252: INGLETON | O1252: GREEN | W1252: MOORABBIN | X1252: 14 | Y1252: 6 | Z1252: 0 | AA1252: 1762 | AB1252: 1348 | AC1252: 130.71216617210683 | AD1252: 56
A1254: PRESTON | C1254: 5 | D1254: 4 | E1254: =C1254*6+D1254 -> 34 | G1254: 9 | H1254: 12 | I1254: =G1254*6+H1254 -> 66 | K1254: 13 | L1254: 14 | M1254: =K1254*6+L1254 -> 92 | O1254: 16 | P1254: 14 | Q1254: =O1254*6+P1254 -> 110 | S1254: TOORAK PARK | W1254: BRUNSWICK | X1254: 11 | Y1254: 8 | Z1254: 1 | AA1254: 1690 | AB1254: 1401 | AC1254: 120.63 | AD1254: 46
A1255: PRAHRAN | C1255: 3 | D1255: 1 | E1255: =C1255*6+D1255 -> 19 | G1255: 5 | H1255: 2 | I1255: =G1255*6+H1255 -> 32 | K1255: 7 | L1255: 7 | M1255: =K1255*6+L1255 -> 49 | O1255: 11 | P1255: 10 | Q1255: =O1255*6+P1255 -> 76 | S1255: E BREWER | W1255: COBURG | X1255: 11 | Y1255: 9 | Z1255: 0 | AA1255: 1745 | AB1255: 1523 | AC1255: 114.57649376231123 | AD1255: 44
A1256: BEST PLAYERS | W1256: BOX HILL | X1256: 10 | Y1256: 10 | Z1256: 0 | AA1256: 1461 | AB1256: 1559 | AC1256: 93.713919178960879 | AD1256: 40
A1257: PRESTON | C1257: F CHARD | F1257: McBEAN | I1257: FOLEY | K1257: BRADFORD | N1257: LALOR | Q1257: HOBAN | W1257: PRAHRAN | X1257: 9 | Y1257: 11 | Z1257: 0 | AA1257: 1547 | AB1257: 1663 | AC1257: 93.02 | AD1257: 36
A1258: PRAHRAN | C1258: ELLIOTT | F1258: WILSON | I1258: HARVEY | K1258: C BOYD | N1258: ROY JONES | Q1258: GAZE | W1258: YARRAVILLE | X1258: 9 | Y1258: 11 | Z1258: 0 | AA1258: 1429 | AB1258: 1623 | AC1258: 88.046826863832408 | AD1258: 36
A1259: GOALKICKERS | W1259: SANDRINGHAM | X1259: 8 | Y1259: 12 | Z1259: 0 | AA1259: 1560 | AB1259: 1888 | AC1259: 82.627118644067792 | AD1259: 32
A1260: PRESTON | C1260: F CHARD 10 | F1260: FOLEY | H1260: HOWARD | J1260: LALOR | L1260: OSBORNE | N1260: BRADFORD | Q1260: LITTLE | W1260: NORTHCOTE | X1260: 6 | Y1260: 14 | Z1260: 0 | AA1260: 1245 | AB1260: 1547 | AC1260: 80.478345184227535 | AD1260: 24
A1261: PRAHRAN | C1261: KINNABURGH 4 | F1261: CLEAR 3 | H1261: WILSON 2 | J1261: ELLIOTT 2 | W1261: OAKLEIGH | X1261: 5 | Y1261: 15 | Z1261: 0 | AA1261: 1375 | AB1261: 1668 | AC1261: 82.43 | AD1261: 20
W1262: CAMBERWELL | X1262: 5 | Y1262: 15 | Z1262: 0 | AA1262: 1328 | AB1262: 1736 | AC1262: 76.5 | AD1262: 20
A1263: YARRAVILLE | C1263: 2 | D1263: 1 | E1263: =C1263*6+D1263 -> 13 | G1263: 4 | H1263: 4 | I1263: =G1263*6+H1263 -> 28 | K1263: 8 | L1263: 8 | M1263: =K1263*6+L1263 -> 56 | O1263: 9 | P1263: 13 | Q1263: =O1263*6+P1263 -> 67 | S1263: BRUNSWICK | W1263: BRIGHTON | X1263: 1 | Y1263: 19 | Z1263: 0 | AA1263: 1040 | AB1263: 1905 | AC1263: 54.593175853018373 | AD1263: 4
A1264: BRUNSWICK | C1264: 3 | D1264: 8 | E1264: =C1264*6+D1264 -> 26 | G1264: 6 | H1264: 9 | I1264: =G1264*6+H1264 -> 45 | K1264: 8 | L1264: 11 | M1264: =K1264*6+L1264 -> 59 | O1264: 8 | P1264: 15 | Q1264: =O1264*6+P1264 -> 63 | S1264: ROBINSON
A1265: BEST PLAYERS
A1266: YARRAVILLE | C1266: WILD | F1266: MASON | I1266: MITCHELL | L1266: J ROHLEDER | O1266: COOK | Q1266: S SMITH
A1267: BRUNSWICK | C1267: CARROLL | F1267: WEIR | I1267: EDWARDS | L1267: JAMES | O1267: SIMPSON | Q1267: DILLON
A1268: GOALKICKERS
A1269: YARRAVILLE | C1269: MASON 3 | F1269: WILCOX 2 | I1269: VANDERFEEN | L1269: GARLICK | N1269: WILD | P1269: HUGHES
A1270: BRUNSWICK | C1270: HAYES 3 | F1270: McMAHON 2 | I1270: JAMES 2 | L1270: WEIR
A1272: NORTHCOTE | C1272: 4 | D1272: 3 | E1272: =C1272*6+D1272 -> 27 | G1272: 6 | H1272: 5 | I1272: =G1272*6+H1272 -> 41 | K1272: 11 | L1272: 7 | M1272: =K1272*6+L1272 -> 73 | O1272: 14 | P1272: 16 | Q1272: =O1272*6+P1272 -> 100 | S1272: NORTHCOTE
A1273: SANDRINGHAM | C1273: 2 | D1273: 1 | E1273: =C1273*6+D1273 -> 13 | G1273: 5 | H1273: 6 | I1273: =G1273*6+H1273 -> 36 | K1273: 6 | L1273: 10 | M1273: =K1273*6+L1273 -> 46 | O1273: 7 | P1273: 13 | Q1273: =O1273*6+P1273 -> 55 | S1273: ROWE
A1274: BEST PLAYERS
A1275: NORTHCOTE | C1275: STABB | E1275: GOUGH | H1275: GIBBS | K1275: PURDON | N1275: WOOLNOUGH | Q1275: TULL
A1276: SANDRINGHAM | C1276: CROFT | E1276: McMAHON | H1276: KRAUSE | K1276: R HARPER | N1276: DAVIDSON | Q1276: HAMBLY
A1277: GOALKICKERS
A1278: NORTHCOTE | C1278: GIBBS 4 | E1278: TULL 3 | G1278: PURDON 2 | J1278: STABB | L1278: COLLINS | N1278: BINNS | P1278: ROMARI | R1278: DEVINE
A1279: SANDRINGHAM | C1279: FLETCHER 2 | F1279: FLEMING 2 | I1279: COGHLAN | K1279: DAVIDSON | N1279: McMAHON
A1281: COBURG | C1281: 4 | D1281: 6 | E1281: =C1281*6+D1281 -> 30 | G1281: 5 | H1281: 10 | I1281: =G1281*6+H1281 -> 40 | K1281: 10 | L1281: 11 | M1281: =K1281*6+L1281 -> 71 | O1281: 15 | P1281: 14 | Q1281: =O1281*6+P1281 -> 104 | S1281: OAKLEIGH
A1282: OAKLEIGH | C1282: 3 | D1282: 3 | E1282: =C1282*6+D1282 -> 21 | G1282: 7 | H1282: 7 | I1282: =G1282*6+H1282 -> 49 | K1282: 11 | L1282: 9 | M1282: =K1282*6+L1282 -> 75 | O1282: 15 | P1282: 10 | Q1282: =O1282*6+P1282 -> 100 | S1282: BEITZEL
A1283: BEST PLAYERS
A1284: COBURG | C1284: H WILKINSON | F1284: CONDON | I1284: SANDLANT | L1284: MATTHEWS | O1284: YORK | Q1284: GOULLET
A1285: OAKLEIGH | C1285: GUY | F1285: I'ANSON | I1285: WILLIAMS | L1285: LONIE | O1285: TEMME | Q1285: HOWELL
A1286: GOALKICKERS
A1287: COBURG | C1287: STUBBS 3 | F1287: H WILKINSON 2 | J1287: YORK 2 | L1287: HORSKINS 2 | O1287: HEWES 2 | Q1287: McCOLL 2 | T1287: JONES | V1287: GOULLET
A1288: OAKLEIGH | C1288: HOWELL 4 | F1288: BURCH 3 | I1288: LONIE 3 | K1288: STANBOROUGH | N1288: WINTER | P1288: SCOTT | R1288: TEMME | U1288: DOQUILLE
A1290: CAMBERWELL | C1290: 3 | D1290: 2 | E1290: =C1290*6+D1290 -> 20 | G1290: 5 | H1290: 6 | I1290: =G1290*6+H1290 -> 36 | K1290: 6 | L1290: 8 | M1290: =K1290*6+L1290 -> 44 | O1290: 10 | P1290: 9 | Q1290: =O1290*6+P1290 -> 69 | S1290: CAMBERWELL
A1291: MOORABBIN | C1291: 3 | D1291: 4 | E1291: =C1291*6+D1291 -> 22 | G1291: 5 | H1291: 6 | I1291: =G1291*6+H1291 -> 36 | K1291: 5 | L1291: 14 | M1291: =K1291*6+L1291 -> 44 | O1291: 8 | P1291: 17 | Q1291: =O1291*6+P1291 -> 65 | S1291: ROACH
A1292: BEST PLAYERS
A1293: CAMBERWELL | C1293: HOLYOAK | F1293: TEMPANY | I1293: YOUNG | K1293: HEDLEY | N1293: McGUINNESS | Q1293: JOHNSON
A1294: MOORABBIN | C1294: LAWRENCE | F1294: MURRAY | I1294: McGAW | K1294: KING | N1294: GREEN | Q1294: TREZISE
A1295: GOALKICKERS
A1296: CAMBERWELL | C1296: YOUNG 4 | F1296: HEDLEY | H1296: K JOHNSON | K1296: MATTHEWS | N1296: TEMPANY | Q1296: BENBOW | S1296: McGUINNESS
A1297: MOORABBIN | C1297: RENWICK 4 | F1297: CLOVER | H1297: MCGAW | J1297: SCHOFIELD | M1297: MURPHY
A1299: PORT MELBOURNE | C1299: 6 | D1299: 6 | E1299: =C1299*6+D1299 -> 42 | G1299: 12 | H1299: 9 | I1299: =G1299*6+H1299 -> 81 | K1299: 16 | L1299: 12 | M1299: =K1299*6+L1299 -> 108 | O1299: 25 | P1299: 15 | Q1299: =O1299*6+P1299 -> 165 | S1299: ELSTERNWICK PARK
A1300: BRIGHTON | C1300: 0 | D1300: 2 | E1300: =C1300*6+D1300 -> 2 | G1300: 3 | H1300: 6 | I1300: =G1300*6+H1300 -> 24 | K1300: 7 | L1300: 6 | M1300: =K1300*6+L1300 -> 48 | O1300: 8 | P1300: 6 | Q1300: =O1300*6+P1300 -> 54 | S1300: BARNETT
A1301: BEST PLAYERS
A1302: PORT MELBOURNE | C1302: MILLER | F1302: SHANNON | I1302: JOHNSON | L1302: BONNETT | O1302: ATKINSON | R1302: WITHERS
A1303: BRIGHTON | C1303: KNIGHT | F1303: POUND | I1303: STEVENS | L1303: ALEXANDER | O1303: TURNER | R1303: EMBLETON
A1304: GOALKICKERS
A1305: PORT MELBOURNE | C1305: BONNETT 9 | F1305: MILLER 3 | I1305: SHANNON 3 | L1305: WALSH 3 | N1305: FRASER 3 | Q1305: ALLEN 2 | T1305: SYKES | V1305: STONE
A1306: BRIGHTON | C1306: ALEXANDER 3 | F1306: KNIGHT 2 | I1306: CARROLL | K1306: COCKFIELD | N1306: PRETTY
A1308: FINALS
A1309: 1ST SEMI | D1309: 3RD SEPTEMBER | J1309: WEATHER | M1309: SOUTH WEST WIND SHOWERS
D1310: 1ST QTR | H1310: 2ND QTR | L1310: 3RD QTR | P1310: FINAL
A1311: WILLIAMSTOWN | C1311: 3 | D1311: 2 | E1311: =C1311*6+D1311 -> 20 | G1311: 7 | H1311: 5 | I1311: =G1311*6+H1311 -> 47 | K1311: 8 | L1311: 10 | M1311: =K1311*6+L1311 -> 58 | O1311: 12 | P1311: 12 | Q1311: =O1311*6+P1311 -> 84 | S1311: JUNCTION OVAL
A1312: MOORABBIN | C1312: 4 | D1312: 0 | E1312: =C1312*6+D1312 -> 24 | G1312: 6 | H1312: 2 | I1312: =G1312*6+H1312 -> 38 | K1312: 8 | L1312: 5 | M1312: =K1312*6+L1312 -> 53 | O1312: 10 | P1312: 9 | Q1312: =O1312*6+P1312 -> 69 | S1312: IRVING
A1313: BEST PLAYERS
A1314: WILLIAMSTOWN | C1314: OUTEN | F1314: MUNDAY | I1314: SMITH | L1314: LINTON | O1314: CURRAN | R1314: CALLAHAN
A1315: MOORABBIN | C1315: GILDER | F1315: MORONEY | I1315: KING | L1315: GREEN | O1315: McGAW | R1315: RENWICK
A1316: GOALKICKERS
A1317: WILLIAMSTOWN | C1317: LINTON 4 | F1317: FISHER 3 | I1317: GEAR 2 | K1317: SMITH | M1317: R JONES | O1317: CALLAHAN
A1318: MOORABBIN | C1318: MORONEY 3 | F1318: SCHOFIELD 3 | I1318: McGAW 3 | L1318: RENWICK
A1320: 2ND SEMI | E1320: 10TH SEPTEMBER | J1320: WEATHER | N1320: FINE
A1321: PORT MELBOURNE | C1321: 4 | D1321: 4 | E1321: =C1321*6+D1321 -> 28 | G1321: 7 | H1321: 7 | I1321: =G1321*6+H1321 -> 49 | K1321: 10 | L1321: 11 | M1321: =K1321*6+L1321 -> 71 | O1321: 19 | P1321: 15 | Q1321: =O1321*6+P1321 -> 129 | S1321: JUNCTION OVAL
A1322: PRESTON | C1322: 1 | D1322: 5 | E1322: =C1322*6+D1322 -> 11 | G1322: 4 | H1322: 9 | I1322: =G1322*6+H1322 -> 33 | K1322: 7 | L1322: 12 | M1322: =K1322*6+L1322 -> 54 | O1322: 8 | P1322: 13 | Q1322: =O1322*6+P1322 -> 61 | S1322: ROBINSON
A1323: BEST PLAYERS
A1324: PORT MELBOURNE | C1324: JOHNSON | F1324: WILSON | I1324: METHERALL | L1324: WITHERS | O1324: FRASER | Q1324: BONNETT
A1325: PRESTON | C1325: BRADFORD | F1325: FOLEY | I1325: L SWEET | L1325: HENRYS | O1325: LALOR | Q1325: JEFFREY
A1326: GOALKICKERS
A1327: PORT MELBOURNE | C1327: BONNETT 6 | F1327: SHANNON 3 | I1327: McBROOM 3 | L1327: FRASER 3 | N1327: SYKES 2 | P1327: WALSH | R1327: MILLER
A1328: PRESTON | C1328: BRADFORD 5 | F1328: F CHARD 2 | I1328: FOLEY
A1330: PRELIMINARY FINAL | H1330: 17TH SEPTEMBER | M1330: WEATHER
A1331: WILLIAMSTOWN | C1331: 2 | D1331: 3 | E1331: =C1331*6+D1331 -> 15 | G1331: 8 | H1331: 9 | I1331: =G1331*6+H1331 -> 57 | K1331: 9 | L1331: 9 | M1331: =K1331*6+L1331 -> 63 | O1331: 11 | P1331: 16 | Q1331: =O1331*6+P1331 -> 82 | S1331: JUNCTION OVAL
A1332: PRESTON | C1332: 1 | D1332: 4 | E1332: =C1332*6+D1332 -> 10 | G1332: 3 | H1332: 7 | I1332: =G1332*6+H1332 -> 25 | K1332: 8 | L1332: 8 | M1332: =K1332*6+L1332 -> 56 | O1332: 10 | P1332: 13 | Q1332: =O1332*6+P1332 -> 73 | S1332: IRVING
A1333: BEST PLAYERS
A1334: WILLIAMSTOWN | C1334: OUTEN | F1334: MARTIN | I1334: SIMPSON | L1334: FISHER | O1334: EVANS | Q1334: LAURIE
A1335: PRESTON | C1335: LITTLE | F1335: F CHARD | I1335: HOWARD | L1335: JEFFREY | O1335: CUSACK | Q1335: COOPER
A1336: GOALKICKERS
A1337: WILLIAMSTOWN | C1337: EVANS 4 | F1337: WOOKEY 2 | I1337: FISHER | K1337: SIMPSON | M1337: SMITH | O1337: CALLAHAN | R1337: LINTON
A1338: PRESTON | C1338: F CHARD 6 | F1338: FOLEY | I1338: JEFFREY | K1338: WATT | M1338: LALOR
A1340: GRAND FINAL | E1340: 26TH SEPTEMBER | J1340: WEATHER
A1341: WILLIAMSTOWN | C1341: 1 | D1341: 3 | E1341: 9 | G1341: 5 | H1341: 10 | I1341: 40 | K1341: 7 | L1341: 13 | M1341: 55 | O1341: 13 | P1341: 19 | Q1341: =O1341*6+P1341 -> 97 | S1341: JUNCTION OVAL
A1342: PORT MELBOURNE | C1342: 7 | D1342: 3 | E1342: 45 | G1342: 8 | H1342: 6 | I1342: 54 | K1342: 12 | L1342: 8 | M1342: 80 | O1342: 13 | P1342: 10 | Q1342: =O1342*6+P1342 -> 88 | S1342: IRVING
A1343: BEST PLAYERS
A1344: WILLIAMSTOWN | C1344: LINTON | F1344: OUTEN | I1344: MARTIN | L1344: SMITH | O1344: SIMS | Q1344: R JONES
A1345: PORT MELBOURNE | C1345: JOHNSON | F1345: METHERALL | I1345: WITHERS | L1345: TUCKER | O1345: SYKES | Q1345: ALLEN
A1346: GOALKICKERS
A1347: WILLIAMSTOWN | C1347: LINTON 6 | F1347: SMITH 2 | I1347: FISHER | K1347: SIMPSON | N1347: CALLAHAN | Q1347: GEAR | S1347: McPHERSON
A1348: PORT MELBOURNE | C1348: BRAGG 4 | F1348: MILLER 3 | I1348: WALSH 2 | K1348: McBROOM | N1348: BONNETT | Q1348: STONE | S1348: SHANNON