A1: Victorian Football Association
A2: Season 1956
A3: © Copyright Wal Williams | F3: First created: 2 November 2014
A4: Contact: joywalwi at gmail dot com | F4: Last updated: 27 January 2018 | W4: VFA Results and tables - Link to the main index page
A5: You are free to copy this document in whole or part provided that proper acknowledgement is given to the author. All rights reserved.
A7: YEAR 1956
A8: ROUND 1 | D8: 14TH APRIL | G8: WEATHER | I8: STRONG NORTH GALE WINDIEST OPENING DAY EVER | S8: PLAYED AT
D9: 1ST QTR | H9: 2ND QTR | L9: 3RD QTR | P9: FINAL | S9: WILLIAMSTOWN
A10: WILLIAMSTOWN | C10: 1 | D10: 0 | E10: =C10*6+D10 -> 6 | G10: 5 | H10: 9 | I10: =G10*6+H10 -> 39 | K10: 5 | L10: 10 | M10: =K10*6+L10 -> 40 | O10: 9 | P10: 15 | Q10: =O10*6+P10 -> 69 | S10: UMPIRE | X10: LADDER | AB10: ROUND | AD10: 1
A11: MOORABBIN | C11: 2 | D11: 2 | E11: =C11*6+D11 -> 14 | G11: 2 | H11: 2 | I11: =G11*6+H11 -> 14 | K11: 2 | L11: 9 | M11: =K11*6+L11 -> 21 | O11: 3 | P11: 9 | Q11: =O11*6+P11 -> 27 | S11: IRVING
A12: BEST PLAYERS | W12: TEAM | X12: W | Y12: L | Z12: D | AA12: FOR | AB12: AGST | AC12: % | AD12: PTS
A13: WILLIAMSTOWN | C13: CALLAHAN | F13: BEITZEL | I13: LINTON | L13: GEAR | N13: MUNDAY | Q13: RAMSAY
A14: MOORABBIN | C14: LAWRENCE | F14: MORONEY | I14: K BOYD | L14: GILDER | N14: DYNON | Q14: HOUSTON | W14: PORT MELBOURNE | X14: 1 | Y14: 0 | Z14: 0 | AA14: 130 | AB14: 37 | AC14: 351.35135135135135 | AD14: 4
A15: GOALKICKERS | W15: WILLIAMSTOWN | X15: 1 | Y15: 0 | Z15: 0 | AA15: 69 | AB15: 27 | AC15: 255.55555555555554 | AD15: 4
A16: WILLIAMSTOWN | C16: GEAR 2 | F16: EVANS 2 | I16: REED | K16: LINTON | M16: McPHERSON | P16: MARTIN | R16: FISHER | W16: BRIGHTON | X16: 1 | Y16: 0 | Z16: 0 | AA16: 114 | AB16: 65 | AC16: 175.38461538461539 | AD16: 4
A17: MOORABBIN | C17: SCHOFIELD | F17: McGAW | I17: MORONEY | W17: NORTHCOTE | X17: 1 | Y17: 0 | Z17: 0 | AA17: 38 | AB17: 27 | AC17: 140.74074074074073 | AD17: 4
A19: SANDRINGHAM | C19: 0 | D19: 2 | E19: =C19*6+D19 -> 2 | G19: 4 | H19: 10 | I19: =G19*6+H19 -> 34 | K19: 6 | L19: 10 | M19: =K19*6+L19 -> 46 | O19: 13 | P19: 16 | Q19: =O19*6+P19 -> 94 | S19: BEACH ROAD | W19: BOX HILL | X19: 1 | Y19: 0 | Z19: 0 | AA19: 106 | AB19: 76 | AC19: 139.47368421052633 | AD19: 4
A20: BRUNSWICK | C20: 5 | D20: 3 | E20: =C20*6+D20 -> 33 | G20: 5 | H20: 4 | I20: =G20*6+H20 -> 34 | K20: 9 | L20: 11 | M20: =K20*6+L20 -> 65 | O20: 11 | P20: 12 | Q20: =O20*6+P20 -> 78 | S20: BARNETT | W20: SANDRINGHAM | X20: 1 | Y20: 0 | Z20: 0 | AA20: 94 | AB20: 78 | AC20: 120.51282051282051 | AD20: 4
A21: BEST PLAYERS | W21: COBURG | X21: 1 | Y21: 0 | Z21: 0 | AA21: 99 | AB21: 86 | AC21: 115.11627906976744 | AD21: 4
A22: SANDRINGHAM | C22: BOLAND | F22: RANSOM | I22: HAMBLY | L22: SHEARER | N22: WEBSTER | Q22: R HARPER | W22: PRESTON | X22: 0 | Y22: 1 | Z22: 0 | AA22: 86 | AB22: 99 | AC22: 86.868686868686865 | AD22: 0
A23: BRUNSWICK | C23: McFEE | F23: POLLARD | I23: MOORCROFT | L23: WALL | N23: JAMES | Q23: SIMPSON | W23: BRUNSWICK | X23: 0 | Y23: 1 | Z23: 0 | AA23: 78 | AB23: 94 | AC23: 82.978723404255319 | AD23: 0
A24: GOALKICKERS | W24: CAMBERWELL | X24: 0 | Y24: 1 | Z24: 0 | AA24: 76 | AB24: 106 | AC24: 71.698113207547166 | AD24: 0
A25: SANDRINGHAM | C25: BOLAND 4 | F25: WEBSTER 3 | I25: R HARPER 2 | L25: JOHNSTON 2 | O25: QUINN | Q25: CROFT | W25: YARRAVILLE | X25: 0 | Y25: 1 | Z25: 0 | AA25: 27 | AB25: 38 | AC25: 71.05263157894737 | AD25: 0
A26: BRUNSWICK | C26: McFEE 6 | F26: NEILSON | I26: I CLUES | K26: HAYES | M26: WEIR | O26: DEAS | W26: PRAHRAN | X26: 0 | Y26: 1 | Z26: 0 | AA26: 65 | AB26: 114 | AC26: 57.017543859649123 | AD26: 0
W27: MOORABBIN | X27: 0 | Y27: 1 | Z27: 0 | AA27: 27 | AB27: 69 | AC27: 39.130434782608695 | AD27: 0
A28: BOX HILL | C28: 7 | D28: 4 | E28: =C28*6+D28 -> 46 | G28: 9 | H28: 5 | I28: =G28*6+H28 -> 59 | K28: 14 | L28: 14 | M28: =K28*6+L28 -> 98 | O28: 15 | P28: 16 | Q28: =O28*6+P28 -> 106 | S28: BOX HILL | W28: OAKLEIGH | X28: 0 | Y28: 1 | Z28: 0 | AA28: 37 | AB28: 130 | AC28: 28.46153846153846 | AD28: 0
A29: CAMBERWELL | C29: 1 | D29: 4 | E29: =C29*6+D29 -> 10 | G29: 5 | H29: 12 | I29: =G29*6+H29 -> 42 | K29: 5 | L29: 13 | M29: =K29*6+L29 -> 43 | O29: 10 | P29: 16 | Q29: =O29*6+P29 -> 76 | S29: BREWER
A30: BEST PLAYERS
A31: BOX HILL | C31: DUNN | F31: WITHERDEN | I31: PLUNKETT | L31: LOVE | O31: CRAIG | Q31: McKENZIE
A32: CAMBERWELL | C32: McGUINNESS | F32: TURNBULL | I32: CHARLTON | L32: DUGDALE | O32: ROSS | Q32: MASON
A33: GOALKICKERS
A34: BOX HILL | C34: DUNN 7 | F34: BROWN 4 | I34: JOHNSTONE 2 | L34: PLUNKETT | O34: BENNETT
A35: CAMBERWELL | C35: MATHEWS 3 | F35: TURNBULL 2 | I35: MASON | K35: DUGDALE | M35: SABBATUCCI | P35: ROSS | R35: JOHNSON
A37: COBURG | C37: 1 | D37: 1 | E37: =C37*6+D37 -> 7 | G37: 5 | H37: 4 | I37: =G37*6+H37 -> 34 | K37: 6 | L37: 5 | M37: =K37*6+L37 -> 41 | O37: 14 | P37: 15 | Q37: =O37*6+P37 -> 99 | S37: COBURG
A38: PRESTON | C38: 7 | D38: 2 | E38: =C38*6+D38 -> 44 | G38: 9 | H38: 3 | I38: =G38*6+H38 -> 57 | K38: 13 | L38: 8 | M38: =K38*6+L38 -> 86 | O38: 13 | P38: 8 | Q38: =O38*6+P38 -> 86 | S38: ROWE
A39: BEST PLAYERS
A40: COBURG | C40: MAHONEY | F40: H WILKINSON | I40: JONES | K40: HEWES | N40: DANGUAARD | Q40: FEWKES
A41: PRESTON | C41: SWEET | F41: BRADFORD | I41: FOLEY | K41: SUPPLITT | N41: LALOR | Q41: LITTLE
A42: GOALKICKERS
A43: COBURG | C43: H WILKINSON 6 | F43: HEWES 3 | I43: R BRENNAN 2 | L43: B JONES | N43: YOUNG | P43: MILES
A44: PRESTON | C44: F CHARD 4 | F44: FOLEY 4 | I44: LALOR 2 | K44: BRADFORD | N44: CONSTABLE | Q44: G OSBORNE
A46: PORT MELBOURNE | C46: 7 | D46: 2 | E46: =C46*6+D46 -> 44 | G46: 12 | H46: 4 | I46: =G46*6+H46 -> 76 | K46: 15 | L46: 10 | M46: =K46*6+L46 -> 100 | O46: 19 | P46: 16 | Q46: =O46*6+P46 -> 130 | S46: OAKLEIGH
A47: OAKLEIGH | C47: 1 | D47: 2 | E47: =C47*6+D47 -> 8 | G47: 4 | H47: 5 | I47: =G47*6+H47 -> 29 | K47: 5 | L47: 5 | M47: =K47*6+L47 -> 35 | O47: 5 | P47: 7 | Q47: =O47*6+P47 -> 37 | S47: ROACH
A48: BEST PLAYERS
A49: PORT MELBOURNE | C49: BONNETT | F49: ALLEN | I49: LEWIS | L49: R ATKINSON | O49: WHARTON | R49: ROSEWARNE
A50: OAKLEIGH | C50: GUY | F50: TEMME | I50: NEWPORT | L50: COLLINS | O50: BAPTIST | R50: NICHOLSON
A51: GOALKICKERS
A52: PORT MELBOURNE | C52: BONNETT 6 | F52: STREADER 4 | I52: WHARTON 2 | L52: R ATKINSON 2 | O52: ROSEWARNE 2 | R52: MILLER | U52: SYKES | W52: E ATKINSON
A53: OAKLEIGH | C53: D'ARCY 2 | F53: NICHOLSON 2 | I53: BURCH
A55: NORTHCOTE | C55: 2 | D55: 8 | E55: =C55*6+D55 -> 20 | G55: 3 | H55: 10 | I55: =G55*6+H55 -> 28 | K55: 4 | L55: 11 | M55: =K55*6+L55 -> 35 | O55: 4 | P55: 14 | Q55: =O55*6+P55 -> 38 | S55: NORTHCOTE
A56: YARRAVILLE | C56: 3 | D56: 1 | E56: =C56*6+D56 -> 19 | G56: 3 | H56: 4 | I56: =G56*6+H56 -> 22 | K56: 3 | L56: 7 | M56: =K56*6+L56 -> 25 | O56: 3 | P56: 9 | Q56: =O56*6+P56 -> 27 | S56: ALLEN
A57: BEST PLAYERS
A58: NORTHCOTE | C58: STABB | F58: ROMARI | I58: TULL | L58: PAWSEY | N58: C POWELL | Q58: K POWELL
A59: YARRAVILLE | C59: GARRICK | F59: WILCOX | I59: SCHUMAN | L59: S JONES | N59: MASON | Q59: McDOWELL
A60: GOALKICKERS
A61: NORTHCOTE | C61: ROMARI 3 | F61: K POWELL
A62: YARRAVILLE | C62: McDOWELL | F62: McPHEE | I62: SCHUMAN
A64: BRIGHTON | C64: 2 | D64: 0 | E64: =C64*6+D64 -> 12 | G64: 9 | H64: 4 | I64: =G64*6+H64 -> 58 | K64: 9 | L64: 4 | M64: =K64*6+L64 -> 58 | O64: 17 | P64: 12 | Q64: =O64*6+P64 -> 114 | S64: TOORAK PARK
A65: PRAHRAN | C65: 4 | D65: 7 | E65: =C65*6+D65 -> 31 | G65: 5 | H65: 8 | I65: =G65*6+H65 -> 38 | K65: 8 | L65: 10 | M65: =K65*6+L65 -> 58 | O65: 9 | P65: 11 | Q65: =O65*6+P65 -> 65 | S65: BEITZEL
A66: BEST PLAYERS
A67: BRIGHTON | C67: J DAVIDSON | F67: LLOYD | I67: COCKFIELD | L67: GRIENKE | O67: DURKIN | Q67: I DAVIDSON
A68: PRAHRAN | C68: PLAIN | F68: W STEVENSON | I68: HARVEY | L68: HORSFIELD | O68: WILSON | Q68: W JONES
A69: GOALKICKERS
A70: BRIGHTON | C70: WEST 4 | F70: DURKIN 4 | I70: GRIENKE 3 | L70: LLOYD 3 | N70: COURTNEY 2 | Q70: KNIGHT
A71: PRAHRAN | C71: HARVEY 2 | F71: WILSON 2 | I71: W JONES | K71: WOOD | M71: C BOYD | O71: ELLIOTT | Q71: HEAD
A73: ROUND 2 | E73: 21ST APRIL | J73: WEATHER | M73: SOUTH BREEZE DULL | S73: PLAYED AT
D74: 1ST QTR | H74: 2ND QTR | L74: 3RD QTR | P74: FINAL | S74: ELSTERNWICK PARK
A75: COBURG | C75: 4 | D75: 4 | E75: =C75*6+D75 -> 28 | G75: 12 | H75: 10 | I75: =G75*6+H75 -> 82 | K75: 20 | L75: 17 | M75: =K75*6+L75 -> 137 | O75: 26 | P75: 22 | Q75: =O75*6+P75 -> 178 | S75: UMPIRE | X75: LADDER | AB75: ROUND | AD75: 2
A76: BRIGHTON | C76: 2 | D76: 8 | E76: =C76*6+D76 -> 20 | G76: 3 | H76: 9 | I76: =G76*6+H76 -> 27 | K76: 5 | L76: 11 | M76: =K76*6+L76 -> 41 | O76: 11 | P76: 14 | Q76: =O76*6+P76 -> 80 | S76: BREWER
A77: BEST PLAYERS | W77: TEAM | X77: W | Y77: L | Z77: D | AA77: FOR | AB77: AGST | AC77: % | AD77: PTS
A78: COBURG | C78: HEWES | F78: WYMER | I78: GOULLET | L78: McCOLL | N78: MAHONEY | Q78: STARBUCK
A79: BRIGHTON | C79: GRIENKE | F79: BROWNING | I79: PEARSON | L79: LLOYD | N79: I DAVIDSON | Q79: WEST | W79: PORT MELBOURNE | X79: 2 | Y79: 0 | Z79: 0 | AA79: 246 | AB79: 108 | AC79: 227.77777777777777 | AD79: 8
A80: GOALKICKERS | W80: COBURG | X80: 2 | Y80: 0 | Z80: 0 | AA80: 277 | AB80: 166 | AC80: 166.86746987951807 | AD80: 8
A81: COBURG | C81: HEWES 13 | E81: GOULLET 4 | H81: H WILKINSON 2 | K81: R BRENNAN 2 | N81: MILLER 2 | Q81: WYMER 2 | T81: YOUNG | W81: BOX HILL | X81: 2 | Y81: 0 | Z81: 0 | AA81: 168 | AB81: 134 | AC81: 125.3731343283582 | AD81: 8
A82: BRIGHTON | C82: WEST 4 | E82: BROWNING 2 | H82: SMITH 2 | J82: GRIENKE | M82: LYGON | O82: PEARSON | W82: WILLIAMSTOWN | X82: 1 | Y82: 1 | Z82: 0 | AA82: 121 | AB82: 109 | AC82: 111.0091743119266 | AD82: 4
A84: BOX HILL | C84: 2 | D84: 1 | E84: =C84*6+D84 -> 13 | G84: 4 | H84: 3 | I84: =G84*6+H84 -> 27 | K84: 6 | L84: 10 | M84: =K84*6+L84 -> 46 | O84: 8 | P84: 14 | Q84: =O84*6+P84 -> 62 | S84: PRESTON | W84: BRUNSWICK | X84: 1 | Y84: 1 | Z84: 0 | AA84: 160 | AB84: 146 | AC84: 109.58904109589041 | AD84: 4
A85: PRESTON | C85: 3 | D85: 2 | E85: =C85*6+D85 -> 20 | G85: 6 | H85: 6 | I85: =G85*6+H85 -> 42 | K85: 7 | L85: 7 | M85: =K85*6+L85 -> 49 | O85: 8 | P85: 10 | Q85: =O85*6+P85 -> 58 | S85: BARNETT | W85: NORTHCOTE | X85: 1 | Y85: 1 | Z85: 0 | AA85: 108 | AB85: 112 | AC85: 96.428571428571431 | AD85: 4
A86: BEST PLAYERS | W86: CAMBERWELL | X86: 1 | Y86: 1 | Z86: 0 | AA86: 161 | AB86: 168 | AC86: 95.833333333333329 | AD86: 4
A87: BOX HILL | C87: LOVE | F87: HOUGHTON | I87: BROWN | L87: IRVINE | N87: PLUNKETT | Q87: NICHOLSON | W87: SANDRINGHAM | X87: 1 | Y87: 1 | Z87: 0 | AA87: 156 | AB87: 163 | AC87: 95.705521472392633 | AD87: 4
A88: PRESTON | C88: L SWEET | F88: FOLEY | I88: CONSTABLE | L88: WALKER | N88: K CHARD | Q88: G OSBORNE | W88: MOORABBIN | X88: 1 | Y88: 1 | Z88: 0 | AA88: 112 | AB88: 139 | AC88: 80.57553956834532 | AD88: 4
A89: GOALKICKERS | W89: BRIGHTON | X89: 1 | Y89: 1 | Z89: 0 | AA89: 194 | AB89: 243 | AC89: 79.835390946502059 | AD89: 4
A90: BOX HILL | C90: BROWN 4 | F90: PLUNKETT 2 | I90: INGLETON 2 | W90: OAKLEIGH | X90: 1 | Y90: 1 | Z90: 0 | AA90: 133 | AB90: 210 | AC90: 63.333333333333336 | AD90: 4
A91: PRESTON | C91: BRADFORD 2 | F91: LITTLE 2 | I91: K CHARD | K91: F CHARD | M91: G OSBORNE | P91: FOLEY | W91: PRESTON | X91: 0 | Y91: 2 | Z91: 0 | AA91: 144 | AB91: 161 | AC91: 89.440993788819881 | AD91: 0
W92: YARRAVILLE | X92: 0 | Y92: 2 | Z92: 0 | AA92: 107 | AB92: 134 | AC92: 79.850746268656721 | AD92: 0
A93: BRUNSWICK | C93: 4 | D93: 4 | E93: =C93*6+D93 -> 28 | G93: 9 | H93: 6 | I93: =G93*6+H93 -> 60 | K93: 10 | L93: 10 | M93: =K93*6+L93 -> 70 | O93: 12 | P93: 10 | Q93: =O93*6+P93 -> 82 | S93: BRUNSWICK | W93: PRAHRAN | X93: 0 | Y93: 2 | Z93: 0 | AA93: 136 | AB93: 230 | AC93: 59.130434782608695 | AD93: 0
A94: WILLIAMSTOWN | C94: 1 | D94: 2 | E94: =C94*6+D94 -> 8 | G94: 2 | H94: 3 | I94: =G94*6+H94 -> 15 | K94: 4 | L94: 6 | M94: =K94*6+L94 -> 30 | O94: 7 | P94: 10 | Q94: =O94*6+P94 -> 52 | S94: ROACH
A95: BEST PLAYERS
A96: BRUNSWICK | C96: RELFS | E96: HAYES | H96: LOVETT | K96: CLUES | N96: STANLEY | Q96: McFEE
A97: WILLIAMSTOWN | C97: KENT | E97: MARTIN | H97: JONES | K97: CALLAHAN | N97: GEAR | Q97: FISHER
A98: GOALKICKERS
A99: BRUNSWICK | C99: HAYES 5 | F99: LOVETT 3 | I99: CLUES 2 | L99: WEIR | N99: McFEE
A100: WILLIAMSTOWN | C100: LINTON 2 | F100: THOMPSON | I100: WOOKEY | L100: GEAR | N100: FISHER | P100: CALLAHAN
A102: CAMBERWELL | C102: 3 | D102: 3 | E102: =C102*6+D102 -> 21 | G102: 6 | H102: 8 | I102: =G102*6+H102 -> 44 | K102: 9 | L102: 11 | M102: =K102*6+L102 -> 65 | O102: 12 | P102: 13 | Q102: =O102*6+P102 -> 85 | S102: CAMBERWELL
A103: SANDRINGHAM | C103: 2 | D103: 1 | E103: =C103*6+D103 -> 13 | G103: 5 | H103: 2 | I103: =G103*6+H103 -> 32 | K103: 8 | L103: 6 | M103: =K103*6+L103 -> 54 | O103: 9 | P103: 8 | Q103: =O103*6+P103 -> 62 | S103: IRVING
A104: BEST PLAYERS
A105: CAMBERWELL | C105: SKALBERG | F105: HOLYOAK | I105: DUGDALE | L105: WATTS | N105: TURNBULL | Q105: NELSON
A106: SANDRINGHAM | C106: BOLAND | F106: McKENZIE | I106: RANSOM | L106: JONES | N106: FLETCHER | Q106: EVANS
A107: GOALKICKERS
A108: CAMBERWELL | C108: DUGDALE 3 | F108: ROSS 3 | I108: JOHNSON 2 | L108: McGUINNESS 2 | O108: WATTS | Q108: MATTHEWS
A109: SANDRINGHAM | C109: BOLAND 4 | F109: SHEARER | I109: WEBSTER | K109: RANSOM | M109: QUINN | O109: KRAUSE
A111: OAKLEIGH | C111: 3 | D111: 0 | E111: =C111*6+D111 -> 18 | G111: 7 | H111: 3 | I111: =G111*6+H111 -> 45 | K111: 10 | L111: 5 | M111: =K111*6+L111 -> 65 | O111: 15 | P111: 6 | Q111: =O111*6+P111 -> 96 | S111: YARRAVILLE
A112: YARRAVILLE | C112: 6 | D112: 5 | E112: =C112*6+D112 -> 41 | G112: 7 | H112: 5 | I112: =G112*6+H112 -> 47 | K112: 11 | L112: 9 | M112: =K112*6+L112 -> 75 | O112: 11 | P112: 14 | Q112: =O112*6+P112 -> 80 | S112: ROWE
A113: BEST PLAYERS
A114: OAKLEIGH | C114: NICHOLSON | F114: GUY | I114: CAMM | L114: BRUCE | O114: BARRY | R114: KITTO
A115: YARRAVILLE | C115: WILD | F115: GARRICK | I115: GARLICK | L115: SCHUMAN | O115: B WILLIAMS | R115: McPHEE
A116: GOALKICKERS
A117: OAKLEIGH | C117: NICHOLSON 8 | F117: BARRY 3 | I117: D'ARCY 2 | L117: MATTHEY | O117: BLACKBURN
A118: YARRAVILLE | C118: SCHUMAN 4 | F118: GARLICK 3 | I118: CAREY 2 | L118: CHARLES | O118: McPHEE
A120: PORT MELBOURNE | C120: 6 | D120: 2 | E120: =C120*6+D120 -> 38 | G120: 11 | H120: 6 | I120: =G120*6+H120 -> 72 | K120: 13 | L120: 9 | M120: =K120*6+L120 -> 87 | O120: 17 | P120: 14 | Q120: =O120*6+P120 -> 116 | S120: PORT MELBOURNE
A121: PRAHRAN | C121: 2 | D121: 4 | E121: =C121*6+D121 -> 16 | G121: 4 | H121: 6 | I121: =G121*6+H121 -> 30 | K121: 9 | L121: 7 | M121: =K121*6+L121 -> 61 | O121: 10 | P121: 11 | Q121: =O121*6+P121 -> 71 | S121: ALLEN
A122: BEST PLAYERS
A123: PORT MELBOURNE | C123: BONNETT | F123: JOHNSON | I123: R ATKINSON | L123: LAFFEY | N123: MILLER | Q123: LEWIS
A124: PRAHRAN | C124: SHARP | F124: ROSS JONES | I124: HARVEY | L124: PLAIN | N124: HART | Q124: HORSFIELD
A125: GOALKICKERS
A126: PORT MELBOURNE | C126: BONNETT 10 | F126: JOHNSON 3 | I126: LEWIS 2 | K126: McBROOM | N126: SYKES
A127: PRAHRAN | C127: HARVEY 2 | F127: KINNABURGH 2 | J127: SHARP 2 | M127: HART 2 | O127: ELLIOTT | Q127: RICKARDS
A129: MOORABBIN | C129: 3 | D129: 6 | E129: =C129*6+D129 -> 24 | G129: 6 | H129: 9 | I129: =G129*6+H129 -> 45 | K129: 11 | L129: 12 | M129: =K129*6+L129 -> 78 | O129: 12 | P129: 13 | Q129: =O129*6+P129 -> 85 | S129: MOORABBIN
A130: NORTHCOTE | C130: 1 | D130: 2 | E130: =C130*6+D130 -> 8 | G130: 4 | H130: 6 | I130: =G130*6+H130 -> 30 | K130: 6 | L130: 7 | M130: =K130*6+L130 -> 43 | O130: 10 | P130: 10 | Q130: =O130*6+P130 -> 70 | S130: BEITZEL
A131: BEST PLAYERS
A132: MOORABBIN | C132: EDWARDS | F132: DYNON | I132: MURPHY | L132: SCHOFIELD | O132: CARGILL | Q132: McGAW
A133: NORTHCOTE | C133: GOUGH | F133: K POWELL | I133: WOOLNOUGH | L133: FRANCIS | O133: HOLT | Q133: ROMARI
A134: GOALKICKERS
A135: MOORABBIN | C135: SCHOFIELD 6 | F135: McGAW 2 | I135: CLOVER 2 | L135: CARGILL | N135: LEHMANN
A136: NORTHCOTE | C136: ROMARI 6 | F136: DEVINE | I136: K POWELL | L136: BINNS | N136: GIBBS
A138: ROUND 3 | E138: 28TH APRIL | J138: WEATHER | O138: FINE | S138: PLAYED AT
D139: 1ST QTR | H139: 2ND QTR | L139: 3RD QTR | P139: FINAL | S139: COBURG
A140: PORT MELBOURNE | C140: 4 | D140: 6 | E140: =C140*6+D140 -> 30 | G140: 9 | H140: 14 | I140: =G140*6+H140 -> 68 | K140: 12 | L140: 17 | M140: =K140*6+L140 -> 89 | O140: 15 | P140: 22 | Q140: =O140*6+P140 -> 112 | S140: UMPIRE | X140: LADDER | AB140: ROUND | AD140: 3
A141: COBURG | C141: 0 | D141: 3 | E141: =C141*6+D141 -> 3 | G141: 3 | H141: 4 | I141: =G141*6+H141 -> 22 | K141: 6 | L141: 8 | M141: =K141*6+L141 -> 44 | O141: 8 | P141: 9 | Q141: =O141*6+P141 -> 57 | S141: BARNETT
A142: BEST PLAYERS | W142: TEAM | X142: W | Y142: L | Z142: D | AA142: FOR | AB142: AGST | AC142: % | AD142: PTS
A143: PORT MELBOURNE | C143: MILLER | E143: JOHNSON | H143: ALLEN | K143: WILSON | N143: McBROOM | Q143: E ATKINSON
A144: COBURG | C144: B JONES | E144: STARBUCK | H144: MAHONEY | K144: FEWKES | N144: McCOLL | Q144: J BRENNAN | W144: PORT MELBOURNE | X144: 3 | Y144: 0 | Z144: 0 | AA144: 358 | AB144: 165 | AC144: 216.96969696969697 | AD144: 12
A145: GOALKICKERS | W145: BOX HILL | X145: 3 | Y145: 0 | Z145: 0 | AA145: 243 | AB145: 149 | AC145: 163.08724832214764 | AD145: 12
A146: PORT MELBOURNE | C146: BONNETT 5 | F146: MILLER 2 | H146: COLLINS 2 | J146: LEWIS 2 | L146: JOHNSON | N146: SYKES | P146: REECE YOUNG | S146: E ATKINSON | W146: WILLIAMSTOWN | X146: 2 | Y146: 1 | Z146: 0 | AA146: 245 | AB146: 157 | AC146: 156.05095541401275 | AD146: 8
A147: COBURG | C147: HEWES 4 | F147: WYMER 2 | I147: GOULLET | K147: YOUNG | W147: COBURG | X147: 2 | Y147: 1 | Z147: 0 | AA147: 334 | AB147: 278 | AC147: 120.14388489208633 | AD147: 8
A149: WILLIAMSTOWN | C149: 2 | D149: 7 | E149: =C149*6+D149 -> 19 | G149: 10 | H149: 10 | I149: =G149*6+H149 -> 70 | K149: 14 | L149: 15 | M149: =K149*6+L149 -> 99 | O149: 17 | P149: 22 | Q149: =O149*6+P149 -> 124 | S149: WILLIAMSTOWN | W149: MOORABBIN | X149: 2 | Y149: 1 | Z149: 0 | AA149: 191 | AB149: 206 | AC149: 92.71844660194175 | AD149: 8
A150: CAMBERWELL | C150: 2 | D150: 1 | E150: =C150*6+D150 -> 13 | G150: 2 | H150: 4 | I150: =G150*6+H150 -> 16 | K150: 4 | L150: 8 | M150: =K150*6+L150 -> 32 | O150: 6 | P150: 12 | Q150: =O150*6+P150 -> 48 | S150: V BEITZEL | W150: OAKLEIGH | X150: 2 | Y150: 1 | Z150: 0 | AA150: 195 | AB150: 256 | AC150: 76.171875 | AD150: 8
A151: BEST PLAYERS | W151: BRUNSWICK | X151: 1 | Y151: 2 | Z151: 0 | AA151: 227 | AB151: 225 | AC151: 100.88888888888889 | AD151: 4
A152: WILLIAMSTOWN | C152: MARTIN | F152: EVANS | I152: GEAR | L152: THOMPSON | O152: LINTON | Q152: WARD | W152: PRESTON | X152: 1 | Y152: 2 | Z152: 0 | AA152: 222 | AB152: 232 | AC152: 95.689655172413794 | AD152: 4
A153: CAMBERWELL | C153: DUGDALE | F153: McGUINNES | I153: ROCHFORD | L153: K CLARK | O153: ROSS | Q153: PROUDFOOT | W153: SANDRINGHAM | X153: 1 | Y153: 2 | Z153: 0 | AA153: 227 | AB153: 241 | AC153: 94.190871369294612 | AD153: 4
A154: GOALKICKERS | W154: NORTHCOTE | X154: 1 | Y154: 2 | Z154: 0 | AA154: 154 | AB154: 174 | AC154: 88.505747126436788 | AD154: 4
A155: WILLIAMSTOWN | C155: EVANS 6 | E155: GEAR 4 | G155: LINTON 3 | I155: MARTIN | K155: WOOKEY | M155: CALLAHAN | P155: REED | W155: PRAHRAN | X155: 1 | Y155: 2 | Z155: 0 | AA155: 214 | AB155: 282 | AC155: 75.886524822695037 | AD155: 4
A156: CAMBERWELL | C156: McGUINNESS 3 | F156: DUGDALE 2 | I156: MATHEWS | W156: CAMBERWELL | X156: 1 | Y156: 2 | Z156: 0 | AA156: 209 | AB156: 292 | AC156: 71.575342465753423 | AD156: 4
W157: BRIGHTON | X157: 1 | Y157: 2 | Z157: 0 | AA157: 209 | AB157: 318 | AC157: 65.723270440251568 | AD157: 4
A158: MOORABBIN | C158: 3 | D158: 2 | E158: =C158*6+D158 -> 20 | G158: 5 | H158: 6 | I158: =G158*6+H158 -> 36 | K158: 8 | L158: 7 | M158: =K158*6+L158 -> 55 | O158: 11 | P158: 13 | Q158: =O158*6+P158 -> 79 | S158: BRUNSWICK | W158: YARRAVILLE | X158: 0 | Y158: 3 | Z158: 0 | AA158: 159 | AB158: 212 | AC158: 75 | AD158: 0
A159: BRUNSWICK | C159: 2 | D159: 5 | E159: =C159*6+D159 -> 17 | G159: 3 | H159: 6 | I159: =G159*6+H159 -> 24 | K159: 7 | L159: 11 | M159: =K159*6+L159 -> 53 | O159: 9 | P159: 13 | Q159: =O159*6+P159 -> 67 | S159: ALLEN
A160: BEST PLAYERS
A161: MOORABBIN | C161: McGAW | F161: KING | I161: MURRAY | L161: MURPHY | N161: GREEN | Q161: GILDER
A162: BRUNSWICK | C162: ROLFS | F162: MULLENGER | I162: WEIR | L162: JAMES | N162: STANLEY | Q162: EDWARDS
A163: GOALKICKERS
A164: MOORABBIN | C164: HOUSTON 3 | F164: SCHOFIELD 3 | I164: McGAW 2 | L164: K BOYD 2 | O164: CLOVER
A165: BRUNSWICK | C165: JAMES 3 | F165: McFEE 3 | I165: EDWARDS | K165: CULLY | M165: STANLEY
A167: OAKLEIGH | C167: 2 | D167: 2 | E167: =C167*6+D167 -> 14 | G167: 4 | H167: 4 | I167: =G167*6+H167 -> 28 | K167: 6 | L167: 5 | M167: =K167*6+L167 -> 41 | O167: 9 | P167: 8 | Q167: =O167*6+P167 -> 62 | S167: OAKLEIGH
A168: NORTHCOTE | C168: 2 | D168: 1 | E168: =C168*6+D168 -> 13 | G168: 3 | H168: 3 | I168: =G168*6+H168 -> 21 | K168: 4 | L168: 5 | M168: =K168*6+L168 -> 29 | O168: 6 | P168: 10 | Q168: =O168*6+P168 -> 46 | S168: BREWER
A169: BEST PLAYERS
A170: OAKLEIGH | C170: TEMME | F170: BRIAN WILLIAMS | J170: NEWPORT | M170: BARRY | O170: KITTO | Q170: COLLINS
A171: NORTHCOTE | C171: I WALKER | F171: CRAWLEY | J171: STABB | M171: GOUGH | O171: COLLINS | Q171: PAYNTER
A172: GOALKICKERS
A173: OAKLEIGH | C173: HOWELL 4 | F173: BARRY | H173: BLACKBURN | K173: NICHOLSON | N173: MATHEY | P173: KELLETT
A174: NORTHCOTE | C174: COLLINS 3 | F174: ROMARI | H174: DEVINE | K174: TULL
A176: PRAHRAN | C176: 1 | D176: 3 | E176: =C176*6+D176 -> 9 | G176: 3 | H176: 6 | I176: =G176*6+H176 -> 24 | K176: 4 | L176: 9 | M176: =K176*6+L176 -> 33 | O176: 11 | P176: 12 | Q176: =O176*6+P176 -> 78 | S176: TOORAK PARK
A177: YARRAVILLE | C177: 6 | D177: 3 | E177: =C177*6+D177 -> 39 | G177: 6 | H177: 6 | I177: =G177*6+H177 -> 42 | K177: 6 | L177: 9 | M177: =K177*6+L177 -> 45 | O177: 7 | P177: 10 | Q177: =O177*6+P177 -> 52
A178: BEST PLAYERS
A179: PRAHRAN | C179: GAZE | F179: SHARP | I179: MORROW | L179: ROSS JONES | O179: HENRY | Q179: HORSFIELD
A180: YARRAVILLE | C180: B FRASER | F180: GARRICK | I180: DE JONG | L180: R MASON | O180: COCKRAM | Q180: GARLICK
A181: GOALKICKERS
A182: PRAHRAN | C182: SHARP 3 | F182: KINNABURGH 2 | J182: STEVENSON 2 | M182: PLAIN | O182: HART | Q182: HARVEY | S182: WILSON
A183: YARRAVILLE | C183: SCHUMAN 2 | F183: DE JONG 2 | I183: FRASER | K183: HARGREAVES | N183: GARLICK
A185: PRESTON | C185: 2 | D185: 2 | E185: =C185*6+D185 -> 14 | G185: 6 | H185: 8 | I185: =G185*6+H185 -> 44 | K185: 8 | L185: 14 | M185: =K185*6+L185 -> 62 | O185: 10 | P185: 18 | Q185: =O185*6+P185 -> 78 | S185: BEACH ROAD
A186: SANDRINGHAM | C186: 1 | D186: 6 | E186: =C186*6+D186 -> 12 | G186: 4 | H186: 8 | I186: =G186*6+H186 -> 32 | K186: 7 | L186: 15 | M186: =K186*6+L186 -> 57 | O186: 9 | P186: 17 | Q186: =O186*6+P186 -> 71 | S186: ROACH
A187: BEST PLAYERS
A188: PRESTON | C188: McBEAN | F188: L SWEET | I188: FOLEY | K188: BRADFORD | N188: LITTLE | Q188: CONSTABLE
A189: SANDRINGHAM | C189: BOLAND | F189: R HARPER | I189: JONES | K189: KRAUSE | N189: SHEARER | Q189: HAMBLY
A190: GOALKICKERS
A191: PRESTON | C191: BRADFOR D 2 | F191: CRELLIN 2 | I191: LITTLE 2 | K191: FOLEY 2 | M191: LALOR | O191: CONSTABLE
A192: SANDRINGHAM | C192: BOLAND 5 | F192: QUINN 2 | I192: JOHNSTON | L192: WEBSTER
A194: BOX HILL | C194: 1 | D194: 6 | E194: =C194*6+D194 -> 12 | G194: 3 | H194: 8 | I194: =G194*6+H194 -> 26 | K194: 7 | L194: 14 | M194: =K194*6+L194 -> 56 | O194: 9 | P194: 21 | Q194: =O194*6+P194 -> 75 | S194: BOX HILL
A195: BRIGHTON | C195: 0 | D195: 1 | E195: =C195*6+D195 -> 1 | G195: 0 | H195: 4 | I195: =G195*6+H195 -> 4 | K195: 0 | L195: 6 | M195: =K195*6+L195 -> 6 | O195: 1 | P195: 9 | Q195: =O195*6+P195 -> 15 | S195: ROWE
A196: BEST PLAYERS
A197: BOX HILL | C197: GREEN | F197: WRIGHT | I197: HOUGHTON | L197: LOVE | N197: SAWATSKY | Q197: BENNETT
A198: BRIGHTON | C198: I DAVIDSON | F198: PRETTY | I198: POUND | L198: PEARSON | N198: KNIGHT | Q198: GRIENKE
A199: GOALKICKERS
A200: BOX HILL | C200: DUNN 3 | F200: BROWN 2 | I200: MADDEN | K200: CRAIG | M200: HOUGHTON | P200: INGLETON
A201: BRIGHTON | C201: SMITH
A203: ROUND 4 | E203: 5TH MAY | J203: WEATHER | O203: FINE | S203: PLAYED AT
D204: 1ST QTR | H204: 2ND QTR | L204: 3RD QTR | P204: FINAL | S204: PORT MELBOURNE
A205: PORT MELBOURNE | C205: 3 | D205: 4 | E205: =C205*6+D205 -> 22 | G205: 5 | H205: 7 | I205: =G205*6+H205 -> 37 | K205: 7 | L205: 17 | M205: =K205*6+L205 -> 59 | O205: 9 | P205: 18 | Q205: =O205*6+P205 -> 72 | S205: UMPIRE | X205: LADDER | AB205: ROUND | AD205: 4
A206: BOX HILL | C206: 1 | D206: 1 | E206: =C206*6+D206 -> 7 | G206: 3 | H206: 4 | I206: =G206*6+H206 -> 22 | K206: 4 | L206: 5 | M206: =K206*6+L206 -> 29 | O206: 5 | P206: 11 | Q206: =O206*6+P206 -> 41 | S206: IRVING
A207: BEST PLAYERS | W207: TEAM | X207: W | Y207: L | Z207: D | AA207: FOR | AB207: AGST | AC207: % | AD207: PTS
A208: PORT MELBOURNE | C208: WILSON | F208: WITHERS | I208: SYKES | L208: JOHNSON | O208: COLLINS | Q208: METHERALL
A209: BOX HILL | C209: WRIGHT | F209: STREET | I209: HOUGHTON | L209: IRVINE | O209: CRAIG | Q209: BENNETT | W209: PORT MELBOURNE | X209: 4 | Y209: 0 | Z209: 0 | AA209: 430 | AB209: 206 | AC209: 208.73786407766991 | AD209: 16
A210: GOALKICKERS | W210: WILLIAMSTOWN | X210: 3 | Y210: 1 | Z210: 0 | AA210: 314 | AB210: 225 | AC210: 139.55555555555554 | AD210: 12
A211: PORT MELBOURNE | C211: BONNETT 4 | F211: SYKES 2 | I211: MILLER 2 | L211: McBROOM | W211: MOORABBIN | X211: 3 | Y211: 1 | Z211: 0 | AA211: 306 | AB211: 234 | AC211: 130.76923076923077 | AD211: 12
A212: BOX HILL | C212: EADE 2 | F212: D BROWN | I212: J JOHNSTONE | L212: DUNN | W212: COBURG | X212: 3 | Y212: 1 | Z212: 0 | AA212: 438 | AB212: 337 | AC212: 129.97032640949556 | AD212: 12
A214: MOORABBIN | C214: 6 | D214: 5 | E214: =C214*6+D214 -> 41 | G214: 10 | H214: 8 | I214: =G214*6+H214 -> 68 | K214: 13 | L214: 10 | M214: =K214*6+L214 -> 88 | O214: 17 | P214: 13 | Q214: =O214*6+P214 -> 115 | S214: M'BINN | W214: BOX HILL | X214: 3 | Y214: 1 | Z214: 0 | AA214: 284 | AB214: 221 | AC214: 128.50678733031674 | AD214: 12
A215: OAKLEIGH | C215: 2 | D215: 1 | E215: =C215*6+D215 -> 13 | G215: 4 | H215: 2 | I215: =G215*6+H215 -> 26 | K215: 4 | L215: 4 | M215: =K215*6+L215 -> 28 | O215: 4 | P215: 4 | Q215: =O215*6+P215 -> 28 | S215: ROBINSON | W215: BRUNSWICK | X215: 2 | Y215: 2 | Z215: 0 | AA215: 354 | AB215: 290 | AC215: 122.06896551724138 | AD215: 8
A216: BEST PLAYERS | W216: SANDRINGHAM | X216: 2 | Y216: 2 | Z216: 0 | AA216: 334 | AB216: 302 | AC216: 110.59602649006622 | AD216: 8
A217: MOORABBIN | C217: GREEN | E217: SCHOFIELD | H217: MURRAY | K217: CLOVER | N217: CARGILL | Q217: BULMER | W217: NORTHCOTE | X217: 2 | Y217: 2 | Z217: 0 | AA217: 250 | AB217: 262 | AC217: 95.419847328244273 | AD217: 8
A218: OAKLEIGH | C218: SCULLIN | E218: KITTO | H218: NICHOLSON | K218: BRUCE | N218: CAMM | Q218: I'ANSON | W218: OAKLEIGH | X218: 2 | Y218: 2 | Z218: 0 | AA218: 223 | AB218: 371 | AC218: 60.107816711590296 | AD218: 8
A219: GOALKICKERS | W219: PRESTON | X219: 1 | Y219: 3 | Z219: 0 | AA219: 290 | AB219: 301 | AC219: 96.34551495016612 | AD219: 4
A220: MOORABBIN | C220: SCHOFIELD 11 | F220: HOUSTON | I220: MURPHY | K220: CARGILL | M220: BULMER | O220: CLOVER | Q220: McGAW | W220: PRAHRAN | X220: 1 | Y220: 3 | Z220: 0 | AA220: 302 | AB220: 378 | AC220: 79.894179894179899 | AD220: 4
A221: OAKLEIGH | C221: NICHOLSON 2 | F221: HOWELL 2 | W221: CAMBERWELL | X221: 1 | Y221: 3 | Z221: 0 | AA221: 274 | AB221: 419 | AC221: 65.393794749403341 | AD221: 4
W222: BRIGHTON | X222: 1 | Y222: 3 | Z222: 0 | AA222: 270 | AB222: 425 | AC222: 63.529411764705884 | AD222: 4
A223: WILLIAMSTOWN | C223: 3 | D223: 6 | E223: =C223*6+D223 -> 24 | G223: 5 | H223: 6 | I223: =G223*6+H223 -> 36 | K223: 7 | L223: 13 | M223: =K223*6+L223 -> 55 | O223: 9 | P223: 15 | Q223: =O223*6+P223 -> 69 | S223: PRESTON | W223: YARRAVILLE | X223: 0 | Y223: 4 | Z223: 0 | AA223: 218 | AB223: 316 | AC223: 68.987341772151893 | AD223: 0
A224: PRESTON | C224: 2 | D224: 6 | E224: =C224*6+D224 -> 18 | G224: 5 | H224: 11 | I224: =G224*6+H224 -> 41 | K224: 6 | L224: 13 | M224: =K224*6+L224 -> 49 | O224: 9 | P224: 14 | Q224: =O224*6+P224 -> 68 | S224: BREWER
A225: BEST PLAYERS
A226: WILLIAMSTOWN | C226: SIMS | F226: OUTEN | I226: MUNDAY | L226: LINTON | N226: JONES | Q226: CURRAN
A227: PRESTON | C227: BRADFORD | F227: GUNN | I227: L SWEET | L227: FOLEY | N227: McBEAN | Q227: CUSACK
A228: GOALKICKERS
A229: WILLIAMSTOWN | C229: LINTON 4 | F229: FISHER 3 | I229: EVANS | K229: MURPHY
A230: PRESTON | C230: FOLEY 3 | F230: LITTLE 2 | I230: BRADFORD 2 | L230: CRELLIN 2
A232: NORTHCOTE | C232: 5 | D232: 2 | E232: =C232*6+D232 -> 32 | G232: 6 | H232: 3 | I232: =G232*6+H232 -> 39 | K232: 11 | L232: 11 | M232: =K232*6+L232 -> 77 | O232: 14 | P232: 12 | Q232: =O232*6+P232 -> 96 | S232: NORTHCOTE
A233: PRAHRAN | C233: 1 | D233: 5 | E233: =C233*6+D233 -> 11 | G233: 7 | H233: 7 | I233: =G233*6+H233 -> 49 | K233: 8 | L233: 8 | M233: =K233*6+L233 -> 56 | O233: 13 | P233: 10 | Q233: =O233*6+P233 -> 88 | S233: ROACH
A234: BEST PLAYERS
A235: NORTHCOTE | C235: WRIGHT | F235: GIBBS | I235: STABB | K235: ROMARI | N235: COLLINS | Q235: C POWELL
A236: PRAHRAN | C236: MORROW | F236: HARVEY | I236: GAZE | K236: HEALEY | N236: PLAIN | Q236: WILSON
A237: GOALKICKERS
A238: NORTHCOTE | C238: WRIGHT 3 | F238: ROMARI 3 | I238: COLLINS 3 | L238: DEVINE 2 | N238: C POWELL | Q238: STABB | S238: C WALKER
A239: PRAHRAN | C239: KINNABURGH 6 | F239: HARVEY 2 | I239: HART 2 | K239: RICKARDS | M239: PEARSON | O239: CLEAR
A241: SANDRINGHAM | C241: 1 | D241: 11 | E241: =C241*6+D241 -> 17 | G241: 2 | H241: 17 | I241: =G241*6+H241 -> 29 | K241: 9 | L241: 25 | M241: =K241*6+L241 -> 79 | O241: 13 | P241: 29 | Q241: =O241*6+P241 -> 107 | S241: ELSTERNWICK PARK
A242: BRIGHTON | C242: 2 | D242: 1 | E242: =C242*6+D242 -> 13 | G242: 7 | H242: 1 | I242: =G242*6+H242 -> 43 | K242: 8 | L242: 2 | M242: =K242*6+L242 -> 50 | O242: 9 | P242: 7 | Q242: =O242*6+P242 -> 61 | S242: ALLEN
A243: BEST PLAYERS
A244: SANDRINGHAM | C244: McMAHON | F244: KRAUSE | I244: JOHNSTON | L244: QUINN | O244: EVANS | Q244: CROFT
A245: BRIGHTON | C245: FREEMAN | F245: PEARSON | I245: BURKE | L245: DURKIN | O245: POUND | Q245: HART
A246: GOALKICKERS
A247: SANDRINGHAM | C247: JOHNSTON 4 | F247: GRUMLEY 2 | I247: EVANS 2 | K247: CROUCH | M247: SHEARER | O247: WEBSTER | Q247: QUINN | S247: McMAHON
A248: BRIGHTON | C248: HART 4 | F248: DURKIN 2 | I248: BURKE | K248: GRIENKE | M248: BROWNING
A250: BRUNSWICK | C250: 3 | D250: 4 | E250: =C250*6+D250 -> 22 | G250: 8 | H250: 10 | I250: =G250*6+H250 -> 58 | K250: 12 | L250: 15 | M250: =K250*6+L250 -> 87 | O250: 18 | P250: 19 | Q250: =O250*6+P250 -> 127 | S250: CAMBERWELL
A251: CAMBERWELL | C251: 4 | D251: 3 | E251: =C251*6+D251 -> 27 | G251: 6 | H251: 6 | I251: =G251*6+H251 -> 42 | K251: 7 | L251: 8 | M251: =K251*6+L251 -> 50 | O251: 9 | P251: 11 | Q251: =O251*6+P251 -> 65 | S251: BARNETT
A252: BEST PLAYERS
A253: BRUNSWICK | C253: CULLY | F253: M ROLFS | I253: STANLEY | L253: WALL | N253: McFEE | Q253: EDWARDS
A254: CAMBERWELL | C254: McGUINNESS | F254: K CLARKE | I254: HOLYOAK | L254: WALKER | N254: TURNBULL | Q254: WATTS
A255: GOALKICKERS
A256: BRUNSWICK | C256: WALL 3 | E256: I CLUES 3 | H256: LOVETT 2 | J256: McFEE 2 | L256: STANLEY 2 | N256: DILLON 2 | P256: JAMES 2 | R256: DEAS | T256: WEIR
A257: CAMBERWELL | C257: McGUINNESS 5 | F257: MATHEWS | I257: COLEMAN | L257: JOHNSON | N257: DUGDALE
A259: COBURG | C259: 4 | D259: 2 | E259: =C259*6+D259 -> 26 | G259: 8 | H259: 8 | I259: =G259*6+H259 -> 56 | K259: 9 | L259: 12 | M259: =K259*6+L259 -> 66 | O259: 15 | P259: 14 | Q259: =O259*6+P259 -> 104 | S259: YARRAVILLE
A260: YARRAVILLE | C260: 3 | D260: 1 | E260: =C260*6+D260 -> 19 | G260: 5 | H260: 3 | I260: =G260*6+H260 -> 33 | K260: 8 | L260: 10 | M260: =K260*6+L260 -> 58 | O260: 8 | P260: 11 | Q260: =O260*6+P260 -> 59 | S260: BEITZEL
A261: BEST PLAYERS
A262: COBURG | C262: J BRENNAN | F262: MAHONEY | I262: JONES | K262: HEWES | N262: FEWKES | Q262: McCOLL
A263: YARRAVILLE | C263: FRASER | F263: SANDS | I263: WILD | K263: B MASON | N263: WILLIAMS | Q263: DE JONG
A264: GOALKICKERS
A265: COBURG | C265: HEWES 5 | F265: H WILKINSON 3 | J265: MILLER 2 | M265: GOULLET 2 | P265: R BRENNAN | S265: MILES | U265: McCOLL
A266: YARRAVILLE | C266: WILLIAMS 3 | F266: WILD | H266: TUCK | J266: FRASER | M266: DE JONG | O266: HEMPEL
A268: ROUND 5 | E268: 12TH MAY | J268: WEATHER | M268: SOUTH WEST WIND RAIN | S268: PLAYED AT
D269: 1ST QTR | H269: 2ND QTR | L269: 3RD QTR | P269: FINAL | S269: COBURG
A270: COBURG | C270: 3 | D270: 9 | E270: =C270*6+D270 -> 27 | G270: 6 | H270: 10 | I270: =G270*6+H270 -> 46 | K270: 8 | L270: 16 | M270: =K270*6+L270 -> 64 | O270: 11 | P270: 18 | Q270: =O270*6+P270 -> 84 | S270: UMPIRE | X270: LADDER | AB270: ROUND | AD270: 5
A271: NORTHCOTE | C271: 1 | D271: 0 | E271: =C271*6+D271 -> 6 | G271: 6 | H271: 7 | I271: =G271*6+H271 -> 43 | K271: 7 | L271: 8 | M271: =K271*6+L271 -> 50 | O271: 8 | P271: 12 | Q271: =O271*6+P271 -> 60 | S271: IRVING
A272: BEST PLAYERS | W272: TEAM | X272: W | Y272: L | Z272: D | AA272: FOR | AB272: AGST | AC272: % | AD272: PTS
A273: COBURG | C273: MAHONEY | F273: J BRENNAN | I273: GOULLET | L273: B JONES | N273: H WILKINSON | Q273: FEWKES
A274: NORTHCOTE | C274: FRANCIS | F274: WOOLNOUGH | I274: BINNS | L274: C POWELL | N274: TULL | Q274: STABB | W274: PORT MELBOURNE | X274: 5 | Y274: 0 | Z274: 0 | AA274: 517 | AB274: 283 | AC274: 182.68551236749116 | AD274: 20
A275: GOALKICKERS | W275: BOX HILL | X275: 4 | Y275: 1 | Z275: 0 | AA275: 407 | AB275: 256 | AC275: 158.984375 | AD275: 16
A276: COBURG | C276: GOULLET 4 | F276: HEWES 3 | I276: YOUNG 3 | L276: H WILKINSON | W276: WILLIAMSTOWN | X276: 4 | Y276: 1 | Z276: 0 | AA276: 380 | AB276: 249 | AC276: 152.61044176706827 | AD276: 16
A277: NORTHCOTE | C277: BINNS 5 | F277: DEVINE | I277: ROMARI | L277: PURDON | W277: MOORABBIN | X277: 4 | Y277: 1 | Z277: 0 | AA277: 387 | AB277: 291 | AC277: 132.98969072164948 | AD277: 16
A279: PORT MELBOURNE | C279: 5 | D279: 5 | E279: =C279*6+D279 -> 35 | G279: 6 | H279: 8 | I279: =G279*6+H279 -> 44 | K279: 11 | L279: 11 | M279: =K279*6+L279 -> 77 | O279: 12 | P279: 15 | Q279: =O279*6+P279 -> 87 | S279: BEACH ROAD | W279: COBURG | X279: 4 | Y279: 1 | Z279: 0 | AA279: 522 | AB279: 397 | AC279: 131.48614609571788 | AD279: 16
A280: SANDRINGHAM | C280: 2 | D280: 2 | E280: =C280*6+D280 -> 14 | G280: 5 | H280: 3 | I280: =G280*6+H280 -> 33 | K280: 7 | L280: 3 | M280: =K280*6+L280 -> 45 | O280: 12 | P280: 5 | Q280: =O280*6+P280 -> 77 | S280: ROWE | W280: OAKLEIGH | X280: 2 | Y280: 2 | Z280: 1 | AA280: 301 | AB280: 449 | AC280: 67.037861915367486 | AD280: 10
A281: BEST PLAYERS | W281: BRUNSWICK | X281: 2 | Y281: 3 | Z281: 0 | AA281: 405 | AB281: 354 | AC281: 114.40677966101696 | AD281: 8
A282: PORT MELBOURNE | C282: ALLEN | F282: JOHNSON | I282: WITHERS | L282: STREADER | O282: LEWIS | Q282: McBROOM | W282: SANDRINGHAM | X282: 2 | Y282: 3 | Z282: 0 | AA282: 411 | AB282: 389 | AC282: 105.65552699228792 | AD282: 8
A283: SANDRINGHAM | C283: SHEARER | F283: KRAUSE | I283: DAVIDSON | L283: K EVANS | O283: JONES | Q283: McMAHON | W283: PRESTON | X283: 2 | Y283: 3 | Z283: 0 | AA283: 354 | AB283: 352 | AC283: 100.56818181818181 | AD283: 8
A284: GOALKICKERS | W284: NORTHCOTE | X284: 2 | Y284: 3 | Z284: 0 | AA284: 310 | AB284: 346 | AC284: 89.595375722543352 | AD284: 8
A285: PORT MELBOURNE | C285: McBROOM 3 | F285: BONNETT 2 | I285: REECE YOUNG 2 | L285: SYKES | N285: JOHNSON | P285: STREADER | R285: WITHERS | U285: LEWIS | W285: PRAHRAN | X285: 1 | Y285: 3 | Z285: 1 | AA285: 380 | AB285: 456 | AC285: 83.333333333333329 | AD285: 6
A286: SANDRINGHAM | C286: DAVIDSON 4 | F286: HOGAN 4 | I286: FLETCHER 2 | L286: JOHNSTON | N286: R EVANS | W286: CAMBERWELL | X286: 1 | Y286: 4 | Z286: 0 | AA286: 331 | AB286: 500 | AC286: 66.2 | AD286: 4
W287: BRIGHTON | X287: 1 | Y287: 4 | Z287: 0 | AA287: 294 | AB287: 491 | AC287: 59.877800407331975 | AD287: 4
A288: PRESTON | C288: 3 | D288: 2 | E288: =C288*6+D288 -> 20 | G288: 6 | H288: 4 | I288: =G288*6+H288 -> 40 | K288: 7 | L288: 8 | M288: =K288*6+L288 -> 50 | O288: 9 | P288: 10 | Q288: =O288*6+P288 -> 64 | S288: BRUNSWICK | W288: YARRAVILLE | X288: 0 | Y288: 5 | Z288: 0 | AA288: 253 | AB288: 439 | AC288: 57.630979498861045 | AD288: 0
A289: BRUNSWICK | C289: 2 | D289: 2 | E289: =C289*6+D289 -> 14 | G289: 4 | H289: 4 | I289: =G289*6+H289 -> 28 | K289: 6 | L289: 6 | M289: =K289*6+L289 -> 42 | O289: 7 | P289: 9 | Q289: =O289*6+P289 -> 51 | S289: ROBINSON
A290: BEST PLAYERS
A291: PRESTON | C291: FOLEY | F291: LALOR | I291: CROCKER | L291: BRADFORD | O291: McBEAN | Q291: McLACHLAN
A292: BRUNSWICK | C292: CULLY | F292: WEIR | I292: McGREGOR | L292: MULLENGER | O292: McFEE | Q292: SIMPSON
A293: GOALKICKERS
A294: PRESTON | C294: FOLEY 4 | F294: LALOR 2 | I294: CRELLIN 2 | L294: K CHARD
A295: BRUNSWICK | C295: McFEE 2 | F295: HAYES | H295: STANLEY | J295: DILLON | L295: WEIR | N295: MULLENGER
A297: PRAHRAN | C297: 5 | D297: 5 | E297: =C297*6+D297 -> 35 | G297: 5 | H297: 8 | I297: =G297*6+H297 -> 38 | K297: 10 | L297: 12 | M297: =K297*6+L297 -> 72 | O297: 11 | P297: 12 | Q297: =O297*6+P297 -> 78 | S297: TOORAK PARK
A298: OAKLEIGH | C298: 1 | D298: 1 | E298: =C298*6+D298 -> 7 | G298: 6 | H298: 5 | I298: =G298*6+H298 -> 41 | K298: 7 | L298: 10 | M298: =K298*6+L298 -> 52 | O298: 11 | P298: 12 | Q298: =O298*6+P298 -> 78 | S298: BEITZEL
A299: BEST PLAYERS
A300: PRAHRAN | C300: MORROW | F300: HARVEY | I300: PLAIN | K300: ROSS JONES | N300: HEALEY | Q300: KINNABURGH
A301: OAKLEIGH | C301: COLLINS | F301: NEWPORT | I301: GUY | K301: ANDERSON | N301: BACKMAN | Q301: BAPTIST
A302: GOALKICKERS
A303: PRAHRAN | C303: KINNABURGH 4 | F303: WILSON 3 | I303: HARVEY 2 | L303: ELLIOTT | N303: SHARP
A304: OAKLEIGH | C304: HOWELL 3 | F304: COUGHLAN 2 | I304: ANDERSON 2 | L304: NICHOLSON 2 | O304: NEWPORT | Q304: H WILLIAMS
A306: MOORABBIN | C306: 0 | D306: 4 | E306: =C306*6+D306 -> 4 | G306: 5 | H306: 12 | I306: =G306*6+H306 -> 42 | K306: 5 | L306: 12 | M306: =K306*6+L306 -> 42 | O306: 11 | P306: 15 | Q306: =O306*6+P306 -> 81 | S306: CAMBERWELL
A307: CAMBERWELL | C307: 3 | D307: 7 | E307: =C307*6+D307 -> 25 | G307: 5 | H307: 8 | I307: =G307*6+H307 -> 38 | K307: 7 | L307: 12 | M307: =K307*6+L307 -> 54 | O307: 7 | P307: 15 | Q307: =O307*6+P307 -> 57 | S307: BREWER
A308: BEST PLAYERS
A309: MOORABBIN | C309: McGAW | F309: JONES | I309: KING | L309: MANIE | O309: CARGHILL | R309: BULMER
A310: CAMBERWELL | C310: McGUINNESS | F310: HOLYOAK | I310: DEAGAN | L310: COLEMAN | O310: SCHNEIDER | R310: TURNBULL
A311: GOALKICKERS
A312: MOORABBIN | C312: BULMER 2 | F312: JONES 2 | H312: McGAW 2 | J312: SCHOFIELD | M312: MANIE | O312: SUTHERLAND | R312: RENWICK | U312: CHANDLER
A313: CAMBERWELL | C313: SCHNEIDER 2 | F313: COLEMAN 2 | I313: LANE | K313: McGUINNESS | N313: WATTS
A315: BOX HILL | C315: 6 | D315: 2 | E315: =C315*6+D315 -> 38 | G315: 6 | H315: 6 | I315: =G315*6+H315 -> 42 | K315: 14 | L315: 13 | M315: =K315*6+L315 -> 97 | O315: 18 | P315: 15 | Q315: =O315*6+P315 -> 123 | S315: BOX HILL
A316: YARRAVILLE | C316: 1 | D316: 1 | E316: =C316*6+D316 -> 7 | G316: 4 | H316: 4 | I316: =G316*6+H316 -> 28 | K316: 5 | L316: 4 | M316: =K316*6+L316 -> 34 | O316: 5 | P316: 5 | Q316: =O316*6+P316 -> 35 | S316: ROACH
A317: BEST PLAYERS
A318: BOX HILL | C318: DUNN | F318: SAWATSKY | I318: LOVE | K318: PLUNKETT | N318: HOUGHTON | Q318: BENNETT
A319: YARRAVILLE | C319: MASON | F319: MARCHESI | I319: WILD | K319: GARLICK | N319: FRASER | Q319: DE JONG
A320: GOALKICKERS
A321: BOX HILL | C321: DUNN 6 | E321: SAWATSKY 3 | H321: PLUNKETT 2 | K321: EADE 2 | M321: BROWN 2 | O321: LANNING | Q321: BENNETT | T321: NODEN
A322: YARRAVILLE | C322: TUCK | E322: DE JONG | H322: WILD | J322: GARLICK | M322: FRASER
A324: WILLIAMSTOWN | C324: 3 | D324: 4 | E324: =C324*6+D324 -> 22 | G324: 4 | H324: 9 | I324: =G324*6+H324 -> 33 | K324: 5 | L324: 10 | M324: =K324*6+L324 -> 40 | O324: 9 | P324: 12 | Q324: =O324*6+P324 -> 66 | S324: WILLIAMSTOWN
A325: BRIGHTON | C325: 0 | D325: 3 | E325: =C325*6+D325 -> 3 | G325: 1 | H325: 3 | I325: =G325*6+H325 -> 9 | K325: 2 | L325: 5 | M325: =K325*6+L325 -> 17 | O325: 3 | P325: 6 | Q325: =O325*6+P325 -> 24 | S325: BARNETT
A326: BEST PLAYERS
A327: WILLIAMSTOWN | C327: MARTIN | F327: MUNDAY | I327: REED | K327: LINTON | N327: JOHNSON | Q327: WARD
A328: BRIGHTON | C328: PEARSON | F328: CRAIG | I328: POUND | K328: FREEMAN | N328: BROWNING | Q328: DAVIDSON
A329: GOALKICKERS
A330: WILLIAMSTOWN | C330: ANDERSON 3 | F330: LINTON 2 | I330: CALLAHAN 2 | L330: REED | N330: WOOKEY
A331: BRIGHTON | C331: WEST | F331: HART | I331: McASEY
A333: ROUND 6 | E333: 19TH MAY | J333: WEATHER | M333: SOUTH EAST WIND FINE | S333: PLAYED AT
D334: 1ST QTR | H334: 2ND QTR | L334: 3RD QTR | P334: FINAL | S334: PORT MELBOURNE
A335: WILLIAMSTOWN | C335: 1 | D335: 0 | E335: =C335*6+D335 -> 6 | G335: 7 | H335: 4 | I335: =G335*6+H335 -> 46 | K335: 13 | L335: 5 | M335: =K335*6+L335 -> 83 | O335: 14 | P335: 8 | Q335: =O335*6+P335 -> 92 | S335: UMPIRE | X335: LADDER | AB335: ROUND | AD335: 6
A336: PORT MELBOURNE | C336: 2 | D336: 3 | E336: =C336*6+D336 -> 15 | G336: 7 | H336: 4 | I336: =G336*6+H336 -> 46 | K336: 10 | L336: 8 | M336: =K336*6+L336 -> 68 | O336: 12 | P336: 15 | Q336: =O336*6+P336 -> 87 | S336: ROACH
A337: BEST PLAYERS | W337: TEAM | X337: W | Y337: L | Z337: D | AA337: FOR | AB337: AGST | AC337: % | AD337: PTS
A338: WILLIAMSTOWN | C338: CALLAHAN | F338: EVANS | H338: GEAR | K338: KENT | N338: CURRAN | Q338: WOOKEY
A339: PORT MELBOURNE | C339: BONNETT | F339: ALLEN | H339: MCDONALD | K339: McBROOM | N339: E ATKINSON | Q339: LOCKHART | W339: PORT MELBOURNE | X339: 5 | Y339: 1 | Z339: 0 | AA339: 604 | AB339: 375 | AC339: 161.07 | AD339: 20
A340: GOALKICKERS | W340: BOX HILL | X340: 5 | Y340: 1 | Z340: 0 | AA340: 464 | AB340: 312 | AC340: 148.71794871794873 | AD340: 20
A341: WILLIAMSTOWN | C341: EVANS 4 | E341: REED 2 | G341: CALLAHAN 2 | J341: LINTON 2 | L341: FISHER | N341: GEAR | P341: ANDERSON | S341: WOOKEY | W341: MOORABBIN | X341: 5 | Y341: 1 | Z341: 0 | AA341: 490 | AB341: 341 | AC341: 143.69501466275659 | AD341: 20
A342: PORT MELBOURNE | C342: BONNETT 6 | F342: McDONALD 2 | I342: McBROOM 2 | L342: REECE YOUNG | W342: WILLIAMSTOWN | X342: 5 | Y342: 1 | Z342: 0 | AA342: 472 | AB342: 336 | AC342: 140.48 | AD342: 20
A344: OAKLEIGH | C344: 2 | D344: 3 | E344: =C344*6+D344 -> 15 | G344: 5 | H344: 4 | I344: =G344*6+H344 -> 34 | K344: 10 | L344: 8 | M344: =K344*6+L344 -> 68 | O344: 11 | P344: 8 | Q344: =O344*6+P344 -> 74 | S344: OAKLEIGH | W344: COBURG | X344: 4 | Y344: 2 | Z344: 0 | AA344: 587 | AB344: 471 | AC344: 124.62845010615712 | AD344: 16
A345: COBURG | C345: 5 | D345: 2 | E345: =C345*6+D345 -> 32 | G345: 5 | H345: 4 | I345: =G345*6+H345 -> 34 | K345: 7 | L345: 5 | M345: =K345*6+L345 -> 47 | O345: 9 | P345: 11 | Q345: =O345*6+P345 -> 65 | S345: ROWE | W345: OAKLEIGH | X345: 3 | Y345: 2 | Z345: 1 | AA345: 375 | AB345: 514 | AC345: 72.95719844357977 | AD345: 14
A346: BEST PLAYERS | W346: BRUNSWICK | X346: 3 | Y346: 3 | Z346: 0 | AA346: 529 | AB346: 433 | AC346: 122.17090069284065 | AD346: 12
A347: OAKLEIGH | C347: GUY | F347: NEWPORT | I347: SCULLIN | K347: HOWELL | N347: COLLINS | Q347: CARGHILL | W347: PRESTON | X347: 3 | Y347: 3 | Z347: 0 | AA347: 446 | AB347: 435 | AC347: 102.52873563218391 | AD347: 12
A348: COBURG | C348: GOULLET | F348: SHORT | I348: MILES | K348: McCOLL | N348: MAHONEY | Q348: J BRENNAN | W348: SANDRINGHAM | X348: 2 | Y348: 4 | Z348: 0 | AA348: 458 | AB348: 441 | AC348: 103.85487528344672 | AD348: 8
A349: GOALKICKERS | W349: NORTHCOTE | X349: 2 | Y349: 4 | Z349: 0 | AA349: 366 | AB349: 403 | AC349: 90.818858560794041 | AD349: 8
A350: OAKLEIGH | C350: HOWELL 4 | F350: NEWPORT 4 | I350: COUGHLAN 2 | L350: NICHOLSON | W350: PRAHRAN | X350: 1 | Y350: 4 | Z350: 1 | AA350: 430 | AB350: 559 | AC350: 76.92307692307692 | AD350: 6
A351: COBURG | C351: B JONES 4 | F351: MILES 2 | I351: GOULLET | K351: SASSELA | M351: H WILKINSON | W351: CAMBERWELL | X351: 1 | Y351: 5 | Z351: 0 | AA351: 414 | AB351: 592 | AC351: 69.932432432432435 | AD351: 4
W352: YARRAVILLE | X352: 1 | Y352: 5 | Z352: 0 | AA352: 305 | AB352: 486 | AC352: 62.757201646090536 | AD352: 4
A353: BOX HILL | C353: 3 | D353: 2 | E353: =C353*6+D353 -> 20 | G353: 3 | H353: 3 | I353: =G353*6+H353 -> 21 | K353: 5 | L353: 6 | M353: =K353*6+L353 -> 36 | O353: 8 | P353: 9 | Q353: =O353*6+P353 -> 57 | S353: NORTHCOTE | W353: BRIGHTON | X353: 1 | Y353: 5 | Z353: 0 | AA353: 373 | AB353: 615 | AC353: 60.650406504065039 | AD353: 4
A354: NORTHCOTE | C354: 1 | D354: 3 | E354: =C354*6+D354 -> 9 | G354: 5 | H354: 4 | I354: =G354*6+H354 -> 34 | K354: 7 | L354: 5 | M354: =K354*6+L354 -> 47 | O354: 8 | P354: 8 | Q354: =O354*6+P354 -> 56 | S354: ALLEN
A355: BEST PLAYERS
A356: BOX HILL | C356: BENNETT | F356: IRVINE | I356: PLUNKETT | L356: AUSTEN | N356: HOUGHTON | Q356: GREEN
A357: NORTHCOTE | C357: FRANCIS | F357: VAINS | I357: WOOLNOUGH | L357: HOLT | N357: GIBBS | Q357: PAYNTER
A358: GOALKICKERS
A359: BOX HILL | C359: BROWN 3 | F359: BENNETT 2 | I359: SAWATSKY | L359: PLUNKETT | O359: GREEN
A360: NORTHCOTE | C360: ROMARI 3 | F360: DEVINE 2 | I360: HOLT | K360: PURDON | M360: BINNS
A362: MOORABBIN | C362: 4 | D362: 3 | E362: =C362*6+D362 -> 27 | G362: 8 | H362: 9 | I362: =G362*6+H362 -> 57 | K362: 12 | L362: 10 | M362: =K362*6+L362 -> 82 | O362: 15 | P362: 13 | Q362: =O362*6+P362 -> 103 | S362: TOORAK PARK
A363: PRAHRAN | C363: 1 | D363: 1 | E363: =C363*6+D363 -> 7 | G363: 3 | H363: 6 | I363: =G363*6+H363 -> 24 | K363: 5 | L363: 12 | M363: =K363*6+L363 -> 42 | O363: 6 | P363: 14 | Q363: =O363*6+P363 -> 50 | S363: IRVING
A364: BEST PLAYERS
A365: MOORABBIN | C365: DYNON | E365: GREEN | H365: McGAW | K365: RENWICK | N365: MURRAY | Q365: LEHMANN
A366: PRAHRAN | C366: HARVEY | E366: PEARSON | H366: SHARP | K366: SNOW | N366: HEALEY | Q366: WILSON
A367: GOALKICKERS
A368: MOORABBIN | C368: RENWICK 5 | F368: SCHOFIELD 4 | I368: McGAW 3 | L368: CLOVER | N368: MURRAY | Q368: CARGHILL
A369: PRAHRAN | C369: WILSON 2 | F369: SHARP 2 | I369: HARVEY | K369: HART
A371: PRESTON | C371: 1 | D371: 1 | E371: =C371*6+D371 -> 7 | G371: 4 | H371: 6 | I371: =G371*6+H371 -> 30 | K371: 7 | L371: 9 | M371: =K371*6+L371 -> 51 | O371: 13 | P371: 14 | Q371: =O371*6+P371 -> 92 | S371: PRESTON
A372: CAMBERWELL | C372: 3 | D372: 3 | E372: =C372*6+D372 -> 21 | G372: 5 | H372: 2 | I372: =G372*6+H372 -> 32 | K372: 10 | L372: 4 | M372: =K372*6+L372 -> 64 | O372: 13 | P372: 5 | Q372: =O372*6+P372 -> 83 | S372: BEITZEL
A373: BEST PLAYERS
A374: PRESTON | C374: FOLEY | E374: CONSTABLE | H374: GUNN | K374: JONES | N374: CROCKER | Q374: McBEAN
A375: CAMBERWELL | C375: ROSS | E375: McGUINNESS | H375: COLEMAN | K375: BELL | N375: SKALBERG | Q375: HOLYOAK
A376: GOALKICKERS
A377: PRESTON | C377: FOLEY 4 | E377: JONES 3 | G377: CRELLIN 2 | I377: K CHARD | K377: BRADFORD | M377: CONSTABLE | P377: LALOR
A378: CAMBERWELL | C378: COLEMAN 4 | F378: MATHEWS 4 | I378: McGUINNESS 2 | L378: WATTS 2 | N378: FARRELL
A380: BRUNSWICK | C380: 7 | D380: 3 | E380: =C380*6+D380 -> 45 | G380: 8 | H380: 7 | I380: =G380*6+H380 -> 55 | K380: 13 | L380: 16 | M380: =K380*6+L380 -> 94 | O380: 18 | P380: 16 | Q380: =O380*6+P380 -> 124 | S380: ELSTERNWICK PARK
A381: BRIGHTON | C381: 2 | D381: 2 | E381: =C381*6+D381 -> 14 | G381: 8 | H381: 6 | I381: =G381*6+H381 -> 54 | K381: 8 | L381: 8 | M381: =K381*6+L381 -> 56 | O381: 11 | P381: 13 | Q381: =O381*6+P381 -> 79 | S381: BREWER
A382: BEST PLAYERS
A383: BRUNSWICK | C383: WEIR | F383: STANLEY | I383: POLLARD | L383: CULLY | O383: SIMPSON | R383: NEILSON
A384: BRIGHTON | C384: FREEMAN | F384: CRAIG | I384: HART | L384: I DAVIDSON | O384: BROWNING | R384: POUND
A385: GOALKICKERS
A386: BRUNSWICK | C386: HAYES 4 | E386: WEIR 4 | G386: I CLUES 3 | I386: McFEE 2 | K386: POLLLARD | M386: CULLY | O386: McMAHON | Q386: CORNES | S386: MULLENGER
A387: BRIGHTON | C387: HART 4 | E387: CRAIG 3 | G387: COOPER 2 | J387: DURKIN | L387: FREEMAN
A389: YARRAVILLE | C389: 1 | D389: 4 | E389: =C389*6+D389 -> 10 | G389: 4 | H389: 7 | I389: =G389*6+H389 -> 31 | K389: 5 | L389: 10 | M389: =K389*6+L389 -> 40 | O389: 6 | P389: 16 | Q389: =O389*6+P389 -> 52 | S389: YARRAVILLE
A390: SANDRINGHAM | C390: 4 | D390: 0 | E390: =C390*6+D390 -> 24 | G390: 4 | H390: 4 | I390: =G390*6+H390 -> 28 | K390: 7 | L390: 5 | M390: =K390*6+L390 -> 47 | O390: 7 | P390: 5 | Q390: =O390*6+P390 -> 47 | S390: BARNETT
A391: BEST PLAYERS
A392: YARRAVILLE | C392: WALLACE | F392: FRASER | I392: ROHLEDER | L392: CAREY | N392: GARRICK | Q392: CUFFE
A393: SANDRINGHAM | C393: JOHNSTON | F393: KRAUSE | I393: BOLAND | L393: FLETCHER | N393: JONES | Q393: DAVIDSON
A394: GOALKICKERS
A395: YARRAVILLE | C395: CAREY 3 | F395: HEMPL | I395: FRASER | K395: WILLIAMS
A396: SANDRINGHAM | C396: BOLAND 3 | F396: JOHNSTON 2 | I396: QUINN | K396: DAVIDSON
A398: ROUND 7 | E398: 26TH MAY | J398: WEATHER | M398: SOUTH WEST WIND GROUNDS HEAVY | S398: PLAYED AT
D399: 1ST QTR | H399: 2ND QTR | L399: 3RD QTR | P399: FINAL | S399: OAKLEIGH
A400: BOX HILL | C400: 3 | D400: 1 | E400: =C400*6+D400 -> 19 | G400: 10 | H400: 4 | I400: =G400*6+H400 -> 64 | K400: 10 | L400: 5 | M400: =K400*6+L400 -> 65 | O400: 13 | P400: 10 | Q400: =O400*6+P400 -> 88 | S400: UMPIRE | X400: LADDER | AB400: ROUND | AD400: 7
A401: OAKLEIGH | C401: 1 | D401: 1 | E401: =C401*6+D401 -> 7 | G401: 1 | H401: 3 | I401: =G401*6+H401 -> 9 | K401: 4 | L401: 7 | M401: =K401*6+L401 -> 31 | O401: 4 | P401: 10 | Q401: =O401*6+P401 -> 34 | S401: BARNETT
A402: BEST PLAYERS | W402: TEAM | X402: W | Y402: L | Z402: D | AA402: FOR | AB402: AGST | AC402: % | AD402: PTS
A403: BOX HILL | C403: AUSTEN | F403: NODEN | I403: GALLAWAY | L403: SAWATSKY | O403: WRIGHT | Q403: INGLETON
A404: OAKLEIGH | C404: PRENDERGAST | F404: SCULLIN | I404: BAPTIST | L404: COLLINS | O404: GUY | Q404: BRUCE | W404: BOX HILL | X404: 6 | Y404: 1 | Z404: 0 | AA404: 552 | AB404: 346 | AC404: 159.53757225433526 | AD404: 24
A405: GOALKICKERS | W405: PORT MELBOURNE | X405: 6 | Y405: 1 | Z405: 0 | AA405: 671 | AB405: 424 | AC405: 158.25 | AD405: 24
A406: BOX HILL | C406: PLUNKETT 4 | F406: BROWN 3 | I406: DUNN 2 | K406: SAWATSKY | N406: NODEN | P406: DRURY | R406: INGLETON | W406: MOORABBIN | X406: 5 | Y406: 2 | Z406: 0 | AA406: 551 | AB406: 411 | AC406: 134.06326034063261 | AD406: 20
A407: OAKLEIGH | C407: NEWPORT 2 | F407: PREECE | H407: BACKMAN | W407: WILLIAMSTOWN | X407: 5 | Y407: 2 | Z407: 0 | AA407: 548 | AB407: 413 | AC407: 132.69 | AD407: 20
A409: PRESTON | C409: 5 | D409: 5 | E409: =C409*6+D409 -> 35 | G409: 7 | H409: 7 | I409: =G409*6+H409 -> 49 | K409: 9 | L409: 8 | M409: =K409*6+L409 -> 62 | O409: 10 | P409: 10 | Q409: =O409*6+P409 -> 70 | S409: MOORABBIN | W409: COBURG | X409: 5 | Y409: 2 | Z409: 0 | AA409: 693 | AB409: 539 | AC409: 128.57142857142858 | AD409: 20
A410: MOORABBIN | C410: 1 | D410: 1 | E410: =C410*6+D410 -> 7 | G410: 5 | H410: 2 | I410: =G410*6+H410 -> 32 | K410: 8 | L410: 5 | M410: =K410*6+L410 -> 53 | O410: 9 | P410: 7 | Q410: =O410*6+P410 -> 61 | S410: SMYTH | W410: PRESTON | X410: 4 | Y410: 3 | Z410: 0 | AA410: 516 | AB410: 496 | AC410: 104.03225806451613 | AD410: 16
A411: BEST PLAYERS | W411: OAKLEIGH | X411: 3 | Y411: 3 | Z411: 1 | AA411: 409 | AB411: 602 | AC411: 67.940199335548172 | AD411: 14
A412: PRESTON | C412: CROCKER | F412: LALOR | I412: FOLEY | K412: BRADFORD | N412: SUPPLITT | Q412: MCBEAN | W412: BRUNSWICK | X412: 3 | Y412: 4 | Z412: 0 | AA412: 578 | AB412: 500 | AC412: 115.6 | AD412: 12
A413: MOORABBIN | C413: MORONEY | F413: BULMER | I413: DYNON | K413: GILDER | N413: LAWRENCE | Q413: CLOVER | W413: SANDRINGHAM | X413: 3 | Y413: 4 | Z413: 0 | AA413: 534 | AB413: 486 | AC413: 109.87654320987654 | AD413: 12
A414: GOALKICKERS | W414: NORTHCOTE | X414: 2 | Y414: 5 | Z414: 0 | AA414: 411 | AB414: 479 | AC414: 85.803757828810021 | AD414: 8
A415: PRESTON | C415: BRADFORD 4 | F415: FOLEY 3 | I415: LITTLE | K415: LALOR | M415: F CHARD | W415: YARRAVILLE | X415: 2 | Y415: 5 | Z415: 0 | AA415: 382 | AB415: 562 | AC415: 67.971530249110316 | AD415: 8
A416: MOORABBIN | C416: HOUGHTON 2 | F416: McGAW 2 | I416: RENWICK 2 | L416: SUTHERLAND | O416: SCHOFIELD | Q416: BULMER | W416: BRIGHTON | X416: 2 | Y416: 5 | Z416: 0 | AA416: 444 | AB416: 679 | AC416: 65.390279823269509 | AD416: 8
W417: PRAHRAN | X417: 1 | Y417: 5 | Z417: 1 | AA417: 498 | AB417: 665 | AC417: 74.887218045112789 | AD417: 6
A418: PORT MELBOURNE | C418: 4 | D418: 3 | E418: =C418*6+D418 -> 27 | G418: 5 | H418: 5 | I418: =G418*6+H418 -> 35 | K418: 7 | L418: 6 | M418: =K418*6+L418 -> 48 | O418: 10 | P418: 7 | Q418: =O418*6+P418 -> 67 | S418: BRUNSWICK | W418: CAMBERWELL | X418: 1 | Y418: 6 | Z418: 0 | AA418: 478 | AB418: 663 | AC418: 72.096530920060331 | AD418: 4
A419: BRUNSWICK | C419: 3 | D419: 1 | E419: =C419*6+D419 -> 19 | G419: 6 | H419: 1 | I419: =G419*6+H419 -> 37 | K419: 6 | L419: 1 | M419: =K419*6+L419 -> 37 | O419: 8 | P419: 1 | Q419: =O419*6+P419 -> 49 | S419: ALLEN
A420: BEST PLAYERS
A421: PORT MELBOURNE | C421: LOCKHART | F421: E ATKINSON | I421: METHERALL | L421: R ATKINSON | O421: LAFFEY | R421: MILLER
A422: BRUNSWICK | C422: CORNES | F422: ROLFS | I422: PURVES | L422: JAMES | O422: POLLARD | R422: SIMPSON
A423: GOALKICKERS
A424: PORT MELBOURNE | C424: BONNETT 3 | F424: STREADER 2 | I424: LEWIS 2 | K424: MILLER | M424: McBROOM | P424: JOHNSON
A425: BRUNSWICK | C425: JAMES 2 | F425: WEIR 2 | I425: HAYES 2 | K425: SIMPSON | N425: McFEE
A427: SANDRINGHAM | C427: 2 | D427: 1 | E427: =C427*6+D427 -> 13 | G427: 5 | H427: 5 | I427: =G427*6+H427 -> 35 | K427: 6 | L427: 7 | M427: =K427*6+L427 -> 43 | O427: 11 | P427: 10 | Q427: =O427*6+P427 -> 76 | S427: BEACH ROAD
A428: NORTHCOTE | C428: 3 | D428: 2 | E428: =C428*6+D428 -> 20 | G428: 3 | H428: 9 | I428: =G428*6+H428 -> 27 | K428: 4 | L428: 12 | M428: =K428*6+L428 -> 36 | O428: 5 | P428: 15 | Q428: =O428*6+P428 -> 45 | S428: BREWER
A429: BEST PLAYERS
A430: SANDRINGHAM | C430: JONES | E430: GILLIES | H430: BOLAND | K430: K EVANS | N430: McKENZIE | Q430: KRAUSE
A431: NORTHCOTE | C431: DEVINE | E431: GIBBS | H431: PAYNTER | K431: F VAINS | N431: OLIVER | Q431: PURDON
A432: GOALKICKERS
A433: SANDRINGHAM | C433: HARPER 3 | F433: BOLAND 2 | I433: JOHNSTON 2 | L433: DAVIDSON | N433: SHRIVES | P433: McMAHON | S433: QUINN
A434: NORTHCOTE | C434: GIBBS 3 | F434: A JOHNSON | I434: DEVINE
A436: BRIGHTON | C436: 4 | D436: 4 | E436: =C436*6+D436 -> 28 | G436: 5 | H436: 5 | I436: =G436*6+H436 -> 35 | K436: 9 | L436: 9 | M436: =K436*6+L436 -> 63 | O436: 10 | P436: 11 | Q436: =O436*6+P436 -> 71 | S436: ELSTERNWICK PARK
A437: CAMBERWELL | C437: 3 | D437: 3 | E437: =C437*6+D437 -> 21 | G437: 6 | H437: 6 | I437: =G437*6+H437 -> 42 | K437: 8 | L437: 9 | M437: =K437*6+L437 -> 57 | O437: 9 | P437: 10 | Q437: =O437*6+P437 -> 64 | S437: ROBINSON
A438: BEST PLAYERS
A439: BRIGHTON | C439: CRAIG | E439: WILLIAMS | H439: PEARSON | K439: HART | N439: GRIENKE | Q439: J DAVIDSON
A440: CAMBERWELL | C440: ROSS | E440: EADES | H440: HOLYOAK | K440: I CLARKE | N440: L SMITH | Q440: TEMPANY
A441: GOALKICKERS
A442: BRIGHTON | C442: CRAIG 3 | F442: HART 3 | H442: A SMITH | J442: DURKIN | L442: FREEMAN | N442: DALY
A443: CAMBERWELL | C443: TEMPANY 5 | F443: EADES 2 | H443: WATTS | J443: ROSS
A445: COBURG | C445: 6 | D445: 4 | E445: =C445*6+D445 -> 40 | G445: 10 | H445: 9 | I445: =G445*6+H445 -> 69 | K445: 12 | L445: 15 | M445: =K445*6+L445 -> 87 | O445: 15 | P445: 16 | Q445: =O445*6+P445 -> 106 | S445: COBURG
A446: PRAHRAN | C446: 2 | D446: 1 | E446: =C446*6+D446 -> 13 | G446: 3 | H446: 3 | I446: =G446*6+H446 -> 21 | K446: 5 | L446: 6 | M446: =K446*6+L446 -> 36 | O446: 10 | P446: 8 | Q446: =O446*6+P446 -> 68 | S446: ROACH
A447: BEST PLAYERS
A448: COBURG | C448: B JONES | F448: McCOLL | I448: J BRENNAN | L448: FEWKES | O448: H WILKINSON | R448: HEWES
A449: PRAHRAN | C449: C BOYD | F449: HARVEY | I449: ELLIOTT | L449: ROSS JONES | O449: SHARP | R449: MORROW
A450: GOALKICKERS
A451: COBURG | C451: HEWES 7 | F451: J BRENNAN 3 | I451: B JONES 2 | K451: HUNTINGTON 2 | N451: H WILKINSON
A452: PRAHRAN | C452: HARVEY 3 | F452: HORSFIELD 2 | I452: KINNABURGH 2 | L452: SHARP 2 | N452: DOOLEY
A454: YARRAVILLE | C454: 0 | D454: 2 | E454: =C454*6+D454 -> 2 | G454: 6 | H454: 9 | I454: =G454*6+H454 -> 45 | K454: 7 | L454: 12 | M454: =K454*6+L454 -> 54 | O454: 10 | P454: 17 | Q454: =O454*6+P454 -> 77 | S454: WILLIAMSTOWN
A455: WILLIAMSTOWN | C455: 2 | D455: 4 | E455: =C455*6+D455 -> 16 | G455: 4 | H455: 6 | I455: =G455*6+H455 -> 30 | K455: 8 | L455: 8 | M455: =K455*6+L455 -> 56 | O455: 11 | P455: 10 | Q455: =O455*6+P455 -> 76 | S455: ROWE
A456: BEST PLAYERS
A457: YARRAVILLE | C457: ROHLEDER | F457: CUFFE | I457: HEMPEL | L457: MASON | O457: GARRICK | Q457: CARSON
A458: WILLIAMSTOWN | C458: KENT | F458: FISHER | I458: CALLAHAN | L458: MUNDAY | O458: LINTON | Q458: R JONES
A459: GOALKICKERS
A460: YARRAVILLE | C460: HEMPEL 4 | F460: BOURKE 2 | I460: GARRICK | K460: WILCOX | M460: CARSON | O460: WALLIS
A461: WILLIAMSTOWN | C461: LINTON 3 | F461: EVANS 3 | I461: CALLAHAN 2 | L461: REED | N461: MULDOWNEY | Q461: WOOKEY
A463: ROUND 8 | E463: 2ND JUNE | J463: WEATHER | O463: FINE | S463: PLAYED AT
D464: 1ST QTR | H464: 2ND QTR | L464: 3RD QTR | P464: FINAL | S464: BOX HILL
A465: BOX HILL | C465: 5 | D465: 2 | E465: =C465*6+D465 -> 32 | G465: 8 | H465: 8 | I465: =G465*6+H465 -> 56 | K465: 8 | L465: 12 | M465: =K465*6+L465 -> 60 | O465: 9 | P465: 13 | Q465: =O465*6+P465 -> 67 | S465: UMPIRE | X465: LADDER | AB465: ROUND | AD465: 8
A466: COBURG | C466: 2 | D466: 1 | E466: =C466*6+D466 -> 13 | G466: 4 | H466: 6 | I466: =G466*6+H466 -> 30 | K466: 7 | L466: 6 | M466: =K466*6+L466 -> 48 | O466: 9 | P466: 8 | Q466: =O466*6+P466 -> 62 | S466: ROBINSON
A467: BEST PLAYERS | W467: TEAM | X467: W | Y467: L | Z467: D | AA467: FOR | AB467: AGST | AC467: % | AD467: PTS
A468: BOX HILL | C468: HOUGHTON | F468: BROWN | I468: NODEN | L468: LOVE | O468: AUSTEN | Q468: IRVINE
A469: COBURG | C469: B JONES | F469: SMITH | I469: MATHEWS | L469: H WILKINSON | O469: HORSKINS | Q469: YOUNG | W469: BOX HILL | X469: 7 | Y469: 1 | Z469: 0 | AA469: 619 | AB469: 408 | AC469: 151.71568627450981 | AD469: 28
A470: GOALKICKERS | W470: WILLIAMSTOWN | X470: 6 | Y470: 2 | Z470: 0 | AA470: 662 | AB470: 431 | AC470: 153.6 | AD470: 24
A471: BOX HILL | C471: BROWN 6 | F471: DEVERY | I471: INGLETON | L471: PLUNKETT | W471: PORT MELBOURNE | X471: 6 | Y471: 2 | Z471: 0 | AA471: 713 | AB471: 490 | AC471: 145.51 | AD471: 24
A472: COBURG | C472: HEWES 3 | F472: B JONES 2 | I472: McMAHON | K472: GOULLET | M472: H WILKINSON | P472: YOUNG | W472: MOORABBIN | X472: 6 | Y472: 2 | Z472: 0 | AA472: 625 | AB472: 481 | AC472: 129.93762993762994 | AD472: 24
A474: PRESTON | C474: 2 | D474: 3 | E474: =C474*6+D474 -> 15 | G474: 5 | H474: 4 | I474: =G474*6+H474 -> 34 | K474: 5 | L474: 10 | M474: =K474*6+L474 -> 40 | O474: 9 | P474: 12 | Q474: =O474*6+P474 -> 66 | S474: COBURG | W474: COBURG | X474: 5 | Y474: 3 | Z474: 0 | AA474: 755 | AB474: 606 | AC474: 124.58745874587459 | AD474: 20
A475: PORT MELBOURNE | C475: 1 | D475: 1 | E475: =C475*6+D475 -> 7 | G475: 3 | H475: 5 | I475: =G475*6+H475 -> 23 | K475: 5 | L475: 5 | M475: =K475*6+L475 -> 35 | O475: 6 | P475: 6 | Q475: =O475*6+P475 -> 42 | S475: IRVING | W475: PRESTON | X475: 5 | Y475: 3 | Z475: 0 | AA475: 582 | AB475: 538 | AC475: 108.17843866171003 | AD475: 20
A476: BEST PLAYERS | W476: BRUNSWICK | X476: 4 | Y476: 4 | Z476: 0 | AA476: 634 | AB476: 532 | AC476: 119.17293233082707 | AD476: 16
A477: PRESTON | C477: CROCKER | F477: HOWARD | I477: CUSACK | L477: LALOR | N477: BRAFORD | Q477: F CHARD | W477: SANDRINGHAM | X477: 4 | Y477: 4 | Z477: 0 | AA477: 614 | AB477: 549 | AC477: 111.83970856102003 | AD477: 16
A478: PORT MELBOURNE | C478: LOCKHART | F478: WITHERS | I478: SYKES | L478: MILLER | N478: E ATKINSON | Q478: McBROOM | W478: OAKLEIGH | X478: 3 | Y478: 4 | Z478: 1 | AA478: 427 | AB478: 716 | AC478: 59.63687150837989 | AD478: 14
A479: GOALKICKERS | W479: NORTHCOTE | X479: 2 | Y479: 6 | Z479: 0 | AA479: 443 | AB479: 535 | AC479: 82.803738317757009 | AD479: 8
A480: PRESTON | C480: F CHARD 6 | F480: BRADFORD | I480: LALOR | K480: CONSTABLE | W480: CAMBERWELL | X480: 2 | Y480: 6 | Z480: 0 | AA480: 547 | AB480: 716 | AC480: 76.396648044692739 | AD480: 8
A481: PORT MELBOURNE | C481: BONNETT 2 | F481: McBROOM 2 | I481: MILLER | K481: OLDFIELD | W481: YARRAVILLE | X481: 2 | Y481: 6 | Z481: 0 | AA481: 435 | AB481: 631 | AC481: 68.938193343898575 | AD481: 8
W482: BRIGHTON | X482: 2 | Y482: 6 | Z482: 0 | AA482: 514 | AB482: 753 | AC482: 68.260292164674638 | AD482: 8
A483: MOORABBIN | C483: 1 | D483: 1 | E483: =C483*6+D483 -> 7 | G483: 6 | H483: 8 | I483: =G483*6+H483 -> 44 | K483: 8 | L483: 11 | M483: =K483*6+L483 -> 59 | O483: 10 | P483: 14 | Q483: =O483*6+P483 -> 74 | S483: MOORABBIN | W483: PRAHRAN | X483: 1 | Y483: 6 | Z483: 1 | AA483: 561 | AB483: 745 | AC483: 75.302013422818789 | AD483: 6
A484: BRIGHTON | C484: 3 | D484: 2 | E484: =C484*6+D484 -> 20 | G484: 5 | H484: 5 | I484: =G484*6+H484 -> 35 | K484: 7 | L484: 6 | M484: =K484*6+L484 -> 48 | O484: 10 | P484: 10 | Q484: =O484*6+P484 -> 70 | S484: ROACH
A485: BEST PLAYERS
A486: MOORABBIN | C486: RENWICK | F486: GREEN | I486: McGAW | K486: K BOYD | N486: LEHMANN | Q486: GILDER
A487: BRIGHTON | C487: PEARSON | F487: BROWNING | I487: DALEY | K487: COCKFIELD | N487: WILLIAMS | Q487: HART
A488: GOALKICKERS
A489: MOORABBIN | C489: SCHOFIELD 3 | F489: McGAW 3 | I489: BULMER | K489: MORONEY | N489: MURPHY | P489: RENWICK
A490: BRIGHTON | C490: HART 3 | F490: CRAIG 2 | I490: DURKIN 2 | L490: DALEY | N490: McCANN | P490: COOPER
E491: 4TH JUNE | H491: QUEENS BIRTHDAY | L491: WEATHER | P491: RAIN DULL
A492: WILLIAMSTOWN | C492: 6 | D492: 2 | E492: =C492*6+D492 -> 38 | G492: 11 | H492: 7 | I492: =G492*6+H492 -> 73 | K492: 12 | L492: 11 | M492: =K492*6+L492 -> 83 | O492: 16 | P492: 18 | Q492: =O492*6+P492 -> 114 | S492: WILLIAMSTOWN
A493: OAKLEIGH | C493: 0 | D493: 4 | E493: =C493*6+D493 -> 4 | G493: 0 | H493: 6 | I493: =G493*6+H493 -> 6 | K493: 2 | L493: 6 | M493: =K493*6+L493 -> 18 | O493: 2 | P493: 6 | Q493: =O493*6+P493 -> 18 | S493: ALLEN
A494: BEST PLAYERS
A495: WILLIAMSTOWN | C495: REED | F495: KENT | I495: MARTIN | L495: BEITZEL | N495: WOOKEY | Q495: GEAR
A496: OAKLEIGH | C496: COLLINS | F496: KITTO | I496: COUGHLAN | L496: BACKMAN | N496: BOURKE | Q496: BAPTIST
A497: GOALKICKERS
A498: WILLIAMSTOWN | C498: LINTON 4 | F498: REED 3 | H498: EVANS 2 | J498: GEAR 2 | L498: SMITH 2 | N498: FISHER | P498: WOOKEY | R498: SIMS
A499: OAKLEIGH | C499: NICHOLSON | F499: KITTO
A501: BRUNSWICK | C501: 0 | D501: 2 | E501: =C501*6+D501 -> 2 | G501: 4 | H501: 6 | I501: =G501*6+H501 -> 30 | K501: 6 | L501: 8 | M501: =K501*6+L501 -> 44 | O501: 7 | P501: 14 | Q501: =O501*6+P501 -> 56 | S501: BRUNSWICK
A502: NORTHCOTE | C502: 2 | D502: 2 | E502: =C502*6+D502 -> 14 | G502: 3 | H502: 3 | I502: =G502*6+H502 -> 21 | K502: 4 | L502: 6 | M502: =K502*6+L502 -> 30 | O502: 4 | P502: 8 | Q502: =O502*6+P502 -> 32 | S502: SMYTH
A503: BEST PLAYERS | S503: NORTHCOTE
A504: BRUNSWICK | C504: McFEE | E504: ROLFS | H504: STANLEY | K504: CORNES | N504: MULLENGER | Q504: PURVES
A505: NORTHCOTE | C505: HOLT | E505: GIBBS | H505: DEVINE | K505: JOHNSON | N505: FRANCIS | Q505: WRIGHT
A506: GOALKICKERS
A507: BRUNSWICK | C507: MULLENGER 2 | F507: CULLY | H507: McFEE | J507: LOVETT | M507: EDWARDS | P507: WEIR
A508: NORTHCOTE | C508: ROMARI 2 | F508: PAWSEY | I508: JOHNSON
A510: CAMBERWELL | C510: 2 | D510: 2 | E510: =C510*6+D510 -> 14 | G510: 5 | H510: 5 | I510: =G510*6+H510 -> 35 | K510: 8 | L510: 8 | M510: =K510*6+L510 -> 56 | O510: 10 | P510: 9 | Q510: =O510*6+P510 -> 69 | S510: CAMBERWELL
A511: YARRAVILLE | C511: 1 | D511: 2 | E511: =C511*6+D511 -> 8 | G511: 2 | H511: 7 | I511: =G511*6+H511 -> 19 | K511: 5 | L511: 8 | M511: =K511*6+L511 -> 38 | O511: 6 | P511: 17 | Q511: =O511*6+P511 -> 53 | S511: BREWER
A512: BEST PLAYERS
A513: CAMBERWELL | C513: ROSS | E513: BELL | H513: EADES | K513: McGUINNESS | N513: I CLARKE | Q513: SKALBERG
A514: YARRAVILLE | C514: WILD | E514: CARSON | H514: ROHLEDER | K514: GARLICK | N514: PAINE | Q514: FRASER
A515: GOALKICKERS
A516: CAMBERWELL | C516: McGUINNESS 5 | F516: TEMPANY 2 | I516: SCHNEIDER | L516: HOLYOAK | N516: ROSS
A517: YARRAVILLE | C517: WILD 2 | E517: HEMPEL | G517: BOURKE | I517: GARLICK | K517: TUCK
A519: SANDRINGHAM | C519: 3 | D519: 3 | E519: =C519*6+D519 -> 21 | G519: 6 | H519: 4 | I519: =G519*6+H519 -> 40 | K519: 11 | L519: 7 | M519: =K519*6+L519 -> 73 | O519: 12 | P519: 8 | Q519: =O519*6+P519 -> 80 | S519: BEACH ROAD
A520: PRAHRAN | C520: 1 | D520: 4 | E520: =C520*6+D520 -> 10 | G520: 3 | H520: 5 | I520: =G520*6+H520 -> 23 | K520: 6 | L520: 8 | M520: =K520*6+L520 -> 44 | O520: 8 | P520: 15 | Q520: =O520*6+P520 -> 63 | S520: ROWE
A521: BEST PLAYERS
A522: SANDRINGHAM | C522: BOLAND | E522: FLETCHER | H522: QUINN | K522: R HARPER | N522: I JONES | Q522: HAIGH
A523: PRAHRAN | C523: GAZE | E523: HARVEY | H523: ROSS JONES | K523: KINNABURGH | N523: CORTI | Q523: ELLIOTT
A524: GOALKICKERS
A525: SANDRINGHAM | C525: R HARPER 4 | F525: BOLAND 2 | I525: QUINN 2 | K525: KRAUSE | M525: EVANS | O525: SHRIVES | Q525: SHEARER
A526: PRAHRAN | C526: KINNABURGH 2 | F526: HARVEY 2 | I526: SHARP | K526: ELLIOTT | M526: ROY JONES | P526: HART
A528: ROUND 9 | E528: 9TH JUNE | K528: WEATHER | M528: SOUTH EAST WIND GROUNDS HEAVY | S528: PLAYED AT
D529: 1ST QTR | H529: 2ND QTR | L529: 3RD QTR | P529: FINAL | S529: COBURG
A530: MOORABBIN | C530: 5 | D530: 2 | E530: =C530*6+D530 -> 32 | G530: 7 | H530: 2 | I530: =G530*6+H530 -> 44 | K530: 7 | L530: 8 | M530: =K530*6+L530 -> 50 | O530: 10 | P530: 11 | Q530: =O530*6+P530 -> 71 | S530: UMPIRE | X530: LADDER | AB530: ROUND | AD530: 9
A531: COBURG | C531: 2 | D531: 0 | E531: =C531*6+D531 -> 12 | G531: 6 | H531: 3 | I531: =G531*6+H531 -> 39 | K531: 6 | L531: 5 | M531: =K531*6+L531 -> 41 | O531: 10 | P531: 10 | Q531: =O531*6+P531 -> 70 | S531: ROACH
A532: BEST PLAYERS | W532: TEAM | X532: W | Y532: L | Z532: D | AA532: FOR | AB532: AGST | AC532: % | AD532: PTS
A533: MOORABBIN | C533: K BOYD | E533: CLOVER | H533: MURRAY | K533: KING | N533: RYAN | Q533: LAWRENCE
A534: COBURG | C534: McCOLL | E534: GOULLET | H534: H WILKINSON | K534: RUTLEDGE | N534: B JONES | Q534: MILLER | W534: BOX HILL | X534: 8 | Y534: 1 | Z534: 0 | AA534: 697 | AB534: 435 | AC534: 160.22988505747125 | AD534: 32
A535: GOALKICKERS | W535: WILLIAMSTOWN | X535: 7 | Y535: 2 | Z535: 0 | AA535: 720 | AB535: 446 | AC535: 161.43 | AD535: 28
A536: MOORABBIN | C536: SCHOFIELD 3 | F536: MORONEY 2 | I536: McGAW 2 | K536: CLOVER | M536: K BOYD | O536: LEHMANN | W536: PORT MELBOURNE | X536: 7 | Y536: 2 | Z536: 0 | AA536: 820 | AB536: 550 | AC536: 149.09 | AD536: 28
A537: COBURG | C537: B JONES 4 | F537: H WILKINSON 3 | J537: HORSKINS | M537: GOULLET | O537: MILLER | W537: MOORABBIN | X537: 7 | Y537: 2 | Z537: 0 | AA537: 696 | AB537: 551 | AC537: 126.31578947368421 | AD537: 28
A539: OAKLEIGH | C539: 1 | D539: 1 | E539: =C539*6+D539 -> 7 | G539: 6 | H539: 7 | I539: =G539*6+H539 -> 43 | K539: 9 | L539: 10 | M539: =K539*6+L539 -> 64 | O539: 10 | P539: 16 | Q539: =O539*6+P539 -> 76 | S539: OAKLEIGH | W539: PRESTON | X539: 6 | Y539: 3 | Z539: 0 | AA539: 699 | AB539: 606 | AC539: 115.34653465346534 | AD539: 24
A540: SANDRINGHAM | C540: 3 | D540: 7 | E540: =C540*6+D540 -> 25 | G540: 4 | H540: 10 | I540: =G540*6+H540 -> 34 | K540: 6 | L540: 15 | M540: =K540*6+L540 -> 51 | O540: 6 | P540: 17 | Q540: =O540*6+P540 -> 53 | S540: IRVING | W540: COBURG | X540: 5 | Y540: 4 | Z540: 0 | AA540: 825 | AB540: 677 | AC540: 121.86115214180207 | AD540: 20
A541: BEST PLAYERS | W541: BRUNSWICK | X541: 5 | Y541: 4 | Z541: 0 | AA541: 719 | AB541: 602 | AC541: 119.43521594684385 | AD541: 20
A542: OAKLEIGH | C542: BACKMAN | F542: RILEY | I542: COLLINS | L542: BOURKE | N542: SCULLIN | Q542: COUGHLAN | W542: OAKLEIGH | X542: 4 | Y542: 4 | Z542: 1 | AA542: 503 | AB542: 769 | AC542: 65.40962288686606 | AD542: 18
A543: SANDRINGHAM | C543: MARSHALL | F543: FLETCHER | I543: WEBSTER | L543: JONES | N543: RANSOM | Q543: K EVANS | W543: SANDRINGHAM | X543: 4 | Y543: 5 | Z543: 0 | AA543: 667 | AB543: 625 | AC543: 106.72 | AD543: 16
A544: GOALKICKERS | W544: NORTHCOTE | X544: 2 | Y544: 7 | Z544: 0 | AA544: 458 | AB544: 593 | AC544: 77.234401349072513 | AD544: 8
A545: OAKLEIGH | C545: BACKMAN 3 | F545: R PREECE 2 | I545: COUGHLAN 2 | L545: COLLINS | N545: NICHOLSON | Q545: RILEY | W545: CAMBERWELL | X545: 2 | Y545: 7 | Z545: 0 | AA545: 607 | AB545: 823 | AC545: 73.754556500607535 | AD545: 8
A546: SANDRINGHAM | C546: WEBSTER 2 | F546: RANSOM | I546: DAVIDSON | L546: R EVANS | N546: MARSHALL | W546: YARRAVILLE | X546: 2 | Y546: 7 | Z546: 0 | AA546: 505 | AB546: 716 | AC546: 70.530726256983243 | AD546: 8
W547: BRIGHTON | X547: 2 | Y547: 7 | Z547: 0 | AA547: 582 | AB547: 870 | AC547: 66.896551724137936 | AD547: 8
A548: BRUNSWICK | C548: 1 | D548: 4 | E548: =C548*6+D548 -> 10 | G548: 3 | H548: 7 | I548: =G548*6+H548 -> 25 | K548: 7 | L548: 10 | M548: =K548*6+L548 -> 52 | O548: 12 | P548: 13 | Q548: =O548*6+P548 -> 85 | S548: YARRAVILLE | W548: PRAHRAN | X548: 1 | Y548: 7 | Z548: 1 | AA548: 588 | AB548: 823 | AC548: 71.445929526123933 | AD548: 6
A549: YARRAVILLE | C549: 1 | D549: 1 | E549: =C549*6+D549 -> 7 | G549: 5 | H549: 4 | I549: =G549*6+H549 -> 34 | K549: 7 | L549: 5 | M549: =K549*6+L549 -> 47 | O549: 10 | P549: 10 | Q549: =O549*6+P549 -> 70 | S549: ROACH
A550: BEST PLAYERS
A551: BRUNSWICK | C551: BUCHANAN | F551: WEST | I551: STANLEY | L551: ROLFS | N551: NEILSON | Q551: McFARLANE
A552: YARRAVILLE | C552: GARLICK | F552: FRASER | I552: DE JONG | L552: F JONES | N552: CASELEY | Q552: ROHLEDER
A553: GOALKICKERS
A554: BRUNSWICK | C554: McFARLANE 6 | F554: HAYES 2 | I554: LOVETT 2 | L554: MULLENGER | O554: SIMPSON
A555: YARRAVILLE | C555: BOURKE 2 | F555: CAREY 2 | I555: GARRICK 2 | L555: GARLICK | N555: TUCK | P555: WILD | R555: WALLIS
A557: PRESTON | C557: 2 | D557: 2 | E557: =C557*6+D557 -> 14 | G557: 8 | H557: 7 | I557: =G557*6+H557 -> 55 | K557: 11 | L557: 9 | M557: =K557*6+L557 -> 75 | O557: 16 | P557: 21 | Q557: =O557*6+P557 -> 117 | S557: ELSTERNWICK PARK
A558: BRIGHTON | C558: 4 | D558: 8 | E558: =C558*6+D558 -> 32 | G558: 5 | H558: 12 | I558: =G558*6+H558 -> 42 | K558: 7 | L558: 19 | M558: =K558*6+L558 -> 61 | O558: 8 | P558: 20 | Q558: =O558*6+P558 -> 68 | S558: CARDWELL
A559: BEST PLAYERS
A560: PRESTON | C560: HOBAN | F560: COOPER | I560: BRADFORD | L560: FOLEY | N560: CUSACK | Q560: BLIZZARD
A561: BRIGHTON | C561: HART | F561: PRETTY | I561: WEST | L561: GRIENKE | N561: I DAVIDSON | Q561: D CURRIE
A562: GOALKICKERS
A563: PRESTON | C563: F CHARD 5 | F563: BRADFORD 3 | I563: FOLEY 2 | K563: CONSTABLE | N563: LALOR | P563: GLYNN | R563: BLIZZARD | U563: LITTLE | W563: ROSE
A564: BRIGHTON | C564: WEST 4 | F564: HART 3 | I564: GRIENKE
A566: WILLIAMSTOWN | C566: 2 | D566: 3 | E566: =C566*6+D566 -> 15 | G566: 5 | H566: 4 | I566: =G566*6+H566 -> 34 | K566: 6 | L566: 8 | M566: =K566*6+L566 -> 44 | O566: 7 | P566: 16 | Q566: =O566*6+P566 -> 58 | S566: NORTHCOTE
A567: NORTHCOTE | C567: 0 | D567: 0 | E567: =C567*6+D567 -> 0 | G567: 1 | H567: 1 | I567: =G567*6+H567 -> 7 | K567: 2 | L567: 2 | M567: =K567*6+L567 -> 14 | O567: 2 | P567: 3 | Q567: =O567*6+P567 -> 15 | S567: ROBINSON
A568: BEST PLAYERS
A569: WILLIAMSTOWN | C569: CURRAN | F569: SIMS | I569: EVANS | L569: WOOKEY | N569: MARTIN | Q569: OUTEN
A570: NORTHCOTE | C570: J VAINS | F570: HOLT | I570: PAYNTER | L570: LOTT | N570: DEVINE | Q570: GIBBS
A571: GOALKICKERS
A572: WILLIAMSTOWN | C572: EVANS 3 | F572: R SMITH 2 | I572: F JONES | K572: LINTON
A573: NORTHCOTE | C573: HUSSEY | F573: HOLT
A575: PORT MELBOURNE | C575: 3 | D575: 6 | E575: =C575*6+D575 -> 24 | G575: 7 | H575: 9 | I575: =G575*6+H575 -> 51 | K575: 11 | L575: 16 | M575: =K575*6+L575 -> 82 | O575: 15 | P575: 17 | Q575: =O575*6+P575 -> 107 | S575: PORT MELBOURNE
A576: CAMBERWELL | C576: 1 | D576: 1 | E576: =C576*6+D576 -> 7 | G576: 2 | H576: 6 | I576: =G576*6+H576 -> 18 | K576: 5 | L576: 8 | M576: =K576*6+L576 -> 38 | O576: 8 | P576: 12 | Q576: =O576*6+P576 -> 60 | S576: ROWE
A577: BEST PLAYERS
A578: PORT MELBOURNE | C578: WITHERS | F578: LOCKHART | I578: JOHNSON | L578: MILLER | N578: BONNETT | Q578: HOWARTH
A579: CAMBERWELL | C579: SABBATUCCI | F579: McGUINNESS | I579: ALSOPP | L579: SCHNEIDER | N579: WATTS | Q579: I CLARKE
A580: GOALKICKERS
A581: PORT MELBOURNE | C581: BONNETT 6 | F581: JOHNSON 2 | I581: McBROOM 2 | L581: STREADER | N581: LEWIS | P581: WITHERS | R581: MILLER | U581: COLLINS
A582: CAMBERWELL | C582: McGUINNESS 4 | F582: WATTS 2 | I582: TEMPANY | K582: COLEMAN | M582: LANE
A584: BOX HILL | C584: 6 | D584: 6 | E584: =C584*6+D584 -> 42 | G584: 8 | H584: 9 | I584: =G584*6+H584 -> 57 | K584: 11 | L584: 12 | M584: =K584*6+L584 -> 78 | O584: 11 | P584: 12 | Q584: =O584*6+P584 -> 78 | S584: TOORAK PARK
A585: PRAHRAN | C585: 0 | D585: 2 | E585: =C585*6+D585 -> 2 | G585: 1 | H585: 2 | I585: =G585*6+H585 -> 8 | K585: 2 | L585: 4 | M585: =K585*6+L585 -> 16 | O585: 3 | P585: 9 | Q585: =O585*6+P585 -> 27 | S585: BREWER
A586: BEST PLAYERS
A587: BOX HILL | C587: LOVE | E587: DUNN | H587: HOUGHTON | K587: SAWATSKY | N587: AUSTEN | Q587: GREEN
A588: PRAHRAN | C588: CLEAR | E588: SHARP | H588: GAZE | K588: HARVEY | N588: MORROW | Q588: HEALEY
A589: GOALKICKERS
A590: BOX HILL | C590: BROWN 4 | E590: DUNN 2 | G590: NICHOLSON | J590: INGLETON | M590: EADE | N590: PLUNKETT | Q590: SAWATSKY
A591: PRAHRAN | C591: HARVEY 2 | F591: HORSFIELD
A593: ROUND 10 | E593: 16TH JUNE | J593: WEATHER | O593: FINE | S593: PLAYED AT
D594: 1ST QTR | H594: 2ND QTR | L594: 3RD QTR | P594: FINAL | S594: BOX HILL
A595: BOX HILL | C595: 3 | D595: 4 | E595: =C595*6+D595 -> 22 | G595: 6 | H595: 6 | I595: =G595*6+H595 -> 42 | K595: 10 | L595: 7 | M595: =K595*6+L595 -> 67 | O595: 10 | P595: 10 | Q595: =O595*6+P595 -> 70 | S595: UMPIRE | X595: LADDER | AB595: ROUND | AD595: 10
A596: MOORABBIN | C596: 2 | D596: 2 | E596: =C596*6+D596 -> 14 | G596: 4 | H596: 5 | I596: =G596*6+H596 -> 29 | K596: 8 | L596: 8 | M596: =K596*6+L596 -> 56 | O596: 9 | P596: 11 | Q596: =O596*6+P596 -> 65 | S596: CARDWELL
A597: BEST PLAYERS | W597: TEAM | X597: W | Y597: L | Z597: D | AA597: FOR | AB597: AGST | AC597: % | AD597: PTS
A598: BOX HILL | C598: WRIGHT | F598: LOVE | H598: IRVINE | K598: SAWATSKY | N598: INGLETON | Q598: AUSTEN
A599: MOORABBIN | C599: DYNON | F599: KING | H599: MORONEY | K599: GREEN | N599: BULMER | Q599: JONES | W599: BOX HILL | X599: 9 | Y599: 1 | Z599: 0 | AA599: 767 | AB599: 500 | AC599: 153.4 | AD599: 36
A600: GOALKICKERS | W600: WILLIAMSTOWN | X600: 8 | Y600: 2 | Z600: 0 | AA600: 815 | AB600: 533 | AC600: 152.91 | AD600: 32
A601: BOX HILL | C601: DUNN 2 | F601: BROWN 2 | I601: INGLETON 2 | L601: BLENHEIM 2 | O601: CRAIG | Q601: PLUNKETT | W601: PORT MELBOURNE | X601: 7 | Y601: 3 | Z601: 0 | AA601: 890 | AB601: 634 | AC601: 140.38 | AD601: 28
A602: MOORABBIN | C602: DYNON 3 | F602: SCHOFIELD 2 | I602: McGAW 2 | L602: CLOVER | N602: MORONEY | W602: MOORABBIN | X602: 7 | Y602: 3 | Z602: 0 | AA602: 761 | AB602: 621 | AC602: 122.54428341384863 | AD602: 28
A604: CAMBERWELL | C604: 2 | D604: 2 | E604: =C604*6+D604 -> 14 | G604: 6 | H604: 7 | I604: =G604*6+H604 -> 43 | K604: 7 | L604: 8 | M604: =K604*6+L604 -> 50 | O604: 7 | P604: 10 | Q604: =O604*6+P604 -> 52 | S604: NORTHCOTE | W604: BRUNSWICK | X604: 6 | Y604: 4 | Z604: 0 | AA604: 842 | AB604: 667 | AC604: 126.23688155922039 | AD604: 24
A605: NORTHCOTE | C605: 3 | D605: 2 | E605: =C605*6+D605 -> 20 | G605: 4 | H605: 3 | I605: =G605*6+H605 -> 27 | K605: 6 | L605: 6 | M605: =K605*6+L605 -> 42 | O605: 7 | P605: 8 | Q605: =O605*6+P605 -> 50 | S605: SMYTH | W605: PRESTON | X605: 6 | Y605: 4 | Z605: 0 | AA605: 763 | AB605: 671 | AC605: 113.71087928464978 | AD605: 24
A606: BEST PLAYERS | W606: COBURG | X606: 5 | Y606: 5 | Z606: 0 | AA606: 893 | AB606: 750 | AC606: 119.06666666666666 | AD606: 20
A607: CAMBERWELL | C607: ROSS | E607: HOLYOAK | H607: COLEMAN | K607: NELSON | N607: SCHNEIDER | Q607: TEMPANY | W607: SANDRINGHAM | X607: 5 | Y607: 5 | Z607: 0 | AA607: 740 | AB607: 693 | AC607: 106.78210678210678 | AD607: 20
A608: NORTHCOTE | C608: BINNS | E608: TULL | H608: L WALKER | K608: F VAINS | N608: PAYNTER | Q608: J VAINS | W608: OAKLEIGH | X608: 4 | Y608: 5 | Z608: 1 | AA608: 568 | AB608: 892 | AC608: 63.677130044843047 | AD608: 18
A609: GOALKICKERS | W609: CAMBERWELL | X609: 3 | Y609: 7 | Z609: 0 | AA609: 659 | AB609: 873 | AC609: 75.486827033218788 | AD609: 12
A610: CAMBERWELL | C610: COLEMAN 3 | F610: DONALDSON 2 | J610: LANE | L610: SCHNEIDER | W610: YARRAVILLE | X610: 3 | Y610: 7 | Z610: 0 | AA610: 570 | AB610: 780 | AC610: 73.07692307692308 | AD610: 12
A611: NORTHCOTE | C611: HOLT 2 | F611: BINNS 2 | I611: DEVINE | K611: J JOHNSON | N611: ROMARI | W611: BRIGHTON | X611: 3 | Y611: 7 | Z611: 0 | AA611: 666 | AB611: 940 | AC611: 70.851063829787236 | AD611: 12
W612: NORTHCOTE | X612: 2 | Y612: 8 | Z612: 0 | AA612: 508 | AB612: 645 | AC612: 78.759689922480618 | AD612: 8
A613: BRIGHTON | C613: 2 | D613: 0 | E613: =C613*6+D613 -> 12 | G613: 10 | H613: 3 | I613: =G613*6+H613 -> 63 | K613: 10 | L613: 7 | M613: =K613*6+L613 -> 67 | O613: 12 | P613: 12 | Q613: =O613*6+P613 -> 84 | S613: PORT MELBOURNE | W613: PRAHRAN | X613: 1 | Y613: 8 | Z613: 1 | AA613: 675 | AB613: 918 | AC613: 73.529411764705884 | AD613: 6
A614: PORT MELBOURNE | C614: 2 | D614: 7 | E614: =C614*6+D614 -> 19 | G614: 3 | H614: 9 | I614: =G614*6+H614 -> 27 | K614: 9 | L614: 14 | M614: =K614*6+L614 -> 68 | O614: 9 | P614: 16 | Q614: =O614*6+P614 -> 70 | S614: ROBINSON
A615: BEST PLAYERS
A616: BRIGHTON | C616: I DAVIDSON | F616: DALEY | I616: WILLIAMS | L616: CRAIG | N616: MCCANN | Q616: WOOLSTENCROFT
A617: PORT MELBOURNE | C617: MILLER | F617: COLLINS | I617: STREADER | L617: WILSON | N617: LAFFEY | Q617: WHARTON
A618: GOALKICKERS
A619: BRIGHTON | C619: JEWELL 3 | F619: DALEY 2 | I619: HART 2 | K619: WOOLSTENCROFT | O619: CURRIE | Q619: DURKIN | S619: CRAIG | U619: PRETTY
A620: PORT MELBOURNE | C620: MILLER 3 | F620: LEWIS 2 | I620: STREADER 2 | L620: WITHERS | N620: OLDFIELD | Q620: REECE YOUNG
E621: 23RD JUNE | M621: WEATHER | R621: FINE
A622: BRUNSWICK | C622: 3 | D622: 0 | E622: =C622*6+D622 -> 18 | G622: 10 | H622: 3 | I622: =G622*6+H622 -> 63 | K622: 15 | L622: 5 | M622: =K622*6+L622 -> 95 | O622: 19 | P622: 9 | Q622: =O622*6+P622 -> 123 | S622: OAKLEIGH
A623: OAKLEIGH | C623: 2 | D623: 2 | E623: =C623*6+D623 -> 14 | G623: 3 | H623: 9 | I623: =G623*6+H623 -> 27 | K623: 5 | L623: 14 | M623: =K623*6+L623 -> 44 | O623: 8 | P623: 17 | Q623: =O623*6+P623 -> 65 | S623: ROWE
A624: BEST PLAYERS
A625: BRUNSWICK | C625: MULLENGER | F625: McFEE | H625: LOVETT | K625: DILLON | N625: YEA | P625: STANLEY
A626: OAKLEIGH | C626: BOURKE | F626: COLLINS | H626: BAPTIST | K626: CARGILL | N626: KITTO | P626: COUGHLAN
A627: GOALKICKERS
A628: BRUNSWICK | C628: DILLON 5 | E628: McFEE 3 | G628: LOVETT 3 | I628: M McFARLANE 2 | M628: EDWARDS | O628: MULLENGER | R628: CORNES | U628: JAMES | W628: PURCELL | X628: STANLEY
A629: OAKLEIGH | C629: COUGHLAN 3 | F629: RILEY 2 | H629: NICHOLSON 2 | K629: CAMM
A631: SANDRINGHAM | C631: 2 | D631: 3 | E631: =C631*6+D631 -> 15 | G631: 4 | H631: 5 | I631: =G631*6+H631 -> 29 | K631: 6 | L631: 8 | M631: =K631*6+L631 -> 44 | O631: 10 | P631: 13 | Q631: =O631*6+P631 -> 73 | S631: COBURG
A632: COBURG | C632: 2 | D632: 9 | E632: =C632*6+D632 -> 21 | G632: 2 | H632: 16 | I632: =G632*6+H632 -> 28 | K632: 7 | L632: 19 | M632: =K632*6+L632 -> 61 | O632: 8 | P632: 20 | Q632: =O632*6+P632 -> 68 | S632: ALLEN
A633: BEST PLAYERS
A634: SANDRINGHAM | C634: FLETCHER | F634: R EVANS | I634: JOHNSTON | L634: BOLAND | O634: SHRIVES | R634: RANSOM
A635: COBURG | C635: YOUNG | F635: McCOLL | I635: BOYLE | L635: DANGUAARD | O635: BRENNAN | R635: GOULLET
A636: GOALKICKERS
A637: SANDRINGHAM | C637: BOLAND 3 | F637: MARSHALL 2 | I637: WARBURTON 2 | L637: VANCE | N637: QUINN | P637: RANSOM
A638: COBURG | C638: YOUNG 3 | F638: PEARCE 2 | I638: H WILKINSON | L638: GOULLET | O638: HUNTINGTON
A640: YARRAVILLE | C640: 5 | D640: 1 | E640: =C640*6+D640 -> 31 | G640: 5 | H640: 6 | I640: =G640*6+H640 -> 36 | K640: 8 | L640: 8 | M640: =K640*6+L640 -> 56 | O640: 9 | P640: 11 | Q640: =O640*6+P640 -> 65 | S640: YARRAVILLE
A641: PRESTON | C641: 1 | D641: 5 | E641: =C641*6+D641 -> 11 | G641: 3 | H641: 6 | I641: =G641*6+H641 -> 24 | K641: 5 | L641: 7 | M641: =K641*6+L641 -> 37 | O641: 9 | P641: 10 | Q641: =O641*6+P641 -> 64 | S641: BARNETT
A642: BEST PLAYERS
A643: YARRAVILLE | C643: MASON | F643: ROHLEDER | I643: PAINE | L643: JONES | O643: CARSON | R643: CAREY
A644: PRESTON | C644: F CHARD | F644: HAYES | I644: L SWEET | L644: HOBAN | O644: LITTLE | R644: BRADFORD
A645: GOALKICKERS
A646: YARRAVILLE | C646: BOURKE 3 | F646: WILD 2 | I646: CAREY 2 | L646: HEMPEL | N646: GARLICK
A647: PRESTON | C647: F CHARD 4 | F647: LITTLE 2 | I647: CONSTABLE 2 | L647: HAYES
A649: WILLIAMSTOWN | C649: 4 | D649: 4 | E649: =C649*6+D649 -> 28 | G649: 7 | H649: 4 | I649: =G649*6+H649 -> 46 | K649: 10 | L649: 9 | M649: =K649*6+L649 -> 69 | O649: 14 | P649: 11 | Q649: =O649*6+P649 -> 95 | S649: TOORAK PARK
A650: PRAHRAN | C650: 3 | D650: 1 | E650: =C650*6+D650 -> 19 | G650: 7 | H650: 9 | I650: =G650*6+H650 -> 51 | K650: 9 | L650: 13 | M650: =K650*6+L650 -> 67 | O650: 12 | P650: 15 | Q650: =O650*6+P650 -> 87 | S650: ROACH
A651: BEST PLAYERS
A652: WILLIAMSTOWN | C652: MARTIN | F652: GEAR | I652: MATHIESON | L652: SMITH | O652: TAAFE | R652: R JONES
A653: PRAHRAN | C653: HARVEY | F653: O'BRYAN | I653: MORROW | L653: WILSON | O653: KINNABURGH | R653: HEALEY
A654: GOALKICKERS
A655: WILLIAMSTOWN | C655: MATHIESON 6 | F655: F JONES 2 | I655: REED | K655: LINTON | M655: EVANS | O655: SIMS | Q655: FISHER | S655: McPHERSON
A656: PRAHRAN | C656: KINNABURGH 6 | F656: ELLIOTT | H656: HARVEY | J656: DAVIDSON | M656: WILSON | O656: O'BRYAN | Q656: SNOW
A658: ROUND 11 | E658: 30TH JUNE | J658: WEATHER | M658: SOUTH WEST WIND SHOWERS | S658: PLAYED AT
D659: 1ST QTR | H659: 2ND QTR | L659: 3RD QTR | P659: FINAL | S659: MOORABBIN
A660: PORT MELBOURNE | C660: 2 | D660: 0 | E660: =C660*6+D660 -> 12 | G660: 7 | H660: 4 | I660: =G660*6+H660 -> 46 | K660: 9 | L660: 6 | M660: =K660*6+L660 -> 60 | O660: 10 | P660: 12 | Q660: =O660*6+P660 -> 72 | S660: UMPIRE | X660: LADDER | AB660: ROUND | AD660: 11
A661: MOORABBIN | C661: 5 | D661: 6 | E661: =C661*6+D661 -> 36 | G661: 6 | H661: 6 | I661: =G661*6+H661 -> 42 | K661: 9 | L661: 11 | M661: =K661*6+L661 -> 65 | O661: 9 | P661: 11 | Q661: =O661*6+P661 -> 65 | S661: ALLEN
A662: BEST PLAYERS | W662: TEAM | X662: W | Y662: L | Z662: D | AA662: FOR | AB662: AGST | AC662: % | AD662: PTS
A663: PORT MELBOURNE | C663: JOHNSON | F663: MILLER | I663: STREADER | L663: LOCKHART | N663: REECE YOUNG | Q663: HARVEY
A664: MOORABBIN | C664: MURRAY | F664: MORONEY | I664: DYNON | L664: McGAW | N664: MURPHY | Q664: BULMER | W664: BOX HILL | X664: 10 | Y664: 1 | Z664: 0 | AA664: 816 | AB664: 545 | AC664: 149.72477064220183 | AD664: 40
A665: GOALKICKERS | W665: WILLIAMSTOWN | X665: 9 | Y665: 2 | Z665: 0 | AA665: 896 | AB665: 601 | AC665: 149.08 | AD665: 36
A666: PORT MELBOURNE | C666: MITCHELL 3 | F666: MILLER 3 | I666: JOHNSON 2 | L666: HARVEY | N666: BONNETT | W666: PORT MELBOURNE | X666: 8 | Y666: 3 | Z666: 0 | AA666: 962 | AB666: 699 | AC666: 137.63 | AD666: 32
A667: MOORABBIN | C667: SCHOFIELD 4 | F667: BULMER 2 | I667: McGAW 2 | L667: MORONEY | W667: BRUNSWICK | X667: 7 | Y667: 4 | Z667: 0 | AA667: 951 | AB667: 714 | AC667: 133.19327731092437 | AD667: 28
A669: WILLIAMSTOWN | C669: 0 | D669: 2 | E669: =C669*6+D669 -> 2 | G669: 4 | H669: 8 | I669: =G669*6+H669 -> 32 | K669: 5 | L669: 8 | M669: =K669*6+L669 -> 38 | O669: 11 | P669: 15 | Q669: =O669*6+P669 -> 81 | S669: WILLIAMSTOWN | W669: MOORABBIN | X669: 7 | Y669: 4 | Z669: 0 | AA669: 826 | AB669: 693 | AC669: 119.1919191919192 | AD669: 28
A670: COBURG | C670: 4 | D670: 8 | E670: =C670*6+D670 -> 32 | G670: 4 | H670: 9 | I670: =G670*6+H670 -> 33 | K670: 8 | L670: 13 | M670: =K670*6+L670 -> 61 | O670: 9 | P670: 14 | Q670: =O670*6+P670 -> 68 | S670: CARDWELL | W670: PRESTON | X670: 7 | Y670: 4 | Z670: 0 | AA670: 829 | AB670: 715 | AC670: 115.94405594405595 | AD670: 28
A671: BEST PLAYERS | W671: COBURG | X671: 5 | Y671: 6 | Z671: 0 | AA671: 961 | AB671: 831 | AC671: 115.64380264741276 | AD671: 20
A672: WILLIAMSTOWN | C672: R JONES | F672: REED | I672: TAAFE | L672: SIMMS | O672: GEAR | Q672: WOOKEY | W672: SANDRINGHAM | X672: 5 | Y672: 6 | Z672: 0 | AA672: 785 | AB672: 742 | AC672: 105.79514824797843 | AD672: 20
A673: COBURG | C673: YOUNG | F673: HUNTINGTON | I673: B JONES | L673: MAHONEY | O673: BOOTH | Q673: McMAHON | W673: OAKLEIGH | X673: 4 | Y673: 6 | Z673: 1 | AA673: 618 | AB673: 953 | AC673: 64.847848898216156 | AD673: 18
A674: GOALKICKERS | W674: CAMBERWELL | X674: 4 | Y674: 7 | Z674: 0 | AA674: 720 | AB674: 923 | AC674: 78.006500541711816 | AD674: 16
A675: WILLIAMSTOWN | C675: REED 4 | F675: MUNDAY 3 | I675: MATHIESON 2 | L675: SMITH | N675: GEAR | W675: BRIGHTON | X675: 4 | Y675: 7 | Z675: 0 | AA675: 735 | AB675: 994 | AC675: 73.943661971830991 | AD675: 16
A676: COBURG | C676: HUGHES 3 | F676: HUNTINGTON 2 | J676: YOUNG | L676: MILES | N676: MAHONEY | Q676: H WILKINSON | W676: YARRAVILLE | X676: 3 | Y676: 8 | Z676: 0 | AA676: 624 | AB676: 849 | AC676: 73.4982332155477 | AD676: 12
W677: NORTHCOTE | X677: 2 | Y677: 9 | Z677: 0 | AA677: 552 | AB677: 711 | AC677: 77.637130801687761 | AD677: 8
A678: BOX HILL | C678: 2 | D678: 5 | E678: =C678*6+D678 -> 17 | G678: 2 | H678: 6 | I678: =G678*6+H678 -> 18 | K678: 5 | L678: 12 | M678: =K678*6+L678 -> 42 | O678: 6 | P678: 13 | Q678: =O678*6+P678 -> 49 | S678: BEACH ROAD | W678: PRAHRAN | X678: 1 | Y678: 9 | Z678: 1 | AA678: 722 | AB678: 1027 | AC678: 70.301850048685495 | AD678: 6
A679: SANDRINGHAM | C679: 0 | D679: 0 | E679: =C679*6+D679 -> 0 | G679: 3 | H679: 3 | I679: =G679*6+H679 -> 21 | K679: 3 | L679: 4 | M679: =K679*6+L679 -> 22 | O679: 6 | P679: 9 | Q679: =O679*6+P679 -> 45 | S679: ROBINSON
A680: BEST PLAYERS
A681: BOX HILL | C681: SAWATSKY | F681: LANNING | I681: PLUNKETT | L681: GREEN | O681: NICHOLSON | R681: WRIGHT
A682: SANDRINGHAM | C682: FLETCHER | F682: QUINN | I682: RANSOM | L682: CONNINGSBY | O682: R EVANS | R682: JONES
A683: GOALKICKERS
A684: BOX HILL | C684: PLUNKETT 2 | F684: DUNN | H684: NODEN | J684: HOUGHTON | M684: NICHOLSON
A685: SANDRINGHAM | C685: QUINN 2 | F685: R HARPER | I685: VANCE | K685: WEBSTER | N685: HARRIS
A687: CAMBERWELL | C687: 1 | D687: 3 | E687: =C687*6+D687 -> 9 | G687: 2 | H687: 4 | I687: =G687*6+H687 -> 16 | K687: 6 | L687: 6 | M687: =K687*6+L687 -> 42 | O687: 9 | P687: 7 | Q687: =O687*6+P687 -> 61 | S687: CAMBERWELL
A688: OAKLEIGH | C688: 0 | D688: 1 | E688: =C688*6+D688 -> 1 | G688: 2 | H688: 7 | I688: =G688*6+H688 -> 19 | K688: 4 | L688: 10 | M688: =K688*6+L688 -> 34 | O688: 6 | P688: 14 | Q688: =O688*6+P688 -> 50 | S688: BREWER
A689: BEST PLAYERS
A690: CAMBERWELL | C690: HOLYOAK | F690: NELSON | I690: ROSS | L690: MCGUINNESS | O690: MASON | Q690: BELL
A691: OAKLEIGH | C691: LEHNE | F691: COLLINS | I691: SCULLIN | L691: NICHOLSON | O691: RILEY | Q691: CAMM
A692: GOALKICKERS
A693: CAMBERWELL | C693: McGUINNESS 3 | F693: DONALDSON 2 | I693: ROSS | K693: SKALBERG | M693: COLEMAN | P693: DUGDALE
A694: OAKLEIGH | C694: NEWPORT 2 | F694: COUGHLAN 2 | I694: NICHOLSON | L694: RILEY
A696: BRIGHTON | C696: 3 | D696: 0 | E696: =C696*6+D696 -> 18 | G696: 5 | H696: 1 | I696: =G696*6+H696 -> 31 | K696: 8 | L696: 1 | M696: =K696*6+L696 -> 49 | O696: 11 | P696: 3 | Q696: =O696*6+P696 -> 69 | S696: ELSTERNWICK PARK
A697: YARRAVILLE | C697: 3 | D697: 3 | E697: =C697*6+D697 -> 21 | G697: 5 | H697: 10 | I697: =G697*6+H697 -> 40 | K697: 6 | L697: 10 | M697: =K697*6+L697 -> 46 | O697: 7 | P697: 12 | Q697: =O697*6+P697 -> 54 | S697: IRVING
A698: BEST PLAYERS
A699: BRIGHTON | C699: DALEY | F699: PEARSON | I699: HART | L699: FREEMAN | O699: MILNE | Q699: CURRIE
A700: YARRAVILLE | C700: DODDS | F700: CHARLES | I700: PAINE | L700: WILD | O700: CUFFE | Q700: MASON
A701: GOALKICKERS
A702: BRIGHTON | C702: HART 4 | F702: DALEY 3 | I702: WEST 2 | K702: COCKFIELD | N702: JEWELL
A703: YARRAVILLE | C703: WILD 3 | F703: CHARLES | I703: McPHEE | K703: WALLIS | N703: CAREY
A705: PRESTON | C705: 2 | D705: 1 | E705: =C705*6+D705 -> 13 | G705: 4 | H705: 2 | I705: =G705*6+H705 -> 26 | K705: 8 | L705: 4 | M705: =K705*6+L705 -> 52 | O705: 10 | P705: 6 | Q705: =O705*6+P705 -> 66 | S705: COBURG
A706: NORTHCOTE | C706: 1 | D706: 2 | E706: =C706*6+D706 -> 8 | G706: 2 | H706: 3 | I706: =G706*6+H706 -> 15 | K706: 3 | L706: 4 | M706: =K706*6+L706 -> 22 | O706: 6 | P706: 8 | Q706: =O706*6+P706 -> 44 | S706: ROWE
A707: BEST PLAYERS
A708: PRESTON | C708: FOLEY | E708: CUSACK | H708: McBEAN | K708: CONSTABLE | N708: CROCKER | Q708: McLACHLAN
A709: NORTHCOTE | C709: DEVINE | E709: TULL | H709: GOUGH | K709: ALDRIDGE | N709: HUSSEY | Q709: J VAINS
A710: GOALKICKERS
A711: PRESTON | C711: FOLEY 3 | F711: F CHARD 2 | I711: COOPER 2 | L711: GUNN | N711: BRADFORD | Q711: ROSE
A712: NORTHCOTE | C712: COLLINS 2 | F712: OLNEY | H712: GOUGH | J712: FRANCIS | L712: F JOHNSTON
A714: BRUNSWICK | C714: 5 | D714: 10 | E714: =C714*6+D714 -> 40 | G714: 6 | H714: 11 | I714: =G714*6+H714 -> 47 | K714: 11 | L714: 15 | M714: =K714*6+L714 -> 81 | O714: 15 | P714: 19 | Q714: =O714*6+P714 -> 109 | S714: BRUNSWICK
A715: PRAHRAN | C715: 0 | D715: 0 | E715: =C715*6+D715 -> 0 | G715: 1 | H715: 13 | I715: =G715*6+H715 -> 19 | K715: 3 | L715: 14 | M715: =K715*6+L715 -> 32 | O715: 5 | P715: 17 | Q715: =O715*6+P715 -> 47 | S715: GODDARD
A716: BEST PLAYERS
A717: BRUNSWICK | C717: DILLON | E717: WEIR | H717: LOVETT | K717: STANLEY | N717: POLLARD | Q717: R McMAHON
A718: PRAHRAN | C718: GAZE | E718: CLEAR | H718: ELLIOTT | K718: ROSS JONES | N718: O'BRYAN | Q718: HEALEY
A719: GOALKICKERS
A720: BRUNSWICK | C720: DILLON 5 | F720: HAYES 4 | I720: POLLARD 2 | L720: LOVETT 2 | N720: WEIR | P720: TAYLOR
A721: PRAHRAN | C721: CHINNOCK | F721: ELLIOTT | I721: D KINNABURGH | L721: MORROW | N721: RICKARDS
A723: ROUND 12 | E723: 7TH JULY | H723: WEATHER | K723: NORTH WEST WIND FINE GROUNDS HEAVY | S723: PLAYED AT
D724: 1ST QTR | H724: 2ND QTR | L724: 3RD QTR | P724: FINAL | S724: BOX HILL
A725: BOX HILL | C725: 3 | D725: 0 | E725: =C725*6+D725 -> 18 | G725: 5 | H725: 3 | I725: =G725*6+H725 -> 33 | K725: 6 | L725: 4 | M725: =K725*6+L725 -> 40 | O725: 8 | P725: 10 | Q725: =O725*6+P725 -> 58 | S725: UMPIRE | X725: LADDER | AB725: ROUND | AD725: 12
A726: WILLIAMSTOWN | C726: 1 | D726: 4 | E726: =C726*6+D726 -> 10 | G726: 2 | H726: 7 | I726: =G726*6+H726 -> 19 | K726: 5 | L726: 9 | M726: =K726*6+L726 -> 39 | O726: 5 | P726: 11 | Q726: =O726*6+P726 -> 41 | S726: IRVING
A727: BEST PLAYERS | W727: TEAM | X727: W | Y727: L | Z727: D | AA727: FOR | AB727: AGST | AC727: % | AD727: PTS
A728: BOX HILL | C728: LOVE | E728: DUNN | H728: AUSTEN | K728: HOUGHTON | N728: LANNING | Q728: BROWN
A729: WILLIAMSTOWN | C729: MARTIN | E729: LINTON | H729: GEAR | K729: JONES | N729: CALLAHAN | Q729: SIMS | W729: BOX HILL | X729: 11 | Y729: 1 | Z729: 0 | AA729: 874 | AB729: 586 | AC729: 149.14675767918089 | AD729: 44
A730: GOALKICKERS | W730: WILLIAMSTOWN | X730: 9 | Y730: 3 | Z730: 0 | AA730: 937 | AB730: 659 | AC730: 142.19 | AD730: 36
A731: BOX HILL | C731: BROWN 5 | F731: PLUNKETT 2 | I731: LE LIEVRE | W731: PORT MELBOURNE | X731: 9 | Y731: 3 | Z731: 0 | AA731: 1070 | AB731: 766 | AC731: 139.69 | AD731: 36
A732: WILLIAMSTOWN | C732: LINTON 4 | F732: SMITH | W732: BRUNSWICK | X732: 8 | Y732: 4 | Z732: 0 | AA732: 1027 | AB732: 778 | AC732: 132.00514138817482 | AD732: 32
A734: BRUNSWICK | C734: 3 | D734: 2 | E734: =C734*6+D734 -> 20 | G734: 6 | H734: 5 | I734: =G734*6+H734 -> 41 | K734: 8 | L734: 7 | M734: =K734*6+L734 -> 55 | O734: 11 | P734: 10 | Q734: =O734*6+P734 -> 76 | S734: COBURG | W734: PRESTON | X734: 8 | Y734: 4 | Z734: 0 | AA734: 889 | AB734: 768 | AC734: 115.75520833333333 | AD734: 32
A735: COBURG | C735: 1 | D735: 6 | E735: =C735*6+D735 -> 12 | G735: 3 | H735: 8 | I735: =G735*6+H735 -> 26 | K735: 6 | L735: 15 | M735: =K735*6+L735 -> 51 | O735: 8 | P735: 16 | Q735: =O735*6+P735 -> 64 | S735: ROACH | W735: MOORABBIN | X735: 7 | Y735: 5 | Z735: 0 | AA735: 870 | AB735: 752 | AC735: 115.69148936170212 | AD735: 28
A736: BEST PLAYERS | W736: SANDRINGHAM | X736: 6 | Y736: 6 | Z736: 0 | AA736: 844 | AB736: 786 | AC736: 107.3791348600509 | AD736: 24
A737: BRUNSWICK | C737: WEIR | E737: ROLFS | H737: EDWARDS | K737: HAYES | N737: McMAHON | Q737: PURVES | W737: COBURG | X737: 5 | Y737: 7 | Z737: 0 | AA737: 1025 | AB737: 907 | AC737: 113.00992282249173 | AD737: 20
A738: COBURG | C738: MILES | E738: RUTLEDGE | H738: B JONES | K738: WYMER | N738: McCOLL | Q738: HEWES | W738: CAMBERWELL | X738: 5 | Y738: 7 | Z738: 0 | AA738: 783 | AB738: 982 | AC738: 79.735234215885953 | AD738: 20
A739: GOALKICKERS | W739: OAKLEIGH | X739: 4 | Y739: 7 | Z739: 1 | AA739: 671 | AB739: 1013 | AC739: 66.238894373149066 | AD739: 18
A740: BRUNSWICK | C740: LOVETT 2 | F740: McFARLANE 2 | I740: WEIR 2 | K740: DILLON | M740: POLLARD | O740: NEILSON | Q740: TAYLOR | S740: HAYES | W740: BRIGHTON | X740: 4 | Y740: 8 | Z740: 0 | AA740: 774 | AB740: 1060 | AC740: 73.018867924528308 | AD740: 16
A741: COBURG | C741: HEWES 5 | F741: H WILKINSON | I741: PEARCE | K741: A JONES | W741: NORTHCOTE | X741: 3 | Y741: 9 | Z741: 0 | AA741: 618 | AB741: 750 | AC741: 82.4 | AD741: 12
W742: YARRAVILLE | X742: 3 | Y742: 9 | Z742: 0 | AA742: 691 | AB742: 957 | AC742: 72.204806687565309 | AD742: 12
A743: SANDRINGHAM | C743: 3 | D743: 2 | E743: =C743*6+D743 -> 20 | G743: 5 | H743: 5 | I743: =G743*6+H743 -> 35 | K743: 7 | L743: 5 | M743: =K743*6+L743 -> 47 | O743: 9 | P743: 5 | Q743: =O743*6+P743 -> 59 | S743: BEACH ROAD | W743: PRAHRAN | X743: 1 | Y743: 10 | Z743: 1 | AA743: 781 | AB743: 1090 | AC743: 71.651376146788991 | AD743: 6
A744: MOORABBIN | C744: 3 | D744: 4 | E744: =C744*6+D744 -> 22 | G744: 4 | H744: 4 | I744: =G744*6+H744 -> 28 | K744: 4 | L744: 8 | M744: =K744*6+L744 -> 32 | O744: 6 | P744: 8 | Q744: =O744*6+P744 -> 44 | S744: ROWE
A745: BEST PLAYERS
A746: SANDRINGHAM | C746: FLETCHER | F746: CONNINGSBY | I746: VANCE | L746: I JONES | O746: K EVANS | R746: CROUCH
A747: MOORABBIN | C747: GILDER | F747: McGAW | I747: BOYD | L747: PECK | O747: MORONEY | R747: CLOVER
A748: GOALKICKERS
A749: SANDRINGHAM | C749: R HARPER 3 | F749: VANCE 2 | I749: QUINN | K749: BOLAND | M749: K EVANS | O749: DAVIDSON
A750: MOORABBIN | C750: McGAW 2 | F750: MORONEY 2 | I750: SCHOFIELD | L750: CLOVER
A752: PRESTON | C752: 0 | D752: 2 | E752: =C752*6+D752 -> 2 | G752: 6 | H752: 9 | I752: =G752*6+H752 -> 45 | K752: 7 | L752: 10 | M752: =K752*6+L752 -> 52 | O752: 8 | P752: 12 | Q752: =O752*6+P752 -> 60 | S752: OAKLEIGH
A753: OAKLEIGH | C753: 2 | D753: 1 | E753: =C753*6+D753 -> 13 | G753: 2 | H753: 1 | I753: =G753*6+H753 -> 13 | K753: 6 | L753: 4 | M753: =K753*6+L753 -> 40 | O753: 8 | P753: 5 | Q753: =O753*6+P753 -> 53 | S753: ALLEN
A754: BEST PLAYERS
A755: PRESTON | C755: CROCKER | F755: BRADFORD | I755: McLACHLAN | L755: ROSE | N755: HOWARD | Q755: L SWEET
A756: OAKLEIGH | C756: COLLINS | F756: BACKMAN | I756: NICHOLSON | L756: SCULLIN | N756: I'ANSON | Q756: BOURKE
A757: GOALKICKERS
A758: PRESTON | C758: BRADFORD 3 | F758: FOLEY 2 | I758: COOPER | K758: F CHARD | M758: CONSTABLE
A759: OAKLEIGH | C759: COUGHLAN 2 | F759: NEWPORT | I759: BOURKE | K759: LEHNE | M759: RILEY | O759: CAMM | Q759: BACKMAN
A761: NORTHCOTE | C761: 5 | D761: 5 | E761: =C761*6+D761 -> 35 | G761: 5 | H761: 7 | I761: =G761*6+H761 -> 37 | K761: 8 | L761: 10 | M761: =K761*6+L761 -> 58 | O761: 9 | P761: 12 | Q761: =O761*6+P761 -> 66 | S761: NORTHCOTE
A762: BRIGHTON | C762: 0 | D762: 0 | E762: =C762*6+D762 -> 0 | G762: 2 | H762: 5 | I762: =G762*6+H762 -> 17 | K762: 3 | L762: 5 | M762: =K762*6+L762 -> 23 | O762: 5 | P762: 9 | Q762: =O762*6+P762 -> 39 | S762: BARNETT
A763: BEST PLAYERS
A764: NORTHCOTE | C764: GOUGH | F764: POWELL | I764: WOOLNOUGH | L764: L WALKER | N764: OLNEY | Q764: G WALKER
A765: BRIGHTON | C765: I McCANN | F765: DALEY | I765: PRETTY | L765: WILLIAMS | N765: FREEMAN | Q765: WOOLSTENCROFT
A766: GOALKICKERS
A767: NORTHCOTE | C767: COLLINS 2 | F767: HUSSEY 2 | I767: DEVINE | K767: OLIVER | M767: G WALKER | P767: OLNEY | R767: WOOLNOUGH
A768: BRIGHTON | C768: WEST 2 | F768: HART 2 | I768: BROWNING
A770: CAMBERWELL | C770: 1 | D770: 2 | E770: =C770*6+D770 -> 8 | G770: 5 | H770: 5 | I770: =G770*6+H770 -> 35 | K770: 5 | L770: 8 | M770: =K770*6+L770 -> 38 | O770: 9 | P770: 9 | Q770: =O770*6+P770 -> 63 | S770: TOORAK PARK
A771: PRAHRAN | C771: 1 | D771: 2 | E771: =C771*6+D771 -> 8 | G771: 3 | H771: 3 | I771: =G771*6+H771 -> 21 | K771: 6 | L771: 6 | M771: =K771*6+L771 -> 42 | O771: 8 | P771: 11 | Q771: =O771*6+P771 -> 59 | S771: CARDWELL
A772: BEST PLAYERS
A773: CAMBERWELL | C773: K CLARKE | F773: HOLYOAK | I773: McGUINNESS | L773: BELL | O773: NELSON | R773: ROSS
A774: PRAHRAN | C774: O'BRYAN | F774: SHILLABEER | I774: MORROW | L774: ROSS JONES | O774: HARVEY | R774: HORSFIELD
A775: GOALKICKERS
A776: CAMBERWELL | C776: McGUINNESS 4 | F776: TEMPANY 3 | I776: COLEMAN | L776: DUGDALE
A777: PRAHRAN | C777: WILSON 2 | F777: O'BRYAN 2 | I777: HARVEY | K777: P KINNABURGH | N777: D KINNABURGH | Q777: CHINNOCK
A779: PORT MELBOURNE | C779: 5 | D779: 8 | E779: =C779*6+D779 -> 38 | G779: 10 | H779: 8 | I779: =G779*6+H779 -> 68 | K779: 14 | L779: 11 | M779: =K779*6+L779 -> 95 | O779: 16 | P779: 12 | Q779: =O779*6+P779 -> 108 | S779: YARRAVILLE
A780: YARRAVILLE | C780: 0 | D780: 1 | E780: =C780*6+D780 -> 1 | G780: 4 | H780: 6 | I780: =G780*6+H780 -> 30 | K780: 7 | L780: 7 | M780: =K780*6+L780 -> 49 | O780: 9 | P780: 13 | Q780: =O780*6+P780 -> 67 | S780: BREWER
A781: BEST PLAYERS
A782: PORT MELBOURNE | C782: BONNETT | F782: MILLER | I782: WITHERS | L782: JOHNSON | O782: ALLEN | Q782: METHERALL
A783: YARRAVILLE | C783: ROHLEDER | F783: CUFFE | I783: HEMPEL | L783: FRASER | O783: CAREY | Q783: BOURKE
A784: GOALKICKERS
A785: PORT MELBOURNE | C785: BONNETT 9 | F785: ALLEN 3 | I785: MILLER | K785: McDONALD | N785: STREADER | Q785: R ATKINSON
A786: YARRAVILLE | C786: HEMPEL 3 | F786: McPHEE 2 | I786: GARLICK | K786: BOURKE | M786: SCHUMAN | P786: DE JONG
A788: ROUND 13 | E788: 14TH JULY | J788: WEATHER | M788: SOUTH WEST BREEZE FINE | S788: PLAYED AT
D789: 1ST QTR | H789: 2ND QTR | L789: 3RD QTR | P789: FINAL | S789: BRUNSWICK
A790: BRUNSWICK | C790: 3 | D790: 2 | E790: =C790*6+D790 -> 20 | G790: 6 | H790: 3 | I790: =G790*6+H790 -> 39 | K790: 8 | L790: 5 | M790: =K790*6+L790 -> 53 | O790: 10 | P790: 11 | Q790: =O790*6+P790 -> 71 | S790: UMPIRE | X790: LADDER | AB790: ROUND | AD790: 13
A791: BOX HILL | C791: 3 | D791: 2 | E791: =C791*6+D791 -> 20 | G791: 3 | H791: 4 | I791: =G791*6+H791 -> 22 | K791: 3 | L791: 10 | M791: =K791*6+L791 -> 28 | O791: 4 | P791: 12 | Q791: =O791*6+P791 -> 36 | S791: ALLEN
A792: BEST PLAYERS | W792: TEAM | X792: W | Y792: L | Z792: D | AA792: FOR | AB792: AGST | AC792: % | AD792: PTS
A793: BRUNSWICK | C793: ROLFS | F793: DILLON | I793: PURVES | L793: TAYLOR | N793: BUCHANAN | Q793: EDWARDS
A794: BOX HILL | C794: HOUGHTON | F794: GREEN | I794: WRIGHT | L794: BENNETT | N794: LANNING | Q794: IRVINE | W794: BOX HILL | X794: 11 | Y794: 2 | Z794: 0 | AA794: 910 | AB794: 657 | AC794: 138.50837138508371 | AD794: 44
A795: GOALKICKERS | W795: WILLIAMSTOWN | X795: 10 | Y795: 3 | Z795: 0 | AA795: 1069 | AB795: 710 | AC795: 150.56 | AD795: 40
A796: BRUNSWICK | C796: DILLON 4 | F796: STANLEY 2 | I796: CULLY | K796: CLUES | M796: LOVETT | O796: WEIR | W796: PORT MELBOURNE | X796: 10 | Y796: 3 | Z796: 0 | AA796: 1194 | AB796: 839 | AC796: 142.31 | AD796: 40
A797: BOX HILL | C797: BROWN 2 | F797: DUNN | I797: NODEN | W797: BRUNSWICK | X797: 9 | Y797: 4 | Z797: 0 | AA797: 1098 | AB797: 814 | AC797: 134.88943488943488 | AD797: 36
A799: WILLIAMSTOWN | C799: 4 | D799: 2 | E799: =C799*6+D799 -> 26 | G799: 9 | H799: 9 | I799: =G799*6+H799 -> 63 | K799: 13 | L799: 14 | M799: =K799*6+L799 -> 92 | O799: 19 | P799: 18 | Q799: =O799*6+P799 -> 132 | S799: WILLIAMSTOWN | W799: PRESTON | X799: 9 | Y799: 4 | Z799: 0 | AA799: 965 | AB799: 808 | AC799: 119.43069306930693 | AD799: 36
A800: SANDRINGHAM | C800: 3 | D800: 3 | E800: =C800*6+D800 -> 21 | G800: 4 | H800: 3 | I800: =G800*6+H800 -> 27 | K800: 7 | L800: 6 | M800: =K800*6+L800 -> 48 | O800: 7 | P800: 9 | Q800: =O800*6+P800 -> 51 | S800: E BREWER | W800: MOORABBIN | X800: 8 | Y800: 5 | Z800: 0 | AA800: 967 | AB800: 823 | AC800: 117.49696233292831 | AD800: 32
A801: BEST PLAYERS | W801: COBURG | X801: 6 | Y801: 7 | Z801: 0 | AA801: 1112 | AB801: 960 | AC801: 115.83333333333333 | AD801: 24
A802: WILLIAMSTOWN | C802: SMITH | F802: MARTIN | I802: LINTON | L802: WOOKEY | O802: GEAR | Q802: CALLAHAN | W802: SANDRINGHAM | X802: 6 | Y802: 7 | Z802: 0 | AA802: 895 | AB802: 918 | AC802: 97.494553376906325 | AD802: 24
A803: SANDRINGHAM | C803: JOHNSTON | F803: FLETCHER | I803: QUINN | L803: RANSOM | O803: K EVANS | Q803: BOLAND | W803: OAKLEIGH | X803: 5 | Y803: 7 | Z803: 1 | AA803: 741 | AB803: 1068 | AC803: 69.382022471910119 | AD803: 22
A804: GOALKICKERS | W804: CAMBERWELL | X804: 5 | Y804: 8 | Z804: 0 | AA804: 836 | AB804: 1069 | AC804: 78.203928905519177 | AD804: 20
A805: WILLIAMSTOWN | C805: LINTON 8 | F805: CALLAHAN 4 | I805: SMITH 3 | K805: GEAR 3 | M805: REED | W805: BRIGHTON | X805: 4 | Y805: 9 | Z805: 0 | AA805: 829 | AB805: 1130 | AC805: 73.362831858407077 | AD805: 16
A806: SANDRINGHAM | C806: JOHNSTON 5 | F806: RANSOM | I806: WEBSTER | W806: NORTHCOTE | X806: 3 | Y806: 10 | Z806: 0 | AA806: 691 | AB806: 874 | AC806: 79.061784897025177 | AD806: 12
W807: YARRAVILLE | X807: 3 | Y807: 10 | Z807: 0 | AA807: 762 | AB807: 1054 | AC807: 72.296015180265655 | AD807: 12
A808: COBURG | C808: 5 | D808: 2 | E808: =C808*6+D808 -> 32 | G808: 7 | H808: 3 | I808: =G808*6+H808 -> 45 | K808: 9 | L808: 4 | M808: =K808*6+L808 -> 58 | O808: 13 | P808: 9 | Q808: =O808*6+P808 -> 87 | S808: CAMBERWELL | W808: PRAHRAN | X808: 1 | Y808: 11 | Z808: 1 | AA808: 821 | AB808: 1166 | AC808: 70.411663807890221 | AD808: 6
A809: CAMBERWELL | C809: 5 | D809: 1 | E809: =C809*6+D809 -> 31 | G809: 7 | H809: 1 | I809: =G809*6+H809 -> 43 | K809: 7 | L809: 2 | M809: =K809*6+L809 -> 44 | O809: 8 | P809: 5 | Q809: =O809*6+P809 -> 53 | S809: ROWE
A810: BEST PLAYERS
A811: COBURG | C811: WILKINSON | F811: MAHONEY | I811: STARBUCK | L811: HUNTINGTON | O811: BOOTH | Q811: McCOLL
A812: CAMBERWELL | C812: MASON | F812: HOLYOAK | I812: NELSON | L812: K CLARKE | O812: SMITH | Q812: SKALBERG
A813: GOALKICKERS
A814: COBURG | C814: HEWES 4 | F814: HUNTINGTON 3 | J814: WILKINSON 3 | M814: B JONES | O814: MAHONEY | R814: MILES
A815: CAMBERWELL | C815: McGUINNESS 2 | F815: TEMPANY 2 | I815: COLEMAN | K815: HEINRICH | M815: SABBATUCCI | P815: WALKER
A817: OAKLEIGH | C817: 1 | D817: 3 | E817: =C817*6+D817 -> 9 | G817: 7 | H817: 7 | I817: =G817*6+H817 -> 49 | K817: 9 | L817: 8 | M817: =K817*6+L817 -> 62 | O817: 10 | P817: 10 | Q817: =O817*6+P817 -> 70 | S817: ELSTERNWICK PARK
A818: BRIGHTON | C818: 0 | D818: 4 | E818: =C818*6+D818 -> 4 | G818: 1 | H818: 6 | I818: =G818*6+H818 -> 12 | K818: 2 | L818: 16 | M818: =K818*6+L818 -> 28 | O818: 6 | P818: 19 | Q818: =O818*6+P818 -> 55 | S818: ROBINSON
A819: BEST PLAYERS
A820: OAKLEIGH | C820: GUY | E820: COLLINS | H820: CAMM | J820: NEWPORT | M820: NICHOLSON | Q820: BAPTIST
A821: BRIGHTON | C821: MILLS | E821: BROWNING | H821: PRETTY | J821: COURTNEY | M821: WOOLSTENCROFT | Q821: POUND
A822: GOALKICKERS
A823: OAKLEIGH | C823: NEWPORT 4 | F823: NICHOLSON 3 | I823: B WILLIAMS 2 | L823: MELVILLE
A824: BRIGHTON | C824: JEWELL 3 | F824: HART 2 | I824: FREEMAN
A826: MOORABBIN | C826: 5 | D826: 0 | E826: =C826*6+D826 -> 30 | G826: 8 | H826: 2 | I826: =G826*6+H826 -> 50 | K826: 12 | L826: 2 | M826: =K826*6+L826 -> 74 | O826: 15 | P826: 7 | Q826: =O826*6+P826 -> 97 | S826: MOORABBIN
A827: YARRAVILLE | C827: 2 | D827: 1 | E827: =C827*6+D827 -> 13 | G827: 3 | H827: 3 | I827: =G827*6+H827 -> 21 | K827: 8 | L827: 8 | M827: =K827*6+L827 -> 56 | O827: 10 | P827: 11 | Q827: =O827*6+P827 -> 71 | S827: BARNETT
A828: BEST PLAYERS
A829: MOORABBIN | C829: DYNON | F829: McGAW | I829: RENWICK | L829: GILDER | O829: MANIE | R829: BULMER
A830: YARRAVILLE | C830: DE JONG | F830: JONES | I830: ROHLEDER | L830: N GARLICK | O830: HARGREAVES | R830: HUGHES
A831: GOALKICKERS
A832: MOORABBIN | C832: RENWICK 4 | F832: DYNON 4 | I832: MORONEY 3 | L832: McGAW 3 | O832: BULMER
A833: YARRAVILLE | C833: DE JONG 2 | F833: HUGHES 2 | I833: SCHUMAN 2 | L833: B WILLIAMS | O833: ROHLEDER | Q833: J GARLICK | T833: HARGREAVES
A835: PORT MELBOURNE | C835: 5 | D835: 2 | E835: =C835*6+D835 -> 32 | G835: 10 | H835: 8 | I835: =G835*6+H835 -> 68 | K835: 14 | L835: 10 | M835: =K835*6+L835 -> 94 | O835: 18 | P835: 16 | Q835: =O835*6+P835 -> 124 | S835: PORT MELBOURNE
A836: NORTHCOTE | C836: 4 | D836: 2 | E836: =C836*6+D836 -> 26 | G836: 5 | H836: 8 | I836: =G836*6+H836 -> 38 | K836: 8 | L836: 10 | M836: =K836*6+L836 -> 58 | O836: 10 | P836: 13 | Q836: =O836*6+P836 -> 73 | S836: ROACH
A837: BEST PLAYERS
A838: PORT MELBOURNE | C838: JOHNSON | F838: WITHERS | I838: LOCKHART | L838: STREADER | O838: McDONALD | R838: BONNETT
A839: NORTHCOTE | C839: FRANCIS | F839: L WALKER | I839: A JOHNSON | L839: DEVINE | O839: WOOLNOUGH | R839: COLLINS
A840: GOALKICKERS
A841: PORT MELBOURNE | C841: BONNETT 6 | F841: McDONALD 4 | I841: MILLER 2 | K841: WITHERS 2 | N841: R ATKINSON | Q841: ALLEN | S841: HARVEY | U841: JOHNSON
A842: NORTHCOTE | C842: FRANCIS 3 | F842: HUSSEY 3 | I842: COLLINS 2 | L842: TULL | N842: WOOLNOUGH
A844: PRESTON | C844: 2 | D844: 3 | E844: =C844*6+D844 -> 15 | G844: 4 | H844: 4 | I844: =G844*6+H844 -> 28 | K844: 6 | L844: 5 | M844: =K844*6+L844 -> 41 | O844: 11 | P844: 10 | Q844: =O844*6+P844 -> 76 | S844: COBURG
A845: PRAHRAN | C845: 0 | D845: 3 | E845: =C845*6+D845 -> 3 | G845: 1 | H845: 7 | I845: =G845*6+H845 -> 13 | K845: 5 | L845: 10 | M845: =K845*6+L845 -> 40 | O845: 5 | P845: 10 | Q845: =O845*6+P845 -> 40 | S845: IRVING
A846: BEST PLAYERS
A847: PRESTON | C847: CUSACK | E847: McBEAN | H847: BRADFORD | K847: L SWEET | N847: CROCKER | Q847: LITTLE
A848: PRAHRAN | C848: SHARP | E848: SHILLABEER | H848: HARVEY | K848: HEALEY | N848: MORROW | Q848: PLAIN
A849: GOALKICKERS
A850: PRESTON | C850: F CHARD 4 | F850: McBEAN 3 | I850: BRADFORD 2 | L850: COOPER 2
A851: PRAHRAN | C851: HARLEY | E851: PLAIN | G851: CHINNOCK | J851: WILSON | M851: D KINNABURGH
A853: ROUND 14 | E853: 21ST JULY | J853: WEATHER | O853: WEST BREEZE FINE | S853: PLAYED AT
D854: 1ST QTR | H854: 2ND QTR | L854: 3RD QTR | P854: FINAL | S854: MOORABBIN
A855: WILLIAMSTOWN | C855: 3 | D855: 1 | E855: =C855*6+D855 -> 19 | G855: 9 | H855: 5 | I855: =G855*6+H855 -> 59 | K855: 9 | L855: 5 | M855: =K855*6+L855 -> 59 | O855: 9 | P855: 10 | Q855: =O855*6+P855 -> 64 | S855: UMPIRE | X855: LADDER | AB855: ROUND | AD855: 14
A856: MOORABBIN | C856: 0 | D856: 7 | E856: =C856*6+D856 -> 7 | G856: 0 | H856: 8 | I856: =G856*6+H856 -> 8 | K856: 2 | L856: 13 | M856: =K856*6+L856 -> 25 | O856: 3 | P856: 15 | Q856: =O856*6+P856 -> 33 | S856: ROBINSON
A857: BEST PLAYERS | W857: TEAM | X857: W | Y857: L | Z857: D | AA857: FOR | AB857: AGST | AC857: % | AD857: PTS
A858: WILLIAMSTOWN | C858: MARTIN | E858: LINTON | H858: KENT | K858: CURRAN | N858: MUNDAY | Q858: LAURIE
A859: MOORABBIN | C859: GILDER | E859: HOUSTON | H859: A JONES | K859: McGAW | N859: BULMER | Q859: EDWARDS | W859: BOX HILL | X859: 12 | Y859: 2 | Z859: 0 | AA859: 988 | AB859: 703 | AC859: 140.54054054054055 | AD859: 48
A860: GOALKICKERS | W860: WILLIAMSTOWN | X860: 11 | Y860: 3 | Z860: 0 | AA860: 1133 | AB860: 743 | AC860: 152.49 | AD860: 44
A861: WILLIAMSTOWN | C861: LINTON 5 | F861: CALLAHAN | I861: MARTIN | K861: REED | M861: A SMITH | W861: PORT MELBOURNE | X861: 11 | Y861: 3 | Z861: 0 | AA861: 1253 | AB861: 878 | AC861: 142.71 | AD861: 44
A862: MOORABBIN | C862: MURPHY | F862: HOUSTON | I862: A JONES | W862: BRUNSWICK | X862: 10 | Y862: 4 | Z862: 0 | AA862: 1168 | AB862: 855 | AC862: 136.60818713450291 | AD862: 40
A864: BRUNSWICK | C864: 2 | D864: 1 | E864: =C864*6+D864 -> 13 | G864: 5 | H864: 6 | I864: =G864*6+H864 -> 36 | K864: 7 | L864: 7 | M864: =K864*6+L864 -> 49 | O864: 10 | P864: 10 | Q864: =O864*6+P864 -> 70 | S864: BRUNSWICK | W864: PRESTON | X864: 10 | Y864: 4 | Z864: 0 | AA864: 1068 | AB864: 864 | AC864: 123.61111111111111 | AD864: 40
A865: SANDRINGHAM | C865: 1 | D865: 3 | E865: =C865*6+D865 -> 9 | G865: 3 | H865: 7 | I865: =G865*6+H865 -> 25 | K865: 5 | L865: 10 | M865: =K865*6+L865 -> 40 | O865: 5 | P865: 11 | Q865: =O865*6+P865 -> 41 | S865: IRVING | W865: MOORABBIN | X865: 8 | Y865: 6 | Z865: 0 | AA865: 1000 | AB865: 887 | AC865: 112.73957158962796 | AD865: 32
A866: BEST PLAYERS | W866: COBURG | X866: 6 | Y866: 8 | Z866: 0 | AA866: 1168 | AB866: 1063 | AC866: 109.87770460959548 | AD866: 24
A867: BRUNSWICK | C867: PURVES | F867: POLLARD | I867: EDWARDS | L867: WEIR | N867: MASON | Q867: CORNES | W867: SANDRINGHAM | X867: 6 | Y867: 8 | Z867: 0 | AA867: 936 | AB867: 988 | AC867: 94.736842105263165 | AD867: 24
A868: SANDRINGHAM | C868: K EVANS | F868: QUINN | I868: M DAVIDSON | L868: WEBSTER | N868: BOLAND | Q868: FLETCHER | W868: OAKLEIGH | X868: 5 | Y868: 8 | Z868: 1 | AA868: 780 | AB868: 1127 | AC868: 69.210292812777283 | AD868: 22
A869: GOALKICKERS | W869: CAMBERWELL | X869: 5 | Y869: 9 | Z869: 0 | AA869: 882 | AB869: 1147 | AC869: 76.896251089799478 | AD869: 20
A870: BRUNSWICK | C870: TAYLOR 3 | F870: DILLON 2 | I870: McFARLANE 2 | L870: MULLENGER | O870: CLUES | Q870: WEIR | W870: YARRAVILLE | X870: 4 | Y870: 10 | Z870: 0 | AA870: 859 | AB870: 1108 | AC870: 77.527075812274362 | AD870: 16
A871: SANDRINGHAM | C871: R HARPER 3 | F871: QUINN | I871: M DAVIDSON | W871: BRIGHTON | X871: 4 | Y871: 10 | Z871: 0 | AA871: 898 | AB871: 1206 | AC871: 74.461028192371472 | AD871: 16
W872: NORTHCOTE | X872: 3 | Y872: 11 | Z872: 0 | AA872: 745 | AB872: 971 | AC872: 76.725025746652932 | AD872: 12
A873: PORT MELBOURNE | C873: 2 | D873: 3 | E873: =C873*6+D873 -> 15 | G873: 3 | H873: 9 | I873: =G873*6+H873 -> 27 | K873: 5 | L873: 12 | M873: =K873*6+L873 -> 42 | O873: 7 | P873: 17 | Q873: =O873*6+P873 -> 59 | S873: PORT MELBOURNE | W873: PRAHRAN | X873: 2 | Y873: 11 | Z873: 1 | AA873: 897 | AB873: 1235 | AC873: 72.631578947368425 | AD873: 10
A874: OAKLEIGH | C874: 3 | D874: 4 | E874: =C874*6+D874 -> 22 | G874: 4 | H874: 4 | I874: =G874*6+H874 -> 28 | K874: 5 | L874: 8 | M874: =K874*6+L874 -> 38 | O874: 5 | P874: 9 | Q874: =O874*6+P874 -> 39 | S874: BARNETT
A875: BEST PLAYERS
A876: PORT MELBOURNE | C876: JOHNSON | F876: WITHERS | I876: LEWIS | L876: SYKES | N876: METHERALL | Q876: E ATKINSON
A877: OAKLEIGH | C877: GUY | F877: LEHNE | I877: BOURKE | L877: BAPTIST | N877: GRANT | Q877: NICHOLSON
A878: GOALKICKERS
A879: PORT MELBOURNE | C879: STREADER 2 | F879: JOHNSON | I879: BONNETT | K879: LEWIS | M879: SYKES | O879: R ATKINSON
A880: OAKLEIGH | C880: BOURKE 2 | F880: CAMM | I880: GRANT | K880: GUY
A882: PRESTON | C882: 5 | D882: 4 | E882: =C882*6+D882 -> 34 | G882: 6 | H882: 6 | I882: =G882*6+H882 -> 42 | K882: 11 | L882: 10 | M882: =K882*6+L882 -> 76 | O882: 15 | P882: 13 | Q882: =O882*6+P882 -> 103 | S882: COBURG | U882: PRESTON
A883: COBURG | C883: 0 | D883: 1 | E883: =C883*6+D883 -> 1 | G883: 3 | H883: 7 | I883: =G883*6+H883 -> 25 | K883: 5 | L883: 7 | M883: =K883*6+L883 -> 37 | O883: 8 | P883: 8 | Q883: =O883*6+P883 -> 56 | S883: BREWER | U883: HOME
A884: BEST PLAYERS | U884: GAME
A885: PRESTON | C885: LITTLE | F885: L SWEET | I885: CUSACK | L885: McLACHLAN | O885: FOLEY | Q885: BRADFORD
A886: COBURG | C886: MAHONEY | F886: WILKINSON | I886: GOULLET | L886: SHORT | O886: B JONES | Q886: FEWKES
A887: GOALKICKERS
A888: PRESTON | C888: F CHARD 5 | F888: BRADFORD 3 | I888: McBEAN 2 | L888: ROSE | N888: COOPER | P888: GUNN | R888: CONSTABLE | V888: FOLEY
A889: COBURG | C889: HEWES 3 | F889: GOULLET 2 | I889: B JONES | L889: MILES | N889: BRENNAN
A891: YARRAVILLE | C891: 4 | D891: 2 | E891: =C891*6+D891 -> 26 | G891: 7 | H891: 4 | I891: =G891*6+H891 -> 46 | K891: 14 | L891: 11 | M891: =K891*6+L891 -> 95 | O891: 14 | P891: 13 | Q891: =O891*6+P891 -> 97 | S891: YARRAVILLE
A892: NORTHCOTE | C892: 2 | D892: 2 | E892: =C892*6+D892 -> 14 | G892: 3 | H892: 8 | I892: =G892*6+H892 -> 26 | K892: 4 | L892: 8 | M892: =K892*6+L892 -> 32 | O892: 6 | P892: 18 | Q892: =O892*6+P892 -> 54 | S892: CARDWELL
A893: BEST PLAYERS
A894: YARRAVILLE | C894: ROHLEDER | F894: BOURKE | I894: FRASER | L894: DE JONG | O894: MASON | Q894: CUFFE
A895: NORTHCOTE | C895: CRADDOCK | F895: DEVINE | I895: ALDRIDGE | L895: FRANCIS | O895: J VAINS | Q895: WOOLNOUGH
A896: GOALKICKERS
A897: YARRAVILLE | C897: CAREY 4 | E897: HUGHES 3 | H897: WILLIAMS 2 | K897: WILD | M897: ROHLEDER | O897: GARLICK | Q897: HARGREAVES | T897: CHARLES
A898: NORTHCOTE | C898: DEVINE 2 | F898: G WALKER | I898: WOOLNOUGH | L898: J COLLINS | O898: PETERS
A900: PRAHRAN | C900: 2 | D900: 2 | E900: =C900*6+D900 -> 14 | G900: 4 | H900: 5 | I900: =G900*6+H900 -> 29 | K900: 9 | L900: 7 | M900: =K900*6+L900 -> 61 | O900: 11 | P900: 10 | Q900: =O900*6+P900 -> 76 | S900: ELSTERNWICK PARK
A901: BRIGHTON | C901: 3 | D901: 4 | E901: =C901*6+D901 -> 22 | G901: 7 | H901: 3 | I901: =G901*6+H901 -> 45 | K901: 9 | L901: 4 | M901: =K901*6+L901 -> 58 | O901: 10 | P901: 9 | Q901: =O901*6+P901 -> 69 | S901: ALLEN
A902: BEST PLAYERS
A903: PRAHRAN | C903: HARVEY | E903: PLAIN | H903: SHARP | K903: WILSON | N903: SHILLABEER | Q903: D KINNABURGH
A904: BRIGHTON | C904: HART | E904: POUND | H904: WILLIAMS | K904: MILLS | N904: PRETTY | Q904: COURTNEY
A905: GOALKICKERS
A906: PRAHRAN | C906: WILSON 3 | F906: D KINNABURGH 2 | J906: MORROW 2 | M906: SHILLABEER | P906: SHARP | R906: HARVEY | U906: ELLIOTT
A907: BRIGHTON | C907: HART 6 | F907: DAVIS 2 | I907: FREEMAN | K907: PEARSON
A909: BOX HILL | C909: 4 | D909: 5 | E909: =C909*6+D909 -> 29 | G909: 4 | H909: 6 | I909: =G909*6+H909 -> 30 | K909: 10 | L909: 11 | M909: =K909*6+L909 -> 71 | O909: 11 | P909: 12 | Q909: =O909*6+P909 -> 78 | S909: CAMBERWELL
A910: CAMBERWELL | C910: 0 | D910: 1 | E910: =C910*6+D910 -> 1 | G910: 2 | H910: 2 | I910: =G910*6+H910 -> 14 | K910: 2 | L910: 2 | M910: =K910*6+L910 -> 14 | O910: 7 | P910: 4 | Q910: =O910*6+P910 -> 46 | S910: ROACH
A911: BEST PLAYERS
A912: BOX HILL | C912: LOVE | E912: WRIGHT | H912: LANNING | K912: AUSTEN | N912: HOUGHTON | Q912: SAWATSKY
A913: CAMBERWELL | C913: ROSS | E913: HOLYOAK | H913: NELSON | K913: McGUINNES | N913: MASON | Q913: COLEMAN
A914: GOALKICKERS
A915: BOX HILL | C915: HOUGHTON 3 | F915: DUNN 2 | H915: WHITE 2 | J915: PLUNKETT 2 | M915: MADDEN | O915: GREEN
A916: CAMBERWELL | C916: TEMPANY 3 | F916: FLINTON | H916: SKALBERG | J916: COLEMAN | M916: WATTS
A918: ROUND 15 | E918: 28TH JULY | J918: WEATHER | M918: NORTH WEST BREEZE FINE | S918: PLAYED AT
D919: 1ST QTR | H919: 2ND QTR | L919: 3RD QTR | P919: FINAL | S919: WILLIAMSTOWN
A920: WILLIAMSTOWN | C920: 4 | D920: 4 | E920: =C920*6+D920 -> 28 | G920: 6 | H920: 9 | I920: =G920*6+H920 -> 45 | K920: 10 | L920: 12 | M920: =K920*6+L920 -> 72 | O920: 15 | P920: 17 | Q920: =O920*6+P920 -> 107 | S920: UMPIRE | X920: LADDER | AB920: ROUND | AD920: 15
A921: BRUNSWICK | C921: 3 | D921: 4 | E921: =C921*6+D921 -> 22 | G921: 4 | H921: 4 | I921: =G921*6+H921 -> 28 | K921: 6 | L921: 6 | M921: =K921*6+L921 -> 42 | O921: 9 | P921: 9 | Q921: =O921*6+P921 -> 63 | S921: ROACH
A922: BEST PLAYERS | W922: TEAM | X922: W | Y922: L | Z922: D | AA922: FOR | AB922: AGST | AC922: % | AD922: PTS
A923: WILLIAMSTOWN | C923: CURRAN | E923: MARTIN | H923: SIMS | K923: KENT | N923: R JONES | Q923: LINTON
A924: BRUNSWICK | C924: WEIR | E924: EDWARDS | H924: DEAS | K924: HAYES | N924: STANLEY | Q924: CLUES | W924: WILLIAMSTOWN | X924: 12 | Y924: 3 | Z924: 0 | AA924: 1240 | AB924: 806 | AC924: 153.85 | AD924: 48
A925: GOALKICKERS | W925: PORT MELBOURNE | X925: 12 | Y925: 3 | Z925: 0 | AA925: 1376 | AB925: 940 | AC925: 146.38 | AD925: 48
A926: WILLIAMSTOWN | C926: McPHERSON 7 | F926: LINTON 3 | I926: FISHER 2 | K926: REED 2 | M926: SMITH | W926: BOX HILL | X926: 12 | Y926: 3 | Z926: 0 | AA926: 1023 | AB926: 769 | AC926: 133.0299089726918 | AD926: 48
A927: BRUNSWICK | C927: HAYES 3 | F927: LOVETT 2 | I927: CLUES | K927: STANLEY | M927: DILLON | O927: WEIR | W927: PRESTON | X927: 11 | Y927: 4 | Z927: 0 | AA927: 1134 | AB927: 899 | AC927: 126.14015572858732 | AD927: 44
A929: PRESTON | C929: 0 | D929: 1 | E929: =C929*6+D929 -> 1 | G929: 6 | H929: 2 | I929: =G929*6+H929 -> 38 | K929: 8 | L929: 4 | M929: =K929*6+L929 -> 52 | O929: 10 | P929: 6 | Q929: =O929*6+P929 -> 66 | S929: BOX HILL | W929: BRUNSWICK | X929: 10 | Y929: 5 | Z929: 0 | AA929: 1231 | AB929: 962 | AC929: 127.96257796257797 | AD929: 40
A930: BOX HILL | C930: 1 | D930: 3 | E930: =C930*6+D930 -> 9 | G930: 1 | H930: 4 | I930: =G930*6+H930 -> 10 | K930: 2 | L930: 8 | M930: =K930*6+L930 -> 20 | O930: 4 | P930: 11 | Q930: =O930*6+P930 -> 35 | S930: ROBINSON | W930: MOORABBIN | X930: 9 | Y930: 6 | Z930: 0 | AA930: 1074 | AB930: 927 | AC930: 115.85760517799353 | AD930: 36
A931: BEST PLAYERS | W931: SANDRINGHAM | X931: 7 | Y931: 8 | Z931: 0 | AA931: 1020 | AB931: 1047 | AC931: 97.421203438395409 | AD931: 28
A932: PRESTON | C932: L SWEET | F932: FOLEY | I932: SUPPLITT | L932: F CHARD | N932: BRADFORD | Q932: McBEAN | W932: COBURG | X932: 6 | Y932: 8 | Z932: 1 | AA932: 1267 | AB932: 1162 | AC932: 109.03614457831326 | AD932: 26
A933: BOX HILL | C933: HOUGHTON | F933: SAWATSKY | I933: WRIGHT | L933: LANNING | N933: CRAIG | Q933: DUNN | W933: OAKLEIGH | X933: 5 | Y933: 9 | Z933: 1 | AA933: 838 | AB933: 1187 | AC933: 70.598146588037068 | AD933: 22
A934: GOALKICKERS | W934: YARRAVILLE | X934: 5 | Y934: 10 | Z934: 0 | AA934: 919 | AB934: 1166 | AC934: 78.816466552315603 | AD934: 20
A935: PRESTON | C935: F CHARD 3 | F935: FOLEY 3 | I935: McBEAN 2 | L935: CONSTABLE | O935: McLACHLAN | W935: CAMBERWELL | X935: 5 | Y935: 10 | Z935: 0 | AA935: 941 | AB935: 1231 | AC935: 76.441917140536148 | AD935: 20
A936: BOX HILL | C936: SAWATSKY 2 | F936: STREET | I936: DUNN | W936: BRIGHTON | X936: 4 | Y936: 10 | Z936: 1 | AA936: 997 | AB936: 1305 | AC936: 76.398467432950198 | AD936: 18
W937: NORTHCOTE | X937: 3 | Y937: 12 | Z937: 0 | AA937: 785 | AB937: 1045 | AC937: 75.119617224880386 | AD937: 12
A938: SANDRINGHAM | C938: 1 | D938: 2 | E938: =C938*6+D938 -> 8 | G938: 7 | H938: 7 | I938: =G938*6+H938 -> 49 | K938: 9 | L938: 8 | M938: =K938*6+L938 -> 62 | O938: 12 | P938: 12 | Q938: =O938*6+P938 -> 84 | S938: BEACH ROAD | W938: PRAHRAN | X938: 2 | Y938: 12 | Z938: 1 | AA938: 959 | AB938: 1358 | AC938: 70.618556701030926 | AD938: 10
A939: CAMBERWELL | C939: 1 | D939: 5 | E939: =C939*6+D939 -> 11 | G939: 1 | H939: 5 | I939: =G939*6+H939 -> 11 | K939: 6 | L939: 11 | M939: =K939*6+L939 -> 47 | O939: 8 | P939: 11 | Q939: =O939*6+P939 -> 59 | S939: CARDWELL
A940: BEST PLAYERS
A941: SANDRINGHAM | C941: BOLAND | F941: RANSOM | I941: QUINN | L941: TOTTEN | O941: CROUCH | Q941: WEBSTER
A942: CAMBERWELL | C942: TEMPANY | F942: HOLYOAK | I942: DUGDALE | L942: McGUINNESS | O942: MASON | Q942: K CLARKE
A943: GOALKICKERS
A944: SANDRINGHAM | C944: CROUCH 5 | F944: JOHNSTON 3 | I944: QUINN 2 | K944: RANSOM | M944: MARSHALL
A945: CAMBERWELL | C945: DUGDALE 3 | F945: McGUINNESS 2 | J945: TEMPANY 2 | M945: WALKER
A947: YARRAVILLE | C947: 2 | D947: 0 | E947: =C947*6+D947 -> 12 | G947: 6 | H947: 2 | I947: =G947*6+H947 -> 38 | K947: 8 | L947: 5 | M947: =K947*6+L947 -> 53 | O947: 9 | P947: 6 | Q947: =O947*6+P947 -> 60 | S947: OAKLEIGH
A948: OAKLEIGH | C948: 2 | D948: 3 | E948: =C948*6+D948 -> 15 | G948: 6 | H948: 7 | I948: =G948*6+H948 -> 43 | K948: 8 | L948: 8 | M948: =K948*6+L948 -> 56 | O948: 8 | P948: 10 | Q948: =O948*6+P948 -> 58 | S948: ALLEN
A949: BEST PLAYERS
A950: YARRAVILLE | C950: JONES | E950: GARLICK | H950: WILD | K950: WILLIAMS | N950: GARRICK | Q950: DE JONG
A951: OAKLEIGH | C951: RILEY | E951: NICHOLSON | H951: GRANT | K951: WILLIAMS | N951: BAPTIST | Q951: MELVILLE
A952: GOALKICKERS
A953: YARRAVILLE | C953: WILLIAMS 2 | F953: HARGREAVES | I953: HUGHES | K953: WILD | M953: GARLICK | O953: HEMPEL | Q953: DE JONG | S953: CAREY
A954: OAKLEIGH | C954: BAPTIST 3 | F954: GUY | H954: WILLIAMS | K954: GRANT | M954: COUGHLAN | P954: NICHOLSON
A956: COBURG | C956: 5 | D956: 7 | E956: =C956*6+D956 -> 37 | G956: 8 | H956: 10 | I956: =G956*6+H956 -> 58 | K956: 11 | L956: 15 | M956: =K956*6+L956 -> 81 | O956: 14 | P956: 15 | Q956: =O956*6+P956 -> 99 | S956: COBURG
A957: BRIGHTON | C957: 1 | D957: 4 | E957: =C957*6+D957 -> 10 | G957: 3 | H957: 9 | I957: =G957*6+H957 -> 27 | K957: 6 | L957: 11 | M957: =K957*6+L957 -> 47 | O957: 14 | P957: 15 | Q957: =O957*6+P957 -> 99 | S957: BARNETT
A958: BEST PLAYERS
A959: COBURG | C959: B JONES | F959: SHORT | H959: WILKINSON | K959: HEWES | N959: MILES | Q959: MAHONEY
A960: BRIGHTON | C960: FREEMAN | F960: HART | H960: McCANN | K960: CURRIE | N960: PEARSON | Q960: KERR
A961: GOALKICKERS
A962: COBURG | C962: B JONES 6 | F962: HUNTINGTON 3 | J962: WILKINSON 2 | M962: PEARCE 2 | O962: MILES
A963: BRIGHTON | C963: PEARSON 3 | F963: HART 2 | H963: JEWELL 2 | J963: CRAIG 2 | L963: BROWN | N963: CURRIE | P963: McCANN
A965: MOORABBIN | C965: 1 | D965: 2 | E965: =C965*6+D965 -> 8 | G965: 3 | H965: 2 | I965: =G965*6+H965 -> 20 | K965: 8 | L965: 4 | M965: =K965*6+L965 -> 52 | O965: 11 | P965: 8 | Q965: =O965*6+P965 -> 74 | S965: NORTHCOTE
A966: NORTHCOTE | C966: 3 | D966: 3 | E966: =C966*6+D966 -> 21 | G966: 3 | H966: 5 | I966: =G966*6+H966 -> 23 | K966: 3 | L966: 6 | M966: =K966*6+L966 -> 24 | O966: 5 | P966: 10 | Q966: =O966*6+P966 -> 40 | S966: E BREWER
A967: BEST PLAYERS
A968: MOORABBIN | C968: DYNON | F968: BOYD | I968: MURRAY | L968: EDWARDS | O968: SCHOFIELD | R968: JONES
A969: NORTHCOTE | C969: ALDRIDGE | F969: F VAINS | I969: FRANCIS | L969: HEDGER | O969: DEVINE | R969: WOOLNOUGH
A970: GOALKICKERS
A971: MOORABBIN | C971: SCHOFIELD 4 | F971: GREEN 2 | I971: DYNON 2 | K971: McGAW 2 | N971: CARGILL
A972: NORTHCOTE | C972: COLLINS 2 | F972: WOOLNOUGH | I972: FRANCIS | K972: DEVINE
A974: PORT MELBOURNE | C974: 7 | D974: 7 | E974: =C974*6+D974 -> 49 | G974: 10 | H974: 11 | I974: =G974*6+H974 -> 71 | K974: 16 | L974: 18 | M974: =K974*6+L974 -> 114 | O974: 17 | P974: 21 | Q974: =O974*6+P974 -> 123 | S974: TOORAK PARK
A975: PRAHRAN | C975: 1 | D975: 3 | E975: =C975*6+D975 -> 9 | G975: 4 | H975: 6 | I975: =G975*6+H975 -> 30 | K975: 5 | L975: 6 | M975: =K975*6+L975 -> 36 | O975: 9 | P975: 8 | Q975: =O975*6+P975 -> 62 | S975: ROWE
A976: BEST PLAYERS
A977: PORT MELBOURNE | C977: JOHNSON | F977: WITHERS | I977: RON YOUNG | L977: LEWIS | N977: E ATKINSON | R977: LAFFEY
A978: PRAHRAN | C978: SHILLABEER | F978: SHARP | I978: ROSS JONES | L978: HARVEY | N978: P KINNABURGH | R978: SIMPSON
A979: GOALKICKERS
A980: PORT MELBOURNE | C980: BONNETT 4 | F980: MILLER 4 | I980: LEWIS 2 | K980: STREADER 2 | N980: HARVEY 2 | Q980: SYKES | S980: MCDONALD | V980: BAILLIE
A981: PRAHRAN | C981: SHARP 3 | F981: HARVEY 2 | I981: MORROW 2 | L981: WILSON | N981: CHINNOCK
A983: ROUND 16 | E983: 4TH AUGUST | J983: WEATHER | O983: FINE & SUNNY | S983: PLAYED AT
D984: 1ST QTR | H984: 2ND QTR | L984: 3RD QTR | P984: FINAL | S984: MOORABBIN
A985: BRUNSWICK | C985: 4 | D985: 4 | E985: =C985*6+D985 -> 28 | G985: 7 | H985: 5 | I985: =G985*6+H985 -> 47 | K985: 10 | L985: 11 | M985: =K985*6+L985 -> 71 | O985: 10 | P985: 13 | Q985: =O985*6+P985 -> 73 | S985: UMPIRE | X985: LADDER | AB985: ROUND | AD985: 16
A986: MOORABBIN | C986: 1 | D986: 1 | E986: =C986*6+D986 -> 7 | G986: 4 | H986: 7 | I986: =G986*6+H986 -> 31 | K986: 7 | L986: 8 | M986: =K986*6+L986 -> 50 | O986: 9 | P986: 13 | Q986: =O986*6+P986 -> 67 | S986: ALLEN
A987: BEST PLAYERS | W987: TEAM | X987: W | Y987: L | Z987: D | AA987: FOR | AB987: AGST | AC987: % | AD987: PTS
A988: BRUNSWICK | C988: POLLARD | F988: ROLFS | I988: EDWARDS | L988: STANLEY | O988: LOVETT | Q988: DEAS
A989: MOORABBIN | C989: A BOYD | F989: MURRAY | I989: RYAN | L989: MORONEY | O989: McGAW | Q989: SCHOFIELD | W989: PORT MELBOURNE | X989: 13 | Y989: 3 | Z989: 0 | AA989: 1572 | AB989: 986 | AC989: 159.43 | AD989: 52
A990: GOALKICKERS | W990: WILLIAMSTOWN | X990: 13 | Y990: 3 | Z990: 0 | AA990: 1372 | AB990: 875 | AC990: 156.8 | AD990: 52
A991: BRUNSWICK | C991: CLUES 2 | F991: DEAS 2 | H991: POLLARD 2 | K991: MULLENGER 2 | N991: HAYES | P991: WEIR | W991: PRESTON | X991: 12 | Y991: 4 | Z991: 0 | AA991: 1240 | AB991: 951 | AC991: 130.38906414300737 | AD991: 48
A992: MOORABBIN | C992: SCHOFIELD 5 | F992: MORONEY 2 | I992: McGAW 2 | W992: BOX HILL | X992: 12 | Y992: 4 | Z992: 0 | AA992: 1114 | AB992: 870 | AC992: 128.04597701149424 | AD992: 48
A994: PORT MELBOURNE | C994: 5 | D994: 6 | E994: =C994*6+D994 -> 36 | G994: 13 | H994: 11 | I994: =G994*6+H994 -> 89 | K994: 18 | L994: 16 | M994: =K994*6+L994 -> 124 | O994: 29 | P994: 22 | Q994: =O994*6+P994 -> 196 | S994: PORT MELBOURNE | W994: BRUNSWICK | X994: 11 | Y994: 5 | Z994: 0 | AA994: 1304 | AB994: 1029 | AC994: 126.72497570456754 | AD994: 44
A995: COBURG | C995: 2 | D995: 2 | E995: =C995*6+D995 -> 14 | G995: 4 | H995: 2 | I995: =G995*6+H995 -> 26 | K995: 6 | L995: 9 | M995: =K995*6+L995 -> 45 | O995: 6 | P995: 10 | Q995: =O995*6+P995 -> 46 | S995: ROACH | W995: MOORABBIN | X995: 9 | Y995: 7 | Z995: 0 | AA995: 1141 | AB995: 1000 | AC995: 114.1 | AD995: 36
A996: BEST PLAYERS | W996: SANDRINGHAM | X996: 7 | Y996: 9 | Z996: 0 | AA996: 1072 | AB996: 1153 | AC996: 92.974848222029493 | AD996: 28
A997: PORT MELBOURNE | C997: ALLEN | F997: WITHERS | I997: STREADER | L997: SYKES | N997: BONNETT | Q997: FRASER | W997: COBURG | X997: 6 | Y997: 9 | Z997: 1 | AA997: 1313 | AB997: 1358 | AC997: 96.68630338733432 | AD997: 26
A998: COBURG | C998: WILKINSON | F998: HUNTINGTON | I998: STARBUCK | L998: MURRAY | N998: McCOLL | Q998: MILES | W998: OAKLEIGH | X998: 6 | Y998: 9 | Z998: 1 | AA998: 893 | AB998: 1229 | AC998: 72.660699755899103 | AD998: 26
A999: GOALKICKERS | N999: RON YOUNG | Q999: McDONALD | W999: YARRAVILLE | X999: 6 | Y999: 10 | Z999: 0 | AA999: 1023 | AB999: 1187 | AC999: 86.183656276326872 | AD999: 24
A1000: PORT MELBOURNE | C1000: BONNETT 7 | F1000: LEWIS 4 | H1000: STREADER 4 | K1000: FRASER 3 | M1000: MILLER 3 | O1000: SYKES 2 | Q1000: WITHERS 2 | T1000: HARVEY 2 | W1000: BRIGHTON | X1000: 5 | Y1000: 10 | Z1000: 1 | AA1000: 1098 | AB1000: 1396 | AC1000: 78.653295128939831 | AD1000: 22
A1001: COBURG | C1001: WILKINSON | F1001: BOOTH | H1001: MILLER | J1001: HEWES | L1001: YOUNG | N1001: MILES | W1001: CAMBERWELL | X1001: 5 | Y1001: 11 | Z1001: 0 | AA1001: 1010 | AB1001: 1363 | AC1001: 74.101247248716064 | AD1001: 20
W1002: NORTHCOTE | X1002: 3 | Y1002: 13 | Z1002: 0 | AA1002: 827 | AB1002: 1100 | AC1002: 75.181818181818187 | AD1002: 12
A1003: PRESTON | C1003: 4 | D1003: 1 | E1003: =C1003*6+D1003 -> 25 | G1003: 8 | H1003: 4 | I1003: =G1003*6+H1003 -> 52 | K1003: 10 | L1003: 11 | M1003: =K1003*6+L1003 -> 71 | O1003: 15 | P1003: 16 | Q1003: =O1003*6+P1003 -> 106 | S1003: COBURG | W1003: PRAHRAN | X1003: 2 | Y1003: 13 | Z1003: 1 | AA1003: 980 | AB1003: 1462 | AC1003: 67.031463748290008 | AD1003: 10
A1004: SANDRINGHAM | C1004: 3 | D1004: 3 | E1004: =C1004*6+D1004 -> 21 | G1004: 3 | H1004: 4 | I1004: =G1004*6+H1004 -> 22 | K1004: 4 | L1004: 7 | M1004: =K1004*6+L1004 -> 31 | O1004: 7 | P1004: 10 | Q1004: =O1004*6+P1004 -> 52 | S1004: BARNETT
A1005: BEST PLAYERS
A1006: PRESTON | C1006: L SWEET | F1006: F CHARD | I1006: CROCKER | L1006: COOPER | N1006: McLACHLAN | Q1006: LITTLE
A1007: SANDRINGHAM | C1007: RANSOM | F1007: MARSHALL | I1007: QUINN | L1007: BOLAND | N1007: WEBSTER | Q1007: McKENZIE
A1008: GOALKICKERS
A1009: PRESTON | C1009: F CHARD 6 | F1009: BRADFORD 3 | I1009: McBEAN 2 | L1009: FOLEY | N1009: CONSTABLE | Q1009: ROSE | R1009: LITTLE
A1010: SANDRINGHAM | C1010: CROUCH 3 | F1010: TOTTEN 2 | I1010: QUINN | K1010: JOHNSTON
A1012: OAKLEIGH | C1012: 2 | D1012: 2 | E1012: =C1012*6+D1012 -> 14 | G1012: 3 | H1012: 4 | I1012: =G1012*6+H1012 -> 22 | K1012: 6 | L1012: 6 | M1012: =K1012*6+L1012 -> 42 | O1012: 7 | P1012: 13 | Q1012: =O1012*6+P1012 -> 55 | S1012: NORTHCOTE
A1013: NORTHCOTE | C1013: 0 | D1013: 3 | E1013: =C1013*6+D1013 -> 3 | G1013: 4 | H1013: 4 | I1013: =G1013*6+H1013 -> 28 | K1013: 5 | L1013: 8 | M1013: =K1013*6+L1013 -> 38 | O1013: 5 | P1013: 12 | Q1013: =O1013*6+P1013 -> 42 | S1013: ROWE
A1014: BEST PLAYERS
A1015: OAKLEIGH | C1015: COLLINS | F1015: BACKMAN | I1015: GRANT | L1015: GUY | N1015: DONOHUE | Q1015: I'ANSON
A1016: NORTHCOTE | C1016: ALDRIDGE | F1016: POWELL | I1016: WATSON | L1016: COLLINS | N1016: A JOHNSON | Q1016: PETERS
A1017: GOALKICKERS
A1018: OAKLEIGH | C1018: WILLIAMS 2 | F1018: GRANT 2 | I1018: BAPTIST | K1018: CAMM | M1018: COUGHLAN
A1019: NORTHCOTE | C1019: PETERS 3 | F1019: COLLINS 2
A1021: YARRAVILLE | C1021: 1 | D1021: 2 | E1021: =C1021*6+D1021 -> 8 | G1021: 7 | H1021: 5 | I1021: =G1021*6+H1021 -> 47 | K1021: 10 | L1021: 6 | M1021: =K1021*6+L1021 -> 66 | O1021: 16 | P1021: 8 | Q1021: =O1021*6+P1021 -> 104 | S1021: YARRAVILLE
A1022: PRAHRAN | C1022: 0 | D1022: 4 | E1022: =C1022*6+D1022 -> 4 | G1022: 1 | H1022: 6 | I1022: =G1022*6+H1022 -> 12 | K1022: 1 | L1022: 9 | M1022: =K1022*6+L1022 -> 15 | O1022: 2 | P1022: 9 | Q1022: =O1022*6+P1022 -> 21 | S1022: ROBINSON
A1023: BEST PLAYERS
A1024: YARRAVILLE | C1024: DE JONG | F1024: ROHLEDER | I1024: CUFFE | L1024: GARLICK | O1024: BOURKE | Q1024: MASON
A1025: PRAHRAN | C1025: F SHILLABEER | F1025: CLEAR | I1025: SIMPSON | L1025: ROSS JONES | O1025: PLAIN | Q1025: SHARP
A1026: GOALKICKERS
A1027: YARRAVILLE | C1027: SCHUMAN 5 | F1027: WILLIAMS 3 | I1027: HUGHES 2 | K1027: DE JONG 2 | M1027: WILD 2 | O1027: GARLICK | Q1027: HEMPEL
A1028: PRAHRAN | C1028: WILSON 2
A1030: WILLIAMSTOWN | C1030: 3 | D1030: 5 | E1030: =C1030*6+D1030 -> 23 | G1030: 8 | H1030: 7 | I1030: =G1030*6+H1030 -> 55 | K1030: 17 | L1030: 9 | M1030: =K1030*6+L1030 -> 111 | O1030: 20 | P1030: 12 | Q1030: =O1030*6+P1030 -> 132 | S1030: CAMBERWELL
A1031: CAMBERWELL | C1031: 2 | D1031: 1 | E1031: =C1031*6+D1031 -> 13 | G1031: 3 | H1031: 6 | I1031: =G1031*6+H1031 -> 24 | K1031: 4 | L1031: 9 | M1031: =K1031*6+L1031 -> 33 | O1031: 9 | P1031: 15 | Q1031: =O1031*6+P1031 -> 69 | S1031: IRVING
A1032: BEST PLAYERS
A1033: WILLIAMSTOWN | C1033: MARTIN | F1033: McPHERSON | I1033: CALLAHAN | L1033: LINTON | N1033: TURNER | Q1033: CURRAN
A1034: CAMBERWELL | C1034: ROSS | F1034: K CLARKE | I1034: SKALBERG | L1034: BELL | N1034: SMITH | Q1034: TEMPANY
A1035: GOALKICKERS
A1036: WILLIAMSTOWN | C1036: McPHERSON 10 | F1036: LINTON 3 | I1036: FISHER 2 | K1036: WOOKEY | M1036: GEAR | O1036: SMITH | Q1036: REED | S1036: WARD
A1037: CAMBERWELL | C1037: DUGDALE 2 | F1037: K CLARKE 2 | I1037: COLEMAN | K1037: TEMPANY | M1037: SKALBERG | O1037: JACKSON | Q1037: FLINTON
A1039: BRIGHTON | C1039: 1 | D1039: 3 | E1039: =C1039*6+D1039 -> 9 | G1039: 8 | H1039: 5 | I1039: =G1039*6+H1039 -> 53 | K1039: 13 | L1039: 8 | M1039: =K1039*6+L1039 -> 86 | O1039: 15 | P1039: 11 | Q1039: =O1039*6+P1039 -> 101 | S1039: ELSTERNWICK PARK
A1040: BOX HILL | C1040: 3 | D1040: 4 | E1040: =C1040*6+D1040 -> 22 | G1040: 5 | H1040: 7 | I1040: =G1040*6+H1040 -> 37 | K1040: 7 | L1040: 11 | M1040: =K1040*6+L1040 -> 53 | O1040: 13 | P1040: 13 | Q1040: =O1040*6+P1040 -> 91 | S1040: CARDWELL
A1041: BEST PLAYERS
A1042: BRIGHTON | C1042: FREEMAN | F1042: STEVENS | I1042: CURRIE | L1042: DURKIN | O1042: McCANN | R1042: PRETTY
A1043: BOX HILL | C1043: IRVINE | F1043: DEVERY | I1043: WHITE | L1043: SAWATSKY | O1043: AUSTEN | R1043: LANNING
A1044: GOALKICKERS
A1045: BRIGHTON | C1045: DURKIN 5 | F1045: HART 4 | H1045: WEST 4 | J1045: PROSSER | L1045: DAVIS
A1046: BOX HILL | C1046: PLUNKETT 2 | F1046: WHITE 2 | H1046: DEVERY 2 | J1046: LE LIEVRE 2 | M1046: SAWATSKY | P1046: GREEN | R1046: BROWN | U1046: DOUGLAS | X1046: AUSTEN
A1048: ROUND 17 | E1048: 11TH AUGUST | J1048: WEATHER | M1048: SOUTH WEST WIND SHOWERS | S1048: PLAYED AT | X1048: LADDER | AB1048: ROUND | AD1048: 17
D1049: 1ST QTR | H1049: 2ND QTR | L1049: 3RD QTR | P1049: FINAL | S1049: WILLIAMSTOWN
A1050: WILLIAMSTOWN | C1050: 3 | D1050: 4 | E1050: =C1050*6+D1050 -> 22 | G1050: 8 | H1050: 8 | I1050: =G1050*6+H1050 -> 56 | K1050: 10 | L1050: 8 | M1050: =K1050*6+L1050 -> 68 | O1050: 12 | P1050: 12 | Q1050: =O1050*6+P1050 -> 84 | S1050: UMPIRE | W1050: TEAM | X1050: W | Y1050: L | Z1050: D | AA1050: FOR | AB1050: AGST | AC1050: % | AD1050: PTS
A1051: PRESTON | C1051: 2 | D1051: 3 | E1051: =C1051*6+D1051 -> 15 | G1051: 2 | H1051: 4 | I1051: =G1051*6+H1051 -> 16 | K1051: 5 | L1051: 11 | M1051: =K1051*6+L1051 -> 41 | O1051: 5 | P1051: 13 | Q1051: =O1051*6+P1051 -> 43 | S1051: E BREWER
A1052: BEST PLAYERS | W1052: WILLIAMSTOWN | X1052: 14 | Y1052: 3 | Z1052: 0 | AA1052: 1456 | AB1052: 918 | AC1052: 158.6 | AD1052: 56
A1053: WILLIAMSTOWN | C1053: MARTIN | F1053: R JONES | I1053: CALLAHAN | L1053: LINTON | O1053: WOOKEY | Q1053: REED | W1053: PORT MELBOURNE | X1053: 14 | Y1053: 3 | Z1053: 0 | AA1053: 1621 | AB1053: 1031 | AC1053: 157.23 | AD1053: 56
A1054: PRESTON | C1054: BRADFORD | F1054: FOLEY | I1054: CUSACK | L1054: CONSTABLE | O1054: SUPPLITT | Q1054: HOWARD | W1054: BRUNSWICK | X1054: 12 | Y1054: 5 | Z1054: 0 | AA1054: 1391 | AB1054: 1086 | AC1054: 128.08471454880294 | AD1054: 48
A1055: GOALKICKERS | Q1055: R JONES | W1055: BOX HILL | X1055: 12 | Y1055: 5 | Z1055: 0 | AA1055: 1159 | AB1055: 919 | AC1055: 126.11534276387377 | AD1055: 48
A1056: WILLIAMSTOWN | C1056: McPHERSON 2 | F1056: WOOKEY 2 | I1056: SMITH 2 | K1056: GEAR 2 | M1056: CALLAHAN | P1056: LINTON | R1056: MUNDAY
A1057: PRESTON | C1057: BRADFORD 2 | F1057: K CHARD | I1057: COOPER | K1057: CONSTABLE | W1057: PRESTON | X1057: 12 | Y1057: 5 | Z1057: 0 | AA1057: 1283 | AB1057: 1035 | AC1057: 123.96135265700484 | AD1057: 48
W1058: MOORABBIN | X1058: 10 | Y1058: 7 | Z1058: 0 | AA1058: 1209 | AB1058: 1059 | AC1058: 114.16430594900849 | AD1058: 40
A1059: PORT MELBOURNE | C1059: 3 | D1059: 0 | E1059: =C1059*6+D1059 -> 18 | G1059: 5 | H1059: 3 | I1059: =G1059*6+H1059 -> 33 | K1059: 5 | L1059: 8 | M1059: =K1059*6+L1059 -> 38 | O1059: 6 | P1059: 13 | Q1059: =O1059*6+P1059 -> 49 | S1059: BOX HILL | W1059: SANDRINGHAM | X1059: 8 | Y1059: 9 | Z1059: 0 | AA1059: 1153 | AB1059: 1228 | AC1059: 93.892508143322473 | AD1059: 32
A1060: BOX HILL | C1060: 0 | D1060: 2 | E1060: =C1060*6+D1060 -> 2 | G1060: 0 | H1060: 3 | I1060: =G1060*6+H1060 -> 3 | K1060: 4 | L1060: 5 | M1060: =K1060*6+L1060 -> 29 | O1060: 6 | P1060: 9 | Q1060: =O1060*6+P1060 -> 45 | S1060: IRVING | W1060: YARRAVILLE | X1060: 7 | Y1060: 10 | Z1060: 0 | AA1060: 1116 | AB1060: 1274 | AC1060: 87.598116169544738 | AD1060: 28
A1061: BEST PLAYERS | W1061: COBURG | X1061: 6 | Y1061: 10 | Z1061: 1 | AA1061: 1400 | AB1061: 1451 | AC1061: 96.485182632667133 | AD1061: 26
A1062: PORT MELBOURNE | C1062: JOHNSON | F1062: MILLER | I1062: METHERALL | L1062: RON YOUNG | O1062: WITHERS | Q1062: E ATKINSON | W1062: OAKLEIGH | X1062: 6 | Y1062: 10 | Z1062: 1 | AA1062: 952 | AB1062: 1297 | AC1062: 73.400154202004629 | AD1062: 26
A1063: BOX HILL | C1063: AUSTEN | F1063: IRVINE | I1063: LOVE | L1063: SAWATSKY | O1063: LANNING | Q1063: QUINN | W1063: BRIGHTON | X1063: 5 | Y1063: 11 | Z1063: 1 | AA1063: 1173 | AB1063: 1477 | AC1063: 79.417738659444822 | AD1063: 22
A1064: GOALKICKERS | W1064: CAMBERWELL | X1064: 5 | Y1064: 12 | Z1064: 0 | AA1064: 1067 | AB1064: 1450 | AC1064: 73.58620689655173 | AD1064: 20
A1065: PORT MELBOURNE | C1065: BONNETT 3 | F1065: MILLER 2 | I1065: SYKES | W1065: PRAHRAN | X1065: 3 | Y1065: 13 | Z1065: 1 | AA1065: 1033 | AB1065: 1512 | AC1065: 68.320105820105823 | AD1065: 14
A1066: BOX HILL | C1066: SAWATSKY 3 | F1066: GREEN | I1066: PLUNKETT | L1066: DUNN | W1066: NORTHCOTE | X1066: 3 | Y1066: 14 | Z1066: 0 | AA1066: 877 | AB1066: 1153 | AC1066: 76.062445793581958 | AD1066: 12
A1068: MOORABBIN | C1068: 2 | D1068: 8 | E1068: =C1068*6+D1068 -> 20 | G1068: 3 | H1068: 9 | I1068: =G1068*6+H1068 -> 27 | K1068: 6 | L1068: 14 | M1068: =K1068*6+L1068 -> 50 | O1068: 9 | P1068: 14 | Q1068: =O1068*6+P1068 -> 68 | S1068: OAKLEIGH
A1069: OAKLEIGH | C1069: 1 | D1069: 1 | E1069: =C1069*6+D1069 -> 7 | G1069: 4 | H1069: 5 | I1069: =G1069*6+H1069 -> 29 | K1069: 5 | L1069: 8 | M1069: =K1069*6+L1069 -> 38 | O1069: 7 | P1069: 17 | Q1069: =O1069*6+P1069 -> 59 | S1069: CARDWELL
A1070: BEST PLAYERS
A1071: MOORABBIN | C1071: A BOYD | F1071: MURRAY | I1071: PECK | L1071: CLOVER | O1071: McGAW | Q1071: RENWICK
A1072: OAKLEIGH | C1072: GRANT | F1072: I'ANSON | I1072: NICHOLSON | L1072: COLLINS | O1072: GUY | Q1072: PRENDERGAST
A1073: GOALKICKERS
A1074: MOORABBIN | C1074: SCHOFIELD 4 | F1074: CLOVER 2 | I1074: RENWICK | L1074: K BOYD | N1074: CARGILL
A1075: OAKLEIGH | C1075: GRANT 3 | F1075: B WILLIAMS | I1075: COUGHLAN | L1075: NICHOLSON | O1075: D'ARCY
A1077: YARRAVILLE | C1077: 3 | D1077: 4 | E1077: =C1077*6+D1077 -> 22 | G1077: 7 | H1077: 6 | I1077: =G1077*6+H1077 -> 48 | K1077: 10 | L1077: 7 | M1077: =K1077*6+L1077 -> 67 | O1077: 13 | P1077: 15 | Q1077: =O1077*6+P1077 -> 93 | S1077: COBURG
A1078: COBURG | C1078: 4 | D1078: 1 | E1078: =C1078*6+D1078 -> 25 | G1078: 7 | H1078: 3 | I1078: =G1078*6+H1078 -> 45 | K1078: 12 | L1078: 7 | M1078: =K1078*6+L1078 -> 79 | O1078: 13 | P1078: 9 | Q1078: =O1078*6+P1078 -> 87 | S1078: GODING
A1079: BEST PLAYERS
A1080: YARRAVILLE | C1080: SCHUMAN | F1080: MARCHESI | I1080: CUFFE | L1080: WILD | N1080: GARLICK | Q1080: GARRICK
A1081: COBURG | C1081: H WILKINSON | F1081: HEWES | I1081: BRENNAN | L1081: BOOTH | N1081: MAHONEY | Q1081: CRAIG
A1082: GOALKICKERS
A1083: YARRAVILLE | C1083: SCHUMAN 3 | F1083: HUGHES 2 | I1083: WILLIAMS 2 | L1083: CAREY 2 | N1083: GARLICK 2 | Q1083: ROHLEDER | T1083: WILD
A1084: COBURG | C1084: HEWES 6 | F1084: H WILKINSON 3 | J1084: L JONES 2 | M1084: PEARCE | O1084: GOULLET
A1086: SANDRINGHAM | C1086: 3 | D1086: 4 | E1086: =C1086*6+D1086 -> 22 | G1086: 4 | H1086: 4 | I1086: =G1086*6+H1086 -> 28 | K1086: 9 | L1086: 7 | M1086: =K1086*6+L1086 -> 61 | O1086: 12 | P1086: 9 | Q1086: =O1086*6+P1086 -> 81 | S1086: BEACH ROAD
A1087: BRIGHTON | C1087: 2 | D1087: 2 | E1087: =C1087*6+D1087 -> 14 | G1087: 9 | H1087: 4 | I1087: =G1087*6+H1087 -> 58 | K1087: 9 | L1087: 6 | M1087: =K1087*6+L1087 -> 60 | O1087: 11 | P1087: 9 | Q1087: =O1087*6+P1087 -> 75 | S1087: ROBINSON
A1088: BEST PLAYERS
A1089: SANDRINGHAM | C1089: SHEARER | F1089: JOHNSTON | I1089: RANSOM | L1089: QUINN | N1089: WEBSTER | Q1089: SHRIVES
A1090: BRIGHTON | C1090: STEVENS | F1090: WILLIAMS | I1090: CURRIE | L1090: PRETTY | N1090: McCANN | Q1090: FREEMAN
A1091: GOALKICKERS
A1092: SANDRINGHAM | C1092: JOHNSTON 5 | F1092: QUINN 2 | I1092: SHEARER | K1092: VANCE | M1092: MARSHALL | P1092: RANSOM | R1092: TOTTEN
A1093: BRIGHTON | C1093: WEST 5 | F1093: HART 3 | H1093: PROSSER | J1093: DURKIN | L1093: WOOLSTENCROFT
A1095: PRAHRAN | C1095: 3 | D1095: 4 | E1095: =C1095*6+D1095 -> 22 | G1095: 5 | H1095: 5 | I1095: =G1095*6+H1095 -> 35 | K1095: 7 | L1095: 9 | M1095: =K1095*6+L1095 -> 51 | O1095: 7 | P1095: 11 | Q1095: =O1095*6+P1095 -> 53 | S1095: TOORAK PARK
A1096: NORTHCOTE | C1096: 1 | D1096: 4 | E1096: =C1096*6+D1096 -> 10 | G1096: 3 | H1096: 6 | I1096: =G1096*6+H1096 -> 24 | K1096: 5 | L1096: 10 | M1096: =K1096*6+L1096 -> 40 | O1096: 6 | P1096: 14 | Q1096: =O1096*6+P1096 -> 50 | S1096: ROACH
A1097: BEST PLAYERS
A1098: PRAHRAN | C1098: SHILLABEER | F1098: PEARSON | I1098: HARVEY | L1098: ROSS JONES | O1098: WILSON | Q1098: SHARP
A1099: NORTHCOTE | C1099: POWELL | F1099: L WALKER | I1099: COLLINS | L1099: ALDRIDGE | O1099: HEDGER | Q1099: WOOLNOUGH
A1100: GOALKICKERS
A1101: PRAHRAN | C1101: HART 2 | F1101: HARVEY 2 | I1101: SHARP 2 | L1101: HASSELL
A1102: NORTHCOTE | C1102: PETERS 2 | F1102: COLLINS 2 | I1102: FRANCIS | L1102: WOOLNOUGH
A1104: BRUNSWICK | C1104: 4 | D1104: 6 | E1104: =C1104*6+D1104 -> 30 | G1104: 7 | H1104: 12 | I1104: =G1104*6+H1104 -> 54 | K1104: 8 | L1104: 13 | M1104: =K1104*6+L1104 -> 61 | O1104: 12 | P1104: 15 | Q1104: =O1104*6+P1104 -> 87 | S1104: BRUNSWICK
A1105: CAMBERWELL | C1105: 2 | D1105: 2 | E1105: =C1105*6+D1105 -> 14 | G1105: 3 | H1105: 5 | I1105: =G1105*6+H1105 -> 23 | K1105: 7 | L1105: 8 | M1105: =K1105*6+L1105 -> 50 | O1105: 8 | P1105: 9 | Q1105: =O1105*6+P1105 -> 57 | S1105: BARNETT
A1106: BEST PLAYERS
A1107: BRUNSWICK | C1107: MULLENGER | F1107: WEIR | I1107: R MASON | L1107: EDWARDS | O1107: LOVETT | R1107: ROLFS
A1108: CAMBERWELL | C1108: ROSS | F1108: J MASON | I1108: BELL | L1108: PROUDFOOT | O1108: K CLARKE | R1108: NELSON
A1109: GOALKICKERS
A1110: BRUNSWICK | C1110: R MASON 2 | F1110: MULLENGER 2 | I1110: HAYES 2 | K1110: LOVETT 2 | M1110: WEIR 2 | O1110: CLUES | Q1110: SKINNER
A1111: CAMBERWELL | C1111: DUGDALE 2 | F1111: McGUINNESS | I1111: ROSS | K1111: K CLARKE | M1111: COLEMAN | O1111: CHARLTON | R1111: DONALDSON
A1113: ROUND 18 | E1113: 18TH AUGUST | J1113: WEATHER | O1113: NORTH WEST WIND | S1113: PLAYED AT
D1114: 1ST QTR | H1114: 2ND QTR | L1114: 3RD QTR | P1114: FINAL | S1114: COBURG
A1115: BRUNSWICK | C1115: 4 | D1115: 4 | E1115: =C1115*6+D1115 -> 28 | G1115: 5 | H1115: 5 | I1115: =G1115*6+H1115 -> 35 | K1115: 11 | L1115: 7 | M1115: =K1115*6+L1115 -> 73 | O1115: 13 | P1115: 9 | Q1115: =O1115*6+P1115 -> 87 | S1115: UMPIRE | X1115: LADDER | AB1115: ROUND | AD1115: 18
A1116: PRESTON | C1116: 1 | D1116: 1 | E1116: =C1116*6+D1116 -> 7 | G1116: 6 | H1116: 4 | I1116: =G1116*6+H1116 -> 40 | K1116: 8 | L1116: 4 | M1116: =K1116*6+L1116 -> 52 | O1116: 10 | P1116: 7 | Q1116: =O1116*6+P1116 -> 67 | S1116: ROBINSON
A1117: BEST PLAYERS | W1117: TEAM | X1117: W | Y1117: L | Z1117: D | AA1117: FOR | AB1117: AGST | AC1117: % | AD1117: PTS
A1118: BRUNSWICK | C1118: ROLFS | E1118: YEA | H1118: MULLENGER | K1118: WEIR | N1118: DUNSTAN | Q1118: NEILSON
A1119: PRESTON | C1119: McBEAN | E1119: LITTLE | H1119: HOWARD | K1119: CUSACK | N1119: K CHARD | Q1119: COOPER | W1119: PORT MELBOURNE | X1119: 15 | Y1119: 3 | Z1119: 0 | AA1119: 1730 | AB1119: 1049 | AC1119: 164.92 | AD1119: 60
A1120: GOALKICKERS | W1120: WILLIAMSTOWN | X1120: 15 | Y1120: 3 | Z1120: 0 | AA1120: 1552 | AB1120: 974 | AC1120: 159.34 | AD1120: 60
A1121: BRUNSWICK | C1121: HAYES 4 | F1121: MULLENGER 3 | I1121: MASON | K1121: WEIR | M1121: POLLARD | O1121: SKINNER | Q1121: YEA | R1121: R McFARLANE | W1121: BRUNSWICK | X1121: 13 | Y1121: 5 | Z1121: 0 | AA1121: 1478 | AB1121: 1153 | AC1121: 128.18733738074587 | AD1121: 52
A1122: PRESTON | C1122: LALOR 3 | F1122: F CHARD 2 | I1122: McBEAN | K1122: LITTLE | M1122: FOLEY | O1122: CUSACK | Q1122: HAYES | W1122: BOX HILL | X1122: 12 | Y1122: 6 | Z1122: 0 | AA1122: 1227 | AB1122: 996 | AC1122: 123.19277108433735 | AD1122: 48
A1124: PORT MELBOURNE | C1124: 3 | D1124: 5 | E1124: =C1124*6+D1124 -> 23 | G1124: 6 | H1124: 9 | I1124: =G1124*6+H1124 -> 45 | K1124: 10 | L1124: 14 | M1124: =K1124*6+L1124 -> 74 | O1124: 15 | P1124: 19 | Q1124: =O1124*6+P1124 -> 109 | S1124: PORT MELBOURNE | W1124: PRESTON | X1124: 12 | Y1124: 6 | Z1124: 0 | AA1124: 1350 | AB1124: 1122 | AC1124: 120.32085561497327 | AD1124: 48
A1125: SANDRINGHAM | C1125: 0 | D1125: 0 | E1125: =C1125*6+D1125 -> 0 | G1125: 2 | H1125: 5 | I1125: =G1125*6+H1125 -> 17 | K1125: 2 | L1125: 5 | M1125: =K1125*6+L1125 -> 17 | O1125: 2 | P1125: 6 | Q1125: =O1125*6+P1125 -> 18 | S1125: BARNETT | W1125: MOORABBIN | X1125: 11 | Y1125: 7 | Z1125: 0 | AA1125: 1299 | AB1125: 1103 | AC1125: 117.76971894832276 | AD1125: 44
A1126: BEST PLAYERS | W1126: YARRAVILLE | X1126: 8 | Y1126: 10 | Z1126: 0 | AA1126: 1193 | AB1126: 1342 | AC1126: 88.897168405365122 | AD1126: 32
A1127: PORT MELBOURNE | C1127: METHERALL | F1127: JOHNSON | I1127: BONNETT | L1127: MILLER | N1127: WITHERS | Q1127: McDONALD | W1127: SANDRINGHAM | X1127: 8 | Y1127: 10 | Z1127: 0 | AA1127: 1171 | AB1127: 1337 | AC1127: 87.584143605086012 | AD1127: 32
A1128: SANDRINGHAM | C1128: FLETCHER | F1128: BOLAND | I1128: R HARPER | L1128: R EVANS | N1128: QUINN | Q1128: VANCE | W1128: OAKLEIGH | X1128: 7 | Y1128: 10 | Z1128: 1 | AA1128: 1012 | AB1128: 1346 | AC1128: 75.185735512630018 | AD1128: 30
A1129: GOALKICKERS | W1129: COBURG | X1129: 6 | Y1129: 11 | Z1129: 1 | AA1129: 1487 | AB1129: 1549 | AC1129: 95.997417688831504 | AD1129: 26
A1130: PORT MELBOURNE | C1130: BONNETT 7 | F1130: McDONALD 3 | I1130: STONE 2 | K1130: MILLER 2 | M1130: SYKES | W1130: BRIGHTON | X1130: 5 | Y1130: 12 | Z1130: 1 | AA1130: 1229 | AB1130: 1573 | AC1130: 78.130959949141769 | AD1130: 22
A1131: SANDRINGHAM | C1131: CROUCH | F1131: JOHNSTON | W1131: CAMBERWELL | X1131: 5 | Y1131: 13 | Z1131: 0 | AA1131: 1111 | AB1131: 1540 | AC1131: 72.142857142857139 | AD1131: 20
W1132: NORTHCOTE | X1132: 4 | Y1132: 14 | Z1132: 0 | AA1132: 975 | AB1132: 1240 | AC1132: 78.629032258064512 | AD1132: 16
A1133: YARRAVILLE | C1133: 4 | D1133: 9 | E1133: =C1133*6+D1133 -> 33 | G1133: 5 | H1133: 10 | I1133: =G1133*6+H1133 -> 40 | K1133: 8 | L1133: 21 | M1133: =K1133*6+L1133 -> 69 | O1133: 9 | P1133: 23 | Q1133: =O1133*6+P1133 -> 77 | S1133: YARRAVILLE | W1133: PRAHRAN | X1133: 3 | Y1133: 14 | Z1133: 1 | AA1133: 1082 | AB1133: 1572 | AC1133: 68.829516539440206 | AD1133: 14
A1134: BOX HILL | C1134: 0 | D1134: 1 | E1134: =C1134*6+D1134 -> 1 | G1134: 5 | H1134: 9 | I1134: =G1134*6+H1134 -> 39 | K1134: 5 | L1134: 9 | M1134: =K1134*6+L1134 -> 39 | O1134: 9 | P1134: 14 | Q1134: =O1134*6+P1134 -> 68 | S1134: BREWER
A1135: BEST PLAYERS
A1136: YARRAVILLE | C1136: CUFFE | F1136: GARLICK | I1136: WILD | L1136: CAREY | O1136: GARRICK | Q1136: JONES
A1137: BOX HILL | C1137: WHITE | F1137: CRAIG | I1137: SAWATSKY | L1137: BENNETT | O1137: LOVE | Q1137: LANNING
A1138: GOALKICKERS
A1139: YARRAVILLE | C1139: WILD 2 | E1139: CAREY | G1139: SCHUMAN | I1139: HUGHES | K1139: CHARLES | M1139: WILLIAMS | P1139: BURGE | R1139: GARLICK
A1140: BOX HILL | C1140: WHITE 2 | E1140: DUNN 2 | G1140: HOUGHTON | I1140: DEVERY | K1140: CRAIG | M1140: BROWN | O1140: LONSDALE
A1142: OAKLEIGH | C1142: 2 | D1142: 4 | E1142: =C1142*6+D1142 -> 16 | G1142: 3 | H1142: 6 | I1142: =G1142*6+H1142 -> 24 | K1142: 6 | L1142: 9 | M1142: =K1142*6+L1142 -> 45 | O1142: 8 | P1142: 12 | Q1142: =O1142*6+P1142 -> 60 | S1142: OAKLEIGH
A1143: PRAHRAN | C1143: 1 | D1143: 3 | E1143: =C1143*6+D1143 -> 9 | G1143: 2 | H1143: 3 | I1143: =G1143*6+H1143 -> 15 | K1143: 6 | L1143: 4 | M1143: =K1143*6+L1143 -> 40 | O1143: 7 | P1143: 7 | Q1143: =O1143*6+P1143 -> 49 | S1143: IRVING
A1144: BEST PLAYERS
A1145: OAKLEIGH | C1145: SCURRAH | F1145: BAPTIST | I1145: NEWPORT | L1145: BACKMAN | O1145: GRANT | Q1145: CAMM
A1146: PRAHRAN | C1146: CLEAR | F1146: HARVEY | I1146: ROSS JONES | L1146: SHILLABEER | O1146: ELLIOTT | Q1146: SHARP
A1147: GOALKICKERS
A1148: OAKLEIGH | C1148: GRANT 2 | F1148: NEWPORT 2 | I1148: BACKMAN | K1148: NICHOLSON | N1148: ANDERSON | Q1148: BOURKE
A1149: PRAHRAN | C1149: HARVEY 6 | F1149: L GAZE
A1151: NORTHCOTE | C1151: 4 | D1151: 3 | E1151: =C1151*6+D1151 -> 27 | G1151: 10 | H1151: 5 | I1151: =G1151*6+H1151 -> 65 | K1151: 12 | L1151: 11 | M1151: =K1151*6+L1151 -> 83 | O1151: 14 | P1151: 14 | Q1151: =O1151*6+P1151 -> 98 | S1151: NORTHCOTE
A1152: COBURG | C1152: 3 | D1152: 4 | E1152: =C1152*6+D1152 -> 22 | G1152: 6 | H1152: 6 | I1152: =G1152*6+H1152 -> 42 | K1152: 7 | L1152: 9 | M1152: =K1152*6+L1152 -> 51 | O1152: 13 | P1152: 9 | Q1152: =O1152*6+P1152 -> 87 | S1152: ALLEN
A1153: BEST PLAYERS
A1154: NORTHCOTE | C1154: DEVINE | F1154: POWELL | I1154: WOOLNOUGH | L1154: L WALKER | N1154: ALDRIDGE | Q1154: PETERS
A1155: COBURG | C1155: L SMITH | F1155: B JONES | I1155: H WILKINSON | L1155: BRENNAN | N1155: MAHONEY | Q1155: SHORT
A1156: GOALKICKERS
A1157: NORTHCOTE | C1157: PETERS 4 | F1157: FRANCIS 3 | I1157: TULL 2 | K1157: DEVINE 2 | M1157: OLNEY | O1157: COLLINS | Q1157: NEWMAN
A1158: COBURG | C1158: B JONES 5 | F1158: HEWES 4 | I1158: H WILKINSON 3 | M1158: HUNTINGTON
A1160: MOORABBIN | C1160: 8 | D1160: 3 | E1160: =C1160*6+D1160 -> 51 | G1160: 8 | H1160: 3 | I1160: =G1160*6+H1160 -> 51 | K1160: 11 | L1160: 6 | M1160: =K1160*6+L1160 -> 72 | O1160: 14 | P1160: 6 | Q1160: =O1160*6+P1160 -> 90 | S1160: MOORABBIN
A1161: CAMBERWELL | C1161: 1 | D1161: 0 | E1161: =C1161*6+D1161 -> 6 | G1161: 4 | H1161: 5 | I1161: =G1161*6+H1161 -> 29 | K1161: 4 | L1161: 6 | M1161: =K1161*6+L1161 -> 30 | O1161: 6 | P1161: 8 | Q1161: =O1161*6+P1161 -> 44 | S1161: GODING
A1162: BEST PLAYERS
A1163: MOORABBIN | C1163: PECK | E1163: MORONEY | H1163: HOUSTEN | K1163: MURRAY | N1163: WHALEBONE | Q1163: MURPHY
A1164: CAMBERWELL | C1164: ROSS | E1164: DUGDALE | H1164: COLEMAN | K1164: MASON | N1164: ALLSOP | Q1164: PROUDFOOT
A1165: GOALKICKERS
A1166: MOORABBIN | C1166: SCHOFIELD 7 | F1166: HOUSTEN 2 | I1166: RENWICK 2 | L1166: MORONEY | N1166: WHALEBONE | Q1166: McGAW
A1167: CAMBERWELL | C1167: DUGDALE 2 | F1167: ROSS | H1167: McGUINNESS | K1167: MASON | M1167: COLEMAN
A1169: WILLIAMSTOWN | C1169: 3 | D1169: 1 | E1169: =C1169*6+D1169 -> 19 | G1169: 7 | H1169: 7 | I1169: =G1169*6+H1169 -> 49 | K1169: 8 | L1169: 11 | M1169: =K1169*6+L1169 -> 59 | O1169: 13 | P1169: 18 | Q1169: =O1169*6+P1169 -> 96 | S1169: ELSTERNWICK PARK
A1170: BRIGHTON | C1170: 1 | D1170: 7 | E1170: =C1170*6+D1170 -> 13 | G1170: 3 | H1170: 7 | I1170: =G1170*6+H1170 -> 25 | K1170: 6 | L1170: 14 | M1170: =K1170*6+L1170 -> 50 | O1170: 7 | P1170: 14 | Q1170: =O1170*6+P1170 -> 56 | S1170: ROACH
A1171: BEST PLAYERS
A1172: WILLIAMSTOWN | C1172: GEAR | F1172: CALLAHAN | I1172: WOOKEY | L1172: MURPHY | O1172: SMIRH | Q1172: SIMS
A1173: BRIGHTON | C1173: DURKIN | F1173: FREEMAN | I1173: WILLIAMS | L1173: HART | O1173: McCANN | Q1173: PEARSON
A1174: GOALKICKERS
A1175: WILLIAMSTOWN | C1175: GEAR 4 | E1175: LINTON 2 | H1175: MURPHY 2 | J1175: WOOKEY 2 | M1175: FISHER | O1175: SMITH | Q1175: CALLAHAN
A1176: BRIGHTON | C1176: HART 3 | E1176: PEARSON 2 | H1176: DURKIN 2
A1178: ROUND 19 | E1178: 25TH AUGUST | J1178: WEATHER | M1178: SOUTH WEST WIND SHOWERS | S1178: PLAYED AT
D1179: 1ST QTR | H1179: 2ND QTR | L1179: 3RD QTR | P1179: FINAL | S1179: WILLIAMSTOWN
A1180: WILLIAMSTOWN | C1180: 3 | D1180: 1 | E1180: =C1180*6+D1180 -> 19 | G1180: 7 | H1180: 13 | I1180: =G1180*6+H1180 -> 55 | K1180: 9 | L1180: 15 | M1180: =K1180*6+L1180 -> 69 | O1180: 12 | P1180: 20 | Q1180: =O1180*6+P1180 -> 92 | S1180: UMPIRE | X1180: LADDER | AB1180: ROUND | AD1180: 19
A1181: PORT MELBOURNE | C1181: 3 | D1181: 3 | E1181: =C1181*6+D1181 -> 21 | G1181: 3 | H1181: 6 | I1181: =G1181*6+H1181 -> 24 | K1181: 7 | L1181: 11 | M1181: =K1181*6+L1181 -> 53 | O1181: 8 | P1181: 13 | Q1181: =O1181*6+P1181 -> 61 | S1181: ALLEN
A1182: BEST PLAYERS | W1182: TEAM | X1182: W | Y1182: L | Z1182: D | AA1182: FOR | AB1182: AGST | AC1182: % | AD1182: PTS
A1183: WILLIAMSTOWN | C1183: R JONES | E1183: MARTIN | H1183: OUTEN | K1183: LINTON | N1183: FISHER | Q1183: GEAR
A1184: PORT MELBOURNE | C1184: MILLER | E1184: WILSON | H1184: WITHERS | K1184: JOHNSON | N1184: E ATKINSON | Q1184: BONNETT | W1184: WILLIAMSTOWN | X1184: 16 | Y1184: 3 | Z1184: 0 | AA1184: 1644 | AB1184: 1033 | AC1184: 159.14811229428847 | AD1184: 64
A1185: GOALKICKERS | W1185: PORT MELBOURNE | X1185: 15 | Y1185: 4 | Z1185: 0 | AA1185: 1789 | AB1185: 1141 | AC1185: 156.79228746713409 | AD1185: 60
A1186: WILLIAMSTOWN | C1186: LINTON 3 | F1186: MURPHY 3 | I1186: OUTEN | K1186: FISHER | M1186: GEAR | N1186: LAURIE | P1186: SMITH | R1186: WOOKEY | W1186: BRUNSWICK | X1186: 14 | Y1186: 5 | Z1186: 0 | AA1186: 1591 | AB1186: 1202 | AC1186: 132.36272878535775 | AD1186: 56
A1187: PORT MELBOURNE | C1187: BONNETT 3 | F1187: MILLER 3 | I1187: HARVEY | K1187: ALLEN | W1187: BOX HILL | X1187: 13 | Y1187: 6 | Z1187: 0 | AA1187: 1293 | AB1187: 1041 | AC1187: 124.20749279538904 | AD1187: 52
A1189: YARRAVILLE | C1189: 1 | D1189: 4 | E1189: =C1189*6+D1189 -> 10 | G1189: 2 | H1189: 14 | I1189: =G1189*6+H1189 -> 26 | K1189: 3 | L1189: 18 | M1189: =K1189*6+L1189 -> 36 | O1189: 5 | P1189: 22 | Q1189: =O1189*6+P1189 -> 52 | S1189: BEACH ROAD | W1189: PRESTON | X1189: 13 | Y1189: 6 | Z1189: 0 | AA1189: 1432 | AB1189: 1153 | AC1189: 124.19774501300954 | AD1189: 52
A1190: SANDRINGHAM | C1190: 2 | D1190: 4 | E1190: =C1190*6+D1190 -> 16 | G1190: 3 | H1190: 5 | I1190: =G1190*6+H1190 -> 23 | K1190: 6 | L1190: 5 | M1190: =K1190*6+L1190 -> 41 | O1190: 7 | P1190: 5 | Q1190: =O1190*6+P1190 -> 47 | S1190: IRVING | W1190: MOORABBIN | X1190: 12 | Y1190: 7 | Z1190: 0 | AA1190: 1459 | AB1190: 1132 | AC1190: 128.886925795053 | AD1190: 48
A1191: BEST PLAYERS | W1191: YARRAVILLE | X1191: 9 | Y1191: 10 | Z1191: 0 | AA1191: 1245 | AB1191: 1389 | AC1191: 89.632829373650111 | AD1191: 36
A1192: YARRAVILLE | C1192: DE JONG | F1192: GARRICK | I1192: WILD | K1192: JONES | N1192: CUFFE | Q1192: MARCHESI | W1192: SANDRINGHAM | X1192: 8 | Y1192: 11 | Z1192: 0 | AA1192: 1218 | AB1192: 1389 | AC1192: 87.688984881209507 | AD1192: 32
A1193: SANDRINGHAM | C1193: CROFT | F1193: QUINN | I1193: JONES | K1193: DAVIDSON | N1193: WEBSTER | Q1193: McKENZIE | W1193: COBURG | X1193: 7 | Y1193: 11 | Z1193: 1 | AA1193: 1604 | AB1193: 1594 | AC1193: 100.62735257214554 | AD1193: 30
A1194: GOALKICKERS | W1194: OAKLEIGH | X1194: 7 | Y1194: 11 | Z1194: 1 | AA1194: 1057 | AB1194: 1463 | AC1194: 72.248803827751203 | AD1194: 30
A1195: YARRAVILLE | C1195: SCHUMAN 3 | F1195: WILLIAMS | I1195: HUGHES | W1195: BRIGHTON | X1195: 5 | Y1195: 13 | Z1195: 1 | AA1195: 1278 | AB1195: 1686 | AC1195: 75.80071174377224 | AD1195: 22
A1196: SANDRINGHAM | C1196: DAVIDSON 2 | F1196: R HARPER 2 | I1196: JOHNSTON | L1196: VANCE | N1196: QUINN | W1196: CAMBERWELL | X1196: 5 | Y1196: 14 | Z1196: 0 | AA1196: 1142 | AB1196: 1622 | AC1196: 70.406905055487059 | AD1196: 20
W1197: NORTHCOTE | X1197: 4 | Y1197: 15 | Z1197: 0 | AA1197: 1020 | AB1197: 1306 | AC1197: 78.101071975497703 | AD1197: 16
A1198: COBURG | C1198: 7 | D1198: 3 | E1198: =C1198*6+D1198 -> 45 | G1198: 10 | H1198: 6 | I1198: =G1198*6+H1198 -> 66 | K1198: 15 | L1198: 7 | M1198: =K1198*6+L1198 -> 97 | O1198: 18 | P1198: 9 | Q1198: =O1198*6+P1198 -> 117 | S1198: COBURG | W1198: PRAHRAN | X1198: 3 | Y1198: 15 | Z1198: 1 | AA1198: 1111 | AB1198: 1732 | AC1198: 64.145496535796767 | AD1198: 14
A1199: OAKLEIGH | C1199: 1 | D1199: 1 | E1199: =C1199*6+D1199 -> 7 | G1199: 4 | H1199: 3 | I1199: =G1199*6+H1199 -> 27 | K1199: 5 | L1199: 5 | M1199: =K1199*6+L1199 -> 35 | O1199: 6 | P1199: 9 | Q1199: =O1199*6+P1199 -> 45 | S1199: CARDWELL
A1200: BEST PLAYERS
A1201: COBURG | C1201: L SMITH | F1201: L JONES | I1201: GOULLET | L1201: B JONES | O1201: CRAIG | Q1201: HEWES
A1202: OAKLEIGH | C1202: NEWPORT | F1202: DONOHUE | I1202: GRANT | L1202: ANDERSON | O1202: COLLINS | Q1202: ALWAY
A1203: GOALKICKERS
A1204: COBURG | C1204: HEWES 6 | F1204: H WILKINSON 3 | J1204: ROBINSON 3 | M1204: GOULLET 2 | P1204: B JONES 2 | S1204: L JONES | V1204: BOYLE
A1205: OAKLEIGH | C1205: ANDERSON 4 | F1205: ALWAY | I1205: BOURKE
A1207: BRUNSWICK | C1207: 3 | D1207: 0 | E1207: =C1207*6+D1207 -> 18 | G1207: 6 | H1207: 4 | I1207: =G1207*6+H1207 -> 40 | K1207: 10 | L1207: 5 | M1207: =K1207*6+L1207 -> 65 | O1207: 17 | P1207: 11 | Q1207: =O1207*6+P1207 -> 113 | S1207: BRUNSWICK
A1208: BRIGHTON | C1208: 3 | D1208: 4 | E1208: =C1208*6+D1208 -> 22 | G1208: 3 | H1208: 6 | I1208: =G1208*6+H1208 -> 24 | K1208: 7 | L1208: 7 | M1208: =K1208*6+L1208 -> 49 | O1208: 7 | P1208: 7 | Q1208: =O1208*6+P1208 -> 49 | S1208: GODING
A1209: BEST PLAYERS
A1210: BRUNSWICK | C1210: SKINNER | F1210: STANLEY | I1210: EDWARDS | L1210: WEIR | O1210: MULLENGER | R1210: CARROLL
A1211: BRIGHTON | C1211: FREEMAN | F1211: CURRIE | I1211: WILLIAMS | L1211: BROWNING | O1211: HART | R1211: MCCANN
A1212: GOALKICKERS
A1213: BRUNSWICK | C1213: SKINNER 5 | F1213: JAMES 4 | I1213: STANLEY 3 | L1213: LOVETT 2 | N1213: MASON | P1213: MULLENGER | S1213: McFARLANE
A1214: BRIGHTON | C1214: HART 2 | F1214: WEST 2 | H1214: DURKIN | J1214: BROWNING | M1214: DAVIS
A1216: PRESTON | C1216: 6 | D1216: 4 | E1216: =C1216*6+D1216 -> 40 | G1216: 8 | H1216: 6 | I1216: =G1216*6+H1216 -> 54 | K1216: 10 | L1216: 7 | M1216: =K1216*6+L1216 -> 67 | O1216: 12 | P1216: 10 | Q1216: =O1216*6+P1216 -> 82 | S1216: CAMBERWELL
A1217: CAMBERWELL | C1217: 1 | D1217: 7 | E1217: =C1217*6+D1217 -> 13 | G1217: 2 | H1217: 4 | I1217: =G1217*6+H1217 -> 16 | K1217: 3 | L1217: 5 | M1217: =K1217*6+L1217 -> 23 | O1217: 4 | P1217: 7 | Q1217: =O1217*6+P1217 -> 31 | S1217: ROACH
A1218: BEST PLAYERS
A1219: PRESTON | C1219: CROCKER | F1219: L SWEET | I1219: McBEAN | L1219: COOPER | N1219: McLACHLAN | Q1219: K CHARD
A1220: CAMBERWELL | C1220: MASON | F1220: BELL | I1220: ALLSOP | L1220: ROSS | N1220: I CLARKE | Q1220: McGUINNESS
A1221: GOALKICKERS
A1222: PRESTON | C1222: McBEAN 4 | F1222: F CHARD 3 | I1222: FOLEY 3 | K1222: K CHARD | M1222: CONSTABLE
A1223: CAMBERWELL | C1223: McGUINNESS 2 | F1223: COLEMAN 2
A1225: BOX HILL | C1225: 5 | D1225: 2 | E1225: =C1225*6+D1225 -> 32 | G1225: 6 | H1225: 3 | I1225: =G1225*6+H1225 -> 39 | K1225: 7 | L1225: 5 | M1225: =K1225*6+L1225 -> 47 | O1225: 10 | P1225: 6 | Q1225: =O1225*6+P1225 -> 66 | S1225: BOX HILL
A1226: NORTHCOTE | C1226: 0 | D1226: 3 | E1226: =C1226*6+D1226 -> 3 | G1226: 2 | H1226: 7 | I1226: =G1226*6+H1226 -> 19 | K1226: 4 | L1226: 7 | M1226: =K1226*6+L1226 -> 31 | O1226: 6 | P1226: 9 | Q1226: =O1226*6+P1226 -> 45 | S1226: BARNETT
A1227: BEST PLAYERS
A1228: BOX HILL | C1228: LOVE | E1228: LANNING | H1228: AUSTEN | K1228: SAWATSKY | N1228: PLUNKETT | Q1228: WHITE
A1229: NORTHCOTE | C1229: TULL | E1229: ALDRIDGE | H1229: FRANCIS | K1229: F VAINS | N1229: J VAINS | Q1229: COLLINS
A1230: GOALKICKERS
A1231: BOX HILL | C1231: SAWATSKY 3 | F1231: DEVERY 3 | I1231: PLUNKETT 2 | L1231: EADE | N1231: BROWN
A1232: NORTHCOTE | C1232: FRANCIS | F1232: PETERS | I1232: COLLINS | K1232: NEWMAN | N1232: DEVINE | P1232: WOOLNOUGH
A1234: MOORABBIN | C1234: 2 | D1234: 4 | E1234: =C1234*6+D1234 -> 16 | G1234: 10 | H1234: 10 | I1234: =G1234*6+H1234 -> 70 | K1234: 18 | L1234: 19 | M1234: =K1234*6+L1234 -> 127 | O1234: 23 | P1234: 22 | Q1234: =O1234*6+P1234 -> 160 | S1234: MOORABBIN
A1235: PRAHRAN | C1235: 1 | D1235: 2 | E1235: =C1235*6+D1235 -> 8 | G1235: 2 | H1235: 2 | I1235: =G1235*6+H1235 -> 14 | K1235: 2 | L1235: 2 | M1235: =K1235*6+L1235 -> 14 | O1235: 4 | P1235: 5 | Q1235: =O1235*6+P1235 -> 29 | S1235: BREWER
A1236: BEST PLAYERS
A1237: MOORABBIN | C1237: SCHOFIELD | F1237: K BOYD | I1237: MURRAY | L1237: MORONEY | O1237: DYNON | Q1237: MURPHY
A1238: PRAHRAN | C1238: SHILLABEER | F1238: WILSON | I1238: GAZE | L1238: ORCHARD | O1238: PEARSON | Q1238: CLEAR
A1239: GOALKICKERS
A1240: MOORABBIN | C1240: SCHOFIELD 13 | F1240: MORONEY 4 | I1240: WHALEBONE 3 | L1240: McGAW 2 | O1240: K BOYD
A1241: PRAHRAN | C1241: SHARP | E1241: ORCHARD | H1241: D KINNABURGH | K1241: GRAHAM
A1243: ROUND 20 | E1243: 1ST SEPTEMBER | K1243: WEATHER | N1243: NORTH WEST WIND | S1243: PLAYED AT
D1244: 1ST QTR | H1244: 2ND QTR | L1244: 3RD QTR | P1244: FINAL | S1244: PORT MELBOURNE
A1245: PORT MELBOURNE | C1245: 0 | D1245: 2 | E1245: =C1245*6+D1245 -> 2 | G1245: 4 | H1245: 9 | I1245: =G1245*6+H1245 -> 33 | K1245: 5 | L1245: 11 | M1245: =K1245*6+L1245 -> 41 | O1245: 7 | P1245: 16 | Q1245: =O1245*6+P1245 -> 58 | S1245: UMPIRE | X1245: LADDER | AB1245: ROUND | AD1245: 20
A1246: BRUNSWICK | C1246: 4 | D1246: 5 | E1246: =C1246*6+D1246 -> 29 | G1246: 5 | H1246: 5 | I1246: =G1246*6+H1246 -> 35 | K1246: 5 | L1246: 9 | M1246: =K1246*6+L1246 -> 39 | O1246: 6 | P1246: 10 | Q1246: =O1246*6+P1246 -> 46 | S1246: CARDWELL
A1247: BEST PLAYERS | W1247: TEAM | X1247: W | Y1247: L | Z1247: D | AA1247: FOR | AB1247: AGST | AC1247: % | AD1247: PTS
A1248: PORT MELBOURNE | C1248: JOHNSON | F1248: R ATKINSON | I1248: MILLER | L1248: E ATKINSON | O1248: RON YOUNG | R1248: METHERALL
A1249: BRUNSWICK | C1249: TAYLOR | F1249: MULLENGER | I1249: EDWARDS | L1249: LOVETT | O1249: ROLFS | R1249: YEA | W1249: WILLIAMSTOWN | X1249: 17 | Y1249: 3 | Z1249: 0 | AA1249: 1725 | AB1249: 1068 | AC1249: 161.51685393258427 | AD1249: 68
A1250: GOALKICKERS | W1250: PORT MELBOURNE | X1250: 16 | Y1250: 4 | Z1250: 0 | AA1250: 1847 | AB1250: 1187 | AC1250: 155.60235888795282 | AD1250: 64
A1251: PORT MELBOURNE | C1251: BONNETT 3 | F1251: MILLER 2 | I1251: STONE | K1251: McDONALD | W1251: BRUNSWICK | X1251: 14 | Y1251: 6 | Z1251: 0 | AA1251: 1637 | AB1251: 1260 | AC1251: 129.92063492063491 | AD1251: 56
A1252: BRUNSWICK | C1252: HAYES 2 | F1252: TAYLOR 2 | I1252: NEILSON | K1252: SKINNER | W1252: BOX HILL | X1252: 14 | Y1252: 6 | Z1252: 0 | AA1252: 1359 | AB1252: 1075 | AC1252: 126.41860465116279 | AD1252: 56
A1254: PRESTON | C1254: 1 | D1254: 0 | E1254: =C1254*6+D1254 -> 6 | G1254: 9 | H1254: 4 | I1254: =G1254*6+H1254 -> 58 | K1254: 11 | L1254: 5 | M1254: =K1254*6+L1254 -> 71 | O1254: 16 | P1254: 14 | Q1254: =O1254*6+P1254 -> 110 | S1254: PRESTON | W1254: PRESTON | X1254: 14 | Y1254: 6 | Z1254: 0 | AA1254: 1542 | AB1254: 1247 | AC1254: 123.65677626303128 | AD1254: 56
A1255: MOORABBIN | C1255: 6 | D1255: 2 | E1255: =C1255*6+D1255 -> 38 | G1255: 7 | H1255: 3 | I1255: =G1255*6+H1255 -> 45 | K1255: 13 | L1255: 8 | M1255: =K1255*6+L1255 -> 86 | O1255: 14 | P1255: 10 | Q1255: =O1255*6+P1255 -> 94 | S1255: IRVING | W1255: MOORABBIN | X1255: 12 | Y1255: 8 | Z1255: 0 | AA1255: 1553 | AB1255: 1242 | AC1255: 125.0402576489533 | AD1255: 48
A1256: BEST PLAYERS | W1256: SANDRINGHAM | X1256: 9 | Y1256: 11 | Z1256: 0 | AA1256: 1283 | AB1256: 1434 | AC1256: 89.470013947001391 | AD1256: 36
A1257: PRESTON | C1257: CROCKER | F1257: CUSACK | I1257: L SWEET | L1257: COOPER | O1257: LITTLE | Q1257: HAYES | W1257: YARRAVILLE | X1257: 9 | Y1257: 11 | Z1257: 0 | AA1257: 1280 | AB1257: 1470 | AC1257: 87.074829931972786 | AD1257: 36
A1258: MOORABBIN | C1258: A BOYD | F1258: McGAW | I1258: GILDER | L1258: SCHOFIELD | O1258: MORONEY | Q1258: PECK | W1258: COBURG | X1258: 7 | Y1258: 12 | Z1258: 1 | AA1258: 1655 | AB1258: 1647 | AC1258: 100.48573163327262 | AD1258: 30
A1259: GOALKICKERS | W1259: OAKLEIGH | X1259: 7 | Y1259: 12 | Z1259: 1 | AA1259: 1091 | AB1259: 1529 | AC1259: 71.353826030085017 | AD1259: 30
A1260: PRESTON | C1260: HAYES 4 | E1260: COOPER 3 | G1260: McBEAN 3 | J1260: F CHARD 3 | M1260: CONSTABLE | P1260: FOLEY | R1260: BLAKE | W1260: BRIGHTON | X1260: 6 | Y1260: 13 | Z1260: 1 | AA1260: 1343 | AB1260: 1743 | AC1260: 77.051061388410787 | AD1260: 26
A1261: MOORABBIN | C1261: SCHOFIELD 6 | F1261: McGAW 2 | I1261: HOGAN | K1261: MORONEY | M1261: K BOYD | O1261: HOUSTEN | Q1261: WHALEBONE | T1261: MANIE | W1261: CAMBERWELL | X1261: 5 | Y1261: 15 | Z1261: 0 | AA1261: 1199 | AB1261: 1687 | AC1261: 71.072910491997632 | AD1261: 20
W1262: PRAHRAN | X1262: 4 | Y1262: 15 | Z1262: 1 | AA1262: 1164 | AB1262: 1783 | AC1262: 65.283230510375773 | AD1262: 18
A1263: WILLIAMSTOWN | C1263: 0 | D1263: 3 | E1263: =C1263*6+D1263 -> 3 | G1263: 5 | H1263: 12 | I1263: =G1263*6+H1263 -> 42 | K1263: 6 | L1263: 14 | M1263: =K1263*6+L1263 -> 50 | O1263: 10 | P1263: 21 | Q1263: =O1263*6+P1263 -> 81 | S1263: YARRAVILLE | W1263: NORTHCOTE | X1263: 4 | Y1263: 16 | Z1263: 0 | AA1263: 1065 | AB1263: 1371 | AC1263: 77.680525164113789 | AD1263: 16
A1264: YARRAVILLE | C1264: 2 | D1264: 6 | E1264: =C1264*6+D1264 -> 18 | G1264: 2 | H1264: 7 | I1264: =G1264*6+H1264 -> 19 | K1264: 4 | L1264: 11 | M1264: =K1264*6+L1264 -> 35 | O1264: 4 | P1264: 11 | Q1264: =O1264*6+P1264 -> 35 | S1264: BARNETT
A1265: BEST PLAYERS
A1266: WILLIAMSTOWN | C1266: CALLAHAN | F1266: SMITH | I1266: LINTON | L1266: GEAR | N1266: WOOKEY | Q1266: CURRAN
A1267: YARRAVILLE | C1267: ROHLEDER | F1267: GARRICK | I1267: GARLICK | L1267: CUFFE | N1267: COOK | Q1267: MASON
A1268: GOALKICKERS
A1269: WILLIAMSTOWN | C1269: MURPHY 3 | F1269: SMITH 2 | I1269: LINTON | K1269: MARTIN | M1269: GEAR | N1269: CALLAHAN | Q1269: WOOKEY
A1270: YARRAVILLE | C1270: SCHUMAN 2 | F1270: CAREY 2
A1272: BOX HILL | C1272: 2 | D1272: 3 | E1272: =C1272*6+D1272 -> 15 | G1272: 2 | H1272: 15 | I1272: =G1272*6+H1272 -> 27 | K1272: 3 | L1272: 15 | M1272: =K1272*6+L1272 -> 33 | O1272: 8 | P1272: 18 | Q1272: =O1272*6+P1272 -> 66 | S1272: BOX HILL
A1273: OAKLEIGH | C1273: 1 | D1273: 1 | E1273: =C1273*6+D1273 -> 7 | G1273: 1 | H1273: 1 | I1273: =G1273*6+H1273 -> 7 | K1273: 4 | L1273: 4 | M1273: =K1273*6+L1273 -> 28 | O1273: 5 | P1273: 4 | Q1273: =O1273*6+P1273 -> 34 | S1273: ALLEN
A1274: BEST PLAYERS
A1275: BOX HILL | C1275: WRIGHT | E1275: GREEN | H1275: SAWATSKY | K1275: LOVE | N1275: DEVERY | Q1275: AUSTEN
A1276: OAKLEIGH | C1276: GRANT | E1276: GUY | H1276: I'ANSON | K1276: CAMM | N1276: COLLINS | Q1276: BOURKE
A1277: GOALKICKERS
A1278: BOX HILL | C1278: BROWN 2 | F1278: INGLETON 2 | I1278: BENNETT | K1278: EADE | M1278: STREET | O1278: DUNN
A1279: OAKLEIGH | C1279: GRANT 3 | F1279: MELVILLE | I1279: MOODY
A1281: BRIGHTON | C1281: 1 | D1281: 1 | E1281: =C1281*6+D1281 -> 7 | G1281: 4 | H1281: 5 | I1281: =G1281*6+H1281 -> 29 | K1281: 4 | L1281: 5 | M1281: =K1281*6+L1281 -> 29 | O1281: 9 | P1281: 11 | Q1281: =O1281*6+P1281 -> 65 | S1281: CAMBERWELL
A1282: CAMBERWELL | C1282: 1 | D1282: 4 | E1282: =C1282*6+D1282 -> 10 | G1282: 3 | H1282: 5 | I1282: =G1282*6+H1282 -> 23 | K1282: 6 | L1282: 9 | M1282: =K1282*6+L1282 -> 45 | O1282: 8 | P1282: 9 | Q1282: =O1282*6+P1282 -> 57 | S1282: ROWE
A1283: BEST PLAYERS
A1284: BRIGHTON | C1284: McCANN | F1284: GRIENKE | I1284: I DAVIDSON | L1284: STEVENS | O1284: CURRIE | R1284: PEARSON
A1285: CAMBERWELL | C1285: ROSS | F1285: NELSON | I1285: MASON | L1285: WATTS | O1285: McGUINNESS | R1285: K CLARKE
A1286: GOALKICKERS
A1287: BRIGHTON | C1287: BROWNING 3 | F1287: HART 2 | I1287: CURRIE | K1287: MILNES | M1287: STEVENS | O1287: PRETTY
A1288: CAMBERWELL | C1288: K CLARKE 3 | F1288: WATTS 2 | I1288: McGUINNESS 2 | L1288: ALLSOP
A1290: PRAHRAN | C1290: 4 | D1290: 3 | E1290: =C1290*6+D1290 -> 27 | G1290: 4 | H1290: 3 | I1290: =G1290*6+H1290 -> 27 | K1290: 6 | L1290: 5 | M1290: =K1290*6+L1290 -> 41 | O1290: 8 | P1290: 5 | Q1290: =O1290*6+P1290 -> 53 | S1290: TOORAK PARK
A1291: COBURG | C1291: 0 | D1291: 4 | E1291: =C1291*6+D1291 -> 4 | G1291: 3 | H1291: 12 | I1291: =G1291*6+H1291 -> 30 | K1291: 3 | L1291: 12 | M1291: =K1291*6+L1291 -> 30 | O1291: 6 | P1291: 15 | Q1291: =O1291*6+P1291 -> 51 | S1291: GODING
A1292: BEST PLAYERS
A1293: PRAHRAN | C1293: ROSS JONES | F1293: WILSON | I1293: ORCHARD | L1293: SHARP | N1293: MORROW | Q1293: D KINNABURGH
A1294: COBURG | C1294: B JONES | F1294: FEWKES | I1294: H WILKINSON | L1294: HEWES | N1294: BOYLE | Q1294: MAHONEY
A1295: GOALKICKERS
A1296: PRAHRAN | C1296: SHARP 4 | F1296: MORROW 2 | I1296: D KINNABURGH | M1296: ELLIOTT
A1297: COBURG | C1297: HEWES 2 | F1297: B JONES 2 | I1297: MAHONEY | L1297: H WILKINSON
A1299: SANDRINGHAM | C1299: 0 | D1299: 5 | E1299: =C1299*6+D1299 -> 5 | G1299: 2 | H1299: 7 | I1299: =G1299*6+H1299 -> 19 | K1299: 4 | L1299: 9 | M1299: =K1299*6+L1299 -> 33 | O1299: 9 | P1299: 11 | Q1299: =O1299*6+P1299 -> 65 | S1299: NORTHCOTE
A1300: NORTHCOTE | C1300: 2 | D1300: 3 | E1300: =C1300*6+D1300 -> 15 | G1300: 3 | H1300: 9 | I1300: =G1300*6+H1300 -> 27 | K1300: 4 | L1300: 8 | M1300: =K1300*6+L1300 -> 32 | O1300: 6 | P1300: 9 | Q1300: =O1300*6+P1300 -> 45 | S1300: E BREWER
A1301: BEST PLAYERS
A1302: SANDRINGHAM | C1302: JONES | E1302: STEWART | H1302: CONNINGSBY | K1302: CROFT | N1302: VANCE | Q1302: DAVIDSON
A1303: NORTHCOTE | C1303: GIBBS | E1303: FRANCIS | H1303: F VAINS | K1303: TULL | N1303: J VAINS | Q1303: COLLINS
A1304: GOALKICKERS
A1305: SANDRINGHAM | C1305: DAVIDSON 4 | F1305: BOLAND 3 | I1305: RANSOM | L1305: VANCE
A1306: NORTHCOTE | C1306: GIBBS 3 | F1306: PETERS | I1306: DEVINE | L1306: COLLINS
A1308: FINALS
A1309: 1ST SEMI | D1309: 8TH SEPTEMBER | J1309: WEATHER | M1309: SOUTH EAST BREEZE
D1310: 1ST QTR | H1310: 2ND QTR | L1310: 3RD QTR | P1310: FINAL
A1311: BOX HILL | C1311: 1 | D1311: 1 | E1311: =C1311*6+D1311 -> 7 | G1311: 10 | H1311: 6 | I1311: =G1311*6+H1311 -> 66 | K1311: 11 | L1311: 8 | M1311: =K1311*6+L1311 -> 74 | O1311: 15 | P1311: 15 | Q1311: =O1311*6+P1311 -> 105 | S1311: JUNCTION OAVL
A1312: BRUNSWICK | C1312: 3 | D1312: 5 | E1312: =C1312*6+D1312 -> 23 | G1312: 3 | H1312: 9 | I1312: =G1312*6+H1312 -> 27 | K1312: 7 | L1312: 15 | M1312: =K1312*6+L1312 -> 57 | O1312: 12 | P1312: 18 | Q1312: =O1312*6+P1312 -> 90 | S1312: CARDWELL
A1313: BEST PLAYERS
A1314: BOX HILL | C1314: DUNN | E1314: BENNETT | H1314: NICHOLSON | K1314: HOUGHTON | N1314: INGLETON | Q1314: AUSTEN
A1315: BRUNSWICK | C1315: NEILSON | E1315: ROLFS | H1315: STANLEY | K1315: MULLENGER | N1315: TAYLOR | Q1315: HAYES
A1316: GOALKICKERS
A1317: BOX HILL | C1317: DUNN 5 | F1317: BROWN 5 | I1317: INGLETON 2 | L1317: PLUNKETT | N1317: BENNETT | Q1317: SAWATSKY
A1318: BRUNSWICK | C1318: HAYES 6 | F1318: WEIR 2 | I1318: TAYLOR 2 | L1318: MASON | N1318: STANLEY | Q1318: DEAS
A1320: 2ND SEMI | D1320: 15TH SEPTEMBER | J1320: WEATHER | M1320: SOUTH BREEZE FINE & SUNNY
A1321: PORT MELBOURNE | C1321: 2 | D1321: 4 | E1321: =C1321*6+D1321 -> 16 | G1321: 3 | H1321: 8 | I1321: =G1321*6+H1321 -> 26 | K1321: 8 | L1321: 13 | M1321: =K1321*6+L1321 -> 61 | O1321: 12 | P1321: 15 | Q1321: =O1321*6+P1321 -> 87 | S1321: JUNCTION OAVL
A1322: WILLIAMSTOWN | C1322: 0 | D1322: 3 | E1322: =C1322*6+D1322 -> 3 | G1322: 4 | H1322: 6 | I1322: =G1322*6+H1322 -> 30 | K1322: 7 | L1322: 7 | M1322: =K1322*6+L1322 -> 49 | O1322: 10 | P1322: 13 | Q1322: =O1322*6+P1322 -> 73 | S1322: IRVING
A1323: BEST PLAYERS
A1324: PORT MELBOURNE | C1324: WITHERS | F1324: JOHNSON | I1324: HARVEY | L1324: MILLER | N1324: BONNETT | Q1324: LAFFEY
A1325: WILLIAMSTOWN | C1325: OUTEN | F1325: LINTON | I1325: CALLAHAN | L1325: BEITZEL | N1325: KENT | Q1325: GEAR
A1326: GOALKICKERS
A1327: PORT MELBOURNE | C1327: BONNETT 3 | F1327: HARVEY 2 | I1327: LEWIS 2 | K1327: WITHERS | M1327: MILLER | O1327: ALLEN | Q1327: KERR | S1327: McDONALD
A1328: WILLIAMSTOWN | C1328: McPHERSON 4 | F1328: LINTON 2 | I1328: FISHER | K1328: GEAR | M1328: REED | O1328: SMITH
A1330: PRELIMINARY FINAL | G1330: 22ND SPTEMBER | L1330: WEATHER | O1330: SOUTH WEST WIND COLD SHOWERS
A1331: WILLIAMSTOWN | C1331: 4 | D1331: 4 | E1331: =C1331*6+D1331 -> 28 | G1331: 5 | H1331: 5 | I1331: =G1331*6+H1331 -> 35 | K1331: 10 | L1331: 8 | M1331: =K1331*6+L1331 -> 68 | O1331: 12 | P1331: 14 | Q1331: =O1331*6+P1331 -> 86 | S1331: JUNCTION OAVL
A1332: BOX HILL | C1332: 2 | D1332: 4 | E1332: =C1332*6+D1332 -> 16 | G1332: 5 | H1332: 10 | I1332: =G1332*6+H1332 -> 40 | K1332: 6 | L1332: 16 | M1332: =K1332*6+L1332 -> 52 | O1332: 8 | P1332: 16 | Q1332: =O1332*6+P1332 -> 64 | S1332: CARDWELL
A1333: BEST PLAYERS
A1334: WILLIAMSTOWN | C1334: LINTON | F1334: MUNDAY | I1334: WOOKEY | L1334: BEITZEL | O1334: CALLAHAN | R1334: REED
A1335: BOX HILL | C1335: LOVE | F1335: BENNETT | I1335: DUNN | L1335: INGLETON | O1335: WHITE | R1335: WRIGHT
A1336: GOALKICKERS
A1337: WILLIAMSTOWN | C1337: LINTON 3 | F1337: McPHERSON 3 | I1337: CALLAHAN | L1337: OUTEN | N1337: FISHER | P1337: GEAR | R1337: R SMITH | U1337: WOOKEY
A1338: BOX HILL | C1338: BROWN 3 | F1338: INGLETON 2 | I1338: DUNN | K1338: BENNETT | M1338: EADE
A1340: GRAND FINAL | E1340: 29TH SEPTEMBER | J1340: WEATHER | M1340: SOUTH WEST BREEZE FINE
A1341: WILLIAMSTOWN | C1341: 3 | D1341: 1 | E1341: 19 | G1341: 8 | H1341: 5 | I1341: 53 | K1341: 8 | L1341: 10 | M1341: 58 | O1341: 14 | P1341: 18 | Q1341: =O1341*6+P1341 -> 102 | S1341: JUNCTION OAVL
A1342: PORT MELBOURNE | C1342: 5 | D1342: 6 | E1342: 36 | G1342: 8 | H1342: 11 | I1342: 59 | K1342: 9 | L1342: 14 | M1342: 68 | O1342: 10 | P1342: 18 | Q1342: =O1342*6+P1342 -> 78 | S1342: IRVING
A1343: BEST PLAYERS
A1344: WILLIAMSTOWN | C1344: SMITH | F1344: McPHERSON | I1344: FISHER | K1344: MUNDAY | N1344: LAURIE | Q1344: CURRAN
A1345: PORT MELBOURNE | C1345: JOHNSON | F1345: COLLINS | I1345: SYKES | K1345: STONE | N1345: WHARTON | Q1345: WITHERS
A1346: GOALKICKERS
A1347: WILLIAMSTOWN | C1347: McPHERSON 6 | F1347: GEAR 2 | I1347: LINTON | K1347: FISHER | M1347: WOOKEY | O1347: REED | Q1347: SMITH | S1347: CALLAHAN
A1348: PORT MELBOURNE | C1348: BONNETT 4 | F1348: JOHNSON | I1348: SYKES | K1348: MILLER | M1348: HARVEY | O1348: COLLINS | Q1348: McDONALD
A1351: YEAR 1956 | D1351: CARNIVAL | I1351: 14TH JUNE
A1352: ROUND 1 | D1352: 1ST QTR | H1352: 2ND QTR | L1352: 3RD QTR | P1352: FINAL
A1353: S.A. | C1353: 6 | D1353: 3 | E1353: =(C1353*6+D1353) -> 39 | G1353: 7 | H1353: 5 | I1353: =(G1353*6+H1353) -> 47 | K1353: 14 | L1353: 13 | M1353: =(K1353*6+L1353) -> 97 | O1353: 16 | P1353: 14 | Q1353: =(O1353*6+P1353) -> 110 | S1353: SUBIACO
A1354: V.F.A. | C1354: 1 | D1354: 1 | E1354: =(C1354*6+D1354) -> 7 | G1354: 7 | H1354: 7 | I1354: =(G1354*6+H1354) -> 49 | K1354: 7 | L1354: 8 | M1354: =(K1354*6+L1354) -> 50 | O1354: 11 | P1354: 10 | Q1354: =(O1354*6+P1354) -> 76 | S1354: ALDERMAN (S.A.)
A1355: BEST PLAYERS
A1356: S.A. | C1356: F WILLIAMS | F1356: G WILLIAMS | I1356: THOMPSON | L1356: MOTLEY | N1356: HEAD | Q1356: RATTIGAR
A1357: V.F.A. | C1357: JOHNSON | F1357: ROLFS | I1357: JONES | L1357: GILDER | N1357: GIBBS | Q1357: McBROOM
A1358: GOALKICKERS
A1359: S.A. | C1359: HEAD 5 | E1359: F WILLIAMS 4 | H1359: ZUCKER 2 | J1359: DAVIES 2 | M1359: LINDNER | O1359: MOTLEY | Q1359: THOMPSON
A1360: V.F.A. | C1360: GIBBS 3 | E1360: BONNETT 3 | H1360: McBROOM 2 | K1360: McGUINNESS | N1360: MAHONEY | Q1360: JONES
J1362: TEAMS
F1363: V.F.A. | P1363: S.A
A1364: BACKS | C1364: OUTEN | F1364: ROLFS | I1364: A MURPHY | M1364: COSTELLO | P1364: ABLEY | S1364: G WILLIAMS
A1365: H-BACKS | C1365: GILDER | F1365: CALLAHAN | I1365: CURRAN | M1365: ASHLEY | P1365: McCANN | S1365: AISH
A1366: CENTRES | C1366: COOPER | F1366: JONES | I1366: BOYD | M1366: EGLINGTON | P1366: HEAD | S1366: THOMPSON
A1367: H-FORWARDS | C1367: GUNN | F1367: FOLEY | I1367: HEWES | M1367: DAVIES | P1367: FOEHSE | S1367: MOTLEY
A1368: FORWARDS | C1368: SHARP | F1368: BONNETT | I1368: GIBBS | M1368: BLAND | P1368: LINDNER | S1368: BUNTON
A1369: RUCKS | C1369: JOHNSON | F1369: FRASER | I1369: McBROOM | M1369: ZUCKER | P1369: WHELAN | S1369: F WILLIAMS
A1370: RES | C1370: MAHONEY | F1370: McGUINNESS | M1370: RATTIGAN | P1370: FOSDIKE
A1372: MATCH 2 | F1372: 16TH JUNE
A1373: V.F.L. | C1373: 6 | D1373: 3 | E1373: =(C1373*6+D1373) -> 39 | G1373: 9 | H1373: 7 | I1373: =(G1373*6+H1373) -> 61 | K1373: 16 | L1373: 13 | M1373: =(K1373*6+L1373) -> 109 | O1373: 21 | P1373: 17 | Q1373: =(O1373*6+P1373) -> 143 | S1373: SUBIACO
A1374: V.F.A. | C1374: 1 | D1374: 1 | E1374: =(C1374*6+D1374) -> 7 | G1374: 3 | H1374: 3 | I1374: =(G1374*6+H1374) -> 21 | K1374: 3 | L1374: 3 | M1374: =(K1374*6+L1374) -> 21 | O1374: 3 | P1374: 5 | Q1374: =(O1374*6+P1374) -> 23 | S1374: M HALL (S.A.)
A1375: BEST PLAYERS
A1376: V.F.L. | C1376: WRIGHT | F1376: HUTCHISON | I1376: S SPENCER | L1376: PIANTO | O1376: CHICK | R1376: WHITTEN
A1377: V.F.A. | C1377: HOUGHTON | F1377: CURRAN | I1377: WEIR | L1377: JOHNSON | O1377: SHILLABEER | R1377: JONES
A1378: GOALKICKERS
A1379: V.F.L. | C1379: J SPENCER 6 | F1379: HUTCHISON 6 | I1379: S SPENCER 3 | L1379: GUNN 2 | N1379: BARASSI | P1379: WOODLEY
A1380: V.F.A. | C1380: HOUGHTON | F1380: MURPHY | I1380: WEIR
J1382: TEAMS
F1383: V.F.A. | P1383: V.F.L.
A1384: BACKS | C1384: OUTEN | F1384: ROLFS | I1384: MAHONEY | M1384: STEPHEN | P1384: GOLDSMITH | S1384: GALE
A1385: H-BACKS | C1385: SHILLABEER | F1385: GILDER | I1385: CURRAN | M1385: JAMES | P1385: ROBERTS | S1385: ROWE
A1386: CENTRES | C1386: COOPER | F1386: JONES | I1386: SHEARER | M1386: CHICK | P1386: BOX | S1386: O'NEILL
A1387: H-FORWARDS | C1387: GUNN | F1387: FOLEY | I1387: HEWES | M1387: GUNN | P1387: WHITTEN | S1387: S SPENCER
A1388: FORWARDS | C1388: WEIR | F1388: BONNETT | I1388: HOUGHTON | M1388: WEIDEMAN | P1388: J SPENCER | S1388: PIANTO
A1389: RUCKS | C1389: JOHNSON | F1389: MURPHY | I1389: McBROOM | M1389: WRIGHT | P1389: BARASSI | S1389: HUTCHISON
A1390: RES | C1390: GUY | F1390: McGUINNESS | M1390: WOODLEY | P1390: SIMMONDS
A1393: MATCH 3 | F1393: 19TH JUNE
A1394: TASMANIA | C1394: 8 | D1394: 7 | E1394: =(C1394*6+D1394) -> 55 | G1394: 15 | H1394: 8 | I1394: =(G1394*6+H1394) -> 98 | K1394: 23 | L1394: 16 | M1394: =(K1394*6+L1394) -> 154 | O1394: 27 | P1394: 22 | Q1394: =(O1394*6+P1394) -> 184 | S1394: SUBIACO
A1395: V.F.A. | C1395: 2 | D1395: 3 | E1395: =(C1395*6+D1395) -> 15 | G1395: 7 | H1395: 8 | I1395: =(G1395*6+H1395) -> 50 | K1395: 10 | L1395: 8 | M1395: =(K1395*6+L1395) -> 68 | O1395: 12 | P1395: 12 | Q1395: =(O1395*6+P1395) -> 84
A1396: BEST PLAYERS
A1397: TASMANIA | C1397: GARWOOD | F1397: WEBB | I1397: ROSE | L1397: STOKES | O1397: LONG | Q1397: CONLAN
A1398: V.F.A. | C1398: CURRAN | F1398: HOUGHTON | I1398: WEIR | L1398: McBROOM | O1398: OUTEN | Q1398: HEWES
A1399: GOALKICKERS
A1400: TASMANIA | C1400: GARWOOD 7 | F1400: CARIS 5 | I1400: GRIFFITHS 3 | L1400: ROSS 3 | N1400: WEBB 3 | P1400: LOH 2 | R1400: LONG 2 | U1400: YOST | W1400: MOORE
A1401: V.F.A. | C1401: BONNETT 4 | F1401: McBROOM 3 | I1401: WEIR 3 | K1401: HOUGHTON | N1401: HEWES
A1403: MATCH 4 | F1403: 21ST JUNE
A1404: W.A. | C1404: 4 | D1404: 5 | E1404: =(C1404*6+D1404) -> 29 | G1404: 13 | H1404: 11 | I1404: =(G1404*6+H1404) -> 89 | K1404: 19 | L1404: 17 | M1404: =(K1404*6+L1404) -> 131 | O1404: 22 | P1404: 20 | Q1404: =(O1404*6+P1404) -> 152 | S1404: SUBIACO
A1405: V.F.A. | C1405: 5 | D1405: 3 | E1405: =(C1405*6+D1405) -> 33 | G1405: 7 | H1405: 5 | I1405: =(G1405*6+H1405) -> 47 | K1405: 7 | L1405: 9 | M1405: =(K1405*6+L1405) -> 51 | O1405: 9 | P1405: 15 | Q1405: =(O1405*6+P1405) -> 69
A1406: BEST PLAYERS
A1407: W.A. | C1407: HOWARD | F1407: KETTLEWELL | I1407: FARMER
A1408: V.F.A. | C1408: FOLEY | F1408: JOHNSON | I1408: BOYD
A1409: GOALKICKERS
A1410: W.A. | C1410: HOWARD 4 | F1410: KETTLEWELL 4 | J1410: GEROVITCH 4 | M1410: WALKER 2 | P1410: FARMER 2 | R1410: ALLEN
A1411: V.F.A. | C1411: FOLEY 2 | F1411: McGUINNESS 2 | J1411: HOUGHTON 2 | M1411: McBROOM | O1411: SHARP | Q1411: BONNETT
F1413: V.F.A. TEAM
A1414: BACKS | C1414: GUNN | F1414: ROLFS | I1414: FRASER
A1415: H-BACKS | C1415: SHILLABEER | F1415: GILDER | I1415: CURRAN
A1416: CENTRES | C1416: BOYD | F1416: JONES | I1416: COOPER
A1417: H-FORWARDS | C1417: MURPHY | F1417: FOLEY | I1417: SHEARER
A1418: FORWARDS | C1418: HOUGHTON | F1418: BONNETT | I1418: MCGUINNESS
A1419: RUCKS | C1419: JOHNSON | F1419: SHARP | I1419: McBROOM
A1420: RES | C1420: NONE