A1: Victorian Football Association
A2: Season 1957
A3: © Copyright Wal Williams | F3: First created: 2 November 2014
A4: Contact: joywalwi at gmail dot com | F4: Last updated: 27 January 2018 | W4: VFA Results and tables - Link to the main index page
A5: You are free to copy this document in whole or part provided that proper acknowledgement is given to the author. All rights reserved.
A7: YEAR 1957
A8: ROUND 1 | C8: 17TH APRIL (WED NIGHT) | S8: PLAYED AT
D9: 1ST QTR | H9: 2ND QTR | L9: 3RD QTR | P9: FINAL | S9: SOUTH MELBOURNE
A10: WILLIAMSTOWN | C10: 3 | D10: 1 | E10: =C10*6+D10 -> 19 | G10: 8 | H10: 3 | I10: =G10*6+H10 -> 51 | K10: 9 | L10: 6 | M10: =K10*6+L10 -> 60 | O10: 12 | P10: 10 | Q10: =O10*6+P10 -> 82 | S10: UMPIRE | X10: LADDER | AB10: ROUND | AD10: 1
A11: MOORABBIN | C11: 5 | D11: 2 | E11: =C11*6+D11 -> 32 | G11: 6 | H11: 7 | I11: =G11*6+H11 -> 43 | K11: 7 | L11: 10 | M11: =K11*6+L11 -> 52 | O11: 9 | P11: 12 | Q11: =O11*6+P11 -> 66 | S11: IRVING
A12: BEST PLAYERS | W12: TEAM | X12: W | Y12: L | Z12: D | AA12: FOR | AB12: AGST | AC12: % | AD12: PTS
A13: WILLIAMSTOWN | C13: WARD | F13: CALLAHAN | I13: MARTIN | L13: R JONES | O13: GEAR | R13: REED
A14: MOORABBIN | C14: MORONEY | F14: MURPHY | I14: K BOYD | L14: PECK | O14: SCHOFIELD | R14: MANIE | W14: PORT MELBOURNE | X14: 1 | Y14: 0 | Z14: 0 | AA14: 152 | AB14: 26 | AC14: 584.62 | AD14: 4
A15: GOALKICKERS | W15: BRUNSWICK | X15: 1 | Y15: 0 | Z15: 0 | AA15: 120 | AB15: 38 | AC15: 315.78947368421052 | AD15: 4
A16: WILLIAMSTOWN | C16: McPHERSON 3 | F16: WARD 3 | I16: CALLAHAN 2 | L16: REED 2 | N16: T JONES | Q16: GEAR | W16: PRESTON | X16: 1 | Y16: 0 | Z16: 0 | AA16: 72 | AB16: 42 | AC16: 171.42857142857142 | AD16: 4
A17: MOORABBIN | C17: SCHOFIELD 4 | F17: BULMER 2 | I17: MORONEY | L17: MURPHY | N17: WHALEBONE | W17: COBURG | X17: 1 | Y17: 0 | Z17: 0 | AA17: 106 | AB17: 63 | AC17: 168.25396825396825 | AD17: 4
C18: 20TH APRIL (EASTER SAT) | J18: WEATHER | M18: NORTH WEST WIND RAIN 3RD QTR
A19: PORT MELBOURNE | C19: 5 | D19: 4 | E19: =C19*6+D19 -> 34 | G19: 9 | H19: 5 | I19: =G19*6+H19 -> 59 | K19: 16 | L19: 15 | M19: =K19*6+L19 -> 111 | O19: 22 | P19: 20 | Q19: =O19*6+P19 -> 152 | S19: PORT MELBOURNE | W19: YARRAVILLE | X19: 1 | Y19: 0 | Z19: 0 | AA19: 82 | AB19: 55 | AC19: 149.09090909090909 | AD19: 4
A20: OAKLEIGH | C20: 0 | D20: 1 | E20: =C20*6+D20 -> 1 | G20: 1 | H20: 4 | I20: =G20*6+H20 -> 10 | K20: 2 | L20: 6 | M20: =K20*6+L20 -> 18 | O20: 3 | P20: 8 | Q20: =O20*6+P20 -> 26 | S20: BREWER | W20: WILLIAMSTOWN | X20: 1 | Y20: 0 | Z20: 0 | AA20: 82 | AB20: 66 | AC20: 124.24242424242425 | AD20: 4
A21: BEST PLAYERS | W21: BRIGHTON | X21: 1 | Y21: 0 | Z21: 0 | AA21: 61 | AB21: 56 | AC21: 108.92857142857143 | AD21: 4
A22: PORT MELBOURNE | C22: THOMPSON | F22: SYKES | I22: WITHERS | L22: BONNETT | O22: R ATKINSON | R22: MORRIS | W22: BOX HILL | X22: 0 | Y22: 1 | Z22: 0 | AA22: 56 | AB22: 61 | AC22: 91.803278688524586 | AD22: 0
A23: OAKLEIGH | C23: LONGNEY | F23: HORLEY | I23: BAPTIST | L23: BACKMAN | O23: KITTO | R23: B WILLIAMS | W23: MOORABBIN | X23: 0 | Y23: 1 | Z23: 0 | AA23: 66 | AB23: 82 | AC23: 80.487804878048777 | AD23: 0
A24: GOALKICKERS | N24: LANDORFF | Q24: BRAGG | W24: NORTHCOTE | X24: 0 | Y24: 1 | Z24: 0 | AA24: 55 | AB24: 82 | AC24: 67.073170731707322 | AD24: 0
A25: PORT MELBOURNE | C25: BONNETT 8 | F25: SYKES 4 | I25: THOMPSON 2 | L25: MORRIS 2 | O25: KERR 2 | Q25: WITHERS | S25: MITCHELL | W25: CAMBERWELL | X25: 0 | Y25: 1 | Z25: 0 | AA25: 63 | AB25: 106 | AC25: 59.433962264150942 | AD25: 0
A26: OAKLEIGH | C26: LONGNEY | F26: McGOWAN | I26: COUGHLAN | W26: SANDRINGHAM | X26: 0 | Y26: 1 | Z26: 0 | AA26: 42 | AB26: 72 | AC26: 58.333333333333336 | AD26: 0
W27: PRAHRAN | X27: 0 | Y27: 1 | Z27: 0 | AA27: 38 | AB27: 120 | AC27: 31.666666666666668 | AD27: 0
A28: YARRAVILLE | C28: 4 | D28: 9 | E28: =C28*6+D28 -> 33 | G28: 4 | H28: 10 | I28: =G28*6+H28 -> 34 | K28: 9 | L28: 14 | M28: =K28*6+L28 -> 68 | O28: 11 | P28: 16 | Q28: =O28*6+P28 -> 82 | S28: YARRAVILLE | W28: OAKLEIGH | X28: 0 | Y28: 1 | Z28: 0 | AA28: 26 | AB28: 152 | AC28: 17.11 | AD28: 0
A29: NORTHCOTE | C29: 0 | D29: 0 | E29: =C29*6+D29 -> 0 | G29: 5 | H29: 4 | I29: =G29*6+H29 -> 34 | K29: 6 | L29: 7 | M29: =K29*6+L29 -> 43 | O29: 7 | P29: 13 | Q29: =O29*6+P29 -> 55 | S29: ROWE
A30: BEST PLAYERS
A31: YARRAVILLE | C31: ROHLEDER | F31: MASON | I31: HEMPEL | L31: WEBB | O31: SAID | R31: GARLICK
A32: NORTHCOTE | C32: FRANCIS | F32: GERVASONI | I32: F VAINS | L32: BARNES | O32: L WALKER | R32: LOTT
A33: GOALKICKERS
A34: YARRAVILLE | C34: SAID 4 | F34: WEBB 4 | I34: FRASER 2 | L34: HEMPEL
A35: NORTHCOTE | C35: G WALKER 2 | F35: GERVASONI 2 | J35: BARNES 2 | M35: DEVINE
C36: 22ND APRIL (EASTER MON) | J36: WEATHER | O36: WEST WIND DULL
A37: BRUNSWICK | C37: 2 | D37: 2 | E37: =C37*6+D37 -> 14 | G37: 7 | H37: 10 | I37: =G37*6+H37 -> 52 | K37: 9 | L37: 15 | M37: =K37*6+L37 -> 69 | O37: 17 | P37: 18 | Q37: =O37*6+P37 -> 120 | S37: BRUNSWICK
A38: PRAHRAN | C38: 3 | D38: 3 | E38: =C38*6+D38 -> 21 | G38: 3 | H38: 3 | I38: =G38*6+H38 -> 21 | K38: 4 | L38: 5 | M38: =K38*6+L38 -> 29 | O38: 5 | P38: 8 | Q38: =O38*6+P38 -> 38 | S38: ROBINSON
A39: BEST PLAYERS
A40: BRUNSWICK | C40: WEIR | F40: DILLON | I40: HAYES | L40: LOVETT | O40: EDWARDS | R40: R PHIPPS
A41: PRAHRAN | C41: MORROW | F41: HARVEY | I41: ROSS JONES | L41: BOYD | O41: HEAD | R41: SHILLABEER
A42: GOALKICKERS
A43: BRUNSWICK | C43: DILLON 3 | F43: HAYES 3 | I43: WEIR 3 | K43: MULLENGER 3 | N43: TAYLOR 2 | Q43: JARMAN | S43: DEAS | U43: R PHIPPS
A44: PRAHRAN | C44: McCOLL 2 | F44: SHILLABEER | I44: FRASER | K44: HARVEY
A46: BRIGHTON | C46: 1 | D46: 5 | E46: =C46*6+D46 -> 11 | G46: 4 | H46: 10 | I46: =G46*6+H46 -> 34 | K46: 5 | L46: 14 | M46: =K46*6+L46 -> 44 | O46: 7 | P46: 19 | Q46: =O46*6+P46 -> 61 | S46: ELSTERNWICK PARK
A47: BOX HILL | C47: 2 | D47: 4 | E47: =C47*6+D47 -> 16 | G47: 3 | H47: 5 | I47: =G47*6+H47 -> 23 | K47: 6 | L47: 11 | M47: =K47*6+L47 -> 47 | O47: 7 | P47: 14 | Q47: =O47*6+P47 -> 56 | S47: O'DONOGHUE
A48: BEST PLAYERS
A49: BRIGHTON | C49: CURRIE | F49: PRETTY | I49: HART | L49: MILNES | O49: STEVENS | R49: DURKIN
A50: BOX HILL | C50: WHITE | F50: LOVE | I50: DEVERY | L50: HOUGHTON | O50: IRVINE | R50: GREEN
A51: GOALKICKERS
A52: BRIGHTON | C52: HART 3 | F52: STEVENS | I52: WEST | K52: DALEY | N52: HORROCKS
A53: BOX HILL | C53: DEVERY 3 | F53: BROWN 2 | I53: DUNN | K53: INGLETON
A55: COBURG | C55: 6 | D55: 5 | E55: =C55*6+D55 -> 41 | G55: 9 | H55: 8 | I55: =G55*6+H55 -> 62 | K55: 12 | L55: 13 | M55: =K55*6+L55 -> 85 | O55: 15 | P55: 16 | Q55: =O55*6+P55 -> 106 | S55: CAMBERWELL
A56: CAMBERWELL | C56: 3 | D56: 3 | E56: =C56*6+D56 -> 21 | G56: 7 | H56: 8 | I56: =G56*6+H56 -> 50 | K56: 8 | L56: 10 | M56: =K56*6+L56 -> 58 | O56: 8 | P56: 15 | Q56: =O56*6+P56 -> 63 | S56: ROACH
A57: BEST PLAYERS
A58: COBURG | C58: SHAW | F58: WYMER | I58: WILSON | L58: GOULLET | O58: MAHONEY | R58: RUTLEDGE
A59: CAMBERWELL | C59: HEGARTY | F59: TEMPANY | I59: PROUDFOOT | L59: ROSS | O59: WATTS | R59: BOCK
A60: GOALKICKERS
A61: COBURG | C61: HEWES 6 | F61: JORDAN 3 | I61: SHAW 2 | K61: YOUNG | M61: JONES | O61: WYMER | Q61: J BRENNAN
A62: CAMBERWELL | C62: TEMPANY 3 | F62: McGUINNESS 2 | J62: HIGSON | L62: MASON | N62: CHAMBERS
A64: PRESTON | C64: 3 | D64: 8 | E64: =C64*6+D64 -> 26 | G64: 3 | H64: 11 | I64: =G64*6+H64 -> 29 | K64: 8 | L64: 16 | M64: =K64*6+L64 -> 64 | O64: 9 | P64: 18 | Q64: =O64*6+P64 -> 72 | S64: PRESTON
A65: SANDRINGHAM | C65: 2 | D65: 1 | E65: =C65*6+D65 -> 13 | G65: 3 | H65: 3 | I65: =G65*6+H65 -> 21 | K65: 4 | L65: 3 | M65: =K65*6+L65 -> 27 | O65: 6 | P65: 6 | Q65: =O65*6+P65 -> 42 | S65: CARDWELL
A66: BEST PLAYERS
A67: PRESTON | C67: SWEET | F67: FOOTE | I67: DAWSON | L67: MILLS | O67: BENNETTS | R67: SUPPLITT
A68: SANDRINGHAM | C68: McLEAN | F68: STEELE | I68: JOHNSTON | L68: CROFT | O68: JONES | R68: MURPHY
A69: GOALKICKERS
A70: PRESTON | C70: F CHARD 3 | F70: FOOTE 2 | I70: FOLEY | K70: MILLS | M70: SWEET | O70: BENNETTS
A71: SANDRINGHAM | C71: ECCLESTON 2 | G71: MURPHY 2 | J71: JOHNSTON | M71: STEELE
A73: ROUND 2 | C73: 24TH APRIL (WED NIGHT) | S73: PLAYED AT
D74: 1ST QTR | H74: 2ND QTR | L74: 3RD QTR | P74: FINAL | S74: S.M.
A75: WILLIAMSTOWN | C75: 1 | D75: 0 | E75: =C75*6+D75 -> 6 | G75: 4 | H75: 1 | I75: =G75*6+H75 -> 25 | K75: 6 | L75: 4 | M75: =K75*6+L75 -> 40 | O75: 9 | P75: 11 | Q75: =O75*6+P75 -> 65 | S75: UMPIRE | X75: LADDER | AB75: ROUND | AD75: 2
A76: PORT MELBOURNE | C76: 1 | D76: 5 | E76: =C76*6+D76 -> 11 | G76: 2 | H76: 9 | I76: =G76*6+H76 -> 21 | K76: 6 | L76: 12 | M76: =K76*6+L76 -> 48 | O76: 8 | P76: 15 | Q76: =O76*6+P76 -> 63 | S76: ROACH
A77: BEST PLAYERS | W77: TEAM | X77: W | Y77: L | Z77: D | AA77: FOR | AB77: AGST | AC77: % | AD77: PTS
A78: WILLIAMSTOWN | C78: CALLAHAN | F78: OUTEN | I78: RAMSAY | L78: GEAR | O78: SIMS | R78: E BEITZEL
A79: PORT MELBOURNE | C79: R ATKINSON | F79: METHERALL | I79: THOMPSON | L79: BONNETT | O79: JOHNSON | R79: SYKES | W79: BRUNSWICK | X79: 2 | Y79: 0 | Z79: 0 | AA79: 181 | AB79: 97 | AC79: 186.5979381443299 | AD79: 8
A80: GOALKICKERS | W80: PRESTON | X80: 2 | Y80: 0 | Z80: 0 | AA80: 199 | AB80: 107 | AC80: 185.98130841121494 | AD80: 8
A81: WILLIAMSTOWN | C81: CALLAHAN 2 | F81: McPHERSON 2 | J81: GEAR 2 | L81: WARD 2 | N81: SIMS | W81: COBURG | X81: 2 | Y81: 0 | Z81: 0 | AA81: 219 | AB81: 145 | AC81: 151.0344827586207 | AD81: 8
A82: PORT MELBOURNE | C82: BONNETT 4 | F82: THOMPSON | I82: WITHERS | K82: SYKES | M82: KERR | W82: YARRAVILLE | X82: 2 | Y82: 0 | Z82: 0 | AA82: 174 | AB82: 117 | AC82: 148.71794871794873 | AD82: 8
C83: 27TH APRIL | I83: WEATHER | M83: NORTH WEST WIND DULL
A84: COBURG | C84: 2 | D84: 1 | E84: =C84*6+D84 -> 13 | G84: 7 | H84: 13 | I84: =G84*6+H84 -> 55 | K84: 8 | L84: 16 | M84: =K84*6+L84 -> 64 | O84: 15 | P84: 23 | Q84: =O84*6+P84 -> 113 | S84: COBURG | W84: WILLIAMSTOWN | X84: 2 | Y84: 0 | Z84: 0 | AA84: 147 | AB84: 129 | AC84: 113.95348837209302 | AD84: 8
A85: BRIGHTON | C85: 4 | D85: 5 | E85: =C85*6+D85 -> 29 | G85: 5 | H85: 7 | I85: =G85*6+H85 -> 37 | K85: 10 | L85: 13 | M85: =K85*6+L85 -> 73 | O85: 11 | P85: 16 | Q85: =O85*6+P85 -> 82 | S85: ROWE | W85: PORT MELBOURNE | X85: 1 | Y85: 1 | Z85: 0 | AA85: 215 | AB85: 91 | AC85: 236.26 | AD85: 4
A86: BEST PLAYERS | W86: MOORABBIN | X86: 1 | Y86: 1 | Z86: 0 | AA86: 167 | AB86: 125 | AC86: 133.6 | AD86: 4
A87: COBURG | C87: JORDAN | F87: FEWKES | I87: SHAW | L87: JONES | O87: BIGELOW | R87: GOULLET | W87: CAMBERWELL | X87: 1 | Y87: 1 | Z87: 0 | AA87: 164 | AB87: 167 | AC87: 98.203592814371262 | AD87: 4
A88: BRIGHTON | C88: HART | F88: CRAIG | I88: McCANN | L88: STEVENS | O88: COLLINS | R88: L WILKINSON | W88: BRIGHTON | X88: 1 | Y88: 1 | Z88: 0 | AA88: 143 | AB88: 169 | AC88: 84.615384615384613 | AD88: 4
A89: GOALKICKERS | W89: BOX HILL | X89: 0 | Y89: 2 | Z89: 0 | AA89: 115 | AB89: 122 | AC89: 94.26229508196721 | AD89: 0
A90: COBURG | C90: HEWES 5 | F90: JORDAN 3 | I90: GOULLET 3 | L90: GILCHRIST 2 | O90: HUNTINGTON | R90: J BRENNAN | W90: NORTHCOTE | X90: 0 | Y90: 2 | Z90: 0 | AA90: 116 | AB90: 183 | AC90: 63.387978142076506 | AD90: 0
A91: BRIGHTON | C91: HART 5 | F91: WOOLSTENCROFT 2 | J91: DURKIN 2 | M91: WILKINSON | P91: CRAIG | W91: SANDRINGHAM | X91: 0 | Y91: 2 | Z91: 0 | AA91: 85 | AB91: 173 | AC91: 49.132947976878611 | AD91: 0
W92: PRAHRAN | X92: 0 | Y92: 2 | Z92: 0 | AA92: 103 | AB92: 247 | AC92: 41.700404858299592 | AD92: 0
A93: BRUNSWICK | C93: 2 | D93: 3 | E93: =C93*6+D93 -> 15 | G93: 6 | H93: 6 | I93: =G93*6+H93 -> 42 | K93: 7 | L93: 8 | M93: =K93*6+L93 -> 50 | O93: 8 | P93: 13 | Q93: =O93*6+P93 -> 61 | S93: BOX HILL | W93: OAKLEIGH | X93: 0 | Y93: 2 | Z93: 0 | AA93: 88 | AB93: 244 | AC93: 36.07 | AD93: 0
A94: BOX HILL | C94: 3 | D94: 0 | E94: =C94*6+D94 -> 18 | G94: 3 | H94: 3 | I94: =G94*6+H94 -> 21 | K94: 6 | L94: 8 | M94: =K94*6+L94 -> 44 | O94: 8 | P94: 11 | Q94: =O94*6+P94 -> 59 | S94: BREWER
A95: BEST PLAYERS
A96: BRUNSWICK | C96: ROLFS | F96: DEAS | I96: TAYLOR | L96: McFARLANE | O96: WHILEY | R96: MULLENGER
A97: BOX HILL | C97: LOVE | F97: IRVINE | I97: HOUGHTON | L97: DEVERY | O97: DUNN | R97: EADE
A98: GOALKICKERS
A99: BRUNSWICK | C99: TAYLOR 3 | F99: R PHIPPS 2 | I99: DEAS | K99: MULLENGER | N99: WEIR
A100: BOX HILL | C100: DUNN 2 | F100: DEVERY 2 | I100: INGLETON 2 | L100: PLUNKETT | O100: BROWN
A102: CAMBERWELL | C102: 4 | D102: 2 | E102: =C102*6+D102 -> 26 | G102: 9 | H102: 4 | I102: =G102*6+H102 -> 58 | K102: 11 | L102: 6 | M102: =K102*6+L102 -> 72 | O102: 15 | P102: 11 | Q102: =O102*6+P102 -> 101 | S102: NORTHCOTE
A103: NORTHCOTE | C103: 0 | D103: 2 | E103: =C103*6+D103 -> 2 | G103: 1 | H103: 10 | I103: =G103*6+H103 -> 16 | K103: 6 | L103: 15 | M103: =K103*6+L103 -> 51 | O103: 7 | P103: 19 | Q103: =O103*6+P103 -> 61 | S103: CARDWELL
A104: BEST PLAYERS
A105: CAMBERWELL | C105: ROSS | F105: HOLYOAK | I105: BOCK | L105: HIGSON | O105: PROUDFOOT | R105: McGUINNESS
A106: NORTHCOTE | C106: GERVASONI | F106: G WALKER | I106: L WALKER | L106: F VAINS | O106: STEPHENS | R106: DEVINE
A107: GOALKICKERS
A108: CAMBERWELL | C108: HIGSON 6 | F108: McGUINNESS 3 | J108: MASON 3 | M108: COLEMAN 2 | P108: CHAPLIN
A109: NORTHCOTE | C109: STEPHENS 3 | F109: G WALKER 2 | J109: GERVASONI 2
A111: MOORABBIN | C111: 1 | D111: 3 | E111: =C111*6+D111 -> 9 | G111: 6 | H111: 11 | I111: =G111*6+H111 -> 47 | K111: 8 | L111: 15 | M111: =K111*6+L111 -> 63 | O111: 13 | P111: 23 | Q111: =O111*6+P111 -> 101 | S111: BEACH ROAD
A112: SANDRINGHAM | C112: 3 | D112: 3 | E112: =C112*6+D112 -> 21 | G112: 3 | H112: 3 | I112: =G112*6+H112 -> 21 | K112: 5 | L112: 5 | M112: =K112*6+L112 -> 35 | O112: 6 | P112: 7 | Q112: =O112*6+P112 -> 43 | S112: ROBINSON
A113: BEST PLAYERS
A114: MOORABBIN | C114: STANLEY | F114: PECK | I114: MORONEY | L114: RENWICK | O114: R EVANS | R114: BOYD
A115: SANDRINGHAM | C115: McLEAN | F115: B THOMPSON | I115: WEBSTER | L115: GRANGER | O115: ALSOPP | R115: R EVANS
A116: GOALKICKERS
A117: MOORABBIN | C117: SCHOFIELD 7 | F117: McGAW 2 | I117: R EVANS | K117: BULMER | M117: CLOVER | O117: RENWICK
A118: SANDRINGHAM | C118: MURPHY 2 | F118: MARSHALL 2 | J118: BOLAND | M118: GRANGER
A120: YARRAVILLE | C120: 3 | D120: 4 | E120: =C120*6+D120 -> 22 | G120: 5 | H120: 8 | I120: =G120*6+H120 -> 38 | K120: 11 | L120: 14 | M120: =K120*6+L120 -> 80 | O120: 12 | P120: 20 | Q120: =O120*6+P120 -> 92 | S120: OAKLEIGH
A121: OAKLEIGH | C121: 4 | D121: 3 | E121: =C121*6+D121 -> 27 | G121: 5 | H121: 6 | I121: =G121*6+H121 -> 36 | K121: 7 | L121: 11 | M121: =K121*6+L121 -> 53 | O121: 8 | P121: 14 | Q121: =O121*6+P121 -> 62 | S121: IRVING
A122: BEST PLAYERS
A123: YARRAVILLE | C123: BOWLER | F123: DE JONG | I123: CARSON | L123: GARRICK | O123: ROHLEDER | R123: WEBB
A124: OAKLEIGH | C124: COLLINS | F124: COUGHLAN | I124: GRANT | L124: KITTO | O124: LONGNEY | R124: McGOWAN
A125: GOALKICKERS
A126: YARRAVILLE | C126: DRIVER 2 | F126: SAID 2 | H126: CARSON 2 | K126: DE JONG 2 | N126: ROHLEDER 2 | Q126: WEBB | S126: LIVINGSTONE
A127: OAKLEIGH | C127: LONGNEY 2 | F127: COUGHLAN 2 | J127: McGOWAN 2 | M127: B WILLIAMS | P127: GRANT
A129: PRESTON | C129: 1 | D129: 0 | E129: =C129*6+D129 -> 6 | G129: 10 | H129: 7 | I129: =G129*6+H129 -> 67 | K129: 11 | L129: 9 | M129: =K129*6+L129 -> 75 | O129: 19 | P129: 13 | Q129: =O129*6+P129 -> 127 | S129: TOORAK PARK
A130: PRAHRAN | C130: 3 | D130: 5 | E130: =C130*6+D130 -> 23 | G130: 3 | H130: 5 | I130: =G130*6+H130 -> 23 | K130: 7 | L130: 10 | M130: =K130*6+L130 -> 52 | O130: 9 | P130: 11 | Q130: =O130*6+P130 -> 65 | S130: O'DONOGHUE
A131: BEST PLAYERS
A132: PRESTON | C132: COOPER | F132: F CHARD | I132: FOLEY | L132: FOOTE | O132: LITTLE | R132: SWEET
A133: PRAHRAN | C133: BOYD | F133: FRASER | I133: HEALEY | L133: ROY JONES | O133: W JONES | R133: NORMINGTON
A134: GOALKICKERS
A135: PRESTON | C135: F CHARD 5 | F135: FOLEY 4 | I135: HOWARD 3 | L135: FOOTE 2 | N135: DAWSON 2 | Q135: COOPER | S135: McLACHLAN | W135: CUSACK
A136: PRAHRAN | C136: FRASER 3 | F136: CLEAR 2 | I136: HEALEY | K136: BOYD | M136: M WILSON | P136: RICKARDS
A138: ROUND 3 | C138: 1ST MAY (WED NIGHT) | S138: PLAYED AT
D139: 1ST QTR | H139: 2ND QTR | L139: 3RD QTR | P139: FINAL | S139: S.M.
A140: BRUNSWICK | C140: 7 | D140: 4 | E140: =C140*6+D140 -> 46 | G140: 8 | H140: 7 | I140: =G140*6+H140 -> 55 | K140: 11 | L140: 11 | M140: =K140*6+L140 -> 77 | O140: 12 | P140: 12 | Q140: =O140*6+P140 -> 84 | S140: UMPIRE | X140: LADDER | AB140: ROUND | AD140: 3
A141: COBURG | C141: 1 | D141: 2 | E141: =C141*6+D141 -> 8 | G141: 1 | H141: 10 | I141: =G141*6+H141 -> 16 | K141: 3 | L141: 12 | M141: =K141*6+L141 -> 30 | O141: 9 | P141: 18 | Q141: =O141*6+P141 -> 72 | S141: CARDWELL
A142: BEST PLAYERS | W142: TEAM | X142: W | Y142: L | Z142: D | AA142: FOR | AB142: AGST | AC142: % | AD142: PTS
A143: BRUNSWICK | C143: ROLFS | F143: TAYLOR | I143: WHILEY | L143: K DILLON | O143: STANLEY | R143: WEIR
A144: COBURG | C144: McCOLL | F144: JORDAN | I144: GOULLET | L144: WILKINSON | O144: B JONES | R144: BIGELOW | W144: BRUNSWICK | X144: 3 | Y144: 0 | Z144: 0 | AA144: 265 | AB144: 169 | AC144: 156.80473372781066 | AD144: 12
A145: GOALKICKERS | W145: WILLIAMSTOWN | X145: 3 | Y145: 0 | Z145: 0 | AA145: 246 | AB145: 174 | AC145: 141.37931034482759 | AD145: 12
A146: BRUNSWICK | C146: DEAS 4 | F146: TAYLOR 2 | I146: HAYES 2 | K146: K DILLON 2 | N146: J DILLON | Q146: McMAHON | W146: YARRAVILLE | X146: 3 | Y146: 0 | Z146: 0 | AA146: 246 | AB146: 184 | AC146: 133.69565217391303 | AD146: 12
A147: COBURG | C147: GOULLET 3 | F147: HEWES 2 | I147: WILKINSON 2 | L147: YOUNG | N147: JORDAN | W147: PRESTON | X147: 2 | Y147: 1 | Z147: 0 | AA147: 264 | AB147: 191 | AC147: 138.21989528795811 | AD147: 8
C148: 4TH MAY | I148: WEATHER | M148: SOUTH WEST BREEZE DULL
A149: YARRAVILLE | C149: 5 | D149: 2 | E149: =C149*6+D149 -> 32 | G149: 5 | H149: 5 | I149: =G149*6+H149 -> 35 | K149: 7 | L149: 10 | M149: =K149*6+L149 -> 52 | O149: 10 | P149: 12 | Q149: =O149*6+P149 -> 72 | S149: YARRAVILLE | W149: COBURG | X149: 2 | Y149: 1 | Z149: 0 | AA149: 291 | AB149: 229 | AC149: 127.07423580786026 | AD149: 8
A150: PORT MELBOURNE | C150: 2 | D150: 2 | E150: =C150*6+D150 -> 14 | G150: 2 | H150: 11 | I150: =G150*6+H150 -> 23 | K150: 5 | L150: 13 | M150: =K150*6+L150 -> 43 | O150: 8 | P150: 19 | Q150: =O150*6+P150 -> 67 | S150: O'DONOGHUE | W150: MOORABBIN | X150: 2 | Y150: 1 | Z150: 0 | AA150: 300 | AB150: 238 | AC150: 126.05042016806723 | AD150: 8
A151: BEST PLAYERS | W151: CAMBERWELL | X151: 2 | Y151: 1 | Z151: 0 | AA151: 244 | AB151: 224 | AC151: 108.92857142857143 | AD151: 8
A152: YARRAVILLE | C152: DE JONG | F152: BODSWORTH | I152: MASON | L152: MAGEE | O152: DIXON | R152: GARLICK | W152: PORT MELBOURNE | X152: 1 | Y152: 2 | Z152: 0 | AA152: 282 | AB152: 163 | AC152: 173.01 | AD152: 4
A153: PORT MELBOURNE | C153: JOHNSON | F153: WITHERS | I153: LEWIS | L153: R ATKINSON | O153: LANDORFF | R153: METHERALL | W153: BOX HILL | X153: 1 | Y153: 2 | Z153: 0 | AA153: 199 | AB153: 187 | AC153: 106.41711229946524 | AD153: 4
A154: GOALKICKERS | W154: NORTHCOTE | X154: 1 | Y154: 2 | Z154: 0 | AA154: 243 | AB154: 272 | AC154: 89.338235294117652 | AD154: 4
A155: YARRAVILLE | C155: BODSWORTH 4 | G155: DE JONG 2 | J155: BOURKE 2 | M155: CARSON | O155: MAGEE | W155: BRIGHTON | X155: 1 | Y155: 2 | Z155: 0 | AA155: 232 | AB155: 296 | AC155: 78.378378378378372 | AD155: 4
A156: PORT MELBOURNE | C156: BONNETT 3 | F156: LEWIS 2 | I156: COLLINS | K156: THOMPSON | N156: LAFFEY | W156: PRAHRAN | X156: 0 | Y156: 3 | Z156: 0 | AA156: 216 | AB156: 380 | AC156: 56.842105263157897 | AD156: 0
W157: SANDRINGHAM | X157: 0 | Y157: 3 | Z157: 0 | AA157: 130 | AB157: 272 | AC157: 47.794117647058826 | AD157: 0
A158: NORTHCOTE | C158: 2 | D158: 2 | E158: =C158*6+D158 -> 14 | G158: 6 | H158: 7 | I158: =G158*6+H158 -> 43 | K158: 10 | L158: 9 | M158: =K158*6+L158 -> 69 | O158: 19 | P158: 13 | Q158: =O158*6+P158 -> 127 | S158: ELSTERNWICK PARK | W158: OAKLEIGH | X158: 0 | Y158: 3 | Z158: 0 | AA158: 145 | AB158: 324 | AC158: 44.75 | AD158: 0
A159: BRIGHTON | C159: 4 | D159: 4 | E159: =C159*6+D159 -> 28 | G159: 7 | H159: 6 | I159: =G159*6+H159 -> 48 | K159: 11 | L159: 8 | M159: =K159*6+L159 -> 74 | O159: 13 | P159: 11 | Q159: =O159*6+P159 -> 89 | S159: ROACH
A160: BEST PLAYERS
A161: NORTHCOTE | C161: GERVASONI | F161: WRIGHT | I161: L WALKER | L161: POWELL | O161: FRANCIS | R161: G WALKER
A162: BRIGHTON | C162: MILNES | F162: HART | I162: CURRIE | L162: STEVENS | O162: MAY | R162: WILKINSON
A163: GOALKICKERS
A164: NORTHCOTE | C164: FRANCIS 5 | F164: G WALKER 4 | J164: WOOLNOUGH 4 | N164: GERVASONI 3 | R164: STEPHENS | T164: BARNES | W164: DRAKE
A165: BRIGHTON | C165: HART 4 | F165: WILKINSON 3 | J165: WOOLSTENCROFT 2 | O165: DURKIN 2 | R165: CRAIG | T165: WHITE
A167: BOX HILL | C167: 3 | D167: 1 | E167: =C167*6+D167 -> 19 | G167: 6 | H167: 2 | I167: =G167*6+H167 -> 38 | K167: 9 | L167: 7 | M167: =K167*6+L167 -> 61 | O167: 12 | P167: 12 | Q167: =O167*6+P167 -> 84 | S167: PRESTON
A168: PRESTON | C168: 2 | D168: 4 | E168: =C168*6+D168 -> 16 | G168: 6 | H168: 11 | I168: =G168*6+H168 -> 47 | K168: 6 | L168: 14 | M168: =K168*6+L168 -> 50 | O168: 8 | P168: 17 | Q168: =O168*6+P168 -> 65 | S168: IRVING
A169: BEST PLAYERS
A170: BOX HILL | C170: DEVERY | F170: STREET | I170: HOUGHTON | L170: BROWN | O170: EADE | R170: LOVE
A171: PRESTON | C171: SUPPLITT | F171: CUSACK | I171: COOPER | L171: RICHMAND | O171: HOWARD | R171: F CHARD
A172: GOALKICKERS
A173: BOX HILL | C173: DEVERY 3 | F173: STREET 3 | I173: INGLETON 2 | L173: HOUGHTON | O173: JOHNSON | Q173: ELSWORTH | S173: EADE
A174: PRESTON | C174: F CHARD 5 | F174: FOOTE | H174: LALOR | J174: FOLEY
A176: CAMBERWELL | C176: 2 | D176: 2 | E176: =C176*6+D176 -> 14 | G176: 5 | H176: 7 | I176: =G176*6+H176 -> 37 | K176: 7 | L176: 8 | M176: =K176*6+L176 -> 50 | O176: 11 | P176: 14 | Q176: =O176*6+P176 -> 80 | S176: CAMBERWELL
A177: OAKLEIGH | C177: 2 | D177: 3 | E177: =C177*6+D177 -> 15 | G177: 3 | H177: 4 | I177: =G177*6+H177 -> 22 | K177: 7 | L177: 8 | M177: =K177*6+L177 -> 50 | O177: 8 | P177: 9 | Q177: =O177*6+P177 -> 57 | S177: ROBINSON
A178: BEST PLAYERS
A179: CAMBERWELL | C179: HOLYOAK | F179: NELSON | I179: AMERY | L179: McGUINNESS | O179: COLEMAN | R179: ROSS
A180: OAKLEIGH | C180: D'ARCY | F180: LONGNEY | I180: COUGHLAN | L180: BASSETT | O180: B NICHOLSON | R180: COLLINS
A181: GOALKICKERS
A182: CAMBERWELL | C182: McGUINNESS 4 | F182: HIGSON 2 | I182: SKALBERG 2 | L182: ROSS | N182: SMITH | P182: AMERY
A183: OAKLEIGH | C183: COUGHLAN 3 | F183: NICHOLSON | I183: LONGNEY | K183: KITTO | M183: McGOWAN | P183: KELLETT
A185: MOORABBIN | C185: 8 | D185: 8 | E185: =C185*6+D185 -> 56 | G185: 11 | H185: 16 | I185: =G185*6+H185 -> 82 | K185: 14 | L185: 20 | M185: =K185*6+L185 -> 104 | O185: 18 | P185: 25 | Q185: =O185*6+P185 -> 133 | S185: MOORABBIN
A186: PRAHRAN | C186: 2 | D186: 0 | E186: =C186*6+D186 -> 12 | G186: 8 | H186: 3 | I186: =G186*6+H186 -> 51 | K186: 11 | L186: 13 | M186: =K186*6+L186 -> 79 | O186: 16 | P186: 17 | Q186: =O186*6+P186 -> 113 | S186: BREWER
A187: BEST PLAYERS
A188: MOORABBIN | C188: MANIE | F188: RENWICK | I188: MURPHY | L188: GREEN | O188: TREZISE | R188: EVANS
A189: PRAHRAN | C189: HARVEY | F189: McKENZIE | I189: MORROW | L189: McCULLOCH | O189: FRASER | R189: O'BRYAN
A190: GOALKICKERS
A191: MOORABBIN | C191: RENWICK 5 | F191: MCGAW 4 | I191: MURPHY 3 | L191: WHALEBONE 2 | P191: BOYD 2 | R191: MANIE | T191: BULMER
A192: PRAHRAN | C192: HARVEY 5 | F192: McCULLOCH 4 | J192: McKENZIE 3 | M192: M WILSON 2 | P192: McCOLL | R192: FRASER
A194: WILLIAMSTOWN | C194: 2 | D194: 2 | E194: =C194*6+D194 -> 14 | G194: 6 | H194: 10 | I194: =G194*6+H194 -> 46 | K194: 11 | L194: 12 | M194: =K194*6+L194 -> 78 | O194: 14 | P194: 15 | Q194: =O194*6+P194 -> 99 | S194: BEACH ROAD
A195: SANDRINGHAM | C195: 2 | D195: 2 | E195: =C195*6+D195 -> 14 | G195: 2 | H195: 3 | I195: =G195*6+H195 -> 15 | K195: 4 | L195: 6 | M195: =K195*6+L195 -> 30 | O195: 6 | P195: 9 | Q195: =O195*6+P195 -> 45 | S195: ROWE
A196: BEST PLAYERS
A197: WILLIAMSTOWN | C197: MARTIN | F197: RAMSAY | I197: REED | L197: WOODS | O197: McPHERSON | R197: R SMITH
A198: SANDRINGHAM | C198: ALSOPP | F198: CROFT | I198: THOMPSON | L198: MURPHY | O198: WINTERS | R198: WEBSTER
A199: GOALKICKERS
A200: WILLIAMSTOWN | C200: McPHERSON 6 | F200: SMITH 3 | I200: OUTEN 2 | L200: MARTIN | N200: R JONES | Q200: WOOKEY
A201: SANDRINGHAM | C201: ALSOPP 2 | F201: McNEIL | H201: MURPHY | J201: GRANGER | M201: ECCLESTON
A203: ROUND 4 | C203: 8TH MAY (WED NIGHT) | S203: PLAYED AT
D204: 1ST QTR | H204: 2ND QTR | L204: 3RD QTR | P204: FINAL | S204: S.M.
A205: COBURG | C205: 7 | D205: 2 | E205: =C205*6+D205 -> 44 | G205: 10 | H205: 9 | I205: =G205*6+H205 -> 69 | K205: 14 | L205: 11 | M205: =K205*6+L205 -> 95 | O205: 15 | P205: 19 | Q205: =O205*6+P205 -> 109 | S205: UMPIRE | X205: LADDER | AB205: ROUND | AD205: 4
A206: PRESTON | C206: 3 | D206: 1 | E206: =C206*6+D206 -> 19 | G206: 4 | H206: 5 | I206: =G206*6+H206 -> 29 | K206: 6 | L206: 12 | M206: =K206*6+L206 -> 48 | O206: 10 | P206: 13 | Q206: =O206*6+P206 -> 73 | S206: ROWE
A207: BEST PLAYERS | W207: TEAM | X207: W | Y207: L | Z207: D | AA207: FOR | AB207: AGST | AC207: % | AD207: PTS
A208: COBURG | C208: JORDAN | F208: BIGELOW | I208: SASSELLA | L208: FEWKES | O208: McCOLL | R208: HEWES
A209: PRESTON | C209: LITTLE | F209: COOPER | I209: RICKARDS | L209: CUSACK | O209: DAWSON | R209: WATT | W209: BRUNSWICK | X209: 4 | Y209: 0 | Z209: 0 | AA209: 382 | AB209: 223 | AC209: 171.30044843049328 | AD209: 16
A210: GOALKICKERS | W210: WILLIAMSTOWN | X210: 4 | Y210: 0 | Z210: 0 | AA210: 322 | AB210: 227 | AC210: 141.85022026431719 | AD210: 16
A211: COBURG | C211: HEWES 6 | F211: JORDAN 5 | I211: ROBINSON | L211: SHAW | N211: WILKINSON | Q211: J BRENNAN | W211: MOORABBIN | X211: 3 | Y211: 1 | Z211: 0 | AA211: 421 | AB211: 311 | AC211: 135.36977491961414 | AD211: 12
A212: PRESTON | C212: GLEESON 2 | F212: MILLS 2 | I212: FOLEY 2 | K212: LITTLE | M212: F CHARD | P212: LALOR | R212: DAWSON | W212: COBURG | X212: 3 | Y212: 1 | Z212: 0 | AA212: 400 | AB212: 302 | AC212: 132.4503311258278 | AD212: 12
C213: 11TH MAY | I213: WEATHER | M213: WEST BREEZE FINE
A214: WILLIAMSTOWN | C214: 3 | D214: 2 | E214: =C214*6+D214 -> 20 | G214: 6 | H214: 5 | I214: =G214*6+H214 -> 41 | K214: 9 | L214: 6 | M214: =K214*6+L214 -> 60 | O214: 11 | P214: 10 | Q214: =O214*6+P214 -> 76 | S214: WILLIAMSTOWN | W214: YARRAVILLE | X214: 3 | Y214: 1 | Z214: 0 | AA214: 299 | AB214: 260 | AC214: 115 | AD214: 12
A215: YARRAVILLE | C215: 2 | D215: 6 | E215: =C215*6+D215 -> 18 | G215: 2 | H215: 7 | I215: =G215*6+H215 -> 19 | K215: 5 | L215: 15 | M215: =K215*6+L215 -> 45 | O215: 6 | P215: 17 | Q215: =O215*6+P215 -> 53 | S215: ROBINSON | W215: PORT MELBOURNE | X215: 2 | Y215: 2 | Z215: 0 | AA215: 429 | AB215: 206 | AC215: 208.25 | AD215: 8
A216: BEST PLAYERS | W216: PRESTON | X216: 2 | Y216: 2 | Z216: 0 | AA216: 337 | AB216: 300 | AC216: 112.33333333333333 | AD216: 8
A217: WILLIAMSTOWN | C217: LAURIE | F217: CALLAHAN | I217: KENT | L217: SIMMS | O217: OUTEN | R217: E BEITZEL | W217: CAMBERWELL | X217: 2 | Y217: 2 | Z217: 0 | AA217: 287 | AB217: 371 | AC217: 77.35849056603773 | AD217: 8
A218: YARRAVILLE | C218: DODDS | F218: GARRICK | I218: DIXON | L218: RULE | O218: DE JONG | R218: MASON | W218: BOX HILL | X218: 1 | Y218: 3 | Z218: 0 | AA218: 272 | AB218: 308 | AC218: 88.311688311688314 | AD218: 4
A219: GOALKICKERS | W219: NORTHCOTE | X219: 1 | Y219: 3 | Z219: 0 | AA219: 297 | AB219: 389 | AC219: 76.349614395886888 | AD219: 4
A220: WILLIAMSTOWN | C220: McPHERSON 4 | F220: WARD 2 | I220: REED 2 | K220: GEAR 2 | M220: SMITH | W220: BRIGHTON | X220: 1 | Y220: 3 | Z220: 0 | AA220: 295 | AB220: 387 | AC220: 76.227390180878558 | AD220: 4
A221: YARRAVILLE | C221: DE JONG 2 | F221: SAID | H221: BOURKE | J221: SCHUMAN | M221: DRIVER | W221: SANDRINGHAM | X221: 1 | Y221: 3 | Z221: 0 | AA221: 215 | AB221: 344 | AC221: 62.5 | AD221: 4
W222: OAKLEIGH | X222: 1 | Y222: 3 | Z222: 0 | AA222: 236 | AB222: 387 | AC222: 60.98 | AD222: 4
A223: PORT MELBOURNE | C223: 4 | D223: 3 | E223: =C223*6+D223 -> 27 | G223: 9 | H223: 7 | I223: =G223*6+H223 -> 61 | K223: 15 | L223: 13 | M223: =K223*6+L223 -> 103 | O223: 22 | P223: 15 | Q223: =O223*6+P223 -> 147 | S223: PORT MELBOURNE | W223: PRAHRAN | X223: 0 | Y223: 4 | Z223: 0 | AA223: 288 | AB223: 465 | AC223: 61.935483870967744 | AD223: 0
A224: CAMBERWELL | C224: 0 | D224: 5 | E224: =C224*6+D224 -> 5 | G224: 1 | H224: 5 | I224: =G224*6+H224 -> 11 | K224: 3 | L224: 10 | M224: =K224*6+L224 -> 28 | O224: 5 | P224: 13 | Q224: =O224*6+P224 -> 43 | S224: BREWER
A225: BEST PLAYERS
A226: PORT MELBOURNE | C226: BONNETT | F226: CLUES | I226: JOHNSON | L226: LEWIS | O226: SYKES | R226: TYRELL
A227: CAMBERWELL | C227: HOLYOAK | F227: MASON | I227: McGUINNESS | L227: ROSS | O227: STANBOROUGH | R227: TEMPANY
A228: GOALKICKERS
A229: PORT MELBOURNE | C229: BONNETT 7 | F229: EVANS 3 | I229: CLUES 2 | K229: SYKES 2 | M229: TYRELL 2 | P229: THOMPSON 2 | S229: MONKS | U229: WITHERS | W229: E ATKINSON | X229: MORRIS
A230: CAMBERWELL | C230: McGUINNESS 3 | G230: HIGSON | I230: MASON
A232: MOORABBIN | C232: 4 | D232: 3 | E232: =C232*6+D232 -> 27 | G232: 8 | H232: 6 | I232: =G232*6+H232 -> 54 | K232: 11 | L232: 11 | M232: =K232*6+L232 -> 77 | O232: 18 | P232: 13 | Q232: =O232*6+P232 -> 121 | S232: BOX HILL
A233: BOX HILL | C233: 2 | D233: 2 | E233: =C233*6+D233 -> 14 | G233: 3 | H233: 3 | I233: =G233*6+H233 -> 21 | K233: 8 | L233: 8 | M233: =K233*6+L233 -> 56 | O233: 10 | P233: 13 | Q233: =O233*6+P233 -> 73 | S233: CARDWELL
A234: BEST PLAYERS
A235: MOORABBIN | C235: MURPHY | F235: EVANS | I235: EDWARDS | L235: CLOVER | O235: LEHAMNN | R235: McGAW
A236: BOX HILL | C236: HOUGHTON | F236: IRVINE | I236: A JONES | L236: STREET | O236: WHITE | R236: WRIGHT
A237: GOALKICKERS
A238: MOORABBIN | C238: RENWICK 4 | F238: CLOVER 3 | I238: WHALEBONE 3 | M238: MANIE 2 | P238: McGAW 2 | R238: MURPHY 2 | U238: MURRAY | W238: EVANS
A239: BOX HILL | C239: DEVERY 2 | F239: DUNN 2 | I239: A JONES | K239: INGLETON | N239: GRAYSON | Q239: ELSWORTH | S239: STEET | U239: FANNING
A241: SANDRINGHAM | C241: 0 | D241: 0 | E241: =C241*6+D241 -> 0 | G241: 2 | H241: 5 | I241: =G241*6+H241 -> 17 | K241: 6 | L241: 6 | M241: =K241*6+L241 -> 42 | O241: 13 | P241: 7 | Q241: =O241*6+P241 -> 85 | S241: TOORAK PARK
A242: PRAHRAN | C242: 3 | D242: 2 | E242: =C242*6+D242 -> 20 | G242: 4 | H242: 4 | I242: =G242*6+H242 -> 28 | K242: 5 | L242: 8 | M242: =K242*6+L242 -> 38 | O242: 10 | P242: 12 | Q242: =O242*6+P242 -> 72 | S242: ROACH
A243: BEST PLAYERS
A244: SANDRINGHAM | C244: K EVANS | F244: WEBSTER | I244: WINTERS | L244: BOLAND | O244: ALSOPP | R244: JONES
A245: PRAHRAN | C245: ROY JONES | F245: HEALEY | I245: MORROW | L245: O'BRYAN | O245: GATES | R245: BOYD
A246: GOALKICKERS
A247: SANDRINGHAM | C247: ALSOPP 5 | F247: BOLAND 5 | I247: VANCE | K247: RANSOM | N247: MURPHY
A248: PRAHRAN | C248: HARVEY 4 | F248: C BOYD 2 | I248: McCULLOCH 2 | M248: FRASER | O248: WILSON
A250: OAKLEIGH | C250: 4 | D250: 2 | E250: =C250*6+D250 -> 26 | G250: 6 | H250: 5 | I250: =G250*6+H250 -> 41 | K250: 8 | L250: 10 | M250: =K250*6+L250 -> 58 | O250: 13 | P250: 13 | Q250: =O250*6+P250 -> 91 | S250: OAKLEIGH
A251: BRIGHTON | C251: 2 | D251: 6 | E251: =C251*6+D251 -> 18 | G251: 4 | H251: 7 | I251: =G251*6+H251 -> 31 | K251: 7 | L251: 12 | M251: =K251*6+L251 -> 54 | O251: 8 | P251: 15 | Q251: =O251*6+P251 -> 63 | S251: O'DONOGHUE
A252: BEST PLAYERS
A253: OAKLEIGH | C253: COLLINS | F253: McGOWAN | I253: KITTO | L253: COUGHLAN | O253: NICHOLSON | R253: BOURKE
A254: BRIGHTON | C254: CURRIE | F254: WEE HEE | I254: McCANN | L254: HART | O254: WEST | R254: DURKIN
A255: GOALKICKERS
A256: OAKLEIGH | C256: McGOWAN 5 | F256: GRANT 3 | I256: COUGHLAN 2 | L256: BOURKE 2 | O256: LONGNEY
A257: BRIGHTON | C257: WEST 3 | F257: HART 2 | I257: PRETTY | K257: DURKIN | M257: KERR
A259: BRUNSWICK | C259: 3 | D259: 3 | E259: =C259*6+D259 -> 21 | G259: 8 | H259: 6 | I259: =G259*6+H259 -> 54 | K259: 12 | L259: 10 | M259: =K259*6+L259 -> 82 | O259: 17 | P259: 15 | Q259: =O259*6+P259 -> 117 | S259: NORTHCOTE
A260: NORTHCOTE | C260: 2 | D260: 1 | E260: =C260*6+D260 -> 13 | G260: 4 | H260: 1 | I260: =G260*6+H260 -> 25 | K260: 6 | L260: 3 | M260: =K260*6+L260 -> 39 | O260: 8 | P260: 6 | Q260: =O260*6+P260 -> 54 | S260: IRVING
A261: BEST PLAYERS
A262: BRUNSWICK | C262: WEIR | F262: ROLFS | I262: EDWARDS | L262: NEILSON | O262: McMAHON | R262: HAYES
A263: NORTHCOTE | C263: L WALKER | F263: POWELL | I263: WOOLNOUGH | L263: DEVINE | O263: JOHNSON | R263: GERVASONI
A264: GOALKICKERS
A265: BRUNSWICK | C265: HAYES 5 | F265: WEIR 4 | H265: DEAS 3 | J265: TAYLOR 2 | M265: McMAHON | P265: J DILLON | R265: R PHIPPS
A266: NORTHCOTE | C266: GERVASONI 2 | F266: WOOLNOUGH 2 | J266: STEPHENS 2 | M266: G WALKER | P266: DRAKE
A268: ROUND 5 | C268: 15TH MAY (WED NIGHT) | S268: PLAYED AT
D269: 1ST QTR | H269: 2ND QTR | L269: 3RD QTR | P269: FINAL | S269: S.M.
A270: MOORABBIN | C270: 2 | D270: 4 | E270: =C270*6+D270 -> 16 | G270: 3 | H270: 7 | I270: =G270*6+H270 -> 25 | K270: 8 | L270: 13 | M270: =K270*6+L270 -> 61 | O270: 10 | P270: 14 | Q270: =O270*6+P270 -> 74 | S270: UMPIRE | X270: LADDER | AB270: ROUND | AD270: 5
A271: COBURG | C271: 0 | D271: 5 | E271: =C271*6+D271 -> 5 | G271: 3 | H271: 9 | I271: =G271*6+H271 -> 27 | K271: 5 | L271: 12 | M271: =K271*6+L271 -> 42 | O271: 7 | P271: 15 | Q271: =O271*6+P271 -> 57 | S271: BREWER
A272: BEST PLAYERS | W272: TEAM | X272: W | Y272: L | Z272: D | AA272: FOR | AB272: AGST | AC272: % | AD272: PTS
A273: MOORABBIN | C273: RENWICK | F273: EDWARDS | I273: McGAW | L273: BULL | O273: TREZISE | R273: EVANS
A274: COBURG | C274: BIGELOW | F274: GOULLET | I274: J BRENNAN | L274: RUTLEDGE | O274: WILKINSON | R274: McCOLL | W274: WILLIAMSTOWN | X274: 5 | Y274: 0 | Z274: 0 | AA274: 482 | AB274: 282 | AC274: 170.92198581560282 | AD274: 20
A275: GOALKICKERS | W275: BRUNSWICK | X275: 5 | Y275: 0 | Z275: 0 | AA275: 471 | AB275: 285 | AC275: 165.26315789473685 | AD275: 20
A276: MOORABBIN | C276: RENWICK 8 | F276: McGAW 2 | W276: MOORABBIN | X276: 4 | Y276: 1 | Z276: 0 | AA276: 495 | AB276: 368 | AC276: 134.5108695652174 | AD276: 16
A277: COBURG | C277: HEWES 2 | F277: GOULLET 2 | I277: YOUNG | K277: WILKINSON | N277: JORDAN | W277: YARRAVILLE | X277: 4 | Y277: 1 | Z277: 0 | AA277: 412 | AB277: 326 | AC277: 126.38036809815951 | AD277: 16
C278: 18TH MAY | I278: WEATHER | M278: NORTH WEST WIND
A279: YARRAVILLE | C279: 1 | D279: 1 | E279: =C279*6+D279 -> 7 | G279: 4 | H279: 8 | I279: =G279*6+H279 -> 32 | K279: 7 | L279: 14 | M279: =K279*6+L279 -> 56 | O279: 16 | P279: 17 | Q279: =O279*6+P279 -> 113 | S279: CAMBERWELL | W279: PORT MELBOURNE | X279: 3 | Y279: 2 | Z279: 0 | AA279: 584 | AB279: 266 | AC279: 219.55 | AD279: 12
A280: CAMBERWELL | C280: 2 | D280: 6 | E280: =C280*6+D280 -> 18 | G280: 4 | H280: 10 | I280: =G280*6+H280 -> 34 | K280: 7 | L280: 11 | M280: =K280*6+L280 -> 53 | O280: 9 | P280: 12 | Q280: =O280*6+P280 -> 66 | S280: O'DONOGHUE | W280: COBURG | X280: 3 | Y280: 2 | Z280: 0 | AA280: 457 | AB280: 376 | AC280: 121.54255319148936 | AD280: 12
A281: BEST PLAYERS | W281: PRESTON | X281: 3 | Y281: 2 | Z281: 0 | AA281: 442 | AB281: 385 | AC281: 114.8051948051948 | AD281: 12
A282: YARRAVILLE | C282: STONE | F282: DIXON | I282: MAGEE | L282: BOURKE | O282: WEBB | R282: DE JONG | W282: BOX HILL | X282: 2 | Y282: 3 | Z282: 0 | AA282: 367 | AB282: 391 | AC282: 93.861892583120209 | AD282: 8
A283: CAMBERWELL | C283: HIGSON | F283: DUGDALE | I283: HOLYOAK | L283: SMITH | O283: NELSON | R283: AMERY | W283: CAMBERWELL | X283: 2 | Y283: 3 | Z283: 0 | AA283: 353 | AB283: 484 | AC283: 72.933884297520663 | AD283: 8
A284: GOALKICKERS | W284: NORTHCOTE | X284: 1 | Y284: 4 | Z284: 0 | AA284: 382 | AB284: 494 | AC284: 77.327935222672068 | AD284: 4
A285: YARRAVILLE | C285: BOURKE 6 | F285: DE JONG 3 | I285: MAGEE 3 | L285: WEBB 2 | N285: DODDS | P285: CAREY | W285: SANDRINGHAM | X285: 1 | Y285: 4 | Z285: 0 | AA285: 298 | AB285: 439 | AC285: 67.881548974943058 | AD285: 4
A286: CAMBERWELL | C286: HIGSON 3 | F286: DUGDALE 2 | I286: COLEMAN | L286: STANBOROUGH | P286: MASON | R286: JOHNSON | W286: BRIGHTON | X286: 1 | Y286: 4 | Z286: 0 | AA286: 355 | AB286: 542 | AC286: 65.498154981549817 | AD286: 4
W287: OAKLEIGH | X287: 1 | Y287: 4 | Z287: 0 | AA287: 298 | AB287: 476 | AC287: 62.61 | AD287: 4
A288: PRESTON | C288: 5 | D288: 3 | E288: =C288*6+D288 -> 33 | G288: 8 | H288: 4 | I288: =G288*6+H288 -> 52 | K288: 13 | L288: 8 | M288: =K288*6+L288 -> 86 | O288: 16 | P288: 9 | Q288: =O288*6+P288 -> 105 | S288: PRESTON | W288: PRAHRAN | X288: 0 | Y288: 5 | Z288: 0 | AA288: 343 | AB288: 625 | AC288: 54.88 | AD288: 0
A289: NORTHCOTE | C289: 2 | D289: 2 | E289: =C289*6+D289 -> 14 | G289: 8 | H289: 3 | I289: =G289*6+H289 -> 51 | K289: 10 | L289: 4 | M289: =K289*6+L289 -> 64 | O289: 12 | P289: 13 | Q289: =O289*6+P289 -> 85 | S289: ROBINSON
A290: BEST PLAYERS
A291: PRESTON | C291: FOLEY | F291: SWEET | I291: COOPER | L291: CUSACK | O291: LITTLE | R291: GLEESON
A292: NORTHCOTE | C292: FRANCIS | F292: WRIGHT | I292: POWELL | L292: GERVASONI | O292: L WALKER | R292: STEPHENS
A293: GOALKICKERS
A294: PRESTON | C294: F CHARD 5 | F294: FOLEY 4 | I294: GREY 3 | K294: LITTLE 2 | N294: COOPER | P294: DAWSON
A295: NORTHCOTE | C295: PETERS 3 | F295: STEPHENS 3 | I295: WOOLNOUGH 2 | M295: COLLINS | O295: GERVASONI | R295: DRAKE | T295: WALSH
A297: PORT MELBOURNE | C297: 7 | D297: 4 | E297: =C297*6+D297 -> 46 | G297: 11 | H297: 9 | I297: =G297*6+H297 -> 75 | K297: 18 | L297: 10 | M297: =K297*6+L297 -> 118 | O297: 23 | P297: 17 | Q297: =O297*6+P297 -> 155 | S297: ELSTERNWICK PARK
A298: BRIGHTON | C298: 2 | D298: 2 | E298: =C298*6+D298 -> 14 | G298: 4 | H298: 5 | I298: =G298*6+H298 -> 29 | K298: 7 | L298: 9 | M298: =K298*6+L298 -> 51 | O298: 8 | P298: 12 | Q298: =O298*6+P298 -> 60 | S298: IRVING
A299: BEST PLAYERS
A300: PORT MELBOURNE | C300: JOHNSON | F300: BONNETT | I300: SYKES | L300: THOMPSON | O300: EVANS | R300: LEWIS
A301: BRIGHTON | C301: HART | F301: WEE HEE | I301: CURRIE | L301: COLLINS | O301: PRETTY | R301: CARROLL
A302: GOALKICKERS
A303: PORT MELBOURNE | C303: BONNETT 11 | F303: THOMPSON 4 | J303: SYKES 3 | M303: EVANS 2 | P303: LEWIS 2 | R303: MONKS
A304: BRIGHTON | C304: HART 3 | F304: WEE HEE 2 | I304: WEST | K304: COLLINS | N304: DURKIN
A306: BOX HILL | C306: 4 | D306: 12 | E306: =C306*6+D306 -> 36 | G306: 5 | H306: 13 | I306: =G306*6+H306 -> 43 | K306: 10 | L306: 15 | M306: =K306*6+L306 -> 75 | O306: 13 | P306: 17 | Q306: =O306*6+P306 -> 95 | S306: BEACH ROAD
A307: SANDRINGHAM | C307: 1 | D307: 1 | E307: =C307*6+D307 -> 7 | G307: 6 | H307: 8 | I307: =G307*6+H307 -> 44 | K307: 7 | L307: 9 | M307: =K307*6+L307 -> 51 | O307: 12 | P307: 11 | Q307: =O307*6+P307 -> 83 | S307: ROWE
A308: BEST PLAYERS
A309: BOX HILL | C309: INGLETON | F309: HOUGHTON | I309: LARKIN | L309: JOHNSTON | O309: TAYLOR | R309: COX
A310: SANDRINGHAM | C310: EVANS | F310: LORKIN | I310: GRANGER | L310: RANSOM | O310: McLEAN | R310: CROFT
A311: GOALKICKERS
A312: BOX HILL | C312: INGLETON 5 | F312: BROWN 3 | I312: COX 3 | K312: EADE | M312: STREET
A313: SANDRINGHAM | C313: ALSOPP 2 | F313: RANSOM 2 | I313: GRANGER 2 | L313: WEBSTER 2 | O313: BOLAND 2 | R313: LORKIN | T313: MARSHALL
A315: BRUNSWICK | C315: 1 | D315: 3 | E315: =C315*6+D315 -> 9 | G315: 3 | H315: 6 | I315: =G315*6+H315 -> 24 | K315: 11 | L315: 9 | M315: =K315*6+L315 -> 75 | O315: 13 | P315: 11 | Q315: =O315*6+P315 -> 89 | S315: BRUNSWICK
A316: OAKLEIGH | C316: 0 | D316: 5 | E316: =C316*6+D316 -> 5 | G316: 5 | H316: 8 | I316: =G316*6+H316 -> 38 | K316: 7 | L316: 10 | M316: =K316*6+L316 -> 52 | O316: 8 | P316: 14 | Q316: =O316*6+P316 -> 62 | S316: GWYNNE
A317: BEST PLAYERS
A318: BRUNSWICK | C318: NEILSON | F318: ROLFS | I318: HAYES | K318: WHILEY | N318: M PHIPPS | Q318: TAYLOR
A319: OAKLEIGH | C319: COUGHLAN | F319: NICHOLSON | I319: GRANT | K319: KITTO | N319: BURKE | Q319: GAY
A320: GOALKICKERS
A321: BRUNSWICK | C321: HAYES 6 | F321: R PHIPPS 2 | I321: WEIR | K321: J DILLON | M321: NEILSON | O321: TAYLOR | Q321: K DILLON
A322: OAKLEIGH | C322: McGOWAN 3 | F322: KITTO 2 | I322: LANE | K322: GAY | M322: GRANT
A324: WILLIAMSTOWN | C324: 7 | D324: 6 | E324: =C324*6+D324 -> 48 | G324: 9 | H324: 12 | I324: =G324*6+H324 -> 66 | K324: 16 | L324: 18 | M324: =K324*6+L324 -> 114 | O324: 23 | P324: 22 | Q324: =O324*6+P324 -> 160 | S324: TOORAK PARK
A325: PRAHRAN | C325: 1 | D325: 1 | E325: =C325*6+D325 -> 7 | G325: 4 | H325: 4 | I325: =G325*6+H325 -> 28 | K325: 5 | L325: 5 | M325: =K325*6+L325 -> 35 | O325: 8 | P325: 7 | Q325: =O325*6+P325 -> 55 | S325: CARDWELL
A326: BEST PLAYERS
A327: WILLIAMSTOWN | C327: CALLAHAN | F327: McPHERSON | I327: OUTEN | L327: WARD | O327: MATIN | R327: E BEITZEL
A328: PRAHRAN | C328: HARVEY | F328: SHILLABEER | I328: CLEAR | L328: GATES | O328: DOOLEY | R328: McCULLOCH
A329: GOALKICKERS
A330: WILLIAMSTOWN | C330: McPHERSON 10 | G330: WARD 4 | I330: CALLAHAN 3 | L330: REED 2 | N330: MURPHY 2 | Q330: OUTEN | S330: MARTIN
A331: PRAHRAN | C331: McCULLOCH 3 | G331: PEARSON 2 | J331: GATES | L331: BOYD | N331: DOOLEY
A333: ROUND 6 | C333: 25TH MAY | G333: WEATHER | J333: NORTH WEST BREEZE CLOUDY DULL | S333: PLAYED AT
D334: 1ST QTR | H334: 2ND QTR | L334: 3RD QTR | P334: FINAL | S334: PORT MELBOURNE
A335: PORT MELBOURNE | C335: 3 | D335: 2 | E335: =C335*6+D335 -> 20 | G335: 12 | H335: 9 | I335: =G335*6+H335 -> 81 | K335: 13 | L335: 13 | M335: =K335*6+L335 -> 91 | O335: 15 | P335: 20 | Q335: =O335*6+P335 -> 110 | S335: UMPIRE | X335: LADDER | AA335: ROUND | AD335: 6
A336: BRUNSWICK | C336: 2 | D336: 5 | E336: =C336*6+D336 -> 17 | G336: 3 | H336: 7 | I336: =G336*6+H336 -> 25 | K336: 6 | L336: 8 | M336: =K336*6+L336 -> 44 | O336: 8 | P336: 12 | Q336: =O336*6+P336 -> 60 | S336: CARDWELL
A337: BEST PLAYERS | W337: TEAM | X337: W | Y337: L | Z337: D | AA337: FOR | AB337: AGST | AC337: % | AD337: PTS
A338: PORT MELBOURNE | C338: JOHNSON | F338: LEWIS | I338: SYKES | L338: BONNETT | O338: LANDORFF | R338: McMASTER
A339: BRUNSWICK | C339: HAYES | F339: J DILLON | I339: DEAS | L339: JARMAN | O339: McFARLANE | R339: WEIR | W339: WILLIAMSTOWN | X339: 6 | Y339: 0 | Z339: 0 | AA339: 566 | AB339: 321 | AC339: 176.3239875389408 | AD339: 24
A340: GOALKICKERS | W340: MOORABBIN | X340: 5 | Y340: 1 | Z340: 0 | AA340: 575 | AB340: 410 | AC340: 140.2439024390244 | AD340: 20
A341: PORT MELBOURNE | C341: BONNETT 6 | F341: LEWIS 2 | I341: SYKES 2 | K341: MONKS 2 | N341: THOMPSON | Q341: EVANS | S341: McDONALD | W341: YARRAVILLE | X341: 5 | Y341: 1 | Z341: 0 | AA341: 536 | AB341: 393 | AC341: 136.38676844783714 | AD341: 20
A342: BRUNSWICK | C342: HAYES 4 | F342: J DILLON 2 | I342: TAYLOR | K342: WEIR | W342: BRUNSWICK | X342: 5 | Y342: 1 | Z342: 0 | AA342: 531 | AB342: 395 | AC342: 134.43037974683546 | AD342: 20
A344: MOORABBIN | C344: 1 | D344: 6 | E344: =C344*6+D344 -> 12 | G344: 4 | H344: 13 | I344: =G344*6+H344 -> 37 | K344: 6 | L344: 17 | M344: =K344*6+L344 -> 53 | O344: 9 | P344: 26 | Q344: =O344*6+P344 -> 80 | S344: NORTHCOTE | W344: PORT MELBOURNE | X344: 4 | Y344: 2 | Z344: 0 | AA344: 694 | AB344: 326 | AC344: 212.88 | AD344: 16
A345: NORTHCOTE | C345: 3 | D345: 1 | E345: =C345*6+D345 -> 19 | G345: 4 | H345: 2 | I345: =G345*6+H345 -> 26 | K345: 4 | L345: 9 | M345: =K345*6+L345 -> 33 | O345: 5 | P345: 12 | Q345: =O345*6+P345 -> 42 | S345: GWYNNE | W345: COBURG | X345: 3 | Y345: 3 | Z345: 0 | AA345: 531 | AB345: 459 | AC345: 115.68627450980392 | AD345: 12
A346: BEST PLAYERS | W346: PRESTON | X346: 3 | Y346: 3 | Z346: 0 | AA346: 507 | AB346: 465 | AC346: 109.03225806451613 | AD346: 12
A347: MOORABBIN | C347: GREEN | F347: MORONEY | I347: TREZISE | L347: EDWARDS | O347: CLOVER | R347: McGAW | W347: BOX HILL | X347: 3 | Y347: 3 | Z347: 0 | AA347: 449 | AB347: 455 | AC347: 98.681318681318686 | AD347: 12
A348: NORTHCOTE | C348: POWELL | F348: FRANCIS | I348: BRETHERTON | L348: WRIGHT | O348: L WALKER | R348: ADAMSON | W348: SANDRINGHAM | X348: 2 | Y348: 4 | Z348: 0 | AA348: 381 | AB348: 513 | AC348: 74.26900584795321 | AD348: 8
A349: GOALKICKERS | W349: OAKLEIGH | X349: 2 | Y349: 4 | Z349: 0 | AA349: 378 | AB349: 541 | AC349: 69.87 | AD349: 8
A350: MOORABBIN | C350: RENWICK 3 | F350: BULL 3 | I350: MURRAY | L350: MURPHY | O350: McGAW | W350: CAMBERWELL | X350: 2 | Y350: 4 | Z350: 0 | AA350: 392 | AB350: 568 | AC350: 69.014084507042256 | AD350: 8
A351: NORTHCOTE | C351: WRIGHT 3 | F351: COLLINS | I351: WILLIAMSON | W351: NORTHCOTE | X351: 1 | Y351: 5 | Z351: 0 | AA351: 424 | AB351: 574 | AC351: 73.867595818815332 | AD351: 4
W352: BRIGHTON | X352: 1 | Y352: 5 | Z352: 0 | AA352: 422 | AB352: 666 | AC352: 63.363363363363362 | AD352: 4
A353: WILLIAMSTOWN | C353: 1 | D353: 1 | E353: =C353*6+D353 -> 7 | G353: 8 | H353: 4 | I353: =G353*6+H353 -> 52 | K353: 11 | L353: 6 | M353: =K353*6+L353 -> 72 | O353: 12 | P353: 12 | Q353: =O353*6+P353 -> 84 | S353: CAMBERWELL | W353: PRAHRAN | X353: 0 | Y353: 6 | Z353: 0 | AA353: 407 | AB353: 707 | AC353: 57.567185289957564 | AD353: 0
A354: CAMBERWELL | C354: 1 | D354: 4 | E354: =C354*6+D354 -> 10 | G354: 1 | H354: 6 | I354: =G354*6+H354 -> 12 | K354: 3 | L354: 7 | M354: =K354*6+L354 -> 25 | O354: 5 | P354: 9 | Q354: =O354*6+P354 -> 39 | S354: ROWE
A355: BEST PLAYERS
A356: WILLIAMSTOWN | C356: CALLAHAN | F356: SMITH | I356: MURPHY | L356: MUNDAY | O356: F JONES | R356: R JONES
A357: CAMBERWELL | C357: MASON | F357: AMERY | I357: HOLYOAK | L357: K JOHNSON | O357: TEMPANY | R357: BELL
A358: GOALKICKERS
A359: WILLIAMSTOWN | C359: McPHERSON 5 | F359: MURPHY 3 | I359: SMITH 3 | L359: OUTEN
A360: CAMBERWELL | C360: HIGSON 2 | F360: TEMPANY 2 | I360: K JOHNSON
A362: SANDRINGHAM | C362: 2 | D362: 3 | E362: =C362*6+D362 -> 15 | G362: 4 | H362: 9 | I362: =G362*6+H362 -> 33 | K362: 6 | L362: 9 | M362: =K362*6+L362 -> 45 | O362: 11 | P362: 17 | Q362: =O362*6+P362 -> 83 | S362: COBURG
A363: COBURG | C363: 5 | D363: 1 | E363: =C363*6+D363 -> 31 | G363: 8 | H363: 3 | I363: =G363*6+H363 -> 51 | K363: 11 | L363: 6 | M363: =K363*6+L363 -> 72 | O363: 11 | P363: 8 | Q363: =O363*6+P363 -> 74 | S363: O'DONOGHUE
A364: BEST PLAYERS
A365: SANDRINGHAM | C365: WEBSTER | F365: MURPHY | I365: McLEAN | L365: GRANGER | O365: ECCLESTON | R365: BOLAND
A366: COBURG | C366: BIGELOW | F366: WILKINSON | I366: JORDAN | L366: FEWKES | O366: MAHONEY | R366: HEWES
A367: GOALKICKERS
A368: SANDRINGHAM | C368: ALSOPP 3 | F368: JOHNSTON 2 | I368: MURPHY 2 | L368: BOLAND | N368: EVANS | P368: WINTERS | R368: GRANGER
A369: COBURG | C369: HEWES 5 | F369: JORDAN 2 | I369: ROBINSON 2 | L369: H WILKINSON | O369: MILLER
A371: OAKLEIGH | C371: 1 | D371: 4 | E371: =C371*6+D371 -> 10 | G371: 3 | H371: 9 | I371: =G371*6+H371 -> 27 | K371: 6 | L371: 15 | M371: =K371*6+L371 -> 51 | O371: 10 | P371: 20 | Q371: =O371*6+P371 -> 80 | S371: OAKLEIGH
A372: PRESTON | C372: 5 | D372: 3 | E372: =C372*6+D372 -> 33 | G372: 7 | H372: 5 | I372: =G372*6+H372 -> 47 | K372: 7 | L372: 10 | M372: =K372*6+L372 -> 52 | O372: 9 | P372: 11 | Q372: =O372*6+P372 -> 65 | S372: IRVING
A373: BEST PLAYERS
A374: OAKLEIGH | C374: COUGHLAN | F374: GRANT | I374: COLLINS | L374: McGOWAN | O374: BACKMAN | R374: BAPTIST
A375: PRESTON | C375: SWEET | F375: LITTLE | I375: FOLEY | L375: F CHARD | O375: GRAY | R375: CUSACK
A376: GOALKICKERS
A377: OAKLEIGH | C377: McGOWAN 5 | F377: GRANT 2 | I377: COUGHLAN | L377: LANE | N377: BASSETT
A378: PRESTON | C378: F CHARD 5 | F378: OSBORNE 3 | I378: McLACHLAN
A380: BOX HILL | C380: 1 | D380: 2 | E380: =C380*6+D380 -> 8 | G380: 5 | H380: 4 | I380: =G380*6+H380 -> 34 | K380: 9 | L380: 4 | M380: =K380*6+L380 -> 58 | O380: 12 | P380: 10 | Q380: =O380*6+P380 -> 82 | S380: BOX HILL
A381: PRAHRAN | C381: 3 | D381: 1 | E381: =C381*6+D381 -> 19 | G381: 6 | H381: 5 | I381: =G381*6+H381 -> 41 | K381: 7 | L381: 9 | M381: =K381*6+L381 -> 51 | O381: 9 | P381: 10 | Q381: =O381*6+P381 -> 64 | S381: GODING
A382: BEST PLAYERS
A383: BOX HILL | C383: WHITE | F383: PLUNKETT | I383: DEVERY | L383: INGLETON | O383: LONSDALE | R383: CRAIG
A384: PRAHRAN | C384: HARVEY | F384: HEAD | I384: PEARSON | L384: PLAIN | O384: CLEAR | R384: DOOLEY
A385: GOALKICKERS
A386: BOX HILL | C386: BROWN 3 | F386: DEVERY 2 | I386: WHITE 2 | L386: STREET 2 | O386: COX 2 | Q386: INGLETON
A387: PRAHRAN | C387: O'BRYAN 2 | F387: WHARTON 2 | I387: R WILSON | L387: M WILSON | O387: BOYD | Q387: HEALEY | S387: PEARSON
A389: YARRAVILLE | C389: 4 | D389: 8 | E389: =C389*6+D389 -> 32 | G389: 10 | H389: 11 | I389: =G389*6+H389 -> 71 | K389: 15 | L389: 19 | M389: =K389*6+L389 -> 109 | O389: 17 | P389: 22 | Q389: =O389*6+P389 -> 124 | S389: YARRAVILLE
A390: BRIGHTON | C390: 0 | D390: 0 | E390: =C390*6+D390 -> 0 | G390: 2 | H390: 3 | I390: =G390*6+H390 -> 15 | K390: 4 | L390: 4 | M390: =K390*6+L390 -> 28 | O390: 10 | P390: 7 | Q390: =O390*6+P390 -> 67 | S390: BREWER
A391: BEST PLAYERS
A392: YARRAVILLE | C392: CAREY | F392: BODSWORTH | I392: ROHLEDER | L392: DE JONG | O392: SCHUMAN | R392: GARRICK
A393: BRIGHTON | C393: PEARSON | F393: GURRIE | I393: PRETTY | L393: HART | O393: STEVENS | R393: HUNTER
A394: GOALKICKERS
A395: YARRAVILLE | C395: CAREY 6 | F395: WEBB 3 | I395: BODSWORTH 2 | M395: MAGEE | O395: BOURKE | Q395: CARSON | S395: GARRICK | V395: RULE | W395: SCHUMAM
A396: BRIGHTON | C396: HART 4 | F396: WEST 3 | I396: PEARSON | K396: HUNTER | M396: BROWNING
A398: ROUND 7 | C398: 29TH MAY (WED NIGHT) | S398: PLAYED AT
D399: 1ST QTR | H399: 2ND QTR | L399: 3RD QTR | P399: FINAL | S399: S.M.
A400: WILLIAMSTOWN | C400: 2 | D400: 2 | E400: =C400*6+D400 -> 14 | G400: 4 | H400: 4 | I400: =G400*6+H400 -> 28 | K400: 8 | L400: 7 | M400: =K400*6+L400 -> 55 | O400: 17 | P400: 10 | Q400: =O400*6+P400 -> 112 | S400: UMPIRE | X400: LADDER | AA400: ROUND | AD400: 7
A401: BOX HILL | C401: 0 | D401: 5 | E401: =C401*6+D401 -> 5 | G401: 3 | H401: 7 | I401: =G401*6+H401 -> 25 | K401: 4 | L401: 11 | M401: =K401*6+L401 -> 35 | O401: 4 | P401: 11 | Q401: =O401*6+P401 -> 35 | S401: IRVING
A402: BEST PLAYERS | W402: TEAM | X402: W | Y402: L | Z402: D | AA402: FOR | AB402: AGST | AC402: % | AD402: PTS
A403: WILLIAMSTOWN | C403: MARTIN | F403: KENT | I403: EVANS | L403: OUTEN | O403: RAMSAY | R403: CALLAHAN
A404: BOX HILL | C404: TAYLOR | F404: CRAIG | I404: A JONES | L404: WHITE | O404: IRVINE | R404: NODEN | W404: WILLIAMSTOWN | X404: 7 | Y404: 0 | Z404: 0 | AA404: 678 | AB404: 356 | AC404: 190.44943820224719 | AD404: 28
A405: GOALKICKERS | W405: MOORABBIN | X405: 6 | Y405: 1 | Z405: 0 | AA405: 699 | AB405: 447 | AC405: 156.38 | AD405: 24
A406: WILLIAMSTOWN | C406: McPHERSON 5 | F406: WARD 4 | I406: CALLAHAN 2 | L406: GEAR 2 | N406: F JONES 2 | Q406: SMITH | S406: MURPHY | W406: BRUNSWICK | X406: 6 | Y406: 1 | Z406: 0 | AA406: 600 | AB406: 462 | AC406: 129.87012987012986 | AD406: 24
A407: BOX HILL | C407: PLUNKETT 2 | F407: SAWATSKY | I407: BROWN | W407: PORT MELBOURNE | X407: 5 | Y407: 2 | Z407: 0 | AA407: 774 | AB407: 404 | AC407: 191.58 | AD407: 20
C408: 1ST JUNE | I408: WEATHER | M408: LIGHT RAIN 1ST QTR
A409: BRUNSWICK | C409: 1 | D409: 3 | E409: =C409*6+D409 -> 9 | G409: 4 | H409: 3 | I409: =G409*6+H409 -> 27 | K409: 6 | L409: 6 | M409: =K409*6+L409 -> 42 | O409: 10 | P409: 9 | Q409: =O409*6+P409 -> 69 | S409: BRUNSWICK | W409: YARRAVILLE | X409: 5 | Y409: 2 | Z409: 0 | AA409: 603 | AB409: 462 | AC409: 130.51948051948051 | AD409: 20
A410: YARRAVILLE | C410: 3 | D410: 6 | E410: =C410*6+D410 -> 24 | G410: 5 | H410: 12 | I410: =G410*6+H410 -> 42 | K410: 7 | L410: 14 | M410: =K410*6+L410 -> 56 | O410: 8 | P410: 19 | Q410: =O410*6+P410 -> 67 | S410: ROWE | W410: COBURG | X410: 3 | Y410: 4 | Z410: 0 | AA410: 611 | AB410: 568 | AC410: 107.57042253521126 | AD410: 12
A411: BEST PLAYERS | W411: PRESTON | X411: 3 | Y411: 4 | Z411: 0 | AA411: 585 | AB411: 545 | AC411: 107.33944954128441 | AD411: 12
A412: BRUNSWICK | C412: WEIR | F412: MULLENGER | I412: HOUSE | L412: McFARLANE | O412: K DILLON | R412: HAYES | W412: SANDRINGHAM | X412: 3 | Y412: 4 | Z412: 0 | AA412: 482 | AB412: 557 | AC412: 86.535008976660677 | AD412: 12
A413: YARRAVILLE | C413: GARRICK | F413: MAGEE | I413: MASON | L413: WILD | O413: SCHUMANN | R413: COCKCROFT | W413: BOX HILL | X413: 3 | Y413: 4 | Z413: 0 | AA413: 484 | AB413: 567 | AC413: 85.361552028218696 | AD413: 12
A414: GOALKICKERS | W414: CAMBERWELL | X414: 3 | Y414: 4 | Z414: 0 | AA414: 478 | AB414: 641 | AC414: 74.570982839313572 | AD414: 12
A415: BRUNSWICK | C415: HAYES 5 | F415: JARMAN | I415: WEIR | K415: MCMAHON | N415: WHILEY | P415: K DILLON | W415: OAKLEIGH | X415: 2 | Y415: 5 | Z415: 0 | AA415: 415 | AB415: 665 | AC415: 62.406015037593988 | AD415: 8
A416: YARRAVILLE | C416: WILD 3 | F416: CAREY 2 | I416: MAGEE | K416: SCHUMAN | N416: RULE | W416: NORTHCOTE | X416: 1 | Y416: 6 | Z416: 0 | AA416: 468 | AB416: 675 | AC416: 69.333333333333329 | AD416: 4
W417: BRIGHTON | X417: 1 | Y417: 6 | Z417: 0 | AA417: 495 | AB417: 752 | AC417: 65.824468085106389 | AD417: 4
A418: PORT MELBOURNE | C418: 3 | D418: 1 | E418: =C418*6+D418 -> 19 | G418: 6 | H418: 6 | I418: =G418*6+H418 -> 42 | K418: 7 | L418: 7 | M418: =K418*6+L418 -> 49 | O418: 11 | P418: 14 | Q418: =O418*6+P418 -> 80 | S418: PRESTON | W418: PRAHRAN | X418: 1 | Y418: 6 | Z418: 0 | AA418: 516 | AB418: 787 | AC418: 65.565438373570515 | AD418: 4
A419: PRESTON | C419: 5 | D419: 4 | E419: =C419*6+D419 -> 34 | G419: 7 | H419: 7 | I419: =G419*6+H419 -> 49 | K419: 11 | L419: 12 | M419: =K419*6+L419 -> 78 | O419: 11 | P419: 12 | Q419: =O419*6+P419 -> 78 | S419: E BREWER
A420: BEST PLAYERS
A421: PORT MELBOURNE | C421: LANDORFF | F421: TYRELL | I421: R ATKINSON | L421: JOHNSON | O421: MONKS | R421: LAFFEY
A422: PRESTON | C422: COOPER | F422: GLEESON | I422: LITTLE | L422: SWEET | O422: F CHARD | R422: FOLEY
A423: GOALKICKERS
A424: PORT MELBOURNE | C424: BONNETT 4 | F424: MORRIS 3 | I424: R ATKINSON | L424: MONKS | N424: TYRELL | P424: WITHERS
A425: PRESTON | C425: F CHARD 5 | F425: SWEET 2 | I425: GLEESON 2 | L425: OSBORNE | N425: FOLEY
A427: MOORABBIN | C427: 8 | D427: 7 | E427: =C427*6+D427 -> 55 | G427: 8 | H427: 11 | I427: =G427*6+H427 -> 59 | K427: 14 | L427: 15 | M427: =K427*6+L427 -> 99 | O427: 18 | P427: 20 | Q427: =O427*6+P427 -> 128 | S427: MOORABBIN
A428: OAKLEIGH | C428: 1 | D428: 0 | E428: =C428*6+D428 -> 6 | G428: 4 | H428: 2 | I428: =G428*6+H428 -> 26 | K428: 4 | L428: 4 | M428: =K428*6+L428 -> 28 | O428: 5 | P428: 7 | Q428: =O428*6+P428 -> 37 | S428: O'DONOGHUE
A429: BEST PLAYERS
A430: MOORABBIN | C430: McGAW | F430: MURRAY | I430: CLOVER | L430: EDWARDS | O430: MORONEY | R430: EVANS
A431: OAKLEIGH | C431: COLLINS | F431: GAY | I431: D'ARCY | L431: KNIGHTS | O431: FURZER | R431: SEYMOUR
A432: GOALKICKERS
A433: MOORABBIN | C433: RENWICK 6 | F433: McGAW 4 | I433: BULL 2 | K433: MENNIE 2 | N433: MURRAY 2 | Q433: CLOVER | S433: BULMER
A434: OAKLEIGH | C434: FURZER 2 | F434: BASSETT | I434: McGOWAN | L434: GRANT
A436: SANDRINGHAM | C436: 0 | D436: 6 | E436: =C436*6+D436 -> 6 | G436: 4 | H436: 13 | I436: =G436*6+H436 -> 37 | K436: 6 | L436: 18 | M436: =K436*6+L436 -> 54 | O436: 13 | P436: 23 | Q436: =O436*6+P436 -> 101 | S436: BEACH ROAD
A437: NORTHCOTE | C437: 1 | D437: 3 | E437: =C437*6+D437 -> 9 | G437: 2 | H437: 5 | I437: =G437*6+H437 -> 17 | K437: 4 | L437: 7 | M437: =K437*6+L437 -> 31 | O437: 6 | P437: 8 | Q437: =O437*6+P437 -> 44 | S437: CARDWELL
A438: BEST PLAYERS
A439: SANDRINGHAM | C439: WEBSTER | F439: JOHNSTON | I439: BOLAND | L439: JONES | O439: RICHARDS | R439: QUINN
A440: NORTHCOTE | C440: VAINS | F440: POWELL | I440: TAYLOR | L440: WRIGHT | O440: DEVINE | R440: L WALKER
A441: GOALKICKERS
A442: SANDRINGHAM | C442: ALSOPP 4 | F442: MURPHY 3 | I442: JOHNSTON 2 | L442: BOLAND | N442: R EVANS | Q442: RANSOM | S442: QUINN
A443: NORTHCOTE | C443: ROMARI 2 | F443: STEPHENS | I443: OLNEY | K443: WOOLNOUGH | N443: DEVINE
A445: CAMBERWELL | C445: 2 | D445: 2 | E445: =C445*6+D445 -> 14 | G445: 7 | H445: 8 | I445: =G445*6+H445 -> 50 | K445: 9 | L445: 10 | M445: =K445*6+L445 -> 64 | O445: 12 | P445: 14 | Q445: =O445*6+P445 -> 86 | S445: ELSTERNWICK PARK
A446: BRIGHTON | C446: 4 | D446: 6 | E446: =C446*6+D446 -> 30 | G446: 5 | H446: 8 | I446: =G446*6+H446 -> 38 | K446: 8 | L446: 12 | M446: =K446*6+L446 -> 60 | O446: 10 | P446: 13 | Q446: =O446*6+P446 -> 73 | S446: GODING
A447: BEST PLAYERS
A448: CAMBERWELL | C448: SKALBERG | F448: ROSS | I448: TEMPANY | L448: SEYMOUR | O448: SMITH | R448: AMERY
A449: BRIGHTON | C449: COCKFIELD | F449: HART | I449: DALEY | L449: STEVENS | O449: BEACH | R449: PRETTY
A450: GOALKICKERS
A451: CAMBERWELL | C451: DUGDALE 3 | F451: SEYMOUR 2 | I451: HIGSON 2 | L451: ROSS | N451: COLEMAN | Q451: McGUINNESS | S451: CHAMBERS | V451: SKALBERG
A452: BRIGHTON | C452: HART 4 | F452: DALEY 2 | I452: CURRIE 2 | L452: PRETTY | N452: WEST
A454: PRAHRAN | C454: 3 | D454: 2 | E454: =C454*6+D454 -> 20 | G454: 8 | H454: 8 | I454: =G454*6+H454 -> 56 | K454: 11 | L454: 9 | M454: =K454*6+L454 -> 75 | O454: 16 | P454: 13 | Q454: =O454*6+P454 -> 109 | S454: TOORAK PARK
A455: COBURG | C455: 5 | D455: 2 | E455: =C455*6+D455 -> 32 | G455: 8 | H455: 6 | I455: =G455*6+H455 -> 54 | K455: 12 | L455: 6 | M455: =K455*6+L455 -> 78 | O455: 12 | P455: 8 | Q455: =O455*6+P455 -> 80 | S455: GWYNNE
A456: BEST PLAYERS
A457: PRAHRAN | C457: PLAIN | F457: O'BRYAN | I457: MORROW | L457: HARVEY | O457: SHILLABEER | R457: McCULLOCH
A458: COBURG | C458: BIGELOW | F458: YOUNG | I458: JORDAN | L458: WILKINSON | O458: HEWES | R458: MILLER
A459: GOALKICKERS
A460: PRAHRAN | C460: McKENZIE 4 | F460: McCULLOCH 4 | J460: O'BRYAN 3 | M460: HARVEY 2 | P460: BOYD 2 | R460: WILSON
A461: COBURG | C461: HEWES 4 | F461: MILLER 2 | I461: GOULLET 2 | L461: HUNTINGTON 2 | P461: J BRENNAN | S461: JORDAN
A463: ROUND 8 | C463: 8TH JUNE | I463: WEATHER | L463: NORTH WEST WIND WARM SUNNY | S463: PLAYED AT
D464: 1ST QTR | H464: 2ND QTR | L464: 3RD QTR | P464: FINAL | S464: M'BINN
A465: MOORABBIN | C465: 4 | D465: 2 | E465: =C465*6+D465 -> 26 | G465: 8 | H465: 7 | I465: =G465*6+H465 -> 55 | K465: 8 | L465: 9 | M465: =K465*6+L465 -> 57 | O465: 13 | P465: 16 | Q465: =O465*6+P465 -> 94 | S465: UMPIRE | X465: LADDER | AA465: ROUND | AD465: 8
A466: YARRAVILLE | C466: 6 | D466: 1 | E466: =C466*6+D466 -> 37 | G466: 7 | H466: 2 | I466: =G466*6+H466 -> 44 | K466: 10 | L466: 8 | M466: =K466*6+L466 -> 68 | O466: 11 | P466: 11 | Q466: =O466*6+P466 -> 77 | S466: IRVING
A467: BEST PLAYERS | W467: TEAM | X467: W | Y467: L | Z467: D | AA467: FOR | AB467: AGST | AC467: % | AD467: PTS
A468: MOORABBIN | C468: TREZISE | F468: EVANS | I468: RENWICK | L468: BOYD | O468: STANLEY | R468: WHALEBONE
A469: YARRAVILLE | C469: STONE | F469: GARRICK | I469: DE JONG | L469: BODSWORTH | O469: MASON | R469: LIVINGSTONE | W469: WILLIAMSTOWN | X469: 8 | Y469: 0 | Z469: 0 | AA469: 739 | AB469: 390 | AC469: 189.48717948717947 | AD469: 32
A470: GOALKICKERS | W470: MOORABBIN | X470: 7 | Y470: 1 | Z470: 0 | AA470: 797 | AB470: 524 | AC470: 152.1 | AD470: 28
A471: MOORABBIN | C471: WHALEBONE 4 | G471: RENWICK 4 | J471: BULMER 2 | M471: McGAW 2 | P471: MANIE | W471: BRUNSWICK | X471: 7 | Y471: 1 | Z471: 0 | AA471: 684 | AB471: 505 | AC471: 135.44554455445544 | AD471: 28
A472: YARRAVILLE | C472: BODSWORTH 4 | G472: DIXON 4 | J472: CAREY | L472: MAGEE | N472: SCHUMAN | W472: PORT MELBOURNE | X472: 6 | Y472: 2 | Z472: 0 | AA472: 861 | AB472: 482 | AC472: 178.63 | AD472: 24
A474: WILLIAMSTOWN | C474: 3 | D474: 0 | E474: =C474*6+D474 -> 18 | G474: 5 | H474: 6 | I474: =G474*6+H474 -> 36 | K474: 6 | L474: 10 | M474: =K474*6+L474 -> 46 | O474: 8 | P474: 13 | Q474: =O474*6+P474 -> 61 | S474: WILLIAMSTOWN | W474: YARRAVILLE | X474: 5 | Y474: 3 | Z474: 0 | AA474: 680 | AB474: 556 | AC474: 122.30215827338129 | AD474: 20
A475: COBURG | C475: 1 | D475: 10 | E475: =C475*6+D475 -> 16 | G475: 2 | H475: 11 | I475: =G475*6+H475 -> 23 | K475: 2 | L475: 12 | M475: =K475*6+L475 -> 24 | O475: 3 | P475: 16 | Q475: =O475*6+P475 -> 34 | S475: GODING | W475: PRESTON | X475: 4 | Y475: 4 | Z475: 0 | AA475: 683 | AB475: 603 | AC475: 113.26699834162521 | AD475: 16
A476: BEST PLAYERS | W476: BOX HILL | X476: 4 | Y476: 4 | Z476: 0 | AA476: 572 | AB476: 601 | AC476: 95.174708818635608 | AD476: 16
A477: WILLIAMSTOWN | C477: OGDEN | F477: McPHERSON | I477: KENT | L477: GEAR | O477: R JONES | R477: E BEITZEL | W477: COBURG | X477: 3 | Y477: 5 | Z477: 0 | AA477: 645 | AB477: 629 | AC477: 102.54372019077901 | AD477: 12
A478: COBURG | C478: WYMER | F478: BIGELOW | I478: YOUNG | L478: FEWKES | O478: MAHONEY | R478: RUTLEDGE | W478: SANDRINGHAM | X478: 3 | Y478: 5 | Z478: 0 | AA478: 560 | AB478: 644 | AC478: 86.956521739130437 | AD478: 12
A479: GOALKICKERS | W479: CAMBERWELL | X479: 3 | Y479: 5 | Z479: 0 | AA479: 536 | AB479: 739 | AC479: 72.530446549391073 | AD479: 12
A480: WILLIAMSTOWN | C480: McPHERSON 4 | F480: F JONES | I480: GEAR | K480: CALLAHAN | N480: WHITTAKER | W480: PRAHRAN | X480: 2 | Y480: 6 | Z480: 0 | AA480: 618 | AB480: 872 | AC480: 70.871559633027516 | AD480: 8
A481: COBURG | C481: McCOLL 2 | F481: YOUNG | W481: OAKLEIGH | X481: 2 | Y481: 6 | Z481: 0 | AA481: 500 | AB481: 771 | AC481: 64.85 | AD481: 8
W482: NORTHCOTE | X482: 1 | Y482: 7 | Z482: 0 | AA482: 502 | AB482: 763 | AC482: 65.792922673656619 | AD482: 4
A483: PORT MELBOURNE | C483: 5 | D483: 2 | E483: =C483*6+D483 -> 32 | G483: 6 | H483: 3 | I483: =G483*6+H483 -> 39 | K483: 10 | L483: 8 | M483: =K483*6+L483 -> 68 | O483: 13 | P483: 9 | Q483: =O483*6+P483 -> 87 | S483: BEACH ROAD | W483: BRIGHTON | X483: 1 | Y483: 7 | Z483: 0 | AA483: 538 | AB483: 836 | AC483: 64.354066985645929 | AD483: 4
A484: SANDRINGHAM | C484: 1 | D484: 5 | E484: =C484*6+D484 -> 11 | G484: 5 | H484: 9 | I484: =G484*6+H484 -> 39 | K484: 6 | L484: 11 | M484: =K484*6+L484 -> 47 | O484: 10 | P484: 18 | Q484: =O484*6+P484 -> 78 | S484: ROACH
A485: BEST PLAYERS
A486: PORT MELBOURNE | C486: MONKS | F486: BONNETT | I486: LOCKHART | L486: WITHERS | O486: SYKES | R486: MORRIS
A487: SANDRINGHAM | C487: McLEAN | F487: CROFT | I487: RANSOM | L487: GRANGER | O487: ECCLESTON | R487: R EVANS
A488: GOALKICKERS
A489: PORT MELBOURNE | C489: BONNETT 7 | F489: SYKES 2 | I489: McMASTER 2 | L489: B EVANS | N489: MONKS
A490: SANDRINGHAM | C490: ALSOPP 4 | F490: R EVANS | I490: QUINN | K490: MURPHY | M490: RANSOM | O490: K EVANS | Q490: GRANGER
A492: PRESTON | C492: 5 | D492: 5 | E492: =C492*6+D492 -> 35 | G492: 5 | H492: 11 | I492: =G492*6+H492 -> 41 | K492: 14 | L492: 14 | M492: =K492*6+L492 -> 98 | O492: 14 | P492: 14 | Q492: =O492*6+P492 -> 98 | S492: PRESTON
A493: CAMBERWELL | C493: 0 | D493: 2 | E493: =C493*6+D493 -> 2 | G493: 4 | H493: 6 | I493: =G493*6+H493 -> 30 | K493: 5 | L493: 9 | M493: =K493*6+L493 -> 39 | O493: 7 | P493: 16 | Q493: =O493*6+P493 -> 58 | S493: CARDWELL
A494: BEST PLAYERS
A495: PRESTON | C495: COOPER | F495: FOLEY | I495: F CHARD | L495: LITTLE | O495: SWEET | R495: GLEESON
A496: CAMBERWELL | C496: ROSS | F496: COLEMAN | I496: LANNING | L496: TEMPANY | O496: CHAMBERS | R496: MASON
A497: GOALKICKERS
A498: PRESTON | C498: F CHARD 4 | F498: COOPER 3 | I498: SWEET 2 | K498: GLEESON | M498: OSBORNE | P498: LITTLE | R498: FOLEY | T498: BREARLEY
A499: CAMBERWELL | C499: COLEMAN 4 | F499: CHAMBERS | I499: LANNING | L499: BOCK
A501: PRAHRAN | C501: 1 | D501: 2 | E501: =C501*6+D501 -> 8 | G501: 7 | H501: 3 | I501: =G501*6+H501 -> 45 | K501: 9 | L501: 5 | M501: =K501*6+L501 -> 59 | O501: 15 | P501: 12 | Q501: =O501*6+P501 -> 102 | S501: TOORAK PARK
A502: OAKLEIGH | C502: 5 | D502: 5 | E502: =C502*6+D502 -> 35 | G502: 7 | H502: 5 | I502: =G502*6+H502 -> 47 | K502: 12 | L502: 12 | M502: =K502*6+L502 -> 84 | O502: 12 | P502: 13 | Q502: =O502*6+P502 -> 85 | S502: ROWE
A503: BEST PLAYERS | S503: NORTHCOTE
A504: PRAHRAN | C504: HARVEY | F504: PEARSON | I504: PLAIN | L504: McCULLOCH | O504: SHILLABEER | R504: O'BRYAN
A505: OAKLEIGH | C505: McGOWAN | F505: COUGHLAN | I505: BOURKE | L505: BAPTIST | O505: BACKMAN | R505: ANDERSON
A506: GOALKICKERS
A507: PRAHRAN | C507: McCULLOCH 4 | F507: McKENZIE 4 | I507: HARVEY 3 | L507: PEARSON 2 | O507: O'BRYAN | Q507: WHARTON
A508: OAKLEIGH | C508: McGOWAN 8 | F508: ANDERSON | I508: COUGHLAN | L508: BOURKE | N508: NICHOLSON
A510: BOX HILL | C510: 1 | D510: 6 | E510: =C510*6+D510 -> 12 | G510: 3 | H510: 10 | I510: =G510*6+H510 -> 28 | K510: 7 | L510: 10 | M510: =K510*6+L510 -> 52 | O510: 12 | P510: 16 | Q510: =O510*6+P510 -> 88 | S510: BOX HILL
A511: NORTHCOTE | C511: 3 | D511: 3 | E511: =C511*6+D511 -> 21 | G511: 3 | H511: 6 | I511: =G511*6+H511 -> 24 | K511: 4 | L511: 9 | M511: =K511*6+L511 -> 33 | O511: 4 | P511: 10 | Q511: =O511*6+P511 -> 34 | S511: O'DONOGHUE
A512: BEST PLAYERS
A513: BOX HILL | C513: LOVE | F513: WHITE | I513: DEVERY | L513: INGLETON | O513: JOHNSON | R513: WITHERDEN
A514: NORTHCOTE | C514: TAYLOR | F514: WRIGHT | I514: JOHNSON | L514: ALDRIDGE | O514: G WALKER | R514: BRETHERTON
A515: GOALKICKERS
A516: BOX HILL | C516: LOVE 3 | E516: SAWATSKY 3 | H516: EADE 2 | J516: INGLETON | M516: STREET | O516: DEVERY | Q516: COX
A517: NORTHCOTE | C517: WOOLNOUGH 2 | G517: ROMARI | J517: BRETHERTON
A519: BRUNSWICK | C519: 2 | D519: 2 | E519: =C519*6+D519 -> 14 | G519: 3 | H519: 4 | I519: =G519*6+H519 -> 22 | K519: 11 | L519: 10 | M519: =K519*6+L519 -> 76 | O519: 11 | P519: 18 | Q519: =O519*6+P519 -> 84 | S519: BRUNSWICK
A520: BRIGHTON | C520: 1 | D520: 0 | E520: =C520*6+D520 -> 6 | G520: 2 | H520: 2 | I520: =G520*6+H520 -> 14 | K520: 2 | L520: 3 | M520: =K520*6+L520 -> 15 | O520: 6 | P520: 7 | Q520: =O520*6+P520 -> 43 | S520: GWYNNE
A521: BEST PLAYERS
A522: BRUNSWICK | C522: K DILLON | F522: NEILSON | I522: McFARLANE | L522: DEAS | O522: ROLFS | R522: BUCHANAN
A523: BRIGHTON | C523: McCANN | F523: GURRY | I523: STEVENS | L523: WILKINSON | O523: DALEY | R523: PEARSON
A524: GOALKICKERS
A525: BRUNSWICK | C525: K DILLON 7 | F525: BRENNAN | I525: NEILSON | L525: JARMAN | O525: DEAS
A526: BRIGHTON | C526: PEARSON 2 | F526: DALEY 2 | I526: BEACH | L526: PEARSON
A528: ROUND 9 | C528: 15TH JUNE | I528: WEATHER | N528: WEST BREEZE FINE & SUNNY | S528: PLAYED AT
D529: 1ST QTR | H529: 2ND QTR | L529: 3RD QTR | P529: FINAL | S529: PORT MELBOURNE
A530: PORT MELBOURNE | C530: 2 | D530: 3 | E530: =C530*6+D530 -> 15 | G530: 3 | H530: 6 | I530: =G530*6+H530 -> 24 | K530: 9 | L530: 14 | M530: =K530*6+L530 -> 68 | O530: 14 | P530: 19 | Q530: =O530*6+P530 -> 103 | S530: UMPIRE | X530: LADDER | AB530: ROUND | AD530: 9
A531: MOORABBIN | C531: 3 | D531: 9 | E531: =C531*6+D531 -> 27 | G531: 6 | H531: 13 | I531: =G531*6+H531 -> 49 | K531: 7 | L531: 15 | M531: =K531*6+L531 -> 57 | O531: 10 | P531: 20 | Q531: =O531*6+P531 -> 80 | S531: GODING
A532: BEST PLAYERS | W532: TEAM | X532: W | Y532: L | Z532: D | AA532: FOR | AB532: AGST | AC532: % | AD532: PTS
A533: PORT MELBOURNE | C533: MONKS | F533: WITHERS | I533: SYKES | L533: BONNETT | O533: LEWIS | R533: JOHNSON
A534: MOORABBIN | C534: CLOVER | F534: EVANS | I534: BULMER | L534: BOYD | O534: WHALEBONE | R534: MANIE | W534: WILLIAMSTOWN | X534: 9 | Y534: 0 | Z534: 0 | AA534: 848 | AB534: 457 | AC534: 185.55798687089717 | AD534: 36
A535: GOALKICKERS | W535: BRUNSWICK | X535: 8 | Y535: 1 | Z535: 0 | AA535: 790 | AB535: 564 | AC535: 140.0709219858156 | AD535: 32
A536: PORT MELBOURNE | C536: BONNETT 4 | F536: MONKS 4 | I536: JOHNSON 2 | L536: SYKES 2 | O536: EVANS | Q536: McMASTER | W536: PORT MELBOURNE | X536: 7 | Y536: 2 | Z536: 0 | AA536: 964 | AB536: 562 | AC536: 171.53 | AD536: 28
A537: MOORABBIN | C537: WHALEBONE 3 | G537: BOYD 3 | I537: RENWICK 2 | L537: BULMER | N537: McGAW | W537: MOORABBIN | X537: 7 | Y537: 2 | Z537: 0 | AA537: 877 | AB537: 627 | AC537: 139.87 | AD537: 28
A539: PRESTON | C539: 4 | D539: 2 | E539: =C539*6+D539 -> 26 | G539: 8 | H539: 7 | I539: =G539*6+H539 -> 55 | K539: 9 | L539: 8 | M539: =K539*6+L539 -> 62 | O539: 11 | P539: 10 | Q539: =O539*6+P539 -> 76 | S539: YARRAVILLE | W539: YARRAVILLE | X539: 5 | Y539: 4 | Z539: 0 | AA539: 754 | AB539: 632 | AC539: 119.30379746835443 | AD539: 20
A540: YARRAVILLE | C540: 5 | D540: 4 | E540: =C540*6+D540 -> 34 | G540: 6 | H540: 7 | I540: =G540*6+H540 -> 43 | K540: 9 | L540: 16 | M540: =K540*6+L540 -> 70 | O540: 9 | P540: 20 | Q540: =O540*6+P540 -> 74 | S540: ROACH | W540: PRESTON | X540: 5 | Y540: 4 | Z540: 0 | AA540: 759 | AB540: 677 | AC540: 112.1122599704579 | AD540: 20
A541: BEST PLAYERS | W541: COBURG | X541: 4 | Y541: 5 | Z541: 0 | AA541: 730 | AB541: 703 | AC541: 103.84068278805121 | AD541: 16
A542: PRESTON | C542: LITTLE | F542: McCONNELL | I542: FOOTE | L542: HILL | O542: DAWSON | R542: FOLEY | W542: BOX HILL | X542: 4 | Y542: 5 | Z542: 0 | AA542: 646 | AB542: 686 | AC542: 94.169096209912539 | AD542: 16
A543: YARRAVILLE | C543: BODSWORTH | F543: ROHLEDER | I543: DE JONG | L543: BOURKE | O543: WEBB | R543: MASON | W543: SANDRINGHAM | X543: 4 | Y543: 5 | Z543: 0 | AA543: 645 | AB543: 721 | AC543: 89.45908460471567 | AD543: 16
A544: GOALKICKERS | W544: PRAHRAN | X544: 3 | Y544: 6 | Z544: 0 | AA544: 717 | AB544: 934 | AC544: 76.766595289079234 | AD544: 12
A545: PRESTON | C545: F CHARD 5 | F545: GLEESON 3 | I545: BREARLEY 2 | L545: SWEET | W545: CAMBERWELL | X545: 3 | Y545: 6 | Z545: 0 | AA545: 595 | AB545: 845 | AC545: 70.414201183431956 | AD545: 12
A546: YARRAVILLE | C546: BODSWORTH 2 | G546: MAGEE 2 | J546: CAREY 2 | M546: SCHUMAN | P546: BOURKE | R546: WILD | W546: OAKLEIGH | X546: 2 | Y546: 7 | Z546: 0 | AA546: 577 | AB546: 856 | AC546: 67.41 | AD546: 8
W547: NORTHCOTE | X547: 1 | Y547: 8 | Z547: 0 | AA547: 564 | AB547: 862 | AC547: 65.429234338747094 | AD547: 4
A548: BRUNSWICK | C548: 3 | D548: 0 | E548: =C548*6+D548 -> 18 | G548: 8 | H548: 4 | I548: =G548*6+H548 -> 52 | K548: 12 | L548: 5 | M548: =K548*6+L548 -> 77 | O548: 16 | P548: 10 | Q548: =O548*6+P548 -> 106 | S548: CAMBERWELL | W548: BRIGHTON | X548: 1 | Y548: 8 | Z548: 0 | AA548: 605 | AB548: 945 | AC548: 64.021164021164026 | AD548: 4
A549: CAMBERWELL | C549: 2 | D549: 4 | E549: =C549*6+D549 -> 16 | G549: 2 | H549: 8 | I549: =G549*6+H549 -> 20 | K549: 7 | L549: 9 | M549: =K549*6+L549 -> 51 | O549: 8 | P549: 11 | Q549: =O549*6+P549 -> 59 | S549: O'DONOGHUE
A550: BEST PLAYERS
A551: BRUNSWICK | C551: K DILLON | F551: RUSS | I551: LOVETT | L551: JARMAN | O551: HAYES | R551: WEIR
A552: CAMBERWELL | C552: ROSS | F552: BELL | I552: HOLYOAK | L552: COLEMAN | O552: MASON | R552: NELSON
A553: GOALKICKERS
A554: BRUNSWICK | C554: HAYES 5 | F554: K DILLON 4 | I554: JARMAN 3 | L554: WEIR 2 | N554: J DILLON | Q554: McFARLANE
A555: CAMBERWELL | C555: NELSON 3 | F555: HIGSON 3 | I555: MASON | K555: ROSS
C556: 17TH JUNE | G556: QUEENS BIRTHDAY | K556: WEATHER | N556: NORTH WEST BREEZE DULL
A557: COBURG | C557: 2 | D557: 0 | E557: =C557*6+D557 -> 12 | G557: 6 | H557: 3 | I557: =G557*6+H557 -> 39 | K557: 8 | L557: 6 | M557: =K557*6+L557 -> 54 | O557: 12 | P557: 13 | Q557: =O557*6+P557 -> 85 | S557: COBURG
A558: BOX HILL | C558: 4 | D558: 10 | E558: =C558*6+D558 -> 34 | G558: 5 | H558: 11 | I558: =G558*6+H558 -> 41 | K558: 8 | L558: 19 | M558: =K558*6+L558 -> 67 | O558: 9 | P558: 20 | Q558: =O558*6+P558 -> 74 | S558: ROWE
A559: BEST PLAYERS
A560: COBURG | C560: SHORT | F560: HUGHES | I560: SHAW | L560: YOUNG | O560: BIGELOW | R560: SASSELLA
A561: BOX HILL | C561: RICHARDS | F561: DEVERY | I561: WHITE | L561: CRAIG | O561: IRVINE | R561: DUMMELOW
A562: GOALKICKERS
A563: COBURG | C563: HEWES 7 | F563: WILKINSON | I563: SHAW | K563: JORDAN | M563: SASSELLA | P563: BIGELOW
A564: BOX HILL | C564: BROWN 2 | F564: COX 2 | H564: RICHARDS 2 | K564: ELSWORTH | N564: LOVE | P564: DEVERY
A566: SANDRINGHAM | C566: 4 | D566: 2 | E566: =C566*6+D566 -> 26 | G566: 5 | H566: 3 | I566: =G566*6+H566 -> 33 | K566: 9 | L566: 5 | M566: =K566*6+L566 -> 59 | O566: 13 | P566: 7 | Q566: =O566*6+P566 -> 85 | S566: OAKLEIGH
A567: OAKLEIGH | C567: 1 | D567: 5 | E567: =C567*6+D567 -> 11 | G567: 5 | H567: 9 | I567: =G567*6+H567 -> 39 | K567: 7 | L567: 12 | M567: =K567*6+L567 -> 54 | O567: 10 | P567: 17 | Q567: =O567*6+P567 -> 77 | S567: GWYNNE
A568: BEST PLAYERS
A569: SANDRINGHAM | C569: JONES | F569: JOHNSTON | J569: QUINN | M569: ALSOPP | P569: RANSOM | S569: WEBSTER
A570: OAKLEIGH | C570: COLLINS | F570: COUGHLAN | J570: ANDERSON | M570: BAPTIST | P570: LONGNEY | S570: FURZER
A571: GOALKICKERS
A572: SANDRINGHAM | C572: ALSOPP 5 | F572: JOHNSTON 3 | I572: RANSOM 2 | L572: MURPHY | N572: K EVANS | Q572: GRANGER
A573: OAKLEIGH | C573: McGOWAN 3 | F573: LONGNEY 2 | I573: COUGHLAN | L573: WINTERS | N573: KELLETT | Q573: BAPTIST | T573: ANDERSON
A575: PRAHRAN | C575: 5 | D575: 3 | E575: =C575*6+D575 -> 33 | G575: 9 | H575: 5 | I575: =G575*6+H575 -> 59 | K575: 12 | L575: 11 | M575: =K575*6+L575 -> 83 | O575: 14 | P575: 15 | Q575: =O575*6+P575 -> 99 | S575: NORTHCOTE
A576: NORTHCOTE | C576: 2 | D576: 1 | E576: =C576*6+D576 -> 13 | G576: 2 | H576: 5 | I576: =G576*6+H576 -> 17 | K576: 3 | L576: 6 | M576: =K576*6+L576 -> 24 | O576: 8 | P576: 14 | Q576: =O576*6+P576 -> 62 | S576: BREWER
A577: BEST PLAYERS
A578: PRAHRAN | C578: ROY JONES | F578: ROSS JONES | J578: MORROW | M578: WILSON | P578: SHILLABEER | S578: McKENZIE
A579: NORTHCOTE | C579: POWELL | F579: ALDRIDGE | J579: ZIMMER | M579: L WALKER | P579: GERVASONI | S579: JOHNSON
A580: GOALKICKERS
A581: PRAHRAN | C581: McKENZIE 4 | F581: HORSFIELD 2 | I581: PEARSON 2 | L581: WHARTON 2 | O581: McCULLOCH 2 | R581: O'BRYAN | T581: HARVEY
A582: NORTHCOTE | C582: PETERS 3 | F582: ZIMMER 2 | I582: FRANCIS 2 | L582: LOTT
A584: WILLIAMSTOWN | C584: 5 | D584: 4 | E584: =C584*6+D584 -> 34 | G584: 6 | H584: 7 | I584: =G584*6+H584 -> 43 | K584: 11 | L584: 11 | M584: =K584*6+L584 -> 77 | O584: 16 | P584: 13 | Q584: =O584*6+P584 -> 109 | S584: ELSTERNWICK PARK
A585: BRIGHTON | C585: 4 | D585: 1 | E585: =C585*6+D585 -> 25 | G585: 7 | H585: 4 | I585: =G585*6+H585 -> 46 | K585: 8 | L585: 5 | M585: =K585*6+L585 -> 53 | O585: 10 | P585: 7 | Q585: =O585*6+P585 -> 67 | S585: JENKINS
A586: BEST PLAYERS
A587: WILLIAMSTOWN | C587: CALLAHAN | F587: OUTEN | I587: SMITH | M587: MARTIN | P587: WARD | S587: EVANS
A588: BRIGHTON | C588: McCANN | F588: DALEY | I588: COLLINS | M588: PRETTY | P588: KERR | S588: GURRY
A589: GOALKICKERS
A590: WILLIAMSTOWN | C590: SMITH 4 | F590: MURPHY 3 | I590: McPHERSON 3 | L590: WARD 2 | N590: CALLAHAN 2 | Q590: JONES | S590: REED
A591: BRIGHTON | C591: DALEY 3 | F591: WOOLSTENCROFT 2 | K591: HART 2 | M591: COOPER | O591: CRAIG | Q591: HUNTER
A593: ROUND 10 | E593: 22ND JUNE | J593: WEATHER | M593: SOUTH EAST WIND GROUNDS WET | S593: PLAYED AT
D594: 1ST QTR | H594: 2ND QTR | L594: 3RD QTR | P594: FINAL | S594: BRUNSWICK
A595: WILLIAMSTOWN | C595: 2 | D595: 2 | E595: =C595*6+D595 -> 14 | G595: 4 | H595: 10 | I595: =G595*6+H595 -> 34 | K595: 7 | L595: 13 | M595: =K595*6+L595 -> 55 | O595: 13 | P595: 19 | Q595: =O595*6+P595 -> 97 | S595: UMPIRE | X595: LADDER | AB595: ROUND | AD595: 10
A596: BRUNSWICK | C596: 2 | D596: 1 | E596: =C596*6+D596 -> 13 | G596: 2 | H596: 3 | I596: =G596*6+H596 -> 15 | K596: 4 | L596: 6 | M596: =K596*6+L596 -> 30 | O596: 5 | P596: 7 | Q596: =O596*6+P596 -> 37 | S596: ROACH
A597: BEST PLAYERS | W597: TEAM | X597: W | Y597: L | Z597: D | AA597: FOR | AB597: AGST | AC597: % | AD597: PTS
A598: WILLIAMSTOWN | C598: KENT | F598: OUTEN | I598: MUNDAY | L598: SMITH | O598: E BEITZEL | R598: EVANS
A599: BRUNSWICK | C599: K DILLON | F599: ROLFS | I599: LOVETT | L599: MULLENGER | O599: NEILSON | R599: J DILLON | W599: WILLIAMSTOWN | X599: 10 | Y599: 0 | Z599: 0 | AA599: 945 | AB599: 494 | AC599: 191.29554655870444 | AD599: 40
A600: GOALKICKERS | W600: PORT MELBOURNE | X600: 8 | Y600: 2 | Z600: 0 | AA600: 1097 | AB600: 613 | AC600: 178.96 | AD600: 32
A601: WILLIAMSTOWN | C601: McPHERSON 4 | F601: MURPHY 3 | I601: WARD 2 | K601: WHITTAKER 2 | N601: GEAR | P601: LAURIE | W601: MOORABBIN | X601: 8 | Y601: 2 | Z601: 0 | AA601: 963 | AB601: 678 | AC601: 142.04 | AD601: 32
A602: BRUNSWICK | C602: MULLENGER 2 | F602: K DILLON | I602: DEAS | K602: SEYMOUR | W602: BRUNSWICK | X602: 8 | Y602: 2 | Z602: 0 | AA602: 827 | AB602: 661 | AC602: 125.11346444780635 | AD602: 32
A604: SANDRINGHAM | C604: 3 | D604: 0 | E604: =C604*6+D604 -> 18 | G604: 3 | H604: 1 | I604: =G604*6+H604 -> 19 | K604: 3 | L604: 4 | M604: =K604*6+L604 -> 22 | O604: 11 | P604: 8 | Q604: =O604*6+P604 -> 74 | S604: YARRAVILLE | W604: PRESTON | X604: 6 | Y604: 4 | Z604: 0 | AA604: 831 | AB604: 726 | AC604: 114.46280991735537 | AD604: 24
A605: YARRAVILLE | C605: 2 | D605: 6 | E605: =C605*6+D605 -> 18 | G605: 3 | H605: 10 | I605: =G605*6+H605 -> 28 | K605: 7 | L605: 15 | M605: =K605*6+L605 -> 57 | O605: 7 | P605: 19 | Q605: =O605*6+P605 -> 61 | S605: O'DONOGHUE | W605: YARRAVILLE | X605: 5 | Y605: 5 | Z605: 0 | AA605: 815 | AB605: 706 | AC605: 115.43909348441926 | AD605: 20
A606: BEST PLAYERS | W606: COBURG | X606: 5 | Y606: 5 | Z606: 0 | AA606: 857 | AB606: 765 | AC606: 112.02614379084967 | AD606: 20
A607: SANDRINGHAM | C607: JONES | F607: HAMBLY | I607: THOMPSON | L607: RANSOM | O607: WINTERS | R607: McLEAN | W607: SANDRINGHAM | X607: 5 | Y607: 5 | Z607: 0 | AA607: 719 | AB607: 782 | AC607: 91.943734015345271 | AD607: 20
A608: YARRAVILLE | C608: STONE | F608: GARRICK | I608: BODSWORTH | L608: MASON | O608: COCKRAM | R608: DIXON | W608: BOX HILL | X608: 4 | Y608: 6 | Z608: 0 | AA608: 712 | AB608: 757 | AC608: 94.055482166446495 | AD608: 16
A609: GOALKICKERS | W609: PRAHRAN | X609: 3 | Y609: 7 | Z609: 0 | AA609: 768 | AB609: 1067 | AC609: 71.977507029053427 | AD609: 12
A610: SANDRINGHAM | C610: BOLAND 3 | F610: RANSOM 2 | I610: McLEAN | K610: R EVANS | M610: MURPHY | O610: ALSOPP | Q610: STEELE | W610: OAKLEIGH | X610: 3 | Y610: 7 | Z610: 0 | AA610: 648 | AB610: 922 | AC610: 70.28 | AD610: 12
A611: YARRAVILLE | C611: BODSWORTH 2 | G611: MAGEE 2 | J611: ROHLEDER | M611: BOURKE | O611: DE JONG | W611: CAMBERWELL | X611: 3 | Y611: 7 | Z611: 0 | AA611: 646 | AB611: 931 | AC611: 69.387755102040813 | AD611: 12
W612: BRIGHTON | X612: 1 | Y612: 9 | Z612: 0 | AA612: 654 | AB612: 1017 | AC612: 64.306784660766965 | AD612: 4
A613: PORT MELBOURNE | C613: 2 | D613: 2 | E613: =C613*6+D613 -> 14 | G613: 8 | H613: 9 | I613: =G613*6+H613 -> 57 | K613: 10 | L613: 11 | M613: =K613*6+L613 -> 71 | O613: 19 | P613: 19 | Q613: =O613*6+P613 -> 133 | S613: PORT MELBOURNE | W613: NORTHCOTE | X613: 1 | Y613: 9 | Z613: 0 | AA613: 626 | AB613: 989 | AC613: 63.296258847320523 | AD613: 4
A614: PRAHRAN | C614: 5 | D614: 4 | E614: =C614*6+D614 -> 34 | G614: 6 | H614: 4 | I614: =G614*6+H614 -> 40 | K614: 7 | L614: 9 | M614: =K614*6+L614 -> 51 | O614: 7 | P614: 9 | Q614: =O614*6+P614 -> 51 | S614: IRVING
A615: BEST PLAYERS
A616: PORT MELBOURNE | C616: MONKS | F616: WITHERS | I616: JOHNSON | L616: E ATKINSON | O616: LEWIS | R616: McMASTER
A617: PRAHRAN | C617: MPRROE | F617: HARVEY | I617: O'BRYAN | L617: ROY JONES | O617: SHILLABEER | R617: COOPER
A618: GOALKICKERS
A619: PORT MELBOURNE | C619: BONNETT 5 | F619: MONKS 4 | I619: JOHNSON 2 | L619: THOMPSON 2 | O619: MORRIS 2 | R619: OLDFIELD | T619: E ATKINSON | W619: LAFFEY | X619: EVANS
A620: PRAHRAN | C620: HARVEY 4 | F620: McCULLOCH | I620: DOOLEY | L620: O'BRYAN
A622: MOORABBIN | C622: 2 | D622: 4 | E622: =C622*6+D622 -> 16 | G622: 9 | H622: 6 | I622: =G622*6+H622 -> 60 | K622: 9 | L622: 8 | M622: =K622*6+L622 -> 62 | O622: 12 | P622: 14 | Q622: =O622*6+P622 -> 86 | S622: CAMBERWELL
A623: CAMBERWELL | C623: 2 | D623: 3 | E623: =C623*6+D623 -> 15 | G623: 4 | H623: 8 | I623: =G623*6+H623 -> 32 | K623: 4 | L623: 17 | M623: =K623*6+L623 -> 41 | O623: 5 | P623: 21 | Q623: =O623*6+P623 -> 51 | S623: JENKINS
A624: BEST PLAYERS
A625: MOORABBIN | C625: GILDER | F625: RENWICK | I625: BOYD | L625: McGAW | O625: CLOVER | R625: GREEN
A626: CAMBERWELL | C626: ROSS | F626: AMERY | I626: TEMPANY | L626: HOLYOAK | O626: CHAMBERS | R626: SKALBERG
A627: GOALKICKERS
A628: MOORABBIN | C628: RENWICK 8 | F628: MANIE 2 | I628: HOY | K628: McGAW
A629: CAMBERWELL | C629: MASON 2 | F629: SKALBERG | I629: COLEMAN | L629: HIGSON
A631: OAKLEIGH | C631: 3 | D631: 1 | E631: =C631*6+D631 -> 19 | G631: 4 | H631: 3 | I631: =G631*6+H631 -> 27 | K631: 9 | L631: 4 | M631: =K631*6+L631 -> 58 | O631: 11 | P631: 5 | Q631: =O631*6+P631 -> 71 | S631: OAKLEIGH
A632: BOX HILL | C632: 3 | D632: 5 | E632: =C632*6+D632 -> 23 | G632: 6 | H632: 11 | I632: =G632*6+H632 -> 47 | K632: 7 | L632: 14 | M632: =K632*6+L632 -> 56 | O632: 8 | P632: 18 | Q632: =O632*6+P632 -> 66 | S632: BREWER
A633: BEST PLAYERS
A634: OAKLEIGH | C634: FURZER | F634: COUGHLAN | I634: B WILLIAMS | L634: D'ARCY | O634: McGOWAN | R634: PRENDERGAST
A635: BOX HILL | C635: IRVINE | F635: LOVE | I635: CRAIG | L635: WRIGHT | O635: RICHARDS | R635: A JONES
A636: GOALKICKERS
A637: OAKLEIGH | C637: BASSETT 3 | F637: McGOWAN 2 | I637: LONGNEY 2 | L637: KELLETT 2 | O637: COUGHLAN | R637: WINTER
A638: BOX HILL | C638: RICHARDS 3 | F638: McKENZIE | I638: EADE | K638: A JONES | M638: DEVERY | O638: LOVE
A640: COBURG | C640: 9 | D640: 6 | E640: =C640*6+D640 -> 60 | G640: 14 | H640: 8 | I640: =G640*6+H640 -> 92 | K640: 18 | L640: 12 | M640: =K640*6+L640 -> 120 | O640: 19 | P640: 13 | Q640: =O640*6+P640 -> 127 | S640: NORTHCOTE
A641: NORTHCOTE | C641: 0 | D641: 0 | E641: =C641*6+D641 -> 0 | G641: 4 | H641: 4 | I641: =G641*6+H641 -> 28 | K641: 6 | L641: 5 | M641: =K641*6+L641 -> 41 | O641: 9 | P641: 8 | Q641: =O641*6+P641 -> 62 | S641: GWYNNE
A642: BEST PLAYERS
A643: COBURG | C643: GOULLET | F643: McCOLL | I643: JORDAN | L643: MAHONEY | O643: WYMER | R643: HORSKINS
A644: NORTHCOTE | C644: ALDRIDGE | F644: WOOLNOUGH | I644: DEVINE | L644: POWELL | O644: PETERS | R644: J JOHNSON
A645: GOALKICKERS
A646: COBURG | C646: HEWES 5 | F646: JORDAN 4 | I646: WILKINSON 2 | L646: SHAW 2 | N646: BRENNAN 2 | Q646: BIGELOW | S646: WYMER | U646: GOULLET | W646: HORSKINS
A647: NORTHCOTE | C647: CRADDOCK 2 | F647: LOTT | H647: WELSH | J647: J VAINS | M647: PETERS | O647: DEVINE | Q647: ATKINSON | S647: OLIVER
A649: PRESTON | C649: 4 | D649: 3 | E649: =C649*6+D649 -> 27 | G649: 4 | H649: 6 | I649: =G649*6+H649 -> 30 | K649: 8 | L649: 10 | M649: =K649*6+L649 -> 58 | O649: 10 | P649: 12 | Q649: =O649*6+P649 -> 72 | S649: ELSTERNWICK PARK
A650: BRIGHTON | C650: 1 | D650: 2 | E650: =C650*6+D650 -> 8 | G650: 1 | H650: 6 | I650: =G650*6+H650 -> 12 | K650: 3 | L650: 10 | M650: =K650*6+L650 -> 28 | O650: 6 | P650: 13 | Q650: =O650*6+P650 -> 49 | S650: ROWE
A651: BEST PLAYERS
A652: PRESTON | C652: HILL | F652: GLEESON | I652: PREST | M652: SWEET | P652: FOLEY | R652: COOPER
A653: BRIGHTON | C653: McCANN | F653: DALEY | I653: WOOLSTENCROFT | M653: COCKFIELD | P653: PRETTY | R653: MILNES
A654: GOALKICKERS
A655: PRESTON | C655: SIDE 3 | E655: F CHARD 3 | H655: FOLEY 2 | J655: GLEESON | M655: SWEET
A656: BRIGHTON | C656: CRAIG 2 | F656: DALEY | H656: PEARSON | J656: HART | M656: COLLINS
A658: ROUND 11 | E658: 29TH JUNE | J658: WEATHER | M658: WEST BREEZE MILD & SUNNY | S658: PLAYED AT
D659: 1ST QTR | H659: 2ND QTR | L659: 3RD QTR | P659: FINAL | S659: PRESTON
A660: PRESTON | C660: 5 | D660: 1 | E660: =C660*6+D660 -> 31 | G660: 11 | H660: 8 | I660: =G660*6+H660 -> 74 | K660: 14 | L660: 10 | M660: =K660*6+L660 -> 94 | O660: 17 | P660: 15 | Q660: =O660*6+P660 -> 117 | S660: UMPIRE | X660: LADDER | AB660: ROUND | AD660: 11
A661: BRUNSWICK | C661: 1 | D661: 5 | E661: =C661*6+D661 -> 11 | G661: 3 | H661: 6 | I661: =G661*6+H661 -> 24 | K661: 8 | L661: 11 | M661: =K661*6+L661 -> 59 | O661: 10 | P661: 13 | Q661: =O661*6+P661 -> 73 | S661: IRVING
A662: BEST PLAYERS | W662: TEAM | X662: W | Y662: L | Z662: D | AA662: FOR | AB662: AGST | AC662: % | AD662: PTS
A663: PRESTON | C663: F CHARD | F663: COOPER | I663: FOOTE | L663: DAWSON | O663: FOLEY | R663: HILL
A664: BRUNSWICK | C664: LINKINS | F664: K DILLON | I664: SEYMOUR | L664: DEAS | O664: ROLFS | R664: WEIR | W664: WILLIAMSTOWN | X664: 11 | Y664: 0 | Z664: 0 | AA664: 1051 | AB664: 542 | AC664: 193.91143911439116 | AD664: 44
A665: GOALKICKERS | W665: MOORABBIN | X665: 9 | Y665: 2 | Z665: 0 | AA665: 1085 | AB665: 730 | AC665: 148.63 | AD665: 36
A666: PRESTON | C666: F CHARD 6 | F666: OSBORNE 2 | I666: LITTLE 2 | K666: FOLEY 2 | M666: WILLIAMS 2 | P666: SIDE | Q666: HAYES | S666: DAWSON | W666: PORT MELBOURNE | X666: 8 | Y666: 3 | Z666: 0 | AA666: 1179 | AB666: 734 | AC666: 160.63 | AD666: 32
A667: BRUNSWICK | C667: K DILLON 3 | F667: HAYES 3 | I667: LOVETT | K667: DEAS | M667: WEIR | O667: J DILLON | W667: BRUNSWICK | X667: 8 | Y667: 3 | Z667: 0 | AA667: 900 | AB667: 778 | AC667: 115.68123393316195 | AD667: 32
A669: BOX HILL | C669: 6 | D669: 3 | E669: =C669*6+D669 -> 39 | G669: 13 | H669: 8 | I669: =G669*6+H669 -> 86 | K669: 16 | L669: 12 | M669: =K669*6+L669 -> 108 | O669: 18 | P669: 13 | Q669: =O669*6+P669 -> 121 | S669: BOX HILL | W669: PRESTON | X669: 7 | Y669: 4 | Z669: 0 | AA669: 948 | AB669: 799 | AC669: 118.64831038798498 | AD669: 28
A670: PORT MELBOURNE | C670: 1 | D670: 4 | E670: =C670*6+D670 -> 10 | G670: 6 | H670: 5 | I670: =G670*6+H670 -> 41 | K670: 9 | L670: 7 | M670: =K670*6+L670 -> 61 | O670: 12 | P670: 10 | Q670: =O670*6+P670 -> 82 | S670: ROACH | W670: COBURG | X670: 6 | Y670: 5 | Z670: 0 | AA670: 924 | AB670: 796 | AC670: 116.08040201005025 | AD670: 24
A671: BEST PLAYERS | W671: YARRAVILLE | X671: 5 | Y671: 6 | Z671: 0 | AA671: 879 | AB671: 784 | AC671: 112.11734693877551 | AD671: 20
A672: BOX HILL | C672: BENNETT | F672: McKENZIE | I672: CRAIG | L672: SAWATSKY | O672: ELSWORTH | R672: PLUNKETT | W672: BOX HILL | X672: 5 | Y672: 6 | Z672: 0 | AA672: 833 | AB672: 839 | AC672: 99.284862932061984 | AD672: 20
A673: PORT MELBOURNE | C673: R ATKINSON | F673: SYKES | I673: WITHERS | L673: McMASTER | O673: TYRELL | R673: MONKS | W673: SANDRINGHAM | X673: 5 | Y673: 6 | Z673: 0 | AA673: 792 | AB673: 864 | AC673: 91.666666666666671 | AD673: 20
A674: GOALKICKERS | N674: WRIGHT | Q674: GOOCH | S674: PLUNKETT | W674: PRAHRAN | X674: 4 | Y674: 7 | Z674: 0 | AA674: 846 | AB674: 1131 | AC674: 74.801061007957557 | AD674: 16
A675: BOX HILL | C675: BENNETT 6 | F675: DEVERY 3 | I675: SAWATSKY 2 | L675: GRAYSON 2 | O675: McKENZIE | R675: ELLSWORTH | W675: CAMBERWELL | X675: 4 | Y675: 7 | Z675: 0 | AA675: 728 | AB675: 1004 | AC675: 72.509960159362549 | AD675: 16
A676: PORT MELBOURNE | C676: SYKES 4 | F676: OLDFIELD 3 | I676: MONKS 2 | L676: EVANS | N676: JOHNSON | Q676: MORRIS | W676: OAKLEIGH | X676: 3 | Y676: 8 | Z676: 0 | AA676: 679 | AB676: 989 | AC676: 68.66 | AD676: 12
W677: BRIGHTON | X677: 1 | Y677: 10 | Z677: 0 | AA677: 706 | AB677: 1139 | AC677: 61.984196663740121 | AD677: 4
A678: COBURG | C678: 2 | D678: 1 | E678: =C678*6+D678 -> 13 | G678: 6 | H678: 7 | I678: =G678*6+H678 -> 43 | K678: 7 | L678: 11 | M678: =K678*6+L678 -> 53 | O678: 9 | P678: 13 | Q678: =O678*6+P678 -> 67 | S678: COBURG | W678: NORTHCOTE | X678: 1 | Y678: 10 | Z678: 0 | AA678: 674 | AB678: 1095 | AC678: 61.552511415525117 | AD678: 4
A679: OAKLEIGH | C679: 1 | D679: 3 | E679: =C679*6+D679 -> 9 | G679: 3 | H679: 4 | I679: =G679*6+H679 -> 22 | K679: 4 | L679: 7 | M679: =K679*6+L679 -> 31 | O679: 4 | P679: 7 | Q679: =O679*6+P679 -> 31 | S679: ROWE
A680: BEST PLAYERS
A681: COBURG | C681: BIGELOW | F681: SMITH | I681: SHAW | L681: HORSKINS | O681: MAHONEY | R681: JORDAN
A682: OAKLEIGH | C682: D'ARCY | F682: COLLINS | I682: LONGNEY | L682: WINTER | O682: LANE | R682: McGOWAN
A683: GOALKICKERS
A684: COBURG | C684: HEWES 3 | F684: SHAW 2 | I684: BIGELOW | K684: JORDAN | M684: PEARCE | O684: GOULLET
A685: OAKLEIGH | C685: LONGNEY 3 | F685: McGOWAN
A687: PRAHRAN | C687: 3 | D687: 5 | E687: =C687*6+D687 -> 23 | G687: 5 | H687: 10 | I687: =G687*6+H687 -> 40 | K687: 7 | L687: 14 | M687: =K687*6+L687 -> 56 | O687: 10 | P687: 18 | Q687: =O687*6+P687 -> 78 | S687: TOORAK PARK
A688: YARRAVILLE | C688: 4 | D688: 4 | E688: =C688*6+D688 -> 28 | G688: 6 | H688: 5 | I688: =G688*6+H688 -> 41 | K688: 8 | L688: 8 | M688: =K688*6+L688 -> 56 | O688: 9 | P688: 10 | Q688: =O688*6+P688 -> 64 | S688: GWYYNE
A689: BEST PLAYERS
A690: PRAHRAN | C690: BOYD | F690: CHRISTIAN | I690: PLAIN | L690: HORSFIELD | O690: O'BRYAN | R690: HEAD
A691: YARRAVILLE | C691: CAREY | F691: MASON | I691: WEBB | L691: GARRICK | O691: ROHLEDER | R691: DE JONG
A692: GOALKICKERS
A693: PRAHRAN | C693: HARVEY 2 | F693: McKENZIE 2 | I693: McCULLOCH 2 | L693: O'BRYAN | N693: CLEAR | P693: BOYD | R693: HORSFIELD
A694: YARRAVILLE | C694: PITT 4 | F694: RULE 3 | I694: CAREY 2
A696: CAMBERWELL | C696: 1 | D696: 4 | E696: =C696*6+D696 -> 10 | G696: 4 | H696: 7 | I696: =G696*6+H696 -> 31 | K696: 8 | L696: 13 | M696: =K696*6+L696 -> 61 | O696: 11 | P696: 16 | Q696: =O696*6+P696 -> 82 | S696: BEACH ROAD
A697: SANDRINGHAM | C697: 3 | D697: 5 | E697: =C697*6+D697 -> 23 | G697: 6 | H697: 9 | I697: =G697*6+H697 -> 45 | K697: 6 | L697: 9 | M697: =K697*6+L697 -> 45 | O697: 10 | P697: 13 | Q697: =O697*6+P697 -> 73 | S697: CARDWELL
A698: BEST PLAYERS
A699: CAMBERWELL | C699: CHAMBERS | F699: ROSS | I699: HOLYOAK | M699: BELL | O699: McGUINNESS | R699: CHAPLIN
A700: SANDRINGHAM | C700: R EVANS | F700: CROFT | I700: C JOHNSTON | M700: McLEAN | O700: RANSOM | R700: QUINN
A701: GOALKICKERS
A702: CAMBERWELL | C702: SKALBERG 2 | F702: McGUINNESS 2 | J702: HOLYOAK 2 | M702: HIGSON | O702: MASON | Q702: McPHAIL | S702: TEMPANY | V702: LANNING
A703: SANDRINGHAM | C703: ALSOPP 3 | F703: R EVANS 2 | I703: C JOHNSTON 2 | M703: BOLAND 2 | P703: QUINN
A705: MOORABBIN | C705: 4 | D705: 3 | E705: =C705*6+D705 -> 27 | G705: 9 | H705: 9 | I705: =G705*6+H705 -> 63 | K705: 12 | L705: 11 | M705: =K705*6+L705 -> 83 | O705: 18 | P705: 14 | Q705: =O705*6+P705 -> 122 | S705: MOORABBIN
A706: BRIGHTON | C706: 1 | D706: 0 | E706: =C706*6+D706 -> 6 | G706: 3 | H706: 2 | I706: =G706*6+H706 -> 20 | K706: 5 | L706: 3 | M706: =K706*6+L706 -> 33 | O706: 8 | P706: 4 | Q706: =O706*6+P706 -> 52 | S706: BREWER
A707: BEST PLAYERS
A708: MOORABBIN | C708: BOYD | F708: MANIE | I708: BULL | L708: EVANS | O708: BULMER | R708: TREZISE
A709: BRIGHTON | C709: DALEY | F709: KERR | I709: McCANN | L709: HUNTER | O709: MILNES | R709: CURRIE
A710: GOALKICKERS
A711: MOORABBIN | C711: McGAW 3 | F711: BULL 3 | I711: MANIE 3 | L711: HOY 3 | N711: RENWICK 2 | Q711: JONES 2 | S711: BULMER | V711: MENNIE
A712: BRIGHTON | C712: KERR 3 | F712: RODWELL | I712: HUNTER | K712: HART | M712: COLLINS | O712: DALEY
A714: WILLIAMSTOWN | C714: 6 | D714: 2 | E714: =C714*6+D714 -> 38 | G714: 8 | H714: 5 | I714: =G714*6+H714 -> 53 | K714: 12 | L714: 9 | M714: =K714*6+L714 -> 81 | O714: 15 | P714: 16 | Q714: =O714*6+P714 -> 106 | S714: WILLIAMSTOWN
A715: NORTHCOTE | C715: 1 | D715: 2 | E715: =C715*6+D715 -> 8 | G715: 4 | H715: 4 | I715: =G715*6+H715 -> 28 | K715: 6 | L715: 4 | M715: =K715*6+L715 -> 40 | O715: 7 | P715: 6 | Q715: =O715*6+P715 -> 48 | S715: BREWER
A716: BEST PLAYERS
A717: WILLIAMSTOWN | C717: MARTIN | F717: SIMS | I717: GEAR | L717: McPHERSON | O717: R JONES | R717: EVANS
A718: NORTHCOTE | C718: GERVASONI | F718: POWELL | I718: WRIGHT | L718: PETERS | O718: HEDGER | R718: ADAMSON
A719: GOALKICKERS
A720: WILLIAMSTOWN | C720: McPHERSON 7 | F720: GEAR 2 | I720: SMITH 2 | L720: F JONES | N720: WARD | P720: WHITTAKER | S720: EVANS
A721: NORTHCOTE | C721: ZIMMER 2 | F721: PETERS 2 | I721: ROMARI 2 | L721: GERVASONI
A723: ROUND 12 | E723: 6TH JULY | J723: WEATHER | O723: FINE & SUNNY | S723: PLAYED AT
D724: 1ST QTR | H724: 2ND QTR | L724: 3RD QTR | P724: FINAL | S724: BRUNSWICK
A725: BRUNSWICK | C725: 2 | D725: 1 | E725: =C725*6+D725 -> 13 | G725: 3 | H725: 5 | I725: =G725*6+H725 -> 23 | K725: 5 | L725: 11 | M725: =K725*6+L725 -> 41 | O725: 6 | P725: 13 | Q725: =O725*6+P725 -> 49 | S725: UMPIRE | X725: LADDER | AB725: ROUND | AD725: 12
A726: MOORABBIN | C726: 0 | D726: 1 | E726: =C726*6+D726 -> 1 | G726: 2 | H726: 4 | I726: =G726*6+H726 -> 16 | K726: 2 | L726: 9 | M726: =K726*6+L726 -> 21 | O726: 5 | P726: 15 | Q726: =O726*6+P726 -> 45 | S726: CARDWELL
A727: BEST PLAYERS | W727: TEAM | X727: W | Y727: L | Z727: D | AA727: FOR | AB727: AGST | AC727: % | AD727: PTS
A728: BRUNSWICK | C728: ROLFS | F728: LINKINS | I728: THOMPSON | L728: WEIR | O728: K DILLON | R728: DEAS
A729: MOORABBIN | C729: PECK | F729: MURRAY | I729: CLOVER | L729: MURPHY | O729: ZANELLI | R729: McGAW | W729: WILLIAMSTOWN | X729: 12 | Y729: 0 | Z729: 0 | AA729: 1150 | AB729: 593 | AC729: 193.929173693086 | AD729: 48
A730: GOALKICKERS | W730: PORT MELBOURNE | X730: 9 | Y730: 3 | Z730: 0 | AA730: 1269 | AB730: 818 | AC730: 155.13 | AD730: 36
A731: BRUNSWICK | C731: DEAS 2 | F731: K DILLON | I731: CRONIN | L731: HAYES | N731: WEIR | W731: MOORABBIN | X731: 9 | Y731: 3 | Z731: 0 | AA731: 1130 | AB731: 779 | AC731: 145.06 | AD731: 36
A732: MOORABBIN | C732: RENWICK 3 | F732: EVANS | I732: McGAW | W732: BRUNSWICK | X732: 9 | Y732: 3 | Z732: 0 | AA732: 949 | AB732: 823 | AC732: 115.30984204131227 | AD732: 36
A734: WILLIAMSTOWN | C734: 3 | D734: 5 | E734: =C734*6+D734 -> 23 | G734: 6 | H734: 8 | I734: =G734*6+H734 -> 44 | K734: 10 | L734: 10 | M734: =K734*6+L734 -> 70 | O734: 14 | P734: 15 | Q734: =O734*6+P734 -> 99 | S734: PRESTON | W734: PRESTON | X734: 7 | Y734: 5 | Z734: 0 | AA734: 999 | AB734: 898 | AC734: 111.24721603563475 | AD734: 28
A735: PRESTON | C735: 0 | D735: 1 | E735: =C735*6+D735 -> 1 | G735: 3 | H735: 5 | I735: =G735*6+H735 -> 23 | K735: 5 | L735: 8 | M735: =K735*6+L735 -> 38 | O735: 7 | P735: 9 | Q735: =O735*6+P735 -> 51 | S735: O'DONOGHUE | W735: COBURG | X735: 6 | Y735: 6 | Z735: 0 | AA735: 1008 | AB735: 886 | AC735: 113.77 | AD735: 24
A736: BEST PLAYERS | W736: BOX HILL | X736: 6 | Y736: 6 | Z736: 0 | AA736: 951 | AB736: 932 | AC736: 102.04 | AD736: 24
A737: WILLIAMSTOWN | C737: B BEITZEL | F737: KENT | I737: OUTEN | L737: WARD | O737: MUNDAY | R737: E BEITZEL | W737: SANDRINGHAM | X737: 6 | Y737: 6 | Z737: 0 | AA737: 899 | AB737: 945 | AC737: 95.13 | AD737: 24
A738: PRESTON | C738: FOOTE | F738: CUSACK | I738: PREST | L738: DAWSON | O738: COOPER | R738: SUPPLITT | W738: YARRAVILLE | X738: 5 | Y738: 7 | Z738: 0 | AA738: 972 | AB738: 902 | AC738: 107.76 | AD738: 20
A739: GOALKICKERS | W739: PRAHRAN | X739: 5 | Y739: 7 | Z739: 0 | AA739: 950 | AB739: 1232 | AC739: 77.11 | AD739: 20
A740: WILLIAMSTOWN | C740: McPHERSON 4 | F740: F JONES 3 | I740: B BEITZEL 2 | L740: GEAR | N740: OGDEN | P740: SMITH | R740: WHITTAKER | U740: WARD | W740: CAMBERWELL | X740: 4 | Y740: 8 | Z740: 0 | AA740: 829 | AB740: 1108 | AC740: 74.82 | AD740: 16
A741: PRESTON | C741: F CHARD 3 | F741: FOLEY 2 | I741: HAYES | K741: SWEET | W741: OAKLEIGH | X741: 4 | Y741: 8 | Z741: 0 | AA741: 773 | AB741: 1038 | AC741: 74.47 | AD741: 16
W742: BRIGHTON | X742: 1 | Y742: 11 | Z742: 0 | AA742: 787 | AB742: 1246 | AC742: 63.16 | AD742: 4
A743: PORT MELBOURNE | C743: 4 | D743: 1 | E743: =C743*6+D743 -> 25 | G743: 9 | H743: 5 | I743: =G743*6+H743 -> 59 | K743: 12 | L743: 8 | M743: =K743*6+L743 -> 80 | O743: 13 | P743: 12 | Q743: =O743*6+P743 -> 90 | S743: PORT MELBOURNE | W743: NORTHCOTE | X743: 1 | Y743: 11 | Z743: 0 | AA743: 723 | AB743: 1189 | AC743: 60.81 | AD743: 4
A744: COBURG | C744: 0 | D744: 4 | E744: =C744*6+D744 -> 4 | G744: 5 | H744: 9 | I744: =G744*6+H744 -> 39 | K744: 8 | L744: 14 | M744: =K744*6+L744 -> 62 | O744: 11 | P744: 18 | Q744: =O744*6+P744 -> 84 | S744: BREWER
A745: BEST PLAYERS
A746: PORT MELBOURNE | C746: WITHERS | F746: JOHNSON | I746: BOWEN | L746: LEWIS | O746: MONKS | R746: THOMPSON
A747: COBURG | C747: SMITH | F747: SHAW | I747: GOULLET | L747: JORDAN | O747: WILSON | R747: HORSKINS
A748: GOALKICKERS
A749: PORT MELBOURNE | C749: JOHNSON 3 | F749: OLDFIELD 2 | I749: MONKS 2 | L749: THOMPSON 2 | O749: WITHERS 2 | R749: McMASTER | U749: SYKES
A750: COBURG | C750: JORDAN 5 | F750: McCOLL 2 | I750: SHAW 2 | K750: WILKINSON | N750: HEWES
A752: BOX HILL | C752: 2 | D752: 2 | E752: =C752*6+D752 -> 14 | G752: 5 | H752: 9 | I752: =G752*6+H752 -> 39 | K752: 14 | L752: 13 | M752: =K752*6+L752 -> 97 | O752: 17 | P752: 16 | Q752: =O752*6+P752 -> 118 | S752: YARRAVILLE
A753: YARRAVILLE | C753: 3 | D753: 2 | E753: =C753*6+D753 -> 20 | G753: 6 | H753: 3 | I753: =G753*6+H753 -> 39 | K753: 7 | L753: 4 | M753: =K753*6+L753 -> 46 | O753: 14 | P753: 9 | Q753: =O753*6+P753 -> 93 | S753: JENKINS
A754: BEST PLAYERS
A755: BOX HILL | C755: DEVERY | F755: CRAIG | I755: JONES | L755: BENNETT | O755: JOHNSTON | R755: LOVE
A756: YARRAVILLE | C756: BODSWORTH | F756: MASON | I756: CARSON | L756: ROHLEDER | O756: STONE | R756: GARRICK
A757: GOALKICKERS
A758: BOX HILL | C758: DEVERY 6 | F758: BENNETT 3 | I758: PLUNKETT 2 | L758: WRIGHT 2 | O758: GRAYSON 2 | R758: McKENZIE | T758: ELSWORTH
A759: YARRAVILLE | C759: PITT 3 | E759: RULE 2 | G759: DIXON 2 | I759: CARSON 2 | L759: OLIVER | N759: COLLINS | P759: DE JONG | R759: GARRICK | T759: BOWLER
A761: PRAHRAN | C761: 2 | D761: 7 | E761: =C761*6+D761 -> 19 | G761: 7 | H761: 9 | I761: =G761*6+H761 -> 51 | K761: 12 | L761: 15 | M761: =K761*6+L761 -> 87 | O761: 14 | P761: 20 | Q761: =O761*6+P761 -> 104 | S761: CAMBERWELL
A762: CAMBERWELL | C762: 4 | D762: 4 | E762: =C762*6+D762 -> 28 | G762: 5 | H762: 10 | I762: =G762*6+H762 -> 40 | K762: 10 | L762: 15 | M762: =K762*6+L762 -> 75 | O762: 14 | P762: 17 | Q762: =O762*6+P762 -> 101 | S762: ROWE
A763: BEST PLAYERS
A764: PRAHRAN | C764: MORROW | F764: MCKENZIE | I764: HARVEY | L764: HEALEY | O764: HORSFIELD | R764: PLAIN
A765: CAMBERWELL | C765: HOLYOAK | F765: McPHAIL | I765: ROSS | L765: McGUINNESS | O765: ALSOPP | R765: AMERY
A766: GOALKICKERS
A767: PRAHRAN | C767: McKENZIE 4 | F767: HORSFIELD 3 | I767: McCULLOCH 2 | L767: HEALEY | N767: PLAIN | P767: HEAD | R767: HARVEY | T767: WILSON
A768: CAMBERWELL | C768: HOLYOAK 3 | F768: McPHAIL 3 | I768: McGUINNESS 2 | L768: MASON 2 | O768: HIGSON | Q768: TEMPANY | S768: CHAMBERS | V768: SKALBERG
A770: OAKLEIGH | C770: 3 | D770: 4 | E770: =C770*6+D770 -> 22 | G770: 4 | H770: 12 | I770: =G770*6+H770 -> 36 | K770: 9 | L770: 14 | M770: =K770*6+L770 -> 68 | O770: 13 | P770: 16 | Q770: =O770*6+P770 -> 94 | S770: OAK
A771: NORTHCOTE | C771: 0 | D771: 6 | E771: =C771*6+D771 -> 6 | G771: 3 | H771: 6 | I771: =G771*6+H771 -> 24 | K771: 5 | L771: 6 | M771: =K771*6+L771 -> 36 | O771: 7 | P771: 7 | Q771: =O771*6+P771 -> 49 | S771: ROACH
A772: BEST PLAYERS
A773: OAKLEIGH | C773: PALMER | F773: COUGHLAN | I773: KELLETT | L773: ANDERSON | O773: BACKMAN | R773: PRENDERGAST
A774: NORTHCOTE | C774: GERVASONI | F774: POWELL | I774: WRIGHT | L774: CRADDOCK | O774: McFARLANE | R774: JOHNSON
A775: GOALKICKERS
A776: OAKLEIGH | C776: ANDERSON 4 | F776: KELLETT 3 | I776: LONGNEY 3 | L776: McGOWAN | N776: COUGHLAN | Q776: GRANT
A777: NORTHCOTE | C777: WRIGHT 2 | F777: ZIMMER 2 | I777: GERVASONI | L777: DEVINE | N777: HEDGER
A779: SANDRINGHAM | C779: 0 | D779: 6 | E779: =C779*6+D779 -> 6 | G779: 3 | H779: 16 | I779: =G779*6+H779 -> 34 | K779: 8 | L779: 21 | M779: =K779*6+L779 -> 69 | O779: 14 | P779: 23 | Q779: =O779*6+P779 -> 107 | S779: ELSTERNWICK PARK
A780: BRIGHTON | C780: 3 | D780: 3 | E780: =C780*6+D780 -> 21 | G780: 6 | H780: 4 | I780: =G780*6+H780 -> 40 | K780: 9 | L780: 5 | M780: =K780*6+L780 -> 59 | O780: 12 | P780: 9 | Q780: =O780*6+P780 -> 81 | S780: IRVING
A781: BEST PLAYERS
A782: SANDRINGHAM | C782: HAMBLY | F782: RANSOM | I782: ECCLESTON | L782: McLEAN | O782: K EVANS | R782: STEELE
A783: BRIGHTON | C783: COCKFIELD | F783: COLLINS | I783: CURRIE | L783: McCANN | O783: WILLIAMS | R783: WOOLSTENCROFT
A784: GOALKICKERS
A785: SANDRINGHAM | C785: C JOHNSTON 5 | G785: ECCLESTON 5 | J785: STEELE 3 | M785: RANSOM
A786: BRIGHTON | C786: COLLINS 4 | F786: HART 2 | I786: KERR 2 | K786: WOOLSTENCROFT | O786: DALEY | Q786: PEARSON | S786: MILNES
A788: ROUND 13 | E788: 13TH JULY | J788: WEATHER | O788: WEST WIND | S788: PLAYED AT
D789: 1ST QTR | H789: 2ND QTR | L789: 3RD QTR | P789: FINAL | S789: MOORABBIN
A790: MOORABBIN | C790: 3 | D790: 5 | E790: =C790*6+D790 -> 23 | G790: 6 | H790: 6 | I790: =G790*6+H790 -> 42 | K790: 10 | L790: 8 | M790: =K790*6+L790 -> 68 | O790: 12 | P790: 14 | Q790: =O790*6+P790 -> 86 | S790: UMPIRE | X790: LADDER | AB790: ROUND | AD790: 13
A791: PRESTON | C791: 2 | D791: 2 | E791: =C791*6+D791 -> 14 | G791: 6 | H791: 6 | I791: =G791*6+H791 -> 42 | K791: 6 | L791: 11 | M791: =K791*6+L791 -> 47 | O791: 7 | P791: 19 | Q791: =O791*6+P791 -> 61 | S791: GWYNNE
A792: BEST PLAYERS | W792: TEAM | X792: W | Y792: L | Z792: D | AA792: FOR | AB792: AGST | AC792: % | AD792: PTS
A793: MOORABBIN | C793: PECK | F793: JOHNS | I793: TREZISE | L793: BULMER | O793: MURRAY | R793: STANLEY
A794: PRESTON | C794: LITTLE | F794: FOLEY | I794: HILL | L794: FOOTE | O794: WATT | R794: MILLS | W794: WILLIAMSTOWN | X794: 13 | Y794: 0 | Z794: 0 | AA794: 1215 | AB794: 618 | AC794: 196.60194174757282 | AD794: 52
A795: GOALKICKERS | W795: PORT MELBOURNE | X795: 10 | Y795: 3 | Z795: 0 | AA795: 1337 | AB795: 863 | AC795: 154.92 | AD795: 40
A796: MOORABBIN | C796: RENWICK 6 | F796: BULL 2 | H796: BULMER 2 | K796: MURPHY | M796: JONES | O796: McGAW | W796: MOORABBIN | X796: 10 | Y796: 3 | Z796: 0 | AA796: 1216 | AB796: 840 | AC796: 144.76 | AD796: 40
A797: PRESTON | C797: SIDE | E797: DAWSON | G797: SWEET | I797: F CHARD | L797: OSBORNE | N797: FOLEY | P797: MILLS | W797: BRUNSWICK | X797: 9 | Y797: 4 | Z797: 0 | AA797: 1003 | AB797: 894 | AC797: 112.19239373601789 | AD797: 36
A799: SANDRINGHAM | C799: 4 | D799: 7 | E799: =C799*6+D799 -> 31 | G799: 4 | H799: 8 | I799: =G799*6+H799 -> 32 | K799: 6 | L799: 16 | M799: =K799*6+L799 -> 52 | O799: 9 | P799: 17 | Q799: =O799*6+P799 -> 71 | S799: BEACH ROAD | W799: COBURG | X799: 7 | Y799: 6 | Z799: 0 | AA799: 1084 | AB799: 937 | AC799: 115.68836712913554 | AD799: 28
A800: BRUNSWICK | C800: 2 | D800: 1 | E800: =C800*6+D800 -> 13 | G800: 6 | H800: 4 | I800: =G800*6+H800 -> 40 | K800: 6 | L800: 6 | M800: =K800*6+L800 -> 42 | O800: 7 | P800: 12 | Q800: =O800*6+P800 -> 54 | S800: BREWER | W800: PRESTON | X800: 7 | Y800: 6 | Z800: 0 | AA800: 1060 | AB800: 984 | AC800: 107.72357723577235 | AD800: 28
A801: BEST PLAYERS | W801: BOX HILL | X801: 7 | Y801: 6 | Z801: 0 | AA801: 1058 | AB801: 1015 | AC801: 104.23645320197045 | AD801: 28
A802: SANDRINGHAM | C802: RANSOM | F802: BOLAND | I802: STEELE | L802: ALLSOP | O802: CROFT | R802: JONES | W802: SANDRINGHAM | X802: 7 | Y802: 6 | Z802: 0 | AA802: 970 | AB802: 999 | AC802: 97.097097097097091 | AD802: 28
A803: BRUNSWICK | C803: LOVETT | F803: LINKINS | I803: K DILLON | L803: JARMAN | O803: POLLARD | R803: CREMIN | W803: PRAHRAN | X803: 6 | Y803: 7 | Z803: 0 | AA803: 1053 | AB803: 1300 | AC803: 81 | AD803: 24
A804: GOALKICKERS | W804: YARRAVILLE | X804: 5 | Y804: 8 | Z804: 0 | AA804: 1023 | AB804: 978 | AC804: 104.60122699386503 | AD804: 20
A805: SANDRINGHAM | C805: ALLSOP 4 | F805: STEELE 2 | I805: BOLAND 2 | L805: MARSHALL | W805: CAMBERWELL | X805: 4 | Y805: 9 | Z805: 0 | AA805: 912 | AB805: 1215 | AC805: 75.061728395061735 | AD805: 16
A806: BRUNSWICK | C806: K DILLON 2 | F806: DEAS 2 | I806: JARMAN | K806: HAYES | M806: G STANLEY | W806: OAKLEIGH | X806: 4 | Y806: 9 | Z806: 0 | AA806: 798 | AB806: 1103 | AC806: 72.35 | AD806: 16
W807: BRIGHTON | X807: 1 | Y807: 12 | Z807: 0 | AA807: 855 | AB807: 1349 | AC807: 63.380281690140848 | AD807: 4
A808: COBURG | C808: 2 | D808: 1 | E808: =C808*6+D808 -> 13 | G808: 4 | H808: 5 | I808: =G808*6+H808 -> 29 | K808: 9 | L808: 7 | M808: =K808*6+L808 -> 61 | O808: 11 | P808: 10 | Q808: =O808*6+P808 -> 76 | S808: COBURG | W808: NORTHCOTE | X808: 1 | Y808: 12 | Z808: 0 | AA808: 768 | AB808: 1257 | AC808: 61.097852028639615 | AD808: 4
A809: YARRAVILLE | C809: 1 | D809: 5 | E809: =C809*6+D809 -> 11 | G809: 3 | H809: 9 | I809: =G809*6+H809 -> 27 | K809: 6 | L809: 13 | M809: =K809*6+L809 -> 49 | O809: 6 | P809: 15 | Q809: =O809*6+P809 -> 51 | S809: O'DONOGHUE
A810: BEST PLAYERS
A811: COBURG | C811: SHORT | F811: BIGELOW | I811: HORSKINS | L811: D SHAW | O811: HEWES | R811: BOOTH
A812: YARRAVILLE | C812: DRIVER | F812: STONE | I812: CARSON | L812: WILD | O812: ROHLEDER | R812: TITFORD
A813: GOALKICKERS
A814: COBURG | C814: HEWES 4 | F814: WILKINSON 2 | J814: HORSKINS | M814: GOULLET | O814: J BRENNAN | R814: SHAW | T814: BOYLE
A815: YARRAVILLE | C815: MAGEE 2 | F815: RULE | H815: BODSWORTH | K815: DRIVER | M815: LAMONT
A817: BOX HILL | C817: 4 | D817: 2 | E817: =C817*6+D817 -> 26 | G817: 9 | H817: 6 | I817: =G817*6+H817 -> 60 | K817: 11 | L817: 9 | M817: =K817*6+L817 -> 75 | O817: 15 | P817: 17 | Q817: =O817*6+P817 -> 107 | S817: BOX HILL
A818: CAMBERWELL | C818: 4 | D818: 2 | E818: =C818*6+D818 -> 26 | G818: 6 | H818: 3 | I818: =G818*6+H818 -> 39 | K818: 11 | L818: 5 | M818: =K818*6+L818 -> 71 | O818: 13 | P818: 5 | Q818: =O818*6+P818 -> 83 | S818: CARLTON
A819: BEST PLAYERS
A820: BOX HILL | C820: BENNETT | F820: DEVERY | I820: GOOCH | L820: DISTON | O820: WITHERDEN | R820: TYLER
A821: CAMBERWELL | C821: DUGDALE | F821: MASON | I821: McGUINNESS | L821: AMERY | O821: McPHAIL | R821: HOLYOAK
A822: GOALKICKERS
A823: BOX HILL | C823: BENNETT 7 | F823: DEVERY 3 | I823: GOOCH | K823: RICHARDS | N823: DISTON | P823: PLUNKETT | R823: COX
A824: CAMBERWELL | C824: HIGSON 3 | F824: DUGDALE 3 | I824: McGUINNESS 3 | M824: BELL | O824: HOLYOAK | R824: McPHAIL | T824: CASTLES
A826: PRAHRAN | C826: 2 | D826: 1 | E826: =C826*6+D826 -> 13 | G826: 7 | H826: 6 | I826: =G826*6+H826 -> 48 | K826: 13 | L826: 7 | M826: =K826*6+L826 -> 85 | O826: 15 | P826: 13 | Q826: =O826*6+P826 -> 103 | S826: TOORAK PARK
A827: BRIGHTON | C827: 2 | D827: 5 | E827: =C827*6+D827 -> 17 | G827: 4 | H827: 8 | I827: =G827*6+H827 -> 32 | K827: 8 | L827: 12 | M827: =K827*6+L827 -> 60 | O827: 9 | P827: 14 | Q827: =O827*6+P827 -> 68 | S827: CARDWELL
A828: BEST PLAYERS
A829: PRAHRAN | C829: CLEAR | F829: McKENZIE | I829: HARVEY | L829: HEALEY | O829: C BOYD | S829: MORROW
A830: BRIGHTON | C830: HART | F830: COOPER | I830: COLLINS | L830: HUNTER | O830: WOOLSTENCROFT | S830: PEARSON
A831: GOALKICKERS
A832: PRAHRAN | C832: CLEAR 4 | F832: McKENZIE 3 | I832: McCULLOCH 3 | L832: HARVEY 2 | O832: C BOYD | Q832: HEAD | S832: WHARTON
A833: BRIGHTON | C833: HART 3 | F833: COLLINS 2 | I833: CRAIG | K833: KERR | M833: MILNES | O833: COOPER
A835: WILLIAMSTOWN | C835: 4 | D835: 2 | E835: =C835*6+D835 -> 26 | G835: 7 | H835: 5 | I835: =G835*6+H835 -> 47 | K835: 8 | L835: 10 | M835: =K835*6+L835 -> 58 | O835: 9 | P835: 11 | Q835: =O835*6+P835 -> 65 | S835: WILLIAMSTOWN
A836: OAKLEIGH | C836: 1 | D836: 1 | E836: =C836*6+D836 -> 7 | G836: 1 | H836: 1 | I836: =G836*6+H836 -> 7 | K836: 2 | L836: 5 | M836: =K836*6+L836 -> 17 | O836: 3 | P836: 7 | Q836: =O836*6+P836 -> 25 | S836: IRVING
A837: BEST PLAYERS
A838: WILLIAMSTOWN | C838: GARLICK | F838: F JONES | I838: RAMSAY | L838: SMITH | O838: WHITTAKER | S838: MCPHERSON
A839: OAKLEIGH | C839: ANDERSON | F839: BAPTIST | I839: D'ARCY | L839: ROBINSON | O839: GORDON | S839: COLLINS
A840: GOALKICKERS
A841: WILLIAMSTOWN | C841: R SMITH 3 | F841: F JONES 2 | I841: R JONES | K841: GARLICK | M841: McPHERSON | P841: GEAR
A842: OAKLEIGH | C842: ROBINSON 2 | F842: DOWLING
A844: PORT MELBOURNE | C844: 3 | D844: 5 | E844: =C844*6+D844 -> 23 | G844: 6 | H844: 10 | I844: =G844*6+H844 -> 46 | K844: 8 | L844: 12 | M844: =K844*6+L844 -> 60 | O844: 9 | P844: 14 | Q844: =O844*6+P844 -> 68 | S844: NORTHCOTE
A845: NORTHCOTE | C845: 1 | D845: 3 | E845: =C845*6+D845 -> 9 | G845: 5 | H845: 6 | I845: =G845*6+H845 -> 36 | K845: 5 | L845: 7 | M845: =K845*6+L845 -> 37 | O845: 6 | P845: 9 | Q845: =O845*6+P845 -> 45 | S845: JENKINS
A846: BEST PLAYERS
A847: PORT MELBOURNE | C847: MONKS | F847: LOCKHART | I847: E ATKINSON | L847: R ATKINSON | O847: MORRIS | R847: BOWER
A848: NORTHCOTE | C848: GERVASONI | F848: DEVINE | I848: WOOLNOUGH | L848: F VAINS | O848: CRADDOCK | R848: McFARLANE
A849: GOALKICKERS
A850: PORT MELBOURNE | C850: OLDFIELD 2 | F850: EVANS 2 | I850: SYKES | K850: MORRIS | M850: LEWIS | O850: McMASTER | R850: E ATKINSON
A851: NORTHCOTE | C851: GERVASONI 3 | F851: CLARKE 2 | I851: ADAMSON
A853: ROUND 14 | E853: 20TH JULY | J853: WEATHER | M853: NORTH WEST WIND CLOUDY COLD | S853: PLAYED AT
D854: 1ST QTR | H854: 2ND QTR | L854: 3RD QTR | P854: FINAL | S854: WILLIAMSTOWN
A855: WILLIAMSTOWN | C855: 1 | D855: 2 | E855: =C855*6+D855 -> 8 | G855: 7 | H855: 5 | I855: =G855*6+H855 -> 47 | K855: 9 | L855: 6 | M855: =K855*6+L855 -> 60 | O855: 11 | P855: 15 | Q855: =O855*6+P855 -> 81 | S855: UMPIRE | X855: LADDER | AB855: ROUND | AD855: 14
A856: MOORABBIN | C856: 4 | D856: 7 | E856: =C856*6+D856 -> 31 | G856: 5 | H856: 9 | I856: =G856*6+H856 -> 39 | K856: 7 | L856: 13 | M856: =K856*6+L856 -> 55 | O856: 8 | P856: 13 | Q856: =O856*6+P856 -> 61 | S856: BREWER
A857: BEST PLAYERS | W857: TEAM | X857: W | Y857: L | Z857: D | AA857: FOR | AB857: AGST | AC857: % | AD857: PTS
A858: WILLIAMSTOWN | C858: OUTEN | F858: MARTIN | I858: MURPHY | L858: SMITH | O858: R JONES | R858: LAURIE
A859: MOORABBIN | C859: BOYD | F859: McGAW | I859: MURPHY | L859: PECK | O859: RYAN | R859: CLOVER | W859: WILLIAMSTOWN | X859: 14 | Y859: 0 | Z859: 0 | AA859: 1296 | AB859: 679 | AC859: 190.86892488954345 | AD859: 56
A860: GOALKICKERS | W860: PORT MELBOURNE | X860: 11 | Y860: 3 | Z860: 0 | AA860: 1429 | AB860: 927 | AC860: 154.15 | AD860: 44
A861: WILLIAMSTOWN | C861: R SMITH 2 | F861: R JONES 2 | I861: GEAR 2 | K861: McPHERSON | N861: WARD | P861: MURPHY | R861: F JONES | T861: SIMS | W861: MOORABBIN | X861: 10 | Y861: 4 | Z861: 0 | AA861: 1277 | AB861: 921 | AC861: 138.65 | AD861: 40
A862: MOORABBIN | C862: RENWICK 3 | F862: McGAW 2 | I862: MURPHY | K862: BOYD | M862: HOGAN | W862: BRUNSWICK | X862: 10 | Y862: 4 | Z862: 0 | AA862: 1045 | AB862: 934 | AC862: 111.88436830835117 | AD862: 40
A864: SANDRINGHAM | C864: 3 | D864: 1 | E864: =C864*6+D864 -> 19 | G864: 7 | H864: 11 | I864: =G864*6+H864 -> 53 | K864: 7 | L864: 11 | M864: =K864*6+L864 -> 53 | O864: 9 | P864: 13 | Q864: =O864*6+P864 -> 67 | S864: BEACH ROAD | W864: COBURG | X864: 8 | Y864: 6 | Z864: 0 | AA864: 1176 | AB864: 997 | AC864: 117.95386158475426 | AD864: 32
A865: PRESTON | C865: 5 | D865: 0 | E865: =C865*6+D865 -> 30 | G865: 6 | H865: 1 | I865: =G865*6+H865 -> 37 | K865: 8 | L865: 7 | M865: =K865*6+L865 -> 55 | O865: 8 | P865: 12 | Q865: =O865*6+P865 -> 60 | S865: ROACH | W865: BOX HILL | X865: 8 | Y865: 6 | Z865: 0 | AA865: 1178 | AB865: 1095 | AC865: 107.57990867579909 | AD865: 32
A866: BEST PLAYERS | W866: SANDRINGHAM | X866: 8 | Y866: 6 | Z866: 0 | AA866: 1037 | AB866: 1059 | AC866: 97.922568460812087 | AD866: 32
A867: SANDRINGHAM | C867: BOLAND | F867: K EVANS | I867: CROFT | L867: THOMPSON | O867: ALLSOP | R867: WEBSTER | W867: PRESTON | X867: 7 | Y867: 7 | Z867: 0 | AA867: 1120 | AB867: 1051 | AC867: 106.56517602283539 | AD867: 28
A868: PRESTON | C868: MILLS | F868: HOBAN | I868: McLACHLAN | L868: SWEET | O868: PREST | R868: RATCLIFFE | W868: PRAHRAN | X868: 6 | Y868: 8 | Z868: 0 | AA868: 1093 | AB868: 1342 | AC868: 81.445603576751111 | AD868: 24
A869: GOALKICKERS | W869: YARRAVILLE | X869: 5 | Y869: 9 | Z869: 0 | AA869: 1062 | AB869: 1049 | AC869: 101.23927550047665 | AD869: 20
A870: SANDRINGHAM | C870: BOLAND 3 | F870: ALLSOP 2 | I870: K EVANS 2 | L870: STEELE | N870: MARSHALL | W870: CAMBERWELL | X870: 4 | Y870: 10 | Z870: 0 | AA870: 972 | AB870: 1307 | AC870: 74.368783473603671 | AD870: 16
A871: PRESTON | C871: F CHARD 2 | F871: FOOTE | H871: GLEESON | J871: HAYES | L871: McLACHLAN | O871: PREST | Q871: SIDE | W871: OAKLEIGH | X871: 4 | Y871: 10 | Z871: 0 | AA871: 862 | AB871: 1195 | AC871: 72.13 | AD871: 16
W872: NORTHCOTE | X872: 2 | Y872: 12 | Z872: 0 | AA872: 839 | AB872: 1296 | AC872: 64.737654320987659 | AD872: 8
A873: BRUNSWICK | C873: 3 | D873: 2 | E873: =C873*6+D873 -> 20 | G873: 3 | H873: 3 | I873: =G873*6+H873 -> 21 | K873: 4 | L873: 6 | M873: =K873*6+L873 -> 30 | O873: 6 | P873: 6 | Q873: =O873*6+P873 -> 42 | S873: TOORAK PARK | W873: BRIGHTON | X873: 1 | Y873: 13 | Z873: 0 | AA873: 935 | AB873: 1469 | AC873: 63.648740639891081 | AD873: 4
A874: PRAHRAN | C874: 2 | D874: 1 | E874: =C874*6+D874 -> 13 | G874: 2 | H874: 4 | I874: =G874*6+H874 -> 16 | K874: 3 | L874: 9 | M874: =K874*6+L874 -> 27 | O874: 5 | P874: 10 | Q874: =O874*6+P874 -> 40 | S874: O'DONOGHUE
A875: BEST PLAYERS
A876: BRUNSWICK | C876: NEILSON | F876: THOMPSON | I876: LINKINS | L876: ROLFS | O876: DEAS | R876: WHILEY
A877: PRAHRAN | C877: ROY JONES | F877: HEAD | I877: HOOPER | L877: PLAIN | O877: HORSFIELD | R877: HEALEY
A878: GOALKICKERS
A879: BRUNSWICK | C879: DEAS | E879: J DILLON | H879: HAYES | J879: K DILLON | M879: TAYLOR | P879: JARMAN
A880: PRAHRAN | C880: O'BRYAN 2 | F880: HORSFIELD | I880: WHARTON | L880: CLEAR
A882: COBURG | C882: 1 | D882: 2 | E882: =C882*6+D882 -> 8 | G882: 7 | H882: 6 | I882: =G882*6+H882 -> 48 | K882: 10 | L882: 10 | M882: =K882*6+L882 -> 70 | O882: 13 | P882: 14 | Q882: =O882*6+P882 -> 92 | S882: COBURG
A883: CAMBERWELL | C883: 3 | D883: 6 | E883: =C883*6+D883 -> 24 | G883: 3 | H883: 9 | I883: =G883*6+H883 -> 27 | K883: 6 | L883: 11 | M883: =K883*6+L883 -> 47 | O883: 8 | P883: 12 | Q883: =O883*6+P883 -> 60 | S883: IRVING
A884: BEST PLAYERS
A885: COBURG | C885: MAHONEY | F885: McCOLL | I885: HEWES | L885: BOYLE | O885: J BRENNAN | R885: SHORT
A886: CAMBERWELL | C886: CHAMBERS | F886: SEYMOUR | I886: TEMPANY | L886: CHAPLIN | O886: HOLYOAK | R886: ROSS
A887: GOALKICKERS
A888: COBURG | C888: HEWES 6 | F888: McCOLL | H888: GOULLET | J888: BIGELOW | M888: SHAW | O888: BOYLE | Q888: J BRENNAN | T888: WILKINSON
A889: CAMBERWELL | C889: HOLYOAK 3 | F889: SEYMOUR 2 | I889: HIGSON 2 | L889: AMERY
A891: NORTHCOTE | C891: 0 | D891: 3 | E891: =C891*6+D891 -> 3 | G891: 3 | H891: 6 | I891: =G891*6+H891 -> 24 | K891: 8 | L891: 9 | M891: =K891*6+L891 -> 57 | O891: 10 | P891: 11 | Q891: =O891*6+P891 -> 71 | S891: NORTHCOTE
A892: YARRAVILLE | C892: 1 | D892: 4 | E892: =C892*6+D892 -> 10 | G892: 2 | H892: 6 | I892: =G892*6+H892 -> 18 | K892: 2 | L892: 9 | M892: =K892*6+L892 -> 21 | O892: 4 | P892: 15 | Q892: =O892*6+P892 -> 39 | S892: CARDWELL
A893: BEST PLAYERS
A894: NORTHCOTE | C894: GERVASONI | F894: WOOLNOUGH | J894: ROMARI | M894: WRIGHT | O894: DEVINE | R894: McFARLANE
A895: YARRAVILLE | C895: RULE | F895: BODSWORTH | J895: BOURKE | M895: DRIVER | O895: MASON | R895: COLLINS
A896: GOALKICKERS
A897: NORTHCOTE | C897: ROMARI 6 | F897: LOTT | H897: GERVASONI | K897: OLIVER | N897: POWELL
A898: YARRAVILLE | C898: WILD 2 | F898: CAREY | H898: COCKRAM
A900: BOX HILL | C900: 3 | D900: 6 | E900: =C900*6+D900 -> 24 | G900: 6 | H900: 13 | I900: =G900*6+H900 -> 49 | K900: 10 | L900: 15 | M900: =K900*6+L900 -> 75 | O900: 17 | P900: 18 | Q900: =O900*6+P900 -> 120 | S900: BOX HILL
A901: BRIGHTON | C901: 3 | D901: 4 | E901: =C901*6+D901 -> 22 | G901: 3 | H901: 6 | I901: =G901*6+H901 -> 24 | K901: 8 | L901: 12 | M901: =K901*6+L901 -> 60 | O901: 11 | P901: 14 | Q901: =O901*6+P901 -> 80 | S901: GODING
A902: BEST PLAYERS
A903: BOX HILL | C903: DEVERY | F903: DISTON | I903: LOVE | L903: GOOCH | O903: WHITE | R903: PLUNKETT
A904: BRIGHTON | C904: ASLING | F904: McCANN | I904: HART | L904: COOPER | O904: CRAIG | R904: BEATH
A905: GOALKICKERS
A906: BOX HILL | C906: DEVERY 4 | F906: EADE 3 | H906: PLUNKETT 3 | K906: BENNETT 2 | N906: DISTON 2 | Q906: BROWN | S906: ELSWORTH | V906: WHITE
A907: BRIGHTON | C907: HART 3 | F907: ASLING 2 | I907: DALEY | K907: MILNES | M907: COLLINS | O907: HUNTER | Q907: CRAIG | S907: BROWNING
A909: PORT MELBOURNE | C909: 1 | D909: 2 | E909: =C909*6+D909 -> 8 | G909: 4 | H909: 6 | I909: =G909*6+H909 -> 30 | K909: 8 | L909: 10 | M909: =K909*6+L909 -> 58 | O909: 13 | P909: 14 | Q909: =O909*6+P909 -> 92 | S909: OAKLEIGH
A910: OAKLEIGH | C910: 3 | D910: 1 | E910: =C910*6+D910 -> 19 | G910: 5 | H910: 2 | I910: =G910*6+H910 -> 32 | K910: 7 | L910: 2 | M910: =K910*6+L910 -> 44 | O910: 10 | P910: 4 | Q910: =O910*6+P910 -> 64 | S910: CARLTON
A911: BEST PLAYERS
A912: PORT MELBOURNE | C912: JOHNSON | F912: SYKES | I912: LAFFEY | L912: R ATKINSON | O912: EVANS | R912: WITHERS
A913: OAKLEIGH | C913: D'ARCY | F913: ANDERSON | I913: PALMER | L913: NICHOLSON | O913: FURZER | R913: WILLIAMS
A914: GOALKICKERS
A915: PORT MELBOURNE | C915: BONNETT 5 | F915: EVANS 2 | I915: MONKS 2 | L915: WHITE 2 | O915: MORRIS | R915: SYKES
A916: OAKLEIGH | C916: McGOWAN 3 | F916: LONGNEY 2 | I916: COUGHLAN 2 | L916: NICHOLSON | O916: DOWLING | R916: ANDERSON
A918: ROUND 15 | E918: 27TH JULY | J918: WEATHER | O918: FINE & SUNNY | S918: PLAYED AT
D919: 1ST QTR | H919: 2ND QTR | L919: 3RD QTR | P919: FINAL | S919: PORT MELBOURNE
A920: WILLIAMSTOWN | C920: 2 | D920: 4 | E920: =C920*6+D920 -> 16 | G920: 4 | H920: 4 | I920: =G920*6+H920 -> 28 | K920: 7 | L920: 4 | M920: =K920*6+L920 -> 46 | O920: 8 | P920: 6 | Q920: =O920*6+P920 -> 54 | S920: UMPIRE | X920: LADDER | AB920: ROUND | AD920: 15
A921: PORT MELBOURNE | C921: 2 | D921: 3 | E921: =C921*6+D921 -> 15 | G921: 4 | H921: 8 | I921: =G921*6+H921 -> 32 | K921: 6 | L921: 10 | M921: =K921*6+L921 -> 46 | O921: 6 | P921: 12 | Q921: =O921*6+P921 -> 48 | S921: ROACH
A922: BEST PLAYERS | W922: TEAM | X922: W | Y922: L | Z922: D | AA922: FOR | AB922: AGST | AC922: % | AD922: PTS
A923: WILLIAMSTOWN | C923: MARTIN | F923: KENT | I923: SIMS | L923: R JONES | O923: RAMSAY | R923: OUTEN
A924: PORT MELBOURNE | C924: MONKS | F924: R ATKINSON | I924: LANDORFF | L924: BOWEN | O924: EVANS | R924: TYRELL | W924: WILLIAMSTOWN | X924: 15 | Y924: 0 | Z924: 0 | AA924: 1350 | AB924: 727 | AC924: 185.69463548830811 | AD924: 60
A925: GOALKICKERS | W925: PORT MELBOURNE | X925: 11 | Y925: 4 | Z925: 0 | AA925: 1477 | AB925: 981 | AC925: 150.56 | AD925: 44
A926: WILLIAMSTOWN | C926: McPHERSON 3 | F926: CALLAHAN 2 | J926: GEAR | L926: RAMSAY | N926: OUTEN | W926: MOORABBIN | X926: 11 | Y926: 4 | Z926: 0 | AA926: 1402 | AB926: 962 | AC926: 145.74 | AD926: 44
A927: PORT MELBOURNE | C927: JOHNSON 2 | F927: BONNETT 2 | J927: MONKS | L927: SYKES | W927: BRUNSWICK | X927: 10 | Y927: 5 | Z927: 0 | AA927: 1081 | AB927: 1023 | AC927: 105.66959921798632 | AD927: 40
A929: BOX HILL | C929: 2 | D929: 1 | E929: =C929*6+D929 -> 13 | G929: 5 | H929: 5 | I929: =G929*6+H929 -> 35 | K929: 8 | L929: 10 | M929: =K929*6+L929 -> 58 | O929: 13 | P929: 11 | Q929: =O929*6+P929 -> 89 | S929: BRUNSWICK | W929: BOX HILL | X929: 9 | Y929: 6 | Z929: 0 | AA929: 1267 | AB929: 1131 | AC929: 112.02475685234306 | AD929: 36
A930: BRUNSWICK | C930: 1 | D930: 4 | E930: =C930*6+D930 -> 10 | G930: 1 | H930: 7 | I930: =G930*6+H930 -> 13 | K930: 3 | L930: 7 | M930: =K930*6+L930 -> 25 | O930: 4 | P930: 12 | Q930: =O930*6+P930 -> 36 | S930: O'DONOGHUE | W930: COBURG | X930: 8 | Y930: 7 | Z930: 0 | AA930: 1263 | AB930: 1092 | AC930: 115.65934065934066 | AD930: 32
A931: BEST PLAYERS | W931: PRESTON | X931: 8 | Y931: 7 | Z931: 0 | AA931: 1239 | AB931: 1115 | AC931: 111.12107623318386 | AD931: 32
A932: BOX HILL | C932: EADE | F932: LOVE | I932: WRIGHT | L932: WHITE | O932: SAWATSKY | R932: DEVERY | W932: SANDRINGHAM | X932: 8 | Y932: 7 | Z932: 0 | AA932: 1078 | AB932: 1184 | AC932: 91.047297297297291 | AD932: 32
A933: BRUNSWICK | C933: DEAS | F933: NEILSON | I933: ROLFS | L933: WEIR | O933: ROBSON | R933: POLLARD | W933: YARRAVILLE | X933: 6 | Y933: 9 | Z933: 0 | AA933: 1150 | AB933: 1116 | AC933: 103.04659498207886 | AD933: 24
A934: GOALKICKERS | W934: PRAHRAN | X934: 6 | Y934: 9 | Z934: 0 | AA934: 1157 | AB934: 1461 | AC934: 79.192334017796028 | AD934: 24
A935: BOX HILL | C935: BENNETT 5 | F935: DEVERY 2 | I935: SAWATSKY 2 | L935: EADE | N935: ELSWORTH | Q935: BROWN | S935: TYLER | W935: CAMBERWELL | X935: 5 | Y935: 10 | Z935: 0 | AA935: 1084 | AB935: 1381 | AC935: 78.493845039826212 | AD935: 20
A936: BRUNSWICK | C936: THORNTON 2 | F936: JARMAN | I936: DILLON | W936: OAKLEIGH | X936: 4 | Y936: 11 | Z936: 0 | AA936: 929 | AB936: 1283 | AC936: 72.41 | AD936: 16
W937: BRIGHTON | X937: 2 | Y937: 13 | Z937: 0 | AA937: 1030 | AB937: 1556 | AC937: 66.195372750642676 | AD937: 8
A938: MOORABBIN | C938: 2 | D938: 2 | E938: =C938*6+D938 -> 14 | G938: 8 | H938: 3 | I938: =G938*6+H938 -> 51 | K938: 14 | L938: 7 | M938: =K938*6+L938 -> 91 | O938: 19 | P938: 11 | Q938: =O938*6+P938 -> 125 | S938: MOORABBIN | W938: NORTHCOTE | X938: 2 | Y938: 13 | Z938: 0 | AA938: 913 | AB938: 1408 | AC938: 64.84375 | AD938: 8
A939: SANDRINGHAM | C939: 3 | D939: 3 | E939: =C939*6+D939 -> 21 | G939: 3 | H939: 3 | I939: =G939*6+H939 -> 21 | K939: 5 | L939: 3 | M939: =K939*6+L939 -> 33 | O939: 6 | P939: 5 | Q939: =O939*6+P939 -> 41 | S939: CARDWELL
A940: BEST PLAYERS
A941: MOORABBIN | C941: EVANS | F941: McGAW | I941: HOGAN | L941: BULMER | O941: MURRAY | R941: K BOYD
A942: SANDRINGHAM | C942: RANSOM | F942: BOLAND | I942: K EVANS | L942: THOMPSON | O942: CROFT | R942: JONES
A943: GOALKICKERS
A944: MOORABBIN | C944: McGAW 7 | F944: HOGAN 5 | I944: BULMER 3 | L944: RENWICK 3 | O944: MURPHY
A945: SANDRINGHAM | C945: ALLSOP 3 | F945: BOLAND 2 | I945: RICHARDS
A947: PRESTON | C947: 2 | D947: 3 | E947: =C947*6+D947 -> 15 | G947: 10 | H947: 11 | I947: =G947*6+H947 -> 71 | K947: 11 | L947: 15 | M947: =K947*6+L947 -> 81 | O947: 16 | P947: 23 | Q947: =O947*6+P947 -> 119 | S947: PRESTON
A948: PRAHRAN | C948: 2 | D948: 2 | E948: =C948*6+D948 -> 14 | G948: 3 | H948: 3 | I948: =G948*6+H948 -> 21 | K948: 8 | L948: 4 | M948: =K948*6+L948 -> 52 | O948: 10 | P948: 4 | Q948: =O948*6+P948 -> 64 | S948: IRVING
A949: BEST PLAYERS
A950: PRESTON | C950: SWEET | F950: FOLEY | I950: LITTLE | L950: CUSACK | O950: GLEESON | R950: McCONNELL
A951: PRAHRAN | C951: WHARTON | F951: O'BRYAN | I951: HEALEY | L951: ROSS JONES | O951: McCULLOCH | R951: CHRISTIAN
A952: GOALKICKERS
A953: PRESTON | C953: F CHARD 6 | F953: FOLEY 3 | I953: HAYES 2 | K953: COOPER 2 | N953: LITTLE | P953: WOOD | R953: DAWSON
A954: PRAHRAN | C954: McCULLOCH 4 | F954: WHARTON 3 | J954: CLEAR | L954: HARVEY | N954: HASSELL
A956: YARRAVILLE | C956: 7 | D956: 4 | E956: =C956*6+D956 -> 46 | G956: 9 | H956: 6 | I956: =G956*6+H956 -> 60 | K956: 13 | L956: 9 | M956: =K956*6+L956 -> 87 | O956: 13 | P956: 10 | Q956: =O956*6+P956 -> 88 | S956: YARRAVILLE
A957: OAKLEIGH | C957: 0 | D957: 1 | E957: =C957*6+D957 -> 1 | G957: 5 | H957: 5 | I957: =G957*6+H957 -> 35 | K957: 8 | L957: 5 | M957: =K957*6+L957 -> 53 | O957: 10 | P957: 7 | Q957: =O957*6+P957 -> 67 | S957: GODING
A958: BEST PLAYERS
A959: YARRAVILLE | C959: BODSWORTH | F959: CAREY | I959: BOURKE | L959: MASON | O959: MATTHEWS | R959: WILD
A960: OAKLEIGH | C960: FURZER | F960: MATTHEY | I960: PALMER | L960: WILLIAMS | O960: D'ARCY | R960: ANDERSON
A961: GOALKICKERS
A962: YARRAVILLE | C962: CARSON 3 | F962: BODSWORTH 3 | J962: BOURKE 2 | M962: O'MEARA 2 | P962: CAREY | R962: GARRICK | T962: LAMONT
A963: OAKLEIGH | C963: FURZER 4 | F963: ROBINSON 2 | J963: KELLETT 2 | M963: ANDERSON | P963: McGOWAN
A965: CAMBERWELL | C965: 6 | D965: 6 | E965: =C965*6+D965 -> 42 | G965: 7 | H965: 11 | I965: =G965*6+H965 -> 53 | K965: 13 | L965: 20 | M965: =K965*6+L965 -> 98 | O965: 15 | P965: 22 | Q965: =O965*6+P965 -> 112 | S965: CAMBERWELL
A966: NORTHCOTE | C966: 2 | D966: 3 | E966: =C966*6+D966 -> 15 | G966: 5 | H966: 8 | I966: =G966*6+H966 -> 38 | K966: 6 | L966: 9 | M966: =K966*6+L966 -> 45 | O966: 10 | P966: 14 | Q966: =O966*6+P966 -> 74 | S966: CARLTON
A967: BEST PLAYERS
A968: CAMBERWELL | C968: ROSS | F968: AMERY | I968: McGUINNESS | L968: SKALBERG | O968: HOLYOAK | R968: MASON
A969: NORTHCOTE | C969: POWELL | F969: L WALKER | I969: J VAINS | L969: GERVASONI | O969: ROMARI | R969: WOOLNOUGH
A970: GOALKICKERS
A971: CAMBERWELL | C971: McGUINNESS 3 | F971: HIGSON 3 | I971: COLEMAN 3 | L971: SKALBERG 2 | O971: SEYMOUR 2 | R971: ROSS | T971: HOLYOAK
A972: NORTHCOTE | C972: ROMARI 3 | F972: WOOLNOUGH 2 | J972: L WALKER | M972: GERVASONI | P972: WALSH | R972: POWELL | T972: ROSS
A974: BRIGHTON | C974: 4 | D974: 3 | E974: =C974*6+D974 -> 27 | G974: 7 | H974: 3 | I974: =G974*6+H974 -> 45 | K974: 10 | L974: 9 | M974: =K974*6+L974 -> 69 | O974: 14 | P974: 11 | Q974: =O974*6+P974 -> 95 | S974: ELSTERNWICK PARK
A975: COBURG | C975: 1 | D975: 3 | E975: =C975*6+D975 -> 9 | G975: 3 | H975: 8 | I975: =G975*6+H975 -> 26 | K975: 7 | L975: 9 | M975: =K975*6+L975 -> 51 | O975: 12 | P975: 15 | Q975: =O975*6+P975 -> 87 | S975: JENKINS
A976: BEST PLAYERS
A977: BRIGHTON | C977: COOPER | F977: HART | I977: DALEY | L977: MAY | O977: ASLING | R977: MILLS
A978: COBURG | C978: JONES | F978: BOYLE | I978: YOUNG | L978: GOULLET | O978: MAHONEY | R978: HEWES
A979: GOALKICKERS
A980: BRIGHTON | C980: HART 4 | F980: ASLING 4 | I980: DALEY 3 | L980: MILNES | N980: COLLINS | Q980: BROWNING
A981: COBURG | C981: BOYLE 3 | F981: HEWES 3 | I981: BIGELOW 2 | L981: JONES | N981: WILSON | P981: H CUFFE | R981: BRENNAN
A983: ROUND 16 | E983: 3RD AUGUST | J983: WEATHER | M983: SOUTH WEST BREEZE FINE | S983: PLAYED AT
D984: 1ST QTR | H984: 2ND QTR | L984: 3RD QTR | P984: FINAL | S984: COBURG
A985: COBURG | C985: 3 | D985: 2 | E985: =C985*6+D985 -> 20 | G985: 6 | H985: 4 | I985: =G985*6+H985 -> 40 | K985: 8 | L985: 4 | M985: =K985*6+L985 -> 52 | O985: 9 | P985: 6 | Q985: =O985*6+P985 -> 60 | S985: UMPIRE | X985: LADDER | AB985: ROUND | AD985: 16
A986: BRUNSWICK | C986: 2 | D986: 2 | E986: =C986*6+D986 -> 14 | G986: 5 | H986: 5 | I986: =G986*6+H986 -> 35 | K986: 8 | L986: 10 | M986: =K986*6+L986 -> 58 | O986: 8 | P986: 11 | Q986: =O986*6+P986 -> 59 | S986: ALLEN
A987: BEST PLAYERS | W987: TEAM | X987: W | Y987: L | Z987: D | AA987: FOR | AB987: AGST | AC987: % | AD987: PTS
A988: COBURG | C988: MAHONEY | F988: McCOLL | I988: SHAW | L988: HEWES | O988: YOUNG | R988: SHORT
A989: BRUNSWICK | C989: K DILLON | F989: EDWARDS | I989: NEILSON | L989: LINKINS | O989: BUCHANAN | R989: ROBSON | W989: WILLIAMSTOWN | X989: 16 | Y989: 0 | Z989: 0 | AA989: 1416 | AB989: 783 | AC989: 180.84291187739464 | AD989: 64
A990: GOALKICKERS | W990: MOORABBIN | X990: 12 | Y990: 4 | Z990: 0 | AA990: 1518 | AB990: 1030 | AC990: 146.24 | AD990: 48
A991: COBURG | C991: HEWES 4 | F991: J BRENNAN 2 | J991: JORDAN | L991: McCOLL | N991: GOULLET | W991: PORT MELBOURNE | X991: 11 | Y991: 5 | Z991: 0 | AA991: 1555 | AB991: 1065 | AC991: 146.01 | AD991: 44
A992: BRUNSWICK | C992: K DILLON 3 | F992: THORNTON 2 | J992: G STANLEY | M992: DEAS | O992: WHILEY | W992: BRUNSWICK | X992: 10 | Y992: 6 | Z992: 0 | AA992: 1140 | AB992: 1083 | AC992: 105.26315789473684 | AD992: 40
A994: PRESTON | C994: 3 | D994: 3 | E994: =C994*6+D994 -> 21 | G994: 4 | H994: 4 | I994: =G994*6+H994 -> 28 | K994: 9 | L994: 10 | M994: =K994*6+L994 -> 64 | O994: 13 | P994: 14 | Q994: =O994*6+P994 -> 92 | S994: BOX HILL | W994: COBURG | X994: 9 | Y994: 7 | Z994: 0 | AA994: 1323 | AB994: 1151 | AC994: 114.94352736750652 | AD994: 36
A995: BOX HILL | C995: 1 | D995: 2 | E995: =C995*6+D995 -> 8 | G995: 3 | H995: 10 | I995: =G995*6+H995 -> 28 | K995: 6 | L995: 13 | M995: =K995*6+L995 -> 49 | O995: 10 | P995: 21 | Q995: =O995*6+P995 -> 81 | S995: BREWER | W995: PRESTON | X995: 9 | Y995: 7 | Z995: 0 | AA995: 1331 | AB995: 1196 | AC995: 111.2876254180602 | AD995: 36
A996: BEST PLAYERS | W996: BOX HILL | X996: 9 | Y996: 7 | Z996: 0 | AA996: 1348 | AB996: 1223 | AC996: 110.22076860179885 | AD996: 36
A997: PRESTON | C997: HAYES | F997: FOLEY | I997: HOBAN | L997: SIDE | O997: F CHARD | R997: McCONNELL | W997: SANDRINGHAM | X997: 8 | Y997: 8 | Z997: 0 | AA997: 1134 | AB997: 1250 | AC997: 90.72 | AD997: 32
A998: BOX HILL | C998: DEVERY | F998: EADE | I998: DISTON | L998: JOHNSTON | O998: BENNETT | R998: SAWATSKY | W998: YARRAVILLE | X998: 7 | Y998: 9 | Z998: 0 | AA998: 1234 | AB998: 1194 | AC998: 103.35008375209381 | AD998: 28
A999: GOALKICKERS | W999: CAMBERWELL | X999: 6 | Y999: 10 | Z999: 0 | AA999: 1207 | AB999: 1448 | AC999: 83.356353591160214 | AD999: 24
A1000: PRESTON | C1000: HAYES 4 | F1000: F CHARD 3 | I1000: GLEESON 2 | L1000: FOLEY | N1000: COOPER | P1000: McLACHLAN | S1000: DAWSON | W1000: PRAHRAN | X1000: 6 | Y1000: 10 | Z1000: 0 | AA1000: 1225 | AB1000: 1577 | AC1000: 77.679137603043756 | AD1000: 24
A1001: BOX HILL | C1001: BENNETT 5 | F1001: SAWATSKY 2 | J1001: EADE | L1001: DISTON | N1001: BROWN | W1001: OAKLEIGH | X1001: 4 | Y1001: 12 | Z1001: 0 | AA1001: 996 | AB1001: 1406 | AC1001: 70.84 | AD1001: 16
W1002: NORTHCOTE | X1002: 3 | Y1002: 13 | Z1002: 0 | AA1002: 989 | AB1002: 1480 | AC1002: 66.824324324324323 | AD1002: 12
A1003: WILLIAMSTOWN | C1003: 4 | D1003: 9 | E1003: =C1003*6+D1003 -> 33 | G1003: 5 | H1003: 9 | I1003: =G1003*6+H1003 -> 39 | K1003: 7 | L1003: 17 | M1003: =K1003*6+L1003 -> 59 | O1003: 8 | P1003: 18 | Q1003: =O1003*6+P1003 -> 66 | S1003: WILLIAMSTOWN | W1003: BRIGHTON | X1003: 2 | Y1003: 14 | Z1003: 0 | AA1003: 1102 | AB1003: 1632 | AC1003: 67.524509803921575 | AD1003: 8
A1004: SANDRINGHAM | C1004: 0 | D1004: 0 | E1004: =C1004*6+D1004 -> 0 | G1004: 3 | H1004: 5 | I1004: =G1004*6+H1004 -> 23 | K1004: 3 | L1004: 5 | M1004: =K1004*6+L1004 -> 23 | O1004: 8 | P1004: 8 | Q1004: =O1004*6+P1004 -> 56 | S1004: CARLTON
A1005: BEST PLAYERS
A1006: WILLIAMSTOWN | C1006: MARTIN | F1006: CALLAHAN | I1006: WARD | L1006: GEAR | O1006: GARLICK | R1006: EVANS
A1007: SANDRINGHAM | C1007: GRANGER | F1007: McLEAN | I1007: RANSOM | L1007: WEBSTER | O1007: RICHARDS | R1007: MARSHALL
A1008: GOALKICKERS
A1009: WILLIAMSTOWN | C1009: CULLINAN 4 | F1009: GARLICK | I1009: SMITH | K1009: MURPHY | N1009: O'CONNOR
A1010: SANDRINGHAM | C1010: LORKIN 3 | F1010: STEELE 2 | I1010: MYERS | K1010: RICHARDS | N1010: MURPHY
A1012: YARRAVILLE | C1012: 2 | D1012: 4 | E1012: =C1012*6+D1012 -> 16 | G1012: 6 | H1012: 8 | I1012: =G1012*6+H1012 -> 44 | K1012: 6 | L1012: 10 | M1012: =K1012*6+L1012 -> 46 | O1012: 12 | P1012: 12 | Q1012: =O1012*6+P1012 -> 84 | S1012: PORT MELBOURNE
A1013: PORT MELBOURNE | C1013: 4 | D1013: 5 | E1013: =C1013*6+D1013 -> 29 | G1013: 4 | H1013: 9 | I1013: =G1013*6+H1013 -> 33 | K1013: 9 | L1013: 15 | M1013: =K1013*6+L1013 -> 69 | O1013: 10 | P1013: 18 | Q1013: =O1013*6+P1013 -> 78 | S1013: JENKINS
A1014: BEST PLAYERS
A1015: YARRAVILLE | C1015: LIVINGSTONE | G1015: BODSWORTH | J1015: BOURKE | M1015: CARSON | P1015: WEBB | S1015: WILD
A1016: PORT MELBOURNE | C1016: MONKS | G1016: JOHNSON | J1016: HARVEY | M1016: E ATKINSON | P1016: BOWEN | S1016: LEWIS
A1017: GOALKICKERS
A1018: YARRAVILLE | C1018: O'MEARA 3 | F1018: BOURKE 3 | I1018: WALLIS 2 | L1018: WILD | N1018: COLLINS | Q1018: MATTHEWS | S1018: CAREY
A1019: PORT MELBOURNE | C1019: BONNETT 5 | F1019: MONKS 2 | I1019: EVANS 2 | L1019: McMASTER
A1021: CAMBERWELL | C1021: 2 | D1021: 2 | E1021: =C1021*6+D1021 -> 14 | G1021: 12 | H1021: 5 | I1021: =G1021*6+H1021 -> 77 | K1021: 14 | L1021: 8 | M1021: =K1021*6+L1021 -> 92 | O1021: 19 | P1021: 9 | Q1021: =O1021*6+P1021 -> 123 | S1021: OAKLEIGH
A1022: OAKLEIGH | C1022: 1 | D1022: 8 | E1022: =C1022*6+D1022 -> 14 | G1022: 3 | H1022: 9 | I1022: =G1022*6+H1022 -> 27 | K1022: 5 | L1022: 12 | M1022: =K1022*6+L1022 -> 42 | O1022: 9 | P1022: 13 | Q1022: =O1022*6+P1022 -> 67 | S1022: O'DONOGHUE
A1023: BEST PLAYERS
A1024: CAMBERWELL | C1024: BELL | F1024: McGUINNESS | J1024: SKALBERG | M1024: WATTS | P1024: TEMPANY | S1024: HOLYOAK
A1025: OAKLEIGH | C1025: D'ARCY | F1025: BACKMAN | J1025: COUGHLAN | M1025: LONGNEY | P1025: COLLINS | S1025: HORLEY
A1026: GOALKICKERS
A1027: CAMBERWELL | C1027: McGUINNESS 4 | F1027: HOLYOAK 4 | I1027: HIGSON 3 | L1027: COLEMAN 3 | O1027: WATTS 2 | R1027: AMERY 2 | T1027: SKALBERG
A1028: OAKLEIGH | C1028: COUGHLAN 3 | F1028: ANDERSON 2 | J1028: ROBINSON 2 | M1028: DOWLING | P1028: MATTHEY
A1030: NORTHCOTE | C1030: 1 | D1030: 3 | E1030: =C1030*6+D1030 -> 9 | G1030: 5 | H1030: 6 | I1030: =G1030*6+H1030 -> 36 | K1030: 6 | L1030: 15 | M1030: =K1030*6+L1030 -> 51 | O1030: 10 | P1030: 16 | Q1030: =O1030*6+P1030 -> 76 | S1030: NORTHCOTE
A1031: BRIGHTON | C1031: 2 | D1031: 1 | E1031: =C1031*6+D1031 -> 13 | G1031: 5 | H1031: 5 | I1031: =G1031*6+H1031 -> 35 | K1031: 8 | L1031: 6 | M1031: =K1031*6+L1031 -> 54 | O1031: 10 | P1031: 12 | Q1031: =O1031*6+P1031 -> 72 | S1031: ROACH
A1032: BEST PLAYERS
A1033: NORTHCOTE | C1033: GERVASONI | F1033: POWELL | I1033: WOOLNOUGH | M1033: L WALKER | P1033: J VAINS | S1033: RADCLIFFE
A1034: BRIGHTON | C1034: GURRY | F1034: HART | I1034: BROWNING | M1034: BEATH | P1034: DALEY | S1034: COOPER
A1035: GOALKICKERS
A1036: NORTHCOTE | C1036: RADCLIFFE 2 | F1036: WOOLNOUGH 2 | J1036: GERVASONI 2 | N1036: PETERS | P1036: ROMARI | R1036: CARMODY | U1036: ADAMSON
A1037: BRIGHTON | C1037: MILNES 3 | F1037: HART 2 | I1037: DALEY 2 | L1037: COOPER | N1037: ASLING | P1037: HUNTER
A1039: MOORABBIN | C1039: 4 | D1039: 3 | E1039: =C1039*6+D1039 -> 27 | G1039: 7 | H1039: 10 | I1039: =G1039*6+H1039 -> 52 | K1039: 8 | L1039: 16 | M1039: =K1039*6+L1039 -> 64 | O1039: 16 | P1039: 20 | Q1039: =O1039*6+P1039 -> 116 | S1039: TOORAK PARK
A1040: PRAHRAN | C1040: 4 | D1040: 2 | E1040: =C1040*6+D1040 -> 26 | G1040: 5 | H1040: 5 | I1040: =G1040*6+H1040 -> 35 | K1040: 8 | L1040: 8 | M1040: =K1040*6+L1040 -> 56 | O1040: 10 | P1040: 8 | Q1040: =O1040*6+P1040 -> 68 | S1040: GODING
A1041: BEST PLAYERS
A1042: MOORABBIN | C1042: TREZISE | F1042: BULMER | I1042: PECK | L1042: McGAW | O1042: GREEN | R1042: BULL
A1043: PRAHRAN | C1043: McKENZIE | F1043: HARVEY | I1043: CLEAR | L1043: HOOPER | O1043: O'BRYAN | R1043: PLAIN
A1044: GOALKICKERS
A1045: MOORABBIN | C1045: RENWICK 4 | F1045: BULMER 2 | I1045: MANIE 2 | L1045: McGAW 2 | O1045: HOGAN 2 | R1045: BULL 2 | T1045: MURPHY | W1045: CLOVER
A1046: PRAHRAN | C1046: O'BRYAN 2 | F1046: McKENZIE 2 | I1046: HORSFIELD 2 | L1046: WHARTON 2 | O1046: McCULLOCH 2
A1048: ROUND 17 | E1048: 10TH AUGUST | J1048: WEATHER | M1048: WET LIGHT RAIN THROUGHOUT | S1048: PLAYED AT
D1049: 1ST QTR | H1049: 2ND QTR | L1049: 3RD QTR | P1049: FINAL | S1049: MOORABBIN
A1050: MOORABBIN | C1050: 1 | D1050: 6 | E1050: =C1050*6+D1050 -> 12 | G1050: 5 | H1050: 7 | I1050: =G1050*6+H1050 -> 37 | K1050: 9 | L1050: 8 | M1050: =K1050*6+L1050 -> 62 | O1050: 11 | P1050: 15 | Q1050: =O1050*6+P1050 -> 81 | S1050: UMPIRE | X1050: LADDER | AB1050: ROUND | AD1050: 17
A1051: BOX HILL | C1051: 4 | D1051: 1 | E1051: =C1051*6+D1051 -> 25 | G1051: 7 | H1051: 5 | I1051: =G1051*6+H1051 -> 47 | K1051: 8 | L1051: 8 | M1051: =K1051*6+L1051 -> 56 | O1051: 10 | P1051: 8 | Q1051: =O1051*6+P1051 -> 68 | S1051: IRVING
A1052: BEST PLAYERS | W1052: TEAM | X1052: W | Y1052: L | Z1052: D | AA1052: FOR | AB1052: AGST | AC1052: % | AD1052: PTS
A1053: MOORABBIN | C1053: EVANS | F1053: K BOYD | I1053: PECK | L1053: STANLEY | O1053: MANIE | R1053: RYAN
A1054: BOX HILL | C1054: WRIGHT | F1054: WHITE | I1054: BENNETT | L1054: TAYLOE | O1054: ELSWORTH | R1054: LOVE | W1054: WILLIAMSTOWN | X1054: 17 | Y1054: 0 | Z1054: 0 | AA1054: 1488 | AB1054: 839 | AC1054: 177.35399284862933 | AD1054: 68
A1055: GOALKICKERS | W1055: MOORABBIN | X1055: 13 | Y1055: 4 | Z1055: 0 | AA1055: 1599 | AB1055: 1098 | AC1055: 145.63 | AD1055: 52
A1056: MOORABBIN | C1056: McGAW 4 | F1056: K BOYD 2 | I1056: RENWICK 2 | L1056: BULL | N1056: MANIE | P1056: BULMER | W1056: PORT MELBOURNE | X1056: 12 | Y1056: 5 | Z1056: 0 | AA1056: 1645 | AB1056: 1152 | AC1056: 142.8 | AD1056: 48
A1057: BOX HILL | C1057: BENNETT 4 | F1057: SAWATSKY 2 | J1057: McKENZIE | M1057: BROWN | O1057: JOHNSTON | R1057: ELSWORTH | W1057: BRUNSWICK | X1057: 11 | Y1057: 6 | Z1057: 0 | AA1057: 1239 | AB1057: 1133 | AC1057: 109.35569285083848 | AD1057: 44
A1059: SANDRINGHAM | C1059: 2 | D1059: 2 | E1059: =C1059*6+D1059 -> 14 | G1059: 4 | H1059: 6 | I1059: =G1059*6+H1059 -> 30 | K1059: 8 | L1059: 8 | M1059: =K1059*6+L1059 -> 56 | O1059: 10 | P1059: 11 | Q1059: =O1059*6+P1059 -> 71 | S1059: BEACH ROAD | W1059: PRESTON | X1059: 10 | Y1059: 7 | Z1059: 0 | AA1059: 1426 | AB1059: 1264 | AC1059: 112.81645569620254 | AD1059: 40
A1060: PRAHRAN | C1060: 3 | D1060: 4 | E1060: =C1060*6+D1060 -> 22 | G1060: 4 | H1060: 8 | I1060: =G1060*6+H1060 -> 32 | K1060: 6 | L1060: 14 | M1060: =K1060*6+L1060 -> 50 | O1060: 9 | P1060: 17 | Q1060: =O1060*6+P1060 -> 71 | S1060: GWYNNE | W1060: COBURG | X1060: 9 | Y1060: 8 | Z1060: 0 | AA1060: 1391 | AB1060: 1246 | AC1060: 111.63723916532905 | AD1060: 36
A1061: BEST PLAYERS | W1061: BOX HILL | X1061: 9 | Y1061: 8 | Z1061: 0 | AA1061: 1416 | AB1061: 1304 | AC1061: 108.58895705521472 | AD1061: 36
A1062: SANDRINGHAM | C1062: RANSOM | F1062: K EVANS | I1062: MARSHALL | L1062: JONES | O1062: ALLSOP | R1062: MURPHY | W1062: SANDRINGHAM | X1062: 8 | Y1062: 8 | Z1062: 1 | AA1062: 1205 | AB1062: 1321 | AC1062: 91.218773656320963 | AD1062: 34
A1063: PRAHRAN | C1063: RICKARDS | F1063: ROY JONES | I1063: BOYD | L1063: McKENZIE | O1063: ROSS JONES | R1063: HARVEY | W1063: YARRAVILLE | X1063: 7 | Y1063: 10 | Z1063: 0 | AA1063: 1290 | AB1063: 1266 | AC1063: 101.89573459715639 | AD1063: 28
A1064: GOALKICKERS | W1064: PRAHRAN | X1064: 6 | Y1064: 10 | Z1064: 1 | AA1064: 1296 | AB1064: 1648 | AC1064: 78.640776699029132 | AD1064: 26
A1065: SANDRINGHAM | C1065: ALLSOP 4 | F1065: BOLAND | I1065: MURPHY | K1065: RANSOM | M1065: GRANGER | P1065: RICHARDS | S1065: ECCLESTON | W1065: CAMBERWELL | X1065: 6 | Y1065: 11 | Z1065: 0 | AA1065: 1294 | AB1065: 1538 | AC1065: 84.135240572171654 | AD1065: 24
A1066: PRAHRAN | C1066: HARVEY 2 | F1066: RICKARDS 2 | I1066: C BOYD 2 | L1066: McKENZIE 2 | O1066: WHARTON | W1066: OAKLEIGH | X1066: 5 | Y1066: 12 | Z1066: 0 | AA1066: 1110 | AB1066: 1477 | AC1066: 75.15 | AD1066: 20
W1067: NORTHCOTE | X1067: 3 | Y1067: 14 | Z1067: 0 | AA1067: 1039 | AB1067: 1579 | AC1067: 65.801139962001272 | AD1067: 12
A1068: BRUNSWICK | C1068: 3 | D1068: 3 | E1068: =C1068*6+D1068 -> 21 | G1068: 6 | H1068: 7 | I1068: =G1068*6+H1068 -> 43 | K1068: 10 | L1068: 15 | M1068: =K1068*6+L1068 -> 75 | O1068: 14 | P1068: 15 | Q1068: =O1068*6+P1068 -> 99 | S1068: BRUNSWICK | W1068: BRIGHTON | X1068: 2 | Y1068: 15 | Z1068: 0 | AA1068: 1173 | AB1068: 1746 | AC1068: 67.182130584192436 | AD1068: 8
A1069: NORTHCOTE | C1069: 3 | D1069: 0 | E1069: =C1069*6+D1069 -> 18 | G1069: 3 | H1069: 1 | I1069: =G1069*6+H1069 -> 19 | K1069: 4 | L1069: 2 | M1069: =K1069*6+L1069 -> 26 | O1069: 7 | P1069: 8 | Q1069: =O1069*6+P1069 -> 50 | S1069: CARLTON
A1070: BEST PLAYERS
A1071: BRUNSWICK | C1071: THORNTON | F1071: WEIR | I1071: K DILLON | L1071: NEILSON | O1071: ROLFS | R1071: SEYMOUR
A1072: NORTHCOTE | C1072: DEVINE | F1072: GERVASONI | I1072: POWELL | L1072: WOOLNOUGH | O1072: L WALKER | R1072: F VAINS
A1073: GOALKICKERS
A1074: BRUNSWICK | C1074: THORNTON 6 | F1074: K DILLON 3 | I1074: WEIR 2 | K1074: JARMAN | M1074: WHILEY | O1074: DEAS
A1075: NORTHCOTE | C1075: PETERS 2 | F1075: ROMARI | H1075: RADCLIFFE | K1075: ADAMSON | N1075: DEVINE | P1075: CARMODY
E1076: 17TH AUGUST | M1076: WEATHER | R1076: FINE & SUNNY
A1077: PRESTON | C1077: 5 | D1077: 0 | E1077: =C1077*6+D1077 -> 30 | G1077: 6 | H1077: 4 | I1077: =G1077*6+H1077 -> 40 | K1077: 9 | L1077: 13 | M1077: =K1077*6+L1077 -> 67 | O1077: 13 | P1077: 17 | Q1077: =O1077*6+P1077 -> 95 | S1077: PRESTON
A1078: COBURG | C1078: 3 | D1078: 4 | E1078: =C1078*6+D1078 -> 22 | G1078: 4 | H1078: 10 | I1078: =G1078*6+H1078 -> 34 | K1078: 6 | L1078: 14 | M1078: =K1078*6+L1078 -> 50 | O1078: 9 | P1078: 14 | Q1078: =O1078*6+P1078 -> 68 | S1078: ROACH
A1079: BEST PLAYERS
A1080: PRESTON | C1080: FOLEY | F1080: F CHARD | I1080: FOOTE | L1080: GLEESON | O1080: McLACHLAN | R1080: DAWSON
A1081: COBURG | C1081: BIGELOW | F1081: MAHONEY | I1081: JORDAN | L1081: McCOLL | O1081: FEWKES | R1081: SMITH
A1082: GOALKICKERS
A1083: PRESTON | C1083: FOLEY 4 | F1083: F CHARD 3 | I1083: HILL 2 | K1083: DAWSON | M1083: GLEESON | O1083: SIDE | Q1083: McKENZIE
A1084: COBURG | C1084: WILKINSON 3 | F1084: HEWES 2 | I1084: BIGELOW | K1084: JORDAN | M1084: BRENNAN | O1084: SHAW
A1086: WILLIAMSTOWN | C1086: 2 | D1086: 3 | E1086: =C1086*6+D1086 -> 15 | G1086: 5 | H1086: 7 | I1086: =G1086*6+H1086 -> 37 | K1086: 8 | L1086: 10 | M1086: =K1086*6+L1086 -> 58 | O1086: 10 | P1086: 12 | Q1086: =O1086*6+P1086 -> 72 | S1086: YARRAVILLE
A1087: YARRAVILLE | C1087: 2 | D1087: 1 | E1087: =C1087*6+D1087 -> 13 | G1087: 2 | H1087: 7 | I1087: =G1087*6+H1087 -> 19 | K1087: 5 | L1087: 9 | M1087: =K1087*6+L1087 -> 39 | O1087: 7 | P1087: 14 | Q1087: =O1087*6+P1087 -> 56 | S1087: ALLEN
A1088: BEST PLAYERS
A1089: WILLIAMSTOWN | C1089: EVANS | F1089: OUTEN | I1089: KENT | L1089: RAMSAY | O1089: OGDEN | R1089: WARD
A1090: YARRAVILLE | C1090: MASON | F1090: STONE | I1090: LIVINGSTONE | L1090: WILD | O1090: GARRICK | R1090: DRIVER
A1091: GOALKICKERS
A1092: WILLIAMSTOWN | C1092: WARD 4 | F1092: CULLINAN 3 | I1092: SMITH | K1092: OUTEN | M1092: CALLAHAN
A1093: YARRAVILLE | C1093: WALLIS 2 | F1093: CAREY 2 | I1093: BODSWORTH | L1093: CARSON | N1093: COLLINS
A1095: OAKLEIGH | C1095: 5 | D1095: 3 | E1095: =C1095*6+D1095 -> 33 | G1095: 8 | H1095: 6 | I1095: =G1095*6+H1095 -> 54 | K1095: 12 | L1095: 12 | M1095: =K1095*6+L1095 -> 84 | O1095: 16 | P1095: 18 | Q1095: =O1095*6+P1095 -> 114 | S1095: ELSTERNWICK PARK
A1096: BRIGHTON | C1096: 3 | D1096: 5 | E1096: =C1096*6+D1096 -> 23 | G1096: 4 | H1096: 8 | I1096: =G1096*6+H1096 -> 32 | K1096: 5 | L1096: 10 | M1096: =K1096*6+L1096 -> 40 | O1096: 10 | P1096: 11 | Q1096: =O1096*6+P1096 -> 71 | S1096: GODING
A1097: BEST PLAYERS
A1098: OAKLEIGH | C1098: COUGHLAN | F1098: FURZER | I1098: HORLEY | L1098: LONGNEY | O1098: COLLINS | R1098: F BAPTIST
A1099: BRIGHTON | C1099: McCANN | F1099: CURRIE | I1099: GURRY | L1099: DALEY | O1099: COCKFIELD | R1099: WILKINSON
A1100: GOALKICKERS
A1101: OAKLEIGH | C1101: COUGHLAN 4 | F1101: McGOWAN 3 | I1101: LONGNEY 3 | L1101: ANDERSON 3 | O1101: FURZER | Q1101: NICHOLSON | S1101: BACKMAN
A1102: BRIGHTON | C1102: HART 3 | F1102: WILKINSON 2 | I1102: GURRY 2 | L1102: MILNES | N1102: CURRIE | P1102: WOOLSTENCROFT
A1104: PORT MELBOURNE | C1104: 5 | D1104: 5 | E1104: =C1104*6+D1104 -> 35 | G1104: 8 | H1104: 11 | I1104: =G1104*6+H1104 -> 59 | K1104: 10 | L1104: 15 | M1104: =K1104*6+L1104 -> 75 | O1104: 12 | P1104: 18 | Q1104: =O1104*6+P1104 -> 90 | S1104: CAMBERWELL
A1105: CAMBERWELL | C1105: 2 | D1105: 2 | E1105: =C1105*6+D1105 -> 14 | G1105: 7 | H1105: 5 | I1105: =G1105*6+H1105 -> 47 | K1105: 9 | L1105: 8 | M1105: =K1105*6+L1105 -> 62 | O1105: 12 | P1105: 15 | Q1105: =O1105*6+P1105 -> 87 | S1105: BREWER
A1106: BEST PLAYERS
A1107: PORT MELBOURNE | C1107: LEWIS | F1107: BOWEN | I1107: WITHERS | L1107: LAFFEY | O1107: JOHNSON | R1107: BONNETT
A1108: CAMBERWELL | C1108: ROSS | F1108: MASON | I1108: WATTS | L1108: HEGARTY | O1108: CHAMBERS | R1108: McGUINNESS
A1109: GOALKICKERS
A1110: PORT MELBOURNE | C1110: BONNETT 6 | F1110: THOMPSON 2 | J1110: McMASTER | M1110: MONKS | O1110: JOHNSON | Q1110: WITHERS
A1111: CAMBERWELL | C1111: WATTS 5 | F1111: HIGSON 2 | I1111: COLEMAN | L1111: MASON | N1111: DUGDALE | Q1111: SKALBERG | S1111: McGUINNESS
A1113: ROUND 18 | E1113: 24TH AUGUST | J1113: WEATHER | O1113: WARM SUNNY | S1113: PLAYED AT
D1114: 1ST QTR | H1114: 2ND QTR | L1114: 3RD QTR | P1114: FINAL | S1114: COBURG
A1115: COBURG | C1115: 4 | D1115: 7 | E1115: =C1115*6+D1115 -> 31 | G1115: 7 | H1115: 12 | I1115: =G1115*6+H1115 -> 54 | K1115: 15 | L1115: 20 | M1115: =K1115*6+L1115 -> 110 | O1115: 16 | P1115: 21 | Q1115: =O1115*6+P1115 -> 117 | S1115: UMPIRE | X1115: LADDER | AB1115: ROUND | AD1115: 18
A1116: MOORABBIN | C1116: 1 | D1116: 3 | E1116: =C1116*6+D1116 -> 9 | G1116: 6 | H1116: 4 | I1116: =G1116*6+H1116 -> 40 | K1116: 7 | L1116: 6 | M1116: =K1116*6+L1116 -> 48 | O1116: 11 | P1116: 9 | Q1116: =O1116*6+P1116 -> 75 | S1116: BREWER
A1117: BEST PLAYERS | W1117: TEAM | X1117: W | Y1117: L | Z1117: D | AA1117: FOR | AB1117: AGST | AC1117: % | AD1117: PTS
A1118: COBURG | C1118: B JONES | F1118: JORDAN | I1118: SHAW | L1118: BOOTH | O1118: WYMER | R1118: YOUNG
A1119: MOORABBIN | C1119: McGAW | F1119: MANIE | I1119: STANLEY | L1119: MURPHY | O1119: RYAN | R1119: PECK | W1119: WILLIAMSTOWN | X1119: 18 | Y1119: 0 | Z1119: 0 | AA1119: 1613 | AB1119: 894 | AC1119: 180.42505592841164 | AD1119: 72
A1120: GOALKICKERS | W1120: PORT MELBOURNE | X1120: 13 | Y1120: 5 | Z1120: 0 | AA1120: 1767 | AB1120: 1223 | AC1120: 144.48 | AD1120: 52
A1121: COBURG | C1121: JORDAN 4 | F1121: WILKINSON 3 | I1121: HEWES 3 | L1121: B JONES 2 | O1121: SHAW 2 | Q1121: BIGELOW | S1121: WYMER | W1121: MOORABBIN | X1121: 13 | Y1121: 5 | Z1121: 0 | AA1121: 1674 | AB1121: 1215 | AC1121: 137.78 | AD1121: 52
A1122: MOORABBIN | C1122: RENWICK 3 | F1122: McGAW 2 | I1122: MURPHY 2 | L1122: EVANS 2 | O1122: MANIE | Q1122: BULMER | W1122: BRUNSWICK | X1122: 12 | Y1122: 6 | Z1122: 0 | AA1122: 1336 | AB1122: 1180 | AC1122: 113.22033898305085 | AD1122: 48
A1124: BOX HILL | C1124: 2 | D1124: 6 | E1124: =C1124*6+D1124 -> 18 | G1124: 5 | H1124: 11 | I1124: =G1124*6+H1124 -> 41 | K1124: 11 | L1124: 18 | M1124: =K1124*6+L1124 -> 84 | O1124: 13 | P1124: 23 | Q1124: =O1124*6+P1124 -> 101 | S1124: BOX HILL | W1124: PRESTON | X1124: 11 | Y1124: 7 | Z1124: 0 | AA1124: 1599 | AB1124: 1304 | AC1124: 122.62269938650307 | AD1124: 44
A1125: SANDRINGHAM | C1125: 4 | D1125: 1 | E1125: =C1125*6+D1125 -> 25 | G1125: 5 | H1125: 3 | I1125: =G1125*6+H1125 -> 33 | K1125: 5 | L1125: 3 | M1125: =K1125*6+L1125 -> 33 | O1125: 9 | P1125: 3 | Q1125: =O1125*6+P1125 -> 57 | S1125: CARDWELL | W1125: COBURG | X1125: 10 | Y1125: 8 | Z1125: 0 | AA1125: 1508 | AB1125: 1321 | AC1125: 114.1559424678274 | AD1125: 40
A1126: BEST PLAYERS | W1126: BOX HILL | X1126: 10 | Y1126: 8 | Z1126: 0 | AA1126: 1517 | AB1126: 1361 | AC1126: 111.46216017634093 | AD1126: 40
A1127: BOX HILL | C1127: LOVE | F1127: INGLETON | I1127: SAWATSKY | L1127: GOOCH | O1127: TAYLOR | R1127: WHITE | W1127: SANDRINGHAM | X1127: 8 | Y1127: 9 | Z1127: 1 | AA1127: 1262 | AB1127: 1422 | AC1127: 88.748241912798875 | AD1127: 34
A1128: SANDRINGHAM | C1128: ALLSOP | F1128: McLEAN | I1128: JONES | L1128: BOLAND | O1128: MARSHALL | R1128: RANSOM | W1128: YARRAVILLE | X1128: 7 | Y1128: 11 | Z1128: 0 | AA1128: 1377 | AB1128: 1368 | AC1128: 100.65789473684211 | AD1128: 28
A1129: GOALKICKERS | W1129: CAMBERWELL | X1129: 7 | Y1129: 11 | Z1129: 0 | AA1129: 1396 | AB1129: 1625 | AC1129: 85.907692307692301 | AD1129: 28
A1130: BOX HILL | C1130: SAWATSKY 4 | F1130: HOUGHTON 3 | J1130: INGLETON 3 | M1130: LOVE | O1130: BENNETT | Q1130: ELSWORTH | W1130: PRAHRAN | X1130: 6 | Y1130: 11 | Z1130: 1 | AA1130: 1351 | AB1130: 1773 | AC1130: 76.198533558939644 | AD1130: 26
A1131: SANDRINGHAM | C1131: OAKLEY 6 | F1131: RANSOM 2 | I1131: BOLAND | W1131: OAKLEIGH | X1131: 5 | Y1131: 13 | Z1131: 0 | AA1131: 1157 | AB1131: 1574 | AC1131: 73.51 | AD1131: 20
W1132: NORTHCOTE | X1132: 3 | Y1132: 15 | Z1132: 0 | AA1132: 1079 | AB1132: 1752 | AC1132: 61.586757990867582 | AD1132: 12
A1133: WILLIAMSTOWN | C1133: 3 | D1133: 5 | E1133: =C1133*6+D1133 -> 23 | G1133: 10 | H1133: 7 | I1133: =G1133*6+H1133 -> 67 | K1133: 13 | L1133: 11 | M1133: =K1133*6+L1133 -> 89 | O1133: 18 | P1133: 17 | Q1133: =O1133*6+P1133 -> 125 | S1133: WILLIAMSTOWN | W1133: BRIGHTON | X1133: 2 | Y1133: 16 | Z1133: 0 | AA1133: 1244 | AB1133: 1868 | AC1133: 66.595289079229119 | AD1133: 8
A1134: PRAHRAN | C1134: 1 | D1134: 3 | E1134: =C1134*6+D1134 -> 9 | G1134: 3 | H1134: 5 | I1134: =G1134*6+H1134 -> 23 | K1134: 4 | L1134: 6 | M1134: =K1134*6+L1134 -> 30 | O1134: 8 | P1134: 7 | Q1134: =O1134*6+P1134 -> 55 | S1134: O'DONOGHUE
A1135: BEST PLAYERS
A1136: WILLIAMSTOWN | C1136: CULLINAN | F1136: OUTEN | I1136: GEAR | L1136: R SMITH | O1136: MARTIN | R1136: E BEITZEL
A1137: PRAHRAN | C1137: McKENZIE | F1137: PEARSON | I1137: HOOPER | L1137: HEALEY | O1137: ROY JONES | R1137: HEAD
A1138: GOALKICKERS
A1139: WILLIAMSTOWN | C1139: CULLINAN 8 | F1139: GEAR 5 | I1139: O'CONNOR 3 | L1139: WARD 2 | N1139: JONES | P1139: MURPHY
A1140: PRAHRAN | C1140: PEARSON 3 | F1140: ORCHARD 2 | I1140: HORSFIELD | L1140: HEALEY | N1140: HEAD
A1142: CAMBERWELL | C1142: 4 | D1142: 4 | E1142: =C1142*6+D1142 -> 28 | G1142: 9 | H1142: 10 | I1142: =G1142*6+H1142 -> 64 | K1142: 10 | L1142: 15 | M1142: =K1142*6+L1142 -> 75 | O1142: 13 | P1142: 24 | Q1142: =O1142*6+P1142 -> 102 | S1142: YARRAVILLE
A1143: YARRAVILLE | C1143: 2 | D1143: 6 | E1143: =C1143*6+D1143 -> 18 | G1143: 3 | H1143: 9 | I1143: =G1143*6+H1143 -> 27 | K1143: 6 | L1143: 12 | M1143: =K1143*6+L1143 -> 48 | O1143: 12 | P1143: 15 | Q1143: =O1143*6+P1143 -> 87 | S1143: IRVING
A1144: BEST PLAYERS
A1145: CAMBERWELL | C1145: ROSS | F1145: HOLYOAK | I1145: COLEMAN | L1145: AMERY | O1145: HIGSON | R1145: DUGDALE
A1146: YARRAVILLE | C1146: LAMONT | F1146: GARRICK | I1146: BODSWORTH | L1146: CAREY | O1146: WILD | R1146: MASON
A1147: GOALKICKERS
A1148: CAMBERWELL | C1148: HIGSON 5 | F1148: PIPER 2 | H1148: ROSS | J1148: HOLYOAK | M1148: DUGDALE | O1148: WATTS | Q1148: SKALBERG | S1148: AMERY
A1149: YARRAVILLE | C1149: WALLIS 5 | F1149: LIVINGSTONE | I1149: GARRICK | K1149: DRIVER | M1149: CAREY | O1149: MATTHEWS | R1149: O'MEARA | T1149: COLLINS
A1151: BRUNSWICK | C1151: 1 | D1151: 6 | E1151: =C1151*6+D1151 -> 12 | G1151: 4 | H1151: 7 | I1151: =G1151*6+H1151 -> 31 | K1151: 7 | L1151: 9 | M1151: =K1151*6+L1151 -> 51 | O1151: 14 | P1151: 13 | Q1151: =O1151*6+P1151 -> 97 | S1151: OAKLEIGH
A1152: OAKLEIGH | C1152: 2 | D1152: 3 | E1152: =C1152*6+D1152 -> 15 | G1152: 3 | H1152: 7 | I1152: =G1152*6+H1152 -> 25 | K1152: 6 | L1152: 10 | M1152: =K1152*6+L1152 -> 46 | O1152: 6 | P1152: 11 | Q1152: =O1152*6+P1152 -> 47 | S1152: ROACH
A1153: BEST PLAYERS
A1154: BRUNSWICK | C1154: THORNTON | F1154: ROLFS | I1154: WEIR | L1154: EDWARDS | O1154: POLLARD | R1154: ROBSON
A1155: OAKLEIGH | C1155: COLLINS | F1155: KELLETT | I1155: F BAPTIST | L1155: PRENDERGAST | O1155: HORLEY | R1155: ROBINSON
A1156: GOALKICKERS
A1157: BRUNSWICK | C1157: THORNTON 4 | F1157: K DILLON 4 | I1157: WHILEY 2 | L1157: McMAHON | N1157: McFARLANE | Q1157: HAYES | S1157: JARMAN
A1158: OAKLEIGH | C1158: McGOWAN 2 | F1158: NICHOLSON | I1158: LONGNEY | L1158: WOODS | N1158: GAY
A1160: PRESTON | C1160: 6 | D1160: 5 | E1160: =C1160*6+D1160 -> 41 | G1160: 15 | H1160: 12 | I1160: =G1160*6+H1160 -> 102 | K1160: 20 | L1160: 15 | M1160: =K1160*6+L1160 -> 135 | O1160: 26 | P1160: 17 | Q1160: =O1160*6+P1160 -> 173 | S1160: NORTHCOTE
A1161: NORTHCOTE | C1161: 2 | D1161: 4 | E1161: =C1161*6+D1161 -> 16 | G1161: 2 | H1161: 4 | I1161: =G1161*6+H1161 -> 16 | K1161: 3 | L1161: 5 | M1161: =K1161*6+L1161 -> 23 | O1161: 5 | P1161: 10 | Q1161: =O1161*6+P1161 -> 40 | S1161: ALLEN
A1162: BEST PLAYERS
A1163: PRESTON | C1163: PREST | F1163: WILLIAMS | I1163: F CHARD | L1163: FOLEY | O1163: LITTLE | R1163: COOPER
A1164: NORTHCOTE | C1164: WOOLNOUGH | F1164: GERVASONI | I1164: BRETHERTON | L1164: TAYLOR | O1164: DEVINE | R1164: POWELL
A1165: GOALKICKERS
A1166: PRESTON | C1166: F CHARD 12 | F1166: McKENZIE 3 | I1166: FOLEY 3 | K1166: SIDE 3 | M1166: WILLIAMS 3 | P1166: GLEESON | R1166: McLACHLAN
A1167: NORTHCOTE | C1167: GERVASONI 3 | F1167: RADCLIFFE | I1167: POWELL
A1169: PORT MELBOURNE | C1169: 5 | D1169: 6 | E1169: =C1169*6+D1169 -> 36 | G1169: 8 | H1169: 9 | I1169: =G1169*6+H1169 -> 57 | K1169: 13 | L1169: 13 | M1169: =K1169*6+L1169 -> 91 | O1169: 17 | P1169: 20 | Q1169: =O1169*6+P1169 -> 122 | S1169: PORT MELBOURNE
A1170: BRIGHTON | C1170: 1 | D1170: 4 | E1170: =C1170*6+D1170 -> 10 | G1170: 5 | H1170: 9 | I1170: =G1170*6+H1170 -> 39 | K1170: 9 | L1170: 11 | M1170: =K1170*6+L1170 -> 65 | O1170: 10 | P1170: 11 | Q1170: =O1170*6+P1170 -> 71 | S1170: BREWER
A1171: BEST PLAYERS
A1172: PORT MELBOURNE | C1172: JOHNSON | F1172: WITHERS | I1172: MONKS | L1172: LOCKHART | O1172: EVANS | R1172: BONNETT
A1173: BRIGHTON | C1173: ASLING | F1173: DALEY | I1173: COOPER | L1173: COLLINS | O1173: STEVENS | R1173: WILLIAMS
A1174: GOALKICKERS
A1175: PORT MELBOURNE | C1175: BONNETT 5 | F1175: MONKS 4 | I1175: EVANS 3 | K1175: SYKES 2 | M1175: McDONALD 2 | P1175: BRAGG
A1176: BRIGHTON | C1176: HART 5 | F1176: WILKINSON | I1176: COOPER | K1176: ASLING | M1176: BROWNING | P1176: COLLINS
A1178: ROUND 19 | E1178: 31ST AUGUST | H1178: WEATHER | K1178: SOUTH WEST WIND COLD HEAVY RAIN & HAIL | S1178: PLAYED AT
D1179: 1ST QTR | H1179: 2ND QTR | L1179: 3RD QTR | P1179: FINAL | S1179: BRUNSWICK
A1180: PORT MELBOURNE | C1180: 4 | D1180: 0 | E1180: =C1180*6+D1180 -> 24 | G1180: 5 | H1180: 4 | I1180: =G1180*6+H1180 -> 34 | K1180: 9 | L1180: 4 | M1180: =K1180*6+L1180 -> 58 | O1180: 10 | P1180: 10 | Q1180: =O1180*6+P1180 -> 70 | S1180: UMPIRE | X1180: LADDER | AB1180: ROUND | AD1180: 19
A1181: BRUNSWICK | C1181: 3 | D1181: 5 | E1181: =C1181*6+D1181 -> 23 | G1181: 5 | H1181: 8 | I1181: =G1181*6+H1181 -> 38 | K1181: 6 | L1181: 8 | M1181: =K1181*6+L1181 -> 44 | O1181: 9 | P1181: 10 | Q1181: =O1181*6+P1181 -> 64 | S1181: IRVING
A1182: BEST PLAYERS | W1182: TEAM | X1182: W | Y1182: L | Z1182: D | AA1182: FOR | AB1182: AGST | AC1182: % | AD1182: PTS
A1183: PORT MELBOURNE | C1183: MONKS | F1183: JOHNSON | I1183: METHERALL | L1183: McDONALD | O1183: R ATKINSON | R1183: LANDORFF
A1184: BRUNSWICK | C1184: K DILLON | F1184: ROLFS | I1184: LOVETT | L1184: HAYES | O1184: POLLARD | R1184: McFARLANE | W1184: WILLIAMSTOWN | X1184: 19 | Y1184: 0 | Z1184: 0 | AA1184: 1693 | AB1184: 934 | AC1184: 181.26338329764454 | AD1184: 76
A1185: GOALKICKERS | W1185: MOORABBIN | X1185: 14 | Y1185: 5 | Z1185: 0 | AA1185: 1812 | AB1185: 1255 | AC1185: 144.38 | AD1185: 56
A1186: PORT MELBOURNE | C1186: MONKS 2 | F1186: McDONALD 2 | I1186: EVANS | K1186: LEWIS | M1186: SYKES | O1186: JOHNSON | R1186: BONNETT | T1186: WITHERS | W1186: PORT MELBOURNE | X1186: 14 | Y1186: 5 | Z1186: 0 | AA1186: 1837 | AB1186: 1287 | AC1186: 142.74 | AD1186: 56
A1187: BRUNSWICK | C1187: K DILLON 2 | F1187: ROBSON 2 | I1187: THORNTON | L1187: WHILEY | N1187: POLLARD | Q1187: McFARLANE | S1187: MULLENGER | W1187: PRESTON | X1187: 12 | Y1187: 7 | Z1187: 0 | AA1187: 1699 | AB1187: 1379 | AC1187: 123.20522117476432 | AD1187: 48
A1189: COBURG | C1189: 2 | D1189: 6 | E1189: =C1189*6+D1189 -> 18 | G1189: 4 | H1189: 8 | I1189: =G1189*6+H1189 -> 32 | K1189: 6 | L1189: 12 | M1189: =K1189*6+L1189 -> 48 | O1189: 9 | P1189: 14 | Q1189: =O1189*6+P1189 -> 68 | S1189: BEACH ROAD | W1189: BRUNSWICK | X1189: 12 | Y1189: 7 | Z1189: 0 | AA1189: 1400 | AB1189: 1250 | AC1189: 112 | AD1189: 48
A1190: SANDRINGHAM | C1190: 0 | D1190: 2 | E1190: =C1190*6+D1190 -> 2 | G1190: 3 | H1190: 8 | I1190: =G1190*6+H1190 -> 26 | K1190: 4 | L1190: 10 | M1190: =K1190*6+L1190 -> 34 | O1190: 8 | P1190: 16 | Q1190: =O1190*6+P1190 -> 64 | S1190: O'DONOGHUE | W1190: COBURG | X1190: 11 | Y1190: 8 | Z1190: 0 | AA1190: 1576 | AB1190: 1385 | AC1190: 113.79061371841155 | AD1190: 44
A1191: BEST PLAYERS | W1191: BOX HILL | X1191: 11 | Y1191: 8 | Z1191: 0 | AA1191: 1619 | AB1191: 1425 | AC1191: 113.6140350877193 | AD1191: 44
A1192: COBURG | C1192: BIGELOW | F1192: WILKINSON | I1192: YOUNG | L1192: CUFFE | O1192: JORDAN | R1192: SHAW | W1192: SANDRINGHAM | X1192: 8 | Y1192: 10 | Z1192: 1 | AA1192: 1326 | AB1192: 1490 | AC1192: 88.993288590604024 | AD1192: 34
A1193: SANDRINGHAM | C1193: BOLAND | F1193: McLEAN | I1193: K EVANS | L1193: OAKLEY | O1193: WINTERS | R1193: RANSOM | W1193: YARRAVILLE | X1193: 7 | Y1193: 11 | Z1193: 1 | AA1193: 1462 | AB1193: 1453 | AC1193: 100.6194081211287 | AD1193: 30
A1194: GOALKICKERS | W1194: CAMBERWELL | X1194: 7 | Y1194: 12 | Z1194: 0 | AA1194: 1436 | AB1194: 1705 | AC1194: 84.222873900293251 | AD1194: 28
A1195: COBURG | C1195: YOUNG 2 | F1195: JORDAN 2 | I1195: HEWES 2 | L1195: BIGELOW | N1195: B JONES | Q1195: BRENNAN | W1195: PRAHRAN | X1195: 6 | Y1195: 12 | Z1195: 1 | AA1195: 1415 | AB1195: 1875 | AC1195: 75.466666666666669 | AD1195: 26
A1196: SANDRINGHAM | C1196: BOLAND 2 | F1196: K EVANS 2 | I1196: OAKLEY 2 | L1196: RANSOM | N1196: JOHNSTON | W1196: OAKLEIGH | X1196: 5 | Y1196: 14 | Z1196: 0 | AA1196: 1232 | AB1196: 1674 | AC1196: 73.6 | AD1196: 20
W1197: NORTHCOTE | X1197: 3 | Y1197: 16 | Z1197: 0 | AA1197: 1119 | AB1197: 1890 | AC1197: 59.206349206349209 | AD1197: 12
A1198: BOX HILL | C1198: 3 | D1198: 2 | E1198: =C1198*6+D1198 -> 20 | G1198: 9 | H1198: 9 | I1198: =G1198*6+H1198 -> 63 | K1198: 9 | L1198: 11 | M1198: =K1198*6+L1198 -> 65 | O1198: 14 | P1198: 18 | Q1198: =O1198*6+P1198 -> 102 | S1198: TOORAK PARK | W1198: BRIGHTON | X1198: 2 | Y1198: 16 | Z1198: 1 | AA1198: 1329 | AB1198: 1953 | AC1198: 68.049155145929333 | AD1198: 10
A1199: PRAHRAN | C1199: 1 | D1199: 5 | E1199: =C1199*6+D1199 -> 11 | G1199: 1 | H1199: 5 | I1199: =G1199*6+H1199 -> 11 | K1199: 9 | L1199: 9 | M1199: =K1199*6+L1199 -> 63 | O1199: 9 | P1199: 10 | Q1199: =O1199*6+P1199 -> 64 | S1199: ROACH
A1200: BEST PLAYERS
A1201: BOX HILL | C1201: SAWATSKY | F1201: IRVINE | I1201: EADE | L1201: LOVE | N1201: WHITE | Q1201: HOUGHTON
A1202: PRAHRAN | C1202: BOYD | F1202: HARVEY | I1202: HEALEY | L1202: HEAD | N1202: ROY JONES | Q1202: McKENZIE
A1203: GOALKICKERS
A1204: BOX HILL | C1204: COX 3 | E1204: BENNETT 3 | H1204: SAWATSKY 2 | K1204: DEVERY 2 | N1204: ELSWORTH | Q1204: LOVE | R1204: INGLETON | T1204: HOUGHTON
A1205: PRAHRAN | C1205: McKENZIE 3 | F1205: SIMPSON 2 | I1205: BOYD 2 | K1205: HARVEY | M1205: PEARSON
A1207: BRIGHTON | C1207: 3 | D1207: 2 | E1207: =C1207*6+D1207 -> 20 | G1207: 7 | H1207: 5 | I1207: =G1207*6+H1207 -> 47 | K1207: 10 | L1207: 12 | M1207: =K1207*6+L1207 -> 72 | O1207: 12 | P1207: 13 | Q1207: =O1207*6+P1207 -> 85 | S1207: ELSTERNWICK PARK
A1208: YARRAVILLE | C1208: 2 | D1208: 3 | E1208: =C1208*6+D1208 -> 15 | G1208: 7 | H1208: 4 | I1208: =G1208*6+H1208 -> 46 | K1208: 10 | L1208: 6 | M1208: =K1208*6+L1208 -> 66 | O1208: 12 | P1208: 13 | Q1208: =O1208*6+P1208 -> 85 | S1208: ALLEN
A1209: BEST PLAYERS
A1210: BRIGHTON | C1210: DALEY | F1210: WILKINSON | I1210: STEVENS | L1210: HUNTER | O1210: HART | R1210: McCANN
A1211: YARRAVILLE | C1211: DRIVER | F1211: ORANGE | I1211: ROHLEDER | L1211: WEBB | O1211: GARRICK | R1211: CAREY
A1212: GOALKICKERS
A1213: BRIGHTON | C1213: DALEY 4 | F1213: COLLINS 2 | I1213: WILKINSON 2 | L1213: HART 2 | N1213: STEVENS | Q1213: CRAIG
A1214: YARRAVILLE | C1214: ORANGE 4 | F1214: DRIVER 3 | I1214: CAREY 2 | L1214: WEBB 2 | O1214: DIXON
A1216: WILLIAMSTOWN | C1216: 3 | D1216: 1 | E1216: =C1216*6+D1216 -> 19 | G1216: 6 | H1216: 5 | I1216: =G1216*6+H1216 -> 41 | K1216: 7 | L1216: 7 | M1216: =K1216*6+L1216 -> 49 | O1216: 11 | P1216: 14 | Q1216: =O1216*6+P1216 -> 80 | S1216: WILLIAMSTOWN
A1217: CAMBERWELL | C1217: 0 | D1217: 3 | E1217: =C1217*6+D1217 -> 3 | G1217: 1 | H1217: 5 | I1217: =G1217*6+H1217 -> 11 | K1217: 4 | L1217: 10 | M1217: =K1217*6+L1217 -> 34 | O1217: 5 | P1217: 10 | Q1217: =O1217*6+P1217 -> 40 | S1217: CARDWELL
A1218: BEST PLAYERS
A1219: WILLIAMSTOWN | C1219: OUTEN | F1219: R JONES | I1219: CALLAHAN | L1219: GEAR | O1219: WHITAKER | R1219: RAMSAY
A1220: CAMBERWELL | C1220: COLEMAN | F1220: DUGDALE | I1220: ROSS | L1220: HEGARTY | O1220: HIGSON | R1220: SKALBERG
A1221: GOALKICKERS
A1222: WILLIAMSTOWN | C1222: CULLINAN 4 | F1222: GEAR 3 | I1222: CALLAHAN | L1222: WARD | N1222: READ | P1222: SMITH
A1223: CAMBERWELL | C1223: HIGSON 2 | F1223: HOLYOAK | I1223: COLEMAN | L1223: WATTS
A1225: PRESTON | C1225: 3 | D1225: 6 | E1225: =C1225*6+D1225 -> 24 | G1225: 5 | H1225: 10 | I1225: =G1225*6+H1225 -> 40 | K1225: 12 | L1225: 13 | M1225: =K1225*6+L1225 -> 85 | O1225: 14 | P1225: 16 | Q1225: =O1225*6+P1225 -> 100 | S1225: PRESTON
A1226: OAKLEIGH | C1226: 2 | D1226: 1 | E1226: =C1226*6+D1226 -> 13 | G1226: 7 | H1226: 4 | I1226: =G1226*6+H1226 -> 46 | K1226: 10 | L1226: 5 | M1226: =K1226*6+L1226 -> 65 | O1226: 11 | P1226: 9 | Q1226: =O1226*6+P1226 -> 75 | S1226: GODING
A1227: BEST PLAYERS
A1228: PRESTON | C1228: FOOTE | F1228: COOPER | I1228: WILLIAMS | L1228: GLEESON | O1228: SWEET | R1228: LITTLE
A1229: OAKLEIGH | C1229: LONGNEY | F1229: McGOWAN | I1229: BOURKE | L1229: COLLINS | O1229: COUGHLAN | R1229: DOWLING
A1230: GOALKICKERS
A1231: PRESTON | C1231: F CHARD 4 | F1231: WILLIAMS 3 | I1231: FOLEY 2 | K1231: FOOTE | M1231: GLEESON | O1231: HAYES | Q1231: SWEET | S1231: COOPER
A1232: OAKLEIGH | C1232: McGOWAN 7 | F1232: NICHOLSON | I1232: DOWLING | L1232: LONGNEY | O1232: COUGHLAN
A1234: MOORABBIN | C1234: 7 | D1234: 4 | E1234: =C1234*6+D1234 -> 46 | G1234: 10 | H1234: 8 | I1234: =G1234*6+H1234 -> 68 | K1234: 18 | L1234: 11 | M1234: =K1234*6+L1234 -> 119 | O1234: 21 | P1234: 12 | Q1234: =O1234*6+P1234 -> 138 | S1234: MOORABBIN
A1235: NORTHCOTE | C1235: 0 | D1235: 0 | E1235: =C1235*6+D1235 -> 0 | G1235: 1 | H1235: 2 | I1235: =G1235*6+H1235 -> 8 | K1235: 2 | L1235: 3 | M1235: =K1235*6+L1235 -> 15 | O1235: 5 | P1235: 10 | Q1235: =O1235*6+P1235 -> 40 | S1235: BREWER
A1236: BEST PLAYERS
A1237: MOORABBIN | C1237: McGAW | F1237: MURRAY | I1237: BOYD | L1237: GREEN | O1237: HIRST | R1237: TREZISE
A1238: NORTHCOTE | C1238: DEVINE | F1238: GERVASONI | I1238: J VAINS | L1238: PETERS | O1238: HUSSEY | R1238: L WALKER
A1239: GOALKICKERS
A1240: MOORABBIN | C1240: RENWICK 7 | F1240: McGAW 5 | I1240: MURPHY 2 | L1240: CLOVER 2 | O1240: EVANS | Q1240: HOGAN | S1240: BULL | U1240: MURRAY | W1240: BULMER
A1241: NORTHCOTE | C1241: KENNEDY | F1241: WOOLNOUGH | I1241: PETERS | K1241: F VAINS | N1241: GERVASONI
A1243: ROUND 20 | E1243: 7TH SEPTEMBER | I1243: WEATHER | L1243: STRONG SOUTH WIND RAIN IN 2ND HALF | S1243: PLAYED AT
D1244: 1ST QTR | H1244: 2ND QTR | L1244: 3RD QTR | P1244: FINAL | S1244: PORT MELBOURNE
A1245: PRESTON | C1245: 3 | D1245: 3 | E1245: =C1245*6+D1245 -> 21 | G1245: 4 | H1245: 7 | I1245: =G1245*6+H1245 -> 31 | K1245: 10 | L1245: 11 | M1245: =K1245*6+L1245 -> 71 | O1245: 12 | P1245: 13 | Q1245: =O1245*6+P1245 -> 85 | S1245: UMPIRE | X1245: LADDER | AB1245: ROUND | AD1245: 20
A1246: PORT MELBOURNE | C1246: 2 | D1246: 3 | E1246: =C1246*6+D1246 -> 15 | G1246: 5 | H1246: 7 | I1246: =G1246*6+H1246 -> 37 | K1246: 9 | L1246: 9 | M1246: =K1246*6+L1246 -> 63 | O1246: 12 | P1246: 9 | Q1246: =O1246*6+P1246 -> 81 | S1246: BREWER
A1247: BEST PLAYERS | W1247: TEAM | X1247: W | Y1247: L | Z1247: D | AA1247: FOR | AB1247: AGST | AC1247: % | AD1247: PTS
A1248: PRESTON | C1248: FOOTE | F1248: GLEESON | I1248: COOPER | L1248: DAWSON | O1248: SIDE | R1248: HAYES
A1249: PORT MELBOURNE | C1249: MONKS | F1249: METHERALL | I1249: BONNETT | L1249: R ATKINSON | O1249: LANDORFF | R1249: LOCKHART | W1249: WILLIAMSTOWN | X1249: 20 | Y1249: 0 | Z1249: 0 | AA1249: 1784 | AB1249: 969 | AC1249: 184.10732714138288 | AD1249: 80
A1250: GOALKICKERS | W1250: MOORABBIN | X1250: 15 | Y1250: 5 | Z1250: 0 | AA1250: 1876 | AB1250: 1314 | AC1250: 142.77 | AD1250: 60
A1251: PRESTON | C1251: F CHARD 3 | F1251: FOOTE 2 | I1251: COOPER 2 | L1251: McLACHLAN 2 | P1251: SIDE | R1251: HAYES | T1251: FOLEY | W1251: PORT MELBOURNE | X1251: 14 | Y1251: 6 | Z1251: 0 | AA1251: 1918 | AB1251: 1372 | AC1251: 139.8 | AD1251: 56
A1252: PORT MELBOURNE | C1252: BONNETT 5 | F1252: MONKS 4 | I1252: EVANS | K1252: SYKES | M1252: McDONALD | W1252: PRESTON | X1252: 13 | Y1252: 7 | Z1252: 0 | AA1252: 1784 | AB1252: 1460 | AC1252: 122.1917808219178 | AD1252: 52
A1254: BRUNSWICK | C1254: 1 | D1254: 3 | E1254: =C1254*6+D1254 -> 9 | G1254: 5 | H1254: 6 | I1254: =G1254*6+H1254 -> 36 | K1254: 6 | L1254: 9 | M1254: =K1254*6+L1254 -> 45 | O1254: 9 | P1254: 14 | Q1254: =O1254*6+P1254 -> 68 | S1254: YARRAVILLE | W1254: BRUNSWICK | X1254: 13 | Y1254: 7 | Z1254: 0 | AA1254: 1468 | AB1254: 1292 | AC1254: 113.62229102167183 | AD1254: 52
A1255: YARRAVILLE | C1255: 0 | D1255: 2 | E1255: =C1255*6+D1255 -> 2 | G1255: 0 | H1255: 6 | I1255: =G1255*6+H1255 -> 6 | K1255: 3 | L1255: 8 | M1255: =K1255*6+L1255 -> 26 | O1255: 5 | P1255: 12 | Q1255: =O1255*6+P1255 -> 42 | S1255: O'DONOGHUE | W1255: COBURG | X1255: 12 | Y1255: 8 | Z1255: 0 | AA1255: 1699 | AB1255: 1408 | AC1255: 120.66761363636364 | AD1255: 48
A1256: BEST PLAYERS | W1256: BOX HILL | X1256: 11 | Y1256: 9 | Z1256: 0 | AA1256: 1654 | AB1256: 1516 | AC1256: 109.10290237467018 | AD1256: 44
A1257: BRUNSWICK | C1257: SEYMOUR | F1257: MULLENGER | I1257: STANLEY | L1257: K DILLON | O1257: WEIR | R1257: J DILLON | W1257: SANDRINGHAM | X1257: 8 | Y1257: 11 | Z1257: 1 | AA1257: 1362 | AB1257: 1528 | AC1257: 89.136125654450268 | AD1257: 34
A1258: YARRAVILLE | C1258: LIVINGSTONE | F1258: GARRICK | I1258: WILD | L1258: DIXON | O1258: COCKRAM | R1258: TITFORD | W1258: CAMBERWELL | X1258: 8 | Y1258: 12 | Z1258: 0 | AA1258: 1529 | AB1258: 1790 | AC1258: 85.418994413407816 | AD1258: 32
A1259: GOALKICKERS | W1259: YARRAVILLE | X1259: 7 | Y1259: 12 | Z1259: 1 | AA1259: 1504 | AB1259: 1521 | AC1259: 98.882314266929654 | AD1259: 30
A1260: BRUNSWICK | C1260: K DILLON 3 | F1260: MULLENGER 2 | J1260: THORNTON | M1260: SEYMOUR | P1260: McFARLANE | S1260: TAYLOR | W1260: PRAHRAN | X1260: 6 | Y1260: 13 | Z1260: 1 | AA1260: 1438 | AB1260: 1998 | AC1260: 71.971971971971968 | AD1260: 26
A1261: YARRAVILLE | C1261: DIXON 2 | F1261: DRIVER | I1261: GARRICK | L1261: WEBB | W1261: OAKLEIGH | X1261: 5 | Y1261: 15 | Z1261: 0 | AA1261: 1291 | AB1261: 1738 | AC1261: 74.280782508630608 | AD1261: 20
W1262: NORTHCOTE | X1262: 4 | Y1262: 16 | Z1262: 0 | AA1262: 1157 | AB1262: 1926 | AC1262: 60.072689511941846 | AD1262: 16
A1263: WILLIAMSTOWN | C1263: 5 | D1263: 1 | E1263: =C1263*6+D1263 -> 31 | G1263: 8 | H1263: 6 | I1263: =G1263*6+H1263 -> 54 | K1263: 10 | L1263: 8 | M1263: =K1263*6+L1263 -> 68 | O1263: 13 | P1263: 13 | Q1263: =O1263*6+P1263 -> 91 | S1263: BOX HILL | W1263: BRIGHTON | X1263: 2 | Y1263: 17 | Z1263: 1 | AA1263: 1414 | AB1263: 2046 | AC1263: 69.110459433040077 | AD1263: 10
A1264: BOX HILL | C1264: 0 | D1264: 3 | E1264: =C1264*6+D1264 -> 3 | G1264: 0 | H1264: 3 | I1264: =G1264*6+H1264 -> 3 | K1264: 2 | L1264: 9 | M1264: =K1264*6+L1264 -> 21 | O1264: 4 | P1264: 11 | Q1264: =O1264*6+P1264 -> 35 | S1264: IRVING
A1265: BEST PLAYERS
A1266: WILLIAMSTOWN | C1266: KENT | F1266: SMITH | I1266: O'CONNOR | L1266: CULLINAN | O1266: SIMS | R1266: GEAR
A1267: BOX HILL | C1267: WHITE | F1267: BROWN | I1267: CRAIG | L1267: LOVE | O1267: FANNING | R1267: BROWN
A1268: GOALKICKERS
A1269: WILLIAMSTOWN | C1269: CULLINAN 6 | F1269: GEAR 3 | I1269: O'CONNOR 2 | M1269: WARD | O1269: CALLAHAN
A1270: BOX HILL | C1270: COX | F1270: BROWN | I1270: SAWATSKY | L1270: DEVERY
A1272: COBURG | C1272: 4 | D1272: 8 | E1272: =C1272*6+D1272 -> 32 | G1272: 8 | H1272: 12 | I1272: =G1272*6+H1272 -> 60 | K1272: 13 | L1272: 16 | M1272: =K1272*6+L1272 -> 94 | O1272: 17 | P1272: 21 | Q1272: =O1272*6+P1272 -> 123 | S1272: COBURG
A1273: PRAHRAN | C1273: 0 | D1273: 1 | E1273: =C1273*6+D1273 -> 1 | G1273: 1 | H1273: 4 | I1273: =G1273*6+H1273 -> 10 | K1273: 1 | L1273: 8 | M1273: =K1273*6+L1273 -> 14 | O1273: 2 | P1273: 11 | Q1273: =O1273*6+P1273 -> 23 | S1273: BREWER
A1274: BEST PLAYERS
A1275: COBURG | C1275: HEWES | F1275: SHAW | I1275: WILKINSON | L1275: JORDAN | O1275: CUFFE | R1275: LIVINGSTONE
A1276: PRAHRAN | C1276: HARVEY | F1276: CHRISTIAN | I1276: HORSFIELD | L1276: RICKARDS | O1276: ROY JONES | R1276: ORCHARD
A1277: GOALKICKERS
A1278: COBURG | C1278: HEWES 9 | F1278: SHAW 3 | I1278: BRENNAN 2 | L1278: JONES | N1278: McCOLL | P1278: JORDAN
A1279: PRAHRAN | C1279: RICKARDS | F1279: O'BRYAN
A1281: CAMBERWELL | C1281: 1 | D1281: 2 | E1281: =C1281*6+D1281 -> 8 | G1281: 5 | H1281: 4 | I1281: =G1281*6+H1281 -> 34 | K1281: 8 | L1281: 6 | M1281: =K1281*6+L1281 -> 54 | O1281: 13 | P1281: 15 | Q1281: =O1281*6+P1281 -> 93 | S1281: CAMBERWELL
A1282: BRIGHTON | C1282: 7 | D1282: 2 | E1282: =C1282*6+D1282 -> 44 | G1282: 8 | H1282: 8 | I1282: =G1282*6+H1282 -> 56 | K1282: 11 | L1282: 12 | M1282: =K1282*6+L1282 -> 78 | O1282: 12 | P1282: 13 | Q1282: =O1282*6+P1282 -> 85 | S1282: GODING
A1283: BEST PLAYERS
A1284: CAMBERWELL | C1284: ROSS | F1284: HOLYOAK | I1284: McGUINNESS | L1284: AMERY | O1284: MASON | R1284: SKALBERG
A1285: BRIGHTON | C1285: ASLING | F1285: COOPER | I1285: STEVENS | L1285: MAY | O1285: McCANN | R1285: MILNES
A1286: GOALKICKERS
A1287: CAMBERWELL | C1287: McGUINNESS 4 | F1287: COLEMAN 2 | I1287: HOLYOAK | K1287: DUGDALE | M1287: AMERY | O1287: ROSS | Q1287: McPHAIL | S1287: HIGSON | U1287: SEYMOUR
A1288: BRIGHTON | C1288: COOPER 3 | F1288: COLLINS 2 | I1288: HART 2 | K1288: DALEY | M1288: WOOLSTENCROFT | Q1288: WHITE | S1288: WILKINSON | V1288: CRAIG
A1290: NORTHCOTE | C1290: 1 | D1290: 3 | E1290: =C1290*6+D1290 -> 9 | G1290: 1 | H1290: 7 | I1290: =G1290*6+H1290 -> 13 | K1290: 3 | L1290: 12 | M1290: =K1290*6+L1290 -> 30 | O1290: 4 | P1290: 14 | Q1290: =O1290*6+P1290 -> 38 | S1290: NORTHCOTE
A1291: SANDRINGHAM | C1291: 1 | D1291: 0 | E1291: =C1291*6+D1291 -> 6 | G1291: 2 | H1291: 10 | I1291: =G1291*6+H1291 -> 22 | K1291: 2 | L1291: 10 | M1291: =K1291*6+L1291 -> 22 | O1291: 4 | P1291: 12 | Q1291: =O1291*6+P1291 -> 36 | S1291: ALLEN
A1292: BEST PLAYERS
A1293: NORTHCOTE | C1293: BRETHERTON | F1293: J VAINS | I1293: POWELL | L1293: GERVASONI | O1293: WOOLNOUGH | R1293: F VAINS
A1294: SANDRINGHAM | C1294: RANSOM | F1294: CROFT | I1294: WEBSTER | L1294: GRANGER | O1294: THOMPSON | R1294: BOLAND
A1295: GOALKICKERS
A1296: NORTHCOTE | C1296: COLLINS 2 | F1296: PETERS | I1296: ROMARI
A1297: SANDRINGHAM | C1297: OAKLEY 3 | F1297: JOHNSTON
A1299: MOORABBIN | C1299: 2 | D1299: 2 | E1299: =C1299*6+D1299 -> 14 | G1299: 6 | H1299: 4 | I1299: =G1299*6+H1299 -> 40 | K1299: 7 | L1299: 8 | M1299: =K1299*6+L1299 -> 50 | O1299: 9 | P1299: 10 | Q1299: =O1299*6+P1299 -> 64 | S1299: OAKLEIGH
A1300: OAKLEIGH | C1300: 4 | D1300: 3 | E1300: =C1300*6+D1300 -> 27 | G1300: 7 | H1300: 5 | I1300: =G1300*6+H1300 -> 47 | K1300: 8 | L1300: 8 | M1300: =K1300*6+L1300 -> 56 | O1300: 8 | P1300: 11 | Q1300: =O1300*6+P1300 -> 59 | S1300: CARDWELL
A1301: BEST PLAYERS
A1302: MOORABBIN | C1302: STANLEY | F1302: GILDER | I1302: BOYD | L1302: HIRST | O1302: GREEN | R1302: EVANS
A1303: OAKLEIGH | C1303: LONGNEY | F1303: NICHOLSON | I1303: B J WILLIAMS | L1303: COUGHLAN | O1303: KELLETT | R1303: KITTO
A1304: GOALKICKERS
A1305: MOORABBIN | C1305: MURRAY 2 | F1305: RENWICK 2 | I1305: MURPHY 2 | L1305: WHALEBONE | O1305: EVANS | Q1305: TRZISE
A1306: OAKLEIGH | C1306: McGOWAN 3 | F1306: COUGHLAN 2 | I1306: KELLETT | L1306: LONGNEY | O1306: NICHOLSON
A1308: FINALS
A1309: 1ST SEMI | D1309: 14TH SEPTEMBER | I1309: WEATHER | L1309: STRONG SOUTH WIND COLD DRIZZLE
D1310: 1ST QTR | H1310: 2ND QTR | L1310: 3RD QTR | P1310: FINAL
A1311: PORT MELBOURNE | C1311: 6 | D1311: 5 | E1311: =C1311*6+D1311 -> 41 | G1311: 9 | H1311: 6 | I1311: =G1311*6+H1311 -> 60 | K1311: 12 | L1311: 9 | M1311: =K1311*6+L1311 -> 81 | O1311: 19 | P1311: 13 | Q1311: =O1311*6+P1311 -> 127 | S1311: JUNCTION OVAL
A1312: PRESTON | C1312: 1 | D1312: 1 | E1312: =C1312*6+D1312 -> 7 | G1312: 3 | H1312: 2 | I1312: =G1312*6+H1312 -> 20 | K1312: 6 | L1312: 7 | M1312: =K1312*6+L1312 -> 43 | O1312: 7 | P1312: 9 | Q1312: =O1312*6+P1312 -> 51 | S1312: ALLEN
A1313: BEST PLAYERS
A1314: PORT MELBOURNE | C1314: JOHNSON | F1314: BONNETT | I1314: MONKS | L1314: METHERALL | O1314: WITHERS | R1314: BOWEN
A1315: PRESTON | C1315: McCONNELL | F1315: GLEESON | I1315: COOPER | L1315: HOWARD | O1315: PREST | R1315: FOOTE
A1316: GOALKICKERS
A1317: PORT MELBOURNE | C1317: BONNETT 4 | F1317: MONKS 4 | I1317: OLDFIELD 2 | L1317: EVANS 2 | N1317: TYRELL 2 | Q1317: THOMPSON 2 | T1317: WITHERS | W1317: JOHNSON | X1317: McDONALD
A1318: PRESTON | C1318: GLEESON 3 | F1318: FOOTE | H1318: SUPPLITT | K1318: WILLIAMS | N1318: COOPER
A1320: 2ND SEMI | E1320: 21ST SEPTEMBER | J1320: WEATHER | M1320: WEST WIND RAIN BEFORE GAME
A1321: MOORABBIN | C1321: 2 | D1321: 4 | E1321: =C1321*6+D1321 -> 16 | G1321: 4 | H1321: 6 | I1321: =G1321*6+H1321 -> 30 | K1321: 7 | L1321: 10 | M1321: =K1321*6+L1321 -> 52 | O1321: 9 | P1321: 16 | Q1321: =O1321*6+P1321 -> 70 | S1321: JUNCTION OVAL
A1322: WILLIAMSTOWN | C1322: 3 | D1322: 2 | E1322: =C1322*6+D1322 -> 20 | G1322: 6 | H1322: 4 | I1322: =G1322*6+H1322 -> 40 | K1322: 9 | L1322: 5 | M1322: =K1322*6+L1322 -> 59 | O1322: 10 | P1322: 8 | Q1322: =O1322*6+P1322 -> 68 | S1322: IRVING
A1323: BEST PLAYERS
A1324: MOORABBIN | C1324: MURPHY | F1324: MANIE | I1324: STANLEY | L1324: RENWICK | O1324: MENNIE | R1324: LEHMANN
A1325: WILLIAMSTOWN | C1325: R JONES | F1325: OUTEN | I1325: MARTIN | L1325: SMITH | O1325: EVANS | R1325: RAMSAY
A1326: GOALKICKERS
A1327: MOORABBIN | C1327: RENWICK 2 | F1327: BULL 2 | I1327: TREZISE | L1327: MURPHY | N1327: BULMER | Q1327: MANIE | S1327: WHALEBONE
A1328: WILLIAMSTOWN | C1328: WARD 2 | F1328: CULLINAN 2 | I1328: GEAR 2 | L1328: CALLAHAN | O1328: MARTIN | Q1328: F JONES | S1328: SMITH
A1330: PRELIMINARY FINAL | F1330: 28TH SEPTEMBER | J1330: WEATHER | N1330: SOUTH BREEZE FINE
A1331: PORT MELBOURNE | C1331: 4 | D1331: 4 | E1331: =C1331*6+D1331 -> 28 | G1331: 9 | H1331: 5 | I1331: =G1331*6+H1331 -> 59 | K1331: 14 | L1331: 11 | M1331: =K1331*6+L1331 -> 95 | O1331: 18 | P1331: 12 | Q1331: =O1331*6+P1331 -> 120 | S1331: JUNCTION OVAL
A1332: WILLIAMSTOWN | C1332: 1 | D1332: 4 | E1332: =C1332*6+D1332 -> 10 | G1332: 3 | H1332: 6 | I1332: =G1332*6+H1332 -> 24 | K1332: 4 | L1332: 8 | M1332: =K1332*6+L1332 -> 32 | O1332: 6 | P1332: 12 | Q1332: =O1332*6+P1332 -> 48 | S1332: ALLEN
A1333: BEST PLAYERS
A1334: PORT MELBOURNE | C1334: JOHNSON | F1334: MONKS | I1334: METHERALL | L1334: LANDORFF | O1334: WITHERS | R1334: R ATKINSON
A1335: WILLIAMSTOWN | C1335: OUTEN | F1335: E BEITZEL | I1335: WARD | L1335: R JONES | O1335: SIMS | R1335: WHITAKER
A1336: GOALKICKERS
A1337: PORT MELBOURNE | C1337: BONNETT 4 | F1337: MONKS 4 | I1337: TYRELL 3 | L1337: EVANS | N1337: LAWSON | P1337: SYKES | R1337: OLDFIELD | T1337: McDONALD | W1337: WHITE
A1338: WILLIAMSTOWN | C1338: REED 2 | F1338: CULLINAN 2 | I1338: B BEITZEL | L1338: SMITH
A1340: GRAND FINAL | E1340: 5TH OCTOBER | J1340: WEATHER | M1340: DULL RAIN AFTER HALF TIME
A1341: MOORABBIN | C1341: 4 | D1341: 4 | E1341: 28 | G1341: 7 | H1341: 6 | I1341: 48 | K1341: 10 | L1341: 10 | M1341: 70 | O1341: 15 | P1341: 12 | Q1341: =O1341*6+P1341 -> 102 | S1341: JUNCTION OVAL
A1342: PORT MELBOURNE | C1342: 1 | D1342: 7 | E1342: 13 | G1342: 4 | H1342: 14 | I1342: 38 | K1342: 5 | L1342: 17 | M1342: 47 | O1342: 7 | P1342: 20 | Q1342: =O1342*6+P1342 -> 62 | S1342: IRVING
A1343: BEST PLAYERS
A1344: MOORABBIN | C1344: GREEN | F1344: TREZISE | I1344: MURPHY | L1344: EVANS | O1344: MANIE | R1344: McGAW
A1345: PORT MELBOURNE | C1345: R ATKINSON | F1345: BOWEN | I1345: JOHNSON | L1345: MONKS | O1345: EVANS | R1345: WHITE
A1346: GOALKICKERS
A1347: MOORABBIN | C1347: RENWICK 3 | F1347: BULL 3 | H1347: CLOVER 2 | K1347: MURPHY 2 | N1347: MANIE | P1347: McGAW | R1347: MURRAY | T1347: MENNIE | V1347: BULMER
A1348: PORT MELBOURNE | C1348: EVANS 2 | F1348: MONKS | H1348: WITHERS | K1348: SYKES | M1348: BONNETT | O1348: OLDFIELD
A1350: REPRESENTATIVE GAMES | I1350: 24TH JULY (WED NIGHT)
A1351: S A | C1351: 1 | D1351: 2 | E1351: =C1351*6+D1351 -> 8 | G1351: 2 | H1351: 7 | I1351: =G1351*6+H1351 -> 19 | K1351: 8 | L1351: 7 | M1351: =K1351*6+L1351 -> 55 | O1351: 11 | P1351: 12 | Q1351: =O1351*6+P1351 -> 78 | S1351: STH MELB
A1352: V F A | C1352: 1 | D1352: 1 | E1352: =C1352*6+D1352 -> 7 | G1352: 2 | H1352: 4 | I1352: =G1352*6+H1352 -> 16 | K1352: 4 | L1352: 6 | M1352: =K1352*6+L1352 -> 30 | O1352: 6 | P1352: 8 | Q1352: =O1352*6+P1352 -> 44 | S1352: GARDNER (W.A.)
A1353: BEST PLAYERS
A1354: S A | C1354: DEANE | F1354: WILLIAMS | I1354: HEAD | L1354: WALKER | O1354: KOERNER | R1354: PHIPPS
A1355: V F A | C1355: MARTIN | F1355: E BEITZEL | I1355: JOHNSON | L1355: R JONES | O1355: WEIR | R1355: COUGHLAN
A1356: GOALKICKERS
A1357: S A | C1357: HEAD 3 | F1357: WILLIAMS 2 | I1357: DEANE 2 | L1357: PHIPPS 2 | O1357: JOHNS | Q1357: WALKER
A1358: V F A | C1358: MARTIN | F1358: WEIR | H1358: SMITH | J1358: McGAW | L1358: BONNETT | O1358: COUGHLAN
A1360: TEAMS
F1361: V.F.A. | O1361: S.A.
A1362: BACKS | C1362: E BEITZEL | F1362: ROLFS | I1362: CALLAHAN | L1362: KRETSCHMER | O1362: KERLEY | R1362: GILBOURNE
A1363: H-BACKS | C1363: OUTEN | F1363: WHILEY | I1363: IRVINE | L1363: HEW | O1363: ASHBY | R1363: SAWLEY
A1364: CENTRES | C1364: K BOYD | F1364: MARTIN | I1364: MURPHY | L1364: EGLINTON | O1364: KOERNER | R1364: McDONALD
A1365: H-FORWARDS | C1365: R SMITH | F1365: LOVE | I1365: COUGHLAN | L1365: HEAD | O1365: PHIPPS | R1365: DEANE
A1366: FORWARDS | C1366: R JONES | F1366: BONNETT | I1366: WARD | L1366: DAVIES | O1366: JOHNS | R1366: SHEPPARD
A1367: RUCKS | C1367: JOHNSON | F1367: ROSS | I1367: WEIR | L1367: WHELAN | O1367: MERRETT | R1367: WILLIAMS
A1368: RES | C1368: C BOYD | F1368: McGAW | L1368: LIVESEY | O1368: WRIGHT
G1371: 13TH JULY | K1371: WEATHER | O1371: RAIN
A1372: V F A | C1372: 5 | D1372: 1 | E1372: =C1372*6+D1372 -> 31 | G1372: 11 | H1372: 3 | I1372: =G1372*6+H1372 -> 69 | K1372: 15 | L1372: 5 | M1372: =K1372*6+L1372 -> 95 | O1372: 18 | P1372: 8 | Q1372: =O1372*6+P1372 -> 116 | S1372: LAUNCESTON
A1373: NTH TAS | C1373: 4 | D1373: 4 | E1373: =C1373*6+D1373 -> 28 | G1373: 8 | H1373: 7 | I1373: =G1373*6+H1373 -> 55 | K1373: 8 | L1373: 7 | M1373: =K1373*6+L1373 -> 55 | O1373: 12 | P1373: 11 | Q1373: =O1373*6+P1373 -> 83
A1374: BEST PLAYERS
A1375: V F A | C1375: JOHNSON | F1375: OUTEN | I1375: WITHERS | L1375: ROLFS | O1375: LOVE | R1375: GARRICK
A1376: TAS | C1376: SULLIVAN | F1376: LINGER | I1376: STOKES | L1376: MURPHY | O1376: MOORE | R1376: BLIGH
A1377: GOALKICKERS
A1378: V F A | C1378: JOHNSON 5 | F1378: COUGHLAN 4 | J1378: LOVE 4 | L1378: JORDAN 2 | O1378: WARD 2 | Q1378: WEIR | S1378: ROSS
A1379: TAS | C1379: LINGER 4 | F1379: McKAY 2 | I1379: STOKES | K1379: PATTERSON | N1379: BALDOCK | Q1379: MUIR | S1379: APTED | U1379: FRENCH
A1381: TEAMS
F1382: V.F.A.
A1383: BACKS | C1383: E BEITZEL | F1383: ROLFS | I1383: COUGHLAN
A1384: H-BACKS | C1384: OUTEN | F1384: KENT | I1384: IRVINE
A1385: CENTRES | C1385: COOPER | F1385: WITHERS | I1385: POWELL
A1386: H-FORWARDS | C1386: BOYD | F1386: JOHNSON | I1386: WARD
A1387: FORWARDS | C1387: ROSS | F1387: LOVE | I1387: JORDAN
A1388: RUCKS | C1388: CALLAHAN | F1388: GARRICK | I1388: WEIR
A1389: RES | C1389: WHILEY | F1389: WRIGHT | I1389: BACKMAN