A1: Victorian Football Association
A2: Season 1958
A3: © Copyright Wal Williams | F3: First created: 2 November 2014
A4: Contact: joywalwi at gmail dot com | F4: Last updated: 27 January 2018 | W4: VFA Results and tables - Link to the main index page
A5: You are free to copy this document in whole or part provided that proper acknowledgement is given to the author. All rights reserved.
A7: YEAR 1958
A8: ROUND 1 | D8: 9TH APRIL | I8: (WED NIGHT) | M8: WEATHER | X8: LADDER | AA8: ROUND | AC8: 1
C9: 1ST QTR | G9: 2ND QTR | K9: 3RD QTR | O9: FINAL | S9: PLAYED AT | W9: TEAM | X9: W | Y9: L | Z9: D | AA9: FOR | AB9: AGST | AC9: % | AD9: PTS
A10: YARRAVILLE | C10: 4 | D10: 3 | E10: =C10*6+D10 -> 27 | G10: 6 | H10: 3 | I10: =G10*6+H10 -> 39 | K10: 16 | L10: 16 | M10: =K10*6+L10 -> 112 | O10: 21 | P10: 21 | Q10: =O10*6+P10 -> 147 | S10: SOUTH MELBOURNE
A11: PRAHRAN | C11: 0 | D11: 1 | E11: =C11*6+D11 -> 1 | G11: 2 | H11: 3 | I11: =G11*6+H11 -> 15 | K11: 2 | L11: 4 | M11: =K11*6+L11 -> 16 | O11: 3 | P11: 6 | Q11: =O11*6+P11 -> 24 | S11: UMPIRE | W11: YARRAVILLE | X11: 1 | Y11: 0 | Z11: 0 | AA11: 147 | AB11: 24 | AC11: 612.5 | AD11: 4
A12: BEST PLAYERS | S12: ALLEN | W12: SANDRINGHAM | X12: 1 | Y12: 0 | Z12: 0 | AA12: 116 | AB12: 54 | AC12: 214.81481481481481 | AD12: 4
A13: YARRAVILLE | C13: WEBB | F13: DRINAN | I13: VANDERFEEN | L13: TITFORD | O13: PITT | R13: GARRICK | W13: OAKLEIGH | X13: 1 | Y13: 0 | Z13: 0 | AA13: 95 | AB13: 62 | AC13: 153.2258064516129 | AD13: 4
A14: PRAHRAN | C14: HARVEY | F14: RICKARDS | I14: HEALEY | L14: W JONES | O14: SHILLABEER | W14: WILLIAMSTOWN | X14: 1 | Y14: 0 | Z14: 0 | AA14: 81 | AB14: 54 | AC14: 150 | AD14: 4
A15: GOALKICKERS | N15: BURNSIDE | Q15: DE JONG
A16: YARRAVILLE | C16: WEBB 7 | E16: VANDERFEEN 3 | H16: TITFORD 2 | J16: BROWN 2 | M16: ANDERSON 2 | P16: PITT 2 | R16: MASON | W16: BRUNSWICK | X16: 1 | Y16: 0 | Z16: 0 | AA16: 69 | AB16: 62 | AC16: 111.29032258064517 | AD16: 4
A17: PRAHRAN | C17: HARVEY | E17: RICKARDS | H17: CHRISTIAN | W17: MOORABBIN | X17: 1 | Y17: 0 | Z17: 0 | AA17: 80 | AB17: 73 | AC17: 109.58904109589041 | AD17: 4
D18: 12TH APRIL | J18: WEATHER | O18: NORTH EAST WIND HOT | W18: PORT MELBOURNE | X18: 1 | Y18: 0 | Z18: 0 | AA18: 106 | AB18: 102 | AC18: 103.92156862745098 | AD18: 4
A19: BRUNSWICK | C19: 3 | D19: 3 | E19: =C19*6+D19 -> 21 | G19: 7 | H19: 5 | I19: =G19*6+H19 -> 47 | K19: 9 | L19: 8 | M19: =K19*6+L19 -> 62 | O19: 9 | P19: 15 | Q19: =O19*6+P19 -> 69 | S19: NORTHCOTE | W19: MORDIALLOC | X19: 1 | Y19: 0 | Z19: 0 | AA19: 82 | AB19: 81 | AC19: 101.23456790123457 | AD19: 4
A20: NORTHCOTE | C20: 4 | D20: 1 | E20: =C20*6+D20 -> 25 | G20: 6 | H20: 3 | I20: =G20*6+H20 -> 39 | K20: 8 | L20: 6 | M20: =K20*6+L20 -> 54 | O20: 9 | P20: 8 | Q20: =O20*6+P20 -> 62 | S20: ROACH | W20: CAMBERWELL | X20: 0 | Y20: 1 | Z20: 0 | AA20: 81 | AB20: 82 | AC20: 98.780487804878049 | AD20: 0
A21: BEST PLAYERS | W21: COBURG | X21: 0 | Y21: 1 | Z21: 0 | AA21: 102 | AB21: 106 | AC21: 96.226415094339629 | AD21: 0
A22: BRUNSWICK | C22: WHILEY | F22: R THOMPSON | I22: K DILLON | L22: L STANLEY | O22: McFARLANE | R22: EDWARDS | W22: BOX HILL | X22: 0 | Y22: 1 | Z22: 0 | AA22: 73 | AB22: 80 | AC22: 91.25 | AD22: 0
A23: NORTHCOTE | C23: WOOLNOUGH | F23: WRIGHT | I23: TAYLOR | L23: SMITH | O23: ROMARI | R23: BRETHERTON | W23: NORTHCOTE | X23: 0 | Y23: 1 | Z23: 0 | AA23: 62 | AB23: 69 | AC23: 89.85507246376811 | AD23: 0
A24: GOALKICKERS | W24: PRESTON | X24: 0 | Y24: 1 | Z24: 0 | AA24: 54 | AB24: 81 | AC24: 66.666666666666671 | AD24: 0
A25: BRUNSWICK | C25: G STANLEY 3 | F25: K DILLON 2 | I25: EDWARDS 2 | L25: THORNTON | O25: WHILEY | W25: DANDENONG | X25: 0 | Y25: 1 | Z25: 0 | AA25: 62 | AB25: 95 | AC25: 65.263157894736835 | AD25: 0
A26: NORTHCOTE | C26: MUIR 2 | E26: COLLINS 2 | H26: CONYBEAR 2 | K26: WRIGHT | M26: RYAN | O26: MARCHANT | W26: BRIGHTON | X26: 0 | Y26: 1 | Z26: 0 | AA26: 54 | AB26: 116 | AC26: 46.551724137931032 | AD26: 0
W27: PRAHRAN | X27: 0 | Y27: 1 | Z27: 0 | AA27: 24 | AB27: 147 | AC27: 16.33 | AD27: 0
A28: PORT MELBOURNE | C28: 4 | D28: 6 | E28: =C28*6+D28 -> 30 | G28: 6 | H28: 8 | I28: =G28*6+H28 -> 44 | K28: 11 | L28: 14 | M28: =K28*6+L28 -> 80 | O28: 15 | P28: 16 | Q28: =O28*6+P28 -> 106 | S28: COBURG
A29: COBURG | C29: 1 | D29: 2 | E29: =C29*6+D29 -> 8 | G29: 5 | H29: 12 | I29: =G29*6+H29 -> 42 | K29: 9 | L29: 20 | M29: =K29*6+L29 -> 74 | O29: 13 | P29: 24 | Q29: =O29*6+P29 -> 102 | S29: O'DONOGHUE
A30: BEST PLAYERS
A31: PORT MELBOURNE | C31: ROONEY | F31: LANE | I31: WITHERS | L31: R ATKINSON | O31: MORRIS | R31: LANDORFF
A32: COBURG | C32: JORDAN | F32: B JONES | I32: BEVIS | L32: MAHONEY | O32: HUNTINGTON | R32: SHAW
A33: GOALKICKERS
A34: PORT MELBOURNE | C34: BONNETT 6 | F34: LANE 4 | H34: BOWEN | J34: MONKS | L34: SYMONDS | N34: THOMPSON | Q34: FREYER
A35: COBURG | C35: B JONES 5 | F35: HEWES 2 | I35: SHAW 2 | K35: HUNTINGTON 2 | N35: NEESON | P35: BYRON
A37: WILLIAMSTOWN | C37: 2 | D37: 1 | E37: =C37*6+D37 -> 13 | G37: 5 | H37: 8 | I37: =G37*6+H37 -> 38 | K37: 9 | L37: 11 | M37: =K37*6+L37 -> 65 | O37: 11 | P37: 15 | Q37: =O37*6+P37 -> 81 | S37: WILLIAMSTOWN
A38: PRESTON | C38: 3 | D38: 1 | E38: =C38*6+D38 -> 19 | G38: 4 | H38: 1 | I38: =G38*6+H38 -> 25 | K38: 6 | L38: 3 | M38: =K38*6+L38 -> 39 | O38: 8 | P38: 6 | Q38: =O38*6+P38 -> 54 | S38: GODING
A39: BEST PLAYERS
A40: WILLIAMSTOWN | C40: MARTIN | F40: WARD | I40: MUNDAY | L40: OGDEN | O40: E BEITZEL | R40: F JONES
A41: PRESTON | C41: BERGIN | F41: RYMER | I41: GWILLIAM | L41: HOWARD | O41: BRIERLEY | R41: PREST
A42: GOALKICKERS
A43: WILLIAMSTOWN | C43: WARD 4 | F43: F JONES 2 | I43: CULLINAN 2 | L43: CALLAHAN | O43: O'FLYNN | Q43: PRIMMER
A44: PRESTON | C44: BERGIN 4 | F44: BRIERLEY | I44: HOWARD | K44: BRYAN | M44: RYMER
A46: OAKLEIGH | C46: 4 | D46: 4 | E46: =C46*6+D46 -> 28 | G46: 7 | H46: 7 | I46: =G46*6+H46 -> 49 | K46: 8 | L46: 11 | M46: =K46*6+L46 -> 59 | O46: 13 | P46: 17 | Q46: =O46*6+P46 -> 95 | S46: OAKLEIGH
A47: DANDENONG | C47: 1 | D47: 2 | E47: =C47*6+D47 -> 8 | G47: 4 | H47: 4 | I47: =G47*6+H47 -> 28 | K47: 6 | L47: 10 | M47: =K47*6+L47 -> 46 | O47: 8 | P47: 14 | Q47: =O47*6+P47 -> 62 | S47: T BREWER
A48: BEST PLAYERS
A49: OAKLEIGH | C49: COLLINS | F49: LEANE | I49: COUGHLAN | L49: BACKMAN | O49: PRENDERGAST | R49: McCOUBRIE
A50: DANDENONG | C50: JOHNSON | F50: WATERS | I50: TODD | L50: OWENS | O50: LITTLE | R50: MINOTTI
A51: GOALKICKERS
A52: OAKLEIGH | C52: COUGHLAN 4 | F52: McGOWAN 4 | I52: LEANE 2 | K52: LONGNEY | M52: BACKMAN | O52: GERMAINE
A53: DANDENONG | C53: OWEN 3 | F53: LITTLE 2 | I53: TODD 2 | K53: PENNEFATHER
A55: SANDRINGHAM | C55: 4 | D55: 8 | E55: =C55*6+D55 -> 32 | G55: 4 | H55: 10 | I55: =G55*6+H55 -> 34 | K55: 10 | L55: 17 | M55: =K55*6+L55 -> 77 | O55: 16 | P55: 20 | Q55: =O55*6+P55 -> 116 | S55: BEACH ROAD
A56: BRIGHTON | C56: 3 | D56: 2 | E56: =C56*6+D56 -> 20 | G56: 6 | H56: 5 | I56: =G56*6+H56 -> 41 | K56: 7 | L56: 6 | M56: =K56*6+L56 -> 48 | O56: 7 | P56: 12 | Q56: =O56*6+P56 -> 54 | S56: JENKINS/JOHNS
A57: BEST PLAYERS
A58: SANDRINGHAM | C58: SHRIVES | F58: OAKLEY | I58: JONES | L58: STEELE | O58: BOLAND | R58: PATMORE
A59: BRIGHTON | C59: CRAIG | F59: ELDERING | I59: MILNES | K59: WOOLSTENCROFT | O59: N MILLS | R59: HART
A60: GOALKICKERS
A61: SANDRINGHAM | C61: OAKLEY 7 | F61: ECCLESTON 3 | I61: RICHARDS | K61: RANSOM | M61: PATMORE | O61: CROFT | Q61: MURPHY | S61: STEELE
A62: BRIGHTON | C62: CRAIG 3 | F62: HART 2 | I62: WHITE | K62: COOPER
A64: MORDIALLOC | C64: 1 | D64: 1 | E64: =C64*6+D64 -> 7 | G64: 7 | H64: 5 | I64: =G64*6+H64 -> 47 | K64: 9 | L64: 9 | M64: =K64*6+L64 -> 63 | O64: 12 | P64: 10 | Q64: =O64*6+P64 -> 82 | S64: MORDIALLOC
A65: CAMBERWELL | C65: 1 | D65: 3 | E65: =C65*6+D65 -> 9 | G65: 5 | H65: 7 | I65: =G65*6+H65 -> 37 | K65: 8 | L65: 9 | M65: =K65*6+L65 -> 57 | O65: 11 | P65: 15 | Q65: =O65*6+P65 -> 81 | S65: GWYNNE
A66: BEST PLAYERS
A67: MORDIALLOC | C67: CRANE | F67: STANTON | I67: PEARSON | L67: JOSE | O67: BESANKO | R67: HOLYOAK
A68: CAMBERWELL | C68: ROSS | F68: COLEMAN | I68: HIGSON | L68: SKALBERG | O68: McISAAC | R68: WATTS
A69: GOALKICKERS
A70: MORDIALLOC | C70: DUFFIELD 3 | F70: PEARSON 2 | I70: BAKER 2 | K70: SHEAHAN | M70: STANTON | O70: METCALF | Q70: HOLYOAK | S70: ANDREWS
A71: CAMBERWELL | C71: HIGSON 3 | F71: COLEMAN 3 | I71: SKALBERG | K71: WHITTEN | M71: AMERY | O71: McGUINNESS | R71: WATTS
A73: MOORABBIN | C73: 3 | D73: 3 | E73: =C73*6+D73 -> 21 | G73: 6 | H73: 6 | I73: =G73*6+H73 -> 42 | K73: 10 | L73: 12 | M73: =K73*6+L73 -> 72 | O73: 11 | P73: 14 | Q73: =O73*6+P73 -> 80 | S73: BOX HILL
A74: BOX HILL | C74: 1 | D74: 1 | E74: =C74*6+D74 -> 7 | G74: 7 | H74: 4 | I74: =G74*6+H74 -> 46 | K74: 8 | L74: 5 | M74: =K74*6+L74 -> 53 | O74: 11 | P74: 7 | Q74: =O74*6+P74 -> 73 | S74: ROY
A75: BEST PLAYERS
A76: MOORABBIN | C76: MURPHY | F76: HIRST | I76: GREEN | L76: BULMER | O76: CLARK | R76: STANLEY
A77: BOX HILL | C77: LOVE | F77: WHITE | I77: WRIGHT | L77: TAYLOR | O77: CRAIG | R77: EADE
A78: GOALKICKERS
A79: MOORABBIN | C79: COLE 2 | F79: MANIE 2 | I79: HIRST 2 | L79: BULMER 2 | O79: MURPHY 2 | R79: RENWICK
A80: BOX HILL | C80: CARRICK 3 | F80: RICHARDS 2 | I80: PLUNKETT | K80: SAWATSKY | N80: ELSWORTH | Q80: PRESTON | S80: DEVERY | W80: BROWN
A82: ROUND 2 | D82: 16TH APRIL | I82: (WED NIGHT) | M82: WEATHER | S82: PLAYED AT
C83: 1ST QTR | G83: 2ND QTR | K83: 3RD QTR | O83: FINAL | S83: SOUTH MELBOURNE | X83: LADDER | AA83: ROUND | AC83: 2
A84: WILLIAMSTOWN | C84: 3 | D84: 3 | E84: =C84*6+D84 -> 21 | G84: 6 | H84: 8 | I84: =G84*6+H84 -> 44 | K84: 9 | L84: 13 | M84: =K84*6+L84 -> 67 | O84: 17 | P84: 14 | Q84: =O84*6+P84 -> 116 | S84: UMPIRE | W84: TEAM | X84: W | Y84: L | Z84: D | AA84: FOR | AB84: AGST | AC84: % | AD84: PTS
A85: BRUNSWICK | C85: 4 | D85: 3 | E85: =C85*6+D85 -> 27 | G85: 4 | H85: 7 | I85: =G85*6+H85 -> 31 | K85: 6 | L85: 9 | M85: =K85*6+L85 -> 45 | O85: 7 | P85: 13 | Q85: =O85*6+P85 -> 55 | S85: O'DONOGHUE
A86: BEST PLAYERS | W86: YARRAVILLE | X86: 2 | Y86: 0 | Z86: 0 | AA86: 253 | AB86: 115 | AC86: 220 | AD86: 8
A87: WILLIAMSTOWN | C87: MAZOURIS | F87: E BEITZEL | I87: OUTEN | L87: RAMSAY | O87: MARTIN | R87: B BEITZEL | W87: WILLIAMSTOWN | X87: 2 | Y87: 0 | Z87: 0 | AA87: 197 | AB87: 109 | AC87: 180.73394495412845 | AD87: 8
A88: BRUNSWICK | C88: WHILEY | F88: L STANLEY | I88: HAYES | L88: LINKINS | O88: K DILLON | R88: VELO | W88: PORT MELBOURNE | X88: 2 | Y88: 0 | Z88: 0 | AA88: 267 | AB88: 159 | AC88: 167.9245283018868 | AD88: 8
A89: GOALKICKERS | N89: PRIMMER | Q89: SMITH | W89: MOORABBIN | X89: 2 | Y89: 0 | Z89: 0 | AA89: 155 | AB89: 143 | AC89: 108.39160839160839 | AD89: 8
A90: WILLIAMSTOWN | C90: CULLINAN 5 | F90: R JONES 2 | I90: REED 2 | K90: WARD 2 | M90: CALLAHAN | O90: MARTIN | Q90: MAZOURIS | S90: R JONES
A91: BRUNSWICK | C91: HAYES 4 | F91: K DILLON | I91: McFARLANE | L91: G STANLEY | W91: BOX HILL | X91: 1 | Y91: 1 | Z91: 0 | AA91: 219 | AB91: 138 | AC91: 158.69565217391303 | AD91: 4
D92: 19TH APRIL | J92: WEATHER | O92: SOUTH WEST WIND FINE | W92: SANDRINGHAM | X92: 1 | Y92: 1 | Z92: 0 | AA92: 186 | AB92: 129 | AC92: 144.18604651162789 | AD92: 4
A93: MOORABBIN | C93: 2 | D93: 0 | E93: =C93*6+D93 -> 12 | G93: 6 | H93: 6 | I93: =G93*6+H93 -> 42 | K93: 7 | L93: 7 | M93: =K93*6+L93 -> 49 | O93: 10 | P93: 15 | Q93: =O93*6+P93 -> 75 | S93: MOORABBIN | W93: PRESTON | X93: 1 | Y93: 1 | Z93: 0 | AA93: 161 | AB93: 128 | AC93: 125.78125 | AD93: 4
A94: SANDRINGHAM | C94: 2 | D94: 0 | E94: =C94*6+D94 -> 12 | G94: 3 | H94: 10 | I94: =G94*6+H94 -> 28 | K94: 7 | L94: 15 | M94: =K94*6+L94 -> 57 | O94: 9 | P94: 16 | Q94: =O94*6+P94 -> 70 | S94: ALLEN | W94: OAKLEIGH | X94: 1 | Y94: 1 | Z94: 0 | AA94: 163 | AB94: 137 | AC94: 118.97810218978103 | AD94: 4
A95: BEST PLAYERS | W95: CAMBERWELL | X95: 1 | Y95: 1 | Z95: 0 | AA95: 156 | AB95: 150 | AC95: 104 | AD95: 4
A96: MOORABBIN | C96: BULMER | F96: GREEN | I96: McGAW | L96: MURPHY | O96: HOGAN | R96: GILDER | W96: MORDIALLOC | X96: 1 | Y96: 1 | Z96: 0 | AA96: 163 | AB96: 175 | AC96: 93.142857142857139 | AD96: 4
A97: SANDRINGHAM | C97: McLEAN | F97: SHRIVES | I97: GRANGER | L97: OAKLEY | O97: WEBSTER | R97: BOLAND | W97: DANDENONG | X97: 1 | Y97: 1 | Z97: 0 | AA97: 156 | AB97: 176 | AC97: 88.63636363636364 | AD97: 4
A98: GOALKICKERS | W98: BRUNSWICK | X98: 1 | Y98: 1 | Z98: 0 | AA98: 124 | AB98: 178 | AC98: 69.662921348314612 | AD98: 4
A99: MOORABBIN | C99: HOGAN 4 | F99: MURPHY | H99: McGAW | J99: HIRST | L99: COLE | N99: MANIE | P99: BULMER | W99: COBURG | X99: 0 | Y99: 2 | Z99: 0 | AA99: 193 | AB99: 212 | AC99: 91.037735849056602 | AD99: 0
A100: SANDRINGHAM | C100: OAKLEY 4 | F100: ELLIS 2 | H100: GRANGER | J100: STEELE | L100: BUTTERWORTH | W100: NORTHCOTE | X100: 0 | Y100: 2 | Z100: 0 | AA100: 109 | AB100: 176 | AC100: 61.93181818181818 | AD100: 0
W101: BRIGHTON | X101: 0 | Y101: 2 | Z101: 0 | AA101: 112 | AB101: 262 | AC101: 42.748091603053432 | AD101: 0
A102: CAMBERWELL | C102: 2 | D102: 4 | E102: =C102*6+D102 -> 16 | G102: 4 | H102: 6 | I102: =G102*6+H102 -> 30 | K102: 8 | L102: 12 | M102: =K102*6+L102 -> 60 | O102: 10 | P102: 15 | Q102: =O102*6+P102 -> 75 | S102: CAMBERWELL | W102: PRAHRAN | X102: 0 | Y102: 2 | Z102: 0 | AA102: 81 | AB102: 308 | AC102: 26.3 | AD102: 0
A103: OAKLEIGH | C103: 2 | D103: 2 | E103: =C103*6+D103 -> 14 | G103: 4 | H103: 8 | I103: =G103*6+H103 -> 32 | K103: 6 | L103: 10 | M103: =K103*6+L103 -> 46 | O103: 9 | P103: 14 | Q103: =O103*6+P103 -> 68 | S103: ROACH
A104: BEST PLAYERS
A105: CAMBERWELL | C105: ROSS | F105: B JOHNSON | I105: COLEMAN | L105: CHAMBERS | O105: BOX | R105: MASON
A106: OAKLEIGH | C106: D'ARCY | F106: COLLINS | I106: BOURKE | L106: COUGHLAN | O106: ROBINSON | R106: NICHOLSON
A107: GOALKICKERS
A108: CAMBERWELL | C108: COLEMAN 5 | F108: HIGSON 2 | I108: WHITTEN | L108: BROWN | N108: WATTS
A109: OAKLEIGH | C109: NICHOLSON 4 | F109: McCOUBRIE | I109: LONGNEY | L109: COUGHLAN | N109: WILLIAMS | Q109: O'CONNELL
A111: YARRAVILLE | C111: 4 | D111: 1 | E111: =C111*6+D111 -> 25 | G111: 7 | H111: 6 | I111: =G111*6+H111 -> 48 | K111: 11 | L111: 12 | M111: =K111*6+L111 -> 78 | O111: 15 | P111: 16 | Q111: =O111*6+P111 -> 106 | S111: YARRAVILLE
A112: COBURG | C112: 6 | D112: 1 | E112: =C112*6+D112 -> 37 | G112: 8 | H112: 5 | I112: =G112*6+H112 -> 53 | K112: 12 | L112: 9 | M112: =K112*6+L112 -> 81 | O112: 13 | P112: 13 | Q112: =O112*6+P112 -> 91 | S112: ROWE
A113: BEST PLAYERS
A114: YARRAVILLE | C114: CAREY | F114: BOURKE | I114: VANDERFEEN | L114: BROWN | O114: WORNER | R114: GARRICK
A115: COBURG | C115: BIGELOW | F115: JORDAN | I115: DANGUAARD | L115: SHAW | O115: RUTLEDGE | R115: HEWES
A116: GOALKICKERS
A117: YARRAVILLE | C117: VANDERFEEN 4 | F117: GLEESON 3 | I117: BOURKE 2 | L117: WEBB 2 | N117: BROWN 2 | Q117: LETCHER | S117: MASON
A118: COBURG | C118: HEWES 6 | F118: SHAW 2 | I118: HORSKINS | K118: JORDAN | M118: GOULLET | O118: J BRENNAN | R118: HUNTINGTON
A120: PRESTON | C120: 7 | D120: 7 | E120: =C120*6+D120 -> 49 | G120: 9 | H120: 8 | I120: =G120*6+H120 -> 62 | K120: 14 | L120: 8 | M120: =K120*6+L120 -> 92 | O120: 16 | P120: 11 | Q120: =O120*6+P120 -> 107 | S120: PRESTON
A121: NORTHCOTE | C121: 0 | D121: 1 | E121: =C121*6+D121 -> 1 | G121: 4 | H121: 8 | I121: =G121*6+H121 -> 32 | K121: 6 | L121: 9 | M121: =K121*6+L121 -> 45 | O121: 6 | P121: 11 | Q121: =O121*6+P121 -> 47 | S121: BREWER
A122: BEST PLAYERS
A123: PRESTON | C123: BRIERLEY | F123: RYMER | I123: BERGIN | K123: CUSACK | N123: PREST | Q123: HOWARD
A124: NORTHCOTE | C124: GERVASONI | F124: BRETHERTON | I124: BARNES | K124: VAINS | N124: HUSSEY | Q124: SMITH
A125: GOALKICKERS
A126: PRESTON | C126: RYMER 6 | F126: BRIERLEY 6 | I126: DAWSON | K126: BRYAN | M126: BROWN | O126: BERGIN
A127: NORTHCOTE | C127: ROMARI 2 | F127: CONNYBEAR | I127: COLLINS | K127: KENNY | M127: GERVASONI
A129: DANDENONG | C129: 2 | D129: 3 | E129: =C129*6+D129 -> 15 | G129: 7 | H129: 7 | I129: =G129*6+H129 -> 49 | K129: 10 | L129: 14 | M129: =K129*6+L129 -> 74 | O129: 13 | P129: 16 | Q129: =O129*6+P129 -> 94 | S129: DANDENONG
A130: MORDIALLOC | C130: 4 | D130: 1 | E130: =C130*6+D130 -> 25 | G130: 8 | H130: 2 | I130: =G130*6+H130 -> 50 | K130: 11 | L130: 6 | M130: =K130*6+L130 -> 72 | O130: 12 | P130: 9 | Q130: =O130*6+P130 -> 81 | S130: GODING
A131: BEST PLAYERS
A132: DANDENONG | C132: TODD | F132: FRENCH | I132: DALE | L132: GOOD | N132: MINOTTI | Q132: NISH
A133: MORDIALLOC | C133: BARCLAY | F133: JOSE | I133: ANDREW | L133: CRANE | N133: METCALF | Q133: WORCESTER
A134: GOALKICKERS
A135: DANDENONG | C135: DALE 4 | F135: PETERS 3 | I135: MINOTTI | K135: TODD | M135: PENNEFATHER | P135: GOOD | R135: LITTLE | T135: PHILLIPS
A136: MORDIALLOC | C136: ANDREW 4 | F136: JOSE 3 | I136: WORCESTER 2 | L136: BAKER | N136: METCALF | Q136: PEARSON
A138: BOX HILL | C138: 4 | D138: 0 | E138: =C138*6+D138 -> 24 | G138: 10 | H138: 3 | I138: =G138*6+H138 -> 63 | K138: 15 | L138: 8 | M138: =K138*6+L138 -> 98 | O138: 22 | P138: 14 | Q138: =O138*6+P138 -> 146 | S138: ELSTERNWICK PARK
A139: BRIGHTON | C139: 2 | D139: 1 | E139: =C139*6+D139 -> 13 | G139: 5 | H139: 2 | I139: =G139*6+H139 -> 32 | K139: 5 | L139: 3 | M139: =K139*6+L139 -> 33 | O139: 9 | P139: 4 | Q139: =O139*6+P139 -> 58 | S139: GWYNNE
A140: BEST PLAYERS
A141: BOX HILL | C141: DEVERY | F141: BROWN | I141: PRESTON | L141: EADE | O141: JOHNSON | R141: GOOCH
A142: BRIGHTON | C142: ELDRIDGE | F142: HART | I142: MILNES | L142: BURSEY | O142: LUNDGREN | R142: MILLS
A143: GOALKICKERS
A144: BOX HILL | C144: DEVERY 6 | E144: BROWN 5 | G144: PRESTON 4 | J144: CARRICK 2 | M144: JOHNSON | O144: SAWATSKY | R144: GRAYSON | T144: EADE | W144: LOVE
A145: BRIGHTON | C145: HART 5 | F145: J WHITE | I145: BURSEY | K145: WOOLSTENCROFT | O145: NEW
A147: PORT MELBOURNE | C147: 4 | D147: 4 | E147: =C147*6+D147 -> 28 | G147: 10 | H147: 9 | I147: =G147*6+H147 -> 69 | K147: 16 | L147: 14 | M147: =K147*6+L147 -> 110 | O147: 24 | P147: 17 | Q147: =O147*6+P147 -> 161 | S147: PORT MELBOURNE
A148: PRAHRAN | C148: 5 | D148: 2 | E148: =C148*6+D148 -> 32 | G148: 7 | H148: 2 | I148: =G148*6+H148 -> 44 | K148: 8 | L148: 4 | M148: =K148*6+L148 -> 52 | O148: 8 | P148: 9 | Q148: =O148*6+P148 -> 57 | S148: MARCY
A149: BEST PLAYERS
A150: PORT MELBOURNE | C150: WITHERS | F150: MONKS | I150: BONNETT | L150: SYMONDS | O150: LANE | R150: E ATKINSON
A151: PRAHRAN | C151: O'BRYAN | F151: HEAD | I151: HARVEY | L151: ROY JONES | O151: BOYD | R151: HOOPER
A152: GOALKICKERS
A153: PORT MELBOURNE | C153: BONNETT 8 | F153: SYKES 4 | I153: LANE 4 | K153: FREYER 3 | M153: LAWSON 2 | P153: SYMONDS 2 | S153: BOWEN
A154: PRAHRAN | C154: RICHARDS 3 | F154: HORSFIELD 2 | I154: BOYD 2 | K154: WHARTON
A156: ROUND 3 | D156: 23RD APRIL | I156: (WED NIGHT) | M156: WEATHER | S156: PLAYED AT
C157: 1ST QTR | G157: 2ND QTR | K157: 3RD QTR | O157: FINAL | S157: SOUTH MELBOURNE | X157: LADDER | AA157: ROUND | AC157: 3
A158: PORT MELBOURNE | C158: 4 | D158: 4 | E158: =C158*6+D158 -> 28 | G158: 5 | H158: 6 | I158: =G158*6+H158 -> 36 | K158: 9 | L158: 6 | M158: =K158*6+L158 -> 60 | O158: 10 | P158: 7 | Q158: =O158*6+P158 -> 67 | S158: UMPIRE | W158: TEAM | X158: W | Y158: L | Z158: D | AA158: FOR | AB158: AGST | AC158: % | AD158: PTS
A159: PRESTON | C159: 0 | D159: 2 | E159: =C159*6+D159 -> 2 | G159: 2 | H159: 4 | I159: =G159*6+H159 -> 16 | K159: 4 | L159: 5 | M159: =K159*6+L159 -> 29 | O159: 8 | P159: 7 | Q159: =O159*6+P159 -> 55 | S159: GODING
A160: BEST PLAYERS | W160: WILLIAMSTOWN | X160: 3 | Y160: 0 | Z160: 0 | AA160: 315 | AB160: 196 | AC160: 160.71428571428572 | AD160: 12
A161: PORT MELBOURNE | C161: SYKES | F161: E ATKINSON | I161: R ATKINSON | L161: WITHERS | O161: METHERALL | R161: ROONEY | W161: PORT MELBOURNE | X161: 3 | Y161: 0 | Z161: 0 | AA161: 334 | AB161: 214 | AC161: 156.07476635514018 | AD161: 12
A162: PRESTON | C162: FOOTE | F162: GWILLIAM | I162: BRIERLEY | L162: POTTER | O162: DAWSON | R162: RYMER | W162: MOORABBIN | X162: 3 | Y162: 0 | Z162: 0 | AA162: 273 | AB162: 192 | AC162: 142.1875 | AD162: 12
A163: GOALKICKERS | W163: YARRAVILLE | X163: 2 | Y163: 1 | Z163: 0 | AA163: 340 | AB163: 233 | AC163: 145.92 | AD163: 8
A164: PORT MELBOURNE | C164: SYKES 3 | F164: FREYER 2 | I164: LANE 2 | K164: WITHERS | M164: BONNETT | O164: LEWIS
A165: PRESTON | C165: RYMER 3 | F165: BRIERLEY 2 | I165: BERGIN | K165: PREST | M165: McLACHALN | W165: OAKLEIGH | X165: 2 | Y165: 1 | Z165: 0 | AA165: 268 | AB165: 185 | AC165: 144.86486486486487 | AD165: 8
D166: 26TH APRIL | L166: WEATHER | O166: FINE & SUNNY | W166: CAMBERWELL | X166: 2 | Y166: 1 | Z166: 0 | AA166: 223 | AB166: 211 | AC166: 105.68720379146919 | AD166: 8
A167: WILLIAMSTOWN | C167: 5 | D167: 3 | E167: =C167*6+D167 -> 33 | G167: 11 | H167: 7 | I167: =G167*6+H167 -> 73 | K167: 13 | L167: 11 | M167: =K167*6+L167 -> 89 | O167: 17 | P167: 16 | Q167: =O167*6+P167 -> 118 | S167: YARRAVILLE | W167: MORDIALLOC | X167: 2 | Y167: 1 | Z167: 0 | AA167: 222 | AB167: 227 | AC167: 97.797356828193827 | AD167: 8
A168: YARRAVILLE | C168: 6 | D168: 5 | E168: =C168*6+D168 -> 41 | G168: 8 | H168: 7 | I168: =G168*6+H168 -> 55 | K168: 11 | L168: 14 | M168: =K168*6+L168 -> 80 | O168: 12 | P168: 15 | Q168: =O168*6+P168 -> 87 | S168: ROACH | W168: BOX HILL | X168: 1 | Y168: 2 | Z168: 0 | AA168: 280 | AB168: 205 | AC168: 136.58536585365854 | AD168: 4
A169: BEST PLAYERS | W169: SANDRINGHAM | X169: 1 | Y169: 2 | Z169: 0 | AA169: 238 | AB169: 188 | AC169: 126.59574468085107 | AD169: 4
A170: WILLIAMSTOWN | C170: MUNDAY | F170: E BEITZEL | I170: MARTIN | L170: REED | O170: OGDEN | R170: CULLINAN | W170: PRESTON | X170: 1 | Y170: 2 | Z170: 0 | AA170: 216 | AB170: 195 | AC170: 110.76923076923077 | AD170: 4
A171: YARRAVILLE | C171: CAREY | F171: GLEESON | I171: ARCHBOLD | L171: LETCHER | O171: VANDERFEEN | R171: MAGEE | W171: COBURG | X171: 1 | Y171: 2 | Z171: 0 | AA171: 264 | AB171: 263 | AC171: 100.38022813688212 | AD171: 4
A172: GOALKICKERS | W172: BRUNSWICK | X172: 1 | Y172: 2 | Z172: 0 | AA172: 175 | AB172: 249 | AC172: 70.281124497991968 | AD172: 4
A173: WILLIAMSTOWN | C173: CULLINAN 6 | F173: WARD 3 | I173: REED 3 | K173: F JONES 2 | M173: SMITH | O173: OUTEN | Q173: MARTIN | W173: DANDENONG | X173: 1 | Y173: 2 | Z173: 0 | AA173: 205 | AB173: 294 | AC173: 69.72789115646259 | AD173: 4
A174: YARRAVILLE | C174: GLEESON 4 | F174: VANDERFEEN 2 | J174: R BROWN 2 | M174: BOURKE | O174: CROOK | Q174: CAREY | S174: MAGEE | W174: PRAHRAN | X174: 1 | Y174: 2 | Z174: 0 | AA174: 204 | AB174: 370 | AC174: 55.13 | AD174: 4
W175: NORTHCOTE | X175: 0 | Y175: 3 | Z175: 0 | AA175: 171 | AB175: 299 | AC175: 57.190635451505017 | AD175: 0
A176: CAMBERWELL | C176: 2 | D176: 3 | E176: =C176*6+D176 -> 15 | G176: 6 | H176: 8 | I176: =G176*6+H176 -> 44 | K176: 8 | L176: 9 | M176: =K176*6+L176 -> 57 | O176: 9 | P176: 13 | Q176: =O176*6+P176 -> 67 | S176: CAMBERWELL | W176: BRIGHTON | X176: 0 | Y176: 3 | Z176: 0 | AA176: 160 | AB176: 367 | AC176: 43.596730245231605 | AD176: 0
A177: BOX HILL | C177: 1 | D177: 7 | E177: =C177*6+D177 -> 13 | G177: 4 | H177: 8 | I177: =G177*6+H177 -> 32 | K177: 5 | L177: 15 | M177: =K177*6+L177 -> 45 | O177: 7 | P177: 19 | Q177: =O177*6+P177 -> 61 | S177: ALLEN
A178: BEST PLAYERS
A179: CAMBERWELL | C179: MASON | F179: ROSS | I179: McGUINNESS | M179: SEYMOUR | P179: B JOHNSON | S179: AMERY
A180: BOX HILL | C180: LOVE | F180: WRIGHT | I180: GOOCH | M180: EADE | P180: SAWATSKY | S180: WHITE
A181: GOALKICKERS
A182: CAMBERWELL | C182: McGUINNESS 3 | F182: SEYMOUR 3 | I182: M YOUNG | L182: BROWN | N182: RICE
A183: BOX HILL | C183: SAWATSKY 2 | F183: BROWN | H183: WHITE | J183: LOVE | L183: DEVERY | N183: SALVADO
A185: MORDIALLOC | C185: 2 | D185: 1 | E185: =C185*6+D185 -> 13 | G185: 5 | H185: 3 | I185: =G185*6+H185 -> 33 | K185: 6 | L185: 7 | M185: =K185*6+L185 -> 43 | O185: 8 | P185: 11 | Q185: =O185*6+P185 -> 59 | S185: MORDIALLOC
A186: SANDRINGHAM | C186: 2 | D186: 2 | E186: =C186*6+D186 -> 14 | G186: 2 | H186: 6 | I186: =G186*6+H186 -> 18 | K186: 3 | L186: 9 | M186: =K186*6+L186 -> 27 | O186: 6 | P186: 16 | Q186: =O186*6+P186 -> 52 | S186: GWYNNE
A187: BEST PLAYERS
A188: MORDIALLOC | C188: BESANKO | F188: CRAIG | I188: MAUNDER | L188: JOSE | O188: CRAWFORD | R188: ANDREW
A189: SANDRINGHAM | C189: RANSOM | F189: RICHARDS | I189: ELLIS | L189: ROBINSON | O189: McLEAN | R189: PATMORE
A190: GOALKICKERS
A191: MORDIALLOC | C191: JOSE 3 | F191: CRAWFORD 3 | I191: PEARSON | K191: METCALF
A192: SANDRINGHAM | C192: RANSOM 3 | F192: ELLIS 2 | I192: PATMORE
A194: MOORABBIN | C194: 6 | D194: 3 | E194: =C194*6+D194 -> 39 | G194: 10 | H194: 13 | I194: =G194*6+H194 -> 73 | K194: 10 | L194: 16 | M194: =K194*6+L194 -> 76 | O194: 16 | P194: 22 | Q194: =O194*6+P194 -> 118 | S194: DANDENONG
A195: DANDENONG | C195: 2 | D195: 1 | E195: =C195*6+D195 -> 13 | G195: 4 | H195: 4 | I195: =G195*6+H195 -> 28 | K195: 7 | L195: 6 | M195: =K195*6+L195 -> 48 | O195: 7 | P195: 7 | Q195: =O195*6+P195 -> 49 | S195: ROWE
A196: BEST PLAYERS
A197: MOORABBIN | C197: MORONEY | F197: GILDER | I197: STANLEY | L197: RENWICK | O197: BULMER | R197: COLE
A198: DANDENONG | C198: GILLINGHAM | F198: LITTLE | I198: PENNEFATHER | L198: NISH | O198: WATERS | R198: JOHNSON
A199: GOALKICKERS
A200: MOORABBIN | C200: RENWICK 7 | F200: HIRST 2 | I200: HOGAN 2 | K200: MORONEY | M200: MENNIE | O200: COLE | Q200: MANIE | S200: McGAW
A201: DANDENONG | C201: DALE 2 | F201: PETERS 2 | I201: MINOTTI | K201: TODD | M201: GOOD
A203: COBURG | C203: 6 | D203: 2 | E203: =C203*6+D203 -> 38 | G203: 8 | H203: 3 | I203: =G203*6+H203 -> 51 | K203: 8 | L203: 4 | M203: =K203*6+L203 -> 52 | O203: 11 | P203: 5 | Q203: =O203*6+P203 -> 71 | S203: COBURG
A204: BRUNSWICK | C204: 1 | D204: 2 | E204: =C204*6+D204 -> 8 | G204: 3 | H204: 6 | I204: =G204*6+H204 -> 24 | K204: 4 | L204: 20 | M204: =K204*6+L204 -> 44 | O204: 4 | P204: 27 | Q204: =O204*6+P204 -> 51 | S204: MARCY
A205: BEST PLAYERS
A206: COBURG | C206: WILSON | F206: BIGELOW | I206: HORSKINS | L206: B JONES | O206: HEWES | R206: J BRENNAN
A207: BRUNSWICK | C207: WHILEY | F207: EDWARDS | I207: PHIPPS | L207: LINKINS | O207: JARMAN | R207: G STANLEY
A208: GOALKICKERS
A209: COBURG | C209: B JONES 4 | F209: NEESON 3 | I209: KAYLL | K209: J BRENNAN | N209: HOOGEN | P209: WILSON
A210: BRUNSWICK | C210: K DILLON 2 | F210: JARMAN | I210: THORNTON
A212: PRAHRAN | C212: 3 | D212: 7 | E212: =C212*6+D212 -> 25 | G212: 5 | H212: 9 | I212: =G212*6+H212 -> 39 | K212: 12 | L212: 13 | M212: =K212*6+L212 -> 85 | O212: 18 | P212: 15 | Q212: =O212*6+P212 -> 123 | S212: TOORAK PARK
A213: NORTHCOTE | C213: 1 | D213: 1 | E213: =C213*6+D213 -> 7 | G213: 2 | H213: 5 | I213: =G213*6+H213 -> 17 | K213: 5 | L213: 6 | M213: =K213*6+L213 -> 36 | O213: 9 | P213: 8 | Q213: =O213*6+P213 -> 62 | S213: VINCENT
A214: BEST PLAYERS
A215: PRAHRAN | C215: HARVEY | F215: CHRISTIAN | I215: ROSS JONES | L215: BOYD | O215: KINNABURGH | S215: HEAD
A216: NORTHCOTE | C216: GERVASONI | F216: WOOLNOUGH | I216: BRETHERTON | L216: HUSSEY | O216: ROMARI | S216: TAYLOR
A217: GOALKICKERS
A218: PRAHRAN | C218: WHARTON 5 | F218: HARVEY 3 | I218: KINNABURGH 2 | L218: SHALLVEY 2 | O218: RICKARDS 2 | R218: HORSFIELD | T218: BOYD | W218: O'BRYAN | X218: BELFORD
A219: NORTHCOTE | C219: KENNY 3 | F219: PEARCE 2 | I219: GERVASONI | L219: WIGNELL | O219: WOOLNOUGH | R219: ROMARI
A221: OAKLEIGH | C221: 4 | D221: 4 | E221: =C221*6+D221 -> 28 | G221: 8 | H221: 8 | I221: =G221*6+H221 -> 56 | K221: 13 | L221: 9 | M221: =K221*6+L221 -> 87 | O221: 15 | P221: 15 | Q221: =O221*6+P221 -> 105 | S221: OAKLEIGH
A222: BRIGHTON | C222: 2 | D222: 1 | E222: =C222*6+D222 -> 13 | G222: 3 | H222: 3 | I222: =G222*6+H222 -> 21 | K222: 5 | L222: 5 | M222: =K222*6+L222 -> 35 | O222: 7 | P222: 6 | Q222: =O222*6+P222 -> 48 | S222: O'DONOGHUE
A223: BEST PLAYERS
A224: OAKLEIGH | C224: DONOHUE | F224: BACKMAN | I224: NICHOLSON | L224: COLLINS | O224: B J WILLIAMS | S224: D'ARCY
A225: BRIGHTON | C225: WOOLSTENCROFT | G225: WHITE | I225: BURSEY | L225: HUNTER | O225: COLLINS | S225: MILNES
A226: GOALKICKERS
A227: OAKLEIGH | C227: B J WILLIAMS 3 | F227: NICHOLSON 2 | I227: LEHNE 2 | K227: BOURKE 2 | M227: LANE | N227: GERMAINE | Q227: LONGNEY | S227: PALMER | W227: COUGHLAN
A228: BRIGHTON | C228: DAVIS 2 | F228: BROWNING | I228: COLLINS | K228: MAY | M228: HART | O228: WHITE
A230: ROUND 4 | D230: 30TH APRIL | H230: (WED NIGHT) | L230: WEATHER | S230: PLAYED AT
C231: 1ST QTR | G231: 2ND QTR | K231: 3RD QTR | O231: FINAL | S231: SOUTH MELBOURNE | X231: LADDER | AA231: ROUND | AC231: 4
A232: PORT MELBOURNE | C232: 3 | D232: 4 | E232: =C232*6+D232 -> 22 | G232: 6 | H232: 9 | I232: =G232*6+H232 -> 45 | K232: 13 | L232: 9 | M232: =K232*6+L232 -> 87 | O232: 15 | P232: 12 | Q232: =O232*6+P232 -> 102 | S232: UMPIRE | W232: TEAM | X232: W | Y232: L | Z232: D | AA232: FOR | AB232: AGST | AC232: % | AD232: PTS
A233: WILLIAMSTOWN | C233: 5 | D233: 4 | E233: =C233*6+D233 -> 34 | G233: 8 | H233: 6 | I233: =G233*6+H233 -> 54 | K233: 10 | L233: 14 | M233: =K233*6+L233 -> 74 | O233: 13 | P233: 15 | Q233: =O233*6+P233 -> 93 | S233: ROACH
A234: BEST PLAYERS | W234: PORT MELBOURNE | X234: 4 | Y234: 0 | Z234: 0 | AA234: 436 | AB234: 307 | AC234: 142.01954397394138 | AD234: 16
A235: PORT MELBOURNE | C235: WHITE | F235: BONNETT | I235: R ATKINSON | L235: E ATKINSON | O235: LANDORFF | R235: WITHERS | W235: MOORABBIN | X235: 4 | Y235: 0 | Z235: 0 | AA235: 321 | AB235: 236 | AC235: 136.01694915254237 | AD235: 16
A236: WILLIAMSTOWN | C236: E BEITZEL | F236: SMITH | I236: REED | L236: MAZOURIS | O236: RAMSAY | R236: KENT | W236: YARRAVILLE | X236: 3 | Y236: 1 | Z236: 0 | AA236: 424 | AB236: 280 | AC236: 151.43 | AD236: 12
A237: GOALKICKERS | W237: WILLIAMSTOWN | X237: 3 | Y237: 1 | Z237: 0 | AA237: 408 | AB237: 298 | AC237: 136.91275167785236 | AD237: 12
A238: PORT MELBOURNE | C238: BONNETT 6 | F238: MONKS 3 | I238: SYKES 2 | K238: SYMONDS | M238: FREYER | O238: CAMERON | Q238: ROONEY
A239: WILLIAMSTOWN | C239: MAZOURIS 3 | F239: WARD 3 | H239: CULLINAN 2 | K239: SMITH 2 | M239: CALLAHAN | P239: PRIMMER | R239: REED | W239: CAMBERWELL | X239: 3 | Y239: 1 | Z239: 0 | AA239: 273 | AB239: 257 | AC239: 106.22568093385215 | AD239: 12
D240: 3RD MAY | J240: WEATHER | O240: STRONG NORTH WEST WIND | W240: MORDIALLOC | X240: 3 | Y240: 1 | Z240: 0 | AA240: 284 | AB240: 277 | AC240: 102.52707581227436 | AD240: 12
A241: MOORABBIN | C241: 0 | D241: 8 | E241: =C241*6+D241 -> 8 | G241: 1 | H241: 9 | I241: =G241*6+H241 -> 15 | K241: 3 | L241: 14 | M241: =K241*6+L241 -> 32 | O241: 5 | P241: 18 | Q241: =O241*6+P241 -> 48 | S241: MOORABBIN | W241: BOX HILL | X241: 2 | Y241: 2 | Z241: 0 | AA241: 400 | AB241: 216 | AC241: 185.18518518518519 | AD241: 8
A242: OAKLEIGH | C242: 1 | D242: 2 | E242: =C242*6+D242 -> 8 | G242: 4 | H242: 5 | I242: =G242*6+H242 -> 29 | K242: 6 | L242: 7 | M242: =K242*6+L242 -> 43 | O242: 6 | P242: 8 | Q242: =O242*6+P242 -> 44 | S242: VINCENT | W242: OAKLEIGH | X242: 2 | Y242: 2 | Z242: 0 | AA242: 312 | AB242: 233 | AC242: 133.90557939914163 | AD242: 8
A243: BEST PLAYERS | W243: COBURG | X243: 2 | Y243: 2 | Z243: 0 | AA243: 346 | AB243: 329 | AC243: 105.16717325227964 | AD243: 8
A244: MOORABBIN | C244: COLE | E244: HIRST | H244: MURPHY | K244: GILDER | N244: BULMER | Q244: STANLEY | W244: BRUNSWICK | X244: 2 | Y244: 2 | Z244: 0 | AA244: 244 | AB244: 287 | AC244: 85.017421602787451 | AD244: 8
A245: OAKLEIGH | C245: D'ARCY | E245: COLLINS | H245: NICHOLSON | K245: DONOHUE | N245: LONGNEY | Q245: COUGHLAN | W245: SANDRINGHAM | X245: 1 | Y245: 3 | Z245: 0 | AA245: 284 | AB245: 238 | AC245: 119.32773109243698 | AD245: 4
A246: GOALKICKERS | W246: PRESTON | X246: 1 | Y246: 3 | Z246: 0 | AA246: 282 | AB246: 277 | AC246: 101.80505415162455 | AD246: 4
A247: MOORABBIN | C247: COLE | E247: McGAW | G247: RENWICK | I247: RYAN | K247: HIRST | W247: PRAHRAN | X247: 1 | Y247: 3 | Z247: 0 | AA247: 242 | AB247: 439 | AC247: 55.13 | AD247: 4
A248: OAKLEIGH | C248: O'CONNELL 2 | F248: BOURKE | H248: NICHOLSON | K248: LONGNEY | M248: WINTER | W248: DANDENONG | X248: 1 | Y248: 3 | Z248: 0 | AA248: 216 | AB248: 414 | AC248: 52.173913043478258 | AD248: 4
W249: NORTHCOTE | X249: 0 | Y249: 4 | Z249: 0 | AA249: 218 | AB249: 383 | AC249: 56.919060052219322 | AD249: 0
A250: CAMBERWELL | C250: 4 | D250: 9 | E250: =C250*6+D250 -> 33 | G250: 4 | H250: 9 | I250: =G250*6+H250 -> 33 | K250: 6 | L250: 14 | M250: =K250*6+L250 -> 50 | O250: 6 | P250: 14 | Q250: =O250*6+P250 -> 50 | S250: BEACH ROAD | W250: BRIGHTON | X250: 0 | Y250: 4 | Z250: 0 | AA250: 210 | AB250: 429 | AC250: 48.951048951048953 | AD250: 0
A251: SANDRINGHAM | C251: 0 | D251: 1 | E251: =C251*6+D251 -> 1 | G251: 1 | H251: 4 | I251: =G251*6+H251 -> 10 | K251: 2 | L251: 5 | M251: =K251*6+L251 -> 17 | O251: 6 | P251: 10 | Q251: =O251*6+P251 -> 46 | S251: GODING
A252: BEST PLAYERS
A253: CAMBERWELL | C253: ROSS | F253: CHAMBERS | I253: B JOHNSON | L253: RICE | O253: BOX | Q253: COLEMAN
A254: SANDRINGHAM | C254: EVANS | F254: PATMORE | I254: ELLIS | L254: CLARKE | O254: JONES | Q254: McLEAN
A255: GOALKICKERS
A256: CAMBERWELL | C256: HIGSON 2 | F256: RICE 2 | I256: ROSS | K256: McGUINNESS
A257: SANDRINGHAM | C257: OAKLEY 4 | F257: PATMORE | I257: SHRIVES
A259: COBURG | C259: 4 | D259: 9 | E259: =C259*6+D259 -> 33 | G259: 4 | H259: 10 | I259: =G259*6+H259 -> 34 | K259: 9 | L259: 15 | M259: =K259*6+L259 -> 69 | O259: 11 | P259: 16 | Q259: =O259*6+P259 -> 82 | S259: PRESTON
A260: PRESTON | C260: 1 | D260: 0 | E260: =C260*6+D260 -> 6 | G260: 6 | H260: 5 | I260: =G260*6+H260 -> 41 | K260: 7 | L260: 8 | M260: =K260*6+L260 -> 50 | O260: 9 | P260: 12 | Q260: =O260*6+P260 -> 66 | S260: O'DONOGHUE
A261: BEST PLAYERS
A262: COBURG | C262: BIGELOW | F262: B JONES | I262: HOOGEN | L262: BYRON | O262: HEWES | R262: SHAW
A263: PRESTON | C263: BERGIN | F263: FOOTE | I263: McLACHLAN | L263: BRIERLEY | O263: GWILLIAM | R263: HOWARD
A264: GOALKICKERS
A265: COBURG | C265: HEWES 3 | F265: B JONES 2 | I265: KAYLL | K265: HUNTINGTON | N265: HOOGEN | P265: JORDAN | R265: NEESON | T265: BYRON
A266: PRESTON | C266: BRIERLEY 3 | F266: CUSACK 2 | I266: DAWSON | K266: FOOTE | M266: GWILLIAM | P266: BERGIN
A268: BRUNSWICK | C268: 2 | D268: 5 | E268: =C268*6+D268 -> 17 | G268: 4 | H268: 7 | I268: =G268*6+H268 -> 31 | K268: 6 | L268: 15 | M268: =K268*6+L268 -> 51 | O268: 9 | P268: 15 | Q268: =O268*6+P268 -> 69 | S268: BRUNSWICK
A269: PRAHRAN | C269: 0 | D269: 2 | E269: =C269*6+D269 -> 2 | G269: 2 | H269: 5 | I269: =G269*6+H269 -> 17 | K269: 2 | L269: 5 | M269: =K269*6+L269 -> 17 | O269: 5 | P269: 8 | Q269: =O269*6+P269 -> 38 | S269: ALLEN
A270: BEST PLAYERS
A271: BRUNSWICK | C271: WHILEY | F271: N THOMPSON | I271: HAYES | L271: K DILLON | O271: STANLEY | R271: JARMAN
A272: PRAHRAN | C272: CHRISTIAN | F272: HEAD | I272: RICKARDS | L272: WATKINS | O272: HARVEY | R272: O'BRYAN
A273: GOALKICKERS
A274: BRUNSWICK | C274: HAYES 4 | F274: JARMAN 3 | I274: G STANLEY | L274: THORNTON
A275: PRAHRAN | C275: CHRISTIAN | F275: O'BRYAN | H275: WATKINS | J275: HARVEY | L275: HEALEY
A277: BOX HILL | C277: 2 | D277: 2 | E277: =C277*6+D277 -> 14 | G277: 8 | H277: 10 | I277: =G277*6+H277 -> 58 | K277: 10 | L277: 12 | M277: =K277*6+L277 -> 72 | O277: 17 | P277: 18 | Q277: =O277*6+P277 -> 120 | S277: BOX HILL
A278: DANDENONG | C278: 0 | D278: 3 | E278: =C278*6+D278 -> 3 | G278: 0 | H278: 3 | I278: =G278*6+H278 -> 3 | K278: 1 | L278: 5 | M278: =K278*6+L278 -> 11 | O278: 1 | P278: 5 | Q278: =O278*6+P278 -> 11 | S278: MARCY
A279: BEST PLAYERS
A280: BOX HILL | C280: DEVERY | F280: SAWATSKY | I280: WHITE | L280: BROWN | N280: LOVE | Q280: WRIGHT
A281: DANDENONG | C281: TODD | F281: GILLINGHAM | I281: PENNEFATHER | L281: MINOTTI | N281: GUILLE | Q281: FRENCH
A282: GOALKICKERS
A283: BOX HILL | C283: SALVADO 5 | F283: BROWN 3 | I283: RICHARDS 2 | L283: LOVE 2 | N283: CRAIG | P283: DEVERY | R283: SAWATSKY | T283: PRESTON | X283: BRAIN
A284: DANDENONG | C284: OWEN
A286: MORDIALLOC | C286: 0 | D286: 3 | E286: =C286*6+D286 -> 3 | G286: 3 | H286: 9 | I286: =G286*6+H286 -> 27 | K286: 4 | L286: 10 | M286: =K286*6+L286 -> 34 | O286: 8 | P286: 14 | Q286: =O286*6+P286 -> 62 | S286: ELSTERNWICK PARK
A287: BRIGHTON | C287: 2 | D287: 9 | E287: =C287*6+D287 -> 21 | G287: 3 | H287: 9 | I287: =G287*6+H287 -> 27 | K287: 6 | L287: 12 | M287: =K287*6+L287 -> 48 | O287: 6 | P287: 14 | Q287: =O287*6+P287 -> 50 | S287: ROWE
A288: BEST PLAYERS
A289: MORDIALLOC | C289: PEARSON | F289: LASKEY | I289: METCALF | L289: SHEEHAN | O289: MORGAN | R289: BARCLAY
A290: BRIGHTON | C290: COOPER | F290: HART | I290: DAVIS | L290: HEIMRICH | O290: ASHENHURST | R290: MILNES
A291: GOALKICKERS
A292: MORDIALLOC | C292: PEARSON 3 | F292: WILKINSON 2 | I292: SHIELDS 2 | L292: LASKEY
A293: BRIGHTON | C293: HART 2 | E293: WHITE | G293: HEIMRICH | J293: DAVIS | L293: CRAIG
A295: YARRAVILLE | C295: 4 | D295: 3 | E295: =C295*6+D295 -> 27 | G295: 8 | H295: 10 | I295: =G295*6+H295 -> 58 | K295: 8 | L295: 14 | M295: =K295*6+L295 -> 62 | O295: 11 | P295: 18 | Q295: =O295*6+P295 -> 84 | S295: NORTHCOTE
A296: NORTHCOTE | C296: 1 | D296: 2 | E296: =C296*6+D296 -> 8 | G296: 1 | H296: 2 | I296: =G296*6+H296 -> 8 | K296: 5 | L296: 5 | M296: =K296*6+L296 -> 35 | O296: 7 | P296: 5 | Q296: =O296*6+P296 -> 47 | S296: QUINN
A297: BEST PLAYERS
A298: YARRAVILLE | C298: CROOK | F298: MASON | I298: WEBB | L298: BOURKE | O298: LAMONT | R298: ARCHBOLD
A299: NORTHCOTE | C299: SMITH | F299: RYAN | I299: MARCHANT | L299: VAINS | O299: PHILLIPS | R299: HUSSEY
A300: GOALKICKERS
A301: YARRAVILLE | C301: GLEESON 4 | F301: WEBB 3 | H301: CROOK 2 | J301: VANDERFEEN | M301: CAREY
A302: NORTHCOTE | C302: RYAN 3 | F302: GERVASONI 2 | I302: ROMARI | K302: BRETHERTON
A304: ROUND 5 | E304: 10TH MAY | J304: WEATHER | O304: NORTH WEST WIND
C305: 1ST QTR | G305: 2ND QTR | K305: 3RD QTR | O305: FINAL | S305: PLAYED AT | X305: LADDER | AA305: ROUND | AC305: 5
A306: MORDIALLOC | C306: 5 | D306: 4 | E306: =C306*6+D306 -> 34 | G306: 8 | H306: 7 | I306: =G306*6+H306 -> 55 | K306: 10 | L306: 9 | M306: =K306*6+L306 -> 69 | O306: 12 | P306: 12 | Q306: =O306*6+P306 -> 84 | S306: MORDIALLOC | W306: TEAM | X306: W | Y306: L | Z306: D | AA306: FOR | AB306: AGST | AC306: % | AD306: PTS
A307: MOORABBIN | C307: 2 | D307: 2 | E307: =C307*6+D307 -> 14 | G307: 6 | H307: 5 | I307: =G307*6+H307 -> 41 | K307: 10 | L307: 9 | M307: =K307*6+L307 -> 69 | O307: 12 | P307: 12 | Q307: =O307*6+P307 -> 84 | S307: UMPIRE
A308: BEST PLAYERS | S308: O'DONOGHUE | W308: PORT MELBOURNE | X308: 5 | Y308: 0 | Z308: 0 | AA308: 546 | AB308: 354 | AC308: 154.23728813559322 | AD308: 20
A309: MORDIALLOC | C309: BESANKO | F309: PEARSON | I309: CRANE | L309: LASKEY | O309: METCALF | R309: EGERTON | W309: MOORABBIN | X309: 4 | Y309: 0 | Z309: 1 | AA309: 405 | AB309: 320 | AC309: 126.5625 | AD309: 18
A310: MOORABBIN | C310: GILDER | F310: McGAW | I310: MANIE | L310: MENNIE | O310: MURPHY | R310: LEHMANN | W310: WILLIAMSTOWN | X310: 4 | Y310: 1 | Z310: 0 | AA310: 480 | AB310: 368 | AC310: 130.43478260869566 | AD310: 16
A311: GOALKICKERS | Q311: SHIELDS | W311: CAMBERWELL | X311: 4 | Y311: 1 | Z311: 0 | AA311: 404 | AB311: 317 | AC311: 127.44479495268139 | AD311: 16
A312: MORDIALLOC | C312: PEARSON 3 | F312: WILKINSON 2 | I312: LASKEY 2 | K312: CRAWFORD | N312: METCALF | P312: EGERTON | R312: SHEEHAN
A313: MOORABBIN | C313: McGAW 4 | F313: MANIE 4 | I313: COLE 2 | K313: WHALEBONE | N313: RENWICK | W313: MORDIALLOC | X313: 3 | Y313: 1 | Z313: 1 | AA313: 368 | AB313: 361 | AC313: 101.93905817174515 | AD313: 14
W314: BOX HILL | X314: 3 | Y314: 2 | Z314: 0 | AA314: 501 | AB314: 312 | AC314: 160.57692307692307 | AD314: 12
A315: WILLIAMSTOWN | C315: 0 | D315: 2 | E315: =C315*6+D315 -> 2 | G315: 4 | H315: 10 | I315: =G315*6+H315 -> 34 | K315: 5 | L315: 10 | M315: =K315*6+L315 -> 40 | O315: 10 | P315: 12 | Q315: =O315*6+P315 -> 72 | S315: COBURG | W315: YARRAVILLE | X315: 3 | Y315: 2 | Z315: 0 | AA315: 485 | AB315: 358 | AC315: 135.47 | AD315: 12
A316: COBURG | C316: 4 | D316: 4 | E316: =C316*6+D316 -> 28 | G316: 5 | H316: 6 | I316: =G316*6+H316 -> 36 | K316: 6 | L316: 10 | M316: =K316*6+L316 -> 46 | O316: 10 | P316: 10 | Q316: =O316*6+P316 -> 70 | S316: ALLEN | W316: BRUNSWICK | X316: 3 | Y316: 2 | Z316: 0 | AA316: 322 | AB316: 348 | AC316: 92.52873563218391 | AD316: 12
A317: BEST PLAYERS | W317: SANDRINGHAM | X317: 2 | Y317: 3 | Z317: 0 | AA317: 372 | AB317: 302 | AC317: 123.17880794701986 | AD317: 8
A318: WILLIAMSTOWN | C318: OUTEN | F318: E BEITZEL | I318: R JONES | L318: MUNDAY | O318: WHITTAKER | R318: EVANS | W318: OAKLEIGH | X318: 2 | Y318: 3 | Z318: 0 | AA318: 408 | AB318: 334 | AC318: 122.1556886227545 | AD318: 8
A319: COBURG | C319: YOUNG | F319: BIGELOW | I319: JORDAN | L319: B JONES | O319: RUTLEDGE | R319: WILSON | W319: COBURG | X319: 2 | Y319: 3 | Z319: 0 | AA319: 416 | AB319: 401 | AC319: 103.74064837905237 | AD319: 8
A320: GOALKICKERS | W320: PRAHRAN | X320: 2 | Y320: 3 | Z320: 0 | AA320: 327 | AB320: 507 | AC320: 64.5 | AD320: 8
A321: WILLIAMSTOWN | C321: MAZOURIS 3 | F321: CULLINAN 2 | I321: REED 2 | K321: CALLAHAN | N321: OUTEN | P321: SMITH | W321: PRESTON | X321: 1 | Y321: 4 | Z321: 0 | AA321: 350 | AB321: 362 | AC321: 96.685082872928177 | AD321: 4
A322: COBURG | C322: HEWES 3 | F322: HOOGEN 2 | I322: JORDAN 2 | L322: SHAW 2 | N322: JACKSON | W322: DANDENONG | X322: 1 | Y322: 4 | Z322: 0 | AA322: 280 | AB322: 502 | AC322: 55.776892430278885 | AD322: 4
W323: NORTHCOTE | X323: 0 | Y323: 5 | Z323: 0 | AA323: 265 | AB323: 493 | AC323: 53.752535496957407 | AD323: 0
A324: BOX HILL | C324: 3 | D324: 4 | E324: =C324*6+D324 -> 22 | G324: 7 | H324: 7 | I324: =G324*6+H324 -> 49 | K324: 13 | L324: 11 | M324: =K324*6+L324 -> 89 | O324: 15 | P324: 11 | Q324: =O324*6+P324 -> 101 | S324: OAKLEIGH | W324: BRIGHTON | X324: 0 | Y324: 5 | Z324: 0 | AA324: 271 | AB324: 559 | AC324: 48.479427549194988 | AD324: 0
A325: OAKLEIGH | C325: 4 | D325: 2 | E325: =C325*6+D325 -> 26 | G325: 6 | H325: 8 | I325: =G325*6+H325 -> 44 | K325: 11 | L325: 13 | M325: =K325*6+L325 -> 79 | O325: 13 | P325: 18 | Q325: =O325*6+P325 -> 96 | S325: MARCY
A326: BEST PLAYERS
A327: BOX HILL | C327: DEVERY | F327: SAWATSKY | I327: CRAIG | L327: GOOCH | O327: WHITE | R327: PEARCE
A328: OAKLEIGH | C328: COLLINS | F328: COUGHLAN | I328: B WILLIAMS | L328: DONOHUE | O328: LANE | R328: O'DONNELL
A329: GOALKICKERS
A330: BOX HILL | C330: DEVERY 4 | F330: SAWATSKY 3 | I330: BRAIN 3 | K330: SALVADO 2 | N330: MCKENZIE | Q330: GOOCH | S330: WHITE
A331: OAKLEIGH | C331: O'DONNELL 3 | F331: B WILLIAMS 3 | I331: WINTER 3 | L331: COUGHLAN 2 | O331: NICHOLSON | R331: DOWLING
A333: BRUNSWICK | C333: 3 | D333: 2 | E333: =C333*6+D333 -> 20 | G333: 6 | H333: 9 | I333: =G333*6+H333 -> 45 | K333: 7 | L333: 10 | M333: =K333*6+L333 -> 52 | O333: 11 | P333: 12 | Q333: =O333*6+P333 -> 78 | S333: YARRAVILLE
A334: YARRAVILLE | C334: 1 | D334: 4 | E334: =C334*6+D334 -> 10 | G334: 2 | H334: 7 | I334: =G334*6+H334 -> 19 | K334: 7 | L334: 11 | M334: =K334*6+L334 -> 53 | O334: 8 | P334: 13 | Q334: =O334*6+P334 -> 61 | S334: GODING
A335: BEST PLAYERS
A336: BRUNSWICK | C336: G STANLEY | F336: BADDELEY | I336: K DILLON | L336: ROBSON | O336: WHILEY | R336: EDWARDS
A337: YARRAVILLE | C337: ARCHBOLD | F337: VANDERFEEN | I337: LETCHER | L337: ROHLEDER | O337: LIVINGSTONE | R337: CAREY
A338: GOALKICKERS
A339: BRUNSWICK | C339: HAYES 3 | F339: ROBSON 3 | I339: PHIPPS 3 | L339: G STANLEY | O339: L STANLEY
A340: YARRAVILLE | C340: CAREY 2 | F340: VANDERFEEN 2 | J340: LETCHER | L340: BOURKE | N340: WEBB | P340: GLEESON
A342: PRAHRAN | C342: 5 | D342: 4 | E342: =C342*6+D342 -> 34 | G342: 7 | H342: 8 | I342: =G342*6+H342 -> 50 | K342: 9 | L342: 14 | M342: =K342*6+L342 -> 68 | O342: 11 | P342: 19 | Q342: =O342*6+P342 -> 85 | S342: TOORAK PARK
A343: PRESTON | C343: 3 | D343: 1 | E343: =C343*6+D343 -> 19 | G343: 6 | H343: 6 | I343: =G343*6+H343 -> 42 | K343: 6 | L343: 9 | M343: =K343*6+L343 -> 45 | O343: 9 | P343: 14 | Q343: =O343*6+P343 -> 68 | S343: GWYNNE
A344: BEST PLAYERS
A345: PRAHRAN | C345: HEAD | F345: HOOPER | I345: HARVEY | L345: WATKINS | O345: CHRISTIAN | R345: ASH
A346: PRESTON | C346: RYMER | F346: BRIERLEY | I346: GWILLIAM | L346: BRYAN | O346: HOWARD | R346: SUPPLITT
A347: GOALKICKERS
A348: PRAHRAN | C348: RICKARDS 3 | F348: WHARTON 3 | I348: KINNABURGH 2 | M348: BURNS | O348: ANDERSON | R348: HARVEY
A349: PRESTON | C349: RYMER 4 | F349: BRIERLEY 2 | I349: SUPPLITT | K349: BERGIN | M349: JENSEN
A351: SANDRINGHAM | C351: 3 | D351: 1 | E351: =C351*6+D351 -> 19 | G351: 8 | H351: 5 | I351: =G351*6+H351 -> 53 | K351: 8 | L351: 8 | M351: =K351*6+L351 -> 56 | O351: 13 | P351: 10 | Q351: =O351*6+P351 -> 88 | S351: BEACH ROAD
A352: DANDENONG | C352: 2 | D352: 1 | E352: =C352*6+D352 -> 13 | G352: 2 | H352: 2 | I352: =G352*6+H352 -> 14 | K352: 7 | L352: 8 | M352: =K352*6+L352 -> 50 | O352: 9 | P352: 10 | Q352: =O352*6+P352 -> 64 | S352: ROACH
A353: BEST PLAYERS
A354: SANDRINGHAM | C354: WILLIAMS | F354: CROFT | I354: RICHARDS | L354: SHRIVES | O354: OAKLEY | R354: McLEAN
A355: DANDENONG | C355: KNIGHT | F355: GUILLE | I355: MINOTTI | L355: JEMMESON | O355: PAPWORTH | R355: LALOR
A356: GOALKICKERS
A357: SANDRINGHAM | C357: OAKLEY 7 | F357: ELLIS 2 | I357: SHRIVES | K357: STEELE | M357: PATMORE | O357: ECCLESTON
A358: DANDENONG | C358: LALOR 5 | F358: PENNEFATHER 2 | J358: KNIGHT
A360: CAMBERWELL | C360: 0 | D360: 3 | E360: =C360*6+D360 -> 3 | G360: 9 | H360: 8 | I360: =G360*6+H360 -> 62 | K360: 15 | L360: 10 | M360: =K360*6+L360 -> 100 | O360: 19 | P360: 17 | Q360: =O360*6+P360 -> 131 | S360: CAMBERWELL
A361: BRIGHTON | C361: 2 | D361: 3 | E361: =C361*6+D361 -> 15 | G361: 4 | H361: 3 | I361: =G361*6+H361 -> 27 | K361: 7 | L361: 6 | M361: =K361*6+L361 -> 48 | O361: 9 | P361: 6 | Q361: =O361*6+P361 -> 60 | S361: BREWER
A362: BEST PLAYERS
A363: CAMBERWELL | C363: McGUINNESS | F363: B JOHNSON | I363: COLEMAN | L363: McISAAC | O363: RICE | R363: YOUNG
A364: BRIGHTON | C364: CRAIG | F364: N MILLS | I364: COOPER | L364: MILNES | O364: BURSEY | R364: ASHENHURST
A365: GOALKICKERS
A366: CAMBERWELL | C366: HIGSON 5 | F366: McGUINNESS 5 | I366: COLEMAN 3 | L366: RICE 3 | N366: YOUNG 2 | Q366: SKALBERG
A367: BRIGHTON | C367: CRAIG 4 | F367: DAVIS | H367: HART | J367: COOPER | L367: MAY | N367: CURRIE
A369: PORT MELBOURNE | C369: 3 | D369: 5 | E369: =C369*6+D369 -> 23 | G369: 6 | H369: 7 | I369: =G369*6+H369 -> 43 | K369: 12 | L369: 11 | M369: =K369*6+L369 -> 83 | O369: 16 | P369: 14 | Q369: =O369*6+P369 -> 110 | S369: NORTHCOTE
A370: NORTHCOTE | C370: 1 | D370: 5 | E370: =C370*6+D370 -> 11 | G370: 2 | H370: 8 | I370: =G370*6+H370 -> 20 | K370: 5 | L370: 10 | M370: =K370*6+L370 -> 40 | O370: 6 | P370: 11 | Q370: =O370*6+P370 -> 47 | S370: ALLEN
A371: BEST PLAYERS
A372: PORT MELBOURNE | C372: WITHERS | F372: SYMONDS | I372: E ATKINSON | L372: FREYER | O372: ROONEY | R372: MONKS
A373: NORTHCOTE | C373: WRIGHT | F373: SMITH | I373: ROMARI | L373: GERVASONI | O373: HUSSEY | R373: RYAN
A374: GOALKICKERS
A375: PORT MELBOURNE | C375: MONKS 6 | F375: BONNETT 4 | I375: ROONEY 2 | L375: SYKES 2 | N375: FREYER 2 | Q375: SYMONDS
A376: NORTHCOTE | C376: ROMARI 3 | F376: MARCHANT | I376: COLLINS | K376: RYAN
A378: ROUND 6 | E378: 17TH MAY | J378: WEATHER | M378: STRONG NORTH WEST WIND | S378: PLAYED AT
C379: 1ST QTR | G379: 2ND QTR | K379: 3RD QTR | O379: FINAL | S379: PORT MELBOURNE | X379: LADDER | AA379: ROUND | AC379: 6
A380: YARRAVILLE | C380: 2 | D380: 0 | E380: =C380*6+D380 -> 12 | G380: 7 | H380: 2 | I380: =G380*6+H380 -> 44 | K380: 10 | L380: 3 | M380: =K380*6+L380 -> 63 | O380: 12 | P380: 6 | Q380: =O380*6+P380 -> 78 | S380: UMPIRE | W380: TEAM | X380: W | Y380: L | Z380: D | AA380: FOR | AB380: AGST | AC380: % | AD380: PTS
A381: PORT MELBOURNE | C381: 3 | D381: 3 | E381: =C381*6+D381 -> 21 | G381: 4 | H381: 4 | I381: =G381*6+H381 -> 28 | K381: 8 | L381: 8 | M381: =K381*6+L381 -> 56 | O381: 8 | P381: 8 | Q381: =O381*6+P381 -> 56 | S381: ALLEN
A382: BEST PLAYERS | W382: MOORABBIN | X382: 5 | Y382: 0 | Z382: 1 | AA382: 485 | AB382: 345 | AC382: 140.57971014492753 | AD382: 22
A383: YARRAVILLE | C383: ARCHBOLD | F383: GARRICK | I383: ANDERSON | L383: LETCHER | O383: CROOK | Q383: MASON | W383: PORT MELBOURNE | X383: 5 | Y383: 1 | Z383: 0 | AA383: 602 | AB383: 432 | AC383: 139.35185185185185 | AD383: 20
A384: PORT MELBOURNE | C384: MERRETT | F384: R ATKINSON | I384: METHERALL | L384: SYKES | O384: LEWIS | Q384: WITHERS | W384: WILLIAMSTOWN | X384: 5 | Y384: 1 | Z384: 0 | AA384: 537 | AB384: 392 | AC384: 136.98979591836735 | AD384: 20
A385: GOALKICKERS | W385: CAMBERWELL | X385: 5 | Y385: 1 | Z385: 0 | AA385: 496 | AB385: 383 | AC385: 129.50391644908615 | AD385: 20
A386: YARRAVILLE | C386: CROOK 3 | F386: LETCHER 2 | I386: BOURKE 2 | L386: GLEESON 2 | N386: WEBB | P386: ANDERSON | R386: CAREY
A387: PORT MELBOURNE | C387: BONNETT 2 | F387: SYMONDS 2 | I387: McMASTER | L387: MERRETT | N387: SYKES | P387: LANDORF | W387: MORDIALLOC | X387: 4 | Y387: 1 | Z387: 1 | AA387: 413 | AB387: 401 | AC387: 102.9925187032419 | AD387: 18
W388: BOX HILL | X388: 4 | Y388: 2 | Z388: 0 | AA388: 594 | AB388: 354 | AC388: 167.79661016949152 | AD388: 16
A389: BOX HILL | C389: 1 | D389: 4 | E389: =C389*6+D389 -> 10 | G389: 4 | H389: 14 | I389: =G389*6+H389 -> 38 | K389: 4 | L389: 17 | M389: =K389*6+L389 -> 41 | O389: 11 | P389: 27 | Q389: =O389*6+P389 -> 93 | S389: BOX HILL | W389: YARRAVILLE | X389: 4 | Y389: 2 | Z389: 0 | AA389: 563 | AB389: 414 | AC389: 135.99 | AD389: 16
A390: SANDRINGHAM | C390: 2 | D390: 6 | E390: =C390*6+D390 -> 18 | G390: 3 | H390: 6 | I390: =G390*6+H390 -> 24 | K390: 5 | L390: 11 | M390: =K390*6+L390 -> 41 | O390: 5 | P390: 12 | Q390: =O390*6+P390 -> 42 | S390: O'DONOGHUE | W390: BRUNSWICK | X390: 4 | Y390: 2 | Z390: 0 | AA390: 392 | AB390: 409 | AC390: 95.843520782396084 | AD390: 16
A391: BEST PLAYERS | W391: COBURG | X391: 3 | Y391: 3 | Z391: 0 | AA391: 489 | AB391: 462 | AC391: 105.84415584415585 | AD391: 12
A392: BOX HILL | C392: EADE | F392: GOOCH | I392: SAWATSKY | L392: WHITE | O392: PRENDERGAST | R392: DEVERY | W392: OAKLEIGH | X392: 2 | Y392: 4 | Z392: 0 | AA392: 448 | AB392: 379 | AC392: 118.20580474934037 | AD392: 8
A393: SANDRINGHAM | C393: STEELE | F393: CROFT | I393: EVANS | L393: RICHARDS | O393: LINDSAY | R393: McLEAN | W393: SANDRINGHAM | X393: 2 | Y393: 4 | Z393: 0 | AA393: 414 | AB393: 395 | AC393: 104.81012658227849 | AD393: 8
A394: GOALKICKERS | W394: PRAHRAN | X394: 2 | Y394: 4 | Z394: 0 | AA394: 388 | AB394: 580 | AC394: 66.9 | AD394: 8
A395: BOX HILL | C395: BROWN 3 | F395: EADE 2 | H395: CRAIG 2 | J395: SALVADO | M395: SAWATSKY | P395: PLUNKETT | R395: PRENDERGAST | W395: PRESTON | X395: 1 | Y395: 5 | Z395: 0 | AA395: 411 | AB395: 432 | AC395: 95.138888888888886 | AD395: 4
A396: SANDRINGHAM | C396: K EVANS 2 | F396: ELLIS 2 | I396: ECCLESTON | W396: DANDENONG | X396: 1 | Y396: 5 | Z396: 0 | AA396: 346 | AB396: 594 | AC396: 58.249158249158249 | AD396: 4
W397: NORTHCOTE | X397: 0 | Y397: 6 | Z397: 0 | AA397: 289 | AB397: 550 | AC397: 52.545454545454547 | AD397: 0
A398: MORDIALLOC | C398: 2 | D398: 5 | E398: =C398*6+D398 -> 17 | G398: 4 | H398: 6 | I398: =G398*6+H398 -> 30 | K398: 5 | L398: 10 | M398: =K398*6+L398 -> 40 | O398: 6 | P398: 9 | Q398: =O398*6+P398 -> 45 | S398: OAKLEIGH | W398: BRIGHTON | X398: 0 | Y398: 6 | Z398: 0 | AA398: 296 | AB398: 639 | AC398: 46.322378716744915 | AD398: 0
A399: OAKLEIGH | C399: 2 | D399: 3 | E399: =C399*6+D399 -> 15 | G399: 4 | H399: 5 | I399: =G399*6+H399 -> 29 | K399: 4 | L399: 8 | M399: =K399*6+L399 -> 32 | O399: 5 | P399: 10 | Q399: =O399*6+P399 -> 40 | S399: GODING
A400: BEST PLAYERS
A401: MORDIALLOC | C401: JOSE | F401: BARR | I401: WILKINSON | L401: SHEEHAN | O401: LASKEY | R401: PEARSON
A402: OAKLEIGH | C402: LEHNE | F402: LANE | I402: LONGNEY | L402: D'ARCY | O402: DONOHUE | R402: WINTER
A403: GOALKICKERS
A404: MORDIALLOC | C404: JOSE 2 | F404: WILKINSON 2 | I404: METCALF | K404: PEARSON
A405: OAKLEIGH | C405: LONGNEY 3 | F405: LEHNE 2
A407: COBURG | C407: 2 | D407: 7 | E407: =C407*6+D407 -> 19 | G407: 3 | H407: 8 | I407: =G407*6+H407 -> 26 | K407: 7 | L407: 18 | M407: =K407*6+L407 -> 60 | O407: 9 | P407: 19 | Q407: =O407*6+P407 -> 73 | S407: COBURG
A408: PRAHRAN | C408: 1 | D408: 0 | E408: =C408*6+D408 -> 6 | G408: 3 | H408: 0 | I408: =G408*6+H408 -> 18 | K408: 3 | L408: 1 | M408: =K408*6+L408 -> 19 | O408: 9 | P408: 7 | Q408: =O408*6+P408 -> 61 | S408: BREWER
A409: BEST PLAYERS
A410: COBURG | C410: SHAW | F410: RUTLEDGE | I410: HOOGEN | L410: SHORT | O410: MAHONEY | R410: BIGELOW
A411: PRAHRAN | C411: ALLEN | F411: CHRISTIAN | I411: ROSS JONES | L411: BOYD | O411: HARVEY | R411: WHARTON
A412: GOALKICKERS
A413: COBURG | C413: HOOGEN 2 | F413: SHAW 2 | I413: HEWES 2 | L413: MAHONEY | O413: HUNTINGTON | R413: BIGELOW
A414: PRAHRAN | C414: WHARTON 2 | F414: HARVEY 2 | I414: RICKARDS 2 | L414: HORSFIELD | O414: BURNS | Q414: ALLEN
A416: BRUNSWICK | C416: 1 | D416: 0 | E416: =C416*6+D416 -> 6 | G416: 4 | H416: 5 | I416: =G416*6+H416 -> 29 | K416: 4 | L416: 6 | M416: =K416*6+L416 -> 30 | O416: 10 | P416: 10 | Q416: =O416*6+P416 -> 70 | S416: PRESTON
A417: PRESTON | C417: 3 | D417: 6 | E417: =C417*6+D417 -> 24 | G417: 4 | H417: 6 | I417: =G417*6+H417 -> 30 | K417: 9 | L417: 7 | M417: =K417*6+L417 -> 61 | O417: 9 | P417: 7 | Q417: =O417*6+P417 -> 61 | S417: ROACH
A418: BEST PLAYERS
A419: BRUNSWICK | C419: BRENNAN | F419: G STANLEY | I419: BARR | L419: L STANLEY | O419: N THOMPSON | R419: McFARLANE
A420: PRESTON | C420: FOOTE | F420: BRIERLEY | I420: GWILLIAM | L420: BRYAN | O420: RYMER | R420: BERGIN
A421: GOALKICKERS
A422: BRUNSWICK | C422: G STANLEY 3 | F422: HOUSE 2 | I422: JARMAN | K422: BRENNAN | M422: N THOMPSON | P422: McFARLANE | R422: BARR
A423: PRESTON | C423: FOOTE 3 | F423: BRIERLEY 3 | I423: RYMER | K423: McMAHON | M423: DAWSON
A425: CAMBERWELL | C425: 4 | D425: 2 | E425: =C425*6+D425 -> 26 | G425: 7 | H425: 6 | I425: =G425*6+H425 -> 48 | K425: 12 | L425: 11 | M425: =K425*6+L425 -> 83 | O425: 13 | P425: 14 | Q425: =O425*6+P425 -> 92 | S425: DANDENONG
A426: DANDENONG | C426: 1 | D426: 3 | E426: =C426*6+D426 -> 9 | G426: 7 | H426: 8 | I426: =G426*6+H426 -> 50 | K426: 8 | L426: 10 | M426: =K426*6+L426 -> 58 | O426: 9 | P426: 12 | Q426: =O426*6+P426 -> 66 | S426: MARCY
A427: BEST PLAYERS
A428: CAMBERWELL | C428: ROSS | F428: MASON | I428: SKALBERG | L428: McGUINNESS | O428: RICE | R428: B JOHNSON
A429: DANDENONG | C429: TODD | F429: McKINNAIRD | I429: GILLINGHAM | L429: GUILLE | O429: PENNEFATHER | R429: LALOR
A430: GOALKICKERS
A431: CAMBERWELL | C431: WHITTEN 3 | F431: McGUINNESS 3 | J431: COLEMAN 3 | M431: SKALBERG 2 | P431: RICE | R431: ROSS
A432: DANDENONG | C432: LALOR 3 | F432: PENNEFATHER 3 | J432: TODD | L432: PETERS | N432: KNIGHT
A434: WILLIAMSTOWN | C434: 3 | D434: 1 | E434: =C434*6+D434 -> 19 | G434: 7 | H434: 6 | I434: =G434*6+H434 -> 48 | K434: 7 | L434: 6 | M434: =K434*6+L434 -> 48 | O434: 8 | P434: 9 | Q434: =O434*6+P434 -> 57 | S434: WILLIAMSTOWN
A435: NORTHCOTE | C435: 1 | D435: 1 | E435: =C435*6+D435 -> 7 | G435: 1 | H435: 1 | I435: =G435*6+H435 -> 7 | K435: 3 | L435: 5 | M435: =K435*6+L435 -> 23 | O435: 3 | P435: 6 | Q435: =O435*6+P435 -> 24 | S435: GWYNNE
A436: BEST PLAYERS
A437: WILLIAMSTOWN | C437: MARTIN | F437: SMITH | I437: CALLAHAN | L437: MAZOURIS | O437: E BEITZEL | R437: REED
A438: NORTHCOTE | C438: TAYLOR | F438: GERVASONI | I438: WRIGHT | L438: VAINS | O438: SMITH | R438: KENNY
A439: GOALKICKERS
A440: WILLIAMSTOWN | C440: PRIMMER 2 | F440: REED 2 | I440: SMITH 2 | L440: MAZOURIS | O440: CULLINAN
A441: NORTHCOTE | C441: KENNY | F441: ROMARI | I441: CRIPPS
A443: MOORABBIN | C443: 1 | D443: 1 | E443: =C443*6+D443 -> 7 | G443: 8 | H443: 1 | I443: =G443*6+H443 -> 49 | K443: 8 | L443: 3 | M443: =K443*6+L443 -> 51 | O443: 12 | P443: 8 | Q443: =O443*6+P443 -> 80 | S443: MOORABBIN
A444: BRIGHTON | C444: 0 | D444: 4 | E444: =C444*6+D444 -> 4 | G444: 0 | H444: 5 | I444: =G444*6+H444 -> 5 | K444: 3 | L444: 7 | M444: =K444*6+L444 -> 25 | O444: 3 | P444: 7 | Q444: =O444*6+P444 -> 25 | S444: BLACKBURN
A445: BEST PLAYERS
A446: MOORABBIN | C446: MANIE | F446: HOGAN | I446: GREEN | L446: McGAW | O446: PAPLEY | R446: HIRST
A447: BRIGHTON | C447: MAY | F447: HEIMRICH | I447: MILNES | L447: N MILLS | O447: HART | R447: BURSEY
A448: GOALKICKERS
A449: MOORABBIN | C449: HOGAN 2 | F449: MANIE 2 | I449: McGAW 2 | K449: WHALEBONE 2 | N449: MASON 2 | Q449: COLE | R449: HIRST
A450: BRIGHTON | C450: CRAIG | F450: N COOPER | I450: BROWNING
A452: ROUND 7 | E452: 24TH MAY | J452: WEATHER | O452: STRONG WEST WIND | S452: PLAYED AT
C453: 1ST QTR | G453: 2ND QTR | K453: 3RD QTR | O453: FINAL | S453: CAMBERWELL | X453: LADDER | AA453: ROUND | AC453: 7
A454: CAMBERWELL | C454: 2 | D454: 4 | E454: =C454*6+D454 -> 16 | G454: 6 | H454: 7 | I454: =G454*6+H454 -> 43 | K454: 8 | L454: 7 | M454: =K454*6+L454 -> 55 | O454: 9 | P454: 10 | Q454: =O454*6+P454 -> 64 | S454: UMPIRE | W454: TEAM | X454: W | Y454: L | Z454: D | AA454: FOR | AB454: AGST | AC454: % | AD454: PTS
A455: MOORABBIN | C455: 2 | D455: 3 | E455: =C455*6+D455 -> 15 | G455: 4 | H455: 4 | I455: =G455*6+H455 -> 28 | K455: 5 | L455: 4 | M455: =K455*6+L455 -> 34 | O455: 8 | P455: 7 | Q455: =O455*6+P455 -> 55 | S455: GODING
A456: BEST PLAYERS | W456: WILLIAMSTOWN | X456: 6 | Y456: 1 | Z456: 0 | AA456: 598 | AB456: 450 | AC456: 132.89 | AD456: 24
A457: CAMBERWELL | C457: ROSS | F457: RICE | I457: BOX | K457: YOUNG | N457: COLEMAN | Q457: B JOHNSON | W457: CAMBERWELL | X457: 6 | Y457: 1 | Z457: 0 | AA457: 560 | AB457: 438 | AC457: 127.85388127853881 | AD457: 24
A458: MOORABBIN | C458: P RYAN | F458: HOGAN | I458: GREEN | K458: GILDER | N458: CRAMERI | Q458: EVANS | W458: MOORABBIN | X458: 5 | Y458: 1 | Z458: 1 | AA458: 540 | AB458: 409 | AC458: 132.02933985330074 | AD458: 22
A459: GOALKICKERS | W459: BOX HILL | X459: 5 | Y459: 2 | Z459: 0 | AA459: 666 | AB459: 388 | AC459: 171.64948453608247 | AD459: 20
A460: CAMBERWELL | C460: HIGSON 4 | F460: SKALBERG | I460: RICE | K460: YOUNG | M460: McGUINNESS | P460: BOX
A461: MOORABBIN | C461: WHALEBONE 2 | F461: McGAW 2 | I461: R MASON | K461: MANIE | M461: HOGAN | O461: CRAMERI | W461: YARRAVILLE | X461: 5 | Y461: 2 | Z461: 0 | AA461: 630 | AB461: 457 | AC461: 137.86 | AD461: 20
W462: PORT MELBOURNE | X462: 5 | Y462: 2 | Z462: 0 | AA462: 674 | AB462: 514 | AC462: 131.1284046692607 | AD462: 20
A463: BOX HILL | C463: 0 | D463: 3 | E463: =C463*6+D463 -> 3 | G463: 1 | H463: 6 | I463: =G463*6+H463 -> 12 | K463: 7 | L463: 9 | M463: =K463*6+L463 -> 51 | O463: 10 | P463: 12 | Q463: =O463*6+P463 -> 72 | S463: MORDIALLOC | W463: BRUNSWICK | X463: 5 | Y463: 2 | Z463: 0 | AA463: 474 | AB463: 481 | AC463: 98.544698544698548 | AD463: 20
A464: MORDIALLOC | C464: 1 | D464: 2 | E464: =C464*6+D464 -> 8 | G464: 2 | H464: 5 | I464: =G464*6+H464 -> 17 | K464: 3 | L464: 7 | M464: =K464*6+L464 -> 25 | O464: 4 | P464: 10 | Q464: =O464*6+P464 -> 34 | S464: POLLARD | W464: MORDIALLOC | X464: 4 | Y464: 2 | Z464: 1 | AA464: 447 | AB464: 473 | AC464: 94.503171247357301 | AD464: 18
A465: BEST PLAYERS | W465: COBURG | X465: 4 | Y465: 3 | Z465: 0 | AA465: 595 | AB465: 527 | AC465: 112.90322580645162 | AD465: 16
A466: BOX HILL | C466: GOOCH | F466: CRAIG | I466: BRAIN | L466: BROWN | O466: IRVINE | R466: WHITE | W466: SANDRINGHAM | X466: 3 | Y466: 4 | Z466: 0 | AA466: 482 | AB466: 443 | AC466: 108.80361173814899 | AD466: 12
A467: MORDIALLOC | C467: CRANE | F467: BARCLAY | I467: O'NEILL | L467: BARR | O467: BESANKO | R467: METCALF | W467: OAKLEIGH | X467: 2 | Y467: 5 | Z467: 0 | AA467: 496 | AB467: 447 | AC467: 110.96196868008948 | AD467: 8
A468: GOALKICKERS | W468: PRAHRAN | X468: 2 | Y468: 5 | Z468: 0 | AA468: 446 | AB468: 641 | AC468: 69.58 | AD468: 8
A469: BOX HILL | C469: BRAIN 4 | F469: BROWN 2 | I469: SALVADO 2 | L469: JONES | N469: CRAIG | W469: PRESTON | X469: 1 | Y469: 6 | Z469: 0 | AA469: 454 | AB469: 499 | AC469: 90.981963927855716 | AD469: 4
A470: MORDIALLOC | C470: JOSE 2 | F470: WILKINSON | I470: R McLORINAN | W470: DANDENONG | X470: 1 | Y470: 6 | Z470: 0 | AA470: 401 | AB470: 674 | AC470: 59.495548961424333 | AD470: 4
W471: BRIGHTON | X471: 1 | Y471: 6 | Z471: 0 | AA471: 376 | AB471: 694 | AC471: 54.178674351585016 | AD471: 4
A472: BRUNSWICK | C472: 0 | D472: 0 | E472: =C472*6+D472 -> 0 | G472: 3 | H472: 2 | I472: =G472*6+H472 -> 20 | K472: 6 | L472: 3 | M472: =K472*6+L472 -> 39 | O472: 13 | P472: 4 | Q472: =O472*6+P472 -> 82 | S472: BRUNSWICK | W472: NORTHCOTE | X472: 0 | Y472: 7 | Z472: 0 | AA472: 354 | AB472: 656 | AC472: 53.963414634146339 | AD472: 0
A473: PORT MELBOURNE | C473: 5 | D473: 8 | E473: =C473*6+D473 -> 38 | G473: 5 | H473: 8 | I473: =G473*6+H473 -> 38 | K473: 9 | L473: 12 | M473: =K473*6+L473 -> 66 | O473: 10 | P473: 12 | Q473: =O473*6+P473 -> 72 | S473: MARCY
A474: BEST PLAYERS
A475: BRUNSWICK | C475: N THOMPSON | G475: K DILLON | J475: EDWARDS | M475: R THOMPSON | P475: HOUSE | R475: McFARLANE
A476: PORT MELBOURNE | C476: R ATKINSON | G476: BONNETT | J476: METHERALL | M476: WITHERS | P476: MONKS | R476: LEWIS
A477: GOALKICKERS
A478: BRUNSWICK | C478: HAYES 5 | F478: K DILLON 4 | I478: JARMAN 2 | L478: McFARLANE | O478: HOUSE
A479: PORT MELBOURNE | C479: BONNETT 6 | F479: MERRETT 2 | I479: MONKS 2
A481: SANDRINGHAM | C481: 1 | D481: 1 | E481: =C481*6+D481 -> 7 | G481: 2 | H481: 4 | I481: =G481*6+H481 -> 16 | K481: 9 | L481: 8 | M481: =K481*6+L481 -> 62 | O481: 9 | P481: 14 | Q481: =O481*6+P481 -> 68 | S481: BEACH ROAD
A482: OAKLEIGH | C482: 2 | D482: 5 | E482: =C482*6+D482 -> 17 | G482: 4 | H482: 7 | I482: =G482*6+H482 -> 31 | K482: 5 | L482: 10 | M482: =K482*6+L482 -> 40 | O482: 6 | P482: 12 | Q482: =O482*6+P482 -> 48 | S482: GWYNNE
A483: BEST PLAYERS
A484: SANDRINGHAM | C484: SHRIVES | F484: McLEAN | I484: RICHARDS | L484: ELLIS | O484: ECCLESTON | R484: EVANS
A485: OAKLEIGH | C485: BOURKE | F485: BAPTIST | I485: D'ARCY | L485: B J WILLIAMS | O485: LONGNEY | R485: COLLINS
A486: GOALKICKERS
A487: SANDRINGHAM | C487: STEELE 2 | E487: ELLIS 2 | G487: EVANS 2 | I487: ECCLESTON 2 | L487: McLEAN
A488: OAKLEIGH | C488: BRINE 3 | F488: LONGNEY 2 | I488: COUGHLAN
A490: BRIGHTON | C490: 3 | D490: 3 | E490: =C490*6+D490 -> 21 | G490: 5 | H490: 8 | I490: =G490*6+H490 -> 38 | K490: 7 | L490: 11 | M490: =K490*6+L490 -> 53 | O490: 11 | P490: 14 | Q490: =O490*6+P490 -> 80 | S490: ELSTERNWICK PARK
A491: DANDENONG | C491: 3 | D491: 1 | E491: =C491*6+D491 -> 19 | G491: 5 | H491: 1 | I491: =G491*6+H491 -> 31 | K491: 6 | L491: 4 | M491: =K491*6+L491 -> 40 | O491: 8 | P491: 7 | Q491: =O491*6+P491 -> 55 | S491: ALLEN
A492: BEST PLAYERS
A493: BRIGHTON | C493: ASLING | F493: BURSEY | I493: CRAIG | L493: HART | O493: MILNES | R493: CURRIE
A494: DANDENONG | C494: TODD | F494: MINOTTI | I494: BASSETT | L494: KINNAIRD | O494: FRENCH | R494: RICKMAN
A495: GOALKICKERS
A496: BRIGHTON | C496: HART 4 | F496: McCANN 2 | I496: CRAIG | K496: BURSEY | M496: W COOPER | P496: BROWNING | R496: ASLING
A497: DANDENONG | C497: KNIGHT 3 | F497: PENNEFATHER 2 | J497: RICKMAN | M497: TODD | O497: DALE
A499: YARRAVILLE | C499: 2 | D499: 0 | E499: =C499*6+D499 -> 12 | G499: 5 | H499: 0 | I499: =G499*6+H499 -> 30 | K499: 8 | L499: 6 | M499: =K499*6+L499 -> 54 | O499: 9 | P499: 13 | Q499: =O499*6+P499 -> 67 | S499: YARRAVILLE
A500: PRESTON | C500: 2 | D500: 2 | E500: =C500*6+D500 -> 14 | G500: 2 | H500: 3 | I500: =G500*6+H500 -> 15 | K500: 3 | L500: 4 | M500: =K500*6+L500 -> 22 | O500: 6 | P500: 7 | Q500: =O500*6+P500 -> 43 | S500: BREWER
A501: BEST PLAYERS
A502: YARRAVILLE | C502: VANDERFEEN | F502: COOK | I502: GARRICK | L502: ROHLEDER | O502: BURNSIDE | R502: ARCHBOLD
A503: PRESTON | C503: HOWARD | F503: RYMER | I503: GEAR | L503: BRYAN | O503: BERGIN | R503: WOOD | S503: NORTHCOTE
A504: GOALKICKERS
A505: YARRAVILLE | C505: VANDERFEEN 5 | F505: COOK 2 | I505: ANDERSON | L505: GARRICK
A506: PRESTON | C506: BERGIN 2 | F506: WOOD 2 | I506: McMAHON | L506: DAWSON
A508: WILLIAMSTOWN | C508: 2 | D508: 4 | E508: =C508*6+D508 -> 16 | G508: 4 | H508: 8 | I508: =G508*6+H508 -> 32 | K508: 7 | L508: 8 | M508: =K508*6+L508 -> 50 | O508: 8 | P508: 13 | Q508: =O508*6+P508 -> 61 | S508: TOORAK PARK
A509: PRAHRAN | C509: 1 | D509: 3 | E509: =C509*6+D509 -> 9 | G509: 2 | H509: 6 | I509: =G509*6+H509 -> 18 | K509: 6 | L509: 10 | M509: =K509*6+L509 -> 46 | O509: 8 | P509: 10 | Q509: =O509*6+P509 -> 58 | S509: O'DONOGHUE
A510: BEST PLAYERS
A511: WILLIAMSTOWN | C511: MARTIN | F511: CALLAHAN | I511: REED | L511: COLQUHOUN | O511: GEAR | R511: CULLINAN
A512: PRAHRAN | C512: HARVEY | F512: KINNABURGH | I512: CHRISTIAN | L512: HORSFIELD | O512: ANDERSON | R512: VURLOW
A513: GOALKICKERS
A514: WILLIAMSTOWN | C514: CULLINAN 3 | F514: CALLAHAN | I514: R JONES | K514: PRIMMER | M514: REED | O514: WARD
A515: PRAHRAN | C515: HORSFIELD 2 | F515: BURNS | H515: DUNKERLEY | K515: HARVEY | M515: ALLEN | O515: SHALLVEY | R515: VURLOW
A517: COBURG | C517: 3 | D517: 4 | E517: =C517*6+D517 -> 22 | G517: 9 | H517: 11 | I517: =G517*6+H517 -> 65 | K517: 10 | L517: 11 | M517: =K517*6+L517 -> 71 | O517: 15 | P517: 16 | Q517: =O517*6+P517 -> 106 | S517: NORTHCOTE
A518: NORTHCOTE | C518: 2 | D518: 5 | E518: =C518*6+D518 -> 17 | G518: 4 | H518: 7 | I518: =G518*6+H518 -> 31 | K518: 8 | L518: 10 | M518: =K518*6+L518 -> 58 | O518: 9 | P518: 11 | Q518: =O518*6+P518 -> 65 | S518: ROACH
A519: BEST PLAYERS
A520: COBURG | C520: SHAW | F520: J BRENNAN | I520: YOUNG | L520: JORDAN | O520: BERNER | R520: HEWES
A521: NORTHCOTE | C521: GERVASONI | F521: SMITH | I521: WOOLNOUGH | L521: BRETHERTON | O521: WIGNELL | R521: MUIR
A522: GOALKICKERS
A523: COBURG | C523: HEWES 7 | F523: JORDAN 2 | I523: JACKSON 2 | L523: SHAW 2 | N523: R BRENNAN | Q523: BERNER
A524: NORTHCOTE | C524: GERVASONI 2 | F524: WOOLNOUGH 2 | J524: COLLINS | L524: ALLEN | N524: MCFARLANE | Q524: CRIPPS | S524: BROWN
A526: ROUND 8 | E526: 31ST MAY | J526: WEATHER | O526: FINE & SUNNY | S526: PLAYED AT
C527: 1ST QTR | G527: 2ND QTR | K527: 3RD QTR | O527: FINAL | S527: MOORABBIN | X527: LADDER | AA527: ROUND | AC527: 8
A528: BOX HILL | C528: 1 | D528: 1 | E528: =C528*6+D528 -> 7 | G528: 3 | H528: 5 | I528: =G528*6+H528 -> 23 | K528: 3 | L528: 8 | M528: =K528*6+L528 -> 26 | O528: 11 | P528: 9 | Q528: =O528*6+P528 -> 75 | S528: UMPIRE | W528: TEAM | X528: W | Y528: L | Z528: D | AA528: FOR | AB528: AGST | AC528: % | AD528: PTS
A529: MOORABBIN | C529: 2 | D529: 0 | E529: =C529*6+D529 -> 12 | G529: 4 | H529: 2 | I529: =G529*6+H529 -> 26 | K529: 6 | L529: 5 | M529: =K529*6+L529 -> 41 | O529: 9 | P529: 7 | Q529: =O529*6+P529 -> 61 | S529: MARCY
A530: BEST PLAYERS | W530: CAMBERWELL | X530: 7 | Y530: 1 | Z530: 0 | AA530: 645 | AB530: 491 | AC530: 131.36456211812629 | AD530: 28
A531: BOX HILL | C531: BEARDMORE | F531: SAWATSKY | I531: LOVE | K531: BROWN | N531: WHITE | Q531: WRIGHT | W531: WILLIAMSTOWN | X531: 7 | Y531: 1 | Z531: 0 | AA531: 698 | AB531: 543 | AC531: 128.55 | AD531: 28
A532: MOORABBIN | C532: GREEN | F532: MORONEY | I532: BOYD | K532: J RYAN | N532: WALDRON | Q532: McCARTNEY | W532: BOX HILL | X532: 6 | Y532: 2 | Z532: 0 | AA532: 741 | AB532: 449 | AC532: 165.03340757238308 | AD532: 24
A533: GOALKICKERS | W533: YARRAVILLE | X533: 6 | Y533: 2 | Z533: 0 | AA533: 739 | AB533: 516 | AC533: 143.22 | AD533: 24
A534: BOX HILL | C534: CARRICK 4 | F534: BROWN 2 | I534: SAWATSKY | L534: EADE | N534: BRAIN | P534: DEVERY | R534: JOHNSON
A535: MOORABBIN | C535: MORONEY 2 | F535: MURPHY 2 | I535: CRAMERI | K535: WHALEBONE | N535: EVANS | P535: HOGAN | R535: HIRST | W535: BRUNSWICK | X535: 6 | Y535: 2 | Z535: 0 | AA535: 583 | AB535: 558 | AC535: 104.48028673835125 | AD535: 24
W536: MOORABBIN | X536: 5 | Y536: 2 | Z536: 1 | AA536: 601 | AB536: 484 | AC536: 124.17355371900827 | AD536: 22
A537: CAMBERWELL | C537: 2 | D537: 2 | E537: =C537*6+D537 -> 14 | G537: 6 | H537: 5 | I537: =G537*6+H537 -> 41 | K537: 10 | L537: 7 | M537: =K537*6+L537 -> 67 | O537: 12 | P537: 13 | Q537: =O537*6+P537 -> 85 | S537: CAMBERWELL | W537: PORT MELBOURNE | X537: 5 | Y537: 3 | Z537: 0 | AA537: 740 | AB537: 608 | AC537: 121.71052631578948 | AD537: 20
A538: MORDIALLOC | C538: 4 | D538: 3 | E538: =C538*6+D538 -> 27 | G538: 5 | H538: 4 | I538: =G538*6+H538 -> 34 | K538: 6 | L538: 6 | M538: =K538*6+L538 -> 42 | O538: 7 | P538: 11 | Q538: =O538*6+P538 -> 53 | S538: ALLEN | W538: COBURG | X538: 5 | Y538: 3 | Z538: 0 | AA538: 689 | AB538: 593 | AC538: 116.18887015177066 | AD538: 20
A539: BEST PLAYERS | W539: MORDIALLOC | X539: 4 | Y539: 3 | Z539: 1 | AA539: 500 | AB539: 558 | AC539: 89.605734767025083 | AD539: 18
A540: CAMBERWELL | C540: MASON | F540: B JOHNSON | I540: WHITTEN | L540: HIGSON | O540: ROSS | R540: BOX | W540: SANDRINGHAM | X540: 4 | Y540: 4 | Z540: 0 | AA540: 600 | AB540: 487 | AC540: 123.20328542094455 | AD540: 16
A541: MORDIALLOC | C541: MAUNDER | F541: EGERTON | I541: SHEEHAN | L541: BARR | O541: WILKINSON | R541: METCALF | W541: OAKLEIGH | X541: 2 | Y541: 6 | Z541: 0 | AA541: 559 | AB541: 512 | AC541: 109.1796875 | AD541: 8
A542: GOALKICKERS | W542: PRAHRAN | X542: 2 | Y542: 6 | Z542: 0 | AA542: 505 | AB542: 750 | AC542: 67.33 | AD542: 8
A543: CAMBERWELL | C543: HIGSON 5 | F543: McGUINNESS 2 | I543: YOUNG | K543: COLEMAN | M543: SABATUCCI | P543: WHITTEN | R543: SEYMOUR | W543: DANDENONG | X543: 2 | Y543: 6 | Z543: 0 | AA543: 466 | AB543: 737 | AC543: 63.229308005427406 | AD543: 8
A544: MORDIALLOC | C544: JOSE 2 | E544: WILKINSON 2 | H544: LASKEY | J544: LENNIE | L544: BAKER | W544: PRESTON | X544: 1 | Y544: 7 | Z544: 0 | AA544: 547 | AB544: 599 | AC544: 91.318864774624373 | AD544: 4
W545: BRIGHTON | X545: 1 | Y545: 7 | Z545: 0 | AA545: 420 | AB545: 812 | AC545: 51.724137931034484 | AD545: 4
A546: COBURG | C546: 4 | D546: 2 | E546: =C546*6+D546 -> 26 | G546: 6 | H546: 6 | I546: =G546*6+H546 -> 42 | K546: 9 | L546: 12 | M546: =K546*6+L546 -> 66 | O546: 13 | P546: 16 | Q546: =O546*6+P546 -> 94 | S546: PORT MELBOURNE | W546: NORTHCOTE | X546: 0 | Y546: 8 | Z546: 0 | AA546: 431 | AB546: 765 | AC546: 56.33986928104575 | AD546: 0
A547: PORT MELBOURNE | C547: 3 | D547: 4 | E547: =C547*6+D547 -> 22 | G547: 5 | H547: 6 | I547: =G547*6+H547 -> 36 | K547: 7 | L547: 9 | M547: =K547*6+L547 -> 51 | O547: 9 | P547: 12 | Q547: =O547*6+P547 -> 66 | S547: O'DONOGHUE
A548: BEST PLAYERS
A549: COBURG | C549: HORSKINS | F549: MAHONEY | I549: J BRENNAN | L549: HOOGEN | O549: HUNTINGTON | R549: BRIANT
A550: PORT MELBOURNE | C550: R ATKINSON | F550: WITHERS | I550: SYMONDS | L550: THOMPSON | O550: METHERALL | R550: SYKES
A551: GOALKICKERS
A552: COBURG | C552: J BRENNAN 4 | F552: HEWES 3 | I552: HOOGEN 3 | L552: HOLCOMBE | N552: SHAW | P552: HUNTINGTON
A553: PORT MELBOURNE | C553: SYMONDS 2 | F553: SYKES | H553: BONNETT | J553: WITHERS | L553: THOMPSON | O553: POWER | Q553: CAMERON | S553: MERRETT
A555: DANDENONG | C555: 3 | D555: 2 | E555: =C555*6+D555 -> 20 | G555: 7 | H555: 6 | I555: =G555*6+H555 -> 48 | K555: 7 | L555: 11 | M555: =K555*6+L555 -> 53 | O555: 8 | P555: 17 | Q555: =O555*6+P555 -> 65 | S555: DANDENONG
A556: OAKLEIGH | C556: 3 | D556: 4 | E556: =C556*6+D556 -> 22 | G556: 5 | H556: 7 | I556: =G556*6+H556 -> 37 | K556: 7 | L556: 12 | M556: =K556*6+L556 -> 54 | O556: 8 | P556: 15 | Q556: =O556*6+P556 -> 63 | S556: BREWER
A557: BEST PLAYERS
A558: DANDENONG | C558: JOHNSON | F558: LALOR | I558: LITTLE | L558: KNIGHT | O558: BASSETT | R558: TODD
A559: OAKLEIGH | C559: COUGHLAN | F559: D'ARCY | I559: NICHOLSON | L559: DONOHUE | O559: BOURKE | R559: WILLIAMS
A560: GOALKICKERS
A561: DANDENONG | C561: KNIGHT 2 | F561: LALOR 2 | I561: RICKMAN 2 | L561: TODD | N561: PENNEFATHER
A562: OAKLEIGH | C562: TOOHEY 2 | F562: NICHOLSON 2 | I562: PALMER | K562: WINTER | M562: LANE | O562: COUGHLAN
A564: YARRAVILLE | C564: 2 | D564: 10 | E564: =C564*6+D564 -> 22 | G564: 6 | H564: 12 | I564: =G564*6+H564 -> 48 | K564: 11 | L564: 16 | M564: =K564*6+L564 -> 82 | O564: 15 | P564: 19 | Q564: =O564*6+P564 -> 109 | S564: YARRAVILLE
A565: PRAHRAN | C565: 2 | D565: 2 | E565: =C565*6+D565 -> 14 | G565: 4 | H565: 4 | I565: =G565*6+H565 -> 28 | K565: 6 | L565: 4 | M565: =K565*6+L565 -> 40 | O565: 9 | P565: 5 | Q565: =O565*6+P565 -> 59 | S565: POLLARD
A566: BEST PLAYERS
A567: YARRAVILLE | C567: ROHLEDER | F567: O'HALLORAN | I567: VANDERFEEN | L567: FITZGERALD | O567: LETCHER | R567: DRINAN
A568: PRAHRAN | C568: O'BRYAN | F568: ALLEN | I568: RICKARDS | L568: BURLEY | O568: HARVEY | R568: HEAD
A569: GOALKICKERS
A570: YARRAVILLE | C570: GLEESON 3 | F570: VANDERFEEN 2 | J570: MAGEE 2 | M570: WEBB 2 | O570: CAREY 2 | Q570: ANDERSON | S570: LETCHER | W570: O'HALLORAN | X570: BARCLAY
A571: PRAHRAN | C571: MURRAY 2 | F571: BOYD 2 | H571: HOOPER 2 | J571: VURLOW | L571: YOUNG | N571: HARVEY
A573: SANDRINGHAM | C573: 2 | D573: 2 | E573: =C573*6+D573 -> 14 | G573: 6 | H573: 6 | I573: =G573*6+H573 -> 42 | K573: 11 | L573: 13 | M573: =K573*6+L573 -> 79 | O573: 17 | P573: 16 | Q573: =O573*6+P573 -> 118 | S573: ELSTERNWICK PARK
A574: BRIGHTON | C574: 1 | D574: 6 | E574: =C574*6+D574 -> 12 | G574: 3 | H574: 11 | I574: =G574*6+H574 -> 29 | K574: 4 | L574: 12 | M574: =K574*6+L574 -> 36 | O574: 5 | P574: 14 | Q574: =O574*6+P574 -> 44 | S574: GODING
A575: BEST PLAYERS
A576: SANDRINGHAM | C576: BOLAND | F576: STEELE | I576: WILLIAMS | L576: EVANS | O576: OAKLEY | R576: LINDSAY
A577: BRIGHTON | C577: BURSEY | F577: N MILLS | I577: ASHENHURST | L577: BROWNING | O577: MILNES | R577: MCCANN
A578: GOALKICKERS
A579: SANDRINGHAM | C579: ELLIS 7 | F579: OAKLEY 4 | I579: ECCLESTON 2 | L579: EVANS 2 | N579: FAULKHEAD | Q579: STEELE
A580: BRIGHTON | C580: HART 3 | F580: BROWNING | I580: N COOPER
A582: BRUNSWICK | C582: 2 | D582: 3 | E582: =C582*6+D582 -> 15 | G582: 8 | H582: 5 | I582: =G582*6+H582 -> 53 | K582: 11 | L582: 12 | M582: =K582*6+L582 -> 78 | O582: 16 | P582: 13 | Q582: =O582*6+P582 -> 109 | S582: BRUNSWICK
A583: NORTHCOTE | C583: 3 | D583: 3 | E583: =C583*6+D583 -> 21 | G583: 6 | H583: 2 | I583: =G583*6+H583 -> 38 | K583: 8 | L583: 2 | M583: =K583*6+L583 -> 50 | O583: 12 | P583: 5 | Q583: =O583*6+P583 -> 77 | S583: GWYNNE
A584: BEST PLAYERS
A585: BRUNSWICK | C585: JARMAN | F585: K DILLON | I585: HAYES | L585: BRENNAN | O585: EDWARDS | R585: McFARLANE
A586: NORTHCOTE | C586: WOOLNOUGH | F586: GERVASONI | I586: BROWN | L586: VAINS | O586: CHOATE | R586: McFARLANE
A587: GOALKICKERS
A588: BRUNSWICK | C588: HAYES 7 | F588: JARMAN 2 | I588: K DILLON 2 | L588: McFARLANE 2 | O588: R DILLON | Q588: GARDNER | S588: G STANLEY
A589: NORTHCOTE | C589: WIGNELL 3 | F589: BRETHERTON 2 | J589: BROWN 2 | L589: ALLEN | N589: WOOLNOUGH | Q589: VAINS | S589: CRIPPS | W589: GERVASONI
A591: WILLIAMSTOWN | C591: 5 | D591: 6 | E591: =C591*6+D591 -> 36 | G591: 7 | H591: 7 | I591: =G591*6+H591 -> 49 | K591: 13 | L591: 10 | M591: =K591*6+L591 -> 88 | O591: 15 | P591: 10 | Q591: =O591*6+P591 -> 100 | S591: PRESTON
A592: PRESTON | C592: 1 | D592: 2 | E592: =C592*6+D592 -> 8 | G592: 5 | H592: 4 | I592: =G592*6+H592 -> 34 | K592: 9 | L592: 4 | M592: =K592*6+L592 -> 58 | O592: 14 | P592: 9 | Q592: =O592*6+P592 -> 93 | S592: BLACKBURN
A593: BEST PLAYERS
A594: WILLIAMSTOWN | C594: CALLAHAN | F594: MARTIN | I594: SMITH | L594: REED | O594: R JONES | R594: E BEITZEL
A595: PRESTON | C595: FOOTE | F595: BERGIN | I595: DAWSON | L595: McLACHLAN | O595: RYMER | R595: WOOD
A596: GOALKICKERS
A597: WILLIAMSTOWN | C597: CULLINAN 4 | F597: REED 3 | I597: SMITH 3 | L597: WARD 2 | N597: CALLAHAN | Q597: R JONES | S597: O'CONNOR
A598: PRESTON | C598: BERGIN 4 | F598: RYMER 2 | I598: BRIERLEY 2 | L598: CUSACK 2 | N598: WOOD 2 | Q598: BRYAN | S598: CONSTABLE
A600: ROUND 9 | E600: 7TH JUNE | M600: WEATHER | P600: FINE | S600: PLAYED AT
C601: 1ST QTR | G601: 2ND QTR | K601: 3RD QTR | O601: FINAL | S601: WILLIAMSTOWN | X601: LADDER | AA601: ROUND | AC601: 9
A602: WILLIAMSTOWN | C602: 3 | D602: 7 | E602: =C602*6+D602 -> 25 | G602: 5 | H602: 9 | I602: =G602*6+H602 -> 39 | K602: 9 | L602: 12 | M602: =K602*6+L602 -> 66 | O602: 10 | P602: 13 | Q602: =O602*6+P602 -> 73 | S602: UMPIRE | W602: TEAM | X602: W | Y602: L | Z602: D | AA602: FOR | AB602: AGST | AC602: % | AD602: PTS
A603: BRUNSWICK | C603: 1 | D603: 5 | E603: =C603*6+D603 -> 11 | G603: 5 | H603: 7 | I603: =G603*6+H603 -> 37 | K603: 7 | L603: 10 | M603: =K603*6+L603 -> 52 | O603: 10 | P603: 12 | Q603: =O603*6+P603 -> 72 | S603: BREWER
A604: BEST PLAYERS | W604: WILLIAMSTOWN | X604: 8 | Y604: 1 | Z604: 0 | AA604: 771 | AB604: 615 | AC604: 125.37 | AD604: 32
A605: WILLIAMSTOWN | C605: EVANS | F605: WARD | I605: CALLAHAN | L605: COLQUHOUN | O605: MARTIN | R605: SMITH | W605: BOX HILL | X605: 7 | Y605: 2 | Z605: 0 | AA605: 832 | AB605: 481 | AC605: 172.97 | AD605: 28
A606: BRUNSWICK | C606: WHILEY | F606: N THOMPSON | I606: HOUSE | L606: EDWARDS | O606: K DILLON | R606: VELO | W606: YARRAVILLE | X606: 7 | Y606: 2 | Z606: 0 | AA606: 845 | AB606: 597 | AC606: 141.54 | AD606: 28
A607: GOALKICKERS | W607: CAMBERWELL | X607: 7 | Y607: 2 | Z607: 0 | AA607: 699 | AB607: 550 | AC607: 127.09090909090909 | AD607: 28
A608: WILLIAMSTOWN | C608: WARD 3 | F608: NEYLON 3 | I608: CALLAHAN | L608: O'CONNOR | N608: REED | P608: MARTIN
A609: BRUNSWICK | C609: WHILEY 3 | F609: K DILLON 2 | I609: L STANLEY 2 | L609: PHIPPS | N609: R DILLON | Q609: JARMAN | W609: PORT MELBOURNE | X609: 6 | Y609: 3 | Z609: 0 | AA609: 864 | AB609: 663 | AC609: 130.31674208144796 | AD609: 24
W610: MOORABBIN | X610: 5 | Y610: 2 | Z610: 2 | AA610: 676 | AB610: 559 | AC610: 120.93023255813954 | AD610: 24
A611: YARRAVILLE | C611: 5 | D611: 4 | E611: =C611*6+D611 -> 34 | G611: 8 | H611: 6 | I611: =G611*6+H611 -> 54 | K611: 14 | L611: 10 | M611: =K611*6+L611 -> 94 | O611: 16 | P611: 10 | Q611: =O611*6+P611 -> 106 | S611: COBURG | W611: BRUNSWICK | X611: 6 | Y611: 3 | Z611: 0 | AA611: 655 | AB611: 631 | AC611: 103.80348652931855 | AD611: 24
A612: COBURG | C612: 3 | D612: 2 | E612: =C612*6+D612 -> 20 | G612: 6 | H612: 6 | I612: =G612*6+H612 -> 42 | K612: 8 | L612: 8 | M612: =K612*6+L612 -> 56 | O612: 11 | P612: 15 | Q612: =O612*6+P612 -> 81 | S612: MARCY | W612: COBURG | X612: 5 | Y612: 4 | Z612: 0 | AA612: 770 | AB612: 699 | AC612: 110.15736766809728 | AD612: 20
A613: BEST PLAYERS | W613: SANDRINGHAM | X613: 4 | Y613: 4 | Z613: 1 | AA613: 675 | AB613: 562 | AC613: 120.10676156583629 | AD613: 18
A614: YARRAVILLE | C614: WEBB | F614: McTAGGART | I614: HART | L614: VANDERFEEN | O614: GLEESON | R614: CAREY | W614: MORDIALLOC | X614: 4 | Y614: 4 | Z614: 1 | AA614: 594 | AB614: 667 | AC614: 89.055472263868069 | AD614: 18
A615: COBURG | C615: MAHONEY | F615: SHAW | I615: YOUNG | L615: HORSKINS | O615: HEWES | R615: HUNTINGTON | W615: OAKLEIGH | X615: 3 | Y615: 6 | Z615: 0 | AA615: 618 | AB615: 566 | AC615: 109.18727915194346 | AD615: 12
A616: GOALKICKERS | W616: DANDENONG | X616: 3 | Y616: 6 | Z616: 0 | AA616: 575 | AB616: 831 | AC616: 69.193742478941033 | AD616: 12
A617: YARRAVILLE | C617: GLEESON 5 | F617: HART 3 | H617: WEBB 3 | J617: ANDERSON 2 | M617: VANDERFEEN 2 | P617: CAREY | W617: PRAHRAN | X617: 2 | Y617: 7 | Z617: 0 | AA617: 560 | AB617: 874 | AC617: 64.07 | AD617: 8
A618: COBURG | C618: HEWES 3 | E618: HUNTINGTON 2 | H618: HOOGEN 2 | J618: WILSON | L618: HOSKINS | N618: NEESON | P618: J BRENNAN | W618: PRESTON | X618: 1 | Y618: 8 | Z618: 0 | AA618: 631 | AB618: 688 | AC618: 91.715116279069761 | AD618: 4
W619: NORTHCOTE | X619: 1 | Y619: 8 | Z619: 0 | AA619: 520 | AB619: 849 | AC619: 61.248527679623088 | AD619: 4
A620: SANDRINGHAM | C620: 1 | D620: 1 | E620: =C620*6+D620 -> 7 | G620: 6 | H620: 7 | I620: =G620*6+H620 -> 43 | K620: 10 | L620: 10 | M620: =K620*6+L620 -> 70 | O620: 10 | P620: 15 | Q620: =O620*6+P620 -> 75 | S620: BEACH ROAD | W620: BRIGHTON | X620: 1 | Y620: 8 | Z620: 0 | AA620: 452 | AB620: 903 | AC620: 50.06 | AD620: 4
A621: MOORABBIN | C621: 3 | D621: 5 | E621: =C621*6+D621 -> 23 | G621: 3 | H621: 9 | I621: =G621*6+H621 -> 27 | K621: 7 | L621: 13 | M621: =K621*6+L621 -> 55 | O621: 10 | P621: 15 | Q621: =O621*6+P621 -> 75 | S621: POLLARD
A622: BEST PLAYERS
A623: SANDRINGHAM | C623: BOLAND | F623: K EVANS | I623: STEELE | K623: OAKLEY | N623: RICHARDS | Q623: JOHNSON
A624: MOORABBIN | C624: BOYD | F624: MORONEY | I624: TREZISE | K624: RENWICK | N624: WHALEBONE | Q624: MANIE
A625: GOALKICKERS
A626: SANDRINGHAM | C626: OAKLEY 4 | F626: K EVANS 2 | I626: STEELE 2 | K626: WEBSTER | M626: RICHARDS
A627: MOORABBIN | C627: RENWICK 4 | F627: CRAMERI 2 | I627: TREZISE | K627: WHALEBONE | N627: R EVANS | P627: HOY
A629: PORT MELBOURNE | C629: 6 | D629: 7 | E629: =C629*6+D629 -> 43 | G629: 9 | H629: 9 | I629: =G629*6+H629 -> 63 | K629: 18 | L629: 13 | M629: =K629*6+L629 -> 121 | O629: 18 | P629: 16 | Q629: =O629*6+P629 -> 124 | S629: TOORAK PARK
A630: PRAHRAN | C630: 0 | D630: 0 | E630: =C630*6+D630 -> 0 | G630: 3 | H630: 3 | I630: =G630*6+H630 -> 21 | K630: 3 | L630: 4 | M630: =K630*6+L630 -> 22 | O630: 8 | P630: 7 | Q630: =O630*6+P630 -> 55 | S630: GODING
A631: BEST PLAYERS
A632: PORT MELBOURNE | C632: WITHERS | F632: SYKES | I632: THOMPSON | L632: McMASTER | O632: LEWIS | R632: SYMONDS
A633: PRAHRAN | C633: HARVEY | F633: HART | I633: WHARTON | L633: BELFORD | O633: BOYD | R633: PEARSON
A634: GOALKICKERS
A635: PORT MELBOURNE | C635: THOMPSON 4 | F635: BONNETT 4 | I635: SYKES 4 | K635: SYMONDS 2 | N635: CLAXTON 2 | Q635: MONKS | S635: McDONALD
A636: PRAHRAN | C636: HART 3 | F636: HARVEY 2 | I636: DUNKERLEY | L636: VURLOW | N636: BOYD
A638: DANDENONG | C638: 3 | D638: 0 | E638: =C638*6+D638 -> 18 | G638: 11 | H638: 7 | I638: =G638*6+H638 -> 73 | K638: 12 | L638: 8 | M638: =K638*6+L638 -> 80 | O638: 16 | P638: 13 | Q638: =O638*6+P638 -> 109 | S638: MORDIALLOC
A639: MORDIALLOC | C639: 8 | D639: 5 | E639: =C639*6+D639 -> 53 | G639: 8 | H639: 6 | I639: =G639*6+H639 -> 54 | K639: 11 | L639: 10 | M639: =K639*6+L639 -> 76 | O639: 14 | P639: 10 | Q639: =O639*6+P639 -> 94 | S639: GWYNNE
A640: BEST PLAYERS
A641: DANDENONG | C641: GILLINGHAM | F641: RICKMAN | I641: PENNEFATHER | L641: LITTLE | O641: TODD | R641: PHIPPS
A642: MORDIALLOC | C642: PEARSON | F642: WILKINSON | I642: MAUNDER | L642: METCALF | O642: BARCLAY | R642: LASKEY
A643: GOALKICKERS
A644: DANDENONG | C644: PENNEFATHER 4 | F644: RICKMAN 3 | I644: DODD 3 | K644: KNIGHT 2 | M644: PHIPPS 2 | O644: MINOTTI
A645: MORDIALLOC | C645: PEARSON 3 | F645: LASKEY 3 | I645: WILKINSON 3 | L645: MAUNDER 2 | O645: LENNIE | Q645: BAKER | S645: CRANE
A647: NORTHCOTE | C647: 5 | D647: 1 | E647: =C647*6+D647 -> 31 | G647: 6 | H647: 5 | I647: =G647*6+H647 -> 41 | K647: 9 | L647: 7 | M647: =K647*6+L647 -> 61 | O647: 13 | P647: 11 | Q647: =O647*6+P647 -> 89 | S647: NORTHCOTE
A648: PRESTON | C648: 4 | D648: 1 | E648: =C648*6+D648 -> 25 | G648: 8 | H648: 5 | I648: =G648*6+H648 -> 53 | K648: 10 | L648: 10 | M648: =K648*6+L648 -> 70 | O648: 12 | P648: 12 | Q648: =O648*6+P648 -> 84 | S648: ALLEN
A649: BEST PLAYERS
A650: NORTHCOTE | C650: GERVASONI | F650: WOOLNOUGH | I650: TAYLOR | L650: BRETHERTON | O650: BARNES | R650: MCFARLANE
A651: PRESTON | C651: RYMER | F651: DAWSON | I651: HOWARD | L651: CUTLER | O651: FOOTE | R651: REYNOLDS
A652: GOALKICKERS
A653: NORTHCOTE | C653: BROWN 3 | F653: VAINS 3 | I653: BARNES 2 | L653: CRIPPS 2 | N653: WIGNELL | P653: WOOLNOUGH | S653: ALLEN
A654: PRESTON | C654: RYMER 4 | F654: WOOD 2 | I654: FOOTE 2 | L654: BERGIN | N654: BRIERLEY | P654: DAWSON | R654: CONSTABLE
A656: OAKLEIGH | C656: 1 | D656: 2 | E656: =C656*6+D656 -> 8 | G656: 2 | H656: 3 | I656: =G656*6+H656 -> 15 | K656: 5 | L656: 4 | M656: =K656*6+L656 -> 34 | O656: 8 | P656: 11 | Q656: =O656*6+P656 -> 59 | S656: OAKLEIGH
A657: CAMBERWELL | C657: 1 | D657: 4 | E657: =C657*6+D657 -> 10 | G657: 2 | H657: 10 | I657: =G657*6+H657 -> 22 | K657: 5 | L657: 17 | M657: =K657*6+L657 -> 47 | O657: 6 | P657: 18 | Q657: =O657*6+P657 -> 54 | S657: O'DONOGHUE
A658: BEST PLAYERS
A659: OAKLEIGH | C659: COUGHLAN | F659: WILLIAMS | I659: BACKMAN | L659: D'ARCY | O659: LONGNEY | R659: PRENDERGAST
A660: CAMBERWELL | C660: CLARKE | F660: McGUINNESS | I660: WHITTEN | L660: ROSS | O660: K JOHNSON | R660: SKALBERG
A661: GOALKICKERS
A662: OAKLEIGH | C662: D'ARCY 3 | F662: McGOWAN 2 | I662: NICHOLSON | L662: COUGHLAN | O662: DOWLING
A663: CAMBERWELL | C663: WHITTEN 3 | F663: McGUINNESS 3
A665: BOX HILL | C665: 4 | D665: 8 | E665: =C665*6+D665 -> 32 | G665: 6 | H665: 9 | I665: =G665*6+H665 -> 45 | K665: 7 | L665: 15 | M665: =K665*6+L665 -> 57 | O665: 12 | P665: 19 | Q665: =O665*6+P665 -> 91 | S665: BOX HILL
A666: BRIGHTON | C666: 0 | D666: 0 | E666: =C666*6+D666 -> 0 | G666: 2 | H666: 1 | I666: =G666*6+H666 -> 13 | K666: 3 | L666: 3 | M666: =K666*6+L666 -> 21 | O666: 4 | P666: 8 | Q666: =O666*6+P666 -> 32 | S666: ROWE
A667: BEST PLAYERS
A668: BOX HILL | C668: DEVERY | F668: PEARCE | I668: BURR | L668: BRAIN | O668: CRAIG | R668: JOHNSON
A669: BRIGHTON | C669: WOOLSTENCROFT | G669: N MILLS | I669: HEIMRICH | L669: CURRIE | O669: CRAIG | R669: W COOPER
A670: GOALKICKERS
A671: BOX HILL | C671: CARRICK 3 | F671: SAWATSKY 3 | I671: JOHNSON 2 | L671: BRAIN | N671: EADE | P671: WITNISH | R671: JONES
A672: BRIGHTON | C672: HART 2 | F672: N COOPER | I672: ASLING
A674: ROUND 10 | E674: 14TH JUNE | J674: WEATHER | M674: STRONG SOUTH WIND RAIN & HAIL | S674: PLAYED AT
C675: 1ST QTR | G675: 2ND QTR | K675: 3RD QTR | O675: FINAL | S675: BOX HILL
A676: BOX HILL | C676: 3 | D676: 4 | E676: =C676*6+D676 -> 22 | G676: 3 | H676: 5 | I676: =G676*6+H676 -> 23 | K676: 6 | L676: 11 | M676: =K676*6+L676 -> 47 | O676: 10 | P676: 12 | Q676: =O676*6+P676 -> 72 | S676: UMPIRE
A677: CAMBERWELL | C677: 2 | D677: 0 | E677: =C677*6+D677 -> 12 | G677: 4 | H677: 5 | I677: =G677*6+H677 -> 29 | K677: 7 | L677: 5 | M677: =K677*6+L677 -> 47 | O677: 10 | P677: 6 | Q677: =O677*6+P677 -> 66 | S677: BREWER | X677: LADDER | AA677: ROUND | AC677: 10
A678: BEST PLAYERS | W678: TEAM | X678: W | Y678: L | Z678: D | AA678: FOR | AB678: AGST | AC678: % | AD678: PTS
A679: BOX HILL | C679: CRAIG | F679: SAWATSKY | I679: LOVE | K679: PEARCE | N679: EADE | Q679: IRVINE
A680: CAMBERWELL | C680: COLEMAN | F680: B JOHNSON | I680: McISAAC | K680: SKALBERG | N680: ROSS | Q680: MASON | W680: WILLIAMSTOWN | X680: 9 | Y680: 1 | Z680: 0 | AA680: 851 | AB680: 676 | AC680: 125.89 | AD680: 36
A681: GOALKICKERS | W681: BOX HILL | X681: 8 | Y681: 2 | Z681: 0 | AA681: 904 | AB681: 547 | AC681: 165.26 | AD681: 32
A682: BOX HILL | C682: SAWATSKY 3 | F682: JOHNSON 2 | I682: BRAIN 2 | K682: BROWN | M682: PLUNKETT | P682: DRUERY | W682: YARRAVILLE | X682: 7 | Y682: 3 | Z682: 0 | AA682: 906 | AB682: 677 | AC682: 133.83 | AD682: 28
A683: CAMBERWELL | C683: HIGSON 5 | F683: WHITTEN | I683: MORAN | K683: AMERY | M683: ROSS | O683: McDONALD | W683: PORT MELBOURNE | X683: 7 | Y683: 3 | Z683: 0 | AA683: 917 | AB683: 700 | AC683: 131 | AD683: 28
A685: SANDRINGHAM | C685: 1 | D685: 2 | E685: =C685*6+D685 -> 8 | G685: 5 | H685: 13 | I685: =G685*6+H685 -> 43 | K685: 6 | L685: 13 | M685: =K685*6+L685 -> 49 | O685: 10 | P685: 16 | Q685: =O685*6+P685 -> 76 | S685: BEACH ROAD | W685: MOORABBIN | X685: 6 | Y685: 2 | Z685: 2 | AA685: 777 | AB685: 599 | AC685: 129.71619365609348 | AD685: 28
A686: MORDIALLOC | C686: 3 | D686: 5 | E686: =C686*6+D686 -> 23 | G686: 3 | H686: 5 | I686: =G686*6+H686 -> 23 | K686: 7 | L686: 10 | M686: =K686*6+L686 -> 52 | O686: 8 | P686: 14 | Q686: =O686*6+P686 -> 62 | S686: MARCY | W686: CAMBERWELL | X686: 7 | Y686: 3 | Z686: 0 | AA686: 765 | AB686: 622 | AC686: 122.9903536977492 | AD686: 28
A687: BEST PLAYERS | W687: COBURG | X687: 6 | Y687: 4 | Z687: 0 | AA687: 857 | AB687: 765 | AC687: 112.02614379084967 | AD687: 24
A688: SANDRINGHAM | C688: OAKLEY | F688: RICHARDS | I688: VANCE | K688: WEBSTER | N688: FAULKHEAD | Q688: SHRIVES | W688: BRUNSWICK | X688: 6 | Y688: 4 | Z688: 0 | AA688: 721 | AB688: 718 | AC688: 100.41782729805014 | AD688: 24
A689: MORDIALLOC | C689: O'NEILL | F689: EGERTON | I689: PEARSON | K689: CRANE | N689: BARCLAY | Q689: METCALF | W689: SANDRINGHAM | X689: 5 | Y689: 4 | Z689: 1 | AA689: 751 | AB689: 624 | AC689: 120.3525641025641 | AD689: 22
A690: GOALKICKERS | W690: MORDIALLOC | X690: 4 | Y690: 5 | Z690: 1 | AA690: 656 | AB690: 743 | AC690: 88.290713324360695 | AD690: 18
A691: SANDRINGHAM | C691: OAKLEY 2 | F691: STEELE 2 | I691: MURPHY 2 | L691: ELLIS | N691: LINDSAY | P691: VANCE | R691: WILLIAMS | W691: OAKLEIGH | X691: 4 | Y691: 6 | Z691: 0 | AA691: 770 | AB691: 691 | AC691: 111.43270622286541 | AD691: 16
A692: MORDIALLOC | C692: CRANE 3 | F692: BAKER 2 | I692: WILKINSON | L692: PEARSON | N692: MAUNDER | W692: PRAHRAN | X692: 3 | Y692: 7 | Z692: 0 | AA692: 628 | AB692: 916 | AC692: 68.56 | AD692: 12
W693: DANDENONG | X693: 3 | Y693: 7 | Z693: 0 | AA693: 615 | AB693: 932 | AC693: 65.987124463519308 | AD693: 12
A694: PRAHRAN | C694: 5 | D694: 4 | E694: =C694*6+D694 -> 34 | G694: 6 | H694: 7 | I694: =G694*6+H694 -> 43 | K694: 7 | L694: 13 | M694: =K694*6+L694 -> 55 | O694: 9 | P694: 14 | Q694: =O694*6+P694 -> 68 | S694: NORTHCOTE | W694: PRESTON | X694: 1 | Y694: 9 | Z694: 0 | AA694: 668 | AB694: 741 | AC694: 90.148448043184885 | AD694: 4
A695: NORTHCOTE | C695: 0 | D695: 0 | E695: =C695*6+D695 -> 0 | G695: 2 | H695: 4 | I695: =G695*6+H695 -> 16 | K695: 2 | L695: 5 | M695: =K695*6+L695 -> 17 | O695: 6 | P695: 6 | Q695: =O695*6+P695 -> 42 | S695: O'DONOGHUE | W695: NORTHCOTE | X695: 1 | Y695: 9 | Z695: 0 | AA695: 562 | AB695: 917 | AC695: 61.286804798255183 | AD695: 4
A696: BEST PLAYERS | W696: BRIGHTON | X696: 1 | Y696: 9 | Z696: 0 | AA696: 577 | AB696: 1055 | AC696: 54.69 | AD696: 4
A697: PRAHRAN | C697: HOOPER | F697: VURLOW | I697: ALLEN | L697: ROSS JONES | O697: DUNKERLEY | R697: PEARSON
A698: NORTHCOTE | C698: SMITH | F698: TAYLOR | I698: WOOLNOUGH | L698: HUSSEY | O698: GERVASONI | R698: ATKINSON
A699: GOALKICKERS
A700: PRAHRAN | C700: VURLOW 4 | F700: CALLESON 2 | I700: HARVEY | K700: HART | M700: McGEE
A701: NORTHCOTE | C701: CRIPPS 2 | F701: TAYLOR | H701: VAINS | J701: WIGNELL | L701: ATKINSON
A703: PORT MELBOURNE | C703: 2 | D703: 3 | E703: =C703*6+D703 -> 15 | G703: 3 | H703: 4 | I703: =G703*6+H703 -> 22 | K703: 7 | L703: 10 | M703: =K703*6+L703 -> 52 | O703: 7 | P703: 11 | Q703: =O703*6+P703 -> 53 | S703: PRESTON
A704: PRESTON | C704: 0 | D704: 2 | E704: =C704*6+D704 -> 2 | G704: 3 | H704: 6 | I704: =G704*6+H704 -> 24 | K704: 3 | L704: 7 | M704: =K704*6+L704 -> 25 | O704: 4 | P704: 13 | Q704: =O704*6+P704 -> 37 | S704: POLLARD
A705: BEST PLAYERS
A706: PORT MELBOURNE | C706: MONKS | F706: SYKES | I706: CLAXTON | L706: WITHERS | O706: METHERALL | R706: E ATKINSON
A707: PRESTON | C707: FOOTE | F707: BERGIN | I707: POTTER | L707: DAWSON | O707: RYMER | R707: HOWARD
A708: GOALKICKERS
A709: PORT MELBOURNE | C709: BONNETT 3 | F709: SYMONDS | I709: McMASTER | L709: CLAXTON | N709: CAMERON
A710: PRESTON | C710: WOOD 2 | F710: RYMER | H710: BERGIN
E711: 16TH JUNE | H711: QUEENS BIRTHDAY | L711: WEATHER | P711: FINE DULL
A712: WILLIAMSTOWN | C712: 0 | D712: 1 | E712: =C712*6+D712 -> 1 | G712: 5 | H712: 6 | I712: =G712*6+H712 -> 36 | K712: 8 | L712: 5 | M712: =K712*6+L712 -> 53 | O712: 11 | P712: 14 | Q712: =O712*6+P712 -> 80 | S712: WILLIAMSTOWN
A713: YARRAVILLE | C713: 3 | D713: 5 | E713: =C713*6+D713 -> 23 | G713: 4 | H713: 7 | I713: =G713*6+H713 -> 31 | K713: 7 | L713: 12 | M713: =K713*6+L713 -> 54 | O713: 8 | P713: 13 | Q713: =O713*6+P713 -> 61 | S713: ALLEN
A714: BEST PLAYERS
A715: WILLIAMSTOWN | C715: R JONES | F715: DAVIES | I715: EVANS | L715: E BEITZEL | O715: WARD | R715: OUTEN
A716: YARRAVILLE | C716: McTAGGART | F716: ROHLEDER | I716: MAGEE | L716: HART | O716: ARCHBOLD | R716: WILD
A717: GOALKICKERS
A718: WILLIAMSTOWN | C718: WARD 4 | F718: CULLINAN 2 | I718: BOURKE 2 | L718: SMITH 2 | N718: REED
A719: YARRAVILLE | C719: LETCHER | E719: GLEESON | G719: ROHLEDER | I719: ANDERSON | L719: MAGEE | N719: BOURKE | P719: VANDERFEEN | S719: CROOK
A721: COBURG | C721: 5 | D721: 5 | E721: =C721*6+D721 -> 35 | G721: 5 | H721: 11 | I721: =G721*6+H721 -> 41 | K721: 9 | L721: 18 | M721: =K721*6+L721 -> 72 | O721: 11 | P721: 21 | Q721: =O721*6+P721 -> 87 | S721: BRUNSWICK
A722: BRUNSWICK | C722: 3 | D722: 2 | E722: =C722*6+D722 -> 20 | G722: 5 | H722: 4 | I722: =G722*6+H722 -> 34 | K722: 5 | L722: 4 | M722: =K722*6+L722 -> 34 | O722: 10 | P722: 6 | Q722: =O722*6+P722 -> 66 | S722: ROWE
A723: BEST PLAYERS
A724: COBURG | C724: NEESON | F724: JORDAN | I724: HEWES | L724: J BRENNAN | O724: MAHONEY | R724: HUNTINGTON
A725: BRUNSWICK | C725: N THOMPSON | F725: WHILEY | I725: HAYES | L725: K DILLON | O725: R THOMPSON | R725: McFARLANE
A726: GOALKICKERS
A727: COBURG | C727: HEWES 6 | F727: JORDAN 2 | I727: SHAW | K727: HOOGEN | M727: J BRENNAN
A728: BRUNSWICK | C728: HAYES 4 | F728: K DILLON 2 | I728: McFARLANE 2 | L728: G STANLEY | O728: BARR
A730: MOORABBIN | C730: 5 | D730: 3 | E730: =C730*6+D730 -> 33 | G730: 7 | H730: 8 | I730: =G730*6+H730 -> 50 | K730: 10 | L730: 13 | M730: =K730*6+L730 -> 73 | O730: 14 | P730: 17 | Q730: =O730*6+P730 -> 101 | S730: MOORABBIN
A731: DANDENONG | C731: 2 | D731: 1 | E731: =C731*6+D731 -> 13 | G731: 4 | H731: 1 | I731: =G731*6+H731 -> 25 | K731: 4 | L731: 1 | M731: =K731*6+L731 -> 25 | O731: 6 | P731: 4 | Q731: =O731*6+P731 -> 40 | S731: GWYNNE
A732: BEST PLAYERS
A733: MOORABBIN | C733: MORONEY | F733: HOY | I733: CRAMERI | L733: BILLSON | O733: RENWICK | R733: FERGUSSON
A734: DANDENONG | C734: BASSETT | F734: JOHNSON | I734: RICKMAN | L734: MINOTTI | O734: KINNAIRD | R734: PETERS
A735: GOALKICKERS
A736: MOORABBIN | C736: HOY 3 | E736: MORONEY 2 | H736: BILLSON 2 | J736: RENWICK 2 | M736: WHALEBONE 2 | P736: CRAMERI | R736: ROSS | S736: TREZISE
A737: DANDENONG | C737: PENNEFATHER 2 | G737: LALOR 2 | I737: LITTLE | K737: PETERS
A739: OAKLEIGH | C739: 10 | D739: 3 | E739: =C739*6+D739 -> 63 | G739: 13 | H739: 9 | I739: =G739*6+H739 -> 87 | K739: 18 | L739: 18 | M739: =K739*6+L739 -> 126 | O739: 22 | P739: 20 | Q739: =O739*6+P739 -> 152 | S739: ELSTERNWICK PARK
A740: BRIGHTON | C740: 3 | D740: 3 | E740: =C740*6+D740 -> 21 | G740: 8 | H740: 6 | I740: =G740*6+H740 -> 54 | K740: 12 | L740: 9 | M740: =K740*6+L740 -> 81 | O740: 19 | P740: 11 | Q740: =O740*6+P740 -> 125 | S740: GIBBONS
A741: BEST PLAYERS
A742: OAKLEIGH | C742: COUGHALN | F742: COLLINS | I742: D'ARCY | L742: McGOWAN | O742: DONOHUE | R742: LONGNEY
A743: BRIGHTON | C743: HART | F743: CRAIG | I743: MAY | L743: BURSEY | O743: BROWNING | R743: COOPER
A744: GOALKICKERS
A745: OAKLEIGH | C745: McGOWAN 5 | F745: D'ARCY 3 | I745: ROBINSON 3 | L745: NICHOLSON 3 | O745: BOURKE 2 | Q745: LONGNEY 2 | S745: LEHNE 2 | W745: COUGHLAN | X745: DOWLING
A746: BRIGHTON | C746: HART 7 | E746: CRAIG 3 | G746: BURSEY 2 | I746: BROWNING 2 | L746: ASLING 2 | O746: ASHENHURST | R746: TURNBULL | T746: FOX
A748: ROUND 11 | E748: 21ST JUNE | J748: WEATHER | M748: STRONG NORTH WEST WIND | S748: PLAYED AT
C749: 1ST QTR | G749: 2ND QTR | K749: 3RD QTR | O749: FINAL | S749: PORT MELBOURNE
A750: WILLIAMSTOWN | C750: 1 | D750: 1 | E750: =C750*6+D750 -> 7 | G750: 1 | H750: 7 | I750: =G750*6+H750 -> 13 | K750: 3 | L750: 9 | M750: =K750*6+L750 -> 27 | O750: 7 | P750: 10 | Q750: =O750*6+P750 -> 52 | S750: UMPIRE | X750: LADDER | AA750: ROUND | AC750: 11
A751: PORT MELBOURNE | C751: 3 | D751: 2 | E751: =C751*6+D751 -> 20 | G751: 3 | H751: 2 | I751: =G751*6+H751 -> 20 | K751: 5 | L751: 9 | M751: =K751*6+L751 -> 39 | O751: 5 | P751: 9 | Q751: =O751*6+P751 -> 39 | S751: MARCY | W751: TEAM | X751: W | Y751: L | Z751: D | AA751: FOR | AB751: AGST | AC751: % | AD751: PTS
A752: BEST PLAYERS
A753: WILLIAMSTOWN | C753: E BEITZEL | F753: COLQUHOUN | I753: R JONES | L753: SIMS | O753: KENT | R753: SMITH | W753: WILLIAMSTOWN | X753: 10 | Y753: 1 | Z753: 0 | AA753: 903 | AB753: 715 | AC753: 126.29 | AD753: 40
A754: PORT MELBOURNE | C754: CLAXTON | F754: LEWIS | I754: SYMONDS | L754: R ATKINSON | O754: BOWEN | R754: WITHERS | W754: BOX HILL | X754: 9 | Y754: 2 | Z754: 0 | AA754: 994 | AB754: 608 | AC754: 163.49 | AD754: 36
A755: GOALKICKERS | W755: MOORABBIN | X755: 7 | Y755: 2 | Z755: 2 | AA755: 893 | AB755: 638 | AC755: 139.96865203761755 | AD755: 32
A756: WILLIAMSTOWN | C756: CULLINAN 2 | F756: DAVIES | H756: REED | J756: NEYLON | L756: EVANS | N756: WARD | W756: YARRAVILLE | X756: 8 | Y756: 3 | Z756: 0 | AA756: 970 | AB756: 718 | AC756: 135.1 | AD756: 32
A757: PORT MELBOURNE | C757: WITHERS 2 | F757: CLAXTON | I757: BONNETT | L757: SYMONDS
W758: PORT MELBOURNE | X758: 7 | Y758: 4 | Z758: 0 | AA758: 956 | AB758: 752 | AC758: 127.12765957446808 | AD758: 28
A759: SANDRINGHAM | C759: 6 | D759: 5 | E759: =C759*6+D759 -> 41 | G759: 7 | H759: 6 | I759: =G759*6+H759 -> 48 | K759: 14 | L759: 13 | M759: =K759*6+L759 -> 97 | O759: 14 | P759: 13 | Q759: =O759*6+P759 -> 97 | S759: CAMBERWELL | W759: CAMBERWELL | X759: 7 | Y759: 4 | Z759: 0 | AA759: 861 | AB759: 719 | AC759: 119.74965229485396 | AD759: 28
A760: CAMBERWELL | C760: 2 | D760: 2 | E760: =C760*6+D760 -> 14 | G760: 8 | H760: 10 | I760: =G760*6+H760 -> 58 | K760: 9 | L760: 11 | M760: =K760*6+L760 -> 65 | O760: 13 | P760: 18 | Q760: =O760*6+P760 -> 96 | S760: POLLARD | W760: COBURG | X760: 7 | Y760: 4 | Z760: 0 | AA760: 973 | AB760: 852 | AC760: 114.2018779342723 | AD760: 28
A761: BEST PLAYERS | W761: BRUNSWICK | X761: 7 | Y761: 4 | Z761: 0 | AA761: 850 | AB761: 799 | AC761: 106.38297872340425 | AD761: 28
A762: SANDRINGHAM | C762: EVANS | F762: OAKLEY | I762: MCLEAN | L762: RICHARDS | O762: CROFT | R762: VANCE | W762: SANDRINGHAM | X762: 6 | Y762: 4 | Z762: 1 | AA762: 848 | AB762: 720 | AC762: 117.77777777777777 | AD762: 26
A763: CAMBERWELL | C763: BOX | F763: YOUNG | I763: K JOHNSON | L763: McGUINNESS | O763: WHITTEN | R763: AMERY | W763: MORDIALLOC | X763: 5 | Y763: 5 | Z763: 1 | AA763: 745 | AB763: 801 | AC763: 93.008739076154811 | AD763: 22
A764: GOALKICKERS | W764: OAKLEIGH | X764: 4 | Y764: 7 | Z764: 0 | AA764: 809 | AB764: 807 | AC764: 100.24783147459728 | AD764: 16
A765: SANDRINGHAM | C765: OAKLEY 4 | E765: EVANS 2 | G765: VANCE 2 | I765: FAULKHEAD 2 | L765: CROFT | N765: STEELE | P765: WEBSTER | R765: RICHARDS | W765: PRAHRAN | X765: 3 | Y765: 8 | Z765: 0 | AA765: 709 | AB765: 1045 | AC765: 67.85 | AD765: 12
A766: CAMBERWELL | C766: WHITTEN 3 | F766: YOUNG 2 | H766: McGUINNESS 2 | K766: BOX | L766: COLEMAN | N766: AMERY | P766: RICE | Q766: CLARKE | S766: MOUNTAIN | W766: DANDENONG | X766: 3 | Y766: 8 | Z766: 0 | AA766: 676 | AB766: 1022 | AC766: 66.144814090019565 | AD766: 12
W767: PRESTON | X767: 1 | Y767: 10 | Z767: 0 | AA767: 755 | AB767: 857 | AC767: 88.098016336056006 | AD767: 4
A768: MOORABBIN | C768: 3 | D768: 2 | E768: =C768*6+D768 -> 20 | G768: 8 | H768: 8 | I768: =G768*6+H768 -> 56 | K768: 12 | L768: 13 | M768: =K768*6+L768 -> 85 | O768: 16 | P768: 20 | Q768: =O768*6+P768 -> 116 | S768: OAKLEIGH | W768: NORTHCOTE | X768: 1 | Y768: 10 | Z768: 0 | AA768: 603 | AB768: 981 | AC768: 61.467889908256879 | AD768: 4
A769: OAKLEIGH | C769: 4 | D769: 2 | E769: =C769*6+D769 -> 26 | G769: 5 | H769: 4 | I769: =G769*6+H769 -> 34 | K769: 5 | L769: 6 | M769: =K769*6+L769 -> 36 | O769: 5 | P769: 9 | Q769: =O769*6+P769 -> 39 | S769: ALLEN | W769: BRIGHTON | X769: 1 | Y769: 10 | Z769: 0 | AA769: 635 | AB769: 1144 | AC769: 55.51 | AD769: 4
A770: BEST PLAYERS
A771: MOORABBIN | C771: MORONEY | F771: WHALEBONE | I771: RENWICK | L771: MANIE | O771: MURPHY | R771: JONES
A772: OAKLEIGH | C772: NICHOLSON | F772: LANE | I772: LONGNEY | L772: BOURKE | O772: PRENDERGAST | R772: BACKMAN
A773: GOALKICKERS
A774: MOORABBIN | C774: RENWICK 7 | F774: MORONEY 3 | I774: MURPHY 2 | L774: JONES 2 | N774: WHALEBONE | Q774: MANIE
A775: OAKLEIGH | C775: NICHOLSON 3 | F775: LONGNEY | I775: DOWLING
A777: BRUNSWICK | C777: 3 | D777: 3 | E777: =C777*6+D777 -> 21 | G777: 13 | H777: 7 | I777: =G777*6+H777 -> 85 | K777: 14 | L777: 8 | M777: =K777*6+L777 -> 92 | O777: 19 | P777: 15 | Q777: =O777*6+P777 -> 129 | S777: TOORAK PARK
A778: PRAHRAN | C778: 5 | D778: 5 | E778: =C778*6+D778 -> 35 | G778: 6 | H778: 5 | I778: =G778*6+H778 -> 41 | K778: 11 | L778: 14 | M778: =K778*6+L778 -> 80 | O778: 11 | P778: 15 | Q778: =O778*6+P778 -> 81 | S778: GIBBONS
A779: BEST PLAYERS
A780: BRUNSWICK | C780: R THOMPSON | F780: WHILEY | I780: THORNTON | L780: K DILLON | O780: BRENNAN | R780: HAYES
A781: PRAHRAN | C781: HARVEY | F781: BELFORD | I781: PEARSON | L781: HOOPER | O781: BOYD | R781: CALLESON
A782: GOALKICKERS
A783: BRUNSWICK | C783: HAYES 5 | F783: BARR 3 | H783: WHILEY 3 | J783: K DILLON 2 | M783: McFARLANE 2 | P783: STANLEY 2 | R783: ROBSON | T783: JARMAN
A784: PRAHRAN | C784: HARVEY 3 | F784: CALLESON 3 | I784: VURLOW | K784: HART | M784: McGEE | O784: PEARSON | Q784: BOYD
A786: COBURG | C786: 4 | D786: 1 | E786: =C786*6+D786 -> 25 | G786: 6 | H786: 6 | I786: =G786*6+H786 -> 42 | K786: 10 | L786: 10 | M786: =K786*6+L786 -> 70 | O786: 17 | P786: 14 | Q786: =O786*6+P786 -> 116 | S786: COBURG
A787: PRESTON | C787: 5 | D787: 3 | E787: =C787*6+D787 -> 33 | G787: 8 | H787: 6 | I787: =G787*6+H787 -> 54 | K787: 10 | L787: 7 | M787: =K787*6+L787 -> 67 | O787: 13 | P787: 9 | Q787: =O787*6+P787 -> 87 | S787: BREWER
A788: BEST PLAYERS
A789: COBURG | C789: JORDAN | F789: J BRENNAN | I789: WILSON | L789: YOUNG | O789: KAYLL | R789: RYAN
A790: PRESTON | C790: CUSACK | F790: RYMER | I790: BRYAN | L790: BERGIN | O790: FOOTE | R790: BRIERLEY
A791: GOALKICKERS
A792: COBURG | C792: KAYLL 5 | E792: CUFFE 2 | G792: HEWES 2 | I792: J BRENNAN 2 | L792: MAHONEY 2 | O792: JORDAN | Q792: HOOGEN | R792: WILSON | T792: NEESON
A793: PRESTON | C793: RYMER 5 | E793: BERGIN 2 | G793: REYNOLDS 2 | J793: DAWSON | L793: BRIERLEY | N793: CONSTABLE | Q793: HASSETT
A795: MORDIALLOC | C795: 7 | D795: 8 | E795: =C795*6+D795 -> 50 | G795: 7 | H795: 8 | I795: =G795*6+H795 -> 50 | K795: 13 | L795: 11 | M795: =K795*6+L795 -> 89 | O795: 13 | P795: 11 | Q795: =O795*6+P795 -> 89 | S795: MORDIALLOC
A796: BRIGHTON | C796: 0 | D796: 2 | E796: =C796*6+D796 -> 2 | G796: 4 | H796: 9 | I796: =G796*6+H796 -> 33 | K796: 5 | L796: 10 | M796: =K796*6+L796 -> 40 | O796: 7 | P796: 16 | Q796: =O796*6+P796 -> 58 | S796: ROWE
A797: BEST PLAYERS
A798: MORDIALLOC | C798: METCALF | F798: BESANKO | J798: BAKER | M798: PEARSON | P798: LENNIE | S798: LASKEY
A799: BRIGHTON | C799: MAY | F799: WOOLSTENCROFT | J799: MCCANN | M799: MILNES | P799: BROWNING | S799: HART
A800: GOALKICKERS
A801: MORDIALLOC | C801: BAKER 5 | F801: BESANKO 3 | I801: PEARSON | K801: B McLORINAN | N801: METCALF | Q801: LENNIE | S801: WILKINSON
A802: BRIGHTON | C802: N COOPER 2 | F802: BURSEY | I802: MAY | K802: HART | M802: TURNBULL
A804: BOX HILL | C804: 2 | D804: 1 | E804: =C804*6+D804 -> 13 | G804: 7 | H804: 10 | I804: =G804*6+H804 -> 52 | K804: 10 | L804: 11 | M804: =K804*6+L804 -> 71 | O804: 12 | P804: 18 | Q804: =O804*6+P804 -> 90 | S804: DANDENONG
A805: DANDENONG | C805: 2 | D805: 2 | E805: =C805*6+D805 -> 14 | G805: 4 | H805: 2 | I805: =G805*6+H805 -> 26 | K805: 7 | L805: 6 | M805: =K805*6+L805 -> 48 | O805: 9 | P805: 7 | Q805: =O805*6+P805 -> 61 | S805: O'DONOGHUE
A806: BEST PLAYERS
A807: BOX HILL | C807: CARRICK | F807: LOVE | I807: SAWATSKY | L807: WHITE | O807: PLUNKETT | R807: JONES
A808: DANDENONG | C808: PENNEFATHER | F808: GUILLE | I808: KNIGHT | L808: TODD | O808: JOHNSON | R808: CRUTCHFIELD
A809: GOALKICKERS
A810: BOX HILL | C810: CARRICK 5 | F810: SAWATSKY 3 | I810: JONES | K810: EADE | M810: DEVERY | O810: JOHNSON
A811: DANDENONG | C811: PENNEFATHER 3 | F811: KNIGHT 2 | I811: CLOSE | K811: RICKMAN | M811: PHIPPS | O811: TODD
A813: YARRAVILLE | C813: 0 | D813: 2 | E813: =C813*6+D813 -> 2 | G813: 2 | H813: 14 | I813: =G813*6+H813 -> 26 | K813: 2 | L813: 15 | M813: =K813*6+L813 -> 27 | O813: 7 | P813: 22 | Q813: =O813*6+P813 -> 64 | S813: YARRAVILLE
A814: NORTHCOTE | C814: 3 | D814: 6 | E814: =C814*6+D814 -> 24 | G814: 3 | H814: 6 | I814: =G814*6+H814 -> 24 | K814: 5 | L814: 10 | M814: =K814*6+L814 -> 40 | O814: 5 | P814: 11 | Q814: =O814*6+P814 -> 41 | S814: GWYNNE
A815: BEST PLAYERS
A816: YARRAVILLE | C816: CAREY | F816: DRINAN | I816: McTAGGART | L816: MASON | O816: WILD | R816: BARCLAY
A817: NORTHCOTE | C817: WOOLNOUGH | F817: TAYLOR | I817: CRIPPS | L817: J VAINS | O817: McFARLANE | R817: MARCHANT
A818: GOALKICKERS
A819: YARRAVILLE | C819: GLEESON 2 | F819: CROOK 2 | I819: BARCLAY | K819: COLLINS | M819: BOURKE
A820: NORTHCOTE | C820: ALLEN | E820: MURPHY | G820: J VAINS | I820: CRIPPS | K820: WOOLNOUGH
A822: ROUND 12 | E822: 28TH JUNE | J822: WEATHER | M822: COLD HEAVY FOG RAIN | S822: PLAYED AT
C823: 1ST QTR | G823: 2ND QTR | K823: 3RD QTR | O823: FINAL | S823: BRUNSWICK | X823: LADDER | AA823: ROUND | AC823: 12
A824: BRUNSWICK | C824: 2 | D824: 4 | E824: =C824*6+D824 -> 16 | G824: 5 | H824: 8 | I824: =G824*6+H824 -> 38 | K824: 8 | L824: 8 | M824: =K824*6+L824 -> 56 | O824: 10 | P824: 10 | Q824: =O824*6+P824 -> 70 | S824: UMPIRE | W824: TEAM | X824: W | Y824: L | Z824: D | AA824: FOR | AB824: AGST | AC824: % | AD824: PTS
A825: YARRAVILLE | C825: 1 | D825: 6 | E825: =C825*6+D825 -> 12 | G825: 3 | H825: 8 | I825: =G825*6+H825 -> 26 | K825: 6 | L825: 12 | M825: =K825*6+L825 -> 48 | O825: 7 | P825: 15 | Q825: =O825*6+P825 -> 57 | S825: BREWER
A826: BEST PLAYERS | W826: BOX HILL | X826: 10 | Y826: 2 | Z826: 0 | AA826: 1096 | AB826: 653 | AC826: 167.84 | AD826: 40
A827: BRUNSWICK | C827: HOUSE | F827: EDWARDS | I827: THORNTON | L827: JARMAN | O827: HAYES | Q827: R DILLON | W827: WILLIAMSTOWN | X827: 10 | Y827: 2 | Z827: 0 | AA827: 983 | AB827: 801 | AC827: 122.72 | AD827: 40
A828: YARRAVILLE | C828: DRINAN | F828: GLEESON | I828: VANDERFEEN | L828: ARCHBOLD | O828: BARCLAY | Q828: McTAGGART | W828: MOORABBIN | X828: 8 | Y828: 2 | Z828: 2 | AA828: 987 | AB828: 660 | AC828: 149.54545454545453 | AD828: 36
A829: GOALKICKERS | W829: PORT MELBOURNE | X829: 8 | Y829: 4 | Z829: 0 | AA829: 1136 | AB829: 803 | AC829: 141.46948941469489 | AD829: 32
A830: BRUNSWICK | C830: R DILLON 4 | F830: HAYES 3 | I830: K DILLON | L830: ROBSON | N830: WHILEY
A831: YARRAVILLE | C831: GLEESON 3 | F831: BARCLAY 3 | I831: BROWN | W831: YARRAVILLE | X831: 8 | Y831: 4 | Z831: 0 | AA831: 1027 | AB831: 788 | AC831: 130.33 | AD831: 32
W832: CAMBERWELL | X832: 8 | Y832: 4 | Z832: 0 | AA832: 949 | AB832: 764 | AC832: 124.21465968586388 | AD832: 32
A833: COBURG | C833: 2 | D833: 5 | E833: =C833*6+D833 -> 17 | G833: 2 | H833: 12 | I833: =G833*6+H833 -> 24 | K833: 11 | L833: 18 | M833: =K833*6+L833 -> 84 | O833: 11 | P833: 20 | Q833: =O833*6+P833 -> 86 | S833: WILLIAMSTOWN | W833: COBURG | X833: 8 | Y833: 4 | Z833: 0 | AA833: 1059 | AB833: 932 | AC833: 113.62660944206009 | AD833: 32
A834: WILLIAMSTOWN | C834: 3 | D834: 4 | E834: =C834*6+D834 -> 22 | G834: 6 | H834: 13 | I834: =G834*6+H834 -> 49 | K834: 7 | L834: 15 | M834: =K834*6+L834 -> 57 | O834: 10 | P834: 20 | Q834: =O834*6+P834 -> 80 | S834: POLLARD | W834: BRUNSWICK | X834: 8 | Y834: 4 | Z834: 0 | AA834: 920 | AB834: 856 | AC834: 107.4766355140187 | AD834: 32
A835: BEST PLAYERS | W835: SANDRINGHAM | X835: 7 | Y835: 4 | Z835: 1 | AA835: 944 | AB835: 756 | AC835: 124.86772486772487 | AD835: 30
A836: COBURG | C836: JORDAN | F836: GOULLET | I836: YOUNG | L836: MATTHEWS | O836: HEWES | Q836: SHAW | W836: MORDIALLOC | X836: 5 | Y836: 6 | Z836: 1 | AA836: 767 | AB836: 895 | AC836: 85.69832402234637 | AD836: 22
A837: WILLIAMSTOWN | C837: CALLAHAN | F837: MARTIN | I837: R JONES | L837: WARD | O837: WOODS | Q837: CALQUHOUN | W837: OAKLEIGH | X837: 4 | Y837: 8 | Z837: 0 | AA837: 854 | AB837: 909 | AC837: 93.949394939493956 | AD837: 16
A838: GOALKICKERS | W838: PRAHRAN | X838: 3 | Y838: 9 | Z838: 0 | AA838: 774 | AB838: 1122 | AC838: 68.98 | AD838: 12
A839: COBURG | C839: HEWES 3 | F839: J BRENNAN 3 | I839: HOLCOMBE 3 | L839: KAYLL | N839: NEESON | W839: DANDENONG | X839: 3 | Y839: 9 | Z839: 0 | AA839: 712 | AB839: 1118 | AC839: 63.685152057245084 | AD839: 12
A840: WILLIAMSTOWN | C840: REED 3 | F840: WARD 3 | I840: CULLINAN 2 | L840: NEYLON | N840: DAVIES | W840: PRESTON | X840: 2 | Y840: 10 | Z840: 0 | AA840: 832 | AB840: 922 | AC840: 90.238611713665946 | AD840: 8
W841: NORTHCOTE | X841: 1 | Y841: 11 | Z841: 0 | AA841: 654 | AB841: 1161 | AC841: 56.330749354005171 | AD841: 4
A842: MOORABBIN | C842: 4 | D842: 2 | E842: =C842*6+D842 -> 26 | G842: 9 | H842: 4 | I842: =G842*6+H842 -> 58 | K842: 11 | L842: 6 | M842: =K842*6+L842 -> 72 | O842: 14 | P842: 10 | Q842: =O842*6+P842 -> 94 | S842: MOORABBIN | W842: BRIGHTON | X842: 1 | Y842: 11 | Z842: 0 | AA842: 680 | AB842: 1232 | AC842: 55.19 | AD842: 4
A843: MORDIALLOC | C843: 1 | D843: 2 | E843: =C843*6+D843 -> 8 | G843: 2 | H843: 4 | I843: =G843*6+H843 -> 16 | K843: 2 | L843: 8 | M843: =K843*6+L843 -> 20 | O843: 2 | P843: 10 | Q843: =O843*6+P843 -> 22 | S843: O'DONOGHUE
A844: BEST PLAYERS
A845: MOORABBIN | C845: MURPHY | F845: GILDER | I845: GREEN | L845: EVANS | O845: CRAMERI | R845: MORONEY
A846: MORDIALLOC | C846: BESANKO | F846: BARCLAY | I846: METCALF | L846: JOSE | O846: CRANE | R846: LASKEY
A847: GOALKICKERS
A848: MOORABBIN | C848: RENWICK 5 | F848: MANIE 3 | I848: CRAMERI 2 | L848: HOY | M848: JONES | O848: MORONEY | Q848: MURPHY
A849: MORDIALLOC | C849: BAKER | F849: WILKINSON
A851: BOX HILL | C851: 4 | D851: 2 | E851: =C851*6+D851 -> 26 | G851: 9 | H851: 7 | I851: =G851*6+H851 -> 61 | K851: 14 | L851: 10 | M851: =K851*6+L851 -> 94 | O851: 15 | P851: 12 | Q851: =O851*6+P851 -> 102 | S851: BOX HILL
A852: OAKLEIGH | C852: 1 | D852: 2 | E852: =C852*6+D852 -> 8 | G852: 1 | H852: 4 | I852: =G852*6+H852 -> 10 | K852: 3 | L852: 4 | M852: =K852*6+L852 -> 22 | O852: 6 | P852: 9 | Q852: =O852*6+P852 -> 45 | S852: GWYNNE
A853: BEST PLAYERS
A854: BOX HILL | C854: IRVINE | F854: BROWN | I854: DEVERY | L854: TAYLOR | O854: EADE | R854: CARRICK
A855: OAKLEIGH | C855: BACKMAN | F855: WOODS | I855: D'ARCY | L855: COUGHLAN | O855: BOURKE | R855: LANE
A856: GOALKICKERS
A857: BOX HILL | C857: CARRICK 6 | F857: DEVERY 4 | I857: BROWN 2 | K857: JONES 2 | M857: SAWATSKY
A858: OAKLEIGH | C858: ROBINSON | F858: BACKMAN | I858: McGOWAN | K858: DOWLING | M858: O'DONNELL | P858: COUGHLAN
A860: SANDRINGHAM | C860: 3 | D860: 5 | E860: =C860*6+D860 -> 23 | G860: 5 | H860: 9 | I860: =G860*6+H860 -> 39 | K860: 9 | L860: 12 | M860: =K860*6+L860 -> 66 | O860: 14 | P860: 12 | Q860: =O860*6+P860 -> 96 | S860: DANDENONG
A861: DANDENONG | C861: 1 | D861: 3 | E861: =C861*6+D861 -> 9 | G861: 2 | H861: 4 | I861: =G861*6+H861 -> 16 | K861: 4 | L861: 5 | M861: =K861*6+L861 -> 29 | O861: 5 | P861: 6 | Q861: =O861*6+P861 -> 36 | S861: ROWE
A862: BEST PLAYERS
A863: SANDRINGHAM | C863: RICHARDS | F863: EVANS | I863: McLEAN | L863: STEELE | O863: WILLIAMS | R863: VANCE
A864: DANDENONG | C864: TODD | F864: PHIPPS | I864: FRENCH | L864: JOHNSON | O864: KNIGHT | R864: MINOTTI
A865: GOALKICKERS
A866: SANDRINGHAM | C866: OAKLEY 4 | F866: STEELE 3 | I866: EVANS 2 | L866: VANCE | N866: FAULKHEAD | Q866: CROFT | S866: WILLIAMS | W866: LINDSAY
A867: DANDENONG | C867: TODD | E867: PHIPPS | G867: RICKMAN | J867: LITTLE | L867: KNIGHT
A869: PRESTON | C869: 2 | D869: 1 | E869: =C869*6+D869 -> 13 | G869: 4 | H869: 6 | I869: =G869*6+H869 -> 30 | K869: 7 | L869: 8 | M869: =K869*6+L869 -> 50 | O869: 11 | P869: 11 | Q869: =O869*6+P869 -> 77 | S869: PRESTON
A870: PRAHRAN | C870: 2 | D870: 1 | E870: =C870*6+D870 -> 13 | G870: 4 | H870: 1 | I870: =G870*6+H870 -> 25 | K870: 6 | L870: 4 | M870: =K870*6+L870 -> 40 | O870: 10 | P870: 5 | Q870: =O870*6+P870 -> 65 | S870: MARCY
A871: BEST PLAYERS
A872: PRESTON | C872: HOWARD | F872: MILBURN | I872: CUSACK | L872: McLACHLAN | O872: DAWSON | R872: RYMER
A873: PRAHRAN | C873: HEALEY | F873: CHRISTIAN | I873: DUNKERLEY | L873: SHALLVEY | O873: ROSS JONES | R873: ROY JONES
A874: GOALKICKERS
A875: PRESTON | C875: RYMER 4 | F875: COOPER 2 | I875: REYNOLDS | K875: BERGIN | M875: FOOTE | O875: CUTLER | Q875: BRIERLEY
A876: PRAHRAN | C876: CALLESON 2 | F876: POWELL 2 | I876: HARVEY | K876: VURLOW | M876: SHALLVEY | P876: BELFORD | R876: PEARSON | T876: WHARTON
A878: PORT MELBOURNE | C878: 7 | D878: 5 | E878: =C878*6+D878 -> 47 | G878: 15 | H878: 11 | I878: =G878*6+H878 -> 101 | K878: 23 | L878: 12 | M878: =K878*6+L878 -> 150 | O878: 27 | P878: 18 | Q878: =O878*6+P878 -> 180 | S878: PORT MELBOURNE
A879: NORTHCOTE | C879: 1 | D879: 0 | E879: =C879*6+D879 -> 6 | G879: 3 | H879: 2 | I879: =G879*6+H879 -> 20 | K879: 5 | L879: 2 | M879: =K879*6+L879 -> 32 | O879: 8 | P879: 3 | Q879: =O879*6+P879 -> 51 | S879: GIBBONS
A880: BEST PLAYERS
A881: PORT MELBOURNE | C881: BONNETT | F881: SYKES | I881: CLAXTON | L881: THOMPSON | O881: WITHERS | R881: R ATKINSON
A882: NORTHCOTE | C882: WOOLNOUGH | F882: FRENCHAM | I882: CRIPPS | L882: GERVASONI | O882: TAYLOR | R882: BROWN
A883: GOALKICKERS
A884: PORT MELBOURNE | C884: BONNETT 9 | F884: FREYER 5 | I884: SYKES 5 | K884: CLAXTON 4 | N884: THOMPSON 3 | Q884: McRAE
A885: NORTHCOTE | C885: CRIPPS 4 | F885: WOOLNOUGH 2 | J885: BARNES | M885: ALLEN
A887: CAMBERWELL | C887: 3 | D887: 3 | E887: =C887*6+D887 -> 21 | G887: 3 | H887: 6 | I887: =G887*6+H887 -> 24 | K887: 7 | L887: 16 | M887: =K887*6+L887 -> 58 | O887: 11 | P887: 22 | Q887: =O887*6+P887 -> 88 | S887: ELSTERNWICK PARK
A888: BRIGHTON | C888: 2 | D888: 4 | E888: =C888*6+D888 -> 16 | G888: 4 | H888: 6 | I888: =G888*6+H888 -> 30 | K888: 5 | L888: 7 | M888: =K888*6+L888 -> 37 | O888: 6 | P888: 9 | Q888: =O888*6+P888 -> 45 | S888: ALLEN
A889: BEST PLAYERS
A890: CAMBERWELL | C890: ROSS | F890: CLARKE | I890: B JOHNSON | L890: McISAAC | O890: WHITTEN | R890: BOX
A891: BRIGHTON | C891: CRAIG | F891: HART | I891: W COOPER | L891: KEENAN | O891: MAY | R891: WOOLSTENCROFT
A892: GOALKICKERS
A893: CAMBERWELL | C893: WHITTEN 4 | F893: CLARKE 2 | I893: McDONALD 2 | L893: ROSS | N893: COLEMAN | Q893: McGUINNES
A894: BRIGHTON | C894: CRAIG 2 | F894: HART | H894: HEIMRICH | J894: N COOPER | M894: ASLING
A896: ROUND 13 | E896: 19TH JULY | J896: WEATHER | O896: NORTH WIND FINE | S896: PLAYED AT
C897: 1ST QTR | G897: 2ND QTR | K897: 3RD QTR | O897: FINAL | S897: YARRAVILLE | X897: LADDER | AA897: ROUND | AC897: 13
A898: PORT MELBOURNE | C898: 3 | D898: 5 | E898: =C898*6+D898 -> 23 | G898: 7 | H898: 8 | I898: =G898*6+H898 -> 50 | K898: 10 | L898: 8 | M898: =K898*6+L898 -> 68 | O898: 11 | P898: 12 | Q898: =O898*6+P898 -> 78 | S898: UMPIRE | W898: TEAM | X898: W | Y898: L | Z898: D | AA898: FOR | AB898: AGST | AC898: % | AD898: PTS
A899: YARRAVILLE | C899: 3 | D899: 4 | E899: =C899*6+D899 -> 22 | G899: 4 | H899: 6 | I899: =G899*6+H899 -> 30 | K899: 8 | L899: 12 | M899: =K899*6+L899 -> 60 | O899: 9 | P899: 14 | Q899: =O899*6+P899 -> 68 | S899: O'DONOGHUE
A900: BEST PLAYERS | W900: WILLIAMSTOWN | X900: 11 | Y900: 2 | Z900: 0 | AA900: 1113 | AB900: 851 | AC900: 130.79 | AD900: 44
A901: PORT MELBOURNE | C901: BOWEN | E901: METHERALL | H901: E ATKINSON | K901: BONNETT | N901: THOMPSON | Q901: SYMONDS | W901: MOORABBIN | X901: 9 | Y901: 2 | Z901: 2 | AA901: 1157 | AB901: 720 | AC901: 160.69444444444446 | AD901: 40
A902: YARRAVILLE | C902: WILD | E902: WEBB | H902: CAREY | K902: MAGEE | N902: MASON | Q902: GLEESON | W902: BOX HILL | X902: 10 | Y902: 3 | Z902: 0 | AA902: 1149 | AB902: 737 | AC902: 155.9 | AD902: 40
A903: GOALKICKERS | W903: PORT MELBOURNE | X903: 9 | Y903: 4 | Z903: 0 | AA903: 1214 | AB903: 871 | AC903: 139.38002296211252 | AD903: 36
A904: PORT MELBOURNE | C904: BONNETT 5 | F904: McMASTER 2 | I904: LOCKHART | L904: SYMONDS | N904: THOMPSON | Q904: CLAXTON
A905: YARRAVILLE | C905: WEBB 3 | F905: CROOK 2 | I905: MAGEE 2 | L905: GLEESON 2 | W905: CAMBERWELL | X905: 9 | Y905: 4 | Z905: 0 | AA905: 1026 | AB905: 809 | AC905: 126.82323856613102 | AD905: 36
W906: SANDRINGHAM | X906: 8 | Y906: 4 | Z906: 1 | AA906: 1028 | AB906: 809 | AC906: 127.07045735475896 | AD906: 34
A907: SANDRINGHAM | C907: 5 | D907: 3 | E907: =C907*6+D907 -> 33 | G907: 8 | H907: 7 | I907: =G907*6+H907 -> 55 | K907: 10 | L907: 9 | M907: =K907*6+L907 -> 69 | O907: 12 | P907: 12 | Q907: =O907*6+P907 -> 84 | S907: BEACH ROAD | W907: BRUNSWICK | X907: 8 | Y907: 4 | Z907: 1 | AA907: 985 | AB907: 921 | AC907: 106.94896851248643 | AD907: 34
A908: BOX HILL | C908: 2 | D908: 0 | E908: =C908*6+D908 -> 12 | G908: 4 | H908: 1 | I908: =G908*6+H908 -> 25 | K908: 6 | L908: 2 | M908: =K908*6+L908 -> 38 | O908: 8 | P908: 5 | Q908: =O908*6+P908 -> 53 | S908: MARCY | W908: YARRAVILLE | X908: 8 | Y908: 5 | Z908: 0 | AA908: 1095 | AB908: 866 | AC908: 126.44 | AD908: 32
A909: BEST PLAYERS | W909: COBURG | X909: 8 | Y909: 5 | Z909: 0 | AA909: 1126 | AB909: 1006 | AC909: 111.93 | AD909: 32
A910: SANDRINGHAM | C910: WEBSTER | F910: McLEAN | I910: LORKIN | L910: CROFT | N910: EVANS | Q910: WILLIAMS | W910: MORDIALLOC | X910: 6 | Y910: 6 | Z910: 1 | AA910: 857 | AB910: 942 | AC910: 90.976645435244166 | AD910: 26
A911: BOX HILL | C911: BEARDMORE | F911: WHITE | I911: PLUNKETT | L911: EADE | N911: DEVERY | Q911: CARRICK | W911: OAKLEIGH | X911: 4 | Y911: 9 | Z911: 0 | AA911: 901 | AB911: 999 | AC911: 90.190190190190194 | AD911: 16
A912: GOALKICKERS | W912: PRAHRAN | X912: 4 | Y912: 9 | Z912: 0 | AA912: 848 | AB912: 1189 | AC912: 71.32 | AD912: 16
A913: SANDRINGHAM | C913: ECCLESTON 3 | F913: OAKLEY 3 | I913: WILLIAMS 2 | L913: STEELE 2 | N913: RANSOM | P913: VANCE | W913: DANDENONG | X913: 3 | Y913: 10 | Z913: 0 | AA913: 757 | AB913: 1195 | AC913: 63.347280334728033 | AD913: 12
A914: BOX HILL | C914: CARRICK 4 | F914: JOHNSON 2 | I914: JONES | K914: BRAIN | W914: PRESTON | X914: 2 | Y914: 10 | Z914: 1 | AA914: 897 | AB914: 987 | AC914: 90.881458966565347 | AD914: 10
W915: NORTHCOTE | X915: 1 | Y915: 12 | Z915: 0 | AA915: 704 | AB915: 1291 | AC915: 54.531371030209144 | AD915: 4
A916: PRAHRAN | C916: 0 | D916: 2 | E916: =C916*6+D916 -> 2 | G916: 1 | H916: 11 | I916: =G916*6+H916 -> 17 | K916: 4 | L916: 11 | M916: =K916*6+L916 -> 35 | O916: 10 | P916: 14 | Q916: =O916*6+P916 -> 74 | S916: TOORAK PARK | W916: BRIGHTON | X916: 1 | Y916: 12 | Z916: 0 | AA916: 740 | AB916: 1402 | AC916: 52.78 | AD916: 4
A917: COBURG | C917: 0 | D917: 5 | E917: =C917*6+D917 -> 5 | G917: 1 | H917: 7 | I917: =G917*6+H917 -> 13 | K917: 6 | L917: 13 | M917: =K917*6+L917 -> 49 | O917: 9 | P917: 13 | Q917: =O917*6+P917 -> 67 | S917: ALLEN
A918: BEST PLAYERS
A919: PRAHRAN | C919: HOOPER | F919: HORSFIELD | I919: HARVEY | L919: ASH | N919: ROSS JONES | Q919: HART
A920: COBURG | C920: GOULLET | F920: NEESON | I920: HUNTINGTON | L920: JORDAN | N920: WILSON | Q920: HEWES
A921: GOALKICKERS
A922: PRAHRAN | C922: HARVEY 2 | F922: HART | H922: SHALLVEY | J922: VURLOW | L922: SEEDY | N922: ROSS JONES | Q922: PEARSON | S922: HOOPER | W922: WHARTON
A923: COBURG | C923: HEWES 4 | F923: SHAW 2 | I923: NEESON | K923: GOULLET | N923: MATTHEWS
A925: MORDIALLOC | C925: 3 | D925: 2 | E925: =C925*6+D925 -> 20 | G925: 7 | H925: 6 | I925: =G925*6+H925 -> 48 | K925: 11 | L925: 8 | M925: =K925*6+L925 -> 74 | O925: 13 | P925: 12 | Q925: =O925*6+P925 -> 90 | S925: MORDIALLOC
A926: OAKLEIGH | C926: 0 | D926: 2 | E926: =C926*6+D926 -> 2 | G926: 0 | H926: 5 | I926: =G926*6+H926 -> 5 | K926: 1 | L926: 9 | M926: =K926*6+L926 -> 15 | O926: 6 | P926: 11 | Q926: =O926*6+P926 -> 47 | S926: GODING
A927: BEST PLAYERS
A928: MORDIALLOC | C928: CRANE | F928: BAKER | I928: BESANKO | L928: EGERTON | O928: BARR | R928: ANDREWS
A929: OAKLEIGH | C929: D'ARCY | F929: DONOHUE | I929: NICHOLSON | L929: BACKMAN | O929: COLLINS | R929: BOURKE
A930: GOALKICKERS
A931: MORDIALLOC | C931: BAKER 8 | F931: PEARSON 3 | I931: HOLYOAK | L931: WILKINSON
A932: OAKLEIGH | C932: GAY 3 | F932: KITTO | I932: BACKMAN | L932: KELLETT
A934: BRUNSWICK | C934: 1 | D934: 5 | E934: =C934*6+D934 -> 11 | G934: 3 | H934: 8 | I934: =G934*6+H934 -> 26 | K934: 8 | L934: 10 | M934: =K934*6+L934 -> 58 | O934: 9 | P934: 11 | Q934: =O934*6+P934 -> 65 | S934: BRUNSWICK
A935: PRESTON | C935: 1 | D935: 1 | E935: =C935*6+D935 -> 7 | G935: 3 | H935: 8 | I935: =G935*6+H935 -> 26 | K935: 4 | L935: 8 | M935: =K935*6+L935 -> 32 | O935: 9 | P935: 11 | Q935: =O935*6+P935 -> 65 | S935: POLLARD
A936: BEST PLAYERS
A937: BRUNSWICK | C937: VELO | F937: K DILLON | I937: EDWARDS | L937: HOUSE | O937: HAYES | R937: WHILEY
A938: PRESTON | C938: BERGIN | F938: MILBURN | I938: BRIERLEY | L938: HOWARD | O938: DAWSON | R938: LIVINGSTONE
A939: GOALKICKERS
A940: BRUNSWICK | C940: WHILEY 3 | F940: G STANLEY 2 | I940: K DILLON 2 | L940: HAYES | N940: R DILLON
A941: PRESTON | C941: REYNOLDS 2 | F941: CUTLER 2 | I941: RYMER | K941: BRIERLEY | M941: FOOTE | O941: GREEN | Q941: BERGIN
A943: CAMBERWELL | C943: 1 | D943: 7 | E943: =C943*6+D943 -> 13 | G943: 5 | H943: 12 | I943: =G943*6+H943 -> 42 | K943: 7 | L943: 16 | M943: =K943*6+L943 -> 58 | O943: 10 | P943: 17 | Q943: =O943*6+P943 -> 77 | S943: CAMBERWELL
A944: DANDENONG | C944: 0 | D944: 4 | E944: =C944*6+D944 -> 4 | G944: 2 | H944: 6 | I944: =G944*6+H944 -> 18 | K944: 3 | L944: 9 | M944: =K944*6+L944 -> 27 | O944: 6 | P944: 9 | Q944: =O944*6+P944 -> 45 | S944: GIBBONS
A945: BEST PLAYERS
A946: CAMBERWELL | C946: BOX | F946: CHAMBERS | I946: MASON | L946: McDONALD | O946: HIGSON | R946: CLARKE
A947: DANDENONG | C947: LALOR | F947: GILLINGHAM | I947: BASSETT | L947: FRENCH | O947: KENNY | R947: TODD
A948: GOALKICKERS
A949: CAMBERWELL | C949: MOUNTAIN 5 | F949: BOX | H949: RICE | J949: McDONALD | M949: COLEMAN | P949: AMERY
A950: DANDENONG | C950: TODD | E950: KNIGHT | H950: PHIPPS | J950: LALOR | M950: RICKMAN | P950: LITTLE
A952: WILLIAMSTOWN | C952: 4 | D952: 1 | E952: =C952*6+D952 -> 25 | G952: 10 | H952: 9 | I952: =G952*6+H952 -> 69 | K952: 14 | L952: 11 | M952: =K952*6+L952 -> 95 | O952: 19 | P952: 16 | Q952: =O952*6+P952 -> 130 | S952: NORTHCOTE
A953: NORTHCOTE | C953: 5 | D953: 1 | E953: =C953*6+D953 -> 31 | G953: 5 | H953: 3 | I953: =G953*6+H953 -> 33 | K953: 7 | L953: 8 | M953: =K953*6+L953 -> 50 | O953: 7 | P953: 8 | Q953: =O953*6+P953 -> 50 | S953: ROWE
A954: BEST PLAYERS
A955: WILLIAMSTOWN | C955: E BEITZEL | F955: BOURKE | I955: CALLAHAN | L955: CULLINAN | O955: COLQUHOUN | R955: WARD
A956: NORTHCOTE | C956: GERVASONI | F956: WOOLNOUGH | I956: TAYLOR | L956: BRETHERTON | O956: SMITH | R956: WRIGHT
A957: GOALKICKERS
A958: WILLIAMSTOWN | C958: CULLINAN 7 | F958: DAVIES 2 | I958: SMITH 2 | K958: WARD 2 | M958: F JONES 2 | O958: PELLY 2 | Q958: REED | R958: CALLAHAN
A959: NORTHCOTE | C959: GERVASONI 4 | F959: J VAINS 2 | I959: ALLEN
A961: MOORABBIN | C961: 2 | D961: 6 | E961: =C961*6+D961 -> 18 | G961: 8 | H961: 15 | I961: =G961*6+H961 -> 63 | K961: 20 | L961: 21 | M961: =K961*6+L961 -> 141 | O961: 24 | P961: 26 | Q961: =O961*6+P961 -> 170 | S961: ELSTERNWICK PARK
A962: BRIGHTON | C962: 2 | D962: 2 | E962: =C962*6+D962 -> 14 | G962: 3 | H962: 4 | I962: =G962*6+H962 -> 22 | K962: 4 | L962: 6 | M962: =K962*6+L962 -> 30 | O962: 9 | P962: 6 | Q962: =O962*6+P962 -> 60 | S962: BREWER
A963: BEST PLAYERS
A964: MOORABBIN | C964: MORONEY | F964: EVANS | I964: TREZISE | L964: J RYAN | O964: MANIE | R964: MASON
A965: BRIGHTON | C965: N MILLS | F965: ASLING | I965: MAY | L965: W COOPER | O965: BURSEY | R965: McCANN
A966: GOALKICKERS
A967: MOORABBIN | C967: RENWICK 8 | F967: MORONEY 5 | I967: WHALEBONE 3 | L967: CRAMERI 3 | N967: MURPHY 2 | Q967: J RYAN | S967: EVANS | W967: MANIE
A968: BRIGHTON | C968: N COOPER 2 | F968: CRAIG 2 | H968: HART 2 | J968: ASLING | L968: BROWNING | O968: MILNES
A970: ROUND 14 | E970: 26TH JULY | J970: WEATHER | O970: NORTH WIND | S970: PLAYED AT
C971: 1ST QTR | G971: 2ND QTR | K971: 3RD QTR | O971: FINAL | S971: MOORABBIN | X971: LADDER | AA971: ROUND | AC971: 14
A972: MOORABBIN | C972: 0 | D972: 3 | E972: =C972*6+D972 -> 3 | G972: 2 | H972: 5 | I972: =G972*6+H972 -> 17 | K972: 4 | L972: 7 | M972: =K972*6+L972 -> 31 | O972: 9 | P972: 10 | Q972: =O972*6+P972 -> 64 | S972: UMPIRE | W972: TEAM | X972: W | Y972: L | Z972: D | AA972: FOR | AB972: AGST | AC972: % | AD972: PTS
A973: CAMBERWELL | C973: 1 | D973: 3 | E973: =C973*6+D973 -> 9 | G973: 1 | H973: 4 | I973: =G973*6+H973 -> 10 | K973: 3 | L973: 9 | M973: =K973*6+L973 -> 27 | O973: 3 | P973: 9 | Q973: =O973*6+P973 -> 27 | S973: ROWE
A974: BEST PLAYERS | W974: WILLIAMSTOWN | X974: 12 | Y974: 2 | Z974: 0 | AA974: 1192 | AB974: 906 | AC974: 131.56 | AD974: 48
A975: MOORABBIN | C975: CRAMERI | F975: MURPHY | I975: J RYAN | L975: GREEN | O975: EVANS | Q975: MORONEY | W975: MOORABBIN | X975: 10 | Y975: 2 | Z975: 2 | AA975: 1221 | AB975: 747 | AC975: 163.45381526104418 | AD975: 44
A976: CAMBERWELL | C976: MASON | F976: ROSS | I976: B JOHNSON | L976: McDONALD | O976: RICE | Q976: SKALBERG | W976: BOX HILL | X976: 11 | Y976: 3 | Z976: 0 | AA976: 1215 | AB976: 778 | AC976: 156.17 | AD976: 44
A977: GOALKICKERS | W977: PORT MELBOURNE | X977: 10 | Y977: 4 | Z977: 0 | AA977: 1279 | AB977: 935 | AC977: 136.79144385026737 | AD977: 40
A978: MOORABBIN | C978: CRAMERI 3 | F978: MANIE 2 | I978: WHALEBONE | L978: RENWICK | N978: MORONEY | Q978: EVANS
A979: CAMBERWELL | C979: BOX | E979: McDONALD | H979: RICE | W979: SANDRINGHAM | X979: 9 | Y979: 4 | Z979: 1 | AA979: 1129 | AB979: 905 | AC979: 124.75138121546961 | AD979: 38
W980: CAMBERWELL | X980: 9 | Y980: 5 | Z980: 0 | AA980: 1053 | AB980: 873 | AC980: 120.61855670103093 | AD980: 36
A981: PORT MELBOURNE | C981: 2 | D981: 4 | E981: =C981*6+D981 -> 16 | G981: 4 | H981: 9 | I981: =G981*6+H981 -> 33 | K981: 4 | L981: 15 | M981: =K981*6+L981 -> 39 | O981: 8 | P981: 17 | Q981: =O981*6+P981 -> 65 | S981: PORT MELBOURNE | W981: COBURG | X981: 9 | Y981: 5 | Z981: 0 | AA981: 1226 | AB981: 1053 | AC981: 116.43 | AD981: 36
A982: BRUNSWICK | C982: 3 | D982: 2 | E982: =C982*6+D982 -> 20 | G982: 7 | H982: 3 | I982: =G982*6+H982 -> 45 | K982: 8 | L982: 6 | M982: =K982*6+L982 -> 54 | O982: 9 | P982: 10 | Q982: =O982*6+P982 -> 64 | S982: GODING | W982: BRUNSWICK | X982: 8 | Y982: 5 | Z982: 1 | AA982: 1049 | AB982: 986 | AC982: 106.3894523326572 | AD982: 34
A983: BEST PLAYERS | W983: YARRAVILLE | X983: 8 | Y983: 6 | Z983: 0 | AA983: 1159 | AB983: 939 | AC983: 123.43 | AD983: 32
A984: PORT MELBOURNE | C984: LOCKHART | F984: FREYER | I984: E ATKINSON | L984: WHITE | O984: BOWEN | R984: WITHERS | W984: MORDIALLOC | X984: 6 | Y984: 7 | Z984: 1 | AA984: 898 | AB984: 1008 | AC984: 89.087301587301582 | AD984: 26
A985: BRUNSWICK | C985: K DILLON | F985: WHILEY | I985: HOUSE | L985: McFARLANE | O985: N THOMPSON | R985: HAYES | W985: OAKLEIGH | X985: 4 | Y985: 10 | Z985: 0 | AA985: 997 | AB985: 1100 | AC985: 90.63636363636364 | AD985: 16
A986: GOALKICKERS | W986: PRAHRAN | X986: 4 | Y986: 10 | Z986: 0 | AA986: 903 | AB986: 1268 | AC986: 71.21 | AD986: 16
A987: PORT MELBOURNE | C987: FREYER 2 | F987: LAWSON 2 | I987: McMASTER | L987: THOMPSON | N987: SYKES | P987: LOCKHART | W987: PRESTON | X987: 3 | Y987: 10 | Z987: 1 | AA987: 970 | AB987: 1051 | AC987: 92.293054234062794 | AD987: 14
A988: BRUNSWICK | C988: K DILLON 4 | F988: PHIPPS | I988: ROBSON | K988: McFARLANE | N988: LINKINS | P988: G STANLEY | W988: DANDENONG | X988: 3 | Y988: 11 | Z988: 0 | AA988: 820 | AB988: 1270 | AC988: 64.566929133858267 | AD988: 12
W989: BRIGHTON | X989: 2 | Y989: 12 | Z989: 0 | AA989: 815 | AB989: 1465 | AC989: 55.63 | AD989: 8
A990: SANDRINGHAM | C990: 1 | D990: 3 | E990: =C990*6+D990 -> 9 | G990: 7 | H990: 5 | I990: =G990*6+H990 -> 47 | K990: 11 | L990: 9 | M990: =K990*6+L990 -> 75 | O990: 15 | P990: 11 | Q990: =O990*6+P990 -> 101 | S990: OAKLEIGH | W990: NORTHCOTE | X990: 1 | Y990: 13 | Z990: 0 | AA990: 751 | AB990: 1391 | AC990: 53.989935298346516 | AD990: 4
A991: OAKLEIGH | C991: 4 | D991: 7 | E991: =C991*6+D991 -> 31 | G991: 6 | H991: 8 | I991: =G991*6+H991 -> 44 | K991: 8 | L991: 9 | M991: =K991*6+L991 -> 57 | O991: 14 | P991: 12 | Q991: =O991*6+P991 -> 96 | S991: GIBBONS
A992: BEST PLAYERS
A993: SANDRINGHAM | C993: BOLAND | F993: RICHARDS | I993: RANSOM | L993: LORKIN | O993: EVANS | R993: McLEAN
A994: OAKLEIGH | C994: COLLINS | F994: D'ARCY | I994: DONOHUE | L994: F BAPTIST | O994: LONGNEY | R994: BOURKE
A995: GOALKICKERS
A996: SANDRINGHAM | C996: OAKLEY 4 | E996: RANSOM 2 | H996: WILLIAMS 2 | K996: LORKIN 2 | M996: WEBSTER | O996: ECCLESTON | R996: STEELE | S996: LINDSAY | W996: McLEAN
A997: OAKLEIGH | C997: NICHOLSON 3 | F997: BOURKE 2 | I997: GAY 2 | K997: LONGNEY 2 | N997: D'ARCY | P997: ROBINSON | R997: WAITES | S997: DONOHUE
A999: BOX HILL | C999: 2 | D999: 3 | E999: =C999*6+D999 -> 15 | G999: 3 | H999: 7 | I999: =G999*6+H999 -> 25 | K999: 4 | L999: 9 | M999: =K999*6+L999 -> 33 | O999: 9 | P999: 12 | Q999: =O999*6+P999 -> 66 | S999: BOX HILL
A1000: MORDIALLOC | C1000: 2 | D1000: 5 | E1000: =C1000*6+D1000 -> 17 | G1000: 3 | H1000: 6 | I1000: =G1000*6+H1000 -> 24 | K1000: 5 | L1000: 7 | M1000: =K1000*6+L1000 -> 37 | O1000: 5 | P1000: 11 | Q1000: =O1000*6+P1000 -> 41 | S1000: POLLARD
A1001: BEST PLAYERS
A1002: BOX HILL | C1002: WHITE | F1002: SAWATSKY | I1002: WRIGHT | L1002: LOVE | O1002: CRAIG | R1002: GOOCH
A1003: MORDIALLOC | C1003: BARCLAY | F1003: BESANKO | I1003: SHEEHAN | L1003: CRANE | O1003: EGERTON | R1003: ANDREW
A1004: GOALKICKERS
A1005: BOX HILL | C1005: BROWN 2 | F1005: SAWATSKY 2 | I1005: ELSWORTH | K1005: BRAIN | M1005: JOHNSON | O1005: CARRICK | Q1005: BLACKALL
A1006: MORDIALLOC | C1006: LASKEY 2 | F1006: LENNIE | H1006: DUFFIELD | K1006: BAKER
A1008: BRIGHTON | C1008: 3 | D1008: 1 | E1008: =C1008*6+D1008 -> 19 | G1008: 5 | H1008: 3 | I1008: =G1008*6+H1008 -> 33 | K1008: 7 | L1008: 10 | M1008: =K1008*6+L1008 -> 52 | O1008: 10 | P1008: 15 | Q1008: =O1008*6+P1008 -> 75 | S1008: DANDENONG
A1009: DANDENONG | C1009: 3 | D1009: 7 | E1009: =C1009*6+D1009 -> 25 | G1009: 4 | H1009: 8 | I1009: =G1009*6+H1009 -> 32 | K1009: 8 | L1009: 13 | M1009: =K1009*6+L1009 -> 61 | O1009: 8 | P1009: 15 | Q1009: =O1009*6+P1009 -> 63 | S1009: O'DONOGHUE
A1010: BEST PLAYERS
A1011: BRIGHTON | C1011: W COOPER | F1011: MAY | I1011: HART | L1011: CRAIG | O1011: BURSEY | R1011: N MILLS
A1012: DANDENONG | C1012: RICKMAN | F1012: TODD | I1012: GILLINGHAM | L1012: FRENCH | O1012: KENNY | R1012: HOWER
A1013: GOALKICKERS
A1014: BRIGHTON | C1014: CRAIG 3 | F1014: BURSEY 2 | I1014: HART 2 | K1014: BROWNING | N1014: ASLING | P1014: NEW
A1015: DANDENONG | C1015: LITTLE 2 | F1015: RICKMAN 2 | I1015: HOWER | K1015: OWEN | M1015: KENNY | O1015: PHIPPS
A1017: PRESTON | C1017: 2 | D1017: 0 | E1017: =C1017*6+D1017 -> 12 | G1017: 7 | H1017: 0 | I1017: =G1017*6+H1017 -> 42 | K1017: 8 | L1017: 0 | M1017: =K1017*6+L1017 -> 48 | O1017: 11 | P1017: 7 | Q1017: =O1017*6+P1017 -> 73 | S1017: PRESTON
A1018: YARRAVILLE | C1018: 2 | D1018: 8 | E1018: =C1018*6+D1018 -> 20 | G1018: 5 | H1018: 9 | I1018: =G1018*6+H1018 -> 39 | K1018: 7 | L1018: 15 | M1018: =K1018*6+L1018 -> 57 | O1018: 8 | P1018: 16 | Q1018: =O1018*6+P1018 -> 64 | S1018: ALLEN
A1019: BEST PLAYERS
A1020: PRESTON | C1020: FOOTE | F1020: BERGIN | I1020: CUSACK | L1020: BRIERLEY | O1020: GEAR | R1020: DAWSON
A1021: YARRAVILLE | C1021: BURNS | F1021: LETCHER | I1021: DRINAN | L1021: LAMONT | O1021: BROWN | R1021: MASON
A1022: GOALKICKERS
A1023: PRESTON | C1023: RYMER 3 | F1023: BERGIN 3 | I1023: GREEN 2 | K1023: FOOTE | M1023: McLACHLAN | P1023: DAWSON
A1024: YARRAVILLE | C1024: CAREY 3 | F1024: BROWN 2 | I1024: CROOK | K1024: BARCLAY | M1024: GLEESON
A1026: COBURG | C1026: 6 | D1026: 4 | E1026: =C1026*6+D1026 -> 40 | G1026: 8 | H1026: 6 | I1026: =G1026*6+H1026 -> 54 | K1026: 12 | L1026: 12 | M1026: =K1026*6+L1026 -> 84 | O1026: 14 | P1026: 16 | Q1026: =O1026*6+P1026 -> 100 | S1026: COBURG
A1027: NORTHCOTE | C1027: 0 | D1027: 2 | E1027: =C1027*6+D1027 -> 2 | G1027: 3 | H1027: 6 | I1027: =G1027*6+H1027 -> 24 | K1027: 3 | L1027: 6 | M1027: =K1027*6+L1027 -> 24 | O1027: 6 | P1027: 11 | Q1027: =O1027*6+P1027 -> 47 | S1027: MARCY
A1028: BEST PLAYERS
A1029: COBURG | C1029: HUNTINGTON | F1029: BIGELOW | I1029: JORDAN | L1029: J BRENNAN | O1029: SHAW | R1029: RUTLEDGE
A1030: NORTHCOTE | C1030: MARCHANT | F1030: COLLINS | I1030: GERVASONI | L1030: WOOLNOUGH | O1030: BRETHERTON | R1030: CRIPPS
A1031: GOALKICKERS
A1032: COBURG | C1032: HEWES 4 | F1032: HUNTINGTON 3 | J1032: J BRENNAN 3 | M1032: NEESON 2 | P1032: GOULLET | R1032: JORDAN
A1033: NORTHCOTE | C1033: CRIPPS 2 | F1033: GERVASONI | I1033: RYAN | K1033: COLLINS | M1033: BRETHERTON
A1035: WILLIAMSTOWN | C1035: 2 | D1035: 2 | E1035: =C1035*6+D1035 -> 14 | G1035: 5 | H1035: 7 | I1035: =G1035*6+H1035 -> 37 | K1035: 6 | L1035: 8 | M1035: =K1035*6+L1035 -> 44 | O1035: 11 | P1035: 13 | Q1035: =O1035*6+P1035 -> 79 | S1035: WILLIAMSTOWN
A1036: PRAHRAN | C1036: 3 | D1036: 3 | E1036: =C1036*6+D1036 -> 21 | G1036: 4 | H1036: 5 | I1036: =G1036*6+H1036 -> 29 | K1036: 7 | L1036: 7 | M1036: =K1036*6+L1036 -> 49 | O1036: 8 | P1036: 7 | Q1036: =O1036*6+P1036 -> 55 | S1036: GWYNNE
A1037: BEST PLAYERS
A1038: WILLIAMSTOWN | C1038: WARD | F1038: CALLAHAN | I1038: MARTIN | L1038: SMITH | O1038: MAZOURIS | R1038: R JONES
A1039: PRAHRAN | C1039: HOOPER | F1039: HARVEY | I1039: VURLOW | L1039: HORSFIELD | O1039: CHRISTIAN | R1039: ROSS JONES
A1040: GOALKICKERS
A1041: WILLIAMSTOWN | C1041: WARD 4 | F1041: SMITH 2 | I1041: R JONES | K1041: MAZOURIS | N1041: PELLY | P1041: B BEITZEL | R1041: CULLINAN
A1042: PRAHRAN | C1042: HARVEY 2 | F1042: SEEDY 2 | I1042: SHALLVEY | K1042: PEARSON | M1042: HORSFIELD | P1042: VURLOW
A1044: ROUND 15 | E1044: 2ND AUGUST | J1044: WEATHER | M1044: SOUTH WEST WIND CLOUDY BUT FINE | S1044: PLAYED AT
C1045: 1ST QTR | G1045: 2ND QTR | K1045: 3RD QTR | O1045: FINAL | S1045: BEACH ROAD | X1045: LADDER | AA1045: ROUND | AC1045: 15
A1046: WILLIAMSTOWN | C1046: 4 | D1046: 5 | E1046: =C1046*6+D1046 -> 29 | G1046: 10 | H1046: 7 | I1046: =G1046*6+H1046 -> 67 | K1046: 15 | L1046: 10 | M1046: =K1046*6+L1046 -> 100 | O1046: 20 | P1046: 14 | Q1046: =O1046*6+P1046 -> 134 | S1046: UMPIRE | W1046: TEAM | X1046: W | Y1046: L | Z1046: D | AA1046: FOR | AB1046: AGST | AC1046: % | AD1046: PTS
A1047: SANDRINGHAM | C1047: 5 | D1047: 1 | E1047: =C1047*6+D1047 -> 31 | G1047: 8 | H1047: 6 | I1047: =G1047*6+H1047 -> 54 | K1047: 13 | L1047: 9 | M1047: =K1047*6+L1047 -> 87 | O1047: 14 | P1047: 15 | Q1047: =O1047*6+P1047 -> 99 | S1047: ROACH
A1048: BEST PLAYERS | W1048: WILLIAMSTOWN | X1048: 13 | Y1048: 2 | Z1048: 0 | AA1048: 1326 | AB1048: 1005 | AC1048: 131.94 | AD1048: 52
A1049: WILLIAMSTOWN | C1049: COLQUHOUN | F1049: CULLINAN | I1049: RAMSAY | L1049: KENT | N1049: LIDDY | Q1049: MARTIN | W1049: BOX HILL | X1049: 12 | Y1049: 3 | Z1049: 0 | AA1049: 1299 | AB1049: 859 | AC1049: 151.22 | AD1049: 48
A1050: SANDRINGHAM | C1050: BOLAND | F1050: McLEAN | I1050: OAKLEY | L1050: WEBSTER | N1050: RICHARDS | Q1050: CROFT | W1050: MOORABBIN | X1050: 10 | Y1050: 3 | Z1050: 2 | AA1050: 1302 | AB1050: 842 | AC1050: 154.63182897862234 | AD1050: 44
A1051: GOALKICKERS | P1051: SMITH | W1051: PORT MELBOURNE | X1051: 11 | Y1051: 4 | Z1051: 0 | AA1051: 1394 | AB1051: 1008 | AC1051: 138.29365079365078 | AD1051: 44
A1052: WILLIAMSTOWN | C1052: CULLINAN 7 | F1052: PELLY 4 | H1052: J EVANS 2 | J1052: WARD | L1052: REED | M1052: RAMSAY | O1052: LIDDY | Q1052: B BEITZEL | S1052: MARTIN
A1053: SANDRINGHAM | C1053: OAKLEY 8 | F1053: CROFT 2 | I1053: LINDSAY | K1053: ECCLESTON | N1053: K EVANS | P1053: RANSOM | W1053: COBURG | X1053: 10 | Y1053: 5 | Z1053: 0 | AA1053: 1321 | AB1053: 1134 | AC1053: 116.49 | AD1053: 40
W1054: SANDRINGHAM | X1054: 9 | Y1054: 5 | Z1054: 1 | AA1054: 1228 | AB1054: 1039 | AC1054: 118.19056785370549 | AD1054: 38
A1055: PORT MELBOURNE | C1055: 2 | D1055: 4 | E1055: =C1055*6+D1055 -> 16 | G1055: 6 | H1055: 9 | I1055: =G1055*6+H1055 -> 45 | K1055: 11 | L1055: 11 | M1055: =K1055*6+L1055 -> 77 | O1055: 17 | P1055: 13 | Q1055: =O1055*6+P1055 -> 115 | S1055: PORT MELBOURNE | W1055: CAMBERWELL | X1055: 9 | Y1055: 6 | Z1055: 0 | AA1055: 1126 | AB1055: 988 | AC1055: 113.96761133603239 | AD1055: 36
A1056: CAMBERWELL | C1056: 5 | D1056: 4 | E1056: =C1056*6+D1056 -> 34 | G1056: 6 | H1056: 6 | I1056: =G1056*6+H1056 -> 42 | K1056: 8 | L1056: 11 | M1056: =K1056*6+L1056 -> 59 | O1056: 10 | P1056: 13 | Q1056: =O1056*6+P1056 -> 73 | S1056: MARCY | W1056: BRUNSWICK | X1056: 8 | Y1056: 6 | Z1056: 1 | AA1056: 1107 | AB1056: 1051 | AC1056: 105.32825880114177 | AD1056: 34
A1057: BEST PLAYERS | W1057: YARRAVILLE | X1057: 8 | Y1057: 7 | Z1057: 0 | AA1057: 1240 | AB1057: 1023 | AC1057: 121.21 | AD1057: 32
A1058: PORT MELBOURNE | C1058: R ATKINSON | F1058: MONKS | I1058: BONNETT | L1058: THOMPSON | O1058: BOWEN | Q1058: FREYER | W1058: MORDIALLOC | X1058: 7 | Y1058: 7 | Z1058: 1 | AA1058: 963 | AB1058: 1066 | AC1058: 90.33771106941839 | AD1058: 30
A1059: CAMBERWELL | C1059: AMERY | F1059: ROSS | I1059: McDONALD | L1059: RICE | O1059: McISAAC | Q1059: BOX | W1059: PRAHRAN | X1059: 5 | Y1059: 10 | Z1059: 0 | AA1059: 999 | AB1059: 1362 | AC1059: 73.35 | AD1059: 20
A1060: GOALKICKERS | W1060: PRESTON | X1060: 4 | Y1060: 10 | Z1060: 1 | AA1060: 1109 | AB1060: 1174 | AC1060: 94.463373083475304 | AD1060: 18
A1061: PORT MELBOURNE | C1061: BONNETT 5 | F1061: FREYER 4 | I1061: CLAXTON 3 | L1061: SYKES 2 | N1061: LOCKHART | Q1061: McMASTER | S1061: SYMONDS | W1061: OAKLEIGH | X1061: 4 | Y1061: 11 | Z1061: 0 | AA1061: 1091 | AB1061: 1196 | AC1061: 91.220735785953181 | AD1061: 16
A1062: CAMBERWELL | C1062: HIGSON 3 | F1062: McDONALD 3 | I1062: MORAN | K1062: WHITTEN | M1062: MOUNTAIN | P1062: COLEMAN | W1062: DANDENONG | X1062: 3 | Y1062: 12 | Z1062: 0 | AA1062: 943 | AB1062: 1409 | AC1062: 66.926898509581264 | AD1062: 12
W1063: NORTHCOTE | X1063: 2 | Y1063: 13 | Z1063: 0 | AA1063: 816 | AB1063: 1433 | AC1063: 56.943475226796927 | AD1063: 8
A1064: COBURG | C1064: 2 | D1064: 4 | E1064: =C1064*6+D1064 -> 16 | G1064: 7 | H1064: 7 | I1064: =G1064*6+H1064 -> 49 | K1064: 11 | L1064: 8 | M1064: =K1064*6+L1064 -> 74 | O1064: 14 | P1064: 11 | Q1064: =O1064*6+P1064 -> 95 | S1064: COBURG | W1064: BRIGHTON | X1064: 2 | Y1064: 13 | Z1064: 0 | AA1064: 857 | AB1064: 1530 | AC1064: 56.01 | AD1064: 8
A1065: MOORABBIN | C1065: 4 | D1065: 3 | E1065: =C1065*6+D1065 -> 27 | G1065: 6 | H1065: 7 | I1065: =G1065*6+H1065 -> 43 | K1065: 7 | L1065: 9 | M1065: =K1065*6+L1065 -> 51 | O1065: 11 | P1065: 15 | Q1065: =O1065*6+P1065 -> 81 | S1065: GODING
A1066: BEST PLAYERS
A1067: COBURG | C1067: YOUNG | F1067: BIGELOW | I1067: JORDAN | L1067: J BRENNAN | O1067: HOOGEN | R1067: WILSON
A1068: MOORABBIN | C1068: P EVANS | F1068: BOYD | I1068: GREEN | L1068: GILDER | O1068: MASON | R1068: WHALEBONE
A1069: GOALKICKERS
A1070: COBURG | C1070: JORDAN 4 | F1070: J BRENNAN 3 | I1070: GOULLET 2 | L1070: HUNTINGTON 2 | O1070: SHAW 2 | Q1070: HEWES
A1071: MOORABBIN | C1071: RENWICK 5 | F1071: MURPHY 2 | I1071: WHALEBONE 2 | L1071: McGAW | N1071: CRAMERI
A1073: BOX HILL | C1073: 4 | D1073: 0 | E1073: =C1073*6+D1073 -> 24 | G1073: 6 | H1073: 1 | I1073: =G1073*6+H1073 -> 37 | K1073: 8 | L1073: 4 | M1073: =K1073*6+L1073 -> 52 | O1073: 13 | P1073: 6 | Q1073: =O1073*6+P1073 -> 84 | S1073: BOX HILL
A1074: YARRAVILLE | C1074: 3 | D1074: 3 | E1074: =C1074*6+D1074 -> 21 | G1074: 8 | H1074: 8 | I1074: =G1074*6+H1074 -> 56 | K1074: 9 | L1074: 14 | M1074: =K1074*6+L1074 -> 68 | O1074: 11 | P1074: 15 | Q1074: =O1074*6+P1074 -> 81 | S1074: GIBBONS
A1075: BEST PLAYERS
A1076: BOX HILL | C1076: WITNISH | F1076: TAYLOR | I1076: BRAIN | L1076: GOOCH | O1076: LOVE | R1076: WRIGHT
A1077: YARRAVILLE | C1077: CROOK | F1077: McTAGGART | I1077: FITZGERALD | L1077: LETCHER | O1077: STONE | R1077: MAGEE
A1078: GOALKICKERS
A1079: BOX HILL | C1079: PLUNKETT 4 | F1079: BROWN 3 | I1079: BRAIN 2 | K1079: CRAIG | M1079: DEVERY | O1079: TAYLOR | Q1079: CARRICK
A1080: YARRAVILLE | C1080: CROOK 2 | F1080: GLEESON 2 | I1080: ANDERSON 2 | L1080: FITZGERALD | O1080: CAREY | Q1080: DRINAN | S1080: WEBB | T1080: ORANGE
A1082: MORDIALLOC | C1082: 1 | D1082: 1 | E1082: =C1082*6+D1082 -> 7 | G1082: 5 | H1082: 3 | I1082: =G1082*6+H1082 -> 33 | K1082: 8 | L1082: 7 | M1082: =K1082*6+L1082 -> 55 | O1082: 9 | P1082: 11 | Q1082: =O1082*6+P1082 -> 65 | S1082: BRUNSWICK
A1083: BRUNSWICK | C1083: 3 | D1083: 7 | E1083: =C1083*6+D1083 -> 25 | G1083: 5 | H1083: 12 | I1083: =G1083*6+H1083 -> 42 | K1083: 7 | L1083: 14 | M1083: =K1083*6+L1083 -> 56 | O1083: 7 | P1083: 16 | Q1083: =O1083*6+P1083 -> 58 | S1083: ALLEN
A1084: BEST PLAYERS
A1085: MORDIALLOC | C1085: JOSE | F1085: ORPHIN | I1085: DUFFIELD | L1085: LASKEY | O1085: SHEEHAN | R1085: CRANE
A1086: BRUNSWICK | C1086: K DILLON | F1086: HAYES | I1086: HOUSE | L1086: PHIPPS | O1086: LINKINS | R1086: BRENNAN
A1087: GOALKICKERS
A1088: MORDIALLOC | C1088: DUFFIELD 3 | F1088: CRAWFORD 2 | I1088: ORPHIN | K1088: MAUNDER | M1088: McLORINAN | P1088: BESANKO
A1089: BRUNSWICK | C1089: PHIPPS 3 | F1089: LINKINS 2 | I1089: K DILLON | L1089: HAYES
A1091: PRAHRAN | C1091: 1 | D1091: 2 | E1091: =C1091*6+D1091 -> 8 | G1091: 8 | H1091: 7 | I1091: =G1091*6+H1091 -> 55 | K1091: 10 | L1091: 9 | M1091: =K1091*6+L1091 -> 69 | O1091: 14 | P1091: 12 | Q1091: =O1091*6+P1091 -> 96 | S1091: OAKLEIGH
A1092: OAKLEIGH | C1092: 3 | D1092: 7 | E1092: =C1092*6+D1092 -> 25 | G1092: 4 | H1092: 9 | I1092: =G1092*6+H1092 -> 33 | K1092: 9 | L1092: 12 | M1092: =K1092*6+L1092 -> 66 | O1092: 13 | P1092: 16 | Q1092: =O1092*6+P1092 -> 94 | S1092: ROWE
A1093: BEST PLAYERS
A1094: PRAHRAN | C1094: HOOPER | F1094: HARVEY | I1094: WHARTON | L1094: CALLESON | O1094: HEALEY | R1094: CHRISTIAN
A1095: OAKLEIGH | C1095: F BAPTIST | F1095: BLACK | I1095: LONGNEY | L1095: BLACKMAN | O1095: DONOHUE | R1095: D'ARCY
A1096: GOALKICKERS
A1097: PRAHRAN | C1097: CALLESON 4 | F1097: VURLEY 2 | I1097: SEEDY 2 | K1097: PEARSON 2 | N1097: HEALEY | P1097: HART | R1097: WHARTON | T1097: HOOPER
A1098: OAKLEIGH | C1098: LONGNEY 4 | F1098: GAY 2 | I1098: D'ARCY 2 | K1098: COLLINS 2 | N1098: ROBINSON | Q1098: BOURKE | S1098: COUGHLAN
A1100: PRESTON | C1100: 6 | D1100: 5 | E1100: =C1100*6+D1100 -> 41 | G1100: 10 | H1100: 8 | I1100: =G1100*6+H1100 -> 68 | K1100: 16 | L1100: 14 | M1100: =K1100*6+L1100 -> 110 | O1100: 20 | P1100: 19 | Q1100: =O1100*6+P1100 -> 139 | S1100: DANDENONG
A1101: DANDENONG | C1101: 3 | D1101: 4 | E1101: =C1101*6+D1101 -> 22 | G1101: 10 | H1101: 8 | I1101: =G1101*6+H1101 -> 68 | K1101: 15 | L1101: 11 | M1101: =K1101*6+L1101 -> 101 | O1101: 18 | P1101: 15 | Q1101: =O1101*6+P1101 -> 123 | S1101: BREWER
A1102: BEST PLAYERS
A1103: PRESTON | C1103: CUTLER | F1103: BERGIN | I1103: FOOTE | L1103: WOOD | O1103: DAWSON | R1103: HOWARD
A1104: DANDENONG | C1104: HOWER | F1104: TODD | I1104: LALOR | L1104: JOHNSON | O1104: BEATTIE | R1104: KENNY
A1105: GOALKICKERS
A1106: PRESTON | C1106: CUTLER 7 | F1106: BERGIN 4 | I1106: COOPER 2 | K1106: HOWARD 2 | N1106: WOOD | P1106: REYNOLDS | R1106: GEAR | S1106: RYMER | W1106: BRIERLEY
A1107: DANDENONG | C1107: HOWER 6 | F1107: TODD 5 | I1107: BEATTIE 3 | L1107: KENNY 2 | N1107: LALOR | P1107: MINOTTI
A1109: NORTHCOTE | C1109: 3 | D1109: 4 | E1109: =C1109*6+D1109 -> 22 | G1109: 6 | H1109: 7 | I1109: =G1109*6+H1109 -> 43 | K1109: 8 | L1109: 8 | M1109: =K1109*6+L1109 -> 56 | O1109: 9 | P1109: 11 | Q1109: =O1109*6+P1109 -> 65 | S1109: NORTHCOTE
A1110: BRIGHTON | C1110: 1 | D1110: 2 | E1110: =C1110*6+D1110 -> 8 | G1110: 2 | H1110: 4 | I1110: =G1110*6+H1110 -> 16 | K1110: 2 | L1110: 9 | M1110: =K1110*6+L1110 -> 21 | O1110: 5 | P1110: 12 | Q1110: =O1110*6+P1110 -> 42 | S1110: POLLARD
A1111: BEST PLAYERS
A1112: NORTHCOTE | C1112: GERVASONI | F1112: WRIGHT | I1112: BRETHERTON | L1112: MARCHANT | O1112: SMITH | R1112: J VAINS
A1113: BRIGHTON | C1113: McCANN | F1113: N MILLS | I1113: W COOPER | L1113: ASLING | O1113: ELDERING | R1113: WOOLSTENCROFT
A1114: GOALKICKERS
A1115: NORTHCOTE | C1115: McFARLANE 2 | F1115: J VAINS | H1115: BRETHERTON | K1115: COLLINS | M1115: CRIPPS | O1115: MARCHANT | R1115: GERVASONI | T1115: WRIGHT
A1116: BRIGHTON | C1116: ASLING 2 | F1116: BROWNING | I1116: HART | K1116: BURSEY
A1118: ROUND 16 | E1118: 9TH AUGUST | J1118: WEATHER | O1118: NORTH WEST WIND | S1118: PLAYED AT
C1119: 1ST QTR | G1119: 2ND QTR | K1119: 3RD QTR | O1119: FINAL | S1119: MORDIALLOC
A1120: COBURG | C1120: 1 | D1120: 1 | E1120: =C1120*6+D1120 -> 7 | G1120: 8 | H1120: 7 | I1120: =G1120*6+H1120 -> 55 | K1120: 10 | L1120: 10 | M1120: =K1120*6+L1120 -> 70 | O1120: 13 | P1120: 16 | Q1120: =O1120*6+P1120 -> 94 | S1120: UMPIRE
A1121: MORDIALLOC | C1121: 7 | D1121: 5 | E1121: =C1121*6+D1121 -> 47 | G1121: 7 | H1121: 5 | I1121: =G1121*6+H1121 -> 47 | K1121: 8 | L1121: 10 | M1121: =K1121*6+L1121 -> 58 | O1121: 12 | P1121: 12 | Q1121: =O1121*6+P1121 -> 84 | S1121: ROACH | X1121: LADDER | AA1121: ROUND | AC1121: 16
A1122: BEST PLAYERS | W1122: TEAM | X1122: W | Y1122: L | Z1122: D | AA1122: FOR | AB1122: AGST | AC1122: % | AD1122: PTS
A1123: COBURG | C1123: SHAW | E1123: HUNTINGTON | H1123: RUTLEDGE | K1123: BIGELOW | N1123: BARNES | Q1123: JORDAN
A1124: MORDIALLOC | C1124: CRANE | E1124: ANDREW | H1124: MAUNDER | K1124: JOSE | N1124: LASKEY | Q1124: DUFFIELD | W1124: WILLIAMSTOWN | X1124: 14 | Y1124: 2 | Z1124: 0 | AA1124: 1437 | AB1124: 1039 | AC1124: 138.31 | AD1124: 56
A1125: GOALKICKERS | W1125: MOORABBIN | X1125: 11 | Y1125: 3 | Z1125: 2 | AA1125: 1396 | AB1125: 905 | AC1125: 154.25414364640883 | AD1125: 48
A1126: COBURG | C1126: HEWES 4 | E1126: GOULLET 2 | H1126: HUNTINGTON | K1126: NEESON | M1126: CARR | N1126: BRENNAN | P1126: BYRON | R1126: SHAW | S1126: JORDAN | W1126: PORT MELBOURNE | X1126: 12 | Y1126: 4 | Z1126: 0 | AA1126: 1544 | AB1126: 1049 | AC1126: 147.18779790276454 | AD1126: 48
A1127: MORDIALLOC | C1127: LASKEY 3 | F1127: DUFFIELD 3 | I1127: CRAWFORD 2 | L1127: BAKER 2 | N1127: B McLORINAN | Q1127: WILKINSON | W1127: BOX HILL | X1127: 12 | Y1127: 4 | Z1127: 0 | AA1127: 1364 | AB1127: 934 | AC1127: 146.04 | AD1127: 48
A1129: PRESTON | C1129: 0 | D1129: 3 | E1129: =C1129*6+D1129 -> 3 | G1129: 6 | H1129: 9 | I1129: =G1129*6+H1129 -> 45 | K1129: 7 | L1129: 11 | M1129: =K1129*6+L1129 -> 53 | O1129: 10 | P1129: 15 | Q1129: =O1129*6+P1129 -> 75 | S1129: PRESTON | W1129: COBURG | X1129: 11 | Y1129: 5 | Z1129: 0 | AA1129: 1415 | AB1129: 1218 | AC1129: 116.17 | AD1129: 44
A1130: BOX HILL | C1130: 5 | D1130: 3 | E1130: =C1130*6+D1130 -> 33 | G1130: 5 | H1130: 3 | I1130: =G1130*6+H1130 -> 33 | K1130: 8 | L1130: 9 | M1130: =K1130*6+L1130 -> 57 | O1130: 9 | P1130: 11 | Q1130: =O1130*6+P1130 -> 65 | S1130: O'DONOGHUE | W1130: SANDRINGHAM | X1130: 10 | Y1130: 5 | Z1130: 1 | AA1130: 1309 | AB1130: 1100 | AC1130: 119 | AD1130: 42
A1131: BEST PLAYERS | W1131: CAMBERWELL | X1131: 10 | Y1131: 6 | Z1131: 0 | AA1131: 1244 | AB1131: 1065 | AC1131: 116.8075117370892 | AD1131: 40
A1132: PRESTON | C1132: HOWARD | F1132: FOOTE | I1132: RYMER | L1132: BRYAN | O1132: BERGIN | R1132: REYNOLDS | W1132: YARRAVILLE | X1132: 9 | Y1132: 7 | Z1132: 0 | AA1132: 1348 | AB1132: 1072 | AC1132: 125.75 | AD1132: 36
A1133: BOX HILL | C1133: BEARDMORE | F1133: IRVINE | I1133: WITNISH | L1133: JOHNSON | O1133: DEVERY | R1133: WHITE | W1133: BRUNSWICK | X1133: 8 | Y1133: 7 | Z1133: 1 | AA1133: 1170 | AB1133: 1145 | AC1133: 102.18340611353712 | AD1133: 34
A1134: GOALKICKERS | W1134: MORDIALLOC | X1134: 7 | Y1134: 8 | Z1134: 1 | AA1134: 1047 | AB1134: 1160 | AC1134: 90.258620689655174 | AD1134: 30
A1135: PRESTON | C1135: REYNOLDS 2 | F1135: GREEN 2 | H1135: FOOTE | J1135: GEER | L1135: BERGIN | N1135: BRIERLEY | P1135: DAWSON | R1135: CUTLER | W1135: PRESTON | X1135: 5 | Y1135: 10 | Z1135: 1 | AA1135: 1184 | AB1135: 1239 | AC1135: 95.560936238902343 | AD1135: 22
A1136: BOX HILL | C1136: DEVERY 3 | F1136: JOHNSON 2 | I1136: PLUNKETT 2 | L1136: TYLER | N1136: GOOCH | W1136: PRAHRAN | X1136: 5 | Y1136: 11 | Z1136: 0 | AA1136: 1060 | AB1136: 1443 | AC1136: 73.46 | AD1136: 20
W1137: OAKLEIGH | X1137: 4 | Y1137: 12 | Z1137: 0 | AA1137: 1125 | AB1137: 1307 | AC1137: 86.074980872226476 | AD1137: 16
A1138: WILLIAMSTOWN | C1138: 3 | D1138: 3 | E1138: =C1138*6+D1138 -> 21 | G1138: 7 | H1138: 11 | I1138: =G1138*6+H1138 -> 53 | K1138: 10 | L1138: 13 | M1138: =K1138*6+L1138 -> 73 | O1138: 16 | P1138: 15 | Q1138: =O1138*6+P1138 -> 111 | S1138: WILLIAMSTOWN | W1138: DANDENONG | X1138: 3 | Y1138: 13 | Z1138: 0 | AA1138: 992 | AB1138: 1517 | AC1138: 65.39 | AD1138: 12
A1139: OAKLEIGH | C1139: 2 | D1139: 1 | E1139: =C1139*6+D1139 -> 13 | G1139: 2 | H1139: 1 | I1139: =G1139*6+H1139 -> 13 | K1139: 3 | L1139: 2 | M1139: =K1139*6+L1139 -> 20 | O1139: 5 | P1139: 4 | Q1139: =O1139*6+P1139 -> 34 | S1139: ALLEN | W1139: NORTHCOTE | X1139: 2 | Y1139: 14 | Z1139: 0 | AA1139: 893 | AB1139: 1551 | AC1139: 57.575757575757578 | AD1139: 8
A1140: BEST PLAYERS | W1140: BRIGHTON | X1140: 2 | Y1140: 14 | Z1140: 0 | AA1140: 898 | AB1140: 1680 | AC1140: 53.45 | AD1140: 8
A1141: WILLIAMSTOWN | C1141: MARTIN | F1141: LIDDY | I1141: PELLY | L1141: EVANS | O1141: CALLAHAN | R1141: WHITTAKER
A1142: OAKLEIGH | C1142: D'ARCY | F1142: F BAPTIST | I1142: ROBINSON | L1142: McCOUBRIE | O1142: DONOHUE | R1142: LEHNE
A1143: GOALKICKERS
A1144: WILLIAMSTOWN | C1144: PELLY 4 | F1144: CULLINAN 3 | I1144: F JONES 3 | K1144: CALLAHAN 2 | N1144: WARD | P1144: MARTIN | R1144: LIDDY | S1144: REED
A1145: OAKLEIGH | C1145: D'ARCY 4 | F1145: WINTER
A1147: PORT MELBOURNE | C1147: 1 | D1147: 2 | E1147: =C1147*6+D1147 -> 8 | G1147: 10 | H1147: 8 | I1147: =G1147*6+H1147 -> 68 | K1147: 15 | L1147: 10 | M1147: =K1147*6+L1147 -> 100 | O1147: 22 | P1147: 18 | Q1147: =O1147*6+P1147 -> 150 | S1147: ELSTERNWICK PARK
A1148: BRIGHTON | C1148: 1 | D1148: 5 | E1148: =C1148*6+D1148 -> 11 | G1148: 1 | H1148: 5 | I1148: =G1148*6+H1148 -> 11 | K1148: 3 | L1148: 10 | M1148: =K1148*6+L1148 -> 28 | O1148: 5 | P1148: 11 | Q1148: =O1148*6+P1148 -> 41 | S1148: BREWER
A1149: BEST PLAYERS
A1150: PORT MELBOURNE | C1150: LANDORFF | F1150: LEWIS | I1150: CLAXTON | L1150: LOCKHART | O1150: METHERALL | R1150: MONKS
A1151: BRIGHTON | C1151: W COOPER | F1151: CRAIG | I1151: BURSEY | L1151: N COOPER | O1151: MILNES | R1151: EBZERY
A1152: GOALKICKERS
A1153: PORT MELBOURNE | C1153: LOCKHART 5 | F1153: BONNETT 4 | I1153: CLAXTON 3 | L1153: THOMPSON 3 | O1153: SYMONDS 2 | R1153: SYKES 2 | T1153: E ATKINSON | X1153: MONKS | Z1153: WITHERS
A1154: BRIGHTON | C1154: WILLIAMS 2 | F1154: HUNTER | I1154: CRAIG | K1154: ELDERING
E1155: 16TH AUGUST | J1155: WEATHER | O1155: NORTH WEST WIND CLOUDY
A1156: MOORABBIN | C1156: 5 | D1156: 4 | E1156: =C1156*6+D1156 -> 34 | G1156: 8 | H1156: 4 | I1156: =G1156*6+H1156 -> 52 | K1156: 12 | L1156: 9 | M1156: =K1156*6+L1156 -> 81 | O1156: 14 | P1156: 10 | Q1156: =O1156*6+P1156 -> 94 | S1156: MOORABBIN
A1157: BRUNSWICK | C1157: 1 | D1157: 0 | E1157: =C1157*6+D1157 -> 6 | G1157: 4 | H1157: 3 | I1157: =G1157*6+H1157 -> 27 | K1157: 5 | L1157: 6 | M1157: =K1157*6+L1157 -> 36 | O1157: 9 | P1157: 9 | Q1157: =O1157*6+P1157 -> 63 | S1157: POLLARD
A1158: BEST PLAYERS
A1159: MOORABBIN | C1159: MURPHY | F1159: LAY | H1159: LEHMANN | K1159: MENNIE | N1159: CRAMERI | Q1159: TREZISE
A1160: BRUNSWICK | C1160: N THOMPSON | F1160: K DILLON | H1160: VELO | K1160: EDWARDS | N1160: HAYES | Q1160: McMAHON
A1161: GOALKICKERS
A1162: MOORABBIN | C1162: RENWICK 4 | F1162: P RYAN 2 | I1162: LAY 2 | K1162: CRAMERI 2 | N1162: EVANS | P1162: MURPHY | R1162: MENNIE | T1162: MASON
A1163: BRUNSWICK | C1163: VELO 3 | F1163: JARMAN 3 | I1163: K DILLON | K1163: HAYES | M1163: EDWARDS
A1165: SANDRINGHAM | C1165: 5 | D1165: 0 | E1165: =C1165*6+D1165 -> 30 | G1165: 6 | H1165: 2 | I1165: =G1165*6+H1165 -> 38 | K1165: 11 | L1165: 7 | M1165: =K1165*6+L1165 -> 73 | O1165: 12 | P1165: 9 | Q1165: =O1165*6+P1165 -> 81 | S1165: TOORAK PARK
A1166: PRAHRAN | C1166: 0 | D1166: 0 | E1166: =C1166*6+D1166 -> 0 | G1166: 5 | H1166: 5 | I1166: =G1166*6+H1166 -> 35 | K1166: 5 | L1166: 5 | M1166: =K1166*6+L1166 -> 35 | O1166: 9 | P1166: 7 | Q1166: =O1166*6+P1166 -> 61 | S1166: MARCY
A1167: BEST PLAYERS
A1168: SANDRINGHAM | C1168: CROFT | F1168: STEELE | H1168: McLEAN | K1168: BOLAND | N1168: FAULKHEAD | Q1168: RICHARDS
A1169: PRAHRAN | C1169: PEARSON | F1169: SEEDY | H1169: DUNKERLEY | K1169: HARVEY | N1169: MOULTON | Q1169: WHARTON
A1170: GOALKICKERS
A1171: SANDRINGHAM | C1171: STEELE 4 | F1171: ECCLESTON 2 | I1171: OAKLEY 2 | L1171: VANCE 2 | N1171: EVANS | P1171: LINDSAY
A1172: PRAHRAN | C1172: WHARTON 3 | F1172: HART 2 | H1172: SEEDY | J1172: CALLESON | M1172: VURLOW | O1172: HOOPER
A1174: YARRAVILLE | C1174: 7 | D1174: 5 | E1174: =C1174*6+D1174 -> 47 | G1174: 9 | H1174: 6 | I1174: =G1174*6+H1174 -> 60 | K1174: 11 | L1174: 19 | M1174: =K1174*6+L1174 -> 85 | O1174: 14 | P1174: 24 | Q1174: =O1174*6+P1174 -> 108 | S1174: YARRAVILLE
A1175: DANDENONG | C1175: 0 | D1175: 0 | E1175: =C1175*6+D1175 -> 0 | G1175: 4 | H1175: 4 | I1175: =G1175*6+H1175 -> 28 | K1175: 4 | L1175: 4 | M1175: =K1175*6+L1175 -> 28 | O1175: 7 | P1175: 7 | Q1175: =O1175*6+P1175 -> 49 | S1175: ROWE
A1176: BEST PLAYERS
A1177: YARRAVILLE | C1177: LAMONT | F1177: DRINAN | I1177: ARCHBOLD | L1177: MASON | O1177: PHILLIPS | R1177: VANDERFEEN
A1178: DANDENONG | C1178: JOHNSON | F1178: LALOR | I1178: KINNAIRD | L1178: WILLIAMS | O1178: TODD | R1178: BASSETT
A1179: GOALKICKERS
A1180: YARRAVILLE | C1180: VANDERFEEN 4 | F1180: WEBB 3 | I1180: PHILLIPS 2 | L1180: GLEESON 2 | O1180: CAREY | Q1180: MAGEE | S1180: HAWKINS
A1181: DANDENONG | C1181: KENNY | E1181: PHIPPS | G1181: TURNER | I1181: LALOR | K1181: TODD | M1181: MINOTTI | O1181: BEATTIE
A1183: CAMBERWELL | C1183: 1 | D1183: 3 | E1183: =C1183*6+D1183 -> 9 | G1183: 6 | H1183: 8 | I1183: =G1183*6+H1183 -> 44 | K1183: 10 | L1183: 13 | M1183: =K1183*6+L1183 -> 73 | O1183: 17 | P1183: 16 | Q1183: =O1183*6+P1183 -> 118 | S1183: CAMBERWELL
A1184: NORTHCOTE | C1184: 4 | D1184: 6 | E1184: =C1184*6+D1184 -> 30 | G1184: 8 | H1184: 6 | I1184: =G1184*6+H1184 -> 54 | K1184: 10 | L1184: 10 | M1184: =K1184*6+L1184 -> 70 | O1184: 11 | P1184: 11 | Q1184: =O1184*6+P1184 -> 77 | S1184: GODING
A1185: BEST PLAYERS
A1186: CAMBERWELL | C1186: ROSS | E1186: K JOHNSON | I1186: HIGSON | L1186: WHITTEN | O1186: MORAN | R1186: MOUNTAIN
A1187: NORTHCOTE | C1187: RYAN | E1187: WOOLNOUGH | I1187: GERVASONI | L1187: CRIPPS | O1187: BRETHERTON | R1187: J VAINS
A1188: GOALKICKERS
A1189: CAMBERWELL | C1189: SEYMOUR 4 | F1189: MOUNTAIN 3 | I1189: McGUINNESS 3 | L1189: COLEMAN 3 | O1189: WHITTEN 2 | R1189: BOX | S1189: SKALBERG
A1190: NORTHCOTE | C1190: MULCAHY 3 | F1190: ALLEN 2 | I1190: BROWN 2 | K1190: CRIPPS 2 | M1190: COLLINS | O1190: FRENCHAM
A1192: ROUND 17 | E1192: 23RD AUGUST | J1192: WEATHER | O1192: DULL | S1192: PLAYED AT
C1193: 1ST QTR | G1193: 2ND QTR | K1193: 3RD QTR | O1193: FINAL | S1193: WILLIAMSTOWN | X1193: LADDER | AA1193: ROUND | AC1193: 17
A1194: MOORABBIN | C1194: 1 | D1194: 5 | E1194: =C1194*6+D1194 -> 11 | G1194: 5 | H1194: 6 | I1194: =G1194*6+H1194 -> 36 | K1194: 8 | L1194: 10 | M1194: =K1194*6+L1194 -> 58 | O1194: 10 | P1194: 10 | Q1194: =O1194*6+P1194 -> 70 | S1194: UMPIRE | W1194: TEAM | X1194: W | Y1194: L | Z1194: D | AA1194: FOR | AB1194: AGST | AC1194: % | AD1194: PTS
A1195: WILLIAMSTOWN | C1195: 1 | D1195: 4 | E1195: =C1195*6+D1195 -> 10 | G1195: 5 | H1195: 9 | I1195: =G1195*6+H1195 -> 39 | K1195: 6 | L1195: 10 | M1195: =K1195*6+L1195 -> 46 | O1195: 8 | P1195: 15 | Q1195: =O1195*6+P1195 -> 63 | S1195: O'DONOGHUE
A1196: BEST PLAYERS | W1196: WILLIAMSTOWN | X1196: 14 | Y1196: 3 | Z1196: 0 | AA1196: 1500 | AB1196: 1109 | AC1196: 135.26 | AD1196: 56
A1197: MOORABBIN | C1197: EVANS | F1197: STANLEY | I1197: WHALEBONE | L1197: RENWICK | O1197: GREEN | Q1197: WALDRON | W1197: MOORABBIN | X1197: 12 | Y1197: 3 | Z1197: 2 | AA1197: 1466 | AB1197: 968 | AC1197: 151.44628099173553 | AD1197: 52
A1198: WILLIAMSTOWN | C1198: CALLAHAN | F1198: MARTIN | I1198: DAVIES | L1198: SMITH | O1198: WARD | Q1198: WHITTAKER | W1198: BOX HILL | X1198: 13 | Y1198: 4 | Z1198: 0 | AA1198: 1445 | AB1198: 973 | AC1198: 148.51 | AD1198: 52
A1199: GOALKICKERS | W1199: PORT MELBOURNE | X1199: 12 | Y1199: 5 | Z1199: 0 | AA1199: 1583 | AB1199: 1130 | AC1199: 140.08849557522123 | AD1199: 48
A1200: MOORABBIN | C1200: RENWICK 4 | F1200: CRAMERI 3 | I1200: P RYAN | K1200: WHALEBONE | N1200: A JONES
A1201: WILLIAMSTOWN | C1201: WARD 2 | F1201: SMITH 2 | I1201: CALLAHAN | L1201: DAVIES | N1201: REED | P1201: EVANS | W1201: SANDRINGHAM | X1201: 11 | Y1201: 5 | Z1201: 1 | AA1201: 1392 | AB1201: 1177 | AC1201: 118.26677994902293 | AD1201: 46
W1202: COBURG | X1202: 11 | Y1202: 6 | Z1202: 0 | AA1202: 1492 | AB1202: 1301 | AC1202: 114.68 | AD1202: 44
A1203: BOX HILL | C1203: 3 | D1203: 5 | E1203: =C1203*6+D1203 -> 23 | G1203: 7 | H1203: 6 | I1203: =G1203*6+H1203 -> 48 | K1203: 11 | L1203: 8 | M1203: =K1203*6+L1203 -> 74 | O1203: 12 | P1203: 9 | Q1203: =O1203*6+P1203 -> 81 | S1203: BOX HILL | W1203: YARRAVILLE | X1203: 10 | Y1203: 7 | Z1203: 0 | AA1203: 1444 | AB1203: 1145 | AC1203: 126.11 | AD1203: 40
A1204: PORT MELBOURNE | C1204: 3 | D1204: 1 | E1204: =C1204*6+D1204 -> 19 | G1204: 3 | H1204: 4 | I1204: =G1204*6+H1204 -> 22 | K1204: 5 | L1204: 6 | M1204: =K1204*6+L1204 -> 36 | O1204: 5 | P1204: 9 | Q1204: =O1204*6+P1204 -> 39 | S1204: ROACH | W1204: CAMBERWELL | X1204: 10 | Y1204: 7 | Z1204: 0 | AA1204: 1317 | AB1204: 1161 | AC1204: 113.43669250645995 | AD1204: 40
A1205: BEST PLAYERS | W1205: BRUNSWICK | X1205: 9 | Y1205: 7 | Z1205: 1 | AA1205: 1274 | AB1205: 1224 | AC1205: 104.08496732026144 | AD1205: 38
A1206: BOX HILL | C1206: DEVERY | F1206: GOOCH | I1206: BRAIN | L1206: WRIGHT | O1206: TAYLOR | R1206: BROWN | W1206: MORDIALLOC | X1206: 8 | Y1206: 8 | Z1206: 1 | AA1206: 1117 | AB1206: 1218 | AC1206: 91.707717569786539 | AD1206: 34
A1207: PORT MELBOURNE | C1207: SYKES | F1207: BOWEN | I1207: LANDORFF | L1207: SYMONDS | O1207: LOCKHART | R1207: THOMPSON | W1207: PRESTON | X1207: 6 | Y1207: 10 | Z1207: 1 | AA1207: 1286 | AB1207: 1303 | AC1207: 98.695318495778977 | AD1207: 26
A1208: GOALKICKERS | W1208: PRAHRAN | X1208: 6 | Y1208: 11 | Z1208: 0 | AA1208: 1203 | AB1208: 1531 | AC1208: 78.58 | AD1208: 24
A1209: BOX HILL | C1209: BROWN 3 | F1209: BRAIN 2 | H1209: DEVERY 2 | J1209: JOHNSON 2 | M1209: SAWATSKY | P1209: CARRICK | R1209: TAYLOR | W1209: OAKLEIGH | X1209: 4 | Y1209: 13 | Z1209: 0 | AA1209: 1189 | AB1209: 1409 | AC1209: 84.386089425124197 | AD1209: 16
A1210: PORT MELBOURNE | C1210: LOCKHART 2 | F1210: MONKS | H1210: BONNETT | J1210: SYMONDS | W1210: DANDENONG | X1210: 3 | Y1210: 14 | Z1210: 0 | AA1210: 1080 | AB1210: 1660 | AC1210: 65.06 | AD1210: 12
W1211: NORTHCOTE | X1211: 2 | Y1211: 15 | Z1211: 0 | AA1211: 951 | AB1211: 1621 | AC1211: 58.667489204194943 | AD1211: 8
A1212: SANDRINGHAM | C1212: 0 | D1212: 5 | E1212: =C1212*6+D1212 -> 5 | G1212: 1 | H1212: 8 | I1212: =G1212*6+H1212 -> 14 | K1212: 5 | L1212: 12 | M1212: =K1212*6+L1212 -> 42 | O1212: 11 | P1212: 17 | Q1212: =O1212*6+P1212 -> 83 | S1212: BEACH ROAD | W1212: BRIGHTON | X1212: 2 | Y1212: 15 | Z1212: 0 | AA1212: 977 | AB1212: 1784 | AC1212: 54.76 | AD1212: 8
A1213: COBURG | C1213: 3 | D1213: 8 | E1213: =C1213*6+D1213 -> 26 | G1213: 7 | H1213: 11 | I1213: =G1213*6+H1213 -> 53 | K1213: 10 | L1213: 12 | M1213: =K1213*6+L1213 -> 72 | O1213: 10 | P1213: 17 | Q1213: =O1213*6+P1213 -> 77 | S1213: BREWER
A1214: BEST PLAYERS
A1215: SANDRINGHAM | C1215: RANSOM | F1215: THOMPSON | I1215: CROFT | L1215: STEELE | N1215: OAKLEY | Q1215: EVANS
A1216: COBURG | C1216: GOULLET | F1216: JORDAN | I1216: HUNTINGTON | L1216: HOOGEN | N1216: WILSON | Q1216: BIGELOW
A1217: GOALKICKERS
A1218: SANDRINGHAM | C1218: RANSOM 4 | F1218: VANCE 2 | I1218: OAKLEY 2 | L1218: RICHARDS | N1218: EVANS | P1218: STEELE
A1219: COBURG | C1219: HUNTINGTON 2 | F1219: NEESON 2 | I1219: BRENNAN 2 | L1219: MATHEWS 2 | O1219: GOULLET | Q1219: CARR
A1221: YARRAVILLE | C1221: 4 | D1221: 3 | E1221: =C1221*6+D1221 -> 27 | G1221: 6 | H1221: 6 | I1221: =G1221*6+H1221 -> 42 | K1221: 9 | L1221: 7 | M1221: =K1221*6+L1221 -> 61 | O1221: 14 | P1221: 12 | Q1221: =O1221*6+P1221 -> 96 | S1221: YARRAVILLE
A1222: CAMBERWELL | C1222: 0 | D1222: 4 | E1222: =C1222*6+D1222 -> 4 | G1222: 3 | H1222: 6 | I1222: =G1222*6+H1222 -> 24 | K1222: 7 | L1222: 6 | M1222: =K1222*6+L1222 -> 48 | O1222: 11 | P1222: 7 | Q1222: =O1222*6+P1222 -> 73 | S1222: MARCY
A1223: BEST PLAYERS
A1224: YARRAVILLE | C1224: CROOK | F1224: PHILLIPS | I1224: MASON | K1224: ARCHBOLD | N1224: GLEESON | Q1224: VANDERFEEN
A1225: CAMBERWELL | C1225: LONSDALE | F1225: McGUINNESS | I1225: HIGSON | K1225: ROSS | N1225: CHAPLIN | Q1225: DOUGLAS
A1226: GOALKICKERS
A1227: YARRAVILLE | C1227: CROOK 4 | F1227: MAGEE 2 | I1227: GLEESON 2 | L1227: CAREY 2 | N1227: VANDERFEEN 2 | R1227: BARCLAY | T1227: PHILLIPS
A1228: CAMBERWELL | C1228: McGUINNESS 4 | F1228: HIGSON 4 | I1228: MOUNTAIN 2 | L1228: SKALBERG
A1230: PRESTON | C1230: 2 | D1230: 4 | E1230: =C1230*6+D1230 -> 16 | G1230: 9 | H1230: 7 | I1230: =G1230*6+H1230 -> 61 | K1230: 10 | L1230: 8 | M1230: =K1230*6+L1230 -> 68 | O1230: 15 | P1230: 12 | Q1230: =O1230*6+P1230 -> 102 | S1230: PRESTON
A1231: OAKLEIGH | C1231: 1 | D1231: 4 | E1231: =C1231*6+D1231 -> 10 | G1231: 4 | H1231: 5 | I1231: =G1231*6+H1231 -> 29 | K1231: 8 | L1231: 8 | M1231: =K1231*6+L1231 -> 56 | O1231: 9 | P1231: 10 | Q1231: =O1231*6+P1231 -> 64 | S1231: GODING
A1232: BEST PLAYERS
A1233: PRESTON | C1233: BERGIN | F1233: COOPER | I1233: MILBURN | L1233: McLACHLAN | O1233: RYMER | R1233: FOOTE
A1234: OAKLEIGH | C1234: D'ARCY | F1234: LONGNEY | I1234: WINTER | L1234: DONOHUE | O1234: GAY | R1234: McGOWAN
A1235: GOALKICKERS
A1236: PRESTON | C1236: RYMER 6 | F1236: WOOD 2 | I1236: COOPER 2 | L1236: DAWSON | N1236: BRIERLEY | Q1236: OGDEN | S1236: HOBAN | W1236: BERGIN
A1237: OAKLEIGH | C1237: McGOWAN 3 | F1237: LONGNEY 2 | I1237: D'ARCY | K1237: COUGHLAN | N1237: O'DONNELL | Q1237: WILLIAMS
A1239: PRAHRAN | C1239: 6 | D1239: 3 | E1239: =C1239*6+D1239 -> 39 | G1239: 10 | H1239: 6 | I1239: =G1239*6+H1239 -> 66 | K1239: 14 | L1239: 8 | M1239: =K1239*6+L1239 -> 92 | O1239: 22 | P1239: 11 | Q1239: =O1239*6+P1239 -> 143 | S1239: DANDENONG
A1240: DANDENONG | C1240: 4 | D1240: 3 | E1240: =C1240*6+D1240 -> 27 | G1240: 5 | H1240: 6 | I1240: =G1240*6+H1240 -> 36 | K1240: 10 | L1240: 13 | M1240: =K1240*6+L1240 -> 73 | O1240: 12 | P1240: 16 | Q1240: =O1240*6+P1240 -> 88 | S1240: ALLEN
A1241: BEST PLAYERS
A1242: PRAHRAN | C1242: HOOPER | F1242: HARVEY | I1242: CHRISTIAN | L1242: HEALEY | N1242: CALLESON | Q1242: BELFORD
A1243: DANDENONG | C1243: BASSETT | F1243: CROSBIE | I1243: WILLIAMS | L1243: LALOR | N1243: JOHNSON | Q1243: KENNY
A1244: GOALKICKERS
A1245: PRAHRAN | C1245: CALLESON 6 | F1245: HOOPER 4 | I1245: WHARTON 3 | L1245: PEARSON 2 | N1245: VURLOW 2 | Q1245: BELFORD 2 | S1245: HART 2 | W1245: DUNKERLEY
A1246: DANDENONG | C1246: CROSBIE 5 | F1246: LALOR 3 | I1246: KENNY 2 | L1246: TURNER | O1246: KNIGHT
A1248: MORDIALLOC | C1248: 6 | D1248: 2 | E1248: =C1248*6+D1248 -> 38 | G1248: 6 | H1248: 5 | I1248: =G1248*6+H1248 -> 41 | K1248: 9 | L1248: 7 | M1248: =K1248*6+L1248 -> 61 | O1248: 10 | P1248: 10 | Q1248: =O1248*6+P1248 -> 70 | S1248: MORDIALLOC
A1249: NORTHCOTE | C1249: 1 | D1249: 0 | E1249: =C1249*6+D1249 -> 6 | G1249: 4 | H1249: 1 | I1249: =G1249*6+H1249 -> 25 | K1249: 6 | L1249: 2 | M1249: =K1249*6+L1249 -> 38 | O1249: 9 | P1249: 4 | Q1249: =O1249*6+P1249 -> 58 | S1249: DIXON
A1250: BEST PLAYERS
A1251: MORDIALLOC | C1251: BAKER | F1251: DUFFIELD | I1251: CRANE | L1251: JOSE | O1251: EGERTON | R1251: WILKINSON
A1252: NORTHCOTE | C1252: SMITH | F1252: VAINS | I1252: GERVASONI | L1252: HUSSEY | O1252: BRETHERTON | R1252: RYAN
A1253: GOALKICKERS
A1254: MORDIALLOC | C1254: BAKER 2 | F1254: LASKEY 2 | I1254: WILKINSON 2 | L1254: ORPHIN | N1254: CRAWFORD | Q1254: EGERTON | S1254: DUFFIELD
A1255: NORTHCOTE | C1255: ALLEN 3 | F1255: WOOLNOUGH 2 | J1255: CONYBEAR 2 | M1255: MULCAHY | P1255: WRIGHT
A1257: BRUNSWICK | C1257: 2 | D1257: 5 | E1257: =C1257*6+D1257 -> 17 | G1257: 7 | H1257: 7 | I1257: =G1257*6+H1257 -> 49 | K1257: 11 | L1257: 10 | M1257: =K1257*6+L1257 -> 76 | O1257: 15 | P1257: 14 | Q1257: =O1257*6+P1257 -> 104 | S1257: E'WICK
A1258: BRIGHTON | C1258: 1 | D1258: 2 | E1258: =C1258*6+D1258 -> 8 | G1258: 6 | H1258: 11 | I1258: =G1258*6+H1258 -> 47 | K1258: 6 | L1258: 14 | M1258: =K1258*6+L1258 -> 50 | O1258: 10 | P1258: 19 | Q1258: =O1258*6+P1258 -> 79 | S1258: ROWE
A1259: BEST PLAYERS
A1260: BRUNSWICK | C1260: EDWARDS | F1260: JARMAN | I1260: WHILEY | L1260: HAYES | P1260: L STANLEY | S1260: G STANLEY
A1261: BRIGHTON | C1261: EBZERY | F1261: BROWNING | I1261: N MILLS | L1261: WOOLSTENCROFT | P1261: W COOPER | S1261: McCANN
A1262: GOALKICKERS
A1263: BRUNSWICK | C1263: VELO 4 | F1263: G STANLEY 4 | I1263: EDWARDS 2 | L1263: PHIPPS 2 | N1263: DEAS | P1263: HAYES | R1263: K DILLON
A1264: BRIGHTON | C1264: WOOLSTENCROFT 3 | G1264: N COOPER 2 | J1264: HART | L1264: EBZERY | N1264: HUNTER | Q1264: BROWNING | S1264: ASLING
A1266: ROUND 18 | E1266: 30TH AUGUST | J1266: WEATHER | M1266: SOUTH WIND GROUNDS HEAVY | S1266: PLAYED AT
C1267: 1ST QTR | G1267: 2ND QTR | K1267: 3RD QTR | O1267: FINAL | S1267: PORT MELBOURNE | X1267: LADDER | AA1267: ROUND | AC1267: 18
A1268: PORT MELBOURNE | C1268: 6 | D1268: 2 | E1268: =C1268*6+D1268 -> 38 | G1268: 13 | H1268: 3 | I1268: =G1268*6+H1268 -> 81 | K1268: 15 | L1268: 5 | M1268: =K1268*6+L1268 -> 95 | O1268: 21 | P1268: 6 | Q1268: =O1268*6+P1268 -> 132 | S1268: UMPIRE | W1268: TEAM | X1268: W | Y1268: L | Z1268: D | AA1268: FOR | AB1268: AGST | AC1268: % | AD1268: PTS
A1269: SANDRINGHAM | C1269: 3 | D1269: 4 | E1269: =C1269*6+D1269 -> 22 | G1269: 7 | H1269: 6 | I1269: =G1269*6+H1269 -> 48 | K1269: 11 | L1269: 8 | M1269: =K1269*6+L1269 -> 74 | O1269: 13 | P1269: 13 | Q1269: =O1269*6+P1269 -> 91 | S1269: ALLEN
A1270: BEST PLAYERS | W1270: WILLIAMSTOWN | X1270: 15 | Y1270: 3 | Z1270: 0 | AA1270: 1563 | AB1270: 1142 | AC1270: 136.86 | AD1270: 60
A1271: PORT MELBOURNE | C1271: WITHERS | F1271: SYKES | I1271: LEWIS | L1271: WHITE | N1271: BONNETT | Q1271: METHERALL | W1271: MOORABBIN | X1271: 13 | Y1271: 3 | Z1271: 2 | AA1271: 1556 | AB1271: 1036 | AC1271: 150.1930501930502 | AD1271: 56
A1272: SANDRINGHAM | C1272: SHEERIN | F1272: RICHARDS | I1272: WEBSTER | L1272: EVANS | N1272: OAKLEY | Q1272: THOMPSON | W1272: BOX HILL | X1272: 13 | Y1272: 5 | Z1272: 0 | AA1272: 1479 | AB1272: 1045 | AC1272: 141.53 | AD1272: 52
A1273: GOALKICKERS | W1273: PORT MELBOURNE | X1273: 13 | Y1273: 5 | Z1273: 0 | AA1273: 1715 | AB1273: 1221 | AC1273: 140.45864045864045 | AD1273: 52
A1274: PORT MELBOURNE | C1274: BONNETT 10 | F1274: CLAXTON 4 | I1274: SYKES 3 | K1274: THOMPSON 2 | N1274: R ATKINSON | Q1274: FREYER
A1275: SANDRINGHAM | C1275: OAKLEY 2 | E1275: BARRAN 2 | H1275: EVANS 2 | J1275: WEBSTER 2 | M1275: STEELE | O1275: WILLIAMS | Q1275: SHRIVES | S1275: McLEAN | W1275: COBURG | X1275: 12 | Y1275: 6 | Z1275: 0 | AA1275: 1567 | AB1275: 1330 | AC1275: 117.82 | AD1275: 48
Q1276: ECCLESTON | W1276: SANDRINGHAM | X1276: 11 | Y1276: 6 | Z1276: 1 | AA1276: 1483 | AB1276: 1309 | AC1276: 113.292589763178 | AD1276: 46
A1277: BRUNSWICK | C1277: 1 | D1277: 0 | E1277: =C1277*6+D1277 -> 6 | G1277: 6 | H1277: 4 | I1277: =G1277*6+H1277 -> 40 | K1277: 7 | L1277: 5 | M1277: =K1277*6+L1277 -> 47 | O1277: 11 | P1277: 6 | Q1277: =O1277*6+P1277 -> 72 | S1277: BRUNSWICK | W1277: YARRAVILLE | X1277: 11 | Y1277: 7 | Z1277: 0 | AA1277: 1543 | AB1277: 1222 | AC1277: 126.29 | AD1277: 44
A1278: BOX HILL | C1278: 1 | D1278: 3 | E1278: =C1278*6+D1278 -> 9 | G1278: 3 | H1278: 4 | I1278: =G1278*6+H1278 -> 22 | K1278: 4 | L1278: 8 | M1278: =K1278*6+L1278 -> 32 | O1278: 4 | P1278: 10 | Q1278: =O1278*6+P1278 -> 34 | S1278: GODING | W1278: BRUNSWICK | X1278: 10 | Y1278: 7 | Z1278: 1 | AA1278: 1346 | AB1278: 1258 | AC1278: 106.9952305246423 | AD1278: 42
A1279: BEST PLAYERS | W1279: CAMBERWELL | X1279: 10 | Y1279: 8 | Z1279: 0 | AA1279: 1350 | AB1279: 1224 | AC1279: 110.29411764705883 | AD1279: 40
A1280: BRUNSWICK | C1280: THORNTON | F1280: JARMAN | I1280: EDWARDS | L1280: McFARLANE | O1280: VELO | Q1280: HAYES | W1280: MORDIALLOC | X1280: 8 | Y1280: 9 | Z1280: 1 | AA1280: 1194 | AB1280: 1317 | AC1280: 90.66059225512528 | AD1280: 34
A1281: BOX HILL | C1281: IRVINE | F1281: WHITE | I1281: SAWAYSKY | L1281: BROWN | O1281: DEVERY | Q1281: PLUNKETT | W1281: PRAHRAN | X1281: 7 | Y1281: 11 | Z1281: 0 | AA1281: 1303 | AB1281: 1604 | AC1281: 81.23 | AD1281: 28
A1282: GOALKICKERS | W1282: PRESTON | X1282: 6 | Y1282: 11 | Z1282: 1 | AA1282: 1354 | AB1282: 1393 | AC1282: 97.200287150035891 | AD1282: 26
A1283: BRUNSWICK | C1283: McFARLANE 3 | F1283: VELO 3 | H1283: G STANLEY 2 | K1283: K DILLON 2 | N1283: N THOMPSON | W1283: OAKLEIGH | X1283: 5 | Y1283: 13 | Z1283: 0 | AA1283: 1307 | AB1283: 1469 | AC1283: 88.972089857045603 | AD1283: 20
A1284: BOX HILL | C1284: BROWN 2 | F1284: DEVERY | H1284: SAWATSKY | W1284: DANDENONG | X1284: 3 | Y1284: 15 | Z1284: 0 | AA1284: 1109 | AB1284: 1735 | AC1284: 63.92 | AD1284: 12
W1285: NORTHCOTE | X1285: 2 | Y1285: 16 | Z1285: 0 | AA1285: 1011 | AB1285: 1739 | AC1285: 58.136860264519839 | AD1285: 8
A1286: YARRAVILLE | C1286: 5 | D1286: 5 | E1286: =C1286*6+D1286 -> 35 | G1286: 8 | H1286: 6 | I1286: =G1286*6+H1286 -> 54 | K1286: 13 | L1286: 15 | M1286: =K1286*6+L1286 -> 93 | O1286: 14 | P1286: 15 | Q1286: =O1286*6+P1286 -> 99 | S1286: MORDIALLOC | W1286: BRIGHTON | X1286: 2 | Y1286: 16 | Z1286: 0 | AA1286: 1050 | AB1286: 1884 | AC1286: 55.73 | AD1286: 8
A1287: MORDIALLOC | C1287: 0 | D1287: 4 | E1287: =C1287*6+D1287 -> 4 | G1287: 2 | H1287: 9 | I1287: =G1287*6+H1287 -> 21 | K1287: 5 | L1287: 14 | M1287: =K1287*6+L1287 -> 44 | O1287: 10 | P1287: 17 | Q1287: =O1287*6+P1287 -> 77 | S1287: O'DONOGHUE
A1288: BEST PLAYERS
A1289: YARRAVILLE | C1289: ARCHBOLD | F1289: DRINAN | I1289: GLEESON | L1289: WEBB | O1289: MASON | R1289: CROOK
A1290: MORDIALLOC | C1290: BESANKO | F1290: SHEEHAN | I1290: METCALF | L1290: WILKINSON | O1290: CRANE | R1290: ORPHIN
A1291: GOALKICKERS
A1292: YARRAVILLE | C1292: GLEESON 3 | F1292: CROOK 3 | I1292: WEBB 2 | K1292: CAREY 2 | M1292: MAGEE | O1292: DRINAN | Q1292: BARCLAY | S1292: LAMONT
A1293: MORDIALLOC | C1293: CRANE 3 | F1293: PEARSON 2 | I1293: DUFFIELD | K1293: SHEEHAN | M1293: CRAWFORD | P1293: LASKEY | R1293: BARCLAY
A1295: WILLIAMSTOWN | C1295: 4 | D1295: 2 | E1295: =C1295*6+D1295 -> 26 | G1295: 6 | H1295: 4 | I1295: =G1295*6+H1295 -> 40 | K1295: 7 | L1295: 7 | M1295: =K1295*6+L1295 -> 49 | O1295: 9 | P1295: 9 | Q1295: =O1295*6+P1295 -> 63 | S1295: CAMBERWELL
A1296: CAMBERWELL | C1296: 1 | D1296: 3 | E1296: =C1296*6+D1296 -> 9 | G1296: 3 | H1296: 5 | I1296: =G1296*6+H1296 -> 23 | K1296: 3 | L1296: 8 | M1296: =K1296*6+L1296 -> 26 | O1296: 4 | P1296: 9 | Q1296: =O1296*6+P1296 -> 33 | S1296: POLLARD
A1297: BEST PLAYERS
A1298: WILLIAMSTOWN | C1298: MARTIN | F1298: REED | I1298: CALLAHAN | L1298: R JONES | O1298: E BEITZEL | R1298: PELLY
A1299: CAMBERWELL | C1299: ROSS | F1299: DOUGLAS | I1299: CHAMBERS | L1299: McDONALD | O1299: McISAAC | R1299: BOX
A1300: GOALKICKERS
A1301: WILLIAMSTOWN | C1301: CULLINAN 2 | F1301: DAVIES 2 | I1301: REED 2 | K1301: R JONES | M1301: CALLAHAN | P1301: NEYLON
A1302: CAMBERWELL | C1302: HIGSON 2 | F1302: ROSS | H1302: COLEMAN
A1304: OAKLEIGH | C1304: 5 | D1304: 5 | E1304: =C1304*6+D1304 -> 35 | G1304: 8 | H1304: 10 | I1304: =G1304*6+H1304 -> 58 | K1304: 13 | L1304: 17 | M1304: =K1304*6+L1304 -> 95 | O1304: 16 | P1304: 22 | Q1304: =O1304*6+P1304 -> 118 | S1304: OAKLEIGH
A1305: NORTHCOTE | C1305: 2 | D1305: 1 | E1305: =C1305*6+D1305 -> 13 | G1305: 5 | H1305: 3 | I1305: =G1305*6+H1305 -> 33 | K1305: 7 | L1305: 5 | M1305: =K1305*6+L1305 -> 47 | O1305: 9 | P1305: 6 | Q1305: =O1305*6+P1305 -> 60 | S1305: BREWER
A1306: BEST PLAYERS
A1307: OAKLEIGH | C1307: COLLINS | F1307: D'ARCY | I1307: COUGHLAN | M1307: GAY | O1307: LONGNEY | R1307: LANE
A1308: NORTHCOTE | C1308: GERVASONI | F1308: SMITH | I1308: WOOLNOUGH | M1308: RYAN | O1308: HUSSEY | R1308: CRIPPS
A1309: GOALKICKERS
A1310: OAKLEIGH | C1310: COUGHLAN 3 | F1310: D'ARCY 2 | I1310: WINTER 2 | K1310: LONGNEY 2 | N1310: NICHOLSON 2 | Q1310: WILLIAMS | S1310: McCOUBRIE | W1310: COLLINS | X1310: H BAPTIST | AA1310: McGOWAN
A1311: NORTHCOTE | C1311: COLLINS 2 | F1311: ALLEN 2 | I1311: CRIPPS 2 | K1311: ATKINSON | N1311: FRENCHAM | Q1311: MARCHANT
A1313: PRAHRAN | C1313: 6 | D1313: 6 | E1313: =C1313*6+D1313 -> 42 | G1313: 8 | H1313: 9 | I1313: =G1313*6+H1313 -> 57 | K1313: 10 | L1313: 15 | M1313: =K1313*6+L1313 -> 75 | O1313: 13 | P1313: 22 | Q1313: =O1313*6+P1313 -> 100 | S1313: TOORAK PARK
A1314: BRIGHTON | C1314: 2 | D1314: 1 | E1314: =C1314*6+D1314 -> 13 | G1314: 8 | H1314: 5 | I1314: =G1314*6+H1314 -> 53 | K1314: 9 | L1314: 8 | M1314: =K1314*6+L1314 -> 62 | O1314: 10 | P1314: 13 | Q1314: =O1314*6+P1314 -> 73 | S1314: MARCY
A1315: BEST PLAYERS
A1316: PRAHRAN | C1316: PEARSON | F1316: ASH | I1316: HARVEY | L1316: CALLESON | O1316: CHRISTIAN | R1316: HOOPER
A1317: BRIGHTON | C1317: BROWNING | F1317: McCANN | I1317: ASLING | L1317: W COOPER | O1317: GARDE | R1317: WOOLSTENCROFT
A1318: GOALKICKERS
A1319: PRAHRAN | C1319: HARVEY 4 | F1319: CALLESON 4 | I1319: HOOPER | K1319: HEALEY | M1319: ASH | O1319: HART | Q1319: DUNKERLEY
A1320: BRIGHTON | C1320: NEW 2 | F1320: HART 2 | I1320: W COOPER 2 | L1320: WOOLSTENCROFT | P1320: CRAIG | R1320: ASLING | T1320: HUNTER
A1322: COBURG | C1322: 3 | D1322: 3 | E1322: =C1322*6+D1322 -> 21 | G1322: 5 | H1322: 9 | I1322: =G1322*6+H1322 -> 39 | K1322: 8 | L1322: 14 | M1322: =K1322*6+L1322 -> 62 | O1322: 10 | P1322: 15 | Q1322: =O1322*6+P1322 -> 75 | S1322: COBURG
A1323: DANDENONG | C1323: 2 | D1323: 0 | E1323: =C1323*6+D1323 -> 12 | G1323: 2 | H1323: 0 | I1323: =G1323*6+H1323 -> 12 | K1323: 2 | L1323: 1 | M1323: =K1323*6+L1323 -> 13 | O1323: 4 | P1323: 5 | Q1323: =O1323*6+P1323 -> 29 | S1323: DIXON
A1324: BEST PLAYERS
A1325: COBURG | C1325: YOUNG | F1325: SHAW | I1325: JORDAN | L1325: BYRON | O1325: HOOGEN | R1325: GOULLET
A1326: DANDENONG | C1326: TODD | F1326: KINNAIRD | I1326: PURCELL | L1326: BASSTT | O1326: JOHNSON | R1326: PETERS
A1327: GOALKICKERS
A1328: COBURG | C1328: BYRON 5 | F1328: KAYLL 2 | I1328: J BRENNAN | L1328: GOULLET | O1328: BIGELOW
A1329: DANDENONG | C1329: PETERS 3 | F1329: CROSBIE
A1331: MOORABBIN | C1331: 2 | D1331: 4 | E1331: =C1331*6+D1331 -> 16 | G1331: 7 | H1331: 10 | I1331: =G1331*6+H1331 -> 52 | K1331: 8 | L1331: 11 | M1331: =K1331*6+L1331 -> 59 | O1331: 13 | P1331: 12 | Q1331: =O1331*6+P1331 -> 90 | S1331: MOORABBIN
A1332: PRESTON | C1332: 4 | D1332: 2 | E1332: =C1332*6+D1332 -> 26 | G1332: 5 | H1332: 4 | I1332: =G1332*6+H1332 -> 34 | K1332: 8 | L1332: 12 | M1332: =K1332*6+L1332 -> 60 | O1332: 9 | P1332: 14 | Q1332: =O1332*6+P1332 -> 68 | S1332: ROWE
A1333: BEST PLAYERS
A1334: MOORABBIN | C1334: BOYD | F1334: MORONEY | I1334: WALDRON | L1334: WHALEBONE | O1334: GREEN | R1334: RENWICK
A1335: PRESTON | C1335: BRIERLEY | F1335: HOWARD | I1335: FOOTE | L1335: BERGIN | O1335: COOPER | R1335: CUTLER
A1336: GOALKICKERS
A1337: MOORABBIN | C1337: RENWICK 6 | F1337: MORONEY 3 | I1337: WHALEBONE 2 | L1337: LAY | M1337: EVANS
A1338: PRESTON | C1338: BRIERLEY 3 | F1338: WOOD 2 | I1338: FOOTE 2 | K1338: RYMER | M1338: COOPER
A1340: FINALS
A1341: 1ST SEMI | D1341: 6TH SEPTEMBER | J1341: WEATHER | M1341: SOUTH BREEZE FINE
C1342: 1ST QTR | G1342: 2ND QTR | K1342: 3RD QTR | O1342: FINAL
A1343: PORT MELBOURNE | C1343: 4 | D1343: 4 | E1343: =C1343*6+D1343 -> 28 | G1343: 7 | H1343: 7 | I1343: =G1343*6+H1343 -> 49 | K1343: 16 | L1343: 15 | M1343: =K1343*6+L1343 -> 111 | O1343: 17 | P1343: 20 | Q1343: =O1343*6+P1343 -> 122 | S1343: JUNCTION OVAL
A1344: BOX HILL | C1344: 5 | D1344: 4 | E1344: =C1344*6+D1344 -> 34 | G1344: 8 | H1344: 7 | I1344: =G1344*6+H1344 -> 55 | K1344: 9 | L1344: 8 | M1344: =K1344*6+L1344 -> 62 | O1344: 11 | P1344: 9 | Q1344: =O1344*6+P1344 -> 75 | S1344: O'DONOGHUE
A1345: BEST PLAYERS
A1346: PORT MELBOURNE | C1346: LANDORFF | F1346: FREYER | I1346: BONNETT | L1346: SYMONDS | O1346: SYKES | R1346: McRAE
A1347: BOX HILL | C1347: WRIGHT | F1347: GOOCH | I1347: SAWATSKY | L1347: WHITE | O1347: BROWN | R1347: TAYLOR
A1348: GOALKICKERS
A1349: PORT MELBOURNE | C1349: BONNETT 5 | F1349: FREYER 3 | I1349: CLAXTON 2 | L1349: LOCKHART 2 | O1349: McRAE 2 | Q1349: SYMONDS | S1349: WITHERS | W1349: SYKES
A1350: BOX HILL | C1350: BROWN 4 | F1350: BRAIN 2 | I1350: JOHNSON | K1350: SAWATSKY | N1350: CARRICK | P1350: TAYLOR | R1350: PRESTON
A1352: 2ND SEMI | D1352: 13TH SEPTEMBER | J1352: WEATHER | M1352: SOUTH WIND FINE
A1353: MOORABBIN | C1353: 4 | D1353: 5 | E1353: =C1353*6+D1353 -> 29 | G1353: 5 | H1353: 8 | I1353: =G1353*6+H1353 -> 38 | K1353: 10 | L1353: 11 | M1353: =K1353*6+L1353 -> 71 | O1353: 13 | P1353: 13 | Q1353: =O1353*6+P1353 -> 91 | S1353: JUNCTION OVAL
A1354: WILLIAMSTOWN | C1354: 2 | D1354: 3 | E1354: =C1354*6+D1354 -> 15 | G1354: 4 | H1354: 7 | I1354: =G1354*6+H1354 -> 31 | K1354: 5 | L1354: 12 | M1354: =K1354*6+L1354 -> 42 | O1354: 8 | P1354: 21 | Q1354: =O1354*6+P1354 -> 69 | S1354: ALLEN
A1355: BEST PLAYERS
A1356: MOORABBIN | C1356: STANLEY | F1356: WALDRON | I1356: GREEN | L1356: MENNIE | O1356: MORONEY | R1356: P RYAN
A1357: WILLIAMSTOWN | C1357: E BEITZEL | F1357: CALLAHAN | I1357: MARTIN | L1357: WHITTAKER | O1357: SMITH | R1357: BOURKE
A1358: GOALKICKERS
A1359: MOORABBIN | C1359: RENWICK 3 | F1359: MORONEY 3 | I1359: P RYAN 2 | K1359: LEHMANN | M1359: A JONES | O1359: MURPHY | Q1359: MANIE | S1359: WHALEBONE
A1360: WILLIAMSTOWN | C1360: PELLY 3 | F1360: R JONES | H1360: CULLINAN | J1360: BOURKE | L1360: DAVIES | N1360: SIMS
A1362: PRELIMINARY FINAL | F1362: 20TH SEPTEMBER | K1362: WEATHER | N1362: SOUTH WIND GROUND HEAVY
A1363: WILLIAMSTOWN | C1363: 1 | D1363: 1 | E1363: =C1363*6+D1363 -> 7 | G1363: 5 | H1363: 6 | I1363: =G1363*6+H1363 -> 36 | K1363: 6 | L1363: 7 | M1363: =K1363*6+L1363 -> 43 | O1363: 11 | P1363: 14 | Q1363: =O1363*6+P1363 -> 80 | S1363: JUNCTION OVAL
A1364: PORT MELBOURNE | C1364: 4 | D1364: 2 | E1364: =C1364*6+D1364 -> 26 | G1364: 4 | H1364: 2 | I1364: =G1364*6+H1364 -> 26 | K1364: 6 | L1364: 8 | M1364: =K1364*6+L1364 -> 44 | O1364: 8 | P1364: 10 | Q1364: =O1364*6+P1364 -> 58 | S1364: ROWE
A1365: BEST PLAYERS
A1366: WILLIAMSTOWN | C1366: MARTIN | F1366: E BEITZEL | I1366: CULLINAN | L1366: COLQUHOUN | O1366: KENT | R1366: R JONES
A1367: PORT MELBOURNE | C1367: CAMERON | F1367: WITHERS | I1367: METHERALL | L1367: R ATKINSON | O1367: SYKES | R1367: FREYER
A1368: GOALKICKERS
A1369: WILLIAMSTOWN | C1369: CULLINAN 5 | F1369: WARD 2 | I1369: SMITH | K1369: MAZOURIS | N1369: F JONES | Q1369: PELLY
A1370: PORT MELBOURNE | C1370: BONNETT 3 | F1370: CLAXTON 2 | I1370: SYKES | K1370: CAMERON | N1370: FREYER
A1372: GRAND FINAL | E1372: 27TH SEPTEMBER | K1372: WEATHER | N1372: SOUTH WIND SHOWERS
A1373: WILLIAMSTOWN | C1373: 0 | D1373: 1 | E1373: 1 | G1373: 3 | H1373: 5 | I1373: 23 | K1373: 4 | L1373: 9 | M1373: 33 | O1373: 6 | P1373: 15 | Q1373: =O1373*6+P1373 -> 51 | S1373: JUNCTION OVAL
A1374: MOORABBIN | C1374: 4 | D1374: 5 | E1374: 29 | G1374: 4 | H1374: 6 | I1374: 30 | K1374: 5 | L1374: 8 | M1374: 38 | O1374: 7 | P1374: 9 | Q1374: =O1374*6+P1374 -> 51 | S1374: ROWE
A1375: BEST PLAYERS
A1376: WILLIAMSTOWN | C1376: KENT | F1376: RAMSAY | I1376: E BEITZEL | L1376: MARTIN | O1376: COLQUHOUN | R1376: MAZOURIS
A1377: MOORABBIN | C1377: STANLEY | F1377: WALDRON | I1377: MORONEY | L1377: GREEN | O1377: TREZISE | R1377: GILDER
A1378: GOALKICKERS
A1379: WILLIAMSTOWN | C1379: CULLINAN 2 | F1379: MAZOURIS 2 | I1379: REED | K1379: PELLY
A1380: MOORABBIN | C1380: RENWICK 4 | F1380: WHALEBONE 2 | J1380: MORONEY
A1382: GRAND FINAL REPLAY | G1382: 4TH OCTOBER | K1382: WEATHER | N1382: NORTH WIND GROUND HEAVY
A1383: WILLIAMSTOWN | C1383: 3 | D1383: 12 | E1383: 30 | G1383: 5 | H1383: 14 | I1383: 44 | K1383: 12 | L1383: 18 | M1383: 90 | O1383: 13 | P1383: 18 | Q1383: =O1383*6+P1383 -> 96 | S1383: JUNCTION OVAL
A1384: MOORABBIN | C1384: 0 | D1384: 0 | E1384: 0 | G1384: 3 | H1384: 3 | I1384: 21 | K1384: 3 | L1384: 5 | M1384: 23 | O1384: 8 | P1384: 16 | Q1384: =O1384*6+P1384 -> 64 | S1384: ROWE
A1385: BEST PLAYERS
A1386: WILLIAMSTOWN | C1386: CALLAHAN | F1386: COLQUHOUN | I1386: BOURKE | L1386: MARTIN | O1386: E BEITZEL | R1386: R JONES
A1387: MOORABBIN | C1387: GREEN | F1387: BOYD | I1387: WALDRON | L1387: GILDER | O1387: STANLEY | R1387: JONES
A1388: GOALKICKERS
A1389: WILLIAMSTOWN | C1389: CULLINAN 5 | F1389: MAZOURIS 2 | I1389: PELLY 2 | K1389: MURPHY | M1389: CALLAHAN | P1389: B BEITZEL | R1389: RAMSAY
A1390: MOORABBIN | C1390: RENWICK 3 | F1390: CRAMERI 2 | I1390: EVANS | K1390: JONES | M1390: P RYAN
A1392: YEAR 1958
A1393: V.F.A. IN CARNIVAL MATCHES | S1393: PLAYED AT
E1394: 2ND JULY | H1394: AFTERNOON | M1394: WEATHER | O1394: NORTH WIND COLD | S1394: M.C.G.
A1395: V.F.A. | C1395: 5 | D1395: 4 | E1395: =C1395*6+D1395 -> 34 | G1395: 6 | H1395: 7 | I1395: =G1395*6+H1395 -> 43 | K1395: 11 | L1395: 9 | M1395: =K1395*6+L1395 -> 75 | O1395: 15 | P1395: 12 | Q1395: 102 | S1395: UMPIRE
A1396: TASMANIA | C1396: 3 | D1396: 2 | E1396: =C1396*6+D1396 -> 20 | G1396: 5 | H1396: 5 | I1396: =G1396*6+H1396 -> 35 | K1396: 9 | L1396: 14 | M1396: =K1396*6+L1396 -> 68 | O1396: 13 | P1396: 16 | Q1396: 94 | S1396: L GARDNER (W.A.)
A1397: BEST PLAYERS
A1398: V.F.A. | C1398: WITHERS | F1398: METCALF | I1398: WHITE | L1398: BOX | O1398: DEVERY | R1398: COUGHLAN
A1399: TASMANIA | C1399: J ROSS | F1399: MURPHY | I1399: GARWOOD | L1399: MOORE | O1399: GALE | R1399: HILL
A1400: GOALKICKERS
A1401: V.F.A. | C1401: COUGHLAN 4 | F1401: BOX 3 | I1401: BONNETT 2 | L1401: DEVERY 2 | O1401: K ROSS | Q1401: SYMONDS | S1401: J BRENNAN | W1401: BOURKE
A1402: TASMANIA | C1402: J ROSS 4 | F1402: GARWOOD 2 | I1402: MURPHY 2 | L1402: WILLIAMS | N1402: LONG | P1402: BALDOCK | R1402: LEO | S1402: MOORE
A1404: TEAMS
F1405: V.F.A. | P1405: TAS
A1406: BACKS | C1406: R ATKINSON | F1406: LOVE | I1406: BOURKE | M1406: GALE | P1406: HILL | S1406: MASON
A1407: H-BACKS | C1407: J EVANS | F1407: WHILEY | I1407: GILDER | M1407: PATTERSON | P1407: MURPHY | S1407: PARREMORE
A1408: CENTRES | C1408: METCALF | F1408: WITHERS | I1408: WHITE | M1408: CONLAN | P1408: FITZALLEN | S1408: HODGSON
A1409: H-FORWARDS | C1409: COUGHLAN | F1409: BOX | I1409: J BRENNAN | M1409: GARWOOD | P1409: LEEDHAM | S1409: LONG
A1410: FORWARDS | C1410: MANIE | F1410: BONNETT | I1410: SYMONDS | M1410: WILLIAMS | P1410: BALDOCK | S1410: LEO
A1411: RUCKS | C1411: K ROSS | F1411: GOOCH | I1411: DEVERY | M1411: J ROSS | P1411: MOORE | S1411: SPENCER
A1412: RES | C1412: BACKMAN | F1412: CAREY | M1412: SHADBOLT | P1412: CHAPMAN
E1414: 7TH JULY | I1414: NIGHT | M1414: WEATHER | P1414: COLD SHOWERS
A1415: V.F.L. | C1415: 3 | D1415: 6 | E1415: =C1415*6+D1415 -> 24 | G1415: 9 | H1415: 14 | I1415: =G1415*6+H1415 -> 68 | K1415: 10 | L1415: 21 | M1415: =K1415*6+L1415 -> 81 | O1415: 13 | P1415: 23 | Q1415: 101 | S1415: STH MELB
A1416: V.F.A. | C1416: 3 | D1416: 2 | E1416: =C1416*6+D1416 -> 20 | G1416: 4 | H1416: 6 | I1416: =G1416*6+H1416 -> 30 | K1416: 4 | L1416: 8 | M1416: =K1416*6+L1416 -> 32 | O1416: 7 | P1416: 10 | Q1416: 52 | S1416: SWEENEY
A1417: BEST PLAYERS
A1418: V.F.L. | C1418: DAVIS | F1418: ABRAHAMS | I1418: TEASDALE | L1418: SKILTON | O1418: JAMES | R1418: WHITTEN
A1419: V.F.A. | C1419: WITHERS | F1419: SYMONDS | I1419: METCALF | L1419: WHILEY | O1419: BOX | R1419: COUGHLAN
A1420: GOALKICKERS
A1421: V.F.L. | C1421: DAVIS 2 | E1421: DODD 2 | G1421: ABRAHAMS 2 | J1421: WHITTEN 2 | M1421: SCHULZ 2 | P1421: SKILTON | R1421: DUGDALE | T1421: BARASSI
A1422: V.F.A. | C1422: HUNTINGTON 2 | F1422: HAYES | H1422: DEVERY | J1422: COUGHLAN | M1422: MANIE | O1422: ROSS
A1424: TEAMS
F1425: V.F.A. | P1425: V.F.L.
A1426: BACKS | C1426: R ATKINSON | F1426: CRANE | I1426: LOVE | M1426: COMBEN | P1426: GOLDSMITH | S1426: TEASDALE
A1427: H-BACKS | C1427: J EVANS | F1427: WHILEY | I1427: GILDER | M1427: MURRAY | P1427: McDONALD | S1427: JAMES
A1428: CENTRES | C1428: K WHITE | F1428: WITHERS | I1428: METCALF | M1428: CLARKE | P1428: MITHEN | S1428: BURGESS
A1429: H-FORWARDS | C1429: R EVANS | F1429: BOX | I1429: COUGHLAN | M1429: ABRAHAMS | P1429: WHITTEN | S1429: ARTHUR
A1430: FORWARDS | C1430: SYMONDS | F1430: HAYES | I1430: MANIE | M1430: AYLETT | P1430: DUGDALE | S1430: DODD
A1431: RUCKS | C1431: ROSS | F1431: BOURKE | I1431: DEVERY | M1431: LEEK | P1431: DAVIS | S1431: SKILTON
A1432: RES | C1432: HUNTINGTON | F1432: BACKMAN | M1432: BARASSI | P1432: SCHULZ
E1434: 9TH JULY | H1434: AFTERNOON
A1435: W.A. | C1435: 4 | D1435: 5 | E1435: =C1435*6+D1435 -> 29 | G1435: 10 | H1435: 10 | I1435: =G1435*6+H1435 -> 70 | K1435: 18 | L1435: 14 | M1435: =K1435*6+L1435 -> 122 | O1435: 21 | P1435: 16 | Q1435: 142 | S1435: M.C.G.
A1436: V.F.A. | C1436: 2 | D1436: 1 | E1436: =C1436*6+D1436 -> 13 | G1436: 5 | H1436: 2 | I1436: =G1436*6+H1436 -> 32 | K1436: 6 | L1436: 4 | M1436: =K1436*6+L1436 -> 40 | O1436: 11 | P1436: 8 | Q1436: 74 | S1436: A NASH (VIC)
A1437: BEST PLAYERS
A1438: W.A. | C1438: CLARKE | F1438: FARMER | I1438: PREEN | L1438: MOSE | N1438: SORRELL | Q1438: WHITE
A1439: V.F.A. | C1439: METCALF | F1439: SYMONDS | I1439: WHILEY | L1439: LEWIS | N1439: R ATKINSON | Q1439: LOVE
A1440: GOALKICKERS
A1441: W.A. | C1441: MOSE 5 | F1441: WHITE 4 | H1441: MUMME 3 | J1441: PREEN 3 | L1441: GEROVICH 2 | O1441: PORTER 2 | Q1441: FOLEY | S1441: FARMER
A1442: V.F.A. | C1442: SYMONDS 5 | F1442: MANIE 2 | I1442: DEVERY | K1442: R EVANS | M1442: J BRENNAN | P1442: BONNETT
A1444: TEAMS
F1445: V.F.A. | P1445: W.A.
A1446: BACKS | C1446: R ATKINSON | F1446: GILDER | I1446: GOOCH | M1446: BYFIELD | P1446: WATTS | S1446: JOHNSON
A1447: H-BACKS | C1447: LEWIS | F1447: WHILEY | I1447: J EVANS | M1447: KELLY | P1447: ROGERS | S1447: KETTLEWELL
A1448: CENTRES | C1448: METCALF | F1448: R EVANS | I1448: BACKMAN | M1448: COLGAN | P1448: SORRELL | S1448: SEAL
A1449: H-FORWARDS | C1449: COUGHLAN | F1449: LOVE | I1449: J BRENNAN | M1449: PREEN | P1449: GEROVICH | S1449: POLTER
A1450: FORWARDS | C1450: MANIE | F1450: BONNETT | I1450: SYMONDS | M1450: MUMME | P1450: MOSE | S1450: FOLEY
A1451: RUCKS | C1451: ROSS | F1451: HUNTINGTON | I1451: DEVERY | M1451: CLARKE | P1451: FARMER | S1451: WHITE
A1452: RES | C1452: CAREY | F1452: HAYES | M1452: HILLIER | P1452: PARENTICH
E1455: 11TH JULY | H1455: NIGHT
A1456: S.A. | C1456: 4 | D1456: 2 | E1456: =C1456*6+D1456 -> 26 | G1456: 9 | H1456: 3 | I1456: =G1456*6+H1456 -> 57 | K1456: 15 | L1456: 10 | M1456: =K1456*6+L1456 -> 100 | O1456: 16 | P1456: 15 | Q1456: 111 | S1456: STH MELB
A1457: V.F.A. | C1457: 2 | D1457: 3 | E1457: =C1457*6+D1457 -> 15 | G1457: 3 | H1457: 5 | I1457: =G1457*6+H1457 -> 23 | K1457: 4 | L1457: 9 | M1457: =K1457*6+L1457 -> 33 | O1457: 5 | P1457: 13 | Q1457: 43 | S1457: B WILSON (TAS)
A1458: BEST PLAYERS
A1459: S.A. | C1459: McGREGOR | F1459: SAWLEY | I1459: MOTLEY | L1459: KITCHEN | O1459: BARBURY | R1459: F WILLIAMS
A1460: V.F.A. | C1460: R ATKINSON | F1460: DEVERY | I1460: CAREY | L1460: ROSS | O1460: LANDORFF
A1461: GOALKICKERS
A1462: S.A. | C1462: F WILLIAMS 3 | F1462: KITCHEN 3 | I1462: KERLEY 3 | K1462: McGREGOR 3 | N1462: WHELAN 2 | Q1462: G WILLIAMS | S1462: BUNTON
A1463: V.F.A. | C1463: MANIE | E1463: DEVERY | H1463: WHILEY | J1463: BONNETT | M1463: HAYES
A1465: TEAMS NOT AVAILABLE
A1467: DUE TO INJURIES V.F.A. INCLUDED B JOHNSON R LANDORFF & J MARTIN NOT IN ORIGINAL SQUAD