A1: Victorian Football Association
A2: Season 1959
A3: © Copyright Wal Williams | F3: First created: 2 November 2014
A4: Contact: joywalwi at gmail dot com | F4: Last updated: 27 January 2018 | W4: VFA Results and tables - Link to the main index page
A5: You are free to copy this document in whole or part provided that proper acknowledgement is given to the author. All rights reserved.
A7: YEAR 1959
A8: ROUND 1 | C8: 18TH APRIL | I8: WEATHER | L8: FINE & SUNNY | S8: PLAYED AT
D9: 1ST QTR | H9: 2ND QTR | L9: 3RD QTR | P9: FINAL | S9: ELSTERNWICK PARK | X9: LADDER | AB9: ROUND | AD9: 1
A10: SANDRINGHAM | C10: 4 | D10: 6 | E10: =C10*6+D10 -> 30 | G10: 7 | H10: 14 | I10: =G10*6+H10 -> 56 | K10: 10 | L10: 18 | M10: =K10*6+L10 -> 78 | O10: 13 | P10: 24 | Q10: =O10*6+P10 -> 102 | S10: UMPIRE
A11: BRIGHTON | C11: 4 | D11: 4 | E11: =C11*6+D11 -> 28 | G11: 6 | H11: 5 | I11: =G11*6+H11 -> 41 | K11: 9 | L11: 9 | M11: =K11*6+L11 -> 63 | O11: 10 | P11: 11 | Q11: =O11*6+P11 -> 71 | S11: O'DONOGHUE | W11: TEAM | X11: W | Y11: L | Z11: D | AA11: FOR | AB11: AGST | AC11: % | AD11: PTS
A12: BEST PLAYERS
A13: SANDRINGHAM | C13: B THOMPSON | F13: OAKLEY | I13: RICHARDS | L13: PATMORE | N13: LINDSAY | Q13: BOLAND | W13: WILLIAMSTOWN | X13: 1 | Y13: 0 | Z13: 0 | AA13: 173 | AB13: 48 | AC13: 360.41666666666669 | AD13: 4
A14: BRIGHTON | C14: WOOLSTENCROFT | G14: MILLS | I14: MAY | L14: CRAIG | N14: ASHENHURST | Q14: W COOPER | W14: MOORABBIN | X14: 1 | Y14: 0 | Z14: 0 | AA14: 145 | AB14: 41 | AC14: 353.65853658536588 | AD14: 4
A15: GOALKICKERS | W15: BRUNSWICK | X15: 1 | Y15: 0 | Z15: 0 | AA15: 155 | AB15: 53 | AC15: 292.45283018867923 | AD15: 4
A16: SANDRINGHAM | C16: OAKLEY 6 | F16: STEELE 2 | I16: LINDSAY | K16: GRANGER | M16: GLEESON | O16: FAULKHEAD | R16: SHRIVES | W16: BOX HILL | X16: 1 | Y16: 0 | Z16: 0 | AA16: 153 | AB16: 56 | AC16: 273.21428571428572 | AD16: 4
A17: BRIGHTON | C17: CRAIG 4 | F17: P COOPER 2 | I17: DAVIS | K17: ASLING | M17: MAY | O17: W COOPER
W18: SANDRINGHAM | X18: 1 | Y18: 0 | Z18: 0 | AA18: 102 | AB18: 71 | AC18: 143.66197183098592 | AD18: 4
A19: MOORABBIN | C19: 7 | D19: 2 | E19: =C19*6+D19 -> 44 | G19: 12 | H19: 6 | I19: =G19*6+H19 -> 78 | K19: 16 | L19: 8 | M19: =K19*6+L19 -> 104 | O19: 22 | P19: 13 | Q19: =O19*6+P19 -> 145 | S19: MOORABBIN | W19: PORT MELBOURNE | X19: 1 | Y19: 0 | Z19: 0 | AA19: 103 | AB19: 80 | AC19: 128.75 | AD19: 4
A20: OAKLEIGH | C20: 1 | D20: 2 | E20: =C20*6+D20 -> 8 | G20: 2 | H20: 5 | I20: =G20*6+H20 -> 17 | K20: 4 | L20: 8 | M20: =K20*6+L20 -> 32 | O20: 5 | P20: 11 | Q20: =O20*6+P20 -> 41 | S20: ROACH | W20: COBURG | X20: 1 | Y20: 0 | Z20: 0 | AA20: 86 | AB20: 71 | AC20: 121.12676056338029 | AD20: 4
A21: BEST PLAYERS | W21: MORDIALLOC | X21: 1 | Y21: 0 | Z21: 0 | AA21: 109 | AB21: 91 | AC21: 119.78 | AD21: 4
A22: MOORABBIN | C22: P RYAN | E22: PAPLEY | H22: TREZISE | K22: GILDER | N22: WHALEBONE | Q22: MEEHAN | W22: DANDENONG | X22: 0 | Y22: 1 | Z22: 0 | AA22: 91 | AB22: 109 | AC22: 83.49 | AD22: 0
A23: OAKLEIGH | C23: DALE | E23: COUGHLAN | H23: GAY | K23: NAISMITH | N23: DONOHUE | Q23: BURKE | W23: YARRAVILLE | X23: 0 | Y23: 1 | Z23: 0 | AA23: 71 | AB23: 86 | AC23: 82.558139534883722 | AD23: 0
A24: GOALKICKERS | P24: EVANS | R24: MEEHAN | W24: NORTHCOTE | X24: 0 | Y24: 1 | Z24: 0 | AA24: 80 | AB24: 103 | AC24: 77.669902912621353 | AD24: 0
A25: MOORABBIN | C25: PAPLEY 10 | F25: P RYAN 2 | I25: WHALEBONE 2 | L25: McGAW 2 | N25: BILLSON 2 | Q25: RENWICK 2 | W25: BRIGHTON | X25: 0 | Y25: 1 | Z25: 0 | AA25: 71 | AB25: 102 | AC25: 69.607843137254903 | AD25: 0
A26: OAKLEIGH | C26: NAISMITH 2 | F26: PALMER | I26: DALE | K26: GAY | W26: CAMBERWELL | X26: 0 | Y26: 1 | Z26: 0 | AA26: 56 | AB26: 153 | AC26: 36.601307189542482 | AD26: 0
W27: SUNSHINE | X27: 0 | Y27: 1 | Z27: 0 | AA27: 53 | AB27: 155 | AC27: 34.193548387096776 | AD27: 0
A28: BOX HILL | C28: 1 | D28: 9 | E28: =C28*6+D28 -> 15 | G28: 7 | H28: 12 | I28: =G28*6+H28 -> 54 | K28: 14 | L28: 16 | M28: =K28*6+L28 -> 100 | O28: 22 | P28: 21 | Q28: =O28*6+P28 -> 153 | S28: CAMBERWELL | W28: OAKLEIGH | X28: 0 | Y28: 1 | Z28: 0 | AA28: 41 | AB28: 145 | AC28: 28.275862068965516 | AD28: 0
A29: CAMBERWELL | C29: 0 | D29: 2 | E29: =C29*6+D29 -> 2 | G29: 2 | H29: 5 | I29: =G29*6+H29 -> 17 | K29: 4 | L29: 7 | M29: =K29*6+L29 -> 31 | O29: 8 | P29: 8 | Q29: =O29*6+P29 -> 56 | S29: BREWER | W29: PRESTON | X29: 0 | Y29: 1 | Z29: 0 | AA29: 48 | AB29: 173 | AC29: 27.745664739884393 | AD29: 0
A30: BEST PLAYERS
A31: BOX HILL | C31: ROMARI | F31: BROWN | I31: MILNE | L31: PLUNKETT | O31: WITNISH | R31: WHITE
A32: CAMBERWELL | C32: SKALBERG | F32: SEYMOUR | I32: HIGSON | L32: K CHAMBERS | O32: FREIBERG | R32: MUIR
A33: GOALKICKERS
A34: BOX HILL | C34: ROMARI 11 | F34: PRESTON 3 | I34: PLUNKETT 2 | L34: BROWN 2 | N34: SAWATSKY 2 | Q34: MILNE | S34: WHITE
A35: CAMBERWELL | C35: HIGSON 5 | F35: FREYBERG | I35: SEYMOUR | L35: K CHAMBERS
A37: MORDIALLOC | C37: 2 | D37: 2 | E37: =C37*6+D37 -> 14 | G37: 7 | H37: 15 | I37: =G37*6+H37 -> 57 | K37: 10 | L37: 22 | M37: =K37*6+L37 -> 82 | O37: 14 | P37: 25 | Q37: =O37*6+P37 -> 109 | S37: DANDENONG
A38: DANDENONG | C38: 3 | D38: 3 | E38: =C38*6+D38 -> 21 | G38: 6 | H38: 4 | I38: =G38*6+H38 -> 40 | K38: 10 | L38: 7 | M38: =K38*6+L38 -> 67 | O38: 13 | P38: 13 | Q38: =O38*6+P38 -> 91 | S38: MARCY
A39: BEST PLAYERS
A40: MORDIALLOC | C40: CRAIG | F40: MAGINNESS | I40: BESANKO | L40: PEARSON | O40: WILKINSON | R40: SHEEHAN
A41: DANDENONG | C41: PHIPPS | F41: HEAD | I41: BASSETT | L41: GRAY | O41: GILLINGHAM | R41: KINNAIRD
A42: GOALKICKERS
A43: MORDIALLOC | C43: BAKER 3 | E43: WILKINSON 2 | H43: PEARSON 2 | K43: MAUNDER 2 | N43: LENNIE 2 | Q43: SHEEHAN | S43: MAGINNESS | V43: COSTELLO
A44: DANDENONG | C44: BASSETT 6 | F44: PHIPPS 3 | I44: CROSBIE 2 | L44: GILLINGHAM | O44: LALOR
A46: WILLIAMSTOWN | C46: 2 | D46: 4 | E46: =C46*6+D46 -> 16 | G46: 7 | H46: 8 | I46: =G46*6+H46 -> 50 | K46: 15 | L46: 14 | M46: =K46*6+L46 -> 104 | O46: 26 | P46: 17 | Q46: =O46*6+P46 -> 173 | S46: PRESTON
A47: PRESTON | C47: 2 | D47: 6 | E47: =C47*6+D47 -> 18 | G47: 3 | H47: 8 | I47: =G47*6+H47 -> 26 | K47: 5 | L47: 10 | M47: =K47*6+L47 -> 40 | O47: 6 | P47: 12 | Q47: =O47*6+P47 -> 48 | S47: ALLEN
A48: BEST PLAYERS
A49: WILLIAMSTOWN | C49: PELLY | F49: CALLAHAN | I49: KELLETT | L49: RAMSAY | O49: MURPHY | R49: CULLINAN
A50: PRESTON | C50: HOWARD | F50: McLACHLAN | I50: COOPER | L50: O'BRIEN | O50: CRELLIN | R50: BRYAN
A51: GOALKICKERS
A52: WILLIAMSTOWN | C52: CULLINAN 10 | F52: CALLAHAN 3 | I52: MURPHY 3 | L52: PELLY 3 | N52: MALONEY 2 | Q52: SMITH 2 | S52: WARD | U52: RAMSAY | X52: KELLETT
A53: PRESTON | C53: O'BRIEN 3 | F53: RYMER | H53: BERGIN | J53: GRAY
A55: COBURG | C55: 2 | D55: 0 | E55: =C55*6+D55 -> 12 | G55: 6 | H55: 5 | I55: =G55*6+H55 -> 41 | K55: 9 | L55: 6 | M55: =K55*6+L55 -> 60 | O55: 13 | P55: 8 | Q55: =O55*6+P55 -> 86 | S55: YARRAVILLE
A56: YARRAVILLE | C56: 2 | D56: 3 | E56: =C56*6+D56 -> 15 | G56: 4 | H56: 3 | I56: =G56*6+H56 -> 27 | K56: 8 | L56: 7 | M56: =K56*6+L56 -> 55 | O56: 10 | P56: 11 | Q56: =O56*6+P56 -> 71 | S56: ROWE
A57: BEST PLAYERS
A58: COBURG | C58: BYRON | F58: HORSKINS | I58: BRENNAN | L58: GLEESON | O58: WILSON | R58: MAHONEY
A59: YARRAVILLE | C59: BURT | F59: CAREY | I59: ARCHBOLD | L59: LAMONT | O59: DRINAN | R59: BROWN
A60: GOALKICKERS
A61: COBURG | C61: BYRON 6 | F61: BRENNAN 3 | I61: CARR | K61: WILSON | M61: JORDAN | O61: O'SULLIVAN
A62: YARRAVILLE | C62: BURT 3 | F62: R BROWN 2 | I62: LETCHER | K62: HART | M62: MAGEE | O62: CAREY | Q62: O'HALLORAN
A64: BRUNSWICK | C64: 5 | D64: 4 | E64: =C64*6+D64 -> 34 | G64: 10 | H64: 11 | I64: =G64*6+H64 -> 71 | K64: 17 | L64: 17 | M64: =K64*6+L64 -> 119 | O64: 22 | P64: 23 | Q64: =O64*6+P64 -> 155 | S64: NORTHCOTE
A65: SUNSHINE | C65: 3 | D65: 2 | E65: =C65*6+D65 -> 20 | G65: 6 | H65: 8 | I65: =G65*6+H65 -> 44 | K65: 6 | L65: 10 | M65: =K65*6+L65 -> 46 | O65: 7 | P65: 11 | Q65: =O65*6+P65 -> 53 | S65: DIXON
A66: BEST PLAYERS
A67: BRUNSWICK | C67: DILLON | F67: STANLEY | I67: HAYES | K67: JARMAN | N67: McMAHON | Q67: WHILEY
A68: SUNSHINE | C68: B JEPSON | F68: SEYNOUR | I68: SOMMERVILLE | L68: MILNE | N68: DIX | Q68: TREZISE
A69: GOALKICKERS
A70: BRUNSWICK | C70: DILLON 8 | F70: HAYES 7 | I70: STANLEY 3 | L70: WATT | N70: VELO | P70: JARMAN | R70: EDWARDS
A71: SUNSHINE | C71: KELLY 3 | F71: DIX 2 | I71: SEYMOUR | L71: SIMMONS
A73: PORT MELBOURNE | C73: 2 | D73: 3 | E73: =C73*6+D73 -> 15 | G73: 6 | H73: 9 | I73: =G73*6+H73 -> 45 | K73: 10 | L73: 14 | M73: =K73*6+L73 -> 74 | O73: 14 | P73: 19 | Q73: =O73*6+P73 -> 103 | S73: PORT MELBOURNE
A74: NORTHCOTE | C74: 2 | D74: 1 | E74: =C74*6+D74 -> 13 | G74: 5 | H74: 2 | I74: =G74*6+H74 -> 32 | K74: 9 | L74: 6 | M74: =K74*6+L74 -> 60 | O74: 12 | P74: 8 | Q74: =O74*6+P74 -> 80 | S74: POLLLARD
A75: BEST PLAYERS
A76: PORT MELBOURNE | C76: R ATKINSON | F76: LAWSON | I76: McMASTER | L76: FREYER | O76: LEWIS | R76: BONNETT
A77: NORTHCOTE | C77: WRIGHT | F77: BRETHERTON | I77: VAINS | L77: MARCHANT | O77: SMITH | R77: CRIPPS
A78: GOALKICKERS
A79: PORT MELBOURNE | C79: FREYER 5 | F79: BONNETT 3 | I79: OUSLEY 2 | K79: MONKS 2 | M79: LANE 2
A80: NORTHCOTE | C80: BRETHERTON 3 | F80: METHERALL 2 | I80: CRIPPS 2 | K80: WRIGHT 2 | M80: LUDGROVE | O80: BROWN | Q80: VAINS
A82: ROUND 2 | E82: 2ND MAY | J82: WEATHER | O82: FINE | S82: PLAYED AT
D83: 1ST QTR | H83: 2ND QTR | L83: 3RD QTR | P83: FINAL | S83: WILLIAMSTOWN
A84: WILLIAMSTOWN | C84: 5 | D84: 4 | E84: =C84*6+D84 -> 34 | G84: 7 | H84: 6 | I84: =G84*6+H84 -> 48 | K84: 11 | L84: 9 | M84: =K84*6+L84 -> 75 | O84: 13 | P84: 14 | Q84: =O84*6+P84 -> 92 | S84: UMPIRE | X84: LADDER | AB84: ROUND | AD84: 2
A85: BRUNSWICK | C85: 1 | D85: 0 | E85: =C85*6+D85 -> 6 | G85: 4 | H85: 3 | I85: =G85*6+H85 -> 27 | K85: 6 | L85: 8 | M85: =K85*6+L85 -> 44 | O85: 12 | P85: 10 | Q85: =O85*6+P85 -> 82 | S85: ROWE
A86: BEST PLAYERS | W86: TEAM | X86: W | Y86: L | Z86: D | AA86: FOR | AB86: AGST | AC86: % | AD86: PTS
A87: WILLIAMSTOWN | C87: MAZOURIS | F87: EVANS | I87: MURPHY | K87: CALLAHAN | N87: R JONES | Q87: BOB JONES
A88: BRUNSWICK | C88: DILLON | F88: R THOMPSON | I88: STANLEY | K88: WHILEY | N88: BADDELEY | Q88: WEIR | W88: MOORABBIN | X88: 2 | Y88: 0 | Z88: 0 | AA88: 271 | AB88: 122 | AC88: 222.13114754098362 | AD88: 8
A89: GOALKICKERS | Q89: MAZOURIS | W89: WILLIAMSTOWN | X89: 2 | Y89: 0 | Z89: 0 | AA89: 265 | AB89: 130 | AC89: 203.84615384615384 | AD89: 8
A90: WILLIAMSTOWN | C90: R SMITH 3 | F90: MURPHY 3 | I90: PELLY 2 | K90: MATTHEWS | N90: R JONES | P90: CULLINAN | R90: CALLAHAN | W90: BOX HILL | X90: 2 | Y90: 0 | Z90: 0 | AA90: 275 | AB90: 150 | AC90: 183.33333333333334 | AD90: 8
A91: BRUNSWICK | C91: DILLON 5 | F91: STANLEY 3 | I91: McFARLANE | L91: HAYES | N91: WEIR | P91: DEAS | W91: SANDRINGHAM | X91: 2 | Y91: 0 | Z91: 0 | AA91: 231 | AB91: 130 | AC91: 177.69230769230768 | AD91: 8
A93: PORT MELBOURNE | C93: 5 | D93: 3 | E93: =C93*6+D93 -> 33 | G93: 10 | H93: 9 | I93: =G93*6+H93 -> 69 | K93: 15 | L93: 13 | M93: =K93*6+L93 -> 103 | O93: 22 | P93: 16 | Q93: =O93*6+P93 -> 148 | S93: COBURG | W93: PORT MELBOURNE | X93: 2 | Y93: 0 | Z93: 0 | AA93: 251 | AB93: 178 | AC93: 141.01123595505618 | AD93: 8
A94: COBURG | C94: 4 | D94: 3 | E94: =C94*6+D94 -> 27 | G94: 8 | H94: 6 | I94: =G94*6+H94 -> 54 | K94: 11 | L94: 11 | M94: =K94*6+L94 -> 77 | O94: 14 | P94: 14 | Q94: =O94*6+P94 -> 98 | S94: ALLEN | W94: BRUNSWICK | X94: 1 | Y94: 1 | Z94: 0 | AA94: 237 | AB94: 145 | AC94: 163.44827586206895 | AD94: 4
A95: BEST PLAYERS | W95: YARRAVILLE | X95: 1 | Y95: 1 | Z95: 0 | AA95: 193 | AB95: 129 | AC95: 149.6124031007752 | AD95: 4
A96: PORT MELBOURNE | C96: BONNETT | F96: MONKS | I96: LAWSON | L96: WITHERS | N96: LOCKHART | Q96: CLAXTON | W96: MORDIALLOC | X96: 1 | Y96: 1 | Z96: 0 | AA96: 190 | AB96: 217 | AC96: 87.56 | AD96: 4
A97: COBURG | C97: CLARKSON | F97: JORDAN | I97: HORSKINS | L97: BYRON | N97: NEESON | Q97: WILSON | W97: COBURG | X97: 1 | Y97: 1 | Z97: 0 | AA97: 184 | AB97: 219 | AC97: 84.018264840182653 | AD97: 4
A98: GOALKICKERS | P98: WITHERS | R98: McMASTER | W98: OAKLEIGH | X98: 1 | Y98: 1 | Z98: 0 | AA98: 150 | AB98: 219 | AC98: 68.493150684931507 | AD98: 4
A99: PORT MELBOURNE | C99: BONNETT 7 | F99: MONKS 5 | I99: OUSLEY 2 | K99: LANE 2 | M99: WEBSTER 2 | P99: CLAXTON | R99: FREYER | W99: PRESTON | X99: 1 | Y99: 1 | Z99: 0 | AA99: 161 | AB99: 268 | AC99: 60.07462686567164 | AD99: 4
A100: COBURG | C100: BYRON 5 | F100: NEESON 3 | I100: WILSON 2 | L100: HORSKINS 2 | O100: CARR | Q100: JORDAN | W100: DANDENONG | X100: 0 | Y100: 2 | Z100: 0 | AA100: 165 | AB100: 218 | AC100: 75.69 | AD100: 0
W101: BRIGHTON | X101: 0 | Y101: 2 | Z101: 0 | AA101: 165 | AB101: 224 | AC101: 73.660714285714292 | AD101: 0
A102: MOORABBIN | C102: 5 | D102: 3 | E102: =C102*6+D102 -> 33 | G102: 14 | H102: 12 | I102: =G102*6+H102 -> 96 | K102: 15 | L102: 14 | M102: =K102*6+L102 -> 104 | O102: 18 | P102: 18 | Q102: =O102*6+P102 -> 126 | S102: MORDIALLOC | W102: SUNSHINE | X102: 0 | Y102: 2 | Z102: 0 | AA102: 148 | AB102: 268 | AC102: 55.223880597014926 | AD102: 0
A103: MORDIALLOC | C103: 1 | D103: 2 | E103: =C103*6+D103 -> 8 | G103: 2 | H103: 2 | I103: =G103*6+H103 -> 14 | K103: 9 | L103: 5 | M103: =K103*6+L103 -> 59 | O103: 12 | P103: 9 | Q103: =O103*6+P103 -> 81 | S103: MAUNDER | W103: NORTHCOTE | X103: 0 | Y103: 2 | Z103: 0 | AA103: 123 | AB103: 225 | AC103: 54.666666666666664 | AD103: 0
A104: BEST PLAYERS | W104: CAMBERWELL | X104: 0 | Y104: 2 | Z104: 0 | AA104: 115 | AB104: 282 | AC104: 40.780141843971634 | AD104: 0
A105: MOORABBIN | C105: WHALEBONE | F105: TREZISE | I105: GILDER | L105: McGAW | N105: P RYAN | Q105: BOYD
A106: MORDIALLOC | C106: KERR | F106: BARCLAY | I106: EGERTON | L106: BARR | N106: CRANE | Q106: COSTELLO
A107: GOALKICKERS
A108: MOORABBIN | C108: PAPLEY 5 | F108: COLE 4 | I108: WHALEBONE 3 | L108: McGAW 3 | O108: P RYAN 2 | R108: BILLSON
A109: MORDIALLOC | C109: KERR 3 | E109: CRANE 2 | G109: EGERTON 2 | J109: COSTELLO 2 | M109: MAUNDER | P109: WILKINSON | S109: PEARSON
A111: YARRAVILLE | C111: 5 | D111: 2 | E111: =C111*6+D111 -> 32 | G111: 9 | H111: 9 | I111: =G111*6+H111 -> 63 | K111: 14 | L111: 11 | M111: =K111*6+L111 -> 95 | O111: 18 | P111: 14 | Q111: =O111*6+P111 -> 122 | S111: NORTHCOTE
A112: NORTHCOTE | C112: 0 | D112: 1 | E112: =C112*6+D112 -> 1 | G112: 1 | H112: 2 | I112: =G112*6+H112 -> 8 | K112: 4 | L112: 5 | M112: =K112*6+L112 -> 29 | O112: 6 | P112: 7 | Q112: =O112*6+P112 -> 43 | S112: MARCY
A113: BEST PLAYERS
A114: YARRAVILLE | C114: DRINAN | F114: ARCHBOLD | I114: VANDERFEEN | L114: LETCHER | O114: CROOK | Q114: BURNSIDE
A115: NORTHCOTE | C115: BRETHERTON | F115: SMITH | I115: WRIGHT | L115: McFARLANE | O115: CLARK | Q115: BROWN
A116: GOALKICKERS
A117: YARRAVILLE | C117: MAGEE 6 | E117: BURT 4 | G117: O'HALLORAN 3 | J117: VANDERFEEN 2 | N117: CAREY 2 | Q117: HART
A118: NORTHCOTE | C118: METHERALL 2 | F118: VAINS | H118: MALING | J118: CLARK | L118: FLANAGAN
A120: PRESTON | C120: 4 | D120: 1 | E120: =C120*6+D120 -> 25 | G120: 7 | H120: 4 | I120: =G120*6+H120 -> 46 | K120: 11 | L120: 10 | M120: =K120*6+L120 -> 76 | O120: 17 | P120: 11 | Q120: =O120*6+P120 -> 113 | S120: SUNSHINE
A121: SUNSHINE | C121: 5 | D121: 2 | E121: =C121*6+D121 -> 32 | G121: 10 | H121: 4 | I121: =G121*6+H121 -> 64 | K121: 11 | L121: 6 | M121: =K121*6+L121 -> 72 | O121: 14 | P121: 11 | Q121: =O121*6+P121 -> 95 | S121: ROBINSON
A122: BEST PLAYERS
A123: PRESTON | C123: RYMER | F123: WALSH | I123: BRYAN | L123: HOWARD | O123: McLACHLAN | R123: O'REILLY
A124: SUNSHINE | C124: TREZISE | F124: SEYMOUR | I124: WHITEHAND | L124: MILNE | O124: KELLY | R124: CROSBIE
A125: GOALKICKERS
A126: PRESTON | C126: WALSH 7 | F126: McLACHLAN 4 | J126: RYMER | L126: HOWARD | N126: COOPER | P126: CRELLIN | R126: BAILEY | T126: DAWSON
A127: SUNSHINE | C127: WHITEHAND 6 | F127: KELLY 4 | I127: SEYMOUR | K127: MILNE | M127: MUNRO | O127: SIMMONS
A129: SANDRINGHAM | C129: 3 | D129: 5 | E129: =C129*6+D129 -> 23 | G129: 9 | H129: 11 | I129: =G129*6+H129 -> 65 | K129: 13 | L129: 14 | M129: =K129*6+L129 -> 92 | O129: 19 | P129: 15 | Q129: =O129*6+P129 -> 129 | S129: BEACH ROAD
A130: CAMBERWELL | C130: 1 | D130: 3 | E130: =C130*6+D130 -> 9 | G130: 4 | H130: 4 | I130: =G130*6+H130 -> 28 | K130: 6 | L130: 4 | M130: =K130*6+L130 -> 40 | O130: 9 | P130: 5 | Q130: =O130*6+P130 -> 59 | S130: DIXON
A131: BEST PLAYERS
A132: SANDRINGHAM | C132: OAKLEY | F132: SHRIVES | I132: WILLIAMS | L132: PATMORE | O132: THOMPSON | R132: STEELE
A133: CAMBERWELL | C133: HIGSON | F133: WHITTEN | I133: CLARKE | L133: K JOHNSON | O133: CHAPMAN | R133: BETHERAS
A134: GOALKICKERS
A135: SANDRINGHAM | C135: SHRIVES 5 | F135: OAKLEY 4 | I135: VANCE 4 | K135: WILLIAMS 3 | N135: PATMORE 2 | Q135: ALSOPP
A136: CAMBERWELL | C136: HIGSON 6 | F136: WHITTEN 3
A138: BOX HILL | C138: 6 | D138: 4 | E138: =C138*6+D138 -> 40 | G138: 9 | H138: 8 | I138: =G138*6+H138 -> 62 | K138: 16 | L138: 11 | M138: =K138*6+L138 -> 107 | O138: 18 | P138: 14 | Q138: =O138*6+P138 -> 122 | S138: BOX HILL
A139: BRIGHTON | C139: 0 | D139: 7 | E139: =C139*6+D139 -> 7 | G139: 3 | H139: 11 | I139: =G139*6+H139 -> 29 | K139: 8 | L139: 14 | M139: =K139*6+L139 -> 62 | O139: 13 | P139: 16 | Q139: =O139*6+P139 -> 94 | S139: D ROACH
A140: BEST PLAYERS
A141: BOX HILL | C141: BROWN | F141: ROMARI | I141: CARRICK | K141: WHITE | N141: WITNISH | Q141: PRESTON
A142: BRIGHTON | C142: ASHENHURST | F142: McCANN | I142: CRAIG | K142: W COOPER | N142: ASLING | Q142: MILLS
A143: GOALKICKERS
A144: BOX HILL | C144: ROMARI 7 | F144: CARRICK 4 | I144: WHITE 3 | K144: PRESTON 2 | N144: BROWN | P144: TAYLOR
A145: BRIGHTON | C145: ASLING 3 | F145: N COOPER 3 | I145: ASHENHURST 2 | L145: P COOPER | N145: JONES | P145: MURRAY | R145: WOOLSTENCROFT | W145: ATKINSON
A147: OAKLEIGH | C147: 5 | D147: 3 | E147: =C147*6+D147 -> 33 | G147: 8 | H147: 12 | I147: =G147*6+H147 -> 60 | K147: 11 | L147: 18 | M147: =K147*6+L147 -> 84 | O147: 14 | P147: 25 | Q147: =O147*6+P147 -> 109 | S147: OAKLEIGH
A148: DANDENONG | C148: 2 | D148: 2 | E148: =C148*6+D148 -> 14 | G148: 6 | H148: 5 | I148: =G148*6+H148 -> 41 | K148: 8 | L148: 7 | M148: =K148*6+L148 -> 55 | O148: 11 | P148: 8 | Q148: =O148*6+P148 -> 74 | S148: O'DONOGHUE
A149: BEST PLAYERS
A150: OAKLEIGH | C150: COUGHLAN | F150: BAPTIST | I150: DONOHUE | L150: ASH | N150: PEAKE | Q150: COLLINS
A151: DANDENONG | C151: GILLINGHAM | F151: JOHNSON | I151: COOK | L151: BASSETT | N151: READ | Q151: WATERS
A152: GOALKICKERS
A153: OAKLEIGH | C153: COUGHLAN 6 | F153: WINTER 4 | I153: COLLINS | K153: VARNEY | M153: ASH | N153: DALE
A154: DANDENONG | C154: BASSETT 3 | F154: HEAD 2 | H154: TODD | J154: LALOR | L154: WATERS | N154: HAMILTON | Q154: COOK | S154: PHIPPS
A156: ROUND 3 | E156: 9TH MAY | J156: WEATHER | M156: SOUTH WIND COLD DULL | S156: PLAYED AT
D157: 1ST QTR | H157: 2ND QTR | L157: 3RD QTR | P157: FINAL | S157: NORTHCOTE
A158: YARRAVILLE | C158: 2 | D158: 5 | E158: =C158*6+D158 -> 17 | G158: 9 | H158: 7 | I158: =G158*6+H158 -> 61 | K158: 11 | L158: 7 | M158: =K158*6+L158 -> 73 | O158: 16 | P158: 7 | Q158: =O158*6+P158 -> 103 | S158: UMPIRE | X158: LADDER | AB158: ROUND | AD158: 3
A159: BRUNSWICK | C159: 3 | D159: 1 | E159: =C159*6+D159 -> 19 | G159: 7 | H159: 1 | I159: =G159*6+H159 -> 43 | K159: 9 | L159: 4 | M159: =K159*6+L159 -> 58 | O159: 11 | P159: 5 | Q159: =O159*6+P159 -> 71 | S159: O'DONOGHUE
A160: BEST PLAYERS | W160: TEAM | X160: W | Y160: L | Z160: D | AA160: FOR | AB160: AGST | AC160: % | AD160: PTS
A161: YARRAVILLE | C161: HART | F161: DRINAN | I161: VANDERFEEN | L161: LETCHER | O161: McTAGGART | R161: LAMONT
A162: BRUNSWICK | C162: EDWARDS | F162: JARMAN | I162: G STANLEY | L162: R THOMPSON | O162: WEIR | R162: McFARLANE | W162: MOORABBIN | X162: 3 | Y162: 0 | Z162: 0 | AA162: 418 | AB162: 159 | AC162: 262.89308176100627 | AD162: 12
A163: GOALKICKERS | W163: WILLIAMSTOWN | X163: 3 | Y163: 0 | Z163: 0 | AA163: 405 | AB163: 181 | AC163: 223.75690607734808 | AD163: 12
A164: YARRAVILLE | C164: HART 5 | E164: VANDERFEEN 3 | H164: MAGEE 2 | J164: CAREY 2 | L164: HOOD | N164: BURT | P164: DRINAN | R164: ANDERSON | W164: SANDRINGHAM | X164: 3 | Y164: 0 | Z164: 0 | AA164: 323 | AB164: 178 | AC164: 181.46067415730337 | AD164: 12
A165: BRUNSWICK | C165: JARMAN 5 | F165: G STANLEY 4 | I165: EDWARDS | L165: W THOMPSON | W165: BOX HILL | X165: 3 | Y165: 0 | Z165: 0 | AA165: 382 | AB165: 230 | AC165: 166.08695652173913 | AD165: 12
A167: SANDRINGHAM | C167: 2 | D167: 3 | E167: =C167*6+D167 -> 15 | G167: 6 | H167: 8 | I167: =G167*6+H167 -> 44 | K167: 8 | L167: 11 | M167: =K167*6+L167 -> 59 | O167: 12 | P167: 20 | Q167: =O167*6+P167 -> 92 | S167: BEACH ROAD | W167: YARRAVILLE | X167: 2 | Y167: 1 | Z167: 0 | AA167: 296 | AB167: 200 | AC167: 148 | AD167: 8
A168: MORDIALLOC | C168: 2 | D168: 7 | E168: =C168*6+D168 -> 19 | G168: 2 | H168: 7 | I168: =G168*6+H168 -> 19 | K168: 6 | L168: 11 | M168: =K168*6+L168 -> 47 | O168: 6 | P168: 12 | Q168: =O168*6+P168 -> 48 | S168: ALLEN | W168: PORT MELBOURNE | X168: 2 | Y168: 1 | Z168: 0 | AA168: 310 | AB168: 262 | AC168: 118.32061068702291 | AD168: 8
A169: BEST PLAYERS | W169: COBURG | X169: 2 | Y169: 1 | Z169: 0 | AA169: 325 | AB169: 275 | AC169: 118.18181818181819 | AD169: 8
A170: SANDRINGHAM | C170: WEBSTER | F170: PATMORE | I170: RICHARDS | L170: VANCE | O170: THOMPSON | R170: BOLAND | W170: OAKLEIGH | X170: 2 | Y170: 1 | Z170: 0 | AA170: 294 | AB170: 283 | AC170: 103.886925795053 | AD170: 8
A171: MORDIALLOC | C171: CRANE | F171: COSTELLO | I171: EGERTON | L171: CRAWFORD | O171: JOSE | R171: MAGINNESS | W171: BRUNSWICK | X171: 1 | Y171: 2 | Z171: 0 | AA171: 308 | AB171: 248 | AC171: 124.19354838709677 | AD171: 4
A172: GOALKICKERS | W172: MORDIALLOC | X172: 1 | Y172: 2 | Z172: 0 | AA172: 238 | AB172: 309 | AC172: 77.02 | AD172: 4
A173: SANDRINGHAM | C173: OAKLEY 4 | F173: VANCE 3 | I173: WEBSTER 2 | L173: RICHARDS | N173: STEELE | P173: LINDSAY | W173: SUNSHINE | X173: 1 | Y173: 2 | Z173: 0 | AA173: 232 | AB173: 327 | AC173: 70.948012232415905 | AD173: 4
A174: MORDIALLOC | C174: CRANE 3 | F174: CRAWFORD 2 | J174: PEARSON | W174: PRESTON | X174: 1 | Y174: 2 | Z174: 0 | AA174: 217 | AB174: 409 | AC174: 53.056234718826403 | AD174: 4
W175: DANDENONG | X175: 0 | Y175: 3 | Z175: 0 | AA175: 245 | AB175: 325 | AC175: 75.38 | AD175: 0
A176: COBURG | C176: 4 | D176: 3 | E176: =C176*6+D176 -> 27 | G176: 10 | H176: 9 | I176: =G176*6+H176 -> 69 | K176: 12 | L176: 10 | M176: =K176*6+L176 -> 82 | O176: 20 | P176: 21 | Q176: =O176*6+P176 -> 141 | S176: PRESTON | W176: BRIGHTON | X176: 0 | Y176: 3 | Z176: 0 | AA176: 229 | AB176: 368 | AC176: 62.228260869565219 | AD176: 0
A177: PRESTON | C177: 3 | D177: 3 | E177: =C177*6+D177 -> 21 | G177: 4 | H177: 6 | I177: =G177*6+H177 -> 30 | K177: 8 | L177: 8 | M177: =K177*6+L177 -> 56 | O177: 8 | P177: 8 | Q177: =O177*6+P177 -> 56 | S177: POLLARD | W177: NORTHCOTE | X177: 0 | Y177: 3 | Z177: 0 | AA177: 174 | AB177: 365 | AC177: 47.671232876712331 | AD177: 0
A178: BEST PLAYERS | W178: CAMBERWELL | X178: 0 | Y178: 3 | Z178: 0 | AA178: 152 | AB178: 429 | AC178: 35.431235431235429 | AD178: 0
A179: COBURG | C179: MAHONEY | F179: SHORT | I179: HORSKINS | L179: WILSON | O179: JORDAN | R179: GOULLET
A180: PRESTON | C180: RYMER | F180: BRYAN | I180: WOOD | L180: WALSH | O180: McLACHLAN | R180: JENSEN
A181: GOALKICKERS
A182: COBURG | C182: BYRON 4 | F182: HORSKINS 3 | I182: GOULLET 3 | L182: MATTHEWS 3 | O182: SHAW 2 | Q182: JORDAN 2 | S182: NEESON | U182: CARR
A183: PRESTON | C183: BOLGER 2 | F183: BAILEY 2 | I183: RYMER | K183: BERGIN | M183: McLACHLAN | P183: CRELLIN
A185: OAKLEIGH | C185: 6 | D185: 4 | E185: =C185*6+D185 -> 40 | G185: 9 | H185: 7 | I185: =G185*6+H185 -> 61 | K185: 18 | L185: 14 | M185: =K185*6+L185 -> 122 | O185: 21 | P185: 18 | Q185: =O185*6+P185 -> 144 | S185: ELSTERNWICK PARK
A186: BRIGHTON | C186: 1 | D186: 1 | E186: =C186*6+D186 -> 7 | G186: 4 | H186: 8 | I186: =G186*6+H186 -> 32 | K186: 5 | L186: 8 | M186: =K186*6+L186 -> 38 | O186: 8 | P186: 16 | Q186: =O186*6+P186 -> 64 | S186: MARCY
A187: BEST PLAYERS
A188: OAKLEIGH | C188: VARNEY | F188: WINTER | I188: COLLINS | L188: KITTO | O188: DALE | R188: NAISMITH
A189: BRIGHTON | C189: MILLS | F189: MAY | I189: P COOPER | L189: W COOPER | O189: CRAIG | R189: ASLING
A190: GOALKICKERS
A191: OAKLEIGH | C191: COLLINS 4 | E191: VARNEY 3 | G191: McGOWAN 3 | J191: KITTO 3 | L191: COUGHLAN 2 | O191: McKEOGH 2 | R191: WINTER 2 | U191: DALE | W191: PALMER
A192: BRIGHTON | C192: P COOPER 3 | F192: ASLING 2 | I192: ASHENHURST | L192: W COOPER | N192: O'MEARA
A194: BOX HILL | C194: 1 | D194: 0 | E194: =C194*6+D194 -> 6 | G194: 7 | H194: 6 | I194: =G194*6+H194 -> 48 | K194: 12 | L194: 9 | M194: =K194*6+L194 -> 81 | O194: 16 | P194: 11 | Q194: =O194*6+P194 -> 107 | S194: BOX HILL
A195: DANDENONG | C195: 3 | D195: 4 | E195: =C195*6+D195 -> 22 | G195: 3 | H195: 5 | I195: =G195*6+H195 -> 23 | K195: 5 | L195: 9 | M195: =K195*6+L195 -> 39 | O195: 11 | P195: 14 | Q195: =O195*6+P195 -> 80 | S195: ROBINSON
A196: BEST PLAYERS
A197: BOX HILL | C197: PRESTON | F197: PLUNKETT | I197: TAYLOR | L197: WRIGHT | O197: WANDIN | R197: ROMARI
A198: DANDENONG | C198: GRAY | F198: WATERS | I198: TODD | L198: HEAD | O198: GOOD | R198: BASSETT
A199: GOALKICKERS
A200: BOX HILL | C200: ROMARI 6 | F200: WHITE 4 | I200: PLUNKETT 3 | L200: PRESTON 3
A201: DANDENONG | C201: HOWER 2 | F201: PHIPPS 2 | I201: KNIGHT 2 | K201: TODD | M201: WATERS | O201: RICKMAN | Q201: BASSETT | T201: VERBEEK
A203: SUNSHINE | C203: 3 | D203: 2 | E203: =C203*6+D203 -> 20 | G203: 6 | H203: 8 | I203: =G203*6+H203 -> 44 | K203: 10 | L203: 11 | M203: =K203*6+L203 -> 71 | O203: 12 | P203: 12 | Q203: =O203*6+P203 -> 84 | S203: SUNSHINE
A204: PORT MELBOURNE | C204: 3 | D204: 3 | E204: =C204*6+D204 -> 21 | G204: 4 | H204: 7 | I204: =G204*6+H204 -> 31 | K204: 6 | L204: 11 | M204: =K204*6+L204 -> 47 | O204: 7 | P204: 17 | Q204: =O204*6+P204 -> 59 | S204: ROACH
A205: BEST PLAYERS
A206: SUNSHINE | C206: TREZISE | F206: SEYMOUR | I206: SWIFT | L206: CROSBIE | O206: KELLY | R206: T CORCORAN
A207: PORT MELBOURNE | C207: CLAXTON | F207: McMASTER | I207: ATKINSON | L207: BONNETT | O207: OUSLEY | R207: LEWIS
A208: GOALKICKERS
A209: SUNSHINE | C209: KELLY 4 | F209: DIX 3 | H209: P FITZGERALD 2 | L209: TREZISE | N209: WARREN | P209: MILNE
A210: PORT MELBOURNE | C210: CLAXTON 3 | F210: BONNETT 2 | I210: OUSLEY | K210: MONKS
A212: WILLIAMSTOWN | C212: 1 | D212: 4 | E212: =C212*6+D212 -> 10 | G212: 7 | H212: 8 | I212: =G212*6+H212 -> 50 | K212: 12 | L212: 8 | M212: =K212*6+L212 -> 80 | O212: 21 | P212: 14 | Q212: =O212*6+P212 -> 140 | S212: WILLIAMSTOWN
A213: NORTHCOTE | C213: 1 | D213: 3 | E213: =C213*6+D213 -> 9 | G213: 2 | H213: 4 | I213: =G213*6+H213 -> 16 | K213: 6 | L213: 6 | M213: =K213*6+L213 -> 42 | O213: 7 | P213: 9 | Q213: =O213*6+P213 -> 51 | S213: DIXON
A214: BEST PLAYERS
A215: WILLIAMSTOWN | C215: CULLINAN | F215: O'CONNOR | I215: MATTHEWS | L215: EVANS | O215: MAZOURIS | R215: MALONEY
A216: NORTHCOTE | C216: VAINS | F216: BRETHERTON | I216: CONYBEAR | L216: BARNES | O216: METHERALL | R216: ROOTSEY
A217: GOALKICKERS
A218: WILLIAMSTOWN | C218: CULLINAN 9 | F218: MAZOURIS 4 | I218: CAIRNS 2 | K218: EVANS | M218: MALONEY | O218: MATTHEWS | R218: PELLY | T218: KELLETT | W218: MURPHY
A219: NORTHCOTE | C219: METHERALL 2 | F219: BARNES 2 | I219: FLANAGAN | L219: VAINS | N219: JACKSON
A221: MOORABBIN | C221: 7 | D221: 7 | E221: =C221*6+D221 -> 49 | G221: 15 | H221: 12 | I221: =G221*6+H221 -> 102 | K221: 18 | L221: 20 | M221: =K221*6+L221 -> 128 | O221: 21 | P221: 21 | Q221: =O221*6+P221 -> 147 | S221: CAMBERWELL
A222: CAMBERWELL | C222: 0 | D222: 1 | E222: =C222*6+D222 -> 1 | G222: 2 | H222: 2 | I222: =G222*6+H222 -> 14 | K222: 2 | L222: 3 | M222: =K222*6+L222 -> 15 | O222: 5 | P222: 7 | Q222: =O222*6+P222 -> 37 | S222: ROWE
A223: BEST PLAYERS
A224: MOORABBIN | C224: McGAW | F224: PAPLEY | I224: RYAN | L224: WHALEBONE | O224: BILLSON | R224: GILDER
A225: CAMBERWELL | C225: WHITTEN | F225: DOUGLAS | I225: FREYBERG | L225: BETHERAS | O225: CASTLES | R225: SEYMOUR
A226: GOALKICKERS
A227: MOORABBIN | C227: PAPLEY 8 | F227: McGAW 4 | I227: WHALEBONE 4 | L227: COLE 2 | N227: RYAN 2 | P227: MEEHAN
A228: CAMBERWELL | C228: FREYBERG 2 | F228: SKALBERG | I228: BENNIE | K228: SEYMOUR
A230: ROUND 4 | E230: 16TH MAY | J230: WEATHER | O230: FINE & SUNNY | S230: PLAYED AT
D231: 1ST QTR | H231: 2ND QTR | L231: 3RD QTR | P231: FINAL | S231: MOORABBIN
A232: MOORABBIN | C232: 4 | D232: 1 | E232: =C232*6+D232 -> 25 | G232: 13 | H232: 8 | I232: =G232*6+H232 -> 86 | K232: 16 | L232: 14 | M232: =K232*6+L232 -> 110 | O232: 23 | P232: 22 | Q232: =O232*6+P232 -> 160 | S232: UMPIRE | X232: LADDER | AB232: ROUND | AD232: 4
A233: BOX HILL | C233: 1 | D233: 3 | E233: =C233*6+D233 -> 9 | G233: 2 | H233: 4 | I233: =G233*6+H233 -> 16 | K233: 5 | L233: 7 | M233: =K233*6+L233 -> 37 | O233: 6 | P233: 8 | Q233: =O233*6+P233 -> 44 | S233: ALLEN
A234: BEST PLAYERS | W234: TEAM | X234: W | Y234: L | Z234: D | AA234: FOR | AB234: AGST | AC234: % | AD234: PTS
A235: MOORABBIN | C235: GILDER | F235: MORONEY | I235: PAPLEY | L235: EVANS | N235: TREZISE | Q235: COLE
A236: BOX HILL | C236: SAWATSKY | F236: PLUNKETT | I236: WRIGHT | L236: BROWN | N236: CRAIG | Q236: CARRICK | W236: MOORABBIN | X236: 4 | Y236: 0 | Z236: 0 | AA236: 578 | AB236: 203 | AC236: 284.72906403940885 | AD236: 16
A237: GOALKICKERS | W237: WILLIAMSTOWN | X237: 4 | Y237: 0 | Z237: 0 | AA237: 483 | AB237: 245 | AC237: 197.14285714285714 | AD237: 16
A238: MOORABBIN | C238: PAPLEY 7 | F238: CRAMERI 5 | I238: McGAW 4 | K238: RYAN 2 | M238: MORONEY 2 | P238: COLE | Q238: BILLSON | S238: MEEHAN | W238: SANDRINGHAM | X238: 4 | Y238: 0 | Z238: 0 | AA238: 493 | AB238: 266 | AC238: 185.33834586466165 | AD238: 16
A239: BOX HILL | C239: SAWATSKY 2 | F239: BRAIN | I239: BROWN | K239: W WANDIN | N239: PLUNKETT | W239: YARRAVILLE | X239: 3 | Y239: 1 | Z239: 0 | AA239: 441 | AB239: 240 | AC239: 183.75 | AD239: 12
A241: WILLIAMSTOWN | C241: 2 | D241: 1 | E241: =C241*6+D241 -> 13 | G241: 5 | H241: 8 | I241: =G241*6+H241 -> 38 | K241: 8 | L241: 15 | M241: =K241*6+L241 -> 63 | O241: 10 | P241: 18 | Q241: =O241*6+P241 -> 78 | S241: PORT MELBOURNE | W241: OAKLEIGH | X241: 3 | Y241: 1 | Z241: 0 | AA241: 527 | AB241: 372 | AC241: 141.66666666666666 | AD241: 12
A242: PORT MELBOURNE | C242: 4 | D242: 4 | E242: =C242*6+D242 -> 28 | G242: 5 | H242: 8 | I242: =G242*6+H242 -> 38 | K242: 7 | L242: 12 | M242: =K242*6+L242 -> 54 | O242: 8 | P242: 16 | Q242: =O242*6+P242 -> 64 | S242: ROBINSON | W242: COBURG | X242: 3 | Y242: 1 | Z242: 0 | AA242: 414 | AB242: 358 | AC242: 115.64245810055866 | AD242: 12
A243: BEST PLAYERS | W243: BOX HILL | X243: 3 | Y243: 1 | Z243: 0 | AA243: 426 | AB243: 390 | AC243: 109.23076923076923 | AD243: 12
A244: WILLIAMSTOWN | C244: CALLAHAN | F244: EVANS | I244: KENT | L244: PELLY | O244: E BEITZEL | R244: MAZOURIS | W244: PORT MELBOURNE | X244: 2 | Y244: 2 | Z244: 0 | AA244: 374 | AB244: 340 | AC244: 110 | AD244: 8
A245: PORT MELBOURNE | C245: MONKS | F245: OUSLEY | I245: COLLINS | L245: ATKINSON | O245: LEWIS | R245: McRAE | W245: MORDIALLOC | X245: 2 | Y245: 2 | Z245: 0 | AA245: 355 | AB245: 372 | AC245: 95.43 | AD245: 8
A246: GOALKICKERS | W246: PRESTON | X246: 2 | Y246: 2 | Z246: 0 | AA246: 341 | AB246: 496 | AC246: 68.75 | AD246: 8
A247: WILLIAMSTOWN | C247: CULLINAN 3 | F247: PELLY 3 | I247: MAZOURIS 2 | L247: MATHEWS | O247: MALONEY | W247: BRUNSWICK | X247: 1 | Y247: 3 | Z247: 0 | AA247: 391 | AB247: 337 | AC247: 116.02373887240356 | AD247: 4
A248: PORT MELBOURNE | C248: MONKS 3 | F248: QUAIFE 2 | I248: BONNETT 2 | L248: CLAXTON | W248: SUNSHINE | X248: 1 | Y248: 3 | Z248: 0 | AA248: 272 | AB248: 472 | AC248: 57.627118644067799 | AD248: 4
W249: DANDENONG | X249: 0 | Y249: 4 | Z249: 0 | AA249: 333 | AB249: 495 | AC249: 67.27 | AD249: 0
A250: COBURG | C250: 2 | D250: 5 | E250: =C250*6+D250 -> 17 | G250: 6 | H250: 9 | I250: =G250*6+H250 -> 45 | K250: 7 | L250: 16 | M250: =K250*6+L250 -> 58 | O250: 12 | P250: 17 | Q250: =O250*6+P250 -> 89 | S250: COBURG | W250: BRIGHTON | X250: 0 | Y250: 4 | Z250: 0 | AA250: 292 | AB250: 485 | AC250: 60.206185567010309 | AD250: 0
A251: BRUNSWICK | C251: 3 | D251: 4 | E251: =C251*6+D251 -> 22 | G251: 4 | H251: 6 | I251: =G251*6+H251 -> 30 | K251: 8 | L251: 6 | M251: =K251*6+L251 -> 54 | O251: 12 | P251: 11 | Q251: =O251*6+P251 -> 83 | S251: MARCY | W251: NORTHCOTE | X251: 0 | Y251: 4 | Z251: 0 | AA251: 261 | AB251: 489 | AC251: 53.37 | AD251: 0
A252: BEST PLAYERS | W252: CAMBERWELL | X252: 0 | Y252: 4 | Z252: 0 | AA252: 241 | AB252: 662 | AC252: 36.404833836858003 | AD252: 0
A253: COBURG | C253: SHAW | F253: CARR | I253: TANCREDI | L253: SHORT | N253: HORSKINS | Q253: GOULLET
A254: BRUNSWICK | C254: HAYES | F254: MCFARLANE | I254: DILLON | L254: WEIR | N254: HOUSE | Q254: R THOMPSON
A255: GOALKICKERS
A256: COBURG | C256: CARR 4 | F256: SHAW 2 | H256: JORDAN | J256: BYRON | L256: GLEESON | N256: GOULLET | P256: MATTHEWS | S256: NEESON
A257: BRUNSWICK | C257: STANLEY 4 | F257: DILLON 3 | I257: McFARLANE 2 | L257: WHILEY | N257: YOUNG | P257: JARMAN
A259: YARRAVILLE | C259: 6 | D259: 5 | E259: =C259*6+D259 -> 41 | G259: 10 | H259: 10 | I259: =G259*6+H259 -> 70 | K259: 15 | L259: 16 | M259: =K259*6+L259 -> 106 | O259: 21 | P259: 19 | Q259: =O259*6+P259 -> 145 | S259: YARRAVILLE
A260: SUNSHINE | C260: 1 | D260: 0 | E260: =C260*6+D260 -> 6 | G260: 3 | H260: 3 | I260: =G260*6+H260 -> 21 | K260: 4 | L260: 6 | M260: =K260*6+L260 -> 30 | O260: 5 | P260: 10 | Q260: =O260*6+P260 -> 40 | S260: JENKINS
A261: BEST PLAYERS
A262: YARRAVILLE | C262: CAREY | F262: DRINAN | I262: COOK | L262: McTAGGART | O262: HOOD | R262: LAMONT
A263: SUNSHINE | C263: SEYMOUR | F263: WHITEHAND | I263: TREZISE | L263: WARREN | O263: MILNE | R263: KELLY
A264: GOALKICKERS
A265: YARRAVILLE | C265: CAREY 7 | F265: CROOK 4 | I265: O'HALLORAN 4 | L265: HOOD 2 | N265: HART 2 | P265: VANDERFEEN 2
A266: SUNSHINE | C266: DIX 2 | F266: SIMMONS | I266: MILNE | K266: KELLY
A268: MORDIALLOC | C268: 4 | D268: 2 | E268: =C268*6+D268 -> 26 | G268: 9 | H268: 4 | I268: =G268*6+H268 -> 58 | K268: 9 | L268: 9 | M268: =K268*6+L268 -> 63 | O268: 17 | P268: 15 | Q268: =O268*6+P268 -> 117 | S268: MORDIALLOC
A269: BRIGHTON | C269: 5 | D269: 4 | E269: =C269*6+D269 -> 34 | G269: 7 | H269: 4 | I269: =G269*6+H269 -> 46 | K269: 8 | L269: 9 | M269: =K269*6+L269 -> 57 | O269: 9 | P269: 9 | Q269: =O269*6+P269 -> 63 | S269: DIXON
A270: BEST PLAYERS
A271: MORDIALLOC | C271: COSTELLO | F271: KERR | I271: EGERTON | L271: BARCLAY | O271: WILKINSON | R271: CRAWFORD
A272: BRIGHTON | C272: W COOPER | F272: BROWNING | I272: O'MEARA | L272: TAYLOR | O272: HOWELL | R272: FOLEY
A273: GOALKICKERS
A274: MORDIALLOC | C274: KERR 5 | F274: CRAWFORD 5 | I274: COSTELLO 3 | L274: PEARSON 2 | O274: CRANE 2
A275: BRIGHTON | C275: P COOPER 4 | F275: W COOPER 2 | I275: ATKINSON | L275: HOWELL | N275: CRAIG
A277: PRESTON | C277: 5 | D277: 7 | E277: =C277*6+D277 -> 37 | G277: 9 | H277: 11 | I277: =G277*6+H277 -> 65 | K277: 13 | L277: 13 | M277: =K277*6+L277 -> 91 | O277: 17 | P277: 22 | Q277: =O277*6+P277 -> 124 | S277: NORTHCOTE
A278: NORTHCOTE | C278: 4 | D278: 2 | E278: =C278*6+D278 -> 26 | G278: 9 | H278: 4 | I278: =G278*6+H278 -> 58 | K278: 12 | L278: 6 | M278: =K278*6+L278 -> 78 | O278: 13 | P278: 9 | Q278: =O278*6+P278 -> 87 | S278: O'DONOGHUE
A279: BEST PLAYERS
A280: PRESTON | C280: McLACHLAN | F280: RYMER | I280: HOWARD | L280: WALSH | O280: WILSON | R280: HAUGHTON
A281: NORTHCOTE | C281: BRETHERTON | F281: VAINS | I281: FLANAGAN | L281: WRIGHT | O281: RYAN | R281: DOWLING
A282: GOALKICKERS
A283: PRESTON | C283: WALSH 6 | F283: McLACHLAN 4 | I283: HAUGHTON 3 | L283: BOLGER | N283: DAWSON | Q283: WISHART | S283: McCRIMMON
A284: NORTHCOTE | C284: FLANAGAN 4 | F284: CONYBEAR 4 | I284: BARNES | K284: BRETHERTON | N284: CRIPPS | P284: WRIGHT | R284: COLLINS
A286: OAKLEIGH | C286: 9 | D286: 4 | E286: =C286*6+D286 -> 58 | G286: 19 | H286: 8 | I286: =G286*6+H286 -> 122 | K286: 28 | L286: 9 | M286: =K286*6+L286 -> 177 | O286: 37 | P286: 11 | Q286: =O286*6+P286 -> 233 | S286: OAKLEIGH
A287: CAMBERWELL | C287: 3 | D287: 0 | E287: =C287*6+D287 -> 18 | G287: 10 | H287: 2 | I287: =G287*6+H287 -> 62 | K287: 13 | L287: 3 | M287: =K287*6+L287 -> 81 | O287: 14 | P287: 5 | Q287: =O287*6+P287 -> 89 | S287: ROACH
A288: BEST PLAYERS
A289: OAKLEIGH | C289: COUGHLAN | F289: McGOWAN | I289: WINTER | L289: DONOHUE | O289: DALE | R289: VARNEY
A290: CAMBERWELL | C290: SEYMOUR | F290: WHITTEN | I290: SKALBERG | L290: FREYBERG | O290: B JOHNSON | R290: MUIR
A291: GOALKICKERS
A292: OAKLEIGH | C292: McGOWAN 11 | F292: COUGHLAN 7 | I292: WINTER 6 | K292: ASH 3 | M292: WILLIAMS 2 | P292: NAISMITH 2 | S292: PALMER 2 | V292: VARNEY 2 | X292: DALE | Z292: COLLINS
A293: CAMBERWELL | C293: SEYMOUR 4 | F293: FREYBERG 3 | I293: MUIR 2 | K293: B JOHNSON 2 | N293: WHETTEN | Q293: McPHERSON | T293: BETHERAS
A295: SANDRINGHAM | C295: 6 | D295: 4 | E295: =C295*6+D295 -> 40 | G295: 13 | H295: 7 | I295: =G295*6+H295 -> 85 | K295: 17 | L295: 13 | M295: =K295*6+L295 -> 115 | O295: 25 | P295: 20 | Q295: =O295*6+P295 -> 170 | S295: DANDENONG
A296: DANDENONG | C296: 5 | D296: 7 | E296: =C296*6+D296 -> 37 | G296: 8 | H296: 8 | I296: =G296*6+H296 -> 56 | K296: 10 | L296: 15 | M296: =K296*6+L296 -> 75 | O296: 12 | P296: 16 | Q296: =O296*6+P296 -> 88 | S296: ROWE
A297: BEST PLAYERS
A298: SANDRINGHAM | C298: OAKLEY | F298: WEBSTER | I298: STEELE | L298: CROFT | O298: PATMORE | R298: BOLAND
A299: DANDENONG | C299: BASSETT | F299: WATERS | I299: GRAY | L299: JOHNSON | O299: O'BRIEN | R299: HEAD
A300: GOALKICKERS
A301: SANDRINGHAM | C301: OAKLEY 12 | F301: STEELE 5 | I301: WEBSTER 3 | L301: PATMORE 3 | O301: WILLIAMS | R301: SHRIVES
A302: DANDENONG | C302: GRAY 5 | F302: BASSETT 2 | I302: HOWER 2 | K302: COOTE | M302: PHIPPS | O302: WATERS
A304: ROUND 5 | E304: 23RD MAY | J304: WEATHER | M304: SOUTH WIND FINE BUT COLD | S304: PLAYED AT
D305: 1ST QTR | H305: 2ND QTR | L305: 3RD QTR | P305: FINAL | S305: MOORABBIN
A306: MOORABBIN | C306: 0 | D306: 2 | E306: =C306*6+D306 -> 2 | G306: 7 | H306: 7 | I306: =G306*6+H306 -> 49 | K306: 9 | L306: 8 | M306: =K306*6+L306 -> 62 | O306: 12 | P306: 15 | Q306: =O306*6+P306 -> 87 | S306: UMPIRE | X306: LADDER | AB306: ROUND | AD306: 5
A307: SANDRINGHAM | C307: 5 | D307: 7 | E307: =C307*6+D307 -> 37 | G307: 6 | H307: 7 | I307: =G307*6+H307 -> 43 | K307: 9 | L307: 14 | M307: =K307*6+L307 -> 68 | O307: 10 | P307: 18 | Q307: =O307*6+P307 -> 78 | S307: O'DONOGHUE
A308: BEST PLAYERS | W308: TEAM | X308: W | Y308: L | Z308: D | AA308: FOR | AB308: AGST | AC308: % | AD308: PTS
A309: MOORABBIN | C309: BOYD | F309: MORONEY | I309: GILDER | L309: MEEHAN | O309: PAPLEY | R309: BILLSON
A310: SANDRINGHAM | C310: CROFT | F310: WEBSTER | I310: VANCE | L310: OAKLEY | O310: RICHARDS | R310: BOLAND | W310: MOORABBIN | X310: 5 | Y310: 0 | Z310: 0 | AA310: 665 | AB310: 281 | AC310: 236.65480427046262 | AD310: 20
A311: GOALKICKERS | W311: WILLIAMSTOWN | X311: 5 | Y311: 0 | Z311: 0 | AA311: 565 | AB311: 312 | AC311: 181.08974358974359 | AD311: 20
A312: MOORABBIN | C312: PAPLEY 5 | F312: MEEHAN 3 | I312: RYAN | K312: MORONEY | N312: McGAW | P312: EVANS | W312: SANDRINGHAM | X312: 4 | Y312: 1 | Z312: 0 | AA312: 571 | AB312: 353 | AC312: 161.75637393767704 | AD312: 16
A313: SANDRINGHAM | C313: OAKLEY 3 | F313: SCOTT | H313: RICHARDS | J313: WEBSTER | L313: WILLIAMS | N313: VANCE | P313: SHRIVES | R313: RANSOM | W313: OAKLEIGH | X313: 4 | Y313: 1 | Z313: 0 | AA313: 608 | AB313: 432 | AC313: 140.74074074074073 | AD313: 16
A315: WILLIAMSTOWN | C315: 1 | D315: 6 | E315: =C315*6+D315 -> 12 | G315: 5 | H315: 8 | I315: =G315*6+H315 -> 38 | K315: 7 | L315: 11 | M315: =K315*6+L315 -> 53 | O315: 10 | P315: 22 | Q315: =O315*6+P315 -> 82 | S315: YARRAVILLE | W315: COBURG | X315: 4 | Y315: 1 | Z315: 0 | AA315: 546 | AB315: 401 | AC315: 136.15960099750623 | AD315: 16
A316: YARRAVILLE | C316: 4 | D316: 7 | E316: =C316*6+D316 -> 31 | G316: 4 | H316: 8 | I316: =G316*6+H316 -> 32 | K316: 9 | L316: 12 | M316: =K316*6+L316 -> 66 | O316: 9 | P316: 13 | Q316: =O316*6+P316 -> 67 | S316: ROWE | W316: YARRAVILLE | X316: 3 | Y316: 2 | Z316: 0 | AA316: 508 | AB316: 322 | AC316: 157.7639751552795 | AD316: 12
A317: BEST PLAYERS | W317: MORDIALLOC | X317: 3 | Y317: 2 | Z317: 0 | AA317: 520 | AB317: 409 | AC317: 127.13 | AD317: 12
A318: WILLIAMSTOWN | C318: MAZOURIS | F318: MATTHEWS | I318: PELLY | L318: BOB JONES | O318: COLQUHOUN | R318: KELLETT | W318: PORT MELBOURNE | X318: 3 | Y318: 2 | Z318: 0 | AA318: 482 | AB318: 384 | AC318: 125.52083333333333 | AD318: 12
A319: YARRAVILLE | C319: LETCHER | F319: DRINAN | I319: ARCHBOLD | L319: BOB BROWN | O319: MASON | R319: McTAGGART | W319: BOX HILL | X319: 3 | Y319: 2 | Z319: 0 | AA319: 486 | AB319: 471 | AC319: 103.18471337579618 | AD319: 12
A320: GOALKICKERS | W320: BRUNSWICK | X320: 2 | Y320: 3 | Z320: 0 | AA320: 509 | AB320: 421 | AC320: 120.90261282660333 | AD320: 8
A321: WILLIAMSTOWN | C321: CULLINAN 2 | F321: MURPHY 2 | I321: MAZOURIS 2 | L321: MALONEY | N321: PELLY | P321: O'CONNOR | R321: MATTHEWS | W321: PRESTON | X321: 2 | Y321: 3 | Z321: 0 | AA321: 385 | AB321: 604 | AC321: 63.74 | AD321: 8
A322: YARRAVILLE | C322: LETCHER 3 | F322: W BROWN 2 | I322: HOOD | K322: BURT | M322: CAREY | O322: VANDERFEEN | W322: DANDENONG | X322: 1 | Y322: 4 | Z322: 0 | AA322: 439 | AB322: 597 | AC322: 73.53 | AD322: 4
W323: SUNSHINE | X323: 1 | Y323: 4 | Z323: 0 | AA323: 315 | AB323: 604 | AC323: 52.152317880794705 | AD323: 4
A324: OAKLEIGH | C324: 2 | D324: 2 | E324: =C324*6+D324 -> 14 | G324: 5 | H324: 9 | I324: =G324*6+H324 -> 39 | K324: 8 | L324: 11 | M324: =K324*6+L324 -> 59 | O324: 11 | P324: 15 | Q324: =O324*6+P324 -> 81 | S324: BOX HILL | W324: BRIGHTON | X324: 0 | Y324: 5 | Z324: 0 | AA324: 394 | AB324: 591 | AC324: 66.666666666666671 | AD324: 0
A325: BOX HILL | C325: 2 | D325: 4 | E325: =C325*6+D325 -> 16 | G325: 5 | H325: 5 | I325: =G325*6+H325 -> 35 | K325: 7 | L325: 9 | M325: =K325*6+L325 -> 51 | O325: 8 | P325: 12 | Q325: =O325*6+P325 -> 60 | S325: DIXON | W325: NORTHCOTE | X325: 0 | Y325: 5 | Z325: 0 | AA325: 345 | AB325: 607 | AC325: 56.84 | AD325: 0
A326: BEST PLAYERS | W326: CAMBERWELL | X326: 0 | Y326: 5 | Z326: 0 | AA326: 278 | AB326: 827 | AC326: 33.615477629987907 | AD326: 0
A327: OAKLEIGH | C327: NAISMITH | F327: McCOOKE | I327: COUGHLAN | L327: VARNEY | O327: DALE | Q327: J WILLIAMS
A328: BOX HILL | C328: EADE | F328: SAWATSKY | I328: TAYLOR | L328: WRIGHT | O328: DICKEY | Q328: BEARDMORE
A329: GOALKICKERS
A330: OAKLEIGH | C330: VARNEY 4 | F330: COUGHLAN 3 | I330: McCOOKE 2 | L330: NAISMITH | N330: McGOWAN
A331: BOX HILL | C331: ROMARI 3 | F331: DICKEY 2 | I331: PRESTON | K331: SAWATSKY | N331: PLUNKETT
A333: PORT MELBOURNE | C333: 7 | D333: 6 | E333: =C333*6+D333 -> 48 | G333: 8 | H333: 9 | I333: =G333*6+H333 -> 57 | K333: 12 | L333: 16 | M333: =K333*6+L333 -> 88 | O333: 15 | P333: 18 | Q333: =O333*6+P333 -> 108 | S333: PRESTON
A334: PRESTON | C334: 0 | D334: 0 | E334: =C334*6+D334 -> 0 | G334: 4 | H334: 3 | I334: =G334*6+H334 -> 27 | K334: 4 | L334: 3 | M334: =K334*6+L334 -> 27 | O334: 6 | P334: 8 | Q334: =O334*6+P334 -> 44 | S334: MARCY
A335: BEST PLAYERS
A336: PORT MELBOURNE | C336: MONKS | F336: FREYER | I336: McRAE | L336: ATKINSON | O336: QUAIFE | R336: LEWIS
A337: PRESTON | C337: LAMBIE | F337: LIVINGSTONE | I337: BRYAN | L337: WILSON | O337: HAUGHTON | R337: HOWARD
A338: GOALKICKERS
A339: PORT MELBOURNE | C339: FREYER 5 | F339: WESTWOOD 4 | I339: EVANS 2 | K339: COLLINS 2 | N339: QUAIFE | P339: MONKS
A340: PRESTON | C340: DAWSON 3 | F340: McCRIMMON | I340: McLACHLAN | L340: WOOD
A342: DANDENONG | C342: 2 | D342: 5 | E342: =C342*6+D342 -> 17 | G342: 9 | H342: 13 | I342: =G342*6+H342 -> 67 | K342: 10 | L342: 13 | M342: =K342*6+L342 -> 73 | O342: 15 | P342: 16 | Q342: =O342*6+P342 -> 106 | S342: ELSTERNWICK PARK
A343: BRIGHTON | C343: 4 | D343: 5 | E343: =C343*6+D343 -> 29 | G343: 6 | H343: 7 | I343: =G343*6+H343 -> 43 | K343: 13 | L343: 17 | M343: =K343*6+L343 -> 95 | O343: 14 | P343: 18 | Q343: =O343*6+P343 -> 102 | S343: TREWIN
A344: BEST PLAYERS
A345: DANDENONG | C345: WATERS | F345: GRAY | I345: HOWER | K345: MINOTTI | N345: TODD | Q345: BASSETT
A346: BRIGHTON | C346: MILLS | F346: W COOPER | I346: MAY | K346: ATKINSON | N346: N COOPER | Q346: O'MEARA
A347: GOALKICKERS
A348: DANDENONG | C348: GRAY 6 | F348: TODD 3 | H348: MINOTTI | J348: CROSBIE | L348: GILLINGHAM | O348: HOWER | Q348: PHIPPS | S348: KNIGHT
A349: BRIGHTON | C349: P COOPER 3 | F349: N COOPER 3 | I349: MAY 2 | K349: ATKINSON 2 | N349: BURSEY | P349: BROWNING | S349: FIDGE | U349: McCANN
A351: BRUNSWICK | C351: 2 | D351: 3 | E351: =C351*6+D351 -> 15 | G351: 7 | H351: 8 | I351: =G351*6+H351 -> 50 | K351: 10 | L351: 10 | M351: =K351*6+L351 -> 70 | O351: 17 | P351: 16 | Q351: =O351*6+P351 -> 118 | S351: NORTHCOTE
A352: NORTHCOTE | C352: 3 | D352: 4 | E352: =C352*6+D352 -> 22 | G352: 3 | H352: 10 | I352: =G352*6+H352 -> 28 | K352: 8 | L352: 11 | M352: =K352*6+L352 -> 59 | O352: 12 | P352: 12 | Q352: =O352*6+P352 -> 84 | S352: O'TOOLE
A353: BEST PLAYERS
A354: BRUNSWICK | C354: WHILEY | F354: WEIR | I354: HAYES | L354: JARMAN | N354: N THOMPSON | Q354: YOUNG
A355: NORTHCOTE | C355: RYAN | F355: COLLINS | I355: WRIGHT | L355: CRIPPS | N355: BRETHERTON | Q355: ROOTSEY
A356: GOALKICKERS
A357: BRUNSWICK | C357: JARMAN 4 | F357: DILLON 3 | H357: WEIR 2 | J357: FORD 2 | L357: McFARLANE 2 | O357: WHILEY 2 | Q357: STANLEY | S357: BARR
A358: NORTHCOTE | C358: CRIPPS 2 | F358: METHERALL 2 | I358: FLANAGAN 2 | L358: CHOATE 2 | N358: WRIGHT | P358: BROWN | R358: MULCAHY | U358: CONYBEAR
A360: COBURG | C360: 4 | D360: 3 | E360: =C360*6+D360 -> 27 | G360: 8 | H360: 10 | I360: =G360*6+H360 -> 58 | K360: 14 | L360: 12 | M360: =K360*6+L360 -> 96 | O360: 19 | P360: 18 | Q360: =O360*6+P360 -> 132 | S360: SUNSHINE
A361: SUNSHINE | C361: 3 | D361: 2 | E361: =C361*6+D361 -> 20 | G361: 4 | H361: 4 | I361: =G361*6+H361 -> 28 | K361: 6 | L361: 7 | M361: =K361*6+L361 -> 43 | O361: 6 | P361: 7 | Q361: =O361*6+P361 -> 43 | S361: ALLEN
A362: BEST PLAYERS
A363: COBURG | C363: GOULLET | F363: SHAW | I363: NEESON | K363: WILSON | N363: O'SULLIVAN | Q363: GLEESON
A364: SUNSHINE | C364: MILNE | F364: CORCORAN | I364: CROSBIE | K364: WHITEHAND | N364: SOMMERVILLE | Q364: SAUNDERS
A365: GOALKICKERS
A366: COBURG | C366: BYRON 7 | F366: GOULLET 3 | I366: SHAW 2 | K366: NEESON 2 | N366: O'SULLIVAN 2 | Q366: WILSON | S366: HORSKINS | V366: MATTHEWS
A367: SUNSHINE | C367: WHITEHAND 2 | F367: MILNE | H367: GREGORY | J367: FITZGERALD | M367: SEYMOUR
A369: MORDIALLOC | C369: 6 | D369: 5 | E369: =C369*6+D369 -> 41 | G369: 15 | H369: 7 | I369: =G369*6+H369 -> 97 | K369: 17 | L369: 11 | M369: =K369*6+L369 -> 113 | O369: 24 | P369: 21 | Q369: =O369*6+P369 -> 165 | S369: CAMBERWELL
A370: CAMBERWELL | C370: 2 | D370: 1 | E370: =C370*6+D370 -> 13 | G370: 2 | H370: 1 | I370: =G370*6+H370 -> 13 | K370: 4 | L370: 5 | M370: =K370*6+L370 -> 29 | O370: 5 | P370: 7 | Q370: =O370*6+P370 -> 37 | S370: JENKINS
A371: BEST PLAYERS
A372: MORDIALLOC | C372: KERR | F372: MAGINNESS | I372: CRAWFORD | L372: COSTELLO | O372: BAKER | R372: CRANE
A373: CAMBERWELL | C373: K CHAMBERS | F373: FREYBERG | I373: EADES | L373: BENNIE | O373: B JOHNSON | R373: SKALBERG
A374: GOALKICKERS
A375: MORDIALLOC | C375: CRAWFORD 7 | F375: KERR 6 | H375: BAKER 4 | J375: O'NEILL 2 | M375: BESANKO 2 | P375: CRANE | R375: MAGINNESS | U375: COSTELLO
A376: CAMBERWELL | C376: FREYBERG 2 | F376: SEYMOUR 2 | I376: EADES
A378: ROUND 6 | E378: 30TH MAY | J378: WEATHER | O378: FINE | S378: PLAYED AT
D379: 1ST QTR | H379: 2ND QTR | L379: 3RD QTR | P379: FINAL | S379: MORDIALLOC
A380: MORDIALLOC | C380: 3 | D380: 2 | E380: =C380*6+D380 -> 20 | G380: 4 | H380: 7 | I380: =G380*6+H380 -> 31 | K380: 5 | L380: 9 | M380: =K380*6+L380 -> 39 | O380: 10 | P380: 12 | Q380: =O380*6+P380 -> 72 | S380: UMPIRE | X380: LADDER | AB380: ROUND | AD380: 6
A381: OAKLEIGH | C381: 3 | D381: 3 | E381: =C381*6+D381 -> 21 | G381: 3 | H381: 5 | I381: =G381*6+H381 -> 23 | K381: 5 | L381: 8 | M381: =K381*6+L381 -> 38 | O381: 6 | P381: 8 | Q381: =O381*6+P381 -> 44 | S381: ROWE
A382: BEST PLAYERS | W382: TEAM | X382: W | Y382: L | Z382: D | AA382: FOR | AB382: AGST | AC382: % | AD382: PTS
A383: MORDIALLOC | C383: CRANE | F383: BESANKO | I383: COSTELLO | L383: BARR | N383: JOSE | Q383: MAUNDER
A384: OAKLEIGH | C384: COUGHLAN | F384: LANE | I384: PRENDERGAST | L384: NAISMITH | N384: McCOOKE | Q384: PILCHER | W384: MOORABBIN | X384: 6 | Y384: 0 | Z384: 0 | AA384: 798 | AB384: 369 | AC384: 216.26016260162601 | AD384: 24
A385: GOALKICKERS | W385: WILLIAMSTOWN | X385: 6 | Y385: 0 | Z385: 0 | AA385: 698 | AB385: 357 | AC385: 195.51820728291315 | AD385: 24
A386: MORDIALLOC | C386: CRAWFORD 2 | F386: HAMILTON 2 | I386: BESANKO | K386: COSTELLO | M386: KERR | O386: MAGINNESS | Q386: FLINN | S386: PEARSON | W386: SANDRINGHAM | X386: 5 | Y386: 1 | Z386: 0 | AA386: 704 | AB386: 427 | AC386: 164.87119437939111 | AD386: 20
A387: OAKLEIGH | C387: PILCHER 3 | F387: VARNEY | I387: DALE | K387: WINTER | W387: COBURG | X387: 5 | Y387: 1 | Z387: 0 | AA387: 679 | AB387: 475 | AC387: 142.94736842105263 | AD387: 20
A389: YARRAVILLE | C389: 8 | D389: 6 | E389: =C389*6+D389 -> 54 | G389: 10 | H389: 7 | I389: =G389*6+H389 -> 67 | K389: 16 | L389: 13 | M389: =K389*6+L389 -> 109 | O389: 19 | P389: 17 | Q389: =O389*6+P389 -> 131 | S389: PORT MELBOURNE | W389: YARRAVILLE | X389: 4 | Y389: 2 | Z389: 0 | AA389: 639 | AB389: 398 | AC389: 160.55276381909547 | AD389: 16
A390: PORT MELBOURNE | C390: 0 | D390: 0 | E390: =C390*6+D390 -> 0 | G390: 2 | H390: 4 | I390: =G390*6+H390 -> 16 | K390: 6 | L390: 6 | M390: =K390*6+L390 -> 42 | O390: 11 | P390: 10 | Q390: =O390*6+P390 -> 76 | S390: ALLEN | W390: MORDIALLOC | X390: 4 | Y390: 2 | Z390: 0 | AA390: 592 | AB390: 453 | AC390: 130.68 | AD390: 16
A391: BEST PLAYERS | W391: OAKLEIGH | X391: 4 | Y391: 2 | Z391: 0 | AA391: 652 | AB391: 504 | AC391: 129.36507936507937 | AD391: 16
A392: YARRAVILLE | C392: CROOK | F392: LETCHER | I392: McTAGGART | L392: DRINAN | O392: LAMONT | R392: BURT | W392: PORT MELBOURNE | X392: 3 | Y392: 3 | Z392: 0 | AA392: 558 | AB392: 515 | AC392: 108.34951456310679 | AD392: 12
A393: PORT MELBOURNE | C393: COLLINS | F393: MONKS | I393: ATKINSON | L393: WITHERS | O393: LEWIS | R393: FREYER | W393: BOX HILL | X393: 3 | Y393: 3 | Z393: 0 | AA393: 560 | AB393: 604 | AC393: 92.715231788079464 | AD393: 12
A394: GOALKICKERS | W394: PRESTON | X394: 3 | Y394: 3 | Z394: 0 | AA394: 476 | AB394: 667 | AC394: 71.36 | AD394: 12
A395: YARRAVILLE | C395: W BROWN 6 | F395: HART 3 | H395: LETCHER 2 | J395: BURT 2 | L395: BARRETT 2 | O395: CAREY 2 | Q395: ANDERSON | T395: LAMONT | W395: BRUNSWICK | X395: 2 | Y395: 4 | Z395: 0 | AA395: 572 | AB395: 512 | AC395: 111.71875 | AD395: 8
A396: PORT MELBOURNE | C396: MONKS 4 | F396: COLLINS 3 | I396: BONNETT 2 | L396: EVANS | N396: FREYER | W396: BRIGHTON | X396: 1 | Y396: 5 | Z396: 0 | AA396: 518 | AB396: 653 | AC396: 79.326186830015317 | AD396: 4
W397: DANDENONG | X397: 1 | Y397: 5 | Z397: 0 | AA397: 527 | AB397: 730 | AC397: 72.19 | AD397: 4
A398: SANDRINGHAM | C398: 3 | D398: 1 | E398: =C398*6+D398 -> 19 | G398: 10 | H398: 6 | I398: =G398*6+H398 -> 66 | K398: 16 | L398: 11 | M398: =K398*6+L398 -> 107 | O398: 20 | P398: 13 | Q398: =O398*6+P398 -> 133 | S398: BEACH ROAD | W398: SUNSHINE | X398: 1 | Y398: 5 | Z398: 0 | AA398: 360 | AB398: 737 | AC398: 48.846675712347356 | AD398: 4
A399: BOX HILL | C399: 4 | D399: 2 | E399: =C399*6+D399 -> 26 | G399: 5 | H399: 2 | I399: =G399*6+H399 -> 32 | K399: 6 | L399: 4 | M399: =K399*6+L399 -> 40 | O399: 11 | P399: 8 | Q399: =O399*6+P399 -> 74 | S399: JENKINS | W399: NORTHCOTE | X399: 0 | Y399: 6 | Z399: 0 | AA399: 419 | AB399: 740 | AC399: 56.62 | AD399: 0
A400: BEST PLAYERS | W400: CAMBERWELL | X400: 0 | Y400: 6 | Z400: 0 | AA400: 340 | AB400: 951 | AC400: 35.751840168243952 | AD400: 0
A401: SANDRINGHAM | C401: OAKLEY | F401: RICHARDS | I401: SHRIVES | L401: WEBSTER | O401: RANSOM | R401: CROFT
A402: BOX HILL | C402: K WHITE | F402: CRAIG | I402: TAYLOR | L402: SAWATSKY | O402: DICKEY | R402: BRAIN
A403: GOALKICKERS
A404: SANDRINGHAM | C404: OAKLEY 14 | F404: WEBSTER 3 | I404: SHRIVES | K404: VANCE | M404: ECCLESTON
A405: BOX HILL | C405: ROMARI 3 | F405: SAWATSKY 2 | I405: DICKEY 2 | K405: BRAIN 2 | M405: K WHITE | O405: NAUGHTON
A407: PRESTON | C407: 6 | D407: 1 | E407: =C407*6+D407 -> 37 | G407: 7 | H407: 2 | I407: =G407*6+H407 -> 44 | K407: 11 | L407: 5 | M407: =K407*6+L407 -> 71 | O407: 14 | P407: 7 | Q407: =O407*6+P407 -> 91 | S407: PRESTON
A408: BRUNSWICK | C408: 1 | D408: 1 | E408: =C408*6+D408 -> 7 | G408: 4 | H408: 5 | I408: =G408*6+H408 -> 29 | K408: 8 | L408: 8 | M408: =K408*6+L408 -> 56 | O408: 9 | P408: 9 | Q408: =O408*6+P408 -> 63 | S408: DIXON
A409: BEST PLAYERS
A410: PRESTON | C410: RYMER | F410: DAWSON | I410: CUTLER | L410: HAUGHTON | O410: McCRIMMON | R410: DANGUAARD
A411: BRUNSWICK | C411: STANLEY | F411: HAYES | I411: JARMAN | L411: LINKINS | O411: LEWIS | R411: ROBSON
A412: GOALKICKERS
A413: PRESTON | C413: WALSH 5 | F413: DAWSON 3 | I413: McCRIMMON 2 | L413: RYMER 2 | N413: CUTLER 2
A414: BRUNSWICK | C414: STANLEY 4 | F414: JARMAN 2 | I414: DILLON 2 | L414: WHILEY
A416: BRIGHTON | C416: 4 | D416: 3 | E416: =C416*6+D416 -> 27 | G416: 9 | H416: 8 | I416: =G416*6+H416 -> 62 | K416: 13 | L416: 12 | M416: =K416*6+L416 -> 90 | O416: 18 | P416: 16 | Q416: =O416*6+P416 -> 124 | S416: ELSTERNWICK PARK
A417: CAMBERWELL | C417: 2 | D417: 1 | E417: =C417*6+D417 -> 13 | G417: 4 | H417: 5 | I417: =G417*6+H417 -> 29 | K417: 7 | L417: 10 | M417: =K417*6+L417 -> 52 | O417: 8 | P417: 14 | Q417: =O417*6+P417 -> 62 | S417: ROBINSON
A418: BEST PLAYERS
A419: BRIGHTON | C419: McCANN | F419: ASLING | I419: BURSEY | L419: GRANT | O419: ATKINSON | R419: WILLIAMS
A420: CAMBERWELL | C420: BENNIE | F420: K JOHNSON | I420: FREYBERG | L420: SKALBERG | O420: COMMONS | R420: WHITTEN
A421: GOALKICKERS
A422: BRIGHTON | C422: P COOPER 6 | F422: ASLING 5 | I422: McCANN 2 | L422: MAY 2 | N422: N COOPER | Q422: W COOPER | T422: BROWNING
A423: CAMBERWELL | C423: FREYBERG 4 | F423: BENNIE 2 | I423: EDWARDS | L423: SEYMOUR
A425: COBURG | C425: 2 | D425: 5 | E425: =C425*6+D425 -> 17 | G425: 8 | H425: 13 | I425: =G425*6+H425 -> 61 | K425: 11 | L425: 16 | M425: =K425*6+L425 -> 82 | O425: 19 | P425: 19 | Q425: =O425*6+P425 -> 133 | S425: NORTHCOTE
A426: NORTHCOTE | C426: 5 | D426: 2 | E426: =C426*6+D426 -> 32 | G426: 6 | H426: 2 | I426: =G426*6+H426 -> 38 | K426: 10 | L426: 5 | M426: =K426*6+L426 -> 65 | O426: 11 | P426: 8 | Q426: =O426*6+P426 -> 74 | S426: TREWIN
A427: BEST PLAYERS
A428: COBURG | C428: BRYON | F428: HOOGEN | I428: O'SULLIVAN | L428: WILSON | O428: YOUNG | R428: JORDAN
A429: NORTHCOTE | C429: WRIGHT | F429: CRIPPS | I429: BRETHERTON | L429: CONYBEAR | O429: ROOTSEY | R429: BROWN
A430: GOALKICKERS
A431: COBURG | C431: BYRON 8 | F431: SHAW 3 | I431: MATTHEWS 2 | L431: JORDAN 2 | N431: HORSKINS | Q431: CARR | R431: GOULLET | U431: O'SULLIVAN
A432: NORTHCOTE | C432: CONYBEAR 5 | F432: GIBBS 2 | I432: BRETHERTON | L432: RYAN | N432: WRIGHT | P432: METHERALL
A434: MOORABBIN | C434: 2 | D434: 0 | E434: =C434*6+D434 -> 12 | G434: 12 | H434: 1 | I434: =G434*6+H434 -> 73 | K434: 16 | L434: 6 | M434: =K434*6+L434 -> 102 | O434: 20 | P434: 13 | Q434: =O434*6+P434 -> 133 | S434: DANDENONG
A435: DANDENONG | C435: 4 | D435: 2 | E435: =C435*6+D435 -> 26 | G435: 7 | H435: 4 | I435: =G435*6+H435 -> 46 | K435: 10 | L435: 8 | M435: =K435*6+L435 -> 68 | O435: 13 | P435: 10 | Q435: =O435*6+P435 -> 88 | S435: HORNE
A436: BEST PLAYERS
A437: MOORABBIN | C437: PAPLEY | F437: MORONEY | I437: TREZISE | L437: COLE | N437: GREEN | Q437: GILDER
A438: DANDENONG | C438: WATERS | F438: JOHNSON | I438: CROWE | L438: HEAD | N438: TODD | Q438: PENNEFATHER
A439: GOALKICKERS
A440: MOORABBIN | C440: PAPLEY 8 | F440: MORONEY 3 | I440: COLE 3 | K440: McGAW 2 | M440: P RYAN | O440: CRAMERI | Q440: WHALEBONE | T440: BURGESS
A441: DANDENONG | C441: DALE 4 | F441: CROWE 3 | I441: GRAY 3 | K441: DART | M441: PHIPPS | O441: TODD
A443: WILLIAMSTOWN | C443: 4 | D443: 2 | E443: =C443*6+D443 -> 26 | G443: 6 | H443: 8 | I443: =G443*6+H443 -> 44 | K443: 13 | L443: 15 | M443: =K443*6+L443 -> 93 | O443: 19 | P443: 19 | Q443: =O443*6+P443 -> 133 | S443: WILLIAMSTOWN
A444: SUNSHINE | C444: 2 | D444: 2 | E444: =C444*6+D444 -> 14 | G444: 3 | H444: 4 | I444: =G444*6+H444 -> 22 | K444: 4 | L444: 6 | M444: =K444*6+L444 -> 30 | O444: 6 | P444: 9 | Q444: =O444*6+P444 -> 45 | S444: O'DONOGHUE
A445: BEST PLAYERS
A446: WILLIAMSTOWN | C446: EVANS | F446: MALONEY | I446: COLQUHOUN | L446: PELLY | O446: BOB JONES | R446: E BEITZEL
A447: SUNSHINE | C447: CROSBIE | F447: SEYMOUR | I447: MILNE | L447: DIX | O447: GREGORY | R447: TREZISE
A448: GOALKICKERS
A449: WILLIAMSTOWN | C449: CULLINAN 5 | F449: MALONEY 4 | I449: PELLY 3 | K449: ANDERSON 2 | N449: MURPHY 2 | Q449: MATTHEWS | T449: MAZOURIS | W449: DAVIES
A450: SUNSHINE | C450: WARREN 2 | F450: LITCHFIELD 2 | J450: DIX | L450: GREGORY
A452: ROUND 7 | E452: 6TH JUNE | J452: WEATHER | O452: FINE MILD | S452: PLAYED AT
D453: 1ST QTR | H453: 2ND QTR | L453: 3RD QTR | P453: FINAL | S453: COBURG
A454: WILLIAMSTOWN | C454: 2 | D454: 1 | E454: =C454*6+D454 -> 13 | G454: 6 | H454: 7 | I454: =G454*6+H454 -> 43 | K454: 9 | L454: 10 | M454: =K454*6+L454 -> 64 | O454: 11 | P454: 16 | Q454: =O454*6+P454 -> 82 | S454: UMPIRE | X454: LADDER | AB454: ROUND | AD454: 7
A455: COBURG | C455: 5 | D455: 5 | E455: =C455*6+D455 -> 35 | G455: 9 | H455: 5 | I455: =G455*6+H455 -> 59 | K455: 9 | L455: 6 | M455: =K455*6+L455 -> 60 | O455: 12 | P455: 9 | Q455: =O455*6+P455 -> 81 | S455: JENKINS
A456: BEST PLAYERS | W456: TEAM | X456: W | Y456: L | Z456: D | AA456: FOR | AB456: AGST | AC456: % | AD456: PTS
A457: WILLIAMSTOWN | C457: PELLY | F457: CULLINAN | I457: MAZOURIS | L457: COLQUHOUN | O457: E BEITZEL | R457: RAMSAY
A458: COBURG | C458: BIGELOW | F458: GOULLET | I458: SHAW | L458: HOOGEN | O458: BRENNAN | R458: WILSON | W458: MOORABBIN | X458: 7 | Y458: 0 | Z458: 0 | AA458: 908 | AB458: 423 | AC458: 214.65721040189126 | AD458: 28
A459: GOALKICKERS | W459: WILLIAMSTOWN | X459: 7 | Y459: 0 | Z459: 0 | AA459: 780 | AB459: 438 | AC459: 178.08219178082192 | AD459: 28
A460: WILLIAMSTOWN | C460: CULLINAN 5 | F460: PELLY 2 | H460: R JONES | J460: MURPHY | M460: ANDERSON | P460: WARD | W460: YARRAVILLE | X460: 5 | Y460: 2 | Z460: 0 | AA460: 748 | AB460: 477 | AC460: 156.81 | AD460: 20
A461: COBURG | C461: SHAW 3 | F461: O'SULLIVAN 2 | I461: BYRON 2 | K461: BEVIS 2 | M461: GOULLET | O461: JORDAN | Q461: MATTHEWS | W461: SANDRINGHAM | X461: 5 | Y461: 2 | Z461: 0 | AA461: 806 | AB461: 532 | AC461: 151.50375939849624 | AD461: 20
A463: OAKLEIGH | C463: 3 | D463: 2 | E463: =C463*6+D463 -> 20 | G463: 7 | H463: 4 | I463: =G463*6+H463 -> 46 | K463: 13 | L463: 6 | M463: =K463*6+L463 -> 84 | O463: 16 | P463: 9 | Q463: =O463*6+P463 -> 105 | S463: OAKLEIGH | W463: COBURG | X463: 5 | Y463: 2 | Z463: 0 | AA463: 760 | AB463: 557 | AC463: 136.44524236983841 | AD463: 20
A464: SANDRINGHAM | C464: 3 | D464: 2 | E464: =C464*6+D464 -> 20 | G464: 6 | H464: 3 | I464: =G464*6+H464 -> 39 | K464: 10 | L464: 3 | M464: =K464*6+L464 -> 63 | O464: 16 | P464: 6 | Q464: =O464*6+P464 -> 102 | S464: HORNE | W464: MORDIALLOC | X464: 5 | Y464: 2 | Z464: 0 | AA464: 648 | AB464: 501 | AC464: 129.34 | AD464: 20
A465: BEST PLAYERS | W465: OAKLEIGH | X465: 5 | Y465: 2 | Z465: 0 | AA465: 757 | AB465: 606 | AC465: 124.91749174917491 | AD465: 20
A466: OAKLEIGH | C466: PALMER | F466: DALE | I466: LASKEY | L466: McGOWAN | O466: COLLINS | R466: WILLIAMS | W466: PORT MELBOURNE | X466: 4 | Y466: 3 | Z466: 0 | AA466: 647 | AB466: 586 | AC466: 110.40955631399318 | AD466: 16
A467: SANDRINGHAM | C467: WEBSTER | F467: SHEERAN | I467: VANCE | L467: SHRIVES | O467: RICHARDS | R467: THOMPSON | W467: BOX HILL | X467: 3 | Y467: 4 | Z467: 0 | AA467: 608 | AB467: 660 | AC467: 92.121212121212125 | AD467: 12
A468: GOALKICKERS | W468: PRESTON | X468: 3 | Y468: 4 | Z468: 0 | AA468: 555 | AB468: 776 | AC468: 71.52 | AD468: 12
A469: OAKLEIGH | C469: PALMER 4 | E469: LASKEY 2 | G469: COLLINS 2 | I469: McGOWAN 2 | L469: VARNEY 2 | N469: McKEOGH | P469: KITTO | R469: COUGHLAN | U469: ASH | W469: BRUNSWICK | X469: 2 | Y469: 5 | Z469: 0 | AA469: 643 | AB469: 601 | AC469: 106.98835274542429 | AD469: 8
A470: SANDRINGHAM | C470: WEBSTER 6 | F470: OAKLEY 3 | I470: BOLAND | K470: STEELE | M470: WILLIAMS | O470: PATMORE | Q470: RICHARDS | S470: RANSOM | W470: DANDENONG | X470: 2 | Y470: 5 | Z470: 0 | AA470: 641 | AB470: 771 | AC470: 83.14 | AD470: 8
R471: VANCE | W471: SUNSHINE | X471: 2 | Y471: 5 | Z471: 0 | AA471: 467 | AB471: 827 | AC471: 56.469165659008468 | AD471: 8
A472: MORDIALLOC | C472: 2 | D472: 4 | E472: =C472*6+D472 -> 16 | G472: 6 | H472: 10 | I472: =G472*6+H472 -> 46 | K472: 7 | L472: 12 | M472: =K472*6+L472 -> 54 | O472: 7 | P472: 14 | Q472: =O472*6+P472 -> 56 | S472: BOX HILL | W472: BRIGHTON | X472: 1 | Y472: 6 | Z472: 0 | AA472: 572 | AB472: 763 | AC472: 74.967234600262117 | AD472: 4
A473: BOX HILL | C473: 1 | D473: 3 | E473: =C473*6+D473 -> 9 | G473: 3 | H473: 3 | I473: =G473*6+H473 -> 21 | K473: 5 | L473: 9 | M473: =K473*6+L473 -> 39 | O473: 6 | P473: 12 | Q473: =O473*6+P473 -> 48 | S473: TREWIN | W473: NORTHCOTE | X473: 0 | Y473: 7 | Z473: 0 | AA473: 509 | AB473: 847 | AC473: 60.09 | AD473: 0
A474: BEST PLAYERS | W474: CAMBERWELL | X474: 0 | Y474: 7 | Z474: 0 | AA474: 381 | AB474: 1065 | AC474: 35.774647887323944 | AD474: 0
A475: MORDIALLOC | C475: DULLARD | F475: O'NEILL | I475: JOSE | L475: PEARSON | N475: MAUNDER | Q475: COSTELLO
A476: BOX HILL | C476: BROWN | F476: MILNE | I476: WITTMER | L476: CRAIG | N476: SAWATSKY | Q476: BRAIN
A477: GOALKICKERS
A478: MORDIALLOC | C478: O'NEILL 3 | F478: PEARSON 2 | I478: MAUNDER 2
A479: BOX HILL | C479: DICKEY 2 | F479: EADE | H479: MILNE | J479: SAWATSKY | M479: ROMARI
A481: YARRAVILLE | C481: 2 | D481: 4 | E481: =C481*6+D481 -> 16 | G481: 10 | H481: 8 | I481: =G481*6+H481 -> 68 | K481: 13 | L481: 12 | M481: =K481*6+L481 -> 90 | O481: 16 | P481: 13 | Q481: =O481*6+P481 -> 109 | S481: YARRAVILLE
A482: PRESTON | C482: 5 | D482: 1 | E482: =C482*6+D482 -> 31 | G482: 6 | H482: 4 | I482: =G482*6+H482 -> 40 | K482: 10 | L482: 6 | M482: =K482*6+L482 -> 66 | O482: 12 | P482: 7 | Q482: =O482*6+P482 -> 79 | S482: O'DONOGHUE
A483: BEST PLAYERS
A484: YARRAVILLE | C484: BURT | F484: LETCHER | I484: CROOK | K484: DRINAN | N484: CAREY | Q484: B BROWN
A485: PRESTON | C485: HOWARD | F485: CUTLER | I485: LAMBIE | K485: McLACHLAN | N485: BRYAN | Q485: BERGIN
A486: GOALKICKERS
A487: YARRAVILLE | C487: BURT 5 | F487: LETCHER 5 | I487: CAREY 2 | K487: W BROWN 2 | N487: BARRETT | P487: CROOK
A488: PRESTON | C488: WALSH 3 | F488: McLACHLAN 2 | J488: CUTLER 2 | M488: BERGIN 2 | O488: DANGUAARD | R488: BRYAN | T488: RYMER
A490: PORT MELBOURNE | C490: 3 | D490: 6 | E490: =C490*6+D490 -> 24 | G490: 5 | H490: 9 | I490: =G490*6+H490 -> 39 | K490: 8 | L490: 13 | M490: =K490*6+L490 -> 61 | O490: 12 | P490: 17 | Q490: =O490*6+P490 -> 89 | S490: NORTHCOTE
A491: BRUNSWICK | C491: 3 | D491: 2 | E491: =C491*6+D491 -> 20 | G491: 6 | H491: 5 | I491: =G491*6+H491 -> 41 | K491: 9 | L491: 9 | M491: =K491*6+L491 -> 63 | O491: 10 | P491: 11 | Q491: =O491*6+P491 -> 71 | S491: ROWE
A492: BEST PLAYERS
A493: PORT MELBOURNE | C493: WITHERS | F493: EVANS | I493: GREENWOOD | L493: McRAE | O493: LEWIS | R493: FREYER
A494: BRUNSWICK | C494: WHILEY | F494: JARMAN | I494: R THOMPSON | L494: DILLON | O494: ROBSON | R494: STANLEY
A495: GOALKICKERS
A496: PORT MELBOURNE | C496: BONNETT 4 | F496: FREYER 3 | I496: MONKS 2 | K496: ROONEY | M496: EVANS | O496: ATKINSON
A497: BRUNSWICK | C497: McKENNA 2 | F497: DILLON 2 | I497: WHILEY 2 | L497: ROBSON | N497: McCORMACK | Q497: WATT | S497: BIBBY
A499: DANDENONG | C499: 5 | D499: 1 | E499: =C499*6+D499 -> 31 | G499: 8 | H499: 2 | I499: =G499*6+H499 -> 50 | K499: 10 | L499: 6 | M499: =K499*6+L499 -> 66 | O499: 17 | P499: 12 | Q499: =O499*6+P499 -> 114 | S499: CAMBERWELL
A500: CAMBERWELL | C500: 2 | D500: 1 | E500: =C500*6+D500 -> 13 | G500: 4 | H500: 2 | I500: =G500*6+H500 -> 26 | K500: 6 | L500: 4 | M500: =K500*6+L500 -> 40 | O500: 6 | P500: 5 | Q500: =O500*6+P500 -> 41 | S500: DIXON
A501: BEST PLAYERS
A502: DANDENONG | C502: TODD | F502: WATERS | I502: HEAD | K502: GRAY | N502: PENNEFATHER | Q502: GUILLE
A503: CAMBERWELL | C503: K JOHNSON | F503: EADES | I503: MOULE | K503: CASTLES | N503: SEYMOUR | Q503: WHITTEN | S503: NORTHCOTE
A504: GOALKICKERS
A505: DANDENONG | C505: GRAY 4 | F505: PHIPPS 3 | H505: TODD 3 | J505: BASSETT 2 | M505: PETERS 2 | O505: CROWE 2 | Q505: MINOTTI
A506: CAMBERWELL | C506: FREYBERG 2 | F506: SEYMOUR 2 | I506: BENNIE | K506: CASTLES
A508: SUNSHINE | C508: 6 | D508: 3 | E508: =C508*6+D508 -> 39 | G508: 9 | H508: 5 | I508: =G508*6+H508 -> 59 | K508: 12 | L508: 10 | M508: =K508*6+L508 -> 82 | O508: 15 | P508: 17 | Q508: =O508*6+P508 -> 107 | S508: SUNSHINE
A509: NORTHCOTE | C509: 3 | D509: 4 | E509: =C509*6+D509 -> 22 | G509: 9 | H509: 6 | I509: =G509*6+H509 -> 60 | K509: 11 | L509: 12 | M509: =K509*6+L509 -> 78 | O509: 13 | P509: 12 | Q509: =O509*6+P509 -> 90 | S509: POLLARD
A510: BEST PLAYERS
A511: SUNSHINE | C511: CROSBIE | F511: KELLY | I511: WARREN | L511: DIX | O511: GREGORY | R511: FITZGERALD
A512: NORTHCOTE | C512: WRIGHT | F512: METHERALL | I512: CRIPPS | L512: GIBBS | O512: FLANAGAN | R512: VAINS
A513: GOALKICKERS
A514: SUNSHINE | C514: KELLY 5 | F514: DIX 3 | I514: WARREN 3 | L514: MILNE 2 | N514: LITCHFIELD | Q514: FOREMAN
A515: NORTHCOTE | C515: SHAW 3 | F515: GIBBS 2 | I515: FLANAGAN 2 | L515: METHERALL 2 | O515: ALLEN | Q515: CRIPPS | S515: VAINS | U515: CONYBEAR
A517: MOORABBIN | C517: 2 | D517: 3 | E517: =C517*6+D517 -> 15 | G517: 7 | H517: 6 | I517: =G517*6+H517 -> 48 | K517: 12 | L517: 9 | M517: =K517*6+L517 -> 81 | O517: 16 | P517: 14 | Q517: =O517*6+P517 -> 110 | S517: MOORABBIN
A518: BRIGHTON | C518: 2 | D518: 2 | E518: =C518*6+D518 -> 14 | G518: 4 | H518: 3 | I518: =G518*6+H518 -> 27 | K518: 6 | L518: 5 | M518: =K518*6+L518 -> 41 | O518: 8 | P518: 6 | Q518: =O518*6+P518 -> 54 | S518: ROACH
A519: BEST PLAYERS
A520: MOORABBIN | C520: TREZISE | F520: COLE | I520: KENT | L520: GREEN | O520: MORONEY | R520: McGAW
A521: BRIGHTON | C521: W COOPER | F521: COCKFIELD | I521: BURSEY | L521: ASLING | O521: McCANN | R521: BROWNING
A522: GOALKICKERS
A523: MOORABBIN | C523: PAPLEY 4 | F523: McGAW 3 | I523: BILLSON 2 | K523: MORONEY 2 | N523: CRAMERI 2 | Q523: MEEHAN 2 | T523: P RYAN
A524: BRIGHTON | C524: BROWNING 3 | F524: P COOPER 3 | I524: BURSEY | K524: HOWELL
A526: ROUND 8 | E526: 13TH JUNE | I526: WEATHER | L526: SOUTH WIND RAIN HAIL COLD WIND | S526: PLAYED AT
D527: 1ST QTR | H527: 2ND QTR | L527: 3RD QTR | P527: FINAL | S527: MORDIALLOC
A528: SANDRINGHAM | C528: 1 | D528: 3 | E528: =C528*6+D528 -> 9 | G528: 6 | H528: 15 | I528: =G528*6+H528 -> 51 | K528: 7 | L528: 18 | M528: =K528*6+L528 -> 60 | O528: 10 | P528: 20 | Q528: =O528*6+P528 -> 80 | S528: UMPIRE | X528: LADDER | AB528: ROUND | AD528: 8
A529: MORDIALLOC | C529: 5 | D529: 5 | E529: =C529*6+D529 -> 35 | G529: 6 | H529: 5 | I529: =G529*6+H529 -> 41 | K529: 9 | L529: 9 | M529: =K529*6+L529 -> 63 | O529: 11 | P529: 11 | Q529: =O529*6+P529 -> 77 | S529: ALLEN
A530: BEST PLAYERS | W530: TEAM | X530: W | Y530: L | Z530: D | AA530: FOR | AB530: AGST | AC530: % | AD530: PTS
A531: SANDRINGHAM | C531: RICHARDS | F531: WEBSTER | I531: BOLAND | L531: SHEERAN | O531: JONES | Q531: VANCE
A532: MORDIALLOC | C532: PEARSON | F532: BARCLAY | I532: CRANE | L532: HAMILTON | O532: JOSE | Q532: FLINN | W532: MOORABBIN | X532: 8 | Y532: 0 | Z532: 0 | AA532: 1062 | AB532: 442 | AC532: 240.27 | AD532: 32
A533: GOALKICKERS | W533: WILLIAMSTOWN | X533: 8 | Y533: 0 | Z533: 0 | AA533: 899 | AB533: 507 | AC533: 177.31755424063115 | AD533: 32
A534: SANDRINGHAM | C534: OAKLEY 7 | F534: ECCLESTON | I534: GLEESON | K534: WEBSTER | W534: YARRAVILLE | X534: 6 | Y534: 2 | Z534: 0 | AA534: 835 | AB534: 530 | AC534: 157.55 | AD534: 24
A535: MORDIALLOC | C535: PEARSON 5 | F535: CRAWFORD 2 | I535: BESANKO | K535: KERR | M535: FLINN | O535: BAKER | W535: SANDRINGHAM | X535: 6 | Y535: 2 | Z535: 0 | AA535: 886 | AB535: 609 | AC535: 145.48440065681444 | AD535: 24
A537: COBURG | C537: 2 | D537: 6 | E537: =C537*6+D537 -> 18 | G537: 6 | H537: 10 | I537: =G537*6+H537 -> 46 | K537: 11 | L537: 16 | M537: =K537*6+L537 -> 82 | O537: 15 | P537: 19 | Q537: =O537*6+P537 -> 109 | S537: COBURG | W537: COBURG | X537: 6 | Y537: 2 | Z537: 0 | AA537: 869 | AB537: 611 | AC537: 142.22585924713584 | AD537: 24
A538: PRESTON | C538: 2 | D538: 3 | E538: =C538*6+D538 -> 15 | G538: 3 | H538: 6 | I538: =G538*6+H538 -> 24 | K538: 4 | L538: 8 | M538: =K538*6+L538 -> 32 | O538: 7 | P538: 12 | Q538: =O538*6+P538 -> 54 | S538: ROWE | W538: OAKLEIGH | X538: 6 | Y538: 2 | Z538: 0 | AA538: 877 | AB538: 631 | AC538: 138.98573692551506 | AD538: 24
A539: BEST PLAYERS | W539: MORDIALLOC | X539: 5 | Y539: 3 | Z539: 0 | AA539: 725 | AB539: 581 | AC539: 124.78 | AD539: 20
A540: COBURG | C540: JORDAN | F540: O'SULLIVAN | I540: WILSON | L540: YOUNG | O540: BYRON | Q540: GOULLET | W540: PORT MELBOURNE | X540: 5 | Y540: 3 | Z540: 0 | AA540: 745 | AB540: 618 | AC540: 120.55016181229773 | AD540: 20
A541: PRESTON | C541: WILSON | F541: HAUGHTON | I541: RYMER | L541: DAWSON | O541: JENSEN | Q541: McCRIMMON | W541: BOX HILL | X541: 3 | Y541: 5 | Z541: 0 | AA541: 679 | AB541: 753 | AC541: 90.172642762284198 | AD541: 12
A542: GOALKICKERS | W542: DANDENONG | X542: 3 | Y542: 5 | Z542: 0 | AA542: 734 | AB542: 842 | AC542: 87.17 | AD542: 12
A543: COBURG | C543: BYRON 6 | E543: BEVIS 2 | G543: O'SULLIVAN 2 | J543: HUNTINGTON 2 | M543: WILSON | O543: JORDAN | Q543: HORSKINS | W543: PRESTON | X543: 3 | Y543: 5 | Z543: 0 | AA543: 609 | AB543: 885 | AC543: 68.81 | AD543: 12
A544: PRESTON | C544: DAWSON 2 | F544: McCRIMMON | I544: RYMER | K544: McLACHLAN | N544: WALSH | P544: HAUGHTON | W544: BRUNSWICK | X544: 2 | Y544: 6 | Z544: 0 | AA544: 696 | AB544: 688 | AC544: 101.16279069767442 | AD544: 8
W545: SUNSHINE | X545: 2 | Y545: 6 | Z545: 0 | AA545: 499 | AB545: 925 | AC545: 53.945945945945944 | AD545: 8
A546: PORT MELBOURNE | C546: 1 | D546: 2 | E546: =C546*6+D546 -> 8 | G546: 6 | H546: 4 | I546: =G546*6+H546 -> 40 | K546: 12 | L546: 8 | M546: =K546*6+L546 -> 80 | O546: 14 | P546: 14 | Q546: =O546*6+P546 -> 98 | S546: PORT MELBOURNE | W546: BRIGHTON | X546: 1 | Y546: 7 | Z546: 0 | AA546: 597 | AB546: 883 | AC546: 67.610419026047566 | AD546: 4
A547: SUNSHINE | C547: 0 | D547: 3 | E547: =C547*6+D547 -> 3 | G547: 1 | H547: 6 | I547: =G547*6+H547 -> 12 | K547: 4 | L547: 7 | M547: =K547*6+L547 -> 31 | O547: 4 | P547: 8 | Q547: =O547*6+P547 -> 32 | S547: MARCY | W547: NORTHCOTE | X547: 0 | Y547: 8 | Z547: 0 | AA547: 578 | AB547: 966 | AC547: 59.83 | AD547: 0
A548: BEST PLAYERS | W548: CAMBERWELL | X548: 0 | Y548: 8 | Z548: 0 | AA548: 400 | AB548: 1219 | AC548: 32.81 | AD548: 0
A549: PORT MELBOURNE | C549: QUAIFE | F549: CLAXTON | I549: MONKS | L549: LEWIS | O549: FREYER | Q549: WEBSTER
A550: SUNSHINE | C550: TREZISE | F550: CROSBIE | I550: SEYMOUR | L550: FITZGERALD | O550: SWIFT | Q550: E JEPSON
A551: GOALKICKERS
A552: PORT MELBOURNE | C552: CLAXTON 3 | F552: MONKS 3 | I552: BONNETT 2 | L552: QUAIFE 2 | N552: FREYER 2 | Q552: EVANS | S552: WEBSTER
A553: SUNSHINE | C553: FOGARTY 2 | F553: WARREN | I553: TREZISE
A555: OAKLEIGH | C555: 4 | D555: 5 | E555: =C555*6+D555 -> 29 | G555: 9 | H555: 8 | I555: =G555*6+H555 -> 62 | K555: 13 | L555: 10 | M555: =K555*6+L555 -> 88 | O555: 17 | P555: 18 | Q555: =O555*6+P555 -> 120 | S555: OAKLEIGH
A556: BRIGHTON | C556: 1 | D556: 1 | E556: =C556*6+D556 -> 7 | G556: 1 | H556: 1 | I556: =G556*6+H556 -> 7 | K556: 2 | L556: 1 | M556: =K556*6+L556 -> 13 | O556: 4 | P556: 1 | Q556: =O556*6+P556 -> 25 | S556: TREWIN
A557: BEST PLAYERS
A558: OAKLEIGH | C558: COUGHLAN | F558: PALMER | I558: NAISMITH | L558: LANE | O558: COLLINS | R558: MCCOOKE
A559: BRIGHTON | C559: BROWNING | F559: McCANN | I559: ASLING | L559: MILLS | O559: HOWELL | R559: W COOPER
A560: GOALKICKERS
A561: OAKLEIGH | C561: COUGHLAN 5 | F561: J WILLIAMS 3 | I561: PALMER 2 | L561: McCOOKE 2 | O561: LASKEY 2 | Q561: ASH 2 | S561: FOAT
A562: BRIGHTON | C562: BURSEY 2 | F562: McCANN | I562: BROWNING
E563: 15TH JUNE | H563: QUEENS BIRTHDAY | L563: WEATHER | O563: SOUTH WIND DULL
A564: DANDENONG | C564: 2 | D564: 3 | E564: =C564*6+D564 -> 15 | G564: 6 | H564: 9 | I564: =G564*6+H564 -> 45 | K564: 10 | L564: 12 | M564: =K564*6+L564 -> 72 | O564: 13 | P564: 15 | Q564: =O564*6+P564 -> 93 | S564: DANDENONG
A565: BOX HILL | C565: 3 | D565: 4 | E565: =C565*6+D565 -> 22 | G565: 5 | H565: 4 | I565: =G565*6+H565 -> 34 | K565: 8 | L565: 6 | M565: =K565*6+L565 -> 54 | O565: 10 | P565: 11 | Q565: =O565*6+P565 -> 71 | S565: ROACH
A566: BEST PLAYERS
A567: DANDENONG | C567: WATERS | F567: JOHNSON | I567: TODD | L567: LALOR | O567: GRAY | R567: GUILLE
A568: BOX HILL | C568: WITTMER | F568: PORTEOUS | I568: ROCHOW | L568: WRIGHT | O568: TAYLOR | R568: MILNE
A569: GOALKICKERS
A570: DANDENONG | C570: GRAY 4 | F570: TODD 3 | H570: WATERS | J570: MINOTTI | M570: DALE | O570: PETERS | Q570: CROWE | S570: LALOR
A571: BOX HILL | C571: BROWN 2 | F571: PLUNKETT 2 | I571: SAWATSKY 2 | L571: WHITE | N571: MILNE | P571: ROMARI | R571: PORTEOUS
A573: YARRAVILLE | C573: 3 | D573: 3 | E573: =C573*6+D573 -> 21 | G573: 6 | H573: 4 | I573: =G573*6+H573 -> 40 | K573: 9 | L573: 7 | M573: =K573*6+L573 -> 61 | O573: 13 | P573: 9 | Q573: =O573*6+P573 -> 87 | S573: YARRAVILLE
A574: BRUNSWICK | C574: 3 | D574: 1 | E574: =C574*6+D574 -> 19 | G574: 4 | H574: 6 | I574: =G574*6+H574 -> 30 | K574: 7 | L574: 8 | M574: =K574*6+L574 -> 50 | O574: 7 | P574: 11 | Q574: =O574*6+P574 -> 53 | S574: HORNE
A575: BEST PLAYERS
A576: YARRAVILLE | C576: McTAGGART | F576: CAREY | I576: VANDERFEEN | L576: LETCHER | O576: ARCHBOLD | R576: DRINAN
A577: BRUNSWICK | C577: DILLON | F577: McKENNA | I577: R THOMPSON | L577: RYAN | O577: ROBSON | R577: MCFARLANE
A578: GOALKICKERS
A579: YARRAVILLE | C579: VANDERFEEN 4 | F579: BARRETT 2 | I579: LETCHER 2 | L579: CAREY 2 | N579: HART | P579: W BROWN | R579: CROOK
A580: BRUNSWICK | C580: McFARLANE 3 | F580: ROBSON 3 | I580: BIBBY
A582: WILLIAMSTOWN | C582: 2 | D582: 2 | E582: =C582*6+D582 -> 14 | G582: 5 | H582: 7 | I582: =G582*6+H582 -> 37 | K582: 12 | L582: 13 | M582: =K582*6+L582 -> 85 | O582: 17 | P582: 17 | Q582: =O582*6+P582 -> 119 | S582: NORTHCOTE
A583: NORTHCOTE | C583: 2 | D583: 6 | E583: =C583*6+D583 -> 18 | G583: 5 | H583: 12 | I583: =G583*6+H583 -> 42 | K583: 9 | L583: 12 | M583: =K583*6+L583 -> 66 | O583: 9 | P583: 15 | Q583: =O583*6+P583 -> 69 | S583: DIXON
A584: BEST PLAYERS
A585: WILLIAMSTOWN | C585: MAZOURIS | F585: CULLINAN | I585: CALLAHAN | L585: MATTHEWS | O585: E BEITZEL | R585: CAIRNS
A586: NORTHCOTE | C586: R SMITH | F586: SHAW | I586: BRETHERTON | L586: RYAN | O586: WRIGHT | R586: FLANAGAN
A587: GOALKICKERS
A588: WILLIAMSTOWN | C588: CULLINAN 7 | F588: MAZOURIS 3 | I588: CAIRNS 2 | K588: R SMITH 2 | N588: MATTHEWS 2 | Q588: MALONEY
A589: NORTHCOTE | C589: SHAW 3 | F589: GIBBS 2 | I589: BROWN 2 | K589: RYAN | M589: METHERALL
A591: MOORABBIN | C591: 3 | D591: 6 | E591: =C591*6+D591 -> 24 | G591: 7 | H591: 11 | I591: =G591*6+H591 -> 53 | K591: 14 | L591: 16 | M591: =K591*6+L591 -> 100 | O591: 22 | P591: 12 | Q591: =O591*6+P591 -> 144 | S591: MOORABBIN
A592: CAMBERWELL | C592: 0 | D592: 2 | E592: =C592*6+D592 -> 2 | G592: 1 | H592: 5 | I592: =G592*6+H592 -> 11 | K592: 2 | L592: 7 | M592: =K592*6+L592 -> 19 | O592: 2 | P592: 7 | Q592: =O592*6+P592 -> 19 | S592: O'DONOGHUE
A593: BEST PLAYERS
A594: MOORABBIN | C594: GILDER | F594: MORONEY | I594: BILLSON | L594: PAPLEY | O594: McGAW | R594: RYAN
A595: CAMBERWELL | C595: BENNIE | F595: EADES | I595: CASTLES | L595: McPHERSON | O595: FREYBERG | R595: WATTS
A596: GOALKICKERS
A597: MOORABBIN | C597: PAPLEY 6 | F597: McGAW 5 | I597: BILLSON 4 | L597: MORONEY 2 | O597: RYAN 2 | Q597: COLE | R597: MEEHAN | U597: CRAMERI
A598: CAMBERWELL | C598: WATTS | F598: McPHERSON
A600: ROUND 9 | E600: 20TH JUNE | J600: WEATHER | M600: NORTH WIND RAIN BEFORE GAMES | S600: PLAYED AT
D601: 1ST QTR | H601: 2ND QTR | L601: 3RD QTR | P601: FINAL | S601: WILLIAMSTOWN
A602: WILLIAMSTOWN | C602: 3 | D602: 3 | E602: =C602*6+D602 -> 21 | G602: 12 | H602: 9 | I602: =G602*6+H602 -> 81 | K602: 17 | L602: 13 | M602: =K602*6+L602 -> 115 | O602: 22 | P602: 15 | Q602: =O602*6+P602 -> 147 | S602: UMPIRE | X602: LADDER | AB602: ROUND | AD602: 9
A603: PORT MELBOURNE | C603: 4 | D603: 3 | E603: =C603*6+D603 -> 27 | G603: 7 | H603: 5 | I603: =G603*6+H603 -> 47 | K603: 9 | L603: 7 | M603: =K603*6+L603 -> 61 | O603: 12 | P603: 11 | Q603: =O603*6+P603 -> 83 | S603: ALLEN
A604: BEST PLAYERS | W604: TEAM | X604: W | Y604: L | Z604: D | AA604: FOR | AB604: AGST | AC604: % | AD604: PTS
A605: WILLIAMSTOWN | C605: SMITH | E605: CAIRNS | H605: EVANS | K605: MATTHEWS | N605: MURPHY | Q605: E BEITZEL
A606: PORT MELBOURNE | C606: OUSLEY | E606: BOWEN | H606: EVANS | K606: WITHERS | N606: BONNET | Q606: QUAIFE | W606: WILLIAMSTOWN | X606: 9 | Y606: 0 | Z606: 0 | AA606: 1046 | AB606: 590 | AC606: 177.28813559322035 | AD606: 36
A607: GOALKICKERS | S607: CAIRNS | W607: MOORABBIN | X607: 8 | Y607: 1 | Z607: 0 | AA607: 1136 | AB607: 549 | AC607: 206.92 | AD607: 32
A608: WILLIAMSTOWN | C608: CULLINAN 8 | F608: MATTHEWS 3 | I608: MAZOURIS 3 | L608: EVANS 3 | N608: MALONEY 2 | Q608: PELLY | S608: MURPHY | W608: OAKLEIGH | X608: 7 | Y608: 2 | Z608: 0 | AA608: 1045 | AB608: 645 | AC608: 162.01550387596899 | AD608: 28
A609: PORT MELBOURNE | C609: BONNETT 6 | F609: EVANS 2 | I609: COLLINS 2 | L609: QUAIFE 2 | W609: SANDRINGHAM | X609: 7 | Y609: 2 | Z609: 0 | AA609: 1006 | AB609: 643 | AC609: 156.45412130637635 | AD609: 28
A611: BOX HILL | C611: 5 | D611: 3 | E611: =C611*6+D611 -> 33 | G611: 11 | H611: 7 | I611: =G611*6+H611 -> 73 | K611: 13 | L611: 11 | M611: =K611*6+L611 -> 89 | O611: 15 | P611: 17 | Q611: =O611*6+P611 -> 107 | S611: BOX HILL | W611: YARRAVILLE | X611: 7 | Y611: 2 | Z611: 0 | AA611: 931 | AB611: 599 | AC611: 155.43 | AD611: 28
A612: MOORABBIN | C612: 3 | D612: 5 | E612: =C612*6+D612 -> 23 | G612: 4 | H612: 8 | I612: =G612*6+H612 -> 32 | K612: 6 | L612: 12 | M612: =K612*6+L612 -> 48 | O612: 10 | P612: 14 | Q612: =O612*6+P612 -> 74 | S612: HORNE | W612: COBURG | X612: 7 | Y612: 2 | Z612: 0 | AA612: 963 | AB612: 677 | AC612: 142.24519940915806 | AD612: 28
A613: BEST PLAYERS | W613: MORDIALLOC | X613: 6 | Y613: 3 | Z613: 0 | AA613: 836 | AB613: 661 | AC613: 126.48 | AD613: 24
A614: BOX HILL | C614: BROWN | F614: DUMMELOW | I614: WITTMER | L614: ROCHOW | O614: TAYLOR | Q614: K WHITE | W614: PORT MELBOURNE | X614: 5 | Y614: 4 | Z614: 0 | AA614: 828 | AB614: 765 | AC614: 108.23529411764706 | AD614: 20
A615: MOORABBIN | C615: TREZISE | F615: PECK | I615: GILDER | L615: CRAMERI | O615: BOYD | Q615: RYAN | W615: BOX HILL | X615: 4 | Y615: 5 | Z615: 0 | AA615: 786 | AB615: 827 | AC615: 95.042321644498188 | AD615: 16
A616: GOALKICKERS | W616: PRESTON | X616: 4 | Y616: 5 | Z616: 0 | AA616: 731 | AB616: 970 | AC616: 75.36 | AD616: 16
A617: BOX HILL | C617: PLUNKETT 4 | F617: SALVADO 3 | I617: BRAIN | K617: DICKEY | M617: BROWN | O617: ROMARI | W617: DANDENONG | X617: 3 | Y617: 6 | Z617: 0 | AA617: 768 | AB617: 962 | AC617: 79.83 | AD617: 12
A618: MOORABBIN | C618: CRAMERI 3 | F618: COLE | H618: KENT | J618: WHALEBONE | M618: PECK | O618: PAPLEY | Q618: MEEHAN | S618: RYAN | W618: BRUNSWICK | X618: 2 | Y618: 7 | Z618: 0 | AA618: 762 | AB618: 782 | AC618: 97.442455242966759 | AD618: 8
W619: SUNSHINE | X619: 2 | Y619: 7 | Z619: 0 | AA619: 568 | AB619: 1021 | AC619: 55.631733594515183 | AD619: 8
A620: SANDRINGHAM | C620: 5 | D620: 6 | E620: =C620*6+D620 -> 36 | G620: 7 | H620: 11 | I620: =G620*6+H620 -> 53 | K620: 13 | L620: 15 | M620: =K620*6+L620 -> 93 | O620: 17 | P620: 18 | Q620: =O620*6+P620 -> 120 | S620: BEACH ROAD | W620: BRIGHTON | X620: 1 | Y620: 8 | Z620: 0 | AA620: 677 | AB620: 994 | AC620: 68.108651911468812 | AD620: 4
A621: DANDENONG | C621: 1 | D621: 2 | E621: =C621*6+D621 -> 8 | G621: 1 | H621: 4 | I621: =G621*6+H621 -> 10 | K621: 2 | L621: 7 | M621: =K621*6+L621 -> 19 | O621: 4 | P621: 10 | Q621: =O621*6+P621 -> 34 | S621: ROWE | W621: NORTHCOTE | X621: 0 | Y621: 9 | Z621: 0 | AA621: 663 | AB621: 1088 | AC621: 60.94 | AD621: 0
A622: BEST PLAYERS | W622: CAMBERWELL | X622: 0 | Y622: 9 | Z622: 0 | AA622: 414 | AB622: 1387 | AC622: 29.85 | AD622: 0
A623: SANDRINGHAM | C623: RANSOM | F623: CROFT | I623: BOLAND | L623: SHRIVES | O623: STEELE | Q623: WEBSTER
A624: DANDENONG | C624: WATERS | F624: GILLINGHAM | I624: HEAD | L624: GUILLE | O624: DART | Q624: O'BRIEN
A625: GOALKICKERS
A626: SANDRINGHAM | C626: OAKLEY 4 | F626: SHRIVES 4 | I626: GLEESON 3 | L626: WEBSTER 2 | O626: ECCLESTON 2 | R626: VANCE | T626: PATMORE
A627: DANDENONG | C627: TODD | E627: WATERS | H627: DALE | J627: GRAY
A629: COBURG | C629: 1 | D629: 1 | E629: =C629*6+D629 -> 7 | G629: 4 | H629: 4 | I629: =G629*6+H629 -> 28 | K629: 8 | L629: 11 | M629: =K629*6+L629 -> 59 | O629: 13 | P629: 16 | Q629: =O629*6+P629 -> 94 | S629: NORTHCOTE
A630: BRUNSWICK | C630: 3 | D630: 4 | E630: =C630*6+D630 -> 22 | G630: 6 | H630: 7 | I630: =G630*6+H630 -> 43 | K630: 7 | L630: 10 | M630: =K630*6+L630 -> 52 | O630: 9 | P630: 12 | Q630: =O630*6+P630 -> 66 | S630: O'DONOGHUE
A631: BEST PLAYERS
A632: COBURG | C632: GOULLET | F632: BYRON | I632: BRENNAN | L632: SHORT | O632: YOUNG | R632: WILSON
A633: BRUNSWICK | C633: WHILEY | F633: R DILLON | I633: K DILLON | L633: JARMAN | O633: LEWIS | R633: RYAN
A634: GOALKICKERS
A635: COBURG | C635: BYRON 5 | F635: HORSKINS 3 | I635: MATTHEWS 2 | L635: HUNTINGTON | O635: GLEESON | Q635: O'SULLIVAN
A636: BRUNSWICK | C636: K DILLON 3 | F636: WHILEY 3 | I636: BIBBY | K636: STANLEY | M636: McKENNA
A638: PRESTON | C638: 2 | D638: 1 | E638: =C638*6+D638 -> 13 | G638: 10 | H638: 5 | I638: =G638*6+H638 -> 65 | K638: 13 | L638: 5 | M638: =K638*6+L638 -> 83 | O638: 18 | P638: 14 | Q638: =O638*6+P638 -> 122 | S638: PRESTON
A639: NORTHCOTE | C639: 5 | D639: 4 | E639: =C639*6+D639 -> 34 | G639: 7 | H639: 7 | I639: =G639*6+H639 -> 49 | K639: 10 | L639: 13 | M639: =K639*6+L639 -> 73 | O639: 12 | P639: 13 | Q639: =O639*6+P639 -> 85 | S639: ROACH
A640: BEST PLAYERS
A641: PRESTON | C641: BRYAN | F641: WOOD | I641: McLACHLAN | L641: DAWSON | O641: WALSH | Q641: WILSON
A642: NORTHCOTE | C642: BRETHERTON | F642: WRIGHT | I642: FLANAGAN | L642: METHERALL | O642: RYAN | Q642: GIBBS
A643: GOALKICKERS
A644: PRESTON | C644: WALSH 5 | E644: REYNOLDS 2 | H644: HOWARD 2 | K644: CUTLER 2 | M644: McLACHLAN 2 | P644: LAMBIE 2 | R644: WILSON | T644: BRYAN | W644: DAWSON
A645: NORTHCOTE | C645: GIBBS 3 | E645: FLANAGAN 2 | H645: VAINS 2 | J645: RYAN | L645: SHAW | N645: METHERALL | Q645: WRIGHT | S645: BARNES
A647: MORDIALLOC | C647: 6 | D647: 4 | E647: =C647*6+D647 -> 40 | G647: 10 | H647: 6 | I647: =G647*6+H647 -> 66 | K647: 14 | L647: 11 | M647: =K647*6+L647 -> 95 | O647: 16 | P647: 15 | Q647: =O647*6+P647 -> 111 | S647: ELSTERNWICK PARK
A648: BRIGHTON | C648: 1 | D648: 3 | E648: =C648*6+D648 -> 9 | G648: 4 | H648: 8 | I648: =G648*6+H648 -> 32 | K648: 6 | L648: 10 | M648: =K648*6+L648 -> 46 | O648: 11 | P648: 14 | Q648: =O648*6+P648 -> 80 | S648: MARCY
A649: BEST PLAYERS
A650: MORDIALLOC | C650: BESANKO | F650: CRAWFORD | I650: PEARSON | L650: BAKER | O650: KERR | Q650: HAMILTON
A651: BRIGHTON | C651: ASLING | F651: N COOPER | I651: COCKFIELD | L651: P COOPER | O651: BURSEY | Q651: W COOPER
A652: GOALKICKERS
A653: MORDIALLOC | C653: BAKER 5 | E653: PEARSON 3 | H653: HAMILTON 2 | K653: KERR 2 | M653: CRAWFORD 2 | P653: SHEEHAN | R653: BESANKO
A654: BRIGHTON | C654: P COOPER 4 | F654: ASLING 2 | I654: W COOPER | L654: BURSEY | N654: FOX | P654: N COOPER | R654: CRAIG
A656: OAKLEIGH | C656: 7 | D656: 8 | E656: =C656*6+D656 -> 50 | G656: 13 | H656: 12 | I656: =G656*6+H656 -> 90 | K656: 20 | L656: 21 | M656: =K656*6+L656 -> 141 | O656: 24 | P656: 24 | Q656: =O656*6+P656 -> 168 | S656: CAMBERWELL
A657: CAMBERWELL | C657: 0 | D657: 2 | E657: =C657*6+D657 -> 2 | G657: 0 | H657: 6 | I657: =G657*6+H657 -> 6 | K657: 0 | L657: 6 | M657: =K657*6+L657 -> 6 | O657: 1 | P657: 8 | Q657: =O657*6+P657 -> 14 | S657: ROBINSON
A658: BEST PLAYERS
A659: OAKLEIGH | C659: LASKEY | F659: J WILLIAMS | I659: COLLINS | L659: DALE | O659: ASH | R659: PALMER
A660: CAMBERWELL | C660: K CHAMBERS | F660: BENNIE | I660: SEYMOUR | L660: CASTLES | O660: SKALBERG | R660: COMMONS
A661: GOALKICKERS
A662: OAKLEIGH | C662: J WILLIAMS 10 | F662: LASKEY 4 | I662: COLLINS 4 | L662: VARNEY 2 | N662: ASH | P662: NAISMITH | R662: COUGHLAN | U662: PALMER
A663: CAMBERWELL | C663: MUIR
A665: YARRAVILLE | C665: 2 | D665: 3 | E665: =C665*6+D665 -> 15 | G665: 4 | H665: 8 | I665: =G665*6+H665 -> 32 | K665: 9 | L665: 10 | M665: =K665*6+L665 -> 64 | O665: 14 | P665: 12 | Q665: =O665*6+P665 -> 96 | S665: SUNSHINE
A666: SUNSHINE | C666: 1 | D666: 2 | E666: =C666*6+D666 -> 8 | G666: 2 | H666: 8 | I666: =G666*6+H666 -> 20 | K666: 3 | L666: 12 | M666: =K666*6+L666 -> 30 | O666: 9 | P666: 15 | Q666: =O666*6+P666 -> 69 | S666: TREWIN
A667: BEST PLAYERS
A668: YARRAVILLE | C668: LETCHER | F668: GOODEN | I668: BOURKE | L668: LAMONT | O668: McTAGGART | R668: MASON
A669: SUNSHINE | C669: FOREMAN | F669: WARREN | I669: SAUNDERS | L669: CROSBIE | O669: SEYMOUR | R669: MILNE
A670: GOALKICKERS
A671: YARRAVILLE | C671: VANDERFEEN 3 | F671: CAREY 3 | I671: LETCHER 2 | L671: BURT 2 | N671: LAMONT | P671: GOODEN | R671: TARRANT | U671: O'HALLORAN
A672: SUNSHINE | C672: FOREMAN 4 | F672: LITCHFIELD | I672: DIX | K672: SEYMOUR | N672: M JEPSON | Q672: FOGARTY
A674: ROUND 10 | E674: 27TH JUNE | J674: WEATHER | O674: SOUTH EAST WIND | S674: PLAYED AT
D675: 1ST QTR | H675: 2ND QTR | L675: 3RD QTR | P675: FINAL | S675: BEACH ROAD
A676: SANDRINGHAM | C676: 1 | D676: 5 | E676: =C676*6+D676 -> 11 | G676: 5 | H676: 7 | I676: =G676*6+H676 -> 37 | K676: 7 | L676: 13 | M676: =K676*6+L676 -> 55 | O676: 11 | P676: 19 | Q676: =O676*6+P676 -> 85 | S676: UMPIRE | X676: LADDER | AB676: ROUND | AD676: 10
A677: MOORABBIN | C677: 3 | D677: 5 | E677: =C677*6+D677 -> 23 | G677: 4 | H677: 8 | I677: =G677*6+H677 -> 32 | K677: 8 | L677: 11 | M677: =K677*6+L677 -> 59 | O677: 11 | P677: 15 | Q677: =O677*6+P677 -> 81 | S677: ROBINSON
A678: BEST PLAYERS | W678: TEAM | X678: W | Y678: L | Z678: D | AA678: FOR | AB678: AGST | AC678: % | AD678: PTS
A679: SANDRINGHAM | C679: SHEERAN | F679: O'BIERNE | I679: BOLAND | L679: WILLIAMS | O679: VANCE | Q679: JONES
A680: MOORABBIN | C680: RYAN | F680: CRAMERI | I680: GILDER | L680: MEEHAN | O680: BOYD | Q680: PECK | W680: WILLIAMSTOWN | X680: 10 | Y680: 0 | Z680: 0 | AA680: 1127 | AB680: 651 | AC680: 173.11827956989248 | AD680: 40
A681: GOALKICKERS | W681: MOORABBIN | X681: 8 | Y681: 2 | Z681: 0 | AA681: 1217 | AB681: 634 | AC681: 191.96 | AD681: 32
A682: SANDRINGHAM | C682: OAKLEY 3 | E682: VANCE 2 | G682: STEELE 2 | I682: SHRIVES | K682: ECCLESTON | N682: WEBSTER | P682: WILLIAMS | W682: OAKLEIGH | X682: 8 | Y682: 2 | Z682: 0 | AA682: 1112 | AB682: 703 | AC682: 158.1792318634424 | AD682: 32
A683: MOORABBIN | C683: CRAMERI 3 | F683: PAPLEY 2 | I683: RYAN 2 | K683: HOY 2 | M683: BILLSON | O683: McGAW | W683: COBURG | X683: 8 | Y683: 2 | Z683: 0 | AA683: 1121 | AB683: 725 | AC683: 154.62068965517241 | AD683: 32
A685: WILLIAMSTOWN | C685: 3 | D685: 4 | E685: =C685*6+D685 -> 22 | G685: 5 | H685: 10 | I685: =G685*6+H685 -> 40 | K685: 7 | L685: 13 | M685: =K685*6+L685 -> 55 | O685: 11 | P685: 15 | Q685: =O685*6+P685 -> 81 | S685: WILLIAMSTOWN | W685: SANDRINGHAM | X685: 8 | Y685: 2 | Z685: 0 | AA685: 1091 | AB685: 724 | AC685: 150.69060773480663 | AD685: 32
A686: YARRAVILLE | C686: 2 | D686: 5 | E686: =C686*6+D686 -> 17 | G686: 4 | H686: 8 | I686: =G686*6+H686 -> 32 | K686: 6 | L686: 12 | M686: =K686*6+L686 -> 48 | O686: 8 | P686: 13 | Q686: =O686*6+P686 -> 61 | S686: HORNE | W686: YARRAVILLE | X686: 7 | Y686: 3 | Z686: 0 | AA686: 992 | AB686: 680 | AC686: 145.88 | AD686: 28
A687: BEST PLAYERS | W687: MORDIALLOC | X687: 7 | Y687: 3 | Z687: 0 | AA687: 972 | AB687: 685 | AC687: 141.9 | AD687: 28
A688: WILLIAMSTOWN | C688: MALONEY | F688: MATTHEWS | I688: CALLAHAN | L688: CAIRNS | N688: MAZOURIS | Q688: HENDY | W688: PORT MELBOURNE | X688: 6 | Y688: 4 | Z688: 0 | AA688: 941 | AB688: 817 | AC688: 115.17747858017135 | AD688: 24
A689: YARRAVILLE | C689: VANDERFEEN | F689: ORANGE | I689: DRINAN | L689: BOURKE | N689: BURT | Q689: McTAGGART | W689: BOX HILL | X689: 4 | Y689: 6 | Z689: 0 | AA689: 844 | AB689: 894 | AC689: 94.407158836689035 | AD689: 16
A690: GOALKICKERS | W690: DANDENONG | X690: 4 | Y690: 6 | Z690: 0 | AA690: 882 | AB690: 1025 | AC690: 86.05 | AD690: 16
A691: WILLIAMSTOWN | C691: MATTHEWS 3 | F691: MALONEY 2 | I691: MAZOURIS 2 | L691: DAVIES 2 | N691: CALLAHAN | Q691: CULLINAN | W691: PRESTON | X691: 4 | Y691: 6 | Z691: 0 | AA691: 783 | AB691: 1083 | AC691: 72.3 | AD691: 16
A692: YARRAVILLE | C692: VANDERFEEN 3 | F692: BOURKE 2 | I692: CAREY 2 | K692: CROOK | W692: BRUNSWICK | X692: 3 | Y692: 7 | Z692: 0 | AA692: 890 | AB692: 864 | AC692: 103.00925925925925 | AD692: 12
W693: SUNSHINE | X693: 2 | Y693: 8 | Z693: 0 | AA693: 616 | AB693: 1179 | AC693: 52.247667514843087 | AD693: 8
A694: OAKLEIGH | C694: 1 | D694: 2 | E694: =C694*6+D694 -> 8 | G694: 5 | H694: 8 | I694: =G694*6+H694 -> 38 | K694: 6 | L694: 10 | M694: =K694*6+L694 -> 46 | O694: 9 | P694: 13 | Q694: =O694*6+P694 -> 67 | S694: OAKLEIGH | W694: BRIGHTON | X694: 1 | Y694: 9 | Z694: 0 | AA694: 740 | AB694: 1108 | AC694: 66.7870036101083 | AD694: 4
A695: BOX HILL | C695: 4 | D695: 1 | E695: =C695*6+D695 -> 25 | G695: 5 | H695: 2 | I695: =G695*6+H695 -> 32 | K695: 6 | L695: 6 | M695: =K695*6+L695 -> 42 | O695: 8 | P695: 10 | Q695: =O695*6+P695 -> 58 | S695: ROWE | W695: NORTHCOTE | X695: 0 | Y695: 10 | Z695: 0 | AA695: 745 | AB695: 1216 | AC695: 61.27 | AD695: 0
A696: BEST PLAYERS | W696: CAMBERWELL | X696: 0 | Y696: 10 | Z696: 0 | AA696: 438 | AB696: 1523 | AC696: 28.76 | AD696: 0
A697: OAKLEIGH | C697: ASH | F697: DONOHUE | I697: PEAKE | K697: NAISMITH | N697: KITTO | Q697: COLLINS
A698: BOX HILL | C698: D BROWN | F698: MILNE | I698: SALVADO | K698: K WHITE | N698: WITTMER | Q698: SAWATSKY
A699: GOALKICKERS
A700: OAKLEIGH | C700: COLLINS 3 | F700: VARNEY 2 | I700: COUGHLAN 2 | L700: LASKEY | N700: McGOWAN
A701: BOX HILL | C701: SALVADO 3 | F701: PLUNKETT 3 | I701: TREADWELL | L701: SAWATSKY
A703: PORT MELBOURNE | C703: 0 | D703: 5 | E703: =C703*6+D703 -> 5 | G703: 6 | H703: 14 | I703: =G703*6+H703 -> 50 | K703: 9 | L703: 18 | M703: =K703*6+L703 -> 72 | O703: 15 | P703: 23 | Q703: =O703*6+P703 -> 113 | S703: PORT MELBOURNE
A704: PRESTON | C704: 0 | D704: 4 | E704: =C704*6+D704 -> 4 | G704: 1 | H704: 7 | I704: =G704*6+H704 -> 13 | K704: 6 | L704: 10 | M704: =K704*6+L704 -> 46 | O704: 7 | P704: 10 | Q704: =O704*6+P704 -> 52 | S704: POLLARD
A705: BEST PLAYERS
A706: PORT MELBOURNE | C706: OUSLEY | F706: WHITE | I706: QUAIFE | L706: MILLER | N706: McMASTER | Q706: ATKINSON
A707: PRESTON | C707: HAUGHTON | F707: DANGUAARD | I707: McLACHLAN | L707: WOOD | N707: JENSEN | Q707: CUTLER
A708: GOALKICKERS
A709: PORT MELBOURNE | C709: BONNETT 4 | F709: MILLER 3 | I709: MONKS 3 | K709: CAMERON 2 | N709: CLAXTON 2 | Q709: QUAIFE
A710: PRESTON | C710: McLACHLAN 2 | F710: CUTLER | I710: WALSH | K710: DAWSON | M710: OLIVER | O710: REYNOLDS
A712: DANDENONG | C712: 6 | D712: 3 | E712: =C712*6+D712 -> 39 | G712: 11 | H712: 10 | I712: =G712*6+H712 -> 76 | K712: 14 | L712: 13 | M712: =K712*6+L712 -> 97 | O712: 16 | P712: 18 | Q712: =O712*6+P712 -> 114 | S712: DANDENONG
A713: BRIGHTON | C713: 1 | D713: 2 | E713: =C713*6+D713 -> 8 | G713: 2 | H713: 3 | I713: =G713*6+H713 -> 15 | K713: 6 | L713: 8 | M713: =K713*6+L713 -> 44 | O713: 8 | P713: 15 | Q713: =O713*6+P713 -> 63 | S713: ALLEN
A714: BEST PLAYERS
A715: DANDENONG | C715: WATERS | F715: LITTLE | I715: HEAD | L715: DART | N715: TODD | P715: HOWER
A716: BRIGHTON | C716: ASLING | F716: P COOPER | I716: KEENAN | L716: McCANN | N716: DAVIS | P716: BURSEY
A717: GOALKICKERS
A718: DANDENONG | C718: LITTLE 3 | F718: HEAD 3 | H718: LALOR 2 | J718: K WILLIAMS 2 | N718: TODD 2 | P718: WATERS | R718: GRAY | T718: PETERS | V718: GILLINGHAM
A719: BRIGHTON | C719: P COOPER 3 | F719: BROWNING 2 | I719: W COOPER | L719: CRAIG | N719: N COOPER
A721: BRUNSWICK | C721: 5 | D721: 6 | E721: =C721*6+D721 -> 36 | G721: 8 | H721: 9 | I721: =G721*6+H721 -> 57 | K721: 15 | L721: 11 | M721: =K721*6+L721 -> 101 | O721: 19 | P721: 14 | Q721: =O721*6+P721 -> 128 | S721: NORTHCOTE
A722: NORTHCOTE | C722: 3 | D722: 2 | E722: =C722*6+D722 -> 20 | G722: 5 | H722: 5 | I722: =G722*6+H722 -> 35 | K722: 7 | L722: 7 | M722: =K722*6+L722 -> 49 | O722: 12 | P722: 10 | Q722: =O722*6+P722 -> 82 | S722: MARCY
A723: BEST PLAYERS
A724: BRUNSWICK | C724: K DILLON | F724: YOUNG | I724: ROBSON | L724: STANLEY | O724: WHILEY | Q724: HAYES
A725: NORTHCOTE | C725: WRIGHT | F725: BRETHERTON | I725: R SMITH | L725: MARCHANT | O725: CLARKE | Q725: VAINS
A726: GOALKICKERS
A727: BRUNSWICK | C727: HAYES 4 | F727: K DILLON 4 | I727: STANLEY 3 | L727: BIBBY 3 | N727: YOUNG 2 | Q727: WHILEY 2 | T727: JARMAN
A728: NORTHCOTE | C728: VAINS 5 | F728: CONYBEAR 3 | I728: WRIGHT 2 | L728: BROWN | N728: SCOTT
A730: COBURG | C730: 2 | D730: 7 | E730: =C730*6+D730 -> 19 | G730: 8 | H730: 12 | I730: =G730*6+H730 -> 60 | K730: 15 | L730: 13 | M730: =K730*6+L730 -> 103 | O730: 23 | P730: 20 | Q730: =O730*6+P730 -> 158 | S730: COBURG
A731: SUNSHINE | C731: 2 | D731: 0 | E731: =C731*6+D731 -> 12 | G731: 3 | H731: 1 | I731: =G731*6+H731 -> 19 | K731: 5 | L731: 6 | M731: =K731*6+L731 -> 36 | O731: 7 | P731: 6 | Q731: =O731*6+P731 -> 48 | S731: DIXON
A732: BEST PLAYERS
A733: COBURG | C733: BYRON | F733: JORDAN | I733: GOULLET | L733: GLEESON | O733: MAHONEY | R733: HORSKINS
A734: SUNSHINE | C734: A CORCORAN | F734: TREZISE | I734: E JEPSON | L734: KELLY | O734: M FITZGERALD | R734: LITCHFIELD
A735: GOALKICKERS
A736: COBURG | C736: BYRON 16 | F736: HUNTINGTON | I736: GLEESON | K736: JORDAN | M736: O'BRIEN | O736: WILSON | Q736: HORSKINS | S736: GOULLET
A737: SUNSHINE | C737: KELLY 3 | F737: LITCHFIELD 2 | I737: WARREN | K737: FOGARTY
A739: MORDIALLOC | C739: 9 | D739: 9 | E739: =C739*6+D739 -> 63 | G739: 11 | H739: 10 | I739: =G739*6+H739 -> 76 | K739: 17 | L739: 20 | M739: =K739*6+L739 -> 122 | O739: 19 | P739: 22 | Q739: =O739*6+P739 -> 136 | S739: MORDIALLOC
A740: CAMBERWELL | C740: 0 | D740: 0 | E740: =C740*6+D740 -> 0 | G740: 2 | H740: 1 | I740: =G740*6+H740 -> 13 | K740: 3 | L740: 1 | M740: =K740*6+L740 -> 19 | O740: 3 | P740: 6 | Q740: =O740*6+P740 -> 24 | S740: ROACH
A741: BEST PLAYERS
A742: MORDIALLOC | C742: JOSE | F742: CRANE | I742: BESANKO | L742: O'NEILL | O742: BARCLAY | R742: BAKER
A743: CAMBERWELL | C743: K CHAMBERS | F743: CHAPMAN | I743: COMMONS | L743: WHITING | O743: FREYBERG | R743: LONG
A744: GOALKICKERS
A745: MORDIALLOC | C745: BAKER 5 | E745: KERR 4 | G745: O'NEILL 4 | I745: COSTELLO 3 | L745: SHEEHAN | N745: CRAWFORD | Q745: CRANE
A746: CAMBERWELL | C746: ELLIS | E746: COMMONS | H746: FREYBERG
A748: ROUND 11 | E748: 4TH JULY | J748: WEATHER | O748: WEST WIND DULL | S748: PLAYED AT
D749: 1ST QTR | H749: 2ND QTR | L749: 3RD QTR | P749: FINAL | S749: MOORABBIN
A750: MORDIALLOC | C750: 5 | D750: 1 | E750: =C750*6+D750 -> 31 | G750: 10 | H750: 5 | I750: =G750*6+H750 -> 65 | K750: 13 | L750: 8 | M750: =K750*6+L750 -> 86 | O750: 17 | P750: 12 | Q750: =O750*6+P750 -> 114 | S750: UMPIRE | X750: LADDER | AB750: ROUND | AD750: 11
A751: MOORABBIN | C751: 2 | D751: 3 | E751: =C751*6+D751 -> 15 | G751: 6 | H751: 7 | I751: =G751*6+H751 -> 43 | K751: 11 | L751: 13 | M751: =K751*6+L751 -> 79 | O751: 13 | P751: 15 | Q751: =O751*6+P751 -> 93 | S751: JENKINS
A752: BEST PLAYERS | W752: TEAM | X752: W | Y752: L | Z752: D | AA752: FOR | AB752: AGST | AC752: % | AD752: PTS
A753: MORDIALLOC | C753: BESANKO | F753: COSTELLO | I753: JOSE | L753: CRANE | O753: PEARSON | R753: O'NEILL
A754: MOORABBIN | C754: MORONEY | F754: BILLSON | I754: BAKER | L754: RYAN | O754: HOGAN | R754: PECK | W754: WILLIAMSTOWN | X754: 11 | Y754: 0 | Z754: 0 | AA754: 1247 | AB754: 729 | AC754: 171.05624142661179 | AD754: 44
A755: GOALKICKERS | W755: SANDRINGHAM | X755: 9 | Y755: 2 | Z755: 0 | AA755: 1222 | AB755: 740 | AC755: 165.13513513513513 | AD755: 36
A756: MORDIALLOC | C756: BAKER 5 | E756: O'NEILL 3 | G756: COSTELLO 2 | J756: ROBERTS 2 | M756: PEARSON 2 | P756: KERR 2 | R756: BESANKO | W756: OAKLEIGH | X756: 9 | Y756: 2 | Z756: 0 | AA756: 1240 | AB756: 785 | AC756: 157.96178343949043 | AD756: 36
A757: MOORABBIN | C757: PAPLEY 4 | E757: McGAW 2 | G757: CRAMERI 2 | J757: MORONEY | M757: BILLSON | O757: RYAN | Q757: CAMPBELL | S757: HOGAN | W757: COBURG | X757: 9 | Y757: 2 | Z757: 0 | AA757: 1212 | AB757: 808 | AC757: 150 | AD757: 36
A759: COBURG | C759: 2 | D759: 2 | E759: =C759*6+D759 -> 14 | G759: 5 | H759: 7 | I759: =G759*6+H759 -> 37 | K759: 8 | L759: 12 | M759: =K759*6+L759 -> 60 | O759: 12 | P759: 19 | Q759: =O759*6+P759 -> 91 | S759: PORT MELBOURNE | W759: MOORABBIN | X759: 8 | Y759: 3 | Z759: 0 | AA759: 1310 | AB759: 748 | AC759: 175.13 | AD759: 32
A760: PORT MELBOURNE | C760: 7 | D760: 4 | E760: =C760*6+D760 -> 46 | G760: 10 | H760: 6 | I760: =G760*6+H760 -> 66 | K760: 11 | L760: 9 | M760: =K760*6+L760 -> 75 | O760: 12 | P760: 11 | Q760: =O760*6+P760 -> 83 | S760: HORNE | W760: YARRAVILLE | X760: 8 | Y760: 3 | Z760: 0 | AA760: 1109 | AB760: 766 | AC760: 144.78 | AD760: 32
A761: BEST PLAYERS | W761: MORDIALLOC | X761: 8 | Y761: 3 | Z761: 0 | AA761: 1086 | AB761: 778 | AC761: 139.59 | AD761: 32
A762: COBURG | C762: WILSON | F762: BRENNAN | I762: MATTHEWS | L762: BIGELOW | O762: BYRON | R762: SHORT | W762: PORT MELBOURNE | X762: 6 | Y762: 5 | Z762: 0 | AA762: 1024 | AB762: 908 | AC762: 112.77533039647577 | AD762: 24
A763: PORT MELBOURNE | C763: BOWEN | F763: LEWIS | I763: OUSLEY | L763: MONKS | O763: ATKINSON | R763: LOCKHART | W763: BOX HILL | X763: 5 | Y763: 6 | Z763: 0 | AA763: 940 | AB763: 966 | AC763: 97.308488612836442 | AD763: 20
A764: GOALKICKERS | W764: DANDENONG | X764: 4 | Y764: 7 | Z764: 0 | AA764: 964 | AB764: 1153 | AC764: 83.61 | AD764: 16
A765: COBURG | C765: WILSON 5 | F765: BYRON 4 | I765: GLEESON | K765: JORDAN | M765: O'SULLIVAN | W765: PRESTON | X765: 4 | Y765: 7 | Z765: 0 | AA765: 840 | AB765: 1179 | AC765: 71.25 | AD765: 16
A766: PORT MELBOURNE | C766: MONKS 5 | F766: BONNETT 2 | I766: EVANS | K766: O'TOOLE | M766: McMASTER | O766: QUAIFE | Q766: JOLIFFE | W766: BRUNSWICK | X766: 3 | Y766: 8 | Z766: 0 | AA766: 968 | AB766: 984 | AC766: 98.373983739837399 | AD766: 12
W767: SUNSHINE | X767: 3 | Y767: 8 | Z767: 0 | AA767: 712 | AB767: 1236 | AC767: 57.605177993527505 | AD767: 12
A768: OAKLEIGH | C768: 6 | D768: 3 | E768: =C768*6+D768 -> 39 | G768: 8 | H768: 8 | I768: =G768*6+H768 -> 56 | K768: 15 | L768: 11 | M768: =K768*6+L768 -> 101 | O768: 19 | P768: 14 | Q768: =O768*6+P768 -> 128 | S768: DANDENONG | W768: BRIGHTON | X768: 1 | Y768: 10 | Z768: 0 | AA768: 812 | AB768: 1204 | AC768: 67.441860465116278 | AD768: 4
A769: DANDENONG | C769: 2 | D769: 3 | E769: =C769*6+D769 -> 15 | G769: 4 | H769: 7 | I769: =G769*6+H769 -> 31 | K769: 6 | L769: 8 | M769: =K769*6+L769 -> 44 | O769: 12 | P769: 10 | Q769: =O769*6+P769 -> 82 | S769: O'DONOGHUE | W769: NORTHCOTE | X769: 0 | Y769: 11 | Z769: 0 | AA769: 831 | AB769: 1333 | AC769: 62.34 | AD769: 0
A770: BEST PLAYERS | W770: CAMBERWELL | X770: 0 | Y770: 11 | Z770: 0 | AA770: 454 | AB770: 1654 | AC770: 27.45 | AD770: 0
A771: OAKLEIGH | C771: D'ARCY | F771: JONES | I771: NAISMITH | L771: COLLINS | N771: PALMER | Q771: COUGHLAN
A772: DANDENONG | C772: WATERS | F772: DE LORENZO | I772: LALOR | L772: HOWER | N772: GUILLE | Q772: COOTE
A773: GOALKICKERS
A774: OAKLEIGH | C774: D'ARCY 5 | E774: JONES 4 | G774: McGOWAN 3 | J774: COLLINS 2 | M774: PALMER 2 | P774: COUGHLAN | R774: KITTO | T774: LASKEY
A775: DANDENONG | C775: GRAY 3 | E775: LALOR 2 | G775: PETERS 2 | I775: WATERS | K775: TODD | M775: GUILLE | O775: LITTLE | Q775: GOODES
A777: WILLIAMSTOWN | C777: 3 | D777: 7 | E777: =C777*6+D777 -> 25 | G777: 9 | H777: 11 | I777: =G777*6+H777 -> 65 | K777: 12 | L777: 17 | M777: =K777*6+L777 -> 89 | O777: 17 | P777: 18 | Q777: =O777*6+P777 -> 120 | S777: NORTHCOTE
A778: BRUNSWICK | C778: 4 | D778: 3 | E778: =C778*6+D778 -> 27 | G778: 6 | H778: 5 | I778: =G778*6+H778 -> 41 | K778: 10 | L778: 9 | M778: =K778*6+L778 -> 69 | O778: 11 | P778: 12 | Q778: =O778*6+P778 -> 78 | S778: ROACH
A779: BEST PLAYERS
A780: WILLIAMSTOWN | C780: MALONEY | F780: DAVIES | I780: PELLY | L780: SMITH | O780: E BEITZEL | R780: BOB JONES
A781: BRUNSWICK | C781: McCORMACK | F781: DILLON | I781: STANLEY | L781: WHILEY | O781: VELO | R781: ROBSON
A782: GOALKICKERS
A783: WILLIAMSTOWN | C783: DAVIES 6 | F783: PELLY 3 | I783: MALONEY 2 | L783: BOB JONES | N783: EVANS | P783: MAZOURIS | R783: WARD | T783: SMITH
A784: BRUNSWICK | C784: VELO 4 | F784: STANLEY 3 | I784: BIBBY 2 | K784: WHILEY | M784: DILLON
A786: SUNSHINE | C786: 5 | D786: 8 | E786: =C786*6+D786 -> 38 | G786: 7 | H786: 9 | I786: =G786*6+H786 -> 51 | K786: 13 | L786: 12 | M786: =K786*6+L786 -> 90 | O786: 13 | P786: 18 | Q786: =O786*6+P786 -> 96 | S786: PRESTON
A787: PRESTON | C787: 0 | D787: 1 | E787: =C787*6+D787 -> 1 | G787: 5 | H787: 3 | I787: =G787*6+H787 -> 33 | K787: 5 | L787: 4 | M787: =K787*6+L787 -> 34 | O787: 8 | P787: 9 | Q787: =O787*6+P787 -> 57 | S787: ROBINSON
A788: BEST PLAYERS
A789: SUNSHINE | C789: TREZISE | F789: SAUNDERS | I789: WARREN | L789: FOREMAN | O789: DIX | R789: LITCHFIELD
A790: PRESTON | C790: WILSON | F790: WOOD | I790: HAUGHTON | L790: DAWSON | O790: McKENZIE | R790: SUPPLITT
A791: GOALKICKERS
A792: SUNSHINE | C792: FOREMAN 4 | F792: DIX 3 | H792: LITCHFIELD 2 | K792: KELLY | M792: M JEPSON | O792: GREGORY | Q792: MILNE
A793: PRESTON | C793: WALSH 4 | F793: DAWSON | H793: OLIVER | J793: HAUGHTON | M793: PHILLIPSON
A795: BOX HILL | C795: 3 | D795: 7 | E795: =C795*6+D795 -> 25 | G795: 4 | H795: 9 | I795: =G795*6+H795 -> 33 | K795: 10 | L795: 14 | M795: =K795*6+L795 -> 74 | O795: 13 | P795: 18 | Q795: =O795*6+P795 -> 96 | S795: ELSTERNWICK PARK
A796: BRIGHTON | C796: 3 | D796: 4 | E796: =C796*6+D796 -> 22 | G796: 4 | H796: 6 | I796: =G796*6+H796 -> 30 | K796: 5 | L796: 7 | M796: =K796*6+L796 -> 37 | O796: 10 | P796: 12 | Q796: =O796*6+P796 -> 72 | S796: POLLARD
A797: BEST PLAYERS
A798: BOX HILL | C798: PLUNKETT | F798: BROWN | I798: DUMMELOW | L798: SALVADO | O798: TAYLOR | R798: DICKEY
A799: BRIGHTON | C799: McCANN | F799: P COOPER | I799: BROWNING | L799: W COOPER | O799: ATKINSON | R799: FOX
A800: GOALKICKERS
A801: BOX HILL | C801: SALVADO 7 | F801: PLUNKETT 4 | I801: SAWATSKY 2
A802: BRIGHTON | C802: P COOPER 3 | F802: CRAIG 2 | H802: ASLING 2 | K802: BURSEY 2 | M802: W COOPER
A804: YARRAVILLE | C804: 4 | D804: 3 | E804: =C804*6+D804 -> 27 | G804: 10 | H804: 7 | I804: =G804*6+H804 -> 67 | K804: 12 | L804: 9 | M804: =K804*6+L804 -> 81 | O804: 17 | P804: 15 | Q804: =O804*6+P804 -> 117 | S804: YARRAVILLE
A805: NORTHCOTE | C805: 3 | D805: 5 | E805: =C805*6+D805 -> 23 | G805: 4 | H805: 6 | I805: =G805*6+H805 -> 30 | K805: 10 | L805: 11 | M805: =K805*6+L805 -> 71 | O805: 12 | P805: 14 | Q805: =O805*6+P805 -> 86 | S805: ROWE
A806: BEST PLAYERS
A807: YARRAVILLE | C807: CAREY | F807: DRINAN | I807: LETCHER | L807: MASON | N807: ANDERSON | Q807: CROOK
A808: NORTHCOTE | C808: ATKINSON | F808: BRETHERTON | I808: WRIGHT | L808: VAINS | N808: SHAW | Q808: CONYBEAR
A809: GOALKICKERS
A810: YARRAVILLE | C810: VANDERFEEN 5 | F810: ANDERSON 3 | I810: LETCHER 2 | L810: CROOK 2 | N810: CAREY 2 | Q810: RON BROWN | T810: BARRETT | W810: BOURKE
A811: NORTHCOTE | C811: MULCAHY 3 | F811: SHAW 2 | I811: CRIPPS 2 | K811: CLARK | M811: VAINS | O811: BRETHERTON | R811: CONYBEAR | U811: SCOTT
A813: SANDRINGHAM | C813: 7 | D813: 6 | E813: =C813*6+D813 -> 48 | G813: 10 | H813: 8 | I813: =G813*6+H813 -> 68 | K813: 18 | L813: 16 | M813: =K813*6+L813 -> 124 | O813: 19 | P813: 17 | Q813: =O813*6+P813 -> 131 | S813: CAMBERWELL
A814: CAMBERWELL | C814: 0 | D814: 1 | E814: =C814*6+D814 -> 1 | G814: 2 | H814: 1 | I814: =G814*6+H814 -> 13 | K814: 2 | L814: 2 | M814: =K814*6+L814 -> 14 | O814: 2 | P814: 4 | Q814: =O814*6+P814 -> 16 | S814: MARCY
A815: BEST PLAYERS
A816: SANDRINGHAM | C816: SHEERAN | F816: STEELE | I816: OAKLEY | L816: WEBSTER | O816: RANSOM | R816: PATMORE
A817: CAMBERWELL | C817: WHITING | F817: K CHAMBERS | I817: SKALBERG | L817: SEYMOUR | O817: EADES | R817: B JOHNSON
A818: GOALKICKERS
A819: SANDRINGHAM | C819: OAKLEY 9 | F819: SHRIVES 3 | I819: GRANGER 2 | L819: PATMORE | N819: VANCE | P819: RICHARDS | S819: WEBSTER | V819: ECCLESTON
A820: CAMBERWELL | C820: ELLIS | F820: WHITING
A822: ROUND 12 | E822: 11TH JULY | J822: WEATHER | M822: NORTH WEST WIND COLD | S822: PLAYED AT
D823: 1ST QTR | H823: 2ND QTR | L823: 3RD QTR | P823: FINAL | S823: OAKLEIGH
A824: MOORABBIN | C824: 4 | D824: 4 | E824: =C824*6+D824 -> 28 | G824: 6 | H824: 6 | I824: =G824*6+H824 -> 42 | K824: 7 | L824: 9 | M824: =K824*6+L824 -> 51 | O824: 10 | P824: 15 | Q824: =O824*6+P824 -> 75 | S824: UMPIRE | X824: LADDER | AB824: ROUND | AD824: 12
A825: OAKLEIGH | C825: 2 | D825: 2 | E825: =C825*6+D825 -> 14 | G825: 7 | H825: 8 | I825: =G825*6+H825 -> 50 | K825: 9 | L825: 11 | M825: =K825*6+L825 -> 65 | O825: 9 | P825: 13 | Q825: =O825*6+P825 -> 67 | S825: ALLEN
A826: BEST PLAYERS | W826: TEAM | X826: W | Y826: L | Z826: D | AA826: FOR | AB826: AGST | AC826: % | AD826: PTS
A827: MOORABBIN | C827: PAPLEY | F827: MORONEY | I827: BOYD | L827: RYAN | O827: KENT | Q827: TREZISE
A828: OAKLEIGH | C828: PRENDERGAST | F828: COUGHLAN | I828: DONOHUE | L828: PALMER | O828: D'ARCY | Q828: VARNEY | W828: WILLIAMSTOWN | X828: 12 | Y828: 0 | Z828: 0 | AA828: 1354 | AB828: 770 | AC828: 175.84415584415584 | AD828: 48
A829: GOALKICKERS | W829: SANDRINGHAM | X829: 10 | Y829: 2 | Z829: 0 | AA829: 1335 | AB829: 797 | AC829: 167.50313676286072 | AD829: 40
A830: MOORABBIN | C830: PAPLEY 4 | F830: CRAMERI 2 | I830: BILLSON | K830: HOGAN | M830: McGAW | O830: BOURKE | W830: COBURG | X830: 10 | Y830: 2 | Z830: 0 | AA830: 1292 | AB830: 874 | AC830: 147.82608695652175 | AD830: 40
A831: OAKLEIGH | C831: D'ARCY 3 | F831: VARNEY 2 | I831: COUGHLAN | K831: JONES | M831: PALMER | O831: GOYNE | W831: MOORABBIN | X831: 9 | Y831: 3 | Z831: 0 | AA831: 1385 | AB831: 815 | AC831: 169.94 | AD831: 36
A833: COBURG | C833: 3 | D833: 2 | E833: =C833*6+D833 -> 20 | G833: 3 | H833: 6 | I833: =G833*6+H833 -> 24 | K833: 9 | L833: 13 | M833: =K833*6+L833 -> 67 | O833: 11 | P833: 14 | Q833: =O833*6+P833 -> 80 | S833: COBURG | W833: OAKLEIGH | X833: 9 | Y833: 3 | Z833: 0 | AA833: 1307 | AB833: 860 | AC833: 151.97674418604652 | AD833: 36
A834: YARRAVILLE | C834: 1 | D834: 2 | E834: =C834*6+D834 -> 8 | G834: 6 | H834: 8 | I834: =G834*6+H834 -> 44 | K834: 6 | L834: 11 | M834: =K834*6+L834 -> 47 | O834: 9 | P834: 12 | Q834: =O834*6+P834 -> 66 | S834: ROBINSON/SELBY | W834: MORDIALLOC | X834: 9 | Y834: 3 | Z834: 0 | AA834: 1155 | AB834: 833 | AC834: 138.66 | AD834: 36
A835: BEST PLAYERS | W835: YARRAVILLE | X835: 8 | Y835: 4 | Z835: 0 | AA835: 1175 | AB835: 846 | AC835: 138.89 | AD835: 32
A836: COBURG | C836: BIGELOW | F836: HOOGEN | I836: HUNTINGTON | L836: JORDAN | N836: MATTHEWS | Q836: TANCREDI | W836: PORT MELBOURNE | X836: 7 | Y836: 5 | Z836: 0 | AA836: 1133 | AB836: 957 | AC836: 118.39080459770115 | AD836: 28
A837: YARRAVILLE | C837: BURT | F837: BOB BROWN | I837: CROOK | L837: MASON | N837: CAREY | Q837: DRINAN | W837: BOX HILL | X837: 6 | Y837: 6 | Z837: 0 | AA837: 1058 | AB837: 1000 | AC837: 105.8 | AD837: 24
A838: GOALKICKERS | W838: BRUNSWICK | X838: 4 | Y838: 8 | Z838: 0 | AA838: 1045 | AB838: 1034 | AC838: 101.06382978723404 | AD838: 16
A839: COBURG | C839: JORDAN 2 | E839: NEESON 2 | G839: MATTHEWS 2 | J839: CARR | L839: O'SULLIVAN | N839: GOULLET | P839: SHAW | R839: HUNTINGTON | W839: DANDENONG | X839: 4 | Y839: 8 | Z839: 0 | AA839: 1019 | AB839: 1222 | AC839: 83.39 | AD839: 16
A840: YARRAVILLE | C840: VANDERFEEN 3 | F840: CAREY 3 | I840: LETCHER | K840: BOB BROWN | N840: ANDERSON | W840: PRESTON | X840: 4 | Y840: 8 | Z840: 0 | AA840: 881 | AB840: 1286 | AC840: 68.51 | AD840: 16
W841: SUNSHINE | X841: 3 | Y841: 9 | Z841: 0 | AA841: 762 | AB841: 1313 | AC841: 58.035034272658038 | AD841: 12
A842: MORDIALLOC | C842: 5 | D842: 8 | E842: =C842*6+D842 -> 38 | G842: 6 | H842: 8 | I842: =G842*6+H842 -> 44 | K842: 8 | L842: 14 | M842: =K842*6+L842 -> 62 | O842: 9 | P842: 15 | Q842: =O842*6+P842 -> 69 | S842: MORDIALLOC | W842: BRIGHTON | X842: 1 | Y842: 11 | Z842: 0 | AA842: 869 | AB842: 1317 | AC842: 65.983295368261196 | AD842: 4
A843: DANDENONG | C843: 0 | D843: 1 | E843: =C843*6+D843 -> 1 | G843: 3 | H843: 7 | I843: =G843*6+H843 -> 25 | K843: 4 | L843: 11 | M843: =K843*6+L843 -> 35 | O843: 6 | P843: 19 | Q843: =O843*6+P843 -> 55 | S843: ROWE | W843: NORTHCOTE | X843: 0 | Y843: 12 | Z843: 0 | AA843: 880 | AB843: 1442 | AC843: 61.03 | AD843: 0
A844: BEST PLAYERS | W844: CAMBERWELL | X844: 0 | Y844: 12 | Z844: 0 | AA844: 488 | AB844: 1772 | AC844: 27.54 | AD844: 0
A845: MORDIALLOC | C845: O'NEILL | F845: COSTELLO | I845: JOSE | K845: SHEEHAN | N845: KERR | Q845: MAUNDER
A846: DANDENONG | C846: HOWER | F846: WATERS | I846: LALOR | K846: GUILLE | N846: LITTLE | Q846: TODD
A847: GOALKICKERS
A848: MORDIALLOC | C848: BAKER 3 | F848: COSTELLO 2 | I848: SHEEHAN | K848: KERR | M848: O'NEILL | O848: WORCESTER
A849: DANDENONG | C849: CRAWFORD 2 | F849: DART 2 | I849: LALOR | K849: TODD
A851: BRUNSWICK | C851: 3 | D851: 3 | E851: =C851*6+D851 -> 21 | G851: 7 | H851: 7 | I851: =G851*6+H851 -> 49 | K851: 9 | L851: 11 | M851: =K851*6+L851 -> 65 | O851: 10 | P851: 17 | Q851: =O851*6+P851 -> 77 | S851: SUNSHINE
A852: SUNSHINE | C852: 2 | D852: 1 | E852: =C852*6+D852 -> 13 | G852: 2 | H852: 3 | I852: =G852*6+H852 -> 15 | K852: 3 | L852: 6 | M852: =K852*6+L852 -> 24 | O852: 7 | P852: 8 | Q852: =O852*6+P852 -> 50 | S852: POLLARD
A853: BEST PLAYERS
A854: BRUNSWICK | C854: R THOMPSON | F854: McKENNA | I854: HAYES | L854: WHILEY | O854: DILLON | R854: VELO
A855: SUNSHINE | C855: TREZISE | F855: FITZGERALD | I855: DIX | L855: MILNE | O855: SAUNDERS | R855: WARREN
A856: GOALKICKERS
A857: BRUNSWICK | C857: VELO 3 | F857: STANLEY 2 | I857: WHILEY 2 | L857: BIBBY | N857: DILLON
A858: SUNSHINE | C858: FOREMAN 3 | F858: LITCHFIELD 2 | I858: DIX | K858: KELLY
A860: PORT MELBOURNE | C860: 3 | D860: 7 | E860: =C860*6+D860 -> 25 | G860: 5 | H860: 15 | I860: =G860*6+H860 -> 45 | K860: 9 | L860: 16 | M860: =K860*6+L860 -> 70 | O860: 15 | P860: 19 | Q860: =O860*6+P860 -> 109 | S860: NORTHCOTE
A861: NORTHCOTE | C861: 1 | D861: 3 | E861: =C861*6+D861 -> 9 | G861: 3 | H861: 10 | I861: =G861*6+H861 -> 28 | K861: 4 | L861: 13 | M861: =K861*6+L861 -> 37 | O861: 5 | P861: 19 | Q861: =O861*6+P861 -> 49 | S861: DIXON
A862: BEST PLAYERS
A863: PORT MELBOURNE | C863: LEWIS | F863: BONNETT | I863: QUAIFE | L863: ATKINSON | O863: EVANS | Q863: CLAXTON
A864: NORTHCOTE | C864: ATKINSON | F864: VAINS | I864: BRETHERTON | L864: ROOTSEY | O864: SMITH | Q864: CLARK
A865: GOALKICKERS
A866: PORT MELBOURNE | C866: BONNETT 6 | F866: CAMERON 3 | I866: MERRETT 3 | L866: O'TOOLE | N866: QUAIFE | P866: CLAXTON
A867: NORTHCOTE | C867: CRIPPS 2 | F867: MULCAHY | I867: VAINS | K867: SCOTT
A869: BOX HILL | C869: 2 | D869: 6 | E869: =C869*6+D869 -> 18 | G869: 4 | H869: 7 | I869: =G869*6+H869 -> 31 | K869: 11 | L869: 10 | M869: =K869*6+L869 -> 76 | O869: 17 | P869: 16 | Q869: =O869*6+P869 -> 118 | S869: BOX HILL
A870: CAMBERWELL | C870: 0 | D870: 0 | E870: =C870*6+D870 -> 0 | G870: 2 | H870: 4 | I870: =G870*6+H870 -> 16 | K870: 2 | L870: 5 | M870: =K870*6+L870 -> 17 | O870: 4 | P870: 10 | Q870: =O870*6+P870 -> 34 | S870: JENKINS
A871: BEST PLAYERS
A872: BOX HILL | C872: PLUNKETT | F872: BRAIN | I872: SALVADO | L872: WITNISH | O872: WRIGHT | R872: WITTMER
A873: CAMBERWELL | C873: FREYBERG | F873: WATTS | I873: MOULE | L873: SKALBERG | O873: EADES | R873: K CHAMBERS
A874: GOALKICKERS
A875: BOX HILL | C875: SALVADO 6 | F875: PLUNKETT 3 | I875: BRAIN 2 | K875: BROWN 2 | M875: K WHITE | O875: WITNISH | Q875: CARRICK | S875: ROCHOW
A876: CAMBERWELL | C876: SEYMOUR 2 | F876: K JOHNSON | I876: EADES
A878: WILLIAMSTOWN | C878: 5 | D878: 6 | E878: =C878*6+D878 -> 36 | G878: 8 | H878: 8 | I878: =G878*6+H878 -> 56 | K878: 12 | L878: 13 | M878: =K878*6+L878 -> 85 | O878: 15 | P878: 17 | Q878: =O878*6+P878 -> 107 | S878: WILLIAMSTOWN
A879: PRESTON | C879: 0 | D879: 4 | E879: =C879*6+D879 -> 4 | G879: 2 | H879: 8 | I879: =G879*6+H879 -> 20 | K879: 3 | L879: 8 | M879: =K879*6+L879 -> 26 | O879: 5 | P879: 11 | Q879: =O879*6+P879 -> 41 | S879: MARCY
A880: BEST PLAYERS
A881: WILLIAMSTOWN | C881: EVANS | F881: PELLY | I881: CALLAHAN | L881: E BEITZEL | O881: MATTHEWS | R881: RAWSON
A882: PRESTON | C882: NELSON | F882: WILSON | I882: BRYSON | L882: DAWSON | O882: DANGUAARD | R882: HAUGHTON
A883: GOALKICKERS
A884: WILLIAMSTOWN | C884: DAVIES 4 | F884: MURPHY 3 | I884: MALONEY 2 | L884: MATTHEWS 2 | O884: EVANS | Q884: SMITH | S884: PELLY | U884: CAIRNS
A885: PRESTON | C885: WALSH 2 | F885: DAWSON | I885: McMAHON | L885: LAMBIE
A887: SANDRINGHAM | C887: 2 | D887: 2 | E887: =C887*6+D887 -> 14 | G887: 7 | H887: 12 | I887: =G887*6+H887 -> 54 | K887: 11 | L887: 16 | M887: =K887*6+L887 -> 82 | O887: 15 | P887: 23 | Q887: =O887*6+P887 -> 113 | S887: BEACH ROAD
A888: BRIGHTON | C888: 2 | D888: 6 | E888: =C888*6+D888 -> 18 | G888: 2 | H888: 6 | I888: =G888*6+H888 -> 18 | K888: 5 | L888: 8 | M888: =K888*6+L888 -> 38 | O888: 8 | P888: 9 | Q888: =O888*6+P888 -> 57 | S888: HORNE
A889: BEST PLAYERS
A890: SANDRINGHAM | C890: PATMORE | F890: GRANGER | I890: RICHARDS | L890: CROFT | O890: WILLIAMS | R890: BOLAND
A891: BRIGHTON | C891: BROWNING | F891: PROSSER | I891: ATKINSON | L891: ASHENHURST | O891: WILLIAMS | R891: W COOPER
A892: GOALKICKERS
A893: SANDRINGHAM | C893: OAKLEY 5 | F893: GRANGER 3 | I893: PATMORE 2 | L893: WEBSTER 2 | O893: BARRAN | Q893: ECCLESTON | T893: SHRIVES
A894: BRIGHTON | C894: P COOPER 2 | F894: ASLING 2 | I894: CURRIE | K894: CRAIG | M894: ATKINSON | P894: W COOPER
A896: ROUND 13 | E896: 18TH JULY | J896: WEATHER | M896: STRONG NORTH WIND FINE | S896: PLAYED AT
D897: 1ST QTR | H897: 2ND QTR | L897: 3RD QTR | P897: FINAL | S897: OAKLEIGH
A898: OAKLEIGH | C898: 1 | D898: 6 | E898: =C898*6+D898 -> 12 | G898: 4 | H898: 7 | I898: =G898*6+H898 -> 31 | K898: 7 | L898: 12 | M898: =K898*6+L898 -> 54 | O898: 10 | P898: 17 | Q898: =O898*6+P898 -> 77 | S898: UMPIRE | X898: LADDER | AB898: ROUND | AD898: 13
A899: MORDIALLOC | C899: 0 | D899: 3 | E899: =C899*6+D899 -> 3 | G899: 2 | H899: 7 | I899: =G899*6+H899 -> 19 | K899: 6 | L899: 7 | M899: =K899*6+L899 -> 43 | O899: 8 | P899: 10 | Q899: =O899*6+P899 -> 58 | S899: MARCY
A900: BEST PLAYERS | W900: TEAM | X900: W | Y900: L | Z900: D | AA900: FOR | AB900: AGST | AC900: % | AD900: PTS
A901: OAKLEIGH | C901: KITTO | E901: PRENDERGAST | H901: NAISMITH | K901: McCOOKE | N901: McGOWAN | Q901: PEAKE
A902: MORDIALLOC | C902: CRANE | E902: BESANKO | H902: MAUNDER | K902: JOSE | N902: PEARSON | Q902: O'NEILL | W902: WILLIAMSTOWN | X902: 13 | Y902: 0 | Z902: 0 | AA902: 1484 | AB902: 833 | AC902: 178.15 | AD902: 52
A903: GOALKICKERS | W903: SANDRINGHAM | X903: 11 | Y903: 2 | Z903: 0 | AA903: 1417 | AB903: 846 | AC903: 167.49408983451536 | AD903: 44
A904: OAKLEIGH | C904: McGOWAN 4 | F904: JONES 2 | H904: COLLINS | J904: D'ARCY | L904: PALMER | N904: J WILLIAMS | W904: COBURG | X904: 11 | Y904: 2 | Z904: 0 | AA904: 1422 | AB904: 957 | AC904: 148.58934169278996 | AD904: 44
A905: MORDIALLOC | C905: O'NEILL 3 | F905: KERR 2 | H905: PEARSON | J905: BESANKO | M905: BAKER | W905: MOORABBIN | X905: 10 | Y905: 3 | Z905: 0 | AA905: 1461 | AB905: 843 | AC905: 173.31 | AD905: 40
A907: YARRAVILLE | C907: 3 | D907: 7 | E907: =C907*6+D907 -> 25 | G907: 6 | H907: 8 | I907: =G907*6+H907 -> 44 | K907: 13 | L907: 14 | M907: =K907*6+L907 -> 92 | O907: 13 | P907: 16 | Q907: =O907*6+P907 -> 94 | S907: YARRAVILLE | W907: OAKLEIGH | X907: 10 | Y907: 3 | Z907: 0 | AA907: 1384 | AB907: 918 | AC907: 150.76252723311546 | AD907: 40
A908: PORT MELBOURNE | C908: 1 | D908: 1 | E908: =C908*6+D908 -> 7 | G908: 4 | H908: 6 | I908: =G908*6+H908 -> 30 | K908: 5 | L908: 6 | M908: =K908*6+L908 -> 36 | O908: 6 | P908: 12 | Q908: =O908*6+P908 -> 48 | S908: O'DONOGHUE | W908: YARRAVILLE | X908: 9 | Y908: 4 | Z908: 0 | AA908: 1269 | AB908: 894 | AC908: 141.95 | AD908: 36
A909: BEST PLAYERS | W909: MORDIALLOC | X909: 9 | Y909: 4 | Z909: 0 | AA909: 1213 | AB909: 910 | AC909: 133.3 | AD909: 36
A910: YARRAVILLE | C910: BOURKE | F910: BOB BROWN | I910: WILLIAMS | L910: McTAGGART | O910: BURT | R910: ANDERSON | W910: PORT MELBOURNE | X910: 7 | Y910: 6 | Z910: 0 | AA910: 1181 | AB910: 1051 | AC910: 112.36917221693625 | AD910: 28
A911: PORT MELBOURNE | C911: CLAXTON | F911: MONKS | I911: McRAE | L911: ATKINSON | O911: LOCKHART | R911: LEWIS | W911: BOX HILL | X911: 6 | Y911: 7 | Z911: 0 | AA911: 1107 | AB911: 1082 | AC911: 102.31053604436229 | AD911: 24
A912: GOALKICKERS | W912: BRUNSWICK | X912: 5 | Y912: 8 | Z912: 0 | AA912: 1161 | AB912: 1095 | AC912: 106.02739726027397 | AD912: 20
A913: YARRAVILLE | C913: VANDERFEEN 4 | F913: BOURKE 4 | I913: BARRETT | K913: COLLINS | M913: BURT | N913: ANDERSON | Q913: LETCHER | W913: DANDENONG | X913: 4 | Y913: 9 | Z913: 0 | AA913: 1047 | AB913: 1298 | AC913: 80.66 | AD913: 16
A914: PORT MELBOURNE | C914: BONNETT 3 | F914: McMASTER | I914: CAMERON | K914: QUAIFE | W914: PRESTON | X914: 4 | Y914: 9 | Z914: 0 | AA914: 942 | AB914: 1402 | AC914: 67.19 | AD914: 16
W915: SUNSHINE | X915: 3 | Y915: 10 | Z915: 0 | AA915: 825 | AB915: 1443 | AC915: 57.17 | AD915: 12
A916: SANDRINGHAM | C916: 3 | D916: 0 | E916: =C916*6+D916 -> 18 | G916: 7 | H916: 1 | I916: =G916*6+H916 -> 43 | K916: 7 | L916: 4 | M916: =K916*6+L916 -> 46 | O916: 12 | P916: 10 | Q916: =O916*6+P916 -> 82 | S916: BOX HILL | W916: BRIGHTON | X916: 1 | Y916: 12 | Z916: 0 | AA916: 952 | AB916: 1416 | AC916: 67.2316384180791 | AD916: 4
A917: BOX HILL | C917: 3 | D917: 2 | E917: =C917*6+D917 -> 20 | G917: 5 | H917: 4 | I917: =G917*6+H917 -> 34 | K917: 5 | L917: 6 | M917: =K917*6+L917 -> 36 | O917: 7 | P917: 7 | Q917: =O917*6+P917 -> 49 | S917: POLLARD | W917: CAMBERWELL | X917: 1 | Y917: 12 | Z917: 0 | AA917: 587 | AB917: 1855 | AC917: 31.64 | AD917: 4
A918: BEST PLAYERS | W918: NORTHCOTE | X918: 0 | Y918: 13 | Z918: 0 | AA918: 963 | AB918: 1572 | AC918: 61.26 | AD918: 0
A919: SANDRINGHAM | C919: GRANGER | F919: JONES | I919: PATMORE | L919: SHEERAN | O919: BOLAND | R919: RANSOM
A920: BOX HILL | C920: EADE | F920: G D BROWN | I920: MILNE | L920: SAWATSKY | O920: WITHERDEN | R920: WRIGHT
A921: GOALKICKERS
A922: SANDRINGHAM | C922: OAKLEY 6 | F922: PATMORE 3 | I922: WILLIAMS | L922: ECCLESTON | O922: WEBSTER
A923: BOX HILL | C923: SALVADO 3 | F923: EADE 2 | I923: WITNISH | K923: CARRICK
A925: MOORABBIN | C925: 0 | D925: 2 | E925: =C925*6+D925 -> 2 | G925: 5 | H925: 3 | I925: =G925*6+H925 -> 33 | K925: 7 | L925: 4 | M925: =K925*6+L925 -> 46 | O925: 11 | P925: 10 | Q925: =O925*6+P925 -> 76 | S925: MOORABBIN
A926: DANDENONG | C926: 1 | D926: 1 | E926: =C926*6+D926 -> 7 | G926: 1 | H926: 3 | I926: =G926*6+H926 -> 9 | K926: 4 | L926: 4 | M926: =K926*6+L926 -> 28 | O926: 4 | P926: 4 | Q926: =O926*6+P926 -> 28 | S926: TREWIN
A927: BEST PLAYERS
A928: MOORABBIN | C928: MORONEY | F928: GILDER | I928: PAPLEY | L928: BOYD | O928: RENWICK | R928: TREZISE
A929: DANDENONG | C929: HOWER | F929: PURCELL | I929: GUILLE | L929: MINOTTI | O929: PHIPPS | R929: PETERS
A930: GOALKICKERS
A931: MOORABBIN | C931: MORONEY 5 | F931: P RYAN 2 | I931: PAPLEY 2 | L931: BILLSON | O931: RENWICK
A932: DANDENONG | C932: DALE 2 | F932: LITTLE | I932: DE LORENZO
A934: BRUNSWICK | C934: 4 | D934: 3 | E934: =C934*6+D934 -> 27 | G934: 7 | H934: 7 | I934: =G934*6+H934 -> 49 | K934: 11 | L934: 9 | M934: =K934*6+L934 -> 75 | O934: 17 | P934: 14 | Q934: =O934*6+P934 -> 116 | S934: NORTHCOTE
A935: PRESTON | C935: 3 | D935: 3 | E935: =C935*6+D935 -> 21 | G935: 5 | H935: 5 | I935: =G935*6+H935 -> 35 | K935: 7 | L935: 10 | M935: =K935*6+L935 -> 52 | O935: 8 | P935: 13 | Q935: =O935*6+P935 -> 61 | S935: ALLEN
A936: BEST PLAYERS
A937: BRUNSWICK | C937: EDWARDS | F937: K DILLON | I937: HAYES | L937: R THOMPSON | O937: WATT | R937: STANLEY
A938: PRESTON | C938: WOOD | F938: HAUGHTON | I938: LAMBIE | L938: BERGIN | O938: HOWARD | R938: WILSON
A939: GOALKICKERS
A940: BRUNSWICK | C940: K DILLON 5 | F940: McFARLANE 4 | I940: STANLEY 4 | L940: WHILEY | N940: VELO | P940: WATT | R940: McKENNA
A941: PRESTON | C941: BERGIN 3 | F941: RYMER 2 | I941: WALSH | K941: OLIVER | M941: LAMBIE | O941: DAWSON
A943: CAMBERWELL | C943: 5 | D943: 1 | E943: =C943*6+D943 -> 31 | G943: 10 | H943: 3 | I943: =G943*6+H943 -> 63 | K943: 15 | L943: 6 | M943: =K943*6+L943 -> 96 | O943: 15 | P943: 9 | Q943: =O943*6+P943 -> 99 | S943: CAMBERWELL
A944: BRIGHTON | C944: 2 | D944: 2 | E944: =C944*6+D944 -> 14 | G944: 7 | H944: 3 | I944: =G944*6+H944 -> 45 | K944: 8 | L944: 5 | M944: =K944*6+L944 -> 53 | O944: 12 | P944: 11 | Q944: =O944*6+P944 -> 83 | S944: DIXON
A945: BEST PLAYERS
A946: CAMBERWELL | C946: SEYMOUR | F946: EADES | I946: FREYBERG | L946: SKALBERG | O946: K CHAMBERS | R946: B JOHNSON
A947: BRIGHTON | C947: ASLING | F947: BROWNING | I947: WILLIAMS | L947: CURRIE | O947: ATKINSON | R947: BURSEY
A948: GOALKICKERS
A949: CAMBERWELL | C949: SEYMOUR 6 | F949: M CHAMBERS 2 | J949: FREYBERG 2 | M949: EADES 2 | O949: ELLIS 2 | Q949: SKALBERG
A950: BRIGHTON | C950: BROWNING 3 | F950: BURSEY 2 | I950: P COOPER 2 | L950: ASLING 2 | N950: ATKINSON 2 | Q950: CRAIG
A952: WILLIAMSTOWN | C952: 4 | D952: 4 | E952: =C952*6+D952 -> 28 | G952: 11 | H952: 14 | I952: =G952*6+H952 -> 80 | K952: 14 | L952: 18 | M952: =K952*6+L952 -> 102 | O952: 18 | P952: 22 | Q952: =O952*6+P952 -> 130 | S952: SUNSHINE
A953: SUNSHINE | C953: 3 | D953: 4 | E953: =C953*6+D953 -> 22 | G953: 4 | H953: 5 | I953: =G953*6+H953 -> 29 | K953: 7 | L953: 8 | M953: =K953*6+L953 -> 50 | O953: 9 | P953: 9 | Q953: =O953*6+P953 -> 63 | S953: ROWE
A954: BEST PLAYERS
A955: WILLIAMSTOWN | C955: SMITH | F955: PELLY | I955: MATTHEWS | L955: CALLAHAN | O955: EVANS | R955: R JONES
A956: SUNSHINE | C956: T CORCORAN | F956: LITCHFIELD | I956: FITZGERALD | L956: MILNE | O956: FOREMAN | R956: WARREN
A957: GOALKICKERS
A958: WILLIAMSTOWN | C958: DAVIES 4 | F958: PELLY 4 | H958: MATTHEWS 4 | K958: WARD 2 | M958: MURPHY | O958: EVANS | Q958: MAZOURIS | S958: BOB JONES
A959: SUNSHINE | C959: LITCHFIELD 4 | F959: WARREN 2 | I959: MILNE | K959: DIX | M959: DIXON
A961: COBURG | C961: 5 | D961: 6 | E961: =C961*6+D961 -> 36 | G961: 9 | H961: 8 | I961: =G961*6+H961 -> 62 | K961: 14 | L961: 14 | M961: =K961*6+L961 -> 98 | O961: 19 | P961: 16 | Q961: =O961*6+P961 -> 130 | S961: COBURG
A962: NORTHCOTE | C962: 0 | D962: 2 | E962: =C962*6+D962 -> 2 | G962: 5 | H962: 10 | I962: =G962*6+H962 -> 40 | K962: 6 | L962: 10 | M962: =K962*6+L962 -> 46 | O962: 11 | P962: 17 | Q962: =O962*6+P962 -> 83 | S962: ROACH
A963: BEST PLAYERS
A964: COBURG | C964: GOULLET | F964: BYRON | I964: SHAW | L964: JORDAN | O964: WILSON | R964: BIGELOW
A965: NORTHCOTE | C965: BRETHERTON | F965: ADAMSON | I965: SHAW | L965: ATKINSON | O965: R SMITH | R965: M CLARK
A966: GOALKICKERS
A967: COBURG | C967: BYRON 9 | F967: GOULLET 4 | I967: JORDAN 2 | K967: CARR 2 | M967: O'SULLIVAN | P967: SHAW
A968: NORTHCOTE | C968: BRETHERTON 4 | F968: SHAW 3 | I968: CLARK 2 | L968: MULCAHY | N968: FLANAGAN
A970: ROUND 14 | E970: 25TH JULY | H970: WEATHER | K970: SOUTH WIND DRIZZLE RAIN GROUNDS HEAVY | S970: PLAYED AT
D971: 1ST QTR | H971: 2ND QTR | L971: 3RD QTR | P971: FINAL | S971: WILLIAMSTOWN
A972: COBURG | C972: 7 | D972: 7 | E972: =C972*6+D972 -> 49 | G972: 7 | H972: 7 | I972: =G972*6+H972 -> 49 | K972: 9 | L972: 12 | M972: =K972*6+L972 -> 66 | O972: 11 | P972: 12 | Q972: =O972*6+P972 -> 78 | S972: UMPIRE | X972: LADDER | AB972: ROUND | AD972: 14
A973: WILLIAMSTOWN | C973: 0 | D973: 0 | E973: =C973*6+D973 -> 0 | G973: 4 | H973: 8 | I973: =G973*6+H973 -> 32 | K973: 6 | L973: 12 | M973: =K973*6+L973 -> 48 | O973: 8 | P973: 16 | Q973: =O973*6+P973 -> 64 | S973: ALLEN
A974: BEST PLAYERS | W974: TEAM | X974: W | Y974: L | Z974: D | AA974: FOR | AB974: AGST | AC974: % | AD974: PTS
A975: COBURG | C975: JORDAN | F975: HOOGEN | I975: SHORT | L975: BIGELOW | N975: TANCREDI | Q975: O'SULLIVAN
A976: WILLIAMSTOWN | C976: CALLAHAN | F976: MATTHEWS | I976: COLQUHOUN | L976: PELLY | N976: R JONES | Q976: BOB JONES | W976: WILLIAMSTOWN | X976: 13 | Y976: 1 | Z976: 0 | AA976: 1548 | AB976: 911 | AC976: 169.92 | AD976: 52
A977: GOALKICKERS | W977: SANDRINGHAM | X977: 12 | Y977: 2 | Z977: 0 | AA977: 1469 | AB977: 893 | AC977: 164.501679731243 | AD977: 48
A978: COBURG | C978: JORDAN 3 | E978: BYRON 2 | G978: CLARKSON | I978: MAHONEY | L978: O'SULLIVAN | O978: GLEESON | Q978: CARR | S978: BEVIS | W978: COBURG | X978: 12 | Y978: 2 | Z978: 0 | AA978: 1500 | AB978: 1021 | AC978: 146.91478942213516 | AD978: 48
A979: WILLIAMSTOWN | C979: PELLY 3 | F979: WARD 2 | I979: EVANS | K979: MATTHEWS | N979: DAVIES | W979: MOORABBIN | X979: 11 | Y979: 3 | Z979: 0 | AA979: 1563 | AB979: 880 | AC979: 177.61 | AD979: 44
A981: SANDRINGHAM | C981: 1 | D981: 1 | E981: =C981*6+D981 -> 7 | G981: 2 | H981: 4 | I981: =G981*6+H981 -> 16 | K981: 4 | L981: 5 | M981: =K981*6+L981 -> 29 | O981: 7 | P981: 10 | Q981: =O981*6+P981 -> 52 | S981: BEACH ROAD | W981: OAKLEIGH | X981: 10 | Y981: 4 | Z981: 0 | AA981: 1431 | AB981: 970 | AC981: 147.5257731958763 | AD981: 40
A982: OAKLEIGH | C982: 2 | D982: 5 | E982: =C982*6+D982 -> 17 | G982: 3 | H982: 8 | I982: =G982*6+H982 -> 26 | K982: 4 | L982: 10 | M982: =K982*6+L982 -> 34 | O982: 6 | P982: 11 | Q982: =O982*6+P982 -> 47 | S982: ROACH | W982: YARRAVILLE | X982: 10 | Y982: 4 | Z982: 0 | AA982: 1369 | AB982: 941 | AC982: 145.48 | AD982: 40
A983: BEST PLAYERS | W983: MORDIALLOC | X983: 9 | Y983: 5 | Z983: 0 | AA983: 1274 | AB983: 1002 | AC983: 127.15 | AD983: 36
A984: SANDRINGHAM | C984: CROFT | F984: McKENZIE | I984: RICHARDS | L984: STEELE | N984: VANCE | Q984: BOLAND | W984: PORT MELBOURNE | X984: 7 | Y984: 6 | Z984: 1 | AA984: 1249 | AB984: 1119 | AC984: 111.61751563896335 | AD984: 30
A985: OAKLEIGH | C985: McCOOKE | F985: COLLINS | I985: PEAKE | L985: KITTO | N985: PRENDERGAST | Q985: COUGHLAN | W985: BOX HILL | X985: 7 | Y985: 7 | Z985: 0 | AA985: 1199 | AB985: 1143 | AC985: 104.89938757655293 | AD985: 28
A986: GOALKICKERS | W986: BRUNSWICK | X986: 5 | Y986: 8 | Z986: 1 | AA986: 1229 | AB986: 1163 | AC986: 105.6749785038693 | AD986: 22
A987: SANDRINGHAM | C987: STEELE 3 | F987: OAKLEY 2 | I987: ECCLESTON 2 | W987: DANDENONG | X987: 5 | Y987: 9 | Z987: 0 | AA987: 1109 | AB987: 1358 | AC987: 81.66 | AD987: 20
A988: OAKLEIGH | C988: PALMER 2 | F988: COUGHLAN | I988: D'ARCY | K988: J WILLIAMS | N988: VARNEY | W988: PRESTON | X988: 4 | Y988: 10 | Z988: 0 | AA988: 989 | AB988: 1502 | AC988: 65.85 | AD988: 16
W989: SUNSHINE | X989: 3 | Y989: 11 | Z989: 0 | AA989: 870 | AB989: 1507 | AC989: 57.73 | AD989: 12
A990: BOX HILL | C990: 4 | D990: 4 | E990: =C990*6+D990 -> 28 | G990: 6 | H990: 9 | I990: =G990*6+H990 -> 45 | K990: 10 | L990: 9 | M990: =K990*6+L990 -> 69 | O990: 13 | P990: 14 | Q990: =O990*6+P990 -> 92 | S990: MORDIALLOC | W990: BRIGHTON | X990: 1 | Y990: 13 | Z990: 0 | AA990: 989 | AB990: 1518 | AC990: 65.151515151515156 | AD990: 4
A991: MORDIALLOC | C991: 3 | D991: 0 | E991: =C991*6+D991 -> 18 | G991: 6 | H991: 3 | I991: =G991*6+H991 -> 39 | K991: 8 | L991: 5 | M991: =K991*6+L991 -> 53 | O991: 9 | P991: 7 | Q991: =O991*6+P991 -> 61 | S991: BREWER | W991: NORTHCOTE | X991: 1 | Y991: 13 | Z991: 0 | AA991: 1027 | AB991: 1617 | AC991: 63.51 | AD991: 4
A992: BEST PLAYERS | W992: CAMBERWELL | X992: 1 | Y992: 13 | Z992: 0 | AA992: 647 | AB992: 1917 | AC992: 33.75 | AD992: 4
A993: BOX HILL | C993: SALVADO | F993: BROWN | I993: WHITE | L993: SAWATSKY | O993: WITTMER | R993: PLUNKETT
A994: MORDIALLOC | C994: BESANKO | F994: BARR | I994: MAUNDER | L994: COSTELLO | O994: PEARSON | R994: MEADE
A995: GOALKICKERS
A996: BOX HILL | C996: SALVADO 5 | F996: SAWATSKY 4 | I996: CARRICK | K996: WHITE | M996: LANE | O996: WITNISH
A997: MORDIALLOC | C997: BAKER 3 | F997: COSTELLO 2 | I997: BESANKO | K997: WILKINSON | N997: KERR | P997: ROBERTS
A999: PORT MELBOURNE | C999: 5 | D999: 6 | E999: =C999*6+D999 -> 36 | G999: 7 | H999: 7 | I999: =G999*6+H999 -> 49 | K999: 9 | L999: 11 | M999: =K999*6+L999 -> 65 | O999: 9 | P999: 14 | Q999: =O999*6+P999 -> 68 | S999: PORT MELBOURNE
A1000: BRUNSWICK | C1000: 3 | D1000: 4 | E1000: =C1000*6+D1000 -> 22 | G1000: 5 | H1000: 5 | I1000: =G1000*6+H1000 -> 35 | K1000: 7 | L1000: 10 | M1000: =K1000*6+L1000 -> 52 | O1000: 9 | P1000: 14 | Q1000: =O1000*6+P1000 -> 68 | S1000: MARCY
A1001: BEST PLAYERS
A1002: PORT MELBOURNE | C1002: McRAE | F1002: BOWEN | I1002: MONKS | L1002: QUAIFE | O1002: SPENCE | R1002: WITHERS
A1003: BRUNSWICK | C1003: WHILEY | F1003: STANLEY | I1003: McCORMACK | L1003: ROBSON | O1003: EDWARDS | R1003: K DILLON
A1004: GOALKICKERS
A1005: PORT MELBOURNE | C1005: BONNETT 4 | F1005: PENALUNA 2 | I1005: MONKS | K1005: CAMERON | N1005: CLAXTON
A1006: BRUNSWICK | C1006: YOUNG 2 | F1006: ROBSON 2 | I1006: McKENNA | K1006: McFARLANE | N1006: BIBBY | P1006: STANLEY | R1006: WATT
A1008: NORTHCOTE | C1008: 2 | D1008: 1 | E1008: =C1008*6+D1008 -> 13 | G1008: 4 | H1008: 5 | I1008: =G1008*6+H1008 -> 29 | K1008: 8 | L1008: 6 | M1008: =K1008*6+L1008 -> 54 | O1008: 9 | P1008: 10 | Q1008: =O1008*6+P1008 -> 64 | S1008: NORTHCOTE
A1009: SUNSHINE | C1009: 1 | D1009: 3 | E1009: =C1009*6+D1009 -> 9 | G1009: 4 | H1009: 3 | I1009: =G1009*6+H1009 -> 27 | K1009: 6 | L1009: 7 | M1009: =K1009*6+L1009 -> 43 | O1009: 6 | P1009: 9 | Q1009: =O1009*6+P1009 -> 45 | S1009: HORNE
A1010: BEST PLAYERS
A1011: NORTHCOTE | C1011: BRETHERTON | F1011: VAINS | I1011: CLARK | K1011: ATKINSON | N1011: SHAW | P1011: WRIGHT
A1012: SUNSHINE | C1012: WARREN | F1012: SEYMOUR | I1012: P FITZGERALD | L1012: TREZISE | N1012: JEPSON | P1012: KEMP
A1013: GOALKICKERS
A1014: NORTHCOTE | C1014: CLARK 4 | F1014: SCOTT 2 | I1014: VAINS | K1014: WRIGHT | M1014: SHAW
A1015: SUNSHINE | C1015: FOREMAN 3 | F1015: LITCHFIELD 3
A1017: YARRAVILLE | C1017: 4 | D1017: 3 | E1017: =C1017*6+D1017 -> 27 | G1017: 8 | H1017: 6 | I1017: =G1017*6+H1017 -> 54 | K1017: 13 | L1017: 10 | M1017: =K1017*6+L1017 -> 88 | O1017: 15 | P1017: 10 | Q1017: =O1017*6+P1017 -> 100 | S1017: PRESTON
A1018: PRESTON | C1018: 1 | D1018: 0 | E1018: =C1018*6+D1018 -> 6 | G1018: 5 | H1018: 3 | I1018: =G1018*6+H1018 -> 33 | K1018: 5 | L1018: 4 | M1018: =K1018*6+L1018 -> 34 | O1018: 6 | P1018: 11 | Q1018: =O1018*6+P1018 -> 47 | S1018: DIXON
A1019: BEST PLAYERS
A1020: YARRAVILLE | C1020: BOURKE | F1020: DRINAN | I1020: RON BROWN | L1020: BOB BROWN | O1020: BURT | R1020: MASON
A1021: PRESTON | C1021: RYMER | F1021: WOOD | I1021: NELSON | L1021: BERGIN | O1021: HAUGHTON | R1021: WALSH
A1022: GOALKICKERS
A1023: YARRAVILLE | C1023: RON BROWN 5 | F1023: BOURKE 3 | I1023: COLLINS 2 | L1023: BURT | N1023: VANDERFEEN | Q1023: CROOK | S1023: LETCHER | V1023: CAREY
A1024: PRESTON | C1024: WALSH 2 | F1024: OLIVER | I1024: WILSON | K1024: JENSEN | M1024: BERGIN
A1026: DANDENONG | C1026: 1 | D1026: 5 | E1026: =C1026*6+D1026 -> 11 | G1026: 3 | H1026: 9 | I1026: =G1026*6+H1026 -> 27 | K1026: 6 | L1026: 14 | M1026: =K1026*6+L1026 -> 50 | O1026: 7 | P1026: 20 | Q1026: =O1026*6+P1026 -> 62 | S1026: DANDENONG
A1027: CAMBERWELL | C1027: 1 | D1027: 2 | E1027: =C1027*6+D1027 -> 8 | G1027: 4 | H1027: 8 | I1027: =G1027*6+H1027 -> 32 | K1027: 6 | L1027: 9 | M1027: =K1027*6+L1027 -> 45 | O1027: 8 | P1027: 12 | Q1027: =O1027*6+P1027 -> 60 | S1027: POLLARD
A1028: BEST PLAYERS
A1029: DANDENONG | C1029: LALOR | F1029: GUILLE | I1029: GRAY | L1029: COOTE | O1029: LITTLE | R1029: HOWER
A1030: CAMBERWELL | C1030: EADES | F1030: K JOHNSON | I1030: M COMMONS | L1030: K CHAMBERS | O1030: WATTS | R1030: MOULE
A1031: GOALKICKERS
A1032: DANDENONG | C1032: LALOR 3 | F1032: GRAY 2 | I1032: COOK | K1032: DALE
A1033: CAMBERWELL | C1033: K JOHNSON 2 | F1033: EADES 2 | I1033: M CHAMBERS | L1033: WHITING | N1033: ELLIS | P1033: COMMONS
A1035: MOORABBIN | C1035: 2 | D1035: 4 | E1035: =C1035*6+D1035 -> 16 | G1035: 6 | H1035: 9 | I1035: =G1035*6+H1035 -> 45 | K1035: 8 | L1035: 12 | M1035: =K1035*6+L1035 -> 60 | O1035: 14 | P1035: 18 | Q1035: =O1035*6+P1035 -> 102 | S1035: ELSTERNWICK PARK
A1036: BRIGHTON | C1036: 0 | D1036: 4 | E1036: =C1036*6+D1036 -> 4 | G1036: 3 | H1036: 4 | I1036: =G1036*6+H1036 -> 22 | K1036: 5 | L1036: 6 | M1036: =K1036*6+L1036 -> 36 | O1036: 5 | P1036: 7 | Q1036: =O1036*6+P1036 -> 37 | S1036: O'DONOGHUE
A1037: BEST PLAYERS
A1038: MOORABBIN | C1038: GILDER | F1038: CRAMERI | I1038: BILLSON | L1038: KENT | N1038: MORONEY | Q1038: TREZISE
A1039: BRIGHTON | C1039: BURSEY | F1039: FOX | I1039: WILLIAMS | L1039: FOLEY | N1039: WHITE | Q1039: BROWNING
A1040: GOALKICKERS
A1041: MOORABBIN | C1041: BILLSON 4 | F1041: CRAMERI 3 | I1041: MORONEY 2 | L1041: RYAN | N1041: RENWICK | P1041: PAPLEY | R1041: PERRY | T1041: HOGAN
A1042: BRIGHTON | C1042: BURSEY 3 | F1042: McCANN | I1042: CRAIG
A1044: ROUND 15 | E1044: 1ST AUGUST | J1044: WEATHER | M1044: STRONG NORTH WEST WIND | S1044: PLAYED AT
D1045: 1ST QTR | H1045: 2ND QTR | L1045: 3RD QTR | P1045: FINAL | S1045: WILLIAMSTOWN
A1046: WILLIAMSTOWN | C1046: 2 | D1046: 1 | E1046: =C1046*6+D1046 -> 13 | G1046: 7 | H1046: 7 | I1046: =G1046*6+H1046 -> 49 | K1046: 7 | L1046: 11 | M1046: =K1046*6+L1046 -> 53 | O1046: 13 | P1046: 16 | Q1046: =O1046*6+P1046 -> 94 | S1046: UMPIRE | X1046: LADDER | AB1046: ROUND | AD1046: 15
A1047: SANDRINGHAM | C1047: 2 | D1047: 5 | E1047: =C1047*6+D1047 -> 17 | G1047: 2 | H1047: 6 | I1047: =G1047*6+H1047 -> 18 | K1047: 3 | L1047: 8 | M1047: =K1047*6+L1047 -> 26 | O1047: 5 | P1047: 10 | Q1047: =O1047*6+P1047 -> 40 | S1047: O'DONOGHUE
A1048: BEST PLAYERS | W1048: TEAM | X1048: W | Y1048: L | Z1048: D | AA1048: FOR | AB1048: AGST | AC1048: % | AD1048: PTS
A1049: WILLIAMSTOWN | C1049: MURPHY | F1049: MATTHEWS | I1049: DAVIES | K1049: SMITH | N1049: MALONEY | Q1049: WARD
A1050: SANDRINGHAM | C1050: WEBSTER | F1050: JONES | I1050: CROFT | K1050: ECCLESTON | N1050: SHRIVES | Q1050: VANCE | W1050: WILLIAMSTOWN | X1050: 14 | Y1050: 1 | Z1050: 0 | AA1050: 1642 | AB1050: 951 | AC1050: 172.66 | AD1050: 56
A1051: GOALKICKERS | W1051: MOORABBIN | X1051: 12 | Y1051: 3 | Z1051: 0 | AA1051: 1627 | AB1051: 902 | AC1051: 180.38 | AD1051: 48
A1052: WILLIAMSTOWN | C1052: WARD 3 | E1052: MURPHY 3 | H1052: DAVIES 2 | J1052: MALONEY 2 | M1052: MATTHEWS | P1052: JONES | R1052: MENZIES | W1052: SANDRINGHAM | X1052: 12 | Y1052: 3 | Z1052: 0 | AA1052: 1509 | AB1052: 987 | AC1052: 152.88753799392097 | AD1052: 48
A1053: SANDRINGHAM | C1053: WEBSTER 4 | F1053: SHRIVES | W1053: COBURG | X1053: 12 | Y1053: 3 | Z1053: 0 | AA1053: 1522 | AB1053: 1085 | AC1053: 140.27649769585253 | AD1053: 48
A1055: MOORABBIN | C1055: 0 | D1055: 1 | E1055: =C1055*6+D1055 -> 1 | G1055: 5 | H1055: 3 | I1055: =G1055*6+H1055 -> 33 | K1055: 5 | L1055: 5 | M1055: =K1055*6+L1055 -> 35 | O1055: 9 | P1055: 10 | Q1055: =O1055*6+P1055 -> 64 | S1055: MOORABBIN | W1055: YARRAVILLE | X1055: 11 | Y1055: 4 | Z1055: 0 | AA1055: 1520 | AB1055: 986 | AC1055: 154.16 | AD1055: 44
A1056: COBURG | C1056: 1 | D1056: 4 | E1056: =C1056*6+D1056 -> 10 | G1056: 1 | H1056: 4 | I1056: =G1056*6+H1056 -> 10 | K1056: 2 | L1056: 7 | M1056: =K1056*6+L1056 -> 19 | O1056: 2 | P1056: 10 | Q1056: =O1056*6+P1056 -> 22 | S1056: POLLARD | W1056: OAKLEIGH | X1056: 11 | Y1056: 4 | Z1056: 0 | AA1056: 1549 | AB1056: 1019 | AC1056: 152.01177625122671 | AD1056: 44
A1057: BEST PLAYERS | W1057: MORDIALLOC | X1057: 9 | Y1057: 6 | Z1057: 0 | AA1057: 1355 | AB1057: 1085 | AC1057: 124.88 | AD1057: 36
A1058: MOORABBIN | C1058: BOYD | E1058: GREEN | H1058: GILDER | K1058: PAPLEY | N1058: RENWICK | Q1058: WHALEBONE | W1058: PORT MELBOURNE | X1058: 8 | Y1058: 6 | Z1058: 1 | AA1058: 1394 | AB1058: 1171 | AC1058: 119.04355251921434 | AD1058: 34
A1059: COBURG | C1059: WILSON | E1059: YOUNG | H1059: O'SULLIVAN | K1059: SHAW | N1059: BIGELOW | Q1059: JORDAN | W1059: BOX HILL | X1059: 7 | Y1059: 8 | Z1059: 0 | AA1059: 1245 | AB1059: 1206 | AC1059: 103.23383084577114 | AD1059: 28
A1060: GOALKICKERS | W1060: BRUNSWICK | X1060: 6 | Y1060: 8 | Z1060: 1 | AA1060: 1312 | AB1060: 1244 | AC1060: 105.46623794212219 | AD1060: 26
A1061: MOORABBIN | C1061: CRAMERI 3 | F1061: PAPLEY 2 | I1061: RYAN | K1061: HOGAN | M1061: BILLSON | O1061: McGAW | W1061: DANDENONG | X1061: 5 | Y1061: 10 | Z1061: 0 | AA1061: 1169 | AB1061: 1430 | AC1061: 81.75 | AD1061: 20
A1062: COBURG | C1062: JORDAN | F1062: O'SULLIVAN | W1062: PRESTON | X1062: 5 | Y1062: 10 | Z1062: 0 | AA1062: 1061 | AB1062: 1562 | AC1062: 67.93 | AD1062: 20
W1063: SUNSHINE | X1063: 4 | Y1063: 11 | Z1063: 0 | AA1063: 933 | AB1063: 1553 | AC1063: 60.08 | AD1063: 16
A1064: BRUNSWICK | C1064: 3 | D1064: 3 | E1064: =C1064*6+D1064 -> 21 | G1064: 4 | H1064: 6 | I1064: =G1064*6+H1064 -> 30 | K1064: 10 | L1064: 8 | M1064: =K1064*6+L1064 -> 68 | O1064: 12 | P1064: 11 | Q1064: =O1064*6+P1064 -> 83 | S1064: NORTHCOTE | W1064: BRIGHTON | X1064: 1 | Y1064: 14 | Z1064: 0 | AA1064: 1034 | AB1064: 1669 | AC1064: 61.953265428400236 | AD1064: 4
A1065: MORDIALLOC | C1065: 4 | D1065: 1 | E1065: =C1065*6+D1065 -> 25 | G1065: 10 | H1065: 4 | I1065: =G1065*6+H1065 -> 64 | K1065: 11 | L1065: 5 | M1065: =K1065*6+L1065 -> 71 | O1065: 12 | P1065: 9 | Q1065: =O1065*6+P1065 -> 81 | S1065: BAIRD | W1065: NORTHCOTE | X1065: 1 | Y1065: 14 | Z1065: 0 | AA1065: 1076 | AB1065: 1735 | AC1065: 62.02 | AD1065: 4
A1066: BEST PLAYERS | W1066: CAMBERWELL | X1066: 1 | Y1066: 14 | Z1066: 0 | AA1066: 699 | AB1066: 2062 | AC1066: 33.9 | AD1066: 4
A1067: BRUNSWICK | C1067: K DILLON | F1067: STANLEY | I1067: WHILEY | L1067: R DILLON | O1067: HAYES | R1067: McCORMACK
A1068: MORDIALLOC | C1068: BAKER | F1068: KERR | I1068: BESANKO | L1068: MEADE | O1068: COSTELLO | R1068: JOSE
A1069: GOALKICKERS
A1070: BRUNSWICK | C1070: G STANLEY 4 | F1070: K DILLON 3 | I1070: ROBSON 2 | L1070: WHILEY | N1070: BIBBY | P1070: VELO
A1071: MORDIALLOC | C1071: BAKER 4 | F1071: PEARSON 2 | I1071: CRAWFORD 2 | L1071: COSTELLO 2 | O1071: O'NEILL | Q1071: KERR
A1073: PRESTON | C1073: 1 | D1073: 5 | E1073: =C1073*6+D1073 -> 11 | G1073: 6 | H1073: 8 | I1073: =G1073*6+H1073 -> 44 | K1073: 7 | L1073: 8 | M1073: =K1073*6+L1073 -> 50 | O1073: 9 | P1073: 18 | Q1073: =O1073*6+P1073 -> 72 | S1073: PRESTON
A1074: DANDENONG | C1074: 1 | D1074: 1 | E1074: =C1074*6+D1074 -> 7 | G1074: 1 | H1074: 4 | I1074: =G1074*6+H1074 -> 10 | K1074: 7 | L1074: 12 | M1074: =K1074*6+L1074 -> 54 | O1074: 8 | P1074: 12 | Q1074: =O1074*6+P1074 -> 60 | S1074: HORNE
A1075: BEST PLAYERS
A1076: PRESTON | C1076: MCKENZIE | F1076: WILSON | I1076: RYMER | L1076: HAUGHTON | O1076: DANGUAARD | R1076: LAMBIE
A1077: DANDENONG | C1077: WATERS | F1077: TODD | I1077: PHIPPS | L1077: LALOR | O1077: HOWER | R1077: HEAD
A1078: GOALKICKERS
A1079: PRESTON | C1079: RYMER 5 | F1079: LAMBIE | H1079: McKENZIE | J1079: BERGIN | L1079: McMAHON
A1080: DANDENONG | C1080: LALOR 2 | F1080: TODD 2 | H1080: WATERS | J1080: PHIPPS | L1080: PETERS | N1080: LITTLE
A1082: SUNSHINE | C1082: 3 | D1082: 6 | E1082: =C1082*6+D1082 -> 24 | G1082: 4 | H1082: 7 | I1082: =G1082*6+H1082 -> 31 | K1082: 9 | L1082: 8 | M1082: =K1082*6+L1082 -> 62 | O1082: 9 | P1082: 9 | Q1082: =O1082*6+P1082 -> 63 | S1082: SUNSHINE
A1083: BOX HILL | C1083: 0 | D1083: 1 | E1083: =C1083*6+D1083 -> 1 | G1083: 2 | H1083: 6 | I1083: =G1083*6+H1083 -> 18 | K1083: 4 | L1083: 9 | M1083: =K1083*6+L1083 -> 33 | O1083: 5 | P1083: 16 | Q1083: =O1083*6+P1083 -> 46 | S1083: ALLEN
A1084: BEST PLAYERS
A1085: SUNSHINE | C1085: TREZISE | F1085: WARREN | I1085: CROSBIE | L1085: LITCHFIELD | O1085: KEMP | R1085: MILNE
A1086: BOX HILL | C1086: MILNE | F1086: BROWN | I1086: SAWATSKY | L1086: PLUNKETT | O1086: WITNISH | R1086: EADE
A1087: GOALKICKERS
A1088: SUNSHINE | C1088: LITCHFIELD 2 | F1088: MILNE 2 | I1088: WARREN 2 | L1088: TREZISE | N1088: KELLY | P1088: MORRIS
A1089: BOX HILL | C1089: SALVADO 3 | F1089: SAWATSKY | I1089: WITNISH
A1091: PORT MELBOURNE | C1091: 3 | D1091: 4 | E1091: =C1091*6+D1091 -> 22 | G1091: 10 | H1091: 12 | I1091: =G1091*6+H1091 -> 72 | K1091: 14 | L1091: 14 | M1091: =K1091*6+L1091 -> 98 | O1091: 21 | P1091: 19 | Q1091: =O1091*6+P1091 -> 145 | S1091: CAMBERWELL
A1092: CAMBERWELL | C1092: 2 | D1092: 2 | E1092: =C1092*6+D1092 -> 14 | G1092: 4 | H1092: 2 | I1092: =G1092*6+H1092 -> 26 | K1092: 6 | L1092: 4 | M1092: =K1092*6+L1092 -> 40 | O1092: 8 | P1092: 4 | Q1092: =O1092*6+P1092 -> 52 | S1092: ROWE
A1093: BEST PLAYERS
A1094: PORT MELBOURNE | C1094: QUAIFE | F1094: MONKS | I1094: CLAXTON | L1094: BONNETT | O1094: ATKINSON | R1094: OUSLEY
A1095: CAMBERWELL | C1095: EADES | F1095: SKALBERG | I1095: MOULE | L1095: K CHAMBERS | O1095: SEYMOUR | R1095: COMMONS
A1096: GOALKICKERS
A1097: PORT MELBOURNE | C1097: BONNETT 8 | F1097: QUAIFE 4 | I1097: MONKS 3 | K1097: PENALUNA 2 | N1097: CLAXTON 2 | Q1097: JOLIFFE | S1097: WITHERS
A1098: CAMBERWELL | C1098: SKALBERG 2 | F1098: K JOHNSON | I1098: SEYMOUR | K1098: ELLIS | M1098: M CHAMBERS | P1098: K CHAMBERS | S1098: EADES
A1100: OAKLEIGH | C1100: 4 | D1100: 5 | E1100: =C1100*6+D1100 -> 29 | G1100: 6 | H1100: 13 | I1100: =G1100*6+H1100 -> 49 | K1100: 12 | L1100: 18 | M1100: =K1100*6+L1100 -> 90 | O1100: 16 | P1100: 22 | Q1100: =O1100*6+P1100 -> 118 | S1100: OAKLEIGH
A1101: NORTHCOTE | C1101: 1 | D1101: 2 | E1101: =C1101*6+D1101 -> 8 | G1101: 4 | H1101: 3 | I1101: =G1101*6+H1101 -> 27 | K1101: 7 | L1101: 3 | M1101: =K1101*6+L1101 -> 45 | O1101: 7 | P1101: 7 | Q1101: =O1101*6+P1101 -> 49 | S1101: BREWER
A1102: BEST PLAYERS
A1103: OAKLEIGH | C1103: COUGHLAN | F1103: PRENDERGAST | J1103: NAISMITH | M1103: DONOHUE | P1103: COLLINS | S1103: ASH
A1104: NORTHCOTE | C1104: CLARK | F1104: ROOTSEY | J1104: WRIGHT | M1104: CONYBEAR | P1104: FLANAGAN | S1104: MARCHANT
A1105: GOALKICKERS
A1106: OAKLEIGH | C1106: COUGHLAN 5 | F1106: JONES 3 | H1106: J WILLIAMS 3 | K1106: COLLINS 2 | N1106: VARNEY 2 | Q1106: McCOOKE
A1107: NORTHCOTE | C1107: FLANAGAN 2 | F1107: CLARK 2 | I1107: SCOTT 2 | L1107: WRIGHT
A1109: YARRAVILLE | C1109: 6 | D1109: 5 | E1109: =C1109*6+D1109 -> 41 | G1109: 9 | H1109: 6 | I1109: =G1109*6+H1109 -> 60 | K1109: 22 | L1109: 13 | M1109: =K1109*6+L1109 -> 145 | O1109: 23 | P1109: 13 | Q1109: =O1109*6+P1109 -> 151 | S1109: ELSTERNWICK PARK
A1110: BRIGHTON | C1110: 0 | D1110: 0 | E1110: =C1110*6+D1110 -> 0 | G1110: 2 | H1110: 2 | I1110: =G1110*6+H1110 -> 14 | K1110: 3 | L1110: 3 | M1110: =K1110*6+L1110 -> 21 | O1110: 6 | P1110: 9 | Q1110: =O1110*6+P1110 -> 45 | S1110: ROACH
A1111: BEST PLAYERS
A1112: YARRAVILLE | C1112: ANDERSON | F1112: MASON | I1112: DRINAN | K1112: WILLIAMS | N1112: BOURKE | Q1112: CAREY
A1113: BRIGHTON | C1113: BURSEY | F1113: FOLEY | I1113: CRAIG | K1113: McCANN | N1113: BROWNING | Q1113: W COOPER
A1114: GOALKICKERS
A1115: YARRAVILLE | C1115: ANDERSON 11 | F1115: BOURKE 3 | I1115: CAREY 3 | K1115: RON BROWN 2 | N1115: CROOK 2 | Q1115: NEWMAN | S1115: LETCHER
A1116: BRIGHTON | C1116: P COOPER 2 | F1116: CURRIE 2 | I1116: BURSEY | K1116: W COOPER
A1118: ROUND 16 | E1118: 8TH AUGUST | I1118: WEATHER | L1118: WEST WIND FINE GROUNDS SLIPPERY | S1118: PLAYED AT
D1119: 1ST QTR | H1119: 2ND QTR | L1119: 3RD QTR | P1119: FINAL | S1119: YARRAVILLE
A1120: YARRAVILLE | C1120: 3 | D1120: 1 | E1120: =C1120*6+D1120 -> 19 | G1120: 8 | H1120: 5 | I1120: =G1120*6+H1120 -> 53 | K1120: 11 | L1120: 11 | M1120: =K1120*6+L1120 -> 77 | O1120: 15 | P1120: 18 | Q1120: =O1120*6+P1120 -> 108 | S1120: UMPIRE | X1120: LADDER | AB1120: ROUND | AD1120: 16
A1121: MOORABBIN | C1121: 4 | D1121: 2 | E1121: =C1121*6+D1121 -> 26 | G1121: 5 | H1121: 3 | I1121: =G1121*6+H1121 -> 33 | K1121: 8 | L1121: 5 | M1121: =K1121*6+L1121 -> 53 | O1121: 8 | P1121: 6 | Q1121: =O1121*6+P1121 -> 54 | S1121: ROWE
A1122: BEST PLAYERS | W1122: TEAM | X1122: W | Y1122: L | Z1122: D | AA1122: FOR | AB1122: AGST | AC1122: % | AD1122: PTS
A1123: YARRAVILLE | C1123: CROOK | F1123: CAREY | I1123: ANDERSON | L1123: BOURKE | N1123: LETCHER | Q1123: MASON
A1124: MOORABBIN | C1124: WHALEBONE | F1124: BURGESS | I1124: BOYD | L1124: GILDER | N1124: HOY | Q1124: BILLSON | W1124: WILLIAMSTOWN | X1124: 15 | Y1124: 1 | Z1124: 0 | AA1124: 1736 | AB1124: 1022 | AC1124: 169.86 | AD1124: 60
A1125: GOALKICKERS | W1125: SANDRINGHAM | X1125: 13 | Y1125: 3 | Z1125: 0 | AA1125: 1645 | AB1125: 1061 | AC1125: 155.04241281809612 | AD1125: 52
A1126: YARRAVILLE | C1126: ANDERSON 4 | F1126: LETCHER 3 | I1126: CROOK 3 | K1126: COLLINS 2 | N1126: CAREY 2 | Q1126: BOURKE | W1126: COBURG | X1126: 13 | Y1126: 3 | Z1126: 0 | AA1126: 1639 | AB1126: 1125 | AC1126: 145.6888888888889 | AD1126: 52
A1127: MOORABBIN | C1127: WHALEBONE 3 | F1127: CRAMERI | I1127: BILLSON | K1127: HOY | M1127: PAPLEY | O1127: McGAW | W1127: MOORABBIN | X1127: 12 | Y1127: 4 | Z1127: 0 | AA1127: 1681 | AB1127: 1010 | AC1127: 166.44 | AD1127: 48
A1129: OAKLEIGH | C1129: 4 | D1129: 2 | E1129: =C1129*6+D1129 -> 26 | G1129: 6 | H1129: 5 | I1129: =G1129*6+H1129 -> 41 | K1129: 8 | L1129: 9 | M1129: =K1129*6+L1129 -> 57 | O1129: 15 | P1129: 11 | Q1129: =O1129*6+P1129 -> 101 | S1129: PORT MELBOURNE | W1129: YARRAVILLE | X1129: 12 | Y1129: 4 | Z1129: 0 | AA1129: 1628 | AB1129: 1040 | AC1129: 155.34 | AD1129: 48
A1130: PORT MELBOURNE | C1130: 2 | D1130: 4 | E1130: =C1130*6+D1130 -> 16 | G1130: 4 | H1130: 6 | I1130: =G1130*6+H1130 -> 30 | K1130: 11 | L1130: 10 | M1130: =K1130*6+L1130 -> 76 | O1130: 12 | P1130: 11 | Q1130: =O1130*6+P1130 -> 83 | S1130: HORNE | W1130: OAKLEIGH | X1130: 12 | Y1130: 4 | Z1130: 0 | AA1130: 1650 | AB1130: 1102 | AC1130: 149.72776769509983 | AD1130: 48
A1131: BEST PLAYERS | W1131: MORDIALLOC | X1131: 9 | Y1131: 7 | Z1131: 0 | AA1131: 1426 | AB1131: 1179 | AC1131: 120.95 | AD1131: 36
A1132: OAKLEIGH | C1132: COUGHLAN | F1132: NAISMITH | I1132: LANE | L1132: J WILLIAMS | O1132: KITTO | Q1132: JONES | W1132: PORT MELBOURNE | X1132: 8 | Y1132: 7 | Z1132: 1 | AA1132: 1477 | AB1132: 1272 | AC1132: 116.11635220125787 | AD1132: 34
A1133: PORT MELBOURNE | C1133: CLAXTON | F1133: LEWIS | I1133: BONNETT | L1133: BOWEN | O1133: ATKINSON | Q1133: MONKS | W1133: BOX HILL | X1133: 8 | Y1133: 8 | Z1133: 0 | AA1133: 1359 | AB1133: 1243 | AC1133: 109.33226065969428 | AD1133: 32
A1134: GOALKICKERS | N1134: PALMER | Q1134: NAISMITH | W1134: BRUNSWICK | X1134: 6 | Y1134: 9 | Z1134: 1 | AA1134: 1386 | AB1134: 1380 | AC1134: 100.43478260869566 | AD1134: 26
A1135: OAKLEIGH | C1135: VARNEY 3 | E1135: J WILLIAMS 2 | H1135: JONES 2 | J1135: COUGHLAN 2 | M1135: BAPTIST 2 | P1135: COLLINS | R1135: D'ARCY | W1135: DANDENONG | X1135: 6 | Y1135: 10 | Z1135: 0 | AA1135: 1285 | AB1135: 1493 | AC1135: 86.07 | AD1135: 24
A1136: PORT MELBOURNE | C1136: BONNETT 6 | F1136: CLAXTON 3 | I1136: JOLIFFE | K1136: BOWEN | M1136: WEBSTER | W1136: PRESTON | X1136: 5 | Y1136: 11 | Z1136: 0 | AA1136: 1098 | AB1136: 1676 | AC1136: 65.51 | AD1136: 20
W1137: SUNSHINE | X1137: 4 | Y1137: 12 | Z1137: 0 | AA1137: 996 | AB1137: 1669 | AC1137: 59.68 | AD1137: 16
A1138: WILLIAMSTOWN | C1138: 2 | D1138: 8 | E1138: =C1138*6+D1138 -> 20 | G1138: 3 | H1138: 12 | I1138: =G1138*6+H1138 -> 30 | K1138: 9 | L1138: 19 | M1138: =K1138*6+L1138 -> 73 | O1138: 12 | P1138: 22 | Q1138: =O1138*6+P1138 -> 94 | S1138: MORDIALLOC | W1138: NORTHCOTE | X1138: 2 | Y1138: 14 | Z1138: 0 | AA1138: 1169 | AB1138: 1797 | AC1138: 65.05 | AD1138: 8
A1139: MORDIALLOC | C1139: 3 | D1139: 2 | E1139: =C1139*6+D1139 -> 20 | G1139: 8 | H1139: 3 | I1139: =G1139*6+H1139 -> 51 | K1139: 9 | L1139: 5 | M1139: =K1139*6+L1139 -> 59 | O1139: 10 | P1139: 11 | Q1139: =O1139*6+P1139 -> 71 | S1139: ALLEN | W1139: BRIGHTON | X1139: 1 | Y1139: 15 | Z1139: 0 | AA1139: 1074 | AB1139: 1786 | AC1139: 60.134378499440089 | AD1139: 4
A1140: BEST PLAYERS | W1140: CAMBERWELL | X1140: 1 | Y1140: 15 | Z1140: 0 | AA1140: 761 | AB1140: 2155 | AC1140: 35.31 | AD1140: 4
A1141: WILLIAMSTOWN | C1141: SMITH | F1141: MALONEY | I1141: EVANS | L1141: ANDERSON | O1141: PELLY | Q1141: KELLETT
A1142: MORDIALLOC | C1142: BAKER | F1142: JOSE | I1142: COSTELLO | L1142: DULLARD | O1142: O'NEILL | Q1142: BESANKO
A1143: GOALKICKERS
A1144: WILLIAMSTOWN | C1144: WARD 3 | F1144: MALONEY 2 | I1144: PELLY 2 | K1144: MURPHY 2 | N1144: ANDERSON | Q1144: SMITH | S1144: MENZIES
A1145: MORDIALLOC | C1145: BAKER 5 | F1145: O'NEILL 2 | I1145: BESANKO | K1145: COSTELLO | M1145: KERR
A1147: SANDRINGHAM | C1147: 3 | D1147: 4 | E1147: =C1147*6+D1147 -> 22 | G1147: 9 | H1147: 13 | I1147: =G1147*6+H1147 -> 67 | K1147: 14 | L1147: 16 | M1147: =K1147*6+L1147 -> 100 | O1147: 19 | P1147: 22 | Q1147: =O1147*6+P1147 -> 136 | S1147: BEACH ROAD
A1148: BRUNSWICK | C1148: 5 | D1148: 1 | E1148: =C1148*6+D1148 -> 31 | G1148: 5 | H1148: 3 | I1148: =G1148*6+H1148 -> 33 | K1148: 9 | L1148: 5 | M1148: =K1148*6+L1148 -> 59 | O1148: 11 | P1148: 8 | Q1148: =O1148*6+P1148 -> 74 | S1148: BREWER
A1149: BEST PLAYERS
A1150: SANDRINGHAM | C1150: WEBSTER | F1150: SHRIVES | I1150: RICHARDS | L1150: STEELE | O1150: JONES | R1150: OAKLEY
A1151: BRUNSWICK | C1151: WHILEY | F1151: K DILLON | I1151: STANLEY | L1151: HAYES | O1151: EDWARDS | R1151: R DILLON
A1152: GOALKICKERS
A1153: SANDRINGHAM | C1153: WEBSTER 5 | F1153: STEELE 4 | I1153: OAKLEY 4 | L1153: GLEESON 2 | N1153: ALSOPP | P1153: ECCLESTON | S1153: RICHARDS | V1153: WILLIAMS
A1154: BRUNSWICK | C1154: WHILEY 4 | F1154: STANLEY 3 | I1154: WATT | K1154: K DILLON | M1154: McFARLANE | P1154: McKENNA
A1156: BOX HILL | C1156: 1 | D1156: 3 | E1156: =C1156*6+D1156 -> 9 | G1156: 6 | H1156: 8 | I1156: =G1156*6+H1156 -> 44 | K1156: 9 | L1156: 10 | M1156: =K1156*6+L1156 -> 64 | O1156: 16 | P1156: 18 | Q1156: =O1156*6+P1156 -> 114 | S1156: BOX HILL
A1157: PRESTON | C1157: 0 | D1157: 3 | E1157: =C1157*6+D1157 -> 3 | G1157: 3 | H1157: 6 | I1157: =G1157*6+H1157 -> 24 | K1157: 3 | L1157: 6 | M1157: =K1157*6+L1157 -> 24 | O1157: 5 | P1157: 7 | Q1157: =O1157*6+P1157 -> 37 | S1157: MARCY
A1158: BEST PLAYERS
A1159: BOX HILL | C1159: WHITE | F1159: WITNISH | I1159: WRIGHT | L1159: SAWATSKY | O1159: BROWN | Q1159: MILNE
A1160: PRESTON | C1160: McKENZIE | F1160: HAUGHTON | I1160: McLACHLAN | L1160: DAWSON | O1160: WOOD | Q1160: DANGUAARD
A1161: GOALKICKERS
A1162: BOX HILL | C1162: SALVADO 4 | F1162: WHITE 3 | I1162: WITNISH 3 | L1162: LANE 3 | N1162: SAWATSKY 2 | Q1162: EADE
A1163: PRESTON | C1163: McKENZIE | F1163: BERGIN | H1163: WALSH | J1163: DAWSON | L1163: LAMBIE
A1165: DANDENONG | C1165: 2 | D1165: 2 | E1165: =C1165*6+D1165 -> 14 | G1165: 7 | H1165: 10 | I1165: =G1165*6+H1165 -> 52 | K1165: 9 | L1165: 16 | M1165: =K1165*6+L1165 -> 70 | O1165: 16 | P1165: 20 | Q1165: =O1165*6+P1165 -> 116 | S1165: DANDENONG
A1166: SUNSHINE | C1166: 7 | D1166: 3 | E1166: =C1166*6+D1166 -> 45 | G1166: 7 | H1166: 3 | I1166: =G1166*6+H1166 -> 45 | K1166: 9 | L1166: 6 | M1166: =K1166*6+L1166 -> 60 | O1166: 9 | P1166: 9 | Q1166: =O1166*6+P1166 -> 63 | S1166: ROACH
A1167: BEST PLAYERS
A1168: DANDENONG | C1168: HOWER | F1168: WATERS | I1168: JOHNSON | L1168: TODD | O1168: LALOR | Q1168: PHIPPS
A1169: SUNSHINE | C1169: FITZGERALD | F1169: MORRIS | I1169: MILNE | L1169: KEMP | O1169: DIX | Q1169: SEYMOUR
A1170: GOALKICKERS
A1171: DANDENONG | C1171: GILLINGHAM 5 | F1171: LALOR 3 | I1171: GUILLE 2 | K1171: PETERS 2 | M1171: WATERS | O1171: PHIPPS | Q1171: BASSETT | S1171: TODD
A1172: SUNSHINE | C1172: MORRIS 3 | F1172: KELLY 2 | I1172: WARREN | K1172: TREZISE | M1172: SIMPSON | O1172: LITCHFIELD
A1174: NORTHCOTE | C1174: 3 | D1174: 6 | E1174: =C1174*6+D1174 -> 24 | G1174: 5 | H1174: 8 | I1174: =G1174*6+H1174 -> 38 | K1174: 11 | L1174: 13 | M1174: =K1174*6+L1174 -> 79 | O1174: 13 | P1174: 15 | Q1174: =O1174*6+P1174 -> 93 | S1174: NORTHCOTE
A1175: CAMBERWELL | C1175: 0 | D1175: 2 | E1175: =C1175*6+D1175 -> 2 | G1175: 2 | H1175: 6 | I1175: =G1175*6+H1175 -> 18 | K1175: 2 | L1175: 7 | M1175: =K1175*6+L1175 -> 19 | O1175: 8 | P1175: 14 | Q1175: =O1175*6+P1175 -> 62 | S1175: O'DONOGHUE
A1176: BEST PLAYERS
A1177: NORTHCOTE | C1177: WRIGHT | F1177: CLARK | I1177: ROOTSEY | K1177: VAINS | N1177: MARCHANT | Q1177: MONAR
A1178: CAMBERWELL | C1178: K CHAMBERS | F1178: FREYBERG | I1178: MOULE | K1178: COMMONS | N1178: EADES | Q1178: McPHERSON
A1179: GOALKICKERS
A1180: NORTHCOTE | C1180: CLARK 3 | E1180: VAINS 2 | G1180: CONYBEAR 2 | J1180: BROWN | L1180: WRIGHT | N1180: MALING | P1180: MOONEY | R1180: SHAW | T1180: ADAMSON
A1181: CAMBERWELL | C1181: SEYMOUR 2 | F1181: K JOHNSON 2 | I1181: M CHAMBERS 2 | M1181: K CHAMBERS | P1181: FREYBERG
A1183: COBURG | C1183: 4 | D1183: 4 | E1183: =C1183*6+D1183 -> 28 | G1183: 9 | H1183: 9 | I1183: =G1183*6+H1183 -> 63 | K1183: 11 | L1183: 11 | M1183: =K1183*6+L1183 -> 77 | O1183: 17 | P1183: 15 | Q1183: =O1183*6+P1183 -> 117 | S1183: COBURG
A1184: BRIGHTON | C1184: 0 | D1184: 0 | E1184: =C1184*6+D1184 -> 0 | G1184: 2 | H1184: 0 | I1184: =G1184*6+H1184 -> 12 | K1184: 4 | L1184: 2 | M1184: =K1184*6+L1184 -> 26 | O1184: 6 | P1184: 4 | Q1184: =O1184*6+P1184 -> 40 | S1184: BAIRD
A1185: BEST PLAYERS
A1186: COBURG | C1186: JORDAN | F1186: BIGELOW | I1186: HOOGEN | L1186: CARR | N1186: SHAW | Q1186: TANCREDI
A1187: BRIGHTON | C1187: ATKINSON | F1187: BROWNING | I1187: GRANT | L1187: BURSEY | N1187: N COOPER | Q1187: McDONALD
A1188: GOALKICKERS
A1189: COBURG | C1189: CARR 3 | E1189: BYRON 3 | G1189: BRENNAN 2 | J1189: SHAW 2 | L1189: NEESON 2 | N1189: O'BRIEN 2 | Q1189: JORDAN 2 | T1189: MAHONEY
A1190: BRIGHTON | C1190: P COOPER 3 | F1190: CRAIG | H1190: BURSEY | J1190: FOX
A1192: ROUND 17 | E1192: 15TH AUGUST | J1192: WEATHER | M1192: SOUTH WEST WIND COLD | S1192: PLAYED AT
D1193: 1ST QTR | H1193: 2ND QTR | L1193: 3RD QTR | P1193: FINAL | S1193: MOORABBIN
A1194: MOORABBIN | C1194: 5 | D1194: 2 | E1194: =C1194*6+D1194 -> 32 | G1194: 7 | H1194: 4 | I1194: =G1194*6+H1194 -> 46 | K1194: 14 | L1194: 9 | M1194: =K1194*6+L1194 -> 93 | O1194: 14 | P1194: 9 | Q1194: =O1194*6+P1194 -> 93 | S1194: UMPIRE | X1194: LADDER | AB1194: ROUND | AD1194: 17
A1195: WILLIAMSTOWN | C1195: 1 | D1195: 0 | E1195: =C1195*6+D1195 -> 6 | G1195: 5 | H1195: 6 | I1195: =G1195*6+H1195 -> 36 | K1195: 5 | L1195: 6 | M1195: =K1195*6+L1195 -> 36 | O1195: 8 | P1195: 10 | Q1195: =O1195*6+P1195 -> 58 | S1195: MARCY
A1196: BEST PLAYERS | W1196: TEAM | X1196: W | Y1196: L | Z1196: D | AA1196: FOR | AB1196: AGST | AC1196: % | AD1196: PTS
A1197: MOORABBIN | C1197: TREZISE | F1197: BILLSON | I1197: CAMPBELL | L1197: WHALEBONE | O1197: McGAW | R1197: HIRST
A1198: WILLIAMSTOWN | C1198: B JONES | F1198: MAZOURIS | I1198: E BEITZEL | L1198: SMITH | O1198: O'CONNOR | R1198: MALONEY | W1198: WILLIAMSTOWN | X1198: 15 | Y1198: 2 | Z1198: 0 | AA1198: 1794 | AB1198: 1115 | AC1198: 160.9 | AD1198: 60
A1199: GOALKICKERS | W1199: COBURG | X1199: 14 | Y1199: 3 | Z1199: 0 | AA1199: 1703 | AB1199: 1170 | AC1199: 145.55555555555554 | AD1199: 56
A1200: MOORABBIN | C1200: WHALEBONE 4 | F1200: PAPLEY 2 | I1200: BILLSON 2 | K1200: CAMPBELL 2 | N1200: RYAN | P1200: TREZISE | R1200: McGAW | T1200: HIRST | W1200: MOORABBIN | X1200: 13 | Y1200: 4 | Z1200: 0 | AA1200: 1774 | AB1200: 1068 | AC1200: 166.1 | AD1200: 52
A1201: WILLIAMSTOWN | C1201: MAZOURIS 3 | F1201: MALONEY 2 | I1201: SMITH | K1201: WARD | M1201: PELLY | W1201: SANDRINGHAM | X1201: 13 | Y1201: 4 | Z1201: 0 | AA1201: 1690 | AB1201: 1125 | AC1201: 150.22222222222223 | AD1201: 52
A1203: COBURG | C1203: 0 | D1203: 2 | E1203: =C1203*6+D1203 -> 2 | G1203: 2 | H1203: 7 | I1203: =G1203*6+H1203 -> 19 | K1203: 3 | L1203: 11 | M1203: =K1203*6+L1203 -> 29 | O1203: 8 | P1203: 16 | Q1203: =O1203*6+P1203 -> 64 | S1203: COBURG | W1203: OAKLEIGH | X1203: 13 | Y1203: 4 | Z1203: 0 | AA1203: 1744 | AB1203: 1169 | AC1203: 149.1873396065013 | AD1203: 52
A1204: SANDRINGHAM | C1204: 3 | D1204: 5 | E1204: =C1204*6+D1204 -> 23 | G1204: 3 | H1204: 6 | I1204: =G1204*6+H1204 -> 24 | K1204: 5 | L1204: 9 | M1204: =K1204*6+L1204 -> 39 | O1204: 6 | P1204: 9 | Q1204: =O1204*6+P1204 -> 45 | S1204: ROWE | W1204: YARRAVILLE | X1204: 12 | Y1204: 5 | Z1204: 0 | AA1204: 1695 | AB1204: 1134 | AC1204: 149.47 | AD1204: 48
A1205: BEST PLAYERS | W1205: MORDIALLOC | X1205: 10 | Y1205: 7 | Z1205: 0 | AA1205: 1521 | AB1205: 1273 | AC1205: 119.48 | AD1205: 40
A1206: COBURG | C1206: SHORT | F1206: JORDAN | I1206: GOULLET | L1206: MAHONEY | O1206: BIGELOW | R1206: O'SULLIVAN | W1206: PORT MELBOURNE | X1206: 9 | Y1206: 7 | Z1206: 1 | AA1206: 1570 | AB1206: 1334 | AC1206: 117.6911544227886 | AD1206: 38
A1207: SANDRINGHAM | C1207: JONES | F1207: BOLAND | I1207: ALSOPP | L1207: WILLIAMS | O1207: RICHARDS | R1207: O'BIERNE | W1207: BOX HILL | X1207: 8 | Y1207: 9 | Z1207: 0 | AA1207: 1421 | AB1207: 1336 | AC1207: 106.3622754491018 | AD1207: 32
A1208: GOALKICKERS | W1208: BRUNSWICK | X1208: 7 | Y1208: 9 | Z1208: 1 | AA1208: 1477 | AB1208: 1454 | AC1208: 101.5818431911967 | AD1208: 30
A1209: COBURG | C1209: JORDAN 4 | F1209: NEESON 2 | I1209: O'SULLIVAN | L1209: SHAW | W1209: DANDENONG | X1209: 6 | Y1209: 11 | Z1209: 0 | AA1209: 1359 | AB1209: 1584 | AC1209: 85.8 | AD1209: 24
A1210: SANDRINGHAM | C1210: GLEESON 2 | F1210: ALSOPP | H1210: WILLIAMS | J1210: RICHARDS | M1210: O'BIERNE | W1210: PRESTON | X1210: 5 | Y1210: 12 | Z1210: 0 | AA1210: 1192 | AB1210: 1771 | AC1210: 67.31 | AD1210: 20
W1211: SUNSHINE | X1211: 5 | Y1211: 12 | Z1211: 0 | AA1211: 1093 | AB1211: 1748 | AC1211: 62.53 | AD1211: 20
A1212: OAKLEIGH | C1212: 1 | D1212: 1 | E1212: =C1212*6+D1212 -> 7 | G1212: 6 | H1212: 5 | I1212: =G1212*6+H1212 -> 41 | K1212: 9 | L1212: 9 | M1212: =K1212*6+L1212 -> 63 | O1212: 14 | P1212: 10 | Q1212: =O1212*6+P1212 -> 94 | S1212: YARRAVILLE | W1212: NORTHCOTE | X1212: 2 | Y1212: 15 | Z1212: 0 | AA1212: 1240 | AB1212: 1886 | AC1212: 65.75 | AD1212: 8
A1213: YARRAVILLE | C1213: 4 | D1213: 3 | E1213: =C1213*6+D1213 -> 27 | G1213: 6 | H1213: 4 | I1213: =G1213*6+H1213 -> 40 | K1213: 8 | L1213: 7 | M1213: =K1213*6+L1213 -> 55 | O1213: 10 | P1213: 7 | Q1213: =O1213*6+P1213 -> 67 | S1213: ALLEN | W1213: BRIGHTON | X1213: 2 | Y1213: 15 | Z1213: 0 | AA1213: 1163 | AB1213: 1857 | AC1213: 62.627894453419493 | AD1213: 8
A1214: BEST PLAYERS | W1214: CAMBERWELL | X1214: 1 | Y1214: 16 | Z1214: 0 | AA1214: 840 | AB1214: 2252 | AC1214: 37.3 | AD1214: 4
A1215: OAKLEIGH | C1215: COUGHLAN | F1215: J WILLIAMS | I1215: McCOOKE | L1215: COLLINS | O1215: DONOHUE | R1215: JONES
A1216: YARRAVILLE | C1216: ANDERSON | F1216: ORANGE | I1216: DRINAN | L1216: RON BROWN | O1216: CAREY | R1216: BOURKE
A1217: GOALKICKERS
A1218: OAKLEIGH | C1218: COUGHLAN 6 | F1218: JONES 2 | I1218: J WILLIAMS 2 | L1218: COLLINS 2 | N1218: McCOOKE | Q1218: PALMER
A1219: YARRAVILLE | C1219: RON BROWN 4 | F1219: BOURKE 2 | I1219: COLLINS | K1219: WEBB | M1219: ANDERSON | P1219: VANDERFEEN
A1221: PORT MELBOURNE | C1221: 2 | D1221: 0 | E1221: =C1221*6+D1221 -> 12 | G1221: 4 | H1221: 5 | I1221: =G1221*6+H1221 -> 29 | K1221: 10 | L1221: 7 | M1221: =K1221*6+L1221 -> 67 | O1221: 13 | P1221: 15 | Q1221: =O1221*6+P1221 -> 93 | S1221: PORT MELBOURNE
A1222: BOX HILL | C1222: 0 | D1222: 3 | E1222: =C1222*6+D1222 -> 3 | G1222: 3 | H1222: 5 | I1222: =G1222*6+H1222 -> 23 | K1222: 7 | L1222: 7 | M1222: =K1222*6+L1222 -> 49 | O1222: 9 | P1222: 8 | Q1222: =O1222*6+P1222 -> 62 | S1222: BREWER
A1223: BEST PLAYERS
A1224: PORT MELBOURNE | C1224: MONKS | F1224: CLAXTON | I1224: WITHERS | L1224: ATKINSON | O1224: EVANS | Q1224: BONNETT
A1225: BOX HILL | C1225: MILNE | F1225: SALVADO | I1225: PLUNKETT | L1225: BROWN | O1225: WHITE | Q1225: CRAIG
A1226: GOALKICKERS
A1227: PORT MELBOURNE | C1227: BONNETT 5 | F1227: MONKS 4 | I1227: EVANS 2 | L1227: CLAXTON 2
A1228: BOX HILL | C1228: SALVADO 5 | F1228: PLUNKETT 2 | I1228: LANE | K1228: BROWN
A1230: BRUNSWICK | C1230: 2 | D1230: 3 | E1230: =C1230*6+D1230 -> 15 | G1230: 4 | H1230: 9 | I1230: =G1230*6+H1230 -> 33 | K1230: 10 | L1230: 11 | M1230: =K1230*6+L1230 -> 71 | O1230: 13 | P1230: 13 | Q1230: =O1230*6+P1230 -> 91 | S1230: NORTHCOTE
A1231: DANDENONG | C1231: 0 | D1231: 4 | E1231: =C1231*6+D1231 -> 4 | G1231: 2 | H1231: 7 | I1231: =G1231*6+H1231 -> 19 | K1231: 7 | L1231: 7 | M1231: =K1231*6+L1231 -> 49 | O1231: 11 | P1231: 8 | Q1231: =O1231*6+P1231 -> 74 | S1231: POLLARD
A1232: BEST PLAYERS
A1233: BRUNSWICK | C1233: K DILLON | F1233: McKENNA | I1233: ROSSIN | L1233: JARMAN | O1233: STANLEY | R1233: WHILEY
A1234: DANDENONG | C1234: HOWER | F1234: TODD | I1234: WATERS | L1234: JOHNSON | O1234: PETERS | R1234: GUILLE
A1235: GOALKICKERS
A1236: BRUNSWICK | C1236: K DILLON 4 | F1236: JARMAN 2 | I1236: McFARLANE 2 | L1236: WHILEY 2 | N1236: WATT | P1236: VELO | R1236: STANLEY
A1237: DANDENONG | C1237: TODD 3 | F1237: GILLINGHAM 2 | J1237: WATERS 2 | M1237: BASSETT 2 | P1237: LITTLE | R1237: RANKIN
A1239: BRIGHTON | C1239: 5 | D1239: 7 | E1239: =C1239*6+D1239 -> 37 | G1239: 7 | H1239: 7 | I1239: =G1239*6+H1239 -> 49 | K1239: 9 | L1239: 16 | M1239: =K1239*6+L1239 -> 70 | O1239: 12 | P1239: 17 | Q1239: =O1239*6+P1239 -> 89 | S1239: ELSTERNWICK PARK
A1240: NORTHCOTE | C1240: 0 | D1240: 1 | E1240: =C1240*6+D1240 -> 1 | G1240: 9 | H1240: 4 | I1240: =G1240*6+H1240 -> 58 | K1240: 10 | L1240: 7 | M1240: =K1240*6+L1240 -> 67 | O1240: 10 | P1240: 11 | Q1240: =O1240*6+P1240 -> 71 | S1240: ROBINSON
A1241: BEST PLAYERS
A1242: BRIGHTON | C1242: BURSEY | F1242: P COOPER | I1242: CURRIE | L1242: N COOPER | O1242: McCANN | R1242: ATKINSON
A1243: NORTHCOTE | C1243: BRETHERTON | F1243: VAINS | I1243: WRIGHT | L1243: CRIPPS | O1243: ATKINSON | R1243: FLANAGAN
A1244: GOALKICKERS
A1245: BRIGHTON | C1245: P COOPER 4 | F1245: N COOPER 3 | I1245: BURSEY 2 | L1245: ASLING 2 | O1245: McDONALD
A1246: NORTHCOTE | C1246: BRETHERTON 3 | F1246: GIBBS 2 | I1246: ADAMSON | L1246: CONYBEAR | O1246: SHAW | Q1246: CRIPPS | S1246: VAINS
A1248: SUNSHINE | C1248: 3 | D1248: 0 | E1248: =C1248*6+D1248 -> 18 | G1248: 5 | H1248: 4 | I1248: =G1248*6+H1248 -> 34 | K1248: 7 | L1248: 5 | M1248: =K1248*6+L1248 -> 47 | O1248: 15 | P1248: 7 | Q1248: =O1248*6+P1248 -> 97 | S1248: CAMBERWELL
A1249: CAMBERWELL | C1249: 5 | D1249: 0 | E1249: =C1249*6+D1249 -> 30 | G1249: 5 | H1249: 1 | I1249: =G1249*6+H1249 -> 31 | K1249: 10 | L1249: 3 | M1249: =K1249*6+L1249 -> 63 | O1249: 12 | P1249: 7 | Q1249: =O1249*6+P1249 -> 79 | S1249: BAIRD
A1250: BEST PLAYERS
A1251: SUNSHINE | C1251: P FITZGERALD | F1251: SAUNDERS | I1251: KELLY | L1251: DIX | N1251: MORRIS | Q1251: WARREN
A1252: CAMBERWELL | C1252: WATTS | F1252: K CHAMBERS | I1252: SKALBERG | L1252: COMMONS | N1252: FREYBERG | Q1252: SEYMOUR
A1253: GOALKICKERS
A1254: SUNSHINE | C1254: KELLY 6 | F1254: WARREN 2 | I1254: LITCHFIELD 2 | L1254: MORRIS 2 | N1254: JEPSON | P1254: SEYMOUR | R1254: DIXON
A1255: CAMBERWELL | C1255: FREYBERG 5 | F1255: SEYMOUR 3 | I1255: B JOHNSON 2 | L1255: COMMONS | N1255: EADES
A1257: MORDIALLOC | C1257: 1 | D1257: 1 | E1257: =C1257*6+D1257 -> 7 | G1257: 10 | H1257: 6 | I1257: =G1257*6+H1257 -> 66 | K1257: 10 | L1257: 8 | M1257: =K1257*6+L1257 -> 68 | O1257: 14 | P1257: 11 | Q1257: =O1257*6+P1257 -> 95 | S1257: MORDIALLOC
A1258: PRESTON | C1258: 4 | D1258: 5 | E1258: =C1258*6+D1258 -> 29 | G1258: 7 | H1258: 6 | I1258: =G1258*6+H1258 -> 48 | K1258: 10 | L1258: 13 | M1258: =K1258*6+L1258 -> 73 | O1258: 13 | P1258: 16 | Q1258: =O1258*6+P1258 -> 94 | S1258: ROACH
A1259: BEST PLAYERS
A1260: MORDIALLOC | C1260: PEARSON | F1260: JOSE | I1260: BESANKO | L1260: COSTELLO | O1260: ROBERTS | R1260: BAKER
A1261: PRESTON | C1261: DAWSON | F1261: BERGIN | I1261: DANGUAARD | L1261: WALSH | O1261: HOWARD | R1261: McKENZIE
A1262: GOALKICKERS
A1263: MORDIALLOC | C1263: BAKER 4 | F1263: PEARSON 4 | I1263: ROBERTS 3 | L1263: COSTELLO | O1263: KERR | Q1263: O'NEILL
A1264: PRESTON | C1264: McKENZIE 4 | F1264: BERGIN 3 | I1264: WALSH 2 | K1264: RYMER | M1264: PITCHER | O1264: DAWSON | Q1264: NELSON
A1266: ROUND 18 | E1266: 22ND AUGUST | J1266: WEATHER | M1266: SOUTH EAST BREEZE FINE & SUNNY | S1266: PLAYED AT
D1267: 1ST QTR | H1267: 2ND QTR | L1267: 3RD QTR | P1267: FINAL | S1267: BEACH ROAD
A1268: SANDRINGHAM | C1268: 2 | D1268: 5 | E1268: =C1268*6+D1268 -> 17 | G1268: 5 | H1268: 5 | I1268: =G1268*6+H1268 -> 35 | K1268: 12 | L1268: 9 | M1268: =K1268*6+L1268 -> 81 | O1268: 16 | P1268: 9 | Q1268: =O1268*6+P1268 -> 105 | S1268: UMPIRE | X1268: LADDER | AB1268: ROUND | AD1268: 18
A1269: PORT MELBOURNE | C1269: 6 | D1269: 2 | E1269: =C1269*6+D1269 -> 38 | G1269: 10 | H1269: 6 | I1269: =G1269*6+H1269 -> 66 | K1269: 11 | L1269: 6 | M1269: =K1269*6+L1269 -> 72 | O1269: 15 | P1269: 8 | Q1269: =O1269*6+P1269 -> 98 | S1269: O'DONOGHUE
A1270: BEST PLAYERS | W1270: TEAM | X1270: W | Y1270: L | Z1270: D | AA1270: FOR | AB1270: AGST | AC1270: % | AD1270: PTS
A1271: SANDRINGHAM | C1271: WILLIAMS | F1271: RANSOM | I1271: SHRIVES | L1271: CROFT | N1271: GLEESON | Q1271: RICHARDS
A1272: PORT MELBOURNE | C1272: CLAXTON | F1272: WITHERS | I1272: BONNETT | L1272: WEBSTER | N1272: LEWIS | Q1272: MONKS | W1272: WILLIAMSTOWN | X1272: 16 | Y1272: 2 | Z1272: 0 | AA1272: 1992 | AB1272: 1166 | AC1272: 170.84 | AD1272: 64
A1273: GOALKICKERS | W1273: COBURG | X1273: 15 | Y1273: 3 | Z1273: 0 | AA1273: 1821 | AB1273: 1263 | AC1273: 144.18052256532067 | AD1273: 60
A1274: SANDRINGHAM | C1274: OAKLEY 8 | F1274: GLEESON 2 | I1274: WEBSTER 2 | L1274: WILLIAMS | O1274: CROFT | Q1274: SHRIVES | S1274: PATMORE | W1274: OAKLEIGH | X1274: 14 | Y1274: 4 | Z1274: 0 | AA1274: 1829 | AB1274: 1241 | AC1274: 147.38 | AD1274: 56
A1275: PORT MELBOURNE | C1275: BONNETT 6 | F1275: CLAXTON 2 | I1275: WITHERS 2 | L1275: MONKS 2 | N1275: HAMBRIDGE | Q1275: WEBSTER | S1275: QUAIFE | W1275: SANDRINGHAM | X1275: 14 | Y1275: 4 | Z1275: 0 | AA1275: 1795 | AB1275: 1223 | AC1275: 146.77023712183157 | AD1275: 56
A1277: YARRAVILLE | C1277: 4 | D1277: 3 | E1277: =C1277*6+D1277 -> 27 | G1277: 9 | H1277: 5 | I1277: =G1277*6+H1277 -> 59 | K1277: 11 | L1277: 7 | M1277: =K1277*6+L1277 -> 73 | O1277: 12 | P1277: 10 | Q1277: =O1277*6+P1277 -> 82 | S1277: BOX HILL | W1277: MOORABBIN | X1277: 13 | Y1277: 5 | Z1277: 0 | AA1277: 1837 | AB1277: 1154 | AC1277: 159.19 | AD1277: 52
A1278: BOX HILL | C1278: 0 | D1278: 0 | E1278: =C1278*6+D1278 -> 0 | G1278: 1 | H1278: 3 | I1278: =G1278*6+H1278 -> 9 | K1278: 1 | L1278: 7 | M1278: =K1278*6+L1278 -> 13 | O1278: 4 | P1278: 13 | Q1278: =O1278*6+P1278 -> 37 | S1278: ROACH | W1278: YARRAVILLE | X1278: 13 | Y1278: 5 | Z1278: 0 | AA1278: 1777 | AB1278: 1171 | AC1278: 151.75 | AD1278: 52
A1279: BEST PLAYERS | W1279: MORDIALLOC | X1279: 11 | Y1279: 7 | Z1279: 0 | AA1279: 1656 | AB1279: 1379 | AC1279: 120.09 | AD1279: 44
A1280: YARRAVILLE | C1280: McTAGGART | F1280: CAREY | I1280: WILLIAMS | L1280: ANDERSON | O1280: WEBB | Q1280: MASON | W1280: PORT MELBOURNE | X1280: 9 | Y1280: 8 | Z1280: 1 | AA1280: 1668 | AB1280: 1439 | AC1280: 115.91382904794996 | AD1280: 38
A1281: BOX HILL | C1281: WRIGHT | F1281: MILNE | I1281: CARRICK | L1281: TAYLOR | O1281: BATES | Q1281: WHITE | W1281: BOX HILL | X1281: 8 | Y1281: 10 | Z1281: 0 | AA1281: 1458 | AB1281: 1418 | AC1281: 102.82087447108604 | AD1281: 32
A1282: GOALKICKERS | W1282: BRUNSWICK | X1282: 7 | Y1282: 10 | Z1282: 1 | AA1282: 1549 | AB1282: 1539 | AC1282: 100.65 | AD1282: 30
A1283: YARRAVILLE | C1283: ANDERSON 7 | F1283: CAREY 2 | I1283: BOURKE | K1283: BURT | M1283: LETCHER | W1283: DANDENONG | X1283: 6 | Y1283: 12 | Z1283: 0 | AA1283: 1452 | AB1283: 1702 | AC1283: 85.31 | AD1283: 24
A1284: BOX HILL | C1284: SAWATSKY | F1284: WHITE | H1284: LANE | J1284: SALVADO | W1284: PRESTON | X1284: 6 | Y1284: 12 | Z1284: 0 | AA1284: 1278 | AB1284: 1834 | AC1284: 69.68 | AD1284: 24
W1285: SUNSHINE | X1285: 6 | Y1285: 12 | Z1285: 0 | AA1285: 1223 | AB1285: 1831 | AC1285: 66.79 | AD1285: 24
A1286: OAKLEIGH | C1286: 1 | D1286: 3 | E1286: =C1286*6+D1286 -> 9 | G1286: 3 | H1286: 10 | I1286: =G1286*6+H1286 -> 28 | K1286: 9 | L1286: 15 | M1286: =K1286*6+L1286 -> 69 | O1286: 11 | P1286: 19 | Q1286: =O1286*6+P1286 -> 85 | S1286: OAKLEIGH | W1286: NORTHCOTE | X1286: 2 | Y1286: 16 | Z1286: 0 | AA1286: 1346 | AB1286: 2021 | AC1286: 66.6 | AD1286: 8
A1287: BRUNSWICK | C1287: 3 | D1287: 0 | E1287: =C1287*6+D1287 -> 18 | G1287: 7 | H1287: 1 | I1287: =G1287*6+H1287 -> 43 | K1287: 8 | L1287: 2 | M1287: =K1287*6+L1287 -> 50 | O1287: 11 | P1287: 6 | Q1287: =O1287*6+P1287 -> 72 | S1287: ROBINSON | W1287: BRIGHTON | X1287: 2 | Y1287: 16 | Z1287: 0 | AA1287: 1246 | AB1287: 1987 | AC1287: 62.707599396074485 | AD1287: 8
A1288: BEST PLAYERS | W1288: CAMBERWELL | X1288: 1 | Y1288: 17 | Z1288: 0 | AA1288: 891 | AB1288: 2450 | AC1288: 36.37 | AD1288: 4
A1289: OAKLEIGH | C1289: COLLINS | F1289: D'ARCY | I1289: PEAKE | L1289: McCOOKE | N1289: DONOHUE | Q1289: JONES
A1290: BRUNSWICK | C1290: R THOMPSON | F1290: WATT | I1290: McKENNA | L1290: WHILEY | N1290: K DILLON | Q1290: ROSSIN
A1291: GOALKICKERS
A1292: OAKLEIGH | C1292: JONES 4 | F1292: GAY 2 | H1292: ASH 2 | J1292: WILLIAMS | M1292: NAISMITH | O1292: McCOOKE
A1293: BRUNSWICK | C1293: THORNTON 4 | F1293: STANLEY 4 | I1293: K DILLON | K1293: WHILEY | M1293: McFARLANE
A1295: PRESTON | C1295: 0 | D1295: 4 | E1295: =C1295*6+D1295 -> 4 | G1295: 4 | H1295: 7 | I1295: =G1295*6+H1295 -> 31 | K1295: 9 | L1295: 8 | M1295: =K1295*6+L1295 -> 62 | O1295: 12 | P1295: 14 | Q1295: =O1295*6+P1295 -> 86 | S1295: PRESTON
A1296: MOORABBIN | C1296: 2 | D1296: 2 | E1296: =C1296*6+D1296 -> 14 | G1296: 5 | H1296: 5 | I1296: =G1296*6+H1296 -> 35 | K1296: 9 | L1296: 8 | M1296: =K1296*6+L1296 -> 62 | O1296: 9 | P1296: 9 | Q1296: =O1296*6+P1296 -> 63 | S1296: BAIRD
A1297: BEST PLAYERS
A1298: PRESTON | C1298: JENSEN | F1298: McKENZIE | I1298: HAUGHTON | L1298: WOOD | N1298: WILSON | Q1298: WALKER
A1299: MOORABBIN | C1299: TREZISE | F1299: BILLSON | I1299: McGAW | L1299: HIRST | N1299: WHALEBONE | Q1299: GREEN
A1300: GOALKICKERS
A1301: PRESTON | C1301: BERGIN 3 | F1301: WALSH 2 | I1301: McKENZIE 2 | L1301: WILSON 2 | O1301: HOWARD | Q1301: NELSON | S1301: McMAHON
A1302: MOORABBIN | C1302: CRAMERI 5 | F1302: TREZISE | I1302: HOGAN | K1302: WHALEBONE | N1302: BILLSON
A1304: SUNSHINE | C1304: 3 | D1304: 1 | E1304: =C1304*6+D1304 -> 19 | G1304: 7 | H1304: 3 | I1304: =G1304*6+H1304 -> 45 | K1304: 14 | L1304: 6 | M1304: =K1304*6+L1304 -> 90 | O1304: 20 | P1304: 10 | Q1304: =O1304*6+P1304 -> 130 | S1304: SUNSHINE
A1305: BRIGHTON | C1305: 3 | D1305: 1 | E1305: =C1305*6+D1305 -> 19 | G1305: 3 | H1305: 8 | I1305: =G1305*6+H1305 -> 26 | K1305: 8 | L1305: 9 | M1305: =K1305*6+L1305 -> 57 | O1305: 12 | P1305: 11 | Q1305: =O1305*6+P1305 -> 83 | S1305: POLLARD
A1306: BEST PLAYERS
A1307: SUNSHINE | C1307: KEMP | F1307: WARREN | I1307: CROSBIE | L1307: DIXON | O1307: TREZISE | R1307: KELLY
A1308: BRIGHTON | C1308: McCANN | F1308: BURSEY | I1308: ASLING | L1308: CRAIG | O1308: CURRIE | R1308: W COOPER
A1309: GOALKICKERS
A1310: SUNSHINE | C1310: KELLY 6 | E1310: WARREN 4 | H1310: SIMPSON 3 | J1310: MILNE 2 | L1310: MORRIS 2 | N1310: TREZISE | P1310: DIXON | R1310: LITCHFIELD
A1311: BRIGHTON | C1311: BROWNING 2 | F1311: McCANN 2 | I1311: BURSEY 2 | K1311: ASLING 2 | M1311: MAY | N1311: P COOPER | P1311: CURRIE | R1311: McDONALD
A1313: MORDIALLOC | C1313: 6 | D1313: 2 | E1313: =C1313*6+D1313 -> 38 | G1313: 13 | H1313: 3 | I1313: =G1313*6+H1313 -> 81 | K1313: 17 | L1313: 6 | M1313: =K1313*6+L1313 -> 108 | O1313: 21 | P1313: 9 | Q1313: =O1313*6+P1313 -> 135 | S1313: NORTHCOTE
A1314: NORTHCOTE | C1314: 2 | D1314: 4 | E1314: =C1314*6+D1314 -> 16 | G1314: 7 | H1314: 8 | I1314: =G1314*6+H1314 -> 50 | K1314: 11 | L1314: 10 | M1314: =K1314*6+L1314 -> 76 | O1314: 15 | P1314: 16 | Q1314: =O1314*6+P1314 -> 106 | S1314: ROWE
A1315: BEST PLAYERS
A1316: MORDIALLOC | C1316: MAUNDER | F1316: BAKER | I1316: ROBERTS | L1316: KERR | O1316: SHEEHAN | R1316: BESANKO
A1317: NORTHCOTE | C1317: SHAW | F1317: WRIGHT | I1317: GIBBS | L1317: BRETHERTON | O1317: MARCHANT | R1317: CRIPPS
A1318: GOALKICKERS
A1319: MORDIALLOC | C1319: BAKER 8 | E1319: CRAWFORD 2 | H1319: PEARSON 2 | K1319: ROBERTS 2 | N1319: KERR 2 | P1319: MAUNDER 2 | S1319: O'NEILL | U1319: COSTELLO | X1319: BESANKO
A1320: NORTHCOTE | C1320: GIBBS 4 | E1320: WIGNELL 3 | H1320: SHAW 2 | J1320: VAINS | L1320: WRIGHT | N1320: BRETHERTON | Q1320: CONYBEAR | S1320: FLANAGAN | W1320: CRIPPS
A1322: COBURG | C1322: 6 | D1322: 0 | E1322: =C1322*6+D1322 -> 36 | G1322: 10 | H1322: 6 | I1322: =G1322*6+H1322 -> 66 | K1322: 13 | L1322: 8 | M1322: =K1322*6+L1322 -> 86 | O1322: 18 | P1322: 10 | Q1322: =O1322*6+P1322 -> 118 | S1322: DANDENONG
A1323: DANDENONG | C1323: 3 | D1323: 2 | E1323: =C1323*6+D1323 -> 20 | G1323: 6 | H1323: 5 | I1323: =G1323*6+H1323 -> 41 | K1323: 10 | L1323: 10 | M1323: =K1323*6+L1323 -> 70 | O1323: 13 | P1323: 15 | Q1323: =O1323*6+P1323 -> 93 | S1323: SMITH
A1324: BEST PLAYERS
A1325: COBURG | C1325: JORDAN | F1325: NEESON | I1325: O'BRIEN | L1325: CARR | O1325: SHORT | Q1325: SHAW
A1326: DANDENONG | C1326: PENNEFATHER | F1326: HOWER | I1326: PHIPPS | L1326: GILLINGHAM | O1326: LALOR | Q1326: LITTLE
A1327: GOALKICKERS
A1328: COBURG | C1328: CARR 5 | F1328: BYRON 4 | I1328: JORDAN 4 | L1328: SHAW 2 | N1328: O'SULLIVAN | Q1328: NEESON | S1328: O'BRIEN
A1329: DANDENONG | C1329: GILLINGHAM 4 | F1329: RANKIN 3 | I1329: LALOR 2 | L1329: GUILLE | N1329: HOWER | P1329: LITTLE | R1329: PETERS
A1331: WILLIAMSTOWN | C1331: 6 | D1331: 6 | E1331: =C1331*6+D1331 -> 42 | G1331: 13 | H1331: 12 | I1331: =G1331*6+H1331 -> 90 | K1331: 20 | L1331: 18 | M1331: =K1331*6+L1331 -> 138 | O1331: 29 | P1331: 24 | Q1331: =O1331*6+P1331 -> 198 | S1331: WILLIAMSTOWN
A1332: CAMBERWELL | C1332: 1 | D1332: 3 | E1332: =C1332*6+D1332 -> 9 | G1332: 3 | H1332: 6 | I1332: =G1332*6+H1332 -> 24 | K1332: 4 | L1332: 9 | M1332: =K1332*6+L1332 -> 33 | O1332: 7 | P1332: 9 | Q1332: =O1332*6+P1332 -> 51 | S1332: BREWER
A1333: BEST PLAYERS
A1334: WILLIAMSTOWN | C1334: PELLY | F1334: KENT | I1334: SMITH | L1334: CALLAHAN | O1334: MURPHY | Q1334: E BEITZEL
A1335: CAMBERWELL | C1335: K CHAMBERS | F1335: EADES | I1335: CHAPLIN | L1335: SKALBERG | O1335: ELLIS | Q1335: FREYBERG
A1336: GOALKICKERS
A1337: WILLIAMSTOWN | C1337: PELLY 7 | E1337: EVANS 6 | G1337: MURPHY 5 | I1337: MALONEY 3 | L1337: MAZOURIS 2 | O1337: D MATTHEWS | R1337: SMITH | T1337: D WARD | W1337: WHITTAKER | X1337: CALLAHAN | AA1337: RAMSAY
A1338: CAMBERWELL | C1338: FREYBERG 3 | F1338: EADES 2 | I1338: SKALBERG | L1338: COMMONS
A1340: ROUND 19 | E1340: 29TH AUGUST | J1340: WEATHER | M1340: NORTH WEST WIND SUNNY | S1340: PLAYED AT
D1341: 1ST QTR | H1341: 2ND QTR | L1341: 3RD QTR | P1341: FINAL | S1341: WILLIAMSTOWN
A1342: OAKLEIGH | C1342: 3 | D1342: 3 | E1342: =C1342*6+D1342 -> 21 | G1342: 6 | H1342: 4 | I1342: =G1342*6+H1342 -> 40 | K1342: 8 | L1342: 11 | M1342: =K1342*6+L1342 -> 59 | O1342: 14 | P1342: 12 | Q1342: =O1342*6+P1342 -> 96 | S1342: UMPIRE | X1342: LADDER | AB1342: ROUND | AD1342: 19
A1343: WILLIAMSTOWN | C1343: 1 | D1343: 5 | E1343: =C1343*6+D1343 -> 11 | G1343: 3 | H1343: 6 | I1343: =G1343*6+H1343 -> 24 | K1343: 6 | L1343: 7 | M1343: =K1343*6+L1343 -> 43 | O1343: 9 | P1343: 13 | Q1343: =O1343*6+P1343 -> 67 | S1343: POLLARD
A1344: BEST PLAYERS | W1344: TEAM | X1344: W | Y1344: L | Z1344: D | AA1344: FOR | AB1344: AGST | AC1344: % | AD1344: PTS
A1345: OAKLEIGH | C1345: JONES | F1345: LANE | I1345: ASH | K1345: WILLIAMS | N1345: BAPTIST | Q1345: PRENDERGAST
A1346: WILLIAMSTOWN | C1346: EVANS | F1346: COLQUHOUN | I1346: SMITH | K1346: E BEITZEL | N1346: KENT | Q1346: PELLY | W1346: WILLIAMSTOWN | X1346: 16 | Y1346: 3 | Z1346: 0 | AA1346: 2059 | AB1346: 1262 | AC1346: 163.15 | AD1346: 64
A1347: GOALKICKERS | W1347: COBURG | X1347: 16 | Y1347: 3 | Z1347: 0 | AA1347: 1927 | AB1347: 1324 | AC1347: 145.54380664652567 | AD1347: 64
A1348: OAKLEIGH | C1348: JONES 6 | F1348: VARNEY 4 | I1348: BAPTIST 3 | L1348: McGOWAN | W1348: SANDRINGHAM | X1348: 15 | Y1348: 4 | Z1348: 0 | AA1348: 1977 | AB1348: 1276 | AC1348: 154.93730407523512 | AD1348: 60
A1349: WILLIAMSTOWN | C1349: MAZOURIS 2 | F1349: EVANS 2 | I1349: CULLINAN | K1349: CALLAHAN | N1349: MURPHY | P1349: MATTHEWS | R1349: PELLY | W1349: OAKLEIGH | X1349: 15 | Y1349: 4 | Z1349: 0 | AA1349: 1925 | AB1349: 1308 | AC1349: 147.17 | AD1349: 60
A1351: PORT MELBOURNE | C1351: 5 | D1351: 0 | E1351: =C1351*6+D1351 -> 30 | G1351: 9 | H1351: 9 | I1351: =G1351*6+H1351 -> 63 | K1351: 11 | L1351: 9 | M1351: =K1351*6+L1351 -> 75 | O1351: 19 | P1351: 16 | Q1351: =O1351*6+P1351 -> 130 | S1351: MORDIALLOC | W1351: MOORABBIN | X1351: 14 | Y1351: 5 | Z1351: 0 | AA1351: 1967 | AB1351: 1203 | AC1351: 163.51 | AD1351: 56
A1352: MORDIALLOC | C1352: 6 | D1352: 8 | E1352: =C1352*6+D1352 -> 44 | G1352: 9 | H1352: 15 | I1352: =G1352*6+H1352 -> 69 | K1352: 13 | L1352: 20 | M1352: =K1352*6+L1352 -> 98 | O1352: 15 | P1352: 22 | Q1352: =O1352*6+P1352 -> 112 | S1352: ROBINSON | W1352: YARRAVILLE | X1352: 14 | Y1352: 5 | Z1352: 0 | AA1352: 1896 | AB1352: 1264 | AC1352: 150 | AD1352: 56
A1353: BEST PLAYERS | W1353: MORDIALLOC | X1353: 11 | Y1353: 8 | Z1353: 0 | AA1353: 1768 | AB1353: 1509 | AC1353: 117.16 | AD1353: 44
A1354: PORT MELBOURNE | C1354: BONNETT | F1354: QUAIFE | I1354: HAMBRIDGE | L1354: LEWIS | N1354: WITHERS | Q1354: WHITE | W1354: PORT MELBOURNE | X1354: 10 | Y1354: 8 | Z1354: 1 | AA1354: 1798 | AB1354: 1551 | AC1354: 115.92520954223082 | AD1354: 42
A1355: MORDIALLOC | C1355: COSTELLO | F1355: BAKER | I1355: WILKINSON | L1355: KERR | N1355: BESANKO | Q1355: DULLARD | W1355: BRUNSWICK | X1355: 8 | Y1355: 10 | Z1355: 1 | AA1355: 1643 | AB1355: 1611 | AC1355: 101.99 | AD1355: 34
A1356: GOALKICKERS | Q1356: MERRETT | S1356: WITHERS | W1356: BOX HILL | X1356: 8 | Y1356: 11 | Z1356: 0 | AA1356: 1519 | AB1356: 1524 | AC1356: 99.671916010498691 | AD1356: 32
A1357: PORT MELBOURNE | C1357: BONNETT 6 | F1357: O'TOOLE 3 | I1357: CLAXTON 2 | L1357: HAMBRIDGE 2 | O1357: MONKS 2 | Q1357: QUAIFE | S1357: WEBSTER | W1357: PRESTON | X1357: 7 | Y1357: 12 | Z1357: 0 | AA1357: 1383 | AB1357: 1889 | AC1357: 73.21 | AD1357: 28
A1358: MORDIALLOC | C1358: BAKER 4 | E1358: COSTELLO 3 | H1358: KERR 2 | J1358: O'NEILL 2 | M1358: ROBERTS | O1358: SHEEHAN | Q1358: BESANKO | S1358: CRANE | W1358: DANDENONG | X1358: 6 | Y1358: 13 | Z1358: 0 | AA1358: 1545 | AB1358: 1821 | AC1358: 84.84 | AD1358: 24
W1359: SUNSHINE | X1359: 6 | Y1359: 13 | Z1359: 0 | AA1359: 1272 | AB1359: 1961 | AC1359: 64.86 | AD1359: 24
A1360: COBURG | C1360: 5 | D1360: 2 | E1360: =C1360*6+D1360 -> 32 | G1360: 10 | H1360: 7 | I1360: =G1360*6+H1360 -> 67 | K1360: 11 | L1360: 7 | M1360: =K1360*6+L1360 -> 73 | O1360: 16 | P1360: 10 | Q1360: =O1360*6+P1360 -> 106 | S1360: COBURG | W1360: NORTHCOTE | X1360: 2 | Y1360: 17 | Z1360: 0 | AA1360: 1399 | AB1360: 2203 | AC1360: 63.5 | AD1360: 8
A1361: BOX HILL | C1361: 5 | D1361: 5 | E1361: =C1361*6+D1361 -> 35 | G1361: 6 | H1361: 7 | I1361: =G1361*6+H1361 -> 43 | K1361: 8 | L1361: 12 | M1361: =K1361*6+L1361 -> 60 | O1361: 8 | P1361: 13 | Q1361: =O1361*6+P1361 -> 61 | S1361: ALLEN | W1361: BRIGHTON | X1361: 2 | Y1361: 17 | Z1361: 0 | AA1361: 1301 | AB1361: 2092 | AC1361: 62.189292543021033 | AD1361: 8
A1362: BEST PLAYERS | W1362: CAMBERWELL | X1362: 1 | Y1362: 18 | Z1362: 0 | AA1362: 963 | AB1362: 2544 | AC1362: 37.85 | AD1362: 4
A1363: COBURG | C1363: JORDAN | F1363: CLARKSON | I1363: CARR | K1363: TANCREDI | N1363: BYRON | Q1363: SHAW
A1364: BOX HILL | C1364: ROMARI | F1364: SAWATSKY | I1364: BRAIN | K1364: BROWN | N1364: SALVADO | Q1364: WITNISH
A1365: GOALKICKERS
A1366: COBURG | C1366: BYRON 4 | F1366: O'SULLIVAN 3 | I1366: O'BRIEN 3 | K1366: CARR 2 | M1366: JORDAN 2 | P1366: SHAW 2
A1367: BOX HILL | C1367: SALVADO 2 | F1367: ROMARI 2 | I1367: PLUNKETT 2 | L1367: BRAIN | N1367: WITNISH
A1369: YARRAVILLE | C1369: 5 | D1369: 5 | E1369: =C1369*6+D1369 -> 35 | G1369: 6 | H1369: 10 | I1369: =G1369*6+H1369 -> 46 | K1369: 11 | L1369: 19 | M1369: =K1369*6+L1369 -> 85 | O1369: 16 | P1369: 23 | Q1369: =O1369*6+P1369 -> 119 | S1369: DANDENONG
A1370: DANDENONG | C1370: 3 | D1370: 4 | E1370: =C1370*6+D1370 -> 22 | G1370: 7 | H1370: 8 | I1370: =G1370*6+H1370 -> 50 | K1370: 9 | L1370: 10 | M1370: =K1370*6+L1370 -> 64 | O1370: 13 | P1370: 15 | Q1370: =O1370*6+P1370 -> 93 | S1370: O'DONOGHUE
A1371: BEST PLAYERS
A1372: YARRAVILLE | C1372: CAREY | F1372: WILLIAMS | I1372: McTAGGART | L1372: WEBB | N1372: RON BROWN | Q1372: DRINAN
A1373: DANDENONG | C1373: PENNEFATHER | F1373: GILLINGHAM | I1373: CROSBIE | L1373: WATERS | N1373: LALOR | Q1373: PURCELL
A1374: GOALKICKERS
A1375: YARRAVILLE | C1375: VANDERFEEN 4 | F1375: RON BROWN 3 | I1375: CAREY 3 | K1375: COLLINS 2 | N1375: DRINAN | P1375: BOURKE | R1375: LETCHER | U1375: BURT
A1376: DANDENONG | C1376: GILLINGHAM 5 | F1376: RANKIN 2 | I1376: BASSETT | K1376: PHIPPS | M1376: LALOR | O1376: JOHNSON | Q1376: CROSBIE | S1376: TODD
A1378: PRESTON | C1378: 3 | D1378: 0 | E1378: =C1378*6+D1378 -> 18 | G1378: 9 | H1378: 5 | I1378: =G1378*6+H1378 -> 59 | K1378: 10 | L1378: 6 | M1378: =K1378*6+L1378 -> 66 | O1378: 16 | P1378: 9 | Q1378: =O1378*6+P1378 -> 105 | S1378: PRESTON
A1379: BRIGHTON | C1379: 3 | D1379: 2 | E1379: =C1379*6+D1379 -> 20 | G1379: 4 | H1379: 2 | I1379: =G1379*6+H1379 -> 26 | K1379: 8 | L1379: 7 | M1379: =K1379*6+L1379 -> 55 | O1379: 8 | P1379: 7 | Q1379: =O1379*6+P1379 -> 55 | S1379: SMITH
A1380: BEST PLAYERS
A1381: PRESTON | C1381: McKENZIE | F1381: WOOD | I1381: PITCHER | K1381: RATCLIFFE | N1381: LAMBIE | Q1381: McMAHON
A1382: BRIGHTON | C1382: BURSEY | F1382: GRANT | I1382: FOLEY | K1382: ELDERING | N1382: ASLING | Q1382: McCANN
A1383: GOALKICKERS
A1384: PRESTON | C1384: McKENZIE 4 | F1384: RATCLIFFE 3 | I1384: PITCHER 3 | L1384: NELSON 2 | N1384: DAWSON 2 | Q1384: RYMER | S1384: WALSH
A1385: BRIGHTON | C1385: P COOPER 4 | F1385: CURRIE 2 | I1385: BURSEY | K1385: ELDERING
A1387: BRUNSWICK | C1387: 2 | D1387: 3 | E1387: =C1387*6+D1387 -> 15 | G1387: 6 | H1387: 11 | I1387: =G1387*6+H1387 -> 47 | K1387: 11 | L1387: 12 | M1387: =K1387*6+L1387 -> 78 | O1387: 13 | P1387: 16 | Q1387: =O1387*6+P1387 -> 94 | S1387: BRUNSWICK
A1388: CAMBERWELL | C1388: 4 | D1388: 6 | E1388: =C1388*6+D1388 -> 30 | G1388: 6 | H1388: 7 | I1388: =G1388*6+H1388 -> 43 | K1388: 10 | L1388: 8 | M1388: =K1388*6+L1388 -> 68 | O1388: 10 | P1388: 12 | Q1388: =O1388*6+P1388 -> 72 | S1388: ROACH
A1389: BEST PLAYERS
A1390: BRUNSWICK | C1390: R THOMPSON | F1390: LINKINS | I1390: STANLEY | L1390: HAYES | N1390: K DILLON | Q1390: THORNTON
A1391: CAMBERWELL | C1391: FREYBERG | F1391: MOULE | I1391: COMMONS | L1391: K JOHNSON | N1391: EADES | Q1391: SIMON
A1392: GOALKICKERS
A1393: BRUNSWICK | C1393: THORNTON 6 | F1393: K DILLON 3 | I1393: STANLEY | K1393: WATT | M1393: McKENNA | O1393: TEASDALE
A1394: CAMBERWELL | C1394: FREYBERG 6 | F1394: SEYMOUR | I1394: K JOHNSON | L1394: EADES | N1394: SIMON
A1396: MOORABBIN | C1396: 4 | D1396: 9 | E1396: =C1396*6+D1396 -> 33 | G1396: 8 | H1396: 10 | I1396: =G1396*6+H1396 -> 58 | K1396: 15 | L1396: 18 | M1396: =K1396*6+L1396 -> 108 | O1396: 18 | P1396: 22 | Q1396: =O1396*6+P1396 -> 130 | S1396: MOORABBIN
A1397: SUNSHINE | C1397: 0 | D1397: 1 | E1397: =C1397*6+D1397 -> 1 | G1397: 2 | H1397: 3 | I1397: =G1397*6+H1397 -> 15 | K1397: 4 | L1397: 3 | M1397: =K1397*6+L1397 -> 27 | O1397: 7 | P1397: 7 | Q1397: =O1397*6+P1397 -> 49 | S1397: ROWE
A1398: BEST PLAYERS
A1399: MOORABBIN | C1399: MORONEY | F1399: GILDER | I1399: BOYD | L1399: RENWICK | N1399: TREZISE | Q1399: HOY
A1400: SUNSHINE | C1400: K JEPSON | F1400: MILNE | I1400: P FITZGERALD | L1400: TREZISE | N1400: KEMP | Q1400: WARREN
A1401: GOALKICKERS
A1402: MOORABBIN | C1402: RENWICK 6 | F1402: MORONEY 4 | I1402: WHALEBONE 2 | L1402: BILLSON 2 | N1402: McGAW 2 | Q1402: CRAMERI | S1402: PAPLEY
A1403: SUNSHINE | C1403: TREZISE 2 | F1403: MUNRO 2 | I1403: SIMPSON | K1403: KELLY | M1403: DIXON
A1405: SANDRINGHAM | C1405: 3 | D1405: 2 | E1405: =C1405*6+D1405 -> 20 | G1405: 12 | H1405: 8 | I1405: =G1405*6+H1405 -> 80 | K1405: 19 | L1405: 12 | M1405: =K1405*6+L1405 -> 126 | O1405: 27 | P1405: 20 | Q1405: =O1405*6+P1405 -> 182 | S1405: BEACH ROAD
A1406: NORTHCOTE | C1406: 2 | D1406: 3 | E1406: =C1406*6+D1406 -> 15 | G1406: 4 | H1406: 3 | I1406: =G1406*6+H1406 -> 27 | K1406: 7 | L1406: 6 | M1406: =K1406*6+L1406 -> 48 | O1406: 7 | P1406: 11 | Q1406: =O1406*6+P1406 -> 53 | S1406: TREWIN
A1407: BEST PLAYERS
A1408: SANDRINGHAM | C1408: OAKLEY | F1408: WEBSTER | I1408: GLEESON | K1408: PATMORE | N1408: RANSOM | Q1408: ALSOPP
A1409: NORTHCOTE | C1409: WRIGHT | F1409: BRETHERTON | I1409: VAINS | K1409: GIBBS | N1409: WIGNELL | Q1409: SCOTT
A1410: GOALKICKERS
A1411: SANDRINGHAM | C1411: OAKLEY 16 | F1411: ALSOP 4 | I1411: WEBSTER 3 | L1411: STEELE | N1411: GLEESON | P1411: BARRAN | R1411: THOMPSON
A1412: NORTHCOTE | C1412: WIGNELL 2 | F1412: BRETHERTON 2 | J1412: SCOTT 2 | M1412: CRIPPS
A1414: ROUND 20 | E1414: 5TH SEPTEMBER | J1414: WEATHER | M1414: NORTH WIND FINE & SUNNY | S1414: PLAYED AT
D1415: 1ST QTR | H1415: 2ND QTR | L1415: 3RD QTR | P1415: FINAL | S1415: OAKLEIGH
A1416: OAKLEIGH | C1416: 2 | D1416: 8 | E1416: =C1416*6+D1416 -> 20 | G1416: 7 | H1416: 11 | I1416: =G1416*6+H1416 -> 53 | K1416: 10 | L1416: 14 | M1416: =K1416*6+L1416 -> 74 | O1416: 13 | P1416: 18 | Q1416: =O1416*6+P1416 -> 96 | S1416: UMPIRE | X1416: LADDER | AB1416: ROUND | AD1416: 20
A1417: COBURG | C1417: 1 | D1417: 2 | E1417: =C1417*6+D1417 -> 8 | G1417: 3 | H1417: 7 | I1417: =G1417*6+H1417 -> 25 | K1417: 4 | L1417: 11 | M1417: =K1417*6+L1417 -> 35 | O1417: 7 | P1417: 14 | Q1417: =O1417*6+P1417 -> 56 | S1417: O'DONOGHUE
A1418: BEST PLAYERS | W1418: TEAM | X1418: W | Y1418: L | Z1418: D | AA1418: FOR | AB1418: AGST | AC1418: % | AD1418: PTS
A1419: OAKLEIGH | C1419: KITTO | F1419: DONOHUE | I1419: ASH | L1419: COLLINS | N1419: COUGHLAN | Q1419: McCOOKE
A1420: COBURG | C1420: CARR | F1420: SHAW | I1420: TANCREDI | L1420: WILSON | N1420: HOOGEN | Q1420: O'SULLIVAN | W1420: WILLIAMSTOWN | X1420: 17 | Y1420: 3 | Z1420: 0 | AA1420: 2157 | AB1420: 1339 | AC1420: 161.09 | AD1420: 68
A1421: GOALKICKERS | W1421: SANDRINGHAM | X1421: 16 | Y1421: 4 | Z1421: 0 | AA1421: 2064 | AB1421: 1340 | AC1421: 154.02985074626866 | AD1421: 64
A1422: OAKLEIGH | C1422: JONES 2 | E1422: COLLINS 2 | G1422: ASH 2 | I1422: PALMER 2 | K1422: NAISMITH 2 | N1422: BAPTIST | P1422: COUGHLAN | R1422: D'ARCY | W1422: OAKLEIGH | X1422: 16 | Y1422: 4 | Z1422: 0 | AA1422: 2021 | AB1422: 1367 | AC1422: 147.84198975859547 | AD1422: 64
A1423: COBURG | C1423: GOULLET 3 | F1423: O'SULLIVAN 2 | I1423: CARR | K1423: BYRON | W1423: COBURG | X1423: 16 | Y1423: 4 | Z1423: 0 | AA1423: 1983 | AB1423: 1420 | AC1423: 139.64788732394365 | AD1423: 64
A1425: SANDRINGHAM | C1425: 0 | D1425: 0 | E1425: =C1425*6+D1425 -> 0 | G1425: 3 | H1425: 3 | I1425: =G1425*6+H1425 -> 21 | K1425: 7 | L1425: 5 | M1425: =K1425*6+L1425 -> 47 | O1425: 12 | P1425: 15 | Q1425: =O1425*6+P1425 -> 87 | S1425: YARRAVILLE | W1425: MOORABBIN | X1425: 15 | Y1425: 5 | Z1425: 0 | AA1425: 2060 | AB1425: 1266 | AC1425: 162.72 | AD1425: 60
A1426: YARRAVILLE | C1426: 5 | D1426: 2 | E1426: =C1426*6+D1426 -> 32 | G1426: 7 | H1426: 3 | I1426: =G1426*6+H1426 -> 45 | K1426: 10 | L1426: 3 | M1426: =K1426*6+L1426 -> 63 | O1426: 10 | P1426: 4 | Q1426: =O1426*6+P1426 -> 64 | S1426: ROBINSON | W1426: YARRAVILLE | X1426: 14 | Y1426: 6 | Z1426: 0 | AA1426: 1960 | AB1426: 1351 | AC1426: 145.08 | AD1426: 56
A1427: BEST PLAYERS | W1427: MORDIALLOC | X1427: 12 | Y1427: 8 | Z1427: 0 | AA1427: 1878 | AB1427: 1566 | AC1427: 119.92 | AD1427: 48
A1428: SANDRINGHAM | C1428: WEBSTER | F1428: JONES | I1428: SHEERAN | L1428: BOLAND | N1428: RANSOM | Q1428: CROFT | W1428: PORT MELBOURNE | X1428: 10 | Y1428: 9 | Z1428: 1 | AA1428: 1861 | AB1428: 1644 | AC1428: 113.19951338199513 | AD1428: 42
A1429: YARRAVILLE | C1429: CROOK | F1429: MASON | I1429: LETCHER | L1429: ORANGE | N1429: CAREY | Q1429: McTAGGART | W1429: BRUNSWICK | X1429: 9 | Y1429: 10 | Z1429: 1 | AA1429: 1746 | AB1429: 1675 | AC1429: 104.24 | AD1429: 38
A1430: GOALKICKERS | W1430: BOX HILL | X1430: 8 | Y1430: 12 | Z1430: 0 | AA1430: 1596 | AB1430: 1623 | AC1430: 98.336414048059154 | AD1430: 32
A1431: SANDRINGHAM | C1431: OAKLEY 3 | F1431: WEBSTER 3 | I1431: SHRIVES 2 | L1431: ALSOPP 2 | N1431: RICHARDS | Q1431: STEELE | W1431: PRESTON | X1431: 8 | Y1431: 12 | Z1431: 0 | AA1431: 1502 | AB1431: 1967 | AC1431: 76.36 | AD1431: 32
A1432: YARRAVILLE | C1432: CROOK 4 | F1432: LAMONT | H1432: RON BROWN | K1432: HOOD | M1432: CAREY | O1432: BOURKE | Q1432: VANDERFEEN | W1432: DANDENONG | X1432: 6 | Y1432: 14 | Z1432: 0 | AA1432: 1618 | AB1432: 1921 | AC1432: 84.23 | AD1432: 24
W1433: SUNSHINE | X1433: 6 | Y1433: 14 | Z1433: 0 | AA1433: 1329 | AB1433: 2071 | AC1433: 64.17 | AD1433: 24
A1434: MOORABBIN | C1434: 4 | D1434: 1 | E1434: =C1434*6+D1434 -> 25 | G1434: 10 | H1434: 3 | I1434: =G1434*6+H1434 -> 63 | K1434: 11 | L1434: 6 | M1434: =K1434*6+L1434 -> 72 | O1434: 14 | P1434: 9 | Q1434: =O1434*6+P1434 -> 93 | S1434: PORT MELBOURNE | W1434: NORTHCOTE | X1434: 3 | Y1434: 17 | Z1434: 0 | AA1434: 1499 | AB1434: 2276 | AC1434: 65.86 | AD1434: 12
A1435: PORT MELBOURNE | C1435: 3 | D1435: 4 | E1435: =C1435*6+D1435 -> 22 | G1435: 6 | H1435: 5 | I1435: =G1435*6+H1435 -> 41 | K1435: 8 | L1435: 6 | M1435: =K1435*6+L1435 -> 54 | O1435: 9 | P1435: 9 | Q1435: =O1435*6+P1435 -> 63 | S1435: ALLEN | W1435: BRIGHTON | X1435: 2 | Y1435: 18 | Z1435: 0 | AA1435: 1365 | AB1435: 2195 | AC1435: 62.17 | AD1435: 8
A1436: BEST PLAYERS | W1436: CAMBERWELL | X1436: 1 | Y1436: 19 | Z1436: 0 | AA1436: 1041 | AB1436: 2663 | AC1436: 39.09 | AD1436: 4
A1437: MOORABBIN | C1437: RYAN | F1437: MORONEY | I1437: BOYD | K1437: RENWICK | N1437: TREZISE | Q1437: GREEN
A1438: PORT MELBOURNE | C1438: CLAXTON | F1438: MERRETT | I1438: MONKS | K1438: LAWSON | N1438: McRAE | Q1438: WITHERS
A1439: GOALKICKERS
A1440: MOORABBIN | C1440: RENWICK 6 | F1440: WHALEBONE 2 | J1440: MORONEY | M1440: PAPLEY | O1440: CRAMERI | Q1440: BILLSON | S1440: McGAW | U1440: RYAN
A1441: PORT MELBOURNE | C1441: BONNETT 3 | F1441: MERRETT 2 | I1441: O'TOOLE | K1441: MONKS | M1441: PENALUNA | O1441: WITHERS
A1443: WILLIAMSTOWN | C1443: 3 | D1443: 3 | E1443: =C1443*6+D1443 -> 21 | G1443: 10 | H1443: 10 | I1443: =G1443*6+H1443 -> 70 | K1443: 11 | L1443: 13 | M1443: =K1443*6+L1443 -> 79 | O1443: 14 | P1443: 15 | Q1443: =O1443*6+P1443 -> 99 | S1443: BOX HILL
A1444: BOX HILL | C1444: 4 | D1444: 2 | E1444: =C1444*6+D1444 -> 26 | G1444: 4 | H1444: 4 | I1444: =G1444*6+H1444 -> 28 | K1444: 9 | L1444: 7 | M1444: =K1444*6+L1444 -> 61 | O1444: 11 | P1444: 11 | Q1444: =O1444*6+P1444 -> 77 | S1444: TREWIN
A1445: BEST PLAYERS
A1446: WILLIAMSTOWN | C1446: PELLY | F1446: EVANS | I1446: WARD | K1446: MALONEY | N1446: KENT | Q1446: SMITH
A1447: BOX HILL | C1447: WITNISH | F1447: ROMARI | I1447: BROWN | K1447: PLUNKETT | N1447: CRAIG | Q1447: TAYLOR
A1448: GOALKICKERS
A1449: WILLIAMSTOWN | C1449: PELLY 3 | F1449: EVANS 3 | I1449: KELLETT 2 | L1449: MURPHY 2 | N1449: CALLAHAN | Q1449: MALONEY | T1449: SMITH | V1449: WARD
A1450: BOX HILL | C1450: ROMARI 5 | F1450: BRAIN 2 | I1450: PLUNKETT | K1450: WITNISH | M1450: BROWN | O1450: CARRIGG
A1452: NORTHCOTE | C1452: 2 | D1452: 2 | E1452: =C1452*6+D1452 -> 14 | G1452: 4 | H1452: 6 | I1452: =G1452*6+H1452 -> 30 | K1452: 9 | L1452: 12 | M1452: =K1452*6+L1452 -> 66 | O1452: 14 | P1452: 16 | Q1452: =O1452*6+P1452 -> 100 | S1452: NORTHCOTE
A1453: DANDENONG | C1453: 3 | D1453: 4 | E1453: =C1453*6+D1453 -> 22 | G1453: 7 | H1453: 5 | I1453: =G1453*6+H1453 -> 47 | K1453: 7 | L1453: 10 | M1453: =K1453*6+L1453 -> 52 | O1453: 10 | P1453: 13 | Q1453: =O1453*6+P1453 -> 73 | S1453: ROACH
A1454: BEST PLAYERS
A1455: NORTHCOTE | C1455: WRIGHT | F1455: BRETHERTON | I1455: CRIPPS | L1455: SCOTT | O1455: GORMAN | R1455: GIBBS
A1456: DANDENONG | C1456: LALOR | F1456: WATERS | I1456: MINOTTI | L1456: JOHNSON | O1456: WILLIAMS | R1456: GRAY
A1457: GOALKICKERS
A1458: NORTHCOTE | C1458: SCOTT 3 | F1458: VAINS 3 | I1458: WIGNELL 2 | L1458: GIBBS 2 | N1458: CRIPPS | P1458: WRIGHT | R1458: MARCHANT | U1458: ROOTSEY
A1459: DANDENONG | C1459: MINOTTI 3 | F1459: GILLINGHAM 2 | I1459: GRAY 2 | K1459: LALOR | M1459: WATERS | O1459: CROSBIE
A1461: PRESTON | C1461: 7 | D1461: 3 | E1461: =C1461*6+D1461 -> 45 | G1461: 9 | H1461: 5 | I1461: =G1461*6+H1461 -> 59 | K1461: 14 | L1461: 14 | M1461: =K1461*6+L1461 -> 98 | O1461: 17 | P1461: 17 | Q1461: =O1461*6+P1461 -> 119 | S1461: CAMBERWELL
A1462: CAMBERWELL | C1462: 2 | D1462: 2 | E1462: =C1462*6+D1462 -> 14 | G1462: 8 | H1462: 4 | I1462: =G1462*6+H1462 -> 52 | K1462: 10 | L1462: 8 | M1462: =K1462*6+L1462 -> 68 | O1462: 11 | P1462: 12 | Q1462: =O1462*6+P1462 -> 78 | S1462: POLLARD
A1463: BEST PLAYERS
A1464: PRESTON | C1464: BERGIN | F1464: McKENZIE | I1464: NELSON | L1464: McLACHLAN | O1464: RYMER | R1464: DAWSON
A1465: CAMBERWELL | C1465: FREYBERG | F1465: EADES | I1465: SKALBERG | L1465: McPHERSON | O1465: K CHAMBERS | R1465: MUIR
A1466: GOALKICKERS
A1467: PRESTON | C1467: BERGIN 4 | F1467: McKENZIE 3 | I1467: NELSON 3 | K1467: WALSH 2 | M1467: RYMER | O1467: RATCLIFFE | Q1467: WILSON | S1467: DAWSON | V1467: BRITTAIN
A1468: CAMBERWELL | C1468: FREYBERG 6 | F1468: B JOHNSON 3 | I1468: KILPATRICK | L1468: DOUGLAS
A1470: MORDIALLOC | C1470: 1 | D1470: 2 | E1470: =C1470*6+D1470 -> 8 | G1470: 4 | H1470: 4 | I1470: =G1470*6+H1470 -> 28 | K1470: 9 | L1470: 7 | M1470: =K1470*6+L1470 -> 61 | O1470: 17 | P1470: 8 | Q1470: =O1470*6+P1470 -> 110 | S1470: SUNSHINE
A1471: SUNSHINE | C1471: 5 | D1471: 2 | E1471: =C1471*6+D1471 -> 32 | G1471: 7 | H1471: 5 | I1471: =G1471*6+H1471 -> 47 | K1471: 8 | L1471: 6 | M1471: =K1471*6+L1471 -> 54 | O1471: 8 | P1471: 9 | Q1471: =O1471*6+P1471 -> 57 | S1471: D K SMITH
A1472: BEST PLAYERS
A1473: MORDIALLOC | C1473: BAKER | F1473: BESANKO | I1473: ROBERTS | L1473: WHITE | O1473: WILKINSON | R1473: MEADE
A1474: SUNSHINE | C1474: FITZGERALD | F1474: KEMP | I1474: CROSBIE | L1474: TREZISE | O1474: DIX | R1474: LITCHFIELD
A1475: GOALKICKERS
A1476: MORDIALLOC | C1476: BAKER 8 | F1476: WILKINSON 2 | I1476: BESANKO 2 | L1476: SHEEHAN 2 | O1476: MAGINNESS | R1476: KERR | T1476: O'NEILL
A1477: SUNSHINE | C1477: DIX 3 | F1477: N JEPSON | I1477: GREGORY | K1477: LITCHFIELD | N1477: MUNRO | P1477: O'KEEFE
A1479: BRUNSWICK | C1479: 4 | D1479: 10 | E1479: =C1479*6+D1479 -> 34 | G1479: 6 | H1479: 12 | I1479: =G1479*6+H1479 -> 48 | K1479: 12 | L1479: 17 | M1479: =K1479*6+L1479 -> 89 | O1479: 14 | P1479: 19 | Q1479: =O1479*6+P1479 -> 103 | S1479: ELSTERNWICK PARK
A1480: BRIGHTON | C1480: 0 | D1480: 2 | E1480: =C1480*6+D1480 -> 2 | G1480: 1 | H1480: 9 | I1480: =G1480*6+H1480 -> 15 | K1480: 2 | L1480: 11 | M1480: =K1480*6+L1480 -> 23 | O1480: 8 | P1480: 16 | Q1480: =O1480*6+P1480 -> 64 | S1480: BREWER
A1481: BEST PLAYERS
A1482: BRUNSWICK | C1482: K DILLON | F1482: WATT | I1482: THORNTON | L1482: STANLEY | O1482: R THOMPSON | R1482: HAYES
A1483: BRIGHTON | C1483: BURSEY | F1483: POWELL | I1483: CURRIE | L1483: ELDERING | O1483: WILLIAMS | R1483: ASLING
A1484: GOALKICKERS
A1485: BRUNSWICK | C1485: STANLEY 5 | F1485: K DILLON 4 | I1485: THORNTON 3 | L1485: WATT | N1485: HAYES
A1486: BRIGHTON | C1486: ASLING 2 | F1486: BURSEY 2 | I1486: P COOPER | K1486: MAY | M1486: CURRIE | O1486: HOWELL
A1488: FINALS
A1489: 1ST SEMI | D1489: 12TH SEPTEMBER | J1489: WEATHER | M1489: DULL LIGHT RAIN
D1490: 1ST QTR | H1490: 2ND QTR | L1490: 3RD QTR | P1490: FINAL
A1491: COBURG | C1491: 3 | D1491: 2 | E1491: =C1491*6+D1491 -> 20 | G1491: 4 | H1491: 5 | I1491: =G1491*6+H1491 -> 29 | K1491: 7 | L1491: 9 | M1491: =K1491*6+L1491 -> 51 | O1491: 12 | P1491: 11 | Q1491: =O1491*6+P1491 -> 83 | S1491: JUNCTION OVAL
A1492: OAKLEIGH | C1492: 5 | D1492: 2 | E1492: =C1492*6+D1492 -> 32 | G1492: 7 | H1492: 6 | I1492: =G1492*6+H1492 -> 48 | K1492: 6 | L1492: 7 | M1492: =K1492*6+L1492 -> 43 | O1492: 7 | P1492: 14 | Q1492: =O1492*6+P1492 -> 56 | S1492: O'DONOGHUE
A1493: BEST PLAYERS
A1494: COBURG | C1494: WILSON | F1494: MAHONEY | I1494: JORDAN | L1494: GOULLET | O1494: YOUNG | R1494: HOOGEN
A1495: OAKLEIGH | C1495: JONES | F1495: DONOHUE | I1495: LANE | L1495: McCOOKE | O1495: COUGHLAN | R1495: PEAKE
A1496: GOALKICKERS
A1497: COBURG | C1497: SHAW 3 | F1497: HUNTINGTON 2 | J1497: WILSON | L1497: GOULLET | N1497: BYRON | P1497: MATTHEWS
A1498: OAKLEIGH | C1498: JONES 4 | F1498: BAPTIST | I1498: DONOHUE | K1498: VARNEY
A1500: 2ND SEMI | D1500: 26TH SEPTEMBER | J1500: WEATHER | N1500: SOUTH WEST BREEZE FINE
A1501: WILLIAMSTOWN | C1501: 4 | D1501: 2 | E1501: =C1501*6+D1501 -> 26 | G1501: 5 | H1501: 5 | I1501: =G1501*6+H1501 -> 35 | K1501: 6 | L1501: 10 | M1501: =K1501*6+L1501 -> 46 | O1501: 11 | P1501: 14 | Q1501: =O1501*6+P1501 -> 80 | S1501: JUNCTION OVAL | W1501: POSTPONED 19TH SEPTEMBER
A1502: SANDRINGHAM | C1502: 3 | D1502: 2 | E1502: =C1502*6+D1502 -> 20 | G1502: 5 | H1502: 6 | I1502: =G1502*6+H1502 -> 36 | K1502: 7 | L1502: 14 | M1502: =K1502*6+L1502 -> 56 | O1502: 7 | P1502: 16 | Q1502: =O1502*6+P1502 -> 58 | S1502: ALLEN | W1502: DUE TO ADVERSE WEATHER
A1503: BEST PLAYERS | W1503: STRONG SOUTH WIND
A1504: WILLIAMSTOWN | C1504: SMITH | F1504: EVANS | I1504: E BEITZEL | L1504: B BEITZEL | O1504: COLQUHOUN | R1504: MURPHY | W1504: HEAVY RAIN
A1505: SANDRINGHAM | C1505: CROFT | F1505: BOLAND | I1505: JONES | L1505: RANSOM | O1505: WEBSTER | R1505: THOMPSON
A1506: GOALKICKERS
A1507: WILLIAMSTOWN | C1507: EVANS 3 | F1507: MURPHY 2 | I1507: CALLAHAN | L1507: WARD | N1507: MALONEY | Q1507: CULLINAN | S1507: MAZOURIS | W1507: R JONES
A1508: SANDRINGHAM | C1508: WILLIAMS | F1508: SHRIVES | I1508: GLEESON | K1508: WEBSTER | M1508: VANCE | O1508: RICHARDS | R1508: ALSOPP
A1510: PRELIMINARY FINAL | F1510: 3RD QCTOBER | J1510: WEATHER | N1510: FINE
A1511: COBURG | C1511: 5 | D1511: 10 | E1511: =C1511*6+D1511 -> 40 | G1511: 7 | H1511: 13 | I1511: =G1511*6+H1511 -> 55 | K1511: 9 | L1511: 16 | M1511: =K1511*6+L1511 -> 70 | O1511: 14 | P1511: 16 | Q1511: =O1511*6+P1511 -> 100 | S1511: JUNCTION OVAL
A1512: SANDRINGHAM | C1512: 1 | D1512: 3 | E1512: =C1512*6+D1512 -> 9 | G1512: 4 | H1512: 9 | I1512: =G1512*6+H1512 -> 33 | K1512: 8 | L1512: 12 | M1512: =K1512*6+L1512 -> 60 | O1512: 13 | P1512: 18 | Q1512: =O1512*6+P1512 -> 96 | S1512: O'DONOGHUE
A1513: BEST PLAYERS
A1514: COBURG | C1514: TANCREDI | F1514: BRENNAN | I1514: HUNTINGTON | L1514: YOUNG | O1514: JORDAN | R1514: GOULLET
A1515: SANDRINGHAM | C1515: JONES | F1515: RICHARDS | I1515: BOLAND | L1515: VANCE | O1515: WEBSTER | R1515: OAKLEY
A1516: GOALKICKERS
A1517: COBURG | C1517: BYRON 5 | F1517: O'SULLIVAN 3 | I1517: HUNTINGTON 3 | L1517: CARR | N1517: JORDAN | P1517: GOULLET
A1518: SANDRINGHAM | C1518: OAKLEY 6 | F1518: VANCE 2 | I1518: ECCLESTON | L1518: STEELE | N1518: MARSHALL | Q1518: WEBSTER | S1518: RICHARDS
A1520: GRAND FINAL | D1520: 10TH OCTOBER | I1520: WEATHER | K1520: STRONG NORTH WEST WIND 1ST HALF | R1520: CHANGE TO WEST WIND & RAIN 3RD QTR
A1521: WILLIAMSTOWN | C1521: 2 | D1521: 8 | E1521: 20 | G1521: 6 | H1521: 13 | I1521: 49 | K1521: 6 | L1521: 14 | M1521: 50 | O1521: 15 | P1521: 21 | Q1521: =O1521*6+P1521 -> 111 | S1521: JUNCTION OVAL
A1522: COBURG | C1522: 1 | D1522: 1 | E1522: 7 | G1522: 5 | H1522: 6 | I1522: 36 | K1522: 9 | L1522: 9 | M1522: 63 | O1522: 11 | P1522: 10 | Q1522: =O1522*6+P1522 -> 76 | S1522: ALLEN
A1523: BEST PLAYERS
A1524: WILLIAMSTOWN | C1524: EVANS | F1524: CALLAHAN | I1524: B BEITZEL | L1524: KENT | O1524: MAZOURIS | R1524: BOB JONES
A1525: COBURG | C1525: YOUNG | F1525: BIGELOW | I1525: BRENNAN | L1525: SHORT | O1525: BYRON | R1525: TANCREDI
A1526: GOALKICKERS
A1527: WILLIAMSTOWN | C1527: CULLINAN 6 | F1527: CALLAHAN 2 | I1527: MALONEY 2 | L1527: MAZOURIS 2 | O1527: PELLY | Q1527: EVANS | S1527: R JONES
A1528: COBURG | C1528: BYRON 2 | F1528: CARR 2 | I1528: JORDAN 2 | L1528: SHAW 2 | N1528: GOULLET | Q1528: MATTHEWS | T1528: HUNTINGTON