A1: Victorian Football Association
A2: Season 1960
A3: © Copyright Wal Williams | F3: First created: 2 November 2014
A4: Contact: joywalwi at gmail dot com | F4: Last updated: 27 January 2018 | W4: VFA Results and tables - Link to the main index page
A5: You are free to copy this document in whole or part provided that proper acknowledgement is given to the author. All rights reserved.
A7: YEAR 1960
A8: ROUND 1 | E8: 16TH APRIL | H8: EASTER SAT | K8: WEATHER | N8: STRONG WEST WIND | S8: PLAYED AT | X8: LADDER | AB8: ROUND | AD8: 1
D9: 1ST QTR | H9: 2ND QTR | L9: 3RD QTR | P9: FINAL | S9: CAMBERWELL
A10: OAKLEIGH | C10: 1 | D10: 3 | E10: =C10*6+D10 -> 9 | G10: 3 | H10: 9 | I10: =G10*6+H10 -> 27 | K10: 6 | L10: 10 | M10: =K10*6+L10 -> 46 | O10: 9 | P10: 19 | Q10: =O10*6+P10 -> 73 | S10: UMPIRE | W10: TEAM | X10: W | Y10: L | Z10: D | AA10: FOR | AB10: AGST | AC10: % | AD10: PTS
A11: DANDENONG | C11: 3 | D11: 6 | E11: =C11*6+D11 -> 24 | G11: 5 | H11: 7 | I11: =G11*6+H11 -> 37 | K11: 8 | L11: 7 | M11: =K11*6+L11 -> 55 | O11: 8 | P11: 8 | Q11: =O11*6+P11 -> 56 | S11: TREWIN
A12: BEST PLAYERS | W12: SANDRINGHAM | X12: 1 | Y12: 0 | Z12: 0 | AA12: 156 | AB12: 43 | AC12: 362.7906976744186 | AD12: 4
A13: OAKLEIGH | C13: McCOOKE | F13: McGOWAN | I13: NAISMITH | L13: COUGHLAN | O13: GIBBON | Q13: PEAKE | W13: MORDIALLOC | X13: 1 | Y13: 0 | Z13: 0 | AA13: 129 | AB13: 49 | AC13: 263.26530612244898 | AD13: 4
A14: DANDENONG | C14: WATERS | F14: PENNEFATHER | I14: STAUNTON | L14: OSBORNE | O14: BASSETT | Q14: GOOD | W14: MOORABBIN | X14: 1 | Y14: 0 | Z14: 0 | AA14: 120 | AB14: 46 | AC14: 260.86956521739131 | AD14: 4
A15: GOALKICKERS | W15: PORT MELBOURNE | X15: 1 | Y15: 0 | Z15: 0 | AA15: 154 | AB15: 82 | AC15: 187.80487804878049 | AD15: 4
A16: OAKLEIGH | C16: McGOWAN 4 | F16: ASH | H16: JONES | J16: MATHEWS | M16: NAISMITH | P16: VARNEY | W16: COBURG | X16: 1 | Y16: 0 | Z16: 0 | AA16: 112 | AB16: 69 | AC16: 162.31884057971016 | AD16: 4
A17: DANDENONG | C17: BASSETT 2 | F17: OSBORNE 2 | I17: GILLINGHAM 2 | L17: THOMAS 2 | W17: BRUNSWICK | X17: 1 | Y17: 0 | Z17: 0 | AA17: 99 | AB17: 69 | AC17: 143.47826086956522 | AD17: 4
A19: YARRAVILLE | C19: 2 | D19: 3 | E19: =C19*6+D19 -> 15 | G19: 4 | H19: 5 | I19: =G19*6+H19 -> 29 | K19: 7 | L19: 10 | M19: =K19*6+L19 -> 52 | O19: 9 | P19: 14 | Q19: =O19*6+P19 -> 68 | S19: WILLIAMSTOWN | W19: OAKLEIGH | X19: 1 | Y19: 0 | Z19: 0 | AA19: 73 | AB19: 56 | AC19: 130.35714285714286 | AD19: 4
A20: WILLIAMSTOWN | C20: 2 | D20: 2 | E20: =C20*6+D20 -> 14 | G20: 5 | H20: 9 | I20: =G20*6+H20 -> 39 | K20: 5 | L20: 12 | M20: =K20*6+L20 -> 42 | O20: 7 | P20: 15 | Q20: =O20*6+P20 -> 57 | S20: ALLEN | W20: YARRAVILLE | X20: 1 | Y20: 0 | Z20: 0 | AA20: 68 | AB20: 57 | AC20: 119.29824561403508 | AD20: 4
A21: BEST PLAYERS | W21: WILLIAMSTOWN | X21: 0 | Y21: 1 | Z21: 0 | AA21: 57 | AB21: 68 | AC21: 83.82352941176471 | AD21: 0
A22: YARRAVILLE | C22: WILLIAMS | F22: LAMONT | I22: LETCHER | L22: ORANGE | O22: PEARCE | R22: CROOK | W22: DANDENONG | X22: 0 | Y22: 1 | Z22: 0 | AA22: 56 | AB22: 73 | AC22: 76.712328767123282 | AD22: 0
A23: WILLIAMSTOWN | C23: COLLINS | F23: PELLY | I23: MAZOURIS | L23: BROADWAY | O23: COLQUHOUN | R23: BOB JONES | W23: SUNSHINE | X23: 0 | Y23: 1 | Z23: 0 | AA23: 69 | AB23: 99 | AC23: 69.696969696969703 | AD23: 0
A24: GOALKICKERS | W24: PRESTON | X24: 0 | Y24: 1 | Z24: 0 | AA24: 69 | AB24: 112 | AC24: 61.607142857142854 | AD24: 0
A25: YARRAVILLE | C25: ANDERSON 4 | F25: LETCHER | I25: COLLINS | K25: CROOK | M25: CAREY | O25: RON BROWN | W25: NORTHCOTE | X25: 0 | Y25: 1 | Z25: 0 | AA25: 82 | AB25: 154 | AC25: 53.246753246753244 | AD25: 0
A26: WILLIAMSTOWN | C26: PELLY 2 | F26: CULLINAN | I26: MURPHY | K26: WARD | M26: MAZOURIS | O26: MALONEY | W26: BOX HILL | X26: 0 | Y26: 1 | Z26: 0 | AA26: 46 | AB26: 120 | AC26: 38.333333333333336 | AD26: 0
W27: CAMBERWELL | X27: 0 | Y27: 1 | Z27: 0 | AA27: 49 | AB27: 129 | AC27: 37.984496124031011 | AD27: 0
A28: BRUNSWICK | C28: 4 | D28: 5 | E28: =C28*6+D28 -> 29 | G28: 8 | H28: 8 | I28: =G28*6+H28 -> 56 | K28: 13 | L28: 14 | M28: =K28*6+L28 -> 92 | O28: 14 | P28: 15 | Q28: =O28*6+P28 -> 99 | S28: SUNSHINE | W28: BRIGHTON | X28: 0 | Y28: 1 | Z28: 0 | AA28: 43 | AB28: 156 | AC28: 27.564102564102566 | AD28: 0
A29: SUNSHINE | C29: 2 | D29: 1 | E29: =C29*6+D29 -> 13 | G29: 7 | H29: 9 | I29: =G29*6+H29 -> 51 | K29: 7 | L29: 11 | M29: =K29*6+L29 -> 53 | O29: 9 | P29: 15 | Q29: =O29*6+P29 -> 69 | S29: SCOTT | W29: PRAHRAN | X29: 0 | Y29: 0 | Z29: 0 | AA29: 0 | AB29: 0 | AC29: 0 | AD29: 0
A30: BEST PLAYERS
A31: BRUNSWICK | C31: DENTON | F31: K DILLON | I31: G STANLEY | L31: LINKINS | O31: WHILEY | Q31: HOUSE
A32: SUNSHINE | C32: SEYMOUR | F32: CROSBIE | I32: WARREN | L32: FITZGERALD | O32: BRYSON | Q32: DICKSON
A33: GOALKICKERS
A34: BRUNSWICK | C34: G STANLEY 3 | F34: DENTON 3 | I34: MILLER 2 | K34: K DILLON | M34: AYRES | O34: HOUSE | Q34: LEWIS | S34: AMBROSE
A35: SUNSHINE | C35: DICKSON 3 | F35: STAFFORD 2 | I35: BRYSON 2 | L35: KELLY | N35: WARREN
A37: COBURG | C37: 7 | D37: 7 | E37: =C37*6+D37 -> 49 | G37: 7 | H37: 9 | I37: =G37*6+H37 -> 51 | K37: 13 | L37: 13 | M37: =K37*6+L37 -> 91 | O37: 15 | P37: 22 | Q37: =O37*6+P37 -> 112 | S37: COBURG
A38: PRESTON | C38: 5 | D38: 0 | E38: =C38*6+D38 -> 30 | G38: 9 | H38: 4 | I38: =G38*6+H38 -> 58 | K38: 9 | L38: 5 | M38: =K38*6+L38 -> 59 | O38: 10 | P38: 9 | Q38: =O38*6+P38 -> 69 | S38: POLLARD
A39: BEST PLAYERS
A40: COBURG | C40: WILSON | F40: CLARKSON | I40: FITZPATRICK | L40: BRENNAN | O40: SHORT | Q40: HUNTINGTON
A41: PRESTON | C41: HOWARD | F41: HAUGHTON | I41: BERGIN | L41: McMAHON | O41: MILLER | Q41: NELSON
A42: GOALKICKERS
A43: COBURG | C43: FITZPATRICK 4 | F43: WILSON 3 | I43: JORDAN 3 | L43: BRENNAN 2 | O43: BYRON | Q43: MAHONEY | T43: BIGELOW
A44: PRESTON | C44: HOWARD 2 | F44: DAVIS 2 | H44: GRAY 2 | J44: BERGIN | L44: MILLER | N44: HAUGHTON | Q44: DEAN
E45: 18TH APRIL | H45: EASTER MON | K45: WEATHER | O45: WEST WIND
A46: PORT MELBOURNE | C46: 2 | D46: 2 | E46: =C46*6+D46 -> 14 | G46: 9 | H46: 6 | I46: =G46*6+H46 -> 60 | K46: 11 | L46: 10 | M46: =K46*6+L46 -> 76 | O46: 23 | P46: 16 | Q46: =O46*6+P46 -> 154 | S46: NORTHCOTE
A47: NORTHCOTE | C47: 2 | D47: 6 | E47: =C47*6+D47 -> 18 | G47: 5 | H47: 9 | I47: =G47*6+H47 -> 39 | K47: 8 | L47: 15 | M47: =K47*6+L47 -> 63 | O47: 11 | P47: 16 | Q47: =O47*6+P47 -> 82 | S47: ROACH
A48: BEST PLAYERS
A49: PORT MELBOURNE | C49: BONNETT | F49: FREYER | I49: MONKS | L49: McDONALD | O49: CLAXTON | R49: FURNESS
A50: NORTHCOTE | C50: BRETHERTON | F50: WRIGHT | I50: HICKS | L50: NIHILL | O50: WIGNELL | R50: LAVER
A51: GOALKICKERS
A52: PORT MELBOURNE | C52: BONNETT 11 | F52: MONKS 3 | I52: McDONALD 3 | L52: CLAXTON 3 | O52: FREYER | Q52: McMILLAN | T52: LAWSON
A53: NORTHCOTE | C53: HICKS 3 | F53: WRIGHT 2 | I53: BETSON 2 | L53: SHAW | N53: WIGNELL | P53: DUBOIS | R53: OLIVER
A55: MOORABBIN | C55: 4 | D55: 3 | E55: =C55*6+D55 -> 27 | G55: 9 | H55: 5 | I55: =G55*6+H55 -> 59 | K55: 11 | L55: 9 | M55: =K55*6+L55 -> 75 | O55: 18 | P55: 12 | Q55: =O55*6+P55 -> 120 | S55: BOX HILL
A56: BOX HILL | C56: 1 | D56: 5 | E56: =C56*6+D56 -> 11 | G56: 4 | H56: 7 | I56: =G56*6+H56 -> 31 | K56: 6 | L56: 9 | M56: =K56*6+L56 -> 45 | O56: 6 | P56: 10 | Q56: =O56*6+P56 -> 46 | S56: D K SMITH
A57: BEST PLAYERS
A58: MOORABBIN | C58: GILDER | F58: PAPLEY | I58: KENT | K58: MILLS | N58: BUZZA | Q58: MORONEY
A59: BOX HILL | C59: BEASY | F59: EADE | I59: DEAN | K59: WRIGHT | N59: SAUNDERS | Q59: PLUNKETT
A60: GOALKICKERS
A61: MOORABBIN | C61: PAPLEY 4 | F61: MORONEY 4 | I61: RYAN 3 | K61: CRAMERI 2 | N61: WHALEBONE 2 | Q61: BUZZA | S61: MANIE | U61: TREZISE
A62: BOX HILL | C62: SALVADO | F62: WITNISH | I62: BROWN | K62: EADE | M62: PLUNKETT | P62: GUEST
A64: MORDIALLOC | C64: 5 | D64: 5 | E64: =C64*6+D64 -> 35 | G64: 9 | H64: 10 | I64: =G64*6+H64 -> 64 | K64: 13 | L64: 12 | M64: =K64*6+L64 -> 90 | O64: 19 | P64: 15 | Q64: =O64*6+P64 -> 129 | S64: MORDIALLOC
A65: CAMBERWELL | C65: 1 | D65: 2 | E65: =C65*6+D65 -> 8 | G65: 1 | H65: 6 | I65: =G65*6+H65 -> 12 | K65: 3 | L65: 7 | M65: =K65*6+L65 -> 25 | O65: 7 | P65: 7 | Q65: =O65*6+P65 -> 49 | S65: O'DONOGHUE
A66: BEST PLAYERS
A67: MORDIALLOC | C67: JOSE | F67: BARR | I67: PEARSON | L67: RITCHIE | O67: WILKINSON | R67: MAGINNESS
A68: CAMBERWELL | C68: WHITTEN | F68: ELLIS | I68: CHAPLIN | L68: KENT | O68: KILPATRICK | R68: COLLETT
A69: GOALKICKERS
A70: MORDIALLOC | C70: BAKER 7 | F70: PEARSON 5 | I70: RITCHIE 2 | L70: MINHAN 2 | N70: KERR | P70: WILKINSON | S70: NISBET
A71: CAMBERWELL | C71: KILPATRICK 2 | F71: SKALBERG | I71: R THOMPSON | L71: QUIRK | N71: K JOHNSON | Q71: H THOMPSON
A73: SANDRINGHAM | C73: 7 | D73: 2 | E73: =C73*6+D73 -> 44 | G73: 10 | H73: 5 | I73: =G73*6+H73 -> 65 | K73: 19 | L73: 10 | M73: =K73*6+L73 -> 124 | O73: 23 | P73: 18 | Q73: =O73*6+P73 -> 156 | S73: BEACH ROAD
A74: BRIGHTON | C74: 0 | D74: 3 | E74: =C74*6+D74 -> 3 | G74: 0 | H74: 6 | I74: =G74*6+H74 -> 6 | K74: 3 | L74: 6 | M74: =K74*6+L74 -> 24 | O74: 6 | P74: 7 | Q74: =O74*6+P74 -> 43 | S74: BREWER
A75: BEST PLAYERS
A76: SANDRIGHAM | C76: OAKLEY | F76: R EVANS | I76: STEELE | L76: SNELLING | O76: SHEERAN | R76: RASMUSSEN
A77: BRIGHTON | C77: BROWNING | F77: D CURRIE | I77: WILLIAMS | L77: ELDERING | O77: McCANN | R77: BURSEY
A78: GOALKICKERS
A79: SANDRIGHAM | C79: OAKLEY 5 | F79: SNELLING 4 | I79: STEELE 3 | K79: EVANS 3 | M79: WEBSTER 2 | P79: VANCE 2 | R79: GLEESON 2 | U79: RICHARDS | X79: RASMUSSEN
A80: BRIGHTON | C80: HOWELL 2 | F80: CURRIE | H80: BURSEY | J80: BEGLEY | L80: GRANT
A82: BYE | C82: PRAHRAN
A84: ROUND 2 | E84: 23RD APRIL | J84: WEATHER | M84: SOUTH WEST WIND DRIZZLE | S84: PLAYED AT | X84: LADDER | AB84: ROUND | AD84: 1
D85: 1ST QTR | H85: 2ND QTR | L85: 3RD QTR | P85: FINAL | S85: PORT MELBOURNE
A86: WILLIAMSTOWN | C86: 1 | D86: 1 | E86: =C86*6+D86 -> 7 | G86: 4 | H86: 10 | I86: =G86*6+H86 -> 34 | K86: 7 | L86: 14 | M86: =K86*6+L86 -> 56 | O86: 10 | P86: 23 | Q86: =O86*6+P86 -> 83 | S86: UMPIRE | W86: TEAM | X86: W | Y86: L | Z86: D | AA86: FOR | AB86: AGST | AC86: % | AD86: PTS
A87: PORT MELBOURNE | C87: 2 | D87: 7 | E87: =C87*6+D87 -> 19 | G87: 3 | H87: 8 | I87: =G87*6+H87 -> 26 | K87: 7 | L87: 10 | M87: =K87*6+L87 -> 52 | O87: 8 | P87: 12 | Q87: =O87*6+P87 -> 60 | S87: O'DONOGHUE
A88: BEST PLAYERS | W88: SANDRINGHAM | X88: 2 | Y88: 0 | Z88: 0 | AA88: 261 | AB88: 90 | AC88: 290 | AD88: 8
A89: WILLIAMSTOWN | C89: B BEITZEL | F89: MALONEY | I89: COLQUHOUN | L89: PELLY | N89: MURPHY | Q89: BOB JONES | W89: MORDIALLOC | X89: 2 | Y89: 0 | Z89: 0 | AA89: 204 | AB89: 89 | AC89: 229.2134831460674 | AD89: 8
A90: PORT MELBOURNE | C90: CLARKE | F90: MERRETT | I90: COVENTRY | L90: JOLIFFE | N90: TUCKER | Q90: BONNETT | W90: MOORABBIN | X90: 2 | Y90: 0 | Z90: 0 | AA90: 194 | AB90: 100 | AC90: 194 | AD90: 8
A91: GOALKICKERS | W91: YARRAVILLE | X91: 2 | Y91: 0 | Z91: 0 | AA91: 158 | AB91: 94 | AC91: 168.08510638297872 | AD91: 8
A92: WILLIAMSTOWN | C92: MALONEY 2 | F92: PELLY 2 | H92: CULLINAN 2 | K92: WARD | M92: MURPHY | O92: MAZOURIS | R92: EVANS | W92: COBURG | X92: 2 | Y92: 0 | Z92: 0 | AA92: 201 | AB92: 140 | AC92: 143.57142857142858 | AD92: 8
A93: PORT MELBOURNE | C93: BONNETT 4 | F93: FREYER 2 | I93: CLAXTON | L93: McDONALD | W93: PORT MELBOURNE | X93: 1 | Y93: 1 | Z93: 0 | AA93: 214 | AB93: 165 | AC93: 129.69696969696969 | AD93: 4
A95: MOORABBIN | C95: 2 | D95: 0 | E95: =C95*6+D95 -> 12 | G95: 5 | H95: 5 | I95: =G95*6+H95 -> 35 | K95: 6 | L95: 10 | M95: =K95*6+L95 -> 46 | O95: 10 | P95: 14 | Q95: =O95*6+P95 -> 74 | S95: MOORABBIN | W95: WILLIAMSTOWN | X95: 1 | Y95: 1 | Z95: 0 | AA95: 140 | AB95: 128 | AC95: 109.375 | AD95: 4
A96: OAKLEIGH | C96: 2 | D96: 4 | E96: =C96*6+D96 -> 16 | G96: 2 | H96: 6 | I96: =G96*6+H96 -> 18 | K96: 6 | L96: 11 | M96: =K96*6+L96 -> 47 | O96: 7 | P96: 12 | Q96: =O96*6+P96 -> 54 | S96: POLLARD | W96: BRUNSWICK | X96: 1 | Y96: 1 | Z96: 0 | AA96: 170 | AB96: 158 | AC96: 107.59493670886076 | AD96: 4
A97: BEST PLAYERS | W97: OAKLEIGH | X97: 1 | Y97: 1 | Z97: 0 | AA97: 127 | AB97: 130 | AC97: 97.692307692307693 | AD97: 4
A98: MOORABBIN | C98: WHALEBONE | F98: MORONEY | I98: GILDER | L98: RYAN | O98: TREZISE | Q98: KANN | W98: NORTHCOTE | X98: 1 | Y98: 1 | Z98: 0 | AA98: 146 | AB98: 191 | AC98: 76.439790575916234 | AD98: 4
A99: OAKLEIGH | C99: KITTO | F99: COUGHLAN | I99: MATTHEWS | L99: NAISMITH | O99: D'ARCY | Q99: PANNAM | W99: CAMBERWELL | X99: 1 | Y99: 1 | Z99: 0 | AA99: 108 | AB99: 183 | AC99: 59.016393442622949 | AD99: 4
A100: GOALKICKERS | W100: SUNSHINE | X100: 0 | Y100: 2 | Z100: 0 | AA100: 123 | AB100: 158 | AC100: 77.848101265822791 | AD100: 0
A101: MOORABBIN | C101: WHALEBONE 4 | F101: RYAN 3 | H101: MORONEY | J101: PAPLEY | L101: MANIE | W101: PRESTON | X101: 0 | Y101: 2 | Z101: 0 | AA101: 106 | AB101: 176 | AC101: 60.227272727272727 | AD101: 0
A102: OAKLEIGH | C102: MATTHEWS 3 | F102: PANNAM 2 | I102: KITTO | K102: McKEOGH | W102: DANDENONG | X102: 0 | Y102: 2 | Z102: 0 | AA102: 103 | AB102: 181 | AC102: 56.906077348066297 | AD102: 0
W103: PRAHRAN | X103: 0 | Y103: 1 | Z103: 0 | AA103: 37 | AB103: 87 | AC103: 42.53 | AD103: 0
A104: SANDRINGHAM | C104: 0 | D104: 2 | E104: =C104*6+D104 -> 2 | G104: 8 | H104: 7 | I104: =G104*6+H104 -> 55 | K104: 11 | L104: 9 | M104: =K104*6+L104 -> 75 | O104: 15 | P104: 15 | Q104: =O104*6+P104 -> 105 | S104: DANDENONG | W104: BOX HILL | X104: 0 | Y104: 1 | Z104: 0 | AA104: 46 | AB104: 120 | AC104: 38.333333333333336 | AD104: 0
A105: DANDENONG | C105: 1 | D105: 6 | E105: =C105*6+D105 -> 12 | G105: 1 | H105: 7 | I105: =G105*6+H105 -> 13 | K105: 4 | L105: 11 | M105: =K105*6+L105 -> 35 | O105: 6 | P105: 11 | Q105: =O105*6+P105 -> 47 | S105: SMITH | W105: BRIGHTON | X105: 0 | Y105: 2 | Z105: 0 | AA105: 83 | AB105: 231 | AC105: 35.930735930735928 | AD105: 0
A106: BEST PLAYERS
A107: SANDRINGHAM | C107: RICHARDS | F107: BOLAND | I107: WEBSTER | L107: RANSOM | O107: EVANS | Q107: STRACHAN
A108: DANDENONG | C108: HOWER | F108: PENNEFATHER | I108: PETERS | L108: JOHNSON | O108: THOMAS | Q108: STAUNTON
A109: GOALKICKERS
A110: SANDRINGHAM | C110: OAKLEY 4 | F110: GLEESON 4 | I110: RICHARDS 2 | L110: VANCE | N110: EVANS | P110: RASMUSSEN | S110: STEELE | U110: WEBSTER
A111: DANDENONG | C111: THOMAS 2 | F111: WILLIAMS | I111: GILLINGHAM | L111: HOWER | N111: OSBORNE
A113: YARRAVILLE | C113: 5 | D113: 0 | E113: =C113*6+D113 -> 30 | G113: 7 | H113: 6 | I113: =G113*6+H113 -> 48 | K113: 9 | L113: 7 | M113: =K113*6+L113 -> 61 | O113: 13 | P113: 12 | Q113: =O113*6+P113 -> 90 | S113: YARRAVILLE
A114: PRAHRAN | C114: 2 | D114: 1 | E114: =C114*6+D114 -> 13 | G114: 2 | H114: 3 | I114: =G114*6+H114 -> 15 | K114: 5 | L114: 6 | M114: =K114*6+L114 -> 36 | O114: 5 | P114: 7 | Q114: =O114*6+P114 -> 37 | S114: TREWIN
A115: BEST PLAYERS
A116: YARRAVILLE | C116: ORANGE | F116: CAREY | I116: CROOK | L116: RON BROWN | O116: LAMONT | R116: BURT
A117: PRAHRAN | C117: HARVEY | F117: ROSS | I117: ROSS JONES | L117: PEARSON | O117: LEWIS | R117: ROY JONES
A118: GOALKICKERS
A119: YARRAVILLE | C119: RON BROWN 3 | F119: CAREY 2 | H119: BOURKE 2 | J119: ORANGE | L119: FLEMING | N119: CROOK | P119: COLLINS | R119: ANDERSON | U119: FLETCHER
A120: PRAHRAN | C120: LEWIS 2 | F120: ROSS | H120: HARVEY | J120: PEARSON
A122: NORTHCOTE | C122: 3 | D122: 1 | E122: =C122*6+D122 -> 19 | G122: 5 | H122: 3 | I122: =G122*6+H122 -> 33 | K122: 5 | L122: 5 | M122: =K122*6+L122 -> 35 | O122: 9 | P122: 10 | Q122: =O122*6+P122 -> 64 | S122: PRESTON
A123: PRESTON | C123: 1 | D123: 5 | E123: =C123*6+D123 -> 11 | G123: 1 | H123: 8 | I123: =G123*6+H123 -> 14 | K123: 4 | L123: 13 | M123: =K123*6+L123 -> 37 | O123: 4 | P123: 13 | Q123: =O123*6+P123 -> 37 | S123: BREWER
A124: BEST PLAYERS
A125: NORTHCOTE | C125: BETSON | F125: BRETHERTON | I125: LAVER | K125: NIHILL | M125: HICKS | P125: VAINS
A126: PRESTON | C126: RATCLIFFE | F126: McLACHLAN | I126: BERGIN | K126: GRAY | M126: MILLER | P126: NELSON
A127: GOALKICKERS
A128: NORTHCOTE | C128: HICKS 3 | F128: VAINS | H128: WRIGHT | J128: DONEGAN | M128: BRETHERTON | P128: BETSON | R128: HOSKING
A129: PRESTON | C129: DAVIS 2 | F129: BERGIN | I129: RATCLIFFE
A131: CAMBERWELL | C131: 2 | D131: 6 | E131: =C131*6+D131 -> 18 | G131: 2 | H131: 9 | I131: =G131*6+H131 -> 21 | K131: 6 | L131: 10 | M131: =K131*6+L131 -> 46 | O131: 8 | P131: 11 | Q131: =O131*6+P131 -> 59 | S131: CAMBERWELL
A132: SUNSHINE | C132: 1 | D132: 2 | E132: =C132*6+D132 -> 8 | G132: 4 | H132: 5 | I132: =G132*6+H132 -> 29 | K132: 5 | L132: 8 | M132: =K132*6+L132 -> 38 | O132: 7 | P132: 12 | Q132: =O132*6+P132 -> 54 | S132: ROACH
A133: BEST PLAYERS
A134: CAMBERWELL | C134: WHITTEN | F134: K JOHNSON | I134: BAILEY | L134: LONG | O134: COMMONS | R134: SKALBERG
A135: SUNSHINE | C135: LEVER | F135: SEYMOUR | I135: CROSBIE | L135: FITZGERALD | O135: TURNER | R135: KELLY
A136: GOALKICKERS
A137: CAMBERWELL | C137: B JOHNSON 2 | F137: R THOMPSON 2 | J137: WHITTEN | M137: COMMONS | P137: QUIRK | R137: O'NEILL
A138: SUNSHINE | C138: KELLY 5 | F138: DICKSON | I138: BRYSON
A140: MORDIALLOC | C140: 3 | D140: 1 | E140: =C140*6+D140 -> 19 | G140: 5 | H140: 3 | I140: =G140*6+H140 -> 33 | K140: 7 | L140: 5 | M140: =K140*6+L140 -> 47 | O140: 11 | P140: 9 | Q140: =O140*6+P140 -> 75 | S140: ELSTERNWICK PARK
A141: BRIGHTON | C141: 3 | D141: 0 | E141: =C141*6+D141 -> 18 | G141: 3 | H141: 2 | I141: =G141*6+H141 -> 20 | K141: 5 | L141: 4 | M141: =K141*6+L141 -> 34 | O141: 6 | P141: 4 | Q141: =O141*6+P141 -> 40 | S141: SCOTT
A142: BEST PLAYERS
A143: MORDIALLOC | C143: MAGINNESS | F143: MEADE | I143: JOSE | K143: BAKER | N143: KERR | Q143: BESANKO
A144: BRIGHTON | C144: BURSEY | F144: WILLIAMS | I144: BEGLEY | K144: FOX | N144: N COOPER | Q144: McCANN
A145: GOALKICKERS
A146: MORDIALLOC | C146: BAKER 4 | F146: NESBIT | H146: MEADE | J146: BESANKO | L146: RITCHIE | N146: KERR | P146: PEARSON | R146: WILKINSON
A147: BRIGHTON | C147: N COOPER 2 | F147: BURSEY 2 | I147: BROWNING | L147: HOWELL
A149: 1ST SUNDAY MATCH IN V.F.A. | F149: 24TH APRIL | K149: WEATHER | N149: FINE DULL
A150: COBURG | C150: 6 | D150: 6 | E150: =C150*6+D150 -> 42 | G150: 8 | H150: 13 | I150: =G150*6+H150 -> 61 | K150: 12 | L150: 16 | M150: =K150*6+L150 -> 88 | O150: 12 | P150: 17 | Q150: =O150*6+P150 -> 89 | S150: BRUNSWICK
A151: BRUNSWICK | C151: 0 | D151: 1 | E151: =C151*6+D151 -> 1 | G151: 3 | H151: 5 | I151: =G151*6+H151 -> 23 | K151: 3 | L151: 15 | M151: =K151*6+L151 -> 33 | O151: 9 | P151: 17 | Q151: =O151*6+P151 -> 71 | S151: KARDINIA PARK
A152: BEST PLAYERS
A153: COBURG | C153: MATTHEWS | F153: HUNTINGTON | I153: BIGELOW | L153: JORDAN | N153: CARR | Q153: SHORT
A154: BRUNSWICK | C154: R DILLON | F154: EDWARDS | I154: JARMAN | L154: MILLER | N154: ROSSIN | Q154: McCORMACK
A155: GOALKICKERS
A156: COBURG | C156: BIGELOW 2 | F156: WILSON 2 | I156: JORDAN 2 | L156: KERR 2 | N156: CARR | P156: BYRON | R156: FITZPATRICK | W156: HUNTINGTON
A157: BRUNSWICK | C157: K DILLON 2 | F157: MATTHEWS 2 | I157: McKENNA 2 | L157: MILLER | N157: VELO | P157: DENTON
A159: BYE | C159: BOX HILL
A161: ROUND 3 | E161: 30TH APRIL | K161: WEATHER | P161: FINE DULL | S161: PLAYED AT
D162: 1ST QTR | H162: 2ND QTR | L162: 3RD QTR | P162: FINAL | S162: BEACH ROAD
A163: SANDRINGHAM | C163: 5 | D163: 3 | E163: =C163*6+D163 -> 33 | G163: 11 | H163: 8 | I163: =G163*6+H163 -> 74 | K163: 14 | L163: 13 | M163: =K163*6+L163 -> 97 | O163: 23 | P163: 16 | Q163: =O163*6+P163 -> 154 | S163: UMPIRE | X163: LADDER | AB163: ROUND | AD163: 3
A164: MOORABBIN | C164: 2 | D164: 1 | E164: =C164*6+D164 -> 13 | G164: 2 | H164: 8 | I164: =G164*6+H164 -> 20 | K164: 6 | L164: 9 | M164: =K164*6+L164 -> 45 | O164: 9 | P164: 12 | Q164: =O164*6+P164 -> 66 | S164: ALLEN
A165: BEST PLAYERS | W165: TEAM | X165: W | Y165: L | Z165: D | AA165: FOR | AB165: AGST | AC165: % | AD165: PTS
A166: SANDRINGHAM | C166: RICHARDS | F166: BOLAND | I166: EVANS | L166: RANSOM | N166: WEBSTER | Q166: RASMUSSEN
A167: MOORABBIN | C167: CRAMERI | F167: WHALEBONE | I167: WILSON | L167: BOYD | N167: MILLS | Q167: RYAN | W167: SANDRINGHAM | X167: 3 | Y167: 0 | Z167: 0 | AA167: 415 | AB167: 156 | AC167: 266.03 | AD167: 12
A168: GOALKICKERS | W168: MORDIALLOC | X168: 3 | Y168: 0 | Z168: 0 | AA168: 302 | AB168: 158 | AC168: 191.13924050632912 | AD168: 12
A169: SANDRINGHAM | C169: EVANS 6 | E169: WEBSTER 6 | H169: RASMUSSEN 4 | K169: OAKLEY 3 | M169: STEELE | O169: GLEESON | Q169: RICHARDS | T169: RANSOM | W169: YARRAVILLE | X169: 3 | Y169: 0 | Z169: 0 | AA169: 249 | AB169: 134 | AC169: 185.82089552238807 | AD169: 12
A170: MOORABBIN | C170: RYAN 6 | F170: CRAMERI 2 | I170: MANIE | W170: COBURG | X170: 3 | Y170: 0 | Z170: 0 | AA170: 384 | AB170: 209 | AC170: 183.73205741626793 | AD170: 12
W171: OAKLEIGH | X171: 2 | Y171: 1 | Z171: 0 | AA171: 266 | AB171: 198 | AC171: 134.34343434343435 | AD171: 8
A172: BRUNSWICK | C172: 5 | D172: 2 | E172: =C172*6+D172 -> 32 | G172: 11 | H172: 6 | I172: =G172*6+H172 -> 72 | K172: 15 | L172: 10 | M172: =K172*6+L172 -> 100 | O172: 19 | P172: 11 | Q172: =O172*6+P172 -> 125 | S172: NORTHCOTE | W172: BRUNSWICK | X172: 2 | Y172: 1 | Z172: 0 | AA172: 295 | AB172: 220 | AC172: 134.09090909090909 | AD172: 8
A173: NORTHCOTE | C173: 0 | D173: 1 | E173: =C173*6+D173 -> 1 | G173: 4 | H173: 3 | I173: =G173*6+H173 -> 27 | K173: 6 | L173: 6 | M173: =K173*6+L173 -> 42 | O173: 9 | P173: 8 | Q173: =O173*6+P173 -> 62 | S173: O'DONOGHUE
A174: BEST PLAYERS | W174: WILLIAMSTOWN | X174: 2 | Y174: 1 | Z174: 0 | AA174: 264 | AB174: 200 | AC174: 132 | AD174: 8
A175: BRUNSWICK | C175: G STANLEY | F175: K DILLON | I175: DENTON | L175: MATHEWS | O175: McCORMACK | R175: EDWARDS | W175: MOORABBIN | X175: 2 | Y175: 1 | Z175: 0 | AA175: 260 | AB175: 254 | AC175: 102.36220472440945 | AD175: 8
A176: NORTHCOTE | C176: BRETHERTON | F176: HOSKINGS | I176: DONEGAN | L176: LAVER | O176: DOWLING | R176: ADAMSON | W176: PORT MELBOURNE | X176: 1 | Y176: 2 | Z176: 0 | AA176: 254 | AB176: 256 | AC176: 99.21875 | AD176: 4
A177: GOALKICKERS | W177: SUNSHINE | X177: 1 | Y177: 2 | Z177: 0 | AA177: 225 | AB177: 252 | AC177: 89.285714285714292 | AD177: 4
A178: BRUNSWICK | C178: DENTON 5 | F178: G STANLEY 5 | I178: K DILLON 4 | L178: MATHEWS 3 | O178: DEAS | Q178: AMBROSE | W178: NORTHCOTE | X178: 1 | Y178: 2 | Z178: 0 | AA178: 208 | AB178: 316 | AC178: 65.822784810126578 | AD178: 4
A179: NORTHCOTE | C179: VAINS 2 | F179: WRIGHT | H179: BREHANY | J179: AGHAN | L179: BETSON | N179: BRETHERTON | Q179: WIGNELL | S179: HOSKINGS | W179: CAMBERWELL | X179: 1 | Y179: 1 | Z179: 0 | AA179: 108 | AB179: 183 | AC179: 59.016393442622949 | AD179: 4
W180: PRAHRAN | X180: 0 | Y180: 2 | Z180: 0 | AA180: 131 | AB180: 189 | AC180: 69.31 | AD180: 0
A181: WILLIAMSTOWN | C181: 3 | D181: 3 | E181: =C181*6+D181 -> 21 | G181: 7 | H181: 7 | I181: =G181*6+H181 -> 49 | K181: 13 | L181: 11 | M181: =K181*6+L181 -> 89 | O181: 18 | P181: 16 | Q181: =O181*6+P181 -> 124 | S181: WILLIAMSTOWN | W181: DANDENONG | X181: 0 | Y181: 3 | Z181: 0 | AA181: 172 | AB181: 279 | AC181: 61.648745519713259 | AD181: 0
A182: PRESTON | C182: 2 | D182: 0 | E182: =C182*6+D182 -> 12 | G182: 6 | H182: 2 | I182: =G182*6+H182 -> 38 | K182: 8 | L182: 2 | M182: =K182*6+L182 -> 50 | O182: 11 | P182: 6 | Q182: =O182*6+P182 -> 72 | S182: TREWIN | W182: PRESTON | X182: 0 | Y182: 3 | Z182: 0 | AA182: 178 | AB182: 300 | AC182: 59.333333333333336 | AD182: 0
A183: BEST PLAYERS | W183: BOX HILL | X183: 0 | Y183: 2 | Z183: 0 | AA183: 114 | AB183: 259 | AC183: 44.015444015444018 | AD183: 0
A184: WILLIAMSTOWN | C184: PELLY | F184: MALONEY | I184: McASEY | L184: MAZOURIS | O184: E BEITZEL | Q184: COLLINS | W184: BRIGHTON | X184: 0 | Y184: 3 | Z184: 0 | AA184: 152 | AB184: 414 | AC184: 36.714975845410628 | AD184: 0
A185: PRESTON | C185: HAUGHTON | F185: WALSH | I185: SLATTERY | L185: BERGIN | O185: LORD | Q185: MILLER
A186: GOALKICKERS
A187: WILLIAMSTOWN | C187: PELLY 4 | F187: MURPHY 3 | I187: MAZOURIS 3 | L187: WARD 3 | N187: CULLINAN 2 | Q187: McASEY | S187: RAINSFORD | V187: MALONEY
A188: PRESTON | C188: WOODS 3 | F188: McMAHON 2 | I188: WALSH 2 | L188: DAVIS | N188: BERGIN | P188: GRAY | R188: WILSON
A190: SUNSHINE | C190: 3 | D190: 1 | E190: =C190*6+D190 -> 19 | G190: 9 | H190: 6 | I190: =G190*6+H190 -> 60 | K190: 12 | L190: 8 | M190: =K190*6+L190 -> 80 | O190: 15 | P190: 12 | Q190: =O190*6+P190 -> 102 | S190: TOORAK PARK
A191: PRAHRAN | C191: 6 | D191: 4 | E191: =C191*6+D191 -> 40 | G191: 10 | H191: 8 | I191: =G191*6+H191 -> 68 | K191: 13 | L191: 12 | M191: =K191*6+L191 -> 90 | O191: 13 | P191: 16 | Q191: =O191*6+P191 -> 94 | S191: SMITH
A192: BEST PLAYERS
A193: SUNSHINE | C193: KELLY | F193: FITZGERALD | I193: CROSBIE | L193: BARCLAY | O193: N KEMP | Q193: DICKSON
A194: PRAHRAN | C194: ROSS | F194: WALSH | I194: HARVEY | L194: LEWIS | O194: BOYD | Q194: VURLOW
A195: GOALKICKERS
A196: SUNSHINE | C196: KELLY 9 | F196: BARCLAY 2 | I196: HOLLAND | K196: TURNER | M196: BRYSON | O196: DICKSON
A197: PRAHRAN | C197: LEWIS 5 | F197: HARVEY 3 | I197: WALSH 2 | K197: PEARSON 2 | N197: L ROSS
A199: OAKLEIGH | C199: 3 | D199: 4 | E199: =C199*6+D199 -> 22 | G199: 8 | H199: 6 | I199: =G199*6+H199 -> 54 | K199: 13 | L199: 12 | M199: =K199*6+L199 -> 90 | O199: 20 | P199: 19 | Q199: =O199*6+P199 -> 139
A200: BOX HILL | C200: 1 | D200: 2 | E200: =C200*6+D200 -> 8 | G200: 4 | H200: 3 | I200: =G200*6+H200 -> 27 | K200: 8 | L200: 5 | M200: =K200*6+L200 -> 53 | O200: 10 | P200: 8 | Q200: =O200*6+P200 -> 68 | S200: BREWER
A201: BEST PLAYERS
A202: OAKLEIGH | C202: COUGHLAN | F202: PANNAM | I202: McCOOKE | L202: NAISMITH | O202: COLLINS | R202: KITTO
A203: BOX HILL | C203: BATES | F203: WHITE | I203: ROCHOW | L203: CRAIG | O203: LANE | R203: WRIGHT
A204: GOALKICKERS
A205: OAKLEIGH | C205: COUGHLAN 4 | F205: PANNAM 4 | I205: McCOOKE 3 | L205: D'ARCY 3 | N205: ALLSOPP 2 | Q205: McKEOGH 2 | T205: ASH | V205: COLLINS
A206: BOX HILL | C206: SALVADO 4 | F206: LANE 2 | I206: BATES 2 | L206: GRAY | N206: DEAN
A208: MORDIALLOC | C208: 4 | D208: 3 | E208: =C208*6+D208 -> 27 | G208: 7 | H208: 10 | I208: =G208*6+H208 -> 52 | K208: 9 | L208: 15 | M208: =K208*6+L208 -> 69 | O208: 13 | P208: 20 | Q208: =O208*6+P208 -> 98 | S208: MORDIALLOC
A209: DANDENONG | C209: 1 | D209: 5 | E209: =C209*6+D209 -> 11 | G209: 5 | H209: 8 | I209: =G209*6+H209 -> 38 | K209: 9 | L209: 8 | M209: =K209*6+L209 -> 62 | O209: 10 | P209: 9 | Q209: =O209*6+P209 -> 69
A210: BEST PLAYERS
A211: MORDIALLOC | C211: JOSE | F211: RITCHIE | I211: NISBET | L211: BESANKO | O211: MINAHAN | R211: WILKINSON
A212: DANDENONG | C212: WATERS | F212: LALOR | I212: STAUNTON | L212: PENNEFATHER | O212: THOMAS | R212: PETERS
A213: GOALKICKERS
A214: MORDIALLOC | C214: NISBET 4 | F214: RITCHIE 3 | I214: BAKER 2 | K214: WILKINSON | N214: MEADE | P214: PEARSON | R214: MINAHAN
A215: DANDENONG | C215: GILLINGHAM 3 | F215: WATERS 2 | I215: LALOR 2 | K215: THOMAS 2 | N215: GRAY
A217: COBURG | C217: 8 | D217: 2 | E217: =C217*6+D217 -> 50 | G217: 12 | H217: 9 | I217: =G217*6+H217 -> 81 | K217: 21 | L217: 11 | M217: =K217*6+L217 -> 137 | O217: 28 | P217: 15 | Q217: =O217*6+P217 -> 183 | S217: COBURG
A218: BRIGHTON | C218: 1 | D218: 4 | E218: =C218*6+D218 -> 10 | G218: 3 | H218: 8 | I218: =G218*6+H218 -> 26 | K218: 5 | L218: 11 | M218: =K218*6+L218 -> 41 | O218: 9 | P218: 15 | Q218: =O218*6+P218 -> 69 | S218: SCOTT
A219: BEST PLAYERS
A220: COBURG | C220: BIGELOW | F220: CARR | I220: WILSON | L220: JORDAN | O220: MATTHEWS | R220: SHORT
A221: BRIGHTON | C221: W COOPER | F221: BROWNING | I221: BURSEY | L221: ELDERING | O221: N COOPER | R221: BEGLEY
A222: GOALKICKERS
A223: COBURG | C223: CARR 5 | F223: FITZPATRICK 5 | J223: BIGELOW 4 | M223: BRENNAN 3 | P223: JORDAN 3 | R223: WILSON 3 | U223: BYRON 3 | X223: MATTHEWS | AA223: HOLT
A224: BRIGHTON | C224: BROWNING 2 | F224: TURNER 2 | I224: P COOPER 2 | L224: BURSEY | N224: N COOPER | Q224: BEGLEY
F225: 1ST MAY | J225: WEATHER | N225: WET
A226: YARRAVILLE | C226: 4 | D226: 6 | E226: =C226*6+D226 -> 30 | G226: 5 | H226: 8 | I226: =G226*6+H226 -> 38 | K226: 9 | L226: 17 | M226: =K226*6+L226 -> 71 | O226: 12 | P226: 19 | Q226: =O226*6+P226 -> 91 | S226: YARRAVILLE
A227: PORT MELBOURNE | C227: 1 | D227: 0 | E227: =C227*6+D227 -> 6 | G227: 4 | H227: 3 | I227: =G227*6+H227 -> 27 | K227: 4 | L227: 5 | M227: =K227*6+L227 -> 29 | O227: 5 | P227: 10 | Q227: =O227*6+P227 -> 40 | S227: O'DONOGHUE
A228: BEST PLAYERS
A229: YARRAVILLE | C229: CROOK | F229: PEARCE | I229: LETCHER | L229: LAMONT | O229: CAREY | R229: FLEMING
A230: PORT MELBOURNE | C230: HARRIS | F230: CLAXTON | I230: LEWIS | L230: COVENTRY | O230: McLEOD | R230: BOWEN
A231: GOALKICKERS
A232: YARRAVILLE | C232: CROOK 4 | F232: ANDERSON 2 | I232: LETCHER | K232: RON BROWN | N232: BURT | P232: CAREY | R232: BOURKE | U232: FLEMING
A233: PORT MELBOURNE | C233: CLAXTON 2 | F233: McLEOD | I233: LAWSON | K233: MERRETT
A235: BYE | C235: CAMBERWELL
A237: ROUND 4 | E237: 7TH MAY | I237: WEATHER | L237: STRONG NORTH WIND SHOWERS COLD | S237: PLAYED AT
D238: 1ST QTR | H238: 2ND QTR | L238: 3RD QTR | P238: FINAL | S238: MOORABBIN
A239: MOORABBIN | C239: 6 | D239: 3 | E239: =C239*6+D239 -> 39 | G239: 8 | H239: 5 | I239: =G239*6+H239 -> 53 | K239: 10 | L239: 9 | M239: =K239*6+L239 -> 69 | O239: 12 | P239: 10 | Q239: =O239*6+P239 -> 82 | S239: UMPIRE | X239: LADDER | AB239: ROUND | AD239: 4
A240: MORDIALLOC | C240: 0 | D240: 0 | E240: =C240*6+D240 -> 0 | G240: 5 | H240: 2 | I240: =G240*6+H240 -> 32 | K240: 7 | L240: 2 | M240: =K240*6+L240 -> 44 | O240: 10 | P240: 4 | Q240: =O240*6+P240 -> 64 | S240: O'DONOGHUE
A241: BEST PLAYERS | W241: TEAM | X241: W | Y241: L | Z241: D | AA241: FOR | AB241: AGST | AC241: % | AD241: PTS
A242: MOORABBIN | C242: MORONEY | F242: CLARK | I242: GILDER | L242: RYAN | N242: WHALEBONE | Q242: KANN
A243: MORDIALLOC | C243: BESANKO | F243: DULLARD | I243: MAUNDER | L243: LE DEUX | N243: SHEEHAN | Q243: RITCHIE | W243: SANDRINGHAM | X243: 4 | Y243: 0 | Z243: 0 | AA243: 481 | AB243: 195 | AC243: 246.67 | AD243: 16
A244: GOALKICKERS | W244: YARRAVILLE | X244: 4 | Y244: 0 | Z244: 0 | AA244: 320 | AB244: 162 | AC244: 197.53086419753086 | AD244: 16
A245: MOORABBIN | C245: RYAN 3 | E245: WHALEBONE 2 | H245: BUZZA 2 | J245: CRAMERI 2 | M245: PAPLEY | O245: MORONEY | Q245: MANIE | W245: COBURG | X245: 4 | Y245: 0 | Z245: 0 | AA245: 481 | AB245: 256 | AC245: 187.890625 | AD245: 16
A246: MORDIALLOC | C246: SHEEHAN 3 | F246: RITCHIE 3 | I246: NISBET | K246: BAKER | M246: MAUNDER | P246: KERR | W246: MORDIALLOC | X246: 3 | Y246: 1 | Z246: 0 | AA246: 366 | AB246: 240 | AC246: 152.5 | AD246: 12
W247: BRUNSWICK | X247: 3 | Y247: 1 | Z247: 0 | AA247: 357 | AB247: 266 | AC247: 134.21052631578948 | AD247: 12
A248: COBURG | C248: 1 | D248: 2 | E248: =C248*6+D248 -> 8 | G248: 7 | H248: 10 | I248: =G248*6+H248 -> 52 | K248: 8 | L248: 11 | M248: =K248*6+L248 -> 59 | O248: 14 | P248: 13 | Q248: =O248*6+P248 -> 97 | S248: SUNSHINE | W248: MOORABBIN | X248: 3 | Y248: 1 | Z248: 0 | AA248: 342 | AB248: 318 | AC248: 107.55 | AD248: 12
A249: SUNSHINE | C249: 2 | D249: 3 | E249: =C249*6+D249 -> 15 | G249: 2 | H249: 3 | I249: =G249*6+H249 -> 15 | K249: 4 | L249: 5 | M249: =K249*6+L249 -> 29 | O249: 7 | P249: 5 | Q249: =O249*6+P249 -> 47 | S249: BREWER
A250: BEST PLAYERS | W250: OAKLEIGH | X250: 2 | Y250: 1 | Z250: 0 | AA250: 266 | AB250: 198 | AC250: 134.34343434343435 | AD250: 8
A251: COBURG | C251: CARR | F251: WILSON | I251: HUNTINGTON | L251: KERR | N251: JORDAN | Q251: SHORT | W251: PORT MELBOURNE | X251: 2 | Y251: 2 | Z251: 0 | AA251: 352 | AB251: 285 | AC251: 123.50877192982456 | AD251: 8
A252: SUNSHINE | C252: PRESTON | F252: SAUNDERS | I252: CROSBIE | L252: TURNER | N252: FITZGERALD | Q252: STAFFORD | W252: WILLIAMSTOWN | X252: 2 | Y252: 2 | Z252: 0 | AA252: 310 | AB252: 262 | AC252: 118.32061068702291 | AD252: 8
A253: GOALKICKERS | W253: CAMBERWELL | X253: 2 | Y253: 1 | Z253: 0 | AA253: 191 | AB253: 204 | AC253: 93.627450980392155 | AD253: 8
A254: COBURG | C254: CARR 5 | F254: WILSON 4 | I254: BYRON 2 | K254: HOLCOMBE | N254: BRENNAN | Q254: YOUNG | W254: DANDENONG | X254: 1 | Y254: 3 | Z254: 0 | AA254: 255 | AB254: 299 | AC254: 85.284280936454849 | AD254: 4
A255: SUNSHINE | C255: HOLLAND 2 | F255: DIXON | H255: BRYSON | J255: TURNER | L255: KELLY | N255: SAID | W255: SUNSHINE | X255: 1 | Y255: 3 | Z255: 0 | AA255: 272 | AB255: 349 | AC255: 77.936962750716333 | AD255: 4
W256: NORTHCOTE | X256: 1 | Y256: 3 | Z256: 0 | AA256: 228 | AB256: 399 | AC256: 57.142857142857146 | AD256: 4
A257: PORT MELBOURNE | C257: 2 | D257: 3 | E257: =C257*6+D257 -> 15 | G257: 6 | H257: 9 | I257: =G257*6+H257 -> 45 | K257: 9 | L257: 11 | M257: =K257*6+L257 -> 65 | O257: 13 | P257: 20 | Q257: =O257*6+P257 -> 98 | S257: PORT MELBOURNE | W257: PRESTON | X257: 0 | Y257: 4 | Z257: 0 | AA257: 206 | AB257: 371 | AC257: 55.525606469002696 | AD257: 0
A258: PRAHRAN | C258: 2 | D258: 4 | E258: =C258*6+D258 -> 16 | G258: 2 | H258: 5 | I258: =G258*6+H258 -> 17 | K258: 3 | L258: 10 | M258: =K258*6+L258 -> 28 | O258: 3 | P258: 11 | Q258: =O258*6+P258 -> 29 | S258: HORNE | W258: PRAHRAN | X258: 0 | Y258: 3 | Z258: 0 | AA258: 160 | AB258: 287 | AC258: 55.75 | AD258: 0
A259: BEST PLAYERS | W259: BOX HILL | X259: 0 | Y259: 3 | Z259: 0 | AA259: 153 | AB259: 325 | AC259: 47.07692307692308 | AD259: 0
A260: PORT MELBOURNE | C260: McLEOD | F260: CAMERON | I260: CLAXTON | L260: FURNESS | O260: FREYER | Q260: MERRETT | W260: BRIGHTON | X260: 0 | Y260: 4 | Z260: 0 | AA260: 173 | AB260: 497 | AC260: 34.808853118712271 | AD260: 0
A261: PRAHRAN | C261: HARVEY | F261: ANDERSON | I261: HARRISON | L261: ROSS | O261: GEARY | Q261: ROSS JONES
A262: GOALKICKERS
A263: PORT MELBOURNE | C263: CLAXTON 4 | F263: BONNETT 4 | I263: McLEOD 2 | L263: O'TOOLE | N263: BOWEN | P263: FREYER
A264: PRAHRAN | C264: PEARSON 2 | F264: ROLLINGS
A266: DANDENONG | C266: 2 | D266: 7 | E266: =C266*6+D266 -> 19 | G266: 4 | H266: 7 | I266: =G266*6+H266 -> 31 | K266: 9 | L266: 11 | M266: =K266*6+L266 -> 65 | O266: 12 | P266: 11 | Q266: =O266*6+P266 -> 83 | S266: DANDENONG
A267: NORTHCOTE | C267: 0 | D267: 1 | E267: =C267*6+D267 -> 1 | G267: 0 | H267: 7 | I267: =G267*6+H267 -> 7 | K267: 1 | L267: 10 | M267: =K267*6+L267 -> 16 | O267: 1 | P267: 14 | Q267: =O267*6+P267 -> 20 | S267: BAIRD
A268: BEST PLAYERS
A269: DANDENONG | C269: WATERS | F269: PENNEFATHER | I269: THOMAS | L269: OSBORNE | O269: WILLIAMS | R269: TODD
A270: NORTHCOTE | C270: BRETHERTON | F270: DONEGAN | I270: VAINS | L270: GORMAN | O270: HOSKINGS | R270: LAVER
A271: GOALKICKERS
A272: DANDENONG | C272: WATERS 4 | F272: THOMAS 3 | I272: PETERS 3 | K272: OSBORNE | M272: WILLIAMS
A273: NORTHCOTE | C273: HOSKINGS
A275: CAMBERWELL | C275: 1 | D275: 2 | E275: =C275*6+D275 -> 8 | G275: 3 | H275: 5 | I275: =G275*6+H275 -> 23 | K275: 5 | L275: 8 | M275: =K275*6+L275 -> 38 | O275: 12 | P275: 11 | Q275: =O275*6+P275 -> 83 | S275: ELSTERNWICK PARK
A276: BRIGHTON | C276: 1 | D276: 4 | E276: =C276*6+D276 -> 10 | G276: 1 | H276: 6 | I276: =G276*6+H276 -> 12 | K276: 2 | L276: 7 | M276: =K276*6+L276 -> 19 | O276: 2 | P276: 9 | Q276: =O276*6+P276 -> 21 | S276: ALLEN
A277: BEST PLAYERS
A278: CAMBERWELL | C278: WHITTEN | F278: KENT | I278: JOHNSON | L278: COMMONS | O278: EADES | R278: LONDON
A279: BRIGHTON | C279: BURSEY | F279: CRAIG | I279: W COOPER | L279: THOMAS | O279: McCANN | R279: GRANT
A280: GOALKICKERS
A281: CAMBERWELL | C281: LONDON 4 | F281: COMMONS 2 | I281: KENT 2 | K281: EADES | M281: KILPATRICK | P281: QUIRK | R281: COLLETT
A282: BRIGHTON | C282: BURSEY | F282: P COOPER
A284: SANDRINGHAM | C284: 2 | D284: 6 | E284: =C284*6+D284 -> 18 | G284: 4 | H284: 11 | I284: =G284*6+H284 -> 35 | K284: 6 | L284: 15 | M284: =K284*6+L284 -> 51 | O284: 8 | P284: 18 | Q284: =O284*6+P284 -> 66 | S284: BOX HILL
A285: BOX HILL | C285: 0 | D285: 1 | E285: =C285*6+D285 -> 1 | G285: 3 | H285: 3 | I285: =G285*6+H285 -> 21 | K285: 4 | L285: 3 | M285: =K285*6+L285 -> 27 | O285: 6 | P285: 3 | Q285: =O285*6+P285 -> 39 | S285: TREWIN
A286: BEST PLAYERS
A287: SANDRINGHAM | C287: BOLAND | F287: RANSOM | I287: WEBSTER | L287: RASMUSSEN | O287: OAKLEY | R287: RICHARDS
A288: BOX HILL | C288: WITNISH | F288: LEHMANN | I288: WHITE | L288: DUMMELOW | O288: EADE | R288: RANDLES
A289: GOALKICKERS
A290: SANDRINGHAM | C290: OAKLEY 2 | F290: EVANS | H290: ALLSOP | J290: GLEESON | L290: WEBSTER | N290: VANCE | P290: RASMUSSEN
A291: BOX HILL | C291: WITNISH 2 | F291: SALVADO 2 | I291: BATES | K291: ROCHOW
B292: 8TH MAY | G292: WEATHER | J292: SOUTH WEST WIND
A293: BRUNSWICK | C293: 3 | D293: 1 | E293: =C293*6+D293 -> 19 | G293: 4 | H293: 1 | I293: =G293*6+H293 -> 25 | K293: 8 | L293: 1 | M293: =K293*6+L293 -> 49 | O293: 10 | P293: 2 | Q293: =O293*6+P293 -> 62 | S293: BRUNSWICK
A294: WILLIAMSTOWN | C294: 0 | D294: 2 | E294: =C294*6+D294 -> 2 | G294: 5 | H294: 9 | I294: =G294*6+H294 -> 39 | K294: 5 | L294: 10 | M294: =K294*6+L294 -> 40 | O294: 5 | P294: 16 | Q294: =O294*6+P294 -> 46 | S294: ROACH
A295: BEST PLAYERS
A296: BRUNSWICK | C296: MATTHEWS | F296: R DILLON | I296: VELO | K296: K DILLON | N296: McCORMACK | Q296: WHILEY
A297: WILLIAMSTOWN | C297: E BEITZEL | F297: WARD | I297: MURPHY | K297: MAZOURIS | N297: McASEY | Q297: MALONEY
A298: GOALKICKERS
A299: BRUNSWICK | C299: K DILLON 3 | F299: DEAS 2 | I299: MILLER 2 | L299: MATTHEWS 2 | O299: G STANLEY
A300: WILLIAMSTOWN | C300: CULLINAN | F300: McASEY | I300: MURPHY | K300: PELLY | M300: MAZOURIS
A302: YARRAVILLE | C302: 3 | D302: 5 | E302: =C302*6+D302 -> 23 | G302: 8 | H302: 5 | I302: =G302*6+H302 -> 53 | K302: 9 | L302: 8 | M302: =K302*6+L302 -> 62 | O302: 10 | P302: 11 | Q302: =O302*6+P302 -> 71 | S302: PRESTON
A303: PRESTON | C303: 0 | D303: 0 | E303: =C303*6+D303 -> 0 | G303: 2 | H303: 2 | I303: =G303*6+H303 -> 14 | K303: 2 | L303: 2 | M303: =K303*6+L303 -> 14 | O303: 4 | P303: 4 | Q303: =O303*6+P303 -> 28 | S303: SMITH
A304: BEST PLAYERS
A305: YARRAVILLE | C305: PEARCE | F305: LAMONT | I305: ORANGE | L305: ANDERSON | N305: CROOK | Q305: LETCHER
A306: PRESTON | C306: McLACHLAN | F306: LAMBIE | I306: SLATTERY | L306: JENSEN | N306: RATCLIFFE | Q306: HAUGHTON
A307: GOALKICKERS
A308: YARRAVILLE | C308: ANDERSON 4 | F308: RON BROWN 2 | I308: CAREY 2 | L308: BOURKE | N308: COLLINS
A309: PRESTON | C309: RATCLIFFE | F309: GRAY | H309: NELSON | K309: WILSON
A311: BYE | C311: OAKLEIGH
A313: ROUND 5 | E313: 14TH MAY | H313: WEATHER | J313: SOUTH WEST WIND HEAVY RAIN GROUNDS VERY BAD | S313: PLAYED AT
D314: 1ST QTR | H314: 2ND QTR | L314: 3RD QTR | P314: FINAL | S314: YARRAVILLE
A315: YARRAVILLE | C315: 6 | D315: 3 | E315: =C315*6+D315 -> 39 | G315: 8 | H315: 4 | I315: =G315*6+H315 -> 52 | K315: 10 | L315: 8 | M315: =K315*6+L315 -> 68 | O315: 11 | P315: 11 | Q315: =O315*6+P315 -> 77 | S315: UMPIRE | X315: LADDER | AB315: ROUND | AD315: 5
A316: BRUNSWICK | C316: 0 | D316: 2 | E316: =C316*6+D316 -> 2 | G316: 2 | H316: 3 | I316: =G316*6+H316 -> 15 | K316: 3 | L316: 4 | M316: =K316*6+L316 -> 22 | O316: 4 | P316: 6 | Q316: =O316*6+P316 -> 30 | S316: TREWIN
A317: BEST PLAYERS | W317: TEAM | X317: W | Y317: L | Z317: D | AA317: FOR | AB317: AGST | AC317: % | AD317: PTS
A318: YARRAVILLE | C318: LETCHER | F318: WILLIAMS | I318: BOB BROWN | L318: PEARCE | O318: CAREY | Q318: COOK
A319: BRUNSWICK | C319: G STANLEY | F319: R DILLON | I319: MILLER | L319: K DILLON | O319: WHITE | Q319: VELO | W319: YARRAVILLE | X319: 5 | Y319: 0 | Z319: 0 | AA319: 397 | AB319: 192 | AC319: 206.77083333333334 | AD319: 20
A320: GOALKICKERS | W320: COBURG | X320: 5 | Y320: 0 | Z320: 0 | AA320: 581 | AB320: 297 | AC320: 195.62289562289561 | AD320: 20
A321: YARRAVILLE | C321: McCARTHY 3 | F321: RON BROWN 3 | I321: ANDERSON 2 | L321: LETCHER | N321: MASON | P321: CAREY | R321: BARRETT | W321: SANDRINGHAM | X321: 4 | Y321: 1 | Z321: 0 | AA321: 515 | AB321: 236 | AC321: 218.22 | AD321: 16
A322: BRUNSWICK | C322: JARMAN | F322: TAYLOR | I322: K DILLON | K322: MATTHEWS | W322: MORDIALLOC | X322: 4 | Y322: 1 | Z322: 0 | AA322: 432 | AB322: 289 | AC322: 149.48 | AD322: 16
W323: MOORABBIN | X323: 4 | Y323: 1 | Z323: 0 | AA323: 409 | AB323: 376 | AC323: 108.78 | AD323: 16
A324: OAKLEIGH | C324: 4 | D324: 5 | E324: =C324*6+D324 -> 29 | G324: 4 | H324: 6 | I324: =G324*6+H324 -> 30 | K324: 5 | L324: 8 | M324: =K324*6+L324 -> 38 | O324: 5 | P324: 11 | Q324: =O324*6+P324 -> 41 | S324: BEACH ROAD | W324: OAKLEIGH | X324: 3 | Y324: 1 | Z324: 0 | AA324: 307 | AB324: 232 | AC324: 132.32758620689654 | AD324: 12
A325: SANDRINGHAM | C325: 1 | D325: 0 | E325: =C325*6+D325 -> 6 | G325: 3 | H325: 0 | I325: =G325*6+H325 -> 18 | K325: 3 | L325: 2 | M325: =K325*6+L325 -> 20 | O325: 5 | P325: 4 | Q325: =O325*6+P325 -> 34 | S325: O'DONOGHUE
A326: BEST PLAYERS | W326: PORT MELBOURNE | X326: 3 | Y326: 2 | Z326: 0 | AA326: 405 | AB326: 328 | AC326: 123.47560975609755 | AD326: 12
A327: OAKLEIGH | C327: CLEMENTS | F327: NAISMITH | I327: PRENDERGAST | L327: McCOOKE | O327: PEARCE | Q327: ALLSOP | W327: BRUNSWICK | X327: 3 | Y327: 2 | Z327: 0 | AA327: 387 | AB327: 343 | AC327: 112.82798833819243 | AD327: 12
A328: SANDRINGHAM | C328: WEBSTER | F328: RASMUUSEN | I328: JONES | L328: RICHARDS | O328: CROFT | Q328: WILLIAMS | W328: WILLIAMSTOWN | X328: 2 | Y328: 3 | Z328: 0 | AA328: 368 | AB328: 329 | AC328: 111.85410334346504 | AD328: 8
A329: GOALKICKERS | W329: DANDENONG | X329: 2 | Y329: 3 | Z329: 0 | AA329: 304 | AB329: 335 | AC329: 90.746268656716424 | AD329: 8
A330: OAKLEIGH | C330: ALLSOP 2 | F330: JONES | H330: CLEMENTS | K330: D'ARCY | W330: CAMBERWELL | X330: 2 | Y330: 2 | Z330: 0 | AA330: 227 | AB330: 253 | AC330: 89.723320158102766 | AD330: 8
A331: SANDRINGHAM | C331: RANSOM 2 | F331: VANCE | H331: WEBSTER | K331: WILLIAMS | W331: SUNSHINE | X331: 1 | Y331: 3 | Z331: 1 | AA331: 326 | AB331: 403 | AC331: 80.893300248138956 | AD331: 6
W332: NORTHCOTE | X332: 1 | Y332: 3 | Z332: 1 | AA332: 282 | AB332: 453 | AC332: 62.251655629139073 | AD332: 6
A333: MOORABBIN | C333: 3 | D333: 1 | E333: =C333*6+D333 -> 19 | G333: 4 | H333: 3 | I333: =G333*6+H333 -> 27 | K333: 8 | L333: 6 | M333: =K333*6+L333 -> 54 | O333: 10 | P333: 7 | Q333: =O333*6+P333 -> 67 | S333: WILLIAMSTOWN | W333: PRESTON | X333: 0 | Y333: 5 | Z333: 0 | AA333: 249 | AB333: 424 | AC333: 58.726415094339622 | AD333: 0
A334: WILLIAMSTOWN | C334: 0 | D334: 1 | E334: =C334*6+D334 -> 1 | G334: 6 | H334: 8 | I334: =G334*6+H334 -> 44 | K334: 7 | L334: 8 | M334: =K334*6+L334 -> 50 | O334: 8 | P334: 10 | Q334: =O334*6+P334 -> 58 | S334: POLLARD | W334: BOX HILL | X334: 0 | Y334: 4 | Z334: 0 | AA334: 202 | AB334: 391 | AC334: 51.662404092071611 | AD334: 0
A335: BEST PLAYERS | W335: PRAHRAN | X335: 0 | Y335: 4 | Z335: 0 | AA335: 201 | AB335: 387 | AC335: 51.94 | AD335: 0
A336: MOORABBIN | C336: MORONEY | F336: WHALEBONE | I336: HOGAN | L336: RYAN | O336: CLARK | Q336: MILLS | W336: BRIGHTON | X336: 0 | Y336: 4 | Z336: 0 | AA336: 173 | AB336: 497 | AC336: 34.808853118712271 | AD336: 0
A337: WILLIAMSTOWN | C337: BOB JONES | F337: WARD | I337: McASEY | L337: MALONEY | O337: PELLY | Q337: COLLINS
A338: GOALKICKERS
A339: MOORABBIN | C339: RYAN 3 | F339: HOGAN 2 | I339: CRAMERI 2 | L339: PAPLEY | N339: MORONEY | Q339: TREZISE
A340: WILLIAMSTOWN | C340: MURPHY 2 | F340: PELLY 2 | I340: MALONEY 2 | L340: McASEY | N340: WARD
A342: DANDENONG | C342: 1 | D342: 0 | E342: =C342*6+D342 -> 6 | G342: 2 | H342: 6 | I342: =G342*6+H342 -> 18 | K342: 4 | L342: 11 | M342: =K342*6+L342 -> 35 | O342: 6 | P342: 13 | Q342: =O342*6+P342 -> 49 | S342: CAMBERWELL
A343: CAMBERWELL | C343: 1 | D343: 2 | E343: =C343*6+D343 -> 8 | G343: 3 | H343: 3 | I343: =G343*6+H343 -> 21 | K343: 4 | L343: 6 | M343: =K343*6+L343 -> 30 | O343: 5 | P343: 6 | Q343: =O343*6+P343 -> 36 | S343: SMITH
A344: BEST PLAYERS
A345: DANDENONG | C345: THOMAS | F345: HOWER | I345: PENNEFATHER | L345: OSBORNE | O345: WATERS | Q345: STANTON
A346: CAMBERWELL | C346: WHITTEN | F346: EADES | I346: SKALBERG | L346: COMMONS | O346: B ELLIS | Q346: K JOHNSON
A347: GOALKICKERS
A348: DANDENONG | C348: OSBORNE 2 | F348: WILLIAMS 2 | I348: PRESTON | L348: PETERS
A349: CAMBERWELL | C349: COMMONS 2 | F349: KENT | I349: EADES | K349: LONDON
A351: PORT MELBOURNE | C351: 3 | D351: 2 | E351: =C351*6+D351 -> 20 | G351: 4 | H351: 6 | I351: =G351*6+H351 -> 30 | K351: 6 | L351: 8 | M351: =K351*6+L351 -> 44 | O351: 7 | P351: 11 | Q351: =O351*6+P351 -> 53 | S351: PORT MELBOURNE
A352: PRESTON | C352: 1 | D352: 1 | E352: =C352*6+D352 -> 7 | G352: 3 | H352: 3 | I352: =G352*6+H352 -> 21 | K352: 5 | L352: 4 | M352: =K352*6+L352 -> 34 | O352: 6 | P352: 7 | Q352: =O352*6+P352 -> 43 | S352: ALLEN
A353: BEST PLAYERS
A354: PORT MELBOURNE | C354: FREYER | F354: LAWSON | I354: TUCKER | L354: COVENTRY | O354: McLEOD | R354: CAMERON
A355: PRESTON | C355: SLATTERY | F355: HOWARD | I355: WALKER | L355: HAUGHTON | O355: McLACHLAN | R355: JENSEN
A356: GOALKICKERS
A357: PORT MELBOURNE | C357: BONNETT 2 | F357: LAWSON 2 | I357: McLEOD | K357: FREYER | M357: BOWEN
A358: PRESTON | C358: GILBERT 2 | F358: WALSH 2 | I358: LAMBIE | K358: GRAY
A360: COBURG | C360: 3 | D360: 2 | E360: =C360*6+D360 -> 20 | G360: 9 | H360: 7 | I360: =G360*6+H360 -> 61 | K360: 11 | L360: 8 | M360: =K360*6+L360 -> 74 | O360: 15 | P360: 10 | Q360: =O360*6+P360 -> 100 | S360: TOORAK PARK
A361: PRAHRAN | C361: 4 | D361: 1 | E361: =C361*6+D361 -> 25 | G361: 4 | H361: 2 | I361: =G361*6+H361 -> 26 | K361: 6 | L361: 4 | M361: =K361*6+L361 -> 40 | O361: 6 | P361: 5 | Q361: =O361*6+P361 -> 41 | S361: ROACH
A362: BEST PLAYERS
A363: COBURG | C363: CARR | F363: JORDAN | I363: YOUNG | L363: BYRON | O363: SMITH | Q363: CLARKSON
A364: PRAHRAN | C364: ROSS | F364: ROSS JONES | I364: HARVEY | L364: ROLLINGS | O364: MURRAY | Q364: HOWE
A365: GOALKICKERS
A366: COBURG | C366: CARR 5 | F366: BYRON 5 | I366: WILSON 2 | L366: JORDAN | N366: HUNTINGTON | Q366: MATTHEWS
A367: PRAHRAN | C367: MUIR 2 | F367: ROSS | H367: LEWIS | J367: PEARSON | M367: GEARY
A369: MORDIALLOC | C369: 2 | D369: 2 | E369: =C369*6+D369 -> 14 | G369: 4 | H369: 8 | I369: =G369*6+H369 -> 32 | K369: 7 | L369: 9 | M369: =K369*6+L369 -> 51 | O369: 9 | P369: 12 | Q369: =O369*6+P369 -> 66 | S369: MORDIALLOC
A370: BOX HILL | C370: 2 | D370: 2 | E370: =C370*6+D370 -> 14 | G370: 3 | H370: 3 | I370: =G370*6+H370 -> 21 | K370: 6 | L370: 5 | M370: =K370*6+L370 -> 41 | O370: 7 | P370: 7 | Q370: =O370*6+P370 -> 49 | S370: MILLER
A371: BEST PLAYERS
A372: MORDIALLOC | C372: CRANE | F372: WILKINSON | I372: MAUNDER | L372: KAVANAGH | O372: SHEEHAN | R372: NISBET
A373: BOX HILL | C373: WHITE | F373: EADE | I373: SALVADO | L373: WITNISH | O373: GRAY | R373: BATES
A374: GOALKICKERS
A375: MORDIALLOC | C375: KAVANAGH 2 | F375: SHEEHAN 2 | I375: MINAHAN 2 | L375: WILKINSON | O375: NISBET | Q375: BESANKO
A376: BOX HILL | C376: SALVADO 3 | F376: DEAN | H376: WITNISH | J376: WHITE | M376: EADE
D377: 15TH MAY
A378: NORTHCOTE | C378: 2 | D378: 11 | E378: =C378*6+D378 -> 23 | G378: 2 | H378: 13 | I378: =G378*6+H378 -> 25 | K378: 6 | L378: 17 | M378: =K378*6+L378 -> 53 | O378: 6 | P378: 18 | Q378: =O378*6+P378 -> 54 | S378: NORTHCOTE
A379: SUNSHINE | C379: 0 | D379: 3 | E379: =C379*6+D379 -> 3 | G379: 2 | H379: 4 | I379: =G379*6+H379 -> 16 | K379: 4 | L379: 7 | M379: =K379*6+L379 -> 31 | O379: 7 | P379: 12 | Q379: =O379*6+P379 -> 54 | S379: HORNE
A380: BEST PLAYERS
A381: NORTHCOTE | C381: HICKS | F381: VAINS | I381: DONEGAN | L381: SHAW | O381: BRETHERTON | R381: LAVER
A382: SUNSHINE | C382: FITZGERALD | F382: CROSBIE | I382: WARREN | L382: SAID | O382: KEMP | R382: KELLY
A383: GOALKICKERS
A384: NORTHCOTE | C384: HICKS 2 | F384: SHAW 2 | I384: WIGNELL | L384: MORAN
A385: SUNSHINE | C385: KELLY 3 | F385: SAID 2 | I385: DICKSON | L385: WARREN
A387: BYE | C387: BRIGHTON
A389: ROUND 6 | E389: 21ST MAY | I389: WEATHER | K389: SOUTH WEST WIND RAIN COLD GROUNDS BAD | S389: PLAYED AT
D390: 1ST QTR | H390: 2ND QTR | L390: 3RD QTR | P390: FINAL | S390: CAMBERWELL
A391: OAKLEIGH | C391: 2 | D391: 1 | E391: =C391*6+D391 -> 13 | G391: 6 | H391: 2 | I391: =G391*6+H391 -> 38 | K391: 6 | L391: 3 | M391: =K391*6+L391 -> 39 | O391: 8 | P391: 9 | Q391: =O391*6+P391 -> 57 | S391: UMPIRE | X391: LADDER | AB391: ROUND | AD391: 6
A392: MORDIALLOC | C392: 3 | D392: 4 | E392: =C392*6+D392 -> 22 | G392: 5 | H392: 8 | I392: =G392*6+H392 -> 38 | K392: 7 | L392: 11 | M392: =K392*6+L392 -> 53 | O392: 7 | P392: 11 | Q392: =O392*6+P392 -> 53 | S392: ROACH
A393: BEST PLAYERS | W393: TEAM | X393: W | Y393: L | Z393: D | AA393: FOR | AB393: AGST | AC393: % | AD393: PTS
A394: OAKLEIGH | C394: COUGHLAN | F394: PRENDERGAST | I394: ALLSOP | L394: D'ARCY | N394: COLLINS | Q394: McCOOKE
A395: MORDIALLOC | C395: DULLARD | F395: LE DEUX | I395: CRANE | L395: SHEEHAN | N395: JAMIESON | Q395: MINAHAN | W395: COBURG | X395: 6 | Y395: 0 | Z395: 0 | AA395: 647 | AB395: 319 | AC395: 202.82131661442006 | AD395: 24
A396: GOALKICKERS | W396: YARRAVILLE | X396: 5 | Y396: 1 | Z396: 0 | AA396: 450 | AB396: 261 | AC396: 172.41379310344828 | AD396: 20
A397: OAKLEIGH | C397: COLLINS 3 | F397: PANNAM 2 | I397: HALL | K397: COUGHLAN | N397: ALLSOP | W397: MOORABBIN | X397: 5 | Y397: 1 | Z397: 0 | AA397: 501 | AB397: 411 | AC397: 121.9 | AD397: 20
A398: MORDIALLOC | C398: BAKER 2 | F398: SHEEHAN 2 | I398: WILKINSON | L398: NISBET | N398: MAUNDER | W398: SANDRINGHAM | X398: 4 | Y398: 1 | Z398: 0 | AA398: 515 | AB398: 236 | AC398: 218.22 | AD398: 16
W399: MORDIALLOC | X399: 4 | Y399: 2 | Z399: 0 | AA399: 485 | AB399: 346 | AC399: 140.17 | AD399: 16
A400: MOORABBIN | C400: 2 | D400: 2 | E400: =C400*6+D400 -> 14 | G400: 9 | H400: 9 | I400: =G400*6+H400 -> 63 | K400: 9 | L400: 11 | M400: =K400*6+L400 -> 65 | O400: 13 | P400: 14 | Q400: =O400*6+P400 -> 92 | S400: MOORABBIN | W400: OAKLEIGH | X400: 4 | Y400: 1 | Z400: 0 | AA400: 364 | AB400: 285 | AC400: 127.71929824561404 | AD400: 16
A401: CAMBERWELL | C401: 1 | D401: 2 | E401: =C401*6+D401 -> 8 | G401: 2 | H401: 2 | I401: =G401*6+H401 -> 14 | K401: 5 | L401: 5 | M401: =K401*6+L401 -> 35 | O401: 5 | P401: 5 | Q401: =O401*6+P401 -> 35 | S401: BREWER
A402: BEST PLAYERS | W402: BRUNSWICK | X402: 4 | Y402: 2 | Z402: 0 | AA402: 440 | AB402: 361 | AC402: 121.88365650969529 | AD402: 16
A403: MOORABBIN | C403: MORONEY | F403: PAPLEY | I403: HIRST | L403: WHALEBONE | O403: MANIE | Q403: MILLS | W403: WILLIAMSTOWN | X403: 3 | Y403: 3 | Z403: 0 | AA403: 455 | AB403: 346 | AC403: 131.50289017341041 | AD403: 12
A404: CAMBERWELL | C404: SKALBERG | F404: EADES | I404: FREYBERG | L404: KENT | O404: B ELLIS | Q404: BAILEY | W404: PORT MELBOURNE | X404: 3 | Y404: 3 | Z404: 0 | AA404: 423 | AB404: 381 | AC404: 111.02362204724409 | AD404: 12
A405: GOALKICKERS | W405: DANDENONG | X405: 3 | Y405: 3 | Z405: 0 | AA405: 412 | AB405: 396 | AC405: 104.04040404040404 | AD405: 12
A406: MOORABBIN | C406: MORONEY 4 | F406: HIRST 2 | H406: WHALEBONE 2 | K406: MANIE 2 | M406: CRAMERI | O406: PAPLEY | Q406: BUZZA | W406: CAMBERWELL | X406: 2 | Y406: 3 | Z406: 0 | AA406: 262 | AB406: 345 | AC406: 75.94202898550725 | AD406: 8
A407: CAMBERWELL | C407: LONDON 2 | F407: GIBSON | H407: COMMONS | K407: QUIRK | W407: SUNSHINE | X407: 1 | Y407: 4 | Z407: 1 | AA407: 343 | AB407: 490 | AC407: 70 | AD407: 6
W408: NORTHCOTE | X408: 1 | Y408: 4 | Z408: 1 | AA408: 304 | AB408: 519 | AC408: 58.574181117533719 | AD408: 6
A409: WILLIAMSTOWN | C409: 1 | D409: 3 | E409: =C409*6+D409 -> 9 | G409: 7 | H409: 5 | I409: =G409*6+H409 -> 47 | K409: 11 | L409: 7 | M409: =K409*6+L409 -> 73 | O409: 13 | P409: 9 | Q409: =O409*6+P409 -> 87 | S409: SUNSHINE | W409: PRESTON | X409: 1 | Y409: 5 | Z409: 0 | AA409: 313 | AB409: 455 | AC409: 68.791208791208788 | AD409: 4
A410: SUNSHINE | C410: 1 | D410: 2 | E410: =C410*6+D410 -> 8 | G410: 2 | H410: 2 | I410: =G410*6+H410 -> 14 | K410: 2 | L410: 4 | M410: =K410*6+L410 -> 16 | O410: 2 | P410: 5 | Q410: =O410*6+P410 -> 17 | S410: SMITH | W410: BOX HILL | X410: 1 | Y410: 4 | Z410: 0 | AA410: 271 | AB410: 444 | AC410: 61.036036036036037 | AD410: 4
A411: BEST PLAYERS | W411: PRAHRAN | X411: 0 | Y411: 5 | Z411: 0 | AA411: 232 | AB411: 451 | AC411: 51.44 | AD411: 0
A412: WILLIAMSTOWN | C412: PELLY | F412: McASEY | I412: E BEITZEL | L412: COLLINS | O412: MALONEY | R412: WARD | W412: BRIGHTON | X412: 0 | Y412: 5 | Z412: 0 | AA412: 234 | AB412: 605 | AC412: 38.67768595041322 | AD412: 0
A413: SUNSHINE | C413: STAFFORD | F413: BARCLAY | I413: I KEMP | L413: E JEPSON | O413: N KEMP | R413: KELLY
A414: GOALKICKERS
A415: WILLIAMSTOWN | C415: McASEY 4 | F415: EVANS 2 | I415: PELLY 2 | K415: WARD 2 | M415: MURPHY 2 | P415: MALONEY
A416: SUNSHINE | C416: KELLY 2
A418: PRESTON | C418: 4 | D418: 5 | E418: =C418*6+D418 -> 29 | G418: 4 | H418: 8 | I418: =G418*6+H418 -> 32 | K418: 6 | L418: 14 | M418: =K418*6+L418 -> 50 | O418: 8 | P418: 16 | Q418: =O418*6+P418 -> 64 | S418: PRESTON
A419: PRAHRAN | C419: 0 | D419: 0 | E419: =C419*6+D419 -> 0 | G419: 3 | H419: 3 | I419: =G419*6+H419 -> 21 | K419: 4 | L419: 3 | M419: =K419*6+L419 -> 27 | O419: 4 | P419: 7 | Q419: =O419*6+P419 -> 31 | S419: O'DONOGHUE
A420: BEST PLAYERS
A421: PRESTON | C421: SLATTERY | F421: LAMBIE | I421: HAUGHTON | L421: MILLER | O421: McDONNELL | R421: WALSH
A422: PRAHRAN | C422: BOYD | F422: ROLLINGS | I422: ROSS | L422: O'BRIEN | O422: HARVEY | R422: SEEDY
A423: GOALKICKERS
A424: PRESTON | C424: HOWARD 2 | F424: DAVIS | H424: GRAY | J424: McDONNELL | M424: GILBERT | O424: HAUGHTON | R424: LAMBIE
A425: PRAHRAN | C425: PEARSON 2 | F425: BOYD | H425: ROSS
A427: DANDENONG | C427: 8 | D427: 5 | E427: =C427*6+D427 -> 53 | G427: 9 | H427: 10 | I427: =G427*6+H427 -> 64 | K427: 13 | L427: 14 | M427: =K427*6+L427 -> 92 | O427: 15 | P427: 18 | Q427: =O427*6+P427 -> 108 | S427: DANDENONG
A428: BRIGHTON | C428: 2 | D428: 0 | E428: =C428*6+D428 -> 12 | G428: 7 | H428: 3 | I428: =G428*6+H428 -> 45 | K428: 7 | L428: 8 | M428: =K428*6+L428 -> 50 | O428: 8 | P428: 13 | Q428: =O428*6+P428 -> 61 | S428: ROWE
A429: BEST PLAYERS
A430: DANDENONG | C430: TODD | F430: CROSBIE | I430: PENNEFATHER | L430: HOWER | O430: WATERS | R430: THOMAS
A431: BRIGHTON | C431: McCANN | F431: BROWNING | I431: W COOPER | L431: WILLIAMS | O431: BURSEY | R431: MOULE
A432: GOALKICKERS
A433: DANDENONG | C433: CROSBIE 5 | F433: THOMAS 3 | I433: WATERS 3 | L433: WILLIAMS 2 | O433: TODD | Q433: PETERS
A434: BRIGHTON | C434: BROWNING 4 | F434: BEGLEY 2 | I434: BURSEY | K434: HOWELL
A436: COBURG | C436: 3 | D436: 5 | E436: =C436*6+D436 -> 23 | G436: 3 | H436: 8 | I436: =G436*6+H436 -> 26 | K436: 7 | L436: 12 | M436: =K436*6+L436 -> 54 | O436: 8 | P436: 18 | Q436: =O436*6+P436 -> 66 | S436: COBURG
A437: NORTHCOTE | C437: 1 | D437: 1 | E437: =C437*6+D437 -> 7 | G437: 2 | H437: 8 | I437: =G437*6+H437 -> 20 | K437: 2 | L437: 9 | M437: =K437*6+L437 -> 21 | O437: 2 | P437: 10 | Q437: =O437*6+P437 -> 22 | S437: MILLER
A438: BEST PLAYERS
A439: COBURG | C439: SHAW | F439: CARR | I439: SHORT | K439: JORDAN | N439: BIGELOW | Q439: HUNTINGTON
A440: NORTHCOTE | C440: WRIGHT | F440: MORAN | I440: HICKS | K440: BRETHERTON | N440: VAINS | Q440: DONEGAN
A441: GOALKICKERS
A442: COBURG | C442: SHAW 3 | F442: BIGELOW 2 | I442: JORDAN | K442: HUNTINGTON | N442: CARR
A443: NORTHCOTE | C443: MORAN | F443: HICKS
A445: BOX HILL | C445: 1 | D445: 1 | E445: =C445*6+D445 -> 7 | G445: 3 | H445: 2 | I445: =G445*6+H445 -> 20 | K445: 4 | L445: 3 | M445: =K445*6+L445 -> 27 | O445: 10 | P445: 9 | Q445: =O445*6+P445 -> 69 | S445: BOX HILL
A446: YARRAVILLE | C446: 3 | D446: 3 | E446: =C446*6+D446 -> 21 | G446: 5 | H446: 5 | I446: =G446*6+H446 -> 35 | K446: 6 | L446: 9 | M446: =K446*6+L446 -> 45 | O446: 7 | P446: 11 | Q446: =O446*6+P446 -> 53 | S446: HORNE
A447: BEST PLAYERS
A448: BOX HILL | C448: BROWN | E448: BATES | H448: ROCHOW | K448: WITTNER | N448: WRIGHT | Q448: CRAIG
A449: YARRAVILLE | C449: CROOK | E449: CAREY | H449: McCABE | K449: McTAGGART | N449: MASON | Q449: RON BROWN
A450: GOALKICKERS
A451: BOX HILL | C451: GRAY 3 | F451: BEASY 2 | I451: SALVADO | K451: WHITE | M451: MACE | O451: BATES | Q451: BROWN
A452: YARRAVILLE | C452: CROOK 3 | F452: RON BROWN 2 | J452: McCARTHY | M452: CAREY
C453: 22ND MAY
A454: BRUNSWICK | C454: 1 | D454: 3 | E454: =C454*6+D454 -> 9 | G454: 5 | H454: 8 | I454: =G454*6+H454 -> 38 | K454: 7 | L454: 10 | M454: =K454*6+L454 -> 52 | O454: 7 | P454: 11 | Q454: =O454*6+P454 -> 53 | S454: BRUNSWICK
A455: PORT MELBOURNE | C455: 1 | D455: 1 | E455: =C455*6+D455 -> 7 | G455: 1 | H455: 1 | I455: =G455*6+H455 -> 7 | K455: 1 | L455: 3 | M455: =K455*6+L455 -> 9 | O455: 2 | P455: 6 | Q455: =O455*6+P455 -> 18 | S455: POLLARD
A456: BEST PLAYERS
A457: BRUNSWICK | C457: R DILLON | F457: K DILLON | I457: G STANLEY | L457: EDWARDS | O457: McCORMACK | R457: GREER
A458: PORT MELBOURNE | C458: FREYER | F458: COVENTRY | I458: CAMERON | L458: LEWIS | O458: CLAXTON | R458: OUSLEY
A459: GOALKICKERS
A460: BRUNSWICK | C460: K DILLON 4 | F460: AMBROSE | I460: G STANLEY | L460: DENTON
A461: PORT MELBOURNE | C461: FITZGERALD | F461: BONNETT
A463: BYE | C463: SANDRINGHAM
A465: ROUND 7 | E465: 28TH MAY | J465: WEATHER | M465: STRONG NORTH WEST WIND | S465: PLAYED AT
D466: 1ST QTR | H466: 2ND QTR | L466: 3RD QTR | P466: FINAL | S466: MORDIALLOC
A467: MORDIALLOC | C467: 7 | D467: 0 | E467: =C467*6+D467 -> 42 | G467: 8 | H467: 0 | I467: =G467*6+H467 -> 48 | K467: 12 | L467: 3 | M467: =K467*6+L467 -> 75 | O467: 15 | P467: 5 | Q467: =O467*6+P467 -> 95 | S467: UMPIRE | X467: LADDER | AB467: ROUND | AD467: 7
A468: SANDRINGHAM | C468: 1 | D468: 4 | E468: =C468*6+D468 -> 10 | G468: 7 | H468: 10 | I468: =G468*6+H468 -> 52 | K468: 8 | L468: 12 | M468: =K468*6+L468 -> 60 | O468: 11 | P468: 21 | Q468: =O468*6+P468 -> 87 | S468: POLLARD
A469: BEST PLAYERS | W469: TEAM | X469: W | Y469: L | Z469: D | AA469: FOR | AB469: AGST | AC469: % | AD469: PTS
A470: MORDIALLOC | C470: BESANKO | F470: RITCHIE | I470: JOSE | L470: WILKINSON | O470: SHEEHAN | Q470: MEADE
A471: SANDRINGHAM | C471: McKENZIE | F471: JONES | I471: WEBSTER | L471: RANSOM | O471: CROFT | Q471: ALLSOPP | W471: COBURG | X471: 6 | Y471: 1 | Z471: 0 | AA471: 722 | AB471: 396 | AC471: 182.32323232323233 | AD471: 24
A472: GOALKICKERS | W472: YARRAVILLE | X472: 6 | Y472: 1 | Z472: 0 | AA472: 586 | AB472: 328 | AC472: 178.65853658536585 | AD472: 24
A473: MORDIALLOC | C473: BAKER 4 | F473: BESANKO 3 | I473: SHEEAHN 3 | L473: NISBET 2 | N473: KERR | P473: ROBERTS | R473: WILKINSON | W473: MOORABBIN | X473: 6 | Y473: 1 | Z473: 0 | AA473: 665 | AB473: 454 | AC473: 146.48 | AD473: 24
A474: SANDRINGHAM | C474: ALLSOPP 3 | F474: WEBSTER 3 | I474: OAKLEY 2 | L474: EVANS | N474: GLEESON | P474: MURRAY | W474: MORDIALLOC | X474: 5 | Y474: 2 | Z474: 0 | AA474: 580 | AB474: 433 | AC474: 133.95 | AD474: 20
W475: SANDRINGHAM | X475: 4 | Y475: 2 | Z475: 0 | AA475: 602 | AB475: 331 | AC475: 181.87 | AD475: 16
A476: WILLIAMSTOWN | C476: 2 | D476: 3 | E476: =C476*6+D476 -> 15 | G476: 5 | H476: 6 | I476: =G476*6+H476 -> 36 | K476: 6 | L476: 7 | M476: =K476*6+L476 -> 43 | O476: 11 | P476: 11 | Q476: =O476*6+P476 -> 77 | S476: WILLIAMSTOWN | W476: WILLIAMSTOWN | X476: 4 | Y476: 3 | Z476: 0 | AA476: 532 | AB476: 421 | AC476: 126.36579572446556 | AD476: 16
A477: COBURG | C477: 4 | D477: 2 | E477: =C477*6+D477 -> 26 | G477: 5 | H477: 2 | I477: =G477*6+H477 -> 32 | K477: 12 | L477: 3 | M477: =K477*6+L477 -> 75 | O477: 12 | P477: 3 | Q477: =O477*6+P477 -> 75 | S477: BREWER
A478: BEST PLAYERS | W478: OAKLEIGH | X478: 4 | Y478: 2 | Z478: 0 | AA478: 420 | AB478: 352 | AC478: 119.31818181818181 | AD478: 16
A479: WILLIAMSTOWN | C479: CARMICHAEL | F479: MALONEY | I479: SMITH | K479: O'CONNOR | N479: PELLY | Q479: E BEITZEL | W479: BRUNSWICK | X479: 4 | Y479: 3 | Z479: 0 | AA479: 505 | AB479: 434 | AC479: 116.3594470046083 | AD479: 16
A480: COBURG | C480: JORDAN | F480: SHAW | I480: HINKS | K480: SMITH | N480: HUNTINGTON | Q480: SHORT | W480: PORT MELBOURNE | X480: 4 | Y480: 3 | Z480: 0 | AA480: 490 | AB480: 437 | AC480: 112.12814645308924 | AD480: 16
A481: GOALKICKERS | W481: DANDENONG | X481: 3 | Y481: 3 | Z481: 0 | AA481: 412 | AB481: 396 | AC481: 104.04040404040404 | AD481: 12
A482: WILLIAMSTOWN | C482: WARD 3 | F482: MALONEY 2 | I482: O'CONNOR 2 | L482: B BEITZEL | N482: McASEY | P482: PELLY | R482: CLOUGH | W482: NORTHCOTE | X482: 2 | Y482: 4 | Z482: 1 | AA482: 422 | AB482: 608 | AC482: 69.40789473684211 | AD482: 10
A483: COBURG | C483: BYRON 4 | F483: JORDAN 3 | I483: STANBOROUGH 2 | M483: CARR | O483: WILSON | Q483: HOOGEN | W483: CAMBERWELL | X483: 2 | Y483: 4 | Z483: 0 | AA483: 340 | AB483: 430 | AC483: 79.069767441860463 | AD483: 8
W484: PRESTON | X484: 2 | Y484: 5 | Z484: 0 | AA484: 386 | AB484: 520 | AC484: 74.230769230769226 | AD484: 8
A485: PORT MELBOURNE | C485: 3 | D485: 0 | E485: =C485*6+D485 -> 18 | G485: 6 | H485: 3 | I485: =G485*6+H485 -> 39 | K485: 7 | L485: 5 | M485: =K485*6+L485 -> 47 | O485: 10 | P485: 7 | Q485: =O485*6+P485 -> 67 | S485: PORT MELBOURNE | W485: BOX HILL | X485: 2 | Y485: 4 | Z485: 0 | AA485: 356 | AB485: 522 | AC485: 68.199233716475092 | AD485: 8
A486: OAKLEIGH | C486: 2 | D486: 3 | E486: =C486*6+D486 -> 15 | G486: 3 | H486: 5 | I486: =G486*6+H486 -> 23 | K486: 6 | L486: 10 | M486: =K486*6+L486 -> 46 | O486: 7 | P486: 14 | Q486: =O486*6+P486 -> 56 | S486: ROWE | W486: SUNSHINE | X486: 1 | Y486: 5 | Z486: 1 | AA486: 410 | AB486: 626 | AC486: 65.495207667731634 | AD486: 6
A487: BEST PLAYERS | W487: PRAHRAN | X487: 0 | Y487: 6 | Z487: 0 | AA487: 321 | AB487: 569 | AC487: 56.41 | AD487: 0
A488: PORT MELBOURNE | C488: LEWIS | F488: COVENTRY | I488: FREYER | L488: CAMERON | O488: FITZGERALD | R488: McLEOD | W488: BRIGHTON | X488: 0 | Y488: 6 | Z488: 0 | AA488: 277 | AB488: 769 | AC488: 36.020806241872563 | AD488: 0
A489: OAKLEIGH | C489: NAISMITH | F489: ALLSOP | I489: PANNAM | L489: JONES | O489: ASH | R489: PEAKE
A490: GOALKICKERS
A491: PORT MELBOURNE | C491: BONNETT 4 | F491: McLEOD 2 | I491: MONKS | K491: FREYER | M491: FITZGERALD | P491: OUSLEY
A492: OAKLEIGH | C492: PANNAM 2 | F492: JONES 2 | I492: ALLSOP | K492: McKEOGH | M492: HALL
A494: NORTHCOTE | C494: 2 | D494: 6 | E494: =C494*6+D494 -> 18 | G494: 6 | H494: 11 | I494: =G494*6+H494 -> 47 | K494: 11 | L494: 20 | M494: =K494*6+L494 -> 86 | O494: 16 | P494: 22 | Q494: =O494*6+P494 -> 118 | S494: TOORAK PARK
A495: PRAHRAN | C495: 4 | D495: 5 | E495: =C495*6+D495 -> 29 | G495: 7 | H495: 7 | I495: =G495*6+H495 -> 49 | K495: 8 | L495: 7 | M495: =K495*6+L495 -> 55 | O495: 13 | P495: 11 | Q495: =O495*6+P495 -> 89 | S495: SMITH
A496: BEST PLAYERS
A497: NORTHCOTE | C497: HICKS | F497: WRIGHT | I497: BRETHERTON | L497: HOSKINGS | O497: MORAN | Q497: AGHAN
A498: PRAHRAN | C498: PEARSON | F498: HART | I498: ROSS JONES | L498: HARRISON | O498: MURRAY | Q498: ROY JONES
A499: GOALKICKERS
A500: NORTHCOTE | C500: MORAN 4 | F500: HOSKINGS 4 | I500: HICKS 4 | K500: LAVER | M500: MALING | O500: KELLY | Q500: AGHAN
A501: PRAHRAN | C501: PEARSON 4 | F501: MURRAY 3 | I501: MUIR 3 | K501: HART 2 | M501: VURLOW
A503: BOX HILL | C503: 0 | D503: 1 | E503: =C503*6+D503 -> 1 | G503: 6 | H503: 7 | I503: =G503*6+H503 -> 43 | K503: 6 | L503: 10 | M503: =K503*6+L503 -> 46 | O503: 12 | P503: 13 | Q503: =O503*6+P503 -> 85 | S503: NORTHCOTE
A504: CAMBERWELL | C504: 5 | D504: 7 | E504: =C504*6+D504 -> 37 | G504: 7 | H504: 7 | I504: =G504*6+H504 -> 49 | K504: 10 | L504: 12 | M504: =K504*6+L504 -> 72 | O504: 11 | P504: 12 | Q504: =O504*6+P504 -> 78 | S504: ROACH
A505: BEST PLAYERS
A506: BOX HILL | C506: MACE | F506: BATES | I506: WRIGHT | L506: WHITE | N506: BROWN | Q506: WITNISH
A507: CAMBERWELL | C507: SKALBERG | F507: QUIRK | I507: CHAPMAN | L507: LONDON | N507: K JOHNSON | Q507: J THOMPSON
A508: GOALKICKERS
A509: BOX HILL | C509: MACE 4 | F509: SALVADO 2 | I509: BROWN 2 | L509: BATES 2 | N509: BEASY | P509: CRAIG
A510: CAMBERWELL | C510: LONDON 5 | F510: QUIRK 2 | I510: WHITTEN 2 | L510: LONG | N510: G ELLIS
A512: PRESTON | C512: 0 | D512: 0 | E512: =C512*6+D512 -> 0 | G512: 6 | H512: 3 | I512: =G512*6+H512 -> 39 | K512: 7 | L512: 3 | M512: =K512*6+L512 -> 45 | O512: 11 | P512: 7 | Q512: =O512*6+P512 -> 73 | S512: PRESTON
A513: BRUNSWICK | C513: 5 | D513: 2 | E513: =C513*6+D513 -> 32 | G513: 6 | H513: 4 | I513: =G513*6+H513 -> 40 | K513: 10 | L513: 5 | M513: =K513*6+L513 -> 65 | O513: 10 | P513: 5 | Q513: =O513*6+P513 -> 65 | S513: MILLER
A514: BEST PLAYERS
A515: PRESTON | C515: McLACHLAN | F515: SLATTERY | I515: J LORD | L515: HAUGHTON | O515: P LORD | R515: WALKER
A516: BRUNSWICK | C516: BRENNAN | F516: R DILLON | I516: MATTHEWS | L516: McCORMACK | O516: K DILLON | R516: DEAS
A517: GOALKICKERS
A518: PRESTON | C518: McDONNELL 3 | F518: BERGIN 2 | I518: WALSH 2 | K518: DAVIS | M518: P LORD | O518: GILBERT | Q518: HAUGHTON
A519: BRUNSWICK | C519: MATTHEWS 3 | F519: K DILLON 3 | I519: TAYLOR 2 | L519: VELO | N519: WHILEY
A521: YARRAVILLE | C521: 1 | D521: 1 | E521: =C521*6+D521 -> 7 | G521: 9 | H521: 9 | I521: =G521*6+H521 -> 63 | K521: 10 | L521: 10 | M521: =K521*6+L521 -> 70 | O521: 19 | P521: 22 | Q521: =O521*6+P521 -> 136 | S521: YARRAVILLE
A522: SUNSHINE | C522: 4 | D522: 2 | E522: =C522*6+D522 -> 26 | G522: 5 | H522: 3 | I522: =G522*6+H522 -> 33 | K522: 10 | L522: 7 | M522: =K522*6+L522 -> 67 | O522: 10 | P522: 7 | Q522: =O522*6+P522 -> 67 | S522: ALLEN
A523: BEST PLAYERS
A524: YARRAVILLE | C524: CAREY | F524: McTAGGART | I524: RON BROWN | L524: LETCHER | O524: BOURKE | R524: ANDERSON
A525: SUNSHINE | C525: TREZISE | F525: BARCLAY | I525: CROSBIE | L525: WARREN | O525: STAFFORD | R525: N KEMP
A526: GOALKICKERS
A527: YARRAVILLE | C527: ANDERSON 8 | F527: BURT 3 | I527: RON BROWN 2 | L527: CAREY 2 | N527: HART 2 | P527: BOURKE | R527: CROOK
A528: SUNSHINE | C528: KELLY 2 | F528: BARCLAY 2 | I528: WARREN | K528: STAFFORD | M528: CROSBIE | O528: DICKSON | Q528: I KEMP
A530: MOORABBIN | C530: 5 | D530: 13 | E530: =C530*6+D530 -> 43 | G530: 7 | H530: 14 | I530: =G530*6+H530 -> 56 | K530: 19 | L530: 24 | M530: =K530*6+L530 -> 138 | O530: 22 | P530: 32 | Q530: =O530*6+P530 -> 164 | S530: ELSTERNWICK PARK
A531: BRIGHTON | C531: 0 | D531: 0 | E531: =C531*6+D531 -> 0 | G531: 3 | H531: 5 | I531: =G531*6+H531 -> 23 | K531: 3 | L531: 5 | M531: =K531*6+L531 -> 23 | O531: 6 | P531: 7 | Q531: =O531*6+P531 -> 43 | S531: HORNE
A532: BEST PLAYERS
A533: MOORABBIN | C533: MORONEY | F533: WHALEBONE | I533: CRAMERI | L533: RYAN | N533: PAPLEY | Q533: MILLS
A534: BRIGHTON | C534: W COOPER | F534: HOWELL | I534: ELDERING | L534: BURSEY | N534: HANCE | Q534: BEGLEY
A535: GOALKICKERS
A536: MOORABBIN | C536: CRAMERI 6 | F536: P RYAN 5 | I536: MORONEY 4 | L536: WHALEBONE 3 | O536: PAPLEY 2 | Q536: BILLSON | S536: PERRY
A537: BRIGHTON | C537: BURSEY 3 | F537: HOWELL | H537: FOX | J537: TURNER
A539: BYE | C539: DANDENONG
A541: ROUND 8 | E541: 4TH JUNE | J541: WEATHER | O541: FINE & SUNNY | S541: PLAYED AT
D542: 1ST QTR | H542: 2ND QTR | L542: 3RD QTR | P542: FINAL | S542: MOORABBIN
A543: MOORABBIN | C543: 2 | D543: 1 | E543: =C543*6+D543 -> 13 | G543: 4 | H543: 7 | I543: =G543*6+H543 -> 31 | K543: 9 | L543: 14 | M543: =K543*6+L543 -> 68 | O543: 14 | P543: 17 | Q543: =O543*6+P543 -> 101 | S543: UMPIRE | X543: LADDER | AB543: ROUND | AD543: 8
A544: DANDENONG | C544: 3 | D544: 3 | E544: =C544*6+D544 -> 21 | G544: 4 | H544: 6 | I544: =G544*6+H544 -> 30 | K544: 4 | L544: 7 | M544: =K544*6+L544 -> 31 | O544: 6 | P544: 10 | Q544: =O544*6+P544 -> 46 | S544: ALLEN
A545: BEST PLAYERS | W545: TEAM | X545: W | Y545: L | Z545: D | AA545: FOR | AB545: AGST | AC545: % | AD545: PTS
A546: MOORABBIN | C546: MORONEY | F546: PERRY | I546: PAPLEY | L546: GILDER | O546: MILLS | Q546: WHALEBONE
A547: DANDENONG | C547: WATERS | F547: LITTLE | I547: OSBORNE | L547: PETERS | O547: HOWER | Q547: STAUNTON | W547: COBURG | X547: 7 | Y547: 1 | Z547: 0 | AA547: 811 | AB547: 458 | AC547: 177.07423580786025 | AD547: 28
A548: GOALKICKERS | W548: MOORABBIN | X548: 7 | Y548: 1 | Z548: 0 | AA548: 766 | AB548: 500 | AC548: 153.2 | AD548: 28
A549: MOORABBIN | C549: RYAN 7 | F549: MANIE 2 | I549: MORONEY 2 | L549: PAPLEY | N549: WHALEBONE | Q549: HOY | W549: YARRAVILLE | X549: 6 | Y549: 2 | Z549: 0 | AA549: 648 | AB549: 417 | AC549: 155.39568345323741 | AD549: 24
A550: DANDENONG | C550: THOMAS | E550: OSBORNE | H550: CROSBIE | J550: GRAY | L550: WILLIAMS | O550: HOWER | W550: SANDRINGHAM | X550: 5 | Y550: 2 | Z550: 0 | AA550: 718 | AB550: 378 | AC550: 189.95 | AD550: 20
N551: OAKLEIGH | P551: HOME | R551: GAME | W551: MORDIALLOC | X551: 5 | Y551: 2 | Z551: 0 | AA551: 580 | AB551: 433 | AC551: 133.95 | AD551: 20
A552: OAKLEIGH | C552: 6 | D552: 0 | E552: =C552*6+D552 -> 36 | G552: 8 | H552: 7 | I552: =G552*6+H552 -> 55 | K552: 13 | L552: 13 | M552: =K552*6+L552 -> 91 | O552: 15 | P552: 17 | Q552: =O552*6+P552 -> 107 | S552: CAMBERWELL | W552: PORT MELBOURNE | X552: 5 | Y552: 3 | Z552: 0 | AA552: 631 | AB552: 482 | AC552: 130.91286307053943 | AD552: 20
A553: CAMBERWELL | C553: 3 | D553: 0 | E553: =C553*6+D553 -> 18 | G553: 6 | H553: 1 | I553: =G553*6+H553 -> 37 | K553: 7 | L553: 3 | M553: =K553*6+L553 -> 45 | O553: 11 | P553: 6 | Q553: =O553*6+P553 -> 72 | S553: SMITH
A554: BEST PLAYERS | W554: BRUNSWICK | X554: 5 | Y554: 3 | Z554: 0 | AA554: 621 | AB554: 480 | AC554: 129.375 | AD554: 20
A555: OAKLEIGH | C555: COUGHLAN | F555: ALLSOPP | I555: ASH | L555: COLLINS | O555: NAISMITH | R555: JONES | W555: OAKLEIGH | X555: 5 | Y555: 2 | Z555: 0 | AA555: 527 | AB555: 424 | AC555: 124.29245283018868 | AD555: 20
A556: CAMBERWELL | C556: COMMONS | F556: CHAPLIN | I556: WHITTEN | L556: K JOHNSON | O556: GIBSON | R556: SKALBERG | W556: WILLIAMSTOWN | X556: 4 | Y556: 4 | Z556: 0 | AA556: 625 | AB556: 525 | AC556: 119.04761904761905 | AD556: 16
A557: GOALKICKERS | W557: NORTHCOTE | X557: 3 | Y557: 4 | Z557: 1 | AA557: 526 | AB557: 701 | AC557: 75.03566333808844 | AD557: 14
A558: OAKLEIGH | C558: COUGHLAN 4 | F558: ASH 3 | H558: HALL 3 | J558: ALLSOPP 2 | M558: COLLINS | O558: JONES | Q558: McKEOGH | W558: DANDENONG | X558: 3 | Y558: 4 | Z558: 0 | AA558: 458 | AB558: 497 | AC558: 92.152917505030175 | AD558: 12
A559: CAMBERWELL | C559: LONDON 3 | F559: GIBSON 3 | I559: WHITTEN | K559: QUIRK | M559: ELLIS | O559: KENT | Q559: FISHER | W559: BOX HILL | X559: 3 | Y559: 4 | Z559: 0 | AA559: 471 | AB559: 582 | AC559: 80.927835051546396 | AD559: 12
W560: CAMBERWELL | X560: 2 | Y560: 5 | Z560: 0 | AA560: 412 | AB560: 537 | AC560: 76.722532588454371 | AD560: 8
A561: NORTHCOTE | C561: 2 | D561: 5 | E561: =C561*6+D561 -> 17 | G561: 6 | H561: 9 | I561: =G561*6+H561 -> 45 | K561: 11 | L561: 14 | M561: =K561*6+L561 -> 80 | O561: 15 | P561: 14 | Q561: =O561*6+P561 -> 104 | S561: NORTHCOTE | W561: PRESTON | X561: 2 | Y561: 6 | Z561: 0 | AA561: 433 | AB561: 636 | AC561: 68.081761006289312 | AD561: 8
A562: WILLIAMSTOWN | C562: 4 | D562: 5 | E562: =C562*6+D562 -> 29 | G562: 6 | H562: 10 | I562: =G562*6+H562 -> 46 | K562: 7 | L562: 12 | M562: =K562*6+L562 -> 54 | O562: 13 | P562: 15 | Q562: =O562*6+P562 -> 93 | S562: TREWIN | W562: SUNSHINE | X562: 1 | Y562: 6 | Z562: 1 | AA562: 455 | AB562: 767 | AC562: 59.322033898305087 | AD562: 6
A563: BEST PLAYERS | W563: PRAHRAN | X563: 0 | Y563: 7 | Z563: 0 | AA563: 367 | AB563: 685 | AC563: 53.58 | AD563: 0
A564: NORTHCOTE | C564: HICKS | F564: OLIVER | I564: WRIGHT | L564: VAINS | N564: MORAN | Q564: BRETHERTON | W564: BRIGHTON | X564: 0 | Y564: 7 | Z564: 0 | AA564: 337 | AB564: 884 | AC564: 38.122171945701361 | AD564: 0
A565: WILLIAMSTOWN | C565: SMITH | F565: E BEITZEL | I565: PELLY | L565: JONES | N565: CLOUGH | Q565: WARD
A566: GOALKICKERS
A567: NORTHCOTE | C567: HICKS 7 | F567: MORAN 4 | I567: AGHAN | K567: KELLY | M567: VAINS | O567: MALING
A568: WILLIAMSTOWN | C568: CLOUGH 3 | F568: McASEY 3 | I568: PELLY 3 | K568: WARD | M568: E BEITZEL | P568: MURPHY | R568: SMITH
A570: BOX HILL | C570: 4 | D570: 7 | E570: =C570*6+D570 -> 31 | G570: 6 | H570: 10 | I570: =G570*6+H570 -> 46 | K570: 11 | L570: 13 | M570: =K570*6+L570 -> 79 | O570: 16 | P570: 19 | Q570: =O570*6+P570 -> 115 | S570: BOX HILL
A571: BRIGHTON | C571: 0 | D571: 2 | E571: =C571*6+D571 -> 2 | G571: 2 | H571: 7 | I571: =G571*6+H571 -> 19 | K571: 4 | L571: 11 | M571: =K571*6+L571 -> 35 | O571: 7 | P571: 18 | Q571: =O571*6+P571 -> 60 | S571: MANCE
A572: BEST PLAYERS
A573: BOX HILL | C573: WITNISH | F573: BROWN | I573: BEASY | L573: WITTMER | O573: CRAIG | R573: MACE
A574: BRIGHTON | C574: W COOPER | F574: ELDERING | I574: McCANN | L574: QUIRK | O574: HOWELL | R574: BEGLEY
A575: GOALKICKERS
A576: BOX HILL | C576: WITNISH 3 | F576: GRAY 3 | H576: MACE 3 | J576: CHEFFERS 3 | M576: WHITE 2 | O576: EADE 2
A577: BRIGHTON | C577: McCANN 2 | F577: HOWELL | H577: BROWNING | J577: CRAIG | L577: QUIRK | N577: FOX
A579: SANDRINGHAM | C579: 1 | D579: 4 | E579: =C579*6+D579 -> 10 | G579: 9 | H579: 11 | I579: =G579*6+H579 -> 65 | K579: 9 | L579: 15 | M579: =K579*6+L579 -> 69 | O579: 16 | P579: 20 | Q579: =O579*6+P579 -> 116 | S579: BEACH ROAD
A580: PRESTON | C580: 1 | D580: 0 | E580: =C580*6+D580 -> 6 | G580: 2 | H580: 2 | I580: =G580*6+H580 -> 14 | K580: 4 | L580: 8 | M580: =K580*6+L580 -> 32 | O580: 6 | P580: 11 | Q580: =O580*6+P580 -> 47 | S580: McMASTER
A581: BEST PLAYERS
A582: SANDRINGHAM | C582: GLEESON | F582: BOLAND | I582: GRAMBEAU | L582: THOMPSON | O582: RANSOM | R582: MURRAY
A583: PRESTON | C583: HOWARD | F583: MILLER | I583: MUTIMER | L583: WALKER | O583: BERGIN | R583: HORWOOD
A584: GOALKICKERS
A585: SANDRINGHAM | C585: OAKLEY 4 | F585: GLEESON 3 | I585: GRAMBEAU 3 | L585: ALLSOP 2 | N585: THOMPSON | Q585: RASMUSSEN | T585: MUTER | V585: MURRAY
A586: PRESTON | C586: BERGIN 2 | F586: HOWARD | I586: DAVIS | K586: GRAY | M586: McDONNELL
A588: PORT MELBOURNE | C588: 1 | D588: 4 | E588: =C588*6+D588 -> 10 | G588: 6 | H588: 15 | I588: =G588*6+H588 -> 51 | K588: 16 | L588: 19 | M588: =K588*6+L588 -> 115 | O588: 19 | P588: 27 | Q588: =O588*6+P588 -> 141 | S588: SUNSHINE
A589: SUNSHINE | C589: 1 | D589: 5 | E589: =C589*6+D589 -> 11 | G589: 1 | H589: 5 | I589: =G589*6+H589 -> 11 | K589: 2 | L589: 8 | M589: =K589*6+L589 -> 20 | O589: 6 | P589: 9 | Q589: =O589*6+P589 -> 45 | S589: SCOTT
A590: BEST PLAYERS
A591: PORT MELBOURNE | C591: MONKS | F591: FURNESS | I591: FREYER | L591: LEWIS | O591: BONNETT | R591: LAWSON
A592: SUNSHINE | C592: WARREN | F592: I KEMP | I592: TURNER | L592: STAFFORD | O592: SAUNDERS | R592: TREZISE
A593: GOALKICKERS
A594: PORT MELBOURNE | C594: BONNETT 5 | F594: FREYER 4 | I594: McLEOD 2 | L594: MONKS 2 | N594: FITZGERALD 2 | Q594: CLAXTON 2 | T594: JOLIFFE | V594: LAWSON
A595: SUNSHINE | C595: SAUNDERS 3 | F595: TREZISE | I595: KELLY | K595: BARCLAY
A597: BRUNSWICK | C597: 3 | D597: 7 | E597: =C597*6+D597 -> 25 | G597: 6 | H597: 9 | I597: =G597*6+H597 -> 45 | K597: 12 | L597: 14 | M597: =K597*6+L597 -> 86 | O597: 16 | P597: 20 | Q597: =O597*6+P597 -> 116 | S597: BRUNSWICK
A598: PRAHRAN | C598: 1 | D598: 3 | E598: =C598*6+D598 -> 9 | G598: 4 | H598: 6 | I598: =G598*6+H598 -> 30 | K598: 4 | L598: 9 | M598: =K598*6+L598 -> 33 | O598: 6 | P598: 10 | Q598: =O598*6+P598 -> 46 | S598: HORNE
A599: BEST PLAYERS
A600: BRUNSWICK | C600: WHILEY | F600: R DILLON | I600: WATT | L600: K DILLON | O600: BIBBY | R600: MATTHEWS
A601: PRAHRAN | C601: ROSS JONES | F601: PEARSON | I601: McCONNELL | L601: HAYES | O601: ROY JONES | R601: MARSDEN
A602: GOALKICKERS
A603: BRUNSWICK | C603: K DILLON 3 | F603: RYAN 3 | H603: TAYLOR 3 | J603: G STANLEY 3 | M603: AYRES 2 | O603: MATTHEWS | R603: AMBROSE
A604: PRAHRAN | C604: KENNY 2 | F604: HARRIS | H604: ROLLINGS | J604: HART | L604: BOYD
C605: 5TH JUNE | I605: WEATHER | M605: FINE
A606: COBURG | C606: 4 | D606: 5 | E606: =C606*6+D606 -> 29 | G606: 7 | H606: 8 | I606: =G606*6+H606 -> 50 | K606: 10 | L606: 10 | M606: =K606*6+L606 -> 70 | O606: 13 | P606: 11 | Q606: =O606*6+P606 -> 89 | S606: COBURG
A607: YARRAVILLE | C607: 2 | D607: 0 | E607: =C607*6+D607 -> 12 | G607: 4 | H607: 1 | I607: =G607*6+H607 -> 25 | K607: 5 | L607: 2 | M607: =K607*6+L607 -> 32 | O607: 9 | P607: 8 | Q607: =O607*6+P607 -> 62 | S607: O'DONOGHUE
A608: BEST PLAYERS
A609: COBURG | C609: YOUNG | F609: JORDAN | I609: SHORT | L609: HOOGEN | O609: SHAW | R609: BYRON
A610: YARRAVILLE | C610: McTAGGART | F610: McCABE | I610: MASON | L610: BOB BROWN | O610: LETCHER | R610: ORANGE
A611: GOALKICKERS
A612: COBURG | C612: BYRON 4 | F612: JORDAN 3 | I612: SHAW 2 | K612: BIGELOW | M612: CARR | O612: KAYLL | Q612: HOOGEN
A613: YARRAVILLE | C613: CROOK 2 | E613: LETCHER | G613: RON BROWN | J613: McCARTHY | M613: HART | N613: ANDERSON | Q613: NARKIEWICZ | T613: CAREY
A615: BYE | C615: MORDIALLOC
A617: ROUND 9 | E617: 13TH JUNE | H617: QUEENS BIRTHDAY | L617: WEATHER | N617: FINE BUT DULL | S617: PLAYED AT
D618: 1ST QTR | H618: 2ND QTR | L618: 3RD QTR | P618: FINAL | S618: PORT MELBOURNE
A619: COBURG | C619: 4 | D619: 2 | E619: =C619*6+D619 -> 26 | G619: 7 | H619: 6 | I619: =G619*6+H619 -> 48 | K619: 9 | L619: 14 | M619: =K619*6+L619 -> 68 | O619: 16 | P619: 18 | Q619: =O619*6+P619 -> 114 | S619: UMPIRE | X619: LADDER | AB619: ROUND | AD619: 9
A620: PORT MELBOURNE | C620: 6 | D620: 5 | E620: =C620*6+D620 -> 41 | G620: 9 | H620: 10 | I620: =G620*6+H620 -> 64 | K620: 12 | L620: 14 | M620: =K620*6+L620 -> 86 | O620: 15 | P620: 18 | Q620: =O620*6+P620 -> 108 | S620: ROACH
A621: BEST PLAYERS | W621: TEAM | X621: W | Y621: L | Z621: D | AA621: FOR | AB621: AGST | AC621: % | AD621: PTS
A622: COBURG | C622: JORDAN | F622: BIGELOW | I622: HINKS | L622: HOOGEN | N622: SHAW | Q622: BYRON
A623: PORT MELBOURNE | C623: McDONALD | F623: COVENTRY | I623: CAMERON | L623: BONNETT | N623: CLAXTON | Q623: JOLIFFE | W623: COBURG | X623: 8 | Y623: 1 | Z623: 0 | AA623: 925 | AB623: 566 | AC623: 163.42756183745584 | AD623: 32
A624: GOALKICKERS | W624: MOORABBIN | X624: 7 | Y624: 1 | Z624: 0 | AA624: 766 | AB624: 500 | AC624: 153.2 | AD624: 28
A625: COBURG | C625: BIGELOW 3 | F625: HINKS 3 | H625: JORDAN 3 | J625: BYRON 3 | M625: HOOGEN 2 | P625: SHAW | R625: KERR | W625: YARRAVILLE | X625: 7 | Y625: 2 | Z625: 0 | AA625: 784 | AB625: 510 | AC625: 153.72549019607843 | AD625: 28
A626: PORT MELBOURNE | C626: BONNETT 5 | F626: CLAXTON 3 | I626: SPENCE 2 | K626: McLEOD | M626: CLARKE | O626: JOLIFFE | Q626: FITZGERALD | T626: LAWSON | W626: SANDRINGHAM | X626: 6 | Y626: 2 | Z626: 0 | AA626: 898 | AB626: 455 | AC626: 197.36 | AD626: 24
W627: OAKLEIGH | X627: 6 | Y627: 2 | Z627: 0 | AA627: 679 | AB627: 492 | AC627: 138.00813008130081 | AD627: 24
A628: BRUNSWICK | C628: 2 | D628: 2 | E628: =C628*6+D628 -> 14 | G628: 3 | H628: 5 | I628: =G628*6+H628 -> 23 | K628: 8 | L628: 9 | M628: =K628*6+L628 -> 57 | O628: 11 | P628: 11 | Q628: =O628*6+P628 -> 77 | S628: BRUNSWICK | W628: BRUNSWICK | X628: 6 | Y628: 3 | Z628: 0 | AA628: 698 | AB628: 520 | AC628: 134.23076923076923 | AD628: 24
A629: MORDIALLOC | C629: 3 | D629: 5 | E629: =C629*6+D629 -> 23 | G629: 3 | H629: 6 | I629: =G629*6+H629 -> 24 | K629: 5 | L629: 7 | M629: =K629*6+L629 -> 37 | O629: 5 | P629: 10 | Q629: =O629*6+P629 -> 40 | S629: McMASTER
A630: BEST PLAYERS | W630: WILLIAMSTOWN | X630: 5 | Y630: 4 | Z630: 0 | AA630: 754 | AB630: 585 | AC630: 128.88888888888889 | AD630: 20
A631: BRUNSWICK | C631: WATT | E631: WHILEY | H631: JOHNSTON | K631: AMBROSE | N631: BRENNAN | Q631: BIBBY | W631: PORT MELBOURNE | X631: 5 | Y631: 4 | Z631: 0 | AA631: 739 | AB631: 596 | AC631: 123.99328859060402 | AD631: 20
A632: MORDIALLOC | C632: JOSE | E632: DULLARD | H632: BESANKO | K632: BAKER | N632: RITCHIE | Q632: MAUNDER | W632: MORDIALLOC | X632: 5 | Y632: 3 | Z632: 0 | AA632: 620 | AB632: 510 | AC632: 121.57 | AD632: 20
A633: GOALKICKERS | W633: DANDENONG | X633: 4 | Y633: 4 | Z633: 0 | AA633: 553 | AB633: 575 | AC633: 96.173913043478265 | AD633: 16
A634: BRUNSWICK | C634: RYAN 3 | F634: AMBROSE 3 | I634: G STANLEY 2 | L634: DENTON | N634: BIBBY | P634: MATTHEWS | W634: NORTHCOTE | X634: 3 | Y634: 5 | Z634: 1 | AA634: 619 | AB634: 837 | AC634: 73.954599761051369 | AD634: 14
A635: MORDIALLOC | C635: BAKER 4 | F635: SHEEHAN | W635: BOX HILL | X635: 3 | Y635: 5 | Z635: 0 | AA635: 549 | AB635: 677 | AC635: 81.093057607090103 | AD635: 12
W636: PRESTON | X636: 3 | Y636: 6 | Z636: 0 | AA636: 551 | AB636: 683 | AC636: 80.673499267935583 | AD636: 12
A637: YARRAVILLE | C637: 5 | D637: 6 | E637: =C637*6+D637 -> 36 | G637: 10 | H637: 10 | I637: =G637*6+H637 -> 70 | K637: 15 | L637: 14 | M637: =K637*6+L637 -> 104 | O637: 20 | P637: 16 | Q637: =O637*6+P637 -> 136 | S637: YARRAVILLE | W637: CAMBERWELL | X637: 2 | Y637: 6 | Z637: 0 | AA637: 489 | AB637: 717 | AC637: 68.20083682008368 | AD637: 8
A638: NORTHCOTE | C638: 3 | D638: 1 | E638: =C638*6+D638 -> 19 | G638: 6 | H638: 3 | I638: =G638*6+H638 -> 39 | K638: 10 | L638: 6 | M638: =K638*6+L638 -> 66 | O638: 14 | P638: 9 | Q638: =O638*6+P638 -> 93 | S638: POLLARD | W638: SUNSHINE | X638: 1 | Y638: 7 | Z638: 1 | AA638: 502 | AB638: 885 | AC638: 56.72316384180791 | AD638: 6
A639: BEST PLAYERS | W639: PRAHRAN | X639: 0 | Y639: 8 | Z639: 0 | AA639: 427 | AB639: 814 | AC639: 52.46 | AD639: 0
A640: YARRAVILLE | C640: MEDDINGS | F640: CROOK | I640: BURT | L640: MASON | O640: RON BROWN | R640: LETCHER | W640: BRIGHTON | X640: 0 | Y640: 8 | Z640: 0 | AA640: 405 | AB640: 1036 | AC640: 39.092664092664094 | AD640: 0
A641: NORTHCOTE | C641: WRIGHT | F641: HICKS | I641: BRETHERTON | L641: HOSKINGS | O641: LAVER | R641: MARCHANT
A642: GOALKICKERS
A643: YARRAVILLE | C643: MEDDINGS 10 | F643: CROOK 4 | I643: RON BROWN 3 | L643: CAREY | N643: BURT | P643: LETCHER
A644: NORTHCOTE | C644: HICKS 5 | F644: HOSKINGS 2 | I644: MALING 2 | L644: AGHAN 2 | N644: VAINS | P644: HAMILTON | S644: BRETHERTON
A646: DANDENONG | C646: 3 | D646: 2 | E646: =C646*6+D646 -> 20 | G646: 5 | H646: 5 | I646: =G646*6+H646 -> 35 | K646: 8 | L646: 8 | M646: =K646*6+L646 -> 56 | O646: 14 | P646: 11 | Q646: =O646*6+P646 -> 95 | S646: DANDENONG
A647: BOX HILL | C647: 1 | D647: 5 | E647: =C647*6+D647 -> 11 | G647: 3 | H647: 10 | I647: =G647*6+H647 -> 28 | K647: 9 | L647: 14 | M647: =K647*6+L647 -> 68 | O647: 10 | P647: 18 | Q647: =O647*6+P647 -> 78 | S647: HORNE
A648: BEST PLAYERS
A649: DANDENONG | C649: WITNISH | F649: BROWN | I649: CRAIG | L649: WHITE | O649: BEASY | R649: WITTMER
A650: BOX HILL | C650: LITTLE | F650: WATERS | I650: PENNEFATHER | L650: GILLINGHAM | O650: STAUNTON | R650: HOWER
A651: GOALKICKERS
A652: DANDENONG | C652: CROSBIE 4 | F652: WATERS 2 | I652: PENNEFATHER 2 | L652: ROSETTI | N652: THOMAS | P652: KILPATRICK | S652: OSBORNE | V652: ARGOON | X652: VERBEEK
A653: BOX HILL | C653: WITNISH 3 | F653: BROWN 2 | I653: GRAY 2 | K653: BEASY | M653: EADE | O653: CHEFFERS
A655: PRESTON | C655: 2 | D655: 4 | E655: =C655*6+D655 -> 16 | G655: 7 | H655: 13 | I655: =G655*6+H655 -> 55 | K655: 8 | L655: 16 | M655: =K655*6+L655 -> 64 | O655: 16 | P655: 22 | Q655: =O655*6+P655 -> 118 | S655: PRESTON
A656: SUNSHINE | C656: 4 | D656: 3 | E656: =C656*6+D656 -> 27 | G656: 5 | H656: 4 | I656: =G656*6+H656 -> 34 | K656: 7 | L656: 5 | M656: =K656*6+L656 -> 47 | O656: 7 | P656: 5 | Q656: =O656*6+P656 -> 47 | S656: TREWIN
A657: BEST PLAYERS
A658: PRESTON | C658: WALSH | F658: McLACHLAN | I658: WATSON | L658: HOWARD | O658: HAUGHTON | R658: BERGIN
A659: SUNSHINE | C659: CROSBIE | F659: STAFFORD | I659: GREGORY | L659: WARREN | O659: DICKSON | R659: WALKER
A660: GOALKICKERS
A661: PRESTON | C661: DAVIS 3 | F661: McDONNELL 3 | I661: WOOD 3 | K661: WALSH 2 | M661: BERGIN | O661: WATSON | Q661: GRAY | S661: LAMBIE | U661: HAUGHTON
A662: SUNSHINE | C662: DICKSON 2 | F662: BARCLAY | I662: GREGORY | K662: WALKER | M662: KELLY | O662: SEYMOUR
A664: WILLIAMSTOWN | C664: 5 | D664: 1 | E664: =C664*6+D664 -> 31 | G664: 8 | H664: 2 | I664: =G664*6+H664 -> 50 | K664: 15 | L664: 5 | M664: =K664*6+L664 -> 95 | O664: 19 | P664: 15 | Q664: =O664*6+P664 -> 129 | S664: TOORAK PARK
A665: PRAHRAN | C665: 3 | D665: 2 | E665: =C665*6+D665 -> 20 | G665: 4 | H665: 6 | I665: =G665*6+H665 -> 30 | K665: 7 | L665: 10 | M665: =K665*6+L665 -> 52 | O665: 8 | P665: 12 | Q665: =O665*6+P665 -> 60 | S665: SCOTT
A666: BEST PLAYERS
A667: WILLIAMSTOWN | C667: PELLY | F667: BOB JONES | I667: E BEITZEL | L667: SMITH | O667: WARD | Q667: CLOUGH
A668: PRAHRAN | C668: ROLLINGS | F668: HARVEY | I668: CLEMENTS | L668: SEEDY | O668: BOYD | Q668: KENNY
A669: GOALKICKERS
A670: WILLIAMSTOWN | C670: McASEY 4 | F670: CLOUGH 4 | I670: PELLY 3 | K670: HYNES 2 | M670: RAINSFORD 2 | P670: EVANS 2 | R670: WARD | T670: COPE
A671: PRAHRAN | C671: KENNY 2 | F671: LEWIS 2 | I671: PEARSON 2 | L671: HAYES | N671: HARVEY
A673: OAKLEIGH | C673: 4 | D673: 9 | E673: =C673*6+D673 -> 33 | G673: 9 | H673: 15 | I673: =G673*6+H673 -> 69 | K673: 15 | L673: 26 | M673: =K673*6+L673 -> 116 | O673: 20 | P673: 32 | Q673: =O673*6+P673 -> 152 | S673: ELSTERNWICK PARK
A674: BRIGHTON | C674: 2 | D674: 1 | E674: =C674*6+D674 -> 13 | G674: 5 | H674: 2 | I674: =G674*6+H674 -> 32 | K674: 8 | L674: 5 | M674: =K674*6+L674 -> 53 | O674: 10 | P674: 8 | Q674: =O674*6+P674 -> 68 | S674: O'DONOGHUE
A675: BEST PLAYERS
A676: OAKLEIGH | C676: COUGHLAN | F676: McCOOKE | I676: ALLSOP | K676: NAISMITH | N676: PEAKE | Q676: McKEOGH
A677: BRIGHTON | C677: McCANN | F677: QUIRK | I677: LEARY | K677: CRAIG | N677: W COOPER | Q677: BROWNING
A678: GOALKICKERS
A679: OAKLEIGH | C679: COUGHLAN 6 | F679: ALLSOP 4 | I679: COLLINS 3 | K679: HALL 2 | M679: McGOWAN 2 | P679: PALMER | R679: PANNAM | U679: JONES
A680: BRIGHTON | C680: QUIRK 5 | F680: LEARY | H680: BROWNING | K680: BEGLEY | M680: THOMAS | O680: CURRIE
A682: SANDRINGHAM | C682: 6 | D682: 5 | E682: =C682*6+D682 -> 41 | G682: 11 | H682: 13 | I682: =G682*6+H682 -> 79 | K682: 18 | L682: 21 | M682: =K682*6+L682 -> 129 | O682: 25 | P682: 30 | Q682: =O682*6+P682 -> 180 | S682: CAMBERWELL
A683: CAMBERWELL | C683: 3 | D683: 1 | E683: =C683*6+D683 -> 19 | G683: 6 | H683: 2 | I683: =G683*6+H683 -> 38 | K683: 9 | L683: 4 | M683: =K683*6+L683 -> 58 | O683: 12 | P683: 5 | Q683: =O683*6+P683 -> 77 | S683: ALLEN
A684: BEST PLAYERS
A685: SANDRINGHAM | C685: GLEESON | F685: ALLSOPP | I685: OAKLEY | L685: GRAMBEAU | O685: MUTER | R685: MURRAY
A686: CAMBERWELL | C686: SKALBERG | F686: COMMONS | I686: GIBSON | L686: O'NEILL | O686: WHITTEN | R686: B JOHNSON
A687: GOALKICKERS
A688: SANDRINGHAM | C688: OAKLEY 9 | F688: ALLSOPP 5 | I688: GLEESON 4 | L688: MUTER 2 | N688: EVANS 2 | Q688: PETCH 2 | S688: GRAMBEAU
A689: CAMBERWELL | C689: O'NEILL 5 | F689: COMMONS 3 | I689: GIBSON 2 | K689: FREYBERG | M689: LONDON
A691: BYE | C691: MOORABBIN
A693: ROUND 10 | E693: 18TH JUNE | K693: WEATHER | P693: FINE | S693: PLAYED AT
D694: 1ST QTR | H694: 2ND QTR | L694: 3RD QTR | P694: FINAL | S694: COBURG
A695: MOORABBIN | C695: 2 | D695: 1 | E695: =C695*6+D695 -> 13 | G695: 7 | H695: 2 | I695: =G695*6+H695 -> 44 | K695: 14 | L695: 2 | M695: =K695*6+L695 -> 86 | O695: 16 | P695: 3 | Q695: =O695*6+P695 -> 99 | S695: UMPIRE | X695: LADDER | AB695: ROUND | AD695: 10
A696: COBURG | C696: 1 | D696: 6 | E696: =C696*6+D696 -> 12 | G696: 5 | H696: 6 | I696: =G696*6+H696 -> 36 | K696: 7 | L696: 11 | M696: =K696*6+L696 -> 53 | O696: 12 | P696: 18 | Q696: =O696*6+P696 -> 90 | S696: POLLARD
A697: BEST PLAYERS | W697: TEAM | X697: W | Y697: L | Z697: D | AA697: FOR | AB697: AGST | AC697: % | AD697: PTS
A698: MOORABBIN | C698: PERRY | F698: PAPLEY | I698: CLARK | L698: GILDER | N698: WHALEBONE | Q698: KANN
A699: COBURG | C699: CARR | F699: WILSON | I699: JORDAN | L699: HOOGEN | N699: SHORT | Q699: YOUNG | W699: COBURG | X699: 8 | Y699: 2 | Z699: 0 | AA699: 1015 | AB699: 665 | AC699: 152.63157894736841 | AD699: 32
A700: GOALKICKERS | W700: YARRAVILLE | X700: 8 | Y700: 2 | Z700: 0 | AA700: 884 | AB700: 593 | AC700: 149.07251264755482 | AD700: 32
A701: MOORABBIN | C701: RYAN 4 | E701: CLARK 4 | G701: MORONEY 2) | J701: WHALEBONE 2 | M701: PAPLEY 2 | O701: HOGAN | Q701: CRAMERI | W701: MOORABBIN | X701: 8 | Y701: 1 | Z701: 0 | AA701: 865 | AB701: 590 | AC701: 146.61 | AD701: 32
A702: COBURG | C702: CARR 2 | E702: BYRON 2 | G702: WILSON 2 | I702: JORDAN | K702: O'BRIEN | M702: CLARKSON | O702: KERNICK | Q702: BIGELOW | S702: YOUNG | W702: SANDRINGHAM | X702: 7 | Y702: 2 | Z702: 0 | AA702: 1025 | AB702: 490 | AC702: 209.18 | AD702: 28
W703: OAKLEIGH | X703: 7 | Y703: 2 | Z703: 0 | AA703: 793 | AB703: 569 | AC703: 139.36731107205622 | AD703: 28
A704: SANDRINGHAM | C704: 2 | D704: 3 | E704: =C704*6+D704 -> 15 | G704: 4 | H704: 10 | I704: =G704*6+H704 -> 34 | K704: 12 | L704: 12 | M704: =K704*6+L704 -> 84 | O704: 18 | P704: 19 | Q704: =O704*6+P704 -> 127 | S704: BEACH ROAD | W704: WILLIAMSTOWN | X704: 6 | Y704: 4 | Z704: 0 | AA704: 893 | AB704: 651 | AC704: 137.17357910906298 | AD704: 24
A705: BRUNSWICK | C705: 1 | D705: 3 | E705: =C705*6+D705 -> 9 | G705: 3 | H705: 4 | I705: =G705*6+H705 -> 22 | K705: 4 | L705: 5 | M705: =K705*6+L705 -> 29 | O705: 4 | P705: 11 | Q705: =O705*6+P705 -> 35 | S705: O'DONOGHUE
A706: BEST PLAYERS | W706: BRUNSWICK | X706: 6 | Y706: 4 | Z706: 0 | AA706: 733 | AB706: 647 | AC706: 113.29211746522411 | AD706: 24
A707: SANDRINGHAM | C707: GRAMBEAU | F707: THOMPSON | I707: McKENZIE | L707: EVANS | N707: STRACHAN | Q707: WEBSTER | W707: PORT MELBOURNE | X707: 5 | Y707: 5 | Z707: 0 | AA707: 806 | AB707: 684 | AC707: 117.83625730994152 | AD707: 20
A708: BRUNSWICK | C708: WHILEY | F708: BRENNAN | I708: JOHNSTON | L708: EDWARDS | N708: K DILLON | Q708: ROBSON | W708: MORDIALLOC | X708: 5 | Y708: 4 | Z708: 0 | AA708: 703 | AB708: 610 | AC708: 115.25 | AD708: 20
A709: GOALKICKERS | R709: MUTER | W709: NORTHCOTE | X709: 4 | Y709: 5 | Z709: 1 | AA709: 726 | AB709: 889 | AC709: 81.664791901012379 | AD709: 18
A710: SANDRINGHAM | C710: STRACHAN 4 | F710: GLEESON 4 | I710: EVANS 3 | K710: WEBSTER 2 | N710: OAKLEY 2 | Q710: MURRAY | S710: PETCH | W710: DANDENONG | X710: 4 | Y710: 5 | Z710: 0 | AA710: 604 | AB710: 680 | AC710: 88.82352941176471 | AD710: 16
A711: BRUNSWICK | C711: K DILLON | F711: G STANLEY | I711: MATTHEWS | L711: DENTON | W711: BOX HILL | X711: 4 | Y711: 5 | Z711: 0 | AA711: 637 | AB711: 744 | AC711: 85.618279569892479 | AD711: 16
W712: PRESTON | X712: 3 | Y712: 7 | Z712: 0 | AA712: 628 | AB712: 797 | AC712: 78.795483061480553 | AD712: 12
A713: YARRAVILLE | C713: 3 | D713: 5 | E713: =C713*6+D713 -> 23 | G713: 10 | H713: 6 | I713: =G713*6+H713 -> 66 | K713: 13 | L713: 11 | M713: =K713*6+L713 -> 89 | O713: 14 | P713: 16 | Q713: =O713*6+P713 -> 100 | S713: MORDIALLOC | W713: SUNSHINE | X713: 2 | Y713: 7 | Z713: 1 | AA713: 607 | AB713: 936 | AC713: 64.850427350427353 | AD713: 10
A714: MORDIALLOC | C714: 1 | D714: 5 | E714: =C714*6+D714 -> 11 | G714: 4 | H714: 5 | I714: =G714*6+H714 -> 29 | K714: 5 | L714: 13 | M714: =K714*6+L714 -> 43 | O714: 11 | P714: 17 | Q714: =O714*6+P714 -> 83 | S714: MARCY | W714: CAMBERWELL | X714: 2 | Y714: 7 | Z714: 0 | AA714: 555 | AB714: 856 | AC714: 64.836448598130843 | AD714: 8
A715: BEST PLAYERS | W715: PRAHRAN | X715: 0 | Y715: 9 | Z715: 0 | AA715: 479 | AB715: 921 | AC715: 52.01 | AD715: 0
A716: YARRAVILLE | C716: CROOK | F716: RON BROWN | I716: WILLIAMS | L716: McTAGGART | O716: MEDDINGS | R716: BURT | W716: BRIGHTON | X716: 0 | Y716: 8 | Z716: 0 | AA716: 405 | AB716: 1036 | AC716: 39.092664092664094 | AD716: 0
A717: MORDIALLOC | C717: ROBERTS | F717: NISBET | I717: JOSE | L717: RITCHIE | O717: MAUNDER | R717: BESANKO
A718: GOALKICKERS
A719: YARRAVILLE | C719: MEDDINGS 3 | F719: RON BROWN 2 | I719: HART 2 | K719: BURT | M719: WILLIAMS | O719: CROOK | Q719: BOURKE | S719: CAREY | U719: COLLINS | X719: MAGEE
A720: MORDIALLOC | C720: ROBERTS 3 | F720: BAKER 2 | I720: PEARSON 2 | L720: McMILLAN 2 | O720: RITCHIE | Q720: NISBET
A722: BOX HILL | C722: 3 | D722: 4 | E722: =C722*6+D722 -> 22 | G722: 5 | H722: 7 | I722: =G722*6+H722 -> 37 | K722: 12 | L722: 8 | M722: =K722*6+L722 -> 80 | O722: 13 | P722: 10 | Q722: =O722*6+P722 -> 88 | S722: BOX HILL
A723: PORT MELBOURNE | C723: 1 | D723: 2 | E723: =C723*6+D723 -> 8 | G723: 3 | H723: 4 | I723: =G723*6+H723 -> 22 | K723: 7 | L723: 10 | M723: =K723*6+L723 -> 52 | O723: 9 | P723: 13 | Q723: =O723*6+P723 -> 67 | S723: SCOTT
A724: BEST PLAYERS
A725: BOX HILL | C725: BROWN | F725: WHITE | I725: WALLER | L725: WITNISH | O725: BEASY | R725: ROCHOW
A726: PORT MELBOURNE | C726: COVENTRY | F726: McLEOD | I726: CLARK | L726: MONKS | O726: McDONALD | R726: CLAXTON
A727: GOALKICKERS
A728: BOX HILL | C728: WHITE 4 | F728: BROWN 2 | I728: WITNISH 2 | L728: GRAY 2 | N728: MACE | P728: EADE | R728: CHEFFERS
A729: PORT MELBOURNE | C729: MONKS 3 | F729: CLAXTON 2 | I729: FREYER 2 | K729: McLEOD | M729: BONNETT
A731: SUNSHINE | C731: 5 | D731: 0 | E731: =C731*6+D731 -> 30 | G731: 10 | H731: 4 | I731: =G731*6+H731 -> 64 | K731: 11 | L731: 6 | M731: =K731*6+L731 -> 72 | O731: 16 | P731: 9 | Q731: =O731*6+P731 -> 105 | S731: SUNSHINE
A732: DANDENONG | C732: 2 | D732: 2 | E732: =C732*6+D732 -> 14 | G732: 4 | H732: 3 | I732: =G732*6+H732 -> 27 | K732: 6 | L732: 7 | M732: =K732*6+L732 -> 43 | O732: 7 | P732: 9 | Q732: =O732*6+P732 -> 51 | S732: McMASTER
A733: BEST PLAYERS
A734: SUNSHINE | C734: TREZISE | F734: CROSBIE | I734: BARCLAY | L734: PRESTON | O734: GREGORY | R734: N KEMP
A735: DANDENONG | C735: LITTLE | F735: PENNEFATHER | I735: WATERS | L735: OSBORNE | O735: STAUNTON | R735: MINOTTI
A736: GOALKICKERS
A737: SUNSHINE | C737: STAFFORD 2 | F737: BARCLAY 2 | I737: CROSBIE 2 | K737: GREGORY 2 | N737: KELLY 2 | P737: BARABASZ 2 | S737: TREZISE | U737: WALKER | X737: LAVER | Z737: TURNER
A738: DANDENONG | C738: OSBORNE 2 | F738: CROSBIE 2 | I738: PENNEFATHER | L738: MINOTTI
A740: WILLIAMSTOWN | C740: 3 | D740: 6 | E740: =C740*6+D740 -> 24 | G740: 8 | H740: 13 | I740: =G740*6+H740 -> 61 | K740: 13 | L740: 14 | M740: =K740*6+L740 -> 92 | O740: 20 | P740: 19 | Q740: =O740*6+P740 -> 139 | S740: WILLIAMSTOWN
A741: CAMBERWELL | C741: 3 | D741: 2 | E741: =C741*6+D741 -> 20 | G741: 4 | H741: 4 | I741: =G741*6+H741 -> 28 | K741: 9 | L741: 5 | M741: =K741*6+L741 -> 59 | O741: 10 | P741: 6 | Q741: =O741*6+P741 -> 66 | S741: ROACH
A742: BEST PLAYERS
A743: WILLIAMSTOWN | C743: SMITH | F743: BOB JONES | I743: CLOUGH | L743: WARD | N743: B BEITZEL | Q743: McASEY
A744: CAMBERWELL | C744: THOMPSON | F744: K JOHNSON | I744: CHAPLIN | L744: FREYBERG | N744: KENT | Q744: O'NEILL
A745: GOALKICKERS
A746: WILLIAMSTOWN | C746: R JONES 6 | F746: PELLY 4 | H746: CLOUGH 3 | J746: FREEMAN | L746: HYNES | N746: SMITH | P746: COPE | Q746: WARD | S746: McASEY | U746: EVANS
A747: CAMBERWELL | C747: FREYBERG 4 | F747: O'NEILL 3 | I747: GIBSON | K747: KENT | M747: COMMONS
A749: OAKLEIGH | C749: 7 | D749: 6 | E749: =C749*6+D749 -> 48 | G749: 9 | H749: 9 | I749: =G749*6+H749 -> 63 | K749: 15 | L749: 11 | M749: =K749*6+L749 -> 101 | O749: 17 | P749: 12 | Q749: =O749*6+P749 -> 114 | S749: CAMBERWELL
A750: PRESTON | C750: 2 | D750: 0 | E750: =C750*6+D750 -> 12 | G750: 4 | H750: 4 | I750: =G750*6+H750 -> 28 | K750: 7 | L750: 5 | M750: =K750*6+L750 -> 47 | O750: 11 | P750: 11 | Q750: =O750*6+P750 -> 77 | S750: HORNE
A751: BEST PLAYERS
A752: OAKLEIGH | C752: COUGHLAN | F752: McCOOKE | I752: KITTO | L752: ALLSOP | O752: WILLIAMS | R752: COLLINS
A753: PRESTON | C753: BERGIN | F753: WATSON | I753: WALKER | L753: WOOD | O753: HOWARD | R753: HAUGHTON
A754: GOALKICKERS
A755: OAKLEIGH | C755: WILLIAMS 5 | F755: COUGHLAN 3 | I755: McCOOKE 3 | L755: ALLSOP 3 | N755: JONES 2 | P755: PALMER
A756: PRESTON | C756: LORD 3 | F756: WATSON 2 | I756: BERGIN 2 | K756: McDONNELL 2 | N756: DAVIS | P756: HOWARD
C757: 19TH JUNE
A758: NORTHCOTE | C758: 2 | D758: 7 | E758: =C758*6+D758 -> 19 | G758: 6 | H758: 8 | I758: =G758*6+H758 -> 44 | K758: 13 | L758: 9 | M758: =K758*6+L758 -> 87 | O758: 16 | P758: 11 | Q758: =O758*6+P758 -> 107 | S758: NORTHCOTE
A759: PRAHRAN | C759: 1 | D759: 1 | E759: =C759*6+D759 -> 7 | G759: 1 | H759: 7 | I759: =G759*6+H759 -> 13 | K759: 4 | L759: 8 | M759: =K759*6+L759 -> 32 | O759: 7 | P759: 10 | Q759: =O759*6+P759 -> 52 | S759: SMITH
A760: BEST PLAYERS
A761: NORTHCOTE | C761: VAINS | F761: OLIVER | I761: HICKS | L761: HOSKINGS | O761: MORAN | Q761: BRETHERTON
A762: PRAHRAN | C762: PEARSON | F762: CLEMENTS | I762: O'BRIEN | L762: HARVEY | O762: LEWIS | Q762: HAYES
A763: GOALKICKERS
A764: NORTHCOTE | C764: HICKS 5 | F764: VAINS 3 | I764: MARCHANT 2 | L764: MORAN 2 | N764: AGHAN 2 | Q764: HOSKINGS | T764: HAMILTON
A765: PRAHRAN | C765: LEWIS 4 | F765: HARVEY | I765: PEARSON | L765: HARRIS
A767: BYE | C767: BRIGHTON
A769: ROUND 11 | E769: 25TH JUNE | K769: WEATHER | P769: FINE | S769: PLAYED AT
D770: 1ST QTR | H770: 2ND QTR | L770: 3RD QTR | P770: FINAL | S770: PORT MELBOURNE
A771: PORT MELBOURNE | C771: 3 | D771: 1 | E771: =C771*6+D771 -> 19 | G771: 10 | H771: 4 | I771: =G771*6+H771 -> 64 | K771: 14 | L771: 9 | M771: =K771*6+L771 -> 93 | O771: 17 | P771: 14 | Q771: =O771*6+P771 -> 116 | S771: UMPIRE | X771: LADDER | AB771: ROUND | AD771: 11
A772: NORTHCOTE | C772: 1 | D772: 8 | E772: =C772*6+D772 -> 14 | G772: 3 | H772: 9 | I772: =G772*6+H772 -> 27 | K772: 4 | L772: 10 | M772: =K772*6+L772 -> 34 | O772: 7 | P772: 13 | Q772: =O772*6+P772 -> 55 | S772: TREWIN
A773: BEST PLAYERS | W773: TEAM | X773: W | Y773: L | Z773: D | AA773: FOR | AB773: AGST | AC773: % | AD773: PTS
A774: PORT MELBOURNE | C774: MONKS | F774: CLARK | I774: FURNESS | L774: LAWSON | N774: BONNETT | Q774: WHITE
A775: NORTHCOTE | C775: BRETHERTON | F775: BARTLEY | I775: MARCHANT | L775: OLIVER | N775: FINN | Q775: VAINS | W775: SANDRINGHAM | X775: 8 | Y775: 2 | Z775: 0 | AA775: 1187 | AB775: 549 | AC775: 216.21 | AD775: 32
A776: GOALKICKERS | W776: OAKLEIGH | X776: 8 | Y776: 2 | Z776: 0 | AA776: 936 | AB776: 622 | AC776: 150.48231511254019 | AD776: 32
A777: PORT MELBOURNE | C777: BONNETT 7 | F777: MONKS 3 | I777: McLEOD 2 | K777: CONWAY 2 | N777: JOLIFFE | P777: FITZGERALD | S777: McMILLAN | W777: COBURG | X777: 8 | Y777: 3 | Z777: 0 | AA777: 1069 | AB777: 736 | AC777: 145.24456521739131 | AD777: 32
A778: NORTHCOTE | C778: BARTLEY 2 | F778: MORAN | I778: VAINS | K778: HOSKING | M778: AGHAN | O778: McMAHON | W778: MOORABBIN | X778: 8 | Y778: 2 | Z778: 0 | AA778: 907 | AB778: 652 | AC778: 139.11 | AD778: 32
W779: YARRAVILLE | X779: 8 | Y779: 3 | Z779: 0 | AA779: 942 | AB779: 700 | AC779: 134.57142857142858 | AD779: 32
A780: OAKLEIGH | C780: 3 | D780: 5 | E780: =C780*6+D780 -> 23 | G780: 7 | H780: 10 | I780: =G780*6+H780 -> 52 | K780: 15 | L780: 12 | M780: =K780*6+L780 -> 102 | O780: 21 | P780: 17 | Q780: =O780*6+P780 -> 143 | S780: DANDENONG | W780: WILLIAMSTOWN | X780: 7 | Y780: 4 | Z780: 0 | AA780: 1000 | AB780: 709 | AC780: 141.04372355430183 | AD780: 28
A781: DANDENONG | C781: 2 | D781: 3 | E781: =C781*6+D781 -> 15 | G781: 3 | H781: 5 | I781: =G781*6+H781 -> 23 | K781: 6 | L781: 7 | M781: =K781*6+L781 -> 43 | O781: 7 | P781: 11 | Q781: =O781*6+P781 -> 53 | S781: POLLARD
A782: BEST PLAYERS | W782: BRUNSWICK | X782: 7 | Y782: 4 | Z782: 0 | AA782: 810 | AB782: 707 | AC782: 114.56859971711457 | AD782: 28
A783: OAKLEIGH | C783: ALLSOPP | F783: McCOOKE | I783: NAISMITH | L783: McKEOGH | O783: JONES | Q783: CLEMENTS | W783: PORT MELBOURNE | X783: 6 | Y783: 5 | Z783: 0 | AA783: 922 | AB783: 739 | AC783: 124.76319350473614 | AD783: 24
A784: DANDENONG | C784: LITTLE | F784: KILPATRICK | I784: G WILLIAMS | L784: ROSETTI | O784: RANKIN | Q784: STAUNTON | W784: MORDIALLOC | X784: 6 | Y784: 4 | Z784: 0 | AA784: 802 | AB784: 681 | AC784: 117.77 | AD784: 24
A785: GOALKICKERS | W785: BOX HILL | X785: 5 | Y785: 5 | Z785: 0 | AA785: 699 | AB785: 786 | AC785: 88.931297709923669 | AD785: 20
A786: OAKLEIGH | C786: ALLSOPP 6 | F786: CLEMENTS 5 | I786: McCOOKE 5 | L786: J WILLIAMS 2 | O786: COLLINS | Q786: JONES | S786: PANNAM | W786: NORTHCOTE | X786: 4 | Y786: 6 | Z786: 1 | AA786: 781 | AB786: 1005 | AC786: 77.711442786069654 | AD786: 18
A787: DANDENONG | C787: CROSBIE 2 | F787: RANKIN 2 | I787: ROSETTI | K787: THOMAS | M787: GILLINGHAM | W787: PRESTON | X787: 4 | Y787: 7 | Z787: 0 | AA787: 699 | AB787: 851 | AC787: 82.138660399529968 | AD787: 16
W788: DANDENONG | X788: 4 | Y788: 6 | Z788: 0 | AA788: 657 | AB788: 823 | AC788: 79.829890643985422 | AD788: 16
A789: MORDIALLOC | C789: 6 | D789: 7 | E789: =C789*6+D789 -> 43 | G789: 7 | H789: 9 | I789: =G789*6+H789 -> 51 | K789: 13 | L789: 14 | M789: =K789*6+L789 -> 92 | O789: 14 | P789: 15 | Q789: =O789*6+P789 -> 99 | S789: CAMBERWELL | W789: SUNSHINE | X789: 2 | Y789: 8 | Z789: 1 | AA789: 667 | AB789: 1013 | AC789: 65.844027640671271 | AD789: 10
A790: CAMBERWELL | C790: 1 | D790: 0 | E790: =C790*6+D790 -> 6 | G790: 5 | H790: 6 | I790: =G790*6+H790 -> 36 | K790: 7 | L790: 7 | M790: =K790*6+L790 -> 49 | O790: 10 | P790: 11 | Q790: =O790*6+P790 -> 71 | S790: BAIRD | W790: CAMBERWELL | X790: 2 | Y790: 8 | Z790: 0 | AA790: 626 | AB790: 955 | AC790: 65.549738219895289 | AD790: 8
A791: BEST PLAYERS | W791: PRAHRAN | X791: 0 | Y791: 9 | Z791: 0 | AA791: 479 | AB791: 921 | AC791: 52.01 | AD791: 0
A792: MORDIALLOC | C792: MINAHAN | F792: JOSE | I792: NISBET | K792: McMILLAN | N792: ROBERTS | Q792: DULLARD | W792: BRIGHTON | X792: 0 | Y792: 9 | Z792: 0 | AA792: 464 | AB792: 1198 | AC792: 38.731218697829718 | AD792: 0
A793: CAMBERWELL | C793: QUIRK | F793: J THOMPSON | I793: WHITTEN | K793: SKALBERG | N793: B JOHNSON | Q793: COMMONS
A794: GOALKICKERS
A795: MORDIALLOC | C795: DALE 5 | E795: MINAHAN 4 | H795: McMILLAN | J795: PEARSON | L795: ROBERTS | N795: McGUINNESS | Q795: NISBET
A796: CAMBERWELL | C796: QUIRK 3 | F796: COMMONS 2 | I796: FREYBERG 2 | L796: O'NEILL | N796: GIBSON | P796: ELLIS
A798: BRUNSWICK | C798: 2 | D798: 5 | E798: =C798*6+D798 -> 17 | G798: 5 | H798: 8 | I798: =G798*6+H798 -> 38 | K798: 9 | L798: 9 | M798: =K798*6+L798 -> 63 | O798: 11 | P798: 11 | Q798: =O798*6+P798 -> 77 | S798: BRUNSWICK
A799: SUNSHINE | C799: 0 | D799: 4 | E799: =C799*6+D799 -> 4 | G799: 2 | H799: 7 | I799: =G799*6+H799 -> 19 | K799: 8 | L799: 8 | M799: =K799*6+L799 -> 56 | O799: 8 | P799: 12 | Q799: =O799*6+P799 -> 60 | S799: ROACH
A800: BEST PLAYERS
A801: BRUNSWICK | C801: DENTON | F801: JOHNSON | I801: BIBBY | K801: WATTS | N801: STANLEY | Q801: VELO
A802: SUNSHINE | C802: BARCLAY | F802: CROSBIE | I802: GREGORY | K802: SWEENEY | N802: PRESTON | Q802: WALKER
A803: GOALKICKERS
A804: BRUNSWICK | C804: AMBROSE 3 | F804: BIBBY 2 | I804: MILLER 2 | L804: STANLEY | N804: THORLEY | P804: DENTON | R804: ROBSON
A805: SUNSHINE | C805: SEYMOUR 3 | F805: STAFFORD 2 | I805: BARCLAY 2 | L805: CROSBIE
A807: BOX HILL | C807: 5 | D807: 3 | E807: =C807*6+D807 -> 33 | G807: 6 | H807: 3 | I807: =G807*6+H807 -> 39 | K807: 7 | L807: 6 | M807: =K807*6+L807 -> 48 | O807: 9 | P807: 8 | Q807: =O807*6+P807 -> 62 | S807: MOORABBIN
A808: MOORABBIN | C808: 1 | D808: 2 | E808: =C808*6+D808 -> 8 | G808: 3 | H808: 7 | I808: =G808*6+H808 -> 25 | K808: 3 | L808: 9 | M808: =K808*6+L808 -> 27 | O808: 5 | P808: 12 | Q808: =O808*6+P808 -> 42 | S808: McMASTER
A809: BEST PLAYERS
A810: BOX HILL | C810: WHITE | F810: WITNISH | I810: GRAY | K810: ROCHOW | N810: SAUNDERS | Q810: SHORT
A811: MOORABBIN | C811: BOYD | F811: BUZZA | I811: KENT | K811: CLARK | N811: MILLS | Q811: MANIE
A812: GOALKICKERS
A813: BOX HILL | C813: WHITE 4 | F813: GRAY 2 | I813: CHEFFERS | L813: MACE | N813: WITNISH
A814: MOORABBIN | C814: RYAN 3 | F814: BILLSON | I814: BAKER
A816: PRESTON | C816: 3 | D816: 7 | E816: =C816*6+D816 -> 25 | G816: 4 | H816: 8 | I816: =G816*6+H816 -> 32 | K816: 10 | L816: 11 | M816: =K816*6+L816 -> 71 | O816: 10 | P816: 11 | Q816: =O816*6+P816 -> 71 | S816: PRESTON
A817: COBURG | C817: 2 | D817: 3 | E817: =C817*6+D817 -> 15 | G817: 2 | H817: 10 | I817: =G817*6+H817 -> 22 | K817: 2 | L817: 12 | M817: =K817*6+L817 -> 24 | O817: 6 | P817: 18 | Q817: =O817*6+P817 -> 54 | S817: SCOTT
A818: BEST PLAYERS
A819: PRESTON | C819: P LORD | F819: HAUGHTON | I819: BERGIN | L819: WALSH | O819: HOWARD | R819: MILLER
A820: COBURG | C820: BIGELOW | F820: HOOGEN | I820: O'BRIEN | L820: CARR | O820: TANCREDI | R820: HOLT
A821: GOALKICKERS
A822: PRESTON | C822: BERGIN 3 | F822: LAMBIE 2 | I822: WOOD | K822: McDONNELL | N822: HOWARD | P822: WALSH | R822: HAUGHTON
A823: COBURG | C823: CARR 3 | F823: SHAW 2 | I823: BRENNAN
A825: SANDRINGHAM | C825: 3 | D825: 8 | E825: =C825*6+D825 -> 26 | G825: 11 | H825: 13 | I825: =G825*6+H825 -> 79 | K825: 14 | L825: 21 | M825: =K825*6+L825 -> 105 | O825: 22 | P825: 30 | Q825: =O825*6+P825 -> 162 | S825: ELSTERNWICK PARK
A826: BRIGHTON | C826: 2 | D826: 6 | E826: =C826*6+D826 -> 18 | G826: 5 | H826: 7 | I826: =G826*6+H826 -> 37 | K826: 8 | L826: 10 | M826: =K826*6+L826 -> 58 | O826: 8 | P826: 11 | Q826: =O826*6+P826 -> 59 | S826: MARCY
A827: BEST PLAYERS
A828: SANDRINGHAM | C828: BOLAND | F828: MURRAY | I828: STRACHAN | L828: OAKLEY | O828: McKENZIE | R828: ALLSOP
A829: BRIGHTON | C829: CRAIG | F829: McCANN | I829: MOULE | L829: BURSEY | O829: W COOPER | R829: BROWNING
A830: GOALKICKERS
A831: SANDRINGHAM | C831: OAKLEY 8 | F831: GLEESON 3 | I831: PATMORE 3 | L831: ALLSOP 3 | N831: MURRAY 2 | Q831: PETCH 2 | T831: RASMUSSEN
A832: BRIGHTON | C832: CRAIG | E832: BROWNING | G832: BEGLEY | I832: HOWELL | K832: QUIRK | M832: FREEMAN | O832: TURNER | Q832: BURSEY
C833: 26TH JUNE
A834: WILLIAMSTOWN | C834: 4 | D834: 3 | E834: =C834*6+D834 -> 27 | G834: 8 | H834: 11 | I834: =G834*6+H834 -> 59 | K834: 9 | L834: 14 | M834: =K834*6+L834 -> 68 | O834: 14 | P834: 23 | Q834: =O834*6+P834 -> 107 | S834: YARRAVILLE
A835: YARRAVILLE | C835: 3 | D835: 5 | E835: =C835*6+D835 -> 23 | G835: 6 | H835: 6 | I835: =G835*6+H835 -> 42 | K835: 7 | L835: 8 | M835: =K835*6+L835 -> 50 | O835: 8 | P835: 10 | Q835: =O835*6+P835 -> 58 | S835: O'DONOGHUE
A836: BEST PLAYERS
A837: WILLIAMSTOWN | C837: PELLY | F837: MALONEY | I837: WARD | L837: COPE | O837: SMITH | R837: McASEY
A838: YARRAVILLE | C838: RON BROWN | F838: LAMONT | I838: ORANGE | L838: BOURKE | O838: ANDERSON | R838: HART
A839: GOALKICKERS
A840: WILLIAMSTOWN | C840: CULLINAN 3 | F840: PELLY 3 | H840: MALONEY 3 | K840: McASEY 2 | N840: CLOUGH 2 | Q840: EVANS
A841: YARRAVILLE | C841: MEDDINGS 3 | F841: McCABE 3 | I841: CROOK 2
A843: BYE | C843: PRAHRAN
A845: ROUND 12 | E845: 2ND JULY | K845: WEATHER | P845: COLD FOGGY | S845: PLAYED AT
D846: 1ST QTR | H846: 2ND QTR | L846: 3RD QTR | P846: FINAL | S846: CAMBERWELL
A847: OAKLEIGH | C847: 5 | D847: 2 | E847: =C847*6+D847 -> 32 | G847: 6 | H847: 8 | I847: =G847*6+H847 -> 44 | K847: 10 | L847: 8 | M847: =K847*6+L847 -> 68 | O847: 19 | P847: 12 | Q847: =O847*6+P847 -> 126 | S847: UMPIRE | X847: LADDER | AB847: ROUND | AD847: 12
A848: MOORABBIN | C848: 3 | D848: 1 | E848: =C848*6+D848 -> 19 | G848: 5 | H848: 4 | I848: =G848*6+H848 -> 34 | K848: 8 | L848: 6 | M848: =K848*6+L848 -> 54 | O848: 8 | P848: 10 | Q848: =O848*6+P848 -> 58 | S848: TREWIN
A849: BEST PLAYERS | W849: TEAM | X849: W | Y849: L | Z849: D | AA849: FOR | AB849: AGST | AC849: % | AD849: PTS
A850: OAKLEIGH | C850: ALLSOPP | F850: COLLINS | I850: McCOOKE | L850: JONES | O850: WILLIAMS | R850: HAY
A851: MOORABBIN | C851: CRAMERI | F851: MANIE | I851: CLARK | L851: WALDRON | O851: MILLS | R851: HOY | W851: SANDRINGHAM | X851: 9 | Y851: 2 | Z851: 0 | AA851: 1307 | AB851: 589 | AC851: 221.9 | AD851: 36
A852: GOALKICKERS | W852: OAKLEIGH | X852: 9 | Y852: 2 | Z852: 0 | AA852: 1062 | AB852: 680 | AC852: 156.1764705882353 | AD852: 36
A853: OAKLEIGH | C853: CLEMENTS 6 | F853: JONES 4 | H853: HALL 2 | J853: WILLIAMS 2 | M853: COLLINS 2 | O853: PALMER | Q853: McOOKE | S853: KITTO | W853: COBURG | X853: 9 | Y853: 3 | Z853: 0 | AA853: 1163 | AB853: 784 | AC853: 148.34183673469389 | AD853: 36
A854: MOORABBIN | C854: MILLS 3 | F854: CRAMERI 2 | I854: BULMER | K854: PAXTON | M854: HOGAN | W854: WILLIAMSTOWN | X854: 8 | Y854: 4 | Z854: 0 | AA854: 1101 | AB854: 783 | AC854: 140.61302681992336 | AD854: 32
W855: YARRAVILLE | X855: 8 | Y855: 3 | Z855: 0 | AA855: 942 | AB855: 700 | AC855: 134.57142857142858 | AD855: 32
A856: WILLIAMSTOWN | C856: 2 | D856: 3 | E856: =C856*6+D856 -> 15 | G856: 8 | H856: 6 | I856: =G856*6+H856 -> 54 | K856: 11 | L856: 10 | M856: =K856*6+L856 -> 76 | O856: 15 | P856: 11 | Q856: =O856*6+P856 -> 101 | S856: WILLIAMSTOWN | W856: MOORABBIN | X856: 8 | Y856: 3 | Z856: 0 | AA856: 965 | AB856: 778 | AC856: 124.04 | AD856: 32
A857: PORT MELBOURNE | C857: 2 | D857: 4 | E857: =C857*6+D857 -> 16 | G857: 3 | H857: 5 | I857: =G857*6+H857 -> 23 | K857: 8 | L857: 7 | M857: =K857*6+L857 -> 55 | O857: 11 | P857: 8 | Q857: =O857*6+P857 -> 74 | S857: POLLARD
A858: BEST PLAYERS | W858: MORDIALLOC | X858: 7 | Y858: 4 | Z858: 0 | AA858: 877 | AB858: 741 | AC858: 118.35 | AD858: 28
A859: WILLIAMSTOWN | C859: SMITH | F859: McASEY | I859: WARD | K859: MALONEY | N859: COLLINS | Q859: MAZOURIS | W859: BRUNSWICK | X859: 7 | Y859: 5 | Z859: 0 | AA859: 858 | AB859: 801 | AC859: 107.11610486891385 | AD859: 28
A860: PORT MELBOURNE | C860: LEWIS | F860: BONNETT | I860: BOWEN | K860: HARRIS | N860: CLAXTON | Q860: COVENTRY | W860: PORT MELBOURNE | X860: 6 | Y860: 6 | Z860: 0 | AA860: 996 | AB860: 840 | AC860: 118.57142857142857 | AD860: 24
A861: GOALKICKERS | W861: BOX HILL | X861: 6 | Y861: 5 | Z861: 0 | AA861: 838 | AB861: 863 | AC861: 97.103128621089226 | AD861: 24
A862: WILLIAMSTOWN | C862: CULLINAN 4 | F862: MAZOURIS 3 | I862: CLOUGH 3 | K862: McASEY 2 | N862: COPE | P862: SMITH | R862: HILL | W862: NORTHCOTE | X862: 5 | Y862: 6 | Z862: 1 | AA862: 880 | AB862: 1090 | AC862: 80.733944954128447 | AD862: 22
A863: PORT MELBOURNE | C863: BONNETT 5 | F863: McMILLAN 2 | I863: CLAXTON | K863: McDONALD | N863: BOWEN | W863: PRESTON | X863: 4 | Y863: 8 | Z863: 0 | AA863: 784 | AB863: 950 | AC863: 82.526315789473685 | AD863: 16
W864: DANDENONG | X864: 4 | Y864: 7 | Z864: 0 | AA864: 697 | AB864: 943 | AC864: 73.91 | AD864: 16
A865: CAMBERWELL | C865: 2 | D865: 6 | E865: =C865*6+D865 -> 18 | G865: 7 | H865: 10 | I865: =G865*6+H865 -> 52 | K865: 11 | L865: 12 | M865: =K865*6+L865 -> 78 | O865: 15 | P865: 15 | Q865: =O865*6+P865 -> 105 | S865: SUNSHINE | W865: CAMBERWELL | X865: 3 | Y865: 8 | Z865: 0 | AA865: 731 | AB865: 1008 | AC865: 72.519841269841265 | AD865: 12
A866: SUNSHINE | C866: 2 | D866: 1 | E866: =C866*6+D866 -> 13 | G866: 4 | H866: 3 | I866: =G866*6+H866 -> 27 | K866: 5 | L866: 5 | M866: =K866*6+L866 -> 35 | O866: 7 | P866: 11 | Q866: =O866*6+P866 -> 53 | S866: O'DONOGHUE | W866: SUNSHINE | X866: 2 | Y866: 9 | Z866: 1 | AA866: 720 | AB866: 1118 | AC866: 64.400715563506267 | AD866: 10
A867: BEST PLAYERS | W867: PRAHRAN | X867: 0 | Y867: 10 | Z867: 0 | AA867: 556 | AB867: 1060 | AC867: 52.45 | AD867: 0
A868: CAMBERWELL | C868: O'NEILL | F868: CHAPLIN | I868: COMMONS | L868: G ELLIS | N868: B JOHNSON | Q868: THOMPSON | W868: BRIGHTON | X868: 0 | Y868: 10 | Z868: 0 | AA868: 524 | AB868: 1273 | AC868: 41.162608012568732 | AD868: 0
A869: SUNSHINE | C869: TRESIZE | F869: SAUNDERS | I869: N KEMP | L869: PRESTON | N869: CROSBIE | Q869: OLARENSHAW
A870: GOALKICKERS
A871: CAMBERWELL | C871: O'NEILL 6 | F871: FREIBERG 3 | I871: B ELLIS 2 | L871: KENT | N871: G ELLIS | P871: GIBSON | R871: McGUINNESS
A872: SUNSHINE | C872: KELLY 2 | F872: CROSBIE 2 | I872: STAFFORD | L872: GREGORY | N872: I KEMP
A874: BOX HILL | C874: 5 | D874: 4 | E874: =C874*6+D874 -> 34 | G874: 8 | H874: 8 | I874: =G874*6+H874 -> 56 | K874: 11 | L874: 15 | M874: =K874*6+L874 -> 81 | O874: 20 | P874: 19 | Q874: =O874*6+P874 -> 139 | S874: TOORAK PARK
A875: PRAHRAN | C875: 1 | D875: 3 | E875: =C875*6+D875 -> 9 | G875: 5 | H875: 6 | I875: =G875*6+H875 -> 36 | K875: 9 | L875: 6 | M875: =K875*6+L875 -> 60 | O875: 11 | P875: 11 | Q875: =O875*6+P875 -> 77 | S875: ROACH
A876: BEST PLAYERS
A877: BOX HILL | C877: WHITE | F877: SALVADO | I877: GLARE | K877: BEASY | N877: BROWN | Q877: WITTMER
A878: PRAHRAN | C878: HARVEY | F878: CHRISTIAN | I878: SEEDY | K878: ROSS JONES | N878: BOYD | Q878: ANDERSON
A879: GOALKICKERS
A880: BOX HILL | C880: SALVADO 6 | F880: EADE 2 | H880: WITNISH 2 | J880: GLARE 2 | L880: BEASY 2 | N880: WHITE 2 | P880: BROWN 2 | R880: MACE | T880: GRAY
A881: PRAHRAN | C881: ANDERSON 3 | F881: LEWIS 2 | H881: CHRISTIAN 2 | K881: BOYD 2 | M881: MURPHY | O881: HARRIS
A883: SANDRINGHAM | C883: 2 | D883: 4 | E883: =C883*6+D883 -> 16 | G883: 8 | H883: 11 | I883: =G883*6+H883 -> 59 | K883: 11 | L883: 18 | M883: =K883*6+L883 -> 84 | O883: 16 | P883: 24 | Q883: =O883*6+P883 -> 120 | S883: BEACH ROAD
A884: DANDENONG | C884: 2 | D884: 4 | E884: =C884*6+D884 -> 16 | G884: 3 | H884: 5 | I884: =G884*6+H884 -> 23 | K884: 4 | L884: 8 | M884: =K884*6+L884 -> 32 | O884: 5 | P884: 10 | Q884: =O884*6+P884 -> 40 | S884: BAIRD
A885: BEST PLAYERS
A886: SANDRINGHAM | C886: THOMPSON | F886: RANSOM | I886: MUTER | L886: McKENZIE | O886: MURRAY | R886: EVANS
A887: DANDENONG | C887: ROSETTI | F887: OSBORNE | I887: GOOD | L887: RANKIN | O887: STAUNTON | R887: WILLIAMS
A888: GOALKICKERS
A889: SANDRINGHAM | C889: OAKLEY 4 | F889: EVANS 4 | I889: MURRAY 3 | L889: MUTER 2 | N889: THOMPSON | Q889: ALLSOP | S889: BARRAN
A890: DANDENONG | C890: RANKIN 2 | F890: CROSBIE | I890: OSBORNE | L890: STAUNTON
D891: 3RD JULY
A892: COBURG | C892: 1 | D892: 3 | E892: =C892*6+D892 -> 9 | G892: 7 | H892: 6 | I892: =G892*6+H892 -> 48 | K892: 12 | L892: 7 | M892: =K892*6+L892 -> 79 | O892: 14 | P892: 10 | Q892: =O892*6+P892 -> 94 | S892: COBURG
A893: BRUNSWICK | C893: 1 | D893: 1 | E893: =C893*6+D893 -> 7 | G893: 3 | H893: 4 | I893: =G893*6+H893 -> 22 | K893: 5 | L893: 5 | M893: =K893*6+L893 -> 35 | O893: 7 | P893: 6 | Q893: =O893*6+P893 -> 48 | S893: HORNE
A894: BEST PLAYERS
A895: COBURG | C895: WILSON | F895: CARR | I895: HINKS | L895: MATTHEWS | O895: O'BRIEN | R895: BIGELOW
A896: BRUNSWICK | C896: BIBBY | F896: MATTHEWS | I896: K DILLON | L896: AMBROSE | O896: R DILLON | R896: ROBSON
A897: GOALKICKERS
A898: COBURG | C898: COLBERT 4 | F898: WATSON 4 | I898: CARR 3 | K898: SHAW 2 | M898: O'BRIEN
A899: BRUNSWICK | C899: MATTHEWS 2 | F899: K DILLON 2 | I899: VELO | K899: BIBBY | M899: DENTON
A901: NORTHCOTE | C901: 1 | D901: 1 | E901: =C901*6+D901 -> 7 | G901: 5 | H901: 4 | I901: =G901*6+H901 -> 34 | K901: 9 | L901: 8 | M901: =K901*6+L901 -> 62 | O901: 15 | P901: 9 | Q901: =O901*6+P901 -> 99 | S901: NORTHCOTE
A902: PRESTON | C902: 5 | D902: 8 | E902: =C902*6+D902 -> 38 | G902: 8 | H902: 10 | I902: =G902*6+H902 -> 58 | K902: 11 | L902: 16 | M902: =K902*6+L902 -> 82 | O902: 11 | P902: 19 | Q902: =O902*6+P902 -> 85 | S902: BREWER
A903: BEST PLAYERS
A904: NORTHCOTE | C904: VAINS | F904: HAMILTON | I904: OLIVER | L904: MARCHANT | O904: ROOTSEY | R904: McMAHON
A905: PRESTON | C905: WOODS | F905: BERGIN | I905: LAMBIE | L905: WALKER | O905: P LORD | R905: WATSON
A906: GOALKICKERS
A907: NORTHCOTE | C907: SHAW 4 | E907: MARCHANT 3 | H907: VAINS 2 | J907: MORAN | L907: HAMILTON | N907: McMAHON | Q907: BRETHERTON | T907: O'BIERNE | W907: OLIVER
A908: PRESTON | C908: BERGIN 3 | F908: LAMBIE 2 | I908: WOODS 2 | K908: HOWARD | M908: McMAHON | O908: McDONNELL | R908: McCRIMMON
A910: MORDIALLOC | C910: 3 | D910: 0 | E910: =C910*6+D910 -> 18 | G910: 5 | H910: 2 | I910: =G910*6+H910 -> 32 | K910: 9 | L910: 5 | M910: =K910*6+L910 -> 59 | O910: 11 | P910: 9 | Q910: =O910*6+P910 -> 75 | S910: MORDIALLOC
A911: BRIGHTON | C911: 1 | D911: 2 | E911: =C911*6+D911 -> 8 | G911: 2 | H911: 6 | I911: =G911*6+H911 -> 18 | K911: 5 | L911: 10 | M911: =K911*6+L911 -> 40 | O911: 8 | P911: 12 | Q911: =O911*6+P911 -> 60 | S911: SMITH
A912: BEST PLAYERS
A913: MORDIALLOC | C913: MAGUINNESS | F913: CRANE | I913: McMILLAN | L913: DULLARD | O913: MINAHAN | R913: MAUNDER
A914: BRIGHTON | C914: McCANN | F914: BURSEY | I914: MOULE | L914: ELDERING | O914: GRANT | R914: BROWNING
A915: GOALKICKERS
A916: MORDIALLOC | C916: MAGUINNESS 2 | F916: MINAHAN 2 | I916: ROBERTS 2 | L916: KAVANAGH | O916: PEARSON | Q916: McMILLAN | T916: DALE | V916: MAUNDER
A917: BRIGHTON | C917: ASHENHURST 2 | F917: QUIRK 2 | H917: FOX | I917: ELDERING | K917: BURSEY | M917: BROWNING
A919: BYE | C919: YARRAVILLE
A921: ROUND 13 | E921: 9TH JULY | I921: WEATHER | K921: STRONG NORTH WIND RAIN AT FINISH | S921: PLAYED AT
D922: 1ST QTR | H922: 2ND QTR | L922: 3RD QTR | P922: FINAL | S922: MOORABBIN
A923: MOORABBIN | C923: 7 | D923: 3 | E923: =C923*6+D923 -> 45 | G923: 8 | H923: 5 | I923: =G923*6+H923 -> 53 | K923: 11 | L923: 10 | M923: =K923*6+L923 -> 76 | O923: 12 | P923: 13 | Q923: =O923*6+P923 -> 85 | S923: UMPIRE | X923: LADDER | AB923: ROUND | AD923: 13
A924: SANDRINGHAM | C924: 1 | D924: 1 | E924: =C924*6+D924 -> 7 | G924: 5 | H924: 5 | I924: =G924*6+H924 -> 35 | K924: 6 | L924: 6 | M924: =K924*6+L924 -> 42 | O924: 10 | P924: 9 | Q924: =O924*6+P924 -> 69 | S924: HORNE
A925: BEST PLAYERS | W925: TEAM | X925: W | Y925: L | Z925: D | AA925: FOR | AB925: AGST | AC925: % | AD925: PTS
A926: MOORABBIN | C926: MORONEY | F926: CRAMERI | I926: PAPLEY | L926: WHALEBONE | O926: RYAN | Q926: GILDER
A927: SANDRINGHAM | C927: CROFT | F927: OAKLEY | I927: ALLSOP | L927: BOLAND | O927: WEBSTER | Q927: JONES
A928: GOALKICKERS | W928: OAKLEIGH | X928: 10 | Y928: 2 | Z928: 0 | AA928: 1171 | AB928: 726 | AC928: 161.29476584022038 | AD928: 40
A929: MOORABBIN | C929: MORONEY 3 | F929: CRAMERI 3 | I929: WHALEBONE 2 | L929: RYAN 2 | N929: MEEHAN | P929: PAPLEY | W929: COBURG | X929: 10 | Y929: 3 | Z929: 0 | AA929: 1304 | AB929: 827 | AC929: 157.6783555018138 | AD929: 40
A930: SANDRINGHAM | C930: OAKLEY 3 | F930: PATMORE 2 | I930: GLEESON 2 | L930: EVANS | N930: ALLSOP | P930: WEBSTER | W930: SANDRINGHAM | X930: 9 | Y930: 3 | Z930: 0 | AA930: 1376 | AB930: 674 | AC930: 204.15 | AD930: 36
W931: WILLIAMSTOWN | X931: 9 | Y931: 4 | Z931: 0 | AA931: 1181 | AB931: 851 | AC931: 138.77790834312574 | AD931: 36
A932: PORT MELBOURNE | C932: 0 | D932: 1 | E932: =C932*6+D932 -> 1 | G932: 3 | H932: 6 | I932: =G932*6+H932 -> 24 | K932: 4 | L932: 8 | M932: =K932*6+L932 -> 32 | O932: 6 | P932: 12 | Q932: =O932*6+P932 -> 48 | S932: PORT MELBOURNE | W932: MOORABBIN | X932: 9 | Y932: 3 | Z932: 0 | AA932: 1050 | AB932: 847 | AC932: 123.97 | AD932: 36
A933: YARRAVILLE | C933: 4 | D933: 3 | E933: =C933*6+D933 -> 27 | G933: 4 | H933: 4 | I933: =G933*6+H933 -> 28 | K933: 7 | L933: 5 | M933: =K933*6+L933 -> 47 | O933: 7 | P933: 6 | Q933: =O933*6+P933 -> 48 | S933: O'DONOGHUE | W933: YARRAVILLE | X933: 8 | Y933: 3 | Z933: 1 | AA933: 990 | AB933: 748 | AC933: 132.35294117647058 | AD933: 34
A934: BEST PLAYERS
A935: PORT MELBOURNE | C935: FREYER | F935: MONKS | I935: McDONALD | L935: HARRIS | O935: FITZGERALD | R935: LEWIS | W935: MORDIALLOC | X935: 8 | Y935: 4 | Z935: 0 | AA935: 922 | AB935: 772 | AC935: 119.43 | AD935: 32
A936: YARRAVILLE | C936: McTAGGART | F936: FLEMING | I936: CROOK | L936: WILLIAMS | O936: NARKIEWICZ | R936: MEDDINGS | W936: BRUNSWICK | X936: 8 | Y936: 5 | Z936: 0 | AA936: 946 | AB936: 869 | AC936: 108.86075949367088 | AD936: 32
A937: GOALKICKERS | W937: PORT MELBOURNE | X937: 6 | Y937: 6 | Z937: 1 | AA937: 1044 | AB937: 888 | AC937: 117.56756756756756 | AD937: 26
A938: PORT MELBOURNE | C938: BONNETT 2 | F938: MONKS 2 | I938: SPENCE | K938: McDONALD | W938: BOX HILL | X938: 6 | Y938: 6 | Z938: 0 | AA938: 884 | AB938: 972 | AC938: 90.946502057613174 | AD938: 24
A939: YARRAVILLE | C939: FLEMING 3 | F939: MEDDINGS 3 | I939: WILLIAMS | W939: NORTHCOTE | X939: 5 | Y939: 7 | Z939: 1 | AA939: 948 | AB939: 1178 | AC939: 80.47538200339558 | AD939: 22
W940: PRESTON | X940: 4 | Y940: 9 | Z940: 0 | AA940: 852 | AB940: 1030 | AC940: 82.71844660194175 | AD940: 16
A941: OAKLEIGH | C941: 6 | D941: 4 | E941: =C941*6+D941 -> 40 | G941: 9 | H941: 5 | I941: =G941*6+H941 -> 59 | K941: 13 | L941: 10 | M941: =K941*6+L941 -> 88 | O941: 16 | P941: 13 | Q941: =O941*6+P941 -> 109 | S941: BOX HILL | W941: CAMBERWELL | X941: 4 | Y941: 8 | Z941: 0 | AA941: 791 | AB941: 1045 | AC941: 75.693779904306226 | AD941: 16
A942: BOX HILL | C942: 1 | D942: 2 | E942: =C942*6+D942 -> 8 | G942: 4 | H942: 5 | I942: =G942*6+H942 -> 29 | K942: 4 | L942: 6 | M942: =K942*6+L942 -> 30 | O942: 6 | P942: 10 | Q942: =O942*6+P942 -> 46 | S942: ALLEN | W942: DANDENONG | X942: 4 | Y942: 8 | Z942: 0 | AA942: 728 | AB942: 988 | AC942: 73.68 | AD942: 16
A943: BEST PLAYERS | W943: SUNSHINE | X943: 2 | Y943: 9 | Z943: 1 | AA943: 720 | AB943: 1118 | AC943: 64.400715563506267 | AD943: 10
A944: OAKLEIGH | C944: JONES | F944: McCOOKE | I944: WILLIAMS | L944: NAISMITH | O944: PEAKE | Q944: COLLINS | W944: PRAHRAN | X944: 0 | Y944: 11 | Z944: 0 | AA944: 593 | AB944: 1120 | AC944: 52.95 | AD944: 0
A945: BOX HILL | C945: BROWN | F945: WHITE | I945: WITTMER | L945: WRIGHT | O945: CRAIG | Q945: SAUNDERS | W945: BRIGHTON | X945: 0 | Y945: 11 | Z945: 0 | AA945: 567 | AB945: 1414 | AC945: 40.099009900990097 | AD945: 0
A946: GOALKICKERS
A947: OAKLEIGH | C947: McCOOKE 5 | F947: JONES 4 | I947: CLEMENTS 3 | L947: J WILLIAMS 3 | O947: HALL
A948: BOX HILL | C948: SALVADO 3 | F948: EADE 2 | I948: BEASY
A950: WILLIAMSTOWN | C950: 3 | D950: 12 | E950: =C950*6+D950 -> 30 | G950: 3 | H950: 14 | I950: =G950*6+H950 -> 32 | K950: 9 | L950: 18 | M950: =K950*6+L950 -> 72 | O950: 10 | P950: 20 | Q950: =O950*6+P950 -> 80 | S950: PRESTON
A951: PRESTON | C951: 0 | D951: 1 | E951: =C951*6+D951 -> 1 | G951: 5 | H951: 4 | I951: =G951*6+H951 -> 34 | K951: 6 | L951: 4 | M951: =K951*6+L951 -> 40 | O951: 10 | P951: 8 | Q951: =O951*6+P951 -> 68 | S951: ROACH
A952: BEST PLAYERS
A953: WILLIAMSTOWN | C953: SMITH | F953: WARD | I953: B BEITZEL | L953: MALONEY | O953: CARMICHAEL | R953: COLLINS
A954: PRESTON | C954: McLACHLAN | F954: LAMBIE | I954: MILLER | L954: JENSEN | O954: WOODS | R954: WALKER
A955: GOALKICKERS
A956: WILLIAMSTOWN | C956: R JONES 3 | F956: MAZOURIS | I956: EVANS | K956: SMITH | M956: CULLINAN | O956: CLOUGH | Q956: WARD | R956: McASEY
A957: PRESTON | C957: LAMBIE 4 | F957: McDONNELL 3 | I957: JENSEN 2 | K957: GRAHAM
A959: BRUNSWICK | C959: 2 | D959: 1 | E959: =C959*6+D959 -> 13 | G959: 5 | H959: 4 | I959: =G959*6+H959 -> 34 | K959: 7 | L959: 7 | M959: =K959*6+L959 -> 49 | O959: 13 | P959: 10 | Q959: =O959*6+P959 -> 88 | S959: BRUNSWICK
A960: NORTHCOTE | C960: 3 | D960: 3 | E960: =C960*6+D960 -> 21 | G960: 3 | H960: 6 | I960: =G960*6+H960 -> 24 | K960: 4 | L960: 11 | M960: =K960*6+L960 -> 35 | O960: 9 | P960: 14 | Q960: =O960*6+P960 -> 68 | S960: BAIRD
A961: BEST PLAYERS
A962: BRUNSWICK | C962: K DILLON | F962: JOHNSON | I962: BRENNAN | L962: WHILEY | O962: STANLEY | R962: BIBBY
A963: NORTHCOTE | C963: BRETHERTON | F963: WRIGHT | I963: VAINS | L963: MARCHANT | O963: ROOTSEY | R963: LAVER
A964: GOALKICKERS
A965: BRUNSWICK | C965: K DILLON 3 | F965: STANLEY 3 | I965: McKENNA 2 | L965: BIBBY 2 | N965: AMBROSE 2 | Q965: AYRES
A966: NORTHCOTE | C966: HICKS 3 | F966: VAINS 2 | I966: BRETHERTON | L966: SHAW | N966: MARCHANT | Q966: HOSKINGS
A968: MORDIALLOC | C968: 0 | D968: 3 | E968: =C968*6+D968 -> 3 | G968: 1 | H968: 4 | I968: =G968*6+H968 -> 10 | K968: 3 | L968: 11 | M968: =K968*6+L968 -> 29 | O968: 5 | P968: 15 | Q968: =O968*6+P968 -> 45 | S968: DANDENONG
A969: DANDENONG | C969: 0 | D969: 4 | E969: =C969*6+D969 -> 4 | G969: 1 | H969: 7 | I969: =G969*6+H969 -> 13 | K969: 1 | L969: 10 | M969: =K969*6+L969 -> 16 | O969: 3 | P969: 13 | Q969: =O969*6+P969 -> 31 | S969: TREWIN
A970: BEST PLAYERS
A971: MORDIALLOC | C971: CRANE | E971: NISBET | H971: ROBERTS | K971: MEADE | N971: MINAHAN | Q971: JOSE
A972: DANDENONG | C972: LITTLE | E972: GOOD | H972: ROSETTI | K972: PENNEFATHER | N972: RANKIN | Q972: STAUNTON
A973: GOALKICKERS
A974: MORDIALLOC | C974: ROBERTS 2 | F974: MINAHAN 2 | J974: RITCHIE
A975: DANDENONG | C975: WHITE | F975: KILPATRICK | J975: PENNEFATHER
A977: CAMBERWELL | C977: 1 | D977: 3 | E977: =C977*6+D977 -> 9 | G977: 2 | H977: 5 | I977: =G977*6+H977 -> 17 | K977: 6 | L977: 10 | M977: =K977*6+L977 -> 46 | O977: 8 | P977: 12 | Q977: =O977*6+P977 -> 60 | S977: CAMBERWELL
A978: PRAHRAN | C978: 0 | D978: 1 | E978: =C978*6+D978 -> 1 | G978: 2 | H978: 2 | I978: =G978*6+H978 -> 14 | K978: 3 | L978: 4 | M978: =K978*6+L978 -> 22 | O978: 5 | P978: 7 | Q978: =O978*6+P978 -> 37 | S978: POLLARD
A979: BEST PLAYERS
A980: CAMBERWELL | C980: B JOHNSON | F980: WHITTEN | I980: COMMONS | L980: G YOUNG | O980: McGUINNESS | R980: SKALBERG
A981: PRAHRAN | C981: CLEMENTS | F981: HAYES | I981: ROLLINGS | L981: SEEDY | O981: ROSS JONES | R981: PEARSON
A982: GOALKICKERS
A983: CAMBERWELL | C983: McGUINNESS 3 | F983: O'NEILL 2 | I983: B ELLIS | L983: FREIBERG | O983: COMMONS
A984: PRAHRAN | C984: PEARSON 2 | F984: HARRISON | I984: ANDERSON | L984: MURRAY
A986: COBURG | C986: 2 | D986: 2 | E986: =C986*6+D986 -> 14 | G986: 11 | H986: 10 | I986: =G986*6+H986 -> 76 | K986: 13 | L986: 11 | M986: =K986*6+L986 -> 89 | O986: 20 | P986: 21 | Q986: =O986*6+P986 -> 141 | S986: ELSTERNWICK PARK
A987: BRIGHTON | C987: 3 | D987: 2 | E987: =C987*6+D987 -> 20 | G987: 3 | H987: 2 | I987: =G987*6+H987 -> 20 | K987: 6 | L987: 6 | M987: =K987*6+L987 -> 42 | O987: 6 | P987: 7 | Q987: =O987*6+P987 -> 43 | S987: McMASTER
A988: BEST PLAYERS
A989: COBURG | C989: TANCREDI | F989: WILSON | I989: CLARKSON | L989: HOLCOMBE | O989: MATTHEWS | R989: BYRON
A990: BRIGHTON | C990: W COOPER | F990: McCANN | I990: BROWNING | L990: ELDERING | O990: MOORE | R990: CRAIG
A991: GOALKICKERS
A992: COBURG | C992: BYRON 6 | F992: WILSON 5 | I992: HOOGEN 3 | L992: O'BRIEN 2 | N992: MATTHEWS | Q992: BIGELOW
A993: BRIGHTON | C993: QUIRK 3 | F993: ELDERING | I993: BROWNING | L993: FOX
A995: BYE | C995: SUNSHINE
A997: ROUND 14 | E997: 16TH JULY | J997: WEATHER | M997: NORTH WEST WIND CLOUDY | S997: PLAYED AT
D998: 1ST QTR | H998: 2ND QTR | L998: 3RD QTR | P998: FINAL | S998: MORDIALLOC
A999: MORDIALLOC | C999: 0 | D999: 1 | E999: =C999*6+D999 -> 1 | G999: 6 | H999: 2 | I999: =G999*6+H999 -> 38 | K999: 7 | L999: 5 | M999: =K999*6+L999 -> 47 | O999: 12 | P999: 7 | Q999: =O999*6+P999 -> 79 | S999: UMPIRE | X999: LADDER | AB999: ROUND | AD999: 14
A1000: MOORABBIN | C1000: 2 | D1000: 5 | E1000: =C1000*6+D1000 -> 17 | G1000: 5 | H1000: 7 | I1000: =G1000*6+H1000 -> 37 | K1000: 6 | L1000: 10 | M1000: =K1000*6+L1000 -> 46 | O1000: 7 | P1000: 14 | Q1000: =O1000*6+P1000 -> 56 | S1000: O'DONOGHUE
A1001: BEST PLAYERS | W1001: TEAM | X1001: W | Y1001: L | Z1001: D | AA1001: FOR | AB1001: AGST | AC1001: % | AD1001: PTS
A1002: MORDIALLOC | C1002: PEARSON | F1002: MINAHAN | I1002: ROBERTS | L1002: JAMIESON | O1002: MAUNDER | Q1002: CRANE
A1003: MOORABBIN | C1003: BOYD | F1003: PAPLEY | I1003: MORONEY | L1003: RYAN | O1003: MANIE | Q1003: GILDER | W1003: OAKLEIGH | X1003: 11 | Y1003: 2 | Z1003: 0 | AA1003: 1301 | AB1003: 753 | AC1003: 172.77556440903055 | AD1003: 44
A1004: GOALKICKERS | W1004: COBURG | X1004: 11 | Y1004: 3 | Z1004: 0 | AA1004: 1399 | AB1004: 898 | AC1004: 155.79064587973275 | AD1004: 44
A1005: MORDIALLOC | C1005: NISBET 3 | F1005: ROBERTS 3 | I1005: PEARSON 2 | L1005: McMILLAN | N1005: BESANKO | P1005: RITCHIE | R1005: MINAHAN | W1005: SANDRINGHAM | X1005: 10 | Y1005: 3 | Z1005: 0 | AA1005: 1501 | AB1005: 717 | AC1005: 209.34 | AD1005: 40
A1006: MOORABBIN | C1006: RYAN 5 | F1006: PAPLEY | I1006: WHALEBONE | W1006: WILLIAMSTOWN | X1006: 10 | Y1006: 4 | Z1006: 0 | AA1006: 1281 | AB1006: 896 | AC1006: 142.96875 | AD1006: 40
W1007: YARRAVILLE | X1007: 9 | Y1007: 3 | Z1007: 1 | AA1007: 1177 | AB1007: 837 | AC1007: 140.62126642771804 | AD1007: 38
A1008: WILLIAMSTOWN | C1008: 1 | D1008: 2 | E1008: =C1008*6+D1008 -> 8 | G1008: 4 | H1008: 5 | I1008: =G1008*6+H1008 -> 29 | K1008: 10 | L1008: 9 | M1008: =K1008*6+L1008 -> 69 | O1008: 15 | P1008: 10 | Q1008: =O1008*6+P1008 -> 100 | S1008: WILLIAMSTOWN | W1008: MORDIALLOC | X1008: 9 | Y1008: 4 | Z1008: 0 | AA1008: 1001 | AB1008: 828 | AC1008: 120.89 | AD1008: 36
A1009: BRUNSWICK | C1009: 2 | D1009: 1 | E1009: =C1009*6+D1009 -> 13 | G1009: 3 | H1009: 1 | I1009: =G1009*6+H1009 -> 19 | K1009: 3 | L1009: 1 | M1009: =K1009*6+L1009 -> 19 | O1009: 7 | P1009: 3 | Q1009: =O1009*6+P1009 -> 45 | S1009: TREWIN
A1010: BEST PLAYERS | W1010: MOORABBIN | X1010: 9 | Y1010: 4 | Z1010: 0 | AA1010: 1106 | AB1010: 926 | AC1010: 119.44 | AD1010: 36
A1011: WILLIAMSTOWN | C1011: BOB JONES | F1011: PELLY | I1011: R JONES | L1011: E BEITZEL | N1011: SMITH | Q1011: EVANS | W1011: BRUNSWICK | X1011: 8 | Y1011: 6 | Z1011: 0 | AA1011: 991 | AB1011: 969 | AC1011: 102.2703818369453 | AD1011: 32
A1012: BRUNSWICK | C1012: WHILEY | F1012: STANLEY | I1012: JOHNSON | L1012: K DILLON | N1012: EDWARDS | Q1012: AYRES | W1012: PORT MELBOURNE | X1012: 6 | Y1012: 6 | Z1012: 1 | AA1012: 1044 | AB1012: 888 | AC1012: 117.56756756756756 | AD1012: 26
A1013: GOALKICKERS | W1013: NORTHCOTE | X1013: 6 | Y1013: 7 | Z1013: 1 | AA1013: 1026 | AB1013: 1233 | AC1013: 83.211678832116789 | AD1013: 26
A1014: WILLIAMSTOWN | C1014: PELLY 4 | F1014: EVANS 3 | I1014: CULLINAN 2 | L1014: COPE 2 | N1014: SMITH 2 | P1014: R JONES | R1014: CLOUGH | W1014: BOX HILL | X1014: 6 | Y1014: 7 | Z1014: 0 | AA1014: 927 | AB1014: 1097 | AC1014: 84.503190519598903 | AD1014: 24
A1015: BRUNSWICK | C1015: DENTON 2 | F1015: McKENZIE 2 | I1015: STANLEY | K1015: K DILLON | M1015: AMBROSE | W1015: PRESTON | X1015: 4 | Y1015: 10 | Z1015: 0 | AA1015: 941 | AB1015: 1217 | AC1015: 77.321281840591624 | AD1015: 16
W1016: CAMBERWELL | X1016: 4 | Y1016: 9 | Z1016: 0 | AA1016: 852 | AB1016: 1110 | AC1016: 76.756756756756758 | AD1016: 16
A1017: SANDRINGHAM | C1017: 2 | D1017: 4 | E1017: =C1017*6+D1017 -> 16 | G1017: 7 | H1017: 16 | I1017: =G1017*6+H1017 -> 58 | K1017: 11 | L1017: 19 | M1017: =K1017*6+L1017 -> 85 | O1017: 17 | P1017: 23 | Q1017: =O1017*6+P1017 -> 125 | S1017: BEACH ROAD | W1017: DANDENONG | X1017: 4 | Y1017: 9 | Z1017: 0 | AA1017: 783 | AB1017: 1066 | AC1017: 73.45 | AD1017: 16
A1018: BOX HILL | C1018: 3 | D1018: 3 | E1018: =C1018*6+D1018 -> 21 | G1018: 5 | H1018: 3 | I1018: =G1018*6+H1018 -> 33 | K1018: 5 | L1018: 6 | M1018: =K1018*6+L1018 -> 36 | O1018: 6 | P1018: 7 | Q1018: =O1018*6+P1018 -> 43 | S1018: POLLARD | W1018: SUNSHINE | X1018: 2 | Y1018: 10 | Z1018: 1 | AA1018: 791 | AB1018: 1213 | AC1018: 65.210222588623253 | AD1018: 10
A1019: BEST PLAYERS | W1019: BRIGHTON | X1019: 1 | Y1019: 11 | Z1019: 0 | AA1019: 632 | AB1019: 1475 | AC1019: 42.847457627118644 | AD1019: 4
A1020: SANDRINGHAM | C1020: RICHARDS | F1020: McKENZIE | I1020: MURRAY | L1020: OAKLEY | N1020: STRACHAN | Q1020: CROFT | W1020: PRAHRAN | X1020: 0 | Y1020: 12 | Z1020: 0 | AA1020: 620 | AB1020: 1250 | AC1020: 49.6 | AD1020: 0
A1021: BOX HILL | C1021: WALLER | F1021: GLARE | I1021: SHORT | L1021: WHITE | N1021: GRAY | Q1021: QUINN
A1022: GOALKICKERS
A1023: SANDRINGHAM | C1023: OAKLEY 7 | F1023: EVANS 2 | I1023: GLEESON 2 | L1023: WEBSTER | N1023: MURRAY | P1023: SHRIVES | R1023: MUTER | T1023: ALLSOP | V1023: RICHARDS
A1024: BOX HILL | C1024: SALVADO 2 | F1024: WHITE 2 | I1024: GLARE | K1024: DEAN
A1026: YARRAVILLE | C1026: 7 | D1026: 7 | E1026: =C1026*6+D1026 -> 49 | G1026: 14 | H1026: 7 | I1026: =G1026*6+H1026 -> 91 | K1026: 19 | L1026: 12 | M1026: =K1026*6+L1026 -> 126 | O1026: 29 | P1026: 13 | Q1026: =O1026*6+P1026 -> 187 | S1026: YARRAVILLE
A1027: PRESTON | C1027: 3 | D1027: 3 | E1027: =C1027*6+D1027 -> 21 | G1027: 8 | H1027: 6 | I1027: =G1027*6+H1027 -> 54 | K1027: 10 | L1027: 9 | M1027: =K1027*6+L1027 -> 69 | O1027: 13 | P1027: 11 | Q1027: =O1027*6+P1027 -> 89 | S1027: BAIRD
A1028: BEST PLAYERS
A1029: YARRAVILLE | C1029: RON BROWN | F1029: WILLIAMS | I1029: BURT | L1029: LAMONT | N1029: CROOK | Q1029: MEDDINGS
A1030: PRESTON | C1030: WALKER | F1030: HOWARD | I1030: MILLER | L1030: P LORD | N1030: GRAHAM | Q1030: WOODS
A1031: GOALKICKERS
A1032: YARRAVILLE | C1032: MEDDINGS 7 | F1032: BURT 5 | H1032: RON BROWN 4 | K1032: WILLIAMS 3 | N1032: McCARTHY 3 | Q1032: BARRETT 2 | T1032: FLEMING 2 | W1032: CROOK 2 | Y1032: CAREY
A1033: PRESTON | C1033: GRAHAM 4 | F1033: HOWARD 2 | I1033: J LORD 2 | K1033: BENNETTS | N1033: DUNCOMBE | Q1033: McCRIMMON | T1033: MILLER | V1033: HANDRICK
A1035: NORTHCOTE | C1035: 1 | D1035: 2 | E1035: =C1035*6+D1035 -> 8 | G1035: 3 | H1035: 6 | I1035: =G1035*6+H1035 -> 24 | K1035: 4 | L1035: 10 | M1035: =K1035*6+L1035 -> 34 | O1035: 11 | P1035: 12 | Q1035: =O1035*6+P1035 -> 78 | S1035: NORTHCOTE
A1036: DANDENONG | C1036: 2 | D1036: 3 | E1036: =C1036*6+D1036 -> 15 | G1036: 3 | H1036: 8 | I1036: =G1036*6+H1036 -> 26 | K1036: 5 | L1036: 11 | M1036: =K1036*6+L1036 -> 41 | O1036: 7 | P1036: 13 | Q1036: =O1036*6+P1036 -> 55 | S1036: McMASTER
A1037: BEST PLAYERS
A1038: NORTHCOTE | C1038: McMAHON | F1038: VAINS | I1038: SHAW | L1038: MORAN | O1038: BRETHERTON | R1038: WRIGHT
A1039: DANDENONG | C1039: WATERS | F1039: PETERS | I1039: LITTLE | L1039: HOWER | O1039: THOMAS | R1039: GRAY
A1040: GOALKICKERS
A1041: NORTHCOTE | C1041: HICKS 5 | F1041: MARCHANT | I1041: OLIVER | K1041: SHAW | M1041: MORAN | O1041: DUBOIS | Q1041: VAINS
A1042: DANDENONG | C1042: GRAY 3 | F1042: LALOR 2 | I1042: GILLINGHAM | L1042: OSBORNE
A1044: BRIGHTON | C1044: 0 | D1044: 0 | E1044: =C1044*6+D1044 -> 0 | G1044: 1 | H1044: 6 | I1044: =G1044*6+H1044 -> 12 | K1044: 3 | L1044: 10 | M1044: =K1044*6+L1044 -> 28 | O1044: 8 | P1044: 17 | Q1044: =O1044*6+P1044 -> 65 | S1044: CAMBERWELL
A1045: CAMBERWELL | C1045: 2 | D1045: 9 | E1045: =C1045*6+D1045 -> 21 | G1045: 4 | H1045: 9 | I1045: =G1045*6+H1045 -> 33 | K1045: 6 | L1045: 12 | M1045: =K1045*6+L1045 -> 48 | O1045: 8 | P1045: 13 | Q1045: =O1045*6+P1045 -> 61 | S1045: BREWER
A1046: BEST PLAYERS
A1047: BRIGHTON | C1047: BURSEY | F1047: W COOPER | I1047: MOORE | L1047: HOWELL | O1047: CRAIG | Q1047: GARDE
A1048: CAMBERWELL | C1048: O'NEILL | F1048: K JOHNSON | I1048: WHITTEN | L1048: COMMONS | O1048: B ELLIS | Q1048: B JOHNSON
A1049: GOALKICKERS
A1050: BRIGHTON | C1050: BURSEY 2 | F1050: MOORE 2 | I1050: QUIRK 2 | K1050: HOWELL | M1050: BROWNING
A1051: CAMBERWELL | C1051: O'NEILL 4 | F1051: G ELLIS 2 | I1051: COMMONS | L1051: CONDON
A1053: COBURG | C1053: 3 | D1053: 4 | E1053: =C1053*6+D1053 -> 22 | G1053: 7 | H1053: 8 | I1053: =G1053*6+H1053 -> 50 | K1053: 10 | L1053: 15 | M1053: =K1053*6+L1053 -> 75 | O1053: 13 | P1053: 17 | Q1053: =O1053*6+P1053 -> 95 | S1053: COBURG
A1054: SUNSHINE | C1054: 2 | D1054: 0 | E1054: =C1054*6+D1054 -> 12 | G1054: 3 | H1054: 1 | I1054: =G1054*6+H1054 -> 19 | K1054: 6 | L1054: 3 | M1054: =K1054*6+L1054 -> 39 | O1054: 11 | P1054: 5 | Q1054: =O1054*6+P1054 -> 71 | S1054: MARCY
A1055: BEST PLAYERS
A1056: COBURG | C1056: YOUNG | F1056: HOLT | I1056: SHAW | K1056: JORDAN | N1056: HINKS | Q1056: SHORT
A1057: SUNSHINE | C1057: SAUNDERS | F1057: WARREN | I1057: CROSBIE | K1057: MULLARVEY | N1057: GREGORY | Q1057: BARABASZ
A1058: GOALKICKERS
A1059: COBURG | C1059: BYRON 7 | F1059: JORDAN 3 | I1059: CARR | K1059: HINKS | M1059: BRENNAN
A1060: SUNSHINE | C1060: MULLARVEY 3 | F1060: BARABASZ 2 | I1060: CROSBIE 2 | L1060: KELLY 2 | N1060: GREGORY 2
C1061: 17TH JULY
A1062: OAKLEIGH | C1062: 7 | D1062: 4 | E1062: =C1062*6+D1062 -> 46 | G1062: 8 | H1062: 7 | I1062: =G1062*6+H1062 -> 55 | K1062: 16 | L1062: 10 | M1062: =K1062*6+L1062 -> 106 | O1062: 19 | P1062: 16 | Q1062: =O1062*6+P1062 -> 130 | S1062: TOORAK PARK
A1063: PRAHRAN | C1063: 1 | D1063: 0 | E1063: =C1063*6+D1063 -> 6 | G1063: 4 | H1063: 0 | I1063: =G1063*6+H1063 -> 24 | K1063: 4 | L1063: 1 | M1063: =K1063*6+L1063 -> 25 | O1063: 4 | P1063: 3 | Q1063: =O1063*6+P1063 -> 27 | S1063: ROWE
A1064: BEST PLAYERS
A1065: OAKLEIGH | C1065: COUGHLAN | F1065: McCOOKE | I1065: COLLINS | K1065: KITTO | N1065: LANE | Q1065: NAISMITH
A1066: PRAHRAN | C1066: SEEDY | F1066: HARVEY | I1066: BOYD | K1066: PEARSON | N1066: O'BRIEN | Q1066: GRACE
A1067: GOALKICKERS
A1068: OAKLEIGH | C1068: McCOOKE 7 | F1068: CLEMENTS 4 | I1068: JONES 2 | K1068: PANNAM 2 | N1068: NAISMITH 2 | Q1068: COUGHLAN | T1068: D'ARCY
A1069: PRAHRAN | C1069: CLEMENTS 3 | F1069: HARVEY
A1071: BYE | C1071: PORT MELBOURNE
A1073: ROUND 15 | E1073: 23RD JULY | H1073: WEATHER | K1073: SOUTH WEST BREEZE COLD GROUNDS HEAVY | S1073: PLAYED AT
D1074: 1ST QTR | H1074: 2ND QTR | L1074: 3RD QTR | P1074: FINAL | S1074: CAMBERWELL
A1075: SANDRINGHAM | C1075: 0 | D1075: 4 | E1075: =C1075*6+D1075 -> 4 | G1075: 3 | H1075: 4 | I1075: =G1075*6+H1075 -> 22 | K1075: 9 | L1075: 7 | M1075: =K1075*6+L1075 -> 61 | O1075: 12 | P1075: 10 | Q1075: =O1075*6+P1075 -> 82 | S1075: UMPIRE | X1075: LADDER | AB1075: ROUND | AD1075: 15
A1076: OAKLEIGH | C1076: 1 | D1076: 4 | E1076: =C1076*6+D1076 -> 10 | G1076: 5 | H1076: 6 | I1076: =G1076*6+H1076 -> 36 | K1076: 8 | L1076: 7 | M1076: =K1076*6+L1076 -> 55 | O1076: 9 | P1076: 9 | Q1076: =O1076*6+P1076 -> 63 | S1076: MARCY
A1077: BEST PLAYERS | W1077: TEAM | X1077: W | Y1077: L | Z1077: D | AA1077: FOR | AB1077: AGST | AC1077: % | AD1077: PTS
A1078: SANDRINGHAM | C1078: BOLAND | F1078: OAKLEY | I1078: RICHARDS | L1078: JONES | O1078: GLEESON | R1078: WEBSTER
A1079: OAKLEIGH | C1079: COUGHLAN | F1079: BUCKLEY | I1079: PRENDERGAST | L1079: McCOOKE | O1079: NAISMITH | R1079: PEAKE | W1079: SANDRINGHAM | X1079: 11 | Y1079: 3 | Z1079: 0 | AA1079: 1583 | AB1079: 780 | AC1079: 202.95 | AD1079: 44
A1080: GOALKICKERS | W1080: OAKLEIGH | X1080: 11 | Y1080: 3 | Z1080: 0 | AA1080: 1364 | AB1080: 835 | AC1080: 163.35329341317365 | AD1080: 44
A1081: SANDRINGHAM | C1081: OAKLEY 4 | F1081: GLEESON 4 | I1081: SHRIVES 2 | L1081: WEBSTER | N1081: BOUYER | W1081: COBURG | X1081: 11 | Y1081: 3 | Z1081: 0 | AA1081: 1399 | AB1081: 898 | AC1081: 155.79064587973275 | AD1081: 44
A1082: OAKLEIGH | C1082: D'ARCY 2 | F1082: McCOOKE 2 | I1082: COLLINS 2 | L1082: PANNAM | N1082: CLEMENTS | Q1082: JONES | W1082: WILLIAMSTOWN | X1082: 11 | Y1082: 4 | Z1082: 0 | AA1082: 1363 | AB1082: 951 | AC1082: 143.32281808622503 | AD1082: 44
W1083: YARRAVILLE | X1083: 10 | Y1083: 3 | Z1083: 1 | AA1083: 1223 | AB1083: 875 | AC1083: 139.77142857142857 | AD1083: 42
A1084: WILLIAMSTOWN | C1084: 4 | D1084: 3 | E1084: =C1084*6+D1084 -> 27 | G1084: 6 | H1084: 5 | I1084: =G1084*6+H1084 -> 41 | K1084: 11 | L1084: 8 | M1084: =K1084*6+L1084 -> 74 | O1084: 12 | P1084: 10 | Q1084: =O1084*6+P1084 -> 82 | S1084: MOORABBIN | W1084: MORDIALLOC | X1084: 9 | Y1084: 5 | Z1084: 0 | AA1084: 1030 | AB1084: 879 | AC1084: 117.18 | AD1084: 36
A1085: MOORABBIN | C1085: 1 | D1085: 2 | E1085: =C1085*6+D1085 -> 8 | G1085: 5 | H1085: 6 | I1085: =G1085*6+H1085 -> 36 | K1085: 5 | L1085: 7 | M1085: =K1085*6+L1085 -> 37 | O1085: 7 | P1085: 13 | Q1085: =O1085*6+P1085 -> 55 | S1085: BREWER
A1086: BEST PLAYERS | W1086: MOORABBIN | X1086: 9 | Y1086: 5 | Z1086: 0 | AA1086: 1161 | AB1086: 1008 | AC1086: 115.18 | AD1086: 36
A1087: WILLIAMSTOWN | C1087: E BEITZEL | F1087: R JONES | I1087: BOB JONES | L1087: CLOUGH | O1087: PELLY | Q1087: WARD | W1087: BRUNSWICK | X1087: 8 | Y1087: 7 | Z1087: 0 | AA1087: 1029 | AB1087: 1015 | AC1087: 101.37931034482759 | AD1087: 32
A1088: MOORABBIN | C1088: MILLS | F1088: HOGAN | I1088: HIRST | L1088: PERRY | O1088: KANN | Q1088: BOYD | W1088: PORT MELBOURNE | X1088: 7 | Y1088: 6 | Z1088: 1 | AA1088: 1119 | AB1088: 934 | AC1088: 119.80728051391863 | AD1088: 30
A1089: GOALKICKERS | W1089: BOX HILL | X1089: 7 | Y1089: 7 | Z1089: 0 | AA1089: 978 | AB1089: 1126 | AC1089: 86.856127886323264 | AD1089: 28
A1090: WILLIAMSTOWN | C1090: CLOUGH 4 | F1090: PELLY 3 | I1090: R JONES 3 | L1090: McASEY | N1090: BOB JONES | W1090: NORTHCOTE | X1090: 6 | Y1090: 8 | Z1090: 1 | AA1090: 1086 | AB1090: 1334 | AC1090: 81.409295352323838 | AD1090: 26
A1091: MOORABBIN | C1091: MORONEY 2 | F1091: RYAN 2 | I1091: CRAMERI | L1091: PAPLEY | N1091: HOGAN | W1091: DANDENONG | X1091: 5 | Y1091: 9 | Z1091: 0 | AA1091: 889 | AB1091: 1144 | AC1091: 77.71 | AD1091: 20
W1092: CAMBERWELL | X1092: 4 | Y1092: 10 | Z1092: 0 | AA1092: 930 | AB1092: 1216 | AC1092: 76.48026315789474 | AD1092: 16
A1093: BOX HILL | C1093: 1 | D1093: 2 | E1093: =C1093*6+D1093 -> 8 | G1093: 3 | H1093: 5 | I1093: =G1093*6+H1093 -> 23 | K1093: 6 | L1093: 7 | M1093: =K1093*6+L1093 -> 43 | O1093: 7 | P1093: 9 | Q1093: =O1093*6+P1093 -> 51 | S1093: BOX HILL | W1093: PRESTON | X1093: 4 | Y1093: 11 | Z1093: 0 | AA1093: 987 | AB1093: 1292 | AC1093: 76.393188854489168 | AD1093: 16
A1094: MORDIALLOC | C1094: 1 | D1094: 1 | E1094: =C1094*6+D1094 -> 7 | G1094: 2 | H1094: 1 | I1094: =G1094*6+H1094 -> 13 | K1094: 2 | L1094: 4 | M1094: =K1094*6+L1094 -> 16 | O1094: 4 | P1094: 5 | Q1094: =O1094*6+P1094 -> 29 | S1094: MILLEN | W1094: SUNSHINE | X1094: 3 | Y1094: 10 | Z1094: 1 | AA1094: 892 | AB1094: 1273 | AC1094: 70.070699135899446 | AD1094: 14
A1095: BEST PLAYERS | W1095: BRIGHTON | X1095: 2 | Y1095: 11 | Z1095: 0 | AA1095: 688 | AB1095: 1527 | AC1095: 45.055664702030121 | AD1095: 8
A1096: BOX HILL | C1096: WHITE | F1096: BEASY | I1096: BROWN | L1096: EADE | O1096: WITNISH | R1096: WRIGHT | W1096: PRAHRAN | X1096: 0 | Y1096: 13 | Z1096: 0 | AA1096: 672 | AB1096: 1306 | AC1096: 51.45 | AD1096: 0
A1097: MORDIALLOC | C1097: JOSE | F1097: CRANE | I1097: MINAHAN | L1097: RITCHIE | O1097: PEARSON | R1097: LE DEUX
A1098: GOALKICKERS
A1099: BOX HILL | C1099: WHITE 3 | F1099: BEASY | H1099: SALVADO | J1099: EADE | L1099: GRAY
A1100: MORDIALLOC | C1100: MINAHAN | F1100: ROBERTS | I1100: KAVANAGH | L1100: NISBET
A1102: PORT MELBOURNE | C1102: 2 | D1102: 1 | E1102: =C1102*6+D1102 -> 13 | G1102: 6 | H1102: 5 | I1102: =G1102*6+H1102 -> 41 | K1102: 8 | L1102: 7 | M1102: =K1102*6+L1102 -> 55 | O1102: 11 | P1102: 9 | Q1102: =O1102*6+P1102 -> 75 | S1102: PRESTON
A1103: PRESTON | C1103: 2 | D1103: 1 | E1103: =C1103*6+D1103 -> 13 | G1103: 4 | H1103: 2 | I1103: =G1103*6+H1103 -> 26 | K1103: 7 | L1103: 2 | M1103: =K1103*6+L1103 -> 44 | O1103: 7 | P1103: 4 | Q1103: =O1103*6+P1103 -> 46 | S1103: McMASTER
A1104: BEST PLAYERS
A1105: PORT MELBOURNE | C1105: FURNESS | F1105: MONKS | I1105: McDONALD | L1105: LEWIS | O1105: JOLIFFE | R1105: HARRIS
A1106: PRESTON | C1106: BENNETTS | F1106: HOWARD | I1106: WATSON | L1106: McLACHLAN | O1106: WALKER | R1106: MUTIMER
A1107: GOALKICKERS
A1108: PORT MELBOURNE | C1108: BONNETT 3 | F1108: CLAXTON 2 | I1108: FURNESS | K1108: MUMMERY | N1108: MONKS | P1108: FREYER | R1108: JOLIFFE | U1108: BOWEN
A1109: PRESTON | C1109: HOWARD 2 | F1109: BENNETTS 2 | I1109: P LORD | K1109: J LORD | M1109: BERGIN
A1111: DANDENONG | C1111: 3 | D1111: 6 | E1111: =C1111*6+D1111 -> 24 | G1111: 5 | H1111: 9 | I1111: =G1111*6+H1111 -> 39 | K1111: 12 | L1111: 14 | M1111: =K1111*6+L1111 -> 86 | O1111: 15 | P1111: 16 | Q1111: =O1111*6+P1111 -> 106 | S1111: DANDENONG
A1112: CAMBERWELL | C1112: 2 | D1112: 2 | E1112: =C1112*6+D1112 -> 14 | G1112: 6 | H1112: 4 | I1112: =G1112*6+H1112 -> 40 | K1112: 7 | L1112: 5 | M1112: =K1112*6+L1112 -> 47 | O1112: 11 | P1112: 12 | Q1112: =O1112*6+P1112 -> 78 | S1112: ROACH
A1113: BEST PLAYERS
A1114: DANDENONG | C1114: WATERS | F1114: LALOR | I1114: LITTLE | L1114: WILLIAMS | O1114: GRAY | Q1114: PENNEFATHER
A1115: CAMBERWELL | C1115: GIBSON | F1115: COMMONS | I1115: O'NEILL | L1115: DOUGLAS | O1115: QUIRK | Q1115: WHITTEN
A1116: GOALKICKERS
A1117: DANDENONG | C1117: WILLIAMS 6 | F1117: GRAY 4 | H1117: LALOR 2 | J1117: GILLINGHAM 2 | M1117: PAPWORTH
A1118: CAMBERWELL | C1118: O'NEILL 7 | F1118: DOUGLAS 2 | I1118: SAUNDERS | L1118: LONDON
A1120: BRIGHTON | C1120: 1 | D1120: 1 | E1120: =C1120*6+D1120 -> 7 | G1120: 3 | H1120: 2 | I1120: =G1120*6+H1120 -> 20 | K1120: 5 | L1120: 4 | M1120: =K1120*6+L1120 -> 34 | O1120: 8 | P1120: 8 | Q1120: =O1120*6+P1120 -> 56 | S1120: ELSTERNWICK PARK
A1121: PRAHRAN | C1121: 1 | D1121: 5 | E1121: =C1121*6+D1121 -> 11 | G1121: 1 | H1121: 7 | I1121: =G1121*6+H1121 -> 13 | K1121: 5 | L1121: 9 | M1121: =K1121*6+L1121 -> 39 | O1121: 7 | P1121: 10 | Q1121: =O1121*6+P1121 -> 52 | S1121: DIXON
A1122: BEST PLAYERS
A1123: BRIGHTON | C1123: BURSEY | F1123: QUIRK | I1123: ASHENHURST | L1123: FOX | O1123: BROWNING | R1123: ELDERING
A1124: PRAHRAN | C1124: HAYES | F1124: HARRIS | I1124: ROLLINGS | L1124: O'BRIEN | O1124: HARRISON | R1124: ROY JONES
A1125: GOALKICKERS
A1126: BRIGHTON | C1126: QUIRK 3 | F1126: HOWELL 2 | I1126: W COOPER | L1126: GARDE | N1126: BROWNING
A1127: PRAHRAN | C1127: QUARTERMAIN 3 | G1127: YATES 2 | I1127: ROLLINGS | L1127: HARRIS
A1129: SUNSHINE | C1129: 2 | D1129: 2 | E1129: =C1129*6+D1129 -> 14 | G1129: 9 | H1129: 7 | I1129: =G1129*6+H1129 -> 61 | K1129: 11 | L1129: 7 | M1129: =K1129*6+L1129 -> 73 | O1129: 14 | P1129: 17 | Q1129: =O1129*6+P1129 -> 101 | S1129: SUNSHINE
A1130: NORTHCOTE | C1130: 0 | D1130: 4 | E1130: =C1130*6+D1130 -> 4 | G1130: 4 | H1130: 4 | I1130: =G1130*6+H1130 -> 28 | K1130: 8 | L1130: 9 | M1130: =K1130*6+L1130 -> 57 | O1130: 8 | P1130: 12 | Q1130: =O1130*6+P1130 -> 60 | S1130: ALLEN
A1131: BEST PLAYERS
A1132: SUNSHINE | C1132: SAUNDERS | F1132: GREGORY | I1132: TRESIZE | L1132: M KEMP | O1132: WARREN | R1132: CROSBIE
A1133: NORTHCOTE | C1133: BRETHERTON | F1133: O'BIERNE | I1133: MARCHANT | L1133: SHAW | O1133: McMAHON | R1133: OLIVER
A1134: GOALKICKERS
A1135: SUNSHINE | C1135: KELLY 4 | F1135: GREGORY 4 | I1135: BARCLAY 2 | L1135: MULLARVEY | O1135: N KEMP | Q1135: CROSBIE | S1135: SEYMOUR
A1136: NORTHCOTE | C1136: OLIVER 3 | F1136: HICKS | H1136: SHAW | J1136: VAINS | L1136: KELLY | N1136: MARCHANT
C1137: 24TH JULY
A1138: YARRAVILLE | C1138: 1 | D1138: 5 | E1138: =C1138*6+D1138 -> 11 | G1138: 1 | H1138: 7 | I1138: =G1138*6+H1138 -> 13 | K1138: 3 | L1138: 10 | M1138: =K1138*6+L1138 -> 28 | O1138: 6 | P1138: 10 | Q1138: =O1138*6+P1138 -> 46 | S1138: BRUNSWICK
A1139: BRUNSWICK | C1139: 0 | D1139: 1 | E1139: =C1139*6+D1139 -> 1 | G1139: 1 | H1139: 5 | I1139: =G1139*6+H1139 -> 11 | K1139: 2 | L1139: 7 | M1139: =K1139*6+L1139 -> 19 | O1139: 5 | P1139: 8 | Q1139: =O1139*6+P1139 -> 38 | S1139: O'DONOGHUE
A1140: BEST PLAYERS
A1141: YARRAVILLE | C1141: BOB BROWN | F1141: McTAGGART | I1141: BURT | K1141: CROOK | N1141: RON BROWN | Q1141: ORANGE
A1142: BRUNSWICK | C1142: DENTON | F1142: K DILLON | I1142: BIBBY | K1142: EDWARDS | N1142: WHILEY | Q1142: BRENNAN
A1143: GOALKICKERS
A1144: YARRAVILLE | C1144: FLEMING | F1144: MEDDINGS | I1144: CAREY | K1144: ANDERSON | N1144: RON BROWN | Q1144: BURT
A1145: BRUNSWICK | C1145: K DILLON 3 | G1145: BIBBY | J1145: AMBROSE
A1147: BYE | C1147: COBURG
A1149: ROUND 16 | E1149: 30TH JULY | J1149: WEATHER | M1149: NORTH WEST WIND SUNNY | S1149: PLAYED AT
D1150: 1ST QTR | H1150: 2ND QTR | L1150: 3RD QTR | P1150: FINAL | S1150: MORDIALLOC
A1151: OAKLEIGH | C1151: 5 | D1151: 1 | E1151: =C1151*6+D1151 -> 31 | G1151: 8 | H1151: 3 | I1151: =G1151*6+H1151 -> 51 | K1151: 12 | L1151: 8 | M1151: =K1151*6+L1151 -> 80 | O1151: 17 | P1151: 11 | Q1151: =O1151*6+P1151 -> 113 | S1151: UMPIRE | X1151: LADDER | AB1151: ROUND | AD1151: 16
A1152: MORDIALLOC | C1152: 2 | D1152: 3 | E1152: =C1152*6+D1152 -> 15 | G1152: 6 | H1152: 7 | I1152: =G1152*6+H1152 -> 43 | K1152: 13 | L1152: 11 | M1152: =K1152*6+L1152 -> 89 | O1152: 16 | P1152: 14 | Q1152: =O1152*6+P1152 -> 110 | S1152: ALLEN
A1153: BEST PLAYERS | W1153: TEAM | X1153: W | Y1153: L | Z1153: D | AA1153: FOR | AB1153: AGST | AC1153: % | AD1153: PTS
A1154: OAKLEIGH | C1154: PANNAM | F1154: BUCKLEY | I1154: D'ARCY | K1154: McCOOKE | N1154: PRENDERGAST | Q1154: JONES
A1155: MORDIALLOC | C1155: NISBET | F1155: MAUNDER | I1155: JOSE | K1155: BAKER | N1155: MINAHAN | Q1155: PEARSON | W1155: SANDRINGHAM | X1155: 12 | Y1155: 3 | Z1155: 0 | AA1155: 1756 | AB1155: 795 | AC1155: 220.88 | AD1155: 48
A1156: GOALKICKERS | W1156: COBURG | X1156: 12 | Y1156: 3 | Z1156: 0 | AA1156: 1509 | AB1156: 958 | AC1156: 157.51565762004176 | AD1156: 48
A1157: OAKLEIGH | C1157: McCOOKE 5 | F1157: JONES 5 | H1157: PANNAM 2 | K1157: CLEMENTS 2 | N1157: KITTO | P1157: ASH | Q1157: D'ARCY | W1157: OAKLEIGH | X1157: 12 | Y1157: 3 | Z1157: 0 | AA1157: 1477 | AB1157: 945 | AC1157: 156.2962962962963 | AD1157: 48
A1158: MORDIALLOC | C1158: MINAHAN 3 | F1158: BAKER 3 | H1158: ROBERTS 2 | J1158: SHEEHAN 2 | M1158: MAUNDER 2 | P1158: NISBET 2 | R1158: PEARSON | W1158: WILLIAMSTOWN | X1158: 12 | Y1158: 4 | Z1158: 0 | AA1158: 1477 | AB1158: 1000 | AC1158: 147.7 | AD1158: 48
Q1159: MAGINNESS | W1159: YARRAVILLE | X1159: 11 | Y1159: 3 | Z1159: 1 | AA1159: 1321 | AB1159: 914 | AC1159: 144.52954048140043 | AD1159: 46
A1160: YARRAVILLE | C1160: 6 | D1160: 3 | E1160: =C1160*6+D1160 -> 39 | G1160: 7 | H1160: 8 | I1160: =G1160*6+H1160 -> 50 | K1160: 11 | L1160: 15 | M1160: =K1160*6+L1160 -> 81 | O1160: 13 | P1160: 20 | Q1160: =O1160*6+P1160 -> 98 | S1160: YARRAVILLE | W1160: MOORABBIN | X1160: 10 | Y1160: 5 | Z1160: 0 | AA1160: 1276 | AB1160: 1082 | AC1160: 117.93 | AD1160: 40
A1161: BOX HILL | C1161: 2 | D1161: 3 | E1161: =C1161*6+D1161 -> 15 | G1161: 4 | H1161: 8 | I1161: =G1161*6+H1161 -> 32 | K1161: 5 | L1161: 9 | M1161: =K1161*6+L1161 -> 39 | O1161: 5 | P1161: 9 | Q1161: =O1161*6+P1161 -> 39 | S1161: McMASTER
A1162: BEST PLAYERS | W1162: MORDIALLOC | X1162: 9 | Y1162: 6 | Z1162: 0 | AA1162: 1140 | AB1162: 992 | AC1162: 114.92 | AD1162: 36
A1163: YARRAVILLE | C1163: ORANGE | F1163: FLEMING | I1163: McCARTHY | L1163: WILLIAMS | O1163: CROOK | Q1163: LAMONT | W1163: PORT MELBOURNE | X1163: 8 | Y1163: 6 | Z1163: 1 | AA1163: 1236 | AB1163: 1012 | AC1163: 122.13438735177866 | AD1163: 34
A1164: BOX HILL | C1164: BROWN | F1164: SHORT | I1164: BEASY | L1164: SALVADO | O1164: GRAY | Q1164: WITNISH | W1164: BRUNSWICK | X1164: 8 | Y1164: 8 | Z1164: 0 | AA1164: 1107 | AB1164: 1132 | AC1164: 97.791519434628981 | AD1164: 32
A1165: GOALKICKERS | W1165: BOX HILL | X1165: 7 | Y1165: 8 | Z1165: 0 | AA1165: 1017 | AB1165: 1224 | AC1165: 83.088235294117652 | AD1165: 28
A1166: YARRAVILLE | C1166: McCARTHY 5 | F1166: FLEMING 4 | I1166: RON BROWN | L1166: MEDDINGS | O1166: CAREY | Q1166: COLLINS | W1166: NORTHCOTE | X1166: 6 | Y1166: 9 | Z1166: 1 | AA1166: 1146 | AB1166: 1444 | AC1166: 79.362880886426595 | AD1166: 26
A1167: BOX HILL | C1167: SALVADO 3 | F1167: WHITE | I1167: QUINN | W1167: DANDENONG | X1167: 5 | Y1167: 10 | Z1167: 0 | AA1167: 975 | AB1167: 1232 | AC1167: 79.14 | AD1167: 20
W1168: PRESTON | X1168: 4 | Y1168: 11 | Z1168: 0 | AA1168: 987 | AB1168: 1292 | AC1168: 76.393188854489168 | AD1168: 16
A1169: PORT MELBOURNE | C1169: 1 | D1169: 1 | E1169: =C1169*6+D1169 -> 7 | G1169: 6 | H1169: 8 | I1169: =G1169*6+H1169 -> 44 | K1169: 9 | L1169: 11 | M1169: =K1169*6+L1169 -> 65 | O1169: 16 | P1169: 21 | Q1169: =O1169*6+P1169 -> 117 | S1169: PORT MELBOURNE | W1169: CAMBERWELL | X1169: 4 | Y1169: 11 | Z1169: 0 | AA1169: 1004 | AB1169: 1331 | AC1169: 75.432006010518407 | AD1169: 16
A1170: BRUNSWICK | C1170: 3 | D1170: 9 | E1170: =C1170*6+D1170 -> 27 | G1170: 5 | H1170: 10 | I1170: =G1170*6+H1170 -> 40 | K1170: 9 | L1170: 16 | M1170: =K1170*6+L1170 -> 70 | O1170: 10 | P1170: 18 | Q1170: =O1170*6+P1170 -> 78 | S1170: MILLER | W1170: SUNSHINE | X1170: 3 | Y1170: 11 | Z1170: 1 | AA1170: 941 | AB1170: 1387 | AC1170: 67.844268204758478 | AD1170: 14
A1171: BEST PLAYERS | W1171: BRIGHTON | X1171: 3 | Y1171: 11 | Z1171: 0 | AA1171: 776 | AB1171: 1613 | AC1171: 48.109113453192812 | AD1171: 12
A1172: PORT MELBOURNE | C1172: MONKS | F1172: MUMMERY | I1172: FURNESS | L1172: BONNETT | O1172: LEWIS | Q1172: BOWEN | W1172: PRAHRAN | X1172: 0 | Y1172: 14 | Z1172: 0 | AA1172: 687 | AB1172: 1479 | AC1172: 46.45 | AD1172: 0
A1173: BRUNSWICK | C1173: K DILLON | F1173: BRENNAN | I1173: STANLEY | L1173: R DILLON | O1173: VELO | Q1173: DENTON
A1174: GOALKICKERS
A1175: PORT MELBOURNE | C1175: BONNETT 9 | F1175: CLAXTON 3 | I1175: MUMMERY 2 | L1175: LAWSON | N1175: BOWEN
A1176: BRUNSWICK | C1176: STANLEY 4 | F1176: McKENNA 3 | I1176: K DILLON 2 | L1176: VELO
A1178: MOORABBIN | C1178: 5 | D1178: 2 | E1178: =C1178*6+D1178 -> 32 | G1178: 9 | H1178: 5 | I1178: =G1178*6+H1178 -> 59 | K1178: 14 | L1178: 6 | M1178: =K1178*6+L1178 -> 90 | O1178: 18 | P1178: 7 | Q1178: =O1178*6+P1178 -> 115 | S1178: CAMBERWELL
A1179: CAMBERWELL | C1179: 5 | D1179: 5 | E1179: =C1179*6+D1179 -> 35 | G1179: 6 | H1179: 7 | I1179: =G1179*6+H1179 -> 43 | K1179: 9 | L1179: 12 | M1179: =K1179*6+L1179 -> 66 | O1179: 10 | P1179: 14 | Q1179: =O1179*6+P1179 -> 74 | S1179: MARCY
A1180: BEST PLAYERS
A1181: MOORABBIN | C1181: CLARK | F1181: MILLS | I1181: BOYD | L1181: WHALEBONE | O1181: HIRST | Q1181: NOTTINGHAM
A1182: CAMBERWELL | C1182: WHITTEN | F1182: THOMPSON | I1182: CHAPLIN | L1182: GIBSON | O1182: O'NEILL | Q1182: COMMONS
A1183: GOALKICKERS
A1184: MOORABBIN | C1184: CRAMERI 8 | F1184: HIRST 4 | I1184: WHALEBONE 3 | L1184: RYAN 2 | N1184: MANIE
A1185: CAMBERWELL | C1185: O'NEILL 4 | F1185: WHITTEN | I1185: FREIBERG | K1185: G ELLIS | M1185: GIBSON | O1185: SAUNDERS | R1185: LONDON
A1187: BRIGHTON | C1187: 2 | D1187: 1 | E1187: =C1187*6+D1187 -> 13 | G1187: 10 | H1187: 4 | I1187: =G1187*6+H1187 -> 64 | K1187: 12 | L1187: 5 | M1187: =K1187*6+L1187 -> 77 | O1187: 13 | P1187: 10 | Q1187: =O1187*6+P1187 -> 88 | S1187: ELSTERNWICK PARK
A1188: DANDENONG | C1188: 6 | D1188: 5 | E1188: =C1188*6+D1188 -> 41 | G1188: 9 | H1188: 8 | I1188: =G1188*6+H1188 -> 62 | K1188: 11 | L1188: 14 | M1188: =K1188*6+L1188 -> 80 | O1188: 12 | P1188: 14 | Q1188: =O1188*6+P1188 -> 86 | S1188: POLLARD
A1189: BEST PLAYERS
A1190: BRIGHTON | C1190: W COOPER | F1190: McCANN | I1190: BROWNING | L1190: QUIRK | O1190: BURSEY | R1190: HOWELL
A1191: DANDENONG | C1191: HOWER | F1191: GOOD | I1191: WILLIAMS | L1191: KILPATRICK | O1191: OSBORNE | R1191: THOMAS
A1192: GOALKICKERS
A1193: BRIGHTON | C1193: QUIRK 4 | F1193: BROWNING 3 | I1193: BURSEY 2 | K1193: MOORE | M1193: HANCE | O1193: HOWELL | Q1193: TURNOUR
A1194: DANDENONG | C1194: WILLIAMS 3 | F1194: OSBORNE 2 | I1194: GRAY 2 | K1194: PETERS | M1194: FRENCH | O1194: GILLINGHAM | R1194: PAPWORTH | U1194: LALOR
A1196: WILLIAMSTOWN | C1196: 6 | D1196: 5 | E1196: =C1196*6+D1196 -> 41 | G1196: 10 | H1196: 8 | I1196: =G1196*6+H1196 -> 68 | K1196: 14 | L1196: 16 | M1196: =K1196*6+L1196 -> 100 | O1196: 16 | P1196: 18 | Q1196: =O1196*6+P1196 -> 114 | S1196: WILLIAMSTOWN
A1197: SUNSHINE | C1197: 1 | D1197: 1 | E1197: =C1197*6+D1197 -> 7 | G1197: 3 | H1197: 3 | I1197: =G1197*6+H1197 -> 21 | K1197: 4 | L1197: 4 | M1197: =K1197*6+L1197 -> 28 | O1197: 7 | P1197: 7 | Q1197: =O1197*6+P1197 -> 49 | S1197: DIXON
A1198: BEST PLAYERS
A1199: WILLIAMSTOWN | C1199: SMITH | F1199: BROADWAY | I1199: McASEY | L1199: CLOUGH | O1199: MURPHY | R1199: CARMICHAEL
A1200: SUNSHINE | C1200: WARREN | F1200: CROSBIE | I1200: SAUNDERS | L1200: BARCLAY | O1200: T CORCORAN | R1200: BARABASZ
A1201: GOALKICKERS
A1202: WILLIAMSTOWN | C1202: CLOUGH 4 | F1202: PELLY 3 | I1202: R JONES 3 | L1202: McASEY 2 | N1202: DAVIES 2 | Q1202: COPE | S1202: HYNES
A1203: SUNSHINE | C1203: CROSBIE 2 | F1203: GREGORY | I1203: KELLY | K1203: BARCLAY | M1203: BARABASZ | P1203: STAFFORD
A1205: SANDRINGHAM | C1205: 11 | D1205: 3 | E1205: =C1205*6+D1205 -> 69 | G1205: 14 | H1205: 10 | I1205: =G1205*6+H1205 -> 94 | K1205: 19 | L1205: 15 | M1205: =K1205*6+L1205 -> 129 | O1205: 26 | P1205: 17 | Q1205: =O1205*6+P1205 -> 173 | S1205: TOORAK PARK
A1206: PRAHRAN | C1206: 0 | D1206: 0 | E1206: =C1206*6+D1206 -> 0 | G1206: 0 | H1206: 1 | I1206: =G1206*6+H1206 -> 1 | K1206: 0 | L1206: 1 | M1206: =K1206*6+L1206 -> 1 | O1206: 2 | P1206: 3 | Q1206: =O1206*6+P1206 -> 15 | S1206: O'DONOGHUE
A1207: BEST PLAYERS
A1208: SANDRINGHAM | C1208: OAKLEY | F1208: STRAHAN | I1208: BOUYER | L1208: MUTER | O1208: ALLSOP | R1208: BOLAND
A1209: PRAHRAN | C1209: BOYD | F1209: SEEDY | I1209: ROY JONES | L1209: QUARTERMAIN | O1209: ROLLINGS | R1209: O'BRIEN
A1210: GOALKICKERS
A1211: SANDRINGHAM | C1211: OAKLEY 10 | F1211: STRAHAN 4 | I1211: BOUYER 4 | L1211: SHRIVES 3 | N1211: WILLIAMS 2 | Q1211: MURRAY | S1211: RANSOM | V1211: MUTER
A1212: PRAHRAN | C1212: O'BRIEN | F1212: ROLLINGS
C1213: 31ST JULY
A1214: COBURG | C1214: 3 | D1214: 5 | E1214: =C1214*6+D1214 -> 23 | G1214: 8 | H1214: 11 | I1214: =G1214*6+H1214 -> 59 | K1214: 14 | L1214: 18 | M1214: =K1214*6+L1214 -> 102 | O1214: 15 | P1214: 20 | Q1214: =O1214*6+P1214 -> 110 | S1214: NORTHCOTE
A1215: NORTHCOTE | C1215: 2 | D1215: 1 | E1215: =C1215*6+D1215 -> 13 | G1215: 4 | H1215: 3 | I1215: =G1215*6+H1215 -> 27 | K1215: 4 | L1215: 4 | M1215: =K1215*6+L1215 -> 28 | O1215: 9 | P1215: 6 | Q1215: =O1215*6+P1215 -> 60 | S1215: BREWER
A1216: BEST PLAYERS
A1217: COBURG | C1217: CARR | F1217: SHAW | I1217: TANCREDI | L1217: BIGELOW | O1217: WILSON | R1217: RICCI
A1218: NORTHCOTE | C1218: GORMAN | F1218: HOSKING | I1218: MORAN | L1218: KEAYS | O1218: O'BIERNE
A1219: GOALKICKERS
A1220: COBURG | C1220: CARR 4 | E1220: COLBERT 3 | H1220: BIGELOW 2 | K1220: HOOGEN 2 | M1220: WILSON | O1220: HINKS | Q1220: O'BRIEN | S1220: RICCI
A1221: NORTHCOTE | C1221: MORAN 3 | F1221: HOSKING 2 | I1221: KEAYS | K1221: GORMAN | M1221: DU BOIS | O1221: KELLY
A1223: BYE | C1223: PRESTON
A1225: ROUND 17 | D1225: 6TH AUGUST | J1225: WEATHER | M1225: SOUTH WEST BREEZE FINE & SUNNY | S1225: PLAYED AT | X1225: LADDER | AB1225: ROUND | AD1225: 17
D1226: 1ST QTR | H1226: 2ND QTR | L1226: 3RD QTR | P1226: FINAL | S1226: BEACH ROAD
A1227: SANDRINGHAM | C1227: 2 | D1227: 2 | E1227: =C1227*6+D1227 -> 14 | G1227: 9 | H1227: 12 | I1227: =G1227*6+H1227 -> 66 | K1227: 13 | L1227: 18 | M1227: =K1227*6+L1227 -> 96 | O1227: 16 | P1227: 24 | Q1227: =O1227*6+P1227 -> 120 | S1227: UMPIRE | W1227: TEAM | X1227: W | Y1227: L | Z1227: D | AA1227: FOR | AB1227: AGST | AC1227: % | AD1227: PTS
A1228: MORDIALLOC | C1228: 2 | D1228: 4 | E1228: =C1228*6+D1228 -> 16 | G1228: 2 | H1228: 8 | I1228: =G1228*6+H1228 -> 20 | K1228: 3 | L1228: 10 | M1228: =K1228*6+L1228 -> 28 | O1228: 8 | P1228: 13 | Q1228: =O1228*6+P1228 -> 61 | S1228: POLLARD
A1229: BEST PLAYERS | W1229: SANDRINGHAM | X1229: 13 | Y1229: 3 | Z1229: 0 | AA1229: 1876 | AB1229: 856 | AC1229: 219.16 | AD1229: 52
A1230: SANDRINGHAM | C1230: MURRAY | F1230: BOUYER | I1230: MUTER | K1230: SHRIVES | N1230: OAKLEY | Q1230: JONES | W1230: OAKLEIGH | X1230: 13 | Y1230: 3 | Z1230: 0 | AA1230: 1590 | AB1230: 1012 | AC1230: 157.11462450592884 | AD1230: 52
A1231: MORDIALLOC | C1231: LE DEUX | F1231: SHEEHAN | I1231: JOSE | K1231: BESANKO | N1231: MAUNDER | Q1231: PEARSON | W1231: WILLIAMSTOWN | X1231: 13 | Y1231: 4 | Z1231: 0 | AA1231: 1557 | AB1231: 1050 | AC1231: 148.28571428571428 | AD1231: 52
A1232: GOALKICKERS | W1232: YARRAVILLE | X1232: 12 | Y1232: 3 | Z1232: 1 | AA1232: 1425 | AB1232: 947 | AC1232: 150.4751847940866 | AD1232: 50
A1233: SANDRINGHAM | C1233: OAKLEY 8 | F1233: BOUYER 5 | I1233: WEBSTER | K1233: MUTER | M1233: GLEESON | W1233: COBURG | X1233: 12 | Y1233: 4 | Z1233: 0 | AA1233: 1559 | AB1233: 1038 | AC1233: 150.19267822736032 | AD1233: 48
A1234: MORDIALLOC | C1234: BAKER 3 | F1234: MINAHAN 2 | I1234: SHEEHAN 2 | L1234: NISBET | W1234: MOORABBIN | X1234: 11 | Y1234: 5 | Z1234: 0 | AA1234: 1446 | AB1234: 1141 | AC1234: 126.73 | AD1234: 44
A1236: BRUNSWICK | C1236: 0 | D1236: 2 | E1236: =C1236*6+D1236 -> 2 | G1236: 3 | H1236: 6 | I1236: =G1236*6+H1236 -> 24 | K1236: 6 | L1236: 10 | M1236: =K1236*6+L1236 -> 46 | O1236: 8 | P1236: 12 | Q1236: =O1236*6+P1236 -> 60 | S1236: BRUNSWICK | W1236: MORDIALLOC | X1236: 9 | Y1236: 7 | Z1236: 0 | AA1236: 1201 | AB1236: 1112 | AC1236: 108 | AD1236: 36
A1237: PRESTON | C1237: 2 | D1237: 2 | E1237: =C1237*6+D1237 -> 14 | G1237: 2 | H1237: 7 | I1237: =G1237*6+H1237 -> 19 | K1237: 4 | L1237: 10 | M1237: =K1237*6+L1237 -> 34 | O1237: 6 | P1237: 12 | Q1237: =O1237*6+P1237 -> 48 | S1237: MARCY | W1237: BRUNSWICK | X1237: 9 | Y1237: 8 | Z1237: 0 | AA1237: 1167 | AB1237: 1180 | AC1237: 98.898305084745758 | AD1237: 36
A1238: BEST PLAYERS | W1238: PORT MELBOURNE | X1238: 8 | Y1238: 7 | Z1238: 1 | AA1238: 1303 | AB1238: 1125 | AC1238: 115.82222222222222 | AD1238: 34
A1239: BRUNSWICK | C1239: WHILEY | F1239: K DILLON | I1239: JOHNSON | L1239: R DILLON | O1239: AMBROSE | Q1239: VELO | W1239: BOX HILL | X1239: 8 | Y1239: 8 | Z1239: 0 | AA1239: 1122 | AB1239: 1295 | AC1239: 86.640926640926637 | AD1239: 32
A1240: PRESTON | C1240: GRAHAM | F1240: LAMBIE | I1240: WALKER | L1240: McCRIMMON | O1240: JENSEN | Q1240: P LORD | W1240: NORTHCOTE | X1240: 6 | Y1240: 9 | Z1240: 1 | AA1240: 1146 | AB1240: 1444 | AC1240: 79.362880886426595 | AD1240: 26
A1241: GOALKICKERS | W1241: DANDENONG | X1241: 6 | Y1241: 10 | Z1241: 0 | AA1241: 1137 | AB1241: 1272 | AC1241: 89.39 | AD1241: 24
A1242: BRUNSWICK | C1242: AMBROSE 3 | F1242: J WHILEY 3 | I1242: McKENNA | L1242: K DILLON | W1242: PRESTON | X1242: 4 | Y1242: 12 | Z1242: 0 | AA1242: 1035 | AB1242: 1352 | AC1242: 76.553254437869825 | AD1242: 16
A1243: PRESTON | C1243: LAMBIE 2 | F1243: P LORD | I1243: HOWARD | L1243: McRIMMON | O1243: GRAHAM | W1243: CAMBERWELL | X1243: 4 | Y1243: 12 | Z1243: 0 | AA1243: 1075 | AB1243: 1436 | AC1243: 74.860724233983291 | AD1243: 16
W1244: SUNSHINE | X1244: 3 | Y1244: 12 | Z1244: 1 | AA1244: 974 | AB1244: 1491 | AC1244: 65.325285043594903 | AD1244: 14
A1245: BOX HILL | C1245: 2 | D1245: 2 | E1245: =C1245*6+D1245 -> 14 | G1245: 6 | H1245: 11 | I1245: =G1245*6+H1245 -> 47 | K1245: 10 | L1245: 13 | M1245: =K1245*6+L1245 -> 73 | O1245: 15 | P1245: 15 | Q1245: =O1245*6+P1245 -> 105 | S1245: BOX HILL | W1245: BRIGHTON | X1245: 3 | Y1245: 13 | Z1245: 0 | AA1245: 889 | AB1245: 1840 | AC1245: 48.32 | AD1245: 12
A1246: CAMBERWELL | C1246: 3 | D1246: 4 | E1246: =C1246*6+D1246 -> 22 | G1246: 4 | H1246: 5 | I1246: =G1246*6+H1246 -> 29 | K1246: 7 | L1246: 7 | M1246: =K1246*6+L1246 -> 49 | O1246: 10 | P1246: 11 | Q1246: =O1246*6+P1246 -> 71 | S1246: DIXON | W1246: PRAHRAN | X1246: 1 | Y1246: 15 | Z1246: 0 | AA1246: 784 | AB1246: 1695 | AC1246: 46.25 | AD1246: 4
A1247: BEST PLAYERS
A1248: BOX HILL | C1248: WHITE | F1248: BROWN | I1248: BEASY | K1248: CRAIG | N1248: CHEFFERS | Q1248: GLARE
A1249: CAMBERWELL | C1249: YOUNG | F1249: J THOMPSON | I1249: WATTS | K1249: COMMONS | N1249: B JOHNSON | Q1249: GIBSON
A1250: GOALKICKERS
A1251: BOX HILL | C1251: WHITE 4 | F1251: GLARE 3 | I1251: SALVADO 2 | L1251: CHEFFERS 2 | O1251: BROWN | Q1251: GRAY | S1251: DEAN | U1251: EADE
A1252: CAMBERWELL | C1252: LONDON 4 | F1252: O'NEILL 3 | I1252: WATTS | K1252: FREIBERG | M1252: QUIRK
A1254: DANDENONG | C1254: 5 | D1254: 8 | E1254: =C1254*6+D1254 -> 38 | G1254: 8 | H1254: 11 | I1254: =G1254*6+H1254 -> 59 | K1254: 19 | L1254: 16 | M1254: =K1254*6+L1254 -> 130 | O1254: 24 | P1254: 18 | Q1254: =O1254*6+P1254 -> 162 | S1254: DANDENONG
A1255: PRAHRAN | C1255: 0 | D1255: 0 | E1255: =C1255*6+D1255 -> 0 | G1255: 2 | H1255: 2 | I1255: =G1255*6+H1255 -> 14 | K1255: 5 | L1255: 3 | M1255: =K1255*6+L1255 -> 33 | O1255: 5 | P1255: 10 | Q1255: =O1255*6+P1255 -> 40 | S1255: ALLEN
A1256: BEST PLAYERS
A1257: DANDENONG | C1257: PENNEFATHER | F1257: WILLIAMS | I1257: GOOD | L1257: GILLINGHAM | O1257: GRAY | Q1257: PAPWORTH
A1258: PRAHRAN | C1258: ROSS JONES | F1258: SEEDY | I1258: PEARSON | L1258: CLEMENTS | O1258: C BOYD | Q1258: HAYES
A1259: GOALKICKERS
A1260: DANDENONG | C1260: GRAY 7 | F1260: WILLIAMS 6 | I1260: PAPWORTH 5 | L1260: OSBORNE 2 | O1260: GILLINGHAM 2 | R1260: THOMAS | U1260: RANKIN
A1261: PRAHRAN | C1261: LEWIS | E1261: BOYD | G1261: KENNY | I1261: WALSH | K1261: ANDERSON
A1263: MOORABBIN | C1263: 5 | D1263: 7 | E1263: =C1263*6+D1263 -> 37 | G1263: 9 | H1263: 12 | I1263: =G1263*6+H1263 -> 66 | K1263: 14 | L1263: 24 | M1263: =K1263*6+L1263 -> 108 | O1263: 24 | P1263: 26 | Q1263: =O1263*6+P1263 -> 170 | S1263: MOORABBIN
A1264: BRIGHTON | C1264: 0 | D1264: 0 | E1264: =C1264*6+D1264 -> 0 | G1264: 6 | H1264: 4 | I1264: =G1264*6+H1264 -> 40 | K1264: 6 | L1264: 4 | M1264: =K1264*6+L1264 -> 40 | O1264: 9 | P1264: 5 | Q1264: =O1264*6+P1264 -> 59 | S1264: ROHAN
A1265: BEST PLAYERS
A1266: MOORABBIN | C1266: MORONEY | F1266: PAPLEY | I1266: WHALEBONE | L1266: CRAMERI | O1266: RYAN | Q1266: GILDER
A1267: BRIGHTON | C1267: ELDERING | F1267: BROWNING | I1267: N COOPER | L1267: W COOPER | O1267: MOORE | Q1267: FOX
A1268: GOALKICKERS
A1269: MOORABBIN | C1269: CRAMERI 6 | F1269: WHALEBONE 5 | I1269: RYAN 4 | K1269: MANIE 3 | M1269: PAPLEY 2 | O1269: HOGAN 2 | Q1269: MORONEY | T1269: HIRST
A1270: BRIGHTON | C1270: BROWNING 3 | F1270: MOORE 2 | I1270: HANCE | K1270: QUIRK | M1270: BEGLEY | O1270: TURNOUR
D1272: 13TH AUGUST | I1272: WEATHER | L1272: SOUTH WEST WIND RAIN GROUNDS BAD
A1273: OAKLEIGH | C1273: 4 | D1273: 7 | E1273: =C1273*6+D1273 -> 31 | G1273: 9 | H1273: 9 | I1273: =G1273*6+H1273 -> 63 | K1273: 13 | L1273: 11 | M1273: =K1273*6+L1273 -> 89 | O1273: 16 | P1273: 17 | Q1273: =O1273*6+P1273 -> 113 | S1273: CAMBERWELL
A1274: PORT MELBOURNE | C1274: 1 | D1274: 0 | E1274: =C1274*6+D1274 -> 6 | G1274: 6 | H1274: 2 | I1274: =G1274*6+H1274 -> 38 | K1274: 7 | L1274: 3 | M1274: =K1274*6+L1274 -> 45 | O1274: 10 | P1274: 7 | Q1274: =O1274*6+P1274 -> 67 | S1274: ROACH
A1275: BEST PLAYERS
A1276: OAKLEIGH | C1276: NAISMITH | F1276: LANE | I1276: PRENDERGAST | L1276: McCOOKE | O1276: COUGHLAN | R1276: JONES
A1277: PORT MELBOURNE | C1277: FURNESS | F1277: FREYER | I1277: LEWIS | L1277: CLARK | O1277: BOWEN | R1277: MONKS
A1278: GOALKICKERS
A1279: OAKLEIGH | C1279: JONES 3 | E1279: COUGHLAN 3 | H1279: LONGNEY 2 | J1279: COLLINS 2 | M1279: D'ARCY 2 | O1279: ASH | P1279: VARNEY | R1279: McCOOKE | U1279: LANE
A1280: PORT MELBOURNE | C1280: FITZGERALD 4 | F1280: FREYER 2 | I1280: FURNESS | K1280: MONKS | M1280: LAWSON | O1280: JOLIFFE
A1282: YARRAVILLE | C1282: 0 | D1282: 4 | E1282: =C1282*6+D1282 -> 4 | G1282: 7 | H1282: 10 | I1282: =G1282*6+H1282 -> 52 | K1282: 10 | L1282: 11 | M1282: =K1282*6+L1282 -> 71 | O1282: 15 | P1282: 14 | Q1282: =O1282*6+P1282 -> 104 | S1282: SUNSHINE
A1283: SUNSHINE | C1283: 1 | D1283: 0 | E1283: =C1283*6+D1283 -> 6 | G1283: 1 | H1283: 1 | I1283: =G1283*6+H1283 -> 7 | K1283: 4 | L1283: 3 | M1283: =K1283*6+L1283 -> 27 | O1283: 5 | P1283: 3 | Q1283: =O1283*6+P1283 -> 33 | S1283: MILNE
A1284: BEST PLAYERS
A1285: YARRAVILLE | C1285: BOB BROWN | F1285: McCARTHY | I1285: RON BROWN | L1285: ANDERSON | O1285: WILLIAMS | R1285: CROOK
A1286: SUNSHINE | C1286: CROSBIE | F1286: PRESTON | I1286: LEVER | L1286: OLARENSHAW | O1286: KEMP | R1286: SAUNDERS
A1287: GOALKICKERS
A1288: YARRAVILLE | C1288: MEDDINGS 4 | F1288: McCARTHY 2 | I1288: FLEMING 2 | L1288: ANDERSON | N1288: CROOK | P1288: BURT | Q1288: COLLINS | S1288: WILLIAMS | V1288: ORANGE | W1288: BARRETT
A1289: SUNSHINE | C1289: BARCLAY | F1289: BARABASZ | I1289: KELLY | K1289: CROSBIE | N1289: TRESIZE
E1290: 14TH AUGUST
A1291: WILLIAMSTOWN | C1291: 1 | D1291: 5 | E1291: =C1291*6+D1291 -> 11 | G1291: 5 | H1291: 6 | I1291: =G1291*6+H1291 -> 36 | K1291: 11 | L1291: 6 | M1291: =K1291*6+L1291 -> 72 | O1291: 12 | P1291: 8 | Q1291: =O1291*6+P1291 -> 80 | S1291: COBURG
A1292: COBURG | C1292: 0 | D1292: 3 | E1292: =C1292*6+D1292 -> 3 | G1292: 4 | H1292: 4 | I1292: =G1292*6+H1292 -> 28 | K1292: 6 | L1292: 6 | M1292: =K1292*6+L1292 -> 42 | O1292: 7 | P1292: 8 | Q1292: =O1292*6+P1292 -> 50 | S1292: O'DONOGHUE
A1293: BEST PLAYERS
A1294: WILLIAMSTOWN | C1294: WARD | F1294: B BEITZEL | I1294: McASEY | L1294: SMITH | O1294: PELLY | R1294: EVANS
A1295: COBURG | C1295: McNABB | F1295: CLARKSON | I1295: TANCREDI | L1295: MATTHEWS | O1295: SMITH | R1295: HOOGEN
A1296: GOALKICKERS
A1297: WILLIAMSTOWN | C1297: WARD 6 | F1297: PELLY 3 | I1297: CLOUGH 2 | L1297: McASEY
A1298: COBURG | C1298: BYRON 2 | F1298: CARR | H1298: SHAW | J1298: O'BRIEN | L1298: BIGELOW | O1298: HINKS
A1300: PRAHRAN | C1300: 2 | D1300: 3 | E1300: =C1300*6+D1300 -> 15 | G1300: 3 | H1300: 5 | I1300: =G1300*6+H1300 -> 23 | K1300: 7 | L1300: 5 | M1300: =K1300*6+L1300 -> 47 | O1300: 8 | P1300: 9 | Q1300: =O1300*6+P1300 -> 57 | S1300: TOORAK PARK
A1301: BRIGHTON | C1301: 2 | D1301: 4 | E1301: =C1301*6+D1301 -> 16 | G1301: 3 | H1301: 7 | I1301: =G1301*6+H1301 -> 25 | K1301: 5 | L1301: 10 | M1301: =K1301*6+L1301 -> 40 | O1301: 7 | P1301: 12 | Q1301: =O1301*6+P1301 -> 54 | S1301: McMASTER
A1302: BEST PLAYERS
A1303: PRAHRAN | C1303: HARRIS | F1303: MORRISON | I1303: HEALEY | L1303: BOYD | O1303: WALSH | Q1303: SEEDY
A1304: BRIGHTON | C1304: BROWNING | F1304: BURSEY | I1304: HOWELL | L1304: McCANN | O1304: CRAIG | Q1304: W COOPER
A1305: GOALKICKERS
A1306: PRAHRAN | C1306: BOYD 2 | F1306: MORRISON 2 | I1306: HEALEY 2 | L1306: ROLLINGS | O1306: GRACE
A1307: BRIGHTON | C1307: BURSEY 2 | F1307: QUIRK 2 | I1307: BROWNING | L1307: HOWELL | O1307: W COOPER
A1309: BYES | C1309: NORTHCOTE
A1311: ROUND 18 | E1311: 20TH AUGUST | I1311: WEATHER | L1311: SOUTH WIND GROUNDS BAD AFTER RAIN | S1311: PLAYED AT
D1312: 1ST QTR | H1312: 2ND QTR | L1312: 3RD QTR | P1312: FINAL | S1312: YARRAVILLE
A1313: YARRAVILLE | C1313: 5 | D1313: 3 | E1313: =C1313*6+D1313 -> 33 | G1313: 6 | H1313: 6 | I1313: =G1313*6+H1313 -> 42 | K1313: 9 | L1313: 12 | M1313: =K1313*6+L1313 -> 66 | O1313: 13 | P1313: 13 | Q1313: =O1313*6+P1313 -> 91 | S1313: UMPIRE | X1313: LADDER | AB1313: ROUND | AD1313: 18
A1314: COBURG | C1314: 1 | D1314: 2 | E1314: =C1314*6+D1314 -> 8 | G1314: 8 | H1314: 4 | I1314: =G1314*6+H1314 -> 52 | K1314: 10 | L1314: 4 | M1314: =K1314*6+L1314 -> 64 | O1314: 12 | P1314: 11 | Q1314: =O1314*6+P1314 -> 83 | S1314: POLLARD
A1315: BEST PLAYERS | W1315: TEAM | X1315: W | Y1315: L | Z1315: D | AA1315: FOR | AB1315: AGST | AC1315: % | AD1315: PTS
A1316: YARRAVILLE | C1316: FLEMING | F1316: CAREY | I1316: BOB BROWN | L1316: HART | O1316: BURT | Q1316: CROOK
A1317: COBURG | C1317: SHAW | F1317: O'BRIEN | I1317: BYRON | L1317: BIGELOW | O1317: SMITH | Q1317: SHORT | W1317: SANDRINGHAM | X1317: 14 | Y1317: 3 | Z1317: 0 | AA1317: 1949 | AB1317: 893 | AC1317: 218.25 | AD1317: 56
A1318: GOALKICKERS | W1318: OAKLEIGH | X1318: 14 | Y1318: 3 | Z1318: 0 | AA1318: 1713 | AB1318: 1051 | AC1318: 162.98763082778305 | AD1318: 56
A1319: YARRAVILLE | C1319: McCARTHY 4 | F1319: MEDDINGS 2 | I1319: CROOK 2 | K1319: CAREY 2 | M1319: FLEMING | O1319: BURT | Q1319: HART | W1319: WILLIAMSTOWN | X1319: 14 | Y1319: 4 | Z1319: 0 | AA1319: 1645 | AB1319: 1066 | AC1319: 154.31519699812384 | AD1319: 56
A1320: COBURG | C1320: BYRON 6 | E1320: CARR | G1320: BIGELOW | I1320: WILSON | K1320: SHAW | M1320: O'BRIEN | O1320: TANCREDI | W1320: YARRAVILLE | X1320: 13 | Y1320: 3 | Z1320: 1 | AA1320: 1516 | AB1320: 1030 | AC1320: 147.18446601941747 | AD1320: 54
W1321: COBURG | X1321: 12 | Y1321: 5 | Z1321: 0 | AA1321: 1642 | AB1321: 1129 | AC1321: 145.4384410983171 | AD1321: 48
A1322: DANDENONG | C1322: 1 | D1322: 1 | E1322: =C1322*6+D1322 -> 7 | G1322: 9 | H1322: 5 | I1322: =G1322*6+H1322 -> 59 | K1322: 10 | L1322: 6 | M1322: =K1322*6+L1322 -> 66 | O1322: 16 | P1322: 9 | Q1322: =O1322*6+P1322 -> 105 | S1322: DANDENONG | W1322: MOORABBIN | X1322: 11 | Y1322: 6 | Z1322: 0 | AA1322: 1539 | AB1322: 1246 | AC1322: 123.52 | AD1322: 44
A1323: MOORABBIN | C1323: 2 | D1323: 4 | E1323: =C1323*6+D1323 -> 16 | G1323: 6 | H1323: 6 | I1323: =G1323*6+H1323 -> 42 | K1323: 8 | L1323: 12 | M1323: =K1323*6+L1323 -> 60 | O1323: 13 | P1323: 15 | Q1323: =O1323*6+P1323 -> 93 | S1323: HORNE
A1324: BEST PLAYERS | W1324: MORDIALLOC | X1324: 10 | Y1324: 7 | Z1324: 0 | AA1324: 1285 | AB1324: 1175 | AC1324: 109.36 | AD1324: 40
A1325: DANDENONG | C1325: ROSETTI | F1325: GILLINGHAM | I1325: JOHNSON | L1325: PENNEFATHER | O1325: WATERS | Q1325: PAPWORTH | W1325: PORT MELBOURNE | X1325: 9 | Y1325: 7 | Z1325: 1 | AA1325: 1392 | AB1325: 1190 | AC1325: 116.97478991596638 | AD1325: 38
A1326: MOORABBIN | C1326: GILDER | F1326: HOGAN | I1326: PERRY | L1326: TRESIZE | O1326: MORONEY | Q1326: RYAN | W1326: BRUNSWICK | X1326: 9 | Y1326: 8 | Z1326: 0 | AA1326: 1167 | AB1326: 1180 | AC1326: 98.898305084745758 | AD1326: 36
A1327: GOALKICKERS | L1327: OSBORNE | O1327: HOWER | Q1327: GRAY | W1327: BOX HILL | X1327: 9 | Y1327: 8 | Z1327: 0 | AA1327: 1300 | AB1327: 1346 | AC1327: 96.582466567607725 | AD1327: 36
A1328: DANDENONG | C1328: RANKIN 3 | E1328: GILLINGHAM 3 | H1328: PAPWORTH 2 | K1328: WILLIAMS 2 | N1328: WATERS | P1328: ROSETTI | R1328: THOMAS | W1328: DANDENONG | X1328: 7 | Y1328: 10 | Z1328: 0 | AA1328: 1242 | AB1328: 1365 | AC1328: 90.99 | AD1328: 28
A1329: MOORABBIN | C1329: CRAMERI 5 | F1329: RYAN 3 | H1329: MORONEY | J1329: PAPLEY | L1329: HIRST | N1329: MANIE | P1329: HOGAN | W1329: NORTHCOTE | X1329: 6 | Y1329: 10 | Z1329: 1 | AA1329: 1162 | AB1329: 1532 | AC1329: 75.848563968668401 | AD1329: 26
W1330: PRESTON | X1330: 4 | Y1330: 13 | Z1330: 0 | AA1330: 1072 | AB1330: 1425 | AC1330: 75.228070175438603 | AD1330: 16
A1331: WILLIAMSTOWN | C1331: 4 | D1331: 2 | E1331: =C1331*6+D1331 -> 26 | G1331: 4 | H1331: 5 | I1331: =G1331*6+H1331 -> 29 | K1331: 10 | L1331: 11 | M1331: =K1331*6+L1331 -> 71 | O1331: 12 | P1331: 16 | Q1331: =O1331*6+P1331 -> 88 | S1331: WILLIAMSTOWN | W1331: CAMBERWELL | X1331: 4 | Y1331: 13 | Z1331: 0 | AA1331: 1114 | AB1331: 1559 | AC1331: 71.456061577934577 | AD1331: 16
A1332: NORTHCOTE | C1332: 0 | D1332: 0 | E1332: =C1332*6+D1332 -> 0 | G1332: 0 | H1332: 2 | I1332: =G1332*6+H1332 -> 2 | K1332: 0 | L1332: 2 | M1332: =K1332*6+L1332 -> 2 | O1332: 2 | P1332: 4 | Q1332: =O1332*6+P1332 -> 16 | S1332: ROHAN | W1332: SUNSHINE | X1332: 3 | Y1332: 13 | Z1332: 1 | AA1332: 1039 | AB1332: 1580 | AC1332: 65.759493670886073 | AD1332: 14
A1333: BEST PLAYERS | W1333: BRIGHTON | X1333: 3 | Y1333: 14 | Z1333: 0 | AA1333: 940 | AB1333: 2018 | AC1333: 46.58 | AD1333: 12
A1334: WILLIAMSTOWN | C1334: BOB JONES | F1334: McASEY | I1334: MURPHY | L1334: SMITH | O1334: E BEITZEL | Q1334: COPE | W1334: PRAHRAN | X1334: 1 | Y1334: 16 | Z1334: 0 | AA1334: 847 | AB1334: 1779 | AC1334: 47.61 | AD1334: 4
A1335: NORTHCOTE | C1335: OLIVER | F1335: McMAHON | I1335: LEVER | L1335: BRETHERTON | O1335: MORAN | Q1335: LANGHORNE
A1336: GOALKICKERS
A1337: WILLIAMSTOWN | C1337: MURPHY 3 | F1337: CULLINAN 3 | I1337: COPE 2 | K1337: WARD | M1337: CLOUGH | O1337: SMITH | Q1337: McASEY
A1338: NORTHCOTE | C1338: HICKS 2
A1340: PORT MELBOURNE | C1340: 4 | D1340: 5 | E1340: =C1340*6+D1340 -> 29 | G1340: 7 | H1340: 12 | I1340: =G1340*6+H1340 -> 54 | K1340: 10 | L1340: 14 | M1340: =K1340*6+L1340 -> 74 | O1340: 12 | P1340: 17 | Q1340: =O1340*6+P1340 -> 89 | S1340: PORT MELBOURNE
A1341: SUNSHINE | C1341: 3 | D1341: 4 | E1341: =C1341*6+D1341 -> 22 | G1341: 6 | H1341: 7 | I1341: =G1341*6+H1341 -> 43 | K1341: 9 | L1341: 9 | M1341: =K1341*6+L1341 -> 63 | O1341: 9 | P1341: 11 | Q1341: =O1341*6+P1341 -> 65 | S1341: MARCY
A1342: BEST PLAYERS
A1343: PORT MELBOURNE | C1343: MONKS | F1343: BONNETT | I1343: CLAXTON | L1343: CLARK | O1343: FREYER | Q1343: BOWEN
A1344: SUNSHINE | C1344: TRESIZE | F1344: CROSBIE | I1344: KELLY | L1344: WARREN | O1344: KEMP | Q1344: STAFFORD
A1345: GOALKICKERS
A1346: PORT MELBOURNE | C1346: BONNETT 4 | F1346: MONKS 3 | I1346: CLAXTON 2 | L1346: FREYER | N1346: McLEOD | Q1346: MUMMARY
A1347: SUNSHINE | C1347: N KELLY 4 | F1347: N KEMP | H1347: BARCLAY | J1347: STAFFORD | M1347: GREGORY | P1347: WARREN
A1349: BOX HILL | C1349: 12 | D1349: 4 | E1349: =C1349*6+D1349 -> 76 | G1349: 16 | H1349: 8 | I1349: =G1349*6+H1349 -> 104 | K1349: 22 | L1349: 13 | M1349: =K1349*6+L1349 -> 145 | O1349: 27 | P1349: 16 | Q1349: =O1349*6+P1349 -> 178 | S1349: ELSTERNWICK PARK
A1350: BRIGHTON | C1350: 0 | D1350: 0 | E1350: =C1350*6+D1350 -> 0 | G1350: 2 | H1350: 4 | I1350: =G1350*6+H1350 -> 16 | K1350: 3 | L1350: 4 | M1350: =K1350*6+L1350 -> 22 | O1350: 7 | P1350: 9 | Q1350: =O1350*6+P1350 -> 51 | S1350: ALLEN
A1351: BEST PLAYERS
A1352: BOX HILL | C1352: BROWN | F1352: EADE | I1352: BEASY | K1352: SALVADO | N1352: WHITE | Q1352: QUINN
A1353: BRIGHTON | C1353: BROWNING | F1353: W COOPER | I1353: McCANN | K1353: BURSEY | N1353: HOWELL | Q1353: BEGLEY
A1354: GOALKICKERS
A1355: BOX HILL | C1355: SALVADO 5 | F1355: BEASY 5 | H1355: BROWN 4 | J1355: QUINN 3 | L1355: GUEST 3 | N1355: WHITE 2 | P1355: GRAY 2 | R1355: EADE | T1355: GLARE | V1355: HARFIELD
A1356: BRIGHTON | C1356: QUIRK 2 | E1356: W COOPER | H1356: HOWELL | J1356: BROWNING | M1356: BURSEY | O1356: BEGLEY
A1358: SANDRINGHAM | C1358: 1 | D1358: 3 | E1358: =C1358*6+D1358 -> 9 | G1358: 4 | H1358: 8 | I1358: =G1358*6+H1358 -> 32 | K1358: 5 | L1358: 9 | M1358: =K1358*6+L1358 -> 39 | O1358: 10 | P1358: 13 | Q1358: =O1358*6+P1358 -> 73 | S1358: PRESTON
A1359: PRESTON | C1359: 2 | D1359: 1 | E1359: =C1359*6+D1359 -> 13 | G1359: 2 | H1359: 3 | I1359: =G1359*6+H1359 -> 15 | K1359: 5 | L1359: 7 | M1359: =K1359*6+L1359 -> 37 | O1359: 5 | P1359: 7 | Q1359: =O1359*6+P1359 -> 37 | S1359: MILLEN
A1360: BEST PLAYERS
A1361: SANDRINGHAM | C1361: RICHARDS | F1361: RANSOM | I1361: McKENZIE | L1361: JONES | N1361: SHRIVES | Q1361: MUSGROVE
A1362: PRESTON | C1362: WALSH | F1362: DAVIS | I1362: WALKER | L1362: BENNETTS | N1362: McLACHLAN | Q1362: WATSON
A1363: GOALKICKERS
A1364: SANDRINGHAM | C1364: OAKLEY 4 | F1364: BOUYER 3 | I1364: MUTER | K1364: RICHARDS | M1364: MURRAY
A1365: PRESTON | C1365: MILLER 2 | F1365: BENNETTS | I1365: LAMBIE | K1365: JENSEN
A1367: OAKLEIGH | C1367: 3 | D1367: 2 | E1367: =C1367*6+D1367 -> 20 | G1367: 7 | H1367: 6 | I1367: =G1367*6+H1367 -> 48 | K1367: 12 | L1367: 6 | M1367: =K1367*6+L1367 -> 78 | O1367: 19 | P1367: 9 | Q1367: =O1367*6+P1367 -> 123 | S1367: CAMBERWELL
A1368: CAMBERWELL | C1368: 2 | D1368: 5 | E1368: =C1368*6+D1368 -> 17 | G1368: 2 | H1368: 5 | I1368: =G1368*6+H1368 -> 17 | K1368: 5 | L1368: 9 | M1368: =K1368*6+L1368 -> 39 | O1368: 5 | P1368: 9 | Q1368: =O1368*6+P1368 -> 39 | S1368: O'DONOGHUE
A1369: BEST PLAYERS
A1370: OAKLEIGH | C1370: LONGLEY | F1370: McCOOKE | I1370: COUGHLAN | L1370: NAISMITH | O1370: COLLINS | R1370: KITTO
A1371: CAMBERWELL | C1371: GREIBERG | F1371: B JOHNSON | I1371: CHAPLIN | L1371: QUIRK | O1371: COMMONS | R1371: WHITTEN
A1372: GOALKICKERS
A1373: OAKLEIGH | C1373: McCOOKE 4 | F1373: COUGHLAN 3 | I1373: LONGLEY 3 | L1373: D'ARCY 3 | N1373: NAISMITH | Q1373: VARNEY | S1373: PALMER | V1373: COLLINS | X1373: ASH | Z1373: PANNAM
A1374: CAMBERWELL | C1374: LONDON 2 | F1374: WATTS 2 | I1374: FREIBERG
C1375: 21ST AUGUST
A1376: MORDIALLOC | C1376: 1 | D1376: 5 | E1376: =C1376*6+D1376 -> 11 | G1376: 3 | H1376: 10 | I1376: =G1376*6+H1376 -> 28 | K1376: 10 | L1376: 15 | M1376: =K1376*6+L1376 -> 75 | O1376: 11 | P1376: 18 | Q1376: =O1376*6+P1376 -> 84 | S1376: TOORAK PARK
A1377: PRAHRAN | C1377: 1 | D1377: 3 | E1377: =C1377*6+D1377 -> 9 | G1377: 5 | H1377: 6 | I1377: =G1377*6+H1377 -> 36 | K1377: 5 | L1377: 6 | M1377: =K1377*6+L1377 -> 36 | O1377: 9 | P1377: 9 | Q1377: =O1377*6+P1377 -> 63 | S1377: DIXON
A1378: BEST PLAYERS
A1379: MORDIALLOC | C1379: JOSE | F1379: BESANKO | I1379: DULLARD | L1379: ROBERTS | O1379: SHEEHAN | R1379: PEARSON
A1380: PRAHRAN | C1380: HOOPER | F1380: BOYD | I1380: HAYES | L1380: ROSS JONES | O1380: MORRISON | R1380: CLOSE
A1381: GOALKICKERS
A1382: MORDIALLOC | C1382: MINAHAN 4 | F1382: BAKER 3 | I1382: LE DEUX | K1382: ROBERTS | M1382: PEARSON | O1382: BESANKO
A1383: PRAHRAN | C1383: WALSH 3 | F1383: PEARSON 2 | I1383: HAYES | K1383: BOYD | M1383: CLOSE | O1383: HART
A1385: BYE | C1385: BRUNSWICK
A1387: ROUND 19 | E1387: 27TH AUGUST | J1387: WEATHER | O1387: NORTH WIND FINE | S1387: PLAYED AT
D1388: 1ST QTR | H1388: 2ND QTR | L1388: 3RD QTR | P1388: FINAL | S1388: MORDIALLOC
A1389: MORDIALLOC | C1389: 2 | D1389: 8 | E1389: =C1389*6+D1389 -> 20 | G1389: 3 | H1389: 11 | I1389: =G1389*6+H1389 -> 29 | K1389: 10 | L1389: 18 | M1389: =K1389*6+L1389 -> 78 | O1389: 12 | P1389: 20 | Q1389: =O1389*6+P1389 -> 92 | S1389: UMPIRE | X1389: LADDER | AB1389: ROUND | AD1389: 19
A1390: BRUNSWICK | C1390: 2 | D1390: 1 | E1390: =C1390*6+D1390 -> 13 | G1390: 8 | H1390: 6 | I1390: =G1390*6+H1390 -> 54 | K1390: 9 | L1390: 9 | M1390: =K1390*6+L1390 -> 63 | O1390: 11 | P1390: 13 | Q1390: =O1390*6+P1390 -> 79 | S1390: O'DONOGHUE
A1391: BEST PLAYERS | W1391: TEAM | X1391: W | Y1391: L | Z1391: D | AA1391: FOR | AB1391: AGST | AC1391: % | AD1391: PTS
A1392: MORDIALLOC | C1392: MINAHAN | F1392: BESANKO | I1392: JOSE | L1392: DULLARD | O1392: NISBET | Q1392: SHEEHAN
A1393: BRUNSWICK | C1393: BIBBY | F1393: K DILLON | I1393: EDWARDS | L1393: JOHNSON | O1393: RYAN | Q1393: WHILEY | W1393: SANDRINGHAM | X1393: 15 | Y1393: 3 | Z1393: 0 | AA1393: 2133 | AB1393: 942 | AC1393: 226.43 | AD1393: 60
A1394: GOALKICKERS | W1394: OAKLEIGH | X1394: 15 | Y1394: 3 | Z1394: 0 | AA1394: 1826 | AB1394: 1088 | AC1394: 167.83088235294119 | AD1394: 60
A1395: MORDIALLOC | C1395: BAKER 3 | E1395: MINAHAN 3 | H1395: PEARSON 2 | K1395: NESBIT | M1395: MAGINNESS | P1395: SHEEHAN | R1395: ROBERTS | W1395: YARRAVILLE | X1395: 14 | Y1395: 3 | Z1395: 1 | AA1395: 1584 | AB1395: 1095 | AC1395: 144.65753424657535 | AD1395: 58
A1396: BRUNSWICK | C1396: DENTON 4 | F1396: BIBBY 2 | H1396: NISSEN 2 | J1396: McMAHON | M1396: K DILLON | O1396: McKENNA | W1396: WILLIAMSTOWN | X1396: 14 | Y1396: 4 | Z1396: 0 | AA1396: 1645 | AB1396: 1066 | AC1396: 154.31519699812384 | AD1396: 56
W1397: COBURG | X1397: 13 | Y1397: 5 | Z1397: 0 | AA1397: 1752 | AB1397: 1218 | AC1397: 143.8423645320197 | AD1397: 52
A1398: DANDENONG | C1398: 5 | D1398: 4 | E1398: =C1398*6+D1398 -> 34 | G1398: 7 | H1398: 6 | I1398: =G1398*6+H1398 -> 48 | K1398: 10 | L1398: 10 | M1398: =K1398*6+L1398 -> 70 | O1398: 12 | P1398: 12 | Q1398: =O1398*6+P1398 -> 84 | S1398: BOX HILL | W1398: MOORABBIN | X1398: 12 | Y1398: 6 | Z1398: 0 | AA1398: 1705 | AB1398: 1270 | AC1398: 134.25 | AD1398: 48
A1399: BOX HILL | C1399: 1 | D1399: 3 | E1399: =C1399*6+D1399 -> 9 | G1399: 5 | H1399: 10 | I1399: =G1399*6+H1399 -> 40 | K1399: 7 | L1399: 12 | M1399: =K1399*6+L1399 -> 54 | O1399: 11 | P1399: 15 | Q1399: =O1399*6+P1399 -> 81 | S1399: ROHAN
A1400: BEST PLAYERS | W1400: MORDIALLOC | X1400: 11 | Y1400: 7 | Z1400: 0 | AA1400: 1377 | AB1400: 1254 | AC1400: 109.81 | AD1400: 44
A1401: DANDENONG | C1401: PENNEFATHER | F1401: PAPWORTH | I1401: WATERS | L1401: RANKIN | O1401: PETERS | Q1401: HOWER | W1401: PORT MELBOURNE | X1401: 9 | Y1401: 8 | Z1401: 1 | AA1401: 1481 | AB1401: 1300 | AC1401: 113.92307692307692 | AD1401: 38
A1402: BOX HILL | C1402: BROWN | F1402: GRAY | I1402: BEASY | L1402: CRAIG | O1402: WHITE | Q1402: SALVADO | W1402: BRUNSWICK | X1402: 9 | Y1402: 9 | Z1402: 0 | AA1402: 1246 | AB1402: 1272 | AC1402: 97.95597484276729 | AD1402: 36
A1403: GOALKICKERS | W1403: BOX HILL | X1403: 9 | Y1403: 9 | Z1403: 0 | AA1403: 1381 | AB1403: 1430 | AC1403: 96.573426573426573 | AD1403: 36
A1404: DANDENONG | C1404: PAPWORTH 6 | F1404: RANKIN 4 | I1404: GRAY 2 | W1404: DANDENONG | X1404: 8 | Y1404: 10 | Z1404: 0 | AA1404: 1326 | AB1404: 1446 | AC1404: 91.7 | AD1404: 32
A1405: BOX HILL | C1405: SALVADO 4 | F1405: WHITE 2 | I1405: GUEST 2 | K1405: GRAY 2 | M1405: GLARE | W1405: NORTHCOTE | X1405: 6 | Y1405: 11 | Z1405: 1 | AA1405: 1227 | AB1405: 1600 | AC1405: 76.6875 | AD1405: 26
W1406: SUNSHINE | X1406: 4 | Y1406: 13 | Z1406: 1 | AA1406: 1171 | AB1406: 1620 | AC1406: 72.283950617283949 | AD1406: 18
A1407: SUNSHINE | C1407: 3 | D1407: 3 | E1407: =C1407*6+D1407 -> 21 | G1407: 8 | H1407: 7 | I1407: =G1407*6+H1407 -> 55 | K1407: 11 | L1407: 8 | M1407: =K1407*6+L1407 -> 74 | O1407: 20 | P1407: 12 | Q1407: =O1407*6+P1407 -> 132 | S1407: SUNSHINE | W1407: PRESTON | X1407: 4 | Y1407: 14 | Z1407: 0 | AA1407: 1112 | AB1407: 1557 | AC1407: 71.419396274887603 | AD1407: 16
A1408: PRESTON | C1408: 3 | D1408: 0 | E1408: =C1408*6+D1408 -> 18 | G1408: 5 | H1408: 0 | I1408: =G1408*6+H1408 -> 30 | K1408: 6 | L1408: 4 | M1408: =K1408*6+L1408 -> 40 | O1408: 6 | P1408: 4 | Q1408: =O1408*6+P1408 -> 40 | S1408: McMASTER | W1408: CAMBERWELL | X1408: 4 | Y1408: 14 | Z1408: 0 | AA1408: 1163 | AB1408: 1743 | AC1408: 66.724039013195636 | AD1408: 16
A1409: BEST PLAYERS | W1409: BRIGHTON | X1409: 3 | Y1409: 15 | Z1409: 0 | AA1409: 977 | AB1409: 2131 | AC1409: 45.85 | AD1409: 12
A1410: SUNSHINE | C1410: LEVER | F1410: WARREN | I1410: TRESIZE | L1410: KELLY | N1410: EDWARDS | Q1410: PRESTON | W1410: PRAHRAN | X1410: 1 | Y1410: 17 | Z1410: 0 | AA1410: 871 | AB1410: 1945 | AC1410: 44.78 | AD1410: 4
A1411: PRESTON | C1411: HOWARD | F1411: WOODS | I1411: McLACHLAN | L1411: MILLER | N1411: GILBERT | Q1411: WALKER
A1412: GOALKICKERS
A1413: SUNSHINE | C1413: KELLY 7 | F1413: BARCLAY 4 | I1413: EDWARDS 4 | L1413: CROSBIE 2 | N1413: WARREN | P1413: GREGORY | R1413: TURNER
A1414: PRESTON | C1414: GILBERT 3 | F1414: WALSH 2 | I1414: LAMBIE
A1416: YARRAVILLE | C1416: 1 | D1416: 6 | E1416: =C1416*6+D1416 -> 12 | G1416: 5 | H1416: 10 | I1416: =G1416*6+H1416 -> 40 | K1416: 7 | L1416: 11 | M1416: =K1416*6+L1416 -> 53 | O1416: 9 | P1416: 14 | Q1416: =O1416*6+P1416 -> 68 | S1416: NORTHCOTE
A1417: NORTHCOTE | C1417: 5 | D1417: 0 | E1417: =C1417*6+D1417 -> 30 | G1417: 6 | H1417: 1 | I1417: =G1417*6+H1417 -> 37 | K1417: 8 | L1417: 8 | M1417: =K1417*6+L1417 -> 56 | O1417: 9 | P1417: 11 | Q1417: =O1417*6+P1417 -> 65 | S1417: MARCY
A1418: BEST PLAYERS
A1419: YARRAVILLE | C1419: McTAGGART | F1419: McCARTHY | I1419: MASON | L1419: FLEMING | N1419: BOB BROWN | Q1419: LAMONT
A1420: NORTHCOTE | C1420: McMAHON | F1420: ROOTSEY | I1420: HICKS | L1420: LAVER | N1420: GORMAN | Q1420: VAINS
A1421: GOALKICKERS
A1422: YARRAVILLE | C1422: MEDDINGS 3 | F1422: CAREY 2 | I1422: MASON | K1422: CROOK | M1422: McCARTHY | P1422: FLEMING
A1423: NORTHCOTE | C1423: HICKS 3 | F1423: LANGHORNE 2 | I1423: VAINS | K1423: MORAN | M1423: OLIVER | O1423: FINEGAN
A1425: MOORABBIN | C1425: 2 | D1425: 2 | E1425: =C1425*6+D1425 -> 14 | G1425: 8 | H1425: 9 | I1425: =G1425*6+H1425 -> 57 | K1425: 16 | L1425: 12 | M1425: =K1425*6+L1425 -> 108 | O1425: 25 | P1425: 16 | Q1425: =O1425*6+P1425 -> 166 | S1425: MOORABBIN
A1426: PRAHRAN | C1426: 1 | D1426: 2 | E1426: =C1426*6+D1426 -> 8 | G1426: 1 | H1426: 2 | I1426: =G1426*6+H1426 -> 8 | K1426: 3 | L1426: 4 | M1426: =K1426*6+L1426 -> 22 | O1426: 3 | P1426: 6 | Q1426: =O1426*6+P1426 -> 24 | S1426: POLLARD
A1427: BEST PLAYERS
A1428: MOORABBIN | C1428: WHALEBONE | F1428: CRAMERI | I1428: MILLS | L1428: CLARK | O1428: PERRY | Q1428: GILDER
A1429: PRAHRAN | C1429: HOOPER | F1429: HAYES | I1429: WILSON | L1429: ROLLINGS | O1429: BOYD | Q1429: MURRAY
A1430: GOALKICKERS
A1431: MOORABBIN | C1431: CRAMERI 7 | F1431: WHALEBONE 5 | I1431: RYAN 5 | K1431: MORONEY 3 | N1431: HOGAN 2 | Q1431: PERRY | S1431: BUZZA | U1431: HOY
A1432: PRAHRAN | C1432: McGEE | F1432: WALSH | I1432: MORRISON
A1434: SANDRINGHAM | C1434: 8 | D1434: 9 | E1434: =C1434*6+D1434 -> 57 | G1434: 13 | H1434: 9 | I1434: =G1434*6+H1434 -> 87 | K1434: 21 | L1434: 12 | M1434: =K1434*6+L1434 -> 138 | O1434: 28 | P1434: 16 | Q1434: =O1434*6+P1434 -> 184 | S1434: BEACH ROAD
A1435: CAMBERWELL | C1435: 1 | D1435: 1 | E1435: =C1435*6+D1435 -> 7 | G1435: 4 | H1435: 6 | I1435: =G1435*6+H1435 -> 30 | K1435: 5 | L1435: 7 | M1435: =K1435*6+L1435 -> 37 | O1435: 6 | P1435: 13 | Q1435: =O1435*6+P1435 -> 49 | S1435: ALLEN
A1436: BEST PLAYERS
A1437: SANDRINGHAM | C1437: CROFT | F1437: RICHARDS | I1437: WEBSTER | L1437: MURRAY | O1437: MUSGROVE | R1437: OAKLEY
A1438: CAMBERWELL | C1438: FREIBERG | F1438: SKALBERG | I1438: BAILEY | L1438: GIBSON | O1438: JOHNSON | R1438: YOUNG
A1439: GOALKICKERS
A1440: SANDRINGHAM | C1440: OAKLEY 9 | E1440: WEBSTER 3 | H1440: GLEESON 3 | J1440: SHRIVES 3 | M1440: BOUYER 3 | O1440: MURRAY 2 | R1440: RICHARDS 2 | V1440: ALLSOP 2 | W1440: RANSOM
A1441: CAMBERWELL | C1441: O'NEILL 2 | F1441: FREIBERG 2 | I1441: COMMONS | L1441: DOUGLAS
A1443: OAKLEIGH | C1443: 1 | D1443: 3 | E1443: =C1443*6+D1443 -> 9 | G1443: 9 | H1443: 6 | I1443: =G1443*6+H1443 -> 60 | K1443: 12 | L1443: 10 | M1443: =K1443*6+L1443 -> 82 | O1443: 16 | P1443: 17 | Q1443: =O1443*6+P1443 -> 113 | S1443: CAMBERWELL
A1444: BRIGHTON | C1444: 2 | D1444: 4 | E1444: =C1444*6+D1444 -> 16 | G1444: 2 | H1444: 5 | I1444: =G1444*6+H1444 -> 17 | K1444: 4 | L1444: 11 | M1444: =K1444*6+L1444 -> 35 | O1444: 4 | P1444: 13 | Q1444: =O1444*6+P1444 -> 37 | S1444: MILLEN
A1445: BEST PLAYERS
A1446: OAKLEIGH | C1446: KITTO | F1446: NAISMITH | I1446: COUGHLAN | L1446: D'ARCY | O1446: BUCKLEY | R1446: LANE
A1447: BRIGHTON | C1447: BROWNING | F1447: W COOPER | I1447: HOWELL | L1447: GARDE | O1447: TURNOUR | R1447: MOULE
A1448: GOALKICKERS
A1449: OAKLEIGH | C1449: D'ARCY 7 | F1449: McCOOKE 3 | I1449: COUGHLAN 3 | L1449: COLLINS 2 | O1449: LANE
A1450: BRIGHTON | C1450: GARDE 2 | F1450: McCANN | I1450: QUIRK
C1451: 28TH AUGUST
A1452: COBURG | C1452: 4 | D1452: 6 | E1452: =C1452*6+D1452 -> 30 | G1452: 9 | H1452: 10 | I1452: =G1452*6+H1452 -> 64 | K1452: 11 | L1452: 11 | M1452: =K1452*6+L1452 -> 77 | O1452: 15 | P1452: 20 | Q1452: =O1452*6+P1452 -> 110 | S1452: COBURG
A1453: PORT MELBOURNE | C1453: 1 | D1453: 3 | E1453: =C1453*6+D1453 -> 9 | G1453: 5 | H1453: 7 | I1453: =G1453*6+H1453 -> 37 | K1453: 13 | L1453: 9 | M1453: =K1453*6+L1453 -> 87 | O1453: 13 | P1453: 11 | Q1453: =O1453*6+P1453 -> 89 | S1453: HORNE
A1454: BEST PLAYERS
A1455: COBURG | C1455: O'BRIEN | F1455: WILSON | I1455: BIGELOW | L1455: JORDAN | O1455: SMITH | R1455: CLARKSON
A1456: PORT MELBOURNE | C1456: BONNETT | F1456: JOLIFFE | I1456: MUNNERY | L1456: McLEOD | O1456: FITZGERALD | R1456: LEWIS
A1457: GOALKICKERS
A1458: COBURG | C1458: COLBERT 4 | F1458: O'BRIEN 3 | I1458: BYRON 2 | K1458: CARR 2 | M1458: WILSON 2 | O1458: BIGELOW | Q1458: JORDAN
A1459: PORT MELBOURNE | C1459: BONNETT 6 | F1459: FITZGERALD 2 | I1459: FURNESS | K1459: MUNNERY | M1459: McLEOD | O1459: CLAXTON | Q1459: MONKS
A1461: BYE | C1461: WILLIAMSTOWN
A1463: FINALS
A1464: QUALIFYING FINALS | F1464: 3RD SEPTEMBER | K1464: WEATHER | M1464: WEST WIND COLD RAIN AFTER 1/2 TIME
A1465: YARRAVILLE | C1465: 8 | D1465: 3 | E1465: =C1465*6+D1465 -> 51 | G1465: 10 | H1465: 7 | I1465: =G1465*6+H1465 -> 67 | K1465: 15 | L1465: 8 | M1465: =K1465*6+L1465 -> 98 | O1465: 18 | P1465: 10 | Q1465: =O1465*6+P1465 -> 118 | S1465: YARRAVILLE
A1466: MOORABBIN | C1466: 0 | D1466: 1 | E1466: =C1466*6+D1466 -> 1 | G1466: 5 | H1466: 2 | I1466: =G1466*6+H1466 -> 32 | K1466: 10 | L1466: 2 | M1466: =K1466*6+L1466 -> 62 | O1466: 15 | P1466: 5 | Q1466: =O1466*6+P1466 -> 95 | S1466: O'DONOGHUE
A1467: BEST PLAYERS
A1468: YARRAVILLE | C1468: WILLIAMS | F1468: McCARTHY | I1468: HART | K1468: BOURKE | N1468: ORANGE | Q1468: McTAGGART
A1469: MOORABBIN | C1469: CLARK | F1469: HIRST | I1469: PERRY | K1469: HOGAN | N1469: PAPLEY | Q1469: CRAMERI
A1470: GOALKICKERS
A1471: YARRAVILLE | C1471: WILLIAMS 5 | F1471: HART 4 | I1471: MEDDINGS 3 | L1471: BURT | N1471: CAREY | P1471: McCARTHY | S1471: RON BROWN | V1471: LAMONT | X1471: CROOK
A1472: MOORABBIN | C1472: CRAMERI 5 | F1472: MORONEY 3 | I1472: HOGAN 2 | K1472: WHALEBONE | N1472: HOY | P1472: RYAN | R1472: MANIE | U1472: CLARK
A1474: WILLIAMSTOWN | C1474: 4 | D1474: 0 | E1474: =C1474*6+D1474 -> 24 | G1474: 6 | H1474: 4 | I1474: =G1474*6+H1474 -> 40 | K1474: 9 | L1474: 6 | M1474: =K1474*6+L1474 -> 60 | O1474: 12 | P1474: 10 | Q1474: =O1474*6+P1474 -> 82 | S1474: JUNCTION OVAL
A1475: COBURG | C1475: 1 | D1475: 4 | E1475: =C1475*6+D1475 -> 10 | G1475: 3 | H1475: 8 | I1475: =G1475*6+H1475 -> 26 | K1475: 5 | L1475: 10 | M1475: =K1475*6+L1475 -> 40 | O1475: 6 | P1475: 11 | Q1475: =O1475*6+P1475 -> 47 | S1475: POLLARD
A1476: BEST PLAYERS
A1477: WILLIAMSTOWN | C1477: B BEITZEL | F1477: E BEITZEL | I1477: WARD | L1477: PELLY | N1477: CULLINAN | Q1477: EVANS
A1478: COBURG | C1478: JORDAN | F1478: CLARKSON | I1478: BRENNAN | L1478: SMITH | N1478: MATTHEWS | Q1478: McNABB
A1479: GOALKICKERS
A1480: WILLIAMSTOWN | C1480: CULLINAN 3 | F1480: WARD 3 | I1480: MURPHY 2 | L1480: CLOUGH 2 | O1480: PELLY | Q1480: BOB JONES
A1481: COBURG | C1481: JORDAN 2 | F1481: COLBERT | I1481: BYRON | K1481: BRENNAN | M1481: O'BRIEN
A1483: 1ST SEMI | D1483: 10TH SEPTEMBER | J1483: WEATHER | L1483: NORTH WEST WIND FINE
A1484: WILLIAMSTOWN | C1484: 1 | D1484: 4 | E1484: =C1484*6+D1484 -> 10 | G1484: 3 | H1484: 11 | I1484: =G1484*6+H1484 -> 29 | K1484: 6 | L1484: 15 | M1484: =K1484*6+L1484 -> 51 | O1484: 8 | P1484: 19 | Q1484: =O1484*6+P1484 -> 67 | S1484: JUNCTION OVAL
A1485: YARRAVILLE | C1485: 4 | D1485: 2 | E1485: =C1485*6+D1485 -> 26 | G1485: 4 | H1485: 3 | I1485: =G1485*6+H1485 -> 27 | K1485: 7 | L1485: 6 | M1485: =K1485*6+L1485 -> 48 | O1485: 9 | P1485: 8 | Q1485: =O1485*6+P1485 -> 62 | S1485: MARCY
A1486: BEST PLAYERS
A1487: WILLIAMSTOWN | C1487: McASEY | F1487: WARD | I1487: COLQUHOUN | L1487: PELLY | O1487: BOB JONES | R1487: E BEITZEL
A1488: YARRAVILLE | C1488: LAMONT | F1488: McTAGGART | I1488: McCARTHY | L1488: BOB BROWN | O1488: WILLIAMS | R1488: ORANGE
A1489: GOALKICKERS
A1490: WILLIAMSTOWN | C1490: McASEY 2 | F1490: MURPHY 2 | I1490: CULLINAN 2 | L1490: WARD | N1490: PELLY
A1491: YARRAVILLE | C1491: RON BROWN 3 | F1491: MEDDINGS 2 | I1491: McCARTHY | L1491: WILLIAMS | N1491: HART | P1491: CAREY
A1493: 2ND SEMI | E1493: 17TH SEPTEMBER | J1493: WEATHER | M1493: SOUTH BREEZE RAIN GROUND BAD
A1494: SANDRINGHAM | C1494: 5 | D1494: 1 | E1494: =C1494*6+D1494 -> 31 | G1494: 5 | H1494: 2 | I1494: =G1494*6+H1494 -> 32 | K1494: 6 | L1494: 7 | M1494: =K1494*6+L1494 -> 43 | O1494: 10 | P1494: 11 | Q1494: =O1494*6+P1494 -> 71 | S1494: JUNCTION OVAL
A1495: OAKLEIGH | C1495: 2 | D1495: 5 | E1495: =C1495*6+D1495 -> 17 | G1495: 6 | H1495: 5 | I1495: =G1495*6+H1495 -> 41 | K1495: 7 | L1495: 10 | M1495: =K1495*6+L1495 -> 52 | O1495: 8 | P1495: 11 | Q1495: =O1495*6+P1495 -> 59 | S1495: ALLEN
A1496: BEST PLAYERS
A1497: SANDRINGHAM | C1497: WILLIAMS | F1497: MUTER | I1497: BOUYER | L1497: McKENZIE | O1497: SHRIVES | Q1497: ALLSOP
A1498: OAKLEIGH | C1498: McCOOKE | F1498: KITTO | I1498: COUGHLAN | L1498: PEAKE | O1498: JONES | Q1498: BUCKLEY
A1499: GOALKICKERS
A1500: SANDRINGHAM | C1500: ALLSOP 2 | F1500: WEBSTER 2 | I1500: EVANS | K1500: STRACHAN | N1500: MUTER | P1500: OAKLEY | R1500: RICHARDS | U1500: BOUYER
A1501: OAKLEIGH | C1501: COUGHLAN 6 | F1501: McCOOKE | I1501: ALLSOP
A1503: PRELIMINARY FINAL | G1503: 24TH SEPTEMBER | K1503: WEATHER | M1503: NORTH WIND THUNDERSTORM WITH HEAVY RAIN BEFORE GAME GROUND BAD
A1504: OAKLEIGH | C1504: 0 | D1504: 3 | E1504: =C1504*6+D1504 -> 3 | G1504: 2 | H1504: 7 | I1504: =G1504*6+H1504 -> 19 | K1504: 5 | L1504: 9 | M1504: =K1504*6+L1504 -> 39 | O1504: 6 | P1504: 12 | Q1504: =O1504*6+P1504 -> 48 | S1504: JUNCTION OVAL
A1505: WILLIAMSTOWN | C1505: 0 | D1505: 1 | E1505: =C1505*6+D1505 -> 1 | G1505: 2 | H1505: 5 | I1505: =G1505*6+H1505 -> 17 | K1505: 3 | L1505: 7 | M1505: =K1505*6+L1505 -> 25 | O1505: 4 | P1505: 9 | Q1505: =O1505*6+P1505 -> 33 | S1505: MARCY
A1506: BEST PLAYERS
A1507: OAKLEIGH | C1507: COLLINS | F1507: PEAKE | I1507: JONES | L1507: BUCKLEY | O1507: NAISMITH | R1507: PRENDERGAST
A1508: WILLIAMSTOWN | C1508: RUSSELL | F1508: E BEITZEL | I1508: BOB JONES | L1508: McASEY | O1508: COLLINS | R1508: SMITH
A1509: GOALKICKERS
A1510: OAKLEIGH | C1510: JONES 2 | F1510: ALLSOP 2 | I1510: COUGHLAN | L1510: McCOOKE
A1511: WILLIAMSTOWN | C1511: WARD | F1511: MAZOURIS | I1511: SMITH | L1511: EVANS
A1513: GRAND FINAL | E1513: 1ST OCTOBER | H1513: WEATHER | K1513: SOUTH BREEZE GROUND BAD FROM PREVIOUS RAIN
A1514: OAKLEIGH | C1514: 1 | D1514: 2 | E1514: 8 | G1514: 8 | H1514: 9 | I1514: 57 | K1514: 10 | L1514: 12 | M1514: 72 | O1514: 18 | P1514: 14 | Q1514: =O1514*6+P1514 -> 122 | S1514: JUNCTION OVAL
A1515: SANDRINGHAM | C1515: 2 | D1515: 4 | E1515: 16 | G1515: 3 | H1515: 4 | I1515: 22 | K1515: 7 | L1515: 10 | M1515: 52 | O1515: 8 | P1515: 14 | Q1515: =O1515*6+P1515 -> 62 | S1515: ALLEN
A1516: BEST PLAYERS
A1517: OAKLEIGH | C1517: COUGHLAN | F1517: ALLSOP | I1517: GIBBON | L1517: BUCKLEY | N1517: NAISMITH | Q1517: PRENDERGAST
A1518: SANDRINGHAM | C1518: BOLAND | F1518: RICHARDS | I1518: MUTER | L1518: CROFT | N1518: JONES | Q1518: STRACHAN
A1519: GOALKICKERS
A1520: OAKLEIGH | C1520: COUGHLAN 4 | F1520: JONES 4 | H1520: McCOOKE 2 | K1520: ALLSOP 2 | M1520: NAISMITH 2 | P1520: BUCKLEY | R1520: D'ARCY | T1520: PANNAM | W1520: ASH
A1521: SANDRINGHAM | C1521: BOUYER 3 | F1521: STRACHAN 2 | I1521: RICHARDS 2 | L1521: WEBSTER
A1525: INTERSTATE MATCH | G1525: 30TH JULY | L1525: WEATHER
D1526: 1ST QTR | H1526: 2ND QTR | L1526: 3RD QTR | P1526: FINAL
A1527: V.F.A. | C1527: 3 | D1527: 2 | E1527: =(C1527*6)+D1527 -> 20 | G1527: 4 | H1527: 3 | I1527: =(G1527*6)+H1527 -> 27 | K1527: 9 | L1527: 4 | M1527: =(K1527*6)+L1527 -> 58 | O1527: 12 | P1527: 9 | Q1527: =(O1527*6)+P1527 -> 81 | S1527: CANBERRA
A1528: AUST AMATEURS | C1528: 4 | D1528: 4 | E1528: =(C1528*6)+D1528 -> 28 | G1528: 5 | H1528: 4 | I1528: =(G1528*6)+H1528 -> 34 | K1528: 7 | L1528: 5 | M1528: =(K1528*6)+L1528 -> 47 | O1528: 8 | P1528: 9 | Q1528: =(O1528*6)+P1528 -> 57 | S1528: SCHWAB
A1529: BEST PLAYERS
A1530: V.F.A. | C1530: BYRON | F1530: WHILEY | I1530: E BEITZEL | L1530: COUGHLAN | O1530: FREYER | Q1530: WEBSTER
A1531: AUST AMATEURS | C1531: JOBLING | F1531: KERR | I1531: McCORMICK | L1531: LEWTHWAITE | O1531: CAPES | Q1531: PECK
A1532: GOALKICKERS
A1533: V.F.A. | C1533: BYRON 8 | F1533: HICKS 2 | I1533: COUGHLAN | L1533: MORONEY
A1534: AUST AMATEURS | C1534: PECK 3 | F1534: CAPES | H1534: TIDSWELL | K1534: LEWTHWAITE | N1534: McCORMICK | Q1534: NELSON
A1536: SQUAD
A1537: BOX HILL | C1537: CRAIG
A1538: BRUNSWICK | C1538: EDWARDS | F1538: WHILEY
A1539: COBURG | C1539: JORDAN | F1539: SHORT | I1539: BYRON
A1540: DANDENONG | C1540: WATERS | F1540: PENNEFATHER
A1541: MOORABBIN | C1541: GILDER | F1541: MORONEY | I1541: PAPLEY
A1542: MORDIALLOC | C1542: BESANKO | F1542: RITCHIE
A1543: NORTHCOTE | C1543: HICKS
A1544: OAKLEIGH | C1544: COUGHLAN
A1545: PORT MELBOURNE | C1545: FREYER
A1546: S'HAM | C1546: WEBSTER | F1546: RICHARDS | I1546: CROFT
A1547: WILLIAMSTOWN | C1547: E BEITZEL | F1547: BOB JONES
A1550: CARNIVAL
A1551: 1ST MATCH | E1551: 26TH JUNE
A1552: V.F.A. | C1552: 1 | D1552: 10 | E1552: =(C1552*6)+D1552 -> 16 | G1552: 9 | H1552: 17 | I1552: =(G1552*6)+H1552 -> 71 | K1552: 12 | L1552: 25 | M1552: =(K1552*6)+L1552 -> 97 | O1552: 17 | P1552: 31 | Q1552: =(O1552*6)+P1552 -> 133 | S1552: SYDNEY
A1553: A.C.T. | C1553: 1 | D1553: 5 | E1553: =(C1553*6)+D1553 -> 11 | G1553: 1 | H1553: 7 | I1553: =(G1553*6)+H1553 -> 13 | K1553: 2 | L1553: 8 | M1553: =(K1553*6)+L1553 -> 20 | O1553: 3 | P1553: 11 | Q1553: =(O1553*6)+P1553 -> 29 | S1553: DOWNIE (TAS)
A1554: BEST PLAYERS
A1555: V.F.A. | C1555: WHILEY | F1555: FREYER | I1555: BESANKO | L1555: SHORT | O1555: GILDER | R1555: E BEITZEL
A1556: A.C.T. | C1556: DUFFY | F1556: EVERS | I1556: GRIFFIN | L1556: WILSON | O1556: KERSHAW | R1556: GRIGG
A1557: GOALKICKERS
A1558: V.F.A. | C1558: BYRON 3 | E1558: WHALEBONE 3 | H1558: WEBSTER 2 | J1558: FREYER 2 | L1558: COUGHLAN 2 | O1558: PAPLEY | Q1558: RITCHIE | S1558: WATERS | V1558: HICKS
A1559: A.C.T. | C1559: EVERS | F1559: HEATH | I1559: FRY
A1561: TEAMS | F1561: V.F.A. | O1561: A.C.T.
A1562: B | C1562: E BEITZEL | F1562: SHORT | I1562: CROFT | L1562: GRIFFIN | O1562: GRIGG
A1563: H-B | C1563: EDWARDS | F1563: WHILEY | I1563: GILDER | L1563: WOOD | O1563: HARRIS | R1563: WATERS
A1564: C | C1564: BESANKO | F1564: WATERS | I1564: RICHARDS | L1564: KERSHAW | O1564: DUFFY
A1565: H-F | C1565: PAPLEY | F1565: HICKS | I1565: FREYER | L1565: BROWNING | O1565: WESTON | R1565: ALLEN
A1566: F | C1566: WHALEBONE | F1566: BYRON | I1566: WEBSTER | L1566: WHEELER | O1566: HEATH | R1566: BLENCOWE
A1567: R | C1567: BOB JONES | F1567: COUGHLAN | I1567: JORDAN | L1567: EVERS | O1567: WILSON | R1567: BARRY
A1568: RES | C1568: PENNEFATHER | F1568: RITCHIE | L1568: FULLER | O1568: FRY
A1570: 2ND MATCH | E1570: 29TH JUNE
A1571: V.F.A. | C1571: 6 | D1571: 9 | E1571: =(C1571*6)+D1571 -> 45 | G1571: 12 | H1571: 9 | I1571: =(G1571*6)+H1571 -> 81 | K1571: 20 | L1571: 13 | M1571: =(K1571*6)+L1571 -> 133 | O1571: 22 | P1571: 20 | Q1571: =(O1571*6)+P1571 -> 152 | S1571: SYDNEY
A1572: QLD | C1572: 1 | D1572: 2 | E1572: =(C1572*6)+D1572 -> 8 | G1572: 2 | H1572: 4 | I1572: =(G1572*6)+H1572 -> 16 | K1572: 2 | L1572: 6 | M1572: =(K1572*6)+L1572 -> 18 | O1572: 3 | P1572: 7 | Q1572: =(O1572*6)+P1572 -> 25 | S1572: DOWNIE (TAS)
A1573: BEST PLAYERS
A1574: V.F.A. | C1574: JORDAN | F1574: BYRON | I1574: PAPLEY | L1574: WATERS | O1574: BOB JONES | S1574: FREYER
A1575: QLD | C1575: DIHM | F1575: GREENLAW | I1575: CZISLOWSKI | L1575: PATTERSON | O1575: ADAMS
A1576: GOALKICKERS
A1577: V.F.A. | C1577: BYRON 9 | F1577: PAPLEY 4 | I1577: JORDAN 3 | K1577: HICKS 2 | M1577: WHALEBONE | P1577: PENNEFATHER | S1577: RITCHIE | U1577: COUGHLAN
A1578: QLD | C1578: McGILL | F1578: FALLIS | I1578: HEINIGER
A1580: 3RD MATCH | E1580: 3RD JULY
A1581: V.F.A. | C1581: 3 | D1581: 6 | E1581: =(C1581*6)+D1581 -> 24 | G1581: 9 | H1581: 14 | I1581: =(G1581*6)+H1581 -> 68 | K1581: 12 | L1581: 15 | M1581: =(K1581*6)+L1581 -> 87 | O1581: 23 | P1581: 24 | Q1581: =(O1581*6)+P1581 -> 162 | S1581: SYDNEY
A1582: N.S.W. | C1582: 3 | D1582: 4 | E1582: =(C1582*6)+D1582 -> 22 | G1582: 4 | H1582: 5 | I1582: =(G1582*6)+H1582 -> 29 | K1582: 8 | L1582: 7 | M1582: =(K1582*6)+L1582 -> 55 | O1582: 8 | P1582: 9 | Q1582: =(O1582*6)+P1582 -> 57 | S1582: DOWNIE (TAS)
A1583: BEST PLAYERS
A1584: V.F.A. | C1584: PAPLEY | F1584: HICKS | I1584: COUGHLAN | L1584: E BEITZEL | O1584: CAMERON | S1584: WATERS
A1585: N.S.W. | C1585: HARDING | F1585: McNULTY | I1585: BATCHELOR | L1585: SHOWN | O1585: NOACK
A1586: GOALKICKERS
A1587: V.F.A. | C1587: HICKS 6 | F1587: WATERS 5 | I1587: COUGHLAN 3 | L1587: BYRON 3 | N1587: PAPLEY 2 | Q1587: WEBSTER 2 | T1587: RITCHIE | V1587: MORONEY
A1588: N.S.W. | C1588: McNULTY 4 | F1588: PERIERA 2 | I1588: BATCHELOR 2
A1590: TEAMS | F1590: V.F.A. | O1590: N.S.W.
A1591: B | C1591: E BEITZEL | F1591: CAMERON | I1591: CROFT | L1591: STUBLEY | O1591: KUSHERT | R1591: LITTLE
A1592: H-B | C1592: EDWARDS | F1592: WHILEY | I1592: GILDER | L1592: PRINGLE | O1592: HARDING | R1592: SPEED
A1593: C | C1593: WHALEBONE | F1593: WATERS | I1593: FREYER | L1593: DAVIDSON | O1593: WHISH-WILSON | R1593: SIGSWORTH
A1594: H-F | C1594: WEBSTER | F1594: HICKS | I1594: PAPLEY | L1594: O'DONNELL | O1594: SHOWN | R1594: McNULTY
A1595: F | C1595: RITCHIE | F1595: BYRON | I1595: JORDAN | L1595: COOKE | O1595: PERIERA | R1595: WALLACE
A1596: R | C1596: BOB JONES | F1596: COUGHLAN | I1596: MORONEY | L1596: NOACK | O1596: HARE | R1596: BATCHELOE
A1597: RES | C1597: CRAIG | F1597: PENNEFATHER | L1597: ROBSON | O1597: TOWNLEY