A1: Victorian Football Association
A2: Season 1961 - Division Two
A3: © Copyright Wal Williams | F3: First created: 28 March 2016
A4: Contact: joywalwi at gmail dot com | F4: Last updated: 28 March 2016 | W4: VFA Results and tables - Link to the main index page
A5: You are free to copy this document in whole or part provided that proper acknowledgement is given to the author. All rights reserved.
A7: 1961 | D7: 2ND DIVISION
A8: ROUND 1 | E8: 15TH APRIL | I8: WEATHER | L8: SOUTH WEST WIND SHOWERS COLD | S8: PLAYED AT
D9: 1ST QTR | H9: 2ND QTR | L9: 3RD QTR | P9: FINAL | S9: SUNSHINE
A10: NORTHCOTE | E10: =C10*6+D10 -> 0 | I10: =G10*6+H10 -> 0 | M10: =K10*6+L10 -> 0 | O10: 13 | P10: 10 | Q10: =O10*6+P10 -> 88 | S10: UMPIRE | X10: LADDER | AB10: ROUND | AD10: 1
A11: SUNSHINE | E11: =C11*6+D11 -> 0 | I11: =G11*6+H11 -> 0 | M11: =K11*6+L11 -> 0 | O11: 6 | P11: 10 | Q11: =O11*6+P11 -> 46
A12: BEST PLAYERS | W12: TEAM | X12: W | Y12: L | Z12: D | AA12: FOR | AB12: AGST | AC12: % | AD12: PTS
A13: NORTHCOTE | C13: DOOLAN | F13: LANGBORNE | I13: OLIVER | L13: SHEARN | O13: MANSON | R13: MARCHANT
A14: SUNSHINE | C14: CROSBIE | F14: BLACKMAN | I14: BARCLAY | L14: SAUNDERS | O14: GIBBONS | R14: N KEMP | W14: CAMBERWELL | X14: 1 | Y14: 0 | Z14: 0 | AA14: 102 | AB14: 36 | AC14: =(AA14*100)/AB14 -> 283.33333333333331 | AD14: =(X14*4)+(Z14*2) -> 4
A15: GOALKICKERS | W15: NORTHCOTE | X15: 1 | Y15: 0 | Z15: 0 | AA15: 88 | AB15: 46 | AC15: =(AA15*100)/AB15 -> 191.30434782608697 | AD15: =(X15*4)+(Z15*2) -> 4
A16: NORTHCOTE | C16: MARCHANT 3 | F16: SHEARN 3 | I16: MORAN 2 | K16: LANGBORNE 2 | N16: WRIGHT | P16: MANSON | R16: AGHAN | W16: PRAHRAN | X16: 1 | Y16: 0 | Z16: 0 | AA16: 56 | AB16: 45 | AC16: =(AA16*100)/AB16 -> 124.44444444444444 | AD16: =(X16*4)+(Z16*2) -> 4
A17: SUNSHINE | C17: CROSBIE 3 | F17: BARCLAY 2 | I17: TREZISE | W17: DANDENONG | X17: 1 | Y17: 0 | Z17: 0 | AA17: 81 | AB17: 72 | AC17: =(AA17*100)/AB17 -> 112.5 | AD17: =(X17*4)+(Z17*2) -> 4
A19: CAMBERWELL | E19: =C19*6+D19 -> 0 | I19: =G19*6+H19 -> 0 | M19: =K19*6+L19 -> 0 | O19: 14 | P19: 18 | Q19: =O19*6+P19 -> 102 | S19: ELSTENWICK PARK | W19: PRESTON | X19: 0 | Y19: 1 | Z19: 0 | AA19: 72 | AB19: 81 | AC19: =(AA19*100)/AB19 -> 88.888888888888886 | AD19: =(X19*4)+(Z19*2) -> 0
A20: BRIGHTON | E20: =C20*6+D20 -> 0 | I20: =G20*6+H20 -> 0 | M20: =K20*6+L20 -> 0 | O20: 4 | P20: 12 | Q20: =O20*6+P20 -> 36 | W20: WAVERLEY | X20: 0 | Y20: 1 | Z20: 0 | AA20: 45 | AB20: 56 | AC20: =(AA20*100)/AB20 -> 80.357142857142861 | AD20: =(X20*4)+(Z20*2) -> 0
A21: BEST PLAYERS | W21: SUNSHINE | X21: 0 | Y21: 1 | Z21: 0 | AA21: 46 | AB21: 88 | AC21: =(AA21*100)/AB21 -> 52.272727272727273 | AD21: =(X21*4)+(Z21*2) -> 0
A22: CAMBERWELL | C22: YOUNG | F22: B JOHNSON | I22: O'NEILL | W22: BRIGHTON | X22: 0 | Y22: 1 | Z22: 0 | AA22: 36 | AB22: 102 | AC22: =(AA22*100)/AB22 -> 35.294117647058826 | AD22: =(X22*4)+(Z22*2) -> 0
A23: BRIGHTON | C23: MAY | F23: BEGLEY | I23: FOX
A24: GOALKICKERS
A25: CAMBERWELL | C25: O'NEILL 6 | E25: GIBSON 3 | G25: LONDON 2 | J25: GAUDION | L25: ELLIS | N25: QUIRK
A26: BRIGHTON | C26: COOPER 2 | F26: NIVEN | H26: BEGLEY
A28: DANDENONG | E28: =C28*6+D28 -> 0 | I28: =G28*6+H28 -> 0 | M28: =K28*6+L28 -> 0 | O28: 11 | P28: 15 | Q28: =O28*6+P28 -> 81 | S28: DANDENONG
A29: PRESTON | E29: =C29*6+D29 -> 0 | I29: =G29*6+H29 -> 0 | M29: =K29*6+L29 -> 0 | O29: 9 | P29: 18 | Q29: =O29*6+P29 -> 72
A30: BEST PLAYERS
A31: DANDENONG | C31: MORRIS | F31: STAUNTON | I31: ROSETTI | L31: PAPWORTH | O31: LITTLE | Q31: PENNEFATHER
A32: PRESTON | C32: MILLER | F32: HOWARD | I32: SLATTERY | L32: HANCOCK | O32: LAMBIE | Q32: PARRIS
A33: GOALKICKERS
A34: DANDENONG | C34: MORRIS 4 | F34: PAPWORTH 3 | I34: KNEEBONE 2 | L34: T WATERS | O34: OSBORNE
A35: PRESTON | C35: HOWARD 4 | F35: PARRIS 2 | I35: KEALEY | K35: McDONALD | N35: SAMPERI
A37: PRAHRAN | E37: =C37*6+D37 -> 0 | I37: =G37*6+H37 -> 0 | M37: =K37*6+L37 -> 0 | O37: 7 | P37: 14 | Q37: =O37*6+P37 -> 56 | S37: TOORAK PARK
A38: WAVERLEY | E38: =C38*6+D38 -> 0 | I38: =G38*6+H38 -> 0 | M38: =K38*6+L38 -> 0 | O38: 6 | P38: 9 | Q38: =O38*6+P38 -> 45
A39: BEST PLAYERS
A40: PRAHRAN | C40: McMAHON | F40: GRAY | I40: GEARY | L40: WISHART | O40: ROLLINGS | R40: KIND
A41: WAVERLEY | C41: D SCOTT | F41: FALCONER | I41: HEAD | L41: PECK | O41: P SCOTT | R41: RAY
A42: GOALKICKERS
A43: PRAHRAN | C43: McMAHON | F43: VURLOW | I43: GRAY | K43: GEARY | M43: WISHART | O43: ROLLINGS | R43: KIND
A44: WAVERLEY | C44: D SCOTT | F44: P SCOTT | I44: FALCONER | L44: HEAD | N44: RAY | P44: COLE
A46: ROUND 2 | E46: 22ND APRIL | I46: WEATHER | S46: PLAYED AT
D47: 1ST QTR | H47: 2ND QTR | L47: 3RD QTR | P47: FINAL | S47: WAVERLEY
A48: WAVERLEY | E48: =C48*6+D48 -> 0 | I48: =G48*6+H48 -> 0 | M48: =K48*6+L48 -> 0 | O48: 17 | P48: 9 | Q48: =O48*6+P48 -> 111 | S48: UMPIRE | X48: LADDER | AB48: ROUND | AD48: 2
A49: SUNSHINE | E49: =C49*6+D49 -> 0 | I49: =G49*6+H49 -> 0 | M49: =K49*6+L49 -> 0 | O49: 13 | P49: 19 | Q49: =O49*6+P49 -> 97
A50: BEST PLAYERS | W50: TEAM | X50: W | Y50: L | Z50: D | AA50: FOR | AB50: AGST | AC50: % | AD50: PTS
A51: WAVERLEY | C51: D SCOTT | F51: BLACK | I51: PECK | L51: P SCOTT | O51: COLE | Q51: BUNN
A52: SUNSHINE | C52: WARREN | F52: PRESTON | I52: CROSBIE | L52: STANFORD | O52: BYRNE | Q52: N KEMP | W52: NORTHCOTE | X52: 2 | Y52: 0 | Z52: 0 | AA52: 201 | AB52: 57 | AC52: =(AA52*100)/AB52 -> 352.63157894736844 | AD52: =(X52*4)+(Z52*2) -> 8
A53: GOALKICKERS | W53: DANDENONG | X53: 2 | Y53: 0 | Z53: 0 | AA53: 186 | AB53: 123 | AC53: =(AA53*100)/AB53 -> 151.21951219512195 | AD53: =(X53*4)+(Z53*2) -> 8
A54: WAVERLEY | C54: D SCOTT 5 | F54: FALCONER 3 | I54: P SCOTT 2 | K54: CLANCY 2 | N54: ARNOT 2 | P54: RAY 2 | R54: LEE | W54: PRAHRAN | X54: 2 | Y54: 0 | Z54: 0 | AA54: 136 | AB54: 123 | AC54: =(AA54*100)/AB54 -> 110.5691056910569 | AD54: =(X54*4)+(Z54*2) -> 8
A55: SUNSHINE | C55: BYRNE 3 | E55: WARREN 2 | H55: CROSBIE 2 | J55: BARABASZ 2 | M55: STAFFORD | P55: TREZISE | R55: TIPPING | T55: TURNER | W55: CAMBERWELL | X55: 1 | Y55: 1 | Z55: 0 | AA55: 153 | AB55: 131 | AC55: =(AA55*100)/AB55 -> 116.79389312977099 | AD55: =(X55*4)+(Z55*2) -> 4
A57: DANDENONG | E57: =C57*6+D57 -> 0 | I57: =G57*6+H57 -> 0 | M57: =K57*6+L57 -> 0 | O57: 12 | P57: 23 | Q57: =O57*6+P57 -> 95 | S57: CAMBERWELL | W57: WAVERLEY | X57: 1 | Y57: 1 | Z57: 0 | AA57: 156 | AB57: 153 | AC57: =(AA57*100)/AB57 -> 101.96078431372548 | AD57: =(X57*4)+(Z57*2) -> 4
A58: CAMBERWELL | E58: =C58*6+D58 -> 0 | I58: =G58*6+H58 -> 0 | M58: =K58*6+L58 -> 0 | O58: 8 | P58: 3 | Q58: =O58*6+P58 -> 51 | W58: PRESTON | X58: 0 | Y58: 2 | Z58: 0 | AA58: 150 | AB58: 161 | AC58: =(AA58*100)/AB58 -> 93.16770186335404 | AD58: =(X58*4)+(Z58*2) -> 0
A59: BEST PLAYERS | W59: SUNSHINE | X59: 0 | Y59: 2 | Z59: 0 | AA59: 143 | AB59: 199 | AC59: =(AA59*100)/AB59 -> 71.859296482412063 | AD59: =(X59*4)+(Z59*2) -> 0
A60: DANDENONG | C60: MINOTTI | F60: MORRIS | I60: PAPWORTH | L60: PENNEFATHER | O60: KIRKPATRICK | R60: GOOD | W60: BRIGHTON | X60: 0 | Y60: 2 | Z60: 0 | AA60: 47 | AB60: 215 | AC60: =(AA60*100)/AB60 -> 21.86046511627907 | AD60: =(X60*4)+(Z60*2) -> 0
A61: CAMBERWELL | C61: K JOHNSON | F61: YOUNG | I61: O'NEILL | L61: ELLIS | O61: MASON | R61: LONDON
A62: GOALKICKERS
A63: DANDENONG | C63: MINOTTI 4 | F63: PAPWORTH 2 | I63: WILLIAMS 2 | L63: MORRIS 2 | N63: T WATERS | Q63: WILSON
A64: CAMBERWELL | C64: ELLIS 3 | E64: O'NEILL 2 | H64: JONES 2 | J64: QUIRK
A66: PRAHRAN | E66: =C66*6+D66 -> 0 | I66: =G66*6+H66 -> 0 | M66: =K66*6+L66 -> 0 | O66: 12 | P66: 8 | Q66: =O66*6+P66 -> 80 | S66: PRESTON
A67: PRESTON | E67: =C67*6+D67 -> 0 | I67: =G67*6+H67 -> 0 | M67: =K67*6+L67 -> 0 | O67: 10 | P67: 18 | Q67: =O67*6+P67 -> 78
A68: BEST PLAYERS
A69: PRAHRAN | C69: VURLOW | F69: HILL | I69: WISHART | L69: GRAY | O69: STEER | R69: GALBRAITH
A70: PRESTON | C70: HOWARD | F70: MURNANE | I70: POWELL | L70: BOYLE | O70: HANCOCK | R70: O'DONNELL
A71: GOALKICKERS
A72: PRAHRAN | C72: GRAY 4 | E72: COLLINS 2 | H72: VURLOW 2 | K72: BUTLER 2 | N72: GEARY | P72: KIND
A73: PRESTON | C73: HOWARD 6 | F73: MURNANE | I73: LAMBIE | K73: MILLAR | M73: DIXON
A75: NORTHCOTE | E75: =C75*6+D75 -> 0 | I75: =G75*6+H75 -> 0 | M75: =K75*6+L75 -> 0 | O75: 15 | P75: 23 | Q75: =O75*6+P75 -> 113 | S75: NORTHCOTE
A76: BRIGHTON | E76: =C76*6+D76 -> 0 | I76: =G76*6+H76 -> 0 | M76: =K76*6+L76 -> 0 | O76: 1 | P76: 5 | Q76: =O76*6+P76 -> 11
A77: BEST PLAYERS
A78: NORTHCOTE | C78: ROOTSEY | F78: SHEARN | I78: LANGBORNE | L78: OLIVER | O78: DOOLAN | Q78: WRIGHT
A79: BRIGHTON | C79: MAY | F79: BURSEY | I79: FIDGE | L79: HOSKINS | O79: BARR
A80: GOALKICKERS
A81: NORTHCOTE | C81: SHEARD 4 | F81: KEAYS 3 | H81: DOOLAN 2 | J81: LANGBORNE 2 | M81: MORAN 2 | O81: BREHENY | Q81: ROOTSEY
A82: BRIGHTON | C82: BURSEY
A84: ROUND 3 | E84: 29TH APRIL | I84: WEATHER
D85: 1ST QTR | H85: 2ND QTR | L85: 3RD QTR | P85: FINAL
A86: PRESTON | E86: =C86*6+D86 -> 0 | I86: =G86*6+H86 -> 0 | M86: =K86*6+L86 -> 0 | O86: 17 | P86: 20 | Q86: =O86*6+P86 -> 122 | S86: PRESTON | X86: LADDER | AB86: ROUND | AD86: 3
A87: BRIGHTON | E87: =C87*6+D87 -> 0 | I87: =G87*6+H87 -> 0 | M87: =K87*6+L87 -> 0 | O87: 5 | P87: 6 | Q87: =O87*6+P87 -> 36
A88: BEST PLAYERS | W88: TEAM | X88: W | Y88: L | Z88: D | AA88: FOR | AB88: AGST | AC88: % | AD88: PTS
A89: PRESTON | C89: POWELL | F89: MUIR | I89: LAMBIE | L89: SLATTERY | O89: MILLAR | Q89: DIXON
A90: BRIGHTON | C90: CULL | F90: COOPER | I90: WATSON | L90: ELDERING | W90: NORTHCOTE | X90: 3 | Y90: 0 | Z90: 0 | AA90: 330 | AB90: 148 | AC90: =(AA90*100)/AB90 -> 222.97297297297297 | AD90: =(X90*4)+(Z90*2) -> 12
A91: GOALKICKERS | W91: DANDENONG | X91: 3 | Y91: 0 | Z91: 0 | AA91: 276 | AB91: 204 | AC91: =(AA91*100)/AB91 -> 135.29411764705881 | AD91: =(X91*4)+(Z91*2) -> 12
A92: PRESTON | C92: POWELL 4 | E92: LAMBIE 3 | G92: HOWARD 2 | I92: DIXON 2 | K92: J LORD 2 | M92: MILLAR | O92: GRAHAM | Q92: SLATTERY | S92: HANCOCK | W92: CAMBERWELL | X92: 2 | Y92: 1 | Z92: 0 | AA92: 251 | AB92: 221 | AC92: =(AA92*100)/AB92 -> 113.57466063348416 | AD92: =(X92*4)+(Z92*2) -> 8
A93: BRIGHTON | C93: CULL 3 | E93: COOPER | G93: WATSON | W93: PRAHRAN | X93: 2 | Y93: 1 | Z93: 0 | AA93: 226 | AB93: 221 | AC93: =(AA93*100)/AB93 -> 102.26244343891403 | AD93: =(X93*4)+(Z93*2) -> 8
A95: NORTHCOTE | E95: =C95*6+D95 -> 0 | I95: =G95*6+H95 -> 0 | M95: =K95*6+L95 -> 0 | O95: 19 | P95: 15 | Q95: =O95*6+P95 -> 129 | S95: WAVERLEY | W95: PRESTON | X95: 1 | Y95: 2 | Z95: 0 | AA95: 272 | AB95: 197 | AC95: =(AA95*100)/AB95 -> 138.07106598984771 | AD95: =(X95*4)+(Z95*2) -> 4
A96: WAVERLEY | E96: =C96*6+D96 -> 0 | I96: =G96*6+H96 -> 0 | M96: =K96*6+L96 -> 0 | O96: 13 | P96: 13 | Q96: =O96*6+P96 -> 91 | W96: WAVERLEY | X96: 1 | Y96: 2 | Z96: 0 | AA96: 247 | AB96: 282 | AC96: =(AA96*100)/AB96 -> 87.588652482269509 | AD96: =(X96*4)+(Z96*2) -> 4
A97: BEST PLAYERS | W97: SUNSHINE | X97: 0 | Y97: 3 | Z97: 0 | AA97: 224 | AB97: 289 | AC97: =(AA97*100)/AB97 -> 77.508650519031136 | AD97: =(X97*4)+(Z97*2) -> 0
A98: NORTHCOTE | C98: LANGBORNE | F98: OLIVER | I98: WRIGHT | L98: DOOLAN | O98: GASKETT | Q98: BLAKE | W98: BRIGHTON | X98: 0 | Y98: 3 | Z98: 0 | AA98: 83 | AB98: 337 | AC98: =(AA98*100)/AB98 -> 24.629080118694361 | AD98: =(X98*4)+(Z98*2) -> 0
A99: WAVERLEY | C99: FALCONER | F99: COLE | I99: BLACK | L99: LEE | O99: P SCOTT | Q99: CLANCY
A100: GOALKICKERS
A101: NORTHCOTE | C101: SHEARN 5 | E101: OLIVER 4 | G101: GASKETT 2 | I101: LANGBORNE 2 | L101: MARCHANT 2 | O101: DOOLAN | Q101: WRIGHT | S101: MORAN | V101: O'BRIEN
A102: WAVERLEY | C102: FALCONER 7 | F102: P SCOTT 3 | I102: DENMAN | L102: ARNOTT | N102: D SCOTT
A104: DANDENONG | E104: =C104*6+D104 -> 0 | I104: =G104*6+H104 -> 0 | M104: =K104*6+L104 -> 0 | O104: 13 | P104: 12 | Q104: =O104*6+P104 -> 90 | S104: SUNSHINE
A105: SUNSHINE | E105: =C105*6+D105 -> 0 | I105: =G105*6+H105 -> 0 | M105: =K105*6+L105 -> 0 | O105: 11 | P105: 15 | Q105: =O105*6+P105 -> 81
A106: BEST PLAYERS
A107: DANDENONG | C107: THOMAS | F107: LITTLE | I107: PENNEFATHER | L107: PAPWORTH | O107: MINOTTI | R107: MORRIS
A108: SUNSHINE | C108: WARREN | F108: STEVENS | I108: N KEMP | L108: TIPPING | O108: P FITZGERALD | R108: TURNER
A109: GOALKICKERS
A110: DANDENONG | C110: PETERS 4 | E110: GILLINGHAM 2 | H110: THOMAS 2 | J110: LITTLE 2 | L110: MINOTTI 2 | N110: JOHNSON
A111: SUNSHINE | C111: STEVENS 4 | F111: TIPPING 2 | I111: TURNER 2 | K111: LEWIS | M111: CROSBIE | O111: STAFFORD
A113: CAMBERWELL | E113: =C113*6+D113 -> 0 | I113: =G113*6+H113 -> 0 | M113: =K113*6+L113 -> 0 | O113: 14 | P113: 14 | Q113: =O113*6+P113 -> 98 | S113: TOORAK PARK
A114: PRAHRAN | E114: =C114*6+D114 -> 0 | I114: =G114*6+H114 -> 0 | M114: =K114*6+L114 -> 0 | O114: 12 | P114: 18 | Q114: =O114*6+P114 -> 90
A115: BEST PLAYERS
A116: CAMBERWELL | C116: JOHNSON | F116: YOUNG | I116: THOMPSON | L116: O'NEILL | O116: ELLIS
A117: PRAHRAN | C117: HARRIS | F117: McMAHON | I117: SEEDY | L117: BUTLER | O117: LEWIS | Q117: PEARSON
A118: GOALKICKERS
A119: CAMBERWELL | C119: O'NEILL 8 | F119: GAUDION 2 | I119: YOUNG | K119: ELLIS | M119: DOUGLAS | P119: SKALBERG
A120: PRAHRAN | C120: LEWIS 7 | F120: GEARY 2 | I120: McMAHON | L120: VURLOW | N120: GRAY
A122: ROUND 4 | E122: 6TH MAY | I122: WEATHER
D123: 1ST QTR | H123: 2ND QTR | L123: 3RD QTR | P123: FINAL
A124: WAVERLEY | E124: =C124*6+D124 -> 0 | I124: =G124*6+H124 -> 0 | M124: =K124*6+L124 -> 0 | O124: 12 | P124: 18 | Q124: =O124*6+P124 -> 90 | S124: ELSTENWICK PARK | X124: LADDER | AB124: ROUND | AD124: 4
A125: BRIGHTON | E125: =C125*6+D125 -> 0 | I125: =G125*6+H125 -> 0 | M125: =K125*6+L125 -> 0 | O125: 8 | P125: 11 | Q125: =O125*6+P125 -> 59
A126: BEST PLAYERS | W126: TEAM | X126: W | Y126: L | Z126: D | AA126: FOR | AB126: AGST | AC126: % | AD126: PTS
A127: WAVERLEY | C127: COLE | F127: D SCOTT | I127: CLANCY | L127: LEE | N127: SMITH | Q127: BLACK
A128: BRIGHTON | C128: FIDGE | F128: MAHONEY | I128: BEGLEY | L128: MAY | N128: WATSON | Q128: FOX | W128: NORTHCOTE | X128: 4 | Y128: 0 | Z128: 0 | AA128: 402 | AB128: 217 | AC128: =(AA128*100)/AB128 -> 185.25345622119815 | AD128: =(X128*4)+(Z128*2) -> 16
A129: GOALKICKERS | W129: DANDENONG | X129: 4 | Y129: 0 | Z129: 0 | AA129: 392 | AB129: 253 | AC129: =(AA129*100)/AB129 -> 154.94071146245059 | AD129: =(X129*4)+(Z129*2) -> 16
A130: WAVERLEY | C130: LEE 4 | E130: D SCOTT 3 | H130: CLANCY 2 | K130: COLE 2 | M130: DENMAN | W130: CAMBERWELL | X130: 3 | Y130: 1 | Z130: 0 | AA130: 356 | AB130: 318 | AC130: =(AA130*100)/AB130 -> 111.9496855345912 | AD130: =(X130*4)+(Z130*2) -> 12
A131: BRIGHTON | C131: MAHONEY 3 | F131: FRANCIS | I131: BEGLEY | K131: WATSON | M131: HANCE | O131: FIDGE | W131: WAVERLEY | X131: 2 | Y131: 2 | Z131: 0 | AA131: 337 | AB131: 341 | AC131: =(AA131*100)/AB131 -> 98.826979472140764 | AD131: =(X131*4)+(Z131*2) -> 8
A133: CAMBERWELL | E133: =C133*6+D133 -> 0 | I133: =G133*6+H133 -> 0 | M133: =K133*6+L133 -> 0 | O133: 16 | P133: 9 | Q133: =O133*6+P133 -> 105 | S133: CAMBERWELL | W133: PRAHRAN | X133: 2 | Y133: 2 | Z133: 0 | AA133: 275 | AB133: 337 | AC133: =(AA133*100)/AB133 -> 81.602373887240361 | AD133: =(X133*4)+(Z133*2) -> 8
A134: SUNSHINE | E134: =C134*6+D134 -> 0 | I134: =G134*6+H134 -> 0 | M134: =K134*6+L134 -> 0 | O134: 14 | P134: 13 | Q134: =O134*6+P134 -> 97 | W134: PRESTON | X134: 1 | Y134: 3 | Z134: 0 | AA134: 341 | AB134: 269 | AC134: =(AA134*100)/AB134 -> 126.76579925650557 | AD134: =(X134*4)+(Z134*2) -> 4
A135: BEST PLAYERS | W135: SUNSHINE | X135: 0 | Y135: 4 | Z135: 0 | AA135: 321 | AB135: 394 | AC135: =(AA135*100)/AB135 -> 81.472081218274113 | AD135: =(X135*4)+(Z135*2) -> 0
A136: CAMBERWELL | C136: LONDON | F136: O'NEILL | I136: YOUNG | L136: MASON | N136: J THOMPSON | Q136: GIBSON | W136: BRIGHTON | X136: 0 | Y136: 4 | Z136: 0 | AA136: 142 | AB136: 427 | AC136: =(AA136*100)/AB136 -> 33.255269320843091 | AD136: =(X136*4)+(Z136*2) -> 0
A137: SUNSHINE | C137: P FITZGERALD | F137: TREZISE | I137: GALLE | L137: CASEY | N137: BREWEIS | Q137: PRESTON
A138: GOALKICKERS
A139: CAMBERWELL | C139: O'NEILL 9 | F139: GIBSON 3 | I139: QUIRK | K139: LONDON | M139: YOUNG | O139: DOUGLAS
A140: SUNSHINE | C140: BREWIS 7 | F140: CROSBIE 2 | I140: CASEY | K140: GALLE | M140: N WARREN | P140: TIPPING | R140: MULLARVEY
A142: DANDENONG | E142: =C142*6+D142 -> 0 | I142: =G142*6+H142 -> 0 | M142: =K142*6+L142 -> 0 | O142: 16 | P142: 20 | Q142: =O142*6+P142 -> 116 | S142: DANDENONG
A143: PRAHRAN | E143: =C143*6+D143 -> 0 | I143: =G143*6+H143 -> 0 | M143: =K143*6+L143 -> 0 | O143: 6 | P143: 13 | Q143: =O143*6+P143 -> 49
A144: BEST PLAYERS
A145: DANDENONG | C145: MORRIS | F145: PENNEFATHER | I145: KILPATRICK | L145: OSBORNE | N145: T WATERS | Q145: MINOTTI
A146: PRAHRAN | C146: HILL | F146: GRAY | I146: BUTLER | L146: HARRISON | N146: VURLOW | Q146: PEARSON
A147: GOALKICKERS
A148: DANDENONG | C148: PENNEFATHER 6 | F148: PAPWORTH 3 | I148: MORRIS 3 | K148: MINOTTI 2 | N148: GILLINGHAM | Q148: THOMAS
A149: PRAHRAN | C149: VURLOW 2 | F149: McMAHON | I149: GEARY | K149: PEARSON | M149: B WILSON
A151: NORTHCOTE | E151: =C151*6+D151 -> 0 | I151: =G151*6+H151 -> 0 | M151: =K151*6+L151 -> 0 | O151: 11 | P151: 6 | Q151: =O151*6+P151 -> 72 | S151: NORTHCOTE
A152: PRESTON | E152: =C152*6+D152 -> 0 | I152: =G152*6+H152 -> 0 | M152: =K152*6+L152 -> 0 | O152: 9 | P152: 15 | Q152: =O152*6+P152 -> 69
A153: BEST PLAYERS
A154: NORTHCOTE | C154: SHEARN | F154: BLAKE | I154: BRETHERTON | L154: LEVER | N154: WRIGHT | Q154: GASCOTT
A155: PRESTON | C155: POWER | F155: MUIR | I155: SLATTERY | L155: MURNANE | N155: McLAUGHLIN | Q155: J LORD
A156: GOALKICKERS
A157: NORTHCOTE | C157: SHEARN 4 | F157: MORAN 2 | I157: GASCOTT 2 | L157: ROOTSEY | N157: OLIVER | P157: WRIGHT
A158: PRESTON | C158: POWELL 3 | F158: MUIR 2 | I158: HOWARD 2 | L158: VERNON | N158: J LORD
A160: ROUND 5 | E160: 13TH MAY | I160: WEATHER
D161: 1ST QTR | H161: 2ND QTR | L161: 3RD QTR | P161: FINAL
A162: PRESTON | E162: =C162*6+D162 -> 0 | I162: =G162*6+H162 -> 0 | M162: =K162*6+L162 -> 0 | O162: 18 | P162: 15 | Q162: =O162*6+P162 -> 123 | S162: PRESTON | X162: LADDER | AB162: ROUND | AD162: 5
A163: SUNSHINE | E163: =C163*6+D163 -> 0 | I163: =G163*6+H163 -> 0 | M163: =K163*6+L163 -> 0 | O163: 11 | P163: 10 | Q163: =O163*6+P163 -> 76
A164: BEST PLAYERS | W164: TEAM | X164: W | Y164: L | Z164: D | AA164: FOR | AB164: AGST | AC164: % | AD164: PTS
A165: PRESTON | C165: POWELL | F165: LAMBIE | I165: SLATTERY | L165: O'DONNELL | O165: SAYERS | Q165: McMAHON
A166: SUNSHINE | C166: CROSBIE | F166: TREZISE | I166: P FITZGERALD | L166: MULLARVEY | O166: PRESTON | Q166: LEAVER | W166: DANDENONG | X166: 5 | Y166: 0 | Z166: 0 | AA166: 593 | AB166: 312 | AC166: =(AA166*100)/AB166 -> 190.06410256410257 | AD166: =(X166*4)+(Z166*2) -> 20
A167: GOALKICKERS | W167: NORTHCOTE | X167: 5 | Y167: 0 | Z167: 0 | AA167: 480 | AB167: 258 | AC167: =(AA167*100)/AB167 -> 186.04651162790697 | AD167: =(X167*4)+(Z167*2) -> 20
A168: PRESTON | C168: DAVIS 4 | E168: POWELL 3 | H168: McMAHON 3 | K168: MURNANE 3 | N168: KEALEY 3 | Q168: LAMBIE | S168: DIXON | W168: CAMBERWELL | X168: 4 | Y168: 1 | Z168: 0 | AA168: 453 | AB168: 407 | AC168: =(AA168*100)/AB168 -> 111.3022113022113 | AD168: =(X168*4)+(Z168*2) -> 16
A169: SUNSHINE | C169: BREWIS 3 | E169: CASEY 2 | G169: MULLARVEY 2 | J169: CROSBIE | M169: TIPPING | O169: MAGILL | Q169: TREZISE | W169: PRESTON | X169: 2 | Y169: 3 | Z169: 0 | AA169: 464 | AB169: 345 | AC169: =(AA169*100)/AB169 -> 134.49275362318841 | AD169: =(X169*4)+(Z169*2) -> 8
A171: CAMBERWELL | E171: =C171*6+D171 -> 0 | I171: =G171*6+H171 -> 0 | M171: =K171*6+L171 -> 0 | O171: 15 | P171: 7 | Q171: =O171*6+P171 -> 97 | S171: CAMBERWELL | W171: WAVERLEY | X171: 2 | Y171: 3 | Z171: 0 | AA171: 426 | AB171: 438 | AC171: =(AA171*100)/AB171 -> 97.260273972602747 | AD171: =(X171*4)+(Z171*2) -> 8
A172: WAVERLEY | E172: =C172*6+D172 -> 0 | I172: =G172*6+H172 -> 0 | M172: =K172*6+L172 -> 0 | O172: 12 | P172: 17 | Q172: =O172*6+P172 -> 89 | W172: PRAHRAN | X172: 2 | Y172: 3 | Z172: 0 | AA172: 316 | AB172: 415 | AC172: =(AA172*100)/AB172 -> 76.144578313253007 | AD172: =(X172*4)+(Z172*2) -> 8
A173: BEST PLAYERS | W173: SUNSHINE | X173: 0 | Y173: 5 | Z173: 0 | AA173: 397 | AB173: 517 | AC173: =(AA173*100)/AB173 -> 76.789168278529985 | AD173: =(X173*4)+(Z173*2) -> 0
A174: CAMBERWELL | C174: O'NEILL | F174: THOMPSON | I174: QUIRK | L174: ELLIS | O174: YOUNG | Q174: JOHNSON | W174: BRIGHTON | X174: 0 | Y174: 5 | Z174: 0 | AA174: 201 | AB174: 628 | AC174: =(AA174*100)/AB174 -> 32.00636942675159 | AD174: =(X174*4)+(Z174*2) -> 0
A175: WAVERLEY | C175: ARNOTT | F175: JOHNSTON | I175: FALCONER | L175: McGUINNESS | O175: COLE | Q175: D SCOTT
A176: GOALKICKERS
A177: CAMBERWELL | C177: O'NEILL 8 | F177: QUIRK 3 | H177: COLLETT | J177: JONES | L177: FRIEBERG | N177: SMITH
A178: WAVERLEY | C178: D SCOTT 4 | F178: ARNOTT 3 | I178: FALCONER 2 | L178: COLE | N178: JOHNSTON | Q178: McGUINNESS
A180: DANDENONG | E180: =C180*6+D180 -> 0 | I180: =G180*6+H180 -> 0 | M180: =K180*6+L180 -> 0 | O180: 30 | P180: 21 | Q180: =O180*6+P180 -> 201 | S180: DANDENONG
A181: BRIGHTON | E181: =C181*6+D181 -> 0 | I181: =G181*6+H181 -> 0 | M181: =K181*6+L181 -> 0 | O181: 8 | P181: 11 | Q181: =O181*6+P181 -> 59
A182: BEST PLAYERS
A183: DANDENONG | C183: GILLINGHAM | F183: STAUNTON | I183: MINOTTI | L183: OSBORN | O183: GOOD | Q183: PETERS
A184: BRIGHTON | C184: FIDGE | F184: FOX | I184: MAY | L184: KEENAN | O184: FRANCIS | Q184: HOSKIN
A185: GOALKICKERS
A186: DANDENONG | C186: GILLINHAM 11 | F186: MINOTTI 5 | I186: MORRIS 3 | K186: PETERS 3 | M186: THOMAS 2 | P186: OSBORNE 2 | R186: PENNEFATHER | V186: PAPWORTH | X186: T WATERS | AA186: WHELOW
A187: BRIGHTON | C187: FIDGE 3 | E187: FRANCIS 2 | H187: SAUNDERS | K187: BEGLEY | M187: MAHONEY
E188: 14TH MAY | I188: WEATHER
A189: NORTHCOTE | E189: =C189*6+D189 -> 0 | I189: =G189*6+H189 -> 0 | M189: =K189*6+L189 -> 0 | O189: 12 | P189: 6 | Q189: =O189*6+P189 -> 78 | S189: TOORAK PARK
A190: PRAHRAN | E190: =C190*6+D190 -> 0 | I190: =G190*6+H190 -> 0 | M190: =K190*6+L190 -> 0 | O190: 5 | P190: 11 | Q190: =O190*6+P190 -> 41
A191: BEST PLAYERS
A192: NORTHCOTE | C192: WRIGHT | F192: DOOLAN | I192: MORAN | L192: LANGBORNE | O192: GASCOTT
A193: PRAHRAN | C193: KIND | F193: PAT WALSH | I193: STEER | L193: HAYES | O193: CLOSE | Q193: HILL
A194: GOALKICKERS
A195: NORTHCOTE | C195: MORAN 3 | F195: DOOLAN 2 | I195: SHEARN 2 | K195: LANGBORNE 2 | N195: KEAYS | P195: STONEHAM | S195: GASCOTT
A196: PRAHRAN | C196: LEWIS 2 | F196: BOSCH | I196: PAT WALSH | L196: CLOSE
A198: ROUND 6 | E198: 20TH MAY | I198: WEATHER
D199: 1ST QTR | H199: 2ND QTR | L199: 3RD QTR | P199: FINAL
A200: NORTHCOTE | E200: =C200*6+D200 -> 0 | I200: =G200*6+H200 -> 0 | M200: =K200*6+L200 -> 0 | O200: 11 | P200: 12 | Q200: =O200*6+P200 -> 78 | S200: NORTHCOTE | X200: LADDER | AB200: ROUND | AD200: 6
A201: DANDENONG | E201: =C201*6+D201 -> 0 | I201: =G201*6+H201 -> 0 | M201: =K201*6+L201 -> 0 | O201: 3 | P201: 14 | Q201: =O201*6+P201 -> 32
A202: BEST PLAYERS | W202: TEAM | X202: W | Y202: L | Z202: D | AA202: FOR | AB202: AGST | AC202: % | AD202: PTS
A203: NORTHCOTE | C203: LANGBORNE | F203: TAYLOR | I203: WRIGHT | L203: DOOLAN | O203: OLIVER | Q203: McMAHON
A204: DANDENONG | C204: T WATERS | F204: B WATERS | I204: LITTLE | L204: COOTE | O204: PENNEFATHER | W204: NORTHCOTE | X204: 6 | Y204: 0 | Z204: 0 | AA204: 556 | AB204: 290 | AC204: =(AA204*100)/AB204 -> 191.72413793103448 | AD204: =(X204*4)+(Z204*2) -> 24
A205: GOALKICKERS | W205: DANDENONG | X205: 5 | Y205: 1 | Z205: 0 | AA205: 625 | AB205: 390 | AC205: =(AA205*100)/AB205 -> 160.25641025641025 | AD205: =(X205*4)+(Z205*2) -> 20
A206: NORTHCOTE | C206: OUSLEY 3 | F206: DOOLAN 2 | I206: TAYLOR 2 | L206: SHEARN 2 | N206: ROOTSEY | Q206: BREHENEY | W206: CAMBERWELL | X206: 4 | Y206: 2 | Z206: 0 | AA206: 522 | AB206: 508 | AC206: =(AA206*100)/AB206 -> 102.75590551181102 | AD206: =(X206*4)+(Z206*2) -> 16
A207: DANDENONG | C207: GILLINGHAM | F207: PETERS | I207: PENNEFATHER | W207: PRESTON | X207: 3 | Y207: 3 | Z207: 0 | AA207: 546 | AB207: 408 | AC207: =(AA207*100)/AB207 -> 133.8235294117647 | AD207: =(X207*4)+(Z207*2) -> 12
A209: PRAHRAN | E209: =C209*6+D209 -> 0 | I209: =G209*6+H209 -> 0 | M209: =K209*6+L209 -> 0 | O209: 17 | P209: 28 | Q209: =O209*6+P209 -> 130 | W209: PRAHRAN | X209: 3 | Y209: 3 | Z209: 0 | AA209: 446 | AB209: 467 | AC209: =(AA209*100)/AB209 -> 95.503211991434696 | AD209: =(X209*4)+(Z209*2) -> 12
A210: BRIGHTON | E210: =C210*6+D210 -> 0 | I210: =G210*6+H210 -> 0 | M210: =K210*6+L210 -> 0 | O210: 7 | P210: 10 | Q210: =O210*6+P210 -> 52 | S210: ELSTENWICK PARK | W210: WAVERLEY | X210: 2 | Y210: 4 | Z210: 0 | AA210: 489 | AB210: 520 | AC210: =(AA210*100)/AB210 -> 94.038461538461533 | AD210: =(X210*4)+(Z210*2) -> 8
A211: BEST PLAYERS | W211: SUNSHINE | X211: 1 | Y211: 5 | Z211: 0 | AA211: 498 | AB211: 586 | AC211: =(AA211*100)/AB211 -> 84.982935153583611 | AD211: =(X211*4)+(Z211*2) -> 4
A212: PRAHRAN | C212: HILL | F212: LAMBERT | I212: B WILSON | L212: GRAY | O212: BOSCH | Q212: KIND | W212: BRIGHTON | X212: 0 | Y212: 6 | Z212: 0 | AA212: 253 | AB212: 758 | AC212: =(AA212*100)/AB212 -> 33.377308707124008 | AD212: =(X212*4)+(Z212*2) -> 0
A213: BRIGHTON | C213: FIDGE | F213: ASHENHURST | I213: MAY | L213: BEGLEY | O213: THOMAS | Q213: LAMBERT
A214: GOALKICKERS
A215: PRAHRAN | C215: KIND 4 | E215: PEARSON 3 | H215: BOSCH 3 | J215: CLOSE 2 | L215: McMAHON 2 | O215: O'BRIEN 2 | Q215: HAYES
A216: BRIGHTON | C216: LAMBERT 4 | F216: MAHONEY 2 | I216: FIDGE
A218: SUNSHINE | E218: =C218*6+D218 -> 0 | I218: =G218*6+H218 -> 0 | M218: =K218*6+L218 -> 0 | O218: 15 | P218: 11 | Q218: =O218*6+P218 -> 101 | S218: SUNSHINE
A219: CAMBERWELL | E219: =C219*6+D219 -> 0 | I219: =G219*6+H219 -> 0 | M219: =K219*6+L219 -> 0 | O219: 10 | P219: 9 | Q219: =O219*6+P219 -> 69
A220: BEST PLAYERS
A221: SUNSHINE | C221: GALLE | F221: CROSBIE | I221: CASEY | L221: WARREN | O221: N KEMP | Q221: PRESTON
A222: CAMBERWELL | C222: LONDON | F222: QUIRK | I222: JOHNSON | L222: BUNNING | O222: MASON | Q222: YOUNG
A223: GOALKICKERS
A224: SUNSHINE | C224: CASEY 5 | F224: BREWIS 4 | I224: STEVENS 2 | L224: GALLE 2 | N224: MAGILL | P224: CROSBIE
A225: CAMBERWELL | C225: O'NEILL 3 | F225: GIBSON 2 | I225: YOUNG 2 | K225: BUNNING | M225: QUIRK | O225: THOMPSON
A227: PRESTON | E227: =C227*6+D227 -> 0 | I227: =G227*6+H227 -> 0 | M227: =K227*6+L227 -> 0 | O227: 10 | P227: 22 | Q227: =O227*6+P227 -> 82 | S227: WAVERLEY
A228: WAVERLEY | E228: =C228*6+D228 -> 0 | I228: =G228*6+H228 -> 0 | M228: =K228*6+L228 -> 0 | O228: 9 | P228: 9 | Q228: =O228*6+P228 -> 63
A229: BEST PLAYERS
A230: PRESTON | C230: HANCOCK | F230: MURNANE | I230: MILLAR | L230: SLATTERY | O230: LAMBIE | Q230: POWELL
A231: WAVERLEY | C231: BLACK | F231: PECK | I231: CLANCY | L231: COLE | O231: RAY | Q231: McGUINNESS
A232: GOALKICKERS | C232: 1 SHORT
A233: PRESTON | C233: MURNANE 5 | F233: HOWARD | I233: LAMBERT | L233: KEARNEY | N233: DIXON
A234: WAVERLEY | C234: CLANCY 2 | F234: LEE 2 | H234: RAY 2 | K234: D SCOTT | M234: COLE | O234: ARNOTT
A236: ROUND 7 | E236: 27TH MAY | I236: WEATHER
D237: 1ST QTR | H237: 2ND QTR | L237: 3RD QTR | P237: FINAL
A238: CAMBERWELL | E238: =C238*6+D238 -> 0 | I238: =G238*6+H238 -> 0 | M238: =K238*6+L238 -> 0 | O238: 14 | P238: 10 | Q238: =O238*6+P238 -> 94 | S238: CAMBERWELL | X238: LADDER | AB238: ROUND | AD238: 7
A239: PRAHRAN | E239: =C239*6+D239 -> 0 | I239: =G239*6+H239 -> 0 | M239: =K239*6+L239 -> 0 | O239: 8 | P239: 9 | Q239: =O239*6+P239 -> 57
A240: BEST PLAYERS | W240: TEAM | X240: W | Y240: L | Z240: D | AA240: FOR | AB240: AGST | AC240: % | AD240: PTS
A241: CAMBERWELL | C241: C THOMPSON | F241: YOUNG | I241: O'NEILL | L241: SKALBERG | O241: MASON
A242: PRAHRAN | C242: CLOSE | F242: WISHART | I242: PAT WALSH | L242: McMAHON | O242: COLLINS | W242: NORTHCOTE | X242: 6 | Y242: 1 | Z242: 0 | AA242: 616 | AB242: 393 | AC242: =(AA242*100)/AB242 -> 156.74300254452928 | AD242: =(X242*4)+(Z242*2) -> 24
A243: GOALKICKERS | W243: DANDENONG | X243: 5 | Y243: 2 | Z243: 0 | AA243: 700 | AB243: 480 | AC243: =(AA243*100)/AB243 -> 145.83333333333334 | AD243: =(X243*4)+(Z243*2) -> 20
A244: CAMBERWELL | C244: O'NEILL 9 | F244: YOUNG 3 | I244: GIBSON | K244: ELLIS | W244: CAMBERWELL | X244: 5 | Y244: 2 | Z244: 0 | AA244: 616 | AB244: 565 | AC244: =(AA244*100)/AB244 -> 109.02654867256638 | AD244: =(X244*4)+(Z244*2) -> 20
A245: PRAHRAN | C245: CLOSE 2 | F245: WISHART 2 | I245: PEARSON | K245: MURRAY | M245: KIND | O245: McMAHON | W245: PRESTON | X245: 4 | Y245: 3 | Z245: 0 | AA245: 649 | AB245: 468 | AC245: =(AA245*100)/AB245 -> 138.67521367521368 | AD245: =(X245*4)+(Z245*2) -> 16
A247: WAVERLEY | E247: =C247*6+D247 -> 0 | I247: =G247*6+H247 -> 0 | M247: =K247*6+L247 -> 0 | O247: 12 | P247: 18 | Q247: =O247*6+P247 -> 90 | S247: WAVERLEY | W247: WAVERLEY | X247: 3 | Y247: 4 | Z247: 0 | AA247: 579 | AB247: 595 | AC247: =(AA247*100)/AB247 -> 97.310924369747895 | AD247: =(X247*4)+(Z247*2) -> 12
A248: DANDENONG | E248: =C248*6+D248 -> 0 | I248: =G248*6+H248 -> 0 | M248: =K248*6+L248 -> 0 | O248: 10 | P248: 15 | Q248: =O248*6+P248 -> 75 | W248: PRAHRAN | X248: 3 | Y248: 4 | Z248: 0 | AA248: 503 | AB248: 561 | AC248: =(AA248*100)/AB248 -> 89.661319073083774 | AD248: =(X248*4)+(Z248*2) -> 12
A249: BEST PLAYERS | W249: SUNSHINE | X249: 2 | Y249: 5 | Z249: 0 | AA249: 667 | AB249: 641 | AC249: =(AA249*100)/AB249 -> 104.05616224648986 | AD249: =(X249*4)+(Z249*2) -> 8
A250: WAVERLEY | C250: SMITH | F250: D SCOTT | I250: EVANS | L250: LEE | O250: ARNOTT | Q250: BLACK | W250: BRIGHTON | X250: 0 | Y250: 7 | Z250: 0 | AA250: 308 | AB250: 927 | AC250: =(AA250*100)/AB250 -> 33.225458468176917 | AD250: =(X250*4)+(Z250*2) -> 0
A251: DANDENONG | C251: LITTLE | F251: GOOD | I251: B WATERS | L251: PETERS | O251: MORRIS | Q251: GRAY
A252: GOALKICKERS
A253: WAVERLEY | C253: SMITH 3 | E253: RAY 3 | G253: LEE 2 | I253: D SCOTT | L253: JOHNSON | N253: CLANCY | Q253: FALCONER
A254: DANDENONG | C254: GILLINGHAM 4 | G254: GRAY 3 | I254: T WATERS | L254: MINOTTI | N254: PETERS
A256: SUNSHINE | E256: =C256*6+D256 -> 0 | I256: =G256*6+H256 -> 0 | M256: =K256*6+L256 -> 0 | O256: 25 | P256: 19 | Q256: =O256*6+P256 -> 169 | S256: SUNSHINE
A257: BRIGHTON | E257: =C257*6+D257 -> 0 | I257: =G257*6+H257 -> 0 | M257: =K257*6+L257 -> 0 | O257: 7 | P257: 13 | Q257: =O257*6+P257 -> 55
A258: BEST PLAYERS
A259: SUNSHINE | C259: CROSBIE | F259: TREZISE | I259: GALLE | L259: MULLARVEY | O259: BREWIS | R259: MAGILL
A260: BRIGHTON | C260: LAMBERT | F260: G KEENAN | I260: FIDGE | L260: HUGHES | O260: J KEENAN | R260: BEGLEY
A261: GOALKICKERS
A262: SUNSHINE | C262: CROSBIE 8 | F262: GALLE 5 | H262: BREWIS 4 | J262: CASEY 3 | L262: MAGILL 2 | N262: STAFFORD | Q262: MULLARVEY | T262: BARABASZ
A263: BRIGHTON | C263: LAMBERT 3 | F263: HUGHES 2 | I263: J KEENAN 2
E264: 28TH MAY | I264: WEATHER
A265: PRESTON | E265: =C265*6+D265 -> 0 | I265: =G265*6+H265 -> 0 | M265: =K265*6+L265 -> 0 | O265: 14 | P265: 19 | Q265: =O265*6+P265 -> 103 | S265: PRESTON
A266: NORTHCOTE | E266: =C266*6+D266 -> 0 | I266: =G266*6+H266 -> 0 | M266: =K266*6+L266 -> 0 | O266: 8 | P266: 12 | Q266: =O266*6+P266 -> 60
A267: BEST PLAYERS
A268: PRESTON | C268: ZORZI | F268: HANCOCK | I268: DIXON | L268: WATSON | O268: POWELL | Q268: LAMBIE
A269: NORTHCOTE | C269: GORMAN | F269: WRIGHT | I269: DOOLAN | L269: SHEARN | O269: BRETHERTON
A270: GOALKICKERS
A271: PRESTON | C271: WATSON 4 | F271: MURNANE 3 | I271: LAMBIE 2 | K271: McMAHON 2 | N271: DIXON | P271: ZORZI | R271: POWELL
A272: NORTHCOTE | C272: OLIVER 2 | F272: SHEARN 2 | I272: LANGBORNE 2 | L272: MARCHANT | O272: TAYLOR
A274: ROUND 8 | E274: 3RD JUNE | I274: WEATHER
D275: 1ST QTR | H275: 2ND QTR | L275: 3RD QTR | P275: FINAL
A276: PRESTON | E276: =C276*6+D276 -> 0 | I276: =G276*6+H276 -> 0 | M276: =K276*6+L276 -> 0 | O276: 30 | P276: 15 | Q276: =O276*6+P276 -> 195 | S276: ELSTENWICK PARK | X276: LADDER | AB276: ROUND | AD276: 8
A277: BRIGHTON | E277: =C277*6+D277 -> 0 | I277: =G277*6+H277 -> 0 | M277: =K277*6+L277 -> 0 | O277: 3 | P277: 4 | Q277: =O277*6+P277 -> 22
A278: BEST PLAYERS | W278: TEAM | X278: W | Y278: L | Z278: D | AA278: FOR | AB278: AGST | AC278: % | AD278: PTS
A279: PRESTON | C279: LAMBIE | F279: MURNANE | I279: MUIR | L279: McMAHON | O279: POWELL | Q279: O'DONNELL
A280: BRIGHTON | C280: LAMBERT | F280: BEDDOE | I280: MAY | L280: BRASCHER | O280: FOX | Q280: G KEENAN | W280: NORTHCOTE | X280: 7 | Y280: 1 | Z280: 0 | AA280: 721 | AB280: 464 | AC280: =(AA280*100)/AB280 -> 155.38793103448276 | AD280: =(X280*4)+(Z280*2) -> 28
A281: GOALKICKERS | K281: MILLAR | M281: SHERRY | O281: HANCOCK | W281: DANDENONG | X281: 6 | Y281: 2 | Z281: 0 | AA281: 822 | AB281: 561 | AC281: =(AA281*100)/AB281 -> 146.524064171123 | AD281: =(X281*4)+(Z281*2) -> 24
A282: PRESTON | C282: LAMBIE 8 | E282: McMAHON 5 | H282: MURNANE 4 | J282: MUIR 3 | L282: WATSON 2 | N282: POWELL 2 | Q282: DIXON 2 | S282: ZORZI | W282: PRESTON | X282: 5 | Y282: 3 | Z282: 0 | AA282: 844 | AB282: 490 | AC282: =(AA282*100)/AB282 -> 172.24489795918367 | AD282: =(X282*4)+(Z282*2) -> 20
A283: BRIGHTON | C283: LAMBERT 2 | F283: GRANT | W283: CAMBERWELL | X283: 5 | Y283: 3 | Z283: 0 | AA283: 687 | AB283: 670 | AC283: =(AA283*100)/AB283 -> 102.53731343283582 | AD283: =(X283*4)+(Z283*2) -> 20
A285: DANDENONG | E285: =C285*6+D285 -> 0 | I285: =G285*6+H285 -> 0 | M285: =K285*6+L285 -> 0 | O285: 17 | P285: 20 | Q285: =O285*6+P285 -> 122 | S285: DANDENONG | W285: PRAHRAN | X285: 4 | Y285: 4 | Z285: 0 | AA285: 580 | AB285: 615 | AC285: =(AA285*100)/AB285 -> 94.308943089430898 | AD285: =(X285*4)+(Z285*2) -> 16
A286: SUNSHINE | E286: =C286*6+D286 -> 0 | I286: =G286*6+H286 -> 0 | M286: =K286*6+L286 -> 0 | O286: 11 | P286: 15 | Q286: =O286*6+P286 -> 81 | W286: WAVERLEY | X286: 3 | Y286: 5 | Z286: 0 | AA286: 633 | AB286: 672 | AC286: =(AA286*100)/AB286 -> 94.196428571428569 | AD286: =(X286*4)+(Z286*2) -> 12
A287: BEST PLAYERS | W287: SUNSHINE | X287: 2 | Y287: 6 | Z287: 0 | AA287: 748 | AB287: 763 | AC287: =(AA287*100)/AB287 -> 98.034076015727393 | AD287: =(X287*4)+(Z287*2) -> 8
A288: DANDENONG | C288: OSBORNE | F288: B WATERS | I288: DINEEN | L288: MORRIS | O288: COOTE | Q288: T WATERS | W288: BRIGHTON | X288: 0 | Y288: 8 | Z288: 0 | AA288: 330 | AB288: 1122 | AC288: =(AA288*100)/AB288 -> 29.411764705882351 | AD288: =(X288*4)+(Z288*2) -> 0
A289: SUNSHINE | C289: PRESTON | F289: CROSBIE | I289: P FITZGERALD | L289: TREZISE | O289: BREWIS | Q289: GALLE
A290: GOALKICKERS
A291: DANDENONG | C291: OSBORNE 4 | F291: DINEEN 4 | I291: B WATERS 4 | L291: MORRIS 2 | N291: RANKIN 2 | Q291: GRAY
A292: SUNSHINE | C292: MAGILL 2 | F292: CROSBIE 2 | I292: CASEY | K292: TREZISE | M292: BREWIS | O292: GALLE | Q292: TIPPING
A294: PRAHRAN | E294: =C294*6+D294 -> 0 | I294: =G294*6+H294 -> 0 | M294: =K294*6+L294 -> 0 | O294: 11 | P294: 11 | Q294: =O294*6+P294 -> 77 | S294: TOORAK PARK
A295: WAVERLEY | E295: =C295*6+D295 -> 0 | I295: =G295*6+H295 -> 0 | M295: =K295*6+L295 -> 0 | O295: 6 | P295: 18 | Q295: =O295*6+P295 -> 54
A296: BEST PLAYERS
A297: PRAHRAN | C297: WILSON | F297: PEARSON | I297: WISHART | L297: BUTLER | O297: HARVEY | Q297: RICHARDS
A298: WAVERLEY | C298: CLANCY | F298: BLACK | I298: DENMAN | L298: LEE | O298: D SCOTT | Q298: COLE
A299: GOALKICKERS
A300: PRAHRAN | C300: WILSON 3 | F300: RICHARDS 2 | I300: HARVEY 2 | L300: BUTLER 2 | N300: WISHART | Q300: BOSCH
A301: WAVERLEY | C301: D SCOTT 2 | F301: FALCONER 2 | I301: CLANCY | K301: RAY
E302: 4TH JUNE | I302: WEATHER
A303: NORTHCOTE | E303: =C303*6+D303 -> 0 | I303: =G303*6+H303 -> 0 | M303: =K303*6+L303 -> 0 | O303: 15 | P303: 15 | Q303: =O303*6+P303 -> 105 | S303: NORTHCOTE
A304: CAMBERWELL | E304: =C304*6+D304 -> 0 | I304: =G304*6+H304 -> 0 | M304: =K304*6+L304 -> 0 | O304: 10 | P304: 11 | Q304: =O304*6+P304 -> 71
A305: BEST PLAYERS
A306: NORTHCOTE
A307: CAMBERWELL | C307: JOHNSON | F307: YOUNG | I307: ELLIS | L307: COLLETT | O307: GIBSON
A308: GOALKICKERS
A309: NORTHCOTE | C309: SHEARN 4 | F309: LANGBORNE 3 | I309: OLIVER 2 | K309: TAYLOR 2 | M309: MORAN | O309: OUSLEY | Q309: STONEHAM | T309: GASCOTT
A310: CAMBERWELL | C310: O'NEILL 4 | F310: YOUNG 3 | I310: COLLETT 3
A312: ROUND 9 | E312: 10TH JUNE | I312: WEATHER
D313: 1ST QTR | H313: 2ND QTR | L313: 3RD QTR | P313: FINAL
A314: PRESTON | E314: =C314*6+D314 -> 0 | I314: =G314*6+H314 -> 0 | M314: =K314*6+L314 -> 0 | O314: 14 | P314: 13 | Q314: =O314*6+P314 -> 97 | S314: PRESTON | X314: LADDER | AB314: ROUND | AD314: 9
A315: DANDENONG | E315: =C315*6+D315 -> 0 | I315: =G315*6+H315 -> 0 | M315: =K315*6+L315 -> 0 | O315: 8 | P315: 11 | Q315: =O315*6+P315 -> 59
A316: BEST PLAYERS | W316: TEAM | X316: W | Y316: L | Z316: D | AA316: FOR | AB316: AGST | AC316: % | AD316: PTS
A317: PRESTON | C317: DWYER | F317: SAYERS | I317: ZORZI | L317: HANCOCK | O317: SLATTERY
A318: DANDENONG | C318: B WATERS | F318: THOMAS | I318: LITTLE | L318: T WATERS | O318: MORRIS | W318: NORTHCOTE | X318: 8 | Y318: 1 | Z318: 0 | AA318: 832 | AB318: 520 | AC318: =(AA318*100)/AB318 -> 160 | AD318: =(X318*4)+(Z318*2) -> 32
A319: GOALKICKERS | W319: PRESTON | X319: 6 | Y319: 3 | Z319: 0 | AA319: 941 | AB319: 549 | AC319: =(AA319*100)/AB319 -> 171.40255009107469 | AD319: =(X319*4)+(Z319*2) -> 24
A320: PRESTON | C320: POWELL 4 | E320: DIXON 2 | G320: HANCOCK 2 | J320: McDONALD 2 | M320: MUIR | O320: LAMBIE | Q320: McMAHON | S320: SLATTERY | W320: DANDENONG | X320: 6 | Y320: 3 | Z320: 0 | AA320: 881 | AB320: 658 | AC320: =(AA320*100)/AB320 -> 133.89057750759878 | AD320: =(X320*4)+(Z320*2) -> 24
A321: DANDENONG | C321: GILLINGHAM 2 | F321: RANKIN 2 | I321: DINEEN | K321: WILSON | M321: LITTLE | O321: PETERS | W321: CAMBERWELL | X321: 6 | Y321: 3 | Z321: 0 | AA321: 805 | AB321: 773 | AC321: =(AA321*100)/AB321 -> 104.13971539456662 | AD321: =(X321*4)+(Z321*2) -> 24
A323: CAMBERWELL | E323: =C323*6+D323 -> 0 | I323: =G323*6+H323 -> 0 | M323: =K323*6+L323 -> 0 | O323: 17 | P323: 16 | Q323: =O323*6+P323 -> 118 | S323: CAMBERWELL | W323: PRAHRAN | X323: 5 | Y323: 4 | Z323: 0 | AA323: 655 | AB323: 672 | AC323: =(AA323*100)/AB323 -> 97.470238095238102 | AD323: =(X323*4)+(Z323*2) -> 20
A324: BRIGHTON | E324: =C324*6+D324 -> 0 | I324: =G324*6+H324 -> 0 | M324: =K324*6+L324 -> 0 | O324: 16 | P324: 7 | Q324: =O324*6+P324 -> 103 | W324: WAVERLEY | X324: 3 | Y324: 6 | Z324: 0 | AA324: 689 | AB324: 783 | AC324: =(AA324*100)/AB324 -> 87.994891443167305 | AD324: =(X324*4)+(Z324*2) -> 12
A325: BEST PLAYERS | W325: SUNSHINE | X325: 2 | Y325: 7 | Z325: 0 | AA325: 805 | AB325: 838 | AC325: =(AA325*100)/AB325 -> 96.062052505966591 | AD325: =(X325*4)+(Z325*2) -> 8
A326: CAMBERWELL | C326: O'NEILL | F326: ELLIS | I326: LONDON | L326: GAUDION | O326: ATKINSON | R326: JONES | W326: BRIGHTON | X326: 0 | Y326: 9 | Z326: 0 | AA326: 433 | AB326: 1240 | AC326: =(AA326*100)/AB326 -> 34.91935483870968 | AD326: =(X326*4)+(Z326*2) -> 0
A327: BRIGHTON | C327: BEDDOE | F327: LAMBERT | I327: STIRLING | L327: BEGLEY | O327: McDONALD | R327: J KEENAN
A328: GOALKICKERS
A329: CAMBERWELL | C329: ELLIS 4 | E329: GAUDION 3 | H329: GIBSON 3 | J329: JONES 3 | L329: QUIRK | N329: O'NEILL | P329: YOUNG | R329: LANDON
A330: BRIGHTON | C330: LAMBERT 5 | F330: BEDDOE 5 | I330: BEGLEY 3 | K330: HENDERSON 2 | N330: GRANT
E331: 12TH JUNE | I331: WEATHER
A332: NORTHCOTE | E332: =C332*6+D332 -> 0 | I332: =G332*6+H332 -> 0 | M332: =K332*6+L332 -> 0 | O332: 15 | P332: 21 | Q332: =O332*6+P332 -> 111 | S332: WAVERLEY
A333: WAVERLEY | E333: =C333*6+D333 -> 0 | I333: =G333*6+H333 -> 0 | M333: =K333*6+L333 -> 0 | O333: 8 | P333: 8 | Q333: =O333*6+P333 -> 56
A334: BEST PLAYERS
A335: NORTHCOTE | C335: GORMAN | F335: LAVER | I335: LANGBORNE | L335: STONEHAM | O335: McMAHON | Q335: OLIVER
A336: WAVERLEY
A337: GOALKICKERS
A338: NORTHCOTE | C338: STONEHAM 7 | F338: OLIVER 3 | I338: SHEARN 2 | L338: GORMAN | N338: TAYLOR | Q338: OUSLEY
A339: WAVERLEY | C339: FALCONER 3 | F339: SMITH 2 | I339: D SCOTT | L339: COLE | N339: LEE
A341: PRAHRAN | E341: =C341*6+D341 -> 0 | I341: =G341*6+H341 -> 0 | M341: =K341*6+L341 -> 0 | O341: 11 | P341: 9 | Q341: =O341*6+P341 -> 75 | S341: TOORAK PARK
A342: SUNSHINE | E342: =C342*6+D342 -> 0 | I342: =G342*6+H342 -> 0 | M342: =K342*6+L342 -> 0 | O342: 8 | P342: 9 | Q342: =O342*6+P342 -> 57
A343: BEST PLAYERS
A344: PRAHRAN | C344: LEWIS | F344: HARVEY | I344: WILSON | L344: BOSCH
A345: SUNSHINE | C345: FITZGERALD | F345: TREZISE | I345: N KEMP | L345: PRESTON | O345: BLACKMAN
A346: GOALKICKERS
A347: PRAHRAN | C347: BUTLER 3 | E347: WILSON 2 | G347: McMAHON 2 | J347: HARVEY | L347: KIND | N347: BOSCH | P347: RICHARDS
A348: SUNSHINE | C348: CASEY 3 | E348: MAGILL | G348: STAFFORD | J348: ROACH | L348: STEVENS | N348: GALLE
A350: ROUND 10 | E350: 17TH JUNE | I350: WEATHER
D351: 1ST QTR | H351: 2ND QTR | L351: 3RD QTR | P351: FINAL
A352: NORTHCOTE | E352: =C352*6+D352 -> 0 | I352: =G352*6+H352 -> 0 | M352: =K352*6+L352 -> 0 | O352: 14 | P352: 22 | Q352: =O352*6+P352 -> 106 | S352: ELSTENWICK PARK | X352: LADDER | AB352: ROUND | AD352: 10
A353: BRIGHTON | E353: =C353*6+D353 -> 0 | I353: =G353*6+H353 -> 0 | M353: =K353*6+L353 -> 0 | O353: 6 | P353: 7 | Q353: =O353*6+P353 -> 43
A354: BEST PLAYERS | W354: TEAM | X354: W | Y354: L | Z354: D | AA354: FOR | AB354: AGST | AC354: % | AD354: PTS
A355: NORTHCOTE | C355: LANGBORNE | F355: BLAKE | I355: STONEHAM | L355: SHEARN
A356: BRIGHTON | C356: MAY | F356: WATSON | I356: FOX | L356: BEGLEY | W356: NORTHCOTE | X356: 9 | Y356: 1 | Z356: 0 | AA356: 938 | AB356: 563 | AC356: =(AA356*100)/AB356 -> 166.60746003552399 | AD356: =(X356*4)+(Z356*2) -> 36
A357: GOALKICKERS | W357: CAMBERWELL | X357: 7 | Y357: 3 | Z357: 0 | AA357: 903 | AB357: 861 | AC357: =(AA357*100)/AB357 -> 104.8780487804878 | AD357: =(X357*4)+(Z357*2) -> 28
A358: NORTHCOTE | C358: STONEHAM 6 | F358: SHEARN 3 | I358: LANGBORNE 2 | L358: WRIGHT | N358: ROOTSEY | Q358: BREHENEY | W358: PRESTON | X358: 6 | Y358: 4 | Z358: 0 | AA358: 1029 | AB358: 647 | AC358: =(AA358*100)/AB358 -> 159.04173106646058 | AD358: =(X358*4)+(Z358*2) -> 24
A359: BRIGHTON | C359: BEDDOE 2 | E359: LAMBERT | H359: BEGLEY | J359: McDONALD | M359: HENDERSON | W359: DANDENONG | X359: 6 | Y359: 4 | Z359: 0 | AA359: 978 | AB359: 755 | AC359: =(AA359*100)/AB359 -> 129.53642384105962 | AD359: =(X359*4)+(Z359*2) -> 24
A361: PRAHRAN | E361: =C361*6+D361 -> 0 | I361: =G361*6+H361 -> 0 | M361: =K361*6+L361 -> 0 | O361: 16 | P361: 11 | Q361: =O361*6+P361 -> 107 | S361: DANDENONG | W361: PRAHRAN | X361: 6 | Y361: 4 | Z361: 0 | AA361: 762 | AB361: 769 | AC361: =(AA361*100)/AB361 -> 99.089726918075428 | AD361: =(X361*4)+(Z361*2) -> 24
A362: DANDENONG | E362: =C362*6+D362 -> 0 | I362: =G362*6+H362 -> 0 | M362: =K362*6+L362 -> 0 | O362: 13 | P362: 19 | Q362: =O362*6+P362 -> 97 | W362: SUNSHINE | X362: 3 | Y362: 7 | Z362: 0 | AA362: 904 | AB362: 905 | AC362: =(AA362*100)/AB362 -> 99.889502762430936 | AD362: =(X362*4)+(Z362*2) -> 12
A363: BEST PLAYERS | W363: WAVERLEY | X363: 3 | Y363: 7 | Z363: 0 | AA363: 756 | AB363: 882 | AC363: =(AA363*100)/AB363 -> 85.714285714285708 | AD363: =(X363*4)+(Z363*2) -> 12
A364: PRAHRAN | C364: BOSCH | F364: BUTLER | I364: McMAHON | L364: HAYES | O364: LAMBERT | Q364: O'BRIEN | W364: BRIGHTON | X364: 0 | Y364: 10 | Z364: 0 | AA364: 476 | AB364: 1346 | AC364: =(AA364*100)/AB364 -> 35.364041604754831 | AD364: =(X364*4)+(Z364*2) -> 0
A365: DANDENONG | C365: LITTLE | F365: MORRIS | I365: GOOD | L365: STAUNTON | O365: B WATERS | Q365: JOHNSON
A366: GOALKICKERS
A367: PRAHRAN | C367: BOSCH 4 | E367: O'BRIEN 3 | G367: WISHART 3 | J367: WILSON 3 | M367: GRAY | O367: PAT WALSH | R367: RICHARDS
A368: DANDENONG | C368: LITTLE 4 | E368: PAPWORTH 2 | H368: MORRIS 2 | J368: PENNEFATHER | M368: WILSON | O368: PETERS | Q368: B WATERS | T368: JOHNSON
A370: SUNSHINE | E370: =C370*6+D370 -> 0 | I370: =G370*6+H370 -> 0 | M370: =K370*6+L370 -> 0 | O370: 15 | P370: 9 | Q370: =O370*6+P370 -> 99 | S370: SUNSHINE
A371: WAVERLEY | E371: =C371*6+D371 -> 0 | I371: =G371*6+H371 -> 0 | M371: =K371*6+L371 -> 0 | O371: 10 | P371: 7 | Q371: =O371*6+P371 -> 67
A372: BEST PLAYERS
A373: SUNSHINE | C373: MAGILL | F373: TIPPING | I373: ROACH | L373: N KEMP
A374: WAVERLEY | C374: EVANS | F374: SMITH | I374: PECK | L374: COLE
A375: GOALKICKERS
A376: SUNSHINE | C376: N KEMP 3 | E376: TIPPING 3 | G376: CROSBIE 2 | I376: GALLE 2 | K376: MAGILL 2 | M376: TREZISE 2 | O376: CASEY
A377: WAVERLEY | C377: D SCOTT 3 | F377: LEE 2 | H377: FALCONER 2 | K377: CLANCY | M377: MAGUINNESS | P377: SMITH
E378: 18TH JUNE | J378: WEATHER
A379: CAMBERWELL | E379: =C379*6+D379 -> 0 | I379: =G379*6+H379 -> 0 | M379: =K379*6+L379 -> 0 | O379: 15 | P379: 8 | Q379: =O379*6+P379 -> 98 | S379: PRESTON
A380: PRESTON | E380: =C380*6+D380 -> 0 | I380: =G380*6+H380 -> 0 | M380: =K380*6+L380 -> 0 | O380: 12 | P380: 16 | Q380: =O380*6+P380 -> 88
A381: BEST PLAYERS
A382: CAMBERWELL | C382: GAUDION | F382: GIBSON | I382: YOUNG | L382: O'NEILL | O382: SKALBERG | R382: JOHNSON
A383: PRESTON | C383: SLATTERY | F383: McDONALD | I383: POWELL | L383: MUIR | O383: HANCOCK | R383: SAYERS
A384: GOALKICKERS
A385: CAMBERWELL | C385: O'NEILL 6 | F385: JONES 3 | I385: QUIRK 3 | K385: GIBSON 2 | M385: GAUDION
A386: PRESTON | C386: McDONALD 5 | F386: POWELL 3 | I386: ZORZI | K386: DIXON | M386: LAMBIE | O386: MUIR
A388: ROUND 11 | E388: 24TH JUNE | I388: WEATHER
D389: 1ST QTR | H389: 2ND QTR | L389: 3RD QTR | P389: FINAL
A390: NORTHCOTE | E390: =C390*6+D390 -> 0 | I390: =G390*6+H390 -> 0 | M390: =K390*6+L390 -> 0 | O390: 19 | P390: 11 | Q390: =O390*6+P390 -> 125 | S390: NORTHCOTE | X390: LADDER | AB390: ROUND | AD390: 11
A391: SUNSHINE | E391: =C391*6+D391 -> 0 | I391: =G391*6+H391 -> 0 | M391: =K391*6+L391 -> 0 | O391: 8 | P391: 7 | Q391: =O391*6+P391 -> 55
A392: BEST PLAYERS | W392: TEAM | X392: W | Y392: L | Z392: D | AA392: FOR | AB392: AGST | AC392: % | AD392: PTS
A393: NORTHCOTE | C393: STONEHAM | F393: LANGBORNE | I393: OLIVER | L393: WRIGHT | O393: BREHENEY | R393: SHEARN
A394: SUNSHINE | C394: N KEMP | F394: MAGILL | I394: MULLARVEY | L394: GIBBONS | O394: GALLE | R394: ROACH | W394: NORTHCOTE | X394: 10 | Y394: 1 | Z394: 0 | AA394: 1063 | AB394: 618 | AC394: =(AA394*100)/AB394 -> 172.00647249190939 | AD394: =(X394*4)+(Z394*2) -> 40
A395: GOALKICKERS | W395: DANDENONG | X395: 7 | Y395: 4 | Z395: 0 | AA395: 1058 | AB395: 814 | AC395: =(AA395*100)/AB395 -> 129.97542997542999 | AD395: =(X395*4)+(Z395*2) -> 28
A396: NORTHCOTE | C396: STONEHAM 6 | F396: MILLS 3 | H396: SHEARN 3 | J396: OLIVER 2 | L396: KEAYS 2 | N396: LANGBORNE | Q396: OUSLEY | S396: BREHENEY | W396: CAMBERWELL | X396: 7 | Y396: 4 | Z396: 0 | AA396: 962 | AB396: 941 | AC396: =(AA396*100)/AB396 -> 102.2316684378321 | AD396: =(X396*4)+(Z396*2) -> 28
A397: SUNSHINE | C397: N KEMP 4 | F397: MAGILL 2 | I397: SYMONS | L397: MULLARVEY | W397: PRAHRAN | X397: 7 | Y397: 4 | Z397: 0 | AA397: 825 | AB397: 820 | AC397: =(AA397*100)/AB397 -> 100.60975609756098 | AD397: =(X397*4)+(Z397*2) -> 28
A399: DANDENONG | E399: =C399*6+D399 -> 0 | I399: =G399*6+H399 -> 0 | M399: =K399*6+L399 -> 0 | O399: 11 | P399: 14 | Q399: =O399*6+P399 -> 80 | S399: CAMBERWELL | W399: PRESTON | X399: 6 | Y399: 5 | Z399: 0 | AA399: 1080 | AB399: 710 | AC399: =(AA399*100)/AB399 -> 152.11267605633802 | AD399: =(X399*4)+(Z399*2) -> 24
A400: CAMBERWELL | E400: =C400*6+D400 -> 0 | I400: =G400*6+H400 -> 0 | M400: =K400*6+L400 -> 0 | O400: 9 | P400: 5 | Q400: =O400*6+P400 -> 59 | W400: WAVERLEY | X400: 4 | Y400: 7 | Z400: 0 | AA400: 923 | AB400: 948 | AC400: =(AA400*100)/AB400 -> 97.362869198312239 | AD400: =(X400*4)+(Z400*2) -> 16
A401: BEST PLAYERS | W401: SUNSHINE | X401: 3 | Y401: 8 | Z401: 0 | AA401: 959 | AB401: 1028 | AC401: =(AA401*100)/AB401 -> 93.287937743190668 | AD401: =(X401*4)+(Z401*2) -> 12
A402: DANDENONG | C402: B WATERS | F402: ROSETTI | I402: GILLINGHAM | L402: PETERS | N402: KILPATRICK | Q402: MINOTTI | W402: BRIGHTON | X402: 0 | Y402: 11 | Z402: 0 | AA402: 542 | AB402: 1513 | AC402: =(AA402*100)/AB402 -> 35.822868473231992 | AD402: =(X402*4)+(Z402*2) -> 0
A403: CAMBERWELL | C403: SKALBERG | F403: GIBSON | I403: YOUNG | L403: QUIRK | N403: BAILEY | Q403: K JOHNSON
A404: GOALKICKERS
A405: DANDENONG | C405: MINOTTI 3 | F405: T WATERS 3 | I405: PENNEFATHER 2 | L405: STAUNTON 2 | O405: ARMSTRONG
A406: CAMBERWELL | C406: GIBSON 2 | E406: JONES 2 | G406: MASON | I406: QUIRK | K406: O'NEILL | M406: DOUGLAS | O406: LONDON
A408: WAVERLEY | E408: =C408*6+D408 -> 0 | I408: =G408*6+H408 -> 0 | M408: =K408*6+L408 -> 0 | O408: 25 | P408: 17 | Q408: =O408*6+P408 -> 167 | S408: WAVERLEY
A409: BRIGHTON | E409: =C409*6+D409 -> 0 | I409: =G409*6+H409 -> 0 | M409: =K409*6+L409 -> 0 | O409: 9 | P409: 12 | Q409: =O409*6+P409 -> 66
A410: BEST PLAYERS
A411: WAVERLEY | C411: D SCOTT | F411: CLANCY | I411: SOUTAR | L411: LARKINS | N411: COLE | Q411: SMITH
A412: BRIGHTON | C412: LAMBERT | F412: CURRIE | I412: BANT | L412: MAY | N412: WATSON | Q412: BEDDOE
A413: GOALKICKERS
A414: WAVERLEY | C414: D SCOTT 7 | E414: SOUTAR 4 | G414: FALCONER 4 | J414: RAY 3 | L414: CLANCY 2 | N414: HARKINS 2 | Q414: SMITH 2 | S414: LEE
A415: BRIGHTON | C415: LAMBERT 5 | F415: BEDDOE | I415: BEGLEY | K415: CURRIE | M415: WATSON
E416: 25TH JUNE | J416: WEATHER
A417: PRAHRAN | E417: =C417*6+D417 -> 0 | I417: =G417*6+H417 -> 0 | M417: =K417*6+L417 -> 0 | O417: 8 | P417: 15 | Q417: =O417*6+P417 -> 63 | S417: TOORAK PARK
A418: PRESTON | E418: =C418*6+D418 -> 0 | I418: =G418*6+H418 -> 0 | M418: =K418*6+L418 -> 0 | O418: 7 | P418: 9 | Q418: =O418*6+P418 -> 51
A419: BEST PLAYERS
A420: PRAHRAN | C420: LAMBERT | F420: HILL | I420: WISHART | L420: B WILSON | N420: GRACE | Q420: PEARSON
A421: PRESTON | C421: SAYERS | F421: HANCOCK | I421: HOWARD | L421: POWELL | N421: McLAUGHLIN
A422: GOALKICKERS
A423: PRAHRAN | C423: PEARSON 3 | F423: B WILSON 2 | I423: WISHART | L423: RAY | N423: McMAHON
A424: PRESTON | C424: HANCOCK 2 | F424: MCDONALD 2 | I424: WOOD | K424: HOWARD | N424: MURNANE
A426: ROUND 12 | E426: 1ST JULY | I426: WEATHER
D427: 1ST QTR | H427: 2ND QTR | L427: 3RD QTR | P427: FINAL
A428: DANDENONG | E428: =C428*6+D428 -> 0 | I428: =G428*6+H428 -> 0 | M428: =K428*6+L428 -> 0 | O428: 26 | P428: 20 | Q428: =O428*6+P428 -> 176 | S428: ELSTENWICK PARK | X428: LADDER | AB428: ROUND | AD428: 12
A429: BRIGHTON | E429: =C429*6+D429 -> 0 | I429: =G429*6+H429 -> 0 | M429: =K429*6+L429 -> 0 | O429: 5 | P429: 5 | Q429: =O429*6+P429 -> 35
A430: BEST PLAYERS | W430: TEAM | X430: W | Y430: L | Z430: D | AA430: FOR | AB430: AGST | AC430: % | AD430: PTS
A431: DANDENONG | C431: B WATERS | F431: LITTLE | H431: OSBORNE | K431: T WATERS | N431: GRAY | Q431: DINEEN
A432: BRIGHTON | C432: LAMBERT | F432: WILLIAMS | I432: ALLEN | K432: HENDERSON | N432: MAY | Q432: BEGLEY | W432: NORTHCOTE | X432: 11 | Y432: 1 | Z432: 0 | AA432: 1155 | AB432: 659 | AC432: =(AA432*100)/AB432 -> 175.26555386949923 | AD432: =(X432*4)+(Z432*2) -> 44
A433: GOALKICKERS | W433: DANDENONG | X433: 8 | Y433: 4 | Z433: 0 | AA433: 1234 | AB433: 849 | AC433: =(AA433*100)/AB433 -> 145.34746760895172 | AD433: =(X433*4)+(Z433*2) -> 32
A434: DANDENONG | C434: T WATERS 8 | F434: GRAY 6 | H434: LITTLE 4 | J434: OSBORNE 3 | M434: DELANTY 2 | P434: DINEEN 2 | R434: B WATERS | W434: PRESTON | X434: 7 | Y434: 5 | Z434: 0 | AA434: 1165 | AB434: 792 | AC434: =(AA434*100)/AB434 -> 147.09595959595958 | AD434: =(X434*4)+(Z434*2) -> 28
A435: BRIGHTON | C435: LAMBERT 2 | F435: WILLIAMS 2 | I435: SMITH | W435: CAMBERWELL | X435: 7 | Y435: 5 | Z435: 0 | AA435: 1069 | AB435: 1055 | AC435: =(AA435*100)/AB435 -> 101.32701421800948 | AD435: =(X435*4)+(Z435*2) -> 28
A437: WAVERLEY | E437: =C437*6+D437 -> 0 | I437: =G437*6+H437 -> 0 | M437: =K437*6+L437 -> 0 | O437: 17 | P437: 12 | Q437: =O437*6+P437 -> 114 | S437: WAVERLEY | W437: PRAHRAN | X437: 7 | Y437: 5 | Z437: 0 | AA437: 866 | AB437: 912 | AC437: =(AA437*100)/AB437 -> 94.956140350877192 | AD437: =(X437*4)+(Z437*2) -> 28
A438: CAMBERWELL | E438: =C438*6+D438 -> 0 | I438: =G438*6+H438 -> 0 | M438: =K438*6+L438 -> 0 | O438: 15 | P438: 17 | Q438: =O438*6+P438 -> 107 | W438: WAVERLEY | X438: 5 | Y438: 7 | Z438: 0 | AA438: 1037 | AB438: 1042 | AC438: =(AA438*100)/AB438 -> 99.520153550863725 | AD438: =(X438*4)+(Z438*2) -> 20
A439: BEST PLAYERS | W439: SUNSHINE | X439: 3 | Y439: 9 | Z439: 0 | AA439: 1041 | AB439: 1113 | AC439: =(AA439*100)/AB439 -> 93.530997304582215 | AD439: =(X439*4)+(Z439*2) -> 12
A440: WAVERLEY | C440: D SCOTT | F440: FALCONER | I440: NOLAN | L440: SMITH | N440: CLANCY | Q440: SOUTAR | W440: BRIGHTON | X440: 0 | Y440: 12 | Z440: 0 | AA440: 577 | AB440: 1689 | AC440: =(AA440*100)/AB440 -> 34.162226169330964 | AD440: =(X440*4)+(Z440*2) -> 0
A441: CAMBERWELL | C441: WHITTEN | F441: JONES | I441: BAILEY | L441: ELLIS | N441: CHAMBERS
A442: GOALKICKERS
A443: WAVERLEY | C443: D SCOTT 4 | F443: RAY 3 | H443: DRISCOLL 2 | J443: SMITH 2 | L443: FALCONER 2 | N443: COLE | P443: LEE | Q443: CLANCY | S443: P SCOTT
A444: CAMBERWELL | C444: LONDON 5 | F444: JONES 3 | H444: GAUDION 2 | K444: HOBILL 2 | M444: BAILEY | O444: ELLIS | Q444: CHAMBERS
A446: PRESTON | E446: =C446*6+D446 -> 0 | I446: =G446*6+H446 -> 0 | M446: =K446*6+L446 -> 0 | O446: 11 | P446: 19 | Q446: =O446*6+P446 -> 85 | S446: SUNSHINE
A447: SUNSHINE | E447: =C447*6+D447 -> 0 | I447: =G447*6+H447 -> 0 | M447: =K447*6+L447 -> 0 | O447: 12 | P447: 10 | Q447: =O447*6+P447 -> 82
A448: BEST PLAYERS
A449: PRESTON | C449: MUIR | F449: HANCOCK | I449: MURNANE | L449: POWELL | N449: MURPHY | Q449: SAYERS
A450: SUNSHINE | C450: CROSBIE | F450: TREZISE | I450: MAGILL | L450: LEAVER | N450: GALLE | Q450: PRESTON
A451: GOALKICKERS
A452: PRESTON | C452: HOWARD 3 | F452: HANCOCK 3 | I452: MURNANE 2 | L452: POWELL 2 | N452: WOOD
A453: SUNSHINE | C453: CROSBIE 2 | F453: BURNSIDE 2 | I453: TREZISE | K453: MAGILL | M453: CASEY | O453: LEAVER | Q453: TIPPING | S453: N KEMP | V453: SYMONS | X453: BLACKMAN
E454: 2ND JULY | I454: WEATHER
A455: NORTHCOTE | E455: =C455*6+D455 -> 0 | I455: =G455*6+H455 -> 0 | M455: =K455*6+L455 -> 0 | O455: 13 | P455: 14 | Q455: =O455*6+P455 -> 92 | S455: NORTHCOTE
A456: PRAHRAN | E456: =C456*6+D456 -> 0 | I456: =G456*6+H456 -> 0 | M456: =K456*6+L456 -> 0 | O456: 5 | P456: 11 | Q456: =O456*6+P456 -> 41
A457: BEST PLAYERS
A458: NORTHCOTE | C458: GORMAN | F458: WRIGHT | I458: STONEHAM | L458: SHEARN | N458: LANGBORNE
A459: PRAHRAN | C459: LAMBERT | F459: CLOSE | I459: HILL | L459: McMAHON | N459: PEARSON
A460: GOALKICKERS
A461: NORTHCOTE | C461: STONEHAM 5 | F461: BREHENEY 3 | I461: SHEARN 3 | L461: LANGBORNE | O461: WISHART
A462: PRAHRAN | C462: McMAHON | F462: GRAY | H462: BUTLER | J462: WISHART | M462: RICHARDS
A464: ROUND 13 | E464: 8TH JULY | I464: WEATHER
D465: 1ST QTR | H465: 2ND QTR | L465: 3RD QTR | P465: FINAL
A466: PRESTON | E466: =C466*6+D466 -> 0 | I466: =G466*6+H466 -> 0 | M466: =K466*6+L466 -> 0 | O466: 8 | P466: 12 | Q466: =O466*6+P466 -> 60 | S466: PRESTON | X466: LADDER | AB466: ROUND | AD466: 13
A467: WAVERLEY | E467: =C467*6+D467 -> 0 | I467: =G467*6+H467 -> 0 | M467: =K467*6+L467 -> 0 | O467: 9 | P467: 4 | Q467: =O467*6+P467 -> 58
A468: BEST PLAYERS | W468: TEAM | X468: W | Y468: L | Z468: D | AA468: FOR | AB468: AGST | AC468: % | AD468: PTS
A469: PRESTON | C469: MURNANE | F469: MUIR | I469: HANCOCK | L469: LAMBIE | N469: McLAUGHLIN | Q469: McDONNELL
A470: WAVERLEY | C470: SMITH | F470: D SCOTT | I470: RAY | L470: CLANCY | N470: JOHNSTON | Q470: COLE | W470: NORTHCOTE | X470: 11 | Y470: 2 | Z470: 0 | AA470: 1185 | AB470: 724 | AC470: =(AA470*100)/AB470 -> 163.67403314917127 | AD470: =(X470*4)+(Z470*2) -> 44
A471: GOALKICKERS | W471: DANDENONG | X471: 9 | Y471: 4 | Z471: 0 | AA471: 1264 | AB471: 914 | AC471: =(AA471*100)/AB471 -> 138.29321663019692 | AD471: =(X471*4)+(Z471*2) -> 36
A472: PRESTON | C472: WOOD 3 | F472: MURNANE 2 | I472: LAMBIE 2 | L472: HOWARD | W472: PRESTON | X472: 8 | Y472: 5 | Z472: 0 | AA472: 1225 | AB472: 850 | AC472: =(AA472*100)/AB472 -> 144.11764705882354 | AD472: =(X472*4)+(Z472*2) -> 32
A473: WAVERLEY | C473: RAY 2 | F473: CLANCY 2 | I473: D SCOTT 2 | L473: SMITH 2 | N473: DRISCOLL | W473: CAMBERWELL | X473: 8 | Y473: 5 | Z473: 0 | AA473: 1118 | AB473: 1099 | AC473: =(AA473*100)/AB473 -> 101.72884440400364 | AD473: =(X473*4)+(Z473*2) -> 32
A475: CAMBERWELL | E475: =C475*6+D475 -> 0 | I475: =G475*6+H475 -> 0 | M475: =K475*6+L475 -> 0 | O475: 7 | P475: 7 | Q475: =O475*6+P475 -> 49 | S475: CAMBERWELL | W475: PRAHRAN | X475: 8 | Y475: 5 | Z475: 0 | AA475: 953 | AB475: 947 | AC475: =(AA475*100)/AB475 -> 100.63357972544878 | AD475: =(X475*4)+(Z475*2) -> 32
A476: SUNSHINE | E476: =C476*6+D476 -> 0 | I476: =G476*6+H476 -> 0 | M476: =K476*6+L476 -> 0 | O476: 6 | P476: 8 | Q476: =O476*6+P476 -> 44 | W476: WAVERLEY | X476: 5 | Y476: 8 | Z476: 0 | AA476: 1095 | AB476: 1102 | AC476: =(AA476*100)/AB476 -> 99.364791288566238 | AD476: =(X476*4)+(Z476*2) -> 20
A477: BEST PLAYERS | W477: SUNSHINE | X477: 3 | Y477: 10 | Z477: 0 | AA477: 1085 | AB477: 1162 | AC477: =(AA477*100)/AB477 -> 93.373493975903614 | AD477: =(X477*4)+(Z477*2) -> 12
A478: CAMBERWELL | C478: LONDON | F478: THOMPSON | I478: WHITTEN | L478: HOBILL | N478: BAILEY | Q478: SKALBERG | W478: BRIGHTON | X478: 0 | Y478: 13 | Z478: 0 | AA478: 612 | AB478: 1776 | AC478: =(AA478*100)/AB478 -> 34.45945945945946 | AD478: =(X478*4)+(Z478*2) -> 0
A479: SUNSHINE | C479: TREZISE | F479: P FITZGERALD | I479: MULLARVEY | L479: N KEMP | N479: MAGILL | Q479: CROSBIE
A480: GOALKICKERS
A481: CAMBERWELL | C481: LONDON 5 | F481: GAUDION | I481: GIBSON
A482: SUNSHINE | C482: N KEMP 2 | F482: GALLE 2 | I482: CROSBIE | L482: STAFFORD
A484: DANDENONG | E484: =C484*6+D484 -> 0 | I484: =G484*6+H484 -> 0 | M484: =K484*6+L484 -> 0 | O484: 9 | P484: 11 | Q484: =O484*6+P484 -> 65 | S484: DANDENONG
A485: NORTHCOTE | E485: =C485*6+D485 -> 0 | I485: =G485*6+H485 -> 0 | M485: =K485*6+L485 -> 0 | O485: 3 | P485: 12 | Q485: =O485*6+P485 -> 30
A486: BEST PLAYERS
A487: DANDENONG | C487: DINEEN | F487: MORRIS | I487: B WATERS | L487: OSBORNE | N487: MINOTTI | Q487: ABRAHAM
A488: NORTHCOTE | C488: GASCOTT | F488: McMAHON | I488: SHEARN
A489: GOALKICKERS
A490: DANDENONG | C490: OSBORNE 3 | F490: CUNNINGHAM 2 | J490: T WATERS 2 | M490: ABRAHAM | P490: STAUNTON
A491: NORTHCOTE | C491: DOOLAN | F491: SHEARN | I491: STONEHAM
E492: 9TH JULY | I492: WEATHER
A493: PRAHRAN | E493: =C493*6+D493 -> 0 | I493: =G493*6+H493 -> 0 | M493: =K493*6+L493 -> 0 | O493: 13 | P493: 9 | Q493: =O493*6+P493 -> 87 | S493: TOORAK PARK
A494: BRIGHTON | E494: =C494*6+D494 -> 0 | I494: =G494*6+H494 -> 0 | M494: =K494*6+L494 -> 0 | O494: 5 | P494: 5 | Q494: =O494*6+P494 -> 35
A495: BEST PLAYERS
A496: PRAHRAN | C496: CLOSE | F496: ROSS JONES | I496: GEARY | L496: LAMBERT | N496: WISHART | Q496: PEARSON
A497: BRIGHTON | C497: McLAREN | F497: MAY | I497: G KEENAN | L497: LAMBERT | N497: WILLIAMS | Q497: McDONALD
A498: GOALKICKERS
A499: PRAHRAN | C499: GEARY 3 | F499: BUTLER 2 | I499: PEARSON 2 | L499: WISHART 2 | O499: WILSON | Q499: KING
A500: BRIGHTON | C500: LAMBERT 2 | F500: BEGLEY 2 | I500: HENDERSON
A502: ROUND 14 | E502: 15TH JULY | I502: WEATHER
D503: 1ST QTR | H503: 2ND QTR | L503: 3RD QTR | P503: FINAL
A504: NORTHCOTE | E504: =C504*6+D504 -> 0 | I504: =G504*6+H504 -> 0 | M504: =K504*6+L504 -> 0 | O504: 9 | P504: 7 | Q504: =O504*6+P504 -> 61 | S504: NORTHCOTE | X504: LADDER | AB504: ROUND | AD504: 14
A505: PRESTON | E505: =C505*6+D505 -> 0 | I505: =G505*6+H505 -> 0 | M505: =K505*6+L505 -> 0 | O505: 6 | P505: 8 | Q505: =O505*6+P505 -> 44
A506: BEST PLAYERS | W506: TEAM | X506: W | Y506: L | Z506: D | AA506: FOR | AB506: AGST | AC506: % | AD506: PTS
A507: NORTHCOTE | C507: WRIGHT | F507: GACOTT | I507: LANGBORNE | L507: McMAHON | O507: STONEHAM | R507: OUSLEY
A508: PRESTON | C508: BOYLE | F508: SLATTERY | I508: HANCOCK | L508: McDONELL | O508: McLAUGHLIN | W508: NORTHCOTE | X508: 12 | Y508: 2 | Z508: 0 | AA508: 1246 | AB508: 768 | AC508: =(AA508*100)/AB508 -> 162.23958333333334 | AD508: =(X508*4)+(Z508*2) -> 48
A509: GOALKICKERS | W509: DANDENONG | X509: 10 | Y509: 4 | Z509: 0 | AA509: 1382 | AB509: 1000 | AC509: =(AA509*100)/AB509 -> 138.2 | AD509: =(X509*4)+(Z509*2) -> 40
A510: NORTHCOTE | C510: STONEHAM 4 | F510: BREHENEY | I510: AGHAN | K510: LANGBORNE | N510: LAVER | P510: WRIGHT | W510: PRAHRAN | X510: 9 | Y510: 5 | Z510: 0 | AA510: 1050 | AB510: 1026 | AC510: =(AA510*100)/AB510 -> 102.3391812865497 | AD510: =(X510*4)+(Z510*2) -> 36
A511: PRESTON | C511: POWELL | F511: HARRIS | I511: MURNANE | L511: HANCOCK | N511: HOWARD | Q511: DIXON | W511: PRESTON | X511: 8 | Y511: 6 | Z511: 0 | AA511: 1269 | AB511: 911 | AC511: =(AA511*100)/AB511 -> 139.29747530186609 | AD511: =(X511*4)+(Z511*2) -> 32
A513: SUNSHINE | E513: =C513*6+D513 -> 0 | I513: =G513*6+H513 -> 0 | M513: =K513*6+L513 -> 0 | O513: 25 | P513: 32 | Q513: =O513*6+P513 -> 182 | S513: ELSTENWICK PARK | W513: CAMBERWELL | X513: 8 | Y513: 6 | Z513: 0 | AA513: 1197 | AB513: 1196 | AC513: =(AA513*100)/AB513 -> 100.08361204013377 | AD513: =(X513*4)+(Z513*2) -> 32
A514: BRIGHTON | E514: =C514*6+D514 -> 0 | I514: =G514*6+H514 -> 0 | M514: =K514*6+L514 -> 0 | O514: 5 | P514: 7 | Q514: =O514*6+P514 -> 37 | W514: WAVERLEY | X514: 5 | Y514: 9 | Z514: 0 | AA514: 1181 | AB514: 1220 | AC514: =(AA514*100)/AB514 -> 96.803278688524586 | AD514: =(X514*4)+(Z514*2) -> 20
A515: BEST PLAYERS | W515: SUNSHINE | X515: 4 | Y515: 10 | Z515: 0 | AA515: 1267 | AB515: 1197 | AC515: =(AA515*100)/AB515 -> 105.84795321637426 | AD515: =(X515*4)+(Z515*2) -> 16
A516: SUNSHINE | C516: TREZISE | F516: WAPLING | I516: CROSBIE | L516: GALLE | O516: CASEY | Q516: N KEMP | W516: BRIGHTON | X516: 0 | Y516: 14 | Z516: 0 | AA516: 649 | AB516: 1958 | AC516: =(AA516*100)/AB516 -> 33.146067415730336 | AD516: =(X516*4)+(Z516*2) -> 0
A517: BRIGHTON | C517: G KEENAN | F517: HANCE | I517: J SMITH | L517: WATSON | O517: MAY | Q517: HENDERSON
A518: GOALKICKERS
A519: SUNSHINE | C519: N KEMP 5 | E519: GALLE 5 | G519: CROSBIE 4 | I519: WAPLING 4 | L519: MULLARVEY 3 | O519: STAFFORD 2 | R519: CASEY | U519: TREZISE
A520: BRIGHTON | C520: WATSON 2 | F520: MAY | H520: HENDERSON | K520: BRASCHER
A522: DANDENONG | E522: =C522*6+D522 -> 0 | I522: =G522*6+H522 -> 0 | M522: =K522*6+L522 -> 0 | O522: 17 | P522: 16 | Q522: =O522*6+P522 -> 118 | S522: DANDENONG
A523: WAVERLEY | E523: =C523*6+D523 -> 0 | I523: =G523*6+H523 -> 0 | M523: =K523*6+L523 -> 0 | O523: 12 | P523: 14 | Q523: =O523*6+P523 -> 86
A524: BEST PLAYERS
A525: DANDENONG | C525: B WATERS | F525: DELANTY | I525: OSBORNE | L525: MINOTTI | O525: T WATERS | R525: GRAY
A526: WAVERLEY | C526: D SCOTT | F526: EVANS | I526: LEE | L526: SMITH | O526: PECK
A527: GOALKICKERS
A528: DANDENONG | C528: T WATERS 4 | F528: DELANTY 4 | I528: B WATERS 2 | L528: MINOTTI 2 | N528: LITTLE 2 | P528: STAUNTON 2 | S528: DINEEN
A529: WAVERLEY | C529: D SCOTT 4 | F529: LEE 3 | H529: SMITH 2 | J529: P SCOTT | L529: SOUTAR | N529: HANNAFORD
A531: PRAHRAN | E531: =C531*6+D531 -> 0 | I531: =G531*6+H531 -> 0 | M531: =K531*6+L531 -> 0 | O531: 15 | P531: 7 | Q531: =O531*6+P531 -> 97 | S531: TOORAK PARK
A532: CAMBERWELL | E532: =C532*6+D532 -> 0 | I532: =G532*6+H532 -> 0 | M532: =K532*6+L532 -> 0 | O532: 11 | P532: 13 | Q532: =O532*6+P532 -> 79
A533: BEST PLAYERS
A534: PRAHRAN | C534: BOSCH | F534: GRAY | I534: BUTLER | L534: ROSS JONES | O534: WILSON | R534: HILL
A535: CAMBERWELL | C535: WHITTEN | F535: HOBILL | I535: YOUNG | L535: GIBSON | O535: GAUDION | R535: QUIRK
A536: GOALKICKERS
A537: PRAHRAN | C537: WISHART 4 | F537: KING 3 | H537: WILSON 2 | J537: RICHARDS 2 | M537: BUTLER 2 | O537: GRAY | Q537: PEARSON
A538: CAMBERWELL | C538: ELLIS 3 | F538: O'NEILL 2 | I538: GIBSON 2 | K538: LONDON 2 | M538: YOUNG | O538: GAUDION
A540: ROUND 15 | E540: 22ND JULY | I540: WEATHER
D541: 1ST QTR | H541: 2ND QTR | L541: 3RD QTR | P541: FINAL
A542: PRESTON | E542: =C542*6+D542 -> 0 | I542: =G542*6+H542 -> 0 | M542: =K542*6+L542 -> 0 | O542: 22 | P542: 31 | Q542: =O542*6+P542 -> 163 | S542: PRESTON | X542: LADDER | AB542: ROUND | AD542: 15
A543: BRIGHTON | E543: =C543*6+D543 -> 0 | I543: =G543*6+H543 -> 0 | M543: =K543*6+L543 -> 0 | O543: 1 | P543: 2 | Q543: =O543*6+P543 -> 8
A544: BEST PLAYERS | W544: TEAM | X544: W | Y544: L | Z544: D | AA544: FOR | AB544: AGST | AC544: % | AD544: PTS
A545: PRESTON | C545: BOYLE | F545: HANCOCK | I545: PARRIS | L545: ZORZI | O545: SHERRY | Q545: SLATTERY
A546: BRIGHTON | C546: LAMBERT | F546: BEDDOE | I546: McLAREN | L546: ALLEN | O546: GRANT | Q546: G KEENAN | W546: NORTHCOTE | X546: 13 | Y546: 2 | Z546: 0 | AA546: 1342 | AB546: 849 | AC546: =(AA546*100)/AB546 -> 158.0683156654888 | AD546: =(X546*4)+(Z546*2) -> 52
A547: GOALKICKERS | O547: McDONNELL | W547: DANDENONG | X547: 11 | Y547: 4 | Z547: 0 | AA547: 1465 | AB547: 1168 | AC547: =(AA547*100)/AB547 -> 125.42808219178082 | AD547: =(X547*4)+(Z547*2) -> 44
A548: PRESTON | C548: BOYLE 5 | E548: PARRIS 5 | G548: SHERRY 2 | I548: ZORZI 2 | K548: POWELL 2 | M548: HANCOCK 2 | O548: MURNANE | R548: REYNOLDS | W548: PRESTON | X548: 9 | Y548: 6 | Z548: 0 | AA548: 1432 | AB548: 919 | AC548: =(AA548*100)/AB548 -> 155.82154515778021 | AD548: =(X548*4)+(Z548*2) -> 36
A549: BRIGHTON | C549: LAMBERT | W549: PRAHRAN | X549: 9 | Y549: 6 | Z549: 0 | AA549: 1135 | AB549: 1118 | AC549: =(AA549*100)/AB549 -> 101.52057245080501 | AD549: =(X549*4)+(Z549*2) -> 36
A551: NORTHCOTE | E551: =C551*6+D551 -> 0 | I551: =G551*6+H551 -> 0 | M551: =K551*6+L551 -> 0 | O551: 13 | P551: 18 | Q551: =O551*6+P551 -> 96 | S551: CAMBERWELL | W551: CAMBERWELL | X551: 8 | Y551: 7 | Z551: 0 | AA551: 1278 | AB551: 1292 | AC551: =(AA551*100)/AB551 -> 98.916408668730654 | AD551: =(X551*4)+(Z551*2) -> 32
A552: CAMBERWELL | E552: =C552*6+D552 -> 0 | I552: =G552*6+H552 -> 0 | M552: =K552*6+L552 -> 0 | O552: 11 | P552: 15 | Q552: =O552*6+P552 -> 81 | W552: WAVERLEY | X552: 6 | Y552: 9 | Z552: 0 | AA552: 1273 | AB552: 1305 | AC552: =(AA552*100)/AB552 -> 97.547892720306507 | AD552: =(X552*4)+(Z552*2) -> 24
A553: BEST PLAYERS | W553: SUNSHINE | X553: 4 | Y553: 11 | Z553: 0 | AA553: 1335 | AB553: 1280 | AC553: =(AA553*100)/AB553 -> 104.296875 | AD553: =(X553*4)+(Z553*2) -> 16
A554: NORTHCOTE | C554: BRETHERTON | F554: LANGBORNE | I554: SHEARN | L554: TAYLOR | O554: GORMAN | Q554: WRIGHT | W554: BRIGHTON | X554: 0 | Y554: 15 | Z554: 0 | AA554: 657 | AB554: 2121 | AC554: =(AA554*100)/AB554 -> 30.975954738330977 | AD554: =(X554*4)+(Z554*2) -> 0
A555: CAMBERWELL | C555: WHITTEN | F555: HOBILL | I555: O'NEILL | L555: SMITH | O555: COLLETT | Q555: THOMPSON
A556: GOALKICKERS
A557: NORTHCOTE | C557: SHEARN 5 | F557: TAYLOR 2 | I557: STONEHAM 2 | L557: GASCOTT | N557: LAVER | P557: LANGBORNE | S557: AGHAN
A558: CAMBERWELL | C558: O'NEILL 3 | F558: YOUNG 2 | I558: ELLIS 2 | K558: THOMPSON 2 | N558: GIBSON | P558: SMITH
A560: WAVERLEY | E560: =C560*6+D560 -> 0 | I560: =G560*6+H560 -> 0 | M560: =K560*6+L560 -> 0 | O560: 12 | P560: 20 | Q560: =O560*6+P560 -> 92 | S560: WAVERLEY
A561: PRAHRAN | E561: =C561*6+D561 -> 0 | I561: =G561*6+H561 -> 0 | M561: =K561*6+L561 -> 0 | O561: 11 | P561: 19 | Q561: =O561*6+P561 -> 85
A562: BEST PLAYERS
A563: WAVERLEY | C563: SMITH | F563: BLACK | I563: COLE | L563: EVANS | O563: MCGUINNESS | R563: RAY
A564: PRAHRAN | C564: HILL | F564: LAMBERT | I564: McMAHON | L564: CLOSE | O564: GRAY | R564: KIND
A565: GOALKICKERS
A566: WAVERLEY | C566: HEAD 3 | E566: RAY 3 | G566: CLANCY 2 | J566: D SCOTT | L566: SMITH | N566: YEOMAN | P566: HARKINS
A567: PRAHRAN | C567: McMAHON 3 | F567: HAYES | H567: BUTLER | J567: GRAY | L567: KIND | M567: GRACE | O567: BOSCH | Q567: RICHARDS | T567: ROSS JONES
A569: DANDENONG | E569: =C569*6+D569 -> 0 | I569: =G569*6+H569 -> 0 | M569: =K569*6+L569 -> 0 | O569: 11 | P569: 17 | Q569: =O569*6+P569 -> 83 | S569: SUNSHINE
A570: SUNSHINE | E570: =C570*6+D570 -> 0 | I570: =G570*6+H570 -> 0 | M570: =K570*6+L570 -> 0 | O570: 10 | P570: 8 | Q570: =O570*6+P570 -> 68
A571: BEST PLAYERS
A572: DANDENONG | C572: GILLINGHAM | F572: ABRAHAM | I572: MINOTTI | L572: LITTLE | O572: CUNNINGHAM | R572: DELANTY
A573: SUNSHINE | C573: STAFFORD | F573: TREZISE | I573: LEAVER | L573: FERGUSON | O573: PRESTON | R573: MAGILL
A574: GOALKICKERS
A575: DANDENONG | C575: T WATERS 2 | F575: MINOTTI 2 | I575: LITTLE 2 | K575: MORRIS 2 | M575: OSBORNE | O575: DELANTY | Q575: OSWALD
A576: SUNSHINE | C576: MAGILL 3 | F576: LEAVER 2 | I576: I KEMP 2 | K576: BLACKMAN | N576: STAFFORD | Q576: MULLARVEY
A578: ROUND 16 | E578: 29TH JULY | I578: WEATHER
D579: 1ST QTR | H579: 2ND QTR | L579: 3RD QTR | P579: FINAL
A580: CAMBERWELL | E580: =C580*6+D580 -> 0 | I580: =G580*6+H580 -> 0 | M580: =K580*6+L580 -> 0 | O580: 29 | P580: 23 | Q580: =O580*6+P580 -> 197 | S580: ELSTENWICK PARK | X580: LADDER | AB580: ROUND | AD580: 16
A581: BRIGHTON | E581: =C581*6+D581 -> 0 | I581: =G581*6+H581 -> 0 | M581: =K581*6+L581 -> 0 | O581: 4 | P581: 9 | Q581: =O581*6+P581 -> 33
A582: BEST PLAYERS | W582: TEAM | X582: W | Y582: L | Z582: D | AA582: FOR | AB582: AGST | AC582: % | AD582: PTS
A583: CAMBERWELL | C583: THOMPSON | F583: HOBILL | I583: O'NEILL | L583: ELLIS | O583: WHITTEN | R583: BAILEY
A584: BRIGHTON | C584: MAY | F584: WATSON | I584: G KEENAN | L584: J SMITH | O584: LAMBERT | R584: BEGLEY | W584: NORTHCOTE | X584: 14 | Y584: 2 | Z584: 0 | AA584: 1444 | AB584: 932 | AC584: =(AA584*100)/AB584 -> 154.93562231759657 | AD584: =(X584*4)+(Z584*2) -> 56
A585: GOALKICKERS | W585: DANDENONG | X585: 12 | Y585: 4 | Z585: 0 | AA585: 1585 | AB585: 1267 | AC585: =(AA585*100)/AB585 -> 125.09865824782952 | AD585: =(X585*4)+(Z585*2) -> 48
A586: CAMBERWELL | C586: O'NEILL 12 | F586: THOMPSON 5 | I586: ELLIS 4 | K586: QUIRK 3 | M586: YOUNG 2 | O586: GIBSON | Q586: SMITH | S586: HOBILL | W586: PRESTON | X586: 9 | Y586: 7 | Z586: 0 | AA586: 1531 | AB586: 1039 | AC586: =(AA586*100)/AB586 -> 147.35322425409046 | AD586: =(X586*4)+(Z586*2) -> 36
A587: BRIGHTON | C587: LAMBERT 2 | F587: WATSON | I587: ALLEN | W587: CAMBERWELL | X587: 9 | Y587: 7 | Z587: 0 | AA587: 1475 | AB587: 1325 | AC587: =(AA587*100)/AB587 -> 111.32075471698113 | AD587: =(X587*4)+(Z587*2) -> 36
A589: DANDENONG | E589: =C589*6+D589 -> 0 | I589: =G589*6+H589 -> 0 | M589: =K589*6+L589 -> 0 | O589: 18 | P589: 12 | Q589: =O589*6+P589 -> 120 | S589: DANDENONG | W589: PRAHRAN | X589: 9 | Y589: 7 | Z589: 0 | AA589: 1231 | AB589: 1216 | AC589: =(AA589*100)/AB589 -> 101.23355263157895 | AD589: =(X589*4)+(Z589*2) -> 36
A590: PRESTON | E590: =C590*6+D590 -> 0 | I590: =G590*6+H590 -> 0 | M590: =K590*6+L590 -> 0 | O590: 14 | P590: 15 | Q590: =O590*6+P590 -> 99 | W590: WAVERLEY | X590: 6 | Y590: 10 | Z590: 0 | AA590: 1356 | AB590: 1407 | AC590: =(AA590*100)/AB590 -> 96.375266524520256 | AD590: =(X590*4)+(Z590*2) -> 24
A591: BEST PLAYERS | W591: SUNSHINE | X591: 5 | Y591: 11 | Z591: 0 | AA591: 1433 | AB591: 1376 | AC591: =(AA591*100)/AB591 -> 104.14244186046511 | AD591: =(X591*4)+(Z591*2) -> 20
A592: DANDENONG | C592: GILLINGHAM | F592: CUNNINGHAM | I592: MINOTTI | L592: STAUNTON | O592: DELANTY | R592: ROSETTI | W592: BRIGHTON | X592: 0 | Y592: 16 | Z592: 0 | AA592: 690 | AB592: 2318 | AC592: =(AA592*100)/AB592 -> 29.767040552200172 | AD592: =(X592*4)+(Z592*2) -> 0
A593: PRESTON | C593: SAYERS | F593: MURNANE | I593: McLAUGHLIN | L593: POWELL | O593: MURPHY | R593: HANCOCK
A594: GOALKICKERS
A595: DANDENONG | C595: CUNNINGHAM 4 | F595: MINOTTI 3 | I595: DELANTY 3 | L595: WATSON 3 | N595: ABRAHAM 3 | Q595: LITTLE | S595: MORRIS
A596: PRESTON | C596: MURNANE 2 | F596: POWELL 2 | I596: HOWARD 2 | L596: MILLAR 2 | N596: MURPHY 2 | Q596: McDONNELL | T596: HANCOCK | W596: PARRIS | X596: ZORZI
A598: SUNSHINE | E598: =C598*6+D598 -> 0 | I598: =G598*6+H598 -> 0 | M598: =K598*6+L598 -> 0 | O598: 14 | P598: 14 | Q598: =O598*6+P598 -> 98 | S598: SUNSHINE
A599: PRAHRAN | E599: =C599*6+D599 -> 0 | I599: =G599*6+H599 -> 0 | M599: =K599*6+L599 -> 0 | O599: 14 | P599: 12 | Q599: =O599*6+P599 -> 96
A600: BEST PLAYERS
A601: SUNSHINE | C601: TREZISE | F601: CROSBIE | I601: P FITZGERALD | L601: GALLE | N601: MAGILL
A602: PRAHRAN | C602: LAMBERT | F602: BUTLER | I602: CLOSE | L602: PEARSON | N602: BOSCH | Q602: HARRIS
A603: GOALKICKERS
A604: SUNSHINE | C604: I KEMP 2 | E604: MULLARVEY 2 | H604: MAGILL 2 | J604: CROSBIE 2 | M604: WAPLING 2 | P604: P FITZGERALD | S604: GALLE | V604: TREZISE | X604: FERGUSON
A605: PRAHRAN | C605: WILSON 4 | E605: MCMAHON 3 | H605: PEARSON 2 | J605: GEARY 2 | L605: BUTLER | N605: CLOSE | P605: WISHART
E606: 30TH JULY | I606: WEATHER
A607: NORTHCOTE | E607: =C607*6+D607 -> 0 | I607: =G607*6+H607 -> 0 | M607: =K607*6+L607 -> 0 | O607: 14 | P607: 18 | Q607: =O607*6+P607 -> 102 | S607: NORTHCOTE
A608: WAVERLEY | E608: =C608*6+D608 -> 0 | I608: =G608*6+H608 -> 0 | M608: =K608*6+L608 -> 0 | O608: 13 | P608: 5 | Q608: =O608*6+P608 -> 83
A609: BEST PLAYERS
A610: NORTHCOTE | C610: BRETHERTON | F610: TAYLOR | I610: OUSLEY | L610: WRIGHT | N610: LANGBORNE | Q610: STONEHAM
A611: WAVERLEY | C611: SMITH | F611: PECK | I611: D SCOTT | L611: CLANCY | N611: HARKINS | Q611: FALCONER
A612: GOALKICKERS
A613: NORTHCOTE | C613: STONEHAM 4 | F613: AGHAN 3 | I613: SHEARN 2 | K613: LANGBORNE 2 | N613: DOWLING 2 | Q613: TAYLOR
A614: WAVERLEY | C614: HARKINS 5 | F614: FALCONER 3 | I614: HEAD | K614: YEOMAN | M614: P SCOTT | O614: RAY | Q614: D SCOTT
A616: ROUND 17 | E616: 5TH AUGUST | I616: WEATHER
D617: 1ST QTR | H617: 2ND QTR | L617: 3RD QTR | P617: FINAL
A618: NORTHCOTE | E618: =C618*6+D618 -> 0 | I618: =G618*6+H618 -> 0 | M618: =K618*6+L618 -> 0 | O618: 27 | P618: 16 | Q618: =O618*6+P618 -> 178 | S618: NORTHCOTE | X618: LADDER | AB618: ROUND | AD618: 17
A619: BRIGHTON | E619: =C619*6+D619 -> 0 | I619: =G619*6+H619 -> 0 | M619: =K619*6+L619 -> 0 | O619: 1 | P619: 2 | Q619: =O619*6+P619 -> 8
A620: BEST PLAYERS | W620: TEAM | X620: W | Y620: L | Z620: D | AA620: FOR | AB620: AGST | AC620: % | AD620: PTS
A621: NORTHCOTE | C621: WRIGHT | F621: BLAKE | I621: SHEARN | L621: DOOLAN | O621: McMAHON | R621: LAVER
A622: BRIGHTON | C622: MAY | F622: BRASCHER | I622: JAMIESON | L622: G KEENAN | O622: ALLEN | R622: HENDERSON | W622: NORTHCOTE | X622: 15 | Y622: 2 | Z622: 0 | AA622: 1622 | AB622: 940 | AC622: =(AA622*100)/AB622 -> 172.55319148936169 | AD622: =(X622*4)+(Z622*2) -> 60
A623: GOALKICKERS | L623: ROOTSEY | O623: LAVER | W623: DANDENONG | X623: 13 | Y623: 4 | Z623: 0 | AA623: 1680 | AB623: 1350 | AC623: =(AA623*100)/AB623 -> 124.44444444444444 | AD623: =(X623*4)+(Z623*2) -> 52
A624: NORTHCOTE | C624: SHEARN 8 | E624: STONEHAM 6 | H624: AGHAN 3 | J624: WRIGHT 2 | M624: TAYLOR 2 | O624: OUSLEY 2 | Q624: LANGBORNE 2 | W624: PRESTON | X624: 10 | Y624: 7 | Z624: 0 | AA624: 1617 | AB624: 1121 | AC624: =(AA624*100)/AB624 -> 144.24620874219448 | AD624: =(X624*4)+(Z624*2) -> 40
A625: BRIGHTON | C625: BEGLEY | W625: CAMBERWELL | X625: 9 | Y625: 8 | Z625: 0 | AA625: 1557 | AB625: 1411 | AC625: =(AA625*100)/AB625 -> 110.34727143869596 | AD625: =(X625*4)+(Z625*2) -> 36
A627: PRESTON | E627: =C627*6+D627 -> 0 | I627: =G627*6+H627 -> 0 | M627: =K627*6+L627 -> 0 | O627: 12 | P627: 14 | Q627: =O627*6+P627 -> 86 | S627: CAMBERWELL | W627: PRAHRAN | X627: 9 | Y627: 8 | Z627: 0 | AA627: 1314 | AB627: 1311 | AC627: =(AA627*100)/AB627 -> 100.22883295194508 | AD627: =(X627*4)+(Z627*2) -> 36
A628: CAMBERWELL | E628: =C628*6+D628 -> 0 | I628: =G628*6+H628 -> 0 | M628: =K628*6+L628 -> 0 | O628: 12 | P628: 10 | Q628: =O628*6+P628 -> 82 | W628: WAVERLEY | X628: 7 | Y628: 10 | Z628: 0 | AA628: 1478 | AB628: 1483 | AC628: =(AA628*100)/AB628 -> 99.662845583277146 | AD628: =(X628*4)+(Z628*2) -> 28
A629: BEST PLAYERS | W629: SUNSHINE | X629: 5 | Y629: 12 | Z629: 0 | AA629: 1509 | AB629: 1498 | AC629: =(AA629*100)/AB629 -> 100.73431241655541 | AD629: =(X629*4)+(Z629*2) -> 20
A630: PRESTON | C630: SHERRY | F630: POWER | I630: MUIR | L630: MURPHY | O630: MURNANE | R630: O'KEEFE | W630: BRIGHTON | X630: 0 | Y630: 17 | Z630: 0 | AA630: 698 | AB630: 2496 | AC630: =(AA630*100)/AB630 -> 27.964743589743591 | AD630: =(X630*4)+(Z630*2) -> 0
A631: CAMBERWELL | C631: O'NEILL | F631: SKALBERG | I631: WHITTEN | L631: LONDON | O631: COLLETT | R631: YOUNG
A632: GOALKICKERS
A633: PRESTON | C633: MUIR 3 | E633: ZORZI 3 | G633: POWELL 3 | J633: SHERRY | L633: O'KEEFE | N633: MURPHY
A634: CAMBERWELL | C634: O'NEILL 3 | E634: ELLIS 2 | G634: LONDON 2 | J634: COLLETT 2 | M634: THOMPSON | P634: QUIRK | R634: YOUNG
A636: WAVERLEY | E636: =C636*6+D636 -> 0 | I636: =G636*6+H636 -> 0 | M636: =K636*6+L636 -> 0 | O636: 19 | P636: 8 | Q636: =O636*6+P636 -> 122 | S636: WAVERLEY
A637: SUNSHINE | E637: =C637*6+D637 -> 0 | I637: =G637*6+H637 -> 0 | M637: =K637*6+L637 -> 0 | O637: 9 | P637: 22 | Q637: =O637*6+P637 -> 76
A638: BEST PLAYERS
A639: WAVERLEY | C639: SOUTAR | F639: SMITH | I639: D SCOTT | L639: BLACK | O639: PECK | Q639: FALCONER
A640: SUNSHINE | C640: TREZISE | F640: P FITZGERALD | I640: CROSBIE | L640: PRESTON | O640: I KEMP | Q640: WAPLING
A641: GOALKICKERS
A642: WAVERLEY | C642: D SCOTT 6 | F642: P SCOTT 3 | I642: HARKINS 3 | K642: CLANCY 2 | N642: SMITH 2 | P642: HANNAFORD | S642: RAY | U642: FALCONER
A643: SUNSHINE | C643: CROSBIE 4 | F643: TREZISE 2 | I643: WAPLING 2 | L643: N KEMP
E644: 6TH AUGUST | I644: WEATHER
A645: DANDENONG | E645: =C645*6+D645 -> 0 | I645: =G645*6+H645 -> 0 | M645: =K645*6+L645 -> 0 | O645: 14 | P645: 11 | Q645: =O645*6+P645 -> 95 | S645: TOORAK PARK
A646: PRAHRAN | E646: =C646*6+D646 -> 0 | I646: =G646*6+H646 -> 0 | M646: =K646*6+L646 -> 0 | O646: 12 | P646: 11 | Q646: =O646*6+P646 -> 83
A647: BEST PLAYERS
A648: DANDENONG | C648: LITTLE | F648: DELANTY | I648: T WATERS | L648: GILLINGHAM | O648: WHELOW
A649: PRAHRAN | C649: HAYES | F649: GRAY | I649: LAMBERT | L649: BOSCH | O649: WILSON | Q649: HARRIS
A650: GOALKICKERS
A651: DANDENONG | C651: LITTLE 3 | E651: T WATERS 3 | H651: ABRAHAM 2 | K651: DELANTY 2 | M651: CUNNINGHAM | P651: OSBORNE | R651: MINOTTI | U651: ROSETTI
A652: PRAHRAN | C652: McMAHON 2 | F652: PAT WALSH 2 | I652: RICHARDS 2 | L652: WILSON 2 | N652: WISHART | Q652: BOSCH | S652: GRAY | U652: BUTLER
A654: ROUND 18 | E654: 12TH AUGUST | I654: WEATHER
D655: 1ST QTR | H655: 2ND QTR | L655: 3RD QTR | P655: FINAL
A656: PRESTON | E656: =C656*6+D656 -> 0 | I656: =G656*6+H656 -> 0 | M656: =K656*6+L656 -> 0 | O656: 16 | P656: 15 | Q656: =O656*6+P656 -> 111 | S656: PRESTON | X656: LADDER | AB656: ROUND | AD656: 18
A657: PRAHRAN | E657: =C657*6+D657 -> 0 | I657: =G657*6+H657 -> 0 | M657: =K657*6+L657 -> 0 | O657: 11 | P657: 6 | Q657: =O657*6+P657 -> 72
A658: BEST PLAYERS | W658: TEAM | X658: W | Y658: L | Z658: D | AA658: FOR | AB658: AGST | AC658: % | AD658: PTS
A659: PRESTON | C659: MURPHY | F659: MURNANE | I659: HOWARD | L659: O'KEEFE | O659: SHERRY | Q659: DIXON
A660: PRAHRAN | C660: BUTLER | F660: ROSS JONES | I660: WILSON | L660: PEARSON | O660: CLOSE | Q660: HAYES | W660: NORTHCOTE | X660: 16 | Y660: 2 | Z660: 0 | AA660: 1726 | AB660: 985 | AC660: =(AA660*100)/AB660 -> 175.2284263959391 | AD660: =(X660*4)+(Z660*2) -> 64
A661: GOALKICKERS | W661: DANDENONG | X661: 14 | Y661: 4 | Z661: 0 | AA661: 1799 | AB661: 1459 | AC661: =(AA661*100)/AB661 -> 123.30363262508567 | AD661: =(X661*4)+(Z661*2) -> 56
A662: PRESTON | C662: MURNANE 6 | F662: POWELL 3 | I662: HOWARD 2 | L662: ZORZI 2 | N662: HANCOCK | Q662: SHERRY | S662: O'KEEFE | W662: PRESTON | X662: 11 | Y662: 7 | Z662: 0 | AA662: 1728 | AB662: 1193 | AC662: =(AA662*100)/AB662 -> 144.84492875104777 | AD662: =(X662*4)+(Z662*2) -> 44
A663: PRAHRAN | C663: McMAHON 3 | F663: WILSON 3 | I663: BUTLER 2 | K663: CLOSE | M663: PAT WALSH | P663: WISHART | W663: CAMBERWELL | X663: 9 | Y663: 9 | Z663: 0 | AA663: 1666 | AB663: 1530 | AC663: =(AA663*100)/AB663 -> 108.88888888888889 | AD663: =(X663*4)+(Z663*2) -> 36
A665: WAVERLEY | E665: =C665*6+D665 -> 0 | I665: =G665*6+H665 -> 0 | M665: =K665*6+L665 -> 0 | O665: 19 | P665: 11 | Q665: =O665*6+P665 -> 125 | S665: ELSTENWICK PARK | W665: PRAHRAN | X665: 9 | Y665: 9 | Z665: 0 | AA665: 1386 | AB665: 1422 | AC665: =(AA665*100)/AB665 -> 97.468354430379748 | AD665: =(X665*4)+(Z665*2) -> 36
A666: BRIGHTON | E666: =C666*6+D666 -> 0 | I666: =G666*6+H666 -> 0 | M666: =K666*6+L666 -> 0 | O666: 9 | P666: 9 | Q666: =O666*6+P666 -> 63 | W666: WAVERLEY | X666: 8 | Y666: 10 | Z666: 0 | AA666: 1603 | AB666: 1546 | AC666: =(AA666*100)/AB666 -> 103.6869340232859 | AD666: =(X666*4)+(Z666*2) -> 32
A667: BEST PLAYERS | W667: SUNSHINE | X667: 5 | Y667: 13 | Z667: 0 | AA667: 1554 | AB667: 1602 | AC667: =(AA667*100)/AB667 -> 97.00374531835206 | AD667: =(X667*4)+(Z667*2) -> 20
A668: WAVERLEY | C668: EVANS | F668: D SCOTT | I668: FALCONER | L668: HARKINS | O668: SMITH | Q668: RAY | W668: BRIGHTON | X668: 0 | Y668: 18 | Z668: 0 | AA668: 761 | AB668: 2621 | AC668: =(AA668*100)/AB668 -> 29.034719572682182 | AD668: =(X668*4)+(Z668*2) -> 0
A669: BRIGHTON | C669: ALLEN | F669: MAY | I669: SMITH | L669: BEGLEY | O669: WATSON | Q669: McLAREN
A670: GOALKICKERS
A671: WAVERLEY | C671: D SCOTT 7 | F671: P SCOTT 2 | I671: SMITH 2 | K671: RAY 2 | M671: FALCONER 2 | P671: ALLEN | R671: CLANCY | U671: COLE | W671: HARKINS
A672: BRIGHTON | C672: ALLEN 3 | F672: HENDERSON 2 | I672: SMITH 2 | K672: WILLIAMS | M672: WATSON | O672: BEGLEY
A674: DANDENONG | E674: =C674*6+D674 -> 0 | I674: =G674*6+H674 -> 0 | M674: =K674*6+L674 -> 0 | O674: 16 | P674: 23 | Q674: =O674*6+P674 -> 119 | S674: DANDENONG
A675: CAMBERWELL | E675: =C675*6+D675 -> 0 | I675: =G675*6+H675 -> 0 | M675: =K675*6+L675 -> 0 | O675: 16 | P675: 13 | Q675: =O675*6+P675 -> 109
A676: BEST PLAYERS
A677: DANDENONG | C677: GRAY | F677: MORRIS | I677: DELANTY | L677: CUNNINGHAM | O677: MINOTTI | R677: ROSETTI
A678: CAMBERWELL | C678: O'NEILL | F678: YOUNG | I678: K JOHNSON | L678: WHITTEN | O678: B JOHNSON | R678: THOMPSON
A679: GOALKICKERS
A680: DANDENONG | C680: GRAY 5 | E680: ABRAHAM 4 | H680: MORRIS 2 | J680: DELANTY 2 | M680: ROSETTI | O680: MINOTTI | Q680: LITTLE
A681: CAMBERWELL | C681: O'NEILL 7 | E681: THOMPSON 3 | H681: LONDON 2 | J681: WHITTEN | M681: HOBILL | O681: QUIRK | Q681: YOUNG
A683: NORTHCOTE | E683: =C683*6+D683 -> 0 | I683: =G683*6+H683 -> 0 | M683: =K683*6+L683 -> 0 | O683: 14 | P683: 20 | Q683: =O683*6+P683 -> 104 | S683: SUNSHINE
A684: SUNSHINE | E684: =C684*6+D684 -> 0 | I684: =G684*6+H684 -> 0 | M684: =K684*6+L684 -> 0 | O684: 7 | P684: 3 | Q684: =O684*6+P684 -> 45
A685: BEST PLAYERS
A686: NORTHCOTE | C686: R LANGBORNE | F686: LAVER | I686: WRIGHT | L686: GORMAN | O686: GASCOTT | R686: JACKSON
A687: SUNSHINE | C687: CROSBIE | F687: P FITZGERALD | I687: TREZISE | L687: BLACKMAN | O687: FERGUSON | R687: PRESTON
A688: GOALKICKERS
A689: NORTHCOTE | C689: SHEARN 5 | F689: R LANGBORNE 4 | J689: STONEHAM 2 | M689: WRIGHT | O689: TAYLOR | Q689: MORAN
A690: SUNSHINE | C690: N KEMP 2 | F690: CROSBIE 2 | I690: CASEY | K690: MULLARVEY | N690: MAGILL
A692: FINALS
A693: 1ST SEMI | E693: 19TH AUGUST | I693: WEATHER
D694: 1ST QTR | H694: 2ND QTR | L694: 3RD QTR | P694: FINAL | S694: TOORAK PARK
A695: CAMBERWELL | C695: 2 | D695: 7 | E695: =C695*6+D695 -> 19 | G695: 5 | H695: 17 | I695: =G695*6+H695 -> 47 | K695: 10 | L695: 21 | M695: =K695*6+L695 -> 81 | O695: 15 | P695: 24 | Q695: =O695*6+P695 -> 114 | S695: UMPIRE
A696: PRESTON | C696: 4 | D696: 2 | E696: =C696*6+D696 -> 26 | G696: 6 | H696: 6 | I696: =G696*6+H696 -> 42 | K696: 7 | L696: 6 | M696: =K696*6+L696 -> 48 | O696: 8 | P696: 9 | Q696: =O696*6+P696 -> 57 | S696: TREWIN
A697: BEST PLAYERS
A698: CAMBERWELL | C698: WHITTEN | F698: YOUNG | I698: O'NEILL | L698: GIBSON | O698: THOMPSON | R698: HOBILL
A699: PRESTON | C699: ZORZI | F699: HOWARD | I699: McLAUGHLIN | L699: HANCOCK | O699: MURPHY | R699: MUIR
A700: GOALKICKERS
A701: CAMBERWELL | C701: O'NEILL 6 | F701: QUIRK 4 | H701: THOMPSON | K701: COLLETT | M701: HOBILL | O701: LONDON | Q701: ELLIS
A702: PRESTON | C702: ZORZI 3 | F702: MURNANE 2 | I702: HOWARD | L702: CANNON | O702: 1 SHORT
A704: 2ND SEMI | E704: 27TH AUGUST | I704: WEATHER | S704: TOORAK PARK
A705: NORTHCOTE | C705: 2 | D705: 1 | E705: =C705*6+D705 -> 13 | G705: 6 | H705: 3 | I705: =G705*6+H705 -> 39 | K705: 8 | L705: 4 | M705: =K705*6+L705 -> 52 | O705: 13 | P705: 7 | Q705: =O705*6+P705 -> 85 | S705: UMPIRE
A706: DANDENONG | C706: 3 | D706: 5 | E706: =C706*6+D706 -> 23 | G706: 4 | H706: 8 | I706: =G706*6+H706 -> 32 | K706: 6 | L706: 11 | M706: =K706*6+L706 -> 47 | O706: 8 | P706: 13 | Q706: =O706*6+P706 -> 61 | S706: ALLEN
A707: BEST PLAYERS
A708: NORTHCOTE | C708: SHEARN | F708: WRIGHT | I708: BRETHERTON | L708: DOOLAN | O708: McMAHON | R708: TAYLOR
A709: DANDENONG | C709: B WATERS | F709: PETERS | I709: PENNEFATHER | L709: STAUNTON | O709: LITTLE | R709: GILLINGHAM
A710: GOALKICKERS
A711: NORTHCOTE | C711: SHEARN 6 | F711: R LANGBORNE 2 | J711: OUSLEY 2 | M711: ROOTSEY | O711: STONEHAM | R711: TAYLOR
A712: DANDENONG | C712: MORRIS 2 | F712: GRAY 2 | I712: PENNEFATHER 2 | M712: T WATERS | P712: MINOTTI
A714: PRELIMINARY | E714: 3RD SEPTEMBER | I714: WEATHER | S714: TOORAK PARK
A715: DANDENONG | C715: 5 | D715: 2 | E715: =C715*6+D715 -> 32 | G715: 11 | H715: 8 | I715: =G715*6+H715 -> 74 | K715: 14 | L715: 12 | M715: =K715*6+L715 -> 96 | O715: 18 | P715: 15 | Q715: =O715*6+P715 -> 123 | S715: UMPIRE
A716: CAMBERWELL | C716: 7 | D716: 2 | E716: =C716*6+D716 -> 44 | G716: 10 | H716: 3 | I716: =G716*6+H716 -> 63 | K716: 14 | L716: 8 | M716: =K716*6+L716 -> 92 | O716: 17 | P716: 16 | Q716: =O716*6+P716 -> 118 | S716: McMASTER
A717: BEST PLAYERS
A718: DANDENONG | C718: T WATERS | F718: DINEEN | I718: DELANTY | L718: PENNEFATHER | O718: MINOTTI | R718: GRAY
A719: CAMBERWELL | C719: GAUDION | F719: QUIRK | I719: B JOHNSON | L719: O'NEILL | O719: JONES | R719: YOUNG
A720: GOALKICKERS
A721: DANDENONG | C721: T WATERS 4 | F721: GRAY 4 | H721: MINOTTI 3 | J721: MORRIS 3 | M721: DELANTY 2 | P721: LITTLE 2
A722: CAMBERWELL | C722: O'NEILL 4 | F722: QUIRK 4 | H722: GIBSON 3 | J722: ELLIS 2 | L722: LONDON 2 | O722: WHITTEN | Q722: JONES
A724: GRAND | E724: 10TH SEPTEMBER | J724: WEATHER | S724: TOORAK PARK
A725: NORTHCOTE | C725: 2 | D725: 1 | E725: =C725*6+D725 -> 13 | G725: 5 | H725: 8 | I725: =G725*6+H725 -> 38 | K725: 8 | L725: 13 | M725: =K725*6+L725 -> 61 | O725: 12 | P725: 15 | Q725: =O725*6+P725 -> 87 | S725: UMPIRE
A726: DANDENONG | C726: 2 | D726: 8 | E726: =C726*6+D726 -> 20 | G726: 3 | H726: 12 | I726: =G726*6+H726 -> 30 | K726: 6 | L726: 15 | M726: =K726*6+L726 -> 51 | O726: 9 | P726: 18 | Q726: =O726*6+P726 -> 72 | S726: McMASTER
A727: BEST PLAYERS
A728: NORTHCOTE | C728: TAYLOR | F728: WRIGHT | I728: DOOLAN | L728: SHEARN | O728: OUSLEY | R728: GASCOTT
A729: DANDENONG | C729: T WATERS | F729: DELANTY | I729: PENNEFATHER | L729: LITTLE | O729: OSBORNE | R729: MINOTTI
A730: GOALKICKERS
A731: NORTHCOTE | C731: TAYLOR 5 | F731: SHEARN 2 | I731: WRIGHT | K731: DOWLING | M731: OLIVER | O731: OUSLEY | Q731: AGHAN
A732: DANDENONG | C732: T WATERS 4 | F732: LITTLE 2 | I732: MINOTTI | K732: ABRAHAM | M732: GRAY
A734: PLAY-OFF
A735: MORDIALLOC | C735: 5 | D735: 4 | E735: =C735*6+D735 -> 34 | G735: 8 | H735: 6 | I735: =G735*6+H735 -> 54 | K735: 14 | L735: 10 | M735: =K735*6+L735 -> 94 | O735: 18 | P735: 12 | Q735: =O735*6+P735 -> 120 | S735: DANDENONG
A736: DANDENONG | C736: 3 | D736: 5 | E736: =C736*6+D736 -> 23 | G736: 4 | H736: 9 | I736: =G736*6+H736 -> 33 | K736: 9 | L736: 16 | M736: =K736*6+L736 -> 70 | O736: 13 | P736: 19 | Q736: =O736*6+P736 -> 97
A737: BEST PLAYERS
A738: MORDIALLOC | C738: CRANE | F738: BLAINEY | I738: HORNE | L738: CRAWFORD | O738: RITCHIE | R738: PETRIE
A739: DANDENONG | C739: DINEEN | F739: MORRIS | I739: ROSETTI | L739: CUNNINGHAM | O739: T WATERS | R739: B WATERS
A740: GOALKICKERS
A741: MORDIALLOC | C741: CRANE 11 | F741: MINIHAN 3 | I741: PEARSON 3 | L741: GILL | N741: KAVANAGH | Q741: 1 OVER
A742: DANDENONG | C742: T WATERS 3 | F742: ABRAHAM 2 | I742: MORRIS 2 | L742: MINOTTI 2 | N742: B WATERS 2 | Q742: DINEEN | S742: DELANTY