A1: Victorian Football Association
A2: Season 1961 - Division One
A3: © Copyright Wal Williams | F3: First created: 2 May 2015
A4: Contact: joywalwi at gmail dot com | F4: Last updated: 2 May 2015 | W4: VFA Results and tables - Link to the main index page
A5: You are free to copy this document in whole or part provided that proper acknowledgement is given to the author. All rights reserved.
A7: 1961 | D7: 1ST DIVISION | CA7: \D | CB7: {GOTO}BJ3~/M{RIGHT 7}{END}{DOWN}~G4~
A8: ROUND 1 | E8: 15TH APRIL | J8: WEATHER | M8: SOUTH WEST WIND SHOWERS COLD | S8: PLAYED AT | CB8: {GOTO}AL3~/M{END}{RIGHT}{END}{DOWN}~P3~
D9: 1ST QTR | H9: 2ND QTR | L9: 3RD QTR | P9: FINAL | S9: MOORABBIN | CB9: {GOTO}BJ23~/M{RIGHT 7}{END}{DOWN}~V4~
A10: MOORABBIN | C10: 2 | D10: 3 | E10: =C10*6+D10 -> 15 | G10: 8 | H10: 11 | I10: =G10*6+H10 -> 59 | K10: 9 | L10: 13 | M10: =K10*6+L10 -> 67 | O10: 16 | P10: 18 | Q10: =O10*6+P10 -> 114 | S10: UMPIRE | X10: LADDER | AB10: ROUND | AD10: 1 | CB10: {GOTO}BJ43~/M{RIGHT 7}{END}{DOWN}~G24~
A11: MORDIALLOC | C11: 1 | D11: 4 | E11: =C11*6+D11 -> 10 | G11: 1 | H11: 4 | I11: =G11*6+H11 -> 10 | K11: 2 | L11: 7 | M11: =K11*6+L11 -> 19 | O11: 2 | P11: 9 | Q11: =O11*6+P11 -> 21 | S11: McMASTER | CB11: {GOTO}AL23~/M{END}{RIGHT}{END}{DOWN}~P23~
A12: BEST PLAYERS | W12: TEAM | X12: W | Y12: L | Z12: D | AA12: FOR | AB12: AGST | AC12: % | AD12: PTS | CB12: {GOTO}BJ63~/M{RIGHT 7}{END}{DOWN}~V24~
A13: MOORABBIN | C13: MILLS | F13: PAPLEY | I13: BOYD | K13: MANIE | N13: WHALEBONE | Q13: SEARLE | CB13: {GOTO}BJ83~/M{RIGHT 7}{END}{DOWN}~G44~
A14: MORDIALLOC | C14: DULLARD | F14: BESANKO | I14: BURGE | K14: MAUNDER | N14: LE DEUX | Q14: WILLIAMSON | W14: MOORABBIN | X14: 1 | Y14: 0 | Z14: 0 | AA14: 114 | AB14: 21 | AC14: 542.85714285714289 | AD14: 4 | CB14: {GOTO}AL43~/M{END}{RIGHT}{END}{DOWN}~P43~
A15: GOALKICKERS | W15: COBURG | X15: 1 | Y15: 0 | Z15: 0 | AA15: 51 | AB15: 22 | AC15: 231.81818181818181 | AD15: 4 | CB15: {GOTO}BJ103~/M{RIGHT 7}{END}{DOWN}~V44~
A16: MOORABBIN | C16: PAPLEY 7 | F16: WHALEBONE 3 | I16: MANIE 2 | K16: KUPSCH 2 | M16: RYAN | N16: WILDE | W16: SANDRINGHAM | X16: 1 | Y16: 0 | Z16: 0 | AA16: 112 | AB16: 64 | AC16: 175 | AD16: 4 | CB16: {GOTO}BJ123~/M{RIGHT 7}{END}{DOWN}~G64~
A17: MORDIALLOC | C17: R JOYCE | F17: MINAHAN | W17: PORT MELBOURNE | X17: 1 | Y17: 0 | Z17: 0 | AA17: 82 | AB17: 78 | AC17: 105.12820512820512 | AD17: 4 | CB17: {GOTO}AL63~/M{END}{RIGHT}{END}{DOWN}~P63~
CB18: {GOTO}BJ143~/M{RIGHT 7}{END}{DOWN}~V64~
A19: PORT MELBOURNE | C19: 2 | D19: 5 | E19: =C19*6+D19 -> 17 | G19: 6 | H19: 9 | I19: =G19*6+H19 -> 45 | K19: 11 | L19: 13 | M19: =K19*6+L19 -> 79 | O19: 11 | P19: 16 | Q19: =O19*6+P19 -> 82 | S19: PORT MELBOURNE | W19: WILLIAMSTOWN | X19: 1 | Y19: 0 | Z19: 0 | AA19: 73 | AB19: 71 | AC19: 102.8169014084507 | AD19: 4 | CB19: {GOTO}BJ163~/M{RIGHT 7}{END}{DOWN}~G84~
A20: BOX HILL | C20: 4 | D20: 1 | E20: =C20*6+D20 -> 25 | G20: 8 | H20: 4 | I20: =G20*6+H20 -> 52 | K20: 10 | L20: 4 | M20: =K20*6+L20 -> 64 | O20: 12 | P20: 6 | Q20: =O20*6+P20 -> 78 | S20: MILLEN | W20: YARRAVILLE | X20: 0 | Y20: 1 | Z20: 0 | AA20: 71 | AB20: 73 | AC20: 97.260273972602747 | AD20: 0 | CB20: {GOTO}AL83~/M{END}{RIGHT}{END}{DOWN}~P83~
A21: BEST PLAYERS | W21: BOX HILL | X21: 0 | Y21: 1 | Z21: 0 | AA21: 78 | AB21: 82 | AC21: 95.121951219512198 | AD21: 0 | CB21: {GOTO}BJ183~/M{RIGHT 7}{END}{DOWN}~V84~
A22: PORT MELBOURNE | C22: CLAXTON | F22: McLEOD | I22: LEWIS | K22: BONNETT | N22: BOWEN | Q22: STRAUCH | W22: OAKLEIGH | X22: 0 | Y22: 1 | Z22: 0 | AA22: 64 | AB22: 112 | AC22: 57.142857142857146 | AD22: 0 | CB22: {GOTO}BJ203~/M{RIGHT 7}{END}{DOWN}~G104~
A23: BOX HILL | C23: BEASY | F23: HALIT | I23: GRAY | K23: EADE | N23: CHEFFERS | W23: BRUNSWICK | X23: 0 | Y23: 1 | Z23: 0 | AA23: 22 | AB23: 51 | AC23: 43.137254901960787 | AD23: 0 | CB23: {GOTO}AL103~/M{END}{RIGHT}{END}{DOWN}~P103~
A24: GOALKICKERS | W24: MORDIALLOC | X24: 0 | Y24: 1 | Z24: 0 | AA24: 21 | AB24: 114 | AC24: 18.421052631578949 | AD24: 0 | CB24: {GOTO}BJ223~/M{RIGHT 7}{END}{DOWN}~V104~
A25: PORT MELBOURNE | C25: CLAXTON 4 | F25: BONNETT 4 | I25: McLEOD 2 | L25: MONKS | CB25: {GOTO}BJ243~/M{RIGHT 7}{END}{DOWN}~G124~
A26: BOX HILL | C26: WHITE 2 | F26: SALVADO 2 | I26: HALIT 2 | K26: EADE 2 | M26: CHEFFERS 2 | P26: BEASY | R26: GLARE | CB26: {GOTO}AL123~/M{END}{RIGHT}{END}{DOWN}~P123~
CB27: {GOTO}BJ263~/M{RIGHT 7}{END}{DOWN}~V124~
A28: SANDRINGHAM | C28: 3 | D28: 0 | E28: =C28*6+D28 -> 18 | G28: 7 | H28: 8 | I28: =G28*6+H28 -> 50 | K28: 10 | L28: 9 | M28: =K28*6+L28 -> 69 | O28: 16 | P28: 16 | Q28: =O28*6+P28 -> 112 | S28: OAKLEIGH | CB28: {GOTO}BJ283~/M{RIGHT 7}{END}{DOWN}~G144~
A29: OAKLEIGH | C29: 3 | D29: 2 | E29: =C29*6+D29 -> 20 | G29: 3 | H29: 9 | I29: =G29*6+H29 -> 27 | K29: 7 | L29: 16 | M29: =K29*6+L29 -> 58 | O29: 8 | P29: 16 | Q29: =O29*6+P29 -> 64 | S29: ALLEN | CB29: {GOTO}AL143~/M{END}{RIGHT}{END}{DOWN}~P143~
A30: BEST PLAYERS | CB30: {GOTO}BJ303~/M{RIGHT 7}{END}{DOWN}~V144~
A31: SANDRINGHAM | C31: BOLAND | F31: EVANS | I31: JONES | L31: PELUSO | O31: SHEERAN | R31: KELTON | CB31: {GOTO}BJ323~/M{RIGHT 7}{END}{DOWN}~G164~
A32: OAKLEIGH | C32: WARD | F32: KITTO | I32: COUGHLAN | L32: BUCKLEY | O32: PEAKE | R32: NAISMITH | CB32: {GOTO}AL163~/M{END}{RIGHT}{END}{DOWN}~P163~
A33: GOALKICKERS | CB33: {GOTO}BJ343~/M{RIGHT 7}{END}{DOWN}~V164~
A34: SANDRINGHAM | C34: EVANS 4 | F34: STRACHAN 4 | I34: BOUYER 2 | L34: MURRAY 2 | N34: SHEERAN | P34: MUTER | R34: ORWIN | T34: WEBSTER | CB34: {GOTO}BJ363~/M{RIGHT 7}{END}{DOWN}~G184~
A35: OAKLEIGH | C35: COUGHLAN 4 | F35: KITTO | H35: GIBSON | J35: D'ARCY | L35: WILLIAMS | CB35: {GOTO}AL183~/M{END}{RIGHT}{END}{DOWN}~P183~
CB36: {GOTO}BJ383~/M{RIGHT 7}{END}{DOWN}~V184~
A37: WILLIAMSTOWN | C37: 1 | D37: 2 | E37: =C37*6+D37 -> 8 | G37: 3 | H37: 4 | I37: =G37*6+H37 -> 22 | K37: 9 | L37: 5 | M37: =K37*6+L37 -> 59 | O37: 11 | P37: 7 | Q37: =O37*6+P37 -> 73 | S37: YARRAVILLE | CB37: {GOTO}BJ403~/M{RIGHT 7}{END}{DOWN}~G204~
A38: YARRAVILLE | C38: 3 | D38: 4 | E38: =C38*6+D38 -> 22 | G38: 6 | H38: 6 | I38: =G38*6+H38 -> 42 | K38: 9 | L38: 9 | M38: =K38*6+L38 -> 63 | O38: 10 | P38: 11 | Q38: =O38*6+P38 -> 71 | S38: BEARD | CB38: {GOTO}AL203~/M{END}{RIGHT}{END}{DOWN}~P203~
A39: BEST PLAYERS | CB39: {GOTO}BJ423~/M{RIGHT 7}{END}{DOWN}~V204~
A40: WILLIAMSTOWN | C40: EVANS | F40: COLLINS | I40: CARMICHAEL | L40: BOB JONES | O40: SMITH | Q40: CLOUGH | CB40: {HOME}
A41: YARRAVILLE | C41: WHITTEN | F41: McDONALD | I41: MEDDINGS | L41: McTAGGART | O41: BOURKE | Q41: CRAIG
A42: GOALKICKERS
A43: WILLIAMSTOWN | C43: COLLINS 3 | F43: HILL 2 | H43: MAZOURIS 2 | K43: MURPHY | M43: JAMES | O43: SMITH | Q43: CLOUGH
A44: YARRAVILLE | C44: MEDDINGS 6 | F44: CAREY 2 | I44: McCARTHY | L44: McDONALD
E45: 16TH APRIL
A46: COBURG | C46: 1 | D46: 2 | E46: =C46*6+D46 -> 8 | G46: 1 | H46: 3 | I46: =G46*6+H46 -> 9 | K46: 7 | L46: 8 | M46: =K46*6+L46 -> 50 | O46: 7 | P46: 9 | Q46: =O46*6+P46 -> 51 | S46: BRUNSWICK
A47: BRUNSWICK | C47: 1 | D47: 2 | E47: =C47*6+D47 -> 8 | G47: 2 | H47: 4 | I47: =G47*6+H47 -> 16 | K47: 2 | L47: 4 | M47: =K47*6+L47 -> 16 | O47: 3 | P47: 4 | Q47: =O47*6+P47 -> 22 | S47: POLLARD
A48: BEST PLAYERS
A49: COBURG | C49: JORDAN | F49: CARR | I49: CLARKSON | L49: BEVILACQUA | O49: YOUNG | Q49: SHAW
A50: BRUNSWICK | C50: WHILEY | F50: J EDWARDS | I50: JOHNSON | L50: DENTON | O50: RYAN | Q50: BUTLER
A51: GOALKICKERS
A52: COBURG | C52: BEVILACQUA 3 | F52: CARR | H52: FINDLAY | J52: COLBERT | L52: SHAW
A53: BRUNSWICK | C53: McMAHON | F53: BUTLER | I53: McKENNA
A55: ROUND 2 | E55: 22ND APRIL | J55: WEATHER | N55: NORTH WEST WIND | S55: PLAYED AT
D56: 1ST QTR | H56: 2ND QTR | L56: 3RD QTR | P56: FINAL | S56: BEACH ROAD
A57: PORT MELBOURNE | C57: 8 | D57: 7 | E57: =C57*6+D57 -> 55 | G57: 8 | H57: 9 | I57: =G57*6+H57 -> 57 | K57: 14 | L57: 17 | M57: =K57*6+L57 -> 101 | O57: 14 | P57: 17 | Q57: =O57*6+P57 -> 101 | S57: UMPIRE | X57: LADDER | AB57: ROUND | AD57: 2
A58: SANDRINGHAM | C58: 1 | D58: 2 | E58: =C58*6+D58 -> 8 | G58: 6 | H58: 4 | I58: =G58*6+H58 -> 40 | K58: 8 | L58: 7 | M58: =K58*6+L58 -> 55 | O58: 13 | P58: 20 | Q58: =O58*6+P58 -> 98 | S58: O'DONOGHUE
A59: BEST PLAYERS | W59: TEAM | X59: W | Y59: L | Z59: D | AA59: FOR | AB59: AGST | AC59: % | AD59: PTS
A60: PORT MELBOURNE | C60: BONNETT | F60: CAMERON | I60: CLAXTON | L60: CLAUSCEN | O60: McLEOD | R60: FURNESS
A61: SANDRINGHAM | C61: EVANS | F61: KELTON | I61: WEBSTER | L61: MURRAY | O61: SHRIVES | R61: RANSOM | W61: COBURG | X61: 2 | Y61: 0 | Z61: 0 | AA61: 160 | AB61: 100 | AC61: 160 | AD61: 8
A62: GOALKICKERS | W62: WILLIAMSTOWN | X62: 2 | Y62: 0 | Z62: 0 | AA62: 149 | AB62: 128 | AC62: 116.40625 | AD62: 8
A63: PORT MELBOURNE | C63: CLAXTON 5 | F63: BONNETT 5 | I63: McLEOD 2 | L63: CLAUSCEN | N63: CONWAY | W63: PORT MELBOURNE | X63: 2 | Y63: 0 | Z63: 0 | AA63: 183 | AB63: 176 | AC63: 103.97727272727273 | AD63: 8
A64: SANDRINGHAM | C64: EVANS 4 | F64: MURRAY 3 | I64: WEBSTER 2 | L64: ALLSOP | N64: RANSOM | P64: BARRAN | R64: BOUYER | W64: MOORABBIN | X64: 1 | Y64: 1 | Z64: 0 | AA64: 171 | AB64: 97 | AC64: 176.28865979381445 | AD64: 4
A66: WILLIAMSTOWN | C66: 1 | D66: 3 | E66: =C66*6+D66 -> 9 | G66: 5 | H66: 4 | I66: =G66*6+H66 -> 34 | K66: 10 | L66: 8 | M66: =K66*6+L66 -> 68 | O66: 11 | P66: 10 | Q66: =O66*6+P66 -> 76 | S66: WILLIAMSTOWN | W66: SANDRINGHAM | X66: 1 | Y66: 1 | Z66: 0 | AA66: 210 | AB66: 165 | AC66: 127.27272727272727 | AD66: 4
A67: MOORABBIN | C67: 1 | D67: 3 | E67: =C67*6+D67 -> 9 | G67: 3 | H67: 5 | I67: =G67*6+H67 -> 23 | K67: 3 | L67: 5 | M67: =K67*6+L67 -> 23 | O67: 8 | P67: 9 | Q67: =O67*6+P67 -> 57 | S67: MILLEN | W67: YARRAVILLE | X67: 1 | Y67: 1 | Z67: 0 | AA67: 151 | AB67: 152 | AC67: 99.34210526315789 | AD67: 4
A68: BEST PLAYERS | W68: BRUNSWICK | X68: 1 | Y68: 1 | Z68: 0 | AA68: 92 | AB68: 119 | AC68: 77.310924369747895 | AD68: 4
A69: WILLIAMSTOWN | C69: SMITH | F69: MALONEY | I69: WARD | L69: MURPHY | N69: HILL | Q69: MAZOURIS | W69: BOX HILL | X69: 0 | Y69: 2 | Z69: 0 | AA69: 146 | AB69: 152 | AC69: 96.05263157894737 | AD69: 0
A70: MOORABBIN | C70: GILDER | F70: CLARK | I70: APPLEY | L70: RYAN | N70: SHEPHERD | Q70: WHALEBONE | W70: OAKLEIGH | X70: 0 | Y70: 2 | Z70: 0 | AA70: 142 | AB70: 221 | AC70: 64.25339366515837 | AD70: 0
A71: GOALKICKERS | W71: MORDIALLOC | X71: 0 | Y71: 2 | Z71: 0 | AA71: 100 | AB71: 194 | AC71: 51.546391752577321 | AD71: 0
A72: WILLIAMSTOWN | C72: HILL 4 | F72: MURPHY 3 | I72: McASEY 2 | L72: JAMES | N72: MAZOURIS
A73: MOORABBIN | C73: PAPLEY 5 | F73: CRUTCHFIELD | I73: RYAN | K73: HIRST
A75: BRUNSWICK | C75: 2 | D75: 0 | E75: =C75*6+D75 -> 12 | G75: 5 | H75: 0 | I75: =G75*6+H75 -> 30 | K75: 8 | L75: 5 | M75: =K75*6+L75 -> 53 | O75: 10 | P75: 10 | Q75: =O75*6+P75 -> 70 | S75: BOX HILL
A76: BOX HILL | C76: 3 | D76: 6 | E76: =C76*6+D76 -> 24 | G76: 5 | H76: 10 | I76: =G76*6+H76 -> 40 | K76: 7 | L76: 12 | M76: =K76*6+L76 -> 54 | O76: 9 | P76: 14 | Q76: =O76*6+P76 -> 68 | S76: DIXON
A77: BEST PLAYERS
A78: BRUNSWICK | C78: CLEGG | F78: WHILEY | I78: R DILLON | L78: BIBBY | O78: AMBROSE | R78: RYAN
A79: BOX HILL | C79: BEASY | F79: BATCH | I79: WITTMER | L79: EADE | O79: WITNISH | R79: BATES
A80: GOALKICKERS
A81: BRUNSWICK | C81: AMBROSE 3 | F81: VELO 2 | H81: McMAHON | K81: BUTLER | M81: BIBBY | O81: DENTON | Q81: CLEGG
A82: BOX HILL | C82: SALVADO 3 | F82: BATES | H82: CLARE | J82: BEASY | L82: GRAY | N82: EADE | P82: BATCH
A84: YARRAVILLE | C84: 7 | D84: 9 | E84: =C84*6+D84 -> 51 | G84: 7 | H84: 10 | I84: =G84*6+H84 -> 52 | K84: 11 | L84: 13 | M84: =K84*6+L84 -> 79 | O84: 11 | P84: 14 | Q84: =O84*6+P84 -> 80 | S84: MORDIALLOC
A85: MORDIALLOC | C85: 0 | D85: 0 | E85: =C85*6+D85 -> 0 | G85: 5 | H85: 9 | I85: =G85*6+H85 -> 39 | K85: 5 | L85: 10 | M85: =K85*6+L85 -> 40 | O85: 10 | P85: 19 | Q85: =O85*6+P85 -> 79 | S85: TREWIN
A86: BEST PLAYERS
A87: MORDIALLOC | C87: MINAHAN | F87: ROBERTS | I87: DULLARD | L87: GILL | O87: NESBIT
A88: YARRAVILLE | C88: CROOK | F88: CAREY | I88: RON BROWN | L88: NARKIEWICZ | O88: McCARTHY | R88: McDONALD
A89: GOALKICKERS
A90: MORDIALLOC | C90: MINAHAN 2 | F90: GILL 2 | H90: PEARSON 2 | K90: NESBIT 2 | M90: DEAN | O90: BURGE
A91: YARRAVILLE | C91: ANDERSON 3 | F91: McCARTHY 3 | I91: RON BROWN 3 | L91: CLEGG | N91: CAREY
A93: COBURG | C93: 4 | D93: 9 | E93: =C93*6+D93 -> 33 | G93: 5 | H93: 12 | I93: =G93*6+H93 -> 42 | K93: 11 | L93: 16 | M93: =K93*6+L93 -> 82 | O93: 15 | P93: 19 | Q93: =O93*6+P93 -> 109 | S93: COBURG
A94: OAKLEIGH | C94: 0 | D94: 1 | E94: =C94*6+D94 -> 1 | G94: 3 | H94: 4 | I94: =G94*6+H94 -> 22 | K94: 8 | L94: 9 | M94: =K94*6+L94 -> 57 | O94: 11 | P94: 12 | Q94: =O94*6+P94 -> 78 | S94: BREWER
A95: BEST PLAYERS
A96: COBURG | C96: RICCI | F96: JORDAN | I96: SHAW | L96: KERR | O96: BEVILACQUA | R96: SHORT
A97: OAKLEIGH | C97: MULDOON | F97: D'ARCY | I97: COUGHALN | L97: PALMER | O97: PEAKE | R97: McKEOGH
A98: GOALKICKERS
A99: COBURG | C99: RICCI 5 | E99: KAYLL 2 | G99: BEVILACQUA 2 | J99: CARR 2 | L99: LYNCH | N99: KERR | P99: K O'BRIEN | R99: SHAW
A100: OAKLEIGH | C100: COUGHLAN 2 | F100: MULDOON 2 | I100: JONES | K100: GIBBON | M100: HALL | N100: McCOMBE | P100: VARNEY | R100: PALMER | T100: McKEOGH
A102: ROUND 3 | E102: 25TH APRIL | J102: WEATHER | M102: SOUTH WEST WIND SHOWERS | S102: PLAYED AT
D103: 1ST QTR | H103: 2ND QTR | L103: 3RD QTR | P103: FINAL | S103: PORT MELBOURNE
A104: WILLIAMSTOWN | C104: 4 | D104: 3 | E104: =C104*6+D104 -> 27 | G104: 7 | H104: 7 | I104: =G104*6+H104 -> 49 | K104: 10 | L104: 7 | M104: =K104*6+L104 -> 67 | O104: 13 | P104: 12 | Q104: =O104*6+P104 -> 90 | S104: UMPIRE | X104: LADDER | AB104: ROUND | AD104: 3
A105: PORT MELBOURNE | C105: 2 | D105: 2 | E105: =C105*6+D105 -> 14 | G105: 2 | H105: 3 | I105: =G105*6+H105 -> 15 | K105: 8 | L105: 8 | M105: =K105*6+L105 -> 56 | O105: 10 | P105: 12 | Q105: =O105*6+P105 -> 72 | S105: POLLARD
A106: BEST PLAYERS | W106: TEAM | X106: W | Y106: L | Z106: D | AA106: FOR | AB106: AGST | AC106: % | AD106: PTS
A107: WILLIAMSTOWN | C107: SMITH | F107: MAZOURIS | I107: MURPHY | L107: COLLINS | N107: TAUBE | Q107: BOB JONES
A108: PORT MELBOURNE | C108: CLAXTON | F108: LANDORFF | I108: COVENTRY | L108: LEWIS | N108: McMASTER | Q108: MCLEOD | W108: WILLIAMSTOWN | X108: 3 | Y108: 0 | Z108: 0 | AA108: 239 | AB108: 200 | AC108: 119.5 | AD108: 12
A109: GOALKICKERS | W109: COBURG | X109: 2 | Y109: 0 | Z109: 1 | AA109: 232 | AB109: 172 | AC109: 134.88372093023256 | AD109: 10
A110: WILLIAMSTOWN | C110: JAMES 4 | F110: COLLINS 3 | I110: MURPHY 2 | L110: MALONEY 2 | O110: MAZOURIS 2 | W110: MOORABBIN | X110: 2 | Y110: 1 | Z110: 0 | AA110: 257 | AB110: 171 | AC110: 150.29239766081872 | AD110: 8
A111: PORT MELBOURNE | C111: CLAXTON 4 | F111: BONNETT 4 | I111: LAWSON | K111: CONWAY | W111: YARRAVILLE | X111: 2 | Y111: 1 | Z111: 0 | AA111: 273 | AB111: 214 | AC111: 127.57009345794393 | AD111: 8
A113: MOORABBIN | C113: 2 | D113: 6 | E113: =C113*6+D113 -> 18 | G113: 4 | H113: 8 | I113: =G113*6+H113 -> 32 | K113: 6 | L113: 10 | M113: =K113*6+L113 -> 46 | O113: 12 | P113: 14 | Q113: =O113*6+P113 -> 86 | S113: M.C.G. | W113: PORT MELBOURNE | X113: 2 | Y113: 1 | Z113: 0 | AA113: 255 | AB113: 266 | AC113: 95.864661654135332 | AD113: 8
A114: SANDRINGHAM | C114: 1 | D114: 3 | E114: =C114*6+D114 -> 9 | G114: 4 | H114: 5 | I114: =G114*6+H114 -> 29 | K114: 6 | L114: 5 | M114: =K114*6+L114 -> 41 | O114: 11 | P114: 8 | Q114: =O114*6+P114 -> 74 | S114: O'DONOGHUE | W114: BRUNSWICK | X114: 2 | Y114: 1 | Z114: 0 | AA114: 183 | AB114: 209 | AC114: 87.56 | AD114: 8
A115: BEST PLAYERS | W115: SANDRINGHAM | X115: 1 | Y115: 2 | Z115: 0 | AA115: 284 | AB115: 251 | AC115: 113.14741035856574 | AD115: 4
A116: MOORABBIN | C116: GILDER | F116: MILLS | I116: BOYD | K116: SCHUBERT | N116: PAPLEY | Q116: WHALEBONE | W116: BOX HILL | X116: 0 | Y116: 2 | Z116: 1 | AA116: 218 | AB116: 224 | AC116: 97.321428571428569 | AD116: 2
A117: SANDRINGHAM | C117: BOLAND | F117: EVANS | I117: SHRIVES | K117: WEBSTER | N117: RICHARDS | Q117: MURRAY | W117: MORDIALLOC | X117: 0 | Y117: 3 | Z117: 0 | AA117: 190 | AB117: 285 | AC117: 66.67 | AD117: 0
A118: GOALKICKERS | W118: OAKLEIGH | X118: 0 | Y118: 3 | Z118: 0 | AA118: 204 | AB118: 343 | AC118: 59.475218658892125 | AD118: 0
A119: MOORABBIN | C119: PAPLEY 5 | F119: RYAN 2 | I119: SCHUBERT 2 | L119: HIRST | N119: WHALEBONE | Q119: WALTERS
A120: SANDRINGHAM | C120: OAKLEY 3 | F120: WEBSTER 3 | I120: RICHARDS 2 | L120: MURRAY | N120: GLEESON | Q120: EVANS
A122: YARRAVILLE | C122: 4 | D122: 8 | E122: =C122*6+D122 -> 32 | G122: 7 | H122: 8 | I122: =G122*6+H122 -> 50 | K122: 12 | L122: 11 | M122: =K122*6+L122 -> 83 | O122: 18 | P122: 14 | Q122: =O122*6+P122 -> 122 | S122: YARRAVILLE
A123: OAKLEIGH | C123: 1 | D123: 1 | E123: =C123*6+D123 -> 7 | G123: 5 | H123: 4 | I123: =G123*6+H123 -> 34 | K123: 7 | L123: 6 | M123: =K123*6+L123 -> 48 | O123: 9 | P123: 8 | Q123: =O123*6+P123 -> 62 | S123: McMASTER
A124: BEST PLAYERS
A125: YARRAVILLE | C125: CROOK | F125: ORANGE | I125: CLEGG | L125: WHITTEN | N125: RON BROWN | Q125: CAREY
A126: OAKLEIGH | C126: DEFTEROUS | F126: COUGHLAN | I126: MULDOON | L126: HALL | N126: McCOOKE | Q126: D'ARCY
A127: GOALKICKERS
A128: YARRAVILLE | C128: CAREY 4 | F128: WHITTEN 3 | I128: ORANGE 3 | K128: CROOK 2 | M128: CLEGG 2 | O128: McCARTHY 2 | R128: LAMONT | U128: McDONALD
A129: OAKLEIGH | C129: D'ARCY 2 | F129: MULDOON 2 | I129: LONGNEY | K129: JEWELL | M129: ASH | O129: McKEOGH | Q129: COUGHLAN
A131: BRUNSWICK | C131: 5 | D131: 7 | E131: =C131*6+D131 -> 37 | G131: 6 | H131: 8 | I131: =G131*6+H131 -> 44 | K131: 12 | L131: 13 | M131: =K131*6+L131 -> 85 | O131: 13 | P131: 13 | Q131: =O131*6+P131 -> 91 | S131: MORDIALLOC
A132: MORDIALLOC | C132: 4 | D132: 2 | E132: =C132*6+D132 -> 26 | G132: 8 | H132: 7 | I132: =G132*6+H132 -> 55 | K132: 10 | L132: 8 | M132: =K132*6+L132 -> 68 | O132: 13 | P132: 12 | Q132: =O132*6+P132 -> 90 | S132: MILLEN
A133: BEST PLAYERS
A134: BRUNSWICK | C134: BIBBY | F134: RYAN | I134: CLEGG | L134: WHILEY | O134: AMBROSE | R134: WATT
A135: MORDIALLOC | C135: BURGE | F135: ROBERTS | I135: DEAN | L135: MINAHAN | O135: PEARSON | R135: RITCHIE
A136: GOALKICKERS
A137: BRUNSWICK | C137: BIBBY 4 | F137: AMBROSE 4 | I137: R EDWARDS 2 | L137: BUTLER | N137: MATTHEWS | Q137: RYAN
A138: MORDIALLOC | C138: BURGE 4 | F138: PEARSON 2 | I138: NESBIT 2 | K138: ROBERTS 2 | N138: GILL | P138: DEAN | R138: BESANKO
A140: BOX HILL | C140: 1 | D140: 6 | E140: =C140*6+D140 -> 12 | G140: 4 | H140: 7 | I140: =G140*6+H140 -> 31 | K140: 7 | L140: 9 | M140: =K140*6+L140 -> 51 | O140: 10 | P140: 12 | Q140: =O140*6+P140 -> 72 | S140: BOX HILL
A141: COBURG | C141: 4 | D141: 4 | E141: =C141*6+D141 -> 28 | G141: 6 | H141: 6 | I141: =G141*6+H141 -> 42 | K141: 8 | L141: 15 | M141: =K141*6+L141 -> 63 | O141: 9 | P141: 18 | Q141: =O141*6+P141 -> 72 | S141: BAIRD
A142: BEST PLAYERS
A143: BOX HILL | C143: BEASY | F143: CLARE | I143: LEHMAN | L143: EADE | N143: WHITE | Q143: SALVADO
A144: COBURG | C144: YOUNG | F144: RICCI | I144: JORDAN | L144: SHAW | N144: KERR | Q144: CARR
A145: GOALKICKERS
A146: BOX HILL | C146: SALVADO 4 | F146: SAWATSKY | I146: GRAY | K146: CLARE | M146: EADE | O146: WHITE | Q146: BAYES
A147: COBURG | C147: SHAW 3 | F147: CARR 2 | I147: BEVILACQUA | L147: JORDAN | N147: KAYLL | P147: RICCI
A149: ROUND 4 | E149: 29TH APRIL | J149: WEATHER | M149: NORTH WEST WIND FINE & SUNNY | S149: PLAYED AT
D150: 1ST QTR | H150: 2ND QTR | L150: 3RD QTR | P150: FINAL | S150: MOORABBIN
A151: MOORABBIN | C151: 0 | D151: 0 | E151: =C151*6+D151 -> 0 | G151: 4 | H151: 5 | I151: =G151*6+H151 -> 29 | K151: 6 | L151: 12 | M151: =K151*6+L151 -> 48 | O151: 9 | P151: 22 | Q151: =O151*6+P151 -> 76 | S151: UMPIRE | X151: LADDER | AB151: ROUND | AD151: 4
A152: PORT MELBOURNE | C152: 4 | D152: 5 | E152: =C152*6+D152 -> 29 | G152: 7 | H152: 6 | I152: =G152*6+H152 -> 48 | K152: 9 | L152: 10 | M152: =K152*6+L152 -> 64 | O152: 10 | P152: 10 | Q152: =O152*6+P152 -> 70 | S152: ROWE
A153: BEST PLAYERS | W153: TEAM | X153: W | Y153: L | Z153: D | AA153: FOR | AB153: AGST | AC153: % | AD153: PTS
A154: MOORABBIN | C154: HIRST | E154: SHEPHERD | H154: RYAN | K154: PAPLEY | N154: WHALEBONE | Q154: WILDIE
A155: PORT MELBOURNE | C155: McLEOD | E155: CAMERON | H155: CLAXTON | K155: COVENTRY | N155: MERRETT | Q155: BONNETT | W155: WILLIAMSTOWN | X155: 4 | Y155: 0 | Z155: 0 | AA155: 360 | AB155: 241 | AC155: 149.37759336099586 | AD155: 16
A156: GOALKICKERS | W156: MOORABBIN | X156: 3 | Y156: 1 | Z156: 0 | AA156: 333 | AB156: 241 | AC156: 138.17427385892117 | AD156: 12
A157: MOORABBIN | C157: PAPLEY 3 | F157: WHALEBONE 2 | J157: BILLSON 2 | M157: RYAN | O157: BUZZA | W157: YARRAVILLE | X157: 3 | Y157: 1 | Z157: 0 | AA157: 366 | AB157: 271 | AC157: 135.05535055350555 | AD157: 12
A158: PORT MELBOURNE | C158: CLAXTON 5 | F158: BONNETT 2 | I158: McLEOD | K158: MERRETT | M158: McRAE | W158: COBURG | X158: 2 | Y158: 1 | Z158: 1 | AA158: 289 | AB158: 265 | AC158: 109.05660377358491 | AD158: 10
A160: SANDRINGHAM | C160: 4 | D160: 2 | E160: =C160*6+D160 -> 26 | G160: 6 | H160: 3 | I160: =G160*6+H160 -> 39 | K160: 9 | L160: 6 | M160: =K160*6+L160 -> 60 | O160: 14 | P160: 13 | Q160: =O160*6+P160 -> 97 | S160: BRUNSWICK | W160: SANDRINGHAM | X160: 2 | Y160: 2 | Z160: 0 | AA160: 381 | AB160: 332 | AC160: 114.75903614457832 | AD160: 8
A161: BRUNSWICK | C161: 3 | D161: 4 | E161: =C161*6+D161 -> 22 | G161: 5 | H161: 9 | I161: =G161*6+H161 -> 39 | K161: 7 | L161: 14 | M161: =K161*6+L161 -> 56 | O161: 11 | P161: 15 | Q161: =O161*6+P161 -> 81 | S161: McMASTER | W161: PORT MELBOURNE | X161: 2 | Y161: 2 | Z161: 0 | AA161: 325 | AB161: 342 | AC161: 95.029239766081872 | AD161: 8
A162: BEST PLAYERS | W162: BRUNSWICK | X162: 2 | Y162: 2 | Z162: 0 | AA162: 264 | AB162: 306 | AC162: 86.27 | AD162: 8
A163: SANDRINGHAM | C163: STRACHAN | F163: BOLAND | I163: MURRAY | L163: OAKLEY | O163: SHRIVES | R163: RANSOM | W163: OAKLEIGH | X163: 1 | Y163: 3 | Z163: 0 | AA163: 286 | AB163: 401 | AC163: 71.321695760598502 | AD163: 4
A164: BRUNSWICK | C164: J EDWARDS | F164: WHILEY | I164: CLEGG | L164: BRENNAN | O164: R EDWARDS | R164: BUTLER | W164: BOX HILL | X164: 0 | Y164: 3 | Z164: 1 | AA164: 259 | AB164: 345 | AC164: 75.072463768115938 | AD164: 2
A165: GOALKICKERS | W165: MORDIALLOC | X165: 0 | Y165: 4 | Z165: 0 | AA165: 248 | AB165: 367 | AC165: 67.57 | AD165: 0
A166: SANDRINGHAM | C166: OAKLEY 6 | F166: MURRAY 2 | I166: GLEESON 2 | L166: STRACHAN | N166: McLEAN | P166: ALLSOP | R166: MURPHY
A167: BRUNSWICK | C167: AMBROSE 4 | F167: R EDWARDS 2 | I167: AYRES 2 | K167: BUTLER | M167: DENTON | O167: BIBBY
A169: OAKLEIGH | C169: 1 | D169: 6 | E169: =C169*6+D169 -> 12 | G169: 5 | H169: 9 | I169: =G169*6+H169 -> 39 | K169: 8 | L169: 12 | M169: =K169*6+L169 -> 60 | O169: 11 | P169: 16 | Q169: =O169*6+P169 -> 82 | S169: OAKLEIGH
A170: MORDIALLOC | C170: 2 | D170: 1 | E170: =C170*6+D170 -> 13 | G170: 6 | H170: 2 | I170: =G170*6+H170 -> 38 | K170: 7 | L170: 3 | M170: =K170*6+L170 -> 45 | O170: 9 | P170: 4 | Q170: =O170*6+P170 -> 58 | S170: DIXON
A171: BEST PLAYERS
A172: OAKLEIGH | C172: DEFTEROUS | F172: KITTO | I172: MULDOON | L172: RICCI | N172: BUCKLEY | Q172: COUGHLAN
A173: MORDIALLOC | C173: BLAINEY | F173: LE DEUX | I173: HORNE | L173: NESBIT | N173: GILL | Q173: R JOYCE
A174: GOALKICKERS
A175: OAKLEIGH | C175: RICCI 4 | F175: D HALL 3 | I175: COUGHLAN | L175: MULDOON | N175: McCOOKE | Q175: McGOWAN
A176: MORDIALLOC | C176: NESBIT 3 | F176: BURGE 3 | I176: SHEEHAN 2 | L176: GILL
A178: WILLIAMSTOWN | C178: 1 | D178: 4 | E178: =C178*6+D178 -> 10 | G178: 10 | H178: 9 | I178: =G178*6+H178 -> 69 | K178: 15 | L178: 13 | M178: =K178*6+L178 -> 103 | O178: 17 | P178: 19 | Q178: =O178*6+P178 -> 121 | S178: WILLIAMSTOWN
A179: BOX HILL | C179: 2 | D179: 4 | E179: =C179*6+D179 -> 16 | G179: 2 | H179: 4 | I179: =G179*6+H179 -> 16 | K179: 3 | L179: 5 | M179: =K179*6+L179 -> 23 | O179: 6 | P179: 5 | Q179: =O179*6+P179 -> 41 | S179: TREWIN
A180: BEST PLAYERS
A181: WILLIAMSTOWN | C181: SMITH | F181: MAZOURIS | I181: TAUBE | L181: JAMES | N181: PELLY | Q181: McASEY
A182: BOX HILL | C182: WHITE | F182: LEHMAN | I182: BAYES | L182: CLARE | N182: WITNISH | Q182: WITTMER
A183: GOALKICKERS
A184: WILLIAMSTOWN | C184: JAMES 5 | F184: PELLY 4 | H184: MAZOURIS 3 | K184: HILL 2 | M184: MALONEY | O184: MURPHY | Q184: COLLINS
A185: BOX HILL | C185: SALVADO 2 | F185: BAYES | H185: CLARE | J185: LE LIEVRE | M185: GRAY
E186: 30TH APRIL
A187: YARRAVILLE | C187: 4 | D187: 4 | E187: =C187*6+D187 -> 28 | G187: 7 | H187: 7 | I187: =G187*6+H187 -> 49 | K187: 10 | L187: 11 | M187: =K187*6+L187 -> 71 | O187: 13 | P187: 15 | Q187: =O187*6+P187 -> 93 | S187: COBURG
A188: COBURG | C188: 2 | D188: 2 | E188: =C188*6+D188 -> 14 | G188: 4 | H188: 3 | I188: =G188*6+H188 -> 27 | K188: 7 | L188: 7 | M188: =K188*6+L188 -> 49 | O188: 8 | P188: 9 | Q188: =O188*6+P188 -> 57 | S188: MILLEN
A189: BEST PLAYERS
A190: YARRAVILLE | C190: NARKIEWICZ | F190: WHITTEN | I190: MEDDINGS | L190: CLEGG | O190: BOB BROWN | R190: ORANGE
A191: COBURG | C191: CARR | F191: RICCI | I191: SHAW | L191: SULLIVAN | O191: FINDLAY | R191: CLARKSON
A192: GOALKICKERS
A193: YARRAVILLE | C193: MEDDINGS 7 | F193: WHITTEN 3 | I193: CLEGG | K193: RON BROWN | N193: McCARTHY
A194: COBURG | C194: FITZPATRICK 4 | F194: JORDAN | I194: CARR | K194: SHAW
A196: ROUND 5 | E196: 6TH MAY | K196: WEATHER | O196: FINE | S196: PLAYED AT
D197: 1ST QTR | H197: 2ND QTR | L197: 3RD QTR | P197: FINAL | S197: WILLIAMSTOWN
A198: YARRAVILLE | C198: 4 | D198: 5 | E198: =C198*6+D198 -> 29 | G198: 6 | H198: 6 | I198: =G198*6+H198 -> 42 | K198: 10 | L198: 10 | M198: =K198*6+L198 -> 70 | O198: 12 | P198: 13 | Q198: =O198*6+P198 -> 85 | S198: UMPIRE | X198: LADDER | AB198: ROUND | AD198: 5
A199: WILLIAMSTOWN | C199: 2 | D199: 1 | E199: =C199*6+D199 -> 13 | G199: 5 | H199: 8 | I199: =G199*6+H199 -> 38 | K199: 7 | L199: 10 | M199: =K199*6+L199 -> 52 | O199: 8 | P199: 13 | Q199: =O199*6+P199 -> 61 | S199: O'DONOGHUE
A200: BEST PLAYERS | W200: TEAM | X200: W | Y200: L | Z200: D | AA200: FOR | AB200: AGST | AC200: % | AD200: PTS
A201: YARRAVILLE | C201: RON BROWN | F201: WHITTEN | I201: CLEGG | L201: CROOK | N201: BOB BROWN | Q201: HOSKINGS
A202: WILLIAMSTOWN | C202: COLLINS | F202: PELLY | I202: McASEY | L202: TAUBE | N202: EVANS | Q202: FINCH | W202: MOORABBIN | X202: 4 | Y202: 1 | Z202: 0 | AA202: 470 | AB202: 279 | AC202: 168.45878136200716 | AD202: 16
A203: GOALKICKERS | W203: YARRAVILLE | X203: 4 | Y203: 1 | Z203: 0 | AA203: 451 | AB203: 332 | AC203: 135.84337349397592 | AD203: 16
A204: YARRAVILLE | C204: RON BROWN 4 | F204: McDONALD 2 | I204: CAREY 2 | K204: WHITTEN | M204: CLEGG | O204: EVANS | Q204: McGILL | W204: WILLIAMSTOWN | X204: 4 | Y204: 1 | Z204: 0 | AA204: 421 | AB204: 326 | AC204: 129.14110429447854 | AD204: 16
A205: WILLIAMSTOWN | C205: McASEY 2 | F205: MURPHY 2 | I205: JAMES | K205: COLLINS | M205: PELLY | O205: MAZOURIS | W205: COBURG | X205: 3 | Y205: 1 | Z205: 1 | AA205: 378 | AB205: 335 | AC205: 112.83582089552239 | AD205: 14
A207: SANDRINGHAM | C207: 5 | D207: 7 | E207: =C207*6+D207 -> 37 | G207: 8 | H207: 9 | I207: =G207*6+H207 -> 57 | K207: 11 | L207: 10 | M207: =K207*6+L207 -> 76 | O207: 13 | P207: 15 | Q207: =O207*6+P207 -> 93 | S207: MORDIALLOC | W207: SANDRINGHAM | X207: 3 | Y207: 2 | Z207: 0 | AA207: 474 | AB207: 389 | AC207: 121.85089974293059 | AD207: 12
A208: MORDIALLOC | C208: 1 | D208: 1 | E208: =C208*6+D208 -> 7 | G208: 4 | H208: 6 | I208: =G208*6+H208 -> 30 | K208: 6 | L208: 7 | M208: =K208*6+L208 -> 43 | O208: 8 | P208: 9 | Q208: =O208*6+P208 -> 57 | S208: BAIRD | W208: PORT MELBOURNE | X208: 3 | Y208: 2 | Z208: 0 | AA208: 431 | AB208: 433 | AC208: 99.53810623556582 | AD208: 12
A209: BEST PLAYERS | W209: BRUNSWICK | X209: 2 | Y209: 3 | Z209: 0 | AA209: 334 | AB209: 395 | AC209: 84.56 | AD209: 8
A210: SANDRINGHAM | C210: EVANS | F210: MURRAY | I210: PELUSO | L210: STRACHAN | O210: ALLSOP | Q210: RANSOM | W210: OAKLEIGH | X210: 1 | Y210: 4 | Z210: 0 | AA210: 377 | AB210: 507 | AC210: 74.358974358974365 | AD210: 4
A211: MORDIALLOC | C211: BESANKO | F211: LYONS | I211: WILLIAMS | L211: DULLARD | O211: BLAINEY | Q211: KAVANAGH | W211: BOX HILL | X211: 0 | Y211: 4 | Z211: 1 | AA211: 297 | AB211: 482 | AC211: 61.61825726141079 | AD211: 2
A212: GOALKICKERS | W212: MORDIALLOC | X212: 0 | Y212: 5 | Z212: 0 | AA212: 305 | AB212: 460 | AC212: 66.3 | AD212: 0
A213: SANDRINGHAM | C213: EVANS 3 | F213: ALLSOP 3 | I213: OAKLEY 2 | L213: MURRAY 2 | N213: MUTER 2 | Q213: GLEESON
A214: MORDIALLOC | C214: PEARSON 3 | F214: KAVANAGH 2 | I214: ROBERTS | K214: RITCHIE | M214: GILL
A216: MOORABBIN | C216: 7 | D216: 2 | E216: =C216*6+D216 -> 44 | G216: 10 | H216: 9 | I216: =G216*6+H216 -> 69 | K216: 11 | L216: 11 | M216: =K216*6+L216 -> 77 | O216: 20 | P216: 17 | Q216: =O216*6+P216 -> 137 | S216: MOORABBIN
A217: BOX HILL | C217: 1 | D217: 1 | E217: =C217*6+D217 -> 7 | G217: 2 | H217: 1 | I217: =G217*6+H217 -> 13 | K217: 5 | L217: 7 | M217: =K217*6+L217 -> 37 | O217: 5 | P217: 8 | Q217: =O217*6+P217 -> 38 | S217: SCOTT
A218: BEST PLAYERS
A219: MOORABBIN | C219: PAPLEY | F219: WHALEBONE | I219: KUPSCH | L219: WILDIE | O219: PAXTON | Q219: RYAN
A220: BOX HILL | C220: WITNISH | F220: LEHMAN | I220: WHITE | L220: SAWATSKY | O220: CLARE | Q220: EADE
A221: GOALKICKERS
A222: MOORABBIN | C222: PAPLEY 9 | F222: BILLSON 3 | I222: WHALEBONE 2 | L222: PAXTON 2 | N222: RYAN | P222: CRUTCHFIELD | S222: HOGAN | U222: HIRST
A223: BOX HILL | C223: SAWATSKY 2 | F223: GRAY | H223: SALVADO | J223: BAYES
E224: 7TH MAY
A225: COBURG | C225: 0 | D225: 3 | E225: =C225*6+D225 -> 3 | G225: 7 | H225: 5 | I225: =G225*6+H225 -> 47 | K225: 8 | L225: 9 | M225: =K225*6+L225 -> 57 | O225: 13 | P225: 11 | Q225: =O225*6+P225 -> 89 | S225: COBURG
A226: BRUNSWICK | C226: 2 | D226: 4 | E226: =C226*6+D226 -> 16 | G226: 5 | H226: 7 | I226: =G226*6+H226 -> 37 | K226: 7 | L226: 10 | M226: =K226*6+L226 -> 52 | O226: 10 | P226: 10 | Q226: =O226*6+P226 -> 70 | S226: TREWIN
A227: BEST PLAYERS
A228: COBURG | C228: BEVILACQUA | F228: JORDAN | I228: BRENNAN | L228: CARR | O228: McNABB | R228: O'BRIEN
A229: BRUNSWICK | C229: R DILLON | F229: JOHNSON | I229: DENTON | L229: AYRES | O229: BRENNAN | R229: WHILEY
A230: GOALKICKERS
A231: COBURG | C231: BRENNAN 4 | F231: BEVILACQUA 4 | J231: O'BRIEN 2 | M231: FITZPATRICK | P231: JORDAN | R231: CARR
A232: BRUNSWICK | C232: AMBROSE 4 | F232: DENTON 2 | I232: R EDWARDS | L232: MATTHEWS | O232: AYRES | Q232: BIBBY
A234: PORT MELBOURNE | C234: 6 | D234: 2 | E234: =C234*6+D234 -> 38 | G234: 7 | H234: 5 | I234: =G234*6+H234 -> 47 | K234: 11 | L234: 8 | M234: =K234*6+L234 -> 74 | O234: 16 | P234: 10 | Q234: =O234*6+P234 -> 106 | S234: PORT MELBOURNE
A235: OAKLEIGH | C235: 1 | D235: 1 | E235: =C235*6+D235 -> 7 | G235: 6 | H235: 7 | I235: =G235*6+H235 -> 43 | K235: 10 | L235: 11 | M235: =K235*6+L235 -> 71 | O235: 12 | P235: 19 | Q235: =O235*6+P235 -> 91 | S235: ALLEN
A236: BEST PLAYERS
A237: PORT MELBOURNE | C237: CAMERON | F237: MERRETT | I237: MONKS | L237: FREYER | O237: McLEOD | Q237: COVENTRY
A238: OAKLEIGH | C238: MULDOON | F238: RICCI | I238: McCOOKE | L238: COUGHLAN | O238: GIBBON | Q238: PEAKE
A239: GOALKICKERS
A240: PORT MELBOURNE | C240: MONKS 5 | F240: McLEOD 3 | I240: BONNETT 3 | L240: MERRETT 2 | O240: LAWSON | Q240: CLAXTON | S240: FREYER
A241: OAKLEIGH | C241: RICCI 5 | F241: GIBBON 3 | I241: MULDOON 2 | L241: COUGHLAN | O241: D'ARCY
A243: ROUND 6 | E243: 13TH MAY | J243: WEATHER | M243: NORTH BREEZE FINE & SUNNY | S243: PLAYED AT
D244: 1ST QTR | H244: 2ND QTR | L244: 3RD QTR | P244: FINAL | S244: YARRAVILLE
A245: MOORABBIN | C245: 1 | D245: 2 | E245: =C245*6+D245 -> 8 | G245: 6 | H245: 9 | I245: =G245*6+H245 -> 45 | K245: 7 | L245: 11 | M245: =K245*6+L245 -> 53 | O245: 10 | P245: 21 | Q245: =O245*6+P245 -> 81 | S245: UMPIRE | X245: LADDER | AB245: ROUND | AD245: 6
A246: YARRAVILLE | C246: 3 | D246: 5 | E246: =C246*6+D246 -> 23 | G246: 5 | H246: 8 | I246: =G246*6+H246 -> 38 | K246: 8 | L246: 12 | M246: =K246*6+L246 -> 60 | O246: 9 | P246: 13 | Q246: =O246*6+P246 -> 67 | S246: BAIRD
A247: BEST PLAYERS | W247: TEAM | X247: W | Y247: L | Z247: D | AA247: FOR | AB247: AGST | AC247: % | AD247: PTS
A248: MOORABBIN | C248: HENDERSON | F248: BUZZA | I248: RYAN | L248: GILDER | N248: HIRST | Q248: MANIE
A249: YARRAVILLE | C249: McTAGGART | F249: BOB BROWN | I249: HOSKINGS | L249: McGILL | N249: McCARTHY | Q249: RON BROWN | W249: MOORABBIN | X249: 5 | Y249: 1 | Z249: 0 | AA249: 551 | AB249: 346 | AC249: 159.24855491329481 | AD249: 20
A250: GOALKICKERS | W250: WILLIAMSTOWN | X250: 5 | Y250: 1 | Z250: 0 | AA250: 530 | AB250: 415 | AC250: 127.71084337349397 | AD250: 20
A251: MOORABBIN | C251: PAPLEY 3 | F251: HENDERSON 2 | I251: HIRST 2 | K251: CRUTCHFIELD | N251: HOGAN | P251: BILLSON | W251: SANDRINGHAM | X251: 4 | Y251: 2 | Z251: 0 | AA251: 593 | AB251: 454 | AC251: 130.61674008810573 | AD251: 16
A252: YARRAVILLE | C252: McDONALD 3 | F252: RON BROWN 2 | I252: WHITTEN | K252: BOURKE | M252: EVANS | O252: CLEGG | W252: YARRAVILLE | X252: 4 | Y252: 2 | Z252: 0 | AA252: 518 | AB252: 413 | AC252: 125.42372881355932 | AD252: 16
A254: SANDRINGHAM | C254: 2 | D254: 8 | E254: =C254*6+D254 -> 20 | G254: 5 | H254: 11 | I254: =G254*6+H254 -> 41 | K254: 14 | L254: 16 | M254: =K254*6+L254 -> 100 | O254: 16 | P254: 23 | Q254: =O254*6+P254 -> 119 | S254: BEACH ROAD | W254: PORT MELBOURNE | X254: 4 | Y254: 2 | Z254: 0 | AA254: 560 | AB254: 515 | AC254: 108.7378640776699 | AD254: 16
A255: COBURG | C255: 0 | D255: 1 | E255: =C255*6+D255 -> 1 | G255: 5 | H255: 2 | I255: =G255*6+H255 -> 32 | K255: 5 | L255: 6 | M255: =K255*6+L255 -> 36 | O255: 9 | P255: 11 | Q255: =O255*6+P255 -> 65 | S255: FISHER | W255: COBURG | X255: 3 | Y255: 2 | Z255: 1 | AA255: 443 | AB255: 454 | AC255: 97.57709251101322 | AD255: 14
A256: BEST PLAYERS | W256: BRUNSWICK | X256: 2 | Y256: 4 | Z256: 0 | AA256: 416 | AB256: 524 | AC256: 79.39 | AD256: 8
A257: SANDRINGHAM | C257: PELUSO | F257: MURRAY | I257: WEBSTER | L257: BOLAND | O257: JONES | Q257: ALLSOP | W257: MORDIALLOC | X257: 1 | Y257: 5 | Z257: 0 | AA257: 409 | AB257: 508 | AC257: 80.51 | AD257: 4
A258: COBURG | C258: JORDAN | F258: SHORT | I258: CARR | L258: HUNTINGTON | O258: HOOGEN | Q258: McNABB | W258: OAKLEIGH | X258: 1 | Y258: 5 | Z258: 0 | AA258: 466 | AB258: 616 | AC258: 75.649350649350652 | AD258: 4
A259: GOALKICKERS | W259: BOX HILL | X259: 0 | Y259: 5 | Z259: 1 | AA259: 345 | AB259: 586 | AC259: 58.87372013651877 | AD259: 2
A260: SANDRINGHAM | C260: OAKLEY 6 | E260: ALLSOP 3 | G260: EVANS 2 | I260: STRACHAN | L260: RANSOM | N260: BURKE | P260: MUTER | R260: WEBSTER
A261: COBURG | C261: JORDAN 3 | F261: CARR 2 | H261: HUNTINGTON 2 | L261: SHAW | N261: FITZPATRICK
A263: MORDIALLOC | C263: 6 | D263: 10 | E263: =C263*6+D263 -> 46 | G263: 11 | H263: 13 | I263: =G263*6+H263 -> 79 | K263: 15 | L263: 13 | M263: =K263*6+L263 -> 103 | O263: 15 | P263: 14 | Q263: =O263*6+P263 -> 104 | S263: BOX HILL
A264: BOX HILL | C264: 0 | D264: 1 | E264: =C264*6+D264 -> 1 | G264: 2 | H264: 4 | I264: =G264*6+H264 -> 16 | K264: 4 | L264: 6 | M264: =K264*6+L264 -> 30 | O264: 6 | P264: 12 | Q264: =O264*6+P264 -> 48 | S264: O'DONOGHUE
A265: BEST PLAYERS
A266: MORDIALLOC | C266: BLAINEY | F266: BURKE | I266: KAVANAGH | L266: MINAHAN | O266: PEARSON | Q266: NESBIT
A267: BOX HILL | C267: BEASY | F267: WITNISH | I267: SAWATSKY | L267: CLARE | O267: CRAIG | Q267: SALVADO
A268: GOALKICKERS
A269: MORDIALLOC | C269: BURGE 6 | F269: KAVANAGH 2 | I269: PEARSON 2 | L269: MINAHAN 2 | O269: NESBIT | Q269: ROBRTS | S269: CRANE
A270: BOX HILL | C270: SAWTSKY 2 | F270: SALVADO 2 | I270: CLARE | K270: GUEST
A272: WILLIAMSTOWN | C272: 2 | D272: 3 | E272: =C272*6+D272 -> 15 | G272: 8 | H272: 5 | I272: =G272*6+H272 -> 53 | K272: 14 | L272: 5 | M272: =K272*6+L272 -> 89 | O272: 17 | P272: 7 | Q272: =O272*6+P272 -> 109 | S272: OAKLEIGH
A273: OAKLEIGH | C273: 3 | D273: 4 | E273: =C273*6+D273 -> 22 | G273: 6 | H273: 11 | I273: =G273*6+H273 -> 47 | K273: 10 | L273: 13 | M273: =K273*6+L273 -> 73 | O273: 12 | P273: 17 | Q273: =O273*6+P273 -> 89 | S273: WOOLFE
A274: BEST PLAYERS
A275: WILLIAMSTOWN | C275: SMITH | F275: MAZOURIS | I275: TAUBE | L275: EVANS | O275: COPE | Q275: WARD
A276: OAKLEIGH | C276: D'ARCY | F276: BOOTH | I276: RICCI | L276: GIBBON | O276: BEST | Q276: PEAKE
A277: GOALKICKERS
A278: WILLIAMSTOWN | C278: MAZOURIS 3 | F278: JAMES 3 | I278: MURPHY 2 | L278: COPE 2 | N278: WARD 2 | P278: McASEY | R278: COLLINS | T278: SMITH | V278: WILLIAMS
A279: OAKLEIGH | C279: GIBBON 5 | F279: RICCI 4 | I279: HALL 2 | L279: BEST
F280: 14TH MAY | I280: WEATHER | L280: FINE
A281: PORT MELBOURNE | C281: 3 | D281: 5 | E281: =C281*6+D281 -> 23 | G281: 7 | H281: 9 | I281: =G281*6+H281 -> 51 | K281: 13 | L281: 12 | M281: =K281*6+L281 -> 90 | O281: 19 | P281: 15 | Q281: =O281*6+P281 -> 129 | S281: BRUNSWICK
A282: BRUNSWICK | C282: 3 | D282: 2 | E282: =C282*6+D282 -> 20 | G282: 5 | H282: 7 | I282: =G282*6+H282 -> 37 | K282: 8 | L282: 7 | M282: =K282*6+L282 -> 55 | O282: 12 | P282: 10 | Q282: =O282*6+P282 -> 82 | S282: POLLARD
A283: BEST PLAYERS
A284: PORT MELBOURNE | C284: McLEOD | F284: BONNETT | I284: FREYER | L284: MONKS | O284: CAMERON | R284: BOWEN
A285: BRUNSWICK | C285: BIBBY | F285: MATTHEWS | I285: CLEGG | L285: WHILEY | O285: J EDWARDS | R285: DENTON
A286: GOALKICKERS
A287: PORT MELBOURNE | C287: BONNETT 9 | F287: MONKS 3 | I287: FREYER 3 | L287: CLAXTON 2 | O287: TAGGERT | Q287: STRAUCH
A288: BRUNSWICK | C288: BIBBY 3 | F288: CLEGG 3 | I288: STANLEY 3 | L288: MATTHEWS | O288: VELO | Q288: RYAN
A290: ROUND 7 | E290: 20TH MAY | J290: WEATHER | M290: NORTH WEST BREEZE FINE & SUNNY | S290: PLAYED AT
D291: 1ST QTR | H291: 2ND QTR | L291: 3RD QTR | P291: FINAL | S291: MOORABBIN
A292: SANDRINGHAM | C292: 0 | D292: 2 | E292: =C292*6+D292 -> 2 | G292: 3 | H292: 6 | I292: =G292*6+H292 -> 24 | K292: 8 | L292: 8 | M292: =K292*6+L292 -> 56 | O292: 12 | P292: 11 | Q292: =O292*6+P292 -> 83 | S292: UMPIRE | X292: LADDER | AB292: ROUND | AD292: 7
A293: MOORABBIN | C293: 3 | D293: 2 | E293: =C293*6+D293 -> 20 | G293: 5 | H293: 3 | I293: =G293*6+H293 -> 33 | K293: 8 | L293: 3 | M293: =K293*6+L293 -> 51 | O293: 11 | P293: 9 | Q293: =O293*6+P293 -> 75 | S293: TREWIN
A294: BEST PLAYERS | W294: TEAM | X294: W | Y294: L | Z294: D | AA294: FOR | AB294: AGST | AC294: % | AD294: PTS
A295: SANDRINGHAM | C295: STRACHAN | F295: SHRIVES | I295: BURKE | K295: OAKLEY | N295: WEBSTER | Q295: BOLAND
A296: MOORABBIN | C296: HENDERSON | F296: PAPLEY | I296: BUZZA | K296: CROSHER | N296: RYAN | Q296: MANIE | W296: WILLIAMSTOWN | X296: 6 | Y296: 1 | Z296: 0 | AA296: 636 | AB296: 473 | AC296: 134.46088794926004 | AD296: 24
A297: GOALKICKERS | W297: MOORABBIN | X297: 5 | Y297: 2 | Z297: 0 | AA297: 626 | AB297: 429 | AC297: 145.92074592074593 | AD297: 20
A298: SANDRINGHAM | C298: OAKLEY 5 | F298: WEBSTER 3 | I298: BURKE | K298: MURRAY | M298: MUTER | O298: STRACHAN | W298: YARRAVILLE | X298: 5 | Y298: 2 | Z298: 0 | AA298: 611 | AB298: 470 | AC298: 130 | AD298: 20
A299: MOORABBIN | C299: PAPLEY 5 | F299: HIRST 3 | I299: PAXTON | K299: CRAMERI | M299: BILLSON | W299: SANDRINGHAM | X299: 5 | Y299: 2 | Z299: 0 | AA299: 676 | AB299: 529 | AC299: 127.7882797731569 | AD299: 20
A301: YARRAVILLE | C301: 2 | D301: 1 | E301: =C301*6+D301 -> 13 | G301: 5 | H301: 6 | I301: =G301*6+H301 -> 36 | K301: 9 | L301: 7 | M301: =K301*6+L301 -> 61 | O301: 14 | P301: 9 | Q301: =O301*6+P301 -> 93 | S301: BRUNSWICK | W301: PORT MELBOURNE | X301: 5 | Y301: 2 | Z301: 0 | AA301: 674 | AB301: 590 | AC301: 114.23728813559322 | AD301: 20
A302: BRUNSWICK | C302: 2 | D302: 3 | E302: =C302*6+D302 -> 15 | G302: 2 | H302: 6 | I302: =G302*6+H302 -> 18 | K302: 5 | L302: 9 | M302: =K302*6+L302 -> 39 | O302: 7 | P302: 15 | Q302: =O302*6+P302 -> 57 | S302: DIXON | W302: COBURG | X302: 3 | Y302: 3 | Z302: 1 | AA302: 518 | AB302: 568 | AC302: 91.197183098591552 | AD302: 14
A303: BEST PLAYERS | W303: OAKLEIGH | X303: 2 | Y303: 5 | Z303: 0 | AA303: 573 | AB303: 710 | AC303: 80.704225352112672 | AD303: 8
A304: YARRAVILLE | C304: McTAGGART | F304: BOB BROWN | I304: MEDDINGS | L304: BOURKE | O304: McCARTHY | R304: EVANS | W304: BRUNSWICK | X304: 2 | Y304: 5 | Z304: 0 | AA304: 473 | AB304: 617 | AC304: 76.66 | AD304: 8
A305: BRUNSWICK | C305: R EDWARDS | F305: WILSON | I305: McPHERSON | L305: MATTHEWS | O305: DENTON | R305: WHILEY | W305: MORDIALLOC | X305: 1 | Y305: 6 | Z305: 0 | AA305: 467 | AB305: 614 | AC305: 76.06 | AD305: 4
A306: GOALKICKERS | W306: BOX HILL | X306: 0 | Y306: 6 | Z306: 1 | AA306: 439 | AB306: 693 | AC306: 63.347763347763347 | AD306: 2
A307: YARRAVILLE | C307: MEDDINGS 8 | F307: McCARTHY 3 | I307: McDONALD | L307: MASON | N307: HOSKINGS
A308: BRUNSWICK | C308: AMBROSE 2 | F308: G STANLEY | I308: McPHERSON | L308: BIBBY | N308: DENTON | Q308: CLEGG
A310: OAKLEIGH | C310: 4 | D310: 2 | E310: =C310*6+D310 -> 26 | G310: 11 | H310: 11 | I310: =G310*6+H310 -> 77 | K310: 12 | L310: 15 | M310: =K310*6+L310 -> 87 | O310: 14 | P310: 23 | Q310: =O310*6+P310 -> 107 | S310: BOX HILL
A311: BOX HILL | C311: 4 | D311: 4 | E311: =C311*6+D311 -> 28 | G311: 5 | H311: 4 | I311: =G311*6+H311 -> 34 | K311: 11 | L311: 10 | M311: =K311*6+L311 -> 76 | O311: 14 | P311: 10 | Q311: =O311*6+P311 -> 94 | S311: MILLEN
A312: BEST PLAYERS
A313: OAKLEIGH | C313: RICCI | E313: BOOTH | H313: COUGHLAN | K313: JEWELL | N313: KITTO | Q313: D'ARCY
A314: BOX HILL | C314: QUINN | E314: BEASY | H314: SAWATSKY | K314: BATCH | N314: RANDLES | Q314: SALVADO
A315: GOALKICKERS
A316: OAKLEIGH | C316: RICCI 6 | E316: COUGHLAN 3 | H316: KITTO 2 | J316: MULDOON | M316: HALL | N316: GIBBON
A317: BOX HILL | C317: QUINN 3 | F317: SALVADO 2 | I317: SAWATSKY 2 | L317: ANDREWS | N317: GRAY | P317: GUEST | R317: WHITE | T317: WITNISH | W317: BEASY | X317: EADE
A319: WILLIAMSTOWN | C319: 1 | D319: 3 | E319: =C319*6+D319 -> 9 | G319: 6 | H319: 7 | I319: =G319*6+H319 -> 43 | K319: 11 | L319: 13 | M319: =K319*6+L319 -> 79 | O319: 15 | P319: 16 | Q319: =O319*6+P319 -> 106 | S319: WILLIAMSTOWN
A320: MORDIALLOC | C320: 3 | D320: 0 | E320: =C320*6+D320 -> 18 | G320: 5 | H320: 3 | I320: =G320*6+H320 -> 33 | K320: 6 | L320: 7 | M320: =K320*6+L320 -> 43 | O320: 8 | P320: 10 | Q320: =O320*6+P320 -> 58 | S320: POLLARD
A321: BEST PLAYERS
A322: WILLIAMSTOWN | C322: WILLIAMS | F322: MAZOURIS | I322: EVANS | L322: FINCH | N322: CARMICHAEL | Q322: JAMES
A323: MORDIALLOC | C323: PEARSON | F323: BESANKO | I323: DULLARD | L323: HORNE | N323: MINAHAN | Q323: LYON
A324: GOALKICKERS
A325: WILLIAMSTOWN | C325: JAMES 4 | F325: MALONEY 3 | I325: WARD 3 | K325: MAZOURIS 3 | N325: SMITH | P325: COPE
A326: MORDIALLOC | C326: MINAHAN 2 | F326: BURGE 2 | I326: ROBERTS 2 | L326: PEARSON | N326: RITCHIE
E327: 21ST MAY
A328: PORT MELBOURNE | C328: 5 | D328: 1 | E328: =C328*6+D328 -> 31 | G328: 12 | H328: 8 | I328: =G328*6+H328 -> 80 | K328: 13 | L328: 8 | M328: =K328*6+L328 -> 86 | O328: 17 | P328: 12 | Q328: =O328*6+P328 -> 114 | S328: PORT MELBOURNE
A329: COBURG | C329: 1 | D329: 4 | E329: =C329*6+D329 -> 10 | G329: 1 | H329: 5 | I329: =G329*6+H329 -> 11 | K329: 8 | L329: 8 | M329: =K329*6+L329 -> 56 | O329: 11 | P329: 9 | Q329: =O329*6+P329 -> 75 | S329: WOOLFE
A330: BEST PLAYERS
A331: PORT MELBOURNE | C331: CLAXTON | F331: LEWIS | H331: COVENTRY | K331: BONNETT | N331: TAGGART | Q331: FREYER
A332: COBURG | C332: CLARKSON | F332: CARR | H332: SHAW | K332: HOOGEN | N332: FITZPATRICK | Q332: BRENNAN
A333: GOALKICKERS
A334: PORT MELBOURNE | C334: BONNETT 6 | F334: MONKS 4 | I334: CLAXTON 4 | L334: FREYER | N334: BOWEN | P334: TAGGART
A335: COBURG | C335: COLBERT 3 | F335: SHAW 2 | H335: CARR 2 | J335: BEVILACQUA | M335: FINDLAY | O335: JORDAN | Q335: BRENNAN
A337: ROUND 8 | E337: 27TH MAY | J337: WEATHER | N337: NORTH BREEZE LIGHT RAIN | S337: PLAYED AT
D338: 1ST QTR | H338: 2ND QTR | L338: 3RD QTR | P338: FINAL | S338: OAKLEIGH
A339: OAKLEIGH | C339: 3 | D339: 4 | E339: =C339*6+D339 -> 22 | G339: 5 | H339: 10 | I339: =G339*6+H339 -> 40 | K339: 8 | L339: 14 | M339: =K339*6+L339 -> 62 | O339: 13 | P339: 18 | Q339: =O339*6+P339 -> 96 | S339: UMPIRE | X339: LADDER | AB339: ROUND | AD339: 8
A340: BRUNSWICK | C340: 4 | D340: 5 | E340: =C340*6+D340 -> 29 | G340: 6 | H340: 7 | I340: =G340*6+H340 -> 43 | K340: 8 | L340: 10 | M340: =K340*6+L340 -> 58 | O340: 10 | P340: 11 | Q340: =O340*6+P340 -> 71 | S340: FISHER
A341: BEST PLAYERS | W341: TEAM | X341: W | Y341: L | Z341: D | AA341: FOR | AB341: AGST | AC341: % | AD341: PTS
A342: OAKLEIGH | C342: MULDOON | F342: GIBBON | I342: D'ARCY | L342: HAY | N342: BEST | Q342: JONES
A343: BRUNSWICK | C343: J EDWARDS | F343: AYRES | I343: DENTON | L343: WILSON | N343: THOMPSON | Q343: WHILEY | W343: MOORABBIN | X343: 6 | Y343: 2 | Z343: 0 | AA343: 752 | AB343: 525 | AC343: 143.23809523809524 | AD343: 24
A344: GOALKICKERS | W344: SANDRINGHAM | X344: 6 | Y344: 2 | Z344: 0 | AA344: 810 | AB344: 605 | AC344: 133.88429752066116 | AD344: 24
A345: OAKLEIGH | C345: GIBBON 4 | F345: BEST 3 | H345: MULDOON 2 | K345: RICCI | M345: KITTO | O345: COUGHLAN | R345: ASH | W345: WILLIAMSTOWN | X345: 6 | Y345: 2 | Z345: 0 | AA345: 712 | AB345: 557 | AC345: 127.82764811490125 | AD345: 24
A346: BRUNSWICK | C346: DENTON 3 | F346: BIBBY 2 | H346: STANLEY 2 | K346: MILLER | M346: AMBROSE | O346: WHILEY | W346: PORT MELBOURNE | X346: 6 | Y346: 2 | Z346: 0 | AA346: 743 | AB346: 643 | AC346: 115.55209953343702 | AD346: 24
A348: SANDRINGHAM | C348: 4 | D348: 1 | E348: =C348*6+D348 -> 25 | G348: 9 | H348: 8 | I348: =G348*6+H348 -> 62 | K348: 13 | L348: 10 | M348: =K348*6+L348 -> 88 | O348: 19 | P348: 20 | Q348: =O348*6+P348 -> 134 | S348: BEACH ROAD | W348: YARRAVILLE | X348: 5 | Y348: 3 | Z348: 0 | AA348: 664 | AB348: 539 | AC348: 123.19109461966605 | AD348: 20
A349: BOX HILL | C349: 5 | D349: 6 | E349: =C349*6+D349 -> 36 | G349: 8 | H349: 7 | I349: =G349*6+H349 -> 55 | K349: 11 | L349: 10 | M349: =K349*6+L349 -> 76 | O349: 11 | P349: 10 | Q349: =O349*6+P349 -> 76 | S349: ALLEN | W349: COBURG | X349: 4 | Y349: 3 | Z349: 1 | AA349: 602 | AB349: 644 | AC349: 93.478260869565219 | AD349: 18
A350: BEST PLAYERS | W350: OAKLEIGH | X350: 3 | Y350: 5 | Z350: 0 | AA350: 669 | AB350: 781 | AC350: 85.659411011523687 | AD350: 12
A351: SANDRINGHAM | C351: DAWSON | F351: SHRIVES | I351: STRACHAN | L351: OAKLEY | N351: WEBSTER | Q351: SHEERAN | W351: BRUNSWICK | X351: 2 | Y351: 6 | Z351: 0 | AA351: 544 | AB351: 713 | AC351: 76.3 | AD351: 8
A352: BOX HILL | C352: SALVADO | F352: WHITE | I352: WITNISH | L352: BEASY | N352: LEHMAN | Q352: REID | W352: MORDIALLOC | X352: 1 | Y352: 7 | Z352: 0 | AA352: 563 | AB352: 740 | AC352: 76.08 | AD352: 4
A353: GOALKICKERS | W353: BOX HILL | X353: 0 | Y353: 7 | Z353: 1 | AA353: 515 | AB353: 827 | AC353: 62.273276904474002 | AD353: 2
A354: SANDRINGHAM | C354: DAWSON 6 | F354: OAKLEY 5 | I354: WEBSTER 2 | L354: BEVERIDGE 2 | O354: STRACHAN 2 | R354: MUTER | T354: KELTON
A355: BOX HILL | C355: SALVADO 3 | F355: ANDREWS 2 | I355: REID 2 | K355: BLACKALL | M355: QUINN | O355: LE LIEVRE | Q355: WHITE
A357: MOORABBIN | C357: 3 | D357: 2 | E357: =C357*6+D357 -> 20 | G357: 8 | H357: 3 | I357: =G357*6+H357 -> 51 | K357: 12 | L357: 4 | M357: =K357*6+L357 -> 76 | O357: 20 | P357: 6 | Q357: =O357*6+P357 -> 126 | S357: MORDIALLOC
A358: MORDIALLOC | C358: 4 | D358: 4 | E358: =C358*6+D358 -> 28 | G358: 6 | H358: 7 | I358: =G358*6+H358 -> 43 | K358: 13 | L358: 9 | M358: =K358*6+L358 -> 87 | O358: 14 | P358: 12 | Q358: =O358*6+P358 -> 96 | S358: JOHNS
A359: BEST PLAYERS
A360: MOORABBIN | C360: SHEPHERD | F360: RYAN | I360: GILDER | L360: HENDERSON | O360: MILLS | Q360: PAPLEY
A361: MORDIALLOC | C361: PEARSON | F361: MINAHAN | I361: WILKINSON | L361: DULLARD | O361: RITCHIE | Q361: ROBERTS
A362: GOALKICKERS
A363: MOORABBIN | C363: PAPLEY 7 | E363: HENDERSON 3 | H363: ADAMSON 3 | K363: CRAMERI | M363: SHEPHERD | O363: RYAN | Q363: WHALEBONE | T363: KERR | V363: WALTERS | X363: MANIE
A364: MORDIALLOC | C364: PEARSON 5 | F364: WILKINSON 3 | I364: NESBIT 2 | K364: MINAHAN 2 | N364: ROBERTS | P364: GILL
E365: 28TH MAY
A366: PORT MELBOURNE | C366: 0 | D366: 1 | E366: =C366*6+D366 -> 1 | G366: 3 | H366: 3 | I366: =G366*6+H366 -> 21 | K366: 7 | L366: 5 | M366: =K366*6+L366 -> 47 | O366: 10 | P366: 9 | Q366: =O366*6+P366 -> 69 | S366: YARRAVILLE
A367: YARRAVILLE | C367: 2 | D367: 6 | E367: =C367*6+D367 -> 18 | G367: 3 | H367: 9 | I367: =G367*6+H367 -> 27 | K367: 3 | L367: 14 | M367: =K367*6+L367 -> 32 | O367: 6 | P367: 17 | Q367: =O367*6+P367 -> 53 | S367: TREWIN
A368: BEST PLAYERS
A369: PORT MELBOURNE | C369: STRAUCH | F369: CAMERON | I369: COVENTRY | L369: MONKS | O369: BONNETT | R369: FREYER
A370: YARRAVILLE | C370: McGILL | F370: WHITTEN | I370: CROOK | L370: BURNSIDE | O370: McCARTHY | R370: FLEMING
A371: GOALKICKERS
A372: PORT MELBOURNE | C372: BONNETT 4 | F372: MONKS 2 | I372: CLAXTON | K372: MERRETT | M372: FREYER | O372: JEFFREY
A373: YARRAVILLE | C373: BURNSIDE 2 | F373: McDONALD | I373: McCARTHY | L373: WHITTEN | O373: FLEMING
A375: COBURG | C375: 4 | D375: 5 | E375: =C375*6+D375 -> 29 | G375: 7 | H375: 7 | I375: =G375*6+H375 -> 49 | K375: 9 | L375: 9 | M375: =K375*6+L375 -> 63 | O375: 12 | P375: 12 | Q375: =O375*6+P375 -> 84 | S375: COBURG
A376: WILLIAMSTOWN | C376: 1 | D376: 3 | E376: =C376*6+D376 -> 9 | G376: 4 | H376: 8 | I376: =G376*6+H376 -> 32 | K376: 7 | L376: 10 | M376: =K376*6+L376 -> 52 | O376: 11 | P376: 10 | Q376: =O376*6+P376 -> 76 | S376: McMASTER
A377: BEST PLAYERS
A378: COBURG | C378: CARR | F378: JORDAN | I378: KERR | K378: SULLIVAN | N378: BRENNAN | Q378: FITZPATRICK
A379: WILLIAMSTOWN | C379: MALONEY | F379: MURPHY | I379: JAMES | K379: COPE | N379: CARMICHAEL | Q379: RUSSELL
A380: GOALKICKERS
A381: COBURG | C381: CARR 4 | F381: JORDAN 3 | I381: COLBERT 2 | L381: McNABB | N381: BEVILACQUA | Q381: RICCI
A382: WILLIAMSTOWN | C382: JAMES 5 | F382: MURPHY 4 | I382: MALONEY 2
A384: ROUND 9 | E384: 3RD JUNE | J384: WEATHER | N384: RAIN GROUNDS HEAVY | S384: PLAYED AT
D385: 1ST QTR | H385: 2ND QTR | L385: 3RD QTR | P385: FINAL | S385: WILLIAMSTOWN
A386: WILLIAMSTOWN | C386: 2 | D386: 2 | E386: =C386*6+D386 -> 14 | G386: 6 | H386: 7 | I386: =G386*6+H386 -> 43 | K386: 7 | L386: 10 | M386: =K386*6+L386 -> 52 | O386: 11 | P386: 17 | Q386: =O386*6+P386 -> 83 | S386: UMPIRE | X386: LADDER | AB386: ROUND | AD386: 9
A387: PORT MELBOURNE | C387: 2 | D387: 5 | E387: =C387*6+D387 -> 17 | G387: 4 | H387: 8 | I387: =G387*6+H387 -> 32 | K387: 5 | L387: 15 | M387: =K387*6+L387 -> 45 | O387: 7 | P387: 18 | Q387: =O387*6+P387 -> 60 | S387: MILLEN
A388: BEST PLAYERS | W388: TEAM | X388: W | Y388: L | Z388: D | AA388: FOR | AB388: AGST | AC388: % | AD388: PTS
A389: WILLIAMSTOWN | C389: JAMES | E389: MALONEY | H389: WILLIAMS | K389: MAZOURIS | N389: RUSSELL | Q389: CLOUGH
A390: PORT MELBOURNE | C390: FREYER | E390: CLAUSCEN | H390: LEWIS | K390: McRAE | N390: TAGGART | Q390: GREENWOOD | W390: MOORABBIN | X390: 7 | Y390: 2 | Z390: 0 | AA390: 862 | AB390: 614 | AC390: 140.39087947882737 | AD390: 28
A391: GOALKICKERS | W391: WILLIAMSTOWN | X391: 7 | Y391: 2 | Z391: 0 | AA391: 795 | AB391: 617 | AC391: 128.84927066450567 | AD391: 28
A392: WILLIAMSTOWN | C392: JAMES 3 | F392: MURPHY 3 | I392: WILLIAMS 2 | L392: MAZOURIS | N392: SMITH | Q392: MALONEY | W392: SANDRINGHAM | X392: 6 | Y392: 3 | Z392: 0 | AA392: 884 | AB392: 686 | AC392: 128.86297376093293 | AD392: 24
A393: PORT MELBOURNE | C393: BONNETT 3 | F393: STRAUCH | I393: MERRETT | K393: McRAE | M393: FREYER | W393: YARRAVILLE | X393: 6 | Y393: 3 | Z393: 0 | AA393: 745 | AB393: 613 | AC393: 121.53344208809135 | AD393: 24
A395: YARRAVILLE | C395: 2 | D395: 2 | E395: =C395*6+D395 -> 14 | G395: 4 | H395: 2 | I395: =G395*6+H395 -> 26 | K395: 9 | L395: 9 | M395: =K395*6+L395 -> 63 | O395: 12 | P395: 9 | Q395: =O395*6+P395 -> 81 | S395: YARRAVILLE | W395: PORT MELBOURNE | X395: 6 | Y395: 3 | Z395: 0 | AA395: 803 | AB395: 726 | AC395: 110.60606060606061 | AD395: 24
A396: SANDRINGHAM | C396: 2 | D396: 2 | E396: =C396*6+D396 -> 14 | G396: 5 | H396: 8 | I396: =G396*6+H396 -> 38 | K396: 5 | L396: 9 | M396: =K396*6+L396 -> 39 | O396: 10 | P396: 14 | Q396: =O396*6+P396 -> 74 | S396: WOOLFE | W396: COBURG | X396: 4 | Y396: 4 | Z396: 1 | AA396: 691 | AB396: 754 | AC396: 91.644562334217511 | AD396: 18
A397: BEST PLAYERS | W397: OAKLEIGH | X397: 4 | Y397: 5 | Z397: 0 | AA397: 802 | AB397: 824 | AC397: 97.330097087378647 | AD397: 16
A398: YARRAVILLE | C398: CROOK | E398: NARKIEWICZ | H398: LAMONT | K398: RON BROWN | N398: McCARTHY | Q398: MEDDINGS | W398: BRUNSWICK | X398: 3 | Y398: 6 | Z398: 0 | AA398: 642 | AB398: 779 | AC398: 82.41 | AD398: 12
A399: SANDRINGHAM | C399: SHRIVES | E399: DAWSON | H399: MUTER | K399: STRACHAN | N399: SHEERAN | Q399: BURKE | W399: MORDIALLOC | X399: 1 | Y399: 8 | Z399: 0 | AA399: 606 | AB399: 873 | AC399: 69.42 | AD399: 4
A400: GOALKICKERS | W400: BOX HILL | X400: 0 | Y400: 8 | Z400: 1 | AA400: 581 | AB400: 925 | AC400: 62.810810810810814 | AD400: 2
A401: YARRAVILLE | C401: MEDDINGS 4 | F401: WHITTEN 3 | I401: McCARTHY 2 | L401: CLEGG | N401: RON BROWN | Q401: WARWICK
A402: SANDRINGHAM | C402: DAWSON 4 | F402: STRACHAN 3 | I402: PELUSO | K402: OAKLEY | M402: MURRAY
A404: MOORABBIN | C404: 3 | D404: 2 | E404: =C404*6+D404 -> 20 | G404: 10 | H404: 7 | I404: =G404*6+H404 -> 67 | K404: 12 | L404: 11 | M404: =K404*6+L404 -> 83 | O404: 15 | P404: 20 | Q404: =O404*6+P404 -> 110 | S404: MOORABBIN
A405: COBURG | C405: 7 | D405: 4 | E405: =C405*6+D405 -> 46 | G405: 10 | H405: 5 | I405: =G405*6+H405 -> 65 | K405: 12 | L405: 9 | M405: =K405*6+L405 -> 81 | O405: 13 | P405: 11 | Q405: =O405*6+P405 -> 89 | S405: O'DONOGHUE
A406: BEST PLAYERS
A407: MOORABBIN | C407: ADAMSON | F407: CROSHER | I407: HENDERSON | L407: SHEPHERD | O407: SCHOFIELD | R407: WALTERS
A408: COBURG | C408: JORDAN | F408: SULLIVAN | I408: CARR | L408: RICCI | O408: COLBERT | R408: BRENNAN
A409: GOALKICKERS
A410: MOORABBIN | C410: SCHOFIELD 6 | F410: WHALEBONE 3 | I410: PAPLEY 2 | K410: ADAMSON 2 | N410: HENDERSON | Q410: CRAMERI
A411: COBURG | C411: JORDAN 4 | F411: CARR 3 | H411: COLBERT 3 | J411: O'BRIEN | L411: RICCI | N411: KERR
A413: OAKLEIGH | C413: 5 | D413: 2 | E413: =C413*6+D413 -> 32 | G413: 9 | H413: 11 | I413: =G413*6+H413 -> 65 | K413: 12 | L413: 12 | M413: =K413*6+L413 -> 84 | O413: 19 | P413: 19 | Q413: =O413*6+P413 -> 133 | S413: OAKLEIGH
A414: MORDIALLOC | C414: 3 | D414: 3 | E414: =C414*6+D414 -> 21 | G414: 3 | H414: 7 | I414: =G414*6+H414 -> 25 | K414: 4 | L414: 10 | M414: =K414*6+L414 -> 34 | O414: 5 | P414: 13 | Q414: =O414*6+P414 -> 43 | S414: ALLEN
A415: BEST PLAYERS
A416: OAKLEIGH | C416: CAMPBELL | F416: COUGHLAN | I416: JEWELL | L416: HALL | N416: WOOD | Q416: D'ARCY
A417: MORDIALLOC | C417: KAVANAGH | F417: BESANKO | I417: McHENRY | L417: HORNE | N417: GILL | Q417: BARR
A418: GOALKICKERS
A419: OAKLEIGH | C419: COUGHLAN 5 | F419: GIBBON 3 | I419: JEWELL 3 | K419: BEST 3 | M419: MULDOON 2 | P419: McCOOKE 2 | S419: RICCI
A420: MORDIALLOC | C420: McHENRY 3 | F420: KAVANAGH 2
A422: BRUNSWICK | C422: 5 | D422: 7 | E422: =C422*6+D422 -> 37 | G422: 8 | H422: 11 | I422: =G422*6+H422 -> 59 | K422: 13 | L422: 14 | M422: =K422*6+L422 -> 92 | O422: 14 | P422: 14 | Q422: =O422*6+P422 -> 98 | S422: BRUNSWICK
A423: BOX HILL | C423: 0 | D423: 2 | E423: =C423*6+D423 -> 2 | G423: 5 | H423: 4 | I423: =G423*6+H423 -> 34 | K423: 7 | L423: 4 | M423: =K423*6+L423 -> 46 | O423: 10 | P423: 6 | Q423: =O423*6+P423 -> 66 | S423: BAIRD
A424: BEST PLAYERS
A425: BRUNSWICK | C425: R EDWARDS | F425: STANLEY | I425: BIBBY | L425: DENTON | O425: VELO | Q425: JOHNSON
A426: BOX HILL | C426: WITNISH | F426: LEHMAN | I426: WHITE | L426: MAIN | O426: MACE | Q426: BEASY
A427: GOALKICKERS
A428: BRUNSWICK | C428: STANLEY 4 | F428: DENTON 3 | I428: CLEGG 2 | K428: R EDWARDS 2 | N428: WHILEY 2 | Q428: McPHERSON
A429: BOX HILL | C429: REID 4 | F429: WITNISH 3 | I429: SALVADO | K429: GUEST | M429: WHITE
A431: ROUND 10 | E431: 10TH JUNE | J431: WEATHER | M431: COLD & FOGGY | S431: PLAYED AT
D432: 1ST QTR | H432: 2ND QTR | L432: 3RD QTR | P432: FINAL | S432: PORT MELBOURNE
A433: PORT MELBOURNE | C433: 3 | D433: 2 | E433: =C433*6+D433 -> 20 | G433: 7 | H433: 10 | I433: =G433*6+H433 -> 52 | K433: 11 | L433: 12 | M433: =K433*6+L433 -> 78 | O433: 17 | P433: 14 | Q433: =O433*6+P433 -> 116 | S433: UMPIRE | X433: LADDER | AB433: ROUND | AD433: 10
A434: MOORABBIN | C434: 3 | D434: 3 | E434: =C434*6+D434 -> 21 | G434: 3 | H434: 5 | I434: =G434*6+H434 -> 23 | K434: 6 | L434: 7 | M434: =K434*6+L434 -> 43 | O434: 12 | P434: 10 | Q434: =O434*6+P434 -> 82 | S434: McMASTER
A435: BEST PLAYERS | W435: TEAM | X435: W | Y435: L | Z435: D | AA435: FOR | AB435: AGST | AC435: % | AD435: PTS
A436: PORT MELBOURNE | C436: McLEOD | F436: MERRETT | I436: CLAXTON | L436: STRAUCH | O436: McMASTER | R436: LEWIS
A437: MOORABBIN | C437: BUZZA | F437: RYAN | I437: HOY | L437: HOGAN | O437: ADAMSON | R437: CLARK | W437: WILLIAMSTOWN | X437: 8 | Y437: 2 | Z437: 0 | AA437: 884 | AB437: 685 | AC437: 129.05109489051094 | AD437: 32
A438: GOALKICKERS | W438: MOORABBIN | X438: 7 | Y438: 3 | Z438: 0 | AA438: 944 | AB438: 730 | AC438: 129.31506849315068 | AD438: 28
A439: PORT MELBOURNE | C439: BONNETT 8 | F439: CLAXTON 3 | I439: MERRETT 2 | L439: JEFFREY | N439: McMASTER | Q439: LAWSON | S439: MONKS | W439: SANDRINGHAM | X439: 7 | Y439: 3 | Z439: 0 | AA439: 982 | AB439: 771 | AC439: 127.36705577172503 | AD439: 28
A440: MOORABBIN | C440: HOGAN 3 | F440: SCHOFIELD 3 | I440: RYAN 2 | K440: ADAMSON 2 | N440: CHANDLER | Q440: CRAMERI | W440: YARRAVILLE | X440: 7 | Y440: 3 | Z440: 0 | AA440: 879 | AB440: 703 | AC440: 125.03556187766713 | AD440: 28
A442: COBURG | C442: 2 | D442: 7 | E442: =C442*6+D442 -> 19 | G442: 7 | H442: 9 | I442: =G442*6+H442 -> 51 | K442: 8 | L442: 14 | M442: =K442*6+L442 -> 62 | O442: 11 | P442: 17 | Q442: =O442*6+P442 -> 83 | S442: MORDIALLOC | W442: PORT MELBOURNE | X442: 7 | Y442: 3 | Z442: 0 | AA442: 919 | AB442: 808 | AC442: 113.73762376237623 | AD442: 28
A443: MORDIALLOC | C443: 3 | D443: 2 | E443: =C443*6+D443 -> 20 | G443: 7 | H443: 2 | I443: =G443*6+H443 -> 44 | K443: 11 | L443: 6 | M443: =K443*6+L443 -> 72 | O443: 12 | P443: 7 | Q443: =O443*6+P443 -> 79 | S443: MILLEN | W443: COBURG | X443: 5 | Y443: 4 | Z443: 1 | AA443: 774 | AB443: 833 | AC443: 92.917166866746697 | AD443: 22
A444: BEST PLAYERS | W444: OAKLEIGH | X444: 4 | Y444: 6 | Z444: 0 | AA444: 887 | AB444: 922 | AC444: 96.203904555314537 | AD444: 16
A445: COBURG | C445: TANCREDI | F445: RICCI | I445: SHORT | L445: SULLIVAN | O445: McNABB | R445: BRENNAN | W445: BRUNSWICK | X445: 3 | Y445: 7 | Z445: 0 | AA445: 710 | AB445: 868 | AC445: 81.8 | AD445: 12
A446: MORDIALLOC | C446: PEARSON | F446: NESBIT | I446: DULLARD | L446: GILL | O446: RITCHIE | R446: SHEEHAN | W446: MORDIALLOC | X446: 1 | Y446: 9 | Z446: 0 | AA446: 685 | AB446: 956 | AC446: 71.65 | AD446: 4
A447: GOALKICKERS | W447: BOX HILL | X447: 0 | Y447: 9 | Z447: 1 | AA447: 671 | AB447: 1059 | AC447: 63.361661945231347 | AD447: 2
A448: COBURG | C448: K L O'BRIEN 4 | F448: RICCI 3 | I448: K O'BRIEN 2 | L448: BEVILACQUA | O448: TEESE
A449: MORDIALLOC | C449: PEARSON 4 | F449: SHEAHAN 2 | I449: WILKINSON 2 | L449: McHENRY 2 | O449: CRAWFORD | R449: NESBIT
E450: 12TH JUNE | J450: WEATHER | N450: NORTH BREEZE FINE & SUNNY
A451: SANDRINGHAM | C451: 6 | D451: 3 | E451: =C451*6+D451 -> 39 | G451: 7 | H451: 4 | I451: =G451*6+H451 -> 46 | K451: 11 | L451: 11 | M451: =K451*6+L451 -> 77 | O451: 14 | P451: 14 | Q451: =O451*6+P451 -> 98 | S451: BEACH ROAD
A452: OAKLEIGH | C452: 2 | D452: 3 | E452: =C452*6+D452 -> 15 | G452: 10 | H452: 5 | I452: =G452*6+H452 -> 65 | K452: 10 | L452: 9 | M452: =K452*6+L452 -> 69 | O452: 12 | P452: 13 | Q452: =O452*6+P452 -> 85 | S452: BAIRD
A453: BEST PLAYERS
A454: SANDRINGHAM | C454: BEVERIDGE | F454: SHRIVES | I454: OAKLEY | L454: DAWSON | O454: BOLAND | R454: WEBSTER
A455: OAKLEIGH | C455: D'ARCY | F455: RICCI | I455: ASH | L455: PEAKE | O455: McCOOKE | R455: BEST
A456: GOALKICKERS
A457: SANDRINGHAM | C457: OAKLEY 4 | F457: BEVERIDGE 3 | I457: BRYAN 2 | K457: DAWSON 2 | N457: McLEAN | P457: BURKE | R457: McCORMACK
A458: OAKLEIGH | C458: RICCI 5 | F458: PILCHER 4 | I458: HALL | K458: ASH | M458: McCOOKE
A460: WILLIAMSTOWN | C460: 2 | D460: 4 | E460: =C460*6+D460 -> 16 | G460: 5 | H460: 7 | I460: =G460*6+H460 -> 37 | K460: 9 | L460: 11 | M460: =K460*6+L460 -> 65 | O460: 13 | P460: 11 | Q460: =O460*6+P460 -> 89 | S460: WILLIAMSTOWN
A461: BRUNSWICK | C461: 2 | D461: 2 | E461: =C461*6+D461 -> 14 | G461: 7 | H461: 3 | I461: =G461*6+H461 -> 45 | K461: 8 | L461: 5 | M461: =K461*6+L461 -> 53 | O461: 10 | P461: 8 | Q461: =O461*6+P461 -> 68 | S461: WOOLFE
A462: BEST PLAYERS
A463: WILLIAMSTOWN | C463: MAZOURIS | F463: MALONEY | I463: WARD | L463: CLOUGH | O463: McASEY | R463: JAMES
A464: BRUNSWICK | C464: JOHNSON | F464: VELO | I464: J EDWARDS | L464: MATTHEWS | O464: BIBBY | R464: BRENNAN
A465: GOALKICKERS
A466: WILLIAMSTOWN | C466: MAZOURIS 3 | F466: JAMES 3 | I466: McPHEE 2 | K466: WARD | M466: MURPHY | O466: BOB JONES | R466: CLOUGH | T466: MALONEY
A467: BRUNSWICK | C467: MATTHEWS 2 | F467: BIBBY 2 | I467: CLEGG 2 | K467: AMBROSE | M467: BUTLER | O467: R EDWARDS | R467: BRENNAN
A469: YARRAVILLE | C469: 1 | D469: 4 | E469: =C469*6+D469 -> 10 | G469: 5 | H469: 9 | I469: =G469*6+H469 -> 39 | K469: 15 | L469: 14 | M469: =K469*6+L469 -> 104 | O469: 19 | P469: 20 | Q469: =O469*6+P469 -> 134 | S469: BOX HILL
A470: BOX HILL | C470: 5 | D470: 1 | E470: =C470*6+D470 -> 31 | G470: 9 | H470: 3 | I470: =G470*6+H470 -> 57 | K470: 10 | L470: 4 | M470: =K470*6+L470 -> 64 | O470: 14 | P470: 6 | Q470: =O470*6+P470 -> 90 | S470: O'DONOGHUE
A471: BEST PLAYERS
A472: YARRAVILLE | C472: WHITTEN | F472: CLEGG | I472: McCARTHY | L472: WARWICK | O472: McTAGGART | R472: McDONALD
A473: BOX HILL | C473: WHITE | F473: BEASY | I473: WITTMER | L473: EADE | O473: LEHMAN | R473: REID
A474: GOALKICKERS
A475: YARRAVILLE | C475: WARWICK 5 | F475: McCARTHY 4 | I475: WHITTEN 3 | L475: McDONALD 2 | O475: RON BROWN | R475: CROOK | T475: FLEMING | W475: PEARCE | X475: LAMONT
A476: BOX HILL | C476: BEASY 3 | F476: SALVADO 2 | I476: HALIT 2 | K476: REID 2 | M476: WHITE | O476: GRAY | Q476: EADE | S476: ROCHOW | V476: GUEST
A478: ROUND 11 | E478: 17TH JUNE | K478: WEATHER | N478: WEST WIND SHOWERS | S478: PLAYED AT
D479: 1ST QTR | H479: 2ND QTR | L479: 3RD QTR | P479: FINAL | S479: MOORABBIN
A480: MOORABBIN | C480: 4 | D480: 1 | E480: =C480*6+D480 -> 25 | G480: 7 | H480: 3 | I480: =G480*6+H480 -> 45 | K480: 7 | L480: 7 | M480: =K480*6+L480 -> 49 | O480: 9 | P480: 9 | Q480: =O480*6+P480 -> 63 | S480: UMPIRE | X480: LADDER | AB480: ROUND | AD480: 11
A481: WILLIAMSTOWN | C481: 3 | D481: 5 | E481: =C481*6+D481 -> 23 | G481: 5 | H481: 5 | I481: =G481*6+H481 -> 35 | K481: 7 | L481: 13 | M481: =K481*6+L481 -> 55 | O481: 7 | P481: 16 | Q481: =O481*6+P481 -> 58 | S481: ALLEN
A482: BEST PLAYERS | W482: TEAM | X482: W | Y482: L | Z482: D | AA482: FOR | AB482: AGST | AC482: % | AD482: PTS
A483: MOORABBIN | C483: CLARK | F483: CROSHER | I483: MANIE | L483: GILDER | O483: BUZZA | R483: CRAMERI
A484: WILLIAMSTOWN | C484: COLLINS | F484: EVANS | I484: MALONEY | L484: RUSSELL | O484: MAZOURIS | R484: MURPHY | W484: MOORABBIN | X484: 8 | Y484: 3 | Z484: 0 | AA484: 1007 | AB484: 788 | AC484: 127.79187817258884 | AD484: 32
A485: GOALKICKERS | W485: WILLIAMSTOWN | X485: 8 | Y485: 3 | Z485: 0 | AA485: 942 | AB485: 748 | AC485: 125.93582887700535 | AD485: 32
A486: MOORABBIN | C486: ADAMSON 3 | F486: SCHOFIELD 3 | I486: MANIE 2 | L486: CLARK | W486: PORT MELBOURNE | X486: 8 | Y486: 3 | Z486: 0 | AA486: 1066 | AB486: 871 | AC486: 122.38805970149254 | AD486: 32
A487: WILLIAMSTOWN | C487: MALONEY 3 | F487: MURPHY | H487: MAZOURIS | K487: JAMES | M487: CLOUGH | W487: SANDRINGHAM | X487: 7 | Y487: 4 | Z487: 0 | AA487: 1070 | AB487: 860 | AC487: 124.41860465116279 | AD487: 28
A489: OAKLEIGH | C489: 5 | D489: 2 | E489: =C489*6+D489 -> 32 | G489: 6 | H489: 5 | I489: =G489*6+H489 -> 41 | K489: 12 | L489: 10 | M489: =K489*6+L489 -> 82 | O489: 15 | P489: 12 | Q489: =O489*6+P489 -> 102 | S489: OAKLEIGH | W489: YARRAVILLE | X489: 7 | Y489: 4 | Z489: 0 | AA489: 950 | AB489: 805 | AC489: 118.01242236024845 | AD489: 28
A490: YARRAVILLE | C490: 1 | D490: 2 | E490: =C490*6+D490 -> 8 | G490: 5 | H490: 8 | I490: =G490*6+H490 -> 38 | K490: 8 | L490: 9 | M490: =K490*6+L490 -> 57 | O490: 10 | P490: 11 | Q490: =O490*6+P490 -> 71 | S490: MARCY | W490: COBURG | X490: 6 | Y490: 4 | Z490: 1 | AA490: 917 | AB490: 874 | AC490: 104.91990846681922 | AD490: 26
A491: BEST PLAYERS | W491: OAKLEIGH | X491: 5 | Y491: 6 | Z491: 0 | AA491: 989 | AB491: 993 | AC491: 99.597180261832833 | AD491: 20
A492: OAKLEIGH | C492: JONES | F492: CAMPBELL | I492: COUGHLAN | L492: D'ARCY | O492: JEWELL | R492: McCOOKE | W492: BRUNSWICK | X492: 4 | Y492: 7 | Z492: 0 | AA492: 799 | AB492: 956 | AC492: 83.58 | AD492: 16
A493: YARRAVILLE | C493: RON BROWN | F493: McTAGGART | I493: CLEGG | L493: BOB BROWN | O493: WHITTEN | R493: MASON | W493: MORDIALLOC | X493: 1 | Y493: 10 | Z493: 0 | AA493: 748 | AB493: 1103 | AC493: 67.82 | AD493: 4
A494: GOALKICKERS | W494: BOX HILL | X494: 0 | Y494: 10 | Z494: 1 | AA494: 712 | AB494: 1202 | AC494: 59.234608985024956 | AD494: 2
A495: OAKLEIGH | C495: RICCI 5 | F495: JONES 3 | H495: PILCHER 2 | J495: COUGHLAN 2 | M495: KITTO | O495: McCOOKE | Q495: DEFTEROUS
A496: YARRAVILLE | C496: RON BROWN 3 | F496: WARWICK 2 | I496: McCARTHY 2 | L496: MEDDINGS 2 | O496: McDONALD
A498: BRUNSWICK | C498: 2 | D498: 3 | E498: =C498*6+D498 -> 15 | G498: 6 | H498: 10 | I498: =G498*6+H498 -> 46 | K498: 8 | L498: 11 | M498: =K498*6+L498 -> 59 | O498: 12 | P498: 17 | Q498: =O498*6+P498 -> 89 | S498: BRUNSWICK
A499: SANDRINGHAM | C499: 4 | D499: 7 | E499: =C499*6+D499 -> 31 | G499: 6 | H499: 7 | I499: =G499*6+H499 -> 43 | K499: 11 | L499: 15 | M499: =K499*6+L499 -> 81 | O499: 12 | P499: 16 | Q499: =O499*6+P499 -> 88 | S499: JOHNS
A500: BEST PLAYERS
A501: BRUNSWICK | C501: CLEGG | F501: J EDWARDS | I501: MATTHEWS | L501: WATT | O501: STANLEY | R501: BRENNAN
A502: SANDRINGHAM | C502: DAWSON | F502: BEVERIDGE | I502: MUTER | L502: HOAR | O502: STRACHAN | R502: WEBSTER
A503: GOALKICKERS
A504: BRUNSWICK | C504: AMBROSE 3 | F504: STANLEY 3 | I504: BRENNAN 2 | L504: CLEGG 2 | N504: McKENNA | Q504: WHILEY
A505: SANDRINGHAM | C505: DAWSON 3 | F505: OAKLEY 2 | I505: BEVERIDGE 2 | L505: STRACHAN 2 | O505: WEBSTER | Q505: MURRAY | S505: HOAR
A507: COBURG | C507: 4 | D507: 2 | E507: =C507*6+D507 -> 26 | G507: 11 | H507: 6 | I507: =G507*6+H507 -> 72 | K507: 16 | L507: 10 | M507: =K507*6+L507 -> 106 | O507: 22 | P507: 11 | Q507: =O507*6+P507 -> 143 | S507: COBURG
A508: BOX HILL | C508: 4 | D508: 3 | E508: =C508*6+D508 -> 27 | G508: 4 | H508: 5 | I508: =G508*6+H508 -> 29 | K508: 4 | L508: 5 | M508: =K508*6+L508 -> 29 | O508: 5 | P508: 11 | Q508: =O508*6+P508 -> 41 | S508: TREWIN
A509: BEST PLAYERS
A510: COBURG | C510: JORDAN | F510: RICCI | I510: SULLIVAN | L510: McNABB | O510: EDWARDS | R510: SHORT
A511: BOX HILL | C511: CRAIG | F511: WHITE | I511: LEHMAN | L511: GRAY | O511: BEASY | R511: EADE
A512: GOALKICKERS
A513: COBURG | C513: K L O'BRIEN 6 | F513: JORDAN 5 | I513: RICCI 4 | K513: EDWARDS 2 | N513: McNABB | P513: COLBERT | R513: KERR | T513: LYNCH | V513: NIGRO
A514: BOX HILL | C514: CHEFFERS 2 | F514: BEASY | I514: GRAY | K514: CHAPMAN
E515: 18TH JUNE | H515: WEATHER | K515: FINE
A516: PORT MELBOURNE | C516: 4 | D516: 6 | E516: =C516*6+D516 -> 30 | G516: 6 | H516: 9 | I516: =G516*6+H516 -> 45 | K516: 16 | L516: 15 | M516: =K516*6+L516 -> 111 | O516: 21 | P516: 21 | Q516: =O516*6+P516 -> 147 | S516: PORT MELBOURNE
A517: MORDIALLOC | C517: 2 | D517: 1 | E517: =C517*6+D517 -> 13 | G517: 6 | H517: 4 | I517: =G517*6+H517 -> 40 | K517: 6 | L517: 5 | M517: =K517*6+L517 -> 41 | O517: 9 | P517: 9 | Q517: =O517*6+P517 -> 63 | S517: BAIRD
A518: BEST PLAYERS
A519: PORT MELBOURNE | C519: BONNETT | F519: TAGGART | I519: CLAXTON | L519: STRAUCH | O519: K WHITE | R519: MONKS
A520: MORDIALLOC | C520: BARR | F520: PEARSON | I520: WILLIAMS | L520: CRAWFORD | O520: LE DEUX | R520: SHEAHAN
A521: GOALKICKERS
A522: PORT MELBOURNE | C522: BONNETT 8 | F522: CLAXTON 5 | I522: MONKS 3 | K522: TAGGART 2 | N522: McLEOD | Q522: MERRETT | S522: BOWEN
A523: MORDIALLOC | C523: PEARSON 4 | F523: CRAWFORD | I523: PETRIE | K523: WILKINSON | N523: McHENRY | Q523: WILLIS
A525: ROUND 12 | E525: 24TH JUNE | J525: WEATHER | M525: DULL NO WIND GROUNDS SLIPPERY | S525: PLAYED AT
D526: 1ST QTR | H526: 2ND QTR | L526: 3RD QTR | P526: FINAL | S526: BEACH ROAD
A527: SANDRINGHAM | C527: 5 | D527: 3 | E527: =C527*6+D527 -> 33 | G527: 10 | H527: 7 | I527: =G527*6+H527 -> 67 | K527: 11 | L527: 8 | M527: =K527*6+L527 -> 74 | O527: 14 | P527: 12 | Q527: =O527*6+P527 -> 96 | S527: UMPIRE | X527: LADDER | AB527: ROUND | AD527: 12
A528: PORT MELBOURNE | C528: 2 | D528: 4 | E528: =C528*6+D528 -> 16 | G528: 4 | H528: 10 | I528: =G528*6+H528 -> 34 | K528: 10 | L528: 14 | M528: =K528*6+L528 -> 74 | O528: 10 | P528: 18 | Q528: =O528*6+P528 -> 78 | S528: MARCY
A529: BEST PLAYERS | W529: TEAM | X529: W | Y529: L | Z529: D | AA529: FOR | AB529: AGST | AC529: % | AD529: PTS
A530: SANDRINGHAM | C530: WEBSTER | F530: McKENZIE | I530: PELUSO | L530: OAKLEY | O530: MURRAY | R530: MUSGROVE
A531: PORT MELBOURNE | C531: MONKS | F531: TAGGART | I531: McMASTER | L531: JEFFREY | O531: A CAMERON | R531: MERRETT | W531: SANDRINGHAM | X531: 8 | Y531: 4 | Z531: 0 | AA531: 1166 | AB531: 938 | AC531: 124.30703624733475 | AD531: 32
A532: GOALKICKERS | W532: MOORABBIN | X532: 8 | Y532: 4 | Z532: 0 | AA532: 1079 | AB532: 875 | AC532: 123.31428571428572 | AD532: 32
A533: SANDRINGHAM | C533: OAKLEY 7 | F533: DAWSON 2 | I533: PELUSO 2 | K533: ALLSOP | M533: SHEERAN | O533: MURRAY | W533: PORT MELBOURNE | X533: 8 | Y533: 4 | Z533: 0 | AA533: 1144 | AB533: 967 | AC533: 118.30403309203723 | AD533: 32
A534: PORT MELBOURNE | C534: MONKS 4 | F534: BONNETT 3 | I534: TAGGART 2 | L534: CLAXTON | W534: YARRAVILLE | X534: 8 | Y534: 4 | Z534: 0 | AA534: 1029 | AB534: 872 | AC534: 118.00458715596331 | AD534: 32
A536: OAKLEIGH | C536: 4 | D536: 5 | E536: =C536*6+D536 -> 29 | G536: 7 | H536: 6 | I536: =G536*6+H536 -> 48 | K536: 9 | L536: 8 | M536: =K536*6+L536 -> 62 | O536: 12 | P536: 15 | Q536: =O536*6+P536 -> 87 | S536: OAKLEIGH | W536: WILLIAMSTOWN | X536: 8 | Y536: 4 | Z536: 0 | AA536: 991 | AB536: 840 | AC536: 117.97619047619048 | AD536: 32
A537: MOORABBIN | C537: 3 | D537: 2 | E537: =C537*6+D537 -> 20 | G537: 4 | H537: 5 | I537: =G537*6+H537 -> 29 | K537: 9 | L537: 9 | M537: =K537*6+L537 -> 63 | O537: 10 | P537: 12 | Q537: =O537*6+P537 -> 72 | S537: O'DONOGHUE | W537: COBURG | X537: 6 | Y537: 5 | Z537: 1 | AA537: 984 | AB537: 953 | AC537: 103.25288562434417 | AD537: 26
A538: BEST PLAYERS | W538: OAKLEIGH | X538: 6 | Y538: 6 | Z538: 0 | AA538: 1076 | AB538: 1065 | AC538: 101.03286384976526 | AD538: 24
A539: OAKLEIGH | C539: COUGHLAN | F539: PEAKE | I539: D'ARCY | L539: RICCI | O539: KITTO | Q539: DEFTEROUS | W539: BRUNSWICK | X539: 5 | Y539: 7 | Z539: 0 | AA539: 882 | AB539: 1016 | AC539: 86.81 | AD539: 20
A540: MOORABBIN | C540: GILDER | F540: MILLS | I540: MANIE | L540: WHALEBONE | O540: HOY | Q540: SHEPHERD | W540: BOX HILL | X540: 1 | Y540: 10 | Z540: 1 | AA540: 804 | AB540: 1251 | AC540: 64.268585131894483 | AD540: 6
A541: GOALKICKERS | W541: MORDIALLOC | X541: 1 | Y541: 11 | Z541: 0 | AA541: 808 | AB541: 1186 | AC541: 68.13 | AD541: 4
A542: OAKLEIGH | C542: HALL 3 | F542: RICCI 3 | I542: COUGHLAN 2 | L542: JEWELL 2 | O542: JONES | Q542: KITTO
A543: MOORABBIN | C543: MANIE 3 | F543: HENDERSON 3 | I543: SCHOFIELD 2 | L543: PAPLEY | N543: ADAMSON
A545: BRUNSWICK | C545: 1 | D545: 2 | E545: =C545*6+D545 -> 8 | G545: 6 | H545: 6 | I545: =G545*6+H545 -> 42 | K545: 9 | L545: 10 | M545: =K545*6+L545 -> 64 | O545: 12 | P545: 11 | Q545: =O545*6+P545 -> 83 | S545: BRUNSWICK
A546: MORDIALLOC | C546: 3 | D546: 5 | E546: =C546*6+D546 -> 23 | G546: 3 | H546: 8 | I546: =G546*6+H546 -> 26 | K546: 5 | L546: 11 | M546: =K546*6+L546 -> 41 | O546: 8 | P546: 12 | Q546: =O546*6+P546 -> 60 | S546: TREWIN
A547: BEST PLAYERS
A548: BRUNSWICK | C548: BRENNAN | F548: R EDWARDS | I548: WHILEY | L548: J EDWARDS | O548: BIBBY | R548: MATTHEWS
A549: MORDIALLOC | C549: BLAINEY | F549: KAVANAGH | I549: NISBET | L549: BESANKO | O549: PEARSON | R549: CRAWFORD
A550: GOALKICKERS
A551: BRUNSWICK | C551: WHILEY 4 | F551: BRENNAN 2 | I551: MATTHEWS 2 | L551: DENTON | N551: BIBBY | P551: R EDWARDS | S551: AMBROSE
A552: MORDIALLOC | C552: NESBIT 3 | F552: KAVANAGH 2 | I552: BURGE 2 | K552: CRAWFORD
A554: BOX HILL | C554: 4 | D554: 6 | E554: =C554*6+D554 -> 30 | G554: 8 | H554: 9 | I554: =G554*6+H554 -> 57 | K554: 12 | L554: 10 | M554: =K554*6+L554 -> 82 | O554: 13 | P554: 14 | Q554: =O554*6+P554 -> 92 | S554: BOX HILL
A555: WILLIAMSTOWN | C555: 1 | D555: 2 | E555: =C555*6+D555 -> 8 | G555: 3 | H555: 4 | I555: =G555*6+H555 -> 22 | K555: 4 | L555: 4 | M555: =K555*6+L555 -> 28 | O555: 7 | P555: 7 | Q555: =O555*6+P555 -> 49 | S555: JACKSON
A556: BEST PLAYERS
A557: BOX HILL | C557: BEASY | F557: WHITE | I557: CRAIG | L557: BATCH | O557: CHEFFERS | R557: WITTMER
A558: WILLIAMSTOWN | C558: CARMICHAEL | F558: MAZOURIS | I558: COLLINS | L558: WARD | O558: SMITH | R558: COPE
A559: GOALKICKERS
A560: BOX HILL | C560: BARNES 4 | F560: WHITE 3 | I560: EADE | K560: BATES | M560: REID | O560: GUEST | Q560: BEASY | S560: SALVADO
A561: WILLIAMSTOWN | C561: COLLINS | F561: JAMES | H561: MALONEY | K561: SMITH | M561: COPE | O561: MURPHY | R561: CLOUGH
D562: 25TH JUNE | G562: WEATHER | J562: FINE
A563: YARRAVILLE | C563: 2 | D563: 3 | E563: =C563*6+D563 -> 15 | G563: 6 | H563: 7 | I563: =G563*6+H563 -> 43 | K563: 8 | L563: 11 | M563: =K563*6+L563 -> 59 | O563: 11 | P563: 13 | Q563: =O563*6+P563 -> 79 | S563: YARRAVILLE
A564: COBURG | C564: 2 | D564: 4 | E564: =C564*6+D564 -> 16 | G564: 5 | H564: 7 | I564: =G564*6+H564 -> 37 | K564: 8 | L564: 10 | M564: =K564*6+L564 -> 58 | O564: 9 | P564: 13 | Q564: =O564*6+P564 -> 67 | S564: ALLEN
A565: BEST PLAYERS
A566: YARRAVILLE | C566: McTAGGART | F566: RON BROWN | I566: WHITTEN | L566: BOB BROWN | O566: McGILL | R566: CLEGG
A567: COBURG | C567: JORDAN | F567: TANCREDI | I567: McNABB | L567: KERR | O567: K L O'BRIEN | R567: HOOGEN
A568: GOALKICKERS
A569: YARRAVILLE | C569: RON BROWN 2 | F569: CLEGG 2 | I569: FLEMING 2 | L569: MEDDINGS 2 | O569: WARWICK | R569: BOURKE | U569: BURR
A570: COBURG | C570: K L O'BRIEN 3 | F570: McNABB 2 | I570: K O'BRIEN | L570: RICCI | N570: NIGRO | P570: COLBERT
A572: ROUND 13 | E572: 1ST JULY | J572: WEATHER | N572: SOUTH EAST WIND | S572: PLAYED AT
D573: 1ST QTR | H573: 2ND QTR | L573: 3RD QTR | P573: FINAL | S573: WILLIAMSTOWN
A574: WILLIAMSTOWN | C574: 1 | D574: 0 | E574: =C574*6+D574 -> 6 | G574: 6 | H574: 4 | I574: =G574*6+H574 -> 40 | K574: 6 | L574: 6 | M574: =K574*6+L574 -> 42 | O574: 9 | P574: 18 | Q574: =O574*6+P574 -> 72 | S574: UMPIRE | X574: LADDER | AB574: ROUND | AD574: 13
A575: SANDRINGHAM | C575: 3 | D575: 2 | E575: =C575*6+D575 -> 20 | G575: 4 | H575: 2 | I575: =G575*6+H575 -> 26 | K575: 7 | L575: 8 | M575: =K575*6+L575 -> 50 | O575: 7 | P575: 9 | Q575: =O575*6+P575 -> 51 | S575: O'DONOGHUE
A576: BEST PLAYERS | W576: TEAM | X576: W | Y576: L | Z576: D | AA576: FOR | AB576: AGST | AC576: % | AD576: PTS
A577: WILLIAMSTOWN | C577: CLOUGH | F577: WARD | I577: COPE | L577: EVANS | N577: TAUBE | Q577: McCONVILLE
A578: SANDRINGHAM | C578: MURRAY | F578: BEVERIDGE | I578: WEBSTER | L578: PELUSO | N578: BOLAND | Q578: DAWSON | W578: MOORABBIN | X578: 9 | Y578: 4 | Z578: 0 | AA578: 1170 | AB578: 919 | AC578: 127.31229597388466 | AD578: 36
A579: GOALKICKERS | W579: PORT MELBOURNE | X579: 9 | Y579: 4 | Z579: 0 | AA579: 1299 | AB579: 1059 | AC579: 122.66288951841359 | AD579: 36
A580: WILLIAMSTOWN | C580: CLOUGH 3 | F580: TURNER 2 | I580: JAMES 2 | K580: MALONEY | N580: WILLIAMS | W580: WILLIAMSTOWN | X580: 9 | Y580: 4 | Z580: 0 | AA580: 1063 | AB580: 891 | AC580: 119.30415263748597 | AD580: 36
A581: SANDRINGHAM | C581: MURRAY 3 | F581: BEVERIDGE 2 | I581: OAKLEY | K581: DAWSON | W581: SANDRINGHAM | X581: 8 | Y581: 5 | Z581: 0 | AA581: 1217 | AB581: 1010 | AC581: 120.4950495049505 | AD581: 32
A583: MOORABBIN | C583: 4 | D583: 4 | E583: =C583*6+D583 -> 28 | G583: 6 | H583: 7 | I583: =G583*6+H583 -> 43 | K583: 7 | L583: 12 | M583: =K583*6+L583 -> 54 | O583: 12 | P583: 19 | Q583: =O583*6+P583 -> 91 | S583: MOORABBIN | W583: YARRAVILLE | X583: 8 | Y583: 5 | Z583: 0 | AA583: 1065 | AB583: 928 | AC583: 114.76293103448276 | AD583: 32
A584: BRUNSWICK | C584: 0 | D584: 2 | E584: =C584*6+D584 -> 2 | G584: 4 | H584: 5 | I584: =G584*6+H584 -> 29 | K584: 5 | L584: 7 | M584: =K584*6+L584 -> 37 | O584: 6 | P584: 8 | Q584: =O584*6+P584 -> 44 | S584: BAIRD | W584: COBURG | X584: 7 | Y584: 5 | Z584: 1 | AA584: 1096 | AB584: 1025 | AC584: 106.92682926829268 | AD584: 30
A585: BEST PLAYERS | W585: OAKLEIGH | X585: 6 | Y585: 7 | Z585: 0 | AA585: 1148 | AB585: 1177 | AC585: 97.536108751062017 | AD585: 24
A586: MOORABBIN | C586: SHEPHERD | F586: RYAN | I586: KUPSCH | L586: KEE | N586: SCHOFIELD | Q586: BUZZA | W586: BRUNSWICK | X586: 5 | Y586: 8 | Z586: 0 | AA586: 926 | AB586: 1107 | AC586: 83.65 | AD586: 20
A587: BRUNSWICK | C587: McKENNA | F587: CLEGG | I587: BIBBY | L587: DENTON | N587: WILSON | Q587: STANLEY | W587: MORDIALLOC | X587: 2 | Y587: 11 | Z587: 0 | AA587: 864 | AB587: 1222 | AC587: 70.7 | AD587: 8
A588: GOALKICKERS | W588: BOX HILL | X588: 1 | Y588: 11 | Z588: 1 | AA588: 896 | AB588: 1406 | AC588: 63.726884779516361 | AD588: 6
A589: MOORABBIN | C589: SCHOFIELD 4 | F589: RYAN 3 | H589: SHEPHERD 2 | K589: PAPLEY | M589: HOY | N589: ADAMSON
A590: BRUNSWICK | C590: BIBBY 2 | F590: BRENNAN 2 | I590: MATTHEWS | L590: DENTON
A592: PORT MELBOURNE | C592: 10 | D592: 6 | E592: =C592*6+D592 -> 66 | G592: 10 | H592: 8 | I592: =G592*6+H592 -> 68 | K592: 21 | L592: 12 | M592: =K592*6+L592 -> 138 | O592: 23 | P592: 17 | Q592: =O592*6+P592 -> 155 | S592: PORT MELBOURNE
A593: BOX HILL | C593: 1 | D593: 0 | E593: =C593*6+D593 -> 6 | G593: 5 | H593: 7 | I593: =G593*6+H593 -> 37 | K593: 6 | L593: 7 | M593: =K593*6+L593 -> 43 | O593: 13 | P593: 14 | Q593: =O593*6+P593 -> 92 | S593: WOOLFE
A594: BEST PLAYERS
A595: PORT MELBOURNE | C595: MONKS | F595: CLAXTON | I595: FREYER | L595: TAGGART | O595: A CAMERON | R595: MERRETT
A596: BOX HILL | C596: WHITE | F596: CRAIG | I596: CHEFFERS | L596: WITNISH | O596: CLARE | R596: BEASY
A597: GOALKICKERS
A598: PORT MELBOURNE | C598: BONNETT 5 | F598: CLAXTON 3 | I598: MONKS 3 | K598: FREYER 3 | M598: MERRETT 2 | P598: ROONEY 2 | R598: JOLIFFE | T598: STRAUCH | W598: McMASTER | X598: TAGGART | AA598: McLEOD
A599: BOX HILL | C599: WHITE 4 | F599: BATES 2 | I599: REID 2 | K599: BARNES 2 | N599: SALVADO 2 | Q599: CLARE
A601: MORDIALLOC | C601: 1 | D601: 2 | E601: =C601*6+D601 -> 8 | G601: 5 | H601: 3 | I601: =G601*6+H601 -> 33 | K601: 5 | L601: 6 | M601: =K601*6+L601 -> 36 | O601: 8 | P601: 8 | Q601: =O601*6+P601 -> 56 | S601: MORDIALLOC
A602: YARRAVILLE | C602: 1 | D602: 1 | E602: =C602*6+D602 -> 7 | G602: 1 | H602: 3 | I602: =G602*6+H602 -> 9 | K602: 2 | L602: 9 | M602: =K602*6+L602 -> 21 | O602: 4 | P602: 12 | Q602: =O602*6+P602 -> 36 | S602: JACKSON
A603: BEST PLAYERS
A604: MORDIALLOC | C604: GILL | F604: HORNE | I604: PEARSON | L604: NESBIT | O604: PETRIE | R604: CRANE
A605: YARRAVILLE | C605: BOB BROWN | F605: RON BROWN | I605: McCARTHY | L605: ORANGE | O605: McTAGGART | R605: VAUTIER
A606: GOALKICKERS
A607: MORDIALLOC | C607: CRANE 5 | F607: PEARSON 2 | I607: BURGE
A608: YARRAVILLE | C608: McCARTHY | F608: MEDDINGS | I608: BURGE | K608: McGILL
D609: 2ND JULY | G609: WEATHER | J609: FINE
A610: COBURG | C610: 5 | D610: 1 | E610: =C610*6+D610 -> 31 | G610: 11 | H610: 4 | I610: =G610*6+H610 -> 70 | K610: 14 | L610: 4 | M610: =K610*6+L610 -> 88 | O610: 17 | P610: 10 | Q610: =O610*6+P610 -> 112 | S610: COBURG
A611: OAKLEIGH | C611: 2 | D611: 2 | E611: =C611*6+D611 -> 14 | G611: 5 | H611: 4 | I611: =G611*6+H611 -> 34 | K611: 9 | L611: 10 | M611: =K611*6+L611 -> 64 | O611: 10 | P611: 12 | Q611: =O611*6+P611 -> 72 | S611: McMASTER
A612: BEST PLAYERS
A613: COBURG | C613: SHORT | E613: K L O'BRIEN | H613: NIGRO | K613: McNABB | N613: RICCI | Q613: SULLIVAN
A614: OAKLEIGH | C614: ASH | E614: McCOOKE | H614: KITTO | K614: BEST | N614: HALL | Q614: RICCI
A615: GOALKICKERS
A616: COBURG | C616: K L O'BRIEN 5 | F616: FITZPATRICK 3 | J616: NIGRO 3 | L616: RICCI 3 | N616: JORDAN 2 | Q616: CARR
A617: OAKLEIGH | C617: McCOOKE 4 | F617: KITTO 2 | I617: JEWELL | K617: RICCI | M617: BEST | O617: GIBBON
A619: ROUND 14 | E619: 8TH JULY | J619: WEATHER | M619: STRONG WEST WIND SHOWERS | S619: PLAYED AT
D620: 1ST QTR | H620: 2ND QTR | L620: 3RD QTR | P620: FINAL | S620: YARRAVILLE
A621: YARRAVILLE | C621: 2 | D621: 4 | E621: =C621*6+D621 -> 16 | G621: 3 | H621: 4 | I621: =G621*6+H621 -> 22 | K621: 4 | L621: 6 | M621: =K621*6+L621 -> 30 | O621: 4 | P621: 8 | Q621: =O621*6+P621 -> 32 | S621: UMPIRE | X621: LADDER | AB621: ROUND | AD621: 14
A622: WILLIAMSTOWN | C622: 0 | D622: 1 | E622: =C622*6+D622 -> 1 | G622: 0 | H622: 4 | I622: =G622*6+H622 -> 4 | K622: 0 | L622: 4 | M622: =K622*6+L622 -> 4 | O622: 1 | P622: 5 | Q622: =O622*6+P622 -> 11 | S622: JOHNS
A623: BEST PLAYERS | W623: TEAM | X623: W | Y623: L | Z623: D | AA623: FOR | AB623: AGST | AC623: % | AD623: PTS
A624: YARRAVILLE | C624: McTAGGART | F624: CROOK | I624: NARKIEWICZ | L624: McGILL | N624: RON BROWN | Q624: MASON
A625: WILLIAMSTOWN | C625: WARD | F625: EVANS | I625: TURNER | L625: TAUBE | N625: COLLINS | Q625: CARMICHAEL | W625: MOORABBIN | X625: 10 | Y625: 4 | Z625: 0 | AA625: 1232 | AB625: 959 | AC625: 128.46715328467153 | AD625: 40
A626: GOALKICKERS | W626: SANDRINGHAM | X626: 9 | Y626: 5 | Z626: 0 | AA626: 1288 | AB626: 1074 | AC626: 119.92551210428306 | AD626: 36
A627: YARRAVILLE | C627: NARKIEWICZ | F627: McCARTHY | I627: VAUTIER | L627: WHITTEN | W627: PORT MELBOURNE | X627: 9 | Y627: 5 | Z627: 0 | AA627: 1349 | AB627: 1145 | AC627: 117.81659388646288 | AD627: 36
A628: WILLIAMSTOWN | C628: MALONEY | W628: YARRAVILLE | X628: 9 | Y628: 5 | Z628: 0 | AA628: 1097 | AB628: 939 | AC628: 116.82641107561236 | AD628: 36
A630: OAKLEIGH | C630: 3 | D630: 2 | E630: =C630*6+D630 -> 20 | G630: 7 | H630: 4 | I630: =G630*6+H630 -> 46 | K630: 8 | L630: 5 | M630: =K630*6+L630 -> 53 | O630: 13 | P630: 8 | Q630: =O630*6+P630 -> 86 | S630: OAKLEIGH | W630: WILLIAMSTOWN | X630: 9 | Y630: 5 | Z630: 0 | AA630: 1074 | AB630: 923 | AC630: 116.35969664138678 | AD630: 36
A631: PORT MELBOURNE | C631: 2 | D631: 4 | E631: =C631*6+D631 -> 16 | G631: 2 | H631: 6 | I631: =G631*6+H631 -> 18 | K631: 5 | L631: 15 | M631: =K631*6+L631 -> 45 | O631: 5 | P631: 20 | Q631: =O631*6+P631 -> 50 | S631: TREWIN | W631: COBURG | X631: 7 | Y631: 6 | Z631: 1 | AA631: 1161 | AB631: 1134 | AC631: 102.38095238095238 | AD631: 30
A632: BEST PLAYERS | W632: OAKLEIGH | X632: 7 | Y632: 7 | Z632: 0 | AA632: 1234 | AB632: 1227 | AC632: 100.57049714751426 | AD632: 28
A633: OAKLEIGH | C633: B WILLIAMS | F633: COUGHLAN | I633: KITTO | L633: PEAKE | N633: JEWELL | Q633: JONES | W633: BRUNSWICK | X633: 6 | Y633: 8 | Z633: 0 | AA633: 1035 | AB633: 1172 | AC633: 88.31 | AD633: 24
A634: PORT MELBOURNE | C634: McLEOD | F634: MONKS | I634: CLAXTON | L634: JOLIFFE | N634: TAGGART | Q634: STRAUCH | W634: MORDIALLOC | X634: 2 | Y634: 12 | Z634: 0 | AA634: 928 | AB634: 1293 | AC634: 71.77 | AD634: 8
A635: GOALKICKERS | W635: BOX HILL | X635: 1 | Y635: 12 | Z635: 1 | AA635: 936 | AB635: 1468 | AC635: 63.760217983651224 | AD635: 6
A636: OAKLEIGH | C636: COUGHLAN 4 | F636: KITTO 2 | I636: BEST 2 | K636: PEAKE | M636: RICCI | O636: MULDOON | Q636: ASH | R636: JONES
A637: PORT MELBOURNE | C637: BONNETT 3 | F637: TAGGART | I637: BOWEN
A639: SANDRINGHAM | C639: 0 | D639: 0 | E639: =C639*6+D639 -> 0 | G639: 4 | H639: 5 | I639: =G639*6+H639 -> 29 | K639: 7 | L639: 8 | M639: =K639*6+L639 -> 50 | O639: 10 | P639: 11 | Q639: =O639*6+P639 -> 71 | S639: BEACH ROAD
A640: MORDIALLOC | C640: 3 | D640: 4 | E640: =C640*6+D640 -> 22 | G640: 3 | H640: 6 | I640: =G640*6+H640 -> 24 | K640: 7 | L640: 9 | M640: =K640*6+L640 -> 51 | O640: 9 | P640: 10 | Q640: =O640*6+P640 -> 64 | S640: ALLEN
A641: BEST PLAYERS
A642: SANDRINGHAM | C642: WEBSTER | F642: MURRAY | I642: SHRIVES | L642: BOLAND | O642: BEVERIDGE | R642: OAKLEY
A643: MORDIALLOC | C643: GILL | F643: PEARSON | I643: PETRIE | L643: CRANE | O643: HORNE | R643: BLAINEY
A644: GOALKICKERS
A645: SANDRINGHAM | C645: OAKLEY 3 | F645: SHRIVES 2 | I645: WEBSTER 2 | L645: BEVERIDGE | N645: BURKE | P645: MURRAY
A646: MORDIALLOC | C646: CRANE 3 | F646: NESBIT 2 | I646: BURGE 2 | K646: CRAWFORD 2
A648: MOORABBIN | C648: 3 | D648: 3 | E648: =C648*6+D648 -> 21 | G648: 4 | H648: 3 | I648: =G648*6+H648 -> 27 | K648: 6 | L648: 5 | M648: =K648*6+L648 -> 41 | O648: 9 | P648: 8 | Q648: =O648*6+P648 -> 62 | S648: BOX HILL
A649: BOX HILL | C649: 0 | D649: 1 | E649: =C649*6+D649 -> 1 | G649: 3 | H649: 2 | I649: =G649*6+H649 -> 20 | K649: 5 | L649: 3 | M649: =K649*6+L649 -> 33 | O649: 6 | P649: 4 | Q649: =O649*6+P649 -> 40 | S649: MILLEN
A650: BEST PLAYERS
A651: MOORABBIN | C651: GILDER | F651: CLARK | I651: MANIE | L651: ADAMSON | O651: SHEPHERD | R651: KUPSCH
A652: BOX HILL | C652: WHITE | F652: REID | I652: CHEFFERS | L652: BEASY | O652: WITTMER | R652: BARNES
A653: GOALKICKERS
A654: MOORABBIN | C654: PAPLEY 2 | F654: BOX 2 | H654: ADAMSON | K654: KEE | M654: SHEPHERD | P654: MANIE | R654: KUPSCH
A655: BOX HILL | C655: BARNES 3 | F655: REID 2 | H655: CLARE
E656: 9TH JULY | H656: WEATHER | K656: FINE
A657: BRUNSWICK | C657: 4 | D657: 4 | E657: =C657*6+D657 -> 28 | G657: 6 | H657: 4 | I657: =G657*6+H657 -> 40 | K657: 14 | L657: 8 | M657: =K657*6+L657 -> 92 | O657: 16 | P657: 13 | Q657: =O657*6+P657 -> 109 | S657: BRUNSWICK
A658: COBURG | C658: 0 | D658: 1 | E658: =C658*6+D658 -> 1 | G658: 3 | H658: 7 | I658: =G658*6+H658 -> 25 | K658: 5 | L658: 9 | M658: =K658*6+L658 -> 39 | O658: 9 | P658: 11 | Q658: =O658*6+P658 -> 65 | S658: WOOLFE
A659: BEST PLAYERS
A660: BRUNSWICK | C660: WHILEY | F660: BIBBY | I660: R EDWARDS | L660: J EDWARDS | O660: THOMPSON | R660: AMBROSE
A661: COBURG | C661: K L O'BRIEN | F661: McNABB | I661: HOOGEN | L661: CARR | O661: JORDAN | R661: SHORT
A662: GOALKICKERS
A663: BRUNSWICK | C663: WHILEY 5 | F663: AMBROSE 2 | I663: McKENNA 2 | L663: BRENNAN 2 | O663: VELO 2 | Q663: WATT | S663: STANLEY | V663: BIBBY
A664: COBURG | C664: K L O'BRIEN 4 | F664: JORDAN 2 | I664: COLBERT 2 | L664: SULLIVAN
A666: ROUND 15 | E666: 15TH JULY | J666: WEATHER | M666: SOUTH WEST WIND SHOWERS | S666: PLAYED AT
D667: 1ST QTR | H667: 2ND QTR | L667: 3RD QTR | P667: FINAL | S667: MOORABBIN
A668: MOORABBIN | C668: 0 | D668: 3 | E668: =C668*6+D668 -> 3 | G668: 4 | H668: 9 | I668: =G668*6+H668 -> 33 | K668: 4 | L668: 11 | M668: =K668*6+L668 -> 35 | O668: 5 | P668: 19 | Q668: =O668*6+P668 -> 49 | S668: UMPIRE | X668: LADDER | AB668: ROUND | AD668: 15
A669: YARRAVILLE | C669: 1 | D669: 4 | E669: =C669*6+D669 -> 10 | G669: 1 | H669: 7 | I669: =G669*6+H669 -> 13 | K669: 4 | L669: 17 | M669: =K669*6+L669 -> 41 | O669: 4 | P669: 17 | Q669: =O669*6+P669 -> 41 | S669: WOOLFE
A670: BEST PLAYERS | W670: TEAM | X670: W | Y670: L | Z670: D | AA670: FOR | AB670: AGST | AC670: % | AD670: PTS
A671: MOORABBIN | C671: CLARK | F671: PAPLEY | I671: KUPSCH | L671: MANIE | O671: SHEPHERD | Q671: HOY
A672: YARRAVILLE | C672: WHITTEN | F672: McCARTHY | I672: CROOK | L672: NARKIEWICZ | O672: MASON | Q672: CLEGG | W672: MOORABBIN | X672: 11 | Y672: 4 | Z672: 0 | AA672: 1281 | AB672: 1000 | AC672: 128.1 | AD672: 44
A673: GOALKICKERS | W673: SANDRINGHAM | X673: 9 | Y673: 6 | Z673: 0 | AA673: 1356 | AB673: 1149 | AC673: 118.01566579634465 | AD673: 36
A674: MOORABBIN | C674: KEE | E674: CLARK | G674: SHEPHERD | J674: SCHOFIELD | M674: ADAMSON | W674: PORT MELBOURNE | X674: 9 | Y674: 6 | Z674: 0 | AA674: 1428 | AB674: 1237 | AC674: 115.44058205335489 | AD674: 36
A675: YARRAVILLE | C675: WHITTEN | F675: CROOK | I675: BOURKE | K675: McGILL | W675: YARRAVILLE | X675: 9 | Y675: 6 | Z675: 0 | AA675: 1138 | AB675: 988 | AC675: 115.18218623481782 | AD675: 36
A677: COBURG | C677: 2 | D677: 3 | E677: =C677*6+D677 -> 15 | G677: 3 | H677: 4 | I677: =G677*6+H677 -> 22 | K677: 8 | L677: 6 | M677: =K677*6+L677 -> 54 | O677: 11 | P677: 9 | Q677: =O677*6+P677 -> 75 | S677: COBURG | W677: WILLIAMSTOWN | X677: 9 | Y677: 6 | Z677: 0 | AA677: 1132 | AB677: 1006 | AC677: 112.52485089463221 | AD677: 36
A678: SANDRINGHAM | C678: 5 | D678: 2 | E678: =C678*6+D678 -> 32 | G678: 8 | H678: 3 | I678: =G678*6+H678 -> 51 | K678: 9 | L678: 8 | M678: =K678*6+L678 -> 62 | O678: 10 | P678: 8 | Q678: =O678*6+P678 -> 68 | S678: JACKSON | W678: COBURG | X678: 8 | Y678: 6 | Z678: 1 | AA678: 1236 | AB678: 1202 | AC678: 102.82861896838602 | AD678: 34
A679: BEST PLAYERS | W679: OAKLEIGH | X679: 8 | Y679: 7 | Z679: 0 | AA679: 1317 | AB679: 1285 | AC679: 102.49027237354086 | AD679: 32
A680: COBURG | C680: CARR | F680: JORDAN | I680: SHORT | L680: RICCI | O680: SULLIVAN | R680: COLBERT | W680: BRUNSWICK | X680: 7 | Y680: 8 | Z680: 0 | AA680: 1127 | AB680: 1251 | AC680: 90.09 | AD680: 28
A681: SANDRINGHAM | C681: MURRAY | F681: SHRIVES | I681: STRACHAN | L681: RANSOM | O681: DAWSON | R681: BOLAND | W681: MORDIALLOC | X681: 3 | Y681: 12 | Z681: 0 | AA681: 1014 | AB681: 1347 | AC681: 75.28 | AD681: 12
A682: GOALKICKERS | W682: BOX HILL | X682: 1 | Y682: 13 | Z682: 1 | AA682: 990 | AB682: 1554 | AC682: 63.706563706563706 | AD682: 6
A683: COBURG | C683: K L O'BRIEN 4 | F683: CARR 3 | I683: JORDAN 2 | L683: RICCI | N683: NIGRO
A684: SANDRINGHAM | C684: MURRAY 2 | F684: DAWSON 2 | I684: WEBSTER 2 | L684: BEVERIDGE | N684: RANSOM | P684: SHRIVES | R684: OAKLEY
A686: OAKLEIGH | C686: 3 | D686: 5 | E686: =C686*6+D686 -> 23 | G686: 5 | H686: 6 | I686: =G686*6+H686 -> 36 | K686: 11 | L686: 10 | M686: =K686*6+L686 -> 76 | O686: 12 | P686: 11 | Q686: =O686*6+P686 -> 83 | S686: WILLIAMSTOWN
A687: WILLIAMSTOWN | C687: 1 | D687: 0 | E687: =C687*6+D687 -> 6 | G687: 7 | H687: 4 | I687: =G687*6+H687 -> 46 | K687: 8 | L687: 4 | M687: =K687*6+L687 -> 52 | O687: 8 | P687: 10 | Q687: =O687*6+P687 -> 58 | S687: MILLEN
A688: BEST PLAYERS
A689: OAKLEIGH | C689: KITTO | F689: ASH | I689: STEPHENSON | L689: RICCI | O689: D'ARCY | Q689: JONES
A690: WILLIAMSTOWN | C690: SMITH | F690: TAUBE | I690: COLLINS | L690: WILLIAMS | O690: EVANS | Q690: HILL
A691: GOALKICKERS
A692: OAKLEIGH | C692: RICCI 4 | F692: D'ARCY 3 | I692: JONES 3 | K692: JEWELL | M692: COUGHLAN
A693: WILLIAMSTOWN | C693: BOWLES 2 | F693: WILLIAMS 2 | I693: JAMES | K693: PELLY | M693: MURPHY | O693: HILL
A695: MORDIALLOC | C695: 0 | D695: 3 | E695: =C695*6+D695 -> 3 | G695: 7 | H695: 7 | I695: =G695*6+H695 -> 49 | K695: 9 | L695: 7 | M695: =K695*6+L695 -> 61 | O695: 13 | P695: 8 | Q695: =O695*6+P695 -> 86 | S695: MORDIALLOC
A696: BOX HILL | C696: 2 | D696: 3 | E696: =C696*6+D696 -> 15 | G696: 3 | H696: 5 | I696: =G696*6+H696 -> 23 | K696: 5 | L696: 10 | M696: =K696*6+L696 -> 40 | O696: 7 | P696: 12 | Q696: =O696*6+P696 -> 54 | S696: LEE
A697: BEST PLAYERS
A698: MORDIALLOC | C698: CRANE | F698: BESANKO | I698: WILLIAMS | L698: PETRIE | N698: WILLIAMSON | Q698: NESBIT
A699: BOX HILL | C699: BEASY | F699: WHITE | I699: WITNISH | L699: GUEST | N699: SALVADO | Q699: DUMMELOW
A700: GOALKICKERS
A701: MORDIALLOC | C701: CRANE 6 | F701: BESANKO 3 | I701: NESBIT | K701: CRAWFORD | N701: DEAN | P701: GILL | Q701: PETRIE
A702: BOX HILL | C702: WHITE 2 | F702: BARNES 2 | I702: SALVADO | K702: REID | M702: BEASY
E703: 16TH JULY | H703: WEATHER | K703: S.W. WIND
A704: BRUNSWICK | C704: 6 | D704: 9 | E704: =C704*6+D704 -> 45 | G704: 8 | H704: 12 | I704: =G704*6+H704 -> 60 | K704: 10 | L704: 17 | M704: =K704*6+L704 -> 77 | O704: 12 | P704: 20 | Q704: =O704*6+P704 -> 92 | S704: PORT MELBOURNE
A705: PORT MELBOURNE | C705: 1 | D705: 2 | E705: =C705*6+D705 -> 8 | G705: 6 | H705: 4 | I705: =G705*6+H705 -> 40 | K705: 7 | L705: 7 | M705: =K705*6+L705 -> 49 | O705: 11 | P705: 13 | Q705: =O705*6+P705 -> 79 | S705: HORNE
A706: BEST PLAYERS
A707: BRUNSWICK | C707: WHILEY | F707: BIBBY | I707: THOMPSON | L707: JOHNSON | O707: CLEGG | Q707: J EDWARDS
A708: PORT MELBOURNE | C708: TAGGART | F708: WHITE | I708: CAMERON | L708: McLEOD | O708: BOWEN | Q708: MONKS
A709: GOALKICKERS
A710: BRUNSWICK | C710: WHILEY 4 | F710: BIBBY 4 | H710: CLEGG 2 | J710: BRENNAN 2
A711: PORT MELBOURNE | C711: BONNETT 4 | F711: TAGGART 2 | I711: BOWEN | K711: McRAE | M711: MERRETT | O711: CLAXTON | Q711: WHITE
A713: ROUND 16 | E713: 22ND JULY | J713: WEATHER | N713: SOUTH BREEZE FINE | S713: PLAYED AT
D714: 1ST QTR | H714: 2ND QTR | L714: 3RD QTR | P714: FINAL | S714: BEACH ROAD
A715: MOORABBIN | C715: 5 | D715: 1 | E715: =C715*6+D715 -> 31 | G715: 6 | H715: 5 | I715: =G715*6+H715 -> 41 | K715: 10 | L715: 8 | M715: =K715*6+L715 -> 68 | O715: 12 | P715: 10 | Q715: =O715*6+P715 -> 82 | S715: UMPIRE | X715: LADDER | AB715: ROUND | AD715: 16
A716: SANDRINGHAM | C716: 1 | D716: 8 | E716: =C716*6+D716 -> 14 | G716: 1 | H716: 11 | I716: =G716*6+H716 -> 17 | K716: 4 | L716: 14 | M716: =K716*6+L716 -> 38 | O716: 6 | P716: 18 | Q716: =O716*6+P716 -> 54 | S716: LEE
A717: BEST PLAYERS | W717: TEAM | X717: W | Y717: L | Z717: D | AA717: FOR | AB717: AGST | AC717: % | AD717: PTS
A718: MOORABBIN | C718: CLARK | E718: GILDER | H718: PAPLEY | K718: HENDERSON | N718: WHALEBONE | Q718: DALTON
A719: SANDRINGHAM | C719: BOLAND | E719: SHEERAN | H719: SHRIVES | K719: McKENZIE | N719: MURRAY | Q719: WEBSTER | W719: MOORABBIN | X719: 12 | Y719: 4 | Z719: 0 | AA719: 1363 | AB719: 1054 | AC719: 129.31688804554079 | AD719: 48
A720: GOALKICKERS | W720: YARRAVILLE | X720: 10 | Y720: 6 | Z720: 0 | AA720: 1228 | AB720: 1064 | AC720: 115.41353383458646 | AD720: 40
A721: MOORABBIN | C721: PAPLEY 3 | E721: CRUTCHFIELD 2 | H721: SCHOFIELD 2 | K721: KUPSCH | M721: WHALEBONE | P721: HENDERSON | R721: RYAN | T721: KEE | W721: COBURG | X721: 9 | Y721: 6 | Z721: 1 | AA721: 1289 | AB721: 1250 | AC721: 103.12 | AD721: 38
A722: SANDRINGHAM | C722: ALLSOP 2 | F722: STRACHAN 2 | I722: MUTER | K722: KELTON | W722: SANDRINGHAM | X722: 9 | Y722: 7 | Z722: 0 | AA722: 1410 | AB722: 1231 | AC722: 114.54102355808286 | AD722: 36
A724: YARRAVILLE | C724: 4 | D724: 2 | E724: =C724*6+D724 -> 26 | G724: 7 | H724: 3 | I724: =G724*6+H724 -> 45 | K724: 8 | L724: 8 | M724: =K724*6+L724 -> 56 | O724: 13 | P724: 12 | Q724: =O724*6+P724 -> 90 | S724: YARRAVILLE | W724: PORT MELBOURNE | X724: 9 | Y724: 7 | Z724: 0 | AA724: 1476 | AB724: 1290 | AC724: 114.41860465116279 | AD724: 36
A725: BRUNSWICK | C725: 4 | D725: 0 | E725: =C725*6+D725 -> 24 | G725: 7 | H725: 3 | I725: =G725*6+H725 -> 45 | K725: 8 | L725: 6 | M725: =K725*6+L725 -> 54 | O725: 11 | P725: 10 | Q725: =O725*6+P725 -> 76 | S725: ALLEN | W725: WILLIAMSTOWN | X725: 9 | Y725: 7 | Z725: 0 | AA725: 1205 | AB725: 1083 | AC725: 111.26500461680517 | AD725: 36
A726: BEST PLAYERS | W726: OAKLEIGH | X726: 8 | Y726: 8 | Z726: 0 | AA726: 1423 | AB726: 1406 | AC726: 101.20910384068279 | AD726: 32
A727: YARRAVILLE | C727: McTAGGART | F727: McGILL | I727: LAMONT | L727: FLEMING | N727: ORANGE | Q727: NARKIEWICZ | W727: BRUNSWICK | X727: 7 | Y727: 9 | Z727: 0 | AA727: 1203 | AB727: 1341 | AC727: 89.71 | AD727: 28
A728: BRUNSWICK | C728: WILSON | F728: CLEGG | I728: AMBROSE | L728: WHILEY | N728: McKENNA | Q728: THOMPSON | W728: MORDIALLOC | X728: 4 | Y728: 12 | Z728: 0 | AA728: 1091 | AB728: 1420 | AC728: 76.83 | AD728: 16
A729: GOALKICKERS | W729: BOX HILL | X729: 2 | Y729: 13 | Z729: 1 | AA729: 1111 | AB729: 1660 | AC729: 66.92771084337349 | AD729: 10
A730: YARRAVILLE | C730: WILSON 3 | E730: MEDDINGS 2 | H730: FLEMING 2 | J730: TONZING 2 | M730: RON BROWN | P730: BOURKE | R730: LAMONT | T730: CROOK
A731: BRUNSWICK | C731: CLEGG 7 | F731: MATTHEWS 2 | J731: R DILLON | M731: LEWIS
A733: BOX HILL | C733: 3 | D733: 4 | E733: =C733*6+D733 -> 22 | G733: 10 | H733: 6 | I733: =G733*6+H733 -> 66 | K733: 17 | L733: 6 | M733: =K733*6+L733 -> 108 | O733: 19 | P733: 7 | Q733: =O733*6+P733 -> 121 | S733: OAKLEIGH
A734: OAKLEIGH | C734: 3 | D734: 5 | E734: =C734*6+D734 -> 23 | G734: 6 | H734: 10 | I734: =G734*6+H734 -> 46 | K734: 9 | L734: 17 | M734: =K734*6+L734 -> 71 | O734: 14 | P734: 22 | Q734: =O734*6+P734 -> 106 | S734: MARCY
A735: BEST PLAYERS
A736: BOX HILL | C736: SALVADO | F736: WHITE | I736: EADE | K736: DUMMELOW | N736: WITNISH | Q736: BEASY
A737: OAKLEIGH | C737: McCOOKE | F737: JEWELL | I737: JONES | K737: BEST | N737: KITTO | Q737: COUGHLAN
A738: GOALKICKERS
A739: BOX HILL | C739: SALVADO 6 | F739: WHITE 4 | I739: EADE 3 | K739: BEASY 2 | M739: BARNES 2 | P739: QUINN | R739: BATES
A740: OAKLEIGH | C740: McCOOKE 4 | F740: COUGHLAN 2 | I740: D'ARCY 2 | K740: JEWELL 2 | M740: BEST | O740: ASH | P740: KITTO | R740: MULDOON
A742: MORDIALLOC | C742: 4 | D742: 1 | E742: =C742*6+D742 -> 25 | G742: 6 | H742: 3 | I742: =G742*6+H742 -> 39 | K742: 10 | L742: 3 | M742: =K742*6+L742 -> 63 | O742: 12 | P742: 5 | Q742: =O742*6+P742 -> 77 | S742: MORDIALLOC
A743: WILLIAMSTOWN | C743: 2 | D743: 2 | E743: =C743*6+D743 -> 14 | G743: 7 | H743: 4 | I743: =G743*6+H743 -> 46 | K743: 8 | L743: 6 | M743: =K743*6+L743 -> 54 | O743: 11 | P743: 7 | Q743: =O743*6+P743 -> 73 | S743: HORNE
A744: BEST PLAYERS
A745: MORDIALLOC | C745: BESANKO | F745: NESBIT | I745: CRANE | L745: PETRIE | N745: WILLIAMS | Q745: BURGE
A746: WILLIAMSTOWN | C746: SMITH | F746: FINCH | I746: TURNER | L746: MURPHY | N746: TAUBE | Q746: CARMICHAEL
A747: GOALKICKERS
A748: MORDIALLOC | C748: CRANE 7 | F748: CRAWFORD | I748: BESANKO | K748: DEAN | M748: NESBIT | O748: BURGE
A749: WILLIAMSTOWN | C749: TURNER 6 | F749: COPE | H749: COLLINS | K749: MURPHY | M749: FINCH | O749: BARNES
E750: 23RD JULY | H750: NORTH BREEZE RAIN
A751: COBURG | C751: 4 | D751: 5 | E751: =C751*6+D751 -> 29 | G751: 5 | H751: 5 | I751: =G751*6+H751 -> 35 | K751: 7 | L751: 9 | M751: =K751*6+L751 -> 51 | O751: 7 | P751: 11 | Q751: =O751*6+P751 -> 53 | S751: COBURG
A752: PORT MELBOURNE | C752: 1 | D752: 1 | E752: =C752*6+D752 -> 7 | G752: 6 | H752: 2 | I752: =G752*6+H752 -> 38 | K752: 6 | L752: 4 | M752: =K752*6+L752 -> 40 | O752: 7 | P752: 6 | Q752: =O752*6+P752 -> 48 | S752: ALLEN
A753: BEST PLAYERS
A754: COBURG | C754: CLARKSON | F754: JORDAN | I754: McNABB | L754: BUTCHER | O754: RICCI | R754: SULLIVAN
A755: PORT MELBOURNE | C755: LAWSON | F755: CAMERON | I755: LANDORFF | L755: TAGGART | O755: BONNETT | R755: WHITE
A756: GOALKICKERS
A757: COBURG | C757: F FINDLAY 2 | F757: RICCI 2 | H757: JORDAN | J757: K L O'BRIEN | M757: FITZPATRICK
A758: PORT MELBOURNE | C758: BONNETT 5 | F758: MONKS | H758: WHITE
A760: ROUND 17 | E760: 29TH JULY | J760: WEATHER | N760: DULL NO WIND | S760: PLAYED AT
D761: 1ST QTR | H761: 2ND QTR | L761: 3RD QTR | P761: FINAL | S761: WILLIAMSTOWN
A762: WILLIAMSTOWN | C762: 4 | D762: 6 | E762: =C762*6+D762 -> 30 | G762: 4 | H762: 9 | I762: =G762*6+H762 -> 33 | K762: 9 | L762: 14 | M762: =K762*6+L762 -> 68 | O762: 13 | P762: 17 | Q762: =O762*6+P762 -> 95 | S762: UMPIRE | X762: LADDER | AB762: ROUND | AD762: 17
A763: COBURG | C763: 0 | D763: 1 | E763: =C763*6+D763 -> 1 | G763: 5 | H763: 4 | I763: =G763*6+H763 -> 34 | K763: 10 | L763: 5 | M763: =K763*6+L763 -> 65 | O763: 12 | P763: 9 | Q763: =O763*6+P763 -> 81 | S763: SMITH
A764: BEST PLAYERS | W764: TEAM | X764: W | Y764: L | Z764: D | AA764: FOR | AB764: AGST | AC764: % | AD764: PTS
A765: WILLIAMSTOWN | C765: SMITH | F765: FINCH | I765: TURNER | L765: MALONEY | N765: COLLINS | Q765: WARD
A766: COBURG | C766: McNABB | F766: JORDAN | I766: K L O'BRIEN | L766: CARR | N766: SHORT | Q766: FITZPATRICK | W766: MOORABBIN | X766: 13 | Y766: 4 | Z766: 0 | AA766: 1448 | AB766: 1126 | AC766: 128.5968028419183 | AD766: 52
A767: GOALKICKERS | W767: PORT MELBOURNE | X767: 10 | Y767: 7 | Z767: 0 | AA767: 1585 | AB767: 1366 | AC767: 116.03221083455344 | AD767: 40
A768: WILLIAMSTOWN | C768: WILLIAMS 4 | F768: TURNER 2 | I768: WARD 2 | K768: BARNES 2 | M768: HYNES | O768: FINCH | Q768: EVANS | W768: SANDRINGHAM | X768: 10 | Y768: 7 | Z768: 0 | AA768: 1452 | AB768: 1269 | AC768: 114.42080378250591 | AD768: 40
A769: COBURG | C769: K L O'BRIEN 5 | F769: RICCI 3 | H769: CARR 2 | J769: FINDLAY | L769: JORDAN | W769: WILLIAMSTOWN | X769: 10 | Y769: 7 | Z769: 0 | AA769: 1300 | AB769: 1164 | AC769: 111.68384879725086 | AD769: 40
A771: OAKLEIGH | C771: 3 | D771: 6 | E771: =C771*6+D771 -> 24 | G771: 7 | H771: 8 | I771: =G771*6+H771 -> 50 | K771: 11 | L771: 10 | M771: =K771*6+L771 -> 76 | O771: 15 | P771: 15 | Q771: =O771*6+P771 -> 105 | S771: BRUNSWICK | W771: YARRAVILLE | X771: 10 | Y771: 7 | Z771: 0 | AA771: 1304 | AB771: 1173 | AC771: 111.16794543904518 | AD771: 40
A772: BRUNSWICK | C772: 1 | D772: 5 | E772: =C772*6+D772 -> 11 | G772: 4 | H772: 7 | I772: =G772*6+H772 -> 31 | K772: 6 | L772: 12 | M772: =K772*6+L772 -> 48 | O772: 8 | P772: 14 | Q772: =O772*6+P772 -> 62 | S772: O'DONOGHUE | W772: COBURG | X772: 9 | Y772: 7 | Z772: 1 | AA772: 1370 | AB772: 1345 | AC772: 101.85873605947955 | AD772: 38
A773: BEST PLAYERS | W773: OAKLEIGH | X773: 9 | Y773: 8 | Z773: 0 | AA773: 1528 | AB773: 1468 | AC773: 104.08719346049047 | AD773: 36
A774: OAKLEIGH | C774: JONES | F774: PEAKE | I774: HALL | L774: STEPHENSON | O774: DEFTEROUS | R774: COUGHLAN | W774: BRUNSWICK | X774: 7 | Y774: 10 | Z774: 0 | AA774: 1265 | AB774: 1446 | AC774: 87.48 | AD774: 28
A775: BRUNSWICK | C775: J EDWARDS | F775: THORNTON | I775: JOHNSON | L775: R EDWARDS | O775: THOMPSON | R775: DILLON | W775: MORDIALLOC | X775: 4 | Y775: 13 | Z775: 0 | AA775: 1163 | AB775: 1505 | AC775: 77.28 | AD775: 16
A776: GOALKICKERS | Q776: DEFTEROUS | W776: BOX HILL | X776: 2 | Y776: 14 | Z776: 1 | AA776: 1149 | AB776: 1702 | AC776: 67.508813160987074 | AD776: 10
A777: OAKLEIGH | C777: JEWELL 3 | E777: BEST 2 | G777: STEPHENSON 2 | J777: McCOOKE 2 | M777: RICCI 2 | O777: D'ARCY | Q777: JONES | S777: COUGHLAN
A778: BRUNSWICK | C778: THORNTON 3 | F778: LEWIS | H778: WHILEY | J778: CLEGG | L778: MATTHEWS | O778: MISSEN
A780: SANDRINGHAM | C780: 2 | D780: 3 | E780: =C780*6+D780 -> 15 | G780: 2 | H780: 5 | I780: =G780*6+H780 -> 17 | K780: 4 | L780: 9 | M780: =K780*6+L780 -> 33 | O780: 5 | P780: 12 | Q780: =O780*6+P780 -> 42 | S780: BOX HILL
A781: BOX HILL | C781: 0 | D781: 1 | E781: =C781*6+D781 -> 1 | G781: 3 | H781: 4 | I781: =G781*6+H781 -> 22 | K781: 4 | L781: 6 | M781: =K781*6+L781 -> 30 | O781: 5 | P781: 8 | Q781: =O781*6+P781 -> 38 | S781: HORNE
A782: BEST PLAYERS
A783: SANDRINGHAM | C783: McKENZIE | F783: JONES | I783: DAWSON | L783: STEELE | N783: SHRIVES | Q783: KELTON
A784: BOX HILL | C784: BEASY | F784: DUMMELOW | I784: WHITE | L784: CHEFFERS | N784: WITNISH | Q784: BATES
A785: GOALKICKERS
A786: SANDRINGHAM | C786: DAWSON 2 | F786: KELTON | I786: ALLSOP | L786: GLEESON
A787: BOX HILL | C787: BARNES 2 | F787: SALVADO | I787: BEASY | L787: GRAY
A789: MOORABBIN | C789: 4 | D789: 4 | E789: =C789*6+D789 -> 28 | G789: 9 | H789: 7 | I789: =G789*6+H789 -> 61 | K789: 10 | L789: 11 | M789: =K789*6+L789 -> 71 | O789: 12 | P789: 13 | Q789: =O789*6+P789 -> 85 | S789: MOORABBIN
A790: MORDIALLOC | C790: 1 | D790: 4 | E790: =C790*6+D790 -> 10 | G790: 6 | H790: 5 | I790: =G790*6+H790 -> 41 | K790: 8 | L790: 8 | M790: =K790*6+L790 -> 56 | O790: 10 | P790: 12 | Q790: =O790*6+P790 -> 72 | S790: BAIRD
A791: BEST PLAYERS
A792: MOORABBIN | C792: WILDIE | E792: KUPSCH | H792: PAPLEY | K792: HENDERSON | N792: SHEPHERD | Q792: MANIE
A793: MORDIALLOC | C793: GILL | E793: DULLARD | H793: BURGE | K793: CRAWFORD | N793: WILLIAMS | Q793: CRANE
A794: GOALKICKERS
A795: MOORABBIN | C795: SCHOFIELD 5 | F795: PAPLEY 3 | I795: SHEPHERD 2 | L795: ADAMSON 2 | O795: RYAN
A796: MORDIALLOC | C796: CRANE 3 | F796: BURGE 3 | I796: NESBIT | K796: DULLARD | M796: PETRIE | O796: GILL
E797: 30TH JULY | K797: WEATHER
A798: PORT MELBOURNE | C798: 2 | D798: 4 | E798: =C798*6+D798 -> 16 | G798: 8 | H798: 11 | I798: =G798*6+H798 -> 59 | K798: 11 | L798: 16 | M798: =K798*6+L798 -> 82 | O798: 15 | P798: 19 | Q798: =O798*6+P798 -> 109 | S798: PORT MELBOURNE
A799: YARRAVILLE | C799: 4 | D799: 4 | E799: =C799*6+D799 -> 28 | G799: 5 | H799: 8 | I799: =G799*6+H799 -> 38 | K799: 7 | L799: 9 | M799: =K799*6+L799 -> 51 | O799: 11 | P799: 10 | Q799: =O799*6+P799 -> 76 | S799: LEE
A800: BEST PLAYERS
A801: PORT MELBOURNE | C801: TAGGART | F801: MERRETT | I801: LANDORFF | L801: BONNETT | O801: STRAUCH | R801: CLAXTON
A802: YARRAVILLE | C802: BOB BROWN | F802: EVANS | I802: GILL | L802: CROOK | O802: LAMONT | R802: FLEMING
A803: GOALKICKERS
A804: PORT MELBOURNE | C804: BONNETT 5 | F804: MONKS 3 | I804: CLAXTON 3 | L804: JEFFREY 2 | N804: TAGGART | Q804: LAWSON
A805: YARRAVILLE | C805: MEDDINGS 4 | F805: LAMONT 3 | I805: McCARTHY 2 | L805: FLEMING 2
A807: ROUND 18 | E807: 5TH AUGUST | J807: WEATHER | N807: FINE SUNNY | S807: PLAYED AT
D808: 1ST QTR | H808: 2ND QTR | L808: 3RD QTR | P808: FINAL | S808: BEACH ROAD
A809: SANDRINGHAM | C809: 1 | D809: 3 | E809: =C809*6+D809 -> 9 | G809: 6 | H809: 16 | I809: =G809*6+H809 -> 52 | K809: 11 | L809: 20 | M809: =K809*6+L809 -> 86 | O809: 15 | P809: 22 | Q809: =O809*6+P809 -> 112 | S809: UMPIRE | X809: LADDER | AB809: ROUND | AD809: 18
A810: YARRAVILLE | C810: 5 | D810: 7 | E810: =C810*6+D810 -> 37 | G810: 8 | H810: 9 | I810: =G810*6+H810 -> 57 | K810: 11 | L810: 10 | M810: =K810*6+L810 -> 76 | O810: 13 | P810: 14 | Q810: =O810*6+P810 -> 92 | S810: MARCY
A811: BEST PLAYERS | W811: TEAM | X811: W | Y811: L | Z811: D | AA811: FOR | AB811: AGST | AC811: % | AD811: PTS
A812: SANDRINGHAM | C812: MURRAY | F812: WEBSTER | I812: ALLSOP | L812: SHRIVES | N812: McKENZIE | Q812: KELTON
A813: YARRAVILLE | C813: WHITTEN | F813: HOSKINGS | I813: FLEMING | L813: MASON | N813: BOURKE | Q813: RON BROWN | W813: MOORABBIN | X813: 13 | Y813: 5 | Z813: 0 | AA813: 1506 | AB813: 1211 | AC813: 124.36003303055327 | AD813: 52
A814: GOALKICKERS | W814: SANDRINGHAM | X814: 11 | Y814: 7 | Z814: 0 | AA814: 1564 | AB814: 1361 | AC814: 114.91550330639235 | AD814: 44
A815: SANDRINGHAM | C815: MURRAY 5 | F815: PELUSO 3 | I815: OAKLEY 2 | L815: DAWSON 2 | O815: BURKE | R815: KELTON | W815: WILLIAMSTOWN | X815: 11 | Y815: 7 | Z815: 0 | AA815: 1384 | AB815: 1243 | AC815: 111.34352373290426 | AD815: 44
A816: YARRAVILLE | C816: WHITTEN (5) | F816: BOURKE (2) | I816: EVANS (2) | L816: RON BROWN (2) | O816: FLEMING | R816: McCARHY | W816: COBURG | X816: 10 | Y816: 7 | Z816: 1 | AA816: 1455 | AB816: 1403 | AC816: 103.70634354953671 | AD816: 42
A818: COBURG | C818: 1 | D818: 8 | E818: =C818*6+D818 -> 14 | G818: 4 | H818: 11 | I818: =G818*6+H818 -> 35 | K818: 10 | L818: 18 | M818: =K818*6+L818 -> 78 | O818: 11 | P818: 19 | Q818: =O818*6+P818 -> 85 | S818: COBURG | W818: PORT MELBOURNE | X818: 10 | Y818: 8 | Z818: 0 | AA818: 1664 | AB818: 1450 | AC818: 114.75862068965517 | AD818: 40
A819: MOORABBIN | C819: 1 | D819: 6 | E819: =C819*6+D819 -> 12 | G819: 2 | H819: 10 | I819: =G819*6+H819 -> 22 | K819: 2 | L819: 15 | M819: =K819*6+L819 -> 27 | O819: 6 | P819: 22 | Q819: =O819*6+P819 -> 58 | S819: MILLEN | W819: OAKLEIGH | X819: 10 | Y819: 8 | Z819: 0 | AA819: 1655 | AB819: 1521 | AC819: 108.80999342537804 | AD819: 40
A820: BEST PLAYERS | W820: YARRAVILLE | X820: 10 | Y820: 8 | Z820: 0 | AA820: 1396 | AB820: 1285 | AC820: 108.63813229571984 | AD820: 40
A821: COBURG | C821: SULLIVAN | F821: McNABB | I821: JORDAN | L821: TANCREDI | O821: CARR | Q821: MATTHEWS | W821: BRUNSWICK | X821: 8 | Y821: 10 | Z821: 0 | AA821: 1313 | AB821: 1487 | AC821: 88.3 | AD821: 32
A822: MOORABBIN | C822: KUPSCH | F822: CROSHER | I822: HOY | L822: GILDER | O822: BUZZA | Q822: PAPLEY | W822: MORDIALLOC | X822: 4 | Y822: 14 | Z822: 0 | AA822: 1216 | AB822: 1632 | AC822: 74.51 | AD822: 16
A823: GOALKICKERS | W823: BOX HILL | X823: 2 | Y823: 15 | Z823: 1 | AA823: 1190 | AB823: 1750 | AC823: 68 | AD823: 10
A824: COBURG | C824: K L O'BRIEN 3 | F824: RICCI 2 | H824: CARR | J824: FINDLAY | L824: JORDAN | N824: SHAW | P824: FITZPATRICK | S824: K O'BRIEN
A825: MOORABBIN | C825: KEE 2 | F825: SCHOFIELD 2 | I825: PAPLEY | K825: HENDERSON
A827: OAKLEIGH | C827: 5 | D827: 5 | E827: =C827*6+D827 -> 35 | G827: 11 | H827: 10 | I827: =G827*6+H827 -> 76 | K827: 14 | L827: 14 | M827: =K827*6+L827 -> 98 | O827: 18 | P827: 19 | Q827: =O827*6+P827 -> 127 | S827: MORDIALLOC
A828: MORDIALLOC | C828: 0 | D828: 5 | E828: =C828*6+D828 -> 5 | G828: 1 | H828: 6 | I828: =G828*6+H828 -> 12 | K828: 3 | L828: 10 | M828: =K828*6+L828 -> 28 | O828: 7 | P828: 11 | Q828: =O828*6+P828 -> 53 | S828: SCOTT
A829: BEST PLAYERS
A830: OAKLEIGH | C830: D'ARCY | E830: BEST | H830: JEWELL | K830: ASH | N830: RICCI | Q830: COUGHLAN
A831: MORDIALLOC | C831: GILL | E831: DULLARD | H831: BESANKO | K831: ROBERTS | N831: KAVANAGH | Q831: RITCHIE
A832: GOALKICKERS
A833: OAKLEIGH | C833: D'ARCY 5 | F833: JONES 3 | H833: RICCI 3 | J833: COUGHLAN 3 | M833: JEWELL 2 | P833: KITTO | R833: BEST
A834: MORDIALLOC | C834: KAVANAGH 3 | F834: DEAN 2 | H834: CRANE | J834: RITCHIE
A836: BRUNSWICK | C836: 2 | D836: 1 | E836: =C836*6+D836 -> 13 | G836: 5 | H836: 2 | I836: =G836*6+H836 -> 32 | K836: 5 | L836: 5 | M836: =K836*6+L836 -> 35 | O836: 7 | P836: 6 | Q836: =O836*6+P836 -> 48 | S836: BOX HILL
A837: BOX HILL | C837: 2 | D837: 2 | E837: =C837*6+D837 -> 14 | G837: 2 | H837: 2 | I837: =G837*6+H837 -> 14 | K837: 5 | L837: 4 | M837: =K837*6+L837 -> 34 | O837: 6 | P837: 5 | Q837: =O837*6+P837 -> 41 | S837: TREWIN
A838: BEST PLAYERS
A839: BRUNSWICK | C839: JOHNSON | F839: THOMPSON | I839: McKENNA | L839: WHILEY | O839: MATTHEWS | R839: WILSON
A840: BOX HILL | C840: BEASY | F840: WHITE | I840: GRAY | L840: DUMMELOW | O840: WITNISH | R840: CHEFFERS
A841: GOALKICKERS
A842: BRUNSWICK | C842: WHILEY 2 | F842: CLEGG 2 | I842: DENTON | K842: R EDWARDS | N842: MATTHEWS
A843: BOX HILL | C843: GUEST 2 | F843: BARNES | H843: GRAY | J843: BEASY | L843: SALVADO
E844: 6TH AUGUST
A845: WILLIAMSTOWN | C845: 2 | D845: 5 | E845: =C845*6+D845 -> 17 | G845: 4 | H845: 10 | I845: =G845*6+H845 -> 34 | K845: 8 | L845: 15 | M845: =K845*6+L845 -> 63 | O845: 11 | P845: 18 | Q845: =O845*6+P845 -> 84 | S845: PORT MELBOURNE
A846: PORT MELBOURNE | C846: 4 | D846: 1 | E846: =C846*6+D846 -> 25 | G846: 6 | H846: 4 | I846: =G846*6+H846 -> 40 | K846: 9 | L846: 8 | M846: =K846*6+L846 -> 62 | O846: 11 | P846: 13 | Q846: =O846*6+P846 -> 79 | S846: WOOLFE
A847: BEST PLAYERS
A848: WILLIAMSTOWN | C848: EVANS | F848: PARKER | I848: CARMICHAEL | L848: WARD | O848: COPE | Q848: SMITH
A849: PORT MELBOURNE | C849: STRAUCH | F849: LANDORFF | I849: BONNETT | L849: CLAXTON | O849: LEWIS | Q849: MONKS
A850: GOALKICKERS
A851: WILLIAMSTOWN | C851: JAMES 3 | F851: WARD 2 | I851: EVANS 2 | K851: TURNER | M851: MALONEY | O851: PELLY | Q851: SMITH
A852: PORT MELBOURNE | C852: BONNETT 6 | F852: MONKS 3 | I852: CLAXTON | K852: JEFFREY
A854: ROUND 19 | E854: 12TH AUGUST | J854: WEATHER | M854: NORTH WEST WIND FINE SUNNY | S854: PLAYED AT
D855: 1ST QTR | H855: 2ND QTR | L855: 3RD QTR | P855: FINAL | S855: MOORABBIN
A856: MOORABBIN | C856: 3 | D856: 6 | E856: =C856*6+D856 -> 24 | G856: 8 | H856: 10 | I856: =G856*6+H856 -> 58 | K856: 8 | L856: 12 | M856: =K856*6+L856 -> 60 | O856: 11 | P856: 15 | Q856: =O856*6+P856 -> 81 | S856: UMPIRE | X856: LADDER | AB856: ROUND | AD856: 19
A857: PORT MELBOURNE | C857: 2 | D857: 3 | E857: =C857*6+D857 -> 15 | G857: 5 | H857: 4 | I857: =G857*6+H857 -> 34 | K857: 7 | L857: 7 | M857: =K857*6+L857 -> 49 | O857: 10 | P857: 8 | Q857: =O857*6+P857 -> 68 | S857: TREWIN
A858: BEST PLAYERS | W858: TEAM | X858: W | Y858: L | Z858: D | AA858: FOR | AB858: AGST | AC858: % | AD858: PTS
A859: MOORABBIN | C859: KUPSCH | F859: WILDIE | I859: BUZZA | L859: CROSHER | O859: HOY | Q859: CRAMERI
A860: PORT MELBOURNE | C860: STRAUCH | F860: McLEOD | I860: TAGGART | L860: BONNETT | O860: CLAXTON | Q860: LAWSON | W860: MOORABBIN | X860: 14 | Y860: 5 | Z860: 0 | AA860: 1587 | AB860: 1279 | AC860: 124.08131352619233 | AD860: 56
A861: GOALKICKERS | W861: YARRAVILLE | X861: 11 | Y861: 8 | Z861: 0 | AA861: 1598 | AB861: 1321 | AC861: 120.96896290688872 | AD861: 44
A862: MOORABBIN | C862: SCHOFIELD 4 | F862: KEE 3 | H862: ADAMSON 2 | K862: PAPLEY | M862: SHEPHERD | W862: SANDRINGHAM | X862: 11 | Y862: 8 | Z862: 0 | AA862: 1653 | AB862: 1460 | AC862: 113.21917808219177 | AD862: 44
A863: PORT MELBOURNE | C863: BONNETT 8 | F863: LAWSON | I863: TOLSHER | W863: OAKLEIGH | X863: 11 | Y863: 8 | Z863: 0 | AA863: 1754 | AB863: 1610 | AC863: 108.94409937888199 | AD863: 44
A865: OAKLEIGH | C865: 4 | D865: 2 | E865: =C865*6+D865 -> 26 | G865: 6 | H865: 9 | I865: =G865*6+H865 -> 45 | K865: 11 | L865: 13 | M865: =K865*6+L865 -> 79 | O865: 14 | P865: 15 | Q865: =O865*6+P865 -> 99 | S865: OAKLEIGH | W865: WILLIAMSTOWN | X865: 11 | Y865: 8 | Z865: 0 | AA865: 1470 | AB865: 1375 | AC865: 106.90909090909091 | AD865: 44
A866: SANDRINGHAM | C866: 2 | D866: 5 | E866: =C866*6+D866 -> 17 | G866: 6 | H866: 5 | I866: =G866*6+H866 -> 41 | K866: 10 | L866: 9 | M866: =K866*6+L866 -> 69 | O866: 13 | P866: 11 | Q866: =O866*6+P866 -> 89 | S866: McMASTER | W866: COBURG | X866: 10 | Y866: 8 | Z866: 1 | AA866: 1553 | AB866: 1509 | AC866: 102.91583830351226 | AD866: 42
A867: BEST PLAYERS | W867: PORT MELBOURNE | X867: 10 | Y867: 9 | Z867: 0 | AA867: 1732 | AB867: 1531 | AC867: 113.1286740692358 | AD867: 40
A868: OAKLEIGH | C868: PEAKE | F868: JEWELL | I868: McCOOKE | L868: D'ARCY | O868: DEFTEROUS | R868: BEST | W868: BRUNSWICK | X868: 9 | Y868: 10 | Z868: 0 | AA868: 1445 | AB868: 1573 | AC868: 91.86 | AD868: 36
A869: SANDRINGHAM | C869: BOLAND | F869: KELTON | I869: WEBSTER | L869: BURKE | O869: ALLSOP | R869: PELUSO | W869: MORDIALLOC | X869: 5 | Y869: 14 | Z869: 0 | AA869: 1322 | AB869: 1730 | AC869: 76.42 | AD869: 20
A870: GOALKICKERS | W870: BOX HILL | X870: 2 | Y870: 16 | Z870: 1 | AA870: 1226 | AB870: 1952 | AC870: 62.807377049180324 | AD870: 10
A871: OAKLEIGH | C871: JEWELL 4 | F871: JONES 3 | I871: D'ARCY 3 | K871: BEST 2 | M871: COUGHLAN | P871: STEPHENSON
A872: SANDRINGHAM | C872: OAKLEY 6 | F872: MURRAY 2 | I872: WEBSTER | K872: KELTON | M872: BURKE | O872: ALLSOP | Q872: PELUSO
A874: YARRAVILLE | C874: 8 | D874: 8 | E874: =C874*6+D874 -> 56 | G874: 17 | H874: 14 | I874: =G874*6+H874 -> 116 | K874: 19 | L874: 17 | M874: =K874*6+L874 -> 131 | O874: 29 | P874: 28 | Q874: =O874*6+P874 -> 202 | S874: YARRAVILLE
A875: BOX HILL | C875: 0 | D875: 2 | E875: =C875*6+D875 -> 2 | G875: 2 | H875: 2 | I875: =G875*6+H875 -> 14 | K875: 4 | L875: 6 | M875: =K875*6+L875 -> 30 | O875: 5 | P875: 6 | Q875: =O875*6+P875 -> 36 | S875: ALLEN
A876: BEST PLAYERS
A877: YARRAVILLE | C877: WHITTEN | F877: McGILL | I877: McTAGGART | L877: CLEGG | N877: WILSON | Q877: CROOK
A878: BOX HILL | C878: BEASY | F878: WITNISH | I878: CHEFFERS | L878: BATCH | N878: CRAIG | Q878: QUINN
A879: GOALKICKERS
A880: YARRAVILLE | C880: WHITTEN 7 | F880: RON BROWN 5 | I880: CLEGG 4 | K880: LAMONT 3 | N880: McCARTHY 3 | Q880: McKENNA 3 | T880: CROOK 2 | W880: VAUTIER | X880: WILSON
A881: BOX HILL | C881: WHITE 2 | F881: CRAIG | H881: GRAY | J881: BARNES
A883: MORDIALLOC | C883: 5 | D883: 4 | E883: =C883*6+D883 -> 34 | G883: 8 | H883: 5 | I883: =G883*6+H883 -> 53 | K883: 13 | L883: 8 | M883: =K883*6+L883 -> 86 | O883: 16 | P883: 10 | Q883: =O883*6+P883 -> 106 | S883: COBURG
A884: COBURG | C884: 2 | D884: 0 | E884: =C884*6+D884 -> 12 | G884: 7 | H884: 1 | I884: =G884*6+H884 -> 43 | K884: 10 | L884: 3 | M884: =K884*6+L884 -> 63 | O884: 15 | P884: 8 | Q884: =O884*6+P884 -> 98 | S884: MARCY
A885: BEST PLAYERS
A886: MORDIALLOC | C886: NESBIT | F886: DULLARD | I886: PEARSON | L886: DEAN | O886: BARR | Q886: ROBERTS
A887: COBURG | C887: JORDAN | F887: KERR | I887: YOUNG | L887: SHORT | O887: RICCI | Q887: COLBERT
A888: GOALKICKERS
A889: MORDIALLOC | C889: NESBIT 4 | E889: CRANE 2 | G889: PEARSON 2 | J889: PETRIE 2 | L889: GILL 2 | N889: CRAWFORD | Q889: DEAN | R889: McHENRY | U889: WILLIAMSON
A890: COBURG | C890: JORDAN 5 | F890: RICCI 4 | H890: K L O'BRIEN 3 | K890: MATTHEWS | N890: CARR | P890: K O'BRIEN
E891: 13TH AUGUST
A892: BRUNSWICK | C892: 3 | D892: 6 | E892: =C892*6+D892 -> 24 | G892: 6 | H892: 8 | I892: =G892*6+H892 -> 44 | K892: 11 | L892: 8 | M892: =K892*6+L892 -> 74 | O892: 20 | P892: 12 | Q892: =O892*6+P892 -> 132 | S892: BRUNSWICK
A893: WILLIAMSTOWN | C893: 4 | D893: 2 | E893: =C893*6+D893 -> 26 | G893: 6 | H893: 5 | I893: =G893*6+H893 -> 41 | K893: 10 | L893: 11 | M893: =K893*6+L893 -> 71 | O893: 12 | P893: 14 | Q893: =O893*6+P893 -> 86 | S893: LEE
A894: BEST PLAYERS
A895: BRUNSWICK | C895: JOHNSON | F895: J EDWARDS | I895: CLEGG | L895: WHILEY | O895: THOMPSON | R895: BUTLER
A896: WILLIAMSTOWN | C896: WARD | F896: MALONEY | I896: COPE | L896: SMITH | O896: TURNER | R896: PARKER
A897: GOALKICKERS
A898: BRUNSWICK | C898: DENTON 4 | F898: MATTHEWS 3 | I898: CLEGG 3 | K898: WHILEY 3 | M898: BUTLER 3 | O898: BIBBY | Q898: R EDWARDS | T898: AMBROSE | W898: THORNTON
A899: WILLIAMSTOWN | C899: WARD 3 | F899: TURNER 3 | I899: WILLIAMS 2 | L899: JAMES | N899: EVANS | P899: PELLY | R899: MURPHY
A901: ROUND 20 | E901: 19TH AUGUST | J901: WEATHER | N901: FINE NO WIND | S901: PLAYED AT
D902: 1ST QTR | H902: 2ND QTR | L902: 3RD QTR | P902: FINAL | S902: YARRAVILLE
A903: YARRAVILLE | C903: 3 | D903: 5 | E903: =C903*6+D903 -> 23 | G903: 8 | H903: 5 | I903: =G903*6+H903 -> 53 | K903: 12 | L903: 6 | M903: =K903*6+L903 -> 78 | O903: 15 | P903: 8 | Q903: =O903*6+P903 -> 98 | S903: UMPIRE | X903: LADDER | AB903: ROUND | AD903: 20
A904: OAKLEIGH | C904: 4 | D904: 1 | E904: =C904*6+D904 -> 25 | G904: 6 | H904: 8 | I904: =G904*6+H904 -> 44 | K904: 11 | L904: 12 | M904: =K904*6+L904 -> 78 | O904: 13 | P904: 17 | Q904: =O904*6+P904 -> 95 | S904: MILLEN
A905: BEST PLAYERS | W905: TEAM | X905: W | Y905: L | Z905: D | AA905: FOR | AB905: AGST | AC905: % | AD905: PTS
A906: YARRAVILLE | C906: RON BROWN | F906: McTAGGART | I906: MEDDINGS | L906: CAREY | N906: ORANGE | Q906: HOSKINGS
A907: OAKLEIGH | C907: JONES | F907: HALL | I907: DEFTEROUS | L907: JEWELL | N907: D'ARCY | Q907: COUGHLAN | W907: MOORABBIN | X907: 14 | Y907: 6 | Z907: 0 | AA907: 1639 | AB907: 1389 | AC907: 117.99856011519078 | AD907: 56
A908: GOALKICKERS | W908: YARRAVILLE | X908: 12 | Y908: 8 | Z908: 0 | AA908: 1696 | AB908: 1416 | AC908: 119.77401129943503 | AD908: 48
A909: YARRAVILLE | C909: CAREY 6 | F909: MEDDINGS 3 | I909: RON BROWN 2 | L909: McKENNA | N909: LAMONT | P909: WHITTEN | R909: WILSON | W909: SANDRINGHAM | X909: 12 | Y909: 8 | Z909: 0 | AA909: 1812 | AB909: 1562 | AC909: 116.00512163892445 | AD909: 48
A910: OAKLEIGH | C910: D'ARCY 7 | F910: JEWELL 3 | I910: ASH | K910: RICCI | M910: JONES | W910: WILLIAMSTOWN | X910: 12 | Y910: 8 | Z910: 0 | AA910: 1580 | AB910: 1427 | AC910: 110.72179397337071 | AD910: 48
A912: WILLIAMSTOWN | C912: 5 | D912: 5 | E912: =C912*6+D912 -> 35 | G912: 11 | H912: 8 | I912: =G912*6+H912 -> 74 | K912: 13 | L912: 10 | M912: =K912*6+L912 -> 88 | O912: 16 | P912: 14 | Q912: =O912*6+P912 -> 110 | S912: WILLIAMSTOWN | W912: OAKLEIGH | X912: 11 | Y912: 9 | Z912: 0 | AA912: 1849 | AB912: 1708 | AC912: 108.2552693208431 | AD912: 44
A913: MOORABBIN | C913: 2 | D913: 3 | E913: =C913*6+D913 -> 15 | G913: 2 | H913: 7 | I913: =G913*6+H913 -> 19 | K913: 5 | L913: 8 | M913: =K913*6+L913 -> 38 | O913: 7 | P913: 10 | Q913: =O913*6+P913 -> 52 | S913: MARCY | W913: COBURG | X913: 10 | Y913: 9 | Z913: 1 | AA913: 1630 | AB913: 1589 | AC913: 102.58023914411579 | AD913: 42
A914: BEST PLAYERS | W914: PORT MELBOURNE | X914: 10 | Y914: 10 | Z914: 0 | AA914: 1840 | AB914: 1641 | AC914: 112.12675198049969 | AD914: 40
A915: WILLIAMSTOWN | C915: TURNER | F915: PARKER | I915: MALONEY | L915: SMITH | N915: EVANS | Q915: WARD | W915: BRUNSWICK | X915: 9 | Y915: 11 | Z915: 0 | AA915: 1547 | AB915: 1732 | AC915: 89.32 | AD915: 36
A916: MOORABBIN | C916: GILDER | F916: HENDERSON | I916: HIRST | L916: MANIE | N916: MILLS | Q916: SHEPHERD | W916: MORDIALLOC | X916: 6 | Y916: 14 | Z916: 0 | AA916: 1432 | AB916: 1838 | AC916: 77.91 | AD916: 24
A917: GOALKICKERS | W917: BOX HILL | X917: 3 | Y917: 16 | Z917: 1 | AA917: 1306 | AB917: 2029 | AC917: 64.366683095120749 | AD917: 14
A918: WILLIAMSTOWN | C918: TURNER 6 | F918: WARD 4 | I918: JAMES 4 | K918: MALONEY 2
A919: MOORABBIN | C919: SCHOFIELD 3 | F919: ADAMSON | I919: MANIE | K919: BILLSON | M919: KUPSCH
A921: MORDIALLOC | C921: 5 | D921: 1 | E921: =C921*6+D921 -> 31 | G921: 11 | H921: 2 | I921: =G921*6+H921 -> 68 | K921: 13 | L921: 4 | M921: =K921*6+L921 -> 82 | O921: 17 | P921: 8 | Q921: =O921*6+P921 -> 110 | S921: MORDIALLOC
A922: PORT MELBOURNE | C922: 7 | D922: 4 | E922: =C922*6+D922 -> 46 | G922: 10 | H922: 6 | I922: =G922*6+H922 -> 66 | K922: 14 | L922: 11 | M922: =K922*6+L922 -> 95 | O922: 16 | P922: 12 | Q922: =O922*6+P922 -> 108 | S922: McMASTER
A923: BEST PLAYERS
A924: MORDIALLOC | C924: NESBIT | F924: PEARSON | I924: RITCHIE | L924: BESANKO | O924: CRAWFORD | R924: BURGE
A925: PORT MELBOURNE | C925: LANDORFF | F925: LEWIS | I925: BONNETT | L925: CLAXTON | O925: FREYER | R925: BOWEN
A926: GOALKICKERS
A927: MORDIALLOC | C927: BURGE 6 | F927: PEARSON 4 | I927: KAVANAGH 2 | L927: CRAWFORD 2 | O927: RITCHIE | Q927: GILL | R927: DEAN
A928: PORT MELBOURNE | C928: BONNETT 7 | F928: CLAUSCEN 3 | I928: FREYER 2 | K928: MONKS 2 | M928: LANDORFF | P928: CLAXTON
A930: BOX HILL | C930: 2 | D930: 2 | E930: =C930*6+D930 -> 14 | G930: 6 | H930: 7 | I930: =G930*6+H930 -> 43 | K930: 8 | L930: 12 | M930: =K930*6+L930 -> 60 | O930: 11 | P930: 14 | Q930: =O930*6+P930 -> 80 | S930: BOX HILL
A931: COBURG | C931: 4 | D931: 4 | E931: =C931*6+D931 -> 28 | G931: 8 | H931: 7 | I931: =G931*6+H931 -> 55 | K931: 9 | L931: 8 | M931: =K931*6+L931 -> 62 | O931: 11 | P931: 11 | Q931: =O931*6+P931 -> 77 | S931: O'DONOGHUE
A932: BEST PLAYERS
A933: BOX HILL | C933: GRAY | F933: BEASY | I933: WHITE | L933: QUINN | N933: WITNISH | Q933: CHEFFERS
A934: COBURG | C934: JORDAN | F934: K L O'BRIEN | I934: McNABB | L934: SHORT | N934: COLBERT | Q934: YOUNG
A935: GOALKICKERS
A936: BOX HILL | C936: GRAY 5 | F936: QUINN 2 | I936: BARNES 2 | L936: WHITE | N936: CURRY
A937: COBURG | C937: YOUNG 4 | F937: K L O'BRIEN 3 | I937: RICCI 2 | K937: FITZPATRICK | N937: BUTCHER
A939: SANDRINGHAM | C939: 5 | D939: 7 | E939: =C939*6+D939 -> 37 | G939: 16 | H939: 10 | I939: =G939*6+H939 -> 106 | K939: 20 | L939: 17 | M939: =K939*6+L939 -> 137 | O939: 23 | P939: 21 | Q939: =O939*6+P939 -> 159 | S939: BEACH ROAD
A940: BRUNSWICK | C940: 0 | D940: 3 | E940: =C940*6+D940 -> 3 | G940: 4 | H940: 6 | I940: =G940*6+H940 -> 30 | K940: 8 | L940: 8 | M940: =K940*6+L940 -> 56 | O940: 15 | P940: 12 | Q940: =O940*6+P940 -> 102 | S940: ALLEN
A941: BEST PLAYERS
A942: SANDRINGHAM | C942: SHRIVES | F942: WEBSTER | I942: OAKLEY | L942: MURRAY | O942: MUSGROVE | R942: DAWSON
A943: BRUNSWICK | C943: MATTHEWS | F943: JOHNSON | I943: CLEGG | L943: THORNTON | O943: WILSON | R943: McPHERSON
A944: GOALKICKERS
A945: SANDRINGHAM | C945: OAKLEY 6 | F945: DAWSON 5 | I945: BOLAND 3 | L945: MUTER 2 | N945: WEBSTER 2 | Q945: MURRAY 2 | T945: ALLSOP 2 | W945: GOLDSMITH
A946: BRUNSWICK | C946: R EDWARDS 3 | F946: MATTHEWS 3 | I946: BIBBY 3 | K946: AMBROSE | M946: BUTLER | O946: DENTON | Q946: CLEGG | S946: THORNTON | V946: LEWIS
A948: ROUND 21 | E948: 26TH AUGUST | J948: WEATHER | N948: SOUTH EAST WIND FINE | S948: PLAYED AT
D949: 1ST QTR | H949: 2ND QTR | L949: 3RD QTR | P949: FINAL | S949: MOORABBIN
A950: MOORABBIN | C950: 2 | D950: 4 | E950: =C950*6+D950 -> 16 | G950: 7 | H950: 7 | I950: =G950*6+H950 -> 49 | K950: 11 | L950: 7 | M950: =K950*6+L950 -> 73 | O950: 16 | P950: 11 | Q950: =O950*6+P950 -> 107 | S950: UMPIRE | X950: LADDER | AB950: ROUND | AD950: 21
A951: OAKLEIGH | C951: 0 | D951: 4 | E951: =C951*6+D951 -> 4 | G951: 6 | H951: 7 | I951: =G951*6+H951 -> 43 | K951: 7 | L951: 10 | M951: =K951*6+L951 -> 52 | O951: 8 | P951: 11 | Q951: =O951*6+P951 -> 59 | S951: WOOLFE
A952: BEST PLAYERS | W952: TEAM | X952: W | Y952: L | Z952: D | AA952: FOR | AB952: AGST | AC952: % | AD952: PTS
A953: MOORABBIN | C953: RYAN | F953: CROSHER | I953: WILDIE | K953: PAPLEY | N953: WHALEBONE | Q953: ADAMSON
A954: OAKLEIGH | C954: HALL | F954: JEWELL | I954: BEST | K954: COUGHLAN | N954: DEFTEROUS | Q954: PEAKE | W954: MOORABBIN | X954: 15 | Y954: 6 | Z954: 0 | AA954: 1746 | AB954: 1448 | AC954: 120.58011049723757 | AD954: 60
A955: GOALKICKERS | W955: YARRAVILLE | X955: 13 | Y955: 8 | Z955: 0 | AA955: 1795 | AB955: 1508 | AC955: 119.03183023872678 | AD955: 52
A956: MOORABBIN | C956: PAPLEY 6 | F956: SCHOFIELD 4 | I956: WHALEBONE 3 | L956: CRAMERI | N956: ADAMSON | Q956: KEE | W956: SANDRINGHAM | X956: 13 | Y956: 8 | Z956: 0 | AA956: 1894 | AB956: 1627 | AC956: 116.41057160417947 | AD956: 52
A957: OAKLEIGH | C957: D'ARCY 2 | F957: JEWELL 2 | I957: HALL | K957: JONES | M957: KITTO | O957: MULDOON | W957: WILLIAMSTOWN | X957: 13 | Y957: 8 | Z957: 0 | AA957: 1717 | AB957: 1475 | AC957: 116.40677966101696 | AD957: 52
A959: YARRAVILLE | C959: 2 | D959: 3 | E959: =C959*6+D959 -> 15 | G959: 10 | H959: 7 | I959: =G959*6+H959 -> 67 | K959: 12 | L959: 10 | M959: =K959*6+L959 -> 82 | O959: 14 | P959: 15 | Q959: =O959*6+P959 -> 99 | S959: COBURG | W959: OAKLEIGH | X959: 11 | Y959: 10 | Z959: 0 | AA959: 1908 | AB959: 1815 | AC959: 105.12396694214875 | AD959: 44
A960: COBURG | C960: 4 | D960: 5 | E960: =C960*6+D960 -> 29 | G960: 6 | H960: 6 | I960: =G960*6+H960 -> 42 | K960: 9 | L960: 10 | M960: =K960*6+L960 -> 64 | O960: 13 | P960: 14 | Q960: =O960*6+P960 -> 92 | S960: BAIRD | W960: COBURG | X960: 10 | Y960: 10 | Z960: 1 | AA960: 1722 | AB960: 1688 | AC960: 102.01421800947867 | AD960: 42
A961: BEST PLAYERS | W961: PORT MELBOURNE | X961: 10 | Y961: 11 | Z961: 0 | AA961: 1905 | AB961: 1723 | AC961: 110.56297156123041 | AD961: 40
A962: YARRAVILLE | C962: CROOK | F962: MEDDINGS | I962: McGILL | L962: WHITTEN | O962: BOB BROWN | R962: McCARTHY | W962: BRUNSWICK | X962: 9 | Y962: 12 | Z962: 0 | AA962: 1600 | AB962: 1792 | AC962: 89.29 | AD962: 36
A963: COBURG | C963: TANCREDI | F963: JORDAN | I963: FITZPATRICK | L963: SHORT | O963: K O'BRIEN | R963: McNABB | W963: MORDIALLOC | X963: 7 | Y963: 14 | Z963: 0 | AA963: 1492 | AB963: 1891 | AC963: 78.9 | AD963: 28
A964: GOALKICKERS | W964: BOX HILL | X964: 3 | Y964: 17 | Z964: 1 | AA964: 1354 | AB964: 2166 | AC964: 62.511542012927052 | AD964: 14
A965: YARRAVILLE | C965: WHITTEN 6 | F965: RON BROWN 2 | I965: MEDDINGS 2 | L965: CROOK 2 | N965: LAMONT | Q965: McCARTHY
A966: COBURG | C966: JORDAN 4 | F966: CARR 4 | H966: RICCI | J966: K L O'BRIEN | M966: KERR | N966: SHORT | P966: FITZPATRICK
A968: SANDRINGHAM | C968: 2 | D968: 0 | E968: =C968*6+D968 -> 12 | G968: 5 | H968: 5 | I968: =G968*6+H968 -> 35 | K968: 9 | L968: 6 | M968: =K968*6+L968 -> 60 | O968: 12 | P968: 10 | Q968: =O968*6+P968 -> 82 | S968: PORT MELBOURNE
A969: PORT MELBOURNE | C969: 3 | D969: 6 | E969: =C969*6+D969 -> 24 | G969: 5 | H969: 8 | I969: =G969*6+H969 -> 38 | K969: 8 | L969: 11 | M969: =K969*6+L969 -> 59 | O969: 9 | P969: 11 | Q969: =O969*6+P969 -> 65 | S969: MARCY
A970: BEST PLAYERS
A971: SANDRINGHAM | C971: WEBSTER | F971: KELTON | I971: DAWSON | L971: HOAR | O971: SHRIVES | R971: PELUSO
A972: PORT MELBOURNE | C972: BOWEN | F972: CLAXTON | I972: TOLSHER | L972: A CAMERON | O972: LANDORFF | R972: STRAUCH
A973: GOALKICKERS
A974: SANDRINGHAM | C974: BRYAN 4 | F974: DAWSON 2 | I974: OAKLEY 2 | L974: MUTER | N974: ALLSOP | P974: KELTON | R974: PELUSO
A975: PORT MELBOURNE | C975: BONNETT 4 | F975: LAWSON 2 | I975: FITZGERALD | L975: BOWEN | N975: McRAE
A977: MORDIALLOC | C977: 3 | D977: 4 | E977: =C977*6+D977 -> 22 | G977: 6 | H977: 9 | I977: =G977*6+H977 -> 45 | K977: 7 | L977: 10 | M977: =K977*6+L977 -> 52 | O977: 8 | P977: 12 | Q977: =O977*6+P977 -> 60 | S977: MORDIALLOC
A978: BRUNSWICK | C978: 1 | D978: 2 | E978: =C978*6+D978 -> 8 | G978: 1 | H978: 3 | I978: =G978*6+H978 -> 9 | K978: 6 | L978: 9 | M978: =K978*6+L978 -> 45 | O978: 7 | P978: 11 | Q978: =O978*6+P978 -> 53 | S978: O'DONOGHUE
A979: BEST PLAYERS
A980: MORDIALLOC | C980: DULLARD | F980: PEARSON | I980: BURGE | L980: NESBIT | O980: McHENRY | R980: ROBERTS
A981: BRUNSWICK | C981: CLEGG | F981: THOMPSON | I981: R EDWARDS | L981: DENTON | O981: DILLON | R981: BIBBY
A982: GOALKICKERS
A983: MORDIALLOC | C983: BURGE 5 | F983: PEARSON 3
A984: BRUNSWICK | C984: BUTLER 2 | F984: McPHERSON | I984: BIBBY | K984: MATTHEWS | N984: LEWIS | P984: CLEGG
A986: WILLIAMSTOWN | C986: 5 | D986: 4 | E986: =C986*6+D986 -> 34 | G986: 9 | H986: 11 | I986: =G986*6+H986 -> 65 | K986: 12 | L986: 19 | M986: =K986*6+L986 -> 91 | O986: 18 | P986: 29 | Q986: =O986*6+P986 -> 137 | S986: WILLIAMSTOWN
A987: BOX HILL | C987: 4 | D987: 2 | E987: =C987*6+D987 -> 26 | G987: 6 | H987: 2 | I987: =G987*6+H987 -> 38 | K987: 6 | L987: 6 | M987: =K987*6+L987 -> 42 | O987: 7 | P987: 6 | Q987: =O987*6+P987 -> 48 | S987: McMASTER
A988: BEST PLAYERS
A989: WILLIAMSTOWN | C989: SMITH | F989: MALONEY | I989: MURPHY | L989: WARD | N989: PARKER | Q989: TURNER
A990: BOX HILL | C990: CRAIG | F990: WHITE | I990: BEASY | L990: BATCH | N990: QUINN | Q990: GRAY
A991: GOALKICKERS
A992: WILLIAMSTOWN | C992: TURNER 5 | F992: MURPHY 4 | I992: JAMES 3 | K992: PELLY 3 | M992: O'TOOLE 2 | P992: CARMICHAEL
A993: BOX HILL | C993: WHITE 3 | F993: BEASY 2 | I993: QUINN | K993: BARNES
A995: ROUND 22 | E995: 2ND SEPTEMBER | J995: WEATHER | M995: SOUTH EAST WIND LIGHT SHOWERS | S995: PLAYED AT
D996: 1ST QTR | H996: 2ND QTR | L996: 3RD QTR | P996: FINAL | S996: BEACH ROAD
A997: SANDRINGHAM | C997: 3 | D997: 0 | E997: =C997*6+D997 -> 18 | G997: 7 | H997: 2 | I997: =G997*6+H997 -> 44 | K997: 10 | L997: 3 | M997: =K997*6+L997 -> 63 | O997: 14 | P997: 10 | Q997: =O997*6+P997 -> 94 | S997: UMPIRE | X997: LADDER | AB997: ROUND | AD997: 22
A998: WILLIAMSTOWN | C998: 2 | D998: 8 | E998: =C998*6+D998 -> 20 | G998: 5 | H998: 13 | I998: =G998*6+H998 -> 43 | K998: 9 | L998: 17 | M998: =K998*6+L998 -> 71 | O998: 10 | P998: 17 | Q998: =O998*6+P998 -> 77 | S998: O'DONOGHUE
A999: BEST PLAYERS | W999: TEAM | X999: W | Y999: L | Z999: D | AA999: FOR | AB999: AGST | AC999: % | AD999: PTS
A1000: SANDRINGHAM | C1000: SHRIVES | F1000: MURRAY | I1000: HOAR | L1000: BRYAN | N1000: SHEERAN | Q1000: BURKE
A1001: WILLIAMSTOWN | C1001: PELLY | F1001: PARKER | I1001: CARMICHAEL | L1001: COPE | N1001: SMITH | Q1001: TAUBE | W1001: MOORABBIN | X1001: 16 | Y1001: 6 | Z1001: 0 | AA1001: 1870 | AB1001: 1501 | AC1001: 124.5836109260493 | AD1001: 64
A1002: GOALKICKERS | W1002: YARRAVILLE | X1002: 14 | Y1002: 8 | Z1002: 0 | AA1002: 1887 | AB1002: 1580 | AC1002: 119.43037974683544 | AD1002: 56
A1003: SANDRINGHAM | C1003: BRYAN 6 | F1003: BOLAND 4 | I1003: MURRAY 2 | L1003: DAWSON | N1003: WEBSTER | W1003: SANDRINGHAM | X1003: 14 | Y1003: 8 | Z1003: 0 | AA1003: 1988 | AB1003: 1704 | AC1003: 116.66666666666667 | AD1003: 56
A1004: WILLIAMSTOWN | C1004: CARMICHAEL 2 | F1004: SMITH 2 | I1004: O'TOOLE 2 | L1004: JAMES | N1004: WARD | P1004: PELLY | R1004: McASEY | W1004: WILLIAMSTOWN | X1004: 13 | Y1004: 9 | Z1004: 0 | AA1004: 1794 | AB1004: 1569 | AC1004: 114.34034416826003 | AD1004: 52
A1006: OAKLEIGH | C1006: 1 | D1006: 1 | E1006: =C1006*6+D1006 -> 7 | G1006: 5 | H1006: 9 | I1006: =G1006*6+H1006 -> 39 | K1006: 12 | L1006: 16 | M1006: =K1006*6+L1006 -> 88 | O1006: 16 | P1006: 18 | Q1006: =O1006*6+P1006 -> 114 | S1006: OAKLEIGH | W1006: OAKLEIGH | X1006: 12 | Y1006: 10 | Z1006: 0 | AA1006: 2022 | AB1006: 1882 | AC1006: 107.43889479277364 | AD1006: 48
A1007: COBURG | C1007: 3 | D1007: 2 | E1007: =C1007*6+D1007 -> 20 | G1007: 4 | H1007: 4 | I1007: =G1007*6+H1007 -> 28 | K1007: 6 | L1007: 5 | M1007: =K1007*6+L1007 -> 41 | O1007: 10 | P1007: 7 | Q1007: =O1007*6+P1007 -> 67 | S1007: TREWIN | W1007: PORT MELBOURNE | X1007: 11 | Y1007: 11 | Z1007: 0 | AA1007: 2015 | AB1007: 1823 | AC1007: 110.53208996160176 | AD1007: 44
A1008: BEST PLAYERS | W1008: COBURG | X1008: 10 | Y1008: 11 | Z1008: 1 | AA1008: 1789 | AB1008: 1802 | AC1008: 99.278579356270811 | AD1008: 42
A1009: OAKLEIGH | C1009: JONES | F1009: PEAKE | I1009: DEFTEROUS | L1009: COUGHLAN | O1009: JEWELL | Q1009: RICCI | W1009: BRUNSWICK | X1009: 9 | Y1009: 13 | Z1009: 0 | AA1009: 1653 | AB1009: 1916 | AC1009: 86.27 | AD1009: 36
A1010: COBURG | C1010: RICCI | F1010: LYNCH | I1010: SULLIVAN | L1010: TANCREDI | O1010: SHORT | Q1010: EDWARDS | W1010: MORDIALLOC | X1010: 7 | Y1010: 15 | Z1010: 0 | AA1010: 1564 | AB1010: 1983 | AC1010: 78.87 | AD1010: 28
A1011: GOALKICKERS | W1011: BOX HILL | X1011: 3 | Y1011: 18 | Z1011: 1 | AA1011: 1454 | AB1011: 2276 | AC1011: 63.884007029876976 | AD1011: 14
A1012: OAKLEIGH | C1012: JEWELL 4 | F1012: JONES 3 | I1012: HALL 3 | K1012: COUGHLAN 2 | N1012: RICCI 2 | P1012: D'ARCY | R1012: BEST
A1013: COBURG | C1013: RICCI 4 | F1013: CLARKSON 2 | I1013: SHORT | K1013: EDWARDS | N1013: MURPHY | P1013: CARR
A1015: PORT MELBOURNE | C1015: 2 | D1015: 2 | E1015: =C1015*6+D1015 -> 14 | G1015: 9 | H1015: 7 | I1015: =G1015*6+H1015 -> 61 | K1015: 10 | L1015: 8 | M1015: =K1015*6+L1015 -> 68 | O1015: 16 | P1015: 14 | Q1015: =O1015*6+P1015 -> 110 | S1015: BOX HILL
A1016: BOX HILL | C1016: 4 | D1016: 3 | E1016: =C1016*6+D1016 -> 27 | G1016: 4 | H1016: 5 | I1016: =G1016*6+H1016 -> 29 | K1016: 10 | L1016: 9 | M1016: =K1016*6+L1016 -> 69 | O1016: 15 | P1016: 10 | Q1016: =O1016*6+P1016 -> 100 | S1016: WOOLFE
A1017: BEST PLAYERS
A1018: PORT MELBOURNE | C1018: LANDORFF | F1018: MONKS | I1018: TOLSHER | L1018: LEWIS | N1018: McLEOD | Q1018: CLAXTON
A1019: BOX HILL | C1019: CRAIG | F1019: QUINN | I1019: WHITE | L1019: BEASY | N1019: CHEFFERS | Q1019: ROSS
A1020: GOALKICKERS
A1021: PORT MELBOURNE | C1021: BONNETT 7 | F1021: CLAXTON 3 | I1021: MONKS 2 | K1021: CLAUSCEN 2 | N1021: WEIGARD | Q1021: TOLSHER
A1022: BOX HILL | C1022: BARNES 4 | F1022: PRESTON 2 | I1022: BEASY 2 | K1022: WHITE 2 | M1022: QUINN 2 | O1022: BLACKALL | Q1022: CURRY | S1022: GRAY
A1024: MOORABBIN | C1024: 3 | D1024: 0 | E1024: =C1024*6+D1024 -> 18 | G1024: 7 | H1024: 4 | I1024: =G1024*6+H1024 -> 46 | K1024: 14 | L1024: 7 | M1024: =K1024*6+L1024 -> 91 | O1024: 19 | P1024: 10 | Q1024: =O1024*6+P1024 -> 124 | S1024: BRUNSWICK
A1025: BRUNSWICK | C1025: 3 | D1025: 4 | E1025: =C1025*6+D1025 -> 22 | G1025: 3 | H1025: 4 | I1025: =G1025*6+H1025 -> 22 | K1025: 3 | L1025: 7 | M1025: =K1025*6+L1025 -> 25 | O1025: 7 | P1025: 11 | Q1025: =O1025*6+P1025 -> 53 | S1025: MILLEN
A1026: BEST PLAYERS
A1027: MOORABBIN | C1027: PAPLEY | E1027: WHALEBONE | H1027: RYAN | K1027: WILDIE | N1027: MANIE | Q1027: MILLS
A1028: BRUNSWICK | C1028: CLEGG | E1028: JOHNSON | H1028: DENTON | K1028: THORNTON | N1028: McKENNA | Q1028: AYRES
A1029: GOALKICKERS
A1030: MOORABBIN | C1030: PAPLEY 5 | F1030: RYAN 3 | H1030: SCHOFIELD 3 | K1030: WHALEBONE 2 | N1030: SHEPHERD 2 | Q1030: MANIE | S1030: ADAMSON | W1030: PERRY | X1030: KEE
A1031: BRUNSWICK | C1031: STANLEY 3 | F1031: DENTON | H1031: MATTHEWS | K1031: WHILEY | M1031: BUTLER
A1033: YARRAVILLE | C1033: 2 | D1033: 3 | E1033: =C1033*6+D1033 -> 15 | G1033: 6 | H1033: 8 | I1033: =G1033*6+H1033 -> 44 | K1033: 7 | L1033: 12 | M1033: =K1033*6+L1033 -> 54 | O1033: 13 | P1033: 14 | Q1033: =O1033*6+P1033 -> 92 | S1033: YARRAVILLE
A1034: MORDIALLOC | C1034: 5 | D1034: 4 | E1034: =C1034*6+D1034 -> 34 | G1034: 7 | H1034: 4 | I1034: =G1034*6+H1034 -> 46 | K1034: 9 | L1034: 6 | M1034: =K1034*6+L1034 -> 60 | O1034: 11 | P1034: 6 | Q1034: =O1034*6+P1034 -> 72 | S1034: MARCY
A1035: BEST PLAYERS
A1036: YARRAVILLE | C1036: McGILL | E1036: RON BROWN | H1036: McCARTHY | K1036: McKENNA | N1036: NARKIEWICZ | Q1036: CROOK
A1037: MORDIALLOC | C1037: CRANE | E1037: DULLARD | H1037: BURGE | K1037: WILLIAMS | N1037: WILLIAMSON | Q1037: HORNE
A1038: GOALKICKERS
A1039: YARRAVILLE | C1039: McCARTHY 5 | F1039: RON BROWN 3 | I1039: CROOK 3 | K1039: MEDDINGS | N1039: VAUTIER
A1040: MORDIALLOC | C1040: CRANE 8 | F1040: NESBIT 2 | I1040: PETRIE
A1042: FINALS
A1043: 1ST SEMI | D1043: 9TH SEPTEMBER | I1043: WEATHER | L1043: SOUTH WEST WIND FINE & SUNNY
D1044: 1ST QTR | H1044: 2ND QTR | L1044: 3RD QTR | P1044: FINAL
A1045: WILLIAMSTOWN | C1045: 4 | D1045: 1 | E1045: =C1045*6+D1045 -> 25 | G1045: 7 | H1045: 2 | I1045: =G1045*6+H1045 -> 44 | K1045: 8 | L1045: 5 | M1045: =K1045*6+L1045 -> 53 | O1045: 12 | P1045: 7 | Q1045: 79 | S1045: JUNCTION OVAL
A1046: SANDRINGHAM | C1046: 5 | D1046: 3 | E1046: =C1046*6+D1046 -> 33 | G1046: 5 | H1046: 4 | I1046: =G1046*6+H1046 -> 34 | K1046: 8 | L1046: 5 | M1046: =K1046*6+L1046 -> 53 | O1046: 9 | P1046: 8 | Q1046: 62 | S1046: WOOLFE
A1047: BEST PLAYERS
A1048: WILLIAMSTOWN | C1048: PELLY | F1048: FINCH | I1048: RUSSELL | L1048: COLLINS | O1048: TURNER | Q1048: SMITH
A1049: SANDRINGHAM | C1049: MURRAY | F1049: STEELE | I1049: McKENZIE | L1049: SHEERAN | O1049: BURKE | Q1049: SHRIVES
A1050: GOALKICKERS
A1051: WILLIAMSTOWN | C1051: TURNER 3 | F1051: PELLY 2 | I1051: McASEY 2 | L1051: CARMICHAEL | O1051: MALONEY | Q1051: MURPHY | S1051: WILLIAMS | W1051: EVANS
A1052: SANDRINGHAM | C1052: BOLAND 4 | F1052: WEBSTER 2 | I1052: OAKLEY | K1052: BRISTOWE | N1052: MURRAY
A1054: 2ND SEMI | D1054: 16TH SEPTEMBER | I1054: WEATHER | L1054: SOUTH EAST WIND LIGHT SHOWERS
A1055: YARRAVILLE | C1055: 1 | D1055: 2 | E1055: =C1055*6+D1055 -> 8 | G1055: 4 | H1055: 3 | I1055: =G1055*6+H1055 -> 27 | K1055: 10 | L1055: 9 | M1055: =K1055*6+L1055 -> 69 | O1055: 13 | P1055: 14 | Q1055: 92 | S1055: JUNCTION OVAL
A1056: MOORABBIN | C1056: 1 | D1056: 4 | E1056: =C1056*6+D1056 -> 10 | G1056: 5 | H1056: 9 | I1056: =G1056*6+H1056 -> 39 | K1056: 6 | L1056: 9 | M1056: =K1056*6+L1056 -> 45 | O1056: 8 | P1056: 14 | Q1056: 62 | S1056: O'DONOGHUE
A1057: BEST PLAYERS
A1058: YARRAVILLE | C1058: McTAGGART | F1058: BOB BROWN | I1058: WILSON | L1058: McGILL | N1058: CROOK | Q1058: CLEGG
A1059: MOORABBIN | C1059: PAPLEY | F1059: GILDER | I1059: WHALEBONE | L1059: KEE | N1059: MANIE | Q1059: WILDIE
A1060: GOALKICKERS
A1061: YARRAVILLE | C1061: MEDDINGS 3 | F1061: CROOK 3 | I1061: WILSON 3 | L1061: WHITTEN 2 | O1061: LAMONT | Q1061: McCARTHY
A1062: MOORABBIN | C1062: KEE 2 | F1062: PAPLEY 2 | I1062: MANIE 2 | L1062: CRUTCHFIELD | O1062: SCHOFIELD
A1064: PRELIMINARY FINAL | F1064: 23RD SEPTEMBER | J1064: WEATHER | M1064: LIGHT SOUTH WEST BREEZE FINE
A1065: WILLIAMSTOWN | C1065: 4 | D1065: 2 | E1065: =C1065*6+D1065 -> 26 | G1065: 7 | H1065: 11 | I1065: =G1065*6+H1065 -> 53 | K1065: 11 | L1065: 13 | M1065: =K1065*6+L1065 -> 79 | O1065: 14 | P1065: 17 | Q1065: 101 | S1065: JUNCTION OVAL
A1066: MOORABBIN | C1066: 5 | D1066: 2 | E1066: =C1066*6+D1066 -> 32 | G1066: 8 | H1066: 4 | I1066: =G1066*6+H1066 -> 52 | K1066: 11 | L1066: 5 | M1066: =K1066*6+L1066 -> 71 | O1066: 15 | P1066: 7 | Q1066: 97 | S1066: McMASTER
A1067: BEST PLAYERS
A1068: WILLIAMSTOWN | C1068: CARMICHAEL | F1068: FINCH | I1068: MAZOURIS | L1068: SMITH | N1068: EVANS | Q1068: TURNER
A1069: MOORABBIN | C1069: KEE | F1069: HOY | I1069: McGAW | L1069: BUZZA | N1069: CROSHER | Q1069: PERRY
A1070: GOALKICKERS
A1071: WILLIAMSTOWN | C1071: MAZOURIS 5 | F1071: MURPHY 3 | I1071: MALONEY 2 | L1071: EVANS 2 | N1071: SMITH | P1071: PELLY
A1072: MOORABBIN | C1072: KEE 4 | E1072: PAPLEY 3 | G1072: RYAN 2 | I1072: WHALEBONE | L1072: HOY | M1072: MANIE | O1072: McGAW | Q1072: KERR | S1072: CRAMERI
A1074: GRAND FINAL | E1074: 30TH SEPTEMBER | J1074: WEATHER | M1074: NORTH WIND HOT (88`F)
A1075: YARRAVILLE | C1075: 6 | D1075: 2 | E1075: =C1075*6+D1075 -> 38 | G1075: 8 | H1075: 2 | I1075: =G1075*6+H1075 -> 50 | K1075: 19 | L1075: 6 | M1075: =K1075*6+L1075 -> 120 | O1075: 22 | P1075: 7 | Q1075: =O1075*6+P1075 -> 139 | S1075: JUNCTION OVAL
A1076: WILLIAMSTOWN | C1076: 1 | D1076: 0 | E1076: =C1076*6+D1076 -> 6 | G1076: 5 | H1076: 6 | I1076: =G1076*6+H1076 -> 36 | K1076: 6 | L1076: 7 | M1076: =K1076*6+L1076 -> 43 | O1076: 11 | P1076: 10 | Q1076: =O1076*6+P1076 -> 76 | S1076: WOOLFE
A1077: BEST PLAYERS
A1078: YARRAVILLE | C1078: CLEGG | F1078: CROOK | I1078: McCARTHY | L1078: McTAGGART | O1078: RON BROWN | R1078: BOB BROWN
A1079: WILLIAMSTOWN | C1079: McASEY | F1079: COLLINS | I1079: PARKER | L1079: EVANS | O1079: CLOUGH | R1079: TAUBE
A1080: GOALKICKERS
A1081: YARRAVILLE | C1081: CROOK 4 | E1081: McCARTHY 4 | H1081: MEDDINGS 3 | K1081: CAREY 3 | M1081: WHITTEN 2 | P1081: LAMONT 2 | R1081: RON BROWN | U1081: McGILL | X1081: VAUTIER | AA1081: PEARCE
A1082: WILLIAMSTOWN | C1082: CLOUGH 4 | F1082: MAZOURIS 3 | I1082: MALONEY | K1082: PELLY | M1082: COPE | O1082: WILLIAMS
A1084: 2ND DIVISION RUNNER-UP VS | F1084: 9TH TEAM 1ST DIVISION
A1085: MORDIALLOC | C1085: 5 | D1085: 4 | E1085: =C1085*6+D1085 -> 34 | G1085: 9 | H1085: 6 | I1085: =G1085*6+H1085 -> 60 | K1085: 14 | L1085: 10 | M1085: =K1085*6+L1085 -> 94 | O1085: 18 | P1085: 12 | Q1085: 120 | S1085: DANDENONG
A1086: DANDENONG | C1086: 3 | D1086: 5 | E1086: =C1086*6+D1086 -> 23 | G1086: 4 | H1086: 9 | I1086: =G1086*6+H1086 -> 33 | K1086: 9 | L1086: 16 | M1086: =K1086*6+L1086 -> 70 | O1086: 13 | P1086: 19 | Q1086: 97 | S1086: TREWIN
A1087: BEST PLAYERS
A1088: MORDIALLOC | C1088: CRANE | F1088: NESBIT | I1088: PEARSON | L1088: HORNE | O1088: BLAINEY | R1088: CRAWFORD
A1089: DANDENONG | C1089: MORRIS | F1089: DINEEN | I1089: ROSETTI | L1089: B WATERS | O1089: ABRAHAM | R1089: GRAY
A1090: GOALKICKERS
A1091: MORDIALLOC | C1091: CRANE 11 | F1091: MINAHAN 3 | I1091: PEARSON 2 | L1091: KAVANAGH | O1091: GILL
A1092: DANDENONG | C1092: T WATERS 3 | F1092: B WATERS 2 | I1092: MINOTTI 2 | L1092: MORRIS 2 | N1092: ABRAHAM 2 | Q1092: DINEEN | S1092: DELANTY
A1094: INTERSTATE MATCH | F1094: 12TH JUNE
A1095: TASMANIA | C1095: 5 | D1095: 3 | E1095: =C1095*6+D1095 -> 33 | G1095: 9 | H1095: 7 | I1095: =G1095*6+H1095 -> 61 | K1095: 12 | L1095: 8 | M1095: =K1095*6+L1095 -> 80 | O1095: 17 | P1095: 12 | Q1095: =O1095*6+P1095 -> 114 | S1095: NORTH HOBART
A1096: V.F.A. | C1096: 0 | D1096: 10 | E1096: =C1096*6+D1096 -> 10 | G1096: 3 | H1096: 15 | I1096: =G1096*6+H1096 -> 33 | K1096: 7 | L1096: 22 | M1096: =K1096*6+L1096 -> 64 | O1096: 11 | P1096: 25 | Q1096: =O1096*6+P1096 -> 91 | S1096: W ANDREW (V.F.L.)
A1097: BEST PLAYERS
A1098: TASMANIA | C1098: LEO | F1098: NOBLE | I1098: GEARD | L1098: SYMONS | O1098: WITHERS | R1098: COLE
A1099: V.F.A. | C1099: JORDAN | F1099: GILDER | I1099: CAMERON | L1099: CROSBIE | O1099: PENNEFATHER | R1099: WRIGHT
A1100: GOALKICKERS
A1101: TASMANIA | C1101: LEO 5 | E1101: COLE 4 | G1101: SYMONS 4 | J1101: ARCHER 2 | M1101: BALDOCK | P1101: HAWKSLEY
A1102: V.F.A. | C1102: JORDAN 5 | F1102: WHALEBONE 2 | J1102: MEDDINGS 2 | M1102: PAPLEY | O1102: OSBORNE
A1104: TEAMS
H1105: V.F.A.
A1106: BACKS | C1106: L GILBERT (MOORABBIN) | H1106: A CAMERON (P.M.) | L1106: N WRIGHT (N'COTE)
A1107: H-BACKS | C1107: J PENNEFATHER (D'NONG) | H1107: J WHILEY (B'WICK) | L1107: R CARR (COB)
A1108: CENTRES | C1108: R BESANKO (M'LLOC) | H1108: R SMITH (WILLIAMSTOWN) | L1108: I WITNISH (B.H.)
A1109: H-FORWARDS | C1109: M PAPLEY (MOORABBIN) | H1109: R MURRAY (S'HAM) | L1109: R FREYER (P.M.)
A1110: FORWARDS | C1110: A OSBORNE (D'NONG) | H1110: K MEDDINGS (Y'VILLE) | L1110: B WHALEBONE (MOORABBIN)
A1111: RUCKS | C1111: M CROSBIE (S'SHINE) | H1111: J COUGHLAN (OAK) | L1111: R JORDAN (COB)
A1112: INT | C1112: G MUTER (S'HAM) | H1112: C STRACHAN (S'HAM) | L1112: R MURNANE (P'TON)