A1: Victorian Football Association
A2: Season 1962 - Division One
A3: © Copyright Wal Williams | F3: First created: 2 May 2015
A4: Contact: joywalwi at gmail dot com | F4: Last updated: 8 October 2017 | W4: VFA Results and tables - Link to the main index page
A5: You are free to copy this document in whole or part provided that proper acknowledgement is given to the author. All rights reserved.
A7: 1962 V.F.A. SEASON 1ST DIVISION | CA7: \D | CB7: {GOTO}BJ3~/M{RIGHT 7}{END}{DOWN}~G4~
A8: ROUND 1 | E8: 28TH APRIL | J8: WEATHER | N8: SOUTH BREEZE RAIN | S8: PLAYED AT | CB8: {GOTO}AL3~/M{END}{RIGHT}{END}{DOWN}~P3~
D9: 1ST QTR | H9: 2ND QTR | L9: 3RD QTR | P9: FINAL | S9: BEACH ROAD | CB9: {GOTO}BJ23~/M{RIGHT 7}{END}{DOWN}~V4~
A10: MOORABBIN | C10: 5 | D10: 2 | E10: =C10*6+D10 -> 32 | G10: 6 | H10: 3 | I10: =G10*6+H10 -> 39 | K10: 10 | L10: 7 | M10: =K10*6+L10 -> 67 | O10: 13 | P10: 8 | Q10: =O10*6+P10 -> 86 | S10: UMPIRE | X10: LADDER | AB10: ROUND | AD10: 1 | CB10: {GOTO}BJ43~/M{RIGHT 7}{END}{DOWN}~G24~
A11: SANDRINGHAM | C11: 0 | D11: 2 | E11: =C11*6+D11 -> 2 | G11: 3 | H11: 6 | I11: =G11*6+H11 -> 24 | K11: 5 | L11: 9 | M11: =K11*6+L11 -> 39 | O11: 10 | P11: 13 | Q11: =O11*6+P11 -> 73 | S11: WOOLFE | CB11: {GOTO}AL23~/M{END}{RIGHT}{END}{DOWN}~P23~
A12: BEST PLAYERS | W12: TEAM | X12: W | Y12: L | Z12: D | AA12: FOR | AB12: AGST | AC12: % | AD12: PTS | CB12: {GOTO}BJ63~/M{RIGHT 7}{END}{DOWN}~V24~
A13: MOORABBIN | C13: P BURNS | F13: PAPLEY | I13: CRAMERI | L13: PERRY | O13: CROSHER | R13: KERR | CB13: {GOTO}BJ83~/M{RIGHT 7}{END}{DOWN}~G44~
A14: SANDRINGHAM | C14: K BURNS | F14: MUTER | I14: CLARK | L14: McKENZIE | O14: O'TOOLE | R14: SHEERAN | W14: COBURG | X14: 1 | Y14: 0 | Z14: 0 | AA14: 96 | AB14: 58 | AC14: 165.51724137931035 | AD14: 4 | CB14: {GOTO}AL43~/M{END}{RIGHT}{END}{DOWN}~P43~
A15: GOALKICKERS | W15: MOORABBIN | X15: 1 | Y15: 0 | Z15: 0 | AA15: 86 | AB15: 73 | AC15: 117.8082191780822 | AD15: 4 | CB15: {GOTO}BJ103~/M{RIGHT 7}{END}{DOWN}~V44~
A16: MOORABBIN | C16: PAPLEY 6 | F16: P BURNS 3 | I16: RYAN 2 | L16: HARRISON 2 | W16: NORTHCOTE | X16: 1 | Y16: 0 | Z16: 0 | AA16: 61 | AB16: 53 | AC16: 115.09433962264151 | AD16: 4 | CB16: {GOTO}BJ123~/M{RIGHT 7}{END}{DOWN}~G64~
A17: SANDRINGHAM | C17: K BURNS 4 | F17: MUTER 2 | I17: CLARK 2 | L17: BRYAN | N17: DAWSON | W17: OAKLEIGH | X17: 1 | Y17: 0 | Z17: 0 | AA17: 56 | AB17: 49 | AC17: 114.28571428571429 | AD17: 4 | CB17: {GOTO}AL63~/M{END}{RIGHT}{END}{DOWN}~P63~
CB18: {GOTO}BJ143~/M{RIGHT 7}{END}{DOWN}~V64~
A19: YARRAVILLE | C19: 3 | D19: 3 | E19: =C19*6+D19 -> 21 | G19: 5 | H19: 6 | I19: =G19*6+H19 -> 36 | K19: 7 | L19: 8 | M19: =K19*6+L19 -> 50 | O19: 8 | P19: 11 | Q19: =O19*6+P19 -> 59 | S19: WILLIAMSTOWN | W19: YARRAVILLE | X19: 1 | Y19: 0 | Z19: 0 | AA19: 59 | AB19: 55 | AC19: 107.27272727272727 | AD19: 4 | CB19: {GOTO}BJ163~/M{RIGHT 7}{END}{DOWN}~G84~
A20: WILLIAMSTOWN | C20: 1 | D20: 2 | E20: =C20*6+D20 -> 8 | G20: 1 | H20: 8 | I20: =G20*6+H20 -> 14 | K20: 3 | L20: 9 | M20: =K20*6+L20 -> 27 | O20: 7 | P20: 13 | Q20: =O20*6+P20 -> 55 | S20: JACKSON | W20: WILLIAMSTOWN | X20: 0 | Y20: 1 | Z20: 0 | AA20: 55 | AB20: 59 | AC20: 93.220338983050851 | AD20: 0 | CB20: {GOTO}AL83~/M{END}{RIGHT}{END}{DOWN}~P83~
A21: BEST PLAYERS | W21: MORDIALLOC | X21: 0 | Y21: 1 | Z21: 0 | AA21: 49 | AB21: 56 | AC21: 87.5 | AD21: 0 | CB21: {GOTO}BJ183~/M{RIGHT 7}{END}{DOWN}~V84~
A22: YARRAVILLE | C22: BOB BROWN | F22: WHITTEN | I22: McTAGGART | L22: CLEGG | N22: TARRANT | Q22: BURR | W22: PORT MELBOURNE | X22: 0 | Y22: 1 | Z22: 0 | AA22: 53 | AB22: 61 | AC22: 86.885245901639351 | AD22: 0 | CB22: {GOTO}BJ203~/M{RIGHT 7}{END}{DOWN}~G104~
A23: WILLIAMSTOWN | C23: CARMICHAEL | F23: BAMFORD | I23: COPE | L23: WARD | N23: TURNER | Q23: JAMES | W23: SANDRINGHAM | X23: 0 | Y23: 1 | Z23: 0 | AA23: 73 | AB23: 86 | AC23: 84.883720930232556 | AD23: 0 | CB23: {GOTO}AL103~/M{END}{RIGHT}{END}{DOWN}~P103~
A24: GOALKICKERS | W24: BRUNSWICK | X24: 0 | Y24: 1 | Z24: 0 | AA24: 58 | AB24: 96 | AC24: 60.416666666666664 | AD24: 0 | CB24: {GOTO}BJ223~/M{RIGHT 7}{END}{DOWN}~V104~
A25: YARRAVILLE | C25: BURR 2 | F25: WHITTEN 2 | I25: CLEGG 2 | L25: CROOK | N25: VAUTIER | CB25: {GOTO}BJ243~/M{RIGHT 7}{END}{DOWN}~G124~
A26: WILLIAMSTOWN | C26: JAMES 5 | F26: WILLIAMS | I26: CLOUGH | CB26: {GOTO}AL123~/M{END}{RIGHT}{END}{DOWN}~P123~
CB27: {GOTO}BJ263~/M{RIGHT 7}{END}{DOWN}~V124~
A28: OAKLEIGH | C28: 2 | D28: 8 | E28: =C28*6+D28 -> 20 | G28: 3 | H28: 9 | I28: =G28*6+H28 -> 27 | K28: 4 | L28: 16 | M28: =K28*6+L28 -> 40 | O28: 6 | P28: 20 | Q28: =O28*6+P28 -> 56 | S28: MORDIALLOC | CB28: {GOTO}BJ283~/M{RIGHT 7}{END}{DOWN}~G144~
A29: MORDIALLOC | C29: 1 | D29: 0 | E29: =C29*6+D29 -> 6 | G29: 5 | H29: 3 | I29: =G29*6+H29 -> 33 | K29: 6 | L29: 5 | M29: =K29*6+L29 -> 41 | O29: 7 | P29: 7 | Q29: =O29*6+P29 -> 49 | S29: BAIRD | CB29: {GOTO}AL143~/M{END}{RIGHT}{END}{DOWN}~P143~
A30: BEST PLAYERS | CB30: {GOTO}BJ303~/M{RIGHT 7}{END}{DOWN}~V144~
A31: OAKLEIGH | C31: JONES | F31: DEFTEROUS | I31: McCOOKE | L31: TURNER | O31: PEAKE | R31: KITTO | CB31: {GOTO}BJ323~/M{RIGHT 7}{END}{DOWN}~G164~
A32: MORDIALLOC | C32: PEARSON | F32: EMBERSON | I32: JAMIESON | L32: BLAINEY | O32: HARRINGTON | R32: RITCHIE | CB32: {GOTO}AL163~/M{END}{RIGHT}{END}{DOWN}~P163~
A33: GOALKICKERS | CB33: {GOTO}BJ343~/M{RIGHT 7}{END}{DOWN}~V164~
A34: OAKLEIGH | C34: JONES 3 | F34: COUGHLAN | I34: WILLIAMS | L34: RICCI | CB34: {HOME}
A35: MORDIALLOC | C35: KAVANAGH | F35: PEARSON | I35: EMBERSON | L35: ROBERTS | O35: HARRINGTON | R35: WILLIAMSON | U35: THOMPSON
E36: 29TH APRIL | J36: WEATHER | M36: SOUTH WEST WIND FINE
A37: NORTHCOTE | C37: 0 | D37: 1 | E37: =C37*6+D37 -> 1 | G37: 4 | H37: 4 | I37: =G37*6+H37 -> 28 | K37: 8 | L37: 7 | M37: =K37*6+L37 -> 55 | O37: 9 | P37: 7 | Q37: =O37*6+P37 -> 61 | S37: NORTHCOTE
A38: PORT MELBOURNE | C38: 4 | D38: 2 | E38: =C38*6+D38 -> 26 | G38: 4 | H38: 6 | I38: =G38*6+H38 -> 30 | K38: 5 | L38: 12 | M38: =K38*6+L38 -> 42 | O38: 6 | P38: 17 | Q38: =O38*6+P38 -> 53 | S38: McMASTER
A39: BEST PLAYERS
A40: NORTHCOTE | C40: GASKETT | F40: STONEHAM | I40: DEAN | L40: BRETHERTON | O40: McMAHON | R40: DOWLING
A41: PORT MELBOURNE | C41: THORPE | F41: GARRA | I41: R EVANS | L41: McLEOD | O41: COSTELLO | R41: STRAUCH
A42: GOALKICKERS
A43: NORTHCOTE | C43: DEAN 4 | F43: STONEHAM | I43: GREIG | K43: LAVER | M43: WILLIAMS | P43: GASKETT
A44: PORT MELBOURNE | C44: BONNETT 2 | F44: THORPE 2 | I44: TOLSHER | K44: FREYER
A46: COBURG | C46: 3 | D46: 4 | E46: =C46*6+D46 -> 22 | G46: 4 | H46: 6 | I46: =G46*6+H46 -> 30 | K46: 13 | L46: 11 | M46: =K46*6+L46 -> 89 | O46: 14 | P46: 12 | Q46: =O46*6+P46 -> 96 | S46: COBURG
A47: BRUNSWICK | C47: 2 | D47: 2 | E47: =C47*6+D47 -> 14 | G47: 4 | H47: 5 | I47: =G47*6+H47 -> 29 | K47: 5 | L47: 7 | M47: =K47*6+L47 -> 37 | O47: 7 | P47: 16 | Q47: =O47*6+P47 -> 58 | S47: ALLEN
A48: BEST PLAYERS
A49: COBURG | C49: A FINDLAY | F49: CLARKSON | I49: K O'BRIEN | L49: R O'BRIEN | O49: SHORT | Q49: WILSON
A50: BRUNSWICK | C50: HARWOOD | F50: THOMPSON | I50: JOHNSON | L50: J EDWARDS | O50: WATT | Q50: BRIGLIA
A51: GOALKICKERS
A52: COBURG | C52: R O'BRIEN 5 | F52: F FINDLAY 4 | I52: HOLCOMBE | L52: L BRIMACOMBE | O52: MATHEWS | Q52: K L O'BRIEN | T52: K O'BRIEN
A53: BRUNSWICK | C53: BIBBY 2 | F53: BRIGLIA 2 | I53: STANLEY | L53: JOHNSON | N53: MYERS
A55: ROUND 2 | E55: 5TH MAY | J55: WEATHER | M55: NORTH WEST WIND DULL CLOUDY | S55: PLAYED AT
D56: 1ST QTR | H56: 2ND QTR | L56: 3RD QTR | P56: FINAL | S56: OAKLEIGH
A57: WILLIAMSTOWN | C57: 3 | D57: 2 | E57: =C57*6+D57 -> 20 | G57: 5 | H57: 7 | I57: =G57*6+H57 -> 37 | K57: 10 | L57: 8 | M57: =K57*6+L57 -> 68 | O57: 12 | P57: 11 | Q57: =O57*6+P57 -> 83 | S57: UMPIRE | X57: LADDER | AB57: ROUND | AD57: 2
A58: OAKLEIGH | C58: 2 | D58: 3 | E58: =C58*6+D58 -> 15 | G58: 3 | H58: 5 | I58: =G58*6+H58 -> 23 | K58: 7 | L58: 8 | M58: =K58*6+L58 -> 50 | O58: 11 | P58: 13 | Q58: =O58*6+P58 -> 79 | S58: MARCY
A59: BEST PLAYERS | W59: TEAM | X59: W | Y59: L | Z59: D | AA59: FOR | AB59: AGST | AC59: % | AD59: PTS
A60: WILLIAMSTOWN | C60: WARD | E60: MAZOURIS | H60: CLOUGH | K60: CARMICHAEL | N60: McPHEE | Q60: JAMES
A61: OAKLEIGH | C61: JONES | E61: PEAKE | H61: McCLELLAND | K61: COUGHLAN | N61: JEWELL | Q61: DEFTEROUS | W61: MOORABBIN | X61: 2 | Y61: 0 | Z61: 0 | AA61: 197 | AB61: 115 | AC61: 171.30434782608697 | AD61: 8
A62: GOALKICKERS | W62: COBURG | X62: 2 | Y62: 0 | Z62: 0 | AA62: 181 | AB62: 111 | AC62: 163.06306306306305 | AD62: 8
A63: WILLIAMSTOWN | C63: JAMES 3 | F63: MAZOURIS 3 | I63: TURNER 2 | L63: CLOUGH 2 | O63: COLLINS | Q63: WARD | W63: SANDRINGHAM | X63: 1 | Y63: 1 | Z63: 0 | AA63: 202 | AB63: 180 | AC63: 112.22222222222223 | AD63: 4
A64: OAKLEIGH | C64: J WILLIAMS 3 | F64: JONES 2 | I64: NICHOLLS 2 | L64: RICCI 2 | N64: TURNER | P64: JEWELL | W64: OAKLEIGH | X64: 1 | Y64: 1 | Z64: 0 | AA64: 135 | AB64: 132 | AC64: 102.27272727272727 | AD64: 4
A66: MOORABBIN | C66: 3 | D66: 1 | E66: =C66*6+D66 -> 19 | G66: 5 | H66: 6 | I66: =G66*6+H66 -> 36 | K66: 10 | L66: 15 | M66: =K66*6+L66 -> 75 | O66: 15 | P66: 21 | Q66: =O66*6+P66 -> 111 | S66: MOORABBIN | W66: WILLIAMSTOWN | X66: 1 | Y66: 1 | Z66: 0 | AA66: 138 | AB66: 138 | AC66: 100 | AD66: 4
A67: MORDIALLOC | C67: 3 | D67: 1 | E67: =C67*6+D67 -> 19 | G67: 3 | H67: 5 | I67: =G67*6+H67 -> 23 | K67: 6 | L67: 6 | M67: =K67*6+L67 -> 42 | O67: 6 | P67: 6 | Q67: =O67*6+P67 -> 42 | S67: HORNE | W67: NORTHCOTE | X67: 1 | Y67: 1 | Z67: 0 | AA67: 142 | AB67: 145 | AC67: 97.931034482758619 | AD67: 4
A68: BEST PLAYERS | W68: BRUNSWICK | X68: 1 | Y68: 1 | Z68: 0 | AA68: 150 | AB68: 177 | AC68: 84.745762711864401 | AD68: 4
A69: MOORABBIN | C69: CRUTCHFIELD | F69: BURNS | I69: HARRISON | L69: WHALEBONE | O69: BRENCHLEY | R69: PAPLEY | W69: YARRAVILLE | X69: 1 | Y69: 1 | Z69: 0 | AA69: 112 | AB69: 140 | AC69: 80 | AD69: 4
A70: MORDIALLOC | C70: WILLIAMSON | F70: RITCHIE | I70: PETRIE | L70: HORNE | O70: B PEARSON | R70: NISBET | W70: PORT MELBOURNE | X70: 0 | Y70: 2 | Z70: 0 | AA70: 147 | AB70: 190 | AC70: 77.368421052631575 | AD70: 0
A71: GOALKICKERS | W71: MORDIALLOC | X71: 0 | Y71: 2 | Z71: 0 | AA71: 91 | AB71: 167 | AC71: 54.491017964071858 | AD71: 0
A72: MOORABBIN | C72: PAPLEY 6 | F72: BURNS 3 | I72: PERRY 2 | K72: BRENCHLEY 2 | N72: HARRISON | Q72: FOX
A73: MORDIALLOC | C73: WILLIAMSON 2 | F73: KAVANAGH | I73: NISBET | K73: I PEARSON | N73: EMBERSON
A75: SANDRINGHAM | C75: 2 | D75: 1 | E75: =C75*6+D75 -> 13 | G75: 11 | H75: 7 | I75: =G75*6+H75 -> 73 | K75: 11 | L75: 12 | M75: =K75*6+L75 -> 78 | O75: 19 | P75: 15 | Q75: =O75*6+P75 -> 129 | S75: PORT MELBOURNE
A76: PORT MELBOURNE | C76: 5 | D76: 5 | E76: =C76*6+D76 -> 35 | G76: 8 | H76: 5 | I76: =G76*6+H76 -> 53 | K76: 12 | L76: 9 | M76: =K76*6+L76 -> 81 | O76: 14 | P76: 10 | Q76: =O76*6+P76 -> 94 | S76: MANCE
A77: BEST PLAYERS
A78: SANDRINGHAM | C78: KELTON | F78: MUTER | I78: BURNS | L78: WEBSTER | N78: BRYAN | Q78: BLACKFORD
A79: PORT MELBOURNE | C79: LAWSON | F79: FREYER | I79: CLAUSCEN | L79: LEWIS | N79: McRAE | Q79: EDWARDS
A80: GOALKICKERS
A81: SANDRINGHAM | C81: BURNS 5 | F81: BRYAN 3 | I81: MUTER 3 | K81: MURRAY 2 | N81: BURKE 2 | P81: KELTON 2 | S81: CLARK | U81: WEBSTER
A82: PORT MELBOURNE | C82: McLEOD 3 | F82: SIMPSON 3 | I82: CLAUSCEN 3 | L82: FREYER 2 | N82: LAWSON | P82: PETRUCCO | S82: EDWARDS
E83: 6TH MAY | J83: WEATHER | M83: SOUTH WIND FINE
A84: COBURG | C84: 3 | D84: 4 | E84: =C84*6+D84 -> 22 | G84: 7 | H84: 9 | I84: =G84*6+H84 -> 51 | K84: 8 | L84: 10 | M84: =K84*6+L84 -> 58 | O84: 12 | P84: 13 | Q84: =O84*6+P84 -> 85 | S84: YARRAVILLE
A85: YARRAVILLE | C85: 1 | D85: 3 | E85: =C85*6+D85 -> 9 | G85: 2 | H85: 5 | I85: =G85*6+H85 -> 17 | K85: 4 | L85: 10 | M85: =K85*6+L85 -> 34 | O85: 6 | P85: 17 | Q85: =O85*6+P85 -> 53 | S85: WOOLFE
A86: BEST PLAYERS
A87: COBURG | C87: A FINDLAY | F87: B SMITH | I87: SHORT | L87: J BRIMACOMBE | O87: WILSON | R87: CLARKSON
A88: YARRAVILLE | C88: NARKIEWICZ | F88: BOB BROWN | I88: RON BROWN | L88: WHITTEN | O88: ORANGE | R88: WHITZELL
A89: GOALKICKERS
A90: COBURG | C90: J BRIMACOMBE 3 | G90: MICKLESON 2 | J90: F FINDLAY 2 | M90: B SMITH 2 | P90: L BRIMACOMBE | T90: ROCHOW | V90: R O'BRIEN
A91: YARRAVILLE | C91: WHITTEN 2 | G91: RON BROWN 2 | J91: BURR | L91: McGILL
A93: BRUNSWICK | C93: 0 | D93: 0 | E93: =C93*6+D93 -> 0 | G93: 5 | H93: 8 | I93: =G93*6+H93 -> 38 | K93: 6 | L93: 11 | M93: =K93*6+L93 -> 47 | O93: 13 | P93: 14 | Q93: =O93*6+P93 -> 92 | S93: BRUNSWICK
A94: NORTHCOTE | C94: 4 | D94: 5 | E94: =C94*6+D94 -> 29 | G94: 4 | H94: 5 | I94: =G94*6+H94 -> 29 | K94: 11 | L94: 8 | M94: =K94*6+L94 -> 74 | O94: 12 | P94: 9 | Q94: =O94*6+P94 -> 81 | S94: MILLEN
A95: BEST PLAYERS
A96: BRUNSWICK | C96: JOHNSON | F96: EDWARDS | I96: STANLEY | L96: AYRES | O96: BRIGLIA | R96: BIBBY
A97: NORTHCOTE | C97: LAVER | F97: McMAHON | I97: GASKETT | L97: BRETHERTON | O97: STONEHAM | R97: HAMBLY
A98: GOALKICKERS
A99: BRUNSWICK | C99: STANLEY 6 | F99: BRIGGS 3 | I99: R EDWARDS 2 | L99: HAGART 2
A100: NORTHCOTE | C100: WILLIAMS 2 | F100: DOWLING 2 | I100: HAMBLY 2 | L100: DEAN 2 | O100: STONEHAM 2 | R100: TAYLOR | U100: GREIG
A102: ROUND 3 | D102: 12TH MAY | I102: WEATHER | L102: FINE THEN RAIN NO WIND | S102: PLAYED AT
D103: 1ST QTR | H103: 2ND QTR | L103: 3RD QTR | P103: FINAL | S103: BEACH ROAD
A104: SANDRINGHAM | C104: 5 | D104: 4 | E104: =C104*6+D104 -> 34 | G104: 9 | H104: 8 | I104: =G104*6+H104 -> 62 | K104: 13 | L104: 12 | M104: =K104*6+L104 -> 90 | O104: 19 | P104: 16 | Q104: =O104*6+P104 -> 130 | S104: UMPIRE | X104: LADDER | AB104: ROUND | AD104: 3
A105: OAKLEIGH | C105: 5 | D105: 3 | E105: =C105*6+D105 -> 33 | G105: 10 | H105: 12 | I105: =G105*6+H105 -> 72 | K105: 14 | L105: 15 | M105: =K105*6+L105 -> 99 | O105: 17 | P105: 19 | Q105: =O105*6+P105 -> 121 | S105: JACKSON
A106: BEST PLAYERS | W106: TEAM | X106: W | Y106: L | Z106: D | AA106: FOR | AB106: AGST | AC106: % | AD106: PTS
A107: SANDRINGHAM | C107: BURNS | E107: MURRAY | H107: DAWSON | K107: KELTON | N107: MUSGROVE | Q107: BURKE
A108: OAKLEIGH | C108: RICCI | E108: D HALL | H108: McCOOKE | K108: JEWELL | N108: KITTO | Q108: NICHOLLS | W108: MOORABBIN | X108: 3 | Y108: 0 | Z108: 0 | AA108: 316 | AB108: 170 | AC108: 185.88235294117646 | AD108: 12
A109: GOALKICKERS | W109: COBURG | X109: 2 | Y109: 1 | Z109: 0 | AA109: 272 | AB109: 204 | AC109: 133.33333333333334 | AD109: 8
A110: SANDRINGHAM | C110: BRYAN 7 | F110: MURRAY 5 | I110: KELTON 2 | L110: DAWSON 2 | O110: BURNS 2 | Q110: O'TOOLE | W110: NORTHCOTE | X110: 2 | Y110: 1 | Z110: 0 | AA110: 242 | AB110: 214 | AC110: 113.08411214953271 | AD110: 8
A111: OAKLEIGH | C111: RICCI 5 | E111: JEWELL 4 | H111: J WILLIAMS 3 | K111: NICHOLLS 2 | N111: TURNER | P111: MULDOON | R111: COUGHLAN | W111: SANDRINGHAM | X111: 2 | Y111: 1 | Z111: 0 | AA111: 332 | AB111: 301 | AC111: 110.29900332225914 | AD111: 8
A113: MOORABBIN | C113: 4 | D113: 4 | E113: =C113*6+D113 -> 28 | G113: 11 | H113: 5 | I113: =G113*6+H113 -> 71 | K113: 17 | L113: 7 | M113: =K113*6+L113 -> 109 | O113: 18 | P113: 11 | Q113: =O113*6+P113 -> 119 | S113: MOORABBIN | W113: WILLIAMSTOWN | X113: 2 | Y113: 1 | Z113: 0 | AA113: 231 | AB113: 229 | AC113: 100.87336244541484 | AD113: 8
A114: BRUNSWICK | C114: 0 | D114: 0 | E114: =C114*6+D114 -> 0 | G114: 3 | H114: 2 | I114: =G114*6+H114 -> 20 | K114: 5 | L114: 4 | M114: =K114*6+L114 -> 34 | O114: 7 | P114: 13 | Q114: =O114*6+P114 -> 55 | S114: TREWIN | W114: YARRAVILLE | X114: 2 | Y114: 1 | Z114: 0 | AA114: 182 | AB114: 205 | AC114: 88.780487804878049 | AD114: 8
A115: BEST PLAYERS | W115: OAKLEIGH | X115: 1 | Y115: 2 | Z115: 0 | AA115: 256 | AB115: 262 | AC115: 97.709923664122144 | AD115: 4
A116: MOORABBIN | C116: PERRY | F116: BURNS | I116: GILDER | L116: KUPSCH | O116: WHALEBONE | R116: CRAMERI | W116: BRUNSWICK | X116: 1 | Y116: 2 | Z116: 0 | AA116: 205 | AB116: 296 | AC116: 69.256756756756758 | AD116: 4
A117: BRUNSWICK | C117: BRIGLIA | F117: EDWARDS | I117: TOZER | L117: BRIGGS | O117: MATTHEWS | R117: AMBROSE | W117: PORT MELBOURNE | X117: 0 | Y117: 3 | Z117: 0 | AA117: 212 | AB117: 260 | AC117: 81.538461538461533 | AD117: 0
A118: GOALKICKERS | S118: HARRISON | W118: MORDIALLOC | X118: 0 | Y118: 3 | Z118: 0 | AA118: 160 | AB118: 267 | AC118: 59.925093632958799 | AD118: 0
A119: MOORABBIN | C119: BURNS 3 | E119: PAPLEY 3 | G119: WHALEBONE 3 | J119: PRESCOTT 3 | M119: PERRY 2 | O119: FOX | P119: BRENCHLEY | S119: McKAY
A120: BRUNSWICK | C120: MATTHEWS 3 | G120: BIBBY 2 | I120: BRIGLIA 2
E121: 13TH MAY | J121: WEATHER | N121: NORTH BREEZE FINE
A122: WILLIAMSTOWN | C122: 2 | D122: 5 | E122: =C122*6+D122 -> 17 | G122: 7 | H122: 5 | I122: =G122*6+H122 -> 47 | K122: 12 | L122: 10 | M122: =K122*6+L122 -> 82 | O122: 13 | P122: 15 | Q122: =O122*6+P122 -> 93 | S122: COBURG
A123: COBURG | C123: 2 | D123: 4 | E123: =C123*6+D123 -> 16 | G123: 7 | H123: 11 | I123: =G123*6+H123 -> 53 | K123: 10 | L123: 16 | M123: =K123*6+L123 -> 76 | O123: 12 | P123: 19 | Q123: =O123*6+P123 -> 91 | S123: MANCE
A124: BEST PLAYERS
A125: WILLIAMSTOWN | C125: MALONEY | F125: COLLINS | I125: JAMES | K125: MAZOURIS | N125: RUSSELL | Q125: WILLIAMS
A126: COBURG | C126: MICKLESON | F126: J BRIMACOMBE | I126: SMITH | K126: L BRIMACOMBE | N126: HOLCOMBE | Q126: R O'BRIEN
A127: GOALKICKERS
A128: WILLIAMSTOWN | C128: JAMES 5 | F128: MAZOURIS 4 | I128: WILLIAMS | K128: MCPHEE | M128: O'TOOLE | O128: TURNER
A129: COBURG | C129: ROCHOW 4 | F129: MICKLESON 3 | I129: J BRIMACOMBE 2 | M129: L BRIMACOMBE 2 | Q129: SMITH
A131: YARRAVILLE | C131: 2 | D131: 7 | E131: =C131*6+D131 -> 19 | G131: 4 | H131: 9 | I131: =G131*6+H131 -> 33 | K131: 4 | L131: 15 | M131: =K131*6+L131 -> 39 | O131: 9 | P131: 16 | Q131: =O131*6+P131 -> 70 | S131: YARRAVILLE
A132: PORT MELBOURNE | C132: 2 | D132: 0 | E132: =C132*6+D132 -> 12 | G132: 3 | H132: 3 | I132: =G132*6+H132 -> 21 | K132: 5 | L132: 9 | M132: =K132*6+L132 -> 39 | O132: 9 | P132: 11 | Q132: =O132*6+P132 -> 65 | S132: MARCY
A133: BEST PLAYERS
A134: YARRAVILLE | C134: CROOK | F134: BOB BROWN | I134: WILSON | L134: RON BROWN | O134: McGILL | R134: WHITZELL
A135: PORT MELBOURNE | C135: A CAMERON | F135: LAWSON | I135: EVANS | L135: GARRA | O135: FREYER | R135: McLEOD
A136: GOALKICKERS
A137: YARRAVILLE | C137: RON BROWN 3 | F137: CLEGG 2 | I137: WHITTEN | L137: WHITZELL | N137: WARWICK | Q137: BURR
A138: PORT MELBOURNE | C138: McLEOD 4 | F138: STRAUCH | I138: EDWARDS | L138: FREYER | N138: FIDLER | Q138: GARRA
A140: NORTHCOTE | C140: 5 | D140: 4 | E140: =C140*6+D140 -> 34 | G140: 6 | H140: 8 | I140: =G140*6+H140 -> 44 | K140: 12 | L140: 8 | M140: =K140*6+L140 -> 80 | O140: 15 | P140: 10 | Q140: =O140*6+P140 -> 100 | S140: NORTHCOTE
A141: MORDIALLOC | C141: 1 | D141: 1 | E141: =C141*6+D141 -> 7 | G141: 4 | H141: 4 | I141: =G141*6+H141 -> 28 | K141: 7 | L141: 8 | M141: =K141*6+L141 -> 50 | O141: 10 | P141: 9 | Q141: =O141*6+P141 -> 69 | S141: POLLARD
A142: BEST PLAYERS
A143: NORTHCOTE | C143: OUSLEY | F143: TAYLOR | I143: DEAN | L143: BRETHERTON | O143: LAVER | R143: McMAHON
A144: MORDIALLOC | C144: KAVANAGH | F144: DEAN | I144: RITCHIE | L144: WILLIS | O144: WILLIAMS | R144: NISBET
A145: GOALKICKERS
A146: NORTHCOTE | C146: DEAN 4 | F146: TAYLOR 2 | I146: BRADY 2 | L146: MAYNE 2 | O146: CRIPPS 2 | Q146: WILLIAMS | T146: GREIG | V146: HAMBLY
A147: MORDIALLOC | C147: KAVANAGH 2 | F147: DEAN 2 | I147: PORTA 2 | L147: WILLIS 2 | O147: NISBET | Q147: WILLIAMSON
A149: ROUND 4 | E149: 19TH MAY | J149: WEATHER | N149: DULL CLOUDY NO WIND | S149: PLAYED AT
D150: 1ST QTR | H150: 2ND QTR | L150: 3RD QTR | P150: FINAL | S150: WILLIAMSTOWN
A151: WILLIAMSTOWN | C151: 5 | D151: 6 | E151: =C151*6+D151 -> 36 | G151: 10 | H151: 7 | I151: =G151*6+H151 -> 67 | K151: 13 | L151: 9 | M151: =K151*6+L151 -> 87 | O151: 19 | P151: 12 | Q151: =O151*6+P151 -> 126 | S151: UMPIRE | X151: LADDER | AB151: ROUND | AD151: 4
A152: NORTHCOTE | C152: 3 | D152: 1 | E152: =C152*6+D152 -> 19 | G152: 9 | H152: 3 | I152: =G152*6+H152 -> 57 | K152: 12 | L152: 9 | M152: =K152*6+L152 -> 81 | O152: 16 | P152: 9 | Q152: =O152*6+P152 -> 105 | S152: WOOLFE
A153: BEST PLAYERS | W153: TEAM | X153: W | Y153: L | Z153: D | AA153: FOR | AB153: AGST | AC153: % | AD153: PTS
A154: WILLIAMSTOWN | C154: MAZOURIS | F154: McASEY | I154: CLOUGH | L154: JAMES | O154: BAMFORD | R154: RUSSELL
A155: NORTHCOTE | C155: GASKETT | F155: TAYLOR | I155: OUSLEY | L155: LAVER | O155: BLAKE | R155: BRADY | W155: MOORABBIN | X155: 4 | Y155: 0 | Z155: 0 | AA155: 433 | AB155: 227 | AC155: 190.74889867841409 | AD155: 16
A156: GOALKICKERS | W156: SANDRINGHAM | X156: 3 | Y156: 1 | Z156: 0 | AA156: 437 | AB156: 380 | AC156: 115 | AD156: 12
A157: WILLIAMSTOWN | C157: JAMES 7 | F157: TURNER 3 | I157: MAZOURIS 3 | L157: CLOUGH 3 | N157: COLLINS | P157: WARD | R157: WILLIAMS | W157: WILLIAMSTOWN | X157: 3 | Y157: 1 | Z157: 0 | AA157: 357 | AB157: 334 | AC157: 106.88622754491018 | AD157: 12
A158: NORTHCOTE | C158: K MAYNE 5 | F158: DEAN 5 | H158: LAVER 2 | J158: GASKETT | M158: BRADY | O158: HAMBLY | Q158: CRIPPS | W158: COBURG | X158: 2 | Y158: 2 | Z158: 0 | AA158: 352 | AB158: 297 | AC158: 118.51851851851852 | AD158: 8
A160: BRUNSWICK | C160: 2 | D160: 4 | E160: =C160*6+D160 -> 16 | G160: 4 | H160: 6 | I160: =G160*6+H160 -> 30 | K160: 10 | L160: 10 | M160: =K160*6+L160 -> 70 | O160: 12 | P160: 15 | Q160: =O160*6+P160 -> 87 | S160: BRUNSWICK | W160: NORTHCOTE | X160: 2 | Y160: 2 | Z160: 0 | AA160: 347 | AB160: 340 | AC160: 102.05882352941177 | AD160: 8
A161: YARRAVILLE | C161: 4 | D161: 3 | E161: =C161*6+D161 -> 27 | G161: 6 | H161: 7 | I161: =G161*6+H161 -> 43 | K161: 7 | L161: 8 | M161: =K161*6+L161 -> 50 | O161: 10 | P161: 14 | Q161: =O161*6+P161 -> 74 | S161: HORNE | W161: YARRAVILLE | X161: 2 | Y161: 2 | Z161: 0 | AA161: 256 | AB161: 292 | AC161: 87.671232876712324 | AD161: 8
A162: BEST PLAYERS | W162: BRUNSWICK | X162: 2 | Y162: 2 | Z162: 0 | AA162: 292 | AB162: 370 | AC162: 78.918918918918919 | AD162: 8
A163: BRUNSWICK | C163: THORPE | F163: AMBROSE | I163: JOHNSON | L163: MATTHEWS | O163: HARWOOD | R163: BRYANT | W163: PORT MELBOURNE | X163: 1 | Y163: 3 | Z163: 0 | AA163: 305 | AB163: 340 | AC163: 89.705882352941174 | AD163: 4
A164: YARRAVILLE | C164: WHITTEN | F164: McTAGGRT | I164: WHITZELL | L164: EVANS | O164: WILSON | R164: LAMONT | W164: OAKLEIGH | X164: 1 | Y164: 3 | Z164: 0 | AA164: 313 | AB164: 379 | AC164: 82.585751978891821 | AD164: 4
A165: GOALKICKERS | W165: MORDIALLOC | X165: 0 | Y165: 4 | Z165: 0 | AA165: 239 | AB165: 372 | AC165: 64.247311827956992 | AD165: 0
A166: BRUNSWICK | C166: STANLEY 3 | F166: DENTON 3 | I166: BRYANT 2 | L166: BRIGLIA 2 | O166: MATTHEWS | R166: THORPE
A167: YARRAVILLE | C167: WHITZELL 3 | F167: CLEGG 2 | I167: FLEMING | K167: EVANS | M167: WARWICK | P167: MATHIAS | R167: WILSON
A169: MOORABBIN | C169: 5 | D169: 1 | E169: =C169*6+D169 -> 31 | G169: 10 | H169: 6 | I169: =G169*6+H169 -> 66 | K169: 12 | L169: 11 | M169: =K169*6+L169 -> 83 | O169: 17 | P169: 15 | Q169: =O169*6+P169 -> 117 | S169: OAKLEIGH
A170: OAKLEIGH | C170: 1 | D170: 2 | E170: =C170*6+D170 -> 8 | G170: 4 | H170: 5 | I170: =G170*6+H170 -> 29 | K170: 7 | L170: 7 | M170: =K170*6+L170 -> 49 | O170: 9 | P170: 9 | Q170: =O170*6+P170 -> 63 | S170: ALLEN
A171: BEST PLAYERS
A172: MOORABBIN | C172: WHALEBONE | F172: BURNS | I172: ROLFE | L172: GILDER | O172: RYAN | Q172: KUPSCH
A173: OAKLEIGH | C173: JEWELL | F173: McCLELLAND | I173: MURPHY | L173: COUGHLAN | O173: KITTO | Q173: RICCI
A174: GOALKICKERS
A175: MOORABBIN | C175: WHALEBONE 6 | F175: BURNS 4 | I175: PRESCOTT 2 | L175: FOX | M175: SHEPHERD | P175: RYAN | R175: MUIR | T175: ROLFE
A176: OAKLEIGH | C176: COUGHLAN 3 | F176: WILLIAMS 2 | I176: JEWELL 2 | L176: McCLELLAND 2
A178: SANDRINGHAM | C178: 2 | D178: 3 | E178: =C178*6+D178 -> 15 | G178: 8 | H178: 8 | I178: =G178*6+H178 -> 56 | K178: 10 | L178: 9 | M178: =K178*6+L178 -> 69 | O178: 15 | P178: 15 | Q178: =O178*6+P178 -> 105 | S178: MORDIALLOC
A179: MORDIALLOC | C179: 1 | D179: 1 | E179: =C179*6+D179 -> 7 | G179: 2 | H179: 3 | I179: =G179*6+H179 -> 15 | K179: 9 | L179: 5 | M179: =K179*6+L179 -> 59 | O179: 12 | P179: 7 | Q179: =O179*6+P179 -> 79 | S179: MILLEN
A180: BEST PLAYERS
A181: SANDRINGHAM | C181: BURNS | E181: MURRAY | H181: DAWSON | K181: WEBSTER | N181: MUTER | Q181: BRYAN
A182: MORDIALLOC | C182: NESBIT | E182: HARRINGTON | H182: RITCHIE | K182: HORNE | N182: DEAN | Q182: WILLIAMSON
A183: GOALKICKERS
A184: SANDRINGHAM | C184: BRYAN 6 | F184: DAWSON 4 | I184: BURNS 2 | L184: MURRAY 2 | O184: BURKE
A185: MORDIALLOC | C185: DEAN 5 | F185: HARRINGTON 3 | J185: THOMPSON | M185: WILLIAMSON | P185: PETRIE | R185: PEARSON
E186: 20TH MAY | I186: WEST BREEZE FINE
A187: PORT MELBOURNE | C187: 4 | D187: 3 | E187: =C187*6+D187 -> 27 | G187: 8 | H187: 3 | I187: =G187*6+H187 -> 51 | K187: 13 | L187: 8 | M187: =K187*6+L187 -> 86 | O187: 14 | P187: 9 | Q187: =O187*6+P187 -> 93 | S187: PORT MELBOURNE
A188: COBURG | C188: 3 | D188: 3 | E188: =C188*6+D188 -> 21 | G188: 6 | H188: 7 | I188: =G188*6+H188 -> 43 | K188: 6 | L188: 10 | M188: =K188*6+L188 -> 46 | O188: 11 | P188: 14 | Q188: =O188*6+P188 -> 80 | S188: POLLARD
A189: BEST PLAYERS
A190: PORT MELBOURNE | C190: FREYER | F190: LANDORFF | I190: GARRA | L190: TAGGART | O190: BONNETT | R190: LAWSON
A191: COBURG | C191: BYRON | F191: JORDAN | I191: CLARKSON | L191: SHORT
A192: GOALKICKERS
A193: PORT MELBOURNE | C193: BONNETT 5 | F193: TAGGART 2 | I193: McLEOD 2 | L193: LAWSON | N193: EDWARDS | Q193: BOWEN | S193: COSTELLO | U193: GARRA
A194: COBURG | C194: BYRON 6 | F194: JORDAN 3 | I194: ROCHOW | K194: J BRIMACOMBE
A196: ROUND 5 | E196: 26TH MAY | J196: WEATHER | M196: WEST WIND GROUNDS MUDDY | S196: PLAYED AT
D197: 1ST QTR | H197: 2ND QTR | L197: 3RD QTR | P197: FINAL | S197: BEACH ROAD
A198: SANDRINGHAM | C198: 1 | D198: 2 | E198: =C198*6+D198 -> 8 | G198: 4 | H198: 7 | I198: =G198*6+H198 -> 31 | K198: 9 | L198: 8 | M198: =K198*6+L198 -> 62 | O198: 13 | P198: 12 | Q198: =O198*6+P198 -> 90 | S198: UMPIRE | X198: LADDER | AB198: ROUND | AD198: 5
A199: WILLIAMSTOWN | C199: 1 | D199: 3 | E199: =C199*6+D199 -> 9 | G199: 4 | H199: 3 | I199: =G199*6+H199 -> 27 | K199: 8 | L199: 7 | M199: =K199*6+L199 -> 55 | O199: 9 | P199: 10 | Q199: =O199*6+P199 -> 64 | S199: TREWIN
A200: BEST PLAYERS | W200: TEAM | X200: W | Y200: L | Z200: D | AA200: FOR | AB200: AGST | AC200: % | AD200: PTS
A201: SANDRINGHAM | C201: BURKE | F201: BURNS | I201: BRYAN | L201: CLIFFORD | O201: BOLAND | R201: McKENZIE
A202: WILLIAMSTOWN | C202: CARMICHAEL | F202: COPE | I202: MALONEY | L202: BAMFORD | O202: MURPHY | R202: MCASEY | W202: MOORABBIN | X202: 5 | Y202: 0 | Z202: 0 | AA202: 513 | AB202: 301 | AC202: 170.43189368770763 | AD202: 20
A203: GOALKICKERS | W203: SANDRINGHAM | X203: 4 | Y203: 1 | Z203: 0 | AA203: 527 | AB203: 444 | AC203: 118.69369369369369 | AD203: 16
A204: SANDRINGHAM | C204: BRYAN 4 | F204: BURNS 3 | I204: CLARK 3 | L204: BURKE 2 | O204: O'TOOLE | W204: COBURG | X204: 3 | Y204: 2 | Z204: 0 | AA204: 464 | AB204: 328 | AC204: 141.46341463414635 | AD204: 12
A205: WILLIAMSTOWN | C205: WARD 3 | F205: JAMES 2 | I205: MURPHY 2 | L205: WILLIAMS | O205: CLOUGH | W205: WILLIAMSTOWN | X205: 3 | Y205: 2 | Z205: 0 | AA205: 421 | AB205: 424 | AC205: 99.29245283018868 | AD205: 12
A207: MOORABBIN | C207: 1 | D207: 2 | E207: =C207*6+D207 -> 8 | G207: 4 | H207: 5 | I207: =G207*6+H207 -> 29 | K207: 6 | L207: 9 | M207: =K207*6+L207 -> 45 | O207: 11 | P207: 14 | Q207: =O207*6+P207 -> 80 | S207: YARRAVILLE | W207: BRUNSWICK | X207: 3 | Y207: 2 | Z207: 0 | AA207: 378 | AB207: 443 | AC207: 85.33 | AD207: 12
A208: YARRAVILLE | C208: 4 | D208: 5 | E208: =C208*6+D208 -> 29 | G208: 5 | H208: 10 | I208: =G208*6+H208 -> 40 | K208: 8 | L208: 13 | M208: =K208*6+L208 -> 61 | O208: 10 | P208: 14 | Q208: =O208*6+P208 -> 74 | S208: MANCE | W208: YARRAVILLE | X208: 2 | Y208: 3 | Z208: 0 | AA208: 330 | AB208: 372 | AC208: 88.709677419354833 | AD208: 8
A209: BEST PLAYERS | W209: OAKLEIGH | X209: 2 | Y209: 3 | Z209: 0 | AA209: 398 | AB209: 458 | AC209: 86.899563318777297 | AD209: 8
A210: MOORABBIN | C210: MANIE | F210: GILDER | I210: WHALEBONE | L210: CROSHER | O210: KUPSCH | R210: SHEPHERD | W210: NORTHCOTE | X210: 2 | Y210: 3 | Z210: 0 | AA210: 378 | AB210: 452 | AC210: 83.628318584070797 | AD210: 8
A211: YARRAVILLE | C211: McTAGGART | F211: RON BROWN | I211: McGILL | L211: NARKIEWICZ | O211: CROOK | R211: WHITTEN | W211: PORT MELBOURNE | X211: 1 | Y211: 4 | Z211: 0 | AA211: 384 | AB211: 425 | AC211: 90.352941176470594 | AD211: 4
A212: GOALKICKERS | W212: MORDIALLOC | X212: 0 | Y212: 5 | Z212: 0 | AA212: 312 | AB212: 458 | AC212: 68.12 | AD212: 0
A213: MOORABBIN | C213: PAPLEY 3 | F213: KEE 3 | I213: WHALEBONE 2 | L213: FOX | N213: MUIR | P213: PRESCOTT
A214: YARRAVILLE | C214: CROOK 2 | F214: WHITZELL 2 | I214: MOLONEY | K214: WHITTEN | M214: WARWICK | P214: RYAN | R214: WILSON | T214: RON BROWN
A216: OAKLEIGH | C216: 2 | D216: 3 | E216: =C216*6+D216 -> 15 | G216: 3 | H216: 4 | I216: =G216*6+H216 -> 22 | K216: 9 | L216: 7 | M216: =K216*6+L216 -> 61 | O216: 13 | P216: 7 | Q216: =O216*6+P216 -> 85 | S216: PORT MELBOURNE
A217: PORT MELBOURNE | C217: 0 | D217: 2 | E217: =C217*6+D217 -> 2 | G217: 4 | H217: 7 | I217: =G217*6+H217 -> 31 | K217: 7 | L217: 9 | M217: =K217*6+L217 -> 51 | O217: 11 | P217: 13 | Q217: =O217*6+P217 -> 79 | S217: MILLEN
A218: BEST PLAYERS
A219: OAKLEIGH | C219: KITTO | F219: JONES | I219: COUGHLAN | L219: TURNER | O219: MURPHY | R219: BAKER
A220: PORT MELBOURNE | C220: GARRA | F220: EVANS | I220: LANDORFF | L220: A CAMERON | O220: TAGGART | R220: McRAE
A221: GOALKICKERS
A222: OAKLEIGH | C222: JONES 4 | F222: HALL 2 | I222: JEWELL 2 | K222: KITTO | M222: McCOOKE | O222: RICCI | Q222: WILLIAMS | T222: NICHOLLS
A223: PORT MELBOURNE | C223: BONNETT 3 | F223: McRAE 2 | I223: McLEOD | K223: LAWSON | M223: LANDORFF | P223: MERRETT | R223: COSTELLO | U223: LANDORFF
E224: 27TH MAY | I224: WEATHER | L224: NORTH WEST WIND
A225: COBURG | C225: 2 | D225: 2 | E225: =C225*6+D225 -> 14 | G225: 5 | H225: 14 | I225: =G225*6+H225 -> 44 | K225: 9 | L225: 17 | M225: =K225*6+L225 -> 71 | O225: 15 | P225: 22 | Q225: =O225*6+P225 -> 112 | S225: NORTHCOTE
A226: NORTHCOTE | C226: 0 | D226: 4 | E226: =C226*6+D226 -> 4 | G226: 1 | H226: 4 | I226: =G226*6+H226 -> 10 | K226: 2 | L226: 5 | M226: =K226*6+L226 -> 17 | O226: 4 | P226: 7 | Q226: =O226*6+P226 -> 31 | S226: MARCY
A227: BEST PLAYERS
A228: COBURG | C228: JORDAN | F228: CLEMENTS | I228: J BRIMACOMBE | L228: FIELDS | O228: ROCHOW | R228: ONGARELLO
A229: NORTHCOTE | C229: McMAHON | F229: CRIPPS | I229: LAVER | L229: GORMAN | O229: BRETHERTON | R229: ROOTSEY
A230: GOALKICKERS
A231: COBURG | C231: JORDAN 6 | F231: ROCHOW 5 | I231: J BRIMACOMBE 2 | M231: BYRON | O231: L BRIMACOMBE
A232: NORTHCOTE | C232: DEAN 3 | F232: CRIPPS
A234: BRUNSWICK | C234: 3 | D234: 4 | E234: =C234*6+D234 -> 22 | G234: 5 | H234: 6 | I234: =G234*6+H234 -> 36 | K234: 9 | L234: 12 | M234: =K234*6+L234 -> 66 | O234: 12 | P234: 14 | Q234: =O234*6+P234 -> 86 | S234: BRUNSWICK
A235: MORDIALLOC | C235: 3 | D235: 2 | E235: =C235*6+D235 -> 20 | G235: 6 | H235: 7 | I235: =G235*6+H235 -> 43 | K235: 8 | L235: 8 | M235: =K235*6+L235 -> 56 | O235: 10 | P235: 13 | Q235: =O235*6+P235 -> 73 | S235: ALLEN
A236: BEST PLAYERS
A237: BRUNSWICK | C237: LEWIS | F237: BIBBY | I237: EDWARDS | L237: THORPE | O237: BRIGLIA | R237: EDWARDS
A238: MORDIALLOC | C238: ROBERTS | F238: STEWART | I238: THOMPSON | L238: RITCHIE | O238: PORTA | R238: FLEMING
A239: GOALKICKERS
A240: BRUNSWICK | C240: THORPE 4 | F240: DENTON 2 | I240: AYRES 2 | L240: BIBBY 2 | O240: BRYANT | Q240: BRIGLIA
A241: MORDIALLOC | C241: DEAN 3 | F241: PEARSON 2 | I241: WILLIS 2 | L241: KAVANAGH | O241: NESBIT | Q241: PORTA
A243: ROUND 6 | E243: 2ND JUNE | J243: WEATHER | N243: WEST WIND RAIN | S243: PLAYED AT
D244: 1ST QTR | H244: 2ND QTR | L244: 3RD QTR | P244: FINAL | S244: COBURG
A245: COBURG | C245: 4 | D245: 4 | E245: =C245*6+D245 -> 28 | G245: 7 | H245: 5 | I245: =G245*6+H245 -> 47 | K245: 11 | L245: 13 | M245: =K245*6+L245 -> 79 | O245: 14 | P245: 17 | Q245: =O245*6+P245 -> 101 | S245: UMPIRE | X245: LADDER | AB245: ROUND | AD245: 6
A246: SANDRINGHAM | C246: 3 | D246: 1 | E246: =C246*6+D246 -> 19 | G246: 6 | H246: 3 | I246: =G246*6+H246 -> 39 | K246: 7 | L246: 7 | M246: =K246*6+L246 -> 49 | O246: 12 | P246: 12 | Q246: =O246*6+P246 -> 84 | S246: MILLEN
A247: BEST PLAYERS | W247: TEAM | X247: W | Y247: L | Z247: D | AA247: FOR | AB247: AGST | AC247: % | AD247: PTS
A248: COBURG | C248: J BRIMACOMBE | G248: L BRIMACOMBE | J248: ROCHOW | M248: SPENCER | P248: SHORT | R248: McNABB
A249: SANDRINGHAM | C249: CLARK | G249: BURKE | J249: McKENZIE | M249: WEBSTER | P249: EVANS | R249: BOLAND | W249: MOORABBIN | X249: 5 | Y249: 1 | Z249: 0 | AA249: 548 | AB249: 337 | AC249: 162.61127596439169 | AD249: 20
A250: GOALKICKERS | R250: SMITH | W250: COBURG | X250: 4 | Y250: 2 | Z250: 0 | AA250: 565 | AB250: 412 | AC250: 137.13592233009709 | AD250: 16
A251: COBURG | C251: J BRIMACOMBE 3 | F251: ROCHOW 3 | I251: McNABB 2 | L251: L BRIMACOMBE 2 | P251: K O'BRIEN 2 | S251: R O'BRIEN | W251: SANDRINGHAM | X251: 4 | Y251: 2 | Z251: 0 | AA251: 611 | AB251: 545 | AC251: 112.11009174311927 | AD251: 16
A252: SANDRINGHAM | C252: BRYAN 3 | F252: O'TOOLE 3 | I252: DAWSON 2 | L252: BURNS 2 | N252: CLARK | P252: McCORMACK | W252: WILLIAMSTOWN | X252: 4 | Y252: 2 | Z252: 0 | AA252: 493 | AB252: 489 | AC252: 100.81799591002044 | AD252: 16
A254: OAKLEIGH | C254: 0 | D254: 7 | E254: =C254*6+D254 -> 7 | G254: 3 | H254: 10 | I254: =G254*6+H254 -> 28 | K254: 5 | L254: 13 | M254: =K254*6+L254 -> 43 | O254: 10 | P254: 16 | Q254: =O254*6+P254 -> 76 | S254: OAKLEIGH | W254: YARRAVILLE | X254: 3 | Y254: 3 | Z254: 0 | AA254: 405 | AB254: 431 | AC254: 93.967517401392115 | AD254: 12
A255: BRUNSWICK | C255: 3 | D255: 0 | E255: =C255*6+D255 -> 18 | G255: 5 | H255: 0 | I255: =G255*6+H255 -> 30 | K255: 9 | L255: 1 | M255: =K255*6+L255 -> 55 | O255: 10 | P255: 1 | Q255: =O255*6+P255 -> 61 | S255: WOOLFE | W255: OAKLEIGH | X255: 3 | Y255: 3 | Z255: 0 | AA255: 474 | AB255: 519 | AC255: 91.329479768786129 | AD255: 12
A256: BEST PLAYERS | W256: BRUNSWICK | X256: 3 | Y256: 3 | Z256: 0 | AA256: 439 | AB256: 519 | AC256: 84.59 | AD256: 12
A257: OAKLEIGH | C257: KITTO | F257: JONES | I257: MURPHY | L257: D HALL | O257: McCLELLAND | R257: DEFTEROUS | W257: PORT MELBOURNE | X257: 2 | Y257: 4 | Z257: 0 | AA257: 420 | AB257: 460 | AC257: 91.304347826086953 | AD257: 8
A258: BRUNSWICK | C258: THORPE | F258: BRIGLIA | I258: AYRES | L258: J EDWARDS | O258: DENTON | R258: THOMPSON | W258: NORTHCOTE | X258: 2 | Y258: 4 | Z258: 0 | AA258: 437 | AB258: 527 | AC258: 82.922201138519924 | AD258: 8
A259: GOALKICKERS | W259: MORDIALLOC | X259: 0 | Y259: 6 | Z259: 0 | AA259: 377 | AB259: 530 | AC259: 71.13 | AD259: 0
A260: OAKLEIGH | C260: JEWELL 4 | F260: NICHOLLS 2 | I260: D HALL | K260: JONES | M260: DEFTEROUS | P260: MURPHY
A261: BRUNSWICK | C261: THORPE 4 | F261: DENTON 3 | I261: BRIGLIA 2 | L261: BIBBY
A263: WILLIAMSTOWN | C263: 2 | D263: 2 | E263: =C263*6+D263 -> 14 | G263: 9 | H263: 5 | I263: =G263*6+H263 -> 59 | K263: 9 | L263: 9 | M263: =K263*6+L263 -> 63 | O263: 10 | P263: 12 | Q263: =O263*6+P263 -> 72 | S263: MORDIALLOC
A264: MORDIALLOC | C264: 4 | D264: 2 | E264: =C264*6+D264 -> 26 | G264: 5 | H264: 8 | I264: =G264*6+H264 -> 38 | K264: 7 | L264: 11 | M264: =K264*6+L264 -> 53 | O264: 9 | P264: 11 | Q264: =O264*6+P264 -> 65 | S264: McMASTER
A265: BEST PLAYERS
A266: WILLIAMSTOWN | C266: CLOUGH | F266: TURNER | I266: WARD | L266: COPE | O266: TAUBE | R266: HILL
A267: MORDIALLOC | C267: NESBIT | F267: HARRINGTON | I267: KAVANAGH | L267: PEARSON | O267: FLEMING | R267: THOMPSON
A268: GOALKICKERS
A269: WILLIAMSTOWN | C269: TURNER 2 | F269: JAMIESON 2 | I269: CLOUGH 2 | L269: WARD | N269: WILLIAMS | Q269: HILL | S269: MURPHY
A270: MORDIALLOC | C270: NESBIT 4 | F270: KAVANAGH | I270: DEAN | K270: HARRINGTON | N270: WILLIAMSON | Q270: PEARSON
C271: 3RD JUNE | F271: WEATHER | I271: FINE
A272: YARRAVILLE | C272: 5 | D272: 4 | E272: =C272*6+D272 -> 34 | G272: 6 | H272: 6 | I272: =G272*6+H272 -> 42 | K272: 8 | L272: 11 | M272: =K272*6+L272 -> 59 | O272: 10 | P272: 15 | Q272: =O272*6+P272 -> 75 | S272: NORTHCOTE
A273: NORTHCOTE | C273: 1 | D273: 1 | E273: =C273*6+D273 -> 7 | G273: 5 | H273: 5 | I273: =G273*6+H273 -> 35 | K273: 7 | L273: 7 | M273: =K273*6+L273 -> 49 | O273: 8 | P273: 11 | Q273: =O273*6+P273 -> 59 | S273: JACKSON
A274: BEST PLAYERS
A275: YARRAVILLE | C275: CROOK | F275: McTAGGART | I275: LAMONT | L275: WHITTEN | O275: ORANGE | R275: NARKIEWICZ
A276: NORTHCOTE | C276: A TAYLOR | F276: DOWLING | I276: C LANGBORNE | L276: WILLIAMS | O276: BLAKE | R276: K MAYNE
A277: GOALKICKERS
A278: YARRAVILLE | C278: LAMONT 2 | F278: CROOK 2 | I278: WHITTEN | K278: WHITZELL | M278: FLEMING | O278: RYAN | Q278: McCARTHY | T278: JAMES
A279: NORTHCOTE | C279: TAYLOR 3 | F279: K MAYNE 3 | I279: R MAYNE | K279: STONEHAM
C280: 4TH JUNE | F280: WEST WIND SHOWERS
A281: PORT MELBOURNE | C281: 1 | D281: 3 | E281: =C281*6+D281 -> 9 | G281: 4 | H281: 4 | I281: =G281*6+H281 -> 28 | K281: 5 | L281: 4 | M281: =K281*6+L281 -> 34 | O281: 5 | P281: 6 | Q281: =O281*6+P281 -> 36 | S281: MOORABBIN
A282: MOORABBIN | C282: 0 | D282: 3 | E282: =C282*6+D282 -> 3 | G282: 1 | H282: 12 | I282: =G282*6+H282 -> 18 | K282: 1 | L282: 15 | M282: =K282*6+L282 -> 21 | O282: 3 | P282: 17 | Q282: =O282*6+P282 -> 35 | S282: ALLEN
A283: BEST PLAYERS
A284: PORT MELBOURNE | C284: TAGGART | F284: LANDORFF | I284: LEWIS | K284: STRAUCH | N284: LAWSON | Q284: G CAMERON
A285: MOORABBIN | C285: PERRY | F285: KERR | I285: KEE | K285: RYAN | N285: MUIR | Q285: MANIE
A286: GOALKICKERS
A287: PORT MELBOURNE | C287: TAGGART 2 | F287: BOWEN | I287: MERRETT | L287: GARRA
A288: MOORABBIN | C288: ROLFE | F288: BURNS | I288: RYAN
A290: ROUND 7 | E290: 9TH JUNE | H290: WEATHER | J290: WEST WIND GROUNDS HEAVY AFTER OVERNIGHT RAIN | S290: PLAYED AT
D291: 1ST QTR | H291: 2ND QTR | L291: 3RD QTR | P291: FINAL | S291: WILLIAMSTOWN
A292: MOORABBIN | C292: 0 | D292: 3 | E292: =C292*6+D292 -> 3 | G292: 2 | H292: 8 | I292: =G292*6+H292 -> 20 | K292: 5 | L292: 10 | M292: =K292*6+L292 -> 40 | O292: 11 | P292: 15 | Q292: =O292*6+P292 -> 81 | S292: UMPIRE | X292: LADDER | AB292: ROUND | AD292: 7
A293: WILLIAMSTOWN | C293: 2 | D293: 5 | E293: =C293*6+D293 -> 17 | G293: 2 | H293: 7 | I293: =G293*6+H293 -> 19 | K293: 5 | L293: 12 | M293: =K293*6+L293 -> 42 | O293: 5 | P293: 12 | Q293: =O293*6+P293 -> 42 | S293: MILLEN
A294: BEST PLAYERS | W294: TEAM | X294: W | Y294: L | Z294: D | AA294: FOR | AB294: AGST | AC294: % | AD294: PTS
A295: MOORABBIN | C295: R WILDIE | F295: GILDER | I295: RYAN | L295: CROSHER | N295: WHALEBONE | Q295: SHEPHERD
A296: WILLIAMSTOWN | C296: BAMFORD | F296: CARMICHAEL | I296: RUSSELL | L296: McASEY | N296: TURNER | Q296: MURPHY | W296: MOORABBIN | X296: 6 | Y296: 1 | Z296: 0 | AA296: 629 | AB296: 379 | AC296: 165.96306068601584 | AD296: 24
A297: GOALKICKERS | W297: COBURG | X297: 5 | Y297: 2 | Z297: 0 | AA297: 687 | AB297: 463 | AC297: 148.38012958963282 | AD297: 20
A298: MOORABBIN | C298: PAPLEY 3 | F298: RYAN 3 | I298: FOX 2 | K298: WHALEBONE 2 | N298: KERR | W298: SANDRINGHAM | X298: 5 | Y298: 2 | Z298: 0 | AA298: 716 | AB298: 592 | AC298: 120.94594594594595 | AD298: 20
A299: WILLIAMSTOWN | C299: WILLIAMS 2 | F299: TURNER | I299: JAMES | K299: MALONEY | W299: WILLIAMSTOWN | X299: 4 | Y299: 3 | Z299: 0 | AA299: 535 | AB299: 570 | AC299: 93.859649122807014 | AD299: 16
A301: OAKLEIGH | C301: 4 | D301: 7 | E301: =C301*6+D301 -> 31 | G301: 4 | H301: 9 | I301: =G301*6+H301 -> 33 | K301: 8 | L301: 12 | M301: =K301*6+L301 -> 60 | O301: 11 | P301: 16 | Q301: =O301*6+P301 -> 82 | S301: YARRAVILLE | W301: OAKLEIGH | X301: 4 | Y301: 3 | Z301: 0 | AA301: 556 | AB301: 596 | AC301: 93.288590604026851 | AD301: 16
A302: YARRAVILLE | C302: 2 | D302: 3 | E302: =C302*6+D302 -> 15 | G302: 5 | H302: 8 | I302: =G302*6+H302 -> 38 | K302: 8 | L302: 9 | M302: =K302*6+L302 -> 57 | O302: 11 | P302: 11 | Q302: =O302*6+P302 -> 77 | S302: TREWIN | W302: BRUNSWICK | X302: 4 | Y302: 3 | Z302: 0 | AA302: 527 | AB302: 584 | AC302: 90.24 | AD302: 16
A303: BEST PLAYERS | W303: YARRAVILLE | X303: 3 | Y303: 4 | Z303: 0 | AA303: 482 | AB303: 513 | AC303: 93.957115009746587 | AD303: 12
A304: OAKLEIGH | C304: WOOD | F304: JEWELL | I304: COUGHLAN | L304: MURPHY | N304: McCOOKE | Q304: DEFTEROUS | W304: PORT MELBOURNE | X304: 2 | Y304: 5 | Z304: 0 | AA304: 485 | AB304: 548 | AC304: 88.503649635036496 | AD304: 8
A305: YARRAVILLE | C305: LAMONT | F305: McTAGGART | I305: McCARTHY | L305: MOLONEY | N305: ORANGE | Q305: WHITTEN | W305: NORTHCOTE | X305: 2 | Y305: 5 | Z305: 0 | AA305: 484 | AB305: 632 | AC305: 76.582278481012665 | AD305: 8
A306: GOALKICKERS | W306: MORDIALLOC | X306: 0 | Y306: 7 | Z306: 0 | AA306: 428 | AB306: 652 | AC306: 65.64 | AD306: 0
A307: OAKLEIGH | C307: JEWELL 5 | F307: HALL 2 | H307: McLAREN | J307: McCOOKE | M307: DEFTEROUS | P307: RICCI
A308: YARRAVILLE | C308: McCARTHY 3 | F308: MOLONEY 2 | I308: WHITZELL 2 | L308: LAMONT | N308: WARWICK | Q308: WHITTEN | S308: NARKIEWICZ
A310: SANDRINGHAM | C310: 2 | D310: 1 | E310: =C310*6+D310 -> 13 | G310: 7 | H310: 6 | I310: =G310*6+H310 -> 48 | K310: 10 | L310: 7 | M310: =K310*6+L310 -> 67 | O310: 16 | P310: 9 | Q310: =O310*6+P310 -> 105 | S310: BEACH ROAD
A311: NORTHCOTE | C311: 1 | D311: 2 | E311: =C311*6+D311 -> 8 | G311: 1 | H311: 2 | I311: =G311*6+H311 -> 8 | K311: 6 | L311: 3 | M311: =K311*6+L311 -> 39 | O311: 7 | P311: 5 | Q311: =O311*6+P311 -> 47 | S311: McMASTER
A312: BEST PLAYERS
A313: SANDRINGHAM | C313: BURNS | F313: POBJOY | I313: BOLAND | L313: MURRAY | O313: McNABB | R313: McCORMACK
A314: NORTHCOTE | C314: WILLIAMS | F314: LAVER | I314: LANGBORNE | L314: DUNCAN | O314: K MAYNE | R314: GASKELL
A315: GOALKICKERS
A316: SANDRINGHAM | C316: BRYAN 3 | F316: DAWSON 3 | I316: BURNS 3 | K316: McCORMACK 3 | N316: MURRAY 2 | Q316: WEBSTER | T316: GLEESON
A317: NORTHCOTE | C317: K MAYNE 4 | F317: C LANGBORNE 2 | J317: DEAN
E318: 10TH JUNE | I318: WEATHER | K318: WEST WIND FINE
A319: BRUNSWICK | C319: 4 | D319: 2 | E319: =C319*6+D319 -> 26 | G319: 7 | H319: 5 | I319: =G319*6+H319 -> 47 | K319: 11 | L319: 7 | M319: =K319*6+L319 -> 73 | O319: 13 | P319: 10 | Q319: =O319*6+P319 -> 88 | S319: PORT MELBOURNE
A320: PORT MELBOURNE | C320: 1 | D320: 0 | E320: =C320*6+D320 -> 6 | G320: 4 | H320: 4 | I320: =G320*6+H320 -> 28 | K320: 6 | L320: 6 | M320: =K320*6+L320 -> 42 | O320: 9 | P320: 11 | Q320: =O320*6+P320 -> 65 | S320: MANCE
A321: BEST PLAYERS
A322: BRUNSWICK | C322: JOHNSON | F322: R DILLON | I322: THOMPSON | L322: AMBROSE | O322: WATT | R322: THORPE
A323: PORT MELBOURNE | C323: LEWIS | F323: STRAUCH | I323: GARRA | L323: TAGGART | O323: EVANS | R323: LAWSON
A324: GOALKICKERS
A325: BRUNSWICK | C325: DENTON 4 | F325: BRYANT 3 | I325: R EDWARDS 2 | L325: THORPE 2 | N325: STANLEY | Q325: BIBBY
A326: PORT MELBOURNE | C326: BONNETT 2 | F326: PETRUCCO 2 | I326: TAGGART | L326: G CAMERON | O326: LANDORFF | R326: TOLSHER | U326: GARRA
A328: COBURG | C328: 4 | D328: 7 | E328: =C328*6+D328 -> 31 | G328: 6 | H328: 10 | I328: =G328*6+H328 -> 46 | K328: 13 | L328: 15 | M328: =K328*6+L328 -> 93 | O328: 17 | P328: 20 | Q328: =O328*6+P328 -> 122 | S328: COBURG
A329: MORDIALLOC | C329: 1 | D329: 3 | E329: =C329*6+D329 -> 9 | G329: 4 | H329: 5 | I329: =G329*6+H329 -> 29 | K329: 5 | L329: 8 | M329: =K329*6+L329 -> 38 | O329: 7 | P329: 9 | Q329: =O329*6+P329 -> 51 | S329: WOOLFE
A330: BEST PLAYERS
A331: COBURG | C331: L BRIMACOMBE | F331: J BRIMACOMBE | J331: SULLIVAN | M331: ROCHOW | P331: McNABB | S331: FIELDS
A332: MORDIALLOC | C332: WILLIAMS | F332: THOMPSON | J332: PORTA | M332: PEARCE | P332: STEWART | S332: RITCHIE
A333: GOALKICKERS
A334: COBURG | C334: L BRIMACOMBE 5 | G334: J BRIMACOMBE 4 | K334: BYRON 3 | M334: R O'BRIEN 2 | P334: ROCHOW | R334: ONGARELLO | U334: McNABB
A335: MORDIALLOC | C335: KAVANAGH 2 | G335: WILLIS 2 | I335: HARRINGTON | L335: NISBET | N335: THOMPSON
A337: ROUND 8 | E337: 16TH JUNE | J337: WEATHER | N337: NORTH WEST WIND DULL | S337: PLAYED AT
D338: 1ST QTR | H338: 2ND QTR | L338: 3RD QTR | P338: FINAL | S338: OAKLEIGH
A339: OAKLEIGH | C339: 1 | D339: 1 | E339: =C339*6+D339 -> 7 | G339: 3 | H339: 4 | I339: =G339*6+H339 -> 22 | K339: 4 | L339: 5 | M339: =K339*6+L339 -> 29 | O339: 6 | P339: 9 | Q339: =O339*6+P339 -> 45 | S339: UMPIRE | X339: LADDER | AB339: ROUND | AD339: 8
A340: COBURG | C340: 3 | D340: 0 | E340: =C340*6+D340 -> 18 | G340: 3 | H340: 2 | I340: =G340*6+H340 -> 20 | K340: 4 | L340: 4 | M340: =K340*6+L340 -> 28 | O340: 5 | P340: 8 | Q340: =O340*6+P340 -> 38 | S340: ALLEN
A341: BEST PLAYERS | W341: TEAM | X341: W | Y341: L | Z341: D | AA341: FOR | AB341: AGST | AC341: % | AD341: PTS
A342: OAKLEIGH | C342: MULDOON | F342: BAKER | I342: DEFTEROUS | L342: TURNER | N342: PEARCE | Q342: COUGHLAN
A343: COBURG | C343: MICKLESON | F343: SPENCER | I343: SHORT | L343: JORDAN | N343: SULLIVAN | Q343: J BRIMACOMBE | W343: MOORABBIN | X343: 7 | Y343: 1 | Z343: 0 | AA343: 726 | AB343: 421 | AC343: 172.44655581947742 | AD343: 28
A344: GOALKICKERS | W344: SANDRINGHAM | X344: 6 | Y344: 2 | Z344: 0 | AA344: 819 | AB344: 642 | AC344: 127.57009345794393 | AD344: 24
A345: OAKLEIGH | C345: RICCI 2 | F345: COUGHLAN | I345: JONES | K345: McCOOKE | N345: MURPHY | W345: COBURG | X345: 5 | Y345: 3 | Z345: 0 | AA345: 725 | AB345: 508 | AC345: 142.71653543307087 | AD345: 20
A346: COBURG | C346: BYRON 2 | F346: JORDAN | I346: R O'BRIEN | L346: K O'BRIEN | W346: OAKLEIGH | X346: 5 | Y346: 3 | Z346: 0 | AA346: 601 | AB346: 634 | AC346: 94.794952681388011 | AD346: 20
A348: SANDRINGHAM | C348: 2 | D348: 4 | E348: =C348*6+D348 -> 16 | G348: 7 | H348: 9 | I348: =G348*6+H348 -> 51 | K348: 9 | L348: 10 | M348: =K348*6+L348 -> 64 | O348: 15 | P348: 13 | Q348: =O348*6+P348 -> 103 | S348: BRUNSWICK | W348: YARRAVILLE | X348: 4 | Y348: 4 | Z348: 0 | AA348: 558 | AB348: 567 | AC348: 98.412698412698418 | AD348: 16
A349: BRUNSWICK | C349: 2 | D349: 3 | E349: =C349*6+D349 -> 15 | G349: 3 | H349: 5 | I349: =G349*6+H349 -> 23 | K349: 7 | L349: 6 | M349: =K349*6+L349 -> 48 | O349: 7 | P349: 8 | Q349: =O349*6+P349 -> 50 | S349: JACKSON | W349: WILLIAMSTOWN | X349: 4 | Y349: 4 | Z349: 0 | AA349: 583 | AB349: 661 | AC349: 88.199697428139189 | AD349: 16
A350: BEST PLAYERS | W350: BRUNSWICK | X350: 4 | Y350: 4 | Z350: 0 | AA350: 577 | AB350: 687 | AC350: 83.99 | AD350: 16
A351: SANDRINGHAM | C351: MURRAY | F351: WEBSTER | I351: CLIFFORD | L351: BOLAND | O351: McKENZIE | R351: BURKE | W351: PORT MELBOURNE | X351: 3 | Y351: 5 | Z351: 0 | AA351: 576 | AB351: 596 | AC351: 96.644295302013418 | AD351: 12
A352: BRUNSWICK | C352: R DILLON | F352: AMBROSE | I352: DENTON | L352: McKENNA | O352: STANLEY | R352: HARWOOD | W352: NORTHCOTE | X352: 2 | Y352: 6 | Z352: 0 | AA352: 526 | AB352: 729 | AC352: 72.153635116598082 | AD352: 8
A353: GOALKICKERS | W353: MORDIALLOC | X353: 0 | Y353: 8 | Z353: 0 | AA353: 482 | AB353: 728 | AC353: 66.21 | AD353: 0
A354: SANDRINGHAM | C354: BRYAN 5 | F354: MURRAY 5 | I354: BURNS 2 | K354: DAWSON 2 | N354: BURKE
A355: BRUNSWICK | C355: STANLEY 3 | F355: ARTHUR | I355: R EDWARDS | L355: DENTON | N355: THORPE
A357: YARRAVILLE | C357: 5 | D357: 7 | E357: =C357*6+D357 -> 37 | G357: 6 | H357: 8 | I357: =G357*6+H357 -> 44 | K357: 9 | L357: 14 | M357: =K357*6+L357 -> 68 | O357: 10 | P357: 16 | Q357: =O357*6+P357 -> 76 | S357: YARRAVILLE
A358: MORDIALLOC | C358: 0 | D358: 3 | E358: =C358*6+D358 -> 3 | G358: 5 | H358: 5 | I358: =G358*6+H358 -> 35 | K358: 5 | L358: 7 | M358: =K358*6+L358 -> 37 | O358: 7 | P358: 12 | Q358: =O358*6+P358 -> 54 | S358: MARCY
A359: BEST PLAYERS
A360: YARRAVILLE | C360: WHITTEN | F360: CLEGG | I360: ORANGE | L360: HOWARTH | O360: MEDDINGS | R360: TARRANT
A361: MORDIALLOC | C361: HARRINGTON | F361: PORTA | I361: BLAINEY | L361: BAKER | O361: NISBET | R361: PERRY
A362: GOALKICKERS
A363: YARRAVILLE | C363: RON BROWN 2 | F363: McCARTHY 2 | I363: CLEGG | K363: WHITTEN | M363: MOLONEY | O363: WARWICK | Q363: MEDDINGS | T363: HOSKINGS
A364: MORDIALLOC | C364: GIBBON 3 | F364: WILLIS | I364: HARRINGTON | L364: NISBET | N364: SCAIFE
A366: MOORABBIN | C366: 2 | D366: 1 | E366: =C366*6+D366 -> 13 | G366: 6 | H366: 7 | I366: =G366*6+H366 -> 43 | K366: 9 | L366: 9 | M366: =K366*6+L366 -> 63 | O366: 13 | P366: 19 | Q366: =O366*6+P366 -> 97 | S366: MOORABBIN
A367: NORTHCOTE | C367: 2 | D367: 3 | E367: =C367*6+D367 -> 15 | G367: 2 | H367: 3 | I367: =G367*6+H367 -> 15 | K367: 6 | L367: 6 | M367: =K367*6+L367 -> 42 | O367: 6 | P367: 6 | Q367: =O367*6+P367 -> 42 | S367: HORNE
A368: BEST PLAYERS
A369: MOORABBIN | C369: RYAN | F369: PERRY | I369: MANIE | L369: CRAMERI | O369: PAPLEY | R369: ROLFE
A370: NORTHCOTE | C370: BRETHERTON | F370: LANGBORNE | I370: DEAN | L370: LAVER | O370: GASKETT | R370: YOUNG
A371: GOALKICKERS
A372: MOORABBIN | C372: RYAN 5 | F372: PAPLEY 3 | I372: FOX 2 | K372: WHALEBONE 2 | N372: ROLFE
A373: NORTHCOTE | C373: YOUNG 2 | F373: DEAN 2 | I373: C LANGBORNE | L373: STONEHAM
E374: 18TH JUNE
A375: PORT MELBOURNE | C375: 3 | D375: 4 | E375: =C375*6+D375 -> 22 | G375: 6 | H375: 8 | I375: =G375*6+H375 -> 44 | K375: 9 | L375: 12 | M375: =K375*6+L375 -> 66 | O375: 13 | P375: 13 | Q375: =O375*6+P375 -> 91 | S375: PORT MELBOURNE
A376: WILLIAMSTOWN | C376: 2 | D376: 2 | E376: =C376*6+D376 -> 14 | G376: 4 | H376: 4 | I376: =G376*6+H376 -> 28 | K376: 5 | L376: 6 | M376: =K376*6+L376 -> 36 | O376: 6 | P376: 12 | Q376: =O376*6+P376 -> 48 | S376: ROHAN
A377: BEST PLAYERS
A378: PORT MELBOURNE | C378: PETRUCCO | F378: STRAUCH | I378: A CAMERON | L378: FREYER | O378: TAGGART | R378: LANDORFF
A379: WILLIAMSTOWN | C379: JOHNS | F379: MURPHY | I379: COPE | L379: MALONEY | O379: BAMFORD | R379: WILLIAMS
A380: GOALKICKERS
A381: PORT MELBOURNE | C381: PETRUCCO 4 | F381: KEYHOE 3 | I381: TAGGART 2 | L381: BONNETT 2 | O381: MERRETT | Q381: LEWIS
A382: WILLIAMSTOWN | C382: JAMES 2 | F382: MALONEY | I382: MURPHY | K382: JOHNS | M382: CLOUGH
A384: ROUND 9 | E384: 23RD JUNE | I384: WEATHER | K384: WEST BREEZE FINE | S384: PLAYED AT
D385: 1ST QTR | H385: 2ND QTR | L385: 3RD QTR | P385: FINAL | S385: COBURG
A386: COBURG | C386: 5 | D386: 2 | E386: =C386*6+D386 -> 32 | G386: 11 | H386: 3 | I386: =G386*6+H386 -> 69 | K386: 15 | L386: 7 | M386: =K386*6+L386 -> 97 | O386: 20 | P386: 10 | Q386: =O386*6+P386 -> 130 | S386: UMPIRE | X386: LADDER | AB386: ROUND | AD386: 9
A387: MOORABBIN | C387: 2 | D387: 6 | E387: =C387*6+D387 -> 18 | G387: 4 | H387: 10 | I387: =G387*6+H387 -> 34 | K387: 8 | L387: 11 | M387: =K387*6+L387 -> 59 | O387: 15 | P387: 12 | Q387: =O387*6+P387 -> 102 | S387: ROHAN
A388: BEST PLAYERS | W388: TEAM | X388: W | Y388: L | Z388: D | AA388: FOR | AB388: AGST | AC388: % | AD388: PTS
A389: COBURG | C389: JORDAN | F389: ROCHOW | I389: L BRIMACOMBE | L389: SULLIVAN | O389: MICKLESON | R389: SPENCER
A390: MOORABBIN | C390: CRAMERI | F390: BURNS | I390: CLARK | L390: RYAN | O390: FOX | R390: KEE | W390: MOORABBIN | X390: 7 | Y390: 2 | Z390: 0 | AA390: 828 | AB390: 551 | AC390: 150.27223230490017 | AD390: 28
A391: GOALKICKERS | M391: F FINDLAY | P391: FITZPATRICK | W391: SANDRINGHAM | X391: 7 | Y391: 2 | Z391: 0 | AA391: 900 | AB391: 719 | AC391: 125.17385257301808 | AD391: 28
A392: COBURG | C392: MICKLESON 6 | F392: J BRIMACOMBE 3 | J392: JORDAN 3 | M392: ROCHOW 3 | P392: BYRON 2 | R392: L BRIMACOMBE | W392: COBURG | X392: 6 | Y392: 3 | Z392: 0 | AA392: 855 | AB392: 610 | AC392: 140.1639344262295 | AD392: 24
A393: MOORABBIN | C393: KEE 5 | F393: BURNS 5 | I393: PAPLEY 2 | K393: RYAN 2 | M393: FOX | W393: OAKLEIGH | X393: 6 | Y393: 3 | Z393: 0 | AA393: 700 | AB393: 677 | AC393: 103.39734121122599 | AD393: 24
A395: OAKLEIGH | C395: 5 | D395: 2 | E395: =C395*6+D395 -> 32 | G395: 8 | H395: 8 | I395: =G395*6+H395 -> 56 | K395: 8 | L395: 15 | M395: =K395*6+L395 -> 63 | O395: 13 | P395: 21 | Q395: =O395*6+P395 -> 99 | S395: NORTHCOTE | W395: WILLIAMSTOWN | X395: 5 | Y395: 4 | Z395: 0 | AA395: 685 | AB395: 736 | AC395: 93.070652173913047 | AD395: 20
A396: NORTHCOTE | C396: 2 | D396: 2 | E396: =C396*6+D396 -> 14 | G396: 3 | H396: 4 | I396: =G396*6+H396 -> 22 | K396: 5 | L396: 6 | M396: =K396*6+L396 -> 36 | O396: 6 | P396: 7 | Q396: =O396*6+P396 -> 43 | S396: WOOLFE | W396: PORT MELBOURNE | X396: 4 | Y396: 5 | Z396: 0 | AA396: 667 | AB396: 651 | AC396: 102.45775729646698 | AD396: 16
A397: BEST PLAYERS | W397: YARRAVILLE | X397: 4 | Y397: 5 | Z397: 0 | AA397: 635 | AB397: 648 | AC397: 97.993827160493822 | AD397: 16
A398: OAKLEIGH | C398: MULDOON | F398: DEFTEROUS | I398: D HALL | L398: RICCI | O398: COUGHLAN | R398: TURNER | W398: BRUNSWICK | X398: 4 | Y398: 5 | Z398: 0 | AA398: 652 | AB398: 789 | AC398: 82.64 | AD398: 16
A399: NORTHCOTE | C399: GASKETT | F399: LAVER | I399: BRETHERTON | L399: C LANGBORNE | O399: GORMAN | R399: WITHERS | W399: NORTHCOTE | X399: 2 | Y399: 7 | Z399: 0 | AA399: 569 | AB399: 828 | AC399: 68.719806763285021 | AD399: 8
A400: GOALKICKERS | W400: MORDIALLOC | X400: 0 | Y400: 9 | Z400: 0 | AA400: 537 | AB400: 819 | AC400: 65.57 | AD400: 0
A401: OAKLEIGH | C401: RICCI 3 | F401: COUGHLAN 3 | I401: JEWELL 2 | K401: NICHOLLS 2 | N401: McLAREN 2 | Q401: DEFTEROUS
A402: NORTHCOTE | C402: STONEHAM 2 | F402: TAYLOR | I402: BRETHERTON | L402: C LANGBORNE | O402: YOUNG
E403: 24TH JUNE | H403: WEATHER | K403: FINE
A404: PORT MELBOURNE | C404: 3 | D404: 1 | E404: =C404*6+D404 -> 19 | G404: 4 | H404: 1 | I404: =G404*6+H404 -> 25 | K404: 13 | L404: 6 | M404: =K404*6+L404 -> 84 | O404: 14 | P404: 7 | Q404: =O404*6+P404 -> 91 | S404: MORDIALLOC
A405: MORDIALLOC | C405: 1 | D405: 0 | E405: =C405*6+D405 -> 6 | G405: 4 | H405: 9 | I405: =G405*6+H405 -> 33 | K405: 4 | L405: 9 | M405: =K405*6+L405 -> 33 | O405: 7 | P405: 13 | Q405: =O405*6+P405 -> 55 | S405: McMASTER
A406: BEST PLAYERS
A407: PORT MELBOURNE | C407: LEWIS | F407: McRAE | I407: TAGGART | L407: McLEOD | O407: KEYHOE | R407: LANDORFF
A408: MORDIALLOC | C408: BLAINEY | F408: NISBET | I408: KAVANAGH | L408: RITCHIE | O408: PORTA | R408: THOMPSON
A409: GOALKICKERS
A410: PORT MELBOURNE | C410: KEYHOE 4 | F410: McRAE 3 | I410: MERRETT 2 | L410: TAGGART | N410: McLEOD | P410: FREYER | R410: BONNETT | U410: LEWIS
A411: MORDIALLOC | C411: NISBET 3 | F411: CRAWFORD 2 | I411: KAVANAGH | L411: PORTA
E412: 30TH JUNE | I412: WEATHER | K412: NORTH WEST BREEZE FINE
A413: SANDRINGHAM | C413: 2 | D413: 1 | E413: =C413*6+D413 -> 13 | G413: 6 | H413: 4 | I413: =G413*6+H413 -> 40 | K413: 8 | L413: 7 | M413: =K413*6+L413 -> 55 | O413: 11 | P413: 15 | Q413: =O413*6+P413 -> 81 | S413: BEACH ROAD
A414: YARRAVILLE | C414: 2 | D414: 4 | E414: =C414*6+D414 -> 16 | G414: 2 | H414: 7 | I414: =G414*6+H414 -> 19 | K414: 6 | L414: 11 | M414: =K414*6+L414 -> 47 | O414: 11 | P414: 11 | Q414: =O414*6+P414 -> 77 | S414: MANCE
A415: BEST PLAYERS
A416: SANDRINGHAM | C416: McKENZIE | F416: HOAR | I416: BOLAND | L416: O'TOOLE | O416: KELTON | R416: WEBSTER
A417: YARRAVILLE | C417: CROOK | F417: WHITTEN | I417: RON BROWN | L417: McCARTHY | O417: BOB BROWN | R417: NARKIEWICZ
A418: GOALKICKERS
A419: SANDRINGHAM | C419: MURRAY 3 | F419: BRYAN 2 | I419: O'TOOLE 2 | L419: BURNS 2 | O419: BURKE | Q419: GLEESON
A420: YARRAVILLE | C420: WHITZELL 3 | F420: McCARTHY 3 | I420: HOSKINGS | L420: RON BROWN | O420: DRIVER | Q420: WILSON | S420: McGILL
A422: WILLIAMSTOWN | C422: 7 | D422: 0 | E422: =C422*6+D422 -> 42 | G422: 10 | H422: 5 | I422: =G422*6+H422 -> 65 | K422: 13 | L422: 8 | M422: =K422*6+L422 -> 86 | O422: 15 | P422: 12 | Q422: =O422*6+P422 -> 102 | S422: WILLIAMSTOWN
A423: BRUNSWICK | C423: 5 | D423: 2 | E423: =C423*6+D423 -> 32 | G423: 7 | H423: 3 | I423: =G423*6+H423 -> 45 | K423: 9 | L423: 5 | M423: =K423*6+L423 -> 59 | O423: 11 | P423: 9 | Q423: =O423*6+P423 -> 75 | S423: HORNE
A424: BEST PLAYERS
A425: WILLIAMSTOWN | C425: MAZOURIS | F425: COLLINS | I425: CARMICHAEL | L425: BAMFORD | O425: FINCH | R425: WARD
A426: BRUNSWICK | C426: STANLEY | F426: AMBROSE | I426: LEWIS | L426: R EDWARDS | O426: THOMPSON | R426: ARTHUR
A427: GOALKICKERS
A428: WILLIAMSTOWN | C428: MAZOURIS 4 | F428: FINCH 4 | I428: MALONEY 3 | L428: WARD | N428: MURPHY | P428: WILLIAMS | S428: JONES
A429: BRUNSWICK | C429: STANLEY 4 | F429: DENTON 2 | I429: ARTHUR 2 | L429: AMBROSE | N429: BRYANT | P429: WHILEY
A431: ROUND 10 | E431: 7TH JULY | I431: WEATHER | K431: NORTH WIND FINE & SUNNY | S431: PLAYED AT
D432: 1ST QTR | H432: 2ND QTR | L432: 3RD QTR | P432: FINAL | S432: MOORABBIN
A433: MOORABBIN | C433: 5 | D433: 5 | E433: =C433*6+D433 -> 35 | G433: 8 | H433: 7 | I433: =G433*6+H433 -> 55 | K433: 12 | L433: 9 | M433: =K433*6+L433 -> 81 | O433: 15 | P433: 10 | Q433: =O433*6+P433 -> 100 | S433: UMPIRE | X433: LADDER | AB433: ROUND | AD433: 10
A434: SANDRINGHAM | C434: 1 | D434: 2 | E434: =C434*6+D434 -> 8 | G434: 5 | H434: 10 | I434: =G434*6+H434 -> 40 | K434: 8 | L434: 13 | M434: =K434*6+L434 -> 61 | O434: 11 | P434: 18 | Q434: =O434*6+P434 -> 84 | S434: BAIRD
A435: BEST PLAYERS | W435: TEAM | X435: W | Y435: L | Z435: D | AA435: FOR | AB435: AGST | AC435: % | AD435: PTS
A436: MOORABBIN | C436: GILDER | F436: R WILDIE | I436: KEE | L436: W KUPSCH | O436: RYAN | Q436: BURNS
A437: SANDRINGHAM | C437: MURRAY | F437: O'TOOLE | I437: McKENZIE | L437: GLEESON | O437: BURKE | Q437: CLIFFORD | W437: MOORABBIN | X437: 8 | Y437: 2 | Z437: 0 | AA437: 928 | AB437: 635 | AC437: 146.14173228346456 | AD437: 32
A438: GOALKICKERS | W438: COBURG | X438: 7 | Y438: 3 | Z438: 0 | AA438: 973 | AB438: 655 | AC438: 148.54961832061068 | AD438: 28
A439: MOORABBIN | C439: KEE 4 | F439: PAPLEY 3 | I439: FOX 2 | K439: W KUPSCH 2 | N439: RYAN 2 | P439: WHALEBONE 2 | W439: SANDRINGHAM | X439: 7 | Y439: 3 | Z439: 0 | AA439: 984 | AB439: 819 | AC439: 120.14652014652015 | AD439: 28
A440: SANDRINGHAM | C440: BRYAN 3 | F440: GLEESON 2 | I440: BURNS 2 | K440: DAWSON | M440: BURKE | O440: WEBSTER | Q440: MURRAY | W440: OAKLEIGH | X440: 7 | Y440: 3 | Z440: 0 | AA440: 790 | AB440: 729 | AC440: 108.3676268861454 | AD440: 28
A442: OAKLEIGH | C442: 2 | D442: 4 | E442: =C442*6+D442 -> 16 | G442: 7 | H442: 5 | I442: =G442*6+H442 -> 47 | K442: 11 | L442: 8 | M442: =K442*6+L442 -> 74 | O442: 13 | P442: 12 | Q442: =O442*6+P442 -> 90 | S442: OAKLEIGH | W442: WILLIAMSTOWN | X442: 6 | Y442: 4 | Z442: 0 | AA442: 787 | AB442: 812 | AC442: 96.921182266009851 | AD442: 24
A443: MORDIALLOC | C443: 1 | D443: 1 | E443: =C443*6+D443 -> 7 | G443: 3 | H443: 2 | I443: =G443*6+H443 -> 20 | K443: 3 | L443: 3 | M443: =K443*6+L443 -> 21 | O443: 8 | P443: 4 | Q443: =O443*6+P443 -> 52 | S443: MILLEN | W443: PORT MELBOURNE | X443: 5 | Y443: 5 | Z443: 0 | AA443: 786 | AB443: 699 | AC443: 112.44635193133047 | AD443: 20
A444: BEST PLAYERS | W444: YARRAVILLE | X444: 4 | Y444: 6 | Z444: 0 | AA444: 711 | AB444: 750 | AC444: 94.8 | AD444: 16
A445: OAKLEIGH | C445: BAKER | F445: PEAKE | I445: TURNER | L445: MULDOON | O445: JONES | R445: JEWELL | W445: BRUNSWICK | X445: 4 | Y445: 6 | Z445: 0 | AA445: 697 | AB445: 907 | AC445: 76.85 | AD445: 16
A446: MORDIALLOC | C446: RITCHIE | F446: THOMPSON | I446: PORTA | L446: DULLARD | O446: KAVANAGH | W446: NORTHCOTE | X446: 2 | Y446: 8 | Z446: 0 | AA446: 617 | AB446: 947 | AC446: 65.153115100316796 | AD446: 8
A447: GOALKICKERS | W447: MORDIALLOC | X447: 0 | Y447: 10 | Z447: 0 | AA447: 589 | AB447: 909 | AC447: 64.8 | AD447: 0
A448: OAKLEIGH | C448: JEWELL 4 | F448: RICCI 3 | I448: D HALL 2 | L448: JONES 2 | N448: COUGHLAN | Q448: MURPHY
A449: MORDIALLOC | C449: KAVANAGH 2 | F449: BAKER 2 | I449: CRAWFORD 2 | L449: RITCHIE | N449: WILLIAMSON
E450: 8TH JULY | J450: WEATHER | N450: NORTH WIND FINE
A451: WILLIAMSTOWN | C451: 5 | D451: 3 | E451: =C451*6+D451 -> 33 | G451: 10 | H451: 6 | I451: =G451*6+H451 -> 66 | K451: 13 | L451: 9 | M451: =K451*6+L451 -> 87 | O451: 15 | P451: 12 | Q451: =O451*6+P451 -> 102 | S451: YARRAVILLE
A452: YARRAVILLE | C452: 2 | D452: 1 | E452: =C452*6+D452 -> 13 | G452: 5 | H452: 3 | I452: =G452*6+H452 -> 33 | K452: 9 | L452: 7 | M452: =K452*6+L452 -> 61 | O452: 11 | P452: 10 | Q452: =O452*6+P452 -> 76 | S452: ALLEN
A453: BEST PLAYERS
A454: WILLIAMSTOWN | C454: O'TOOLE | F454: MAZOURIS | I454: WARD | L454: WILLIAMS | O454: BAMFORD | R454: CLOUGH
A455: YARRAVILLE | C455: NARKIEWICZ | F455: WHITTEN | I455: WHITZELL | L455: ORANGE | O455: BOB BROWN | R455: CLEGG
A456: GOALKICKERS
A457: WILLIAMSTOWN | C457: MALONEY 4 | F457: MURPHY 3 | I457: CLOUGH 2 | L457: WARD 2 | N457: FINCH | P457: WILLIAMS | S457: MAZOURIS | V457: TURNER
A458: YARRAVILLE | C458: WHITZELL 2 | F458: RON BROWN 2 | I458: WARWICK 2 | L458: MEDDINGS | N458: WILSON | P458: McCARTHY | S458: McGILL | U458: LAMONT
A460: PORT MELBOURNE | C460: 5 | D460: 7 | E460: =C460*6+D460 -> 37 | G460: 9 | H460: 10 | I460: =G460*6+H460 -> 64 | K460: 14 | L460: 21 | M460: =K460*6+L460 -> 105 | O460: 16 | P460: 23 | Q460: =O460*6+P460 -> 119 | S460: PORT MELBOURNE
A461: NORTHCOTE | C461: 0 | D461: 1 | E461: =C461*6+D461 -> 1 | G461: 2 | H461: 4 | I461: =G461*6+H461 -> 16 | K461: 4 | L461: 5 | M461: =K461*6+L461 -> 29 | O461: 7 | P461: 6 | Q461: =O461*6+P461 -> 48 | S461: JACKSON
A462: BEST PLAYERS
A463: PORT MELBOURNE | C463: BONNETT | F463: McLEOD | I463: FREYER | L463: LANDORFF | O463: STRAUCH | R463: MERRETT
A464: NORTHCOTE | C464: C LANGBORNE | F464: BRETHERTON | I464: GORMAN | L464: D TAYLOR | O464: LAVER | R464: A TAYLOR
A465: GOALKICKERS
A466: PORT MELBOURNE | C466: BONNETT 7 | F466: MERRETT 3 | I466: PETRUCCO 2 | L466: TAGGART 2 | O466: KEYHOE | Q466: FREYER
A467: NORTHCOTE | C467: C LANGBORNE 3 | G467: A TAYLOR 2 | J467: BRUSH | L467: K MAYNE
A469: COBURG | C469: 8 | D469: 5 | E469: =C469*6+D469 -> 53 | G469: 10 | H469: 10 | I469: =G469*6+H469 -> 70 | K469: 13 | L469: 14 | M469: =K469*6+L469 -> 92 | O469: 17 | P469: 16 | Q469: =O469*6+P469 -> 118 | S469: BRUNSWICK
A470: BRUNSWICK | C470: 1 | D470: 3 | E470: =C470*6+D470 -> 9 | G470: 3 | H470: 4 | I470: =G470*6+H470 -> 22 | K470: 4 | L470: 6 | M470: =K470*6+L470 -> 30 | O470: 6 | P470: 9 | Q470: =O470*6+P470 -> 45 | S470: ROWE
A471: BEST PLAYERS
A472: COBURG | C472: A FINDLAY | F472: ROCHOW | I472: SMITH | L472: FITZPATRICK | O472: SHORT | Q472: SULLIVAN
A473: BRUNSWICK | C473: HARWOOD | F473: AMBROSE | I473: TOZER | L473: R DILLON | O473: AYRES | Q473: THORPE
A474: GOALKICKERS
A475: COBURG | C475: BYRON 3 | F475: ROCHOW 3 | I475: SMITH 3 | K475: MICKLESON 2 | N475: McDONNELL 2 | Q475: WILSON | S475: ROWAN | U475: FITZPATRICK | X475: FIELDS
A476: BRUNSWICK | C476: ARTHUR 3 | F476: WHILEY | I476: K DILLON | L476: R DILLON
A478: ROUND 11 | E478: 14TH JULY | J478: WEATHER | M478: SOUTH BREEZE COLD DULL | S478: PLAYED AT
D479: 1ST QTR | H479: 2ND QTR | L479: 3RD QTR | P479: FINAL | S479: WILLIAMSTOWN
A480: OAKLEIGH | C480: 0 | D480: 3 | E480: =C480*6+D480 -> 3 | G480: 8 | H480: 5 | I480: =G480*6+H480 -> 53 | K480: 8 | L480: 7 | M480: =K480*6+L480 -> 55 | O480: 14 | P480: 10 | Q480: =O480*6+P480 -> 94 | S480: UMPIRE | X480: LADDER | AB480: ROUND | AD480: 11
A481: WILLIAMSTOWN | C481: 3 | D481: 4 | E481: =C481*6+D481 -> 22 | G481: 5 | H481: 6 | I481: =G481*6+H481 -> 36 | K481: 11 | L481: 10 | M481: =K481*6+L481 -> 76 | O481: 11 | P481: 14 | Q481: =O481*6+P481 -> 80 | S481: MANCE
A482: BEST PLAYERS | W482: TEAM | X482: W | Y482: L | Z482: D | AA482: FOR | AB482: AGST | AC482: % | AD482: PTS
A483: OAKLEIGH | C483: TURNER | F483: McCLELLAND | I483: PEAKE | L483: COUGHLAN | O483: WILLIAMS | R483: JEWELL
A484: WILLIAMSTOWN | C484: CLOUGH | F484: WARD | I484: MAZOURIS | L484: COPE | O484: CARMICHAEL | R484: HOSKING | W484: MOORABBIN | X484: 9 | Y484: 2 | Z484: 0 | AA484: 1034 | AB484: 693 | AC484: 149.20634920634922 | AD484: 36
A485: GOALKICKERS | W485: COBURG | X485: 8 | Y485: 3 | Z485: 0 | AA485: 1064 | AB485: 734 | AC485: 144.95912806539511 | AD485: 32
A486: OAKLEIGH | C486: JEWELL 5 | F486: J WILLIAMS 3 | I486: MURPHY 2 | L486: RICCI 2 | N486: COUGHLAN | Q486: HALL | W486: SANDRINGHAM | X486: 8 | Y486: 3 | Z486: 0 | AA486: 1118 | AB486: 903 | AC486: 123.80952380952381 | AD486: 32
A487: WILLIAMSTOWN | C487: CLOUGH 3 | F487: MALONEY 2 | I487: JONES 2 | K487: WARD | M487: MAZOURIS | P487: TAUBE | R487: HOSKING | W487: OAKLEIGH | X487: 8 | Y487: 3 | Z487: 0 | AA487: 884 | AB487: 809 | AC487: 109.27070457354759 | AD487: 32
A489: SANDRINGHAM | C489: 6 | D489: 2 | E489: =C489*6+D489 -> 38 | G489: 8 | H489: 5 | I489: =G489*6+H489 -> 53 | K489: 13 | L489: 12 | M489: =K489*6+L489 -> 90 | O489: 20 | P489: 14 | Q489: =O489*6+P489 -> 134 | S489: BEACH ROAD | W489: WILLIAMSTOWN | X489: 6 | Y489: 5 | Z489: 0 | AA489: 867 | AB489: 906 | AC489: 95.69536423841059 | AD489: 24
A490: PORT MELBOURNE | C490: 1 | D490: 4 | E490: =C490*6+D490 -> 10 | G490: 4 | H490: 10 | I490: =G490*6+H490 -> 34 | K490: 7 | L490: 13 | M490: =K490*6+L490 -> 55 | O490: 11 | P490: 18 | Q490: =O490*6+P490 -> 84 | S490: ROWE | W490: PORT MELBOURNE | X490: 5 | Y490: 6 | Z490: 0 | AA490: 870 | AB490: 833 | AC490: 104.44177671068428 | AD490: 20
A491: BEST PLAYERS | W491: BRUNSWICK | X491: 5 | Y491: 6 | Z491: 0 | AA491: 777 | AB491: 964 | AC491: 80.6 | AD491: 20
A492: SANDRINGHAM | C492: BOLAND | F492: O'TOOLE | I492: POBJOY | L492: McKENZIE | O492: McNABB | R492: MURRAY | W492: YARRAVILLE | X492: 4 | Y492: 7 | Z492: 0 | AA492: 790 | AB492: 841 | AC492: 93.935790725326996 | AD492: 16
A493: PORT MELBOURNE | C493: BRAGG | F493: STRAUCH | I493: LEWIS | L493: BONNETT | O493: TAGGART | R493: MERRETT | W493: NORTHCOTE | X493: 2 | Y493: 9 | Z493: 0 | AA493: 674 | AB493: 1027 | AC493: 65.62804284323272 | AD493: 8
A494: GOALKICKERS | K494: MURRAY | M494: McCORMACK | P494: WEBSTER | R494: McNABB | W494: MORDIALLOC | X494: 0 | Y494: 11 | Z494: 0 | AA494: 647 | AB494: 1015 | AC494: 63.74 | AD494: 0
A495: SANDRINGHAM | C495: BRYAN 4 | E495: BURNS 3 | G495: GLEESON 3 | J495: O'TOOLE 2 | M495: DAWSON 2 | P495: BURKE | R495: MUTER
A496: PORT MELBOURNE | C496: TAGGART 3 | F496: FREYER 2 | I496: BONNETT 2 | L496: MERRETT | N496: WILLIAMS | Q496: JEFFREY | S496: LEWIS
A498: MOORABBIN | C498: 3 | D498: 5 | E498: =C498*6+D498 -> 23 | G498: 6 | H498: 8 | I498: =G498*6+H498 -> 44 | K498: 7 | L498: 9 | M498: =K498*6+L498 -> 51 | O498: 16 | P498: 10 | Q498: =O498*6+P498 -> 106 | S498: MORDIALLOC
A499: MORDIALLOC | C499: 0 | D499: 3 | E499: =C499*6+D499 -> 3 | G499: 2 | H499: 8 | I499: =G499*6+H499 -> 20 | K499: 5 | L499: 12 | M499: =K499*6+L499 -> 42 | O499: 7 | P499: 16 | Q499: =O499*6+P499 -> 58 | S499: GARLICK
A500: BEST PLAYERS
A501: MOORABBIN | C501: SHEPHERD | F501: BURNS | I501: CRAMERI | L501: MANIE | O501: KEE | Q501: RYAN
A502: MORDIALLOC | C502: RITCHIE | F502: DULLARD | I502: ROBERTS | L502: NISBET | O502: PORTA | Q502: JAMIESON
A503: GOALKICKERS
A504: MOORABBIN | C504: PAPLEY 5 | F504: KEE 3 | H504: BURNS 3 | J504: W KUPSCH 2 | M504: RYAN 2 | O504: FOX
A505: MORDIALLOC | C505: NESBIT 2 | F505: CRAWFORD 2 | I505: KAVANAGH | L505: J JOYCE | N505: PORTA
E506: 15TH JULY | I506: WEATHER
A507: BRUNSWICK | C507: 1 | D507: 4 | E507: =C507*6+D507 -> 10 | G507: 4 | H507: 8 | I507: =G507*6+H507 -> 32 | K507: 7 | L507: 9 | M507: =K507*6+L507 -> 51 | O507: 11 | P507: 14 | Q507: =O507*6+P507 -> 80 | S507: NORTHCOTE
A508: NORTHCOTE | C508: 2 | D508: 4 | E508: =C508*6+D508 -> 16 | G508: 4 | H508: 6 | I508: =G508*6+H508 -> 30 | K508: 7 | L508: 8 | M508: =K508*6+L508 -> 50 | O508: 8 | P508: 9 | Q508: =O508*6+P508 -> 57 | S508: MILLEN
A509: BEST PLAYERS
A510: BRUNSWICK | C510: THORPE | F510: K DILLON | I510: THOMPSON | L510: AMBROSE | O510: JOHNSON | R510: DENTON
A511: NORTHCOTE | C511: ADAMSON | F511: BRETHERTON | I511: GASKETT | L511: LANGBORNE | O511: LAVER | R511: DUNCAN
A512: GOALKICKERS
A513: BRUNSWICK | C513: ARTHUR 3 | F513: THORPE 3 | I513: K DILLON 2 | L513: WHILEY 2 | O513: DENTON
A514: NORTHCOTE | C514: GASKETT 2 | F514: OUSLEY 2 | I514: K MAYNE 2 | L514: DUNCAN | O514: LANGBORNE
A516: COBURG | C516: 3 | D516: 2 | E516: =C516*6+D516 -> 20 | G516: 6 | H516: 3 | I516: =G516*6+H516 -> 39 | K516: 11 | L516: 6 | M516: =K516*6+L516 -> 72 | O516: 14 | P516: 7 | Q516: =O516*6+P516 -> 91 | S516: COBURG
A517: YARRAVILLE | C517: 3 | D517: 3 | E517: =C517*6+D517 -> 21 | G517: 7 | H517: 7 | I517: =G517*6+H517 -> 49 | K517: 9 | L517: 9 | M517: =K517*6+L517 -> 63 | O517: 11 | P517: 13 | Q517: =O517*6+P517 -> 79 | S517: HORNE
A518: BEST PLAYERS
A519: COBURG | C519: BYRON | F519: FIELDS | I519: McDONNELL | L519: SPENCER | O519: SULLIVAN | R519: FITZPATRICK
A520: YARRAVILLE | C520: WHITZELL | F520: CLEGG | I520: WHITTEN | L520: MEDDINGS | O520: LAMONT | R520: EVANS
A521: GOALKICKERS
A522: COBURG | C522: BYRON 4 | F522: SMITH 3 | I522: McDONNELL 2 | L522: ROCHOW | N522: MICKLESON | Q522: K L O'BRIEN | T522: ROWAN | V522: FITZPATRICK
A523: YARRAVILLE | C523: LAMONT 4 | F523: WHITZELL 2 | I523: EVANS 2 | L523: CLEGG | N523: McCARTHY | Q523: WHITTEN
A525: ROUND 12 | E525: 21ST JULY | H525: WEATHER | K525: STRONG NORTH EAST WIND COLD & WET | S525: PLAYED AT
D526: 1ST QTR | H526: 2ND QTR | L526: 3RD QTR | P526: FINAL | S526: OAKLEIGH
A527: SANDRINGHAM | C527: 4 | D527: 3 | E527: =C527*6+D527 -> 27 | G527: 7 | H527: 3 | I527: =G527*6+H527 -> 45 | K527: 11 | L527: 5 | M527: =K527*6+L527 -> 71 | O527: 14 | P527: 5 | Q527: =O527*6+P527 -> 89 | S527: UMPIRE | X527: LADDER | AB527: ROUND | AD527: 12
A528: OAKLEIGH | C528: 4 | D528: 1 | E528: =C528*6+D528 -> 25 | G528: 5 | H528: 5 | I528: =G528*6+H528 -> 35 | K528: 6 | L528: 5 | M528: =K528*6+L528 -> 41 | O528: 10 | P528: 6 | Q528: =O528*6+P528 -> 66 | S528: HORNE
A529: BEST PLAYERS | W529: TEAM | X529: W | Y529: L | Z529: D | AA529: FOR | AB529: AGST | AC529: % | AD529: PTS
A530: SANDRINGHAM | C530: BRYAN | F530: BOLAND | I530: BURNS | L530: McNABB | O530: WEBSTER | R530: McKENZIE
A531: OAKLEIGH | C531: MURPHY | F531: WOOD | I531: MULDOON | L531: DEFTEROUS | O531: PEAKE | R531: BAKER | W531: MOORABBIN | X531: 10 | Y531: 2 | Z531: 0 | AA531: 1121 | AB531: 774 | AC531: 144.83204134366926 | AD531: 40
A532: GOALKICKERS | W532: SANDRINGHAM | X532: 9 | Y532: 3 | Z532: 0 | AA532: 1207 | AB532: 969 | AC532: 124.56140350877193 | AD532: 36
A533: SANDRINGHAM | C533: BRYAN 8 | F533: DAWSON 2 | I533: GLEESON | K533: SHEERAN | M533: BURNS | O533: McNABB | W533: COBURG | X533: 8 | Y533: 4 | Z533: 0 | AA533: 1134 | AB533: 827 | AC533: 137.12212817412333 | AD533: 32
A534: OAKLEIGH | C534: MURPHY 3 | F534: RICCI 2 | H534: HALL | J534: RICCI | L534: JEWELL | N534: McCOOKE | Q534: DONALD | S534: WILLIAMS | W534: OAKLEIGH | X534: 8 | Y534: 4 | Z534: 0 | AA534: 950 | AB534: 898 | AC534: 105.79064587973274 | AD534: 32
A536: WILLIAMSTOWN | C536: 2 | D536: 1 | E536: =C536*6+D536 -> 13 | G536: 10 | H536: 4 | I536: =G536*6+H536 -> 64 | K536: 10 | L536: 4 | M536: =K536*6+L536 -> 64 | O536: 14 | P536: 9 | Q536: =O536*6+P536 -> 93 | S536: WILLIAMSTOWN | W536: WILLIAMSTOWN | X536: 7 | Y536: 5 | Z536: 0 | AA536: 960 | AB536: 976 | AC536: 98.360655737704917 | AD536: 28
A537: COBURG | C537: 5 | D537: 4 | E537: =C537*6+D537 -> 34 | G537: 5 | H537: 6 | I537: =G537*6+H537 -> 36 | K537: 9 | L537: 15 | M537: =K537*6+L537 -> 69 | O537: 9 | P537: 16 | Q537: =O537*6+P537 -> 70 | S537: MILLEN | W537: PORT MELBOURNE | X537: 6 | Y537: 6 | Z537: 0 | AA537: 977 | AB537: 933 | AC537: 104.71596998928189 | AD537: 24
A538: BEST PLAYERS | W538: BRUNSWICK | X538: 5 | Y538: 7 | Z538: 0 | AA538: 858 | AB538: 1051 | AC538: 81.64 | AD538: 20
A539: WILLIAMSTOWN | C539: MALONEY | F539: WARD | I539: COLLINS | L539: WILLIAMS | O539: CLOUGH | R539: JOHNS | W539: YARRAVILLE | X539: 4 | Y539: 8 | Z539: 0 | AA539: 890 | AB539: 948 | AC539: 93.881856540084385 | AD539: 16
A540: COBURG | C540: L BRIMACOMBE | F540: SPENCER | I540: SULLIVAN | L540: SHORT | O540: McDONNELL | R540: HICKS | W540: NORTHCOTE | X540: 2 | Y540: 10 | Z540: 0 | AA540: 732 | AB540: 1120 | AC540: 65.357142857142861 | AD540: 8
A541: GOALKICKERS | W541: MORDIALLOC | X541: 1 | Y541: 11 | Z541: 0 | AA541: 740 | AB541: 1073 | AC541: 68.97 | AD541: 4
A542: WILLIAMSTOWN | C542: WILLIAMS 5 | F542: TURNER 2 | I542: CLOUGH 2 | L542: COLLINS 2 | O542: JOHNS 2 | R542: JONES
A543: COBURG | C543: McDONNELL 3 | F543: L BRIMACOMBE 2 | J543: CLEMENTS 2 | M543: A FINDLAY | P543: SMITH
A545: MOORABBIN | C545: 3 | D545: 4 | E545: =C545*6+D545 -> 22 | G545: 6 | H545: 8 | I545: =G545*6+H545 -> 44 | K545: 9 | L545: 9 | M545: =K545*6+L545 -> 63 | O545: 13 | P545: 9 | Q545: =O545*6+P545 -> 87 | S545: BRUNSWICK
A546: BRUNSWICK | C546: 3 | D546: 1 | E546: =C546*6+D546 -> 19 | G546: 7 | H546: 3 | I546: =G546*6+H546 -> 45 | K546: 7 | L546: 5 | M546: =K546*6+L546 -> 47 | O546: 12 | P546: 9 | Q546: =O546*6+P546 -> 81 | S546: JACKSON
A547: BEST PLAYERS
A548: MOORABBIN | C548: W KUPSCH | F548: KEE | I548: BURNS | L548: MANIE | O548: CROSHER | R548: FOX
A549: BRUNSWICK | C549: K DILLON | F549: HARWOOD | I549: THORPE | L549: AYRES | O549: WHILEY | R549: R EDWARDS
A550: GOALKICKERS
A551: MOORABBIN | C551: KEE 4 | F551: W KUPSCH 4 | I551: FOX 2 | K551: BURNS | M551: PAPLEY | O551: WHALEBONE
A552: BRUNSWICK | C552: K DILLON 4 | F552: R EDWARDS 2 | J552: THORPE 2 | M552: HAGART | O552: AMBROSE | R552: BIBBY | T552: DENTON
E553: 22ND JULY | I553: WEATHER | L553: NORTH WIND
A554: PORT MELBOURNE | C554: 4 | D554: 8 | E554: =C554*6+D554 -> 32 | G554: 7 | H554: 10 | I554: =G554*6+H554 -> 52 | K554: 13 | L554: 17 | M554: =K554*6+L554 -> 95 | O554: 15 | P554: 17 | Q554: =O554*6+P554 -> 107 | S554: PORT MELBOURNE
A555: YARRAVILLE | C555: 1 | D555: 0 | E555: =C555*6+D555 -> 6 | G555: 8 | H555: 9 | I555: =G555*6+H555 -> 57 | K555: 8 | L555: 11 | M555: =K555*6+L555 -> 59 | O555: 14 | P555: 16 | Q555: =O555*6+P555 -> 100 | S555: MANCE
A556: BEST PLAYERS
A557: PORT MELBOURNE | C557: McLEOD | F557: FITZGERALD | I557: FREYER | L557: TAGGART | O557: LEWIS | R557: COWLING
A558: YARRAVILLE | C558: TARRANT | F558: NARKIEWICZ | I558: MOLONEY | L558: WHITTEN | O558: RON BROWN | R558: MEDDINGS
A559: GOALKICKERS
A560: PORT MELBOURNE | C560: FITZGERALD 6 | F560: McMASTER 3 | I560: BONNETT 2 | L560: MERRETT | N560: TAGGART | Q560: FREYER | S560: WILLIAMS
A561: YARRAVILLE | C561: McCARTHY 3 | F561: RON BROWN 2 | I561: EVANS 2 | L561: LEATHERS 2 | O561: WHITTEN | Q561: WHITZELL | T561: MEDDINGS | W561: CHARD
A563: MORDIALLOC | C563: 3 | D563: 10 | E563: =C563*6+D563 -> 28 | G563: 4 | H563: 10 | I563: =G563*6+H563 -> 34 | K563: 10 | L563: 15 | M563: =K563*6+L563 -> 75 | O563: 13 | P563: 15 | Q563: =O563*6+P563 -> 93 | S563: MORDIALLOC
A564: NORTHCOTE | C564: 0 | D564: 1 | E564: =C564*6+D564 -> 1 | G564: 4 | H564: 2 | I564: =G564*6+H564 -> 26 | K564: 4 | L564: 5 | M564: =K564*6+L564 -> 29 | O564: 8 | P564: 10 | Q564: =O564*6+P564 -> 58 | S564: TREWIN
A565: BEST PLAYERS
A566: MORDIALLOC | C566: RITCHIE | F566: CAHIR | I566: NESBIT | L566: THOMPSON | O566: BLAINEY | R566: WILLIAMS
A567: NORTHCOTE | C567: ROOTSEY | F567: ADAMSON | I567: FURLONG | L567: GORMAN | O567: LANGBORNE | R567: LAVER
A568: GOALKICKERS
A569: MORDIALLOC | C569: CAHIR 3 | F569: J JOYCE 2 | I569: NESBIT 2 | K569: R JOYCE 2 | N569: HARRINGTON | Q569: PORTA | S569: BAKER | U569: CRAWFORD
A570: NORTHCOTE | C570: LANGBORNE 2 | F570: ADAMSON 2 | I570: DOWLING | K570: DEAN | M570: YOUNG | O570: FURLONG
A572: ROUND 13 | E572: 28TH JULY | J572: WEATHER | N572: SOUTH WEST BREEZE FINE | S572: PLAYED AT
D573: 1ST QTR | H573: 2ND QTR | L573: 3RD QTR | P573: FINAL | S573: MOORABBIN
A574: MOORABBIN | C574: 0 | D574: 3 | E574: =C574*6+D574 -> 3 | G574: 4 | H574: 3 | I574: =G574*6+H574 -> 27 | K574: 5 | L574: 7 | M574: =K574*6+L574 -> 37 | O574: 10 | P574: 11 | Q574: =O574*6+P574 -> 71 | S574: UMPIRE | X574: LADDER | AB574: ROUND | AD574: 13
A575: OAKLEIGH | C575: 3 | D575: 2 | E575: =C575*6+D575 -> 20 | G575: 6 | H575: 7 | I575: =G575*6+H575 -> 43 | K575: 7 | L575: 10 | M575: =K575*6+L575 -> 52 | O575: 8 | P575: 11 | Q575: =O575*6+P575 -> 59 | S575: TREWIN
A576: BEST PLAYERS | W576: TEAM | X576: W | Y576: L | Z576: D | AA576: FOR | AB576: AGST | AC576: % | AD576: PTS
A577: MOORABBIN | C577: CHRISTIE | F577: CRAMERI | I577: WHALEBONE | L577: KEE | N577: GILDER | Q577: MUIR
A578: OAKLEIGH | C578: MULDOON | F578: LUFF | I578: RICCI | L578: JEWELL | N578: McCOOKE | Q578: MURPHY | W578: MOORABBIN | X578: 11 | Y578: 2 | Z578: 0 | AA578: 1192 | AB578: 833 | AC578: 143.1 | AD578: 44
A579: GOALKICKERS | W579: SANDRINGHAM | X579: 10 | Y579: 3 | Z579: 0 | AA579: 1352 | AB579: 1037 | AC579: 130.37608486017359 | AD579: 40
A580: MOORABBIN | C580: KEE 2 | F580: LAIRD 2 | I580: FOX 2 | K580: SYMONS 2 | N580: WHALEBONE 2 | W580: COBURG | X580: 9 | Y580: 4 | Z580: 0 | AA580: 1226 | AB580: 883 | AC580: 138.84484711211778 | AD580: 36
A581: OAKLEIGH | C581: JEWELL 3 | F581: RICCI 2 | I581: DONALD | K581: MURPHY | M581: McCOOKE | W581: OAKLEIGH | X581: 8 | Y581: 5 | Z581: 0 | AA581: 1009 | AB581: 969 | AC581: 104.13 | AD581: 32
A583: YARRAVILLE | C583: 4 | D583: 4 | E583: =C583*6+D583 -> 28 | G583: 5 | H583: 5 | I583: =G583*6+H583 -> 35 | K583: 10 | L583: 8 | M583: =K583*6+L583 -> 68 | O583: 14 | P583: 9 | Q583: =O583*6+P583 -> 93 | S583: YARRAVILLE | W583: WILLIAMSTOWN | X583: 8 | Y583: 5 | Z583: 0 | AA583: 1044 | AB583: 1044 | AC583: 100 | AD583: 32
A584: BRUNSWICK | C584: 0 | D584: 4 | E584: =C584*6+D584 -> 4 | G584: 3 | H584: 7 | I584: =G584*6+H584 -> 25 | K584: 4 | L584: 9 | M584: =K584*6+L584 -> 33 | O584: 11 | P584: 14 | Q584: =O584*6+P584 -> 80 | S584: GARLICK | W584: PORT MELBOURNE | X584: 6 | Y584: 7 | Z584: 0 | AA584: 1033 | AB584: 1025 | AC584: 100.78048780487805 | AD584: 24
A585: BEST PLAYERS | W585: YARRAVILLE | X585: 5 | Y585: 8 | Z585: 0 | AA585: 983 | AB585: 1028 | AC585: 95.622568093385212 | AD585: 20
A586: YARRAVILLE | C586: CLEGG | F586: RON BROWN | I586: WHITTEN | L586: CROOK | N586: WHITZELL | Q586: HOSKINGS | W586: BRUNSWICK | X586: 5 | Y586: 8 | Z586: 0 | AA586: 938 | AB586: 1144 | AC586: 81.99 | AD586: 20
A587: BRUNSWICK | C587: THOMPSON | F587: R EDWARDS | I587: THORPE | L587: R DILLON | N587: TOZER | Q587: AYRES | W587: NORTHCOTE | X587: 2 | Y587: 11 | Z587: 0 | AA587: 800 | AB587: 1204 | AC587: 66.44518272425249 | AD587: 8
A588: GOALKICKERS | W588: MORDIALLOC | X588: 1 | Y588: 12 | Z588: 0 | AA588: 808 | AB588: 1218 | AC588: 66.34 | AD588: 4
A589: YARRAVILLE | C589: CLEGG 3 | F589: LAMONT 3 | I589: WHITTEN 2 | L589: CROOK 2 | N589: EVANS 2 | Q589: CHARD | S589: ORANGE
A590: BRUNSWICK | C590: R EDWARDS 4 | F590: K DILLON 3 | I590: ARTHUR 2 | L590: DENTON | N590: WHILEY
A592: WILLIAMSTOWN | C592: 2 | D592: 3 | E592: =C592*6+D592 -> 15 | G592: 4 | H592: 9 | I592: =G592*6+H592 -> 33 | K592: 7 | L592: 10 | M592: =K592*6+L592 -> 52 | O592: 12 | P592: 12 | Q592: =O592*6+P592 -> 84 | S592: NORTHCOTE
A593: NORTHCOTE | C593: 4 | D593: 2 | E593: =C593*6+D593 -> 26 | G593: 5 | H593: 4 | I593: =G593*6+H593 -> 34 | K593: 9 | L593: 7 | M593: =K593*6+L593 -> 61 | O593: 10 | P593: 8 | Q593: =O593*6+P593 -> 68 | S593: ROWE
A594: BEST PLAYERS
A595: WILLIAMSTOWN | C595: WARD | F595: MURPHY | I595: McCONVILLE | L595: McASEY | O595: TAUBE | R595: COPE
A596: NORTHCOTE | C596: THRIPP | F596: GORMAN | I596: YOUNG | L596: LANGBORNE | O596: DUNCAN | R596: FURLONG
A597: GOALKICKERS
A598: WILLIAMSTOWN | C598: MURPHY 3 | F598: MALONEY 2 | I598: WARD 2 | K598: COLLINS | M598: HYNES | O598: JONES | Q598: McASEY | S598: CLOUGH
A599: NORTHCOTE | C599: THRIPP 3 | F599: GASKETT | H599: R LANGBORNE | K599: YOUNG | M599: DUNCAN | O599: FURLONG | Q599: SHEPHERD | T599: STONEHAM
A601: SANDRINGHAM | C601: 7 | D601: 4 | E601: =C601*6+D601 -> 46 | G601: 12 | H601: 7 | I601: =G601*6+H601 -> 79 | K601: 13 | L601: 9 | M601: =K601*6+L601 -> 87 | O601: 22 | P601: 13 | Q601: =O601*6+P601 -> 145 | S601: BEACH ROAD
A602: MORDIALLOC | C602: 3 | D602: 0 | E602: =C602*6+D602 -> 18 | G602: 5 | H602: 4 | I602: =G602*6+H602 -> 34 | K602: 8 | L602: 8 | M602: =K602*6+L602 -> 56 | O602: 10 | P602: 8 | Q602: =O602*6+P602 -> 68 | S602: ALLEN
A603: BEST PLAYERS
A604: SANDRINGHAM | C604: McKENZIE | F604: BURNS | I604: WEBSTER | L604: BRYAN | N604: SHEERAN | Q604: KELTON
A605: MORDIALLOC | C605: WILLIAMS | F605: RITCHIE | I605: CRAWFORD | L605: CAHIR | N605: KAVANAGH | Q605: BLAINEY
A606: GOALKICKERS
A607: SANDRINGHAM | C607: BRYAN 8 | F607: BURNS 4 | I607: BURKE 4 | K607: GLEESON 2 | N607: DAWSON 2 | Q607: SHEERAN | S607: WEBSTER
A608: MORDIALLOC | C608: KAVANAGH 3 | F608: NISBET | H608: CRAWFORD | K608: BAKER | M608: PORTA | O608: GIBSON | Q608: CAHIR | S608: THOMPSON
E609: 29TH JULY | I609: WEST WIND FINE
A610: COBURG | C610: 1 | D610: 5 | E610: =C610*6+D610 -> 11 | G610: 4 | H610: 8 | I610: =G610*6+H610 -> 32 | K610: 11 | L610: 12 | M610: =K610*6+L610 -> 78 | O610: 13 | P610: 14 | Q610: =O610*6+P610 -> 92 | S610: COBURG
A611: PORT MELBOURNE | C611: 1 | D611: 7 | E611: =C611*6+D611 -> 13 | G611: 4 | H611: 9 | I611: =G611*6+H611 -> 33 | K611: 7 | L611: 10 | M611: =K611*6+L611 -> 52 | O611: 7 | P611: 14 | Q611: =O611*6+P611 -> 56 | S611: O'NEILL
A612: BEST PLAYERS
A613: COBURG | C613: RICCI | F613: SULLIVAN | I613: SMITH | L613: F FINDLAY | O613: CLEMENTS | R613: HOLCOMBE
A614: PORT MELBOURNE | C614: LANDORFF | F614: McLEOD | I614: FREYER | L614: LAWSON | O614: BONNETT | R614: EDWARDS
A615: GOALKICKERS
A616: COBURG | C616: RICCI 3 | E616: SMITH 3 | G616: ROCHOW | I616: McDONNELL | L616: CLEMENTS | N616: SHORT | P616: F FINDLAY | R616: A FINDLAY | U616: L BRIMACOMBE
A617: PORT MELBOURNE | C617: BONNETT 4 | F617: EDWARDS 3
A619: ROUND 14 | E619: 4TH AUGUST | J619: WEATHER | N619: SOUTH BREEZE FINE | S619: PLAYED AT
D620: 1ST QTR | H620: 2ND QTR | L620: 3RD QTR | P620: FINAL | S620: WILLIAMSTOWN
A621: WILLIAMSTOWN | C621: 0 | D621: 3 | E621: =C621*6+D621 -> 3 | G621: 4 | H621: 6 | I621: =G621*6+H621 -> 30 | K621: 7 | L621: 10 | M621: =K621*6+L621 -> 52 | O621: 11 | P621: 14 | Q621: =O621*6+P621 -> 80 | S621: UMPIRE | X621: LADDER | AB621: ROUND | AD621: 14
A622: SANDRINGHAM | C622: 5 | D622: 1 | E622: =C622*6+D622 -> 31 | G622: 8 | H622: 5 | I622: =G622*6+H622 -> 53 | K622: 9 | L622: 6 | M622: =K622*6+L622 -> 60 | O622: 12 | P622: 8 | Q622: =O622*6+P622 -> 80 | S622: GARLICK
A623: BEST PLAYERS | W623: TEAM | X623: W | Y623: L | Z623: D | AA623: FOR | AB623: AGST | AC623: % | AD623: PTS
A624: WILLIAMSTOWN | C624: MALONEY | F624: MURPHY | I624: McCONVILLE | L624: JONES | O624: MURRIE | R624: TAUBE
A625: SANDRINGHAM | C625: DAWSON | F625: BURNS | I625: O'TOOLE | L625: MURRAY | O625: McCORMACK | R625: BOLAND | W625: MOORABBIN | X625: 11 | Y625: 3 | Z625: 0 | AA625: 1255 | AB625: 920 | AC625: 136.41 | AD625: 44
A626: GOALKICKERS | W626: SANDRINGHAM | X626: 10 | Y626: 3 | Z626: 1 | AA626: 1432 | AB626: 1117 | AC626: 128.20053715308862 | AD626: 42
A627: WILLIAMSTOWN | C627: JAMES 4 | F627: MURPHY 2 | I627: JOHNS 2 | K627: MALONEY | M627: FINCH | O627: CLOUGH | W627: COBURG | X627: 10 | Y627: 4 | Z627: 0 | AA627: 1355 | AB627: 944 | AC627: 143.53813559322035 | AD627: 40
A628: SANDRINGHAM | C628: BRYAN 3 | F628: GLEESON 3 | I628: BURNS 2 | K628: DAWSON | M628: BURKE | O628: MURRAY | Q628: McCORMACK | W628: OAKLEIGH | X628: 9 | Y628: 5 | Z628: 0 | AA628: 1123 | AB628: 1039 | AC628: 108.08 | AD628: 36
A630: OAKLEIGH | C630: 3 | D630: 5 | E630: =C630*6+D630 -> 23 | G630: 6 | H630: 7 | I630: =G630*6+H630 -> 43 | K630: 10 | L630: 10 | M630: =K630*6+L630 -> 70 | O630: 16 | P630: 18 | Q630: =O630*6+P630 -> 114 | S630: OAKLEIGH | W630: WILLIAMSTOWN | X630: 8 | Y630: 5 | Z630: 1 | AA630: 1124 | AB630: 1124 | AC630: 100 | AD630: 34
A631: PORT MELBOURNE | C631: 3 | D631: 4 | E631: =C631*6+D631 -> 22 | G631: 4 | H631: 5 | I631: =G631*6+H631 -> 29 | K631: 7 | L631: 9 | M631: =K631*6+L631 -> 51 | O631: 10 | P631: 10 | Q631: =O631*6+P631 -> 70 | S631: McMASTER | W631: YARRAVILLE | X631: 6 | Y631: 8 | Z631: 0 | AA631: 1070 | AB631: 1091 | AC631: 98.075160403299719 | AD631: 24
A632: BEST PLAYERS | W632: PORT MELBOURNE | X632: 6 | Y632: 8 | Z632: 0 | AA632: 1103 | AB632: 1139 | AC632: 96.839332748024589 | AD632: 24
A633: OAKLEIGH | C633: McCOOKE | F633: RICCI | I633: JEWELL | L633: McCORKELL | O633: JONES | Q633: MURPHY | W633: BRUNSWICK | X633: 6 | Y633: 8 | Z633: 0 | AA633: 1018 | AB633: 1205 | AC633: 84.48 | AD633: 24
A634: PORT MELBOURNE | C634: TAGGART | F634: FREYER | I634: COWLING | L634: STRAUCH | O634: CAPLE | Q634: LANDORFF | W634: NORTHCOTE | X634: 2 | Y634: 12 | Z634: 0 | AA634: 861 | AB634: 1333 | AC634: 64.591147786946735 | AD634: 8
A635: GOALKICKERS | W635: MORDIALLOC | X635: 1 | Y635: 13 | Z635: 0 | AA635: 869 | AB635: 1298 | AC635: 66.95 | AD635: 4
A636: OAKLEIGH | C636: MURPHY 5 | F636: COUGHLAN 4 | I636: McCOOKE 3 | L636: JEWELL | N636: TAYLOR | P636: McCLELLAND | S636: RITCHIE
A637: PORT MELBOURNE | C637: BONNETT 5 | F637: TAGGART 4 | I637: MONKS
A639: YARRAVILLE | C639: 2 | D639: 4 | E639: =C639*6+D639 -> 16 | G639: 5 | H639: 10 | I639: =G639*6+H639 -> 40 | K639: 8 | L639: 13 | M639: =K639*6+L639 -> 61 | O639: 12 | P639: 15 | Q639: =O639*6+P639 -> 87 | S639: MOORABBIN
A640: MOORABBIN | C640: 3 | D640: 4 | E640: =C640*6+D640 -> 22 | G640: 3 | H640: 6 | I640: =G640*6+H640 -> 24 | K640: 4 | L640: 9 | M640: =K640*6+L640 -> 33 | O640: 9 | P640: 9 | Q640: =O640*6+P640 -> 63 | S640: ALLEN
A641: BEST PLAYERS
A642: YARRAVILLE | C642: CROOK | F642: WHITZELL | I642: ORANGR | L642: WHITTEN | N642: McCARTHY | Q642: CLEGG
A643: MOORABBIN | C643: PERRY | F643: WHALEBONE | I643: CRAMERI | L643: FOX | N643: MANIE | Q643: MUIR
A644: GOALKICKERS
A645: YARRAVILLE | C645: McCARTHY 3 | F645: WHITZELL 3 | I645: CROOK 2 | K645: LAMONT | M645: CLEGG | O645: MEDDINGS | R645: McKENNA
A646: MOORABBIN | C646: WHALEBONE 6 | F646: FOX 2 | I646: SYMONS
E647: 5TH AUGUST | I647: WEATHER | L647: SOUTH WIND FINE
A648: BRUNSWICK | C648: 4 | D648: 1 | E648: =C648*6+D648 -> 25 | G648: 5 | H648: 4 | I648: =G648*6+H648 -> 34 | K648: 9 | L648: 7 | M648: =K648*6+L648 -> 61 | O648: 12 | P648: 8 | Q648: =O648*6+P648 -> 80 | S648: MORDIALLOC
A649: MORDIALLOC | C649: 0 | D649: 0 | E649: =C649*6+D649 -> 0 | G649: 5 | H649: 8 | I649: =G649*6+H649 -> 38 | K649: 7 | L649: 10 | M649: =K649*6+L649 -> 52 | O649: 8 | P649: 13 | Q649: =O649*6+P649 -> 61 | S649: O'NEILL
A650: BEST PLAYERS
A651: BRUNSWICK | C651: HARWOOD | F651: TOZER | I651: WHILEY | L651: K DILLON | O651: JOHNSON | R651: AMBROSE
A652: MORDIALLOC | C652: DULLARD | F652: NISBET | I652: HARRINGTON | L652: PORTA | O652: PEARSON | R652: CAHIR
A653: GOALKICKERS
A654: BRUNSWICK | C654: McKENNA 3 | F654: HARWOOD 2 | I654: BRYANT 2 | L654: K DILLON 2 | O654: AMBROSE | Q654: THORPE | S654: TOZER
A655: MORDIALLOC | C655: CAHIR 2 | F655: KAVANAGH | I655: THOMPSON | L655: RITCHIE | N655: HARRINGTON | Q655: CRAWFORD | T655: BAKER
A657: COBURG | C657: 3 | D657: 2 | E657: =C657*6+D657 -> 20 | G657: 6 | H657: 6 | I657: =G657*6+H657 -> 42 | K657: 12 | L657: 8 | M657: =K657*6+L657 -> 80 | O657: 20 | P657: 9 | Q657: =O657*6+P657 -> 129 | S657: COBURG
A658: NORTHCOTE | C658: 3 | D658: 2 | E658: =C658*6+D658 -> 20 | G658: 3 | H658: 4 | I658: =G658*6+H658 -> 22 | K658: 6 | L658: 8 | M658: =K658*6+L658 -> 44 | O658: 8 | P658: 13 | Q658: =O658*6+P658 -> 61 | S658: MANCE
A659: BEST PLAYERS
A660: COBURG | C660: MICKLESON | F660: SULLIVAN | I660: HOLCOMBE | L660: McDONNELL | O660: WILSON | R660: SHORT
A661: NORTHCOTE | C661: R LANGBORNE | F661: FURLONG | I661: DOWLING | L661: DUNCAN | O661: ADAMSON | R661: GASKETT
A662: GOALKICKERS
A663: COBURG | C663: McDONNELL 5 | F663: ROCHOW 4 | I663: MICKLESON 3 | L663: F FINDLAY 3 | O663: SMITH 2 | Q663: RICCI 2 | S663: A FINDLAY
A664: NORTHCOTE | C664: SHEPPARD 2 | F664: THRIPP 2 | I664: LANGBORNE | L664: ADAMSON | N664: FURLONG | Q664: STONEHAM
A666: ROUND 15 | E666: 11TH AUGUST | J666: WEATHER | N666: FINE | S666: PLAYED AT
D667: 1ST QTR | H667: 2ND QTR | L667: 3RD QTR | P667: FINAL | S667: BEACH ROAD
A668: SANDRINGHAM | C668: 7 | D668: 9 | E668: =C668*6+D668 -> 51 | G668: 11 | H668: 14 | I668: =G668*6+H668 -> 80 | K668: 15 | L668: 17 | M668: =K668*6+L668 -> 107 | O668: 18 | P668: 18 | Q668: =O668*6+P668 -> 126 | S668: UMPIRE | X668: LADDER | AB668: ROUND | AD668: 15
A669: COBURG | C669: 2 | D669: 1 | E669: =C669*6+D669 -> 13 | G669: 5 | H669: 6 | I669: =G669*6+H669 -> 36 | K669: 7 | L669: 8 | M669: =K669*6+L669 -> 50 | O669: 12 | P669: 14 | Q669: =O669*6+P669 -> 86 | S669: MILLEN
A670: BEST PLAYERS | W670: TEAM | X670: W | Y670: L | Z670: D | AA670: FOR | AB670: AGST | AC670: % | AD670: PTS
A671: SANDRINGHAM | C671: MURRAY | F671: O'TOOLE | I671: BURNS | L671: DAWSON | N671: WEBSTER | Q671: BOLAND
A672: COBURG | C672: L BRIMACOMBE | F672: A FINDLAY | I672: COLBERT | L672: RICCI | N672: SPENCER | Q672: BYRON | W672: MOORABBIN | X672: 12 | Y672: 3 | Z672: 0 | AA672: 1368 | AB672: 998 | AC672: 137.07 | AD672: 48
A673: GOALKICKERS | W673: SANDRINGHAM | X673: 11 | Y673: 3 | Z673: 1 | AA673: 1558 | AB673: 1203 | AC673: 129.50955943474648 | AD673: 46
A674: SANDRINGHAM | C674: BURNS 5 | E674: MURRAY 4 | H674: BRYAN 3 | J674: GLEESON 2 | M674: O'TOOLE | O674: DAWSON | Q674: BURKE | S674: MUTER | W674: COBURG | X674: 10 | Y674: 5 | Z674: 0 | AA674: 1441 | AB674: 1070 | AC674: 134.67289719626169 | AD674: 40
A675: COBURG | C675: L BRIMACOMBE 5 | G675: BYRON 4 | I675: A FINDLAY | L675: K O'BRIEN | N675: COLBERT | W675: OAKLEIGH | X675: 10 | Y675: 5 | Z675: 0 | AA675: 1200 | AB675: 1101 | AC675: 108.99 | AD675: 40
A677: MOORABBIN | C677: 4 | D677: 6 | E677: =C677*6+D677 -> 30 | G677: 7 | H677: 12 | I677: =G677*6+H677 -> 54 | K677: 11 | L677: 17 | M677: =K677*6+L677 -> 83 | O677: 15 | P677: 23 | Q677: =O677*6+P677 -> 113 | S677: PORT MELBOURNE | W677: WILLIAMSTOWN | X677: 9 | Y677: 5 | Z677: 1 | AA677: 1231 | AB677: 1182 | AC677: 104.14551607445009 | AD677: 38
A678: PORT MELBOURNE | C678: 3 | D678: 2 | E678: =C678*6+D678 -> 20 | G678: 8 | H678: 4 | I678: =G678*6+H678 -> 52 | K678: 9 | L678: 5 | M678: =K678*6+L678 -> 59 | O678: 12 | P678: 6 | Q678: =O678*6+P678 -> 78 | S678: HORNE | W678: YARRAVILLE | X678: 7 | Y678: 8 | Z678: 0 | AA678: 1148 | AB678: 1163 | AC678: 98.710232158211525 | AD678: 28
A679: BEST PLAYERS | W679: PORT MELBOURNE | X679: 6 | Y679: 9 | Z679: 0 | AA679: 1181 | AB679: 1252 | AC679: 94.329073482428115 | AD679: 24
A680: MOORABBIN | C680: BURNS | E680: CROSHER | H680: SHEPHERD | K680: MANIE | N680: FOX | Q680: KEE | W680: BRUNSWICK | X680: 6 | Y680: 9 | Z680: 0 | AA680: 1080 | AB680: 1282 | AC680: 84.24 | AD680: 24
A681: PORT MELBOURNE | C681: FREYER | E681: McLEOD | H681: BOB BONNETT | K681: PETRUCCO | N681: COWLING | Q681: STRAUCH | W681: NORTHCOTE | X681: 2 | Y681: 13 | Z681: 0 | AA681: 933 | AB681: 1411 | AC681: 66.123316796598161 | AD681: 8
A682: GOALKICKERS | W682: MORDIALLOC | X682: 1 | Y682: 14 | Z682: 0 | AA682: 927 | AB682: 1405 | AC682: 65.98 | AD682: 4
A683: MOORABBIN | C683: KEE 4 | E683: BURNS 4 | G683: SHEPHERD 4 | J683: W KUPSCH 2 | M683: CHRISTIE
A684: PORT MELBOURNE | C684: BOB BONNETT 7 | F684: PETRUCCO | I684: JEFFREY | K684: LEWIS | M684: BRAGG | O684: BARRY BONNETT
A686: OAKLEIGH | C686: 2 | D686: 4 | E686: =C686*6+D686 -> 16 | G686: 4 | H686: 9 | I686: =G686*6+H686 -> 33 | K686: 7 | L686: 16 | M686: =K686*6+L686 -> 58 | O686: 10 | P686: 17 | Q686: =O686*6+P686 -> 77 | S686: BRUNSWICK
A687: BRUNSWICK | C687: 3 | D687: 1 | E687: =C687*6+D687 -> 19 | G687: 4 | H687: 2 | I687: =G687*6+H687 -> 26 | K687: 8 | L687: 3 | M687: =K687*6+L687 -> 51 | O687: 9 | P687: 8 | Q687: =O687*6+P687 -> 62 | S687: ALLEN
A688: BEST PLAYERS
A689: OAKLEIGH | C689: McCOOKE | F689: COUGHLAN | I689: TURNER | L689: LEFF | O689: MULDOON | R689: WOOD
A690: BRUNSWICK | C690: HARWOOD | F690: THOMPSON | I690: THORPE | L690: JOHNSON | O690: TOZER | R690: WHILEY
A691: GOALKICKERS
A692: OAKLEIGH | C692: RICCI 5 | F692: COUGHLAN 3 | I692: TAYLOR 2
A693: BRUNSWICK | C693: BRYANT 3 | F693: K DILLON 2 | I693: HARWOOD | L693: EDWARDS | N693: KAY | P693: DENTON
A695: YARRAVILLE | C695: 1 | D695: 0 | E695: =C695*6+D695 -> 6 | G695: 4 | H695: 2 | I695: =G695*6+H695 -> 26 | K695: 7 | L695: 9 | M695: =K695*6+L695 -> 51 | O695: 11 | P695: 12 | Q695: =O695*6+P695 -> 78 | S695: YARRAVILLE
A696: NORTHCOTE | C696: 2 | D696: 1 | E696: =C696*6+D696 -> 13 | G696: 7 | H696: 1 | I696: =G696*6+H696 -> 43 | K696: 11 | L696: 3 | M696: =K696*6+L696 -> 69 | O696: 11 | P696: 6 | Q696: =O696*6+P696 -> 72 | S696: BAIRD
A697: BEST PLAYERS
A698: YARRAVILLE | C698: ORANGE | F698: MEDDINGS | I698: HOSKINGS | L698: CROOK | O698: MOLONEY | R698: WHITTEN
A699: NORTHCOTE | C699: GASKETT | F699: BRETHERTON | I699: OUSLEY | L699: DUNCAN | O699: FURLONG | R699: LANGBORNE
A700: GOALKICKERS
A701: YARRAVILLE | C701: McCARTHY 3 | F701: WHITTEN 2 | I701: MEDDINGS 2 | L701: WARWICK | N701: LAMONT | Q701: CROOK | S701: WHITZELL
A702: NORTHCOTE | C702: GASKETT 3 | F702: TAYLOR 2 | I702: FURLONG 2 | L702: K MAYNE 2 | O702: GRYBAS | Q702: R LANGBORNE
A704: WILLIAMSTOWN | C704: 3 | D704: 3 | E704: =C704*6+D704 -> 21 | G704: 8 | H704: 8 | I704: =G704*6+H704 -> 56 | K704: 14 | L704: 11 | M704: =K704*6+L704 -> 95 | O704: 16 | P704: 11 | Q704: =O704*6+P704 -> 107 | S704: WILLIAMSTOWN
A705: MORDIALLOC | C705: 3 | D705: 2 | E705: =C705*6+D705 -> 20 | G705: 3 | H705: 6 | I705: =G705*6+H705 -> 24 | K705: 6 | L705: 8 | M705: =K705*6+L705 -> 44 | O705: 8 | P705: 10 | Q705: =O705*6+P705 -> 58 | S705: MANCE
A706: BEST PLAYERS
A707: WILLIAMSTOWN | C707: CLOUGH | F707: CARMICHAEL | I707: FINCH | L707: RUSSELL | O707: WILLIAMS | R707: COPE
A708: MORDIALLOC | C708: ROBERTS | F708: NISBET | I708: RITCHIE | L708: WILLIAMS | O708: PORTA | R708: STEWART
A709: GOALKICKERS
A710: WILLIAMSTOWN | C710: FINCH 4 | F710: MAZOURIS 3 | I710: JAMES 3 | K710: CLOUGH 2 | N710: WARD 2 | Q710: WILLIAMS | T710: MURPHY
A711: MORDIALLOC | C711: EMBERSON 2 | F711: GIBBON | H711: PORTA | J711: CRAWFORD | M711: POOLEY | O711: THOMPSON | R711: JOYCE
A713: ROUND 16 | E713: 18TH AUGUST | J713: WEATHER | N713: NORTH WIND FINE | S713: PLAYED AT
D714: 1ST QTR | H714: 2ND QTR | L714: 3RD QTR | P714: FINAL | S714: MOORABBIN
A715: WILLIAMSTOWN | C715: 0 | D715: 1 | E715: =C715*6+D715 -> 1 | G715: 3 | H715: 2 | I715: =G715*6+H715 -> 20 | K715: 7 | L715: 2 | M715: =K715*6+L715 -> 44 | O715: 10 | P715: 5 | Q715: =O715*6+P715 -> 65 | S715: UMPIRE | X715: LADDER | AB715: ROUND | AD715: 16
A716: MOORABBIN | C716: 3 | D716: 6 | E716: =C716*6+D716 -> 24 | G716: 5 | H716: 7 | I716: =G716*6+H716 -> 37 | K716: 7 | L716: 10 | M716: =K716*6+L716 -> 52 | O716: 7 | P716: 14 | Q716: =O716*6+P716 -> 56 | S716: MILLEN
A717: BEST PLAYERS | W717: TEAM | X717: W | Y717: L | Z717: D | AA717: FOR | AB717: AGST | AC717: % | AD717: PTS
A718: WILLIAMSTOWN | C718: COPE | F718: MAZOURIS | I718: RUSSELL | L718: CLOUGH | N718: WILLIAMS | Q718: WARD
A719: MOORABBIN | C719: CRAMERI | F719: GILDER | I719: W KUPSCH | L719: RYAN | N719: BURNS | Q719: MANIE | W719: SANDRINGHAM | X719: 12 | Y719: 3 | Z719: 1 | AA719: 1666 | AB719: 1250 | AC719: 133.28 | AD719: 50
A720: GOALKICKERS | W720: MOORABBIN | X720: 12 | Y720: 4 | Z720: 0 | AA720: 1424 | AB720: 1063 | AC720: 133.96 | AD720: 48
A721: WILLIAMSTOWN | C721: CLOUGH 3 | F721: MURPHY 3 | I721: WILLIAMS 2 | L721: FINCH | N721: WARD | W721: COBURG | X721: 11 | Y721: 5 | Z721: 0 | AA721: 1529 | AB721: 1117 | AC721: 136.88451208594449 | AD721: 44
A722: MOORABBIN | C722: SHEPHERD 2 | F722: W KUPSCH 2 | I722: FOX | K722: RYAN | M722: BURNS | W722: OAKLEIGH | X722: 11 | Y722: 5 | Z722: 0 | AA722: 1294 | AB722: 1172 | AC722: 110.41 | AD722: 44
A724: OAKLEIGH | C724: 4 | D724: 3 | E724: =C724*6+D724 -> 27 | G724: 8 | H724: 6 | I724: =G724*6+H724 -> 54 | K724: 12 | L724: 13 | M724: =K724*6+L724 -> 85 | O724: 13 | P724: 16 | Q724: =O724*6+P724 -> 94 | S724: OAKLEIGH | W724: WILLIAMSTOWN | X724: 10 | Y724: 5 | Z724: 1 | AA724: 1296 | AB724: 1238 | AC724: 104.68497576736672 | AD724: 42
A725: YARRAVILLE | C725: 2 | D725: 1 | E725: =C725*6+D725 -> 13 | G725: 5 | H725: 4 | I725: =G725*6+H725 -> 34 | K725: 6 | L725: 5 | M725: =K725*6+L725 -> 41 | O725: 11 | P725: 5 | Q725: =O725*6+P725 -> 71 | S725: HORNE | W725: YARRAVILLE | X725: 7 | Y725: 9 | Z725: 0 | AA725: 1219 | AB725: 1257 | AC725: 96.976929196499597 | AD725: 28
A726: BEST PLAYERS | W726: BRUNSWICK | X726: 7 | Y726: 9 | Z726: 0 | AA726: 1181 | AB726: 1319 | AC726: 89.54 | AD726: 28
A727: OAKLEIGH | C727: McCOOKE | F727: MURPHY | I727: COUGHLAN | L727: LEFF | O727: WOOD | R727: D HALL | W727: PORT MELBOURNE | X727: 6 | Y727: 10 | Z727: 0 | AA727: 1218 | AB727: 1353 | AC727: 90.022172949002211 | AD727: 24
A728: YARRAVILLE | C728: McGILL | F728: WHITZELL | I728: TARRANT | L728: NARKIEWICZ | O728: McTAGGART | R728: RON BROWN | W728: NORTHCOTE | X728: 2 | Y728: 14 | Z728: 0 | AA728: 980 | AB728: 1519 | AC728: 64.516129032258064 | AD728: 8
A729: GOALKICKERS | W729: MORDIALLOC | X729: 1 | Y729: 15 | Z729: 0 | AA729: 974 | AB729: 1493 | AC729: 65.24 | AD729: 4
A730: OAKLEIGH | C730: McCOOKE 4 | F730: MURPHY 3 | I730: COUGHLAN 3 | L730: JEWELL | N730: JONES | P730: DONALD
A731: YARRAVILLE | C731: EVANS 4 | E731: LAMONT | G731: CLEGG | I731: BOB BROWN | L731: WHITZELL | N731: RON BROWN | Q731: ORANGE | S731: WILSON
A733: SANDRINGHAM | C733: 3 | D733: 2 | E733: =C733*6+D733 -> 20 | G733: 8 | H733: 4 | I733: =G733*6+H733 -> 52 | K733: 11 | L733: 10 | M733: =K733*6+L733 -> 76 | O733: 15 | P733: 18 | Q733: =O733*6+P733 -> 108 | S733: NORTHCOTE
A734: NORTHCOTE | C734: 2 | D734: 0 | E734: =C734*6+D734 -> 12 | G734: 4 | H734: 2 | I734: =G734*6+H734 -> 26 | K734: 5 | L734: 4 | M734: =K734*6+L734 -> 34 | O734: 7 | P734: 5 | Q734: =O734*6+P734 -> 47 | S734: GARLICK
A735: BEST PLAYERS
A736: SANDRINGHAM | C736: WEBSTER | F736: CLIFFORD | I736: BRYAN | L736: HOAR | N736: KELTON | Q736: MURRAY
A737: NORTHCOTE | C737: GASKETT | F737: R LANGBORNE | I737: ADAMSON | L737: TAYLOR | N737: GORMAN | Q737: BLAKE
A738: GOALKICKERS
A739: SANDRINGHAM | C739: BRYAN 8 | F739: MURRAY 4 | I739: GLEESON 2 | L739: BURNS
A740: NORTHCOTE | C740: R MAYNE 2 | F740: GASKETT | I740: LANGBORNE | L740: BEECHER | N740: MILLS | P740: ADAMSON
E741: 19TH AUGUST | I741: WEATHER
A742: BRUNSWICK | C742: 2 | D742: 12 | E742: =C742*6+D742 -> 24 | G742: 6 | H742: 16 | I742: =G742*6+H742 -> 52 | K742: 9 | L742: 19 | M742: =K742*6+L742 -> 73 | O742: 13 | P742: 23 | Q742: =O742*6+P742 -> 101 | S742: BRUNSWICK
A743: PORT MELBOURNE | C743: 3 | D743: 1 | E743: =C743*6+D743 -> 19 | G743: 5 | H743: 5 | I743: =G743*6+H743 -> 35 | K743: 5 | L743: 6 | M743: =K743*6+L743 -> 36 | O743: 5 | P743: 7 | Q743: =O743*6+P743 -> 37 | S743: MANCE
A744: BEST PLAYERS
A745: BRUNSWICK | C745: HARWOOD | F745: AMBROSE | I745: DILLON | K745: WATT | N745: BRYANT | Q745: PAY
A746: PORT MELBOURNE | C746: TAGGART | F746: CAPLE | I746: McLEOD | K746: STRAUCH | N746: LANDORFF | Q746: LEWIS
A747: GOALKICKERS
A748: BRUNSWICK | C748: BRYANT 4 | F748: AYRES 2 | I748: WHILEY 2 | L748: AMBROSE 2 | O748: DILLON | Q748: THORPE | S748: McKENNA
A749: PORT MELBOURNE | C749: BOB BONNETT 2 | F749: TAGGART | I749: FITZGERALD | L749: BRAGG
A751: COBURG | C751: 1 | D751: 5 | E751: =C751*6+D751 -> 11 | G751: 5 | H751: 8 | I751: =G751*6+H751 -> 38 | K751: 9 | L751: 12 | M751: =K751*6+L751 -> 66 | O751: 12 | P751: 16 | Q751: =O751*6+P751 -> 88 | S751: MORDIALLOC
A752: MORDIALLOC | C752: 2 | D752: 1 | E752: =C752*6+D752 -> 13 | G752: 4 | H752: 3 | I752: =G752*6+H752 -> 27 | K752: 6 | L752: 3 | M752: =K752*6+L752 -> 39 | O752: 7 | P752: 5 | Q752: =O752*6+P752 -> 47 | S752: ALLEN
A753: BEST PLAYERS
A754: COBURG | C754: WILSON | F754: J BRIMACOMBE | J754: SPENCER | M754: BYRON | O754: COLBERT | R754: A FINDLAY
A755: MORDIALLOC | C755: CRAWFORD | F755: WILLIS | J755: POOLEY | M755: NISBET | O755: PORTA | R755: CAHIR
A756: GOALKICKERS
A757: COBURG | C757: MICKLESON 3 | F757: J BRIMACOMBE 3 | J757: K O'BRIEN 2 | M757: L BRIMACOMBE | Q757: A FINDLAY | T757: SHORT | V757: BYRON
A758: MORDIALLOC | C758: CRAWFORD 2 | F758: CAHIR 2 | I758: WILKINSON | L758: POOLEY | N758: EMBERSON
A760: ROUND 17 | E760: 25TH AUGUST | J760: WEATHER | M760: NORTH WIND GROUNDS MUDDY | S760: PLAYED AT
D761: 1ST QTR | H761: 2ND QTR | L761: 3RD QTR | P761: FINAL | S761: COBURG
A762: COBURG | C762: 2 | D762: 2 | E762: =C762*6+D762 -> 14 | G762: 8 | H762: 6 | I762: =G762*6+H762 -> 54 | K762: 11 | L762: 7 | M762: =K762*6+L762 -> 73 | O762: 15 | P762: 10 | Q762: =O762*6+P762 -> 100 | S762: UMPIRE | X762: LADDER | AB762: ROUND | AD762: 17
A763: OAKLEIGH | C763: 3 | D763: 2 | E763: =C763*6+D763 -> 20 | G763: 4 | H763: 2 | I763: =G763*6+H763 -> 26 | K763: 8 | L763: 7 | M763: =K763*6+L763 -> 55 | O763: 11 | P763: 9 | Q763: =O763*6+P763 -> 75 | S763: MANCE
A764: BEST PLAYERS | W764: TEAM | X764: W | Y764: L | Z764: D | AA764: FOR | AB764: AGST | AC764: % | AD764: PTS
A765: COBURG | C765: J BRIMACOMBE | F765: L BRIMACOMBE | J765: A FINDLAY | M765: HOLCOMBE | P765: RICCI | R765: MICKLESON
A766: OAKLEIGH | C766: McCLELLAND | F766: JEWELL | J766: LUFF | M766: TURNER | P766: PEAKE | R766: McCOOKE | W766: SANDRINGHAM | X766: 13 | Y766: 3 | Z766: 1 | AA766: 1805 | AB766: 1323 | AC766: 136.43235071806501 | AD766: 54
A767: GOALKICKERS | Q767: McNABB | W767: MOORABBIN | X767: 13 | Y767: 4 | Z767: 0 | AA767: 1566 | AB767: 1110 | AC767: 141.08 | AD767: 52
A768: COBURG | C768: J BRIMACOMBE 4 | F768: L BRIMACOMBE 3 | J768: F FINDLAY 3 | M768: ROCHOW 2 | P768: RICCI | R768: A FINDLAY | W768: COBURG | X768: 12 | Y768: 5 | Z768: 0 | AA768: 1629 | AB768: 1192 | AC768: 136.66107382550337 | AD768: 48
A769: OAKLEIGH | C769: McCOOKE 5 | F769: WILLIAMS 2 | I769: JEWELL | K769: MURPHY | M769: RICCI | O769: JONES | W769: WILLIAMSTOWN | X769: 11 | Y769: 5 | Z769: 1 | AA769: 1431 | AB769: 1301 | AC769: 109.99231360491929 | AD769: 46
A771: SANDRINGHAM | C771: 3 | D771: 2 | E771: =C771*6+D771 -> 20 | G771: 12 | H771: 9 | I771: =G771*6+H771 -> 81 | K771: 18 | L771: 17 | M771: =K771*6+L771 -> 125 | O771: 20 | P771: 19 | Q771: =O771*6+P771 -> 139 | S771: BEACH ROAD | W771: OAKLEIGH | X771: 11 | Y771: 6 | Z771: 0 | AA771: 1369 | AB771: 1272 | AC771: 107.63 | AD771: 44
A772: BRUNSWICK | C772: 1 | D772: 4 | E772: =C772*6+D772 -> 10 | G772: 4 | H772: 5 | I772: =G772*6+H772 -> 29 | K772: 6 | L772: 7 | M772: =K772*6+L772 -> 43 | O772: 10 | P772: 13 | Q772: =O772*6+P772 -> 73 | S772: HORNE | W772: YARRAVILLE | X772: 8 | Y772: 9 | Z772: 0 | AA772: 1325 | AB772: 1309 | AC772: 101.22230710466005 | AD772: 32
A773: BEST PLAYERS | W773: BRUNSWICK | X773: 7 | Y773: 10 | Z773: 0 | AA773: 1254 | AB773: 1458 | AC773: 86.01 | AD773: 28
A774: SANDRINGHAM | C774: BURNS | F774: WEBSTER | I774: MURRAY | L774: O'TOOLE | N774: McCORMACK | Q774: POBJOY | W774: PORT MELBOURNE | X774: 6 | Y774: 11 | Z774: 0 | AA774: 1281 | AB774: 1488 | AC774: 86.088709677419359 | AD774: 24
A775: BRUNSWICK | C775: K DILLON | F775: AMBROSE | I775: EDWARDS | L775: BRYANT | N775: THOMPSON | Q775: FAY | W775: NORTHCOTE | X775: 2 | Y775: 15 | Z775: 0 | AA775: 1027 | AB775: 1661 | AC775: 61.830222757375076 | AD775: 8
A776: GOALKICKERS | P776: GLEESON | W776: MORDIALLOC | X776: 1 | Y776: 16 | Z776: 0 | AA776: 1026 | AB776: 1599 | AC776: 64.17 | AD776: 4
A777: SANDRINGHAM | C777: BURNS 5 | E777: O'TOOLE 4 | G777: WEBSTER 2 | J777: MURRAY 2 | M777: McCORMACK 2 | P777: KENNEDY 2 | R777: BRYAN | T777: BURKE
A778: BRUNSWICK | C778: WHILEY 2 | F778: AYRES 2 | I778: BIBBY 2 | K778: K DILLON 2 | N778: STANLEY | Q778: FAY
A780: WILLIAMSTOWN | C780: 4 | D780: 2 | E780: =C780*6+D780 -> 26 | G780: 11 | H780: 8 | I780: =G780*6+H780 -> 74 | K780: 14 | L780: 10 | M780: =K780*6+L780 -> 94 | O780: 20 | P780: 15 | Q780: =O780*6+P780 -> 135 | S780: WILLIAMSTOWN
A781: PORT MELBOURNE | C781: 2 | D781: 1 | E781: =C781*6+D781 -> 13 | G781: 6 | H781: 1 | I781: =G781*6+H781 -> 37 | K781: 7 | L781: 1 | M781: =K781*6+L781 -> 43 | O781: 10 | P781: 3 | Q781: =O781*6+P781 -> 63 | S781: ALLEN
A782: BEST PLAYERS
A783: WILLIAMSTOWN | C783: CLOUGH | F783: CARMICHAEL | J783: COPE | M783: WILLIAMS | P783: MURRIE | S783: McASEY
A784: PORT MELBOURNE | C784: McLEOD | F784: BOB BONNETT | J784: FITZGERALD | M784: PETRUCCO | P784: STRAUCH | S784: LANDORFF
A785: GOALKICKERS
A786: WILLIAMSTOWN | C786: JAMES 4 | F786: WILLIAMS 4 | I786: MAZOURIS 3 | L786: CLOUGH 3 | N786: O'TOOLE 2 | Q786: FINCH 2 | S786: WARD | U786: JOHNS
A787: PORT MELBOURNE | C787: BOB BONNETT 6 | G787: FITZGERALD 3 | J787: PASK
A789: YARRAVILLE | C789: 1 | D789: 4 | E789: =C789*6+D789 -> 10 | G789: 8 | H789: 13 | I789: =G789*6+H789 -> 61 | K789: 10 | L789: 13 | M789: =K789*6+L789 -> 73 | O789: 15 | P789: 16 | Q789: =O789*6+P789 -> 106 | S789: MORDIALLOC
A790: MORDIALLOC | C790: 4 | D790: 3 | E790: =C790*6+D790 -> 27 | G790: 5 | H790: 4 | I790: =G790*6+H790 -> 34 | K790: 7 | L790: 8 | M790: =K790*6+L790 -> 50 | O790: 7 | P790: 10 | Q790: =O790*6+P790 -> 52 | S790: MILLEN
A791: BEST PLAYERS
A792: YARRAVILLE | C792: WHITZELL | F792: RON BROWN | J792: WHITTEN | M792: EVANS | P792: MEDDINGS | S792: ORANGE
A793: MORDIALLOC | C793: NISBET | F793: RITCHIE | J793: BAKER | M793: WILLIAMS | P793: HARRINGTON | S793: DULLARD
A794: GOALKICKERS
A795: YARRAVILLE | C795: EVANS 6 | F795: RON BROWN 3 | I795: CROOK 2 | K795: ALLEN 2 | M795: LAMONT | O795: MEDDINGS
A796: MORDIALLOC | C796: CAHIR 3 | F796: POOLEY 2 | I796: BAKER | K796: CRAWFORD
A798: MOORABBIN | C798: 5 | D798: 3 | E798: =C798*6+D798 -> 33 | G798: 11 | H798: 5 | I798: =G798*6+H798 -> 71 | K798: 20 | L798: 12 | M798: =K798*6+L798 -> 132 | O798: 21 | P798: 16 | Q798: =O798*6+P798 -> 142 | S798: NORTHCOTE
A799: NORTHCOTE | C799: 3 | D799: 1 | E799: =C799*6+D799 -> 19 | G799: 5 | H799: 6 | I799: =G799*6+H799 -> 36 | K799: 5 | L799: 7 | M799: =K799*6+L799 -> 37 | O799: 6 | P799: 11 | Q799: =O799*6+P799 -> 47 | S799: O'NEILL
A800: BEST PLAYERS
A801: MOORABBIN | C801: PAPLEY | F801: PERRY | I801: FOX | L801: HIRST | O801: W KUPSCH | R801: HARRISON
A802: NORTHCOTE | C802: GASKETT | F802: TAYLOR | I802: BLAKE | L802: BRETHERTON | O802: MILLS | R802: R LANGBORNE
A803: GOALKICKERS
A804: MOORABBIN | C804: PAPLEY 7 | F804: HIRST 3 | I804: SHEPHERD 2 | L804: FOX 2 | N804: RYAN 2 | P804: BURNS 2 | R804: KEE 2 | T804: W KUPSCH
A805: NORTHCOTE | C805: BEECHER 2 | F805: FURLONG | I805: R LANGBORNE | L805: MILLS | N805: TAYLOR
A807: ROUND 18 | E807: 1ST SEPTEMBER | J807: WEATHER | N807: WEST WIND FINE & SUNNY | S807: PLAYED AT
D808: 1ST QTR | H808: 2ND QTR | L808: 3RD QTR | P808: FINAL | S808: MOORABBIN
A809: MOORABBIN | C809: 2 | D809: 2 | E809: =C809*6+D809 -> 14 | G809: 6 | H809: 5 | I809: =G809*6+H809 -> 41 | K809: 10 | L809: 9 | M809: =K809*6+L809 -> 69 | O809: 13 | P809: 20 | Q809: =O809*6+P809 -> 98 | S809: UMPIRE | X809: LADDER | AB809: ROUND | AD809: 18
A810: COBURG | C810: 4 | D810: 1 | E810: =C810*6+D810 -> 25 | G810: 8 | H810: 3 | I810: =G810*6+H810 -> 51 | K810: 9 | L810: 6 | M810: =K810*6+L810 -> 60 | O810: 10 | P810: 6 | Q810: =O810*6+P810 -> 66 | S810: ALLEN
A811: BEST PLAYERS | W811: TEAM | X811: W | Y811: L | Z811: D | AA811: FOR | AB811: AGST | AC811: % | AD811: PTS
A812: MOORABBIN | C812: GILDER | F812: KEE | I812: BURNS | L812: PAPLEY | N812: FOX | Q812: RYAN
A813: COBURG | C813: RICCI | F813: McNABB | I813: ACKLAND | L813: SPENCER | N813: SULLIVAN | Q813: A FINDLAY | W813: MOORABBIN | X813: 14 | Y813: 4 | Z813: 0 | AA813: 1664 | AB813: 1176 | AC813: 141.5 | AD813: 56
A814: GOALKICKERS | W814: SANDRINGHAM | X814: 13 | Y814: 4 | Z814: 1 | AA814: 1872 | AB814: 1435 | AC814: 130.45 | AD814: 54
A815: MOORABBIN | C815: FOX 4 | E815: PAPLEY 3 | H815: BURNS 2 | J815: RYAN 2 | L815: KEE | N815: PERRY | W815: WILLIAMSTOWN | X815: 12 | Y815: 5 | Z815: 1 | AA815: 1515 | AB815: 1355 | AC815: 111.80811808118081 | AD815: 50
A816: COBURG | C816: ACKLAND 4 | F816: McNABB 3 | I816: BYRON 3 | W816: COBURG | X816: 12 | Y816: 6 | Z816: 0 | AA816: 1695 | AB816: 1290 | AC816: 131.3953488372093 | AD816: 48
A818: YARRAVILLE | C818: 1 | D818: 0 | E818: =C818*6+D818 -> 6 | G818: 8 | H818: 4 | I818: =G818*6+H818 -> 52 | K818: 11 | L818: 4 | M818: =K818*6+L818 -> 70 | O818: 17 | P818: 10 | Q818: =O818*6+P818 -> 112 | S818: YARRAVILLE | W818: OAKLEIGH | X818: 12 | Y818: 6 | Z818: 0 | AA818: 1502 | AB818: 1308 | AC818: 114.83 | AD818: 48
A819: SANDRINGHAM | C819: 3 | D819: 8 | E819: =C819*6+D819 -> 26 | G819: 3 | H819: 8 | I819: =G819*6+H819 -> 26 | K819: 8 | L819: 12 | M819: =K819*6+L819 -> 60 | O819: 9 | P819: 13 | Q819: =O819*6+P819 -> 67 | S819: MANCE | W819: YARRAVILLE | X819: 9 | Y819: 9 | Z819: 0 | AA819: 1437 | AB819: 1376 | AC819: 104.43 | AD819: 36
A820: BEST PLAYERS | W820: PORT MELBOURNE | X820: 7 | Y820: 11 | Z820: 0 | AA820: 1363 | AB820: 1558 | AC820: 87.483953786906284 | AD820: 28
A821: YARRAVILLE | C821: WHITTEN | F821: BOB BROWN | I821: HOSKINGS | L821: TARRANT | O821: McGILL | Q821: CROOK | W821: BRUNSWICK | X821: 7 | Y821: 11 | Z821: 0 | AA821: 1308 | AB821: 1542 | AC821: 84.82 | AD821: 28
A822: SANDRINGHAM | C822: McKENZIE | F822: BURNS | I822: HOAR | L822: GLEESON | O822: KELTON | Q822: O'TOOLE | W822: NORTHCOTE | X822: 2 | Y822: 16 | Z822: 0 | AA822: 1063 | AB822: 1794 | AC822: 59.253065774804902 | AD822: 8
A823: GOALKICKERS | W823: MORDIALLOC | X823: 1 | Y823: 17 | Z823: 0 | AA823: 1096 | AB823: 1681 | AC823: 65.2 | AD823: 4
A824: YARRAVILLE | C824: EVANS 4 | E824: WHITTEN 3 | H824: RON BROWN 3 | K824: ALLEN 2 | M824: CROOK | O824: WARWICK | Q824: McGILL | S824: WHITZELL
A825: SANDRINGHAM | C825: BURNS 4 | F825: O'TOOLE 2 | I825: BRYAN | K825: GLEESON | M825: McCORMACK
A827: PORT MELBOURNE | C827: 3 | D827: 7 | E827: =C827*6+D827 -> 25 | G827: 5 | H827: 7 | I827: =G827*6+H827 -> 37 | K827: 9 | L827: 12 | M827: =K827*6+L827 -> 66 | O827: 11 | P827: 16 | Q827: =O827*6+P827 -> 82 | S827: PORT MELBOURNE
A828: MORDIALLOC | C828: 0 | D828: 3 | E828: =C828*6+D828 -> 3 | G828: 3 | H828: 7 | I828: =G828*6+H828 -> 25 | K828: 5 | L828: 8 | M828: =K828*6+L828 -> 38 | O828: 9 | P828: 16 | Q828: =O828*6+P828 -> 70 | S828: HORNE
A829: BEST PLAYERS
A830: PORT MELBOURNE | C830: KEYHOE | F830: FREYER | I830: BONNETT | L830: LAWSON | O830: LEWIS | R830: PETRUCCO
A831: MORDIALLOC | C831: POOLEY | F831: BAKER | I831: NISBET | L831: JOYCE | O831: WILLIAMS | R831: HARRINGTON
A832: GOALKICKERS
A833: PORT MELBOURNE | C833: BONNETT 6 | F833: KEYHOE 2 | I833: PETRUCCO 2 | L833: LEWIS
A834: MORDIALLOC | C834: POOLEY 3 | F834: CRAWFORD | I834: BAKER | K834: CAHIR | M834: WILLIE | O834: R JOYCE | Q834: DURKIN
A836: OAKLEIGH | C836: 6 | D836: 6 | E836: =C836*6+D836 -> 42 | G836: 7 | H836: 8 | I836: =G836*6+H836 -> 50 | K836: 14 | L836: 11 | M836: =K836*6+L836 -> 95 | O836: 20 | P836: 13 | Q836: =O836*6+P836 -> 133 | S836: OAKLEIGH
A837: NORTHCOTE | C837: 1 | D837: 1 | E837: =C837*6+D837 -> 7 | G837: 2 | H837: 3 | I837: =G837*6+H837 -> 15 | K837: 3 | L837: 8 | M837: =K837*6+L837 -> 26 | O837: 4 | P837: 12 | Q837: =O837*6+P837 -> 36 | S837: ALLEN
A838: BEST PLAYERS
A839: OAKLEIGH | C839: JEWELL | F839: TAYLOR | I839: WOOD | L839: MULDOON | O839: RICCI | Q839: MURPHY
A840: NORTHCOTE | C840: GASKETT | F840: TAYLOR | I840: FURLONG | L840: DOWLING | O840: LAVER | Q840: ADAMSON
A841: GOALKICKERS
A842: OAKLEIGH | C842: JEWELL 4 | E842: COUGHLAN 3 | H842: RICCI 3 | J842: MURPHY 3 | M842: WILLIAMS 2 | P842: DONALD 2 | R842: KITTO | T842: JONES | V842: WOOD
A843: NORTHCOTE | C843: MILLS | E843: ADAMSON | H843: OUSLEY | K843: FURLONG
E844: 2ND SEPTEMBER | J844: NORTH WIND
A845: WILLIAMSTOWN | C845: 3 | D845: 2 | E845: =C845*6+D845 -> 20 | G845: 5 | H845: 6 | I845: =G845*6+H845 -> 36 | K845: 7 | L845: 8 | M845: =K845*6+L845 -> 50 | O845: 12 | P845: 12 | Q845: =O845*6+P845 -> 84 | S845: BRUNSWICK
A846: BRUNSWICK | C846: 1 | D846: 3 | E846: =C846*6+D846 -> 9 | G846: 3 | H846: 7 | I846: =G846*6+H846 -> 25 | K846: 4 | L846: 10 | M846: =K846*6+L846 -> 34 | O846: 7 | P846: 12 | Q846: =O846*6+P846 -> 54 | S846: O'NEILL
A847: BEST PLAYERS
A848: WILLIAMSTOWN | C848: MURPHY | F848: CARMICHAEL | I848: TAUBE | L848: JOHNS | O848: PARKER | R848: COPE
A849: BRUNSWICK | C849: JOHNSON | F849: WHILEY | I849: MATTHEWS | L849: EDWARDS | O849: AMBROSE | R849: DILLON
A850: GOALKICKERS
A851: WILLIAMSTOWN | C851: MURPHY 3 | F851: WILLIAMS 3 | I851: FINCH 2 | K851: JAMES 2 | M851: McASEY | O851: JOHNS
A852: BRUNSWICK | C852: MATTHEWS 4 | F852: DILLON | I852: McKENNA | L852: STANLEY
A854: FINALS
A855: 1ST SEMI | D855: 8TH SEPTEMBER | I855: WEATHER | L855: SOUTH WEST BREEZE DULL CLOUDY
D856: 1ST QTR | H856: 2ND QTR | L856: 3RD QTR | P856: FINAL
A857: COBURG | C857: 3 | D857: 2 | E857: =C857*6+D857 -> 20 | G857: 4 | H857: 6 | I857: =G857*6+H857 -> 30 | K857: 9 | L857: 10 | M857: =K857*6+L857 -> 64 | O857: 11 | P857: 12 | Q857: =O857*6+P857 -> 78 | S857: JUNCTION OVAL
A858: WILLIAMSTOWN | C858: 0 | D858: 5 | E858: =C858*6+D858 -> 5 | G858: 3 | H858: 9 | I858: =G858*6+H858 -> 27 | K858: 8 | L858: 9 | M858: =K858*6+L858 -> 57 | O858: 10 | P858: 11 | Q858: =O858*6+P858 -> 71 | S858: MANCE
A859: BEST PLAYERS
A860: COBURG | C860: L BRIMACOMBE | G860: WILSON | J860: A FINDLAY | M860: SPENCER | P860: J BRIMACOMBE | T860: SHORT
A861: WILLIAMSTOWN | C861: CARMICHAEL | G861: MURPHY | J861: COPE | M861: WILLIAMS | P861: WILSON | T861: MAZOURIS
A862: GOALKICKERS
A863: COBURG | C863: L BRIMACOMBE 4 | G863: J BRIMACOMBE 2 | K863: MICKLESON 2 | N863: A FINDLAY | Q863: ROCHOW | T863: CLEMENTS
A864: WILLIAMSTOWN | C864: WARD 2 | F864: FINCH 2 | I864: WILLIAMS 2 | L864: MAZOURIS 2 | O864: HYNES | Q864: MURPHY
A866: 2ND SEMI | D866: 15TH SEPTEMBER | I866: WEATHER | L866: EAST WIND LIGHT SHOWER
A867: MOORABBIN | C867: 3 | D867: 5 | E867: =C867*6+D867 -> 23 | G867: 7 | H867: 6 | I867: =G867*6+H867 -> 48 | K867: 13 | L867: 11 | M867: =K867*6+L867 -> 89 | O867: 14 | P867: 15 | Q867: =O867*6+P867 -> 99 | S867: JUNCTION OVAL
A868: SANDRINGHAM | C868: 2 | D868: 0 | E868: =C868*6+D868 -> 12 | G868: 5 | H868: 3 | I868: =G868*6+H868 -> 33 | K868: 7 | L868: 5 | M868: =K868*6+L868 -> 47 | O868: 9 | P868: 9 | Q868: =O868*6+P868 -> 63 | S868: ALLEN
A869: BEST PLAYERS
A870: MOORABBIN | C870: PAPLEY | F870: MANIE | I870: PERRY | L870: WHALEBONE | O870: CRAMERI | R870: BURNS
A871: SANDRINGHAM | C871: O'TOOLE | F871: BOLAND | I871: McKENZIE | L871: WEBSTER | O871: HOAR | R871: CLIFFORD
A872: GOALKICKERS
A873: MOORABBIN | C873: PAPLEY 8 | F873: BURNS 2 | I873: WHALEBONE 2 | M873: KEE | O873: PERRY
A874: SANDRINGHAM | C874: O'TOOLE 4 | F874: SHRIVES 2 | I874: DAWSON | L874: BURKE | N874: MURRAY
A876: PRELIMINARY FINAL | F876: 22ND SEPTEMBER | K876: WEATHER
A877: SANDRINGHAM | C877: 3 | D877: 2 | E877: =C877*6+D877 -> 20 | G877: 9 | H877: 5 | I877: =G877*6+H877 -> 59 | K877: 9 | L877: 7 | M877: =K877*6+L877 -> 61 | O877: 13 | P877: 16 | Q877: =O877*6+P877 -> 94 | S877: JUNCTION OVAL
A878: COBURG | C878: 2 | D878: 2 | E878: =C878*6+D878 -> 14 | G878: 5 | H878: 2 | I878: =G878*6+H878 -> 32 | K878: 6 | L878: 7 | M878: =K878*6+L878 -> 43 | O878: 10 | P878: 11 | Q878: =O878*6+P878 -> 71 | S878: HORNE
A879: BEST PLAYERS
A880: SANDRINGHAM | C880: DAWSON | F880: BURKE | I880: CLIFFORD | L880: McKENZIE | O880: MUSGROVE | R880: KENNEDY
A881: COBURG | C881: SHORT | F881: WILSON | I881: COLBERT | L881: A FINDLAY | O881: SULLIVAN | R881: MICKLESON
A882: GOALKICKERS
A883: SANDRINGHAM | C883: BRYAN 4 | F883: DAWSON 2 | I883: KENNEDY 2 | L883: STRACHAN | O883: BURKE | Q883: GLEESON | S883: MUTER | U883: MURRAY
A884: COBURG | C884: RICCI 3 | F884: J BRIMACOMBE 2 | J884: A FINDLAY 2 | M884: F FINDLAY | P884: McNABB | R884: L BRIMACOMBE
A886: GRAND FINAL | E886: 29TH SEPTEMBER | I886: WEATHER | L886: STRONG SOUTH WEST WIND DULL CLOUDY
A887: SANDRINGHAM | C887: 3 | D887: 4 | E887: 22 | G887: 6 | H887: 7 | I887: 43 | K887: 6 | L887: 7 | M887: 43 | O887: 14 | P887: 10 | Q887: =O887*6+P887 -> 94 | S887: JUNCTION OVAL
A888: MOORABBIN | C888: 3 | D888: 6 | E888: 24 | G888: 7 | H888: 10 | I888: 52 | K888: 12 | L888: 15 | M888: 87 | O888: 13 | P888: 15 | Q888: =O888*6+P888 -> 93 | S888: ALLEN
A889: BEST PLAYERS
A890: SANDRINGHAM | C890: STRACHAN | F890: CLIFFORD | I890: GRANGER | L890: MUSGROVE | O890: McKENZIE | R890: POBJOY
A891: MOORABBIN | C891: WHALEBONE | F891: MANIE | I891: CRAMERI | L891: KEE | O891: CROSHER | R891: DALTON
A892: GOALKICKERS
A893: SANDRINGHAM | C893: STRACHAN 4 | F893: BRYAN 2 | I893: O'TOOLE 2 | L893: DAWSON 2 | O893: MURRAY 2 | R893: KENNEDY 2
A894: MOORABBIN | C894: WHALEBONE 5 | F894: PAPLEY 3 | I894: KEE 2 | K894: FOX | M894: W KUPSCH | P894: CHRISTIE
A896: 2ND DIVISION | C896: RUNNER-UP | F896: VS | H896: 9TH TEAM | J896: 1ST DIVISION
H897: 16TH SEPTEMBER
A898: NORTHCOTE | C898: 3 | D898: 5 | E898: =C898*6+D898 -> 23 | G898: 9 | H898: 14 | I898: 68 | K898: 10 | L898: 15 | M898: 75 | O898: 17 | P898: 21 | Q898: =O898*6+P898 -> 123 | S898: BRUNSWICK
A899: PRAHRAN | C899: 1 | D899: 2 | E899: =C899*6+D899 -> 8 | G899: 2 | H899: 3 | I899: 15 | K899: 5 | L899: 9 | M899: 39 | O899: 6 | P899: 10 | Q899: =O899*6+P899 -> 46 | S899: McMASTER
A900: BEST PLAYERS
A901: NORTHCOTE | C901: DOWLING | F901: C LANGBORNE | J901: R LANGBORNE | M901: GASKETT | P901: BLAKE | S901: BRETHERTON
A902: PRAHRAN | C902: BURGESS | F902: A GRAY | J902: CLOSE | M902: KERLEY | P902: LAMBERT | S902: JONES
A903: GOALKICKERS
A904: NORTHCOTE | C904: AGHAN 4 | F904: OUSLEY 3 | I904: C LANGBORNE 3 | M904: TAYLOR 2 | P904: FURLONG 2 | S904: ADAMSON | V904: R LANGBORNE | X904: GASKETT
A905: PRAHRAN | C905: W GRAY 2 | F905: PEARSON | I905: KERLEY | K905: McCALLUM | N905: RICHARDS
A907: INTERSTATE MATCH | F907: 4TH JUNE | J907: WEATHER | M907: WEST WIND SHOWERS
A908: V.F.A. | C908: 3 | D908: 7 | E908: =C908*6+D908 -> 25 | G908: 6 | H908: 9 | I908: =G908*6+H908 -> 45 | K908: 10 | L908: 10 | M908: =K908*6+L908 -> 70 | O908: 12 | P908: 15 | Q908: =O908*6+P908 -> 87 | S908: DEVONPORT
A909: TASMANIA | C909: 3 | D909: 0 | E909: =C909*6+D909 -> 18 | G909: 5 | H909: 2 | I909: =G909*6+H909 -> 32 | K909: 8 | L909: 6 | M909: =K909*6+L909 -> 54 | O909: 12 | P909: 9 | Q909: =O909*6+P909 -> 81 | S909: SCHWAB
A910: BEST PLAYERS
A911: V.F.A. | C911: PAPLEY | F911: BOSCH | I911: CAMERON | L911: COUGHLAN | O911: YOUNG | R911: JORDAN
A912: TASMANIA | C912: HAYES | F912: WILKINSON | I912: SPENCER | L912: BINGLEY | O912: SYMONS | R912: MOORE
A913: GOALKICKERS
A914: V.F.A. | C914: PAPLEY 4 | F914: JORDAN 3 | I914: COUGHLAN 3 | L914: WHALEBONE | O914: BYRON
A915: TASMANIA | C915: WILKINSON 5 | F915: COLLINS 3 | I915: SYMONS 2 | L915: SMITH | N915: BANKS
A917: TEAMS | F917: V.F.A. | O917: TAS
A918: BACKS | C918: GILDER | F918: CAMERON | I918: YOUNG | L918: SPENCER | O918: PLUNKETT | R918: BROWNING
A919: H-BACKS | C919: CARMICHAEL | F919: FINDLAY | I919: JOHNSON | L919: BINGLEY | O919: HAYES | R919: LAWSON
A920: CENTRES | C920: GASKETT | F920: WATERS | I920: BOSCH | L920: MOORE | O920: CONLAN | R920: JOHNSTONE
A921: H-FORWARDS | C921: BROWN | F921: MURRAY | I921: PAPLEY | L921: GROOM | O921: WILKINSON | R921: CODE
A922: FORWARDS | C922: COUGHLAN | F922: BYRON | I922: WHALEBONE | L922: BANKS | O922: COLLINS | R922: WITHERS
A923: RUCKS | C923: CROSBIE | F923: MUTER | I923: JORDAN | L923: POWELL | O923: SMITH | R923: SYMONS
A924: RES | C924: MALONEY | F924: PENNEFATHER | L924: STUART | O924: HOWARD