A1: Victorian Football Association
A2: Season 1962 - Division Two
A3: © Copyright Wal Williams | F3: First created: 28 March 2016
A4: Contact: joywalwi at gmail dot com | F4: Last updated: 28 March 2016 | W4: VFA Results and tables - Link to the main index page
A5: You are free to copy this document in whole or part provided that proper acknowledgement is given to the author. All rights reserved.
A7: 1962 | D7: 2ND DIVISION
A8: ROUND 1 | E8: 28TH APRIL | I8: WEATHER | S8: PLAYED AT
D9: 1ST QTR | H9: 2ND QTR | L9: 3RD QTR | P9: FINAL | S9: BOX HILL
A10: BOX HILL | E10: =C10*6+D10 -> 0 | I10: =G10*6+H10 -> 0 | M10: =K10*6+L10 -> 0 | O10: 10 | P10: 7 | Q10: =O10*6+P10 -> 67 | S10: UMPIRE | X10: LADDER | AB10: ROUND | AD10: 1
A11: SUNSHINE | E11: =C11*6+D11 -> 0 | I11: =G11*6+H11 -> 0 | M11: =K11*6+L11 -> 0 | O11: 7 | P11: 9 | Q11: =O11*6+P11 -> 51
A12: BEST PLAYERS | W12: TEAM | X12: W | Y12: L | Z12: D | AA12: FOR | AB12: AGST | AC12: % | AD12: PTS
A13: BOX HILL | C13: BEASY | F13: SALVADO | I13: QUINN | L13: WITTNER | O13: BARNES | Q13: ROSS
A14: SUNSHINE | C14: ROACH | F14: CROSBIE | I14: P FITZGERALD | L14: N KEMP | O14: SYMONS | Q14: PRESTON | W14: WAVERLEY | X14: 1 | Y14: 0 | Z14: 0 | AA14: 64 | AB14: 42 | AC14: =(AA14*100)/AB14 -> 152.38095238095238 | AD14: =(X14*4)+(Z14*2) -> 4
A15: GOALKICKERS | W15: BOX HILL | X15: 1 | Y15: 0 | Z15: 0 | AA15: 67 | AB15: 51 | AC15: =(AA15*100)/AB15 -> 131.37254901960785 | AD15: =(X15*4)+(Z15*2) -> 4
A16: BOX HILL | C16: SALVADO 3 | F16: QUINN 2 | I16: BEASY 2 | K16: PAVLIN | M16: CURRY | O16: BARNES | W16: DANDENONG | X16: 1 | Y16: 0 | Z16: 0 | AA16: 59 | AB16: 55 | AC16: =(AA16*100)/AB16 -> 107.27272727272727 | AD16: =(X16*4)+(Z16*2) -> 4
A17: SUNSHINE | C17: CROSBIE 2 | F17: HOWARD 2 | I17: STEWART | L17: N KEMP | N17: WAPLING | W17: PRESTON | X17: 1 | Y17: 0 | Z17: 0 | AA17: 78 | AB17: 73 | AC17: =(AA17*100)/AB17 -> 106.84931506849315 | AD17: =(X17*4)+(Z17*2) -> 4
A19: DANDENONG | E19: =C19*6+D19 -> 0 | I19: =G19*6+H19 -> 0 | M19: =K19*6+L19 -> 0 | O19: 8 | P19: 11 | Q19: =O19*6+P19 -> 59 | S19: CAMBERWELL | W19: PRAHRAN | X19: 0 | Y19: 1 | Z19: 0 | AA19: 73 | AB19: 78 | AC19: =(AA19*100)/AB19 -> 93.589743589743591 | AD19: =(X19*4)+(Z19*2) -> 0
A20: CAMBERWELL | E20: =C20*6+D20 -> 0 | I20: =G20*6+H20 -> 0 | M20: =K20*6+L20 -> 0 | O20: 8 | P20: 7 | Q20: =O20*6+P20 -> 55 | W20: CAMBERWELL | X20: 0 | Y20: 1 | Z20: 0 | AA20: 55 | AB20: 59 | AC20: =(AA20*100)/AB20 -> 93.220338983050851 | AD20: =(X20*4)+(Z20*2) -> 0
A21: BEST PLAYERS | W21: SUNSHINE | X21: 0 | Y21: 1 | Z21: 0 | AA21: 51 | AB21: 67 | AC21: =(AA21*100)/AB21 -> 76.119402985074629 | AD21: =(X21*4)+(Z21*2) -> 0
A22: DANDENONG | C22: LITTLE | F22: WRIGHT | I22: PENNEFATHER | L22: B WATERS | O22: DINEEN | Q22: ABRAHAM | W22: BRIGHTON-CAULFIELD | X22: 0 | Y22: 1 | Z22: 0 | AA22: 42 | AB22: 64 | AC22: =(AA22*100)/AB22 -> 65.625 | AD22: =(X22*4)+(Z22*2) -> 0
A23: CAMBERWELL | C23: SKALBERG | F23: QUIRK | I23: YOUNG | L23: B JOHNSON | O23: GIBSON | Q23: O'NEILL
A24: GOALKICKERS
A25: DANDENONG | C25: WRIGHT 2 | E25: ABRAHAM | H25: GRAY | J25: DELANTY | M25: MINOTTI | O25: SHELTON | Q25: B WATERS
A26: CAMBERWELL | C26: O'NEILL 2 | E26: WRIGHT | H26: GIBSON | J26: QUIRK | L26: LONDON | N26: ELLIS | P26: RICHARDS
A28: WAVERLEY | E28: =C28*6+D28 -> 0 | I28: =G28*6+H28 -> 0 | M28: =K28*6+L28 -> 0 | O28: 8 | P28: 16 | Q28: =O28*6+P28 -> 64 | S28: WAVERLEY
A29: BRIGHTON-CAULFIELD | E29: =C29*6+D29 -> 0 | I29: =G29*6+H29 -> 0 | M29: =K29*6+L29 -> 0 | O29: 6 | P29: 6 | Q29: =O29*6+P29 -> 42
A30: BEST PLAYERS
A31: WAVERLEY | C31: COLE | F31: BLACK | I31: CLANCY | L31: WHITFIELD | O31: E SMITH | Q31: SAMPSON
A32: BRIGHTON-CAULFIELD | C32: FOX | F32: CLARKE | I32: W COOPER | L32: BEGLEY | O32: EVANS | Q32: A MOULE
A33: GOALKICKERS
A34: WAVERLEY | C34: NASH 3 | F34: E SMITH 2 | I34: COLE | K34: WHITFIELD | N34: FALCONER
A35: BRIGHTON-CAULFIELD | C35: BROWNING 2 | F35: BEGLEY 2 | I35: W COOPER | L35: EVANS
A37: PRESTON | E37: =C37*6+D37 -> 0 | I37: =G37*6+H37 -> 0 | M37: =K37*6+L37 -> 0 | O37: 11 | P37: 12 | Q37: =O37*6+P37 -> 78 | S37: PRESTON
A38: PRAHRAN | E38: =C38*6+D38 -> 0 | I38: =G38*6+H38 -> 0 | M38: =K38*6+L38 -> 0 | O38: 11 | P38: 7 | Q38: =O38*6+P38 -> 73
A39: BEST PLAYERS
A40: PRESTON | C40: HAYES | F40: O'KEEFE | I40: HANCOCK | L40: O'DONNELL
A41: PRAHRAN | C41: HAYES | F41: BOSCH | I41: KERLEY | L41: BUTLER | O41: LAMBERT | R41: GRAY
A42: GOALKICKERS
A43: PRESTON | C43: MURNANE 3 | F43: GRANT 3 | I43: O'KEEFE 2 | L43: PERRY 2 | N43: LAMBIE
A44: PRAHRAN | C44: BOSCH 2 | F44: DYER 2 | H44: BUTLER 2 | K44: McMAHON 2 | N44: KERLEY 2 | Q44: RICHARDS
A46: ROUND 2 | E46: 5TH MAY | I46: WEATHER
D47: 1ST QTR | H47: 2ND QTR | L47: 3RD QTR | P47: FINAL
A48: PRESTON | E48: =C48*6+D48 -> 0 | I48: =G48*6+H48 -> 0 | M48: =K48*6+L48 -> 0 | O48: 15 | P48: 10 | Q48: =O48*6+P48 -> 100 | S48: DANDENONG | X48: LADDER | AB48: ROUND | AD48: 2
A49: DANDENONG | E49: =C49*6+D49 -> 0 | I49: =G49*6+H49 -> 0 | M49: =K49*6+L49 -> 0 | O49: 7 | P49: 17 | Q49: =O49*6+P49 -> 59
A50: BEST PLAYERS | W50: TEAM | X50: W | Y50: L | Z50: D | AA50: FOR | AB50: AGST | AC50: % | AD50: PTS
A51: PRESTON | C51: PINFOLD | F51: LAMBIE | I51: GRANT | L51: MURNANE | O51: HANCOCK | R51: MURPHY
A52: DANDENONG | C52: DELANTY | F52: B WATERS | I52: DINEEN | L52: WRIGHT | O52: MINOTTI | R52: BARRAN | W52: WAVERLEY | X52: 2 | Y52: 0 | Z52: 0 | AA52: 152 | AB52: 106 | AC52: =(AA52*100)/AB52 -> 143.39622641509433 | AD52: =(X52*4)+(Z52*2) -> 8
A53: GOALKICKERS | W53: PRESTON | X53: 2 | Y53: 0 | Z53: 0 | AA53: 178 | AB53: 132 | AC53: =(AA53*100)/AB53 -> 134.84848484848484 | AD53: =(X53*4)+(Z53*2) -> 8
A54: PRESTON | C54: MURNANE 5 | F54: GRANT 3 | I54: HANCOCK 2 | L54: PERRY 2 | N54: ELSUM | P54: O'KEEFE | R54: HAYES | W54: BOX HILL | X54: 2 | Y54: 0 | Z54: 0 | AA54: 142 | AB54: 119 | AC54: =(AA54*100)/AB54 -> 119.32773109243698 | AD54: =(X54*4)+(Z54*2) -> 8
A55: DANDENONG | C55: GRAY 2 | F55: DELANTY | I55: WHELOW | L55: ABRAHAM | N55: WRIGHT | P55: DINEEN | W55: CAMBERWELL | X55: 1 | Y55: 1 | Z55: 0 | AA55: 149 | AB55: 149 | AC55: =(AA55*100)/AB55 -> 100 | AD55: =(X55*4)+(Z55*2) -> 4
A57: BOX HILL | E57: =C57*6+D57 -> 0 | I57: =G57*6+H57 -> 0 | M57: =K57*6+L57 -> 0 | O57: 10 | P57: 15 | Q57: =O57*6+P57 -> 75 | S57: CAULFIELD | W57: DANDENONG | X57: 1 | Y57: 1 | Z57: 0 | AA57: 118 | AB57: 155 | AC57: =(AA57*100)/AB57 -> 76.129032258064512 | AD57: =(X57*4)+(Z57*2) -> 4
A58: BRIGHTON-CAULFIELD | E58: =C58*6+D58 -> 0 | I58: =G58*6+H58 -> 0 | M58: =K58*6+L58 -> 0 | O58: 8 | P58: 20 | Q58: =O58*6+P58 -> 68 | W58: PRAHRAN | X58: 0 | Y58: 2 | Z58: 0 | AA58: 163 | AB58: 172 | AC58: =(AA58*100)/AB58 -> 94.767441860465112 | AD58: =(X58*4)+(Z58*2) -> 0
A59: BEST PLAYERS | W59: BRIGHTON-CAULFIELD | X59: 0 | Y59: 2 | Z59: 0 | AA59: 110 | AB59: 139 | AC59: =(AA59*100)/AB59 -> 79.136690647482013 | AD59: =(X59*4)+(Z59*2) -> 0
A60: BOX HILL | C60: CURRY | F60: BEASY | I60: SALVADO | L60: BATES | O60: BRIGGS | Q60: WITTMER | W60: SUNSHINE | X60: 0 | Y60: 2 | Z60: 0 | AA60: 115 | AB60: 155 | AC60: =(AA60*100)/AB60 -> 74.193548387096769 | AD60: =(X60*4)+(Z60*2) -> 0
A61: BRIGHTON-CAULFIELD | C61: FOX | F61: HUNT | I61: SOUTHERN | L61: EVANS | O61: CLARKE | Q61: BEGLEY
A62: GOALKICKERS
A63: BOX HILL | C63: SALVADO 3 | F63: BEASY 2 | I63: BOYES 2 | L63: COLEMAN 2 | O63: PAVLIN
A64: BRIGHTON-CAULFIELD | C64: EVANS 2 | F64: CLARKE | I64: BARTY | K64: FOX | M64: HUNT | O64: R COOPER | R64: QUIRK
A66: WAVERLEY | E66: =C66*6+D66 -> 0 | I66: =G66*6+H66 -> 0 | M66: =K66*6+L66 -> 0 | O66: 12 | P66: 16 | Q66: =O66*6+P66 -> 88 | S66: SUNSHINE
A67: SUNSHINE | E67: =C67*6+D67 -> 0 | I67: =G67*6+H67 -> 0 | M67: =K67*6+L67 -> 0 | O67: 9 | P67: 10 | Q67: =O67*6+P67 -> 64
A68: BEST PLAYERS
A69: WAVERLEY | C69: BLACK | F69: FALCONER | I69: COLE | L69: McKINLEY | O69: NASH | R69: SCOTT
A70: SUNSHINE | C70: CROSBIE | F70: ROACH | I70: HOWARD | L70: SYMONS | O70: LE SEUER | R70: LEAVER
A71: GOALKICKERS
A72: WAVERLEY | C72: NASH 4 | E72: COLE 3 | G72: INNES 2 | I72: FALCONER | L72: SMITH | N72: WHITFIELD
A73: SUNSHINE | C73: M YEOMAN 3 | F73: HOWARD 2 | I73: STEWART 2 | L73: LEAVER 2
E74: 6TH MAY | I74: WEATHER
A75: CAMBERWELL | E75: =C75*6+D75 -> 0 | I75: =G75*6+H75 -> 0 | M75: =K75*6+L75 -> 0 | O75: 13 | P75: 16 | Q75: =O75*6+P75 -> 94 | S75: TOORAK PARK
A76: PRAHRAN | E76: =C76*6+D76 -> 0 | I76: =G76*6+H76 -> 0 | M76: =K76*6+L76 -> 0 | O76: 13 | P76: 12 | Q76: =O76*6+P76 -> 90
A77: BEST PLAYERS
A78: CAMBERWELL | C78: ELLIS | F78: WHITTEN | I78: DOUGLAS | L78: COLLETT | O78: YOUNG
A79: PRAHRAN | C79: BOSCH | F79: LAMBERT | I79: McMAHON | L79: HAYES | O79: GRAY | Q79: BUTLER
A80: GOALKICKERS
A81: CAMBERWELL | C81: O'NEILL 5 | F81: COLLETT 2 | I81: GAUDION | L81: REYNOLDS | N81: WHITTEN | Q81: JONES | S81: QUIRK | V81: RICHARDS
A82: PRAHRAN | C82: KERLEY 4 | F82: BOSCH 3 | I82: RYAN 2 | K82: YOUNG | M82: WILSON | O82: GRAY
A84: ROUND 3 | E84: 12TH MAY | I84: WEATHER
D85: 1ST QTR | H85: 2ND QTR | L85: 3RD QTR | P85: FINAL
A86: PRESTON | E86: =C86*6+D86 -> 0 | I86: =G86*6+H86 -> 0 | M86: =K86*6+L86 -> 0 | O86: 17 | P86: 22 | Q86: =O86*6+P86 -> 124 | S86: WAVERLEY | X86: LADDER | AB86: ROUND | AD86: 3
A87: WAVERLEY | E87: =C87*6+D87 -> 0 | I87: =G87*6+H87 -> 0 | M87: =K87*6+L87 -> 0 | O87: 15 | P87: 11 | Q87: =O87*6+P87 -> 101
A88: BEST PLAYERS | W88: TEAM | X88: W | Y88: L | Z88: D | AA88: FOR | AB88: AGST | AC88: % | AD88: PTS
A89: PRESTON | C89: LAMBIE | F89: MUIR | I89: PINFOLD | L89: HANCOCK | O89: THORPE | Q89: MURPHY
A90: WAVERLEY | C90: COLE | F90: SCOTT | I90: SMITH | L90: McKINLEY | O90: EVANS | Q90: PECK | W90: PRESTON | X90: 3 | Y90: 0 | Z90: 0 | AA90: 302 | AB90: 233 | AC90: =(AA90*100)/AB90 -> 129.61373390557941 | AD90: =(X90*4)+(Z90*2) -> 12
A91: GOALKICKERS | C91: 4 SHORT | W91: CAMBERWELL | X91: 2 | Y91: 1 | Z91: 0 | AA91: 249 | AB91: 210 | AC91: =(AA91*100)/AB91 -> 118.57142857142857 | AD91: =(X91*4)+(Z91*2) -> 8
A92: PRESTON | C92: GRANT 3 | E92: WATSON 3 | H92: LAMBIE 3 | J92: MURNANE 2 | M92: HANCOCK | P92: MURPHY | W92: DANDENONG | X92: 2 | Y92: 1 | Z92: 0 | AA92: 261 | AB92: 223 | AC92: =(AA92*100)/AB92 -> 117.04035874439462 | AD92: =(X92*4)+(Z92*2) -> 8
A93: WAVERLEY | C93: COLE 5 | E93: McKINLEY 3 | H93: NASH 2 | J93: SMITH 2 | M93: WHITFIELD | P93: CLANCY | W93: WAVERLEY | X93: 2 | Y93: 1 | Z93: 0 | AA93: 253 | AB93: 230 | AC93: =(AA93*100)/AB93 -> 110 | AD93: =(X93*4)+(Z93*2) -> 8
A95: PRAHRAN | E95: =C95*6+D95 -> 0 | I95: =G95*6+H95 -> 0 | M95: =K95*6+L95 -> 0 | O95: 13 | P95: 16 | Q95: =O95*6+P95 -> 94 | S95: CAULFIELD | W95: BOX HILL | X95: 2 | Y95: 1 | Z95: 0 | AA95: 203 | AB95: 219 | AC95: =(AA95*100)/AB95 -> 92.694063926940643 | AD95: =(X95*4)+(Z95*2) -> 8
A96: BRIGHTON-CAULFIELD | E96: =C96*6+D96 -> 0 | I96: =G96*6+H96 -> 0 | M96: =K96*6+L96 -> 0 | O96: 11 | P96: 16 | Q96: =O96*6+P96 -> 82 | W96: PRAHRAN | X96: 1 | Y96: 2 | Z96: 0 | AA96: 257 | AB96: 254 | AC96: =(AA96*100)/AB96 -> 101.18110236220473 | AD96: =(X96*4)+(Z96*2) -> 4
A97: BEST PLAYERS | W97: BRIGHTON-CAULFIELD | X97: 0 | Y97: 3 | Z97: 0 | AA97: 192 | AB97: 233 | AC97: =(AA97*100)/AB97 -> 82.403433476394852 | AD97: =(X97*4)+(Z97*2) -> 0
A98: PRAHRAN | C98: MCMAHON | F98: BOSCH | I98: BUTLER | L98: WILSON | O98: RICHARDS | R98: DYER | W98: SUNSHINE | X98: 0 | Y98: 3 | Z98: 0 | AA98: 183 | AB98: 298 | AC98: =(AA98*100)/AB98 -> 61.409395973154361 | AD98: =(X98*4)+(Z98*2) -> 0
A99: BRIGHTON-CAULFIELD | C99: TIERNEY | F99: BARTY | I99: JAMIESON | L99: ASHENHURST | O99: GRANT | R99: T MOULE
A100: GOALKICKERS
A101: PRAHRAN | C101: WILSON 4 | F101: BOSCH 3 | I101: BUTLER 3 | K101: DYER | M101: WISHART | P101: KERLEY
A102: BRIGHTON-CAULFIELD | C102: TIERNEY 4 | F102: JAMIESON 2 | I102: CLARKE | K102: BARTY | M102: GRANT | O102: PALMER | Q102: BEGLEY
A104: CAMBERWELL | E104: =C104*6+D104 -> 0 | I104: =G104*6+H104 -> 0 | M104: =K104*6+L104 -> 0 | O104: 14 | P104: 16 | Q104: =O104*6+P104 -> 100 | S104: BOX HILL
A105: BOX HILL | E105: =C105*6+D105 -> 0 | I105: =G105*6+H105 -> 0 | M105: =K105*6+L105 -> 0 | O105: 8 | P105: 13 | Q105: =O105*6+P105 -> 61
A106: BEST PLAYERS
A107: CAMBERWELL | C107: O'NEILL | F107: WHITTEN | I107: ELLIS | L107: COLLETT | O107: YOUNG | Q107: SKALBERG
A108: BOX HILL | C108: BATES | F108: MACE | I108: BEASY | L108: BAYES | O108: ROCHOW | Q108: BARNES
A109: GOALKICKERS
A110: CAMBERWELL | C110: O'NEILL 5 | F110: ELLIS 3 | H110: COLLETT 2 | K110: REYNOLDS 2 | N110: LONDON | P110: GAUDION
A111: BOX HILL | C111: SALVADO 2 | F111: MACE 2 | H111: BATES 2 | J111: BAYES | L111: BEASY
A113: DANDENONG | E113: =C113*6+D113 -> 0 | I113: =G113*6+H113 -> 0 | M113: =K113*6+L113 -> 0 | O113: 21 | P113: 17 | Q113: =O113*6+P113 -> 143 | S113: SUNSHINE
A114: SUNSHINE | E114: =C114*6+D114 -> 0 | I114: =G114*6+H114 -> 0 | M114: =K114*6+L114 -> 0 | O114: 9 | P114: 14 | Q114: =O114*6+P114 -> 68
A115: BEST PLAYERS
A116: DANDENONG | C116: B WATERS | F116: PENNEFATHER | I116: DELANTY | L116: BARRAN | O116: WRIGHT | Q116: DINEEN
A117: SUNSHINE | C117: R YEOMAN | F117: M YEOMAN | I117: CROSBIE | L117: P FITZGERALD | O117: HOLMES | Q117: N KEMP
A118: GOALKICKERS
A119: DANDENONG | C119: WRIGHT 6 | F119: BARRAN 3 | I119: T WATERS 3 | L119: PETERS 3 | N119: SHELTON 2 | Q119: DINEEN 2 | S119: DELANTY | V119: HOBBS
A120: SUNSHINE | C120: N KEMP 3 | F120: CROSBIE 2 | I120: R YEOMAN | L120: M YEOMAN | O120: LEAVER | Q120: HOLNESS
A122: ROUND 4 | E122: 19TH MAY | I122: WEATHER
D123: 1ST QTR | H123: 2ND QTR | L123: 3RD QTR | P123: FINAL
A124: DANDENONG | E124: =C124*6+D124 -> 0 | I124: =G124*6+H124 -> 0 | M124: =K124*6+L124 -> 0 | O124: 16 | P124: 16 | Q124: =O124*6+P124 -> 112 | S124: DANDENONG | X124: LADDER | AB124: ROUND | AD124: 4
A125: BOX HILL | E125: =C125*6+D125 -> 0 | I125: =G125*6+H125 -> 0 | M125: =K125*6+L125 -> 0 | O125: 9 | P125: 7 | Q125: =O125*6+P125 -> 61
A126: BEST PLAYERS | W126: TEAM | X126: W | Y126: L | Z126: D | AA126: FOR | AB126: AGST | AC126: % | AD126: PTS
A127: DANDENONG | C127: DINEEN | F127: DELANTY | I127: WRIGHT | L127: B WATERS | O127: GILLINGHAM | R127: ABRAHAM
A128: BOX HILL | C128: BEASY | F128: BARNES | I128: BAYES | L128: CRAIG | O128: COLEMAN | R128: ROCHOW | W128: PRESTON | X128: 4 | Y128: 0 | Z128: 0 | AA128: 498 | AB128: 252 | AC128: =(AA128*100)/AB128 -> 197.61904761904762 | AD128: =(X128*4)+(Z128*2) -> 16
A129: GOALKICKERS | W129: CAMBERWELL | X129: 3 | Y129: 1 | Z129: 0 | AA129: 424 | AB129: 316 | AC129: =(AA129*100)/AB129 -> 134.17721518987341 | AD129: =(X129*4)+(Z129*2) -> 12
A130: DANDENONG | C130: WRIGHT 6 | F130: DINEEN 4 | I130: BARRAN 3 | L130: SHINNERS | O130: BELL | Q130: DELANTY | W130: DANDENONG | X130: 3 | Y130: 1 | Z130: 0 | AA130: 373 | AB130: 284 | AC130: =(AA130*100)/AB130 -> 131.33802816901408 | AD130: =(X130*4)+(Z130*2) -> 12
A131: BOX HILL | C131: BARNES 4 | F131: CHAMBERLAIN 2 | J131: CARROLL | M131: BAYES | O131: CRAIG | W131: PRAHRAN | X131: 2 | Y131: 2 | Z131: 0 | AA131: 400 | AB131: 362 | AC131: =(AA131*100)/AB131 -> 110.49723756906077 | AD131: =(X131*4)+(Z131*2) -> 8
W132: WAVERLEY | X132: 2 | Y132: 2 | Z132: 0 | AA132: 361 | AB132: 373 | AC132: =(AA132*100)/AB132 -> 96.782841823056302 | AD132: =(X132*4)+(Z132*2) -> 8
A133: CAMBERWELL | E133: =C133*6+D133 -> 0 | I133: =G133*6+H133 -> 0 | M133: =K133*6+L133 -> 0 | O133: 26 | P133: 19 | Q133: =O133*6+P133 -> 175 | S133: CAMBERWELL | W133: BOX HILL | X133: 2 | Y133: 2 | Z133: 0 | AA133: 264 | AB133: 331 | AC133: =(AA133*100)/AB133 -> 79.758308157099691 | AD133: =(X133*4)+(Z133*2) -> 8
A134: SUNSHINE | E134: =C134*6+D134 -> 0 | I134: =G134*6+H134 -> 0 | M134: =K134*6+L134 -> 0 | O134: 15 | P134: 16 | Q134: =O134*6+P134 -> 106 | W134: SUNSHINE | X134: 0 | Y134: 4 | Z134: 0 | AA134: 289 | AB134: 473 | AC134: =(AA134*100)/AB134 -> 61.099365750528541 | AD134: =(X134*4)+(Z134*2) -> 0
A135: BEST PLAYERS | W135: BRIGHTON-CAULFIELD | X135: 0 | Y135: 4 | Z135: 0 | AA135: 211 | AB135: 429 | AC135: =(AA135*100)/AB135 -> 49.184149184149184 | AD135: =(X135*4)+(Z135*2) -> 0
A136: CAMBERWELL | C136: ELLIS | F136: O'NEILL | I136: REYNOLDS | L136: WHITTEN | O136: SKALBERG | R136: YOUNG
A137: SUNSHINE | C137: HOWARD | F137: CROSBIE | I137: R YEOMAN | L137: M YEOMAN | O137: P FITZGERALD | R137: HOLNESS
A138: GOALKICKERS
A139: CAMBERWELL | C139: ELLIS 9 | E139: O'NEILL 7 | G139: REYNOLDS 3 | J139: COLLARD 2 | M139: GAUDION | O139: JONES | Q139: YOUNG | S139: BAILEY | V139: QUIRK
A140: SUNSHINE | C140: HOWARD 4 | F140: HOLNESS 3 | I140: M YEOMAN 2 | L140: DIXON 2 | N140: CHAMLEY 2 | Q140: STEVENS | T140: CROSBIE
A142: PRESTON | E142: =C142*6+D142 -> 0 | I142: =G142*6+H142 -> 0 | M142: =K142*6+L142 -> 0 | O142: 28 | P142: 28 | Q142: =O142*6+P142 -> 196 | S142: PRESTON
A143: BRIGHTON-CAULFIELD | E143: =C143*6+D143 -> 0 | I143: =G143*6+H143 -> 0 | M143: =K143*6+L143 -> 0 | O143: 2 | P143: 7 | Q143: =O143*6+P143 -> 19
A144: BEST PLAYERS
A145: PRESTON | C145: DIXON | F145: MURNANE | I145: HAYES | L145: LAMBIE | N145: ELSUM | Q145: THORPE
A146: BRIGHTON-CAULFIELD | C146: CLARKE | F146: R COOPER | I146: G KEENAN
A147: GOALKICKERS
A148: PRESTON | C148: DIXON 8 | E148: LAMBIE 4 | G148: MURNANE 4 | J148: GRANT 4 | L148: O'KEEFE 3 | N148: MURPHY 2 | Q148: POWELL 2 | T148: HANCOCK
A149: BRIGHTON-CAULFIELD | C149: R COOPER 2
E150: 20TH MAY | I150: WEATHER
A151: PRAHRAN | E151: =C151*6+D151 -> 0 | I151: =G151*6+H151 -> 0 | M151: =K151*6+L151 -> 0 | O151: 22 | P151: 11 | Q151: =O151*6+P151 -> 143 | S151: TOORAK PARK
A152: WAVERLEY | E152: =C152*6+D152 -> 0 | I152: =G152*6+H152 -> 0 | M152: =K152*6+L152 -> 0 | O152: 15 | P152: 18 | Q152: =O152*6+P152 -> 108
A153: BEST PLAYERS
A154: PRAHRAN | C154: ROACH | F154: LAMBERT | I154: BUTLER | L154: DYER | N154: CLOSE | Q154: RICHARDS
A155: WAVERLEY | C155: NASH | F155: NOLAN | I155: CLANCY | L155: LEE | N155: EVANS | Q155: GREENWOOD
A156: GOALKICKERS
A157: PRAHRAN | C157: ROACH 5 | E157: RYAN 4 | G157: KERLEY 3 | I157: GRAY 3 | K157: WATSON 3 | M157: MURRAY 2 | P157: BUTLER 2
A158: WAVERLEY | C158: NASH 4 | E158: SCOTT 4 | G158: WHITFIELD 2 | J158: LEE 2 | L158: CLANCY | N158: McKINLEY | Q158: SOUTAR
A160: ROUND 5 | E160: 26TH MAY | I160: WEATHER
D161: 1ST QTR | H161: 2ND QTR | L161: 3RD QTR | P161: FINAL
A162: DANDENONG | E162: =C162*6+D162 -> 0 | I162: =G162*6+H162 -> 0 | M162: =K162*6+L162 -> 0 | O162: 17 | P162: 11 | Q162: =O162*6+P162 -> 113 | S162: DANDENONG | X162: LADDER | AB162: ROUND | AD162: 5
A163: WAVERLEY | E163: =C163*6+D163 -> 0 | I163: =G163*6+H163 -> 0 | M163: =K163*6+L163 -> 0 | O163: 4 | P163: 10 | Q163: =O163*6+P163 -> 34
A164: BEST PLAYERS | W164: TEAM | X164: W | Y164: L | Z164: D | AA164: FOR | AB164: AGST | AC164: % | AD164: PTS
A165: DANDENONG | C165: OSBORNE | F165: DINEEN | I165: B WATERS | L165: PETERS
A166: WAVERLEY | C166: McKINLEY | F166: PECK | I166: EVANS | L166: GREENWOOD | W166: PRESTON | X166: 5 | Y166: 0 | Z166: 0 | AA166: 606 | AB166: 329 | AC166: =(AA166*100)/AB166 -> 184.19452887537994 | AD166: =(X166*4)+(Z166*2) -> 20
A167: GOALKICKERS | M167: DINEEN | P167: B WATERS | W167: DANDENONG | X167: 4 | Y167: 1 | Z167: 0 | AA167: 486 | AB167: 318 | AC167: =(AA167*100)/AB167 -> 152.83018867924528 | AD167: =(X167*4)+(Z167*2) -> 16
A168: DANDENONG | C168: OSBORNE 5 | F168: BARRAN 2 | I168: PETERS 2 | K168: T WATERS 2 | N168: WRIGHT 2 | P168: GILLINGHAM | S168: HAAR | W168: CAMBERWELL | X168: 3 | Y168: 2 | Z168: 0 | AA168: 501 | AB168: 424 | AC168: =(AA168*100)/AB168 -> 118.16037735849056 | AD168: =(X168*4)+(Z168*2) -> 12
A169: WAVERLEY | C169: McKINLEY | F169: NASH | I169: WHITFIELD | L169: 1 SHORT | W169: PRAHRAN | X169: 3 | Y169: 2 | Z169: 0 | AA169: 490 | AB169: 442 | AC169: =(AA169*100)/AB169 -> 110.85972850678733 | AD169: =(X169*4)+(Z169*2) -> 12
A171: SUNSHINE | E171: =C171*6+D171 -> 0 | I171: =G171*6+H171 -> 0 | M171: =K171*6+L171 -> 0 | O171: 15 | P171: 16 | Q171: =O171*6+P171 -> 106 | S171: CAULFIELD | W171: BOX HILL | X171: 2 | Y171: 3 | Z171: 0 | AA171: 344 | AB171: 421 | AC171: =(AA171*100)/AB171 -> 81.710213776722085 | AD171: =(X171*4)+(Z171*2) -> 8
A172: BRIGHTON-CAULFIELD | E172: =C172*6+D172 -> 0 | I172: =G172*6+H172 -> 0 | M172: =K172*6+L172 -> 0 | O172: 7 | P172: 22 | Q172: =O172*6+P172 -> 64 | W172: WAVERLEY | X172: 2 | Y172: 3 | Z172: 0 | AA172: 395 | AB172: 486 | AC172: =(AA172*100)/AB172 -> 81.275720164609055 | AD172: =(X172*4)+(Z172*2) -> 8
A173: BEST PLAYERS | W173: SUNSHINE | X173: 1 | Y173: 4 | Z173: 0 | AA173: 395 | AB173: 537 | AC173: =(AA173*100)/AB173 -> 73.556797020484169 | AD173: =(X173*4)+(Z173*2) -> 4
A174: SUNSHINE | C174: CROSBIE | F174: STEVENS | I174: M YEOMAN | L174: ROACH | N174: CHAMLEY | Q174: HOLNESS | W174: BRIGHTON-CAULFIELD | X174: 0 | Y174: 5 | Z174: 0 | AA174: 265 | AB174: 535 | AC174: =(AA174*100)/AB174 -> 49.532710280373834 | AD174: =(X174*4)+(Z174*2) -> 0
A175: BRIGHTON-CAULFIELD | C175: PALMER | F175: CLARKE | I175: EVANS | L175: PRATT | N175: G KEENAN | Q175: HANCE
A176: GOALKICKERS
A177: SUNSHINE | C177: HOLNESS 4 | F177: CROSBIE 3 | I177: M YEOMAN 2 | L177: DIXON 2 | N177: HOWARD | Q177: CHAMLEY | T177: STEVENS | W177: LEAVER
A178: BRIGHTON-CAULFIELD | C178: EVANS 3 | F178: BEGLEY | I178: CLARK | K178: HUNT | M178: PRATT
A180: PRAHRAN | E180: =C180*6+D180 -> 0 | I180: =G180*6+H180 -> 0 | M180: =K180*6+L180 -> 0 | O180: 13 | P180: 12 | Q180: =O180*6+P180 -> 90 | S180: TOORAK PARK
A181: BOX HILL | E181: =C181*6+D181 -> 0 | I181: =G181*6+H181 -> 0 | M181: =K181*6+L181 -> 0 | O181: 11 | P181: 14 | Q181: =O181*6+P181 -> 80
A182: BEST PLAYERS
A183: PRAHRAN | C183: BOSCH | F183: W GRAY | I183: DYER | L183: HAYES
A184: BOX HILL | C184: BAYES | F184: BEASY | I184: BARNES | L184: CARROLL
A185: GOALKICKERS
A186: PRAHRAN | C186: W GRAY 3 | E186: BOSCH 3 | G186: DYER 2 | I186: BUTLER | K186: WILSON | M186: RYAN | O186: KERLEY | Q186: WISHART
A187: BOX HILL | C187: CARROLL 4 | F187: CHAMBERLAIN | I187: BAYES | K187: BURDETT | M187: BERNER | O187: BATES | Q187: BEASY | S187: BARNES
E188: 27TH MAY | I188: WEATHER
A189: PRESTON | E189: =C189*6+D189 -> 0 | I189: =G189*6+H189 -> 0 | M189: =K189*6+L189 -> 0 | O189: 16 | P189: 12 | Q189: =O189*6+P189 -> 108 | S189: PRESTON
A190: CAMBERWELL | E190: =C190*6+D190 -> 0 | I190: =G190*6+H190 -> 0 | M190: =K190*6+L190 -> 0 | O190: 10 | P190: 17 | Q190: =O190*6+P190 -> 77
A191: BEST PLAYERS
A192: PRESTON | C192: MURPHY | F192: HANCOCK | I192: HAYES | L192: LAMBIE | O192: LANGLEY | R192: O'KEEFE
A193: CAMBERWELL | C193: THOMPSON | F193: COLLARD | I193: WHITTEN
A194: GOALKICKERS
A195: PRESTON | C195: DIXON 4 | F195: O'KEEFE 2 | I195: LANGLEY 2 | L195: MURPHY 2 | N195: ELSUM 2 | P195: MUIR | R195: LAMBIE | T195: HANCOCK | W195: POWELL
A196: CAMBERWELL | C196: O'NEILL 5 | F196: QUIRK 3 | I196: ELLIS | K196: COLLETT
A198: ROUND 6 | E198: 2ND JUNE | I198: WEATHER
D199: 1ST QTR | H199: 2ND QTR | L199: 3RD QTR | P199: FINAL
A200: DANDENONG | E200: =C200*6+D200 -> 0 | I200: =G200*6+H200 -> 0 | M200: =K200*6+L200 -> 0 | O200: 17 | P200: 8 | Q200: =O200*6+P200 -> 110 | S200: DANDENONG | X200: LADDER | AB200: ROUND | AD200: 6
A201: BRIGHTON-CAULFIELD | E201: =C201*6+D201 -> 0 | I201: =G201*6+H201 -> 0 | M201: =K201*6+L201 -> 0 | O201: 2 | P201: 7 | Q201: =O201*6+P201 -> 19
A202: BEST PLAYERS | W202: TEAM | X202: W | Y202: L | Z202: D | AA202: FOR | AB202: AGST | AC202: % | AD202: PTS
A203: DANDENONG | C203: T WATERS | F203: ABRAHAM | I203: SHELTON | L203: DINEEN | O203: OSBORNE | R203: GILLINGHAM
A204: BRIGHTON-CAULFIELD | C204: T MOULE | F204: EVANS | I204: CLARKE | L204: A MOULE | O204: PALMER | R204: FOX | W204: DANDENONG | X204: 5 | Y204: 1 | Z204: 0 | AA204: 596 | AB204: 337 | AC204: =(AA204*100)/AB204 -> 176.85459940652819 | AD204: =(X204*4)+(Z204*2) -> 20
A205: GOALKICKERS | W205: PRESTON | X205: 5 | Y205: 1 | Z205: 0 | AA205: 662 | AB205: 390 | AC205: =(AA205*100)/AB205 -> 169.74358974358975 | AD205: =(X205*4)+(Z205*2) -> 20
A206: DANDENONG | C206: T WATERS 5 | F206: SHELTON 4 | I206: WRIGHT 3 | K206: DINEEN | M206: KILPATRICK | P206: OSBORNE | R206: BELL | T206: DELANTY | W206: CAMBERWELL | X206: 4 | Y206: 2 | Z206: 0 | AA206: 562 | AB206: 475 | AC206: =(AA206*100)/AB206 -> 118.31578947368421 | AD206: =(X206*4)+(Z206*2) -> 16
A207: BRIGHTON-CAULFIELD | C207: BEGLEY | E207: CLARKE | W207: PRAHRAN | X207: 4 | Y207: 2 | Z207: 0 | AA207: 566 | AB207: 508 | AC207: =(AA207*100)/AB207 -> 111.41732283464567 | AD207: =(X207*4)+(Z207*2) -> 16
A209: CAMBERWELL | E209: =C209*6+D209 -> 0 | I209: =G209*6+H209 -> 0 | M209: =K209*6+L209 -> 0 | O209: 8 | P209: 13 | Q209: =O209*6+P209 -> 61 | S209: CAMBERWELL | W209: BOX HILL | X209: 3 | Y209: 3 | Z209: 0 | AA209: 405 | AB209: 477 | AC209: =(AA209*100)/AB209 -> 84.905660377358487 | AD209: =(X209*4)+(Z209*2) -> 12
A210: WAVERLEY | E210: =C210*6+D210 -> 0 | I210: =G210*6+H210 -> 0 | M210: =K210*6+L210 -> 0 | O210: 7 | P210: 9 | Q210: =O210*6+P210 -> 51 | W210: WAVERLEY | X210: 2 | Y210: 4 | Z210: 0 | AA210: 446 | AB210: 547 | AC210: =(AA210*100)/AB210 -> 81.53564899451554 | AD210: =(X210*4)+(Z210*2) -> 8
A211: BEST PLAYERS | W211: SUNSHINE | X211: 1 | Y211: 5 | Z211: 0 | AA211: 461 | AB211: 613 | AC211: =(AA211*100)/AB211 -> 75.203915171288742 | AD211: =(X211*4)+(Z211*2) -> 4
A212: CAMBERWELL | C212: GIBSON | F212: BAILEY | I212: WHITTEN | L212: ELLIS | O212: O'NEILL | R212: REYNOLDS | W212: BRIGHTON-CAULFIELD | X212: 0 | Y212: 6 | Z212: 0 | AA212: 284 | AB212: 645 | AC212: =(AA212*100)/AB212 -> 44.031007751937985 | AD212: =(X212*4)+(Z212*2) -> 0
A213: WAVERLEY | C213: WILSON | F213: SMITH | I213: GREENWOOD | L213: COLE | O213: CLEEMAN | R213: FALCONER
A214: GOALKICKERS
A215: CAMBERWELL | C215: ELLIS 4 | F215: GIBSON 2 | I215: REYNOLDS | L215: O'NEILL
A216: WAVERLEY | C216: FALCONER 2 | F216: NASH 2 | I216: SMITH | K216: CLANCY | M216: MORTIMER
E217: 3RD JUNE | I217: WEATHER
A218: PRAHRAN | E218: =C218*6+D218 -> 0 | I218: =G218*6+H218 -> 0 | M218: =K218*6+L218 -> 0 | O218: 11 | P218: 10 | Q218: =O218*6+P218 -> 76 | S218: SUNSHINE
A219: SUNSHINE | E219: =C219*6+D219 -> 0 | I219: =G219*6+H219 -> 0 | M219: =K219*6+L219 -> 0 | O219: 9 | P219: 12 | Q219: =O219*6+P219 -> 66
A220: BEST PLAYERS
A221: PRAHRAN | C221: BUTLER | F221: LAMBERT | I221: CLOSE | L221: DUNCAN | O221: RICHARDS | R221: McMAHON
A222: SUNSHINE | C222: BROTCHIE | F222: STEVENS | I222: CHAMLEY | L222: ROACH | O222: I KEMP | R222: HOWARD
A223: GOALKICKERS
A224: PRAHRAN | C224: BUTLER 2 | E224: WILSON 2 | G224: DUNCAN 2 | J224: RICHARDS | M224: KERLEY | O224: YOUNG | Q224: RYAN | S224: MURRAY
A225: SUNSHINE | C225: STEVENS 3 | F225: YEOMAN 2 | I225: CHAMLEY 2 | L225: I KEMP | N225: DIXON
E226: 4TH JUNE | I226: WEATHER
A227: BOX HILL | E227: =C227*6+D227 -> 0 | I227: =G227*6+H227 -> 0 | M227: =K227*6+L227 -> 0 | O227: 8 | P227: 13 | Q227: =O227*6+P227 -> 61 | S227: BOX HILL
A228: PRESTON | E228: =C228*6+D228 -> 0 | I228: =G228*6+H228 -> 0 | M228: =K228*6+L228 -> 0 | O228: 8 | P228: 8 | Q228: =O228*6+P228 -> 56
A229: BEST PLAYERS
A230: BOX HILL | C230: BATCH | F230: BEASY | I230: CRAIG | L230: BAYES | O230: BARNES | Q230: BURDETT
A231: PRESTON | C231: SLATTERY | F231: MILLS | I231: LAMBIE | L231: MURPHY | O231: O'KEEFE
A232: GOALKICKERS
A233: BOX HILL | C233: BARNES 2 | F233: CARROLL 2 | I233: BURDETT 2 | L233: BEASY | N233: CRAIG
A234: PRESTON | C234: O'KEEFE 2 | F234: BOYLE 2 | I234: LAMBIE | L234: MURPHY | N234: MILLS | P234: WASLEY
A236: ROUND 7 | E236: 9TH JUNE | I236: WEATHER
D237: 1ST QTR | H237: 2ND QTR | L237: 3RD QTR | P237: FINAL
A238: WAVERLEY | E238: =C238*6+D238 -> 0 | I238: =G238*6+H238 -> 0 | M238: =K238*6+L238 -> 0 | O238: 6 | P238: 22 | Q238: =O238*6+P238 -> 58 | S238: WAVERLEY | X238: LADDER | AB238: ROUND | AD238: 7
A239: BOX HILL | E239: =C239*6+D239 -> 0 | I239: =G239*6+H239 -> 0 | M239: =K239*6+L239 -> 0 | O239: 5 | P239: 11 | Q239: =O239*6+P239 -> 41
A240: BEST PLAYERS | W240: TEAM | X240: W | Y240: L | Z240: D | AA240: FOR | AB240: AGST | AC240: % | AD240: PTS
A241: WAVERLEY | C241: WILSON | F241: CLEEMAN | I241: INNES | L241: McKINLEY
A242: BOX HILL | C242: BATES | F242: BATCH | I242: BAYES | L242: ROSS | W242: PRESTON | X242: 6 | Y242: 1 | Z242: 0 | AA242: 745 | AB242: 446 | AC242: =(AA242*100)/AB242 -> 167.04035874439461 | AD242: =(X242*4)+(Z242*2) -> 24
A243: GOALKICKERS | W243: DANDENONG | X243: 6 | Y243: 1 | Z243: 0 | AA243: 705 | AB243: 425 | AC243: =(AA243*100)/AB243 -> 165.88235294117646 | AD243: =(X243*4)+(Z243*2) -> 24
A244: WAVERLEY | C244: LEE 2 | E244: NASH | G244: WILSON | I244: MORTIMER | L244: McKINLEY | W244: CAMBERWELL | X244: 4 | Y244: 3 | Z244: 0 | AA244: 632 | AB244: 566 | AC244: =(AA244*100)/AB244 -> 111.66077738515901 | AD244: =(X244*4)+(Z244*2) -> 16
A245: BOX HILL | C245: BATES 2 | E245: CARROLL | G245: BERNER | I245: BAYES | W245: PRAHRAN | X245: 4 | Y245: 3 | Z245: 0 | AA245: 654 | AB245: 613 | AC245: =(AA245*100)/AB245 -> 106.6884176182708 | AD245: =(X245*4)+(Z245*2) -> 16
A247: BRIGHTON-CAULFIELD | E247: =C247*6+D247 -> 0 | I247: =G247*6+H247 -> 0 | M247: =K247*6+L247 -> 0 | O247: 14 | P247: 7 | Q247: =O247*6+P247 -> 91 | S247: CAULFIELD | W247: WAVERLEY | X247: 3 | Y247: 4 | Z247: 0 | AA247: 504 | AB247: 588 | AC247: =(AA247*100)/AB247 -> 85.714285714285708 | AD247: =(X247*4)+(Z247*2) -> 12
A248: CAMBERWELL | E248: =C248*6+D248 -> 0 | I248: =G248*6+H248 -> 0 | M248: =K248*6+L248 -> 0 | O248: 9 | P248: 16 | Q248: =O248*6+P248 -> 70 | W248: BOX HILL | X248: 3 | Y248: 4 | Z248: 0 | AA248: 446 | AB248: 535 | AC248: =(AA248*100)/AB248 -> 83.364485981308405 | AD248: =(X248*4)+(Z248*2) -> 12
A249: BEST PLAYERS | W249: SUNSHINE | X249: 1 | Y249: 6 | Z249: 0 | AA249: 517 | AB249: 696 | AC249: =(AA249*100)/AB249 -> 74.281609195402297 | AD249: =(X249*4)+(Z249*2) -> 4
A250: BRIGHTON-CAULFIELD | C250: CLARKE | F250: PALMER | I250: T MOULE | L250: SOUTHERN | O250: ASHENHURST | R250: NICHOLLS | W250: BRIGHTON-CAULFIELD | X250: 1 | Y250: 6 | Z250: 0 | AA250: 375 | AB250: 715 | AC250: =(AA250*100)/AB250 -> 52.447552447552447 | AD250: =(X250*4)+(Z250*2) -> 4
A251: CAMBERWELL | C251: WHITTEN | F251: J THOMPSON | I251: ELLIS | L251: O'NEILL | O251: HOBILL
A252: GOALKICKERS
A253: BRIGHTON-CAULFIELD | C253: CLARKE 5 | F253: PALMER 3 | I253: MAJOR 2 | K253: SOUTHERN | N253: EVANS | P253: R COOPER | R253: T MOULE
A254: CAMBERWELL | C254: O'NEILL 6 | F254: COLLETT | I254: ELLIS | K254: B JOHNSON
A256: PRESTON | E256: =C256*6+D256 -> 0 | I256: =G256*6+H256 -> 0 | M256: =K256*6+L256 -> 0 | O256: 11 | P256: 17 | Q256: =O256*6+P256 -> 83 | S256: SUNSHINE
A257: SUNSHINE | E257: =C257*6+D257 -> 0 | I257: =G257*6+H257 -> 0 | M257: =K257*6+L257 -> 0 | O257: 9 | P257: 2 | Q257: =O257*6+P257 -> 56
A258: BEST PLAYERS
A259: PRESTON | C259: SLATTERY | F259: LAMBIE | I259: THORPE | L259: HAYES | O259: GRANT | Q259: HANCOCK
A260: SUNSHINE | C260: YEOMAN | F260: BROTCHIE | I260: HOWARD | L260: CROSBIE | O260: I KEMP | Q260: STEWART
A261: GOALKICKERS
A262: PRESTON | C262: MURNANE 4 | F262: LAMBIE 4 | I262: GRANT | K262: LANGLEY | M262: O'KEEFE
A263: SUNSHINE | C263: HOWARD 3 | F263: CHAMLEY 2 | I263: YEOMAN | K263: HOLNESS | M263: DIXON | O263: N KEMP
E264: 10TH JUNE | I264: WEATHER
A265: DANDENONG | E265: =C265*6+D265 -> 0 | I265: =G265*6+H265 -> 0 | M265: =K265*6+L265 -> 0 | O265: 14 | P265: 21 | Q265: =O265*6+P265 -> 105 | S265: TOORAK PARK
A266: PRAHRAN | E266: =C266*6+D266 -> 0 | I266: =G266*6+H266 -> 0 | M266: =K266*6+L266 -> 0 | O266: 14 | P266: 4 | Q266: =O266*6+P266 -> 88
A267: BEST PLAYERS
A268: DANDENONG | C268: WRIGHT | F268: DINEEN | I268: DELANTY | L268: B WATERS | O268: T WATERS
A269: PRAHRAN | C269: BUTLER | F269: BURGESS | I269: ROY JONES | L269: BOSCH | O269: KERLEY | Q269: LAMBERT
A270: GOALKICKERS
A271: DANDENONG | C271: WRIGHT 7 | F271: T WATERS 2 | I271: SHELTON | K271: DELANTY | M271: DINEEN | O271: HAAR | Q271: PILCHER
A272: PRAHRAN | C272: BOSCH 4 | F272: BUTLER 3 | I272: CLOSE 2 | K272: KERLEY 2 | M272: McMAHON 2 | P272: WILSON
A274: ROUND 8 | E274: 16TH JUNE | I274: WEATHER
D275: 1ST QTR | H275: 2ND QTR | L275: 3RD QTR | P275: FINAL
A276: WAVERLEY | E276: =C276*6+D276 -> 0 | I276: =G276*6+H276 -> 0 | M276: =K276*6+L276 -> 0 | O276: 9 | P276: 20 | Q276: =O276*6+P276 -> 74 | S276: WAVERLEY | X276: LADDER | AB276: ROUND | AD276: 8
A277: BRIGHTON-CAULFIELD | E277: =C277*6+D277 -> 0 | I277: =G277*6+H277 -> 0 | M277: =K277*6+L277 -> 0 | O277: 7 | P277: 10 | Q277: =O277*6+P277 -> 52
A278: BEST PLAYERS | W278: TEAM | X278: W | Y278: L | Z278: D | AA278: FOR | AB278: AGST | AC278: % | AD278: PTS
A279: WAVERLEY | C279: NASH | F279: LEE | I279: SMITH | L279: FALCONER | O279: COLE | R279: INNES
A280: BRIGHTON-CAULFIELD | C280: CLARKE | F280: A MOULE | I280: R COOPER | L280: NICHOLLS | O280: W COOPER | R280: THOMAS | W280: DANDENONG | X280: 7 | Y280: 1 | Z280: 0 | AA280: 852 | AB280: 466 | AC280: =(AA280*100)/AB280 -> 182.83261802575106 | AD280: =(X280*4)+(Z280*2) -> 28
A281: GOALKICKERS | W281: PRESTON | X281: 7 | Y281: 1 | Z281: 0 | AA281: 807 | AB281: 482 | AC281: =(AA281*100)/AB281 -> 167.42738589211618 | AD281: =(X281*4)+(Z281*2) -> 28
A282: WAVERLEY | C282: NASH 3 | F282: FALCONER 2 | I282: SMITH | K282: COLE | M282: GREENWOOD | P282: INNES | W282: PRAHRAN | X282: 4 | Y282: 4 | Z282: 0 | AA282: 690 | AB282: 675 | AC282: =(AA282*100)/AB282 -> 102.22222222222223 | AD282: =(X282*4)+(Z282*2) -> 16
A283: BRIGHTON-CAULFIELD | C283: R COOPER 2 | F283: CLARKE 2 | I283: SOUTHERN | L283: W COOPER | N283: A MOULE | W283: CAMBERWELL | X283: 4 | Y283: 4 | Z283: 0 | AA283: 673 | AB283: 713 | AC283: =(AA283*100)/AB283 -> 94.389901823281903 | AD283: =(X283*4)+(Z283*2) -> 16
A285: DANDENONG | E285: =C285*6+D285 -> 0 | I285: =G285*6+H285 -> 0 | M285: =K285*6+L285 -> 0 | O285: 21 | P285: 21 | Q285: =O285*6+P285 -> 147 | S285: CAMBERWELL | W285: WAVERLEY | X285: 4 | Y285: 4 | Z285: 0 | AA285: 578 | AB285: 640 | AC285: =(AA285*100)/AB285 -> 90.3125 | AD285: =(X285*4)+(Z285*2) -> 16
A286: CAMBERWELL | E286: =C286*6+D286 -> 0 | I286: =G286*6+H286 -> 0 | M286: =K286*6+L286 -> 0 | O286: 5 | P286: 11 | Q286: =O286*6+P286 -> 41 | W286: BOX HILL | X286: 4 | Y286: 4 | Z286: 0 | AA286: 541 | AB286: 610 | AC286: =(AA286*100)/AB286 -> 88.688524590163937 | AD286: =(X286*4)+(Z286*2) -> 16
A287: BEST PLAYERS | W287: SUNSHINE | X287: 1 | Y287: 7 | Z287: 0 | AA287: 592 | AB287: 791 | AC287: =(AA287*100)/AB287 -> 74.841972187104929 | AD287: =(X287*4)+(Z287*2) -> 4
A288: DANDENONG | C288: OSBORNE | F288: WRIGHT | I288: B WATERS | L288: DINEEN | O288: SHELTON | R288: T WATERS | W288: BRIGHTON-CAULFIELD | X288: 1 | Y288: 7 | Z288: 0 | AA288: 427 | AB288: 789 | AC288: =(AA288*100)/AB288 -> 54.119138149556399 | AD288: =(X288*4)+(Z288*2) -> 4
A289: CAMBERWELL | C289: WHITTEN | F289: COLLARD | I289: YOUNG | L289: HOBILL | O289: K JOHNSON | R289: COLLETT
A290: GOALKICKERS
A291: DANDENONG | C291: OSBORNE 5 | E291: WRIGHT 4 | G291: T WATERS 3 | J291: WHELOW 2 | M291: SHELTON 2 | P291: B WATERS | R291: LITTLE | T291: DELANTY | W291: STAUNTON | X291: DINEEN
A292: CAMBERWELL | C292: WHITTEN 2 | F292: JONES | I292: COLLARD | K292: K JOHNSON
A294: BOX HILL | E294: =C294*6+D294 -> 0 | I294: =G294*6+H294 -> 0 | M294: =K294*6+L294 -> 0 | O294: 14 | P294: 11 | Q294: =O294*6+P294 -> 95 | S294: BOX HILL
A295: SUNSHINE | E295: =C295*6+D295 -> 0 | I295: =G295*6+H295 -> 0 | M295: =K295*6+L295 -> 0 | O295: 11 | P295: 9 | Q295: =O295*6+P295 -> 75
A296: BEST PLAYERS
A297: BOX HILL | C297: BARNES | F297: BATES | I297: CRAIG | L297: WHITE | O297: CURRY | R297: BURDETT
A298: SUNSHINE | C298: YEOMAN | F298: TREZISE | I298: CROSBIE | L298: STEWART | O298: HOWARD | R298: DIXON
A299: GOALKICKERS
A300: BOX HILL | C300: BARNES 5 | F300: BAYES 3 | I300: BATES 2 | K300: CARROLL 2 | N300: CURRY 2
A301: SUNSHINE | C301: YEOMAN 3 | F301: HOWARD 3 | I301: STAFFORD | L301: STEWART | N301: TIPPING | P301: N KEMP | R301: STEPHENS
E302: 17TH JUNE | I302: WEATHER
A303: PRESTON | E303: =C303*6+D303 -> 0 | I303: =G303*6+H303 -> 0 | M303: =K303*6+L303 -> 0 | O303: 8 | P303: 14 | Q303: =O303*6+P303 -> 62 | S303: PRESTON
A304: PRAHRAN | E304: =C304*6+D304 -> 0 | I304: =G304*6+H304 -> 0 | M304: =K304*6+L304 -> 0 | O304: 4 | P304: 12 | Q304: =O304*6+P304 -> 36
A305: BEST PLAYERS
A306: PRESTON | C306: THORPE | F306: PINFOLD | I306: HAYES | L306: SLATTERY | O306: GRANT | R306: MURPHY
A307: PRAHRAN | C307: JONES | F307: LAMBERT | I307: HAYES | L307: BUTLER | O307: RICHARDS | R307: McMAHON
A308: GOALKICKERS
A309: PRESTON | C309: DOUGHTY 3 | F309: O'KEEFE | I309: MURNANE | L309: LANGLEY | N309: STEWART | Q309: LAMBIE
A310: PRAHRAN | C310: HAYES | F310: BUTLER | I310: DYER | L310: BOSCH
A312: ROUND 9 | E312: 23RD JUNE | I312: WEATHER
D313: 1ST QTR | H313: 2ND QTR | L313: 3RD QTR | P313: FINAL
A314: PRESTON | E314: =C314*6+D314 -> 0 | I314: =G314*6+H314 -> 0 | M314: =K314*6+L314 -> 0 | O314: 12 | P314: 7 | Q314: =O314*6+P314 -> 79 | S314: DANDENONG | X314: LADDER | AB314: ROUND | AD314: 9
A315: DANDENONG | E315: =C315*6+D315 -> 0 | I315: =G315*6+H315 -> 0 | M315: =K315*6+L315 -> 0 | O315: 11 | P315: 7 | Q315: =O315*6+P315 -> 73
A316: BEST PLAYERS | W316: TEAM | X316: W | Y316: L | Z316: D | AA316: FOR | AB316: AGST | AC316: % | AD316: PTS
A317: PRESTON | C317: THORPE | F317: PINFOLD | I317: SLATTERY | L317: MURPHY | O317: O'KEEFE | Q317: HANCOCK
A318: DANDENONG | C318: LITTLE | F318: PENNEFATHER | I318: DINEEN | L318: ABRAHAM | O318: BELL | Q318: B WATERS | W318: PRESTON | X318: 8 | Y318: 1 | Z318: 0 | AA318: 886 | AB318: 555 | AC318: =(AA318*100)/AB318 -> 159.63963963963963 | AD318: =(X318*4)+(Z318*2) -> 32
A319: GOALKICKERS | W319: DANDENONG | X319: 7 | Y319: 2 | Z319: 0 | AA319: 925 | AB319: 545 | AC319: =(AA319*100)/AB319 -> 169.72477064220183 | AD319: =(X319*4)+(Z319*2) -> 28
A320: PRESTON | C320: MUIR 3 | F320: MURPHY 2 | I320: MURNANE 2 | L320: DOUGHTY 2 | O320: O'KEEFE | Q320: HANCOCK | S320: LAMBERT | W320: WAVERLEY | X320: 5 | Y320: 4 | Z320: 0 | AA320: 704 | AB320: 724 | AC320: =(AA320*100)/AB320 -> 97.237569060773481 | AD320: =(X320*4)+(Z320*2) -> 20
A321: DANDENONG | C321: T WATERS 5 | F321: WRIGHT 2 | I321: DINEEN | K321: SHELTON | M321: HAAR | O321: B WATERS | W321: CAMBERWELL | X321: 5 | Y321: 4 | Z321: 0 | AA321: 756 | AB321: 787 | AC321: =(AA321*100)/AB321 -> 96.060991105463785 | AD321: =(X321*4)+(Z321*2) -> 20
A323: BOX HILL | E323: =C323*6+D323 -> 0 | I323: =G323*6+H323 -> 0 | M323: =K323*6+L323 -> 0 | O323: 17 | P323: 12 | Q323: =O323*6+P323 -> 114 | S323: CAULFIELD | W323: BOX HILL | X323: 5 | Y323: 4 | Z323: 0 | AA323: 655 | AB323: 718 | AC323: =(AA323*100)/AB323 -> 91.225626740947078 | AD323: =(X323*4)+(Z323*2) -> 20
A324: BRIGHTON-CAULFIELD | E324: =C324*6+D324 -> 0 | I324: =G324*6+H324 -> 0 | M324: =K324*6+L324 -> 0 | O324: 16 | P324: 12 | Q324: =O324*6+P324 -> 108 | W324: PRAHRAN | X324: 4 | Y324: 5 | Z324: 0 | AA324: 764 | AB324: 758 | AC324: =(AA324*100)/AB324 -> 100.79155672823219 | AD324: =(X324*4)+(Z324*2) -> 16
A325: BEST PLAYERS | W325: SUNSHINE | X325: 1 | Y325: 8 | Z325: 0 | AA325: 676 | AB325: 917 | AC325: =(AA325*100)/AB325 -> 73.718647764449287 | AD325: =(X325*4)+(Z325*2) -> 4
A326: BOX HILL | C326: WHITE | F326: BATES | I326: BERNER | L326: BEASY | O326: CARROLL | R326: HEATLEY | W326: BRIGHTON-CAULFIELD | X326: 1 | Y326: 8 | Z326: 0 | AA326: 535 | AB326: 903 | AC326: =(AA326*100)/AB326 -> 59.246954595791806 | AD326: =(X326*4)+(Z326*2) -> 4
A327: BRIGHTON-CAULFIELD | C327: PALMER | F327: FOX | I327: HUNT | L327: W COOPER | O327: T MOULE | R327: ASHENHURST
A328: GOALKICKERS
A329: BOX HILL | C329: CARROLL 4 | E329: BARNES 3 | G329: SHORT 3 | I329: BERNER 2 | K329: BAYES | M329: BATES | O329: BEASY | Q329: REID | S329: CURRY
A330: BRIGHTON-CAULFIELD | C330: A MOULE 3 | E330: SOUTHERN 2 | H330: G KEENAN 2 | K330: HUNT 2 | M330: T MOULE 2 | P330: MAJOR | R330: EVANS | T330: PALMER | W330: COOK | X330: R COOPER
A332: CAMBERWELL | E332: =C332*6+D332 -> 0 | I332: =G332*6+H332 -> 0 | M332: =K332*6+L332 -> 0 | O332: 12 | P332: 11 | Q332: =O332*6+P332 -> 83 | S332: TOORAK PARK
A333: PRAHRAN | E333: =C333*6+D333 -> 0 | I333: =G333*6+H333 -> 0 | M333: =K333*6+L333 -> 0 | O333: 11 | P333: 8 | Q333: =O333*6+P333 -> 74
A334: BEST PLAYERS
A335: CAMBERWELL | C335: COLLETT | F335: WHITTEN | I335: SKALBERG | L335: GAUDION | O335: GIBSON | R335: B JOHNSON
A336: PRAHRAN | C336: BUTLER | F336: WISHART | I336: CRIPPS | L336: BOSCH | O336: McMAHON | R336: LAMBERT
A337: GOALKICKERS
A338: CAMBERWELL | C338: COLLETT 4 | F338: KILPATRICK 3 | I338: HAYES 2 | K338: REYNOLDS | M338: ELLIS | O338: GAUDION
A339: PRAHRAN | C339: BUTLER 4 | F339: BOSCH 2 | I339: WISHART 2 | L339: McMAHON | O339: RYAN | Q339: DUNCAN
A341: WAVERLEY | E341: =C341*6+D341 -> 0 | I341: =G341*6+H341 -> 0 | M341: =K341*6+L341 -> 0 | O341: 18 | P341: 18 | Q341: =O341*6+P341 -> 126 | S341: SUNSHINE
A342: SUNSHINE | E342: =C342*6+D342 -> 0 | I342: =G342*6+H342 -> 0 | M342: =K342*6+L342 -> 0 | O342: 11 | P342: 18 | Q342: =O342*6+P342 -> 84
A343: BEST PLAYERS
A344: WAVERLEY | C344: BLACK | F344: MITHEN | I344: INNES | L344: SMITH | O344: SOUTAR | R344: NASH
A345: SUNSHINE | C345: R YEOMAN | F345: BROTCHIE | I345: CROSBIE | L345: STEPHENS | O345: HOWARD | R345: STAFFORD
A346: GOALKICKERS
A347: WAVERLEY | C347: NASH 6 | E347: SMITH 3 | G347: LEE 3 | I347: PETZKE 2 | K347: MITHEN | M347: INNES | O347: McKINLEY | R347: WHITFIELD
A348: SUNSHINE | C348: CROSBIE 3 | F348: R YEOMAN 2 | I348: HOWARD 2 | L348: CHAMLEY 2 | O348: STEPHENS | R348: STEWART
A350: ROUND 10 | E350: 30TH JUNE | I350: WEATHER
D351: 1ST QTR | H351: 2ND QTR | L351: 3RD QTR | P351: FINAL
A352: DANDENONG | E352: =C352*6+D352 -> 0 | I352: =G352*6+H352 -> 0 | M352: =K352*6+L352 -> 0 | O352: 10 | P352: 16 | Q352: =O352*6+P352 -> 76 | S352: DANDENONG | X352: LADDER | AB352: ROUND | AD352: 10
A353: SUNSHINE | E353: =C353*6+D353 -> 0 | I353: =G353*6+H353 -> 0 | M353: =K353*6+L353 -> 0 | O353: 9 | P353: 12 | Q353: =O353*6+P353 -> 66
A354: BEST PLAYERS | W354: TEAM | X354: W | Y354: L | Z354: D | AA354: FOR | AB354: AGST | AC354: % | AD354: PTS
A355: DANDENONG | C355: T WATERS | F355: ABRAHAM | I355: SHELTON | L355: DELANTY | O355: OSBORNE | R355: WRIGHT
A356: SUNSHINE | C356: TREZISE | F356: STEWART | I356: CROSBIE | L356: STEPHENS | O356: ROACH | W356: PRESTON | X356: 9 | Y356: 1 | Z356: 0 | AA356: 991 | AB356: 620 | AC356: =(AA356*100)/AB356 -> 159.83870967741936 | AD356: =(X356*4)+(Z356*2) -> 36
A357: GOALKICKERS | W357: DANDENONG | X357: 8 | Y357: 2 | Z357: 0 | AA357: 1001 | AB357: 611 | AC357: =(AA357*100)/AB357 -> 163.82978723404256 | AD357: =(X357*4)+(Z357*2) -> 32
A358: DANDENONG | C358: SHELTON 2 | F358: WRIGHT 2 | I358: PETERS 2 | K358: T WATERS | N358: DELANTY | Q358: SHINNERS | S358: BELL | W358: BOX HILL | X358: 6 | Y358: 4 | Z358: 0 | AA358: 762 | AB358: 790 | AC358: =(AA358*100)/AB358 -> 96.455696202531641 | AD358: =(X358*4)+(Z358*2) -> 24
A359: SUNSHINE | C359: HOWARD 4 | F359: STEPHENS 2 | I359: YEOMAN | K359: P FITZGERALD | N359: CROSBIE | W359: PRAHRAN | X359: 5 | Y359: 5 | Z359: 0 | AA359: 876 | AB359: 812 | AC359: =(AA359*100)/AB359 -> 107.88177339901478 | AD359: =(X359*4)+(Z359*2) -> 20
A361: BOX HILL | E361: =C361*6+D361 -> 0 | I361: =G361*6+H361 -> 0 | M361: =K361*6+L361 -> 0 | O361: 15 | P361: 17 | Q361: =O361*6+P361 -> 107 | S361: CAMBERWELL | W361: WAVERLEY | X361: 5 | Y361: 5 | Z361: 0 | AA361: 771 | AB361: 829 | AC361: =(AA361*100)/AB361 -> 93.003618817852839 | AD361: =(X361*4)+(Z361*2) -> 20
A362: CAMBERWELL | E362: =C362*6+D362 -> 0 | I362: =G362*6+H362 -> 0 | M362: =K362*6+L362 -> 0 | O362: 9 | P362: 18 | Q362: =O362*6+P362 -> 72 | W362: CAMBERWELL | X362: 5 | Y362: 5 | Z362: 0 | AA362: 828 | AB362: 894 | AC362: =(AA362*100)/AB362 -> 92.617449664429529 | AD362: =(X362*4)+(Z362*2) -> 20
A363: BEST PLAYERS | W363: SUNSHINE | X363: 1 | Y363: 9 | Z363: 0 | AA363: 742 | AB363: 993 | AC363: =(AA363*100)/AB363 -> 74.723061430010077 | AD363: =(X363*4)+(Z363*2) -> 4
A364: BOX HILL | C364: BEASY | F364: BAYES | I364: BATES | L364: CARROLL | O364: HEATLEY | R364: BERNER | W364: BRIGHTON-CAULFIELD | X364: 1 | Y364: 9 | Z364: 0 | AA364: 589 | AB364: 1015 | AC364: =(AA364*100)/AB364 -> 58.029556650246306 | AD364: =(X364*4)+(Z364*2) -> 4
A365: CAMBERWELL | C365: COLLARD | F365: ELLIS | I365: COLLETT | L365: WHITTEN | O365: SKALBERG
A366: GOALKICKERS
A367: BOX HILL | C367: BEASY 3 | E367: CARROLL 3 | H367: BATES 2 | J367: SHORT 2 | L367: BAYES | N367: BURDETT | Q367: BARNES | S367: BERNER | V367: WHITE
A368: CAMBERWELL | C368: COLLARD 4 | F368: ELLIS 2 | H368: KILPATRICK | K368: COLLETT | M368: THOMPSON
A370: PRAHRAN | E370: =C370*6+D370 -> 0 | I370: =G370*6+H370 -> 0 | M370: =K370*6+L370 -> 0 | O370: 16 | P370: 16 | Q370: =O370*6+P370 -> 112 | S370: TOORAK PARK
A371: BRIGHTON-CAULFIELD | E371: =C371*6+D371 -> 0 | I371: =G371*6+H371 -> 0 | M371: =K371*6+L371 -> 0 | O371: 8 | P371: 6 | Q371: =O371*6+P371 -> 54
A372: BEST PLAYERS
A373: PRAHRAN | C373: LAMBERT | F373: PEARSON | I373: RICHARDS | L373: KERLEY | O373: MURPHY | R373: BOSCH
A374: BRIGHTON-CAULFIELD | C374: ASHENHURST | F374: A MOULE | I374: CLARKE | L374: EVANS | O374: PALMER
A375: GOALKICKERS
A376: PRAHRAN | C376: PEARSON 7 | F376: WILSON 2 | I376: KERLEY 2 | K376: DUNCAN 2 | M376: MCMAHON | P376: RICHARDS | R376: BUTLER
A377: BRIGHTON-CAULFIELD | C377: A MOULE 3 | F377: ASHENHURST | I377: R COOPER | L377: PALMER | N377: EVANS | P377: T MOULE
E378: 1ST JULY | I378: WEATHER
A379: PRESTON | E379: =C379*6+D379 -> 0 | I379: =G379*6+H379 -> 0 | M379: =K379*6+L379 -> 0 | O379: 15 | P379: 15 | Q379: =O379*6+P379 -> 105 | S379: PRESTON
A380: WAVERLEY | E380: =C380*6+D380 -> 0 | I380: =G380*6+H380 -> 0 | M380: =K380*6+L380 -> 0 | O380: 9 | P380: 11 | Q380: =O380*6+P380 -> 65
A381: BEST PLAYERS
A382: PRESTON | C382: POWELL | F382: LAMBIE | I382: THORPE | L382: MURPHY | O382: HANCOCK | R382: O'KEEFE
A383: WAVERLEY | C383: McKINLEY | F383: MITHEN | I383: LEE | L383: FALCONER | O383: PECK | R383: BRENCHLEY
A384: GOALKICKERS
A385: PRESTON | C385: LAMBIE 4 | F385: ZORZI 3 | I385: MURPHY 3 | L385: O'KEEFE 2 | N385: POWELL 2 | Q385: MUIR
A386: WAVERLEY | C386: McKINLEY 3 | F386: BRENCHLEY 2 | I386: SMITH | K386: NASH | M386: GREENWOOD | P386: COLE
A388: ROUND 11 | E388: 7TH JULY | I388: WEATHER
D389: 1ST QTR | H389: 2ND QTR | L389: 3RD QTR | P389: FINAL
A390: WAVERLEY | E390: =C390*6+D390 -> 0 | I390: =G390*6+H390 -> 0 | M390: =K390*6+L390 -> 0 | O390: 9 | P390: 15 | Q390: =O390*6+P390 -> 69 | S390: WAVERLEY | X390: LADDER | AB390: ROUND | AD390: 11
A391: PRAHRAN | E391: =C391*6+D391 -> 0 | I391: =G391*6+H391 -> 0 | M391: =K391*6+L391 -> 0 | O391: 9 | P391: 11 | Q391: =O391*6+P391 -> 65
A392: BEST PLAYERS | W392: TEAM | X392: W | Y392: L | Z392: D | AA392: FOR | AB392: AGST | AC392: % | AD392: PTS
A393: WAVERLEY | C393: SMITH | F393: BRENCHLEY | I393: LEE | K393: WILSON | N393: FALCONER | Q393: MITHEN
A394: PRAHRAN | C394: BURGESS | F394: PEARSON | I394: BOSCH | K394: KERLEY | N394: HAYES | Q394: McMAHON | W394: PRESTON | X394: 10 | Y394: 1 | Z394: 0 | AA394: 1151 | AB394: 693 | AC394: =(AA394*100)/AB394 -> 166.0894660894661 | AD394: =(X394*4)+(Z394*2) -> 40
A395: GOALKICKERS | W395: DANDENONG | X395: 9 | Y395: 2 | Z395: 0 | AA395: 1075 | AB395: 672 | AC395: =(AA395*100)/AB395 -> 159.9702380952381 | AD395: =(X395*4)+(Z395*2) -> 36
A396: WAVERLEY | C396: BRENCHLEY 3 | F396: FALCONER 2 | I396: CLANCY | K396: SMITH | M396: LEE | O396: HARKINS | W396: BOX HILL | X396: 6 | Y396: 5 | Z396: 0 | AA396: 823 | AB396: 864 | AC396: =(AA396*100)/AB396 -> 95.254629629629633 | AD396: =(X396*4)+(Z396*2) -> 24
A397: PRAHRAN | C397: KERLEY 3 | F397: PEARSON 3 | I397: DYER 2 | K397: ROACH | W397: WAVERLEY | X397: 6 | Y397: 5 | Z397: 0 | AA397: 840 | AB397: 894 | AC397: =(AA397*100)/AB397 -> 93.959731543624159 | AD397: =(X397*4)+(Z397*2) -> 24
A399: PRESTON | E399: =C399*6+D399 -> 0 | I399: =G399*6+H399 -> 0 | M399: =K399*6+L399 -> 0 | O399: 23 | P399: 22 | Q399: =O399*6+P399 -> 160 | S399: CAULFIELD | W399: PRAHRAN | X399: 5 | Y399: 6 | Z399: 0 | AA399: 941 | AB399: 881 | AC399: =(AA399*100)/AB399 -> 106.81044267877412 | AD399: =(X399*4)+(Z399*2) -> 20
A400: BRIGHTON-CAULFIELD | E400: =C400*6+D400 -> 0 | I400: =G400*6+H400 -> 0 | M400: =K400*6+L400 -> 0 | O400: 10 | P400: 13 | Q400: =O400*6+P400 -> 73 | W400: CAMBERWELL | X400: 5 | Y400: 6 | Z400: 0 | AA400: 902 | AB400: 1003 | AC400: =(AA400*100)/AB400 -> 89.930209371884345 | AD400: =(X400*4)+(Z400*2) -> 20
A401: BEST PLAYERS | W401: SUNSHINE | X401: 2 | Y401: 9 | Z401: 0 | AA401: 851 | AB401: 1067 | AC401: =(AA401*100)/AB401 -> 79.756326148078728 | AD401: =(X401*4)+(Z401*2) -> 8
A402: PRESTON | C402: O'KEEFE | F402: HANCOCK | I402: MURNANE | L402: MURPHY | N402: LAMBIE | Q402: PINFOLD | W402: BRIGHTON-CAULFIELD | X402: 1 | Y402: 10 | Z402: 0 | AA402: 662 | AB402: 1175 | AC402: =(AA402*100)/AB402 -> 56.340425531914896 | AD402: =(X402*4)+(Z402*2) -> 4
A403: BRIGHTON-CAULFIELD | C403: CLARKE | F403: HUNT | I403: T MOULE | L403: R COOPER | N403: EVANS
A404: GOALKICKERS
A405: PRESTON | C405: MURPHY 6 | F405: HANCOCK 6 | I405: LAMBIE 4 | K405: MUIR 2 | M405: HEWETT 2 | O405: O'KEEFE | Q405: MURNANE | S405: GRANT
A406: BRIGHTON-CAULFIELD | C406: CLARKE 3 | F406: T MOULE 2 | I406: CLEMENTS 2 | L406: ASHENHURST | O406: PALMER | Q406: HUNT
A408: DANDENONG | E408: =C408*6+D408 -> 0 | I408: =G408*6+H408 -> 0 | M408: =K408*6+L408 -> 0 | O408: 10 | P408: 14 | Q408: =O408*6+P408 -> 74 | S408: BOX HILL
A409: BOX HILL | E409: =C409*6+D409 -> 0 | I409: =G409*6+H409 -> 0 | M409: =K409*6+L409 -> 0 | O409: 9 | P409: 7 | Q409: =O409*6+P409 -> 61
A410: BEST PLAYERS
A411: DANDENONG | C411: B WATERS | F411: SHELTON | I411: MINOTTI | L411: PENNEFATHER | O411: SHINNERS
A412: BOX HILL | C412: BATES | F412: ROSS | I412: CRAIG | L412: BATCH | O412: CARROLL
A413: GOALKICKERS
A414: DANDENONG | C414: SHELTON 3 | F414: MINOTTI 3 | I414: SHINNERS 2 | L414: DELANTY | O414: ROBIENT
A415: BOX HILL | C415: CARROLL 3 | F415: SALVADO 2 | I415: MACE | K415: BARNES | M415: CRAIG | O415: BURDETT
E416: 8TH JULY | I416: WEATHER
A417: SUNSHINE | E417: =C417*6+D417 -> 0 | I417: =G417*6+H417 -> 0 | M417: =K417*6+L417 -> 0 | O417: 16 | P417: 13 | Q417: =O417*6+P417 -> 109 | S417: SUNSHINE
A418: CAMBERWELL | E418: =C418*6+D418 -> 0 | I418: =G418*6+H418 -> 0 | M418: =K418*6+L418 -> 0 | O418: 10 | P418: 14 | Q418: =O418*6+P418 -> 74
A419: BEST PLAYERS
A420: SUNSHINE | C420: STEWART | F420: CROSBIE | I420: STEPHENS | L420: FERGUSON | O420: TREZISE | Q420: HOWARD
A421: CAMBERWELL | C421: ELLIS | F421: HOBILL | I421: REYNOLDS | L421: COLLARD | O421: K WRIGHT
A422: GOALKICKERS
A423: SUNSHINE | C423: HOWARD 5 | F423: CROSBIE 2 | I423: STAFFORD 2 | L423: STEPHENS 2 | O423: MAGILL | Q423: M FITZGERALD | T423: CHAMLEY | W423: STEWART
A424: CAMBERWELL | C424: LONDON 3 | F424: ELLIS 2 | H424: COLLARD | J424: KILPATRICK | M424: REYNOLDS | P424: COLLETT | R424: K WRIGHT
A426: ROUND 12 | E426: 14TH JULY | I426: WEATHER
D427: 1ST QTR | H427: 2ND QTR | L427: 3RD QTR | P427: FINAL
A428: DANDENONG | E428: =C428*6+D428 -> 0 | I428: =G428*6+H428 -> 0 | M428: =K428*6+L428 -> 0 | O428: 14 | P428: 13 | Q428: =O428*6+P428 -> 97 | S428: DANDENONG | X428: LADDER | AB428: ROUND | AD428: 12
A429: WAVERLEY | E429: =C429*6+D429 -> 0 | I429: =G429*6+H429 -> 0 | M429: =K429*6+L429 -> 0 | O429: 9 | P429: 5 | Q429: =O429*6+P429 -> 59
A430: BEST PLAYERS | W430: TEAM | X430: W | Y430: L | Z430: D | AA430: FOR | AB430: AGST | AC430: % | AD430: PTS
A431: DANDENONG | C431: ARMSTRONG | F431: B WATERS | I431: WRIGHT | L431: ABRAHAM | O431: STAUNTON | R431: DINEEN
A432: WAVERLEY | C432: FALCONER | F432: SMITH | I432: SCOTT | L432: BLACK | O432: NASH | Q432: BRENCHLEY | W432: PRESTON | X432: 11 | Y432: 1 | Z432: 0 | AA432: 1296 | AB432: 749 | AC432: =(AA432*100)/AB432 -> 173.03070761014686 | AD432: =(X432*4)+(Z432*2) -> 44
A433: GOALKICKERS | W433: DANDENONG | X433: 10 | Y433: 2 | Z433: 0 | AA433: 1172 | AB433: 731 | AC433: =(AA433*100)/AB433 -> 160.328317373461 | AD433: =(X433*4)+(Z433*2) -> 40
A434: DANDENONG | C434: ARMSTRONG 5 | F434: MINOTTI 2 | I434: SHINNERS 2 | L434: DINEEN 2 | N434: SHELTON | Q434: DELANTY | S434: WRIGHT | W434: PRAHRAN | X434: 6 | Y434: 6 | Z434: 0 | AA434: 1037 | AB434: 960 | AC434: =(AA434*100)/AB434 -> 108.02083333333333 | AD434: =(X434*4)+(Z434*2) -> 24
A435: WAVERLEY | C435: FALCONER 5 | F435: SMITH 2 | I435: MORTIMER | L435: NASH | W435: BOX HILL | X435: 6 | Y435: 6 | Z435: 0 | AA435: 902 | AB435: 960 | AC435: =(AA435*100)/AB435 -> 93.958333333333329 | AD435: =(X435*4)+(Z435*2) -> 24
A437: PRESTON | E437: =C437*6+D437 -> 0 | I437: =G437*6+H437 -> 0 | M437: =K437*6+L437 -> 0 | O437: 20 | P437: 25 | Q437: =O437*6+P437 -> 145 | S437: CAMBERWELL | W437: WAVERLEY | X437: 6 | Y437: 6 | Z437: 0 | AA437: 899 | AB437: 991 | AC437: =(AA437*100)/AB437 -> 90.716448032290614 | AD437: =(X437*4)+(Z437*2) -> 24
A438: CAMBERWELL | E438: =C438*6+D438 -> 0 | I438: =G438*6+H438 -> 0 | M438: =K438*6+L438 -> 0 | O438: 8 | P438: 8 | Q438: =O438*6+P438 -> 56 | W438: CAMBERWELL | X438: 5 | Y438: 7 | Z438: 0 | AA438: 958 | AB438: 1148 | AC438: =(AA438*100)/AB438 -> 83.449477351916372 | AD438: =(X438*4)+(Z438*2) -> 20
A439: BEST PLAYERS | W439: SUNSHINE | X439: 3 | Y439: 9 | Z439: 0 | AA439: 952 | AB439: 1126 | AC439: =(AA439*100)/AB439 -> 84.547069271758431 | AD439: =(X439*4)+(Z439*2) -> 12
A440: PRESTON | C440: HANCOCK | F440: PINFOLD | I440: MURNANE | L440: O'KEEFE | O440: POWELL | R440: MUIR | W440: BRIGHTON-CAULFIELD | X440: 1 | Y440: 11 | Z440: 0 | AA440: 721 | AB440: 1276 | AC440: =(AA440*100)/AB440 -> 56.504702194357364 | AD440: =(X440*4)+(Z440*2) -> 4
A441: CAMBERWELL | C441: ELLIS | F441: YOUNG | I441: COLLARD | L441: JONES | O441: GIBSON | R441: LONDON
A442: GOALKICKERS
A443: PRESTON | C443: LAMBIE 5 | E443: O'KEEFE 3 | G443: MURPHY 3 | J443: WASLEY 3 | M443: POWELL 2 | O443: HANCOCK 2 | R443: MUIR | T443: LANGLEY
A444: CAMBERWELL | C444: O'NEILL 4 | F444: YOUNG 3 | I444: COLLARD
A446: PRAHRAN | E446: =C446*6+D446 -> 0 | I446: =G446*6+H446 -> 0 | M446: =K446*6+L446 -> 0 | O446: 14 | P446: 12 | Q446: =O446*6+P446 -> 96 | S446: BOX HILL
A447: BOX HILL | E447: =C447*6+D447 -> 0 | I447: =G447*6+H447 -> 0 | M447: =K447*6+L447 -> 0 | O447: 12 | P447: 7 | Q447: =O447*6+P447 -> 79
A448: BEST PLAYERS
A449: PRAHRAN | C449: BUTLER | F449: BOSCH | I449: RICHARDS | L449: HAYES | N449: CAMERON | Q449: ROSS JONES
A450: BOX HILL | C450: BAYES | F450: BERNER | I450: BEASY | L450: BATCH | N450: SALVADO | Q450: WHITE
A451: GOALKICKERS
A452: PRAHRAN | C452: BUTLER 4 | F452: KERLEY 3 | I452: BOSCH 3 | K452: PEARSON 2 | N452: RICHARDS 2
A453: BOX HILL | C453: SALVADO 4 | F453: BAYES 2 | I453: BERNER 2 | L453: WHITE 2 | N453: PROCTOR | Q453: CARROLL
A455: SUNSHINE | E455: =C455*6+D455 -> 0 | I455: =G455*6+H455 -> 0 | M455: =K455*6+L455 -> 0 | O455: 15 | P455: 11 | Q455: =O455*6+P455 -> 101 | S455: SUNSHINE
A456: BRIGHTON-CAULFIELD | E456: =C456*6+D456 -> 0 | I456: =G456*6+H456 -> 0 | M456: =K456*6+L456 -> 0 | O456: 9 | P456: 5 | Q456: =O456*6+P456 -> 59
A457: BEST PLAYERS
A458: SUNSHINE | C458: CROSBIE | F458: YEOMAN | I458: P FITZGERALD | L458: STEPHENS | N458: HOWARD | Q458: TREZISE
A459: BRIGHTON-CAULFIELD | C459: THOMAS | F459: G KEENAN | I459: R COOPER | L459: CLARKE | N459: FOX | Q459: EVANS
A460: GOALKICKERS
A461: SUNSHINE | C461: HOWARD 5 | F461: STEWART 3 | I461: STEPHENS 2 | L461: CROSBIE 2 | N461: CHAMLEY | Q461: YEOMAN | S461: MAGILL
A462: BRIGHTON-CAULFIELD | C462: R COOPER 4 | F462: PALMER 2 | I462: CLARKE | K462: CLEMENTS | N462: A MOULE
A464: ROUND 13 | E464: 21ST JULY | I464: WEATHER
D465: 1ST QTR | H465: 2ND QTR | L465: 3RD QTR | P465: FINAL
A466: WAVERLEY | E466: =C466*6+D466 -> 0 | I466: =G466*6+H466 -> 0 | M466: =K466*6+L466 -> 0 | O466: 10 | P466: 10 | Q466: =O466*6+P466 -> 70 | S466: WAVERLEY | X466: LADDER | AB466: ROUND | AD466: 13
A467: CAMBERWELL | E467: =C467*6+D467 -> 0 | I467: =G467*6+H467 -> 0 | M467: =K467*6+L467 -> 0 | O467: 6 | P467: 18 | Q467: =O467*6+P467 -> 54
A468: BEST PLAYERS | W468: TEAM | X468: W | Y468: L | Z468: D | AA468: FOR | AB468: AGST | AC468: % | AD468: PTS
A469: WAVERLEY | C469: BRENCHLEY | F469: SMITH | I469: SCOTT | L469: SOUTAR | N469: PECK
A470: CAMBERWELL | C470: COLLARD | F470: WHITTEN | I470: ELLIS | L470: O'NEILL | N470: JONES | W470: PRESTON | X470: 12 | Y470: 1 | Z470: 0 | AA470: 1401 | AB470: 796 | AC470: =(AA470*100)/AB470 -> 176.00502512562815 | AD470: =(X470*4)+(Z470*2) -> 48
A471: GOALKICKERS | W471: DANDENONG | X471: 11 | Y471: 2 | Z471: 0 | AA471: 1264 | AB471: 761 | AC471: =(AA471*100)/AB471 -> 166.09724047306176 | AD471: =(X471*4)+(Z471*2) -> 44
A472: WAVERLEY | C472: SMITH 3 | F472: NASH 3 | I472: FALCONER | L472: WHITFIELD | O472: BRENCHLEY | R472: SMAILES | W472: PRAHRAN | X472: 7 | Y472: 6 | Z472: 0 | AA472: 1138 | AB472: 1041 | AC472: =(AA472*100)/AB472 -> 109.31796349663784 | AD472: =(X472*4)+(Z472*2) -> 28
A473: CAMBERWELL | C473: COLLETT | F473: JONES | H473: COLLARD | J473: O'NEILL | L473: ELLIS | N473: HOBILL | W473: WAVERLEY | X473: 7 | Y473: 6 | Z473: 0 | AA473: 969 | AB473: 1045 | AC473: =(AA473*100)/AB473 -> 92.727272727272734 | AD473: =(X473*4)+(Z473*2) -> 28
A475: DANDENONG | E475: =C475*6+D475 -> 0 | I475: =G475*6+H475 -> 0 | M475: =K475*6+L475 -> 0 | O475: 13 | P475: 14 | Q475: =O475*6+P475 -> 92 | S475: CAULFIELD | W475: BOX HILL | X475: 6 | Y475: 7 | Z475: 0 | AA475: 949 | AB475: 1065 | AC475: =(AA475*100)/AB475 -> 89.10798122065728 | AD475: =(X475*4)+(Z475*2) -> 24
A476: BRIGHTON-CAULFIELD | E476: =C476*6+D476 -> 0 | I476: =G476*6+H476 -> 0 | M476: =K476*6+L476 -> 0 | O476: 4 | P476: 6 | Q476: =O476*6+P476 -> 30 | W476: CAMBERWELL | X476: 5 | Y476: 8 | Z476: 0 | AA476: 1012 | AB476: 1218 | AC476: =(AA476*100)/AB476 -> 83.087027914614126 | AD476: =(X476*4)+(Z476*2) -> 20
A477: BEST PLAYERS | W477: SUNSHINE | X477: 3 | Y477: 10 | Z477: 0 | AA477: 1033 | AB477: 1227 | AC477: =(AA477*100)/AB477 -> 84.189079054604733 | AD477: =(X477*4)+(Z477*2) -> 12
A478: DANDENONG | C478: LITTLE | F478: MINOTTI | I478: WRIGHT | L478: DINEEN | N478: ABRAHAM | Q478: PETERS | W478: BRIGHTON-CAULFIELD | X478: 1 | Y478: 12 | Z478: 0 | AA478: 751 | AB478: 1368 | AC478: =(AA478*100)/AB478 -> 54.897660818713447 | AD478: =(X478*4)+(Z478*2) -> 4
A479: BRIGHTON-CAULFIELD | C479: CLARKE | F479: PALMER | I479: THOMAS | L479: FOX | N479: A MOULE | Q479: BARTY
A480: GOALKICKERS
A481: DANDENONG | C481: WRIGHT 3 | F481: LITTLE 3 | I481: T WATERS 2 | L481: ARMSTRONG 2 | O481: PETERS | Q481: MINOTTI | S481: DELANTY
A482: BRIGHTON-CAULFIELD | C482: CLARKE 2 | F482: K HUNT | I482: BEGLEY
A484: PRESTON | E484: =C484*6+D484 -> 0 | I484: =G484*6+H484 -> 0 | M484: =K484*6+L484 -> 0 | O484: 14 | P484: 21 | Q484: =O484*6+P484 -> 105 | S484: PRESTON
A485: BOX HILL | E485: =C485*6+D485 -> 0 | I485: =G485*6+H485 -> 0 | M485: =K485*6+L485 -> 0 | O485: 6 | P485: 11 | Q485: =O485*6+P485 -> 47
A486: BEST PLAYERS
A487: PRESTON | C487: DIXON | F487: MURNANE | I487: GRANT | L487: PINFOLD | N487: MURPHY | Q487: LANGLEY
A488: BOX HILL | C488: HEATLEY | F488: BATCH | I488: BAYES | L488: CRAIG | N488: BLACKALL | Q488: BERNER
A489: GOALKICKERS
A490: PRESTON | C490: MURPHY 4 | F490: MURNANE 2 | I490: HOWELL 2 | L490: GRANT 2 | N490: O'KEEFE | P490: WASLEY | R490: ELSUM | U490: MUIR
A491: BOX HILL | C491: SALVADO 2 | F491: BAYES 2 | I491: BATES | K491: BEASY
E492: 22ND JULY | I492: WEATHER
A493: PRAHRAN | E493: =C493*6+D493 -> 0 | I493: =G493*6+H493 -> 0 | M493: =K493*6+L493 -> 0 | O493: 15 | P493: 11 | Q493: =O493*6+P493 -> 101 | S493: TOORAK PARK
A494: SUNSHINE | E494: =C494*6+D494 -> 0 | I494: =G494*6+H494 -> 0 | M494: =K494*6+L494 -> 0 | O494: 11 | P494: 15 | Q494: =O494*6+P494 -> 81
A495: BEST PLAYERS
A496: PRAHRAN | C496: RICHARDS | F496: YOUNG | I496: BUTLER | L496: MURRAY | N496: CRIPPS | Q496: McMAHON
A497: SUNSHINE | C497: ROACH | F497: HOWARD | I497: CROSBIE | L497: R YEOMAN
A498: GOALKICKERS
A499: PRAHRAN | C499: RICHARDS 5 | F499: McCALLUM 3 | I499: KERLEY 3 | K499: PEARSON 2 | M499: BURGESS | O499: CAMERON
A500: SUNSHINE | C500: HOWARD 3 | F500: R YEOMAN 2 | I500: CASEY | K500: P FITZGERALD | N500: ROACH | P500: LUCLIEW | R500: STEWART | U500: LAWRENCE
A502: ROUND 14 | E502: 28TH JULY | I502: WEATHER
D503: 1ST QTR | H503: 2ND QTR | L503: 3RD QTR | P503: FINAL
A504: DANDENONG | E504: =C504*6+D504 -> 0 | I504: =G504*6+H504 -> 0 | M504: =K504*6+L504 -> 0 | O504: 20 | P504: 20 | Q504: =O504*6+P504 -> 140 | S504: DANDENONG | X504: LADDER | AB504: ROUND | AD504: 14
A505: PRAHRAN | E505: =C505*6+D505 -> 0 | I505: =G505*6+H505 -> 0 | M505: =K505*6+L505 -> 0 | O505: 8 | P505: 13 | Q505: =O505*6+P505 -> 61
A506: BEST PLAYERS | W506: TEAM | X506: W | Y506: L | Z506: D | AA506: FOR | AB506: AGST | AC506: % | AD506: PTS
A507: DANDENONG | C507: T WATERS | F507: PENNEFATHER | J507: B WATERS | M507: DINEEN | O507: BARRAN | Q507: HOBBS
A508: PRAHRAN | C508: CLOSE | F508: McCALLUM | J508: RICHARDS | M508: BOSCH | O508: BUTLER | Q508: PEARSON | W508: PRESTON | X508: 13 | Y508: 1 | Z508: 0 | AA508: 1514 | AB508: 866 | AC508: =(AA508*100)/AB508 -> 174.82678983833719 | AD508: =(X508*4)+(Z508*2) -> 52
A509: GOALKICKERS | W509: DANDENONG | X509: 12 | Y509: 2 | Z509: 0 | AA509: 1404 | AB509: 822 | AC509: =(AA509*100)/AB509 -> 170.80291970802921 | AD509: =(X509*4)+(Z509*2) -> 48
A510: DANDENONG | C510: T WATERS 10 | F510: WRIGHT 3 | I510: ARMSTRONG 3 | L510: MINOTTI 2 | N510: WHELOW | Q510: DINEEN | W510: PRAHRAN | X510: 7 | Y510: 7 | Z510: 0 | AA510: 1199 | AB510: 1281 | AC510: =(AA510*100)/AB510 -> 93.598750975800158 | AD510: =(X510*4)+(Z510*2) -> 28
A511: PRAHRAN | C511: McCALLUM 3 | F511: RICHARDS | I511: BOSCH | K511: PEARSON | M511: BUTLER | O511: KERLEY | W511: WAVERLEY | X511: 7 | Y511: 7 | Z511: 0 | AA511: 1036 | AB511: 1130 | AC511: =(AA511*100)/AB511 -> 91.681415929203538 | AD511: =(X511*4)+(Z511*2) -> 28
A513: CAMBERWELL | E513: =C513*6+D513 -> 0 | I513: =G513*6+H513 -> 0 | M513: =K513*6+L513 -> 0 | O513: 20 | P513: 18 | Q513: =O513*6+P513 -> 138 | S513: CAMBERWELL | W513: BOX HILL | X513: 7 | Y513: 7 | Z513: 0 | AA513: 1034 | AB513: 1132 | AC513: =(AA513*100)/AB513 -> 91.342756183745578 | AD513: =(X513*4)+(Z513*2) -> 28
A514: BRIGHTON-CAULFIELD | E514: =C514*6+D514 -> 0 | I514: =G514*6+H514 -> 0 | M514: =K514*6+L514 -> 0 | O514: 9 | P514: 9 | Q514: =O514*6+P514 -> 63 | W514: CAMBERWELL | X514: 6 | Y514: 8 | Z514: 0 | AA514: 1150 | AB514: 1281 | AC514: =(AA514*100)/AB514 -> 89.773614363778293 | AD514: =(X514*4)+(Z514*2) -> 24
A515: BEST PLAYERS | W515: SUNSHINE | X515: 3 | Y515: 11 | Z515: 0 | AA515: 1103 | AB515: 1340 | AC515: =(AA515*100)/AB515 -> 82.31343283582089 | AD515: =(X515*4)+(Z515*2) -> 12
A516: CAMBERWELL | C516: O'NEILL | F516: JONES | I516: ELLIS | L516: SKALBERG | O516: FRIEBERG | R516: WHITTEN | W516: BRIGHTON-CAULFIELD | X516: 1 | Y516: 13 | Z516: 0 | AA516: 814 | AB516: 1506 | AC516: =(AA516*100)/AB516 -> 54.050464807436917 | AD516: =(X516*4)+(Z516*2) -> 4
A517: BRIGHTON-CAULFIELD | C517: CLARKE | F517: W COOPER | I517: HUGHES | L517: BEGLEY | O517: PALMER | R517: T MOULE
A518: GOALKICKERS
A519: CAMBERWELL | C519: O'NEILL 7 | F519: JONES 5 | I519: ELLIS 3 | K519: HOBILL 2 | M519: QUIRK 2 | O519: WHITTEN
A520: BRIGHTON-CAULFIELD | C520: HUGHES 4 | F520: T MOULE 2 | I520: A MOULE | L520: PALMER | N520: CLARKE
A522: BOX HILL | E522: =C522*6+D522 -> 0 | I522: =G522*6+H522 -> 0 | M522: =K522*6+L522 -> 0 | O522: 12 | P522: 13 | Q522: =O522*6+P522 -> 85 | S522: BOX HILL
A523: WAVERLEY | E523: =C523*6+D523 -> 0 | I523: =G523*6+H523 -> 0 | M523: =K523*6+L523 -> 0 | O523: 10 | P523: 7 | Q523: =O523*6+P523 -> 67
A524: BEST PLAYERS
A525: BOX HILL | C525: CRAIG | F525: ROSS | I525: BATCH | L525: BAYES | O525: BEASY | Q525: GRAY
A526: WAVERLEY | C526: FALCONER | F526: BRENCHLEY | I526: NOLAN | L526: SCOTT | O526: BLACK | Q526: McKINLEY
A527: GOALKICKERS
A528: BOX HILL | C528: GRAY 4 | F528: QUINN 2 | I528: SALVADO 2 | L528: BATES 2 | N528: CRAIG | P528: CARROLL
A529: WAVERLEY | C529: FALCONER 4 | F529: NASH 2 | I529: BRENCHLEY 2 | L529: McKINLEY | N529: WILSON
E530: 29TH JULY | I530: WEATHER
A531: PRESTON | E531: =C531*6+D531 -> 0 | I531: =G531*6+H531 -> 0 | M531: =K531*6+L531 -> 0 | O531: 16 | P531: 17 | Q531: =O531*6+P531 -> 113 | S531: PRESTON
A532: SUNSHINE | E532: =C532*6+D532 -> 0 | I532: =G532*6+H532 -> 0 | M532: =K532*6+L532 -> 0 | O532: 10 | P532: 10 | Q532: =O532*6+P532 -> 70
A533: BEST PLAYERS
A534: PRESTON | C534: GRANT | F534: PINFOLD | I534: STEWART | L534: SAYERS | O534: THORPE | Q534: MURNANE
A535: SUNSHINE | C535: CROSBIE | F535: WILLIAMSON | I535: FERGUSON | L535: R YEOMAN | O535: TURNER | Q535: STEWART
A536: GOALKICKERS
A537: PRESTON | C537: GRANT 4 | F537: LAMBIE 3 | I537: O'KEEFE 2 | K537: MURNANE 2 | N537: STEWART | P537: WASLEY | R537: LANGLEY | T537: MURPHY | W537: MUIR
A538: SUNSHINE | C538: MAGILL 3 | F538: HOWARD 2 | I538: CROSBIE 2 | L538: STEWART | N538: R YEOMAN | Q538: TURNER
A540: ROUND 15 | E540: 4TH AUGUST | I540: WEATHER
D541: 1ST QTR | H541: 2ND QTR | L541: 3RD QTR | P541: FINAL
A542: DANDENONG | E542: =C542*6+D542 -> 0 | I542: =G542*6+H542 -> 0 | M542: =K542*6+L542 -> 0 | O542: 13 | P542: 15 | Q542: =O542*6+P542 -> 93 | S542: DANDENONG | X542: LADDER | AB542: ROUND | AD542: 15
A543: CAMBERWELL | E543: =C543*6+D543 -> 0 | I543: =G543*6+H543 -> 0 | M543: =K543*6+L543 -> 0 | O543: 7 | P543: 8 | Q543: =O543*6+P543 -> 50
A544: BEST PLAYERS | W544: TEAM | X544: W | Y544: L | Z544: D | AA544: FOR | AB544: AGST | AC544: % | AD544: PTS
A545: DANDENONG | C545: DINEEN | F545: BARRAN | I545: B WATERS | L545: OSBORNE | O545: ABRAHAM | R545: SHELTON
A546: CAMBERWELL | C546: JONES | F546: O'NEILL | I546: WRIGHT | L546: COLLETT | O546: GIBSON | R546: HOBILL | W546: DANDENONG | X546: 13 | Y546: 2 | Z546: 0 | AA546: 1497 | AB546: 872 | AC546: =(AA546*100)/AB546 -> 171.6743119266055 | AD546: =(X546*4)+(Z546*2) -> 52
A547: GOALKICKERS | W547: PRESTON | X547: 13 | Y547: 2 | Z547: 0 | AA547: 1590 | AB547: 969 | AC547: =(AA547*100)/AB547 -> 164.08668730650155 | AD547: =(X547*4)+(Z547*2) -> 52
A548: DANDENONG | C548: WRIGHT 4 | F548: PILCHER 3 | I548: DINEEN 2 | K548: MINOTTI | M548: ARMSTRONG | P548: BARRAN | R548: T WATERS | W548: WAVERLEY | X548: 8 | Y548: 7 | Z548: 0 | AA548: 1176 | AB548: 1190 | AC548: =(AA548*100)/AB548 -> 98.82352941176471 | AD548: =(X548*4)+(Z548*2) -> 32
A549: CAMBERWELL | C549: O'NEILL 5 | F549: JONES | I549: WRIGHT | W549: BOX HILL | X549: 8 | Y549: 7 | Z549: 0 | AA549: 1157 | AB549: 1203 | AC549: =(AA549*100)/AB549 -> 96.176226101413135 | AD549: =(X549*4)+(Z549*2) -> 32
A551: WAVERLEY | E551: =C551*6+D551 -> 0 | I551: =G551*6+H551 -> 0 | M551: =K551*6+L551 -> 0 | O551: 21 | P551: 14 | Q551: =O551*6+P551 -> 140 | S551: CAULFIELD | W551: PRAHRAN | X551: 8 | Y551: 7 | Z551: 0 | AA551: 1302 | AB551: 1357 | AC551: =(AA551*100)/AB551 -> 95.946941783345622 | AD551: =(X551*4)+(Z551*2) -> 32
A552: BRIGHTON-CAULFIELD | E552: =C552*6+D552 -> 0 | I552: =G552*6+H552 -> 0 | M552: =K552*6+L552 -> 0 | O552: 8 | P552: 12 | Q552: =O552*6+P552 -> 60 | W552: CAMBERWELL | X552: 6 | Y552: 9 | Z552: 0 | AA552: 1200 | AB552: 1374 | AC552: =(AA552*100)/AB552 -> 87.336244541484717 | AD552: =(X552*4)+(Z552*2) -> 24
A553: BEST PLAYERS | W553: SUNSHINE | X553: 3 | Y553: 12 | Z553: 0 | AA553: 1174 | AB553: 1463 | AC553: =(AA553*100)/AB553 -> 80.246069719753933 | AD553: =(X553*4)+(Z553*2) -> 12
A554: WAVERLEY | C554: FALCONER | F554: MITHEN | I554: MCKINLEY | L554: COLE | O554: NOLAN | Q554: BRENCHLEY | W554: BRIGHTON-CAULFIELD | X554: 1 | Y554: 14 | Z554: 0 | AA554: 874 | AB554: 1646 | AC554: =(AA554*100)/AB554 -> 53.098420413122724 | AD554: =(X554*4)+(Z554*2) -> 4
A555: BRIGHTON-CAULFIELD | C555: ASHENHURST | F555: W COOPER | I555: THOMAS | L555: FOX | O555: BARTY | Q555: T MOULE
A556: GOALKICKERS
A557: WAVERLEY | C557: McKINLEY 4 | F557: FALCONER 4 | I557: COLE 2 | K557: LEE 2 | M557: BRENCHLEY 2 | P557: SCOTT 2 | R557: HARKINS 2 | T557: LYNDON | V557: WHITFIELD
A558: BRIGHTON-CAULFIELD | C558: EVANS 2 | F558: HENDERSON | I558: BEGLEY | K558: MAYER | M558: PALMER | O558: HUGHES | Q558: T MOULE
A560: BOX HILL | E560: =C560*6+D560 -> 0 | I560: =G560*6+H560 -> 0 | M560: =K560*6+L560 -> 0 | O560: 17 | P560: 21 | Q560: =O560*6+P560 -> 123 | S560: SUNSHINE
A561: SUNSHINE | E561: =C561*6+D561 -> 0 | I561: =G561*6+H561 -> 0 | M561: =K561*6+L561 -> 0 | O561: 10 | P561: 11 | Q561: =O561*6+P561 -> 71
A562: BEST PLAYERS
A563: BOX HILL | C563: DUMMELOW | F563: QUINN | I563: SALVADO | L563: BATES | O563: CRAIG | R563: CURRY
A564: SUNSHINE | C564: MAGILL | F564: ROACH | I564: CROSBIE | L564: HOWARD | O564: FERGUSON | R564: R YEOMAN
A565: GOALKICKERS
A566: BOX HILL | C566: SALVADO 5 | F566: QUINN 3 | I566: BAYES 2 | K566: CARROLL 2 | N566: GRAY 2 | P566: BERNER 2 | R566: CURRY
A567: SUNSHINE | C567: HOWARD 5 | F567: MAGILL 2 | I567: STEWART | L567: CROSBIE | N567: R YEOMAN
E568: 5TH AUGUST | I568: WEATHER
A569: PRAHRAN | E569: =C569*6+D569 -> 0 | I569: =G569*6+H569 -> 0 | M569: =K569*6+L569 -> 0 | O569: 15 | P569: 13 | Q569: =O569*6+P569 -> 103 | S569: TOORAK PARK
A570: PRESTON | E570: =C570*6+D570 -> 0 | I570: =G570*6+H570 -> 0 | M570: =K570*6+L570 -> 0 | O570: 9 | P570: 22 | Q570: =O570*6+P570 -> 76
A571: BEST PLAYERS
A572: PRAHRAN | C572: BOSCH | F572: CRIPPS | I572: BURGESS | L572: KERLEY | O572: RICHARDS | R572: CAMERON
A573: PRESTON | C573: LAMBIE | F573: WADDELL | I573: LANGLEY | L573: MURPHY | O573: O'KEEFE
A574: GOALKICKERS
A575: PRAHRAN | C575: BOSCH 4 | E575: PEARSON 2 | H575: CAMERON 2 | K575: BUTLER 2 | M575: RICHARDS | O575: KERLEY | Q575: BURGESS | S575: W GRAY | V575: McCALLUM
A576: PRESTON | C576: LAMBIE 4 | F576: MURPHY 3 | I576: O'KEEFE 2
A578: ROUND 16 | E578: 11TH AUGUST | I578: WEATHER
D579: 1ST QTR | H579: 2ND QTR | L579: 3RD QTR | P579: FINAL
A580: WAVERLEY | E580: =C580*6+D580 -> 0 | I580: =G580*6+H580 -> 0 | M580: =K580*6+L580 -> 0 | O580: 19 | P580: 14 | Q580: =O580*6+P580 -> 128 | S580: WAVERLEY | X580: LADDER | AB580: ROUND | AD580: 16
A581: SUNSHINE | E581: =C581*6+D581 -> 0 | I581: =G581*6+H581 -> 0 | M581: =K581*6+L581 -> 0 | O581: 13 | P581: 15 | Q581: =O581*6+P581 -> 93
A582: BEST PLAYERS | W582: TEAM | X582: W | Y582: L | Z582: D | AA582: FOR | AB582: AGST | AC582: % | AD582: PTS
A583: WAVERLEY | C583: SCOTT | F583: WHITFIELD | I583: COLE | K583: BRENCHLEY | N583: HARKINS
A584: SUNSHINE | C584: HOWARD | F584: R YEOMAN | I584: TREZISE | K584: STEWART | W584: PRESTON | X584: 14 | Y584: 2 | Z584: 0 | AA584: 1680 | AB584: 1048 | AC584: =(AA584*100)/AB584 -> 160.30534351145039 | AD584: =(X584*4)+(Z584*2) -> 56
A585: GOALKICKERS | Q585: HARKINS | W585: DANDENONG | X585: 13 | Y585: 3 | Z585: 0 | AA585: 1576 | AB585: 962 | AC585: =(AA585*100)/AB585 -> 163.82536382536384 | AD585: =(X585*4)+(Z585*2) -> 52
A586: WAVERLEY | C586: FALCONER 3 | F586: WHITFIELD 3 | I586: NASH 3 | K586: SCOTT 3 | M586: McKINLEY 2 | P586: COLE 2 | R586: BRENCHLEY 2 | W586: BOX HILL | X586: 9 | Y586: 7 | Z586: 0 | AA586: 1281 | AB586: 1247 | AC586: =(AA586*100)/AB586 -> 102.72654370489174 | AD586: =(X586*4)+(Z586*2) -> 36
A587: SUNSHINE | C587: HOWARD 7 | F587: P FITZGERALD | I587: MULLARVEY | L587: MAGILL | N587: STEWART | Q587: R YEOMAN | S587: TREZISE | W587: WAVERLEY | X587: 9 | Y587: 7 | Z587: 0 | AA587: 1304 | AB587: 1283 | AC587: =(AA587*100)/AB587 -> 101.63678877630554 | AD587: =(X587*4)+(Z587*2) -> 36
A589: BOX HILL | E589: =C589*6+D589 -> 0 | I589: =G589*6+H589 -> 0 | M589: =K589*6+L589 -> 0 | O589: 16 | P589: 28 | Q589: =O589*6+P589 -> 124 | S589: BOX HILL | W589: PRAHRAN | X589: 9 | Y589: 7 | Z589: 0 | AA589: 1415 | AB589: 1453 | AC589: =(AA589*100)/AB589 -> 97.384721266345494 | AD589: =(X589*4)+(Z589*2) -> 36
A590: BRIGHTON-CAULFIELD | E590: =C590*6+D590 -> 0 | I590: =G590*6+H590 -> 0 | M590: =K590*6+L590 -> 0 | O590: 7 | P590: 2 | Q590: =O590*6+P590 -> 44 | W590: CAMBERWELL | X590: 6 | Y590: 10 | Z590: 0 | AA590: 1296 | AB590: 1487 | AC590: =(AA590*100)/AB590 -> 87.15534633490249 | AD590: =(X590*4)+(Z590*2) -> 24
A591: BEST PLAYERS | W591: SUNSHINE | X591: 3 | Y591: 13 | Z591: 0 | AA591: 1267 | AB591: 1591 | AC591: =(AA591*100)/AB591 -> 79.635449402891268 | AD591: =(X591*4)+(Z591*2) -> 12
A592: BOX HILL | C592: CRAIG | F592: DUURSMA | I592: BAYES | K592: BERNER | N592: WITTNER | Q592: BATES | W592: BRIGHTON-CAULFIELD | X592: 1 | Y592: 15 | Z592: 0 | AA592: 918 | AB592: 1770 | AC592: =(AA592*100)/AB592 -> 51.864406779661017 | AD592: =(X592*4)+(Z592*2) -> 4
A593: BRIGHTON-CAULFIELD | C593: W COOPER | F593: THOMAS | I593: NICHOLL | K593: BARTY | N593: MCMAHON | Q593: IRVINE
A594: GOALKICKERS
A595: BOX HILL | C595: SALVADO 6 | F595: GRAY 3 | H595: CARROLL 2 | J595: QUINN | L595: BAYES | N595: DUURSMA | Q595: CURRY
A596: BRIGHTON-CAULFIELD | C596: HUGHES 3 | F596: BARTY 2 | I596: HENDERSON 2
A598: PRAHRAN | E598: =C598*6+D598 -> 0 | I598: =G598*6+H598 -> 0 | M598: =K598*6+L598 -> 0 | O598: 16 | P598: 17 | Q598: =O598*6+P598 -> 113 | S598: CAMBERWELL
A599: CAMBERWELL | E599: =C599*6+D599 -> 0 | I599: =G599*6+H599 -> 0 | M599: =K599*6+L599 -> 0 | O599: 14 | P599: 12 | Q599: =O599*6+P599 -> 96
A600: BEST PLAYERS
A601: PRAHRAN | C601: BUTLER | F601: KERLEY | I601: CAMERON | L601: BOSCH | N601: BURGESS | Q601: RICHARDS
A602: CAMBERWELL | C602: QUIRK | F602: ELLIS | I602: SKALBERG | L602: JONES | N602: WHITTEN | Q602: DOUGLAS
A603: GOALKICKERS
A604: PRAHRAN | C604: KERLEY 4 | F604: CAMERON 4 | I604: BUTLER 3 | K604: BOSCH 3 | M604: RICHARDS | P604: PEARSON
A605: CAMBERWELL | C605: O'NEILL 4 | F605: QUIRK 3 | I605: ELLIS 2 | K605: HAFEY | M605: HOBILL | O605: JONES | Q605: COLLETT | S605: WATTS
E606: 12TH AUGUST | I606: WEATHER
A607: PRESTON | E607: =C607*6+D607 -> 0 | I607: =G607*6+H607 -> 0 | M607: =K607*6+L607 -> 0 | O607: 13 | P607: 12 | Q607: =O607*6+P607 -> 90 | S607: PRESTON
A608: DANDENONG | E608: =C608*6+D608 -> 0 | I608: =G608*6+H608 -> 0 | M608: =K608*6+L608 -> 0 | O608: 11 | P608: 13 | Q608: =O608*6+P608 -> 79
A609: BEST PLAYERS
A610: PRESTON | C610: DIXON | F610: LAMBIE | I610: MURPHY | L610: HANCOCK | N610: WASLEY | Q610: PINFOLD
A611: DANDENONG | C611: DINEEN | F611: OSBORNE | I611: LITTLE | L611: SHELTON | N611: PENNEFATHER | Q611: BARRAN
A612: GOALKICKERS
A613: PRESTON | C613: O'KEEFE 3 | F613: DEAN 3 | I613: GRANT 3 | L613: MURPHY 3 | N613: LAMBIE
A614: DANDENONG | C614: OSBORNE 4 | F614: DINEEN 2 | I614: SHELTON 2 | L614: MINOTTI | N614: WRIGHT | Q614: T WATERS
A616: FINALS
A617: 1ST SEMI | E617: 18TH AUGUST | I617: WEATHER
D618: 1ST QTR | H618: 2ND QTR | L618: 3RD QTR | P618: FINAL
A619: PRAHRAN | C619: 4 | D619: 4 | E619: =C619*6+D619 -> 28 | G619: 7 | H619: 7 | I619: =G619*6+H619 -> 49 | K619: 10 | L619: 13 | M619: =K619*6+L619 -> 73 | O619: 11 | P619: 16 | Q619: =O619*6+P619 -> 82 | S619: TOORAK PARK
A620: BOX HILL | C620: 1 | D620: 1 | E620: =C620*6+D620 -> 7 | G620: 3 | H620: 6 | I620: =G620*6+H620 -> 24 | K620: 4 | L620: 8 | M620: =K620*6+L620 -> 32 | O620: 8 | P620: 12 | Q620: =O620*6+P620 -> 60 | S620: TREWIN
A621: BEST PLAYERS
A622: PRAHRAN | C622: HAYES | F622: KERLEY | I622: RICHARDS | L622: ROY JONES | O622: MURRAY | Q622: BUTLER
A623: BOX HILL | C623: WITTMER | F623: BATES | I623: BERNER | L623: BATCH | O623: CRAIG | Q623: ROCHOW
A624: GOALKICKERS
A625: PRAHRAN | C625: RICHARDS 3 | F625: KERLEY 2 | I625: BOSCH | K625: CAMERON | M625: BURGESS | O625: W GRAY | Q625: WISHART | T625: McCALLUM
A626: BOX HILL | C626: SALVADO 4 | F626: BATES 2 | I626: N GRAY | K626: BATES
A628: 2ND SEMI | E628: 25TH AUGUST | I628: WEATHER
A629: DANDENONG | C629: 2 | D629: 2 | E629: =C629*6+D629 -> 14 | G629: 8 | H629: 4 | I629: =G629*6+H629 -> 52 | K629: 10 | L629: 7 | M629: =K629*6+L629 -> 67 | O629: 14 | P629: 12 | Q629: =O629*6+P629 -> 96 | S629: TOORAK PARK
A630: PRESTON | C630: 2 | D630: 6 | E630: =C630*6+D630 -> 18 | G630: 6 | H630: 9 | I630: =G630*6+H630 -> 45 | K630: 9 | L630: 14 | M630: =K630*6+L630 -> 68 | O630: 11 | P630: 14 | Q630: =O630*6+P630 -> 80 | S630: ROWE
A631: BEST PLAYERS
A632: DANDENONG | C632: DINEEN | F632: LITTLE | I632: B WATERS | L632: PENNEFATHER | O632: T WATERS | R632: WRIGHT
A633: PRESTON | C633: HANCOCK | F633: SAYERS | I633: MURNANE | L633: LANGLEY | O633: STEWART | R633: MURPHY
A634: GOALKICKERS
A635: DANDENONG | C635: T WATERS 4 | F635: PETERS 3 | I635: DINEEN 3 | L635: WRIGHT 2 | O635: MINOTTI 2
A636: PRESTON | C636: MURPHY 2 | F636: BOYLE 2 | I636: WASLEY 2 | L636: GRANT 2 | N636: HANCOCK | Q636: MURNANE | T636: O'KEEFE
A638: PRELIMINARY | E638: 1ST SEPTEMBER | J638: WEATHER
A639: PRAHRAN | C639: 2 | D639: 1 | E639: =C639*6+D639 -> 13 | G639: 5 | H639: 4 | I639: =G639*6+H639 -> 34 | K639: 6 | L639: 5 | M639: =K639*6+L639 -> 41 | O639: 10 | P639: 6 | Q639: =O639*6+P639 -> 66 | S639: TOORAK PARK
A640: PRESTON | C640: 3 | D640: 5 | E640: =C640*6+D640 -> 23 | G640: 4 | H640: 8 | I640: =G640*6+H640 -> 32 | K640: 6 | L640: 13 | M640: =K640*6+L640 -> 49 | O640: 6 | P640: 16 | Q640: =O640*6+P640 -> 52 | S640: BAIRD
A641: BEST PLAYERS
A642: PRAHRAN | C642: KERLEY | F642: HAYES | I642: LAMBERT | L642: ROY JONES | O642: PEARSON | Q642: W GRAY
A643: PRESTON | C643: STEWART | F643: HAYES | I643: THORPE | L643: ZORZI | O643: MUIR | Q643: MURNANE
A644: GOALKICKERS
A645: PRAHRAN | C645: KERLEY 4 | F645: WISHART 3 | I645: BUTLER | K645: CAMERON | N645: PEARSON
A646: PRESTON | C646: GRANT 2 | F646: LANGLEY | I646: MURPHY | K646: O'KEEFE | N646: MUIR
A648: GRAND | E648: 8TH SEPTEMBER | I648: WEATHER
A649: DANDENONG | C649: 4 | D649: 3 | E649: =C649*6+D649 -> 27 | G649: 5 | H649: 12 | I649: =G649*6+H649 -> 42 | K649: 11 | L649: 17 | M649: =K649*6+L649 -> 83 | O649: 16 | P649: 24 | Q649: =O649*6+P649 -> 120 | S649: TOORAK PARK
A650: PRAHRAN | C650: 2 | D650: 2 | E650: =C650*6+D650 -> 14 | G650: 4 | H650: 7 | I650: =G650*6+H650 -> 31 | K650: 7 | L650: 11 | M650: =K650*6+L650 -> 53 | O650: 8 | P650: 12 | Q650: =O650*6+P650 -> 60 | S650: MILLEN
A651: BEST PLAYERS
A652: DANDENONG | C652: DINEEN | F652: WRIGHT | I652: STAUNTON | L652: B WATERS | O652: ABRAHAM | R652: DELANTY
A653: PRAHRAN | C653: PEARSON | F653: BURGESS | I653: BUTLER | L653: W GRAY | O653: ROY JONES
A654: GOALKICKERS
A655: DANDENONG | C655: WRIGHT 6 | F655: T WATERS 2 | I655: BARRAN 2 | L655: DELANTY | N655: WHELOW | Q655: MINOTTI | S655: PILCHER
A656: PRAHRAN | C656: PEARSON 4 | F656: BURGESS | I656: BUTLER | K656: RICHARDS | M656: WISHART
A658: PROMOTION MATCH
A659: NORTHCOTE | C659: 3 | D659: 5 | E659: =C659*6+D659 -> 23 | G659: 9 | H659: 14 | I659: =G659*6+H659 -> 68 | K659: 10 | L659: 15 | M659: =K659*6+L659 -> 75 | O659: 17 | P659: 21 | Q659: =O659*6+P659 -> 123 | S659: BRUNSWICK
A660: PRAHRAN | C660: 1 | D660: 2 | E660: =C660*6+D660 -> 8 | G660: 2 | H660: 3 | I660: =G660*6+H660 -> 15 | K660: 5 | L660: 9 | M660: =K660*6+L660 -> 39 | O660: 6 | P660: 10 | Q660: =O660*6+P660 -> 46 | S660: McMASTER
A661: BEST PLAYERS
A662: NORTHCOTE | C662: C LANGBORNE | F662: OUSLEY | I662: TAYLOR | L662: BRETHERTON | O662: GASKETT | Q662: AGHAN
A663: PRAHRAN | C663: KERLEY | F663: JONES | I663: McCALLUM | L663: RICHARDS | O663: WISHART | Q663: CLOSE
A664: GOALKICKERS
A665: NORTHCOTE | C665: AGHAN 4 | E665: C LANGBORNE 3 | H665: OUSLEY 3 | J665: TAYLOR 2 | M665: FURLONG 2 | P665: GASKETT | R665: ADAMSON | U665: R LANGBORNE
A666: PRAHRAN | C666: W GRAY 2 | F666: KERLEY | I666: McCALLUM | L666: PEARSON | N666: CLARKE