A1: Victorian Football Association
A2: Season 1963 - Division Two
A3: © Copyright Wal Williams | F3: First created: 28 March 2016
A4: Contact: joywalwi at gmail dot com | F4: Last updated: 28 March 2016 | W4: VFA Results and tables - Link to the main index page
A5: You are free to copy this document in whole or part provided that proper acknowledgement is given to the author. All rights reserved.
A7: 1963 | D7: 2ND DIVISION
A8: ROUND 1 | E8: 20TH APRIL | I8: WEATHER | S8: PLAYED AT
D9: 1ST QTR | H9: 2ND QTR | L9: 3RD QTR | P9: FINAL | S9: CAMBERWELL
A10: CAMBERWEL | E10: =C10*6+D10 -> 0 | I10: =G10*6+H10 -> 0 | M10: =K10*6+L10 -> 0 | O10: 17 | P10: 21 | Q10: =O10*6+P10 -> 123 | S10: UMPIRE | Y10: LADDER | AC10: ROUND | AE10: 1
A11: BRIGHTON-CAULFIELD | E11: =C11*6+D11 -> 0 | I11: =G11*6+H11 -> 0 | M11: =K11*6+L11 -> 0 | O11: 8 | P11: 14 | Q11: =O11*6+P11 -> 62
A12: BEST PLAYERS | W12: TEAM | X12: B | Y12: W | Z12: L | AA12: D | AB12: FOR | AC12: AGST | AD12: % | AE12: PTS
A13: CAMBERWEL | C13: DOUGLAS | F13: QUIRK | I13: O'NEILL | L13: CRIPPS | N13: GAUDION | Q13: RENWOOD
A14: BRIGHTON-CAULFIELD | C14: POWELL | F14: VALENTINE | I14: O'TOOLE | L14: A MOULE | N14: DUNN | Q14: KEENAN | W14: CAMBERWELL | Y14: 1 | Z14: 0 | AA14: 0 | AB14: 123 | AC14: 62 | AD14: =(AB14*100)/AC14 -> 198.38709677419354 | AE14: 4
A15: GOALKICKERS | P15: SMITH | W15: SUNSHINE | Y15: 1 | Z15: 0 | AA15: 0 | AB15: 91 | AC15: 60 | AD15: =(AB15*100)/AC15 -> 151.66666666666666 | AE15: 4
A16: CAMBERWEL | C16: O'NEILL 4 | E16: ELLIS 3 | G16: GAUDION 2 | I16: HAFEY 2 | K16: RENWOOD 2 | N16: WHITTEN | Q16: QUIRK | S16: CRIPPS | W16: WAVERLEY | Y16: 1 | Z16: 0 | AA16: 0 | AB16: 96 | AC16: 66 | AD16: =(AB16*100)/AC16 -> 145.45454545454547 | AE16: 4
A17: BRIGHTON-CAULFIELD | C17: JAMIESON 3 | F17: POWELL 2 | I17: COOK | K17: A MOULE | M17: DOUGLAS | W17: PRESTON | Y17: 1 | Z17: 0 | AA17: 0 | AB17: 80 | AC17: 67 | AD17: =(AB17*100)/AC17 -> 119.40298507462687 | AE17: 4
A19: WAVERLEY | E19: =C19*6+D19 -> 0 | I19: =G19*6+H19 -> 0 | M19: =K19*6+L19 -> 0 | O19: 13 | P19: 18 | Q19: =O19*6+P19 -> 96 | S19: WAVERLEY | W19: GEELONG WEST | X19: 1 | Y19: 0 | Z19: 0 | AA19: 0 | AB19: 0 | AC19: 0 | AE19: 0
A20: BOX HILL | E20: =C20*6+D20 -> 0 | I20: =G20*6+H20 -> 0 | M20: =K20*6+L20 -> 0 | O20: 9 | P20: 12 | Q20: =O20*6+P20 -> 66 | W20: PRAHRAN | Y20: 0 | Z20: 1 | AA20: 0 | AB20: 67 | AC20: 80 | AD20: =(AB20*100)/AC20 -> 83.75 | AE20: 0
A21: BEST PLAYERS | W21: BOX HILL | Y21: 0 | Z21: 1 | AA21: 0 | AB21: 66 | AC21: 96 | AD21: =(AB21*100)/AC21 -> 68.75 | AE21: 0
A22: WAVERLEY | C22: ANGUS | F22: CRANAGE | I22: BRENCHLEY | L22: INGWERSON | O22: SMITH | Q22: LEE | W22: MORDIALLOC | Y22: 0 | Z22: 1 | AA22: 0 | AB22: 60 | AC22: 91 | AD22: =(AB22*100)/AC22 -> 65.934065934065927 | AE22: 0
A23: BOX HILL | C23: P QUINN | F23: BATES | I23: LA ROCHE | L23: ROSS | O23: CRAIG | Q23: BLACKALL | W23: BRIGHTON-CAULFIELD | Y23: 0 | Z23: 1 | AA23: 0 | AB23: 62 | AC23: 123 | AD23: =(AB23*100)/AC23 -> 50.40650406504065 | AE23: 0
A24: GOALKICKERS
A25: WAVERLEY | C25: BRENCHLEY 4 | F25: CRANAGE 3 | I25: SCOTT | K25: McKINDLAY | N25: SMITH | P25: TRELOAR | R25: SMAILES | T25: MARTIN
A26: BOX HILL | C26: LA ROCHE 3 | F26: PLUNKETT 2 | I26: P QUINN 2 | L26: BATES | N26: CRAIG
A28: SUNSHINE | E28: =C28*6+D28 -> 0 | I28: =G28*6+H28 -> 0 | M28: =K28*6+L28 -> 0 | O28: 14 | P28: 7 | Q28: =O28*6+P28 -> 91 | S28: SUNSHINE
A29: MORDIALLOC | E29: =C29*6+D29 -> 0 | I29: =G29*6+H29 -> 0 | M29: =K29*6+L29 -> 0 | O29: 8 | P29: 12 | Q29: =O29*6+P29 -> 60
A30: BEST PLAYERS
A31: SUNSHINE | C31: FERGUSON | F31: CROSBIE | I31: WAPLING | L31: RYAN | O31: MAGILL | R31: B DICKSON
A32: MORDIALLOC | C32: PORTA | F32: BESANKO | I32: WILSON | L32: ROBERTS | O32: WILLIAMS | R32: NESBITT
A33: GOALKICKERS
A34: SUNSHINE | C34: HOWARD 3 | F34: RYAN 3 | H34: WAPLING 3 | K34: MAGILL 2 | N34: CROSBIE 2 | P34: GREGORY
A35: MORDIALLOC | C35: POWELL 3 | F35: TULLOCH 2 | I35: CAREY | K35: CRAWFORD | N35: BAKER
E36: 21ST APRIL | I36: WEATHER
A37: PRESTON | E37: =C37*6+D37 -> 0 | I37: =G37*6+H37 -> 0 | M37: =K37*6+L37 -> 0 | O37: 11 | P37: 14 | Q37: =O37*6+P37 -> 80 | S37: PRESTON
A38: PRAHRAN | E38: =C38*6+D38 -> 0 | I38: =G38*6+H38 -> 0 | M38: =K38*6+L38 -> 0 | O38: 10 | P38: 7 | Q38: =O38*6+P38 -> 67
A39: BEST PLAYERS
A40: PRESTON | C40: ZORZI | F40: BOYLE | I40: MURNANE | L40: SAYERS | O40: BROPHY | Q40: HANCOCK
A41: PRAHRAN | C41: HARRIS | F41: D JONES | I41: ROY JONES | L41: BOSCH | O41: GLOVER | Q41: BURGESS
A42: GOALKICKERS
A43: PRESTON | C43: SECCULL 4 | F43: ZORZI 2 | I43: MUIR | K43: LAMBIE | M43: WATSON | O43: BROPHY | Q43: WHITE
A44: PRAHRAN | C44: PEARSON 3 | F44: RICHARDS 2 | I44: McMAHON | L44: KERLEY | N44: BUTLER | P44: BOSCH | R44: YOUNG
A46: BYE | C46: GEELONG WEST
A48: ROUND 2 | E48: 27TH APRIL | I48: WEATHER | S48: PLAYED AT
D49: 1ST QTR | H49: 2ND QTR | L49: 3RD QTR | P49: FINAL | S49: MORDIALLOC
A50: WAVERLEY | E50: =C50*6+D50 -> 0 | I50: =G50*6+H50 -> 0 | M50: =K50*6+L50 -> 0 | O50: 11 | P50: 14 | Q50: =O50*6+P50 -> 80 | S50: UMPIRE | Y50: LADDER | AC50: ROUND | AE50: 2
A51: MORDIALLOC | E51: =C51*6+D51 -> 0 | I51: =G51*6+H51 -> 0 | M51: =K51*6+L51 -> 0 | O51: 10 | P51: 12 | Q51: =O51*6+P51 -> 72
A52: BEST PLAYERS | W52: TEAM | X52: B | Y52: W | Z52: L | AA52: D | AB52: FOR | AC52: AGST | AD52: % | AE52: PTS
A53: WAVERLEY | C53: TRELOAR | F53: INNES | I53: INGWERSON | L53: ANGUS | O53: BRENCHLEY | R53: THOROGOOD
A54: MORDIALLOC | C54: TULLOCH | F54: PETRIE | I54: HORNE | L54: STEWART | O54: POWER | R54: WILSON | W54: PRESTON | Y54: 2 | Z54: 0 | AA54: 0 | AB54: 187 | AC54: 123 | AD54: =(AB54*100)/AC54 -> 152.03252032520325 | AE54: 8
A55: GOALKICKERS | W55: WAVERLEY | Y55: 2 | Z55: 0 | AA55: 0 | AB55: 176 | AC55: 138 | AD55: =(AB55*100)/AC55 -> 127.53623188405797 | AE55: 8
A56: WAVERLEY | C56: BRENCHLEY 4 | F56: TRELOAR 2 | I56: INGWERSON 2 | L56: CRANAGE | N56: McKINDLAY | Q56: SMITH | W56: PRAHRAN | Y56: 1 | Z56: 1 | AA56: 0 | AB56: 205 | AC56: 146 | AD56: =(AB56*100)/AC56 -> 140.41095890410958 | AE56: 4
A57: MORDIALLOC | C57: POWER 4 | E57: WILLIAMSON | H57: WILSON | J57: TULLOCH | M57: HARRISON | P57: PETRIE | R57: NISBETT | W57: CAMBERWELL | Y57: 1 | Z57: 1 | AA57: 0 | AB57: 188 | AC57: 165 | AD57: =(AB57*100)/AC57 -> 113.93939393939394 | AE57: 4
A59: BOX HILL | E59: =C59*6+D59 -> 0 | I59: =G59*6+H59 -> 0 | M59: =K59*6+L59 -> 0 | O59: 15 | P59: 13 | Q59: =O59*6+P59 -> 103 | S59: BOX HILL | W59: BOX HILL | Y59: 1 | Z59: 1 | AA59: 0 | AB59: 169 | AC59: 161 | AD59: =(AB59*100)/AC59 -> 104.96894409937889 | AE59: 4
A60: CAMBERWELL | E60: =C60*6+D60 -> 0 | I60: =G60*6+H60 -> 0 | M60: =K60*6+L60 -> 0 | O60: 8 | P60: 17 | Q60: =O60*6+P60 -> 65 | W60: SUNSHINE | Y60: 1 | Z60: 1 | AA60: 0 | AB60: 157 | AC60: 198 | AD60: =(AB60*100)/AC60 -> 79.292929292929287 | AE60: 4
A61: BEST PLAYERS | W61: MORDIALLOC | Y61: 0 | Z61: 2 | AA61: 0 | AB61: 132 | AC61: 171 | AD61: =(AB61*100)/AC61 -> 77.192982456140356 | AE61: 0
A62: BOX HILL | C62: P QUINN | F62: BATES | I62: DUURSMA | L62: J QUINN | O62: ROSS | Q62: CHEFFERS | W62: GEELONG WEST | X62: 1 | Y62: 0 | Z62: 1 | AA62: 0 | AB62: 56 | AC62: 107 | AD62: =(AB62*100)/AC62 -> 52.336448598130843 | AE62: 0
A63: CAMBERWELL | C63: WHITTEN | F63: QUIRK | I63: HAFEY | L63: FRIEBERG | O63: CRIPPS | Q63: YOUNG | W63: BRIGHTON-CAULFIELD | X63: 1 | Y63: 0 | Z63: 1 | AA63: 0 | AB63: 62 | AC63: 123 | AD63: =(AB63*100)/AC63 -> 50.40650406504065 | AE63: 0
A64: GOALKICKERS
A65: BOX HILL | C65: P QUINN 3 | F65: SALVADO 3 | I65: BATES 3 | K65: J QUINN 2 | N65: DUURSMA | P65: PLUNKETT | R65: CHEFFERS | T65: WHITE
A66: CAMBERWELL | C66: QUIRK 2 | E66: CRIPPS 2 | G66: HAFEY 2 | I66: WHITTEN | K66: ELLIS
E67: 28TH APRIL | I67: WEATHER
A68: PRESTON | E68: =C68*6+D68 -> 0 | I68: =G68*6+H68 -> 0 | M68: =K68*6+L68 -> 0 | O68: 16 | P68: 11 | Q68: =O68*6+P68 -> 107 | S68: GEELONG WEST
A69: GEELONG WEST | E69: =C69*6+D69 -> 0 | I69: =G69*6+H69 -> 0 | M69: =K69*6+L69 -> 0 | O69: 8 | P69: 8 | Q69: =O69*6+P69 -> 56
A70: BEST PLAYERS
A71: PRESTON | C71: PINFOLD | F71: MURNANE | I71: WADDELL | L71: BROPHY | O71: MUIR | R71: SECCULL
A72: GEELONG WEST | C72: MUELEMAN | F72: L BORRACK | I72: JENNINGS | L72: BROWNING | O72: ARCHDALL | R72: THOM
A73: GOALKICKERS
A74: PRESTON | C74: SECCULL 6 | F74: WADDELL 3 | I74: BROPHY 2 | L74: LANGLEY 2 | N74: WATSON 2 | Q74: HANCOCK
A75: GEELONG WEST | C75: MACKAY 2 | F75: LONG | H75: BONE | J75: L BORRACK | M75: M BORRACK | P75: MULLINS | R75: MUELEMAN
E76: 21ST APRIL | I76: WEATHER
A77: PRAHRAN | E77: =C77*6+D77 -> 0 | I77: =G77*6+H77 -> 0 | M77: =K77*6+L77 -> 0 | O77: 21 | P77: 12 | Q77: =O77*6+P77 -> 138 | S77: TOORAK PARK
A78: SUNSHINE | E78: =C78*6+D78 -> 0 | I78: =G78*6+H78 -> 0 | M78: =K78*6+L78 -> 0 | O78: 9 | P78: 12 | Q78: =O78*6+P78 -> 66
A79: BEST PLAYERS
A80: PRAHRAN | C80: LAMBERT | F80: DYER | I80: BOSCH | L80: ROY JONES | O80: BUTLER | Q80: MCMAHON
A81: SUNSHINE | C81: HOWARD | F81: FERGUSON | I81: RYAN | L81: WAPLING | O81: CROSBIE | Q81: GREGORY
A82: GOALKICKERS
A83: PRAHRAN | C83: KERLEY 5 | E83: BOSCH 4 | G83: PEARSON 3 | I83: DYER 3 | K83: BUTLER 2 | M83: LAMBERT 2 | P83: RICHARDS 2
A84: SUNSHINE | C84: HOWARD 4 | F84: BROPHY 2 | I84: WAPLING | K84: CROSBIE | M84: RYAN
A86: BYE | C86: BRIGHTON-CAULFIELD
A88: ROUND 3 | E88: 20TH APRIL | I88: WEATHER | S88: PLAYED AT
D89: 1ST QTR | H89: 2ND QTR | L89: 3RD QTR | P89: FINAL | S89: CAMBERWELL
A90: CAMBERWELL | E90: =C90*6+D90 -> 0 | I90: =G90*6+H90 -> 0 | M90: =K90*6+L90 -> 0 | O90: 18 | P90: 19 | Q90: =O90*6+P90 -> 127 | S90: UMPIRE | Y90: LADDER | AC90: ROUND | AE90: 3
A91: GEELONG WEST | E91: =C91*6+D91 -> 0 | I91: =G91*6+H91 -> 0 | M91: =K91*6+L91 -> 0 | O91: 8 | P91: 21 | Q91: =O91*6+P91 -> 69
A92: BEST PLAYERS | W92: TEAM | X92: B | Y92: W | Z92: L | AA92: D | AB92: FOR | AC92: AGST | AD92: % | AE92: PTS
A93: CAMBERWELL | C93: WHITTEN | F93: FRIEBERG | I93: PANZIC | K93: O'NEILL | M93: DOUGLAS | P93: HAFEY
A94: GEELONG WEST | C94: MULLINS | F94: HENRY | I94: L BORRACK | L94: COOKE | N94: ARCHDALL | W94: CAMBERWELL | Y94: 2 | Z94: 1 | AA94: 0 | AB94: 315 | AC94: 234 | AD94: =(AB94*100)/AC94 -> 134.61538461538461 | AE94: 8
A95: GOALKICKERS | W95: PRAHRAN | Y95: 2 | Z95: 1 | AA95: 0 | AB95: 283 | AC95: 219 | AD95: =(AB95*100)/AC95 -> 129.22374429223746 | AE95: 8
A96: CAMBERWELL | C96: PANZIC 3 | E96: O'NEILL 3 | G96: HAFEY 3 | I96: ELLIS 3 | K96: RENWOOD 2 | N96: FRIEBERG 2 | Q96: WHITTEN | T96: CRIPPS | W96: PRESTON | Y96: 2 | Z96: 1 | AA96: 0 | AB96: 267 | AC96: 209 | AD96: =(AB96*100)/AC96 -> 127.7511961722488 | AE96: 8
A97: GEELONG WEST | C97: LONG 3 | E97: M BORRACK | H97: HEDLEY | J97: JENNINGS | M97: COOK | O97: ESKRIDGE | W97: WAVERLEY | X97: 1 | Y97: 2 | Z97: 0 | AA97: 0 | AB97: 176 | AC97: 138 | AD97: =(AB97*100)/AC97 -> 127.53623188405797 | AE97: 8
A99: SUNSHINE | E99: =C99*6+D99 -> 0 | I99: =G99*6+H99 -> 0 | M99: =K99*6+L99 -> 0 | O99: 11 | P99: 20 | Q99: =O99*6+P99 -> 86 | S99: SUNSHINE | W99: SUNSHINE | Y99: 2 | Z99: 1 | AA99: 0 | AB99: 243 | AC99: 278 | AD99: =(AB99*100)/AC99 -> 87.410071942446038 | AE99: 8
A100: PRESTON | E100: =C100*6+D100 -> 0 | I100: =G100*6+H100 -> 0 | M100: =K100*6+L100 -> 0 | O100: 11 | P100: 14 | Q100: =O100*6+P100 -> 80 | W100: MORDIALLOC | Y100: 1 | Z100: 2 | AA100: 0 | AB100: 259 | AC100: 241 | AD100: =(AB100*100)/AC100 -> 107.46887966804979 | AE100: 4
A101: BEST PLAYERS | W101: BOX HILL | Y101: 1 | Z101: 2 | AA101: 0 | AB101: 226 | AC101: 274 | AD101: =(AB101*100)/AC101 -> 82.481751824817522 | AE101: 4
A102: SUNSHINE | C102: MURPHY | F102: HOWARD | I102: CROSBIE | L102: LAWRENCE | O102: HEESOM | Q102: SLATTERY | W102: GEELONG WEST | X102: 1 | Y102: 0 | Z102: 2 | AA102: 0 | AB102: 125 | AC102: 234 | AD102: =(AB102*100)/AC102 -> 53.418803418803421 | AE102: 0
A103: PRESTON | C103: PINFOLD | F103: SAYERS | I103: BROPHY | L103: WATSON | O103: MILLAR | Q103: STEWART | W103: BRIGHTON-CAULFIELD | X103: 1 | Y103: 0 | Z103: 2 | AA103: 0 | AB103: 132 | AC103: 250 | AD103: =(AB103*100)/AC103 -> 52.8 | AE103: 0
A104: GOALKICKERS
A105: SUNSHINE | C105: HOWARD 6 | F105: MURPHY 3 | I105: SLATTERY 2
A106: PRESTON | C106: WATSON 4 | F106: LANGLEY 2 | I106: SECCULL 2 | L106: BROPHY 2 | N106: WASLEY
A108: PRAHRAN | E108: =C108*6+D108 -> 0 | I108: =G108*6+H108 -> 0 | M108: =K108*6+L108 -> 0 | O108: 16 | P108: 17 | Q108: =O108*6+P108 -> 113 | S108: TOORAK PARK
A109: BOX HILL | E109: =C109*6+D109 -> 0 | I109: =G109*6+H109 -> 0 | M109: =K109*6+L109 -> 0 | O109: 9 | P109: 3 | Q109: =O109*6+P109 -> 57
A110: BEST PLAYERS
A111: PRAHRAN | C111: ROY JONES | F111: PEARSON | I111: BURGESS | L111: McMAHON | O111: HARRIS | R111: BOSCH
A112: BOX HILL | C112: QUINN | F112: BATES | I112: SALVADO | L112: DUURSMA | O112: BLACKALL | R112: J McLAUGHLIN
A113: GOALKICKERS
A114: PRAHRAN | C114: PEARSON 5 | F114: RICHARDS 4 | I114: DYER 2 | K114: KERLEY 2 | M114: LEAHY | O114: McMAHON | R114: BOSCH
A115: BOX HILL | C115: SALVADO 5 | F115: QUINN 2 | I115: CRAIG 2
A117: MORDIALLOC | E117: =C117*6+D117 -> 0 | I117: =G117*6+H117 -> 0 | M117: =K117*6+L117 -> 0 | O117: 18 | P117: 19 | Q117: =O117*6+P117 -> 127 | S117: PRINCES PARK, CAULFIELD
A118: BRIGHTON-CAULFIELD | E118: =C118*6+D118 -> 0 | I118: =G118*6+H118 -> 0 | M118: =K118*6+L118 -> 0 | O118: 9 | P118: 16 | Q118: =O118*6+P118 -> 70
A119: BEST PLAYERS
A120: MORDIALLOC | C120: ROWE | F120: EVANS | I120: DOUGLAS | L120: FOX | N120: ASHENHURST | R120: HENRY
A121: BRIGHTON-CAULFIELD | C121: POWER | F121: TULLOCH | I121: BESANKO | L121: WILLIAMSON | O121: HARRISON | R121: ROBERTS
A122: GOALKICKERS
A123: MORDIALLOC | C123: POWER 10 | F123: CREED 2 | H123: KAVANAGH 2 | K123: NISBET | M123: HARRISON | P123: WILLIAMSON | S123: TAYLOR
A124: BRIGHTON-CAULFIELD | C124: NICHOLS 2 | F124: GRAY 2 | I124: ROWE | K124: HUGHES | M124: JAMIESON | P124: FULLARTON | S124: DOUGLAS
A126: BYE | C126: WAVERLEY
A128: ROUND 4 | E128: 11TH MAY | I128: WEATHER | S128: PLAYED AT
D129: 1ST QTR | H129: 2ND QTR | L129: 3RD QTR | P129: FINAL | S129: PRESTON
A130: PRESTON | E130: =C130*6+D130 -> 0 | I130: =G130*6+H130 -> 0 | M130: =K130*6+L130 -> 0 | O130: 15 | P130: 11 | Q130: =O130*6+P130 -> 101 | S130: UMPIRE | Y130: LADDER | AC130: ROUND | AE130: 4
A131: WAVERLEY | E131: =C131*6+D131 -> 0 | I131: =G131*6+H131 -> 0 | M131: =K131*6+L131 -> 0 | O131: 13 | P131: 12 | Q131: =O131*6+P131 -> 90
A132: BEST PLAYERS | W132: TEAM | X132: B | Y132: W | Z132: L | AA132: D | AB132: FOR | AC132: AGST | AD132: % | AE132: PTS
A133: PRESTON | C133: BROPHY | F133: SAYERS | I133: LANGLEY | L133: WADDELL | O133: WASLEY | Q133: PINFOLD
A134: WAVERLEY | C134: THOROGOOD | F134: HUDSON | I134: MITHEN | L134: SCOTT | O134: ELLIS | Q134: INNES | W134: PRESTON | Y134: 3 | Z134: 1 | AA134: 0 | AB134: 368 | AC134: 299 | AD134: =(AB134*100)/AC134 -> 123.07692307692308 | AE134: 12
A135: GOALKICKERS | W135: SUNSHINE | Y135: 3 | Z135: 1 | AA135: 0 | AB135: 330 | AC135: 358 | AD135: =(AB135*100)/AC135 -> 92.178770949720672 | AE135: 12
A136: PRESTON | C136: WADDELL 6 | F136: BROPHY 6 | I136: HANCOCK | L136: WASLEY | N136: LANGLEY | W136: CAMBERWELL | X136: 1 | Y136: 2 | Z136: 1 | AA136: 0 | AB136: 315 | AC136: 234 | AD136: =(AB136*100)/AC136 -> 134.61538461538461 | AE136: 8
A137: WAVERLEY | C137: McKINDLAY 6 | F137: WHITFIELD 2 | I137: CRANAGE 2 | L137: TRELOAR 2 | O137: INGWERSON | W137: MORDIALLOC | Y137: 2 | Z137: 2 | AA137: 0 | AB137: 397 | AC137: 328 | AD137: =(AB137*100)/AC137 -> 121.03658536585365 | AE137: 8
A139: BRIGHTON-CAULFIELD | E139: =C139*6+D139 -> 0 | I139: =G139*6+H139 -> 0 | M139: =K139*6+L139 -> 0 | O139: 7 | P139: 14 | Q139: =O139*6+P139 -> 56 | S139: GEELONG WEST | W139: WAVERLEY | X139: 1 | Y139: 2 | Z139: 1 | AA139: 0 | AB139: 266 | AC139: 239 | AD139: =(AB139*100)/AC139 -> 111.29707112970711 | AE139: 8
A140: GEELONG WEST | E140: =C140*6+D140 -> 0 | I140: =G140*6+H140 -> 0 | M140: =K140*6+L140 -> 0 | O140: 6 | P140: 9 | Q140: =O140*6+P140 -> 45 | W140: PRAHRAN | Y140: 2 | Z140: 2 | AA140: 0 | AB140: 370 | AC140: 357 | AD140: =(AB140*100)/AC140 -> 103.64145658263305 | AE140: 8
A141: BEST PLAYERS | W141: BOX HILL | Y141: 1 | Z141: 3 | AA141: 0 | AB141: 306 | AC141: 361 | AD141: =(AB141*100)/AC141 -> 84.764542936288095 | AE141: 4
A142: BRIGHTON-CAULFIELD | C142: ROWE | F142: LAMBERT | I142: ASHENHURST | L142: JAMIESON | O142: FULLARTON | W142: BRIGHTON-CAULFIELD | X142: 1 | Y142: 1 | Z142: 2 | AA142: 0 | AB142: 188 | AC142: 295 | AD142: =(AB142*100)/AC142 -> 63.728813559322035 | AE142: 4
A143: GEELONG WEST | C143: PERRY | F143: HEDLEY | I143: JENNINGS | L143: BORRACK | O143: ARCHDALL | W143: GEELONG WEST | X143: 1 | Y143: 0 | Z143: 3 | AA143: 0 | AB143: 170 | AC143: 290 | AD143: =(AB143*100)/AC143 -> 58.620689655172413 | AE143: 0
A144: GOALKICKERS
A145: BRIGHTON-CAULFIELD | C145: LAMBERT 3 | F145: ROWE | I145: NICHOLS | L145: DUNN | N145: HUNT
A146: GEELONG WEST | C146: PERRY | E146: HEDLEY | H146: LONG | J146: COOKE | L146: BRRACK | N146: MACKAY
A148: SUNSHINE | E148: =C148*6+D148 -> 0 | I148: =G148*6+H148 -> 0 | M148: =K148*6+L148 -> 0 | O148: 12 | P148: 15 | Q148: =O148*6+P148 -> 87 | S148: BOX HILL
A149: BOX HILL | E149: =C149*6+D149 -> 0 | I149: =G149*6+H149 -> 0 | M149: =K149*6+L149 -> 0 | O149: 12 | P149: 8 | Q149: =O149*6+P149 -> 80
A150: BEST PLAYERS
A151: SUNSHINE | C151: MAGILL | F151: HOWARD | I151: CROSBIE | L151: SLATTERY | O151: P FITZGERALD | R151: MURPHY
A152: BOX HILL | C152: SALVADO | F152: P QUINN | I152: BLACKALL | L152: J QUINN | O152: LA ROCHE | R152: GARDINER
A153: GOALKICKERS
A154: SUNSHINE | C154: HOWARD 4 | F154: SLATTERY 2 | I154: MURPHY 2 | L154: M FITZGERALD | O154: WAPLING | Q154: CROSBIE | S154: RYAN
A155: BOX HILL | C155: SALVADO 5 | F155: CRAIG 2 | I155: J QUINN 2 | L155: DUURSMA | N155: LA ROCHE
E156: 12TH MAY | I156: WEATHER
A157: MORDIALLOC | E157: =C157*6+D157 -> 0 | I157: =G157*6+H157 -> 0 | M157: =K157*6+L157 -> 0 | O157: 22 | P157: 6 | Q157: =O157*6+P157 -> 138 | S157: MORDIALLOC
A158: PRAHRAN | E158: =C158*6+D158 -> 0 | I158: =G158*6+H158 -> 0 | M158: =K158*6+L158 -> 0 | O158: 13 | P158: 9 | Q158: =O158*6+P158 -> 87
A159: BEST PLAYERS
A160: MORDIALLOC | C160: BESANKO | F160: POWER | I160: NESBITT | L160: SCAIFE | O160: CREED
A161: PRAHRAN | C161: YOUNG | F161: GLOVER | I161: LAMBERT | L161: BUTLER | O161: STEEL | Q161: ROY JONES
A162: GOALKICKERS
A163: MORDIALLOC | C163: POWER 8 | F163: BESANKO 3 | I163: SCAIFE 3 | K163: NESBITT 2 | M163: CAREY 2 | O163: CREED 2 | Q163: WILSON | T163: HARRISON
A164: PRAHRAN | C164: McMAHON 3 | F164: KERLEY 3 | I164: BOSCH 2 | K164: DYER 2 | M164: R GRAY | P164: 2 SHORT
A166: BYE | C166: CAMBERWELL
A168: ROUND 5 | E168: 18TH MAY | I168: WEATHER | S168: PLAYED AT
D169: 1ST QTR | H169: 2ND QTR | L169: 3RD QTR | P169: FINAL | S169: CAMBERWELL
A170: PRESTON | E170: =C170*6+D170 -> 0 | I170: =G170*6+H170 -> 0 | M170: =K170*6+L170 -> 0 | O170: 9 | P170: 11 | Q170: =O170*6+P170 -> 65 | S170: UMPIRE | Y170: LADDER | AC170: ROUND | AE170: 5
A171: CAMBERWELL | E171: =C171*6+D171 -> 0 | I171: =G171*6+H171 -> 0 | M171: =K171*6+L171 -> 0 | O171: 3 | P171: 8 | Q171: =O171*6+P171 -> 26
A172: BEST PLAYERS | W172: TEAM | X172: B | Y172: W | Z172: L | AA172: D | AB172: FOR | AC172: AGST | AD172: % | AE172: PTS
A173: PRESTON | C173: BROPHY | F173: MURNANE | I173: PINFOLD | L173: SLEEBS | O173: HANCOCK | R173: WASLEY
A174: CAMBERWELL | C174: PANZIC | F174: HAFEY | I174: ELLIS | L174: O'NEILL | O174: RENWOOD | R174: YOUNG | W174: PRESTON | Y174: 4 | Z174: 1 | AA174: 0 | AB174: 433 | AC174: 325 | AD174: =(AB174*100)/AC174 -> 133.23076923076923 | AE174: 16
A175: GOALKICKERS | W175: WAVERLEY | X175: 1 | Y175: 3 | Z175: 1 | AA175: 0 | AB175: 361 | AC175: 301 | AD175: =(AB175*100)/AC175 -> 119.93355481727575 | AE175: 12
A176: PRESTON | C176: DOUGHTY 3 | F176: HANCOCK 2 | I176: BROPHY 2 | L176: SLEEBS | N176: STEWART | W176: PRAHRAN | Y176: 3 | Z176: 2 | AA176: 0 | AB176: 448 | AC176: 393 | AD176: =(AB176*100)/AC176 -> 113.99491094147582 | AE176: 12
A177: CAMBERWELL | C177: RENWOOD 2 | F177: O'NEILL | W177: SUNSHINE | Y177: 3 | Z177: 2 | AA177: 0 | AB177: 392 | AC177: 453 | AD177: =(AB177*100)/AC177 -> 86.534216335540833 | AE177: 12
A179: WAVERLEY | E179: =C179*6+D179 -> 0 | I179: =G179*6+H179 -> 0 | M179: =K179*6+L179 -> 0 | O179: 13 | P179: 17 | Q179: =O179*6+P179 -> 95 | S179: WAVERLEY | W179: MORDIALLOC | X179: 1 | Y179: 2 | Z179: 2 | AA179: 0 | AB179: 397 | AC179: 328 | AD179: =(AB179*100)/AC179 -> 121.03658536585365 | AE179: 8
A180: SUNSHINE | E180: =C180*6+D180 -> 0 | I180: =G180*6+H180 -> 0 | M180: =K180*6+L180 -> 0 | O180: 9 | P180: 8 | Q180: =O180*6+P180 -> 62 | W180: CAMBERWELL | X180: 1 | Y180: 2 | Z180: 2 | AA180: 0 | AB180: 341 | AC180: 299 | AD180: =(AB180*100)/AC180 -> 114.04682274247492 | AE180: 8
A181: BEST PLAYERS | W181: BOX HILL | Y181: 2 | Z181: 3 | AA181: 0 | AB181: 375 | AC181: 403 | AD181: =(AB181*100)/AC181 -> 93.052109181141432 | AE181: 8
A182: WAVERLEY | C182: MITHEN | F182: INGWERSON | I182: McKINDLAY | L182: THOROGOOD | O182: NATION | R182: SMITH | W182: BRIGHTON-CAULFIELD | X182: 1 | Y182: 1 | Z182: 3 | AA182: 0 | AB182: 224 | AC182: 373 | AD182: =(AB182*100)/AC182 -> 60.053619302949059 | AE182: 4
A183: SUNSHINE | C183: CROSBIE | F183: FERGUSON | I183: MURPHY | L183: P FITZGERALD | O183: HOWARD | R183: HENDERSON | W183: GEELONG WEST | X183: 1 | Y183: 0 | Z183: 4 | AA183: 0 | AB183: 212 | AC183: 359 | AD183: =(AB183*100)/AC183 -> 59.052924791086348 | AE183: 0
A184: GOALKICKERS
A185: WAVERLEY | C185: McKINDLAY 4 | F185: INGWERSON 2 | I185: WHITFIELD 2 | L185: SCOTT | N185: SMITH | P185: NATION | R185: TRELOAR | T185: BRENCHLEY
A186: SUNSHINE | C186: M FITZGERALD 2 | G186: HOWARD 2 | J186: MURPHY 2 | M186: SLATTERY | O186: McINTYRE | R186: RYAN
A188: BOX HILL | E188: =C188*6+D188 -> 0 | I188: =G188*6+H188 -> 0 | M188: =K188*6+L188 -> 0 | O188: 10 | P188: 9 | Q188: =O188*6+P188 -> 69 | S188: BOX HILL
A189: GEELONG WEST | E189: =C189*6+D189 -> 0 | I189: =G189*6+H189 -> 0 | M189: =K189*6+L189 -> 0 | O189: 6 | P189: 6 | Q189: =O189*6+P189 -> 42
A190: BEST PLAYERS
A191: BOX HILL | C191: SALVADO | F191: CRAIG | I191: LA ROCHE | L191: QUINN | O191: GARDINER
A192: GEELONG WEST | C192: WILLOUGHBY | F192: PERRY | I192: BONE | L192: LONG | O192: ARCHDALL | R192: BORRACK
A193: GOALKICKERS
A194: BOX HILL | C194: SALVADO 6 | F194: CURRY 2 | I194: CRAIG | K194: BATES
A195: GEELONG WEST | C195: BONE 3 | F195: ARCHDALL 2 | I195: DAVIES
E196: 19TH MAY | I196: WEATHER
A197: PRAHRAN | E197: =C197*6+D197 -> 0 | I197: =G197*6+H197 -> 0 | M197: =K197*6+L197 -> 0 | O197: 11 | P197: 12 | Q197: =O197*6+P197 -> 78 | S197: TOORAK PARK
A198: BRIGHTON-CAULFIELD | E198: =C198*6+D198 -> 0 | I198: =G198*6+H198 -> 0 | M198: =K198*6+L198 -> 0 | O198: 5 | P198: 6 | Q198: =O198*6+P198 -> 36
A199: BEST PLAYERS
A200: PRAHRAN | C200: ROY JONES | F200: BOSCH | I200: LAMBERT | L200: BUTLER | O200: BURGESS
A201: BRIGHTON-CAULFIELD | C201: ROWE | F201: ASHENHURST | I201: LAMBERT | L201: HUNT
A202: GOALKICKERS
A203: PRAHRAN | C203: RICHARDS 4 | F203: PEARSON 3 | I203: BURGESS 2 | L203: BOSCH | N203: DYER
A204: BRIGHTON-CAULFIELD | C204: LAMBERT | F204: DUNN | I204: HUNT | L204: JAMIESON | N204: ROWE
A206: BYE | C206: MORDIALLOC
A208: ROUND 6 | E208: 25TH MAY | I208: WEATHER | S208: PLAYED AT
D209: 1ST QTR | H209: 2ND QTR | L209: 3RD QTR | P209: FINAL | S209: WAVERLEY
A210: WAVERLEY | E210: =C210*6+D210 -> 0 | I210: =G210*6+H210 -> 0 | M210: =K210*6+L210 -> 0 | O210: 12 | P210: 8 | Q210: =O210*6+P210 -> 80 | S210: UMPIRE | Y210: LADDER | AC210: ROUND | AE210: 6
A211: PRAHRAN | E211: =C211*6+D211 -> 0 | I211: =G211*6+H211 -> 0 | M211: =K211*6+L211 -> 0 | O211: 7 | P211: 14 | Q211: =O211*6+P211 -> 56
A212: BEST PLAYERS | W212: TEAM | X212: B | Y212: W | Z212: L | AA212: D | AB212: FOR | AC212: AGST | AD212: % | AE212: PTS
A213: WAVERLEY | C213: SCOTT | F213: BRENCHLEY | I213: INGWERSON | L213: MITHEN | O213: TRELOAR | R213: THOROGOOD
A214: PRAHRAN | C214: RICHARDS | F214: R GRAY | I214: JONES | L214: BUTLER | O214: LAMBERT | R214: BURGESS | W214: PRESTON | X214: 1 | Y214: 4 | Z214: 1 | AA214: 0 | AB214: 433 | AC214: 325 | AD214: =(AB214*100)/AC214 -> 133.23076923076923 | AE214: 16
A215: GOALKICKERS | W215: WAVERLEY | X215: 1 | Y215: 4 | Z215: 1 | AA215: 0 | AB215: 441 | AC215: 357 | AD215: =(AB215*100)/AC215 -> 123.52941176470588 | AE215: 16
A216: WAVERLEY | C216: BRENCHLEY 4 | F216: COLE 3 | I216: INGWERSON 2 | L216: TRELOAR 2 | O216: NATION | W216: SUNSHINE | Y216: 4 | Z216: 2 | AA216: 0 | AB216: 460 | AC216: 484 | AD216: =(AB216*100)/AC216 -> 95.04132231404958 | AE216: 16
A217: PRAHRAN | C217: BUTLER 2 | F217: DYER 2 | I217: PEARSON 2 | L217: BELFORD | W217: MORDIALLOC | X217: 1 | Y217: 3 | Z217: 2 | AA217: 0 | AB217: 479 | AC217: 396 | AD217: =(AB217*100)/AC217 -> 120.95959595959596 | AE217: 12
A219: BOX HILL | E219: =C219*6+D219 -> 0 | I219: =G219*6+H219 -> 0 | M219: =K219*6+L219 -> 0 | O219: 16 | P219: 17 | Q219: =O219*6+P219 -> 113 | S219: PRINCES PARK, CAULFIELD | W219: PRAHRAN | Y219: 3 | Z219: 3 | AA219: 0 | AB219: 504 | AC219: 473 | AD219: =(AB219*100)/AC219 -> 106.553911205074 | AE219: 12
A220: BRIGHTON-CAULFIELD | E220: =C220*6+D220 -> 0 | I220: =G220*6+H220 -> 0 | M220: =K220*6+L220 -> 0 | O220: 11 | P220: 14 | Q220: =O220*6+P220 -> 80 | W220: BOX HILL | Y220: 3 | Z220: 3 | AA220: 0 | AB220: 488 | AC220: 483 | AD220: =(AB220*100)/AC220 -> 101.0351966873706 | AE220: 12
A221: BEST PLAYERS | W221: CAMBERWELL | X221: 1 | Y221: 2 | Z221: 3 | AA221: 0 | AB221: 372 | AC221: 367 | AD221: =(AB221*100)/AC221 -> 101.36239782016349 | AE221: 8
A222: BOX HILL | C222: P QUINN | F222: SALVADO | I222: GARDINER | L222: DUURSMA | O222: LA ROCHE | R222: PLUNKETT | W222: BRIGHTON-CAULFIELD | X222: 1 | Y222: 1 | Z222: 4 | AA222: 0 | AB222: 304 | AC222: 486 | AD222: =(AB222*100)/AC222 -> 62.55144032921811 | AE222: 4
A223: BRIGHTON-CAULFIELD | C223: LAMBERT | F223: ASHENHURST | I223: DUNN | L223: EVANS | O223: POWELL | R223: A MOULE | W223: GEELONG WEST | X223: 1 | Y223: 0 | Z223: 5 | AA223: 0 | AB223: 280 | AC223: 441 | AD223: =(AB223*100)/AC223 -> 63.492063492063494 | AE223: 0
A224: GOALKICKERS
A225: BOX HILL | C225: SALVADO 9 | F225: CRAIG 2 | I225: GARDINER | L225: BARNES | N225: LA ROCHE | Q225: CURRY | S225: J QUINN
A226: BRIGHTON-CAULFIELD | C226: DUNN 3 | E226: POWELL 2 | H226: MOULE 2 | J226: ROWE 2 | L226: MOORE | N226: LAMBERT
E227: 26TH MAY | I227: WEATHER
A228: MORDIALLOC | E228: =C228*6+D228 -> 0 | I228: =G228*6+H228 -> 0 | M228: =K228*6+L228 -> 0 | O228: 11 | P228: 16 | Q228: =O228*6+P228 -> 82 | S228: GEELONG WEST
A229: GEELONG WEST | E229: =C229*6+D229 -> 0 | I229: =G229*6+H229 -> 0 | M229: =K229*6+L229 -> 0 | O229: 9 | P229: 14 | Q229: =O229*6+P229 -> 68
A230: BEST PLAYERS
A231: MORDIALLOC | C231: BESANKO | F231: CAREY | I231: PETRIE | L231: POWER | O231: GASKETT
A232: GEELONG WEST | C232: PERRY | F232: BROWNING | I232: LONG | L232: HEDLEY | O232: HEDT
A233: GOALKICKERS
A234: MORDIALLOC | C234: CAREY 3 | F234: POWER 3 | I234: PETRIE 2 | L234: BESANKO | N234: GASKETT | Q234: TAYLOR
A235: GEELONG WEST | C235: ARCHDALL 2 | F235: TRIBE 2 | I235: HEDLEY 2 | L235: BONE | N235: LONG | P235: PERRY
A237: SUNSHINE | E237: =C237*6+D237 -> 0 | I237: =G237*6+H237 -> 0 | M237: =K237*6+L237 -> 0 | O237: 9 | P237: 14 | Q237: =O237*6+P237 -> 68 | S237: SUNSHINE
A238: CAMBERWELL | E238: =C238*6+D238 -> 0 | I238: =G238*6+H238 -> 0 | M238: =K238*6+L238 -> 0 | O238: 3 | P238: 13 | Q238: =O238*6+P238 -> 31
A239: BEST PLAYERS
A240: SUNSHINE | C240: CROSBIE | F240: HEESOM | I240: RYAN | L240: LAWRENCE | O240: BLACKMAN | R240: WAPLING
A241: CAMBERWELL | C241: HAFEY | F241: WHITTEN | I241: JONES | L241: YOUNG | O241: ADAMS
A242: GOALKICKERS
A243: SUNSHINE | C243: HOWARD 3 | F243: MURPHY 2 | I243: M FITZGERALD | L243: WAPLING | O243: SLATTERY | R243: CHAMLEY
A244: CAMBERWELL | C244: ADAMS | F244: ELLIS | I244: O'NEILL
A246: BYE | C246: PRESTON
A248: ROUND 7 | E248: 1ST JUNE | I248: WEATHER | S248: PLAYED AT
D249: 1ST QTR | H249: 2ND QTR | L249: 3RD QTR | P249: FINAL | S249: CAMBERWELL
A250: WAVERLEY | E250: =C250*6+D250 -> 0 | I250: =G250*6+H250 -> 0 | M250: =K250*6+L250 -> 0 | O250: 11 | P250: 15 | Q250: =O250*6+P250 -> 81 | S250: UMPIRE | Y250: LADDER | AC250: ROUND | AE250: 7
A251: CAMBERWEL | E251: =C251*6+D251 -> 0 | I251: =G251*6+H251 -> 0 | M251: =K251*6+L251 -> 0 | O251: 10 | P251: 13 | Q251: =O251*6+P251 -> 73
A252: BEST PLAYERS | W252: TEAM | X252: B | Y252: W | Z252: L | AA252: D | AB252: FOR | AC252: AGST | AD252: % | AE252: PTS
A253: WAVERLEY | C253: SMITH | F253: SCOTT | I253: McKINDLAY | L253: HUDSON | O253: ELLIS | Q253: LEE
A254: CAMBERWEL | C254: RENWOOD | F254: DOUGLAS | I254: M JONES | L254: YOUNG | O254: HAFEY | Q254: GIBSON | W254: PRESTON | X254: 1 | Y254: 5 | Z254: 1 | AA254: 0 | AB254: 576 | AC254: 381 | AD254: =(AB254*100)/AC254 -> 151.18110236220471 | AE254: 20
A255: GOALKICKERS | W255: WAVERLEY | X255: 1 | Y255: 5 | Z255: 1 | AA255: 0 | AB255: 522 | AC255: 430 | AD255: =(AB255*100)/AC255 -> 121.3953488372093 | AE255: 20
A256: WAVERLEY | C256: SCOTT 3 | F256: INGWERSON 2 | I256: McKINDLAY 2 | L256: COLE 2 | N256: MARTIN | P256: ANGUS | W256: MORDIALLOC | X256: 1 | Y256: 4 | Z256: 2 | AA256: 0 | AB256: 578 | AC256: 441 | AD256: =(AB256*100)/AC256 -> 131.06575963718822 | AE256: 16
A257: CAMBERWEL | C257: RENWOOD 4 | F257: HAFEY 4 | I257: PANZIC | K257: ELLIS | W257: PRAHRAN | Y257: 4 | Z257: 3 | AA257: 0 | AB257: 592 | AC257: 528 | AD257: =(AB257*100)/AC257 -> 112.12121212121212 | AE257: 16
A259: PRESTON | E259: =C259*6+D259 -> 0 | I259: =G259*6+H259 -> 0 | M259: =K259*6+L259 -> 0 | O259: 21 | P259: 17 | Q259: =O259*6+P259 -> 143 | S259: PRESTON | W259: SUNSHINE | X259: 1 | Y259: 4 | Z259: 2 | AA259: 0 | AB259: 460 | AC259: 484 | AD259: =(AB259*100)/AC259 -> 95.04132231404958 | AE259: 16
A260: BRIGHTON-CAULFIELD | E260: =C260*6+D260 -> 0 | I260: =G260*6+H260 -> 0 | M260: =K260*6+L260 -> 0 | O260: 8 | P260: 8 | Q260: =O260*6+P260 -> 56 | W260: BOX HILL | Y260: 3 | Z260: 4 | AA260: 0 | AB260: 533 | AC260: 582 | AD260: =(AB260*100)/AC260 -> 91.580756013745699 | AE260: 12
A261: BEST PLAYERS | W261: CAMBERWELL | X261: 1 | Y261: 2 | Z261: 4 | AA261: 0 | AB261: 375 | AC261: 448 | AD261: =(AB261*100)/AC261 -> 83.705357142857139 | AE261: 8
A262: PRESTON | C262: WADDELL | F262: MURNANE | I262: BOYLE | L262: SAYERS | O262: STEWART | R262: LANGLEY | W262: BRIGHTON-CAULFIELD | X262: 1 | Y262: 1 | Z262: 5 | AA262: 0 | AB262: 360 | AC262: 629 | AD262: =(AB262*100)/AC262 -> 57.233704292527825 | AE262: 4
A263: BRIGHTON-CAULFIELD | C263: ASHENHURST | F263: LAMBERT | I263: FOX | L263: GRAY | O263: QUAYLE | R263: JAMIESON | W263: GEELONG WEST | X263: 1 | Y263: 0 | Z263: 6 | AA263: 0 | AB263: 335 | AC263: 529 | AD263: =(AB263*100)/AC263 -> 63.327032136105863 | AE263: 0
A264: GOALKICKERS | C264: 1 SHORT
A265: PRESTON | C265: WADDELL 6 | F265: MUTIMER 4 | I265: ALEXANDER 2 | L265: LANGLEY 2 | N265: WASLEY 2 | P265: JONES | R265: MILLS | S265: BROPHY | U265: DOUGHTY
A266: BRIGHTON-CAULFIELD | C266: LAMBERT 4 | F266: T MOULE | I266: MOORE | K266: JAMIESON | N266: GRAY
A268: MORDIALLOC | E268: =C268*6+D268 -> 0 | I268: =G268*6+H268 -> 0 | M268: =K268*6+L268 -> 0 | O268: 15 | P268: 9 | Q268: =O268*6+P268 -> 99 | S268: MORDIALLOC
A269: BOX HILL | E269: =C269*6+D269 -> 0 | I269: =G269*6+H269 -> 0 | M269: =K269*6+L269 -> 0 | O269: 6 | P269: 9 | Q269: =O269*6+P269 -> 45
A270: BEST PLAYERS
A271: MORDIALLOC | C271: WILLIS | F271: BESANKO | I271: O'BRIEN | L271: CREED | O271: WILSON | R271: ROBERTS
A272: BOX HILL | C272: P QUINN | F272: SALVADO | I272: GARDINER | L272: BATES | O272: PLUNKETT | R272: HEATLEY
A273: GOALKICKERS
A274: MORDIALLOC | C274: POWER 9 | F274: CREED 2 | I274: CAREY 2 | K274: BESANKO 2
A275: BOX HILL | C275: SALVADO 4 | F275: BATES 2
E276: 2ND JUNE | I276: WEATHER
A277: PRAHRAN | E277: =C277*6+D277 -> 0 | I277: =G277*6+H277 -> 0 | M277: =K277*6+L277 -> 0 | O277: 13 | P277: 10 | Q277: =O277*6+P277 -> 88 | S277: TOORAK PARK
A278: GEELONG WEST | E278: =C278*6+D278 -> 0 | I278: =G278*6+H278 -> 0 | M278: =K278*6+L278 -> 0 | O278: 7 | P278: 13 | Q278: =O278*6+P278 -> 55
A279: BEST PLAYERS
A280: PRAHRAN | C280: BURGESS | F280: ROY JONES | I280: R GRAY | L280: PEARSON | O280: BUTLER | Q280: BELFORD
A281: GEELONG WEST | C281: LONG | F281: PERRY | I281: ARMITAGE | L281: HEDLEY | O281: COOK
A282: GOALKICKERS
A283: PRAHRAN | C283: PEARSON 5 | F283: BOSCH 3 | I283: BUTLER 2 | L283: McMAHON 2 | O283: BURGESS
A284: GEELONG WEST | C284: PERRY 2 | F284: BROWNING 2 | I284: LONG | K284: HEDLEY | M284: BONE
A286: BYE | C286: SUNSHINE
A288: ROUND 8 | E288: 8TH JUNE | I288: WEATHER | S288: PLAYED AT
D289: 1ST QTR | H289: 2ND QTR | L289: 3RD QTR | P289: FINAL | S289: GEELONG WEST
A290: GEELONG WEST | E290: =C290*6+D290 -> 0 | I290: =G290*6+H290 -> 0 | M290: =K290*6+L290 -> 0 | O290: 10 | P290: 14 | Q290: =O290*6+P290 -> 74 | S290: UMPIRE | Y290: LADDER | AC290: ROUND | AE290: 8
A291: SUNSHINE | E291: =C291*6+D291 -> 0 | I291: =G291*6+H291 -> 0 | M291: =K291*6+L291 -> 0 | O291: 6 | P291: 13 | Q291: =O291*6+P291 -> 49
A292: BEST PLAYERS | W292: TEAM | X292: B | Y292: W | Z292: L | AA292: D | AB292: FOR | AC292: AGST | AD292: % | AE292: PTS
A293: GEELONG WEST | C293: THOMAS | F293: LONG | I293: PERRY | L293: JENNINGS | O293: COOK | R293: TRIBE
A294: SUNSHINE | C294: MAGILL | F294: WAPLING | I294: CROSBIE | L294: SLATTERY | O294: P FITZGERALD | R294: McINTYRE | W294: PRESTON | X294: 1 | Y294: 5 | Z294: 2 | AA294: 0 | AB294: 633 | AC294: 453 | AD294: =(AB294*100)/AC294 -> 139.73509933774835 | AE294: 20
A295: GOALKICKERS | W295: WAVERLEY | X295: 1 | Y295: 5 | Z295: 2 | AA295: 0 | AB295: 589 | AC295: 501 | AD295: =(AB295*100)/AC295 -> 117.56487025948104 | AE295: 20
A296: GEELONG WEST | C296: COOK 3 | F296: HEDLEY 3 | I296: MULLINS 2 | L296: PERRY | N296: THOMAS | W296: MORDIALLOC | X296: 1 | Y296: 4 | Z296: 3 | AA296: 0 | AB296: 652 | AC296: 519 | AD296: =(AB296*100)/AC296 -> 125.62620423892101 | AE296: 16
A297: SUNSHINE | C297: RYAN 2 | F297: HOWARD | I297: WAPLING | L297: KEMP | N297: MURPHY | W297: PRAHRAN | X297: 1 | Y297: 4 | Z297: 3 | AA297: 0 | AB297: 592 | AC297: 528 | AD297: =(AB297*100)/AC297 -> 112.12121212121212 | AE297: 16
A299: B'TON/C'FILD | E299: =C299*6+D299 -> 0 | I299: =G299*6+H299 -> 0 | M299: =K299*6+L299 -> 0 | O299: 10 | P299: 11 | Q299: =O299*6+P299 -> 71 | S299: PRINCES PARK, CAULFIELD | W299: BOX HILL | Y299: 4 | Z299: 4 | AA299: 0 | AB299: 605 | AC299: 639 | AD299: =(AB299*100)/AC299 -> 94.67918622848201 | AE299: 16
A300: WAVERLEY | E300: =C300*6+D300 -> 0 | I300: =G300*6+H300 -> 0 | M300: =K300*6+L300 -> 0 | O300: 9 | P300: 13 | Q300: =O300*6+P300 -> 67 | W300: SUNSHINE | X300: 1 | Y300: 4 | Z300: 3 | AA300: 0 | AB300: 509 | AC300: 558 | AD300: =(AB300*100)/AC300 -> 91.218637992831546 | AE300: 16
A301: BEST PLAYERS | W301: CAMBERWELL | X301: 1 | Y301: 3 | Z301: 4 | AA301: 0 | AB301: 453 | AC301: 522 | AD301: =(AB301*100)/AC301 -> 86.781609195402297 | AE301: 12
A302: B'TON/C'FILD | C302: WALSH | F302: NICHOLS | I302: JAMIESON | L302: ROWE | O302: ASHENHURST | W302: BRIGHTON-CAULFIELD | X302: 1 | Y302: 2 | Z302: 5 | AA302: 0 | AB302: 431 | AC302: 696 | AD302: =(AB302*100)/AC302 -> 61.925287356321839 | AE302: 8
A303: WAVERLEY | C303: DONNELLY | F303: HUDSON | I303: McKINDLAY | L303: SMITH | O303: TRELOAR | R303: MARTIN | W303: GEELONG WEST | X303: 1 | Y303: 1 | Z303: 6 | AA303: 0 | AB303: 409 | AC303: 578 | AD303: =(AB303*100)/AC303 -> 70.761245674740479 | AE303: 4
A304: GOALKICKERS
A305: B'TON/C'FILD | C305: JAMIESON 6 | F305: T MOULE 3 | I305: CHANDLER
A306: WAVERLEY | C306: MARTIN 3 | F306: DONNELLY 3 | I306: MCKINDLAY | L306: SCOTT | N306: NASH
E307: 9TH JUNE | I307: WEATHER
A308: CAMBERWELL | E308: =C308*6+D308 -> 0 | I308: =G308*6+H308 -> 0 | M308: =K308*6+L308 -> 0 | O308: 12 | P308: 6 | Q308: =O308*6+P308 -> 78 | S308: MORDIALLOC
A309: MORDIALLOC | E309: =C309*6+D309 -> 0 | I309: =G309*6+H309 -> 0 | M309: =K309*6+L309 -> 0 | O309: 9 | P309: 20 | Q309: =O309*6+P309 -> 74
A310: BEST PLAYERS
A311: CAMBERWELL | C311: YOUNG | F311: WHITTEN | I311: GAUDION | L311: QUIRK | O311: RENWOOD
A312: MORDIALLOC | C312: WILLIAMSON | F312: BESANKO | I312: NESBIT | L312: DEANE | O312: POWER
A313: GOALKICKERS
A314: CAMBERWELL | C314: QUIRK 4 | F314: RENWOOD 3 | I314: PANZIC 3 | L314: HAFEY | N314: McKERNAN
A315: MORDIALLOC | C315: POWER 4 | F315: WILLIAMS 2 | I315: BESANKO 2 | L315: O'BRIEN
E316: 10TH JUNE | I316: WEATHER
A317: BOX HILL | E317: =C317*6+D317 -> 0 | I317: =G317*6+H317 -> 0 | M317: =K317*6+L317 -> 0 | O317: 10 | P317: 12 | Q317: =O317*6+P317 -> 72 | S317: BOX HILL
A318: PRESTON | E318: =C318*6+D318 -> 0 | I318: =G318*6+H318 -> 0 | M318: =K318*6+L318 -> 0 | O318: 7 | P318: 15 | Q318: =O318*6+P318 -> 57
A319: BEST PLAYERS
A320: BOX HILL | C320: SALVADO | F320: CRAIG | I320: PLUNKETT | L320: WHITE | O320: GARDINER | R320: GRIGG
A321: PRESTON | C321: BUSE | F321: JAMES | I321: BOYLE | L321: STEWART | O321: PARRIS | R321: WADDELL
A322: GOALKICKERS
A323: BOX HILL | C323: SALVADO 3 | F323: CRAIG 2 | I323: WHITE 2 | K323: P QUINN | M323: J QUINN | O323: CHEFFERS
A324: PRESTON | C324: MURNANE 2 | F324: WADDELL 2 | I324: PARRIS | K324: STEWART | M324: ALEXANDER
A326: BYE | C326: PRAHRAN
A328: ROUND 9 | E328: 15TH JUNE | I328: WEATHER | S328: PLAYED AT
D329: 1ST QTR | H329: 2ND QTR | L329: 3RD QTR | P329: FINAL | S329: CAMBERWELL
A330: PRAHRAN | E330: =C330*6+D330 -> 0 | I330: =G330*6+H330 -> 0 | M330: =K330*6+L330 -> 0 | O330: 7 | P330: 20 | Q330: =O330*6+P330 -> 62 | S330: UMPIRE | Y330: LADDER | AC330: ROUND | AE330: 9
A331: CAMBERWEL | E331: =C331*6+D331 -> 0 | I331: =G331*6+H331 -> 0 | M331: =K331*6+L331 -> 0 | O331: 5 | P331: 12 | Q331: =O331*6+P331 -> 42
A332: BEST PLAYERS | W332: TEAM | X332: B | Y332: W | Z332: L | AA332: D | AB332: FOR | AC332: AGST | AD332: % | AE332: PTS
A333: PRAHRAN | C333: McMAHON | F333: BELFORD | I333: GLOVER | L333: YOUNG | N333: STEEL | Q333: BURGESS
A334: CAMBERWEL | C334: PANZIC | F334: GEORGE | I334: YOUNG | L334: RENWOOD | N334: WHITTEN | Q334: CRIPPS | W334: PRESTON | X334: 1 | Y334: 6 | Z334: 2 | AA334: 0 | AB334: 700 | AC334: 514 | AD334: =(AB334*100)/AC334 -> 136.18677042801556 | AE334: 24
A335: GOALKICKERS | W335: WAVERLEY | X335: 1 | Y335: 6 | Z335: 2 | AA335: 0 | AB335: 656 | AC335: 564 | AD335: =(AB335*100)/AC335 -> 116.31205673758865 | AE335: 24
A336: PRAHRAN | C336: KERLEY 2 | F336: MCMAHON | I336: BUTLER | K336: W GRAY | M336: GLOVER | O336: PEARSON | W336: PRAHRAN | X336: 1 | Y336: 5 | Z336: 3 | AA336: 0 | AB336: 654 | AC336: 570 | AD336: =(AB336*100)/AC336 -> 114.73684210526316 | AE336: 20
A337: CAMBERWEL | C337: FRIEBERG | F337: McKERNAN | I337: HAFEY | K337: ELLIS | M337: CRIPPS | W337: SUNSHINE | X337: 1 | Y337: 5 | Z337: 3 | AA337: 0 | AB337: 597 | AC337: 598 | AD337: =(AB337*100)/AC337 -> 99.832775919732441 | AE337: 20
A339: WAVERLEY | E339: =C339*6+D339 -> 0 | I339: =G339*6+H339 -> 0 | M339: =K339*6+L339 -> 0 | O339: 8 | P339: 19 | Q339: =O339*6+P339 -> 67 | S339: WAVERLEY | W339: MORDIALLOC | X339: 1 | Y339: 4 | Z339: 4 | AA339: 0 | AB339: 713 | AC339: 586 | AD339: =(AB339*100)/AC339 -> 121.67235494880546 | AE339: 16
A340: GEELONG WEST | E340: =C340*6+D340 -> 0 | I340: =G340*6+H340 -> 0 | M340: =K340*6+L340 -> 0 | O340: 9 | P340: 9 | Q340: =O340*6+P340 -> 63 | W340: BOX HILL | X340: 1 | Y340: 4 | Z340: 4 | AA340: 0 | AB340: 605 | AC340: 639 | AD340: =(AB340*100)/AC340 -> 94.67918622848201 | AE340: 16
A341: BEST PLAYERS | W341: CAMBERWELL | X341: 1 | Y341: 3 | Z341: 5 | AA341: 0 | AB341: 495 | AC341: 584 | AD341: =(AB341*100)/AC341 -> 84.760273972602747 | AE341: 12
A342: WAVERLEY | C342: ANGUS | F342: NATION | I342: SCOTT | L342: THOROGOOD | O342: SMITH | R342: BRENCHLEY | W342: BRIGHTON-CAULFIELD | X342: 1 | Y342: 2 | Z342: 6 | AA342: 0 | AB342: 471 | AC342: 784 | AD342: =(AB342*100)/AC342 -> 60.076530612244895 | AE342: 8
A343: GEELONG WEST | C343: WILLOUGHBY | F343: PERRY | I343: RAWSON | L343: TRIBE | O343: JENNINGS | R343: HEDLEY | W343: GEELONG WEST | X343: 1 | Y343: 1 | Z343: 7 | AA343: 0 | AB343: 472 | AC343: 645 | AD343: =(AB343*100)/AC343 -> 73.178294573643413 | AE343: 4
A344: GOALKICKERS
A345: WAVERLEY | C345: SCOTT 3 | F345: DAVEY 2 | I345: DONNELLY | L345: INGWERSON | O345: McKINDLAY
A346: GEELONG WEST | C346: COOKE 5 | F346: PERRY 2 | I346: HEDLEY | L346: MACKAY
E347: 16TH JUNE | I347: WEATHER
A348: SUNSHINE | E348: =C348*6+D348 -> 0 | I348: =G348*6+H348 -> 0 | M348: =K348*6+L348 -> 0 | O348: 11 | P348: 22 | Q348: =O348*6+P348 -> 88 | S348: SUNSHINE
A349: BRIGHTON-CAULFIELD | E349: =C349*6+D349 -> 0 | I349: =G349*6+H349 -> 0 | M349: =K349*6+L349 -> 0 | O349: 5 | P349: 10 | Q349: =O349*6+P349 -> 40
A350: BEST PLAYERS
A351: SUNSHINE | C351: SLATTERY | F351: TREZISE | I351: CROSBIE | L351: P FITZGERALD | O351: WAPLING | R351: RYAN
A352: BRIGHTON-CAULFIELD | C352: FOX | F352: ASHENHURST | I352: LAMBERT | L352: MOULE | O352: KEENAN
A353: GOALKICKERS
A354: SUNSHINE | C354: MURPHY 3 | F354: HOWARD 2 | I354: WAPLING 2 | L354: CROSBIE 2 | N354: SLATTERY 2
A355: BRIGHTON-CAULFIELD | C355: MOORE 2 | F355: MOULE | I355: LAMBERT | L355: DUNN
A357: PRESTON | E357: =C357*6+D357 -> 0 | I357: =G357*6+H357 -> 0 | M357: =K357*6+L357 -> 0 | O357: 8 | P357: 19 | Q357: =O357*6+P357 -> 67 | S357: PRESTON
A358: MORDIALLOC | E358: =C358*6+D358 -> 0 | I358: =G358*6+H358 -> 0 | M358: =K358*6+L358 -> 0 | O358: 9 | P358: 7 | Q358: =O358*6+P358 -> 61
A359: BEST PLAYERS
A360: PRESTON | C360: BOYLE | F360: DIXON | I360: SAYERS | L360: MUTIMER | O360: JAMES | Q360: ALEXANDER
A361: MORDIALLOC | C361: WILLIAMSON | F361: PORTA | I361: GROVES | L361: O'BRIEN | O361: TULLOCH
A362: GOALKICKERS
A363: PRESTON | C363: MURNANE 2 | F363: MUTIMER 2 | I363: WAPLING | L363: RYAN | N363: APPLEFORD | Q363: STEWART
A364: MORDIALLOC | C364: POWER 2 | F364: O'BRIEN 2 | I364: BESANKO | L364: CAREY | N364: DEANE | P364: CREED | R364: TAYLOR
A366: BYE | C366: BOX HILL
A368: ROUND 10 | E368: 22ND JUNE | I368: WEATHER | S368: PLAYED AT
D369: 1ST QTR | H369: 2ND QTR | L369: 3RD QTR | P369: FINAL | S369: CAMBERWELL
A370: BOX HILL | E370: =C370*6+D370 -> 0 | I370: =G370*6+H370 -> 0 | M370: =K370*6+L370 -> 0 | O370: 7 | P370: 8 | Q370: =O370*6+P370 -> 50 | S370: UMPIRE | Y370: LADDER | AC370: ROUND | AE370: 10
A371: WAVERLEY | E371: =C371*6+D371 -> 0 | I371: =G371*6+H371 -> 0 | M371: =K371*6+L371 -> 0 | O371: 4 | P371: 9 | Q371: =O371*6+P371 -> 33
A372: BEST PLAYERS | W372: TEAM | X372: B | Y372: W | Z372: L | AA372: D | AB372: FOR | AC372: AGST | AD372: % | AE372: PTS
A373: BOX HILL | C373: CHEFFERS | F373: J QUINN | I373: GARDINER | L373: P QUINN | N373: LEHMANN | Q373: CRAIG
A374: WAVERLEY | C374: BRENCHLEY | F374: LEE | I374: INNES | L374: SMITH | N374: MITHEN | Q374: ELLIS | W374: PRESTON | X374: 1 | Y374: 7 | Z374: 2 | AA374: 0 | AB374: 757 | AC374: 562 | AD374: =(AB374*100)/AC374 -> 134.69750889679716 | AE374: 28
A375: GOALKICKERS | W375: WAVERLEY | X375: 1 | Y375: 6 | Z375: 3 | AA375: 0 | AB375: 689 | AC375: 614 | AD375: =(AB375*100)/AC375 -> 112.21498371335505 | AE375: 24
A376: BOX HILL | C376: SALVADO 2 | F376: GARDINER 2 | I376: GRIGG 2 | K376: WITNISH | W376: SUNSHINE | X376: 1 | Y376: 6 | Z376: 3 | AA376: 0 | AB376: 709 | AC376: 671 | AD376: =(AB376*100)/AC376 -> 105.66318926974665 | AE376: 24
A377: WAVERLEY | C377: MARTIN 2 | F377: SMITH | I377: BRENCHLEY | W377: PRAHRAN | X377: 1 | Y377: 5 | Z377: 4 | AA377: 0 | AB377: 702 | AC377: 627 | AD377: =(AB377*100)/AC377 -> 111.96172248803828 | AE377: 20
A379: CAMBERWELL | E379: =C379*6+D379 -> 0 | I379: =G379*6+H379 -> 0 | M379: =K379*6+L379 -> 0 | O379: 13 | P379: 16 | Q379: =O379*6+P379 -> 94 | S379: PRINCES PARK, CAULFIELD | W379: BOX HILL | X379: 1 | Y379: 5 | Z379: 4 | AA379: 0 | AB379: 655 | AC379: 672 | AD379: =(AB379*100)/AC379 -> 97.470238095238102 | AE379: 20
A380: BRIGHTON-CAULFIELD | E380: =C380*6+D380 -> 0 | I380: =G380*6+H380 -> 0 | M380: =K380*6+L380 -> 0 | O380: 9 | P380: 10 | Q380: =O380*6+P380 -> 64 | W380: MORDIALLOC | X380: 1 | Y380: 4 | Z380: 5 | AA380: 0 | AB380: 786 | AC380: 698 | AD380: =(AB380*100)/AC380 -> 112.60744985673352 | AE380: 16
A381: BEST PLAYERS | W381: CAMBERWELL | X381: 1 | Y381: 4 | Z381: 5 | AA381: 0 | AB381: 589 | AC381: 648 | AD381: =(AB381*100)/AC381 -> 90.895061728395063 | AE381: 16
A382: CAMBERWELL | C382: RENWOOD | F382: McKERNAN | I382: DOUGLAS | L382: GEORGE | N382: HAFEY | Q382: PEMBERTON | W382: BRIGHTON-CAULFIELD | X382: 1 | Y382: 2 | Z382: 7 | AA382: 0 | AB382: 535 | AC382: 878 | AD382: =(AB382*100)/AC382 -> 60.933940774487475 | AE382: 8
A383: BRIGHTON-CAULFIELD | C383: MOORE | F383: DUNN | I383: ASHENHURST | L383: POWELL | N383: CHANDLER | Q383: THOMAS | W383: GEELONG WEST | X383: 2 | Y383: 1 | Z383: 7 | AA383: 0 | AB383: 472 | AC383: 645 | AD383: =(AB383*100)/AC383 -> 73.178294573643413 | AE383: 4
A384: GOALKICKERS
A385: CAMBERWELL | C385: RENWOOD 3 | F385: HAFEY 3 | H385: ELLIS 2 | J385: McKERNAN 2 | M385: PANZIC | O385: QUIRK | Q385: ADAMS
A386: BRIGHTON-CAULFIELD | C386: MOORE 3 | F386: LAMBERT 2 | I386: POWELL 2 | L386: DUNN | N386: THOMAS
E387: 23RD JUNE | I387: WEATHER
A388: PRESTON | E388: =C388*6+D388 -> 0 | I388: =G388*6+H388 -> 0 | M388: =K388*6+L388 -> 0 | O388: 8 | P388: 9 | Q388: =O388*6+P388 -> 57 | S388: TOORAK PARK
A389: PRAHRAN | E389: =C389*6+D389 -> 0 | I389: =G389*6+H389 -> 0 | M389: =K389*6+L389 -> 0 | O389: 7 | P389: 6 | Q389: =O389*6+P389 -> 48
A390: BEST PLAYERS
A391: PRESTON | C391: BOYLE | F391: JAMES | I391: DIXON | L391: MURNANE | N391: ALEXANDER | Q391: STEWART
A392: PRAHRAN | C392: D JONES | F392: ROY JONES | I392: YOUNG | L392: ROACH | N392: SEEDY | Q392: LAMBERT
A393: GOALKICKERS
A394: PRESTON | C394: WADDELL 2 | F394: PARRIS 2 | I394: JONES | K394: LANGLEY | M394: RYAN | O394: APPLEFORD
A395: PRAHRAN | C395: RICHARDS 3 | F395: BUTLER | I395: BURGESS | L395: BOSCH | N395: ROACH
E396: 21ST APRIL | I396: WEATHER
A397: SUNSHINE | E397: =C397*6+D397 -> 0 | I397: =G397*6+H397 -> 0 | M397: =K397*6+L397 -> 0 | O397: 16 | P397: 16 | Q397: =O397*6+P397 -> 112 | S397: MORDIALLOC
A398: MORDIALLOC | E398: =C398*6+D398 -> 0 | I398: =G398*6+H398 -> 0 | M398: =K398*6+L398 -> 0 | O398: 11 | P398: 7 | Q398: =O398*6+P398 -> 73
A399: BEST PLAYERS
A400: SUNSHINE | C400: WAPLING | F400: N KEMP | I400: SLATTERY | L400: MAGILL | N400: CROSBIE
A401: MORDIALLOC | C401: WILLIAMSON | F401: NESBIT | I401: KAVANAGH | L401: O'BRIEN
A402: GOALKICKERS
A403: SUNSHINE | C403: WAPLING 7 | F403: N KEMP 5 | I403: MAGILL 2 | L403: CROSBIE | N403: MURPHY
A404: MORDIALLOC | C404: POWER 5 | F404: O'BRIEN 3 | I404: HARRISON | L404: CAREY | N404: NISBET
A406: BYE | C406: GEELONG WEST
A408: ROUND 11 | E408: 29TH JUNE | I408: WEATHER | S408: PLAYED AT
D409: 1ST QTR | H409: 2ND QTR | L409: 3RD QTR | P409: FINAL | S409: CAMBERWELL
A410: BOX HILL | E410: =C410*6+D410 -> 0 | I410: =G410*6+H410 -> 0 | M410: =K410*6+L410 -> 0 | O410: 11 | P410: 22 | Q410: =O410*6+P410 -> 88 | S410: UMPIRE | Y410: LADDER | AC410: ROUND | AE410: 11
A411: CAMBERWELL | E411: =C411*6+D411 -> 0 | I411: =G411*6+H411 -> 0 | M411: =K411*6+L411 -> 0 | O411: 5 | P411: 9 | Q411: =O411*6+P411 -> 39
A412: BEST PLAYERS | W412: TEAM | X412: B | Y412: W | Z412: L | AA412: D | AB412: FOR | AC412: AGST | AD412: % | AE412: PTS
A413: BOX HILL | C413: CRAIG | F413: WITNISH | I413: GARDINER | L413: BATES | O413: P QUINN | R413: WHITE
A414: CAMBERWELL | C414: GIBSON | F414: FRIEBERG | I414: HARMON | L414: HAFEY | O414: WHITTEN | R414: GEORGE | W414: PRESTON | X414: 1 | Y414: 8 | Z414: 2 | AA414: 0 | AB414: 849 | AC414: 600 | AD414: =(AB414*100)/AC414 -> 141.5 | AE414: 32
A415: GOALKICKERS | W415: WAVERLEY | X415: 1 | Y415: 7 | Z415: 3 | AA415: 0 | AB415: 821 | AC415: 658 | AD415: =(AB415*100)/AC415 -> 124.77203647416414 | AE415: 28
A416: BOX HILL | C416: SALVADO 2 | F416: CRAIG 2 | I416: R GRIGG 2 | L416: CHEFFERS 2 | O416: P QUINN | Q416: WITNISH | S416: WHITE | W416: SUNSHINE | X416: 1 | Y416: 7 | Z416: 3 | AA416: 0 | AB416: 809 | AC416: 763 | AD416: =(AB416*100)/AC416 -> 106.02883355176934 | AE416: 28
A417: CAMBERWELL | C417: FRIEBERG 4 | F417: RENWOOD 2 | I417: GIBSON | K417: HAFEY | W417: BOX HILL | X417: 1 | Y417: 6 | Z417: 4 | AA417: 0 | AB417: 743 | AC417: 711 | AD417: =(AB417*100)/AC417 -> 104.50070323488045 | AE417: 24
A419: WAVERLEY | E419: =C419*6+D419 -> 0 | I419: =G419*6+H419 -> 0 | M419: =K419*6+L419 -> 0 | O419: 19 | P419: 18 | Q419: =O419*6+P419 -> 132 | S419: WAVERLEY | W419: PRAHRAN | X419: 1 | Y419: 5 | Z419: 5 | AA419: 0 | AB419: 794 | AC419: 727 | AD419: =(AB419*100)/AC419 -> 109.21595598349381 | AE419: 20
A420: MORDIALLOC | E420: =C420*6+D420 -> 0 | I420: =G420*6+H420 -> 0 | M420: =K420*6+L420 -> 0 | O420: 5 | P420: 14 | Q420: =O420*6+P420 -> 44 | W420: MORDIALLOC | X420: 1 | Y420: 4 | Z420: 6 | AA420: 0 | AB420: 830 | AC420: 830 | AD420: =(AB420*100)/AC420 -> 100 | AE420: 26
A421: BEST PLAYERS | W421: CAMBERWELL | X421: 1 | Y421: 4 | Z421: 6 | AA421: 0 | AB421: 628 | AC421: 736 | AD421: =(AB421*100)/AC421 -> 85.326086956521735 | AE421: 16
A422: WAVERLEY | C422: SCOTT | F422: BRENCHLEY | I422: NASH | L422: INGWERSON | O422: SMITH | W422: BRIGHTON-CAULFIELD | X422: 2 | Y422: 2 | Z422: 7 | AA422: 0 | AB422: 535 | AC422: 878 | AD422: =(AB422*100)/AC422 -> 60.933940774487475 | AE422: 8
A423: MORDIALLOC | C423: POWER | F423: GROVES | I423: BESANKO | L423: O'BRIEN | O423: WILLIS | W423: GEELONG WEST | X423: 2 | Y423: 1 | Z423: 8 | AA423: 0 | AB423: 510 | AC423: 737 | AD423: =(AB423*100)/AC423 -> 69.199457259158748 | AE423: 4
A424: GOALKICKERS
A425: WAVERLEY | C425: NASH 5 | F425: SCOTT 5 | I425: INGWERSON 3 | L425: CRANAGE 2 | O425: BRENCHLEY | R425: SMAILES | T425: MARTIN | W425: FLINN
A426: MORDIALLOC | C426: POWER 4 | F426: O'BRIEN 2 | I426: CAREY 2 | K426: GROVES
E427: 30TH JUNE | I427: WEATHER
A428: SUNSHINE | E428: =C428*6+D428 -> 0 | I428: =G428*6+H428 -> 0 | M428: =K428*6+L428 -> 0 | O428: 15 | P428: 10 | Q428: =O428*6+P428 -> 100 | S428: SUNSHINE
A429: PRAHRAN | E429: =C429*6+D429 -> 0 | I429: =G429*6+H429 -> 0 | M429: =K429*6+L429 -> 0 | O429: 14 | P429: 8 | Q429: =O429*6+P429 -> 92
A430: BEST PLAYERS
A431: SUNSHINE | C431: SLATTERY | F431: CROSBIE | I431: MAGILL | L431: TREZISE | O431: HENDERSON | R431: WAPLING
A432: PRAHRAN | C432: LAMBERT | F432: STEEL | I432: D JONES | L432: BUTLER | O432: McMAHON | R432: ROY JONES
A433: GOALKICKERS
A434: SUNSHINE | C434: WAPLING 5 | F434: SLATTERY 2 | I434: MURPHY 2 | L434: MAGILL | N434: TREZISE | P434: LAWRENCE | S434: McINTYRE | V434: KEMP | X434: RYAN
A435: PRAHRAN | C435: PEARSON 3 | F435: KERLEY 3 | I435: BUTLER 3 | L435: McMAHON | N435: RICHARDS | Q435: BURGESS | T435: BELFORD | W435: D JONES
A437: PRESTON | E437: =C437*6+D437 -> 0 | I437: =G437*6+H437 -> 0 | M437: =K437*6+L437 -> 0 | O437: 12 | P437: 20 | Q437: =O437*6+P437 -> 92 | S437: PRESTON
A438: GEELONG WEST | E438: =C438*6+D438 -> 0 | I438: =G438*6+H438 -> 0 | M438: =K438*6+L438 -> 0 | O438: 4 | P438: 14 | Q438: =O438*6+P438 -> 38
A439: BEST PLAYERS
A440: PRESTON | C440: MURNANE | F440: JAMES | I440: STEWART | L440: DIXON | O440: BOYLE | R440: ALEXANDER
A441: GEELONG WEST | C441: PERRY | F441: SHERWELL | I441: RAWSON | L441: BROWNING | O441: TRIBE
A442: GOALKICKERS
A443: PRESTON | C443: APPLEFORD 4 | F443: HANCOCK 3 | I443: ALEXANDER 2 | L443: MURNANE | O443: WADDELL | R443: PARRIS
A444: GEELONG WEST | C444: PERRY 2 | F444: BONE | H444: LONG
A446: BYE | C446: BRIGHTON-CAULFIELD
A448: ROUND 12 | E448: 6TH JULY | I448: WEATHER | S448: PLAYED AT
D449: 1ST QTR | H449: 2ND QTR | L449: 3RD QTR | P449: FINAL | S449: GEELONG WEST
A450: GEELONG WEST | E450: =C450*6+D450 -> 0 | I450: =G450*6+H450 -> 0 | M450: =K450*6+L450 -> 0 | O450: 9 | P450: 10 | Q450: =O450*6+P450 -> 64 | S450: UMPIRE | Y450: LADDER | AC450: ROUND | AE450: 12
A451: CAMBERWELL | E451: =C451*6+D451 -> 0 | I451: =G451*6+H451 -> 0 | M451: =K451*6+L451 -> 0 | O451: 8 | P451: 11 | Q451: =O451*6+P451 -> 59
A452: BEST PLAYERS | W452: TEAM | X452: B | Y452: W | Z452: L | AA452: D | AB452: FOR | AC452: AGST | AD452: % | AE452: PTS
A453: GEELONG WEST | C453: McDONALD | F453: BERRY | I453: BROWNING | L453: SOUTHERN
A454: CAMBERWELL | C454: ADAMS | F454: QUIRK | I454: HAFEY | W454: PRESTON | X454: 1 | Y454: 9 | Z454: 2 | AA454: 0 | AB454: 955 | AC454: 627 | AD454: =(AB454*100)/AC454 -> 152.31259968102074 | AE454: 36
A455: GOALKICKERS | W455: WAVERLEY | X455: 2 | Y455: 7 | Z455: 3 | AA455: 0 | AB455: 821 | AC455: 658 | AD455: =(AB455*100)/AC455 -> 124.77203647416414 | AE455: 28
A456: GEELONG WEST | C456: HARDIMAN 2 | F456: McDONALD | I456: MULLINS | K456: HEDLEY | M456: SOUTHERN | Q456: 3 SHORT | W456: SUNSHINE | X456: 1 | Y456: 7 | Z456: 4 | AA456: 0 | AB456: 836 | AC456: 869 | AD456: =(AB456*100)/AC456 -> 96.202531645569621 | AE456: 28
A457: CAMBERWELL | C457: QUIRK 3 | F457: ADAMS | I457: McKERNAN | L457: ELLIS | Q457: 2 SHORT | W457: BOX HILL | X457: 1 | Y457: 6 | Z457: 4 | AA457: 1 | AB457: 815 | AC457: 783 | AD457: =(AB457*100)/AC457 -> 104.08684546615581 | AE457: 26
A459: BOX HILL | E459: =C459*6+D459 -> 0 | I459: =G459*6+H459 -> 0 | M459: =K459*6+L459 -> 0 | O459: 10 | P459: 12 | Q459: =O459*6+P459 -> 72 | S459: BOX HILL | W459: PRAHRAN | X459: 1 | Y459: 5 | Z459: 5 | AA459: 1 | AB459: 866 | AC459: 799 | AD459: =(AB459*100)/AC459 -> 108.38548185231539 | AE459: 22
A460: PRAHRAN | E460: =C460*6+D460 -> 0 | I460: =G460*6+H460 -> 0 | M460: =K460*6+L460 -> 0 | O460: 11 | P460: 6 | Q460: =O460*6+P460 -> 72 | W460: MORDIALLOC | X460: 1 | Y460: 5 | Z460: 6 | AA460: 0 | AB460: 936 | AC460: 855 | AD460: =(AB460*100)/AC460 -> 109.47368421052632 | AE460: 20
A461: BEST PLAYERS | W461: CAMBERWELL | X461: 1 | Y461: 4 | Z461: 7 | AA461: 0 | AB461: 687 | AC461: 800 | AD461: =(AB461*100)/AC461 -> 85.875 | AE461: 16
A462: BOX HILL | C462: WITNISH | F462: J QUINN | W462: GEELONG WEST | X462: 2 | Y462: 2 | Z462: 8 | AA462: 0 | AB462: 574 | AC462: 796 | AD462: =(AB462*100)/AC462 -> 72.110552763819101 | AE462: 8
A463: PRAHRAN | C463: LAMBERT | F463: STEEL | I463: GRAY | W463: BRIGHTON-CAULFIELD | X463: 2 | Y463: 2 | Z463: 8 | AA463: 0 | AB463: 560 | AC463: 984 | AD463: =(AB463*100)/AC463 -> 56.91056910569106 | AE463: 8
A464: GOALKICKERS
A465: BOX HILL | F465: GARDINER | I465: BATES | Q465: 4 SHORT
A466: PRAHRAN | F466: KERLEY 3 | I466: RICHARDS 2 | L466: D JONES | Q466: 5 SHORT
E467: 7TH JULY | I467: WEATHER
A468: PRESTON | E468: =C468*6+D468 -> 0 | I468: =G468*6+H468 -> 0 | M468: =K468*6+L468 -> 0 | O468: 15 | P468: 16 | Q468: =O468*6+P468 -> 106 | S468: PRESTON
A469: SUNSHINE | E469: =C469*6+D469 -> 0 | I469: =G469*6+H469 -> 0 | M469: =K469*6+L469 -> 0 | O469: 3 | P469: 9 | Q469: =O469*6+P469 -> 27
A470: BEST PLAYERS
A471: PRESTON | C471: STEWART | F471: JAMES | I471: PARRIS | L471: MUIR | N471: PINFOLD
A472: SUNSHINE | C472: HENDERSON | F472: SLATTERY | I472: CROSBIE | L472: DIXON
A473: GOALKICKERS
A474: PRESTON | C474: PARRIS 3 | F474: APPLEFORD | I474: JAMES 2 | K474: HANCOCK | M474: WADDELL | Q474: ? SHORT
A475: SUNSHINE | C475: KEMP 2 | F475: WAPLING
A477: MORDIALLOC | E477: =C477*6+D477 -> 0 | I477: =G477*6+H477 -> 0 | M477: =K477*6+L477 -> 0 | O477: 15 | P477: 16 | Q477: =O477*6+P477 -> 106 | S477: MORDIALLOC
A478: BRIGHTON-CAULFIELD | E478: =C478*6+D478 -> 0 | I478: =G478*6+H478 -> 0 | M478: =K478*6+L478 -> 0 | O478: 3 | P478: 7 | Q478: =O478*6+P478 -> 25
A479: BEST PLAYERS
A480: MORDIALLOC | C480: PORTA | F480: NESBIT | I480: BESANKO
A481: BRIGHTON-CAULFIELD | C481: DOUGLAS | F481: POWELL
A482: GOALKICKERS
A483: MORDIALLOC | C483: POWER 4 | F483: NESBIT 3 | I483: O'BRIEN 2/3 | N483: BESANKO | Q483: CAREY | T483: ?SHORT
A484: BRIGHTON-CAULFIELD | C484: DOUGLAS | F484: POWELL | Q484: 1 SHORT
A486: BYE | C486: WAVERLEY
A488: ROUND 13 | E488: 13TH JULY | I488: WEATHER | S488: PLAYED AT
D489: 1ST QTR | H489: 2ND QTR | L489: 3RD QTR | P489: FINAL | S489: WAVERLEY
A490: PRESTON | E490: =C490*6+D490 -> 0 | I490: =G490*6+H490 -> 0 | M490: =K490*6+L490 -> 0 | O490: 10 | P490: 14 | Q490: =O490*6+P490 -> 74 | S490: UMPIRE | Y490: LADDER | AC490: ROUND | AE490: 13
A491: WAVERLEY | E491: =C491*6+D491 -> 0 | I491: =G491*6+H491 -> 0 | M491: =K491*6+L491 -> 0 | O491: 9 | P491: 13 | Q491: =O491*6+P491 -> 67
A492: BEST PLAYERS | W492: TEAM | X492: B | Y492: W | Z492: L | AA492: D | AB492: FOR | AC492: AGST | AD492: % | AE492: PTS
A493: PRESTON | C493: SAYERS | F493: MURNANE | I493: ALEXANDER | L493: MUIR | N493: WADDELL | Q493: STEWART
A494: WAVERLEY | C494: BRENCHLEY | F494: NASH | I494: INGWERSEN | L494: THOROGOOD | O494: NATION | Q494: SMITH | W494: PRESTON | X494: 1 | Y494: 10 | Z494: 2 | AA494: 0 | AB494: 1029 | AC494: 694 | AD494: =(AB494*100)/AC494 -> 148.27089337175792 | AE494: 40
A495: GOALKICKERS | W495: SUNSHINE | X495: 1 | Y495: 8 | Z495: 4 | AA495: 0 | AB495: 856 | AC495: 885 | AD495: =(AB495*100)/AC495 -> 96.723163841807903 | AE495: 32
A496: PRESTON | C496: WADDELL 3 | F496: PARRIS 2 | I496: APPLEFOLD 2 | L496: MURNANE | O496: WATSON | Q496: FORD | W496: WAVERLEY | X496: 2 | Y496: 7 | Z496: 4 | AA496: 0 | AB496: 888 | AC496: 732 | AD496: =(AB496*100)/AC496 -> 121.31147540983606 | AE496: 28
A497: WAVERLEY | C497: NASH 3 | F497: SCOTT | H497: CRANAGE | J497: MITHEN | L497: INGWERSEN | O497: COLE | Q497: BRENCHLEY | W497: PRAHRAN | X497: 1 | Y497: 6 | Z497: 5 | AA497: 1 | AB497: 939 | AC497: 862 | AD497: =(AB497*100)/AC497 -> 108.93271461716937 | AE497: 26
A499: SUNSHINE | E499: =C499*6+D499 -> 0 | I499: =G499*6+H499 -> 0 | M499: =K499*6+L499 -> 0 | O499: 2 | P499: 8 | Q499: =O499*6+P499 -> 20 | S499: SUNSHINE | W499: BOX HILL | X499: 1 | Y499: 6 | Z499: 5 | AA499: 1 | AB499: 831 | AC499: 803 | AD499: =(AB499*100)/AC499 -> 103.48692403486925 | AE499: 26
A500: BOX HILL | E500: =C500*6+D500 -> 0 | I500: =G500*6+H500 -> 0 | M500: =K500*6+L500 -> 0 | O500: 2 | P500: 4 | Q500: =O500*6+P500 -> 16 | W500: MORDIALLOC | X500: 1 | Y500: 5 | Z500: 7 | AA500: 0 | AB500: 999 | AC500: 918 | AD500: =(AB500*100)/AC500 -> 108.82352941176471 | AE500: 20
A501: BEST PLAYERS | W501: CAMBERWELL | X501: 2 | Y501: 4 | Z501: 7 | AA501: 0 | AB501: 687 | AC501: 800 | AD501: =(AB501*100)/AC501 -> 85.875 | AE501: 16
A502: SUNSHINE | C502: P FITZGERALD | F502: MAGILL | I502: DIXON | L502: HOWARD | O502: HEESON | R502: CROSBIE | W502: GEELONG WEST | X502: 2 | Y502: 3 | Z502: 8 | AA502: 0 | AB502: 652 | AC502: 873 | AD502: =(AB502*100)/AC502 -> 74.684994272623143 | AE502: 12
A503: BOX HILL | C503: LEHMANN | F503: CHEFFERS | I503: P QUINN | L503: GARDINER | O503: PLUNKETT | R503: CRAIG | W503: BRIGHTON-CAULFIELD | X503: 2 | Y503: 2 | Z503: 9 | AA503: 0 | AB503: 637 | AC503: 1062 | AD503: =(AB503*100)/AC503 -> 59.981167608286249 | AE503: 8
A504: GOALKICKERS
A505: SUNSHINE | C505: HOWARD | F505: CROSBIE
A506: BOX HILL | C506: ROSS | F506: CRAIG
A508: GEELONG WEST | E508: =C508*6+D508 -> 0 | I508: =G508*6+H508 -> 0 | M508: =K508*6+L508 -> 0 | O508: 11 | P508: 12 | Q508: =O508*6+P508 -> 78 | S508: PRINCES PARK, CAULFIELD
A509: BRIGHTON-CAULFIELD | E509: =C509*6+D509 -> 0 | I509: =G509*6+H509 -> 0 | M509: =K509*6+L509 -> 0 | O509: 11 | P509: 11 | Q509: =O509*6+P509 -> 77
A510: BEST PLAYERS
A511: GEELONG WEST | C511: PERRY | F511: THOM | I511: MUELEMAN | L511: DAVIES | O511: WILLOUGHBY | R511: BROWNING
A512: BRIGHTON-CAULFIELD | C512: POWELL | F512: JAMIESON | I512: KEENAN | L512: THOMAS | O512: ROWE | R512: FOX
A513: GOALKICKERS
A514: GEELONG WEST | C514: McDONALD 3 | F514: COOK 2 | I514: PERRY 2 | K514: DAVIES 2 | M514: ARCHDALL | P514: HARDIMAN
A515: BRIGHTON-CAULFIELD | C515: BEGLEY 3 | F515: POWELL 2 | I515: J MOORE 2 | L515: LAMBERT | N515: KEENAN | P515: JAMIESON | R515: DOUGLAS
A517: PRAHRAN | E517: =C517*6+D517 -> 0 | I517: =G517*6+H517 -> 0 | M517: =K517*6+L517 -> 0 | O517: 10 | P517: 13 | Q517: =O517*6+P517 -> 73 | S517: TOORAK PARK
A518: MORDIALLOC | E518: =C518*6+D518 -> 0 | I518: =G518*6+H518 -> 0 | M518: =K518*6+L518 -> 0 | O518: 9 | P518: 9 | Q518: =O518*6+P518 -> 63
A519: BEST PLAYERS
A520: PRAHRAN | C520: STEEL | F520: BURGESS | I520: RICHARDS | L520: LAMBERT | O520: BELFORD | R520: PEARSON
A521: MORDIALLOC | C521: O'BRIEN | F521: BESANKO | I521: NISBET | L521: PORTER | O521: POWER
A522: GOALKICKERS
A523: PRAHRAN | C523: BENETTO 2 | F523: BUTLER 2 | I523: PEARSON 2 | L523: RICHARDS | N523: KERLEY | P523: BURGESS | R523: BELFORD
A524: MORDIALLOC | C524: POWER 3 | F524: O'BRIEN 2 | I524: CAREY 2 | L524: NESBIT | N524: HARRISON
A526: BYE | C526: CAMBERWELL
A528: ROUND 14 | E528: 20TH JULY | I528: WEATHER | S528: PLAYED AT
D529: 1ST QTR | H529: 2ND QTR | L529: 3RD QTR | P529: FINAL | S529: WAVERLEY
A530: WAVERLEY | E530: =C530*6+D530 -> 0 | I530: =G530*6+H530 -> 0 | M530: =K530*6+L530 -> 0 | O530: 7 | P530: 10 | Q530: =O530*6+P530 -> 52 | S530: UMPIRE | Y530: LADDER | AC530: ROUND | AE530: 14
A531: SUNSHINE | E531: =C531*6+D531 -> 0 | I531: =G531*6+H531 -> 0 | M531: =K531*6+L531 -> 0 | O531: 5 | P531: 2 | Q531: =O531*6+P531 -> 32
A532: BEST PLAYERS | W532: TEAM | X532: B | Y532: W | Z532: L | AA532: D | AB532: FOR | AC532: AGST | AD532: % | AE532: PTS
A533: WAVERLEY | C533: NASH | F533: NATION | I533: MITHEN | L533: BRENCHLEY | O533: THOROGOOD | R533: HUDSON
A534: SUNSHINE | C534: HEESOM | F534: CROSBIE | I534: FERGUSON | L534: P FITZGERALD | O534: SLATTERY | R534: HENDERSON | W534: PRESTON | X534: 1 | Y534: 11 | Z534: 2 | AA534: 0 | AB534: 1113 | AC534: 733 | AD534: =(AB534*100)/AC534 -> 151.84174624829467 | AE534: 44
A535: GOALKICKERS | W535: WAVERLEY | X535: 2 | Y535: 8 | Z535: 4 | AA535: 0 | AB535: 940 | AC535: 764 | AD535: =(AB535*100)/AC535 -> 123.03664921465969 | AE535: 32
A536: WAVERLEY | C536: NASH 4 | F536: SCOTT | I536: INGWERSEN | L536: NATION | W536: SUNSHINE | X536: 1 | Y536: 8 | Z536: 5 | AA536: 0 | AB536: 888 | AC536: 937 | AD536: =(AB536*100)/AC536 -> 94.770544290288157 | AE536: 32
A537: SUNSHINE | C537: HOWARD 2 | F537: WAPLING 2 | I537: KEMP | W537: PRAHRAN | X537: 1 | Y537: 7 | Z537: 5 | AA537: 1 | AB537: 1054 | AC537: 916 | AD537: =(AB537*100)/AC537 -> 115.06550218340611 | AE537: 30
A539: PRESTON | E539: =C539*6+D539 -> 0 | I539: =G539*6+H539 -> 0 | M539: =K539*6+L539 -> 0 | O539: 11 | P539: 18 | Q539: =O539*6+P539 -> 84 | S539: PRESTON | W539: BOX HILL | X539: 1 | Y539: 7 | Z539: 5 | AA539: 1 | AB539: 939 | AC539: 864 | AD539: =(AB539*100)/AC539 -> 108.68055555555556 | AE539: 30
A540: CAMBERWELL | E540: =C540*6+D540 -> 0 | I540: =G540*6+H540 -> 0 | M540: =K540*6+L540 -> 0 | O540: 6 | P540: 3 | Q540: =O540*6+P540 -> 39 | W540: MORDIALLOC | X540: 2 | Y540: 5 | Z540: 7 | AA540: 0 | AB540: 999 | AC540: 918 | AD540: =(AB540*100)/AC540 -> 108.82352941176471 | AE540: 20
A541: BEST PLAYERS | W541: CAMBERWELL | X541: 2 | Y541: 4 | Z541: 8 | AA541: 0 | AB541: 726 | AC541: 884 | AD541: =(AB541*100)/AC541 -> 82.126696832579185 | AE541: 16
A542: PRESTON | C542: JAMES | F542: PARRIS | I542: ALEXANDER | L542: MUIR | O542: WADDELL | R542: BUSE | W542: GEELONG WEST | X542: 2 | Y542: 3 | Z542: 9 | AA542: 0 | AB542: 713 | AC542: 981 | AD542: =(AB542*100)/AC542 -> 72.680937818552493 | AE542: 12
A543: CAMBERWELL | C543: DOUGLAS | F543: GAUDION | I543: ELLIS | L543: YOUNG | O543: HARMON | R543: McKERNAN | W543: BRIGHTON-CAULFIELD | X543: 2 | Y543: 2 | Z543: 10 | AA543: 0 | AB543: 691 | AC543: 1177 | AD543: =(AB543*100)/AC543 -> 58.708581138487681 | AE543: 8
A544: GOALKICKERS
A545: PRESTON | C545: ALEXANDER 4 | F545: MURNANE 2 | I545: WADDELL | L545: PARRIS | O545: WATSON | Q545: FORD | S545: STEWART
A546: CAMBERWELL | C546: ELLIS 3 | F546: GAUDION | I546: McKERNAN | L546: QUIRK
A548: BOX HILL | E548: =C548*6+D548 -> 0 | I548: =G548*6+H548 -> 0 | M548: =K548*6+L548 -> 0 | O548: 16 | P548: 12 | Q548: =O548*6+P548 -> 108 | S548: GEELONG WEST
A549: GEELONG WEST | E549: =C549*6+D549 -> 0 | I549: =G549*6+H549 -> 0 | M549: =K549*6+L549 -> 0 | O549: 9 | P549: 7 | Q549: =O549*6+P549 -> 61
A550: BEST PLAYERS
A551: BOX HILL | C551: SALVADO | F551: LA ROCHE | I551: QUINN | L551: BATES | O551: GARDINER | R551: WITNISH
A552: GEELONG WEST | C552: PERRY | F552: McDONALD | I552: TRIBE | L552: DAVIES | O552: MUELEMAN | R552: JENNINGS
A553: GOALKICKERS
A554: BOX HILL | C554: SALVADO 5 | F554: LA ROCHE 3 | I554: QUINN 2 | K554: GARDINER | N554: BATES | P554: CRAIG | R554: D GRIGG | T554: CHEFFERS
A555: GEELONG WEST | C555: McDONALD 5 | F555: PERRY | H555: HEDLEY | J555: DAVIES | L555: MUELEMAN
A557: PRAHRAN | E557: =C557*6+D557 -> 0 | I557: =G557*6+H557 -> 0 | M557: =K557*6+L557 -> 0 | O557: 16 | P557: 19 | Q557: =O557*6+P557 -> 115 | S557: CAULFIELD
A558: BRIGHTON-CAULFIELD | E558: =C558*6+D558 -> 0 | I558: =G558*6+H558 -> 0 | M558: =K558*6+L558 -> 0 | O558: 7 | P558: 12 | Q558: =O558*6+P558 -> 54
A559: BEST PLAYERS
A560: PRAHRAN | C560: LAMBERT | F560: RICHARDS | I560: BENETTO | L560: PEARSON | O560: D JONES
A561: BRIGHTON-CAULFIELD | C561: FOX | F561: THOMAS | I561: HUNT | L561: MOULE | O561: ROWE | Q561: JAMIESON
A562: GOALKICKERS
A563: PRAHRAN | C563: LAMBERT 4 | F563: PEARSON 4 | I563: BELFORD 2 | L563: KERLEY 2 | N563: BURGESS 2 | Q563: BUTLER | T563: ROSS
A564: BRIGHTON-CAULFIELD | C564: LAMBERT 2 | F564: JAMIESON 2 | I564: HUNT 2 | L564: POWELL
A566: BYE | C566: MORDIALLOC
A568: ROUND 15 | E568: 27TH JULY | I568: WEATHER | S568: PLAYED AT
D569: 1ST QTR | H569: 2ND QTR | L569: 3RD QTR | P569: FINAL | S569: TOORAK PARK
A570: WAVERLEY | E570: =C570*6+D570 -> 0 | I570: =G570*6+H570 -> 0 | M570: =K570*6+L570 -> 0 | O570: 12 | P570: 17 | Q570: =O570*6+P570 -> 89 | S570: UMPIRE | Y570: LADDER | AC570: ROUND | AE570: 15
A571: PRAHRAN | E571: =C571*6+D571 -> 0 | I571: =G571*6+H571 -> 0 | M571: =K571*6+L571 -> 0 | O571: 11 | P571: 4 | Q571: =O571*6+P571 -> 70
A572: BEST PLAYERS | W572: TEAM | X572: B | Y572: W | Z572: L | AA572: D | AB572: FOR | AC572: AGST | AD572: % | AE572: PTS
A573: WAVERLEY | C573: MITHEN | F573: SMITH | I573: SMAILES | L573: MARTIN | O573: NATION | R573: NASH
A574: PRAHRAN | C574: ROY JONES | F574: RICHARDS | I574: STEEL | L574: YOUNG | O574: BELFORD | R574: PEARSON | W574: PRESTON | X574: 2 | Y574: 11 | Z574: 2 | AA574: 0 | AB574: 1113 | AC574: 733 | AD574: =(AB574*100)/AC574 -> 151.84174624829467 | AE574: 44
A575: GOALKICKERS | N575: SMAILES | W575: WAVERLEY | X575: 2 | Y575: 9 | Z575: 4 | AA575: 0 | AB575: 1029 | AC575: 834 | AD575: =(AB575*100)/AC575 -> 123.38129496402878 | AE575: 36
A576: WAVERLEY | C576: MARTIN 2 | F576: BRENCHLEY 2 | I576: NATION 2 | K576: SCOTT | M576: CRANAGE | O576: SMITH | Q576: THOROGOOD | T576: NASH | W576: BOX HILL | X576: 1 | Y576: 8 | Z576: 5 | AA576: 1 | AB576: 1001 | AC576: 923 | AD576: =(AB576*100)/AC576 -> 108.45070422535211 | AE576: 34
A577: PRAHRAN | C577: PEARSON 3 | F577: BENNETTO 2 | I577: BUTLER 2 | K577: BELFORD 2 | M577: RICHARDS | P577: KERLEY | W577: SUNSHINE | X577: 1 | Y577: 8 | Z577: 6 | AA577: 0 | AB577: 950 | AC577: 1022 | AD577: =(AB577*100)/AC577 -> 92.954990215264189 | AE577: 32
A579: BOX HILL | E579: =C579*6+D579 -> 0 | I579: =G579*6+H579 -> 0 | M579: =K579*6+L579 -> 0 | O579: 9 | P579: 8 | Q579: =O579*6+P579 -> 62 | S579: BOX HILL | W579: PRAHRAN | X579: 1 | Y579: 7 | Z579: 6 | AA579: 1 | AB579: 1124 | AC579: 1015 | AD579: =(AB579*100)/AC579 -> 110.73891625615764 | AE579: 30
A580: BRIGHTON-CAULFIELD | E580: =C580*6+D580 -> 0 | I580: =G580*6+H580 -> 0 | M580: =K580*6+L580 -> 0 | O580: 8 | P580: 11 | Q580: =O580*6+P580 -> 59 | W580: MORDIALLOC | X580: 2 | Y580: 6 | Z580: 7 | AA580: 0 | AB580: 1129 | AC580: 941 | AD580: =(AB580*100)/AC580 -> 119.97874601487779 | AE580: 24
A581: BEST PLAYERS | W581: CAMBERWELL | X581: 2 | Y581: 5 | Z581: 8 | AA581: 0 | AB581: 811 | AC581: 946 | AD581: =(AB581*100)/AC581 -> 85.729386892177587 | AE581: 20
A582: BOX HILL | C582: WHITE | F582: P QUINN | I582: GARDINER | L582: PLUNKETT | O582: BATES | R582: WITNISH | W582: GEELONG WEST | X582: 2 | Y582: 3 | Z582: 10 | AA582: 0 | AB582: 736 | AC582: 1111 | AD582: =(AB582*100)/AC582 -> 66.246624662466246 | AE582: 12
A583: BRIGHTON-CAULFIELD | C583: JAMIESON | F583: ROWE | I583: FINLAYSON | L583: FOX | O583: DOUGLAS | R583: JONES | W583: BRIGHTON-CAULFIELD | X583: 2 | Y583: 2 | Z583: 11 | AA583: 0 | AB583: 750 | AC583: 1239 | AD583: =(AB583*100)/AC583 -> 60.53268765133172 | AE583: 8
A584: GOALKICKERS
A585: BOX HILL | C585: P QUINN 3 | F585: WHITE 3 | I585: SALVADO 2 | L585: WILDIE
A586: BRIGHTON-CAULFIELD | C586: FOX 4 | F586: NICHOLS | I586: POWELL | L586: MOORE
A588: CAMBERWELL | E588: =C588*6+D588 -> 0 | I588: =G588*6+H588 -> 0 | M588: =K588*6+L588 -> 0 | O588: 12 | P588: 13 | Q588: =O588*6+P588 -> 85 | S588: CAMBERWELL
A589: SUNSHINE | E589: =C589*6+D589 -> 0 | I589: =G589*6+H589 -> 0 | M589: =K589*6+L589 -> 0 | O589: 9 | P589: 8 | Q589: =O589*6+P589 -> 62
A590: BEST PLAYERS
A591: CAMBERWELL | C591: GAUDION | F591: FRIEBERG | I591: McKERNAN | L591: HAFEY | O591: ELLIS | R591: WHITTEN
A592: SUNSHINE | C592: SLATTERY | F592: MAGILL | I592: TREZISE | L592: HOWARD | O592: FERGUSON | R592: HEESOM
A593: GOALKICKERS
A594: CAMBERWELL | C594: WHITTEN 3 | F594: QUIRK 2 | H594: HAFEY 2 | J594: ELLIS 2 | L594: FRIEBERG | N594: GAUDION | Q594: McKERNAN
A595: SUNSHINE | C595: HOWARD 4 | F595: RYAN 2 | H595: MAGILL | J595: SLATTERY | M595: DIXON
A597: MORDIALLOC | E597: =C597*6+D597 -> 0 | I597: =G597*6+H597 -> 0 | M597: =K597*6+L597 -> 0 | O597: 18 | P597: 22 | Q597: =O597*6+P597 -> 130 | S597: PRESTON
A598: GEELONG WEST | E598: =C598*6+D598 -> 0 | I598: =G598*6+H598 -> 0 | M598: =K598*6+L598 -> 0 | O598: 2 | P598: 11 | Q598: =O598*6+P598 -> 23
A599: BEST PLAYERS
A600: MORDIALLOC | C600: NESBIT | F600: BESANKO | I600: POOLEY | L600: MALONEY | O600: POWER
A601: GEELONG WEST | C601: PERRY | F601: ARMITAGE | I601: WILLOUGHBY
A602: GOALKICKERS
A603: MORDIALLOC | C603: POWER 4 | F603: CREED 3 | I603: DEANE 3 | K603: NESBIT 3 | M603: O'BRIEN 3 | O603: PORTER | Q603: BESANKO
A604: GEELONG WEST | C604: PERRY | F604: HEDLEY
A606: BYE | C606: PRESTON
A608: ROUND 16 | E608: 3RD AUGUST | I608: WEATHER | S608: PLAYED AT
D609: 1ST QTR | H609: 2ND QTR | L609: 3RD QTR | P609: FINAL | S609: WAVERLEY
A610: WAVERLEY | E610: =C610*6+D610 -> 0 | I610: =G610*6+H610 -> 0 | M610: =K610*6+L610 -> 0 | O610: 22 | P610: 27 | Q610: =O610*6+P610 -> 159 | S610: UMPIRE | Y610: LADDER | AC610: ROUND | AE610: 16
A611: CAMBERWELL | E611: =C611*6+D611 -> 0 | I611: =G611*6+H611 -> 0 | M611: =K611*6+L611 -> 0 | O611: 4 | P611: 4 | Q611: =O611*6+P611 -> 28
A612: BEST PLAYERS | W612: TEAM | X612: B | Y612: W | Z612: L | AA612: D | AB612: FOR | AC612: AGST | AD612: % | AE612: PTS
A613: WAVERLEY | C613: LEE | F613: NATION | I613: BRENCHLEY | L613: MITHEN | O613: CRANAGE | R613: SCOTT
A614: CAMBERWELL | C614: ELLIS | F614: WHITTEN | I614: GAUDION | L614: DOUGLAS | O614: HAFEY | W614: PRESTON | X614: 2 | Y614: 11 | Z614: 3 | AA614: 0 | AB614: 1211 | AC614: 834 | AD614: =(AB614*100)/AC614 -> 145.20383693045562 | AE614: 44
A615: GOALKICKERS | P615: WHITFIELD | W615: WAVERLEY | X615: 2 | Y615: 10 | Z615: 4 | AA615: 0 | AB615: 1188 | AC615: 862 | AD615: =(AB615*100)/AC615 -> 137.81902552204176 | AE615: 40
A616: WAVERLEY | C616: BRENCHLEY 5 | F616: NASH 4 | H616: SCOTT 4 | J616: ANGUS 3 | L616: NATION 2 | N616: CRANAGE | P616: McKINDLAY | S616: MARTIN | W616: BOX HILL | X616: 1 | Y616: 9 | Z616: 5 | AA616: 1 | AB616: 1171 | AC616: 979 | AD616: =(AB616*100)/AC616 -> 119.61184882533198 | AE616: 38
A617: CAMBERWELL | C617: QUIRK 2 | F617: QUINN | I617: ELLIS | W617: PRAHRAN | X617: 1 | Y617: 8 | Z617: 6 | AA617: 1 | AB617: 1209 | AC617: 1055 | AD617: =(AB617*100)/AC617 -> 114.59715639810426 | AE617: 34
A619: BOX HILL | E619: =C619*6+D619 -> 0 | I619: =G619*6+H619 -> 0 | M619: =K619*6+L619 -> 0 | O619: 9 | P619: 16 | Q619: =O619*6+P619 -> 70 | S619: BOX HILL | W619: SUNSHINE | X619: 2 | Y619: 8 | Z619: 6 | AA619: 0 | AB619: 950 | AC619: 1022 | AD619: =(AB619*100)/AC619 -> 92.954990215264189 | AE619: 32
A620: MORDIALLOC | E620: =C620*6+D620 -> 0 | I620: =G620*6+H620 -> 0 | M620: =K620*6+L620 -> 0 | O620: 8 | P620: 8 | Q620: =O620*6+P620 -> 56 | W620: MORDIALLOC | X620: 2 | Y620: 6 | Z620: 8 | AA620: 0 | AB620: 1185 | AC620: 1011 | AD620: =(AB620*100)/AC620 -> 117.2106824925816 | AE620: 24
A621: BEST PLAYERS | W621: CAMBERWELL | X621: 2 | Y621: 5 | Z621: 9 | AA621: 0 | AB621: 839 | AC621: 1105 | AD621: =(AB621*100)/AC621 -> 75.927601809954751 | AE621: 20
A622: BOX HILL | C622: P QUINN | F622: SALVADO | I622: GARDINER | L622: M WILDIE | O622: CHEFFERS | W622: GEELONG WEST | X622: 2 | Y622: 3 | Z622: 11 | AA622: 0 | AB622: 776 | AC622: 1196 | AD622: =(AB622*100)/AC622 -> 64.88294314381271 | AE622: 12
A623: MORDIALLOC | C623: BESANKO | F623: WILLIAMS | I623: O'BRIEN | L623: CREED | O623: ROBERTS | R623: NISBETT | W623: BRIGHTON-CAULFIELD | X623: 2 | Y623: 3 | Z623: 11 | AA623: 0 | AB623: 851 | AC623: 1337 | AD623: =(AB623*100)/AC623 -> 63.649962602842187 | AE623: 12
A624: GOALKICKERS
A625: BOX HILL | C625: SALVADO 5 | F625: J QUINN | I625: BATES | K625: P QUINN | M625: GARDINER
A626: MORDIALLOC | C626: O'BRIEN 4 | F626: CREED 2 | I626: NISBET | K626: POOLEY
A628: BRIGHTON-CAULFIELD | E628: =C628*6+D628 -> 0 | I628: =G628*6+H628 -> 0 | M628: =K628*6+L628 -> 0 | O628: 15 | P628: 11 | Q628: =O628*6+P628 -> 101 | S628: PRINCES PARK, CAULFIELD
A629: PRESTON | E629: =C629*6+D629 -> 0 | I629: =G629*6+H629 -> 0 | M629: =K629*6+L629 -> 0 | O629: 14 | P629: 14 | Q629: =O629*6+P629 -> 98
A630: BEST PLAYERS
A631: BRIGHTON-CAULFIELD | C631: ASHENHURST | F631: KEENAN | I631: POWELL | L631: THOMAS | O631: A MOULE | R631: JAMIESON
A632: PRESTON | C632: BOYLE | F632: PINFOLD | I632: WATSON | L632: WADDELL | O632: SAYERS | R632: WASLEY
A633: GOALKICKERS
A634: BRIGHTON-CAULFIELD | C634: POWELL 5 | F634: ASHENHURST 3 | I634: ? 2 | K634: JAMIESON 2 | N634: FOX | P634: NICHOLLS | R634: FINLAYSON
A635: PRESTON | C635: ALEXANDER 4 | F635: WADDELL 3 | I635: WATSON 2 | L635: STEWART | N635: JAMES | P635: APPLEFORD | S635: WASLEY | U635: HANCOCK
E636: 4TH AUGUST | I636: WEATHER
A637: PRAHRAN | E637: =C637*6+D637 -> 0 | I637: =G637*6+H637 -> 0 | M637: =K637*6+L637 -> 0 | O637: 12 | P637: 13 | Q637: =O637*6+P637 -> 85 | S637: GEELONG WEST
A638: GEELONG WEST | E638: =C638*6+D638 -> 0 | I638: =G638*6+H638 -> 0 | M638: =K638*6+L638 -> 0 | O638: 4 | P638: 16 | Q638: =O638*6+P638 -> 40
A639: BEST PLAYERS
A640: PRAHRAN | C640: D JONES | F640: ROY JONES | I640: STEEL | L640: PEARSON | O640: KERLEY | R640: McMAHON
A641: GEELONG WEST | C641: SHERWELL | F641: ELLIOTT | I641: PERRY | L641: HARDIMAN | O641: RAWSON | R641: SOUTHERN
A642: GOALKICKERS
A643: PRAHRAN | C643: PEARSON 4 | F643: KERLEY 3 | I643: BENETTO 2 | L643: RICHARDS | O643: GLOVER | Q643: BELFORD
A644: GEELONG WEST | C644: McDONALD 3 | F644: MULLINS
A646: BYE | C646: SUNSHINE
A648: ROUND 17 | E648: 10TH AUGUST | I648: WEATHER | S648: PLAYED AT
D649: 1ST QTR | H649: 2ND QTR | L649: 3RD QTR | P649: FINAL | S649: CAMBERWELL
A650: MORDIALLOC | E650: =C650*6+D650 -> 0 | I650: =G650*6+H650 -> 0 | M650: =K650*6+L650 -> 0 | O650: 14 | P650: 20 | Q650: =O650*6+P650 -> 104 | S650: UMPIRE | Y650: LADDER | AC650: ROUND | AE650: 17
A651: CAMBERWELL | E651: =C651*6+D651 -> 0 | I651: =G651*6+H651 -> 0 | M651: =K651*6+L651 -> 0 | O651: 10 | P651: 17 | Q651: =O651*6+P651 -> 77
A652: BEST PLAYERS | W652: TEAM | X652: B | Y652: W | Z652: L | AA652: D | AB652: FOR | AC652: AGST | AD652: % | AE652: PTS
A653: MORDIALLOC | C653: O'BRIEN | F653: POOLEY | I653: POWER | L653: BESANKO | O653: WILLIAMS | R653: BALL
A654: CAMBERWELL | C654: WHITTEN | F654: GAUDION | I654: WRIGHT | L654: QUINN | O654: FRIEBERG | W654: PRESTON | X654: 2 | Y654: 12 | Z654: 3 | AA654: 0 | AB654: 1292 | AC654: 864 | AD654: =(AB654*100)/AC654 -> 149.53703703703704 | AE654: 48
A655: GOALKICKERS | W655: WAVERLEY | X655: 2 | Y655: 11 | Z655: 4 | AA655: 0 | AB655: 1312 | AC655: 888 | AD655: =(AB655*100)/AC655 -> 147.74774774774775 | AE655: 44
A656: MORDIALLOC | C656: POWER 6 | F656: POOLEY 2 | I656: NISBET 2 | K656: CAREY | M656: CREED | O656: ROBERTS | Q656: GEHLING | W656: BOX HILL | X656: 1 | Y656: 9 | Z656: 6 | AA656: 1 | AB656: 1202 | AC656: 1060 | AD656: =(AB656*100)/AC656 -> 113.39622641509433 | AE656: 38
A657: CAMBERWELL | C657: HARMON 3 | F657: FRIEBERG 2 | I657: QUIRK 2 | K657: KISS 2 | M657: FRIEBERG | W657: SUNSHINE | X657: 2 | Y657: 9 | Z657: 6 | AA657: 0 | AB657: 1061 | AC657: 1070 | AD657: =(AB657*100)/AC657 -> 99.158878504672899 | AE657: 36
A659: WAVERLEY | E659: =C659*6+D659 -> 0 | I659: =G659*6+H659 -> 0 | M659: =K659*6+L659 -> 0 | O659: 18 | P659: 16 | Q659: =O659*6+P659 -> 124 | S659: WAVERLEY | W659: PRAHRAN | X659: 2 | Y659: 8 | Z659: 6 | AA659: 1 | AB659: 1209 | AC659: 1055 | AD659: =(AB659*100)/AC659 -> 114.59715639810426 | AE659: 34
A660: BRIGHTON-CAULFIELD | E660: =C660*6+D660 -> 0 | I660: =G660*6+H660 -> 0 | M660: =K660*6+L660 -> 0 | O660: 3 | P660: 8 | Q660: =O660*6+P660 -> 26 | W660: MORDIALLOC | X660: 2 | Y660: 7 | Z660: 8 | AA660: 0 | AB660: 1289 | AC660: 1088 | AD660: =(AB660*100)/AC660 -> 118.47426470588235 | AE660: 28
A661: BEST PLAYERS | W661: CAMBERWELL | X661: 2 | Y661: 5 | Z661: 10 | AA661: 0 | AB661: 916 | AC661: 1209 | AD661: =(AB661*100)/AC661 -> 75.765095119933832 | AE661: 20
A662: WAVERLEY | C662: NATION | F662: HUDSON | I662: NASH | L662: LEE | N662: MITHEN | Q662: THOROGOOD | W662: GEELONG WEST | X662: 2 | Y662: 3 | Z662: 12 | AA662: 0 | AB662: 824 | AC662: 1307 | AD662: =(AB662*100)/AC662 -> 63.045141545524103 | AE662: 12
A663: BRIGHTON-CAULFIELD | C663: POWELL | F663: DOUGLAS | I663: ROWE | L663: THOMAS | W663: BRIGHTON-CAULFIELD | X663: 2 | Y663: 3 | Z663: 12 | AA663: 0 | AB663: 877 | AC663: 1461 | AD663: =(AB663*100)/AC663 -> 60.027378507871319 | AE663: 12
A664: GOALKICKERS
A665: WAVERLEY | C665: NASH 5 | F665: SCOTT 4 | I665: NATION 4 | L665: ANGUS 2 | N665: CRANAGE | Q665: McKINDLAY | T665: BRENCHLEY
A666: BRIGHTON-CAULFIELD | C666: NICOL 2 | F666: LAMBERT
A668: PRESTON | E668: =C668*6+D668 -> 0 | I668: =G668*6+H668 -> 0 | M668: =K668*6+L668 -> 0 | O668: 11 | P668: 15 | Q668: =O668*6+P668 -> 81 | S668: PRESTON
A669: BOX HILL | E669: =C669*6+D669 -> 0 | I669: =G669*6+H669 -> 0 | M669: =K669*6+L669 -> 0 | O669: 4 | P669: 8 | Q669: =O669*6+P669 -> 32
A670: BEST PLAYERS
A671: PRESTON | C671: PINFOLD | F671: WASLEY | I671: DIXON | L671: BROPHY | O671: MURNANE
A672: BOX HILL | C672: CRAIG | F672: LA ROCHE | I672: WHITE | L672: ROSS | O672: PLUNKETT
A673: GOALKICKERS
A674: PRESTON | C674: APPLEFORD 3 | F674: BROPHY 2 | I674: HANCOCK 2 | L674: WADDELL | N674: MURNANE | Q674: ALEXANDER | T674: PARRIS
A675: BOX HILL | C675: SALVADO 2 | F675: CRAIG | I675: WHITE
E676: 11TH AUGUST | I676: WEATHER
A677: SUNSHINE | E677: =C677*6+D677 -> 0 | I677: =G677*6+H677 -> 0 | M677: =K677*6+L677 -> 0 | O677: 16 | P677: 15 | Q677: =O677*6+P677 -> 111 | S677: SUNSHINE
A678: GEELONG WEST | E678: =C678*6+D678 -> 0 | I678: =G678*6+H678 -> 0 | M678: =K678*6+L678 -> 0 | O678: 7 | P678: 6 | Q678: =O678*6+P678 -> 48
A679: BEST PLAYERS
A680: SUNSHINE | C680: HEESOM | F680: HOWARD | I680: MAGILL | L680: RYAN | N680: STAFFORD | Q680: McINTYRE
A681: GEELONG WEST | C681: WILLOUGHBY | F681: JENNINGS | I681: PERRY | L681: HARDIMAN | O681: MUELEMAN
A682: GOALKICKERS
A683: SUNSHINE | C683: HOWARD 7 | F683: RYAN 3 | H683: CASEY 2 | J683: MAGILL | L683: P FITZGERALD | O683: McINTYRE | R683: MURPHY
A684: GEELONG WEST | C684: BONE 3 | F684: HARDIMAN | I684: McDONALD | L684: MULLINS | N684: PERRY
A686: BYE | C686: PRAHRAN
A688: ROUND 18 | E688: 17TH AUGUST | I688: WEATHER | S688: PLAYED AT
D689: 1ST QTR | H689: 2ND QTR | L689: 3RD QTR | P689: FINAL | S689: GEELONG WEST
A690: WAVERLEY | E690: =C690*6+D690 -> 0 | I690: =G690*6+H690 -> 0 | M690: =K690*6+L690 -> 0 | O690: 24 | P690: 23 | Q690: =O690*6+P690 -> 167 | S690: UMPIRE | Y690: LADDER | AC690: ROUND | AE690: 18
A691: GEELONG WEST | E691: =C691*6+D691 -> 0 | I691: =G691*6+H691 -> 0 | M691: =K691*6+L691 -> 0 | O691: 10 | P691: 8 | Q691: =O691*6+P691 -> 68
A692: BEST PLAYERS | W692: TEAM | X692: B | Y692: W | Z692: L | AA692: D | AB692: FOR | AC692: AGST | AD692: % | AE692: PTS
A693: WAVERLEY | C693: SCOTT | F693: CRANAGE | I693: McKINDLAY | L693: ELLIS | N693: SMITH | Q693: NATION
A694: GEELONG WEST | C694: HEDLEY | F694: WILLOUGHBY | I694: LONG | L694: HARDIMAN | N694: BAKER | W694: WAVERLEY | X694: 2 | Y694: 12 | Z694: 4 | AA694: 0 | AB694: 1479 | AC694: 956 | AD694: =(AB694*100)/AC694 -> 154.70711297071131 | AE694: 48
A695: GOALKICKERS | M695: SMITH | O695: MARTIN | W695: PRESTON | X695: 2 | Y695: 12 | Z695: 4 | AA695: 0 | AB695: 1390 | AC695: 994 | AD695: =(AB695*100)/AC695 -> 139.8390342052314 | AE695: 48
A696: WAVERLEY | C696: NATION 8 | F696: SCOTT 4 | I696: CRANAGE 3 | L696: ANGUS 2 | N696: MCKINDLAY 2 | Q696: BRENCHLEY 2 | T696: COLE | W696: SUNSHINE | X696: 2 | Y696: 10 | Z696: 6 | AA696: 0 | AB696: 1167 | AC696: 1134 | AD696: =(AB696*100)/AC696 -> 102.91005291005291 | AE696: 40
A697: GEELONG WEST | C697: McDONALD 3 | F697: HEDLEY 2 | I697: LONG | K697: PERRY | M697: ELLIOTT | O697: WILLOUGHBY | R697: BONE | W697: PRAHRAN | X697: 2 | Y697: 9 | Z697: 6 | AA697: 1 | AB697: 1303 | AC697: 1129 | AD697: =(AB697*100)/AC697 -> 115.41186891054031 | AE697: 38
A699: SUNSHINE | E699: =C699*6+D699 -> 0 | I699: =G699*6+H699 -> 0 | M699: =K699*6+L699 -> 0 | O699: 15 | P699: 16 | Q699: =O699*6+P699 -> 106 | S699: PRINCES PARK, CAULFIELD | W699: BOX HILL | X699: 2 | Y699: 9 | Z699: 6 | AA699: 1 | AB699: 1202 | AC699: 1060 | AD699: =(AB699*100)/AC699 -> 113.39622641509433 | AE699: 38
A700: BRIGHTON-CAULFIELD | E700: =C700*6+D700 -> 0 | I700: =G700*6+H700 -> 0 | M700: =K700*6+L700 -> 0 | O700: 8 | P700: 16 | Q700: =O700*6+P700 -> 64 | W700: MORDIALLOC | X700: 2 | Y700: 8 | Z700: 8 | AA700: 0 | AB700: 1419 | AC700: 1186 | AD700: =(AB700*100)/AC700 -> 119.64586846543001 | AE700: 32
A701: BEST PLAYERS | W701: CAMBERWELL | X701: 2 | Y701: 5 | Z701: 11 | AA701: 0 | AB701: 990 | AC701: 1303 | AD701: =(AB701*100)/AC701 -> 75.978511128165778 | AE701: 20
A702: SUNSHINE | C702: HEESOM | F702: CROSBIE | I702: RYAN | L702: HENDERSON | O702: HOWARD | R702: P FITZGERALD | W702: GEELONG WEST | X702: 2 | Y702: 3 | Z702: 13 | AA702: 0 | AB702: 892 | AC702: 1474 | AD702: =(AB702*100)/AC702 -> 60.515603799185889 | AE702: 12
A703: BRIGHTON-CAULFIELD | C703: WALSH | F703: J MOORE | I703: FINLAYSON | L703: DOUGLAS | O703: KEENAN | W703: BRIGHTON-CAULFIELD | X703: 2 | Y703: 3 | Z703: 13 | AA703: 0 | AB703: 941 | AC703: 1567 | AD703: =(AB703*100)/AC703 -> 60.051052967453735 | AE703: 12
A704: GOALKICKERS
A705: SUNSHINE | C705: CROSBIE 6 | F705: HOWARD 4 | I705: MAGILL 2 | L705: CASEY | N705: HEESOM | P705: RYAN
A706: BRIGHTON-CAULFIELD | C706: WALSH 2 | F706: FOX 2 | H706: JAMIESON 2 | K706: ROWE 2
E707: 18TH AUGUST | I707: WEATHER
A708: PRAHRAN | E708: =C708*6+D708 -> 0 | I708: =G708*6+H708 -> 0 | M708: =K708*6+L708 -> 0 | O708: 13 | P708: 16 | Q708: =O708*6+P708 -> 94 | S708: TOORAK PARK
A709: CAMBERWELL | E709: =C709*6+D709 -> 0 | I709: =G709*6+H709 -> 0 | M709: =K709*6+L709 -> 0 | O709: 11 | P709: 8 | Q709: =O709*6+P709 -> 74
A710: BEST PLAYERS
A711: PRAHRAN | C711: STEEL | F711: BENETTO | I711: YOUNG | L711: McMAHON | O711: KERLEY
A712: CAMBERWELL | C712: QUINN | F712: RENWOOD | I712: GAUDION | L712: QUIRK | O712: FRIEBERG
A713: GOALKICKERS
A714: PRAHRAN | C714: BENETTO 4 | F714: KERLEY 4 | I714: PEARSON 2 | L714: RICHARDS | N714: BUTLER | P714: BELFORD
A715: CAMBERWELL | C715: QUINN 3 | F715: QUIRK 3 | I715: ADAMS 2 | L715: FRIEBERG | N715: YOUNG | P715: HAFEY
A717: MORDIALLOC | E717: =C717*6+D717 -> 0 | I717: =G717*6+H717 -> 0 | M717: =K717*6+L717 -> 0 | O717: 19 | P717: 16 | Q717: =O717*6+P717 -> 130 | S717: MORDIALLOC
A718: PRESTON | E718: =C718*6+D718 -> 0 | I718: =G718*6+H718 -> 0 | M718: =K718*6+L718 -> 0 | O718: 14 | P718: 14 | Q718: =O718*6+P718 -> 98
A719: BEST PLAYERS
A720: MORDIALLOC | C720: O'BRIEN | F720: ROBERTS | I720: CASEY | L720: BESANKO | O720: POOLEY
A721: PRESTON | C721: STEWART | F721: BOYLE | I721: PINFOLD | L721: JAMES
A722: GOALKICKERS
A723: MORDIALLOC | C723: POWER 5 | F723: NESBIT 4 | I723: POOLEY 4 | L723: O'BRIEN 3 | N723: PORTA 2 | P723: CARTER
A724: PRESTON | C724: ALEXANDER 4 | F724: JAMES 2 | I724: WADDELL 2 | L724: BROPHY | N724: MURNANE | P724: HEWITT | R724: MUIR | S724: WASLEY | U724: RYAN
A726: BYE | C726: BOX HILL
A727: FINALS
A728: 1ST SEMI | E728: 25TH AUGUST | I728: WEATHER | S728: PLAYED AT
D729: 1ST QTR | H729: 2ND QTR | L729: 3RD QTR | P729: FINAL | S729: TOORAK PARK
A730: PRAHRAN | C730: 0 | D730: 9 | E730: =C730*6+D730 -> 9 | G730: 4 | H730: 15 | I730: =G730*6+H730 -> 39 | K730: 8 | L730: 16 | M730: =K730*6+L730 -> 64 | O730: 17 | P730: 21 | Q730: =O730*6+P730 -> 123 | S730: UMPIRE
A731: SUNSHINE | C731: 3 | D731: 0 | E731: =C731*6+D731 -> 18 | G731: 5 | H731: 2 | I731: =G731*6+H731 -> 32 | K731: 6 | L731: 6 | M731: =K731*6+L731 -> 42 | O731: 8 | P731: 14 | Q731: =O731*6+P731 -> 62 | S731: MCMASTER
A732: BEST PLAYERS
A733: PRAHRAN | C733: STEEL | F733: BURGESS | I733: BELFORD | L733: LAMBERT | O733: ROY JONES | R733: R GRAY
A734: SUNSHINE | C734: CROSBIE | F734: BOWMAN | I734: HOWARD | L734: MAGILL | O734: CHAMLEY | R734: HENDERSON
A735: GOALKICKERS
A736: PRAHRAN | C736: BENETTO 3 | F736: PEARSON 3 | I736: BUTLER | K736: RICHARDS | N736: KERLEY | P736: GLOVER
A737: SUNSHINE | C737: HOWARD 6 | F737: STAFFORD | I737: WAPLING | K737: CROSBIE | M737: RYAN
A739: 2ND SEMI | E739: 1ST SEPTEMBER | I739: WEATHER
A740: WAVERLEY | C740: 4 | D740: 1 | E740: =C740*6+D740 -> 25 | G740: 9 | H740: 6 | I740: =G740*6+H740 -> 60 | K740: 11 | L740: 7 | M740: =K740*6+L740 -> 73 | O740: 13 | P740: 18 | Q740: =O740*6+P740 -> 96 | S740: TOORAK PARK
A741: PRESTON | C741: 3 | D741: 4 | E741: =C741*6+D741 -> 22 | G741: 5 | H741: 4 | I741: =G741*6+H741 -> 34 | K741: 11 | L741: 7 | M741: =K741*6+L741 -> 73 | O741: 9 | P741: 12 | Q741: =O741*6+P741 -> 66 | S741: MANCE
A742: BEST PLAYERS
A743: WAVERLEY | C743: CRANAGE | F743: THOROGOOD | I743: LEE | L743: HUDSON | O743: SCOTT | R743: NATION
A744: PRESTON | C744: STEWART | F744: SAYERS | I744: DIXON | L744: WASLEY | O744: MURNANE | R744: APPLEFORD
A745: GOALKICKERS
A746: WAVERLEY | C746: CRANAGE 4 | F746: BRENCHLEY 2 | I746: SCOTT | K746: ANGUS | M746: MITHEN | O746: INGWERSON | R746: NATION | U746: MARTIN | X746: NASH
A747: PRESTON | C747: STEWART 2 | F747: APPLEFORD 2 | I747: WASLEY 2 | L747: WADDELL 2 | O747: PARRIS | Q747: MUIR | S747: ALEXANDER | W747: HANCOCK
A749: PRELIMINARY | E749: 8TH SEPTEMBER | I749: WEATHER
A750: PRESTON | C750: 3 | D750: 7 | E750: =C750*6+D750 -> 25 | G750: 5 | H750: 11 | I750: =G750*6+H750 -> 41 | K750: 10 | L750: 15 | M750: =K750*6+L750 -> 75 | O750: 14 | P750: 7 | Q750: =O750*6+P750 -> 91 | S750: TOORAK PARK
A751: PRAHRAN | C751: 0 | D751: 0 | E751: =C751*6+D751 -> 0 | G751: 6 | H751: 2 | I751: =G751*6+H751 -> 38 | K751: 7 | L751: 2 | M751: =K751*6+L751 -> 44 | O751: 8 | P751: 12 | Q751: =O751*6+P751 -> 60 | S751: McMASTER
A752: BEST PLAYERS
A753: PRESTON | C753: WADDELL | F753: PINFOLD | I753: MURNANE | L753: DIXON | O753: CATTOGGIO | R753: MILLAR
A754: PRAHRAN | C754: D JONES | F754: ROY JONES | I754: CLOSE | L754: BURGESS | O754: LAMBERT | R754: HARRIS
A755: GOALKICKERS
A756: PRESTON | C756: MURNANE 4 | F756: MILLS 3 | I756: WADDELL 2 | L756: PARRIS 2 | N756: MUIR | P756: WASLEY | R756: DIXON | U756: WHITE
A757: PRAHRAN | C757: PEARSON 3 | F757: KERLEY 3 | I757: BENETTO 2 | L757: STEEL | N757: RICHARDS | Q757: BURGESS
A759: GRAND | E759: 21ST APRIL | I759: WEATHER
A760: PRESTON | C760: 1 | D760: 3 | E760: =C760*6+D760 -> 9 | G760: 5 | H760: 7 | I760: =G760*6+H760 -> 37 | K760: 6 | L760: 9 | M760: =K760*6+L760 -> 45 | O760: 11 | P760: 14 | Q760: =O760*6+P760 -> 80 | S760: TOORAK PARK
A761: WAVERLEY | C761: 3 | D761: 6 | E761: =C761*6+D761 -> 24 | G761: 4 | H761: 7 | I761: =G761*6+H761 -> 31 | K761: 9 | L761: 15 | M761: =K761*6+L761 -> 69 | O761: 9 | P761: 15 | Q761: =O761*6+P761 -> 69 | S761: MANCE
A762: BEST PLAYERS
A763: PRESTON | C763: MURNANE | F763: MILLS | I763: PINFOLD | L763: STEWART | O763: CATTOGGIO | R763: PARRIS
A764: WAVERLEY | C764: INGWERSON | F764: THOROGOOD | I764: ANGUS | L764: ELLIS | O764: GREENWOOD | R764: SCOTT
A765: GOALKICKERS
A766: PRESTON | C766: MILLS 5 | F766: MURNANE 3 | I766: PARRIS 2 | L766: WADDELL
A767: WAVERLEY | C767: McKINDLAY 2 | F767: SCOTT 2 | I767: ANGUS 2 | L767: NATION | N767: NASH | P767: INGWERSON