A1: Victorian Football Association
A2: Season 1963 - Division One
A3: © Copyright Wal Williams | F3: First created: 2 May 2015
A4: Contact: joywalwi at gmail dot com | F4: Last updated: 8 October 2017 | W4: VFA Results and tables - Link to the main index page
A5: You are free to copy this document in whole or part provided that proper acknowledgement is given to the author. All rights reserved.
A7: 1963 V.F.A. | C7: SEASON 1ST DIVISION | CA7: \D | CB7: {GOTO}BJ3~/M{RIGHT 7}{END}{DOWN}~G4~
A8: ROUND 1 | D8: 20TH APRIL | I8: WEATHER | L8: SOUTH WIND | S8: PLAYED AT | CB8: {GOTO}AL3~/M{END}{RIGHT}{END}{DOWN}~P3~
D9: 1ST QTR | H9: 2ND QTR | L9: 3RD QTR | P9: FINAL | S9: MOORABBIN | CB9: {GOTO}BJ23~/M{RIGHT 7}{END}{DOWN}~V4~
A10: MOORABBIN | C10: 3 | D10: 9 | E10: =C10*6+D10 -> 27 | G10: 7 | H10: 11 | I10: =G10*6+H10 -> 53 | K10: 13 | L10: 15 | M10: =K10*6+L10 -> 93 | O10: 13 | P10: 20 | Q10: =O10*6+P10 -> 98 | S10: UMPIRE | X10: LADDER | AB10: ROUND | AD10: 1 | CB10: {GOTO}BJ43~/M{RIGHT 7}{END}{DOWN}~G24~
A11: WILLIAMSTOWN | C11: 1 | D11: 1 | E11: =C11*6+D11 -> 7 | G11: 3 | H11: 2 | I11: =G11*6+H11 -> 20 | K11: 4 | L11: 4 | M11: =K11*6+L11 -> 28 | O11: 7 | P11: 10 | Q11: =O11*6+P11 -> 52 | S11: K MILLER | CB11: {GOTO}AL23~/M{END}{RIGHT}{END}{DOWN}~P23~
A12: BEST PLAYERS | W12: TEAM | X12: W | Y12: L | Z12: D | AA12: FOR | AB12: AGST | AC12: % | AD12: PTS | CB12: {GOTO}BJ63~/M{RIGHT 7}{END}{DOWN}~V24~
A13: MOORABBIN | C13: PERRY | F13: PAPLEY | I13: KERR | L13: BURNS | O13: WHALEBONE | R13: HOY | CB13: {GOTO}BJ83~/M{RIGHT 7}{END}{DOWN}~G44~
A14: WILLIAMSTOWN | C14: WARD | F14: CARMICHAEL | I14: BAMFORD | L14: MAZOURIS | O14: MURPHY | R14: RUSSELL | W14: PORT MELBOURNE | X14: 1 | Y14: 0 | Z14: 0 | AA14: 105 | AB14: 48 | AC14: 218.75 | AD14: 4 | CB14: {GOTO}AL43~/M{END}{RIGHT}{END}{DOWN}~P43~
A15: GOALKICKERS | W15: MOORABBIN | X15: 1 | Y15: 0 | Z15: 0 | AA15: 98 | AB15: 52 | AC15: 188.46153846153845 | AD15: 4 | CB15: {GOTO}BJ103~/M{RIGHT 7}{END}{DOWN}~V44~
A16: MOORABBIN | C16: RYAN 3 | F16: BURNS 3 | I16: KEE 2 | K16: PAPLEY 2 | M16: PERRY | O16: FOX | Q16: WHALEBONE | W16: SANDRINGHAM | X16: 1 | Y16: 0 | Z16: 0 | AA16: 94 | AB16: 50 | AC16: 188 | AD16: 4 | CB16: {GOTO}BJ123~/M{RIGHT 7}{END}{DOWN}~G64~
A17: WILLIAMSTOWN | C17: CLOUGH 3 | F17: FINCH 2 | I17: MAZOURIS | L17: BARNES | W17: DANDENONG | X17: 1 | Y17: 0 | Z17: 0 | AA17: 125 | AB17: 87 | AC17: 143.67816091954023 | AD17: 4 | CB17: {GOTO}AL63~/M{END}{RIGHT}{END}{DOWN}~P63~
CB18: {GOTO}BJ143~/M{RIGHT 7}{END}{DOWN}~V64~
A19: SANDRINGHAM | C19: 1 | D19: 5 | E19: =C19*6+D19 -> 11 | G19: 6 | H19: 8 | I19: =G19*6+H19 -> 44 | K19: 12 | L19: 9 | M19: =K19*6+L19 -> 81 | O19: 14 | P19: 10 | Q19: =O19*6+P19 -> 94 | S19: OAKLEIGH | W19: YARRAVILLE | X19: 1 | Y19: 0 | Z19: 0 | AA19: 97 | AB19: 91 | AC19: 106.5934065934066 | AD19: 4 | CB19: {GOTO}BJ163~/M{RIGHT 7}{END}{DOWN}~G84~
A20: OAKLEIGH | C20: 2 | D20: 1 | E20: =C20*6+D20 -> 13 | G20: 2 | H20: 5 | I20: =G20*6+H20 -> 17 | K20: 3 | L20: 10 | M20: =K20*6+L20 -> 28 | O20: 6 | P20: 14 | Q20: =O20*6+P20 -> 50 | S20: HORNE | W20: COBURG | X20: 0 | Y20: 1 | Z20: 0 | AA20: 91 | AB20: 97 | AC20: 93.814432989690715 | AD20: 0 | CB20: {GOTO}AL83~/M{END}{RIGHT}{END}{DOWN}~P83~
A21: BEST PLAYERS | W21: BRUNSWICK | X21: 0 | Y21: 1 | Z21: 0 | AA21: 87 | AB21: 125 | AC21: 69.6 | AD21: 0 | CB21: {GOTO}BJ183~/M{RIGHT 7}{END}{DOWN}~V84~
A22: SANDRINGHAM | C22: SHRIVES | F22: O'TOOLE | I22: BURNS | L22: POBJOY | O22: KENNEDY | R22: MUTER | W22: OAKLEIGH | X22: 0 | Y22: 1 | Z22: 0 | AA22: 50 | AB22: 94 | AC22: 53.191489361702125 | AD22: 0 | CB22: {GOTO}BJ203~/M{RIGHT 7}{END}{DOWN}~G104~
A23: OAKLEIGH | C23: LOTHIAN | F23: JOINER | I23: DEFTEROUS | L23: JONES | O23: WOODS | R23: McLELLAND | W23: WILLIAMSTOWN | X23: 0 | Y23: 1 | Z23: 0 | AA23: 52 | AB23: 98 | AC23: 53.061224489795919 | AD23: 0 | CB23: {GOTO}AL103~/M{END}{RIGHT}{END}{DOWN}~P103~
A24: GOALKICKERS | W24: NORTHCOTE | X24: 0 | Y24: 1 | Z24: 0 | AA24: 48 | AB24: 105 | AC24: 45.714285714285715 | AD24: 0 | CB24: {GOTO}BJ223~/M{RIGHT 7}{END}{DOWN}~V104~
A25: SANDRINGHAM | C25: BRYAN 4 | F25: O'TOOLE 3 | I25: STRACHAN 2 | L25: BURNS 2 | N25: SHRIVES | Q25: BURKE | S25: GLEESON | CB25: {GOTO}BJ243~/M{RIGHT 7}{END}{DOWN}~G124~
A26: OAKLEIGH | C26: GIBBON 3 | F26: BRAIN 2 | I26: McLELLAND | CB26: {GOTO}AL123~/M{END}{RIGHT}{END}{DOWN}~P123~
E27: 21ST APRIL | J27: WEATHER | N27: FINE | CB27: {GOTO}BJ263~/M{RIGHT 7}{END}{DOWN}~V124~
A28: PORT MELBOURNE | C28: 3 | D28: 4 | E28: =C28*6+D28 -> 22 | G28: 7 | H28: 7 | I28: =G28*6+H28 -> 49 | K28: 11 | L28: 12 | M28: =K28*6+L28 -> 78 | O28: 15 | P28: 15 | Q28: =O28*6+P28 -> 105 | S28: PORT MELBOURNE | CB28: {GOTO}BJ283~/M{RIGHT 7}{END}{DOWN}~G144~
A29: NORTHCOTE | C29: 1 | D29: 3 | E29: =C29*6+D29 -> 9 | G29: 3 | H29: 9 | I29: =G29*6+H29 -> 27 | K29: 4 | L29: 10 | M29: =K29*6+L29 -> 34 | O29: 6 | P29: 12 | Q29: =O29*6+P29 -> 48 | S29: BAIRD | CB29: {GOTO}AL143~/M{END}{RIGHT}{END}{DOWN}~P143~
A30: BEST PLAYERS | CB30: {GOTO}BJ303~/M{RIGHT 7}{END}{DOWN}~V144~
A31: PORT MELBOURNE | C31: BONNETT | F31: TAGGART | I31: MITHEN | L31: PETRUCCO | O31: RENOUF | R31: MITHEN | CB31: {GOTO}BJ323~/M{RIGHT 7}{END}{DOWN}~G164~
A32: NORTHCOTE | C32: SIMPSON | F32: ADAMSON | I32: BEECHER | L32: LANGBORNE | O32: LAVER | R32: BRETHERTON | CB32: {GOTO}AL163~/M{END}{RIGHT}{END}{DOWN}~P163~
A33: GOALKICKERS | CB33: {GOTO}BJ343~/M{RIGHT 7}{END}{DOWN}~V164~
A34: PORT MELBOURNE | C34: BONNETT 9 | F34: TAGGART 4 | I34: MERRETT | L34: PETRUCCO | CB34: {HOME}
A35: NORTHCOTE | C35: LANGBORNE 2 | F35: EASTAWAY | I35: FITZGERALD | L35: AGHAN | N35: TAYLOR
A37: YARRAVILLE | C37: 1 | D37: 1 | E37: =C37*6+D37 -> 7 | G37: 6 | H37: 10 | I37: =G37*6+H37 -> 46 | K37: 8 | L37: 11 | M37: =K37*6+L37 -> 59 | O37: 14 | P37: 13 | Q37: =O37*6+P37 -> 97 | S37: YARRAVILLE
A38: COBURG | C38: 6 | D38: 5 | E38: =C38*6+D38 -> 41 | G38: 7 | H38: 6 | I38: =G38*6+H38 -> 48 | K38: 9 | L38: 9 | M38: =K38*6+L38 -> 63 | O38: 13 | P38: 13 | Q38: =O38*6+P38 -> 91 | S38: McMASTER
A39: BEST PLAYERS
A40: YARRAVILLE | C40: WHITTEN | F40: ORANGE | I40: McGILL | L40: EVANS | O40: MEDDINGS | R40: LAMONT
A41: COBURG | C41: L BRIMACOMBE | F41: SULLIVAN | I41: HICKS | L41: FINDLAY | O41: BYRON | R41: J BRIMACOMBE
A42: GOALKICKERS
A43: YARRAVILLE | C43: EVANS 4 | F43: MEDDINGS 2 | I43: CONNELLY 2 | L43: CLEGG | N43: WHITTEN | P43: RON BROWN | S43: ORANGE | U43: ALLEN | W43: LAMONT
A44: COBURG | C44: L BRIMACOMBE 5 | G44: J BRIMACOMBE 3 | K44: FINDLAY 3 | N44: CARMODY | Q44: BYRON
A46: DANDENONG | C46: 6 | D46: 4 | E46: =C46*6+D46 -> 40 | G46: 9 | H46: 8 | I46: =G46*6+H46 -> 62 | K46: 12 | L46: 12 | M46: =K46*6+L46 -> 84 | O46: 18 | P46: 17 | Q46: =O46*6+P46 -> 125 | S46: BRUNSWICK
A47: BRUNSWICK | C47: 5 | D47: 5 | E47: =C47*6+D47 -> 35 | G47: 8 | H47: 7 | I47: =G47*6+H47 -> 55 | K47: 9 | L47: 10 | M47: =K47*6+L47 -> 64 | O47: 12 | P47: 15 | Q47: =O47*6+P47 -> 87 | S47: MANCE
A48: BEST PLAYERS
A49: DANDENONG | C49: B WATERS | F49: OSBORNE | I49: PETERS | L49: DELANTY | O49: WRIGHT | R49: DINEEN
A50: BRUNSWICK | C50: WHILEY | F50: WATTS | I50: K DILLON | L50: AMBROSE | O50: BRIGLIA | R50: ARTHUR
A51: GOALKICKERS
A52: DANDENONG | C52: WRIGHT 5 | F52: DINEEN 2 | I52: DUNCAN 2 | L52: DELANTY 2 | O52: LITTLE 2 | Q52: OSBORNE 2 | T52: MINOTTI | W52: SHINNERS | X52: WATERS
A53: BRUNSWICK | C53: ARTHUR 5 | F53: K DILLON 2 | I53: BRIGLIA | K53: THORPE | M53: AMBROSE | P53: HAGART | R53: MURRAY
A55: ROUND 2 | E55: 27TH APRIL | J55: WEATHER | N55: SOUTH WIND FINE | S55: PLAYED AT
D56: 1ST QTR | H56: 2ND QTR | L56: 3RD QTR | P56: FINAL | S56: BEACH ROAD
A57: SANDRINGHAM | C57: 1 | D57: 1 | E57: =C57*6+D57 -> 7 | G57: 6 | H57: 10 | I57: =G57*6+H57 -> 46 | K57: 9 | L57: 14 | M57: =K57*6+L57 -> 68 | O57: 13 | P57: 20 | Q57: =O57*6+P57 -> 98 | S57: UMPIRE | X57: LADDER | AB57: ROUND | AD57: 2
A58: MOORABBIN | C58: 5 | D58: 5 | E58: =C58*6+D58 -> 35 | G58: 6 | H58: 6 | I58: =G58*6+H58 -> 42 | K58: 9 | L58: 11 | M58: =K58*6+L58 -> 65 | O58: 12 | P58: 14 | Q58: =O58*6+P58 -> 86 | S58: MANCE
A59: BEST PLAYERS | W59: TEAM | X59: W | Y59: L | Z59: D | AA59: FOR | AB59: AGST | AC59: % | AD59: PTS
A60: SANDRINGHAM | C60: BURKE | F60: POBJOY | I60: MUTER | L60: STRACHAN | O60: DAWSON | R60: BURNS
A61: MOORABBIN | C61: CROSHER | F61: CRAMERI | I61: ROLFE | L61: KERR | O61: RYAN | R61: DALTON | W61: SANDRINGHAM | X61: 2 | Y61: 0 | Z61: 0 | AA61: 192 | AB61: 136 | AC61: 141.1764705882353 | AD61: 8
A62: GOALKICKERS | W62: YARRAVILLE | X62: 2 | Y62: 0 | Z62: 0 | AA62: 186 | AB62: 153 | AC62: 121.56862745098039 | AD62: 8
A63: SANDRINGHAM | C63: DAWSON 5 | F63: BRYAN 2 | I63: SHRIVES 2 | L63: BURNS | N63: BURKE | P63: PAY | Q63: SHEEHAN | W63: PORT MELBOURNE | X63: 1 | Y63: 1 | Z63: 0 | AA63: 201 | AB63: 156 | AC63: 128.84615384615384 | AD63: 4
A64: MOORABBIN | C64: WHALEBONE 4 | F64: RYAN 4 | I64: KEE 2 | L64: BURNS | N64: PAPLEY | W64: MOORABBIN | X64: 1 | Y64: 1 | Z64: 0 | AA64: 184 | AB64: 150 | AC64: 122.66666666666667 | AD64: 4
A66: YARRAVILLE | C66: 4 | D66: 0 | E66: =C66*6+D66 -> 24 | G66: 6 | H66: 8 | I66: =G66*6+H66 -> 44 | K66: 8 | L66: 10 | M66: =K66*6+L66 -> 58 | O66: 12 | P66: 17 | Q66: =O66*6+P66 -> 89 | S66: DANDENONG | W66: DANDENONG | X66: 1 | Y66: 1 | Z66: 0 | AA66: 187 | AB66: 176 | AC66: 106.25 | AD66: 4
A67: DANDENONG | C67: 3 | D67: 3 | E67: =C67*6+D67 -> 21 | G67: 4 | H67: 5 | I67: =G67*6+H67 -> 29 | K67: 9 | L67: 7 | M67: =K67*6+L67 -> 61 | O67: 9 | P67: 8 | Q67: =O67*6+P67 -> 62 | S67: HORNE | W67: COBURG | X67: 1 | Y67: 1 | Z67: 0 | AA67: 199 | AB67: 193 | AC67: 103.10880829015544 | AD67: 4
A68: BEST PLAYERS | W68: BRUNSWICK | X68: 1 | Y68: 1 | Z68: 0 | AA68: 160 | AB68: 192 | AC68: 83.333333333333329 | AD68: 4
A69: YARRAVILLE | C69: VAUTIER | F69: WHITTEN | I69: LAMONT | L69: EVANS | O69: ORANGE | R69: RON BROWN | W69: OAKLEIGH | X69: 1 | Y69: 1 | Z69: 0 | AA69: 127 | AB69: 160 | AC69: 79.375 | AD69: 4
A70: DANDENONG | C70: MINOTTI | F70: SHINNERS | I70: PETERS | L70: PIVETTA | O70: WRIGHT | R70: WATERS | W70: WILLIAMSTOWN | X70: 0 | Y70: 2 | Z70: 0 | AA70: 119 | AB70: 171 | AC70: 69.590643274853804 | AD70: 0
A71: GOALKICKERS | W71: NORTHCOTE | X71: 0 | Y71: 2 | Z71: 0 | AA71: 114 | AB71: 182 | AC71: 62.637362637362635 | AD71: 0
A72: YARRAVILLE | C72: EVANS 3 | E72: WHITTEN 2 | H72: LAMONT 2 | K72: CLEGG | M72: MEDDINGS | O72: ALLEN | Q72: McKENNA | S72: CONNELLY
A73: DANDENONG | C73: MINOTTI 2 | F73: OSBORNE | H73: DELANTY | J73: PETERS | L73: BARRON | N73: WRIGHT | P73: SHINNERS | S73: DINEEN
A75: BRUNSWICK | C75: 2 | D75: 4 | E75: =C75*6+D75 -> 16 | G75: 4 | H75: 6 | I75: =G75*6+H75 -> 30 | K75: 8 | L75: 10 | M75: =K75*6+L75 -> 58 | O75: 10 | P75: 13 | Q75: =O75*6+P75 -> 73 | S75: WILLIAMSTOWN
A76: WILLIAMSTOWN | C76: 3 | D76: 4 | E76: =C76*6+D76 -> 22 | G76: 5 | H76: 9 | I76: =G76*6+H76 -> 39 | K76: 7 | L76: 12 | M76: =K76*6+L76 -> 54 | O76: 8 | P76: 19 | Q76: =O76*6+P76 -> 67 | S76: McMASTER
A77: BEST PLAYERS
A78: BRUNSWICK | C78: STANLEY | F78: AMBROSE | I78: HAGART | L78: WHILEY | O78: WATTS | R78: K DILLON
A79: WILLIAMSTOWN | C79: CARMICHAEL | F79: WARD | I79: TURNER | L79: JAMES | O79: MALONEY | R79: RUSSELL
A80: GOALKICKERS
A81: BRUNSWICK | C81: STANLEY 3 | F81: MURRAY 2 | I81: HAGART | K81: AMBROSE | N81: BIBBY | P81: DENTON | R81: ARTHUR
A82: WILLIAMSTOWN | C82: JAMES 4 | F82: TURNER | H82: HYNES | J82: MURPHY | M82: MAZOURIS
D83: 28TH APRIL | I83: WEATHER
A84: COBURG | C84: 2 | D84: 5 | E84: =C84*6+D84 -> 17 | G84: 5 | H84: 9 | I84: =G84*6+H84 -> 39 | K84: 13 | L84: 13 | M84: =K84*6+L84 -> 91 | O84: 15 | P84: 18 | Q84: =O84*6+P84 -> 108 | S84: COBURG
A85: PORT MELBOURNE | C85: 8 | D85: 3 | E85: =C85*6+D85 -> 51 | G85: 10 | H85: 3 | I85: =G85*6+H85 -> 63 | K85: 13 | L85: 5 | M85: =K85*6+L85 -> 83 | O85: 15 | P85: 6 | Q85: =O85*6+P85 -> 96 | S85: POLLARD
A86: BEST PLAYERS
A87: COBURG | C87: CLEMENTS | F87: J BRIMACOMBE | J87: CARMODY | M87: McDONNELL | P87: HOLCOMBE | S87: MICKLESON
A88: PORT MELBOURNE | C88: MERRETT | F88: FREYER | J88: PETRUCCO | M88: LAWSON | P88: BONNETT | S88: STRAUCH
A89: GOALKICKERS
A90: COBURG | C90: J BRIMACOMBE 4 | G90: CARMODY 3 | J90: ROCHOW 2 | M90: CLEMENTS 2 | P90: L BRIMACOMBE | S90: BYRON | U90: FINDLAY | X90: MICKLSEON
A91: PORT MELBOURNE | C91: BONNETT 5 | F91: MILNER 3 | I91: MERRETT 2 | L91: PETRUCCO 2 | O91: BENNETTI | Q91: MITHEN | S91: TAGGART
A93: OAKLEIGH | C93: 5 | D93: 6 | E93: =C93*6+D93 -> 36 | G93: 7 | H93: 7 | I93: =G93*6+H93 -> 49 | K93: 9 | L93: 8 | M93: =K93*6+L93 -> 62 | O93: 11 | P93: 11 | Q93: =O93*6+P93 -> 77 | S93: NORTHCOTE
A94: NORTHCOTE | C94: 1 | D94: 4 | E94: =C94*6+D94 -> 10 | G94: 5 | H94: 9 | I94: =G94*6+H94 -> 39 | K94: 7 | L94: 10 | M94: =K94*6+L94 -> 52 | O94: 9 | P94: 12 | Q94: =O94*6+P94 -> 66 | S94: MILLEN
A95: BEST PLAYERS
A96: OAKLEIGH | C96: PEAKE | F96: MAUGHAN | I96: JONES | L96: LOTHIAN | O96: SHERIDAN | R96: McLLELLAND
A97: NORTHCOTE | C97: LAVER | F97: GORMAN | I97: EASTAWAY | L97: ADAMSON | O97: AGHAN | R97: OUSLEY
A98: GOALKICKERS
A99: OAKLEIGH | C99: McLAREN 3 | F99: GIBBONS 3 | I99: JONES 2 | K99: SHERIDAN | N99: JEWELL | P99: LOTHIAN
A100: NORTHCOTE | C100: C LANGBORNE 2 | F100: FITZGERALD 2 | I100: ADAMSON | L100: AGHAN | N100: SIMPSON | P100: GASKETT | R100: EASTAWAY
A102: ROUND 3 | D102: 4TH MAY | I102: WEATHER | L102: SOUTH BREEZE DULL | S102: PLAYED AT
D103: 1ST QTR | H103: 2ND QTR | L103: 3RD QTR | P103: FINAL | S103: MOORABBIN
A104: YARRAVILLE | C104: 3 | D104: 0 | E104: =C104*6+D104 -> 18 | G104: 8 | H104: 4 | I104: =G104*6+H104 -> 52 | K104: 10 | L104: 5 | M104: =K104*6+L104 -> 65 | O104: 12 | P104: 8 | Q104: =O104*6+P104 -> 80 | S104: UMPIRE | X104: LADDER | AB104: ROUND | AD104: 3
A105: MOORABBIN | C105: 2 | D105: 4 | E105: =C105*6+D105 -> 16 | G105: 3 | H105: 6 | I105: =G105*6+H105 -> 24 | K105: 6 | L105: 8 | M105: =K105*6+L105 -> 44 | O105: 8 | P105: 8 | Q105: =O105*6+P105 -> 56 | S105: O'NEILL
A106: BEST PLAYERS | W106: TEAM | X106: W | Y106: L | Z106: D | AA106: FOR | AB106: AGST | AC106: % | AD106: PTS
A107: YARRAVILLE | C107: CLEGG | E107: WHITTEN | H107: LAMONT | K107: ALLEN | N107: ORANGE | Q107: BOB BROWN
A108: MOORABBIN | C108: KERR | E108: PAPLEY | H108: BURNS | K108: CRAMERI | N108: HOY | Q108: LESLIE | W108: SANDRINGHAM | X108: 3 | Y108: 0 | Z108: 0 | AA108: 303 | AB108: 222 | AC108: 136.48648648648648 | AD108: 12
A109: GOALKICKERS | W109: YARRAVILLE | X109: 3 | Y109: 0 | Z109: 0 | AA109: 266 | AB109: 209 | AC109: 127.27272727272727 | AD109: 12
A110: YARRAVILLE | C110: EVANS 4 | F110: WHITTEN 3 | I110: ALLEN 2 | K110: RON BROWN 2 | N110: MEDDINGS | W110: PORT MELBOURNE | X110: 2 | Y110: 1 | Z110: 0 | AA110: 272 | AB110: 225 | AC110: 120.88888888888889 | AD110: 8
A111: MOORABBIN | C111: PAPLEY 3 | F111: KERR 2 | I111: RYAN | K111: HASSETT | N111: PERRY | W111: COBURG | X111: 2 | Y111: 1 | Z111: 0 | AA111: 313 | AB111: 281 | AC111: 111.38790035587189 | AD111: 8
A113: PORT MELBOURNE | C113: 3 | D113: 1 | E113: =C113*6+D113 -> 19 | G113: 5 | H113: 5 | I113: =G113*6+H113 -> 35 | K113: 7 | L113: 10 | M113: =K113*6+L113 -> 52 | O113: 9 | P113: 17 | Q113: =O113*6+P113 -> 71 | S113: OAKLEIGH | W113: MOORABBIN | X113: 1 | Y113: 2 | Z113: 0 | AA113: 240 | AB113: 230 | AC113: 104.34782608695652 | AD113: 4
A114: OAKLEIGH | C114: 3 | D114: 1 | E114: =C114*6+D114 -> 19 | G114: 6 | H114: 5 | I114: =G114*6+H114 -> 41 | K114: 7 | L114: 9 | M114: =K114*6+L114 -> 51 | O114: 9 | P114: 15 | Q114: =O114*6+P114 -> 69 | S114: ROWE | W114: DANDENONG | X114: 1 | Y114: 2 | Z114: 0 | AA114: 273 | AB114: 287 | AC114: 95.121951219512198 | AD114: 4
A115: BEST PLAYERS | W115: OAKLEIGH | X115: 1 | Y115: 2 | Z115: 0 | AA115: 196 | AB115: 231 | AC115: 84.848484848484844 | AD115: 4
A116: PORT MELBOURNE | C116: RENOUF | F116: PETRUCCO | I116: STRAUCH | L116: WILLIAMS | O116: BENNETTI | R116: BONNETT | W116: BRUNSWICK | X116: 1 | Y116: 2 | Z116: 0 | AA116: 248 | AB116: 306 | AC116: 81.045751633986924 | AD116: 4
A117: OAKLEIGH | C117: TURNER | F117: YOUNG | I117: JONES | L117: PEAKE | O117: LOTHIAN | R117: JEWELL | W117: NORTHCOTE | X117: 1 | Y117: 2 | Z117: 0 | AA117: 188 | AB117: 251 | AC117: 74.900398406374507 | AD117: 4
A118: GOALKICKERS | W118: WILLIAMSTOWN | X118: 0 | Y118: 3 | Z118: 0 | AA118: 188 | AB118: 245 | AC118: 76.734693877551024 | AD118: 0
A119: PORT MELBOURNE | C119: BONNETT 3 | F119: BENETTI 3 | I119: PETRUCCO 2 | L119: JEFFREY
A120: OAKLEIGH | C120: McLAREN 2 | F120: LOTHIAN 2 | I120: JEWELL 2 | L120: RICCI | N120: SHERIDAN | Q120: MAUGHAN
E121: 5TH MAY | J121: WEATHER | N121: FINE
A122: SANDRINGHAM | C122: 3 | D122: 0 | E122: =C122*6+D122 -> 18 | G122: 8 | H122: 3 | I122: =G122*6+H122 -> 51 | K122: 12 | L122: 4 | M122: =K122*6+L122 -> 76 | O122: 17 | P122: 9 | Q122: =O122*6+P122 -> 111 | S122: DANDENONG
A123: DANDENONG | C123: 3 | D123: 3 | E123: =C123*6+D123 -> 21 | G123: 7 | H123: 5 | I123: =G123*6+H123 -> 47 | K123: 9 | L123: 11 | M123: =K123*6+L123 -> 65 | O123: 12 | P123: 14 | Q123: =O123*6+P123 -> 86 | S123: TREWIN
A124: BEST PLAYERS
A125: SANDRINGHAM | C125: HOAR | F125: CLIFFORD | I125: SHRIVES | L125: BURNS | O125: WEBSTER | R125: DAWSON
A126: DANDENONG | C126: LITTLE | F126: BAPTIST | I126: DINEEN | L126: ABRAHAM | O126: BARRAN | R126: OSBORNE
A127: GOALKICKERS
A128: SANDRINGHAM | C128: SHRIVES 6 | F128: BURNS 5 | I128: O'TOOLE 2 | L128: BRYAN | N128: WEBSTER | P128: PAY | R128: GLEESON
A129: DANDENONG | C129: DINEEN 3 | F129: WRIGHT 2 | I129: DELANTY 2 | L129: OSBORNE 2 | O129: MINOTTI | Q129: PIVETTA | S129: PETERS
A131: COBURG | C131: 3 | D131: 4 | E131: =C131*6+D131 -> 22 | G131: 6 | H131: 9 | I131: =G131*6+H131 -> 45 | K131: 12 | L131: 10 | M131: =K131*6+L131 -> 82 | O131: 16 | P131: 18 | Q131: =O131*6+P131 -> 114 | S131: BRUNSWICK
A132: BRUNSWICK | C132: 2 | D132: 1 | E132: =C132*6+D132 -> 13 | G132: 7 | H132: 4 | I132: =G132*6+H132 -> 46 | K132: 12 | L132: 7 | M132: =K132*6+L132 -> 79 | O132: 13 | P132: 10 | Q132: =O132*6+P132 -> 88 | S132: BAIRD
A133: BEST PLAYERS
A134: COBURG | C134: CORNEILSON | F134: SULLIVAN | I134: CARMODY | L134: McDONALD | O134: J BRIMACOMBE | S134: McNABB
A135: BRUNSWICK | C135: WATTS | F135: STANLEY | I135: THOMPSON | L135: COOK | O135: AMBROSE | S135: BRIGLIA
A136: GOALKICKERS
A137: COBURG | C137: J BRIMACOMBE 3 | G137: L BRIMACOMBE 2 | K137: MICKLESON 2 | N137: CARMODY 2 | Q137: BYRON 2 | S137: ROCHOW | V137: CLEMENTS | X137: MURRAY | AA137: SULLIVAN | AC137: McDONALD
A138: BRUNSWICK | C138: STANLEY 4 | F138: EDWARDS 3 | I138: AMBROSE 2 | L138: K DILLON | N138: HAGART | Q138: COOK | S138: ARTHUR
A140: NORTHCOTE | C140: 0 | D140: 5 | E140: =C140*6+D140 -> 5 | G140: 2 | H140: 9 | I140: =G140*6+H140 -> 21 | K140: 5 | L140: 11 | M140: =K140*6+L140 -> 41 | O140: 10 | P140: 14 | Q140: =O140*6+P140 -> 74 | S140: NORTHCOTE
A141: WILLIAMSTOWN | C141: 2 | D141: 2 | E141: =C141*6+D141 -> 14 | G141: 3 | H141: 4 | I141: =G141*6+H141 -> 22 | K141: 8 | L141: 7 | M141: =K141*6+L141 -> 55 | O141: 10 | P141: 9 | Q141: =O141*6+P141 -> 69 | S141: RONAN
A142: BEST PLAYERS
A143: NORTHCOTE | C143: GASKETT | F143: LAVER | I143: OUSLEY | L143: SIMPSON | O143: GORMAN | R143: AGHAN
A144: WILLIAMSTOWN | C144: MAZOURIS | F144: WARD | I144: JAMES | L144: TURNER | O144: BAMFORD | R144: CARMICHAEL
A145: GOALKICKERS
A146: NORTHCOTE | C146: GASKETT 3 | F146: ADAMSON 2 | I146: LACHMUND 2 | L146: SIMPSON | O146: BRUSH | Q146: AGHAN
A147: WILLIAMSTOWN | C147: JAMES 5 | F147: MAZOURIS 2 | I147: SAVIGE | K147: BEAMISH | M147: CLOUGH
A149: ROUND 4 | E149: 11TH MAY | J149: WEATHER | N149: DULL & FOGGY NO WIND | S149: PLAYED AT
D150: 1ST QTR | H150: 2ND QTR | L150: 3RD QTR | P150: FINAL | S150: PORT MELBOURNE
A151: MOORABBIN | C151: 5 | D151: 2 | E151: =C151*6+D151 -> 32 | G151: 10 | H151: 6 | I151: =G151*6+H151 -> 66 | K151: 10 | L151: 7 | M151: =K151*6+L151 -> 67 | O151: 14 | P151: 12 | Q151: =O151*6+P151 -> 96 | S151: UMPIRE | X151: LADDER | AB151: ROUND | AD151: 4
A152: PORT MELBOURNE | C152: 4 | D152: 3 | E152: =C152*6+D152 -> 27 | G152: 6 | H152: 4 | I152: =G152*6+H152 -> 40 | K152: 8 | L152: 7 | M152: =K152*6+L152 -> 55 | O152: 9 | P152: 12 | Q152: =O152*6+P152 -> 66 | S152: TREWIN
A153: BEST PLAYERS | W153: TEAM | X153: W | Y153: L | Z153: D | AA153: FOR | AB153: AGST | AC153: % | AD153: PTS
A154: MOORABBIN | C154: HOY | F154: HARRISON | I154: PAPLEY | L154: WHALEBONE | O154: GUTTERSON | R154: PERRY
A155: PORT MELBOURNE | C155: STRAUCH | F155: PERRY | I155: TAGGART | L155: MILNER | O155: JEFFREY | R155: BONNETT | W155: SANDRINGHAM | X155: 4 | Y155: 0 | Z155: 0 | AA155: 490 | AB155: 293 | AC155: 167.23549488054607 | AD155: 16
A156: GOALKICKERS | W156: YARRAVILLE | X156: 4 | Y156: 0 | Z156: 0 | AA156: 429 | AB156: 300 | AC156: 143 | AD156: 16
A157: MOORABBIN | C157: WHALEBONE 4 | F157: KEE 3 | H157: CRAMERI 2 | K157: PAPLEY 2 | M157: HASSETT 2 | P157: CHRISTIE | W157: COBURG | X157: 3 | Y157: 1 | Z157: 0 | AA157: 411 | AB157: 369 | AC157: 111.3821138211382 | AD157: 12
A158: PORT MELBOURNE | C158: BONNETT 3 | F158: MERRETT 2 | I158: TAGGART | K158: PERRY | M158: MILNER | O158: JEFFREY | W158: MOORABBIN | X158: 2 | Y158: 2 | Z158: 0 | AA158: 336 | AB158: 296 | AC158: 113.51351351351352 | AD158: 8
A160: WILLIAMSTOWN | C160: 3 | D160: 3 | E160: =C160*6+D160 -> 21 | G160: 7 | H160: 7 | I160: =G160*6+H160 -> 49 | K160: 12 | L160: 14 | M160: =K160*6+L160 -> 86 | O160: 18 | P160: 18 | Q160: =O160*6+P160 -> 126 | S160: WILLIAMSTOWN | W160: PORT MELBOURNE | X160: 2 | Y160: 2 | Z160: 0 | AA160: 338 | AB160: 321 | AC160: 105.29595015576324 | AD160: 8
A161: OAKLEIGH | C161: 2 | D161: 3 | E161: =C161*6+D161 -> 15 | G161: 8 | H161: 6 | I161: =G161*6+H161 -> 54 | K161: 10 | L161: 7 | M161: =K161*6+L161 -> 67 | O161: 14 | P161: 9 | Q161: =O161*6+P161 -> 93 | S161: BAIRD | W161: DANDENONG | X161: 1 | Y161: 3 | Z161: 0 | AA161: 361 | AB161: 385 | AC161: 93.766233766233768 | AD161: 4
A162: BEST PLAYERS | W162: WILLIAMSTOWN | X162: 1 | Y162: 3 | Z162: 0 | AA162: 314 | AB162: 338 | AC162: 92.899408284023664 | AD162: 4
A163: WILLIAMSTOWN | C163: BAMFORD | F163: JAMES | I163: MAZOURIS | L163: CARMICHAEL | O163: WARD | Q163: TURNER | W163: OAKLEIGH | X163: 1 | Y163: 3 | Z163: 0 | AA163: 289 | AB163: 357 | AC163: 80.952380952380949 | AD163: 4
A164: OAKLEIGH | C164: JEWELL | F164: JONES | I164: RICCI | L164: MAUGHAN | O164: YOUNG | Q164: LUFF | W164: BRUNSWICK | X164: 1 | Y164: 3 | Z164: 0 | AA164: 339 | AB164: 469 | AC164: 72.281449893390189 | AD164: 4
A165: GOALKICKERS | W165: NORTHCOTE | X165: 1 | Y165: 3 | Z165: 0 | AA165: 259 | AB165: 438 | AC165: 59.1324200913242 | AD165: 4
A166: WILLIAMSTOWN | C166: JAMES 8 | F166: TURNER 3 | I166: MAZOURIS 2 | L166: CLOUGH 2 | N166: MALONEY | Q166: MURRAY | S166: McASEY
A167: OAKLEIGH | C167: JEWELL 5 | F167: RICCI 3 | I167: YOUNG 2 | L167: McLAREN 2 | O167: WILLIAMS | R167: MAUGHAN
A169: YARRAVILLE | C169: 8 | D169: 2 | E169: =C169*6+D169 -> 50 | G169: 16 | H169: 4 | I169: =G169*6+H169 -> 100 | K169: 21 | L169: 9 | M169: =K169*6+L169 -> 135 | O169: 25 | P169: 13 | Q169: =O169*6+P169 -> 163 | S169: YARRAVILLE
A170: BRUNSWICK | C170: 2 | D170: 7 | E170: =C170*6+D170 -> 19 | G170: 4 | H170: 11 | I170: =G170*6+H170 -> 35 | K170: 8 | L170: 17 | M170: =K170*6+L170 -> 65 | O170: 12 | P170: 19 | Q170: =O170*6+P170 -> 91 | S170: ROWE
A171: BEST PLAYERS
A172: YARRAVILLE | C172: WHITTEN | F172: EVANS | I172: ALLEN | L172: LAMONT | O172: ORANGE | R172: CLEGG
A173: BRUNSWICK | C173: AMBROSE | F173: BRIGLIA | I173: WHILEY | L173: MATTHEWS | O173: K DILLON | R173: THOMPSON
A174: GOALKICKERS
A175: YARRAVILLE | C175: EVANS 6 | E175: WHITTEN 4 | H175: MEDDINGS 3 | K175: ALLEN 3 | M175: ORANGE 2 | P175: RON BROWN 2 | S175: LAMONT 2 | V175: CLEGG | X175: KNOTT | Z175: McGILL
A176: BRUNSWICK | C176: K DILLON 4 | F176: ARTHUR 2 | I176: R DILLON 2 | L176: MATTHEWS 2 | O176: AMBROSE | Q176: STANLEY
A178: SANDRINGHAM | C178: 4 | D178: 4 | E178: =C178*6+D178 -> 28 | G178: 13 | H178: 8 | I178: =G178*6+H178 -> 86 | K178: 20 | L178: 12 | M178: =K178*6+L178 -> 132 | O178: 27 | P178: 25 | Q178: =O178*6+P178 -> 187 | S178: BEACH ROAD
A179: NORTHCOTE | C179: 1 | D179: 5 | E179: =C179*6+D179 -> 11 | G179: 3 | H179: 9 | I179: =G179*6+H179 -> 27 | K179: 8 | L179: 15 | M179: =K179*6+L179 -> 63 | O179: 9 | P179: 17 | Q179: =O179*6+P179 -> 71 | S179: POLLARD
A180: BEST PLAYERS
A181: SANDRINGHAM | C181: BURNS | F181: BURKE | I181: SHEEHAN | L181: CLIFORD | O181: SHRIVES | R181: WEBSTER
A182: NORTHCOTE | C182: AGHAN | F182: LAVER | I182: GASKETT | L182: ADAMSON | O182: OUSLEY | R182: EASTAWAY
A183: GOALKICKERS
A184: SANDRINGHAM | C184: DAWSON 7 | F184: SHEEHAN 6 | I184: SHRIVES 5 | L184: MUTER 3 | N184: O'TOOLE 2 | Q184: BURKE | S184: POBJOY | U184: BURNS | W184: WEBSTER
A185: NORTHCOTE | C185: DOWLING 2 | F185: SIMPSON 2 | I185: GASKETT | K185: EASTAWAY | N185: KEAYS | P185: AGHAN | R185: LANGBORNE
E186: 12TH MAY | H186: WEATHER | K186: FINE
A187: COBURG | C187: 4 | D187: 3 | E187: =C187*6+D187 -> 27 | G187: 6 | H187: 9 | I187: =G187*6+H187 -> 45 | K187: 10 | L187: 12 | M187: =K187*6+L187 -> 72 | O187: 14 | P187: 14 | Q187: =O187*6+P187 -> 98 | S187: COBURG
A188: DANDENONG | C188: 0 | D188: 1 | E188: =C188*6+D188 -> 1 | G188: 3 | H188: 5 | I188: =G188*6+H188 -> 23 | K188: 7 | L188: 7 | M188: =K188*6+L188 -> 49 | O188: 13 | P188: 10 | Q188: =O188*6+P188 -> 88 | S188: McMASTER
A189: BEST PLAYERS
A190: COBURG | C190: CARMODY | F190: J BRIMACOMBE | I190: L BRIMACOMBE | L190: FINDLAY | O190: SPENCER | R190: CLEMENTS
A191: DANDENONG | C191: DELANTY | F191: DINEEN | I191: PENNEFATHER | L191: ABRAHAM | O191: WATERS | R191: PETERS
A192: GOALKICKERS
A193: COBURG | C193: CARMODY 4 | F193: J BRIMACOMBE 3 | J193: L BRIMACOMBE 3 | N193: CLEMENTS 2 | Q193: McNABB | S193: FINDLAY
A194: DANDENONG | C194: DELANTY 3 | F194: PETERS 3 | I194: PILCHER 2 | K194: WATERS 2 | N194: MINOTTI | Q194: OSBORNE | S194: DINEEN
A196: ROUND 5 | E196: 18TH MAY | J196: WEATHER | M196: STRONG SOUTH EAST WIND DULL | S196: PLAYED AT
D197: 1ST QTR | H197: 2ND QTR | L197: 3RD QTR | P197: FINAL | S197: BEACH ROAD
A198: SANDRINGHAM | C198: 5 | D198: 5 | E198: =C198*6+D198 -> 35 | G198: 8 | H198: 7 | I198: =G198*6+H198 -> 55 | K198: 11 | L198: 12 | M198: =K198*6+L198 -> 78 | O198: 14 | P198: 16 | Q198: =O198*6+P198 -> 100 | S198: UMPIRE | X198: LADDER | AB198: ROUND | AD198: 5
A199: YARRAVILLE | C199: 0 | D199: 2 | E199: =C199*6+D199 -> 2 | G199: 2 | H199: 7 | I199: =G199*6+H199 -> 19 | K199: 4 | L199: 8 | M199: =K199*6+L199 -> 32 | O199: 8 | P199: 10 | Q199: =O199*6+P199 -> 58 | S199: MILLEN
A200: BEST PLAYERS | W200: TEAM | X200: W | Y200: L | Z200: D | AA200: FOR | AB200: AGST | AC200: % | AD200: PTS
A201: SANDRINGHAM | C201: POBJOY | F201: BURNS | I201: KENNEDY | L201: GRANGER | O201: SHRIVES | R201: WILLS
A202: YARRAVILLE | C202: MALONEY | F202: WHITTEN | I202: BOB BROWN | L202: CLEGG | O202: McGILL | R202: WILSON | W202: SANDRINGHAM | X202: 5 | Y202: 0 | Z202: 0 | AA202: 590 | AB202: 351 | AC202: 168.0911680911681 | AD202: 20
A203: GOALKICKERS | W203: YARRAVILLE | X203: 4 | Y203: 1 | Z203: 0 | AA203: 487 | AB203: 400 | AC203: 121.75 | AD203: 16
A204: SANDRINGHAM | C204: BURNS 4 | F204: SHRIVES 3 | I204: O'TOOLE 2 | L204: WILLS 2 | N204: McCOMBE | Q204: BURKE | S204: PAY | W204: MOORABBIN | X204: 3 | Y204: 2 | Z204: 0 | AA204: 371 | AB204: 330 | AC204: 112.42424242424242 | AD204: 12
A205: YARRAVILLE | C205: ALLEN 2 | F205: LARKINS 2 | I205: WHITTEN | K205: LAMONT | M205: KNOTT | O205: EVANS | W205: COBURG | X205: 3 | Y205: 2 | Z205: 0 | AA205: 457 | AB205: 434 | AC205: 105.29953917050692 | AD205: 12
A207: WILLIAMSTOWN | C207: 0 | D207: 0 | E207: =C207*6+D207 -> 0 | G207: 4 | H207: 2 | I207: =G207*6+H207 -> 26 | K207: 7 | L207: 3 | M207: =K207*6+L207 -> 45 | O207: 10 | P207: 5 | Q207: =O207*6+P207 -> 65 | S207: WILLIAMSTOWN | W207: PORT MELBOURNE | X207: 3 | Y207: 2 | Z207: 0 | AA207: 443 | AB207: 422 | AC207: 104.97630331753554 | AD207: 12
A208: COBURG | C208: 2 | D208: 5 | E208: =C208*6+D208 -> 17 | G208: 3 | H208: 6 | I208: =G208*6+H208 -> 24 | K208: 5 | L208: 9 | M208: =K208*6+L208 -> 39 | O208: 6 | P208: 10 | Q208: =O208*6+P208 -> 46 | S208: O'NEILL | W208: DANDENONG | X208: 2 | Y208: 3 | Z208: 0 | AA208: 479 | AB208: 419 | AC208: 114.31980906921241 | AD208: 8
A209: BEST PLAYERS | W209: WILLIAMSTOWN | X209: 2 | Y209: 3 | Z209: 0 | AA209: 379 | AB209: 384 | AC209: 98.697916666666671 | AD209: 8
A210: WILLIAMSTOWN | C210: MALONEY | F210: MURPHY | I210: McASEY | L210: CARMICHAEL | O210: RUSSELL | R210: MAZOURIS | W210: OAKLEIGH | X210: 1 | Y210: 4 | Z210: 0 | AA210: 323 | AB210: 392 | AC210: 82.397959183673464 | AD210: 4
A211: COBURG | C211: MICKLESON | F211: J BRIMACOMBE | I211: FITZPATRICK | L211: O'BRIEN | O211: L BRIMACOMBE | R211: ROCHOW | W211: BRUNSWICK | X211: 1 | Y211: 4 | Z211: 0 | AA211: 440 | AB211: 574 | AC211: 76.655052264808361 | AD211: 4
A212: GOALKICKERS | W212: NORTHCOTE | X212: 1 | Y212: 4 | Z212: 0 | AA212: 293 | AB212: 556 | AC212: 52.697841726618705 | AD212: 4
A213: WILLIAMSTOWN | C213: MALONEY 3 | F213: BEAMISH 3 | I213: MURPHY 2 | L213: JAMES | N213: McASEY
A214: COBURG | C214: FITZPATRICK 2 | F214: CARMODY | I214: FINDLAY | K214: L BRMACOMBE | N214: MICKLESON
A216: MOORABBIN | C216: 1 | D216: 2 | E216: =C216*6+D216 -> 8 | G216: 1 | H216: 4 | I216: =G216*6+H216 -> 10 | K216: 3 | L216: 6 | M216: =K216*6+L216 -> 24 | O216: 4 | P216: 11 | Q216: =O216*6+P216 -> 35 | S216: MOORABBIN
A217: OAKLEIGH | C217: 2 | D217: 1 | E217: =C217*6+D217 -> 13 | G217: 4 | H217: 3 | I217: =G217*6+H217 -> 27 | K217: 5 | L217: 4 | M217: =K217*6+L217 -> 34 | O217: 5 | P217: 4 | Q217: =O217*6+P217 -> 34 | S217: McMASTER
A218: BEST PLAYERS
A219: MOORABBIN | C219: LESLIE | F219: CHRISTIE | I219: PERRY | L219: WHALEBONE | O219: CRAMERI | R219: CROSHER
A220: OAKLEIGH | C220: MULDOON | F220: McLELLAND | I220: MAUGHAN | L220: YOUNG | O220: PEAKE | R220: TURNER
A221: GOALKICKERS
A222: MOORABBIN | C222: PAPLEY 2 | F222: RYAN | I222: WHALEBONE
A223: OAKLEIGH | C223: TIPPETT 2 | F223: JEWELL | I223: RICCI | K223: SHERIDAN
D224: 19TH MAY | I224: WEATHER | K224: RAIN GROUNDS HEAVY
A225: PORT MELBOURNE | C225: 2 | D225: 3 | E225: =C225*6+D225 -> 15 | G225: 7 | H225: 9 | I225: =G225*6+H225 -> 51 | K225: 11 | L225: 12 | M225: =K225*6+L225 -> 78 | O225: 15 | P225: 15 | Q225: =O225*6+P225 -> 105 | S225: BRUNSWICK
A226: BRUNSWICK | C226: 2 | D226: 7 | E226: =C226*6+D226 -> 19 | G226: 7 | H226: 10 | I226: =G226*6+H226 -> 52 | K226: 10 | L226: 12 | M226: =K226*6+L226 -> 72 | O226: 14 | P226: 17 | Q226: =O226*6+P226 -> 101 | S226: HORNE
A227: BEST PLAYERS
A228: PORT MELBOURNE | C228: LAWSON | F228: LEWIS | I228: TAGGART | L228: MITHEN | O228: MERRETT | R228: STRAUCH
A229: BRUNSWICK | C229: K DILLON | F229: THOMPSON | I229: STANLEY | L229: WICKS | O229: WHILEY | R229: AMBROSE
A230: GOALKICKERS
A231: PORT MELBOURNE | C231: TAGGART 4 | F231: JEFFREY 3 | I231: CORRIGAN 3 | L231: BENETTI 2 | O231: LAWSON | Q231: MITHEN | S231: MILNER
A232: BRUNSWICK | C232: K DILLON 5 | F232: STANLEY 3 | I232: COOK 3 | L232: DENTON | N232: ARTHUR | Q232: WHILEY
A234: DANDENONG | C234: 4 | D234: 3 | E234: =C234*6+D234 -> 27 | G234: 8 | H234: 7 | I234: =G234*6+H234 -> 55 | K234: 13 | L234: 10 | M234: =K234*6+L234 -> 88 | O234: 17 | P234: 16 | Q234: =O234*6+P234 -> 118 | S234: NORTHCOTE
A235: NORTHCOTE | C235: 0 | D235: 1 | E235: =C235*6+D235 -> 1 | G235: 1 | H235: 2 | I235: =G235*6+H235 -> 8 | K235: 3 | L235: 5 | M235: =K235*6+L235 -> 23 | O235: 4 | P235: 10 | Q235: =O235*6+P235 -> 34 | S235: MANCE
A236: BEST PLAYERS
A237: DANDENONG | C237: ABRAHAM | F237: WRIGHT | I237: DINEEN | L237: WATERS | O237: OSBORNE | R237: LITTLE
A238: NORTHCOTE | C238: OUSLEY | F238: ADAMSON | I238: EASTAWAY | L238: GASKETT | O238: BRUSH | R238: BRETHERTON
A239: GOALKICKERS
A240: DANDENONG | C240: KENT 4 | E240: WRIGHT 3 | H240: WATERS 2 | K240: DUNCAN 2 | N240: OSBORNE 2 | Q240: LITTLE | S240: PETERS | U240: DINEEN | W240: FRAME
A241: NORTHCOTE | C241: ADAMSON 2 | F241: OUSLEY | H241: LAVER
A243: ROUND 6 | E243: 25TH MAY | I243: WEATHER | L243: NORTH WEST WIND COLD GROUNDS FAIR | S243: PLAYED AT
D244: 1ST QTR | H244: 2ND QTR | L244: 3RD QTR | P244: FINAL | S244: DANDENONG
A245: DANDENONG | C245: 1 | D245: 3 | E245: =C245*6+D245 -> 9 | G245: 5 | H245: 15 | I245: =G245*6+H245 -> 45 | K245: 6 | L245: 19 | M245: =K245*6+L245 -> 55 | O245: 12 | P245: 20 | Q245: =O245*6+P245 -> 92 | S245: UMPIRE | X245: LADDER | AB245: ROUND | AD245: 6
A246: WILLIAMSTOWN | C246: 4 | D246: 5 | E246: =C246*6+D246 -> 29 | G246: 5 | H246: 5 | I246: =G246*6+H246 -> 35 | K246: 11 | L246: 12 | M246: =K246*6+L246 -> 78 | O246: 13 | P246: 13 | Q246: =O246*6+P246 -> 91 | S246: MILLEN
A247: BEST PLAYERS | W247: TEAM | X247: W | Y247: L | Z247: D | AA247: FOR | AB247: AGST | AC247: % | AD247: PTS
A248: DANDENONG | C248: DELANTY | F248: PIVETTA | I248: BARRAN | L248: ABRAHAM | O248: DINEEN | R248: PENNEFATHER
A249: WILLIAMSTOWN | C249: RUSSELL | F249: CARMICHAEL | I249: TURNER | L249: WARD | O249: MALONEY | R249: BAMFORD | W249: SANDRINGHAM | X249: 5 | Y249: 1 | Z249: 0 | AA249: 670 | AB249: 456 | AC249: 146.92982456140351 | AD249: 20
A250: GOALKICKERS | W250: YARRAVILLE | X250: 5 | Y250: 1 | Z250: 0 | AA250: 560 | AB250: 452 | AC250: 123.89380530973452 | AD250: 20
A251: DANDENONG | C251: COLE 3 | F251: WRIGHT 2 | I251: FRAME 2 | K251: MINOTTI | M251: OSBORNE | O251: PETERS | Q251: DINEEN | S251: PILCHER | W251: MOORABBIN | X251: 4 | Y251: 2 | Z251: 0 | AA251: 489 | AB251: 378 | AC251: 129.36507936507937 | AD251: 16
A252: WILLIAMSTOWN | C252: TURNER 5 | F252: JAMES 3 | I252: MURPHY 2 | L252: MALONEY | N252: CLOUGH | P252: O'TOOLE | W252: COBURG | X252: 4 | Y252: 2 | Z252: 0 | AA252: 562 | AB252: 514 | AC252: 109.33852140077821 | AD252: 16
A254: BRUNSWICK | C254: 4 | D254: 3 | E254: =C254*6+D254 -> 27 | G254: 8 | H254: 6 | I254: =G254*6+H254 -> 54 | K254: 9 | L254: 10 | M254: =K254*6+L254 -> 64 | O254: 12 | P254: 10 | Q254: =O254*6+P254 -> 82 | S254: OAKLEIGH | W254: DANDENONG | X254: 3 | Y254: 3 | Z254: 0 | AA254: 571 | AB254: 510 | AC254: 111.96078431372548 | AD254: 12
A255: OAKLEIGH | C255: 2 | D255: 2 | E255: =C255*6+D255 -> 14 | G255: 3 | H255: 4 | I255: =G255*6+H255 -> 22 | K255: 5 | L255: 7 | M255: =K255*6+L255 -> 37 | O255: 9 | P255: 9 | Q255: =O255*6+P255 -> 63 | S255: POLLARD | W255: PORT MELBOURNE | X255: 3 | Y255: 3 | Z255: 0 | AA255: 495 | AB255: 495 | AC255: 100 | AD255: 12
A256: BEST PLAYERS | W256: WILLIAMSTOWN | X256: 2 | Y256: 4 | Z256: 0 | AA256: 470 | AB256: 476 | AC256: 98.739495798319325 | AD256: 8
A257: BRUNSWICK | C257: STANLEY | F257: K DILLON | I257: THOMPSON | L257: COOK | O257: WICKS | R257: WHILEY | W257: BRUNSWICK | X257: 2 | Y257: 4 | Z257: 0 | AA257: 522 | AB257: 637 | AC257: 81.946624803767662 | AD257: 8
A258: OAKLEIGH | C258: YOUNG | F258: JONES | I258: MURRAY | L258: JORDAN | O258: McLAREN | R258: KITTO | W258: OAKLEIGH | X258: 1 | Y258: 5 | Z258: 0 | AA258: 386 | AB258: 474 | AC258: 81.434599156118139 | AD258: 4
A259: GOALKICKERS | W259: NORTHCOTE | X259: 1 | Y259: 5 | Z259: 0 | AA259: 341 | AB259: 674 | AC259: 50.593471810089021 | AD259: 4
A260: BRUNSWICK | C260: STANLEY 5 | F260: COOK 4 | I260: AMBROSE 2 | L260: EDWARDS
A261: OAKLEIGH | C261: McLAREN 2 | F261: JORDAN 2 | I261: MAUGHAN 2 | L261: McCORKELL | O261: GIBBON | Q261: JONES
A263: MOORABBIN | C263: 3 | D263: 9 | E263: =C263*6+D263 -> 27 | G263: 6 | H263: 10 | I263: =G263*6+H263 -> 46 | K263: 12 | L263: 18 | M263: =K263*6+L263 -> 90 | O263: 16 | P263: 22 | Q263: =O263*6+P263 -> 118 | S263: MOORABBIN
A264: NORTHCOTE | C264: 2 | D264: 1 | E264: =C264*6+D264 -> 13 | G264: 3 | H264: 5 | I264: =G264*6+H264 -> 23 | K264: 4 | L264: 6 | M264: =K264*6+L264 -> 30 | O264: 7 | P264: 6 | Q264: =O264*6+P264 -> 48 | S264: ROWE
A265: BEST PLAYERS
A266: MOORABBIN | C266: PAPLEY | F266: KERR | I266: RYAN | L266: WHALEBONE | O266: PERRY | R266: BURNS
A267: NORTHCOTE | C267: BRETHERTON | F267: C LANGBORNE | I267: BRUSH | L267: EASTAWAY | O267: R MAYNE | R267: OUSLEY
A268: GOALKICKERS
A269: MOORABBIN | C269: KERR 5 | E269: PAPLEY 2 | G269: RYAN 2 | I269: WHALEBONE 2 | L269: CHRISTIE | N269: SYMONS | P269: SHEPHERD | R269: PERRY | T269: BURNS
A270: NORTHCOTE | C270: EASTAWAY 2 | F270: OUSLEY | I270: ADAMSON | L270: SIMPSON | N270: AGHAN | P270: R MAYNE
D271: 26TH MAY | I271: WEATHER | L271: RAIN
A272: COBURG | C272: 4 | D272: 1 | E272: =C272*6+D272 -> 25 | G272: 6 | H272: 1 | I272: =G272*6+H272 -> 37 | K272: 11 | L272: 2 | M272: =K272*6+L272 -> 68 | O272: 17 | P272: 3 | Q272: =O272*6+P272 -> 105 | S272: COBURG
A273: SANDRINGHAM | C273: 2 | D273: 2 | E273: =C273*6+D273 -> 14 | G273: 2 | H273: 9 | I273: =G273*6+H273 -> 21 | K273: 7 | L273: 13 | M273: =K273*6+L273 -> 55 | O273: 10 | P273: 20 | Q273: =O273*6+P273 -> 80 | S273: HORNE
A274: BEST PLAYERS
A275: COBURG | C275: CORNEILSON | F275: LEYDEN | I275: SCHREIBER | L275: McNABB | O275: BARCLAY | R275: CARMODY
A276: SANDRINGHAM | C276: SHRIVES | F276: BURKE | I276: GLEESON | L276: BURNS | O276: CLIFFORD | R276: KENNEDY
A277: GOALKICKERS
A278: COBURG | C278: LEYDEN 5 | F278: J BRIMACOMBE 3 | J278: FITZPATRICK 3 | M278: L BRIMACOMBE 2 | Q278: BARCLAY 2 | T278: FINDLAY | W278: POWELL
A279: SANDRINGHAM | C279: SHRIVES 3 | F279: WILLS 3 | I279: BURNS 2 | L279: BURKE | N279: GLEESON
A281: YARRAVILLE | C281: 0 | D281: 5 | E281: =C281*6+D281 -> 5 | G281: 3 | H281: 8 | I281: =G281*6+H281 -> 26 | K281: 6 | L281: 11 | M281: =K281*6+L281 -> 47 | O281: 10 | P281: 13 | Q281: =O281*6+P281 -> 73 | S281: YARRAVILLE
A282: PORT MELBOURNE | C282: 0 | D282: 3 | E282: =C282*6+D282 -> 3 | G282: 4 | H282: 4 | I282: =G282*6+H282 -> 28 | K282: 5 | L282: 6 | M282: =K282*6+L282 -> 36 | O282: 7 | P282: 10 | Q282: =O282*6+P282 -> 52 | S282: BAIRD
A283: BEST PLAYERS
A284: YARRAVILLE | C284: CLEGG | F284: ORANGE | I284: WHITTEN | L284: LAMONT | O284: ALLEN | R284: MALONEY
A285: PORT MELBOURNE | C285: LEWIS | F285: FREYER | I285: MILNER | L285: RENOUF | O285: PERRY | R285: STRAUCH
A286: GOALKICKERS
A287: YARRAVILLE | C287: LAMONT 2 | F287: KNOTT 2 | I287: EVANS 2 | L287: RON BROWN 2 | O287: WHITTEN | R287: CLEGG
A288: PORT MELBOURNE | C288: MILNER 2 | F288: JEFFREY 2 | I288: BENETTI | L288: MERRETT | O288: CORRIGAN
A290: ROUND 7 | E290: 1ST JUNE | J290: WEATHER | M290: DULL CLOUDY GROUNDS BAD | S290: PLAYED AT
D291: 1ST QTR | H291: 2ND QTR | L291: 3RD QTR | P291: FINAL | S291: BRUNSWICK
A292: BRUNSWICK | C292: 2 | D292: 5 | E292: =C292*6+D292 -> 17 | G292: 4 | H292: 7 | I292: =G292*6+H292 -> 31 | K292: 10 | L292: 14 | M292: =K292*6+L292 -> 74 | O292: 13 | P292: 15 | Q292: =O292*6+P292 -> 93 | S292: UMPIRE | X292: LADDER | AB292: ROUND | AD292: 7
A293: MOORABBIN | C293: 1 | D293: 2 | E293: =C293*6+D293 -> 8 | G293: 2 | H293: 8 | I293: =G293*6+H293 -> 20 | K293: 5 | L293: 8 | M293: =K293*6+L293 -> 38 | O293: 9 | P293: 12 | Q293: =O293*6+P293 -> 66 | S293: FLANAGAN
A294: BEST PLAYERS | W294: TEAM | X294: W | Y294: L | Z294: D | AA294: FOR | AB294: AGST | AC294: % | AD294: PTS
A295: BRUNSWICK | C295: AMBROSE | F295: K DILLON | I295: EDWARDS | L295: WHILEY | O295: COOK | R295: WILSON
A296: MOORABBIN | C296: WHALEBONE | F296: PAPLEY | I296: RYAN | L296: SYMONS | O296: CRAMERI | R296: SHEPHERD | W296: SANDRINGHAM | X296: 5 | Y296: 2 | Z296: 0 | AA296: 784 | AB296: 582 | AC296: 134.70790378006873 | AD296: 20
A297: GOALKICKERS | W297: COBURG | X297: 5 | Y297: 2 | Z297: 0 | AA297: 629 | AB297: 557 | AC297: 112.92639138240574 | AD297: 20
A298: BRUNSWICK | C298: K DILLON 3 | F298: AMBROSE 2 | I298: STANLEY 2 | L298: WHILEY 2 | N298: COOK 2 | P298: ROBINSON | R298: EDWARDS | W298: YARRAVILLE | X298: 5 | Y298: 2 | Z298: 0 | AA298: 615 | AB298: 571 | AC298: 107.70577933450087 | AD298: 20
A299: MOORABBIN | C299: PAPLEY 3 | F299: KERR | H299: RYAN | J299: WHALEBONE | M299: BUICK | O299: SYMONS | Q299: CHRISTIE | W299: MOORABBIN | X299: 4 | Y299: 3 | Z299: 0 | AA299: 555 | AB299: 471 | AC299: 117.83439490445861 | AD299: 16
A301: WILLIAMSTOWN | C301: 4 | D301: 5 | E301: =C301*6+D301 -> 29 | G301: 9 | H301: 7 | I301: =G301*6+H301 -> 61 | K301: 15 | L301: 7 | M301: =K301*6+L301 -> 97 | O301: 19 | P301: 12 | Q301: =O301*6+P301 -> 126 | S301: BEACH ROAD | W301: PORT MELBOURNE | X301: 4 | Y301: 3 | Z301: 0 | AA301: 585 | AB301: 544 | AC301: 107.53676470588235 | AD301: 16
A302: SANDRINGHAM | C302: 5 | D302: 2 | E302: =C302*6+D302 -> 32 | G302: 8 | H302: 5 | I302: =G302*6+H302 -> 53 | K302: 16 | L302: 10 | M302: =K302*6+L302 -> 106 | O302: 17 | P302: 12 | Q302: =O302*6+P302 -> 114 | S302: MANCE | W302: DANDENONG | X302: 3 | Y302: 4 | Z302: 0 | AA302: 620 | AB302: 600 | AC302: 103.33333333333333 | AD302: 12
A303: BEST PLAYERS | W303: WILLIAMSTOWN | X303: 3 | Y303: 4 | Z303: 0 | AA303: 596 | AB303: 590 | AC303: 101.01694915254237 | AD303: 12
A304: WILLIAMSTOWN | C304: CARMICHAEL | F304: BAMFORD | I304: CLOUGH | L304: WARD | O304: MALONEY | R304: JAMES | W304: BRUNSWICK | X304: 3 | Y304: 4 | Z304: 0 | AA304: 615 | AB304: 703 | AC304: 87.482219061166433 | AD304: 12
A305: SANDRINGHAM | C305: SHRIVES | F305: WILLS | I305: McCOMB | L305: CLARK | O305: DAWSON | R305: O'TOOLE | W305: OAKLEIGH | X305: 2 | Y305: 5 | Z305: 0 | AA305: 505 | AB305: 529 | AC305: 95.463137996219288 | AD305: 8
A306: GOALKICKERS | W306: NORTHCOTE | X306: 1 | Y306: 6 | Z306: 0 | AA306: 384 | AB306: 741 | AC306: 51.821862348178136 | AD306: 4
A307: WILLIAMSTOWN | C307: MAZOURIS 5 | F307: JAMES 3 | I307: CARMICHAEL 3 | L307: CLOUGH 3 | N307: MALONEY 2 | Q307: WILLIAMS 2 | T307: LEDWARD
A308: SANDRINGHAM | C308: SHRIVES 4 | F308: WILLS 4 | I308: O'TOOLE 3 | L308: DAWSON 3 | O308: CLARK 2 | Q308: BURKE
A310: OAKLEIGH | C310: 4 | D310: 2 | E310: =C310*6+D310 -> 26 | G310: 11 | H310: 6 | I310: =G310*6+H310 -> 72 | K310: 16 | L310: 8 | M310: =K310*6+L310 -> 104 | O310: 18 | P310: 11 | Q310: =O310*6+P310 -> 119 | S310: OAKLEIGH
A311: YARRAVILLE | C311: 5 | D311: 4 | E311: =C311*6+D311 -> 34 | G311: 7 | H311: 5 | I311: =G311*6+H311 -> 47 | K311: 8 | L311: 7 | M311: =K311*6+L311 -> 55 | O311: 8 | P311: 7 | Q311: =O311*6+P311 -> 55 | S311: JACKSON
A312: BEST PLAYERS
A313: OAKLEIGH | C313: JONES | F313: TURNER | I313: YOUNG | L313: McLAREN | O313: MURRAY | R313: JORDAN
A314: YARRAVILLE | C314: CLEGG | F314: RON BROWN | I314: WHITTEN | L314: ORANGE | O314: WARWICK | R314: McGILL
A315: GOALKICKERS
A316: OAKLEIGH | C316: JONES 6 | E316: McLELLAND 3 | H316: MAUGHAN 2 | K316: JEWELL 2 | M316: CRAWFORD 2 | P316: LOTHIAN | R316: EDWARDS | U316: McLAREN
A317: YARRAVILLE | C317: CLEGG 3 | E317: LARKINS 2 | H317: RON BROWN | K317: ALLEN | M317: WARWICK
D318: 2ND JUNE | I318: WEATHER | L318: RAIN
A319: PORT MELBOURNE | C319: 3 | D319: 4 | E319: =C319*6+D319 -> 22 | G319: 7 | H319: 6 | I319: =G319*6+H319 -> 48 | K319: 10 | L319: 7 | M319: =K319*6+L319 -> 67 | O319: 13 | P319: 12 | Q319: =O319*6+P319 -> 90 | S319: PORT MELBOURNE
A320: DANDENONG | C320: 1 | D320: 1 | E320: =C320*6+D320 -> 7 | G320: 2 | H320: 4 | I320: =G320*6+H320 -> 16 | K320: 5 | L320: 10 | M320: =K320*6+L320 -> 40 | O320: 6 | P320: 13 | Q320: =O320*6+P320 -> 49 | S320: POLLARD
A321: BEST PLAYERS
A322: PORT MELBOURNE | C322: FREYER | F322: LEWIS | I322: WILLIAMS | L322: MILNER | O322: STRAUCH | R322: LANDORFF
A323: DANDENONG | C323: PENNEFATHER | F323: DELANTY | I323: ABRAHAM | L323: OSBORNE | O323: COLE | R323: DUNCAN
A324: GOALKICKERS
A325: PORT MELBOURNE | C325: MITCHELL 4 | F325: MILNER 4 | I325: JEFFREY 2 | L325: CORRIGAN | N325: TAGGART | P325: PERRY
A326: DANDENONG | C326: KENT 2 | F326: OSBORNE | I326: DELANTY | K326: WRIGHT | M326: COLE
A328: COBURG | C328: 3 | D328: 5 | E328: =C328*6+D328 -> 23 | G328: 6 | H328: 9 | I328: =G328*6+H328 -> 45 | K328: 6 | L328: 11 | M328: =K328*6+L328 -> 47 | O328: 9 | P328: 13 | Q328: =O328*6+P328 -> 67 | S328: NORTHCOTE
A329: NORTHCOTE | C329: 0 | D329: 2 | E329: =C329*6+D329 -> 2 | G329: 3 | H329: 3 | I329: =G329*6+H329 -> 21 | K329: 4 | L329: 3 | M329: =K329*6+L329 -> 27 | O329: 6 | P329: 7 | Q329: =O329*6+P329 -> 43 | S329: FROOD
A330: BEST PLAYERS
A331: COBURG | C331: CARMODY | F331: McNABB | I331: SCHREIBER | L331: LORD | O331: BARCLAY | R331: ROCHOW
A332: NORTHCOTE | C332: OUSLEY | F332: ADAMSON | I332: LACHMUND | L332: STANDING | O332: GASKETT | R332: EASTAWAY
A333: GOALKICKERS
A334: COBURG | C334: L BRIMACOMBE 3 | G334: FITZPATRICK 2 | K334: CARMODY 2 | N334: BARCLAY | Q334: J BRIMACOMBE
A335: NORTHCOTE | C335: ADAMSON 3 | G335: LACHMUND | J335: BRUSH | L335: EASTAWAY
A337: ROUND 8 | E337: 8TH JUNE | H337: WEATHER | K337: NO WIND GROUNDS BAD AFTER WEEK OF RAIN | S337: PLAYED AT
D338: 1ST QTR | H338: 2ND QTR | L338: 3RD QTR | P338: FINAL | S338: DANDENONG
A339: MOORABBIN | C339: 4 | D339: 0 | E339: =C339*6+D339 -> 24 | G339: 5 | H339: 2 | I339: =G339*6+H339 -> 32 | K339: 7 | L339: 4 | M339: =K339*6+L339 -> 46 | O339: 10 | P339: 7 | Q339: =O339*6+P339 -> 67 | S339: UMPIRE | X339: LADDER | AB339: ROUND | AD339: 8
A340: DANDENONG | C340: 2 | D340: 1 | E340: =C340*6+D340 -> 13 | G340: 5 | H340: 4 | I340: =G340*6+H340 -> 34 | K340: 8 | L340: 4 | M340: =K340*6+L340 -> 52 | O340: 10 | P340: 6 | Q340: =O340*6+P340 -> 66 | S340: FROOD/McCOY AFTER 1/2 TIME
A341: BEST PLAYERS | W341: TEAM | X341: W | Y341: L | Z341: D | AA341: FOR | AB341: AGST | AC341: % | AD341: PTS
A342: MOORABBIN | C342: CHRISTIE | F342: SHEPHERD | I342: CROSHER | L342: WHALEBONE | O342: CRAMERI | R342: PERRY
A343: DANDENONG | C343: WATERS | F343: PENNEFATHER | I343: ABRAHAM | L343: DUNCAN | O343: BAPTIST | R343: GRAY | W343: SANDRINGHAM | X343: 6 | Y343: 2 | Z343: 0 | AA343: 902 | AB343: 635 | AC343: 142.04724409448818 | AD343: 24
A344: GOALKICKERS | W344: YARRAVILLE | X344: 6 | Y344: 2 | Z344: 0 | AA344: 707 | AB344: 627 | AC344: 112.75917065390749 | AD344: 24
A345: MOORABBIN | C345: BRYAN 3 | F345: BURNS 2 | I345: CHRISTIE 2 | L345: WHALEBONE 2 | O345: SHEPHERD | W345: MOORABBIN | X345: 5 | Y345: 3 | Z345: 0 | AA345: 622 | AB345: 537 | AC345: 115.82867783985103 | AD345: 20
A346: DANDENONG | C346: GRAY 3 | F346: WATERS 2 | I346: DUNCAN 2 | L346: KENT | N346: OSBORNE | Q346: DINEEN | W346: COBURG | X346: 5 | Y346: 3 | Z346: 0 | AA346: 687 | AB346: 621 | AC346: 110.6280193236715 | AD346: 20
A348: WILLIAMSTOWN | C348: 2 | D348: 1 | E348: =C348*6+D348 -> 13 | G348: 5 | H348: 3 | I348: =G348*6+H348 -> 33 | K348: 8 | L348: 5 | M348: =K348*6+L348 -> 53 | O348: 10 | P348: 9 | Q348: =O348*6+P348 -> 69 | S348: WILLIAMSTOWN | W348: PORT MELBOURNE | X348: 4 | Y348: 4 | Z348: 0 | AA348: 648 | AB348: 613 | AC348: 105.70962479608482 | AD348: 16
A349: PORT MELBOURNE | C349: 1 | D349: 5 | E349: =C349*6+D349 -> 11 | G349: 2 | H349: 8 | I349: =G349*6+H349 -> 20 | K349: 3 | L349: 11 | M349: =K349*6+L349 -> 29 | O349: 8 | P349: 15 | Q349: =O349*6+P349 -> 63 | S349: FLANAGAN | W349: WILLIAMSTOWN | X349: 4 | Y349: 4 | Z349: 0 | AA349: 665 | AB349: 653 | AC349: 101.83767228177642 | AD349: 16
A350: BEST PLAYERS | W350: DANDENONG | X350: 3 | Y350: 5 | Z350: 0 | AA350: 686 | AB350: 667 | AC350: 102.84857571214393 | AD350: 12
A351: WILLIAMSTOWN | C351: CLOUGH | F351: WARD | I351: LAWLEY | L351: RUSSELL | O351: MAZOURIS | R351: COPE | W351: OAKLEIGH | X351: 3 | Y351: 5 | Z351: 0 | AA351: 569 | AB351: 587 | AC351: 96.933560477001706 | AD351: 12
A352: PORT MELBOURNE | C352: LANDORFF | F352: FREYER | I352: RENOUF | L352: PERRY | O352: STRAUCH | R352: TAGGART | W352: BRUNSWICK | X352: 3 | Y352: 5 | Z352: 0 | AA352: 668 | AB352: 821 | AC352: 81.364190012180273 | AD352: 12
A353: GOALKICKERS | W353: NORTHCOTE | X353: 1 | Y353: 7 | Z353: 0 | AA353: 440 | AB353: 833 | AC353: 52.821128451380552 | AD353: 4
A354: WILLIAMSTOWN | C354: CLOUGH 2 | F354: MALONEY 2 | I354: MURPHY 2 | L354: CARMICHAEL | O354: LEONARD | Q354: WILLIAMS | T354: MAZOURIS
A355: PORT MELBOURNE | C355: MITHEN 2 | F355: MITCHELL | I355: JEFFREY | K355: CORRIGAN | N355: MILNER | P355: TAGGART | R355: LAWSON
A357: YARRAVILLE | C357: 1 | D357: 0 | E357: =C357*6+D357 -> 6 | G357: 5 | H357: 0 | I357: =G357*6+H357 -> 30 | K357: 11 | L357: 1 | M357: =K357*6+L357 -> 67 | O357: 15 | P357: 2 | Q357: =O357*6+P357 -> 92 | S357: NORTHCOTE
A358: NORTHCOTE | C358: 2 | D358: 6 | E358: =C358*6+D358 -> 18 | G358: 5 | H358: 6 | I358: =G358*6+H358 -> 36 | K358: 6 | L358: 7 | M358: =K358*6+L358 -> 43 | O358: 8 | P358: 8 | Q358: =O358*6+P358 -> 56 | S358: TREWIN
A359: BEST PLAYERS
A360: YARRAVILLE | C360: EVANS | F360: BOB BROWN | I360: McGILL | L360: CLEGG | O360: WHITTEN | R360: ORANGE
A361: NORTHCOTE | C361: C LANGBORNE | F361: ADAMSON | I361: BRETHERTON | L361: SIMPSON | O361: LAVER | R361: R LANGBORNE
A362: GOALKICKERS
A363: YARRAVILLE | C363: EVANS 12 | G363: CLEGG | J363: WHITTEN | M363: KNOTT
A364: NORTHCOTE | C364: R LANGBORNE 2 | G364: BRUSH 2 | I364: ADAMSON | L364: SIMPSON | N364: GASKETT | P364: K MAYNE
C365: 9TH JUNE | F365: WEATHER | I365: RAIN
A366: OAKLEIGH | C366: 1 | D366: 2 | E366: =C366*6+D366 -> 8 | G366: 6 | H366: 5 | I366: =G366*6+H366 -> 41 | K366: 8 | L366: 6 | M366: =K366*6+L366 -> 54 | O366: 9 | P366: 10 | Q366: =O366*6+P366 -> 64 | S366: COBURG
A367: COBURG | C367: 4 | D367: 4 | E367: =C367*6+D367 -> 28 | G367: 4 | H367: 4 | I367: =G367*6+H367 -> 28 | K367: 5 | L367: 7 | M367: =K367*6+L367 -> 37 | O367: 8 | P367: 10 | Q367: =O367*6+P367 -> 58 | S367: MILLEN
A368: BEST PLAYERS
A369: OAKLEIGH | C369: MULDOON | F369: RICCI | I369: YOUNG | L369: JEWELL | O369: KITTO | R369: JONES
A370: COBURG | C370: BYRON | F370: CORNEILISON | I370: LEYDIN | L370: FITZPATRICK | O370: CARMODY | R370: SULLIVAN
A371: GOALKICKERS
A372: OAKLEIGH | C372: JEWELL 5 | F372: RICCI 2 | H372: CRAWFORD 2
A373: COBURG | C373: CARMODY 3 | F373: FITZPATRICK 2 | J373: LEYDIN | L373: SULLIVAN | N373: POWELL
E374: 10TH JUNE | H374: WEST WIND RAIN
A375: SANDRINGHAM | C375: 7 | D375: 3 | E375: =C375*6+D375 -> 45 | G375: 9 | H375: 8 | I375: =G375*6+H375 -> 62 | K375: 13 | L375: 11 | M375: =K375*6+L375 -> 89 | O375: 17 | P375: 16 | Q375: =O375*6+P375 -> 118 | S375: BEACH ROAD
A376: BRUNSWICK | C376: 1 | D376: 3 | E376: =C376*6+D376 -> 9 | G376: 3 | H376: 9 | I376: =G376*6+H376 -> 27 | K376: 6 | L376: 9 | M376: =K376*6+L376 -> 45 | O376: 7 | P376: 11 | Q376: =O376*6+P376 -> 53 | S376: O'NEILL
A377: BEST PLAYERS
A378: SANDRINGHAM | C378: McCOMB | F378: KENNEDY | I378: WILLS | L378: DAWSON | N378: CLARK | Q378: CLIFFORD
A379: BRUNSWICK | C379: WHILEY | F379: ROBINSON | I379: AMBROSE | L379: AYRES | N379: DILLON | Q379: TOZER
A380: GOALKICKERS
A381: SANDRINGHAM | C381: CLARK 4 | F381: DAWSON 3 | I381: STRACHAN 2 | L381: SHRIVES 2 | N381: KENNEDY 2 | Q381: WEBSTER 2 | T381: WILLS 2
A382: BRUNSWICK | C382: STANLEY 2 | F382: WHILEY 2 | I382: AMBROSE | L382: AYRES | N382: COOK
A384: ROUND 9 | D384: 15TH JUNE | H384: WEATHER | J384: STRONG NORTH WEST WIND RAIN AFTER 1/4 TIME | S384: PLAYED AT
D385: 1ST QTR | H385: 2ND QTR | L385: 3RD QTR | P385: FINAL | S385: MOORABBIN
A386: MOORABBIN | C386: 4 | D386: 3 | E386: =C386*6+D386 -> 27 | G386: 4 | H386: 4 | I386: =G386*6+H386 -> 28 | K386: 5 | L386: 9 | M386: =K386*6+L386 -> 39 | O386: 6 | P386: 11 | Q386: =O386*6+P386 -> 47 | S386: UMPIRE | X386: LADDER | AB386: ROUND | AD386: 9
A387: COBURG | C387: 0 | D387: 0 | E387: =C387*6+D387 -> 0 | G387: 1 | H387: 2 | I387: =G387*6+H387 -> 8 | K387: 2 | L387: 4 | M387: =K387*6+L387 -> 16 | O387: 4 | P387: 6 | Q387: =O387*6+P387 -> 30 | S387: MANCE
A388: BEST PLAYERS | W388: TEAM | X388: W | Y388: L | Z388: D | AA388: FOR | AB388: AGST | AC388: % | AD388: PTS
A389: MOORABBIN | C389: CRAMERI | F389: KEE | I389: RYAN | L389: WHALEBONE | O389: PAPLEY | R389: HARRISON
A390: COBURG | C390: CARMODY | F390: BOXSHALL | I390: FITZPATRICK | L390: McDONNELL | O390: SCHREIBER | R390: BRANSTON | W390: YARRAVILLE | X390: 7 | Y390: 2 | Z390: 0 | AA390: 763 | AB390: 670 | AC390: 113.88059701492537 | AD390: 28
A391: GOALKICKERS | W391: SANDRINGHAM | X391: 6 | Y391: 3 | Z391: 0 | AA391: 969 | AB391: 731 | AC391: 132.55813953488371 | AD391: 24
A392: MOORABBIN | C392: BRYAN 3 | F392: RYAN | H392: WHALEBONE | K392: KERR | W392: MOORABBIN | X392: 6 | Y392: 3 | Z392: 0 | AA392: 669 | AB392: 567 | AC392: 117.98941798941799 | AD392: 24
A393: COBURG | C393: L BRIMACOMBE | G393: FITZPATRICK | K393: CARMODY | N393: BOXSHALL | W393: PORT MELBOURNE | X393: 5 | Y393: 4 | Z393: 0 | AA393: 744 | AB393: 680 | AC393: 109.41176470588235 | AD393: 20
A395: DANDENONG | C395: 2 | D395: 6 | E395: =C395*6+D395 -> 18 | G395: 4 | H395: 10 | I395: =G395*6+H395 -> 34 | K395: 8 | L395: 12 | M395: =K395*6+L395 -> 60 | O395: 16 | P395: 14 | Q395: =O395*6+P395 -> 110 | S395: OAKLEIGH | W395: COBURG | X395: 5 | Y395: 4 | Z395: 0 | AA395: 717 | AB395: 668 | AC395: 107.33532934131736 | AD395: 20
A396: OAKLEIGH | C396: 1 | D396: 1 | E396: =C396*6+D396 -> 7 | G396: 1 | H396: 4 | I396: =G396*6+H396 -> 10 | K396: 3 | L396: 6 | M396: =K396*6+L396 -> 24 | O396: 5 | P396: 7 | Q396: =O396*6+P396 -> 37 | S396: TREWIN | W396: DANDENONG | X396: 4 | Y396: 5 | Z396: 0 | AA396: 796 | AB396: 704 | AC396: 113.06818181818181 | AD396: 16
A397: BEST PLAYERS | W397: WILLIAMSTOWN | X397: 4 | Y397: 5 | Z397: 0 | AA397: 708 | AB397: 709 | AC397: 99.858956276445696 | AD397: 16
A398: DANDENONG | C398: DELANTY | F398: GRAY | I398: KENT | L398: COLE | O398: ABRAHAM | R398: DINEEN | W398: BRUNSWICK | X398: 4 | Y398: 5 | Z398: 0 | AA398: 736 | AB398: 873 | AC398: 84.306987399770904 | AD398: 16
A399: OAKLEIGH | C399: TURNER | F399: MULDOON | I399: RICCI | L399: LUFF | O399: MAUGHAN | R399: CRAWFORD | W399: OAKLEIGH | X399: 3 | Y399: 6 | Z399: 0 | AA399: 606 | AB399: 697 | AC399: 86.94404591104734 | AD399: 12
A400: GOALKICKERS | W400: NORTHCOTE | X400: 1 | Y400: 8 | Z400: 0 | AA400: 492 | AB400: 901 | AC400: 54.605993340732518 | AD400: 4
A401: DANDENONG | C401: GRAY 5 | F401: WRIGHT 3 | I401: LITTLE 3 | K401: WATERS | M401: DUNCAN | O401: OSBORNE | Q401: KENT | S401: DINEEN
A402: OAKLEIGH | C402: MAUGHAN 2 | G402: CRAWFORD | J402: RICCI | L402: JEWELL
E403: 16TH JUNE | J403: WEATHER | N403: RAIN
A404: PORT MELBOURNE | C404: 1 | D404: 5 | E404: =C404*6+D404 -> 11 | G404: 5 | H404: 16 | I404: =G404*6+H404 -> 46 | K404: 7 | L404: 20 | M404: =K404*6+L404 -> 62 | O404: 12 | P404: 24 | Q404: =O404*6+P404 -> 96 | S404: PORT MELBOURNE
A405: SANDRINGHAM | C405: 3 | D405: 3 | E405: =C405*6+D405 -> 21 | G405: 3 | H405: 3 | I405: =G405*6+H405 -> 21 | K405: 7 | L405: 10 | M405: =K405*6+L405 -> 52 | O405: 9 | P405: 13 | Q405: =O405*6+P405 -> 67 | S405: McMASTER
A406: BEST PLAYERS
A407: PORT MELBOURNE | C407: MILNER | F407: JEFFREY | I407: TAGGART | L407: STRAUCH | O407: CORRIGAN | R407: FREYER
A408: SANDRINGHAM | C408: McCOMB | F408: BURKE | I408: HOAR | L408: KENNEDY | O408: PAY | R408: CLIFFORD
A409: GOALKICKERS
A410: PORT MELBOURNE | C410: BONNETT 3 | F410: JEFFREY 3 | I410: MILNER 2 | K410: TAGGART | M410: LAWSON | O410: MITHEN | Q410: CORRIGAN
A411: SANDRINGHAM | C411: SHRIVES 2 | F411: DAWSON 2 | I411: O'TOOLE | K411: KENNEDY | M411: BURKE | O411: CLARK | Q411: SHEAHAN
A413: YARRAVILLE | C413: 2 | D413: 2 | E413: =C413*6+D413 -> 14 | G413: 3 | H413: 5 | I413: =G413*6+H413 -> 23 | K413: 6 | L413: 10 | M413: =K413*6+L413 -> 46 | O413: 7 | P413: 14 | Q413: =O413*6+P413 -> 56 | S413: YARRAVILLE
A414: WILLIAMSTOWN | C414: 1 | D414: 4 | E414: =C414*6+D414 -> 10 | G414: 3 | H414: 4 | I414: =G414*6+H414 -> 22 | K414: 4 | L414: 5 | M414: =K414*6+L414 -> 29 | O414: 6 | P414: 7 | Q414: =O414*6+P414 -> 43 | S414: POLLLARD
A415: BEST PLAYERS
A416: YARRAVILLE | C416: CLEGG | F416: WILSON | I416: NARKIEWICZ | L416: WHITTEN | O416: WARWICK | R416: MALONEY
A417: WILLIAMSTOWN | C417: CARMICHAEL | F417: SAVIGE | I417: MAZOURIS | L417: WARD | O417: RUSSELL | R417: TAUBE
A418: GOALKICKERS
A419: YARRAVILLE | C419: WHITTEN 2 | F419: CLEGG 2 | I419: HILL | K419: ALLEN | M419: LAMONT
A420: WILLIAMSTOWN | C420: TURNER 2 | F420: JAMES 2 | I420: WILLIAMS | K420: CLOUGH
A422: BRUNSWICK | C422: 2 | D422: 7 | E422: =C422*6+D422 -> 19 | G422: 4 | H422: 9 | I422: =G422*6+H422 -> 33 | K422: 8 | L422: 12 | M422: =K422*6+L422 -> 60 | O422: 9 | P422: 14 | Q422: =O422*6+P422 -> 68 | S422: BRUNSWICK
A423: NORTHCOTE | C423: 2 | D423: 1 | E423: =C423*6+D423 -> 13 | G423: 3 | H423: 5 | I423: =G423*6+H423 -> 23 | K423: 3 | L423: 7 | M423: =K423*6+L423 -> 25 | O423: 7 | P423: 10 | Q423: =O423*6+P423 -> 52 | S423: BEARD
A424: BEST PLAYERS
A425: BRUNSWICK | C425: THOMPSON | F425: K DILLON | I425: WATT | L425: BIBBY | O425: EDWARDS | R425: AMBROSE
A426: NORTHCOTE | C426: EASTAWAY | F426: C LANGBORNE | I426: BEECHER | L426: ADAMSON | O426: GASKETT | R426: LACHMUND
A427: GOALKICKERS
A428: BRUNSWICK | C428: COOK 3 | F428: BIBBY 2 | I428: WHILEY | K428: EDWARDS | N428: K DILLON | Q428: AMBROSE
A429: NORTHCOTE | C429: ADAMSON 2 | F429: R LANGBORNE 2 | J429: GASKETT 2 | M429: LACHMUND
A431: ROUND 10 | E431: 22ND JUNE | I431: WEATHER | L431: DULL GROUNDS VERY BAD AFTER RAIN | S431: PLAYED AT
D432: 1ST QTR | H432: 2ND QTR | L432: 3RD QTR | P432: FINAL | S432: COBURG
A433: COBURG | C433: 2 | D433: 6 | E433: =C433*6+D433 -> 18 | G433: 4 | H433: 10 | I433: =G433*6+H433 -> 34 | K433: 7 | L433: 13 | M433: =K433*6+L433 -> 55 | O433: 10 | P433: 14 | Q433: =O433*6+P433 -> 74 | S433: UMPIRE | X433: LADDER | AB433: ROUND | AD433: 10
A434: YARRAVILLE | C434: 1 | D434: 5 | E434: =C434*6+D434 -> 11 | G434: 3 | H434: 6 | I434: =G434*6+H434 -> 24 | K434: 9 | L434: 10 | M434: =K434*6+L434 -> 64 | O434: 10 | P434: 12 | Q434: =O434*6+P434 -> 72 | S434: McMASTER
A435: BEST PLAYERS | W435: TEAM | X435: W | Y435: L | Z435: D | AA435: FOR | AB435: AGST | AC435: % | AD435: PTS
A436: COBURG | C436: CARMODY | F436: MICKLESON | I436: BYRON | L436: FITZPATRICK | O436: McNABB | R436: LEYDIN
A437: YARRAVILLE | C437: WILSON | F437: MEDDINGS | I437: CLEGG | L437: RON BROWN | O437: EVANS | R437: MALONEY | W437: SANDRINGHAM | X437: 7 | Y437: 3 | Z437: 0 | AA437: 1082 | AB437: 816 | AC437: 132.59803921568627 | AD437: 28
A438: GOALKICKERS | W438: MOORABBIN | X438: 7 | Y438: 3 | Z438: 0 | AA438: 738 | AB438: 617 | AC438: 119.61102106969206 | AD438: 28
A439: COBURG | C439: CARMODY 3 | F439: MICKLESON 2 | I439: ROCHOW 2 | L439: McDONNELL | O439: BOXSHALL | Q439: ACKLAND | W439: YARRAVILLE | X439: 7 | Y439: 3 | Z439: 0 | AA439: 835 | AB439: 744 | AC439: 112.23118279569893 | AD439: 28
A440: YARRAVILLE | C440: EVANS 5 | F440: LAMONT 2 | I440: MEDDINGS | K440: WRIGHT | M440: HILL | W440: COBURG | X440: 6 | Y440: 4 | Z440: 0 | AA440: 791 | AB440: 740 | AC440: 106.89189189189189 | AD440: 24
A442: MOORABBIN | C442: 1 | D442: 2 | E442: =C442*6+D442 -> 8 | G442: 4 | H442: 4 | I442: =G442*6+H442 -> 28 | K442: 7 | L442: 7 | M442: =K442*6+L442 -> 49 | O442: 10 | P442: 9 | Q442: =O442*6+P442 -> 69 | S442: WILLIAMSTOWN | W442: DANDENONG | X442: 5 | Y442: 5 | Z442: 0 | AA442: 867 | AB442: 771 | AC442: 112.45136186770428 | AD442: 20
A443: WILLIAMSTOWN | C443: 0 | D443: 1 | E443: =C443*6+D443 -> 1 | G443: 3 | H443: 2 | I443: =G443*6+H443 -> 20 | K443: 5 | L443: 4 | M443: =K443*6+L443 -> 34 | O443: 7 | P443: 8 | Q443: =O443*6+P443 -> 50 | S443: HORNE | W443: PORT MELBOURNE | X443: 5 | Y443: 5 | Z443: 0 | AA443: 784 | AB443: 731 | AC443: 107.25034199726402 | AD443: 20
A444: BEST PLAYERS | W444: WILLIAMSTOWN | X444: 4 | Y444: 6 | Z444: 0 | AA444: 758 | AB444: 778 | AC444: 97.429305912596405 | AD444: 16
A445: MOORABBIN | C445: HOY | F445: KERR | I445: CRAMERI | L445: BURNS | O445: WHALEBONE | R445: PERRY | W445: BRUNSWICK | X445: 4 | Y445: 6 | Z445: 0 | AA445: 803 | AB445: 944 | AC445: 85.063559322033896 | AD445: 16
A446: WILLIAMSTOWN | C446: MALONEY | F446: MAZOURIS | I446: MURRIE | L446: TAUBE | O446: SAVIGE | R446: HYNES | W446: OAKLEIGH | X446: 3 | Y446: 7 | Z446: 0 | AA446: 691 | AB446: 810 | AC446: 85.308641975308646 | AD446: 12
A447: GOALKICKERS | W447: NORTHCOTE | X447: 2 | Y447: 8 | Z447: 0 | AA447: 543 | AB447: 941 | AC447: 57.704569606801279 | AD447: 8
A448: MOORABBIN | C448: KEE 2 | F448: BURNS 2 | I448: BRYAN 2 | L448: PAPLEY 2 | O448: WHALEBONE 2
A449: WILLIAMSTOWN | C449: JAMES 3 | F449: MALONEY | I449: MURPHY | L449: MAZOURIS | O449: CLOUGH
A451: DANDENONG | C451: 1 | D451: 7 | E451: =C451*6+D451 -> 13 | G451: 5 | H451: 10 | I451: =G451*6+H451 -> 40 | K451: 7 | L451: 12 | M451: =K451*6+L451 -> 54 | O451: 9 | P451: 17 | Q451: =O451*6+P451 -> 71 | S451: DANDENONG
A452: BRUNSWICK | C452: 1 | D452: 3 | E452: =C452*6+D452 -> 9 | G452: 5 | H452: 7 | I452: =G452*6+H452 -> 37 | K452: 6 | L452: 11 | M452: =K452*6+L452 -> 47 | O452: 9 | P452: 13 | Q452: =O452*6+P452 -> 67 | S452: MANCE
A453: BEST PLAYERS
A454: DANDENONG | C454: WATERS | F454: GRAY | I454: DELANTY | L454: ABRAHAM | O454: LITTLE | R454: DINEEN
A455: BRUNSWICK | C455: K DILLON | F455: AMBROSE | I455: NASH | L455: COOK | O455: WHILEY | R455: BRIGLIA
A456: GOALKICKERS
A457: DANDENONG | C457: BARRAN 2 | F457: GRAY 2 | I457: WATERS | K457: LITTLE | M457: OSBORNE | O457: KENT | Q457: DINEEN
A458: BRUNSWICK | C458: K DILLON 4 | F458: COOK 3 | I458: WICKS | K458: ARTHUR
A460: NORTHCOTE | C460: 1 | D460: 4 | E460: =C460*6+D460 -> 10 | G460: 4 | H460: 7 | I460: =G460*6+H460 -> 31 | K460: 6 | L460: 7 | M460: =K460*6+L460 -> 43 | O460: 7 | P460: 9 | Q460: =O460*6+P460 -> 51 | S460: NORTHCOTE
A461: PORT MELBOURNE | C461: 4 | D461: 3 | E461: =C461*6+D461 -> 27 | G461: 5 | H461: 3 | I461: =G461*6+H461 -> 33 | K461: 5 | L461: 6 | M461: =K461*6+L461 -> 36 | O461: 5 | P461: 10 | Q461: =O461*6+P461 -> 40 | S461: JACKSON
A462: BEST PLAYERS
A463: NORTHCOTE | C463: SIMPSON | F463: OUSLEY | I463: LAVER | L463: C LANGBORNE | O463: R LANGBORNE | R463: VAINS
A464: PORT MELBOURNE | C464: FREYER | F464: RENOUF | I464: MITHEN | L464: STRAUCH | O464: CORRIGAN | R464: BONNETT
A465: GOALKICKERS
A466: NORTHCOTE | C466: OUSLEY 2 | F466: C LANGBORNE | I466: R LANGBORNE | L466: MISSON | N466: BEECHER | Q466: LACHMUND
A467: PORT MELBOURNE | C467: BONNETT 4 | G467: MITHEN
A469: SANDRINGHAM | C469: 5 | D469: 5 | E469: =C469*6+D469 -> 35 | G469: 10 | H469: 9 | I469: =G469*6+H469 -> 69 | K469: 14 | L469: 10 | M469: =K469*6+L469 -> 94 | O469: 17 | P469: 11 | Q469: =O469*6+P469 -> 113 | S469: BEACH ROAD
A470: OAKLEIGH | C470: 0 | D470: 2 | E470: =C470*6+D470 -> 2 | G470: 3 | H470: 4 | I470: =G470*6+H470 -> 22 | K470: 8 | L470: 6 | M470: =K470*6+L470 -> 54 | O470: 13 | P470: 7 | Q470: =O470*6+P470 -> 85 | S470: BAIRD
A471: BEST PLAYERS
A472: SANDRINGHAM | C472: CLARK | F472: McCOMB | I472: MUSGROVE | L472: STRACHAN | O472: CLIFFORD | R472: MUTER
A473: OAKLEIGH | C473: JONES | F473: TURNER | I473: PEAKE | L473: McLAREN | O473: CRAWFORD | R473: MULDOON
A474: GOALKICKERS
A475: SANDRINGHAM | C475: WILLS 5 | E475: STRACHAN 3 | H475: CLARK 2 | J475: MUTER 2 | M475: SHRIVES 2 | P475: BURKE | R475: O'TOOLE | U475: SOUTHERN
A476: OAKLEIGH | C476: JONES 5 | E476: JEWELL 2 | H476: CRAWFORD 2 | K476: DONALD | M476: RICCI | O476: MAUGHAN | R476: McCOOKE
A478: ROUND 11 | E478: 29TH JUNE | J478: WEATHER | N478: NORTH BREEZE FINE | S478: PLAYED AT
D479: 1ST QTR | H479: 2ND QTR | L479: 3RD QTR | P479: FINAL | S479: MOORABBIN
A480: MOORABBIN | C480: 6 | D480: 4 | E480: =C480*6+D480 -> 40 | G480: 11 | H480: 7 | I480: =G480*6+H480 -> 73 | K480: 16 | L480: 9 | M480: =K480*6+L480 -> 105 | O480: 21 | P480: 14 | Q480: =O480*6+P480 -> 140 | S480: UMPIRE | X480: LADDER | AB480: ROUND | AD480: 11
A481: SANDRINGHAM | C481: 1 | D481: 1 | E481: =C481*6+D481 -> 7 | G481: 5 | H481: 7 | I481: =G481*6+H481 -> 37 | K481: 8 | L481: 7 | M481: =K481*6+L481 -> 55 | O481: 11 | P481: 9 | Q481: =O481*6+P481 -> 75 | S481: POLLARD
A482: BEST PLAYERS | W482: TEAM | X482: W | Y482: L | Z482: D | AA482: FOR | AB482: AGST | AC482: % | AD482: PTS
A483: MOORABBIN | C483: PAPLEY | F483: KERR | I483: MUIR | L483: GUTTERSON | O483: CRAMERI | R483: WHALEBONE
A484: SANDRINGHAM | C484: BURNS | F484: MCCOMB | I484: MUSGROVE | L484: HOAR | O484: KENNEDY | R484: BURKE | W484: MOORABBIN | X484: 8 | Y484: 3 | Z484: 0 | AA484: 878 | AB484: 692 | AC484: 126.878612716763 | AD484: 32
A485: GOALKICKERS | Q485: CHRISTIE | W485: YARRAVILLE | X485: 8 | Y485: 3 | Z485: 0 | AA485: 926 | AB485: 804 | AC485: 115.17412935323384 | AD485: 32
A486: MOORABBIN | C486: PAPLEY 5 | E486: BRYAN 4 | G486: SHEPHERD 3 | J486: WHALEBONE 3 | M486: HARRISON 2 | P486: BURNS | R486: KUPSCH | T486: MUIR | W486: SANDRINGHAM | X486: 7 | Y486: 4 | Z486: 0 | AA486: 1157 | AB486: 956 | AC486: 121.02510460251047 | AD486: 28
A487: SANDRINGHAM | C487: O'TOOLE 3 | F487: BURNS 2 | I487: WILLS 2 | K487: SHRIVES | M487: KENNEDY | P487: BURKE | R487: CLARK | W487: COBURG | X487: 7 | Y487: 4 | Z487: 0 | AA487: 908 | AB487: 851 | AC487: 106.69800235017627 | AD487: 28
A489: YARRAVILLE | C489: 6 | D489: 1 | E489: =C489*6+D489 -> 37 | G489: 7 | H489: 2 | I489: =G489*6+H489 -> 44 | K489: 12 | L489: 9 | M489: =K489*6+L489 -> 81 | O489: 13 | P489: 13 | Q489: =O489*6+P489 -> 91 | S489: YARRAVILLE | W489: DANDENONG | X489: 5 | Y489: 6 | Z489: 0 | AA489: 927 | AB489: 862 | AC489: 107.54060324825986 | AD489: 20
A490: DANDENONG | C490: 0 | D490: 3 | E490: =C490*6+D490 -> 3 | G490: 4 | H490: 6 | I490: =G490*6+H490 -> 30 | K490: 5 | L490: 7 | M490: =K490*6+L490 -> 37 | O490: 8 | P490: 12 | Q490: =O490*6+P490 -> 60 | S490: FLANAGAN | W490: PORT MELBOURNE | X490: 5 | Y490: 6 | Z490: 0 | AA490: 895 | AB490: 848 | AC490: 105.54245283018868 | AD490: 20
A491: BEST PLAYERS | W491: WILLIAMSTOWN | X491: 5 | Y491: 6 | Z491: 0 | AA491: 845 | AB491: 852 | AC491: 99.178403755868544 | AD491: 20
A492: YARRAVILLE | C492: CLEGG | F492: MEDDINGS | I492: RON BROWN | L492: WHITTEN | O492: WARWICK | R492: WRIGHT | W492: OAKLEIGH | X492: 4 | Y492: 7 | Z492: 0 | AA492: 779 | AB492: 846 | AC492: 92.080378250591011 | AD492: 16
A493: DANDENONG | C493: DELANTY | F493: WRIGHT | I493: DINEEN | L493: OSBORNE | O493: PITCHER | R493: KENT | W493: BRUNSWICK | X493: 4 | Y493: 7 | Z493: 0 | AA493: 877 | AB493: 1031 | AC493: 85.063045586808926 | AD493: 16
A494: GOALKICKERS | W494: NORTHCOTE | X494: 2 | Y494: 9 | Z494: 0 | AA494: 579 | AB494: 1029 | AC494: 56.268221574344025 | AD494: 8
A495: YARRAVILLE | C495: CLEGG 4 | F495: WHITTEN 3 | I495: MEDDINGS 3 | L495: CONNELLY 2 | O495: ALLEN
A496: DANDENONG | C496: DUNCAN 3 | F496: OSBORNE | I496: DELANTY | L496: KENT | N496: WRIGHT | P496: COLE
A498: WILLIAMSTOWN | C498: 3 | D498: 4 | E498: =C498*6+D498 -> 22 | G498: 7 | H498: 7 | I498: =G498*6+H498 -> 49 | K498: 11 | L498: 10 | M498: =K498*6+L498 -> 76 | O498: 12 | P498: 15 | Q498: =O498*6+P498 -> 87 | S498: BRUNSWICK
A499: BRUNSWICK | C499: 3 | D499: 3 | E499: =C499*6+D499 -> 21 | G499: 4 | H499: 7 | I499: =G499*6+H499 -> 31 | K499: 8 | L499: 11 | M499: =K499*6+L499 -> 59 | O499: 10 | P499: 14 | Q499: =O499*6+P499 -> 74 | S499: CRAIG
A500: BEST PLAYERS
A501: WILLIAMSTOWN | C501: MALONEY | F501: RUSSELL | I501: SAVIGE | L501: CLOUGH | O501: TURNER | R501: CARMICHAEL
A502: BRUNSWICK | C502: COOK | F502: STANLEY | I502: WHILEY | L502: WILSON | O502: THOMPSON | R502: K DILLON
A503: GOALKICKERS
A504: WILLIAMSTOWN | C504: TURNER 2 | F504: WARD 2 | I504: JONES 2 | L504: CLOUGH 2 | O504: HYNES | Q504: MALONEY | S504: COPE | U504: JOHNSON
A505: BRUNSWICK | C505: COOK 3 | F505: DARBY 2 | I505: K DILLON 2 | L505: STANLEY | O505: BIBBY | Q505: K DILLON
A507: OAKLEIGH | C507: 4 | D507: 0 | E507: =C507*6+D507 -> 24 | G507: 7 | H507: 2 | I507: =G507*6+H507 -> 44 | K507: 9 | L507: 6 | M507: =K507*6+L507 -> 60 | O507: 13 | P507: 10 | Q507: =O507*6+P507 -> 88 | S507: OAKLEIGH
A508: NORTHCOTE | C508: 3 | D508: 0 | E508: =C508*6+D508 -> 18 | G508: 4 | H508: 3 | I508: =G508*6+H508 -> 27 | K508: 4 | L508: 4 | M508: =K508*6+L508 -> 28 | O508: 5 | P508: 6 | Q508: =O508*6+P508 -> 36 | S508: MANCE
A509: BEST PLAYERS
A510: OAKLEIGH | C510: JONES | F510: MULDOON | I510: MURRAY | L510: MAUGHAN | O510: McCOOKE | R510: RICCI
A511: NORTHCOTE | C511: OUSLEY | F511: ADAMSON | I511: R LANGBORNE | L511: LACHMUND | O511: McBREEN | R511: WEGNER
A512: GOALKICKERS
A513: OAKLEIGH | C513: JONES 3 | F513: KITTO 2 | I513: MULDOON 2 | L513: MURRAY 2 | O513: RICCI 2 | Q513: GIBBON | S513: MAUGHAN
A514: NORTHCOTE | C514: LACHMUND 2 | F514: SIMPSON | I514: R LANGBORNE | L514: OUSLEY
E515: 30TH JUNE | H515: WEATHER | K515: FINE
A516: COBURG | C516: 3 | D516: 2 | E516: =C516*6+D516 -> 20 | G516: 6 | H516: 7 | I516: =G516*6+H516 -> 43 | K516: 15 | L516: 10 | M516: =K516*6+L516 -> 100 | O516: 17 | P516: 15 | Q516: =O516*6+P516 -> 117 | S516: PORT MELBOURNE
A517: PORT MELBOURNE | C517: 2 | D517: 2 | E517: =C517*6+D517 -> 14 | G517: 8 | H517: 8 | I517: =G517*6+H517 -> 56 | K517: 12 | L517: 14 | M517: =K517*6+L517 -> 86 | O517: 16 | P517: 15 | Q517: =O517*6+P517 -> 111 | S517: TREWIN
A518: BEST PLAYERS
A519: COBURG | C519: CARMODY | F519: MICKLESON | I519: MCDONNELL | L519: SULLIVAN | O519: BYRON | R519: BUTCHER
A520: PORT MELBOURNE | C520: FREYER | F520: MILNER | I520: CARLILE | L520: TAGGART | O520: STRAUCH | R520: WILLIAMS
A521: GOALKICKERS
A522: COBURG | C522: MCDONNELL 5 | F522: MICKLESON 3 | I522: RICCI 2 | K522: CARMODY 2 | N522: BOXSHALL 2 | Q522: POWELL | S522: BUTCHER | V522: LEYDIN
A523: PORT MELBOURNE | C523: CARLILE 5 | F523: MERRETT 3 | I523: CORRIGAN 3 | L523: MILNER 2 | N523: TAGGART 2 | Q523: FREYER
A525: ROUND 12 | E525: 6TH JULY | H525: WEATHER | K525: NORTH WIND GROUNDS VERY BAD WATERLOGGED | S525: PLAYED AT
D526: 1ST QTR | H526: 2ND QTR | L526: 3RD QTR | P526: FINAL | S526: YARRAVILLE
A527: YARRAVILLE | C527: 1 | D527: 4 | E527: =C527*6+D527 -> 10 | G527: 2 | H527: 10 | I527: =G527*6+H527 -> 22 | K527: 5 | L527: 10 | M527: =K527*6+L527 -> 40 | O527: 7 | P527: 11 | Q527: =O527*6+P527 -> 53 | S527: UMPIRE | X527: LADDER | AB527: ROUND | AD527: 12
A528: MOORABBIN | C528: 3 | D528: 2 | E528: =C528*6+D528 -> 20 | G528: 5 | H528: 3 | I528: =G528*6+H528 -> 33 | K528: 7 | L528: 6 | M528: =K528*6+L528 -> 48 | O528: 7 | P528: 8 | Q528: =O528*6+P528 -> 50 | S528: O'NEILL
A529: BEST PLAYERS | W529: TEAM | X529: W | Y529: L | Z529: D | AA529: FOR | AB529: AGST | AC529: % | AD529: PTS
A530: YARRAVILLE | C530: WHITTEN | F530: BOB BROWN | I530: ALLEN | L530: RON BROWN | O530: EVANS | Q530: WILSON
A531: MOORABBIN | C531: GUTTERSON | F531: CROSHER | I531: PAPLEY | L531: HARRISON | O531: BURNS | Q531: KERR | W531: YARRAVILLE | X531: 9 | Y531: 3 | Z531: 0 | AA531: 979 | AB531: 854 | AC531: 114.63700234192038 | AD531: 36
A532: GOALKICKERS | W532: MOORABBIN | X532: 8 | Y532: 4 | Z532: 0 | AA532: 928 | AB532: 745 | AC532: 124.56375838926175 | AD532: 32
A533: YARRAVILLE | C533: WHITTEN 2 | F533: EVANS 2 | I533: LARKINS | K533: ALLEN | M533: CONNELLY | W533: SANDRINGHAM | X533: 8 | Y533: 4 | Z533: 0 | AA533: 1288 | AB533: 1059 | AC533: 121.62417374881964 | AD533: 32
A534: MOORABBIN | C534: BRYAN 3 | F534: BURNS 2 | I534: PAPLEY 2 | W534: COBURG | X534: 8 | Y534: 4 | Z534: 0 | AA534: 993 | AB534: 884 | AC534: 112.33031674208145 | AD534: 32
A536: SANDRINGHAM | C536: 2 | D536: 2 | E536: =C536*6+D536 -> 14 | G536: 6 | H536: 7 | I536: =G536*6+H536 -> 43 | K536: 13 | L536: 12 | M536: =K536*6+L536 -> 90 | O536: 19 | P536: 17 | Q536: =O536*6+P536 -> 131 | S536: BEACH ROAD | W536: WILLIAMSTOWN | X536: 6 | Y536: 6 | Z536: 0 | AA536: 930 | AB536: 883 | AC536: 105.32276330690827 | AD536: 24
A537: DANDENONG | C537: 7 | D537: 3 | E537: =C537*6+D537 -> 45 | G537: 9 | H537: 5 | I537: =G537*6+H537 -> 59 | K537: 13 | L537: 11 | M537: =K537*6+L537 -> 89 | O537: 15 | P537: 13 | Q537: =O537*6+P537 -> 103 | S537: HORNE | W537: DANDENONG | X537: 5 | Y537: 7 | Z537: 0 | AA537: 1030 | AB537: 993 | AC537: 103.72608257804633 | AD537: 20
A538: BEST PLAYERS | W538: PORT MELBOURNE | X538: 5 | Y538: 7 | Z538: 0 | AA538: 983 | AB538: 960 | AC538: 102.39583333333333 | AD538: 20
A539: SANDRINGHAM | C539: BURNS | F539: SHRIVES | I539: CLARK | L539: STRACHAN | O539: WILLS | Q539: MUTER | W539: OAKLEIGH | X539: 5 | Y539: 7 | Z539: 0 | AA539: 891 | AB539: 934 | AC539: 95.396145610278367 | AD539: 20
A540: DANDENONG | C540: WATERS | F540: PENNEFATHER | I540: DELANTY | L540: WRIGHT | O540: DINEEN | Q540: PITCHER | W540: BRUNSWICK | X540: 4 | Y540: 8 | Z540: 0 | AA540: 910 | AB540: 1116 | AC540: 81.541218637992827 | AD540: 16
A541: GOALKICKERS | P541: WEBSTER | S541: BURKE | W541: NORTHCOTE | X541: 2 | Y541: 10 | Z541: 0 | AA541: 610 | AB541: 1114 | AC541: 54.75763016157989 | AD541: 8
A542: SANDRINGHAM | C542: CLARK 4 | E542: BURNS 3 | G542: DAWSON 2 | J542: SHRIVES 2 | M542: KENNEDY 2 | P542: WILLS 2 | R542: STRACHAN 2
A543: DANDENONG | C543: WATERS 4 | F543: GRAY 3 | H543: PORTER 2 | J543: OSBORNE 2 | M543: PETERS | O543: KENT | Q543: DINEEN | S543: HEWITT
A545: WILLIAMSTOWN | C545: 2 | D545: 1 | E545: =C545*6+D545 -> 13 | G545: 6 | H545: 4 | I545: =G545*6+H545 -> 40 | K545: 10 | L545: 5 | M545: =K545*6+L545 -> 65 | O545: 13 | P545: 7 | Q545: =O545*6+P545 -> 85 | S545: WILLIAMSTOWN
A546: NORTHCOTE | C546: 0 | D546: 0 | E546: =C546*6+D546 -> 0 | G546: 1 | H546: 10 | I546: =G546*6+H546 -> 16 | K546: 2 | L546: 12 | M546: =K546*6+L546 -> 24 | O546: 3 | P546: 13 | Q546: =O546*6+P546 -> 31 | S546: CRAIG
A547: BEST PLAYERS
A548: WILLIAMSTOWN | C548: TURNER | F548: SAVIGE | I548: WARD | L548: MALONEY | O548: TAUBE | R548: CLOUGH
A549: NORTHCOTE | C549: C LANGBORNE | F549: BRETHERTON | I549: LAVER | L549: KEAYS | O549: BEECHER | R549: WEGNER
A550: GOALKICKERS
A551: WILLIAMSTOWN | C551: JONES 3 | F551: JOHNS 2 | I551: MALONEY 2 | L551: CLOUGH 2 | O551: TURNER | Q551: O'TOOLE | S551: JOHNSON | V551: FOGARTY
A552: NORTHCOTE | C552: VAINS 2 | F552: MISSON
D553: 7TH JULY | I553: WEATHER
A554: OAKLEIGH | C554: 5 | D554: 3 | E554: =C554*6+D554 -> 33 | G554: 8 | H554: 8 | I554: =G554*6+H554 -> 56 | K554: 12 | L554: 9 | M554: =K554*6+L554 -> 81 | O554: 16 | P554: 16 | Q554: =O554*6+P554 -> 112 | S554: PORT MELBOURNE
A555: PORT MELBOURNE | C555: 4 | D555: 6 | E555: =C555*6+D555 -> 30 | G555: 7 | H555: 8 | I555: =G555*6+H555 -> 50 | K555: 11 | L555: 12 | M555: =K555*6+L555 -> 78 | O555: 12 | P555: 16 | Q555: =O555*6+P555 -> 88 | S555: FLANAGAN
A556: BEST PLAYERS
A557: OAKLEIGH | C557: PEAKE | F557: RICCI | I557: TURNER | L557: MULDOON | O557: JONES | R557: YOUNG
A558: PORT MELBOURNE | C558: FREYER | F558: STRAUCH | I558: LEWIS | L558: CARLILE | O558: MITHEN | R558: EDWARDS
A559: GOALKICKERS
A560: OAKLEIGH | C560: RICCI 4 | E560: JEWELL 2 | G560: MULDOON 2 | J560: JONES 2 | L560: KITTO | N560: WING | P560: McCOOKE | R560: CRAWFORD | U560: MAUGHAN | X560: YOUNG
A561: PORT MELBOURNE | C561: CARLILE 4 | F561: MITHEN 3 | I561: MERRETT | K561: PERRY | M561: FREYER | O561: EDWARDS | R561: CORRIGAN
A563: COBURG | C563: 3 | D563: 3 | E563: =C563*6+D563 -> 21 | G563: 6 | H563: 6 | I563: =G563*6+H563 -> 42 | K563: 8 | L563: 8 | M563: =K563*6+L563 -> 56 | O563: 12 | P563: 13 | Q563: =O563*6+P563 -> 85 | S563: COBURG
A564: BRUNSWICK | C564: 2 | D564: 2 | E564: =C564*6+D564 -> 14 | G564: 3 | H564: 4 | I564: =G564*6+H564 -> 22 | K564: 4 | L564: 7 | M564: =K564*6+L564 -> 31 | O564: 4 | P564: 9 | Q564: =O564*6+P564 -> 33 | S564: MILLEN
A565: BEST PLAYERS
A566: COBURG | C566: MICKLESON | F566: McNABB | I566: LEYDIN | L566: POWELL | N566: CORNEILISON | Q566: BARCLAY
A567: BRUNSWICK | C567: AYRES | F567: K DILLON | I567: BRIGLIA | L567: WHILEY | N567: DARBY | Q567: WICKS
A568: GOALKICKERS
A569: COBURG | C569: BYRON 6 | F569: LEYDIN 2 | I569: L BRIMACOMBE 2 | M569: MICKLESON | P569: McDONNELL
A570: BRUNSWICK | C570: K DILLON 2 | F570: DENTON | I570: TOZER
A572: ROUND 13 | E572: 13TH JULY | G572: WEATHER | I572: STRONG SOUTH WIND CROUNDS VERY BAD WATERLOGGED | S572: PLAYED AT
D573: 1ST QTR | H573: 2ND QTR | L573: 3RD QTR | P573: FINAL | S573: MOORABBIN
A574: MOORABBIN | C574: 4 | D574: 4 | E574: =C574*6+D574 -> 28 | G574: 6 | H574: 6 | I574: =G574*6+H574 -> 42 | K574: 9 | L574: 9 | M574: =K574*6+L574 -> 63 | O574: 11 | P574: 10 | Q574: =O574*6+P574 -> 76 | S574: UMPIRE | X574: LADDER | AB574: ROUND | AD574: 13
A575: PORT MELBOURNE | C575: 1 | D575: 0 | E575: =C575*6+D575 -> 6 | G575: 2 | H575: 1 | I575: =G575*6+H575 -> 13 | K575: 2 | L575: 2 | M575: =K575*6+L575 -> 14 | O575: 3 | P575: 7 | Q575: =O575*6+P575 -> 25 | S575: MILLEN
A576: BEST PLAYERS | W576: TEAM | X576: W | Y576: L | Z576: D | AA576: FOR | AB576: AGST | AC576: % | AD576: PTS
A577: MOORABBIN | C577: PERRY | F577: PAPLEY | I577: WHALEBONE | L577: CHRISTIE | O577: RYAN | R577: KERR
A578: PORT MELBOURNE | C578: WILLIAMS | F578: STRAUCH | I578: BOWEN | L578: LEWIS | O578: CAMERON | R578: MILNER | W578: YARRAVILLE | X578: 10 | Y578: 3 | Z578: 0 | AA578: 1020 | AB578: 889 | AC578: 114.73565804274466 | AD578: 40
A579: GOALKICKERS | W579: MOORABBIN | X579: 9 | Y579: 4 | Z579: 0 | AA579: 1004 | AB579: 770 | AC579: 130.3896103896104 | AD579: 36
A580: MOORABBIN | C580: PERRY 2 | F580: BRYAN 2 | I580: SHEPHERD 2 | L580: RYAN 2 | N580: WHALEBONE | Q580: HARRISON | W580: SANDRINGHAM | X580: 9 | Y580: 4 | Z580: 0 | AA580: 1359 | AB580: 1093 | AC580: 124.33668801463861 | AD580: 36
A581: PORT MELBOURNE | C581: LAWSON | F581: CARLILE | I581: MILNER | W581: COBURG | X581: 9 | Y581: 4 | Z581: 0 | AA581: 1087 | AB581: 937 | AC581: 116.008537886873 | AD581: 36
A583: OAKLEIGH | C583: 1 | D583: 6 | E583: =C583*6+D583 -> 12 | G583: 2 | H583: 10 | I583: =G583*6+H583 -> 22 | K583: 7 | L583: 12 | M583: =K583*6+L583 -> 54 | O583: 9 | P583: 15 | Q583: =O583*6+P583 -> 69 | S583: OAKLEIGH | W583: WILLIAMSTOWN | X583: 6 | Y583: 7 | Z583: 0 | AA583: 971 | AB583: 952 | AC583: 101.99579831932773 | AD583: 24
A584: WILLIAMSTOWN | C584: 0 | D584: 2 | E584: =C584*6+D584 -> 2 | G584: 1 | H584: 3 | I584: =G584*6+H584 -> 9 | K584: 2 | L584: 4 | M584: =K584*6+L584 -> 16 | O584: 6 | P584: 5 | Q584: =O584*6+P584 -> 41 | S584: O'NEILL | W584: OAKLEIGH | X584: 6 | Y584: 7 | Z584: 0 | AA584: 960 | AB584: 975 | AC584: 98.461538461538467 | AD584: 24
A585: BEST PLAYERS | W585: DANDENONG | X585: 5 | Y585: 8 | Z585: 0 | AA585: 1083 | AB585: 1087 | AC585: 99.632014719411217 | AD585: 20
A586: OAKLEIGH | C586: KITTO | F586: JEWELL | I586: McCOOKE | L586: RICCI | O586: PEAKE | R586: TURNER | W586: PORT MELBOURNE | X586: 5 | Y586: 8 | Z586: 0 | AA586: 1008 | AB586: 1036 | AC586: 97.297297297297291 | AD586: 20
A587: WILLIAMSTOWN | C587: SAVIGE | F587: WARD | I587: TAUBE | L587: RUSSELL | O587: LAWLEY | R587: MALONEY | W587: BRUNSWICK | X587: 4 | Y587: 9 | Z587: 0 | AA587: 945 | AB587: 1157 | AC587: 81.676750216076059 | AD587: 16
A588: GOALKICKERS | W588: NORTHCOTE | X588: 2 | Y588: 11 | Z588: 0 | AA588: 644 | AB588: 1185 | AC588: 54.345991561181435 | AD588: 8
A589: OAKLEIGH | C589: LOTHIAN 3 | F589: MULDOON 2 | I589: KITTO | K589: McCOOKE | M589: MAUGHAN | P589: WING
A590: WILLIAMSTOWN | C590: MALONEY | F590: WILLIAMS | I590: BEAMISH | K590: COPE | M590: CLOUGH | P590: JAMES
A592: SANDRINGHAM | C592: 2 | D592: 3 | E592: =C592*6+D592 -> 15 | G592: 4 | H592: 7 | I592: =G592*6+H592 -> 31 | K592: 6 | L592: 14 | M592: =K592*6+L592 -> 50 | O592: 9 | P592: 17 | Q592: =O592*6+P592 -> 71 | S592: NORTHCOTE
A593: NORTHCOTE | C593: 2 | D593: 0 | E593: =C593*6+D593 -> 12 | G593: 2 | H593: 2 | I593: =G593*6+H593 -> 14 | K593: 4 | L593: 3 | M593: =K593*6+L593 -> 27 | O593: 5 | P593: 4 | Q593: =O593*6+P593 -> 34 | S593: FLANAGAN
A594: BEST PLAYERS
A595: SANDRINGHAM | C595: BURNS | F595: WILLS | I595: GRANGER | L595: KENNEDY | O595: BURKE | Q595: CLARK
A596: NORTHCOTE | C596: ADAMSON | F596: R LANGBORNE | I596: BEECHER | L596: DOWLING | O596: VAINS | Q596: SIMPSON
A597: GOALKICKERS
A598: SANDRINGHAM | C598: BURNS 3 | F598: WILLS 3 | I598: BURKE | K598: POBJOY | M598: CLARK
A599: NORTHCOTE | C599: ADAMSON 4 | G599: BEECHER
E600: 14TH JULY | I600: WEATHER | L600: SOUTH WIND
A601: COBURG | C601: 0 | D601: 2 | E601: =C601*6+D601 -> 2 | G601: 8 | H601: 4 | I601: =G601*6+H601 -> 52 | K601: 10 | L601: 5 | M601: =K601*6+L601 -> 65 | O601: 14 | P601: 10 | Q601: =O601*6+P601 -> 94 | S601: DANDENONG
A602: DANDENONG | C602: 3 | D602: 4 | E602: =C602*6+D602 -> 22 | G602: 4 | H602: 5 | I602: =G602*6+H602 -> 29 | K602: 6 | L602: 8 | M602: =K602*6+L602 -> 44 | O602: 7 | P602: 11 | Q602: =O602*6+P602 -> 53 | S602: POLLARD
A603: BEST PLAYERS
A604: COBURG | C604: TANCREDI | F604: LEYDIN | I604: McNABB | L604: MICKLESON | O604: SULLIVAN | R604: BUTCHER
A605: DANDENONG | C605: DELANTY | F605: PENNEFATHER | I605: DINEEN | L605: LITTLE | O605: ANDREWS | R605: KENT
A606: GOALKICKERS
A607: COBURG | C607: BYRON 4 | E607: LEYDIN 2 | G607: McDONNELL 2 | J607: MICKLESON 2 | M607: L BRIMACOMBE | P607: POWELL | R607: ROSS | T607: BUTCHER
A608: DANDENONG | C608: KENT 3 | F608: ANDREWS 3 | I608: GRAY
A610: YARRAVILLE | C610: 2 | D610: 4 | E610: =C610*6+D610 -> 16 | G610: 3 | H610: 8 | I610: =G610*6+H610 -> 26 | K610: 5 | L610: 10 | M610: =K610*6+L610 -> 40 | O610: 5 | P610: 11 | Q610: =O610*6+P610 -> 41 | S610: BRUNSWICK
A611: BRUNSWICK | C611: 1 | D611: 1 | E611: =C611*6+D611 -> 7 | G611: 2 | H611: 5 | I611: =G611*6+H611 -> 17 | K611: 2 | L611: 7 | M611: =K611*6+L611 -> 19 | O611: 4 | P611: 11 | Q611: =O611*6+P611 -> 35 | S611: ANDREW
A612: BEST PLAYERS
A613: YARRAVILLE | C613: BOB BROWN | F613: CLEGG | I613: ALLEN | L613: CONNELLY | O613: FELL | R613: WRIGHT
A614: BRUNSWICK | C614: WILSON | F614: R DILLON | I614: EDWARDS | L614: NASH | O614: K DILLON | R614: WHILEY
A615: GOALKICKERS
A616: YARRAVILLE | C616: EVANS 2 | F616: CONNELLY | I616: WILSON | L616: CLEGG
A617: BRUNSWICK | C617: K DILLON 2 | G617: AMBROSE | J617: COOK
A619: ROUND 14 | E619: 20TH JULY | J619: WEATHER | M619: N BREEZE RAIN 1ST QTR | S619: PLAYED AT
D620: 1ST QTR | H620: 2ND QTR | L620: 3RD QTR | P620: FINAL | S620: DANDENONG
A621: DANDENONG | C621: 5 | D621: 11 | E621: =C621*6+D621 -> 41 | G621: 6 | H621: 13 | I621: =G621*6+H621 -> 49 | K621: 11 | L621: 17 | M621: =K621*6+L621 -> 83 | O621: 11 | P621: 19 | Q621: =O621*6+P621 -> 85 | S621: UMPIRE | X621: LADDER | AB621: ROUND | AD621: 14
A622: NORTHCOTE | C622: 0 | D622: 2 | E622: =C622*6+D622 -> 2 | G622: 3 | H622: 8 | I622: =G622*6+H622 -> 26 | K622: 5 | L622: 8 | M622: =K622*6+L622 -> 38 | O622: 10 | P622: 9 | Q622: =O622*6+P622 -> 69 | S622: McMASTER
A623: BEST PLAYERS | W623: TEAM | X623: W | Y623: L | Z623: D | AA623: FOR | AB623: AGST | AC623: % | AD623: PTS
A624: DANDENONG | C624: VEREY | F624: WATERS | I624: DINEEN | L624: ABRAHAM | O624: KENT | R624: WRIGHT
A625: NORTHCOTE | C625: OUSLEY | F625: MOON | I625: ADAMSON | L625: BRETHERTON | O625: McBREEN | R625: VAINS | W625: SANDRINGHAM | X625: 10 | Y625: 4 | Z625: 0 | AA625: 1426 | AB625: 1144 | AC625: 124.65034965034965 | AD625: 40
A626: GOALKICKERS | W626: COBURG | X626: 10 | Y626: 4 | Z626: 0 | AA626: 1182 | AB626: 1006 | AC626: 117.49502982107356 | AD626: 40
A627: DANDENONG | C627: VEREY 3 | F627: KENT 2 | I627: SHINNERS 2 | L627: DINEEN 2 | O627: WRIGHT | Q627: HEWITT | W627: YARRAVILLE | X627: 10 | Y627: 4 | Z627: 0 | AA627: 1071 | AB627: 956 | AC627: 112.02928870292887 | AD627: 40
A628: NORTHCOTE | C628: OUSLEY 3 | F628: BRADY 2 | I628: DOWLING 2 | L628: ADAMSON 2 | O628: MOON | W628: MOORABBIN | X628: 9 | Y628: 5 | Z628: 0 | AA628: 1074 | AB628: 865 | AC628: 124.16184971098266 | AD628: 36
E629: 22ND JULY | J629: WEATHER | M629: SHOWERS
A630: PORT MELBOURNE | C630: 7 | D630: 7 | E630: =C630*6+D630 -> 49 | G630: 10 | H630: 13 | I630: =G630*6+H630 -> 73 | K630: 13 | L630: 16 | M630: =K630*6+L630 -> 94 | O630: 15 | P630: 19 | Q630: =O630*6+P630 -> 109 | S630: PORT MELBOURNE | W630: OAKLEIGH | X630: 7 | Y630: 7 | Z630: 0 | AA630: 1055 | AB630: 1045 | AC630: 100.95693779904306 | AD630: 28
A631: BRUNSWICK | C631: 2 | D631: 3 | E631: =C631*6+D631 -> 15 | G631: 4 | H631: 6 | I631: =G631*6+H631 -> 30 | K631: 5 | L631: 10 | M631: =K631*6+L631 -> 40 | O631: 10 | P631: 13 | Q631: =O631*6+P631 -> 73 | S631: O'NEILL | W631: DANDENONG | X631: 6 | Y631: 8 | Z631: 0 | AA631: 1168 | AB631: 1156 | AC631: 101.03806228373702 | AD631: 24
A632: BEST PLAYERS | W632: PORT MELBOURNE | X632: 6 | Y632: 8 | Z632: 0 | AA632: 1117 | AB632: 1109 | AC632: 100.72137060414788 | AD632: 24
A633: PORT MELBOURNE | C633: FREYER | F633: MILNER | I633: LEWIS | L633: MITHEN | O633: LANDORFF | R633: STRAUCH | W633: WILLIAMSTOWN | X633: 6 | Y633: 8 | Z633: 0 | AA633: 1040 | AB633: 1047 | AC633: 99.331423113658076 | AD633: 24
A634: BRUNSWICK | C634: WHILEY | F634: WILSON | I634: K DILLON | L634: ROBINSON | O634: WATT | R634: DENTON | W634: BRUNSWICK | X634: 4 | Y634: 10 | Z634: 0 | AA634: 1018 | AB634: 1266 | AC634: 80.41074249605056 | AD634: 16
A635: GOALKICKERS | W635: NORTHCOTE | X635: 2 | Y635: 12 | Z635: 0 | AA635: 713 | AB635: 1270 | AC635: 56.14173228346457 | AD635: 8
A636: PORT MELBOURNE | C636: BONNETT 4 | F636: MERRETT 3 | I636: MILNER 3 | K636: IRELAND 2 | N636: TAGGART | Q636: BOWEN | S636: FREYER
A637: BRUNSWICK | C637: K DILLON 3 | F637: AMBROSE 2 | I637: CAHILL | K637: WHILEY | M637: STANLEY | O637: DARBY | Q637: COOK
E638: 27TH JULY | I638: WEATHER
A639: SANDRINGHAM | C639: 4 | D639: 6 | E639: =C639*6+D639 -> 30 | G639: 4 | H639: 7 | I639: =G639*6+H639 -> 31 | K639: 9 | L639: 11 | M639: =K639*6+L639 -> 65 | O639: 9 | P639: 13 | Q639: =O639*6+P639 -> 67 | S639: YARRAVILLE
A640: YARRAVILLE | C640: 3 | D640: 2 | E640: =C640*6+D640 -> 20 | G640: 6 | H640: 7 | I640: =G640*6+H640 -> 43 | K640: 6 | L640: 9 | M640: =K640*6+L640 -> 45 | O640: 6 | P640: 15 | Q640: =O640*6+P640 -> 51 | S640: TREWIN
A641: BEST PLAYERS
A642: SANDRINGHAM | C642: SHEEHAN | F642: KENNEDY | I642: HOAR | L642: O'TOOLE | O642: BURKE | Q642: GRANGER
A643: YARRAVILLE | C643: ALLEN | F643: MALONEY | I643: CONNELLY | L643: WHITTEN | O643: CLEGG | Q643: NOTT
A644: GOALKICKERS
A645: SANDRINGHAM | C645: O'TOOLE 2 | F645: STRACHAN 2 | I645: GLEESON 2 | L645: SHEEHAN 2 | O645: BURNS
A646: YARRAVILLE | C646: MEDDINGS 2 | F646: EVANS 2 | I646: WHITTEN | L646: CONNELLY
A648: OAKLEIGH | C648: 2 | D648: 1 | E648: =C648*6+D648 -> 13 | G648: 7 | H648: 4 | I648: =G648*6+H648 -> 46 | K648: 9 | L648: 6 | M648: =K648*6+L648 -> 60 | O648: 14 | P648: 11 | Q648: =O648*6+P648 -> 95 | S648: OAKLEIGH
A649: MOORABBIN | C649: 3 | D649: 4 | E649: =C649*6+D649 -> 22 | G649: 7 | H649: 6 | I649: =G649*6+H649 -> 48 | K649: 7 | L649: 12 | M649: =K649*6+L649 -> 54 | O649: 9 | P649: 16 | Q649: =O649*6+P649 -> 70 | S649: McMASTER
A650: BEST PLAYERS
A651: OAKLEIGH | C651: MULDOON | F651: PEAKE | I651: MURRAY | L651: LUFF | O651: TURNER | R651: JONES
A652: MOORABBIN | C652: GUTTERSON | F652: PERRY | I652: KERR | L652: CROSHER | O652: SHEPHERD | R652: ROLFE
A653: GOALKICKERS
A654: OAKLEIGH | C654: MAUGHAN 3 | F654: JONES 2 | H654: MURRAY 2 | J654: RICCI 2 | L654: McCORKELL | O654: MULDOON | Q654: HAINING | S654: LOTJIAN | U654: WING
A655: MOORABBIN | C655: BRYAN 3 | F655: KEE 2 | H655: BURNS | J655: SHEPHERD | M655: HARRISON | P655: CHRISTIE
E656: 28TH JULY | J656: WEATHER | M656: NORTH WEST WIND
A657: COBURG | C657: 5 | D657: 2 | E657: =C657*6+D657 -> 32 | G657: 8 | H657: 5 | I657: =G657*6+H657 -> 53 | K657: 9 | L657: 7 | M657: =K657*6+L657 -> 61 | O657: 13 | P657: 17 | Q657: =O657*6+P657 -> 95 | S657: COBURG
A658: WILLIAMSTOWN | C658: 1 | D658: 4 | E658: =C658*6+D658 -> 10 | G658: 5 | H658: 6 | I658: =G658*6+H658 -> 36 | K658: 10 | L658: 9 | M658: =K658*6+L658 -> 69 | O658: 10 | P658: 9 | Q658: =O658*6+P658 -> 69 | S658: MANCE
A659: BEST PLAYERS
A660: COBURG | C660: LORD | F660: McNABB | I660: CARMODY | L660: LEYDIN | O660: CORNEILISON | S660: BARCLAY
A661: WILLIAMSTOWN | C661: MALONEY | F661: MURPHY | I661: LAWLEY | L661: RUSSELL | O661: CARMICHAEL | S661: JONES
A662: GOALKICKERS
A663: COBURG | C663: CARMODY 4 | F663: McNABB 3 | I663: LEYDIN 2 | L663: McDONNELL | O663: BUTCHER | Q663: BETSON | S663: ACKLAND
A664: WILLIAMSTOWN | C664: JONES 4 | F664: CLOUGH 2 | I664: WILLIAMS | L664: MALONEY | O664: O'TOOLE | Q664: CARMICHAEL
A666: ROUND 15 | E666: 3RD AUGUST | J666: WEATHER | N666: STRONG NORTH WIND | S666: PLAYED AT
D667: 1ST QTR | H667: 2ND QTR | L667: 3RD QTR | P667: FINAL | S667: BEACH ROAD
A668: SANDRINGHAM | C668: 11 | D668: 6 | E668: =C668*6+D668 -> 72 | G668: 11 | H668: 6 | I668: =G668*6+H668 -> 72 | K668: 17 | L668: 9 | M668: =K668*6+L668 -> 111 | O668: 19 | P668: 11 | Q668: =O668*6+P668 -> 125 | S668: UMPIRE | X668: LADDER | AB668: ROUND | AD668: 15
A669: COBURG | C669: 1 | D669: 0 | E669: =C669*6+D669 -> 6 | G669: 6 | H669: 2 | I669: =G669*6+H669 -> 38 | K669: 7 | L669: 3 | M669: =K669*6+L669 -> 45 | O669: 11 | P669: 11 | Q669: =O669*6+P669 -> 77 | S669: ROWE
A670: BEST PLAYERS | W670: TEAM | X670: W | Y670: L | Z670: D | AA670: FOR | AB670: AGST | AC670: % | AD670: PTS
A671: SANDRINGHAM | C671: KENNEDY | F671: McCOMB | I671: SHEEHAN | L671: BURNS | N671: GRANGER | Q671: BURKE
A672: COBURG | C672: BUTCHER | F672: CORNEILISON | I672: TANCREDI | L672: BYRON | N672: LEYDIN | Q672: McDONNELL | W672: SANDRINGHAM | X672: 11 | Y672: 4 | Z672: 0 | AA672: 1551 | AB672: 1221 | AC672: 127.02702702702703 | AD672: 44
A673: GOALKICKERS | W673: MOORABBIN | X673: 10 | Y673: 5 | Z673: 0 | AA673: 1193 | AB673: 917 | AC673: 130.09814612868047 | AD673: 40
A674: SANDRINGHAM | C674: WILLS 6 | E674: BURNS 4 | G674: O'TOOLE 2 | J674: STRACHAN 2 | M674: BURKE 2 | O674: SHEEHAN | Q674: KENNEDY | S674: CLARK | W674: COBURG | X674: 10 | Y674: 5 | Z674: 0 | AA674: 1259 | AB674: 1131 | AC674: 111.31741821396994 | AD674: 40
A675: COBURG | C675: LEYDIN 3 | E675: CARMODY 2 | H675: BUTCHER 2 | K675: J BRIMACOMBE | N675: McDONNELL | Q675: BOXSHALL | S675: POWELL | W675: YARRAVILLE | X675: 10 | Y675: 5 | Z675: 0 | AA675: 1148 | AB675: 1061 | AC675: 108.19981149858624 | AD675: 40
A677: OAKLEIGH | C677: 1 | D677: 2 | E677: =C677*6+D677 -> 8 | G677: 2 | H677: 6 | I677: =G677*6+H677 -> 18 | K677: 4 | L677: 7 | M677: =K677*6+L677 -> 31 | O677: 8 | P677: 13 | Q677: =O677*6+P677 -> 61 | S677: BRUNSWICK | W677: OAKLEIGH | X677: 8 | Y677: 7 | Z677: 0 | AA677: 1116 | AB677: 1095 | AC677: 101.91780821917808 | AD677: 32
A678: BRUNSWICK | C678: 1 | D678: 3 | E678: =C678*6+D678 -> 9 | G678: 4 | H678: 4 | I678: =G678*6+H678 -> 28 | K678: 5 | L678: 8 | M678: =K678*6+L678 -> 38 | O678: 7 | P678: 8 | Q678: =O678*6+P678 -> 50 | S678: HORNE | W678: PORT MELBOURNE | X678: 7 | Y678: 8 | Z678: 0 | AA678: 1222 | AB678: 1186 | AC678: 103.035413153457 | AD678: 28
A679: BEST PLAYERS | W679: DANDENONG | X679: 6 | Y679: 8 | Z679: 1 | AA679: 1209 | AB679: 1197 | AC679: 101.00250626566417 | AD679: 26
A680: OAKLEIGH | C680: JONES | F680: LUFF | I680: MAUGHAN | L680: HAINING | O680: MULDOON | R680: RICCI | W680: WILLIAMSTOWN | X680: 6 | Y680: 8 | Z680: 1 | AA680: 1081 | AB680: 1088 | AC680: 99.356617647058826 | AD680: 26
A681: BRUNSWICK | C681: DARBY | F681: COOK | I681: R DILLON | L681: ROBINSON | O681: DENTON | R681: AMBROSE | W681: BRUNSWICK | X681: 4 | Y681: 11 | Z681: 0 | AA681: 1068 | AB681: 1327 | AC681: 80.482290881688016 | AD681: 16
A682: GOALKICKERS | W682: NORTHCOTE | X682: 2 | Y682: 13 | Z682: 0 | AA682: 765 | AB682: 1389 | AC682: 55.0755939524838 | AD682: 8
A683: OAKLEIGH | C683: JONES 2 | F683: LOTHIAN 2 | I683: HAINING 2 | L683: RICCI | N683: MULDOON
A684: BRUNSWICK | C684: WHILEY | E684: DARBY | G684: CAHILL | I684: GASPARI | L684: COOK | N684: OSBORNE | P684: STANLEY
A686: MOORABBIN | C686: 2 | D686: 2 | E686: =C686*6+D686 -> 14 | G686: 11 | H686: 7 | I686: =G686*6+H686 -> 73 | K686: 12 | L686: 13 | M686: =K686*6+L686 -> 85 | O686: 17 | P686: 17 | Q686: =O686*6+P686 -> 119 | S686: NORTHCOTE
A687: NORTHCOTE | C687: 2 | D687: 3 | E687: =C687*6+D687 -> 15 | G687: 2 | H687: 5 | I687: =G687*6+H687 -> 17 | K687: 5 | L687: 8 | M687: =K687*6+L687 -> 38 | O687: 7 | P687: 10 | Q687: =O687*6+P687 -> 52 | S687: TREWIN
A688: BEST PLAYERS
A689: MOORABBIN | C689: KEE | F689: BURNS | I689: PERRY | L689: SHEPHERD | O689: WHALEBONE | R689: CHRISTIE
A690: NORTHCOTE | C690: BRADY | F690: DOWLING | I690: ADAMSON | L690: BRETHERTON | O690: LAVER | R690: THRIPP
A691: GOALKICKERS
A692: MOORABBIN | C692: KEE 4 | E692: SHEPHERD 4 | H692: BURNS 3 | J692: BRYAN 3 | M692: CHRISTIE 2 | P692: WHALEBONE
A693: NORTHCOTE | C693: LACHMUND 2 | F693: BRADY 2 | I693: ADAMSON | L693: LAVER | N693: THRIPP
D694: 4TH AUGUST | I694: WEATHER
A695: PORT MELB | C695: 4 | D695: 2 | E695: =C695*6+D695 -> 26 | G695: 11 | H695: 8 | I695: =G695*6+H695 -> 74 | K695: 12 | L695: 8 | M695: =K695*6+L695 -> 80 | O695: 16 | P695: 9 | Q695: =O695*6+P695 -> 105 | S695: PORT MELBOURNE
A696: YARRAVILLE | C696: 6 | D696: 0 | E696: =C696*6+D696 -> 36 | G696: 7 | H696: 1 | I696: =G696*6+H696 -> 43 | K696: 11 | L696: 3 | M696: =K696*6+L696 -> 69 | O696: 12 | P696: 5 | Q696: =O696*6+P696 -> 77 | S696: POLLARD
A697: BEST PLAYERS
A698: PORT MELB | C698: CARLILE | F698: MERRETT | I698: WILLIAMS | L698: HYLAND | O698: MILNER | R698: TEAGUE
A699: YARRAVILLE | C699: CLEGG | F699: MALONEY | I699: LAMONT | L699: WILSON | O699: HOWARTH | R699: RON BROWN
A700: GOALKICKERS
A701: PORT MELB | C701: MERRETT 4 | F701: BONNETT 4 | I701: MILNER 3 | K701: MITHEN 2 | N701: HYLAND 2 | Q701: LANDORFF
A702: YARRAVILLE | C702: RON BROWN 3 | F702: ALLEN 2 | I702: LAMONT 2 | L702: CONNELLY 2 | O702: WHITTEN | Q702: CLEGG | S702: WARWICK
A704: WILLIAMSTOWN | C704: 3 | D704: 2 | E704: =C704*6+D704 -> 20 | G704: 3 | H704: 2 | I704: =G704*6+H704 -> 20 | K704: 5 | L704: 5 | M704: =K704*6+L704 -> 35 | O704: 6 | P704: 5 | Q704: =O704*6+P704 -> 41 | S704: WILLIAMSTOWN
A705: DANDENONG | C705: 1 | D705: 1 | E705: =C705*6+D705 -> 7 | G705: 3 | H705: 6 | I705: =G705*6+H705 -> 24 | K705: 4 | L705: 8 | M705: =K705*6+L705 -> 32 | O705: 5 | P705: 11 | Q705: =O705*6+P705 -> 41 | S705: MILLEN
A706: BEST PLAYERS
A707: WILLIAMSTOWN | C707: CLOUGH | F707: MALONEY | I707: RUSSELL | L707: TAUBE | N707: SAVIGE | Q707: TURNER
A708: DANDENONG | C708: PIVETTA | F708: PENNEFATHER | I708: WATERS | L708: DINEEN | N708: KENT | Q708: PILCHER
A709: GOALKICKERS
A710: WILLIAMSTOWN | C710: TURNER 2 | F710: MALONEY 2 | I710: HYNES | K710: JONES
A711: DANDENONG | C711: VEREY 2 | F711: DINEEN | I711: WATERS | K711: ANDREWS
A713: ROUND 16 | E713: 10TH AUGUST | J713: WEATHER | M713: SOUTH BREEZE GROUNDS SOFT | S713: PLAYED AT
D714: 1ST QTR | H714: 2ND QTR | L714: 3RD QTR | P714: FINAL | S714: YARRAVILLE
A715: OAKLEIGH | C715: 4 | D715: 0 | E715: =C715*6+D715 -> 24 | G715: 9 | H715: 5 | I715: =G715*6+H715 -> 59 | K715: 9 | L715: 6 | M715: =K715*6+L715 -> 60 | O715: 11 | P715: 13 | Q715: =O715*6+P715 -> 79 | S715: UMPIRE | X715: LADDER | AB715: ROUND | AD715: 16
A716: YARRAVILLE | C716: 3 | D716: 4 | E716: =C716*6+D716 -> 22 | G716: 4 | H716: 5 | I716: =G716*6+H716 -> 29 | K716: 9 | L716: 11 | M716: =K716*6+L716 -> 65 | O716: 9 | P716: 14 | Q716: =O716*6+P716 -> 68 | S716: MILNE
A717: BEST PLAYERS | W717: TEAM | X717: W | Y717: L | Z717: D | AA717: FOR | AB717: AGST | AC717: % | AD717: PTS
A718: OAKLEIGH | C718: LOTHIAN | F718: HAINING | I718: JEWELL | K718: McCOOKE | N718: LINDSAY | Q718: MULDOON
A719: YARRAVILLE | C719: BOB BROWN | F719: CLEGG | I719: ALLEN | K719: RON BROWN | N719: WHITTEN | Q719: ORANGE | W719: SANDRINGHAM | X719: 12 | Y719: 4 | Z719: 0 | AA719: 1647 | AB719: 1290 | AC719: 127.67441860465117 | AD719: 48
A720: GOALKICKERS | W720: MOORABBIN | X720: 11 | Y720: 5 | Z720: 0 | AA720: 1293 | AB720: 981 | AC720: 131.80428134556576 | AD720: 44
A721: OAKLEIGH | C721: LOTHIAN 6 | F721: McCOOKE 2 | I721: JONES | K721: MULDOON | N721: MURRAY | W721: COBURG | X721: 11 | Y721: 5 | Z721: 0 | AA721: 1388 | AB721: 1179 | AC721: 117.72688719253605 | AD721: 44
A722: YARRAVILLE | C722: WHITTEN 2 | F722: LAMONT 2 | I722: BOB BROWN 2 | L722: KNOTT 2 | N722: CLEGG | W722: YARRAVILLE | X722: 10 | Y722: 6 | Z722: 0 | AA722: 1216 | AB722: 1140 | AC722: 106.66666666666667 | AD722: 40
A724: MOORABBIN | C724: 4 | D724: 3 | E724: =C724*6+D724 -> 27 | G724: 6 | H724: 10 | I724: =G724*6+H724 -> 46 | K724: 9 | L724: 13 | M724: =K724*6+L724 -> 67 | O724: 14 | P724: 16 | Q724: =O724*6+P724 -> 100 | S724: MOORABBIN | W724: OAKLEIGH | X724: 9 | Y724: 7 | Z724: 0 | AA724: 1195 | AB724: 1163 | AC724: 102.75150472914875 | AD724: 36
A725: BRUNSWICK | C725: 2 | D725: 2 | E725: =C725*6+D725 -> 14 | G725: 4 | H725: 4 | I725: =G725*6+H725 -> 28 | K725: 6 | L725: 7 | M725: =K725*6+L725 -> 43 | O725: 9 | P725: 10 | Q725: =O725*6+P725 -> 64 | S725: FLANAGAN | W725: PORT MELBOURNE | X725: 8 | Y725: 8 | Z725: 0 | AA725: 1301 | AB725: 1224 | AC725: 106.29084967320262 | AD725: 32
A726: BEST PLAYERS | W726: DANDENONG | X726: 6 | Y726: 9 | Z726: 1 | AA726: 1247 | AB726: 1276 | AC726: 97.727272727272734 | AD726: 26
A727: MOORABBIN | C727: BRYAN | F727: WHALEBONE | I727: KERR | K727: PERRY | N727: CRAMERI | Q727: PAPLEY | W727: WILLIAMSTOWN | X727: 6 | Y727: 9 | Z727: 1 | AA727: 1150 | AB727: 1184 | AC727: 97.128378378378372 | AD727: 26 | AE727: FOR | AF727: AGST | AG727: % | AH727: PTS
A728: BRUNSWICK | C728: K DILLON | F728: COOK | I728: DARBY | K728: WHILEY | N728: BRIGLIA | Q728: AYRES | W728: BRUNSWICK | X728: 4 | Y728: 12 | Z728: 0 | AA728: 1132 | AB728: 1427 | AC728: 79.327259985984583 | AD728: 16
A729: GOALKICKERS | W729: NORTHCOTE | X729: 2 | Y729: 14 | Z729: 0 | AA729: 813 | AB729: 1518 | AC729: 53.557312252964429 | AD729: 8
A730: MOORABBIN | C730: BRYAN 4 | F730: WHALEBONE 3 | I730: BURNS 2 | K730: RYAN 2 | M730: PERRY | O730: PAPLEY
A731: BRUNSWICK | C731: K DILLON 4 | F731: EDWARDS 2 | I731: COOK 2 | K731: DENTON
A733: SANDRINGHAM | C733: 4 | D733: 1 | E733: =C733*6+D733 -> 25 | G733: 10 | H733: 4 | I733: =G733*6+H733 -> 64 | K733: 12 | L733: 7 | M733: =K733*6+L733 -> 79 | O733: 14 | P733: 12 | Q733: =O733*6+P733 -> 96 | S733: WILLIAMSTOWN
A734: WILLIAMSTOWN | C734: 2 | D734: 4 | E734: =C734*6+D734 -> 16 | G734: 5 | H734: 6 | I734: =G734*6+H734 -> 36 | K734: 7 | L734: 11 | M734: =K734*6+L734 -> 53 | O734: 9 | P734: 15 | Q734: =O734*6+P734 -> 69 | S734: McMASTER
A735: BEST PLAYERS
A736: SANDRINGHAM | C736: O'TOOLE | F736: HOLMES | I736: STRACHAN | L736: GLEESON | O736: BURNS | R736: SHEEHAN
A737: WILLIAMSTOWN | C737: LAWLEY | F737: WARD | I737: MALONEY | L737: MAZOURIS | O737: MURRIE | R737: RUSSELL
A738: GOALKICKERS
A739: SANDRINGHAM | C739: O'TOOLE 6 | F739: STRACHAN 3 | I739: BURKE | K739: BURNS | M739: CLARK | O739: SHEEHAN | R739: WILLS
A740: WILLIAMSTOWN | C740: MALONEY 3 | F740: WILLIAMS 2 | I740: WARD | K740: HYNES | M740: MAZOURIS | P740: CLOUGH
D741: 11TH AUGUST | I741: WEATHER | L741: FINE
A742: PORT MELBOURNE | C742: 5 | D742: 2 | E742: =C742*6+D742 -> 32 | G742: 5 | H742: 3 | I742: =G742*6+H742 -> 33 | K742: 6 | L742: 8 | M742: =K742*6+L742 -> 44 | O742: 11 | P742: 13 | Q742: =O742*6+P742 -> 79 | S742: DANDENONG
A743: DANDENONG | C743: 0 | D743: 4 | E743: =C743*6+D743 -> 4 | G743: 4 | H743: 6 | I743: =G743*6+H743 -> 30 | K743: 4 | L743: 13 | M743: =K743*6+L743 -> 37 | O743: 4 | P743: 14 | Q743: =O743*6+P743 -> 38 | S743: MILLEN
A744: BEST PLAYERS
A745: PORT MELBOURNE | C745: MERRETT | F745: FREYER | I745: LEWIS | L745: STRAUCH | O745: CAMERON | R745: TAGGART
A746: DANDENONG | C746: ABRAHAM | F746: HEWITT | I746: PENNEFATHER | L746: LITTLE | O746: DINEEN | R746: WATERS
A747: GOALKICKERS
A748: PORT MELBOURNE | C748: MERRETT 4 | F748: BONNETT 3 | I748: LAWSON | K748: BOWEN | M748: DANN | O748: TAGGART
A749: DANDENONG | C749: SHINNERS 2 | F749: OSBORNE | I749: VEREY
A751: COBURG | C751: 3 | D751: 2 | E751: =C751*6+D751 -> 20 | G751: 7 | H751: 3 | I751: =G751*6+H751 -> 45 | K751: 15 | L751: 10 | M751: =K751*6+L751 -> 100 | O751: 19 | P751: 15 | Q751: =O751*6+P751 -> 129 | S751: COBURG
A752: NORTHCOTE | C752: 1 | D752: 2 | E752: =C752*6+D752 -> 8 | G752: 4 | H752: 5 | I752: =G752*6+H752 -> 29 | K752: 5 | L752: 9 | M752: =K752*6+L752 -> 39 | O752: 6 | P752: 12 | Q752: =O752*6+P752 -> 48 | S752: HORNE
A753: BEST PLAYERS
A754: COBURG | C754: CARMODY | F754: McNABB | I754: LORD | L754: LEYDIN | N754: L BRIMACOMBE | R754: FINDLAY
A755: NORTHCOTE | C755: LAVER | F755: KEAYS | I755: OUSLEY | L755: BRADY | N755: LACHMUND | R755: McBREEN
A756: GOALKICKERS
A757: COBURG | C757: CARMODY 5 | F757: L BRIMACOMBE 4 | J757: LEYDIN 3 | M757: McNABB 2 | P757: J BRIMACOMBE 2 | T757: FINDLAY | W757: McDONNELL | X757: POWELL
A758: NORTHCOTE | C758: C LANGBORNE | F758: BRADY | H758: DOWLING | J758: THRIPP | L758: BEECHER | N758: McBREEN
A760: ROUND 17 | E760: 17TH AUGUST | J760: WEATHER | N760: NORTH WEST WIND | S760: PLAYED AT
D761: 1ST QTR | H761: 2ND QTR | L761: 3RD QTR | P761: FINAL | S761: OAKLEIGH
A762: COBURG | C762: 3 | D762: 3 | E762: =C762*6+D762 -> 21 | G762: 7 | H762: 7 | I762: =G762*6+H762 -> 49 | K762: 9 | L762: 11 | M762: =K762*6+L762 -> 65 | O762: 15 | P762: 14 | Q762: =O762*6+P762 -> 104 | S762: UMPIRE | X762: LADDER | AB762: ROUND | AD762: 17
A763: OAKLEIGH | C763: 4 | D763: 3 | E763: =C763*6+D763 -> 27 | G763: 7 | H763: 5 | I763: =G763*6+H763 -> 47 | K763: 10 | L763: 9 | M763: =K763*6+L763 -> 69 | O763: 12 | P763: 16 | Q763: =O763*6+P763 -> 88 | S763: FROOD
A764: BEST PLAYERS | W764: TEAM | X764: W | Y764: L | Z764: D | AA764: FOR | AB764: AGST | AC764: % | AD764: PTS
A765: COBURG | C765: CARMODY | F765: MURRAY | I765: L BRIMACOMBE | L765: J BRIMACOMBE | O765: McNABB | R765: SULLIVAN
A766: OAKLEIGH | C766: TURNER | F766: JEWELL | I766: WOOD | L766: JONES | O766: KITTO | R766: LOTHIAN | W766: MOORABBIN | X766: 12 | Y766: 5 | Z766: 0 | AA766: 1335 | AB766: 1006 | AC766: 132.70377733598409 | AD766: 48
A767: GOALKICKERS | S767: POWELL | W767: SANDRINGHAM | X767: 12 | Y767: 5 | Z767: 0 | AA767: 1705 | AB767: 1370 | AC767: 124.45255474452554 | AD767: 48
A768: COBURG | C768: CARMODY 4 | F768: L BRIMACOMBE 3 | J768: ROCHOW 2 | M768: McNABB 2 | O768: J BRIMACOMBE | R768: LEYDIN | T768: McDONNELL | W768: COBURG | X768: 12 | Y768: 5 | Z768: 0 | AA768: 1492 | AB768: 1267 | AC768: 117.75848460931334 | AD768: 48
A769: OAKLEIGH | C769: JONES 4 | F769: LOTHIAN 3 | I769: MURRAY 2 | L769: KITTO | N769: MCLAREN | Q769: McCOOKE | W769: YARRAVILLE | X769: 11 | Y769: 6 | Z769: 0 | AA769: 1356 | AB769: 1195 | AC769: 113.47280334728033 | AD769: 44
A771: MOORABBIN | C771: 1 | D771: 2 | E771: =C771*6+D771 -> 8 | G771: 3 | H771: 13 | I771: =G771*6+H771 -> 31 | K771: 4 | L771: 13 | M771: =K771*6+L771 -> 37 | O771: 4 | P771: 18 | Q771: =O771*6+P771 -> 42 | S771: MOORABBIN | W771: PORT MELBOURNE | X771: 9 | Y771: 8 | Z771: 0 | AA771: 1380 | AB771: 1299 | AC771: 106.23556581986143 | AD771: 36
A772: DANDENONG | C772: 2 | D772: 2 | E772: =C772*6+D772 -> 14 | G772: 2 | H772: 3 | I772: =G772*6+H772 -> 15 | K772: 3 | L772: 5 | M772: =K772*6+L772 -> 23 | O772: 3 | P772: 7 | Q772: =O772*6+P772 -> 25 | S772: O'NEILL | W772: OAKLEIGH | X772: 9 | Y772: 8 | Z772: 0 | AA772: 1283 | AB772: 1267 | AC772: 101.26282557221784 | AD772: 36
A773: BEST PLAYERS | W773: WILLIAMSTOWN | X773: 6 | Y773: 10 | Z773: 1 | AA773: 1225 | AB773: 1263 | AC773: 96.99129057798892 | AD773: 26
A774: MOORABBIN | C774: BURNS | F774: RYAN | I774: CROSHER | L774: CRAMERI | O774: HARRISON | R774: ROLFE | W774: DANDENONG | X774: 6 | Y774: 10 | Z774: 1 | AA774: 1272 | AB774: 1318 | AC774: 96.509863429438539 | AD774: 26
A775: DANDENONG | C775: PILCHER | F775: ABRAHAM | I775: WATERS | L775: PENNEFATHER | O775: COLE | R775: BARRAN | W775: BRUNSWICK | X775: 5 | Y775: 12 | Z775: 0 | AA775: 1212 | AB775: 1485 | AC775: 81.616161616161619 | AD775: 20
A776: GOALKICKERS | W776: NORTHCOTE | X776: 2 | Y776: 15 | Z776: 0 | AA776: 868 | AB776: 1658 | AC776: 52.352231604342585 | AD776: 8
A777: MOORABBIN | C777: RYAN 2 | F777: PAPLEY | I777: BURNS
A778: DANDENONG | C778: WATERS | F778: DELANTY | I778: PILCHER
A780: YARRAVILLE | C780: 6 | D780: 6 | E780: =C780*6+D780 -> 42 | G780: 9 | H780: 10 | I780: =G780*6+H780 -> 64 | K780: 18 | L780: 16 | M780: =K780*6+L780 -> 124 | O780: 20 | P780: 20 | Q780: =O780*6+P780 -> 140 | S780: YARRAVILLE
A781: NORTHCOTE | C781: 0 | D781: 0 | E781: =C781*6+D781 -> 0 | G781: 3 | H781: 1 | I781: =G781*6+H781 -> 19 | K781: 3 | L781: 2 | M781: =K781*6+L781 -> 20 | O781: 8 | P781: 7 | Q781: =O781*6+P781 -> 55 | S781: MANCE
A782: BEST PLAYERS
A783: YARRAVILLE | C783: BOB BROWN | F783: CONNELLY | I783: WHITTEN | L783: MALONEY | O783: CLEGG | R783: McGILL
A784: NORTHCOTE | C784: WEGNER | F784: GEMMELL | I784: GRYBAS | L784: BRETHERTON | O784: DOWLING | R784: McBREEN
A785: GOALKICKERS
A786: YARRAVILLE | C786: KNOTT 5 | F786: CONNELLY 4 | I786: CLEGG 3 | K786: WHITTEN 3 | N786: BOB BROWN 3 | Q786: COGGER | S786: RON BROWN
A787: NORTHCOTE | C787: DOWLING 4 | F787: BRADY 2 | I787: MORAN | K787: BEECHER
A789: BRUNSWICK | C789: 4 | D789: 1 | E789: =C789*6+D789 -> 25 | G789: 7 | H789: 4 | I789: =G789*6+H789 -> 46 | K789: 9 | L789: 9 | M789: =K789*6+L789 -> 63 | O789: 11 | P789: 14 | Q789: =O789*6+P789 -> 80 | S789: BRUNSWICK
A790: SANDRINGHAM | C790: 2 | D790: 2 | E790: =C790*6+D790 -> 14 | G790: 5 | H790: 4 | I790: =G790*6+H790 -> 34 | K790: 7 | L790: 6 | M790: =K790*6+L790 -> 48 | O790: 8 | P790: 10 | Q790: =O790*6+P790 -> 58 | S790: POLLARD
A791: BEST PLAYERS
A792: BRUNSWICK | C792: K DILLON | F792: R DILLON | I792: ROBINSON | L792: WHILEY | N792: DARBY | Q792: BRIGLIA
A793: SANDRINGHAM | C793: HANCE | F793: CLARK | I793: SHEEHAN | L793: HOAR | N793: WILLS | Q793: STRACHAN
A794: GOALKICKERS
A795: BRUNSWICK | C795: K DILLON 3 | F795: COOK 3 | I795: AMBROSE 2 | L795: HAGART | N795: BRIGLIA | P795: DARBY
A796: SANDRINGHAM | C796: BURNS 2 | F796: WILLS 2 | I796: CLARK 2 | L796: HANCE | N796: ALLSOP
E797: 18TH AUGUST
A798: PORT MELBOURNE | C798: 5 | D798: 1 | E798: =C798*6+D798 -> 31 | G798: 6 | H798: 7 | I798: =G798*6+H798 -> 43 | K798: 8 | L798: 10 | M798: =K798*6+L798 -> 58 | O798: 11 | P798: 13 | Q798: =O798*6+P798 -> 79 | S798: PORT MELBOURNE
A799: WILLIAMSTOWN | C799: 2 | D799: 4 | E799: =C799*6+D799 -> 16 | G799: 5 | H799: 5 | I799: =G799*6+H799 -> 35 | K799: 10 | L799: 6 | M799: =K799*6+L799 -> 66 | O799: 11 | P799: 9 | Q799: =O799*6+P799 -> 75 | S799: CRAIG
A800: BEST PLAYERS
A801: PORT MELBOURNE | C801: MERRETT | F801: FREYER | I801: TAGGART | L801: WILLIAMS | O801: RENOUF | R801: LEWIS
A802: WILLIAMSTOWN | C802: MALONEY | F802: JAMES | I802: LAWLEY | L802: CARMICHAEL | O802: McASEY | R802: WARD
A803: GOALKICKERS
A804: PORT MELBOURNE | C804: MERRETT 3 | F804: EDWARDS 2 | I804: BONNETT 2 | L804: TAGGART 2 | O804: CARLILE | Q804: HYLAND
A805: WILLIAMSTOWN | C805: JAMES 5 | F805: MALONEY 2 | I805: CARMICHAEL 2 | M805: WARD | O805: MAZOURIS
A807: ROUND 18 | E807: 24TH AUGUST | J807: WEATHER | N807: NORTH BREEZE FINE | S807: PLAYED AT
D808: 1ST QTR | H808: 2ND QTR | L808: 3RD QTR | P808: FINAL | S808: COBURG
A809: MOORABBIN | C809: 2 | D809: 6 | E809: =C809*6+D809 -> 18 | G809: 8 | H809: 9 | I809: =G809*6+H809 -> 57 | K809: 13 | L809: 10 | M809: =K809*6+L809 -> 88 | O809: 15 | P809: 16 | Q809: =O809*6+P809 -> 106 | S809: UMPIRE | X809: LADDER | AB809: ROUND | AD809: 18
A810: COBURG | C810: 3 | D810: 0 | E810: =C810*6+D810 -> 18 | G810: 4 | H810: 5 | I810: =G810*6+H810 -> 29 | K810: 5 | L810: 8 | M810: =K810*6+L810 -> 38 | O810: 11 | P810: 11 | Q810: =O810*6+P810 -> 77 | S810: MANCE
A811: BEST PLAYERS | W811: TEAM | X811: W | Y811: L | Z811: D | AA811: FOR | AB811: AGST | AC811: % | AD811: PTS
A812: MOORABBIN | C812: GUTTERSON | F812: KUPSCH | I812: HARRISON | L812: PERRY | O812: BRYAN | Q812: CRAMERI
A813: COBURG | C813: McNABB | F813: LORD | I813: J BRIMACOMBE | L813: CORNEILISON | O813: LEYDIN | Q813: BYRON | W813: MOORABBIN | X813: 13 | Y813: 5 | Z813: 0 | AA813: 1441 | AB813: 1083 | AC813: 133.05632502308401 | AD813: 52
A814: GOALKICKERS | W814: SANDRINGHAM | X814: 12 | Y814: 6 | Z814: 0 | AA814: 1805 | AB814: 1486 | AC814: 121.46702557200538 | AD814: 48
A815: MOORABBIN | C815: BRYAN 4 | E815: SHEPHERD 4 | H815: FOX 2 | J815: BURNS | L815: PERRY | N815: WHALEBONE | Q815: SYMONNS | S815: HARRISON | W815: COBURG | X815: 12 | Y815: 6 | Z815: 0 | AA815: 1569 | AB815: 1373 | AC815: 114.27530954115076 | AD815: 48
A816: COBURG | C816: McNABB 3 | F816: LEYDIN 3 | I816: BYRON 2 | K816: L BRIMACOMBE 2 | O816: BUTCHER | W816: YARRAVILLE | X816: 12 | Y816: 6 | Z816: 0 | AA816: 1480 | AB816: 1297 | AC816: 114.1094834232845 | AD816: 48
A818: PORT MELBOURNE | C818: 5 | D818: 4 | E818: =C818*6+D818 -> 34 | G818: 11 | H818: 8 | I818: =G818*6+H818 -> 74 | K818: 14 | L818: 12 | M818: =K818*6+L818 -> 96 | O818: 17 | P818: 14 | Q818: =O818*6+P818 -> 116 | S818: BEACH ROAD | W818: PORT MELBOURNE | X818: 10 | Y818: 8 | Z818: 0 | AA818: 1496 | AB818: 1399 | AC818: 106.93352394567549 | AD818: 40
A819: SANDRINGHAM | C819: 1 | D819: 2 | E819: =C819*6+D819 -> 8 | G819: 8 | H819: 6 | I819: =G819*6+H819 -> 54 | K819: 9 | L819: 7 | M819: =K819*6+L819 -> 61 | O819: 15 | P819: 10 | Q819: =O819*6+P819 -> 100 | S819: MILLEN | W819: OAKLEIGH | X819: 10 | Y819: 8 | Z819: 0 | AA819: 1394 | AB819: 1374 | AC819: 101.45560407569141 | AD819: 40
A820: BEST PLAYERS | W820: DANDENONG | X820: 6 | Y820: 11 | Z820: 1 | AA820: 1379 | AB820: 1429 | AC820: 96.501049685094472 | AD820: 26
A821: PORT MELBOURNE | C821: FREYER | F821: BONNETT | I821: EDWARDS | L821: LEWIS | N821: MERRETT | Q821: MILNER | W821: WILLIAMSTOWN | X821: 6 | Y821: 11 | Z821: 1 | AA821: 1327 | AB821: 1387 | AC821: 95.674116798846427 | AD821: 26
A822: SANDRINGHAM | C822: WILLS | F822: PEROVIC | I822: CLARK | L822: GLESON | N822: MUTER | Q822: HOAR | W822: BRUNSWICK | X822: 6 | Y822: 12 | Z822: 0 | AA822: 1354 | AB822: 1569 | AC822: 86.297004461440409 | AD822: 24
A823: GOALKICKERS | W823: NORTHCOTE | X823: 2 | Y823: 16 | Z823: 0 | AA823: 952 | AB823: 1800 | AC823: 52.888888888888886 | AD823: 8
A824: PORT MELBOURNE | C824: BONNETT 4 | F824: EDWARDS 4 | I824: MILNER 2 | K824: FREYER 2 | M824: CARLILE | O824: MERRETT | Q824: IRELAND | S824: MITHEN | U824: TAGGART
A825: SANDRINGHAM | C825: SHEEHAN 4 | F825: PEROVIC 3 | I825: HANCE 2 | K825: KENNEDY 2 | N825: GLEESON 2 | Q825: WILLS | S825: MERRETT
A827: YARRAVILLE | C827: 3 | D827: 2 | E827: =C827*6+D827 -> 20 | G827: 12 | H827: 10 | I827: =G827*6+H827 -> 82 | K827: 15 | L827: 12 | M827: =K827*6+L827 -> 102 | O827: 18 | P827: 16 | Q827: =O827*6+P827 -> 124 | S827: WILLIAMSTOWN
A828: WILLIAMSTOWN | C828: 3 | D828: 4 | E828: =C828*6+D828 -> 22 | G828: 6 | H828: 4 | I828: =G828*6+H828 -> 40 | K828: 14 | L828: 7 | M828: =K828*6+L828 -> 91 | O828: 15 | P828: 12 | Q828: =O828*6+P828 -> 102 | S828: HORNE
A829: BEST PLAYERS
A830: YARRAVILLE | C830: WHITTEN | F830: CLEGG | I830: MEDDINGS | L830: WILSON | O830: RON BROWN | R830: ORANGE
A831: WILLIAMSTOWN | C831: MALONEY | F831: JAMES | I831: BEAMISH | L831: McASEY | O831: CLOUGH | R831: MAZOURIS
A832: GOALKICKERS
A833: YARRAVILLE | C833: KNOTT 4 | E833: CLEGG 4 | G833: BOB BROWN 3 | J833: CONNELLY 3 | M833: RON BROWN 2 | P833: WHITTEN | R833: ORANGE
A834: WILLIAMSTOWN | C834: JAMES 7 | E834: MAZOURIS 4 | H834: McASEY 2 | J834: FOGARTY | M834: MALONEY
D835: 25TH AUGUST | I835: WEATHER | L835: RAIN
A836: OAKLEIGH | C836: 3 | D836: 3 | E836: =C836*6+D836 -> 21 | G836: 6 | H836: 4 | I836: =G836*6+H836 -> 40 | K836: 15 | L836: 9 | M836: =K836*6+L836 -> 99 | O836: 17 | P836: 9 | Q836: =O836*6+P836 -> 111 | S836: DANDENONG
A837: DANDENONG | C837: 4 | D837: 9 | E837: =C837*6+D837 -> 33 | G837: 6 | H837: 14 | I837: =G837*6+H837 -> 50 | K837: 9 | L837: 15 | M837: =K837*6+L837 -> 69 | O837: 14 | P837: 23 | Q837: =O837*6+P837 -> 107 | S837: TREWIN
A838: BEST PLAYERS
A839: OAKLEIGH | C839: JONES | E839: JEWELL | H839: McCOOKE | K839: PEAKE | N839: RICCI | Q839: TURNER
A840: DANDENONG | C840: KENT | E840: BARROW | H840: PILCHER | K840: DELANTY | N840: GRAY | Q840: ABRAHAM
A841: GOALKICKERS
A842: OAKLEIGH | C842: JONES 5 | F842: McCOOKE 4 | I842: RICCI 4 | K842: CRAWFORD 3 | N842: HAINING
A843: DANDENONG | C843: GRAY 5 | F843: WATERS 3 | I843: OSBORNE 2 | L843: DELANTY | N843: BARRAN | Q843: KENT | S843: DINEEN
A845: BRUNSWICK | C845: 6 | D845: 7 | E845: =C845*6+D845 -> 43 | G845: 11 | H845: 11 | I845: =G845*6+H845 -> 77 | K845: 15 | L845: 21 | M845: =K845*6+L845 -> 111 | O845: 20 | P845: 22 | Q845: =O845*6+P845 -> 142 | S845: NORTHCOTE
A846: NORTHCOTE | C846: 2 | D846: 4 | E846: =C846*6+D846 -> 16 | G846: 3 | H846: 5 | I846: =G846*6+H846 -> 23 | K846: 7 | L846: 7 | M846: =K846*6+L846 -> 49 | O846: 12 | P846: 12 | Q846: =O846*6+P846 -> 84 | S846: ROWE
A847: BEST PLAYERS
A848: BRUNSWICK | C848: COOK | F848: DARBY | I848: STANLEY | L848: WHILEY | O848: WILSON | R848: R DILLON
A849: NORTHCOTE | C849: BRETHERTON | F849: SIMPSON | I849: KEANE | L849: MORAN | O849: LACHMUND | R849: MULLENGER
A850: GOALKICKERS
A851: BRUNSWICK | C851: COOK 7 | E851: STANLEY 4 | H851: DARBY 2 | J851: K DILLON 2 | M851: EDWARDS 2 | P851: WATT | R851: THOMPSON | U851: WALSH
A852: NORTHCOTE | C852: DOWLING 3 | F852: BRETHERTON 2 | J852: OUSLEY 2 | M852: LACHMUND 2 | P852: BRADY | R852: BEITZEL | T852: MULLENGER
A854: FINALS
A855: 1ST SEMI | D855: 31ST AUGUST | J855: WEATHER | M855: SOUTH BREEZE
D856: 1ST QTR | H856: 2ND QTR | L856: 3RD QTR | P856: FINAL
A857: YARRAVILLE | C857: 4 | D857: 4 | E857: =C857*6+D857 -> 28 | G857: 9 | H857: 7 | I857: =G857*6+H857 -> 61 | K857: 14 | L857: 11 | M857: =K857*6+L857 -> 95 | O857: 16 | P857: 15 | Q857: =O857*6+P857 -> 111 | S857: PORT MELBOURNE
A858: COBURG | C858: 3 | D858: 3 | E858: =C858*6+D858 -> 21 | G858: 6 | H858: 9 | I858: =G858*6+H858 -> 45 | K858: 9 | L858: 18 | M858: =K858*6+L858 -> 72 | O858: 14 | P858: 20 | Q858: =O858*6+P858 -> 104 | S858: O'NEILL
A859: BEST PLAYERS
A860: YARRAVILLE | C860: WHITTEN | F860: KNOTT | I860: CLEGG | L860: LARKIN | O860: CONNELLY | R860: HOWARTH
A861: COBURG | C861: CORNEILISON | F861: LORD | I861: CARMODY | L861: McDONNELL | O861: POWELL | R861: MURRAY
A862: GOALKICKERS
A863: YARRAVILLE | C863: KNOTT 7 | F863: CONNELLY 3 | I863: WHITTEN 2 | L863: LAMONT 2 | O863: RON BROWN | R863: WARWICK
A864: COBURG | C864: CARMODY 4 | F864: LEYDIN 3 | I864: J BRIMACOMBE 2 | M864: BRANSTON 2 | P864: McNABB | R864: L BRIMACOMBE | V864: ROCHOW
A866: 2ND SEMI | D866: 7TH SEPTEMBER | J866: WEATHER | M866: SOUTH WEST BREEZE HEAVY SHOWERS
A867: MOORABBIN | C867: 1 | D867: 3 | E867: =C867*6+D867 -> 9 | G867: 6 | H867: 7 | I867: =G867*6+H867 -> 43 | K867: 9 | L867: 11 | M867: =K867*6+L867 -> 65 | O867: 14 | P867: 13 | Q867: =O867*6+P867 -> 97 | S867: PORT MELBOURNE
A868: SANDRINGHAM | C868: 2 | D868: 4 | E868: =C868*6+D868 -> 16 | G868: 6 | H868: 7 | I868: =G868*6+H868 -> 43 | K868: 8 | L868: 10 | M868: =K868*6+L868 -> 58 | O868: 13 | P868: 11 | Q868: =O868*6+P868 -> 89 | S868: HORNE
A869: BEST PLAYERS
A870: MOORABBIN | C870: PERRY | F870: KEE | I870: GUTTERSON | L870: PAPLEY | O870: BURNS | R870: CHRISTIE
A871: SANDRINGHAM | C871: HOAR | F871: WEBSTER | I871: POBJOY | L871: STRACHAN | O871: O'TOOLE | R871: BURNS
A872: GOALKICKERS
A873: MOORABBIN | C873: PAPLEY 5 | F873: KEE 3 | H873: SHEPHERD 2 | K873: WHALEBONE 2 | O873: CHRISTIE 2
A874: SANDRINGHAM | C874: STRACHAN 3 | F874: O'TOOLE 2 | I874: DAWSON 2 | L874: BURNS 2 | N874: WILLS 2 | P874: SHRIVES | R874: BURKE
A876: PRELIMINARY FINAL | F876: 14TH SEPTEMBER | K876: WEATHER | N876: WEST WIND CLOUDY
A877: SANDRINGHAM | C877: 4 | D877: 3 | E877: =C877*6+D877 -> 27 | G877: 8 | H877: 9 | I877: =G877*6+H877 -> 57 | K877: 10 | L877: 9 | M877: =K877*6+L877 -> 69 | O877: 17 | P877: 11 | Q877: =O877*6+P877 -> 113 | S877: PORT MELBOURNE
A878: YARRAVILLE | C878: 2 | D878: 2 | E878: =C878*6+D878 -> 14 | G878: 5 | H878: 3 | I878: =G878*6+H878 -> 33 | K878: 9 | L878: 11 | M878: =K878*6+L878 -> 65 | O878: 10 | P878: 13 | Q878: =O878*6+P878 -> 73 | S878: HORNE
A879: BEST PLAYERS
A880: SANDRINGHAM | C880: STRACHAN | F880: O'TOOLE | I880: KENNEDY | L880: BURKE | N880: BURNS | Q880: WEBSTER
A881: YARRAVILLE | C881: RON BROWN | F881: CLEGG | I881: WHITTEN | L881: LARKIN | N881: ORANGE | Q881: HOWARTH
A882: GOALKICKERS
A883: SANDRINGHAM | C883: STRACHAN 6 | F883: O'TOOLE 3 | I883: KENNEDY 3 | L883: BURNS 2 | N883: WILLS 2 | Q883: DAWSON
A884: YARRAVILLE | C884: CLEGG 2 | F884: KNOTT 2 | I884: ALLEN 2 | K884: LAMONT | M884: BOB BROWN | P884: FELL | R884: RON BROWN
A886: GRAND FINAL | E886: 21ST SEPTEMBER | J886: WEATHER | M886: NORTH WIND DULL
A887: MOORABBIN | C887: 5 | D887: 5 | E887: 35 | G887: 8 | H887: 8 | I887: 56 | K887: 15 | L887: 10 | M887: 100 | O887: 19 | P887: 16 | Q887: =O887*6+P887 -> 130 | S887: PORT MELBOURNE
A888: SANDRINGHAM | C888: 2 | D888: 1 | E888: 13 | G888: 4 | H888: 4 | I888: 28 | K888: 5 | L888: 9 | M888: 39 | O888: 9 | P888: 12 | Q888: =O888*6+P888 -> 66 | S888: O'NEILL
A889: BEST PLAYERS
A890: MOORABBIN | C890: PAPLEY | F890: WHALEBONE | I890: CRAMERI | L890: GUTTERSON | O890: HARRISON | R890: PERRY
A891: SANDRINGHAM | C891: POBJOY | F891: SHRIVES | I891: O'TOOLE | L891: KENNEDY | O891: WEBSTER | R891: HOAR
A892: GOALKICKERS
A893: MOORABBIN | C893: PAPLEY 6 | F893: WHALEBONE 4 | J893: KEE 4 | L893: BURNS 2 | N893: CHRISTIE 2 | Q893: RYAN
A894: SANDRINGHAM | C894: O'TOOLE 2 | F894: GLEESON 2 | I894: WILLS 2 | K894: PEROVIC 2 | N894: STRACHAN