A1: Victorian Football Association
A2: Season 1964 - Division One
A3: © Copyright Wal Williams | F3: First created: 2 May 2015
A4: Contact: joywalwi at gmail dot com | F4: Last updated: 8 October 2017 | W4: VFA Results and tables - Link to the main index page
A5: You are free to copy this document in whole or part provided that proper acknowledgement is given to the author. All rights reserved.
A7: 1964 V.F.A. | B7: SEASON 1ST DIVISION | CA7: \D | CB7: {GOTO}BJ3~/M{RIGHT 7}{END}{DOWN}~G4~
A8: ROUND 1 | D8: 18TH APRIL | I8: WEATHER | L8: DULL FOGGY NO WIND | S8: PLAYED AT | CB8: {GOTO}AL3~/M{END}{RIGHT}{END}{DOWN}~P3~
D9: 1ST QTR | H9: 2ND QTR | L9: 3RD QTR | P9: FINAL | S9: WILLIAMSTOWN | CB9: {GOTO}BJ23~/M{RIGHT 7}{END}{DOWN}~V4~
A10: WILLIAMSTOWN | C10: 2 | D10: 5 | E10: =C10*6+D10 -> 17 | G10: 6 | H10: 9 | I10: =G10*6+H10 -> 45 | K10: 7 | L10: 11 | M10: =K10*6+L10 -> 53 | O10: 12 | P10: 16 | Q10: =O10*6+P10 -> 88 | S10: UMPIRE | X10: LADDER | AB10: ROUND | AD10: 1 | CB10: {GOTO}BJ43~/M{RIGHT 7}{END}{DOWN}~G24~
A11: YARRAVILLE | C11: 3 | D11: 3 | E11: =C11*6+D11 -> 21 | G11: 3 | H11: 6 | I11: =G11*6+H11 -> 24 | K11: 4 | L11: 11 | M11: =K11*6+L11 -> 35 | O11: 9 | P11: 14 | Q11: =O11*6+P11 -> 68 | S11: FLANAGAN | CB11: {GOTO}AL23~/M{END}{RIGHT}{END}{DOWN}~P23~
A12: BEST PLAYERS | W12: TEAM | X12: W | Y12: L | Z12: D | AA12: FOR | AB12: AGST | AC12: % | AD12: PTS | CB12: {GOTO}BJ63~/M{RIGHT 7}{END}{DOWN}~V24~
A13: WILLIAMSTOWN | C13: WARD | F13: JAMES | I13: MALONEY | L13: CLOUGH | N13: McASEY | Q13: CARMICHAEL | CB13: {GOTO}BJ83~/M{RIGHT 7}{END}{DOWN}~G44~
A14: YARRAVILLE | C14: MURRAY | F14: RON BROWN | I14: CLEGG | L14: ORANGE | N14: CONNELLY | Q14: FELL | W14: PORT MELBOURNE | X14: 1 | Y14: 0 | Z14: 0 | AA14: 143 | AB14: 94 | AC14: 152.12765957446808 | AD14: 4 | CB14: {GOTO}AL43~/M{END}{RIGHT}{END}{DOWN}~P43~
A15: GOALKICKERS | W15: WILLIAMSTOWN | X15: 1 | Y15: 0 | Z15: 0 | AA15: 88 | AB15: 68 | AC15: 129.41176470588235 | AD15: 4 | CB15: {GOTO}BJ103~/M{RIGHT 7}{END}{DOWN}~V44~
A16: WILLIAMSTOWN | C16: JAMES 5 | F16: MALONEY 2 | I16: MURPHY | K16: BEAMISH | M16: SAVIGE | O16: CLOUGH | Q16: TURNER | W16: WAVERLEY | X16: 1 | Y16: 0 | Z16: 0 | AA16: 97 | AB16: 90 | AC16: 107.77777777777777 | AD16: 4 | CB16: {GOTO}BJ123~/M{RIGHT 7}{END}{DOWN}~G64~
A17: YARRAVILLE | C17: KNOTT 2 | F17: RON BROWN 2 | I17: CONNELLY 2 | L17: FELL | N17: CLEGG | P17: PIOVESAN | W17: PRESTON | X17: 1 | Y17: 0 | Z17: 0 | AA17: 83 | AB17: 80 | AC17: 103.75 | AD17: 4 | CB17: {GOTO}AL63~/M{END}{RIGHT}{END}{DOWN}~P63~
CB18: {GOTO}BJ143~/M{RIGHT 7}{END}{DOWN}~V64~
A19: WAVERLEY | C19: 3 | D19: 3 | E19: =C19*6+D19 -> 21 | G19: 5 | H19: 9 | I19: =G19*6+H19 -> 39 | K19: 10 | L19: 11 | M19: =K19*6+L19 -> 71 | O19: 14 | P19: 13 | Q19: =O19*6+P19 -> 97 | S19: DANDENONG | W19: COBURG | X19: 1 | Y19: 0 | Z19: 0 | AA19: 100 | AB19: 99 | AC19: 101.01010101010101 | AD19: 4 | CB19: {GOTO}BJ163~/M{RIGHT 7}{END}{DOWN}~G84~
A20: DANDENONG | C20: 3 | D20: 6 | E20: =C20*6+D20 -> 24 | G20: 5 | H20: 12 | I20: =G20*6+H20 -> 42 | K20: 10 | L20: 15 | M20: =K20*6+L20 -> 75 | O20: 12 | P20: 18 | Q20: =O20*6+P20 -> 90 | S20: MILLEN | W20: OAKLEIGH | X20: 0 | Y20: 1 | Z20: 0 | AA20: 99 | AB20: 100 | AC20: 99 | AD20: 0 | CB20: {GOTO}AL83~/M{END}{RIGHT}{END}{DOWN}~P83~
A21: BEST PLAYERS | W21: BRUNSWICK | X21: 0 | Y21: 1 | Z21: 0 | AA21: 80 | AB21: 83 | AC21: 96.385542168674704 | AD21: 0 | CB21: {GOTO}BJ183~/M{RIGHT 7}{END}{DOWN}~V84~
A22: WAVERLEY | C22: MARTIN | F22: ANGUS | I22: NATION | L22: INNES | O22: INGWERSON | R22: ELLIS | W22: DANDENONG | X22: 0 | Y22: 1 | Z22: 0 | AA22: 90 | AB22: 97 | AC22: 92.783505154639172 | AD22: 0 | CB22: {GOTO}BJ203~/M{RIGHT 7}{END}{DOWN}~G104~
A23: DANDENONG | C23: KENT | F23: ABRAHAM | I23: PENNEFATHER | L23: WHALEBONE | O23: GRAY | R23: BARRAN | W23: YARRAVILLE | X23: 0 | Y23: 1 | Z23: 0 | AA23: 68 | AB23: 88 | AC23: 77.272727272727266 | AD23: 0 | CB23: {GOTO}AL103~/M{END}{RIGHT}{END}{DOWN}~P103~
A24: GOALKICKERS | W24: SANDRINGHAM | X24: 0 | Y24: 1 | Z24: 0 | AA24: 94 | AB24: 143 | AC24: 65.734265734265733 | AD24: 0 | CB24: {GOTO}BJ223~/M{RIGHT 7}{END}{DOWN}~V104~
A25: WAVERLEY | C25: FLINN 3 | F25: MUNN 3 | H25: INGWERSON 2 | K25: WHITECROSS 2 | N25: BRENCHLEY 2 | Q25: NATION | S25: NASH | CB25: {GOTO}BJ243~/M{RIGHT 7}{END}{DOWN}~G124~
A26: DANDENONG | C26: GRAY 4 | F26: KENT 3 | H26: HILL | J26: BARRAN | M26: COLE | O26: WHALEBONE | R26: VEREY | CB26: {GOTO}AL123~/M{END}{RIGHT}{END}{DOWN}~P123~
E27: 19TH APRIL | M27: WEATHER | Q27: FINE | CB27: {GOTO}BJ263~/M{RIGHT 7}{END}{DOWN}~V124~
A28: PORT MELBOURNE | C28: 3 | D28: 3 | E28: =C28*6+D28 -> 21 | G28: 5 | H28: 10 | I28: =G28*6+H28 -> 40 | K28: 13 | L28: 12 | M28: =K28*6+L28 -> 90 | O28: 21 | P28: 17 | Q28: =O28*6+P28 -> 143 | S28: BEACH ROAD | CB28: {GOTO}BJ283~/M{RIGHT 7}{END}{DOWN}~G144~
A29: SANDRINGHAM | C29: 5 | D29: 7 | E29: =C29*6+D29 -> 37 | G29: 8 | H29: 12 | I29: =G29*6+H29 -> 60 | K29: 11 | L29: 14 | M29: =K29*6+L29 -> 80 | O29: 13 | P29: 16 | Q29: =O29*6+P29 -> 94 | S29: ROWE | CB29: {GOTO}AL143~/M{END}{RIGHT}{END}{DOWN}~P143~
A30: BEST PLAYERS | CB30: {GOTO}BJ303~/M{RIGHT 7}{END}{DOWN}~V144~
A31: PORT MELBOURNE | C31: FREYER | F31: PERRY | I31: TAGGART | L31: BONNETT | O31: BOWEN | Q31: KERR | CB31: {GOTO}BJ323~/M{RIGHT 7}{END}{DOWN}~G164~
A32: SANDRINGHAM | C32: WILLS | F32: CLIFFORD | I32: SHEEHAN | L32: BURNS | O32: MUTER | Q32: GLEESON | CB32: {GOTO}AL163~/M{END}{RIGHT}{END}{DOWN}~P163~
A33: GOALKICKERS | CB33: {GOTO}BJ343~/M{RIGHT 7}{END}{DOWN}~V164~
A34: PORT MELBOURNE | C34: BONNETT 7 | F34: TAGGART 3 | I34: JEFFREY 3 | K34: EDWARDS 2 | N34: KERR 2 | P34: MOONEY | R34: PERRY | T34: BOWEN | W34: MILNER | CB34: {HOME}
A35: SANDRINGHAM | C35: PEROVIC 3 | F35: BURNS 3 | I35: SHEEHAN 2 | L35: CHRISTIE | N35: MUTER | P35: KENNEDY | R35: O'TOOLE | U35: GLEESON
A37: COBURG | C37: 1 | D37: 1 | E37: =C37*6+D37 -> 7 | G37: 6 | H37: 8 | I37: =G37*6+H37 -> 44 | K37: 10 | L37: 9 | M37: =K37*6+L37 -> 69 | O37: 15 | P37: 10 | Q37: =O37*6+P37 -> 100 | S37: COBURG
A38: OAKLEIGH | C38: 3 | D38: 2 | E38: =C38*6+D38 -> 20 | G38: 7 | H38: 2 | I38: =G38*6+H38 -> 44 | K38: 12 | L38: 6 | M38: =K38*6+L38 -> 78 | O38: 15 | P38: 9 | Q38: =O38*6+P38 -> 99 | S38: CRAIG
A39: BEST PLAYERS
A40: COBURG | C40: MURRAY | F40: WELSH | I40: GRAHAM | L40: GOTCH | O40: BOXSHALL | R40: HAWLEY
A41: OAKLEIGH | C41: TURNER | F41: MULDOON | I41: McLAREN | L41: TIPPETT | O41: KITTO | R41: JONES
A42: GOALKICKERS
A43: COBURG | C43: FITZPATRICK 4 | F43: MURRAY 3 | I43: LEYDIN 2 | K43: CARMODY 2 | N43: ROCHOW | P43: GOTCH | R43: L BRIMACOMBE
A44: OAKLEIGH | C44: McLAREN 6 | F44: McNEILL 2 | I44: WING 2 | K44: JONES 2 | M44: SHERIDAN | O44: MAUGHAN | R44: LOTHIAN
A46: PRESTON | C46: 6 | D46: 1 | E46: =C46*6+D46 -> 37 | G46: 11 | H46: 4 | I46: =G46*6+H46 -> 70 | K46: 12 | L46: 8 | M46: =K46*6+L46 -> 80 | O46: 12 | P46: 11 | Q46: =O46*6+P46 -> 83 | S46: PRESTON
A47: BRUNSWICK | C47: 2 | D47: 5 | E47: =C47*6+D47 -> 17 | G47: 5 | H47: 6 | I47: =G47*6+H47 -> 36 | K47: 6 | L47: 10 | M47: =K47*6+L47 -> 46 | O47: 11 | P47: 14 | Q47: =O47*6+P47 -> 80 | S47: FROOD
A48: BEST PLAYERS
A49: PRESTON | C49: MUIR | F49: PARRIS | I49: MILLER | L49: TRELOAR | O49: DIXON | Q49: WALKER
A50: BRUNSWICK | C50: WICKS | F50: BIBBY | I50: BOWTELL | L50: DENTON | O50: TOZER | Q50: COOK
A51: GOALKICKERS
A52: PRESTON | C52: WALKER 5 | F52: PARRIS 3 | I52: MURNANE | K52: WATSON | M52: MILLS | O52: APPLEFORD
A53: BRUNSWICK | C53: COOK 5 | F53: MURDOCH 2 | I53: STANLEY 2 | L53: BIBBY | N53: DENTON
A55: ROUND 2 | E55: 2ND MAY | J55: WEATHER | N55: NORTH WEST WIND | S55: PLAYED AT
D56: 1ST QTR | H56: 2ND QTR | L56: 3RD QTR | P56: FINAL | S56: OAKLEIGH
A57: PRESTON | C57: 6 | D57: 1 | E57: =C57*6+D57 -> 37 | G57: 8 | H57: 2 | I57: =G57*6+H57 -> 50 | K57: 9 | L57: 4 | M57: =K57*6+L57 -> 58 | O57: 13 | P57: 10 | Q57: =O57*6+P57 -> 88 | S57: UMPIRE | X57: LADDER | AB57: ROUND | AD57: 2
A58: OAKLEIGH | C58: 2 | D58: 6 | E58: =C58*6+D58 -> 18 | G58: 5 | H58: 8 | I58: =G58*6+H58 -> 38 | K58: 6 | L58: 11 | M58: =K58*6+L58 -> 47 | O58: 10 | P58: 16 | Q58: =O58*6+P58 -> 76 | S58: ROWE
A59: BEST PLAYERS | W59: TEAM | X59: W | Y59: L | Z59: D | AA59: FOR | AB59: AGST | AC59: % | AD59: PTS
A60: PRESTON | C60: PARRIS | E60: MURNANE | H60: PINFOLD | K60: MUIR | N60: WHITE | Q60: TRELOAR
A61: OAKLEIGH | C61: JONES | E61: KITTO | H61: McLAREN | K61: LOTHIAN | N61: WING | Q61: MAUGHAN | W61: PORT MELBOURNE | X61: 2 | Y61: 0 | Z61: 0 | AA61: 234 | AB61: 182 | AC61: 128.57142857142858 | AD61: 8
A62: GOALKICKERS | W62: WILLIAMSTOWN | X62: 2 | Y62: 0 | Z62: 0 | AA62: 147 | AB62: 124 | AC62: 118.54838709677419 | AD62: 8
A63: PRESTON | C63: PARRIS 5 | F63: WHITE 3 | I63: TRELOAR 2 | L63: MURNANE | O63: MUIR | Q63: WALKER | W63: PRESTON | X63: 2 | Y63: 0 | Z63: 0 | AA63: 171 | AB63: 156 | AC63: 109.61538461538461 | AD63: 8
A64: OAKLEIGH | C64: McLAREN 2 | F64: LOTHIAN 2 | I64: CRAWFORD 2 | L64: WING 2 | N64: JONES | P64: MAUGHAN | W64: DANDENONG | X64: 1 | Y64: 1 | Z64: 0 | AA64: 178 | AB64: 146 | AC64: 121.91780821917808 | AD64: 4
A66: WILLIAMSTOWN | C66: 4 | D66: 3 | E66: =C66*6+D66 -> 27 | G66: 7 | H66: 7 | I66: =G66*6+H66 -> 49 | K66: 7 | L66: 10 | M66: =K66*6+L66 -> 52 | O66: 8 | P66: 11 | Q66: =O66*6+P66 -> 59 | S66: BRUNSWICK | W66: COBURG | X66: 1 | Y66: 1 | Z66: 0 | AA66: 188 | AB66: 190 | AC66: 98.94736842105263 | AD66: 4
A67: BRUNSWICK | C67: 0 | D67: 1 | E67: =C67*6+D67 -> 1 | G67: 3 | H67: 1 | I67: =G67*6+H67 -> 19 | K67: 6 | L67: 1 | M67: =K67*6+L67 -> 37 | O67: 9 | P67: 2 | Q67: =O67*6+P67 -> 56 | S67: MILLEN | W67: SANDRINGHAM | X67: 1 | Y67: 1 | Z67: 0 | AA67: 213 | AB67: 227 | AC67: 93.832599118942724 | AD67: 4
A68: BEST PLAYERS | W68: WAVERLEY | X68: 1 | Y68: 1 | Z68: 0 | AA68: 181 | AB68: 209 | AC68: 86.602870813397132 | AD68: 4
A69: WILLIAMSTOWN | C69: JONES | E69: MALONEY | H69: MURPHY | K69: GRAHAM | N69: GIBBS | Q69: CLOUGH | W69: BRUNSWICK | X69: 0 | Y69: 2 | Z69: 0 | AA69: 136 | AB69: 142 | AC69: 95.774647887323937 | AD69: 0
A70: BRUNSWICK | C70: COOK | E70: WICKS | H70: RUSSELL | K70: BIBBY | N70: ROBINSON | Q70: PENDLEBURY | W70: OAKLEIGH | X70: 0 | Y70: 2 | Z70: 0 | AA70: 175 | AB70: 188 | AC70: 93.085106382978722 | AD70: 0
A71: GOALKICKERS | W71: YARRAVILLE | X71: 0 | Y71: 2 | Z71: 0 | AA71: 117 | AB71: 176 | AC71: 66.477272727272734 | AD71: 0
A72: WILLIAMSTOWN | C72: JAMES 2 | F72: GRAHAM 2 | I72: CLOUGH 2 | L72: MALONEY | O72: MURPHY
A73: BRUNSWICK | C73: COOK 5 | F73: RUSSELL 2 | I73: PENDLEBURY | L73: BIBBY
A75: DANDENONG | C75: 0 | D75: 8 | E75: =C75*6+D75 -> 8 | G75: 3 | H75: 12 | I75: =G75*6+H75 -> 30 | K75: 10 | L75: 16 | M75: =K75*6+L75 -> 76 | O75: 12 | P75: 16 | Q75: =O75*6+P75 -> 88 | S75: YARRAVILLE
A76: YARRAVILLE | C76: 3 | D76: 2 | E76: =C76*6+D76 -> 20 | G76: 4 | H76: 4 | I76: =G76*6+H76 -> 28 | K76: 4 | L76: 7 | M76: =K76*6+L76 -> 31 | O76: 6 | P76: 13 | Q76: =O76*6+P76 -> 49 | S76: JACKSON
A77: BEST PLAYERS
A78: DANDENONG | C78: SCHMIDT | F78: WHALEBONE | I78: GREENWOOD | L78: PENNEFATHER | O78: BARRAN | R78: OSBORNE
A79: YARRAVILLE | C79: PIOVESAN | F79: ROBERTSON | I79: McGILL | L79: CLEGG | O79: ORANGE | R79: MALONEY
A80: GOALKICKERS
A81: DANDENONG | C81: SCHMIDT 2 | F81: KENT 2 | H81: GREENWOOD 2 | K81: GRAY | M81: WHALEBONE | P81: PIVETTA | R81: BARRAN | U81: VEREY | W81: COLE
A82: YARRAVILLE | C82: PIOVESAN 2 | F82: ROBERTSON | I82: EDWARDS | L82: RON BROWN | O82: CURRIE
A84: SANDRINGHAM | C84: 1 | D84: 1 | E84: =C84*6+D84 -> 7 | G84: 10 | H84: 8 | I84: =G84*6+H84 -> 68 | K84: 13 | L84: 9 | M84: =K84*6+L84 -> 87 | O84: 18 | P84: 11 | Q84: =O84*6+P84 -> 119 | S84: WAVERLEY
A85: WAVERLEY | C85: 6 | D85: 3 | E85: =C85*6+D85 -> 39 | G85: 7 | H85: 9 | I85: =G85*6+H85 -> 51 | K85: 10 | L85: 14 | M85: =K85*6+L85 -> 74 | O85: 11 | P85: 18 | Q85: =O85*6+P85 -> 84 | S85: O'NEILL
A86: BEST PLAYERS
A87: SANDRINGHAM | C87: SMART | F87: BURKE | I87: HOLMES | L87: HOAR | O87: BURNS | R87: SHEEHAN
A88: WAVERLEY | C88: ELLIS | F88: ANGUS | I88: INGWERSON | L88: NATION | O88: HUDSON | R88: LEE
A89: GOALKICKERS
A90: SANDRINGHAM | C90: SMART 5 | F90: BURNS 5 | I90: GLEESON 4 | L90: O'TOOLE 2 | N90: CHRISTIE | Q90: SHEEHAN
A91: WAVERLEY | C91: INGWERSON 2 | F91: DAVEY 2 | I91: FLINN | K91: MITHEN | M91: HUDSON | O91: WHITECROSS | R91: SMITH | T91: BRENCHLEY | W91: MUNN
E92: 3RD MAY | H92: WEATHER | K92: SHOWERS
A93: PORT MELBOURNE | C93: 2 | D93: 2 | E93: =C93*6+D93 -> 14 | G93: 7 | H93: 9 | I93: =G93*6+H93 -> 51 | K93: 9 | L93: 12 | M93: =K93*6+L93 -> 66 | O93: 12 | P93: 19 | Q93: =O93*6+P93 -> 91 | S93: PORT MELBOURNE
A94: COBURG | C94: 3 | D94: 3 | E94: =C94*6+D94 -> 21 | G94: 4 | H94: 4 | I94: =G94*6+H94 -> 28 | K94: 12 | L94: 8 | M94: =K94*6+L94 -> 80 | O94: 13 | P94: 10 | Q94: =O94*6+P94 -> 88 | S94: FROOD
A95: BEST PLAYERS
A96: PORT MELBOURNE | C96: CARLILE | F96: CROSHER | I96: WILLIAMS | L96: TAGGART | O96: KERR | R96: MILNER
A97: COBURG | C97: GOTCH | F97: RIST | I97: SULLIVAN | L97: CLEMENTS | O97: J BRIMACOMBE | R97: HAWLEY
A98: GOALKICKERS
A99: PORT MELBOURNE | C99: JEFFREY 4 | F99: MITHEN 2 | I99: PERRY 2 | K99: TAGGART | M99: MILNER | O99: CARLILE | Q99: MERRETT
A100: COBURG | C100: RIST 4 | E100: GOTCH 3 | G100: FITZPATRICK 2 | J100: McNABB | L100: J BRIMACOMBE | O100: LEYDIN | Q100: CARMODY
A102: ROUND 3 | C102: 9TH MAY | J102: WEATHER | M102: N.W.WIND FINE | S102: PLAYED AT
D103: 1ST QTR | H103: 2ND QTR | L103: 3RD QTR | P103: FINAL | S103: WILLIAMSTOWN
A104: WILLIAMSTOWN | C104: 3 | D104: 2 | E104: =C104*6+D104 -> 20 | G104: 9 | H104: 4 | I104: =G104*6+H104 -> 58 | K104: 13 | L104: 8 | M104: =K104*6+L104 -> 86 | O104: 19 | P104: 13 | Q104: =O104*6+P104 -> 127 | S104: UMPIRE | X104: LADDER | AB104: ROUND | AD104: 3
A105: WAVERLEY | C105: 2 | D105: 3 | E105: =C105*6+D105 -> 15 | G105: 5 | H105: 5 | I105: =G105*6+H105 -> 35 | K105: 10 | L105: 9 | M105: =K105*6+L105 -> 69 | O105: 12 | P105: 9 | Q105: =O105*6+P105 -> 81 | S105: McMASTER
A106: BEST PLAYERS | W106: TEAM | X106: W | Y106: L | Z106: D | AA106: FOR | AB106: AGST | AC106: % | AD106: PTS
A107: WILLIAMSTOWN | C107: JENKINSON | F107: McASEY | I107: WARD | K107: CLOUGH | N107: REES | Q107: CARMICHAEL
A108: WAVERLEY | C108: MITHEN | F108: THOROGOOD | I108: ELLIS | K108: ANGUS | N108: BRENCHLEY | Q108: SMITH | W108: WILLIAMSTOWN | X108: 3 | Y108: 0 | Z108: 0 | AA108: 274 | AB108: 205 | AC108: 133.65853658536585 | AD108: 12
A109: GOALKICKERS | W109: PORT MELBOURNE | X109: 3 | Y109: 0 | Z109: 0 | AA109: 342 | AB109: 268 | AC109: 127.61194029850746 | AD109: 12
A110: WILLIAMSTOWN | C110: JENKINSON 5 | F110: McASEY 5 | I110: TURNER 4 | K110: GRAHAM 2 | N110: WILLIAMS 2 | Q110: JAMES | W110: DANDENONG | X110: 2 | Y110: 1 | Z110: 0 | AA110: 293 | AB110: 214 | AC110: 136.9158878504673 | AD110: 8
A111: WAVERLEY | C111: BRENCHLEY 3 | F111: INGWERSON 2 | I111: NASH 2 | K111: FLINN | M111: MANNICHE | P111: NATION | R111: THOROGOOD | W111: COBURG | X111: 2 | Y111: 1 | Z111: 0 | AA111: 328 | AB111: 266 | AC111: 123.30827067669173 | AD111: 8
E112: 10TH MAY | J112: WEATHER | R112: MASSEY
A113: DANDENONG | C113: 2 | D113: 3 | E113: =C113*6+D113 -> 15 | G113: 5 | H113: 4 | I113: =G113*6+H113 -> 34 | K113: 13 | L113: 13 | M113: =K113*6+L113 -> 91 | O113: 16 | P113: 19 | Q113: =O113*6+P113 -> 115 | S113: PRESTON | W113: PRESTON | X113: 2 | Y113: 1 | Z113: 0 | AA113: 239 | AB113: 271 | AC113: 88.191881918819192 | AD113: 8
A114: PRESTON | C114: 3 | D114: 2 | E114: =C114*6+D114 -> 20 | G114: 5 | H114: 5 | I114: =G114*6+H114 -> 35 | K114: 7 | L114: 7 | M114: =K114*6+L114 -> 49 | O114: 10 | P114: 8 | Q114: =O114*6+P114 -> 68 | S114: FLANAGAN | W114: YARRAVILLE | X114: 1 | Y114: 2 | Z114: 0 | AA114: 260 | AB114: 273 | AC114: 95.238095238095241 | AD114: 4
A115: BEST PLAYERS | W115: SANDRINGHAM | X115: 1 | Y115: 2 | Z115: 0 | AA115: 289 | AB115: 367 | AC115: 78.746594005449595 | AD115: 4
A116: DANDENONG | C116: OSBORNE | F116: COLE | I116: PIVETTA | L116: GREENWOOD | O116: WHALEBONE | R116: PENNEFATHER | W116: WAVERLEY | X116: 1 | Y116: 2 | Z116: 0 | AA116: 262 | AB116: 336 | AC116: 77.976190476190482 | AD116: 4
A117: PRESTON | C117: TRELOAR | F117: WHITE | I117: WATSON | L117: MILLS | O117: WALKER | R117: COHEN | W117: BRUNSWICK | X117: 0 | Y117: 3 | Z117: 0 | AA117: 222 | AB117: 250 | AC117: 88.8 | AD117: 0
A118: GOALKICKERS | W118: OAKLEIGH | X118: 0 | Y118: 3 | Z118: 0 | AA118: 272 | AB118: 331 | AC118: 82.175226586102724 | AD118: 0
A119: DANDENONG | C119: SCHMIDT 3 | F119: COLE 3 | H119: WHALEBONE 3 | K119: VEREY 3 | M119: GREENWOOD 2 | P119: GRAY | R119: BARRAN
A120: PRESTON | C120: WALKER 3 | F120: WATSON 3 | I120: TRELOAR 2 | L120: JAMES | N120: WHITE
A122: COBURG | C122: 3 | D122: 1 | E122: =C122*6+D122 -> 19 | G122: 7 | H122: 7 | I122: =G122*6+H122 -> 49 | K122: 14 | L122: 11 | M122: =K122*6+L122 -> 95 | O122: 20 | P122: 20 | Q122: =O122*6+P122 -> 140 | S122: COBURG
A123: SANDRINGHAM | C123: 5 | D123: 5 | E123: =C123*6+D123 -> 35 | G123: 8 | H123: 6 | I123: =G123*6+H123 -> 54 | K123: 10 | L123: 10 | M123: =K123*6+L123 -> 70 | O123: 11 | P123: 10 | Q123: =O123*6+P123 -> 76 | S123: TREWIN
A124: BEST PLAYERS
A125: COBURG | C125: CLEMENTS | F125: BYRON | I125: SULLIVAN | L125: GOTCH | O125: RIST | R125: LEYDIN
A126: SANDRINGHAM | C126: O'TOOLE | F126: SHEEHAN | I126: BURNS | L126: GRANGER | O126: HARRISON | R126: SHEERAN
A127: GOALKICKERS
A128: COBURG | C128: LEYDIN 4 | E128: FITZPATRICK 3 | H128: ROCHOW 3 | J128: MURRAY 2 | M128: RIST 2 | O128: J BRIMACOMBE 2 | S128: CARMODY 2 | W128: BYRON | X128: McNABB
A129: SANDRINGHAM | C129: O'TOOLE 3 | F129: SHEEHAN 3 | I129: BURNS 2 | K129: GLEESON | M129: WILLS | O129: HARRISON
A131: YARRAVILLE | C131: 3 | D131: 2 | E131: =C131*6+D131 -> 20 | G131: 10 | H131: 5 | I131: =G131*6+H131 -> 65 | K131: 16 | L131: 9 | M131: =K131*6+L131 -> 105 | O131: 21 | P131: 17 | Q131: =O131*6+P131 -> 143 | S131: YARRAVILLE
A132: OAKLEIGH | C132: 5 | D132: 4 | E132: =C132*6+D132 -> 34 | G132: 7 | H132: 6 | I132: =G132*6+H132 -> 48 | K132: 12 | L132: 9 | M132: =K132*6+L132 -> 81 | O132: 14 | P132: 13 | Q132: =O132*6+P132 -> 97 | S132: SCOTT
A133: BEST PLAYERS
A134: YARRAVILLE | C134: MEDDINGS | F134: ORANGE | I134: EDWARDS | L134: RON BROWN | O134: KNOTT | R134: CLEGG
A135: OAKLEIGH | C135: JONES | F135: HAINING | I135: KITTO | L135: SHERIDAN | O135: LYONS | R135: McLAREN
A136: GOALKICKERS
A137: YARRAVILLE | C137: KNOTT 6 | F137: PIOVESAN 4 | I137: MEDDINGS 4 | L137: ALLEN 2 | N137: CONNELLY 2 | Q137: EDWARDS | S137: WILSON | U137: MALONEY
A138: OAKLEIGH | C138: JONES 4 | F138: CRAWFORD 3 | I138: SHERIDAN 2 | L138: KITTO 2 | N138: McLAREN 2 | Q138: THOMSON
A140: PORT MELBOURNE | C140: 3 | D140: 4 | E140: =C140*6+D140 -> 22 | G140: 8 | H140: 7 | I140: =G140*6+H140 -> 55 | K140: 12 | L140: 9 | M140: =K140*6+L140 -> 81 | O140: 16 | P140: 12 | Q140: =O140*6+P140 -> 108 | S140: PORT MELBOURNE
A141: BRUNSWICK | C141: 1 | D141: 2 | E141: =C141*6+D141 -> 8 | G141: 4 | H141: 5 | I141: =G141*6+H141 -> 29 | K141: 6 | L141: 6 | M141: =K141*6+L141 -> 42 | O141: 13 | P141: 8 | Q141: =O141*6+P141 -> 86 | S141: O'NEILL
A142: BEST PLAYERS
A143: PORT MELBOURNE | C143: FREYER | F143: RENOUF | I143: CASTLEHOW | L143: TAGGART | O143: CROSHER | R143: KERR
A144: BRUNSWICK | C144: DENTON | F144: DARBY | I144: ROBINSON | L144: BIBBY | O144: MURDOCH | R144: AYRES
A145: GOALKICKERS
A146: PORT MELBOURNE | C146: TAGGART 3 | F146: BONNETT 3 | I146: JEFFREY 3 | K146: BOWEN 2 | M146: EDWARDS 2 | P146: PERRY 2 | R146: MOONEY
A147: BRUNSWICK | C147: DENTON 3 | F147: ROBINSON 3 | I147: DARBY | K147: MURDOCH | M147: STANLEY | O147: RUSSELL | Q147: WHILEY | S147: COOK | U147: BOWTELL
A149: ROUND 4 | D149: 16TH MAY | I149: WEATHER | L149: FINE | S149: PLAYED AT
D150: 1ST QTR | H150: 2ND QTR | L150: 3RD QTR | P150: FINAL | S150: WAVERLEY
A151: YARRAVILLE | C151: 3 | D151: 4 | E151: =C151*6+D151 -> 22 | G151: 6 | H151: 8 | I151: =G151*6+H151 -> 44 | K151: 11 | L151: 12 | M151: =K151*6+L151 -> 78 | O151: 19 | P151: 14 | Q151: =O151*6+P151 -> 128 | S151: UMPIRE | X151: LADDER | AB151: ROUND | AD151: 4
A152: WAVERLEY | C152: 4 | D152: 13 | E152: =C152*6+D152 -> 37 | G152: 7 | H152: 16 | I152: =G152*6+H152 -> 58 | K152: 7 | L152: 18 | M152: =K152*6+L152 -> 60 | O152: 9 | P152: 24 | Q152: =O152*6+P152 -> 78 | S152: FLANAGAN
A153: BEST PLAYERS | W153: TEAM | X153: W | Y153: L | Z153: D | AA153: FOR | AB153: AGST | AC153: % | AD153: PTS
A154: YARRAVILLE | C154: MEDDINGS | F154: ALLEN | I154: KNOTT | L154: PIOVESAN | O154: ORANGE | R154: CLEGG
A155: WAVERLEY | C155: ELLIS | F155: INNES | I155: ANGUS | L155: NASH | O155: INGWERSON | R155: CULPIN | W155: PORT MELBOURNE | X155: 4 | Y155: 0 | Z155: 0 | AA155: 446 | AB155: 364 | AC155: 122.52747252747253 | AD155: 16
A156: GOALKICKERS | W156: DANDENONG | X156: 3 | Y156: 1 | Z156: 0 | AA156: 393 | AB156: 287 | AC156: 136.93379790940767 | AD156: 12
A157: YARRAVILLE | C157: KNOTT 6 | E157: ALLEN 3 | G157: PIOVESAN 2 | J157: EDWARDS 2 | M157: CONNELLY 2 | P157: CLEGG | R157: MEDDINGS | W157: COBURG | X157: 3 | Y157: 1 | Z157: 0 | AA157: 425 | AB157: 335 | AC157: 126.87 | AD157: 12
A158: WAVERLEY | C158: CULPIN 4 | F158: NASH 2 | I158: HUDSON | K158: NATION | M158: PETZKE | W158: WILLIAMSTOWN | X158: 3 | Y158: 1 | Z158: 0 | AA158: 347 | AB158: 305 | AC158: 113.77049180327869 | AD158: 12
A160: PORT MELBOURNE | C160: 1 | D160: 3 | E160: =C160*6+D160 -> 9 | G160: 7 | H160: 7 | I160: =G160*6+H160 -> 49 | K160: 11 | L160: 8 | M160: =K160*6+L160 -> 74 | O160: 15 | P160: 14 | Q160: =O160*6+P160 -> 104 | S160: OAKLEIGH | W160: YARRAVILLE | X160: 2 | Y160: 2 | Z160: 0 | AA160: 388 | AB160: 351 | AC160: 110.54131054131054 | AD160: 8
A161: OAKLEIGH | C161: 4 | D161: 4 | E161: =C161*6+D161 -> 28 | G161: 5 | H161: 7 | I161: =G161*6+H161 -> 37 | K161: 11 | L161: 10 | M161: =K161*6+L161 -> 76 | O161: 14 | P161: 12 | Q161: =O161*6+P161 -> 96 | S161: McMASTER | W161: PRESTON | X161: 2 | Y161: 2 | Z161: 0 | AA161: 334 | AB161: 382 | AC161: 87.434554973821989 | AD161: 8
A162: BEST PLAYERS | W162: SANDRINGHAM | X162: 2 | Y162: 2 | Z162: 0 | AA162: 400 | AB162: 462 | AC162: 86.580086580086586 | AD162: 8
A163: PORT MELBOURNE | C163: JEFFREY | F163: MOONEY | I163: MARTIN | L163: BOWEN | N163: TAGGART | Q163: PETRUCCO | W163: WAVERLEY | X163: 1 | Y163: 3 | Z163: 0 | AA163: 340 | AB163: 464 | AC163: 73.275862068965523 | AD163: 4
A164: OAKLEIGH | C164: McLAREN | F164: R RICCI | I164: JONES | L164: TURNER | N164: CRAWFORD | Q164: McNEILL | W164: OAKLEIGH | X164: 0 | Y164: 4 | Z164: 0 | AA164: 368 | AB164: 435 | AC164: 84.597701149425291 | AD164: 0
A165: GOALKICKERS | W165: BRUNSWICK | X165: 0 | Y165: 4 | Z165: 0 | AA165: 291 | AB165: 347 | AC165: 83.86 | AD165: 0
A166: PORT MELBOURNE | C166: JEFFREY 4 | F166: MOONEY 4 | I166: BOWEN 2 | K166: MARTIN 2 | N166: TAGGART | P166: EDWARDS | R166: PETRUCCO
A167: OAKLEIGH | C167: McLAREN 4 | F167: R RICCI 3 | I167: CRAWFORD 2 | L167: JONES 2 | N167: SHERIDAN | Q167: O'NEILL
E168: 17TH MAY | I168: WEATHER | M168: NORTH WIND FINE
A169: DANDENONG | C169: 8 | D169: 5 | E169: =C169*6+D169 -> 53 | G169: 8 | H169: 7 | I169: =G169*6+H169 -> 55 | K169: 11 | L169: 15 | M169: =K169*6+L169 -> 81 | O169: 14 | P169: 16 | Q169: =O169*6+P169 -> 100 | S169: DANDENONG
A170: WILLIAMSTOWN | C170: 0 | D170: 0 | E170: =C170*6+D170 -> 0 | G170: 2 | H170: 7 | I170: =G170*6+H170 -> 19 | K170: 3 | L170: 11 | M170: =K170*6+L170 -> 29 | O170: 10 | P170: 13 | Q170: =O170*6+P170 -> 73 | S170: TREWIN
A171: BEST PLAYERS
A172: DANDENONG | C172: PENNEFATHER | F172: OSBORNE | I172: GREENWOOD | L172: ARMSTRONG | O172: WHALEBONE | R172: HOBBS
A173: WILLIAMSTOWN | C173: MALONEY | F173: WARD | I173: JENKINSON | L173: MURRIE | O173: CLOUGH | R173: GRAHAM
A174: GOALKICKERS
A175: DANDENONG | C175: WHALEBONE 4 | F175: OSBORNE 2 | I175: GREENWOOD 2 | L175: ARMSTRONG 2 | O175: SCHMIDT | Q175: PIVETTA | S175: COLE | U175: GRAY
A176: WILLIAMSTOWN | C176: CLOUGH 2 | F176: MURPHY 2 | I176: JAMES | K176: JENKINSON | N176: MALONEY | Q176: RAILTON | S176: GRAHAM | V176: WILLIAMS
A178: SANDRINGHAM | C178: 4 | D178: 6 | E178: =C178*6+D178 -> 30 | G178: 6 | H178: 8 | I178: =G178*6+H178 -> 44 | K178: 14 | L178: 13 | M178: =K178*6+L178 -> 97 | O178: 16 | P178: 15 | Q178: =O178*6+P178 -> 111 | S178: BEACH ROAD
A179: PRESTON | C179: 2 | D179: 1 | E179: =C179*6+D179 -> 13 | G179: 7 | H179: 7 | I179: =G179*6+H179 -> 49 | K179: 9 | L179: 9 | M179: =K179*6+L179 -> 63 | O179: 14 | P179: 11 | Q179: =O179*6+P179 -> 95 | S179: HORNE
A180: BEST PLAYERS
A181: SANDRINGHAM | C181: BURNS | F181: HOAR | I181: MUTER | L181: CLIFFORD | O181: SHEEHAN | R181: MERRETT
A182: PRESTON | C182: MILLER | F182: WALKER | I182: PINFOLD | L182: TRELOAR | O182: MILLS | R182: WATSON
A183: GOALKICKERS
A184: SANDRINGHAM | C184: BURNS 6 | F184: PEROVIC 4 | I184: SHEEHAN 2 | L184: O'TOOLE | N184: MERRETT | Q184: KENNEDY | S184: SMART
A185: PRESTON | C185: WALKER 5 | F185: TRELOAR 2 | I185: WATSON 2 | L185: WASLEY 2 | O185: MILLS | Q185: MUIR | S185: WHITE
A187: COBURG | C187: 1 | D187: 1 | E187: =C187*6+D187 -> 7 | G187: 7 | H187: 6 | I187: =G187*6+H187 -> 48 | K187: 10 | L187: 8 | M187: =K187*6+L187 -> 68 | O187: 14 | P187: 13 | Q187: =O187*6+P187 -> 97 | S187: BRUNSWICK
A188: BRUNSWICK | C188: 2 | D188: 6 | E188: =C188*6+D188 -> 18 | G188: 3 | H188: 6 | I188: =G188*6+H188 -> 24 | K188: 9 | L188: 6 | M188: =K188*6+L188 -> 60 | O188: 10 | P188: 9 | Q188: =O188*6+P188 -> 69 | S188: ROWE
A189: BEST PLAYERS
A190: COBURG | B190: ROCHOW | E190: J BRIMACOMBE | I190: GRAHAM | L190: FITZPATRICK | O190: GOTCH | Q190: SULLIVAN
A191: BRUNSWICK | B191: F ROBINSON | F191: WICKS | I191: DENTON | L191: BIBBY | O191: COOK | Q191: WILSON
A192: GOALKICKERS
A193: COBURG | B193: FITZPATRICK 5 | F193: ROCHOW 3 | I193: BYRON 2 | K193: LEYDIN 2 | M193: GIARDOSSI | P193: CARMODY
A194: BRUNSWICK | B194: COOK 3 | E194: RUSSELL 3 | H194: BOWTELL | J194: WILSON | L194: CHARD | N194: DARBY
A196: ROUND 5 | D196: 23RD MAY | I196: WEATHER | L196: DULL NO WIND | S196: PLAYED AT
D197: 1ST QTR | H197: 2ND QTR | L197: 3RD QTR | P197: FINAL | S197: BRUNSWICK
A198: WAVERLEY | C198: 2 | D198: 3 | E198: =C198*6+D198 -> 15 | G198: 4 | H198: 7 | I198: =G198*6+H198 -> 31 | K198: 6 | L198: 9 | M198: =K198*6+L198 -> 45 | O198: 8 | P198: 13 | Q198: =O198*6+P198 -> 61 | S198: UMPIRE | X198: LADDER | AB198: ROUND | AD198: 5
A199: BRUNSWICK | C199: 1 | D199: 3 | E199: =C199*6+D199 -> 9 | G199: 3 | H199: 7 | I199: =G199*6+H199 -> 25 | K199: 4 | L199: 11 | M199: =K199*6+L199 -> 35 | O199: 6 | P199: 14 | Q199: =O199*6+P199 -> 50 | S199: JACKSON
A200: BEST PLAYERS | W200: TEAM | X200: W | Y200: L | Z200: D | AA200: FOR | AB200: AGST | AC200: % | AD200: PTS
A201: WAVERLEY | C201: MARTIN | F201: INGWERSON | I201: GREENWOOD | L201: MANNICHE | O201: PETZKE | R201: NATION
A202: BRUNSWICK | C202: WATT | F202: BIBBY | I202: COOK | L202: AYRES | O202: DARBY | R202: THOMPSON | W202: DANDENONG | X202: 4 | Y202: 1 | Z202: 0 | AA202: 461 | AB202: 335 | AC202: 137.61194029850745 | AD202: 16
A203: GOALKICKERS | W203: COBURG | X203: 4 | Y203: 1 | Z203: 0 | AA203: 535 | AB203: 397 | AC203: 134.76 | AD203: 16
A204: WAVERLEY | C204: MANNICHE 4 | F204: INGWERSON | I204: NATION | L204: PETZKE | N204: DAVEY | W204: PORT MELBOURNE | X204: 4 | Y204: 1 | Z204: 0 | AA204: 538 | AB204: 462 | AC204: 116.45021645021644 | AD204: 16
A205: BRUNSWICK | C205: COOK 5 | F205: RUSSELL | W205: WILLIAMSTOWN | X205: 3 | Y205: 2 | Z205: 0 | AA205: 419 | AB205: 381 | AC205: 109.9737532808399 | AD205: 12
A207: DANDENONG | C207: 2 | D207: 4 | E207: =C207*6+D207 -> 16 | G207: 2 | H207: 6 | I207: =G207*6+H207 -> 18 | K207: 4 | L207: 8 | M207: =K207*6+L207 -> 32 | O207: 9 | P207: 14 | Q207: =O207*6+P207 -> 68 | S207: OAKLEIGH | W207: YARRAVILLE | X207: 3 | Y207: 2 | Z207: 0 | AA207: 486 | AB207: 443 | AC207: 109.70654627539503 | AD207: 12
A208: OAKLEIGH | C208: 0 | D208: 2 | E208: =C208*6+D208 -> 2 | G208: 2 | H208: 3 | I208: =G208*6+H208 -> 15 | K208: 5 | L208: 5 | M208: =K208*6+L208 -> 35 | O208: 7 | P208: 6 | Q208: =O208*6+P208 -> 48 | S208: O'NEILL | W208: SANDRINGHAM | X208: 3 | Y208: 2 | Z208: 0 | AA208: 476 | AB208: 534 | AC208: 89.138576779026224 | AD208: 12
A209: BEST PLAYERS | W209: PRESTON | X209: 2 | Y209: 3 | Z209: 0 | AA209: 396 | AB209: 492 | AC209: 80.487804878048777 | AD209: 8
A210: DANDENONG | C210: OSBORNE | F210: BARRAN | I210: PIVETTA | L210: ABRAHAM | O210: COLE | Q210: GREENWOOD | W210: WAVERLEY | X210: 2 | Y210: 3 | Z210: 0 | AA210: 401 | AB210: 514 | AC210: 78.01556420233463 | AD210: 8
A211: OAKLEIGH | C211: RICCI | F211: MULDOON | I211: SHERIDAN | L211: LYONS | O211: TIPPETT | Q211: McNEILL | W211: BRUNSWICK | X211: 0 | Y211: 5 | Z211: 0 | AA211: 341 | AB211: 408 | AC211: 83.58 | AD211: 0
A212: GOALKICKERS | W212: OAKLEIGH | X212: 0 | Y212: 5 | Z212: 0 | AA212: 416 | AB212: 503 | AC212: 82.7037773359841 | AD212: 0
A213: DANDENONG | C213: DUNCAN 2 | F213: KENT 2 | H213: SCHMIDT | J213: GREENWOOD | M213: BARRAN | O213: WHALEBONE | R213: VEREY
A214: OAKLEIGH | C214: SHERIDAN 2 | F214: RICCI 2 | H214: KITTO | J214: LYONS | M214: CRAWFORD
E215: 24TH MAY | M215: WEATHER
A216: YARRAVILLE | C216: 4 | D216: 1 | E216: =C216*6+D216 -> 25 | G216: 5 | H216: 2 | I216: =G216*6+H216 -> 32 | K216: 12 | L216: 11 | M216: =K216*6+L216 -> 83 | O216: 14 | P216: 12 | Q216: =O216*6+P216 -> 96 | S216: PORT MELBOURNE
A217: PORT MELBOURNE | C217: 2 | D217: 2 | E217: =C217*6+D217 -> 14 | G217: 11 | H217: 7 | I217: =G217*6+H217 -> 73 | K217: 12 | L217: 8 | M217: =K217*6+L217 -> 80 | O217: 13 | P217: 14 | Q217: =O217*6+P217 -> 92 | S217: HORNE
A218: BEST PLAYERS
A219: YARRAVILLE | C219: NARKIEWICZ | F219: CLEGG | I219: WILSON | L219: WRIGHT | O219: CONNELLY | R219: WARWICK
A220: PORT MELBOURNE | C220: RENOUF | F220: TAGGART | I220: JEFFREY | L220: BOWEN | O220: CARLILE | R220: FREYER
A221: GOALKICKERS
A222: YARRAVILLE | C222: KNOTT 4 | F222: CLEGG 3 | I222: MEDDINGS 2 | L222: PIOVESAN 2 | O222: EDWARDS | Q222: CONNELLY | T222: WARWICK
A223: PORT MELBOURNE | C223: JEFFREY 7 | F223: TAGGART 3 | I223: MILNER 2 | L223: MOONEY
A225: COBURG | C225: 1 | D225: 1 | E225: =C225*6+D225 -> 7 | G225: 5 | H225: 4 | I225: =G225*6+H225 -> 34 | K225: 7 | L225: 9 | M225: =K225*6+L225 -> 51 | O225: 16 | P225: 14 | Q225: =O225*6+P225 -> 110 | S225: PRESTON
A226: PRESTON | C226: 1 | D226: 7 | E226: =C226*6+D226 -> 13 | G226: 4 | H226: 8 | I226: =G226*6+H226 -> 32 | K226: 6 | L226: 13 | M226: =K226*6+L226 -> 49 | O226: 8 | P226: 14 | Q226: =O226*6+P226 -> 62 | S226: CRAIG
A227: BEST PLAYERS
A228: COBURG | C228: BYRON | F228: RIST | I228: ROCHOW | L228: GIARDOSSI | O228: HAWLEY | R228: LEYDIN
A229: PRESTON | C229: MILLS | F229: MURNANE | I229: TRELOAR | L229: RYAN | O229: ALEXANDER | R229: APPLEFORD
A230: GOALKICKERS
A231: COBURG | C231: ROCHOW 4 | F231: LEYDIN 3 | I231: BYRON 3 | K231: RIST 2 | M231: FITZPATRICK 2 | P231: CARMODY 2
A232: PRESTON | C232: ALEXANDER 2 | F232: BROPHY | I232: MILLS | K232: SECCULL | M232: TRELOAR | O232: APPLEFORD | R232: WHITE
A234: SANDRINGHAM | C234: 3 | D234: 2 | E234: =C234*6+D234 -> 20 | G234: 5 | H234: 6 | I234: =G234*6+H234 -> 36 | K234: 8 | L234: 8 | M234: =K234*6+L234 -> 56 | O234: 11 | P234: 10 | Q234: =O234*6+P234 -> 76 | S234: WILLIAMSTOWN
A235: WILLIAMSTOWN | C235: 2 | D235: 3 | E235: =C235*6+D235 -> 15 | G235: 4 | H235: 7 | I235: =G235*6+H235 -> 31 | K235: 5 | L235: 15 | M235: =K235*6+L235 -> 45 | O235: 9 | P235: 18 | Q235: =O235*6+P235 -> 72 | S235: FROOD
A236: BEST PLAYERS
A237: SANDRINGHAM | C237: HARRISON | F237: SHEEHAN | I237: MERRETT | L237: BURNS | O237: HIRST | R237: GRANGER
A238: WILLIAMSTOWN | C238: RUSSELL | F238: SAVIGE | I238: WILLIAMS | L238: JENKINSON | O238: GRAHAM | R238: WARD
A239: GOALKICKERS
A240: SANDRINGHAM | C240: BURNS 3 | F240: SHEEHAN 2 | I240: BURKE 2 | K240: O'TOOLE | M240: SMART | O240: KENNEDY | Q240: PEROVIC
A241: WILLIAMSTOWN | C241: TURNER 2 | F241: WILLIAMS 2 | I241: JAMES | K241: MALONEY | M241: GRAHAM | O241: MURPHY | Q241: FITCH
A243: ROUND 6 | D243: 30TH MAY | I243: WEATHER | L243: NO WIND DULL COLD | S243: PLAYED AT
D244: 1ST QTR | H244: 2ND QTR | L244: 3RD QTR | P244: FINAL | S244: WAVERLEY
A245: WAVERLEY | C245: 6 | D245: 5 | E245: =C245*6+D245 -> 41 | G245: 8 | H245: 7 | I245: =G245*6+H245 -> 55 | K245: 12 | L245: 15 | M245: =K245*6+L245 -> 87 | O245: 16 | P245: 15 | Q245: =O245*6+P245 -> 111 | S245: UMPIRE | X245: LADDER | AB245: ROUND | AD245: 6
A246: OAKLEIGH | C246: 0 | D246: 4 | E246: =C246*6+D246 -> 4 | G246: 5 | H246: 10 | I246: =G246*6+H246 -> 40 | K246: 9 | L246: 12 | M246: =K246*6+L246 -> 66 | O246: 12 | P246: 17 | Q246: =O246*6+P246 -> 89 | S246: FROOD
A247: BEST PLAYERS | W247: TEAM | X247: W | Y247: L | Z247: D | AA247: FOR | AB247: AGST | AC247: % | AD247: PTS
A248: WAVERLEY | C248: INGWERSON | F248: PLANT | H248: CULPIN | K248: SMITH | N248: MARTIN | Q248: MANNICHE
A249: OAKLEIGH | C249: KITTO | F249: RICCI | H249: MAUGHAN | K249: MULDOON | N249: LYONS | Q249: SHERIDAN | W249: PORT MELBOURNE | X249: 5 | Y249: 1 | Z249: 0 | AA249: 618 | AB249: 523 | AC249: 118.16443594646272 | AD249: 20
A250: GOALKICKERS | W250: DANDENONG | X250: 4 | Y250: 2 | Z250: 0 | AA250: 521 | AB250: 399 | AC250: 130.57644110275689 | AD250: 16
A251: WAVERLEY | C251: CULPIN 5 | F251: INGWERSON 4 | I251: MANNICHE 3 | L251: PLANT 2 | N251: PHILIPSON | Q251: DAVEY | W251: COBURG | X251: 4 | Y251: 2 | Z251: 0 | AA251: 617 | AB251: 499 | AC251: 123.65 | AD251: 16
A252: OAKLEIGH | C252: CUNNINGHAM 3 | F252: KITTO 2 | H252: LYONS 2 | J252: RICCI 2 | L252: McNEILL | N252: JONES | P252: SHERIDAN | W252: YARRAVILLE | X252: 4 | Y252: 2 | Z252: 0 | AA252: 615 | AB252: 519 | AC252: 118.49710982658959 | AD252: 16
A254: YARRAVILLE | C254: 6 | D254: 2 | E254: =C254*6+D254 -> 38 | G254: 11 | H254: 7 | I254: =G254*6+H254 -> 73 | K254: 17 | L254: 12 | M254: =K254*6+L254 -> 114 | O254: 19 | P254: 15 | Q254: =O254*6+P254 -> 129 | S254: YARRAVILLE | W254: WILLIAMSTOWN | X254: 4 | Y254: 2 | Z254: 0 | AA254: 521 | AB254: 463 | AC254: 112.52699784017278 | AD254: 16
A255: BRUNSWICK | C255: 2 | D255: 1 | E255: =C255*6+D255 -> 13 | G255: 6 | H255: 3 | I255: =G255*6+H255 -> 39 | K255: 6 | L255: 5 | M255: =K255*6+L255 -> 41 | O255: 11 | P255: 10 | Q255: =O255*6+P255 -> 76 | S255: TREWIN | W255: SANDRINGHAM | X255: 4 | Y255: 2 | Z255: 0 | AA255: 540 | AB255: 594 | AC255: 90.909090909090907 | AD255: 16
A256: BEST PLAYERS | W256: WAVERLEY | X256: 3 | Y256: 3 | Z256: 0 | AA256: 512 | AB256: 603 | AC256: 84.908789386401324 | AD256: 12
A257: YARRAVILLE | C257: MEDDINGS | F257: CONNELLY | I257: RON BROWN | L257: BURT | N257: KNOTT | Q257: WARWICK | W257: PRESTON | X257: 2 | Y257: 4 | Z257: 0 | AA257: 457 | AB257: 572 | AC257: 79.895104895104893 | AD257: 8
A258: BRUNSWICK | C258: COOK | F258: BIBBY | I258: HAGART | L258: DARBY | N258: WILSON | Q258: WHILEY | W258: OAKLEIGH | X258: 0 | Y258: 6 | Z258: 0 | AA258: 505 | AB258: 614 | AC258: 82.247557003257327 | AD258: 0
A259: GOALKICKERS | W259: BRUNSWICK | X259: 0 | Y259: 6 | Z259: 0 | AA259: 417 | AB259: 537 | AC259: 77.65 | AD259: 0
A260: YARRAVILLE | C260: MEDDINGS 6 | F260: KNOTT 4 | I260: RON BROWN 4 | L260: CONNELY 3 | O260: WARWICK | Q260: ALLEN
A261: BRUNSWICK | C261: COOK 6 | F261: WILSON 2 | I261: DENTON | K261: BIBBY | M261: DARBY
E262: 31ST MAY | M262: WEATHER
A263: WILLIAMSTOWN | C263: 2 | D263: 2 | E263: =C263*6+D263 -> 14 | G263: 8 | H263: 2 | I263: =G263*6+H263 -> 50 | K263: 14 | L263: 5 | M263: =K263*6+L263 -> 89 | O263: 16 | P263: 6 | Q263: =O263*6+P263 -> 102 | S263: COBURG
A264: COBURG | C264: 1 | D264: 2 | E264: =C264*6+D264 -> 8 | G264: 6 | H264: 3 | I264: =G264*6+H264 -> 39 | K264: 9 | L264: 5 | M264: =K264*6+L264 -> 59 | O264: 12 | P264: 10 | Q264: =O264*6+P264 -> 82 | S264: JACKSON
A265: BEST PLAYERS
A266: WILLIAMSTOWN | C266: McASEY | F266: TURNER | I266: SAVIGE | L266: RAILTON | O266: JENKINSON | R266: RUSSELL
A267: COBURG | C267: RIST | F267: CLEMENTS | I267: SULLIVAN | L267: ROCHOW | O267: McNABB | R267: LORD
A268: GOALKICKERS
A269: WILLIAMSTOWN | C269: TURNER 4 | E269: GRAHAM 2 | H269: McASEY 2 | J269: CLOUGH 2 | M269: JAMES 2 | O269: O'TOOLE | Q269: WILLIAMS | T269: MALONEY | W269: JENKINSON
A270: COBURG | C270: ROCHOW 3 | F270: CARMODY 3 | I270: J BRIMACOMBE | L270: FITZPATRICK | O270: MURRAY | Q270: BYRON | S270: RIST | U270: LORD
A272: PORT MELBOURNE | C272: 4 | D272: 1 | E272: =C272*6+D272 -> 25 | G272: 7 | H272: 4 | I272: =G272*6+H272 -> 46 | K272: 10 | L272: 8 | M272: =K272*6+L272 -> 68 | O272: 12 | P272: 8 | Q272: =O272*6+P272 -> 80 | S272: PRESTON
A273: PRESTON | C273: 3 | D273: 2 | E273: =C273*6+D273 -> 20 | G273: 5 | H273: 5 | I273: =G273*6+H273 -> 35 | K273: 6 | L273: 5 | M273: =K273*6+L273 -> 41 | O273: 9 | P273: 7 | Q273: =O273*6+P273 -> 61 | S273: SCOTT
A274: BEST PLAYERS
A275: PORT MELBOURNE | C275: CASTLEHOW | F275: FREYER | I275: MARTIN | L275: LEWIS | O275: CROSHER | R275: HYLAND
A276: PRESTON | C276: RYAN | F276: MUIR | I276: APPLEFORD | L276: ALEXANDER | O276: COHEN | R276: WALKER
A277: GOALKICKERS
A278: PORT MELBOURNE | C278: HYLAND 4 | F278: MARTIN 3 | I278: PERRY 2 | K278: BOWEN | M278: JEFFREY | O278: CAWSEY
A279: PRESTON | C279: WALKER 2 | F279: BROPHY 2 | I279: MILLS | K279: MUIR | M279: WHITE | O279: SECCULL | Q279: TRELOAR
A281: SANDRINGHAM | C281: 3 | D281: 2 | E281: =C281*6+D281 -> 20 | G281: 5 | H281: 5 | I281: =G281*6+H281 -> 35 | K281: 5 | L281: 11 | M281: =K281*6+L281 -> 41 | O281: 8 | P281: 16 | Q281: =O281*6+P281 -> 64 | S281: DANDENONG
A282: DANDENONG | C282: 2 | D282: 2 | E282: =C282*6+D282 -> 14 | G282: 4 | H282: 5 | I282: =G282*6+H282 -> 29 | K282: 9 | L282: 5 | M282: =K282*6+L282 -> 59 | O282: 9 | P282: 6 | Q282: =O282*6+P282 -> 60 | S282: McMASTER
A283: BEST PLAYERS
A284: SANDRINGHAM | C284: BURNS | F284: BURKE | I284: BENNETT | L284: HARRISON | O284: GRANGER | R284: KENNEDY
A285: DANDENONG | C285: SHINNERS | F285: PIVETTA | I285: ABRAHAM | L285: VEREY | O285: HILL | R285: WHALEBONE
A286: GOALKICKERS
A287: SANDRINGHAM | C287: O'TOOLE 2 | F287: DIXON 2 | I287: KENNEDY | K287: BURKE | M287: BURNS | O287: HARRISON
A288: DANDENONG | C288: WHALEBONE 4 | F288: DUNCAN 2 | I288: SCHMIDT | K288: OSBORNE | M288: GREENWOOD
A290: ROUND 7 | D290: 6TH JUNE | I290: WEATHER | L290: SOUTH EAST WIND DULL COLD | S290: PLAYED AT
D291: 1ST QTR | H291: 2ND QTR | L291: 3RD QTR | P291: FINAL | S291: BEACH ROAD
A292: YARRAVILLE | C292: 3 | D292: 7 | E292: =C292*6+D292 -> 25 | G292: 4 | H292: 11 | I292: =G292*6+H292 -> 35 | K292: 8 | L292: 19 | M292: =K292*6+L292 -> 67 | O292: 12 | P292: 21 | Q292: =O292*6+P292 -> 93 | S292: UMPIRE | X292: LADDER | AB292: ROUND | AD292: 7
A293: SANDRINGHAM | C293: 1 | D293: 6 | E293: =C293*6+D293 -> 12 | G293: 3 | H293: 9 | I293: =G293*6+H293 -> 27 | K293: 8 | L293: 12 | M293: =K293*6+L293 -> 60 | O293: 12 | P293: 16 | Q293: =O293*6+P293 -> 88 | S293: CRAIG
A294: BEST PLAYERS | W294: TEAM | X294: W | Y294: L | Z294: D | AA294: FOR | AB294: AGST | AC294: % | AD294: PTS
A295: YARRAVILLE | C295: VAUGHAN | F295: NARKIEWICZ | I295: ORANGE | L295: RON BROWN | O295: MALONEY | R295: ALLEN
A296: SANDRINGHAM | C296: SHEEHAN | F296: HIRST | I296: GRANGER | L296: HOLMES | O296: GLEESON | R296: HARRISON | W296: PORT MELBOURNE | X296: 6 | Y296: 1 | Z296: 0 | AA296: 748 | AB296: 595 | AC296: 125.71428571428571 | AD296: 24
A297: GOALKICKERS | W297: COBURG | X297: 5 | Y297: 2 | Z297: 0 | AA297: 697 | AB297: 549 | AC297: 126.96 | AD297: 20
A298: YARRAVILLE | C298: RON BROWN 3 | F298: BENETTI 2 | I298: CONNELLY 2 | L298: EDWARDS | N298: VAUGHAN | P298: KNOTT | R298: ALLEN | T298: WILSON | W298: YARRAVILLE | X298: 5 | Y298: 2 | Z298: 0 | AA298: 706 | AB298: 607 | AC298: 116.30971993410215 | AD298: 20
A299: SANDRINGHAM | C299: GLEESON 3 | F299: PEROVIC 2 | I299: KENNEDY 2 | L299: SMART 2 | N299: HOLMES 2 | Q299: HARRISON | W299: WILLIAMSTOWN | X299: 5 | Y299: 2 | Z299: 0 | AA299: 613 | AB299: 554 | AC299: 110.64981949458483 | AD299: 20
A301: OAKLEIGH | C301: 3 | D301: 7 | E301: =C301*6+D301 -> 25 | G301: 6 | H301: 8 | I301: =G301*6+H301 -> 44 | K301: 11 | L301: 18 | M301: =K301*6+L301 -> 84 | O301: 13 | P301: 20 | Q301: =O301*6+P301 -> 98 | S301: OAKLEIGH | W301: DANDENONG | X301: 4 | Y301: 3 | Z301: 0 | AA301: 571 | AB301: 479 | AC301: 119.20668058455115 | AD301: 16
A302: BRUNSWICK | C302: 0 | D302: 1 | E302: =C302*6+D302 -> 1 | G302: 6 | H302: 7 | I302: =G302*6+H302 -> 43 | K302: 9 | L302: 8 | M302: =K302*6+L302 -> 62 | O302: 10 | P302: 13 | Q302: =O302*6+P302 -> 73 | S302: SCOTT | W302: SANDRINGHAM | X302: 4 | Y302: 3 | Z302: 0 | AA302: 628 | AB302: 685 | AC302: 91.678832116788328 | AD302: 16
A303: BEST PLAYERS | W303: WAVERLEY | X303: 3 | Y303: 4 | Z303: 0 | AA303: 584 | AB303: 733 | AC303: 79.672578444747614 | AD303: 12
A304: OAKLEIGH | C304: KITTO | F304: JONES | I304: McNEILL | L304: McLAREN | O304: CRAWFORD | R304: CUNNINGHAM | W304: PRESTON | X304: 2 | Y304: 5 | Z304: 0 | AA304: 548 | AB304: 664 | AC304: 82.53012048192771 | AD304: 8
A305: BRUNSWICK | C305: BALDOCK | F305: RUSSELL | I305: BIBBY | L305: HAGART | O305: WILSON | R305: HARRIS | W305: OAKLEIGH | X305: 1 | Y305: 6 | Z305: 0 | AA305: 603 | AB305: 687 | AC305: 87.772925764192138 | AD305: 4
A306: GOALKICKERS | W306: BRUNSWICK | X306: 0 | Y306: 7 | Z306: 0 | AA306: 490 | AB306: 635 | AC306: 77.17 | AD306: 0
A307: OAKLEIGH | C307: McLAREN 4 | F307: LYON 2 | I307: KITTO 2 | K307: McNEILL 2 | N307: LOVELESS 2 | Q307: DEFTEROUS
A308: BRUNSWICK | C308: BIBBY 3 | F308: BALDOCK 2 | I308: LEYDIN | K308: HAGART | M308: HARRIS | O308: WILSON | Q308: DACEY
E309: 7TH JUNE | I309: WEATHER | M309: FINE
A310: COBURG | C310: 3 | D310: 1 | E310: =C310*6+D310 -> 19 | G310: 4 | H310: 5 | I310: =G310*6+H310 -> 29 | K310: 8 | L310: 5 | M310: =K310*6+L310 -> 53 | O310: 12 | P310: 8 | Q310: =O310*6+P310 -> 80 | S310: COBURG
A311: DANDENONG | C311: 2 | D311: 5 | E311: =C311*6+D311 -> 17 | G311: 2 | H311: 8 | I311: =G311*6+H311 -> 20 | K311: 4 | L311: 12 | M311: =K311*6+L311 -> 36 | O311: 6 | P311: 14 | Q311: =O311*6+P311 -> 50 | S311: HORNE
A312: BEST PLAYERS
A313: COBURG | C313: RIST | F313: ROCHOW | I313: GRAHAM | L313: McNABB | O313: J BRIMACOMBE | S313: FITZPATRICK
A314: DANDENONG | C314: ABRAHAM | F314: SCHMIDT | I314: ALLEMAND | L314: PIVETTA | O314: GREENWOOD | S314: KENT
A315: GOALKICKERS
A316: COBURG | C316: FITZPATRICK 4 | F316: ROCHOW 2 | I316: RIST 2 | K316: J BRIMACOMBE 2 | O316: LEYDIN | Q316: VARDON
A317: DANDENONG | C317: ALLEMAND (3) | F317: KENT | H317: FRAME | J317: VEREY
A319: WILLIAMSTOWN | C319: 1 | D319: 5 | E319: =C319*6+D319 -> 11 | G319: 3 | H319: 8 | I319: =G319*6+H319 -> 26 | K319: 9 | L319: 10 | M319: =K319*6+L319 -> 64 | O319: 13 | P319: 14 | Q319: =O319*6+P319 -> 92 | S319: WILLIAMSTOWN
A320: PRESTON | C320: 7 | D320: 5 | E320: =C320*6+D320 -> 47 | G320: 9 | H320: 10 | I320: =G320*6+H320 -> 64 | K320: 11 | L320: 17 | M320: =K320*6+L320 -> 83 | O320: 12 | P320: 19 | Q320: =O320*6+P320 -> 91 | S320: O'NEILL
A321: BEST PLAYERS
A322: WILLIAMSTOWN | C322: TURNER | F322: McASEY | I322: JENKINSON | L322: CLOUGH | O322: MALONEY | R322: RAILTON
A323: PRESTON | C323: WATSON | F323: ALEXANDER | I323: BROPHY | L323: BOYLE | O323: PARRIS | R323: COHEN
A324: GOALKICKERS
A325: WILLIAMSTOWN | C325: CLOUGH 4 | F325: TURNER 3 | I325: JAMES 2 | L325: RAILTON 2 | O325: WILLIAMS | R325: JENKINSON
A326: PRESTON | C326: WALKER 5 | F326: PARRIS 3 | I326: BROPHY 2 | L326: MURNANE | O326: CLARKE
A328: PORT MELBOURNE | C328: 3 | D328: 2 | E328: =C328*6+D328 -> 20 | G328: 9 | H328: 7 | I328: =G328*6+H328 -> 61 | K328: 12 | L328: 13 | M328: =K328*6+L328 -> 85 | O328: 19 | P328: 16 | Q328: =O328*6+P328 -> 130 | S328: PORT MELBOURNE
A329: WAVERLEY | C329: 1 | D329: 6 | E329: =C329*6+D329 -> 12 | G329: 5 | H329: 8 | I329: =G329*6+H329 -> 38 | K329: 8 | L329: 10 | M329: =K329*6+L329 -> 58 | O329: 10 | P329: 12 | Q329: =O329*6+P329 -> 72 | S329: ROWE
A330: BEST PLAYERS
A331: PORT MELBOURNE | C331: RENOUF | F331: MERRETT | I331: JEFFREY | L331: TAGGART | O331: BRAGG | R331: KERR
A332: WAVERLEY | C332: LEE | F332: ANGUS | I332: THOROGOOD | L332: PHILLIPSON | O332: INNES | R332: MANNICHE
A333: GOALKICKERS
A334: PORT MELBOURNE | C334: JEFFREY 7 | F334: HYLAND 5 | I334: CAWSEY 3 | L334: MERRETT 2 | O334: LANDORFF | R334: PERRY
A335: WAVERLEY | C335: CULPIN 3 | F335: HUDSON 2 | I335: MANNICHE 2 | L335: PETZKE | N335: PLANT | P335: PHILLIPSON
A337: ROUND 8 | C337: 13TH JUNE | I337: WEATHER | L337: EAST BREEZE FINE | S337: PLAYED AT
D338: 1ST QTR | H338: 2ND QTR | L338: 3RD QTR | P338: FINAL | S338: OAKLEIGH
A339: WILLIAMSTOWN | C339: 6 | D339: 0 | E339: =C339*6+D339 -> 36 | G339: 11 | H339: 2 | I339: =G339*6+H339 -> 68 | K339: 12 | L339: 5 | M339: =K339*6+L339 -> 77 | O339: 14 | P339: 6 | Q339: =O339*6+P339 -> 90 | S339: UMPIRE | X339: LADDER | AB339: ROUND | AD339: 8
A340: OAKLEIGH | C340: 3 | D340: 5 | E340: =C340*6+D340 -> 23 | G340: 4 | H340: 9 | I340: =G340*6+H340 -> 33 | K340: 5 | L340: 14 | M340: =K340*6+L340 -> 44 | O340: 8 | P340: 17 | Q340: =O340*6+P340 -> 65 | S340: HORNE
A341: BEST PLAYERS | W341: TEAM | X341: W | Y341: L | Z341: D | AA341: FOR | AB341: AGST | AC341: % | AD341: PTS
A342: WILLIAMSTOWN | C342: TAUBE | E342: JENKINSON | H342: JAMES | K342: CLOUGH | N342: O'TOOLE | Q342: LEONARD
A343: OAKLEIGH | C343: JONES | E343: TURNER | H343: MULDOON | K343: McLAREN | N343: McNEILL | Q343: MAUGHAN | W343: PORT MELBOURNE | X343: 7 | Y343: 1 | Z343: 0 | AA343: 818 | AB343: 657 | AC343: 124.50532724505327 | AD343: 28
A344: GOALKICKERS | W344: COBURG | X344: 6 | Y344: 2 | Z344: 0 | AA344: 825 | AB344: 629 | AC344: 131.16 | AD344: 24
A345: WILLIAMSTOWN | C345: JAMES 5 | E345: RAILTON 2 | H345: CLOUGH 2 | J345: JENKINSON | M345: WILLIAMS | O345: TAUBE | Q345: McASEY | S345: SAVIGE | W345: YARRAVILLE | X345: 6 | Y345: 2 | Z345: 0 | AA345: 827 | AB345: 720 | AC345: 114.86111111111111 | AD345: 24
A346: OAKLEIGH | C346: McLAREN 4 | F346: McLEAN 2 | I346: TURNER | K346: CUNNINGHAM | W346: WILLIAMSTOWN | X346: 6 | Y346: 2 | Z346: 0 | AA346: 703 | AB346: 619 | AC346: 113.5702746365105 | AD346: 24
C347: 14TH | E347: JUNE | I347: WEATHER
A348: PORT MELBOURNE | C348: 2 | D348: 4 | E348: =C348*6+D348 -> 16 | G348: 4 | H348: 11 | I348: =G348*6+H348 -> 35 | K348: 6 | L348: 12 | M348: =K348*6+L348 -> 48 | O348: 9 | P348: 16 | Q348: =O348*6+P348 -> 70 | S348: PORT MELBOURNE | W348: SANDRINGHAM | X348: 5 | Y348: 3 | Z348: 0 | AA348: 711 | AB348: 753 | AC348: 94.422310756972109 | AD348: 20
A349: DANDENONG | C349: 1 | D349: 4 | E349: =C349*6+D349 -> 10 | G349: 5 | H349: 6 | I349: =G349*6+H349 -> 36 | K349: 6 | L349: 7 | M349: =K349*6+L349 -> 43 | O349: 9 | P349: 8 | Q349: =O349*6+P349 -> 62 | S349: FLANAGAN | W349: DANDENONG | X349: 4 | Y349: 4 | Z349: 0 | AA349: 633 | AB349: 549 | AC349: 115.30054644808743 | AD349: 16
A350: BEST PLAYERS | W350: WAVERLEY | X350: 3 | Y350: 5 | Z350: 0 | AA350: 664 | AB350: 861 | AC350: 77.119628339140533 | AD350: 12
A351: PORT MELBOURNE | C351: BRAGG | F351: MERRETT | I351: RENOUF | L351: MILNER | N351: TAGGART | Q351: LANDORFF | W351: PRESTON | X351: 2 | Y351: 6 | Z351: 0 | AA351: 661 | AB351: 785 | AC351: 84.203821656050962 | AD351: 8
A352: DANDENONG | C352: PENNEFATHER | F352: KENT | I352: DUNCAN | L352: HILL | N352: HOBBS | Q352: OSBORNE | W352: OAKLEIGH | X352: 1 | Y352: 7 | Z352: 0 | AA352: 668 | AB352: 777 | AC352: 85.971685971685972 | AD352: 4
A353: GOALKICKERS | W353: BRUNSWICK | X353: 0 | Y353: 8 | Z353: 0 | AA353: 558 | AB353: 718 | AC353: 77.72 | AD353: 0
A354: PORT MELBOURNE | C354: MERRETT 3 | F354: HYLAND 2 | I354: CAWSEY 2 | L354: MILNER 2
A355: DANDENONG | C355: KENT 5 | F355: PENNEFATHER 2 | J355: SCHMIDT | M355: NORTHWOOD
A357: YARRAVILLE | C357: 1 | D357: 2 | E357: =C357*6+D357 -> 8 | G357: 11 | H357: 9 | I357: =G357*6+H357 -> 75 | K357: 13 | L357: 9 | M357: =K357*6+L357 -> 87 | O357: 17 | P357: 19 | Q357: =O357*6+P357 -> 121 | S357: YARRAVILLE
A358: PRESTON | C358: 8 | D358: 5 | E358: =C358*6+D358 -> 53 | G358: 8 | H358: 7 | I358: =G358*6+H358 -> 55 | K358: 16 | L358: 17 | M358: =K358*6+L358 -> 113 | O358: 16 | P358: 17 | Q358: =O358*6+P358 -> 113 | S358: McMASTER
A359: BEST PLAYERS
A360: YARRAVILLE | C360: RON BROWN | F360: VAUGHAN | I360: EDWARDS | L360: CLEGG | O360: MEDDINGS | R360: CONNELLY
A361: PRESTON | C361: COHEN | F361: ALEXANDER | I361: BROPHY | L361: WALKER | O361: CLARKE | R361: BOYLE
A362: GOALKICKERS
A363: YARRAVILLE | C363: MEDDINGS 4 | F363: BENNETTI 4 | I363: CLEGG 2 | K363: EDWARDS 2 | N363: VAUGHAN | Q363: CONNELLY | S363: RON BROWN | V363: WARWICK | X363: QUARANTOOTO
A364: PRESTON | C364: CLARKE 4 | F364: MILLS 4 | I364: WALKER 3 | L364: TRELOAR | N364: BROPHY | P364: COHEN | R364: BOYLE | T364: ALEXANDER
A366: SANDRINGHAM | C366: 3 | D366: 6 | E366: =C366*6+D366 -> 24 | G366: 7 | H366: 10 | I366: =G366*6+H366 -> 52 | K366: 8 | L366: 17 | M366: =K366*6+L366 -> 65 | O366: 11 | P366: 17 | Q366: =O366*6+P366 -> 83 | S366: BRUNSWICK
A367: BRUNSWICK | C367: 4 | D367: 0 | E367: =C367*6+D367 -> 24 | G367: 4 | H367: 2 | I367: =G367*6+H367 -> 26 | K367: 8 | L367: 4 | M367: =K367*6+L367 -> 52 | O367: 10 | P367: 8 | Q367: =O367*6+P367 -> 68 | S367: O'NEILL
A368: BEST PLAYERS
A369: SANDRINGHAM | C369: HANCE | F369: HOAR | I369: SHEEHAN | L369: KENNEDY | O369: McKENZIE | R369: SHEERAN
A370: BRUNSWICK | C370: LEYDIN | F370: WICKS | I370: DACEY | L370: DARBY | O370: ROBINSON | R370: WILSON
A371: GOALKICKERS
A372: SANDRINGHAM | C372: KENNEDY 3 | F372: BURNS 2 | I372: McKENZIE 2 | L372: SHEERAN | N372: HANCE | P372: SMART | R372: DAWSON
A373: BRUNSWICK | C373: COOK 4 | F373: LEYDIN 2 | I373: DENTON | K373: WILSON | M373: WHILEY | O373: BOWTELL
E374: 15TH JUNE | I374: WEATHER | L374: STRONG N.W.WIND COLD
A375: COBURG | C375: 6 | D375: 10 | E375: =C375*6+D375 -> 46 | G375: 10 | H375: 10 | I375: =G375*6+H375 -> 70 | K375: 17 | L375: 17 | M375: =K375*6+L375 -> 119 | O375: 18 | P375: 20 | Q375: =O375*6+P375 -> 128 | S375: WAVERLEY
A376: WAVERLEY | C376: 1 | D376: 2 | E376: =C376*6+D376 -> 8 | G376: 4 | H376: 10 | I376: =G376*6+H376 -> 34 | K376: 8 | L376: 10 | M376: =K376*6+L376 -> 58 | O376: 11 | P376: 14 | Q376: =O376*6+P376 -> 80 | S376: TREWIN
A377: BEST PLAYERS
A378: COBURG | B378: SULLIVAN | E378: FITZPATRICK | H378: RIST | K378: J BRIMACOMBE | O378: TANCREDI | R378: LEYDIN
A379: WAVERLEY | B379: ANGUS | E379: LEE | H379: THOROGOOD | K379: PHILLIPSON | O379: SMITH | R379: INNES
A380: GOALKICKERS
A381: COBURG | B381: FITZPATRICK 6 | F381: J BRIMACOMBE 5 | J381: LEYDIN 2 | M381: McNABB | O381: COLBERT | Q381: ROCHOW | S381: CARMODY | V381: RIST
A382: WAVERLEY | B382: PHILLIPSON 5 | F382: CULPIN 4 | I382: HUDSON | L382: SCOTT
A384: ROUND 9 | C384: 20TH JUNE | I384: WEATHER | L384: STRONG WEST WIND SHOWERS | S384: PLAYED AT
D385: 1ST QTR | H385: 2ND QTR | L385: 3RD QTR | P385: FINAL | S385: WILLIAMSTOWN
A386: WILLIAMSTOWN | C386: 5 | D386: 4 | E386: =C386*6+D386 -> 34 | G386: 5 | H386: 8 | I386: =G386*6+H386 -> 38 | K386: 7 | L386: 13 | M386: =K386*6+L386 -> 55 | O386: 7 | P386: 19 | Q386: =O386*6+P386 -> 61 | S386: UMPIRE | X386: LADDER | AB386: ROUND | AD386: 9
A387: PORT MELBOURNE | C387: 1 | D387: 1 | E387: =C387*6+D387 -> 7 | G387: 5 | H387: 4 | I387: =G387*6+H387 -> 34 | K387: 5 | L387: 5 | M387: =K387*6+L387 -> 35 | O387: 8 | P387: 8 | Q387: =O387*6+P387 -> 56 | S387: TREWIN
A388: BEST PLAYERS | W388: TEAM | X388: W | Y388: L | Z388: D | AA388: FOR | AB388: AGST | AC388: % | AD388: PTS
A389: WILLIAMSTOWN | C389: TAUBE | F389: MURRAY | I389: TURNER | L389: RAILTON | N389: RUSSELL | Q389: LEONARD
A390: PORT MELBOURNE | C390: CROSHER | F390: LEWIS | I390: HYLAND | L390: TAGGART | N390: KERR | Q390: MERRETT | W390: COBURG | X390: 7 | Y390: 2 | Z390: 0 | AA390: 905 | AB390: 696 | AC390: 130.03 | AD390: 28
A391: GOALKICKERS | W391: PORT MELBOURNE | X391: 7 | Y391: 2 | Z391: 0 | AA391: 874 | AB391: 718 | AC391: 121.72701949860725 | AD391: 28
A392: WILLIAMSTOWN | C392: JENKINSON 2 | F392: TURNER 2 | I392: JAMES | K392: McASEY | M392: CLOUGH | W392: WILLIAMSTOWN | X392: 7 | Y392: 2 | Z392: 0 | AA392: 764 | AB392: 675 | AC392: 113.18518518518519 | AD392: 28
A393: PORT MELBOURNE | C393: TAGGART 2 | F393: HYLAND 2 | I393: MERRETT 2 | L393: MILNER | N393: BRAGG | W393: YARRAVILLE | X393: 6 | Y393: 3 | Z393: 0 | AA393: 894 | AB393: 800 | AC393: 111.75 | AD393: 24
C394: 21ST JUNE | G394: WEATHER
A395: COBURG | C395: 4 | D395: 4 | E395: =C395*6+D395 -> 28 | G395: 6 | H395: 6 | I395: =G395*6+H395 -> 42 | K395: 8 | L395: 10 | M395: =K395*6+L395 -> 58 | O395: 11 | P395: 14 | Q395: =O395*6+P395 -> 80 | S395: COBURG | W395: SANDRINGHAM | X395: 6 | Y395: 3 | Z395: 0 | AA395: 811 | AB395: 831 | AC395: 97.593261131167267 | AD395: 24
A396: YARRAVILLE | C396: 0 | D396: 1 | E396: =C396*6+D396 -> 1 | G396: 4 | H396: 6 | I396: =G396*6+H396 -> 30 | K396: 7 | L396: 10 | M396: =K396*6+L396 -> 52 | O396: 9 | P396: 13 | Q396: =O396*6+P396 -> 67 | S396: SCOTT | W396: DANDENONG | X396: 4 | Y396: 4 | Z396: 1 | AA396: 715 | AB396: 631 | AC396: 113.3122028526149 | AD396: 18
A397: BEST PLAYERS | W397: WAVERLEY | X397: 3 | Y397: 5 | Z397: 1 | AA397: 748 | AB397: 945 | AC397: 79.153439153439152 | AD397: 14
A398: COBURG | C398: ACKLAND | F398: SULLIVAN | I398: LEYDIN | L398: GRAHAM | O398: GOTCH | R398: TANCREDI | W398: PRESTON | X398: 2 | Y398: 6 | Z398: 1 | AA398: 745 | AB398: 869 | AC398: 85.730724971231297 | AD398: 10
A399: YARRAVILLE | C399: EDWARDS | F399: MALONEY | I399: RON BROWN | L399: WARWICK | O399: BENETTI | R399: ORANGE | W399: OAKLEIGH | X399: 1 | Y399: 8 | Z399: 0 | AA399: 746 | AB399: 877 | AC399: 85.062713797035343 | AD399: 4
A400: GOALKICKERS | W400: BRUNSWICK | X400: 0 | Y400: 8 | Z400: 1 | AA400: 640 | AB400: 800 | AC400: 80 | AD400: 2
A401: COBURG | C401: LEYDIN 6 | F401: MURRAY | I401: BYRON | K401: RIST | M401: VARDON | O401: FITZPATRICK
A402: YARRAVILLE | C402: EDWARDS 4 | F402: BENETTI 4 | I402: CLEGG
A404: PRESTON | C404: 2 | D404: 4 | E404: =C404*6+D404 -> 16 | G404: 8 | H404: 7 | I404: =G404*6+H404 -> 55 | K404: 11 | L404: 9 | M404: =K404*6+L404 -> 75 | O404: 12 | P404: 12 | Q404: =O404*6+P404 -> 84 | S404: PRESTON
A405: WAVERLEY | C405: 5 | D405: 3 | E405: =C405*6+D405 -> 33 | G405: 5 | H405: 4 | I405: =G405*6+H405 -> 34 | K405: 8 | L405: 12 | M405: =K405*6+L405 -> 60 | O405: 11 | P405: 18 | Q405: =O405*6+P405 -> 84 | S405: FLANAGAN
A406: BEST PLAYERS
A407: PRESTON | C407: ALEXANDER | F407: SHERRY | I407: WALKER | L407: CLARKE | O407: TRELOAR | R407: WASLEY
A408: WAVERLEY | C408: INNES | F408: FLINN | I408: MARTIN | L408: LEE | O408: SMITH | R408: MARTIN
A409: GOALKICKERS
A410: PRESTON | C410: WALKER 5 | F410: CLARKE 4 | I410: ALEXANDER | L410: TRELOAR | O410: WASLEY
A411: WAVERLEY | C411: INGWERSON 2 | F411: PETZKE 2 | I411: PHILLIPSON 2 | L411: PIPER 2 | O411: HUDSON | Q411: CULPIN | S411: MARTIN
A413: SANDRINGHAM | C413: 6 | D413: 4 | E413: =C413*6+D413 -> 40 | G413: 8 | H413: 7 | I413: =G413*6+H413 -> 55 | K413: 11 | L413: 12 | M413: =K413*6+L413 -> 78 | O413: 14 | P413: 16 | Q413: =O413*6+P413 -> 100 | S413: BEACH ROAD
A414: OAKLEIGH | C414: 0 | D414: 2 | E414: =C414*6+D414 -> 2 | G414: 6 | H414: 4 | I414: =G414*6+H414 -> 40 | K414: 7 | L414: 7 | M414: =K414*6+L414 -> 49 | O414: 11 | P414: 12 | Q414: =O414*6+P414 -> 78 | S414: ROWE
A415: BEST PLAYERS
A416: SANDRINGHAM | C416: GRANGER | F416: BURNS | I416: HANCE | L416: CLIFFORD | O416: GLEESON | R416: JONES
A417: OAKLEIGH | C417: MULDOON | F417: KITTO | I417: MAUGHAN | L417: LOVELESS | O417: JORDAN | R417: JONES
A418: GOALKICKERS
A419: SANDRINGHAM | C419: BURNS 6 | F419: GLEESON 3 | I419: KENNEDY 2 | L419: DAWSON 2 | O419: O'TOOLE
A420: OAKLEIGH | C420: KITTO 4 | F420: JORDAN 3 | I420: McLAREN 2 | L420: LOVELESS 2
A422: DANDENONG | C422: 4 | D422: 3 | E422: =C422*6+D422 -> 27 | G422: 6 | H422: 8 | I422: =G422*6+H422 -> 44 | K422: 7 | L422: 12 | M422: =K422*6+L422 -> 54 | O422: 11 | P422: 16 | Q422: =O422*6+P422 -> 82 | S422: DANDENONG
A423: BRUNSWICK | C423: 4 | D423: 4 | E423: =C423*6+D423 -> 28 | G423: 5 | H423: 7 | I423: =G423*6+H423 -> 37 | K423: 9 | L423: 9 | M423: =K423*6+L423 -> 63 | O423: 12 | P423: 10 | Q423: =O423*6+P423 -> 82 | S423: FROOD
A424: BEST PLAYERS
A425: DANDENONG | C425: GRAVENER | F425: BARRAN | I425: KENT | K425: O'KEEFE | N425: WRIGHT | Q425: PIVETTA
A426: BRUNSWICK | C426: BIBBY | F426: DENTON | I426: BOWTELL | K426: WICKS | N426: ROBINSON | Q426: WILSON
A427: GOALKICKERS
A428: DANDENONG | C428: KENT 5 | F428: SCHMIDT 2 | I428: PENNEFATHER | L428: BARRAN | N428: WHALEBONE | Q428: VEREY
A429: BRUNSWICK | C429: COOK 5 | F429: BOWTELL 2 | I429: WHILEY 2 | L429: LEYDIN 2 | O429: WILSON
A431: ROUND 10 | C431: 27TH JUNE | I431: WEATHER | L431: WEST WIND DULL COLD | S431: PLAYED AT
D432: 1ST QTR | H432: 2ND QTR | L432: 3RD QTR | P432: FINAL | S432: WAVERLEY
A433: DANDENONG | C433: 1 | D433: 2 | E433: =C433*6+D433 -> 8 | G433: 9 | H433: 4 | I433: =G433*6+H433 -> 58 | K433: 10 | L433: 8 | M433: =K433*6+L433 -> 68 | O433: 18 | P433: 12 | Q433: =O433*6+P433 -> 120 | S433: UMPIRE | X433: LADDER | AB433: ROUND | AD433: 10
A434: WAVERLEY | C434: 3 | D434: 3 | E434: =C434*6+D434 -> 21 | G434: 3 | H434: 4 | I434: =G434*6+H434 -> 22 | K434: 8 | L434: 6 | M434: =K434*6+L434 -> 54 | O434: 9 | P434: 7 | Q434: =O434*6+P434 -> 61 | S434: SCOTT
A435: BEST PLAYERS | W435: TEAM | X435: W | Y435: L | Z435: D | AA435: FOR | AB435: AGST | AC435: % | AD435: PTS
A436: DANDENONG | C436: PENNEFATHER | F436: WHALEBONE | I436: ABRAHAM | L436: GRAVENER | O436: FRAME | Q436: OSBORNE
A437: WAVERLEY | C437: LEE | F437: THOROGOOD | I437: SCOTT | L437: ANGUS | O437: SMITH | Q437: GREENWOOD | W437: COBURG | X437: 8 | Y437: 2 | Z437: 0 | AA437: 982 | AB437: 762 | AC437: 128.87 | AD437: 32
A438: GOALKICKERS | W438: PORT MELBOURNE | X438: 8 | Y438: 2 | Z438: 0 | AA438: 972 | AB438: 806 | AC438: 120.59553349875931 | AD438: 32
A439: DANDENONG | C439: WHALEBONE 5 | F439: KENT 4 | H439: PENNEFATHER 2 | L439: SCHMIDT 2 | N439: FRAME 2 | P439: HILL | Q439: OSBORNE | S439: GREENWOOD | W439: WILLIAMSTOWN | X439: 8 | Y439: 2 | Z439: 0 | AA439: 892 | AB439: 749 | AC439: 119.09212283044059 | AD439: 32
A440: WAVERLEY | C440: SCOTT 2 | F440: MITHEN 2 | I440: PIPER 2 | K440: HUDSON | M440: MANNICHE | P440: PHILLIPSON | W440: YARRAVILLE | X440: 6 | Y440: 4 | Z440: 0 | AA440: 968 | AB440: 928 | AC440: 104.31034482758621 | AD440: 24
F441: 28TH JUNE
A442: BRUNSWICK | C442: 0 | D442: 9 | E442: =C442*6+D442 -> 9 | G442: 3 | H442: 13 | I442: =G442*6+H442 -> 31 | K442: 7 | L442: 17 | M442: =K442*6+L442 -> 59 | O442: 8 | P442: 21 | Q442: =O442*6+P442 -> 69 | S442: BRUNSWICK | W442: SANDRINGHAM | X442: 6 | Y442: 4 | Z442: 0 | AA442: 899 | AB442: 929 | AC442: 96.770721205597411 | AD442: 24
A443: PRESTON | C443: 1 | D443: 1 | E443: =C443*6+D443 -> 7 | G443: 5 | H443: 3 | I443: =G443*6+H443 -> 33 | K443: 5 | L443: 5 | M443: =K443*6+L443 -> 35 | O443: 9 | P443: 6 | Q443: =O443*6+P443 -> 60 | S443: HORNE | W443: DANDENONG | X443: 5 | Y443: 4 | Z443: 1 | AA443: 835 | AB443: 692 | AC443: 120.66473988439306 | AD443: 22
A444: BEST PLAYERS | W444: WAVERLEY | X444: 3 | Y444: 6 | Z444: 1 | AA444: 809 | AB444: 1065 | AC444: 75.962441314553985 | AD444: 14
A445: BRUNSWICK | C445: WICKS | F445: AYRES | I445: BIBBY | K445: BOWTELL | N445: LEYDIN | Q445: ROBINSON | W445: PRESTON | X445: 2 | Y445: 7 | Z445: 1 | AA445: 805 | AB445: 938 | AC445: 85.820895522388057 | AD445: 10
A446: PRESTON | C446: MURNANE | F446: TRELOAR | I446: RYAN | K446: COHEN | N446: WASLEY | Q446: PARRIS | W446: BRUNSWICK | X446: 1 | Y446: 8 | Z446: 1 | AA446: 709 | AB446: 860 | AC446: 82.44 | AD446: 6
A447: GOALKICKERS | W447: OAKLEIGH | X447: 1 | Y447: 9 | Z447: 0 | AA447: 812 | AB447: 954 | AC447: 85.115303983228515 | AD447: 4
A448: BRUNSWICK | C448: COOK 3 | F448: BOWTELL 2 | I448: KICK | K448: WHILEY | M448: LEYDIN
A449: PRESTON | C449: WALKER 3 | F449: WATSON | H449: PARRIS | J449: CLARKE | L449: WHITE | N449: ALEXANDER | Q449: WASLEY
D450: 4TH JULY
A451: PORT MELBOURNE | C451: 4 | D451: 4 | E451: =C451*6+D451 -> 28 | G451: 6 | H451: 7 | I451: =G451*6+H451 -> 43 | K451: 11 | L451: 12 | M451: =K451*6+L451 -> 78 | O451: 14 | P451: 14 | Q451: =O451*6+P451 -> 98 | S451: PORT MELBOURNE
A452: SANDRINGHAM | C452: 4 | D452: 3 | E452: =C452*6+D452 -> 27 | G452: 9 | H452: 9 | I452: =G452*6+H452 -> 63 | K452: 9 | L452: 13 | M452: =K452*6+L452 -> 67 | O452: 12 | P452: 16 | Q452: =O452*6+P452 -> 88 | S452: HORNE
A453: BEST PLAYERS
A454: PORT MELBOURNE | C454: CARLILE | F454: MITHEN | I454: TAGGART | L454: KENNEDY | O454: MILNER | R454: CROSHER
A455: SANDRINGHAM | C455: HANCE | F455: HIRST | I455: BURNS | L455: KENNEDY | O455: HOAR | R455: SHEEHAN
A456: GOALKICKERS
A457: PORT MELBOURNE | C457: CARLILE 7 | F457: MILNER 3 | I457: TAGGART 2 | L457: CAWSEY | O457: BOWEN
A458: SANDRINGHAM | C458: BURNS 3 | F458: KENNEDY 2 | I458: SHEEHAN 2 | L458: DAWSON 2 | O458: HANCE | Q458: SMART | S458: HIRST
A460: COBURG | C460: 2 | D460: 1 | E460: =C460*6+D460 -> 13 | G460: 4 | H460: 7 | I460: =G460*6+H460 -> 31 | K460: 8 | L460: 9 | M460: =K460*6+L460 -> 57 | O460: 11 | P460: 11 | Q460: =O460*6+P460 -> 77 | S460: OAKLEIGH
A461: OAKLEIGH | C461: 3 | D461: 3 | E461: =C461*6+D461 -> 21 | G461: 5 | H461: 5 | I461: =G461*6+H461 -> 35 | K461: 8 | L461: 9 | M461: =K461*6+L461 -> 57 | O461: 9 | P461: 12 | Q461: =O461*6+P461 -> 66 | S461: O'NEILL
A462: BEST PLAYERS
A463: COBURG | C463: LEYDIN | F463: WELSH | I463: CLEMENTS | L463: GRAHAM | O463: TANCREDI | R463: CHALLENGER
A464: OAKLEIGH | C464: JONES | F464: LOTHIAN | I464: CRAWFORD | L464: MULDOON | O464: MAUGHAN | R464: McLAREN
A465: GOALKICKERS
A466: COBURG | C466: LEYDIN 4 | F466: WELSH 2 | I466: GOTCH | K466: FITZPATRICK | N466: CHALLENGER | Q466: BYRON | S466: BARCLAY
A467: OAKLEIGH | C467: LOTHIAN 2 | F467: DANN 2 | I467: JONES | K467: McLAREN | N467: RICCI | P467: JORDAN | R467: DOWDELL
E468: 5TH JULY
A469: WILLIAMSTOWN | C469: 11 | D469: 4 | E469: =C469*6+D469 -> 70 | G469: 11 | H469: 6 | I469: =G469*6+H469 -> 72 | K469: 16 | L469: 9 | M469: =K469*6+L469 -> 105 | O469: 19 | P469: 14 | Q469: =O469*6+P469 -> 128 | S469: YARRAVILLE
A470: YARRAVILLE | C470: 2 | D470: 1 | E470: =C470*6+D470 -> 13 | G470: 6 | H470: 5 | I470: =G470*6+H470 -> 41 | K470: 8 | L470: 9 | M470: =K470*6+L470 -> 57 | O470: 10 | P470: 14 | Q470: =O470*6+P470 -> 74 | S470: ROWE
A471: BEST PLAYERS
A472: WILLIAMSTOWN | C472: TURNER | F472: MALONEY | I472: CLOUGH | L472: JENKINSON | O472: SAVIGE | R472: MURRIE
A473: YARRAVILLE | C473: MEDDINGS | F473: ORANGE | I473: VAUGHAN | L473: MALONEY | O473: EDWARDS | R473: RON BROWN
A474: GOALKICKERS
A475: WILLIAMSTOWN | C475: JENKINSON 6 | F475: TURNER 5 | I475: JAMES 4 | K475: WILLIAMS 2 | N475: MALONEY | Q475: CLOUGH
A476: YARRAVILLE | C476: MEDDINGS 6 | F476: CLEGG | H476: CONNELLY | K476: WARWICK | N476: FELL
A478: ROUND 11 | E478: 11TH JULY | J478: WEATHER | N478: STRONG NORTH WEST WIND | S478: PLAYED AT
D479: 1ST QTR | H479: 2ND QTR | L479: 3RD QTR | P479: FINAL | S479: DANDENONG
A480: YARRAVILLE | C480: 0 | D480: 1 | E480: =C480*6+D480 -> 1 | G480: 4 | H480: 9 | I480: =G480*6+H480 -> 33 | K480: 5 | L480: 10 | M480: =K480*6+L480 -> 40 | O480: 12 | P480: 13 | Q480: =O480*6+P480 -> 85 | S480: UMPIRE | X480: LADDER | AB480: ROUND | AD480: 11
A481: DANDENONG | C481: 6 | D481: 6 | E481: =C481*6+D481 -> 42 | G481: 8 | H481: 6 | I481: =G481*6+H481 -> 54 | K481: 9 | L481: 13 | M481: =K481*6+L481 -> 67 | O481: 9 | P481: 14 | Q481: =O481*6+P481 -> 68 | S481: O'NEILL
A482: BEST PLAYERS | W482: TEAM | X482: W | Y482: L | Z482: D | AA482: FOR | AB482: AGST | AC482: % | AD482: PTS
A483: YARRAVILLE | C483: MEDDINGS | F483: RON BROWN | I483: ALLEN | L483: EDWARDS | O483: TAURINS | R483: NARKIEWICZ
A484: DANDENONG | C484: ABRAHAM | F484: WRIGHT | I484: BARRAN | L484: WHALEBONE | O484: DUNCAN | R484: GRAVENER | W484: COBURG | X484: 9 | Y484: 2 | Z484: 0 | AA484: 1052 | AB484: 821 | AC484: 128.14 | AD484: 36
A485: GOALKICKERS | W485: WILLIAMSTOWN | X485: 9 | Y485: 2 | Z485: 0 | AA485: 977 | AB485: 797 | AC485: 122.58469259723965 | AD485: 36
A486: YARRAVILLE | C486: RON BROWN 3 | F486: PIOVESAN 3 | I486: BENETTI 2 | L486: EDWARDS | N486: ALLEN | P486: MURRAY | R486: QUARANTOTTO | W486: PORT MELBOURNE | X486: 8 | Y486: 3 | Z486: 0 | AA486: 1031 | AB486: 876 | AC486: 117.69406392694064 | AD486: 32
A487: DANDENONG | C487: SCHMIDT 2 | F487: HILL 2 | H487: WRIGHT 2 | K487: FRAME 2 | N487: REEVES | W487: YARRAVILLE | X487: 7 | Y487: 4 | Z487: 0 | AA487: 1053 | AB487: 996 | AC487: 105.72289156626506 | AD487: 28
A489: SANDRINGHAM | C489: 6 | D489: 5 | E489: =C489*6+D489 -> 41 | G489: 8 | H489: 7 | I489: =G489*6+H489 -> 55 | K489: 14 | L489: 17 | M489: =K489*6+L489 -> 101 | O489: 14 | P489: 17 | Q489: =O489*6+P489 -> 101 | S489: BEACH ROAD | W489: SANDRINGHAM | X489: 7 | Y489: 4 | Z489: 0 | AA489: 1000 | AB489: 979 | AC489: 102.14504596527068 | AD489: 28
A490: WAVERLEY | C490: 1 | D490: 2 | E490: =C490*6+D490 -> 8 | G490: 2 | H490: 4 | I490: =G490*6+H490 -> 16 | K490: 2 | L490: 4 | M490: =K490*6+L490 -> 16 | O490: 7 | P490: 8 | Q490: =O490*6+P490 -> 50 | S490: ARMSTRONG | W490: DANDENONG | X490: 5 | Y490: 5 | Z490: 1 | AA490: 903 | AB490: 777 | AC490: 116.21621621621621 | AD490: 22
A491: BEST PLAYERS | W491: WAVERLEY | X491: 3 | Y491: 7 | Z491: 1 | AA491: 859 | AB491: 1166 | AC491: 73.670668953687823 | AD491: 14
A492: SANDRINGHAM | C492: BURNS | E492: SHEEHAN | H492: HANCE | K492: O'TOOLE | N492: SMART | Q492: BURKE | W492: PRESTON | X492: 2 | Y492: 8 | Z492: 1 | AA492: 875 | AB492: 1024 | AC492: 85.44921875 | AD492: 10
A493: WAVERLEY | C493: INNES | E493: MARTIN | H493: PIPER | K493: MITHEN | N493: SMITH | Q493: INGWERSON | W493: OAKLEIGH | X493: 2 | Y493: 9 | Z493: 0 | AA493: 898 | AB493: 1024 | AC493: 87.6953125 | AD493: 8
A494: GOALKICKERS | W494: BRUNSWICK | X494: 1 | Y494: 9 | Z494: 1 | AA494: 757 | AB494: 945 | AC494: 80.11 | AD494: 6
A495: SANDRINGHAM | C495: SMART 6 | E495: BURKE 2 | G495: BURNS 2 | I495: DAWSON | K495: CLIFFORD | M495: SHEEHAN | O495: HIRST | Q495: O'TOOLE | S495: HARRISON
A496: WAVERLEY | C496: FLINN 2 | F496: ANGUS | H496: INGWERSON | K496: SMITH | M496: NATION | O496: BRENCHLEY
A498: WILLIAMSTOWN | C498: 1 | D498: 1 | E498: =C498*6+D498 -> 7 | G498: 6 | H498: 8 | I498: =G498*6+H498 -> 44 | K498: 7 | L498: 8 | M498: =K498*6+L498 -> 50 | O498: 12 | P498: 13 | Q498: =O498*6+P498 -> 85 | S498: WILLIAMSTOWN
A499: BRUNSWICK | C499: 3 | D499: 5 | E499: =C499*6+D499 -> 23 | G499: 3 | H499: 6 | I499: =G499*6+H499 -> 24 | K499: 6 | L499: 12 | M499: =K499*6+L499 -> 48 | O499: 6 | P499: 12 | Q499: =O499*6+P499 -> 48 | S499: McMASTER
A500: BEST PLAYERS
A501: WILLIAMSTOWN | C501: JENKINSON | F501: WARE | I501: McASEY | L501: JAMES | O501: LEONARD | R501: TAUBE
A502: BRUNSWICK | C502: BIBBY | F502: AYRES | I502: WICKS | L502: ROBINSON | O502: BOWTELL | R502: LEYDIN
A503: GOALKICKERS
A504: WILLIAMSTOWN | C504: JAMES 5 | F504: JENKINSON 2 | I504: CARMICHAEL | L504: MURPHY | N504: O'TOOLE | P504: WARE | R504: CLOUGH
A505: BRUNSWICK | C505: BIBBY 2 | F505: KICK | H505: McNAMARA | K505: BALDOCK | N505: COOK
D506: 12TH JULY | I506: WEATHER | L506: WEST WIND
A507: COBURG | C507: 2 | D507: 6 | E507: =C507*6+D507 -> 18 | G507: 4 | H507: 11 | I507: =G507*6+H507 -> 35 | K507: 7 | L507: 13 | M507: =K507*6+L507 -> 55 | O507: 9 | P507: 16 | Q507: =O507*6+P507 -> 70 | S507: COBURG
A508: PORT MELBOURNE | C508: 2 | D508: 2 | E508: =C508*6+D508 -> 14 | G508: 4 | H508: 3 | I508: =G508*6+H508 -> 27 | K508: 6 | L508: 10 | M508: =K508*6+L508 -> 46 | O508: 8 | P508: 11 | Q508: =O508*6+P508 -> 59 | S508: FROOD
A509: BEST PLAYERS
A510: COBURG | C510: RIST | F510: TANCREDI | I510: ACKLAND | L510: WELSH | O510: CLEMENTS | R510: BARCLAY
A511: PORT MELBOURNE | C511: RENOUF | F511: CROSHER | I511: MITHEN | L511: MERRETT | O511: STRAUCH | R511: CAWSEY
A512: GOALKICKERS
A513: COBURG | C513: WELSH 3 | F513: RIST 2 | H513: CARMODY | K513: MURRAY | M513: GOTCH | O513: LEYDIN
A514: PORT MELBOURNE | C514: TAGGART 3 | F514: MERRETT 2 | I514: PERRY | K514: CAWSEY | M514: BOWEN
A516: OAKLEIGH | C516: 3 | D516: 1 | E516: =C516*6+D516 -> 19 | G516: 9 | H516: 4 | I516: =G516*6+H516 -> 58 | K516: 10 | L516: 6 | M516: =K516*6+L516 -> 66 | O516: 13 | P516: 8 | Q516: =O516*6+P516 -> 86 | S516: PRESTON
A517: PRESTON | C517: 2 | D517: 3 | E517: =C517*6+D517 -> 15 | G517: 7 | H517: 5 | I517: =G517*6+H517 -> 47 | K517: 9 | L517: 10 | M517: =K517*6+L517 -> 64 | O517: 9 | P517: 16 | Q517: =O517*6+P517 -> 70 | S517: JACKSON
A518: BEST PLAYERS
A519: OAKLEIGH | C519: WOODS | F519: MAUGHAN | I519: JONES | L519: LOTHIAN | O519: McLAREN | R519: KITTO
A520: PRESTON | C520: TRELOAR | F520: RYAN | I520: WALKER | L520: CLARKE | O520: PINFOLD | R520: COHEN
A521: GOALKICKERS
A522: OAKLEIGH | C522: LOTHIAN 4 | F522: McLAREN 3 | I522: LOVELESS 2 | L522: KITTO | N522: DANN | P522: McNEILL | R522: MAUGHAN
A523: PRESTON | C523: WALKER 3 | F523: CLARKE 3 | I523: SHERRY | K523: HANVIN | N523: TRELOAR
A525: ROUND 12 | E525: 18TH JULY | J525: WEATHER | N525: STRONG NORTH WEST WIND | S525: PLAYED AT
D526: 1ST QTR | H526: 2ND QTR | L526: 3RD QTR | P526: FINAL | S526: BEACH ROAD
A527: SANDRINGHAM | C527: 7 | D527: 10 | E527: =C527*6+D527 -> 52 | G527: 8 | H527: 12 | I527: =G527*6+H527 -> 60 | K527: 14 | L527: 18 | M527: =K527*6+L527 -> 102 | O527: 15 | P527: 18 | Q527: =O527*6+P527 -> 108 | S527: UMPIRE | X527: LADDER | AB527: ROUND | AD527: 12
A528: COBURG | C528: 1 | D528: 1 | E528: =C528*6+D528 -> 7 | G528: 6 | H528: 4 | I528: =G528*6+H528 -> 40 | K528: 8 | L528: 5 | M528: =K528*6+L528 -> 53 | O528: 11 | P528: 10 | Q528: =O528*6+P528 -> 76 | S528: McMASTER
A529: BEST PLAYERS | W529: TEAM | X529: W | Y529: L | Z529: D | AA529: FOR | AB529: AGST | AC529: % | AD529: PTS
A530: SANDRINGHAM | C530: MUTER | F530: DAWSON | I530: O'TOOLE | L530: GRANGER | O530: PETERS | R530: HANCE
A531: COBURG | C531: GOTCH | F531: BARCLAY | I531: CLEMENTS | L531: TANCREDI | O531: McNABB | R531: SULLIVAN | W531: WILLIAMSTOWN | X531: 10 | Y531: 2 | Z531: 0 | AA531: 1067 | AB531: 854 | AC531: 124.94145199063232 | AD531: 40
A532: GOALKICKERS | Q532: DAWSON | W532: COBURG | X532: 9 | Y532: 3 | Z532: 0 | AA532: 1128 | AB532: 929 | AC532: 121.42 | AD532: 36
A533: SANDRINGHAM | C533: BURNS 3 | E533: O'TOOLE 2 | H533: SMART 2 | J533: HARRISON 2 | M533: HANCE 2 | O533: BURKE | Q533: SHEEHAN | S533: MUTER | W533: PORT MELBOURNE | X533: 8 | Y533: 4 | Z533: 0 | AA533: 1093 | AB533: 949 | AC533: 115.17386722866175 | AD533: 32
A534: COBURG | C534: CARMODY 3 | F534: FITZPATRICK 3 | J534: RIST 2 | L534: GOTCH 2 | O534: BARCLAY | W534: SANDRINGHAM | X534: 8 | Y534: 4 | Z534: 0 | AA534: 1108 | AB534: 1055 | AC534: 105.02369668246446 | AD534: 32
A536: WILLIAMSTOWN | C536: 4 | D536: 5 | E536: =C536*6+D536 -> 29 | G536: 6 | H536: 10 | I536: =G536*6+H536 -> 46 | K536: 10 | L536: 18 | M536: =K536*6+L536 -> 78 | O536: 12 | P536: 18 | Q536: =O536*6+P536 -> 90 | S536: WAVERLEY | W536: YARRAVILLE | X536: 7 | Y536: 5 | Z536: 0 | AA536: 1133 | AB536: 1078 | AC536: 105.10204081632654 | AD536: 28
A537: WAVERLEY | C537: 1 | D537: 1 | E537: =C537*6+D537 -> 7 | G537: 4 | H537: 4 | I537: =G537*6+H537 -> 28 | K537: 5 | L537: 6 | M537: =K537*6+L537 -> 36 | O537: 8 | P537: 9 | Q537: =O537*6+P537 -> 57 | S537: FROOD | W537: DANDENONG | X537: 6 | Y537: 5 | Z537: 1 | AA537: 1015 | AB537: 832 | AC537: 121.99519230769231 | AD537: 26
A538: BEST PLAYERS | W538: WAVERLEY | X538: 3 | Y538: 8 | Z538: 1 | AA538: 916 | AB538: 1256 | AC538: 72.929936305732483 | AD538: 14
A539: WILLIAMSTOWN | C539: JENKINSON | F539: LEONARD | I539: JAMES | L539: RUSSELL | O539: SAVIGE | R539: CARMICHAEL | W539: OAKLEIGH | X539: 3 | Y539: 9 | Z539: 0 | AA539: 980 | AB539: 1104 | AC539: 88.768115942028984 | AD539: 12
A540: WAVERLEY | C540: SMITH | F540: MITHEN | I540: ELLIS | L540: PIPER | O540: BRENCHLEY | R540: MARTIN | W540: BRUNSWICK | X540: 2 | Y540: 9 | Z540: 1 | AA540: 830 | AB540: 1007 | AC540: 82.42 | AD540: 10
A541: GOALKICKERS | W541: PRESTON | X541: 2 | Y541: 9 | Z541: 1 | AA541: 930 | AB541: 1136 | AC541: 81.866197183098592 | AD541: 10
A542: WILLIAMSTOWN | C542: JAMES 6 | F542: JENKINSON 5 | I542: CLOUGH
A543: WAVERLEY | C543: MITHEN 2 | F543: NASH 2 | I543: INGWERSON | L543: WHITECROSS | O543: SMITH | Q543: ELLIS
A545: OAKLEIGH | C545: 2 | D545: 5 | E545: =C545*6+D545 -> 17 | G545: 3 | H545: 8 | I545: =G545*6+H545 -> 26 | K545: 10 | L545: 13 | M545: =K545*6+L545 -> 73 | O545: 11 | P545: 16 | Q545: =O545*6+P545 -> 82 | S545: OAKLEIGH
A546: YARRAVILLE | C546: 3 | D546: 0 | E546: =C546*6+D546 -> 18 | G546: 6 | H546: 1 | I546: =G546*6+H546 -> 37 | K546: 9 | L546: 4 | M546: =K546*6+L546 -> 58 | O546: 12 | P546: 8 | Q546: =O546*6+P546 -> 80 | S546: FLANAGAN
A547: BEST PLAYERS
A548: OAKLEIGH | C548: McLAREN | F548: KITTO | I548: McNEILL | L548: LOVELESS | O548: MAUGHAN | R548: LOTHIAN
A549: YARRAVILLE | C549: McKENZIE | F549: WARREN | I549: QUARANTOTTO | L549: CLEGG | O549: PIOVESAN | R549: ALLEN
A550: GOALKICKERS
A551: OAKLEIGH | C551: KITTO 3 | F551: McLAREN 2 | I551: LOTHIAN 2 | L551: McNEILL 2 | N551: LOVELESS | Q551: MAUGHAN
A552: YARRAVILLE | C552: PIOVESAN 4 | F552: MEDDINGS 2 | I552: EDWARDS | K552: HOSKINGS | N552: BENETTI | P552: WILSON | R552: QUARANTOTTO | V552: ION
D553: 19TH JULY | I553: WEATHER | L553: WET WINDY
A554: DANDENONG | C554: 3 | D554: 2 | E554: =C554*6+D554 -> 20 | G554: 9 | H554: 6 | I554: =G554*6+H554 -> 60 | K554: 15 | L554: 7 | M554: =K554*6+L554 -> 97 | O554: 17 | P554: 10 | Q554: =O554*6+P554 -> 112 | S554: DANDENONG
A555: PRESTON | C555: 2 | D555: 4 | E555: =C555*6+D555 -> 16 | G555: 4 | H555: 6 | I555: =G555*6+H555 -> 30 | K555: 5 | L555: 10 | M555: =K555*6+L555 -> 40 | O555: 7 | P555: 13 | Q555: =O555*6+P555 -> 55 | S555: ARMSTRONG
A556: BEST PLAYERS
A557: DANDENONG | C557: BARRAN | F557: O'CONNELL | I557: ABRAHAM | L557: WRIGHT | O557: HILL | R557: SCHMIDT
A558: PRESTON | C558: RYAN | F558: ALEXANDER | I558: PINFOLD | L558: SHERRY | O558: TRELOAR | R558: HANVIN
A559: GOALKICKERS
A560: DANDENONG | C560: KENT 5 | F560: O'CONNELL 5 | I560: WHALEBONE 3 | L560: HILL | N560: PIVETTA | Q560: GREENWOOD | T560: REEVE
A561: PRESTON | C561: STOREY 2 | F561: SHERRY | H561: TRELOAR | J561: CLARKE | L561: WALKER | N561: MURNANE
A563: BRUNSWICK | C563: 5 | D563: 5 | E563: =C563*6+D563 -> 35 | G563: 5 | H563: 5 | I563: =G563*6+H563 -> 35 | K563: 10 | L563: 12 | M563: =K563*6+L563 -> 72 | O563: 10 | P563: 13 | Q563: =O563*6+P563 -> 73 | S563: BRUNSWICK
A564: PORT MELBOURNE | C564: 2 | D564: 0 | E564: =C564*6+D564 -> 12 | G564: 3 | H564: 5 | I564: =G564*6+H564 -> 23 | K564: 4 | L564: 5 | M564: =K564*6+L564 -> 29 | O564: 9 | P564: 8 | Q564: =O564*6+P564 -> 62 | S564: ROWE
A565: BEST PLAYERS
A566: BRUNSWICK | C566: BIBBY | F566: ROBINSON | I566: TOZER | L566: WHILEY | O566: LEYDIN | R566: THOMPSON
A567: PORT MELBOURNE | C567: RENOUF | F567: BARRY | I567: CROSHER | L567: TAGGART | O567: STRAUCH | R567: KERR
A568: GOALKICKERS
A569: BRUNSWICK | C569: COOK 4 | F569: BIBBY 2 | I569: KICK | K569: McNAMARA | N569: LEYDIN | P569: WILSON
A570: PORT MELBOURNE | C570: JEFFREY 3 | F570: MERRETT 2 | I570: BOWEN | K570: TAGGART | N570: EDWARDS | Q570: BRAGG
A572: ROUND 13 | D572: 25TH JULY | I572: WEATHER | L572: WEST WIND RAIN 1ST QTR | S572: PLAYED AT
D573: 1ST QTR | H573: 2ND QTR | L573: 3RD QTR | P573: FINAL | S573: YARRAVILLE
A574: YARRAVILLE | C574: 6 | D574: 3 | E574: =C574*6+D574 -> 39 | G574: 11 | H574: 5 | I574: =G574*6+H574 -> 71 | K574: 13 | L574: 6 | M574: =K574*6+L574 -> 84 | O574: 18 | P574: 10 | Q574: =O574*6+P574 -> 118 | S574: UMPIRE | X574: LADDER | AB574: ROUND | AD574: 13
A575: WAVERLEY | C575: 6 | D575: 0 | E575: =C575*6+D575 -> 36 | G575: 10 | H575: 4 | I575: =G575*6+H575 -> 64 | K575: 11 | L575: 8 | M575: =K575*6+L575 -> 74 | O575: 16 | P575: 14 | Q575: =O575*6+P575 -> 110 | S575: HORNE
A576: BEST PLAYERS | W576: TEAM | X576: W | Y576: L | Z576: D | AA576: FOR | AB576: AGST | AC576: % | AD576: PTS
A577: YARRAVILLE | C577: EDWARDS | F577: PIOVESAN | I577: NARKIEWICZ | L577: MEDDINGS | O577: KNOTT | Q577: WARWICK
A578: WAVERLEY | C578: INGWERSON | F578: MITHEN | I578: INNES | L578: SMITH | O578: MASSEY | Q578: ALEXANDER | W578: WILLIAMSTOWN | X578: 11 | Y578: 2 | Z578: 0 | AA578: 1148 | AB578: 920 | AC578: 124.78260869565217 | AD578: 44
A579: GOALKICKERS | W579: COBURG | X579: 9 | Y579: 4 | Z579: 0 | AA579: 1208 | AB579: 1011 | AC579: 119.49 | AD579: 36
A580: YARRAVILLE | C580: PIOVESAN 5 | F580: EDWARDS 4 | I580: MEDDINGS 3 | L580: CONNELLY 2 | O580: ALLEN | Q580: ION | R580: MURRAY | T580: WARWICK | W580: PORT MELBOURNE | X580: 9 | Y580: 4 | Z580: 0 | AA580: 1197 | AB580: 1016 | AC580: 117.81496062992126 | AD580: 36
A581: WAVERLEY | C581: INGWERSON 6 | F581: PIPER 4 | H581: NASH 3 | J581: NATION | L581: WHITECROSS | O581: BRENCHLEY | W581: SANDRINGHAM | X581: 9 | Y581: 4 | Z581: 0 | AA581: 1205 | AB581: 1125 | AC581: 107.11111111111111 | AD581: 36
A583: SANDRINGHAM | C583: 2 | D583: 5 | E583: =C583*6+D583 -> 17 | G583: 4 | H583: 5 | I583: =G583*6+H583 -> 29 | K583: 10 | L583: 10 | M583: =K583*6+L583 -> 70 | O583: 14 | P583: 13 | Q583: =O583*6+P583 -> 97 | S583: PRESTON | W583: YARRAVILLE | X583: 8 | Y583: 5 | Z583: 0 | AA583: 1251 | AB583: 1188 | AC583: 105.3030303030303 | AD583: 32
A584: PRESTON | C584: 2 | D584: 3 | E584: =C584*6+D584 -> 15 | G584: 3 | H584: 7 | I584: =G584*6+H584 -> 25 | K584: 6 | L584: 12 | M584: =K584*6+L584 -> 48 | O584: 9 | P584: 16 | Q584: =O584*6+P584 -> 70 | S584: SCOTT | W584: DANDENONG | X584: 6 | Y584: 6 | Z584: 1 | AA584: 1081 | AB584: 913 | AC584: 118.40087623220154 | AD584: 26
A585: BEST PLAYERS | W585: BRUNSWICK | X585: 3 | Y585: 9 | Z585: 1 | AA585: 912 | AB585: 1087 | AC585: 83.9 | AD585: 14
A586: SANDRINGHAM | C586: HANCE | F586: SHEEHAN | I586: HOAR | L586: HIRST | N586: MUTER | Q586: SMART | W586: WAVERLEY | X586: 3 | Y586: 9 | Z586: 1 | AA586: 1026 | AB586: 1374 | AC586: 74.672489082969435 | AD586: 14
A587: PRESTON | C587: RYAN | F587: WADDELL | I587: DIXON | L587: BOYLE | N587: TRELOAR | Q587: MURNANE | W587: OAKLEIGH | X587: 3 | Y587: 10 | Z587: 0 | AA587: 1047 | AB587: 1208 | AC587: 86.672185430463571 | AD587: 12
A588: GOALKICKERS | W588: PRESTON | X588: 2 | Y588: 10 | Z588: 1 | AA588: 1000 | AB588: 1233 | AC588: 81.103000811030014 | AD588: 10
A589: SANDRINGHAM | C589: SMART 5 | E589: BURNS 2 | G589: HIRST 2 | I589: DAWSON | K589: MUTER | M589: CLIFFORD | P589: GLEESON | R589: SHEEHAN
A590: PRESTON | C590: MILLS 3 | E590: WATSON 2 | H590: WADDELL 2 | K590: JAMES | M590: ALEXANDER
E591: 26TH JULY | J591: WEATHER
A592: WILLIAMSTOWN | C592: 6 | D592: 3 | E592: =C592*6+D592 -> 39 | G592: 8 | H592: 3 | I592: =G592*6+H592 -> 51 | K592: 10 | L592: 11 | M592: =K592*6+L592 -> 71 | O592: 11 | P592: 15 | Q592: =O592*6+P592 -> 81 | S592: WILLIAMSTOWN
A593: DANDENONG | C593: 3 | D593: 0 | E593: =C593*6+D593 -> 18 | G593: 5 | H593: 2 | I593: =G593*6+H593 -> 32 | K593: 8 | L593: 2 | M593: =K593*6+L593 -> 50 | O593: 10 | P593: 6 | Q593: =O593*6+P593 -> 66 | S593: POLLARD
A594: BEST PLAYERS
A595: WILLIAMSTOWN | C595: WARE | F595: LEONARD | I595: MURRIE | L595: McASEY | O595: JENKINSON | R595: MALONEY
A596: DANDENONG | C596: ABRAHAM | F596: SCHMIDT | I596: HILL | L596: OSBORNE | O596: WRIGHT | R596: HOBBS
A597: GOALKICKERS
A598: WILLIAMSTOWN | C598: WILLIAMS 4 | F598: JENKINSON 3 | I598: JAMES | K598: WARE | M598: BEAMISH | P598: LEONARD
A599: DANDENONG | C599: SCHMIDT 3 | F599: KENT 2 | H599: OSBORNE 2 | K599: HILL | M599: WHALEBONE
A601: PORT MELBOURNE | C601: 2 | D601: 3 | E601: =C601*6+D601 -> 15 | G601: 8 | H601: 6 | I601: =G601*6+H601 -> 54 | K601: 11 | L601: 6 | M601: =K601*6+L601 -> 72 | O601: 16 | P601: 8 | Q601: =O601*6+P601 -> 104 | S601: PORT MELBOURNE
A602: OAKLEIGH | C602: 1 | D602: 2 | E602: =C602*6+D602 -> 8 | G602: 2 | H602: 2 | I602: =G602*6+H602 -> 14 | K602: 8 | L602: 4 | M602: =K602*6+L602 -> 52 | O602: 10 | P602: 7 | Q602: =O602*6+P602 -> 67 | S602: ARMSTRONG
A603: BEST PLAYERS
A604: PORT MELBOURNE | C604: CROSHER | F604: PERRY | I604: HOUSE | L604: RENOUF | O604: CASTLEHOW | R604: KERR
A605: OAKLEIGH | C605: MULDOON | F605: JONES | I605: LOVELESS | L605: MAUGHAN | O605: POULTER | R605: WOODS
A606: GOALKICKERS
A607: PORT MELBOURNE | C607: PERRY 4 | E607: HOUSE 4 | G607: JEFFREY 4 | J607: TAGGART | L607: MERRETT | N607: WILLIAMS | Q607: SELL
A608: OAKLEIGH | C608: MULDOON 3 | F608: DOWDELL 2 | I608: McNEILL 2 | L608: MAUGHAN 2 | O608: LOTHIAN
A610: BRUNSWICK | C610: 1 | D610: 2 | E610: =C610*6+D610 -> 8 | G610: 4 | H610: 7 | I610: =G610*6+H610 -> 31 | K610: 7 | L610: 7 | M610: =K610*6+L610 -> 49 | O610: 12 | P610: 10 | Q610: =O610*6+P610 -> 82 | S610: COBURG
A611: COBURG | C611: 1 | D611: 7 | E611: =C611*6+D611 -> 13 | G611: 3 | H611: 9 | I611: =G611*6+H611 -> 27 | K611: 9 | L611: 11 | M611: =K611*6+L611 -> 65 | O611: 11 | P611: 14 | Q611: =O611*6+P611 -> 80 | S611: FLANAGAN
A612: BEST PLAYERS
A613: BRUNSWICK | C613: BIBBY | F613: TOZER | I613: BRIGLIA | L613: WILSON | O613: LEYDIN | R613: DENTON
A614: COBURG | C614: BYRON | F614: GOTCH | I614: BARCLAY | L614: KEEFER | O614: WELSH
A615: GOALKICKERS
A616: BRUNSWICK | C616: COOK 3 | F616: LEYDIN 2 | I616: BIBBY 2 | K616: WILSON 2 | N616: BRIGLIA | P616: KICK | R616: McNAMARA
A617: COBURG | C617: BYRON 4 | F617: J BRIMACOMBE 2 | J617: FITZPATRICK 2 | N617: BARCLAY | P617: MURRAY | R617: KEEFER
A619: ROUND 14 | D619: 1ST AUGUST | I619: WEATHER | L619: SOUTH WIND RAIN | S619: PLAYED AT
D620: 1ST QTR | H620: 2ND QTR | L620: 3RD QTR | P620: FINAL | S620: BEACH ROAD
A621: WILLIAMSTOWN | C621: 1 | D621: 2 | E621: =C621*6+D621 -> 8 | G621: 4 | H621: 13 | I621: =G621*6+H621 -> 37 | K621: 5 | L621: 16 | M621: =K621*6+L621 -> 46 | O621: 9 | P621: 20 | Q621: =O621*6+P621 -> 74 | S621: UMPIRE | X621: LADDER | AB621: ROUND | AD621: 14
A622: SANDRINGHAM | C622: 5 | D622: 6 | E622: =C622*6+D622 -> 36 | G622: 6 | H622: 6 | I622: =G622*6+H622 -> 42 | K622: 8 | L622: 10 | M622: =K622*6+L622 -> 58 | O622: 8 | P622: 16 | Q622: =O622*6+P622 -> 64 | S622: JACKSON
A623: BEST PLAYERS | W623: TEAM | X623: W | Y623: L | Z623: D | AA623: FOR | AB623: AGST | AC623: % | AD623: PTS
A624: WILLIAMSTOWN | C624: RUSSELL | F624: MURRIE | I624: LEONARD | L624: WILLIAMS | O624: BEAMISH | R624: JENKINSON
A625: SANDRINGHAM | C625: O'TOOLE | F625: HOAR | I625: MUTER | L625: KENNEDY | O625: PETERS | R625: CLIFFORD | W625: WILLIAMSTOWN | X625: 12 | Y625: 2 | Z625: 0 | AA625: 1222 | AB625: 984 | AC625: 124.1869918699187 | AD625: 48
A626: GOALKICKERS | W626: COBURG | X626: 10 | Y626: 4 | Z626: 0 | AA626: 1302 | AB626: 1089 | AC626: 119.56 | AD626: 40
A627: WILLIAMSTOWN | C627: GRAHAM 2 | F627: WILIAMS 2 | I627: MALONEY | K627: JENKINSON | N627: JAMES | P627: MURPHY | R627: McASEY | W627: PORT MELBOURNE | X627: 10 | Y627: 4 | Z627: 0 | AA627: 1297 | AB627: 1096 | AC627: 118.33941605839416 | AD627: 40
A628: SANDRINGHAM | C628: O'TOOLE 5 | F628: DAWSON | I628: CLIFFORD | L628: BURNS | W628: SANDRINGHAM | X628: 9 | Y628: 5 | Z628: 0 | AA628: 1269 | AB628: 1199 | AC628: 105.83819849874895 | AD628: 36
A630: BRUNSWICK | C630: 0 | D630: 6 | E630: =C630*6+D630 -> 6 | G630: 0 | H630: 6 | I630: =G630*6+H630 -> 6 | K630: 3 | L630: 8 | M630: =K630*6+L630 -> 26 | O630: 5 | P630: 10 | Q630: =O630*6+P630 -> 40 | S630: WAVERLEY | W630: YARRAVILLE | X630: 8 | Y630: 6 | Z630: 0 | AA630: 1331 | AB630: 1288 | AC630: 103.33850931677019 | AD630: 32
A631: WAVERLEY | C631: 1 | D631: 4 | E631: =C631*6+D631 -> 10 | G631: 4 | H631: 5 | I631: =G631*6+H631 -> 29 | K631: 4 | L631: 7 | M631: =K631*6+L631 -> 31 | O631: 4 | P631: 8 | Q631: =O631*6+P631 -> 32 | S631: POLLARD | W631: DANDENONG | X631: 6 | Y631: 7 | Z631: 1 | AA631: 1125 | AB631: 972 | AC631: 115.74074074074075 | AD631: 26
A632: BEST PLAYERS | W632: BRUNSWICK | X632: 4 | Y632: 9 | Z632: 1 | AA632: 952 | AB632: 1119 | AC632: 85.08 | AD632: 18
A633: BRUNSWICK | C633: BIBBY | F633: THOMPSON | I633: ROBINSON | L633: DARBY | N633: LEYDIN | Q633: BOWTELL | W633: OAKLEIGH | X633: 4 | Y633: 10 | Z633: 0 | AA633: 1106 | AB633: 1252 | AC633: 88.33865814696486 | AD633: 16
A634: WAVERLEY | C634: HUDSON | F634: MITHEN | I634: SMITH | L634: LEE | N634: ALEXANDER | Q634: MARTIN | W634: WAVERLEY | X634: 3 | Y634: 10 | Z634: 1 | AA634: 1058 | AB634: 1414 | AC634: 74.823196605374818 | AD634: 14
A635: GOALKICKERS | W635: PRESTON | X635: 2 | Y635: 11 | Z635: 1 | AA635: 1078 | AB635: 1327 | AC635: 81.235870384325551 | AD635: 10
A636: BRUNSWICK | C636: COOK 3 | F636: WILSON | I636: DARBY
A637: WAVERLEY | C637: PIPER | E637: INGWERSON | H637: NASH | J637: ALEXANDER
E638: 2ND AUGUST | I638: WEATHER | M638: SHOWERS
A639: PORT MELBOURNE | C639: 5 | D639: 1 | E639: =C639*6+D639 -> 31 | G639: 9 | H639: 4 | I639: =G639*6+H639 -> 58 | K639: 12 | L639: 9 | M639: =K639*6+L639 -> 81 | O639: 15 | P639: 10 | Q639: =O639*6+P639 -> 100 | S639: YARRAVILLE
A640: YARRAVILLE | C640: 3 | D640: 2 | E640: =C640*6+D640 -> 20 | G640: 5 | H640: 5 | I640: =G640*6+H640 -> 35 | K640: 7 | L640: 10 | M640: =K640*6+L640 -> 52 | O640: 11 | P640: 14 | Q640: =O640*6+P640 -> 80 | S640: SCOTT
A641: BEST PLAYERS
A642: PORT MELBOURNE | C642: PERRY | F642: MITHEN | I642: BARRY | L642: EVANS | O642: CARLILE | R642: RENOUF
A643: YARRAVILLE | C643: WARWICK | F643: MURRAY | I643: LARKINS | L643: McKENNA | O643: RON BROWN | R643: ALLEN
A644: GOALKICKERS
A645: PORT MELBOURNE | C645: PERRY 4 | F645: MILNER 4 | I645: CARLILE 3 | L645: JEFFREY 2 | O645: BOWEN
A646: YARRAVILLE | C646: MURRAY 3 | F646: PIOVESAN 2 | I646: ALLEN 2 | K646: WARWICK 2 | N646: MEDDINGS | Q646: CONNELLY
A648: OAKLEIGH | C648: 1 | D648: 5 | E648: =C648*6+D648 -> 11 | G648: 4 | H648: 7 | I648: =G648*6+H648 -> 31 | K648: 6 | L648: 8 | M648: =K648*6+L648 -> 44 | O648: 8 | P648: 11 | Q648: =O648*6+P648 -> 59 | S648: DANDENONG
A649: DANDENONG | C649: 1 | D649: 3 | E649: =C649*6+D649 -> 9 | G649: 3 | H649: 3 | I649: =G649*6+H649 -> 21 | K649: 4 | L649: 4 | M649: =K649*6+L649 -> 28 | O649: 6 | P649: 8 | Q649: =O649*6+P649 -> 44 | S649: FROOD
A650: BEST PLAYERS
A651: OAKLEIGH | C651: KITTO | F651: JONES | I651: RICCI | L651: McNEILL | O651: MAUGHAN | R651: McLAREN
A652: DANDENONG | C652: BARRAN | F652: PIVETTA | I652: ABRAHAM | L652: HILL | O652: HOBBS | R652: OSBORNE
A653: GOALKICKERS
A654: OAKLEIGH | C654: McLAREN 2 | F654: JORDAN 2 | I654: POULTER | K654: MAUGHAN | N654: LOTHIAN | P654: KITTO
A655: DANDENONG | C655: HILL | E655: PIVETTA | G655: KENT | I655: WHALEBONE | L655: O'DONNELL | O655: BELL
A657: COBURG | C657: 4 | D657: 1 | E657: =C657*6+D657 -> 25 | G657: 8 | H657: 1 | I657: =G657*6+H657 -> 49 | K657: 12 | L657: 4 | M657: =K657*6+L657 -> 76 | O657: 14 | P657: 10 | Q657: =O657*6+P657 -> 94 | S657: COBURG
A658: PRESTON | C658: 3 | D658: 3 | E658: =C658*6+D658 -> 21 | G658: 8 | H658: 4 | I658: =G658*6+H658 -> 52 | K658: 10 | L658: 8 | M658: =K658*6+L658 -> 68 | O658: 11 | P658: 12 | Q658: =O658*6+P658 -> 78 | S658: ARMSTRONG
A659: BEST PLAYERS
A660: COBURG | C660: RIST | E660: L BRIMACOMBE | I660: J BRIMACOMBE | M660: BARCLAY | P660: FITZPATRICK | S660: GOTCH
A661: PRESTON | C661: PINFOLD | F661: MURNANE | I661: WATSON | M661: CLARKE | P661: DIXON | S661: WALKER
A662: GOALKICKERS
A663: COBURG | C663: L BRIMACOMBE 4 | G663: BYRON 3 | I663: KEEFER 2 | K663: J BRIMACOMBE | N663: FITZPATRICK | Q663: MURRAY | S663: RIST | U663: BARCLAY
A664: PRESTON | C664: CLARKE 3 | F664: WALKER 2 | I664: WADDELL 2 | L664: COHEN 2 | N664: MURNANE | Q664: ALEXANDER
A666: ROUND 15 | D666: 8TH AUGUST | H666: WEATHER | K666: STRONG WEST WIND LIGHT SHOWERS | S666: PLAYED AT
D667: 1ST QTR | H667: 2ND QTR | L667: 3RD QTR | P667: FINAL | S667: BRUNSWICK
A668: YARRAVILLE | C668: 9 | D668: 3 | E668: =C668*6+D668 -> 57 | G668: 11 | H668: 3 | I668: =G668*6+H668 -> 69 | K668: 15 | L668: 7 | M668: =K668*6+L668 -> 97 | O668: 15 | P668: 7 | Q668: =O668*6+P668 -> 97 | S668: UMPIRE | X668: LADDER | AB668: ROUND | AD668: 15
A669: BRUNSWICK | C669: 1 | D669: 1 | E669: =C669*6+D669 -> 7 | G669: 3 | H669: 6 | I669: =G669*6+H669 -> 24 | K669: 5 | L669: 7 | M669: =K669*6+L669 -> 37 | O669: 9 | P669: 10 | Q669: =O669*6+P669 -> 64 | S669: FROOD
A670: BEST PLAYERS | W670: TEAM | X670: W | Y670: L | Z670: D | AA670: FOR | AB670: AGST | AC670: % | AD670: PTS
A671: YARRAVILLE | C671: CONNELLY | F671: CLEGG | I671: MURRAY | K671: ALLEN | N671: PIOVESAN | Q671: EDWARDS
A672: BRUNSWICK | C672: CLELAND | F672: TOZER | I672: LEYDIN | K672: BRIGLIA | N672: COOK | Q672: DARBY | W672: WILLIAMSTOWN | X672: 13 | Y672: 2 | Z672: 0 | AA672: 1283 | AB672: 1034 | AC672: 124.08 | AD672: 52
A673: GOALKICKERS | W673: PORT MELBOURNE | X673: 11 | Y673: 4 | Z673: 0 | AA673: 1389 | AB673: 1169 | AC673: 118.81950384944398 | AD673: 44
A674: YARRAVILLE | C674: ALLEN 5 | F674: CONNELLY 4 | I674: PIOVESAN 2 | L674: EDWARDS 2 | O674: MEDDINGS | R674: MURRAY | W674: COBURG | X674: 10 | Y674: 5 | Z674: 0 | AA674: 1352 | AB674: 1150 | AC674: 117.57 | AD674: 40
A675: BRUNSWICK | C675: COOK 6 | F675: DARBY 2 | I675: LEYDIN 2 | W675: SANDRINGHAM | X675: 10 | Y675: 5 | Z675: 0 | AA675: 1350 | AB675: 1249 | AC675: 108.08646917534027 | AD675: 40
A677: OAKLEIGH | C677: 2 | D677: 1 | E677: =C677*6+D677 -> 13 | G677: 7 | H677: 5 | I677: =G677*6+H677 -> 47 | K677: 7 | L677: 9 | M677: =K677*6+L677 -> 51 | O677: 16 | P677: 18 | Q677: =O677*6+P677 -> 114 | S677: OAKLEIGH | W677: YARRAVILLE | X677: 9 | Y677: 6 | Z677: 0 | AA677: 1428 | AB677: 1352 | AC677: 105.62130177514793 | AD677: 36
A678: WAVERLEY | C678: 6 | D678: 5 | E678: =C678*6+D678 -> 41 | G678: 8 | H678: 8 | I678: =G678*6+H678 -> 56 | K678: 9 | L678: 13 | M678: =K678*6+L678 -> 67 | O678: 10 | P678: 13 | Q678: =O678*6+P678 -> 73 | S678: ROWE | W678: DANDENONG | X678: 6 | Y678: 8 | Z678: 1 | AA678: 1175 | AB678: 1053 | AC678: 111.58594491927825 | AD678: 26
A679: BEST PLAYERS | W679: OAKLEIGH | X679: 5 | Y679: 10 | Z679: 0 | AA679: 1220 | AB679: 1325 | AC679: 92.075471698113205 | AD679: 20
A680: OAKLEIGH | C680: WOODS | F680: McLAREN | I680: JONES | K680: KITTO | N680: CRAWFORD | Q680: LOTHIAN | W680: BRUNSWICK | X680: 4 | Y680: 10 | Z680: 1 | AA680: 1016 | AB680: 1216 | AC680: 84.25 | AD680: 18
A681: WAVERLEY | C681: INGWERSON | F681: MARTIN | I681: NATION | K681: ELLIS | N681: MITHEN | Q681: ALEXANDER | W681: WAVERLEY | X681: 3 | Y681: 11 | Z681: 1 | AA681: 1131 | AB681: 1528 | AC681: 74.018324607329845 | AD681: 14
A682: GOALKICKERS | W682: PRESTON | X682: 2 | Y682: 12 | Z682: 1 | AA682: 1151 | AB682: 1419 | AC682: 81.11346018322763 | AD682: 10
A683: OAKLEIGH | C683: McLAREN 7 | F683: JONES 2 | H683: DOWDELL 2 | K683: KITTO | M683: LOVELESS | O683: HAINING | Q683: MAUGHAN | T683: LOTHIAN
A684: WAVERLEY | C684: NATION 3 | F684: MITHEN 2 | I684: ALEXANDER 2 | L684: PIPER | N684: MARTIN | P684: NASH
E685: 9TH AUGUST | I685: WEATHER
A686: WILLIAMSTOWN | C686: 2 | D686: 6 | E686: =C686*6+D686 -> 18 | G686: 3 | H686: 8 | I686: =G686*6+H686 -> 26 | K686: 7 | L686: 13 | M686: =K686*6+L686 -> 55 | O686: 8 | P686: 13 | Q686: =O686*6+P686 -> 61 | S686: WILLIAMSTOWN
A687: COBURG | C687: 0 | D687: 0 | E687: =C687*6+D687 -> 0 | G687: 2 | H687: 3 | I687: =G687*6+H687 -> 15 | K687: 3 | L687: 3 | M687: =K687*6+L687 -> 21 | O687: 6 | P687: 14 | Q687: =O687*6+P687 -> 50 | S687: HORNE
A688: BEST PLAYERS
A689: WILLIAMSTOWN | C689: TURNER | F689: RAILTON | I689: RUSSELL | L689: JENKINSON | O689: MURRIE | S689: LEONARD
A690: COBURG | C690: BARCLAY | F690: HICKS | I690: SULLIVAN | L690: TANCREDI | O690: J BRIMACOMBE | S690: WELSH
A691: GOALKICKERS
A692: WILLIAMSTOWN | C692: TURNER 5 | F692: JAMES 2 | I692: BEAMISH
A693: COBURG | C693: J BRIMACOMBE 2 | G693: BARCLAY 2 | J693: BYRON | L693: GOTCH
A695: SANDRINGHAM | C695: 0 | D695: 2 | E695: =C695*6+D695 -> 2 | G695: 4 | H695: 6 | I695: =G695*6+H695 -> 30 | K695: 9 | L695: 7 | M695: =K695*6+L695 -> 61 | O695: 11 | P695: 15 | Q695: =O695*6+P695 -> 81 | S695: BEACH ROAD
A696: DANDENONG | C696: 2 | D696: 3 | E696: =C696*6+D696 -> 15 | G696: 4 | H696: 5 | I696: =G696*6+H696 -> 29 | K696: 7 | L696: 7 | M696: =K696*6+L696 -> 49 | O696: 7 | P696: 8 | Q696: =O696*6+P696 -> 50 | S696: FLANAGAN
A697: BEST PLAYERS
A698: SANDRINGHAM | C698: HOAR | F698: HARRISON | I698: WILLS | L698: KENNEDY | O698: BURNS | R698: O'TOOLE
A699: DANDENONG | C699: BARRAN | F699: ABRAHAM | I699: PIVETTA | L699: HILL | O699: WHALEBONE | R699: KENT
A700: GOALKICKERS
A701: SANDRINGHAM | C701: O'TOOLE 3 | F701: BURNS 3 | I701: SMART 2 | K701: STRACHAN | N701: KENNEDY | Q701: GLEESON
A702: DANDENONG | C702: KENT 3 | F702: WHALEBONE 2 | J702: SPIERINGS 2
A704: PORT MELBOURNE | C704: 1 | D704: 2 | E704: =C704*6+D704 -> 8 | G704: 5 | H704: 7 | I704: =G704*6+H704 -> 37 | K704: 8 | L704: 10 | M704: =K704*6+L704 -> 58 | O704: 14 | P704: 18 | Q704: =O704*6+P704 -> 102 | S704: PORT MELBOURNE
A705: PRESTON | C705: 2 | D705: 2 | E705: =C705*6+D705 -> 14 | G705: 5 | H705: 4 | I705: =G705*6+H705 -> 34 | K705: 9 | L705: 5 | M705: =K705*6+L705 -> 59 | O705: 11 | P705: 7 | Q705: =O705*6+P705 -> 73 | S705: O'NEILL
A706: BEST PLAYERS
A707: PORT MELBOURNE | C707: MITHEN | F707: LANDORFF | I707: EDWARDS | L707: CROSHER | O707: CARLILE | R707: PERRY
A708: PRESTON | C708: JAMES | F708: WADDELL | I708: PINFOLD | L708: RYAN | O708: TRELOAR | R708: MURNANE
A709: GOALKICKERS
A710: PORT MELBOURNE | C710: JEFFREY 5 | F710: EDWARDS 3 | I710: PERRY 2 | L710: HOUSE | N710: BOWEN | P710: MITHEN | R710: MILNER
A711: PRESTON | C711: WALKER 3 | F711: JAMES 2 | I711: WATSON 2 | L711: MUIR | N711: WHITE | P711: MILLS | R711: WADDELL
A713: ROUND 16 | E713: 15TH AUGUST | J713: WEATHER | M713: WEST WIND RAIN IN 3RD QTR | S713: PLAYED AT
D714: 1ST QTR | H714: 2ND QTR | L714: 3RD QTR | P714: FINAL | S714: YARRAVILLE
A715: SANDRINGHAM | C715: 3 | D715: 4 | E715: =C715*6+D715 -> 22 | G715: 5 | H715: 9 | I715: =G715*6+H715 -> 39 | K715: 12 | L715: 10 | M715: =K715*6+L715 -> 82 | O715: 16 | P715: 12 | Q715: =O715*6+P715 -> 108 | S715: UMPIRE | X715: LADDER | AB715: ROUND | AD715: 16
A716: YARRAVILLE | C716: 0 | D716: 3 | E716: =C716*6+D716 -> 3 | G716: 4 | H716: 8 | I716: =G716*6+H716 -> 32 | K716: 7 | L716: 11 | M716: =K716*6+L716 -> 53 | O716: 12 | P716: 18 | Q716: =O716*6+P716 -> 90 | S716: O'NEILL
A717: BEST PLAYERS | W717: TEAM | X717: W | Y717: L | Z717: D | AA717: FOR | AB717: AGST | AC717: % | AD717: PTS
A718: SANDRINGHAM | C718: BURNS | F718: SMART | I718: CLIFFORD | L718: WILLS | O718: GLEESON | R718: HOAR
A719: YARRAVILLE | C719: CONNELLY | F719: KNOTT | I719: RON BROWN | L719: WARWICK | O719: CURRIE | R719: PIOVESAN | W719: WILLIAMSTOWN | X719: 13 | Y719: 3 | Z719: 0 | AA719: 1364 | AB719: 1183 | AC719: 115.3 | AD719: 52
A720: GOALKICKERS | W720: PORT MELBOURNE | X720: 12 | Y720: 4 | Z720: 0 | AA720: 1464 | AB720: 1216 | AC720: 120.39473684210526 | AD720: 48
A721: SANDRINGHAM | C721: BURNS 6 | F721: SMART 4 | I721: STRACHAN 3 | L721: CLIFFORD | O721: BURKE | Q721: GLEESON | W721: COBURG | X721: 11 | Y721: 5 | Z721: 0 | AA721: 1437 | AB721: 1190 | AC721: 120.76 | AD721: 44
A722: YARRAVILLE | C722: PIOVESAN 6 | F722: CONNELLY 3 | I722: RON BROWN | L722: CLEGG | N722: EDWARDS | W722: SANDRINGHAM | X722: 11 | Y722: 5 | Z722: 0 | AA722: 1458 | AB722: 1339 | AC722: 108.88722927557879 | AD722: 44
A724: BRUNSWICK | C724: 1 | D724: 1 | E724: =C724*6+D724 -> 7 | G724: 3 | H724: 3 | I724: =G724*6+H724 -> 21 | K724: 5 | L724: 5 | M724: =K724*6+L724 -> 35 | O724: 8 | P724: 7 | Q724: =O724*6+P724 -> 55 | S724: BRUNSWICK | W724: YARRAVILLE | X724: 9 | Y724: 7 | Z724: 0 | AA724: 1518 | AB724: 1460 | AC724: 103.97260273972603 | AD724: 36
A725: OAKLEIGH | C725: 3 | D725: 2 | E725: =C725*6+D725 -> 20 | G725: 4 | H725: 3 | I725: =G725*6+H725 -> 27 | K725: 7 | L725: 4 | M725: =K725*6+L725 -> 46 | O725: 8 | P725: 5 | Q725: =O725*6+P725 -> 53 | S725: HORNE | W725: DANDENONG | X725: 6 | Y725: 9 | Z725: 1 | AA725: 1215 | AB725: 1138 | AC725: 106.76625659050967 | AD725: 26
A726: BEST PLAYERS | W726: BRUNSWICK | X726: 5 | Y726: 10 | Z726: 1 | AA726: 1071 | AB726: 1269 | AC726: 84.4 | AD726: 22
A727: BRUNSWICK | C727: BRIGLIA | F727: THOMPSON | I727: LEYDIN | L727: DARBY | O727: McGRATH | R727: DILLON | W727: OAKLEIGH | X727: 5 | Y727: 11 | Z727: 0 | AA727: 1273 | AB727: 1380 | AC727: 92.246376811594203 | AD727: 20
A728: OAKLEIGH | C728: JONES | F728: MULDOON | I728: MAUGHAN | L728: ADDISON | O728: LOTHIAN | R728: HAINING | W728: PRESTON | X728: 3 | Y728: 12 | Z728: 1 | AA728: 1300 | AB728: 1500 | AC728: 86.666666666666671 | AD728: 14
A729: GOALKICKERS | W729: WAVERLEY | X729: 3 | Y729: 12 | Z729: 1 | AA729: 1178 | AB729: 1603 | AC729: 73.48721147847786 | AD729: 14
A730: BRUNSWICK | C730: COOK 3 | F730: KICK | H730: DARBY | J730: DILLON | L730: LEYDIN | N730: WICKS
A731: OAKLEIGH | C731: JONES 3 | F731: MULDOON | I731: McLAREN | K731: LOTHIAN | M731: RICCI | O731: MAUGHAN
A733: PORT MELBOURNE | C733: 1 | D733: 3 | E733: =C733*6+D733 -> 9 | G733: 6 | H733: 5 | I733: =G733*6+H733 -> 41 | K733: 8 | L733: 9 | M733: =K733*6+L733 -> 57 | O733: 11 | P733: 9 | Q733: =O733*6+P733 -> 75 | S733: WAVERLEY
A734: WAVERLEY | C734: 1 | D734: 5 | E734: =C734*6+D734 -> 11 | G734: 1 | H734: 8 | I734: =G734*6+H734 -> 14 | K734: 2 | L734: 10 | M734: =K734*6+L734 -> 22 | O734: 6 | P734: 11 | Q734: =O734*6+P734 -> 47 | S734: JACKSON
A735: BEST PLAYERS
A736: PORT MELBOURNE | C736: TAGGART | F736: CROSHER | I736: RENOUF | L736: FREYER | N736: PERRY | Q736: CARLILE
A737: WAVERLEY | C737: ELLIS | F737: MITHEN | I737: HUDSON | L737: LEE | N737: THOROGOOD | Q737: PETZKE
A738: GOALKICKERS
A739: PORT MELBOURNE | C739: PERRY 3 | F739: JEFFREY 3 | I739: MILNER 3 | L739: TAGGART | O739: FREYER
A740: WAVERLEY | C740: PIPER 3 | F740: INGWERSON | I740: NATION | L740: CULPIN
D741: 16TH AUGUST | I741: WEATHER | L741: WIND & RAIN
A742: COBURG | C742: 2 | D742: 0 | E742: =C742*6+D742 -> 12 | G742: 6 | H742: 1 | I742: =G742*6+H742 -> 37 | K742: 9 | L742: 3 | M742: =K742*6+L742 -> 57 | O742: 13 | P742: 7 | Q742: =O742*6+P742 -> 85 | S742: DANDENONG
A743: DANDENONG | C743: 1 | D743: 2 | E743: =C743*6+D743 -> 8 | G743: 2 | H743: 2 | I743: =G743*6+H743 -> 14 | K743: 5 | L743: 4 | M743: =K743*6+L743 -> 34 | O743: 6 | P743: 4 | Q743: =O743*6+P743 -> 40 | S743: ROWE
A744: BEST PLAYERS
A745: COBURG | C745: KEEFER | F745: BARCLAY | I745: WELSH | L745: GOTCH | N745: L BRIMACOMBE | R745: RIST
A746: DANDENONG | C746: BARRAN | F746: PIVETTA | I746: BAPTIST | L746: KENT | N746: ABRAHAM | R746: OSBORNE
A747: GOALKICKERS
A748: COBURG | C748: BYRON 5 | F748: L BRIMACOMBE 3 | J748: GOTCH 3 | M748: FITZPATRICK 2 | Q748: FORAN
A749: DANDENONG | C749: ABRAHAM 2 | F749: OSBORNE | I749: HILL | K749: KENT | M749: O'CONNELL
A751: PRESTON | C751: 4 | D751: 1 | E751: =C751*6+D751 -> 25 | G751: 10 | H751: 6 | I751: =G751*6+H751 -> 66 | K751: 12 | L751: 9 | M751: =K751*6+L751 -> 81 | O751: 23 | P751: 11 | Q751: =O751*6+P751 -> 149 | S751: PRESTON
A752: WILLIAMSTOWN | C752: 3 | D752: 4 | E752: =C752*6+D752 -> 22 | G752: 3 | H752: 6 | I752: =G752*6+H752 -> 24 | K752: 12 | L752: 8 | M752: =K752*6+L752 -> 80 | O752: 12 | P752: 9 | Q752: =O752*6+P752 -> 81 | S752: FLANAGAN
A753: BEST PLAYERS
A754: PRESTON | C754: JAMES | F754: WATSON | I754: RYAN | L754: WALKER | O754: MURNANE | R754: CLARKE
A755: WILLIAMSTOWN | C755: SAVIGE | F755: JENKINSON | I755: McASEY | L755: LEONARD | O755: WARD
A756: GOALKICKERS
A757: PRESTON | C757: WALKER 6 | F757: MURNANE 5 | I757: ALEXANDER 3 | L757: CLARKE 2 | N757: PARRIS 2 | P757: MILLER | R757: JAMES | T757: WADDELL | W757: MUIR
A758: WILLIAMSTOWN | C758: JAMES 3 | F758: JENKINSON 2 | I758: TURNER 2 | L758: McASEY 2 | N758: MALONEY | Q758: WILLIAMS | S758: CLOUGH
A760: ROUND 17 | E760: 22ND AUGUST | J760: WEATHER | N760: NORTH WEST WIND FINE | S760: PLAYED AT
D761: 1ST QTR | H761: 2ND QTR | L761: 3RD QTR | P761: FINAL | S761: DANDENONG
A762: DANDENONG | C762: 0 | D762: 1 | E762: =C762*6+D762 -> 1 | G762: 4 | H762: 8 | I762: =G762*6+H762 -> 32 | K762: 6 | L762: 12 | M762: =K762*6+L762 -> 48 | O762: 12 | P762: 17 | Q762: =O762*6+P762 -> 89 | S762: UMPIRE | X762: LADDER | AB762: ROUND | AD762: 17
A763: PORT MELBOURNE | C763: 2 | D763: 2 | E763: =C763*6+D763 -> 14 | G763: 2 | H763: 2 | I763: =G763*6+H763 -> 14 | K763: 7 | L763: 6 | M763: =K763*6+L763 -> 48 | O763: 8 | P763: 8 | Q763: =O763*6+P763 -> 56 | S763: HORNE
A764: BEST PLAYERS | W764: TEAM | X764: W | Y764: L | Z764: D | AA764: FOR | AB764: AGST | AC764: % | AD764: PTS
A765: DANDENONG | C765: PENNEFATHER | F765: PIVETTA | I765: ABRAHAM | L765: HILL | O765: SCHMIDT | R765: BARRAN
A766: PORT MELBOURNE | C766: PERRY | F766: TAGGART | I766: BOWEN | L766: CARLILE | O766: STRAUCH | R766: MITHEN | W766: WILLIAMSTOWN | X766: 14 | Y766: 3 | Z766: 0 | AA766: 1459 | AB766: 1245 | AC766: 117.19 | AD766: 56
A767: GOALKICKERS | W767: COBURG | X767: 12 | Y767: 5 | Z767: 0 | AA767: 1545 | AB767: 1231 | AC767: 125.51 | AD767: 48
A768: DANDENONG | C768: WHALEBONE 3 | F768: SCHMIDT 2 | I768: KENT 2 | K768: OSBORNE | M768: HILL | N768: GRAVENER | Q768: ABRAHAM | S768: KINSELLA | W768: PORT MELBOURNE | X768: 12 | Y768: 5 | Z768: 0 | AA768: 1520 | AB768: 1305 | AC768: 116.47509578544062 | AD768: 48
A769: PORT MELBOURNE | C769: TAGGART 2 | F769: PERRY 2 | I769: JEFFREY 2 | L769: MITHEN | N769: CARLILE | W769: SANDRINGHAM | X769: 12 | Y769: 5 | Z769: 0 | AA769: 1607 | AB769: 1426 | AC769: 112.69284712482468 | AD769: 48
A771: SANDRINGHAM | C771: 7 | D771: 2 | E771: =C771*6+D771 -> 44 | G771: 12 | H771: 10 | I771: =G771*6+H771 -> 82 | K771: 15 | L771: 14 | M771: =K771*6+L771 -> 104 | O771: 21 | P771: 23 | Q771: =O771*6+P771 -> 149 | S771: BEACH ROAD | W771: YARRAVILLE | X771: 10 | Y771: 7 | Z771: 0 | AA771: 1610 | AB771: 1549 | AC771: 103.9380245319561 | AD771: 40
A772: BRUNSWICK | C772: 2 | D772: 2 | E772: =C772*6+D772 -> 14 | G772: 6 | H772: 9 | I772: =G772*6+H772 -> 45 | K772: 10 | L772: 13 | M772: =K772*6+L772 -> 73 | O772: 12 | P772: 15 | Q772: =O772*6+P772 -> 87 | S772: ROWE | W772: DANDENONG | X772: 7 | Y772: 9 | Z772: 1 | AA772: 1304 | AB772: 1194 | AC772: 109.21273031825795 | AD772: 30
A773: BEST PLAYERS | W773: BRUNSWICK | X773: 5 | Y773: 11 | Z773: 1 | AA773: 1158 | AB773: 1418 | AC773: 81.66 | AD773: 22
A774: SANDRINGHAM | C774: MUTER | F774: O'TOOLE | I774: BURKE | L774: HOAR | O774: STRACHAN | R774: HANCE | W774: OAKLEIGH | X774: 5 | Y774: 12 | Z774: 0 | AA774: 1335 | AB774: 1475 | AC774: 90.508474576271183 | AD774: 20
A775: BRUNSWICK | C775: McGRATH | F775: COOK | I775: LEYDIN | L775: THOMPSON | O775: CLELAND | R775: BIBBY | W775: PRESTON | X775: 3 | Y775: 13 | Z775: 1 | AA775: 1389 | AB775: 1592 | AC775: 87.248743718592962 | AD775: 14
A776: GOALKICKERS | W776: WAVERLEY | X776: 3 | Y776: 13 | Z776: 1 | AA776: 1219 | AB776: 1711 | AC776: 71.244886031560497 | AD776: 14
A777: SANDRINGHAM | C777: O'TOOLE 7 | F777: SMART 5 | I777: STRACHAN 4 | L777: BURKE 4 | O777: GLEESON
A778: BRUNSWICK | C778: COOK 5 | F778: KICK 2 | I778: DENTON 2 | L778: ROBINSON 2 | O778: CLELAND
A780: YARRAVILLE | C780: 1 | D780: 0 | E780: =C780*6+D780 -> 6 | G780: 9 | H780: 5 | I780: =G780*6+H780 -> 59 | K780: 10 | L780: 9 | M780: =K780*6+L780 -> 69 | O780: 13 | P780: 14 | Q780: =O780*6+P780 -> 92 | S780: PRESTON
A781: PRESTON | C781: 3 | D781: 6 | E781: =C781*6+D781 -> 24 | G781: 4 | H781: 6 | I781: =G781*6+H781 -> 30 | K781: 7 | L781: 12 | M781: =K781*6+L781 -> 54 | O781: 12 | P781: 17 | Q781: =O781*6+P781 -> 89 | S781: McMASTER
A782: BEST PLAYERS
A783: YARRAVILLE | C783: RON BROWN | F783: EDWARDS | I783: BARROW | L783: KNOTT | O783: QUARANTOTTO | S783: CONNELLY
A784: PRESTON | C784: PARRIS | F784: JAMES | I784: BOYLE | L784: MURNANE | O784: WADDELL | S784: ALEXANDER
A785: GOALKICKERS
A786: YARRAVILLE | C786: RON BROWN 5 | F786: MEDDINGS 2 | I786: CONNELLY 2 | L786: PIOVESAN | N786: EDWARDS | Q786: ALLEN | S786: QUARANTOTTO
A787: PRESTON | C787: WALKER 4 | F787: ALEXANDER 2 | I787: CLARKE 2 | L787: JAMES | N787: PARRIS | Q787: MUIR | S787: HANVIN
A789: WILLIAMSTOWN | C789: 3 | D789: 7 | E789: =C789*6+D789 -> 25 | G789: 4 | H789: 10 | I789: =G789*6+H789 -> 34 | K789: 6 | L789: 13 | M789: =K789*6+L789 -> 49 | O789: 13 | P789: 17 | Q789: =O789*6+P789 -> 95 | S789: WILLIAMSTOWN
A790: OAKLEIGH | C790: 2 | D790: 4 | E790: =C790*6+D790 -> 16 | G790: 5 | H790: 5 | I790: =G790*6+H790 -> 35 | K790: 8 | L790: 7 | M790: =K790*6+L790 -> 55 | O790: 9 | P790: 8 | Q790: =O790*6+P790 -> 62 | S790: POLLARD
A791: BEST PLAYERS
A792: WILLIAMSTOWN | C792: CARMICHAEL | F792: BEAMISH | I792: JENKINSON | L792: RAILTON | O792: TAUBE | R792: MCASEY
A793: OAKLEIGH | C793: McLAREN | F793: KITTO | I793: DOWDELL | L793: JONES | O793: LOTHIAN | R793: WOODS
A794: GOALKICKERS
A795: WILLIAMSTOWN | C795: CARMICHAEL 6 | G795: BEAMISH 2 | J795: JENKINSON | M795: TURNER | O795: MURPHY | Q795: WARE | S795: MCASEY
A796: OAKLEIGH | C796: McLAREN 3 | G796: KITTO 2 | J796: DOWDELL 2 | M796: JONES | O796: RICCI
A798: COBURG | C798: 4 | D798: 8 | E798: =C798*6+D798 -> 32 | G798: 8 | H798: 9 | I798: =G798*6+H798 -> 57 | K798: 12 | L798: 16 | M798: =K798*6+L798 -> 88 | O798: 15 | P798: 18 | Q798: =O798*6+P798 -> 108 | S798: COBURG
A799: WAVERLEY | C799: 0 | D799: 0 | E799: =C799*6+D799 -> 0 | G799: 2 | H799: 5 | I799: =G799*6+H799 -> 17 | K799: 3 | L799: 9 | M799: =K799*6+L799 -> 27 | O799: 5 | P799: 11 | Q799: =O799*6+P799 -> 41 | S799: FROOD
A800: BEST PLAYERS
A801: COBURG | C801: BARCLAY | F801: GOTCH | I801: BYRON | L801: MURRAY | O801: KEEFER | R801: L BRIMACOMBE
A802: WAVERLEY | C802: ELLIS | F802: NATION | I802: THOROGOOD | L802: ALEXANDER | O802: MARTIN | R802: MITHEN
A803: GOALKICKERS
A804: COBURG | C804: BYRON 4 | E804: KEEFER 2 | G804: L BRIMACOMBE 2 | K804: BARCLAY 2 | N804: GOTCH 2 | Q804: J BRIMACOMBE | U804: FITZPATRICK | X804: MURRAY
A805: WAVERLEY | C805: NATION 2 | F805: MITHEN | H805: HUDSON | J805: ELLIS
A807: ROUND 18 | E807: 29TH AUGUST | I807: WEATHER | L807: SOUTH BREEZE RAIN GROUNDS HEAVY | S807: PLAYED AT
D808: 1ST QTR | H808: 2ND QTR | L808: 3RD QTR | P808: FINAL | S808: PORT MELBOURNE
A809: PORT MELBOURNE | C809: 6 | D809: 4 | E809: =C809*6+D809 -> 40 | G809: 11 | H809: 7 | I809: =G809*6+H809 -> 73 | K809: 15 | L809: 11 | M809: =K809*6+L809 -> 101 | O809: 19 | P809: 11 | Q809: =O809*6+P809 -> 125 | S809: UMPIRE | X809: LADDER | AB809: ROUND | AD809: 18
A810: WILLIAMSTOWN | C810: 2 | D810: 5 | E810: =C810*6+D810 -> 17 | G810: 7 | H810: 8 | I810: =G810*6+H810 -> 50 | K810: 11 | L810: 14 | M810: =K810*6+L810 -> 80 | O810: 15 | P810: 18 | Q810: =O810*6+P810 -> 108 | S810: FROOD
A811: BEST PLAYERS | W811: TEAM | X811: W | Y811: L | Z811: D | AA811: FOR | AB811: AGST | AC811: % | AD811: PTS
A812: PORT MELBOURNE | C812: FREYER | F812: MITHEN | I812: PERRY | L812: JEFFREY | O812: STRAUCH | R812: KERR
A813: WILLIAMSTOWN | C813: JENKINSON | F813: McASEY | I813: MURRIE | L813: O'TOOLE | O813: TURNER | R813: TAUBE | W813: WILLIAMSTOWN | X813: 14 | Y813: 4 | Z813: 0 | AA813: 1567 | AB813: 1370 | AC813: 114.38 | AD813: 56
A814: GOALKICKERS | W814: PORT MELBOURNE | X814: 13 | Y814: 5 | Z814: 0 | AA814: 1645 | AB814: 1413 | AC814: 116.41896673743807 | AD814: 52
A815: PORT MELBOURNE | C815: PERRY 7 | E815: JEFFREY 5 | G815: CARLILE 2 | J815: MILNER 2 | M815: TAGGART | O815: MITHEN | Q815: HOUSE | W815: SANDRINGHAM | X815: 13 | Y815: 5 | Z815: 0 | AA815: 1712 | AB815: 1495 | AC815: 114.51505016722408 | AD815: 52
A816: WILLIAMSTOWN | C816: McASEY 6 | F816: JENKINSON 3 | I816: TURNER 3 | L816: CARMICHAEL | O816: MURPHY | Q816: BEAMISH | W816: COBURG | X816: 12 | Y816: 6 | Z816: 0 | AA816: 1620 | AB816: 1312 | AC816: 123.48 | AD816: 48
A818: WAVERLEY | C818: 3 | D818: 3 | E818: =C818*6+D818 -> 21 | G818: 5 | H818: 4 | I818: =G818*6+H818 -> 34 | K818: 9 | L818: 7 | M818: =K818*6+L818 -> 61 | O818: 15 | P818: 9 | Q818: =O818*6+P818 -> 99 | S818: WAVERLEY | W818: YARRAVILLE | X818: 11 | Y818: 7 | Z818: 0 | AA818: 1691 | AB818: 1624 | AC818: 104.1256157635468 | AD818: 44
A819: PRESTON | C819: 5 | D819: 4 | E819: =C819*6+D819 -> 34 | G819: 5 | H819: 10 | I819: =G819*6+H819 -> 40 | K819: 7 | L819: 10 | M819: =K819*6+L819 -> 52 | O819: 8 | P819: 14 | Q819: =O819*6+P819 -> 62 | S819: HORNE | W819: DANDENONG | X819: 8 | Y819: 9 | Z819: 1 | AA819: 1382 | AB819: 1258 | AC819: 109.85691573926869 | AD819: 34
A820: BEST PLAYERS | W820: BRUNSWICK | X820: 5 | Y820: 12 | Z820: 1 | AA820: 1222 | AB820: 1496 | AC820: 81.68 | AD820: 22
A821: WAVERLEY | C821: NATION | F821: INGWERSON | I821: FLINN | L821: SCOTT | O821: PIPER | R821: THOROGOOD | W821: OAKLEIGH | X821: 5 | Y821: 13 | Z821: 0 | AA821: 1404 | AB821: 1580 | AC821: 88.860759493670884 | AD821: 20
A822: PRESTON | C822: JAMES | F822: ALEXANDER | I822: PINFOLD | L822: DIXON | O822: WADDELL | R822: BOYLE | W822: WAVERLEY | X822: 4 | Y822: 13 | Z822: 1 | AA822: 1318 | AB822: 1773 | AC822: 74.337281443880428 | AD822: 18
A823: GOALKICKERS | W823: PRESTON | X823: 3 | Y823: 14 | Z823: 1 | AA823: 1451 | AB823: 1691 | AC823: 85.807214665878178 | AD823: 14
A824: WAVERLEY | C824: SCOTT 3 | E824: INGWERSON 3 | H824: NATION 3 | J824: ALEXANDER 3 | M824: PIPER | N824: CHAPMAN | Q824: PETZKE
A825: PRESTON | C825: DIXON 3 | F825: WADDELL 2 | I825: PARRIS | K825: ALEXANDER | N825: HANVIN
A827: YARRAVILLE | C827: 5 | D827: 4 | E827: =C827*6+D827 -> 34 | G827: 6 | H827: 6 | I827: =G827*6+H827 -> 42 | K827: 10 | L827: 13 | M827: =K827*6+L827 -> 73 | O827: 11 | P827: 15 | Q827: =O827*6+P827 -> 81 | S827: YARRAVILLE
A828: COBURG | C828: 3 | D828: 2 | E828: =C828*6+D828 -> 20 | G828: 6 | H828: 10 | I828: =G828*6+H828 -> 46 | K828: 7 | L828: 12 | M828: =K828*6+L828 -> 54 | O828: 10 | P828: 15 | Q828: =O828*6+P828 -> 75 | S828: O'NEILL
A829: BEST PLAYERS
A830: YARRAVILLE | C830: RON BROWN | F830: CONNELLY | I830: WARWICK | L830: PIOVESAN | O830: KNOTT | Q830: QUARANTOTTO
A831: COBURG | C831: BARCLAY | F831: TANCREDI | I831: SULLIVAN | L831: GOTCH | O831: BYRON | Q831: McNABB
A832: GOALKICKERS
A833: YARRAVILLE | C833: PIOVESAN 3 | F833: CONNELLY 3 | I833: RON BROWN 2 | L833: ALLEN | N833: WARWICK | Q833: QUARANTOTTO
A834: COBURG | C834: GOTCH 2 | F834: BYRON 2 | I834: BARCLAY 2 | L834: KEEFER 2 | N834: WELSH | Q834: MURRAY
A836: DANDENONG | C836: 4 | D836: 1 | E836: =C836*6+D836 -> 25 | G836: 6 | H836: 5 | I836: =G836*6+H836 -> 41 | K836: 8 | L836: 7 | M836: =K836*6+L836 -> 55 | O836: 11 | P836: 12 | Q836: =O836*6+P836 -> 78 | S836: BRUNSWICK
A837: BRUNSWICK | C837: 1 | D837: 3 | E837: =C837*6+D837 -> 9 | G837: 4 | H837: 5 | I837: =G837*6+H837 -> 29 | K837: 7 | L837: 7 | M837: =K837*6+L837 -> 49 | O837: 9 | P837: 10 | Q837: =O837*6+P837 -> 64 | S837: POLLARD
A838: BEST PLAYERS
A839: DANDENONG | C839: WHALEBONE | F839: PENNEFATHER | I839: OSBORNE | L839: GRAVENER | O839: O'CONNELL | R839: KENT
A840: BRUNSWICK | C840: KICK | F840: DAVIS | I840: WHILEY | L840: DARBY | O840: LEYDIN | R840: WICKS
A841: GOALKICKERS
A842: DANDENONG | C842: WHALEBONE 3 | F842: KENT 3 | H842: ARMSTRONG 2 | K842: SCHMIDT | M842: PIVETTA | O842: O'CONNELL
A843: BRUNSWICK | C843: COOK 3 | F843: DAVIS 3 | I843: BRIGLIA | K843: DENTON | M843: BOWTELL
A845: SANDRINGHAM | C845: 5 | D845: 5 | E845: =C845*6+D845 -> 35 | G845: 7 | H845: 10 | I845: =G845*6+H845 -> 52 | K845: 11 | L845: 13 | M845: =K845*6+L845 -> 79 | O845: 15 | P845: 15 | Q845: =O845*6+P845 -> 105 | S845: OAKLEIGH
A846: OAKLEIGH | C846: 2 | D846: 3 | E846: =C846*6+D846 -> 15 | G846: 4 | H846: 4 | I846: =G846*6+H846 -> 28 | K846: 5 | L846: 10 | M846: =K846*6+L846 -> 40 | O846: 9 | P846: 15 | Q846: =O846*6+P846 -> 69 | S846: McMASTER
A847: BEST PLAYERS
A848: SANDRINGHAM | C848: HARRISON | F848: BURNS | I848: BURKE | L848: KENNEDY | O848: HOAR | R848: SMART
A849: OAKLEIGH | C849: JONES | F849: KITTO | I849: McCORKELL | L849: LOTHIAN | O849: MULDOON | R849: JORDAN
A850: GOALKICKERS
A851: SANDRINGHAM | C851: SMART 4 | F851: BURNS 4 | I851: O'TOOLE 2 | L851: STRACHAN 2 | O851: BURKE | Q851: WILLS | S851: HARRISON
A852: OAKLEIGH | C852: CUNNINGHAM 2 | F852: JORDAN | H852: MAUGHAN | J852: LOVELESS | M852: BERRIMAN | P852: McNEILL | R852: LOTHIAN | U852: HAINING
A854: FINALS
A855: 1ST SEMI | D855: 5TH SEPTEMBER | I855: WEATHER | L855: WEST BREEZE DULL CLOUDY
D856: 1ST QTR | H856: 2ND QTR | L856: 3RD QTR | P856: FINAL
A857: COBURG | C857: 4 | D857: 6 | E857: =C857*6+D857 -> 30 | G857: 9 | H857: 11 | I857: =G857*6+H857 -> 65 | K857: 14 | L857: 17 | M857: =K857*6+L857 -> 101 | O857: 19 | P857: 18 | Q857: =O857*6+P857 -> 132 | S857: PORT MELBOURNE
A858: SANDRINGHAM | C858: 2 | D858: 0 | E858: =C858*6+D858 -> 12 | G858: 7 | H858: 6 | I858: =G858*6+H858 -> 48 | K858: 10 | L858: 8 | M858: =K858*6+L858 -> 68 | O858: 12 | P858: 11 | Q858: =O858*6+P858 -> 83 | S858: HORNE
A859: BEST PLAYERS
A860: COBURG | C860: WELSH | F860: J BRIMACOMBE | I860: L BRIMACOMBE | L860: BYRON | O860: TANCREDI | R860: GOTCH
A861: SANDRINGHAM | C861: O'TOOLE | F861: SHEEHAN | I861: STRACHAN | L861: HARRISON | O861: PETERS | R861: SMART
A862: GOALKICKERS
A863: COBURG | C863: KEEFER 3 | E863: BYRON 3 | G863: McNABB 2 | J863: J BRIMACOMBE 2 | N863: L BRIMACOMBE 2 | R863: FITZPATRICK 2 | V863: RIST 2 | X863: BARCLAY 2 | AA863: HARRISON
A864: SANDRINGHAM | C864: O'TOOLE 4 | F864: SMART 4 | I864: SHEEHAN 2 | L864: HARRISON | O864: HANCE
A866: 2ND SEMI | D866: 12TH SEPTEMBER | I866: WEATHER | K866: WEST WIND GROUND MUDDY HEAVY RAIN 2ND QTR
A867: PORT MELBOURNE | C867: 1 | D867: 0 | E867: =C867*6+D867 -> 6 | G867: 8 | H867: 3 | I867: =G867*6+H867 -> 51 | K867: 14 | L867: 4 | M867: =K867*6+L867 -> 88 | O867: 20 | P867: 6 | Q867: =O867*6+P867 -> 126 | S867: PORT MELBOURNE
A868: WILLIAMSTOWN | C868: 4 | D868: 13 | E868: =C868*6+D868 -> 37 | G868: 5 | H868: 17 | I868: =G868*6+H868 -> 47 | K868: 9 | L868: 18 | M868: =K868*6+L868 -> 72 | O868: 9 | P868: 20 | Q868: =O868*6+P868 -> 74 | S868: ROWE
A869: BEST PLAYERS
A870: PORT MELBOURNE | C870: CROSHER | F870: JEFFREY | I870: MITHEN | L870: TAGGART | O870: PERRY | R870: RENOUF
A871: WILLIAMSTOWN | C871: McASEY | F871: RAILTON | I871: CARMICHAEL | L871: MALONEY | O871: JENKINSON | R871: WARE
A872: GOALKICKERS
A873: PORT MELBOURNE | C873: JEFFREY 4 | F873: MILNER 3 | I873: PERRY 3 | K873: FREYER 3 | M873: TAGGART 2 | P873: RENOUF | R873: MITHEN | T873: EDWARDS | W873: BOWEN | X873: CARLILE
A874: WILLIAMSTOWN | C874: MALONEY 3 | F874: WILLIAMS 3 | I874: JENKINSON 2 | L874: CLOUGH
A876: PRELIMINARY FINAL | F876: 19TH SEPTEMBER | K876: WEATHER | N876: NORTH WEST WIND FINE & SUNNY
A877: WILLIAMSTOWN | C877: 3 | D877: 5 | E877: =C877*6+D877 -> 23 | G877: 3 | H877: 7 | I877: =G877*6+H877 -> 25 | K877: 7 | L877: 9 | M877: =K877*6+L877 -> 51 | O877: 12 | P877: 15 | Q877: =O877*6+P877 -> 87 | S877: PORT MELBOURNE
A878: COBURG | C878: 2 | D878: 2 | E878: =C878*6+D878 -> 14 | G878: 3 | H878: 5 | I878: =G878*6+H878 -> 23 | K878: 6 | L878: 12 | M878: =K878*6+L878 -> 48 | O878: 10 | P878: 13 | Q878: =O878*6+P878 -> 73 | S878: O'NEILL
A879: BEST PLAYERS
A880: WILLIAMSTOWN | C880: RUSSELL | F880: MALONEY | I880: RAILTON | L880: WARD | N880: BEAMISH | Q880: WARE
A881: COBURG | C881: WELSH | F881: COLBERT | I881: CLEMENTS | L881: GOTCH | N881: RIST | Q881: J BRIMACOMBE
A882: GOALKICKERS
A883: WILLIAMSTOWN | C883: CARMICHAEL 5 | F883: JENKINSON 2 | I883: TURNER | K883: MURPHY | M883: WILLIAMS | P883: WARE | R883: BEAMISH
A884: COBURG | C884: RIST 2 | E884: J BRIMACOMBE | H884: L BRIMACOMBE | K884: GOTCH | M884: FITZPATRICK | P884: MURRAY | R884: BYRON | T884: BARCLAY | W884: KEEFER
A886: GRAND FINAL | E886: 26TH SEPTEMBER | J886: WEATHER | M886: NORTH WIND FINE
A887: PORT MELBOURNE | C887: 7 | D887: 5 | E887: 47 | G887: 9 | H887: 8 | I887: 62 | K887: 11 | L887: 9 | M887: 75 | O887: 14 | P887: 17 | Q887: =O887*6+P887 -> 101 | S887: PORT MELBOURNE
A888: WILLIAMSTOWN | C888: 1 | D888: 0 | E888: 6 | G888: 4 | H888: 2 | I888: 26 | K888: 6 | L888: 4 | M888: 40 | O888: 10 | P888: 5 | Q888: =O888*6+P888 -> 65 | S888: ROWE
A889: BEST PLAYERS
A890: PORT MELBOURNE | C890: FREYER | F890: TAGGART | I890: CROSHER | L890: KERR | N890: STRAUCH | Q890: MITHEN
A891: WILLIAMSTOWN | C891: RUSSELL | F891: RAILTON | I891: WARD | L891: WARE | N891: CARMICHAEL | Q891: LEONARD
A892: GOALKICKERS
A893: PORT MELBOURNE | C893: FREYER 4 | F893: MILNER 4 | I893: BOWEN 3 | K893: TAGGART | M893: CASTLEHOW | P893: JEFFREY
A894: WILLIAMSTOWN | C894: CARMICHAEL 3 | F894: WARE 3 | I894: RAILTON 2 | L894: JENKINSON | O894: FITCH
A896: REPRESENTATIVE MATCH | G896: 7TH JUNE
A897: V.F.A. | C897: 5 | D897: 2 | E897: =C897*6+D897 -> 32 | G897: 7 | H897: 4 | I897: =G897*6+H897 -> 46 | K897: 12 | L897: 7 | M897: =K897*6+L897 -> 79 | O897: 14 | P897: 11 | Q897: =O897*6+P897 -> 95 | S897: LAUNCESTON
A898: TASMANIA | C898: 3 | D898: 2 | E898: =C898*6+D898 -> 20 | G898: 6 | H898: 6 | I898: =G898*6+H898 -> 42 | K898: 7 | L898: 6 | M898: =K898*6+L898 -> 48 | O898: 10 | P898: 8 | Q898: =O898*6+P898 -> 68 | S898: HODGSON (V.F.L.)
A899: BEST PLAYERS
A900: V.F.A. | C900: CROSBIE | F900: FREYER | I900: PENNEFATHER | L900: GUTTERSON | O900: BURNS | R900: BYRON
A901: TASMANIA | C901: RUMNEY | F901: WHITTON | I901: MOLES | L901: MARNEY | O901: THOMPSON | R901: JOHNSON
A902: GOALKICKERS
A903: V.F.A. | C903: BURNS 4 | F903: BYRON 3 | I903: WHALEBONE 2 | L903: COOK | N903: SHEEHAN | P903: MEDDINGS | R903: CROSBIE | U903: LAVER
A904: TASMANIA | C904: HUDSON 3 | F904: WITHERS 2 | I904: MARNEY 2 | L904: THOMPSON | N904: CONLAN | Q904: WHITTON