A1: Victorian Football Association
A2: Season 1964 - Division Two
A3: © Copyright Wal Williams | F3: First created: 28 March 2016
A4: Contact: joywalwi at gmail dot com | F4: Last updated: 28 March 2016 | W4: VFA Results and tables - Link to the main index page
A5: You are free to copy this document in whole or part provided that proper acknowledgement is given to the author. All rights reserved.
A7: 1964 | D7: 2ND DIVISION
A8: ROUND 1 | E8: 12TH APRIL | I8: WEATHER | S8: PLAYED AT
D9: 1ST QTR | H9: 2ND QTR | L9: 3RD QTR | P9: FINAL | S9: BOX HILL
A10: CAMBERWELL | E10: =C10*6+D10 -> 0 | I10: =G10*6+H10 -> 0 | M10: =K10*6+L10 -> 0 | O10: 15 | P10: 10 | Q10: =O10*6+P10 -> 100 | S10: TOORAK PARK | X10: LADDER | AB10: ROUND | AD10: 1
A11: PRAHRAN | E11: =C11*6+D11 -> 0 | I11: =G11*6+H11 -> 0 | M11: =K11*6+L11 -> 0 | O11: 14 | P11: 14 | Q11: =O11*6+P11 -> 98
A12: BEST PLAYERS | W12: TEAM | X12: W | Y12: L | Z12: D | AA12: FOR | AB12: AGST | AC12: % | AD12: PTS
A13: CAMBERWELL | C13: GAUDION | F13: QUIRK | I13: J SMITH | L13: O'NEILL | N13: PEMBERTON
A14: PRAHRAN | C14: GLOVER | F14: SEEDY | I14: RICHARDS | L14: YOUNG | N14: LAMBERT | W14: BRIGHTON-CAULFIELD | X14: 1 | Y14: 0 | Z14: 0 | AA14: 141 | AB14: 85 | AC14: =(AA14*100)/AB14 -> 165.88235294117646 | AD14: =(X14*4)+(Z14*2) -> 4
A15: GOALKICKERS | W15: NORTHCOTE | X15: 1 | Y15: 0 | Z15: 0 | AA15: 95 | AB15: 66 | AC15: =(AA15*100)/AB15 -> 143.93939393939394 | AD15: =(X15*4)+(Z15*2) -> 4
A16: CAMBERWELL | C16: O'NEILL 4 | F16: QUIRK 4 | I16: SMITH 3 | K16: McKERNAN 2 | N16: ADAMS | P16: ELLIOTT | W16: SUNSHINE | X16: 1 | Y16: 0 | Z16: 0 | AA16: 79 | AB16: 62 | AC16: =(AA16*100)/AB16 -> 127.41935483870968 | AD16: =(X16*4)+(Z16*2) -> 4
A17: PRAHRAN | C17: R EVANS 4 | F17: RICHARDS 2 | I17: PEARSON 2 | K17: KERLEY | M17: BURGESS | O17: GLOVER | Q17: A EVANS | S17: ROSS | U17: HOGAN | W17: CAMBERWELL | X17: 1 | Y17: 0 | Z17: 0 | AA17: 100 | AB17: 98 | AC17: =(AA17*100)/AB17 -> 102.04081632653062 | AD17: =(X17*4)+(Z17*2) -> 4
A19: NORTHCOTE | E19: =C19*6+D19 -> 0 | I19: =G19*6+H19 -> 0 | M19: =K19*6+L19 -> 0 | O19: 14 | P19: 11 | Q19: =O19*6+P19 -> 95 | S19: BOX HILL | W19: PRAHRAN | X19: 0 | Y19: 1 | Z19: 0 | AA19: 98 | AB19: 100 | AC19: =(AA19*100)/AB19 -> 98 | AD19: =(X19*4)+(Z19*2) -> 0
A20: BOX HILL | E20: =C20*6+D20 -> 0 | I20: =G20*6+H20 -> 0 | M20: =K20*6+L20 -> 0 | O20: 9 | P20: 12 | Q20: =O20*6+P20 -> 66 | W20: MORDIALLOC | X20: 0 | Y20: 1 | Z20: 0 | AA20: 62 | AB20: 79 | AC20: =(AA20*100)/AB20 -> 78.481012658227854 | AD20: =(X20*4)+(Z20*2) -> 0
A21: BEST PLAYERS | W21: BOX HILL | X21: 0 | Y21: 1 | Z21: 0 | AA21: 66 | AB21: 95 | AC21: =(AA21*100)/AB21 -> 69.473684210526315 | AD21: =(X21*4)+(Z21*2) -> 0
A22: NORTHCOTE | C22: T KEAYS | F22: GORDON | I22: CRAMERI | L22: MULLENGER | O22: DOWLING | R22: LAVER | W22: GEELONG WEST | X22: 0 | Y22: 1 | Z22: 0 | AA22: 85 | AB22: 141 | AC22: =(AA22*100)/AB22 -> 60.283687943262414 | AD22: =(X22*4)+(Z22*2) -> 0
A23: BOX HILL | C23: GARDINER | F23: JOHNSTON | I23: BATES | L23: PLUNKETT | O23: P QUINN | R23: ROSS
A24: GOALKICKERS
A25: NORTHCOTE | C25: BAYES 3 | E25: MULLENGER 2 | H25: MISSON 2 | J25: B THOMPSON 2 | M25: LUMBY 2 | O25: BAILEY | Q25: BEITZEL | S25: CRAMERI
A26: BOX HILL | C26: P QUINN 2 | E26: MAHON | G26: BAYES | I26: GARDINER | L26: BATES | N26: McLAUGHLIN | Q26: PORTEOUS | T26: JOHNSTON
A28: BRIGHTON-CAULFIELD | E28: =C28*6+D28 -> 0 | I28: =G28*6+H28 -> 0 | M28: =K28*6+L28 -> 0 | O28: 19 | P28: 27 | Q28: =O28*6+P28 -> 141 | S28: PRINCES PARK, CAULFIELD
A29: GEELONG WEST | E29: =C29*6+D29 -> 0 | I29: =G29*6+H29 -> 0 | M29: =K29*6+L29 -> 0 | O29: 12 | P29: 13 | Q29: =O29*6+P29 -> 85
A30: BEST PLAYERS
A31: BRIGHTON-CAULFIELD | C31: ROWE | F31: K KUPSCH | I31: KEE | L31: ROLFE | N31: GUTTERSON | Q31: BURNS
A32: GEELONG WEST | C32: TRIBE | F32: PERRY | I32: LONG | L32: McCALLUM | O32: VAN T'HAG
A33: GOALKICKERS
A34: BRIGHTON-CAULFIELD | C34: KEE 6 | E34: DIBBIN 4 | G34: FOX 3 | I34: BURNS 2 | K34: ROWE 2 | M34: MOORE | O34: FULLARTON
A35: GEELONG WEST | C35: LONG 2 | E35: PERRY 2 | G35: McDONALD 2 | J35: SELLIN 2 | L35: VAN T'HAG | O35: CROFT | Q35: COOKE | S35: WILLIAMS
A37: SUNSHINE | E37: =C37*6+D37 -> 0 | I37: =G37*6+H37 -> 0 | M37: =K37*6+L37 -> 0 | O37: 9 | P37: 25 | Q37: =O37*6+P37 -> 79 | S37: SUNSHINE
A38: MORDIALLOC | E38: =C38*6+D38 -> 0 | I38: =G38*6+H38 -> 0 | M38: =K38*6+L38 -> 0 | O38: 9 | P38: 8 | Q38: =O38*6+P38 -> 62
A39: BEST PLAYERS
A40: SUNSHINE | C40: CROSBIE | F40: WAPLING | I40: PRIOR | L40: HOWARD | O40: DARUL | Q40: KAVANAGH
A41: MORDIALLOC | C41: STEWART | F41: BATES | I41: LESLIE | L41: BLAINEY | O41: WILSON | Q41: O'BRIEN
A42: GOALKICKERS
A43: SUNSHINE | C43: HOWARD 3 | F43: WAPLING 2 | I43: CROSBIE 2 | L43: McINTYRE | N43: M FITZGERALD
A44: MORDIALLOC | C44: LAIRD 2 | F44: MORRISON | I44: HASSETT | L44: LESLIE | N44: PORTA | P44: BATES | R44: DEAN | T44: O'BRIEN
A46: ROUND 2 | E46: 19TH APRIL | I46: WEATHER | S46: PLAYED AT
D47: 1ST QTR | H47: 2ND QTR | L47: 3RD QTR | P47: FINAL | S47: MORDIALLOC
A48: MORDIALLOC | E48: =C48*6+D48 -> 0 | I48: =G48*6+H48 -> 0 | M48: =K48*6+L48 -> 0 | O48: 15 | P48: 8 | Q48: =O48*6+P48 -> 98 | S48: UMPIRE | X48: LADDER | AB48: ROUND | AD48: 2
A49: BRIGHTON-CAULFIELD | E49: =C49*6+D49 -> 0 | I49: =G49*6+H49 -> 0 | M49: =K49*6+L49 -> 0 | O49: 9 | P49: 10 | Q49: =O49*6+P49 -> 64
A50: BEST PLAYERS | W50: TEAM | X50: W | Y50: L | Z50: D | AA50: FOR | AB50: AGST | AC50: % | AD50: PTS
A51: MORDIALLOC | C51: LESLIE | F51: BATES | I51: HASSETT | L51: MORRISON | O51: FULLER | Q51: WILSON
A52: BRIGHTON-CAULFIELD | C52: BRYAN | F52: KEE | I52: ROWE | L52: BALDRY | O52: J LEE | Q52: FOX | W52: SUNSHINE | X52: 2 | Y52: 0 | Z52: 0 | AA52: 183 | AB52: 134 | AC52: =(AA52*100)/AB52 -> 136.56716417910448 | AD52: =(X52*4)+(Z52*2) -> 8
A53: GOALKICKERS | W53: NORTHCOTE | X53: 2 | Y53: 0 | Z53: 0 | AA53: 178 | AB53: 139 | AC53: =(AA53*100)/AB53 -> 128.05755395683454 | AD53: =(X53*4)+(Z53*2) -> 8
A54: MORDIALLOC | C54: LESLIE 5 | F54: MORRISON 4 | I54: HASSETT 2 | L54: DEAN 2 | N54: O'BRIEN | Q54: BATES | W54: BRIGHTON-CAULFIELD | X54: 1 | Y54: 1 | Z54: 0 | AA54: 205 | AB54: 183 | AC54: =(AA54*100)/AB54 -> 112.02185792349727 | AD54: =(X54*4)+(Z54*2) -> 4
A55: BRIGHTON-CAULFIELD | C55: BRYAN 4 | F55: KEE 2 | H55: FOX 2 | J55: NICHOLLS | W55: MORDIALLOC | X55: 1 | Y55: 1 | Z55: 0 | AA55: 160 | AB55: 143 | AC55: =(AA55*100)/AB55 -> 111.88811188811189 | AD55: =(X55*4)+(Z55*2) -> 4
A57: SUNSHINE | E57: =C57*6+D57 -> 0 | I57: =G57*6+H57 -> 0 | M57: =K57*6+L57 -> 0 | O57: 14 | P57: 20 | Q57: =O57*6+P57 -> 104 | S57: GEELONG WEST | W57: CAMBERWELL | X57: 1 | Y57: 1 | Z57: 0 | AA57: 197 | AB57: 205 | AC57: =(AA57*100)/AB57 -> 96.097560975609753 | AD57: =(X57*4)+(Z57*2) -> 4
A58: GEELONG WEST | E58: =C58*6+D58 -> 0 | I58: =G58*6+H58 -> 0 | M58: =K58*6+L58 -> 0 | O58: 10 | P58: 12 | Q58: =O58*6+P58 -> 72 | W58: BOX HILL | X58: 1 | Y58: 1 | Z58: 0 | AA58: 173 | AB58: 192 | AC58: =(AA58*100)/AB58 -> 90.104166666666671 | AD58: =(X58*4)+(Z58*2) -> 4
A59: BEST PLAYERS | W59: PRAHRAN | X59: 0 | Y59: 2 | Z59: 0 | AA59: 171 | AB59: 183 | AC59: =(AA59*100)/AB59 -> 93.442622950819668 | AD59: =(X59*4)+(Z59*2) -> 0
A60: SUNSHINE | C60: FITZGERALD | F60: CROSBIE | I60: KAVANAGH | L60: BLACKMAN | O60: HOWARD | R60: WAPLING | W60: GEELONG WEST | X60: 0 | Y60: 2 | Z60: 0 | AA60: 157 | AB60: 245 | AC60: =(AA60*100)/AB60 -> 64.08163265306122 | AD60: =(X60*4)+(Z60*2) -> 0
A61: GEELONG WEST | C61: McDONALD | F61: PERRY | I61: LONG | L61: NICHOLS | O61: BAKER | R61: WILLOUGHBY
A62: GOALKICKERS
A63: SUNSHINE | C63: HOWARD 4 | F63: FITZGERALD 3 | I63: CROSBIE 3 | L63: WAPLING 2 | O63: HARRIS | Q63: McINTYRE
A64: GEELONG WEST | C64: McDONALD 3 | F64: LONG 3 | I64: PERRY 2 | K64: CROFT | M64: WILLIAMS
A66: NORTHCOTE | E66: =C66*6+D66 -> 0 | I66: =G66*6+H66 -> 0 | M66: =K66*6+L66 -> 0 | O66: 12 | P66: 11 | Q66: =O66*6+P66 -> 83 | S66: NORTHCOTE
A67: PRAHRAN | E67: =C67*6+D67 -> 0 | I67: =G67*6+H67 -> 0 | M67: =K67*6+L67 -> 0 | O67: 10 | P67: 13 | Q67: =O67*6+P67 -> 73
A68: BEST PLAYERS
A69: NORTHCOTE | C69: DOWLING | F69: CRAMERI | I69: EASTAWAY | L69: BAILEY | O69: LUMBY | R69: LAVER
A70: PRAHRAN | C70: SHEEDY | F70: GLOVER | I70: LAMBERT | L70: SEEDY | O70: BURGESS | R70: HOGAN
A71: GOALKICKERS
A72: NORTHCOTE | C72: CRAMERI 3 | F72: BAILEY 3 | I72: KEANE 3 | K72: GEMMELL | M72: THOMPSON | P72: LUMBY
A73: PRAHRAN | C73: R EVANS 3 | F73: HAYES | H73: RICHARDS | J73: BURGESS | L73: PIPER | N73: ROSS | P73: HOGAN | R73: R HAYES
A75: BOX HILL | E75: =C75*6+D75 -> 0 | I75: =G75*6+H75 -> 0 | M75: =K75*6+L75 -> 0 | O75: 14 | P75: 23 | Q75: =O75*6+P75 -> 107 | S75: CAMBERWELL
A76: CAMBERWELL | E76: =C76*6+D76 -> 0 | I76: =G76*6+H76 -> 0 | M76: =K76*6+L76 -> 0 | O76: 15 | P76: 7 | Q76: =O76*6+P76 -> 97
A77: BEST PLAYERS
A78: BOX HILL | C78: P QUINN | F78: GARDINER | I78: BATES | L78: PORTEOUS | O78: JOHNSTON | R78: WHITE
A79: CAMBERWELL | C79: GAUDION | F79: ELLIOTT | I79: O'NEILL | L79: FRIEBERG | O79: HAFEY | R79: ADAMS
A80: GOALKICKERS
A81: BOX HILL | C81: PORTEOUS 5 | F81: BATES 3 | H81: P QUINN | J81: BAYES | L81: GARDINER | N81: ANDREWS | Q81: D GRIGG | S81: WHITE
A82: CAMBERWELL | C82: O'NEILL 6 | F82: J SMITH 3 | I82: PEARSON 2 | L82: HAFEY 2 | N82: PANZIC | P82: QUIRK
A84: ROUND 3 | E84: 2ND MAY | I84: WEATHER | S84: PLAYED AT
D85: 1ST QTR | H85: 2ND QTR | L85: 3RD QTR | P85: FINAL | S85: BOX HILL
A86: SUNSHINE | E86: =C86*6+D86 -> 0 | I86: =G86*6+H86 -> 0 | M86: =K86*6+L86 -> 0 | O86: 13 | P86: 12 | Q86: =O86*6+P86 -> 90 | S86: UMPIRE | X86: LADDER | AB86: ROUND | AD86: 3
A87: BOX HILL | E87: =C87*6+D87 -> 0 | I87: =G87*6+H87 -> 0 | M87: =K87*6+L87 -> 0 | O87: 6 | P87: 21 | Q87: =O87*6+P87 -> 57
A88: BEST PLAYERS | W88: TEAM | X88: W | Y88: L | Z88: D | AA88: FOR | AB88: AGST | AC88: % | AD88: PTS
A89: SUNSHINE | C89: BLACKMAN | F89: DARUL | I89: CROSBIE | L89: WAPLING | O89: HARRIS | Q89: LAWRENCE
A90: BOX HILL | C90: BAYES | F90: R GRIGG | I90: PLUNKETT | L90: JOHNSTON | O90: OGILVIE | Q90: ROSS | W90: SUNSHINE | X90: 3 | Y90: 0 | Z90: 0 | AA90: 273 | AB90: 191 | AC90: =(AA90*100)/AB90 -> 142.93193717277487 | AD90: =(X90*4)+(Z90*2) -> 12
A91: GOALKICKERS | W91: NORTHCOTE | X91: 3 | Y91: 0 | Z91: 0 | AA91: 262 | AB91: 200 | AC91: =(AA91*100)/AB91 -> 131 | AD91: =(X91*4)+(Z91*2) -> 12
A92: SUNSHINE | C92: DARUL 4 | F92: HARRIS 3 | I92: HOWARD 2 | L92: CROSBIE 2 | N92: M FITZGERALD | Q92: WAPLING | W92: MORDIALLOC | X92: 2 | Y92: 1 | Z92: 0 | AA92: 222 | AB92: 183 | AC92: =(AA92*100)/AB92 -> 121.31147540983606 | AD92: =(X92*4)+(Z92*2) -> 8
A93: BOX HILL | C93: PLUNKETT 2 | F93: GRAY | H93: HOBBS | J93: BAYES | L93: P QUINN | W93: CAMBERWELL | X93: 2 | Y93: 1 | Z93: 0 | AA93: 315 | AB93: 320 | AC93: =(AA93*100)/AB93 -> 98.4375 | AD93: =(X93*4)+(Z93*2) -> 8
A95: NORTHCOTE | E95: =C95*6+D95 -> 0 | I95: =G95*6+H95 -> 0 | M95: =K95*6+L95 -> 0 | O95: 12 | P95: 12 | Q95: =O95*6+P95 -> 84 | S95: NORTHCOTE | W95: BRIGHTON-CAULFIELD | X95: 1 | Y95: 2 | Z95: 0 | AA95: 266 | AB95: 257 | AC95: =(AA95*100)/AB95 -> 103.50194552529183 | AD95: =(X95*4)+(Z95*2) -> 4
A96: BRIGHTON-CAULFIELD | E96: =C96*6+D96 -> 0 | I96: =G96*6+H96 -> 0 | M96: =K96*6+L96 -> 0 | O96: 8 | P96: 13 | Q96: =O96*6+P96 -> 61 | W96: BOX HILL | X96: 1 | Y96: 2 | Z96: 0 | AA96: 230 | AB96: 282 | AC96: =(AA96*100)/AB96 -> 81.560283687943269 | AD96: =(X96*4)+(Z96*2) -> 4
A97: BEST PLAYERS | W97: PRAHRAN | X97: 0 | Y97: 3 | Z97: 0 | AA97: 211 | AB97: 245 | AC97: =(AA97*100)/AB97 -> 86.122448979591837 | AD97: =(X97*4)+(Z97*2) -> 0
A98: NORTHCOTE | C98: R LANGBORNE | F98: LAVER | I98: DOWLING | L98: CRAMERI | O98: HAAG | Q98: THOMPSON | W98: GEELONG WEST | X98: 0 | Y98: 3 | Z98: 0 | AA98: 272 | AB98: 363 | AC98: =(AA98*100)/AB98 -> 74.931129476584019 | AD98: =(X98*4)+(Z98*2) -> 0
A99: BRIGHTON-CAULFIELD | C99: LEE | F99: GUTTERSON | I99: ROLFE | L99: MOORE | O99: DUNN | Q99: K KUPSCH
A100: GOALKICKERS
A101: NORTHCOTE | C101: HAAG 5 | E101: R LANGBORNE 2 | I101: LUMLEY 2 | L101: BAILEY | N101: CRAMERI | Q101: OWEN
A102: BRIGHTON-CAULFIELD | C102: DUNN 2 | E102: BRYAN 2 | G102: MOORE | I102: K KUPSCH | L102: BURNS | N102: JAMIESON
A104: CAMBERWELL | E104: =C104*6+D104 -> 0 | I104: =G104*6+H104 -> 0 | M104: =K104*6+L104 -> 0 | O104: 18 | P104: 10 | Q104: =O104*6+P104 -> 118 | S104: CAMBERWELL
A105: GEELONG WEST | E105: =C105*6+D105 -> 0 | I105: =G105*6+H105 -> 0 | M105: =K105*6+L105 -> 0 | O105: 17 | P105: 13 | Q105: =O105*6+P105 -> 115
A106: BEST PLAYERS
A107: CAMBERWELL | C107: I SMITH | F107: O'NEILL | I107: GAUDION | L107: J SMITH | O107: PEMBERTON | R107: ELLIOTT
A108: GEELONG WEST | C108: PERRY | F108: NICHOLLS | I108: VAN T'HAG | L108: CROFT | O108: LONG | R108: COLTISH
A109: GOALKICKERS
A110: CAMBERWELL | C110: O'NEILL 5 | E110: HAFEY 2 | G110: MCKERNAN 2 | J110: KISS 2 | L110: ELLIOTT 2 | N110: J SMITH 2 | Q110: GAUDION | T110: ADAMS | W110: QUIRK
A111: GEELONG WEST | C111: PERRY 4 | E111: McDONALD 4 | H111: LONG 3 | J111: CROFT 3 | L111: WILLIAMS | N111: SELLIN | P111: HOVEY
E112: 3RD MAY | I112: WEATHER
A113: MORDIALLOC | E113: =C113*6+D113 -> 0 | I113: =G113*6+H113 -> 0 | M113: =K113*6+L113 -> 0 | O113: 9 | P113: 8 | Q113: =O113*6+P113 -> 62 | S113: TOORAK PARK
A114: PRAHRAN | E114: =C114*6+D114 -> 0 | I114: =G114*6+H114 -> 0 | M114: =K114*6+L114 -> 0 | O114: 5 | P114: 10 | Q114: =O114*6+P114 -> 40
A115: BEST PLAYERS
A116: MORDIALLOC | C116: MORRISON | F116: DEAN | I116: BIBRON | L116: LILLEY | O116: PORTA | R116: LESLIE
A117: PRAHRAN | C117: MORRISON | F117: YOUNG | I117: GLOVER | L117: SHEEDY | O117: LAMBERT | R117: JAMES
A118: GOALKICKERS
A119: MORDIALLOC | C119: MORRISON 3 | F119: DEAN 3 | I119: PORTA 2 | L119: LESLIE
A120: PRAHRAN | C120: R EVANS 4 | F120: PEARSON
A122: ROUND 4 | E122: 9TH MAY | I122: WEATHER | S122: PLAYED AT
D123: 1ST QTR | H123: 2ND QTR | L123: 3RD QTR | P123: FINAL | S123: MORDIALLOC
A124: MORDIALLOC | E124: =C124*6+D124 -> 0 | I124: =G124*6+H124 -> 0 | M124: =K124*6+L124 -> 0 | O124: 17 | P124: 11 | Q124: =O124*6+P124 -> 113 | S124: UMPIRE | X124: LADDER | AB124: ROUND | AD124: 4
A125: BOX HILL | E125: =C125*6+D125 -> 0 | I125: =G125*6+H125 -> 0 | M125: =K125*6+L125 -> 0 | O125: 11 | P125: 13 | Q125: =O125*6+P125 -> 79
A126: BEST PLAYERS | W126: TEAM | X126: W | Y126: L | Z126: D | AA126: FOR | AB126: AGST | AC126: % | AD126: PTS
A127: MORDIALLOC | C127: DEAN | F127: HASSETT | I127: LESLIE | L127: PORTA | O127: WILSON | Q127: FULLER
A128: BOX HILL | C128: BAYES | F128: P QUINN | I128: PORTEOUS | L128: GARDINER | O128: R GRIGG | Q128: LOOMES | W128: NORTHCOTE | X128: 4 | Y128: 0 | Z128: 0 | AA128: 350 | AB128: 275 | AC128: =(AA128*100)/AB128 -> 127.27272727272727 | AD128: =(X128*4)+(Z128*2) -> 16
A129: GOALKICKERS | W129: MORDIALLOC | X129: 3 | Y129: 1 | Z129: 0 | AA129: 335 | AB129: 262 | AC129: =(AA129*100)/AB129 -> 127.86259541984732 | AD129: =(X129*4)+(Z129*2) -> 12
A130: MORDIALLOC | C130: DEAN 6 | E130: PORTA 3 | G130: FULLER 2 | I130: HASSETT 2 | L130: LESLIE | N130: O'BRIEN | P130: WILSON | R130: FROST | W130: SUNSHINE | X130: 3 | Y130: 1 | Z130: 0 | AA130: 348 | AB130: 279 | AC130: =(AA130*100)/AB130 -> 124.73118279569893 | AD130: =(X130*4)+(Z130*2) -> 12
A131: BOX HILL | C131: P QUINN 3 | F131: SALVADO 3 | I131: GRIGG 2 | K131: PORTEOUS 2 | N131: HOBBS | W131: BRIGHTON-CAULFIELD | X131: 2 | Y131: 2 | Z131: 0 | AA131: 360 | AB131: 344 | AC131: =(AA131*100)/AB131 -> 104.65116279069767 | AD131: =(X131*4)+(Z131*2) -> 8
W132: CAMBERWELL | X132: 2 | Y132: 2 | Z132: 0 | AA132: 402 | AB132: 414 | AC132: =(AA132*100)/AB132 -> 97.101449275362313 | AD132: =(X132*4)+(Z132*2) -> 8
A133: BRIGHTON-CAULFIELD | E133: =C133*6+D133 -> 0 | I133: =G133*6+H133 -> 0 | M133: =K133*6+L133 -> 0 | O133: 12 | P133: 22 | Q133: =O133*6+P133 -> 94 | S133: PRINCES PARK, CAULFIELD | W133: PRAHRAN | X133: 1 | Y133: 3 | Z133: 0 | AA133: 280 | AB133: 296 | AC133: =(AA133*100)/AB133 -> 94.594594594594597 | AD133: =(X133*4)+(Z133*2) -> 4
A134: CAMBERWELL | E134: =C134*6+D134 -> 0 | I134: =G134*6+H134 -> 0 | M134: =K134*6+L134 -> 0 | O134: 12 | P134: 15 | Q134: =O134*6+P134 -> 87 | W134: BOX HILL | X134: 1 | Y134: 3 | Z134: 0 | AA134: 309 | AB134: 395 | AC134: =(AA134*100)/AB134 -> 78.22784810126582 | AD134: =(X134*4)+(Z134*2) -> 4
A135: BEST PLAYERS | W135: GEELONG WEST | X135: 0 | Y135: 4 | Z135: 0 | AA135: 323 | AB135: 432 | AC135: =(AA135*100)/AB135 -> 74.768518518518519 | AD135: =(X135*4)+(Z135*2) -> 0
A136: BRIGHTON-CAULFIELD | C136: GUTTERSON | F136: DUNN | I136: KEE | L136: W KUPSCH | O136: BURNS | Q136: ROWE
A137: CAMBERWELL | C137: J SMITH | F137: K SMITH | I137: TELFER | L137: KISS | O137: QUIRK | Q137: HAFEY
A138: GOALKICKERS
A139: BRIGHTON-CAULFIELD | C139: BRYAN 5 | F139: KEE 2 | H139: BURNS 2 | J139: DUNN | L139: FOX | N139: JAMIESON
A140: CAMBERWELL | C140: O'NEILL 3 | F140: QUIRK 2 | H140: KISS 2 | J140: J SMITH 2 | M140: PEMBERTON | P140: FRIEBERG | R140: HAFEY
E141: 10TH MAY | I141: WEATHER
A142: PRAHRAN | E142: =C142*6+D142 -> 0 | I142: =G142*6+H142 -> 0 | M142: =K142*6+L142 -> 0 | O142: 10 | P142: 9 | Q142: =O142*6+P142 -> 69 | S142: GEELONG WEST
A143: GEELONG WEST | E143: =C143*6+D143 -> 0 | I143: =G143*6+H143 -> 0 | M143: =K143*6+L143 -> 0 | O143: 7 | P143: 9 | Q143: =O143*6+P143 -> 51
A144: BEST PLAYERS
A145: PRAHRAN | C145: D JONES | F145: LAMBERT | I145: YOUNG | L145: BOSCH | O145: MORRISON | R145: KERLEY
A146: GEELONG WEST | C146: COLTISH | F146: PERRY | I146: VAN T'HAG | L146: McDONALD | O146: NICHOLLS | R146: WILLIAMS
A147: GOALKICKERS
A148: PRAHRAN | C148: R EVANS 3 | F148: PEARSON 2 | I148: BURGESS | L148: BOSCH | N148: D JONES | P148: CORRIGAN | R148: McMAHON
A149: GEELONG WEST | C149: McDONALD 3 | F149: WILLIAMS 2 | I149: GOGGIN | K149: HARDIMAN
A151: NORTHCOTE | E151: =C151*6+D151 -> 0 | I151: =G151*6+H151 -> 0 | M151: =K151*6+L151 -> 0 | O151: 14 | P151: 4 | Q151: =O151*6+P151 -> 88 | S151: SUNSHINE
A152: SUNSHINE | E152: =C152*6+D152 -> 0 | I152: =G152*6+H152 -> 0 | M152: =K152*6+L152 -> 0 | O152: 10 | P152: 15 | Q152: =O152*6+P152 -> 75
A153: BEST PLAYERS
A154: NORTHCOTE | C154: THOMPSON | F154: R LANGBORNE | I154: MORRISON | L154: LAVER | O154: OWEN | Q154: CRAMERI
A155: SUNSHINE | C155: BLACKMAN | F155: PRIOR | I155: CROSBIE | L155: HOWARD | O155: TREZISE | Q155: SLATTERY
A156: GOALKICKERS
A157: NORTHCOTE | C157: MORISON 5 | F157: OWEN 3 | I157: HAAG 2 | K157: CRAMERI | M157: THOMPSON | P157: LAVER | R157: KEANE
A158: SUNSHINE | C158: HOWARD 5 | F158: WAPLING 2 | I158: M FITZGERALD | L158: TREZISE | N158: SLATTERY
A160: ROUND 5 | E160: 16TH MAY | I160: WEATHER | S160: PLAYED AT
D161: 1ST QTR | H161: 2ND QTR | L161: 3RD QTR | P161: FINAL | S161: BOX HILL
A162: GEELONG WEST | E162: =C162*6+D162 -> 0 | I162: =G162*6+H162 -> 0 | M162: =K162*6+L162 -> 0 | O162: 12 | P162: 18 | Q162: =O162*6+P162 -> 90 | S162: UMPIRE | X162: LADDER | AB162: ROUND | AD162: 5
A163: BOX HILL | E163: =C163*6+D163 -> 0 | I163: =G163*6+H163 -> 0 | M163: =K163*6+L163 -> 0 | O163: 8 | P163: 12 | Q163: =O163*6+P163 -> 60
A164: BEST PLAYERS | W164: TEAM | X164: W | Y164: L | Z164: D | AA164: FOR | AB164: AGST | AC164: % | AD164: PTS
A165: GEELONG WEST | C165: McDONALD | F165: PERRY | I165: MACKAY | L165: JENNINGS | O165: BAKER | R165: STACEY
A166: BOX HILL | C166: LEHMANN | F166: SALVADO | I166: DUURSMA | L166: KEATLEY | O166: JOHNSTON | R166: GARDINER | W166: MORDIALLOC | X166: 4 | Y166: 1 | Z166: 0 | AA166: 438 | AB166: 339 | AC166: =(AA166*100)/AB166 -> 129.20353982300884 | AD166: =(X166*4)+(Z166*2) -> 16
A167: GOALKICKERS | W167: NORTHCOTE | X167: 4 | Y167: 1 | Z167: 0 | AA167: 427 | AB167: 378 | AC167: =(AA167*100)/AB167 -> 112.96296296296296 | AD167: =(X167*4)+(Z167*2) -> 16
A168: GEELONG WEST | C168: McDONALD 6 | F168: STACEY 2 | I168: PERRY 2 | K168: BAKER | M168: MACKAY | W168: SUNSHINE | X168: 3 | Y168: 2 | Z168: 0 | AA168: 432 | AB168: 366 | AC168: =(AA168*100)/AB168 -> 118.0327868852459 | AD168: =(X168*4)+(Z168*2) -> 12
A169: BOX HILL | C169: SALVADO 4 | F169: JOHNSTON 2 | I169: PORTEOUS | L169: HEATLEY | W169: CAMBERWELL | X169: 3 | Y169: 2 | Z169: 0 | AA169: 489 | AB169: 498 | AC169: =(AA169*100)/AB169 -> 98.192771084337352 | AD169: =(X169*4)+(Z169*2) -> 12
E170: 17TH MAY | I170: WEATHER
A171: PRAHRAN | E171: =C171*6+D171 -> 0 | I171: =G171*6+H171 -> 0 | M171: =K171*6+L171 -> 0 | O171: 11 | P171: 9 | Q171: =O171*6+P171 -> 75 | S171: TOORAK PARK | W171: BRIGHTON-CAULFIELD | X171: 2 | Y171: 3 | Z171: 0 | AA171: 434 | AB171: 419 | AC171: =(AA171*100)/AB171 -> 103.5799522673031 | AD171: =(X171*4)+(Z171*2) -> 8
A172: BRIGHTON-CAULFIELD | E172: =C172*6+D172 -> 0 | I172: =G172*6+H172 -> 0 | M172: =K172*6+L172 -> 0 | O172: 10 | P172: 14 | Q172: =O172*6+P172 -> 74 | W172: PRAHRAN | X172: 2 | Y172: 3 | Z172: 0 | AA172: 355 | AB172: 370 | AC172: =(AA172*100)/AB172 -> 95.945945945945951 | AD172: =(X172*4)+(Z172*2) -> 8
A173: BEST PLAYERS | W173: GEELONG WEST | X173: 1 | Y173: 4 | Z173: 0 | AA173: 413 | AB173: 492 | AC173: =(AA173*100)/AB173 -> 83.943089430894304 | AD173: =(X173*4)+(Z173*2) -> 4
A174: PRAHRAN | C174: KERLEY | F174: SHEEDY | I174: CORRIGAN | L174: ROACH | O174: MARR | R174: YOUNG | W174: BOX HILL | X174: 1 | Y174: 4 | Z174: 0 | AA174: 369 | AB174: 485 | AC174: =(AA174*100)/AB174 -> 76.082474226804123 | AD174: =(X174*4)+(Z174*2) -> 4
A175: BRIGHTON-CAULFIELD | C175: ROWE | F175: W KUPSCH | I175: BURNS | L175: DUNN | O175: RANSOM | R175: JONES
A176: GOALKICKERS
A177: PRAHRAN | C177: R EVANS 4 | F177: BOSCH 2 | I177: PIPER 2 | K177: CORRIGAN 2 | N177: BURGESS
A178: BRIGHTON-CAULFIELD | C178: BURNS 4 | F178: BRYAN 2 | I178: DUNN 2 | K178: W KUPSCH 2
A180: MORDIALLOC | E180: =C180*6+D180 -> 0 | I180: =G180*6+H180 -> 0 | M180: =K180*6+L180 -> 0 | O180: 15 | P180: 13 | Q180: =O180*6+P180 -> 103 | S180: NORTHCOTE
A181: NORTHCOTE | E181: =C181*6+D181 -> 0 | I181: =G181*6+H181 -> 0 | M181: =K181*6+L181 -> 0 | O181: 11 | P181: 11 | Q181: =O181*6+P181 -> 77
A182: BEST PLAYERS
A183: MORDIALLOC | C183: LESLIE | F183: LAIRD | I183: FULLER | L183: BIBRON | O183: PORTA | Q183: LILLEY
A184: NORTHCOTE | C184: LAVER | F184: PITTS | I184: T KEAYS | L184: THOMPSON | O184: R LANGBORNE | R184: EASTAWAY
A185: GOALKICKERS
A186: MORDIALLOC | C186: O'BRIEN 3 | F186: LILLEY 3 | I186: LESLIE 3 | K186: DEAN 2 | M186: FULLER 2 | O186: LAIRD 2
A187: NORTHCOTE | C187: CRAMERI 2 | F187: R LANGBORNE 2 | J187: HAAG 2 | M187: KEANE 2 | O187: EASTAWAY | R187: PITTS | T187: OWEN
A189: CAMBERWELL | E189: =C189*6+D189 -> 0 | I189: =G189*6+H189 -> 0 | M189: =K189*6+L189 -> 0 | O189: 12 | P189: 15 | Q189: =O189*6+P189 -> 87 | S189: SUNSHINE
A190: SUNSHINE | E190: =C190*6+D190 -> 0 | I190: =G190*6+H190 -> 0 | M190: =K190*6+L190 -> 0 | O190: 11 | P190: 18 | Q190: =O190*6+P190 -> 84
A191: BEST PLAYERS
A192: CAMBERWELL | C192: ELLIOTT | F192: DOUGLAS | I192: O'NEILL | L192: HAFEY | O192: J SMITH
A193: SUNSHINE | C193: CROSBIE | F193: TREZISE | I193: DARUL | L193: SLATTERY | O193: YOUNG | Q193: LAWRENCE
A194: GOALKICKERS
A195: CAMBERWELL | C195: O'NEILL 5 | F195: ELLIOTT 2 | I195: PANZIC | K195: HAFEY | M195: QUIRK | O195: K SMITH | R195: CRIPPS
A196: SUNSHINE | C196: M FITZGERALD 2 | G196: WAPLING 2 | J196: CROSBIE 2 | M196: SLATTERY 2 | P196: HOWARD | R196: TREZISE | T196: HARRIS
A198: ROUND 6 | E198: 23RD MAY | I198: WEATHER | S198: PLAYED AT
D199: 1ST QTR | H199: 2ND QTR | L199: 3RD QTR | P199: FINAL | S199: TOORAK PARK
A200: PRAHRAN | E200: =C200*6+D200 -> 0 | I200: =G200*6+H200 -> 0 | M200: =K200*6+L200 -> 0 | O200: 9 | P200: 15 | Q200: =O200*6+P200 -> 69 | S200: UMPIRE | X200: LADDER | AB200: ROUND | AD200: 6
A201: BOX HILL | E201: =C201*6+D201 -> 0 | I201: =G201*6+H201 -> 0 | M201: =K201*6+L201 -> 0 | O201: 8 | P201: 10 | Q201: =O201*6+P201 -> 58
A202: BEST PLAYERS | W202: TEAM | X202: W | Y202: L | Z202: D | AA202: FOR | AB202: AGST | AC202: % | AD202: PTS
A203: PRAHRAN | C203: YOUNG | F203: LAMBERT | I203: McMAHON | L203: PIPER | O203: PEARSON | R203: MARR
A204: BOX HILL | C204: JOHNSTON | F204: GARDINER | I204: LA ROCHE | L204: D GRIGG | O204: LOOMES | R204: BATES | W204: NORTHCOTE | X204: 5 | Y204: 1 | Z204: 0 | AA204: 559 | AB204: 483 | AC204: =(AA204*100)/AB204 -> 115.73498964803312 | AD204: =(X204*4)+(Z204*2) -> 20
A205: GOALKICKERS | W205: SUNSHINE | X205: 4 | Y205: 2 | Z205: 0 | AA205: 542 | AB205: 438 | AC205: =(AA205*100)/AB205 -> 123.74429223744292 | AD205: =(X205*4)+(Z205*2) -> 16
A206: PRAHRAN | C206: R EVANS 2 | F206: PIPER 2 | H206: PEARSON 2 | J206: SHEEDY | L206: MARR | N206: MCMAHON | W206: MORDIALLOC | X206: 4 | Y206: 2 | Z206: 0 | AA206: 516 | AB206: 437 | AC206: =(AA206*100)/AB206 -> 118.07780320366133 | AD206: =(X206*4)+(Z206*2) -> 16
A207: BOX HILL | C207: JOHNSTON 2 | F207: LOOMES | H207: D GRIGG | J207: ROSS | L207: GARDINER | N207: BAYES | P207: SALVADO | W207: PRAHRAN | X207: 3 | Y207: 3 | Z207: 0 | AA207: 424 | AB207: 428 | AC207: =(AA207*100)/AB207 -> 99.065420560747668 | AD207: =(X207*4)+(Z207*2) -> 12
A209: SUNSHINE | E209: =C209*6+D209 -> 0 | I209: =G209*6+H209 -> 0 | M209: =K209*6+L209 -> 0 | O209: 16 | P209: 14 | Q209: =O209*6+P209 -> 110 | S209: PRINCES PARK, CAULFIELD | W209: CAMBERWELL | X209: 3 | Y209: 3 | Z209: 0 | AA209: 594 | AB209: 630 | AC209: =(AA209*100)/AB209 -> 94.285714285714292 | AD209: =(X209*4)+(Z209*2) -> 12
A210: BRIGHTON-CAULFIELD | E210: =C210*6+D210 -> 0 | I210: =G210*6+H210 -> 0 | M210: =K210*6+L210 -> 0 | O210: 10 | P210: 12 | Q210: =O210*6+P210 -> 72 | W210: BRIGHTON-CAULFIELD | X210: 2 | Y210: 4 | Z210: 0 | AA210: 506 | AB210: 529 | AC210: =(AA210*100)/AB210 -> 95.652173913043484 | AD210: =(X210*4)+(Z210*2) -> 8
A211: BEST PLAYERS | W211: GEELONG WEST | X211: 2 | Y211: 4 | Z211: 0 | AA211: 511 | AB211: 570 | AC211: =(AA211*100)/AB211 -> 89.649122807017548 | AD211: =(X211*4)+(Z211*2) -> 8
A212: SUNSHINE | C212: SLATTERY | F212: HOWARD | I212: PRIOR | L212: CROSBIE | O212: DARUL | Q212: HARRIS | W212: BOX HILL | X212: 1 | Y212: 5 | Z212: 0 | AA212: 427 | AB212: 554 | AC212: =(AA212*100)/AB212 -> 77.075812274368232 | AD212: =(X212*4)+(Z212*2) -> 4
A213: BRIGHTON-CAULFIELD | C213: BRYAN | F213: HUNT | I213: KEE | L213: CHANDLER | O213: ROWE | Q213: GUTTERSON
A214: GOALKICKERS
A215: SUNSHINE | C215: HOWARD 5 | F215: HARRIS 5 | I215: SLATTERY 2 | L215: CROSBIE 2 | O215: DARUL 2
A216: BRIGHTON-CAULFIELD | C216: BRYAN 8 | F216: KEE 2
A218: NORTHCOTE | E218: =C218*6+D218 -> 0 | I218: =G218*6+H218 -> 0 | M218: =K218*6+L218 -> 0 | O218: 19 | P218: 18 | Q218: =O218*6+P218 -> 132 | S218: CAMBERWELL
A219: CAMBERWELL | E219: =C219*6+D219 -> 0 | I219: =G219*6+H219 -> 0 | M219: =K219*6+L219 -> 0 | O219: 15 | P219: 15 | Q219: =O219*6+P219 -> 105
A220: BEST PLAYERS
A221: NORTHCOTE | C221: HAAG | F221: CRAMERI | I221: PITTS | L221: OWEN | O221: MARRIOTT | R221: EASTAWAY
A222: CAMBERWELL | C222: PANZIC | F222: K SMITH | I222: PEMBERTON | L222: GAUDION | O222: ELLIOTT | R222: CRIPPS
A223: GOALKICKERS
A224: NORTHCOTE | C224: HAAG 8 | E224: CRAMERI 4 | H224: R LANGBORNE 2 | L224: PITTS 2 | N224: BRADY | P224: MARRIOTT | S224: OWEN
A225: CAMBERWELL | C225: ELLIOTT 4 | F225: O'NEILL 4 | I225: K SMITH 2 | L225: J SMITH 2 | N225: CRIPPS 2 | Q225: QUIRK
E226: 24TH MAY | I226: WEATHER
A227: GEELONG WEST | E227: =C227*6+D227 -> 0 | I227: =G227*6+H227 -> 0 | M227: =K227*6+L227 -> 0 | O227: 15 | P227: 8 | Q227: =O227*6+P227 -> 98 | S227: GEELONG WEST
A228: MORDIALLOC | E228: =C228*6+D228 -> 0 | I228: =G228*6+H228 -> 0 | M228: =K228*6+L228 -> 0 | O228: 11 | P228: 12 | Q228: =O228*6+P228 -> 78
A229: BEST PLAYERS
A230: GEELONG WEST | C230: GOGGIN | F230: WILLIAMS | I230: MACKAY | L230: STACEY | O230: CRONIN | Q230: VAN T'HAG
A231: MORDIALLOC
A232: GOALKICKERS
A233: GEELONG WEST | C233: GOGGIN 4 | E233: MCDONALD 3 | H233: HARDIMAN 2 | K233: CROFT 2 | M233: MACKAY | O233: COLTISH | Q233: PERRY | S233: STACEY
A234: MORDIALLOC
A236: ROUND 7 | E236: 30TH MAY | I236: WEATHER | S236: PLAYED AT
D237: 1ST QTR | H237: 2ND QTR | L237: 3RD QTR | P237: FINAL | S237: BOX HILL
A238: BRIGHTON-CAULFIELD | E238: =C238*6+D238 -> 0 | I238: =G238*6+H238 -> 0 | M238: =K238*6+L238 -> 0 | O238: 14 | P238: 17 | Q238: =O238*6+P238 -> 101 | S238: UMPIRE | X238: LADDER | AB238: ROUND | AD238: 7
A239: BOX HILL | E239: =C239*6+D239 -> 0 | I239: =G239*6+H239 -> 0 | M239: =K239*6+L239 -> 0 | O239: 13 | P239: 10 | Q239: =O239*6+P239 -> 88
A240: BEST PLAYERS | W240: TEAM | X240: W | Y240: L | Z240: D | AA240: FOR | AB240: AGST | AC240: % | AD240: PTS
A241: BRIGHTON-CAULFIELD | C241: GUTTERSON | F241: BURNS | I241: FOX | L241: BRYAN | O241: HUNT | Q241: JONES
A242: BOX HILL | C242: GARDINER | F242: SALVADO | I242: JOHNSTON | L242: BATES | O242: OGILVIE | Q242: MACE | W242: MORDIALLOC | X242: 5 | Y242: 2 | Z242: 0 | AA242: 583 | AB242: 466 | AC242: =(AA242*100)/AB242 -> 125.10729613733906 | AD242: =(X242*4)+(Z242*2) -> 20
A243: GOALKICKERS | W243: SUNSHINE | X243: 5 | Y243: 2 | Z243: 0 | AA243: 603 | AB243: 485 | AC243: =(AA243*100)/AB243 -> 124.32989690721649 | AD243: =(X243*4)+(Z243*2) -> 20
A244: BRIGHTON-CAULFIELD | C244: BRYAN 5 | F244: FOX 4 | I244: BURNS 3 | L244: W KUPSCH | O244: KEE | W244: NORTHCOTE | X244: 5 | Y244: 2 | Z244: 0 | AA244: 636 | AB244: 561 | AC244: =(AA244*100)/AB244 -> 113.36898395721926 | AD244: =(X244*4)+(Z244*2) -> 20
A245: BOX HILL | C245: SALVADO 5 | F245: LA ROCHE 3 | I245: P QUINN | L245: MACE | N245: WHITE | P245: JOHNSTON | R245: GARDINER | W245: BRIGHTON-CAULFIELD | X245: 3 | Y245: 4 | Z245: 0 | AA245: 607 | AB245: 617 | AC245: =(AA245*100)/AB245 -> 98.379254457050237 | AD245: =(X245*4)+(Z245*2) -> 12
E246: 31ST MAY | I246: WEATHER
A247: MORDIALLOC | E247: =C247*6+D247 -> 0 | I247: =G247*6+H247 -> 0 | M247: =K247*6+L247 -> 0 | O247: 9 | P247: 13 | Q247: =O247*6+P247 -> 67 | S247: MORDIALLOC | W247: PRAHRAN | X247: 3 | Y247: 4 | Z247: 0 | AA247: 471 | AB247: 489 | AC247: =(AA247*100)/AB247 -> 96.319018404907979 | AD247: =(X247*4)+(Z247*2) -> 12
A248: CAMBERWELL | E248: =C248*6+D248 -> 0 | I248: =G248*6+H248 -> 0 | M248: =K248*6+L248 -> 0 | O248: 4 | P248: 5 | Q248: =O248*6+P248 -> 29 | W248: GEELONG WEST | X248: 3 | Y248: 4 | Z248: 0 | AA248: 589 | AB248: 647 | AC248: =(AA248*100)/AB248 -> 91.035548686244198 | AD248: =(X248*4)+(Z248*2) -> 12
A249: BEST PLAYERS | W249: CAMBERWELL | X249: 3 | Y249: 4 | Z249: 0 | AA249: 623 | AB249: 697 | AC249: =(AA249*100)/AB249 -> 89.383070301291255 | AD249: =(X249*4)+(Z249*2) -> 12
A250: MORDIALLOC | C250: LESLIE | F250: LAIRD | I250: O'BRIEN | L250: BIBRON | O250: STEWART | R250: LILLEY | W250: BOX HILL | X250: 1 | Y250: 6 | Z250: 0 | AA250: 515 | AB250: 655 | AC250: =(AA250*100)/AB250 -> 78.625954198473281 | AD250: =(X250*4)+(Z250*2) -> 4
A251: CAMBERWELL | C251: WITHERS | F251: HAFEY | I251: K SMITH | L251: GAUDION | O251: DOUGLAS
A252: GOALKICKERS
A253: MORDIALLOC | C253: O'BRIEN 4 | F253: MORRISON 3 | I253: PORTA | K253: GEHLING
A254: CAMBERWELL | C254: O'NEILL 2 | F254: COCKREM | I254: FRIEBERG
A256: GEELONG WEST | E256: =C256*6+D256 -> 0 | I256: =G256*6+H256 -> 0 | M256: =K256*6+L256 -> 0 | O256: 11 | P256: 12 | Q256: =O256*6+P256 -> 78 | S256: NORTHCOTE
A257: NORTHCOTE | E257: =C257*6+D257 -> 0 | I257: =G257*6+H257 -> 0 | M257: =K257*6+L257 -> 0 | O257: 11 | P257: 11 | Q257: =O257*6+P257 -> 77
A258: BEST PLAYERS
A259: GEELONG WEST | C259: WILLIAMS | F259: GRANT | I259: CRONIN | L259: GOGGIN | O259: CROFT | R259: STINE
A260: NORTHCOTE | C260: MARRIOTT | F260: T KEAYS | I260: SIMPSON | L260: CRAMERI | O260: McBREEN | R260: LUMBY
A261: GOALKICKERS | C261: 1 SHORT
A262: GEELONG WEST | C262: GOGGIN 3 | F262: GRANT 2 | I262: MACKAY | K262: McDONALD | N262: WILLIAMS | Q262: STACEY | S262: SELLIN
A263: NORTHCOTE | C263: CRAMERI 3 | F263: R LANGBORNE 2 | J263: MORRISON 2 | M263: BRADY | O263: T KEAYS | Q263: OWEN
A265: SUNSHINE | E265: =C265*6+D265 -> 0 | I265: =G265*6+H265 -> 0 | M265: =K265*6+L265 -> 0 | O265: 8 | P265: 13 | Q265: =O265*6+P265 -> 61 | S265: SUNSHINE
A266: PRAHRAN | E266: =C266*6+D266 -> 0 | I266: =G266*6+H266 -> 0 | M266: =K266*6+L266 -> 0 | O266: 7 | P266: 5 | Q266: =O266*6+P266 -> 47
A267: BEST PLAYERS
A268: SUNSHINE | C268: SLATTERY | F268: WAPLING | I268: ROACH | L268: CROSBIE | O268: STEVENS | R268: BOWMAN
A269: PRAHRAN | C269: BOSCH | F269: KIRBY | I269: CORRIGAN | L269: CLOSE | O269: BURGESS | R269: McMAHON
A270: GOALKICKERS
A271: SUNSHINE | C271: WAPLING 3 | F271: DARUL 2 | I271: M FITZGERALD | L271: CROSBIE | N271: SLATTERY
A272: PRAHRAN | C272: BOSCH 2 | F272: PEARSON | I272: BURGESS | L272: SEEDY | N272: MARR | P272: GEISLER
A274: ROUND 8 | E274: 6TH JUNE | I274: WEATHER | S274: PLAYED AT
D275: 1ST QTR | H275: 2ND QTR | L275: 3RD QTR | P275: FINAL | S275: CAMBERWELL
A276: PRAHRAN | E276: =C276*6+D276 -> 0 | I276: =G276*6+H276 -> 0 | M276: =K276*6+L276 -> 0 | O276: 18 | P276: 17 | Q276: =O276*6+P276 -> 125 | S276: UMPIRE | X276: LADDER | AB276: ROUND | AD276: 8
A277: CAMBERWELL | E277: =C277*6+D277 -> 0 | I277: =G277*6+H277 -> 0 | M277: =K277*6+L277 -> 0 | O277: 19 | P277: 7 | Q277: =O277*6+P277 -> 121
A278: BEST PLAYERS | W278: TEAM | X278: W | Y278: L | Z278: D | AA278: FOR | AB278: AGST | AC278: % | AD278: PTS
A279: PRAHRAN | C279: CORRIGAN | F279: PEARSON | I279: BOSCH | L279: HARRISON | O279: SEEDY | R279: CRIPPS
A280: CAMBERWELL | C280: O'NEILL | F280: GAUDION | I280: HAFEY | L280: J SMITH | O280: K SMITH | R280: PRATT | W280: MORDIALLOC | X280: 6 | Y280: 2 | Z280: 0 | AA280: 631 | AB280: 513 | AC280: =(AA280*100)/AB280 -> 123.00194931773879 | AD280: =(X280*4)+(Z280*2) -> 24
A281: GOALKICKERS | W281: NORTHCOTE | X281: 6 | Y281: 2 | Z281: 0 | AA281: 713 | AB281: 627 | AC281: =(AA281*100)/AB281 -> 113.71610845295056 | AD281: =(X281*4)+(Z281*2) -> 24
A282: PRAHRAN | C282: PEARSON 6 | E282: CORRIGAN 3 | H282: HARRIS 2 | J282: BOSCH 2 | L282: SEEDY 2 | N282: CRIPPS | P282: SHEEDY | R282: PIPER | W282: SUNSHINE | X282: 5 | Y282: 3 | Z282: 0 | AA282: 650 | AB282: 533 | AC282: =(AA282*100)/AB282 -> 121.95121951219512 | AD282: =(X282*4)+(Z282*2) -> 20
A283: CAMBERWELL | C283: O'NEILL 12 | F283: HAFEY 2 | I283: QUIRK 2 | K283: GAUDION | M283: J SMITH | O283: K SMITH | W283: BRIGHTON-CAULFIELD | X283: 4 | Y283: 4 | Z283: 0 | AA283: 690 | AB283: 690 | AC283: =(AA283*100)/AB283 -> 100 | AD283: =(X283*4)+(Z283*2) -> 16
A285: NORTHCOTE | E285: =C285*6+D285 -> 0 | I285: =G285*6+H285 -> 0 | M285: =K285*6+L285 -> 0 | O285: 11 | P285: 11 | Q285: =O285*6+P285 -> 77 | S285: NORTHCOTE | W285: PRAHRAN | X285: 4 | Y285: 4 | Z285: 0 | AA285: 596 | AB285: 610 | AC285: =(AA285*100)/AB285 -> 97.704918032786878 | AD285: =(X285*4)+(Z285*2) -> 16
A286: BOX HILL | E286: =C286*6+D286 -> 0 | I286: =G286*6+H286 -> 0 | M286: =K286*6+L286 -> 0 | O286: 9 | P286: 12 | Q286: =O286*6+P286 -> 66 | W286: GEELONG WEST | X286: 3 | Y286: 5 | Z286: 0 | AA286: 662 | AB286: 730 | AC286: =(AA286*100)/AB286 -> 90.68493150684931 | AD286: =(X286*4)+(Z286*2) -> 12
A287: BEST PLAYERS | W287: CAMBERWELL | X287: 3 | Y287: 5 | Z287: 0 | AA287: 744 | AB287: 822 | AC287: =(AA287*100)/AB287 -> 90.510948905109487 | AD287: =(X287*4)+(Z287*2) -> 12
A288: NORTHCOTE | C288: BAILEY | F288: WEGENER | I288: SIMPSON | L288: McBREEN | O288: T KEAYS | R288: PITTS | W288: BOX HILL | X288: 1 | Y288: 7 | Z288: 0 | AA288: 581 | AB288: 732 | AC288: =(AA288*100)/AB288 -> 79.37158469945355 | AD288: =(X288*4)+(Z288*2) -> 4
A289: BOX HILL | C289: MACE | F289: WHITE | I289: JOHNSTON | L289: HEATLEY | O289: ROSS | R289: INGLETON
A290: GOALKICKERS
A291: NORTHCOTE | C291: LACHMUND 3 | F291: CRAMERI 2 | I291: DOWLING 2 | L291: BAILEY 2 | N291: MORRISON | Q291: OWEN
A292: BOX HILL | C292: P QUINN 2 | F292: SALVADO 2 | I292: MACE 2 | K292: ROSS | M292: GRAY | O292: PLUNKETT
A294: BRIGHTON-CAULFIELD | E294: =C294*6+D294 -> 0 | I294: =G294*6+H294 -> 0 | M294: =K294*6+L294 -> 0 | O294: 13 | P294: 5 | Q294: =O294*6+P294 -> 83 | S294: GEELONG WEST
A295: GEELONG WEST | E295: =C295*6+D295 -> 0 | I295: =G295*6+H295 -> 0 | M295: =K295*6+L295 -> 0 | O295: 9 | P295: 19 | Q295: =O295*6+P295 -> 73
A296: BEST PLAYERS
A297: BRIGHTON-CAULFIELD | C297: KEE | F297: BURNS | I297: FOX | L297: HUNT | O297: RANSOM | R297: LAMBERT
A298: GEELONG WEST | C298: CRONIN | F298: STACEY | I298: McDONALD | L298: CROFT | O298: COLTISH | R298: BELL
A299: GOALKICKERS
A300: BRIGHTON-CAULFIELD | C300: FOX 4 | F300: BRYAN 3 | I300: W KUPSCH 2 | L300: GRAY | N300: KEE | P300: BURNS | R300: LAMBERT
A301: GEELONG WEST | C301: McDONALD 5 | F301: STACEY | I301: GOGGIN | K301: SELLIN | M301: LONG
E302: 7TH JUNE | I302: WEATHER
A303: MORDIALLOC | E303: =C303*6+D303 -> 0 | I303: =G303*6+H303 -> 0 | M303: =K303*6+L303 -> 0 | O303: 5 | P303: 18 | Q303: =O303*6+P303 -> 48 | S303: MORDIALLOC
A304: SUNSHINE | E304: =C304*6+D304 -> 0 | I304: =G304*6+H304 -> 0 | M304: =K304*6+L304 -> 0 | O304: 6 | P304: 11 | Q304: =O304*6+P304 -> 47
A305: BEST PLAYERS
A306: MORDIALLOC | C306: LESLIE | F306: BIBRON | I306: MORRISON | L306: O'BRIEN | O306: LAIRD | Q306: CARDER
A307: SUNSHINE | C307: SLATTERY | F307: YOUNG | I307: STEVENS | L307: M FITZGERALD | O307: BERGFELD
A308: GOALKICKERS
A309: MORDIALLOC | C309: MORRISON 2 | F309: PORTA | I309: O'BRIEN | L309: LESLIE
A310: SUNSHINE | C310: HOWARD 3 | F310: DARUL 2 | I310: WAPLING
A312: ROUND 9 | E312: 13TH JUNE | I312: WEATHER | S312: PLAYED AT
D313: 1ST QTR | H313: 2ND QTR | L313: 3RD QTR | P313: FINAL | S313: PRINCES PARK, CAULFIELD
A314: BRIGHTON-CAULFIELD | E314: =C314*6+D314 -> 0 | I314: =G314*6+H314 -> 0 | M314: =K314*6+L314 -> 0 | O314: 13 | P314: 8 | Q314: =O314*6+P314 -> 86 | S314: UMPIRE | X314: LADDER | AB314: ROUND | AD314: 9
A315: MORDIALLOC | E315: =C315*6+D315 -> 0 | I315: =G315*6+H315 -> 0 | M315: =K315*6+L315 -> 0 | O315: 11 | P315: 18 | Q315: =O315*6+P315 -> 84
A316: BEST PLAYERS | W316: TEAM | X316: W | Y316: L | Z316: D | AA316: FOR | AB316: AGST | AC316: % | AD316: PTS
A317: BRIGHTON-CAULFIELD | C317: BRYAN | F317: RANSOM | I317: ROWE | L317: FOX | N317: CHANDLER | Q317: LAMBERT
A318: MORDIALLOC | C318: LESLIE | F318: ROSENBROCK | I318: CARDER | L318: LILLEY | N318: O'BRIEN | Q318: MORRISON | W318: MORDIALLOC | X318: 6 | Y318: 3 | Z318: 0 | AA318: 715 | AB318: 599 | AC318: =(AA318*100)/AB318 -> 119.36560934891486 | AD318: =(X318*4)+(Z318*2) -> 24
A319: GOALKICKERS | W319: NORTHCOTE | X319: 6 | Y319: 3 | Z319: 0 | AA319: 771 | AB319: 730 | AC319: =(AA319*100)/AB319 -> 105.61643835616438 | AD319: =(X319*4)+(Z319*2) -> 24
A320: BRIGHTON-CAULFIELD | C320: BRYAN 5 | F320: ROWE 4 | I320: FOX 2 | K320: CHANDLER 2 | W320: SUNSHINE | X320: 5 | Y320: 4 | Z320: 0 | AA320: 713 | AB320: 609 | AC320: =(AA320*100)/AB320 -> 117.07717569786536 | AD320: =(X320*4)+(Z320*2) -> 20
A321: MORDIALLOC | C321: LESLIE 6 | F321: O'BRIEN | I321: LILLEY | K321: MORRISON | N321: CARDER | Q321: 1 SHORT | W321: PRAHRAN | X321: 5 | Y321: 4 | Z321: 0 | AA321: 699 | AB321: 668 | AC321: =(AA321*100)/AB321 -> 104.64071856287426 | AD321: =(X321*4)+(Z321*2) -> 20
A323: BOX HILL | E323: =C323*6+D323 -> 0 | I323: =G323*6+H323 -> 0 | M323: =K323*6+L323 -> 0 | O323: 13 | P323: 22 | Q323: =O323*6+P323 -> 100 | S323: BOX HILL | W323: BRIGHTON-CAULFIELD | X323: 5 | Y323: 4 | Z323: 0 | AA323: 776 | AB323: 774 | AC323: =(AA323*100)/AB323 -> 100.25839793281654 | AD323: =(X323*4)+(Z323*2) -> 20
A324: CAMBERWELL | E324: =C324*6+D324 -> 0 | I324: =G324*6+H324 -> 0 | M324: =K324*6+L324 -> 0 | O324: 9 | P324: 17 | Q324: =O324*6+P324 -> 71 | W324: GEELONG WEST | X324: 4 | Y324: 5 | Z324: 0 | AA324: 738 | AB324: 793 | AC324: =(AA324*100)/AB324 -> 93.064312736443881 | AD324: =(X324*4)+(Z324*2) -> 16
A325: BEST PLAYERS | W325: CAMBERWELL | X325: 3 | Y325: 6 | Z325: 0 | AA325: 815 | AB325: 922 | AC325: =(AA325*100)/AB325 -> 88.394793926247289 | AD325: =(X325*4)+(Z325*2) -> 12
A326: BOX HILL | C326: SALVADO | F326: GARDINER | I326: ROSS | L326: LA ROCHE | N326: JOHNSTON | Q326: INGLETON | W326: BOX HILL | X326: 2 | Y326: 7 | Z326: 0 | AA326: 681 | AB326: 803 | AC326: =(AA326*100)/AB326 -> 84.806973848069745 | AD326: =(X326*4)+(Z326*2) -> 8
A327: CAMBERWELL | C327: GAUDION | F327: O'NEILL | I327: HAFEY | L327: J SMITH | N327: WITHERS | Q327: FRIEBERG
A328: GOALKICKERS
A329: BOX HILL | C329: SALVADO 2 | F329: LA ROCHE 2 | I329: GRAY 2 | K329: JOHNSTON 2 | N329: QUINN | P329: MACE | R329: MOULE | T329: WHITE | V329: INGLETON
A330: CAMBERWELL | C330: O'NEILL 4 | F330: CRIPPS 2 | I330: HAFEY 2 | K330: J SMITH
E331: 14TH JUNE | I331: WEATHER
A332: GEELONG WEST | E332: =C332*6+D332 -> 0 | I332: =G332*6+H332 -> 0 | M332: =K332*6+L332 -> 0 | O332: 10 | P332: 16 | Q332: =O332*6+P332 -> 76 | S332: SUNSHINE
A333: SUNSHINE | E333: =C333*6+D333 -> 0 | I333: =G333*6+H333 -> 0 | M333: =K333*6+L333 -> 0 | O333: 9 | P333: 9 | Q333: =O333*6+P333 -> 63
A334: BEST PLAYERS
A335: GEELONG WEST | C335: NICHOLLS | F335: CROFT | I335: WILLIAMSON | L335: BELL | N335: COLTISH | Q335: BENNETT
A336: SUNSHINE | C336: ROACH | F336: SLATTERY | I336: KAVANAGH | L336: CROSBIE | N336: HENDERSON | Q336: HOWARD
A337: GOALKICKERS
A338: GEELONG WEST | C338: MCDONALD 4 | F338: MACKAY 3 | I338: HARDIMAN 2 | L338: GRANT
A339: SUNSHINE | C339: CROSBIE 4 | F339: HOWARD 2 | I339: HARRIS 2 | L339: WAPLING
A341: PRAHRAN | E341: =C341*6+D341 -> 0 | I341: =G341*6+H341 -> 0 | M341: =K341*6+L341 -> 0 | O341: 14 | P341: 19 | Q341: =O341*6+P341 -> 103 | S341: TOORAK PARK
A342: NORTHCOTE | E342: =C342*6+D342 -> 0 | I342: =G342*6+H342 -> 0 | M342: =K342*6+L342 -> 0 | O342: 9 | P342: 4 | Q342: =O342*6+P342 -> 58
A343: BEST PLAYERS
A344: PRAHRAN | C344: MORSE | F344: CORRIGAN | I344: McMAHON | L344: PIPER | N344: SEEDY | Q344: BOSCH
A345: NORTHCOTE | C345: LAVER | F345: BAILEY | I345: LACHMUND | L345: CRAMERI | N345: PITTS | Q345: OWEN
A346: GOALKICKERS
A347: PRAHRAN | C347: SEEDY 4 | E347: BOSCH 2 | G347: PIPER 2 | I347: CRIPPS | K347: CORRIGAN | N347: GLOVER | P347: MORSE | R347: DORAN | T347: MARR
A348: NORTHCOTE | C348: CRAMERI 2 | F348: BAILEY 2 | I348: DOWLING | K348: SIMPSON | M348: LACHMUND | P348: PITTS | R348: OWEN
A350: ROUND 10 | E350: 20TH JUNE | I350: WEATHER | S350: PLAYED AT
D351: 1ST QTR | H351: 2ND QTR | L351: 3RD QTR | P351: FINAL | S351: SUNSHINE
A352: SUNSHINE | E352: =C352*6+D352 -> 0 | I352: =G352*6+H352 -> 0 | M352: =K352*6+L352 -> 0 | O352: 22 | P352: 22 | Q352: =O352*6+P352 -> 154 | S352: UMPIRE | X352: LADDER | AB352: ROUND | AD352: 10
A353: BOX HILL | E353: =C353*6+D353 -> 0 | I353: =G353*6+H353 -> 0 | M353: =K353*6+L353 -> 0 | O353: 8 | P353: 8 | Q353: =O353*6+P353 -> 56
A354: BEST PLAYERS | W354: TEAM | X354: W | Y354: L | Z354: D | AA354: FOR | AB354: AGST | AC354: % | AD354: PTS
A355: SUNSHINE | C355: HOWARD | F355: WAPLING | I355: CROSBIE | L355: YOUNG | N355: HENDERSON | Q355: SLATTERY
A356: BOX HILL | C356: GARDINER | F356: MOULE | I356: MACE | L356: P QUINN | N356: PLUNKETT | Q356: INGLETON | W356: MORDIALLOC | X356: 7 | Y356: 3 | Z356: 0 | AA356: 771 | AB356: 653 | AC356: =(AA356*100)/AB356 -> 118.07044410413476 | AD356: =(X356*4)+(Z356*2) -> 28
A357: GOALKICKERS | Q357: KAVANAGH | W357: SUNSHINE | X357: 6 | Y357: 4 | Z357: 0 | AA357: 867 | AB357: 665 | AC357: =(AA357*100)/AB357 -> 130.37593984962405 | AD357: =(X357*4)+(Z357*2) -> 24
A358: SUNSHINE | C358: WAPLING 6 | E358: HOWARD 5 | H358: CROSBIE 3 | J358: TREZISE 2 | M358: SLATTERY 2 | P358: HARRIS 2 | R358: M FITZGERALD | W358: BRIGHTON-CAULFIELD | X358: 6 | Y358: 4 | Z358: 0 | AA358: 868 | AB358: 819 | AC358: =(AA358*100)/AB358 -> 105.98290598290598 | AD358: =(X358*4)+(Z358*2) -> 24
A359: BOX HILL | C359: GARDINER 4 | F359: MACE 3 | I359: INGLETON | W359: NORTHCOTE | X359: 6 | Y359: 4 | Z359: 0 | AA359: 816 | AB359: 822 | AC359: =(AA359*100)/AB359 -> 99.270072992700733 | AD359: =(X359*4)+(Z359*2) -> 24
A361: BRIGHTON-CAULFIELD | E361: =C361*6+D361 -> 0 | I361: =G361*6+H361 -> 0 | M361: =K361*6+L361 -> 0 | O361: 13 | P361: 14 | Q361: =O361*6+P361 -> 92 | S361: PRINCES PARK, CAULFIELD | W361: PRAHRAN | X361: 5 | Y361: 5 | Z361: 0 | AA361: 753 | AB361: 724 | AC361: =(AA361*100)/AB361 -> 104.00552486187846 | AD361: =(X361*4)+(Z361*2) -> 20
A362: NORTHCOTE | E362: =C362*6+D362 -> 0 | I362: =G362*6+H362 -> 0 | M362: =K362*6+L362 -> 0 | O362: 6 | P362: 9 | Q362: =O362*6+P362 -> 45 | W362: GEELONG WEST | X362: 5 | Y362: 5 | Z362: 0 | AA362: 786 | AB362: 834 | AC362: =(AA362*100)/AB362 -> 94.244604316546756 | AD362: =(X362*4)+(Z362*2) -> 20
A363: BEST PLAYERS | W363: CAMBERWELL | X363: 3 | Y363: 7 | Z363: 0 | AA363: 859 | AB363: 970 | AC363: =(AA363*100)/AB363 -> 88.55670103092784 | AD363: =(X363*4)+(Z363*2) -> 12
A364: BRIGHTON-CAULFIELD | C364: FOX | F364: ROWE | I364: BURNS | L364: CHANDLER | O364: LEE | Q364: KEE | W364: BOX HILL | X364: 2 | Y364: 8 | Z364: 0 | AA364: 737 | AB364: 957 | AC364: =(AA364*100)/AB364 -> 77.011494252873561 | AD364: =(X364*4)+(Z364*2) -> 8
A365: NORTHCOTE | C365: MCBREEN | F365: LAVER | I365: YOUNG | L365: R LANGBORNE | O365: NRUSH | Q365: CRAMERI
A366: GOALKICKERS
A367: BRIGHTON-CAULFIELD | C367: KEE 4 | E367: FOX 3 | G367: BRYAN 3 | I367: HUNT 2 | K367: K KUPSCH
A368: NORTHCOTE | C368: MISSON 2 | F368: CRAMERI | I368: R LANGBORNE | L368: MULLENGER | O368: BAILEY
A370: GEELONG WEST | E370: =C370*6+D370 -> 0 | I370: =G370*6+H370 -> 0 | M370: =K370*6+L370 -> 0 | O370: 6 | P370: 12 | Q370: =O370*6+P370 -> 48 | S370: GEELONG WEST
A371: CAMBERWELL | E371: =C371*6+D371 -> 0 | I371: =G371*6+H371 -> 0 | M371: =K371*6+L371 -> 0 | O371: 6 | P371: 8 | Q371: =O371*6+P371 -> 44
A372: BEST PLAYERS
A373: GEELONG WEST | C373: WILLIAMS | F373: McDONALD | I373: GRANT | L373: NICHOLLS | O373: COLTISH | Q373: JENNINGS
A374: CAMBERWELL | C374: GAUDION | F374: MACKIE | I374: QUIRK | L374: J SMITH | O374: CRIPPS | Q374: O'NEILL
A375: GOALKICKERS
A376: GEELONG WEST | C376: McDONALD 3 | F376: HARDIMAN | I376: GRANT | K376: GOGGIN
A377: CAMBERWELL | C377: J SMITH 2 | F377: QUIRK 2 | I377: O'NEILL | K377: K SMITH
E378: 21ST JUNE | I378: WEATHER
A379: MORDIALLOC | E379: =C379*6+D379 -> 0 | I379: =G379*6+H379 -> 0 | M379: =K379*6+L379 -> 0 | O379: 8 | P379: 8 | Q379: =O379*6+P379 -> 56 | S379: MORDIALLOC
A380: PRAHRAN | E380: =C380*6+D380 -> 0 | I380: =G380*6+H380 -> 0 | M380: =K380*6+L380 -> 0 | O380: 8 | P380: 6 | Q380: =O380*6+P380 -> 54
A381: BEST PLAYERS
A382: MORDIALLOC | C382: HASSETT | F382: LESLIE | I382: BLAINEY | L382: DANCKERT | O382: WILLIAMSON | R382: STEWART
A383: PRAHRAN | C383: McMAHON | F383: CORRIGAN | I383: PIPER | L383: SEEDY | O383: LAMBERT | R383: SHEEDY
A384: GOALKICKERS
A385: MORDIALLOC | C385: MORRISON 4 | F385: CAREY 2 | I385: HASSETT | L385: O'BRIEN
A386: PRAHRAN | C386: SEEDY 3 | F386: PIPER 2 | I386: CRIPPS | K386: SHEEDY | M386: DORAN
A388: ROUND 11 | E388: 27TH JUNE | I388: WEATHER | S388: PLAYED AT
D389: 1ST QTR | H389: 2ND QTR | L389: 3RD QTR | P389: FINAL | S389: BOX HILL
A390: MORDIALLOC | E390: =C390*6+D390 -> 0 | I390: =G390*6+H390 -> 0 | M390: =K390*6+L390 -> 0 | O390: 14 | P390: 11 | Q390: =O390*6+P390 -> 95 | S390: UMPIRE | X390: LADDER | AB390: ROUND | AD390: 11
A391: BOX HILL | E391: =C391*6+D391 -> 0 | I391: =G391*6+H391 -> 0 | M391: =K391*6+L391 -> 0 | O391: 9 | P391: 15 | Q391: =O391*6+P391 -> 69
A392: BEST PLAYERS | W392: TEAM | X392: W | Y392: L | Z392: D | AA392: FOR | AB392: AGST | AC392: % | AD392: PTS
A393: MORDIALLOC | C393: CAREY | F393: PORTA | I393: O'BRIEN | L393: FULLER | O393: WILSON | R393: BLAINEY
A394: BOX HILL | C394: P QUINN | F394: PORTEOUS | I394: LEHMAN | L394: MACE | O394: OGILVIE | R394: PLUNKETT | W394: MORDIALLOC | X394: 8 | Y394: 3 | Z394: 0 | AA394: 866 | AB394: 722 | AC394: =(AA394*100)/AB394 -> 119.94459833795014 | AD394: =(X394*4)+(Z394*2) -> 32
A395: GOALKICKERS | W395: SUNSHINE | X395: 7 | Y395: 4 | Z395: 0 | AA395: 932 | AB395: 711 | AC395: =(AA395*100)/AB395 -> 131.08298171589311 | AD395: =(X395*4)+(Z395*2) -> 28
A396: MORDIALLOC | C396: CAREY 4 | E396: O'BRIEN 2 | G396: FULLER 2 | I396: PORTA 2 | K396: WILSON 2 | M396: POOLEY | O396: LILLEY | W396: BRIGHTON-CAULFIELD | X396: 7 | Y396: 4 | Z396: 0 | AA396: 952 | AB396: 893 | AC396: =(AA396*100)/AB396 -> 106.60694288913774 | AD396: =(X396*4)+(Z396*2) -> 28
A397: BOX HILL | C397: P QUINN 2 | F397: SALVADO 2 | I397: GARDINER 2 | L397: PLUNKETT 2 | O397: MACE | W397: NORTHCOTE | X397: 6 | Y397: 5 | Z397: 0 | AA397: 862 | AB397: 887 | AC397: =(AA397*100)/AB397 -> 97.181510710259303 | AD397: =(X397*4)+(Z397*2) -> 24
A399: BRIGHTON-CAULFIELD | E399: =C399*6+D399 -> 0 | I399: =G399*6+H399 -> 0 | M399: =K399*6+L399 -> 0 | O399: 12 | P399: 12 | Q399: =O399*6+P399 -> 84 | S399: CAMBERWELL | W399: GEELONG WEST | X399: 6 | Y399: 5 | Z399: 0 | AA399: 848 | AB399: 878 | AC399: =(AA399*100)/AB399 -> 96.583143507972665 | AD399: =(X399*4)+(Z399*2) -> 24
A400: CAMBERWELL | E400: =C400*6+D400 -> 0 | I400: =G400*6+H400 -> 0 | M400: =K400*6+L400 -> 0 | O400: 10 | P400: 14 | Q400: =O400*6+P400 -> 74 | W400: PRAHRAN | X400: 5 | Y400: 6 | Z400: 0 | AA400: 797 | AB400: 786 | AC400: =(AA400*100)/AB400 -> 101.39949109414758 | AD400: =(X400*4)+(Z400*2) -> 20
A401: BEST PLAYERS | W401: CAMBERWELL | X401: 3 | Y401: 8 | Z401: 0 | AA401: 933 | AB401: 1054 | AC401: =(AA401*100)/AB401 -> 88.519924098671723 | AD401: =(X401*4)+(Z401*2) -> 12
A402: BRIGHTON-CAULFIELD | C402: ROWE | F402: ROLFE | I402: RANSOM | L402: LEE | O402: HUNT | R402: W KUPSCH | W402: BOX HILL | X402: 2 | Y402: 9 | Z402: 0 | AA402: 806 | AB402: 1052 | AC402: =(AA402*100)/AB402 -> 76.615969581749056 | AD402: =(X402*4)+(Z402*2) -> 8
A403: CAMBERWELL | C403: CRIPPS | F403: GAUDION | I403: O'NEILL | L403: PEMBERTON | O403: MACKIE | R403: WITHERS
A404: GOALKICKERS
A405: BRIGHTON-CAULFIELD | C405: ROWE 3 | E405: HUNT 2 | G405: LEE 2 | I405: W KUPSCH 2 | L405: KEE | N405: BURNS | P405: K KUPSCH
A406: CAMBERWELL | C406: O'NEILL 4 | F406: HAFEY 2 | I406: CRIPPS | K406: PEARSON | M406: J SMITH | O406: FRIEBERG
E407: 28TH JUNE | I407: WEATHER
A408: GEELONG WEST | E408: =C408*6+D408 -> 0 | I408: =G408*6+H408 -> 0 | M408: =K408*6+L408 -> 0 | O408: 8 | P408: 14 | Q408: =O408*6+P408 -> 62 | S408: TOORAK PARK
A409: PRAHRAN | E409: =C409*6+D409 -> 0 | I409: =G409*6+H409 -> 0 | M409: =K409*6+L409 -> 0 | O409: 5 | P409: 14 | Q409: =O409*6+P409 -> 44
A410: BEST PLAYERS
A411: GEELONG WEST | C411: NICHOLLS | F411: BELL | I411: CROFT | L411: GRANT | O411: BENNETT | R411: CRONIN
A412: PRAHRAN | C412: LAMBERT | F412: KIRBY | I412: KERLEY | L412: SHEEDY | O412: SEEDY | R412: HARRIS
A413: GOALKICKERS
A414: GEELONG WEST | C414: GRANT 3 | F414: MACKAY 2 | I414: BENNETT | L414: CROFT | N414: McDONALD
A415: PRAHRAN | C415: KERLEY 2 | F415: CRIPPS | I415: SHEEDY | L415: PIPER
A417: SUNSHINE | E417: =C417*6+D417 -> 0 | I417: =G417*6+H417 -> 0 | M417: =K417*6+L417 -> 0 | O417: 8 | P417: 17 | Q417: =O417*6+P417 -> 65 | S417: NORTHCOTE
A418: NORTHCOTE | E418: =C418*6+D418 -> 0 | I418: =G418*6+H418 -> 0 | M418: =K418*6+L418 -> 0 | O418: 6 | P418: 10 | Q418: =O418*6+P418 -> 46
A419: BEST PLAYERS
A420: SUNSHINE | C420: HOWARD | F420: SLATTERY | I420: CROSBIE | L420: FERGUSON | N420: ROACH | Q420: STEVENS
A421: NORTHCOTE | C421: WEGENER | F421: McBREEN | I421: CRAMERI | L421: BRUSH | N421: R LANGBORNE | Q421: MULLENGER
A422: GOALKICKERS
A423: SUNSHINE | C423: SLATTERY 4 | F423: STEVENS 2 | I423: HOWARD 2
A424: NORTHCOTE | C424: SIMPSON 2 | F424: EASTAWAY 2 | I424: McBREEN | L424: C LANGBORNE
A426: ROUND 12 | E426: 4TH JULY | I426: WEATHER | S426: PLAYED AT
D427: 1ST QTR | H427: 2ND QTR | L427: 3RD QTR | P427: FINAL | S427: PRINCES PARK, CAULFIELD
A428: PRAHRAN | E428: =C428*6+D428 -> 0 | I428: =G428*6+H428 -> 0 | M428: =K428*6+L428 -> 0 | O428: 10 | P428: 32 | Q428: =O428*6+P428 -> 92 | S428: UMPIRE | X428: LADDER | AB428: ROUND | AD428: 12
A429: BRIGHTON-CAULFIELD | E429: =C429*6+D429 -> 0 | I429: =G429*6+H429 -> 0 | M429: =K429*6+L429 -> 0 | O429: 11 | P429: 7 | Q429: =O429*6+P429 -> 73
A430: BEST PLAYERS | W430: TEAM | X430: W | Y430: L | Z430: D | AA430: FOR | AB430: AGST | AC430: % | AD430: PTS
A431: PRAHRAN | C431: LAMBERT | F431: KERLEY | I431: SEEDY | L431: WINTER | O431: MOONEY | R431: KIRBY
A432: BRIGHTON-CAULFIELD | W432: SUNSHINE | X432: 8 | Y432: 4 | Z432: 0 | AA432: 1015 | AB432: 744 | AC432: =(AA432*100)/AB432 -> 136.42473118279571 | AD432: =(X432*4)+(Z432*2) -> 32
A433: GOALKICKERS | W433: MORDIALLOC | X433: 8 | Y433: 4 | Z433: 0 | AA433: 902 | AB433: 773 | AC433: =(AA433*100)/AB433 -> 116.6882276843467 | AD433: =(X433*4)+(Z433*2) -> 32
A434: PRAHRAN | C434: PIPER 3 | E434: SEEDY 3 | H434: CORRIGAN 2 | K434: SHEEDY | M434: STEELE | W434: BRIGHTON-CAULFIELD | X434: 7 | Y434: 5 | Z434: 0 | AA434: 1025 | AB434: 985 | AC434: =(AA434*100)/AB434 -> 104.06091370558376 | AD434: =(X434*4)+(Z434*2) -> 28
A435: BRIGHTON-CAULFIELD | C435: W KUPSCH 3 | F435: BRYAN 2 | I435: KEE 2 | K435: MOORE | M435: BURNS | O435: CHANDLER | R435: ROWE | W435: GEELONG WEST | X435: 7 | Y435: 5 | Z435: 0 | AA435: 911 | AB435: 914 | AC435: =(AA435*100)/AB435 -> 99.671772428884026 | AD435: =(X435*4)+(Z435*2) -> 28
A437: GEELONG WEST | E437: =C437*6+D437 -> 0 | I437: =G437*6+H437 -> 0 | M437: =K437*6+L437 -> 0 | O437: 7 | P437: 21 | Q437: =O437*6+P437 -> 63 | S437: GEELONG WEST | W437: NORTHCOTE | X437: 7 | Y437: 5 | Z437: 0 | AA437: 913 | AB437: 923 | AC437: =(AA437*100)/AB437 -> 98.916576381365118 | AD437: =(X437*4)+(Z437*2) -> 28
A438: BOX HILL | E438: =C438*6+D438 -> 0 | I438: =G438*6+H438 -> 0 | M438: =K438*6+L438 -> 0 | O438: 5 | P438: 6 | Q438: =O438*6+P438 -> 36 | W438: PRAHRAN | X438: 6 | Y438: 6 | Z438: 0 | AA438: 889 | AB438: 859 | AC438: =(AA438*100)/AB438 -> 103.49243306169966 | AD438: =(X438*4)+(Z438*2) -> 24
A439: BEST PLAYERS | W439: CAMBERWELL | X439: 3 | Y439: 9 | Z439: 0 | AA439: 966 | AB439: 1137 | AC439: =(AA439*100)/AB439 -> 84.96042216358839 | AD439: =(X439*4)+(Z439*2) -> 12
A440: GEELONG WEST | C440: McDONALD | F440: BELL | I440: HARDIMAN | L440: BENNSTT | O440: CROFT | Q440: NICHOLLS | W440: BOX HILL | X440: 2 | Y440: 10 | Z440: 0 | AA440: 842 | AB440: 1115 | AC440: =(AA440*100)/AB440 -> 75.515695067264573 | AD440: =(X440*4)+(Z440*2) -> 8
A441: BOX HILL | C441: P QUINN | F441: MACE | I441: GARDINER | L441: GRAY | O441: OGILVIE | Q441: JOHNSTON
A442: GOALKICKERS
A443: GEELONG WEST | C443: MACKAY 2 | F443: HOVEY | I443: GOGGIN | K443: CROFT | M443: GRANT | O443: McDONALD
A444: BOX HILL | C444: PLUNKETT 2 | F444: MACE | I444: GARDINER | L444: HOBBS
A446: SUNSHINE | E446: =C446*6+D446 -> 0 | I446: =G446*6+H446 -> 0 | M446: =K446*6+L446 -> 0 | O446: 11 | P446: 17 | Q446: =O446*6+P446 -> 83 | S446: CAMBERWELL
A447: CAMBERWELL | E447: =C447*6+D447 -> 0 | I447: =G447*6+H447 -> 0 | M447: =K447*6+L447 -> 0 | O447: 4 | P447: 9 | Q447: =O447*6+P447 -> 33
A448: BEST PLAYERS
A449: SUNSHINE | C449: M FITZGERALD | F449: WAPLING | I449: CROSBIE | L449: SLATTERY | O449: HOWARD | R449: ROACH
A450: CAMBERWELL | C450: WITHERS | F450: QUIRK | I450: FRIEBERG | L450: MACKIE | O450: CRIPPS | R450: K SMITH
A451: GOALKICKERS
A452: SUNSHINE | C452: WAPLING 3 | F452: HOWARD 3 | I452: M FITZGERALD | L452: CROSBIE | N452: SLATTERY | Q452: STEVENS | T452: BELL
A453: CAMBERWELL | C453: K SMITH 2 | F453: O'NEILL | I453: QUIRK
E454: 5TH JULY | I454: WEATHER
A455: NORTHCOTE | E455: =C455*6+D455 -> 0 | I455: =G455*6+H455 -> 0 | M455: =K455*6+L455 -> 0 | O455: 7 | P455: 9 | Q455: =O455*6+P455 -> 51 | S455: MORDIALLOC
A456: MORDIALLOC | E456: =C456*6+D456 -> 0 | I456: =G456*6+H456 -> 0 | M456: =K456*6+L456 -> 0 | O456: 4 | P456: 12 | Q456: =O456*6+P456 -> 36
A457: BEST PLAYERS
A458: NORTHCOTE | C458: McBREEN | F458: MISSON | I458: C LANGBORNE | L458: BRASH | O458: SIMPSON
A459: MORDIALLOC | C459: FROST | F459: HOBSON | I459: HASSETT | L459: LESLIE
A460: GOALKICKERS
A461: NORTHCOTE | C461: C LANGBORNE 2 | F461: MISSON | I461: SIMPSON | L461: PITTS | N461: MORRISON | Q461: R LANGBORNE
A462: MORDIALLOC | C462: MORRISON | F462: CARDER | I462: FROST | L462: 1 SHORT
A464: ROUND 13 | E464: 11TH JULY | I464: WEATHER | S464: PLAYED AT
D465: 1ST QTR | H465: 2ND QTR | L465: 3RD QTR | P465: FINAL | S465: BOX HILL
A466: BOX HILL | E466: =C466*6+D466 -> 0 | I466: =G466*6+H466 -> 0 | M466: =K466*6+L466 -> 0 | O466: 17 | P466: 14 | Q466: =O466*6+P466 -> 116 | S466: UMPIRE | X466: LADDER | AB466: ROUND | AD466: 13
A467: PRAHRAN | E467: =C467*6+D467 -> 0 | I467: =G467*6+H467 -> 0 | M467: =K467*6+L467 -> 0 | O467: 8 | P467: 15 | Q467: =O467*6+P467 -> 63
A468: BEST PLAYERS | W468: TEAM | X468: W | Y468: L | Z468: D | AA468: FOR | AB468: AGST | AC468: % | AD468: PTS
A469: BOX HILL | C469: P QUINN | F469: JOHNSTON | I469: MACE | L469: GARDINER | O469: MAHON | Q469: J QUINN
A470: PRAHRAN | C470: PEARSON | F470: McMAHON | I470: PIPER | L470: MORRISON | O470: JONES | Q470: MOONEY | W470: SUNSHINE | X470: 9 | Y470: 4 | Z470: 0 | AA470: 1135 | AB470: 806 | AC470: =(AA470*100)/AB470 -> 140.81885856079404 | AD470: =(X470*4)+(Z470*2) -> 36
A471: GOALKICKERS | W471: MORDIALLOC | X471: 8 | Y471: 5 | Z471: 0 | AA471: 944 | AB471: 835 | AC471: =(AA471*100)/AB471 -> 113.05389221556887 | AD471: =(X471*4)+(Z471*2) -> 32
A472: BOX HILL | C472: P QUINN 4 | F472: MACE 4 | H472: GARDINER 3 | K472: BATES 2 | M472: HOBBS 2 | O472: PLUNKETT | R472: JOHNSTON | W472: GEELONG WEST | X472: 8 | Y472: 5 | Z472: 0 | AA472: 973 | AB472: 956 | AC472: =(AA472*100)/AB472 -> 101.77824267782427 | AD472: =(X472*4)+(Z472*2) -> 32
A473: PRAHRAN | C473: PEARSON 2 | F473: WINTER | H473: CORRIGAN | K473: PIPER | M473: MOONEY | O473: JONES | Q473: SHEEDY | W473: BRIGHTON-CAULFIELD | X473: 7 | Y473: 6 | Z473: 0 | AA473: 1087 | AB473: 1105 | AC473: =(AA473*100)/AB473 -> 98.371040723981906 | AD473: =(X473*4)+(Z473*2) -> 28
A475: SUNSHINE | E475: =C475*6+D475 -> 0 | I475: =G475*6+H475 -> 0 | M475: =K475*6+L475 -> 0 | O475: 18 | P475: 12 | Q475: =O475*6+P475 -> 120 | S475: SUNSHINE | W475: NORTHCOTE | X475: 7 | Y475: 6 | Z475: 0 | AA475: 1018 | AB475: 1036 | AC475: =(AA475*100)/AB475 -> 98.262548262548265 | AD475: =(X475*4)+(Z475*2) -> 28
A476: BRIGHTON-CAULFIELD | E476: =C476*6+D476 -> 0 | I476: =G476*6+H476 -> 0 | M476: =K476*6+L476 -> 0 | O476: 9 | P476: 8 | Q476: =O476*6+P476 -> 62 | W476: PRAHRAN | X476: 6 | Y476: 7 | Z476: 0 | AA476: 952 | AB476: 975 | AC476: =(AA476*100)/AB476 -> 97.641025641025635 | AD476: =(X476*4)+(Z476*2) -> 24
A477: BEST PLAYERS | W477: CAMBERWELL | X477: 4 | Y477: 9 | Z477: 0 | AA477: 1079 | AB477: 1242 | AC477: =(AA477*100)/AB477 -> 86.876006441223836 | AD477: =(X477*4)+(Z477*2) -> 16
A478: SUNSHINE | C478: CROSBIE | F478: FERGUSON | I478: LAWRENCE | L478: SLATTERY | O478: TREZISE | Q478: KAVANAGH | W478: BOX HILL | X478: 3 | Y478: 10 | Z478: 0 | AA478: 958 | AB478: 1178 | AC478: =(AA478*100)/AB478 -> 81.324278438030561 | AD478: =(X478*4)+(Z478*2) -> 12
A479: BRIGHTON-CAULFIELD | C479: RANSOM | F479: W KUPSCH | I479: ROWE | L479: ROLFE | O479: KEE | Q479: PICKERING
A480: GOALKICKERS
A481: SUNSHINE | C481: CROSBIE 6 | E481: DOLL 5 | G481: HOWARD 2 | J481: M FITZGERALD | N481: WAPLING | Q481: SLATTERY | T481: STEVENS | W481: HENDERSON
A482: BRIGHTON-CAULFIELD | C482: W KUPSCH 4 | G482: K KUPSCH 2 | J482: KEE 2 | L482: BRYAN
E483: 12TH JULY | I483: WEATHER
A484: GEELONG WEST | E484: =C484*6+D484 -> 0 | I484: =G484*6+H484 -> 0 | M484: =K484*6+L484 -> 0 | O484: 9 | P484: 8 | Q484: =O484*6+P484 -> 62 | S484: MORDIALLOC
A485: MORDIALLOC | E485: =C485*6+D485 -> 0 | I485: =G485*6+H485 -> 0 | M485: =K485*6+L485 -> 0 | O485: 5 | P485: 12 | Q485: =O485*6+P485 -> 42
A486: BEST PLAYERS
A487: GEELONG WEST | C487: BENNETT | F487: NICHOLLS | I487: CRONIN | L487: VAN T'HAG | O487: RITCHIE | Q487: STACEY
A488: MORDIALLOC | C488: HEESON | F488: FULLER | I488: DANCKERT | L488: LAIRD | O488: FROST | Q488: WILSON
A489: GOALKICKERS
A490: GEELONG WEST | C490: STACEY 3 | F490: HARDIMAN 2 | I490: RITCHIE 2 | L490: GOGGIN | N490: GRANT
A491: MORDIALLOC | C491: FULLER | E491: WILSON | H491: WILLIAMS | K491: CARDER | M491: PORTA
A493: CAMBERWELL | E493: =C493*6+D493 -> 0 | I493: =G493*6+H493 -> 0 | M493: =K493*6+L493 -> 0 | O493: 16 | P493: 17 | Q493: =O493*6+P493 -> 113 | S493: NORTHCOTE
A494: NORTHCOTE | E494: =C494*6+D494 -> 0 | I494: =G494*6+H494 -> 0 | M494: =K494*6+L494 -> 0 | O494: 16 | P494: 9 | Q494: =O494*6+P494 -> 105
A495: BEST PLAYERS
A496: CAMBERWELL | C496: O'NEILL | F496: CRIPPS | I496: J SMITH | L496: K SMITH | O496: ANDERSON | R496: WINSELL
A497: NORTHCOTE | C497: R LANGBORNE | F497: DUNCAN | I497: LACHMUND | L497: CRAMERI | O497: McBREEN | R497: GRYBAS
A498: GOALKICKERS
A499: CAMBERWELL | C499: O'NEILL 10 | F499: CRIPPS 2 | I499: J SMITH 2 | L499: FRIEBERG | N499: K SMITH
A500: NORTHCOTE | C500: LACHMUND 4 | F500: MISSON 3 | I500: GRYBAS 3 | L500: DUNCAN 2 | N500: C LANGBORNE | Q500: R LANGBORNE | U500: PITTS | W500: MORRISON
A502: ROUND 14 | E502: 18TH JULY | I502: WEATHER | S502: PLAYED AT
D503: 1ST QTR | H503: 2ND QTR | L503: 3RD QTR | P503: FINAL | S503: CAMBERWELL
A504: MORDIALLOC | E504: =C504*6+D504 -> 0 | I504: =G504*6+H504 -> 0 | M504: =K504*6+L504 -> 0 | O504: 16 | P504: 14 | Q504: =O504*6+P504 -> 110 | S504: UMPIRE | X504: LADDER | AB504: ROUND | AD504: 14
A505: CAMBERWELL | E505: =C505*6+D505 -> 0 | I505: =G505*6+H505 -> 0 | M505: =K505*6+L505 -> 0 | O505: 8 | P505: 9 | Q505: =O505*6+P505 -> 57
A506: BEST PLAYERS | W506: TEAM | X506: W | Y506: L | Z506: D | AA506: FOR | AB506: AGST | AC506: % | AD506: PTS
A507: MORDIALLOC | C507: LAIRD | F507: PEAKE | I507: HASSETT | L507: DANCKERT | O507: BIBRON | Q507: WILLIAMSON
A508: CAMBERWELL | C508: HAFEY | F508: FRIEBERG | I508: McKERNAN | L508: ADAMS | O508: K SMITH | Q508: ANDERSON | W508: SUNSHINE | X508: 10 | Y508: 4 | Z508: 0 | AA508: 1210 | AB508: 850 | AC508: =(AA508*100)/AB508 -> 142.35294117647058 | AD508: =(X508*4)+(Z508*2) -> 40
A509: GOALKICKERS | W509: MORDIALLOC | X509: 9 | Y509: 5 | Z509: 0 | AA509: 1054 | AB509: 892 | AC509: =(AA509*100)/AB509 -> 118.16143497757848 | AD509: =(X509*4)+(Z509*2) -> 36
A510: MORDIALLOC | C510: POWER 4 | F510: HASSETT 4 | I510: LAIRD 3 | K510: BIBRON 2 | M510: O'BRIEN | O510: FULLER | Q510: ROSENBROCK | W510: GEELONG WEST | X510: 9 | Y510: 5 | Z510: 0 | AA510: 1059 | AB510: 985 | AC510: =(AA510*100)/AB510 -> 107.51269035532995 | AD510: =(X510*4)+(Z510*2) -> 36
A511: CAMBERWELL | C511: O'NEILL 2 | F511: HAFEY 2 | I511: J SMITH | K511: QUINN | M511: McKERNAN | P511: ANDERSON | W511: BRIGHTON-CAULFIELD | X511: 8 | Y511: 6 | Z511: 0 | AA511: 1168 | AB511: 1179 | AC511: =(AA511*100)/AB511 -> 99.067005937234939 | AD511: =(X511*4)+(Z511*2) -> 32
A513: BRIGHTON-CAULFIELD | E513: =C513*6+D513 -> 0 | I513: =G513*6+H513 -> 0 | M513: =K513*6+L513 -> 0 | O513: 10 | P513: 21 | Q513: =O513*6+P513 -> 81 | S513: PRINCES PARK, CAULFIELD | W513: NORTHCOTE | X513: 7 | Y513: 7 | Z513: 0 | AA513: 1047 | AB513: 1122 | AC513: =(AA513*100)/AB513 -> 93.315508021390372 | AD513: =(X513*4)+(Z513*2) -> 28
A514: BOX HILL | E514: =C514*6+D514 -> 0 | I514: =G514*6+H514 -> 0 | M514: =K514*6+L514 -> 0 | O514: 10 | P514: 14 | Q514: =O514*6+P514 -> 74 | W514: PRAHRAN | X514: 6 | Y514: 8 | Z514: 0 | AA514: 996 | AB514: 1050 | AC514: =(AA514*100)/AB514 -> 94.857142857142861 | AD514: =(X514*4)+(Z514*2) -> 24
A515: BEST PLAYERS | W515: CAMBERWELL | X515: 4 | Y515: 10 | Z515: 0 | AA515: 1136 | AB515: 1352 | AC515: =(AA515*100)/AB515 -> 84.023668639053255 | AD515: =(X515*4)+(Z515*2) -> 16
A516: BRIGHTON-CAULFIELD | C516: RANSOM | F516: KEE | I516: W KUPSCH | L516: GUTTERSON | O516: EVANS | Q516: DE BOND | W516: BOX HILL | X516: 3 | Y516: 11 | Z516: 0 | AA516: 1032 | AB516: 1259 | AC516: =(AA516*100)/AB516 -> 81.969817315329621 | AD516: =(X516*4)+(Z516*2) -> 12
A517: BOX HILL | C517: BATES | F517: HOBBS | I517: JOHNSTON | L517: R GRIGG | O517: MAHON | Q517: J QUINN
A518: GOALKICKERS
A519: BRIGHTON-CAULFIELD | C519: PALLIN 3 | F519: W KUPSCH 2 | I519: ROWE | K519: BURNS | M519: PICKERING | P519: LEE | Q519: GUTTERSON
A520: BOX HILL | C520: MACE 2 | F520: GARDINER 2 | I520: PLUNKETT 2 | L520: LA ROCHE 2 | O520: BRYANT | Q520: JOHNSTON
E521: 19TH JULY | I521: WEATHER
A522: GEELONG WEST | E522: =C522*6+D522 -> 0 | I522: =G522*6+H522 -> 0 | M522: =K522*6+L522 -> 0 | O522: 12 | P522: 14 | Q522: =O522*6+P522 -> 86 | S522: GEELONG WEST
A523: NORTHCOTE | E523: =C523*6+D523 -> 0 | I523: =G523*6+H523 -> 0 | M523: =K523*6+L523 -> 0 | O523: 4 | P523: 5 | Q523: =O523*6+P523 -> 29
A524: BEST PLAYERS
A525: GEELONG WEST | C525: NICHOLLS | F525: BENNETT | I525: JENNINGS | L525: CRONIN | O525: RITCHIE | R525: COLTISH
A526: NORTHCOTE | C526: WEGENER | F526: McBREE | I526: BRUSH | L526: R LANGBORNE | O526: DOWLING | R526: CRAMERI
A527: GOALKICKERS
A528: GEELONG WEST | C528: McDONALD 3 | F528: SOUTHERN 2 | I528: GOGGIN 2 | L528: VAN T'HAG | O528: HARDIMAN | R528: GRANT | U528: HOVEY | W528: STACEY
A529: NORTHCOTE | C529: CRAMERI | F529: BRADY | I529: LACHMUND | L529: PITTS
A531: SUNSHINE | E531: =C531*6+D531 -> 0 | I531: =G531*6+H531 -> 0 | M531: =K531*6+L531 -> 0 | O531: 11 | P531: 9 | Q531: =O531*6+P531 -> 75 | S531: TOORAK PARK
A532: PRAHRAN | E532: =C532*6+D532 -> 0 | I532: =G532*6+H532 -> 0 | M532: =K532*6+L532 -> 0 | O532: 6 | P532: 8 | Q532: =O532*6+P532 -> 44
A533: BEST PLAYERS
A534: SUNSHINE | C534: KAVANAGH | F534: CROSBIE | I534: HOWARD | L534: WAPLING | O534: SLATTERY | R534: TREZISE
A535: PRAHRAN | C535: KIRBY | F535: PEARSON | I535: KERLEY | L535: YOUNG | O535: HARTNETT | R535: PIPER
A536: GOALKICKERS
A537: SUNSHINE | C537: SLATTERY 3 | F537: DOLL 3 | H537: STEVENS | J537: CROSBIE | M537: WAPLING | O537: HOWARD | R537: M FITZGERALD
A538: PRAHRAN | C538: PEARSON 5 | F538: PIPER
A540: ROUND 15 | E540: 25TH JULY | I540: WEATHER | S540: PLAYED AT
D541: 1ST QTR | H541: 2ND QTR | L541: 3RD QTR | P541: FINAL | S541: BOX HILL
A542: BOX HILL | E542: =C542*6+D542 -> 0 | I542: =G542*6+H542 -> 0 | M542: =K542*6+L542 -> 0 | O542: 10 | P542: 14 | Q542: =O542*6+P542 -> 74 | S542: UMPIRE | X542: LADDER | AB542: ROUND | AD542: 15
A543: NORTHCOTE | E543: =C543*6+D543 -> 0 | I543: =G543*6+H543 -> 0 | M543: =K543*6+L543 -> 0 | O543: 5 | P543: 14 | Q543: =O543*6+P543 -> 44
A544: BEST PLAYERS | W544: TEAM | X544: W | Y544: L | Z544: D | AA544: FOR | AB544: AGST | AC544: % | AD544: PTS
A545: BOX HILL | C545: P QUINN | F545: BRYANT | I545: WHITE | L545: MACE | N545: PLUNKETT | Q545: HOBBS
A546: NORTHCOTE | C546: CRAMERI | F546: M KEAYS | I546: BRADY | L546: R LANGBORNE | O546: LAVER | Q546: THOMPSON | W546: SUNSHINE | X546: 11 | Y546: 4 | Z546: 0 | AA546: 1281 | AB546: 893 | AC546: =(AA546*100)/AB546 -> 143.44904815229563 | AD546: =(X546*4)+(Z546*2) -> 44
A547: GOALKICKERS | W547: MORDIALLOC | X547: 9 | Y547: 6 | Z547: 0 | AA547: 1097 | AB547: 963 | AC547: =(AA547*100)/AB547 -> 113.91484942886812 | AD547: =(X547*4)+(Z547*2) -> 36
A548: BOX HILL | C548: P QUINN 3 | F548: MACE 2 | I548: BRYANT 2 | L548: WHITE 2 | N548: PLUNKETT | W548: GEELONG WEST | X548: 9 | Y548: 6 | Z548: 0 | AA548: 1129 | AB548: 1079 | AC548: =(AA548*100)/AB548 -> 104.63392029657089 | AD548: =(X548*4)+(Z548*2) -> 36
A549: NORTHCOTE | C549: BRADY 3 | F549: CRAMERI | I549: M KEAYS | W549: BRIGHTON-CAULFIELD | X549: 9 | Y549: 6 | Z549: 0 | AA549: 1262 | AB549: 1249 | AC549: =(AA549*100)/AB549 -> 101.0408326661329 | AD549: =(X549*4)+(Z549*2) -> 36
A551: BRIGHTON-CAULFIELD | E551: =C551*6+D551 -> 0 | I551: =G551*6+H551 -> 0 | M551: =K551*6+L551 -> 0 | O551: 14 | P551: 10 | Q551: =O551*6+P551 -> 94 | S551: PRINCES PARK, CAULFIELD | W551: NORTHCOTE | X551: 7 | Y551: 8 | Z551: 0 | AA551: 1091 | AB551: 1196 | AC551: =(AA551*100)/AB551 -> 91.220735785953181 | AD551: =(X551*4)+(Z551*2) -> 28
A552: GEELONG WEST | E552: =C552*6+D552 -> 0 | I552: =G552*6+H552 -> 0 | M552: =K552*6+L552 -> 0 | O552: 9 | P552: 16 | Q552: =O552*6+P552 -> 70 | W552: PRAHRAN | X552: 6 | Y552: 9 | Z552: 0 | AA552: 1071 | AB552: 1125 | AC552: =(AA552*100)/AB552 -> 95.2 | AD552: =(X552*4)+(Z552*2) -> 24
A553: BEST PLAYERS | W553: CAMBERWELL | X553: 5 | Y553: 10 | Z553: 0 | AA553: 1228 | AB553: 1427 | AC553: =(AA553*100)/AB553 -> 86.054660126138756 | AD553: =(X553*4)+(Z553*2) -> 20
A554: BRIGHTON-CAULFIELD | C554: BRYAN | F554: PICKERING | I554: RANSOM | L554: DE BOND | O554: BURNS | R554: LEE | W554: BOX HILL | X554: 4 | Y554: 11 | Z554: 0 | AA554: 1104 | AB554: 1303 | AC554: =(AA554*100)/AB554 -> 84.727551803530318 | AD554: =(X554*4)+(Z554*2) -> 16
A555: GEELONG WEST | C555: GRANT | F555: BELL | I555: VAN T'HAG | L555: RITCHIE | O555: HARDIMAN | R555: GOGGIN
A556: GOALKICKERS
A557: BRIGHTON-CAULFIELD | C557: BRYAN 5 | F557: ROWE 3 | I557: BURNS 2 | K557: LEE 2 | M557: MOORE | O557: W KUPSCH
A558: GEELONG WEST | C558: RITCHIE 4 | F558: NICHOLLS 2 | I558: BENNETT | L558: GOGGIN | N558: VAN T'HAG
E559: 26TH JULY | I559: WEATHER
A560: CAMBERWELL | E560: =C560*6+D560 -> 0 | I560: =G560*6+H560 -> 0 | M560: =K560*6+L560 -> 0 | O560: 14 | P560: 8 | Q560: =O560*6+P560 -> 92 | S560: TOORAK PARK
A561: PRAHRAN | E561: =C561*6+D561 -> 0 | I561: =G561*6+H561 -> 0 | M561: =K561*6+L561 -> 0 | O561: 11 | P561: 9 | Q561: =O561*6+P561 -> 75
A562: BEST PLAYERS
A563: CAMBERWELL | C563: MACKIE | F563: JONES | I563: GAUDION | L563: J SMITH | O563: K SMITH | R563: HAFEY
A564: PRAHRAN | C564: LAMBERT | F564: SEEDY | I564: SHEEDY | L564: HARTNETT | O564: CRIPPS | R564: YOUNG
A565: GOALKICKERS
A566: CAMBERWELL | C566: JONES 4 | F566: FRIEBERG 3 | I566: O'NEILL 3 | K566: K SMITH 2 | M566: QUIRK | O566: J SMITH
A567: PRAHRAN | C567: SEEDY 3 | F567: KERLEY 2 | I567: McMAHON 2 | L567: PEARSON | N567: CORRIGAN | Q567: SHEEDY | S567: STOKES
A569: SUNSHINE | E569: =C569*6+D569 -> 0 | I569: =G569*6+H569 -> 0 | M569: =K569*6+L569 -> 0 | O569: 10 | P569: 11 | Q569: =O569*6+P569 -> 71 | S569: SUNSHINE
A570: MORDIALLOC | E570: =C570*6+D570 -> 0 | I570: =G570*6+H570 -> 0 | M570: =K570*6+L570 -> 0 | O570: 5 | P570: 13 | Q570: =O570*6+P570 -> 43
A571: BEST PLAYERS
A572: SUNSHINE | C572: TREZISE | F572: FERGUSON | I572: CROSBIE | L572: SLATTERY | O572: ROACH | R572: WAPLING
A573: MORDIALLOC | C573: BLAINEY | F573: DANCKERT | I573: FULLER | L573: LESLIE | O573: MORRISON
A574: GOALKICKERS
A575: SUNSHINE | C575: HOWARD 3 | F575: SLATTERY 3 | I575: WAPLING 2 | L575: M FITZGERALD 2
A576: MORDIALLOC | C576: O'BRIEN 2 | F576: LAIRD | I576: LESLIE | L576: HASSETT
A578: ROUND 16 | E578: 1ST AUGUST | I578: WEATHER | S578: PLAYED AT
D579: 1ST QTR | H579: 2ND QTR | L579: 3RD QTR | P579: FINAL | S579: MORDIALLOC
A580: MORDIALLOC | E580: =C580*6+D580 -> 0 | I580: =G580*6+H580 -> 0 | M580: =K580*6+L580 -> 0 | O580: 11 | P580: 7 | Q580: =O580*6+P580 -> 73 | S580: UMPIRE | X580: LADDER | AB580: ROUND | AD580: 16
A581: BRIGHTON-CAULFIELD | E581: =C581*6+D581 -> 0 | I581: =G581*6+H581 -> 0 | M581: =K581*6+L581 -> 0 | O581: 6 | P581: 11 | Q581: =O581*6+P581 -> 47
A582: BEST PLAYERS | W582: TEAM | X582: W | Y582: L | Z582: D | AA582: FOR | AB582: AGST | AC582: % | AD582: PTS
A583: MORDIALLOC | C583: O'BRIEN | F583: POWER | I583: FULLER | L583: HASSETT | O583: LAIRD | R583: MORRISON
A584: BRIGHTON-CAULFIELD | C584: ROWE | F584: BRYAN | I584: LEE | L584: MOORE | O584: K KUPSCH | R584: HUNT | W584: SUNSHINE | X584: 12 | Y584: 4 | Z584: 0 | AA584: 1375 | AB584: 981 | AC584: =(AA584*100)/AB584 -> 140.16309887869522 | AD584: =(X584*4)+(Z584*2) -> 48
A585: GOALKICKERS | W585: MORDIALLOC | X585: 10 | Y585: 6 | Z585: 0 | AA585: 1170 | AB585: 1010 | AC585: =(AA585*100)/AB585 -> 115.84158415841584 | AD585: =(X585*4)+(Z585*2) -> 40
A586: MORDIALLOC | C586: O'BRIEN 3 | F586: POWER 3 | I586: MORRISON 2 | L586: LAIRD | N586: PORTA | Q586: HASSETT | W586: GEELONG WEST | X586: 9 | Y586: 7 | Z586: 0 | AA586: 1217 | AB586: 1173 | AC586: =(AA586*100)/AB586 -> 103.75106564364876 | AD586: =(X586*4)+(Z586*2) -> 36
A587: BRIGHTON-CAULFIELD | C587: BRYAN 2 | F587: ROWE 2 | I587: MOORE | K587: LEE | W587: BRIGHTON-CAULFIELD | X587: 9 | Y587: 7 | Z587: 0 | AA587: 1309 | AB587: 1322 | AC587: =(AA587*100)/AB587 -> 99.016641452344928 | AD587: =(X587*4)+(Z587*2) -> 36
A589: SUNSHINE | E589: =C589*6+D589 -> 0 | I589: =G589*6+H589 -> 0 | M589: =K589*6+L589 -> 0 | O589: 14 | P589: 10 | Q589: =O589*6+P589 -> 94 | S589: GEELONG WEST | W589: NORTHCOTE | X589: 8 | Y589: 8 | Z589: 0 | AA589: 1226 | AB589: 1222 | AC589: =(AA589*100)/AB589 -> 100.32733224222586 | AD589: =(X589*4)+(Z589*2) -> 32
A590: GEELONG WEST | E590: =C590*6+D590 -> 0 | I590: =G590*6+H590 -> 0 | M590: =K590*6+L590 -> 0 | O590: 13 | P590: 10 | Q590: =O590*6+P590 -> 88 | W590: PRAHRAN | X590: 6 | Y590: 10 | Z590: 0 | AA590: 1097 | AB590: 1260 | AC590: =(AA590*100)/AB590 -> 87.063492063492063 | AD590: =(X590*4)+(Z590*2) -> 24
A591: BEST PLAYERS | W591: CAMBERWELL | X591: 6 | Y591: 10 | Z591: 0 | AA591: 1277 | AB591: 1474 | AC591: =(AA591*100)/AB591 -> 86.635006784260511 | AD591: =(X591*4)+(Z591*2) -> 24
A592: SUNSHINE | C592: M FITZGERALD | F592: SLATTERY | I592: WAPLING | L592: HOWARD | O592: ROACH | R592: DOLL | W592: BOX HILL | X592: 4 | Y592: 12 | Z592: 0 | AA592: 1151 | AB592: 1352 | AC592: =(AA592*100)/AB592 -> 85.133136094674555 | AD592: =(X592*4)+(Z592*2) -> 16
A593: GEELONG WEST | C593: HARDIMAN | F593: GOGGIN | I593: RITCHIE | L593: SELLIN | O593: WILLIAMS | R593: JENNINGS
A594: GOALKICKERS
A595: SUNSHINE | C595: WAPLING 4 | F595: HOWARD 3 | I595: DOLL 3 | K595: McINTYRE 2 | N595: M FITZGERALD | R595: CROSBIE
A596: GEELONG WEST | C596: GOGGIN 4 | F596: HARDIMAN 2 | I596: McDONALD 2 | L596: STACEY | N596: GRANT | P596: RITCHIE | R596: WILLIAMS | U596: HEDLEY
A598: CAMBERWELL | E598: =C598*6+D598 -> 0 | I598: =G598*6+H598 -> 0 | M598: =K598*6+L598 -> 0 | O598: 6 | P598: 13 | Q598: =O598*6+P598 -> 49 | S598: CAMBERWELL
A599: BOX HILL | E599: =C599*6+D599 -> 0 | I599: =G599*6+H599 -> 0 | M599: =K599*6+L599 -> 0 | O599: 5 | P599: 17 | Q599: =O599*6+P599 -> 47
A600: BEST PLAYERS
A601: CAMBERWELL | C601: GAUDION | F601: HAFEY | I601: GIBSON | L601: McKERNAN | O601: ELLIOTT | R601: J SMITH
A602: BOX HILL | C602: MACE | F602: HEATLEY | I602: GARDINER | L602: D GRIGG | O602: JOHNSTON | R602: WHITE
A603: GOALKICKERS
A604: CAMBERWELL | C604: O'NEILL 2 | F604: J SMITH 2 | I604: GIBSON | L604: HAFEY
A605: BOX HILL | C605: MACE 2 | F605: PLUNKETT | I605: WHITE | L605: BATES
E606: 2ND AUGUST | I606: WEATHER
A607: NORTHCOTE | E607: =C607*6+D607 -> 0 | I607: =G607*6+H607 -> 0 | M607: =K607*6+L607 -> 0 | O607: 20 | P607: 15 | Q607: =O607*6+P607 -> 135 | S607: NORTHCOTE
A608: PRAHRAN | E608: =C608*6+D608 -> 0 | I608: =G608*6+H608 -> 0 | M608: =K608*6+L608 -> 0 | O608: 3 | P608: 8 | Q608: =O608*6+P608 -> 26
A609: BEST PLAYERS
A610: NORTHCOTE | C610: R LANGBORNE | F610: BRADY | I610: CRAMERI | L610: PITTS | O610: T KEAYS | R610: THOMPSON
A611: PRAHRAN | C611: HARTNETT | F611: SHEEDY | I611: LAMBERT | L611: McMAHON | O611: KERLEY | R611: O'BRIEN
A612: GOALKICKERS
A613: NORTHCOTE | C613: M KEAYS 4 | F613: DUNCAN 4 | I613: BRADY 3 | K613: CRAMERI 2 | N613: R LANGBORNE 2 | R613: PITTS 2 | T613: THOMPSON | W613: LAVER | X613: KEANE
A614: PRAHRAN | C614: PEARSON 2 | F614: KERLEY
A616: ROUND 17 | E616: 8TH AUGUST | I616: WEATHER | S616: PLAYED AT
D617: 1ST QTR | H617: 2ND QTR | L617: 3RD QTR | P617: FINAL | S617: BOX HILL
A618: SUNSHINE | E618: =C618*6+D618 -> 0 | I618: =G618*6+H618 -> 0 | M618: =K618*6+L618 -> 0 | O618: 8 | P618: 13 | Q618: =O618*6+P618 -> 61 | S618: UMPIRE | X618: LADDER | AB618: ROUND | AD618: 17
A619: BOX HILL | E619: =C619*6+D619 -> 0 | I619: =G619*6+H619 -> 0 | M619: =K619*6+L619 -> 0 | O619: 9 | P619: 6 | Q619: =O619*6+P619 -> 60
A620: BEST PLAYERS | W620: TEAM | X620: W | Y620: L | Z620: D | AA620: FOR | AB620: AGST | AC620: % | AD620: PTS
A621: SUNSHINE | C621: HOWARD | F621: WAPLING | I621: CROSBIE | L621: ROACH | N621: SLATTERY | Q621: McINTYRE
A622: BOX HILL | C622: R GRIGG | F622: MACE | I622: I BATES | L622: PLUNKETT | N622: J QUINN | Q622: JOHNSTON | W622: SUNSHINE | X622: 13 | Y622: 4 | Z622: 0 | AA622: 1436 | AB622: 1041 | AC622: =(AA622*100)/AB622 -> 137.94428434197886 | AD622: =(X622*4)+(Z622*2) -> 52
A623: GOALKICKERS | W623: MORDIALLOC | X623: 10 | Y623: 7 | Z623: 0 | AA623: 1251 | AB623: 1123 | AC623: =(AA623*100)/AB623 -> 111.39804096170971 | AD623: =(X623*4)+(Z623*2) -> 40
A624: SUNSHINE | C624: HOWARD 2 | F624: M FITZGERALD | I624: WAPLING | K624: CROSBIE | M624: SLATTERY | O624: McINTYRE | R624: DOLL | W624: GEELONG WEST | X624: 10 | Y624: 7 | Z624: 0 | AA624: 1316 | AB624: 1233 | AC624: =(AA624*100)/AB624 -> 106.73154906731548 | AD624: =(X624*4)+(Z624*2) -> 40
A625: BOX HILL | C625: J QUINN 3 | F625: JOHNSTON 2 | I625: MACE | K625: GARDINER | M625: PLUNKETT | P625: HOBBS | W625: BRIGHTON-CAULFIELD | X625: 10 | Y625: 7 | Z625: 0 | AA625: 1362 | AB625: 1365 | AC625: =(AA625*100)/AB625 -> 99.780219780219781 | AD625: =(X625*4)+(Z625*2) -> 40
A627: BRIGHTON-CAULFIELD | E627: =C627*6+D627 -> 0 | I627: =G627*6+H627 -> 0 | M627: =K627*6+L627 -> 0 | O627: 7 | P627: 11 | Q627: =O627*6+P627 -> 53 | S627: NORTHCOTE | W627: NORTHCOTE | X627: 8 | Y627: 9 | Z627: 0 | AA627: 1269 | AB627: 1275 | AC627: =(AA627*100)/AB627 -> 99.529411764705884 | AD627: =(X627*4)+(Z627*2) -> 32
A628: NORTHCOTE | E628: =C628*6+D628 -> 0 | I628: =G628*6+H628 -> 0 | M628: =K628*6+L628 -> 0 | O628: 5 | P628: 13 | Q628: =O628*6+P628 -> 43 | W628: PRAHRAN | X628: 7 | Y628: 10 | Z628: 0 | AA628: 1210 | AB628: 1341 | AC628: =(AA628*100)/AB628 -> 90.231170768083516 | AD628: =(X628*4)+(Z628*2) -> 28
A629: BEST PLAYERS | W629: CAMBERWELL | X629: 6 | Y629: 11 | Z629: 0 | AA629: 1337 | AB629: 1573 | AC629: =(AA629*100)/AB629 -> 84.99682136045773 | AD629: =(X629*4)+(Z629*2) -> 24
A630: BRIGHTON-CAULFIELD | C630: PICKERING | F630: EVANS | I630: ROWE | L630: BURNS | O630: GUTTERSON | R630: HUNT | W630: BOX HILL | X630: 4 | Y630: 13 | Z630: 0 | AA630: 1211 | AB630: 1413 | AC630: =(AA630*100)/AB630 -> 85.704175513092707 | AD630: =(X630*4)+(Z630*2) -> 16
A631: NORTHCOTE | C631: R LANGBORNE | F631: MARRIOTT | I631: CRAMERI | L631: THOMPSON | O631: McBREEN | R631: KEANE
A632: GOALKICKERS
A633: BRIGHTON-CAULFIELD | C633: BRYAN 3 | F633: ROWE 3 | I633: HUNT
A634: NORTHCOTE | C634: CRAMERI | F634: McBREEN | I634: R LANGBORNE | L634: KEANE | N634: M KEAYS
A636: GEELONG WEST | E636: =C636*6+D636 -> 0 | I636: =G636*6+H636 -> 0 | M636: =K636*6+L636 -> 0 | O636: 14 | P636: 15 | Q636: =O636*6+P636 -> 99 | S636: CAMBERWELL
A637: CAMBERWELL | E637: =C637*6+D637 -> 0 | I637: =G637*6+H637 -> 0 | M637: =K637*6+L637 -> 0 | O637: 9 | P637: 6 | Q637: =O637*6+P637 -> 60
A638: BEST PLAYERS
A639: GEELONG WEST | C639: HARDIMAN | F639: BELL | I639: LONG | L639: VAN T'HAG | O639: NICHOLLS | R639: WILLIAMS
A640: CAMBERWELL | C640: MACKIE | F640: PEMBERTON | I640: ELLIOTT | L640: GIBSON | O640: McKERNAN | R640: O'NEILL
A641: GOALKICKERS
A642: GEELONG WEST | C642: NICHOLLS 4 | F642: HARDIMAN 3 | I642: LONG 2 | K642: BENNETT | M642: GOGGIN | O642: CROFT | Q642: GRANT | S642: McDONALD
A643: CAMBERWELL | C643: O'NEILL 3 | F643: ELLIOTT 3 | I643: GIBSON | K643: WINSELL | M643: FRIEBERG
E644: 9TH AUGUST | I644: WEATHER
A645: PRAHRAN | E645: =C645*6+D645 -> 0 | I645: =G645*6+H645 -> 0 | M645: =K645*6+L645 -> 0 | O645: 17 | P645: 11 | Q645: =O645*6+P645 -> 113 | S645: TOORAK PARK
A646: MORDIALLOC | E646: =C646*6+D646 -> 0 | I646: =G646*6+H646 -> 0 | M646: =K646*6+L646 -> 0 | O646: 11 | P646: 15 | Q646: =O646*6+P646 -> 81
A647: BEST PLAYERS
A648: PRAHRAN | C648: LAMBERT | F648: CORRIGAN | I648: KERLEY | L648: SHEEDY | O648: MOONEY | R648: PEARSON
A649: MORDIALLOC | C649: BLAINEY | F649: DANCKERT | I649: POWER | L649: MORRISON | O649: FULLER | R649: KAVANAGH
A650: GOALKICKERS
A651: PRAHRAN | C651: PEARSON 4 | F651: CORRIGAN 4 | I651: SEEDY 3 | K651: SHEEDY 2 | M651: McMAHON 2 | P651: O'BRIEN | R651: PIPER
A652: MORDIALLOC | C652: POWER 7 | F652: RODENBROCK | I652: HASSETT | K652: GROVES | M652: WILLIAMS
A654: ROUND 18 | E654: 15TH AUGUST | I654: WEATHER | S654: PLAYED AT
D655: 1ST QTR | H655: 2ND QTR | L655: 3RD QTR | P655: FINAL | S655: MORDIALLOC
A656: MORDIALLOC | E656: =C656*6+D656 -> 0 | I656: =G656*6+H656 -> 0 | M656: =K656*6+L656 -> 0 | O656: 11 | P656: 8 | Q656: =O656*6+P656 -> 74 | S656: UMPIRE | X656: LADDER | AB656: ROUND | AD656: 18
A657: BOX HILL | E657: =C657*6+D657 -> 0 | I657: =G657*6+H657 -> 0 | M657: =K657*6+L657 -> 0 | O657: 6 | P657: 14 | Q657: =O657*6+P657 -> 50
A658: BEST PLAYERS | W658: TEAM | X658: W | Y658: L | Z658: D | AA658: FOR | AB658: AGST | AC658: % | AD658: PTS
A659: MORDIALLOC | C659: POWER | F659: LESLIE | I659: DANCKERT | L659: HASSETT | O659: PORTA | Q659: BATES
A660: BOX HILL | C660: WHITE | F660: D GRIGG | I660: I BATES | L660: PLUNKETT | O660: MACE | Q660: J QUINN | W660: SUNSHINE | X660: 14 | Y660: 4 | Z660: 0 | AA660: 1544 | AB660: 1102 | AC660: =(AA660*100)/AB660 -> 140.10889292196006 | AD660: =(X660*4)+(Z660*2) -> 56
A661: GOALKICKERS | W661: MORDIALLOC | X661: 11 | Y661: 7 | Z661: 0 | AA661: 1325 | AB661: 1173 | AC661: =(AA661*100)/AB661 -> 112.95822676896846 | AD661: =(X661*4)+(Z661*2) -> 44
A662: MORDIALLOC | C662: POWER 5 | F662: LESLIE 2 | I662: HASSETT 2 | L662: PORTA | N662: BATES | W662: GEELONG WEST | X662: 11 | Y662: 7 | Z662: 0 | AA662: 1415 | AB662: 1295 | AC662: =(AA662*100)/AB662 -> 109.26640926640927 | AD662: =(X662*4)+(Z662*2) -> 44
A663: BOX HILL | C663: HOBBS | E663: MACE | G663: PLUNKETT | I663: LOOMES | K663: WHITE | M663: JOHNSTON | W663: BRIGHTON-CAULFIELD | X663: 11 | Y663: 7 | Z663: 0 | AA663: 1503 | AB663: 1434 | AC663: =(AA663*100)/AB663 -> 104.81171548117155 | AD663: =(X663*4)+(Z663*2) -> 44
A665: GEELONG WEST | E665: =C665*6+D665 -> 0 | I665: =G665*6+H665 -> 0 | M665: =K665*6+L665 -> 0 | O665: 15 | P665: 9 | Q665: =O665*6+P665 -> 99 | S665: GEELONG WEST | W665: NORTHCOTE | X665: 8 | Y665: 10 | Z665: 0 | AA665: 1330 | AB665: 1383 | AC665: =(AA665*100)/AB665 -> 96.167751265365155 | AD665: =(X665*4)+(Z665*2) -> 32
A666: PRAHRAN | E666: =C666*6+D666 -> 0 | I666: =G666*6+H666 -> 0 | M666: =K666*6+L666 -> 0 | O666: 8 | P666: 14 | Q666: =O666*6+P666 -> 62 | W666: PRAHRAN | X666: 7 | Y666: 11 | Z666: 0 | AA666: 1272 | AB666: 1440 | AC666: =(AA666*100)/AB666 -> 88.333333333333329 | AD666: =(X666*4)+(Z666*2) -> 28
A667: BEST PLAYERS | W667: CAMBERWELL | X667: 6 | Y667: 12 | Z667: 0 | AA667: 1406 | AB667: 1714 | AC667: =(AA667*100)/AB667 -> 82.030338389731625 | AD667: =(X667*4)+(Z667*2) -> 24
A668: GEELONG WEST | C668: HOVEY | F668: JENNINGS | I668: WILLIAMS | L668: CROFT | O668: BELL | Q668: CRONIN | W668: BOX HILL | X668: 4 | Y668: 14 | Z668: 0 | AA668: 1261 | AB668: 1487 | AC668: =(AA668*100)/AB668 -> 84.801613987895095 | AD668: =(X668*4)+(Z668*2) -> 16
A669: PRAHRAN | C669: LAMBERT | F669: SHEEDY | I669: CORRIGAN | L669: O'BRIEN | O669: MOONEY | Q669: PIPER
A670: GOALKICKERS
A671: GEELONG WEST | C671: HOVEY 4 | F671: GRANT 3 | I671: LONG 2 | K671: CROFT 2 | M671: HARDIMAN 2 | P671: SELLIN | R671: McDONALD
A672: PRAHRAN | C672: SHEEDY 2 | F672: CORRIGAN 2 | I672: PEARSON 2 | L672: O'BRIEN | N672: SEEDY
A674: BRIGHTON-CAULFIELD | E674: =C674*6+D674 -> 0 | I674: =G674*6+H674 -> 0 | M674: =K674*6+L674 -> 0 | O674: 20 | P674: 21 | Q674: =O674*6+P674 -> 141 | S674: PRINCES PARK, CAULFIELD
A675: CAMBERWELL | E675: =C675*6+D675 -> 0 | I675: =G675*6+H675 -> 0 | M675: =K675*6+L675 -> 0 | O675: 10 | P675: 9 | Q675: =O675*6+P675 -> 69
A676: BEST PLAYERS
A677: BRIGHTON-CAULFIELD | C677: RANSOM | F677: ROWE | I677: MOORE | L677: PICKERING | O677: BRYAN | Q677: HUNT
A678: CAMBERWELL | C678: K SMITH | F678: J SMITH | I678: CRIPPS | L678: JONES | O678: O'NEILL | Q678: FRIEBERG
A679: GOALKICKERS | C679: 2 SHORT
A680: BRIGHTON-CAULFIELD | C680: BRYAN 6 | E680: ROWE 3 | G680: MOORE 2 | I680: PALLIN | K680: HUNT | M680: DUNN | O680: K KUPSCH | R680: BURNS | T680: KEENAN
A681: CAMBERWELL | C681: O'NEILL 5 | F681: CRIPPS | H681: J SMITH | J681: FRIEBERG | M681: K SMITH | O681: HAFEY
E682: 16TH AUGUST | I682: WEATHER
A683: SUNSHINE | E683: =C683*6+D683 -> 0 | I683: =G683*6+H683 -> 0 | M683: =K683*6+L683 -> 0 | O683: 16 | P683: 12 | Q683: =O683*6+P683 -> 108 | S683: SUNSHINE
A684: NORTHCOTE | E684: =C684*6+D684 -> 0 | I684: =G684*6+H684 -> 0 | M684: =K684*6+L684 -> 0 | O684: 8 | P684: 13 | Q684: =O684*6+P684 -> 61
A685: BEST PLAYERS
A686: SUNSHINE | C686: BLACKMAN | F686: THORNTON | I686: FERGUSON | L686: CROSBIE | O686: WAPLING | R686: SLATTERY
A687: NORTHCOTE | C687: CRAMERI | F687: GRYBAS | I687: R LANGBORNE | L687: SIMPSON | O687: DUNCAN | R687: THOMPSON
A688: GOALKICKERS
A689: SUNSHINE | C689: WAPLING 5 | F689: DOLL 4 | I689: HOWARD 3 | L689: CROSBIE 2 | N689: TREZISE | Q689: SLATTERY
A690: NORTHCOTE | C690: GRYBAS 3 | F690: McBREEN 2 | I690: CRAMERI | L690: KEANE | N690: C LANGBORNE
A692: FINALS
A693: 1ST SEMI | E693: 23RD AUGUST | I693: WEATHER | S693: PLAYED AT
D694: 1ST QTR | H694: 2ND QTR | L694: 3RD QTR | P694: FINAL | S694: TOORAK PARK
A695: GEELONG WEST | C695: 4 | D695: 5 | E695: =C695*6+D695 -> 29 | G695: 9 | H695: 7 | I695: =G695*6+H695 -> 61 | K695: 11 | L695: 12 | M695: =K695*6+L695 -> 78 | O695: 14 | P695: 15 | Q695: =O695*6+P695 -> 99 | S695: UMPIRE
A696: BRIGHTON-CAULFIELD | C696: 1 | D696: 1 | E696: =C696*6+D696 -> 7 | G696: 4 | H696: 3 | I696: =G696*6+H696 -> 27 | K696: 4 | L696: 5 | M696: =K696*6+L696 -> 29 | O696: 10 | P696: 7 | Q696: =O696*6+P696 -> 67 | S696: ARMSTRONG
A697: BEST PLAYERS
A698: GEELONG WEST | C698: LONG | F698: VAN T'HAG | I698: HARDIMAN | L698: STACEY | O698: McDONALD | R698: WILLIAMS
A699: BRIGHTON-CAULFIELD | C699: BURNS | F699: GUTTERSON | I699: HUNT | L699: K KUPSCH | O699: KEENAN | R699: ROWE
A700: GOALKICKERS | C700: 1 SHORT
A701: GEELONG WEST | C701: McDONALD 5 | F701: STACEY 3 | I701: LONG 2 | K701: CROFT | M701: GRANT | O701: RITCHIE
A702: BRIGHTON-CAULFIELD | C702: BURNS 3 | F702: BRYAN 2 | I702: DE BOND 2 | L702: GUTTERSON | O702: MOORE | Q702: ROWE
A704: 2ND SEMI | E704: 30TH AUGUST | I704: WEATHER
A705: SUNSHINE | C705: 1 | D705: 0 | E705: =C705*6+D705 -> 6 | G705: 5 | H705: 1 | I705: =G705*6+H705 -> 31 | K705: 10 | L705: 3 | M705: =K705*6+L705 -> 63 | O705: 13 | P705: 12 | Q705: =O705*6+P705 -> 90 | S705: TOORAK PARK
A706: MORDIALLOC | C706: 3 | D706: 11 | E706: =C706*6+D706 -> 29 | G706: 5 | H706: 15 | I706: =G706*6+H706 -> 45 | K706: 8 | L706: 18 | M706: =K706*6+L706 -> 66 | O706: 9 | P706: 20 | Q706: =O706*6+P706 -> 74 | S706: ROWE
A707: BEST PLAYERS
A708: SUNSHINE | C708: HOWARD | F708: TREZISE | I708: WAPLING | L708: ROACH | O708: CROSBIE | R708: M FITZGERALD
A709: MORDIALLOC | C709: LAIRD | F709: WILLIAMS | I709: BLAINEY | L709: BIBRON | O709: HASSETT | R709: KAVANAGH
A710: GOALKICKERS
A711: SUNSHINE | C711: HOWARD 6 | F711: M FITZGERALD 2 | J711: BELL 2 | L711: WAPLING | O711: SLATTERY | R711: STEVENS
A712: MORDIALLOC | C712: LAIRD 3 | F712: MORRISON 2 | I712: FULLER | K712: BIBRON | M712: POWER | O712: LESLIE
A714: PRELIMINARY | E714: 6TH SEPTEMBER | I714: WEATHER
A715: GEELONG WEST | C715: 1 | D715: 5 | E715: =C715*6+D715 -> 11 | G715: 4 | H715: 6 | I715: =G715*6+H715 -> 30 | K715: 7 | L715: 14 | M715: =K715*6+L715 -> 56 | O715: 10 | P715: 18 | Q715: =O715*6+P715 -> 78 | S715: TOORAK PARK
A716: MORDIALLOC | C716: 0 | D716: 1 | E716: =C716*6+D716 -> 1 | G716: 5 | H716: 7 | I716: =G716*6+H716 -> 37 | K716: 7 | L716: 9 | M716: =K716*6+L716 -> 51 | O716: 10 | P716: 13 | Q716: =O716*6+P716 -> 73 | S716: POLLARD
A717: BEST PLAYERS
A718: GEELONG WEST | C718: WILLIAMS | F718: BELL | I718: GRANT | L718: NICHOLLS | O718: LONG | R718: HARDIMAN
A719: MORDIALLOC | C719: HASSETT | F719: STEWART | I719: LESLIE | L719: BLAINEY | O719: POWER | R719: WILLIAMS
A720: GOALKICKERS
A721: GEELONG WEST | C721: HOVEY 3 | F721: McDONALD 2 | I721: GOGGIN 2 | L721: GRANT | N721: HARDIMAN | Q721: WILLIAMS
A722: MORDIALLOC | C722: POWER 4 | F722: CAREY | H722: O'BRIEN | J722: MORRISON | M722: HASSETT | O722: DANCKERT | Q722: LAIRD
A724: GRAND | E724: 13TH SEPTEMBER | I724: WEATHER
A725: GEELONG WEST | C725: 4 | D725: 5 | E725: =C725*6+D725 -> 29 | G725: 6 | H725: 7 | I725: =G725*6+H725 -> 43 | K725: 9 | L725: 10 | M725: =K725*6+L725 -> 64 | O725: 14 | P725: 14 | Q725: =O725*6+P725 -> 98 | S725: TOORAK PARK
A726: SUNSHINE | C726: 1 | D726: 2 | E726: =C726*6+D726 -> 8 | G726: 4 | H726: 8 | I726: =G726*6+H726 -> 32 | K726: 5 | L726: 9 | M726: =K726*6+L726 -> 39 | O726: 11 | P726: 11 | Q726: =O726*6+P726 -> 77 | S726: ARMSTRONG
A727: BEST PLAYERS
A728: GEELONG WEST | C728: HARDIMAN | F728: BENNETT | I728: WILLIAMS | L728: BELL | O728: VAN T'HAG | R728: HOVEY
A729: SUNSHINE | C729: FERGUSON | F729: TREZISE | I729: CROSBIE | L729: HOWARD | O729: BLACKMAN | R729: HENDERSON
A730: GOALKICKERS
A731: GEELONG WEST | C731: HARDIMAN 3 | F731: LONG 2 | I731: HOVEY 2 | K731: BENNETT 2 | N731: BELL 2 | Q731: GOGGIN | S731: MACKAY | V731: STACEY
A732: SUNSHINE | C732: M FITZGERALD 2 | G732: HOWARD 2 | J732: CROSBIE 2 | M732: WAPLING | O732: GREGORY | R732: SLATTERY | T732: McINTYRE | W732: DOLL