A1: Victorian Football Association
A2: Season 1965 - Division Two
A3: © Copyright Wal Williams | F3: First created: 28 March 2016
A4: Contact: joywalwi at gmail dot com | F4: Last updated: 28 March 2016 | W4: VFA Results and tables - Link to the main index page
A5: You are free to copy this document in whole or part provided that proper acknowledgement is given to the author. All rights reserved.
A7: 1965 | D7: 2ND DIVISION
A8: ROUND 1 | E8: 10TH APRIL | I8: WEATHER | S8: PLAYED AT
D9: 1ST QTR | H9: 2ND QTR | L9: 3RD QTR | P9: FINAL | S9: NORTHCOTE
A10: PRAHRAN | C10: 0 | D10: 5 | E10: =C10*6+D10 -> 5 | G10: 2 | H10: 9 | I10: =G10*6+H10 -> 21 | K10: 5 | L10: 14 | M10: =K10*6+L10 -> 44 | O10: 12 | P10: 18 | Q10: =O10*6+P10 -> 90 | S10: UMPIRE | Y10: LADDER | AC10: ROUND | AE10: 1
A11: NORTHCOTE | C11: 5 | D11: 3 | E11: =C11*6+D11 -> 33 | G11: 7 | H11: 10 | I11: =G11*6+H11 -> 52 | K11: 7 | L11: 13 | M11: =K11*6+L11 -> 55 | O11: 9 | P11: 16 | Q11: =O11*6+P11 -> 70
A12: BEST PLAYERS | W12: TEAM | X12: B | Y12: W | Z12: L | AA12: D | AB12: FOR | AC12: AGST | AD12: % | AE12: PTS
A13: PRAHRAN | C13: BUTLER | F13: VERWOERT | J13: HARTNETT | M13: SWIFT | P13: HOGAN | R13: GLOVER
A14: NORTHCOTE | C14: OGILVIE | F14: DUNCAN | J14: BEECHER | M14: PITTS | P14: KEANE | R14: GRYBAS | W14: MORDIALLOC | Y14: 1 | Z14: 0 | AA14: 0 | AB14: 141 | AC14: 46 | AD14: =(AB14*100)/AC14 -> 306.52173913043481 | AE14: =(Y14*4)+(AA14*2) -> 4
A15: GOALKICKERS | W15: SUNSHINE | Y15: 1 | Z15: 0 | AA15: 0 | AB15: 123 | AC15: 41 | AD15: =(AB15*100)/AC15 -> 300 | AE15: =(Y15*4)+(AA15*2) -> 4
A16: PRAHRAN | C16: CORRIGAN 2 | F16: HOGAN 2 | I16: PIPER 2 | K16: VERWOERT 2 | N16: GLOVER | P16: SHEEDY | R16: BUTLER | T16: PEARSON | W16: PRAHRAN | Y16: 1 | Z16: 0 | AA16: 0 | AB16: 90 | AC16: 70 | AD16: =(AB16*100)/AC16 -> 128.57142857142858 | AE16: =(Y16*4)+(AA16*2) -> 4
A17: NORTHCOTE | C17: CRAMERI 2 | F17: PITTS 2 | I17: KEANE 2 | K17: GASKETT | N17: BAILEY | P17: R LANGBORNE | W17: CAMBERWELL | Y17: 0 | Z17: 0 | AA17: 1 | AB17: 75 | AC17: 75 | AD17: =(AB17*100)/AC17 -> 100 | AE17: =(Y17*4)+(AA17*2) -> 2
A19: CAMBERWELL | C19: 6 | D19: 3 | E19: =C19*6+D19 -> 39 | G19: 7 | H19: 6 | I19: =G19*6+H19 -> 48 | K19: 9 | L19: 9 | M19: =K19*6+L19 -> 63 | O19: 11 | P19: 9 | Q19: =O19*6+P19 -> 75 | S19: CAMBERWELL | W19: BOX HILL | Y19: 0 | Z19: 0 | AA19: 1 | AB19: 75 | AC19: 75 | AD19: =(AB19*100)/AC19 -> 100 | AE19: =(Y19*4)+(AA19*2) -> 2
A20: BOX HILL | C20: 3 | D20: 2 | E20: =C20*6+D20 -> 20 | G20: 7 | H20: 7 | I20: =G20*6+H20 -> 49 | K20: 7 | L20: 10 | M20: =K20*6+L20 -> 52 | O20: 10 | P20: 15 | Q20: =O20*6+P20 -> 75 | W20: PRESTON | X20: 1 | Y20: 0 | Z20: 0 | AA20: 0 | AB20: 0 | AC20: 0 | AE20: =(Y20*4)+(AA20*2) -> 0
A21: BEST PLAYERS | W21: NORTHCOTE | Y21: 0 | Z21: 1 | AA21: 0 | AB21: 70 | AC21: 90 | AD21: =(AB21*100)/AC21 -> 77.777777777777771 | AE21: =(Y21*4)+(AA21*2) -> 0
A22: CAMBERWELL | C22: QUIRK | F22: GAUDION | I22: YOUNG | L22: HAFEY | O22: DOUGLAS | R22: K SMITH | W22: WERRIBEE | Y22: 0 | Z22: 1 | AA22: 0 | AB22: 41 | AC22: 123 | AD22: =(AB22*100)/AC22 -> 33.333333333333336 | AE22: =(Y22*4)+(AA22*2) -> 0
A23: BOX HILL | C23: MACE | F23: PLUNKETT | I23: GARDINER | L23: GRAY | O23: I BATES | R23: HUNT | W23: CAULFIELD | Y23: 0 | Z23: 1 | AA23: 0 | AB23: 46 | AC23: 141 | AD23: =(AB23*100)/AC23 -> 32.624113475177303 | AE23: =(Y23*4)+(AA23*2) -> 0
A24: GOALKICKERS
A25: CAMBERWELL | C25: QUIRK 3 | F25: K SMITH 3 | I25: COMMONS | L25: ADAMS | N25: FISHER | P25: HAFEY | R25: COCKREM
A26: BOX HILL | C26: MACE 3 | F26: D GRIGG 2 | I26: HARRIS 2 | L26: GARDINER | O26: HUNT | Q26: FELLOWS
A28: SUNSHINE | C28: 3 | D28: 2 | E28: =C28*6+D28 -> 20 | G28: 9 | H28: 8 | I28: =G28*6+H28 -> 62 | K28: 10 | L28: 10 | M28: =K28*6+L28 -> 70 | O28: 18 | P28: 15 | Q28: =O28*6+P28 -> 123 | S28: SUNSHINE
A29: WERRIBEE | C29: 2 | D29: 3 | E29: =C29*6+D29 -> 15 | G29: 3 | H29: 3 | I29: =G29*6+H29 -> 21 | K29: 5 | L29: 10 | M29: =K29*6+L29 -> 40 | O29: 5 | P29: 11 | Q29: =O29*6+P29 -> 41
A30: BEST PLAYERS
A31: SUNSHINE | C31: SLATTERY | F31: CROSBIE | I31: HOWARD | L31: WAPLING | O31: TREZISE | R31: ROACH
A32: WERRIBEE | C32: CARROLL | F32: TURNER | I32: HOLCOMBE | L32: EDWARDS | O32: D DOVE
A33: GOALKICKERS
A34: SUNSHINE | C34: SLATTERY 3 | F34: CROSBIE 3 | I34: TRUSLER 3 | L34: STEVENS 3 | N34: HOWARD 2 | Q34: GREGORY 2 | T34: WAPLING 2
A35: WERRIBEE | C35: EDWARDS 2 | F35: TURNER | I35: D DOVE | L35: TRAINION
A37: MORDIALLOC | C37: 3 | D37: 2 | E37: =C37*6+D37 -> 20 | G37: 9 | H37: 4 | I37: =G37*6+H37 -> 58 | K37: 12 | L37: 7 | M37: =K37*6+L37 -> 79 | O37: 21 | P37: 15 | Q37: =O37*6+P37 -> 141 | S37: MORDIALLOC
A38: CAULFIELD | C38: 2 | D38: 3 | E38: =C38*6+D38 -> 15 | G38: 2 | H38: 6 | I38: =G38*6+H38 -> 18 | K38: 6 | L38: 9 | M38: =K38*6+L38 -> 45 | O38: 6 | P38: 10 | Q38: =O38*6+P38 -> 46
A39: BEST PLAYERS
A40: MORDIALLOC | C40: POWER | F40: BRADBURY | I40: HYNES | L40: MORRISON | O40: O'BRIEN | R40: BAXTER
A41: CAULFIELD | C41: MOORE | F41: ROWE | I41: SIMMONS | L41: ARRELL | O41: PICKERING
A42: GOALKICKERS
A43: MORDIALLOC | C43: POWER 5 | E43: LESLIE 3 | G43: GEHLING 3 | J43: O'BRIEN 3 | L43: CARDER 2 | N43: BAXTER | P43: MORRISON | R43: FULLER | T43: LAIRD | V43: HYNES
A44: CAULFIELD | C44: PICKERING 3 | F44: NICHOLLS | I44: SHARPLEY | L44: ARRELL
A46: BYE | C46: PRESTON
A48: ROUND 2 | E48: 17TH APRIL | I48: WEATHER | S48: PLAYED AT
D49: 1ST QTR | H49: 2ND QTR | L49: 3RD QTR | P49: FINAL | S49: WERRIBEE
A50: WERRIBEE | C50: 3 | D50: 5 | E50: =C50*6+D50 -> 23 | G50: 4 | H50: 7 | I50: =G50*6+H50 -> 31 | K50: 12 | L50: 11 | M50: =K50*6+L50 -> 83 | O50: 13 | P50: 14 | Q50: =O50*6+P50 -> 92 | S50: UMPIRE | Y50: LADDER | AC50: ROUND | AE50: 2
A51: CAMBERWELL | C51: 3 | D51: 0 | E51: =C51*6+D51 -> 18 | G51: 5 | H51: 3 | I51: =G51*6+H51 -> 33 | K51: 7 | L51: 3 | M51: =K51*6+L51 -> 45 | O51: 9 | P51: 7 | Q51: =O51*6+P51 -> 61
A52: BEST PLAYERS | W52: TEAM | X52: B | Y52: W | Z52: L | AA52: D | AB52: FOR | AC52: AGST | AD52: % | AE52: PTS
A53: WERRIBEE | C53: TRAINION | F53: GILLETT | I53: B SMITH | L53: R DOVE | O53: TURNER | R53: CARROLL
A54: CAMBERWELL | C54: DOUGLAS | F54: PEMBERTON | I54: J SMITH | L54: PANZIC | O54: ALLEMAND | R54: ADAMS | W54: MORDIALLOC | Y54: 2 | Z54: 0 | AA54: 0 | AB54: 207 | AC54: 89 | AD54: =(AB54*100)/AC54 -> 232.58426966292134 | AE54: =(Y54*4)+(AA54*2) -> 8
A55: GOALKICKERS | P55: FRANCE | W55: SUNSHINE | Y55: 2 | Z55: 0 | AA55: 0 | AB55: 191 | AC55: 105 | AD55: =(AB55*100)/AC55 -> 181.9047619047619 | AE55: =(Y55*4)+(AA55*2) -> 8
A56: WERRIBEE | C56: GOULOPOLOUS 3 | F56: BRYAN 2 | I56: EDWARDS 2 | L56: B SMITH 2 | N56: STEINBERG | Q56: HOLCOMBE | S56: TRAINION | W56: PRAHRAN | X56: 1 | Y56: 1 | Z56: 0 | AA56: 0 | AB56: 90 | AC56: 70 | AD56: =(AB56*100)/AC56 -> 128.57142857142858 | AE56: =(Y56*4)+(AA56*2) -> 4
A57: CAMBERWELL | C57: J SMITH 4 | F57: CRIPPS 2 | I57: K SMITH 2 | L57: COCKREM | W57: NORTHCOTE | Y57: 1 | Z57: 1 | AA57: 0 | AB57: 125 | AC57: 141 | AD57: =(AB57*100)/AC57 -> 88.652482269503551 | AE57: =(Y57*4)+(AA57*2) -> 4
E58: 18TH APRIL | I58: WEATHER
A59: SUNSHINE | C59: 2 | D59: 2 | E59: =C59*6+D59 -> 14 | G59: 4 | H59: 6 | I59: =G59*6+H59 -> 30 | K59: 7 | L59: 8 | M59: =K59*6+L59 -> 50 | O59: 9 | P59: 14 | Q59: =O59*6+P59 -> 68 | S59: PRESTON | W59: WERRIBEE | Y59: 1 | Z59: 1 | AA59: 0 | AB59: 133 | AC59: 184 | AD59: =(AB59*100)/AC59 -> 72.282608695652172 | AE59: =(Y59*4)+(AA59*2) -> 4
A60: PRESTON | C60: 3 | D60: 6 | E60: =C60*6+D60 -> 24 | G60: 4 | H60: 7 | I60: =G60*6+H60 -> 31 | K60: 7 | L60: 10 | M60: =K60*6+L60 -> 52 | O60: 9 | P60: 10 | Q60: =O60*6+P60 -> 64 | W60: BOX HILL | Y60: 0 | Z60: 1 | AA60: 1 | AB60: 118 | AC60: 141 | AD60: =(AB60*100)/AC60 -> 83.687943262411352 | AE60: =(Y60*4)+(AA60*2) -> 2
A61: BEST PLAYERS | W61: CAMBERWELL | Y61: 0 | Z61: 1 | AA61: 1 | AB61: 136 | AC61: 167 | AD61: =(AB61*100)/AC61 -> 81.437125748502993 | AE61: =(Y61*4)+(AA61*2) -> 2
A62: SUNSHINE | C62: HOWARD | F62: CROSBIE | I62: TRUSLER | L62: HENDERSON | O62: BLACKMAN | R62: YOUNG | W62: PRESTON | X62: 1 | Y62: 0 | Z62: 1 | AA62: 0 | AB62: 64 | AC62: 68 | AD62: =(AB62*100)/AC62 -> 94.117647058823536 | AE62: =(Y62*4)+(AA62*2) -> 0
A63: PRESTON | C63: MURNANE | F63: RYAN | I63: CAMERON | L63: WADDELL | O63: DINEEN | R63: ERWIN | W63: CAULFIELD | Y63: 0 | Z63: 2 | AA63: 0 | AB63: 97 | AC63: 196 | AD63: =(AB63*100)/AC63 -> 49.489795918367349 | AE63: =(Y63*4)+(AA63*2) -> 0
A64: GOALKICKERS
A65: SUNSHINE | C65: CROSBIE 3 | F65: HOWARD 2 | I65: GREGORY 2 | L65: WAPLING | N65: SLATTERY
A66: PRESTON | C66: WATSON 2 | F66: WADDELL 2 | I66: WALKER 2 | L66: TRELOAR | N66: JENKINS | P66: WHITE
E67: 19TH APRIL | I67: WEATHER
A68: NORTHCOTE | C68: 2 | D68: 3 | E68: =C68*6+D68 -> 15 | G68: 4 | H68: 8 | I68: =G68*6+H68 -> 32 | K68: 5 | L68: 9 | M68: =K68*6+L68 -> 39 | O68: 7 | P68: 13 | Q68: =O68*6+P68 -> 55 | S68: PRINCES PARK, CAULFIELD
A69: CAULFIELD | C69: 4 | D69: 1 | E69: =C69*6+D69 -> 25 | G69: 4 | H69: 2 | I69: =G69*6+H69 -> 26 | K69: 8 | L69: 2 | M69: =K69*6+L69 -> 50 | O69: 8 | P69: 3 | Q69: =O69*6+P69 -> 51
A70: BEST PLAYERS
A71: NORTHCOTE | C71: SIMPSON | F71: LACHMUND | I71: McBREEN | L71: SLEEP | N71: BEECHER | Q71: OGILVIE
A72: CAULFIELD | C72: JONES | F72: BAKER | I72: LEE | L72: DOUGLAS | N72: ROWE | Q72: GRAY
A73: GOALKICKERS
A74: NORTHCOTE | C74: BRADY 2 | F74: R LANGBORNE | I74: PITTS | K74: SLEEP | M74: OGILVIE | O74: VINEY
A75: CAULFIELD | C75: BAKER 2 | F75: PALLIN | H75: ROWE | J75: NICHOLLS | M75: MOORE | O75: DE BOND | Q75: DIXON
A77: MORDIALLOC | C77: 4 | D77: 5 | E77: =C77*6+D77 -> 29 | G77: 5 | H77: 5 | I77: =G77*6+H77 -> 35 | K77: 7 | L77: 10 | M77: =K77*6+L77 -> 52 | O77: 9 | P77: 12 | Q77: =O77*6+P77 -> 66 | S77: BOX HILL
A78: BOX HILL | C78: 0 | D78: 0 | E78: =C78*6+D78 -> 0 | G78: 3 | H78: 3 | I78: =G78*6+H78 -> 21 | K78: 4 | L78: 5 | M78: =K78*6+L78 -> 29 | O78: 6 | P78: 7 | Q78: =O78*6+P78 -> 43
A79: BEST PLAYERS
A80: MORDIALLOC | C80: BRADBURY | F80: LAIRD | I80: LESLIE | L80: DANCKERT | N80: O'BRIEN | Q80: HOBSON
A81: BOX HILL | C81: HUNT | F81: McCURRY | I81: LEHMAN | L81: GRIGG | N81: MALCOLM | Q81: DUURSMA
A82: GOALKICKERS
A83: MORDIALLOC | C83: O'BRIEN 3 | F83: POWER 2 | I83: BAXTER | K83: BIBRON | M83: LAIRD | O83: HYNES
A84: BOX HILL | C84: HUNT 3 | F84: MILLER | I84: LA ROCHE | L84: McCURRY
A86: BYE | C86: PRAHRAN
A88: ROUND 3 | E88: 24TH APRIL | I88: WEATHER | S88: PLAYED AT
D89: 1ST QTR | H89: 2ND QTR | L89: 3RD QTR | P89: FINAL | S89: CAMBERWELL
A90: SUNSHINE | C90: 0 | D90: 2 | E90: =C90*6+D90 -> 2 | G90: 6 | H90: 8 | I90: =G90*6+H90 -> 44 | K90: 8 | L90: 11 | M90: =K90*6+L90 -> 59 | O90: 11 | P90: 16 | Q90: =O90*6+P90 -> 82 | S90: UMPIRE | Y90: LADDER | AC90: ROUND | AE90: 3
A91: CAMBERWELL | C91: 5 | D91: 9 | E91: =C91*6+D91 -> 39 | G91: 6 | H91: 10 | I91: =G91*6+H91 -> 46 | K91: 9 | L91: 20 | M91: =K91*6+L91 -> 74 | O91: 9 | P91: 20 | Q91: =O91*6+P91 -> 74
A92: BEST PLAYERS | W92: TEAM | X92: B | Y92: W | Z92: L | AA92: D | AB92: FOR | AC92: AGST | AD92: % | AE92: PTS
A93: SUNSHINE | C93: WAPLING | F93: ROACH | I93: HOWARD | L93: CROSBIE | O93: YOUNG | Q93: BLACKMAN
A94: CAMBERWELL | C94: K SMITH | F94: PANZIC | I94: COCKREM | L94: ADAMS | O94: FISHER | Q94: KISS | W94: SUNSHINE | Y94: 3 | Z94: 0 | AA94: 0 | AB94: 273 | AC94: 179 | AD94: =(AB94*100)/AC94 -> 152.51396648044692 | AE94: =(Y94*4)+(AA94*2) -> 12
A95: GOALKICKERS | W95: MORDIALLOC | X95: 1 | Y95: 2 | Z95: 0 | AA95: 0 | AB95: 207 | AC95: 89 | AD95: =(AB95*100)/AC95 -> 232.58426966292134 | AE95: =(Y95*4)+(AA95*2) -> 8
A96: SUNSHINE | C96: HOWARD 4 | F96: WAPLING 3 | I96: FITZGERLAD | L96: GREGORY | N96: TRELOAR | Q96: SLATTERY | W96: WERRIBEE | Y96: 2 | Z96: 1 | AA96: 0 | AB96: 215 | AC96: 265 | AD96: =(AB96*100)/AC96 -> 81.132075471698116 | AE96: =(Y96*4)+(AA96*2) -> 8
A97: CAMBERWELL | C97: COMMONS 2 | F97: KISS 2 | I97: GAUDION | L97: K SMITH | N97: J SMITH | P97: FISHER | R97: COCKREM | W97: PRAHRAN | X97: 1 | Y97: 1 | Z97: 0 | AA97: 1 | AB97: 178 | AC97: 158 | AD97: =(AB97*100)/AC97 -> 112.65822784810126 | AE97: =(Y97*4)+(AA97*2) -> 6
A99: PRESTON | C99: 3 | D99: 2 | E99: =C99*6+D99 -> 20 | G99: 7 | H99: 7 | I99: =G99*6+H99 -> 49 | K99: 12 | L99: 8 | M99: =K99*6+L99 -> 80 | O99: 19 | P99: 11 | Q99: =O99*6+P99 -> 125 | S99: NORTHCOTE | W99: PRESTON | X99: 1 | Y99: 1 | Z99: 1 | AA99: 0 | AB99: 189 | AC99: 135 | AD99: =(AB99*100)/AC99 -> 140 | AE99: =(Y99*4)+(AA99*2) -> 4
A100: NORTHCOTE | C100: 2 | D100: 1 | E100: =C100*6+D100 -> 13 | G100: 6 | H100: 3 | I100: =G100*6+H100 -> 39 | K100: 8 | L100: 6 | M100: =K100*6+L100 -> 54 | O100: 10 | P100: 7 | Q100: =O100*6+P100 -> 67 | W100: BOX HILL | Y100: 0 | Z100: 1 | AA100: 2 | AB100: 206 | AC100: 229 | AD100: =(AB100*100)/AC100 -> 89.956331877729255 | AE100: =(Y100*4)+(AA100*2) -> 4
A101: BEST PLAYERS | W101: NORTHCOTE | Y101: 1 | Z101: 2 | AA101: 0 | AB101: 192 | AC101: 266 | AD101: =(AB101*100)/AC101 -> 72.180451127819552 | AE101: =(Y101*4)+(AA101*2) -> 4
A102: PRESTON | C102: WALKER | F102: MURNANE | I102: WATSON | L102: SAYERS | O102: McARTHUR | R102: CAMERON | W102: CAMBERWELL | Y102: 0 | Z102: 2 | AA102: 1 | AB102: 210 | AC102: 249 | AD102: =(AB102*100)/AC102 -> 84.337349397590359 | AE102: =(Y102*4)+(AA102*2) -> 2
A103: NORTHCOTE | C103: BEYNON | F103: CRAMERI | I103: LUMBY | L103: OGILVIE | O103: McBREEN | R103: SLEEP | W103: CAULFIELD | Y103: 0 | Z103: 3 | AA103: 0 | AB103: 178 | AC103: 279 | AD103: =(AB103*100)/AC103 -> 63.799283154121866 | AE103: =(Y103*4)+(AA103*2) -> 0
A104: GOALKICKERS | C104: 1 SHORT
A105: PRESTON | C105: WALKER 9 | F105: McARTHUR 2 | I105: CAMERON 2 | L105: TRELOAR | N105: MUIR | O105: MURNANE | R105: TULLY | T105: HYDE
A106: NORTHCOTE | C106: LUMBY 3 | F106: KEANE 3 | I106: VINEY 2 | K106: R LANGBORNE | N106: MCBREEN
A108: WERRIBEE | C108: 4 | D108: 2 | E108: =C108*6+D108 -> 26 | G108: 8 | H108: 4 | I108: =G108*6+H108 -> 52 | K108: 10 | L108: 8 | M108: =K108*6+L108 -> 68 | O108: 12 | P108: 11 | Q108: =O108*6+P108 -> 83 | S108: WERRIBEE
A109: CAULFIELD | C109: 2 | D109: 5 | E109: =C109*6+D109 -> 17 | G109: 6 | H109: 8 | I109: =G109*6+H109 -> 44 | K109: 9 | L109: 9 | M109: =K109*6+L109 -> 63 | O109: 11 | P109: 15 | Q109: =O109*6+P109 -> 81
A110: BEST PLAYERS
A111: WERRIBEE | C111: TURNER | F111: TRAINION | I111: HOLCOMBE | L111: JAMES | N111: BRYAN | Q111: R DOVE
A112: CAULFIELD | C112: DOUGLAS | F112: ROWE | I112: BAKER | L112: PICKERING | N112: SIMMONS | Q112: DIXON
A113: GOALKICKERS
A114: WERRIBEE | C114: JAMES 3 | F114: EDWARDS 2 | I114: BRYAN 2 | K114: HOLCOMBE 2 | N114: GOULOPOLOUS 2 | R114: TRAINION
A115: CAULFIELD | C115: DIXON 4 | F115: ROWE 2 | I115: NICHOLLS | L115: LEE | M115: BAKER | O115: MOORE | Q115: DE BOND
E116: 21ST APRIL | I116: WEATHER
A117: PRAHRAN | C117: 5 | D117: 2 | E117: =C117*6+D117 -> 32 | G117: 7 | H117: 4 | I117: =G117*6+H117 -> 46 | K117: 12 | L117: 8 | M117: =K117*6+L117 -> 80 | O117: 13 | P117: 10 | Q117: =O117*6+P117 -> 88 | S117: TOORAK PARK
A118: BOX HILL | C118: 1 | D118: 4 | E118: =C118*6+D118 -> 10 | G118: 7 | H118: 10 | I118: =G118*6+H118 -> 52 | K118: 8 | L118: 14 | M118: =K118*6+L118 -> 62 | O118: 12 | P118: 16 | Q118: =O118*6+P118 -> 88
A119: BEST PLAYERS
A120: PRAHRAN | C120: PEARSON | F120: PIPER | I120: SHEEDY | L120: CRIPPS | N120: GLOVER | Q120: SMITH
A121: BOX HILL | C121: GARDINER | F121: MACE | I121: BRYANT | L121: HARRIS | N121: I BATES | Q121: HUNT
A122: GOALKICKERS
A123: PRAHRAN | C123: PEARSON 5 | F123: PIPER 3 | H123: SMITH 2 | J123: BUTLER | L123: VERWOERT | O123: HOGAN
A124: BOX HILL | C124: BRYANT 5 | F124: HARRIS 3 | I124: MACE 2 | K124: FELLOWS | M124: DUURSMA
A126: BYE | C126: MORDIALLOC
A128: ROUND 4 | E128: 1ST MAY | I128: WEATHER | S128: PLAYED AT
D129: 1ST QTR | H129: 2ND QTR | L129: 3RD QTR | P129: FINAL | S129: PRINCES PARK, CAULFIELD
A130: CAULFIELD | C130: 6 | D130: 2 | E130: =C130*6+D130 -> 38 | G130: 12 | H130: 5 | I130: =G130*6+H130 -> 77 | K130: 14 | L130: 10 | M130: =K130*6+L130 -> 94 | O130: 19 | P130: 16 | Q130: =O130*6+P130 -> 130 | S130: UMPIRE | Y130: LADDER | AC130: ROUND | AE130: 4
A131: CAMBERWELL | C131: 1 | D131: 1 | E131: =C131*6+D131 -> 7 | G131: 7 | H131: 6 | I131: =G131*6+H131 -> 48 | K131: 10 | L131: 10 | M131: =K131*6+L131 -> 70 | O131: 14 | P131: 15 | Q131: =O131*6+P131 -> 99
A132: BEST PLAYERS | W132: TEAM | X132: B | Y132: W | Z132: L | AA132: D | AB132: FOR | AC132: AGST | AD132: % | AE132: PTS
A133: CAULFIELD | C133: ROWE | F133: COLLINS | I133: BAKER | L133: EVANS | O133: LEE | Q133: STONE
A134: CAMBERWELL | C134: GAUDION | F134: J SMITH | I134: HAFEY | L134: K SMITH | O134: PANZIC | Q134: COMMONS | W134: MORDIALLOC | X134: 1 | Y134: 3 | Z134: 0 | AA134: 0 | AB134: 336 | AC134: 159 | AD134: =(AB134*100)/AC134 -> 211.32075471698113 | AE134: =(Y134*4)+(AA134*2) -> 12
A135: GOALKICKERS | P135: CAMPBELL | R135: SIMMONS | W135: SUNSHINE | Y135: 3 | Z135: 1 | AA135: 0 | AB135: 343 | AC135: 308 | AD135: =(AB135*100)/AC135 -> 111.36363636363636 | AE135: =(Y135*4)+(AA135*2) -> 12
A136: CAULFIELD | C136: NICHOLLS 3 | F136: ROWE 3 | H136: DOUGLAS 3 | K136: DUNN 2 | M136: COLLINS 2 | O136: PALLIN 2 | Q136: GILBERT | S136: BAKER | W136: WERRIBEE | Y136: 3 | Z136: 1 | AA136: 0 | AB136: 312 | AC136: 354 | AD136: =(AB136*100)/AC136 -> 88.13559322033899 | AE136: =(Y136*4)+(AA136*2) -> 12
A137: CAMBERWELL | C137: J SMITH 3 | E137: K SMITH 3 | H137: FISHER 2 | J137: GAUDION | M137: COMMONS | P137: BOYD | R137: HAFEY | T137: PANZIC | W137: PRESTON | X137: 1 | Y137: 2 | Z137: 1 | AA137: 0 | AB137: 335 | AC137: 143 | AD137: =(AB137*100)/AC137 -> 234.26573426573427 | AE137: =(Y137*4)+(AA137*2) -> 8
O138: MORRISON
A139: WERRIBEE | C139: 2 | D139: 5 | E139: =C139*6+D139 -> 17 | G139: 6 | H139: 15 | I139: =G139*6+H139 -> 51 | K139: 8 | L139: 21 | M139: =K139*6+L139 -> 69 | O139: 12 | P139: 25 | Q139: =O139*6+P139 -> 97 | S139: BOX HILL | W139: PRAHRAN | X139: 1 | Y139: 1 | Z139: 1 | AA139: 1 | AB139: 256 | AC139: 304 | AD139: =(AB139*100)/AC139 -> 84.21052631578948 | AE139: =(Y139*4)+(AA139*2) -> 6
A140: BOX HILL | C140: 1 | D140: 3 | E140: =C140*6+D140 -> 9 | G140: 4 | H140: 4 | I140: =G140*6+H140 -> 28 | K140: 8 | L140: 9 | M140: =K140*6+L140 -> 57 | O140: 13 | P140: 11 | Q140: =O140*6+P140 -> 89 | W140: BOX HILL | Y140: 0 | Z140: 2 | AA140: 2 | AB140: 295 | AC140: 326 | AD140: =(AB140*100)/AC140 -> 90.490797546012274 | AE140: =(Y140*4)+(AA140*2) -> 4
A141: BEST PLAYERS | W141: CAULFIELD | Y141: 1 | Z141: 3 | AA141: 0 | AB141: 308 | AC141: 378 | AD141: =(AB141*100)/AC141 -> 81.481481481481481 | AE141: =(Y141*4)+(AA141*2) -> 4
A142: WERRIBEE | C142: TURNER | F142: SANDFORD | I142: BRYAN | L142: SMITH | O142: TRAINION | R142: HOLCOMBE | W142: NORTHCOTE | X142: 1 | Y142: 1 | Z142: 2 | AA142: 0 | AB142: 192 | AC142: 266 | AD142: =(AB142*100)/AC142 -> 72.180451127819552 | AE142: =(Y142*4)+(AA142*2) -> 4
A143: BOX HILL | C143: HOBBS | F143: GRIGG | I143: GARDINER | L143: DUURSMA | O143: MACE | R143: HUNT | W143: CAMBERWELL | Y143: 0 | Z143: 3 | AA143: 1 | AB143: 309 | AC143: 379 | AD143: =(AB143*100)/AC143 -> 81.530343007915562 | AE143: =(Y143*4)+(AA143*2) -> 2
A144: GOALKICKERS
A145: WERRIBEE | C145: GOULOPOLOUS 5 | F145: BRYAN 3 | I145: TRAINION 2 | L145: JAMES | N145: SMITH
A146: BOX HILL | C146: HOBBS 3 | E146: HUNT 3 | G146: LA ROCHE 3 | J146: MACE | L146: BRYANT | N146: PRITCHARD
E147: 2ND MAY | I147: WEATHER
A148: MORDIALLOC | C148: 4 | D148: 6 | E148: =C148*6+D148 -> 30 | G148: 7 | H148: 7 | I148: =G148*6+H148 -> 49 | K148: 12 | L148: 13 | M148: =K148*6+L148 -> 85 | O148: 19 | P148: 15 | Q148: =O148*6+P148 -> 129 | S148: SUNSHINE
A149: SUNSHINE | C149: 3 | D149: 3 | E149: =C149*6+D149 -> 21 | G149: 6 | H149: 5 | I149: =G149*6+H149 -> 41 | K149: 8 | L149: 7 | M149: =K149*6+L149 -> 55 | O149: 9 | P149: 16 | Q149: =O149*6+P149 -> 70
A150: BEST PLAYERS
A151: MORDIALLOC | C151: HYNES | F151: POWER | I151: BIBRON | L151: BAXTER | O151: BRADBURY | R151: LAIRD
A152: SUNSHINE | C152: SLATTERY | F152: DARUL | I152: TRUSLER | L152: CROSBIE | O152: ROACH | R152: TREZISE
A153: GOALKICKERS
A154: MORDIALLOC | C154: POWER 7 | E154: HYNES 3 | G154: LAIRD 3 | I154: O'BRIEN 3 | K154: BAXTER 2 | M154: GEHLING
A155: SUNSHINE | C155: SLATTERY 3 | F155: TRUSLER 3 | I155: CROSBIE 2 | L155: GREGORY
A157: PRESTON | C157: 6 | D157: 4 | E157: =C157*6+D157 -> 40 | G157: 14 | H157: 12 | I157: =G157*6+H157 -> 96 | K157: 17 | L157: 16 | M157: =K157*6+L157 -> 118 | O157: 22 | P157: 14 | Q157: =O157*6+P157 -> 146 | S157: PRESTON
A158: PRAHRAN | C158: 2 | D158: 3 | E158: =C158*6+D158 -> 15 | G158: 5 | H158: 5 | I158: =G158*6+H158 -> 35 | K158: 10 | L158: 9 | M158: =K158*6+L158 -> 69 | O158: 11 | P158: 12 | Q158: =O158*6+P158 -> 78
A159: BEST PLAYERS
A160: PRESTON | C160: ALEXANDER | F160: DINEEN | I160: WADDELL | L160: WALKER | O160: CAMERON | R160: MUIR
A161: PRAHRAN | C161: BUTLER | F161: GRAY | I161: SHEEDY | L161: WISHART | O161: CORRIGAN | R161: HOGAN
A162: GOALKICKERS
A163: PRESTON | C163: WALKER 12 | F163: WADDELL 4 | I163: ALEXANDER 2 | L163: MUIR 2 | N163: APPLEFORD | Q163: MURNANE
A164: PRAHRAN | C164: BUTLER 4 | F164: PEARSON 2 | I164: SHEEDY | K164: CRIPPS | M164: VERWOERT | P164: HOGAN | R164: HARTNETT
A166: BYE | C166: NORTHCOTE
A169: ROUND 5 | E169: 8TH MAY | I169: WEATHER | S169: PLAYED AT
D170: 1ST QTR | H170: 2ND QTR | L170: 3RD QTR | P170: FINAL | S170: PRINCES PARK, CAULFIELD
A171: PRESTON | C171: 1 | D171: 11 | E171: =C171*6+D171 -> 17 | G171: 11 | H171: 14 | I171: =G171*6+H171 -> 80 | K171: 15 | L171: 17 | M171: =K171*6+L171 -> 107 | O171: 24 | P171: 20 | Q171: =O171*6+P171 -> 164 | S171: UMPIRE | Y171: LADDER | AC171: ROUND | AE171: 5
A172: CAULFIELD | C172: 3 | D172: 1 | E172: =C172*6+D172 -> 19 | G172: 4 | H172: 3 | I172: =G172*6+H172 -> 27 | K172: 8 | L172: 3 | M172: =K172*6+L172 -> 51 | O172: 11 | P172: 4 | Q172: =O172*6+P172 -> 70
A173: BEST PLAYERS | W173: TEAM | X173: B | Y173: W | Z173: L | AA173: D | AB173: FOR | AC173: AGST | AD173: % | AE173: PTS
A174: PRESTON | C174: CAMERON | F174: WALKER | I174: ALEXANDER | L174: DINEEN | O174: WADDELL | Q174: McARTHUR
A175: CAULFIELD | C175: EVANS | F175: NICHOLLS | I175: BAKER | L175: ROWE | O175: DOUGLAS | W175: MORDIALLOC | X175: 1 | Y175: 4 | Z175: 0 | AA175: 0 | AB175: 448 | AC175: 214 | AD175: =(AB175*100)/AC175 -> 209.34579439252337 | AE175: =(Y175*4)+(AA175*2) -> 16
A176: GOALKICKERS | N176: CAMERON | Q176: ALEXANDER | T176: RYAN | W176: SUNSHINE | Y176: 3 | Z176: 2 | AA176: 0 | AB176: 399 | AC176: 385 | AD176: =(AB176*100)/AC176 -> 103.63636363636364 | AE176: =(Y176*4)+(AA176*2) -> 12
A177: PRESTON | C177: WALKER 12 | F177: TRELOAR 2 | I177: APPLEFORD 2 | L177: MURNANE 2 | O177: WADDELL | Q177: McARTHUR | T177: MUIR | W177: WERRIBEE | Y177: 3 | Z177: 2 | AA177: 0 | AB177: 368 | AC177: 458 | AD177: =(AB177*100)/AC177 -> 80.349344978165945 | AE177: =(Y177*4)+(AA177*2) -> 12
A178: CAULFIELD | C178: ROWE 3 | F178: SIMMONS 2 | I178: NICHOLLS 2 | L178: BAKER 2 | N178: DOUGLAS | Q178: DUNN | W178: PRESTON | X178: 1 | Y178: 3 | Z178: 1 | AA178: 0 | AB178: 499 | AC178: 213 | AD178: =(AB178*100)/AC178 -> 234.27230046948358 | AE178: =(Y178*4)+(AA178*2) -> 12
A180: PRAHRAN | C180: 7 | D180: 3 | E180: =C180*6+D180 -> 45 | G180: 10 | H180: 9 | I180: =G180*6+H180 -> 69 | K180: 11 | L180: 12 | M180: =K180*6+L180 -> 78 | O180: 15 | P180: 14 | Q180: =O180*6+P180 -> 104 | S180: WERRIBEE | W180: PRAHRAN | X180: 1 | Y180: 2 | Z180: 1 | AA180: 1 | AB180: 360 | AC180: 360 | AD180: =(AB180*100)/AC180 -> 100 | AE180: =(Y180*4)+(AA180*2) -> 10
A181: WERRIBEE | C181: 2 | D181: 1 | E181: =C181*6+D181 -> 13 | G181: 3 | H181: 7 | I181: =G181*6+H181 -> 25 | K181: 5 | L181: 11 | M181: =K181*6+L181 -> 41 | O181: 7 | P181: 14 | Q181: =O181*6+P181 -> 56 | W181: BOX HILL | X181: 1 | Y181: 0 | Z181: 2 | AA181: 2 | AB181: 295 | AC181: 326 | AD181: =(AB181*100)/AC181 -> 90.490797546012274 | AE181: =(Y181*4)+(AA181*2) -> 4
A182: BEST PLAYERS | W182: CAULFIELD | Y182: 1 | Z182: 4 | AA182: 0 | AB182: 378 | AC182: 542 | AD182: =(AB182*100)/AC182 -> 69.741697416974176 | AE182: =(Y182*4)+(AA182*2) -> 4
A183: PRAHRAN | C183: SHEEDY | F183: KIRBY | I183: RYAN | L183: VERWOERT | O183: MOONEY | Q183: SEEDY | W183: NORTHCOTE | X183: 1 | Y183: 2 | Z183: 2 | AA183: 0 | AB183: 269 | AC183: 322 | AD183: =(AB183*100)/AC183 -> 83.540372670807457 | AE183: =(Y183*4)+(AA183*2) -> 8
A184: WERRIBEE | C184: R DOVE | F184: BRYAN | I184: HOLCOMBE | L184: SANDFORD | O184: DENT | Q184: JAMES | W184: CAMBERWELL | Y184: 0 | Z184: 4 | AA184: 1 | AB184: 364 | AC184: 491 | AD184: =(AB184*100)/AC184 -> 74.134419551934826 | AE184: =(Y184*4)+(AA184*2) -> 2
A185: GOALKICKERS
A186: PRAHRAN | C186: RYAN 3 | F186: VERWOERT 3 | I186: SHEEDY 2 | K186: CORRIGAN 2 | N186: SEEDY 2 | P186: PIPER 2 | R186: BUTLER
A187: WERRIBEE | C187: BRYAN 3 | F187: EDWARDS 2 | I187: GOULOPOLOUS | M187: SANDFORD
E188: 9TH MAY | I188: WEATHER
A189: MORDIALLOC | C189: 4 | D189: 2 | E189: =C189*6+D189 -> 26 | G189: 6 | H189: 10 | I189: =G189*6+H189 -> 46 | K189: 9 | L189: 13 | M189: =K189*6+L189 -> 67 | O189: 15 | P189: 22 | Q189: =O189*6+P189 -> 112 | S189: MORDIALLOC
A190: CAMBERWELL | C190: 2 | D190: 6 | E190: =C190*6+D190 -> 18 | G190: 3 | H190: 7 | I190: =G190*6+H190 -> 25 | K190: 5 | L190: 10 | M190: =K190*6+L190 -> 40 | O190: 7 | P190: 13 | Q190: =O190*6+P190 -> 55
A191: BEST PLAYERS
A192: MORDIALLOC | C192: BRADBURY | F192: CARDER | I192: HYNES | L192: O'BRIEN | O192: BAXTER | R192: LESLIE
A193: CAMBERWELL | C193: GIBSON | F193: McKERNAN | I193: MACKIE | L193: YOUNG | O193: ANDERSON | R193: GAUDION
A194: GOALKICKERS
A195: MORDIALLOC | C195: POWER 4 | F195: LESLIE 3 | H195: HYNES 3 | J195: O'BRIEN 2 | M195: BAXTER | O195: CARDER | Q195: BRADBURY
A196: CAMBERWELL | C196: K SMITH 2 | F196: BOYD 2 | H196: KISS | J196: GAUDION | M196: K SMITH
A198: NORTHCOTE | C198: 4 | D198: 5 | E198: =C198*6+D198 -> 29 | G198: 7 | H198: 11 | I198: =G198*6+H198 -> 53 | K198: 8 | L198: 14 | M198: =K198*6+L198 -> 62 | O198: 10 | P198: 17 | Q198: =O198*6+P198 -> 77 | S198: NORTHCOTE
A199: SUNSHINE | C199: 2 | D199: 1 | E199: =C199*6+D199 -> 13 | G199: 2 | H199: 3 | I199: =G199*6+H199 -> 15 | K199: 6 | L199: 6 | M199: =K199*6+L199 -> 42 | O199: 8 | P199: 8 | Q199: =O199*6+P199 -> 56
A200: BEST PLAYERS
A201: NORTHCOTE | C201: CRAMERI | F201: SLEEP | I201: T KEAYS | L201: BRUSH | N201: R LANGBOREN | Q201: McBREEN
A202: SUNSHINE | C202: ROACH | F202: NEWELL | I202: HENDERSON | L202: DARUL | N202: SLATTERY | Q202: BLACKMAN
A203: GOALKICKERS
A204: NORTHCOTE | C204: PITTS 3 | E204: McBREEN | H204: OGILVIE | J204: R LANGBORNE | M204: JOHNSON | O204: DEAN | Q204: CURCIO | S204: LACHMUND
A205: SUNSHINE | C205: GREGORY 3 | F205: FITZGERALD | I205: WAPLING | L205: SLATTERY | N205: DOLL | P205: LEGAWIECZ
A207: BYE | C207: BOX HILL
A209: ROUND 6 | E209: 15TH MAY | I209: WEATHER | S209: PLAYED AT
D210: 1ST QTR | H210: 2ND QTR | L210: 3RD QTR | P210: FINAL | S210: CAMBERWELL
A211: NORTHCOTE | C211: 1 | D211: 2 | E211: =C211*6+D211 -> 8 | G211: 6 | H211: 6 | I211: =G211*6+H211 -> 42 | K211: 6 | L211: 8 | M211: =K211*6+L211 -> 44 | O211: 12 | P211: 15 | Q211: =O211*6+P211 -> 87 | S211: UMPIRE | Y211: LADDER | AC211: ROUND | AE211: 6
A212: CAMBERWELL | C212: 2 | D212: 3 | E212: =C212*6+D212 -> 15 | G212: 4 | H212: 6 | I212: =G212*6+H212 -> 30 | K212: 7 | L212: 9 | M212: =K212*6+L212 -> 51 | O212: 8 | P212: 10 | Q212: =O212*6+P212 -> 58
A213: BEST PLAYERS | W213: TEAM | X213: B | Y213: W | Z213: L | AA213: D | AB213: FOR | AC213: AGST | AD213: % | AE213: PTS
A214: NORTHCOTE | C214: CRAMERI | F214: SLEEP | I214: McBREEN | L214: BEYNON | O214: KEANE | Q214: LUMBY
A215: CAMBERWELL | C215: GIBSON | F215: YOUNG | I215: COMMONS | L215: McKERNAN | O215: PEMBERTON | R215: K SMITH | W215: MORDIALLOC | X215: 1 | Y215: 5 | Z215: 0 | AA215: 0 | AB215: 591 | AC215: 270 | AD215: =(AB215*100)/AC215 -> 218.88888888888889 | AE215: =(Y215*4)+(AA215*2) -> 20
A216: GOALKICKERS | W216: PRESTON | X216: 1 | Y216: 4 | Z216: 1 | AA216: 0 | AB216: 638 | AC216: 246 | AD216: =(AB216*100)/AC216 -> 259.34959349593498 | AE216: =(Y216*4)+(AA216*2) -> 16
A217: NORTHCOTE | C217: CRAMERI 6 | F217: McBREEN 2 | I217: SLEEP | K217: LUMBY | M217: KEANE | O217: LANGBORNE | W217: PRAHRAN | X217: 1 | Y217: 3 | Z217: 1 | AA217: 1 | AB217: 450 | AC217: 432 | AD217: =(AB217*100)/AC217 -> 104.16666666666667 | AE217: =(Y217*4)+(AA217*2) -> 14
A218: CAMBERWELL | C218: D BOYD 2 | F218: K SMITH 2 | I218: COMMONS | L218: PECK | N218: FISHER | P218: PANZIC | W218: SUNSHINE | X218: 1 | Y218: 3 | Z218: 2 | AA218: 0 | AB218: 399 | AC218: 385 | AD218: =(AB218*100)/AC218 -> 103.63636363636364 | AE218: =(Y218*4)+(AA218*2) -> 12
A220: PRESTON | C220: 4 | D220: 3 | E220: =C220*6+D220 -> 27 | G220: 9 | H220: 13 | I220: =G220*6+H220 -> 67 | K220: 11 | L220: 16 | M220: =K220*6+L220 -> 82 | O220: 19 | P220: 25 | Q220: =O220*6+P220 -> 139 | S220: PRESTON | W220: NORTHCOTE | X220: 1 | Y220: 3 | Z220: 2 | AA220: 0 | AB220: 356 | AC220: 380 | AD220: =(AB220*100)/AC220 -> 93.684210526315795 | AE220: =(Y220*4)+(AA220*2) -> 12
A221: BOX HILL | C221: 2 | D221: 2 | E221: =C221*6+D221 -> 14 | G221: 2 | H221: 2 | I221: =G221*6+H221 -> 14 | K221: 3 | L221: 8 | M221: =K221*6+L221 -> 26 | O221: 4 | P221: 9 | Q221: =O221*6+P221 -> 33 | W221: WERRIBEE | Y221: 3 | Z221: 3 | AA221: 0 | AB221: 424 | AC221: 601 | AD221: =(AB221*100)/AC221 -> 70.549084858569046 | AE221: =(Y221*4)+(AA221*2) -> 12
A222: BEST PLAYERS | W222: CAULFIELD | Y222: 1 | Z222: 5 | AA222: 0 | AB222: 449 | AC222: 632 | AD222: =(AB222*100)/AC222 -> 71.044303797468359 | AE222: =(Y222*4)+(AA222*2) -> 4
A223: PRESTON | C223: WALKER | F223: WADDELL | I223: APPLEFORD | L223: TRELOAR | O223: DIXON | Q223: WATSON | W223: BOX HILL | X223: 1 | Y223: 0 | Z223: 3 | AA223: 2 | AB223: 328 | AC223: 465 | AD223: =(AB223*100)/AC223 -> 70.537634408602145 | AE223: =(Y223*4)+(AA223*2) -> 4
A224: BOX HILL | C224: DUURSMA | F224: HOBBS | I224: BRYANT | L224: GRAY | O224: GRIGG | W224: CAMBERWELL | Y224: 0 | Z224: 5 | AA224: 1 | AB224: 422 | AC224: 578 | AD224: =(AB224*100)/AC224 -> 73.010380622837374 | AE224: =(Y224*4)+(AA224*2) -> 2
A225: GOALKICKERS
A226: PRESTON | C226: WALKER 9 | F226: APPLEFORD 2 | I226: McARTHUR 2 | L226: WADDELL | N226: JENKINS | P226: MUIR | R226: TRELOAR | T226: CAMERON | W226: ALEXANDER
A227: BOX HILL | C227: GRIGG | F227: LA ROCHE | I227: HUNT | K227: MORRIS
A229: MORDIALLOC | C229: 4 | D229: 2 | E229: =C229*6+D229 -> 26 | G229: 9 | H229: 9 | I229: =G229*6+H229 -> 63 | K229: 11 | L229: 13 | M229: =K229*6+L229 -> 79 | O229: 20 | P229: 23 | Q229: =O229*6+P229 -> 143 | S229: MORDIALLOC
A230: WERRIBEE | C230: 4 | D230: 6 | E230: =C230*6+D230 -> 30 | G230: 5 | H230: 6 | I230: =G230*6+H230 -> 36 | K230: 8 | L230: 8 | M230: =K230*6+L230 -> 56 | O230: 8 | P230: 8 | Q230: =O230*6+P230 -> 56
A231: BEST PLAYERS
A232: MORDIALLOC | C232: CARDER | F232: BRADBURY | I232: BIBRON | L232: POWER | O232: HOBSON | R232: DANCKERT
A233: WERRIBEE | C233: SANDFORD | F233: TRAINION | I233: BRYAN | L233: ALDERSEA | O233: GOULOPOLOUS | R233: BEVAN
A234: GOALKICKERS
A235: MORDIALLOC | C235: POWER 5 | F235: LESLIE 5 | I235: HYNES 3 | K235: O'BRIEN 2 | M235: BIBRON 2 | O235: MARTELLO | R235: CARDER | U235: DANCKERT
A236: WERRIBEE | C236: BRYAN 2 | F236: SANDFORD 2 | I236: EDWARDS | L236: HOLCOMBE | O236: McGREGOR | R236: TRAINION
E237: 16TH MAY | I237: WEATHER
A238: PRAHRAN | C238: 2 | D238: 0 | E238: =C238*6+D238 -> 12 | G238: 5 | H238: 7 | I238: =G238*6+H238 -> 37 | K238: 8 | L238: 10 | M238: =K238*6+L238 -> 58 | O238: 13 | P238: 12 | Q238: =O238*6+P238 -> 90 | S238: TOORAK PARK
A239: CAULFIELD | C239: 5 | D239: 3 | E239: =C239*6+D239 -> 33 | G239: 6 | H239: 4 | I239: =G239*6+H239 -> 40 | K239: 8 | L239: 4 | M239: =K239*6+L239 -> 52 | O239: 11 | P239: 5 | Q239: =O239*6+P239 -> 71
A240: BEST PLAYERS
A241: PRAHRAN | C241: VERWOERT | F241: RYAN | I241: HARTNETT | L241: KIRBY | O241: SHEEDY | Q241: JUSTICE
A242: CAULFIELD | C242: DOUGLAS | F242: ROWE | I242: TIMMS | L242: STONE | O242: EVANS | Q242: JONES
A243: GOALKICKERS
A244: PRAHRAN | C244: RYAN 4 | F244: HOGAN 4 | I244: CORRIGAN 2 | L244: VERWOERT 2 | O244: PIPER
A245: CAULFIELD | C245: ROWE 5 | F245: BAKER 2 | I245: NICOL | K245: JONES | M245: PALLIN | O245: COLLINS
A247: BYE | C247: SUNSHINE
A249: ROUND 7 | E249: 22ND MAY | I249: WEATHER | S249: PLAYED AT
D250: 1ST QTR | H250: 2ND QTR | L250: 3RD QTR | P250: FINAL | S250: BOX HILL
A251: BOX HILL | C251: 3 | D251: 2 | E251: =C251*6+D251 -> 20 | G251: 7 | H251: 3 | I251: =G251*6+H251 -> 45 | K251: 7 | L251: 5 | M251: =K251*6+L251 -> 47 | O251: 15 | P251: 10 | Q251: =O251*6+P251 -> 100 | S251: UMPIRE | Y251: LADDER | AC251: ROUND | AE251: 7
A252: CAULFIELD | C252: 2 | D252: 4 | E252: =C252*6+D252 -> 16 | G252: 6 | H252: 6 | I252: =G252*6+H252 -> 42 | K252: 7 | L252: 10 | M252: =K252*6+L252 -> 52 | O252: 9 | P252: 13 | Q252: =O252*6+P252 -> 67
A253: BEST PLAYERS | W253: TEAM | X253: B | Y253: W | Z253: L | AA253: D | AB253: FOR | AC253: AGST | AD253: % | AE253: PTS
A254: BOX HILL | C254: HOBBS | F254: BRYANT | I254: FELLOWS | L254: SALMON | O254: GARDINER | R254: SNELL
A255: CAULFIELD | C255: ROWE | F255: DOUGLAS | I255: ARRELL | L255: DUNN | O255: NICHOLLS | R255: PEARSON | W255: PRESTON | X255: 1 | Y255: 5 | Z255: 1 | AA255: 0 | AB255: 755 | AC255: 309 | AD255: =(AB255*100)/AC255 -> 244.33656957928804 | AE255: =(Y255*4)+(AA255*2) -> 20
A256: GOALKICKERS | W256: MORDIALLOC | X256: 1 | Y256: 5 | Z256: 1 | AA256: 0 | AB256: 657 | AC256: 353 | AD256: =(AB256*100)/AC256 -> 186.11898016997168 | AE256: =(Y256*4)+(AA256*2) -> 20
A257: BOX HILL | C257: LA ROCHE 4 | F257: HOBBS 3 | I257: SNELL 2 | K257: BRYANT 2 | M257: MACE 2 | O257: HUNT 2 | W257: SUNSHINE | X257: 1 | Y257: 4 | Z257: 2 | AA257: 0 | AB257: 512 | AC257: 494 | AD257: =(AB257*100)/AC257 -> 103.64372469635627 | AE257: =(Y257*4)+(AA257*2) -> 16
A258: CAULFIELD | C258: ROWE 2 | F258: ARRELL 2 | I258: PEARSON 2 | L258: NICHOLLS | N258: HUNT | P258: DUNN | W258: NORTHCOTE | X258: 1 | Y258: 4 | Z258: 2 | AA258: 0 | AB258: 439 | AC258: 463 | AD258: =(AB258*100)/AC258 -> 94.816414686825055 | AE258: =(Y258*4)+(AA258*2) -> 16
E259: 23RD MAY | I259: WEATHER
A260: NORTHCOTE | C260: 3 | D260: 2 | E260: =C260*6+D260 -> 20 | G260: 6 | H260: 8 | I260: =G260*6+H260 -> 44 | K260: 7 | L260: 10 | M260: =K260*6+L260 -> 52 | O260: 11 | P260: 17 | Q260: =O260*6+P260 -> 83 | S260: NORTHCOTE | W260: PRAHRAN | X260: 1 | Y260: 3 | Z260: 2 | AA260: 1 | AB260: 559 | AC260: 545 | AD260: =(AB260*100)/AC260 -> 102.56880733944953 | AE260: =(Y260*4)+(AA260*2) -> 14
A261: MORDIALLOC | C261: 3 | D261: 0 | E261: =C261*6+D261 -> 18 | G261: 6 | H261: 3 | I261: =G261*6+H261 -> 39 | K261: 8 | L261: 8 | M261: =K261*6+L261 -> 56 | O261: 9 | P261: 12 | Q261: =O261*6+P261 -> 66 | W261: WERRIBEE | Y261: 3 | Z261: 4 | AA261: 0 | AB261: 487 | AC261: 718 | AD261: =(AB261*100)/AC261 -> 67.827298050139277 | AE261: =(Y261*4)+(AA261*2) -> 12
A262: BEST PLAYERS | W262: BOX HILL | X262: 1 | Y262: 1 | Z262: 3 | AA262: 2 | AB262: 428 | AC262: 532 | AD262: =(AB262*100)/AC262 -> 80.451127819548873 | AE262: =(Y262*4)+(AA262*2) -> 8
A263: NORTHCOTE | C263: McBREEN | F263: CRAMERI | I263: SIMPSON | L263: SLEEP | O263: OGILVIE | R263: BEYNON | W263: CAULFIELD | Y263: 1 | Z263: 6 | AA263: 0 | AB263: 516 | AC263: 732 | AD263: =(AB263*100)/AC263 -> 70.491803278688522 | AE263: =(Y263*4)+(AA263*2) -> 4
A264: MORDIALLOC | C264: LAIRD | F264: WILLIAMS | I264: CARDER | L264: O'BRIEN | O264: BRADBURY | R264: HOBSON | W264: CAMBERWELL | X264: 1 | Y264: 0 | Z264: 5 | AA264: 1 | AB264: 422 | AC264: 578 | AD264: =(AB264*100)/AC264 -> 73.010380622837374 | AE264: =(Y264*4)+(AA264*2) -> 2
A265: GOALKICKERS
A266: NORTHCOTE | C266: McBREEN 3 | F266: CRAMERI 3 | I266: R DEAN 2 | L266: GEMMELL | N266: JOHNSON | Q266: CURCIO
A267: MORDIALLOC | C267: O'BRIEN 4 | F267: BAXTER | I267: MARTELLO | L267: GROVES | N267: CARDER | Q267: POWER
A269: SUNSHINE | C269: 1 | D269: 1 | E269: =C269*6+D269 -> 7 | G269: 7 | H269: 6 | I269: =G269*6+H269 -> 48 | K269: 14 | L269: 8 | M269: =K269*6+L269 -> 92 | O269: 17 | P269: 11 | Q269: =O269*6+P269 -> 113 | S269: SUNSHINE
A270: PRAHRAN | C270: 3 | D270: 6 | E270: =C270*6+D270 -> 24 | G270: 7 | H270: 9 | I270: =G270*6+H270 -> 51 | K270: 11 | L270: 16 | M270: =K270*6+L270 -> 82 | O270: 15 | P270: 19 | Q270: =O270*6+P270 -> 109
A271: BEST PLAYERS
A272: SUNSHINE | C272: NEWELL | F272: CROSBIE | I272: BECKER | L272: BROWN | O272: HOWARD | R272: ROACH
A273: PRAHRAN | C273: MOONEY | F273: KIRBY | I273: SHEEDY | L273: WISHART | O273: VERWOERT | R273: PEARSON
A274: GOALKICKERS
A275: SUNSHINE | C275: GREGORY 4 | F275: SLATTERY 3 | I275: CROSBIE 3 | L275: HOWARD 2 | O275: BROWN 2 | Q275: WAPLING | S275: SAUNDERS | W275: LEGAWIECZ
A276: PRAHRAN | C276: PEARSON 4 | F276: RYAN 3 | I276: HOGAN 2 | L276: VERWOERT 2 | O276: SHEEDY 2 | Q276: CORRIGAN | T276: MOONEY
A278: PRESTON | C278: 3 | D278: 2 | E278: =C278*6+D278 -> 20 | G278: 6 | H278: 7 | I278: =G278*6+H278 -> 43 | K278: 12 | L278: 10 | M278: =K278*6+L278 -> 82 | O278: 17 | P278: 15 | Q278: =O278*6+P278 -> 117 | S278: WERRIBEE
A279: WERRIBEE | C279: 3 | D279: 4 | E279: =C279*6+D279 -> 22 | G279: 6 | H279: 4 | I279: =G279*6+H279 -> 40 | K279: 6 | L279: 5 | M279: =K279*6+L279 -> 41 | O279: 9 | P279: 9 | Q279: =O279*6+P279 -> 63
A280: BEST PLAYERS
A281: PRESTON | C281: TRELOAR | F281: DIXON | I281: WADDELL | L281: McARTHUR | O281: MURNANE | R281: MUIR
A282: WERRIBEE | C282: DENT | F282: R DOVE | I282: GOULOPOLOUS | L282: BRYAN | O282: HOLCOMBE | R282: EDWARDS
A283: GOALKICKERS
A284: PRESTON | C284: WALKER 6 | F284: MUIR 4 | H284: TRELOAR 3 | K284: WHITE 2 | M284: WILSON | O284: APPLEFORD
A285: WERRIBEE | C285: BRYAN 3 | F285: PANTE 2 | I285: SANDFORD | L285: TRAINION | N285: McGREGOR | Q285: SMITH
A287: BYE | C287: CAMBERWELL
A289: ROUND 8 | E289: 29TH MAY | I289: WEATHER | S289: PLAYED AT
D290: 1ST QTR | H290: 2ND QTR | L290: 3RD QTR | P290: FINAL | S290: BOX HILL
A291: BOX HILL | C291: 2 | D291: 3 | E291: =C291*6+D291 -> 15 | G291: 3 | H291: 4 | I291: =G291*6+H291 -> 22 | K291: 6 | L291: 7 | M291: =K291*6+L291 -> 43 | O291: 8 | P291: 11 | Q291: =O291*6+P291 -> 59 | S291: UMPIRE | Y291: LADDER | AC291: ROUND | AE291: 8
A292: NORTHCOTE | C292: 1 | D292: 2 | E292: =C292*6+D292 -> 8 | G292: 4 | H292: 3 | I292: =G292*6+H292 -> 27 | K292: 5 | L292: 7 | M292: =K292*6+L292 -> 37 | O292: 6 | P292: 11 | Q292: =O292*6+P292 -> 47
A293: BEST PLAYERS | W293: TEAM | X293: B | Y293: W | Z293: L | AA293: D | AB293: FOR | AC293: AGST | AD293: % | AE293: PTS
A294: BOX HILL | C294: LEHMAN | F294: DUURSMA | I294: SNELL | L294: HOBBS | N294: BRYANT | Q294: I BATES
A295: NORTHCOTE | C295: CRAMERI | F295: BEYNON | I295: SLEEP | L295: McBREEN | N295: GEMMELL | Q295: KEANE | W295: PRESTON | X295: 1 | Y295: 6 | Z295: 1 | AA295: 0 | AB295: 888 | AC295: 339 | AD295: =(AB295*100)/AC295 -> 261.94690265486724 | AE295: =(Y295*4)+(AA295*2) -> 24
A296: GOALKICKERS | W296: MORDIALLOC | X296: 1 | Y296: 5 | Z296: 2 | AA296: 0 | AB296: 738 | AC296: 447 | AD296: =(AB296*100)/AC296 -> 165.1006711409396 | AE296: =(Y296*4)+(AA296*2) -> 20
A297: BOX HILL | C297: HOBBS 4 | F297: MACE 2 | I297: BRYANT 2 | W297: PRAHRAN | X297: 1 | Y297: 4 | Z297: 2 | AA297: 1 | AB297: 653 | AC297: 626 | AD297: =(AB297*100)/AC297 -> 104.31309904153355 | AE297: =(Y297*4)+(AA297*2) -> 18
A298: NORTHCOTE | C298: GEMMELL 2 | F298: SLEEP | I298: PITTS | K298: BEECHER | M298: KEANE | W298: SUNSHINE | X298: 1 | Y298: 4 | Z298: 3 | AA298: 0 | AB298: 579 | AC298: 566 | AD298: =(AB298*100)/AC298 -> 102.29681978798587 | AE298: =(Y298*4)+(AA298*2) -> 16
A300: CAULFIELD | C300: 4 | D300: 1 | E300: =C300*6+D300 -> 25 | G300: 5 | H300: 7 | I300: =G300*6+H300 -> 37 | K300: 7 | L300: 9 | M300: =K300*6+L300 -> 51 | O300: 10 | P300: 12 | Q300: =O300*6+P300 -> 72 | S300: PRINCES PARK, CAULFIELD | W300: NORTHCOTE | X300: 1 | Y300: 4 | Z300: 3 | AA300: 0 | AB300: 486 | AC300: 522 | AD300: =(AB300*100)/AC300 -> 93.103448275862064 | AE300: =(Y300*4)+(AA300*2) -> 16
A301: SUNSHINE | C301: 3 | D301: 3 | E301: =C301*6+D301 -> 21 | G301: 5 | H301: 8 | I301: =G301*6+H301 -> 38 | K301: 8 | L301: 13 | M301: =K301*6+L301 -> 61 | O301: 9 | P301: 13 | Q301: =O301*6+P301 -> 67 | W301: BOX HILL | X301: 1 | Y301: 2 | Z301: 3 | AA301: 2 | AB301: 487 | AC301: 579 | AD301: =(AB301*100)/AC301 -> 84.110535405872199 | AE301: =(Y301*4)+(AA301*2) -> 12
A302: BEST PLAYERS | W302: WERRIBEE | X302: 1 | Y302: 3 | Z302: 4 | AA302: 0 | AB302: 487 | AC302: 718 | AD302: =(AB302*100)/AC302 -> 67.827298050139277 | AE302: =(Y302*4)+(AA302*2) -> 12
A303: CAULFIELD | C303: GILBERT | F303: ROWE | I303: SIMMONS | L303: STONE | N303: DE BOND | Q303: NICOL | W303: CAULFIELD | Y303: 2 | Z303: 6 | AA303: 0 | AB303: 588 | AC303: 799 | AD303: =(AB303*100)/AC303 -> 73.591989987484354 | AE303: =(Y303*4)+(AA303*2) -> 8
A304: SUNSHINE | C304: SLATTERY | F304: BECKER | I304: GREGORY | L304: CLEMSON | N304: TREZISE | Q304: DARUL | W304: CAMBERWELL | X304: 1 | Y304: 0 | Z304: 6 | AA304: 1 | AB304: 452 | AC304: 711 | AD304: =(AB304*100)/AC304 -> 63.572433192686354 | AE304: =(Y304*4)+(AA304*2) -> 2
A305: GOALKICKERS
A306: CAULFIELD | C306: ROWE 4 | F306: NICHOLLS 2 | I306: DOUGLAS | L306: NICOL | N306: MOORE | P306: ARRELL
A307: SUNSHINE | C307: SLATTERY 3 | F307: HOWARD 2 | I307: FITZGERALD | L307: WAPLING | N307: CROSBIE | P307: HARRIS
E308: 30TH MAY | I308: WEATHER
A309: PRESTON | C309: 4 | D309: 4 | E309: =C309*6+D309 -> 28 | G309: 11 | H309: 8 | I309: =G309*6+H309 -> 74 | K309: 13 | L309: 11 | M309: =K309*6+L309 -> 89 | O309: 19 | P309: 19 | Q309: =O309*6+P309 -> 133 | S309: PRESTON
A310: CAMBERWELL | C310: 2 | D310: 1 | E310: =C310*6+D310 -> 13 | G310: 2 | H310: 2 | I310: =G310*6+H310 -> 14 | K310: 4 | L310: 6 | M310: =K310*6+L310 -> 30 | O310: 4 | P310: 6 | Q310: =O310*6+P310 -> 30
A311: BEST PLAYERS
A312: PRESTON | C312: JENKINS | F312: McARTHUR | I312: CAMERON | L312: HUBBARD | N312: DELLAMARTA | Q312: PINFOLD
A313: CAMBERWELL | C313: GAUDION | F313: PEMBERTON | I313: GIBSON | L313: PECK | N313: BOYD | Q313: MACKERNAN
A314: GOALKICKERS
A315: PRESTON | C315: WALKER 6 | F315: WHITE 4 | I315: MURNANE 3 | L315: DELLAMARTA 2 | O315: MUIR 2 | Q315: McARTHUR | T315: WADDELL
A316: CAMBERWELL | C316: DOUGLAS 3 | F316: FISHER
A318: PRAHRAN | C318: 3 | D318: 0 | E318: =C318*6+D318 -> 18 | G318: 9 | H318: 7 | I318: =G318*6+H318 -> 61 | K318: 11 | L318: 8 | M318: =K318*6+L318 -> 74 | O318: 13 | P318: 16 | Q318: =O318*6+P318 -> 94 | S318: TOORAK PARK
A319: MORDIALLOC | C319: 4 | D319: 4 | E319: =C319*6+D319 -> 28 | G319: 9 | H319: 6 | I319: =G319*6+H319 -> 60 | K319: 11 | L319: 13 | M319: =K319*6+L319 -> 79 | O319: 11 | P319: 15 | Q319: =O319*6+P319 -> 81
A320: BEST PLAYERS
A321: PRAHRAN | C321: BUTLER | F321: VERWOERT | I321: YOUNG | L321: McMAHON | O321: RYAN | Q321: WISHART
A322: MORDIALLOC | C322: O'BRIEN | F322: BAXTER | I322: CARDER | L322: LESLIE | O322: DANCKERT
A323: GOALKICKERS
A324: PRAHRAN | C324: RYAN 4 | F324: HOGAN 3 | I324: BUTLER 2 | L324: GLOVER 2 | N324: McMAHON | Q324: VERWOERT
A325: MORDIALLOC | C325: POWER 5 | F325: BAXTER 3 | I325: O'BRIEN 2 | L325: LESLIE
A327: BYE | C327: WERRIBEE
A329: ROUND 9 | E329: 5TH JUNE | I329: WEATHER | S329: PLAYED AT
D330: 1ST QTR | H330: 2ND QTR | L330: 3RD QTR | P330: FINAL | S330: CAMBERWELL
A331: CAMBERWELL | C331: 4 | D331: 0 | E331: =C331*6+D331 -> 24 | G331: 7 | H331: 4 | I331: =G331*6+H331 -> 46 | K331: 9 | L331: 8 | M331: =K331*6+L331 -> 62 | O331: 16 | P331: 10 | Q331: =O331*6+P331 -> 106 | S331: UMPIRE | Y331: LADDER | AC331: ROUND | AE331: 9
A332: PRAHRAN | C332: 3 | D332: 1 | E332: =C332*6+D332 -> 19 | G332: 5 | H332: 3 | I332: =G332*6+H332 -> 33 | K332: 8 | L332: 7 | M332: =K332*6+L332 -> 55 | O332: 10 | P332: 11 | Q332: =O332*6+P332 -> 71
A333: BEST PLAYERS | W333: TEAM | X333: B | Y333: W | Z333: L | AA333: D | AB333: FOR | AC333: AGST | AD333: % | AE333: PTS
A334: CAMBERWELL | C334: MACKIE | F334: GAUDION | I334: ALLEMAND | L334: PEMBERTON | O334: K SMITH | R334: QUIRK
A335: PRAHRAN | C335: RYAN | F335: YOUNG | I335: GLOVER | L335: WISHART | O335: SEEDY | R335: HARTNETT | W335: PRESTON | X335: 1 | Y335: 6 | Z335: 2 | AA335: 0 | AB335: 965 | AC335: 429 | AD335: =(AB335*100)/AC335 -> 224.94172494172494 | AE335: =(Y335*4)+(AA335*2) -> 24
A336: GOALKICKERS | W336: MORDIALLOC | X336: 1 | Y336: 6 | Z336: 2 | AA336: 0 | AB336: 828 | AC336: 524 | AD336: =(AB336*100)/AC336 -> 158.01526717557252 | AE336: =(Y336*4)+(AA336*2) -> 24
A337: CAMBERWELL | C337: QUIRK 5 | F337: K SMITH 4 | I337: DOUGLAS 3 | L337: HAFEY 2 | N337: PECK | P337: GIBSON | W337: SUNSHINE | X337: 1 | Y337: 5 | Z337: 3 | AA337: 0 | AB337: 714 | AC337: 656 | AD337: =(AB337*100)/AC337 -> 108.84146341463415 | AE337: =(Y337*4)+(AA337*2) -> 20
A338: PRAHRAN | C338: RYAN 5 | F338: CRIPPS | I338: BUTLER | K338: PEARSON | M338: VERWOERT | P338: PIPER | W338: NORTHCOTE | X338: 1 | Y338: 5 | Z338: 3 | AA338: 0 | AB338: 561 | AC338: 590 | AD338: =(AB338*100)/AC338 -> 95.084745762711862 | AE338: =(Y338*4)+(AA338*2) -> 20
A340: SUNSHINE | C340: 6 | D340: 4 | E340: =C340*6+D340 -> 40 | G340: 11 | H340: 5 | I340: =G340*6+H340 -> 71 | K340: 17 | L340: 8 | M340: =K340*6+L340 -> 110 | O340: 21 | P340: 9 | Q340: =O340*6+P340 -> 135 | S340: SUNSHINE | W340: PRAHRAN | X340: 1 | Y340: 4 | Z340: 3 | AA340: 1 | AB340: 724 | AC340: 732 | AD340: =(AB340*100)/AC340 -> 98.907103825136616 | AE340: =(Y340*4)+(AA340*2) -> 18
A341: BOX HILL | C341: 1 | D341: 3 | E341: =C341*6+D341 -> 9 | G341: 2 | H341: 11 | I341: =G341*6+H341 -> 23 | K341: 3 | L341: 14 | M341: =K341*6+L341 -> 32 | O341: 12 | P341: 18 | Q341: =O341*6+P341 -> 90 | W341: BOX HILL | X341: 1 | Y341: 2 | Z341: 4 | AA341: 2 | AB341: 577 | AC341: 714 | AD341: =(AB341*100)/AC341 -> 80.812324929971993 | AE341: =(Y341*4)+(AA341*2) -> 12
A342: BEST PLAYERS | W342: WERRIBEE | X342: 1 | Y342: 3 | Z342: 5 | AA342: 0 | AB342: 555 | AC342: 793 | AD342: =(AB342*100)/AC342 -> 69.987389659520801 | AE342: =(Y342*4)+(AA342*2) -> 12
A343: SUNSHINE | C343: DARUL | F343: CROSBIE | I343: GREGORY | L343: YOUNG | O343: TRUSLER | R343: SLATTERY | W343: CAULFIELD | X343: 1 | Y343: 2 | Z343: 6 | AA343: 0 | AB343: 588 | AC343: 799 | AD343: =(AB343*100)/AC343 -> 73.591989987484354 | AE343: =(Y343*4)+(AA343*2) -> 8
A344: BOX HILL | C344: MACE | F344: GARDINER | I344: BRYANT | L344: HARRIS | O344: FELLOWS | R344: I BATES | W344: CAMBERWELL | X344: 1 | Y344: 1 | Z344: 6 | AA344: 1 | AB344: 558 | AC344: 782 | AD344: =(AB344*100)/AC344 -> 71.355498721227619 | AE344: =(Y344*4)+(AA344*2) -> 6
A345: GOALKICKERS
A346: SUNSHINE | C346: GREGORY 5 | F346: CROSBIE 4 | I346: SAUNDERS 3 | L346: SLATTERY 2 | O346: TRUSLER 2 | Q346: LEGAWIECZ 2 | T346: HURST | W346: TREZISE | X346: HOWARD
A347: BOX HILL | C347: MACE 3 | F347: I BATES 2 | I347: LA ROCHE 2 | L347: HOBBS 2 | N347: BAYES | P347: PLUNKETT | R347: HARRIS
E348: 6TH JUNE | I348: WEATHER
A349: NORTHCOTE | C349: 2 | D349: 3 | E349: =C349*6+D349 -> 15 | G349: 4 | H349: 8 | I349: =G349*6+H349 -> 32 | K349: 6 | L349: 11 | M349: =K349*6+L349 -> 47 | O349: 10 | P349: 15 | Q349: =O349*6+P349 -> 75 | S349: NORTHCOTE
A350: WERRIBEE | C350: 4 | D350: 1 | E350: =C350*6+D350 -> 25 | G350: 7 | H350: 3 | I350: =G350*6+H350 -> 45 | K350: 8 | L350: 6 | M350: =K350*6+L350 -> 54 | O350: 10 | P350: 8 | Q350: =O350*6+P350 -> 68
A351: BEST PLAYERS
A352: NORTHCOTE | C352: SIMPSON | F352: HAAG | I352: VINEY | L352: CRAMERI | O352: OGILVIE | Q352: SLEEP
A353: WERRIBEE | C353: HOLCOMBE | F353: EDWARDS | I353: TURNER | L353: SMITH | O353: DOVE | Q353: GOULOPOLOUS
A354: GOALKICKERS
A355: NORTHCOTE | C355: HAAG 3 | F355: CRAMERI 3 | I355: SLEEP | K355: LANGBORNE | N355: VINEY | P355: KELLETT
A356: WERRIBEE | C356: PANTE 3 | F356: SMITH 2 | I356: TURNER | L356: EDWARDS | N356: BRYAN | P356: GOULOPOLOUS
A358: MORDIALLOC | C358: 0 | D358: 0 | E358: =C358*6+D358 -> 0 | G358: 6 | H358: 6 | I358: =G358*6+H358 -> 42 | K358: 7 | L358: 6 | M358: =K358*6+L358 -> 48 | O358: 13 | P358: 12 | Q358: =O358*6+P358 -> 90 | S358: MORDIALLOC
A359: PRESTON | C359: 6 | D359: 9 | E359: =C359*6+D359 -> 45 | G359: 6 | H359: 10 | I359: =G359*6+H359 -> 46 | K359: 10 | L359: 16 | M359: =K359*6+L359 -> 76 | O359: 10 | P359: 17 | Q359: =O359*6+P359 -> 77
A360: BEST PLAYERS
A361: MORDIALLOC | C361: BAXTER | F361: DANCKERT | I361: BLAINEY | L361: POWER | O361: WILLIAMS | R361: HYNES
A362: PRESTON | C362: MURNANE | F362: JENNINGS | I362: CAMERON | L362: HUBBARD | O362: ALEXANDER | R362: MUIR
A363: GOALKICKERS
A364: MORDIALLOC | C364: POWER 5 | F364: BAXTER 4 | I364: O'BRIEN 3 | L364: LESLIE 2
A365: PRESTON | C365: McARTHUR 2 | F365: MURNANE 2 | I365: CAMERON 2 | L365: MUIR 2 | N365: JENKINS 2
A367: BYE | C367: CAULFIELD
A369: ROUND 10 | E369: 12TH JUNE | I369: WEATHER | S369: PLAYED AT
D370: 1ST QTR | H370: 2ND QTR | L370: 3RD QTR | P370: FINAL | S370: PRINCES PARK, CAULFIELD
A371: MORDIALLOC | C371: 4 | D371: 4 | E371: =C371*6+D371 -> 28 | G371: 5 | H371: 5 | I371: =G371*6+H371 -> 35 | K371: 11 | L371: 10 | M371: =K371*6+L371 -> 76 | O371: 13 | P371: 12 | Q371: =O371*6+P371 -> 90 | S371: UMPIRE | Y371: LADDER | AC371: ROUND | AE371: 10
A372: CAULFIELD | C372: 3 | D372: 0 | E372: =C372*6+D372 -> 18 | G372: 6 | H372: 5 | I372: =G372*6+H372 -> 41 | K372: 9 | L372: 7 | M372: =K372*6+L372 -> 61 | O372: 11 | P372: 12 | Q372: =O372*6+P372 -> 78
A373: BEST PLAYERS | W373: TEAM | X373: B | Y373: W | Z373: L | AA373: D | AB373: FOR | AC373: AGST | AD373: % | AE373: PTS
A374: MORDIALLOC | C374: HOBSON | F374: BLAINEY | I374: HYNES | L374: BAXTER | N374: LESLIE | Q374: FULLER
A375: CAULFIELD | C375: DOUGLAS | F375: ROWE | I375: DE BOND | L375: DUNN | N375: NICHOLLS | Q375: MOORE | W375: MORDIALLOC | X375: 1 | Y375: 7 | Z375: 2 | AA375: 0 | AB375: 918 | AC375: 602 | AD375: =(AB375*100)/AC375 -> 152.49169435215947 | AE375: =(Y375*4)+(AA375*2) -> 28
A376: GOALKICKERS | W376: PRESTON | X376: 2 | Y376: 6 | Z376: 2 | AA376: 0 | AB376: 965 | AC376: 429 | AD376: =(AB376*100)/AC376 -> 224.94172494172494 | AE376: =(Y376*4)+(AA376*2) -> 24
A377: MORDIALLOC | C377: BAXTER 4 | F377: LESLIE 3 | I377: POWER 2 | K377: FULLER | M377: LAIRD | O377: HYNES | Q377: GROVES | W377: SUNSHINE | X377: 1 | Y377: 6 | Z377: 3 | AA377: 0 | AB377: 811 | AC377: 751 | AD377: =(AB377*100)/AC377 -> 107.98934753661784 | AE377: =(Y377*4)+(AA377*2) -> 24
A378: CAULFIELD | C378: MOORE 3 | F378: BAKER 2 | I378: ARRELL | K378: DUNN | M378: NICHOLLS | O378: ROWE | Q378: SIMMONS | S378: CROSHER | W378: NORTHCOTE | X378: 1 | Y378: 6 | Z378: 3 | AA378: 0 | AB378: 644 | AC378: 669 | AD378: =(AB378*100)/AC378 -> 96.263079222720478 | AE378: =(Y378*4)+(AA378*2) -> 24
E379: 13TH JUNE | I379: WEATHER
A380: NORTHCOTE | C380: 1 | D380: 1 | E380: =C380*6+D380 -> 7 | G380: 5 | H380: 6 | I380: =G380*6+H380 -> 36 | K380: 8 | L380: 13 | M380: =K380*6+L380 -> 61 | O380: 11 | P380: 17 | Q380: =O380*6+P380 -> 83 | S380: TOORAK PARK | W380: PRAHRAN | X380: 1 | Y380: 4 | Z380: 4 | AA380: 1 | AB380: 803 | AC380: 815 | AD380: =(AB380*100)/AC380 -> 98.527607361963192 | AE380: =(Y380*4)+(AA380*2) -> 18
A381: PRAHRAN | C381: 1 | D381: 1 | E381: =C381*6+D381 -> 7 | G381: 6 | H381: 5 | I381: =G381*6+H381 -> 41 | K381: 9 | L381: 10 | M381: =K381*6+L381 -> 64 | O381: 11 | P381: 13 | Q381: =O381*6+P381 -> 79 | W381: BOX HILL | X381: 1 | Y381: 3 | Z381: 4 | AA381: 2 | AB381: 681 | AC381: 789 | AD381: =(AB381*100)/AC381 -> 86.311787072243348 | AE381: =(Y381*4)+(AA381*2) -> 16
A382: BEST PLAYERS | W382: WERRIBEE | X382: 1 | Y382: 3 | Z382: 6 | AA382: 0 | AB382: 650 | AC382: 890 | AD382: =(AB382*100)/AC382 -> 73.033707865168537 | AE382: =(Y382*4)+(AA382*2) -> 12
A383: NORTHCOTE | C383: KEANE | F383: McBREEN | I383: OGILVIE | L383: HAAG | N383: SIMPSON | Q383: BISHOP | W383: CAULFIELD | X383: 1 | Y383: 2 | Z383: 7 | AA383: 0 | AB383: 666 | AC383: 889 | AD383: =(AB383*100)/AC383 -> 74.91563554555681 | AE383: =(Y383*4)+(AA383*2) -> 8
A384: PRAHRAN | C384: WISHART | F384: COOPER | I384: RYAN | L384: DORAN | N384: YOUNG | Q384: BUTLER | W384: CAMBERWELL | X384: 1 | Y384: 1 | Z384: 7 | AA384: 1 | AB384: 633 | AC384: 886 | AD384: =(AB384*100)/AC384 -> 71.444695259593686 | AE384: =(Y384*4)+(AA384*2) -> 6
A385: GOALKICKERS
A386: NORTHCOTE | C386: HAAG 3 | F386: BISHOP 2 | I386: BRADY 2 | K386: CRAMERI | M386: HENRY | O386: VINEY | Q386: KEANE
A387: PRAHRAN | C387: COOPER 4 | F387: RYAN 3 | I387: BUTLER | K387: SMITH | M387: WISHART | O387: MOONEY
A389: SUNSHINE | C389: 1 | D389: 5 | E389: =C389*6+D389 -> 11 | G389: 7 | H389: 9 | I389: =G389*6+H389 -> 51 | K389: 11 | L389: 11 | M389: =K389*6+L389 -> 77 | O389: 14 | P389: 13 | Q389: =O389*6+P389 -> 97 | S389: WERRIBEE
A390: WERRIBEE | C390: 3 | D390: 2 | E390: =C390*6+D390 -> 20 | G390: 6 | H390: 2 | I390: =G390*6+H390 -> 38 | K390: 11 | L390: 7 | M390: =K390*6+L390 -> 73 | O390: 14 | P390: 11 | Q390: =O390*6+P390 -> 95
A391: BEST PLAYERS
A392: SUNSHINE | C392: TRUSLER | F392: ROACH | I392: SLATTERY | L392: HOWARD | N392: YOUNG | Q392: NEWELL
A393: WERRIBEE | C393: GOULOPOLOUS | F393: McGREGOR | I393: TRAINION | L393: PANTE | N393: B SMITH | Q393: TURNER
A394: GOALKICKERS
A395: SUNSHINE | C395: SLATTERY 5 | F395: HOWARD 3 | I395: TRUSLER 2 | L395: GREGORY 2 | N395: W HARRIS | Q395: TREZISE
A396: WERRIBEE | C396: PANTE 4 | F396: BRYAN 3 | I396: SANDFORD 2 | L396: FRANCE 2 | N396: EDWARDS | Q396: SMITH | S396: TRAINION
E397: 14TH JUNE | I397: WEATHER
A398: BOX HILL | C398: 4 | D398: 4 | E398: =C398*6+D398 -> 28 | G398: 6 | H398: 6 | I398: =G398*6+H398 -> 42 | K398: 12 | L398: 10 | M398: =K398*6+L398 -> 82 | O398: 15 | P398: 14 | Q398: =O398*6+P398 -> 104 | S398: BOX HILL
A399: CAMBERWELL | C399: 1 | D399: 1 | E399: =C399*6+D399 -> 7 | G399: 4 | H399: 4 | I399: =G399*6+H399 -> 28 | K399: 7 | L399: 5 | M399: =K399*6+L399 -> 47 | O399: 11 | P399: 9 | Q399: =O399*6+P399 -> 75
A400: BEST PLAYERS
A401: BOX HILL | C401: GARDINER | F401: I BATES | I401: W HARRIS | L401: GRIGG | O401: MACE | R401: H SMITH
A402: CAMBERWELL | C402: MACKIE | F402: K SMITH | I402: ANDERSON | L402: PEMBERTON | O402: FRIEBERG | R402: GIBSON
A403: GOALKICKERS
A404: BOX HILL | C404: LA ROCHE 4 | F404: MACE 4 | H404: SNELL 2 | J404: BRYANT 2 | M404: GRIGG | O404: I BATES | Q404: McCURRY
A405: CAMBERWELL | C405: ANDERSON 3 | F405: K SMITH 2 | I405: PECK 2 | K405: COOPER | M405: PEMBERTON | P405: GIBSON | R405: GAUDION
A407: BYE | C407: PRESTON
A409: ROUND 11 | E409: 19TH JUNE | I409: WEATHER | S409: PLAYED AT
D410: 1ST QTR | H410: 2ND QTR | L410: 3RD QTR | P410: FINAL | S410: MORDIALLOC
A411: MORDIALLOC | C411: 1 | D411: 2 | E411: =C411*6+D411 -> 8 | G411: 6 | H411: 7 | I411: =G411*6+H411 -> 43 | K411: 12 | L411: 7 | M411: =K411*6+L411 -> 79 | O411: 21 | P411: 12 | Q411: =O411*6+P411 -> 138 | S411: UMPIRE | Y411: LADDER | AC411: ROUND | AE411: 11
A412: BOX HILL | C412: 2 | D412: 3 | E412: =C412*6+D412 -> 15 | G412: 4 | H412: 5 | I412: =G412*6+H412 -> 29 | K412: 8 | L412: 9 | M412: =K412*6+L412 -> 57 | O412: 11 | P412: 9 | Q412: =O412*6+P412 -> 75
A413: BEST PLAYERS | W413: TEAM | X413: B | Y413: W | Z413: L | AA413: D | AB413: FOR | AC413: AGST | AD413: % | AE413: PTS
A414: MORDIALLOC | C414: POWER | F414: LESLIE | I414: HYNES | L414: LAIRD | N414: O'BREIN | Q414: BAXTER
A415: BOX HILL | C415: MACE | F415: LA ROCHE | I415: HOBBS | L415: BAYES | N415: WHITE | Q415: BRYANT | W415: MORDIALLOC | X415: 1 | Y415: 8 | Z415: 2 | AA415: 0 | AB415: 1056 | AC415: 677 | AD415: =(AB415*100)/AC415 -> 155.98227474150664 | AE415: =(Y415*4)+(AA415*2) -> 32
A416: GOALKICKERS | W416: PRESTON | X416: 2 | Y416: 7 | Z416: 2 | AA416: 0 | AB416: 1052 | AC416: 494 | AD416: =(AB416*100)/AC416 -> 212.95546558704453 | AE416: =(Y416*4)+(AA416*2) -> 28
A417: MORDIALLOC | C417: POWER 6 | F417: LESLIE 4 | H417: O'BRIEN 4 | J417: HYNES 3 | L417: COLLIS 2 | N417: BAXTER | Q417: BRADBURY | W417: NORTHCOTE | X417: 1 | Y417: 7 | Z417: 3 | AA417: 0 | AB417: 736 | AC417: 730 | AD417: =(AB417*100)/AC417 -> 100.82191780821918 | AE417: =(Y417*4)+(AA417*2) -> 28
A418: BOX HILL | C418: LA ROCHE 5 | F418: MACE 2 | H418: PLUNKETT | J418: BRYANT | M418: LOOMES | O418: HOBBS | W418: SUNSHINE | X418: 1 | Y418: 6 | Z418: 4 | AA418: 0 | AB418: 876 | AC418: 838 | AD418: =(AB418*100)/AC418 -> 104.5346062052506 | AE418: =(Y418*4)+(AA418*2) -> 24
A420: WERRIBEE | C420: 7 | D420: 2 | E420: =C420*6+D420 -> 44 | G420: 8 | H420: 2 | I420: =G420*6+H420 -> 50 | K420: 8 | L420: 8 | M420: =K420*6+L420 -> 56 | O420: 10 | P420: 10 | Q420: =O420*6+P420 -> 70 | S420: CAMBERWELL | W420: PRAHRAN | X420: 2 | Y420: 4 | Z420: 4 | AA420: 1 | AB420: 803 | AC420: 815 | AD420: =(AB420*100)/AC420 -> 98.527607361963192 | AE420: =(Y420*4)+(AA420*2) -> 18
A421: CAMBERWELL | C421: 0 | D421: 3 | E421: =C421*6+D421 -> 3 | G421: 3 | H421: 12 | I421: =G421*6+H421 -> 30 | K421: 4 | L421: 17 | M421: =K421*6+L421 -> 41 | O421: 5 | P421: 24 | Q421: =O421*6+P421 -> 54 | W421: BOX HILL | X421: 1 | Y421: 3 | Z421: 5 | AA421: 2 | AB421: 756 | AC421: 927 | AD421: =(AB421*100)/AC421 -> 81.553398058252426 | AE421: =(Y421*4)+(AA421*2) -> 16
A422: BEST PLAYERS | W422: WERRIBEE | X422: 1 | Y422: 4 | Z422: 6 | AA422: 0 | AB422: 720 | AC422: 944 | AD422: =(AB422*100)/AC422 -> 76.271186440677965 | AE422: =(Y422*4)+(AA422*2) -> 16
A423: WERRIBEE | C423: TURNER | F423: HOLCOMBE | I423: CARROLL | L423: R DOVE | N423: GOULOPOLOUS | Q423: SANDFORD | W423: CAULFIELD | X423: 1 | Y423: 2 | Z423: 8 | AA423: 0 | AB423: 727 | AC423: 981 | AD423: =(AB423*100)/AC423 -> 74.108053007135581 | AE423: =(Y423*4)+(AA423*2) -> 8
A424: CAMBERWELL | C424: K SMITH | F424: PEMBERTON | I424: ANDERSON | L424: DOUGLAS | N424: HAFEY | Q424: COCKREM | W424: CAMBERWELL | X424: 1 | Y424: 1 | Z424: 8 | AA424: 1 | AB424: 687 | AC424: 956 | AD424: =(AB424*100)/AC424 -> 71.861924686192467 | AE424: =(Y424*4)+(AA424*2) -> 6
A425: GOALKICKERS
A426: WERRIBEE | C426: HOLCOMBE 3 | F426: PANTE 3 | H426: EDWARDS | J426: R DOVE | L426: SANDFORD | N426: B SMITH
A427: CAMBERWELL | C427: K SMITH 2 | F427: ANDERSON 2 | I427: COCKREM
E428: 20TH JUNE | I428: WEATHER
A429: NORTHCOTE | C429: 4 | D429: 3 | E429: =C429*6+D429 -> 27 | G429: 5 | H429: 10 | I429: =G429*6+H429 -> 40 | K429: 9 | L429: 15 | M429: =K429*6+L429 -> 69 | O429: 12 | P429: 20 | Q429: =O429*6+P429 -> 92 | S429: NORTHCOTE
A430: CAULFIELD | C430: 3 | D430: 0 | E430: =C430*6+D430 -> 18 | G430: 5 | H430: 2 | I430: =G430*6+H430 -> 32 | K430: 9 | L430: 5 | M430: =K430*6+L430 -> 59 | O430: 9 | P430: 7 | Q430: =O430*6+P430 -> 61
A431: BEST PLAYERS
A432: NORTHCOTE | C432: McBREEN | F432: GRYBAS | I432: HAAG | L432: CRAMERI | N432: SIMPSON | Q432: BEYNON
A433: CAULFIELD | C433: JONES | F433: EVANS | I433: BAKER | L433: DE BOND | N433: PICKERING | Q433: DOUGLAS
A434: GOALKICKERS
A435: NORTHCOTE | C435: HAAG 4 | F435: MCBREEN 4 | I435: BAILEY | K435: SLEEP | M435: GRYBAS | O435: WILSON
A436: CAULFIELD | C436: BAKER 3 | F436: J MOORE | I436: DOUGLAS | K436: EVANS | M436: PALLIN | O436: SIMMONS | Q436: ROWE
A438: PRESTON | C438: 2 | D438: 6 | E438: =C438*6+D438 -> 18 | G438: 5 | H438: 8 | I438: =G438*6+H438 -> 38 | K438: 9 | L438: 11 | M438: =K438*6+L438 -> 65 | O438: 12 | P438: 15 | Q438: =O438*6+P438 -> 87 | S438: SUNSHINE
A439: SUNSHINE | C439: 4 | D439: 2 | E439: =C439*6+D439 -> 26 | G439: 5 | H439: 8 | I439: =G439*6+H439 -> 38 | K439: 7 | L439: 14 | M439: =K439*6+L439 -> 56 | O439: 8 | P439: 17 | Q439: =O439*6+P439 -> 65
A440: BEST PLAYERS
A441: PRESTON | C441: McARTHUR | F441: MURNANE | I441: WATSON | L441: CAMERON | N441: DELLAMARTA | Q441: WALKER
A442: SUNSHINE | C442: SLATTERY | F442: HOWARD | I442: DARUL | L442: CROSBIE | N442: WAPLING | Q442: YOUNG
A443: GOALKICKERS
A444: PRESTON | C444: WALKER 6 | F444: DELLAMARTA 2 | J444: McARTHUR | M444: TRELOAR | O444: MUIR | Q444: JENKINS
A445: SUNSHINE | C445: SLATTERY 3 | F445: CROSBIE 3 | I445: HOWARD | L445: WAPLING
A447: BYE | C447: PRAHRAN
A449: ROUND 12 | E449: 26TH JUNE | I449: WEATHER | S449: PLAYED AT
D450: 1ST QTR | H450: 2ND QTR | L450: 3RD QTR | P450: FINAL | S450: PRINCES PARK, CAULFIELD
A451: CAULFIELD | C451: 5 | D451: 2 | E451: =C451*6+D451 -> 32 | G451: 9 | H451: 6 | I451: =G451*6+H451 -> 60 | K451: 10 | L451: 9 | M451: =K451*6+L451 -> 69 | O451: 15 | P451: 15 | Q451: =O451*6+P451 -> 105 | S451: UMPIRE | Y451: LADDER | AC451: ROUND | AE451: 12
A452: WERRIBEE | C452: 8 | D452: 4 | E452: =C452*6+D452 -> 52 | G452: 12 | H452: 7 | I452: =G452*6+H452 -> 79 | K452: 13 | L452: 11 | M452: =K452*6+L452 -> 89 | O452: 15 | P452: 15 | Q452: =O452*6+P452 -> 105
A453: BEST PLAYERS | W453: TEAM | X453: B | Y453: W | Z453: L | AA453: D | AB453: FOR | AC453: AGST | AD453: % | AE453: PTS
A454: CAULFIELD | C454: DOUGLAS | F454: DE BOND | I454: ROWE | L454: CROSHER | O454: STONE | Q454: PICKERING
A455: WERRIBEE | C455: HOLCOMBE | F455: SANDFORD | I455: CARROLL | L455: BRYAN | O455: RILEY | Q455: PANTE | W455: MORDIALLOC | X455: 2 | Y455: 8 | Z455: 2 | AA455: 0 | AB455: 1056 | AC455: 677 | AD455: =(AB455*100)/AC455 -> 155.98227474150664 | AE455: =(Y455*4)+(AA455*2) -> 32
A456: GOALKICKERS | N456: GRAY | P456: SQUIRE | W456: NORTHCOTE | X456: 1 | Y456: 8 | Z456: 3 | AA456: 0 | AB456: 837 | AC456: 804 | AD456: =(AB456*100)/AC456 -> 104.1044776119403 | AE456: =(Y456*4)+(AA456*2) -> 32
A457: CAULFIELD | C457: DOUGLAS 3 | E457: ROWE 2 | G457: PALLIN 2 | I457: ARRELL | K457: NICHOLLS | M457: STONE | O457: DUNN | Q457: BAKER | S457: CROSHER | W457: PRESTON | X457: 2 | Y457: 7 | Z457: 3 | AA457: 0 | AB457: 1126 | AC457: 595 | AD457: =(AB457*100)/AC457 -> 189.24369747899161 | AE457: =(Y457*4)+(AA457*2) -> 28
A458: WERRIBEE | C458: BRYAN 3 | E458: PANTE 2 | G458: McGREGOR 2 | J458: SMITH 2 | L458: RILEY 2 | N458: HOLCOMBE | Q458: SANDFORD | T458: TRAINION | W458: SUNSHINE | X458: 1 | Y458: 6 | Z458: 5 | AA458: 0 | AB458: 957 | AC458: 924 | AD458: =(AB458*100)/AC458 -> 103.57142857142857 | AE458: =(Y458*4)+(AA458*2) -> 24
M459: GOULOPOLOUS
A460: PRAHRAN | C460: 6 | D460: 3 | E460: =C460*6+D460 -> 39 | G460: 14 | H460: 4 | I460: =G460*6+H460 -> 88 | K460: 18 | L460: 7 | M460: =K460*6+L460 -> 115 | O460: 21 | P460: 13 | Q460: =O460*6+P460 -> 139 | S460: BOX HILL | W460: PRAHRAN | X460: 2 | Y460: 5 | Z460: 4 | AA460: 1 | AB460: 942 | AC460: 885 | AD460: =(AB460*100)/AC460 -> 106.44067796610169 | AE460: =(Y460*4)+(AA460*2) -> 22
A461: BOX HILL | C461: 2 | D461: 0 | E461: =C461*6+D461 -> 12 | G461: 6 | H461: 1 | I461: =G461*6+H461 -> 37 | K461: 9 | L461: 2 | M461: =K461*6+L461 -> 56 | O461: 11 | P461: 4 | Q461: =O461*6+P461 -> 70 | W461: WERRIBEE | X461: 1 | Y461: 4 | Z461: 6 | AA461: 1 | AB461: 825 | AC461: 1049 | AD461: =(AB461*100)/AC461 -> 78.646329837940897 | AE461: =(Y461*4)+(AA461*2) -> 18
A462: BEST PLAYERS | W462: BOX HILL | X462: 1 | Y462: 3 | Z462: 6 | AA462: 2 | AB462: 826 | AC462: 1066 | AD462: =(AB462*100)/AC462 -> 77.485928705440898 | AE462: =(Y462*4)+(AA462*2) -> 16
A463: PRAHRAN | C463: BUTLER | F463: COOPER | I463: RYAN | L463: VERWOERT | O463: MOONEY | R463: SHEEDY | W463: CAULFIELD | X463: 1 | Y463: 2 | Z463: 8 | AA463: 1 | AB463: 832 | AC463: 1086 | AD463: =(AB463*100)/AC463 -> 76.61141804788214 | AE463: =(Y463*4)+(AA463*2) -> 10
A464: BOX HILL | C464: I BATES | F464: HOBBS | I464: FELLOWS | L464: HARRIS | O464: MACE | R464: BAYES | W464: CAMBERWELL | X464: 1 | Y464: 2 | Z464: 8 | AA464: 1 | AB464: 773 | AC464: 1037 | AD464: =(AB464*100)/AC464 -> 74.541947926711671 | AE464: =(Y464*4)+(AA464*2) -> 10
A465: GOALKICKERS
A466: PRAHRAN | C466: RYAN 7 | E466: COOPER 4 | G466: BUTLER 3 | I466: SHEEDY 2 | K466: DORAN 2 | M466: CORRIGAN | P466: VERWOERT | S466: MOONEY
A467: BOX HILL | C467: MACE 4 | E467: HOBBS 3 | G467: LA ROCHE | J467: BAYES | L467: McCURRY | O467: HARRIS
E468: 27TH JUNE | I468: WEATHER
A469: NORTHCOTE | C469: 3 | D469: 3 | E469: =C469*6+D469 -> 21 | G469: 4 | H469: 4 | I469: =G469*6+H469 -> 28 | K469: 11 | L469: 10 | M469: =K469*6+L469 -> 76 | O469: 15 | P469: 11 | Q469: =O469*6+P469 -> 101 | S469: PRESTON
A470: PRESTON | C470: 1 | D470: 1 | E470: =C470*6+D470 -> 7 | G470: 7 | H470: 4 | I470: =G470*6+H470 -> 46 | K470: 9 | L470: 4 | M470: =K470*6+L470 -> 58 | O470: 11 | P470: 8 | Q470: =O470*6+P470 -> 74
A471: BEST PLAYERS
A472: NORTHCOTE | C472: SLEEP | F472: SIMPSON | I472: CRAMERI | L472: OGILVIE | O472: BRUSH | R472: GRYBAS
A473: PRESTON | C473: DIXON | F473: WADDELL | I473: JENKINS | L473: MURNANE | O473: WALKER | R473: HUBBARD
A474: GOALKICKERS
A475: NORTHCOTE | C475: SLEEP 4 | E475: HAAG 3 | G475: GRYBAS 2 | I475: KEANE 2 | K475: LACHMUND 2 | N475: BRADY | P475: HENRY
A476: PRESTON | C476: WALKER 7 | F476: MUIR 2 | I476: WADDELL | L476: ALLEMAND
A478: CAMBERWELL | C478: 3 | D478: 6 | E478: =C478*6+D478 -> 24 | G478: 4 | H478: 9 | I478: =G478*6+H478 -> 33 | K478: 8 | L478: 11 | M478: =K478*6+L478 -> 59 | O478: 12 | P478: 14 | Q478: =O478*6+P478 -> 86 | S478: SUNSHINE
A479: SUNSHINE | C479: 3 | D479: 2 | E479: =C479*6+D479 -> 20 | G479: 6 | H479: 6 | I479: =G479*6+H479 -> 42 | K479: 9 | L479: 12 | M479: =K479*6+L479 -> 66 | O479: 11 | P479: 15 | Q479: =O479*6+P479 -> 81
A480: BEST PLAYERS
A481: CAMBERWELL | C481: K SMITH | F481: GAUDION | I481: DOUGLAS | L481: MACKIE | O481: PEMBERTON | R481: PECK
A482: SUNSHINE | C482: GREGORY | F482: THORNTON | I482: DARUL | L482: CROSBIE | O482: TRUSLER | R482: WROBLESKI
A483: GOALKICKERS
A484: CAMBERWELL | C484: PECK 5 | E484: K SMITH 2 | H484: ANDERSON | K484: McNAMARA | N484: HAFEY | P484: ADAMS | R484: KISS
A485: SUNSHINE | C485: CROSBIE 3 | F485: SLATTERY 3 | I485: LEGAWIECZ 3 | L485: TRUSLER | N485: GREGORY
A487: BYE | C487: MORDIALLOC
A489: ROUND 13 | E489: 3RD JULY | I489: WEATHER | S489: PLAYED AT
D490: 1ST QTR | H490: 2ND QTR | L490: 3RD QTR | P490: FINAL | S490: CAMBERWELL
A491: CAMBERWELL | C491: 7 | D491: 5 | E491: =C491*6+D491 -> 47 | G491: 8 | H491: 5 | I491: =G491*6+H491 -> 53 | K491: 14 | L491: 15 | M491: =K491*6+L491 -> 99 | O491: 17 | P491: 17 | Q491: =O491*6+P491 -> 119 | S491: UMPIRE | Y491: LADDER | AC491: ROUND | AE491: 13
A492: CAULFIELD | C492: 3 | D492: 1 | E492: =C492*6+D492 -> 19 | G492: 5 | H492: 5 | I492: =G492*6+H492 -> 35 | K492: 5 | L492: 6 | M492: =K492*6+L492 -> 36 | O492: 11 | P492: 10 | Q492: =O492*6+P492 -> 76
A493: BEST PLAYERS | W493: TEAM | X493: B | Y493: W | Z493: L | AA493: D | AB493: FOR | AC493: AGST | AD493: % | AE493: PTS
A494: CAMBERWELL | C494: K SMITH | F494: BOYD | I494: PEMBERTON | L494: FRIEBERG | O494: GAUDION | R494: J SMITH
A495: CAULFIELD | C495: GILBERT | F495: STONE | I495: PICKERING | L495: HUNT | O495: NICHOLLS | R495: DUNN | W495: PRESTON | X495: 2 | Y495: 8 | Z495: 3 | AA495: 0 | AB495: 1243 | AC495: 659 | AD495: =(AB495*100)/AC495 -> 188.61911987860395 | AE495: =(Y495*4)+(AA495*2) -> 32
A496: GOALKICKERS | W496: MORDIALLOC | X496: 2 | Y496: 8 | Z496: 3 | AA496: 0 | AB496: 1153 | AC496: 779 | AD496: =(AB496*100)/AC496 -> 148.01026957637998 | AE496: =(Y496*4)+(AA496*2) -> 32
A497: CAMBERWELL | C497: K SMITH 6 | F497: BOYD 3 | H497: PECK 2 | J497: COCKREM 2 | M497: ANDERSON 2 | P497: J SMITH | R497: PEMBERTON | W497: NORTHCOTE | X497: 2 | Y497: 8 | Z497: 3 | AA497: 0 | AB497: 837 | AC497: 804 | AD497: =(AB497*100)/AC497 -> 104.1044776119403 | AE497: =(Y497*4)+(AA497*2) -> 32
A498: CAULFIELD | C498: GASPARI 4 | F498: PALLIN 2 | I498: DOUGLAS | L498: GRAY | N498: NICHOLLS | Q498: STONE | S498: SIMMONS | W498: SUNSHINE | X498: 1 | Y498: 7 | Z498: 5 | AA498: 0 | AB498: 1059 | AC498: 1021 | AD498: =(AB498*100)/AC498 -> 103.72184133202742 | AE498: =(Y498*4)+(AA498*2) -> 28
A500: BOX HILL | C500: 3 | D500: 2 | E500: =C500*6+D500 -> 20 | G500: 5 | H500: 9 | I500: =G500*6+H500 -> 39 | K500: 7 | L500: 15 | M500: =K500*6+L500 -> 57 | O500: 10 | P500: 17 | Q500: =O500*6+P500 -> 77 | S500: WERRIBEE | W500: PRAHRAN | X500: 2 | Y500: 5 | Z500: 5 | AA500: 1 | AB500: 1006 | AC500: 1002 | AD500: =(AB500*100)/AC500 -> 100.39920159680639 | AE500: =(Y500*4)+(AA500*2) -> 22
A501: WERRIBEE | C501: 3 | D501: 6 | E501: =C501*6+D501 -> 24 | G501: 5 | H501: 8 | I501: =G501*6+H501 -> 38 | K501: 6 | L501: 11 | M501: =K501*6+L501 -> 47 | O501: 9 | P501: 14 | Q501: =O501*6+P501 -> 68 | W501: BOX HILL | X501: 1 | Y501: 4 | Z501: 6 | AA501: 2 | AB501: 903 | AC501: 1134 | AD501: =(AB501*100)/AC501 -> 79.629629629629633 | AE501: =(Y501*4)+(AA501*2) -> 20
A502: BEST PLAYERS | W502: WERRIBEE | X502: 1 | Y502: 4 | Z502: 7 | AA502: 1 | AB502: 893 | AC502: 1126 | AD502: =(AB502*100)/AC502 -> 79.307282415630553 | AE502: =(Y502*4)+(AA502*2) -> 18
A503: BOX HILL | C503: SALMON | F503: LA ROCHE | I503: DUURSMA | L503: WHITE | O503: HARRIS | R503: HOBBS | W503: CAMBERWELL | X503: 1 | Y503: 3 | Z503: 8 | AA503: 1 | AB503: 892 | AC503: 1113 | AD503: =(AB503*100)/AC503 -> 80.143755615453728 | AE503: =(Y503*4)+(AA503*2) -> 14
A504: WERRIBEE | C504: CARROLL | F504: SANDFORD | I504: GOULOPOLOUS | L504: TURNER | O504: EDWARDS | R504: STEINBERG | W504: CAULFIELD | X504: 1 | Y504: 2 | Z504: 9 | AA504: 1 | AB504: 908 | AC504: 1205 | AD504: =(AB504*100)/AC504 -> 75.352697095435687 | AE504: =(Y504*4)+(AA504*2) -> 10
A505: GOALKICKERS
A506: BOX HILL | C506: SNELL 2 | E506: I BATES 2 | G506: HOBBS | I506: MILLER | K506: DUURSMA | N506: MACE | P506: GRAY | R506: WHITE
A507: WERRIBEE | C507: SANDFORD 3 | F507: PANTE 2 | I507: EDWARDS | L507: SMITH | N507: RILEY | P507: McGREGOR
E508: 4TH JULY | I508: WEATHER
A509: PRESTON | C509: 6 | D509: 7 | E509: =C509*6+D509 -> 43 | G509: 7 | H509: 10 | I509: =G509*6+H509 -> 52 | K509: 12 | L509: 15 | M509: =K509*6+L509 -> 87 | O509: 17 | P509: 15 | Q509: =O509*6+P509 -> 117 | S509: TOORAK PARK
A510: PRAHRAN | C510: 2 | D510: 1 | E510: =C510*6+D510 -> 13 | G510: 3 | H510: 4 | I510: =G510*6+H510 -> 22 | K510: 4 | L510: 8 | M510: =K510*6+L510 -> 32 | O510: 9 | P510: 10 | Q510: =O510*6+P510 -> 64
A511: BEST PLAYERS
A512: PRESTON | C512: CAMERON | F512: MURNANE | I512: McARTHUR | L512: CULPH | O512: TRELOAR | R512: WALKER
A513: PRAHRAN | C513: WISHART | F513: BUTLER | I513: RYAN | L513: RICHARDSON | O513: GRAY | R513: MOONEY
A514: GOALKICKERS
A515: PRESTON | C515: WALKER 5 | F515: McARTHUR 2 | I515: WADDELL 2 | L515: CULPH 2 | N515: TRELOAR | Q515: APPLEFORD | T515: STEWART | W515: DELLAMARTA
A516: PRAHRAN | C516: RYAN 4 | F516: BUTLER 2 | I516: COOPER | K516: RICHARDSON | N516: MOONEY
A518: SUNSHINE | C518: 2 | D518: 4 | E518: =C518*6+D518 -> 16 | G518: 5 | H518: 12 | I518: =G518*6+H518 -> 42 | K518: 9 | L518: 15 | M518: =K518*6+L518 -> 69 | O518: 14 | P518: 18 | Q518: =O518*6+P518 -> 102 | S518: MORDIALLOC
A519: MORDIALLOC | C519: 1 | D519: 0 | E519: =C519*6+D519 -> 6 | G519: 3 | H519: 4 | I519: =G519*6+H519 -> 22 | K519: 9 | L519: 9 | M519: =K519*6+L519 -> 63 | O519: 14 | P519: 13 | Q519: =O519*6+P519 -> 97
A520: BEST PLAYERS
A521: SUNSHINE | C521: CROSBIE | F521: SLATTERY | I521: FITZGERALD | L521: WROBLEWSKI | O521: THORNTON | R521: TREZISE
A522: MORDIALLOC | C522: GROVES | F522: HOBSON | I522: BAXTER | L522: HYNES | O522: O'BRIEN | R522: DANCKERT
A523: GOALKICKERS
A524: SUNSHINE | C524: HARRIS 3 | E524: FITZGERALD 2 | H524: HOWARD 2 | J524: WAPLING 2 | M524: BROWN 2 | O524: TREZISE | Q524: GREGORY | T524: TRUSLER
A525: MORDIALLOC | C525: BAXTER 4 | F525: HYNES 3 | I525: POWER 2 | K525: O'BRIEN 2 | M525: BRADLEY | O525: LESLIE | Q525: ROSENBROCK
A527: BYE | C527: NORTHCOTE
A529: ROUND 14 | E529: 10TH JULY | I529: WEATHER | S529: PLAYED AT
D530: 1ST QTR | H530: 2ND QTR | L530: 3RD QTR | P530: FINAL | S530: CAMBERWELL
A531: MORDIALLOC | C531: 1 | D531: 3 | E531: =C531*6+D531 -> 9 | G531: 7 | H531: 9 | I531: =G531*6+H531 -> 51 | K531: 11 | L531: 13 | M531: =K531*6+L531 -> 79 | O531: 15 | P531: 20 | Q531: =O531*6+P531 -> 110 | S531: UMPIRE | Y531: LADDER | AC531: ROUND | AE531: 14
A532: CAMBERWELL | C532: 3 | D532: 5 | E532: =C532*6+D532 -> 23 | G532: 4 | H532: 6 | I532: =G532*6+H532 -> 30 | K532: 7 | L532: 12 | M532: =K532*6+L532 -> 54 | O532: 10 | P532: 13 | Q532: =O532*6+P532 -> 73
A533: BEST PLAYERS | W533: TEAM | X533: B | Y533: W | Z533: L | AA533: D | AB533: FOR | AC533: AGST | AD533: % | AE533: PTS
A534: MORDIALLOC | C534: HYNES | F534: DANCKERT | I534: O'BRIEN | L534: BAXTER | O534: BRADBURY | R534: POWER
A535: CAMBERWELL | C535: PEMBERTON | F535: K SMITH | I535: MACKIE | L535: COCKREM | O535: GAUDION | R535: KISS | W535: PRESTON | X535: 2 | Y535: 9 | Z535: 3 | AA535: 0 | AB535: 1406 | AC535: 708 | AD535: =(AB535*100)/AC535 -> 198.58757062146893 | AE535: =(Y535*4)+(AA535*2) -> 36
A536: GOALKICKERS | W536: MORDIALLOC | X536: 2 | Y536: 9 | Z536: 3 | AA536: 0 | AB536: 1263 | AC536: 852 | AD536: =(AB536*100)/AC536 -> 148.2394366197183 | AE536: =(Y536*4)+(AA536*2) -> 36
A537: MORDIALLOC | C537: HYNES 4 | F537: POWER 3 | I537: LAIRD 2 | K537: LESLIE 2 | M537: BAXTER 2 | O537: O'BRIEN | Q537: FULLER | W537: SUNSHINE | X537: 1 | Y537: 8 | Z537: 5 | AA537: 0 | AB537: 1177 | AC537: 1075 | AD537: =(AB537*100)/AC537 -> 109.48837209302326 | AE537: =(Y537*4)+(AA537*2) -> 32
A538: CAMBERWELL | C538: HAFEY 3 | F538: K GIBSON 3 | I538: PECK 2 | K538: J SMITH | M538: GIBSON | W538: NORTHCOTE | X538: 2 | Y538: 8 | Z538: 4 | AA538: 0 | AB538: 891 | AC538: 922 | AD538: =(AB538*100)/AC538 -> 96.637744034707154 | AE538: =(Y538*4)+(AA538*2) -> 32
A540: PRAHRAN | C540: 6 | D540: 5 | E540: =C540*6+D540 -> 41 | G540: 11 | H540: 9 | I540: =G540*6+H540 -> 75 | K540: 13 | L540: 11 | M540: =K540*6+L540 -> 89 | O540: 19 | P540: 15 | Q540: =O540*6+P540 -> 129 | S540: TOORAK PARK | W540: PRAHRAN | X540: 2 | Y540: 6 | Z540: 5 | AA540: 1 | AB540: 1135 | AC540: 1084 | AD540: =(AB540*100)/AC540 -> 104.70479704797047 | AE540: =(Y540*4)+(AA540*2) -> 26
A541: WERRIBEE | C541: 1 | D541: 5 | E541: =C541*6+D541 -> 11 | G541: 4 | H541: 8 | I541: =G541*6+H541 -> 32 | K541: 8 | L541: 12 | M541: =K541*6+L541 -> 60 | O541: 11 | P541: 16 | Q541: =O541*6+P541 -> 82 | W541: BOX HILL | X541: 2 | Y541: 4 | Z541: 6 | AA541: 2 | AB541: 903 | AC541: 1134 | AD541: =(AB541*100)/AC541 -> 79.629629629629633 | AE541: =(Y541*4)+(AA541*2) -> 20
A542: BEST PLAYERS | W542: WERRIBEE | X542: 1 | Y542: 4 | Z542: 8 | AA542: 1 | AB542: 975 | AC542: 1255 | AD542: =(AB542*100)/AC542 -> 77.689243027888452 | AE542: =(Y542*4)+(AA542*2) -> 18
A543: PRAHRAN | C543: RYAN | F543: SYMONS | I543: SHEEDY | L543: BUTLER | O543: JULIER | Q543: VERWOERT | W543: CAMBERWELL | X543: 1 | Y543: 3 | Z543: 9 | AA543: 1 | AB543: 965 | AC543: 1223 | AD543: =(AB543*100)/AC543 -> 78.90433360588716 | AE543: =(Y543*4)+(AA543*2) -> 14
A544: WERRIBEE | C544: SANDFORD | F544: PANTE | I544: CARROLL | L544: HOLCOMBE | O544: CARSS | Q544: TURNER | W544: CAULFIELD | X544: 1 | Y544: 2 | Z544: 10 | AA544: 1 | AB544: 957 | AC544: 1368 | AD544: =(AB544*100)/AC544 -> 69.956140350877192 | AE544: =(Y544*4)+(AA544*2) -> 10
A545: GOALKICKERS
A546: PRAHRAN | C546: RYAN 9 | F546: BUTLER 3 | I546: SYMONS 2 | L546: COOPER | N546: VERWOERT | Q546: RICHARDSON | T546: GLOVER | V546: WISHART
A547: WERRIBEE | C547: PANTE 5 | F547: SMITH 2 | I547: CARSS 2 | K547: HOLCOMBE | N547: BRYAN
E548: 11TH JULY | I548: WEATHER
A549: SUNSHINE | C549: 3 | D549: 2 | E549: =C549*6+D549 -> 20 | G549: 7 | H549: 6 | I549: =G549*6+H549 -> 48 | K549: 12 | L549: 10 | M549: =K549*6+L549 -> 82 | O549: 18 | P549: 10 | Q549: =O549*6+P549 -> 118 | S549: SUNSHINE
A550: NORTHCOTE | C550: 2 | D550: 1 | E550: =C550*6+D550 -> 13 | G550: 2 | H550: 6 | I550: =G550*6+H550 -> 18 | K550: 5 | L550: 13 | M550: =K550*6+L550 -> 43 | O550: 6 | P550: 18 | Q550: =O550*6+P550 -> 54
A551: BEST PLAYERS
A552: SUNSHINE | C552: SLATTERY | F552: DARUL | I552: THORNTON | L552: CROSBIE | O552: WAPLING | R552: WROBLEWSKI
A553: NORTHCOTE | C553: GRYBAS | F553: DUNCAN | I553: CRAMERI | L553: BRUSH | O553: T KEAYS | R553: McBREEN
A554: GOALKICKERS
A555: SUNSHINE | C555: TREZISE 3 | E555: BROWN 3 | G555: WAPLING 3 | I555: HARRIS 3 | K555: FITZGERALD 2 | N555: HOWARD | Q555: CROSBIE | S555: GREGORY | V555: SLATTERY
A556: NORTHCOTE | C556: BRADY | E556: GRYBAS | G556: HAAG | I556: LACHMUND | L556: SLEEP | N556: WASTELL
A558: PRESTON | C558: 4 | D558: 4 | E558: =C558*6+D558 -> 28 | G558: 11 | H558: 13 | I558: =G558*6+H558 -> 79 | K558: 19 | L558: 17 | M558: =K558*6+L558 -> 131 | O558: 24 | P558: 19 | Q558: =O558*6+P558 -> 163 | S558: PRESTON
A559: CAULFIELD | C559: 3 | D559: 3 | E559: =C559*6+D559 -> 21 | G559: 3 | H559: 4 | I559: =G559*6+H559 -> 22 | K559: 5 | L559: 6 | M559: =K559*6+L559 -> 36 | O559: 7 | P559: 7 | Q559: =O559*6+P559 -> 49
A560: BEST PLAYERS
A561: PRESTON | C561: DIXON | F561: HYDE | I561: MURNANE | L561: WALKER | O561: HUBBARD | R561: JENKINS
A562: CAULFIELD | C562: DE BOND | F562: BAKER | I562: NICHOLLS | L562: STONE | O562: FOX | R562: ROWE
A563: GOALKICKERS
A564: PRESTON | C564: WALKER 12 | F564: MURNANE 4 | I564: McARTHUR 2 | L564: WADDELL 2 | N564: CAMERON | Q564: STEWART | T564: PETERSON | W564: CULPH
A565: CAULFIELD | C565: NICHOLLS 2 | F565: BAKER 2 | I565: GASPARI | L565: DUNN | N565: SQUIRES
A567: BYE | C567: BOX HILL
A569: ROUND 15 | E569: 24TH JULY | I569: WEATHER | S569: PLAYED AT
D570: 1ST QTR | H570: 2ND QTR | L570: 3RD QTR | P570: FINAL | S570: NORTHCOTE
A571: NORTHCOTE | C571: 1 | D571: 1 | E571: =C571*6+D571 -> 7 | G571: 3 | H571: 9 | I571: =G571*6+H571 -> 27 | K571: 9 | L571: 14 | M571: =K571*6+L571 -> 68 | O571: 12 | P571: 18 | Q571: =O571*6+P571 -> 90 | S571: UMPIRE | Y571: LADDER | AC571: ROUND | AE571: 15
A572: CAMBERWELL | C572: 4 | D572: 3 | E572: =C572*6+D572 -> 27 | G572: 5 | H572: 3 | I572: =G572*6+H572 -> 33 | K572: 6 | L572: 4 | M572: =K572*6+L572 -> 40 | O572: 8 | P572: 7 | Q572: =O572*6+P572 -> 55
A573: BEST PLAYERS | W573: TEAM | X573: B | Y573: W | Z573: L | AA573: D | AB573: FOR | AC573: AGST | AD573: % | AE573: PTS
A574: NORTHCOTE | C574: BRUSH | F574: CRAMERI | I574: T KEAYS | L574: SIMPSON | O574: McBREEN | R574: BRADY
A575: CAMBERWELL | C575: MACKIE | F575: ALLEMAND | I575: FRIEBERG | L575: HAFEY | O575: COCKREM | R575: DOUGLAS | W575: PRESTON | X575: 2 | Y575: 10 | Z575: 3 | AA575: 0 | AB575: 1528 | AC575: 756 | AD575: =(AB575*100)/AC575 -> 202.11640211640213 | AE575: =(Y575*4)+(AA575*2) -> 40
A576: GOALKICKERS | C576: 2 SHORT | W576: MORDIALLOC | X576: 2 | Y576: 9 | Z576: 4 | AA576: 0 | AB576: 1342 | AC576: 938 | AD576: =(AB576*100)/AC576 -> 143.07036247334756 | AE576: =(Y576*4)+(AA576*2) -> 36
A577: NORTHCOTE | C577: HAAG 4 | F577: CRAMERI 2 | I577: GRYBAS 2 | L577: LANGBORNE | O577: KEANE | W577: NORTHCOTE | X577: 2 | Y577: 9 | Z577: 4 | AA577: 0 | AB577: 981 | AC577: 977 | AD577: =(AB577*100)/AC577 -> 100.40941658137154 | AE577: =(Y577*4)+(AA577*2) -> 36
A578: CAMBERWELL | C578: J SMITH 2 | F578: PECK 2 | I578: HAFEY 2 | L578: D BOYD | N578: K SMITH | W578: SUNSHINE | X578: 2 | Y578: 8 | Z578: 5 | AA578: 0 | AB578: 1177 | AC578: 1075 | AD578: =(AB578*100)/AC578 -> 109.48837209302326 | AE578: =(Y578*4)+(AA578*2) -> 32
A580: PRAHRAN | C580: 6 | D580: 3 | E580: =C580*6+D580 -> 39 | G580: 7 | H580: 8 | I580: =G580*6+H580 -> 50 | K580: 8 | L580: 10 | M580: =K580*6+L580 -> 58 | O580: 9 | P580: 11 | Q580: =O580*6+P580 -> 65 | S580: PRINCES PARK, CAULFIELD | W580: PRAHRAN | X580: 2 | Y580: 7 | Z580: 5 | AA580: 1 | AB580: 1200 | AC580: 1133 | AD580: =(AB580*100)/AC580 -> 105.9135039717564 | AE580: =(Y580*4)+(AA580*2) -> 30
A581: CAULFIELD | C581: 1 | D581: 0 | E581: =C581*6+D581 -> 6 | G581: 3 | H581: 1 | I581: =G581*6+H581 -> 19 | K581: 3 | L581: 1 | M581: =K581*6+L581 -> 19 | O581: 7 | P581: 7 | Q581: =O581*6+P581 -> 49 | W581: WERRIBEE | X581: 1 | Y581: 5 | Z581: 8 | AA581: 1 | AB581: 1061 | AC581: 1334 | AD581: =(AB581*100)/AC581 -> 79.535232383808093 | AE581: =(Y581*4)+(AA581*2) -> 22
A582: BEST PLAYERS | W582: BOX HILL | X582: 2 | Y582: 4 | Z582: 7 | AA582: 2 | AB582: 951 | AC582: 1256 | AD582: =(AB582*100)/AC582 -> 75.716560509554142 | AE582: =(Y582*4)+(AA582*2) -> 20
A583: PRAHRAN | C583: VERWOERT | F583: KIRBY | I583: HARTNETT | L583: RYAN | O583: SHEEDY | R583: GLOVER | W583: CAMBERWELL | X583: 1 | Y583: 3 | Z583: 10 | AA583: 1 | AB583: 1020 | AC583: 1313 | AD583: =(AB583*100)/AC583 -> 77.684691546077687 | AE583: =(Y583*4)+(AA583*2) -> 14
A584: CAULFIELD | C584: DE BOND | F584: BAKER | I584: SIMMONS | L584: GASPARI | O584: SUTHERLAND | R584: JONES | W584: CAULFIELD | X584: 1 | Y584: 2 | Z584: 11 | AA584: 1 | AB584: 1006 | AC584: 1433 | AD584: =(AB584*100)/AC584 -> 70.202372644801116 | AE584: =(Y584*4)+(AA584*2) -> 10
A585: GOALKICKERS
A586: PRAHRAN | C586: SHEEDY 2 | F586: VERWOERT 2 | I586: RYAN 2 | K586: BUTLER | M586: KIRBY | O586: SYMONS
A587: CAULFIELD | C587: SIMMONS 3 | F587: GASPARI 2 | I587: DOUGLAS | K587: DUNN
A589: PRESTON | C589: 1 | D589: 6 | E589: =C589*6+D589 -> 12 | G589: 9 | H589: 8 | I589: =G589*6+H589 -> 62 | K589: 15 | L589: 12 | M589: =K589*6+L589 -> 102 | O589: 18 | P589: 14 | Q589: =O589*6+P589 -> 122 | S589: PRESTON
A590: BOX HILL | C590: 2 | D590: 1 | E590: =C590*6+D590 -> 13 | G590: 4 | H590: 4 | I590: =G590*6+H590 -> 28 | K590: 5 | L590: 4 | M590: =K590*6+L590 -> 34 | O590: 7 | P590: 6 | Q590: =O590*6+P590 -> 48
A591: BEST PLAYERS
A592: PRESTON | C592: DIXON | F592: ALEXANDER | I592: MURNANE | L592: PETERSON | O592: JENKINS | Q592: WALKER
A593: BOX HILL | C593: HARRIS | F593: WHITE | I593: SALMON | L593: MACE | O593: FELLOWS
A594: GOALKICKERS
A595: PRESTON | C595: WALKER 7 | F595: PETERSON 5 | I595: ALEXANDER 3 | L595: JENKINS 2 | O595: CULPH
A596: BOX HILL | C596: LA ROCHE 2 | F596: MACE | H596: LOOMES | J596: WHITE | L596: HOBBS | N596: I BATES
A598: WERRIBEE | C598: 1 | D598: 3 | E598: =C598*6+D598 -> 9 | G598: 5 | H598: 9 | I598: =G598*6+H598 -> 39 | K598: 7 | L598: 11 | M598: =K598*6+L598 -> 53 | O598: 12 | P598: 14 | Q598: =O598*6+P598 -> 86 | S598: WERRIBEE
A599: MORDIALLOC | C599: 4 | D599: 5 | E599: =C599*6+D599 -> 29 | G599: 7 | H599: 6 | I599: =G599*6+H599 -> 48 | K599: 9 | L599: 7 | M599: =K599*6+L599 -> 61 | O599: 12 | P599: 7 | Q599: =O599*6+P599 -> 79
A600: BEST PLAYERS
A601: WERRIBEE | C601: TURNER | F601: CARSS | I601: CARROLL | L601: SANDFORD | O601: TRAINION | R601: PANTE
A602: MORDIALLOC | C602: GROVES | F602: MORRISON | I602: DANCKERT | L602: BAXTER | O602: WILLIAMS | R602: HYNES
A603: GOALKICKERS
A604: WERRIBEE | C604: CARSS 5 | F604: HOLCOMBE 2 | I604: PANTE 2 | K604: McGREGOR 2 | N604: BRYAN
A605: MORDIALLOC | C605: HYNES 4 | F605: GROVES 2 | I605: O'BRIEN 2 | K605: BAXTER | M605: POWER | O605: BRADBURY | R605: LESLIE
A607: BYE | C607: SUNSHINE
A609: ROUND 16 | E609: 31ST JULY | I609: WEATHER | S609: PLAYED AT
D610: 1ST QTR | H610: 2ND QTR | L610: 3RD QTR | P610: FINAL | S610: PRINCES PARK, CAULFIELD
A611: BOX HILL | C611: 3 | D611: 0 | E611: =C611*6+D611 -> 18 | G611: 13 | H611: 9 | I611: =G611*6+H611 -> 87 | K611: 15 | L611: 11 | M611: =K611*6+L611 -> 101 | O611: 19 | P611: 16 | Q611: =O611*6+P611 -> 130 | S611: UMPIRE | Y611: LADDER | AC611: ROUND | AE611: 16
A612: CAULFIELD | C612: 5 | D612: 2 | E612: =C612*6+D612 -> 32 | G612: 5 | H612: 2 | I612: =G612*6+H612 -> 32 | K612: 8 | L612: 6 | M612: =K612*6+L612 -> 54 | O612: 9 | P612: 7 | Q612: =O612*6+P612 -> 61
A613: BEST PLAYERS | W613: TEAM | X613: B | Y613: W | Z613: L | AA613: D | AB613: FOR | AC613: AGST | AD613: % | AE613: PTS
A614: BOX HILL | C614: LEHMAN | F614: HARRIS | I614: BRYANT | L614: I BATES | O614: MACE | R614: GARDINER
A615: CAULFIELD | C615: DE BOND | F615: GRAY | I615: ROWE | L615: SUTHERLAND | O615: NICHOLLS | R615: BAKER | W615: PRESTON | X615: 2 | Y615: 11 | Z615: 3 | AA615: 0 | AB615: 1692 | AC615: 793 | AD615: =(AB615*100)/AC615 -> 213.3669609079445 | AE615: =(Y615*4)+(AA615*2) -> 44
A616: GOALKICKERS | W616: MORDIALLOC | X616: 2 | Y616: 10 | Z616: 4 | AA616: 0 | AB616: 1440 | AC616: 996 | AD616: =(AB616*100)/AC616 -> 144.57831325301206 | AE616: =(Y616*4)+(AA616*2) -> 40
A617: BOX HILL | C617: MACE 5 | E617: I BATES 3 | G617: LA ROCHE 3 | J617: BRYANT 3 | M617: LOOMES 2 | O617: DIXON | Q617: GRAY | S617: DUURSMA | W617: SUNSHINE | X617: 2 | Y617: 9 | Z617: 5 | AA617: 0 | AB617: 1288 | AC617: 1141 | AD617: =(AB617*100)/AC617 -> 112.88343558282209 | AE617: =(Y617*4)+(AA617*2) -> 36
A618: CAULFIELD | C618: SIMMONS 3 | F618: ROWE 2 | H618: SQUIRES | J618: GRAY | L618: STONE | N618: MELBOURNE | W618: NORTHCOTE | X618: 2 | Y618: 9 | Z618: 5 | AA618: 0 | AB618: 1039 | AC618: 1075 | AD618: =(AB618*100)/AC618 -> 96.651162790697668 | AE618: =(Y618*4)+(AA618*2) -> 36
E619: 1ST AUGUST | I619: WEATHER
A620: MORDIALLOC | C620: 2 | D620: 2 | E620: =C620*6+D620 -> 14 | G620: 5 | H620: 8 | I620: =G620*6+H620 -> 38 | K620: 8 | L620: 8 | M620: =K620*6+L620 -> 56 | O620: 14 | P620: 14 | Q620: =O620*6+P620 -> 98 | S620: MORDIALLOC | W620: PRAHRAN | X620: 2 | Y620: 7 | Z620: 6 | AA620: 1 | AB620: 1266 | AC620: 1244 | AD620: =(AB620*100)/AC620 -> 101.7684887459807 | AE620: =(Y620*4)+(AA620*2) -> 30
A621: NORTHCOTE | C621: 1 | D621: 2 | E621: =C621*6+D621 -> 8 | G621: 5 | H621: 7 | I621: =G621*6+H621 -> 37 | K621: 7 | L621: 10 | M621: =K621*6+L621 -> 52 | O621: 8 | P621: 10 | Q621: =O621*6+P621 -> 58 | W621: BOX HILL | X621: 2 | Y621: 5 | Z621: 7 | AA621: 2 | AB621: 1081 | AC621: 1317 | AD621: =(AB621*100)/AC621 -> 82.080485952923311 | AE621: =(Y621*4)+(AA621*2) -> 24
A622: BEST PLAYERS | W622: WERRIBEE | X622: 1 | Y622: 5 | Z622: 9 | AA622: 1 | AB622: 1098 | AC622: 1498 | AD622: =(AB622*100)/AC622 -> 73.297730307076108 | AE622: =(Y622*4)+(AA622*2) -> 22
A623: MORDIALLOC | C623: BAXTER | F623: HOBSON | I623: BLAINEY | L623: POWER | O623: BRADBURY | R623: LAIRD | W623: CAMBERWELL | X623: 2 | Y623: 3 | Z623: 10 | AA623: 1 | AB623: 1020 | AC623: 1313 | AD623: =(AB623*100)/AC623 -> 77.684691546077687 | AE623: =(Y623*4)+(AA623*2) -> 14
A624: NORTHCOTE | C624: CRAMERI | F624: SIMPSON | I624: BEYNON | L624: DEAN | O624: BISHOP | R624: OGILVIE | W624: CAULFIELD | X624: 1 | Y624: 2 | Z624: 12 | AA624: 1 | AB624: 1067 | AC624: 1563 | AD624: =(AB624*100)/AC624 -> 68.266154830454255 | AE624: =(Y624*4)+(AA624*2) -> 10
A625: GOALKICKERS
A626: MORDIALLOC | C626: POWER 5 | F626: BAXTER 5 | I626: LESLIE 2 | L626: BRADBURY | O626: LAIRD
A627: NORTHCOTE | C627: HAAG 2 | E627: CRAMERI | H627: BRADY | J627: GRYBAS | L627: OGILVIE | N627: GEMMELL | Q627: BISHOP
A629: PRESTON | C629: 9 | D629: 6 | E629: =C629*6+D629 -> 60 | G629: 13 | H629: 11 | I629: =G629*6+H629 -> 89 | K629: 18 | L629: 16 | M629: =K629*6+L629 -> 124 | O629: 24 | P629: 20 | Q629: =O629*6+P629 -> 164 | S629: PRESTON
A630: WERRIBEE | C630: 0 | D630: 3 | E630: =C630*6+D630 -> 3 | G630: 1 | H630: 3 | I630: =G630*6+H630 -> 9 | K630: 2 | L630: 3 | M630: =K630*6+L630 -> 15 | O630: 5 | P630: 7 | Q630: =O630*6+P630 -> 37
A631: BEST PLAYERS
A632: PRESTON | C632: MURNANE | F632: ALEXANDER | I632: CAMERON | L632: WADDELL | O632: WALKER | R632: S STEWART
A633: WERRIBEE | C633: TRAINION | F633: DENT | I633: TURNER | L633: SANDFORD | O633: STEINBERG
A634: GOALKICKERS
A635: PRESTON | C635: WALKER 9 | F635: ALEXANDER 3 | I635: PETERSON 3 | L635: MURNANE 3 | N635: CULPH 2 | P635: JENKINS 2 | R635: STEWART | U635: WADDELL
A636: WERRIBEE | C636: BRYAN | E636: RILEY | G636: SANDFORD | J636: CARSS | L636: TRAINION
A638: SUNSHINE | C638: 5 | D638: 5 | E638: =C638*6+D638 -> 35 | G638: 8 | H638: 11 | I638: =G638*6+H638 -> 59 | K638: 11 | L638: 18 | M638: =K638*6+L638 -> 84 | O638: 15 | P638: 21 | Q638: =O638*6+P638 -> 111 | S638: TOORAK PARK
A639: PRAHRAN | C639: 5 | D639: 3 | E639: =C639*6+D639 -> 33 | G639: 5 | H639: 5 | I639: =G639*6+H639 -> 35 | K639: 6 | L639: 7 | M639: =K639*6+L639 -> 43 | O639: 9 | P639: 12 | Q639: =O639*6+P639 -> 66
A640: BEST PLAYERS
A641: SUNSHINE | C641: HOWARD | F641: TREZISE | I641: FITZGERALD | L641: N BECKER | O641: BROWN | R641: WAPLING
A642: PRAHRAN | C642: SHEEDY | F642: SEEDY | I642: RYAN | L642: KIRBY | O642: HARTNETT | R642: WISHART
A643: GOALKICKERS
A644: SUNSHINE | C644: HOWARD 4 | F644: HARRIS 4 | I644: WAPLING 2 | L644: FITZGERALD 2 | O644: TREZISE | Q644: CROSBIE | S644: GREGORY
A645: PRAHRAN | C645: RYAN 4 | F645: SYMONS 3 | I645: WISHART | L645: JULIER
A647: BYE | C647: CAMBERWELL
A649: ROUND 17 | E649: 7TH AUGUST | I649: WEATHER | S649: PLAYED AT
D650: 1ST QTR | H650: 2ND QTR | L650: 3RD QTR | P650: FINAL | S650: CAMBERWELL
A651: PRESTON | C651: 7 | D651: 5 | E651: =C651*6+D651 -> 47 | G651: 12 | H651: 8 | I651: =G651*6+H651 -> 80 | K651: 19 | L651: 11 | M651: =K651*6+L651 -> 125 | O651: 20 | P651: 12 | Q651: =O651*6+P651 -> 132 | S651: UMPIRE | Y651: LADDER | AC651: ROUND | AE651: 17
A652: CAMBERWELL | C652: 3 | D652: 1 | E652: =C652*6+D652 -> 19 | G652: 6 | H652: 4 | I652: =G652*6+H652 -> 40 | K652: 6 | L652: 4 | M652: =K652*6+L652 -> 40 | O652: 9 | P652: 7 | Q652: =O652*6+P652 -> 61
A653: BEST PLAYERS | W653: TEAM | X653: B | Y653: W | Z653: L | AA653: D | AB653: FOR | AC653: AGST | AD653: % | AE653: PTS
A654: PRESTON | C654: ALEXANDER | F654: TRELOAR | I654: CAMERON | L654: PETERSON | O654: McARTHUR | R654: MURNANE
A655: CAMBERWELL | C655: K SMITH | F655: DOUGLA | I655: HAFEY | L655: PEMBERTON | O655: KISS | R655: FRIEBERG | W655: PRESTON | X655: 2 | Y655: 12 | Z655: 3 | AA655: 0 | AB655: 1824 | AC655: 854 | AD655: =(AB655*100)/AC655 -> 213.5831381733021 | AE655: =(Y655*4)+(AA655*2) -> 48
A656: GOALKICKERS | W656: MORDIALLOC | X656: 2 | Y656: 11 | Z656: 4 | AA656: 0 | AB656: 1535 | AC656: 1055 | AD656: =(AB656*100)/AC656 -> 145.49763033175356 | AE656: =(Y656*4)+(AA656*2) -> 44
A657: PRESTON | C657: CAMERON 5 | F657: PETERSON 4 | I657: WALKER 3 | L657: McARTHUR 3 | O657: ALEXANDER 2 | R657: CULPH 2 | T657: STEWART | W657: SUNSHINE | X657: 2 | Y657: 10 | Z657: 5 | AA657: 0 | AB657: 1378 | AC657: 1173 | AD657: =(AB657*100)/AC657 -> 117.4765558397272 | AE657: =(Y657*4)+(AA657*2) -> 40
A658: CAMBERWELL | C658: FRIEBERG 4 | F658: J SMITH 2 | I658: HAFEY 2 | L658: D BOYD | W658: NORTHCOTE | X658: 2 | Y658: 10 | Z658: 5 | AA658: 0 | AB658: 1091 | AC658: 1102 | AD658: =(AB658*100)/AC658 -> 99.001814882032662 | AE658: =(Y658*4)+(AA658*2) -> 40
A660: NORTHCOTE | C660: 2 | D660: 0 | E660: =C660*6+D660 -> 12 | G660: 5 | H660: 2 | I660: =G660*6+H660 -> 32 | K660: 7 | L660: 3 | M660: =K660*6+L660 -> 45 | O660: 8 | P660: 4 | Q660: =O660*6+P660 -> 52 | S660: NORTHCOTE | W660: PRAHRAN | X660: 2 | Y660: 7 | Z660: 7 | AA660: 1 | AB660: 1325 | AC660: 1339 | AD660: =(AB660*100)/AC660 -> 98.954443614637796 | AE660: =(Y660*4)+(AA660*2) -> 30
A661: BOX HILL | C661: 0 | D661: 4 | E661: =C661*6+D661 -> 4 | G661: 1 | H661: 7 | I661: =G661*6+H661 -> 13 | K661: 2 | L661: 9 | M661: =K661*6+L661 -> 21 | O661: 3 | P661: 9 | Q661: =O661*6+P661 -> 27 | W661: BOX HILL | X661: 2 | Y661: 5 | Z661: 8 | AA661: 2 | AB661: 1108 | AC661: 1369 | AD661: =(AB661*100)/AC661 -> 80.934989043097147 | AE661: =(Y661*4)+(AA661*2) -> 24
A662: BEST PLAYERS | W662: WERRIBEE | X662: 2 | Y662: 5 | Z662: 9 | AA662: 1 | AB662: 1098 | AC662: 1498 | AD662: =(AB662*100)/AC662 -> 73.297730307076108 | AE662: =(Y662*4)+(AA662*2) -> 22
A663: NORTHCOTE | C663: GEMMELL | F663: BEYNON | I663: CRAMERI | L663: SIMPSON | O663: BISHOP | Q663: KEANE | W663: CAMBERWELL | X663: 2 | Y663: 3 | Z663: 11 | AA663: 1 | AB663: 1081 | AC663: 1445 | AD663: =(AB663*100)/AC663 -> 74.809688581314873 | AE663: =(Y663*4)+(AA663*2) -> 14
A664: BOX HILL | C664: MALCOLM | F664: SALMON | I664: FELLOWS | L664: LA ROCHE | O664: HARRIS | Q664: WHITE | W664: CAULFIELD | X664: 1 | Y664: 2 | Z664: 13 | AA664: 1 | AB664: 1099 | AC664: 1653 | AD664: =(AB664*100)/AC664 -> 66.485178463399876 | AE664: =(Y664*4)+(AA664*2) -> 10
A665: GOALKICKERS
A666: NORTHCOTE | C666: LANGBORNE 2 | F666: GEMMELL 2 | I666: KEANE 2 | K666: DEAN | M666: BISHOP
A667: BOX HILL | C667: MACE | E667: BRYANT | H667: McCURRY
A669: SUNSHINE | C669: 2 | D669: 4 | E669: =C669*6+D669 -> 16 | G669: 6 | H669: 5 | I669: =G669*6+H669 -> 41 | K669: 11 | L669: 9 | M669: =K669*6+L669 -> 75 | O669: 13 | P669: 12 | Q669: =O669*6+P669 -> 90 | S669: SUNSHINE
A670: CAULFIELD | C670: 1 | D670: 2 | E670: =C670*6+D670 -> 8 | G670: 3 | H670: 6 | I670: =G670*6+H670 -> 24 | K670: 3 | L670: 6 | M670: =K670*6+L670 -> 24 | O670: 4 | P670: 8 | Q670: =O670*6+P670 -> 32
A671: BEST PLAYERS
A672: SUNSHINE | C672: WAPLING | F672: CROSBIE | I672: SLATTERY | L672: THORNTON | O672: HOWARD | R672: DARUL
A673: CAULFIELD | C673: ROWE | F673: DE BOND | I673: STONE | L673: BAKER | O673: NICHOLLS | R673: SIMMONS
A674: GOALKICKERS
A675: SUNSHINE | C675: HOWARD 3 | F675: CROSBIE 2 | I675: TREZISE 2 | L675: GREGORY 2 | N675: STEVENS 2 | Q675: HARRIS | S675: WAPLING
A676: CAULFIELD | C676: ROWE | F676: NICHOLLS | I676: SIMMONS | L676: FREDERICKSON
E677: 8TH AUGUST | I677: WEATHER
A678: MORDIALLLOC | C678: 3 | D678: 2 | E678: =C678*6+D678 -> 20 | G678: 6 | H678: 3 | I678: =G678*6+H678 -> 39 | K678: 9 | L678: 4 | M678: =K678*6+L678 -> 58 | O678: 14 | P678: 11 | Q678: =O678*6+P678 -> 95 | S678: MORDIALLOC
A679: PRAHRAN | C679: 1 | D679: 3 | E679: =C679*6+D679 -> 9 | G679: 4 | H679: 5 | I679: =G679*6+H679 -> 29 | K679: 7 | L679: 10 | M679: =K679*6+L679 -> 52 | O679: 8 | P679: 11 | Q679: =O679*6+P679 -> 59
A680: BEST PLAYERS
A681: MORDIALLLOC | C681: DANCKERT | F681: HOBSON | I681: LESLIE | L681: BAXTER | O681: POWER | R681: MORRISON
A682: PRAHRAN | C682: RICHARDSON | F682: SHEEDY | I682: MOONEY | L682: BUTLER | O682: McMAHON | R682: HARTNETT
A683: GOALKICKERS
A684: MORDIALLLOC | C684: POWER 5 | F684: O'BRIEN 4 | I684: BAXTER 2 | L684: GROVES 2 | O684: LESLIE
A685: PRAHRAN | C685: RYAN 4 | F685: SYMONS | I685: SHEEDY | L685: CORRIGAN | O685: SEEDY
A687: BYE | C687: WERRIBEE
A689: ROUND 18 | E689: 14TH AUGUST | I689: WEATHER | S689: PLAYED AT
D690: 1ST QTR | H690: 2ND QTR | L690: 3RD QTR | P690: FINAL | S690: BOX HILL
A691: BOX HILL | C691: 4 | D691: 6 | E691: =C691*6+D691 -> 30 | G691: 8 | H691: 9 | I691: =G691*6+H691 -> 57 | K691: 10 | L691: 11 | M691: =K691*6+L691 -> 71 | O691: 14 | P691: 12 | Q691: =O691*6+P691 -> 96 | S691: UMPIRE | Y691: LADDER | AC691: ROUND | AE691: 18
A692: SUNSHINE | C692: 2 | D692: 1 | E692: =C692*6+D692 -> 13 | G692: 4 | H692: 1 | I692: =G692*6+H692 -> 25 | K692: 9 | L692: 6 | M692: =K692*6+L692 -> 60 | O692: 9 | P692: 11 | Q692: =O692*6+P692 -> 65
A693: BEST PLAYERS | W693: TEAM | X693: B | Y693: W | Z693: L | AA693: D | AB693: FOR | AC693: AGST | AD693: % | AE693: PTS
A694: BOX HILL | C694: I BATES | F694: GARDINER | I694: McCURRY | L694: HARRIS | O694: SALMON | Q694: LOOMES
A695: SUNSHINE | C695: SLATTERY | F695: WROBLEWSKI | I695: HARRIS | L695: CROSBIE | O695: ROACH | Q695: BROWN | W695: PRESTON | X695: 2 | Y695: 13 | Z695: 3 | AA695: 0 | AB695: 1927 | AC695: 912 | AD695: =(AB695*100)/AC695 -> 211.29385964912279 | AE695: =(Y695*4)+(AA695*2) -> 52
A696: GOALKICKERS | W696: MORDIALLOC | X696: 2 | Y696: 11 | Z696: 5 | AA696: 0 | AB696: 1593 | AC696: 1158 | AD696: =(AB696*100)/AC696 -> 137.56476683937825 | AE696: =(Y696*4)+(AA696*2) -> 44
A697: BOX HILL | C697: GARDINER 4 | F697: HOBBS 3 | H697: SALMON 2 | K697: LOOMES 2 | M697: BRYANT | O697: GRAY | Q697: I BATES | W697: NORTHCOTE | X697: 2 | Y697: 11 | Z697: 5 | AA697: 0 | AB697: 1182 | AC697: 1172 | AD697: =(AB697*100)/AC697 -> 100.85324232081911 | AE697: =(Y697*4)+(AA697*2) -> 44
A698: SUNSHINE | C698: HARRIS 5 | F698: TREZISE 2 | I698: CROSBIE | K698: SLATTERY | W698: SUNSHINE | X698: 2 | Y698: 10 | Z698: 6 | AA698: 0 | AB698: 1443 | AC698: 1269 | AD698: =(AB698*100)/AC698 -> 113.71158392434988 | AE698: =(Y698*4)+(AA698*2) -> 40
E699: 15TH AUGUST | I699: WEATHER
A700: PRAHRAN | C700: 5 | D700: 4 | E700: =C700*6+D700 -> 34 | G700: 7 | H700: 4 | I700: =G700*6+H700 -> 46 | K700: 9 | L700: 5 | M700: =K700*6+L700 -> 59 | O700: 13 | P700: 9 | Q700: =O700*6+P700 -> 87 | S700: TOORAK PARK | W700: PRAHRAN | X700: 2 | Y700: 8 | Z700: 7 | AA700: 1 | AB700: 1412 | AC700: 1382 | AD700: =(AB700*100)/AC700 -> 102.17076700434153 | AE700: =(Y700*4)+(AA700*2) -> 34
A701: CAMBERWELL | C701: 1 | D701: 2 | E701: =C701*6+D701 -> 8 | G701: 3 | H701: 6 | I701: =G701*6+H701 -> 24 | K701: 3 | L701: 10 | M701: =K701*6+L701 -> 28 | O701: 5 | P701: 13 | Q701: =O701*6+P701 -> 43 | W701: BOX HILL | X701: 2 | Y701: 6 | Z701: 8 | AA701: 2 | AB701: 1204 | AC701: 1434 | AD701: =(AB701*100)/AC701 -> 83.960948396094835 | AE701: =(Y701*4)+(AA701*2) -> 28
A702: BEST PLAYERS | W702: WERRIBEE | X702: 2 | Y702: 5 | Z702: 10 | AA702: 1 | AB702: 1168 | AC702: 1589 | AD702: =(AB702*100)/AC702 -> 73.505349276274387 | AE702: =(Y702*4)+(AA702*2) -> 22
A703: PRAHRAN | C703: RYAN | F703: VERWOERT | I703: WISHART | L703: SHEEDY | O703: CORRIGAN | R703: BUTLER | W703: CAMBERWELL | X703: 2 | Y703: 3 | Z703: 12 | AA703: 1 | AB703: 1124 | AC703: 1532 | AD703: =(AB703*100)/AC703 -> 73.368146214099212 | AE703: =(Y703*4)+(AA703*2) -> 14
A704: CAMBERWELL | C704: MACKIE | F704: ALLEMAND | I704: FRIEBERG | L704: K SMITH | O704: COCKREM | R704: GIBSON | W704: CAULFIELD | X704: 2 | Y704: 2 | Z704: 13 | AA704: 1 | AB704: 1099 | AC704: 1653 | AD704: =(AB704*100)/AC704 -> 66.485178463399876 | AE704: =(Y704*4)+(AA704*2) -> 10
A705: GOALKICKERS
A706: PRAHRAN | C706: RYAN 7 | E706: SHEEDY 3 | H706: VERWOERT | K706: RICHARDSON | N706: CORRIGAN
A707: CAMBERWELL | C707: FRIEBERG 2 | F707: COCKREM 2 | I707: K SMITH
A709: PRESTON | C709: 4 | D709: 7 | E709: =C709*6+D709 -> 31 | G709: 7 | H709: 9 | I709: =G709*6+H709 -> 51 | K709: 10 | L709: 14 | M709: =K709*6+L709 -> 74 | O709: 14 | P709: 19 | Q709: =O709*6+P709 -> 103 | S709: PRESTON
A710: MORDIALLOC | C710: 3 | D710: 0 | E710: =C710*6+D710 -> 18 | G710: 4 | H710: 3 | I710: =G710*6+H710 -> 27 | K710: 7 | L710: 4 | M710: =K710*6+L710 -> 46 | O710: 9 | P710: 4 | Q710: =O710*6+P710 -> 58
A711: BEST PLAYERS
A712: PRESTON | C712: TRELOAR | F712: PETERSON | I712: MURNANE | L712: WADDELL | O712: CAMERON | R712: STEWART
A713: MORDIALLOC | C713: DANCKERT | F713: POWER | I713: GROVES | L713: O'BRIEN | O713: BLAINEY | R713: HYNES
A714: GOALKICKERS
A715: PRESTON | C715: PETERSON 4 | F715: WALKER 3 | I715: CAMERON 3 | L715: ALEXANDER 2 | O715: McARTHUR | R715: MURNANE
A716: MORDIALLOC | C716: POWER 5 | F716: HYNES | H716: O'BRIEN | J716: BATES | L716: GROVES
E717: 21ST APRIL | I717: WEATHER
A718: NORTHCOTE | C718: 6 | D718: 1 | E718: =C718*6+D718 -> 37 | G718: 9 | H718: 3 | I718: =G718*6+H718 -> 57 | K718: 11 | L718: 5 | M718: =K718*6+L718 -> 71 | O718: 14 | P718: 7 | Q718: =O718*6+P718 -> 91 | S718: WERRIBEE
A719: WERRIBEE | C719: 6 | D719: 1 | E719: =C719*6+D719 -> 37 | G719: 7 | H719: 6 | I719: =G719*6+H719 -> 48 | K719: 9 | L719: 8 | M719: =K719*6+L719 -> 62 | O719: 10 | P719: 10 | Q719: =O719*6+P719 -> 70
A720: BEST PLAYERS
A721: NORTHCOTE | C721: SIMPSON | F721: PITTS | I721: CRAMERI | L721: BISHOP | O721: GRYBAS | R721: BRUSH
A722: WERRIBEE | C722: BRYAN | F722: GOULOPOLOUS | I722: TRAINION | L722: TURNER | O722: MELICAN | R722: SMITH
A723: GOALKICKERS
A724: NORTHCOTE | C724: LACHMUND 4 | F724: BRADY 3 | I724: GRYBAS 2 | K724: SOUTER 2 | M724: CRAMERI | O724: HENRY | Q724: McBREEN
A725: WERRIBEE | C725: BRYAN 4 | F725: SMITH 3 | I725: TRAINION | L725: PANTE | N725: CARSS
A727: BYE | C727: CAULFIELD
A729: FINALS
A730: 1ST SEMI | E730: 22ND AUGUST | I730: WEATHER | S730: PLAYED AT
D731: 1ST QTR | H731: 2ND QTR | L731: 3RD QTR | P731: FINAL | S731: TOORAK PARK
A732: NORTHCOTE | C732: 3 | D732: 3 | E732: =C732*6+D732 -> 21 | G732: 11 | H732: 8 | I732: =G732*6+H732 -> 74 | K732: 12 | L732: 11 | M732: =K732*6+L732 -> 83 | O732: 14 | P732: 15 | Q732: =O732*6+P732 -> 99 | S732: UMPIRE
A733: SUNSHINE | C733: 6 | D733: 4 | E733: =C733*6+D733 -> 40 | G733: 8 | H733: 9 | I733: =G733*6+H733 -> 57 | K733: 9 | L733: 13 | M733: =K733*6+L733 -> 67 | O733: 11 | P733: 21 | Q733: =O733*6+P733 -> 87 | S733: DIXON
A734: BEST PLAYERS
A735: NORTHCOTE | C735: HAAG | F735: McBREEN | I735: LACHMUND | L735: BISHOP | O735: BRUSH | R735: OGILVIE
A736: SUNSHINE | C736: TREZISE | F736: DARUL | I736: TRUSLER | L736: CROSBIE | O736: HARRIS | R736: SLATTERY
A737: GOALKICKERS
A738: NORTHCOTE | C738: LACHMUND 5 | F738: HAAG 3 | I738: SOUTER 2 | K738: HENRY | M738: BISHOP | O738: GRYBAS | Q738: BRADY
A739: SUNSHINE | C739: HARRIS 4 | F739: TREZISE 2 | I739: HOWARD 2 | L739: TRUSLER | N739: CROSBIE | Q739: FITZGERALD
A741: 2ND SEMI | E741: 29TH AUGUST | I741: WEATHER
A742: PRESTON | C742: 3 | D742: 4 | E742: =C742*6+D742 -> 22 | G742: 5 | H742: 7 | I742: =G742*6+H742 -> 37 | K742: 8 | L742: 15 | M742: =K742*6+L742 -> 63 | O742: 13 | P742: 18 | Q742: =O742*6+P742 -> 96 | S742: TOORAK PARK
A743: MORDIALLOC | C743: 2 | D743: 4 | E743: =C743*6+D743 -> 16 | G743: 7 | H743: 8 | I743: =G743*6+H743 -> 50 | K743: 9 | L743: 8 | M743: =K743*6+L743 -> 62 | O743: 12 | P743: 9 | Q743: =O743*6+P743 -> 81 | S743: McMASTER
A744: BEST PLAYERS
A745: PRESTON | C745: JENKINS | F745: PETERSON | I745: CAMERON | L745: WADDELL | O745: DIXON | R745: MURNANE
A746: MORDIALLOC | C746: POWER | F746: BAXTER | I746: LESLIE | L746: GROVES | O746: WILLIAMS | R746: BLAINEY
A747: GOALKICKERS
A748: PRESTON | C748: PETERSON 4 | F748: WALKER 3 | I748: WADDELL 2 | L748: JENKINS 2 | N748: TRELOAR | Q748: ALEXANDER
A749: MORDIALLOC | C749: POWER 7 | F749: LESLIE 2 | I749: O'BRIEN 2 | L749: BAXTER
A751: PRELIMINARY | E751: 5TH SEPTEMBER | I751: WEATHER
A752: MORDIALLOC | C752: 7 | D752: 2 | E752: =C752*6+D752 -> 44 | G752: 9 | H752: 2 | I752: =G752*6+H752 -> 56 | K752: 14 | L752: 5 | M752: =K752*6+L752 -> 89 | O752: 18 | P752: 9 | Q752: =O752*6+P752 -> 117 | S752: TOORAK PARK
A753: NORTHCOTE | C753: 2 | D753: 2 | E753: =C753*6+D753 -> 14 | G753: 6 | H753: 6 | I753: =G753*6+H753 -> 42 | K753: 9 | L753: 8 | M753: =K753*6+L753 -> 62 | O753: 11 | P753: 11 | Q753: =O753*6+P753 -> 77 | S753: FLANAGAN
A754: BEST PLAYERS
A755: MORDIALLOC | C755: BAXTER | F755: BRADBURY | I755: GROVES | L755: O'BRIEN | O755: MORRISON | R755: DANCKERT
A756: NORTHCOTE | C756: SLEEP | F756: HAAG | I756: T KEAYS | L756: BISHOP | O756: BEYNON | R756: BRUSH
A757: GOALKICKERS
A758: MORDIALLOC | C758: BAXTER 4 | F758: POWER 4 | I758: MORRISON 4 | L758: BRADBURY 2 | O758: HYNES 2 | Q758: O'BRIEN | S758: FULLER
A759: NORTHCOTE | C759: LACHMUND 4 | F759: BRADY 2 | I759: GRYBAS 2 | L759: HAAG | N759: SLEEP | P759: HENRY
A761: GRAND | E761: 1'2TH SEPTEMBER | I761: WEATHER
A762: PRESTON | C762: 2 | D762: 1 | E762: =C762*6+D762 -> 13 | G762: 6 | H762: 4 | I762: =G762*6+H762 -> 40 | K762: 12 | L762: 6 | M762: =K762*6+L762 -> 78 | O762: 15 | P762: 12 | Q762: =O762*6+P762 -> 102 | S762: TOORAK PARK
A763: MORDIALLOC | C763: 4 | D763: 4 | E763: =C763*6+D763 -> 28 | G763: 5 | H763: 5 | I763: =G763*6+H763 -> 35 | K763: 8 | L763: 7 | M763: =K763*6+L763 -> 55 | O763: 9 | P763: 10 | Q763: =O763*6+P763 -> 64 | S763: O'NEILL
A764: BEST PLAYERS
A765: PRESTON | C765: WADDELL | F765: CAMERON | I765: WALKER | L765: STEWART | O765: MURNANE | R765: PETERSON
A766: MORDIALLOC | C766: MORRISON | F766: HYNES | I766: BAXTER | L766: HOBSON | O766: WILLIAMS | R766: GROVES
A767: GOALKICKERS
A768: PRESTON | C768: WALKER 5 | F768: PETERSON 5 | I768: CAMERON 2 | L768: McARTHUR 2 | O768: JENKINS
A769: MORDIALLOC | C769: MORRISON 4 | F769: HYNES 2 | I769: POWER | L769: O'BRIEN | N769: BAXTER