A1: Victorian Football Association
A2: Season 1965 - Division One
A3: © Copyright Wal Williams | F3: First created: 2 May 2015
A4: Contact: joywalwi at gmail dot com | F4: Last updated: 8 October 2017 | W4: VFA Results and tables - Link to the main index page
A5: You are free to copy this document in whole or part provided that proper acknowledgement is given to the author. All rights reserved.
A7: 1965 V.F.A. | C7: SEASON 1ST DIVISION | CA7: \D | CB7: {GOTO}BJ3~/M{RIGHT 7}{END}{DOWN}~G4~
A8: ROUND 1 | C8: 17TH APRIL | I8: WEATHER | M8: W.WIND SHOWERS COLD | S8: PLAYED AT | CB8: {GOTO}AL3~/M{END}{RIGHT}{END}{DOWN}~P3~
D9: 1ST QTR | H9: 2ND QTR | L9: 3RD QTR | P9: FINAL | S9: YARRAVILLE | CB9: {GOTO}BJ23~/M{RIGHT 7}{END}{DOWN}~V4~
A10: YARRAVILLE | C10: 2 | D10: 7 | E10: =C10*6+D10 -> 19 | G10: 10 | H10: 10 | I10: =G10*6+H10 -> 70 | K10: 14 | L10: 11 | M10: =K10*6+L10 -> 95 | O10: 14 | P10: 11 | Q10: =O10*6+P10 -> 95 | S10: UMPIRE | X10: LADDER | AB10: ROUND | AD10: 1 | CB10: {GOTO}BJ43~/M{RIGHT 7}{END}{DOWN}~G24~
A11: GEELONG WEST | C11: 2 | D11: 0 | E11: =C11*6+D11 -> 12 | G11: 4 | H11: 3 | I11: =G11*6+H11 -> 27 | K11: 7 | L11: 5 | M11: =K11*6+L11 -> 47 | O11: 10 | P11: 9 | Q11: =O11*6+P11 -> 69 | S11: JACKSON | CB11: {GOTO}AL23~/M{END}{RIGHT}{END}{DOWN}~P23~
A12: BEST PLAYERS | W12: TEAM | X12: W | Y12: L | Z12: D | AA12: FOR | AB12: AGST | AC12: % | AD12: PTS | CB12: {GOTO}BJ63~/M{RIGHT 7}{END}{DOWN}~V24~
A13: YARRAVILLE | C13: MURRAY | F13: RON BROWN | I13: QUARANTOTTO | L13: MADIGAN | O13: ROWE | Q13: SIKORA | CB13: {GOTO}BJ83~/M{RIGHT 7}{END}{DOWN}~G44~
A14: GEELONG WEST | C14: WILLIAMS | F14: MULLEN | I14: GOGGIN | L14: HARDIMAN | O14: LONG | Q14: BELL | W14: DANDENONG | X14: 1 | Y14: 0 | Z14: 0 | AA14: 79 | AB14: 14 | AC14: 564.28571428571433 | AD14: 4 | CB14: {GOTO}AL43~/M{END}{RIGHT}{END}{DOWN}~P43~
A15: GOALKICKERS | W15: YARRAVILLE | X15: 1 | Y15: 0 | Z15: 0 | AA15: 95 | AB15: 69 | AC15: 137.68115942028984 | AD15: 4 | CB15: {GOTO}BJ103~/M{RIGHT 7}{END}{DOWN}~V44~
A16: YARRAVILLE | C16: MURRAY 4 | F16: ROWE 3 | H16: QUARANTOTTO 3 | L16: MADIGAN 2 | O16: RON BROWN | R16: CONNELLY | W16: BRUNSWICK | X16: 1 | Y16: 0 | Z16: 0 | AA16: 82 | AB16: 66 | AC16: 124.24242424242425 | AD16: 4 | CB16: {GOTO}BJ123~/M{RIGHT 7}{END}{DOWN}~G64~
A17: GEELONG WEST | C17: MULLEN 3 | F17: McDONALD 2 | I17: NICHOLLS | K17: LONG | M17: BENNETT | O17: GOGGIN | Q17: WILLIAMS | W17: WILLIAMSTOWN | X17: 1 | Y17: 0 | Z17: 0 | AA17: 82 | AB17: 74 | AC17: 110.81081081081081 | AD17: 4 | CB17: {GOTO}AL63~/M{END}{RIGHT}{END}{DOWN}~P63~
C18: 18TH APRIL | H18: WEATHER | K18: WEST WIND | CB18: {GOTO}BJ143~/M{RIGHT 7}{END}{DOWN}~V64~
A19: BRUNSWICK | C19: 4 | D19: 7 | E19: =C19*6+D19 -> 31 | G19: 7 | H19: 7 | I19: =G19*6+H19 -> 49 | K19: 11 | L19: 13 | M19: =K19*6+L19 -> 79 | O19: 11 | P19: 16 | Q19: =O19*6+P19 -> 82 | S19: BRUNSWICK | W19: OAKLEIGH | X19: 1 | Y19: 0 | Z19: 0 | AA19: 32 | AB19: 29 | AC19: 110.34482758620689 | AD19: 4 | CB19: {GOTO}BJ163~/M{RIGHT 7}{END}{DOWN}~G84~
A20: COBURG | C20: 1 | D20: 4 | E20: =C20*6+D20 -> 10 | G20: 5 | H20: 7 | I20: =G20*6+H20 -> 37 | K20: 6 | L20: 8 | M20: =K20*6+L20 -> 44 | O20: 9 | P20: 12 | Q20: =O20*6+P20 -> 66 | S20: McMASTER | W20: SANDRINGHAM | X20: 0 | Y20: 1 | Z20: 0 | AA20: 29 | AB20: 32 | AC20: 90.625 | AD20: 0 | CB20: {GOTO}AL83~/M{END}{RIGHT}{END}{DOWN}~P83~
A21: BEST PLAYERS | W21: PORT MELBOURNE | X21: 0 | Y21: 1 | Z21: 0 | AA21: 74 | AB21: 82 | AC21: 90.243902439024396 | AD21: 0 | CB21: {GOTO}BJ183~/M{RIGHT 7}{END}{DOWN}~V84~
A22: BRUNSWICK | C22: BURNS | F22: LEYDIN | I22: BOWTELL | L22: BIBBY | O22: WICKS | R22: CLELAND | W22: COBURG | X22: 0 | Y22: 1 | Z22: 0 | AA22: 66 | AB22: 82 | AC22: 80.487804878048777 | AD22: 0 | CB22: {GOTO}BJ203~/M{RIGHT 7}{END}{DOWN}~G104~
A23: COBURG | C23: WARR | F23: HICKS | I23: WELSH | L23: J BRIMACOMBE | O23: K MURRAY | R23: L BRIMACOMBE | W23: GEELONG WEST | X23: 0 | Y23: 1 | Z23: 0 | AA23: 69 | AB23: 95 | AC23: 72.631578947368425 | AD23: 0 | CB23: {GOTO}AL103~/M{END}{RIGHT}{END}{DOWN}~P103~
A24: GOALKICKERS | W24: WAVERLEY | X24: 0 | Y24: 1 | Z24: 0 | AA24: 14 | AB24: 79 | AC24: 17.721518987341771 | AD24: 0 | CB24: {GOTO}BJ223~/M{RIGHT 7}{END}{DOWN}~V104~
A25: BRUNSWICK | C25: BOWTELL 3 | F25: BURNS 2 | I25: COOK 2 | K25: BIBBY 2 | M25: DARBY | O25: LEYDIN | CB25: {GOTO}BJ243~/M{RIGHT 7}{END}{DOWN}~G124~
A26: COBURG | C26: WELSH 4 | F26: J BRIMACOMBE 2 | J26: K MURRAY 2 | M26: GIARDOSSI | CB26: {GOTO}AL123~/M{END}{RIGHT}{END}{DOWN}~P123~
A28: WILLIAMSTOWN | C28: 4 | D28: 0 | E28: =C28*6+D28 -> 24 | G28: 9 | H28: 6 | I28: =G28*6+H28 -> 60 | K28: 10 | L28: 8 | M28: =K28*6+L28 -> 68 | O28: 12 | P28: 10 | Q28: =O28*6+P28 -> 82 | S28: PORT MELBOURNE | CB28: {GOTO}BJ263~/M{RIGHT 7}{END}{DOWN}~V124~
A29: PORT MELBOURNE | C29: 2 | D29: 5 | E29: =C29*6+D29 -> 17 | G29: 3 | H29: 8 | I29: =G29*6+H29 -> 26 | K29: 7 | L29: 16 | M29: =K29*6+L29 -> 58 | O29: 9 | P29: 20 | Q29: =O29*6+P29 -> 74 | S29: ROWE | CB29: {GOTO}BJ283~/M{RIGHT 7}{END}{DOWN}~G144~
A30: BEST PLAYERS | CB30: {GOTO}AL143~/M{END}{RIGHT}{END}{DOWN}~P143~
A31: WILLIAMSTOWN | C31: SAVIGE | F31: WARE | I31: SUMMERS | L31: RUSSELL | O31: JAMES | R31: JENKINSON | CB31: {GOTO}BJ303~/M{RIGHT 7}{END}{DOWN}~V144~
A32: PORT MELBOURNE | C32: PERRY | F32: EVANS | I32: MITHEN | L32: JEFFREY | O32: CARLILE | R32: HOWELL | CB32: {GOTO}BJ323~/M{RIGHT 7}{END}{DOWN}~G164~
A33: GOALKICKERS | CB33: {GOTO}AL163~/M{END}{RIGHT}{END}{DOWN}~P163~
A34: WILLIAMSTOWN | C34: JENKINSON 4 | F34: GRAHAM 3 | I34: JAMES 2 | L34: O'BRIEN | N34: SUMMERS | Q34: JOHNSON | CB34: {GOTO}BJ343~/M{RIGHT 7}{END}{DOWN}~V164~
A35: PORT MELBOURNE | C35: PERRY 3 | F35: JEFFREY 2 | I35: McGREGOR 2 | L35: KENNEDY | O35: RENOUF | CB35: {HOME}
D36: 19TH APRIL | I36: WEATHER | L36: SOUTH WIND RAIN COLD
A37: OAKLEIGH | C37: 0 | D37: 1 | E37: =C37*6+D37 -> 1 | G37: 2 | H37: 5 | I37: =G37*6+H37 -> 17 | K37: 2 | L37: 5 | M37: =K37*6+L37 -> 17 | O37: 4 | P37: 8 | Q37: =O37*6+P37 -> 32 | S37: OAKLEIGH
A38: SANDRINGHAM | C38: 1 | D38: 4 | E38: =C38*6+D38 -> 10 | G38: 1 | H38: 4 | I38: =G38*6+H38 -> 10 | K38: 2 | L38: 10 | M38: =K38*6+L38 -> 22 | O38: 3 | P38: 11 | Q38: =O38*6+P38 -> 29 | S38: FLANAGAN
A39: BEST PLAYERS
A40: OAKLEIGH | C40: SHERIDAN | F40: KITTO | I40: McLAREN | L40: LYON | N40: LUFF | Q40: JONES
A41: SANDRINGHAM | C41: MACKENZIE | F41: BURNS | I41: WILLS | L41: HOAR | N41: SELLECK | Q41: HARRISON
A42: GOALKICKERS
A43: OAKLEIGH | C43: LYON 2 | F43: SHERIDAN | I43: DOWDELL
A44: SANDRINGHAM | C44: MACKENZIE | F44: HUMPHREYS | I44: OAKLEY
A46: DANDENONG | C46: 4 | D46: 3 | E46: =C46*6+D46 -> 27 | G46: 5 | H46: 5 | I46: =G46*6+H46 -> 35 | K46: 6 | L46: 5 | M46: =K46*6+L46 -> 41 | O46: 12 | P46: 7 | Q46: =O46*6+P46 -> 79 | S46: WAVERLEY
A47: WAVERLEY | C47: 0 | D47: 0 | E47: =C47*6+D47 -> 0 | G47: 0 | H47: 0 | I47: =G47*6+H47 -> 0 | K47: 2 | L47: 2 | M47: =K47*6+L47 -> 14 | O47: 2 | P47: 2 | Q47: =O47*6+P47 -> 14 | S47: HORNE
A48: BEST PLAYERS
A49: DANDENONG | C49: STAUNTON | F49: ARNOLD | I49: GRAVENER | L49: ABRAHAM | O49: LIENERT | R49: McNAMARA
A50: WAVERLEY | C50: PIPER | F50: MITHEN | I50: D JONES | L50: CULPIN | O50: VARLAMOS | R50: MUNN
A51: GOALKICKERS
A52: DANDENONG | C52: McNAMARA 3 | F52: STAUNTON 3 | I52: ARNOLD 2 | L52: GRAVENER | N52: ABRAHAM | Q52: LIENERT
A53: WAVERLEY | C53: JONES | F53: DOBSON
A55: ROUND 2 | D55: 24TH APRIL | J55: WEATHER | N55: SOUTH EAST WIND FINE | S55: PLAYED AT
D56: 1ST QTR | H56: 2ND QTR | L56: 3RD QTR | P56: FINAL | S56: DANDENONG
A57: DANDENONG | C57: 4 | D57: 5 | E57: =C57*6+D57 -> 29 | G57: 5 | H57: 6 | I57: =G57*6+H57 -> 36 | K57: 7 | L57: 9 | M57: =K57*6+L57 -> 51 | O57: 12 | P57: 11 | Q57: =O57*6+P57 -> 83 | S57: UMPIRE | X57: LADDER | AB57: ROUND | AD57: 2
A58: OAKLEIGH | C58: 4 | D58: 2 | E58: =C58*6+D58 -> 26 | G58: 6 | H58: 4 | I58: =G58*6+H58 -> 40 | K58: 6 | L58: 6 | M58: =K58*6+L58 -> 42 | O58: 8 | P58: 9 | Q58: =O58*6+P58 -> 57 | S58: JACKSON
A59: BEST PLAYERS | W59: TEAM | X59: W | Y59: L | Z59: D | AA59: FOR | AB59: AGST | AC59: % | AD59: PTS
A60: DANDENONG | C60: ARNOLD | F60: ABRAHAM | I60: WHALEBONE | L60: KENT | N60: LIENERT | Q60: GRAVENER
A61: OAKLEIGH | C61: MAUGHAN | F61: JONES | I61: McLAREN | L61: BEARD | N61: DOWDELL | Q61: LYON | W61: DANDENONG | X61: 2 | Y61: 0 | Z61: 0 | AA61: 162 | AB61: 71 | AC61: 228.16901408450704 | AD61: 8
A62: GOALKICKERS | W62: YARRAVILLE | X62: 2 | Y62: 0 | Z62: 0 | AA62: 242 | AB62: 114 | AC62: 212.28070175438597 | AD62: 8
A63: DANDENONG | C63: KENT 4 | F63: ARNOLD 2 | I63: WHALEBONE 2 | L63: McNAMARA 2 | O63: ABRAHAM | R63: LIENERT | W63: PORT MELBOURNE | X63: 1 | Y63: 1 | Z63: 0 | AA63: 210 | AB63: 102 | AC63: 205.88235294117646 | AD63: 4
A64: OAKLEIGH | C64: DOWDELL 3 | F64: BEARD 2 | I64: LYON | K64: JONES | M64: THOMPSON | W64: SANDRINGHAM | X64: 1 | Y64: 1 | Z64: 0 | AA64: 145 | AB64: 82 | AC64: 176.82926829268294 | AD64: 4
A66: SANDRINGHAM | C66: 6 | D66: 3 | E66: =C66*6+D66 -> 39 | G66: 10 | H66: 6 | I66: =G66*6+H66 -> 66 | K66: 14 | L66: 9 | M66: =K66*6+L66 -> 93 | O66: 17 | P66: 14 | Q66: =O66*6+P66 -> 116 | S66: BEACH ROAD | W66: WAVERLEY | X66: 1 | Y66: 1 | Z66: 0 | AA66: 94 | AB66: 113 | AC66: 83.185840707964601 | AD66: 4
A67: BRUNSWICK | C67: 0 | D67: 2 | E67: =C67*6+D67 -> 2 | G67: 5 | H67: 4 | I67: =G67*6+H67 -> 34 | K67: 7 | L67: 8 | M67: =K67*6+L67 -> 50 | O67: 7 | P67: 8 | Q67: =O67*6+P67 -> 50 | S67: HORNE | W67: OAKLEIGH | X67: 1 | Y67: 1 | Z67: 0 | AA67: 89 | AB67: 112 | AC67: 79.464285714285708 | AD67: 4
A68: BEST PLAYERS | W68: WILLIAMSTOWN | X68: 1 | Y68: 1 | Z68: 0 | AA68: 116 | AB68: 154 | AC68: 75.324675324675326 | AD68: 4
A69: SANDRINGHAM | C69: ZEUSCHNER | F69: HANCE | I69: PETERS | L69: SELLECK | O69: MERRETT | R69: O'TOOLE | W69: BRUNSWICK | X69: 1 | Y69: 1 | Z69: 0 | AA69: 132 | AB69: 182 | AC69: 72.527472527472526 | AD69: 4
A70: BRUNSWICK | C70: AYRES | F70: ROBINSON | I70: WHILEY | L70: LEYDIN | O70: WICKS | R70: DARBY | W70: COBURG | X70: 0 | Y70: 2 | Z70: 0 | AA70: 111 | AB70: 229 | AC70: 48.471615720524021 | AD70: 0
A71: GOALKICKERS | W71: GEELONG WEST | X71: 0 | Y71: 2 | Z71: 0 | AA71: 89 | AB71: 231 | AC71: 38.528138528138527 | AD71: 0
A72: SANDRINGHAM | C72: OAKLEY 5 | F72: O'TOOLE 3 | I72: MERRETT 3 | L72: ZEUSCHNER 2 | O72: WILLS 2 | Q72: SMART | S72: HANCE
A73: BRUNSWICK | C73: COOK 3 | F73: WHILEY 2 | I73: DARBY | K73: LEYDIN
A75: PORT MELBOURNE | C75: 5 | D75: 4 | E75: =C75*6+D75 -> 34 | G75: 11 | H75: 8 | I75: =G75*6+H75 -> 74 | K75: 14 | L75: 20 | M75: =K75*6+L75 -> 104 | O75: 18 | P75: 28 | Q75: =O75*6+P75 -> 136 | S75: GEELONG WEST
A76: GEELONG WEST | C76: 1 | D76: 0 | E76: =C76*6+D76 -> 6 | G76: 3 | H76: 0 | I76: =G76*6+H76 -> 18 | K76: 3 | L76: 1 | M76: =K76*6+L76 -> 19 | O76: 3 | P76: 2 | Q76: =O76*6+P76 -> 20 | S76: McMASTER
A77: BEST PLAYERS
A78: PORT MELBOURNE | C78: RENOUF | F78: JEFFREY | I78: BONNETT | L78: TAGGART | O78: CARLILE | R78: PERRY
A79: GEELONG WEST | C79: WILLIAMS | F79: BELL | I79: BROWNING | L79: MULLEN | O79: NICHOLLS | R79: HOPE
A80: GOALKICKERS
A81: PORT MELBOURNE | C81: JEFFREY 6 | F81: RENOUF 5 | I81: PERRY 2 | K81: TAGGART | M81: BONNETT | O81: McGREGOR | Q81: BOWEN | S81: MILNER
A82: GEELONG WEST | C82: MULLEN 3
A84: WAVERLEY | C84: 3 | D84: 3 | E84: =C84*6+D84 -> 21 | G84: 5 | H84: 5 | I84: =G84*6+H84 -> 35 | K84: 8 | L84: 6 | M84: =K84*6+L84 -> 54 | O84: 12 | P84: 8 | Q84: =O84*6+P84 -> 80 | S84: WILLIAMSTOWN
A85: WILLIAMSTOWN | C85: 0 | D85: 1 | E85: =C85*6+D85 -> 1 | G85: 1 | H85: 3 | I85: =G85*6+H85 -> 9 | K85: 3 | L85: 4 | M85: =K85*6+L85 -> 22 | O85: 5 | P85: 4 | Q85: =O85*6+P85 -> 34 | S85: ARMSTRONG
A86: BEST PLAYERS
A87: WAVERLEY | C87: LOCKWOOD | F87: MERRETT | I87: JONES | L87: LAWSON | O87: VARLAMOS | R87: MITHEN
A88: WILLIAMSTOWN | C88: JENKINSON | F88: REES | I88: SAVIGE | L88: McDONALD | O88: JOHNSON | R88: SPENCE
A89: GOALKICKERS
A90: WAVERLEY | C90: JONES 4 | F90: MERRETT 3 | I90: LAWSON 2 | L90: LOCKWOOD 2 | O90: DOBSON
A91: WILLIAMSTOWN | C91: JENKINSON | F91: O'BRIEN | I91: LAWLEY | K91: WARE | M91: JOHNSON
A93: YARRAVILLE | C93: 3 | D93: 4 | E93: =C93*6+D93 -> 22 | G93: 8 | H93: 9 | I93: =G93*6+H93 -> 57 | K93: 10 | L93: 12 | M93: =K93*6+L93 -> 72 | O93: 21 | P93: 21 | Q93: =O93*6+P93 -> 147 | S93: PORT MELBOURNE
A94: COBURG | C94: 2 | D94: 5 | E94: =C94*6+D94 -> 17 | G94: 4 | H94: 6 | I94: =G94*6+H94 -> 30 | K94: 5 | L94: 9 | M94: =K94*6+L94 -> 39 | O94: 6 | P94: 9 | Q94: =O94*6+P94 -> 45 | S94: O'NEILL
A95: BEST PLAYERS
A96: YARRAVILLE | C96: KNOTT | E96: ROWE | H96: CONNELLY | K96: QUARANTOTTO | N96: WARWICK | Q96: RON BROWN
A97: COBURG | C97: ROWE | E97: LORD | H97: ACKLAND | K97: MURRAY | N97: GRAHAM | Q97: FITZPATRICK
A98: GOALKICKERS
A99: YARRAVILLE | C99: ROWE 6 | F99: RON BROWN 4 | I99: CONNELLY 3 | L99: QUARANTOTTO 3 | P99: MEDDINGS 2 | S99: R MURRAY 2 | W99: MADIGAN
A100: COBURG | C100: FITZPATRICK 3 | F100: GRAHAM 2 | I100: L BRIMACOMBE
A102: ROUND 3 | D102: 1ST MAY | I102: WEATHER | L102: FINE & SUNNY | S102: PLAYED AT
D103: 1ST QTR | H103: 2ND QTR | L103: 3RD QTR | P103: FINAL | S103: WAVERLEY
A104: WAVERLEY | C104: 3 | D104: 3 | E104: =C104*6+D104 -> 21 | G104: 5 | H104: 5 | I104: =G104*6+H104 -> 35 | K104: 7 | L104: 9 | M104: =K104*6+L104 -> 51 | O104: 10 | P104: 11 | Q104: =O104*6+P104 -> 71 | S104: UMPIRE | X104: LADDER | AB104: ROUND | AD104: 3
A105: PORT MELBOURNE | C105: 1 | D105: 2 | E105: =C105*6+D105 -> 8 | G105: 4 | H105: 9 | I105: =G105*6+H105 -> 33 | K105: 6 | L105: 13 | M105: =K105*6+L105 -> 49 | O105: 7 | P105: 15 | Q105: =O105*6+P105 -> 57 | S105: FLANAGAN
A106: BEST PLAYERS | W106: TEAM | X106: W | Y106: L | Z106: D | AA106: FOR | AB106: AGST | AC106: % | AD106: PTS
A107: WAVERLEY | C107: GREEN | F107: INNES | I107: MERRETT | L107: POORE | O107: ELLIS | Q107: ARNOTT
A108: PORT MELBOURNE | C108: CROSHER | F108: CAULFIELD | I108: MITHEN | L108: CARLILE | O108: BOWEN | Q108: MILNER | W108: DANDENONG | X108: 3 | Y108: 0 | Z108: 0 | AA108: 343 | AB108: 139 | AC108: 246.76258992805757 | AD108: 12
A109: GOALKICKERS | W109: YARRAVILLE | X109: 3 | Y109: 0 | Z109: 0 | AA109: 347 | AB109: 210 | AC109: 165.23809523809524 | AD109: 12
A110: WAVERLEY | C110: MERRETT 4 | F110: LAWSON 2 | I110: JONES 2 | K110: GREEN | M110: THOROGOOD | W110: SANDRINGHAM | X110: 2 | Y110: 1 | Z110: 0 | AA110: 243 | AB110: 151 | AC110: 160.9271523178808 | AD110: 8
A111: PORT MELBOURNE | C111: PERRY 2 | F111: McGREGOR 2 | I111: TAGGART | K111: KERR | M111: NAISMITH | W111: BRUNSWICK | X111: 2 | Y111: 1 | Z111: 0 | AA111: 242 | AB111: 246 | AC111: 98.373983739837399 | AD111: 8
A113: YARRAVILLE | C113: 4 | D113: 5 | E113: =C113*6+D113 -> 29 | G113: 10 | H113: 9 | I113: =G113*6+H113 -> 69 | K113: 13 | L113: 9 | M113: =K113*6+L113 -> 87 | O113: 15 | P113: 15 | Q113: =O113*6+P113 -> 105 | S113: OAKLEIGH | W113: WAVERLEY | X113: 2 | Y113: 1 | Z113: 0 | AA113: 165 | AB113: 170 | AC113: 97.058823529411768 | AD113: 8
A114: OAKLEIGH | C114: 2 | D114: 8 | E114: =C114*6+D114 -> 20 | G114: 3 | H114: 14 | I114: =G114*6+H114 -> 32 | K114: 8 | L114: 22 | M114: =K114*6+L114 -> 70 | O114: 12 | P114: 24 | Q114: =O114*6+P114 -> 96 | S114: ARMSTRONG | W114: PORT MELBOURNE | X114: 1 | Y114: 2 | Z114: 0 | AA114: 267 | AB114: 173 | AC114: 154.33526011560693 | AD114: 4
A115: BEST PLAYERS | W115: OAKLEIGH | X115: 1 | Y115: 2 | Z115: 0 | AA115: 185 | AB115: 217 | AC115: 85.253456221198164 | AD115: 4
A116: YARRAVILLE | C116: ROWE | E116: RON BROWN | H116: MURRAY | K116: HOWARTH | N116: CONNELLY | Q116: QUARANTOTTO | W116: WILLIAMSTOWN | X116: 1 | Y116: 2 | Z116: 0 | AA116: 185 | AB116: 252 | AC116: 73.412698412698418 | AD116: 4
A117: OAKLEIGH | C117: TIPPETT | E117: BEARD | H117: JORDAN | K117: THOMPSON | N117: JONES | Q117: CRAWFORD | W117: GEELONG WEST | X117: 0 | Y117: 3 | Z117: 0 | AA117: 153 | AB117: 341 | AC117: 44.868035190615835 | AD117: 0
A118: GOALKICKERS | S118: MADIGAN | W118: COBURG | X118: 0 | Y118: 3 | Z118: 0 | AA118: 179 | AB118: 410 | AC118: 43.658536585365852 | AD118: 0
A119: YARRAVILLE | C119: ROWE 4 | E119: RON BROWN 3 | H119: MEDDINGS 2 | K119: CONNELLY 2 | N119: SIKORA | P119: QUARANTOTTO | S119: MURRAY
A120: OAKLEIGH | C120: CRAWFORD 3 | F120: TIPPETT 2 | I120: JORDAN 2 | K120: KITTO | M120: THOMPSON | P120: BEARD | R120: LYON | T120: SHERIDAN
E121: 2ND MAY | M121: WEATHER | Q121: FINE
A122: SANDRINGHAM | C122: 4 | D122: 8 | E122: =C122*6+D122 -> 32 | G122: 4 | H122: 15 | I122: =G122*6+H122 -> 39 | K122: 8 | L122: 19 | M122: =K122*6+L122 -> 67 | O122: 13 | P122: 20 | Q122: =O122*6+P122 -> 98 | S122: WILLIAMSTOWN
A123: WILLIAMSTOWN | C123: 1 | D123: 1 | E123: =C123*6+D123 -> 7 | G123: 3 | H123: 3 | I123: =G123*6+H123 -> 21 | K123: 7 | L123: 8 | M123: =K123*6+L123 -> 50 | O123: 10 | P123: 9 | Q123: =O123*6+P123 -> 69 | S123: POLLARD
A124: BEST PLAYERS
A125: SANDRINGHAM | C125: SELLECK | F125: ZEUSCHNER | I125: MUTER | K125: MERRETT | N125: HARRISON | Q125: GRANGER
A126: WILLIAMSTOWN | C126: WARD | F126: WARE | I126: JAMES | K126: RUSSELL | N126: REES | Q126: BEAMISH
A127: GOALKICKERS
A128: SANDRINGHAM | C128: OAKLEY 4 | F128: WILLS 3 | H128: HANCE 2 | J128: O'TOOLE | L128: ZEUSCHNER | O128: HUMPHREYS | R128: MERRETT
A129: WILLIAMSTOWN | C129: WARE 4 | F129: McDONALD 3 | I129: GRAHAM | K129: JOHNSON | M129: BEAMISH
A131: BRUNSWICK | C131: 4 | D131: 6 | E131: =C131*6+D131 -> 30 | G131: 9 | H131: 9 | I131: =G131*6+H131 -> 63 | K131: 13 | L131: 14 | M131: =K131*6+L131 -> 92 | O131: 15 | P131: 20 | Q131: =O131*6+P131 -> 110 | S131: BRUNSWICK
A132: GEELONG WEST | C132: 2 | D132: 4 | E132: =C132*6+D132 -> 16 | G132: 4 | H132: 10 | I132: =G132*6+H132 -> 34 | K132: 6 | L132: 11 | M132: =K132*6+L132 -> 47 | O132: 8 | P132: 16 | Q132: =O132*6+P132 -> 64 | S132: ROWE
A133: BEST PLAYERS
A134: BRUNSWICK | C134: BRIGLIA | F134: AYRES | I134: DENTON | L134: BURNS | N134: WHILEY | Q134: DARBY
A135: GEELONG WEST | C135: NICHOLLS | F135: GOGGIN | I135: WILLIAMS | L135: BELL | N135: McDONALD
A136: GOALKICKERS
A137: BRUNSWICK | C137: BRIGLIA 6 | F137: KICK 3 | H137: DENTON 2 | K137: BURNS | M137: DARBY | O137: PENDLEBURY | R137: WHILEY
A138: GEELONG WEST | C138: GOGGIN 3 | F138: LONG 2 | H138: McDONALD 2 | K138: MULLEN
A140: DANDENONG | C140: 5 | D140: 6 | E140: =C140*6+D140 -> 36 | G140: 10 | H140: 7 | I140: =G140*6+H140 -> 67 | K140: 19 | L140: 12 | M140: =K140*6+L140 -> 126 | O140: 28 | P140: 13 | Q140: =O140*6+P140 -> 181 | S140: PORT MELBOURNE
A141: COBURG | C141: 2 | D141: 3 | E141: =C141*6+D141 -> 15 | G141: 5 | H141: 6 | I141: =G141*6+H141 -> 36 | K141: 8 | L141: 6 | M141: =K141*6+L141 -> 54 | O141: 10 | P141: 8 | Q141: =O141*6+P141 -> 68 | S141: HORNE
A142: BEST PLAYERS
A143: DANDENONG | C143: ARNOLD | F143: ABRAHAM | I143: KENT | L143: SHINNERS | O143: OSBORNE | R143: GREENWOOD
A144: COBURG | C144: ROWE | F144: KEEFER | I144: BRANSTON | L144: CHALLENGER | O144: GRAHAM
A145: GOALKICKERS
A146: DANDENONG | C146: KENT 8 | E146: ARNOLD 7 | H146: ABRAHAM 5 | K146: REEVE 3 | M146: GREENWOOD | P146: McMILLAN | R146: OSBORNE | U146: BARRAN | X146: LIENERT
A147: COBURG | C147: FITZPATRICK 2 | F147: GIARDOSSI 2 | I147: KEEFER 2 | K147: GREGG 2 | M147: CHALLENGER | P147: GIBBON
A149: ROUND 4 | D149: 8TH MAY | I149: WEATHER | L149: NO WIND RAIN GROUNDS BAD | S149: PLAYED AT
D150: 1ST QTR | H150: 2ND QTR | L150: 3RD QTR | P150: FINAL | S150: PORT MELBOURNE
A151: PORT MELBOURNE | C151: 1 | D151: 3 | E151: =C151*6+D151 -> 9 | G151: 7 | H151: 7 | I151: =G151*6+H151 -> 49 | K151: 11 | L151: 11 | M151: =K151*6+L151 -> 77 | O151: 15 | P151: 12 | Q151: =O151*6+P151 -> 102 | S151: UMPIRE | X151: LADDER | AB151: ROUND | AD151: 4
A152: OAKLEIGH | C152: 0 | D152: 1 | E152: =C152*6+D152 -> 1 | G152: 1 | H152: 2 | I152: =G152*6+H152 -> 8 | K152: 2 | L152: 3 | M152: =K152*6+L152 -> 15 | O152: 3 | P152: 4 | Q152: =O152*6+P152 -> 22 | S152: ARMSTRONG
A153: BEST PLAYERS | W153: TEAM | X153: W | Y153: L | Z153: D | AA153: FOR | AB153: AGST | AC153: % | AD153: PTS
A154: PORT MELBOURNE | C154: BROWNHILL | F154: McGREGOR | I154: JEFFREY | L154: TATE | N154: MITHEN | Q154: BOWEN
A155: OAKLEIGH | C155: LUFF | F155: HAINING | I155: McLAREN | L155: ADDISON | N155: POULTER | Q155: KERR | W155: DANDENONG | X155: 4 | Y155: 0 | Z155: 0 | AA155: 431 | AB155: 197 | AC155: 218.78172588832487 | AD155: 16
A156: GOALKICKERS | W156: SANDRINGHAM | X156: 3 | Y156: 1 | Z156: 0 | AA156: 351 | AB156: 237 | AC156: 148.1012658227848 | AD156: 12
A157: PORT MELBOURNE | C157: BROWNHILL 4 | F157: McGREGOR 3 | I157: TATE 3 | K157: JEFFREY 2 | N157: BOWEN | P157: CAULFIELD | R157: RENOUF | W157: YARRAVILLE | X157: 3 | Y157: 1 | Z157: 0 | AA157: 424 | AB157: 298 | AC157: 142.28187919463087 | AD157: 12
A158: OAKLEIGH | C158: McLAREN 2 | F158: KITTO | W158: BRUNSWICK | X158: 3 | Y158: 1 | Z158: 0 | AA158: 330 | AB158: 323 | AC158: 102.16718266253869 | AD158: 12
A160: DANDENONG | C160: 3 | D160: 3 | E160: =C160*6+D160 -> 21 | G160: 7 | H160: 6 | I160: =G160*6+H160 -> 48 | K160: 10 | L160: 7 | M160: =K160*6+L160 -> 67 | O160: 13 | P160: 10 | Q160: =O160*6+P160 -> 88 | S160: DANDENONG | W160: PORT MELBOURNE | X160: 2 | Y160: 2 | Z160: 0 | AA160: 369 | AB160: 195 | AC160: 189.23076923076923 | AD160: 8
A161: WILLIAMSTOWN | C161: 1 | D161: 2 | E161: =C161*6+D161 -> 8 | G161: 2 | H161: 4 | I161: =G161*6+H161 -> 16 | K161: 5 | L161: 7 | M161: =K161*6+L161 -> 37 | O161: 8 | P161: 10 | Q161: =O161*6+P161 -> 58 | S161: McMASTER | W161: WAVERLEY | X161: 2 | Y161: 2 | Z161: 0 | AA161: 251 | AB161: 278 | AC161: 90.287769784172667 | AD161: 8
A162: BEST PLAYERS | W162: WILLIAMSTOWN | X162: 1 | Y162: 3 | Z162: 0 | AA162: 243 | AB162: 340 | AC162: 71.470588235294116 | AD162: 4
A163: DANDENONG | C163: ARNOLD | F163: GREENWOOD | I163: SHINNERS | L163: CROW | N163: ABRAHAM | Q163: PENNEFATHER | W163: OAKLEIGH | X163: 1 | Y163: 3 | Z163: 0 | AA163: 207 | AB163: 319 | AC163: 64.890282131661436 | AD163: 4
A164: WILLIAMSTOWN | C164: MURRIE | F164: BEAMISH | I164: McDONALD | L164: WARE | N164: GRAHAM | Q164: RUSSELL | W164: GEELONG WEST | X164: 1 | Y164: 3 | Z164: 0 | AA164: 227 | AB164: 395 | AC164: 57.468354430379748 | AD164: 4
A165: GOALKICKERS | W165: COBURG | X165: 0 | Y165: 4 | Z165: 0 | AA165: 233 | AB165: 484 | AC165: 48.140495867768593 | AD165: 0
A166: DANDENONG | C166: ARNOLD 4 | F166: GREENWOOD 2 | I166: OSBORNE 2 | L166: McNAMARA 2 | O166: KENT | Q166: ABRAHAM | T166: REEVE
A167: WILLIAMSTOWN | C167: McDONALD 4 | F167: JENKINSON | I167: WARE | K167: LEONARD | N167: MURRIE
E168: 9TH MAY | M168: WEATHER
A169: BRUNSWICK | C169: 4 | D169: 7 | E169: =C169*6+D169 -> 31 | G169: 5 | H169: 7 | I169: =G169*6+H169 -> 37 | K169: 11 | L169: 13 | M169: =K169*6+L169 -> 79 | O169: 12 | P169: 16 | Q169: =O169*6+P169 -> 88 | S169: YARRAVILLE
A170: YARRAVILLE | C170: 2 | D170: 0 | E170: =C170*6+D170 -> 12 | G170: 6 | H170: 5 | I170: =G170*6+H170 -> 41 | K170: 7 | L170: 7 | M170: =K170*6+L170 -> 49 | O170: 11 | P170: 11 | Q170: =O170*6+P170 -> 77 | S170: JACKSON
A171: BEST PLAYERS
A172: BRUNSWICK | C172: BURNS | F172: WHILEY | I172: ROBINSON | L172: McKINNON | P172: DACEY | R172: BRIGLIA
A173: YARRAVILLE | C173: RON BROWN | F173: PIOVESAN | I173: MURRAY | L173: QUARANTOTTO | P173: KNOTT | R173: FELL
A174: GOALKICKERS
A175: BRUNSWICK | C175: BURNS 5 | F175: DACEY 4 | I175: KICK | K175: BRIGLIA | M175: DARBY
A176: YARRAVILLE | C176: ROWE 4 | F176: RON BROWN 4 | I176: WARWICK | L176: BARROW | N176: QUARANTOTTO
A178: SANDRINGHAM | C178: 2 | D178: 7 | E178: =C178*6+D178 -> 19 | G178: 6 | H178: 9 | I178: =G178*6+H178 -> 45 | K178: 13 | L178: 15 | M178: =K178*6+L178 -> 93 | O178: 15 | P178: 18 | Q178: =O178*6+P178 -> 108 | S178: BEACH ROAD
A179: WAVERLEY | C179: 1 | D179: 4 | E179: =C179*6+D179 -> 10 | G179: 6 | H179: 10 | I179: =G179*6+H179 -> 46 | K179: 8 | L179: 10 | M179: =K179*6+L179 -> 58 | O179: 12 | P179: 14 | Q179: =O179*6+P179 -> 86 | S179: ROWE
A180: BEST PLAYERS
A181: SANDRINGHAM | C181: O'TOOLE | F181: OAKLEY | I181: HARRISON | L181: ZEUSCHNER | O181: MUTER | Q181: PETERS
A182: WAVERLEY | C182: MERRETT | F182: MITHEN | I182: LOCKWOOD | L182: VARLAMOS | O182: ROLFE | Q182: MARTIN
A183: GOALKICKERS
A184: SANDRINGHAM | C184: OAKLEY 5 | F184: ZEUSCHNER 3 | I184: SMART 3 | K184: O'TOOLE 2 | N184: HUMPHREYS | Q184: WILLS
A185: WAVERLEY | C185: CULPIN 3 | F185: MERRETT 3 | I185: LOCKWOOD 2 | L185: ANGUS | N185: MITHEN | P185: POORE | R185: MARTIN
A187: GEELONG WEST | C187: 2 | D187: 4 | E187: =C187*6+D187 -> 16 | G187: 2 | H187: 12 | I187: =G187*6+H187 -> 24 | K187: 5 | L187: 16 | M187: =K187*6+L187 -> 46 | O187: 9 | P187: 20 | Q187: =O187*6+P187 -> 74 | S187: GEELONG WEST
A188: COBURG | C188: 0 | D188: 1 | E188: =C188*6+D188 -> 1 | G188: 1 | H188: 2 | I188: =G188*6+H188 -> 8 | K188: 5 | L188: 5 | M188: =K188*6+L188 -> 35 | O188: 8 | P188: 6 | Q188: =O188*6+P188 -> 54 | S188: FLANAGAN
A189: BEST PLAYERS
A190: GEELONG WEST | C190: HOPE | F190: RAEBURN | I190: NICHOLLS | L190: SYMES | O190: LONG | R190: WILLIAMS
A191: COBURG | C191: McNABB | F191: HAWLEY | I191: KEEFER | L191: LORD | O191: TANCREDI | R191: PARTRIDGE
A192: GOALKICKERS
A193: GEELONG WEST | C193: GOGGIN 3 | F193: CASEY 2 | I193: LONG 2 | K193: WILLIAMS | N193: DUFF
A194: COBURG | C194: BRANSTON 3 | F194: GIBBONS | I194: GREGG | K194: KEEFER | M194: CHALLENGER | P194: WELSH
A196: ROUND 5 | C196: 15TH MAY | J196: WEATHER | M196: N.W.WIND FINE | S196: PLAYED AT
D197: 1ST QTR | H197: 2ND QTR | L197: 3RD QTR | P197: FINAL | S197: OAKLEIGH
A198: WAVERLEY | C198: 5 | D198: 2 | E198: =C198*6+D198 -> 32 | G198: 6 | H198: 4 | I198: =G198*6+H198 -> 40 | K198: 6 | L198: 5 | M198: =K198*6+L198 -> 41 | O198: 8 | P198: 9 | Q198: =O198*6+P198 -> 57 | S198: UMPIRE | X198: LADDER | AB198: ROUND | AD198: 5
A199: OAKLEIGH | C199: 3 | D199: 4 | E199: =C199*6+D199 -> 22 | G199: 4 | H199: 7 | I199: =G199*6+H199 -> 31 | K199: 7 | L199: 11 | M199: =K199*6+L199 -> 53 | O199: 7 | P199: 14 | Q199: =O199*6+P199 -> 56 | S199: McMASTER
A200: BEST PLAYERS | W200: TEAM | X200: W | Y200: L | Z200: D | AA200: FOR | AB200: AGST | AC200: % | AD200: PTS
A201: WAVERLEY | C201: BREWSTER | F201: MERRETT | I201: LAWSON | L201: ELLIS | N201: ARNOTT | Q201: MITHEN
A202: OAKLEIGH | C202: JONES | F202: ADDISON | I202: MAUGHAN | L202: BEARD | N202: DOWDELL | Q202: TURNER | W202: DANDENONG | X202: 5 | Y202: 0 | Z202: 0 | AA202: 517 | AB202: 229 | AC202: 225.76419213973799 | AD202: 20
A203: GOALKICKERS | W203: SANDRINGHAM | X203: 4 | Y203: 1 | Z203: 0 | AA203: 477 | AB203: 299 | AC203: 159.53177257525084 | AD203: 16
A204: WAVERLEY | C204: MERRETT 2 | F204: LAWSON 2 | I204: BREWSTER | L204: MITHEN | N204: MARTIN | P204: HURLE | W204: BRUNSWICK | X204: 4 | Y204: 1 | Z204: 0 | AA204: 369 | AB204: 361 | AC204: 102.21606648199446 | AD204: 16
A205: OAKLEIGH | C205: JONES 2 | F205: DOWDELL 2 | I205: KITTO | K205: McLAREN | N205: MAUGHAN | W205: YARRAVILLE | X205: 3 | Y205: 2 | Z205: 0 | AA205: 456 | AB205: 384 | AC205: 118.75 | AD205: 12
E206: 16TH MAY | J206: WEATHER
A207: DANDENONG | C207: 1 | D207: 2 | E207: =C207*6+D207 -> 8 | G207: 5 | H207: 3 | I207: =G207*6+H207 -> 33 | K207: 10 | L207: 5 | M207: =K207*6+L207 -> 65 | O207: 13 | P207: 8 | Q207: =O207*6+P207 -> 86 | S207: DANDENONG | W207: WAVERLEY | X207: 3 | Y207: 2 | Z207: 0 | AA207: 308 | AB207: 334 | AC207: 92.215568862275447 | AD207: 12
A208: YARRAVILLE | C208: 1 | D208: 1 | E208: =C208*6+D208 -> 7 | G208: 1 | H208: 4 | I208: =G208*6+H208 -> 10 | K208: 3 | L208: 6 | M208: =K208*6+L208 -> 24 | O208: 4 | P208: 8 | Q208: =O208*6+P208 -> 32 | S208: O'NEILL | W208: PORT MELBOURNE | X208: 2 | Y208: 3 | Z208: 0 | AA208: 407 | AB208: 234 | AC208: 173.93162393162393 | AD208: 8
A209: BEST PLAYERS | W209: WILLIAMSTOWN | X209: 2 | Y209: 3 | Z209: 0 | AA209: 350 | AB209: 424 | AC209: 82.547169811320757 | AD209: 8
A210: DANDENONG | C210: PENNEFATHER | F210: ARNOLD | I210: KENT | L210: SHINNERS | O210: BAPTIST | R210: STAUNTON | W210: OAKLEIGH | X210: 1 | Y210: 4 | Z210: 0 | AA210: 263 | AB210: 376 | AC210: 69.946808510638292 | AD210: 4
A211: YARRAVILLE | C211: RON BROWN | F211: MADIGAN | I211: EDWARDS | L211: WARWICK | O211: QUARANTOTTO | R211: BURR | W211: GEELONG WEST | X211: 1 | Y211: 4 | Z211: 0 | AA211: 289 | AB211: 521 | AC211: 55.470249520153551 | AD211: 4
A212: GOALKICKERS | W212: COBURG | X212: 0 | Y212: 5 | Z212: 0 | AA212: 317 | AB212: 591 | AC212: 53.637901861252118 | AD212: 0
A213: DANDENONG | C213: ARNOLD 6 | F213: McNAMARA 4 | J213: ABRAHAM 2 | M213: GRAY
A214: YARRAVILLE | C214: MADIGAN 2 | F214: RON BROWN | I214: FELL
A216: BRUNSWICK | C216: 3 | D216: 5 | E216: =C216*6+D216 -> 23 | G216: 3 | H216: 7 | I216: =G216*6+H216 -> 25 | K216: 4 | L216: 11 | M216: =K216*6+L216 -> 35 | O216: 4 | P216: 15 | Q216: =O216*6+P216 -> 39 | S216: BRUNSWICK
A217: PORT MELBOURNE | C217: 2 | D217: 1 | E217: =C217*6+D217 -> 13 | G217: 4 | H217: 5 | I217: =G217*6+H217 -> 29 | K217: 4 | L217: 7 | M217: =K217*6+L217 -> 31 | O217: 5 | P217: 8 | Q217: =O217*6+P217 -> 38 | S217: N ARMSTRONG
A218: BEST PLAYERS
A219: BRUNSWICK | C219: AYRES | F219: ROBINSON | I219: NOONAN | L219: BURNS | O219: HAGART | R219: ROBBINS
A220: PORT MELBOURNE | C220: MITHEN | F220: RENOUF | I220: TATE | L220: HOWELL | O220: EVANS | R220: GROVER
A221: GOALKICKERS
A222: BRUNSWICK | C222: BURNS 2 | F222: HAGART 2
A223: PORT MELBOURNE | C223: TATE 3 | F223: LEWIS | I223: JEFFREY
A225: WILLIAMSTOWN | C225: 2 | D225: 1 | E225: =C225*6+D225 -> 13 | G225: 5 | H225: 2 | I225: =G225*6+H225 -> 32 | K225: 11 | L225: 5 | M225: =K225*6+L225 -> 71 | O225: 16 | P225: 11 | Q225: =O225*6+P225 -> 107 | S225: PORT MELBOURNE
A226: COBURG | C226: 3 | D226: 7 | E226: =C226*6+D226 -> 25 | G226: 5 | H226: 9 | I226: =G226*6+H226 -> 39 | K226: 8 | L226: 9 | M226: =K226*6+L226 -> 57 | O226: 12 | P226: 12 | Q226: =O226*6+P226 -> 84 | S226: SCOTT
A227: BEST PLAYERS
A228: WILLIAMSTOWN | C228: WARE | F228: RUSSELL | I228: GRAHAM | L228: WARD | O228: N McDONALD | R228: JAMES
A229: COBURG | C229: SULLIVAN | F229: ROCHOW | I229: CHALLENGER | L229: GRAHAM | O229: FITZPATRICK | R229: McGROTTY
A230: GOALKICKERS
A231: WILLIAMSTOWN | C231: GRAHAM 4 | F231: N McDONALD 4 | J231: JENKINSON 2 | M231: BOYD 2 | O231: JAMES | Q231: SUMMERS | S231: WILLIAMS | V231: WARE
A232: COBURG | C232: SULLIVAN 3 | F232: ROCHOW 2 | I232: WELSH 2 | K232: CHALLENGER 2 | N232: BROOMHALL | Q232: KEEFER | S232: McGROTTY
A234: SANDRINGHAM | C234: 3 | D234: 1 | E234: =C234*6+D234 -> 19 | G234: 12 | H234: 6 | I234: =G234*6+H234 -> 78 | K234: 17 | L234: 8 | M234: =K234*6+L234 -> 110 | O234: 19 | P234: 14 | Q234: =O234*6+P234 -> 128 | S234: BEACH ROAD
A235: GEELONG WEST | C235: 2 | D235: 3 | E235: =C235*6+D235 -> 15 | G235: 3 | H235: 4 | I235: =G235*6+H235 -> 22 | K235: 7 | L235: 4 | M235: =K235*6+L235 -> 46 | O235: 9 | P235: 8 | Q235: =O235*6+P235 -> 62 | S235: R ARMSTRONG
A236: BEST PLAYERS
A237: SANDRINGHAM | C237: MACKENZIE | F237: LADDS | I237: O'TOOLE | L237: ZEUSCHNER | O237: HANCE | Q237: O'TOOLE
A238: GEELONG WEST | C238: NICHOLLS | F238: LONG | I238: BENNETT | L238: SYMES | O238: HOPE | Q238: WILLIAMS
A239: GOALKICKERS
A240: SANDRINGHAM | C240: O'TOOLE 5 | F240: MACKENZIE 3 | I240: OAKLEY 3 | L240: WILLS 3 | N240: ZEUSCHNER 2 | Q240: HANCE | S240: VAUGHAN | V240: BURNS
A241: GEELONG WEST | C241: LONG 3 | F241: BELL | H241: STACEY | J241: NUSTELING | M241: WILLIAMS | O241: CASEY | Q241: GOGGIN
A243: ROUND 6 | D243: 22ND MAY | I243: WEATHER | L243: NORTH WEST WIND | S243: PLAYED AT
D244: 1ST QTR | H244: 2ND QTR | L244: 3RD QTR | P244: FINAL | S244: WAVERLEY
A245: WAVERLEY | C245: 1 | D245: 0 | E245: =C245*6+D245 -> 6 | G245: 6 | H245: 7 | I245: =G245*6+H245 -> 43 | K245: 7 | L245: 11 | M245: =K245*6+L245 -> 53 | O245: 13 | P245: 18 | Q245: =O245*6+P245 -> 96 | S245: UMPIRE | X245: LADDER | AB245: ROUND | AD245: 6
A246: BRUNSWICK | C246: 3 | D246: 9 | E246: =C246*6+D246 -> 27 | G246: 4 | H246: 12 | I246: =G246*6+H246 -> 36 | K246: 7 | L246: 17 | M246: =K246*6+L246 -> 59 | O246: 9 | P246: 20 | Q246: =O246*6+P246 -> 74 | S246: SCOTT
A247: BEST PLAYERS | W247: TEAM | X247: W | Y247: L | Z247: D | AA247: FOR | AB247: AGST | AC247: % | AD247: PTS
A248: WAVERLEY | C248: VARLAMOS | F248: MERRETT | I248: LAWSON | L248: POORE | O248: LOCKWOOD | R248: SMITH
A249: BRUNSWICK | C249: ROBINSON | F249: WHILEY | I249: BIBBY | L249: WICKS | O249: BURNS | R249: AYRES | W249: DANDENONG | X249: 6 | Y249: 0 | Z249: 0 | AA249: 621 | AB249: 295 | AC249: 210.5084745762712 | AD249: 24
A250: GOALKICKERS | W250: SANDRINGHAM | X250: 5 | Y250: 1 | Z250: 0 | AA250: 596 | AB250: 342 | AC250: 174.26900584795322 | AD250: 20
A251: WAVERLEY | C251: ELLIS 4 | E251: LOCKWOOD 2 | H251: LAWSON 2 | K251: ROLFE | M251: MITHEN | O251: MERRETT | Q251: BREWSTER | T251: POORE | W251: WAVERLEY | X251: 4 | Y251: 2 | Z251: 0 | AA251: 404 | AB251: 408 | AC251: 99.019607843137251 | AD251: 16
A252: BRUNSWICK | C252: COOK 4 | F252: DARBY 2 | I252: BURNS | K252: BIBBY | M252: DENTON | W252: BRUNSWICK | X252: 4 | Y252: 2 | Z252: 0 | AA252: 443 | AB252: 457 | AC252: 96.936542669584242 | AD252: 16
A254: OAKLEIGH | C254: 5 | D254: 0 | E254: =C254*6+D254 -> 30 | G254: 5 | H254: 1 | I254: =G254*6+H254 -> 31 | K254: 6 | L254: 8 | M254: =K254*6+L254 -> 44 | O254: 7 | P254: 11 | Q254: =O254*6+P254 -> 53 | S254: OAKLEIGH | W254: PORT MELBOURNE | X254: 3 | Y254: 3 | Z254: 0 | AA254: 558 | AB254: 329 | AC254: 169.6048632218845 | AD254: 12
A255: WILLIAMSTOWN | C255: 2 | D255: 1 | E255: =C255*6+D255 -> 13 | G255: 2 | H255: 6 | I255: =G255*6+H255 -> 18 | K255: 2 | L255: 8 | M255: =K255*6+L255 -> 20 | O255: 5 | P255: 8 | Q255: =O255*6+P255 -> 38 | S255: HORNE | W255: YARRAVILLE | X255: 3 | Y255: 3 | Z255: 0 | AA255: 551 | AB255: 535 | AC255: 102.99065420560747 | AD255: 12
A256: BEST PLAYERS | W256: WILLIAMSTOWN | X256: 2 | Y256: 4 | Z256: 0 | AA256: 388 | AB256: 477 | AC256: 81.341719077568129 | AD256: 8
A257: OAKLEIGH | C257: LUFF | F257: BEARD | I257: DOWDELL | L257: LYON | N257: TURNER | Q257: SHERIDAN | W257: OAKLEIGH | X257: 2 | Y257: 4 | Z257: 0 | AA257: 316 | AB257: 414 | AC257: 76.328502415458942 | AD257: 8
A258: WILLIAMSTOWN | C258: EVANS | F258: JONES | I258: SAVIGE | L258: BOYD | N258: WARD | Q258: SUMMERS | W258: GEELONG WEST | X258: 1 | Y258: 5 | Z258: 0 | AA258: 355 | AB258: 625 | AC258: 56.8 | AD258: 4
A259: GOALKICKERS | W259: COBURG | X259: 0 | Y259: 6 | Z259: 0 | AA259: 360 | AB259: 710 | AC259: 50.70422535211268 | AD259: 0
A260: OAKLEIGH | C260: DEFTEROUS 2 | F260: JORDAN 2 | I260: McLAREN | L260: LYON | N260: DOWDELL
A261: WILLIAMSTOWN | C261: WILLIAMS 2 | F261: SUMMERS | I261: BOYD | L261: GRAHAM
E262: 23RD MAY | M262: WEATHER
A263: PORT MELBOURNE | C263: 1 | D263: 4 | E263: =C263*6+D263 -> 10 | G263: 8 | H263: 6 | I263: =G263*6+H263 -> 54 | K263: 17 | L263: 8 | M263: =K263*6+L263 -> 110 | O263: 22 | P263: 19 | Q263: =O263*6+P263 -> 151 | S263: YARRAVILLE
A264: YARRAVILLE | C264: 7 | D264: 1 | E264: =C264*6+D264 -> 43 | G264: 8 | H264: 5 | I264: =G264*6+H264 -> 53 | K264: 13 | L264: 9 | M264: =K264*6+L264 -> 87 | O264: 14 | P264: 11 | Q264: =O264*6+P264 -> 95 | S264: ROWE
A265: BEST PLAYERS
A266: PORT MELBOURNE | C266: CARLILE | F266: CROSHER | I266: RENOUF | L266: MITHEN | O266: TAGGART | R266: CAULFIELD
A267: YARRAVILLE | C267: WARWICK | F267: RON BROWN | I267: KNOTT | L267: MADIGAN | O267: ROWE | R267: MEDDINGS
A268: GOALKICKERS
A269: PORT MELBOURNE | C269: CARLILE 6 | F269: CAULFIELD 4 | I269: EDWARDS 3 | L269: TAGGART 2 | O269: TATE 2 | Q269: RENOUF 2 | T269: BROWNHILL 2 | X269: BOWEN
A270: YARRAVILLE | C270: ROWE 5 | F270: MADIGAN 5 | I270: EDWARDS | K270: RON BROWN | N270: CURRIE | P270: TAURENS
A272: DANDENONG | C272: 3 | D272: 6 | E272: =C272*6+D272 -> 24 | G272: 4 | H272: 9 | I272: =G272*6+H272 -> 33 | K272: 12 | L272: 13 | M272: =K272*6+L272 -> 85 | O272: 15 | P272: 14 | Q272: =O272*6+P272 -> 104 | S272: GEELONG WEST
A273: GEELONG WEST | C273: 4 | D273: 0 | E273: =C273*6+D273 -> 24 | G273: 6 | H273: 1 | I273: =G273*6+H273 -> 37 | K273: 7 | L273: 1 | M273: =K273*6+L273 -> 43 | O273: 10 | P273: 6 | Q273: =O273*6+P273 -> 66 | S273: POLLARD
A274: BEST PLAYERS
A275: DANDENONG | C275: McMILLAN | F275: CROW | I275: McNAMARA | L275: BAPTIST | O275: ABRAHAM | R275: BARRAN
A276: GEELONG WEST | C276: WILLIAMS | F276: COLTISH | I276: NICHOLLS | L276: LONG | O276: GOGGIN | R276: BELL
A277: GOALKICKERS
A278: DANDENONG | C278: McNAMARA 8 | F278: ARNOLD 3 | I278: ABRAHAM 2 | L278: SUTTON | N278: LIENERT
A279: GEELONG WEST | C279: LONG 5 | F279: STACEY 2 | I279: GOGGIN 2 | L279: RAEBURN
A281: SANDRINGHAM | C281: 4 | D281: 2 | E281: =C281*6+D281 -> 26 | G281: 7 | H281: 4 | I281: =G281*6+H281 -> 46 | K281: 11 | L281: 8 | M281: =K281*6+L281 -> 74 | O281: 18 | P281: 11 | Q281: =O281*6+P281 -> 119 | S281: PORT MELBOURNE
A282: COBURG | C282: 1 | D282: 1 | E282: =C282*6+D282 -> 7 | G282: 3 | H282: 4 | I282: =G282*6+H282 -> 22 | K282: 5 | L282: 5 | M282: =K282*6+L282 -> 35 | O282: 6 | P282: 7 | Q282: =O282*6+P282 -> 43 | S282: JACKSON
A283: BEST PLAYERS
A284: SANDRINGHAM | C284: O'TOOLE | F284: GRANGER | I284: HANCE | L284: HARRISON | O284: BURNS | Q284: LADDS
A285: COBURG | C285: ROCHOW | F285: CHALLENGER | I285: McNABB | L285: ROWE | O285: HICKS | Q285: PLANT
A286: GOALKICKERS
A287: SANDRINGHAM | C287: O'TOOLE 4 | F287: ZEUSCHNER 3 | I287: BURNS 3 | K287: OAKLEY 3 | N287: MACKENZIE 2 | Q287: SMART 2 | T287: AGHAN
A288: COBURG | C288: ROCHOW 2 | F288: CHALLENGER 2 | J288: BRANSTON | M288: SULLIVAN
A290: ROUND 7 | C290: 29TH MAY | J290: WEATHER | M290: NORTH WEST WIND | S290: PLAYED AT
D291: 1ST QTR | H291: 2ND QTR | L291: 3RD QTR | P291: FINAL | S291: BRUNSWICK
A292: BRUNSWICK | C292: 3 | D292: 3 | E292: =C292*6+D292 -> 21 | G292: 6 | H292: 9 | I292: =G292*6+H292 -> 45 | K292: 9 | L292: 15 | M292: =K292*6+L292 -> 69 | O292: 11 | P292: 18 | Q292: =O292*6+P292 -> 84 | S292: UMPIRE | X292: LADDER | AB292: ROUND | AD292: 7
A293: OAKLEIGH | C293: 5 | D293: 1 | E293: =C293*6+D293 -> 31 | G293: 6 | H293: 3 | I293: =G293*6+H293 -> 39 | K293: 9 | L293: 8 | M293: =K293*6+L293 -> 62 | O293: 10 | P293: 13 | Q293: =O293*6+P293 -> 73 | S293: O'NEILL
A294: BEST PLAYERS | W294: TEAM | X294: W | Y294: L | Z294: D | AA294: FOR | AB294: AGST | AC294: % | AD294: PTS
A295: BRUNSWICK | C295: COOK | F295: BIBBY | I295: BURNS | L295: AYRES | N295: LEYDIN | Q295: DARBY
A296: OAKLEIGH | C296: KITTO | F296: LYON | I296: SHERIDAN | L296: LUFF | N296: DEFTEROUS | Q296: BEARD | W296: DANDENONG | X296: 6 | Y296: 1 | Z296: 0 | AA296: 703 | AB296: 383 | AC296: 183.5509138381201 | AD296: 24
A297: GOALKICKERS | W297: SANDRINGHAM | X297: 6 | Y297: 1 | Z297: 0 | AA297: 684 | AB297: 424 | AC297: 161.32075471698113 | AD297: 24
A298: BRUNSWICK | C298: COOK 6 | F298: BURNS 2 | I298: DACEY | K298: LEYDIN | M298: BRIGLIA | W298: WAVERLEY | X298: 5 | Y298: 2 | Z298: 0 | AA298: 531 | AB298: 503 | AC298: 105.56660039761431 | AD298: 20
A299: OAKLEIGH | C299: LYON 4 | F299: SHERIDAN 3 | I299: BEARD | K299: DOWDELL | M299: JORDAN | W299: BRUNSWICK | X299: 5 | Y299: 2 | Z299: 0 | AA299: 527 | AB299: 530 | AC299: 99.433962264150949 | AD299: 20
E300: 30TH MAY | J300: WEATHER
A301: SANDRINGHAM | C301: 4 | D301: 2 | E301: =C301*6+D301 -> 26 | G301: 5 | H301: 2 | I301: =G301*6+H301 -> 32 | K301: 13 | L301: 8 | M301: =K301*6+L301 -> 86 | O301: 13 | P301: 10 | Q301: =O301*6+P301 -> 88 | S301: DANDENONG | W301: PORT MELBOURNE | X301: 4 | Y301: 3 | Z301: 0 | AA301: 685 | AB301: 385 | AC301: 177.92207792207793 | AD301: 16
A302: DANDENONG | C302: 1 | D302: 0 | E302: =C302*6+D302 -> 6 | G302: 7 | H302: 6 | I302: =G302*6+H302 -> 48 | K302: 10 | L302: 6 | M302: =K302*6+L302 -> 66 | O302: 12 | P302: 10 | Q302: =O302*6+P302 -> 82 | S302: FLANAGAN | W302: YARRAVILLE | X302: 3 | Y302: 4 | Z302: 0 | AA302: 646 | AB302: 662 | AC302: 97.583081570996981 | AD302: 12
A303: BEST PLAYERS | W303: WILLIAMSTOWN | X303: 3 | Y303: 4 | Z303: 0 | AA303: 494 | AB303: 547 | AC303: 90.310786106032907 | AD303: 12
A304: SANDRINGHAM | C304: GRANGER | F304: PETERS | I304: ZEUSCHNER | L304: O'TOOLE | O304: HARRISON | R304: HOAR | W304: OAKLEIGH | X304: 2 | Y304: 5 | Z304: 0 | AA304: 389 | AB304: 498 | AC304: 78.112449799196781 | AD304: 8
A305: DANDENONG | C305: McMILLAN | F305: PENNEFATHER | I305: ARNOLD | L305: SHINNERS | O305: OSBORNE | R305: ABRAHAM | W305: GEELONG WEST | X305: 1 | Y305: 6 | Z305: 0 | AA305: 425 | AB305: 731 | AC305: 58.139534883720927 | AD305: 4
A306: GOALKICKERS | W306: COBURG | X306: 0 | Y306: 7 | Z306: 0 | AA306: 416 | AB306: 837 | AC306: 49.701314217443247 | AD306: 0
A307: SANDRINGHAM | C307: ZEUSCHNER 3 | F307: SMART 3 | I307: O'TOOLE 2 | L307: MACKENZIE 2 | O307: OAKLEY 2 | R307: BURNS
A308: DANDENONG | C308: ARNOLD 3 | F308: McNAMARA 2 | I308: LIENERT | K308: SUTTON | M308: STAUNTON | O308: PIVETTA | Q308: ABRAHAM | S308: McMILLAN | V308: KENT
A310: PORT MELBOURNE | C310: 5 | D310: 3 | E310: =C310*6+D310 -> 33 | G310: 11 | H310: 10 | I310: =G310*6+H310 -> 76 | K310: 14 | L310: 13 | M310: =K310*6+L310 -> 97 | O310: 18 | P310: 19 | Q310: =O310*6+P310 -> 127 | S310: PORT MELBOURNE
A311: COBURG | C311: 1 | D311: 5 | E311: =C311*6+D311 -> 11 | G311: 2 | H311: 6 | I311: =G311*6+H311 -> 18 | K311: 5 | L311: 7 | M311: =K311*6+L311 -> 37 | O311: 8 | P311: 8 | Q311: =O311*6+P311 -> 56 | S311: McMASTER
A312: BEST PLAYERS
A313: PORT MELBOURNE | C313: CROSHER | F313: EVANS | I313: CARLILE | L313: RENOUF | O313: MITHEN | Q313: TAGGART
A314: COBURG | C314: McNABB | F314: HANSEN | I314: ACKLAND | L314: CHALLENGER | O314: WELSH | Q314: PARTRIDGE
A315: GOALKICKERS
A316: PORT MELBOURNE | C316: CARLILE 7 | F316: BROWNHILL 3 | I316: TAGGART 2 | L316: CAULFIELD 2 | O316: TATE | Q316: RENOUF | S316: MITHEN | U316: BEDFORD
A317: COBURG | C317: CHALLENGER 3 | F317: McGROTTY 2 | I317: ACKLAND | L317: E MURRAY | O317: MIDDLEMO
C318: 5TH JUNE | J318: WEATHER | M318: NO WIND DULL
A319: WAVERLEY | C319: 2 | D319: 4 | E319: =C319*6+D319 -> 16 | G319: 6 | H319: 7 | I319: =G319*6+H319 -> 43 | K319: 12 | L319: 13 | M319: =K319*6+L319 -> 85 | O319: 19 | P319: 13 | Q319: =O319*6+P319 -> 127 | S319: WAVERLEY
A320: YARRAVILLE | C320: 4 | D320: 3 | E320: =C320*6+D320 -> 27 | G320: 9 | H320: 5 | I320: =G320*6+H320 -> 59 | K320: 12 | L320: 6 | M320: =K320*6+L320 -> 78 | O320: 14 | P320: 11 | Q320: =O320*6+P320 -> 95 | S320: CHAPLIN
A321: BEST PLAYERS
A322: WAVERLEY | C322: ROLFE | F322: MERRETT | I322: LAWSON | L322: POORE | O322: JONES | R322: BREWSTER
A323: YARRAVILLE | C323: WARWICK | F323: KNOTT | I323: EDWARDS | L323: RON BROWN | O323: MADIGAN | R323: FELL
A324: GOALKICKERS
A325: WAVERLEY | C325: MERRETT 5 | F325: BREWSTER 4 | I325: LAWSON 3 | L325: ELLIS 2 | N325: MITHEN | P325: MUNN | R325: JONES | T325: LOCKWOOD | X325: POORE
A326: YARRAVILLE | C326: MADIGAN 4 | F326: RON BROWN 3 | I326: ROWE 2 | K326: MEDDINGS | N326: CONNELLY | Q326: WARWICK | S326: QUARANTOTTO | W326: SIKORA
E327: 6TH JUNE | J327: WEATHER | M327: NORTH WEST WIND
A328: WILLIAMSTOWN | C328: 2 | D328: 3 | E328: =C328*6+D328 -> 15 | G328: 11 | H328: 6 | I328: =G328*6+H328 -> 72 | K328: 12 | L328: 7 | M328: =K328*6+L328 -> 79 | O328: 15 | P328: 16 | Q328: =O328*6+P328 -> 106 | S328: WILLIAMSTOWN
A329: GEELONG WEST | C329: 2 | D329: 4 | E329: =C329*6+D329 -> 16 | G329: 2 | H329: 4 | I329: =G329*6+H329 -> 16 | K329: 6 | L329: 9 | M329: =K329*6+L329 -> 45 | O329: 10 | P329: 10 | Q329: =O329*6+P329 -> 70 | S329: DIXON
A330: BEST PLAYERS
A331: WILLIAMSTOWN | C331: JENKINSON | F331: GRAHAM | I331: WARE | L331: WALLACE | O331: CLOUGH | R331: MURRIE
A332: GEELONG WEST | C332: NICHOLLS | F332: WILLIAMS | I332: BELL | L332: LONG | O332: HOLLEY | R332: GROVES
A333: GOALKICKERS
A334: WILLIAMSTOWN | C334: JENKINSON 5 | F334: REES 4 | H334: SAVIGE 2 | J334: GRAHAM 2 | M334: WARD | O334: BRYANT
A335: GEELONG WEST | C335: HOLLEY 4 | F335: GROVES 2 | I335: WILLIAMS | L335: MACKAY | N335: HOPE | P335: LONG
A337: ROUND 8 | E337: 13TH JUNE | M337: WEATHER | S337: PLAYED AT
D338: 1ST QTR | H338: 2ND QTR | L338: 3RD QTR | P338: FINAL | S338: DANDENONG
A339: DANDENONG | C339: 8 | D339: 1 | E339: =C339*6+D339 -> 49 | G339: 9 | H339: 5 | I339: =G339*6+H339 -> 59 | K339: 13 | L339: 9 | M339: =K339*6+L339 -> 87 | O339: 15 | P339: 14 | Q339: =O339*6+P339 -> 104 | S339: UMPIRE | X339: LADDER | AB339: ROUND | AD339: 8
A340: BRUNSWICK | C340: 3 | D340: 0 | E340: =C340*6+D340 -> 18 | G340: 7 | H340: 4 | I340: =G340*6+H340 -> 46 | K340: 8 | L340: 6 | M340: =K340*6+L340 -> 54 | O340: 11 | P340: 7 | Q340: =O340*6+P340 -> 73 | S340: ROWE
A341: BEST PLAYERS | W341: TEAM | X341: W | Y341: L | Z341: D | AA341: FOR | AB341: AGST | AC341: % | AD341: PTS
A342: DANDENONG | C342: McMILLAN | F342: STAUNTON | I342: KENT | K342: CROWE | N342: SHINNERS | P342: GRAVENER
A343: BRUNSWICK | C343: ROBBINS | F343: ROBINSON | I343: DACEY | K343: McKINNON | N343: COOK | P343: DARBY | W343: DANDENONG | X343: 7 | Y343: 1 | Z343: 0 | AA343: 807 | AB343: 456 | AC343: 176.97368421052633 | AD343: 28
A344: GOALKICKERS | W344: SANDRINGHAM | X344: 7 | Y344: 1 | Z344: 0 | AA344: 773 | AB344: 495 | AC344: 156.16161616161617 | AD344: 28
A345: DANDENONG | C345: McMILLAN 4 | F345: WHALEBONE 3 | I345: CROWE 3 | K345: KENT 2 | M345: LIENERT | O345: McNAMARA | R345: STAUNTON | W345: WAVERLEY | X345: 5 | Y345: 3 | Z345: 0 | AA345: 619 | AB345: 608 | AC345: 101.80921052631579 | AD345: 20
A346: BRUNSWICK | C346: DACEY 5 | F346: COOK 3 | H346: DARBY | J346: LEYDIN | L346: DENTON | W346: BRUNSWICK | X346: 5 | Y346: 3 | Z346: 0 | AA346: 600 | AB346: 634 | AC346: 94.637223974763401 | AD346: 20
A348: SANDRINGHAM | C348: 1 | D348: 3 | E348: =C348*6+D348 -> 9 | G348: 3 | H348: 9 | I348: =G348*6+H348 -> 27 | K348: 6 | L348: 12 | M348: =K348*6+L348 -> 48 | O348: 12 | P348: 17 | Q348: =O348*6+P348 -> 89 | S348: BEACH ROAD | W348: PORT MELBOURNE | X348: 4 | Y348: 4 | Z348: 0 | AA348: 756 | AB348: 474 | AC348: 159.49367088607596 | AD348: 16
A349: PORT MELBOURNE | C349: 3 | D349: 4 | E349: =C349*6+D349 -> 22 | G349: 6 | H349: 6 | I349: =G349*6+H349 -> 42 | K349: 10 | L349: 8 | M349: =K349*6+L349 -> 68 | O349: 10 | P349: 11 | Q349: =O349*6+P349 -> 71 | S349: DIXON | W349: YARRAVILLE | X349: 4 | Y349: 4 | Z349: 0 | AA349: 747 | AB349: 745 | AC349: 100.26845637583892 | AD349: 16
A350: BEST PLAYERS | W350: WILLIAMSTOWN | X350: 3 | Y350: 5 | Z350: 0 | AA350: 577 | AB350: 648 | AC350: 89.043209876543216 | AD350: 12
A351: SANDRINGHAM | C351: OAKLEY | F351: PETERS | I351: GRANGER | L351: MACKENZIE | O351: SELLECK | R351: MUTER | W351: OAKLEIGH | X351: 2 | Y351: 6 | Z351: 0 | AA351: 467 | AB351: 597 | AC351: 78.224455611390283 | AD351: 8
A352: PORT MELBOURNE | C352: TAGGART | F352: BOWEN | I352: CARLILE | L352: HOWELL | O352: BEDFORD | R352: CAULFIELD | W352: GEELONG WEST | X352: 2 | Y352: 6 | Z352: 0 | AA352: 530 | AB352: 819 | AC352: 64.713064713064711 | AD352: 8
A353: GOALKICKERS | W353: COBURG | X353: 1 | Y353: 7 | Z353: 0 | AA353: 515 | AB353: 915 | AC353: 56.284153005464482 | AD353: 4
A354: SANDRINGHAM | C354: OAKLEY 4 | F354: MACKENZIE 2 | I354: DIXON 2 | K354: VAUGHAN | M354: SMART | O354: MERRETT | Q354: HIRST
A355: PORT MELBOURNE | C355: TATE 2 | F355: CARLILE 2 | I355: MILNER 2 | K355: BEDFORD 2 | N355: JEFFREY | P355: CAULFIELD
A357: YARRAVILLE | C357: 7 | D357: 4 | E357: =C357*6+D357 -> 46 | G357: 11 | H357: 6 | I357: =G357*6+H357 -> 72 | K357: 14 | L357: 11 | M357: =K357*6+L357 -> 95 | O357: 14 | P357: 17 | Q357: =O357*6+P357 -> 101 | S357: WILLIAMSTOWN
A358: WILLIAMSTOWN | C358: 1 | D358: 2 | E358: =C358*6+D358 -> 8 | G358: 4 | H358: 8 | I358: =G358*6+H358 -> 32 | K358: 7 | L358: 10 | M358: =K358*6+L358 -> 52 | O358: 11 | P358: 17 | Q358: =O358*6+P358 -> 83 | S358: POLLARD
A359: BEST PLAYERS
A360: YARRAVILLE | C360: MADIGAN | F360: MEDDINGS | I360: SELL | L360: CONNELLY | O360: WARWICK | R360: WILSON
A361: WILLIAMSTOWN | C361: JENKINSON | F361: BRYANT | I361: RUSSELL | L361: BOYD | O361: MURRIE | R361: JAMES
A362: GOALKICKERS
A363: YARRAVILLE | C363: MADIGAN 3 | F363: CONNELLY 3 | I363: QUARANTOTTO 3 | M363: MEDDINGS | O363: KNOTT | Q363: ROWE | R363: CURRIE | T363: WILSON
A364: WILLIAMSTOWN | C364: JENKINSON 3 | F364: ROGAN 2 | I364: BRYANT 2 | L364: SUMMERS | N364: BOYD | P364: GRAHAM | R364: CLOUGH
A366: COBURG | C366: 2 | D366: 2 | E366: =C366*6+D366 -> 14 | G366: 7 | H366: 8 | I366: =G366*6+H366 -> 50 | K366: 7 | L366: 11 | M366: =K366*6+L366 -> 53 | O366: 14 | P366: 15 | Q366: =O366*6+P366 -> 99 | S366: PORT MELBOURNE
A367: OAKLEIGH | C367: 3 | D367: 3 | E367: =C367*6+D367 -> 21 | G367: 7 | H367: 4 | I367: =G367*6+H367 -> 46 | K367: 8 | L367: 15 | M367: =K367*6+L367 -> 63 | O367: 10 | P367: 18 | Q367: =O367*6+P367 -> 78 | S367: FLANAGAN
A368: BEST PLAYERS
A369: COBURG | C369: CHALLENGER | F369: CLEMENTS | I369: KEEFER | L369: GRAHAM | O369: HICKS | Q369: PLANT
A370: OAKLEIGH | C370: WOOD | F370: LOTHIAN | I370: HAINING | L370: SHERIDAN | O370: KITTO | Q370: LYON
A371: GOALKICKERS
A372: COBURG | C372: CHALLENGER 3 | F372: WELSH 2 | I372: HILL 2 | K372: KEEFER 2 | M372: McGROTTY 2 | P372: GRAHAM | R372: ROCHOW | U372: FITZPATRICK
A373: OAKLEIGH | C373: DOWDELL 3 | F373: McLAREN 2 | I373: SHERIDAN | L373: BEARD | N373: BOWEN | P373: JORDAN | R373: DEFTEROUS
E374: 14TH JUNE | J374: WEATHER | M374: FINE
A375: GEELONG WEST | C375: 3 | D375: 1 | E375: =C375*6+D375 -> 19 | G375: 6 | H375: 1 | I375: =G375*6+H375 -> 37 | K375: 11 | L375: 3 | M375: =K375*6+L375 -> 69 | O375: 16 | P375: 9 | Q375: =O375*6+P375 -> 105 | S375: GEELONG WEST
A376: WAVERLEY | C376: 4 | D376: 1 | E376: =C376*6+D376 -> 25 | G376: 5 | H376: 6 | I376: =G376*6+H376 -> 36 | K376: 11 | L376: 8 | M376: =K376*6+L376 -> 74 | O376: 13 | P376: 10 | Q376: =O376*6+P376 -> 88 | S376: HENDERSON
A377: BEST PLAYERS
A378: GEELONG WEST | C378: LONG | F378: GOGGIN | I378: EDWARDS | L378: BELL | O378: HOLLEY | R378: SOUTHERN
A379: WAVERLEY | C379: POORE | F379: INNES | I379: ELLIS | L379: SMITH | O379: BREWSTER | R379: GREEN
A380: GOALKICKERS
A381: GEELONG WEST | C381: GOGGIN 4 | F381: HOLLEY 3 | I381: MACKAY 3 | L381: LONG 2 | N381: EDWARDS 2 | Q381: CASEY | S381: GROVES
A382: WAVERLEY | C382: BREWSTER 4 | F382: ELLIS 4 | H382: LAWSON 2 | K382: MERRETT | M382: MITHEN | O382: JONES
A384: ROUND 9 | E384: 19TH JUNE | J384: WEATHER | M384: LIGHT NORTH WIND DULL CLOUDY | S384: PLAYED AT
D385: 1ST QTR | H385: 2ND QTR | L385: 3RD QTR | P385: FINAL | S385: BRUNSWICK
A386: BRUNSWICK | C386: 2 | D386: 2 | E386: =C386*6+D386 -> 14 | G386: 4 | H386: 7 | I386: =G386*6+H386 -> 31 | K386: 7 | L386: 8 | M386: =K386*6+L386 -> 50 | O386: 11 | P386: 13 | Q386: =O386*6+P386 -> 79 | S386: UMPIRE | X386: LADDER | AB386: ROUND | AD386: 9
A387: WILLIAMSTOWN | C387: 1 | D387: 7 | E387: =C387*6+D387 -> 13 | G387: 2 | H387: 7 | I387: =G387*6+H387 -> 19 | K387: 5 | L387: 9 | M387: =K387*6+L387 -> 39 | O387: 6 | P387: 10 | Q387: =O387*6+P387 -> 46 | S387: CHAPLIN
A388: BEST PLAYERS | W388: TEAM | X388: W | Y388: L | Z388: D | AA388: FOR | AB388: AGST | AC388: % | AD388: PTS
A389: BRUNSWICK | C389: DENTON | F389: BIBBY | I389: ROBINSON | L389: LEYDIN | N389: ROBBINS | Q389: McKINNON
A390: WILLIAMSTOWN | C390: EVANS | F390: JAMES | I390: WALLACE | L390: SAVIGE | N390: RUSSELL | Q390: MURRIE | W390: DANDENONG | X390: 7 | Y390: 2 | Z390: 0 | AA390: 841 | AB390: 565 | AC390: 148.84955752212389 | AD390: 28
A391: GOALKICKERS | W391: SANDRINGHAM | X391: 7 | Y391: 2 | Z391: 0 | AA391: 866 | AB391: 596 | AC391: 145.30201342281879 | AD391: 28
A392: BRUNSWICK | C392: PENDLEBURY 3 | F392: DENTON 2 | I392: McKINNON (2) | L392: KICK | N392: WICKS | P392: DARBY | R392: DACEY | W392: WAVERLEY | X392: 6 | Y392: 3 | Z392: 0 | AA392: 732 | AB392: 663 | AC392: 110.40723981900453 | AD392: 24
A393: WILLIAMSTOWN | C393: ROGAN 2 | F393: SAVIGE | H393: BOYD | J393: O'TOOLE | L393: WILLIAMS | W393: BRUNSWICK | X393: 6 | Y393: 3 | Z393: 0 | AA393: 679 | AB393: 680 | AC393: 99.852941176470594 | AD393: 24
A395: OAKLEIGH | C395: 3 | D395: 1 | E395: =C395*6+D395 -> 19 | G395: 6 | H395: 9 | I395: =G395*6+H395 -> 45 | K395: 9 | L395: 9 | M395: =K395*6+L395 -> 63 | O395: 14 | P395: 14 | Q395: =O395*6+P395 -> 98 | S395: OAKLEIGH | W395: PORT MELBOURNE | X395: 5 | Y395: 4 | Z395: 0 | AA395: 865 | AB395: 508 | AC395: 170.2755905511811 | AD395: 20
A396: GEELONG WEST | C396: 2 | D396: 0 | E396: =C396*6+D396 -> 12 | G396: 2 | H396: 3 | I396: =G396*6+H396 -> 15 | K396: 5 | L396: 6 | M396: =K396*6+L396 -> 36 | O396: 6 | P396: 8 | Q396: =O396*6+P396 -> 44 | S396: GANNON | W396: YARRAVILLE | X396: 5 | Y396: 4 | Z396: 0 | AA396: 848 | AB396: 838 | AC396: 101.19331742243436 | AD396: 20
A397: BEST PLAYERS | W397: OAKLEIGH | X397: 3 | Y397: 6 | Z397: 0 | AA397: 565 | AB397: 641 | AC397: 88.143525741029634 | AD397: 12
A398: OAKLEIGH | C398: LOTHIAN | F398: LUFF | I398: CRAWFORD | L398: BEARD | O398: DOWDELL | R398: LYON | W398: WILLIAMSTOWN | X398: 3 | Y398: 6 | Z398: 0 | AA398: 623 | AB398: 727 | AC398: 85.694635488308109 | AD398: 12
A399: GEELONG WEST | C399: NICHOLLS | F399: STACEY | I399: ZAITZ | L399: COLTISH | O399: WILLIAMS | R399: GROVES | W399: GEELONG WEST | X399: 2 | Y399: 7 | Z399: 0 | AA399: 574 | AB399: 917 | AC399: 62.595419847328245 | AD399: 8
A400: GOALKICKERS | W400: COBURG | X400: 1 | Y400: 8 | Z400: 0 | AA400: 570 | AB400: 1028 | AC400: 55.447470817120625 | AD400: 4
A401: OAKLEIGH | C401: LOTHIAN 4 | F401: DOWDELL 3 | I401: CRAWFORD 3 | L401: LYON 2 | N401: DANN | P401: BEARD
A402: GEELONG WEST | C402: LONG | E402: STACEY | G402: WILLIAMS | J402: RAEBURN | M402: GROVES | O402: WHITE
A404: WAVERLEY | C404: 2 | D404: 3 | E404: =C404*6+D404 -> 15 | G404: 7 | H404: 7 | I404: =G404*6+H404 -> 49 | K404: 9 | L404: 11 | M404: =K404*6+L404 -> 65 | O404: 16 | P404: 17 | Q404: =O404*6+P404 -> 113 | S404: WAVERLEY
A405: COBURG | C405: 3 | D405: 1 | E405: =C405*6+D405 -> 19 | G405: 3 | H405: 2 | I405: =G405*6+H405 -> 20 | K405: 6 | L405: 12 | M405: =K405*6+L405 -> 48 | O405: 7 | P405: 13 | Q405: =O405*6+P405 -> 55 | S405: ROWE
A406: BEST PLAYERS
A407: WAVERLEY | C407: BREWSTER | F407: POORE | I407: BRENCHLEY | L407: VARLAMOS | O407: INNES | Q407: ROLFE
A408: COBURG | C408: CLEMENTS | F408: HICKS | I408: GRAHAM | L408: KEEFER | O408: ROWE | Q408: PLANT
A409: GOALKICKERS
A410: WAVERLEY | C410: BREWSTER 7 | F410: JONES 2 | I410: MERRETT 2 | L410: LOCKWOOD 2 | O410: POORE | Q410: BRENCHLEY | T410: SMITH
A411: COBURG | C411: HILL 2 | F411: WELSH 2 | I411: GRAHAM | K411: McGROTTY | N411: CLEMENTS
D412: 20TH JUNE
A413: PORT MELBOURNE | C413: 3 | D413: 6 | E413: =C413*6+D413 -> 24 | G413: 9 | H413: 10 | I413: =G413*6+H413 -> 64 | K413: 13 | L413: 10 | M413: =K413*6+L413 -> 88 | O413: 16 | P413: 13 | Q413: =O413*6+P413 -> 109 | S413: PORT MELBOURNE
A414: DANDENONG | C414: 2 | D414: 0 | E414: =C414*6+D414 -> 12 | G414: 3 | H414: 3 | I414: =G414*6+H414 -> 21 | K414: 3 | L414: 7 | M414: =K414*6+L414 -> 25 | O414: 4 | P414: 10 | Q414: =O414*6+P414 -> 34 | S414: JACKSON
A415: BEST PLAYERS
A416: PORT MELBOURNE | C416: BRAGG | F416: HOWELL | I416: MITHEN | L416: BROWNHILL | O416: HOUSE | R416: BEDFORD
A417: DANDENONG | C417: SHINNERS | F417: KENT | I417: ABRAHAM | L417: ARNOLD | O417: PENNEFATHER | R417: REEVE
A418: GOALKICKERS
A419: PORT MELBOURNE | C419: CARLILE 5 | F419: BROWNHILL 3 | I419: HOWELL 3 | L419: TAGGART 2 | O419: MITHEN | Q419: MILNER | S419: BEDFORD
A420: DANDENONG | C420: LIENERT | F420: KENT | H420: ABRAHAM | K420: REEVE
A422: YARRAVILLE | C422: 1 | D422: 0 | E422: =C422*6+D422 -> 6 | G422: 7 | H422: 6 | I422: =G422*6+H422 -> 48 | K422: 8 | L422: 9 | M422: =K422*6+L422 -> 57 | O422: 14 | P422: 17 | Q422: =O422*6+P422 -> 101 | S422: YARRAVILLE
A423: SANDRINGHAM | C423: 4 | D423: 6 | E423: =C423*6+D423 -> 30 | G423: 5 | H423: 9 | I423: =G423*6+H423 -> 39 | K423: 9 | L423: 14 | M423: =K423*6+L423 -> 68 | O423: 13 | P423: 15 | Q423: =O423*6+P423 -> 93 | S423: McMASTER
A424: BEST PLAYERS
A425: YARRAVILLE | C425: CONNELLY | F425: MEDDINGS | I425: RON BROWN | L425: SELL | O425: MADIGAN | R425: HENDERSON
A426: SANDRINGHAM | C426: HANCE | F426: O'TOOLE | I426: OAKLEY | L426: VAUGHAN | O426: WILLS | R426: ZEUSCHNER
A427: GOALKICKERS
A428: YARRAVILLE | C428: CONNELLY 3 | F428: MADIGAN 3 | I428: ROWE 2 | K428: SIKORA 2 | M428: QUARANTOTTO 2 | Q428: MEDDINGS | T428: RON BROWN
A429: SANDRINGHAM | C429: OAKLEY 3 | F429: WILLS 3 | I429: O'TOOLE 3 | L429: ZEUSCHNER 2 | O429: VAUGHAN | Q429: HANCE
A431: ROUND 10 | C431: 26TH JUNE | J431: WEATHER | M431: NO WIND FOGGY COLD | S431: PLAYED AT
D432: 1ST QTR | H432: 2ND QTR | L432: 3RD QTR | P432: FINAL | S432: DANDENONG
A433: DANDENONG | C433: 3 | D433: 4 | E433: =C433*6+D433 -> 22 | G433: 10 | H433: 6 | I433: =G433*6+H433 -> 66 | K433: 14 | L433: 8 | M433: =K433*6+L433 -> 92 | O433: 17 | P433: 18 | Q433: =O433*6+P433 -> 120 | S433: UMPIRE | X433: LADDER | AB433: ROUND | AD433: 10
A434: WAVERLEY | C434: 3 | D434: 4 | E434: =C434*6+D434 -> 22 | G434: 6 | H434: 8 | I434: =G434*6+H434 -> 44 | K434: 10 | L434: 9 | M434: =K434*6+L434 -> 69 | O434: 12 | P434: 9 | Q434: =O434*6+P434 -> 81 | S434: McMASTER
A435: BEST PLAYERS | W435: TEAM | X435: W | Y435: L | Z435: D | AA435: FOR | AB435: AGST | AC435: % | AD435: PTS
A436: DANDENONG | C436: ARNOLD | F436: McMILLAN | I436: SHINNERS | L436: PIVETTA | O436: KENT | Q436: McNAMARA
A437: WAVERLEY | C437: POORE | F437: BRENCHLEY | I437: SMITH | L437: VARLAMOS | O437: GREEN | Q437: LAWSON | W437: DANDENONG | X437: 8 | Y437: 2 | Z437: 0 | AA437: 961 | AB437: 646 | AC437: 148.76160990712074 | AD437: 32
A438: GOALKICKERS | W438: SANDRINGHAM | X438: 8 | Y438: 2 | Z438: 0 | AA438: 944 | AB438: 669 | AC438: 141.10612855007474 | AD438: 32
A439: DANDENONG | C439: McNAMARA 5 | F439: ABRAHAM 4 | I439: ARNOLD 2 | K439: WHALEBONE 2 | N439: SUTTON | P439: KENT | Q439: BARRAN | S439: REEVE | W439: BRUNSWICK | X439: 7 | Y439: 3 | Z439: 0 | AA439: 774 | AB439: 765 | AC439: 101.17647058823529 | AD439: 28
A440: WAVERLEY | C440: BREWSTER 5 | F440: LAWSON 4 | I440: BRENCHLEY 3 | W440: PORT MELBOURNE | X440: 6 | Y440: 4 | Z440: 0 | AA440: 978 | AB440: 574 | AC440: 170.38327526132403 | AD440: 24
E441: 27TH JUNE | J441: WEATHER | M441: FINE
A442: SANDRINGHAM | C442: 2 | D442: 5 | E442: =C442*6+D442 -> 17 | G442: 4 | H442: 13 | I442: =G442*6+H442 -> 37 | K442: 7 | L442: 21 | M442: =K442*6+L442 -> 63 | O442: 9 | P442: 24 | Q442: =O442*6+P442 -> 78 | S442: BEACH ROAD | W442: WAVERLEY | X442: 6 | Y442: 4 | Z442: 0 | AA442: 813 | AB442: 783 | AC442: 103.83141762452107 | AD442: 24
A443: OAKLEIGH | C443: 2 | D443: 0 | E443: =C443*6+D443 -> 12 | G443: 8 | H443: 7 | I443: =G443*6+H443 -> 55 | K443: 9 | L443: 11 | M443: =K443*6+L443 -> 65 | O443: 10 | P443: 13 | Q443: =O443*6+P443 -> 73 | S443: SCOTT | W443: YARRAVILLE | X443: 6 | Y443: 4 | Z443: 0 | AA443: 939 | AB443: 916 | AC443: 102.51 | AD443: 24
A444: BEST PLAYERS | W444: OAKLEIGH | X444: 3 | Y444: 7 | Z444: 0 | AA444: 638 | AB444: 719 | AC444: 88.734353268428379 | AD444: 12
A445: SANDRINGHAM | C445: HARRISON | F445: O'TOOLE | I445: OAKLEY | L445: PETERS | N445: SELLECK | Q445: HANCE | W445: WILLIAMSTOWN | X445: 3 | Y445: 7 | Z445: 0 | AA445: 689 | AB445: 840 | AC445: 82.023809523809518 | AD445: 12
A446: OAKLEIGH | C446: DEFTEROUS | F446: TURNER | I446: LUFF | L446: DANN | N446: BEARD | Q446: CRAWFORD | W446: GEELONG WEST | X446: 2 | Y446: 8 | Z446: 0 | AA446: 652 | AB446: 1008 | AC446: 64.68 | AD446: 8
A447: GOALKICKERS | W447: COBURG | X447: 1 | Y447: 9 | Z447: 0 | AA447: 655 | AB447: 1123 | AC447: 58.325912733748886 | AD447: 4
A448: SANDRINGHAM | C448: ZEUSCHNER 2 | F448: TREZISE 2 | I448: OAKLEY | K448: WILLS | M448: O'TOOLE | O448: MACKENZIE | R448: SMART
A449: OAKLEIGH | C449: CRAWFORD 3 | F449: SHERIDAN 2 | I449: LYON | K449: DOWDELL | M449: KITTO | O449: DANN | Q449: TURNER
A451: PORT MELBOURNE | C451: 5 | D451: 3 | E451: =C451*6+D451 -> 33 | G451: 8 | H451: 8 | I451: =G451*6+H451 -> 56 | K451: 12 | L451: 13 | M451: =K451*6+L451 -> 85 | O451: 16 | P451: 17 | Q451: =O451*6+P451 -> 113 | S451: WILLIAMSTOWN
A452: WILLIAMSTOWN | C452: 4 | D452: 0 | E452: =C452*6+D452 -> 24 | G452: 7 | H452: 1 | I452: =G452*6+H452 -> 43 | K452: 8 | L452: 5 | M452: =K452*6+L452 -> 53 | O452: 10 | P452: 6 | Q452: =O452*6+P452 -> 66 | S452: O'NEILL
A453: BEST PLAYERS
A454: PORT MELBOURNE | C454: HOUSE | F454: MITHEN | I454: TATE | L454: CAULFIELD | O454: KERR | R454: BRAGG
A455: WILLIAMSTOWN | C455: JAMES | F455: EVANS | I455: MURRIE | L455: SAVIGE | O455: JENKINSON | R455: JOHNSON
A456: GOALKICKERS
A457: PORT MELBOURNE | C457: CARLILE 3 | F457: HOWELL 3 | I457: MILNER 2 | K457: BRAGG 2 | M457: TATE 2 | O457: BROWNHILL 2 | R457: TAGGART | U457: MITHEN
A458: WILLIAMSTOWN | C458: SAVIGE 5 | F458: JENKINSON 2 | I458: BOYD | K458: DOOLEY | M458: MURRIE
A460: YARRAVILLE | C460: 4 | D460: 3 | E460: =C460*6+D460 -> 27 | G460: 7 | H460: 6 | I460: =G460*6+H460 -> 48 | K460: 12 | L460: 9 | M460: =K460*6+L460 -> 81 | O460: 13 | P460: 13 | Q460: =O460*6+P460 -> 91 | S460: GEELONG WEST
A461: GEELONG WEST | C461: 1 | D461: 4 | E461: =C461*6+D461 -> 10 | G461: 6 | H461: 10 | I461: =G461*6+H461 -> 46 | K461: 9 | L461: 11 | M461: =K461*6+L461 -> 65 | O461: 11 | P461: 12 | Q461: =O461*6+P461 -> 78 | S461: JACKSON
A462: BEST PLAYERS
A463: YARRAVILLE | C463: FELL | F463: RON BROWN | I463: WARWICK | L463: MEDDINGS | O463: KNOTT | Q463: MADIGAN
A464: GEELONG WEST | C464: SMITH | F464: NICHOLLS | I464: WILLIAMS | L464: RAEBURN | O464: OLIVER | Q464: BELL
A465: GOALKICKERS
A466: YARRAVILLE | C466: MADIGAN 3 | F466: CZAJOWSKI 2 | I466: KNOTT 2 | K466: CURRIE 2 | M466: CONNELLY 2 | P466: SIKORA 2
A467: GEELONG WEST | C467: RAEBURN 4 | F467: HOLLEY 3 | I467: GOGGIN 2 | K467: WILLIAMS | M467: SMITH
A469: BRUNSWICK | C469: 4 | D469: 3 | E469: =C469*6+D469 -> 27 | G469: 10 | H469: 5 | I469: =G469*6+H469 -> 65 | K469: 12 | L469: 9 | M469: =K469*6+L469 -> 81 | O469: 14 | P469: 11 | Q469: =O469*6+P469 -> 95 | S469: PORT MELBOURNE
A470: COBURG | C470: 1 | D470: 5 | E470: =C470*6+D470 -> 11 | G470: 5 | H470: 13 | I470: =G470*6+H470 -> 43 | K470: 7 | L470: 14 | M470: =K470*6+L470 -> 56 | O470: 11 | P470: 19 | Q470: =O470*6+P470 -> 85 | S470: DIXON
A471: BEST PLAYERS
A472: BRUNSWICK | C472: ROBINSON | F472: DENTON | I472: McKINNON | L472: DARBY | O472: BRIGLIA | Q472: COOK
A473: COBURG | C473: SULLIVAN | F473: CHALLENGER | I473: KEEFER | L473: McNABB | O473: HICKS | Q473: McGROTTY
A474: GOALKICKERS
A475: BRUNSWICK | C475: BURNS 3 | E475: DARBY 2 | G475: LEYDIN 2 | I475: PENDLEBURY 2 | L475: COOK | N475: BIBBY | P475: ROBBINS | R475: McKINNON | U475: DACEY
A476: COBURG | C476: CHALLENGER 4 | F476: McGROTTY 2 | I476: WELSH 2 | K476: McNABB | M476: GRAHAM | O476: E MURRAY
A478: ROUND 11 | D478: 3RD JULY | I478: WEATHER | L478: NORTH BREEZE FINE & SUNNY | S478: PLAYED AT
D479: 1ST QTR | H479: 2ND QTR | L479: 3RD QTR | P479: FINAL | S479: WAVERLEY
A480: WAVERLEY | C480: 3 | D480: 2 | E480: =C480*6+D480 -> 20 | G480: 8 | H480: 3 | I480: =G480*6+H480 -> 51 | K480: 14 | L480: 5 | M480: =K480*6+L480 -> 89 | O480: 15 | P480: 6 | Q480: =O480*6+P480 -> 96 | S480: UMPIRE | X480: LADDER | AB480: ROUND | AD480: 11
A481: WILLIAMSTOWN | C481: 0 | D481: 2 | E481: =C481*6+D481 -> 2 | G481: 4 | H481: 8 | I481: =G481*6+H481 -> 32 | K481: 7 | L481: 12 | M481: =K481*6+L481 -> 54 | O481: 10 | P481: 20 | Q481: =O481*6+P481 -> 80 | S481: JACKSON
A482: BEST PLAYERS | W482: TEAM | X482: W | Y482: L | Z482: D | AA482: FOR | AB482: AGST | AC482: % | AD482: PTS
A483: WAVERLEY | C483: POORE | E483: INNES | H483: HUDSON | K483: BRENCHLEY | N483: VARLAMOS | Q483: THOROGOOD
A484: WILLIAMSTOWN | C484: EVANS | E484: BOYD | H484: JAMES | K484: CLOUGH | N484: WARD | Q484: MURRIE | W484: DANDENONG | X484: 8 | Y484: 3 | Z484: 0 | AA484: 1016 | AB484: 721 | AC484: 140.91539528432733 | AD484: 32
A485: GOALKICKERS | W485: SANDRINGHAM | X485: 8 | Y485: 3 | Z485: 0 | AA485: 1011 | AB485: 808 | AC485: 125.12376237623762 | AD485: 32
A486: WAVERLEY | C486: BREWSTER 4 | F486: MUNN 3 | H486: MERRETT 2 | J486: BRENCHLEY 2 | M486: CHAPMAN | O486: LAWSON | Q486: ELLIS | R486: THOROGOOD | W486: BRUNSWICK | X486: 8 | Y486: 3 | Z486: 0 | AA486: 913 | AB486: 832 | AC486: 109.73557692307692 | AD486: 32
A487: WILLIAMSTOWN | C487: SAVIGE 5 | F487: JENKINSON 2 | I487: ROGAN | K487: JOHNSON | M487: CLOUGH | W487: PORT MELBOURNE | X487: 7 | Y487: 4 | Z487: 0 | AA487: 1162 | AB487: 628 | AC487: 185.03184713375796 | AD487: 28
A489: OAKLEIGH | C489: 4 | D489: 1 | E489: =C489*6+D489 -> 25 | G489: 5 | H489: 6 | I489: =G489*6+H489 -> 36 | K489: 9 | L489: 8 | M489: =K489*6+L489 -> 62 | O489: 10 | P489: 15 | Q489: =O489*6+P489 -> 75 | S489: OAKLEIGH | W489: WAVERLEY | X489: 7 | Y489: 4 | Z489: 0 | AA489: 909 | AB489: 863 | AC489: 105.33024333719582 | AD489: 28
A490: DANDENONG | C490: 0 | D490: 5 | E490: =C490*6+D490 -> 5 | G490: 1 | H490: 9 | I490: =G490*6+H490 -> 15 | K490: 6 | L490: 10 | M490: =K490*6+L490 -> 46 | O490: 7 | P490: 13 | Q490: =O490*6+P490 -> 55 | S490: CHAPLIN | W490: YARRAVILLE | X490: 7 | Y490: 4 | Z490: 0 | AA490: 1051 | AB490: 1018 | AC490: 103.24 | AD490: 28
A491: BEST PLAYERS | W491: OAKLEIGH | X491: 4 | Y491: 7 | Z491: 0 | AA491: 713 | AB491: 774 | AC491: 92.118863049095609 | AD491: 16
A492: OAKLEIGH | C492: WOOD | F492: DOWDELL | I492: TURNER | L492: POULTER | O492: BEARD | Q492: ADDISON | W492: WILLIAMSTOWN | X492: 3 | Y492: 8 | Z492: 0 | AA492: 769 | AB492: 936 | AC492: 82.158119658119659 | AD492: 12
A493: DANDENONG | C493: STAUNTON | F493: BARRAN | I493: McMILLAN | L493: SHINNERS | O493: SUTTON | Q493: ABRAHAM | W493: GEELONG WEST | X493: 2 | Y493: 9 | Z493: 0 | AA493: 706 | AB493: 1192 | AC493: 59.23 | AD493: 8
A494: GOALKICKERS | W494: COBURG | X494: 1 | Y494: 10 | Z494: 0 | AA494: 757 | AB494: 1235 | AC494: 61.295546558704451 | AD494: 4
A495: OAKLEIGH | C495: JORDAN 2 | F495: DANN 2 | H495: KITTO 2 | J495: SHERIDAN | M495: RYAN | N495: CRAWFORD | Q495: MAUGHAN
A496: DANDENONG | C496: SUTTON 2 | F496: ABRAHAM 2 | I496: WHALEBONE | L496: KENT | N496: CROWE
E497: 4TH JULY | M497: WEATHER | Q497: FINE
A498: BRUNSWICK | C498: 5 | D498: 3 | E498: =C498*6+D498 -> 33 | G498: 13 | H498: 9 | I498: =G498*6+H498 -> 87 | K498: 18 | L498: 11 | M498: =K498*6+L498 -> 119 | O498: 21 | P498: 13 | Q498: =O498*6+P498 -> 139 | S498: BRUNSWICK
A499: SANDRINGHAM | C499: 2 | D499: 4 | E499: =C499*6+D499 -> 16 | G499: 4 | H499: 5 | I499: =G499*6+H499 -> 29 | K499: 7 | L499: 13 | M499: =K499*6+L499 -> 55 | O499: 8 | P499: 19 | Q499: =O499*6+P499 -> 67 | S499: POLLARD
A500: BEST PLAYERS
A501: BRUNSWICK | C501: BIBBY | F501: ROBBINS | I501: BURNS | L501: PENDLEBURY | O501: AYRES | R501: COOK
A502: SANDRINGHAM | C502: GRANGER | F502: HARRISON | I502: ZEUSCHNER | L502: REZISE | O502: OAKLEY | R502: VAUGHAN
A503: GOALKICKERS
A504: BRUNSWICK | C504: COOK 5 | E504: BURNS 3 | G504: PENDLEBURY 3 | J504: DARBY 2 | M504: LEYDIN 2 | O504: McKINNON 2 | R504: DENTON | T504: DACEY | V504: WHILEY | X504: WROUT
A505: SANDRINGHAM | C505: O'TOOLE 2 | F505: ZEUSCHNER 2 | I505: MACKENZIE 2 | L505: BURNS | N505: HARRISON
A507: YARRAVILLE | C507: 5 | D507: 5 | E507: =C507*6+D507 -> 35 | G507: 8 | H507: 7 | I507: =G507*6+H507 -> 55 | K507: 11 | L507: 11 | M507: =K507*6+L507 -> 77 | O507: 16 | P507: 16 | Q507: =O507*6+P507 -> 112 | S507: YARRAVILLE
A508: COBURG | C508: 3 | D508: 0 | E508: =C508*6+D508 -> 18 | G508: 8 | H508: 3 | I508: =G508*6+H508 -> 51 | K508: 10 | L508: 4 | M508: =K508*6+L508 -> 64 | O508: 16 | P508: 6 | Q508: =O508*6+P508 -> 102 | S508: O'NEILL
A509: BEST PLAYERS
A510: YARRAVILLE | C510: RON BROWN | F510: WRIGHT | I510: MADIGAN | L510: MEDDINGS | O510: MURRAY | R510: ROACHE
A511: COBURG | C511: KEEFER | F511: GRAHAM | I511: BRANSTON | L511: CLEMENTS | O511: TANCREDI | R511: HICKS
A512: GOALKICKERS
A513: YARRAVILLE | C513: MEDDINGS 4 | F513: MADIGAN 3 | I513: CZAKOWSKI 3 | L513: ROACHE 2 | O513: KNOTT | Q513: RON BROWN | T513: WILSON | W513: QUARANTOTTO
A514: COBURG | C514: BRANSTON 6 | F514: GRAHAM 4 | I514: CHALLENGER 3 | L514: SULLIVAN | O514: KEEFER | Q514: MURRAY
A516: PORT MELBOURNE | C516: 4 | D516: 2 | E516: =C516*6+D516 -> 26 | G516: 12 | H516: 8 | I516: =G516*6+H516 -> 80 | K516: 17 | L516: 12 | M516: =K516*6+L516 -> 114 | O516: 28 | P516: 16 | Q516: =O516*6+P516 -> 184 | S516: PORT MELBOURNE
A517: GEELONG WEST | C517: 2 | D517: 1 | E517: =C517*6+D517 -> 13 | G517: 2 | H517: 4 | I517: =G517*6+H517 -> 16 | K517: 6 | L517: 7 | M517: =K517*6+L517 -> 43 | O517: 7 | P517: 12 | Q517: =O517*6+P517 -> 54 | S517: FLANAGAN
A518: BEST PLAYERS
A519: PORT MELBOURNE | C519: MITHEN | F519: CARLILE | I519: TAGGART | L519: HOUSE | O519: GROVER | R519: BROWNHILL
A520: GEELONG WEST | C520: SMITH | F520: GOGGIN | I520: GROVES | L520: WILLIAMS | O520: OLVER | R520: BELL
A521: GOALKICKERS
A522: PORT MELBOURNE | C522: CARLILE 10 | F522: TAGGART 5 | I522: TATE 4 | K522: HOWELL 3 | N522: MILNER 3 | Q522: BEDFORD 2 | T522: BROWNHILL
A523: GEELONG WEST | C523: EDWARDS 2 | F523: BENNETT | I523: GOGGIN | K523: DUFF | M523: HOLLEY | O523: SMITH
A525: ROUND 12 | D525: 10TH JULY | I525: WEATHER | L525: NORTH BREEZE COLD | S525: PLAYED AT
D526: 1ST QTR | H526: 2ND QTR | L526: 3RD QTR | P526: FINAL | S526: PORT MELBOURNE
A527: PORT MELBOURNE | C527: 2 | D527: 2 | E527: =C527*6+D527 -> 14 | G527: 8 | H527: 6 | I527: =G527*6+H527 -> 54 | K527: 11 | L527: 8 | M527: =K527*6+L527 -> 74 | O527: 12 | P527: 15 | Q527: =O527*6+P527 -> 87 | S527: UMPIRE | X527: LADDER | AB527: ROUND | AD527: 12
A528: WAVERLEY | C528: 1 | D528: 5 | E528: =C528*6+D528 -> 11 | G528: 3 | H528: 8 | I528: =G528*6+H528 -> 26 | K528: 8 | L528: 9 | M528: =K528*6+L528 -> 57 | O528: 10 | P528: 12 | Q528: =O528*6+P528 -> 72 | S528: CHAPLIN
A529: BEST PLAYERS | W529: TEAM | X529: W | Y529: L | Z529: D | AA529: FOR | AB529: AGST | AC529: % | AD529: PTS
A530: PORT MELBOURNE | C530: HOWELL | F530: KERR | I530: HOUSE | L530: BRAGG | O530: RENOUF | R530: CASTLEHOW
A531: WAVERLEY | C531: MERRETT | F531: SMITH | I531: BRENCHLEY | L531: VARLAMOS | O531: ARNOTT | R531: POORE | W531: SANDRINGHAM | X531: 9 | Y531: 3 | Z531: 0 | AA531: 1138 | AB531: 857 | AC531: 132.78879813302217 | AD531: 36
A532: GOALKICKERS | W532: BRUNSWICK | X532: 9 | Y532: 3 | Z532: 0 | AA532: 1009 | AB532: 908 | AC532: 111.12334801762114 | AD532: 36
A533: PORT MELBOURNE | C533: HOWELL 4 | F533: MILNER 3 | I533: CARLILE 2 | L533: BROWNHILL 2 | O533: RENOUF | W533: PORT MELBOURNE | X533: 8 | Y533: 4 | Z533: 0 | AA533: 1249 | AB533: 700 | AC533: 178.42857142857142 | AD533: 32
A534: WAVERLEY | C534: MERRETT 3 | F534: BREWSTER 2 | I534: LAWSON 2 | L534: BRENCHLEY 2 | O534: MITHEN | W534: DANDENONG | X534: 8 | Y534: 4 | Z534: 0 | AA534: 1072 | AB534: 786 | AC534: 136.38676844783714 | AD534: 32
A536: YARRAVILLE | C536: 2 | D536: 4 | E536: =C536*6+D536 -> 16 | G536: 9 | H536: 12 | I536: =G536*6+H536 -> 66 | K536: 10 | L536: 13 | M536: =K536*6+L536 -> 73 | O536: 17 | P536: 22 | Q536: =O536*6+P536 -> 124 | S536: YARRAVILLE | W536: YARRAVILLE | X536: 8 | Y536: 4 | Z536: 0 | AA536: 1175 | AB536: 1078 | AC536: 109 | AD536: 32
A537: OAKLEIGH | C537: 4 | D537: 4 | E537: =C537*6+D537 -> 28 | G537: 6 | H537: 6 | I537: =G537*6+H537 -> 42 | K537: 8 | L537: 9 | M537: =K537*6+L537 -> 57 | O537: 8 | P537: 12 | Q537: =O537*6+P537 -> 60 | S537: POLLARD | W537: WAVERLEY | X537: 7 | Y537: 5 | Z537: 0 | AA537: 981 | AB537: 950 | AC537: 103.26315789473684 | AD537: 28
A538: BEST PLAYERS | W538: OAKLEIGH | X538: 4 | Y538: 8 | Z538: 0 | AA538: 773 | AB538: 898 | AC538: 86.080178173719375 | AD538: 16
A539: YARRAVILLE | C539: WARWICK | F539: MEDDINGS | I539: MADIGAN | L539: EDWARDS | O539: MURRAY | R539: KNOTT | W539: WILLIAMSTOWN | X539: 3 | Y539: 9 | Z539: 0 | AA539: 818 | AB539: 1063 | AC539: 76.952022577610535 | AD539: 12
A540: OAKLEIGH | C540: BEARD | F540: SHERIDAN | I540: HAINING | L540: DEFTEROUS | O540: JORDAN | R540: ADDISON | W540: COBURG | X540: 2 | Y540: 10 | Z540: 0 | AA540: 822 | AB540: 1291 | AC540: 63.671572424477148 | AD540: 8
A541: GOALKICKERS | Q541: WRIGHT | S541: KNOTT | W541: GEELONG WEST | X541: 2 | Y541: 10 | Z541: 0 | AA541: 782 | AB541: 1288 | AC541: 60.71 | AD541: 8
A542: YARRAVILLE | C542: CONNELLY 4 | F542: MADIGAN 4 | I542: CZAKOWSKI 3 | L542: MEDDINGS 2 | O542: RON BROWN | R542: MURRAY
A543: OAKLEIGH | C543: CRAWFORD 3 | F543: MAUGHAN 2 | I543: BEARD | K543: SHERIDAN | N543: KITTO
E544: 11TH JULY | J544: WEATHER | N544: NORTH WIND
A545: SANDRINGHAM | C545: 3 | D545: 4 | E545: =C545*6+D545 -> 22 | G545: 7 | H545: 9 | I545: =G545*6+H545 -> 51 | K545: 11 | L545: 12 | M545: =K545*6+L545 -> 78 | O545: 18 | P545: 19 | Q545: =O545*6+P545 -> 127 | S545: BEACH ROAD
A546: WILLIAMSTOWN | C546: 3 | D546: 2 | E546: =C546*6+D546 -> 20 | G546: 4 | H546: 3 | I546: =G546*6+H546 -> 27 | K546: 7 | L546: 6 | M546: =K546*6+L546 -> 48 | O546: 7 | P546: 7 | Q546: =O546*6+P546 -> 49 | S546: ROWE
A547: BEST PLAYERS
A548: SANDRINGHAM | C548: OAKLEY | F548: VAUGHAN | I548: AGHAN | L548: BURNS | O548: GLEESON | R548: PETERS
A549: WILLIAMSTOWN | C549: JENKINSON | F549: BOYD | I549: WALLACE | L549: CLOUGH | O549: RUSSELL | R549: JOHNSON
A550: GOALKICKERS
A551: SANDRINGHAM | C551: OAKLEY 9 | F551: VAUGHAN 2 | I551: HANCE | K551: O'TOOLE | M551: ZEUSCHNER | P551: GLEESON | R551: AGHAN | T551: BURNS | V551: DIXON
A552: WILLIAMSTOWN | C552: JOHNSON 3 | F552: JENKINSON | I552: SAVIGE | K552: BOYD | M552: MURRIE
A554: BRUNSWICK | C554: 5 | D554: 2 | E554: =C554*6+D554 -> 32 | G554: 6 | H554: 6 | I554: =G554*6+H554 -> 42 | K554: 10 | L554: 11 | M554: =K554*6+L554 -> 71 | O554: 14 | P554: 12 | Q554: =O554*6+P554 -> 96 | S554: GEELONG WEST
A555: GEELONG WEST | C555: 5 | D555: 2 | E555: =C555*6+D555 -> 32 | G555: 7 | H555: 5 | I555: =G555*6+H555 -> 47 | K555: 9 | L555: 7 | M555: =K555*6+L555 -> 61 | O555: 11 | P555: 10 | Q555: =O555*6+P555 -> 76 | S555: McMASTER
A556: BEST PLAYERS
A557: BRUNSWICK | C557: McKINNON | F557: ROBINSON | I557: BIBBY | L557: PENDLEBURY | O557: BURNS | R557: McKINLEY
A558: GEELONG WEST | C558: HELMER | F558: CROFT | I558: GOGGIN | L558: GROVES | O558: DUFF | R558: NICHOLLS
A559: GOALKICKERS
A560: BRUNSWICK | C560: DACEY 5 | F560: McKINNON 3 | I560: COOK 2 | K560: BURNS | M560: BRIGLIA | O560: PENDLEBURY | R560: McGRATH
A561: GEELONG WEST | C561: GOGGIN 4 | F561: CROFT 2 | I561: RAEBURN 2 | L561: HELMER | N561: DUFF | P561: GROVES
A563: COBURG | C563: 1 | D563: 1 | E563: =C563*6+D563 -> 7 | G563: 7 | H563: 5 | I563: =G563*6+H563 -> 47 | K563: 7 | L563: 8 | M563: =K563*6+L563 -> 50 | O563: 9 | P563: 11 | Q563: =O563*6+P563 -> 65 | S563: DANDENONG
A564: DANDENONG | C564: 5 | D564: 3 | E564: =C564*6+D564 -> 33 | G564: 5 | H564: 3 | I564: =G564*6+H564 -> 33 | K564: 6 | L564: 7 | M564: =K564*6+L564 -> 43 | O564: 8 | P564: 8 | Q564: =O564*6+P564 -> 56 | S564: JACKSON
A565: BEST PLAYERS
A566: COBURG | C566: PLANT | F566: CLEMENTS | I566: CHALLENGER | L566: KEEFER | O566: BRANSTON | R566: GIARDOOSI
A567: DANDENONG | C567: OSBORNE | F567: CROWE | I567: WHALEBONE | L567: PENNEFATHER | O567: KENT | R567: McMILLAN
A568: GOALKICKERS
A569: COBURG | C569: BRANSTON 4 | F569: McNABB 2 | I569: CHALLENGER 2 | L569: E MURRAY
A570: DANDENONG | C570: WHALEBONE 2 | F570: SUTTON | I570: MCNAMARA | L570: OSBORNE | N570: DELANTY | Q570: KENT | S570: MELAI
A572: ROUND 13 | D572: 24TH JULY | I572: WEATHER | L572: RAIN LIGHT BAD GROUNDS HEAVY | S572: PLAYED AT
D573: 1ST QTR | H573: 2ND QTR | L573: 3RD QTR | P573: FINAL | S573: OAKLEIGH
A574: OAKLEIGH | C574: 1 | D574: 5 | E574: =C574*6+D574 -> 11 | G574: 3 | H574: 6 | I574: =G574*6+H574 -> 24 | K574: 8 | L574: 7 | M574: =K574*6+L574 -> 55 | O574: 11 | P574: 8 | Q574: =O574*6+P574 -> 74 | S574: UMPIRE | X574: LADDER | AB574: ROUND | AD574: 13
A575: PORT MELBOURNE | C575: 1 | D575: 1 | E575: =C575*6+D575 -> 7 | G575: 6 | H575: 7 | I575: =G575*6+H575 -> 43 | K575: 9 | L575: 10 | M575: =K575*6+L575 -> 64 | O575: 10 | P575: 13 | Q575: =O575*6+P575 -> 73 | S575: JACKSON
A576: BEST PLAYERS | W576: TEAM | X576: W | Y576: L | Z576: D | AA576: FOR | AB576: AGST | AC576: % | AD576: PTS
A577: OAKLEIGH | C577: KITTO | F577: LUFF | I577: BEARD | L577: DEFTEROUS | O577: TURNER | Q577: SHERIDAN
A578: PORT MELBOURNE | C578: GROVER | F578: RENOUF | I578: CRUTCHFIELD | L578: HOUSE | O578: MITHEN | Q578: TATE | W578: BRUNSWICK | X578: 10 | Y578: 3 | Z578: 0 | AA578: 1070 | AB578: 964 | AC578: 110.99585062240664 | AD578: 40
A579: GOALKICKERS | W579: DANDENONG | X579: 9 | Y579: 4 | Z579: 0 | AA579: 1141 | AB579: 850 | AC579: 134.23529411764707 | AD579: 36
A580: OAKLEIGH | C580: LYON 4 | E580: JONES 2 | G580: SHERIDAN | I580: LOTHIAN | K580: DOWDELL | M580: DANN | O580: JORDAN | W580: SANDRINGHAM | X580: 9 | Y580: 4 | Z580: 0 | AA580: 1185 | AB580: 928 | AC580: 127.69396551724138 | AD580: 36
A581: PORT MELBOURNE | C581: TATE 4 | E581: CARLILE 3 | H581: TAGGART | J581: HOWELL | L581: BEDFORD | W581: PORT MELBOURNE | X581: 8 | Y581: 5 | Z581: 0 | AA581: 1322 | AB581: 774 | AC581: 170.80103359173125 | AD581: 32
A583: DANDENONG | C583: 1 | D583: 2 | E583: =C583*6+D583 -> 8 | G583: 2 | H583: 6 | I583: =G583*6+H583 -> 18 | K583: 3 | L583: 10 | M583: =K583*6+L583 -> 28 | O583: 9 | P583: 15 | Q583: =O583*6+P583 -> 69 | S583: WILLIAMSTOWN | W583: YARRAVILLE | X583: 8 | Y583: 5 | Z583: 0 | AA583: 1231 | AB583: 1139 | AC583: 108.08 | AD583: 32
A584: WILLIAMSTOWN | C584: 2 | D584: 0 | E584: =C584*6+D584 -> 12 | G584: 4 | H584: 1 | I584: =G584*6+H584 -> 25 | K584: 8 | L584: 3 | M584: =K584*6+L584 -> 51 | O584: 10 | P584: 4 | Q584: =O584*6+P584 -> 64 | S584: DIXON | W584: WAVERLEY | X584: 8 | Y584: 5 | Z584: 0 | AA584: 1052 | AB584: 997 | AC584: 105.51654964894684 | AD584: 32
A585: BEST PLAYERS | W585: OAKLEIGH | X585: 5 | Y585: 8 | Z585: 0 | AA585: 847 | AB585: 971 | AC585: 87.229660144181253 | AD585: 20
A586: DANDENONG | C586: GRAVENER | F586: MOLONEY | I586: CROWE | L586: WHALEBONE | O586: ABRAHAM | R586: OSBORNE | W586: WILLIAMSTOWN | X586: 3 | Y586: 10 | Z586: 0 | AA586: 882 | AB586: 1132 | AC586: 77.915194346289752 | AD586: 12
A587: WILLIAMSTOWN | C587: EVANS | F587: JAMES | I587: MURRAY | L587: FITCH | O587: LEONARD | R587: RUSSELL | W587: COBURG | X587: 3 | Y587: 10 | Z587: 0 | AA587: 903 | AB587: 1358 | AC587: 66.494845360824741 | AD587: 12
A588: GOALKICKERS | W588: GEELONG WEST | X588: 2 | Y588: 11 | Z588: 0 | AA588: 849 | AB588: 1369 | AC588: 62.02 | AD588: 8
A589: DANDENONG | C589: MOLONEY 2 | F589: ABRAHAM 2 | I589: PENNEFATHER | L589: GRAVENER | N589: McMILLAN | Q589: WHALEBONE | T589: ARNOLD
A590: WILLIAMSTOWN | C590: SAVIGE 3 | F590: BOYD 2 | I590: EVANS | K590: MURRAY | M590: JOHNSON | O590: CLOUGH | R590: JAMES
E591: 25TH JULY | J591: WEATHER | N591: RAIN
A592: BRUNSWICK | C592: 1 | D592: 5 | E592: =C592*6+D592 -> 11 | G592: 4 | H592: 7 | I592: =G592*6+H592 -> 31 | K592: 6 | L592: 7 | M592: =K592*6+L592 -> 43 | O592: 9 | P592: 7 | Q592: =O592*6+P592 -> 61 | S592: BRUNSWICK
A593: YARRAVILLE | C593: 1 | D593: 2 | E593: =C593*6+D593 -> 8 | G593: 5 | H593: 8 | I593: =G593*6+H593 -> 38 | K593: 6 | L593: 9 | M593: =K593*6+L593 -> 45 | O593: 7 | P593: 14 | Q593: =O593*6+P593 -> 56 | S593: FLANAGAN
A594: BEST PLAYERS
A595: BRUNSWICK | C595: LEYDIN | F595: ROBINSON | I595: WICKS | K595: BIBBY | N595: PENDLEBURY | Q595: McGRATH
A596: YARRAVILLE | C596: WARWICK | F596: RON BROWN | I596: FELL | K596: MADIGAN | N596: MURRIE | Q596: CURRIE
A597: GOALKICKERS
A598: BRUNSWICK | C598: LEYDIN 3 | F598: PENDLEBURY 2 | J598: DACEY 2 | M598: COOK | O598: McKINNON
A599: YARRAVILLE | C599: MADIGAN 3 | F599: MEDDINGS 2 | I599: RON BROWN | L599: WARWICK
A601: WAVERLEY | C601: 4 | D601: 2 | E601: =C601*6+D601 -> 26 | G601: 7 | H601: 5 | I601: =G601*6+H601 -> 47 | K601: 9 | L601: 5 | M601: =K601*6+L601 -> 59 | O601: 10 | P601: 11 | Q601: =O601*6+P601 -> 71 | S601: WAVERLEY
A602: SANDRINGHAM | C602: 1 | D602: 4 | E602: =C602*6+D602 -> 10 | G602: 1 | H602: 5 | I602: =G602*6+H602 -> 11 | K602: 5 | L602: 8 | M602: =K602*6+L602 -> 38 | O602: 6 | P602: 11 | Q602: =O602*6+P602 -> 47 | S602: O'NEILL
A603: BEST PLAYERS
A604: WAVERLEY | C604: POORE | F604: MERRETT | I604: MITHEN | L604: BREWSTER | O604: INGWERSON | R604: LAWSON
A605: SANDRINGHAM | C605: MUTER | F605: O'TOOLE | I605: HOAR | L605: GRANGER | O605: PETERS | R605: SELLECK
A606: GOALKICKERS
A607: WAVERLEY | C607: MERRETT 3 | F607: MITHEN 2 | I607: LAWSON 2 | L607: NATION | N607: BRENCHLEY | Q607: PETZKE
A608: SANDRINGHAM | C608: O'TOOLE | F608: ZEUSCHNER | I608: SELLECK | K608: GLEESON | M608: AGHAN | O608: WILLS
A610: COBURG | C610: 3 | D610: 9 | E610: =C610*6+D610 -> 27 | G610: 5 | H610: 11 | I610: =G610*6+H610 -> 41 | K610: 11 | L610: 14 | M610: =K610*6+L610 -> 80 | O610: 11 | P610: 15 | Q610: =O610*6+P610 -> 81 | S610: PORT MELBOURNE
A611: GEELONG WEST | C611: 2 | D611: 0 | E611: =C611*6+D611 -> 12 | G611: 5 | H611: 3 | I611: =G611*6+H611 -> 33 | K611: 5 | L611: 6 | M611: =K611*6+L611 -> 36 | O611: 9 | P611: 13 | Q611: =O611*6+P611 -> 67 | S611: GANNON
A612: BEST PLAYERS
A613: COBURG | C613: KEEFER | F613: FITZPATRICK | I613: CHALLENGER | L613: GIARDOSSI | O613: TANCREDI | R613: CLEMENTS
A614: GEELONG WEST | C614: NICHOLLS | F614: SMITH | I614: JENNINGS | L614: STACEY | O614: OLIVER | R614: WILLIAMS
A615: GOALKICKERS
A616: COBURG | C616: GRAHAM 2 | F616: CHALLENGER 2 | I616: KEEFER 2 | K616: PARTRIDGE | N616: ROCHOW | P616: E MURRAY | R616: CLEMENTS | U616: BRANSTON
A617: GEELONG WEST | C617: SMITH 2 | F617: GROVES 2 | I617: NICHOLLS | K617: HELMER | M617: GOGGIN | O617: CROFT | Q617: STACEY
A619: ROUND 14 | E619: 1ST AUGUST | J619: WEATHER | N619: NORTH WIND FINE | S619: PLAYED AT
D620: 1ST QTR | H620: 2ND QTR | L620: 3RD QTR | P620: FINAL | S620: PORT MELBOURNE
A621: PORT MELBOURNE | C621: 5 | D621: 1 | E621: =C621*6+D621 -> 31 | G621: 7 | H621: 8 | I621: =G621*6+H621 -> 50 | K621: 8 | L621: 13 | M621: =K621*6+L621 -> 61 | O621: 12 | P621: 19 | Q621: =O621*6+P621 -> 91 | S621: UMPIRE | X621: LADDER | AB621: ROUND | AD621: 14
A622: BRUNSWICK | C622: 2 | D622: 2 | E622: =C622*6+D622 -> 14 | G622: 4 | H622: 3 | I622: =G622*6+H622 -> 27 | K622: 6 | L622: 7 | M622: =K622*6+L622 -> 43 | O622: 9 | P622: 11 | Q622: =O622*6+P622 -> 65 | S622: McMASTER
A623: BEST PLAYERS | W623: TEAM | X623: W | Y623: L | Z623: D | AA623: FOR | AB623: AGST | AC623: % | AD623: PTS
A624: PORT MELBOURNE | C624: KERR | E624: HOWELLL | H624: CROSHER | K624: GROVER | N624: MILNER | Q624: BEDFORD
A625: BRUNSWICK | C625: BURNS | E625: WHILEY | H625: PENDLEBURY | K625: ROBBINS | N625: McKINNON | Q625: BIBBY | W625: SANDRINGHAM | X625: 10 | Y625: 4 | Z625: 0 | AA625: 1288 | AB625: 1027 | AC625: 125.41382667964946 | AD625: 40
A626: GOALKICKERS | W626: BRUNSWICK | X626: 10 | Y626: 4 | Z626: 0 | AA626: 1135 | AB626: 1055 | AC626: 107.58293838862559 | AD626: 40
A627: PORT MELBOURNE | C627: HOWELL 5 | F627: CARLILE 2 | I627: TATE 2 | K627: NAISMITH | N627: FREYER | P627: MILNER | W627: PORT MELBOURNE | X627: 9 | Y627: 5 | Z627: 0 | AA627: 1413 | AB627: 839 | AC627: 168.41477949940406 | AD627: 36
A628: BRUNSWICK | C628: LEYDIN 3 | F628: COOK 3 | H628: WHILEY | J628: BURNS | L628: ARTHUR | W628: DANDENONG | X628: 9 | Y628: 5 | Z628: 0 | AA628: 1193 | AB628: 922 | AC628: 129.39262472885034 | AD628: 36
A630: YARRAVILLE | C630: 2 | D630: 0 | E630: =C630*6+D630 -> 12 | G630: 5 | H630: 4 | I630: =G630*6+H630 -> 34 | K630: 6 | L630: 7 | M630: =K630*6+L630 -> 43 | O630: 10 | P630: 12 | Q630: =O630*6+P630 -> 72 | S630: YARRAVILLE | W630: YARRAVILLE | X630: 9 | Y630: 5 | Z630: 0 | AA630: 1303 | AB630: 1191 | AC630: 109.4 | AD630: 36
A631: DANDENONG | C631: 5 | D631: 6 | E631: =C631*6+D631 -> 36 | G631: 5 | H631: 7 | I631: =G631*6+H631 -> 37 | K631: 6 | L631: 15 | M631: =K631*6+L631 -> 51 | O631: 6 | P631: 16 | Q631: =O631*6+P631 -> 52 | S631: CHAPLIN | W631: WAVERLEY | X631: 9 | Y631: 5 | Z631: 0 | AA631: 1158 | AB631: 1067 | AC631: 108.52858481724461 | AD631: 36
A632: BEST PLAYERS | W632: OAKLEIGH | X632: 5 | Y632: 9 | Z632: 0 | AA632: 917 | AB632: 1077 | AC632: 85.143918291550605 | AD632: 20
A633: YARRAVILLE | C633: RON BROWN | F633: WARWICK | I633: CZAKORSKI | L633: ROWE | O633: CURRIE | R633: KNOTT | W633: WILLIAMSTOWN | X633: 4 | Y633: 10 | Z633: 0 | AA633: 977 | AB633: 1190 | AC633: 82.100840336134453 | AD633: 16
A634: DANDENONG | C634: ARNOLD | F634: BARRAN | I634: GRAVENER | L634: McMILLAN | O634: WHALEBONE | R634: OSBORNE | W634: COBURG | X634: 3 | Y634: 11 | Z634: 0 | AA634: 961 | AB634: 1453 | AC634: 66.139022711631114 | AD634: 12
A635: GOALKICKERS | W635: GEELONG WEST | X635: 2 | Y635: 12 | Z635: 0 | AA635: 948 | AB635: 1472 | AC635: 64.4 | AD635: 8
A636: YARRAVILLE | C636: RON BROWN 4 | F636: ROWE 2 | I636: MADIGAN | L636: CZAKOWSKI | O636: KNOTT | Q636: WARWICK
A637: DANDENONG | C637: WHALEBONE 2 | F637: ARNOLD 2 | I637: GRAVENER | L637: McMILLAN
A639: WAVERLEY | C639: 5 | D639: 7 | E639: =C639*6+D639 -> 37 | G639: 6 | H639: 9 | I639: =G639*6+H639 -> 45 | K639: 11 | L639: 15 | M639: =K639*6+L639 -> 81 | O639: 15 | P639: 16 | Q639: =O639*6+P639 -> 106 | S639: WAVERLEY
A640: OAKLEIGH | C640: 2 | D640: 1 | E640: =C640*6+D640 -> 13 | G640: 6 | H640: 3 | I640: =G640*6+H640 -> 39 | K640: 7 | L640: 6 | M640: =K640*6+L640 -> 48 | O640: 10 | P640: 10 | Q640: =O640*6+P640 -> 70 | S640: FLANAGAN
A641: BEST PLAYERS
A642: WAVERLEY | C642: BRENCHLEY | F642: BREWSTER | I642: INNES | L642: MERRETT | O642: VARLAMOS | R642: POORE
A643: OAKLEIGH | C643: JONES | F643: TURNER | I643: CRAWFORD | L643: DEFTEROUS | O643: DANN | R643: MAUGHAN
A644: GOALKICKERS
A645: WAVERLEY | C645: BRENCHLEY 5 | F645: BREWSTER 4 | I645: MERRETT 3 | L645: INGWERSON 2 | O645: PETZKE
A646: OAKLEIGH | C646: DOWDELL 2 | F646: MAUGHAN 2 | I646: LYON | J646: DEFTEROUS | M646: JONES | O646: LOTHIAN | Q646: HAINING | S646: JORDAN
A648: WILLIAMSTOWN | C648: 1 | D648: 3 | E648: =C648*6+D648 -> 9 | G648: 8 | H648: 5 | I648: =G648*6+H648 -> 53 | K648: 10 | L648: 8 | M648: =K648*6+L648 -> 68 | O648: 14 | P648: 11 | Q648: =O648*6+P648 -> 95 | S648: WILLIAMSTOWN
A649: COBURG | C649: 5 | D649: 5 | E649: =C649*6+D649 -> 35 | G649: 5 | H649: 8 | I649: =G649*6+H649 -> 38 | K649: 7 | L649: 10 | M649: =K649*6+L649 -> 52 | O649: 8 | P649: 10 | Q649: =O649*6+P649 -> 58 | S649: HENDERSON
A650: BEST PLAYERS
A651: WILLIAMSTOWN | C651: BRYANT | F651: CLOUGH | I651: SAVIGE | L651: JENKINSON | O651: EVANS | R651: MURRAY
A652: COBURG | C652: GRAHAM | F652: SULLIVAN | I652: GIARDOSSI | L652: PLANT | O652: McGROTTY | R652: PARTRIDGE
A653: GOALKICKERS
A654: WILLIAMSTOWN | C654: JENKINSON 4 | F654: BRYANT 4 | I654: JAMES | K654: SAVIGE | M654: JOHNSON | O654: CARMICHAEL | R654: MURRIE | T654: CLOUGH
A655: COBURG | C655: BRANSTON 4 | F655: ROCHOW | I655: CHALLENGER | L655: SULLIVAN | N655: ACKLAND
A657: SANDRINGHAM | C657: 2 | D657: 6 | E657: =C657*6+D657 -> 18 | G657: 4 | H657: 9 | I657: =G657*6+H657 -> 33 | K657: 12 | L657: 11 | M657: =K657*6+L657 -> 83 | O657: 15 | P657: 13 | Q657: =O657*6+P657 -> 103 | S657: GEELONG WEST
A658: GEELONG WEST | C658: 1 | D658: 3 | E658: =C658*6+D658 -> 9 | G658: 5 | H658: 6 | I658: =G658*6+H658 -> 36 | K658: 11 | L658: 12 | M658: =K658*6+L658 -> 78 | O658: 14 | P658: 15 | Q658: =O658*6+P658 -> 99 | S658: CRAIG
A659: BEST PLAYERS
A660: SANDRINGHAM | C660: PETERS | F660: MUTER | I660: BURNS | L660: OAKLEY | O660: HANCE | Q660: AGHAN
A661: GEELONG WEST | C661: NICHOLLS | F661: CROFT | I661: RAEBURN | L661: HELMER | O661: ZEITZ | Q661: GROVES
A662: GOALKICKERS
A663: SANDRINGHAM | C663: OAKLEY 9 | F663: ZEUSCHNER 2 | I663: BURNS | K663: VAUGHAN | N663: WILLS | P663: HANCE
A664: GEELONG WEST | C664: SMITH 3 | F664: HELMER 3 | I664: CROFT 3 | K664: NICHOLLS 2 | N664: LONG 2 | P664: GROVES
A666: ROUND 15 | D666: 7TH AUGUST | H666: WEATHER | J666: SOUTH EAST WIND RAIN GROUNDS BAD | S666: PLAYED AT
D667: 1ST QTR | H667: 2ND QTR | L667: 3RD QTR | P667: FINAL | S667: BRUNSWICK
A668: WAVERLEY | C668: 0 | D668: 5 | E668: =C668*6+D668 -> 5 | G668: 5 | H668: 9 | I668: =G668*6+H668 -> 39 | K668: 8 | L668: 13 | M668: =K668*6+L668 -> 61 | O668: 10 | P668: 15 | Q668: =O668*6+P668 -> 75 | S668: UMPIRE | X668: LADDER | AB668: ROUND | AD668: 15
A669: BRUNSWICK | C669: 0 | D669: 3 | E669: =C669*6+D669 -> 3 | G669: 0 | H669: 5 | I669: =G669*6+H669 -> 5 | K669: 1 | L669: 7 | M669: =K669*6+L669 -> 13 | O669: 1 | P669: 11 | Q669: =O669*6+P669 -> 17 | S669: GANNON
A670: BEST PLAYERS | W670: TEAM | X670: W | Y670: L | Z670: D | AA670: FOR | AB670: AGST | AC670: % | AD670: PTS
A671: WAVERLEY | C671: POORE | F671: VARLAMOS | I671: HUDSON | L671: MERRETT | N671: LOCKWOOD | Q671: BRENCHLEY
A672: BRUNSWICK | C672: McKINLEY | F672: WICKS | I672: ROBINSON | L672: BURNS | N672: DENTON | Q672: DARBY | W672: SANDRINGHAM | X672: 11 | Y672: 4 | Z672: 0 | AA672: 1418 | AB672: 1092 | AC672: 129.85347985347985 | AD672: 44
A673: GOALKICKERS | W673: PORT MELBOURNE | X673: 10 | Y673: 5 | Z673: 0 | AA673: 1576 | AB673: 882 | AC673: 178.68480725623581 | AD673: 40
A674: WAVERLEY | C674: LOCKWOOD 4 | F674: BRENCHLEY 3 | I674: BREWSTER | L674: LAWSON | O674: MITHEN | W674: DANDENONG | X674: 10 | Y674: 5 | Z674: 0 | AA674: 1282 | AB674: 979 | AC674: 130.94994892747701 | AD674: 40
A675: BRUNSWICK | C675: McKINNON | W675: WAVERLEY | X675: 10 | Y675: 5 | Z675: 0 | AA675: 1233 | AB675: 1084 | AC675: 113.74538745387454 | AD675: 40
A677: WILLIAMSTOWN | C677: 1 | D677: 1 | E677: =C677*6+D677 -> 7 | G677: 4 | H677: 5 | I677: =G677*6+H677 -> 29 | K677: 6 | L677: 5 | M677: =K677*6+L677 -> 41 | O677: 9 | P677: 7 | Q677: =O677*6+P677 -> 61 | S677: WILLIAMSTOWN | W677: BRUNSWICK | X677: 10 | Y677: 5 | Z677: 0 | AA677: 1152 | AB677: 1130 | AC677: 101.94690265486726 | AD677: 40
A678: OAKLEIGH | C678: 2 | D678: 3 | E678: =C678*6+D678 -> 15 | G678: 3 | H678: 3 | I678: =G678*6+H678 -> 21 | K678: 6 | L678: 4 | M678: =K678*6+L678 -> 40 | O678: 6 | P678: 6 | Q678: =O678*6+P678 -> 42 | S678: McMASTER | W678: YARRAVILLE | X678: 9 | Y678: 6 | Z678: 0 | AA678: 1346 | AB678: 1354 | AC678: 99.413059427732946 | AD678: 36
A679: BEST PLAYERS | W679: OAKLEIGH | X679: 5 | Y679: 10 | Z679: 0 | AA679: 959 | AB679: 1138 | AC679: 84.270650263620382 | AD679: 20
A680: WILLIAMSTOWN | C680: JAMES | F680: SAVIGE | I680: ROGAN | L680: MURRIE | O680: RUSSELL | R680: FITCH | W680: WILLIAMSTOWN | X680: 5 | Y680: 10 | Z680: 0 | AA680: 1038 | AB680: 1232 | AC680: 84.253246753246756 | AD680: 20
A681: OAKLEIGH | C681: TURNER | F681: DANN | I681: HAINING | L681: SHERIDAN | O681: MULDOON | R681: MAUGHAN | W681: COBURG | X681: 3 | Y681: 12 | Z681: 0 | AA681: 1026 | AB681: 1583 | AC681: 64.813644977890078 | AD681: 12
A682: GOALKICKERS | W682: GEELONG WEST | X682: 2 | Y682: 13 | Z682: 0 | AA682: 1005 | AB682: 1561 | AC682: 64.38 | AD682: 8
A683: WILLIAMSTOWN | C683: CARMICHAEL 3 | F683: ROGAN 2 | I683: WARE 2 | K683: MURRIE | M683: JENKINSON
A684: OAKLEIGH | C684: B McCORKELL | F684: MAUGHAN | I684: LYON | K684: DOWDELL | M684: JONES | O684: HAINING
E685: 8TH AUGUST | J685: WEATHER | N685: WET
A686: PORT MELBOURNE | C686: 8 | D686: 1 | E686: =C686*6+D686 -> 49 | G686: 13 | H686: 6 | I686: =G686*6+H686 -> 84 | K686: 20 | L686: 9 | M686: =K686*6+L686 -> 129 | O686: 25 | P686: 13 | Q686: =O686*6+P686 -> 163 | S686: PORT MELBOURNE
A687: YARRAVILLE | C687: 1 | D687: 1 | E687: =C687*6+D687 -> 7 | G687: 2 | H687: 3 | I687: =G687*6+H687 -> 15 | K687: 6 | L687: 6 | M687: =K687*6+L687 -> 42 | O687: 6 | P687: 7 | Q687: =O687*6+P687 -> 43 | S687: O'NEILL
A688: BEST PLAYERS
A689: PORT MELBOURNE | C689: MITHEN | F689: MILNER | I689: FREYER | L689: BEDFORD | O689: HOUSE | R689: HOWELL
A690: YARRAVILLE | C690: WARWICK | F690: FELL | I690: RON BROWN | L690: EDWARDS | O690: MADIGAN | R690: BARROW
A691: GOALKICKERS
A692: PORT MELBOURNE | C692: CARLILE 5 | F692: MILNER 5 | I692: FREYER 4 | K692: HOWELL 4 | N692: TATE 3 | P692: TAGGART 2 | S692: MITHEN | U692: BROWNHILL
A693: YARRAVILLE | C693: FELL 2 | E693: WARWICK 2 | H693: MADIGAN | K693: RON BROWN
A695: DANDENONG | C695: 3 | D695: 4 | E695: =C695*6+D695 -> 22 | G695: 5 | H695: 7 | I695: =G695*6+H695 -> 37 | K695: 12 | L695: 9 | M695: =K695*6+L695 -> 81 | O695: 13 | P695: 11 | Q695: =O695*6+P695 -> 89 | S695: DANDENONG
A696: GEELONG WEST | C696: 0 | D696: 4 | E696: =C696*6+D696 -> 4 | G696: 1 | H696: 9 | I696: =G696*6+H696 -> 15 | K696: 2 | L696: 11 | M696: =K696*6+L696 -> 23 | O696: 7 | P696: 15 | Q696: =O696*6+P696 -> 57 | S696: FLANAGAN
A697: BEST PLAYERS
A698: DANDENONG | C698: PENNEFATHER | F698: SHINNERS | I698: DELANTY | L698: ARNOLD | O698: WHALEBONE | R698: GREENWOOD
A699: GEELONG WEST | C699: WILLIAMS | F699: ZAITZ | I699: RAEBURN | L699: STACEY | O699: GROVES | R699: NICHOLLS
A700: GOALKICKERS
A701: DANDENONG | C701: ARNOLD 5 | F701: WHALEBONE 3 | J701: ABRAHAM 2 | M701: OSBORNE | O701: McMILLAN | R701: MELAI
A702: GEELONG WEST | C702: GROVES 2 | F702: HELMER 2 | I702: SMITH | K702: RAEBURN | M702: STACEY
A704: SANDRINGHAM | C704: 9 | D704: 4 | E704: =C704*6+D704 -> 58 | G704: 10 | H704: 8 | I704: =G704*6+H704 -> 68 | K704: 16 | L704: 18 | M704: =K704*6+L704 -> 114 | O704: 18 | P704: 22 | Q704: =O704*6+P704 -> 130 | S704: BEACH ROAD
A705: COBURG | C705: 0 | D705: 1 | E705: =C705*6+D705 -> 1 | G705: 3 | H705: 2 | I705: =G705*6+H705 -> 20 | K705: 4 | L705: 3 | M705: =K705*6+L705 -> 27 | O705: 10 | P705: 5 | Q705: =O705*6+P705 -> 65 | S705: POLLARD
A706: BEST PLAYERS
A707: SANDRINGHAM | C707: OAKLEY | F707: HOAR | I707: WESTON | L707: LADDS | O707: MUTER | R707: PETERS
A708: COBURG | C708: GRAHAM | F708: CLEMENTS | I708: BRANSTON | L708: McGROTTY | O708: PLANT
A709: GOALKICKERS
A710: SANDRINGHAM | C710: OAKLEY 7 | F710: WESTON 3 | I710: VAUGHAN 2 | L710: O'TOOLE | N710: AGHAN | P710: ZEUSCHNER | S710: WILLS | U710: BURNS | W710: BENNETT
A711: COBURG | C711: ROCHOW 3 | F711: BRANSTON 3 | I711: CHALLENGER 2 | L711: HILL | N711: GIARDOSSI
A713: ROUND 16 | D713: 14TH AUGUST | I713: WEATHER | L713: NO WIND DULL CLOUDY | S713: PLAYED AT
D714: 1ST QTR | H714: 2ND QTR | L714: 3RD QTR | P714: FINAL | S714: YARRAVILLE
A715: WAVERLEY | C715: 4 | D715: 2 | E715: =C715*6+D715 -> 26 | G715: 8 | H715: 4 | I715: =G715*6+H715 -> 52 | K715: 9 | L715: 9 | M715: =K715*6+L715 -> 63 | O715: 12 | P715: 14 | Q715: =O715*6+P715 -> 86 | S715: UMPIRE | X715: LADDER | AB715: ROUND | AD715: 16
A716: YARRAVILLE | C716: 3 | D716: 5 | E716: =C716*6+D716 -> 23 | G716: 4 | H716: 9 | I716: =G716*6+H716 -> 33 | K716: 5 | L716: 15 | M716: =K716*6+L716 -> 45 | O716: 8 | P716: 19 | Q716: =O716*6+P716 -> 67 | S716: DIXON
A717: BEST PLAYERS | W717: TEAM | X717: W | Y717: L | Z717: D | AA717: FOR | AB717: AGST | AC717: % | AD717: PTS
A718: WAVERLEY | C718: VARLAMOS | F718: ELLIS | I718: POORE | L718: LOCKWOOD | O718: THOROGOOD | R718: MITHEN
A719: YARRAVILLE | C719: WARWICK | F719: EDWARDS | I719: RON BROWN | L719: MURRAY | O719: ROWE | R719: CURRIE | W719: PORT MELBOURNE | X719: 11 | Y719: 5 | Z719: 0 | AA719: 1650 | AB719: 934 | AC719: 176.65952890792292 | AD719: 44
A720: GOALKICKERS | W720: DANDENONG | X720: 11 | Y720: 5 | Z720: 0 | AA720: 1372 | AB720: 1066 | AC720: 128.70544090056285 | AD720: 44
A721: WAVERLEY | C721: MITHEN 3 | F721: MERRETT 2 | I721: NATION 2 | K721: LOCKWOOD 2 | N721: PETZKE | P721: HURLE | R721: BREWSTER | W721: SANDRINGHAM | X721: 11 | Y721: 5 | Z721: 0 | AA721: 1505 | AB721: 1182 | AC721: 127.32656514382403 | AD721: 44
A722: YARRAVILLE | C722: ROWE 3 | F722: MURRAY 2 | I722: WILSON | K722: MADIGAN | N722: FELL | W722: WAVERLEY | X722: 11 | Y722: 5 | Z722: 0 | AA722: 1319 | AB722: 1151 | AC722: 114.59600347523892 | AD722: 44
A724: BRUNSWICK | C724: 4 | D724: 3 | E724: =C724*6+D724 -> 27 | G724: 7 | H724: 7 | I724: =G724*6+H724 -> 49 | K724: 13 | L724: 8 | M724: =K724*6+L724 -> 86 | O724: 18 | P724: 9 | Q724: =O724*6+P724 -> 117 | S724: OAKLEIGH | W724: BRUNSWICK | X724: 11 | Y724: 5 | Z724: 0 | AA724: 1269 | AB724: 1209 | AC724: 104.96277915632754 | AD724: 44
A725: OAKLEIGH | C725: 2 | D725: 1 | E725: =C725*6+D725 -> 13 | G725: 5 | H725: 4 | I725: =G725*6+H725 -> 34 | K725: 9 | L725: 9 | M725: =K725*6+L725 -> 63 | O725: 11 | P725: 13 | Q725: =O725*6+P725 -> 79 | S725: CRAIG | W725: YARRAVILLE | X725: 9 | Y725: 7 | Z725: 0 | AA725: 1413 | AB725: 1440 | AC725: 98.13 | AD725: 36
A726: BEST PLAYERS | W726: WILLIAMSTOWN | X726: 6 | Y726: 10 | Z726: 0 | AA726: 1081 | AB726: 1261 | AC726: 85.725614591593967 | AD726: 24
A727: BRUNSWICK | C727: LEYDIN | F727: PENDLEBURY | I727: COOK | L727: BIBBY | O727: KICK | R727: BURNS | W727: OAKLEIGH | X727: 5 | Y727: 11 | Z727: 0 | AA727: 1038 | AB727: 1255 | AC727: 82.709163346613551 | AD727: 20
A728: OAKLEIGH | C728: HAINING | F728: BEARD | I728: JONES | L728: JORDAN | O728: DEFTEROUS | R728: SHERIDAN | W728: COBURG | X728: 3 | Y728: 13 | Z728: 0 | AA728: 1078 | AB728: 1657 | AC728: 65.057332528666265 | AD728: 12
A729: GOALKICKERS | W729: GEELONG WEST | X729: 2 | Y729: 14 | Z729: 0 | AA729: 1034 | AB729: 1604 | AC729: 64.46 | AD729: 8
A730: BRUNSWICK | C730: COOK 8 | E730: BURNS 3 | G730: BRIGLIA 2 | I730: PENDLEBURY 2 | L730: McNAMARA | O730: LEYDIN | Q730: McKINNON
A731: OAKLEIGH | C731: JORDAN 3 | F731: SHERIDAN 3 | I731: JONES 2 | K731: MURRAY | M731: HAINING | O731: LYON
E732: 15TH AUGUST | J732: WEATHER | N732: WET
A733: DANDENONG | C733: 5 | D733: 2 | E733: =C733*6+D733 -> 32 | G733: 7 | H733: 6 | I733: =G733*6+H733 -> 48 | K733: 10 | L733: 7 | M733: =K733*6+L733 -> 67 | O733: 13 | P733: 12 | Q733: =O733*6+P733 -> 90 | S733: BEACH ROAD
A734: SANDRINGHAM | C734: 3 | D734: 4 | E734: =C734*6+D734 -> 22 | G734: 6 | H734: 6 | I734: =G734*6+H734 -> 42 | K734: 10 | L734: 8 | M734: =K734*6+L734 -> 68 | O734: 13 | P734: 9 | Q734: =O734*6+P734 -> 87 | S734: McMASTER
A735: BEST PLAYERS
A736: DANDENONG | C736: OSBORNE | F736: ABRAHAM | I736: McMILLAN | L736: ARNOLD | O736: GREENWOOD | R736: SHINNERS
A737: SANDRINGHAM | C737: OAKLEY | F737: VAUGHAN | I737: LADDS | L737: O'TOOLE | O737: ZEUSCHNER | R737: MUTER
A738: GOALKICKERS
A739: DANDENONG | C739: ABRAHAM 4 | F739: MCNAMARA 3 | I739: GREENWOOD 2 | L739: ARNOLD 2 | N739: McMILLAN | Q739: STAUNTON
A740: SANDRINGHAM | C740: OAKLEY 7 | F740: BURNS | H740: AGHAN | J740: WESTON | L740: VAUGHAN | N740: MACKENZIE | Q740: HANCE
A742: WILLIAMSTOWN | C742: 1 | D742: 1 | E742: =C742*6+D742 -> 7 | G742: 2 | H742: 8 | I742: =G742*6+H742 -> 20 | K742: 4 | L742: 10 | M742: =K742*6+L742 -> 34 | O742: 5 | P742: 13 | Q742: =O742*6+P742 -> 43 | S742: GEELONG WEST
A743: GEELONG WEST | C743: 1 | D743: 1 | E743: =C743*6+D743 -> 7 | G743: 1 | H743: 1 | I743: =G743*6+H743 -> 7 | K743: 4 | L743: 3 | M743: =K743*6+L743 -> 27 | O743: 4 | P743: 5 | Q743: =O743*6+P743 -> 29 | S743: O'NEILL
A744: BEST PLAYERS
A745: WILLIAMSTOWN | C745: SAVIGE | F745: JENKINSON | I745: REES | K745: CLOUGH | N745: BAMFORD | Q745: JAMES
A746: GEELONG WEST | C746: NICHOLLS | F746: STACEY | I746: OLVER | K746: LONG | N746: GROVES | Q746: HELMER
A747: GOALKICKERS
A748: WILLIAMSTOWN | C748: JENKINSON 2 | F748: JAMES | H748: JOHNSON | K748: CLOUGH
A749: GEELONG WEST | C749: STACEY 2 | F749: RAEBURN | I749: GROVES
A751: PORT MELBOURNE | C751: 3 | D751: 5 | E751: =C751*6+D751 -> 23 | G751: 8 | H751: 7 | I751: =G751*6+H751 -> 55 | K751: 9 | L751: 9 | M751: =K751*6+L751 -> 63 | O751: 10 | P751: 14 | Q751: =O751*6+P751 -> 74 | S751: PORT MELBOURNE
A752: COBURG | C752: 1 | D752: 3 | E752: =C752*6+D752 -> 9 | G752: 3 | H752: 7 | I752: =G752*6+H752 -> 25 | K752: 5 | L752: 10 | M752: =K752*6+L752 -> 40 | O752: 7 | P752: 10 | Q752: =O752*6+P752 -> 52 | S752: FLANAGAN
A753: BEST PLAYERS
A754: PORT MELBOURNE | C754: KERR | F754: RENOUF | I754: MILNER | L754: BEDFORD | O754: HOUSE | R754: BROWNHILL
A755: COBURG | C755: CHALLENGER | F755: PLANT | I755: TANCREDI | L755: GRAHAM | O755: CLEMENTS | R755: McNABB
A756: GOALKICKERS
A757: PORT MELBOURNE | C757: CARLILE 3 | F757: FREYER 2 | I757: MILNER 2 | L757: BEDFORD | N757: TATE | P757: MITHEN
A758: COBURG | C758: CHALLENGER 4 | F758: BRANSTON 2 | I758: PARTRIDGE
A760: ROUND 17 | E760: 21ST AUGUST | J760: WEATHER | N760: FINE GROUNDS HEAVY | S760: PLAYED AT
D761: 1ST QTR | H761: 2ND QTR | L761: 3RD QTR | P761: FINAL | S761: PORT MELBOURNE
A762: PORT MELBOURNE | C762: 2 | D762: 3 | E762: =C762*6+D762 -> 15 | G762: 5 | H762: 11 | I762: =G762*6+H762 -> 41 | K762: 11 | L762: 14 | M762: =K762*6+L762 -> 80 | O762: 13 | P762: 19 | Q762: =O762*6+P762 -> 97 | S762: UMPIRE | X762: LADDER | AB762: ROUND | AD762: 17
A763: SANDRINGHAM | C763: 4 | D763: 3 | E763: =C763*6+D763 -> 27 | G763: 7 | H763: 4 | I763: =G763*6+H763 -> 46 | K763: 11 | L763: 5 | M763: =K763*6+L763 -> 71 | O763: 14 | P763: 7 | Q763: =O763*6+P763 -> 91 | S763: JACKSON
A764: BEST PLAYERS | W764: TEAM | X764: W | Y764: L | Z764: D | AA764: FOR | AB764: AGST | AC764: % | AD764: PTS
A765: PORT MELBOURNE | C765: MILNER | F765: HOWELL | I765: FREYER | L765: TAGGART | O765: GROVER | Q765: BROWNHILL
A766: SANDRINGHAM | C766: WESTON | F766: HARRISON | I766: OAKLEY | L766: MACKENZIE | O766: BURNS | Q766: GODDARD | W766: PORT MELBOURNE | X766: 12 | Y766: 5 | Z766: 0 | AA766: 1747 | AB766: 1025 | AC766: 170.4390243902439 | AD766: 48
A767: GOALKICKERS | W767: DANDENONG | X767: 12 | Y767: 5 | Z767: 0 | AA767: 1440 | AB767: 1120 | AC767: 128.57142857142858 | AD767: 48
A768: PORT MELBOURNE | C768: TAGGART 3 | F768: HOWELL 3 | I768: FREYER 3 | K768: CARLILE 2 | N768: MILNER | P768: BEDFORD | W768: WAVERLEY | X768: 12 | Y768: 5 | Z768: 0 | AA768: 1440 | AB768: 1167 | AC768: 123.39331619537275 | AD768: 48
A769: SANDRINGHAM | C769: WESTON 3 | F769: OAKLEY 3 | I769: AGHAN 2 | K769: WILLS 2 | M769: BURNS 2 | O769: MACKENZIE | R769: HARRISON | W769: SANDRINGHAM | X769: 11 | Y769: 6 | Z769: 0 | AA769: 1596 | AB769: 1279 | AC769: 124.78498827208757 | AD769: 44
A771: DANDENONG | C771: 2 | D771: 0 | E771: =C771*6+D771 -> 12 | G771: 3 | H771: 1 | I771: =G771*6+H771 -> 19 | K771: 3 | L771: 5 | M771: =K771*6+L771 -> 23 | O771: 10 | P771: 8 | Q771: =O771*6+P771 -> 68 | S771: BRUNSWICK | W771: BRUNSWICK | X771: 11 | Y771: 6 | Z771: 0 | AA771: 1323 | AB771: 1277 | AC771: 103.60219263899765 | AD771: 44
A772: BRUNSWICK | C772: 0 | D772: 7 | E772: =C772*6+D772 -> 7 | G772: 1 | H772: 12 | I772: =G772*6+H772 -> 18 | K772: 4 | L772: 15 | M772: =K772*6+L772 -> 39 | O772: 6 | P772: 18 | Q772: =O772*6+P772 -> 54 | S772: CHAPLIN | W772: YARRAVILLE | X772: 9 | Y772: 8 | Z772: 0 | AA772: 1472 | AB772: 1521 | AC772: 96.78 | AD772: 36
A773: BEST PLAYERS | W773: WILLIAMSTOWN | X773: 7 | Y773: 10 | Z773: 0 | AA773: 1162 | AB773: 1320 | AC773: 88.030303030303031 | AD773: 28
A774: DANDENONG | C774: ABRAHAM | F774: ARNOLD | I774: PENNEFATHER | L774: McMILLAN | O774: REEVE | Q774: SHINNERS | W774: OAKLEIGH | X774: 6 | Y774: 11 | Z774: 0 | AA774: 1119 | AB774: 1320 | AC774: 84.772727272727266 | AD774: 24
A775: BRUNSWICK | C775: WICKS | F775: LEYDIN | I775: BURNS | L775: DENTON | O775: ARTHUR | Q775: ROBINSON | W775: COBURG | X775: 3 | Y775: 14 | Z775: 0 | AA775: 1143 | AB775: 1738 | AC775: 65.765247410817025 | AD775: 12
A776: GOALKICKERS | W776: GEELONG WEST | X776: 2 | Y776: 15 | Z776: 0 | AA776: 1050 | AB776: 1725 | AC776: 60.87 | AD776: 8
A777: DANDENONG | C777: ARNOLD 5 | F777: McNAMARA 3 | I777: SUTTON | K777: MELAI
A778: BRUNSWICK | C778: COOK 2 | F778: BURNS | H778: DENTON | K778: McNAMARA | N778: LEYDIN
A780: WILLIAMSTOWN | C780: 1 | D780: 5 | E780: =C780*6+D780 -> 11 | G780: 4 | H780: 9 | I780: =G780*6+H780 -> 33 | K780: 7 | L780: 12 | M780: =K780*6+L780 -> 54 | O780: 11 | P780: 15 | Q780: =O780*6+P780 -> 81 | S780: YARRAVILLE
A781: YARRAVILLE | C781: 2 | D781: 3 | E781: =C781*6+D781 -> 15 | G781: 5 | H781: 7 | I781: =G781*6+H781 -> 37 | K781: 7 | L781: 11 | M781: =K781*6+L781 -> 53 | O781: 8 | P781: 11 | Q781: =O781*6+P781 -> 59 | S781: FLANAGAN
A782: BEST PLAYERS
A783: WILLIAMSTOWN | C783: MURRIE | F783: JENKINSON | I783: CLOUGH | L783: COUSINS | O783: BRYANT | Q783: EVANS
A784: YARRAVILLE | C784: WARWICK | F784: HOWARTH | I784: MADIGAN | L784: RON BROWN | O784: FELL | Q784: MEDDINGS
A785: GOALKICKERS
A786: WILLIAMSTOWN | C786: JAMES 3 | F786: CLOUGH 3 | I786: EVANS 2 | K786: BRYANT | M786: BOYD | O786: SAVIGE
A787: YARRAVILLE | C787: MADIGAN 3 | F787: RON BROWN 2 | I787: MEDDINGS | L787: WARWICK | N787: QUARANTOTTO
A789: OAKLEIGH | C789: 2 | D789: 3 | E789: =C789*6+D789 -> 15 | G789: 2 | H789: 8 | I789: =G789*6+H789 -> 20 | K789: 8 | L789: 11 | M789: =K789*6+L789 -> 59 | O789: 11 | P789: 15 | Q789: =O789*6+P789 -> 81 | S789: OAKLEIGH
A790: COBURG | C790: 2 | D790: 0 | E790: =C790*6+D790 -> 12 | G790: 6 | H790: 3 | I790: =G790*6+H790 -> 39 | K790: 9 | L790: 4 | M790: =K790*6+L790 -> 58 | O790: 10 | P790: 5 | Q790: =O790*6+P790 -> 65 | S790: O'NEILL
A791: BEST PLAYERS
A792: OAKLEIGH | C792: TURNER | E792: SHERIDAN | H792: BEARD | K792: WOOD | N792: DEFTEROUS | Q792: JORDAN
A793: COBURG | C793: WELSH | E793: GRAHAM | H793: ROCHOW | K793: ROWE | N793: CLEMENTS | Q793: GIARDOSSI
A794: GOALKICKERS
A795: OAKLEIGH | C795: CRAWFORD 4 | F795: LYON 2 | H795: JONES 2 | J795: KITTO | L795: SHERIDAN | O795: HAINING
A796: COBURG | C796: BRANSTON 3 | F796: CLEMENTS 2 | I796: ACKLAND | L796: HICKS | N796: CHALLENGER | Q796: PARTRIDGE | T796: GRAHAM
A798: WAVERLEY | C798: 0 | D798: 4 | E798: =C798*6+D798 -> 4 | G798: 7 | H798: 13 | I798: =G798*6+H798 -> 55 | K798: 11 | L798: 15 | M798: =K798*6+L798 -> 81 | O798: 17 | P798: 19 | Q798: =O798*6+P798 -> 121 | S798: WAVERLEY
A799: GEELONG WEST | C799: 0 | D799: 1 | E799: =C799*6+D799 -> 1 | G799: 1 | H799: 2 | I799: =G799*6+H799 -> 8 | K799: 2 | L799: 3 | M799: =K799*6+L799 -> 15 | O799: 2 | P799: 4 | Q799: =O799*6+P799 -> 16 | S799: McMASTER
A800: BEST PLAYERS
A801: WAVERLEY | C801: POORE | F801: BRENCHLEY | I801: VARLAMOS | L801: HUDSON | O801: INNES | Q801: HURLE
A802: GEELONG WEST | C802: NICHOLLS | F802: JENNINGS | I802: CROFT | L802: STACEY | O802: OLVER | Q802: ZAITZ
A803: GOALKICKERS
A804: WAVERLEY | C804: BRENCHLEY 5 | F804: PETZKE 3 | I804: LAWSON 3 | L804: HURLE 2 | N804: LOCKWOOD | Q804: MERRETT | T804: NATION | V804: MARTIN
A805: GEELONG WEST | C805: HOPE | F805: SYMES
A807: ROUND 18 | E807: 28TH AUGUST | J807: WEATHER | N807: FINE & SUNNY NO WIND | S807: PLAYED AT
D808: 1ST QTR | H808: 2ND QTR | L808: 3RD QTR | P808: FINAL | S808: DANDENONG
A809: DANDENONG | C809: 3 | D809: 3 | E809: =C809*6+D809 -> 21 | G809: 5 | H809: 5 | I809: =G809*6+H809 -> 35 | K809: 9 | L809: 8 | M809: =K809*6+L809 -> 62 | O809: 14 | P809: 9 | Q809: =O809*6+P809 -> 93 | S809: UMPIRE | X809: LADDER | AB809: ROUND | AD809: 18
A810: PORT MELBOURNE | C810: 1 | D810: 2 | E810: =C810*6+D810 -> 8 | G810: 6 | H810: 7 | I810: =G810*6+H810 -> 43 | K810: 8 | L810: 9 | M810: =K810*6+L810 -> 57 | O810: 10 | P810: 9 | Q810: =O810*6+P810 -> 69 | S810: FLANAGAN
A811: BEST PLAYERS | W811: TEAM | X811: W | Y811: L | Z811: D | AA811: FOR | AB811: AGST | AC811: % | AD811: PTS
A812: DANDENONG | C812: GREENWOOD | F812: CLARK | I812: SHINNERS | L812: PENNEFATHER | O812: OSBORNE | R812: SUTTON
A813: PORT MELBOURNE | C813: HOWELL | F813: CROSHER | I813: CAULFIELD | L813: BROWNHILL | O813: BEDFORD | R813: TAGGART | W813: DANDENONG | X813: 13 | Y813: 5 | Z813: 0 | AA813: 1533 | AB813: 1189 | AC813: 128.9318755256518 | AD813: 52
A814: GOALKICKERS | W814: WAVERLEY | X814: 13 | Y814: 5 | Z814: 0 | AA814: 1523 | AB814: 1232 | AC814: 123.62012987012987 | AD814: 52
A815: DANDENONG | C815: GREENWOOD 4 | F815: DELANTY 3 | I815: LIENERT 2 | L815: MELAI 2 | N815: McNAMARA | Q815: ARNOLD | S815: ABRAHAM | W815: PORT MELBOURNE | X815: 12 | Y815: 6 | Z815: 0 | AA815: 1816 | AB815: 1118 | AC815: 162.43291592128801 | AD815: 48
A816: PORT MELBOURNE | C816: CARLILE 3 | F816: HOWELL 3 | I816: BROWNHILL 2 | L816: PERRY | N816: BEDFORD | W816: SANDRINGHAM | X816: 12 | Y816: 6 | Z816: 0 | AA816: 1734 | AB816: 1347 | AC816: 128.73051224944319 | AD816: 48
A818: SANDRINGHAM | C818: 4 | D818: 4 | E818: =C818*6+D818 -> 28 | G818: 7 | H818: 6 | I818: =G818*6+H818 -> 48 | K818: 13 | L818: 9 | M818: =K818*6+L818 -> 87 | O818: 20 | P818: 18 | Q818: =O818*6+P818 -> 138 | S818: BEACH ROAD | W818: BRUNSWICK | X818: 12 | Y818: 6 | Z818: 0 | AA818: 1387 | AB818: 1324 | AC818: 104.75830815709969 | AD818: 48
A819: YARRAVILLE | C819: 1 | D819: 5 | E819: =C819*6+D819 -> 11 | G819: 5 | H819: 9 | I819: =G819*6+H819 -> 39 | K819: 7 | L819: 12 | M819: =K819*6+L819 -> 54 | O819: 9 | P819: 14 | Q819: =O819*6+P819 -> 68 | S819: GANNON | W819: YARRAVILLE | X819: 9 | Y819: 9 | Z819: 0 | AA819: 1540 | AB819: 1659 | AC819: 92.83 | AD819: 36
A820: BEST PLAYERS | W820: WILLIAMSTOWN | X820: 7 | Y820: 11 | Z820: 0 | AA820: 1209 | AB820: 1384 | AC820: 87.355491329479776 | AD820: 28
A821: SANDRINGHAM | C821: GODDARD | F821: OAKLEY | I821: BURNS | L821: GRANGER | O821: O'TOOLE | R821: MACKENZIE | W821: OAKLEIGH | X821: 6 | Y821: 12 | Z821: 0 | AA821: 1204 | AB821: 1429 | AC821: 84.254723582925124 | AD821: 24
A822: YARRAVILLE | C822: WILSON | F822: RON BROWN | I822: MURRAY | L822: MADIGAN | O822: CURRIE | R822: WARWICK | W822: COBURG | X822: 3 | Y822: 15 | Z822: 0 | AA822: 1208 | AB822: 1821 | AC822: 66.337177375068649 | AD822: 12
A823: GOALKICKERS | W823: GEELONG WEST | X823: 3 | Y823: 15 | Z823: 0 | AA823: 1159 | AB823: 1810 | AC823: 64.03 | AD823: 12
A824: SANDRINGHAM | C824: OAKLEY 11 | F824: BURNS 4 | I824: WESTON 2 | L824: VAUGHAN | O824: MACKENZIE | R824: O'TOOLE
A825: YARRAVILLE | C825: MURAY 3 | F825: CURRIE 2 | I825: WARWICK | L825: COLLINS | N825: RON BROWN | Q825: MADIGAN
A827: BRUNSWICK | C827: 2 | D827: 1 | E827: =C827*6+D827 -> 13 | G827: 5 | H827: 4 | I827: =G827*6+H827 -> 34 | K827: 7 | L827: 9 | M827: =K827*6+L827 -> 51 | O827: 9 | P827: 10 | Q827: =O827*6+P827 -> 64 | S827: WILLIAMSTOWN
A828: WILLIAMSTOWN | C828: 0 | D828: 5 | E828: =C828*6+D828 -> 5 | G828: 3 | H828: 9 | I828: =G828*6+H828 -> 27 | K828: 3 | L828: 14 | M828: =K828*6+L828 -> 32 | O828: 5 | P828: 17 | Q828: =O828*6+P828 -> 47 | S828: DIXON
A829: BEST PLAYERS
A830: BRUNSWICK | C830: BURNS | F830: LEYDIN | I830: DARBY | L830: ROBINSON | O830: WICKS | Q830: NOONAN
A831: WILLIAMSTOWN | C831: BAMFORD | F831: SAVIGE | I831: JENKINSON | L831: MURRIE | O831: RUSSELL | Q831: REES
A832: GOALKICKERS
A833: BRUNSWICK | C833: BURNS 3 | F833: WHILEY 2 | I833: PENDLEBURY | L833: McNAMARA | O833: DENTON | Q833: DARBY
A834: WILLIAMSTOWN | C834: REES 2 | F834: DOOLEY | I834: BRYANT | L834: BLAINEY
A836: GEELONG WEST | C836: 6 | D836: 2 | E836: =C836*6+D836 -> 38 | G836: 7 | H836: 7 | I836: =G836*6+H836 -> 49 | K836: 11 | L836: 11 | M836: =K836*6+L836 -> 77 | O836: 16 | P836: 13 | Q836: =O836*6+P836 -> 109 | S836: GEELONG WEST
A837: OAKLEIGH | C837: 4 | D837: 3 | E837: =C837*6+D837 -> 27 | G837: 8 | H837: 8 | I837: =G837*6+H837 -> 56 | K837: 8 | L837: 9 | M837: =K837*6+L837 -> 57 | O837: 12 | P837: 13 | Q837: =O837*6+P837 -> 85 | S837: JACKSON
A838: BEST PLAYERS
A839: GEELONG WEST | C839: WILLIAMS | F839: NICHOLLS | I839: STACEY | L839: PETERS | O839: CROFT | R839: ZEITZ
A840: OAKLEIGH | C840: JONES | F840: BEARD | I840: SHERIDAN | L840: LYON | O840: MAUGHAN | R840: JORDAN
A841: GOALKICKERS
A842: GEELONG WEST | C842: GOGGIN 5 | F842: HELMER 4 | I842: HOPE 2 | K842: CROFT | M842: SMITH | O842: SYMES | Q842: STACEY
A843: OAKLEIGH | C843: MAUGHAN 3 | F843: JONES 3 | I843: SHERIDAN 2 | L843: JORDAN 2 | O843: LYON 2
A845: WAVERLEY | C845: 2 | D845: 5 | E845: =C845*6+D845 -> 17 | G845: 5 | H845: 8 | I845: =G845*6+H845 -> 38 | K845: 9 | L845: 13 | M845: =K845*6+L845 -> 67 | O845: 11 | P845: 17 | Q845: =O845*6+P845 -> 83 | S845: PORT MELBOURNE
A846: COBURG | C846: 3 | D846: 2 | E846: =C846*6+D846 -> 20 | G846: 5 | H846: 6 | I846: =G846*6+H846 -> 36 | K846: 5 | L846: 7 | M846: =K846*6+L846 -> 37 | O846: 9 | P846: 11 | Q846: =O846*6+P846 -> 65 | S846: CHAPLIN
A847: BEST PLAYERS
A848: WAVERLEY | C848: ELLIS | F848: VARLAMOS | I848: POORE | L848: PETZKE | O848: INNES | R848: HUDSON
A849: COBURG | C849: GRAHAM | F849: CHALLENGER | I849: McNABB | L849: GIARDOSSI | O849: WELSH | R849: TANCREDI
A850: GOALKICKERS
A851: WAVERLEY | C851: LOCKWOOD 3 | F851: BREWSTER 2 | I851: NATION 2 | L851: MITHEN | N851: HURLE | P851: BRENCHLEY | S851: PETZKE
A852: COBURG | C852: McNABB 2 | F852: FITZPATRICK 2 | J852: CHALLENGER 2 | N852: KEEFER | P852: ACKLAND | S852: McGROTTY
A854: FINALS
A855: 1ST SEMI | D855: 4TH SEPTEMBER | I855: WEATHER | K855: NORTH WEST WIND GROUND DAMP
D856: 1ST QTR | H856: 2ND QTR | L856: 3RD QTR | P856: FINAL
A857: PORT MELBOURNE | C857: 3 | D857: 2 | E857: =C857*6+D857 -> 20 | G857: 7 | H857: 6 | I857: =G857*6+H857 -> 48 | K857: 9 | L857: 12 | M857: =K857*6+L857 -> 66 | O857: 15 | P857: 17 | Q857: =O857*6+P857 -> 107 | S857: PORT MELBOURNE
A858: SANDRINGHAM | C858: 2 | D858: 4 | E858: =C858*6+D858 -> 16 | G858: 5 | H858: 6 | I858: =G858*6+H858 -> 36 | K858: 8 | L858: 8 | M858: =K858*6+L858 -> 56 | O858: 8 | P858: 12 | Q858: =O858*6+P858 -> 60 | S858: JACKSON
A859: BEST PLAYERS
A860: PORT MELBOURNE | C860: GROVER | F860: CAULFIELD | I860: CROSHER | L860: HOWELL | O860: PERRY | R860: MILNER
A861: SANDRINGHAM | C861: PETERS | F861: GRANGER | I861: VAUGHAN | L861: HOAR | O861: O'TOOLE | R861: SELLECK
A862: GOALKICKERS
A863: PORT MELBOURNE | C863: HOWELL 4 | F863: CARLILE 3 | I863: MILNER 3 | K863: LEWIS 2 | M863: MITHEN | O863: BEDFORD | Q863: BROWNHILL
A864: SANDRINGHAM | C864: O'TOOLE 3 | F864: SELLECK 2 | I864: HANCE | K864: VAUGHAN | N864: OAKLEY
A866: 2ND SEMI | D866: 11TH SEPTEMBER | J866: WEATHER | L866: FINE BUT HAZY
A867: WAVERLEY | C867: 1 | D867: 3 | E867: =C867*6+D867 -> 9 | G867: 6 | H867: 6 | I867: =G867*6+H867 -> 42 | K867: 7 | L867: 14 | M867: =K867*6+L867 -> 56 | O867: 8 | P867: 17 | Q867: =O867*6+P867 -> 65 | S867: PORT MELBOURNE
A868: DANDENONG | C868: 1 | D868: 3 | E868: =C868*6+D868 -> 9 | G868: 3 | H868: 5 | I868: =G868*6+H868 -> 23 | K868: 4 | L868: 8 | M868: =K868*6+L868 -> 32 | O868: 8 | P868: 10 | Q868: =O868*6+P868 -> 58 | S868: McMASTER
A869: BEST PLAYERS
A870: WAVERLEY | C870: VARLAMOS | F870: THOROGOOD | I870: POORE | L870: MITHEN | O870: INNES | Q870: MERRETT
A871: DANDENONG | C871: SHINNERS | F871: CLARK | I871: PENNEFATHER | L871: GREENWOOD | O871: BARRAN | Q871: McMILLAN
A872: GOALKICKERS
A873: WAVERLEY | C873: MERRETT 2 | F873: LAWSON 2 | I873: NATION 2 | L873: MITHEN | N873: PETZKE
A874: DANDENONG | C874: LIENERT 2 | F874: GREENWOOD 2 | J874: MELAI 2 | L874: SUTTON | N874: ABRAHAM
A876: PRELIMINARY FINAL | F876: 19TH SEPTEMBER | K876: WEATHER | M876: WEST WIND DULL SHOWERS 3RD QTR
A877: PORT MELBOURNE | C877: 2 | D877: 5 | E877: =C877*6+D877 -> 17 | G877: 7 | H877: 9 | I877: =G877*6+H877 -> 51 | K877: 11 | L877: 15 | M877: =K877*6+L877 -> 81 | O877: 16 | P877: 19 | Q877: =O877*6+P877 -> 115 | S877: PORT MELBOURNE
A878: DANDENONG | C878: 2 | D878: 2 | E878: =C878*6+D878 -> 14 | G878: 5 | H878: 8 | I878: =G878*6+H878 -> 38 | K878: 7 | L878: 11 | M878: =K878*6+L878 -> 53 | O878: 8 | P878: 19 | Q878: =O878*6+P878 -> 67 | S878: McMASTER
A879: BEST PLAYERS
A880: PORT MELBOURNE | C880: MITHEN | F880: BEDFORD | I880: HOWELL | L880: PERRY | O880: GROVER | R880: BROWNHILL
A881: DANDENONG | C881: OSBORNE | F881: GREENWOOD | I881: ANDREWS | L881: ABRAHAM | O881: CLARK | R881: LIENERT
A882: GOALKICKERS
A883: PORT MELBOURNE | C883: HOWELL 6 | F883: PERRY 3 | I883: MILNER 2 | L883: CARLILE 2 | O883: TATE | Q883: MITHEN | S883: BROWNHILL
A884: DANDENONG | C884: LIENERT 2 | F884: McNAMARA 2 | J884: ABRAHAM 2 | M884: WHALEBONE | P884: ARNOLD
A886: GRAND FINAL | E886: 26TH SEPTEMBER | J886: WEATHER | M886: NORTH WEST WIND WARM
A887: WAVERLEY | C887: 1 | D887: 4 | E887: 10 | G887: 4 | H887: 8 | I887: 32 | K887: 10 | L887: 10 | M887: 70 | O887: 14 | P887: 13 | Q887: =O887*6+P887 -> 97 | S887: PORT MELBOURNE
A888: PORT MELBOURNE | C888: 4 | D888: 9 | E888: 33 | G888: 5 | H888: 15 | I888: 45 | K888: 8 | L888: 18 | M888: 66 | O888: 10 | P888: 25 | Q888: =O888*6+P888 -> 85 | S888: McMASTER
A889: BEST PLAYERS
A890: WAVERLEY | C890: LAWSON | F890: INNES | I890: POORE | L890: VARLAMOS | O890: MERRETT | R890: MITHEN
A891: PORT MELBOURNE | C891: HOWELL | F891: GROVER | I891: CROSHER | L891: RENOUF | O891: CAULFIELD | R891: PERRY
A892: GOALKICKERS
A893: WAVERLEY | C893: LAWSON 4 | F893: MERRETT 3 | I893: BREWSTER 2 | L893: BRENCHLEY 2 | O893: PETZKE 2 | R893: LOCKWOOD
A894: PORT MELBOURNE | C894: HOWELL 4 | F894: PERRY 3 | I894: BROWNHILL | L894: CARLILE | O894: MILNER
A896: REPRESENTATIVE MATCHES
E897: 12TH JUNE | J897: WEATHER | N897: FINE
D898: 1ST QTR | H898: 2ND QTR | L898: 3RD QTR | P898: FINAL
A899: W.A. | C899: 2 | D899: 7 | E899: =C899*6+D899 -> 19 | G899: 4 | H899: 10 | I899: =G899*6+H899 -> 34 | K899: 9 | L899: 17 | M899: =K899*6+L899 -> 71 | O899: 12 | P899: 17 | Q899: =O899*6+P899 -> 89 | S899: SUBIACO
A900: V.F.A. | C900: 4 | D900: 2 | E900: =C900*6+D900 -> 26 | G900: 7 | H900: 4 | I900: =G900*6+H900 -> 46 | K900: 8 | L900: 6 | M900: =K900*6+L900 -> 54 | O900: 12 | P900: 8 | Q900: =O900*6+P900 -> 80
A901: BEST PLAYERS
A902: W.A. | C902: K MURRAY | F902: CABLE | I902: McINTOSH | L902: MANNING | O902: SARRE | Q902: DEMPSEY
A903: V.F.A. | C903: LUFF | F903: ARNOLD | I903: VARLAMOS | L903: NICHOLLS | O903: WARE | Q903: BROWN
A904: GOALKICKERS
A905: W.A. | C905: EVANS 5 | F905: WALKER 3 | I905: CABLE | K905: THORNLEY | N905: MURRAY | P905: SLATER
A906: V.F.A. | C906: ARNOLD 4 | F906: BROWN 3 | I906: O'TOOLE 2 | L906: BIBBY | N906: ZEUSCHNER | Q906: MITHEN
D908: 17TH JULY | I908: WEATHER | K908: SOUTH EAST WIND RAIN 2ND QTR
A909: V.F.A. | C909: 3 | D909: 0 | E909: =C909*6+D909 -> 18 | G909: 8 | H909: 3 | I909: =G909*6+H909 -> 51 | K909: 9 | L909: 5 | M909: =K909*6+L909 -> 59 | O909: 12 | P909: 11 | Q909: =O909*6+P909 -> 83 | S909: TOORAK PARK
A910: TAS | C910: 6 | D910: 4 | E910: =C910*6+D910 -> 40 | G910: 7 | H910: 7 | I910: =G910*6+H910 -> 49 | K910: 10 | L910: 10 | M910: =K910*6+L910 -> 70 | O910: 11 | P910: 10 | Q910: =O910*6+P910 -> 76 | S910: GRANT
A911: BEST PLAYERS
A912: V.F.A. | C912: ROBINSON | F912: VERWOERT | I912: VARLAMOS | L912: CROSBIE | O912: CROSHER | R912: NICHOLLS
A913: TAS | C913: LEE | F913: HOLMES | I913: JONES | L913: MARNEY | O913: McMAHON | R913: RAITT
A914: GOALKICKERS
A915: V.F.A. | C915: O'TOOLE 3 | F915: BURNS 2 | I915: VERWOERT 2 | L915: ZEUSCHNER | O915: OAKLEY | Q915: RYAN | S915: TAGGART | V915: COOK
A916: TAS | C916: MOLES 3 | F916: REVELL 2 | I916: JONES 2 | L916: LAWRENCE | O916: PAYNE | Q916: HOLMES | S916: BONNEY