A1: Victorian Football Association
A2: Season 1966 - Division One
A3: © Copyright Wal Williams | F3: First created: 2 May 2015
A4: Contact: joywalwi at gmail dot com | F4: Last updated: 2 May 2015 | W4: VFA Results and tables - Link to the main index page
A5: You are free to copy this document in whole or part provided that proper acknowledgement is given to the author. All rights reserved.
A7: 1966 | C7: V.F.A. SEASON 1ST DIVISION | CA7: \D | CB7: {GOTO}BJ3~/M{RIGHT 7}{END}{DOWN}~G4~
A8: ROUND 1 | E8: 23RD APRIL | J8: WEATHER | N8: S.E.BREEZE DULL | S8: PLAYED AT | CB8: {GOTO}AL3~/M{END}{RIGHT}{END}{DOWN}~P3~
D9: 1ST QTR | H9: 2ND QTR | L9: 3RD QTR | P9: FINAL | S9: DANDENONG | CB9: {GOTO}BJ23~/M{RIGHT 7}{END}{DOWN}~V4~
A10: WAVERLEY | C10: 5 | D10: 5 | E10: =C10*6+D10 -> 35 | G10: 6 | H10: 6 | I10: =G10*6+H10 -> 42 | K10: 14 | L10: 12 | M10: =K10*6+L10 -> 96 | O10: 17 | P10: 12 | Q10: =O10*6+P10 -> 114 | S10: UMPIRE | X10: LADDER | AB10: ROUND | AD10: 1 | CB10: {GOTO}BJ43~/M{RIGHT 7}{END}{DOWN}~G24~
A11: DANDENONG | C11: 2 | D11: 3 | E11: =C11*6+D11 -> 15 | G11: 5 | H11: 12 | I11: =G11*6+H11 -> 42 | K11: 7 | L11: 13 | M11: =K11*6+L11 -> 55 | O11: 13 | P11: 14 | Q11: =O11*6+P11 -> 92 | S11: FLANAGAN | CB11: {GOTO}AL23~/M{END}{RIGHT}{END}{DOWN}~P23~
A12: BEST PLAYERS | W12: TEAM | X12: W | Y12: L | Z12: D | AA12: FOR | AB12: AGST | AC12: % | AD12: PTS | CB12: {GOTO}BJ63~/M{RIGHT 7}{END}{DOWN}~V24~
A13: WAVERLEY | C13: INNES | E13: NATION | H13: BREWSTER | K13: ROLFE | N13: GALLUS | Q13: THOROGOOD | CB13: {GOTO}BJ83~/M{RIGHT 7}{END}{DOWN}~G44~
A14: DANDENONG | C14: MELAI | E14: WIGHT | H14: GREENWOOD | K14: GRAVENER | N14: EVANS | Q14: BOOGERT | W14: COBURG | X14: 1 | Y14: 0 | Z14: 0 | AA14: 93 | AB14: 51 | AC14: 182.35 | AD14: 4 | CB14: {GOTO}AL43~/M{END}{RIGHT}{END}{DOWN}~P43~
A15: GOALKICKERS | W15: PORT MELBOURNE | X15: 1 | Y15: 0 | Z15: 0 | AA15: 61 | AB15: 36 | AC15: 169.44444444444446 | AD15: 4 | CB15: {GOTO}BJ103~/M{RIGHT 7}{END}{DOWN}~V44~
A16: WAVERLEY | C16: BREWSTER 6 | F16: NATION 4 | I16: LOCKWOOD 2 | L16: REEVES 2 | N16: MITHEN | P16: GALLUS | R16: POORE | W16: YARRAVILLE | X16: 1 | Y16: 0 | Z16: 0 | AA16: 98 | AB16: 72 | AC16: 136.11111111111111 | AD16: 4 | CB16: {GOTO}BJ123~/M{RIGHT 7}{END}{DOWN}~G64~
A17: DANDENONG | C17: WIGHT 4 | F17: MELAI 4 | I17: McNAMARA 2 | L17: GREENWOOD | O17: LIENERT | Q17: WHALEBONE | W17: WAVERLEY | X17: 1 | Y17: 0 | Z17: 0 | AA17: 114 | AB17: 92 | AC17: 123.91304347826087 | AD17: 4 | CB17: {GOTO}AL63~/M{END}{RIGHT}{END}{DOWN}~P63~
D18: 24TH APRIL | I18: WEATHER | L18: FINE | CB18: {GOTO}BJ143~/M{RIGHT 7}{END}{DOWN}~V64~
A19: COBURG | C19: 4 | D19: 6 | E19: =C19*6+D19 -> 30 | G19: 4 | H19: 6 | I19: =G19*6+H19 -> 30 | K19: 11 | L19: 12 | M19: =K19*6+L19 -> 78 | O19: 13 | P19: 15 | Q19: =O19*6+P19 -> 93 | S19: COBURG | W19: BRUNSWICK | X19: 1 | Y19: 0 | Z19: 0 | AA19: 98 | AB19: 93 | AC19: 105.3763440860215 | AD19: 4 | CB19: {GOTO}BJ163~/M{RIGHT 7}{END}{DOWN}~G84~
A20: OAKLEIGH | C20: 1 | D20: 0 | E20: =C20*6+D20 -> 6 | G20: 4 | H20: 6 | I20: =G20*6+H20 -> 30 | K20: 5 | L20: 6 | M20: =K20*6+L20 -> 36 | O20: 7 | P20: 9 | Q20: =O20*6+P20 -> 51 | S20: JACKSON | W20: PRESTON | X20: 0 | Y20: 1 | Z20: 0 | AA20: 93 | AB20: 98 | AC20: 94.897959183673464 | AD20: 0 | CB20: {GOTO}AL83~/M{END}{RIGHT}{END}{DOWN}~P83~
A21: BEST PLAYERS | W21: DANDENONG | X21: 0 | Y21: 1 | Z21: 0 | AA21: 92 | AB21: 114 | AC21: 80.701754385964918 | AD21: 0 | CB21: {GOTO}BJ183~/M{RIGHT 7}{END}{DOWN}~V84~
A22: COBURG | C22: J WELSH | E22: ACKLAND | H22: SULLIVAN | K22: TANCREDI | N22: BRANSTON | Q22: THOMPSON | W22: SANDRINGHAM | X22: 0 | Y22: 1 | Z22: 0 | AA22: 72 | AB22: 98 | AC22: 73.469387755102048 | AD22: 0 | CB22: {GOTO}BJ203~/M{RIGHT 7}{END}{DOWN}~G104~
A23: OAKLEIGH | C23: LYON | E23: MORCOM | H23: FORD | K23: WAPLING | N23: DEFTEROUS | Q23: LOVELESS | W23: WILLIAMSTOWN | X23: 0 | Y23: 1 | Z23: 0 | AA23: 36 | AB23: 61 | AC23: 59.016393442622949 | AD23: 0 | CB23: {GOTO}AL103~/M{END}{RIGHT}{END}{DOWN}~P103~
A24: GOALKICKERS | W24: OAKLEIGH | X24: 0 | Y24: 1 | Z24: 0 | AA24: 51 | AB24: 93 | AC24: 54.84 | AD24: 0 | CB24: {GOTO}BJ223~/M{RIGHT 7}{END}{DOWN}~V104~
A25: COBURG | C25: BRANSTON 4 | F25: THOMPSON 3 | I25: CHALLENGER 2 | L25: WATSON | N25: MIERS | P25: FITZPATRICK | S25: BORDIGNON | CB25: {GOTO}BJ243~/M{RIGHT 7}{END}{DOWN}~G124~
A26: OAKLEIGH | C26: McCORKELL | F26: HAINING | H26: WARREN | J26: LYON | L26: LOVELESS | O26: JORDAN | Q26: WAPLING | CB26: {GOTO}AL123~/M{END}{RIGHT}{END}{DOWN}~P123~
CB27: {GOTO}BJ263~/M{RIGHT 7}{END}{DOWN}~V124~
A28: PORT MELBOURNE | C28: 2 | D28: 2 | E28: =C28*6+D28 -> 14 | G28: 4 | H28: 2 | I28: =G28*6+H28 -> 26 | K28: 7 | L28: 6 | M28: =K28*6+L28 -> 48 | O28: 9 | P28: 7 | Q28: =O28*6+P28 -> 61 | S28: WILLIAMSTOWN | CB28: {GOTO}BJ283~/M{RIGHT 7}{END}{DOWN}~G144~
A29: WILLIAMSTOWN | C29: 0 | D29: 2 | E29: =C29*6+D29 -> 2 | G29: 3 | H29: 4 | I29: =G29*6+H29 -> 22 | K29: 3 | L29: 6 | M29: =K29*6+L29 -> 24 | O29: 5 | P29: 6 | Q29: =O29*6+P29 -> 36 | S29: O'NEILL | CB29: {GOTO}AL143~/M{END}{RIGHT}{END}{DOWN}~P143~
A30: BEST PLAYERS | CB30: {GOTO}BJ303~/M{RIGHT 7}{END}{DOWN}~V144~
A31: PORT MELBOURNE | C31: BEDFORD | F31: CAULFIELD | I31: WILLIAMS | L31: HOWELL | O31: PERRY | Q31: HOUSE | CB31: {GOTO}BJ323~/M{RIGHT 7}{END}{DOWN}~G164~
A32: WILLIAMSTOWN | C32: WARE | F32: TURNER | I32: JAMES | L32: MAGILL | O32: CLOUGH | Q32: RUSSELL | CB32: {GOTO}AL163~/M{END}{RIGHT}{END}{DOWN}~P163~
A33: GOALKICKERS | CB33: {GOTO}BJ343~/M{RIGHT 7}{END}{DOWN}~V164~
A34: PORT MELBOURNE | C34: PERRY 4 | F34: BYRNE 2 | I34: BEDFORD | K34: HOWELL | M34: SCHMIDT | CB34: {HOME}
A35: WILLIAMSTOWN | C35: TURNER 2 | F35: McDONALD 2 | J35: WARE
A37: BRUNSWICK | C37: 3 | D37: 1 | E37: =C37*6+D37 -> 19 | G37: 5 | H37: 5 | I37: =G37*6+H37 -> 35 | K37: 8 | L37: 5 | M37: =K37*6+L37 -> 53 | O37: 14 | P37: 14 | Q37: =O37*6+P37 -> 98 | S37: PRESTON
A38: PRESTON | C38: 5 | D38: 5 | E38: =C38*6+D38 -> 35 | G38: 9 | H38: 8 | I38: =G38*6+H38 -> 62 | K38: 12 | L38: 14 | M38: =K38*6+L38 -> 86 | O38: 13 | P38: 15 | Q38: =O38*6+P38 -> 93 | S38: GANNON
A39: BEST PLAYERS
A40: BRUNSWICK | C40: DENTON | F40: ROBINS | I40: BIBBY | L40: COOK | N40: NOONAN | Q40: McKINNON
A41: PRESTON | C41: CAMERON | F41: DINEEN | I41: HINDMARSH | L41: HANVIN | N41: PERRY | Q41: ALEXANDER
A42: GOALKICKERS
A43: BRUNSWICK | C43: COOK 4 | E43: BURNS 2 | G43: ROBINS | I43: M McKINNON | L43: K DILLON | N43: McNAMARA | Q43: WHILEY | S43: ARTHUR | V43: BIBBY | X43: LEYDIN
A44: PRESTON | C44: WALKER 5 | F44: WADDELL 2 | I44: MURNANE 2 | L44: JENKINS | N44: CAMERON | Q44: DALTON | S44: LEMPRIERE
A46: YARRAVILLE | C46: 0 | D46: 2 | E46: =C46*6+D46 -> 2 | G46: 4 | H46: 6 | I46: =G46*6+H46 -> 30 | K46: 8 | L46: 8 | M46: =K46*6+L46 -> 56 | O46: 14 | P46: 14 | Q46: =O46*6+P46 -> 98 | S46: JUNCTION OVAL
A47: SANDRINGHAM | C47: 4 | D47: 5 | E47: =C47*6+D47 -> 29 | G47: 4 | H47: 7 | I47: =G47*6+H47 -> 31 | K47: 7 | L47: 10 | M47: =K47*6+L47 -> 52 | O47: 10 | P47: 12 | Q47: =O47*6+P47 -> 72 | S47: ARMSTRONG
A48: BEST PLAYERS
A49: YARRAVILLE | C49: MADIGAN | F49: RON BROWN | I49: MEDDINGS | L49: FELL | O49: McDONALD | R49: CASTRICUM
A50: SANDRINGHAM | C50: OAKLEY | F50: MEANEY | I50: HANCE | L50: VAUGHAN | O50: LADDS | R50: SMITH
A51: GOALKICKERS
A52: YARRAVILLE | C52: MADIGAN 3 | F52: FELL 3 | I52: ROWE 3 | K52: CASTRICUM 3 | N52: RON BROWN | Q52: McDONALD
A53: SANDRINGHAM | C53: OAKLEY 4 | F53: O'TOOLE 2 | I53: ZEUSCHNER 2 | L53: MEANEY | N53: MUTER
A55: ROUND 2 | E55: 30TH APRIL | M55: S.W.BREEZE SHOWERS | S55: PLAYED AT
D56: 1ST QTR | H56: 2ND QTR | L56: 3RD QTR | P56: FINAL | S56: WAVERLEY
A57: WAVERLEY | C57: 4 | D57: 6 | E57: =C57*6+D57 -> 30 | G57: 6 | H57: 9 | I57: =G57*6+H57 -> 45 | K57: 10 | L57: 13 | M57: =K57*6+L57 -> 73 | O57: 12 | P57: 18 | Q57: =O57*6+P57 -> 90 | S57: UMPIRE | X57: LADDER | AB57: ROUND | AD57: 2
A58: WILLIAMSTOWN | C58: 0 | D58: 1 | E58: =C58*6+D58 -> 1 | G58: 2 | H58: 4 | I58: =G58*6+H58 -> 16 | K58: 2 | L58: 6 | M58: =K58*6+L58 -> 18 | O58: 6 | P58: 8 | Q58: =O58*6+P58 -> 44 | S58: DIXON
A59: BEST PLAYERS | W59: TEAM | X59: W | Y59: L | Z59: D | AA59: FOR | AB59: AGST | AC59: % | AD59: PTS
A60: WAVERLEY | C60: NATION | F60: POORE | I60: GALLUS | L60: VARLAMOS | O60: PETZKE | Q60: MITHEN
A61: WILLIAMSTOWN | C61: McCARTEN | F61: LEONARD | I61: BAMFORD | L61: RUSSELL | O61: MAGILL | Q61: JAMES | W61: WAVERLEY | X61: 2 | Y61: 0 | Z61: 0 | AA61: 204 | AB61: 136 | AC61: 150 | AD61: 8
A62: GOALKICKERS | W62: YARRAVILLE | X62: 2 | Y62: 0 | Z62: 0 | AA62: 249 | AB62: 178 | AC62: 139.89 | AD62: 8
A63: WAVERLEY | C63: GALLUS 6 | F63: NATION 3 | I63: BRENCHLEY | L63: LOCKWOOD | O63: BREWSTER | W63: PORT MELBOURNE | X63: 2 | Y63: 0 | Z63: 0 | AA63: 153 | AB63: 116 | AC63: 131.89655172413794 | AD63: 8
A64: WILLIAMSTOWN | C64: MAGILL 2 | F64: McDONALD 2 | I64: WALLACE | L64: LEONARD | W64: BRUNSWICK | X64: 2 | Y64: 0 | Z64: 0 | AA64: 200 | AB64: 155 | AC64: 129.03225806451613 | AD64: 8
E65: 1ST MAY | J65: WEATHER | M65: FINE
A66: PORT MELBOURNE | C66: 5 | D66: 0 | E66: =C66*6+D66 -> 30 | G66: 6 | H66: 1 | I66: =G66*6+H66 -> 37 | K66: 11 | L66: 5 | M66: =K66*6+L66 -> 71 | O66: 14 | P66: 8 | Q66: =O66*6+P66 -> 92 | S66: PORT MELBOURNE | W66: SANDRINGHAM | X66: 1 | Y66: 1 | Z66: 0 | AA66: 196 | AB66: 149 | AC66: 131.54362416107384 | AD66: 4
A67: COBURG | C67: 2 | D67: 4 | E67: =C67*6+D67 -> 16 | G67: 9 | H67: 5 | I67: =G67*6+H67 -> 59 | K67: 11 | L67: 6 | M67: =K67*6+L67 -> 72 | O67: 12 | P67: 8 | Q67: =O67*6+P67 -> 80 | S67: FLANAGAN | W67: COBURG | X67: 1 | Y67: 1 | Z67: 0 | AA67: 173 | AB67: 143 | AC67: 120.98 | AD67: 4
A68: BEST PLAYERS | W68: PRESTON | X68: 0 | Y68: 2 | Z68: 0 | AA68: 199 | AB68: 249 | AC68: 79.92 | AD68: 0
A69: PORT MELBOURNE | C69: RENOUF | F69: CAULFIELD | I69: BEDFORD | L69: GROVER | O69: GOLDSMITH | R69: BROWNHILL | W69: DANDENONG | X69: 0 | Y69: 2 | Z69: 0 | AA69: 154 | AB69: 216 | AC69: 71.296296296296291 | AD69: 0
A70: COBURG | C70: BORDIGNON | F70: CHALLENGER | I70: MIERS | L70: THOMPSON | O70: WATSON | R70: ACKLAND | W70: WILLIAMSTOWN | X70: 0 | Y70: 2 | Z70: 0 | AA70: 80 | AB70: 151 | AC70: 52.980132450331126 | AD70: 0
A71: GOALKICKERS | W71: OAKLEIGH | X71: 0 | Y71: 2 | Z71: 0 | AA71: 102 | AB71: 217 | AC71: 47 | AD71: 0
A72: PORT MELBOURNE | C72: GOLDSMITH 7 | F72: BROWNHILL 3 | I72: MILNER 2 | L72: BYRNE | N72: HOWELL
A73: COBURG | C73: CHALLENGER 5 | F73: BORDIGNON 4 | I73: BRANSTON 2 | L73: MIERS
A75: YARRAVILLE | C75: 3 | D75: 0 | E75: =C75*6+D75 -> 18 | G75: 7 | H75: 6 | I75: =G75*6+H75 -> 48 | K75: 16 | L75: 8 | M75: =K75*6+L75 -> 104 | O75: 23 | P75: 13 | Q75: =O75*6+P75 -> 151 | S75: YARRAVILLE
A76: PRESTON | C76: 5 | D76: 1 | E76: =C76*6+D76 -> 31 | G76: 10 | H76: 5 | I76: =G76*6+H76 -> 65 | K76: 13 | L76: 6 | M76: =K76*6+L76 -> 84 | O76: 16 | P76: 10 | Q76: =O76*6+P76 -> 106 | S76: CHAPMAN
A77: BEST PLAYERS
A78: YARRAVILLE | C78: ION | F78: RON BROWN | I78: CASTRICUM | L78: FELL | N78: MEDDINGS | Q78: QUARANTOTTO
A79: PRESTON | C79: LEMPRIERE | F79: TRELOAR | I79: WALKER | L79: EDMONDS | N79: JENKINS | Q79: PINFOLD
A80: GOALKICKERS
A81: YARRAVILLE | C81: ROWE 4 | E81: CASTRICUM 4 | H81: FELL 3 | J81: FOGARTY 3 | M81: QUARANTOTTO 2 | Q81: LARKINS 2 | T81: MADIGAN 2 | W81: McDONALD 2 | X81: RON BROWN
A82: PRESTON | C82: WALKER 9 | F82: LEMPRIERE 2 | I82: ALEXANDER 2 | L82: HINDMARSH | O82: EDMONDS | Q82: WADDELL
A84: BRUNSWICK | C84: 3 | D84: 3 | E84: =C84*6+D84 -> 21 | G84: 7 | H84: 11 | I84: =G84*6+H84 -> 53 | K84: 8 | L84: 14 | M84: =K84*6+L84 -> 62 | O84: 14 | P84: 18 | Q84: =O84*6+P84 -> 102 | S84: BRUNSWICK
A85: DANDENONG | C85: 4 | D85: 3 | E85: =C85*6+D85 -> 27 | G85: 5 | H85: 8 | I85: =G85*6+H85 -> 38 | K85: 7 | L85: 12 | M85: =K85*6+L85 -> 54 | O85: 8 | P85: 14 | Q85: =O85*6+P85 -> 62 | S85: ROWE
A86: BEST PLAYERS
A87: BRUNSWICK | C87: LEYDIN | F87: ROBINS | I87: McKINNON | L87: BIBBY | N87: BURNS | Q87: COOK
A88: DANDENONG | C88: STEDWELL | F88: EVANS | I88: GRAVENER | L88: SUTTON | N88: STAUNTON | Q88: HYNDMANN
A89: GOALKICKERS
A90: BRUNSWICK | C90: LEYDIN 5 | F90: COOK 4 | I90: BURNS 3 | K90: BRIGLIA | M90: McKINNON
A91: DANDENONG | C91: McNAMARA 2 | F91: EVANS 2 | I91: WHALEBONE | L91: STAUNTON | N91: SMITH | P91: MELAI
A93: SANDRINGHAM | C93: 4 | D93: 0 | E93: =C93*6+D93 -> 24 | G93: 9 | H93: 3 | I93: =G93*6+H93 -> 57 | K93: 15 | L93: 5 | M93: =K93*6+L93 -> 95 | O93: 19 | P93: 10 | Q93: =O93*6+P93 -> 124 | S93: OAKLEIGH
A94: OAKLEIGH | C94: 2 | D94: 3 | E94: =C94*6+D94 -> 15 | G94: 3 | H94: 4 | I94: =G94*6+H94 -> 22 | K94: 5 | L94: 7 | M94: =K94*6+L94 -> 37 | O94: 7 | P94: 9 | Q94: =O94*6+P94 -> 51 | S94: GARLICK
A95: BEST PLAYERS
A96: SANDRINGHAM | C96: MACKENZIE | F96: ZEUSCHNER | I96: OAKLEY | L96: HOAR | O96: CLIFFORD | R96: HOLMES
A97: OAKLEIGH | C97: LOVELESS | F97: BEARD | I97: HARRISON | L97: LINDSAY | O97: DEFTEROUS | R97: WAPLING
A98: GOALKICKERS
A99: SANDRINGHAM | C99: OAKLEY 9 | F99: O'TOOLE 3 | I99: ZEUSCHNER 2 | L99: JUDKINS 2 | N99: WILLIAMS 2 | Q99: VAUGHAN
A100: OAKLEIGH | C100: WARREN 2 | F100: HOWLAND | I100: WAPLING | L100: HALL | N100: LOVELESS | Q100: BINDLEY
A102: ROUND 3 | D102: 7TH MAY | I102: WEATHER | L102: NORTH WIND FINE | S102: PLAYED AT
D103: 1ST QTR | H103: 2ND QTR | L103: 3RD QTR | P103: FINAL | S103: COBURG
A104: WAVERLEY | C104: 6 | D104: 5 | E104: =C104*6+D104 -> 41 | G104: 7 | H104: 6 | I104: =G104*6+H104 -> 48 | K104: 14 | L104: 13 | M104: =K104*6+L104 -> 97 | O104: 17 | P104: 14 | Q104: =O104*6+P104 -> 116 | S104: UMPIRE | X104: LADDER | AB104: ROUND | AD104: 3
A105: COBURG | C105: 0 | D105: 2 | E105: =C105*6+D105 -> 2 | G105: 2 | H105: 10 | I105: =G105*6+H105 -> 22 | K105: 2 | L105: 17 | M105: =K105*6+L105 -> 29 | O105: 6 | P105: 27 | Q105: =O105*6+P105 -> 63 | S105: ROWE
A106: BEST PLAYERS | W106: TEAM | X106: W | Y106: L | Z106: D | AA106: FOR | AB106: AGST | AC106: % | AD106: PTS
A107: WAVERLEY | C107: VARLAMOS | F107: POORE | I107: NATION | K107: THOROGOOD | N107: ELLIS | Q107: LOCKWOOD
A108: COBURG | C108: TANCREDI | F108: SULLIVAN | I108: WELSH | K108: CHALLENGER | N108: ACKLAND | Q108: THOMPSON | W108: WAVERLEY | X108: 3 | Y108: 0 | Z108: 0 | AA108: 320 | AB108: 199 | AC108: 160.80402010050253 | AD108: 12
A109: GOALKICKERS | P109: POORE | R109: PETZKE | W109: PORT MELBOURNE | X109: 3 | Y109: 0 | Z109: 0 | AA109: 261 | AB109: 178 | AC109: 146.62921348314606 | AD109: 12
A110: WAVERLEY | C110: McNAMEE 3 | F110: MITHEN 3 | I110: NATION 3 | K110: BREWSTER 2 | N110: GALLUS 2 | Q110: LAWSON | S110: LOCKWOOD | W110: BRUNSWICK | X110: 3 | Y110: 0 | Z110: 0 | AA110: 280 | AB110: 201 | AC110: 139.30348258706468 | AD110: 12
A111: COBURG | C111: BRANSTON 2 | F111: MIERS | H111: FITZPATRICK | K111: CHALLENGER | N111: ACKLAND | W111: YARRAVILLE | X111: 3 | Y111: 0 | Z111: 0 | AA111: 350 | AB111: 268 | AC111: 130.6 | AD111: 12
A113: YARRAVILLE | C113: 6 | D113: 5 | E113: =C113*6+D113 -> 41 | G113: 8 | H113: 6 | I113: =G113*6+H113 -> 54 | K113: 14 | L113: 10 | M113: =K113*6+L113 -> 94 | O113: 15 | P113: 11 | Q113: =O113*6+P113 -> 101 | S113: DANDENONG | W113: SANDRINGHAM | X113: 2 | Y113: 1 | Z113: 0 | AA113: 288 | AB113: 229 | AC113: 125.76419213973799 | AD113: 8
A114: DANDENONG | C114: 2 | D114: 2 | E114: =C114*6+D114 -> 14 | G114: 5 | H114: 5 | I114: =G114*6+H114 -> 35 | K114: 8 | L114: 6 | M114: =K114*6+L114 -> 54 | O114: 13 | P114: 12 | Q114: =O114*6+P114 -> 90 | S114: ARMSTRONG | W114: COBURG | X114: 1 | Y114: 2 | Z114: 0 | AA114: 236 | AB114: 259 | AC114: 91.12 | AD114: 4
A115: BEST PLAYERS | W115: PRESTON | X115: 0 | Y115: 3 | Z115: 0 | AA115: 279 | AB115: 341 | AC115: 81.82 | AD115: 0
A116: YARRAVILLE | C116: FOGARTY | F116: WILSON | I116: RON BROWN | L116: FELL | O116: MEDDINGS | R116: TAURENS | W116: DANDENONG | X116: 0 | Y116: 3 | Z116: 0 | AA116: 244 | AB116: 317 | AC116: 76.971608832807576 | AD116: 0
A117: DANDENONG | C117: BROWN | F117: ROUVRAY | I117: GRAVENER | L117: OSBORNE | O117: WHITEHEAD | R117: EVANS | W117: WILLIAMSTOWN | X117: 0 | Y117: 3 | Z117: 0 | AA117: 126 | AB117: 231 | AC117: 54.545454545454547 | AD117: 0
A118: GOALKICKERS | W118: OAKLEIGH | X118: 0 | Y118: 3 | Z118: 0 | AA118: 164 | AB118: 325 | AC118: 50.46 | AD118: 0
A119: YARRAVILLE | C119: FOGARTY 4 | F119: FELL 3 | H119: ROWE 3 | J119: CONNELLY 2 | M119: RON BROWN | P119: McDONALD | R119: QUARANTOTTO
A120: DANDENONG | C120: SMITH 3 | F120: ROUVRAY 3 | I120: WHALEBONE 2 | L120: GREENWOOD 2 | O120: MELAI | Q120: GRAVENER | S120: LIENERT
E121: 8TH MAY | J121: WEATHER | N121: FINE
A122: SANDRINGHAM | C122: 4 | D122: 2 | E122: =C122*6+D122 -> 26 | G122: 7 | H122: 5 | I122: =G122*6+H122 -> 47 | K122: 11 | L122: 7 | M122: =K122*6+L122 -> 73 | O122: 14 | P122: 8 | Q122: =O122*6+P122 -> 92 | S122: JUNCTION OVAL
A123: PRESTON | C123: 0 | D123: 7 | E123: =C123*6+D123 -> 7 | G123: 3 | H123: 8 | I123: =G123*6+H123 -> 26 | K123: 7 | L123: 10 | M123: =K123*6+L123 -> 52 | O123: 11 | P123: 14 | Q123: =O123*6+P123 -> 80 | S123: O'NEILL
A124: BEST PLAYERS
A125: SANDRINGHAM | C125: CLIFFORD | F125: VAUGHAN | I125: JUDKINS | L125: O'TOOLE | O125: GRANGER | R125: LADDS
A126: PRESTON | C126: DALTON | F126: ALEXANDER | I126: DINEEN | L126: HANVIN | O126: WADDELL | R126: JOYCE
A127: GOALKICKERS
A128: SANDRINGHAM | C128: JUDKINS 4 | F128: O'TOOLE 3 | I128: MEANEY 2 | L128: ZEUSCHNER 2 | O128: CLIFFORD | Q128: MUTER | S128: AGHAN
A129: PRESTON | C129: WALKER 4 | F129: LEMPRIERE 2 | I129: WADDELL 2 | L129: JENKINS 2 | O129: HINDMARSH
A131: BRUNSWICK | C131: 2 | D131: 5 | E131: =C131*6+D131 -> 17 | G131: 4 | H131: 7 | I131: =G131*6+H131 -> 31 | K131: 10 | L131: 13 | M131: =K131*6+L131 -> 73 | O131: 11 | P131: 14 | Q131: =O131*6+P131 -> 80 | S131: WILLIAMSTOWN
A132: WILLIAMSTOWN | C132: 3 | D132: 0 | E132: =C132*6+D132 -> 18 | G132: 3 | H132: 6 | I132: =G132*6+H132 -> 24 | K132: 3 | L132: 7 | M132: =K132*6+L132 -> 25 | O132: 6 | P132: 10 | Q132: =O132*6+P132 -> 46 | S132: JACKSON
A133: BEST PLAYERS
A134: BRUNSWICK | C134: ROBINSON | F134: NOONAN | I134: AYRES | L134: BRIGLIA | O134: McGRATH | R134: BURNS
A135: WILLIAMSTOWN | C135: JAMES | F135: ROGAN | I135: WARD | L135: RUSSELL | O135: CLOUGH | R135: B LEE
A136: GOALKICKERS
A137: BRUNSWICK | C137: COOK 3 | F137: BURNS 3 | I137: AYRES 2 | K137: BRIGLIA | M137: BIBBY | O137: PENDLEBURY
A138: WILLIAMSTOWN | C138: MAGILL 2 | F138: JAMES | H138: McDONALD | K138: MURRIE | M138: CLOUGH
A140: PORT MELBOURNE | C140: 6 | D140: 4 | E140: =C140*6+D140 -> 40 | G140: 10 | H140: 7 | I140: =G140*6+H140 -> 67 | K140: 12 | L140: 9 | M140: =K140*6+L140 -> 81 | O140: 16 | P140: 12 | Q140: =O140*6+P140 -> 108 | S140: OAKLEIGH
A141: OAKLEIGH | C141: 3 | D141: 3 | E141: =C141*6+D141 -> 21 | G141: 5 | H141: 6 | I141: =G141*6+H141 -> 36 | K141: 8 | L141: 7 | M141: =K141*6+L141 -> 55 | O141: 9 | P141: 7 | Q141: =O141*6+P141 -> 61 | S141: CRAIG
A142: BEST PLAYERS
A143: PORT MELBOURNE | C143: CAULFIELD | F143: GOLDSMITH | I143: BEDFORD | L143: HOUSE | O143: CROSHER | R143: GROVER
A144: OAKLEIGH | C144: LOVELESS | F144: LUFF | I144: DEFTEROUS | L144: RITCHIE | O144: LYONS | R144: HALL
A145: GOALKICKERS
A146: PORT MELBOURNE | C146: GOLDSMITH 9 | F146: ALLEN 3 | I146: BEDFORD 2 | L146: MILNER 2
A147: OAKLEIGH | C147: HOWLAND 3 | F147: WARREN 2 | I147: RITCHIE | K147: WAPLING | M147: DEFTEROUS | P147: LOVELESS
A149: ROUND 4 | E149: 14TH MAY | J149: WEATHER | M149: NORTH WEST WIND | S149: PLAYED AT
D150: 1ST QTR | H150: 2ND QTR | L150: 3RD QTR | P150: FINAL | S150: WAVERLEY
A151: WAVERLEY | C151: 9 | D151: 4 | E151: =C151*6+D151 -> 58 | G151: 14 | H151: 7 | I151: =G151*6+H151 -> 91 | K151: 18 | L151: 15 | M151: =K151*6+L151 -> 123 | O151: 22 | P151: 19 | Q151: =O151*6+P151 -> 151 | S151: UMPIRE | X151: LADDER | AB151: ROUND | AD151: 4
A152: OAKLEIGH | C152: 1 | D152: 1 | E152: =C152*6+D152 -> 7 | G152: 2 | H152: 6 | I152: =G152*6+H152 -> 18 | K152: 2 | L152: 8 | M152: =K152*6+L152 -> 20 | O152: 6 | P152: 11 | Q152: =O152*6+P152 -> 47 | S152: CHAPLIN
A153: BEST PLAYERS | W153: TEAM | X153: W | Y153: L | Z153: D | AA153: FOR | AB153: AGST | AC153: % | AD153: PTS
A154: WAVERLEY | C154: BRENCHLEY | F154: PETZKE | I154: VARLAMOS | L154: GALLUS | N154: LAWSON | Q154: REEVES
A155: OAKLEIGH | C155: MULDOON | F155: BEARD | I155: DEFTEROUS | L155: LUFF | N155: JORDAN | Q155: McCORKELL | W155: WAVERLEY | X155: 4 | Y155: 0 | Z155: 0 | AA155: 471 | AB155: 246 | AC155: 191.46341463414635 | AD155: 16
A156: GOALKICKERS | P156: MILLARD | R156: NATION | W156: PORT MELBOURNE | X156: 4 | Y156: 0 | Z156: 0 | AA156: 352 | AB156: 245 | AC156: 143.67346938775509 | AD156: 16
A157: WAVERLEY | C157: BRENCHLEY 5 | F157: PETZKE 4 | I157: GALLUS 4 | K157: MITHEN 2 | M157: LAWSON 2 | P157: McNAMEE 2 | S157: BREWSTER | W157: BRUNSWICK | X157: 4 | Y157: 0 | Z157: 0 | AA157: 381 | AB157: 273 | AC157: 139.56043956043956 | AD157: 16
A158: OAKLEIGH | C158: MULDOON 2 | F158: BENETTI | I158: BEARD | K158: WAPLING | M158: LOVELESS | W158: YARRAVILLE | X158: 4 | Y158: 0 | Z158: 0 | AA158: 435 | AB158: 343 | AC158: 126.82 | AD158: 16
E159: 15TH MAY | J159: WEATHER
A160: PORT MELBOURNE | C160: 3 | D160: 2 | E160: =C160*6+D160 -> 20 | G160: 8 | H160: 2 | I160: =G160*6+H160 -> 50 | K160: 12 | L160: 5 | M160: =K160*6+L160 -> 77 | O160: 14 | P160: 7 | Q160: =O160*6+P160 -> 91 | S160: PORT MELBOURNE | W160: SANDRINGHAM | X160: 2 | Y160: 2 | Z160: 0 | AA160: 355 | AB160: 320 | AC160: 110.9375 | AD160: 8
A161: SANDRINGHAM | C161: 3 | D161: 0 | E161: =C161*6+D161 -> 18 | G161: 4 | H161: 2 | I161: =G161*6+H161 -> 26 | K161: 8 | L161: 4 | M161: =K161*6+L161 -> 52 | O161: 10 | P161: 7 | Q161: =O161*6+P161 -> 67 | S161: JACKSON | W161: PRESTON | X161: 1 | Y161: 3 | Z161: 0 | AA161: 358 | AB161: 410 | AC161: 87.32 | AD161: 4
A162: BEST PLAYERS | W162: COBURG | X162: 1 | Y162: 3 | Z162: 0 | AA162: 308 | AB162: 360 | AC162: 85.56 | AD162: 4
A163: PORT MELBOURNE | C163: GRIFFITHS | F163: CAULFIELD | I163: CROSHER | L163: BEDFORD | N163: GROVER | Q163: BUCKLEY | W163: DANDENONG | X163: 0 | Y163: 4 | Z163: 0 | AA163: 313 | AB163: 396 | AC163: 79.040404040404042 | AD163: 0
A164: SANDRINGHAM | C164: O'TOOLE | F164: LADDS | I164: MACKENZIE | L164: BURKE | N164: SMITH | Q164: MEANEY | W164: WILLIAMSTOWN | X164: 0 | Y164: 4 | Z164: 0 | AA164: 201 | AB164: 316 | AC164: 63.607594936708864 | AD164: 0
A165: GOALKICKERS | W165: OAKLEIGH | X165: 0 | Y165: 4 | Z165: 0 | AA165: 211 | AB165: 476 | AC165: 44.33 | AD165: 0
A166: PORT MELBOURNE | C166: GOLDSMITH 4 | F166: BEDFORD 3 | I166: ALLEN 2 | K166: TAGGART | M166: KERR | N166: MILNER | P166: GRIFFITHS | R166: HOWELL
A167: SANDRINGHAM | C167: O'TOOLE 5 | F167: MEANEY 2 | I167: JUDKINS | K167: DE LUCA | M167: BATEMAN
A169: BRUNSWICK | C169: 3 | D169: 3 | E169: =C169*6+D169 -> 21 | G169: 5 | H169: 4 | I169: =G169*6+H169 -> 34 | K169: 12 | L169: 11 | M169: =K169*6+L169 -> 83 | O169: 14 | P169: 17 | Q169: =O169*6+P169 -> 101 | S169: BRUNSWICK
A170: COBURG | C170: 0 | D170: 7 | E170: =C170*6+D170 -> 7 | G170: 1 | H170: 12 | I170: =G170*6+H170 -> 18 | K170: 6 | L170: 13 | M170: =K170*6+L170 -> 49 | O170: 9 | P170: 18 | Q170: =O170*6+P170 -> 72 | S170: O'NEILL
A171: BEST PLAYERS
A172: BRUNSWICK | C172: COOK | F172: PENDLEBURY | I172: BIBBY | L172: ROBINS | O172: NOONAN | R172: McKINNON
A173: COBURG | C173: ACKLAND | F173: THOMPSON | I173: FITZPATRICK | L173: SULLIVAN | O173: JESS | R173: WATSON
A174: GOALKICKERS
A175: BRUNSWICK | C175: COOK 5 | F175: LEYDIN 2 | I175: PENDLEBURY 2 | L175: DENTON 2 | O175: BURNS | Q175: POLLOCK | T175: McKINNON
A176: COBURG | C176: MIERS 2 | F176: THOMPSON 2 | I176: BRANSTON 2 | L176: GRAHAM | N176: ACKLAND | Q176: FITZPATRICK
A178: PRESTON | C178: 0 | D178: 4 | E178: =C178*6+D178 -> 4 | G178: 2 | H178: 6 | I178: =G178*6+H178 -> 18 | K178: 6 | L178: 10 | M178: =K178*6+L178 -> 46 | O178: 11 | P178: 13 | Q178: =O178*6+P178 -> 79 | S178: PRESTON
A179: DANDENONG | C179: 3 | D179: 1 | E179: =C179*6+D179 -> 19 | G179: 7 | H179: 2 | I179: =G179*6+H179 -> 44 | K179: 7 | L179: 4 | M179: =K179*6+L179 -> 46 | O179: 10 | P179: 9 | Q179: =O179*6+P179 -> 69 | S179: GARLICK
A180: BEST PLAYERS
A181: PRESTON | C181: ALEXANDER | F181: G PERRY | I181: DALTON | L181: DINEEN | O181: WADDELL | R181: HINDMARSH
A182: DANDENONG | C182: GREENWOOD | F182: GRAVENER | I182: SUTTON | L182: OSBORNE | O182: ANDREWS | R182: WHITEHEAD
A183: GOALKICKERS
A184: PRESTON | C184: DALTON 3 | F184: JOYCE 2 | I184: WALKER 2 | L184: ALEXANDER | O184: HEDGECOCK | R184: PARRIS | T184: HINDMARSH
A185: DANDENONG | C185: SMITH 3 | E185: WHALEBONE 2 | I185: LIENERT 2 | L185: McNAMARA | O185: GREENWOOD | R185: EVANS
A187: YARRAVILLE | C187: 3 | D187: 4 | E187: =C187*6+D187 -> 22 | G187: 6 | H187: 4 | I187: =G187*6+H187 -> 40 | K187: 9 | L187: 9 | M187: =K187*6+L187 -> 63 | O187: 12 | P187: 13 | Q187: =O187*6+P187 -> 85 | S187: YARRAVILLE
A188: WILLIAMSTOWN | C188: 3 | D188: 1 | E188: =C188*6+D188 -> 19 | G188: 3 | H188: 7 | I188: =G188*6+H188 -> 25 | K188: 6 | L188: 8 | M188: =K188*6+L188 -> 44 | O188: 11 | P188: 9 | Q188: =O188*6+P188 -> 75 | S188: CRAIG
A189: BEST PLAYERS
A190: YARRAVILLE | C190: MEDDINGS | F190: FELL | I190: ION | K190: CASTRICUM | N190: TAURENS | Q190: FOGARTY
A191: WILLIAMSTOWN | C191: EVANS | F191: WARE | I191: RUSSELL | K191: RAFFLE | N191: SAVIGE | Q191: JAMES
A192: GOALKICKERS
A193: YARRAVILLE | C193: FELL 3 | E193: CASTRICUM 2 | H193: LIENERT 2 | J193: CONNELLY 2 | M193: FOGARTY 2 | P193: LARKIN
A194: WILLIAMSTOWN | C194: WILLIAMS 3 | F194: O'HALLORAN 2 | J194: TURNER 2 | M194: MAGILL | O194: COHEN | Q194: WARE
A196: ROUND 5 | E196: 21ST MAY | J196: WEATHER | N196: SOUTH WIND SHOWERS | S196: PLAYED AT
D197: 1ST QTR | H197: 2ND QTR | L197: 3RD QTR | P197: FINAL | S197: PORT MELBOURNE
A198: PORT MELBOURNE | C198: 4 | D198: 1 | E198: =C198*6+D198 -> 25 | G198: 6 | H198: 4 | I198: =G198*6+H198 -> 40 | K198: 8 | L198: 7 | M198: =K198*6+L198 -> 55 | O198: 12 | P198: 8 | Q198: =O198*6+P198 -> 80 | S198: UMPIRE | X198: LADDER | AB198: ROUND | AD198: 5
A199: WAVERLEY | C199: 2 | D199: 4 | E199: =C199*6+D199 -> 16 | G199: 3 | H199: 6 | I199: =G199*6+H199 -> 24 | K199: 4 | L199: 10 | M199: =K199*6+L199 -> 34 | O199: 6 | P199: 11 | Q199: =O199*6+P199 -> 47 | S199: O'NEILL
A200: BEST PLAYERS | W200: TEAM | X200: W | Y200: L | Z200: D | AA200: FOR | AB200: AGST | AC200: % | AD200: PTS
A201: PORT MELBOURNE | C201: BEDFORD | F201: CROSHER | I201: HOWELL | L201: BUCKLEY | O201: MILNER | Q201: HOUSE
A202: WAVERLEY | C202: POORE | F202: PETZKE | I202: REEVES | L202: MITHEN | O202: ELLIS | Q202: GALLUS | W202: PORT MELBOURNE | X202: 5 | Y202: 0 | Z202: 0 | AA202: 432 | AB202: 292 | AC202: 147.94520547945206 | AD202: 20
A203: GOALKICKERS | W203: BRUNSWICK | X203: 5 | Y203: 0 | Z203: 0 | AA203: 448 | AB203: 326 | AC203: 137.42331288343559 | AD203: 20
A204: PORT MELBOURNE | C204: GOLDSMITH 4 | F204: HOWELL 3 | I204: MILNER 2 | L204: BEDFORD | N204: BOWEN | P204: HOUSE | W204: YARRAVILLE | X204: 5 | Y204: 0 | Z204: 0 | AA204: 521 | AB204: 405 | AC204: 128.64 | AD204: 20
A205: WAVERLEY | C205: LAWSON | E205: GALLUS | G205: NATION | I205: LOCKWOOD | L205: BRENCHLEY | O205: BREWSTER | W205: WAVERLEY | X205: 4 | Y205: 1 | Z205: 0 | AA205: 518 | AB205: 326 | AC205: 158.89570552147239 | AD205: 16
A207: YARRAVILLE | C207: 6 | D207: 4 | E207: =C207*6+D207 -> 40 | G207: 9 | H207: 7 | I207: =G207*6+H207 -> 61 | K207: 10 | L207: 11 | M207: =K207*6+L207 -> 71 | O207: 12 | P207: 14 | Q207: =O207*6+P207 -> 86 | S207: COBURG | W207: SANDRINGHAM | X207: 2 | Y207: 3 | Z207: 0 | AA207: 442 | AB207: 432 | AC207: 102.31481481481481 | AD207: 8
A208: COBURG | C208: 0 | D208: 1 | E208: =C208*6+D208 -> 1 | G208: 4 | H208: 7 | I208: =G208*6+H208 -> 31 | K208: 4 | L208: 8 | M208: =K208*6+L208 -> 32 | O208: 9 | P208: 8 | Q208: =O208*6+P208 -> 62 | S208: GARLICK | W208: PRESTON | X208: 2 | Y208: 3 | Z208: 0 | AA208: 437 | AB208: 475 | AC208: 92 | AD208: 8
A209: BEST PLAYERS | W209: DANDENONG | X209: 1 | Y209: 4 | Z209: 0 | AA209: 425 | AB209: 483 | AC209: 87.991718426501038 | AD209: 4
A210: YARRAVILLE | C210: FELL | F210: QUARANTOTTO | I210: COLLINGS | L210: RON BROWN | O210: ION | R210: MEDDINGS | W210: COBURG | X210: 1 | Y210: 4 | Z210: 0 | AA210: 370 | AB210: 446 | AC210: 82.96 | AD210: 4
A211: COBURG | C211: FITZPATRICK | F211: BOSCHEN | I211: ACKLAND | L211: TANCREDI | O211: BORDIGNON | R211: GRAHAM | W211: WILLIAMSTOWN | X211: 0 | Y211: 5 | Z211: 0 | AA211: 266 | AB211: 395 | AC211: 67.341772151898738 | AD211: 0
A212: GOALKICKERS | W212: OAKLEIGH | X212: 0 | Y212: 5 | Z212: 0 | AA212: 264 | AB212: 543 | AC212: 48.62 | AD212: 0
A213: YARRAVILLE | C213: FELL 3 | E213: QUARANTOTTO 3 | I213: RON BROWN 2 | L213: CASTRIKUM 2 | O213: CONNELLY | R213: FOGARTY
A214: COBURG | C214: GRAHAM 4 | F214: CHALLENGER 2 | J214: GONINON | M214: BEYNON | O214: BOSCHEN
A216: DANDENONG | C216: 5 | D216: 10 | E216: =C216*6+D216 -> 40 | G216: 5 | H216: 13 | I216: =G216*6+H216 -> 43 | K216: 9 | L216: 14 | M216: =K216*6+L216 -> 68 | O216: 16 | P216: 16 | Q216: =O216*6+P216 -> 112 | S216: DANDENONG
A217: SANDRINGHAM | C217: 1 | D217: 2 | E217: =C217*6+D217 -> 8 | G217: 7 | H217: 5 | I217: =G217*6+H217 -> 47 | K217: 9 | L217: 7 | M217: =K217*6+L217 -> 61 | O217: 13 | P217: 9 | Q217: =O217*6+P217 -> 87 | S217: DIXON
A218: BEST PLAYERS
A219: DANDENONG | C219: BROWN | F219: WETZEL | I219: STEDWELL | L219: STAUNTON | O219: LIENERT | Q219: OSBORNE
A220: SANDRINGHAM | C220: ZEUSCHNER | F220: LADDS | I220: O'DWYER | L220: McKENZIE | O220: DIXON | Q220: CLIFFORD
A221: GOALKICKERS
A222: DANDENONG | C222: WETZEL 4 | F222: SMITH 4 | I222: EVANS 3 | K222: SUTTON 2 | N222: LIENERT | P222: GREENWOOD | S222: PATERSON
A223: SANDRINGHAM | C223: ZEUSCHNER 7 | F223: ARON 2 | I223: O'TOOLE 2 | L223: JUDKINS 2
A225: PRESTON | C225: 4 | D225: 2 | E225: =C225*6+D225 -> 26 | G225: 8 | H225: 5 | I225: =G225*6+H225 -> 53 | K225: 11 | L225: 6 | M225: =K225*6+L225 -> 72 | O225: 12 | P225: 7 | Q225: =O225*6+P225 -> 79 | S225: WILLIAMSTOWN
A226: WILLIAMSTOWN | C226: 1 | D226: 2 | E226: =C226*6+D226 -> 8 | G226: 2 | H226: 2 | I226: =G226*6+H226 -> 14 | K226: 7 | L226: 2 | M226: =K226*6+L226 -> 44 | O226: 10 | P226: 5 | Q226: =O226*6+P226 -> 65 | S226: FLANAGAN
A227: BEST PLAYERS
A228: PRESTON | C228: ALEXANDER | F228: HINDMARSH | I228: HANVIN | L228: WALKER | O228: WADDELL | R228: JOYCE
A229: WILLIAMSTOWN | C229: WARE | F229: JAMES | I229: TURNER | L229: PLEITNER | O229: EVANS | R229: WILLIAMS
A230: GOALKICKERS
A231: PRESTON | C231: WALKER 6 | F231: DALTON 2 | I231: HINDMARSH 2 | L231: PERRY | N231: ALEXANDER
A232: WILLIAMSTOWN | C232: PLEITNER 2 | F232: TURNER 2 | I232: MAGILL 2 | L232: JAMES | N232: COHEN | P232: WILLIAMS | R232: ANDERSON
A234: BRUNSWICK | C234: 3 | D234: 3 | E234: =C234*6+D234 -> 21 | G234: 7 | H234: 4 | I234: =G234*6+H234 -> 46 | K234: 9 | L234: 7 | M234: =K234*6+L234 -> 61 | O234: 10 | P234: 7 | Q234: =O234*6+P234 -> 67 | S234: OAKLEIGH
A235: OAKLEIGH | C235: 4 | D235: 3 | E235: =C235*6+D235 -> 27 | G235: 4 | H235: 5 | I235: =G235*6+H235 -> 29 | K235: 7 | L235: 9 | M235: =K235*6+L235 -> 51 | O235: 7 | P235: 11 | Q235: =O235*6+P235 -> 53 | S235: ARMSTRONG
A236: BEST PLAYERS
A237: BRUNSWICK | C237: AYRES | F237: ARTHUR | I237: McGRATH | L237: COOK | O237: LEYDIN | Q237: BIBBY
A238: OAKLEIGH | C238: BEARD | F238: HAINING | I238: DEFTEROUS | L238: SHERIDAN | O238: JORDAN | Q238: MULDOON
A239: GOALKICKERS
A240: BRUNSWICK | C240: COOK 4 | F240: POLLOCK 2 | I240: McKINNON 2 | L240: LEYDIN | N240: BIBBY
A241: OAKLEIGH | C241: RITCHIE 2 | F241: MULDOON 2 | I241: HAINING | K241: JORDAN | M241: HALL
A243: ROUND 6 | D243: 28TH MAY | I243: WEATHER | L243: FINE MILD | S243: PLAYED AT
D244: 1ST QTR | H244: 2ND QTR | L244: 3RD QTR | P244: FINAL | S244: DANDENONG
A245: WILLIAMSTOWN | C245: 3 | D245: 1 | E245: =C245*6+D245 -> 19 | G245: 8 | H245: 4 | I245: =G245*6+H245 -> 52 | K245: 13 | L245: 6 | M245: =K245*6+L245 -> 84 | O245: 15 | P245: 13 | Q245: =O245*6+P245 -> 103 | S245: UMPIRE | X245: LADDER | AB245: ROUND | AD245: 6
A246: DANDENONG | C246: 2 | D246: 6 | E246: =C246*6+D246 -> 18 | G246: 5 | H246: 10 | I246: =G246*6+H246 -> 40 | K246: 8 | L246: 11 | M246: =K246*6+L246 -> 59 | O246: 9 | P246: 13 | Q246: =O246*6+P246 -> 67 | S246: ROWE
A247: BEST PLAYERS | W247: TEAM | X247: W | Y247: L | Z247: D | AA247: FOR | AB247: AGST | AC247: % | AD247: PTS
A248: WILLIAMSTOWN | C248: CLOUGH | F248: EVANS | I248: WARE | L248: MAGILL | N248: PLEITNER | Q248: O'MARA
A249: DANDENONG | C249: GRAVENER | F249: WETZELL | I249: OSBORNE | L249: EVANS | N249: HARDY | Q249: REEVE | W249: YARRAVILLE | X249: 6 | Y249: 0 | Z249: 0 | AA249: 674 | AB249: 439 | AC249: 153.53 | AD249: 24
A250: GOALKICKERS | W250: PORT MELBOURNE | X250: 6 | Y250: 0 | Z250: 0 | AA250: 515 | AB250: 351 | AC250: 146.72364672364674 | AD250: 24
A251: WILLIAMSTOWN | C251: WARE 4 | F251: COHEN 3 | I251: SAVIGE 3 | K251: CLOUGH 3 | N251: PLEITNER | Q251: MAGILL | W251: WAVERLEY | X251: 5 | Y251: 1 | Z251: 0 | AA251: 590 | AB251: 389 | AC251: 151.67095115681235 | AD251: 20
A252: DANDENONG | C252: SMITH 3 | F252: GREENWOOD 2 | J252: EVANS 2 | M252: HARDY | O252: LIENERT | W252: BRUNSWICK | X252: 5 | Y252: 1 | Z252: 0 | AA252: 507 | AB252: 409 | AC252: 123.96088019559902 | AD252: 20
A254: YARRAVILLE | C254: 4 | D254: 1 | E254: =C254*6+D254 -> 25 | G254: 9 | H254: 4 | I254: =G254*6+H254 -> 58 | K254: 15 | L254: 11 | M254: =K254*6+L254 -> 101 | O254: 23 | P254: 15 | Q254: =O254*6+P254 -> 153 | S254: YARRAVILLE | W254: PRESTON | X254: 3 | Y254: 3 | Z254: 0 | AA254: 530 | AB254: 564 | AC254: 93.97 | AD254: 12
A255: OAKLEIGH | C255: 1 | D255: 1 | E255: =C255*6+D255 -> 7 | G255: 1 | H255: 7 | I255: =G255*6+H255 -> 13 | K255: 1 | L255: 10 | M255: =K255*6+L255 -> 16 | O255: 4 | P255: 10 | Q255: =O255*6+P255 -> 34 | S255: O'NEILL | W255: SANDRINGHAM | X255: 2 | Y255: 4 | Z255: 0 | AA255: 505 | AB255: 504 | AC255: 100.1984126984127 | AD255: 8
A256: BEST PLAYERS | W256: DANDENONG | X256: 1 | Y256: 5 | Z256: 0 | AA256: 492 | AB256: 586 | AC256: 83.959044368600686 | AD256: 4
A257: YARRAVILLE | C257: MEDDINGS | F257: CONNELLY | I257: RON BROWN | L257: WILSON | N257: FOGARTY | Q257: CURRIE | W257: COBURG | X257: 1 | Y257: 5 | Z257: 0 | AA257: 459 | AB257: 539 | AC257: 85.16 | AD257: 4
A258: OAKLEIGH | C258: LUFF | F258: MULDOON | I258: DEFTEROUS | L258: RITCHIE | N258: LINDSAY | Q258: SHERIDAN | W258: WILLIAMSTOWN | X258: 1 | Y258: 5 | Z258: 0 | AA258: 369 | AB258: 462 | AC258: 79.870129870129873 | AD258: 4
A259: GOALKICKERS | O259: McDONALD | R259: RON BROWN | W259: OAKLEIGH | X259: 0 | Y259: 6 | Z259: 0 | AA259: 298 | AB259: 696 | AC259: 42.82 | AD259: 0
A260: YARRAVILLE | C260: FOGARTY 6 | F260: QUARANTOTTO 5 | J260: FELL 3 | L260: WARWICK 3 | O260: CASTRIKUM 2 | R260: CONNELLY | U260: CURRIE
A261: OAKLEIGH | C261: JORDAN 2 | G261: HALL
E262: 29TH MAY | J262: WEATHER | N262: NORTH WEST WIND
A263: PORT MELBOURNE | C263: 1 | D263: 1 | E263: =C263*6+D263 -> 7 | G263: 4 | H263: 3 | I263: =G263*6+H263 -> 27 | K263: 11 | L263: 9 | M263: =K263*6+L263 -> 75 | O263: 12 | P263: 11 | Q263: =O263*6+P263 -> 83 | S263: BRUNSWICK
A264: BRUNSWICK | C264: 4 | D264: 2 | E264: =C264*6+D264 -> 26 | G264: 6 | H264: 3 | I264: =G264*6+H264 -> 39 | K264: 8 | L264: 3 | M264: =K264*6+L264 -> 51 | O264: 9 | P264: 5 | Q264: =O264*6+P264 -> 59 | S264: FLANAGAN
A265: BEST PLAYERS
A266: PORT MELBOURNE | C266: TAGGART | F266: BEDFORD | I266: CAULFIELD | L266: GOLDSMITH | O266: BROWNHILL | R266: KERR
A267: BRUNSWICK | C267: ROBINS | F267: HENDERSON | I267: COOK | L267: McGRATH | O267: FLANAGAN | R267: LEYDIN
A268: GOALKICKERS
A269: PORT MELBOURNE | C269: GOLDSMITH 5 | F269: BEDFORD 2 | I269: TAGGART 2 | L269: HOWELL 2 | O269: KERR
A270: BRUNSWICK | C270: COOK 4 | F270: LEYDIN 2 | I270: POLLOCK | K270: PENDLEBURY | N270: HENDERSON
A272: WAVERLEY | C272: 1 | D272: 1 | E272: =C272*6+D272 -> 7 | G272: 3 | H272: 8 | I272: =G272*6+H272 -> 26 | K272: 6 | L272: 11 | M272: =K272*6+L272 -> 47 | O272: 10 | P272: 12 | Q272: =O272*6+P272 -> 72 | S272: JUNCTION OVAL
A273: SANDRINGHAM | C273: 5 | D273: 6 | E273: =C273*6+D273 -> 36 | G273: 6 | H273: 7 | I273: =G273*6+H273 -> 43 | K273: 9 | L273: 8 | M273: =K273*6+L273 -> 62 | O273: 9 | P273: 9 | Q273: =O273*6+P273 -> 63 | S273: GARLICK
A274: BEST PLAYERS
A275: WAVERLEY | C275: VARLAMOS | F275: REEVES | I275: JEFFERSON | L275: HUDSON | O275: LAWSON | R275: THOROGOOD
A276: SANDRINGHAM | C276: BURKE | F276: McKENZIE | I276: ADDISON | L276: LADDS | O276: HOLMES | R276: SMITH
A277: GOALKICKERS
A278: WAVERLEY | C278: MITHEN 2 | F278: NATION 2 | I278: PETZKE 2 | K278: JEFFERSON | N278: BRENCHLEY | Q278: LAWSON | S278: GALLUS
A279: SANDRINGHAM | C279: O'TOOLE 2 | F279: SMITH 2 | I279: HARRISON | L279: ADDISON | N279: JUDKINS | Q279: ZEUSCHNER | T279: O'DWYER
A281: PRESTON | C281: 6 | D281: 8 | E281: =C281*6+D281 -> 44 | G281: 6 | H281: 9 | I281: =G281*6+H281 -> 45 | K281: 11 | L281: 14 | M281: =K281*6+L281 -> 80 | O281: 13 | P281: 15 | Q281: =O281*6+P281 -> 93 | S281: PRESTON
A282: COBURG | C282: 0 | D282: 1 | E282: =C282*6+D282 -> 1 | G282: 2 | H282: 7 | I282: =G282*6+H282 -> 19 | K282: 5 | L282: 9 | M282: =K282*6+L282 -> 39 | O282: 13 | P282: 11 | Q282: =O282*6+P282 -> 89 | S282: DIXON
A283: BEST PLAYERS
A284: PRESTON | C284: ALEXANDER | F284: DALTON | I284: WADDELL | L284: WALKER | N284: A PERRY | Q284: STEWART
A285: COBURG | C285: MIERS | F285: THOMPSON | I285: BORDIGNON | L285: PLANT | N285: TANCREDI | Q285: CHALLENGER
A286: GOALKICKERS
A287: PRESTON | C287: WALKER 5 | F287: DALTON 4 | I287: WADDELL 3 | L287: HEDGCOCK
A288: COBURG | C288: THOMPSON 3 | F288: BORDIGNON 3 | I288: CHALLENGER 2 | L288: BRANSTON 2 | O288: GRAHAM | Q288: MIERS
A290: ROUND 7 | D290: 4TH JUNE | I290: WEATHER | L290: NO WIND DULL | S290: PLAYED AT
D291: 1ST QTR | H291: 2ND QTR | L291: 3RD QTR | P291: FINAL | S291: WAVERLEY
A292: WAVERLEY | C292: 7 | D292: 1 | E292: =C292*6+D292 -> 43 | G292: 8 | H292: 5 | I292: =G292*6+H292 -> 53 | K292: 14 | L292: 7 | M292: =K292*6+L292 -> 91 | O292: 21 | P292: 12 | Q292: =O292*6+P292 -> 138 | S292: UMPIRE | X292: LADDER | AB292: ROUND | AD292: 7
A293: BRUNSWICK | C293: 4 | D293: 1 | E293: =C293*6+D293 -> 25 | G293: 9 | H293: 3 | I293: =G293*6+H293 -> 57 | K293: 14 | L293: 4 | M293: =K293*6+L293 -> 88 | O293: 16 | P293: 6 | Q293: =O293*6+P293 -> 102 | S293: ROWE
A294: BEST PLAYERS | W294: TEAM | X294: W | Y294: L | Z294: D | AA294: FOR | AB294: AGST | AC294: % | AD294: PTS
A295: WAVERLEY | C295: LAWSON | F295: BRENCHLEY | I295: JEFFERSON | L295: NATION | N295: HUDSON | Q295: ROLFE
A296: BRUNSWICK | C296: BURNS | F296: ROBINS | I296: BRIGLIA | L296: DENTON | N296: NOONAN | Q296: LEYDIN | W296: PORT MELBOURNE | X296: 7 | Y296: 0 | Z296: 0 | AA296: 591 | AB296: 415 | AC296: 142.40963855421685 | AD296: 28
A297: GOALKICKERS | W297: WAVERLEY | X297: 6 | Y297: 1 | Z297: 0 | AA297: 728 | AB297: 491 | AC297: 148.26883910386965 | AD297: 24
A298: WAVERLEY | C298: BRENCHLEY 6 | F298: LAWSON 4 | I298: JEFFERSON 4 | L298: GALLUS 3 | N298: NATION 2 | Q298: GREEN | S298: PETZKE | W298: YARRAVILLE | X298: 6 | Y298: 1 | Z298: 0 | AA298: 738 | AB298: 515 | AC298: 143.3 | AD298: 24
A299: BRUNSWICK | C299: DENTON 4 | F299: BURNS 4 | H299: LEYDIN 2 | J299: BRIGLIA 2 | M299: COOK 2 | O299: BIBBY | Q299: TURNER | W299: BRUNSWICK | X299: 5 | Y299: 2 | Z299: 0 | AA299: 609 | AB299: 547 | AC299: 111.33455210237661 | AD299: 20
A301: PRESTON | C301: 3 | D301: 3 | E301: =C301*6+D301 -> 21 | G301: 6 | H301: 6 | I301: =G301*6+H301 -> 42 | K301: 11 | L301: 11 | M301: =K301*6+L301 -> 77 | O301: 12 | P301: 15 | Q301: =O301*6+P301 -> 87 | S301: OAKLEIGH | W301: PRESTON | X301: 4 | Y301: 3 | Z301: 0 | AA301: 617 | AB301: 640 | AC301: 96.41 | AD301: 16
A302: OAKLEIGH | C302: 4 | D302: 2 | E302: =C302*6+D302 -> 26 | G302: 8 | H302: 7 | I302: =G302*6+H302 -> 55 | K302: 9 | L302: 7 | M302: =K302*6+L302 -> 61 | O302: 11 | P302: 10 | Q302: =O302*6+P302 -> 76 | S302: GANNON | W302: SANDRINGHAM | X302: 3 | Y302: 4 | Z302: 0 | AA302: 599 | AB302: 565 | AC302: 106.01769911504425 | AD302: 12
A303: BEST PLAYERS | W303: COBURG | X303: 2 | Y303: 5 | Z303: 0 | AA303: 566 | AB303: 629 | AC303: 89.98 | AD303: 8
A304: PRESTON | C304: ALEXANDER | F304: MURNANE | I304: TRELOAR | L304: KING | O304: WALKER | Q304: DALTON | W304: DANDENONG | X304: 1 | Y304: 6 | Z304: 0 | AA304: 582 | AB304: 693 | AC304: 83.98 | AD304: 4
A305: OAKLEIGH | C305: McLAREN | F305: DUFF | I305: LOVELESS | L305: HARRISON | O305: MILLER | Q305: DEFTEROUS | W305: WILLIAMSTOWN | X305: 1 | Y305: 6 | Z305: 0 | AA305: 430 | AB305: 556 | AC305: 77.338129496402871 | AD305: 4
A306: GOALKICKERS | W306: OAKLEIGH | X306: 0 | Y306: 7 | Z306: 0 | AA306: 374 | AB306: 783 | AC306: 47.77 | AD306: 0
A307: PRESTON | C307: WALKER 5 | F307: ALEXANDER 2 | I307: PARRIS | K307: MURNANE | N307: CAMERON | Q307: DIXON | S307: STEWART
A308: OAKLEIGH | C308: McLAREN 5 | F308: HARRISON | I308: HALL | K308: HOWLAND | N308: MILLER | P308: LOVELESS | R308: DEFTEROUS
E309: 5TH JUNE | J309: WEATHER | N309: FINE
A310: PORT MELBOURNE | C310: 1 | D310: 3 | E310: =C310*6+D310 -> 9 | G310: 5 | H310: 5 | I310: =G310*6+H310 -> 35 | K310: 6 | L310: 13 | M310: =K310*6+L310 -> 49 | O310: 10 | P310: 16 | Q310: =O310*6+P310 -> 76 | S310: P.M
A311: YARRAVILLE | C311: 6 | D311: 3 | E311: =C311*6+D311 -> 39 | G311: 8 | H311: 5 | I311: =G311*6+H311 -> 53 | K311: 9 | L311: 6 | M311: =K311*6+L311 -> 60 | O311: 9 | P311: 10 | Q311: =O311*6+P311 -> 64 | S311: ARMSTRONG
A312: BEST PLAYERS
A313: PORT MELBOURNE | C313: CAULFIELD | F313: BEDFORD | I313: BONNETT | L313: BROWNHILL | O313: TAGGART | R313: GOLDSMITH
A314: YARRAVILLE | C314: WARWICK | F314: MEDDINGS | I314: QUARANTOTTO | L314: FOGARTY | O314: TAURINS | R314: BARROW
A315: GOALKICKERS
A316: PORT MELBOURNE | C316: GOLDSMITH 5 | F316: BUCKLEY | I316: BEDFORD | K316: BONNETT | M316: SCHMIDT | O316: GRIFFITHS
A317: YARRAVILLE | C317: FOGARTY 3 | F317: WARWICK 2 | I317: FELL | J317: CASTRIKUM | M317: McDONALD | P317: CONNELLY
A319: COBURG | C319: 4 | D319: 4 | E319: =C319*6+D319 -> 28 | G319: 8 | H319: 7 | I319: =G319*6+H319 -> 55 | K319: 13 | L319: 9 | M319: =K319*6+L319 -> 87 | O319: 16 | P319: 11 | Q319: =O319*6+P319 -> 107 | S319: COBURG
A320: DANDENONG | C320: 2 | D320: 4 | E320: =C320*6+D320 -> 16 | G320: 4 | H320: 10 | I320: =G320*6+H320 -> 34 | K320: 10 | L320: 15 | M320: =K320*6+L320 -> 75 | O320: 12 | P320: 18 | Q320: =O320*6+P320 -> 90 | S320: JACKSON
A321: BEST PLAYERS
A322: COBURG | C322: MIERS | E322: TANCREDI | H322: SULLIVAN | K322: THOMPSON | N322: CHALLENGER | Q322: BRANSTON
A323: DANDENONG | C323: EVANS | E323: PATTERSON | H323: STEDWELL | K323: LIENERT | N323: WETZELL | Q323: McNAMARA
A324: GOALKICKERS
A325: COBURG | C325: BRANSTON 5 | F325: CHALLENGER 2 | I325: THOMPSON 2 | L325: GRAHAM 2 | N325: JESS | P325: PARTRIDGE | R325: SULLIVAN | U325: BORDIGNON | X325: KEEFER
A326: DANDENONG | C326: OSBORNE 3 | F326: STEDWELL 2 | I326: B SMITH 2 | L326: EVANS | N326: PATTERSON | Q326: GRAVENER | T326: WETZELL | W326: MELAI
A328: SANDRINGHAM | C328: 1 | D328: 3 | E328: =C328*6+D328 -> 9 | G328: 5 | H328: 7 | I328: =G328*6+H328 -> 37 | K328: 11 | L328: 9 | M328: =K328*6+L328 -> 75 | O328: 14 | P328: 10 | Q328: =O328*6+P328 -> 94 | S328: WILLIAMSTOWN
A329: WILLIAMSTOWN | C329: 1 | D329: 2 | E329: =C329*6+D329 -> 8 | G329: 4 | H329: 3 | I329: =G329*6+H329 -> 27 | K329: 6 | L329: 4 | M329: =K329*6+L329 -> 40 | O329: 9 | P329: 7 | Q329: =O329*6+P329 -> 61 | S329: O'NEILL
A330: BEST PLAYERS
A331: SANDRINGHAM | C331: BURKE | F331: GRANGER | I331: ZEUSCHNER | L331: O'TOOLE | O331: JUDKINS | Q331: WILLIAMS
A332: WILLIAMSTOWN | C332: O'TOOLE | F332: BOYD | I332: COHEN | L332: CLOUGH | O332: EVANS | Q332: WILLIAMS
A333: GOALKICKERS
A334: SANDRINGHAM | C334: ZEUSCHNER 4 | F334: O'TOOLE 3 | I334: WILLIAMS 3 | L334: HANCE | N334: SMITH | P334: ADDISON | R334: MUTER
A335: WILLIAMSTOWN | C335: SAVIGE 3 | F335: COHEN 2 | I335: WILLIAMS 2 | L335: CLOUGH 2
A337: ROUND 8 | D337: 12TH JUNE | I337: WEATHER | S337: PLAYED AT
D338: 1ST QTR | H338: 2ND QTR | L338: 3RD QTR | P338: FINAL | S338: PRESTON
A339: PRESTON | C339: 5 | D339: 7 | E339: =C339*6+D339 -> 37 | G339: 8 | H339: 11 | I339: =G339*6+H339 -> 59 | K339: 11 | L339: 16 | M339: =K339*6+L339 -> 82 | O339: 14 | P339: 18 | Q339: =O339*6+P339 -> 102 | S339: UMPIRE | X339: LADDER | AB339: ROUND | AD339: 8
A340: PORT MELBOURNE | C340: 3 | D340: 0 | E340: =C340*6+D340 -> 18 | G340: 7 | H340: 4 | I340: =G340*6+H340 -> 46 | K340: 10 | L340: 6 | M340: =K340*6+L340 -> 66 | O340: 13 | P340: 9 | Q340: =O340*6+P340 -> 87 | S340: ROWE
A341: BEST PLAYERS | W341: TEAM | X341: W | Y341: L | Z341: D | AA341: FOR | AB341: AGST | AC341: % | AD341: PTS
A342: PRESTON | C342: CAMERON | F342: TRELOAR | I342: WADDELL | L342: LEMPRIERE | O342: STEWART | Q342: JOYCE
A343: PORT MELBOURNE | C343: KERR | F343: GRIFFITHS | I343: BROWNHILL | L343: SCHMIDT | O343: PERRY | Q343: HOUSE | W343: YARRAVILLE | X343: 7 | Y343: 1 | Z343: 0 | AA343: 853 | AB343: 586 | AC343: 145.56 | AD343: 28
A344: GOALKICKERS | W344: PORT MELBOURNE | X344: 7 | Y344: 1 | Z344: 0 | AA344: 678 | AB344: 517 | AC344: 131.14119922630562 | AD344: 28
A345: PRESTON | C345: CAMERON 4 | F345: DELLAMARTA 3 | J345: WADDELL 2 | M345: DALTON 2 | P345: G PERRY | R345: JOYCE | W345: WAVERLEY | X345: 6 | Y345: 2 | Z345: 0 | AA345: 799 | AB345: 606 | AC345: 131.84818481848185 | AD345: 24
A346: PORT MELBOURNE | C346: I PERRY 3 | E346: McGREGOR 2 | H346: MILNER 2 | J346: ALLEN 2 | M346: CARLILE 2 | P346: GOLDSMITH | S346: BUCKLEY | W346: BRUNSWICK | X346: 5 | Y346: 3 | Z346: 0 | AA346: 652 | AB346: 656 | AC346: 99.390243902439025 | AD346: 20
A348: WILLIAMSTOWN | C348: 5 | D348: 4 | E348: =C348*6+D348 -> 34 | G348: 7 | H348: 6 | I348: =G348*6+H348 -> 48 | K348: 10 | L348: 9 | M348: =K348*6+L348 -> 69 | O348: 13 | P348: 12 | Q348: =O348*6+P348 -> 90 | S348: WILLIAMSTOWN | W348: PRESTON | X348: 5 | Y348: 3 | Z348: 0 | AA348: 719 | AB348: 727 | AC348: 98.9 | AD348: 20
A349: COBURG | C349: 1 | D349: 3 | E349: =C349*6+D349 -> 9 | G349: 4 | H349: 5 | I349: =G349*6+H349 -> 29 | K349: 5 | L349: 5 | M349: =K349*6+L349 -> 35 | O349: 11 | P349: 7 | Q349: =O349*6+P349 -> 73 | S349: GANNON | W349: SANDRINGHAM | X349: 4 | Y349: 4 | Z349: 0 | AA349: 708 | AB349: 608 | AC349: 116.44736842105263 | AD349: 16
A350: BEST PLAYERS | W350: COBURG | X350: 2 | Y350: 6 | Z350: 0 | AA350: 639 | AB350: 719 | AC350: 88.87 | AD350: 8
A351: WILLIAMSTOWN | C351: TROTMAN | F351: COHEN | I351: SAVIGE | L351: EVANS | O351: CLOUGH | Q351: O'TOOLE | W351: DANDENONG | X351: 2 | Y351: 6 | Z351: 0 | AA351: 682 | AB351: 779 | AC351: 87.55 | AD351: 8
A352: COBURG | C352: TANCREDI | F352: ESDALE | I352: BRANSTON | L352: GRAHAM | O352: PLANT | Q352: THOMPSON | W352: WILLIAMSTOWN | X352: 2 | Y352: 6 | Z352: 0 | AA352: 520 | AB352: 629 | AC352: 82.670906200317958 | AD352: 8
A353: GOALKICKERS | W353: OAKLEIGH | X353: 0 | Y353: 8 | Z353: 0 | AA353: 460 | AB353: 883 | AC353: 52.1 | AD353: 0
A354: WILLIAMSTOWN | C354: SAVIGE 4 | F354: CLOUGH 2 | I354: DODD 2 | K354: MAGILL | M354: COHEN | O354: WARD | Q354: TROTMAN | S354: WILLIAMS
A355: COBURG | C355: BRANSTON 5 | F355: THOMPSON 2 | I355: JESS | K355: MIERS | M355: FITZPATRICK | P355: KEEFER
E356: 13TH JUNE | I356: WEATHER | M356: SOUTH EAST WIND
A357: DANDENONG | C357: 3 | D357: 4 | E357: =C357*6+D357 -> 22 | G357: 5 | H357: 8 | I357: =G357*6+H357 -> 38 | K357: 10 | L357: 14 | M357: =K357*6+L357 -> 74 | O357: 14 | P357: 16 | Q357: =O357*6+P357 -> 100 | S357: DANDENONG
A358: OAKLEIGH | C358: 1 | D358: 3 | E358: =C358*6+D358 -> 9 | G358: 7 | H358: 5 | I358: =G358*6+H358 -> 47 | K358: 8 | L358: 5 | M358: =K358*6+L358 -> 53 | O358: 13 | P358: 8 | Q358: =O358*6+P358 -> 86 | S358: CHAPLIN
A359: BEST PLAYERS
A360: DANDENONG | C360: BROWN | F360: SUTTON | I360: PIVETTA | L360: McNAMARA | O360: GRAVENER | R360: EVANS
A361: OAKLEIGH | C361: WAPLING | F361: DOWDELL | I361: O'BRIEN | L361: HALL | O361: BOWEN | R361: BEARD
A362: GOALKICKERS
A363: DANDENONG | C363: SUTTON 3 | F363: MELAI 3 | I363: GRAVENER 2 | L363: LIENERT | N363: PIVETTA | P363: SMITH | R363: WETZELL | U363: BANKS | W363: REEVES | X363: EVANS
A364: OAKLEIGH | C364: WAPLING 3 | F364: DOWDELL 3 | I364: O'BRIEN 2 | L364: HALL 2 | N364: MILER | P364: MULDOON | R364: McLAREN
E365: 18TH JUNE | I365: WEATHER | M365: NORTH WEST WIND
A366: YARRAVILLE | C366: 8 | D366: 5 | E366: =C366*6+D366 -> 53 | G366: 10 | H366: 4 | I366: =G366*6+H366 -> 64 | K366: 15 | L366: 11 | M366: =K366*6+L366 -> 101 | O366: 17 | P366: 13 | Q366: =O366*6+P366 -> 115 | S366: YARRAVILLE
A367: WAVERLEY | C367: 1 | D367: 0 | E367: =C367*6+D367 -> 6 | G367: 4 | H367: 3 | I367: =G367*6+H367 -> 27 | K367: 4 | L367: 4 | M367: =K367*6+L367 -> 28 | O367: 10 | P367: 11 | Q367: =O367*6+P367 -> 71 | S367: DIXON
A368: BEST PLAYERS
A369: YARRAVILLE | C369: WARWICK | F369: QUARANTOTTO | I369: CONNELLY | L369: BARROW | O369: EDWARDS | R369: CASTRIKUM
A370: WAVERLEY | C370: BRENCHLEY | F370: THOROGOOD | I370: ROLFE | L370: PETZKE | O370: REEVES | R370: GALLUS
A371: GOALKICKERS
A372: YARRAVILLE | C372: CONNELLY 5 | F372: KNOTT 4 | I372: QUARANTOTTO 3 | M372: FOGARTY | O372: WARWICK | Q372: CURRIE | S372: FELL | U372: MADIGAN
A373: WAVERLEY | C373: GALLUS 3 | F373: MITHEN | H373: JEFFERSON | J373: JONES | L373: LEAR | N373: BRENCHLEY | Q373: THOROGOOD | T373: PETZKE
E374: 19TH JUNE | I374: WEATHER | M374: RAIN
A375: SANDRINGHAM | C375: 4 | D375: 5 | E375: =C375*6+D375 -> 29 | G375: 8 | H375: 7 | I375: =G375*6+H375 -> 55 | K375: 9 | L375: 11 | M375: =K375*6+L375 -> 65 | O375: 16 | P375: 13 | Q375: =O375*6+P375 -> 109 | S375: JUNCTION OVAL
A376: BRUNSWICK | C376: 1 | D376: 3 | E376: =C376*6+D376 -> 9 | G376: 3 | H376: 4 | I376: =G376*6+H376 -> 22 | K376: 4 | L376: 7 | M376: =K376*6+L376 -> 31 | O376: 6 | P376: 7 | Q376: =O376*6+P376 -> 43 | S376: CRAIG
A377: BEST PLAYERS
A378: SANDRINGHAM | C378: K WILLS | F378: O'DWYER | I378: LADDS | L378: HANCE | N378: HARRISON | Q378: GRANGER
A379: BRUNSWICK | C379: TURNER | F379: McKINLEY | I379: K DILLON | L379: BRIGLIA | N379: LEYDIN | Q379: ARTHUR
A380: GOALKICKERS
A381: SANDRINGHAM | C381: K WILLS 4 | F381: O'DWYER 4 | I381: ZEUSCHNER 3 | L381: WILLIAMS 2 | O381: HANCE | Q381: ADDISON | S381: HARRISON
A382: BRUNSWICK | C382: ALLEN 2 | F382: COOK | H382: LEYDIN | J382: PENDLEBURY | M382: TURNER
A384: ROUND 9 | E384: 26TH JUNE | J384: WEATHER | N384: WEST WIND | S384: PLAYED AT
D385: 1ST QTR | H385: 2ND QTR | L385: 3RD QTR | P385: FINAL | S385: BRUNSWICK
A386: BRUNSWICK | C386: 4 | D386: 4 | E386: =C386*6+D386 -> 28 | G386: 12 | H386: 7 | I386: =G386*6+H386 -> 79 | K386: 16 | L386: 7 | M386: =K386*6+L386 -> 103 | O386: 17 | P386: 9 | Q386: =O386*6+P386 -> 111 | S386: UMPIRE | X386: LADDER | AB386: ROUND | AD386: 9
A387: YARRAVILLE | C387: 2 | D387: 4 | E387: =C387*6+D387 -> 16 | G387: 5 | H387: 7 | I387: =G387*6+H387 -> 37 | K387: 10 | L387: 9 | M387: =K387*6+L387 -> 69 | O387: 15 | P387: 14 | Q387: =O387*6+P387 -> 104 | S387: N ARMSTRONG
A388: BEST PLAYERS | W388: TEAM | X388: W | Y388: L | Z388: D | AA388: FOR | AB388: AGST | AC388: % | AD388: PTS
A389: BRUNSWICK | C389: COOK | F389: McKINNON | I389: BIBBY | L389: WHILEY | O389: TURNER | Q389: ROBINS
A390: YARRAVILLE | C390: KNOTT | F390: ION | I390: QUARANTOTTO | L390: FELL | O390: TAURENS | Q390: CASTRIKUM | W390: PORT MELBOURNE | X390: 8 | Y390: 1 | Z390: 0 | AA390: 756 | AB390: 562 | AC390: 134.51957295373666 | AD390: 32
A391: GOALKICKERS | W391: YARRAVILLE | X391: 7 | Y391: 2 | Z391: 0 | AA391: 957 | AB391: 697 | AC391: 137.3 | AD391: 28
A392: BRUNSWICK | C392: COOK 7 | F392: McKINNON 3 | I392: WHILEY 3 | L392: BRIGLIA 2 | N392: LEYDIN | P392: O'CONNELL | W392: WAVERLEY | X392: 7 | Y392: 2 | Z392: 0 | AA392: 902 | AB392: 657 | AC392: 137.29071537290716 | AD392: 28
A393: YARRAVILLE | C393: QUARANTOTTO 3 | G393: KNOTT 2 | I393: LIENERT 2 | K393: CURRIE 2 | M393: MADIGAN 2 | P393: ION 2 | R393: FELL | T393: ROACH | W393: BRUNSWICK | X393: 6 | Y393: 3 | Z393: 0 | AA393: 763 | AB393: 760 | AC393: 100.39473684210526 | AD393: 24
A395: WAVERLEY | C395: 3 | D395: 4 | E395: =C395*6+D395 -> 22 | G395: 8 | H395: 7 | I395: =G395*6+H395 -> 55 | K395: 11 | L395: 10 | M395: =K395*6+L395 -> 76 | O395: 14 | P395: 19 | Q395: =O395*6+P395 -> 103 | S395: WAVERLEY | W395: PRESTON | X395: 5 | Y395: 4 | Z395: 0 | AA395: 770 | AB395: 830 | AC395: 92.77 | AD395: 20
A396: PRESTON | C396: 2 | D396: 2 | E396: =C396*6+D396 -> 14 | G396: 3 | H396: 4 | I396: =G396*6+H396 -> 22 | K396: 6 | L396: 6 | M396: =K396*6+L396 -> 42 | O396: 7 | P396: 9 | Q396: =O396*6+P396 -> 51 | S396: O'NEILL | W396: SANDRINGHAM | X396: 4 | Y396: 5 | Z396: 0 | AA396: 788 | AB396: 709 | AC396: 111.14245416078984 | AD396: 16
A397: BEST PLAYERS | W397: COBURG | X397: 3 | Y397: 6 | Z397: 0 | AA397: 740 | AB397: 799 | AC397: 92.62 | AD397: 12
A398: WAVERLEY | C398: REEVES | F398: GALLUS | I398: ROLFE | L398: NATION | O398: LAWSON | R398: POORE | W398: WILLIAMSTOWN | X398: 3 | Y398: 6 | Z398: 0 | AA398: 625 | AB398: 709 | AC398: 88.15232722143864 | AD398: 12
A399: PRESTON | C399: HINDMARSH | F399: HANVIN | I399: G PERRY | L399: JOYCE | O399: MURNANE | R399: ALEXANDER | W399: DANDENONG | X399: 2 | Y399: 7 | Z399: 0 | AA399: 727 | AB399: 857 | AC399: 84.83 | AD399: 8
A400: GOALKICKERS | W400: OAKLEIGH | X400: 0 | Y400: 9 | Z400: 0 | AA400: 540 | AB400: 988 | AC400: 54.66 | AD400: 0
A401: WAVERLEY | C401: NATION 4 | F401: MITHEN 3 | I401: GALLUS 2 | K401: CHRISTIE 2 | N401: LAWSON | P401: POORE | R401: BRENCHLEY
A402: PRESTON | C402: WALKER 3 | F402: HINDMARSH | I402: DALTON | K402: ALEXANDER | N402: LEMPRIERE
A404: COBURG | C404: 3 | D404: 4 | E404: =C404*6+D404 -> 22 | G404: 8 | H404: 8 | I404: =G404*6+H404 -> 56 | K404: 11 | L404: 10 | M404: =K404*6+L404 -> 76 | O404: 15 | P404: 11 | Q404: =O404*6+P404 -> 101 | S404: COBURG
A405: SANDRINGHAM | C405: 5 | D405: 3 | E405: =C405*6+D405 -> 33 | G405: 7 | H405: 4 | I405: =G405*6+H405 -> 46 | K405: 9 | L405: 9 | M405: =K405*6+L405 -> 63 | O405: 11 | P405: 14 | Q405: =O405*6+P405 -> 80 | S405: TURNER
A406: BEST PLAYERS
A407: COBURG | C407: GONINAN | F407: MIERS | I407: FITZPATRICK | L407: ESDALE | O407: THOMPSON | R407: PLANT
A408: SANDRINGHAM | C408: O'DWYER | F408: MACKENZIE | I408: ZEUSCHNER | L408: GRANGER | O408: MUTER | R408: HANCE
A409: GOALKICKERS
A410: COBURG | C410: GONINAN 5 | F410: BRANSTON 5 | I410: THOMPSON 2 | L410: KEEFER 2 | N410: CHALLENGER
A411: SANDRINGHAM | C411: ZEUSCHNER 5 | F411: O'DWYER 2 | I411: HANCE | K411: O'TOOLE | M411: HARRISON | P411: BURKE
A413: WILLIAMSTOWN | C413: 5 | D413: 4 | E413: =C413*6+D413 -> 34 | G413: 9 | H413: 5 | I413: =G413*6+H413 -> 59 | K413: 13 | L413: 8 | M413: =K413*6+L413 -> 86 | O413: 16 | P413: 9 | Q413: =O413*6+P413 -> 105 | S413: OAKLEIGH
A414: OAKLEIGH | C414: 2 | D414: 1 | E414: =C414*6+D414 -> 13 | G414: 8 | H414: 8 | I414: =G414*6+H414 -> 56 | K414: 8 | L414: 11 | M414: =K414*6+L414 -> 59 | O414: 11 | P414: 14 | Q414: =O414*6+P414 -> 80 | S414: JACKSON
A415: BEST PLAYERS
A416: WILLIAMSTOWN | C416: WARE | F416: BOYD | I416: O'TOOLE | L416: SAVIGE | O416: WILLIAMS | R416: RUSSELL
A417: OAKLEIGH | C417: TRAILL | F417: MILLER | I417: WAPLING | L417: O'BRIEN | O417: LUFF | R417: HARRISON
A418: GOALKICKERS
A419: WILLIAMSTOWN | C419: WARE 4 | F419: JOHNSON 3 | I419: SAVIGE 3 | K419: COHEN | M419: DODD | O419: TROTMAN | Q419: WILLIAMS | S419: BAMFORD | V419: CLOUGH
A420: OAKLEIGH | C420: WAPLING 3 | F420: JORDAN 3 | I420: MULDOON 2 | L420: HAINING | N420: MILLER | P420: HALL
A422: PORT MELBOURNE | C422: 3 | D422: 3 | E422: =C422*6+D422 -> 21 | G422: 6 | H422: 10 | I422: =G422*6+H422 -> 46 | K422: 9 | L422: 13 | M422: =K422*6+L422 -> 67 | O422: 10 | P422: 18 | Q422: =O422*6+P422 -> 78 | S422: PORT MELBOURNE
A423: DANDENONG | C423: 3 | D423: 1 | E423: =C423*6+D423 -> 19 | G423: 3 | H423: 4 | I423: =G423*6+H423 -> 22 | K423: 4 | L423: 11 | M423: =K423*6+L423 -> 35 | O423: 5 | P423: 15 | Q423: =O423*6+P423 -> 45 | S423: DIXON
A424: BEST PLAYERS
A425: PORT MELBOURNE | C425: BEDFORD | F425: ALLEN | I425: KERR | K425: CAULFIELD | N425: BONNETT | Q425: GROVER
A426: DANDENONG | C426: McNAMARA | F426: BROWN | I426: HARDY | K426: GRAVENER | N426: OSBORNE | Q426: EVANS
A427: GOALKICKERS
A428: PORT MELBOURNE | C428: TAGGART 3 | F428: ALLEN 2 | I428: CARLILE 2 | L428: GRIFFITHS 2 | O428: BEDFORD
A429: DANDENONG | C429: EVANS 2 | F429: SUTTON | H429: WETZELL | J429: ROUVRAY
A431: ROUND 10 | E431: 2ND JULY | J431: WEATHER | M431: W .WIND FINE SUNNY | S431: PLAYED AT
D432: 1ST QTR | H432: 2ND QTR | L432: 3RD QTR | P432: FINAL | S432: WAVERLEY
A433: WAVERLEY | C433: 7 | D433: 3 | E433: =C433*6+D433 -> 45 | G433: 8 | H433: 6 | I433: =G433*6+H433 -> 54 | K433: 12 | L433: 10 | M433: =K433*6+L433 -> 82 | O433: 14 | P433: 13 | Q433: =O433*6+P433 -> 97 | S433: UMPIRE | X433: LADDER | AB433: ROUND | AD433: 10
A434: DANDENONG | C434: 5 | D434: 0 | E434: =C434*6+D434 -> 30 | G434: 8 | H434: 6 | I434: =G434*6+H434 -> 54 | K434: 10 | L434: 6 | M434: =K434*6+L434 -> 66 | O434: 11 | P434: 8 | Q434: =O434*6+P434 -> 74 | S434: TURNER
A435: BEST PLAYERS | W435: TEAM | X435: W | Y435: L | Z435: D | AA435: FOR | AB435: AGST | AC435: % | AD435: PTS
A436: WAVERLEY | C436: NATION | F436: LAWSON | I436: ROGERSON | L436: ROLFE | N436: VARLAMOS | Q436: MITHEN
A437: DANDENONG | C437: McNAMARA | F437: ROUVRAY | I437: STEDWELL | L437: LIENERT | N437: WETZELL | Q437: GREENWOOD | W437: PORT MELBOURNE | X437: 9 | Y437: 1 | Z437: 0 | AA437: 831 | AB437: 612 | AC437: 135.78431372549019 | AD437: 36
A438: GOALKICKERS | W438: WAVERLEY | X438: 8 | Y438: 2 | Z438: 0 | AA438: 999 | AB438: 731 | AC438: 136.66210670314638 | AD438: 32
A439: WAVERLEY | C439: BREWSTER 4 | F439: BRENCHLEY 3 | I439: LAWSON 2 | L439: NATION 2 | N439: MITHEN | P439: PETZKE | R439: CHRISTIE | W439: YARRAVILLE | X439: 7 | Y439: 3 | Z439: 0 | AA439: 1007 | AB439: 762 | AC439: 132.15 | AD439: 28
A440: DANDENONG | C440: ROUVRAY 7 | F440: OSBORNE | I440: GREENWOOD | L440: PATTERSON | N440: GRAVENER | W440: BRUNSWICK | X440: 7 | Y440: 3 | Z440: 0 | AA440: 850 | AB440: 832 | AC440: 102.16346153846153 | AD440: 28
E441: 3RD JULY | J441: WEATHER | M441: FINE
A442: BRUNSWICK | C442: 0 | D442: 3 | E442: =C442*6+D442 -> 3 | G442: 6 | H442: 13 | I442: =G442*6+H442 -> 49 | K442: 9 | L442: 17 | M442: =K442*6+L442 -> 71 | O442: 11 | P442: 21 | Q442: =O442*6+P442 -> 87 | S442: BRUNSWICK | W442: SANDRINGHAM | X442: 5 | Y442: 5 | Z442: 0 | AA442: 853 | AB442: 759 | AC442: 112.38471673254281 | AD442: 20
A443: PRESTON | C443: 4 | D443: 3 | E443: =C443*6+D443 -> 27 | G443: 4 | H443: 4 | I443: =G443*6+H443 -> 28 | K443: 6 | L443: 5 | M443: =K443*6+L443 -> 41 | O443: 11 | P443: 6 | Q443: =O443*6+P443 -> 72 | S443: ANDERSON/HAYES | W443: PRESTON | X443: 5 | Y443: 5 | Z443: 0 | AA443: 842 | AB443: 917 | AC443: 91.82 | AD443: 20
A444: BEST PLAYERS | W444: COBURG | X444: 3 | Y444: 7 | Z444: 0 | AA444: 809 | AB444: 883 | AC444: 91.62 | AD444: 12
A445: BRUNSWICK | C445: BIBBY | F445: McKINNON | I445: LEYDIN | L445: BRIGLIA | O445: COOK | Q445: ROBINSON | W445: WILLIAMSTOWN | X445: 3 | Y445: 7 | Z445: 0 | AA445: 675 | AB445: 784 | AC445: 86.09693877551021 | AD445: 12
A446: PRESTON | C446: A PERRY | F446: DELLAMARTA | I446: G PERRY | L446: DALTON | O446: DINEEN | Q446: MURNANE | W446: DANDENONG | X446: 2 | Y446: 8 | Z446: 0 | AA446: 801 | AB446: 954 | AC446: 83.96 | AD446: 8
A447: GOALKICKERS | W447: OAKLEIGH | X447: 1 | Y447: 9 | Z447: 0 | AA447: 624 | AB447: 1057 | AC447: 59.04 | AD447: 4
A448: BRUNSWICK | C448: COOK 4 | E448: BURNS | G448: BRIGLIA | I448: McNAMARA | L448: LEYDIN | N448: ROBINSON | Q448: BIBBY | S448: NOONAN
A449: PRESTON | C449: WALKER 4 | F449: DALTON 4 | I449: DELLAMARTA 2 | M449: JOYCE
A451: SANDRINGHAM | C451: 2 | D451: 5 | E451: =C451*6+D451 -> 17 | G451: 4 | H451: 7 | I451: =G451*6+H451 -> 31 | K451: 7 | L451: 10 | M451: =K451*6+L451 -> 52 | O451: 9 | P451: 11 | Q451: =O451*6+P451 -> 65 | S451: YARRAVILLE
A452: YARRAVILLE | C452: 1 | D452: 4 | E452: =C452*6+D452 -> 10 | G452: 2 | H452: 11 | I452: =G452*6+H452 -> 23 | K452: 3 | L452: 12 | M452: =K452*6+L452 -> 30 | O452: 6 | P452: 14 | Q452: =O452*6+P452 -> 50 | S452: GANNON
A453: BEST PLAYERS
A454: SANDRINGHAM | C454: VAUGHAN | F454: O'TOOLE | I454: LADDS | L454: O'DWYER | O454: ADDISON | R454: ZEUSCHNER
A455: YARRAVILLE | C455: BARROW | F455: HENDERSON | I455: FELL | L455: PARSONS | O455: MEDDINGS | R455: ION
A456: GOALKICKERS
A457: SANDRINGHAM | C457: O'TOOLE 3 | F457: ADDISON 2 | I457: WILLS 2 | K457: ZEUSCHNER | N457: WESTON
A458: YARRAVILLE | C458: QUARANTOTTO 2 | G458: WARWICK | J458: RON BROWN | M458: JOHNSON | P458: FELL
A460: OAKLEIGH | C460: 1 | D460: 8 | E460: =C460*6+D460 -> 14 | G460: 3 | H460: 10 | I460: =G460*6+H460 -> 28 | K460: 7 | L460: 17 | M460: =K460*6+L460 -> 59 | O460: 11 | P460: 18 | Q460: =O460*6+P460 -> 84 | S460: OAKLEIGH
A461: COBURG | C461: 3 | D461: 0 | E461: =C461*6+D461 -> 18 | G461: 8 | H461: 1 | I461: =G461*6+H461 -> 49 | K461: 8 | L461: 1 | M461: =K461*6+L461 -> 49 | O461: 11 | P461: 3 | Q461: =O461*6+P461 -> 69 | S461: ROWE
A462: BEST PLAYERS
A463: OAKLEIGH | C463: LOGAN | F463: MILLER | I463: WAPLING | L463: TRAILL | O463: HAINING | R463: MULDOON
A464: COBURG | C464: THOMPSON | F464: BOSCHEN | I464: FITZPATRICK | L464: TANCREDI | O464: MIERS | R464: WELSH
A465: GOALKICKERS
A466: OAKLEIGH | C466: WAPLIMG 6 | F466: DOWDELL 3 | I466: MILLER | K466: JORDAN
A467: COBURG | C467: THOMPSON 3 | F467: MITCHELL 2 | I467: BOSCHEN 2 | L467: BRANSTON | N467: HURLEY | P467: ESDALE | R467: JESS
A469: PORT MELBOURNE | C469: 3 | D469: 2 | E469: =C469*6+D469 -> 20 | G469: 7 | H469: 8 | I469: =G469*6+H469 -> 50 | K469: 9 | L469: 9 | M469: =K469*6+L469 -> 63 | O469: 11 | P469: 9 | Q469: =O469*6+P469 -> 75 | S469: PORT MELBOURNE
A470: WILLIAMSTOWN | C470: 3 | D470: 2 | E470: =C470*6+D470 -> 20 | G470: 5 | H470: 3 | I470: =G470*6+H470 -> 33 | K470: 7 | L470: 8 | M470: =K470*6+L470 -> 50 | O470: 7 | P470: 8 | Q470: =O470*6+P470 -> 50 | S470: CHAPLIN
A471: BEST PLAYERS
A472: PORT MELBOURNE | C472: PERRY | E472: ALLEN | H472: TAGGART | K472: BROWNHILL | N472: BUCKLEY | Q472: GROVER
A473: WILLIAMSTOWN | C473: BOYD | E473: RUSSELL | H473: WARD | K473: JAMES | N473: TROTMAN | Q473: WARE
A474: GOALKICKERS
A475: PORT MELBOURNE | C475: PERRY 3 | F475: CARLILE 2 | I475: TAGGART 2 | L475: ALLEN | N475: BUCKLEY | P475: BEDFORD | R475: GRIFFITHS
A476: WILLIAMSTOWN | C476: WARE 2 | F476: WILLIAMS | I476: O'MARA | K476: COHEN | M476: MAGILL | O476: VOSILAITIS
A478: ROUND 11 | E478: 9TH JULY | J478: WEATHER | M478: DRIZZLE GROUNDS SLIPPERY | S478: PLAYED AT
D479: 1ST QTR | H479: 2ND QTR | L479: 3RD QTR | P479: FINAL | S479: WILLIAMSTOWN
A480: WILLIAMSTOWN | C480: 1 | D480: 1 | E480: =C480*6+D480 -> 7 | G480: 4 | H480: 4 | I480: =G480*6+H480 -> 28 | K480: 6 | L480: 6 | M480: =K480*6+L480 -> 42 | O480: 10 | P480: 8 | Q480: =O480*6+P480 -> 68 | S480: UMPIRE | X480: LADDER | AB480: ROUND | AD480: 11
A481: WAVERLEY | C481: 1 | D481: 4 | E481: =C481*6+D481 -> 10 | G481: 5 | H481: 7 | I481: =G481*6+H481 -> 37 | K481: 8 | L481: 9 | M481: =K481*6+L481 -> 57 | O481: 9 | P481: 11 | Q481: =O481*6+P481 -> 65 | S481: ROWE
A482: BEST PLAYERS | W482: TEAM | X482: W | Y482: L | Z482: D | AA482: FOR | AB482: AGST | AC482: % | AD482: PTS
A483: WILLIAMSTOWN | C483: WARD | F483: A LEE | I483: ANDERSON | L483: PLEITNER | O483: O'MARA | Q483: CLOUGH
A484: WAVERLEY | C484: POORE | F484: MITHEN | I484: REEVES | L484: LAWSON | O484: ROLFE | Q484: ROGERSON | W484: PORT MELBOURNE | X484: 10 | Y484: 1 | Z484: 0 | AA484: 921 | AB484: 652 | AC484: 141.26 | AD484: 40
A485: GOALKICKERS | W485: WAVERLEY | X485: 8 | Y485: 3 | Z485: 0 | AA485: 1064 | AB485: 799 | AC485: 133.16645807259073 | AD485: 32
A486: WILLIAMSTOWN | C486: REES 4 | F486: PLEITNER 3 | I486: COHEN | K486: WARE | M486: CLOUGH | W486: YARRAVILLE | X486: 7 | Y486: 4 | Z486: 0 | AA486: 1089 | AB486: 886 | AC486: 122.91196388261851 | AD486: 28
A487: WAVERLEY | C487: ROGERSON 3 | F487: LAWSON 2 | I487: BREWSTER | L487: INGWERSON | O487: GRANT | Q487: POORE | W487: BRUNSWICK | X487: 7 | Y487: 4 | Z487: 0 | AA487: 917 | AB487: 923 | AC487: 99.349945828819074 | AD487: 28
E488: 10TH JULY | J488: WEATHER | M488: FINE
A489: PRESTON | C489: 3 | D489: 3 | E489: =C489*6+D489 -> 21 | G489: 9 | H489: 4 | I489: =G489*6+H489 -> 58 | K489: 15 | L489: 4 | M489: =K489*6+L489 -> 94 | O489: 19 | P489: 10 | Q489: =O489*6+P489 -> 124 | S489: PRESTON | W489: SANDRINGHAM | X489: 6 | Y489: 5 | Z489: 0 | AA489: 961 | AB489: 851 | AC489: 112.92596944770858 | AD489: 24
A490: YARRAVILLE | C490: 3 | D490: 3 | E490: =C490*6+D490 -> 21 | G490: 5 | H490: 5 | I490: =G490*6+H490 -> 35 | K490: 10 | L490: 9 | M490: =K490*6+L490 -> 69 | O490: 12 | P490: 10 | Q490: =O490*6+P490 -> 82 | S490: JACKSON | W490: PRESTON | X490: 6 | Y490: 5 | Z490: 0 | AA490: 966 | AB490: 999 | AC490: 96.7 | AD490: 24
A491: BEST PLAYERS | W491: WILLIAMSTOWN | X491: 4 | Y491: 7 | Z491: 0 | AA491: 743 | AB491: 849 | AC491: 87.514723203769137 | AD491: 16
A492: PRESTON | C492: ALEXANDER | F492: WALKER | I492: HINDMARSH | L492: DINEEN | N492: HANVIN | Q492: WADDELL | W492: DANDENONG | X492: 3 | Y492: 8 | Z492: 0 | AA492: 892 | AB492: 1021 | AC492: 87.37 | AD492: 12
A493: YARRAVILLE | C493: RON BROWN | F493: McKENNA | I493: ROACH | L493: CURRIE | N493: ION | Q493: BARROW | W493: COBURG | X493: 3 | Y493: 8 | Z493: 0 | AA493: 849 | AB493: 973 | AC493: 87.26 | AD493: 12
A494: GOALKICKERS | P494: DELLAMARTA | R494: MOUNTNEY | W494: OAKLEIGH | X494: 1 | Y494: 10 | Z494: 0 | AA494: 716 | AB494: 1165 | AC494: 61.46 | AD494: 4
A495: PRESTON | C495: WALKER 7 | F495: HINDMARSH 4 | I495: DALTON 2 | K495: JOYCE | M495: ALEXANDER | P495: CAMERON | R495: WADDELL
A496: YARRAVILLE | C496: McKENNA 2 | F496: CONNELLY 2 | I496: FELL 2 | K496: MEDDINGS | M496: ROACH | O496: RON BROWN | R496: CASRIKUM | U496: CURRIE | W496: KNOTT
A498: PORT MELBOURNE | C498: 1 | D498: 2 | E498: =C498*6+D498 -> 8 | G498: 4 | H498: 5 | I498: =G498*6+H498 -> 29 | K498: 6 | L498: 8 | M498: =K498*6+L498 -> 44 | O498: 13 | P498: 12 | Q498: =O498*6+P498 -> 90 | S498: COBURG
A499: COBURG | C499: 2 | D499: 3 | E499: =C499*6+D499 -> 15 | G499: 3 | H499: 3 | I499: =G499*6+H499 -> 21 | K499: 5 | L499: 5 | M499: =K499*6+L499 -> 35 | O499: 5 | P499: 10 | Q499: =O499*6+P499 -> 40 | S499: O'NEILL
A500: BEST PLAYERS
A501: PORT MELBOURNE | C501: COLLINS | F501: GROVER | I501: CRUTCHFIELD | L501: TAGGART | O501: ALLEN | R501: BONNETT
A502: COBURG | C502: TASIC | F502: PLANT | I502: GONINAN | L502: MIERS | O502: BORDIGNON | R502: ACKLAND
A503: GOALKICKERS
A504: PORT MELBOURNE | C504: HOWELL 3 | F504: CARLILE 3 | I504: MILNER 3 | K504: TAGGART | M504: PERRY | O504: GRIFFITHS | Q504: CARLILE
A505: COBURG | C505: SULLIVAN 2 | F505: GONINAN | I505: THOMPSON | L505: BRANSTON
A507: SANDRINGHAM | C507: 9 | D507: 3 | E507: =C507*6+D507 -> 57 | G507: 10 | H507: 6 | I507: =G507*6+H507 -> 66 | K507: 13 | L507: 8 | M507: =K507*6+L507 -> 86 | O507: 16 | P507: 12 | Q507: =O507*6+P507 -> 108 | S507: JUNCTION OVAL
A508: OAKLEIGH | C508: 1 | D508: 3 | E508: =C508*6+D508 -> 9 | G508: 7 | H508: 7 | I508: =G508*6+H508 -> 49 | K508: 8 | L508: 8 | M508: =K508*6+L508 -> 56 | O508: 13 | P508: 14 | Q508: =O508*6+P508 -> 92 | S508: ARMSTRONG
A509: BEST PLAYERS
A510: SANDRINGHAM | C510: BURKE | F510: VAUGHAN | I510: O'TOOLE | L510: HANCE | O510: SELLECK | R510: MACKENZIE
A511: OAKLEIGH | C511: MILLER | F511: BEARD | I511: LYON | L511: LOVELESS | O511: JORDAN | R511: DEFTEROUS
A512: GOALKICKERS
A513: SANDRINGHAM | C513: O'TOOLE 4 | F513: ZEUSCHNER 4 | I513: HANCE 4 | K513: SELLECK | M513: WILLS | O513: WESTON | Q513: MACKENZIE
A514: OAKLEIGH | C514: O'BRIEN 3 | F514: DOWDELL 2 | I514: MILLER 2 | K514: JORDAN | M514: LOVELESS | O514: LYON | Q514: BEARD | S514: RITCHIE | U514: LUFF
A516: DANDENONG | C516: 2 | D516: 1 | E516: =C516*6+D516 -> 13 | G516: 5 | H516: 1 | I516: =G516*6+H516 -> 31 | K516: 9 | L516: 5 | M516: =K516*6+L516 -> 59 | O516: 14 | P516: 7 | Q516: =O516*6+P516 -> 91 | S516: DANDENONG
A517: BRUNSWICK | C517: 4 | D517: 4 | E517: =C517*6+D517 -> 28 | G517: 7 | H517: 5 | I517: =G517*6+H517 -> 47 | K517: 9 | L517: 7 | M517: =K517*6+L517 -> 61 | O517: 10 | P517: 7 | Q517: =O517*6+P517 -> 67 | S517: R ARMSTRONG
A518: BEST PLAYERS
A519: DANDENONG | C519: GRAVENER | F519: WHITEHEAD | I519: PATTERSON | L519: STEDWELL | O519: LIENERT
A520: BRUNSWICK | C520: COOK | F520: LEYDIN | I520: O'CONNELL | L520: ROBINS | O520: TURNER
A521: GOALKICKERS
A522: DANDENONG | C522: STEDWELL 4 | F522: PIVETTA 3 | I522: ROUVRAY 3 | L522: PATTERSON 2 | O522: WETZELL | Q522: BANKS
A523: BRUNSWICK | C523: COOK 3 | F523: LEYDIN 2 | I523: BRIGLIA 2 | L523: McKINNON 2 | O523: DILLON
A525: ROUND 12 | D525: 16TH JULY | I525: WEATHER | L525: HEAVY RAIN VERY COLD | S525: PLAYED AT
D526: 1ST QTR | H526: 2ND QTR | L526: 3RD QTR | P526: FINAL | S526: YARRAVILLE
A527: YARRAVILLE | C527: 0 | D527: 1 | E527: =C527*6+D527 -> 1 | G527: 2 | H527: 2 | I527: =G527*6+H527 -> 14 | K527: 2 | L527: 2 | M527: =K527*6+L527 -> 14 | O527: 6 | P527: 5 | Q527: =O527*6+P527 -> 41 | S527: UMPIRE | X527: LADDER | AB527: ROUND | AD527: 12
A528: DANDENONG | C528: 0 | D528: 2 | E528: =C528*6+D528 -> 2 | G528: 2 | H528: 7 | I528: =G528*6+H528 -> 19 | K528: 3 | L528: 9 | M528: =K528*6+L528 -> 27 | O528: 4 | P528: 12 | Q528: =O528*6+P528 -> 36 | S528: GARLICK
A529: BEST PLAYERS | W529: TEAM | X529: W | Y529: L | Z529: D | AA529: FOR | AB529: AGST | AC529: % | AD529: PTS
A530: YARRAVILLE | C530: MEDDINGS | F530: FELL | I530: EDWARDS | L530: ROACH | O530: BARROW | R530: CASTRIKUM
A531: DANDENONG | C531: McNAMARA | F531: OSBORNE | I531: GRAVENER | L531: LIENERT | O531: HYNDMAN | R531: STAUNTON | W531: PORT MELBOURNE | X531: 11 | Y531: 1 | Z531: 0 | AA531: 1016 | AB531: 711 | AC531: 142.9 | AD531: 44
A532: GOALKICKERS | W532: WAVERLEY | X532: 9 | Y532: 3 | Z532: 0 | AA532: 1152 | AB532: 813 | AC532: 141.69741697416976 | AD532: 36
A533: YARRAVILLE | C533: FELL 2 | F533: ROACH 2 | I533: ROWE | K533: FOGARTY | W533: YARRAVILLE | X533: 8 | Y533: 4 | Z533: 0 | AA533: 1130 | AB533: 922 | AC533: 122.55965292841648 | AD533: 32
A534: DANDENONG | C534: WETZELL 2 | G534: STEDWELL | J534: BANKS | W534: PRESTON | X534: 7 | Y534: 5 | Z534: 0 | AA534: 1037 | AB534: 1051 | AC534: 98.67 | AD534: 28
A536: WAVERLEY | C536: 6 | D536: 5 | E536: =C536*6+D536 -> 41 | G536: 10 | H536: 8 | I536: =G536*6+H536 -> 68 | K536: 10 | L536: 10 | M536: =K536*6+L536 -> 70 | O536: 13 | P536: 10 | Q536: =O536*6+P536 -> 88 | S536: WAVERLEY | W536: BRUNSWICK | X536: 7 | Y536: 5 | Z536: 0 | AA536: 980 | AB536: 998 | AC536: 98.196392785571149 | AD536: 28
A537: COBURG | C537: 0 | D537: 0 | E537: =C537*6+D537 -> 0 | G537: 0 | H537: 1 | I537: =G537*6+H537 -> 1 | K537: 1 | L537: 2 | M537: =K537*6+L537 -> 8 | O537: 2 | P537: 2 | Q537: =O537*6+P537 -> 14 | S537: GANNON | W537: SANDRINGHAM | X537: 6 | Y537: 6 | Z537: 0 | AA537: 1013 | AB537: 922 | AC537: 109.86984815618221 | AD537: 24
A538: BEST PLAYERS | W538: WILLIAMSTOWN | X538: 5 | Y538: 7 | Z538: 0 | AA538: 818 | AB538: 912 | AC538: 89.692982456140356 | AD538: 20
A539: WAVERLEY | C539: DOYLE | F539: GALLUS | I539: MITHEN | L539: NATION | O539: GRANT | R539: INGWERSON | W539: DANDENONG | X539: 3 | Y539: 9 | Z539: 0 | AA539: 928 | AB539: 1062 | AC539: 87.38 | AD539: 12
A540: COBURG | C540: CLEMENTS | F540: BORDIGNON | I540: HAYTON | L540: MIERS | O540: ACKLAND | R540: JESS | W540: COBURG | X540: 3 | Y540: 9 | Z540: 0 | AA540: 863 | AB540: 1061 | AC540: 81.34 | AD540: 12
A541: GOALKICKERS | S541: PETZKE | W541: OAKLEIGH | X541: 1 | Y541: 11 | Z541: 0 | AA541: 775 | AB541: 1260 | AC541: 61.51 | AD541: 4
A542: WAVERLEY | C542: MITHEN 3 | F542: GALLUS 3 | I542: ROGERSON 2 | L542: INGWERSON | O542: LAWSON | Q542: GRANT | S542: NATION
A543: COBURG | C543: CLEMENTS | F543: HAYTON
E544: 17TH JULY | I544: WEATHER
A545: PRESTON | C545: 1 | D545: 3 | E545: =C545*6+D545 -> 9 | G545: 6 | H545: 5 | I545: =G545*6+H545 -> 41 | K545: 6 | L545: 6 | M545: =K545*6+L545 -> 42 | O545: 10 | P545: 11 | Q545: =O545*6+P545 -> 71 | S545: PRESTON
A546: SANDRINGHAM | C546: 3 | D546: 5 | E546: =C546*6+D546 -> 23 | G546: 3 | H546: 8 | I546: =G546*6+H546 -> 26 | K546: 6 | L546: 10 | M546: =K546*6+L546 -> 46 | O546: 7 | P546: 10 | Q546: =O546*6+P546 -> 52 | S546: HASTIE
A547: BEST PLAYERS
A548: PRESTON | C548: WALKER | F548: PARRIS | I548: WADDELL | L548: ALEXANDER | O548: PERRY | R548: MURNANE
A549: SANDRINGHAM | C549: HANCE | F549: HOAR | I549: SELLECK | L549: LADDS | O549: MACKENZIE | R549: VAUGHAN
A550: GOALKICKERS
A551: PRESTON | C551: WALKER 5 | F551: JOYCE | H551: PARRIS | J551: ALEXANDER | M551: CAMERON | O551: WADDELL
A552: SANDRINGHAM | C552: BATEMAN 2 | F552: O'TOOLE | H552: ZEUSCHNER | K552: SELLECK | M552: JUDKINS | O552: K WILLS
A554: WILLIAMSTOWN | C554: 5 | D554: 3 | E554: =C554*6+D554 -> 33 | G554: 6 | H554: 3 | I554: =G554*6+H554 -> 39 | K554: 9 | L554: 6 | M554: =K554*6+L554 -> 60 | O554: 11 | P554: 9 | Q554: =O554*6+P554 -> 75 | S554: BRUNSWICK
A555: BRUNSWICK | C555: 1 | D555: 5 | E555: =C555*6+D555 -> 11 | G555: 6 | H555: 10 | I555: =G555*6+H555 -> 46 | K555: 7 | L555: 11 | M555: =K555*6+L555 -> 53 | O555: 8 | P555: 15 | Q555: =O555*6+P555 -> 63 | S555: TURNER
A556: BEST PLAYERS
A557: WILLIAMSTOWN | C557: DODD | F557: BLAINEY | I557: SAVIGE | L557: VOSILAITES | O557: TROTMAN | R557: O'MARA
A558: BRUNSWICK | C558: LIMBOM | F558: LEYDIN | I558: TURNER | L558: ROBINS | O558: WROUT | R558: BIBBY
A559: GOALKICKERS
A560: WILLIAMSTOWN | C560: SAVIGE 4 | F560: VOSILAITES 3 | I560: JAMES | K560: ROGAN | M560: TROTMAN | P560: BAMFORD
A561: BRUNSWICK | C561: COOK 2 | F561: LIMBOM 2 | I561: LEYDIN | K561: BIBBY | M561: WROUT | O561: BURNS
A563: PORT MELBOURNE | C563: 3 | D563: 1 | E563: =C563*6+D563 -> 19 | G563: 5 | H563: 4 | I563: =G563*6+H563 -> 34 | K563: 10 | L563: 10 | M563: =K563*6+L563 -> 70 | O563: 13 | P563: 17 | Q563: =O563*6+P563 -> 95 | S563: PORT MELBOURNE
A564: OAKLEIGH | C564: 1 | D564: 1 | E564: =C564*6+D564 -> 7 | G564: 4 | H564: 3 | I564: =G564*6+H564 -> 27 | K564: 6 | L564: 4 | M564: =K564*6+L564 -> 40 | O564: 9 | P564: 5 | Q564: =O564*6+P564 -> 59 | S564: ARMSTRONG
A565: BEST PLAYERS
A566: PORT MELBOURNE | C566: BEDFORD | F566: GRIFFITHS | I566: BOWEN | L566: ALLEN | O566: TAGGART | R566: KERR
A567: OAKLEIGH | C567: LYON | F567: WAPLING | I567: DEFTEROUS | L567: O'BRIEN | O567: LOVELESS | R567: LUFF
A568: GOALKICKERS
A569: PORT MELBOURNE | C569: CARLILE 4 | F569: PERRY 3 | I569: HOWELL 2 | L569: BEDFORD | N569: ALLEN | P569: TAGGART | R569: KERR
A570: OAKLEIGH | C570: WAPLING 4 | F570: O' BRIEN 3 | I570: LYON | K570: HARRISON
A572: ROUND 13 | E572: 23RD JULY | J572: WEATHER | M572: NORTH WEST WIND | S572: PLAYED AT
D573: 1ST QTR | H573: 2ND QTR | L573: 3RD QTR | P573: FINAL | S573: OAKLEIGH
A574: WAVERLEY | C574: 2 | D574: 5 | E574: =C574*6+D574 -> 17 | G574: 4 | H574: 8 | I574: =G574*6+H574 -> 32 | K574: 5 | L574: 12 | M574: =K574*6+L574 -> 42 | O574: 7 | P574: 16 | Q574: =O574*6+P574 -> 58 | S574: UMPIRE | X574: LADDER | AB574: ROUND | AD574: 13
A575: OAKLEIGH | C575: 2 | D575: 1 | E575: =C575*6+D575 -> 13 | G575: 3 | H575: 3 | I575: =G575*6+H575 -> 21 | K575: 6 | L575: 4 | M575: =K575*6+L575 -> 40 | O575: 8 | P575: 6 | Q575: =O575*6+P575 -> 54 | S575: CHAPLIN
A576: BEST PLAYERS | W576: TEAM | X576: W | Y576: L | Z576: D | AA576: FOR | AB576: AGST | AC576: % | AD576: PTS
A577: WAVERLEY | C577: NATION | F577: ELLIS | I577: POORE | L577: REEVES | N577: GALLUS | Q577: ROLFE
A578: OAKLEIGH | C578: DEFTEROUS | F578: HARRISON | I578: WAPLING | L578: LYON | N578: O'BRIEN | Q578: MULDOON | W578: PORT MELBOURNE | X578: 12 | Y578: 1 | Z578: 0 | AA578: 1114 | AB578: 782 | AC578: 142.46 | AD578: 48
A579: GOALKICKERS | W579: WAVERLEY | X579: 10 | Y579: 3 | Z579: 0 | AA579: 1210 | AB579: 867 | AC579: 139.56170703575549 | AD579: 40
A580: WAVERLEY | C580: LAWSON 2 | F580: GALLUS 2 | I580: HUDSON | K580: INGWERSON | N580: POORE | W580: YARRAVILLE | X580: 8 | Y580: 5 | Z580: 0 | AA580: 1169 | AB580: 990 | AC580: 118.08080808080808 | AD580: 32
A581: OAKLEIGH | C581: McCORKELL 3 | F581: BEARD 2 | I581: WAPLING 2 | L581: RITCHIE | W581: BRUNSWICK | X581: 8 | Y581: 5 | Z581: 0 | AA581: 1037 | AB581: 1035 | AC581: 100.19323671497584 | AD581: 32
E582: 24TH JULY | J582: WEATHER | M582: NORTH WIND
A583: PORT MELBOURNE | C583: 2 | D583: 4 | E583: =C583*6+D583 -> 16 | G583: 8 | H583: 14 | I583: =G583*6+H583 -> 62 | K583: 10 | L583: 14 | M583: =K583*6+L583 -> 74 | O583: 13 | P583: 20 | Q583: =O583*6+P583 -> 98 | S583: JUNCTION OVAL | W583: PRESTON | X583: 8 | Y583: 5 | Z583: 0 | AA583: 1107 | AB583: 1113 | AC583: 99.46 | AD583: 32
A584: SANDRINGHAM | C584: 4 | D584: 5 | E584: =C584*6+D584 -> 29 | G584: 4 | H584: 8 | I584: =G584*6+H584 -> 32 | K584: 8 | L584: 15 | M584: =K584*6+L584 -> 63 | O584: 9 | P584: 17 | Q584: =O584*6+P584 -> 71 | S584: JACKSON | W584: SANDRINGHAM | X584: 6 | Y584: 7 | Z584: 0 | AA584: 1084 | AB584: 1020 | AC584: 106.27450980392157 | AD584: 24
A585: BEST PLAYERS | W585: WILLIAMSTOWN | X585: 6 | Y585: 7 | Z585: 0 | AA585: 886 | AB585: 951 | AC585: 93.165089379600417 | AD585: 24
A586: PORT MELBOURNE | C586: BEDFORD | F586: PERRY | I586: KERR | L586: HOWELL | N586: TAGGART | Q586: GRIFFITHS | W586: DANDENONG | X586: 3 | Y586: 10 | Z586: 0 | AA586: 990 | AB586: 1132 | AC586: 87.46 | AD586: 12
A587: SANDRINGHAM | C587: HANCE | F587: LADDS | I587: VAUGHAN | L587: SELLECK | N587: O'TOOLE | Q587: MUTER | W587: COBURG | X587: 3 | Y587: 10 | Z587: 0 | AA587: 900 | AB587: 1118 | AC587: 80.5 | AD587: 12
A588: GOALKICKERS | W588: OAKLEIGH | X588: 1 | Y588: 12 | Z588: 0 | AA588: 829 | AB588: 1318 | AC588: 62.9 | AD588: 4
A589: PORT MELBOURNE | C589: CARLILE 4 | F589: PERRY 3 | I589: HOWELL 2 | L589: ALLEN | N589: BUCKLEY | P589: BEDFORD | R589: MILNER
A590: SANDRINGHAM | C590: O'TOOLE 3 | F590: ZEUSCHNER 2 | I590: HANCE 2 | L590: BATEMAN | N590: JUDKINS
A592: WILLIAMSTOWN | C592: 1 | D592: 1 | E592: =C592*6+D592 -> 7 | G592: 2 | H592: 6 | I592: =G592*6+H592 -> 18 | K592: 3 | L592: 8 | M592: =K592*6+L592 -> 26 | O592: 9 | P592: 14 | Q592: =O592*6+P592 -> 68 | S592: WILLIAMSTOWN
A593: YARRAVILLE | C593: 2 | D593: 5 | E593: =C593*6+D593 -> 17 | G593: 2 | H593: 6 | I593: =G593*6+H593 -> 18 | K593: 4 | L593: 12 | M593: =K593*6+L593 -> 36 | O593: 4 | P593: 15 | Q593: =O593*6+P593 -> 39 | S593: CRAIG
A594: BEST PLAYERS
A595: WILLIAMSTOWN | C595: BLAINEY | F595: O'MARA | I595: SAVIGE | L595: MAGILL | O595: WARE | Q595: COHEN
A596: YARRAVILLE | C596: MEDDINGS | F596: ION | I596: HOBBS | L596: CASTRIKUM | O596: FELL | Q596: WILSON
A597: GOALKICKERS
A598: WILLIAMSTOWN | C598: SAVIGE 3 | F598: JAMES 2 | I598: TROTMAN 2 | L598: WARE | N598: CLOUGH
A599: YARRAVILLE | C599: HOBBS 2 | F599: FELL | H599: McKENNA
A601: PRESTON | C601: 5 | D601: 8 | E601: =C601*6+D601 -> 38 | G601: 6 | H601: 9 | I601: =G601*6+H601 -> 45 | K601: 10 | L601: 9 | M601: =K601*6+L601 -> 69 | O601: 10 | P601: 10 | Q601: =O601*6+P601 -> 70 | S601: DANDENONG
A602: DANDENONG | C602: 0 | D602: 0 | E602: =C602*6+D602 -> 0 | G602: 6 | H602: 7 | I602: =G602*6+H602 -> 43 | K602: 6 | L602: 8 | M602: =K602*6+L602 -> 44 | O602: 8 | P602: 14 | Q602: =O602*6+P602 -> 62 | S602: O'NEILL
A603: BEST PLAYERS
A604: PRESTON | C604: HINDMARSH | F604: JOYCE | I604: TRELOAR | L604: DINEEN | O604: WADDELL | R604: ALEXANDER
A605: DANDENONG | C605: GRAVENER | F605: HYNDMAN | I605: WHITEHEAD | L605: BROWN | O605: SUTTON | R605: STAUNTON
A606: GOALKICKERS
A607: PRESTON | C607: WALKER 3 | F607: JOYCE 2 | I607: MURNANE 2 | L607: HINDMARSH | O607: WADDELL | Q607: CAMERON
A608: DANDENONG | C608: ROUVRAY 3 | F608: WETZEL 2 | I608: SMITH | K608: BROWN | M608: BANKS
A610: BRUNSWICK | C610: 4 | D610: 8 | E610: =C610*6+D610 -> 32 | G610: 6 | H610: 8 | I610: =G610*6+H610 -> 44 | K610: 8 | L610: 9 | M610: =K610*6+L610 -> 57 | O610: 8 | P610: 9 | Q610: =O610*6+P610 -> 57 | S610: COBURG
A611: COBURG | C611: 0 | D611: 1 | E611: =C611*6+D611 -> 1 | G611: 3 | H611: 1 | I611: =G611*6+H611 -> 19 | K611: 4 | L611: 1 | M611: =K611*6+L611 -> 25 | O611: 5 | P611: 7 | Q611: =O611*6+P611 -> 37 | S611: GARLICK
A612: BEST PLAYERS
A613: BRUNSWICK | C613: LEYDIN | F613: BURNS | I613: BIBBY | L613: TURNER | O613: AUSTIN | R613: LIMBOM
A614: COBURG | C614: WELSH | F614: ACKLAND | I614: THOMPSON | L614: PLANT | O614: SULLIVAN | R614: MIERS
A615: GOALKICKERS
A616: BRUNSWICK | C616: COOK 2 | F616: BRIGLIA 2 | I616: LEYDIN 2 | L616: ROBINS | N616: WROUT
A617: COBURG | C617: GRAHAM | F617: SULLIVAN | I617: ACKLAND | K617: BORDIGNON | N617: BOSCHEN
A619: ROUND 14 | E619: 31ST JULY | J619: WEATHER | N619: NORTH WIND FINE | S619: PLAYED AT
D620: 1ST QTR | H620: 2ND QTR | L620: 3RD QTR | P620: FINAL | S620: WAVERLEY
A621: PORT MELBOURNE | C621: 1 | D621: 1 | E621: =C621*6+D621 -> 7 | G621: 8 | H621: 4 | I621: =G621*6+H621 -> 52 | K621: 10 | L621: 8 | M621: =K621*6+L621 -> 68 | O621: 17 | P621: 9 | Q621: =O621*6+P621 -> 111 | S621: UMPIRE | X621: LADDER | AB621: ROUND | AD621: 14
A622: WAVERLEY | C622: 5 | D622: 5 | E622: =C622*6+D622 -> 35 | G622: 6 | H622: 10 | I622: =G622*6+H622 -> 46 | K622: 7 | L622: 12 | M622: =K622*6+L622 -> 54 | O622: 11 | P622: 14 | Q622: =O622*6+P622 -> 80 | S622: CRAIG
A623: BEST PLAYERS | W623: TEAM | X623: W | Y623: L | Z623: D | AA623: FOR | AB623: AGST | AC623: % | AD623: PTS
A624: PORT MELBOURNE | C624: BEDFORD | F624: CAULFIELD | I624: BOWEN | L624: BUCKLEY | O624: GROVER | Q624: RENOUF
A625: WAVERLEY | C625: INGWERSON | F625: JEFFERSON | I625: ROGERSON | L625: VARLAMOS | O625: ROLFE | Q625: REEVES | W625: PORT MELBOURNE | X625: 13 | Y625: 1 | Z625: 0 | AA625: 1225 | AB625: 862 | AC625: 142.11 | AD625: 52
A626: GOALKICKERS | R626: KERR | W626: WAVERLEY | X626: 10 | Y626: 4 | Z626: 0 | AA626: 1290 | AB626: 978 | AC626: 131.90184049079755 | AD626: 40
A627: PORT MELBOURNE | C627: BEDFORD 6 | F627: CARLILE 3 | I627: ALLEN 2 | K627: TAGGART | M627: HOWELL | O627: BONNETT | Q627: PERRY | S627: BOWEN | W627: YARRAVILLE | X627: 9 | Y627: 5 | Z627: 0 | AA627: 1245 | AB627: 1040 | AC627: 119.71153846153847 | AD627: 36
A628: WAVERLEY | C628: INGWERSON 3 | F628: HUDSON 2 | I628: GALLUS 2 | K628: LAWSON | M628: ROGERSON | P628: JEFFERSON | S628: THOROGOOD | W628: BRUNSWICK | X628: 8 | Y628: 6 | Z628: 0 | AA628: 1153 | AB628: 1156 | AC628: 99.740484429065745 | AD628: 32
A630: WILLIAMSTOWN | C630: 0 | D630: 3 | E630: =C630*6+D630 -> 3 | G630: 3 | H630: 7 | I630: =G630*6+H630 -> 25 | K630: 5 | L630: 10 | M630: =K630*6+L630 -> 40 | O630: 7 | P630: 17 | Q630: =O630*6+P630 -> 59 | S630: PRESTON | W630: PRESTON | X630: 8 | Y630: 6 | Z630: 0 | AA630: 1161 | AB630: 1172 | AC630: 99.06 | AD630: 32
A631: PRESTON | C631: 1 | D631: 5 | E631: =C631*6+D631 -> 11 | G631: 2 | H631: 5 | I631: =G631*6+H631 -> 17 | K631: 6 | L631: 10 | M631: =K631*6+L631 -> 46 | O631: 7 | P631: 12 | Q631: =O631*6+P631 -> 54 | S631: ARMSTRONG | W631: SANDRINGHAM | X631: 7 | Y631: 7 | Z631: 0 | AA631: 1204 | AB631: 1096 | AC631: 109.85401459854015 | AD631: 28
A632: BEST PLAYERS | W632: WILLIAMSTOWN | X632: 7 | Y632: 7 | Z632: 0 | AA632: 945 | AB632: 1005 | AC632: 94.02985074626865 | AD632: 28
A633: WILLIAMSTOWN | C633: VOSILAITIS | F633: ANDERSON | I633: WARE | L633: BOYD | N633: EVANS | Q633: BAMFORD | W633: DANDENONG | X633: 3 | Y633: 11 | Z633: 0 | AA633: 1066 | AB633: 1252 | AC633: 85.14 | AD633: 12
A634: PRESTON | C634: HANVIN | F634: DIXON | I634: DELLAMARTA | L634: WALKER | N634: CAMERON | Q634: MOUNTNEY | W634: COBURG | X634: 3 | Y634: 11 | Z634: 0 | AA634: 950 | AB634: 1194 | AC634: 79.56 | AD634: 12
A635: GOALKICKERS | W635: OAKLEIGH | X635: 2 | Y635: 12 | Z635: 0 | AA635: 950 | AB635: 1434 | AC635: 66.25 | AD635: 8
A636: WILLIAMSTOWN | C636: SAVIGE 2 | F636: VOSILAITIS 2 | I636: JAMES | K636: TROTMAN | N636: WARE
A637: PRESTON | C637: WALKER 3 | F637: DELLAMARTA 2 | J637: ALEXANDER | M637: MOUNTNEY
A639: SANDRINGHAM | C639: 6 | D639: 3 | E639: =C639*6+D639 -> 39 | G639: 11 | H639: 7 | I639: =G639*6+H639 -> 73 | K639: 13 | L639: 10 | M639: =K639*6+L639 -> 88 | O639: 17 | P639: 18 | Q639: =O639*6+P639 -> 120 | S639: JUNCTION OVAL
A640: DANDENONG | C640: 3 | D640: 3 | E640: =C640*6+D640 -> 21 | G640: 5 | H640: 5 | I640: =G640*6+H640 -> 35 | K640: 8 | L640: 10 | M640: =K640*6+L640 -> 58 | O640: 11 | P640: 10 | Q640: =O640*6+P640 -> 76 | S640: ROWE
A641: BEST PLAYERS
A642: SANDRINGHAM | C642: O'TOOLE | F642: ZEUSCHNER | I642: SMITH | L642: GRANGER | O642: K WILLS | R642: LADDS
A643: DANDENONG | C643: WHITEHEAD | F643: SUTTON | I643: EVANS | L643: STAUNTON | O643: GREENWOOD | R643: BANKS
A644: GOALKICKERS
A645: SANDRINGHAM | C645: O'TOOLE 7 | F645: ZEUSCHNER 7 | I645: HARRISON | L645: BATEMAN | O645: O'DWYER
A646: DANDENONG | C646: GREENWOOD 3 | F646: SUTTON 2 | I646: McNAMARA 2 | L646: STAUNTON | O646: GRAVENER | Q646: BROWN | S646: BANKS
A648: YARRAVILLE | C648: 2 | D648: 0 | E648: =C648*6+D648 -> 12 | G648: 5 | H648: 7 | I648: =G648*6+H648 -> 37 | K648: 6 | L648: 9 | M648: =K648*6+L648 -> 45 | O648: 10 | P648: 16 | Q648: =O648*6+P648 -> 76 | S648: YARRAVILLE
A649: COBURG | C649: 2 | D649: 8 | E649: =C649*6+D649 -> 20 | G649: 2 | H649: 8 | I649: =G649*6+H649 -> 20 | K649: 4 | L649: 14 | M649: =K649*6+L649 -> 38 | O649: 6 | P649: 14 | Q649: =O649*6+P649 -> 50 | S649: CHAPLIN
A650: BEST PLAYERS
A651: YARRAVILLE | C651: MEDDINGS | F651: FELL | I651: ION | L651: CONNELLY | O651: QUARANTOTTO | R651: FOGARTY
A652: COBURG | C652: WELSH | F652: SULLIVAN | I652: THOMPSON | L652: FITZPATRICK | O652: CHALLENGER | R652: TANCREDI
A653: GOALKICKERS
A654: YARRAVILLE | C654: MEDDINGS 4 | F654: CONNELLY 2 | I654: FOGARTY 2 | L654: FELL | N654: QUARANTOTTO
A655: COBURG | C655: FITZPATRICK 3 | F655: THOMPSON | I655: GRAHAM | K655: GIARDOSSI
A657: OAKLEIGH | C657: 4 | D657: 7 | E657: =C657*6+D657 -> 31 | G657: 6 | H657: 7 | I657: =G657*6+H657 -> 43 | K657: 15 | L657: 7 | M657: =K657*6+L657 -> 97 | O657: 19 | P657: 7 | Q657: =O657*6+P657 -> 121 | S657: BRUNSWICK
A658: BRUNSWICK | C658: 3 | D658: 0 | E658: =C658*6+D658 -> 18 | G658: 7 | H658: 5 | I658: =G658*6+H658 -> 47 | K658: 12 | L658: 5 | M658: =K658*6+L658 -> 77 | O658: 18 | P658: 8 | Q658: =O658*6+P658 -> 116 | S658: O'NEILL
A659: BEST PLAYERS
A660: OAKLEIGH | C660: B McCORKELL | F660: LOVELESS | I660: O'BRIEN | L660: HAINING | N660: JORDAN | Q660: HALL
A661: BRUNSWICK | C661: COOK | F661: LEYDIN | I661: BURNS | L661: BIBBY | N661: ROBINS | Q661: PAGONIS
A662: GOALKICKERS
A663: OAKLEIGH | C663: B McCORKELL 5 | F663: BEARD 4 | I663: BOWEN 3 | K663: JORDAN 3 | N663: RITCHIE | P663: LYON | Q663: TRAILL | S663: LOVELESS
A664: BRUNSWICK | C664: COOK 7 | F664: LEYDIN 5 | I664: BURNS 2 | K664: PAGONIS 2 | N664: PENDLEBURY | Q664: DENTON
A666: ROUND 15 | E666: 6TH AUGUST | J666: WEATHER | M666: SOUTH BREEZE | S666: PLAYED AT
D667: 1ST QTR | H667: 2ND QTR | L667: 3RD QTR | P667: FINAL | S667: WILLIAMSTOWN
A668: WILLIAMSTOWN | C668: 3 | D668: 3 | E668: =C668*6+D668 -> 21 | G668: 7 | H668: 4 | I668: =G668*6+H668 -> 46 | K668: 9 | L668: 9 | M668: =K668*6+L668 -> 63 | O668: 10 | P668: 14 | Q668: =O668*6+P668 -> 74 | S668: UMPIRE | X668: LADDER | AB668: ROUND | AD668: 15
A669: DANDENONG | C669: 1 | D669: 3 | E669: =C669*6+D669 -> 9 | G669: 5 | H669: 7 | I669: =G669*6+H669 -> 37 | K669: 9 | L669: 10 | M669: =K669*6+L669 -> 64 | O669: 9 | P669: 15 | Q669: =O669*6+P669 -> 69 | S669: HASTIE
A670: BEST PLAYERS | W670: TEAM | X670: W | Y670: L | Z670: D | AA670: FOR | AB670: AGST | AC670: % | AD670: PTS
A671: WILLIAMSTOWN | C671: RUSSELL | F671: EVANS | I671: TROTMAN | L671: VOSILAITIS | O671: WARD | Q671: BOYD
A672: DANDENONG | C672: STEDWELL | F672: BROWN | I672: GRAVENER | L672: SUTTON | O672: EVANS | Q672: WHITEHEAD | W672: PORT MELBOURNE | X672: 14 | Y672: 1 | Z672: 0 | AA672: 1313 | AB672: 934 | AC672: 140.58 | AD672: 56
A673: GOALKICKERS | W673: WAVERLEY | X673: 11 | Y673: 4 | Z673: 0 | AA673: 1405 | AB673: 1092 | AC673: 128.66300366300365 | AD673: 44
A674: WILLIAMSTOWN | C674: VOSILAITIS 4 | F674: JAMES | H674: COHEN | J674: SAVIGE | L674: TROTMAN | N674: ROGAN | P674: BLAINEY | W674: YARRAVILLE | X674: 10 | Y674: 5 | Z674: 0 | AA674: 1397 | AB674: 1126 | AC674: 124.06749555950266 | AD674: 40
A675: DANDENONG | C675: SUTTON 3 | F675: GREENWOOD 2 | J675: OSBORNE | L675: GRAVENER | N675: LIENERT | P675: HYNDMAN | W675: PRESTON | X675: 9 | Y675: 6 | Z675: 0 | AA675: 1240 | AB675: 1230 | AC675: 100.81 | AD675: 36
E676: 7TH AUGUST | J676: WEATHER | M676: FINE
A677: PORT MELBOURNE | C677: 3 | D677: 2 | E677: =C677*6+D677 -> 20 | G677: 6 | H677: 4 | I677: =G677*6+H677 -> 40 | K677: 8 | L677: 12 | M677: =K677*6+L677 -> 60 | O677: 12 | P677: 16 | Q677: =O677*6+P677 -> 88 | S677: PORT MELBOURNE | W677: BRUNSWICK | X677: 8 | Y677: 7 | Z677: 0 | AA677: 1225 | AB677: 1244 | AC677: 98.472668810289392 | AD677: 32
A678: BRUNSWICK | C678: 1 | D678: 4 | E678: =C678*6+D678 -> 10 | G678: 4 | H678: 5 | I678: =G678*6+H678 -> 29 | K678: 6 | L678: 9 | M678: =K678*6+L678 -> 45 | O678: 9 | P678: 18 | Q678: =O678*6+P678 -> 72 | S678: GANNON | W678: WILLIAMSTOWN | X678: 8 | Y678: 7 | Z678: 0 | AA678: 1019 | AB678: 1074 | AC678: 94.878957169459966 | AD678: 32
A679: BEST PLAYERS | W679: SANDRINGHAM | X679: 7 | Y679: 8 | Z679: 0 | AA679: 1318 | AB679: 1211 | AC679: 108.83567299752271 | AD679: 28
A680: PORT MELBOURNE | C680: CAULFIELD | F680: GRIFFITHS | I680: BUCKLEY | L680: BEDFORD | O680: CARLILE | R680: BOWEN | W680: DANDENONG | X680: 3 | Y680: 12 | Z680: 0 | AA680: 1135 | AB680: 1326 | AC680: 85.6 | AD680: 12
A681: BRUNSWICK | C681: BIBBY | F681: BURNS | I681: McCONNELL | L681: BRIGLIA | O681: LIMBOM | R681: LEYDIN | W681: COBURG | X681: 3 | Y681: 12 | Z681: 0 | AA681: 1008 | AB681: 1273 | AC681: 79.18 | AD681: 12
A682: GOALKICKERS | W682: OAKLEIGH | X682: 2 | Y682: 13 | Z682: 0 | AA682: 1036 | AB682: 1586 | AC682: 65.32 | AD682: 8
A683: PORT MELBOURNE | C683: CARLILE 6 | F683: BOWEN 2 | I683: BEDFORD | K683: HOWELL | M683: PERRY | O683: COLLINS
A684: BRUNSWICK | C684: BURNS 3 | F684: BIBBY 2 | I684: COOK | K684: BRIGLIA | M684: LEYDIN | O684: PENDLEBURY
A686: WAVERLEY | C686: 6 | D686: 6 | E686: =C686*6+D686 -> 42 | G686: 10 | H686: 7 | I686: =G686*6+H686 -> 67 | K686: 12 | L686: 12 | M686: =K686*6+L686 -> 84 | O686: 17 | P686: 13 | Q686: =O686*6+P686 -> 115 | S686: WAVERLEY
A687: SANDRINGHAM | C687: 2 | D687: 2 | E687: =C687*6+D687 -> 14 | G687: 7 | H687: 5 | I687: =G687*6+H687 -> 47 | K687: 10 | L687: 8 | M687: =K687*6+L687 -> 68 | O687: 17 | P687: 12 | Q687: =O687*6+P687 -> 114 | S687: GARLICK
A688: BEST PLAYERS
A689: WAVERLEY | C689: POORE | E689: CHRISTIE | H689: INGWERSON | K689: LAWSON | N689: ROGERSON | Q689: GALLUS
A690: SANDRINGHAM | C690: HANCE | E690: HARRISON | H690: VAUGHAN | K690: O'DWYER | N690: MACKENZIE | Q690: O'TOOLE
A691: GOALKICKERS
A692: WAVERLEY | C692: INGWERSON 3 | F692: GALLUS 3 | I692: CHRISTIE 3 | L692: MITHEN 2 | N692: PETZKE 2 | Q692: JEFFERSON | T692: LAWSON | V692: ROGERSON | X692: McNAMEE
A693: SANDRINGHAM | C693: O'TOOLE 6 | F693: ZEUSCHNER 3 | I693: K WILLS 2 | L693: HANCE 2 | N693: O'DWYER 2 | Q693: HARRISON | T693: VAUGHAN
A695: PRESTON | C695: 2 | D695: 4 | E695: =C695*6+D695 -> 16 | G695: 4 | H695: 6 | I695: =G695*6+H695 -> 30 | K695: 8 | L695: 10 | M695: =K695*6+L695 -> 58 | O695: 11 | P695: 13 | Q695: =O695*6+P695 -> 79 | S695: COBURG
A696: COBURG | C696: 2 | D696: 2 | E696: =C696*6+D696 -> 14 | G696: 4 | H696: 3 | I696: =G696*6+H696 -> 27 | K696: 7 | L696: 5 | M696: =K696*6+L696 -> 47 | O696: 8 | P696: 10 | Q696: =O696*6+P696 -> 58 | S696: TURNER
A697: BEST PLAYERS
A698: PRESTON | C698: DELLAMARTA | F698: SCHICKERT | I698: DALTON | L698: MURNANE | O698: ALEXANDER | R698: WADDELL
A699: COBURG | C699: GOSS | F699: GRAHAM | I699: WELSH | L699: BORDIGNON | O699: FITZPATRICK | R699: OATEN
A700: GOALKICKERS
A701: PRESTON | C701: WALKER 3 | F701: JOYCE 2 | H701: DELLAMARTA 2 | L701: G PERRY | N701: HINDMARSH | Q701: CAMERON | S701: ALEXANDER
A702: COBURG | C702: FITZPATRICK 2 | F702: CHALLENGER 2 | J702: THOMPSON | M702: BORDIGNON | P702: BOSCHEN
A704: YARRAVILLE | C704: 5 | D704: 3 | E704: =C704*6+D704 -> 33 | G704: 11 | H704: 4 | I704: =G704*6+H704 -> 70 | K704: 15 | L704: 9 | M704: =K704*6+L704 -> 99 | O704: 23 | P704: 14 | Q704: =O704*6+P704 -> 152 | S704: OAKLEIGH
A705: OAKLEIGH | C705: 6 | D705: 2 | E705: =C705*6+D705 -> 38 | G705: 7 | H705: 7 | I705: =G705*6+H705 -> 49 | K705: 11 | L705: 10 | M705: =K705*6+L705 -> 76 | O705: 12 | P705: 14 | Q705: =O705*6+P705 -> 86 | S705: ROWE
A706: BEST PLAYERS
A707: YARRAVILLE | C707: ION | F707: MEDDINGS | I707: RON BROWN | L707: QUARANTOTTO | O707: BEATTIE | Q707: WILSON
A708: OAKLEIGH | C708: HAINING | F708: JORDAN | I708: BEARD | L708: A McCORKELL | O708: LYON | Q708: BOWEN
A709: GOALKICKERS
A710: YARRAVILLE | C710: BEATTIE 8 | F710: CURRIE 4 | I710: ION 3 | K710: CONNELLY 3 | N710: FELL 2 | P710: EDWARDS | R710: BROWN | T710: FOGARTY
A711: OAKLEIGH | C711: B McCORKELL 4 | F711: BEARD 4 | I711: RITCHIE | K711: DOWDELL | M711: LOVELESS | P711: JORDAN
A713: ROUND 16 | D713: 13TH AUGUST | H713: WEATHER | K713: DRIZZLING RAIN GROUNDS HEAVY | S713: PLAYED AT
D714: 1ST QTR | H714: 2ND QTR | L714: 3RD QTR | P714: FINAL | S714: BRUNSWICK
A715: WAVERLEY | C715: 3 | D715: 3 | E715: =C715*6+D715 -> 21 | G715: 5 | H715: 7 | I715: =G715*6+H715 -> 37 | K715: 6 | L715: 11 | M715: =K715*6+L715 -> 47 | O715: 9 | P715: 13 | Q715: =O715*6+P715 -> 67 | S715: UMPIRE | X715: LADDER | AB715: ROUND | AD715: 16
A716: BRUNSWICK | C716: 0 | D716: 3 | E716: =C716*6+D716 -> 3 | G716: 3 | H716: 4 | I716: =G716*6+H716 -> 22 | K716: 5 | L716: 7 | M716: =K716*6+L716 -> 37 | O716: 7 | P716: 7 | Q716: =O716*6+P716 -> 49 | S716: HASTIE
A717: BEST PLAYERS | W717: TEAM | X717: W | Y717: L | Z717: D | AA717: FOR | AB717: AGST | AC717: % | AD717: PTS
A718: WAVERLEY | C718: PETZKE | F718: POORE | I718: ROGERSON | L718: THOROGOOD | O718: ROLFE | Q718: MITHEN
A719: BRUNSWICK | C719: BURNS | F719: McGRATH | I719: KICK | L719: LEYDIN | O719: BIBBY | Q719: PENDLEBURY | W719: PORT MELBOURNE | X719: 14 | Y719: 2 | Z719: 0 | AA719: 1390 | AB719: 1017 | AC719: 136.68 | AD719: 56
A720: GOALKICKERS | W720: WAVERLEY | X720: 12 | Y720: 4 | Z720: 0 | AA720: 1472 | AB720: 1141 | AC720: 129.00964066608239 | AD720: 48
A721: WAVERLEY | C721: PETZKE 2 | F721: LAWSON 2 | I721: MITHEN 2 | L721: INGWERSON | O721: CHRISTIE | Q721: GALLUS | W721: YARRAVILLE | X721: 11 | Y721: 5 | Z721: 0 | AA721: 1480 | AB721: 1203 | AC721: 123.02576891105569 | AD721: 44
A722: BRUNSWICK | C722: BRIGLIA 2 | F722: BURNS | H722: COOK | J722: LEYDIN | L722: WATSON | N722: BIBBY | W722: PRESTON | X722: 10 | Y722: 6 | Z722: 0 | AA722: 1324 | AB722: 1268 | AC722: 104.42 | AD722: 40
A724: PRESTON | C724: 4 | D724: 2 | E724: =C724*6+D724 -> 26 | G724: 9 | H724: 3 | I724: =G724*6+H724 -> 57 | K724: 10 | L724: 7 | M724: =K724*6+L724 -> 67 | O724: 12 | P724: 12 | Q724: =O724*6+P724 -> 84 | S724: PRESTON | W724: SANDRINGHAM | X724: 8 | Y724: 8 | Z724: 0 | AA724: 1400 | AB724: 1282 | AC724: 109.20436817472699 | AD724: 32
A725: OAKLEIGH | C725: 3 | D725: 4 | E725: =C725*6+D725 -> 22 | G725: 5 | H725: 4 | I725: =G725*6+H725 -> 34 | K725: 5 | L725: 7 | M725: =K725*6+L725 -> 37 | O725: 5 | P725: 8 | Q725: =O725*6+P725 -> 38 | S725: GANNON | W725: BRUNSWICK | X725: 8 | Y725: 8 | Z725: 0 | AA725: 1274 | AB725: 1311 | AC725: 97.177726926010678 | AD725: 32
A726: BEST PLAYERS | W726: WILLIAMSTOWN | X726: 8 | Y726: 8 | Z726: 0 | AA726: 1090 | AB726: 1156 | AC726: 94.290657439446363 | AD726: 32
A727: PRESTON | C727: ALEXANDER | F727: G PERRY | I727: DIXON | L727: MURNANE | O727: JOYCE | Q727: TRELOAR | W727: DANDENONG | X727: 4 | Y727: 12 | Z727: 0 | AA727: 1195 | AB727: 1375 | AC727: 86.91 | AD727: 16
A728: OAKLEIGH | C728: LYON | F728: TRAILL | I728: JORDAN | L728: HAINING | O728: LUFF | Q728: LOVELESS | W728: COBURG | X728: 3 | Y728: 13 | Z728: 0 | AA728: 1057 | AB728: 1333 | AC728: 79.29 | AD728: 12
A729: GOALKICKERS | W729: OAKLEIGH | X729: 2 | Y729: 14 | Z729: 0 | AA729: 1074 | AB729: 1670 | AC729: 64.31 | AD729: 8
A730: PRESTON | C730: WALKER 3 | F730: DALTON 3 | I730: SCHICKERT 2 | L730: JOYCE | N730: ALEXANDER | Q730: CAMERON | S730: DELLAMARTA
A731: OAKLEIGH | C731: LOVELESS 2 | F731: JORDAN 2 | I731: BEARD
E732: 14TH AUGUST | J732: WEATHER | N732: WET
A733: YARRAVILLE | C733: 3 | D733: 2 | E733: =C733*6+D733 -> 20 | G733: 6 | H733: 5 | I733: =G733*6+H733 -> 41 | K733: 10 | L733: 5 | M733: =K733*6+L733 -> 65 | O733: 13 | P733: 5 | Q733: =O733*6+P733 -> 83 | S733: YARRAVILLE
A734: PORT MELBOURNE | C734: 4 | D734: 1 | E734: =C734*6+D734 -> 25 | G734: 6 | H734: 7 | I734: =G734*6+H734 -> 43 | K734: 9 | L734: 12 | M734: =K734*6+L734 -> 66 | O734: 10 | P734: 17 | Q734: =O734*6+P734 -> 77 | S734: TURNER
A735: BEST PLAYERS
A736: YARRAVILLE | C736: FELL | E736: ION | H736: CONNELLY | K736: FOGARTY | N736: JOHNSTON | Q736: WILSON
A737: PORT MELBOURNE | C737: PERRY | E737: CARLILE | H737: HOWELL | K737: SCHMIDT | N737: BEDFORD | Q737: ALLEN
A738: GOALKICKERS
A739: YARRAVILLE | C739: FELL 3 | E739: CONNELLY 3 | H739: FOGARTY 2 | K739: BEATTIE 2 | N739: JOHNSTON | Q739: QUARANTOTTO | U739: WILSON
A740: PORT MELBOURNE | C740: CARLILE 4 | F740: HOWELL 2 | I740: PERRY | K740: SCHMIDT | N740: BEDFORD | Q740: ALLEN
A742: SANDRINGHAM | C742: 2 | D742: 2 | E742: =C742*6+D742 -> 14 | G742: 6 | H742: 4 | I742: =G742*6+H742 -> 40 | K742: 10 | L742: 6 | M742: =K742*6+L742 -> 66 | O742: 12 | P742: 10 | Q742: =O742*6+P742 -> 82 | S742: JUNCTION OVAL
A743: WILLIAMSTOWN | C743: 6 | D743: 4 | E743: =C743*6+D743 -> 40 | G743: 7 | H743: 8 | I743: =G743*6+H743 -> 50 | K743: 8 | L743: 11 | M743: =K743*6+L743 -> 59 | O743: 10 | P743: 11 | Q743: =O743*6+P743 -> 71 | S743: CHAPLIN
A744: BEST PLAYERS
A745: SANDRINGHAM | C745: O'DWYER | F745: GRANGER | I745: ZEUSCHNER | L745: VAUGHAN | O745: HANCE | R745: LADDS
A746: WILLIAMSTOWN | C746: EVANS | F746: SVIGE | I746: CLOUGH | L746: WARE | O746: ANDERSON | R746: TROTMAN
A747: GOALKICKERS
A748: SANDRINGHAM | C748: DE LUCA 4 | F748: O'DWYER 2 | I748: ADDISON 2 | L748: O'TOOLE | N748: ZEUSCHNER | Q748: GRANGER | S748: K WILLS
A749: WILLIAMSTOWN | C749: SAVIGE 5 | F749: WARE 2 | I749: JAMES | K749: CLOUGH | M749: VOSILAITIS
A751: DANDENONG | C751: 4 | D751: 4 | E751: =C751*6+D751 -> 28 | G751: 6 | H751: 7 | I751: =G751*6+H751 -> 43 | K751: 7 | L751: 10 | M751: =K751*6+L751 -> 52 | O751: 8 | P751: 12 | Q751: =O751*6+P751 -> 60 | S751: DANDENONG
A752: COBURG | C752: 1 | D752: 2 | E752: =C752*6+D752 -> 8 | G752: 3 | H752: 4 | I752: =G752*6+H752 -> 22 | K752: 4 | L752: 5 | M752: =K752*6+L752 -> 29 | O752: 7 | P752: 7 | Q752: =O752*6+P752 -> 49 | S752: JACKSON
A753: BEST PLAYERS
A754: DANDENONG | C754: EVANS | F754: BROWN | I754: STAUNTON | L754: GRAVENER | O754: J SUTTON | R754: McNAMARA
A755: COBURG | C755: CHALLENGER | F755: TANCREDI | I755: PARTRIDGE | L755: ACKLAND | O755: BORDIGNON
A756: GOALKICKERS
A757: DANDENONG | C757: BROWN 2 | F757: GRAVENER 2 | I757: STAUNTON | L757: LIENERT | N757: OSBORNE | Q757: STEDWELL
A758: COBURG | C758: CHALLENGER 3 | F758: BORDIGNON 2 | I758: MITCHELL | L758: GRAHAM
A760: ROUND 17 | E760: 20TH AUGUST | I760: WEATHER | L760: FINE GROUNDS WET FROM PREVIOUS RAIN | S760: PLAYED AT
D761: 1ST QTR | H761: 2ND QTR | L761: 3RD QTR | P761: FINAL | S761: WAVERLEY
A762: WAVERLEY | C762: 3 | D762: 6 | E762: =C762*6+D762 -> 24 | G762: 5 | H762: 9 | I762: =G762*6+H762 -> 39 | K762: 8 | L762: 15 | M762: =K762*6+L762 -> 63 | O762: 13 | P762: 19 | Q762: =O762*6+P762 -> 97 | S762: UMPIRE | X762: LADDER | AB762: ROUND | AD762: 17
A763: YARRAVILLE | C763: 2 | D763: 1 | E763: =C763*6+D763 -> 13 | G763: 4 | H763: 5 | I763: =G763*6+H763 -> 29 | K763: 5 | L763: 5 | M763: =K763*6+L763 -> 35 | O763: 6 | P763: 9 | Q763: =O763*6+P763 -> 45 | S763: JACKSON
A764: BEST PLAYERS | W764: TEAM | X764: W | Y764: L | Z764: D | AA764: FOR | AB764: AGST | AC764: % | AD764: PTS
A765: WAVERLEY | C765: LAWSON | F765: ROGERSON | I765: NATION | L765: POORE | O765: REEVES | R765: JEFFERSON
A766: YARRAVILLE | C766: ION | F766: BARROW | I766: JOHNSTON | L766: McDONALD | O766: CONNELLY | R766: BEATTIE | W766: PORT MELBOURNE | X766: 14 | Y766: 3 | Z766: 0 | AA766: 1442 | AB766: 1096 | AC766: 131.57 | AD766: 56
A767: GOALKICKERS | W767: WAVERLEY | X767: 13 | Y767: 4 | Z767: 0 | AA767: 1569 | AB767: 1186 | AC767: 132.29342327150084 | AD767: 52
A768: WAVERLEY | C768: LAWSON 4 | F768: MITHEN 3 | I768: NATION 2 | K768: ROGERSON | M768: CHRISTIE | O768: GALLUS | Q768: JEFFERSON | W768: YARRAVILLE | X768: 11 | Y768: 6 | Z768: 0 | AA768: 1525 | AB768: 1300 | AC768: 117.30769230769231 | AD768: 44
A769: YARRAVILLE | C769: FELL 2 | F769: ROACH | H769: RON BROWN | K769: CONNELLY | N769: BEATTIE | W769: PRESTON | X769: 11 | Y769: 6 | Z769: 0 | AA769: 1403 | AB769: 1320 | AC769: 106.29 | AD769: 44
A771: PRESTON | C771: 5 | D771: 4 | E771: =C771*6+D771 -> 34 | G771: 5 | H771: 4 | I771: =G771*6+H771 -> 34 | K771: 7 | L771: 11 | M771: =K771*6+L771 -> 53 | O771: 11 | P771: 13 | Q771: =O771*6+P771 -> 79 | S771: PORT MELBOURNE | W771: SANDRINGHAM | X771: 9 | Y771: 8 | Z771: 0 | AA771: 1489 | AB771: 1335 | AC771: 111.53558052434457 | AD771: 36
A772: PORT MELBOURNE | C772: 1 | D772: 2 | E772: =C772*6+D772 -> 8 | G772: 4 | H772: 6 | I772: =G772*6+H772 -> 30 | K772: 4 | L772: 9 | M772: =K772*6+L772 -> 33 | O772: 7 | P772: 10 | Q772: =O772*6+P772 -> 52 | S772: ROWE | W772: BRUNSWICK | X772: 8 | Y772: 9 | Z772: 0 | AA772: 1327 | AB772: 1400 | AC772: 94.785714285714292 | AD772: 32
A773: BEST PLAYERS | W773: WILLIAMSTOWN | X773: 8 | Y773: 9 | Z773: 0 | AA773: 1156 | AB773: 1262 | AC773: 91.60063391442155 | AD773: 32
A774: PRESTON | C774: DIXON | F774: ALEXANDER | I774: MURNANE | L774: WALKER | O774: SCHICKERT | R774: TRELOAR | W774: DANDENONG | X774: 5 | Y774: 12 | Z774: 0 | AA774: 1288 | AB774: 1459 | AC774: 88.28 | AD774: 20
A775: PORT MELBOURNE | C775: BEDFORD | F775: TAGGART | I775: GRIFFITHS | L775: CAULFIELD | O775: BOWEN | R775: BUCKLEY | W775: COBURG | X775: 4 | Y775: 13 | Z775: 0 | AA775: 1163 | AB775: 1399 | AC775: 83.13 | AD775: 16
A776: GOALKICKERS | W776: OAKLEIGH | X776: 2 | Y776: 15 | Z776: 0 | AA776: 1158 | AB776: 1763 | AC776: 65.68 | AD776: 8
A777: PRESTON | C777: WALKER 5 | F777: DELLAMARTA 2 | J777: JOYCE | L777: ALEXANDER | O777: DALTON | Q777: SCHICKERT
A778: PORT MELBOURNE | C778: ALLEN 2 | F778: BEDFORD 2 | I778: PERRY | K778: BOWEN | M778: KERR
A780: SANDRINGHAM | C780: 2 | D780: 3 | E780: =C780*6+D780 -> 15 | G780: 6 | H780: 5 | I780: =G780*6+H780 -> 41 | K780: 10 | L780: 7 | M780: =K780*6+L780 -> 67 | O780: 13 | P780: 11 | Q780: =O780*6+P780 -> 89 | S780: BRUNSWICK
A781: BRUNSWICK | C781: 2 | D781: 4 | E781: =C781*6+D781 -> 16 | G781: 4 | H781: 5 | I781: =G781*6+H781 -> 29 | K781: 5 | L781: 13 | M781: =K781*6+L781 -> 43 | O781: 6 | P781: 17 | Q781: =O781*6+P781 -> 53 | S781: FLANAGAN
A782: BEST PLAYERS
A783: SANDRINGHAM | C783: LADDS | F783: ADDISON | I783: GRANGER | L783: K WILLS | O783: SMITH | R783: O'TOOLE
A784: BRUNSWICK | C784: ROBINS | F784: DENTON | I784: BURNS | L784: LEYDIN | O784: McGRATH | R784: O'CONNELL
A785: GOALKICKERS
A786: SANDRINGHAM | C786: O'TOOLE 4 | F786: ZEUSCHNER 2 | I786: K WILLS 2 | L786: DE LUCA 2 | N786: ADDISON | P786: O'DWYER | R786: GRANGER
A787: BRUNSWICK | C787: LEYDIN 2 | F787: BURNS | H787: KICK | J787: BRIGLIA | L787: WHILEY
A789: COBURG | C789: 5 | D789: 1 | E789: =C789*6+D789 -> 31 | G789: 9 | H789: 6 | I789: =G789*6+H789 -> 60 | K789: 13 | L789: 7 | M789: =K789*6+L789 -> 85 | O789: 16 | P789: 10 | Q789: =O789*6+P789 -> 106 | S789: COBURG
A790: WILLIAMSTOWN | C790: 2 | D790: 9 | E790: =C790*6+D790 -> 21 | G790: 6 | H790: 15 | I790: =G790*6+H790 -> 51 | K790: 8 | L790: 16 | M790: =K790*6+L790 -> 64 | O790: 8 | P790: 18 | Q790: =O790*6+P790 -> 66 | S790: R ARMSTRONG
A791: BEST PLAYERS
A792: COBURG | C792: THOMPSON | F792: GRAHAM | I792: BORDIGNON | L792: HAYES | O792: TANCREDI | R792: HILL
A793: WILLIAMSTOWN | C793: TROTMAN | F793: BOYD | I793: MAGILL | L793: RUSSELL | O793: VOSILAITIS | R793: HILL
A794: GOALKICKERS
A795: COBURG | C795: THOMPSON 6 | F795: BORDIGNON 3 | I795: PARTRIDGE 2 | L795: GRAHAM | N795: GONINON | P795: MITCHELL | R795: CHALLENGER | V795: HILL
A796: WILLIAMSTOWN | C796: JAMES 2 | F796: BLAINEY 2 | I796: VOSILAITIS 2 | L796: COHEN | N796: TROTMAN
A798: DANDENONG | C798: 4 | D798: 3 | E798: =C798*6+D798 -> 27 | G798: 5 | H798: 8 | I798: =G798*6+H798 -> 38 | K798: 9 | L798: 11 | M798: =K798*6+L798 -> 65 | O798: 13 | P798: 15 | Q798: =O798*6+P798 -> 93 | S798: OAKLEIGH
A799: OAKLEIGH | C799: 4 | D799: 6 | E799: =C799*6+D799 -> 30 | G799: 8 | H799: 6 | I799: =G799*6+H799 -> 54 | K799: 12 | L799: 12 | M799: =K799*6+L799 -> 84 | O799: 12 | P799: 12 | Q799: =O799*6+P799 -> 84 | S799: TURNER
A800: BEST PLAYERS
A801: DANDENONG | C801: J McNAMARA | F801: BANKS | I801: STAUNTON | L801: ANDREWS | O801: PIVETTA | R801: BROWN
A802: OAKLEIGH | C802: McLAREN | F802: TRAILL | I802: LOVELESS | L802: JORDAN | O802: LYON | R802: BINDLEY
A803: GOALKICKERS
A804: DANDENONG | C804: J F McNAMARA 3 | G804: WIGHT 3 | I804: STEDWELL 2 | L804: BANKS 2 | N804: OSBORNE | Q804: GREENWOOD | T804: GRAVENER
A805: OAKLEIGH | C805: McLAREN 3 | F805: JORDAN 2 | I805: A McCORKELL | L805: G McCORKELL | O805: BOWEN | Q805: LYON | S805: HOWLAND | V805: TRAILL | X805: LOVELESS
A807: ROUND 18 | D807: 27TH AUGUST | J807: WEATHER | S807: PLAYED AT
D808: 1ST QTR | H808: 2ND QTR | L808: 3RD QTR | P808: FINAL | S808: PRESTON
A809: PRESTON | C809: 4 | D809: 4 | E809: =C809*6+D809 -> 28 | G809: 6 | H809: 7 | I809: =G809*6+H809 -> 43 | K809: 12 | L809: 10 | M809: =K809*6+L809 -> 82 | O809: 14 | P809: 13 | Q809: =O809*6+P809 -> 97 | S809: UMPIRE | X809: LADDER | AB809: ROUND | AD809: 18
A810: WAVERLEY | C810: 3 | D810: 3 | E810: =C810*6+D810 -> 21 | G810: 7 | H810: 7 | I810: =G810*6+H810 -> 49 | K810: 9 | L810: 9 | M810: =K810*6+L810 -> 63 | O810: 13 | P810: 13 | Q810: =O810*6+P810 -> 91 | S810: FLANAGAN
A811: BEST PLAYERS | W811: TEAM | X811: W | Y811: L | Z811: D | AA811: FOR | AB811: AGST | AC811: % | AD811: PTS
A812: PRESTON | C812: HYDE | F812: JOYCE | I812: WALKER | L812: DIXON | O812: CAMERON | R812: TRELOAR
A813: WAVERLEY | C813: INGWERSON | F813: NATION | I813: MITHEN | L813: ROGERSON | O813: POORE | R813: LAWSON | W813: PORT MELBOURNE | X813: 15 | Y813: 3 | Z813: 0 | AA813: 1543 | AB813: 1139 | AC813: 135.47 | AD813: 60
A814: GOALKICKERS | W814: WAVERLEY | X814: 13 | Y814: 5 | Z814: 0 | AA814: 1660 | AB814: 1283 | AC814: 129.3842556508184 | AD814: 52
A815: PRESTON | C815: WALKER 6 | F815: JOYCE 2 | H815: HINDMARSH 2 | K815: DALTON | M815: TREZISE | O815: WADDELL | Q815: G PERRY | W815: YARRAVILLE | X815: 12 | Y815: 6 | Z815: 0 | AA815: 1605 | AB815: 1373 | AC815: 116.89730517115805 | AD815: 48
A816: WAVERLEY | C816: INGWERSON 5 | F816: MITHEN 3 | I816: GALLUS 2 | K816: CHRISTIE | M816: NATION | O816: JEFFERSON | W816: PRESTON | X816: 12 | Y816: 6 | Z816: 0 | AA816: 1500 | AB816: 1411 | AC816: 106.31 | AD816: 48
A818: YARRAVILLE | C818: 3 | D818: 4 | E818: =C818*6+D818 -> 22 | G818: 6 | H818: 6 | I818: =G818*6+H818 -> 42 | K818: 9 | L818: 11 | M818: =K818*6+L818 -> 65 | O818: 11 | P818: 14 | Q818: =O818*6+P818 -> 80 | S818: YARRAVILLE | W818: SANDRINGHAM | X818: 10 | Y818: 8 | Z818: 0 | AA818: 1632 | AB818: 1397 | AC818: 116.8217609162491 | AD818: 40
A819: BRUNSWICK | C819: 1 | D819: 0 | E819: =C819*6+D819 -> 6 | G819: 6 | H819: 2 | I819: =G819*6+H819 -> 38 | K819: 9 | L819: 8 | M819: =K819*6+L819 -> 62 | O819: 10 | P819: 13 | Q819: =O819*6+P819 -> 73 | S819: ARMSTRONG | W819: WILLIAMSTOWN | X819: 9 | Y819: 9 | Z819: 0 | AA819: 1265 | AB819: 1337 | AC819: 94.614809274495144 | AD819: 36
A820: BEST PLAYERS | W820: BRUNSWICK | X820: 8 | Y820: 10 | Z820: 0 | AA820: 1400 | AB820: 1480 | AC820: 94.594594594594597 | AD820: 32
A821: YARRAVILLE | C821: MEDDINGS | F821: RON BROWN | I821: McDONALD | L821: BEATTIE | O821: QUARANTOTTO | R821: FOGARTY | W821: DANDENONG | X821: 5 | Y821: 13 | Z821: 0 | AA821: 1331 | AB821: 1560 | AC821: 85.32 | AD821: 20
A822: BRUNSWICK | C822: BURNS | F822: ROBINSON | I822: ROBINS | L822: O'CONNELL | O822: KERWOOD | R822: WHILEY | W822: COBURG | X822: 4 | Y822: 14 | Z822: 0 | AA822: 1225 | AB822: 1542 | AC822: 79.44 | AD822: 16
A823: GOALKICKERS | W823: OAKLEIGH | X823: 2 | Y823: 16 | Z823: 0 | AA823: 1233 | AB823: 1872 | AC823: 65.87 | AD823: 8
A824: YARRAVILLE | C824: QUARANTOTTO 4 | G824: RON BROWN 3 | J824: ROACH 2 | M824: McKENNA | O824: BEATTIE
A825: BRUNSWICK | C825: WHILEY 4 | E825: BIBBY 2 | G825: O'CONNELL 2 | J825: MACKINNON | M825: BURNS
A827: WILLIAMSTOWN | C827: 5 | D827: 5 | E827: =C827*6+D827 -> 35 | G827: 7 | H827: 10 | I827: =G827*6+H827 -> 52 | K827: 13 | L827: 15 | M827: =K827*6+L827 -> 93 | O827: 15 | P827: 19 | Q827: =O827*6+P827 -> 109 | S827: WILLIAMSTOWN
A828: OAKLEIGH | C828: 1 | D828: 1 | E828: =C828*6+D828 -> 7 | G828: 5 | H828: 3 | I828: =G828*6+H828 -> 33 | K828: 8 | L828: 4 | M828: =K828*6+L828 -> 52 | O828: 11 | P828: 9 | Q828: =O828*6+P828 -> 75 | S828: O'NEILL
A829: BEST PLAYERS
A830: WILLIAMSTOWN | C830: SAVIGE | F830: EVANS | I830: WARE | L830: RUSSELL | O830: WARD | R830: MAGILL
A831: OAKLEIGH | C831: TRAILL | F831: BOWEN | I831: PARIS | L831: JORDAN | O831: B McCORKELL | R831: G McCORKELL
A832: GOALKICKERS
A833: WILLIAMSTOWN | C833: EVANS 6 | F833: SAVIGE 6 | I833: MAGILL | K833: TROTMAN | N833: WARE
A834: OAKLEIGH | C834: B McCORKELL 5 | F834: BOWEN 2 | I834: G McCORKELL 2 | M834: HARRISON | P834: PARIS
A836: SANDRINGHAM | C836: 4 | D836: 4 | E836: =C836*6+D836 -> 28 | G836: 12 | H836: 9 | I836: =G836*6+H836 -> 81 | K836: 18 | L836: 12 | M836: =K836*6+L836 -> 120 | O836: 21 | P836: 17 | Q836: =O836*6+P836 -> 143 | S836: JUNCTION OVAL
A837: COBURG | C837: 0 | D837: 2 | E837: =C837*6+D837 -> 2 | G837: 2 | H837: 3 | I837: =G837*6+H837 -> 15 | K837: 7 | L837: 5 | M837: =K837*6+L837 -> 47 | O837: 9 | P837: 8 | Q837: =O837*6+P837 -> 62 | S837: GANNON
A838: BEST PLAYERS
A839: SANDRINGHAM | C839: O'TOOLE | F839: WESTON | I839: SELLECK | L839: ZEUSCHNER | O839: GRANGER | R839: DE LUCA
A840: COBURG | C840: McGRATH | F840: WELSH | I840: THOMPSON | L840: OATEN | O840: GRAHAM | R840: PARTRIDGE
A841: GOALKICKERS
A842: SANDRINGHAM | C842: O'TOOLE 6 | F842: WESTON 4 | I842: GRANGER 3 | L842: DE LUCA 2 | N842: ADDISON 2 | Q842: ZEUSCHNER 2 | T842: CLIFFORD | W842: K WILLS
A843: COBURG | C843: GRAHAM 2 | F843: TASIC | H843: PARTRIDGE | K843: MIERS | M843: THOMPSON | O843: MITCHELL | Q843: KEEFER | S843: GOSS
A845: PORT MELBOURNE | C845: 2 | D845: 2 | E845: =C845*6+D845 -> 14 | G845: 8 | H845: 3 | I845: =G845*6+H845 -> 51 | K845: 12 | L845: 8 | M845: =K845*6+L845 -> 80 | O845: 15 | P845: 11 | Q845: =O845*6+P845 -> 101 | S845: DANDENONG
A846: DANDENONG | C846: 3 | D846: 2 | E846: =C846*6+D846 -> 20 | G846: 3 | H846: 2 | I846: =G846*6+H846 -> 20 | K846: 5 | L846: 4 | M846: =K846*6+L846 -> 34 | O846: 6 | P846: 7 | Q846: =O846*6+P846 -> 43 | S846: CHAPLIN
A847: BEST PLAYERS
A848: PORT MELBOURNE | C848: GROVER | F848: CAULFIELD | I848: RENOUF | L848: TAGGART | O848: PERRY | R848: GRIFFITH
A849: DANDENONG | C849: J F McNAMARA | F849: SMITH | I849: HYNDMAN | L849: GREENWOOD | O849: GRAVENER | R849: SUTTON
A850: GOALKICKERS
A851: PORT MELBOURNE | C851: PERRY 5 | F851: CARLILE 3 | I851: TAGGART 3 | L851: JEFFREY 2 | N851: McGREGOR 2
A852: DANDENONG | C852: LIENERT | E852: WIGHT | G852: SMITH | I852: MELAI | K852: BANKS | M852: J A McNAMARA
A854: FINALS
A855: 1ST SEMI | D855: 1ST SEPTEMBER | J855: WEATHER | M855: FINE NO WIND
D856: 1ST QTR | H856: 2ND QTR | L856: 3RD QTR | P856: FINAL
A857: PRESTON | C857: 2 | D857: 3 | E857: =C857*6+D857 -> 15 | G857: 5 | H857: 7 | I857: =G857*6+H857 -> 37 | K857: 6 | L857: 10 | M857: =K857*6+L857 -> 46 | O857: 13 | P857: 11 | Q857: =O857*6+P857 -> 89 | S857: JUNCTION OVAL
A858: YARRAVILLE | C858: 4 | D858: 4 | E858: =C858*6+D858 -> 28 | G858: 4 | H858: 8 | I858: =G858*6+H858 -> 32 | K858: 12 | L858: 13 | M858: =K858*6+L858 -> 85 | O858: 12 | P858: 15 | Q858: =O858*6+P858 -> 87 | S858: ARMSTRONG
A859: BEST PLAYERS
A860: PRESTON | C860: JOYCE | F860: ALEXANDER | I860: G PERRY | L860: DELLAMARTA | O860: DALTON | R860: HINDMARSH
A861: YARRAVILLE | C861: CONNELLY | F861: MEDDINGS | I861: McDONALD | L861: CASTRIKUM | O861: RON BROWN | R861: HENDERSON
A862: GOALKICKERS
A863: PRESTON | C863: JOYCE 3 | F863: ALEXANDER 3 | I863: DALTON 2 | L863: CAMERON 2 | O863: HINDMARSH | R863: WALKER | U863: DELLAMARTA
A864: YARRAVILLE | C864: CONNELLY 4 | F864: McDONALD 3 | I864: FELL 2 | K864: BEATTIE 2 | N864: QUARANTOTTO
A866: 2ND SEMI | D866: 10TH SEPTEMBER | J866: WEATHER | M866: WEST WIND DULL CLOUDY
A867: WAVERLEY | C867: 4 | D867: 5 | E867: =C867*6+D867 -> 29 | G867: 6 | H867: 6 | I867: =G867*6+H867 -> 42 | K867: 8 | L867: 8 | M867: =K867*6+L867 -> 56 | O867: 9 | P867: 9 | Q867: =O867*6+P867 -> 63 | S867: JUNCTION OVAL
A868: PORT MELBOURNE | C868: 0 | D868: 2 | E868: =C868*6+D868 -> 2 | G868: 5 | H868: 4 | I868: =G868*6+H868 -> 34 | K868: 5 | L868: 11 | M868: =K868*6+L868 -> 41 | O868: 7 | P868: 13 | Q868: =O868*6+P868 -> 55 | S868: O'NEILL
A869: BEST PLAYERS
A870: WAVERLEY | C870: ELLIS | F870: REEVES | I870: ROGERSON | L870: LAWSON | O870: NATION | R870: POORE
A871: PORT MELBOURNE | C871: CAULFIELD | F871: WILLIAMS | I871: BEDFORD | L871: GROVER | O871: SCHMIDT | R871: TAGGART
A872: GOALKICKERS
A873: WAVERLEY | C873: MITHEN 2 | F873: LAWSON 2 | I873: McNAMEE | K873: GALLUS | M873: NATION | O873: JEFFERSON | R873: PATZKE
A874: PORT MELBOURNE | C874: CARLILE 2 | F874: TAGGART | I874: BEDFORD | K874: HOWELL | M874: JEFFREY | O874: MILNER
A876: PRELIMINARY FINAL | F876: 18TH SEPTEMBER | K876: WEATHER | N876: SOUTH WEST WIND SHOWERS
A877: PORT MELBOURNE | C877: 2 | D877: 3 | E877: =C877*6+D877 -> 15 | G877: 9 | H877: 7 | I877: =G877*6+H877 -> 61 | K877: 11 | L877: 8 | M877: =K877*6+L877 -> 74 | O877: 16 | P877: 14 | Q877: =O877*6+P877 -> 110 | S877: JUNCTION OVAL
A878: PRESTON | C878: 3 | D878: 2 | E878: =C878*6+D878 -> 20 | G878: 6 | H878: 3 | I878: =G878*6+H878 -> 39 | K878: 11 | L878: 4 | M878: =K878*6+L878 -> 70 | O878: 11 | P878: 6 | Q878: =O878*6+P878 -> 72 | S878: ARMSTRONG
A879: BEST PLAYERS
A880: PORT MELBOURNE | C880: ALLEN | F880: WILLIAMS | I880: GRIFFITH | L880: BOWEN | O880: BONNETT | R880: CAULFIELD
A881: PRESTON | C881: CAMERON | F881: MURNANE | I881: WALKER | L881: DALTON | O881: ALEXANDER | R881: DIXON
A882: GOALKICKERS
A883: PORT MELBOURNE | C883: BEDFORD 4 | F883: ALLEN 4 | I883: TAGGART 2 | L883: KERR 2 | N883: SCHMIDT 2 | Q883: HOWELL | S883: BOWEN
A884: PRESTON | C884: WALKER 5 | F884: DALTON 3 | I884: CAMERON 2 | L884: JOYCE
A886: GRAND FINAL | E886: 25TH SEPTEMBER | J886: WEATHER | M886: SOUTH WEST WIND FINE
A887: PORT MELBOURNE | C887: 2 | D887: 4 | E887: 16 | G887: 7 | H887: 6 | I887: 48 | K887: 8 | L887: 8 | M887: 56 | O887: 13 | P887: 12 | Q887: =O887*6+P887 -> 90 | S887: JUNCTION OVAL
A888: WAVERLEY | C888: 3 | D888: 7 | E888: 25 | G888: 3 | H888: 8 | I888: 26 | K888: 4 | L888: 11 | M888: 35 | O888: 6 | P888: 11 | Q888: =O888*6+P888 -> 47 | S888: O'NEILL
A889: BEST PLAYERS
A890: PORT MELBOURNE | C890: BEDFORD | F890: CAULFIELD | I890: WILLIAMS | L890: BONNETT | O890: BUCKLEY | R890: BOWEN
A891: WAVERLEY | C891: REEVES | F891: ROGERSON | I891: JEFFERSON | L891: LAWSON | O891: ROLFE | R891: NATION
A892: GOALKICKERS
A893: PORT MELBOURNE | C893: ALLEN 3 | F893: KERR 3 | I893: BEDFORD 2 | L893: TAGGART | N893: HOWELL | P893: BOWEN | R893: SCHMIDT | U893: BOLLARD
A894: WAVERLEY | C894: LAWSON 2 | F894: McNAMEE 2 | I894: GALLUS 2
A896: CARNIVAL MATCHES
E897: 9TH JUNE | I897: WEATHER | M897: FINE
D898: 1ST QTR | H898: 2ND QTR | L898: 3RD QTR | P898: FINAL
A899: W.A. | C899: 3 | D899: 10 | E899: =C899*6+D899 -> 28 | G899: 11 | H899: 12 | I899: =G899*6+H899 -> 78 | K899: 20 | L899: 14 | M899: =K899*6+L899 -> 134 | O899: 26 | P899: 18 | Q899: =O899*6+P899 -> 174 | S899: NEW NORFOLK
A900: V.F.A. | C900: 1 | D900: 0 | E900: =C900*6+D900 -> 6 | G900: 2 | H900: 2 | I900: =G900*6+H900 -> 14 | K900: 4 | L900: 5 | M900: =K900*6+L900 -> 29 | O900: 5 | P900: 11 | Q900: =O900*6+P900 -> 41 | S900: CROUCH V.F.L.
A901: BEST PLAYERS
A902: W.A. | C902: CABLE | F902: McINTOSH | I902: DONCON | L902: WHINNEN | O902: ATWELL | R902: JOHNSON
A903: V.F.A. | C903: BURNS | F903: VARLAMOS | I903: ALEXANDER | L903: BEDFORD | O903: MACKENZIE
A904: GOALKICKERS
A905: W.A. | C905: JOHNSON 5 | F905: CABLE 4 | I905: BROWN 4 | K905: DONCON 4 | N905: SLATER 3 | Q905: BREHAUT | S905: ABRAHAM | V905: THORNLEY | X905: BAGLEY
A906: V.F.A. | C906: ALEXANDER 2 | F906: BURNS | H906: STEDWELL | K906: BIBBY
E908: 11TH JUNE | J908: WEATHER | N908: FINE
A909: TASMANIA | C909: 4 | D909: 6 | E909: =C909*6+D909 -> 30 | G909: 6 | H909: 13 | I909: =G909*6+H909 -> 49 | K909: 13 | L909: 22 | M909: =K909*6+L909 -> 100 | O909: 19 | P909: 27 | Q909: =O909*6+P909 -> 141 | S909: NORTH HOBART
A910: V.F.A. | C910: 3 | D910: 3 | E910: =C910*6+D910 -> 21 | G910: 4 | H910: 5 | I910: =G910*6+H910 -> 29 | K910: 5 | L910: 5 | M910: =K910*6+L910 -> 35 | O910: 7 | P910: 11 | Q910: =O910*6+P910 -> 53 | S910: CUNNINGHAM S.A.
A911: BEST PLAYERS
A912: TASMANIA | C912: LEE | F912: PAYNE | I912: HUDSON | L912: BROWNING | O912: WHITTON | R912: DONOHUE
A913: V.F.A. | C913: BURNS | F913: BIBBY | I913: BEDFORD | L913: LUFF | O913: POORE | R913: GROVER
A914: GOALKICKERS
A915: TASMANIA | C915: HUDSON 7 | F915: PAYNE 3 | I915: DONOHUE 2 | L915: WHITTON 2 | O915: McLEAN 2 | R915: COX 2 | T915: LAWRENCE
A916: V.F.A. | C916: BIBBY 3 | F916: BURNS 2 | I916: STEDWELL | L916: ALEXANDER
D918: 13TH JUNE | I918: WEATHER
A919: V.F.L. | C919: 3 | D919: 3 | E919: =C919*6+D919 -> 21 | G919: 7 | H919: 7 | I919: =G919*6+H919 -> 49 | K919: 12 | L919: 12 | M919: =K919*6+L919 -> 84 | O919: 14 | P919: 17 | Q919: =O919*6+P919 -> 101 | S919: NORTH HOBART
A920: V.F.A. | C920: 1 | D920: 2 | E920: =C920*6+D920 -> 8 | G920: 3 | H920: 3 | I920: =G920*6+H920 -> 21 | K920: 6 | L920: 6 | M920: =K920*6+L920 -> 42 | O920: 9 | P920: 7 | Q920: =O920*6+P920 -> 61 | S920: MONTGOMERY W.A.
A921: BEST PLAYERS
A922: V.F.L. | C922: MARSHALL | F922: MANN | I922: BARROTT | L922: BRYANT | O922: TEASDALE | R922: NICHOLLS
A923: V.F.A. | C923: BURNS | F923: BROWN | I923: NATION | L923: MACKENZIE | O923: ROBINSON | R923: POORE
A924: GOALKICKERS
A925: V.F.L. | C925: MANN 4 | F925: WHITTEN 3 | I925: TEASDALE 2 | L925: GOOLD | N925: BECK | P925: MAGEE | R925: JOHN | T925: NEWNHAM
A926: V.F.A. | C926: CAULFIELD 3 | F926: BURNS 3 | I926: LUFF | K926: NATION | M926: ALEXANDER
D928: 15TH JUNE | J928: WEATHER
A929: S.A. | C929: 6 | D929: 4 | E929: =C929*6+D929 -> 40 | G929: 8 | H929: 8 | I929: =G929*6+H929 -> 56 | K929: 14 | L929: 13 | M929: =K929*6+L929 -> 97 | O929: 21 | P929: 20 | Q929: =O929*6+P929 -> 146 | S929: NORTH HOBART
A930: V.F.A. | C930: 3 | D930: 2 | E930: =C930*6+D930 -> 20 | G930: 5 | H930: 7 | I930: =G930*6+H930 -> 37 | K930: 8 | L930: 10 | M930: =K930*6+L930 -> 58 | O930: 9 | P930: 11 | Q930: =O930*6+P930 -> 65 | S930: MONTGOMERY W.A.
A931: BEST PLAYERS
A932: S.A. | C932: DAY | F932: ADCOCK | I932: HICKS | L932: SCHOFF | O932: CAHILL | R932: KERLEY
A933: V.F.A. | C933: CAULFIELD | F933: LUFF | I933: BURNS | L933: GROVER | O933: O'TOOLE | R933: NATION
A934: GOALKICKERS
A935: S.A. | C935: KINGSTON 5 | F935: SKUSE 4 | H935: SIMUNSEN 3 | K935: HICKS 2 | M935: POTTER 2 | O935: OAKEY | Q935: DUNN | R935: WEEDING | U935: ANDERSON | X935: CLARKSON
A936: V.F.A. | C936: O'TOOLE 3 | F936: CAULFIELD 3 | I936: BURNS | K936: ALEXANDER | N936: MACKENZIE