A1: Victorian Football Association
A2: Season 1966 - Division Two
A3: © Copyright Wal Williams | F3: First created: 28 March 2016
A4: Contact: joywalwi at gmail dot com | F4: Last updated: 28 March 2016 | W4: VFA Results and tables - Link to the main index page
A5: You are free to copy this document in whole or part provided that proper acknowledgement is given to the author. All rights reserved.
A7: 1966 | C7: V.F.A. SEASON 2ND DIVISION
A8: ROUND 1 | E8: 16TH APRIL | J8: WEATHER | S8: PLAYED AT
D9: 1ST QTR | H9: 2ND QTR | L9: 3RD QTR | P9: FINAL | S9: BOX HILL
A10: BOX HILL | C10: 3 | D10: 1 | E10: =C10*6+D10 -> 19 | G10: 9 | H10: 10 | I10: =G10*6+H10 -> 64 | K10: 12 | L10: 13 | M10: =K10*6+L10 -> 85 | O10: 17 | P10: 14 | Q10: =O10*6+P10 -> 116 | S10: UMPIRE | X10: LADDER | AB10: ROUND | AD10: 1
A11: CAMBERWELL | C11: 3 | D11: 0 | E11: =C11*6+D11 -> 18 | G11: 3 | H11: 3 | I11: =G11*6+H11 -> 21 | K11: 8 | L11: 5 | M11: =K11*6+L11 -> 53 | O11: 12 | P11: 6 | Q11: =O11*6+P11 -> 78
A12: BEST PLAYERS | W12: TEAM | X12: W | Y12: L | Z12: D | AA12: FOR | AB12: AGST | AC12: % | AD12: PTS
A13: BOX HILL | C13: BRYANT | F13: GARDINER | I13: I BATES | L13: WHITE | N13: McCURRY | Q13: LEHMAN
A14: CAMBERWELL | C14: PECK | F14: J SMITH | I14: O'NEILL | L14: D BOYD | N14: WINKLEMAN | Q14: DOUGLAS | W14: PRAHRAN | X14: 1 | Y14: 0 | Z14: 0 | AA14: 97 | AB14: 47 | AC14: =(AA14*100)/AB14 -> 206.38297872340425 | AD14: =(X14*4)+(Z14*2) -> 4
A15: GOALKICKERS | W15: NORTHCOTE | X15: 1 | Y15: 0 | Z15: 0 | AA15: 121 | AB15: 73 | AC15: =(AA15*100)/AB15 -> 165.75342465753425 | AD15: =(X15*4)+(Z15*2) -> 4
A16: BOX HILL | C16: BRYANT 6 | F16: GARDINER 4 | I16: MILLER 2 | K16: McCURRY 2 | N16: I BATES | P16: PRITCHARD | S16: DAVIES | W16: BOX HILL | X16: 1 | Y16: 0 | Z16: 0 | AA16: 116 | AB16: 78 | AC16: =(AA16*100)/AB16 -> 148.71794871794873 | AD16: =(X16*4)+(Z16*2) -> 4
A17: CAMBERWELL | C17: O'NEILL 4 | F17: PECK 3 | I17: WINKLEMAN 2 | L17: PANZIC | N17: FRIEBERG | Q17: D BOYD | W17: MORDIALLOC | X17: 1 | Y17: 0 | Z17: 0 | AA17: 92 | AB17: 82 | AC17: =(AA17*100)/AB17 -> 112.19512195121951 | AD17: =(X17*4)+(Z17*2) -> 4
A19: NORTHCOTE | C19: 6 | D19: 3 | E19: =C19*6+D19 -> 39 | G19: 8 | H19: 5 | I19: =G19*6+H19 -> 53 | K19: 15 | L19: 8 | M19: =K19*6+L19 -> 98 | O19: 17 | P19: 19 | Q19: =O19*6+P19 -> 121 | S19: GEELONG WEST | W19: SUNSHINE | X19: 1 | Y19: 0 | Z19: 0 | AA19: 93 | AB19: 88 | AC19: =(AA19*100)/AB19 -> 105.68181818181819 | AD19: =(X19*4)+(Z19*2) -> 4
A20: GEELONG WEST | C20: 3 | D20: 4 | E20: =C20*6+D20 -> 22 | G20: 5 | H20: 7 | I20: =G20*6+H20 -> 37 | K20: 7 | L20: 9 | M20: =K20*6+L20 -> 51 | O20: 10 | P20: 13 | Q20: =O20*6+P20 -> 73 | W20: WERRIBEE | X20: 0 | Y20: 1 | Z20: 0 | AA20: 88 | AB20: 93 | AC20: =(AA20*100)/AB20 -> 94.623655913978496 | AD20: =(X20*4)+(Z20*2) -> 0
A21: BEST PLAYERS | W21: FRANKSTON | X21: 0 | Y21: 1 | Z21: 0 | AA21: 82 | AB21: 92 | AC21: =(AA21*100)/AB21 -> 89.130434782608702 | AD21: =(X21*4)+(Z21*2) -> 0
A22: NORTHCOTE | C22: MICKLESON | F22: CRAMERI | I22: GEMMELL | L22: SIMPSON | N22: HENRY | Q22: SLEEP | W22: CAMBERWELL | X22: 0 | Y22: 1 | Z22: 0 | AA22: 78 | AB22: 116 | AC22: =(AA22*100)/AB22 -> 67.241379310344826 | AD22: =(X22*4)+(Z22*2) -> 0
A23: GEELONG WEST | C23: SNELL | F23: VAN T'HAG | I23: STACEY | L23: SOUTHERN | N23: RAEBURN | Q23: SALTER | W23: GEELONG WEST | X23: 0 | Y23: 1 | Z23: 0 | AA23: 73 | AB23: 121 | AC23: =(AA23*100)/AB23 -> 60.330578512396691 | AD23: =(X23*4)+(Z23*2) -> 0
A24: GOALKICKERS | W24: CAULFIELD | X24: 0 | Y24: 1 | Z24: 0 | AA24: 47 | AB24: 97 | AC24: =(AA24*100)/AB24 -> 48.453608247422679 | AD24: =(X24*4)+(Z24*2) -> 0
A25: NORTHCOTE | C25: MICKLESON 7 | F25: BRADY 2 | H25: SOUTER 2 | J25: GEMMELL 2 | M25: McBREEN 2 | O25: CRAMERI | R25: GRYBAS
A26: GEELONG WEST | C26: WINTER 2 | F26: GROVES 2 | I26: NIEWEAROWICZ 2 | M26: VAN T'HAG | O26: NUSTELING | R26: WILLIAMS | T26: PETERS | V26: SALTER
A28: SUNSHINE | C28: 3 | D28: 7 | E28: =C28*6+D28 -> 25 | G28: 8 | H28: 12 | I28: =G28*6+H28 -> 60 | K28: 11 | L28: 9 | M28: =K28*6+L28 -> 75 | O28: 13 | P28: 15 | Q28: =O28*6+P28 -> 93 | S28: WERRIBEE
A29: WERRIBEE | C29: 0 | D29: 3 | E29: =C29*6+D29 -> 3 | G29: 5 | H29: 3 | I29: =G29*6+H29 -> 33 | K29: 8 | L29: 7 | M29: =K29*6+L29 -> 55 | O29: 13 | P29: 10 | Q29: =O29*6+P29 -> 88
A30: BEST PLAYERS
A31: SUNSHINE | C31: LAWRENCE | F31: HOWARD | I31: YOUNG | L31: DARUL | N31: CROSBIE | Q31: TREZISE
A32: WERRIBEE | C32: HOLCOMBE | F32: TRAINION | I32: PANTE | L32: GOULOPOLOUS | O32: BRYAN | Q32: KIMBER
A33: GOALKICKERS
A34: SUNSHINE | C34: PLAIN 4 | E34: LEGAWICZ 3 | H34: HOWARD 3 | J34: CROSBIE 2 | M34: KERRIS
A35: WERRIBEE | C35: EDWARDS 5 | F35: McGREGOR 3 | I35: TRAINION 2 | L35: LYONS | N35: ANDERSON | Q35: PANTE
A37: MORDIALLOC | C37: 3 | D37: 3 | E37: =C37*6+D37 -> 21 | G37: 8 | H37: 6 | I37: =G37*6+H37 -> 54 | K37: 9 | L37: 10 | M37: =K37*6+L37 -> 64 | O37: 13 | P37: 14 | Q37: =O37*6+P37 -> 92 | S37: FRANKSTON
A38: FRANKSTON | C38: 4 | D38: 2 | E38: =C38*6+D38 -> 26 | G38: 5 | H38: 3 | I38: =G38*6+H38 -> 33 | K38: 10 | L38: 7 | M38: =K38*6+L38 -> 67 | O38: 12 | P38: 10 | Q38: =O38*6+P38 -> 82
A39: BEST PLAYERS
A40: MORDIALLOC | C40: BRADBURY | F40: MARTELLO | I40: HYNES | L40: POWER | N40: BLAINEY | Q40: GROVES
A41: FRANKSTON | C41: CRUNDEN | F41: ALDERSON | I41: THATCHER | L41: McNAB | N41: ANGUS | Q41: HUGHES
A42: GOALKICKERS
A43: MORDIALLOC | C43: POWER 5 | F43: HYNES 2 | H43: LESLIE 2 | J43: BACKMAN | M43: MARTELLO | P43: GROVES | R43: COLLIS
A44: FRANKSTON | C44: CRUNDEN 5 | F44: HUGHES 3 | I44: McNABB 2 | L44: YATES 2
A46: PRAHRAN | C46: 2 | D46: 3 | E46: =C46*6+D46 -> 15 | G46: 8 | H46: 4 | I46: =G46*6+H46 -> 52 | K46: 12 | L46: 7 | M46: =K46*6+L46 -> 79 | O46: 14 | P46: 13 | Q46: =O46*6+P46 -> 97 | S46: TOORAK PARK
A47: CAULFIELD | C47: 2 | D47: 1 | E47: =C47*6+D47 -> 13 | G47: 2 | H47: 3 | I47: =G47*6+H47 -> 15 | K47: 4 | L47: 4 | M47: =K47*6+L47 -> 28 | O47: 7 | P47: 5 | Q47: =O47*6+P47 -> 47
A48: BEST PLAYERS
A49: PRAHRAN | C49: McMAHON | F49: VERWOERT | I49: WISHART | L49: MINTON-CONNELL | P49: BUTLER | R49: O'BRIEN
A50: CAULFIELD | C50: ROWE | F50: DE BONDE | I50: DUNN | L50: BAKER | P50: LOGAN | R50: MELBOURNE
A51: GOALKICKERS
A52: PRAHRAN | C52: RYAN 4 | E52: BUTLER 2 | G52: HOGAN 2 | I52: O'BRIEN 2 | K52: SEEDY | M52: VERWOERT | P52: SHEEDY | R52: McMAHON
A53: CAULFIELD | C53: J MOORE 2 | F53: SIMMONS 2 | I53: MELBOURNE | L53: LOGAN | N53: DUNN
A55: ROUND 2 | E55: 23RD APRIL | J55: WEATHER | N55: S.E.BREEZE DULL | S55: PLAYED AT
D56: 1ST QTR | H56: 2ND QTR | L56: 3RD QTR | P56: FINAL | S56: CAMBERWELL
A57: CAMBERWELL | C57: 0 | D57: 4 | E57: =C57*6+D57 -> 4 | G57: 2 | H57: 6 | I57: =G57*6+H57 -> 18 | K57: 9 | L57: 9 | M57: =K57*6+L57 -> 63 | O57: 14 | P57: 13 | Q57: =O57*6+P57 -> 97 | S57: UMPIRE | X57: LADDER | AB57: ROUND | AD57: 2
A58: FRANKSTON | C58: 1 | D58: 4 | E58: =C58*6+D58 -> 10 | G58: 6 | H58: 6 | I58: =G58*6+H58 -> 42 | K58: 8 | L58: 8 | M58: =K58*6+L58 -> 56 | O58: 14 | P58: 9 | Q58: =O58*6+P58 -> 93
A59: BEST PLAYERS | W59: TEAM | X59: W | Y59: L | Z59: D | AA59: FOR | AB59: AGST | AC59: % | AD59: PTS
A60: CAMBERWELL | C60: J SMITH | F60: PANZIC | I60: PECK | K60: O'NEILL | N60: WINKLEMAN | Q60: D BOYD
A61: FRANKSTON | C61: HUGHES | F61: CRUNDEN | I61: ALDERSON | L61: McNABB | N61: BOWES | Q61: HARLE | W61: NORTHCOTE | X61: 2 | Y61: 0 | Z61: 0 | AA61: 269 | AB61: 116 | AC61: =(AA61*100)/AB61 -> 231.89655172413794 | AD61: =(X61*4)+(Z61*2) -> 8
A62: GOALKICKERS | W62: BOX HILL | X62: 2 | Y62: 0 | Z62: 0 | AA62: 239 | AB62: 146 | AC62: =(AA62*100)/AB62 -> 163.69863013698631 | AD62: =(X62*4)+(Z62*2) -> 8
A63: CAMBERWELL | C63: O'NEILL 5 | E63: WINKLEMAN 3 | H63: W ADAMS 2 | K63: J SMITH | M63: MACKRELL | P63: McNAMARA | S63: D BOYD | W63: PRAHRAN | X63: 2 | Y63: 0 | Z63: 0 | AA63: 170 | AB63: 116 | AC63: =(AA63*100)/AB63 -> 146.55172413793105 | AD63: =(X63*4)+(Z63*2) -> 8
A64: FRANKSTON | C64: YATES 3 | E64: HUGHES 3 | H64: McNABB 3 | K64: THATCHER 2 | N64: CRUNDEN 2 | Q64: ALDERSON | W64: MORDIALLOC | X64: 2 | Y64: 0 | Z64: 0 | AA64: 165 | AB64: 134 | AC64: =(AA64*100)/AB64 -> 123.13432835820896 | AD64: =(X64*4)+(Z64*2) -> 8
A66: BOX HILL | C66: 3 | D66: 2 | E66: =C66*6+D66 -> 20 | G66: 8 | H66: 9 | I66: =G66*6+H66 -> 57 | K66: 13 | L66: 12 | M66: =K66*6+L66 -> 90 | O66: 18 | P66: 15 | Q66: =O66*6+P66 -> 123 | S66: PRINCES PARK, CAULFIELD | W66: SUNSHINE | X66: 1 | Y66: 1 | Z66: 0 | AA66: 162 | AB66: 161 | AC66: =(AA66*100)/AB66 -> 100.62111801242236 | AD66: =(X66*4)+(Z66*2) -> 4
A67: CAULFIELD | C67: 5 | D67: 2 | E67: =C67*6+D67 -> 32 | G67: 5 | H67: 5 | I67: =G67*6+H67 -> 35 | K67: 8 | L67: 8 | M67: =K67*6+L67 -> 56 | O67: 9 | P67: 14 | Q67: =O67*6+P67 -> 68 | W67: CAMBERWELL | X67: 1 | Y67: 1 | Z67: 0 | AA67: 175 | AB67: 209 | AC67: =(AA67*100)/AB67 -> 83.732057416267949 | AD67: =(X67*4)+(Z67*2) -> 4
A68: BEST PLAYERS | W68: FRANKSTON | X68: 0 | Y68: 2 | Z68: 0 | AA68: 175 | AB68: 189 | AC68: =(AA68*100)/AB68 -> 92.592592592592595 | AD68: =(X68*4)+(Z68*2) -> 0
A69: BOX HILL | C69: BRYANT | F69: MILLER | I69: I BATES | L69: WHITE | N69: McCURRY | Q69: LA ROCHE | W69: GEELONG WEST | X69: 0 | Y69: 2 | Z69: 0 | AA69: 125 | AB69: 194 | AC69: =(AA69*100)/AB69 -> 64.432989690721655 | AD69: =(X69*4)+(Z69*2) -> 0
A70: CAULFIELD | C70: GOWAN | F70: ROWE | I70: LOGAN | L70: MELBOURNE | O70: AUGHTERSON | R70: BAKER | W70: WERRIBEE | X70: 0 | Y70: 2 | Z70: 0 | AA70: 131 | AB70: 241 | AC70: =(AA70*100)/AB70 -> 54.356846473029044 | AD70: =(X70*4)+(Z70*2) -> 0
A71: GOALKICKERS | W71: CAULFIELD | X71: 0 | Y71: 2 | Z71: 0 | AA71: 115 | AB71: 220 | AC71: =(AA71*100)/AB71 -> 52.272727272727273 | AD71: =(X71*4)+(Z71*2) -> 0
A72: BOX HILL | C72: MILLER 4 | E72: BRYANT 4 | H72: I BATES 3 | J72: HUNT 2 | L72: PRITCHARD 2 | O72: GARDINER | R72: GRAY | S72: DAVIES
A73: CAULFIELD | C73: DUNN 2 | F73: SIMMONS 2 | I73: ROWE 2 | K73: MELBOURNE 2 | N73: BAKER
A75: NORTHCOTE | C75: 5 | D75: 2 | E75: =C75*6+D75 -> 32 | G75: 13 | H75: 5 | I75: =G75*6+H75 -> 83 | K75: 16 | L75: 10 | M75: =K75*6+L75 -> 106 | O75: 22 | P75: 16 | Q75: =O75*6+P75 -> 148 | S75: NORTHCOTE
A76: WERRIBEE | C76: 0 | D76: 4 | E76: =C76*6+D76 -> 4 | G76: 2 | H76: 5 | I76: =G76*6+H76 -> 17 | K76: 5 | L76: 10 | M76: =K76*6+L76 -> 40 | O76: 5 | P76: 13 | Q76: =O76*6+P76 -> 43
A77: BEST PLAYERS
A78: NORTHCOTE | C78: MICKLESON | F78: J OGILVIE | I78: CALVERLEY | L78: SALTER | N78: HENRY | Q78: CRAMERI
A79: WERRIBEE | C79: SMITH | F79: O'BRIEN | I79: BRYAN | L79: H OGILVIE | N79: HOLCOMBE
A80: GOALKICKERS
A81: NORTHCOTE | C81: MICKLESON 13 | F81: CRAMERI 2 | I81: GRYBAS 2 | L81: SOUTER | N81: GEMMELL | Q81: BEECHER | S81: G DEAN | V81: CALVERLEY
A82: WERRIBEE | C82: HOLCOMBE | F82: PANTE | I82: JAMMESON | L82: LYON | N82: EDWARDS
A84: PRAHRAN | C84: 3 | D84: 1 | E84: =C84*6+D84 -> 19 | G84: 3 | H84: 4 | I84: =G84*6+H84 -> 22 | K84: 7 | L84: 5 | M84: =K84*6+L84 -> 47 | O84: 11 | P84: 7 | Q84: =O84*6+P84 -> 73 | S84: SUNSHINE
A85: SUNSHINE | C85: 0 | D85: 2 | E85: =C85*6+D85 -> 2 | G85: 6 | H85: 4 | I85: =G85*6+H85 -> 40 | K85: 7 | L85: 8 | M85: =K85*6+L85 -> 50 | O85: 10 | P85: 9 | Q85: =O85*6+P85 -> 69
A86: BEST PLAYERS
A87: PRAHRAN | C87: GLOVER | F87: KIRBY | I87: RICHARDSON | L87: SYMONS | N87: VERWOERT | Q87: WISHART
A88: SUNSHINE | C88: LEGAWIRCZ | F88: SLATTERY | I88: GRAHAM | L88: OVERS | N88: HOWARD | Q88: CROSBIE
A89: GOALKICKERS
A90: PRAHRAN | C90: SYMONS 3 | F90: McMAHON 2 | I90: VERWOERT 2 | L90: COOPER | N90: MOONEY | P90: KERLEY | R90: RYAN
A91: SUNSHINE | C91: GRAHAM 3 | F91: KERRIS 2 | I91: LEGAWIECZ | L91: OVERS | N91: CROSBIE | Q91: HOWARD | S91: PLAIN
A93: MORDIALLOC | C93: 2 | D93: 1 | E93: =C93*6+D93 -> 13 | G93: 7 | H93: 6 | I93: =G93*6+H93 -> 48 | K93: 8 | L93: 8 | M93: =K93*6+L93 -> 56 | O93: 10 | P93: 13 | Q93: =O93*6+P93 -> 73 | S93: MORDIALLOC
A94: GEELONG WEST | C94: 3 | D94: 3 | E94: =C94*6+D94 -> 21 | G94: 4 | H94: 7 | I94: =G94*6+H94 -> 31 | K94: 5 | L94: 10 | M94: =K94*6+L94 -> 40 | O94: 7 | P94: 10 | Q94: =O94*6+P94 -> 52
A95: BEST PLAYERS
A96: MORDIALLOC | C96: BLAINEY | F96: BRADBURY | I96: MARTELLO | L96: DANCKERT | O96: LESLIE | Q96: HOBSON
A97: GEELONG WEST | C97: STACEY | F97: SNELL | I97: GROVES | L97: COLTISH | O97: RAEBURN | Q97: NUSTELING
A98: GOALKICKERS
A99: MORDIALLOC | C99: POWER 2 | F99: LESLIE 2 | I99: HYNES 2 | K99: MARTELLO 2 | N99: IRVINE | P99: MONCRIEFF
A100: GEELONG WEST | C100: STACEY 2 | F100: NUSTELING 2 | I100: NICHOLLS | L100: WINTER | N100: GROVES
A102: ROUND 3 | E102: 30TH APRIL | J102: WEATHER | N102: S.E.BREEZE DULL | S102: PLAYED AT
D103: 1ST QTR | H103: 2ND QTR | L103: 3RD QTR | P103: FINAL | S103: GEELONG WEST
A104: GEELONG WEST | C104: 4 | D104: 4 | E104: =C104*6+D104 -> 28 | G104: 12 | H104: 15 | I104: =G104*6+H104 -> 87 | K104: 19 | L104: 20 | M104: =K104*6+L104 -> 134 | O104: 27 | P104: 26 | Q104: =O104*6+P104 -> 188 | S104: UMPIRE | X104: LADDER | AB104: ROUND | AD104: 3
A105: CAMBERWELL | C105: 3 | D105: 2 | E105: =C105*6+D105 -> 20 | G105: 4 | H105: 2 | I105: =G105*6+H105 -> 26 | K105: 10 | L105: 5 | M105: =K105*6+L105 -> 65 | O105: 10 | P105: 8 | Q105: =O105*6+P105 -> 68
A106: BEST PLAYERS | W106: TEAM | X106: W | Y106: L | Z106: D | AA106: FOR | AB106: AGST | AC106: % | AD106: PTS
A107: GEELONG WEST | C107: NUSTELING | F107: EDWARDS | I107: BRUSHFIELD | L107: WILLIAMS | O107: VAN T'HAG | R107: BUSH
A108: CAMBERWELL | C108: GIBSON | F108: O'NEILL | I108: WINKLEMAN | L108: KISS | O108: PANZIC | W108: PRAHRAN | X108: 3 | Y108: 0 | Z108: 0 | AA108: 281 | AB108: 177 | AC108: =(AA108*100)/AB108 -> 158.75706214689265 | AD108: =(X108*4)+(Z108*2) -> 12
A109: GOALKICKERS | R109: WILLIAMS | W109: NORTHCOTE | X109: 2 | Y109: 1 | Z109: 0 | AA109: 344 | AB109: 247 | AC109: =(AA109*100)/AB109 -> 139.27125506072875 | AD109: =(X109*4)+(Z109*2) -> 8
A110: GEELONG WEST | C110: NUSTELING 10 | F110: GROVES 4 | H110: EDWARDS 3 | K110: STACEY 3 | N110: BUSH 2 | P110: VAN T'HAG 2 | S110: BRUSHFIELD 2 | W110: BOX HILL | X110: 2 | Y110: 1 | Z110: 0 | AA110: 300 | AB110: 257 | AC110: =(AA110*100)/AB110 -> 116.73151750972762 | AD110: =(X110*4)+(Z110*2) -> 8
A111: CAMBERWELL | C111: O'NEILL 5 | F111: J SMITH 2 | I111: D BOYD | K111: WINKLEMAN | N111: KISS | W111: MORDIALLOC | X111: 2 | Y111: 1 | Z111: 0 | AA111: 233 | AB111: 252 | AC111: =(AA111*100)/AB111 -> 92.460317460317455 | AD111: =(X111*4)+(Z111*2) -> 8
A113: FRANKSTON | C113: 6 | D113: 3 | E113: =C113*6+D113 -> 39 | G113: 8 | H113: 6 | I113: =G113*6+H113 -> 54 | K113: 10 | L113: 10 | M113: =K113*6+L113 -> 70 | O113: 13 | P113: 17 | Q113: =O113*6+P113 -> 95 | S113: FRANKSTON | W113: SUNSHINE | X113: 2 | Y113: 1 | Z113: 0 | AA113: 203 | AB113: 236 | AC113: =(AA113*100)/AB113 -> 86.016949152542367 | AD113: =(X113*4)+(Z113*2) -> 8
A114: CAULFIELD | C114: 0 | D114: 2 | E114: =C114*6+D114 -> 2 | G114: 2 | H114: 7 | I114: =G114*6+H114 -> 19 | K114: 7 | L114: 9 | M114: =K114*6+L114 -> 51 | O114: 8 | P114: 10 | Q114: =O114*6+P114 -> 58 | W114: GEELONG WEST | X114: 1 | Y114: 2 | Z114: 0 | AA114: 313 | AB114: 262 | AC114: =(AA114*100)/AB114 -> 119.46564885496183 | AD114: =(X114*4)+(Z114*2) -> 4
A115: BEST PLAYERS | W115: FRANKSTON | X115: 1 | Y115: 2 | Z115: 0 | AA115: 270 | AB115: 247 | AC115: =(AA115*100)/AB115 -> 109.31174089068826 | AD115: =(X115*4)+(Z115*2) -> 4
A116: FRANKSTON | C116: McNABB | F116: BOWES | I116: YATES | L116: LEWIS | O116: WHITE | Q116: HUGHES | W116: WERRIBEE | X116: 1 | Y116: 2 | Z116: 0 | AA116: 249 | AB116: 309 | AC116: =(AA116*100)/AB116 -> 80.582524271844662 | AD116: =(X116*4)+(Z116*2) -> 4
A117: CAULFIELD | C117: ROWE | F117: GOWAN | I117: DE BONDE | L117: LOGAN | O117: ARRELL | Q117: EVANS | W117: CAMBERWELL | X117: 1 | Y117: 2 | Z117: 0 | AA117: 243 | AB117: 397 | AC117: =(AA117*100)/AB117 -> 61.209068010075569 | AD117: =(X117*4)+(Z117*2) -> 4
A118: GOALKICKERS | W118: CAULFIELD | X118: 0 | Y118: 3 | Z118: 0 | AA118: 173 | AB118: 315 | AC118: =(AA118*100)/AB118 -> 54.920634920634917 | AD118: =(X118*4)+(Z118*2) -> 0
A119: FRANKSTON | C119: YATES 4 | F119: LEWIS 3 | I119: McNABB 2 | L119: CRUNDEN | N119: HUGHES | P119: WATSON | R119: ALDERSON
A120: CAULFIELD | C120: ROWE 2 | F120: LOGAN 2 | I120: ARRELL | K120: GOWAN | M120: DE BONDE | P120: BAKER
A122: PRAHRAN | C122: 4 | D122: 3 | E122: =C122*6+D122 -> 27 | G122: 8 | H122: 5 | I122: =G122*6+H122 -> 53 | K122: 14 | L122: 7 | M122: =K122*6+L122 -> 91 | O122: 17 | P122: 9 | Q122: =O122*6+P122 -> 111 | S122: BOX HILL
A123: BOX HILL | C123: 0 | D123: 0 | E123: =C123*6+D123 -> 0 | G123: 2 | H123: 3 | I123: =G123*6+H123 -> 15 | K123: 4 | L123: 5 | M123: =K123*6+L123 -> 29 | O123: 9 | P123: 7 | Q123: =O123*6+P123 -> 61
A124: BEST PLAYERS
A125: PRAHRAN | C125: RYAN | F125: COOPER | I125: BUTLER | L125: RICHARDSON | O125: BOWMAN | Q125: VERWOERT
A126: BOX HILL | C126: GRAY | F126: McCURRY | I126: WHITE | L126: I BATES | O126: LA ROCHE | Q126: C FELLOWS
A127: GOALKICKERS
A128: PRAHRAN | C128: RYAN 3 | E128: COOPER 3 | H128: BUTLER 3 | J128: SKIDMORE 2 | M128: SHEEDY 2 | O128: SYMONS | Q128: MOONEY | S128: VERWOERT | V128: RICHARDSON
A129: BOX HILL | C129: GRAY 4 | E129: HUNT 2 | H129: CARROLL 2 | K129: BRYANT
E130: 1ST MAY | I130: WEATHER
A131: SUNSHINE | C131: 4 | D131: 1 | E131: =C131*6+D131 -> 25 | G131: 9 | H131: 8 | I131: =G131*6+H131 -> 62 | K131: 13 | L131: 14 | M131: =K131*6+L131 -> 92 | O131: 19 | P131: 17 | Q131: =O131*6+P131 -> 131 | S131: NORTHCOTE
A132: NORTHCOTE | C132: 3 | D132: 3 | E132: =C132*6+D132 -> 21 | G132: 5 | H132: 7 | I132: =G132*6+H132 -> 37 | K132: 8 | L132: 7 | M132: =K132*6+L132 -> 55 | O132: 11 | P132: 9 | Q132: =O132*6+P132 -> 75
A133: BEST PLAYERS
A134: SUNSHINE | C134: LEGAWICZ | F134: TREZISE | I134: SLATTERY | L134: GREGORY | O134: THORNTON | R134: OVERS
A135: NORTHCOTE | C135: SLEEP | F135: CALVERLEY | I135: PITTS | L135: MICKLESON | O135: KEAYS | R135: G DEAN
A136: GOALKICKERS
A137: SUNSHINE | C137: W HARRIS 5 | F137: CROSBIE 3 | I137: OVERS 2 | K137: LEGAWICZ 2 | N137: KERRIS 2 | P137: GREGORY 2 | R137: TREZISE | T137: HOWARD | W137: YOUNG
A138: NORTHCOTE | C138: MICKLESON 4 | F138: CALVERLEY 3 | I138: QUAIFE 2 | K138: SLEEP | M138: MAYNE
A140: WERRIBEE | C140: 4 | D140: 4 | E140: =C140*6+D140 -> 28 | G140: 10 | H140: 5 | I140: =G140*6+H140 -> 65 | K140: 12 | L140: 7 | M140: =K140*6+L140 -> 79 | O140: 18 | P140: 10 | Q140: =O140*6+P140 -> 118 | S140: WERRIBEE
A141: MORDIALLOC | C141: 6 | D141: 2 | E141: =C141*6+D141 -> 38 | G141: 7 | H141: 6 | I141: =G141*6+H141 -> 48 | K141: 9 | L141: 8 | M141: =K141*6+L141 -> 62 | O141: 10 | P141: 8 | Q141: =O141*6+P141 -> 68
A142: BEST PLAYERS
A143: WERRIBEE | C143: OGILVIE | F143: TURNER | I143: EDWARDS | L143: SMITH | O143: BRYAN | Q143: GOULOPOLOUS
A144: MORDIALLOC | C144: BRADBURY | F144: BACKMAN | I144: WORRELL | L144: DANCKERT | O144: GROVES
A145: GOALKICKERS
A146: WERRIBEE | C146: EDWARDS 7 | F146: SMITH 4 | H146: HOLCOMBE 2 | K146: BRYAN | M146: PANTE | O146: TRAINION | R146: PETTIFORD | U146: ANDERSON
A147: MORDIALLOC | C147: POWER 5 | F147: BAKMAN 3 | I147: MONCRIEFF 2
A149: ROUND 4 | E149: 7TH MAY | J149: WEATHER | N149: S.E.BREEZE DULL | S149: PLAYED AT
D150: 1ST QTR | H150: 2ND QTR | L150: 3RD QTR | P150: FINAL | S150: PRINCES PARK, CAULFIELD
A151: CAULFIELD | C151: 3 | D151: 4 | E151: =C151*6+D151 -> 22 | G151: 5 | H151: 5 | I151: =G151*6+H151 -> 35 | K151: 11 | L151: 15 | M151: =K151*6+L151 -> 81 | O151: 13 | P151: 16 | Q151: =O151*6+P151 -> 94 | S151: UMPIRE | X151: LADDER | AB151: ROUND | AD151: 4
A152: GEELONG WEST | C152: 2 | D152: 2 | E152: =C152*6+D152 -> 14 | G152: 7 | H152: 8 | I152: =G152*6+H152 -> 50 | K152: 7 | L152: 9 | M152: =K152*6+L152 -> 51 | O152: 12 | P152: 15 | Q152: =O152*6+P152 -> 87
A153: BEST PLAYERS | W153: TEAM | X153: W | Y153: L | Z153: D | AA153: FOR | AB153: AGST | AC153: % | AD153: PTS
A154: CAULFIELD | C154: GOWAN | F154: DE BONDE | I154: AUGHTERSON | M154: ? | O154: ROWE | Q154: LOGAN
A155: GEELONG WEST | D155: ? | F155: VAN T'HAG | I155: BRUSHFIELD | L155: NUSTELING | O155: WILLIAMS | W155: PRAHRAN | X155: 4 | Y155: 0 | Z155: 0 | AA155: 357 | AB155: 243 | AC155: =(AA155*100)/AB155 -> 146.91358024691357 | AD155: =(X155*4)+(Z155*2) -> 16
A156: GOALKICKERS | W156: SUNSHINE | X156: 3 | Y156: 1 | Z156: 0 | AA156: 328 | AB156: 321 | AC156: =(AA156*100)/AB156 -> 102.18068535825545 | AD156: =(X156*4)+(Z156*2) -> 12
A157: CAULFIELD | C157: GOWAN 3 | F157: LOGAN 3 | I157: ARRELL 2 | K157: FOX 2 | M157: BAKER | O157: STONE | Q157: ROWE | W157: MORDIALLOC | X157: 3 | Y157: 1 | Z157: 0 | AA157: 317 | AB157: 320 | AC157: =(AA157*100)/AB157 -> 99.0625 | AD157: =(X157*4)+(Z157*2) -> 12
A158: GEELONG WEST | C158: NUSTELING 4 | F158: BRUSHFIELD 2 | I158: WINTER 2 | K158: HEDLEY | M158: BUSH | O158: WILLIAMS | R158: EDWARDS | W158: NORTHCOTE | X158: 2 | Y158: 2 | Z158: 0 | AA158: 412 | AB158: 331 | AC158: =(AA158*100)/AB158 -> 124.47129909365559 | AD158: =(X158*4)+(Z158*2) -> 8
A160: CAMBERWELL | C160: 7 | D160: 5 | E160: =C160*6+D160 -> 47 | G160: 8 | H160: 5 | I160: =G160*6+H160 -> 53 | K160: 12 | L160: 7 | M160: =K160*6+L160 -> 79 | O160: 16 | P160: 8 | Q160: =O160*6+P160 -> 104 | S160: CAMBERWELL | W160: BOX HILL | X160: 2 | Y160: 2 | Z160: 0 | AA160: 385 | AB160: 382 | AC160: =(AA160*100)/AB160 -> 100.78534031413612 | AD160: =(X160*4)+(Z160*2) -> 8
A161: WERRIBEE | C161: 3 | D161: 2 | E161: =C161*6+D161 -> 20 | G161: 5 | H161: 16 | I161: =G161*6+H161 -> 46 | K161: 8 | L161: 19 | M161: =K161*6+L161 -> 67 | O161: 10 | P161: 21 | Q161: =O161*6+P161 -> 81 | W161: CAMBERWELL | X161: 2 | Y161: 2 | Z161: 0 | AA161: 347 | AB161: 478 | AC161: =(AA161*100)/AB161 -> 72.594142259414227 | AD161: =(X161*4)+(Z161*2) -> 8
A162: BEST PLAYERS | W162: GEELONG WEST | X162: 1 | Y162: 3 | Z162: 0 | AA162: 400 | AB162: 356 | AC162: =(AA162*100)/AB162 -> 112.35955056179775 | AD162: =(X162*4)+(Z162*2) -> 4
A163: CAMBERWELL | C163: O'NEILL | F163: WINKLEMAN | I163: ELLIOTT | L163: ? | O163: ? | Q163: GIBSON | W163: FRANKSTON | X163: 1 | Y163: 3 | Z163: 0 | AA163: 336 | AB163: 323 | AC163: =(AA163*100)/AB163 -> 104.02476780185758 | AD163: =(X163*4)+(Z163*2) -> 4
A164: WERRIBEE | C164: ? | F164: TRAINION | I164: SMITH | L164: ANDERSON | O164: ? | Q164: PETTIFORD | W164: WERRIBEE | X164: 1 | Y164: 3 | Z164: 0 | AA164: 330 | AB164: 413 | AC164: =(AA164*100)/AB164 -> 79.903147699757866 | AD164: =(X164*4)+(Z164*2) -> 4
A165: GOALKICKERS | W165: CAULFIELD | X165: 1 | Y165: 3 | Z165: 0 | AA165: 267 | AB165: 402 | AC165: =(AA165*100)/AB165 -> 66.417910447761187 | AD165: =(X165*4)+(Z165*2) -> 4
A166: CAMBERWELL | C166: O'NEILL 9 | F166: WINKLEMAN 2 | I166: ? 2 | L166: J SMITH | N166: COCKREM | Q166: ?1
A167: WERRIBEE | C167: SMITH 3 | F167: ANDERSON 3 | I167: PETTIFORD 2 | L167: TRAINION 2
A169: SUSNSHINE | C169: 4 | D169: 1 | E169: =C169*6+D169 -> 25 | G169: 8 | H169: 3 | I169: =G169*6+H169 -> 51 | K169: 11 | L169: 8 | M169: =K169*6+L169 -> 74 | O169: 19 | P169: 11 | Q169: =O169*6+P169 -> 125 | S169: SUNSHINE
A170: BOX HILL | C170: 4 | D170: 4 | E170: =C170*6+D170 -> 28 | G170: 6 | H170: 6 | I170: =G170*6+H170 -> 42 | K170: 8 | L170: 7 | M170: =K170*6+L170 -> 55 | O170: 13 | P170: 7 | Q170: =O170*6+P170 -> 85
A171: BEST PLAYERS
A172: SUSNSHINE | C172: HOWARD | F172: TREZISE | I172: SLATTERY | L172: CROSBIE | O172: ROACH | R172: YOUNG
A173: BOX HILL | C173: HUNT | F173: MACE | I173: BRYANT | L173: SMITH | O173: LEHMAN | R173: McCURRY
A174: GOALKICKERS
A175: SUSNSHINE | C175: W HARRIS 4 | F175: HOWARD 4 | I175: GREGORY 3 | L175: GRAHAM 2 | N175: CROSBIE 2 | Q175: TREZISE | S175: YOUNG | U175: SMITH | W175: KERRIS
A176: BOX HILL | C176: ? 3 | F176: BRYANT 3 | I176: GARDINER 2 | L176: HUNT 2 | N176: MILLER | P176: CARROLL | R176: LA ROCHE
E177: 8TH MAY | I177: WEATHER
A178: PRAHRAN | C178: 3 | D178: 1 | E178: =C178*6+D178 -> 19 | G178: 8 | H178: 5 | I178: =G178*6+H178 -> 53 | K178: 10 | L178: 6 | M178: =K178*6+L178 -> 66 | O178: 11 | P178: 10 | Q178: =O178*6+P178 -> 76 | S178: TOORAK PARK
A179: FRANKSTON | C179: 5 | D179: 1 | E179: =C179*6+D179 -> 31 | G179: 7 | H179: 1 | I179: =G179*6+H179 -> 43 | K179: 10 | L179: 4 | M179: =K179*6+L179 -> 64 | O179: 10 | P179: 6 | Q179: =O179*6+P179 -> 66
A180: BEST PLAYERS
A181: PRAHRAN | C181: RICHARDSON | F181: GEISLER | I181: KIRBY | K181: ? | O181: SYMONS | R181: SHEEDY
A182: FRANKSTON | D182: ? | F182: ? | I182: ? | K182: SLADE | O182: ? | R182: BOWEN
A183: GOALKICKERS
A184: PRAHRAN | C184: SYMONS 3 | F184: RYAN 2 | H184: MOONEY 2 | K184: ? 1 | M184: SHEEDY | O184: COOPER | Q184: VERWOERT
A185: FRANKSTON | C185: BOWEN 4 | F185: l ? 2 | I185: McNABB | K185: CRUNDEN | M185: THATCHER | P185: ? 1
A187: MORDIALLOC | C187: 0 | D187: 0 | E187: =C187*6+D187 -> 0 | G187: 4 | H187: 7 | I187: =G187*6+H187 -> 31 | K187: 6 | L187: 11 | M187: =K187*6+L187 -> 47 | O187: 11 | P187: 18 | Q187: =O187*6+P187 -> 84 | S187: MORDIALLOC
A188: NORTHCOTE | C188: 3 | D188: 7 | E188: =C188*6+D188 -> 25 | G188: 6 | H188: 10 | I188: =G188*6+H188 -> 46 | K188: 7 | L188: 11 | M188: =K188*6+L188 -> 53 | O188: 9 | P188: 14 | Q188: =O188*6+P188 -> 68
A189: BEST PLAYERS
A190: MORDIALLOC | C190: BACKMAN | F190: BRADBURY | I190: ? | L190: ? | N190: LESLIE | Q190: DANCKERT
A191: NORTHCOTE | C191: CRAMERI | F191: MICKLESON | I191: LACHMUND | L191: SLEEP | N191: GRYBAS | Q191: PITTS
A192: GOALKICKERS
A193: MORDIALLOC | C193: BACKMAN 4 | F193: POWER 3 | H193: ? 2 | J193: ? 1 | L193: HYNES
A194: NORTHCOTE | C194: GRYBAS 3 | F194: LACHMUND 2 | I194: MICKLESON 2 | L194: CALVERLEY | O194: QUAIFE | R194: ? 1
A196: ROUND 5 | E196: 14TH MAY | J196: WEATHER | N196: S.E.BREEZE DULL | S196: PLAYED AT
D197: 1ST QTR | H197: 2ND QTR | L197: 3RD QTR | P197: FINAL | S197: FRANKSTON
A198: FRANKSTON | C198: 1 | D198: 6 | E198: =C198*6+D198 -> 12 | G198: 8 | H198: 11 | I198: =G198*6+H198 -> 59 | K198: 9 | L198: 11 | M198: =K198*6+L198 -> 65 | O198: 13 | P198: 17 | Q198: =O198*6+P198 -> 95 | S198: UMPIRE | X198: LADDER | AB198: ROUND | AD198: 5
A199: BOX HILL | C199: 5 | D199: 5 | E199: =C199*6+D199 -> 35 | G199: 7 | H199: 8 | I199: =G199*6+H199 -> 50 | K199: 12 | L199: 12 | M199: =K199*6+L199 -> 84 | O199: 13 | P199: 13 | Q199: =O199*6+P199 -> 91
A200: BEST PLAYERS | W200: TEAM | X200: W | Y200: L | Z200: D | AA200: FOR | AB200: AGST | AC200: % | AD200: PTS
A201: FRANKSTON | C201: WHITE | F201: HUGHES | I201: BOWEN | L201: ANGUS | O201: McNABB | R201: SLADE
A202: BOX HILL | C202: GARDINER | F202: MILLER | I202: BRYANT | L202: CARROLL | O202: HUNT | R202: C FELLOWS | W202: PRAHRAN | X202: 4 | Y202: 1 | Z202: 0 | AA202: 422 | AB202: 312 | AC202: =(AA202*100)/AB202 -> 135.25641025641025 | AD202: =(X202*4)+(Z202*2) -> 16
A203: GOALKICKERS | W203: SUNSHINE | X203: 4 | Y203: 1 | Z203: 0 | AA203: 410 | AB203: 373 | AC203: =(AA203*100)/AB203 -> 109.9195710455764 | AD203: =(X203*4)+(Z203*2) -> 16
A204: FRANKSTON | C204: CRUNDEN 3 | F204: HUGHES 3 | H204: PAYNE 2 | J204: ANDERSON | L204: THATCHER | O204: BOWEN | Q204: WATSON | S204: McHUGH | W204: NORTHCOTE | X204: 3 | Y204: 2 | Z204: 0 | AA204: 506 | AB204: 422 | AC204: =(AA204*100)/AB204 -> 119.90521327014218 | AD204: =(X204*4)+(Z204*2) -> 12
A205: BOX HILL | C205: CARROLL 6 | F205: HUNT 2 | I205: MILLER | K205: O'NEILL | M205: LA ROCHE | P205: BRYANT | R205: GARDINER | W205: MORDIALLOC | X205: 3 | Y205: 2 | Z205: 0 | AA205: 369 | AB205: 402 | AC205: =(AA205*100)/AB205 -> 91.791044776119406 | AD205: =(X205*4)+(Z205*2) -> 12
A207: CAULFIELD | C207: 5 | D207: 1 | E207: =C207*6+D207 -> 31 | G207: 12 | H207: 7 | I207: =G207*6+H207 -> 79 | K207: 12 | L207: 9 | M207: =K207*6+L207 -> 81 | O207: 13 | P207: 16 | Q207: =O207*6+P207 -> 94 | S207: WERRIBEE | W207: GEELONG WEST | X207: 2 | Y207: 3 | Z207: 0 | AA207: 469 | AB207: 421 | AC207: =(AA207*100)/AB207 -> 111.40142517814726 | AD207: =(X207*4)+(Z207*2) -> 8
A208: WERRIBEE | C208: 3 | D208: 2 | E208: =C208*6+D208 -> 20 | G208: 7 | H208: 6 | I208: =G208*6+H208 -> 48 | K208: 10 | L208: 12 | M208: =K208*6+L208 -> 72 | O208: 13 | P208: 14 | Q208: =O208*6+P208 -> 92 | W208: FRANKSTON | X208: 2 | Y208: 3 | Z208: 0 | AA208: 431 | AB208: 414 | AC208: =(AA208*100)/AB208 -> 104.10628019323671 | AD208: =(X208*4)+(Z208*2) -> 8
A209: BEST PLAYERS | W209: BOX HILL | X209: 2 | Y209: 3 | Z209: 0 | AA209: 476 | AB209: 477 | AC209: =(AA209*100)/AB209 -> 99.790356394129972 | AD209: =(X209*4)+(Z209*2) -> 8
A210: CAULFIELD | C210: ROWE | F210: EVANS | I210: FARY | L210: STONE | O210: GOWAN | R210: DE BONDE | W210: CAMBERWELL | X210: 2 | Y210: 3 | Z210: 0 | AA210: 438 | AB210: 572 | AC210: =(AA210*100)/AB210 -> 76.573426573426573 | AD210: =(X210*4)+(Z210*2) -> 8
A211: WERRIBEE | C211: HOLCOMBE | F211: LYONS | I211: L ALLISON | L211: ANDERSON | O211: TURNER | R211: B SMITH | W211: CAULFIELD | X211: 2 | Y211: 3 | Z211: 0 | AA211: 361 | AB211: 494 | AC211: =(AA211*100)/AB211 -> 73.07692307692308 | AD211: =(X211*4)+(Z211*2) -> 8
A212: GOALKICKERS | W212: WERRIBEE | X212: 1 | Y212: 4 | Z212: 0 | AA212: 424 | AB212: 505 | AC212: =(AA212*100)/AB212 -> 83.960396039603964 | AD212: =(X212*4)+(Z212*2) -> 4
A213: CAULFIELD | C213: FARY 5 | E213: GOWAN 3 | H213: ROWE 2 | J213: DUNN | L213: DOUGLAS | O213: STONE
A214: WERRIBEE | C214: LYONS 4 | E214: PANTE 2 | G214: B SMITH 2 | J214: ANDERSON | M214: OGILVIE | O214: JAMMESON | R214: HOLCOMBE | U214: TRAINION
E215: 15TH MAY | J215: WEATHER
A216: NORTHCOTE | C216: 3 | D216: 1 | E216: =C216*6+D216 -> 19 | G216: 8 | H216: 5 | I216: =G216*6+H216 -> 53 | K216: 11 | L216: 8 | M216: =K216*6+L216 -> 74 | O216: 13 | P216: 16 | Q216: =O216*6+P216 -> 94 | S216: NORTHCOTE
A217: CAMBERWELL | C217: 2 | D217: 1 | E217: =C217*6+D217 -> 13 | G217: 5 | H217: 6 | I217: =G217*6+H217 -> 36 | K217: 10 | L217: 12 | M217: =K217*6+L217 -> 72 | O217: 13 | P217: 13 | Q217: =O217*6+P217 -> 91
A218: BEST PLAYERS
A219: NORTHCOTE | C219: CRAMERI | F219: LACHMUND | I219: MICKLESON | L219: SLEEP | O219: CALVERLEY | R219: DOWLING
A220: CAMBERWELL | C220: WINKLEMAN | F220: O'NEILL | I220: JAMES | L220: PANZIC | O220: KISS | R220: ANDERSON
A221: GOALKICKERS
A222: NORTHCOTE | C222: LACHMUND 5 | F222: QUAIFE 3 | I222: CALVERLEY 2 | L222: SLEEP | N222: G DEAN | P222: BRADY
A223: CAMBERWELL | C223: WINKLEMAN 6 | G223: O'NEILL 5 | J223: ELLIOTT | M223: D BOYD
A225: SUNSHINE | C225: 2 | D225: 4 | E225: =C225*6+D225 -> 16 | G225: 5 | H225: 8 | I225: =G225*6+H225 -> 38 | K225: 9 | L225: 13 | M225: =K225*6+L225 -> 67 | O225: 11 | P225: 16 | Q225: =O225*6+P225 -> 82 | S225: SUNSHINE
A226: MORDIALLOC | C226: 0 | D226: 2 | E226: =C226*6+D226 -> 2 | G226: 3 | H226: 8 | I226: =G226*6+H226 -> 26 | K226: 4 | L226: 9 | M226: =K226*6+L226 -> 33 | O226: 7 | P226: 10 | Q226: =O226*6+P226 -> 52
A227: BEST PLAYERS
A228: SUNSHINE | C228: HOWARD | F228: TREZISE | I228: CROSBIE | L228: DARUL | O228: THORNTON | R228: GRAHAM
A229: MORDIALLOC | C229: WILLIAMS | F229: BACKMAN | I229: COWLING | L229: HYNES | O229: BRADBURY | R229: HEESON
A230: GOALKICKERS
A231: SUNSHINE | C231: W HARRIS 4 | F231: HOWARD 2 | I231: SMITH | K231: GRAHAM | M231: CROSBIE | O231: KERRIS | Q231: LEGAWIECZ
A232: MORDIALLOC | C232: POWER 2 | F232: BACKMAN 2 | I232: BAXTER | K232: LESLIE | M232: STUDHAM
A234: GEELONG WEST | C234: 0 | D234: 6 | E234: =C234*6+D234 -> 6 | G234: 7 | H234: 8 | I234: =G234*6+H234 -> 50 | K234: 8 | L234: 12 | M234: =K234*6+L234 -> 60 | O234: 9 | P234: 15 | Q234: =O234*6+P234 -> 69 | S234: GEELONG WEST
A235: PRAHRAN | C235: 2 | D235: 1 | E235: =C235*6+D235 -> 13 | G235: 3 | H235: 1 | I235: =G235*6+H235 -> 19 | K235: 8 | L235: 2 | M235: =K235*6+L235 -> 50 | O235: 10 | P235: 5 | Q235: =O235*6+P235 -> 65
A236: BEST PLAYERS
A237: GEELONG WEST | C237: WILLIAMS | F237: SNELL | I237: HOVEY | L237: SYMES | O237: EDWARDS | R237: SOUTHERN
A238: PRAHRAN | C238: RYAN | F238: KIRBY | I238: GLOVER | L238: CRIPPS | O238: SKIDMORE | R238: MINTON-CONNELL
A239: GOALKICKERS
A240: GEELONG WEST | C240: HOVEY 3 | F240: GROVES 3 | I240: NUSTELING 2 | L240: BRUSHFIELD
A241: PRAHRAN | C241: RYAN 6 | F241: VERWOERT 2 | I241: GLOVER | L241: ANDREW
A243: ROUND 6 | E243: 21ST MAY | J243: WEATHER | N243: S.E.BREEZE DULL | S243: PLAYED AT
D244: 1ST QTR | H244: 2ND QTR | L244: 3RD QTR | P244: FINAL | S244: CAMBERWELL
A245: CAMBERWELL | C245: 8 | D245: 4 | E245: =C245*6+D245 -> 52 | G245: 10 | H245: 4 | I245: =G245*6+H245 -> 64 | K245: 12 | L245: 6 | M245: =K245*6+L245 -> 78 | O245: 16 | P245: 7 | Q245: =O245*6+P245 -> 103 | S245: UMPIRE | X245: LADDER | AB245: ROUND | AD245: 6
A246: MORDIALLOC | C246: 1 | D246: 3 | E246: =C246*6+D246 -> 9 | G246: 5 | H246: 5 | I246: =G246*6+H246 -> 35 | K246: 10 | L246: 8 | M246: =K246*6+L246 -> 68 | O246: 13 | P246: 13 | Q246: =O246*6+P246 -> 91
A247: BEST PLAYERS | W247: TEAM | X247: W | Y247: L | Z247: D | AA247: FOR | AB247: AGST | AC247: % | AD247: PTS
A248: CAMBERWELL | C248: J SMITH | F248: O'NEILL | I248: WINKLEMAN | L248: ELLIOTT | O248: ANDERSON | R248: GIBSON
A249: MORDIALLOC | C249: POWER | F249: HYNES | I249: GRAY | L249: BACKMAN | O249: BAXTER | R249: CULPH | W249: PRAHRAN | X249: 5 | Y249: 1 | Z249: 0 | AA249: 500 | AB249: 385 | AC249: =(AA249*100)/AB249 -> 129.87012987012986 | AD249: =(X249*4)+(Z249*2) -> 20
A250: GOALKICKERS | W250: NORTHCOTE | X250: 4 | Y250: 2 | Z250: 0 | AA250: 598 | AB250: 497 | AC250: =(AA250*100)/AB250 -> 120.32193158953723 | AD250: =(X250*4)+(Z250*2) -> 16
A251: CAMBERWELL | C251: O'NEILL 6 | F251: WINKLEMAN 3 | I251: ELLIOTT 2 | L251: McNAMARA 2 | O251: J SMITH | Q251: OSBORNE | S251: FILLIPONE | W251: SUNSHINE | X251: 4 | Y251: 2 | Z251: 0 | AA251: 461 | AB251: 475 | AC251: =(AA251*100)/AB251 -> 97.05263157894737 | AD251: =(X251*4)+(Z251*2) -> 16
A252: MORDIALLOC | C252: POWER 7 | F252: HYNES 3 | I252: STUDHAM 2 | L252: BAXTER | W252: FRANKSTON | X252: 3 | Y252: 3 | Z252: 0 | AA252: 533 | AB252: 465 | AC252: =(AA252*100)/AB252 -> 114.6236559139785 | AD252: =(X252*4)+(Z252*2) -> 12
A254: FRANKSTON | C254: 5 | D254: 3 | E254: =C254*6+D254 -> 33 | G254: 8 | H254: 7 | I254: =G254*6+H254 -> 55 | K254: 13 | L254: 8 | M254: =K254*6+L254 -> 86 | O254: 15 | P254: 12 | Q254: =O254*6+P254 -> 102 | S254: FRANKSTON | W254: MORDIALLOC | X254: 3 | Y254: 3 | Z254: 0 | AA254: 460 | AB254: 505 | AC254: =(AA254*100)/AB254 -> 91.089108910891085 | AD254: =(X254*4)+(Z254*2) -> 12
A255: SUNSHINE | C255: 1 | D255: 2 | E255: =C255*6+D255 -> 8 | G255: 3 | H255: 6 | I255: =G255*6+H255 -> 24 | K255: 5 | L255: 8 | M255: =K255*6+L255 -> 38 | O255: 7 | P255: 9 | Q255: =O255*6+P255 -> 51 | W255: CAMBERWELL | X255: 3 | Y255: 3 | Z255: 0 | AA255: 541 | AB255: 663 | AC255: =(AA255*100)/AB255 -> 81.59879336349924 | AD255: =(X255*4)+(Z255*2) -> 12
A256: BEST PLAYERS | W256: GEELONG WEST | X256: 2 | Y256: 3 | Z256: 1 | AA256: 537 | AB256: 489 | AC256: =(AA256*100)/AB256 -> 109.8159509202454 | AD256: =(X256*4)+(Z256*2) -> 10
A257: FRANKSTON | C257: WHITE | F257: SLADE | I257: CRUNDEN | L257: PAYNE | O257: THATCHER | R257: ANGUS | W257: BOX HILL | X257: 2 | Y257: 3 | Z257: 1 | AA257: 544 | AB257: 545 | AC257: =(AA257*100)/AB257 -> 99.816513761467888 | AD257: =(X257*4)+(Z257*2) -> 10
A258: SUNSHINE | C258: HARRIS | F258: ROACH | I258: KERRIS | L258: YOUNG | O258: OVERS | R258: HOWARD | W258: CAULFIELD | X258: 2 | Y258: 4 | Z258: 0 | AA258: 436 | AB258: 586 | AC258: =(AA258*100)/AB258 -> 74.402730375426614 | AD258: =(X258*4)+(Z258*2) -> 8
A259: GOALKICKERS | W259: WERRIBEE | X259: 1 | Y259: 5 | Z259: 0 | AA259: 497 | AB259: 583 | AC259: =(AA259*100)/AB259 -> 85.248713550600343 | AD259: =(X259*4)+(Z259*2) -> 4
A260: FRANKSTON | C260: PAYNE 4 | E260: CRUNDEN 4 | H260: McHUGH 2 | J260: McNABB | L260: ANDERSON | N260: BOWEN | P260: HUGHES | R260: WATSON
A261: SUNSHINE | C261: W HARRIS 5 | F261: CROSBIE | I261: OVERS
A263: BOX HILL | C263: 1 | D263: 1 | E263: =C263*6+D263 -> 7 | G263: 5 | H263: 7 | I263: =G263*6+H263 -> 37 | K263: 8 | L263: 12 | M263: =K263*6+L263 -> 60 | O263: 9 | P263: 14 | Q263: =O263*6+P263 -> 68 | S263: BOX HILL
A264: GEELONG WEST | C264: 4 | D264: 2 | E264: =C264*6+D264 -> 26 | G264: 8 | H264: 8 | I264: =G264*6+H264 -> 56 | K264: 9 | L264: 11 | M264: =K264*6+L264 -> 65 | O264: 9 | P264: 14 | Q264: =O264*6+P264 -> 68
A265: BEST PLAYERS
A266: BOX HILL | C266: I BATES | F266: BAKER | I266: G FELLOWS | L266: GRAY | O266: O'NEILL | R266: HUNT
A267: GEELONG WEST | C267: NICHOLLS | F267: BRUSHFIELD | I267: HOVEY | L267: VAN T'HAG | O267: STACEY | R267: NUSTELING
A268: GOALKICKERS
A269: BOX HILL | C269: I BATES 2 | F269: LA ROCHE 2 | I269: HUNT 2 | K269: CARROLL 2 | N269: GARDINER
A270: GEELONG WEST | C270: NUSTELING 2 | F270: BRUSHFIELD 2 | I270: STACEY 2 | K270: EDWARDS | N270: NICHOLLS | P270: VAN T'HAG
A272: NORTHCOTE | C272: 2 | D272: 3 | E272: =C272*6+D272 -> 15 | G272: 8 | H272: 4 | I272: =G272*6+H272 -> 52 | K272: 10 | L272: 5 | M272: =K272*6+L272 -> 65 | O272: 14 | P272: 8 | Q272: =O272*6+P272 -> 92 | S272: PRINCES PARK, CAULFIELD
A273: CAULFIELD | C273: 3 | D273: 6 | E273: =C273*6+D273 -> 24 | G273: 6 | H273: 11 | I273: =G273*6+H273 -> 47 | K273: 8 | L273: 19 | M273: =K273*6+L273 -> 67 | O273: 9 | P273: 21 | Q273: =O273*6+P273 -> 75
A274: BEST PLAYERS
A275: NORTHCOTE | C275: CRAMERI | F275: SLEEP | I275: MICKLESON | L275: KEAYS | O275: BUSH | R275: McBREEN
A276: CAULFIELD | C276: ROWE | F276: EVANS | I276: DE BONDE | L276: AUGHTERSON | O276: DOUGLAS | R276: LOGAN
A277: GOALKICKERS
A278: NORTHCOTE | C278: CALVERLEY 4 | F278: MICKLESON 3 | I278: BRADY | K278: GRYBAS | M278: SLEEP | O278: G DEAN | Q278: QUAIFE | S278: LACHMUND | V278: SIMPSON
A279: CAULFIELD | C279: FARY 3 | E279: LOGAN 2 | G279: ARRELL | I279: GOWAN | K279: ROWE | M279: GASPARI
E280: 22ND MAY | I280: WEATHER
A281: PRAHRAN | C281: 1 | D281: 4 | E281: =C281*6+D281 -> 10 | G281: 5 | H281: 8 | I281: =G281*6+H281 -> 38 | K281: 8 | L281: 10 | M281: =K281*6+L281 -> 58 | O281: 10 | P281: 18 | Q281: =O281*6+P281 -> 78 | S281: TOORAK PARK
A282: WERRIBEE | C282: 3 | D282: 1 | E282: =C282*6+D282 -> 19 | G282: 5 | H282: 1 | I282: =G282*6+H282 -> 31 | K282: 11 | L282: 1 | M282: =K282*6+L282 -> 67 | O282: 12 | P282: 1 | Q282: =O282*6+P282 -> 73
A283: BEST PLAYERS
A284: PRAHRAN | C284: MINTON-CONNELL | F284: SHEEDY | I284: RYAN | L284: SEEDY | O284: MOONEY | R284: VERWOERT
A285: WERRIBEE | C285: HOLCPMBE | F285: JAMMESON | I285: LYONS | L285: B SMITH | O285: D SMITH
A286: GOALKICKERS
A287: PRAHRAN | C287: RYAN 3 | E287: SHEEDY 2 | H287: SKIDMORE | K287: YOUNG | M287: VERWOERT | P287: SEEDY | R287: HARTNETT
A288: WERRIBEE | C288: D SMITH 3 | F288: B SMITH 2 | I288: JAMMESON 2 | L288: OGILVIE 2 | O288: LYONS 2 | Q288: TURNER
A290: ROUND 7 | E290: 28TH MAY | J290: WEATHER | S290: PLAYED AT
D291: 1ST QTR | H291: 2ND QTR | L291: 3RD QTR | P291: FINAL | S291: MORDIALLOC
A292: MORDIALLOC | C292: 5 | D292: 4 | E292: =C292*6+D292 -> 34 | G292: 9 | H292: 8 | I292: =G292*6+H292 -> 62 | K292: 13 | L292: 10 | M292: =K292*6+L292 -> 88 | O292: 23 | P292: 13 | Q292: =O292*6+P292 -> 151 | S292: UMPIRE | X292: LADDER | AB292: ROUND | AD292: 7
A293: CAULFIELD | C293: 1 | D293: 3 | E293: =C293*6+D293 -> 9 | G293: 4 | H293: 4 | I293: =G293*6+H293 -> 28 | K293: 5 | L293: 6 | M293: =K293*6+L293 -> 36 | O293: 11 | P293: 8 | Q293: =O293*6+P293 -> 74
A294: BEST PLAYERS | W294: TEAM | X294: W | Y294: L | Z294: D | AA294: FOR | AB294: AGST | AC294: % | AD294: PTS
A295: MORDIALLOC | C295: ? | F295: WILLIAMS | I295: O'BRIEN | L295: BAXTER | N295: BRADBURY | Q295: CULPH
A296: CAULFIELD | C296: ROWE | F296: I MOORE | I296: GASPARI | L296: LOGAN | N296: ARRELL | W296: NORTHCOTE | X296: 5 | Y296: 2 | Z296: 0 | AA296: 701 | AB296: 567 | AC296: =(AA296*100)/AB296 -> 123.6331569664903 | AD296: =(X296*4)+(Z296*2) -> 20
A297: GOALKICKERS | W297: SUNSHINE | X297: 5 | Y297: 2 | Z297: 0 | AA297: 600 | AB297: 508 | AC297: =(AA297*100)/AB297 -> 118.11023622047244 | AD297: =(X297*4)+(Z297*2) -> 20
A298: MORDIALLOC | C298: ? 4 | F298: HYNES 4 | H298: O'BRIEN 4 | J298: LESLIE 4 | L298: POWER 3 | N298: B AXTER 2 | Q298: GRAY | S298: ? 1 | W298: PRAHRAN | X298: 5 | Y298: 2 | Z298: 0 | AA298: 570 | AB298: 488 | AC298: =(AA298*100)/AB298 -> 116.80327868852459 | AD298: =(X298*4)+(Z298*2) -> 20
A299: CAULFIELD | C299: GASPARI 3 | F299: ROWE 2 | H299: FARY 2 | J299: STONE 2 | L299: LOGAN | N299: BAKER | W299: FRANKSTON | X299: 4 | Y299: 3 | Z299: 0 | AA299: 649 | AB299: 563 | AC299: =(AA299*100)/AB299 -> 115.2753108348135 | AD299: =(X299*4)+(Z299*2) -> 16
A301: BOX HILL | C301: 6 | D301: 6 | E301: =C301*6+D301 -> 42 | G301: 9 | H301: 6 | I301: =G301*6+H301 -> 60 | K301: 11 | L301: 10 | M301: =K301*6+L301 -> 76 | O301: 12 | P301: 13 | Q301: =O301*6+P301 -> 85 | S301: WERRIBEE | W301: MORDIALLOC | X301: 4 | Y301: 3 | Z301: 0 | AA301: 611 | AB301: 579 | AC301: =(AA301*100)/AB301 -> 105.52677029360967 | AD301: =(X301*4)+(Z301*2) -> 16
A302: WERRIBEE | C302: 2 | D302: 0 | E302: =C302*6+D302 -> 12 | G302: 4 | H302: 1 | I302: =G302*6+H302 -> 25 | K302: 7 | L302: 5 | M302: =K302*6+L302 -> 47 | O302: 10 | P302: 7 | Q302: =O302*6+P302 -> 67 | W302: BOX HILL | X302: 3 | Y302: 3 | Z302: 1 | AA302: 629 | AB302: 612 | AC302: =(AA302*100)/AB302 -> 102.77777777777777 | AD302: =(X302*4)+(Z302*2) -> 14
A303: BEST PLAYERS | W303: CAMBERWELL | X303: 3 | Y303: 4 | Z303: 0 | AA303: 574 | AB303: 802 | AC303: =(AA303*100)/AB303 -> 71.571072319201988 | AD303: =(X303*4)+(Z303*2) -> 12
A304: BOX HILL | C304: GRAY | F304: I BATES | I304: G FELLOWS | L304: LOOMES | O304: WHITE | R304: GARDINER | W304: GEELONG WEST | X304: 2 | Y304: 4 | Z304: 1 | AA304: 635 | AB304: 605 | AC304: =(AA304*100)/AB304 -> 104.95867768595042 | AD304: =(X304*4)+(Z304*2) -> 10
A305: WERRIBEE | C305: JAMMESON | F305: GAN | I305: TYQUIN | L305: L ALLISON | O305: GILLETT | R305: ANDERSON | W305: CAULFIELD | X305: 2 | Y305: 5 | Z305: 0 | AA305: 510 | AB305: 737 | AC305: =(AA305*100)/AB305 -> 69.199457259158748 | AD305: =(X305*4)+(Z305*2) -> 8
A306: GOALKICKERS | W306: WERRIBEE | X306: 1 | Y306: 6 | Z306: 0 | AA306: 564 | AB306: 668 | AC306: =(AA306*100)/AB306 -> 84.431137724550894 | AD306: =(X306*4)+(Z306*2) -> 4
A307: BOX HILL | C307: BRYANT 3 | F307: GRAY 2 | H307: LOOMES 2 | J307: I BATES 2 | M307: N BATES 2 | P307: HUNT
A308: WERRIBEE | C308: ? 3 | F308: McGREGOR 2 | I308: LYONS 2 | K308: 1 | M308: ALLISON | O308: TRAINION
A310: FRANKSTON | C310: 4 | D310: 4 | E310: =C310*6+D310 -> 28 | G310: 7 | H310: 7 | I310: =G310*6+H310 -> 49 | K310: 13 | L310: 12 | M310: =K310*6+L310 -> 90 | O310: 17 | P310: 14 | Q310: =O310*6+P310 -> 116 | S310: GEELONG WEST
A311: GEELONG WEST | C311: 2 | D311: 5 | E311: =C311*6+D311 -> 17 | G311: 6 | H311: 8 | I311: =G311*6+H311 -> 44 | K311: 10 | L311: 11 | M311: =K311*6+L311 -> 71 | O311: 14 | P311: 14 | Q311: =O311*6+P311 -> 98
A312: BEST PLAYERS
A313: FRANKSTON | C313: McHUGH | F313: WHITE | I313: McNABB | L313: ALDERSON | O313: ? | Q313: WATSON
A314: GEELONG WEST | C314: WILLIAMS | F314: GRANT | I314: SOUTHERN | L314: NUSTELING | O314: SNELL | Q314: PETERS
A315: GOALKICKERS
A316: FRANKSTON | C316: McNABB 5 | F316: McHUGH 5 | I316: THATCHER 3 | L316: PA ? 2 | N316: COULSELL | Q316: CRUNDEN
A317: GEELONG WEST | C317: NUSTELING 5 | F317: GRANT 3 | I317: S ? 3 | L317: BUSH | N317: BRUSHFIELD | Q317: WILLIAMS
E318: 29TH MAY | I318: WEATHER
A319: SUNSHINE | C319: 4 | D319: 4 | E319: =C319*6+D319 -> 28 | G319: 9 | H319: 6 | I319: =G319*6+H319 -> 60 | K319: 15 | L319: 9 | M319: =K319*6+L319 -> 99 | O319: 21 | P319: 13 | Q319: =O319*6+P319 -> 139 | S319: SUNSHINE
A320: CAMBERWELL | C320: 2 | D320: 1 | E320: =C320*6+D320 -> 13 | G320: 3 | H320: 4 | I320: =G320*6+H320 -> 22 | K320: 3 | L320: 5 | M320: =K320*6+L320 -> 23 | O320: 4 | P320: 9 | Q320: =O320*6+P320 -> 33
A321: BEST PLAYERS
A322: SUNSHINE | C322: DARUL | F322: OVERS | I322: TREZISE | L322: YOUNG | O322: CROSBIE
A323: CAMBERWELL | C323: WINKLEMAN | F323: ? | I323: J SMITH | L323: WITHERS | O323: ELLIOTT | Q323: FRIEBERG
A324: GOALKICKERS
A325: SUNSHINE | C325: OVERS 5 | E325: W HARRIS 4 | H325: TREZISE 2 | J325: HOWARD 2 | M325: ? 2 | O325: YOUNG 2 | Q325: HOEY 2 | S325: LEGAWIECZ | W325: GRAHAM
A326: CAMBERWELL | C326: WINKLEMAN 2 | G326: J SMITH | J326: ELLIOTT
A328: NORTHCOTE | C328: 2 | D328: 1 | E328: =C328*6+D328 -> 13 | G328: 9 | H328: 7 | I328: =G328*6+H328 -> 61 | K328: 13 | L328: 8 | M328: =K328*6+L328 -> 86 | O328: 15 | P328: 13 | Q328: =O328*6+P328 -> 103 | S328: NORTHCOTE
A329: PRAHRAN | C329: 2 | D329: 0 | E329: =C329*6+D329 -> 12 | G329: 3 | H329: 6 | I329: =G329*6+H329 -> 24 | K329: 6 | L329: 9 | M329: =K329*6+L329 -> 45 | O329: 9 | P329: 16 | Q329: =O329*6+P329 -> 70
A330: BEST PLAYERS
A331: NORTHCOTE | C331: THOMPSON | F331: McBREEN | I331: MICKLESON | L331: BEECHER | O331: GRYBAS | R331: CALVERLEY
A332: PRAHRAN | C332: SKIDMORE | F332: WISHART | I332: KIRBY | L332: GEISLER | N332: MINTON-CONNELL | R332: MOONEY
A333: GOALKICKERS
A334: NORTHCOTE | C334: ? 5 | F334: CALVERLEY 5 | I334: N WHITE 2 | L334: ? 2 | N334: GRYBAS
A335: PRAHRAN | C335: SKIDMORE 3 | F335: RYAN 2 | H335: RICHARDSON 2 | L335: MOONEY | N335: VERWOERT
A337: ROUND 8 | E337: 4TH JUNE | J337: WEATHER | N337: S.E.BREEZE DULL | S337: PLAYED AT
D338: 1ST QTR | H338: 2ND QTR | L338: 3RD QTR | P338: FINAL | S338: PRINCES PARK, CAULFIELD
A339: CAULFIELD | C339: 2 | D339: 3 | E339: =C339*6+D339 -> 15 | G339: 7 | H339: 5 | I339: =G339*6+H339 -> 47 | K339: 11 | L339: 13 | M339: =K339*6+L339 -> 79 | O339: 15 | P339: 19 | Q339: =O339*6+P339 -> 109 | S339: UMPIRE | X339: LADDER | AB339: ROUND | AD339: 8
A340: CAMBERWELL | C340: 4 | D340: 4 | E340: =C340*6+D340 -> 28 | G340: 9 | H340: 10 | I340: =G340*6+H340 -> 64 | K340: 10 | L340: 12 | M340: =K340*6+L340 -> 72 | O340: 13 | P340: 13 | Q340: =O340*6+P340 -> 91
A341: BEST PLAYERS | W341: TEAM | X341: W | Y341: L | Z341: D | AA341: FOR | AB341: AGST | AC341: % | AD341: PTS
A342: CAULFIELD | C342: ROWE | F342: GOWAN | I342: DOUGLAS | L342: GASPARI | O342: DE BONDE | R342: EVANS
A343: CAMBERWELL | C343: J SMITH | F343: O'NEILL | I343: WINKLEMAN | L343: WITHERS | O343: GIBSON | R343: PANZIC | W343: PRAHRAN | X343: 6 | Y343: 2 | Z343: 0 | AA343: 673 | AB343: 583 | AC343: =(AA343*100)/AB343 -> 115.43739279588337 | AD343: =(X343*4)+(Z343*2) -> 24
A344: GOALKICKERS | W344: FRANKSTON | X344: 5 | Y344: 3 | Z344: 0 | AA344: 770 | AB344: 654 | AC344: =(AA344*100)/AB344 -> 117.73700305810398 | AD344: =(X344*4)+(Z344*2) -> 20
A345: CAULFIELD | C345: ROWE 4 | E345: DOUGLAS 3 | H345: GASPARI 3 | J345: DUNN 2 | L345: GOWAN 2 | N345: LOGAN | W345: NORTHCOTE | X345: 5 | Y345: 3 | Z345: 0 | AA345: 789 | AB345: 684 | AC345: =(AA345*100)/AB345 -> 115.35087719298245 | AD345: =(X345*4)+(Z345*2) -> 20
A346: CAMBERWELL | C346: O'NEILL 6 | F346: J SMITH 3 | I346: ANDERSON 2 | L346: ELLIOTT 2 | W346: SUNSHINE | X346: 5 | Y346: 3 | Z346: 0 | AA346: 692 | AB346: 662 | AC346: =(AA346*100)/AB346 -> 104.53172205438067 | AD346: =(X346*4)+(Z346*2) -> 20
A348: BOX HILL | C348: 5 | D348: 3 | E348: =C348*6+D348 -> 33 | G348: 9 | H348: 5 | I348: =G348*6+H348 -> 59 | K348: 14 | L348: 12 | M348: =K348*6+L348 -> 96 | O348: 17 | P348: 15 | Q348: =O348*6+P348 -> 117 | S348: BOX HILL | W348: BOX HILL | X348: 4 | Y348: 3 | Z348: 1 | AA348: 746 | AB348: 700 | AC348: =(AA348*100)/AB348 -> 106.57142857142857 | AD348: =(X348*4)+(Z348*2) -> 18
A349: NORTHCOTE | C349: 3 | D349: 0 | E349: =C349*6+D349 -> 18 | G349: 8 | H349: 3 | I349: =G349*6+H349 -> 51 | K349: 8 | L349: 5 | M349: =K349*6+L349 -> 53 | O349: 13 | P349: 10 | Q349: =O349*6+P349 -> 88 | W349: MORDIALLOC | X349: 4 | Y349: 4 | Z349: 0 | AA349: 706 | AB349: 682 | AC349: =(AA349*100)/AB349 -> 103.51906158357771 | AD349: =(X349*4)+(Z349*2) -> 16
A350: BEST PLAYERS | W350: GEELONG WEST | X350: 3 | Y350: 4 | Z350: 1 | AA350: 789 | AB350: 697 | AC350: =(AA350*100)/AB350 -> 113.19942611190818 | AD350: =(X350*4)+(Z350*2) -> 14
A351: BOX HILL | C351: HARRIS | F351: C FELLOWS | I351: GARDINER | L351: LOOMES | O351: BRYANT | Q351: HUNT | W351: CAULFIELD | X351: 3 | Y351: 5 | Z351: 0 | AA351: 619 | AB351: 828 | AC351: =(AA351*100)/AB351 -> 74.758454106280197 | AD351: =(X351*4)+(Z351*2) -> 12
A352: NORTHCOTE | C352: N WHITE | F352: QUAIFE | I352: CRAMERI | L352: SLEEP | O352: CALVERLEY | R352: KEAYS | W352: CAMBERWELL | X352: 3 | Y352: 5 | Z352: 0 | AA352: 665 | AB352: 911 | AC352: =(AA352*100)/AB352 -> 72.996706915477503 | AD352: =(X352*4)+(Z352*2) -> 12
A353: GOALKICKERS | W353: WERRIBEE | X353: 1 | Y353: 7 | Z353: 0 | AA353: 655 | AB353: 789 | AC353: =(AA353*100)/AB353 -> 83.01647655259822 | AD353: =(X353*4)+(Z353*2) -> 4
A354: BOX HILL | C354: BRYANT 5 | F354: LOOMES 4 | I354: HUNT 3 | K354: I BATES 2 | M354: GARDINER 2 | P354: BAKER
A355: NORTHCOTE | C355: QUAIFE 4 | F355: MICKLESON 3 | I355: SLEEP 2 | K355: PITTS | M355: CALVERLEY | P355: LACHMUND | S355: N WHITE
A357: FRANKSTON | C357: 4 | D357: 2 | E357: =C357*6+D357 -> 26 | G357: 9 | H357: 5 | I357: =G357*6+H357 -> 59 | K357: 15 | L357: 5 | M357: =K357*6+L357 -> 95 | O357: 19 | P357: 7 | Q357: =O357*6+P357 -> 121 | S357: FRANKSTON
A358: WERRIBEE | C358: 2 | D358: 3 | E358: =C358*6+D358 -> 15 | G358: 4 | H358: 6 | I358: =G358*6+H358 -> 30 | K358: 6 | L358: 10 | M358: =K358*6+L358 -> 46 | O358: 13 | P358: 13 | Q358: =O358*6+P358 -> 91
A359: BEST PLAYERS
A360: FRANKSTON | C360: BOWEN | F360: ALDERSON | I360: PAYNE | L360: McHUGH | O360: THATCHER | R360: KERR
A361: WERRIBEE | C361: OGILVIE | F361: TRAINION | I361: BA SMITH | L361: GILLETT | O361: TURNER | R361: TYQUIN
A362: GOALKICKERS
A363: FRANKSTON | C363: PAYNE 7 | F363: McHUGH 3 | I363: BOWEN 3 | K363: COULSON 2 | N363: THATCHER 2 | Q363: CRUNDEN | T363: KERR
A364: WERRIBEE | C364: OGILVIE 3 | F364: LYONS 2 | I364: SMITH 2 | K364: FRANCE 2 | M364: TRAINION | O364: JAMMESON | R364: TYQUIN | U364: ANDERSON
E365: 5TH JUNE | I365: WEATHER
A366: PRAHRAN | C366: 3 | D366: 4 | E366: =C366*6+D366 -> 22 | G366: 7 | H366: 5 | I366: =G366*6+H366 -> 47 | K366: 11 | L366: 6 | M366: =K366*6+L366 -> 72 | O366: 16 | P366: 7 | Q366: =O366*6+P366 -> 103 | S366: TOORAK PARK
A367: MORDIALLOC | C367: 3 | D367: 3 | E367: =C367*6+D367 -> 21 | G367: 7 | H367: 6 | I367: =G367*6+H367 -> 48 | K367: 11 | L367: 11 | M367: =K367*6+L367 -> 77 | O367: 13 | P367: 17 | Q367: =O367*6+P367 -> 95
A368: BEST PLAYERS
A369: PRAHRAN | C369: MINTON-CONNELL | F369: PIPER | I369: RICHARDSON | L369: VERWOERT | O369: SKIDMORE | R369: ANDREW
A370: MORDIALLOC | C370: O'BRIEN | F370: BAXTER | I370: GRAY | L370: BACKMAN | O370: DANCKERT | R370: WILLIAMS
A371: GOALKICKERS
A372: PRAHRAN | C372: RYAN 4 | E372: VERWOERT 4 | H372: RICHARDSON 2 | K372: SKIDMORE 2 | N372: PIPER 2 | P372: ANDREW | R372: O'BRIEN
A373: MORDIALLOC | C373: POWER 3 | E373: BACKMAN 2 | H373: BAXTER 2 | J373: O'BRIEN 2 | M373: HYNES 2 | O373: LESLIE | Q373: LAIRD
A375: GEELONG WEST | C375: 4 | D375: 4 | E375: =C375*6+D375 -> 28 | G375: 11 | H375: 5 | I375: =G375*6+H375 -> 71 | K375: 15 | L375: 7 | M375: =K375*6+L375 -> 97 | O375: 24 | P375: 10 | Q375: =O375*6+P375 -> 154 | S375: GEELONG WEST
A376: SUNSHINE | C376: 4 | D376: 2 | E376: =C376*6+D376 -> 26 | G376: 8 | H376: 5 | I376: =G376*6+H376 -> 53 | K376: 13 | L376: 12 | M376: =K376*6+L376 -> 90 | O376: 13 | P376: 14 | Q376: =O376*6+P376 -> 92
A377: BEST PLAYERS
A378: GEELONG WEST | C378: BRUSHFIELD | F378: BUSH | I378: GIBBONS | L378: NUSTELING | O378: WILLIAMS | R378: COLTISH
A379: SUNSHINE | C379: BENSON | F379: TREZISE | I379: LEGOWIECZ | L379: CROSBIE | O379: OVERS | R379: DARUL
A380: GOALKICKERS
A381: GEELONG WEST | C381: NUSTELING 7 | F381: GIBBONS 4 | I381: BRUSHFIELD 4 | L381: BUSH 3 | N381: HOVEY 2 | P381: VAN T'HAG 2 | S381: GRANT | U381: STACEY
A382: SUNSHINE | C382: OVERS 3 | E382: HOWARD 2 | H382: LEGAWIECZ 2 | K382: TREZISE | M382: BENSON | O382: CROSBIE | Q382: HOEY | S382: WISE | U382: W HARRIS
A384: ROUND 9 | E384: 11TH JUNE | J384: WEATHER | N384: S.E.BREEZE DULL | S384: PLAYED AT
D385: 1ST QTR | H385: 2ND QTR | L385: 3RD QTR | P385: FINAL | S385: CAMBERWELL
A386: CAMBERWELL | C386: 1 | D386: 5 | E386: =C386*6+D386 -> 11 | G386: 3 | H386: 7 | I386: =G386*6+H386 -> 25 | K386: 12 | L386: 12 | M386: =K386*6+L386 -> 84 | O386: 14 | P386: 14 | Q386: =O386*6+P386 -> 98 | S386: UMPIRE | X386: LADDER | AB386: ROUND | AD386: 9
A387: PRAHRAN | C387: 3 | D387: 3 | E387: =C387*6+D387 -> 21 | G387: 10 | H387: 9 | I387: =G387*6+H387 -> 69 | K387: 11 | L387: 13 | M387: =K387*6+L387 -> 79 | O387: 13 | P387: 18 | Q387: =O387*6+P387 -> 96
A388: BEST PLAYERS | W388: TEAM | X388: W | Y388: L | Z388: D | AA388: FOR | AB388: AGST | AC388: % | AD388: PTS
A389: CAMBERWELL | C389: COCKREM | F389: WINKLEMAN | I389: O'NEILL | L389: FRIEBERG | O389: D BOYD | Q389: ANDERSON
A390: PRAHRAN | C390: SEEDY | F390: ANDERSON | I390: RYAN | K390: O'BRIEN | M390: SKIDMORE | P390: MINTON-CONNELL | W390: FRANKSTON | X390: 6 | Y390: 3 | Z390: 0 | AA390: 858 | AB390: 720 | AC390: =(AA390*100)/AB390 -> 119.16666666666667 | AD390: =(X390*4)+(Z390*2) -> 24
A391: GOALKICKERS | W391: PRAHRAN | X391: 6 | Y391: 3 | Z391: 0 | AA391: 769 | AB391: 681 | AC391: =(AA391*100)/AB391 -> 112.92217327459618 | AD391: =(X391*4)+(Z391*2) -> 24
A392: CAMBERWELL | C392: O'NEILL 5 | F392: ANDERSON 2 | I392: WINKLEMAN 2 | L392: 2 | N392: D BOYD 2 | Q392: FRIEBERG | W392: SUNSHINE | X392: 6 | Y392: 3 | Z392: 0 | AA392: 764 | AB392: 722 | AC392: =(AA392*100)/AB392 -> 105.81717451523545 | AD392: =(X392*4)+(Z392*2) -> 24
A393: PRAHRAN | C393: RYAN 5 | E393: O'BRIEN 3 | H393: SKIDMORE 2 | K393: RICHARDSON | N393: GLOVER | Q393: ANDERSON | W393: NORTHCOTE | X393: 5 | Y393: 4 | Z393: 0 | AA393: 855 | AB393: 772 | AC393: =(AA393*100)/AB393 -> 110.75129533678756 | AD393: =(X393*4)+(Z393*2) -> 20
A395: MORDIALLOC | C395: 0 | D395: 1 | E395: =C395*6+D395 -> 1 | G395: 5 | H395: 4 | I395: =G395*6+H395 -> 34 | K395: 9 | L395: 9 | M395: =K395*6+L395 -> 63 | O395: 13 | P395: 11 | Q395: =O395*6+P395 -> 89 | S395: MORDIALLOC | W395: MORDIALLOC | X395: 5 | Y395: 4 | Z395: 0 | AA395: 795 | AB395: 752 | AC395: =(AA395*100)/AB395 -> 105.71808510638297 | AD395: =(X395*4)+(Z395*2) -> 20
A396: BOX HILL | C396: 1 | D396: 7 | E396: =C396*6+D396 -> 13 | G396: 3 | H396: 9 | I396: =G396*6+H396 -> 27 | K396: 7 | L396: 12 | M396: =K396*6+L396 -> 54 | O396: 9 | P396: 16 | Q396: =O396*6+P396 -> 70 | W396: GEELONG WEST | X396: 4 | Y396: 4 | Z396: 1 | AA396: 936 | AB396: 757 | AC396: =(AA396*100)/AB396 -> 123.64597093791281 | AD396: =(X396*4)+(Z396*2) -> 18
A397: BEST PLAYERS | W397: BOX HILL | X397: 4 | Y397: 4 | Z397: 1 | AA397: 816 | AB397: 789 | AC397: =(AA397*100)/AB397 -> 103.42205323193916 | AD397: =(X397*4)+(Z397*2) -> 18
A398: MORDIALLOC | C398: BACKMAN | F398: BAXTER | I398: DANCKERT | L398: HYNES | N398: ? | Q398: BRADBURY | W398: CAMBERWELL | X398: 4 | Y398: 5 | Z398: 0 | AA398: 763 | AB398: 1007 | AC398: =(AA398*100)/AB398 -> 75.769612711022845 | AD398: =(X398*4)+(Z398*2) -> 16
A399: BOX HILL | C399: ? | F399: I BATES | I399: LA ROCHE | L399: LOOMES | N399: N BATES | Q399: O'NEILL | W399: CAULFIELD | X399: 3 | Y399: 6 | Z399: 0 | AA399: 679 | AB399: 900 | AC399: =(AA399*100)/AB399 -> 75.444444444444443 | AD399: =(X399*4)+(Z399*2) -> 12
A400: GOALKICKERS | W400: WERRIBEE | X400: 1 | Y400: 8 | Z400: 0 | AA400: 715 | AB400: 936 | AC400: =(AA400*100)/AB400 -> 76.388888888888886 | AD400: =(X400*4)+(Z400*2) -> 4
A401: MORDIALLOC | C401: ? 3 | F401: O'BRIEN 3 | I401: BAXTER 2 | L401: ? 2 | N401: HOBSON | P401: POWER | R401: SHIREFFS
A402: BOX HILL | C402: I BATES 4 | F402: N BATES 2 | I402: LOOMES | L402: HUNT | N402: GRAY
A404: SUNSHINE | C404: 3 | D404: 5 | E404: =C404*6+D404 -> 23 | G404: 5 | H404: 8 | I404: =G404*6+H404 -> 38 | K404: 9 | L404: 11 | M404: =K404*6+L404 -> 65 | O404: 10 | P404: 12 | Q404: =O404*6+P404 -> 72 | S404: SUNSHINE
A405: CAULFIELD | C405: 2 | D405: 2 | E405: =C405*6+D405 -> 14 | G405: 4 | H405: 7 | I405: =G405*6+H405 -> 31 | K405: 5 | L405: 8 | M405: =K405*6+L405 -> 38 | O405: 8 | P405: 12 | Q405: =O405*6+P405 -> 60
A406: BEST PLAYERS
A407: SUNSHINE | C407: HOWARD | F407: CROSBIE | I407: LEGAWIECZ | L407: YOUNG
A408: CAULFIELD | C408: ROWE | F408: GOWAN | I408: DOUGLAS | L408: LOGAN | O408: BAKER | Q408: AUGHTERSON
A409: GOALKICKERS
A410: SUNSHINE | C410: LEGAWIECZ 3 | F410: HOEY 2 | H410: GRAHAM | J410: CROSBIE | L410: OVERS | N410: SLATTERY | Q410: CLARKE
A411: CAULFIELD | C411: DOUGLAS 5 | F411: LOGAN | H411: GOWAN | J411: ROWE
E412: 12TH JUNE | I412: WEATHER
A413: GEELONG WEST | C413: 5 | D413: 5 | E413: =C413*6+D413 -> 35 | G413: 10 | H413: 9 | I413: =G413*6+H413 -> 69 | K413: 15 | L413: 14 | M413: =K413*6+L413 -> 104 | O413: 21 | P413: 21 | Q413: =O413*6+P413 -> 147 | S413: WERRIBEE
A414: WERRIBEE | C414: 2 | D414: 1 | E414: =C414*6+D414 -> 13 | G414: 3 | H414: 3 | I414: =G414*6+H414 -> 21 | K414: 6 | L414: 6 | M414: =K414*6+L414 -> 42 | O414: 9 | P414: 6 | Q414: =O414*6+P414 -> 60
A415: BEST PLAYERS
A416: GEELONG WEST | C416: WILLIAMS | F416: NUSTELING | I416: RAEBURN | L416: STACEY | O416: BARKER
A417: WERRIBEE | C417: HOLCOMBE | F417: B SMITH | I417: R EDWARDS | L417: TURNER
A418: GOALKICKERS
A419: GEELONG WEST | C419: NUSTELING 11 | F419: STACEY 2 | H419: BRUSHFIELD 2 | K419: GIBBONS 2 | N419: WILLIAMS | Q419: BUSH | S419: VAN T'HAG | W419: 1
A420: WERRIBEE | C420: PANTE 4 | F420: FRANCE | I420: OGILVIE | K420: TRAINION | M420: L ALLISON | O420: HOLCOMBE | R420: K O'BRIEN
A422: FRANKSTON | C422: 4 | D422: 5 | E422: =C422*6+D422 -> 29 | G422: 7 | H422: 8 | I422: =G422*6+H422 -> 50 | K422: 10 | L422: 9 | M422: =K422*6+L422 -> 69 | O422: 13 | P422: 10 | Q422: =O422*6+P422 -> 88 | S422: NORTHCOTE
A423: NORTHCOTE | C423: 1 | D423: 3 | E423: =C423*6+D423 -> 9 | G423: 4 | H423: 8 | I423: =G423*6+H423 -> 32 | K423: 8 | L423: 10 | M423: =K423*6+L423 -> 58 | O423: 9 | P423: 12 | Q423: =O423*6+P423 -> 66
A424: BEST PLAYERS
A425: FRANKSTON | C425: McNABB | F425: THATCHER | I425: KERR | L425: SLADE | O425: McHUGH | R425: WATSON
A426: NORTHCOTE | F426: WHITE | I426: PITTS | L426: BEECHER | R426: KEAYS
A427: GOALKICKERS
A428: FRANKSTON | C428: ? 5 | F428: CRUNDEN 3 | I428: PAYNE 2 | L428: ? 2 | N428: ? 1
A429: NORTHCOTE
A431: ROUND 10 | E431: 18TH JUNE | J431: WEATHER | N431: S.E.BREEZE DULL | S431: PLAYED AT
D432: 1ST QTR | H432: 2ND QTR | L432: 3RD QTR | P432: FINAL | S432: PRINCES PARK, CAULFIELD
A433: PRAHRAN | C433: 0 | D433: 1 | E433: =C433*6+D433 -> 1 | G433: 3 | H433: 10 | I433: =G433*6+H433 -> 28 | K433: 5 | L433: 14 | M433: =K433*6+L433 -> 44 | O433: 9 | P433: 17 | Q433: =O433*6+P433 -> 71 | S433: UMPIRE | X433: LADDER | AB433: ROUND | AD433: 10
A434: CAULFIELD | C434: 3 | D434: 6 | E434: =C434*6+D434 -> 24 | G434: 3 | H434: 6 | I434: =G434*6+H434 -> 24 | K434: 8 | L434: 14 | M434: =K434*6+L434 -> 62 | O434: 9 | P434: 14 | Q434: =O434*6+P434 -> 68
A435: BEST PLAYERS | W435: TEAM | X435: W | Y435: L | Z435: D | AA435: FOR | AB435: AGST | AC435: % | AD435: PTS
A436: PRAHRAN | C436: SKIDMORE | F436: VERWOERT | I436: SHEEDY | L436: RYAN | N436: MINTON-CONNELL | R436: PEARSON
A437: CAULFIELD | C437: GOWAN | F437: ROWE | I437: DOUGLAS | L437: LOGAN | N437: BAKER | Q437: DE BONDE | W437: SUNSHINE | X437: 7 | Y437: 3 | Z437: 0 | AA437: 824 | AB437: 734 | AC437: =(AA437*100)/AB437 -> 112.26158038147139 | AD437: =(X437*4)+(Z437*2) -> 28
A438: GOALKICKERS | W438: PRAHRAN | X438: 7 | Y438: 3 | Z438: 0 | AA438: 840 | AB438: 749 | AC438: =(AA438*100)/AB438 -> 112.14953271028037 | AD438: =(X438*4)+(Z438*2) -> 28
A439: PRAHRAN | C439: RYAN 2 | E439: McMAHON 2 | H439: CRIPPS | J439: SHEEDY | L439: COOPER | N439: VERWOERT | Q439: GLOVER | W439: FRANKSTON | X439: 6 | Y439: 4 | Z439: 0 | AA439: 932 | AB439: 821 | AC439: =(AA439*100)/AB439 -> 113.52009744214372 | AD439: =(X439*4)+(Z439*2) -> 24
A440: CAULFIELD | C440: BAKER 2 | F440: ARRELL | H440: DE BONDE | J440: GOWAN | L440: DOUGLAS | N440: LOGAN | P440: FARY | R440: ROWE | W440: NORTHCOTE | X440: 6 | Y440: 4 | Z440: 0 | AA440: 920 | AB440: 821 | AC440: =(AA440*100)/AB440 -> 112.0584652862363 | AD440: =(X440*4)+(Z440*2) -> 24
A442: BOX HILL | C442: 3 | D442: 1 | E442: =C442*6+D442 -> 19 | G442: 7 | H442: 7 | I442: =G442*6+H442 -> 49 | K442: 11 | L442: 8 | M442: =K442*6+L442 -> 74 | O442: 14 | P442: 14 | Q442: =O442*6+P442 -> 98 | S442: CAMBERWELL | W442: MORDIALLOC | X442: 6 | Y442: 4 | Z442: 0 | AA442: 896 | AB442: 826 | AC442: =(AA442*100)/AB442 -> 108.47457627118644 | AD442: =(X442*4)+(Z442*2) -> 24
A443: CAMBERWELL | C443: 5 | D443: 5 | E443: =C443*6+D443 -> 35 | G443: 5 | H443: 6 | I443: =G443*6+H443 -> 36 | K443: 7 | L443: 10 | M443: =K443*6+L443 -> 52 | O443: 12 | P443: 12 | Q443: =O443*6+P443 -> 84 | W443: BOX HILL | X443: 5 | Y443: 4 | Z443: 1 | AA443: 914 | AB443: 873 | AC443: =(AA443*100)/AB443 -> 104.69644902634593 | AD443: =(X443*4)+(Z443*2) -> 22
A444: BEST PLAYERS | W444: GEELONG WEST | X444: 4 | Y444: 5 | Z444: 1 | AA444: 985 | AB444: 822 | AC444: =(AA444*100)/AB444 -> 119.82968369829683 | AD444: =(X444*4)+(Z444*2) -> 18
A445: BOX HILL | C445: GARDINER | F445: GRIGG | I445: MACE | L445: BOWYER=SMYTH | P445: O'NEILL | W445: CAMBERWELL | X445: 4 | Y445: 6 | Z445: 0 | AA445: 847 | AB445: 1105 | AC445: =(AA445*100)/AB445 -> 76.651583710407238 | AD445: =(X445*4)+(Z445*2) -> 16
A446: CAMBERWELL | C446: WINKLEMAN | F446: J SMITH | I446: DOUGLAS | L446: WITHERS | O446: FRIEBERG | Q446: JAMES | W446: CAULFIELD | X446: 3 | Y446: 7 | Z446: 0 | AA446: 747 | AB446: 971 | AC446: =(AA446*100)/AB446 -> 76.930998970133885 | AD446: =(X446*4)+(Z446*2) -> 12
A447: GOALKICKERS | W447: WERRIBEE | X447: 1 | Y447: 9 | Z447: 0 | AA447: 727 | AB447: 996 | AC447: =(AA447*100)/AB447 -> 72.99196787148594 | AD447: =(X447*4)+(Z447*2) -> 4
A448: BOX HILL | C448: I BATES 4 | E448: LOOMES 2 | H448: BRYANT 2 | K448: HUNT 2 | M448: MACE | O448: WHITE | Q448: LA ROCHE | T448: GARDINER
A449: CAMBERWELL | C449: ADAMS 3 | E449: WINKLEMAN 2 | H449: J SMITH 2 | K449: D BOYD 2 | M449: O'NEILL 2 | O449: COCKREM
A451: MORDIALLOC | C451: 8 | D451: 6 | E451: =C451*6+D451 -> 54 | G451: 9 | H451: 8 | I451: =G451*6+H451 -> 62 | K451: 13 | L451: 10 | M451: =K451*6+L451 -> 88 | O451: 15 | P451: 11 | Q451: =O451*6+P451 -> 101 | S451: MORDIALLOC
A452: FRANKSTON | C452: 0 | D452: 1 | E452: =C452*6+D452 -> 1 | G452: 4 | H452: 4 | I452: =G452*6+H452 -> 28 | K452: 5 | L452: 6 | M452: =K452*6+L452 -> 36 | O452: 11 | P452: 8 | Q452: =O452*6+P452 -> 74
A453: BEST PLAYERS
A454: MORDIALLOC | C454: BAXTER | F454: DANCKERT | I454: LESLIE | L454: HYNES | N454: ROSENBROCK | Q454: BACKMAN
A455: FRANKSTON | C455: BOWEN | F455: McNAUGHT | I455: BLAKE | L455: CRUNDEN | N455: WHITE
A456: GOALKICKERS
A457: MORDIALLOC | C457: LESLIE 4 | F457: POWER 3 | I457: BAXTER 3 | L457: O'BRIEN 2 | N457: BACKMAN | Q457: GROVES | S457: DANCKERT
A458: FRANKSTON | C458: HUGHES 2 | F458: PAYNE 2 | I458: COULSON 2 | L458: McNABB 2 | N458: CRUNDEN | Q458: LEWIS | S458: BOWMAN
E459: 19TH JUNE | I459: WEATHER
A460: NORTHCOTE | C460: 2 | D460: 6 | E460: =C460*6+D460 -> 18 | G460: 7 | H460: 8 | I460: =G460*6+H460 -> 50 | K460: 9 | L460: 10 | M460: =K460*6+L460 -> 64 | O460: 9 | P460: 11 | Q460: =O460*6+P460 -> 65 | S460: NORTHCOTE
A461: GEELONG WEST | C461: 1 | D461: 6 | E461: =C461*6+D461 -> 12 | G461: 2 | H461: 11 | I461: =G461*6+H461 -> 23 | K461: 3 | L461: 16 | M461: =K461*6+L461 -> 34 | O461: 5 | P461: 19 | Q461: =O461*6+P461 -> 49
A462: BEST PLAYERS
A463: NORTHCOTE | C463: McBREEN | F463: WHITE | I463: CRAMERI | L463: SIMPSON | O463: HENRY | Q463: BEECHER
A464: GEELONG WEST | C464: WILLIAMS | F464: CRONIN | I464: STACEY | L464: BARKER | O464: GIBBONS
A465: GOALKICKERS
A466: NORTHCOTE | C466: GEMMELL 3 | F466: N WHITE 2 | I466: CRAMERI 2 | L466: BEYNON | N466: HENRY
A467: GEELONG WEST | C467: HEDLEY | F467: VAN T'HAG | I467: GIBBONS | L467: SYMES | N467: STACEY
A469: SUNSHINE | C469: 1 | D469: 4 | E469: =C469*6+D469 -> 10 | G469: 3 | H469: 8 | I469: =G469*6+H469 -> 26 | K469: 5 | L469: 12 | M469: =K469*6+L469 -> 42 | O469: 8 | P469: 12 | Q469: =O469*6+P469 -> 60 | S469: SUNSHINE
A470: WERRIBEE | C470: 0 | D470: 0 | E470: =C470*6+D470 -> 0 | G470: 0 | H470: 3 | I470: =G470*6+H470 -> 3 | K470: 1 | L470: 3 | M470: =K470*6+L470 -> 9 | O470: 1 | P470: 6 | Q470: =O470*6+P470 -> 12
A471: BEST PLAYERS
A472: SUNSHINE | C472: SLATTERY | F472: OVERS | I472: BENSON | L472: HOWARD | O472: HUTCHISON | R472: YOUNG
A473: WERRIBEE | C473: TURNER | F473: GILLETT | I473: JAMMESON | L473: HOLCOMBE | O473: O'BRIEN | R473: ANDERSON
A474: GOALKICKERS
A475: SUNSHINE | C475: GRAHAM 2 | F475: KENNEDY 2 | I475: EDWARDS | L475: HOEY | N475: BERGFELD | Q475: BANT
A476: WERRIBEE | C476: LYONS
A478: ROUND 11 | E478: 25TH JUNE | J478: WEATHER | N478: S.E.BREEZE DULL | S478: PLAYED AT
D479: 1ST QTR | H479: 2ND QTR | L479: 3RD QTR | P479: FINAL | S479: FRANKSTON
A480: FRANKSTON | C480: 2 | D480: 4 | E480: =C480*6+D480 -> 16 | G480: 7 | H480: 9 | I480: =G480*6+H480 -> 51 | K480: 8 | L480: 14 | M480: =K480*6+L480 -> 62 | O480: 14 | P480: 22 | Q480: =O480*6+P480 -> 106 | S480: UMPIRE | X480: LADDER | AB480: ROUND | AD480: 11
A481: CAMBERWELL | C481: 4 | D481: 3 | E481: =C481*6+D481 -> 27 | G481: 7 | H481: 3 | I481: =G481*6+H481 -> 45 | K481: 12 | L481: 6 | M481: =K481*6+L481 -> 78 | O481: 13 | P481: 8 | Q481: =O481*6+P481 -> 86
A482: BEST PLAYERS | W482: TEAM | X482: W | Y482: L | Z482: D | AA482: FOR | AB482: AGST | AC482: % | AD482: PTS
A483: FRANKSTON | C483: LEWIS | F483: THATCHER | I483: McNABB | L483: HUGHES | N483: BOWEN | Q483: PAYNE
A484: CAMBERWELL | C484: O'NEILL | F484: J SMITH | I484: KISS | L484: COCKREM | N484: K SMITH | Q484: JAMES | W484: PRAHRAN | X484: 8 | Y484: 3 | Z484: 0 | AA484: 978 | AB484: 802 | AC484: =(AA484*100)/AB484 -> 121.94513715710723 | AD484: =(X484*4)+(Z484*2) -> 32
A485: GOALKICKERS | W485: FRANKSTON | X485: 7 | Y485: 4 | Z485: 0 | AA485: 1038 | AB485: 907 | AC485: =(AA485*100)/AB485 -> 114.44321940463065 | AD485: =(X485*4)+(Z485*2) -> 28
A486: FRANKSTON | C486: BOWEN 3 | E486: THATCHER 3 | H486: HUGHES 3 | J486: CRUNDEN 2 | M486: PAYNE | O486: WATSON | Q486: McHUGH | W486: NORTHCOTE | X486: 7 | Y486: 4 | Z486: 0 | AA486: 1007 | AB486: 880 | AC486: =(AA486*100)/AB486 -> 114.43181818181819 | AD486: =(X486*4)+(Z486*2) -> 28
A487: CAMBERWELL | C487: O'NEILL 8 | F487: J SMITH 2 | I487: WINKLEMAN 2 | L487: W ADAMS | W487: SUNSHINE | X487: 7 | Y487: 4 | Z487: 0 | AA487: 877 | AB487: 872 | AC487: =(AA487*100)/AB487 -> 100.57339449541284 | AD487: =(X487*4)+(Z487*2) -> 28
A489: BOX HILL | C489: 1 | D489: 5 | E489: =C489*6+D489 -> 11 | G489: 4 | H489: 8 | I489: =G489*6+H489 -> 32 | K489: 6 | L489: 15 | M489: =K489*6+L489 -> 51 | O489: 13 | P489: 18 | Q489: =O489*6+P489 -> 96 | S489: BOX HILL | W489: BOX HILL | X489: 6 | Y489: 4 | Z489: 1 | AA489: 1010 | AB489: 926 | AC489: =(AA489*100)/AB489 -> 109.07127429805615 | AD489: =(X489*4)+(Z489*2) -> 26
A490: CAULFIELD | C490: 1 | D490: 5 | E490: =C490*6+D490 -> 11 | G490: 4 | H490: 6 | I490: =G490*6+H490 -> 30 | K490: 6 | L490: 8 | M490: =K490*6+L490 -> 44 | O490: 7 | P490: 11 | Q490: =O490*6+P490 -> 53 | W490: MORDIALLOC | X490: 6 | Y490: 5 | Z490: 0 | AA490: 977 | AB490: 908 | AC490: =(AA490*100)/AB490 -> 107.59911894273128 | AD490: =(X490*4)+(Z490*2) -> 24
A491: BEST PLAYERS | W491: GEELONG WEST | X491: 5 | Y491: 5 | Z491: 1 | AA491: 1067 | AB491: 903 | AC491: =(AA491*100)/AB491 -> 118.16168327796235 | AD491: =(X491*4)+(Z491*2) -> 22
A492: BOX HILL | C492: C FELLOWS | F492: BOWYER-SMYTH | J492: HARRIS | L492: I BATES | N492: BRYANT | Q492: GARDINER | W492: CAMBERWELL | X492: 4 | Y492: 7 | Z492: 0 | AA492: 933 | AB492: 1211 | AC492: =(AA492*100)/AB492 -> 77.043765483071837 | AD492: =(X492*4)+(Z492*2) -> 16
A493: CAULFIELD | C493: EVANS | F493: DE BONDE | I493: AUGHTERSON | L493: GOWAN | N493: FARY | Q493: MARSHALL | W493: CAULFIELD | X493: 3 | Y493: 8 | Z493: 0 | AA493: 800 | AB493: 1067 | AC493: =(AA493*100)/AB493 -> 74.976569821930653 | AD493: =(X493*4)+(Z493*2) -> 12
A494: GOALKICKERS | W494: WERRIBEE | X494: 1 | Y494: 10 | Z494: 0 | AA494: 786 | AB494: 1083 | AC494: =(AA494*100)/AB494 -> 72.576177285318565 | AD494: =(X494*4)+(Z494*2) -> 4
A495: BOX HILL | C495: BRYANT 4 | F495: HUNT 2 | H495: BOWYER-SMYTH 2 | L495: WHITE | N495: LOOMES | P495: GARDINER | R495: LA ROCHE | T495: CURRY
A496: CAULFIELD | C496: LOGAN 2 | F496: ROWE 2 | I496: ARRELL | K496: BAKER | M496: STONE
E497: 26TH JUNE | I497: WEATHER
A498: PRAHRAN | C498: 4 | D498: 2 | E498: =C498*6+D498 -> 26 | G498: 11 | H498: 6 | I498: =G498*6+H498 -> 72 | K498: 18 | L498: 6 | M498: =K498*6+L498 -> 114 | O498: 21 | P498: 12 | Q498: =O498*6+P498 -> 138 | S498: TOORAK PARK
A499: SUNSHINE | C499: 2 | D499: 4 | E499: =C499*6+D499 -> 16 | G499: 2 | H499: 5 | I499: =G499*6+H499 -> 17 | K499: 4 | L499: 9 | M499: =K499*6+L499 -> 33 | O499: 7 | P499: 11 | Q499: =O499*6+P499 -> 53
A500: BEST PLAYERS
A501: PRAHRAN | C501: SHEEDY | F501: GEISLER | I501: RYAN | L501: BUTLER | N501: KERLEY | P501: MINTON-CONNELL
A502: SUNSHINE | C502: GRAHAM | F502: HOWARD | I502: KENNEDY | L502: YOUNG | N502: LEGAWIECZ
A503: GOALKICKERS
A504: PRAHRAN | C504: VERWOERT 5 | F504: PEARSON 4 | I504: SHEEDY 3 | K504: RYAN 2 | M504: BUTLER 2 | O504: SKIDMORE 2 | R504: KERLEY | T504: HOEY | V504: O'BRIEN
A505: SUNSHINE | C505: GRAHAM 3 | F505: EDWARDS | I505: SLATTERY | L505: KENNEDY | N505: BERGFELD
A507: GEELONG WEST | C507: 1 | D507: 3 | E507: =C507*6+D507 -> 9 | G507: 5 | H507: 9 | I507: =G507*6+H507 -> 39 | K507: 8 | L507: 13 | M507: =K507*6+L507 -> 61 | O507: 11 | P507: 16 | Q507: =O507*6+P507 -> 82 | S507: GEELONG WEST
A508: MORDIALLOC | C508: 5 | D508: 2 | E508: =C508*6+D508 -> 32 | G508: 5 | H508: 5 | I508: =G508*6+H508 -> 35 | K508: 9 | L508: 7 | M508: =K508*6+L508 -> 61 | O508: 12 | P508: 9 | Q508: =O508*6+P508 -> 81
A509: BEST PLAYERS
A510: GEELONG WEST | C510: STACEY | F510: WILLIAMS | I510: NUSTELING | L510: COLTISH | N510: RAEBURN | Q510: GIBBONS
A511: MORDIALLOC | C511: STUDHAM | F511: DANCKERT | I511: O'BRIEN | L511: BAXTER | N511: GROVES | Q511: GRAY
A512: GOALKICKERS
A513: GEELONG WEST | C513: NUSTELING 6 | F513: STACEY 2 | I513: VAN T'HAG | L513: SYMES | N513: GIBBONS
A514: MORDIALLOC | C514: POWER 4 | F514: O'BRIEN 4 | I514: BACKMAN | L514: BAXTER | N514: DAVEY | P514: HYNES
A516: NORTHCOTE | C516: 2 | D516: 5 | E516: =C516*6+D516 -> 17 | G516: 4 | H516: 11 | I516: =G516*6+H516 -> 35 | K516: 7 | L516: 13 | M516: =K516*6+L516 -> 55 | O516: 11 | P516: 21 | Q516: =O516*6+P516 -> 87 | S516: WERRIBEE
A517: WERRIBEE | C517: 4 | D517: 2 | E517: =C517*6+D517 -> 26 | G517: 5 | H517: 6 | I517: =G517*6+H517 -> 36 | K517: 8 | L517: 11 | M517: =K517*6+L517 -> 59 | O517: 8 | P517: 11 | Q517: =O517*6+P517 -> 59
A518: BEST PLAYERS
A519: NORTHCOTE
A520: WERRIBEE
A521: GOALKICKERS
A522: NORTHCOTE
A523: WERRIBEE
A525: ROUND 12 | E525: 2ND JULY | J525: WEATHER | N525: S.E.BREEZE DULL | S525: PLAYED AT
D526: 1ST QTR | H526: 2ND QTR | L526: 3RD QTR | P526: FINAL | S526: TOORAK PARK
A527: PRAHRAN | C527: 3 | D527: 7 | E527: =C527*6+D527 -> 25 | G527: 6 | H527: 8 | I527: =G527*6+H527 -> 44 | K527: 8 | L527: 11 | M527: =K527*6+L527 -> 59 | O527: 12 | P527: 12 | Q527: =O527*6+P527 -> 84 | S527: UMPIRE | X527: LADDER | AB527: ROUND | AD527: 12
A528: BOX HILL | C528: 2 | D528: 4 | E528: =C528*6+D528 -> 16 | G528: 5 | H528: 9 | I528: =G528*6+H528 -> 39 | K528: 8 | L528: 12 | M528: =K528*6+L528 -> 60 | O528: 10 | P528: 16 | Q528: =O528*6+P528 -> 76
A529: BEST PLAYERS | W529: TEAM | X529: W | Y529: L | Z529: D | AA529: FOR | AB529: AGST | AC529: % | AD529: PTS
A530: PRAHRAN | C530: KIRBY | F530: BARTLETT | I530: GEISLER | L530: SKIDMORE | O530: ANDREW | Q530: WISHART
A531: BOX HILL | C531: I BATES | F531: WHITE | I531: GARDINER | L531: BOWYER-SMYTH | O531: BRYANT | Q531: HARRIS | W531: PRAHRAN | X531: 9 | Y531: 3 | Z531: 0 | AA531: 1062 | AB531: 878 | AC531: =(AA531*100)/AB531 -> 120.95671981776765 | AD531: =(X531*4)+(Z531*2) -> 36
A532: GOALKICKERS | W532: NORTHCOTE | X532: 8 | Y532: 4 | Z532: 0 | AA532: 1122 | AB532: 946 | AC532: =(AA532*100)/AB532 -> 118.6046511627907 | AD532: =(X532*4)+(Z532*2) -> 32
A533: PRAHRAN | C533: BARTLETT 5 | F533: PEARSON 4 | I533: SKIDMORE | L533: HARTNETT | N533: O'BRIEN | W533: MORDIALLOC | X533: 7 | Y533: 5 | Z533: 0 | AA533: 1140 | AB533: 958 | AC533: =(AA533*100)/AB533 -> 118.99791231732776 | AD533: =(X533*4)+(Z533*2) -> 28
A534: BOX HILL | C534: I BATES 4 | F534: WHITE 3 | I534: MACE | K534: BOWYER-SMYTH | N534: BRYANT | W534: FRANKSTON | X534: 7 | Y534: 5 | Z534: 0 | AA534: 1097 | AB534: 1020 | AC534: =(AA534*100)/AB534 -> 107.54901960784314 | AD534: =(X534*4)+(Z534*2) -> 28
A536: CAULFIELD | C536: 1 | D536: 3 | E536: =C536*6+D536 -> 9 | G536: 7 | H536: 9 | I536: =G536*6+H536 -> 51 | K536: 10 | L536: 10 | M536: =K536*6+L536 -> 70 | O536: 16 | P536: 17 | Q536: =O536*6+P536 -> 113 | S536: PRINCES PARK, CAULFIELD | W536: SUNSHINE | X536: 7 | Y536: 5 | Z536: 0 | AA536: 943 | AB536: 987 | AC536: =(AA536*100)/AB536 -> 95.542046605876394 | AD536: =(X536*4)+(Z536*2) -> 28
A537: FRANKSTON | C537: 3 | D537: 8 | E537: =C537*6+D537 -> 26 | G537: 4 | H537: 8 | I537: =G537*6+H537 -> 32 | K537: 5 | L537: 16 | M537: =K537*6+L537 -> 46 | O537: 7 | P537: 17 | Q537: =O537*6+P537 -> 59 | W537: GEELONG WEST | X537: 6 | Y537: 5 | Z537: 1 | AA537: 1182 | AB537: 975 | AC537: =(AA537*100)/AB537 -> 121.23076923076923 | AD537: =(X537*4)+(Z537*2) -> 26
A538: BEST PLAYERS | W538: BOX HILL | X538: 6 | Y538: 5 | Z538: 1 | AA538: 1086 | AB538: 1010 | AC538: =(AA538*100)/AB538 -> 107.52475247524752 | AD538: =(X538*4)+(Z538*2) -> 26
A539: CAULFIELD | C539: ROWE | F539: LOGAN | I539: BAKER | L539: DOUGLAS | O539: MELBOURNE | R539: AUGHTERSON | W539: CAULFIELD | X539: 4 | Y539: 8 | Z539: 0 | AA539: 913 | AB539: 1126 | AC539: =(AA539*100)/AB539 -> 81.083481349911196 | AD539: =(X539*4)+(Z539*2) -> 16
A540: FRANKSTON | C540: WHITE | F540: McHUGH | I540: ROBERTS | L540: McNABB | O540: BOWEN | R540: BOWES | W540: CAMBERWELL | X540: 4 | Y540: 8 | Z540: 0 | AA540: 1005 | AB540: 1326 | AC540: =(AA540*100)/AB540 -> 75.791855203619903 | AD540: =(X540*4)+(Z540*2) -> 16
A541: GOALKICKERS | W541: WERRIBEE | X541: 1 | Y541: 11 | Z541: 0 | AA541: 836 | AB541: 1246 | AC541: =(AA541*100)/AB541 -> 67.094703049759232 | AD541: =(X541*4)+(Z541*2) -> 4
A542: CAULFIELD | C542: ROWE 5 | E542: LOGAN 3 | G542: GASPARI 2 | J542: GOWAN 2 | L542: DOUGLAS 2 | O542: BAKER | Q542: ROYALS
A543: FRANKSTON | C543: McNABB 2 | F543: BOWEN 2 | I543: CRUNDEN | L543: THATCHER | O543: McHUGH
A545: GEELONG WEST | C545: 6 | D545: 9 | E545: =C545*6+D545 -> 45 | G545: 10 | H545: 11 | I545: =G545*6+H545 -> 71 | K545: 13 | L545: 17 | M545: =K545*6+L545 -> 95 | O545: 16 | P545: 19 | Q545: =O545*6+P545 -> 115 | S545: CAMBERWELL
A546: CAMBERWELL | C546: 0 | D546: 2 | E546: =C546*6+D546 -> 2 | G546: 5 | H546: 4 | I546: =G546*6+H546 -> 34 | K546: 8 | L546: 9 | M546: =K546*6+L546 -> 57 | O546: 10 | P546: 12 | Q546: =O546*6+P546 -> 72
A547: BEST PLAYERS
A548: GEELONG WEST | C548: BRUSHFIELD | F548: PETERS | I548: WILLIAMS | L548: STACEY | O548: NUSTELING | R548: BARKER
A549: CAMBERWELL | C549: ANDERSON | F549: COCKREM | I549: K SMITH | L549: O'NEILL | O549: DOUGLA | R549: J SMITH
A550: GOALKICKERS
A551: GEELONG WEST | C551: NUSTELING 4 | F551: BRUSHFIELD 4 | I551: STACEY 2 | K551: GIBBONS 2 | M551: GRAD 2 | O551: VAN T'HAG | R551: WILLIAMS
A552: CAMBERWELL | C552: O'NEILL 4 | F552: K SMITH 3 | I552: ADAMS | K552: ANDERSON | N552: J SMITH
E553: 3RD JULY | I553: WEATHER
A554: MORDIALLOC | C554: 8 | D554: 4 | E554: =C554*6+D554 -> 52 | G554: 11 | H554: 4 | I554: =G554*6+H554 -> 70 | K554: 18 | L554: 8 | M554: =K554*6+L554 -> 116 | O554: 25 | P554: 13 | Q554: =O554*6+P554 -> 163 | S554: MORDIALLOC
A555: WERRIBEE | C555: 1 | D555: 1 | E555: =C555*6+D555 -> 7 | G555: 5 | H555: 3 | I555: =G555*6+H555 -> 33 | K555: 5 | L555: 4 | M555: =K555*6+L555 -> 34 | O555: 7 | P555: 8 | Q555: =O555*6+P555 -> 50
A556: BEST PLAYERS
A557: MORDIALLOC | C557: O'BRIEN | F557: BAXTER | I557: BLAINEY | L557: POWER | O557: HYNES | R557: SHIREFFS
A558: WERRIBEE | C558: TURNER | F558: JAMMESON | I558: BRYAN | L558: DENT | O558: ANDERSON | R558: O'BRIEN
A559: GOALKICKERS
A560: MORDIALLOC | C560: POWER 7 | F560: O'BRIEN 5 | I560: BAXTER 4 | K560: HYNES 3 | M560: GRAY 2 | O560: CULPH 2 | Q560: LESLIE 2
A561: WERRIBEE | C561: PANTE 2 | F561: JAMMESON 2 | I561: HOLCOMBE | L561: GOULOPOLOUS | O561: STANFORD
A563: NORTHCOTE | C563: 4 | D563: 4 | E563: =C563*6+D563 -> 28 | G563: 7 | H563: 8 | I563: =G563*6+H563 -> 50 | K563: 9 | L563: 12 | M563: =K563*6+L563 -> 66 | O563: 17 | P563: 13 | Q563: =O563*6+P563 -> 115 | S563: SUNSHINE
A564: SUNSHINE | C564: 3 | D564: 1 | E564: =C564*6+D564 -> 19 | G564: 5 | H564: 4 | I564: =G564*6+H564 -> 34 | K564: 8 | L564: 8 | M564: =K564*6+L564 -> 56 | O564: 9 | P564: 12 | Q564: =O564*6+P564 -> 66
A565: BEST PLAYERS
A566: NORTHCOTE | C566: SLEEP | F566: McBREEN | I566: KEANE | L566: PITTS | O566: N HENRY | R566: WHITE
A567: SUNSHINE | C567: SLATTERY | F567: TREZISE | I567: CLEMSON | L567: HOWARD | O567: BENSON | R567: DARUL
A568: GOALKICKERS
A569: NORTHCOTE | C569: KEANE 6 | F569: CALVERLEY 3 | I569: CRAMERI 2 | L569: SLEEP 2 | N569: ECCLES | P569: N WHITE | R569: LACHMUND | U569: HENRY
A570: SUNSHINE | C570: GRAHAM 2 | F570: HOWARD 2 | I570: TREZISE | K570: CROSBIE | M570: N CLEMSON | P570: BROTCHIE | R570: KENNDY
A572: ROUND 13 | E572: 9TH JULY | J572: WEATHER | N572: S.E.BREEZE DULL | S572: PLAYED AT
D573: 1ST QTR | H573: 2ND QTR | L573: 3RD QTR | P573: FINAL | S573: BOX HILL
A574: BOX HILL | C574: 11 | D574: 2 | E574: =C574*6+D574 -> 68 | G574: 14 | H574: 8 | I574: =G574*6+H574 -> 92 | K574: 17 | L574: 12 | M574: =K574*6+L574 -> 114 | O574: 22 | P574: 19 | Q574: =O574*6+P574 -> 151 | S574: UMPIRE | X574: LADDER | AB574: ROUND | AD574: 13
A575: SUNSHINE | C575: 1 | D575: 2 | E575: =C575*6+D575 -> 8 | G575: 3 | H575: 3 | I575: =G575*6+H575 -> 21 | K575: 4 | L575: 6 | M575: =K575*6+L575 -> 30 | O575: 6 | P575: 7 | Q575: =O575*6+P575 -> 43
A576: BEST PLAYERS | W576: TEAM | X576: W | Y576: L | Z576: D | AA576: FOR | AB576: AGST | AC576: % | AD576: PTS
A577: BOX HILL | C577: GARDINER | F577: BOWYER-SMYTH | J577: BRYANT | M577: C FELLOWS | P577: I BATES | R577: LEHMAN
A578: SUNSHINE | C578: SLATTERY | F578: HOWARD | I578: McGARRITY | L578: OVERS | N578: YOUNG | W578: NORTHCOTE | X578: 9 | Y578: 4 | Z578: 0 | AA578: 1260 | AB578: 1059 | AC578: =(AA578*100)/AB578 -> 118.98016997167139 | AD578: =(X578*4)+(Z578*2) -> 36
A579: GOALKICKERS | L579: McCURRY | O579: LA ROCHE | R579: WHITE | W579: PRAHRAN | X579: 9 | Y579: 4 | Z579: 0 | AA579: 1146 | AB579: 976 | AC579: =(AA579*100)/AB579 -> 117.41803278688525 | AD579: =(X579*4)+(Z579*2) -> 36
A580: BOX HILL | C580: BOWYER-SMYTH 4 | G580: BRYANT 3 | J580: I BATES 3 | L580: HUNT 3 | N580: C FELLOWS 2 | Q580: LOOMES 2 | S580: GARDINER | W580: FRANKSTON | X580: 8 | Y580: 5 | Z580: 0 | AA580: 1195 | AB580: 1104 | AC580: =(AA580*100)/AB580 -> 108.24275362318841 | AD580: =(X580*4)+(Z580*2) -> 32
A581: SUNSHINE | C581: SLATTERY 3 | F581: LEGAWIECZ | I581: OVERS | K581: CROSBIE | W581: GEELONG WEST | X581: 7 | Y581: 5 | Z581: 1 | AA581: 1310 | AB581: 1047 | AC581: =(AA581*100)/AB581 -> 125.11938872970391 | AD581: =(X581*4)+(Z581*2) -> 30
A583: FRANKSTON | C583: 3 | D583: 4 | E583: =C583*6+D583 -> 22 | G583: 6 | H583: 5 | I583: =G583*6+H583 -> 41 | K583: 10 | L583: 8 | M583: =K583*6+L583 -> 68 | O583: 14 | P583: 14 | Q583: =O583*6+P583 -> 98 | S583: FRANKSTON | W583: BOX HILL | X583: 7 | Y583: 5 | Z583: 1 | AA583: 1237 | AB583: 1053 | AC583: =(AA583*100)/AB583 -> 117.47388414055081 | AD583: =(X583*4)+(Z583*2) -> 30
A584: PRAHRAN | C584: 1 | D584: 1 | E584: =C584*6+D584 -> 7 | G584: 5 | H584: 7 | I584: =G584*6+H584 -> 37 | K584: 9 | L584: 10 | M584: =K584*6+L584 -> 64 | O584: 12 | P584: 12 | Q584: =O584*6+P584 -> 84 | W584: MORDIALLOC | X584: 7 | Y584: 6 | Z584: 0 | AA584: 1253 | AB584: 1096 | AC584: =(AA584*100)/AB584 -> 114.32481751824818 | AD584: =(X584*4)+(Z584*2) -> 28
A585: BEST PLAYERS | W585: SUNSHINE | X585: 7 | Y585: 6 | Z585: 0 | AA585: 986 | AB585: 1138 | AC585: =(AA585*100)/AB585 -> 86.643233743409496 | AD585: =(X585*4)+(Z585*2) -> 28
A586: FRANKSTON | C586: McNABB | F586: ROBERTS | I586: McHUGH | L586: COUNTY | O586: WATSON | R586: SLADE | W586: CAULFIELD | X586: 4 | Y586: 9 | Z586: 0 | AA586: 985 | AB586: 1254 | AC586: =(AA586*100)/AB586 -> 78.548644338118024 | AD586: =(X586*4)+(Z586*2) -> 16
A587: PRAHRAN | C587: MOONEY | F587: BARTLETT | I587: PEARSON | L587: SEEDY | O587: HARTNETT | R587: RICHARDSON | W587: CAMBERWELL | X587: 4 | Y587: 9 | Z587: 0 | AA587: 1100 | AB587: 1431 | AC587: =(AA587*100)/AB587 -> 76.869322152341027 | AD587: =(X587*4)+(Z587*2) -> 16
A588: GOALKICKERS | W588: WERRIBEE | X588: 2 | Y588: 11 | Z588: 0 | AA588: 941 | AB588: 1341 | AC588: =(AA588*100)/AB588 -> 70.171513795674869 | AD588: =(X588*4)+(Z588*2) -> 8
A589: FRANKSTON | C589: McNABB 4 | F589: PAYNE 3 | I589: McHUGH 2 | L589: EPSTEIN | N589: ROHAN | P589: HUGHES | R589: COUNTY | T589: KERR
A590: PRAHRAN | C590: PEARSON 4 | F590: SEEDY 2 | I590: HARTNETT | L590: BARTLETT | N590: BUTLER | P590: GLOVER | R590: ADAMS
A592: GEELONG WEST | C592: 5 | D592: 6 | E592: =C592*6+D592 -> 36 | G592: 9 | H592: 8 | I592: =G592*6+H592 -> 62 | K592: 15 | L592: 13 | M592: =K592*6+L592 -> 103 | O592: 19 | P592: 14 | Q592: =O592*6+P592 -> 128 | S592: GEELONG WEST
A593: CAULFIELD | C593: 0 | D593: 1 | E593: =C593*6+D593 -> 1 | G593: 3 | H593: 2 | I593: =G593*6+H593 -> 20 | K593: 6 | L593: 2 | M593: =K593*6+L593 -> 38 | O593: 11 | P593: 6 | Q593: =O593*6+P593 -> 72
A594: BEST PLAYERS
A595: GEELONG WEST | C595: WILLIAMS | F595: NUSTELING | I595: SALTER | L595: BRUSHFIELD | O595: RAEBURN | Q595: NICHOLLS
A596: CAULFIELD | C596: BAKER | F596: STONE | I596: ROWE | L596: GASPARI
A597: GOALKICKERS
A598: GEELONG WEST | C598: NUSTELING 5 | F598: GIBBONS 4 | I598: BRUSHFIELD 3 | L598: STACEY 3 | N598: BUSH | P598: VAN T'HAG | S598: WILLIAMS | V598: SALTER
A599: CAULFIELD | C599: ? 3 | F599: STONE 3 | I599: ROWE | K599: BAKER | M599: GASPARI | O599: ARRELL | Q599: SUTHERLAND
A601: WERRIBEE | C601: 6 | D601: 5 | E601: =C601*6+D601 -> 41 | G601: 9 | H601: 7 | I601: =G601*6+H601 -> 61 | K601: 12 | L601: 8 | M601: =K601*6+L601 -> 80 | O601: 16 | P601: 9 | Q601: =O601*6+P601 -> 105 | S601: WERRIBEE
A602: CAMBERWELL | C602: 2 | D602: 0 | E602: =C602*6+D602 -> 12 | G602: 7 | H602: 1 | I602: =G602*6+H602 -> 43 | K602: 11 | L602: 5 | M602: =K602*6+L602 -> 71 | O602: 15 | P602: 5 | Q602: =O602*6+P602 -> 95
A603: BEST PLAYERS
A604: WERRIBEE | C604: OGILVIE | F604: TURNER | I604: JAMMESON | L604: ANDERSON | O604: DENT | Q604: TYQUIN
A605: CAMBERWELL | C605: O'NEILL | F605: COCKREM | I605: DOUGLAS | L605: GIBSON | O605: WINKLEMAN | R605: J SMITH
A606: GOALKICKERS
A607: WERRIBEE | C607: LYONS 3 | F607: ? 3 | G607: PANTE 2 | J607: GOULOPOLOUS 2 | N607: K O'BRIEN 2 | Q607: BRYAN | S607: JAMMESON | V607: AUGHTERSON | X607: DENT
A608: CAMBERWELL | C608: O'NEILL 8 | F608: WINKLEMAN 2 | I608: J SMITH | K608: FRIEBERG | M608: FILLIPONE | P608: COCKREM | R608: ADAMS
E609: 10TH JULY | J609: WEATHER
A610: NORTHCOTE | C610: 4 | D610: 4 | E610: =C610*6+D610 -> 28 | G610: 10 | H610: 6 | I610: =G610*6+H610 -> 66 | K610: 17 | L610: 7 | M610: =K610*6+L610 -> 109 | O610: 21 | P610: 12 | Q610: =O610*6+P610 -> 138 | S610: NORTHCOTE
A611: MORDIALLOC | C611: 4 | D611: 5 | E611: =C611*6+D611 -> 29 | G611: 8 | H611: 8 | I611: =G611*6+H611 -> 56 | K611: 13 | L611: 8 | M611: =K611*6+L611 -> 86 | O611: 17 | P611: 11 | Q611: =O611*6+P611 -> 113
A612: BEST PLAYERS
A613: NORTHCOTE | C613: CRAMERI | F613: CALVERLEY | I613: SLEEP | L613: WHITE | O613: ? | R613: HENRY
A614: MORDIALLOC | C614: GIBSON | F614: GRAY | I614: CULPH | L614: DANCKERT | O614: STUDHAM | R614: GROVES
A615: GOALKICKERS
A616: NORTHCOTE | C616: CRAMERI 5 | F616: CALVERLEY 5 | I616: HENRY 2 | K616: PITTS 2 | M616: KEANE 2 | O616: LACHMUND 2 | R616: N WHITE | T616: THOMPSON | W616: SLEEP
A617: MORDIALLOC | C617: O'BRIEN 6 | F617: POWER 3 | I617: LAIRD 2 | K617: ? 2 | M617: STUDHAM | P617: CULPH | R617: HYNES | T617: RIDDLE
A619: ROUND 14 | E619: 16TH JULY | J619: WEATHER | N619: S.E.BREEZE DULL | S619: PLAYED AT
D620: 1ST QTR | H620: 2ND QTR | L620: 3RD QTR | P620: FINAL | S620: CAMBERWELL
A621: NORTHCOTE | C621: 4 | D621: 6 | E621: =C621*6+D621 -> 30 | G621: 8 | H621: 8 | I621: =G621*6+H621 -> 56 | K621: 9 | L621: 14 | M621: =K621*6+L621 -> 68 | O621: 12 | P621: 15 | Q621: =O621*6+P621 -> 87 | S621: UMPIRE | X621: LADDER | AB621: ROUND | AD621: 14
A622: CAMBERWELL | C622: 3 | D622: 1 | E622: =C622*6+D622 -> 19 | G622: 8 | H622: 4 | I622: =G622*6+H622 -> 52 | K622: 10 | L622: 7 | M622: =K622*6+L622 -> 67 | O622: 12 | P622: 9 | Q622: =O622*6+P622 -> 81
A623: BEST PLAYERS | W623: TEAM | X623: W | Y623: L | Z623: D | AA623: FOR | AB623: AGST | AC623: % | AD623: PTS
A624: NORTHCOTE | C624: CRAMERI | F624: THOMPSON | I624: BEECHER | L624: PITTS | N624: W ? | Q624: SLEEP
A625: CAMBERWELL | C625: DOUGLAS | F625: WITHERS | I625: O'NEILL | L625: D BOYD | N625: J SMITH | Q625: EWINSON | W625: NORTHCOTE | X625: 10 | Y625: 4 | Z625: 0 | AA625: 1347 | AB625: 1140 | AC625: =(AA625*100)/AB625 -> 118.15789473684211 | AD625: =(X625*4)+(Z625*2) -> 40
A626: GOALKICKERS | W626: PRAHRAN | X626: 9 | Y626: 5 | Z626: 0 | AA626: 1214 | AB626: 1057 | AC626: =(AA626*100)/AB626 -> 114.85335856196784 | AD626: =(X626*4)+(Z626*2) -> 36
A627: NORTHCOTE | C627: CRAMERI 5 | F627: KEANE 3 | I627: CALVERLEY 2 | L627: HENRY | N627: PITTS | W627: BOX HILL | X627: 8 | Y627: 5 | Z627: 1 | AA627: 1349 | AB627: 1076 | AC627: =(AA627*100)/AB627 -> 125.37174721189591 | AD627: =(X627*4)+(Z627*2) -> 34
A628: CAMBERWELL | C628: O'NEILL 5 | F628: FILLIPONE 3 | I628: WINKLEMAN 2 | L628: W ADAMS | O628: WITHERS | W628: GEELONG WEST | X628: 8 | Y628: 5 | Z628: 1 | AA628: 1391 | AB628: 1115 | AC628: =(AA628*100)/AB628 -> 124.75336322869956 | AD628: =(X628*4)+(Z628*2) -> 34
A630: BOX HILL | C630: 4 | D630: 3 | E630: =C630*6+D630 -> 27 | G630: 8 | H630: 9 | I630: =G630*6+H630 -> 57 | K630: 11 | L630: 13 | M630: =K630*6+L630 -> 79 | O630: 16 | P630: 16 | Q630: =O630*6+P630 -> 112 | S630: FRANKSTON | W630: FRANKSTON | X630: 8 | Y630: 6 | Z630: 0 | AA630: 1218 | AB630: 1216 | AC630: =(AA630*100)/AB630 -> 100.16447368421052 | AD630: =(X630*4)+(Z630*2) -> 32
A631: FRANKSTON | C631: 1 | D631: 3 | E631: =C631*6+D631 -> 9 | G631: 3 | H631: 5 | I631: =G631*6+H631 -> 23 | K631: 3 | L631: 5 | M631: =K631*6+L631 -> 23 | O631: 3 | P631: 5 | Q631: =O631*6+P631 -> 23 | W631: SUNSHINE | X631: 8 | Y631: 6 | Z631: 0 | AA631: 1056 | AB631: 1182 | AC631: =(AA631*100)/AB631 -> 89.340101522842644 | AD631: =(X631*4)+(Z631*2) -> 32
A632: BEST PLAYERS | W632: MORDIALLOC | X632: 7 | Y632: 7 | Z632: 0 | AA632: 1297 | AB632: 1166 | AC632: =(AA632*100)/AB632 -> 111.23499142367066 | AD632: =(X632*4)+(Z632*2) -> 28
A633: BOX HILL | C633: LA ROCHE | F633: WHITE | I633: O'NEILL | K633: GARDINER | N633: I BATES | Q633: BOWYER-SMYTH | W633: CAULFIELD | X633: 4 | Y633: 9 | Z633: 1 | AA633: 1055 | AB633: 1324 | AC633: =(AA633*100)/AB633 -> 79.682779456193359 | AD633: =(X633*4)+(Z633*2) -> 18
A634: FRANKSTON | C634: PAYNE | F634: McNABB | I634: KERR | K634: CRUNDEN | N634: WHITE | Q634: WATSON | W634: CAMBERWELL | X634: 4 | Y634: 10 | Z634: 0 | AA634: 1181 | AB634: 1518 | AC634: =(AA634*100)/AB634 -> 77.799736495388672 | AD634: =(X634*4)+(Z634*2) -> 16
A635: GOALKICKERS | W635: WERRIBEE | X635: 2 | Y635: 11 | Z635: 1 | AA635: 1011 | AB635: 1411 | AC635: =(AA635*100)/AB635 -> 71.651311126860378 | AD635: =(X635*4)+(Z635*2) -> 10
A636: BOX HILL | C636: BRYANT 4 | F636: LA ROCHE 3 | I636: RALPH 3 | K636: I BATES 2 | M636: GARDINER | P636: LOOMES | R636: HUNT | T636: M ? 1
A637: FRANKSTON | C637: McNABB | F637: PAYNE | I637: BOWEN
A639: CAULFIELD | C639: 4 | D639: 3 | E639: =C639*6+D639 -> 27 | G639: 4 | H639: 4 | I639: =G639*6+H639 -> 28 | K639: 7 | L639: 7 | M639: =K639*6+L639 -> 49 | O639: 10 | P639: 10 | Q639: =O639*6+P639 -> 70 | S639: PRINCES PARK, CAULFIELD
A640: WERRIBEE | C640: 5 | D640: 3 | E640: =C640*6+D640 -> 33 | G640: 8 | H640: 7 | I640: =G640*6+H640 -> 55 | K640: 10 | L640: 7 | M640: =K640*6+L640 -> 67 | O640: 10 | P640: 10 | Q640: =O640*6+P640 -> 70
A641: BEST PLAYERS
A642: CAULFIELD | C642: BAKER | F642: EVANS | I642: GRAY | L642: STONE | N642: AUGHTERSON | Q642: MELBOURNE
A643: WERRIBEE | C643: LYONS | F643: TYQUIN | I643: ANDERSON | L643: OGILVIE | N643: SMITH | Q643: TURNER
A644: GOALKICKERS
A645: CAULFIELD | C645: ROYALS 3 | F645: ROWE 2 | I645: FARY 2 | K645: STONE | M645: BAKER | O645: SUTHERLAND
A646: WERRIBEE | C646: LYONS 4 | F646: O'BRIEN 2 | I646: OGILVIE 2 | L646: BRYAN | N646: TYQUIN
E647: 17TH JULY | I647: WEATHER
A648: GEELONG WEST | C648: 5 | D648: 4 | E648: =C648*6+D648 -> 34 | G648: 8 | H648: 6 | I648: =G648*6+H648 -> 54 | K648: 10 | L648: 9 | M648: =K648*6+L648 -> 69 | O648: 12 | P648: 9 | Q648: =O648*6+P648 -> 81 | S648: TOORAK PARK
A649: PRAHRAN | C649: 1 | D649: 1 | E649: =C649*6+D649 -> 7 | G649: 6 | H649: 6 | I649: =G649*6+H649 -> 42 | K649: 8 | L649: 6 | M649: =K649*6+L649 -> 54 | O649: 10 | P649: 8 | Q649: =O649*6+P649 -> 68
A650: BEST PLAYERS
A651: GEELONG WEST | C651: STACEY | F651: SNELL | I651: WILLIAMS | L651: BRUSHFIELD | O651: RAEBURN | R651: NICHOLLS
A652: PRAHRAN | C652: O'BRIEN | F652: KIRBY | I652: HARTNETT | L652: McMAHON | O652: BARTLETT | R652: BUTLER
A653: GOALKICKERS
A654: GEELONG WEST | C654: SNELL 4 | E654: NUSTELING 4 | H654: STACEY 3 | K654: SALTER
A655: PRAHRAN | C655: BUTLER 4 | F655: PEARSON 3 | I655: SHEEDY | K655: RICHARDSON | N655: HARTNETT
A657: SUNSHINE | C657: 4 | D657: 3 | E657: =C657*6+D657 -> 27 | G657: 4 | H657: 6 | I657: =G657*6+H657 -> 30 | K657: 9 | L657: 8 | M657: =K657*6+L657 -> 62 | O657: 10 | P657: 10 | Q657: =O657*6+P657 -> 70 | S657: MORDIALLOC
A658: MORDIALLOC | C658: 2 | D658: 2 | E658: =C658*6+D658 -> 14 | G658: 2 | H658: 4 | I658: =G658*6+H658 -> 16 | K658: 4 | L658: 5 | M658: =K658*6+L658 -> 29 | O658: 6 | P658: 8 | Q658: =O658*6+P658 -> 44
A659: BEST PLAYERS
A660: SUNSHINE | C660: HIPWORTH | F660: DARUL | I660: HOWARD | L660: WROBLEWSKI | O660: ? | R660: TREZISE
A661: MORDIALLOC | C661: DANCKERT | F661: SHIREFFS | I661: STUDHAM | L661: GRAY | O661: WILLIAMS | R661: GRANGER
A662: GOALKICKERS
A663: SUNSHINE | C663: TREZISE 2 | F663: HOWARD 2 | I663: GRAHAM 2 | L663: ? 1 | N663: GREGORY | P663: W HARRIS | S663: SLATTERY
A664: MORDIALLOC | C664: O'BRIEN 2 | F664: HYNES 2 | I664: GRAY | K664: POWER
A666: ROUND 15 | E666: 23RD JULY | J666: WEATHER | N666: S.E.BREEZE DULL | S666: PLAYED AT
D667: 1ST QTR | H667: 2ND QTR | L667: 3RD QTR | P667: FINAL | S667: MORDIALLOC
A668: MORDIALLOC | C668: 1 | D668: 0 | E668: =C668*6+D668 -> 6 | G668: 8 | H668: 10 | I668: =G668*6+H668 -> 58 | K668: 10 | L668: 12 | M668: =K668*6+L668 -> 72 | O668: 17 | P668: 19 | Q668: =O668*6+P668 -> 121 | S668: UMPIRE | X668: LADDER | AB668: ROUND | AD668: 15
A669: CAMBERWELL | C669: 3 | D669: 5 | E669: =C669*6+D669 -> 23 | G669: 3 | H669: 6 | I669: =G669*6+H669 -> 24 | K669: 8 | L669: 7 | M669: =K669*6+L669 -> 55 | O669: 9 | P669: 8 | Q669: =O669*6+P669 -> 62
A670: BEST PLAYERS | W670: TEAM | X670: W | Y670: L | Z670: D | AA670: FOR | AB670: AGST | AC670: % | AD670: PTS
A671: MORDIALLOC | C671: DANCKERT | F671: GRANGER | I671: O'BRIEN | L671: WILLIAMS | O671: HYNES | Q671: SHIREFFS
A672: CAMBERWELL | C672: J SMITH | F672: O'NEILL | I672: WINKLEMAN | L672: DE COSTA | O672: GIBSON | Q672: DOUGLAS | W672: PRAHRAN | X672: 10 | Y672: 5 | Z672: 0 | AA672: 1291 | AB672: 1095 | AC672: =(AA672*100)/AB672 -> 117.89954337899543 | AD672: =(X672*4)+(Z672*2) -> 40
A673: GOALKICKERS | W673: NORTHCOTE | X673: 10 | Y673: 5 | Z673: 0 | AA673: 1395 | AB673: 1202 | AC673: =(AA673*100)/AB673 -> 116.05657237936772 | AD673: =(X673*4)+(Z673*2) -> 40
A674: MORDIALLOC | C674: O'BRIEN 4 | E674: LESLIE 4 | G674: HYNES 3 | I674: LAIRD 2 | K674: GRANGER | M674: GRAY | O674: WILLIAMS | R674: POWER | W674: GEELONG WEST | X674: 9 | Y674: 5 | Z674: 1 | AA674: 1527 | AB674: 1185 | AC674: =(AA674*100)/AB674 -> 128.86075949367088 | AD674: =(X674*4)+(Z674*2) -> 38
A675: CAMBERWELL | C675: O'NEILL 4 | F675: WINKLEMAN 3 | J675: D BOYD | M675: W ADAMS | W675: SUNSHINE | X675: 9 | Y675: 6 | Z675: 0 | AA675: 1134 | AB675: 1200 | AC675: =(AA675*100)/AB675 -> 94.5 | AD675: =(X675*4)+(Z675*2) -> 36
A677: GEELONG WEST | C677: 7 | D677: 4 | E677: =C677*6+D677 -> 46 | G677: 11 | H677: 10 | I677: =G677*6+H677 -> 76 | K677: 16 | L677: 18 | M677: =K677*6+L677 -> 114 | O677: 19 | P677: 22 | Q677: =O677*6+P677 -> 136 | S677: GEELONG WEST | W677: BOX HILL | X677: 8 | Y677: 6 | Z677: 1 | AA677: 1419 | AB677: 1212 | AC677: =(AA677*100)/AB677 -> 117.07920792079207 | AD677: =(X677*4)+(Z677*2) -> 34
A678: BOX HILL | C678: 0 | D678: 5 | E678: =C678*6+D678 -> 5 | G678: 2 | H678: 12 | I678: =G678*6+H678 -> 24 | K678: 3 | L678: 13 | M678: =K678*6+L678 -> 31 | O678: 9 | P678: 16 | Q678: =O678*6+P678 -> 70 | W678: MORDIALLOC | X678: 8 | Y678: 7 | Z678: 0 | AA678: 1418 | AB678: 1228 | AC678: =(AA678*100)/AB678 -> 115.47231270358306 | AD678: =(X678*4)+(Z678*2) -> 32
A679: BEST PLAYERS | W679: FRANKSTON | X679: 8 | Y679: 7 | Z679: 0 | AA679: 1236 | AB679: 1294 | AC679: =(AA679*100)/AB679 -> 95.517774343122099 | AD679: =(X679*4)+(Z679*2) -> 32
A680: GEELONG WEST | C680: VAN T'HAG | F680: WILLIAMS | I680: GIBBONS | L680: BRUSHFIELD | O680: STACEY | Q680: RAEBURN | W680: CAULFIELD | X680: 5 | Y680: 9 | Z680: 1 | AA680: 1117 | AB680: 1372 | AC680: =(AA680*100)/AB680 -> 81.413994169096213 | AD680: =(X680*4)+(Z680*2) -> 22
A681: BOX HILL | C681: GARDINER | F681: I BATES | I681: HARRIS | L681: LA ROCHE | O681: WHITE | Q681: McCURRY | W681: CAMBERWELL | X681: 4 | Y681: 11 | Z681: 0 | AA681: 1243 | AB681: 1639 | AC681: =(AA681*100)/AB681 -> 75.838926174496649 | AD681: =(X681*4)+(Z681*2) -> 16
A682: GOALKICKERS | R682: VAN T'HAG | W682: WERRIBEE | X682: 2 | Y682: 12 | Z682: 1 | AA682: 1049 | AB682: 1488 | AC682: =(AA682*100)/AB682 -> 70.497311827956992 | AD682: =(X682*4)+(Z682*2) -> 10
A683: GEELONG WEST | C683: GIBBONS 6 | F683: BRUSHFIELD 4 | I683: NUSTELING 3 | L683: BUSH | N683: STACEY | P683: SALTER | R683: WILLIAMS | T683: SNELL
A684: BOX HILL | C684: I BATES 3 | F684: BRYANT 2 | I684: GARDINER | L684: LOOMES | N684: LA ROCHE | Q684: GRAY
E685: 24TH JULY | I685: WEATHER
A686: CAULFIELD | C686: 1 | D686: 3 | E686: =C686*6+D686 -> 9 | G686: 4 | H686: 13 | I686: =G686*6+H686 -> 37 | K686: 5 | L686: 20 | M686: =K686*6+L686 -> 50 | O686: 7 | P686: 20 | Q686: =O686*6+P686 -> 62 | S686: NORTHCOTE
A687: NORTHCOTE | C687: 1 | D687: 2 | E687: =C687*6+D687 -> 8 | G687: 2 | H687: 5 | I687: =G687*6+H687 -> 17 | K687: 2 | L687: 10 | M687: =K687*6+L687 -> 22 | O687: 6 | P687: 12 | Q687: =O687*6+P687 -> 48
A688: BEST PLAYERS
A689: CAULFIELD | C689: FARY | F689: DE BONDE | I689: STONE | L689: GOWAN | O689: AUGHTERSON | R689: ROWE
A690: NORTHCOTE | C690: CRAMERI | F690: THOMPSON | I690: BEECHER | L690: MICKLESON | O690: SLEEP | R690: BRUSH
A691: GOALKICKERS
A692: CAULFIELD | C692: FARY 2 | F692: BAKER | I692: GOWAN | K692: SUTHERLAND | N692: ROYALS | P692: ROWE
A693: NORTHCOTE | C693: MICKLESON 2 | F693: CALVERLEY | I693: HENRY | K693: SLEEP | M693: ECCLES
A695: PRAHRAN | C695: 4 | D695: 2 | E695: =C695*6+D695 -> 26 | G695: 6 | H695: 6 | I695: =G695*6+H695 -> 42 | K695: 8 | L695: 8 | M695: =K695*6+L695 -> 56 | O695: 11 | P695: 11 | Q695: =O695*6+P695 -> 77 | S695: WERRIBEE
A696: WERRIBEE | C696: 2 | D696: 3 | E696: =C696*6+D696 -> 15 | G696: 5 | H696: 2 | I696: =G696*6+H696 -> 32 | K696: 5 | L696: 4 | M696: =K696*6+L696 -> 34 | O696: 5 | P696: 8 | Q696: =O696*6+P696 -> 38
A697: BEST PLAYERS
A698: PRAHRAN | C698: GEISLER | F698: KIRBY | I698: CULPIN | L698: PEARSON | O698: SKIDMORE | R698: SHEEDY
A699: WERRIBEE | C699: GILLETT | F699: DOVE | I699: LYONS | L699: TURNER | O699: SMITH | R699: ANDERSON
A700: GOALKICKERS
A701: PRAHRAN | C701: PEARSON 6 | F701: VERWOERT 2 | I701: BARTLETT | L701: BUTLER | N701: SHEEDY
A702: WERRIBEE | C702: GOULOPOLOUS 2 | F702: LYONS | I702: K O'BRIEN | L702: OGILVIE
A704: SUNSHINE | C704: 1 | D704: 2 | E704: =C704*6+D704 -> 8 | G704: 4 | H704: 9 | I704: =G704*6+H704 -> 33 | K704: 6 | L704: 11 | M704: =K704*6+L704 -> 47 | O704: 11 | P704: 12 | Q704: =O704*6+P704 -> 78 | S704: SUNSHINE
A705: FRANKSTON | C705: 1 | D705: 2 | E705: =C705*6+D705 -> 8 | G705: 1 | H705: 2 | I705: =G705*6+H705 -> 8 | K705: 1 | L705: 5 | M705: =K705*6+L705 -> 11 | O705: 2 | P705: 6 | Q705: =O705*6+P705 -> 18
A706: BEST PLAYERS
A707: SUNSHINE | C707: ROACH | F707: OVERS | I707: DARUL | L707: CROSBIE | O707: HOWARD | R707: HUTCHISON
A708: FRANKSTON | C708: BOWEN | F708: SLADE | I708: COULSON | L708: KERR | O708: McHUGH | R708: WHITE
A709: GOALKICKERS
A710: SUNSHINE | C710: CROSBIE 3 | F710: OVERS 3 | I710: W HARRIS 2 | L710: FITZGERALD 2 | O710: GRAHAM
A711: FRANKSTON | C711: BOWEN 2
A713: ROUND 16 | E713: 30TH JULY | J713: WEATHER | N713: S.E.BREEZE DULL | S713: PLAYED AT
D714: 1ST QTR | H714: 2ND QTR | L714: 3RD QTR | P714: FINAL | S714: CAMBERWELL
A715: SUNSHINE | C715: 2 | D715: 1 | E715: =C715*6+D715 -> 13 | G715: 6 | H715: 6 | I715: =G715*6+H715 -> 42 | K715: 12 | L715: 9 | M715: =K715*6+L715 -> 81 | O715: 15 | P715: 13 | Q715: =O715*6+P715 -> 103 | S715: UMPIRE | X715: LADDER | AB715: ROUND | AD715: 16
A716: CAMBERWELL | C716: 3 | D716: 6 | E716: =C716*6+D716 -> 24 | G716: 4 | H716: 9 | I716: =G716*6+H716 -> 33 | K716: 6 | L716: 12 | M716: =K716*6+L716 -> 48 | O716: 9 | P716: 13 | Q716: =O716*6+P716 -> 67
A717: BEST PLAYERS | W717: TEAM | X717: W | Y717: L | Z717: D | AA717: FOR | AB717: AGST | AC717: % | AD717: PTS
A718: SUNSHINE | C718: HIPWORTH | F718: FITZGERALD | I718: HUTCHISON | L718: DARUL | N718: SLATTERY | Q718: W HARRIS
A719: CAMBERWELL | C719: WITHERS | F719: J SMITH | I719: COCKREM | L719: DOUGLAS | N719: KISS | Q719: WINKLEMAN | W719: NORTHCOTE | X719: 11 | Y719: 5 | Z719: 0 | AA719: 1514 | AB719: 1254 | AC719: =(AA719*100)/AB719 -> 120.73365231259969 | AD719: =(X719*4)+(Z719*2) -> 44
A720: GOALKICKERS | W720: GEELONG WEST | X720: 10 | Y720: 5 | Z720: 1 | AA720: 1637 | AB720: 1251 | AC720: =(AA720*100)/AB720 -> 130.85531574740207 | AD720: =(X720*4)+(Z720*2) -> 42
A721: SUNSHINE | C721: W HARRIS 6 | F721: GRAHAM 2 | H721: SLATTERY 2 | K721: FITZGERALD | N721: OVERS | P721: CROSBIE | R721: GREGORY | T721: HIPWORTH | W721: PRAHRAN | X721: 10 | Y721: 6 | Z721: 0 | AA721: 1343 | AB721: 1214 | AC721: =(AA721*100)/AB721 -> 110.62602965403624 | AD721: =(X721*4)+(Z721*2) -> 40
A722: CAMBERWELL | C722: WITHERS 3 | F722: PECK 2 | H722: O'NEILL | J722: FILLIPONE | M722: W ADAMS | P722: WINKELMAN | W722: SUNSHINE | X722: 10 | Y722: 6 | Z722: 0 | AA722: 1237 | AB722: 1267 | AC722: =(AA722*100)/AB722 -> 97.632202052091557 | AD722: =(X722*4)+(Z722*2) -> 40
A724: MORDIALLOC | C724: 3 | D724: 4 | E724: =C724*6+D724 -> 22 | G724: 8 | H724: 10 | I724: =G724*6+H724 -> 58 | K724: 13 | L724: 11 | M724: =K724*6+L724 -> 89 | O724: 16 | P724: 13 | Q724: =O724*6+P724 -> 109 | S724: PRINCES PARK, CAULFIELD | W724: BOX HILL | X724: 9 | Y724: 6 | Z724: 1 | AA724: 1545 | AB724: 1253 | AC724: =(AA724*100)/AB724 -> 123.30407023144453 | AD724: =(X724*4)+(Z724*2) -> 38
A725: CAULFIELD | C725: 2 | D725: 4 | E725: =C725*6+D725 -> 16 | G725: 3 | H725: 5 | I725: =G725*6+H725 -> 23 | K725: 6 | L725: 7 | M725: =K725*6+L725 -> 43 | O725: 6 | P725: 13 | Q725: =O725*6+P725 -> 49 | W725: MORDIALLOC | X725: 9 | Y725: 7 | Z725: 0 | AA725: 1527 | AB725: 1277 | AC725: =(AA725*100)/AB725 -> 119.57713390759592 | AD725: =(X725*4)+(Z725*2) -> 36
A726: BEST PLAYERS | W726: FRANKSTON | X726: 8 | Y726: 8 | Z726: 0 | AA726: 1302 | AB726: 1404 | AC726: =(AA726*100)/AB726 -> 92.73504273504274 | AD726: =(X726*4)+(Z726*2) -> 32
A727: MORDIALLOC | C727: LESLIE | F727: BAXTER | I727: O'BRIEN | L727: WILLIAMS | N727: BLAINEY | Q727: HYNES | W727: CAULFIELD | X727: 5 | Y727: 10 | Z727: 1 | AA727: 1166 | AB727: 1481 | AC727: =(AA727*100)/AB727 -> 78.730587440918299 | AD727: =(X727*4)+(Z727*2) -> 22
A728: CAULFIELD | C728: GOWAN | F728: AUGHTERSON | I728: EVANS | L728: BAKER | N728: ROYALS | Q728: FARY | W728: CAMBERWELL | X728: 4 | Y728: 12 | Z728: 0 | AA728: 1310 | AB728: 1742 | AC728: =(AA728*100)/AB728 -> 75.200918484500576 | AD728: =(X728*4)+(Z728*2) -> 16
A729: GOALKICKERS | C729: 1 SHORT | W729: WERRIBEE | X729: 2 | Y729: 13 | Z729: 1 | AA729: 1090 | AB729: 1614 | AC729: =(AA729*100)/AB729 -> 67.534076827757119 | AD729: =(X729*4)+(Z729*2) -> 10
A730: MORDIALLOC | C730: LESLIE 6 | F730: BAXTER 3 | I730: O'BRIEN 2 | K730: RIDDLE 2 | M730: HYNES | O730: POWER
A731: CAULFIELD | C731: ARRELL | E731: BAKER | G731: GOWAN | I731: ROYALS | K731: ROWE | M731: FARY
A733: GEELONG WEST | C733: 4 | D733: 3 | E733: =C733*6+D733 -> 27 | G733: 7 | H733: 10 | I733: =G733*6+H733 -> 52 | K733: 9 | L733: 17 | M733: =K733*6+L733 -> 71 | O733: 14 | P733: 26 | Q733: =O733*6+P733 -> 110 | S733: FRANKSTON
A734: FRANKSTON | C734: 1 | D734: 3 | E734: =C734*6+D734 -> 9 | G734: 3 | H734: 6 | I734: =G734*6+H734 -> 24 | K734: 6 | L734: 9 | M734: =K734*6+L734 -> 45 | O734: 9 | P734: 12 | Q734: =O734*6+P734 -> 66
A735: BEST PLAYERS
A736: GEELONG WEST | C736: NICHOLLS | F736: BRUSHFIELD | I736: STACEY | L736: VAN T'HAG | O736: GIBBONS | Q736: WILLIAMS
A737: FRANKSTON | C737: BOWEN | F737: SLADE | I737: CRUNDEN | L737: WATSON | O737: COUNTY
A738: GOALKICKERS
A739: GEELONG WEST | C739: GIBBONS 3 | F739: STACEY 2 | I739: VAN T'HAG 2 | L739: BRUSHFIELD 2 | O739: NIEWEARONICZ 2 | R739: BUSH | T739: WILLIAMS | W739: SNELL
A740: FRANKSTON | C740: McNABB 2 | F740: McHUGH 2 | I740: COUNTY 2 | L740: LEWIS | N740: PAYNE | P740: BOWEN
A742: BOX HILL | C742: 4 | D742: 2 | E742: =C742*6+D742 -> 26 | G742: 9 | H742: 7 | I742: =G742*6+H742 -> 61 | K742: 14 | L742: 12 | M742: =K742*6+L742 -> 96 | O742: 18 | P742: 18 | Q742: =O742*6+P742 -> 126 | S742: BOX HILL
A743: WERRIBEE | C743: 1 | D743: 1 | E743: =C743*6+D743 -> 7 | G743: 4 | H743: 1 | I743: =G743*6+H743 -> 25 | K743: 4 | L743: 4 | M743: =K743*6+L743 -> 28 | O743: 6 | P743: 5 | Q743: =O743*6+P743 -> 41
A744: BEST PLAYERS
A745: BOX HILL | C745: BRYANT | F745: O'NEILL | I745: GRAY | L745: I BATES | O745: BUSH | R745: LEHMAN
A746: WERRIBEE | C746: GOULOPOLOUS | F746: TURNER | I746: JAMMESON | L746: EDWARDS | O746: MILLIGAN | R746: DENT
A747: GOALKICKERS
A748: BOX HILL | C748: RALPH 6 | F748: GRAY 5 | H748: LOOMES 2 | J748: WHITE | L748: LA ROCHE | N748: HUNT | P748: MACKO | R748: BOWYER-SMYTH
A749: WERRIBEE | C749: BRYAN 2 | F749: PANTE | H749: TYQUIN | J749: SHEAHAN | M749: MILLIGAN
E750: 31ST JULY | I750: WEATHER
A751: NORTHCOTE | C751: 2 | D751: 2 | E751: =C751*6+D751 -> 14 | G751: 7 | H751: 5 | I751: =G751*6+H751 -> 47 | K751: 11 | L751: 8 | M751: =K751*6+L751 -> 74 | O751: 18 | P751: 11 | Q751: =O751*6+P751 -> 119 | S751: TOORAK PARK
A752: PRAHRAN | C752: 1 | D752: 7 | E752: =C752*6+D752 -> 13 | G752: 3 | H752: 9 | I752: =G752*6+H752 -> 27 | K752: 5 | L752: 12 | M752: =K752*6+L752 -> 42 | O752: 6 | P752: 16 | Q752: =O752*6+P752 -> 52
A753: BEST PLAYERS
A754: NORTHCOTE | C754: QUAIFE | F754: McBREEN | I754: CALVERLEY | L754: SLEEP | O754: PITTS | R754: CRAMERI
A755: PRAHRAN | C755: KIRBY | F755: GEISLER | I755: RICHARDSON | L755: SKIDMORE | O755: VERWOERT | R755: BARTLETT
A756: GOALKICKERS
A757: NORTHCOTE | C757: QUAIFE 4 | F757: MICKLESON 4 | I757: CALVERLEY 3 | L757: MUIR 2 | N757: CRAMERI 2 | Q757: KEANE | S757: HENRY | V757: SLEEP
A758: PRAHRAN | C758: VERWOERT | F758: COOPER | H758: PEARSON | J758: MCMAHON | M758: CRIPPS | O758: SKIDMORE
A760: ROUND 17 | E760: 6TH AUGUST | J760: WEATHER | N760: S.E.BREEZE DULL | S760: PLAYED AT
D761: 1ST QTR | H761: 2ND QTR | L761: 3RD QTR | P761: FINAL | S761: CAMBERWELL
A762: CAULFIELD | C762: 3 | D762: 5 | E762: =C762*6+D762 -> 23 | G762: 5 | H762: 11 | I762: =G762*6+H762 -> 41 | K762: 13 | L762: 15 | M762: =K762*6+L762 -> 93 | O762: 16 | P762: 18 | Q762: =O762*6+P762 -> 114 | S762: UMPIRE | X762: LADDER | AB762: ROUND | AD762: 17
A763: CAMBERWELL | C763: 3 | D763: 3 | E763: =C763*6+D763 -> 21 | G763: 9 | H763: 4 | I763: =G763*6+H763 -> 58 | K763: 12 | L763: 6 | M763: =K763*6+L763 -> 78 | O763: 14 | P763: 11 | Q763: =O763*6+P763 -> 95
A764: BEST PLAYERS | W764: TEAM | X764: W | Y764: L | Z764: D | AA764: FOR | AB764: AGST | AC764: % | AD764: PTS
A765: CAULFIELD | C765: ROWE | F765: GOWAN | I765: AUGHTERSON | M765: LOGAN | O765: STONE | Q765: DOUGLAS
A766: CAMBERWELL | C766: COCKREM | F766: D BOYD | I766: KISS | L766: FILLIPONE | O766: WINKLEMAN | R766: WITHERS | W766: NORTHCOTE | X766: 12 | Y766: 5 | Z766: 0 | AA766: 1647 | AB766: 1332 | AC766: =(AA766*100)/AB766 -> 123.64864864864865 | AD766: =(X766*4)+(Z766*2) -> 48
A767: GOALKICKERS | W767: GEELONG WEST | X767: 11 | Y767: 5 | Z767: 1 | AA767: 1747 | AB767: 1308 | AC767: =(AA767*100)/AB767 -> 133.56269113149847 | AD767: =(X767*4)+(Z767*2) -> 46
A768: CAULFIELD | C768: LOGAN 5 | F768: STONE 4 | H768: DOUGLAS 3 | K768: ROWE 2 | M768: GOWAN | O768: BAGER | W768: PRAHRAN | X768: 11 | Y768: 6 | Z768: 0 | AA768: 1424 | AB768: 1289 | AC768: =(AA768*100)/AB768 -> 110.47323506594259 | AD768: =(X768*4)+(Z768*2) -> 44
A769: CAMBERWELL | C769: D BOYD 3 | F769: FILLIPONE 3 | I769: WITHERS 2 | L769: WINKLEMAN 2 | O769: W ADAMS 2 | R769: KISS | S769: FRIEBERG | W769: SUNSHINE | X769: 10 | Y769: 7 | Z769: 0 | AA769: 1294 | AB769: 1377 | AC769: =(AA769*100)/AB769 -> 93.972403776325351 | AD769: =(X769*4)+(Z769*2) -> 40
A771: FRANKSTON | C771: 2 | D771: 4 | E771: =C771*6+D771 -> 16 | G771: 3 | H771: 6 | I771: =G771*6+H771 -> 24 | K771: 8 | L771: 12 | M771: =K771*6+L771 -> 60 | O771: 12 | P771: 16 | Q771: =O771*6+P771 -> 88 | S771: WERRIBEE | W771: BOX HILL | X771: 9 | Y771: 7 | Z771: 1 | AA771: 1623 | AB771: 1386 | AC771: =(AA771*100)/AB771 -> 117.0995670995671 | AD771: =(X771*4)+(Z771*2) -> 38
A772: WERRIBEE | C772: 3 | D772: 2 | E772: =C772*6+D772 -> 20 | G772: 7 | H772: 10 | I772: =G772*6+H772 -> 52 | K772: 8 | L772: 13 | M772: =K772*6+L772 -> 61 | O772: 12 | P772: 14 | Q772: =O772*6+P772 -> 86 | W772: MORDIALLOC | X772: 9 | Y772: 8 | Z772: 0 | AA772: 1602 | AB772: 1358 | AC772: =(AA772*100)/AB772 -> 117.96759941089837 | AD772: =(X772*4)+(Z772*2) -> 36
A773: BEST PLAYERS | W773: FRANKSTON | X773: 9 | Y773: 8 | Z773: 0 | AA773: 1390 | AB773: 1490 | AC773: =(AA773*100)/AB773 -> 93.288590604026851 | AD773: =(X773*4)+(Z773*2) -> 36
A774: FRANKSTON | C774: WATSON | F774: THATCHER | I774: KERR | L774: BOWEN | O774: YATES | R774: McHUGH | W774: CAULFIELD | X774: 6 | Y774: 10 | Z774: 1 | AA774: 1280 | AB774: 1576 | AC774: =(AA774*100)/AB774 -> 81.218274111675129 | AD774: =(X774*4)+(Z774*2) -> 26
A775: WERRIBEE | C775: HOLCOMBE | F775: JAMMESON | I775: GOULOPOLOUS | L775: ANDERSON | O775: SHEAHAN | R775: TURNER | W775: CAMBERWELL | X775: 4 | Y775: 13 | Z775: 0 | AA775: 1405 | AB775: 1856 | AC775: =(AA775*100)/AB775 -> 75.700431034482762 | AD775: =(X775*4)+(Z775*2) -> 16
A776: GOALKICKERS | W776: WERRIBEE | X776: 2 | Y776: 14 | Z776: 1 | AA776: 1176 | AB776: 1702 | AC776: =(AA776*100)/AB776 -> 69.095182138660405 | AD776: =(X776*4)+(Z776*2) -> 10
A777: FRANKSTON | C777: KERR 4 | E777: THATCHER 3 | H777: COUNTY 2 | K777: BOWEN | M777: McHUGH | O777: EPSTEIN
A778: WERRIBEE | C778: HOLCOMBE 2 | F778: TYQUIN 2 | H778: BRYAN 2 | J778: PANTE 2 | L778: JAMMESON | O778: DENT | Q778: BA SMITH | S778: SHEAHAN
E779: 7TH AUGUST | I779: WEATHER
A780: PRAHRAN | C780: 4 | D780: 3 | E780: =C780*6+D780 -> 27 | G780: 5 | H780: 6 | I780: =G780*6+H780 -> 36 | K780: 7 | L780: 11 | M780: =K780*6+L780 -> 53 | O780: 11 | P780: 15 | Q780: =O780*6+P780 -> 81 | S780: MORDIALLOC
A781: MORDIALLOC | C781: 2 | D781: 0 | E781: =C781*6+D781 -> 12 | G781: 5 | H781: 3 | I781: =G781*6+H781 -> 33 | K781: 10 | L781: 3 | M781: =K781*6+L781 -> 63 | O781: 12 | P781: 3 | Q781: =O781*6+P781 -> 75
A782: BEST PLAYERS
A783: PRAHRAN | C783: CULPIN | F783: SKIDMORE | I783: McMAHON | L783: PEARSON | O783: COOPER | R783: SHEEDY
A784: MORDIALLOC | C784: DANCKERT | F784: HYNES | I784: BAXTER | L784: GRANGER | O784: WILLIAMS | R784: WILLIAMSON
A785: GOALKICKERS
A786: PRAHRAN | C786: PEARSON 3 | F786: SKIDMORE 3 | I786: PIPER 2 | K786: MCMAHON | N786: BARTLETT | Q786: COOPER
A787: MORDIALLOC | C787: BAXTER 3 | F787: LAIRD 3 | I787: O'BRIEN 2 | K787: LESLIE 2 | M787: GRAY | O787: BACKMAN
A789: NORTHCOTE | C789: 5 | D789: 0 | E789: =C789*6+D789 -> 30 | G789: 10 | H789: 4 | I789: =G789*6+H789 -> 64 | K789: 14 | L789: 9 | M789: =K789*6+L789 -> 93 | O789: 20 | P789: 13 | Q789: =O789*6+P789 -> 133 | S789: NORTHCOTE
A790: BOX HILL | C790: 4 | D790: 3 | E790: =C790*6+D790 -> 27 | G790: 6 | H790: 7 | I790: =G790*6+H790 -> 43 | K790: 7 | L790: 11 | M790: =K790*6+L790 -> 53 | O790: 11 | P790: 12 | Q790: =O790*6+P790 -> 78
A791: BEST PLAYERS
A792: NORTHCOTE | C792: PITTS | F792: MICKLESON | I792: SLEEP | L792: MUIR | N792: CRAMERI | Q792: LACHMUND
A793: BOX HILL | C793: BAKER | F793: WHITE | I793: I BATES | L793: BRYANT | N793: C FELLOWS | Q793: LOOMES
A794: GOALKICKERS | C794: 1 SHORT
A795: NORTHCOTE | C795: MICKLESON 5 | F795: LACHMUND 4 | I795: PITTS 4 | K795: QUAIFE 2 | M795: KEANE | O795: THOMPSON | R795: CALVERLEY | U795: SLEEP
A796: BOX HILL | C796: RALPH 3 | F796: LOOMES 3 | I796: MACE 2 | K796: LA ROCHE | M796: BRYANT | P796: 1 SHORT
A798: GEELONG WEST | C798: 3 | D798: 2 | E798: =C798*6+D798 -> 20 | G798: 8 | H798: 4 | I798: =G798*6+H798 -> 52 | K798: 11 | L798: 4 | M798: =K798*6+L798 -> 70 | O798: 17 | P798: 8 | Q798: =O798*6+P798 -> 110 | S798: SUNSHINE
A799: SUNSHINE | C799: 3 | D799: 6 | E799: =C799*6+D799 -> 24 | G799: 3 | H799: 10 | I799: =G799*6+H799 -> 28 | K799: 4 | L799: 13 | M799: =K799*6+L799 -> 37 | O799: 7 | P799: 15 | Q799: =O799*6+P799 -> 57
A800: BEST PLAYERS
A801: GEELONG WEST | C801: BARKER | F801: NICHOLLS | I801: WILLIAMS | L801: BRUSHFIELD | O801: GRANT | Q801: RAEBURN
A802: SUNSHINE | C802: DARUL | F802: CROSBIE | I802: ROACH | L802: TREZISE | O802: POWER | Q802: OVERS
A803: GOALKICKERS
A804: GEELONG WEST | C804: NUSTELING 6 | F804: BRUSHFIELD 3 | I804: BUSH 2 | K804: STACEY 2 | M804: SNELL 2 | O804: WILLIAMS | Q804: SALTER
A805: SUNSHINE | C805: W HARRIS 3 | F805: TREZISE | I805: GRAHAM | K805: CROSBIE | M805: GREGORY
A807: ROUND 18 | E807: 13TH AUGUST | J807: WEATHER | N807: S.E.BREEZE DULL | S807: PLAYED AT
D808: 1ST QTR | H808: 2ND QTR | L808: 3RD QTR | P808: FINAL | S808: BOX HILL
A809: BOX HILL | C809: 5 | D809: 3 | E809: =C809*6+D809 -> 33 | G809: 9 | H809: 6 | I809: =G809*6+H809 -> 60 | K809: 10 | L809: 7 | M809: =K809*6+L809 -> 67 | O809: 11 | P809: 12 | Q809: =O809*6+P809 -> 78 | S809: UMPIRE | X809: LADDER | AB809: ROUND | AD809: 18
A810: MORDIALLOC | C810: 3 | D810: 1 | E810: =C810*6+D810 -> 19 | G810: 5 | H810: 5 | I810: =G810*6+H810 -> 35 | K810: 11 | L810: 6 | M810: =K810*6+L810 -> 72 | O810: 12 | P810: 6 | Q810: =O810*6+P810 -> 78
A811: BEST PLAYERS | W811: TEAM | X811: W | Y811: L | Z811: D | AA811: FOR | AB811: AGST | AC811: % | AD811: PTS
A812: BOX HILL | C812: BRYANT | F812: LOOMES | I812: LEAKE | L812: MACE | N812: RALPH | Q812: O'NEILL
A813: MORDIALLOC | C813: BAXTER | F813: O'BRIEN | I813: WILLIAMSON | L813: RIDDLE | N813: HYNES | Q813: WILLIAMS | W813: NORTHCOTE | X813: 13 | Y813: 5 | Z813: 0 | AA813: 1736 | AB813: 1413 | AC813: =(AA813*100)/AB813 -> 122.85916489738146 | AD813: =(X813*4)+(Z813*2) -> 52
A814: GOALKICKERS | W814: GEELONG WEST | X814: 12 | Y814: 5 | Z814: 1 | AA814: 1876 | AB814: 1390 | AC814: =(AA814*100)/AB814 -> 134.96402877697841 | AD814: =(X814*4)+(Z814*2) -> 50
A815: BOX HILL | C815: BRYANT 3 | F815: RALPH 3 | I815: I BATES 2 | L815: LOOMES | N815: GRAY | P815: LEAKE | W815: PRAHRAN | X815: 12 | Y815: 6 | Z815: 0 | AA815: 1494 | AB815: 1321 | AC815: =(AA815*100)/AB815 -> 113.09613928841786 | AD815: =(X815*4)+(Z815*2) -> 48
A816: MORDIALLOC | C816: BAXTER 4 | F816: O'BRIEN 4 | I816: POWER 3 | L816: RIDDLE | W816: SUNSHINE | X816: 11 | Y816: 7 | Z816: 0 | AA816: 1396 | AB816: 1421 | AC816: =(AA816*100)/AB816 -> 98.240675580577062 | AD816: =(X816*4)+(Z816*2) -> 44
A818: NORTHCOTE | C818: 3 | D818: 3 | E818: =C818*6+D818 -> 21 | G818: 6 | H818: 6 | I818: =G818*6+H818 -> 42 | K818: 9 | L818: 9 | M818: =K818*6+L818 -> 63 | O818: 13 | P818: 11 | Q818: =O818*6+P818 -> 89 | S818: FRANKSTON | W818: BOX HILL | X818: 9 | Y818: 7 | Z818: 2 | AA818: 1701 | AB818: 1464 | AC818: =(AA818*100)/AB818 -> 116.18852459016394 | AD818: =(X818*4)+(Z818*2) -> 40
A819: FRANKSTON | C819: 4 | D819: 7 | E819: =C819*6+D819 -> 31 | G819: 7 | H819: 8 | I819: =G819*6+H819 -> 50 | K819: 10 | L819: 11 | M819: =K819*6+L819 -> 71 | O819: 11 | P819: 15 | Q819: =O819*6+P819 -> 81 | W819: MORDIALLOC | X819: 9 | Y819: 8 | Z819: 1 | AA819: 1680 | AB819: 1436 | AC819: =(AA819*100)/AB819 -> 116.99164345403899 | AD819: =(X819*4)+(Z819*2) -> 38
A820: BEST PLAYERS | W820: FRANKSTON | X820: 9 | Y820: 9 | Z820: 0 | AA820: 1471 | AB820: 1579 | AC820: =(AA820*100)/AB820 -> 93.160227992400252 | AD820: =(X820*4)+(Z820*2) -> 36
A821: NORTHCOTE | C821: CRAMERI | F821: KEANE | I821: PITTS | L821: QUAIFE | N821: THOMPSON | Q821: McBREEN | W821: CAULFIELD | X821: 6 | Y821: 11 | Z821: 1 | AA821: 1324 | AB821: 1678 | AC821: =(AA821*100)/AB821 -> 78.903456495828365 | AD821: =(X821*4)+(Z821*2) -> 26
A822: FRANKSTON | C822: YATES | F822: BOWEN | I822: McHUGH | L822: KERR | N822: ALDERSON | Q822: THATCHER | W822: CAMBERWELL | X822: 4 | Y822: 14 | Z822: 0 | AA822: 1437 | AB822: 1926 | AC822: =(AA822*100)/AB822 -> 74.610591900311533 | AD822: =(X822*4)+(Z822*2) -> 16
A823: GOALKICKERS | W823: WERRIBEE | X823: 2 | Y823: 15 | Z823: 1 | AA823: 1258 | AB823: 1831 | AC823: =(AA823*100)/AB823 -> 68.705625341343534 | AD823: =(X823*4)+(Z823*2) -> 10
A824: NORTHCOTE | C824: CRAMERI 5 | F824: CALVERLEY 2 | I824: THOMPSON 2 | L824: KEANE 2 | N824: QUAIFE | P824: PITTS
A825: FRANKSTON | C825: KERR 3 | E825: ALDERSON 2 | H825: BOWEN 2 | J825: McHUGH 2 | M825: THATCHER | P825: PAYNE
A827: SUNSHINE | C827: 3 | D827: 4 | E827: =C827*6+D827 -> 22 | G827: 5 | H827: 9 | I827: =G827*6+H827 -> 39 | K827: 7 | L827: 12 | M827: =K827*6+L827 -> 54 | O827: 14 | P827: 18 | Q827: =O827*6+P827 -> 102 | S827: PRINCES PARK, CAULFIELD
A828: CAULFIELD | C828: 1 | D828: 1 | E828: =C828*6+D828 -> 7 | G828: 2 | H828: 6 | I828: =G828*6+H828 -> 18 | K828: 6 | L828: 6 | M828: =K828*6+L828 -> 42 | O828: 6 | P828: 8 | Q828: =O828*6+P828 -> 44
A829: BEST PLAYERS
A830: SUNSHINE | C830: HUTCHISON | F830: W HARRIS | I830: TREZISE | L830: OVERS | N830: GRAHAM | Q830: POWER
A831: CAULFIELD | C831: BAKER | F831: DOUGLAS | I831: ROYALS | L831: DE BONDE | N831: ARRELL | Q831: ROWE
A832: GOALKICKERS
A833: SUNSHINE | C833: W HARRIS 7 | F833: CROSBIE 3 | I833: GRAHAM 3 | L833: LEGAWIECZ
A834: CAULFIELD | C834: ARRELL | E834: SUTHERLAND | H834: BAKER | J834: DOUGLAS | M834: STONE | O834: ROWE
E835: 14TH AUGUST | I835: WEATHER
A836: PRAHRAN | C836: 1 | D836: 8 | E836: =C836*6+D836 -> 14 | G836: 3 | H836: 6 | I836: =G836*6+H836 -> 24 | K836: 5 | L836: 10 | M836: =K836*6+L836 -> 40 | O836: 10 | P836: 10 | Q836: =O836*6+P836 -> 70 | S836: TOORAK PARK
A837: CAMBERWELL | C837: 2 | D837: 2 | E837: =C837*6+D837 -> 14 | G837: 3 | H837: 2 | I837: =G837*6+H837 -> 20 | K837: 4 | L837: 4 | M837: =K837*6+L837 -> 28 | O837: 4 | P837: 8 | Q837: =O837*6+P837 -> 32
A838: BEST PLAYERS
A839: PRAHRAN | C839: CULPIN | F839: SHEEDY | I839: WISHART | L839: McMAHON | N839: VERWOERT | Q839: BARTLETT
A840: CAMBERWELL | C840: DE COSTA | F840: K SMITH | I840: McKERNAN | L840: D BOYD | N840: GIBSON | Q840: WITHERS
A841: GOALKICKERS
A842: PRAHRAN | C842: VERWOERT 4 | F842: PEARSON 3 | I842: McMAHON 2 | L842: SKIDMORE
A843: CAMBERWELL | C843: O'NEILL 3 | F843: COCKREM
A845: GEELONG WEST | C845: 6 | D845: 10 | E845: =C845*6+D845 -> 46 | G845: 8 | H845: 15 | I845: =G845*6+H845 -> 63 | K845: 15 | L845: 20 | M845: =K845*6+L845 -> 110 | O845: 18 | P845: 21 | Q845: =O845*6+P845 -> 129 | S845: GEELONG WEST
A846: WERRIBEE | C846: 1 | D846: 4 | E846: =C846*6+D846 -> 10 | G846: 4 | H846: 9 | I846: =G846*6+H846 -> 33 | K846: 5 | L846: 10 | M846: =K846*6+L846 -> 40 | O846: 11 | P846: 16 | Q846: =O846*6+P846 -> 82
A847: BEST PLAYERS
A848: GEELONG WEST | C848: NUSTELING | F848: RAEBURN | I848: GIBBONS | L848: GRANT | N848: SALTER | Q848: BRUSHFIELD
A849: WERRIBEE | C849: SHEAHAN | F849: MILLIGAN | I849: GOULOPOLOUS | L849: PANTE | N849: GILLETT | Q849: TURNER
A850: GOALKICKERS
A851: GEELONG WEST | C851: NUSTELING 12 | F851: BRUSHFIELD 3 | I851: GIBBONS | K851: STACEY | M851: HOVEY
A852: WERRIBEE | C852: PANTE 4 | F852: B SMITH 2 | I852: BRYAN 2 | K852: SHEAHAN | M852: DENT
A854: FINALS
A855: 1ST SEMI | E855: 21ST AUGUST | J855: WEATHER | S855: PLAYED AT
D856: 1ST QTR | H856: 2ND QTR | L856: 3RD QTR | P856: FINAL | S856: TOORAK PARK
A857: PRAHRAN | C857: 1 | D857: 2 | E857: =C857*6+D857 -> 8 | G857: 5 | H857: 9 | I857: =G857*6+H857 -> 39 | K857: 7 | L857: 12 | M857: =K857*6+L857 -> 54 | O857: 11 | P857: 15 | Q857: =O857*6+P857 -> 81 | S857: UMPIRE
A858: SUNSHINE | C858: 1 | D858: 2 | E858: =C858*6+D858 -> 8 | G858: 1 | H858: 4 | I858: =G858*6+H858 -> 10 | K858: 2 | L858: 4 | M858: =K858*6+L858 -> 16 | O858: 2 | P858: 7 | Q858: =O858*6+P858 -> 19 | S858: O'NEILL
A859: BEST PLAYERS
A860: PRAHRAN | C860: CULPIN | F860: KIRBY | I860: VERWOERT | L860: GEISLER | N860: WISHART | Q860: MINTON-CONNELL
A861: SUNSHINE | C861: TREZISE | F861: DARUL | I861: YOUNG | L861: SLATTERY | N861: POWER | Q861: FITZGERALD
A862: GOALKICKERS
A863: PRAHRAN | C863: PEARSON 5 | F863: KERLEY 2 | I863: McMAHON | L863: VERWOERT | N863: COOPER | Q863: SKIDMORE
A864: SUNSHINE | C864: W HARRIS | F864: CROSBIE
A866: 2ND SEMI | E866: 28TH AUGUST | J866: WEATHER
A867: GEELONG WEST | C867: 4 | D867: 4 | E867: =C867*6+D867 -> 28 | G867: 6 | H867: 11 | I867: =G867*6+H867 -> 47 | K867: 9 | L867: 14 | M867: =K867*6+L867 -> 68 | O867: 15 | P867: 15 | Q867: =O867*6+P867 -> 105 | S867: TOORAK PARK
A868: NORTHCOTE | C868: 3 | D868: 5 | E868: =C868*6+D868 -> 23 | G868: 4 | H868: 12 | I868: =G868*6+H868 -> 36 | K868: 6 | L868: 16 | M868: =K868*6+L868 -> 52 | O868: 8 | P868: 19 | Q868: =O868*6+P868 -> 67 | S868: ROWE
A869: BEST PLAYERS
A870: GEELONG WEST | C870: NUSTELING | F870: WILLIAMS | I870: PETERS | L870: COLTISH | N870: BRUSHFIELD | Q870: SNELL
A871: NORTHCOTE | C871: SLEEP | F871: QUAIFE | I871: THOMPSON | L871: PITTS | N871: EASTAWAY | Q871: SIMPSON
A872: GOALKICKERS
A873: GEELONG WEST | C873: NUSTELING 7 | F873: SNELL 2 | I873: STACEY 2 | L873: GIBBONS 2 | N873: BRUSHFIELD | Q873: BUSH
A874: NORTHCOTE | C874: SLEEP 2 | F874: CALVERLEY 2 | I874: MICKLESON | L874: QUAIFE | N874: LACHMUND | Q874: THOMPSON
A876: PRELIMINARY | E876: 4TH SEPTEMBER | J876: WEATHER
A877: PRAHRAN | C877: 6 | D877: 7 | E877: =C877*6+D877 -> 43 | G877: 9 | H877: 9 | I877: =G877*6+H877 -> 63 | K877: 12 | L877: 10 | M877: =K877*6+L877 -> 82 | O877: 13 | P877: 13 | Q877: =O877*6+P877 -> 91 | S877: TOORAK PARK
A878: NORTHCOTE | C878: 2 | D878: 1 | E878: =C878*6+D878 -> 13 | G878: 10 | H878: 5 | I878: =G878*6+H878 -> 65 | K878: 12 | L878: 8 | M878: =K878*6+L878 -> 80 | O878: 13 | P878: 12 | Q878: =O878*6+P878 -> 90 | S878: JACKSON
A879: BEST PLAYERS
A880: PRAHRAN | C880: BARTLETT | F880: KERLEY | I880: RICHARDSON | L880: GEISLER | N880: GLOVER | Q880: SHEEDY
A881: NORTHCOTE | C881: SIMPSON | F881: QUAIFE | I881: CALVERLEY | L881: MUIR | N881: MICKLESON | Q881: CRAMERI
A882: GOALKICKERS
A883: PRAHRAN | C883: KERLEY 4 | F883: VERWOERT 3 | I883: RICHARDSON 3 | L883: PEARSON 3
A884: NORTHCOTE | C884: MICKLESON 4 | F884: SLEEP 2 | I884: PITTS 2 | K884: LACHMUND | N884: KEANE | Q884: 2 SHORT
A886: GRAND
A887: PRAHRAN | C887: 1 | D887: 0 | E887: =C887*6+D887 -> 6 | G887: 6 | H887: 4 | I887: =G887*6+H887 -> 40 | K887: 9 | L887: 9 | M887: =K887*6+L887 -> 63 | O887: 17 | P887: 12 | Q887: =O887*6+P887 -> 114 | S887: TOORAK PARK
A888: GEELONG WEST | C888: 2 | D888: 9 | E888: =C888*6+D888 -> 21 | G888: 3 | H888: 13 | I888: =G888*6+H888 -> 31 | K888: 3 | L888: 14 | M888: =K888*6+L888 -> 32 | O888: 5 | P888: 15 | Q888: =O888*6+P888 -> 45 | S888: R ARMSTRONG
A889: BEST PLAYERS
A890: PRAHRAN | C890: BARTLETT | F890: KIRBY | I890: BUTLER | L890: CULPIN | N890: GEISLER | Q890: SKIDMORE
A891: GEELONG WEST | C891: GRANT | F891: NICHOLLS | I891: BUSH | L891: BRUSHFIELD | O891: BARKER
A892: GOALKICKERS
A893: PRAHRAN | C893: PEARSON 6 | F893: BARTLETT 4 | I893: RICHARDSON 3 | L893: KERLEY 2 | N893: BUTLER 2
A894: GEELONG WEST | C894: WILLIAMS | F894: STACEY | I894: GIBBONS | L894: SALTER | N894: BRUSHFIELD