A1: Victorian Football Association
A2: Season 1967 - Division One
A3: © Copyright Wal Williams | F3: First created: 2 May 2015
A4: Contact: joywalwi at gmail dot com | F4: Last updated: 2 May 2015 | W4: VFA Results and tables - Link to the main index page
A5: You are free to copy this document in whole or part provided that proper acknowledgement is given to the author. All rights reserved.
A7: 1967 V.F.A. | C7: SEASON 1ST | F7: DIVISION | CA7: \D | CB7: {GOTO}BJ3~/M{RIGHT 7}{END}{DOWN}~G4~
A8: ROUND 1 | E8: 23RD APRIL | M8: WEATHER | S8: PLAYED AT | CB8: {GOTO}AL3~/M{END}{RIGHT}{END}{DOWN}~P3~
D9: 1ST QTR | H9: 2ND QTR | L9: 3RD QTR | P9: FINAL | S9: PORT MELBOURNE | CB9: {GOTO}BJ23~/M{RIGHT 7}{END}{DOWN}~V4~
A10: PORT MELBOURNE | C10: 4 | D10: 5 | E10: =C10*6+D10 -> 29 | G10: 10 | H10: 6 | I10: =G10*6+H10 -> 66 | K10: 13 | L10: 10 | M10: =K10*6+L10 -> 88 | O10: 14 | P10: 14 | Q10: =O10*6+P10 -> 98 | S10: UMPIRE | X10: LADDER | AB10: ROUND | AD10: 1 | CB10: {GOTO}BJ43~/M{RIGHT 7}{END}{DOWN}~G24~
A11: DANDENONG | C11: 4 | D11: 3 | E11: =C11*6+D11 -> 27 | G11: 6 | H11: 7 | I11: =G11*6+H11 -> 43 | K11: 10 | L11: 10 | M11: =K11*6+L11 -> 70 | O11: 13 | P11: 12 | Q11: =O11*6+P11 -> 90 | S11: O'NEILL | CB11: {GOTO}AL23~/M{END}{RIGHT}{END}{DOWN}~P23~
A12: BEST PLAYERS | W12: TEAM | X12: W | Y12: L | Z12: D | AA12: FOR | AB12: AGST | AC12: % | AD12: PTS | CB12: {GOTO}BJ63~/M{RIGHT 7}{END}{DOWN}~V24~
A13: PORT MELBOURNE | C13: BEDFORD | F13: WILLIAMS | I13: COLLINS | L13: TAGGART | O13: PECK | Q13: BUCKLEY | CB13: {GOTO}BJ83~/M{RIGHT 7}{END}{DOWN}~G44~
A14: DANDENONG | C14: STEDWELL | F14: ROUVRAY | I14: McDONALD | L14: OSBORNE | O14: HILL | Q14: J F McNAMARA | W14: PRESTON | X14: 1 | Y14: 0 | Z14: 0 | AA14: 104 | AB14: 59 | AC14: 176.27118644067798 | AD14: 4 | CB14: {GOTO}AL43~/M{END}{RIGHT}{END}{DOWN}~P43~
A15: GOALKICKERS | W15: BRUNSWICK | X15: 1 | Y15: 0 | Z15: 0 | AA15: 108 | AB15: 81 | AC15: 133.33333333333334 | AD15: 4 | CB15: {GOTO}BJ103~/M{RIGHT 7}{END}{DOWN}~V44~
A16: PORT MELBOURNE | C16: PECK 6 | F16: COLLINS 3 | I16: KERR 2 | K16: BEDFORD | M16: TAGGART | O16: GRIFFITH | W16: COBURG | X16: 1 | Y16: 0 | Z16: 0 | AA16: 98 | AB16: 76 | AC16: 128.94736842105263 | AD16: 4 | CB16: {GOTO}BJ123~/M{RIGHT 7}{END}{DOWN}~G64~
A17: DANDENONG | C17: McDONALD 4 | F17: HILL 3 | H17: MORROW 2 | K17: SMITH 2 | M17: WIGHT | O17: MELAI | W17: WAVERLEY | X17: 1 | Y17: 0 | Z17: 0 | AA17: 100 | AB17: 84 | AC17: 119.05 | AD17: 4 | CB17: {GOTO}AL63~/M{END}{RIGHT}{END}{DOWN}~P63~
CB18: {GOTO}BJ143~/M{RIGHT 7}{END}{DOWN}~V64~
A19: BRUNSWICK | C19: 4 | D19: 4 | E19: =C19*6+D19 -> 28 | G19: 8 | H19: 8 | I19: =G19*6+H19 -> 56 | K19: 13 | L19: 15 | M19: =K19*6+L19 -> 93 | O19: 15 | P19: 18 | Q19: =O19*6+P19 -> 108 | S19: BRUNSWICK | W19: PORT MELBOURNE | X19: 1 | Y19: 0 | Z19: 0 | AA19: 98 | AB19: 90 | AC19: 108.88888888888889 | AD19: 4 | CB19: {GOTO}BJ163~/M{RIGHT 7}{END}{DOWN}~G84~
A20: WILLIAMSTOWN | C20: 1 | D20: 1 | E20: =C20*6+D20 -> 7 | G20: 4 | H20: 9 | I20: =G20*6+H20 -> 33 | K20: 5 | L20: 10 | M20: =K20*6+L20 -> 40 | O20: 11 | P20: 15 | Q20: =O20*6+P20 -> 81 | S20: ANDERSON | W20: DANDENONG | X20: 0 | Y20: 1 | Z20: 0 | AA20: 90 | AB20: 98 | AC20: 91.836734693877546 | AD20: 0 | CB20: {GOTO}AL83~/M{END}{RIGHT}{END}{DOWN}~P83~
A21: BEST PLAYERS | W21: YARRAVILLE | X21: 0 | Y21: 1 | Z21: 0 | AA21: 76 | AB21: 98 | AC21: 77.551020408163268 | AD21: 0 | CB21: {GOTO}BJ183~/M{RIGHT 7}{END}{DOWN}~V84~
A22: BRUNSWICK | C22: LEYDIN | F22: BIBBY | I22: WHILEY | L22: ROGERS | O22: ROBINSON | R22: ROBINS | W22: PRAHRAN | X22: 0 | Y22: 1 | Z22: 0 | AA22: 84 | AB22: 100 | AC22: 84 | AD22: 0 | CB22: {GOTO}BJ203~/M{RIGHT 7}{END}{DOWN}~G104~
A23: WILLIAMSTOWN | C23: RUSSELL | F23: WARD | I23: HANCOCK | L23: MAUGHAN | O23: WARE | R23: COHEN | W23: WILLIAMSTOWN | X23: 0 | Y23: 1 | Z23: 0 | AA23: 81 | AB23: 108 | AC23: 75 | AD23: 0 | CB23: {GOTO}AL103~/M{END}{RIGHT}{END}{DOWN}~P103~
A24: GOALKICKERS | W24: SANDRINGHAM | X24: 0 | Y24: 1 | Z24: 0 | AA24: 59 | AB24: 104 | AC24: 56.730769230769234 | AD24: 0 | CB24: {GOTO}BJ223~/M{RIGHT 7}{END}{DOWN}~V104~
A25: BRUNSWICK | C25: BURNS 4 | F25: LEYDIN 3 | I25: ROBINSON 2 | L25: McKINNON 2 | O25: WHILEY 2 | R25: HAGART | T25: ROGERS | CB25: {GOTO}BJ243~/M{RIGHT 7}{END}{DOWN}~G124~
A26: WILLIAMSTOWN | C26: HANCOCK 3 | F26: SZYSKA 2 | I26: TROTMAN 2 | L26: WARE 2 | N26: A VOSILAITIS | Q26: NANKERVIS | CB26: {GOTO}AL123~/M{END}{RIGHT}{END}{DOWN}~P123~
CB27: {GOTO}BJ263~/M{RIGHT 7}{END}{DOWN}~V124~
A28: COBURG | C28: 4 | D28: 7 | E28: =C28*6+D28 -> 31 | G28: 6 | H28: 9 | I28: =G28*6+H28 -> 45 | K28: 10 | L28: 14 | M28: =K28*6+L28 -> 74 | O28: 14 | P28: 14 | Q28: =O28*6+P28 -> 98 | S28: YARRAVILLE | CB28: {GOTO}BJ283~/M{RIGHT 7}{END}{DOWN}~G144~
A29: YARRAVILLE | C29: 2 | D29: 1 | E29: =C29*6+D29 -> 13 | G29: 5 | H29: 4 | I29: =G29*6+H29 -> 34 | K29: 7 | L29: 6 | M29: =K29*6+L29 -> 48 | O29: 11 | P29: 10 | Q29: =O29*6+P29 -> 76 | S29: CRAIG | CB29: {GOTO}AL143~/M{END}{RIGHT}{END}{DOWN}~P143~
A30: BEST PLAYERS | CB30: {GOTO}BJ303~/M{RIGHT 7}{END}{DOWN}~V144~
A31: COBURG | C31: SULLIVAN | F31: TANCREDI | I31: WELSH | L31: KARP | O31: PARDON | R31: McLACHLAN | CB31: {GOTO}BJ323~/M{RIGHT 7}{END}{DOWN}~G164~
A32: YARRAVILLE | C32: WARWICK | F32: BARR | I32: BONGETTI | L32: ROWE | O32: CONNELLY | R32: CASTRIKUM | CB32: {GOTO}AL163~/M{END}{RIGHT}{END}{DOWN}~P163~
A33: GOALKICKERS | CB33: {GOTO}BJ343~/M{RIGHT 7}{END}{DOWN}~V164~
A34: COBURG | C34: HILL 4 | F34: McLACHLAN 4 | J34: TYRELL 2 | M34: KARP | O34: BRANSTON | R34: PARDON | T34: BOSCHEN | CB34: {HOME}
A35: YARRAVILLE | C35: WARWICK 4 | F35: QUARANTOTTO 2 | J35: CONNELLY | M35: BONGETTI | O35: ROACH | Q35: HENDERSON | T35: ROWE
A37: WAVERLEY | C37: 2 | D37: 1 | E37: =C37*6+D37 -> 13 | G37: 7 | H37: 7 | I37: =G37*6+H37 -> 49 | K37: 10 | L37: 9 | M37: =K37*6+L37 -> 69 | O37: 14 | P37: 16 | Q37: =O37*6+P37 -> 100 | S37: WAVERLEY
A38: PRAHRAN | C38: 4 | D38: 3 | E38: =C38*6+D38 -> 27 | G38: 7 | H38: 3 | I38: =G38*6+H38 -> 45 | K38: 12 | L38: 9 | M38: =K38*6+L38 -> 81 | O38: 12 | P38: 12 | Q38: =O38*6+P38 -> 84 | S38: GANNON
A39: BEST PLAYERS
A40: WAVERLEY | C40: McKENZIE | F40: McGOWAN | I40: SEYMOUR | L40: McNAMEE | O40: POORE | R40: REEVES
A41: PRAHRAN | C41: LYNCH | F41: SHEEDY | I41: ALBISTON | L41: McMAHON | O41: KERLEY | R41: BUTLER
A42: GOALKICKERS
A43: WAVERLEY | C43: McGOWAN 3 | F43: McKENZIE 2 | I43: REEVES 2 | K43: LAWSON 2 | N43: POORE 2 | Q43: CARROLL | S43: GRANT | U43: PARKER
A44: PRAHRAN | C44: PEARSON 4 | F44: LYNCH 2 | I44: KERLEY 2 | K44: ALBISTON 2 | N44: VERWOERT | Q44: McLAREN
A46: PRESTON | C46: 3 | D46: 5 | E46: =C46*6+D46 -> 23 | G46: 5 | H46: 6 | I46: =G46*6+H46 -> 36 | K46: 12 | L46: 12 | M46: =K46*6+L46 -> 84 | O46: 15 | P46: 14 | Q46: =O46*6+P46 -> 104 | S46: PRESTON
A47: SANDRINGHAM | C47: 2 | D47: 2 | E47: =C47*6+D47 -> 14 | G47: 5 | H47: 6 | I47: =G47*6+H47 -> 36 | K47: 6 | L47: 9 | M47: =K47*6+L47 -> 45 | O47: 7 | P47: 17 | Q47: =O47*6+P47 -> 59 | S47: JACKSON
A48: BEST PLAYERS
A49: PRESTON | C49: MOUNTNEY | F49: WALKER | I49: DELLAMARTA | L49: HORTON | O49: DALTON | R49: CHAPMAN
A50: SANDRINGHAM | C50: VAUGHAN | F50: HARRISON | I50: WARD | L50: HANCE | O50: K WILLS | R50: MACKENZIE
A51: GOALKICKERS
A52: PRESTON | C52: WALKER 8 | F52: JOYCE 2 | I52: MURNANE | K52: DALTON | M52: CHAPMAN | O52: HEPPER | Q52: DELLAMARTA
A53: SANDRINGHAM | C53: ADDISON 3 | F53: ZEUSCHNER | I53: O'DWYER | K53: GRANGER | M53: K WILLS
A55: ROUND 2 | E55: 29TH APRIL | J55: WEATHER | M55: SOUTH WIND HEAVY RAIN 1ST QTR | S55: PLAYED AT
D56: 1ST QTR | H56: 2ND QTR | L56: 3RD QTR | P56: FINAL | S56: COBURG
A57: BRUNSWICK | C57: 5 | D57: 7 | E57: =C57*6+D57 -> 37 | G57: 6 | H57: 15 | I57: =G57*6+H57 -> 51 | K57: 12 | L57: 18 | M57: =K57*6+L57 -> 90 | O57: 13 | P57: 18 | Q57: =O57*6+P57 -> 96 | S57: UMPIRE | X57: LADDER | AB57: ROUND | AD57: 2
A58: COBURG | C58: 0 | D58: 1 | E58: =C58*6+D58 -> 1 | G58: 6 | H58: 4 | I58: =G58*6+H58 -> 40 | K58: 7 | L58: 8 | M58: =K58*6+L58 -> 50 | O58: 12 | P58: 10 | Q58: =O58*6+P58 -> 82 | S58: GARLICK
A59: BEST PLAYERS | W59: TEAM | X59: W | Y59: L | Z59: D | AA59: FOR | AB59: AGST | AC59: % | AD59: PTS
A60: BRUNSWICK | C60: BIBBY | F60: McGRATH | I60: KICK | L60: HAGART | N60: McKINNON | Q60: LIMBOM
A61: COBURG | C61: THOMPSON | F61: TANCREDI | I61: SULLIVAN | L61: HAYES | N61: OATEN | Q61: PALMER | W61: BRUNSWICK | X61: 2 | Y61: 0 | Z61: 0 | AA61: 204 | AB61: 163 | AC61: 125.15337423312883 | AD61: 8
A62: GOALKICKERS | W62: YARRAVILLE | X62: 1 | Y62: 1 | Z62: 0 | AA62: 233 | AB62: 145 | AC62: 160.68965517241378 | AD62: 4
A63: BRUNSWICK | C63: HAGART 4 | F63: McKINNON 2 | I63: WHILEY 2 | K63: KICK | M63: LEYDIN | O63: BIBBY | Q63: NOONAN | S63: LIMBOM | W63: PRESTON | X63: 1 | Y63: 1 | Z63: 0 | AA63: 196 | AB63: 170 | AC63: 115.29411764705883 | AD63: 4
A64: COBURG | C64: PALMER 4 | F64: THOMPSON 4 | I64: TYRELL 2 | L64: PARDON | N64: McLACHLAN | W64: WAVERLEY | X64: 1 | Y64: 1 | Z64: 0 | AA64: 180 | AB64: 165 | AC64: 109.09 | AD64: 4
A66: DANDENONG | C66: 6 | D66: 3 | E66: =C66*6+D66 -> 39 | G66: 12 | H66: 3 | I66: =G66*6+H66 -> 75 | K66: 16 | L66: 4 | M66: =K66*6+L66 -> 100 | O66: 17 | P66: 9 | Q66: =O66*6+P66 -> 111 | S66: DANDENONG | W66: DANDENONG | X66: 1 | Y66: 1 | Z66: 0 | AA66: 201 | AB66: 190 | AC66: 105.78947368421052 | AD66: 4
A67: PRESTON | C67: 1 | D67: 6 | E67: =C67*6+D67 -> 12 | G67: 7 | H67: 8 | I67: =G67*6+H67 -> 50 | K67: 8 | L67: 12 | M67: =K67*6+L67 -> 60 | O67: 13 | P67: 14 | Q67: =O67*6+P67 -> 92 | S67: CHAPMAN | W67: COBURG | X67: 1 | Y67: 1 | Z67: 0 | AA67: 180 | AB67: 172 | AC67: 104.65116279069767 | AD67: 4
A68: BEST PLAYERS | W68: WILLIAMSTOWN | X68: 1 | Y68: 1 | Z68: 0 | AA68: 154 | AB68: 151 | AC68: 101.98675496688742 | AD68: 4
A69: DANDENONG | C69: EVANS | F69: MORROW | I69: STEDWELL | L69: McDONALD | O69: ROUVRAY | R69: SAVVA | W69: PORT MELBOURNE | X69: 1 | Y69: 1 | Z69: 0 | AA69: 141 | AB69: 163 | AC69: 86.50306748466258 | AD69: 4
A70: PRESTON | C70: DALTON | F70: WALKER | I70: HINDMARSH | L70: MURNANE | O70: CHAPMAN | R70: G PERRY | W70: SANDRINGHAM | X70: 1 | Y70: 1 | Z70: 0 | AA70: 140 | AB70: 184 | AC70: 76.086956521739125 | AD70: 4
A71: GOALKICKERS | Q71: SAVVA | S71: TOWNSEND | W71: PRAHRAN | X71: 0 | Y71: 2 | Z71: 0 | AA71: 131 | AB71: 257 | AC71: 50.97 | AD71: 0
A72: DANDENONG | C72: McDONALD 4 | F72: ROUVRAY 3 | I72: MORROW 2 | L72: B SMITH 2 | N72: LIENERT | P72: STEDWELL | R72: EVANS | T72: MELAI
A73: PRESTON | C73: WALKER 7 | F73: DALTON 3 | I73: HEPPER 2 | L73: G PERRY
A75: YARRAVILLE | C75: 7 | D75: 2 | E75: =C75*6+D75 -> 44 | G75: 14 | H75: 4 | I75: =G75*6+H75 -> 88 | K75: 17 | L75: 6 | M75: =K75*6+L75 -> 108 | O75: 24 | P75: 13 | Q75: =O75*6+P75 -> 157 | S75: TOORAK PARK
A76: PRAHRAN | C76: 0 | D76: 2 | E76: =C76*6+D76 -> 2 | G76: 3 | H76: 5 | I76: =G76*6+H76 -> 23 | K76: 4 | L76: 8 | M76: =K76*6+L76 -> 32 | O76: 6 | P76: 11 | Q76: =O76*6+P76 -> 47 | S76: ROWE
A77: BEST PLAYERS
A78: YARRAVILLE | C78: BONGETTI | F78: WARWICK | I78: CASTIKUM | L78: FOGARTY | O78: BEATTIE | R78: McCARTHY
A79: PRAHRAN | C79: KERLEY | F79: BUTLER | I79: BARTLETT | L79: VERWOERT | O79: DICKESON | R79: McMAHON
A80: GOALKICKERS
A81: YARRAVILLE | C81: MADIGAN 4 | F81: BONGETTI 3 | I81: ROWE 3 | K81: WARWICK 3 | N81: BARR 3 | P81: FOGARTY 3 | R81: BEATTIE 2 | U81: SICELY | W81: CONNELLY | X81: McDONALD
A82: PRAHRAN | C82: VERWOERT 3 | F82: KERLEY 2 | I82: PEARSON
A84: WILLIAMSTOWN | C84: 3 | D84: 2 | E84: =C84*6+D84 -> 20 | G84: 4 | H84: 3 | I84: =G84*6+H84 -> 27 | K84: 6 | L84: 8 | M84: =K84*6+L84 -> 44 | O84: 10 | P84: 13 | Q84: =O84*6+P84 -> 73 | S84: WILLIAMSTOWN
A85: PORT MELBOURNE | C85: 1 | D85: 3 | E85: =C85*6+D85 -> 9 | G85: 2 | H85: 11 | I85: =G85*6+H85 -> 23 | K85: 3 | L85: 14 | M85: =K85*6+L85 -> 32 | O85: 4 | P85: 19 | Q85: =O85*6+P85 -> 43 | S85: TURNER
A86: BEST PLAYERS
A87: WILLIAMSTOWN | C87: RUSSELL | F87: TROTMAN | I87: MADIGAN | L87: O'MARA | O87: VANDENBERG | R87: COHEN
A88: PORT MELBOURNE | C88: KERR | F88: BONNETT | I88: TAGGART | L88: BOLLARD | O88: CAULFIELD | R88: HOWELL
A89: GOALKICKERS
A90: WILLIAMSTOWN | C90: HANCOCK 4 | F90: WARE 3 | I90: SYZSKA | K90: COHEN | M90: FOWLER
A91: PORT MELBOURNE | C91: BRICE 2 | F91: HOWELL | I91: PECK
A93: SANDRINGHAM | C93: 0 | D93: 3 | E93: =C93*6+D93 -> 3 | G93: 3 | H93: 6 | I93: =G93*6+H93 -> 24 | K93: 8 | L93: 7 | M93: =K93*6+L93 -> 55 | O93: 12 | P93: 9 | Q93: =O93*6+P93 -> 81 | S93: BEACH ROAD
A94: WAVERLEY | C94: 2 | D94: 3 | E94: =C94*6+D94 -> 15 | G94: 3 | H94: 11 | I94: =G94*6+H94 -> 29 | K94: 6 | L94: 15 | M94: =K94*6+L94 -> 51 | O94: 10 | P94: 20 | Q94: =O94*6+P94 -> 80 | S94: DIXON
A95: BEST PLAYERS
A96: SANDRINGHAM | C96: MACKENZIE | F96: SELLECK | I96: CLIFFORD | L96: NOWLAN | O96: WARD | R96: O'DWYER
A97: WAVERLEY | C97: McNAMARA | F97: LAWSON | I97: McGOWAN | L97: PROBYN | O97: McKENZIE | R97: CARROLL
A98: GOALKICKERS
A99: SANDRINGHAM | C99: O'DWYER 2 | F99: DE LUCA 2 | I99: MUTER 2 | K99: MACKENZIE 2 | N99: ZEUSCHNER | Q99: WESTON | S99: THOMPSON | V99: CHAPMAN
A100: WAVERLEY | C100: LAWSON 3 | F100: CARROLL 2 | I100: McKENZIE 2 | L100: BELL | N100: PETZKE | P100: DOYLE
A102: ROUND 3 | E102: 6TH MAY | J102: WEATHER | N102: RAIN DULL DAY | S102: PLAYED AT
D103: 1ST QTR | H103: 2ND QTR | L103: 3RD QTR | P103: FINAL | S103: YARRAVILLE
A104: YARRAVILLE | C104: 4 | D104: 3 | E104: =C104*6+D104 -> 27 | G104: 11 | H104: 5 | I104: =G104*6+H104 -> 71 | K104: 14 | L104: 7 | M104: =K104*6+L104 -> 91 | O104: 15 | P104: 10 | Q104: =O104*6+P104 -> 100 | S104: UMPIRE | X104: LADDER | AB104: ROUND | AD104: 3
A105: WAVERLEY | C105: 5 | D105: 1 | E105: =C105*6+D105 -> 31 | G105: 8 | H105: 5 | I105: =G105*6+H105 -> 53 | K105: 13 | L105: 7 | M105: =K105*6+L105 -> 85 | O105: 14 | P105: 9 | Q105: =O105*6+P105 -> 93 | S105: O'NEILL
A106: BEST PLAYERS | W106: TEAM | X106: W | Y106: L | Z106: D | AA106: FOR | AB106: AGST | AC106: % | AD106: PTS
A107: YARRAVILLE | C107: CASTRIKUM | F107: BEATTIE | I107: BONGETTI | L107: WARWICK | O107: MATHERSON | R107: HENDERSON
A108: WAVERLEY | C108: LAWSON | F108: CHRISTIE | I108: BELL | L108: MORDEN | O108: McNAMEE | R108: DOYLE | W108: BRUNSWICK | X108: 3 | Y108: 0 | Z108: 0 | AA108: 290 | AB108: 243 | AC108: 119.34156378600824 | AD108: 12
A109: GOALKICKERS | W109: YARRAVILLE | X109: 2 | Y109: 1 | Z109: 0 | AA109: 333 | AB109: 238 | AC109: 139.91596638655463 | AD109: 8
A110: YARRAVILLE | C110: WARWICK 4 | F110: MADIGAN 3 | I110: ROWE 2 | K110: CONNELLY 2 | N110: BEATTIE 2 | Q110: BARR | R110: FOGARTY | W110: PORT MELBOURNE | X110: 2 | Y110: 1 | Z110: 0 | AA110: 259 | AB110: 236 | AC110: 109.7457627118644 | AD110: 8
A111: WAVERLEY | C111: DOYLE 4 | E111: LAWSON 3 | H111: CHRISTIE 2 | K111: McGOWAN | M111: POORE | O111: CARROLL | Q111: BELL | R111: CORSTORPHIN | W111: DANDENONG | X111: 2 | Y111: 1 | Z111: 0 | AA111: 314 | AB111: 288 | AC111: 109.02777777777777 | AD111: 8
E112: 7TH MAY | J112: WEATHER
A113: BRUNSWICK | C113: 3 | D113: 5 | E113: =C113*6+D113 -> 23 | G113: 7 | H113: 7 | I113: =G113*6+H113 -> 49 | K113: 9 | L113: 13 | M113: =K113*6+L113 -> 67 | O113: 12 | P113: 14 | Q113: =O113*6+P113 -> 86 | S113: BRUNSWICK | W113: PRESTON | X113: 1 | Y113: 2 | Z113: 0 | AA113: 276 | AB113: 256 | AC113: 107.8125 | AD113: 4
A114: PRESTON | C114: 3 | D114: 3 | E114: =C114*6+D114 -> 21 | G114: 6 | H114: 6 | I114: =G114*6+H114 -> 42 | K114: 9 | L114: 6 | M114: =K114*6+L114 -> 60 | O114: 11 | P114: 14 | Q114: =O114*6+P114 -> 80 | S114: ROWE | W114: WAVERLEY | X114: 1 | Y114: 2 | Z114: 0 | AA114: 273 | AB114: 265 | AC114: 103.02 | AD114: 4
A115: BEST PLAYERS | W115: COBURG | X115: 1 | Y115: 2 | Z115: 0 | AA115: 278 | AB115: 285 | AC115: 97.543859649122808 | AD115: 4
A116: BRUNSWICK | C116: BIBBY | F116: LEYDIN | I116: HAGART | L116: McKINNON | O116: WILSON | R116: McGRATH | W116: WILLIAMSTOWN | X116: 1 | Y116: 2 | Z116: 0 | AA116: 224 | AB116: 260 | AC116: 86.15384615384616 | AD116: 4
A117: PRESTON | C117: JOYCE | F117: MURNANE | I117: DALTON | L117: HINDMARSH | O117: MOUNTNEY | R117: CHAPMAN | W117: PRAHRAN | X117: 1 | Y117: 2 | Z117: 0 | AA117: 240 | AB117: 327 | AC117: 73.39 | AD117: 4
A118: GOALKICKERS | W118: SANDRINGHAM | X118: 1 | Y118: 2 | Z118: 0 | AA118: 213 | AB118: 302 | AC118: 70.52980132450331 | AD118: 4
A119: BRUNSWICK | C119: WHILEY 4 | F119: HAGART 2 | I119: ROBINSON 2 | L119: LEYDIN 2 | N119: McKINNON 2
A120: PRESTON | C120: WALKER 3 | F120: WADDELL 3 | I120: HINDMARSH 2 | L120: DALTON | N120: MURNANE | Q120: SCHICKERT
A122: DANDENONG | C122: 4 | D122: 4 | E122: =C122*6+D122 -> 28 | G122: 9 | H122: 7 | I122: =G122*6+H122 -> 61 | K122: 14 | L122: 9 | M122: =K122*6+L122 -> 93 | O122: 17 | P122: 11 | Q122: =O122*6+P122 -> 113 | S122: DANDENONG
A123: COBURG | C123: 1 | D123: 5 | E123: =C123*6+D123 -> 11 | G123: 4 | H123: 7 | I123: =G123*6+H123 -> 31 | K123: 8 | L123: 10 | M123: =K123*6+L123 -> 58 | O123: 14 | P123: 14 | Q123: =O123*6+P123 -> 98 | S123: HENDERSON
A124: BEST PLAYERS
A125: DANDENONG | C125: SMITH | F125: STEDWELL | I125: HILL | L125: MORROW | O125: McDONALD | R125: EVANS
A126: COBURG | C126: TANCREDI | F126: PALMER | I126: THOMPSON | L126: McNABB | O126: PARDON | R126: SULLIVAN
A127: GOALKICKERS
A128: DANDENONG | C128: SMITH 4 | F128: MORROW 3 | I128: MILLER 3 | L128: McDONALD 3 | O128: MELAI 2 | Q128: TOWNSEND | T128: HILL
A129: COBURG | C129: PALMER 4 | F129: McNABB 3 | I129: GONINAN 2 | L129: McLACHLAN 2 | O129: TYRELL | Q129: SCHULZE | T129: GRAHAM
A131: PORT MELBOURNE | C131: 7 | D131: 2 | E131: =C131*6+D131 -> 44 | G131: 10 | H131: 6 | I131: =G131*6+H131 -> 66 | K131: 16 | L131: 8 | M131: =K131*6+L131 -> 104 | O131: 18 | P131: 10 | Q131: =O131*6+P131 -> 118 | S131: PORT MELBOURNE
A132: SANDRINGHAM | C132: 4 | D132: 0 | E132: =C132*6+D132 -> 24 | G132: 7 | H132: 2 | I132: =G132*6+H132 -> 44 | K132: 8 | L132: 5 | M132: =K132*6+L132 -> 53 | O132: 11 | P132: 7 | Q132: =O132*6+P132 -> 73 | S132: GANNON
A133: BEST PLAYERS
A134: PORT MELBOURNE | C134: WILLIAMS | F134: KERR | I134: BONNETT | L134: TAGGART | O134: BEDFORD | R134: BUCKLEY
A135: SANDRINGHAM | C135: LADDS | F135: GRANGER | I135: O'DWYER | L135: HANCE | O135: MACKENZIE | R135: WARD
A136: GOALKICKERS
A137: PORT MELBOURNE | C137: PECK 6 | E137: BOLLARD 3 | H137: TAGGART 2 | K137: BEDFORD 2 | N137: BRICE 2 | P137: HOWELL | R137: BONNETT | U137: COLLINS
A138: SANDRINGHAM | C138: HANCE 2 | F138: CHAPMAN 2 | I138: ADDISON 2 | L138: O'DWYER 2 | O138: GRANGER 2 | R138: THOMPSON
A140: PRAHRAN | C140: 1 | D140: 6 | E140: =C140*6+D140 -> 12 | G140: 7 | H140: 11 | I140: =G140*6+H140 -> 53 | K140: 10 | L140: 18 | M140: =K140*6+L140 -> 78 | O140: 15 | P140: 19 | Q140: =O140*6+P140 -> 109 | S140: TOORAK PARK
A141: WILLIAMSTOWN | C141: 5 | D141: 3 | E141: =C141*6+D141 -> 33 | G141: 5 | H141: 3 | I141: =G141*6+H141 -> 33 | K141: 7 | L141: 7 | M141: =K141*6+L141 -> 49 | O141: 10 | P141: 10 | Q141: =O141*6+P141 -> 70 | S141: CRAIG
A142: BEST PLAYERS
A143: PRAHRAN | C143: WOODLEY | F143: LYNCH | I143: WYND | L143: CULPIN | O143: ALBISTON | R143: MINTON-CONNELL
A144: WILLIAMSTOWN | C144: WARE | F144: VANDENBERG | I144: MADIGAN | L144: FOWLER | O144: NANKERVIS | R144: HANCOCK
A145: GOALKICKERS
A146: PRAHRAN | C146: BARTLETT 4 | F146: PEARSON 4 | I146: LYNCH 2 | K146: VERWOERT 2 | N146: McMAHON | Q146: RICHARDSON | T146: ALBISTON
A147: WILLIAMSTOWN | C147: EVANS 3 | F147: A VOSILAITIS 2 | J147: NANKERVIS 2 | M147: HANCOCK | P147: FOWLER | R147: HIGGINS
A149: ROUND 4 | E149: 13TH MAY | J149: WEATHER | N149: LIGHT RAIN 2ND HALF | S149: PLAYED AT
D150: 1ST QTR | H150: 2ND QTR | L150: 3RD QTR | P150: FINAL | S150: PRESTON
A151: PORT MELBOURNE | C151: 1 | D151: 0 | E151: =C151*6+D151 -> 6 | G151: 4 | H151: 8 | I151: =G151*6+H151 -> 32 | K151: 5 | L151: 11 | M151: =K151*6+L151 -> 41 | O151: 9 | P151: 21 | Q151: =O151*6+P151 -> 75 | S151: UMPIRE | X151: LADDER | AB151: ROUND | AD151: 4
A152: PRESTON | C152: 3 | D152: 7 | E152: =C152*6+D152 -> 25 | G152: 4 | H152: 8 | I152: =G152*6+H152 -> 32 | K152: 7 | L152: 11 | M152: =K152*6+L152 -> 53 | O152: 7 | P152: 15 | Q152: =O152*6+P152 -> 57 | S152: ANDERSON
A153: BEST PLAYERS | W153: TEAM | X153: W | Y153: L | Z153: D | AA153: FOR | AB153: AGST | AC153: % | AD153: PTS
A154: PORT MELBOURNE | C154: TAGGART | F154: BUCKLEY | I154: KERR | K154: WILLIAMS | N154: BEDFORD | Q154: BRICE
A155: PRESTON | C155: MURNANE | F155: DALTON | I155: BOND | K155: DIXON | N155: CHAPMAN | Q155: HINDMARSH | W155: BRUNSWICK | X155: 4 | Y155: 0 | Z155: 0 | AA155: 402 | AB155: 310 | AC155: 129.67741935483872 | AD155: 16
A156: GOALKICKERS | W156: YARRAVILLE | X156: 3 | Y156: 1 | Z156: 0 | AA156: 431 | AB156: 298 | AC156: 144.63087248322148 | AD156: 12
A157: PORT MELBOURNE | C157: PECK 2 | F157: BROWNHILL 2 | I157: WILLIAMS | K157: BOLLARD | M157: IRELAND | O157: BUCKLEY | Q157: TAGGART | W157: PORT MELBOURNE | X157: 3 | Y157: 1 | Z157: 0 | AA157: 334 | AB157: 293 | AC157: 113.99317406143345 | AD157: 12
A158: PRESTON | C158: DALTON 2 | F158: JOYCE | H158: HINDMARSH | K158: WALKER | M158: WADDELL | P158: DELLAMARTA | W158: DANDENONG | X158: 3 | Y158: 1 | Z158: 0 | AA158: 431 | AB158: 388 | AC158: 111.08247422680412 | AD158: 12
A160: BRUNSWICK | C160: 0 | D160: 8 | E160: =C160*6+D160 -> 8 | G160: 5 | H160: 13 | I160: =G160*6+H160 -> 43 | K160: 13 | L160: 18 | M160: =K160*6+L160 -> 96 | O160: 15 | P160: 22 | Q160: =O160*6+P160 -> 112 | S160: WAVERLEY | W160: COBURG | X160: 2 | Y160: 2 | Z160: 0 | AA160: 342 | AB160: 345 | AC160: 99.130434782608702 | AD160: 8
A161: WAVERLEY | C161: 2 | D161: 3 | E161: =C161*6+D161 -> 15 | G161: 3 | H161: 6 | I161: =G161*6+H161 -> 24 | K161: 4 | L161: 7 | M161: =K161*6+L161 -> 31 | O161: 9 | P161: 13 | Q161: =O161*6+P161 -> 67 | S161: TOOHEY | W161: PRESTON | X161: 1 | Y161: 3 | Z161: 0 | AA161: 333 | AB161: 331 | AC161: 100.60422960725076 | AD161: 4
A162: BEST PLAYERS | W162: WAVERLEY | X162: 1 | Y162: 3 | Z162: 0 | AA162: 340 | AB162: 377 | AC162: 90.19 | AD162: 4
A163: BRUNSWICK | C163: ROBINSON | F163: BIBBY | I163: ARTHUR | L163: ROBINS | N163: PENDLEBURY | Q163: WILSON | W163: WILLIAMSTOWN | X163: 1 | Y163: 3 | Z163: 0 | AA163: 284 | AB163: 358 | AC163: 79.32960893854748 | AD163: 4
A164: WAVERLEY | C164: HUDSON | F164: LAWSON | I164: ELLIS | L164: BELL | N164: PROBYN | Q164: LOCKWOOD | W164: PRAHRAN | X164: 1 | Y164: 3 | Z164: 0 | AA164: 300 | AB164: 391 | AC164: 76.73 | AD164: 4
A165: GOALKICKERS | W165: SANDRINGHAM | X165: 1 | Y165: 3 | Z165: 0 | AA165: 313 | AB165: 419 | AC165: 74.701670644391413 | AD165: 4
A166: BRUNSWICK | C166: ARTHUR 5 | F166: ROBINSON 5 | I166: PENDLEBURY 3 | L166: LEYDIN 2
A167: WAVERLEY | C167: DOYLE 3 | F167: McKENZIE 3 | I167: LAWSON 2 | L167: McGOWAN
A169: COBURG | C169: 4 | D169: 9 | E169: =C169*6+D169 -> 33 | G169: 4 | H169: 11 | I169: =G169*6+H169 -> 35 | K169: 8 | L169: 14 | M169: =K169*6+L169 -> 62 | O169: 8 | P169: 16 | Q169: =O169*6+P169 -> 64 | S169: COBURG
A170: PRAHRAN | C170: 0 | D170: 0 | E170: =C170*6+D170 -> 0 | G170: 2 | H170: 4 | I170: =G170*6+H170 -> 16 | K170: 3 | L170: 5 | M170: =K170*6+L170 -> 23 | O170: 9 | P170: 6 | Q170: =O170*6+P170 -> 60 | S170: CHAPLIN
A171: BEST PLAYERS
A172: COBURG | C172: TANCREDI | F172: SULLIVAN | I172: PALMER | L172: PARDON | O172: OATEN | R172: VINCENT
A173: PRAHRAN | C173: DICKESON | F173: WYND | I173: SKIDMORE | L173: KERLEY | O173: VERWOERT | R173: ALBISTON
A174: GOALKICKERS
A175: COBURG | C175: BOSCHEN 2 | F175: McNABB 2 | I175: PARDON | L175: GONINON | N175: PALMER | Q175: GOSS
A176: PRAHRAN | C176: BARTLETT 3 | F176: KERLEY 3 | I176: ALBISTON | L176: WYND
A178: YARRAVILLE | C178: 1 | D178: 3 | E178: =C178*6+D178 -> 9 | G178: 6 | H178: 5 | I178: =G178*6+H178 -> 41 | K178: 10 | L178: 6 | M178: =K178*6+L178 -> 66 | O178: 15 | P178: 8 | Q178: =O178*6+P178 -> 98 | S178: WILLIAMSTOWN
A179: WILLIAMSTOWN | C179: 3 | D179: 6 | E179: =C179*6+D179 -> 24 | G179: 5 | H179: 11 | I179: =G179*6+H179 -> 41 | K179: 5 | L179: 14 | M179: =K179*6+L179 -> 44 | O179: 7 | P179: 18 | Q179: =O179*6+P179 -> 60 | S179: GANNON
A180: BEST PLAYERS
A181: YARRAVILLE | C181: CASTIKUM | F181: MADIGAN | I181: GROSE | L181: LEAHY | N181: ROWE | Q181: WILSON
A182: WILLIAMSTOWN | C182: COHEN | F182: MURRAY | I182: HANCOCK | L182: WARE | N182: NANKERVIS | Q182: SZYSKA
A183: GOALKICKERS
A184: YARRAVILLE | C184: LEAHY 3 | E184: MADIGAN 3 | H184: BARR 2 | J184: BEATTIE 2 | M184: FOGARTY | O184: MATHERSON | R184: BONGETTI | U184: WARWICK | X184: McDONALD
A185: WILLIAMSTOWN | C185: NANKERVIS 2 | F185: A VOSILAITIS | I185: SZYSKA | K185: HANCOCK | M185: TROTMAN | P185: EVANS
A187: DANDENONG | C187: 6 | D187: 8 | E187: =C187*6+D187 -> 44 | G187: 8 | H187: 12 | I187: =G187*6+H187 -> 60 | K187: 16 | L187: 13 | M187: =K187*6+L187 -> 109 | O187: 17 | P187: 15 | Q187: =O187*6+P187 -> 117 | S187: BEACH ROAD
A188: SANDRINGHAM | C188: 2 | D188: 1 | E188: =C188*6+D188 -> 13 | G188: 6 | H188: 9 | I188: =G188*6+H188 -> 45 | K188: 11 | L188: 9 | M188: =K188*6+L188 -> 75 | O188: 14 | P188: 16 | Q188: =O188*6+P188 -> 100 | S188: TURNER
A189: BEST PLAYERS
A190: DANDENONG | C190: STEDWELL | F190: EVANS | I190: McDONALD | L190: SAVVA | O190: MELAI | R190: SUTTON
A191: SANDRINGHAM | C191: WARD | F191: SELLECK | I191: MACKENZIE | L191: VAUGHAN | O191: DE LUCA | R191: FENTON
A192: GOALKICKERS
A193: DANDENONG | C193: MILLER 4 | E193: MORROW 3 | H193: SMITH 3 | J193: SAVVA 3 | M193: McDONALD 2 | P193: RON WETZELL | S193: STEDWELL
A194: SANDRINGHAM | C194: ZEUSCHNER 4 | F194: DE LUCA 3 | I194: DIXON 2 | K194: SELLECK 2 | N194: GRANGER | P194: FENTON | R194: K WILLS
A196: ROUND 5 | E196: 21ST MAY | J196: WEATHER | N196: FINE | S196: PLAYED AT
D197: 1ST QTR | H197: 2ND QTR | L197: 3RD QTR | P197: FINAL | S197: BRUNSWICK
A198: YARRAVILLE | C198: 1 | D198: 3 | E198: =C198*6+D198 -> 9 | G198: 4 | H198: 4 | I198: =G198*6+H198 -> 28 | K198: 7 | L198: 7 | M198: =K198*6+L198 -> 49 | O198: 13 | P198: 8 | Q198: =O198*6+P198 -> 86 | S198: UMPIRE | X198: LADDER | AB198: ROUND | AD198: 5
A199: BRUNSWICK | C199: 7 | D199: 3 | E199: =C199*6+D199 -> 45 | G199: 9 | H199: 5 | I199: =G199*6+H199 -> 59 | K199: 10 | L199: 8 | M199: =K199*6+L199 -> 68 | O199: 12 | P199: 9 | Q199: =O199*6+P199 -> 81 | S199: ARMSTRONG
A200: BEST PLAYERS | W200: TEAM | X200: W | Y200: L | Z200: D | AA200: FOR | AB200: AGST | AC200: % | AD200: PTS
A201: YARRAVILLE | C201: WARWICK | F201: CONNELLY | I201: HENDERSON | L201: MADIGAN | O201: GROSE | Q201: CASTRIKUM
A202: BRUNSWICK | C202: BIBBY | F202: ROGERS | I202: ROBINSON | L202: BURNS | O202: KICK | Q202: LEYDIN | W202: YARRAVILLE | X202: 4 | Y202: 1 | Z202: 0 | AA202: 517 | AB202: 379 | AC202: 136.41160949868075 | AD202: 16
A203: GOALKICKERS | W203: BRUNSWICK | X203: 4 | Y203: 1 | Z203: 0 | AA203: 483 | AB203: 396 | AC203: 121.96969696969697 | AD203: 16
A204: YARRAVILLE | C204: LEAHY 3 | E204: BEATTIE 3 | H204: MADIGAN 2 | K204: BONGETTI 2 | N204: BARR | P204: WARWICK | R204: MATHESON | W204: PORT MELBOURNE | X204: 4 | Y204: 1 | Z204: 0 | AA204: 424 | AB204: 357 | AC204: 118.76750700280112 | AD204: 16
A205: BRUNSWICK | C205: ROBINSON 4 | F205: BURNS 3 | I205: LEYDIN 2 | K205: WHILEY 2 | N205: ROGERS | W205: DANDENONG | X205: 4 | Y205: 1 | Z205: 0 | AA205: 531 | AB205: 475 | AC205: 111.78947368421052 | AD205: 16
A207: COBURG | C207: 4 | D207: 3 | E207: =C207*6+D207 -> 27 | G207: 6 | H207: 5 | I207: =G207*6+H207 -> 41 | K207: 11 | L207: 11 | M207: =K207*6+L207 -> 77 | O207: 15 | P207: 15 | Q207: =O207*6+P207 -> 105 | S207: COBURG | W207: COBURG | X207: 3 | Y207: 2 | Z207: 0 | AA207: 447 | AB207: 430 | AC207: 103.95348837209302 | AD207: 12
A208: PRESTON | C208: 3 | D208: 1 | E208: =C208*6+D208 -> 19 | G208: 8 | H208: 3 | I208: =G208*6+H208 -> 51 | K208: 10 | L208: 4 | M208: =K208*6+L208 -> 64 | O208: 13 | P208: 7 | Q208: =O208*6+P208 -> 85 | S208: CRAIG | W208: SANDRINGHAM | X208: 2 | Y208: 3 | Z208: 0 | AA208: 413 | AB208: 500 | AC208: 82.6 | AD208: 8
A209: BEST PLAYERS | W209: PRESTON | X209: 1 | Y209: 4 | Z209: 0 | AA209: 418 | AB209: 436 | AC209: 95.871559633027516 | AD209: 4
A210: COBURG | C210: TANCREDI | F210: THOMPSON | I210: PARTRIDGE | L210: GONINON | O210: HUGHES | R210: HILL | W210: WAVERLEY | X210: 1 | Y210: 4 | Z210: 0 | AA210: 404 | AB210: 467 | AC210: 86.51 | AD210: 4
A211: PRESTON | C211: LEMPRIERE | F211: CAMERON | I211: MURNANE | L211: JOYCE | O211: DALTON | W211: WILLIAMSTOWN | X211: 1 | Y211: 4 | Z211: 0 | AA211: 365 | AB211: 458 | AC211: 79.6943231441048 | AD211: 4
A212: GOALKICKERS | N212: THOMPSON | Q212: BOSCHEN | W212: PRAHRAN | X212: 1 | Y212: 4 | Z212: 0 | AA212: 387 | AB212: 491 | AC212: 78.82 | AD212: 4
A213: COBURG | C213: GONINAN 4 | F213: PARTRIDGE 3 | I213: McNABB 2 | L213: PALMER | N213: SULLIVAN | Q213: HILL | R213: PARDON
A214: PRESTON | C214: WALKER 3 | F214: JOYCE 3 | I214: DALTON 2 | L214: HORTON 2 | N214: LEMPRIERE 2 | Q214: CHAPMAN
A216: PORT MELBOURNE | C216: 1 | D216: 5 | E216: =C216*6+D216 -> 11 | G216: 6 | H216: 9 | I216: =G216*6+H216 -> 45 | K216: 8 | L216: 12 | M216: =K216*6+L216 -> 60 | O216: 12 | P216: 18 | Q216: =O216*6+P216 -> 90 | S216: PORT MELBOURNE
A217: WAVERLEY | C217: 4 | D217: 3 | E217: =C217*6+D217 -> 27 | G217: 5 | H217: 7 | I217: =G217*6+H217 -> 37 | K217: 8 | L217: 9 | M217: =K217*6+L217 -> 57 | O217: 9 | P217: 10 | Q217: =O217*6+P217 -> 64 | S217: JACKSON
A218: BEST PLAYERS
A219: PORT MELBOURNE | C219: BOLLARD | F219: BRICE | I219: BUCKLEY | L219: BONNETT | O219: RENOUF | R219: ROWLAND
A220: WAVERLEY | C220: McNAMEE | F220: HUDSON | I220: McLEAN | L220: POORE | O220: SEYMOUR | R220: ELLIS
A221: GOALKICKERS
A222: PORT MELBOURNE | C222: BOLLARD 4 | F222: BROWNHILL 3 | I222: HOWELL 2 | L222: BRICE 2 | N222: ROWLAND
A223: WAVERLEY | C223: McKENZIE 2 | F223: REEVES 2 | I223: LAWSON 2 | L223: DOYLE 2 | N223: REID
A225: SANDRINGHAM | C225: 3 | D225: 4 | E225: =C225*6+D225 -> 22 | G225: 6 | H225: 3 | I225: =G225*6+H225 -> 39 | K225: 10 | L225: 12 | M225: =K225*6+L225 -> 72 | O225: 14 | P225: 16 | Q225: =O225*6+P225 -> 100 | S225: WILLIAMSTOWN
A226: WILLIAMSTOWN | C226: 3 | D226: 0 | E226: =C226*6+D226 -> 18 | G226: 6 | H226: 9 | I226: =G226*6+H226 -> 45 | K226: 7 | L226: 12 | M226: =K226*6+L226 -> 54 | O226: 11 | P226: 15 | Q226: =O226*6+P226 -> 81 | S226: HENDERSON
A227: BEST PLAYERS
A228: SANDRINGHAM | C228: SELLECK | F228: VAUGHAN | I228: HOGAN | L228: HANCE | N228: HARRISON | Q228: MACKENZIE
A229: WILLIAMSTOWN | C229: HIGGINS | F229: WHITTINGTON | I229: WARE | L229: COHEN | N229: MADIGAN | Q229: HANCOCK
A230: GOALKICKERS
A231: SANDRINGHAM | C231: ZEUSCHNER 3 | F231: HOGAN 3 | I231: MACKENZIE 2 | L231: SELLECK 2 | N231: DE LUCA 2 | Q231: HANCE | S231: LADDS
A232: WILLIAMSTOWN | C232: HIGGINS 3 | F232: EVANS 2 | I232: VANDENBERG | L232: WARE | N232: HANCOCK | Q232: TROTMAN | S232: NANKERVIS | V232: A VOSILAITIS
A234: DANDENONG | C234: 2 | D234: 3 | E234: =C234*6+D234 -> 15 | G234: 10 | H234: 8 | I234: =G234*6+H234 -> 68 | K234: 11 | L234: 13 | M234: =K234*6+L234 -> 79 | O234: 14 | P234: 16 | Q234: =O234*6+P234 -> 100 | S234: TOORAK PARK
A235: PRAHRAN | C235: 5 | D235: 0 | E235: =C235*6+D235 -> 30 | G235: 7 | H235: 1 | I235: =G235*6+H235 -> 43 | K235: 9 | L235: 3 | M235: =K235*6+L235 -> 57 | O235: 14 | P235: 3 | Q235: =O235*6+P235 -> 87 | S235: O'NEILL
A236: BEST PLAYERS
A237: DANDENONG | C237: MITCHELL | F237: HILL | I237: SAVVA | L237: MORROW | O237: EVANS | R237: MILLER
A238: PRAHRAN | C238: SKIDMORE | F238: VERWOERT | I238: DICKESON | L238: MINTON-CONNELL | P238: McMAHON | R238: ALBISTON
A239: GOALKICKERS
A240: DANDENONG | C240: MILLER 5 | F240: MITCHELL 2 | I240: MELAI 2 | K240: OSBORNE | M240: EVANS | O240: McDONALD | R240: HILL | T240: ROUVRAY
A241: PRAHRAN | C241: VERWOERT 4 | F241: ALBISTON 2 | I241: PEARSON | K241: WYND | M241: SKIDMORE | O241: BUTLER | Q241: KERLEY | S241: BARTLETT | V241: McMAHON | X241: RYAN
A243: ROUND 6 | C243: 27TH MAY | J243: WEATHER | N243: S .BREEZE SHOWERS | S243: PLAYED AT
D244: 1ST QTR | H244: 2ND QTR | L244: 3RD QTR | P244: FINAL | S244: DANDENONG
A245: DANDENONG | C245: 6 | D245: 3 | E245: =C245*6+D245 -> 39 | G245: 7 | H245: 5 | I245: =G245*6+H245 -> 47 | K245: 12 | L245: 10 | M245: =K245*6+L245 -> 82 | O245: 15 | P245: 13 | Q245: =O245*6+P245 -> 103 | S245: UMPIRE | X245: LADDER | AB245: ROUND | AD245: 6
A246: WILLIAMSTOWN | C246: 2 | D246: 0 | E246: =C246*6+D246 -> 12 | G246: 4 | H246: 6 | I246: =G246*6+H246 -> 30 | K246: 6 | L246: 8 | M246: =K246*6+L246 -> 44 | O246: 8 | P246: 15 | Q246: =O246*6+P246 -> 63 | S246: CHAPLIN
A247: BEST PLAYERS | W247: TEAM | X247: W | Y247: L | Z247: D | AA247: FOR | AB247: AGST | AC247: % | AD247: PTS
A248: DANDENONG | C248: McNAMARA | F248: OSBORNE | I248: MELAI | L248: STEDWELL | O248: MORROW | R248: EVANS
A249: WILLIAMSTOWN | C249: MURRIE | F249: MADIGAN | I249: SZYSKA | L249: A VOSILAITIS | O249: JOHNSON | R249: FOWLER | W249: PORT MELBOURNE | X249: 5 | Y249: 1 | Z249: 0 | AA249: 554 | AB249: 447 | AC249: 123.94 | AD249: 20
A250: GOALKICKERS | W250: DANDENONG | X250: 5 | Y250: 1 | Z250: 0 | AA250: 634 | AB250: 538 | AC250: 117.84386617100371 | AD250: 20
A251: DANDENONG | C251: MILLER 4 | F251: MELAI 3 | I251: MORROW 3 | L251: MCDONALD 2 | O251: SMITH | Q251: HILL | R251: MITCHELL | W251: YARRAVILLE | X251: 4 | Y251: 2 | Z251: 0 | AA251: 607 | AB251: 509 | AC251: 119.25 | AD251: 16
A252: WILLIAMSTOWN | C252: FOWLER 3 | F252: JOHNSON 2 | I252: NANKERVIS | L252: HANCOCK | O252: SZYSKA | W252: BRUNSWICK | X252: 4 | Y252: 2 | Z252: 0 | AA252: 537 | AB252: 479 | AC252: 112.10855949895615 | AD252: 16
E253: 28TH MAY | J253: WEATHER | M253: FINE
A254: PORT MELBOURNE | C254: 4 | D254: 5 | E254: =C254*6+D254 -> 29 | G254: 9 | H254: 10 | I254: =G254*6+H254 -> 64 | K254: 13 | L254: 12 | M254: =K254*6+L254 -> 90 | O254: 19 | P254: 16 | Q254: =O254*6+P254 -> 130 | S254: YARRAVILLE | W254: COBURG | X254: 3 | Y254: 3 | Z254: 0 | AA254: 512 | AB254: 525 | AC254: 97.523809523809518 | AD254: 12
A255: YARRAVILLE | C255: 4 | D255: 3 | E255: =C255*6+D255 -> 27 | G255: 4 | H255: 7 | I255: =G255*6+H255 -> 31 | K255: 11 | L255: 12 | M255: =K255*6+L255 -> 78 | O255: 12 | P255: 18 | Q255: =O255*6+P255 -> 90 | S255: TOOHEY | W255: SANDRINGHAM | X255: 3 | Y255: 3 | Z255: 0 | AA255: 508 | AB255: 565 | AC255: 89.911504424778755 | AD255: 12
A256: BEST PLAYERS | W256: PRESTON | X256: 2 | Y256: 4 | Z256: 0 | AA256: 517 | AB256: 471 | AC256: 109.76645435244161 | AD256: 8
A257: PORT MELBOURNE | C257: BEDFORD | F257: TAGGART | I257: BONNETT | L257: QUIRK | O257: KERR | R257: HOWELL | W257: PRAHRAN | X257: 2 | Y257: 4 | Z257: 0 | AA257: 470 | AB257: 545 | AC257: 86.24 | AD257: 8
A258: YARRAVILLE | C258: BARROW | F258: CASTRIKUM | I258: MATHERSON | L258: CONNELLY | O258: MADIGAN | R258: WILSON | W258: WAVERLEY | X258: 1 | Y258: 5 | Z258: 0 | AA258: 439 | AB258: 566 | AC258: 77.56 | AD258: 4
A259: GOALKICKERS | Q259: IRELAND | W259: WILLIAMSTOWN | X259: 1 | Y259: 5 | Z259: 0 | AA259: 428 | AB259: 561 | AC259: 76.292335115864532 | AD259: 4
A260: PORT MELBOURNE | C260: PECK 5 | E260: TAGGART 3 | H260: BEDFORD 3 | J260: HOWELL 2 | M260: QUIRK 2 | O260: BUCKLEY | Q260: BOLLARD | S260: ROWLANDS
A261: YARRAVILLE | C261: MADIGAN 2 | F261: HENDERSON 2 | I261: ROWE | K261: CONNELLY | M261: WARWICK | O261: McDONALD | R261: BONGETTI | U261: BARR | W261: BEATTIE | X261: BURR
A263: SANDRINGHAM | C263: 1 | D263: 0 | E263: =C263*6+D263 -> 6 | G263: 5 | H263: 4 | I263: =G263*6+H263 -> 34 | K263: 9 | L263: 13 | M263: =K263*6+L263 -> 67 | O263: 13 | P263: 17 | Q263: =O263*6+P263 -> 95 | S263: BEACH ROAD
A264: COBURG | C264: 2 | D264: 1 | E264: =C264*6+D264 -> 13 | G264: 7 | H264: 5 | I264: =G264*6+H264 -> 47 | K264: 8 | L264: 5 | M264: =K264*6+L264 -> 53 | O264: 10 | P264: 5 | Q264: =O264*6+P264 -> 65 | S264: DIXON
A265: BEST PLAYERS
A266: SANDRINGHAM | C266: K WILLS | F266: SELLECK | I266: VAUGHAN | L266: ZEUSCHNER | O266: ALEXANDER | R266: WESTON
A267: COBURG | C267: OATEN | F267: PARTRIDGE | I267: WELSH | L267: BOSCHEN | O267: PALMER | R267: McNABB
A268: GOALKICKERS
A269: SANDRINGHAM | C269: WESTON 3 | F269: HARRISON 3 | I269: K WILLS 2 | L269: DE LUCA 2 | O269: HANCE | Q269: ZEUSCHNER | T269: ALEXANDER
A270: COBURG | C270: THOMPSON 3 | F270: PALMER 2 | I270: BROMLEY 2 | L270: BOSCHEN 2 | O270: GONINAN
A272: PRESTON | C272: 5 | D272: 1 | E272: =C272*6+D272 -> 31 | G272: 6 | H272: 5 | I272: =G272*6+H272 -> 41 | K272: 11 | L272: 12 | M272: =K272*6+L272 -> 78 | O272: 13 | P272: 21 | Q272: =O272*6+P272 -> 99 | S272: PRESTON
A273: WAVERLEY | C273: 1 | D273: 2 | E273: =C273*6+D273 -> 8 | G273: 2 | H273: 7 | I273: =G273*6+H273 -> 19 | K273: 2 | L273: 8 | M273: =K273*6+L273 -> 20 | O273: 4 | P273: 11 | Q273: =O273*6+P273 -> 35 | S273: GANNON
A274: BEST PLAYERS
A275: PRESTON | C275: HINDMARSH | F275: LEMPRIERE | I275: CAMERON | L275: HEPPER | O275: MURNANE | R275: WALKER
A276: WAVERLEY | C276: POORE | F276: ELLIS | I276: REEVES | L276: HUDSON | O276: McQUEEN
A277: GOALKICKERS
A278: PRESTON | C278: CHAPMAN 4 | F278: HEPPER 3 | I278: CAMERON 3 | L278: LEMPRIERE 2 | O278: JOYCE
A279: WAVERLEY | C279: McGOWAN | F279: REID | H279: McKENZIE | K279: BURGIN
A281: PRAHRAN | C281: 4 | D281: 2 | E281: =C281*6+D281 -> 26 | G281: 8 | H281: 5 | I281: =G281*6+H281 -> 53 | K281: 10 | L281: 9 | M281: =K281*6+L281 -> 69 | O281: 12 | P281: 11 | Q281: =O281*6+P281 -> 83 | S281: BRUNSWICK
A282: BRUNSWICK | C282: 0 | D282: 6 | E282: =C282*6+D282 -> 6 | G282: 1 | H282: 8 | I282: =G282*6+H282 -> 14 | K282: 5 | L282: 9 | M282: =K282*6+L282 -> 39 | O282: 7 | P282: 12 | Q282: =O282*6+P282 -> 54 | S282: TURNER
A283: BEST PLAYERS
A284: PRAHRAN | C284: CULPIN | F284: BARTLETT | I284: BUTLER | L284: KERLEY | O284: MINTON-CONNELL | S284: SKIDMORE
A285: BRUNSWICK | C285: WILSON | F285: ROBINSON | I285: ROGERS | L285: BURNS | O285: LEYDIN | S285: BIBBY
A286: GOALKICKERS
A287: PRAHRAN | C287: KERLEY 7 | F287: BARTLETT 2 | I287: ALBISTON 2 | L287: SKIDMORE
A288: BRUNSWICK | C288: BURNS 3 | F288: LEYDIN 2 | I288: HAGART | L288: ARTHUR
A290: ROUND 7 | E290: 4TH JUNE | J290: WEATHER | N290: FINE | S290: PLAYED AT
D291: 1ST QTR | H291: 2ND QTR | L291: 3RD QTR | P291: FINAL | S291: PORT MELBOURNE
A292: PORT MELBOURNE | C292: 2 | D292: 1 | E292: =C292*6+D292 -> 13 | G292: 6 | H292: 6 | I292: =G292*6+H292 -> 42 | K292: 11 | L292: 12 | M292: =K292*6+L292 -> 78 | O292: 16 | P292: 14 | Q292: =O292*6+P292 -> 110 | S292: UMPIRE | X292: LADDER | AB292: ROUND | AD292: 7
A293: BRUNSWICK | C293: 2 | D293: 10 | E293: =C293*6+D293 -> 22 | G293: 3 | H293: 12 | I293: =G293*6+H293 -> 30 | K293: 5 | L293: 13 | M293: =K293*6+L293 -> 43 | O293: 9 | P293: 16 | Q293: =O293*6+P293 -> 70 | S293: O'NEILL
A294: BEST PLAYERS | W294: TEAM | X294: W | Y294: L | Z294: D | AA294: FOR | AB294: AGST | AC294: % | AD294: PTS
A295: PORT MELBOURNE | C295: BEDFORD | F295: BUCKLEY | I295: IRELAND | L295: GROVER | N295: GRIFFITHS | Q295: WILLIAMS
A296: BRUNSWICK | C296: ROBINS | F296: ROGERS | I296: O'CONNELL | L296: WILSON | N296: McKINLEY | Q296: HAGART | W296: PORT MELBOURNE | X296: 6 | Y296: 1 | Z296: 0 | AA296: 664 | AB296: 517 | AC296: 128.43 | AD296: 24
A297: GOALKICKERS | O297: BROWNHILL | S297: BRICE | W297: DANDENONG | X297: 6 | Y297: 1 | Z297: 0 | AA297: 763 | AB297: 647 | AC297: 117.92890262751159 | AD297: 24
A298: PORT MELBOURNE | C298: BEDFORD 3 | F298: PECK 3 | H298: QUIRK 2 | J298: IRELAND 2 | M298: TAGGART | O298: BUCKLEY | Q298: HOWELL | S298: BOLLARD | W298: YARRAVILLE | X298: 4 | Y298: 3 | Z298: 0 | AA298: 701 | AB298: 620 | AC298: 113.06 | AD298: 16
A299: BRUNSWICK | C299: BURNS 2 | F299: ROGERS 2 | I299: ROBINSON 2 | L299: BRIGLIA | N299: LEYDIN | P299: BIBBY | W299: BRUNSWICK | X299: 4 | Y299: 3 | Z299: 0 | AA299: 607 | AB299: 589 | AC299: 103.05602716468591 | AD299: 16
A301: PRESTON | C301: 3 | D301: 6 | E301: =C301*6+D301 -> 24 | G301: 5 | H301: 8 | I301: =G301*6+H301 -> 38 | K301: 11 | L301: 11 | M301: =K301*6+L301 -> 77 | O301: 16 | P301: 15 | Q301: =O301*6+P301 -> 111 | S301: YARRAVILLE | W301: COBURG | X301: 4 | Y301: 3 | Z301: 0 | AA301: 612 | AB301: 623 | AC301: 98.234349919743181 | AD301: 16
A302: YARRAVILLE | C302: 1 | D302: 5 | E302: =C302*6+D302 -> 11 | G302: 4 | H302: 12 | I302: =G302*6+H302 -> 36 | K302: 7 | L302: 15 | M302: =K302*6+L302 -> 57 | O302: 12 | P302: 22 | Q302: =O302*6+P302 -> 94 | S302: JACKSON | W302: PRESTON | X302: 3 | Y302: 4 | Z302: 0 | AA302: 628 | AB302: 565 | AC302: 111.15044247787611 | AD302: 12
A303: BEST PLAYERS | W303: PRAHRAN | X303: 3 | Y303: 4 | Z303: 0 | AA303: 587 | AB303: 629 | AC303: 93.32 | AD303: 12
A304: PRESTON | C304: HINDMARSH | F304: LEMPRIERE | I304: MURNANE | L304: DALTON | O304: CAMERON | R304: WALKER | W304: SANDRINGHAM | X304: 3 | Y304: 4 | Z304: 0 | AA304: 592 | AB304: 682 | AC304: 86.8 | AD304: 12
A305: YARRAVILLE | C305: MATHESON | F305: LIENERT | I305: CASTIKUM | L305: GROSE | O305: CONNELLY | R305: MADIGAN | W305: WAVERLEY | X305: 1 | Y305: 6 | Z305: 0 | AA305: 548 | AB305: 695 | AC305: 78.85 | AD305: 4
A306: GOALKICKERS | W306: WILLIAMSTOWN | X306: 1 | Y306: 6 | Z306: 0 | AA306: 526 | AB306: 661 | AC306: 79.576399394856281 | AD306: 4
A307: PRESTON | C307: WALKER 5 | F307: CAMERON 5 | I307: HAYES 2 | K307: LEMPRIERE | N307: WADDELL | P307: HEPPER | R307: DALTON
A308: YARRAVILLE | C308: MADIGAN 4 | F308: WARWICK 2 | I308: LEAHY | K308: QUARANTOTTO | N308: MATHESON | Q308: CONNELLY | S308: J McDONALD | V308: FELL
A310: PRAHRAN | C310: 1 | D310: 2 | E310: =C310*6+D310 -> 8 | G310: 7 | H310: 8 | I310: =G310*6+H310 -> 50 | K310: 10 | L310: 11 | M310: =K310*6+L310 -> 71 | O310: 17 | P310: 15 | Q310: =O310*6+P310 -> 117 | S310: TOORAK PARK
A311: SANDRINGHAM | C311: 5 | D311: 6 | E311: =C311*6+D311 -> 36 | G311: 7 | H311: 9 | I311: =G311*6+H311 -> 51 | K311: 10 | L311: 11 | M311: =K311*6+L311 -> 71 | O311: 12 | P311: 12 | Q311: =O311*6+P311 -> 84 | S311: CRAIG
A312: BEST PLAYERS
A313: PRAHRAN | C313: ALBISTON | F313: KIRBY | I313: PEARSON | L313: WYND | O313: CULPIN | R313: MINTON-CONNELL
A314: SANDRINGHAM | C314: ZEUSCHNER | F314: SELLECK | I314: WARD | L314: ALEXANDER | O314: WESTON | R314: EASTOE
A315: GOALKICKERS
A316: PRAHRAN | C316: RYAN 3 | F316: BUTLER 3 | I316: WYND 3 | K316: KERLEY 2 | M316: ALBISTON 2 | P316: SKIDMORE | R316: PEARSON | U316: VERWOERT | X316: WHITELAW
A317: SANDRINGHAM | C317: ZEUSCHNER 4 | F317: WESTON 2 | I317: K WILLS 2 | L317: SELLECK | N317: HANCE | P317: HARRISON | R317: DE LUCA
A319: COBURG | C319: 3 | D319: 5 | E319: =C319*6+D319 -> 23 | G319: 8 | H319: 6 | I319: =G319*6+H319 -> 54 | K319: 12 | L319: 12 | M319: =K319*6+L319 -> 84 | O319: 14 | P319: 16 | Q319: =O319*6+P319 -> 100 | S319: COBURG
A320: WILLIAMSTOWN | C320: 2 | D320: 3 | E320: =C320*6+D320 -> 15 | G320: 7 | H320: 9 | I320: =G320*6+H320 -> 51 | K320: 12 | L320: 9 | M320: =K320*6+L320 -> 81 | O320: 14 | P320: 14 | Q320: =O320*6+P320 -> 98 | S320: ARMSTRONG
A321: BEST PLAYERS
A322: COBURG | C322: VINCENT | F322: SULLIVAN | I322: GONINAN | L322: GOTCH | O322: HUGHES | R322: WELSH
A323: WILLIAMSTOWN | C323: WHITTINGTON | F323: WARE | I323: HANCOCK | L323: FOWLER | O323: NANKERVIS | R323: SZYSKA
A324: GOALKICKERS
A325: COBURG | C325: GOTCH 4 | F325: VINCENT 3 | I325: GONINAN 2 | L325: SHULZE 2 | O325: PALMER | Q325: SULLIVAN | T325: FITZPATRICK
A326: WILLIAMSTOWN | C326: WARE 5 | F326: SZYSKA 4 | I326: NANKERVIS 3 | L326: HANCOCOK | O326: HIGGINS
A328: DANDENONG | C328: 5 | D328: 4 | E328: =C328*6+D328 -> 34 | G328: 11 | H328: 10 | I328: =G328*6+H328 -> 76 | K328: 15 | L328: 13 | M328: =K328*6+L328 -> 103 | O328: 19 | P328: 15 | Q328: =O328*6+P328 -> 129 | S328: WAVERLEY
A329: WAVERLEY | C329: 5 | D329: 3 | E329: =C329*6+D329 -> 33 | G329: 8 | H329: 3 | I329: =G329*6+H329 -> 51 | K329: 14 | L329: 3 | M329: =K329*6+L329 -> 87 | O329: 17 | P329: 7 | Q329: =O329*6+P329 -> 109 | S329: ROWE
A330: BEST PLAYERS
A331: DANDENONG | C331: MCDONALD | F331: MILLER | I331: McNAMARA | L331: EVANS | O331: SMITH | R331: MORROW
A332: WAVERLEY | C332: POORE | F332: PARKER | I332: SEYMOUR | L332: REEVES | O332: McQUEEN | R332: CARROLL
A333: GOALKICKERS
A334: DANDENONG | C334: MILLER 5 | F334: MORROW 2 | I334: EVANS 2 | K334: MITCHELL 2 | N334: MELAI 2 | P334: SAVVA 2 | R334: McDONALD 2 | V334: HILL 2
A335: WAVERLEY | C335: PARKER 5 | F335: POORE 3 | I335: REID 2 | K335: SEYMOUR 2 | N335: McQUEEN 2 | Q335: CULLIN | S335: McKENZIE | V335: BURGIN
A337: ROUND 8 | E337: 11TH JUNE | J337: WEATHER | N337: FINE | S337: PLAYED AT
D338: 1ST QTR | H338: 2ND QTR | L338: 3RD QTR | P338: FINAL | S338: DANDENONG
A339: DANDENONG | C339: 6 | D339: 4 | E339: =C339*6+D339 -> 40 | G339: 8 | H339: 10 | I339: =G339*6+H339 -> 58 | K339: 15 | L339: 13 | M339: =K339*6+L339 -> 103 | O339: 18 | P339: 16 | Q339: =O339*6+P339 -> 124 | S339: UMPIRE | X339: LADDER | AB339: ROUND | AD339: 8
A340: BRUNSWICK | C340: 2 | D340: 2 | E340: =C340*6+D340 -> 14 | G340: 4 | H340: 4 | I340: =G340*6+H340 -> 28 | K340: 5 | L340: 6 | M340: =K340*6+L340 -> 36 | O340: 11 | P340: 9 | Q340: =O340*6+P340 -> 75 | S340: GANNON
A341: BEST PLAYERS | W341: TEAM | X341: W | Y341: L | Z341: D | AA341: FOR | AB341: AGST | AC341: % | AD341: PTS
A342: DANDENONG | C342: TOWNSEND | F342: MELAI | I342: EVANS | L342: WETZELL | O342: McDONALD | R342: MILLER
A343: BRUNSWICK | C343: BURNS | F343: KICK | I343: ROBINS | L343: WHILEY | O343: ROGERS | R343: ROBINSON | W343: PORT MELBOURNE | X343: 7 | Y343: 1 | Z343: 0 | AA343: 771 | AB343: 600 | AC343: 128.5 | AD343: 28
A344: GOALKICKERS | R344: SMITH | W344: DANDENONG | X344: 7 | Y344: 1 | Z344: 0 | AA344: 887 | AB344: 722 | AC344: 122.85318559556787 | AD344: 28
A345: DANDENONG | C345: HILL 4 | E345: MILLER 3 | G345: TOWNSEND 3 | J345: ROUVRAY 3 | M345: MITCHELL 2 | P345: MCDONALD | R345: MORROW | W345: YARRAVILLE | X345: 4 | Y345: 4 | Z345: 0 | AA345: 768 | AB345: 705 | AC345: 108.94 | AD345: 16
A346: BRUNSWICK | C346: BURNS 2 | E346: LEYDIN 2 | G346: MCKINNON 2 | J346: ROGERS | L346: WROUT | N346: ROBINSON | Q346: HAGART | W346: PRAHRAN | X346: 4 | Y346: 4 | Z346: 0 | AA346: 709 | AB346: 713 | AC346: 99.44 | AD346: 16
A348: PORT MELBOURNE | C348: 1 | D348: 1 | E348: =C348*6+D348 -> 7 | G348: 6 | H348: 7 | I348: =G348*6+H348 -> 43 | K348: 6 | L348: 8 | M348: =K348*6+L348 -> 44 | O348: 16 | P348: 11 | Q348: =O348*6+P348 -> 107 | S348: COBURG | W348: BRUNSWICK | X348: 4 | Y348: 4 | Z348: 0 | AA348: 682 | AB348: 713 | AC348: 95.652173913043484 | AD348: 16
A349: COBURG | C349: 3 | D349: 3 | E349: =C349*6+D349 -> 21 | G349: 4 | H349: 4 | I349: =G349*6+H349 -> 28 | K349: 10 | L349: 8 | M349: =K349*6+L349 -> 68 | O349: 12 | P349: 11 | Q349: =O349*6+P349 -> 83 | S349: TURNER | W349: COBURG | X349: 4 | Y349: 4 | Z349: 0 | AA349: 695 | AB349: 730 | AC349: 95.205479452054789 | AD349: 16
A350: BEST PLAYERS | W350: SANDRINGHAM | X350: 4 | Y350: 4 | Z350: 0 | AA350: 677 | AB350: 749 | AC350: 90.39 | AD350: 16
A351: PORT MELBOURNE | C351: BEDFORD | F351: QUIRK | I351: ALLEN | L351: BUCKLEY | O351: WILLIAMS | R351: TAGGART | W351: PRESTON | X351: 3 | Y351: 5 | Z351: 0 | AA351: 712 | AB351: 687 | AC351: 103.63901018922853 | AD351: 12
A352: COBURG | C352: BOSCHEN | F352: PALMER | I352: TANCREDI | L352: McNABB | O352: GONINAN | W352: WAVERLEY | X352: 2 | Y352: 6 | Z352: 0 | AA352: 638 | AB352: 780 | AC352: 81.79 | AD352: 8
A353: GOALKICKERS | P353: BROWNHILL | S353: BRICE | W353: WILLIAMSTOWN | X353: 1 | Y353: 7 | Z353: 0 | AA353: 611 | AB353: 751 | AC353: 81.358189081225035 | AD353: 4
A354: PORT MELBOURNE | C354: TAGGART 3 | F354: BEDFORD 3 | I354: ALLEN 2 | K354: ROWLANDS 2 | N354: IRELAND 2 | Q354: HOWELL | S354: QUIRK
A355: COBURG | C355: McNABB 5 | F355: PALMER 2 | I355: GOTCH 2 | K355: PARTRIDGE | N355: GONINAN | Q355: SHULZE
A357: PRAHRAN | C357: 1 | D357: 2 | E357: =C357*6+D357 -> 8 | G357: 6 | H357: 7 | I357: =G357*6+H357 -> 43 | K357: 11 | L357: 10 | M357: =K357*6+L357 -> 76 | O357: 18 | P357: 14 | Q357: =O357*6+P357 -> 122 | S357: TOORAK PARK
A358: PRESTON | C358: 8 | D358: 0 | E358: =C358*6+D358 -> 48 | G358: 10 | H358: 0 | I358: =G358*6+H358 -> 60 | K358: 11 | L358: 5 | M358: =K358*6+L358 -> 71 | O358: 13 | P358: 6 | Q358: =O358*6+P358 -> 84 | S358: TOOHEY
A359: BEST PLAYERS
A360: PRAHRAN | C360: BUTLER | F360: RYAN | I360: ALBISTON | L360: McMAHON | O360: CULPIN | Q360: MINTON-CONNELL
A361: PRESTON | C361: HANVIN | F361: PAUL | I361: DALTON | L361: WALKER | O361: HAYES | Q361: MURNANE
A362: GOALKICKERS
A363: PRAHRAN | C363: RYAN 8 | F363: BUTLER 4 | I363: McMAHON 2 | L363: BARTLETT | O363: MINTON-CONNELL | S363: VERWOERT | V363: ALBISTON
A364: PRESTON | C364: WALKER 3 | F364: WADDELL 3 | I364: MURNANE 2 | L364: LEMPRIERE | O364: DALTON | Q364: CAMERON | S364: HAYES | V364: G PERRY
A366: SANDRINGHAM | C366: 5 | D366: 10 | E366: =C366*6+D366 -> 40 | G366: 5 | H366: 11 | I366: =G366*6+H366 -> 41 | K366: 9 | L366: 17 | M366: =K366*6+L366 -> 71 | O366: 11 | P366: 19 | Q366: =O366*6+P366 -> 85 | S366: BEACH ROAD
A367: YARRAVILLE | C367: 4 | D367: 2 | E367: =C367*6+D367 -> 26 | G367: 7 | H367: 7 | I367: =G367*6+H367 -> 49 | K367: 7 | L367: 10 | M367: =K367*6+L367 -> 52 | O367: 9 | P367: 13 | Q367: =O367*6+P367 -> 67 | S367: CHAPLIN
A368: BEST PLAYERS
A369: SANDRINGHAM | C369: MANN | F369: B ZEUSCHNER | I369: LADDS | L369: SELLECK | O369: MACKENZIE | R369: WESTON
A370: YARRAVILLE | C370: CHARLES | F370: LIENERT | I370: CASTIKUM | L370: TAURENS | O370: GROSE | R370: McKENNA
A371: GOALKICKERS
A372: SANDRINGHAM | C372: B ZEUSCHNER 4 | F372: MACKENZIE 2 | I372: MANN 2 | K372: LADDS | M372: SELLECK | O372: M ZEUSCHNER
A373: YARRAVILLE | C373: CHARLES 3 | F373: BEATTIE 2 | I373: LEAHY 2 | K373: QUARANTOTTO | N373: MADIGAN
D374: 12TH JUNE | J374: WEATHER | M374: FOGGY
A375: WAVERLEY | C375: 3 | D375: 3 | E375: =C375*6+D375 -> 21 | G375: 5 | H375: 4 | I375: =G375*6+H375 -> 34 | K375: 9 | L375: 10 | M375: =K375*6+L375 -> 64 | O375: 13 | P375: 12 | Q375: =O375*6+P375 -> 90 | S375: WILLIAMSTOWN
A376: WILLIAMSTOWN | C376: 0 | D376: 4 | E376: =C376*6+D376 -> 4 | G376: 4 | H376: 9 | I376: =G376*6+H376 -> 33 | K376: 8 | L376: 12 | M376: =K376*6+L376 -> 60 | O376: 11 | P376: 19 | Q376: =O376*6+P376 -> 85 | S376: DIXON
A377: BEST PLAYERS
A378: WAVERLEY | C378: ROLFE | F378: HUDSON | I378: THOROGOOD | L378: LAWSON | O378: POORE | Q378: MCQUEEN
A379: WILLIAMSTOWN | C379: NANKERVIS | F379: WARE | I379: SZYSKA | L379: WHITTINGTON | O379: MURRIE | Q379: BLAINEY
A380: GOALKICKERS
A381: WAVERLEY | C381: McQUEEN 3 | F381: PARKER 2 | I381: POORE 2 | K381: HUDSON 2 | M381: BURGIN 2 | O381: BEHAN | Q381: LAWSON
A382: WILLIAMSTOWN | C382: SZYSKA 6 | F382: HIGGINS 2 | I382: DODD | K382: LANE | M382: NANKERVIS
A384: ROUND 9 | E384: 18TH JUNE | J384: WEATHER | N384: FINE | S384: PLAYED AT
D385: 1ST QTR | H385: 2ND QTR | L385: 3RD QTR | P385: FINAL | S385: YARRAVILLE
A386: DANDENONG | C386: 5 | D386: 3 | E386: =C386*6+D386 -> 33 | G386: 11 | H386: 7 | I386: =G386*6+H386 -> 73 | K386: 17 | L386: 8 | M386: =K386*6+L386 -> 110 | O386: 19 | P386: 14 | Q386: =O386*6+P386 -> 128 | S386: UMPIRE | X386: LADDER | AB386: ROUND | AD386: 9
A387: YARRAVILLE | C387: 4 | D387: 2 | E387: =C387*6+D387 -> 26 | G387: 5 | H387: 2 | I387: =G387*6+H387 -> 32 | K387: 7 | L387: 10 | M387: =K387*6+L387 -> 52 | O387: 11 | P387: 13 | Q387: =O387*6+P387 -> 79 | S387: ARMSTRONG
A388: BEST PLAYERS | W388: TEAM | X388: W | Y388: L | Z388: D | AA388: FOR | AB388: AGST | AC388: % | AD388: PTS
A389: DANDENONG | C389: MILLER | F389: SUTTON | I389: SMITH | L389: McDONALD | O389: STEDWELL | R389: HILL
A390: YARRAVILLE | C390: CHARLES | F390: TAURENS | I390: MADIGAN | L390: ROWE | O390: MATHESON | R390: GROSE | W390: DANDENONG | X390: 8 | Y390: 1 | Z390: 0 | AA390: 1015 | AB390: 801 | AC390: 126.71660424469414 | AD390: 32
A391: GOALKICKERS | W391: PORT MELBOURNE | X391: 8 | Y391: 1 | Z391: 0 | AA391: 888 | AB391: 709 | AC391: 125.25 | AD391: 32
A392: DANDENONG | C392: MILLER 9 | F392: HILL 3 | H392: TOWNSEND 2 | K392: MCDONALD 2 | N392: MORROW | P392: SMITH | R392: ROUVRAY | W392: COBURG | X392: 5 | Y392: 4 | Z392: 0 | AA392: 750 | AB392: 771 | AC392: 97.276264591439684 | AD392: 20
A393: YARRAVILLE | C393: ROWE 4 | F393: SALVATORE 2 | I393: ROACH 2 | K393: WILSON 2 | N393: MADIGAN | W393: BRUNSWICK | X393: 5 | Y393: 4 | Z393: 0 | AA393: 775 | AB393: 799 | AC393: 96.996245306633298 | AD393: 20
A395: PORT MELBOURNE | C395: 3 | D395: 6 | E395: =C395*6+D395 -> 24 | G395: 13 | H395: 8 | I395: =G395*6+H395 -> 86 | K395: 15 | L395: 9 | M395: =K395*6+L395 -> 99 | O395: 18 | P395: 9 | Q395: =O395*6+P395 -> 117 | S395: PORT MELBOURNE | W395: PRESTON | X395: 4 | Y395: 5 | Z395: 0 | AA395: 825 | AB395: 764 | AC395: 107.98429319371728 | AD395: 16
A396: PRAHRAN | C396: 1 | D396: 5 | E396: =C396*6+D396 -> 11 | G396: 4 | H396: 9 | I396: =G396*6+H396 -> 33 | K396: 13 | L396: 11 | M396: =K396*6+L396 -> 89 | O396: 15 | P396: 19 | Q396: =O396*6+P396 -> 109 | S396: ROWE | W396: YARRAVILLE | X396: 4 | Y396: 5 | Z396: 0 | AA396: 847 | AB396: 833 | AC396: 101.68 | AD396: 16
A397: BEST PLAYERS | W397: PRAHRAN | X397: 4 | Y397: 5 | Z397: 0 | AA397: 818 | AB397: 830 | AC397: 98.55 | AD397: 16
A398: PORT MELBOURNE | C398: BEDFORD | F398: BUCKLEY | I398: IRELAND | L398: TAGGART | O398: HOWELL | R398: GROVER | W398: SANDRINGHAM | X398: 4 | Y398: 5 | Z398: 0 | AA398: 763 | AB398: 842 | AC398: 90.62 | AD398: 16
A399: PRAHRAN | C399: BARTLETT | F399: McLAREN | I399: KERLEY | K399: MINTON-CONNELL | O399: ALBISTON | R399: RICHARDSON | W399: WAVERLEY | X399: 2 | Y399: 7 | Z399: 0 | AA399: 679 | AB399: 835 | AC399: 81.32 | AD399: 8
A400: GOALKICKERS | Q400: QUIRK | S400: BRICE | W400: WILLIAMSTOWN | X400: 1 | Y400: 8 | Z400: 0 | AA400: 688 | AB400: 864 | AC400: 79.629629629629633 | AD400: 4
A401: PORT MELBOURNE | C401: HOWELL 5 | F401: BEDFORD 4 | I401: ALLEN 2 | K401: COLLINS 2 | N401: TAGGART | P401: CAULFIELD | R401: BOLLARD
A402: PRAHRAN | C402: KERLEY 3 | F402: ALBISTON 3 | I402: RYAN 2 | K402: VERWOERT 2 | N402: WYND 2 | P402: McMAHON | R402: SKIDMORE | U402: BUTLER
A404: BRUNSWICK | C404: 4 | D404: 3 | E404: =C404*6+D404 -> 27 | G404: 8 | H404: 6 | I404: =G404*6+H404 -> 54 | K404: 9 | L404: 10 | M404: =K404*6+L404 -> 64 | O404: 13 | P404: 15 | Q404: =O404*6+P404 -> 93 | S404: BRUNSWICK
A405: SANDRINGHAM | C405: 5 | D405: 1 | E405: =C405*6+D405 -> 31 | G405: 9 | H405: 4 | I405: =G405*6+H405 -> 58 | K405: 10 | L405: 11 | M405: =K405*6+L405 -> 71 | O405: 12 | P405: 14 | Q405: =O405*6+P405 -> 86 | S405: JACKSON
A406: BEST PLAYERS
A407: BRUNSWICK | C407: BURNS | F407: BIBBY | I407: ROGERS | L407: McGRATH | O407: McKINLEY | R407: LEYDIN
A408: SANDRINGHAM | C408: SELLECK | F408: K WILLS | I408: FENTON | L408: M ZEUSCHNER | O408: VAUGHAN | R408: MUTER
A409: GOALKICKERS
A410: BRUNSWICK | C410: BURNS 4 | F410: ROGERS 3 | I410: LEYDIN 2 | L410: ROBINSON 2 | O410: BIBBY | Q410: WROUT
A411: SANDRINGHAM | C411: K WILLS 4 | F411: WESTON 2 | I411: FENTON 2 | L411: HANCE | N411: MANN | P411: MUTER | R411: B ZEUSCHNER
A413: PRESTON | C413: 2 | D413: 2 | E413: =C413*6+D413 -> 14 | G413: 8 | H413: 10 | I413: =G413*6+H413 -> 58 | K413: 13 | L413: 12 | M413: =K413*6+L413 -> 90 | O413: 16 | P413: 17 | Q413: =O413*6+P413 -> 113 | S413: PRESTON
A414: WILLIAMSTOWN | C414: 4 | D414: 3 | E414: =C414*6+D414 -> 27 | G414: 5 | H414: 4 | I414: =G414*6+H414 -> 34 | K414: 12 | L414: 5 | M414: =K414*6+L414 -> 77 | O414: 12 | P414: 5 | Q414: =O414*6+P414 -> 77 | S414: O'NEILL
A415: BEST PLAYERS
A416: PRESTON | C416: HINDMARSH | F416: DALTON | I416: G PERRY | L416: JOYCE | O416: WALKER | R416: PAUL
A417: WILLIAMSTOWN | C417: SZYSKA | F417: NANKERVIS | I417: WARE | L417: O'MARA | O417: A VOSILAITIS | R417: SAGGERS
A418: GOALKICKERS
A419: PRESTON | C419: WALKER 6 | F419: JOYCE 3 | H419: WADDELL 2 | K419: DALTON 2 | N419: LEMPRIERE | Q419: SCHICKERT | T419: HAYES
A420: WILLIAMSTOWN | C420: SZYSKA 5 | F420: NANKERVIS 3 | I420: VANDENBERG 2 | M420: SAGGERS | P420: BLAINEY
E421: 24TH JUNE | J421: WEATHER | M421: S BREEZE LIGHT SHOWERS
A422: COBURG | C422: 3 | D422: 1 | E422: =C422*6+D422 -> 19 | G422: 4 | H422: 4 | I422: =G422*6+H422 -> 28 | K422: 5 | L422: 11 | M422: =K422*6+L422 -> 41 | O422: 7 | P422: 13 | Q422: =O422*6+P422 -> 55 | S422: WAVERLEY
A423: WAVERLEY | C423: 1 | D423: 6 | E423: =C423*6+D423 -> 12 | G423: 3 | H423: 10 | I423: =G423*6+H423 -> 28 | K423: 5 | L423: 10 | M423: =K423*6+L423 -> 40 | O423: 5 | P423: 11 | Q423: =O423*6+P423 -> 41 | S423: CHAPLIN
A424: BEST PLAYERS
A425: COBURG | C425: McNABB | F425: VINCENT | I425: BOSCHEN | L425: TANCREDI | O425: WELSH | Q425: PARDON
A426: WAVERLEY | C426: HUDSON | F426: CARROLL | I426: POORE | L426: G PARKER | O426: ROLFE | Q426: THOROGOOD
A427: GOALKICKERS
A428: COBURG | C428: McNABB 3 | F428: VINCENT 2 | I428: BRANSTON | L428: GONINAN | O428: TANCREDI
A429: WAVERLEY | C429: G PARKER | F429: LAWSON | I429: HUDSON | L429: SEYMOUR | O429: PETZKE
A431: ROUND 10 | D431: 25TH JUNE | I431: WEATHER | S431: PLAYED AT
D432: 1ST QTR | H432: 2ND QTR | L432: 3RD QTR | P432: FINAL | S432: BEACH ROAD
A433: SANDRINGHAM | C433: 5 | D433: 5 | E433: =C433*6+D433 -> 35 | G433: 9 | H433: 6 | I433: =G433*6+H433 -> 60 | K433: 14 | L433: 11 | M433: =K433*6+L433 -> 95 | O433: 17 | P433: 15 | Q433: =O433*6+P433 -> 117 | S433: UMPIRE | X433: LADDER | AB433: ROUND | AD433: 10
A434: PRESTON | C434: 4 | D434: 1 | E434: =C434*6+D434 -> 25 | G434: 4 | H434: 7 | I434: =G434*6+H434 -> 31 | K434: 6 | L434: 12 | M434: =K434*6+L434 -> 48 | O434: 12 | P434: 15 | Q434: =O434*6+P434 -> 87 | S434: TURNER
A435: BEST PLAYERS | W435: TEAM | X435: W | Y435: L | Z435: D | AA435: FOR | AB435: AGST | AC435: % | AD435: PTS
A436: SANDRINGHAM | C436: MANN | F436: B ZEUSCHNER | I436: LOH | K436: LADDS | N436: M ZEUSCHNER | Q436: FENTON
A437: PRESTON | C437: WESTON | F437: DALTON | I437: JOYCE | K437: LEMPRIERE | N437: McLEAN | Q437: SCHICKERT | W437: DANDENONG | X437: 9 | Y437: 1 | Z437: 0 | AA437: 1078 | AB437: 860 | AC437: 125.34883720930233 | AD437: 36
A438: GOALKICKERS | W438: PORT MELBOURNE | X438: 8 | Y438: 2 | Z438: 0 | AA438: 947 | AB438: 772 | AC438: 122.67 | AD438: 32
A439: SANDRINGHAM | C439: WESTON 4 | E439: MUTER 4 | G439: ADDISON 3 | J439: K WILLS 2 | M439: SELLECK | O439: MANN | Q439: FENTON | S439: EASTOE | W439: COBURG | X439: 6 | Y439: 4 | Z439: 0 | AA439: 833 | AB439: 846 | AC439: 98.463356973995275 | AD439: 24
A440: PRESTON | C440: SCHICKERT 3 | F440: LEMPRIERE 2 | I440: WADDELL 2 | L440: WESTON | N440: CHAPMAN | Q440: WALKER | S440: G PERRY | W440: BRUNSWICK | X440: 6 | Y440: 4 | Z440: 0 | AA440: 881 | AB440: 903 | AC440: 97.563676633444075 | AD440: 24
Q441: DALTON
A442: BRUNSWICK | C442: 2 | D442: 6 | E442: =C442*6+D442 -> 18 | G442: 8 | H442: 9 | I442: =G442*6+H442 -> 57 | K442: 12 | L442: 12 | M442: =K442*6+L442 -> 84 | O442: 15 | P442: 16 | Q442: =O442*6+P442 -> 106 | S442: WILLIAMSTOWN | W442: SANDRINGHAM | X442: 5 | Y442: 5 | Z442: 0 | AA442: 880 | AB442: 929 | AC442: 94.73 | AD442: 20
A443: WILLIAMSTOWN | C443: 4 | D443: 4 | E443: =C443*6+D443 -> 28 | G443: 8 | H443: 7 | I443: =G443*6+H443 -> 55 | K443: 12 | L443: 13 | M443: =K443*6+L443 -> 85 | O443: 15 | P443: 14 | Q443: =O443*6+P443 -> 104 | S443: TOOHEY | W443: PRESTON | X443: 4 | Y443: 6 | Z443: 0 | AA443: 912 | AB443: 881 | AC443: 103.51872871736663 | AD443: 16
A444: BEST PLAYERS | W444: YARRAVILLE | X444: 4 | Y444: 6 | Z444: 0 | AA444: 922 | AB444: 916 | AC444: 100.66 | AD444: 16
A445: BRUNSWICK | C445: BURNS | E445: AUSTIN | H445: BONSACK | K445: ROBINSON | N445: ROBINS | Q445: BIBBY | W445: PRAHRAN | X445: 4 | Y445: 6 | Z445: 0 | AA445: 859 | AB445: 882 | AC445: 97.39 | AD445: 16
A446: WILLIAMSTOWN | C446: SZYSKA | E446: NANKERVIS | H446: WHITTINGTON | K446: A VOSILAITIS | N446: HANCOCK | Q446: ALLARD | W446: WAVERLEY | X446: 3 | Y446: 7 | Z446: 0 | AA446: 731 | AB446: 876 | AC446: 83.45 | AD446: 12
A447: GOALKICKERS | W447: WILLIAMSTOWN | X447: 1 | Y447: 9 | Z447: 0 | AA447: 792 | AB447: 970 | AC447: 81.649484536082468 | AD447: 4
A448: BRUNSWICK | C448: BURNS 3 | E448: WHILEY 3 | G448: BIBBY 2 | I448: BONSACK 2 | L448: McKINNON 2 | O448: ROGERS | Q448: PENDLEBURY | T448: WILSON
A449: WILLIAMSTOWN | C449: SZYSKA 10 | F449: NANKERVIS 3 | I449: HIGGINS | K449: A VOSILAITIS
E450: 2ND JULY | J450: WEATHER | N450: SHOWERS
A451: DANDENONG | C451: 3 | D451: 4 | E451: =C451*6+D451 -> 22 | G451: 5 | H451: 10 | I451: =G451*6+H451 -> 40 | K451: 6 | L451: 14 | M451: =K451*6+L451 -> 50 | O451: 8 | P451: 15 | Q451: =O451*6+P451 -> 63 | S451: DANDENONG
A452: PORT MELBOURNE | C452: 4 | D452: 0 | E452: =C452*6+D452 -> 24 | G452: 6 | H452: 2 | I452: =G452*6+H452 -> 38 | K452: 7 | L452: 4 | M452: =K452*6+L452 -> 46 | O452: 9 | P452: 5 | Q452: =O452*6+P452 -> 59 | S452: TOOHEY
A453: BEST PLAYERS
A454: DANDENONG | C454: EVANS | F454: STEDWELL | I454: MILLER | L454: TOWNSEND | O454: SUTTON | Q454: MITCHELL
A455: PORT MELBOURNE | C455: GRIFFITHS | F455: BONNETT | I455: TAGGART | L455: BUCKLEY | O455: BRICE | Q455: RENOUF
A456: GOALKICKERS
A457: DANDENONG | C457: MILLER 4 | F457: MORROW 2 | I457: LIENERT | K457: HILL
A458: PORT MELBOURNE | C458: BRICE 3 | F458: TAGGART 2 | I458: PECK 2 | K458: HOWELL | M458: QUIRK
A460: COBURG | C460: 3 | D460: 1 | E460: =C460*6+D460 -> 19 | G460: 7 | H460: 7 | I460: =G460*6+H460 -> 49 | K460: 8 | L460: 10 | M460: =K460*6+L460 -> 58 | O460: 12 | P460: 11 | Q460: =O460*6+P460 -> 83 | S460: COBURG
A461: YARRAVILLE | C461: 2 | D461: 4 | E461: =C461*6+D461 -> 16 | G461: 6 | H461: 7 | I461: =G461*6+H461 -> 43 | K461: 8 | L461: 10 | M461: =K461*6+L461 -> 58 | O461: 10 | P461: 15 | Q461: =O461*6+P461 -> 75 | S461: O'NEILL
A462: BEST PLAYERS
A463: COBURG | C463: SULLIVAN | F463: PALMER | I463: GONINAN | L463: BOSCHEN | O463: TANCREDI | R463: GOTCH
A464: YARRAVILLE | C464: MADIGAN | F464: CASTIKUM | I464: CONNELLY | L464: ROACH | O464: WARWICK | R464: QUARANTOTTO
A465: GOALKICKERS
A466: COBURG | C466: GONINAN 2 | F466: GOTCH 2 | I466: McNABB 2 | L466: SULLIVAN 2 | O466: PALMER | Q466: PARDON | S466: THOMPSON | V466: VINCENT
A467: YARRAVILLE | C467: MADIGAN 3 | F467: McBEAN 2 | I467: WARWICK 2 | L467: CONNELLY | O467: WILSON | Q467: FOGARTY
A469: WAVERLEY | C469: 1 | D469: 4 | E469: =C469*6+D469 -> 10 | G469: 5 | H469: 5 | I469: =G469*6+H469 -> 35 | K469: 5 | L469: 10 | M469: =K469*6+L469 -> 40 | O469: 7 | P469: 10 | Q469: =O469*6+P469 -> 52 | S469: TOORAK PARK
A470: PRAHRAN | C470: 1 | D470: 0 | E470: =C470*6+D470 -> 6 | G470: 3 | H470: 2 | I470: =G470*6+H470 -> 20 | K470: 4 | L470: 6 | M470: =K470*6+L470 -> 30 | O470: 5 | P470: 11 | Q470: =O470*6+P470 -> 41 | S470: GANNON
A471: BEST PLAYERS
A472: WAVERLEY | C472: HUDSON | F472: McNAMEE | I472: ALLAN | L472: LAWSON | O472: PROBYN | R472: POORE
A473: PRAHRAN | C473: ALBISTON | F473: DICKESON | I473: CULPIN | L473: MAHON | O473: RICHARDSON | R473: BARTLETT
A474: GOALKICKERS
A475: WAVERLEY | C475: G PARKER 2 | F475: ALLAN | H475: LAWSON | J475: THOROGOOD | M475: MASSEY | P475: SEYMOUR
A476: PRAHRAN | C476: RYAN | E476: BUTLER | H476: WYND | J476: VERWOERT | M476: RICHARDSON
A478: ROUND 11 | E478: 9TH JULY | J478: WEATHER | N478: NORTH WIND | S478: PLAYED AT
D479: 1ST QTR | H479: 2ND QTR | L479: 3RD QTR | P479: FINAL | S479: BRUNSWICK
A480: COBURG | C480: 4 | D480: 5 | E480: =C480*6+D480 -> 29 | G480: 6 | H480: 6 | I480: =G480*6+H480 -> 42 | K480: 7 | L480: 14 | M480: =K480*6+L480 -> 56 | O480: 10 | P480: 16 | Q480: =O480*6+P480 -> 76 | S480: UMPIRE | X480: LADDER | AB480: ROUND | AD480: 11
A481: BRUNSWICK | C481: 0 | D481: 0 | E481: =C481*6+D481 -> 0 | G481: 3 | H481: 5 | I481: =G481*6+H481 -> 23 | K481: 5 | L481: 10 | M481: =K481*6+L481 -> 40 | O481: 7 | P481: 13 | Q481: =O481*6+P481 -> 55 | S481: DIXON
A482: BEST PLAYERS | W482: TEAM | X482: W | Y482: L | Z482: D | AA482: FOR | AB482: AGST | AC482: % | AD482: PTS
A483: COBURG | C483: BOSCHEN | F483: GOTCH | I483: TANCREDI | L483: GONINAN | N483: SULLIVAN | Q483: DUNNE
A484: BRUNSWICK | C484: BURNS | F484: McKINNON | I484: ROBINS | L484: BIBBY | N484: WILSON | Q484: BONSACK | W484: DANDENONG | X484: 9 | Y484: 2 | Z484: 0 | AA484: 1155 | AB484: 948 | AC484: 121.83544303797468 | AD484: 36
A485: GOALKICKERS | W485: PORT MELBOURNE | X485: 9 | Y485: 2 | Z485: 0 | AA485: 1032 | AB485: 856 | AC485: 120.56 | AD485: 36
A486: COBURG | C486: BRANSTON 3 | F486: GOTCH 2 | I486: McNABB 2 | L486: VINCENT 2 | O486: BOSCHEN | W486: COBURG | X486: 7 | Y486: 4 | Z486: 0 | AA486: 909 | AB486: 901 | AC486: 100.88790233074361 | AD486: 28
A487: BRUNSWICK | C487: McKINNON 3 | F487: BURNS 2 | I487: WHILEY | L487: BONSACK | W487: BRUNSWICK | X487: 6 | Y487: 5 | Z487: 0 | AA487: 936 | AB487: 979 | AC487: 95.607763023493362 | AD487: 24
A489: PRESTON | C489: 3 | D489: 3 | E489: =C489*6+D489 -> 21 | G489: 6 | H489: 6 | I489: =G489*6+H489 -> 42 | K489: 9 | L489: 14 | M489: =K489*6+L489 -> 68 | O489: 12 | P489: 16 | Q489: =O489*6+P489 -> 88 | S489: PRESTON | W489: PRESTON | X489: 5 | Y489: 6 | Z489: 0 | AA489: 1000 | AB489: 958 | AC489: 104.38413361169103 | AD489: 20
A490: DANDENONG | C490: 3 | D490: 1 | E490: =C490*6+D490 -> 19 | G490: 6 | H490: 7 | I490: =G490*6+H490 -> 43 | K490: 6 | L490: 8 | M490: =K490*6+L490 -> 44 | O490: 11 | P490: 11 | Q490: =O490*6+P490 -> 77 | S490: CHAPLIN | W490: YARRAVILLE | X490: 5 | Y490: 6 | Z490: 0 | AA490: 1013 | AB490: 990 | AC490: 102.32 | AD490: 20
A491: BEST PLAYERS | W491: SANDRINGHAM | X491: 5 | Y491: 6 | Z491: 0 | AA491: 932 | AB491: 986 | AC491: 94.52 | AD491: 20
A492: PRESTON | C492: SCHICKERT | F492: JOYCE | I492: WESTON | L492: DALTON | O492: CAMERON | R492: G PERRY | W492: PRAHRAN | X492: 4 | Y492: 7 | Z492: 0 | AA492: 933 | AB492: 973 | AC492: 95.89 | AD492: 16
A493: DANDENONG | C493: MITCHELL | F493: TOWNSEND | I493: OSBORNE | L493: MILLER | O493: EVANS | R493: WHITEHEAD | W493: WAVERLEY | X493: 4 | Y493: 7 | Z493: 0 | AA493: 788 | AB493: 928 | AC493: 84.91 | AD493: 16
A494: GOALKICKERS | W494: WILLIAMSTOWN | X494: 1 | Y494: 10 | Z494: 0 | AA494: 876 | AB494: 1055 | AC494: 83.03317535545024 | AD494: 4
A495: PRESTON | C495: WALKER 7 | F495: WESTON 2 | I495: HINDMARSH | L495: LEMPRIERE | O495: CHAPMAN
A496: DANDENONG | C496: MILLER 4 | F496: TOWNSEND 2 | I496: MORROW 2 | L496: MITCHELL | N496: McDONALD | Q496: EVANS
A498: WAVERLEY | C498: 2 | D498: 2 | E498: =C498*6+D498 -> 14 | G498: 5 | H498: 4 | I498: =G498*6+H498 -> 34 | K498: 7 | L498: 6 | M498: =K498*6+L498 -> 48 | O498: 8 | P498: 9 | Q498: =O498*6+P498 -> 57 | S498: WAVERLEY
A499: SANDRINGHAM | C499: 2 | D499: 3 | E499: =C499*6+D499 -> 15 | G499: 2 | H499: 7 | I499: =G499*6+H499 -> 19 | K499: 6 | L499: 7 | M499: =K499*6+L499 -> 43 | O499: 7 | P499: 10 | Q499: =O499*6+P499 -> 52 | S499: ARMSTRONG
A500: BEST PLAYERS
A501: WAVERLEY | C501: POORE | F501: ROLFE | I501: REEVES | L501: REID | N501: RIVIS | Q501: G PARKER
A502: SANDRINGHAM | C502: LADDS | F502: CLIFFORD | I502: M ZEUSCHNER | L502: LOH | N502: K WILLS | Q502: FENTON
A503: GOALKICKERS
A504: WAVERLEY | C504: REID 4 | F504: RIVIS 2 | I504: G PARKER | L504: THOROGOOD
A505: SANDRINGHAM | C505: K WILLS 3 | F505: MUTER 2 | I505: EASTOE | L505: SELLECK
A507: YARRAVILLE | C507: 3 | D507: 4 | E507: =C507*6+D507 -> 22 | G507: 4 | H507: 8 | I507: =G507*6+H507 -> 32 | K507: 11 | L507: 10 | M507: =K507*6+L507 -> 76 | O507: 13 | P507: 13 | Q507: =O507*6+P507 -> 91 | S507: YARRAVILLE
A508: PRAHRAN | C508: 2 | D508: 2 | E508: =C508*6+D508 -> 14 | G508: 5 | H508: 3 | I508: =G508*6+H508 -> 33 | K508: 7 | L508: 6 | M508: =K508*6+L508 -> 48 | O508: 11 | P508: 8 | Q508: =O508*6+P508 -> 74 | S508: JACKSON
A509: BEST PLAYERS
A510: YARRAVILLE | C510: CHARLES | F510: WARWICK | I510: CASTIKUM | L510: ROACH | N510: BENNETT | Q510: QUARANTOTTO
A511: PRAHRAN | C511: CULPIN | F511: RICHARDSON | I511: VERWOERT | L511: PEARSON | N511: ALBISTON | Q511: DICKESON
A512: GOALKICKERS
A513: YARRAVILLE | C513: BEATTIE 5 | F513: WARWICK 3 | I513: ROCHFORD 3 | L513: MADIGAN | N513: ROACH
A514: PRAHRAN | C514: RICHARDSON 3 | F514: RYAN 2 | I514: DICKESON | L514: SKIDMORE | N514: BARTLETT | Q514: ALBISTON | S514: McMAHON | V514: PEARSON
A516: PORT MELBOURNE | C516: 3 | D516: 3 | E516: =C516*6+D516 -> 21 | G516: 7 | H516: 12 | I516: =G516*6+H516 -> 54 | K516: 9 | L516: 15 | M516: =K516*6+L516 -> 69 | O516: 11 | P516: 19 | Q516: =O516*6+P516 -> 85 | S516: PORT MELBOURNE
A517: WILLIAMSTOWN | C517: 4 | D517: 3 | E517: =C517*6+D517 -> 27 | G517: 6 | H517: 6 | I517: =G517*6+H517 -> 42 | K517: 9 | L517: 9 | M517: =K517*6+L517 -> 63 | O517: 12 | P517: 12 | Q517: =O517*6+P517 -> 84 | S517: CRAIG
A518: BEST PLAYERS
A519: PORT MELBOURNE | C519: TEAGUE | F519: BRICE | I519: BOWEN | L519: IRELAND | O519: TAGGART | R519: BEDFORD
A520: WILLIAMSTOWN | C520: NANKERVIS | F520: MADIGAN | I520: WARE | L520: MURRIE | O520: RUSSELL | R520: HIGGINS
A521: GOALKICKERS
A522: PORT MELBOURNE | C522: TEAGUE 3 | F522: HOUSE 2 | I522: BEDFORD 2 | L522: TAGGART | N522: ALLEN | P522: BOWEN | R522: BRICE
A523: WILLIAMSTOWN | C523: SZYSKA 3 | F523: NANKERVIS 2 | I523: WARE 2 | K523: HIGGINS 2 | N523: H VOSILAITIS | Q523: VANDENBERG | T523: O'MARA
A525: ROUND 12 | E525: 15TH JULY | J525: WEATHER | M525: NORTH WIND LIGHT SHOWERS | S525: PLAYED AT
D526: 1ST QTR | H526: 2ND QTR | L526: 3RD QTR | P526: FINAL | S526: COBURG
A527: DANDENONG | C527: 2 | D527: 7 | E527: =C527*6+D527 -> 19 | G527: 3 | H527: 8 | I527: =G527*6+H527 -> 26 | K527: 7 | L527: 15 | M527: =K527*6+L527 -> 57 | O527: 8 | P527: 16 | Q527: =O527*6+P527 -> 64 | S527: UMPIRE | X527: LADDER | AB527: ROUND | AD527: 12
A528: COBURG | C528: 0 | D528: 0 | E528: =C528*6+D528 -> 0 | G528: 2 | H528: 4 | I528: =G528*6+H528 -> 16 | K528: 2 | L528: 7 | M528: =K528*6+L528 -> 19 | O528: 8 | P528: 10 | Q528: =O528*6+P528 -> 58 | S528: JACKSON
A529: BEST PLAYERS | W529: TEAM | X529: W | Y529: L | Z529: D | AA529: FOR | AB529: AGST | AC529: % | AD529: PTS
A530: DANDENONG | C530: MITCHELL | F530: EVANS | I530: SHEEHAN | L530: STEDWELL | O530: McDONALD | R530: MELAI
A531: COBURG | C531: GOTCH | F531: WELSH | I531: PARTRIDGE | L531: VINCENT | O531: DUNNE | R531: GONINAN | W531: DANDENONG | X531: 10 | Y531: 2 | Z531: 0 | AA531: 1219 | AB531: 1006 | AC531: 121.17296222664015 | AD531: 40
A532: GOALKICKERS | W532: PORT MELBOURNE | X532: 9 | Y532: 3 | Z532: 0 | AA532: 1092 | AB532: 929 | AC532: 117.55 | AD532: 36
A533: DANDENONG | C533: MILLER 2 | F533: MELAI 2 | I533: MORROW | K533: SMITH | M533: EVANS | O533: TOWNSEND | W533: COBURG | X533: 7 | Y533: 5 | Z533: 0 | AA533: 967 | AB533: 965 | AC533: 100.20725388601036 | AD533: 28
A534: COBURG | C534: PARTRIDGE 3 | F534: VINCENT 3 | I534: GRAHAM | K534: BRANSTON | W534: PRESTON | X534: 6 | Y534: 6 | Z534: 0 | AA534: 1063 | AB534: 1019 | AC534: 104.3179587831207 | AD534: 24
A536: PRESTON | C536: 1 | D536: 11 | E536: =C536*6+D536 -> 17 | G536: 2 | H536: 11 | I536: =G536*6+H536 -> 23 | K536: 7 | L536: 15 | M536: =K536*6+L536 -> 57 | O536: 8 | P536: 15 | Q536: =O536*6+P536 -> 63 | S536: PRESTON | W536: SANDRINGHAM | X536: 6 | Y536: 6 | Z536: 0 | AA536: 1005 | AB536: 1046 | AC536: 96.08 | AD536: 24
A537: BRUNSWICK | C537: 0 | D537: 6 | E537: =C537*6+D537 -> 6 | G537: 5 | H537: 4 | I537: =G537*6+H537 -> 34 | K537: 5 | L537: 4 | M537: =K537*6+L537 -> 34 | O537: 9 | P537: 7 | Q537: =O537*6+P537 -> 61 | S537: CRAIG | W537: BRUNSWICK | X537: 6 | Y537: 6 | Z537: 0 | AA537: 997 | AB537: 1042 | AC537: 95.68138195777351 | AD537: 24
A538: BEST PLAYERS | W538: YARRAVILLE | X538: 5 | Y538: 7 | Z538: 0 | AA538: 1057 | AB538: 1042 | AC538: 101.44 | AD538: 20
A539: PRESTON | C539: DALTON | E539: CAMERON | H539: HINDMARSH | K539: McLEAN | N539: G PERRY | Q539: DIXON | W539: PRAHRAN | X539: 5 | Y539: 7 | Z539: 0 | AA539: 985 | AB539: 1016 | AC539: 96.95 | AD539: 20
A540: BRUNSWICK | C540: WHILEY | E540: LEYDIN | H540: PENDLEBURY | K540: WILSON | N540: SMITH | Q540: BURNS | W540: WAVERLEY | X540: 5 | Y540: 7 | Z540: 0 | AA540: 840 | AB540: 972 | AC540: 86.42 | AD540: 20
A541: GOALKICKERS | W541: WILLIAMSTOWN | X541: 1 | Y541: 11 | Z541: 0 | AA541: 919 | AB541: 1107 | AC541: 83.01716350496838 | AD541: 4
A542: PRESTON | C542: WALKER 3 | F542: DALTON 2 | I542: HINDMARSH | L542: CAMERON | O542: LEMPRIERE
A543: BRUNSWICK | C543: PENDLEBURY 3 | F543: BONSACK | I543: LEYDIN | K543: ROBINSON | N543: WILSON | P543: McKINNON | R543: WHILEY
A545: SANDRINGHAM | C545: 6 | D545: 7 | E545: =C545*6+D545 -> 43 | G545: 6 | H545: 7 | I545: =G545*6+H545 -> 43 | K545: 10 | L545: 13 | M545: =K545*6+L545 -> 73 | O545: 10 | P545: 13 | Q545: =O545*6+P545 -> 73 | S545: BEACH ROAD
A546: PORT MELBOURNE | C546: 0 | D546: 1 | E546: =C546*6+D546 -> 1 | G546: 5 | H546: 5 | I546: =G546*6+H546 -> 35 | K546: 5 | L546: 6 | M546: =K546*6+L546 -> 36 | O546: 8 | P546: 12 | Q546: =O546*6+P546 -> 60 | S546: O'NEILL
A547: BEST PLAYERS
A548: SANDRINGHAM | C548: HOGAN | F548: M ZEUSCHNER | J548: ADDISON | M548: LADDS | O548: LOH | Q548: WARD
A549: PORT MELBOURNE | C549: GRIFFITHS | F549: ROWLANDS | J549: SCHMIDT | M549: BONNETT | O549: TEAGUE | Q549: PECK
A550: GOALKICKERS
A551: SANDRINGHAM | C551: ADDISON 3 | F551: B ZEUSCHNER 2 | J551: HOGAN 2 | M551: MACKENZIE | P551: MUTER | R551: K WILLS
A552: PORT MELBOURNE | C552: TEAGUE 3 | F552: BEDFORD 2 | I552: HOWELL 2 | L552: BRICE
A554: PRAHRAN | C554: 1 | D554: 3 | E554: =C554*6+D554 -> 9 | G554: 1 | H554: 3 | I554: =G554*6+H554 -> 9 | K554: 6 | L554: 10 | M554: =K554*6+L554 -> 46 | O554: 7 | P554: 10 | Q554: =O554*6+P554 -> 52 | S554: WILLIAMSTOWN
A555: WILLAMSTOWN | C555: 0 | D555: 2 | E555: =C555*6+D555 -> 2 | G555: 4 | H555: 6 | I555: =G555*6+H555 -> 30 | K555: 4 | L555: 8 | M555: =K555*6+L555 -> 32 | O555: 5 | P555: 13 | Q555: =O555*6+P555 -> 43 | S555: ARMSTRONG
A556: BEST PLAYERS
A557: PRAHRAN | C557: McMAHON | F557: ALBISTON | I557: DICKESON | L557: McLAREN | O557: BARTLETT | R557: PIPER
A558: WILLAMSTOWN | C558: MURRIE | F558: NANKERVIS | I558: SZYSKA | L558: MADIGAN | O558: HIGGINS | R558: A VOSILAITIS
A559: GOALKICKERS
A560: PRAHRAN | C560: ALBISTON 3 | F560: LONG | H560: PEARSON | K560: PIPER | M560: MINTON-CONNELL
A561: WILLAMSTOWN | C561: SZYSKA 2 | F561: NANKERVIS 2 | I561: A VOSILAITIS
A563: WAVERLEY | C563: 4 | D563: 8 | E563: =C563*6+D563 -> 32 | G563: 4 | H563: 9 | I563: =G563*6+H563 -> 33 | K563: 6 | L563: 14 | M563: =K563*6+L563 -> 50 | O563: 6 | P563: 16 | Q563: =O563*6+P563 -> 52 | S563: WAVERLEY
A564: YARRAVILLE | C564: 0 | D564: 1 | E564: =C564*6+D564 -> 1 | G564: 3 | H564: 6 | I564: =G564*6+H564 -> 24 | K564: 3 | L564: 6 | M564: =K564*6+L564 -> 24 | O564: 6 | P564: 8 | Q564: =O564*6+P564 -> 44 | S564: GARLICK
A565: BEST PLAYERS
A566: WAVERLEY | C566: POORE | F566: REEVES | I566: ROLFE | L566: THOROGOOD | O566: MASSEY | Q566: REID
A567: YARRAVILLE | C567: CASTRIKUM | F567: HENDERSON | I567: TAURENS | L567: CHARLES | O567: MADIGAN | Q567: GROSE
A568: GOALKICKERS
A569: WAVERLEY | C569: REID 3 | F569: SEYMOUR | I569: THOROGOOD | L569: RIVIS
A570: YARRAVILLE | C570: HENDERSON 2 | F570: BEATTIE 2 | I570: MADIGAN | L570: ROACH
A572: ROUND 13 | E572: 22ND JULY | J572: WEATHER | N572: LIGHT RAIN IN MORNING | S572: PLAYED AT
D573: 1ST QTR | H573: 2ND QTR | L573: 3RD QTR | P573: FINAL | S573: PORT MELBOURNE
A574: PORT MELBOURNE | C574: 4 | D574: 3 | E574: =C574*6+D574 -> 27 | G574: 12 | H574: 8 | I574: =G574*6+H574 -> 80 | K574: 20 | L574: 12 | M574: =K574*6+L574 -> 132 | O574: 26 | P574: 15 | Q574: =O574*6+P574 -> 171 | S574: UMPIRE | X574: LADDER | AB574: ROUND | AD574: 13
A575: PRESTON | C575: 2 | D575: 3 | E575: =C575*6+D575 -> 15 | G575: 4 | H575: 9 | I575: =G575*6+H575 -> 33 | K575: 11 | L575: 12 | M575: =K575*6+L575 -> 78 | O575: 15 | P575: 15 | Q575: =O575*6+P575 -> 105 | S575: DIXON
A576: BEST PLAYERS | W576: TEAM | X576: W | Y576: L | Z576: D | AA576: FOR | AB576: AGST | AC576: % | AD576: PTS
A577: PORT MELBOURNE | C577: BONNETT | F577: GRIFFITHS | I577: TEAGUE | L577: TAGGART | O577: BEDFORD | R577: WRIGHT
A578: PRESTON | C578: WALKER | F578: LEMPRIERE | I578: CAMERON | L578: SCHICKERT | O578: CHAPMAN | R578: A PERRY | W578: DANDENONG | X578: 11 | Y578: 2 | Z578: 0 | AA578: 1338 | AB578: 1096 | AC578: 122.08029197080292 | AD578: 44
A579: GOALKICKERS | P579: SCHMIDT | W579: PORT MELBOURNE | X579: 10 | Y579: 3 | Z579: 0 | AA579: 1263 | AB579: 1034 | AC579: 122.15 | AD579: 40
A580: PORT MELBOURNE | C580: TEAGUE 6 | E580: WRIGHT 4 | G580: TAGGART 4 | J580: BEDFORD 4 | M580: HOWELL 2 | P580: BONNETT 2 | R580: PECK 2 | T580: BRICE | W580: COBURG | X580: 8 | Y580: 5 | Z580: 0 | AA580: 1082 | AB580: 1038 | AC580: 104.23892100192678 | AD580: 32
A581: PRESTON | C581: WALKER 4 | E581: JOYCE 2 | G581: WESTON 2 | J581: CHAPMAN 2 | M581: CAMERON 2 | P581: LEMPRIERE | R581: G PERRY | T581: PARRIS | W581: BRUNSWICK | X581: 7 | Y581: 6 | Z581: 0 | AA581: 1074 | AB581: 1116 | AC581: 96.236559139784944 | AD581: 28
A583: DANDENONG | C583: 2 | D583: 1 | E583: =C583*6+D583 -> 13 | G583: 9 | H583: 5 | I583: =G583*6+H583 -> 59 | K583: 14 | L583: 11 | M583: =K583*6+L583 -> 95 | O583: 17 | P583: 17 | Q583: =O583*6+P583 -> 119 | S583: DANDENONG | W583: YARRAVILLE | X583: 6 | Y583: 7 | Z583: 0 | AA583: 1168 | AB583: 1138 | AC583: 102.64 | AD583: 24
A584: SANDRINGHAM | C584: 5 | D584: 4 | E584: =C584*6+D584 -> 34 | G584: 8 | H584: 6 | I584: =G584*6+H584 -> 54 | K584: 9 | L584: 6 | M584: =K584*6+L584 -> 60 | O584: 13 | P584: 12 | Q584: =O584*6+P584 -> 90 | S584: CRAIG | W584: PRESTON | X584: 6 | Y584: 7 | Z584: 0 | AA584: 1168 | AB584: 1190 | AC584: 98.151260504201687 | AD584: 24
A585: BEST PLAYERS | W585: SANDRINGHAM | X585: 6 | Y585: 7 | Z585: 0 | AA585: 1095 | AB585: 1165 | AC585: 93.99 | AD585: 24
A586: DANDENONG | C586: LIENERT | F586: MITCHELL | I586: McNAMARA | L586: MILLER | N586: EVANS | Q586: SHEEHAN | W586: PRAHRAN | X586: 5 | Y586: 8 | Z586: 0 | AA586: 1058 | AB586: 1131 | AC586: 93.55 | AD586: 20
A587: SANDRINGHAM | C587: M ZEUSCHNER | F587: LADDS | I587: HANCE | L587: WARD | N587: CLIFFORD | Q587: HOGAN | W587: WAVERLEY | X587: 5 | Y587: 8 | Z587: 0 | AA587: 914 | AB587: 1049 | AC587: 87.13 | AD587: 20
A588: GOALKICKERS | W588: WILLIAMSTOWN | X588: 1 | Y588: 12 | Z588: 0 | AA588: 1015 | AB588: 1218 | AC588: 83.333333333333329 | AD588: 4
A589: DANDENONG | C589: MILLER 7 | F589: SHEEHAN 3 | I589: HILL 2 | K589: MORROW 2 | N589: EVANS | P589: MELAI | R589: McDONALD
A590: SANDRINGHAM | C590: HOGAN 6 | F590: ADDISON 2 | I590: WESTON | K590: B ZEUSCHNER | N590: MACKENZIE | Q590: SELLECK | S590: MUTER
A592: COBURG | C592: 5 | D592: 6 | E592: =C592*6+D592 -> 36 | G592: 10 | H592: 9 | I592: =G592*6+H592 -> 69 | K592: 12 | L592: 11 | M592: =K592*6+L592 -> 83 | O592: 17 | P592: 13 | Q592: =O592*6+P592 -> 115 | S592: TOORAK PARK
A593: PRAHRAN | C593: 3 | D593: 1 | E593: =C593*6+D593 -> 19 | G593: 3 | H593: 4 | I593: =G593*6+H593 -> 22 | K593: 6 | L593: 12 | M593: =K593*6+L593 -> 48 | O593: 10 | P593: 13 | Q593: =O593*6+P593 -> 73 | S593: TOOHEY
A594: BEST PLAYERS
A595: COBURG | C595: DUNNE | F595: WELSH | I595: McNABB | L595: PARTRIDGE | O595: GONINAN | R595: SULLIVAN
A596: PRAHRAN | C596: SKIDMORE | F596: BARTLETT | I596: ALBISTON | L596: DICKESON | O596: CAVEY | R596: LONG
A597: GOALKICKERS
A598: COBURG | C598: McNABB 3 | F598: THOMPSON 3 | I598: PARTRIDGE 2 | L598: GONINAN 2 | O598: GOTCH | Q598: VINCENT | S598: BOSCHEN | V598: PARDON | X598: TASIC
A599: PRAHRAN | C599: SKIDMORE 4 | F599: RYAN 2 | I599: KIRBY 2 | K599: WYND | M599: VERWOERT
A601: BRUNSWICK | C601: 2 | D601: 1 | E601: =C601*6+D601 -> 13 | G601: 4 | H601: 3 | I601: =G601*6+H601 -> 27 | K601: 7 | L601: 7 | M601: =K601*6+L601 -> 49 | O601: 11 | P601: 11 | Q601: =O601*6+P601 -> 77 | S601: BRUNSWICK
A602: WAVERLEY | C602: 4 | D602: 4 | E602: =C602*6+D602 -> 28 | G602: 6 | H602: 8 | I602: =G602*6+H602 -> 44 | K602: 7 | L602: 10 | M602: =K602*6+L602 -> 52 | O602: 10 | P602: 14 | Q602: =O602*6+P602 -> 74 | S602: O'NEILL
A603: BEST PLAYERS
A604: BRUNSWICK | C604: BURNS | F604: KERWOOD | I604: PENDLEBURY | L604: WILSON | O604: WHILEY | R604: McKINNON
A605: WAVERLEY | C605: CARROLL | F605: POORE | I605: BURGIN | L605: HUDSON | O605: REEVES | R605: MCQUEEN
A606: GOALKICKERS
A607: BRUNSWICK | C607: BRIGLIA 3 | F607: PENDLEBURY 2 | I607: LEYDIN 2 | L607: WILSON | N607: BONSACK | P607: BURNS | R607: WHILEY
A608: WAVERLEY | C608: BURGIN 2 | F608: G PARKER 2 | I608: McQUEEN 2 | L608: SEYMOUR | N608: REID | P608: JONES | R608: ELLIS
A610: YARRAVILLE | C610: 5 | D610: 0 | E610: =C610*6+D610 -> 30 | G610: 8 | H610: 1 | I610: =G610*6+H610 -> 49 | K610: 10 | L610: 5 | M610: =K610*6+L610 -> 65 | O610: 17 | P610: 9 | Q610: =O610*6+P610 -> 111 | S610: YARRAVILLE
A611: WILLIAMSTOWN | C611: 2 | D611: 3 | E611: =C611*6+D611 -> 15 | G611: 8 | H611: 7 | I611: =G611*6+H611 -> 55 | K611: 11 | L611: 9 | M611: =K611*6+L611 -> 75 | O611: 14 | P611: 12 | Q611: =O611*6+P611 -> 96 | S611: CHAPLIN
A612: BEST PLAYERS
A613: YARRAVILLE | C613: CHARLES | F613: MADIGAN | I613: WARWICK | L613: QUARANTOTTO | O613: CASTRIKUM | R613: ROACH
A614: WILLIAMSTOWN | C614: O'TOOLE | F614: NANKERVIS | I614: MADIGAN | L614: FOWLER | O614: MURRIE | R614: WARD
A615: GOALKICKERS
A616: YARRAVILLE | C616: MADIGAN 4 | F616: ROACH 3 | I616: McBEAN 2 | L616: WARWICK 2 | O616: BEATTIE 2 | Q616: FOGARTY | S616: QUARANTOTTO | W616: ROCHFORD | X616: CONNELLY
A617: WILLIAMSTOWN | C617: NANKERVIS 4 | F617: SZYSKA 3 | I617: H VOSILAITIS 3 | L617: A VOSILAITIS | O617: WARE | Q617: FOWLER | T617: BASTIAN
A619: ROUND 14 | E619: 30TH JULY | J619: WEATHER | N619: FINE | S619: PLAYED AT
D620: 1ST QTR | H620: 2ND QTR | L620: 3RD QTR | P620: FINAL | S620: YARRAVILLE
A621: YARRAVILLE | C621: 8 | D621: 3 | E621: =C621*6+D621 -> 51 | G621: 11 | H621: 6 | I621: =G621*6+H621 -> 72 | K621: 18 | L621: 10 | M621: =K621*6+L621 -> 118 | O621: 23 | P621: 15 | Q621: =O621*6+P621 -> 153 | S621: UMPIRE | X621: LADDER | AB621: ROUND | AD621: 14
A622: BRUNSWICK | C622: 4 | D622: 2 | E622: =C622*6+D622 -> 26 | G622: 7 | H622: 7 | I622: =G622*6+H622 -> 49 | K622: 10 | L622: 8 | M622: =K622*6+L622 -> 68 | O622: 16 | P622: 11 | Q622: =O622*6+P622 -> 107 | S622: TOOHEY
A623: BEST PLAYERS | W623: TEAM | X623: W | Y623: L | Z623: D | AA623: FOR | AB623: AGST | AC623: % | AD623: PTS
A624: YARRAVILLE | C624: BONGETTI | F624: BARROW | I624: HENDERSON | L624: TAURENS | N624: WARWICK | Q624: QUARANTOTTO
A625: BRUNSWICK | C625: McKINNON | F625: WHILEY | I625: BURNS | L625: LEYDIN | N625: BIBBY | Q625: KERWOOD | W625: DANDENONG | X625: 12 | Y625: 2 | Z625: 0 | AA625: 1439 | AB625: 1149 | AC625: 125.23933855526545 | AD625: 48
A626: GOALKICKERS | O626: WARWICK | R626: QUARANTOTTO | W626: PORT MELBOURNE | X626: 11 | Y626: 3 | Z626: 0 | AA626: 1373 | AB626: 1134 | AC626: 121.08 | AD626: 44
A627: YARRAVILLE | C627: BONGETTI 6 | F627: BEATTIE 4 | I627: McBEAN 3 | K627: MADIGAN 2 | N627: HENDERSON 2 | Q627: ROACH 2 | S627: CONNELLY 2 | W627: COBURG | X627: 8 | Y627: 6 | Z627: 0 | AA627: 1156 | AB627: 1156 | AC627: 100 | AD627: 32
A628: BRUNSWICK | C628: McKINNON 5 | F628: LEYDIN 3 | I628: BURNS 2 | K628: BIBBY 2 | M628: ROGERS | O628: PENDLEBURY | R628: HAGART | T628: WHILEY | W628: YARRAVILLE | X628: 7 | Y628: 7 | Z628: 0 | AA628: 1321 | AB628: 1245 | AC628: 106.1 | AD628: 28
A630: PRESTON | C630: 2 | D630: 0 | E630: =C630*6+D630 -> 12 | G630: 10 | H630: 6 | I630: =G630*6+H630 -> 66 | K630: 10 | L630: 11 | M630: =K630*6+L630 -> 71 | O630: 17 | P630: 16 | Q630: =O630*6+P630 -> 118 | S630: PRESTON | W630: PRESTON | X630: 7 | Y630: 7 | Z630: 0 | AA630: 1286 | AB630: 1264 | AC630: 101.74050632911393 | AD630: 28
A631: COBURG | C631: 5 | D631: 1 | E631: =C631*6+D631 -> 31 | G631: 7 | H631: 1 | I631: =G631*6+H631 -> 43 | K631: 10 | L631: 6 | M631: =K631*6+L631 -> 66 | O631: 11 | P631: 8 | Q631: =O631*6+P631 -> 74 | S631: ARMSTRONG | W631: SANDRINGHAM | X631: 7 | Y631: 7 | Z631: 0 | AA631: 1169 | AB631: 1231 | AC631: 94.96 | AD631: 28
A632: BEST PLAYERS | W632: BRUNSWICK | X632: 7 | Y632: 7 | Z632: 0 | AA632: 1181 | AB632: 1269 | AC632: 93.065405831363279 | AD632: 28
A633: PRESTON | C633: JOYCE | F633: McLEAN | I633: CHAPMAN | L633: DALTON | O633: HINDMARSH | R633: HANVIN | W633: PRAHRAN | X633: 5 | Y633: 9 | Z633: 0 | AA633: 1111 | AB633: 1232 | AC633: 90.18 | AD633: 20
A634: COBURG | C634: SULLIVAN | F634: GONINAN | I634: WELSH | L634: THOMPSON | O634: OATEN | R634: TANCREDI | W634: WAVERLEY | X634: 5 | Y634: 9 | Z634: 0 | AA634: 1014 | AB634: 1159 | AC634: 87.49 | AD634: 20
A635: GOALKICKERS | W635: WILLIAMSTOWN | X635: 1 | Y635: 13 | Z635: 0 | AA635: 1081 | AB635: 1292 | AC635: 83.668730650154799 | AD635: 4
A636: PRESTON | C636: WALKER 4 | F636: CHAPMAN 4 | I636: JOYCE 3 | K636: HINDMARSH 2 | N636: WESTON 2 | Q636: LEMPRIERE | T636: G PERRY
A637: COBURG | C637: FITZPATRICK 3 | F637: GONINAN 2 | I637: SULLIVAN 2 | L637: VINCENT 2 | N637: GOTCH | P637: POWELL
A639: SANDRINGHAM | C639: 2 | D639: 6 | E639: =C639*6+D639 -> 18 | G639: 3 | H639: 9 | I639: =G639*6+H639 -> 27 | K639: 8 | L639: 16 | M639: =K639*6+L639 -> 64 | O639: 9 | P639: 20 | Q639: =O639*6+P639 -> 74 | S639: BEACH ROAD
A640: WILLIAMSTOWN | C640: 2 | D640: 1 | E640: =C640*6+D640 -> 13 | G640: 4 | H640: 7 | I640: =G640*6+H640 -> 31 | K640: 4 | L640: 9 | M640: =K640*6+L640 -> 33 | O640: 9 | P640: 12 | Q640: =O640*6+P640 -> 66 | S640: JACKSON
A641: BEST PLAYERS
A642: SANDRINGHAM | C642: LADDS | F642: VAUGHAN | I642: CLIFFORD | L642: HOGAN | N642: M ZEUSCHNER | Q642: ADDISON
A643: WILLIAMSTOWN | C643: MAGIGAN | F643: H VOSILAITIS | I643: BARNES | L643: JOHNSON | N643: FOWLER | Q643: NANKERVIS
A644: GOALKICKERS
A645: SANDRINGHAM | C645: HOGAN 3 | F645: DE LUCA 2 | I645: MANN | K645: SELLECK | M645: VAUGHAN | O645: K WILLS
A646: WILLIAMSTOWN | C646: H VOSILAITIS 3 | F646: BARNES 2 | I646: SZYSKA 2 | L646: NANKERVIS | O646: MADIGAN
A648: DANDENONG | C648: 4 | D648: 2 | E648: =C648*6+D648 -> 26 | G648: 8 | H648: 5 | I648: =G648*6+H648 -> 53 | K648: 10 | L648: 13 | M648: =K648*6+L648 -> 73 | O648: 14 | P648: 17 | Q648: =O648*6+P648 -> 101 | S648: DANDENONG
A649: PRAHRAN | C649: 1 | D649: 5 | E649: =C649*6+D649 -> 11 | G649: 3 | H649: 7 | I649: =G649*6+H649 -> 25 | K649: 6 | L649: 11 | M649: =K649*6+L649 -> 47 | O649: 7 | P649: 11 | Q649: =O649*6+P649 -> 53 | S649: DIXON
A650: BEST PLAYERS
A651: DANDENONG | C651: McNAMARA | F651: SHEEHAN | I651: MILLER | L651: MITCHELL | O651: EVANS | Q651: HILL
A652: PRAHRAN | C652: SKIDMORE | F652: HARTNETT | I652: MINTON-CONNELL | M652: ALBISTON | O652: CAVEY | Q652: KIRBY
A653: GOALKICKERS
A654: DANDENONG | C654: MILLER 7 | F654: MORROW 2 | I654: BANKS 2 | K654: SMITH | M654: SHEEHAN | O654: HILL
A655: PRAHRAN | C655: LONG 2 | F655: FLETCHER 2 | I655: RYAN | K655: SKIDMORE | N655: WYND
A657: PORT MELBOURNE | C657: 3 | D657: 1 | E657: =C657*6+D657 -> 19 | G657: 6 | H657: 4 | I657: =G657*6+H657 -> 40 | K657: 8 | L657: 6 | M657: =K657*6+L657 -> 54 | O657: 16 | P657: 14 | Q657: =O657*6+P657 -> 110 | S657: WAVERLEY
A658: WAVERLEY | C658: 6 | D658: 6 | E658: =C658*6+D658 -> 42 | G658: 7 | H658: 10 | I658: =G658*6+H658 -> 52 | K658: 13 | L658: 15 | M658: =K658*6+L658 -> 93 | O658: 14 | P658: 16 | Q658: =O658*6+P658 -> 100 | S658: CRAIG
A659: BEST PLAYERS
A660: PORT MELBOURNE | C660: IRELAND | F660: GRIFFITHS | I660: BENTLEY | L660: HOWELL | O660: SCHMIDT | R660: PECK
A661: WAVERLEY | C661: POORE | F661: G PARKER | I661: McNAMEE | L661: REID | O661: ALLAN | R661: LAWSON
A662: GOALKICKERS
A663: PORT MELBOURNE | C663: HOWELL 6 | F663: BRICE 3 | I663: PECK 2 | K663: BEDFORD | M663: TEAGUE | O663: BONNETT | Q663: CARLILE | S663: SCHMIDT
A664: WAVERLEY | C664: G PARKER 3 | F664: ALLAN 3 | I664: LAWSON 2 | L664: REID 2 | N664: McNAMEE | Q664: THOROGOOD | T664: PETZKE | V664: McQUEEN
A666: ROUND 15 | C666: 5TH AUGUST | J666: WEATHER | M666: S BREEZE FINE SUNNY | S666: PLAYED AT
D667: 1ST QTR | H667: 2ND QTR | L667: 3RD QTR | P667: FINAL | S667: WILLIAMSTOWN
A668: WILLIAMSTOWN | C668: 2 | D668: 4 | E668: =C668*6+D668 -> 16 | G668: 9 | H668: 11 | I668: =G668*6+H668 -> 65 | K668: 11 | L668: 13 | M668: =K668*6+L668 -> 79 | O668: 17 | P668: 16 | Q668: =O668*6+P668 -> 118 | S668: UMPIRE | X668: LADDER | AB668: ROUND | AD668: 15
A669: DANDENONG | C669: 2 | D669: 2 | E669: =C669*6+D669 -> 14 | G669: 5 | H669: 7 | I669: =G669*6+H669 -> 37 | K669: 9 | L669: 13 | M669: =K669*6+L669 -> 67 | O669: 12 | P669: 19 | Q669: =O669*6+P669 -> 91 | S669: O'NEILL
A670: BEST PLAYERS | W670: TEAM | X670: W | Y670: L | Z670: D | AA670: FOR | AB670: AGST | AC670: % | AD670: PTS
A671: WILLIAMSTOWN | C671: NANKERVIS | F671: H VOSILAITIS | I671: FOWLER | L671: SZYSKA | O671: RUSSELL | R671: BASTIAN
A672: DANDENONG | C672: MITCHELL | F672: HILL | I672: McDONALD | L672: McNAMARA | O672: SHEEHAN | R672: MORROW | W672: DANDENONG | X672: 12 | Y672: 3 | Z672: 0 | AA672: 1530 | AB672: 1267 | AC672: 120.7576953433307 | AD672: 48
A673: GOALKICKERS | W673: PORT MELBOURNE | X673: 11 | Y673: 4 | Z673: 0 | AA673: 1438 | AB673: 1223 | AC673: 117.58 | AD673: 44
A674: WILLIAMSTOWN | C674: SZYSKA 7 | F674: FOWLER 3 | I674: NANKERVIS 3 | L674: H VOSILAITIS 2 | O674: BARNES | Q674: YOUNG | W674: YARRAVILLE | X674: 8 | Y674: 7 | Z674: 0 | AA674: 1410 | AB674: 1310 | AC674: 107.63 | AD674: 32
A675: DANDENONG | C675: HILL 5 | F675: MORROW 2 | I675: MELAI 2 | K675: SHEEHAN | M675: MILLER | O675: BARNES | W675: COBURG | X675: 8 | Y675: 7 | Z675: 0 | AA675: 1246 | AB675: 1251 | AC675: 99.60031974420464 | AD675: 32
E676: 6TH AUGUST | J676: WEATHER | M676: FINE
A677: YARRAVILLE | C677: 5 | D677: 2 | E677: =C677*6+D677 -> 32 | G677: 7 | H677: 7 | I677: =G677*6+H677 -> 49 | K677: 11 | L677: 11 | M677: =K677*6+L677 -> 77 | O677: 13 | P677: 11 | Q677: =O677*6+P677 -> 89 | S677: PORT MELBOURNE | W677: SANDRINGHAM | X677: 8 | Y677: 7 | Z677: 0 | AA677: 1264 | AB677: 1321 | AC677: 95.69 | AD677: 32
A678: PORT MELBOURNE | C678: 2 | D678: 4 | E678: =C678*6+D678 -> 16 | G678: 4 | H678: 4 | I678: =G678*6+H678 -> 28 | K678: 7 | L678: 10 | M678: =K678*6+L678 -> 52 | O678: 9 | P678: 11 | Q678: =O678*6+P678 -> 65 | S678: GARLICK | W678: PRESTON | X678: 7 | Y678: 8 | Z678: 0 | AA678: 1376 | AB678: 1385 | AC678: 99.350180505415167 | AD678: 28
A679: BEST PLAYERS | W679: BRUNSWICK | X679: 7 | Y679: 8 | Z679: 0 | AA679: 1247 | AB679: 1337 | AC679: 93.268511593118916 | AD679: 28
A680: YARRAVILLE | C680: CONNELLY | F680: WARWICK | I680: CHARLES | L680: BARROW | N680: BENNETT | Q680: TARRANT | W680: WAVERLEY | X680: 6 | Y680: 9 | Z680: 0 | AA680: 1135 | AB680: 1249 | AC680: 90.88 | AD680: 24
A681: PORT MELBOURNE | C681: IRELAND | F681: SCHMIDT | I681: GRIFFITHS | L681: TAGGART | N681: KERR | Q681: WILLIAMS | W681: PRAHRAN | X681: 6 | Y681: 9 | Z681: 0 | AA681: 1179 | AB681: 1298 | AC681: 90.83 | AD681: 24
A682: GOALKICKERS | W682: WILLIAMSTOWN | X682: 2 | Y682: 13 | Z682: 0 | AA682: 1199 | AB682: 1383 | AC682: 86.695589298626174 | AD682: 8
A683: YARRAVILLE | C683: CONNELLY 4 | F683: MADIGAN 2 | I683: McBEAN 2 | L683: BEATTIE 2 | N683: WARWICK | Q683: BONGETTI
A684: PORT MELBOURNE | C684: HOWELL 3 | F684: TAGGART 3 | I684: TEAGUE | K684: CARLILE | M684: GRIFFITHS
A686: SANDRINGHAM | C686: 3 | D686: 5 | E686: =C686*6+D686 -> 23 | G686: 6 | H686: 8 | I686: =G686*6+H686 -> 44 | K686: 10 | L686: 15 | M686: =K686*6+L686 -> 75 | O686: 12 | P686: 23 | Q686: =O686*6+P686 -> 95 | S686: COBURG
A687: COBURG | C687: 4 | D687: 3 | E687: =C687*6+D687 -> 27 | G687: 8 | H687: 7 | I687: =G687*6+H687 -> 55 | K687: 11 | L687: 12 | M687: =K687*6+L687 -> 78 | O687: 12 | P687: 18 | Q687: =O687*6+P687 -> 90 | S687: ALEXANDER
A688: BEST PLAYERS
A689: SANDRINGHAM | C689: LADDS | F689: MANN | I689: B ZEUSCHNER | L689: M ZEUSCHNER | O689: SELLECK | R689: VAUGHAN
A690: COBURG | C690: WELSH | F690: McNABB | I690: PALMER | L690: THOMPSON | O690: SULLIVAN | R690: VINCENT
A691: GOALKICKERS
A692: SANDRINGHAM | C692: MUTER 4 | F692: B ZEUSCHNER 3 | J692: DIXON 2 | M692: HOGAN | O692: SELLECK | Q692: WESTON
A693: COBURG | C693: PALMER 4 | F693: VINCENT 3 | I693: McNABB 2 | L693: TASIC | N693: GOTCH | P693: SCHULZE
A695: PRAHRAN | C695: 1 | D695: 4 | E695: =C695*6+D695 -> 10 | G695: 1 | H695: 7 | I695: =G695*6+H695 -> 13 | K695: 6 | L695: 11 | M695: =K695*6+L695 -> 47 | O695: 9 | P695: 14 | Q695: =O695*6+P695 -> 68 | S695: TOORAK PARK
A696: BRUNSWICK | C696: 2 | D696: 4 | E696: =C696*6+D696 -> 16 | G696: 5 | H696: 4 | I696: =G696*6+H696 -> 34 | K696: 6 | L696: 5 | M696: =K696*6+L696 -> 41 | O696: 10 | P696: 6 | Q696: =O696*6+P696 -> 66 | S696: PIMBLETT
A697: BEST PLAYERS
A698: PRAHRAN | C698: DICKESON | F698: BARTLETT | I698: SKIDMORE | L698: McLAREN | N698: CAVEY | Q698: KIRBY
A699: BRUNSWICK | C699: BURNS | F699: WROUT | I699: ROBINS | L699: BIBBY | N699: LEYDIN | Q699: ROBINSON
A700: GOALKICKERS
A701: PRAHRAN | C701: BARTLETT 2 | F701: SEEDY 2 | I701: PEARSON | K701: FLETCHER | M701: WHITELAW | P701: MINALL | R701: WYND
A702: BRUNSWICK | C702: WROUT 3 | F702: McKINNON 2 | I702: BURNS | K702: LEYDIN | M702: PENDLEBURY | P702: LIMBOM | R702: HAGART
A704: WAVERLEY | C704: 7 | D704: 9 | E704: =C704*6+D704 -> 51 | G704: 7 | H704: 16 | I704: =G704*6+H704 -> 58 | K704: 14 | L704: 17 | M704: =K704*6+L704 -> 101 | O704: 17 | P704: 19 | Q704: =O704*6+P704 -> 121 | S704: WAVERLEY
A705: PRESTON | C705: 0 | D705: 5 | E705: =C705*6+D705 -> 5 | G705: 6 | H705: 9 | I705: =G705*6+H705 -> 45 | K705: 10 | L705: 13 | M705: =K705*6+L705 -> 73 | O705: 12 | P705: 18 | Q705: =O705*6+P705 -> 90 | S705: TOOHEY
A706: BEST PLAYERS
A707: WAVERLEY | C707: G PARKER | F707: O'DONNELL | I707: BRENCHLEY | L707: McKENZIE | O707: LAWSON | R707: ROLFE
A708: PRESTON | C708: JOYCE | F708: HANVIN | I708: DALTON | L708: McLEAN | O708: G PERRY | R708: SCHICKERT
A709: GOALKICKERS
A710: WAVERLEY | C710: McKENZIE 4 | F710: POORE 3 | H710: O'DONNELL 2 | K710: LAWSON 2 | N710: REID 2 | P710: BRENCHLEY | S710: JONES | U710: G PARKER
A711: PRESTON | C711: WALKER 5 | F711: DALTON 2 | I711: CHAPMAN 2 | L711: A PERRY | N711: LEMPRIERE | Q711: HINDMARSH
A713: ROUND 16 | E713: 12TH AUGUST | J713: WEATHER | N713: RAIN LAST QTR | S713: PLAYED AT
D714: 1ST QTR | H714: 2ND QTR | L714: 3RD QTR | P714: FINAL | S714: PRESTON
A715: PRESTON | C715: 3 | D715: 1 | E715: =C715*6+D715 -> 19 | G715: 10 | H715: 3 | I715: =G715*6+H715 -> 63 | K715: 12 | L715: 6 | M715: =K715*6+L715 -> 78 | O715: 17 | P715: 7 | Q715: =O715*6+P715 -> 109 | S715: UMPIRE | X715: LADDER | AB715: ROUND | AD715: 16
A716: YARRAVILLE | C716: 6 | D716: 7 | E716: =C716*6+D716 -> 43 | G716: 8 | H716: 8 | I716: =G716*6+H716 -> 56 | K716: 12 | L716: 10 | M716: =K716*6+L716 -> 82 | O716: 16 | P716: 12 | Q716: =O716*6+P716 -> 108 | S716: DIXON
A717: BEST PLAYERS | W717: TEAM | X717: W | Y717: L | Z717: D | AA717: FOR | AB717: AGST | AC717: % | AD717: PTS
A718: PRESTON | C718: McLEAN | F718: HYDE | I718: DALTON | L718: WALKER | O718: G PERRY | R718: JOYCE
A719: YARRAVILLE | C719: CHARLES | F719: BARROW | I719: TAURENS | L719: BONGETTI | O719: HENDERSON | R719: ROACH | W719: DANDENONG | X719: 12 | Y719: 4 | Z719: 0 | AA719: 1583 | AB719: 1327 | AC719: 119.29163526752072 | AD719: 48
A720: GOALKICKERS | W720: PORT MELBOURNE | X720: 11 | Y720: 5 | Z720: 0 | AA720: 1511 | AB720: 1315 | AC720: 114.9 | AD720: 44
A721: PRESTON | C721: WALKER 8 | F721: HINDMARSH 2 | J721: WESTON 2 | M721: JOYCE 2 | O721: DALTON 2 | R721: A PERRY | W721: COBURG | X721: 9 | Y721: 7 | Z721: 0 | AA721: 1333 | AB721: 1312 | AC721: 101.60060975609755 | AD721: 36
A722: YARRAVILLE | C722: BONGETTI 5 | F722: ROACH 3 | I722: MADIGAN 2 | L722: CONNELLY 2 | O722: BEATTIE 2 | Q722: WILSON | S722: WARWICK | W722: SANDRINGHAM | X722: 9 | Y722: 7 | Z722: 0 | AA722: 1393 | AB722: 1374 | AC722: 101.38 | AD722: 36
A724: BRUNSWICK | C724: 4 | D724: 4 | E724: =C724*6+D724 -> 28 | G724: 7 | H724: 7 | I724: =G724*6+H724 -> 49 | K724: 11 | L724: 11 | M724: =K724*6+L724 -> 77 | O724: 13 | P724: 14 | Q724: =O724*6+P724 -> 92 | S724: BRUNSWICK | W724: YARRAVILLE | X724: 8 | Y724: 8 | Z724: 0 | AA724: 1518 | AB724: 1419 | AC724: 106.98 | AD724: 32
A725: PORT MELBOURNE | C725: 2 | D725: 1 | E725: =C725*6+D725 -> 13 | G725: 8 | H725: 5 | I725: =G725*6+H725 -> 53 | K725: 10 | L725: 8 | M725: =K725*6+L725 -> 68 | O725: 10 | P725: 13 | Q725: =O725*6+P725 -> 73 | S725: JACKSON | W725: PRESTON | X725: 8 | Y725: 8 | Z725: 0 | AA725: 1485 | AB725: 1493 | AC725: 99.464166108506362 | AD725: 32
A726: BEST PLAYERS | W726: BRUNSWICK | X726: 8 | Y726: 8 | Z726: 0 | AA726: 1339 | AB726: 1410 | AC726: 94.964539007092199 | AD726: 32
A727: BRUNSWICK | C727: BURNS | F727: WILSON | I727: McKINNON | L727: LEYDIN | N727: BIBBY | Q727: KERWOOD | W727: WAVERLEY | X727: 7 | Y727: 9 | Z727: 0 | AA727: 1195 | AB727: 1302 | AC727: 91.78 | AD727: 28
A728: PORT MELBOURNE | C728: HOWELL | F728: BROWNING | I728: RENOUF | L728: TEAGUE | N728: GROVER | Q728: BUCKLEY | W728: PRAHRAN | X728: 6 | Y728: 10 | Z728: 0 | AA728: 1232 | AB728: 1427 | AC728: 86.33 | AD728: 24
A729: GOALKICKERS | W729: WILLIAMSTOWN | X729: 2 | Y729: 14 | Z729: 0 | AA729: 1260 | AB729: 1470 | AC729: 85.714285714285708 | AD729: 8
A730: BRUNSWICK | C730: LEYDIN 4 | F730: BURNS 3 | I730: PENDLEBURY 2 | L730: HAGART 2 | N730: ROBINSON | Q730: BIBBY
A731: PORT MELBOURNE | C731: HOWELL 4 | F731: BRICE 2 | I731: TAGGART | K731: BUCKLEY | M731: BONNETT | O731: TEAGUE
A733: SANDRINGHAM | C733: 3 | D733: 5 | E733: =C733*6+D733 -> 23 | G733: 7 | H733: 9 | I733: =G733*6+H733 -> 51 | K733: 14 | L733: 15 | M733: =K733*6+L733 -> 99 | O733: 18 | P733: 21 | Q733: =O733*6+P733 -> 129 | S733: BEACH ROAD
A734: PRAHRAN | C734: 1 | D734: 1 | E734: =C734*6+D734 -> 7 | G734: 3 | H734: 7 | I734: =G734*6+H734 -> 25 | K734: 6 | L734: 8 | M734: =K734*6+L734 -> 44 | O734: 7 | P734: 11 | Q734: =O734*6+P734 -> 53 | S734: ARMSTRONG
A735: BEST PLAYERS
A736: SANDRINGHAM | C736: VAUGHAN | F736: SELLECK | I736: HOGAN | L736: B ZEUSCHNER | O736: MUTER | R736: ADDISON
A737: PRAHRAN | C737: BARTLETT | F737: ALBISTON | I737: SKIDMORE | L737: PEARSON | O737: DICKESON | R737: McLAREN
A738: GOALKICKERS
A739: SANDRINGHAM | C739: HOGAN 3 | F739: B ZEUSCHNER 3 | J739: ADDSION 3 | M739: DIXON 3 | O739: MUTER 2 | Q739: WESTON 2 | T739: SELLECK | W739: SMITH
A740: PRAHRAN | C740: BARTLETT 5 | F740: WYND | H740: GLOVER
A742: COBURG | C742: 2 | D742: 1 | E742: =C742*6+D742 -> 13 | G742: 9 | H742: 4 | I742: =G742*6+H742 -> 58 | K742: 10 | L742: 4 | M742: =K742*6+L742 -> 64 | O742: 13 | P742: 9 | Q742: =O742*6+P742 -> 87 | S742: WILLIAMSTOWN
A743: WILLIAMSTOWN | C743: 1 | D743: 4 | E743: =C743*6+D743 -> 10 | G743: 1 | H743: 5 | I743: =G743*6+H743 -> 11 | K743: 7 | L743: 7 | M743: =K743*6+L743 -> 49 | O743: 9 | P743: 7 | Q743: =O743*6+P743 -> 61 | S743: CRAIG
A744: BEST PLAYERS
A745: COBURG | C745: PARDON | F745: HUGHES | I745: PALMER | L745: TANCREDI | O745: SULLIVAN | R745: VINCENT
A746: WILLIAMSTOWN | C746: BASTIAN | F746: O'TOOLE | I746: JOHNSON | L746: MURRIE | O746: FOWLER | R746: MADIGAN
A747: GOALKICKERS
A748: COBURG | C748: VINCENT 3 | F748: THOMPSON 3 | I748: McNABB 2 | L748: GOTCH 2 | N748: TASIC | P748: PARDON | R748: PALMER
A749: WILLIAMSTOWN | C749: SZYSKA 4 | F749: WARE 3 | I749: YOUNG | K749: COHEN
A751: WAVERLEY | C751: 0 | D751: 1 | E751: =C751*6+D751 -> 1 | G751: 3 | H751: 6 | I751: =G751*6+H751 -> 24 | K751: 6 | L751: 10 | M751: =K751*6+L751 -> 46 | O751: 8 | P751: 12 | Q751: =O751*6+P751 -> 60 | S751: DANDENONG
A752: DANDENONG | C752: 3 | D752: 2 | E752: =C752*6+D752 -> 20 | G752: 4 | H752: 2 | I752: =G752*6+H752 -> 26 | K752: 5 | L752: 6 | M752: =K752*6+L752 -> 36 | O752: 7 | P752: 11 | Q752: =O752*6+P752 -> 53 | S752: PIMBLETT
A753: BEST PLAYERS
A754: WAVERLEY | C754: McNAMEE | F754: LAWSON | I754: McKENZIE | L754: O'DONNELL | O754: REID
A755: DANDENONG | C755: OSBORNE | F755: HILL | I755: WHITEHEAD | L755: MITCHELL | O755: LIENERT | Q755: McDONALD
A756: GOALKICKERS
A757: WAVERLEY | C757: LAWSON 3 | F757: PARKER | H757: McKENZIE | J757: PROBYN | L757: BRENCHLEY | O757: O'DONNELL
A758: DANDENONG | C758: MORROW 2 | F758: MILLER 2 | I758: SMITH | K758: EVANS | M758: MITCHELL
A760: ROUND 17 | E760: 19TH AUGUST | J760: WEATHER | M760: RAIN TO 1/2 TIME | S760: PLAYED AT
D761: 1ST QTR | H761: 2ND QTR | L761: 3RD QTR | P761: FINAL | S761: WAVERLEY
A762: WAVERLEY | C762: 1 | D762: 4 | E762: =C762*6+D762 -> 10 | G762: 5 | H762: 10 | I762: =G762*6+H762 -> 40 | K762: 8 | L762: 10 | M762: =K762*6+L762 -> 58 | O762: 15 | P762: 15 | Q762: =O762*6+P762 -> 105 | S762: UMPIRE | X762: LADDER | AB762: ROUND | AD762: 17
A763: WILLIAMSTOWN | C763: 3 | D763: 0 | E763: =C763*6+D763 -> 18 | G763: 3 | H763: 4 | I763: =G763*6+H763 -> 22 | K763: 7 | L763: 4 | M763: =K763*6+L763 -> 46 | O763: 8 | P763: 4 | Q763: =O763*6+P763 -> 52 | S763: JACKSON
A764: BEST PLAYERS | W764: TEAM | X764: W | Y764: L | Z764: D | AA764: FOR | AB764: AGST | AC764: % | AD764: PTS
A765: WAVERLEY | C765: ROLFE | F765: O'DONNELL | I765: MASSEY | L765: LAWSON | O765: BRENCHLEY | R765: REEVES
A766: WILLIAMSTOWN | C766: O'MARA | F766: FOWLER | I766: JOHNSON | L766: RUSSELL | O766: NANKERVIS | R766: SZYSKA | W766: DANDENONG | X766: 13 | Y766: 4 | Z766: 0 | AA766: 1678 | AB766: 1411 | AC766: 118.92274982282069 | AD766: 52
A767: GOALKICKERS | W767: PORT MELBOURNE | X767: 12 | Y767: 5 | Z767: 0 | AA767: 1587 | AB767: 1369 | AC767: 115.92 | AD767: 48
A768: WAVERLEY | C768: ALLAN 3 | E768: BRENCHLEY 2 | H768: O'DONNELL 2 | K768: PETZKE 2 | M768: PARKER 2 | O768: POORE 2 | Q768: McQUEEN | S768: McKENZIE | W768: SANDRINGHAM | X768: 10 | Y768: 7 | Z768: 0 | AA768: 1459 | AB768: 1431 | AC768: 101.96 | AD768: 40
A769: WILLIAMSTOWN | C769: FOWLER 4 | F769: SZYSKA 2 | I769: NANKERVIS 2 | W769: PRESTON | X769: 9 | Y769: 8 | Z769: 0 | AA769: 1629 | AB769: 1557 | AC769: 104.62427745664741 | AD769: 36
E770: 20TH AUGUST | M770: WET
A771: PORT MELBOURNE | C771: 2 | D771: 3 | E771: =C771*6+D771 -> 15 | G771: 6 | H771: 4 | I771: =G771*6+H771 -> 40 | K771: 9 | L771: 10 | M771: =K771*6+L771 -> 64 | O771: 10 | P771: 16 | Q771: =O771*6+P771 -> 76 | S771: PORT MELBOURNE | W771: COBURG | X771: 9 | Y771: 8 | Z771: 0 | AA771: 1387 | AB771: 1388 | AC771: 99.927953890489917 | AD771: 36
A772: COBURG | C772: 2 | D772: 2 | E772: =C772*6+D772 -> 14 | G772: 6 | H772: 7 | I772: =G772*6+H772 -> 43 | K772: 7 | L772: 7 | M772: =K772*6+L772 -> 49 | O772: 7 | P772: 12 | Q772: =O772*6+P772 -> 54 | S772: O'NEILL | W772: YARRAVILLE | X772: 8 | Y772: 9 | Z772: 0 | AA772: 1575 | AB772: 1485 | AC772: 106.06 | AD772: 32
A773: BEST PLAYERS | W773: WAVERLEY | X773: 8 | Y773: 9 | Z773: 0 | AA773: 1300 | AB773: 1354 | AC773: 96.01 | AD773: 32
A774: PORT MELBOURNE | C774: SCHMIDT | F774: IRELAND | I774: RENOUF | L774: BEDFORD | O774: TAGGART | R774: TEAGUE | W774: BRUNSWICK | X774: 8 | Y774: 9 | Z774: 0 | AA774: 1423 | AB774: 1505 | AC774: 94.551495016611298 | AD774: 32
A775: COBURG | C775: WELSH | F775: OATEN | I775: TASIC | L775: McNABB | O775: HUGHES | R775: THOMPSON | W775: PRAHRAN | X775: 6 | Y775: 11 | Z775: 0 | AA775: 1296 | AB775: 1571 | AC775: 82.5 | AD775: 24
A776: GOALKICKERS | W776: WILLIAMSTOWN | X776: 2 | Y776: 15 | Z776: 0 | AA776: 1312 | AB776: 1575 | AC776: 83.301587301587304 | AD776: 8
A777: PORT MELBOURNE | C777: BEDFORD 2 | F777: ROWLANDS 2 | I777: HOWELL 2 | L777: TEAGUE 2 | N777: BROWNHILL | Q777: BOWEN
A778: COBURG | C778: McNABB 4 | F778: GOTCH | H778: THOMPSON | K778: PALMER
A780: SANDRINGHAM | C780: 1 | D780: 4 | E780: =C780*6+D780 -> 10 | G780: 6 | H780: 9 | I780: =G780*6+H780 -> 45 | K780: 7 | L780: 10 | M780: =K780*6+L780 -> 52 | O780: 9 | P780: 12 | Q780: =O780*6+P780 -> 66 | S780: YARRAVILLE
A781: YARRAVILLE | C781: 2 | D781: 4 | E781: =C781*6+D781 -> 16 | G781: 3 | H781: 5 | I781: =G781*6+H781 -> 23 | K781: 5 | L781: 13 | M781: =K781*6+L781 -> 43 | O781: 7 | P781: 15 | Q781: =O781*6+P781 -> 57 | S781: TOOHEY
A782: BEST PLAYERS
A783: SANDRINGHAM | C783: LADDS | F783: DIXON | I783: K WILLS | L783: VAUGHAN | O783: LOH | R783: HOGAN
A784: YARRAVILLE | C784: BARROW | F784: HENDERSON | I784: TAURENS | L784: ROCHFORD | O784: MADIGAN | R784: BONGETTI
A785: GOALKICKERS
A786: SANDRINGHAM | C786: MUTER 2 | F786: HOGAN 2 | I786: ADDISON 2 | L786: WESTON | N786: K WILLS | P786: DIXON
A787: YARRAVILLE | C787: MADIGAN 2 | F787: BONGETTI | I787: HENDERSON | L787: CONNELLY | N787: BEATTIE | P787: QUARANTOTTO
A789: DANDENONG | C789: 5 | D789: 5 | E789: =C789*6+D789 -> 35 | G789: 6 | H789: 10 | I789: =G789*6+H789 -> 46 | K789: 8 | L789: 11 | M789: =K789*6+L789 -> 59 | O789: 13 | P789: 17 | Q789: =O789*6+P789 -> 95 | S789: BRUNSWICK
A790: BRUNSWICK | C790: 3 | D790: 0 | E790: =C790*6+D790 -> 18 | G790: 5 | H790: 4 | I790: =G790*6+H790 -> 34 | K790: 10 | L790: 11 | M790: =K790*6+L790 -> 71 | O790: 12 | P790: 12 | Q790: =O790*6+P790 -> 84 | S790: DIXON
A791: BEST PLAYERS
A792: DANDENONG | C792: MELAI | F792: MITCHELL | I792: HILL | L792: LIENERT | O792: McDONALD | R792: ANDREWS
A793: BRUNSWICK | C793: WILSON | F793: ROGERS | I793: PENDLEBURY | L793: WHILEY | O793: LIMBOM | R793: WROUT
A794: GOALKICKERS
A795: DANDENONG | C795: JEFFRIES 3 | F795: MITCHELL 3 | I795: SMITH 2 | K795: HILL 2 | M795: TOWNSEND | P795: MELAI | R795: BARRAN
A796: BRUNSWICK | C796: PENDLEBURY 5 | F796: BURNS 2 | I796: ROBINSON | L796: BIBBY | N796: HAGART | P796: McKINNON | R796: WHILEY
A798: PRESTON | C798: 5 | D798: 2 | E798: =C798*6+D798 -> 32 | G798: 8 | H798: 10 | I798: =G798*6+H798 -> 58 | K798: 16 | L798: 15 | M798: =K798*6+L798 -> 111 | O798: 21 | P798: 18 | Q798: =O798*6+P798 -> 144 | S798: PRESTON
A799: PRAHRAN | C799: 3 | D799: 3 | E799: =C799*6+D799 -> 21 | G799: 4 | H799: 4 | I799: =G799*6+H799 -> 28 | K799: 6 | L799: 7 | M799: =K799*6+L799 -> 43 | O799: 9 | P799: 10 | Q799: =O799*6+P799 -> 64 | S799: CHAPLIN
A800: BEST PLAYERS
A801: PRESTON | C801: HYDE | F801: LEMPRIERE | I801: DALTON | L801: HINDMARSH | P801: McLEAN | R801: WALKER
A802: PRAHRAN | C802: McMAHON | F802: BARTLETT | I802: MINTON-CONNELL | M802: WALLIKER | P802: CULPIN | R802: DICKESON
A803: GOALKICKERS
A804: PRESTON | C804: WALKER 9 | F804: DALTON 3 | I804: HINDMARSH 3 | L804: LEMPRIERE 2 | O804: CHAPMAN 2 | R804: WESTON | U804: A PERRY
A805: PRAHRAN | C805: BARTLETT 5 | F805: RYAN | H805: BUTLER | J805: VERWOERT | M805: PEARSON
A807: ROUND 18 | E807: 26TH AUGUST | J807: WEATHER | M807: STRONG N.W.WIND | S807: PLAYED AT
D808: 1ST QTR | H808: 2ND QTR | L808: 3RD QTR | P808: FINAL | S808: COBURG
A809: WAVERLEY | C809: 5 | D809: 5 | E809: =C809*6+D809 -> 35 | G809: 5 | H809: 5 | I809: =G809*6+H809 -> 35 | K809: 9 | L809: 12 | M809: =K809*6+L809 -> 66 | O809: 12 | P809: 16 | Q809: =O809*6+P809 -> 88 | S809: UMPIRE | X809: LADDER | AB809: ROUND | AD809: 18
A810: COBURG | C810: 1 | D810: 1 | E810: =C810*6+D810 -> 7 | G810: 5 | H810: 7 | I810: =G810*6+H810 -> 37 | K810: 5 | L810: 9 | M810: =K810*6+L810 -> 39 | O810: 7 | P810: 9 | Q810: =O810*6+P810 -> 51 | S810: PIMBLETT
A811: BEST PLAYERS | W811: TEAM | X811: W | Y811: L | Z811: D | AA811: FOR | AB811: AGST | AC811: % | AD811: PTS
A812: WAVERLEY | C812: G PARKER | F812: LAWSON | I812: CARROLL | L812: NATION | O812: POORE | Q812: ALLAN
A813: COBURG | C813: WELSH | F813: TASIC | I813: SULLIVAN | L813: TANCREDI | O813: DUNNE | Q813: GONINAN | W813: DANDENONG | X813: 14 | Y813: 4 | Z813: 0 | AA813: 1743 | AB813: 1464 | AC813: 119.05737704918033 | AD813: 56
A814: GOALKICKERS | Q814: O'DONNELL | W814: PORT MELBOURNE | X814: 13 | Y814: 5 | Z814: 0 | AA814: 1671 | AB814: 1408 | AC814: 118.68 | AD814: 52
A815: WAVERLEY | C815: LAWSON 4 | F815: BRENCHLEY | I815: McNAMEE | K815: POORE | M815: DOYLE | O815: NATION | Q815: G PARKER | S815: ALLAN | W815: SANDRINGHAM | X815: 11 | Y815: 7 | Z815: 0 | AA815: 1557 | AB815: 1496 | AC815: 104.08 | AD815: 44
A816: COBURG | C816: SULLIVAN 2 | F816: TASIC | H816: GONINAN | J816: PALMER | L816: McLACHLAN | O816: VINCENT | W816: PRESTON | X816: 10 | Y816: 8 | Z816: 0 | AA816: 1700 | AB816: 1625 | AC816: 104.61538461538461 | AD816: 40
E817: 27TH AUGUST | J817: WEATHER | M817: RAIN
A818: DANDENONG | C818: 4 | D818: 3 | E818: =C818*6+D818 -> 27 | G818: 8 | H818: 6 | I818: =G818*6+H818 -> 54 | K818: 8 | L818: 11 | M818: =K818*6+L818 -> 59 | O818: 9 | P818: 11 | Q818: =O818*6+P818 -> 65 | S818: DANDENONG | W818: WAVERLEY | X818: 9 | Y818: 9 | Z818: 0 | AA818: 1388 | AB818: 1405 | AC818: 98.79 | AD818: 36
A819: YARRAVILLE | C819: 3 | D819: 2 | E819: =C819*6+D819 -> 20 | G819: 6 | H819: 7 | I819: =G819*6+H819 -> 43 | K819: 6 | L819: 7 | M819: =K819*6+L819 -> 43 | O819: 7 | P819: 11 | Q819: =O819*6+P819 -> 53 | S819: JACKSON | W819: COBURG | X819: 9 | Y819: 9 | Z819: 0 | AA819: 1438 | AB819: 1476 | AC819: 97.425474254742554 | AD819: 36
A820: BEST PLAYERS | W820: YARRAVILLE | X820: 8 | Y820: 10 | Z820: 0 | AA820: 1628 | AB820: 1550 | AC820: 105.03 | AD820: 32
A821: DANDENONG | C821: LIENERT | F821: STEDWELL | I821: BARRAN | L821: EVANS | O821: WHITEHEAD | R821: HILL | W821: BRUNSWICK | X821: 8 | Y821: 10 | Z821: 0 | AA821: 1488 | AB821: 1603 | AC821: 92.825951341235182 | AD821: 32
A822: YARRAVILLE | C822: CHARLES | F822: BARROW | I822: CONNELLY | L822: HENDERSON | O822: FOGARTY | R822: BONGETTI | W822: PRAHRAN | X822: 6 | Y822: 12 | Z822: 0 | AA822: 1335 | AB822: 1655 | AC822: 80.66 | AD822: 24
A823: GOALKICKERS | W823: WILLIAMSTOWN | X823: 2 | Y823: 16 | Z823: 0 | AA823: 1380 | AB823: 1646 | AC823: 83.839611178614817 | AD823: 8
A824: DANDENONG | C824: MILLER 3 | F824: MORROW 3 | I824: EVANS | K824: MITCHELL | N824: MELAI
A825: YARRAVILLE | C825: CASTIKUM 3 | F825: WARWICK 2 | I825: MATHESON | L825: QUARANTOTTO
A827: SANDRINGHAM | C827: 4 | D827: 4 | E827: =C827*6+D827 -> 28 | G827: 6 | H827: 9 | I827: =G827*6+H827 -> 45 | K827: 9 | L827: 18 | M827: =K827*6+L827 -> 72 | O827: 13 | P827: 20 | Q827: =O827*6+P827 -> 98 | S827: BEACH ROAD
A828: BRUNSWICK | C828: 1 | D828: 1 | E828: =C828*6+D828 -> 7 | G828: 5 | H828: 3 | I828: =G828*6+H828 -> 33 | K828: 8 | L828: 3 | M828: =K828*6+L828 -> 51 | O828: 10 | P828: 5 | Q828: =O828*6+P828 -> 65 | S828: GARLICK
A829: BEST PLAYERS
A830: SANDRINGHAM | C830: CLIFFORD | F830: DIXON | I830: M ZEUSCHNER | L830: K WILLS | O830: SELLECK | R830: WESTON
A831: BRUNSWICK | C831: McKINNON | F831: BURNS | I831: LIMBOM | L831: ROGERS | O831: McKINLEY | R831: ROBINSON
A832: GOALKICKERS
A833: SANDRINGHAM | C833: WESTON 4 | F833: DIXON 2 | I833: HANCE 2 | K833: HOGAN | M833: D WILLS | O833: K WILLS
A834: BRUNSWICK | C834: McKINNON 3 | F834: PENDLEBURY 2 | J834: ROBINSON 2 | M834: BIBBY | O834: BURNS | Q834: WROUT
A836: PRESTON | C836: 1 | D836: 2 | E836: =C836*6+D836 -> 8 | G836: 6 | H836: 8 | I836: =G836*6+H836 -> 44 | K836: 6 | L836: 8 | M836: =K836*6+L836 -> 44 | O836: 9 | P836: 17 | Q836: =O836*6+P836 -> 71 | S836: WILLIAMSTOWN
A837: WILLIAMSTOWN | C837: 5 | D837: 6 | E837: =C837*6+D837 -> 36 | G837: 6 | H837: 6 | I837: =G837*6+H837 -> 42 | K837: 10 | L837: 8 | M837: =K837*6+L837 -> 68 | O837: 10 | P837: 8 | Q837: =O837*6+P837 -> 68 | S837: O'NEILL
A838: BEST PLAYERS
A839: PRESTON | C839: HYDE | F839: DALTON | I839: SCHICKERT | L839: McLEAN | O839: PAUL | R839: G PERRY
A840: WILLIAMSTOWN | C840: O'MARA | F840: BARNES | I840: FOWLER | L840: COHEN | O840: MURRIE
A841: GOALKICKERS
A842: PRESTON | C842: WALKER 3 | F842: MURNANE | I842: DALTON | K842: HINDMARSH | N842: CHAPMAN | Q842: A PERRY | S842: G PERRY
A843: WILLIAMSTOWN | C843: BARNES 4 | F843: FOWLER 2 | I843: YOUNG | K843: O'TOOLE | M843: NANKERVIS | P843: SYZSKA
A845: PORT MELBOURNE | C845: 4 | D845: 5 | E845: =C845*6+D845 -> 29 | G845: 8 | H845: 7 | I845: =G845*6+H845 -> 55 | K845: 11 | L845: 11 | M845: =K845*6+L845 -> 77 | O845: 12 | P845: 12 | Q845: =O845*6+P845 -> 84 | S845: TOORAK PARK
A846: PRAHRAN | C846: 2 | D846: 4 | E846: =C846*6+D846 -> 16 | G846: 4 | H846: 7 | I846: =G846*6+H846 -> 31 | K846: 4 | L846: 8 | M846: =K846*6+L846 -> 32 | O846: 4 | P846: 15 | Q846: =O846*6+P846 -> 39 | S846: DIXON
A847: BEST PLAYERS
A848: PORT MELBOURNE | C848: RENOUF | F848: BEDFORD | I848: CAULFIELD | L848: BONNETT | O848: TEAGUE | R848: GRIFFITHS
A849: PRAHRAN | C849: McLAREN | F849: BUTLER | I849: DICKESON | L849: CULPIN | O849: HARTNETT | R849: McMAHON
A850: GOALKICKERS
A851: PORT MELBOURNE | C851: BEDFORD 4 | F851: TEAGUE 3 | I851: ROWLANDS 2 | L851: HOWELL | N851: KERR | P851: BROWNHILL
A852: PRAHRAN | C852: BARTLETT 2 | F852: BUTLER | I852: VERWOERT
A854: FINALS
A855: 1ST SEMI | D855: 3RD SEPTEMBER | J855: WEATHER | N855: FINE
D856: 1ST QTR | H856: 2ND QTR | L856: 3RD QTR | P856: FINAL
A857: SANDRINGHAM | C857: 5 | D857: 4 | E857: =C857*6+D857 -> 34 | G857: 9 | H857: 8 | I857: =G857*6+H857 -> 62 | K857: 10 | L857: 12 | M857: =K857*6+L857 -> 72 | O857: 14 | P857: 16 | Q857: =O857*6+P857 -> 100 | S857: PUNT ROAD
A858: PRESTON | C858: 2 | D858: 3 | E858: =C858*6+D858 -> 15 | G858: 7 | H858: 7 | I858: =G858*6+H858 -> 49 | K858: 11 | L858: 10 | M858: =K858*6+L858 -> 76 | O858: 13 | P858: 12 | Q858: =O858*6+P858 -> 90 | S858: JACKSON
A859: BEST PLAYERS
A860: SANDRINGHAM | C860: HOGAN | F860: M ZEUSCHNER | I860: LOH | K860: SELLECK | N860: DIXON | Q860: EASTOE
A861: PRESTON | C861: LEMPRIERE | F861: WESTON | I861: HANVIN | K861: DALTON | N861: HYDE | Q861: MURNANE
A862: GOALKICKERS
A863: SANDRINGHAM | C863: HOGAN 5 | F863: K WILLS 2 | I863: M ZEUSCHNER 2 | M863: WESTON | O863: SELLECK | Q863: EASTOE | S863: HARRISON | V863: DIXON
A864: PRESTON | C864: WESTON 4 | F864: WALKER 3 | I864: LEMPRIERE 2 | L864: HINDMARSH 2 | O864: JOYCE | Q864: MOUNTNEY
A866: 2ND SEMI | E866: 10TH SEPTEMBER | J866: WEATHER | N866: FINE
A867: PORT MELBOURNE | C867: 1 | D867: 2 | E867: =C867*6+D867 -> 8 | G867: 7 | H867: 6 | I867: =G867*6+H867 -> 48 | K867: 10 | L867: 8 | M867: =K867*6+L867 -> 68 | O867: 14 | P867: 17 | Q867: =O867*6+P867 -> 101 | S867: PUNT ROAD
A868: DANDENONG | C868: 4 | D868: 0 | E868: =C868*6+D868 -> 24 | G868: 5 | H868: 0 | I868: =G868*6+H868 -> 30 | K868: 6 | L868: 10 | M868: =K868*6+L868 -> 46 | O868: 9 | P868: 11 | Q868: =O868*6+P868 -> 65 | S868: O'NEILL
A869: BEST PLAYERS
A870: PORT MELBOURNE | C870: TEAGUE | F870: PECK | I870: BEDFORD | K870: GROVER | N870: HOWELL | Q870: GRIFFITHS
A871: DANDENONG | C871: HILL | F871: STEDWELL | I871: OSBORNE | K871: MITCHELL | N871: MORROW | Q871: WHITEHEAD
A872: GOALKICKERS
A873: PORT MELBOURNE | C873: HOWELL 4 | F873: PECK 3 | H873: TEAGUE 2 | J873: TAGGART | L873: M ALLEN | N873: BEDFORD | P873: ROWLANDS | S873: BRICE
A874: DANDENONG | C874: MILLER 3 | F874: MITCHELL 2 | I874: HILL 2 | K874: MORROW | M874: SMITH
A876: PRELIMINARY FINAL | F876: 17TH SEPTEMBER | K876: WEATHER | O876: FINE
A877: DANDENONG | C877: 2 | D877: 3 | E877: =C877*6+D877 -> 15 | G877: 6 | H877: 5 | I877: =G877*6+H877 -> 41 | K877: 11 | L877: 9 | M877: =K877*6+L877 -> 75 | O877: 15 | P877: 10 | Q877: =O877*6+P877 -> 100 | S877: PUNT ROAD
A878: SANDRINGHAM | C878: 2 | D878: 2 | E878: =C878*6+D878 -> 14 | G878: 6 | H878: 7 | I878: =G878*6+H878 -> 43 | K878: 7 | L878: 10 | M878: =K878*6+L878 -> 52 | O878: 11 | P878: 15 | Q878: =O878*6+P878 -> 81 | S878: TOOHEY
A879: BEST PLAYERS
A880: DANDENONG | C880: SMITH | F880: HILL | I880: STEDWELL | L880: OSBORNE | O880: MITCHELL | R880: WHITEHEAD
A881: SANDRINGHAM | C881: LOH | F881: MACKENZIE | I881: HANCE | L881: WARD | O881: SELLECK | R881: HOGAN
A882: GOALKICKERS
A883: DANDENONG | C883: MILLER 4 | F883: SHEEHAN 3 | I883: HILL 2 | K883: MELAI 2 | M883: McDONALD | P883: OSBORNE | R883: SMITH | T883: MORROW
A884: SANDRINGHAM | C884: HOGAN 4 | F884: B ZEUSCHNER 2 | J884: HANCE | L884: FENTON | N884: K WILLS | P884: DIXON | R884: D WILLS
A886: GRAND FINAL | E886: 24TH SEPTEMBER | J886: WEATHER | N886: FINE
A887: DANDENONG | C887: 4 | D887: 5 | E887: 29 | G887: 8 | H887: 5 | I887: 53 | K887: 11 | L887: 9 | M887: 75 | O887: 16 | P887: 13 | Q887: =O887*6+P887 -> 109 | S887: PUNT ROAD
A888: PORT MELBOURNE | C888: 3 | D888: 1 | E888: 19 | G888: 7 | H888: 5 | I888: 47 | K888: 10 | L888: 11 | M888: 71 | O888: 12 | P888: 12 | Q888: =O888*6+P888 -> 84 | S888: JACKSON
A889: BEST PLAYERS
A890: DANDENONG | C890: MITCHELL | F890: EVANS | I890: McNAMARA | L890: MILLER | O890: MORROW | R890: MELAI
A891: PORT MELBOURNE | C891: IRELAND | F891: GRIFFITHS | I891: TEAGUE | L891: RENOUF | O891: PECK | R891: BUCKLEY
A892: GOALKICKERS
A893: DANDENONG | C893: MORROW 4 | F893: MELAI 3 | I893: MILLER 2 | L893: McDONALD 2 | O893: HILL 2 | Q893: MITCHELL | T893: TOWNSEND | W893: SMITH
A894: PORT MELBOURNE | C894: TEAGUE 4 | F894: PECK 3 | I894: BEDFORD 2 | L894: IRELAND | O894: HOWELL | Q894: BROWNHILL