A1: Victorian Football Association
A2: Season 1967 - Division Two
A3: © Copyright Wal Williams | F3: First created: 28 March 2016
A4: Contact: joywalwi at gmail dot com | F4: Last updated: 28 March 2016 | W4: VFA Results and tables - Link to the main index page
A5: You are free to copy this document in whole or part provided that proper acknowledgement is given to the author. All rights reserved.
A7: 1967 | C7: V.F.A. SEASON 2ND DIVISION
A8: ROUND 1 | E8: 15TH APRIL | J8: WEATHER | S8: PLAYED AT
D9: 1ST QTR | H9: 2ND QTR | L9: 3RD QTR | P9: FINAL | S9: SUNSHINE
A10: SUNSHINE | C10: 0 | D10: 0 | E10: =C10*6+D10 -> 0 | G10: 0 | H10: 0 | I10: =G10*6+H10 -> 0 | K10: 0 | L10: 0 | M10: =K10*6+L10 -> 0 | O10: 13 | P10: 10 | Q10: =O10*6+P10 -> 88 | S10: UMPIRE | X10: LADDER | AB10: ROUND | AD10: 1
A11: WERRIBEE | C11: 0 | D11: 0 | E11: =C11*6+D11 -> 0 | G11: 0 | H11: 0 | I11: =G11*6+H11 -> 0 | K11: 0 | L11: 0 | M11: =K11*6+L11 -> 0 | O11: 9 | P11: 9 | Q11: =O11*6+P11 -> 63
A12: BEST PLAYERS | W12: TEAM | X12: W | Y12: L | Z12: D | AA12: FOR | AB12: AGST | AC12: % | AD12: PTS
A13: SUNSHINE
A14: WERRIBEE | W14: NORTHCOTE | X14: 1 | Y14: 0 | Z14: 0 | AA14: 139 | AB14: 38 | AC14: =(AA14*100)/AB14 -> 365.78947368421052 | AD14: =(X14*4)+(Z14*2) -> 4
A15: GOALKICKERS | W15: GEELONG WEST | X15: 1 | Y15: 0 | Z15: 0 | AA15: 116 | AB15: 67 | AC15: =(AA15*100)/AB15 -> 173.13432835820896 | AD15: =(X15*4)+(Z15*2) -> 4
A16: SUNSHINE | W16: OAKLEIGH | X16: 1 | Y16: 0 | Z16: 0 | AA16: 105 | AB16: 75 | AC16: =(AA16*100)/AB16 -> 140 | AD16: =(X16*4)+(Z16*2) -> 4
A17: WERRIBEE | W17: SUNSHINE | X17: 1 | Y17: 0 | Z17: 0 | AA17: 88 | AB17: 63 | AC17: =(AA17*100)/AB17 -> 139.68253968253967 | AD17: =(X17*4)+(Z17*2) -> 4
A19: OAKLEIGH | C19: 0 | D19: 0 | E19: =C19*6+D19 -> 0 | G19: 0 | H19: 0 | I19: =G19*6+H19 -> 0 | K19: 0 | L19: 0 | M19: =K19*6+L19 -> 0 | O19: 16 | P19: 9 | Q19: =O19*6+P19 -> 105 | S19: MORDIALLOC | W19: BOX HILL | X19: 1 | Y19: 0 | Z19: 0 | AA19: 111 | AB19: 109 | AC19: =(AA19*100)/AB19 -> 101.8348623853211 | AD19: =(X19*4)+(Z19*2) -> 4
A20: MORDIALLOC | C20: 0 | D20: 0 | E20: =C20*6+D20 -> 0 | G20: 0 | H20: 0 | I20: =G20*6+H20 -> 0 | K20: 0 | L20: 0 | M20: =K20*6+L20 -> 0 | O20: 11 | P20: 9 | Q20: =O20*6+P20 -> 75 | W20: CAMBERWELL | X20: 0 | Y20: 1 | Z20: 0 | AA20: 109 | AB20: 111 | AC20: =(AA20*100)/AB20 -> 98.198198198198199 | AD20: =(X20*4)+(Z20*2) -> 0
A21: BEST PLAYERS | W21: WERRIBEE | X21: 0 | Y21: 1 | Z21: 0 | AA21: 63 | AB21: 88 | AC21: =(AA21*100)/AB21 -> 71.590909090909093 | AD21: =(X21*4)+(Z21*2) -> 0
A22: OAKLEIGH | W22: MORDIALLOC | X22: 0 | Y22: 1 | Z22: 0 | AA22: 75 | AB22: 105 | AC22: =(AA22*100)/AB22 -> 71.428571428571431 | AD22: =(X22*4)+(Z22*2) -> 0
A23: MORDIALLOC | W23: FRANKSTON | X23: 0 | Y23: 1 | Z23: 0 | AA23: 67 | AB23: 116 | AC23: =(AA23*100)/AB23 -> 57.758620689655174 | AD23: =(X23*4)+(Z23*2) -> 0
A24: GOALKICKERS | W24: CAULFIELD | X24: 0 | Y24: 1 | Z24: 0 | AA24: 38 | AB24: 139 | AC24: =(AA24*100)/AB24 -> 27.338129496402878 | AD24: =(X24*4)+(Z24*2) -> 0
A25: OAKLEIGH
A26: MORDIALLOC
A28: BOX HILL | C28: 0 | D28: 0 | E28: =C28*6+D28 -> 0 | G28: 0 | H28: 0 | I28: =G28*6+H28 -> 0 | K28: 0 | L28: 0 | M28: =K28*6+L28 -> 0 | O28: 16 | P28: 15 | Q28: =O28*6+P28 -> 111 | S28: CAMBERWELL
A29: CAMBERWELL | C29: 0 | D29: 0 | E29: =C29*6+D29 -> 0 | G29: 0 | H29: 0 | I29: =G29*6+H29 -> 0 | K29: 0 | L29: 0 | M29: =K29*6+L29 -> 0 | O29: 17 | P29: 7 | Q29: =O29*6+P29 -> 109
A30: BEST PLAYERS
A31: BOX HILL
A32: CAMBERWELL
A33: GOALKICKERS
A34: BOX HILL
A35: CAMBERWELL
A37: GEELONG WEST | C37: 0 | D37: 0 | E37: =C37*6+D37 -> 0 | G37: 0 | H37: 0 | I37: =G37*6+H37 -> 0 | K37: 0 | L37: 0 | M37: =K37*6+L37 -> 0 | O37: 17 | P37: 14 | Q37: =O37*6+P37 -> 116 | S37: GEELONG WEST
A38: FRANKSTON | C38: 0 | D38: 0 | E38: =C38*6+D38 -> 0 | G38: 0 | H38: 0 | I38: =G38*6+H38 -> 0 | K38: 0 | L38: 0 | M38: =K38*6+L38 -> 0 | O38: 9 | P38: 13 | Q38: =O38*6+P38 -> 67
A39: BEST PLAYERS
A40: GEELONG WEST
A41: FRANKSTON
A42: GOALKICKERS
A43: GEELONG WEST
A44: FRANKSTON
A46: NORTHCOTE | C46: 0 | D46: 0 | E46: =C46*6+D46 -> 0 | G46: 0 | H46: 0 | I46: =G46*6+H46 -> 0 | K46: 0 | L46: 0 | M46: =K46*6+L46 -> 0 | O46: 20 | P46: 19 | Q46: =O46*6+P46 -> 139 | S46: NORTHCOTE
A47: CAULFIELD | C47: 0 | D47: 0 | E47: =C47*6+D47 -> 0 | G47: 0 | H47: 0 | I47: =G47*6+H47 -> 0 | K47: 0 | L47: 0 | M47: =K47*6+L47 -> 0 | O47: 5 | P47: 8 | Q47: =O47*6+P47 -> 38
A48: BEST PLAYERS
A49: NORTHCOTE
A50: CAULFIELD
A51: GOALKICKERS
A52: NORTHCOTE
A53: CAULFIELD
A55: ROUND 2 | E55: 22ND APRIL | J55: WEATHER | S55: PLAYED AT
D56: 1ST QTR | H56: 2ND QTR | L56: 3RD QTR | P56: FINAL | S56: PRINCES PARK, CAULFIELD
A57: GEELONG WEST | C57: 0 | D57: 0 | E57: =C57*6+D57 -> 0 | G57: 0 | H57: 0 | I57: =G57*6+H57 -> 0 | K57: 0 | L57: 0 | M57: =K57*6+L57 -> 0 | O57: 13 | P57: 20 | Q57: =O57*6+P57 -> 98 | S57: UMPIRE | X57: LADDER | AB57: ROUND | AD57: 2
A58: CAULFIELD | C58: 0 | D58: 0 | E58: =C58*6+D58 -> 0 | G58: 0 | H58: 0 | I58: =G58*6+H58 -> 0 | K58: 0 | L58: 0 | M58: =K58*6+L58 -> 0 | O58: 9 | P58: 12 | Q58: =O58*6+P58 -> 66
A59: BEST PLAYERS | W59: TEAM | X59: W | Y59: L | Z59: D | AA59: FOR | AB59: AGST | AC59: % | AD59: PTS
A60: GEELONG WEST
A61: CAULFIELD | W61: GEELONG WEST | X61: 2 | Y61: 0 | Z61: 0 | AA61: 214 | AB61: 133 | AC61: =(AA61*100)/AB61 -> 160.90225563909775 | AD61: =(X61*4)+(Z61*2) -> 8
A62: GOALKICKERS | W62: OAKLEIGH | X62: 2 | Y62: 0 | Z62: 0 | AA62: 195 | AB62: 164 | AC62: =(AA62*100)/AB62 -> 118.90243902439025 | AD62: =(X62*4)+(Z62*2) -> 8
A63: GEELONG WEST | W63: NORTHCOTE | X63: 1 | Y63: 1 | Z63: 0 | AA63: 228 | AB63: 146 | AC63: =(AA63*100)/AB63 -> 156.16438356164383 | AD63: =(X63*4)+(Z63*2) -> 4
A64: CAULFIELD | W64: SUNSHINE | X64: 1 | Y64: 1 | Z64: 0 | AA64: 177 | AB64: 153 | AC64: =(AA64*100)/AB64 -> 115.68627450980392 | AD64: =(X64*4)+(Z64*2) -> 4
A66: FRANKSTON | C66: 0 | D66: 0 | E66: =C66*6+D66 -> 0 | G66: 0 | H66: 0 | I66: =G66*6+H66 -> 0 | K66: 0 | L66: 0 | M66: =K66*6+L66 -> 0 | O66: 16 | P66: 29 | Q66: =O66*6+P66 -> 125 | S66: FRANKSTON | W66: FRANKSTON | X66: 1 | Y66: 1 | Z66: 0 | AA66: 192 | AB66: 186 | AC66: =(AA66*100)/AB66 -> 103.2258064516129 | AD66: =(X66*4)+(Z66*2) -> 4
A67: CAMBERWELL | C67: 0 | D67: 0 | E67: =C67*6+D67 -> 0 | G67: 0 | H67: 0 | I67: =G67*6+H67 -> 0 | K67: 0 | L67: 0 | M67: =K67*6+L67 -> 0 | O67: 11 | P67: 4 | Q67: =O67*6+P67 -> 70 | W67: BOX HILL | X67: 1 | Y67: 1 | Z67: 0 | AA67: 240 | AB67: 242 | AC67: =(AA67*100)/AB67 -> 99.173553719008268 | AD67: =(X67*4)+(Z67*2) -> 4
A68: BEST PLAYERS | W68: WERRIBEE | X68: 1 | Y68: 1 | Z68: 0 | AA68: 171 | AB68: 177 | AC68: =(AA68*100)/AB68 -> 96.610169491525426 | AD68: =(X68*4)+(Z68*2) -> 4
A69: FRANKSTON | W69: MORDIALLOC | X69: 1 | Y69: 1 | Z69: 0 | AA69: 208 | AB69: 234 | AC69: =(AA69*100)/AB69 -> 88.888888888888886 | AD69: =(X69*4)+(Z69*2) -> 4
A70: CAMBERWELL | W70: CAMBERWELL | X70: 0 | Y70: 2 | Z70: 0 | AA70: 179 | AB70: 236 | AC70: =(AA70*100)/AB70 -> 75.847457627118644 | AD70: =(X70*4)+(Z70*2) -> 0
A71: GOALKICKERS | W71: CAULFIELD | X71: 0 | Y71: 2 | Z71: 0 | AA71: 104 | AB71: 237 | AC71: =(AA71*100)/AB71 -> 43.881856540084385 | AD71: =(X71*4)+(Z71*2) -> 0
A72: FRANKSTON
A73: CAMBERWELL
A75: MORDIALLOC | C75: 0 | D75: 0 | E75: =C75*6+D75 -> 0 | G75: 0 | H75: 0 | I75: =G75*6+H75 -> 0 | K75: 0 | L75: 0 | M75: =K75*6+L75 -> 0 | O75: 20 | P75: 13 | Q75: =O75*6+P75 -> 133 | S75: BOX HILL
A76: BOX HILL | C76: 0 | D76: 0 | E76: =C76*6+D76 -> 0 | G76: 0 | H76: 0 | I76: =G76*6+H76 -> 0 | K76: 0 | L76: 0 | M76: =K76*6+L76 -> 0 | O76: 20 | P76: 9 | Q76: =O76*6+P76 -> 129
A77: BEST PLAYERS
A78: MORDIALLOC
A79: BOX HILL
A80: GOALKICKERS
A81: MORDIALLOC
A82: BOX HILL
A84: OAKLEIGH | C84: 0 | D84: 0 | E84: =C84*6+D84 -> 0 | G84: 0 | H84: 0 | I84: =G84*6+H84 -> 0 | K84: 0 | L84: 0 | M84: =K84*6+L84 -> 0 | O84: 13 | P84: 12 | Q84: =O84*6+P84 -> 90 | S84: OAKLEIGH
A85: SUNSHINE | C85: 0 | D85: 0 | E85: =C85*6+D85 -> 0 | G85: 0 | H85: 0 | I85: =G85*6+H85 -> 0 | K85: 0 | L85: 0 | M85: =K85*6+L85 -> 0 | O85: 13 | P85: 11 | Q85: =O85*6+P85 -> 89
A86: BEST PLAYERS
A87: OAKLEIGH
A88: SUNSHINE
A89: GOALKICKERS
A90: OAKLEIGH
A91: SUNSHINE
A93: WERRIBEE | C93: 0 | D93: 0 | E93: =C93*6+D93 -> 0 | G93: 0 | H93: 0 | I93: =G93*6+H93 -> 0 | K93: 0 | L93: 0 | M93: =K93*6+L93 -> 0 | O93: 16 | P93: 12 | Q93: =O93*6+P93 -> 108 | S93: WERRIBEE
A94: NORTHCOTE | C94: 0 | D94: 0 | E94: =C94*6+D94 -> 0 | G94: 0 | H94: 0 | I94: =G94*6+H94 -> 0 | K94: 0 | L94: 0 | M94: =K94*6+L94 -> 0 | O94: 13 | P94: 11 | Q94: =O94*6+P94 -> 89
A95: BEST PLAYERS
A96: WERRIBEE
A97: NORTHCOTE
A98: GOALKICKERS
A99: WERRIBEE
A100: NORTHCOTE
A102: ROUND 3 | E102: 29TH APRIL | J102: WEATHER | S102: PLAYED AT
D103: 1ST QTR | H103: 2ND QTR | L103: 3RD QTR | P103: FINAL | S103: SUNSHINE
A104: SUNSHINE | C104: 3 | D104: 1 | E104: =C104*6+D104 -> 19 | G104: 7 | H104: 3 | I104: =G104*6+H104 -> 45 | K104: 7 | L104: 7 | M104: =K104*6+L104 -> 49 | O104: 9 | P104: 10 | Q104: =O104*6+P104 -> 64 | S104: UMPIRE | X104: LADDER | AB104: ROUND | AD104: 3
A105: BOX HILL | C105: 2 | D105: 5 | E105: =C105*6+D105 -> 17 | G105: 2 | H105: 5 | I105: =G105*6+H105 -> 17 | K105: 6 | L105: 8 | M105: =K105*6+L105 -> 44 | O105: 6 | P105: 11 | Q105: =O105*6+P105 -> 47
A106: BEST PLAYERS | W106: TEAM | X106: W | Y106: L | Z106: D | AA106: FOR | AB106: AGST | AC106: % | AD106: PTS
A107: SUNSHINE | C107: TREZISE | F107: CROSBIE | I107: HARRIS | L107: POWER
A108: BOX HILL | C108: WHITE | F108: I BATES | I108: C FELLOWS | L108: GRAY | W108: GEELONG WEST | X108: 3 | Y108: 0 | Z108: 0 | AA108: 350 | AB108: 207 | AC108: =(AA108*100)/AB108 -> 169.08212560386474 | AD108: =(X108*4)+(Z108*2) -> 12
A109: GOALKICKERS | W109: OAKLEIGH | X109: 3 | Y109: 0 | Z109: 0 | AA109: 283 | AB109: 229 | AC109: =(AA109*100)/AB109 -> 123.58078602620087 | AD109: =(X109*4)+(Z109*2) -> 12
A110: SUNSHINE | C110: HARRIS 5 | F110: POWER 2 | I110: YOUNG | K110: BANT | W110: SUNSHINE | X110: 2 | Y110: 1 | Z110: 0 | AA110: 241 | AB110: 200 | AC110: =(AA110*100)/AB110 -> 120.5 | AD110: =(X110*4)+(Z110*2) -> 8
A111: BOX HILL | C111: C FELLOWS 3 | F111: HUNT | H111: BAKER | J111: GRAY | W111: FRANKSTON | X111: 2 | Y111: 1 | Z111: 0 | AA111: 306 | AB111: 284 | AC111: =(AA111*100)/AB111 -> 107.74647887323944 | AD111: =(X111*4)+(Z111*2) -> 8
A113: FRANKSTON | C113: 8 | D113: 4 | E113: =C113*6+D113 -> 52 | G113: 9 | H113: 4 | I113: =G113*6+H113 -> 58 | K113: 14 | L113: 10 | M113: =K113*6+L113 -> 94 | O113: 17 | P113: 12 | Q113: =O113*6+P113 -> 114 | S113: MORDIALLOC | W113: NORTHCOTE | X113: 1 | Y113: 2 | Z113: 0 | AA113: 302 | AB113: 282 | AC113: =(AA113*100)/AB113 -> 107.09219858156028 | AD113: =(X113*4)+(Z113*2) -> 4
A114: MORDIALLOC | C114: 1 | D114: 2 | E114: =C114*6+D114 -> 8 | G114: 7 | H114: 10 | I114: =G114*6+H114 -> 52 | K114: 9 | L114: 10 | M114: =K114*6+L114 -> 64 | O114: 14 | P114: 14 | Q114: =O114*6+P114 -> 98 | W114: BOX HILL | X114: 1 | Y114: 2 | Z114: 0 | AA114: 287 | AB114: 306 | AC114: =(AA114*100)/AB114 -> 93.790849673202615 | AD114: =(X114*4)+(Z114*2) -> 4
A115: BEST PLAYERS | W115: WERRIBEE | X115: 1 | Y115: 2 | Z115: 0 | AA115: 236 | AB115: 265 | AC115: =(AA115*100)/AB115 -> 89.056603773584911 | AD115: =(X115*4)+(Z115*2) -> 4
A116: FRANKSTON | C116: PICKFORD | F116: LEWIS | I116: BOWEN | L116: THATCHER | O116: LEE | W116: MORDIALLOC | X116: 1 | Y116: 2 | Z116: 0 | AA116: 306 | AB116: 348 | AC116: =(AA116*100)/AB116 -> 87.931034482758619 | AD116: =(X116*4)+(Z116*2) -> 4
A117: MORDIALLOC | C117: WILLIAMS | F117: BACKMAN | I117: BIBRON | L117: WILLIS | W117: CAULFIELD | X117: 1 | Y117: 2 | Z117: 0 | AA117: 214 | AB117: 324 | AC117: =(AA117*100)/AB117 -> 66.049382716049379 | AD117: =(X117*4)+(Z117*2) -> 4
A118: GOALKICKERS | W118: CAMBERWELL | X118: 0 | Y118: 3 | Z118: 0 | AA118: 266 | AB118: 346 | AC118: =(AA118*100)/AB118 -> 76.878612716763001 | AD118: =(X118*4)+(Z118*2) -> 0
A119: FRANKSTON | C119: KERR 3 | E119: ROSENBROCK 3 | H119: BOWEN 3 | J119: HEPNER 2 | M119: LEE 2 | N119: SLADE 2 | P119: LAWLEY | R119: THATCHER
A120: MORDIALLOC | C120: BACKMAN 3 | F120: WILLIS 3 | H120: POWER 3 | J120: D THOMSON 2 | M120: DAVEY | O120: BIBRON | Q120: CULLEY
A122: CAULFIELD | C122: 6 | D122: 5 | E122: =C122*6+D122 -> 41 | G122: 9 | H122: 12 | I122: =G122*6+H122 -> 66 | K122: 13 | L122: 14 | M122: =K122*6+L122 -> 92 | O122: 15 | P122: 20 | Q122: =O122*6+P122 -> 110 | S122: CAMBERWELL
A123: CAMBERWELL | C123: 3 | D123: 2 | E123: =C123*6+D123 -> 20 | G123: 6 | H123: 5 | I123: =G123*6+H123 -> 41 | K123: 10 | L123: 11 | M123: =K123*6+L123 -> 71 | O123: 12 | P123: 15 | Q123: =O123*6+P123 -> 87
A124: BEST PLAYERS
A125: CAULFIELD | C125: ROWE | F125: DE BONDE | I125: GRIMMER | L125: TURNER
A126: CAMBERWELL | C126: DELANTY | F126: WICKS | I126: FRIEBERG | L126: DJORDEVIC | O126: HUNT
A127: GOALKICKERS
A128: CAULFIELD | C128: TURNER 4 | F128: BAKER 3 | H128: BRADY 2 | J128: SMITH 2 | L128: MOORE | N128: GOWANS | Q128: ROWE | S128: ROBINSON
A129: CAMBERWELL | C129: WICKS 5 | F129: DELANTY 2 | I129: DJORDEVIC 2 | L129: D BOYD | N129: L BOYD | P129: SMITH
A131: OAKLEIGH | C131: 5 | D131: 3 | E131: =C131*6+D131 -> 33 | G131: 7 | H131: 9 | I131: =G131*6+H131 -> 51 | K131: 10 | L131: 13 | M131: =K131*6+L131 -> 73 | O131: 12 | P131: 16 | Q131: =O131*6+P131 -> 88 | S131: OAKLEIGH
A132: WERRIBEE | C132: 1 | D132: 5 | E132: =C132*6+D132 -> 11 | G132: 5 | H132: 8 | I132: =G132*6+H132 -> 38 | K132: 7 | L132: 10 | M132: =K132*6+L132 -> 52 | O132: 9 | P132: 11 | Q132: =O132*6+P132 -> 65
A133: BEST PLAYERS
A134: OAKLEIGH | C134: CUMMING | F134: McCORKELL | I134: WAPLING | L134: TEGG
A135: WERRIBEE | C135: SHEAHAN | F135: TRIANION | I135: JAMIESON | L135: LYONS | O135: SMITH
A136: GOALKICKERS
A137: OAKLEIGH | C137: R CUMMING 7 | F137: McCORKELL | I137: WAPLING | L137: LUFF | N137: BEARD | P137: TEGG
A138: WERRIBEE | C138: SHEAHAN 3 | F138: STUART 2 | I138: ELLIS | K138: JAMIESON | M138: HOOPER | O138: TRIANION
A140: GEELONG WEST | C140: 1 | D140: 4 | E140: =C140*6+D140 -> 10 | G140: 6 | H140: 9 | I140: =G140*6+H140 -> 45 | K140: 13 | L140: 17 | M140: =K140*6+L140 -> 95 | O140: 19 | P140: 22 | Q140: =O140*6+P140 -> 136 | S140: GEELONG WEST
A141: NORTHCOTE | C141: 5 | D141: 2 | E141: =C141*6+D141 -> 32 | G141: 5 | H141: 3 | I141: =G141*6+H141 -> 33 | K141: 9 | L141: 5 | M141: =K141*6+L141 -> 59 | O141: 11 | P141: 8 | Q141: =O141*6+P141 -> 74
A142: BEST PLAYERS
A143: GEELONG WEST | C143: O'DONNELL | F143: STACEY | I143: PETERS | L143: NUSTELING | O143: SALTER | Q143: KEAYS
A144: NORTHCOTE | C144: MAYNE | F144: PITTS | I144: McBREEN | L144: CALVERLEY | O144: NICHOLSON | R144: KEANE
A145: GOALKICKERS
A146: GEELONG WEST | C146: NUSTELING 9 | F146: O'DONNELL 5 | I146: HETHERINGTON 2 | M146: BRUSHFIELD | P146: BARKER | R146: SNELL
A147: NORTHCOTE | C147: KEANE 4 | F147: RORISON 3 | I147: R WHITE 2 | L147: LACHMUND 2
A149: ROUND 4 | E149: 5TH MAY | J149: WEATHER | S149: PLAYED AT
D150: 1ST QTR | H150: 2ND QTR | L150: 3RD QTR | P150: FINAL | S150: NORTHCOTE
A151: NORTHCOTE | C151: 0 | D151: 0 | E151: =C151*6+D151 -> 0 | G151: 0 | H151: 0 | I151: =G151*6+H151 -> 0 | K151: 0 | L151: 0 | M151: =K151*6+L151 -> 0 | O151: 18 | P151: 26 | Q151: =O151*6+P151 -> 134 | S151: UMPIRE | X151: LADDER | AB151: ROUND | AD151: 4
A152: CAMBERWELL | C152: 0 | D152: 0 | E152: =C152*6+D152 -> 0 | G152: 0 | H152: 0 | I152: =G152*6+H152 -> 0 | K152: 0 | L152: 0 | M152: =K152*6+L152 -> 0 | O152: 15 | P152: 14 | Q152: =O152*6+P152 -> 104
A153: BEST PLAYERS | W153: TEAM | X153: W | Y153: L | Z153: D | AA153: FOR | AB153: AGST | AC153: % | AD153: PTS
A154: NORTHCOTE | C154: McBREEN | F154: SLEEP | I154: KEANE | L154: MAYNE | O154: HAAG | Q154: CALVERLEY
A155: CAMBERWELL | C155: FRIEBERG | F155: PECK | I155: D BOYD | L155: DOCKER | O155: SALO | W155: GEELONG WEST | X155: 4 | Y155: 0 | Z155: 0 | AA155: 475 | AB155: 280 | AC155: =(AA155*100)/AB155 -> 169.64285714285714 | AD155: =(X155*4)+(Z155*2) -> 16
A156: GOALKICKERS | W156: OAKLEIGH | X156: 4 | Y156: 0 | Z156: 0 | AA156: 372 | AB156: 304 | AC156: =(AA156*100)/AB156 -> 122.36842105263158 | AD156: =(X156*4)+(Z156*2) -> 16
A157: NORTHCOTE | W157: FRANKSTON | X157: 3 | Y157: 1 | Z157: 0 | AA157: 422 | AB157: 387 | AC157: =(AA157*100)/AB157 -> 109.04392764857882 | AD157: =(X157*4)+(Z157*2) -> 12
A158: CAMBERWELL | W158: NORTHCOTE | X158: 2 | Y158: 2 | Z158: 0 | AA158: 436 | AB158: 386 | AC158: =(AA158*100)/AB158 -> 112.95336787564767 | AD158: =(X158*4)+(Z158*2) -> 8
A160: MORDIALLOC | C160: 7 | D160: 3 | E160: =C160*6+D160 -> 45 | G160: 9 | H160: 6 | I160: =G160*6+H160 -> 60 | K160: 11 | L160: 10 | M160: =K160*6+L160 -> 76 | O160: 14 | P160: 14 | Q160: =O160*6+P160 -> 98 | S160: PRINCES PARK, CAULFIELD | W160: SUNSHINE | X160: 2 | Y160: 2 | Z160: 0 | AA160: 344 | AB160: 316 | AC160: =(AA160*100)/AB160 -> 108.86075949367088 | AD160: =(X160*4)+(Z160*2) -> 8
A161: CAULFIELD | C161: 2 | D161: 6 | E161: =C161*6+D161 -> 18 | G161: 6 | H161: 10 | I161: =G161*6+H161 -> 46 | K161: 9 | L161: 12 | M161: =K161*6+L161 -> 66 | O161: 10 | P161: 17 | Q161: =O161*6+P161 -> 77 | W161: MORDIALLOC | X161: 2 | Y161: 2 | Z161: 0 | AA161: 404 | AB161: 425 | AC161: =(AA161*100)/AB161 -> 95.058823529411768 | AD161: =(X161*4)+(Z161*2) -> 8
A162: BEST PLAYERS | W162: BOX HILL | X162: 1 | Y162: 3 | Z162: 0 | AA162: 362 | AB162: 395 | AC162: =(AA162*100)/AB162 -> 91.64556962025317 | AD162: =(X162*4)+(Z162*2) -> 4
A163: MORDIALLOC | C163: WILLIS | F163: POWER | I163: HOBSON | L163: RIDDLE | O163: LAIRD | W163: WERRIBEE | X163: 1 | Y163: 3 | Z163: 0 | AA163: 309 | AB163: 390 | AC163: =(AA163*100)/AB163 -> 79.230769230769226 | AD163: =(X163*4)+(Z163*2) -> 4
A164: CAULFIELD | C164: DE BONDE | F164: BAKER | I164: GOWANS | L164: BAKER | O164: MOORE | W164: CAULFIELD | X164: 1 | Y164: 3 | Z164: 0 | AA164: 291 | AB164: 422 | AC164: =(AA164*100)/AB164 -> 68.957345971563981 | AD164: =(X164*4)+(Z164*2) -> 4
A165: GOALKICKERS | W165: CAMBERWELL | X165: 0 | Y165: 4 | Z165: 0 | AA165: 370 | AB165: 480 | AC165: =(AA165*100)/AB165 -> 77.083333333333329 | AD165: =(X165*4)+(Z165*2) -> 0
A166: MORDIALLOC | C166: POWER 6 | F166: BACKMAN 2 | I166: DAVEY 2 | K166: WILLIS 2 | M166: LAIRD | O166: PEARCE
A167: CAULFIELD | C167: BRADY 4 | F167: LOGAN 2 | I167: LACHMUND 2 | L167: J MOORE 2
A169: FRANKSTON | C169: 2 | D169: 7 | E169: =C169*6+D169 -> 19 | G169: 7 | H169: 10 | I169: =G169*6+H169 -> 52 | K169: 11 | L169: 10 | M169: =K169*6+L169 -> 76 | O169: 17 | P169: 14 | Q169: =O169*6+P169 -> 116 | S169: FRANKSTON
A170: SUNSHINE | C170: 2 | D170: 3 | E170: =C170*6+D170 -> 15 | G170: 6 | H170: 8 | I170: =G170*6+H170 -> 44 | K170: 13 | L170: 11 | M170: =K170*6+L170 -> 89 | O170: 15 | P170: 13 | Q170: =O170*6+P170 -> 103
A171: BEST PLAYERS
A172: FRANKSTON | C172: COUTTS | F172: ALDERSON | I172: HINES | L172: HEPNER | O172: BOWEN
A173: SUNSHINE | C173: McLEOD | F173: ALLEN | I173: TREZISE | L173: HARRIS | O173: BANT
A174: GOALKICKERS
A175: FRANKSTON | C175: HEPNER 5 | F175: BOWEN 3 | I175: McHUGH 3 | L175: THATCHER 3 | O175: LEE 2 | Q175: SLADE
A176: SUNSHINE | C176: HARRIS 4 | F176: BANT 4 | H176: FITZGERALD 2 | K176: ALLEN | M176: TREZISE | O176: CROSBIE | Q176: MUNROE | S176: SLATTERY
A178: OAKLEIGH | C178: 5 | D178: 1 | E178: =C178*6+D178 -> 31 | G178: 7 | H178: 5 | I178: =G178*6+H178 -> 47 | K178: 11 | L178: 13 | M178: =K178*6+L178 -> 79 | O178: 12 | P178: 17 | Q178: =O178*6+P178 -> 89 | S178: BOX HILL
A179: BOX HILL | C179: 3 | D179: 4 | E179: =C179*6+D179 -> 22 | G179: 7 | H179: 7 | I179: =G179*6+H179 -> 49 | K179: 8 | L179: 9 | M179: =K179*6+L179 -> 57 | O179: 11 | P179: 9 | Q179: =O179*6+P179 -> 75
A180: BEST PLAYERS
A181: OAKLEIGH | C181: LOTHIAN | F181: WAPLING | I181: LUFF | L181: RITCHIE | O181: THOMAS
A182: BOX HILL | C182: O'NEILL | F182: LOOMES | I182: RONALDSON | L182: LA ROCHE | O182: VERNON
A183: GOALKICKERS
A184: OAKLEIGH | C184: LOTHIAN 4 | F184: WAPLING 3 | I184: CUMMING 3 | L184: MILNES | N184: FORD
A185: BOX HILL | C185: LOOMES 3 | F185: C FELLOWS 3 | I185: GARDINER 2 | L185: WHITE | N185: LA ROCHE | Q185: McLEOD
A187: GEELONG WEST | C187: 0 | D187: 0 | E187: =C187*6+D187 -> 0 | G187: 0 | H187: 0 | I187: =G187*6+H187 -> 0 | K187: 0 | L187: 0 | M187: =K187*6+L187 -> 0 | O187: 17 | P187: 23 | Q187: =O187*6+P187 -> 125 | S187: WERRIBEE
A188: WERRIBEE | C188: 0 | D188: 0 | E188: =C188*6+D188 -> 0 | G188: 0 | H188: 0 | I188: =G188*6+H188 -> 0 | K188: 0 | L188: 0 | M188: =K188*6+L188 -> 0 | O188: 10 | P188: 13 | Q188: =O188*6+P188 -> 73
A189: BEST PLAYERS
A190: GEELONG WEST | C190: HETHERINGTON | F190: O'DONNELL | I190: RAEBURN | L190: COLTISH | O190: BRUSHFIELD
A191: WERRIBEE | C191: DOVE | F191: ELLIS | I191: MELICAN | L191: BA SMITH | O191: MORTON
A192: GOALKICKERS
A193: GEELONG WEST | C193: O'DONNELL 5 | F193: NUSTELING 4 | I193: BRUSHFIELD 3 | L193: SNELL 2 | N193: STACEY | P193: DEAN | R193: NIEWEARWOCZ
A194: WERRIBEE | C194: HENLEY 3 | F194: STUART 2 | I194: LYONS 2 | K194: O'BRIEN 2 | N194: JAMIESON
A196: ROUND 5 | E196: 13TH MAY | J196: WEATHER | S196: PLAYED AT
D197: 1ST QTR | H197: 2ND QTR | L197: 3RD QTR | P197: FINAL | S197: CAMBERWELL
A198: GEELONG WEST | C198: 8 | D198: 5 | E198: =C198*6+D198 -> 53 | G198: 11 | H198: 11 | I198: =G198*6+H198 -> 77 | K198: 18 | L198: 22 | M198: =K198*6+L198 -> 130 | O198: 20 | P198: 25 | Q198: =O198*6+P198 -> 145 | S198: UMPIRE | X198: LADDER | AB198: ROUND | AD198: 5
A199: CAMBERWELL | C199: 2 | D199: 2 | E199: =C199*6+D199 -> 14 | G199: 7 | H199: 3 | I199: =G199*6+H199 -> 45 | K199: 10 | L199: 3 | M199: =K199*6+L199 -> 63 | O199: 11 | P199: 10 | Q199: =O199*6+P199 -> 76
A200: BEST PLAYERS | W200: TEAM | X200: W | Y200: L | Z200: D | AA200: FOR | AB200: AGST | AC200: % | AD200: PTS
A201: GEELONG WEST | C201: O'DONNELL | F201: BARKER | I201: STACEY | L201: NUSTELING | O201: BRUSHFIELD
A202: CAMBERWELL | C202: WICKS | F202: BOYD | I202: KISS | L202: CONYERS | O202: WINKLEMAN | W202: GEELONG WEST | X202: 5 | Y202: 0 | Z202: 0 | AA202: 620 | AB202: 356 | AC202: =(AA202*100)/AB202 -> 174.15730337078651 | AD202: =(X202*4)+(Z202*2) -> 20
A203: GOALKICKERS | W203: FRANKSTON | X203: 4 | Y203: 1 | Z203: 0 | AA203: 527 | AB203: 455 | AC203: =(AA203*100)/AB203 -> 115.82417582417582 | AD203: =(X203*4)+(Z203*2) -> 16
A204: GEELONG WEST | C204: NUSTELING 6 | F204: O'DONNELL 6 | I204: THOMPSON 3 | L204: STACEY 2 | N204: BRUSHFIELD 2 | Q204: BUSH | W204: OAKLEIGH | X204: 4 | Y204: 1 | Z204: 0 | AA204: 440 | AB204: 409 | AC204: =(AA204*100)/AB204 -> 107.57946210268949 | AD204: =(X204*4)+(Z204*2) -> 16
A205: CAMBERWELL | C205: WICKS 4 | F205: WINKLEMAN 2 | I205: DELANTY | L205: PECK | N205: SMITH | P205: CONYERS | R205: DJORDEVIC | W205: MORDIALLOC | X205: 3 | Y205: 2 | Z205: 0 | AA205: 552 | AB205: 503 | AC205: =(AA205*100)/AB205 -> 109.74155069582505 | AD205: =(X205*4)+(Z205*2) -> 12
A207: FRANKSTON | C207: 2 | D207: 2 | E207: =C207*6+D207 -> 14 | G207: 8 | H207: 4 | I207: =G207*6+H207 -> 52 | K207: 12 | L207: 8 | M207: =K207*6+L207 -> 80 | O207: 16 | P207: 9 | Q207: =O207*6+P207 -> 105 | S207: OAKLEIGH | W207: SUNSHINE | X207: 3 | Y207: 2 | Z207: 0 | AA207: 403 | AB207: 370 | AC207: =(AA207*100)/AB207 -> 108.91891891891892 | AD207: =(X207*4)+(Z207*2) -> 12
A208: OAKLEIGH | C208: 4 | D208: 5 | E208: =C208*6+D208 -> 29 | G208: 7 | H208: 6 | I208: =G208*6+H208 -> 48 | K208: 8 | L208: 11 | M208: =K208*6+L208 -> 59 | O208: 9 | P208: 14 | Q208: =O208*6+P208 -> 68 | W208: NORTHCOTE | X208: 2 | Y208: 3 | Z208: 0 | AA208: 514 | AB208: 534 | AC208: =(AA208*100)/AB208 -> 96.254681647940075 | AD208: =(X208*4)+(Z208*2) -> 8
A209: BEST PLAYERS | W209: BOX HILL | X209: 2 | Y209: 3 | Z209: 0 | AA209: 460 | AB209: 491 | AC209: =(AA209*100)/AB209 -> 93.686354378818734 | AD209: =(X209*4)+(Z209*2) -> 8
A210: FRANKSTON | C210: ROSENBROCK | F210: SHEPHERD | I210: SLADE | L210: HEPNER | O210: COUTTS | W210: WERRIBEE | X210: 1 | Y210: 4 | Z210: 0 | AA210: 405 | AB210: 488 | AC210: =(AA210*100)/AB210 -> 82.991803278688522 | AD210: =(X210*4)+(Z210*2) -> 4
A211: OAKLEIGH | C211: THOMAS | F211: HAINING | I211: LUFF | L211: LOGAN | O211: TEGG | W211: CAULFIELD | X211: 1 | Y211: 4 | Z211: 0 | AA211: 345 | AB211: 481 | AC211: =(AA211*100)/AB211 -> 71.725571725571726 | AD211: =(X211*4)+(Z211*2) -> 4
A212: GOALKICKERS | W212: CAMBERWELL | X212: 0 | Y212: 5 | Z212: 0 | AA212: 446 | AB212: 625 | AC212: =(AA212*100)/AB212 -> 71.36 | AD212: =(X212*4)+(Z212*2) -> 0
A213: FRANKSTON | C213: ROSENBROCK 9 | F213: THATCHER 2 | I213: HEPNER 2 | K213: KERR | M213: LEE | O213: LAWLEY
A214: OAKLEIGH | C214: LOTHIAN 5 | F214: CUMMING 3 | I214: HAINING
A216: BOX HILL | C216: 3 | D216: 6 | E216: =C216*6+D216 -> 24 | G216: 6 | H216: 9 | I216: =G216*6+H216 -> 45 | K216: 12 | L216: 12 | M216: =K216*6+L216 -> 84 | O216: 14 | P216: 14 | Q216: =O216*6+P216 -> 98 | S216: WERRIBEE
A217: WERRIBEE | C217: 2 | D217: 4 | E217: =C217*6+D217 -> 16 | G217: 5 | H217: 9 | I217: =G217*6+H217 -> 39 | K217: 9 | L217: 12 | M217: =K217*6+L217 -> 66 | O217: 13 | P217: 18 | Q217: =O217*6+P217 -> 96
A218: BEST PLAYERS
A219: BOX HILL | C219: C FELLOWS | F219: WHITE | I219: LOOMES | L219: GARDINER | O219: O'NEILL | Q219: GREAVES
A220: WERRIBEE | C220: JAMIESON | F220: PANTE | I220: GILLETT | L220: LYONS | O220: ELLIS | Q220: HOOPER
A221: GOALKICKERS
A222: BOX HILL | C222: C FELLOWS 4 | F222: LOOMES 3 | I222: I BATES 2 | L222: GARDINER | N222: RALPH | P222: LA ROCHE | R222: BOWYER-SMITH | U222: BRYANT
A223: WERRIBEE | C223: HENLEY 3 | F223: LYONS 3 | I223: BRYAN 2 | K223: STUART 2 | M223: JAMIESON | P223: SHEAHAN | R223: ECCLES
E224: 14TH MAY | I224: WEATHER
A225: SUNSHINE | C225: 1 | D225: 3 | E225: =C225*6+D225 -> 9 | G225: 1 | H225: 5 | I225: =G225*6+H225 -> 11 | K225: 7 | L225: 9 | M225: =K225*6+L225 -> 51 | O225: 8 | P225: 11 | Q225: =O225*6+P225 -> 59 | S225: SUNSHINE
A226: CAULFIELD | C226: 1 | D226: 0 | E226: =C226*6+D226 -> 6 | G226: 2 | H226: 2 | I226: =G226*6+H226 -> 14 | K226: 3 | L226: 4 | M226: =K226*6+L226 -> 22 | O226: 8 | P226: 6 | Q226: =O226*6+P226 -> 54
A227: BEST PLAYERS
A228: SUNSHINE | C228: McLEOD | F228: BANT | I228: KENNEDY | L228: SLATTERY | O228: YOUNG | Q228: FARNE
A229: CAULFIELD | C229: CLARK | F229: GOWANS | I229: MOORE | L229: DE BONDE | O229: MARSHALL | R229: MELBOURNE
A230: GOALKICKERS
A231: SUNSHINE | C231: HARRIS 3 | F231: BANT 2 | I231: HIPWORTH | L231: TREZISE | N231: MUNROE
A232: CAULFIELD | C232: LACHMUND 3 | F232: ROWE 2 | I232: BRADY 2 | L232: GRIMMER
A234: MORDIALLOC | C234: 0 | D234: 0 | E234: =C234*6+D234 -> 0 | G234: 0 | H234: 0 | I234: =G234*6+H234 -> 0 | K234: 0 | L234: 0 | M234: =K234*6+L234 -> 0 | O234: 22 | P234: 16 | Q234: =O234*6+P234 -> 148 | S234: MORDIALLOC
A235: NORTHCOTE | C235: 0 | D235: 0 | E235: =C235*6+D235 -> 0 | G235: 0 | H235: 0 | I235: =G235*6+H235 -> 0 | K235: 0 | L235: 0 | M235: =K235*6+L235 -> 0 | O235: 11 | P235: 12 | Q235: =O235*6+P235 -> 78
A236: BEST PLAYERS
A237: MORDIALLOC | C237: SCAIFFE | F237: POWER | I237: WILLIS | L237: HOBSON | O237: DANCKERT | R237: THOMPSON
A238: NORTHCOTE | C238: WHITE | F238: McBREEN | I238: CALVERLEY | L238: KEANE | O238: SLEEP
A239: GOALKICKERS
A240: MORDIALLOC | C240: POWER 10 | F240: THOMPSON 4 | I240: BACKMAN 3 | L240: LESLIE 2 | N240: CULPH | P240: DAVEY | R240: PEARCE
A241: NORTHCOTE
A243: ROUND 6 | E243: 20TH MAY | J243: WEATHER | S243: PLAYED AT
D244: 1ST QTR | H244: 2ND QTR | L244: 3RD QTR | P244: FINAL | S244: CAMBERWELL
A245: CAMBERWELL | C245: 3 | D245: 1 | E245: =C245*6+D245 -> 19 | G245: 11 | H245: 9 | I245: =G245*6+H245 -> 75 | K245: 16 | L245: 15 | M245: =K245*6+L245 -> 111 | O245: 19 | P245: 16 | Q245: =O245*6+P245 -> 130 | S245: UMPIRE | X245: LADDER | AB245: ROUND | AD245: 6
A246: WERRIBEE | C246: 1 | D246: 1 | E246: =C246*6+D246 -> 7 | G246: 6 | H246: 5 | I246: =G246*6+H246 -> 41 | K246: 8 | L246: 5 | M246: =K246*6+L246 -> 53 | O246: 9 | P246: 12 | Q246: =O246*6+P246 -> 66
A247: BEST PLAYERS | W247: TEAM | X247: W | Y247: L | Z247: D | AA247: FOR | AB247: AGST | AC247: % | AD247: PTS
A248: CAMBERWELL | C248: J SMITH | F248: DJORDEVIC | J248: WINKLEMAN | M248: WICKS | P248: KISS | R248: FRIEBERG
A249: WERRIBEE | C249: HEDLEY | F249: ELLIS | J249: SHEAHAN | M249: DENT | P249: B SMITH | W249: GEELONG WEST | X249: 6 | Y249: 0 | Z249: 0 | AA249: 719 | AB249: 449 | AC249: =(AA249*100)/AB249 -> 160.13363028953231 | AD249: =(X249*4)+(Z249*2) -> 24
A250: GOALKICKERS | W250: OAKLEIGH | X250: 5 | Y250: 1 | Z250: 0 | AA250: 529 | AB250: 489 | AC250: =(AA250*100)/AB250 -> 108.1799591002045 | AD250: =(X250*4)+(Z250*2) -> 20
A251: CAMBERWELL | C251: WICKS 8 | E251: WINKLEMAN 3 | H251: J SMITH 2 | J251: PECK 2 | L251: DJORDEVIC 2 | O251: THOMPSON | R251: SALA | W251: FRANKSTON | X251: 4 | Y251: 2 | Z251: 0 | AA251: 631 | AB251: 589 | AC251: =(AA251*100)/AB251 -> 107.13073005093379 | AD251: =(X251*4)+(Z251*2) -> 16
A252: WERRIBEE | C252: STUART 3 | F252: HEDLEY 2 | I252: DENT | K252: SHEAHAN | M252: COOPER | W252: MORDIALLOC | X252: 3 | Y252: 3 | Z252: 0 | AA252: 645 | AB252: 602 | AC252: =(AA252*100)/AB252 -> 107.14285714285714 | AD252: =(X252*4)+(Z252*2) -> 12
A254: OAKLEIGH | C254: 1 | D254: 1 | E254: =C254*6+D254 -> 7 | G254: 5 | H254: 7 | I254: =G254*6+H254 -> 37 | K254: 7 | L254: 9 | M254: =K254*6+L254 -> 51 | O254: 13 | P254: 11 | Q254: =O254*6+P254 -> 89 | S254: PRINCES PARK, CAULFIELD | W254: NORTHCOTE | X254: 3 | Y254: 3 | Z254: 0 | AA254: 617 | AB254: 606 | AC254: =(AA254*100)/AB254 -> 101.81518151815182 | AD254: =(X254*4)+(Z254*2) -> 12
A255: CAULFIELD | C255: 6 | D255: 3 | E255: =C255*6+D255 -> 39 | G255: 6 | H255: 6 | I255: =G255*6+H255 -> 42 | K255: 11 | L255: 7 | M255: =K255*6+L255 -> 73 | O255: 12 | P255: 8 | Q255: =O255*6+P255 -> 80 | W255: SUNSHINE | X255: 3 | Y255: 3 | Z255: 0 | AA255: 475 | AB255: 473 | AC255: =(AA255*100)/AB255 -> 100.42283298097252 | AD255: =(X255*4)+(Z255*2) -> 12
A256: BEST PLAYERS | W256: BOX HILL | X256: 3 | Y256: 3 | Z256: 0 | AA256: 594 | AB256: 595 | AC256: =(AA256*100)/AB256 -> 99.831932773109244 | AD256: =(X256*4)+(Z256*2) -> 12
A257: OAKLEIGH | C257: CUMMING | F257: HAINING | I257: WAPLING | L257: LOTHIAN | O257: MILNES | W257: CAMBERWELL | X257: 1 | Y257: 5 | Z257: 0 | AA257: 576 | AB257: 691 | AC257: =(AA257*100)/AB257 -> 83.357452966714902 | AD257: =(X257*4)+(Z257*2) -> 4
A258: CAULFIELD | C258: CLARK | F258: DE BONDE | I258: ROWE | L258: BARKER | O258: MOORE | W258: WERRIBEE | X258: 1 | Y258: 5 | Z258: 0 | AA258: 471 | AB258: 618 | AC258: =(AA258*100)/AB258 -> 76.213592233009706 | AD258: =(X258*4)+(Z258*2) -> 4
A259: GOALKICKERS | W259: CAULFIELD | X259: 1 | Y259: 5 | Z259: 0 | AA259: 425 | AB259: 570 | AC259: =(AA259*100)/AB259 -> 74.561403508771932 | AD259: =(X259*4)+(Z259*2) -> 4
A260: OAKLEIGH | C260: CUMMING 6 | F260: WAPLING 2 | I260: LOTHIAN 2 | L260: MILNES | N260: HAINING | P260: FORD
A261: CAULFIELD | C261: GOWANS 3 | F261: BAKER 3 | I261: ROWE 3 | K261: AUGHTERSON 2 | N261: LACHMUND
A263: BOX HILL | C263: 5 | D263: 5 | E263: =C263*6+D263 -> 35 | G263: 10 | H263: 8 | I263: =G263*6+H263 -> 68 | K263: 17 | L263: 12 | M263: =K263*6+L263 -> 114 | O263: 20 | P263: 14 | Q263: =O263*6+P263 -> 134 | S263: FRANKSTON
A264: FRANKSTON | C264: 2 | D264: 5 | E264: =C264*6+D264 -> 17 | G264: 6 | H264: 8 | I264: =G264*6+H264 -> 44 | K264: 11 | L264: 10 | M264: =K264*6+L264 -> 76 | O264: 15 | P264: 14 | Q264: =O264*6+P264 -> 104
A265: BEST PLAYERS
A266: BOX HILL | C266: GARDINER | F266: DAVIES | I266: I BATES | L266: GREAVES | O266: RONALDSON
A267: FRANKSTON | C267: KERR | F267: GLEESON | I267: THATCHER | L267: LEWIS | O267: SHEPHERD | R267: HEPNER
A268: GOALKICKERS
A269: BOX HILL | C269: GREAVES 5 | F269: I BATES 5 | H269: C FELLOWS 2 | K269: GARDINER 2 | N269: LOOMES 2 | P269: RONALDSON | S269: BAKER | U269: McLEOD | W269: BRYANT
A270: FRANKSTON | C270: KERR 5 | E270: BOWEN 3 | G270: ROSENBROCK 2 | J270: THATCHER 2 | M270: LAWLEY | O270: HEPNER | Q270: 1 SHORT
E271: 21ST MAY | I271: WEATHER
A272: GEELONG WEST | C272: 0 | D272: 5 | E272: =C272*6+D272 -> 5 | G272: 5 | H272: 7 | I272: =G272*6+H272 -> 37 | K272: 9 | L272: 10 | M272: =K272*6+L272 -> 64 | O272: 14 | P272: 15 | Q272: =O272*6+P272 -> 99 | S272: GEELONG WEST
A273: MORDIALLOC | C273: 0 | D273: 0 | E273: =C273*6+D273 -> 0 | G273: 8 | H273: 5 | I273: =G273*6+H273 -> 53 | K273: 12 | L273: 7 | M273: =K273*6+L273 -> 79 | O273: 14 | P273: 9 | Q273: =O273*6+P273 -> 93
A274: BEST PLAYERS
A275: GEELONG WEST | C275: THOMPSON | F275: KEAYS | I275: HOVEY | L275: BARKER | O275: RAEBURN | Q275: COLTISH
A276: MORDIALLOC | C276: WILLIAMS | F276: HOBSON | I276: SCAIFFE | L276: DAVEY | O276: POWER | Q276: BACKMAN
A277: GOALKICKERS
A278: GEELONG WEST | C278: NIEWEARWICZ 4 | G278: BUSH 3 | I278: O'DONNELL 2 | L278: THOMPSON 2 | O278: KEAYS 2 | Q278: SNELL
A279: MORDIALLOC | C279: POWER 7 | F279: BACKMAN 4 | I279: THOMPSON 2 | L279: DAVEY
A281: NORTHCOTE | C281: 3 | D281: 2 | E281: =C281*6+D281 -> 20 | G281: 8 | H281: 6 | I281: =G281*6+H281 -> 54 | K281: 11 | L281: 10 | M281: =K281*6+L281 -> 76 | O281: 15 | P281: 13 | Q281: =O281*6+P281 -> 103 | S281: NORTHCOTE
A282: SUNSHINE | C282: 1 | D282: 4 | E282: =C282*6+D282 -> 10 | G282: 1 | H282: 9 | I282: =G282*6+H282 -> 15 | K282: 7 | L282: 13 | M282: =K282*6+L282 -> 55 | O282: 9 | P282: 18 | Q282: =O282*6+P282 -> 72
A283: BEST PLAYERS
A284: NORTHCOTE | C284: OGILVIE | F284: MUIR | I284: KEANE | L284: CALVERLEY | O284: SLEEP | Q284: HENRY
A285: SUNSHINE | C285: McCARTHY | F285: McLEOD | I285: POWER | L285: SLATTERY | O285: PARNE
A286: GOALKICKERS
A287: NORTHCOTE | C287: CALVERLEY 4 | F287: SLEEP 3 | H287: HENRY 3 | J287: PITTS 2 | L287: WHITE | N287: HEARNE | P287: CRAMERI
A288: SUNSHINE | C288: HIPWORTH 3 | F288: BANT 2 | H288: TREZISE | J288: LEGAWICZ | M288: SLATTERY | P288: POWER
A290: ROUND 7 | E290: 27TH MAY | J290: WEATHER | S290: PLAYED AT
D291: 1ST QTR | H291: 2ND QTR | L291: 3RD QTR | P291: FINAL | S291: MORDIALLOC
A292: MORDIALLOC | C292: 2 | D292: 3 | E292: =C292*6+D292 -> 15 | G292: 7 | H292: 12 | I292: =G292*6+H292 -> 54 | K292: 13 | L292: 14 | M292: =K292*6+L292 -> 92 | O292: 16 | P292: 16 | Q292: =O292*6+P292 -> 112 | S292: UMPIRE | X292: LADDER | AB292: ROUND | AD292: 7
A293: CAMBERWELL | C293: 2 | D293: 7 | E293: =C293*6+D293 -> 19 | G293: 4 | H293: 7 | I293: =G293*6+H293 -> 31 | K293: 5 | L293: 10 | M293: =K293*6+L293 -> 40 | O293: 8 | P293: 11 | Q293: =O293*6+P293 -> 59
A294: BEST PLAYERS | W294: TEAM | X294: W | Y294: L | Z294: D | AA294: FOR | AB294: AGST | AC294: % | AD294: PTS
A295: MORDIALLOC | C295: DANCKERT | F295: BIBRON | I295: POWER | L295: LESLIE | O295: SCAIFFE | Q295: BACKMAN
A296: CAMBERWELL | C296: J SMITH | F296: DJORDEVIC | I296: WINKLEMAN | L296: WICKS | O296: KISS | W296: GEELONG WEST | X296: 7 | Y296: 0 | Z296: 0 | AA296: 822 | AB296: 515 | AC296: =(AA296*100)/AB296 -> 159.61165048543688 | AD296: =(X296*4)+(Z296*2) -> 28
A297: GOALKICKERS | W297: OAKLEIGH | X297: 6 | Y297: 1 | Z297: 0 | AA297: 642 | AB297: 559 | AC297: =(AA297*100)/AB297 -> 114.8479427549195 | AD297: =(X297*4)+(Z297*2) -> 24
A298: MORDIALLOC | C298: BACKMAN 4 | F298: POWER 4 | H298: LESLIE 2 | J298: HYNES 2 | L298: BIBRON | N298: THOMPSON | Q298: PORTER | S298: RIDDLE | W298: MORDIALLOC | X298: 4 | Y298: 3 | Z298: 0 | AA298: 757 | AB298: 661 | AC298: =(AA298*100)/AB298 -> 114.52344931921331 | AD298: =(X298*4)+(Z298*2) -> 16
A299: CAMBERWELL | C299: WINKLEMAN 3 | F299: WICKS 2 | I299: CONYERS 2 | L299: PECK | W299: BOX HILL | X299: 4 | Y299: 3 | Z299: 0 | AA299: 680 | AB299: 656 | AC299: =(AA299*100)/AB299 -> 103.65853658536585 | AD299: =(X299*4)+(Z299*2) -> 16
A301: BOX HILL | C301: 1 | D301: 1 | E301: =C301*6+D301 -> 7 | G301: 4 | H301: 3 | I301: =G301*6+H301 -> 27 | K301: 8 | L301: 8 | M301: =K301*6+L301 -> 56 | O301: 13 | P301: 8 | Q301: =O301*6+P301 -> 86 | S301: BOX HILL | W301: FRANKSTON | X301: 4 | Y301: 3 | Z301: 0 | AA301: 679 | AB301: 678 | AC301: =(AA301*100)/AB301 -> 100.14749262536873 | AD301: =(X301*4)+(Z301*2) -> 16
A302: CAULFIELD | C302: 2 | D302: 3 | E302: =C302*6+D302 -> 15 | G302: 5 | H302: 7 | I302: =G302*6+H302 -> 37 | K302: 7 | L302: 7 | M302: =K302*6+L302 -> 49 | O302: 8 | P302: 13 | Q302: =O302*6+P302 -> 61 | W302: NORTHCOTE | X302: 3 | Y302: 4 | Z302: 0 | AA302: 687 | AB302: 719 | AC302: =(AA302*100)/AB302 -> 95.549374130737135 | AD302: =(X302*4)+(Z302*2) -> 12
A303: BEST PLAYERS | W303: SUNSHINE | X303: 3 | Y303: 4 | Z303: 0 | AA303: 541 | AB303: 576 | AC303: =(AA303*100)/AB303 -> 93.923611111111114 | AD303: =(X303*4)+(Z303*2) -> 12
A304: BOX HILL | C304: G FELLOWS | F304: LOOMES | I304: C FELLOWS | L304: GARDINER | O304: BAKER | W304: WERRIBEE | X304: 2 | Y304: 5 | Z304: 0 | AA304: 560 | AB304: 666 | AC304: =(AA304*100)/AB304 -> 84.084084084084083 | AD304: =(X304*4)+(Z304*2) -> 8
A305: CAULFIELD | C305: ROWE | F305: DE BONDE | I305: BAKER | L305: CLARK | O305: COLLINS | W305: CAMBERWELL | X305: 1 | Y305: 6 | Z305: 0 | AA305: 635 | AB305: 803 | AC305: =(AA305*100)/AB305 -> 79.07845579078456 | AD305: =(X305*4)+(Z305*2) -> 4
A306: GOALKICKERS | W306: CAULFIELD | X306: 1 | Y306: 6 | Z306: 0 | AA306: 486 | AB306: 656 | AC306: =(AA306*100)/AB306 -> 74.08536585365853 | AD306: =(X306*4)+(Z306*2) -> 4
A307: BOX HILL | C307: C FELLOWS 6 | F307: LOOMES 2 | I307: GARDINER 2 | L307: GRAY | N307: BRYANT | P307: BOWYER-SMITH
A308: CAULFIELD | C308: ROWE 3 | F308: BRADY 3 | I308: RIGG | K308: BAKER
A310: OAKLEIGH | C310: 2 | D310: 4 | E310: =C310*6+D310 -> 16 | G310: 6 | H310: 9 | I310: =G310*6+H310 -> 45 | K310: 10 | L310: 12 | M310: =K310*6+L310 -> 72 | O310: 16 | P310: 17 | Q310: =O310*6+P310 -> 113 | S310: OAKLEIGH
A311: NORTHCOTE | C311: 4 | D311: 4 | E311: =C311*6+D311 -> 28 | G311: 6 | H311: 5 | I311: =G311*6+H311 -> 41 | K311: 6 | L311: 8 | M311: =K311*6+L311 -> 44 | O311: 9 | P311: 16 | Q311: =O311*6+P311 -> 70
A312: BEST PLAYERS
A313: OAKLEIGH | C313: WAPLING | F313: LOTHIAN | I313: CUMMING | L313: HAINING | O313: LOGAN
A314: NORTHCOTE | C314: EASTAWAY | F314: MUIR | I314: McBREEN | L314: DEAN | O314: CRAMERI
A315: GOALKICKERS
A316: OAKLEIGH | C316: CUMMING 5 | F316: WAPLING 3 | I316: HAINING 2 | L316: LOTHIAN 2 | N316: BURKE | P316: FORD | R316: LUFF | T316: RITCHIE
A317: NORTHCOTE | C317: DEAN 3 | F317: R WHITE 2 | I317: CRAMERI | L317: KEANE | N317: PITTS | P317: SLEEP
E318: 28TH MAY | I318: WEATHER
A319: GEELONG WEST | C319: 4 | D319: 5 | E319: =C319*6+D319 -> 29 | G319: 6 | H319: 12 | I319: =G319*6+H319 -> 48 | K319: 11 | L319: 16 | M319: =K319*6+L319 -> 82 | O319: 14 | P319: 19 | Q319: =O319*6+P319 -> 103 | S319: SUNSHINE
A320: SUNSHINE | C320: 2 | D320: 2 | E320: =C320*6+D320 -> 14 | G320: 3 | H320: 4 | I320: =G320*6+H320 -> 22 | K320: 6 | L320: 7 | M320: =K320*6+L320 -> 43 | O320: 9 | P320: 12 | Q320: =O320*6+P320 -> 66
A321: BEST PLAYERS
A322: GEELONG WEST | C322: THOMPSON | F322: KEAYS | I322: BUSH | L322: HOVEY | O322: RAEBURN | R322: OLIVER
A323: SUNSHINE | C323: HARRIS | F323: McGARRITY | I323: McLEOD | L323: KENNEDY | O323: TREZISE | R323: POWER
A324: GOALKICKERS | C324: 1 SHORT
A325: GEELONG WEST | C325: BUSH 4 | E325: HARRIS 3 | G325: BRUSHFIELD 2 | J325: THOMPSON 2 | M325: NIEWEAREWICZ | Q325: BIEN
A326: SUNSHINE | C326: CROSBIE 2 | F326: SLATTERY 2 | I326: LEGOWICZ 2 | L326: HIPWORTH | O326: POWER | Q326: HARRIS
A328: WERRIBEE | C328: 3 | D328: 3 | E328: =C328*6+D328 -> 21 | G328: 4 | H328: 6 | I328: =G328*6+H328 -> 30 | K328: 7 | L328: 9 | M328: =K328*6+L328 -> 51 | O328: 13 | P328: 11 | Q328: =O328*6+P328 -> 89 | S328: WERRIBEE
A329: FRANKSTON | C329: 2 | D329: 3 | E329: =C329*6+D329 -> 15 | G329: 2 | H329: 11 | I329: =G329*6+H329 -> 23 | K329: 4 | L329: 14 | M329: =K329*6+L329 -> 38 | O329: 5 | P329: 18 | Q329: =O329*6+P329 -> 48
A330: BEST PLAYERS
A331: WERRIBEE | C331: DOVE | F331: ELLIS | I331: B SMITH | L331: ANDERSON | O331: CROMPTON | R331: CHIRGWIN
A332: FRANKSTON | C332: GLEESON | F332: SHEPHERD | I332: HINES | L332: BLAKE | O332: ANDERSON
A333: GOALKICKERS
A334: WERRIBEE | C334: B SMITH 4 | F334: HEMLEY 4 | I334: CHIRGWIN 2 | L334: ELLIS | N334: SHEAHAN | Q334: STUART
A335: FRANKSTON | C335: BOWEN 2 | F335: LEWIS | H335: HEPNER | J335: EAGLE
A337: ROUND 8 | E337: 3RD JUNE | J337: WEATHER | S337: PLAYED AT
D338: 1ST QTR | H338: 2ND QTR | L338: 3RD QTR | P338: FINAL | S338: MORDIALLOC
A339: MORDIALLOC | C339: 3 | D339: 2 | E339: =C339*6+D339 -> 20 | G339: 8 | H339: 10 | I339: =G339*6+H339 -> 58 | K339: 11 | L339: 13 | M339: =K339*6+L339 -> 79 | O339: 15 | P339: 19 | Q339: =O339*6+P339 -> 109 | S339: UMPIRE | X339: LADDER | AB339: ROUND | AD339: 8
A340: WERRIBEE | C340: 3 | D340: 5 | E340: =C340*6+D340 -> 23 | G340: 7 | H340: 6 | I340: =G340*6+H340 -> 48 | K340: 9 | L340: 10 | M340: =K340*6+L340 -> 64 | O340: 12 | P340: 14 | Q340: =O340*6+P340 -> 86
A341: BEST PLAYERS | W341: TEAM | X341: W | Y341: L | Z341: D | AA341: FOR | AB341: AGST | AC341: % | AD341: PTS
A342: MORDIALLOC | C342: POWER | F342: PORTER | I342: WILLIAMS | L342: BIBRON | O342: DANCKERT | R342: BACKMAN
A343: WERRIBEE | C343: ANDERSON | F343: HEMLEY | I343: GILLETT | L343: DOVE | O343: B SMITH | R343: HOOPER | W343: GEELONG WEST | X343: 8 | Y343: 0 | Z343: 0 | AA343: 936 | AB343: 599 | AC343: =(AA343*100)/AB343 -> 156.26043405676126 | AD343: =(X343*4)+(Z343*2) -> 32
A344: GOALKICKERS | W344: OAKLEIGH | X344: 6 | Y344: 2 | Z344: 0 | AA344: 726 | AB344: 673 | AC344: =(AA344*100)/AB344 -> 107.87518573551263 | AD344: =(X344*4)+(Z344*2) -> 24
A345: MORDIALLOC | C345: POWER 9 | F345: PORTER 2 | I345: BACKMAN | L345: THOMPSON | O345: BIBRON | Q345: LESLIE | W345: MORDIALLOC | X345: 5 | Y345: 3 | Z345: 0 | AA345: 866 | AB345: 747 | AC345: =(AA345*100)/AB345 -> 115.93038821954485 | AD345: =(X345*4)+(Z345*2) -> 20
A346: WERRIBEE | C346: HEMLEY 5 | F346: B SMITH 3 | I346: SHEAHAN 2 | L346: CHIRGWIN | O346: HOOPER | W346: FRANKSTON | X346: 5 | Y346: 3 | Z346: 0 | AA346: 769 | AB346: 766 | AC346: =(AA346*100)/AB346 -> 100.39164490861619 | AD346: =(X346*4)+(Z346*2) -> 20
A348: SUNSHINE | C348: 3 | D348: 4 | E348: =C348*6+D348 -> 22 | G348: 7 | H348: 12 | I348: =G348*6+H348 -> 54 | K348: 9 | L348: 14 | M348: =K348*6+L348 -> 68 | O348: 13 | P348: 18 | Q348: =O348*6+P348 -> 96 | S348: CAMBERWELL | W348: BOX HILL | X348: 4 | Y348: 4 | Z348: 0 | AA348: 772 | AB348: 764 | AC348: =(AA348*100)/AB348 -> 101.04712041884817 | AD348: =(X348*4)+(Z348*2) -> 16
A349: CAMBERWELL | C349: 6 | D349: 3 | E349: =C349*6+D349 -> 39 | G349: 9 | H349: 6 | I349: =G349*6+H349 -> 60 | K349: 9 | L349: 12 | M349: =K349*6+L349 -> 66 | O349: 10 | P349: 17 | Q349: =O349*6+P349 -> 77 | W349: NORTHCOTE | X349: 4 | Y349: 4 | Z349: 0 | AA349: 795 | AB349: 811 | AC349: =(AA349*100)/AB349 -> 98.027127003699135 | AD349: =(X349*4)+(Z349*2) -> 16
A350: BEST PLAYERS | W350: SUNSHINE | X350: 4 | Y350: 4 | Z350: 0 | AA350: 637 | AB350: 653 | AC350: =(AA350*100)/AB350 -> 97.549770290964773 | AD350: =(X350*4)+(Z350*2) -> 16
A351: SUNSHINE | C351: CROSBIE | F351: PLAIN | I351: TARCZON | L351: TREZISE | O351: POWER | R351: MUNROE | W351: WERRIBEE | X351: 2 | Y351: 6 | Z351: 0 | AA351: 646 | AB351: 775 | AC351: =(AA351*100)/AB351 -> 83.354838709677423 | AD351: =(X351*4)+(Z351*2) -> 8
A352: CAMBERWELL | C352: WINKLEMAN | F352: DOUGLAS | I352: D BOYD | L352: ALLISON | O352: DELANTY | W352: CAMBERWELL | X352: 1 | Y352: 7 | Z352: 0 | AA352: 712 | AB352: 899 | AC352: =(AA352*100)/AB352 -> 79.199110122358178 | AD352: =(X352*4)+(Z352*2) -> 4
A353: GOALKICKERS | W353: CAULFIELD | X353: 1 | Y353: 7 | Z353: 0 | AA353: 574 | AB353: 746 | AC353: =(AA353*100)/AB353 -> 76.943699731903479 | AD353: =(X353*4)+(Z353*2) -> 4
A354: SUNSHINE | C354: CROSBIE 6 | F354: BROWN 2 | I354: POWER 2 | K354: SLATTERY | M354: TREZISE | O354: HIPWORTH
A355: CAMBERWELL | C355: WICKS 5 | F355: WINKLEMAN 3 | I355: PECK | K355: CONYERS
A357: FRANKSTON | C357: 4 | D357: 5 | E357: =C357*6+D357 -> 29 | G357: 6 | H357: 7 | I357: =G357*6+H357 -> 43 | K357: 10 | L357: 10 | M357: =K357*6+L357 -> 70 | O357: 13 | P357: 12 | Q357: =O357*6+P357 -> 90 | S357: PRINCES PARK, CAULFIELD
A358: CAULFIELD | C358: 0 | D358: 0 | E358: =C358*6+D358 -> 0 | G358: 4 | H358: 12 | I358: =G358*6+H358 -> 36 | K358: 6 | L358: 17 | M358: =K358*6+L358 -> 53 | O358: 10 | P358: 28 | Q358: =O358*6+P358 -> 88
A359: BEST PLAYERS
A360: FRANKSTON | C360: BLAKE | F360: GLEESON | I360: KERR | L360: EAGLE | O360: COUTTS | R360: McHUGH
A361: CAULFIELD | C361: BAKER | F361: LACHMUND | I361: MELBOURNE | L361: CLARK
A362: GOALKICKERS
A363: FRANKSTON | C363: KERR 3 | E363: McHUGH 3 | H363: EAGLE 2 | J363: BOWEN | L363: HINES | N363: BROGIE | P363: SHEPHERD | R363: LAWLEY
A364: CAULFIELD | C364: LACHMUND 3 | F364: McCOOKE 2 | I364: BAKER | K364: BRADY | M364: ROWE | O364: AUGHTERSON | R364: GRIMMER
A366: NORTHCOTE | C366: 6 | D366: 4 | E366: =C366*6+D366 -> 40 | G366: 8 | H366: 5 | I366: =G366*6+H366 -> 53 | K366: 13 | L366: 9 | M366: =K366*6+L366 -> 87 | O366: 16 | P366: 12 | Q366: =O366*6+P366 -> 108 | S366: NORTHCOTE
A367: BOX HILL | C367: 3 | D367: 5 | E367: =C367*6+D367 -> 23 | G367: 7 | H367: 12 | I367: =G367*6+H367 -> 54 | K367: 10 | L367: 19 | M367: =K367*6+L367 -> 79 | O367: 12 | P367: 20 | Q367: =O367*6+P367 -> 92
A368: BEST PLAYERS
A369: NORTHCOTE | C369: CRAMERI | F369: R WHITE | I369: MUIR | L369: SLEEP | O369: PITTS
A370: BOX HILL | C370: C FELLOWS | F370: I BATES | I370: G FELLOWS | L370: LOOMES | O370: BOWYER-SMITH
A371: GOALKICKERS
A372: NORTHCOTE | C372: CRAMERI 4 | F372: R WHITE 3 | I372: MUIR 2 | K372: R DEAN 2 | N372: PITTS 2 | P372: WILSON | R372: McBREEN | T372: SLEEP
A373: BOX HILL | C373: I BATES 3 | F373: C FELLOWS 2 | I373: MACKO 2 | K373: BOWYER-SMITH 2 | O373: GREAVES | Q373: LOOMES | S373: BRYANT
A375: GEELONG WEST | C375: 2 | D375: 2 | E375: =C375*6+D375 -> 14 | G375: 7 | H375: 5 | I375: =G375*6+H375 -> 47 | K375: 11 | L375: 8 | M375: =K375*6+L375 -> 74 | O375: 17 | P375: 12 | Q375: =O375*6+P375 -> 114 | S375: GEELONG WEST
A376: OAKLEIGH | C376: 4 | D376: 6 | E376: =C376*6+D376 -> 30 | G376: 7 | H376: 7 | I376: =G376*6+H376 -> 49 | K376: 9 | L376: 11 | M376: =K376*6+L376 -> 65 | O376: 12 | P376: 12 | Q376: =O376*6+P376 -> 84
A377: BEST PLAYERS
A378: GEELONG WEST | C378: O'DONNELL | F378: BRUSHFIELD | I378: BIEN | K378: HOVEY | M378: SNELL
A379: OAKLEIGH | C379: THOMAS | F379: WAPLING | I379: HAINING | K379: RITCHIE | M379: CUMMING
A380: GOALKICKERS
A381: GEELONG WEST | C381: O'DONNELL 6 | F381: BRUSHFIELD 2 | I381: HARRIS 2 | K381: BUSH 2 | M381: THOMPSON 2 | P381: HOVEY | R381: GIBBONS | T381: NIEREAWICZ
A382: OAKLEIGH | C382: CUMMING 4 | F382: FORD 2 | H382: HAINING 2 | J382: WAPLING | M382: LOTHIAN | O382: BURKE | Q382: LYON
A384: ROUND 9 | E384: 10TH JUNE | J384: WEATHER | S384: PLAYED AT
D385: 1ST QTR | H385: 2ND QTR | L385: 3RD QTR | P385: FINAL | S385: SUNSHINE
A386: SUNSHINE | C386: 2 | D386: 7 | E386: =C386*6+D386 -> 19 | G386: 4 | H386: 11 | I386: =G386*6+H386 -> 35 | K386: 7 | L386: 13 | M386: =K386*6+L386 -> 55 | O386: 11 | P386: 16 | Q386: =O386*6+P386 -> 82 | S386: UMPIRE | X386: LADDER | AB386: ROUND | AD386: 9
A387: MORDIALLOC | C387: 2 | D387: 0 | E387: =C387*6+D387 -> 12 | G387: 6 | H387: 1 | I387: =G387*6+H387 -> 37 | K387: 9 | L387: 4 | M387: =K387*6+L387 -> 58 | O387: 10 | P387: 6 | Q387: =O387*6+P387 -> 66
A388: BEST PLAYERS | W388: TEAM | X388: W | Y388: L | Z388: D | AA388: FOR | AB388: AGST | AC388: % | AD388: PTS
A389: SUNSHINE | C389: TREZISE | F389: PLAIN | I389: KENNEDY | L389: SLATTERY | O389: CROSBIE | Q389: McGARRITY
A390: MORDIALLOC | C390: BACKMAN | F390: BIBRON | I390: DANCKERT | L390: WILLIAMS | O390: RIDDLE | Q390: SCAIFFE | W390: GEELONG WEST | X390: 9 | Y390: 0 | Z390: 0 | AA390: 1048 | AB390: 683 | AC390: =(AA390*100)/AB390 -> 153.44070278184481 | AD390: =(X390*4)+(Z390*2) -> 36
A391: GOALKICKERS | W391: OAKLEIGH | X391: 7 | Y391: 2 | Z391: 0 | AA391: 815 | AB391: 732 | AC391: =(AA391*100)/AB391 -> 111.33879781420765 | AD391: =(X391*4)+(Z391*2) -> 28
A392: SUNSHINE | C392: HARRIS 4 | F392: P ? 3 | I392: CROSBIE | L392: YOUNG | N392: M? 1 | P392: MASON | W392: FRANKSTON | X392: 6 | Y392: 3 | Z392: 0 | AA392: 884 | AB392: 855 | AC392: =(AA392*100)/AB392 -> 103.39181286549707 | AD392: =(X392*4)+(Z392*2) -> 24
A393: MORDIALLOC | C393: POWER 4 | F393: THOMPSON 4 | I393: BACKMAN | L393: EVANS | W393: MORDIALLOC | X393: 5 | Y393: 4 | Z393: 0 | AA393: 932 | AB393: 829 | AC393: =(AA393*100)/AB393 -> 112.42460796139927 | AD393: =(X393*4)+(Z393*2) -> 20
A395: CAULFIELD | C395: 4 | D395: 3 | E395: =C395*6+D395 -> 27 | G395: 7 | H395: 5 | I395: =G395*6+H395 -> 47 | K395: 11 | L395: 9 | M395: =K395*6+L395 -> 75 | O395: 11 | P395: 11 | Q395: =O395*6+P395 -> 77 | S395: WERRIBEE | W395: SUNSHINE | X395: 5 | Y395: 4 | Z395: 0 | AA395: 719 | AB395: 719 | AC395: =(AA395*100)/AB395 -> 100 | AD395: =(X395*4)+(Z395*2) -> 20
A396: WERRIBEE | C396: 5 | D396: 2 | E396: =C396*6+D396 -> 32 | G396: 8 | H396: 5 | I396: =G396*6+H396 -> 53 | K396: 8 | L396: 8 | M396: =K396*6+L396 -> 56 | O396: 9 | P396: 12 | Q396: =O396*6+P396 -> 66 | W396: BOX HILL | X396: 4 | Y396: 5 | Z396: 0 | AA396: 856 | AB396: 876 | AC396: =(AA396*100)/AB396 -> 97.716894977168948 | AD396: =(X396*4)+(Z396*2) -> 16
A397: BEST PLAYERS | W397: NORTHCOTE | X397: 4 | Y397: 5 | Z397: 0 | AA397: 884 | AB397: 926 | AC397: =(AA397*100)/AB397 -> 95.464362850971924 | AD397: =(X397*4)+(Z397*2) -> 16
A398: CAULFIELD | C398: ROWE | F398: BRADY | I398: DE BONDE | L398: BAKER | O398: GOWANS | W398: WERRIBEE | X398: 2 | Y398: 7 | Z398: 0 | AA398: 712 | AB398: 852 | AC398: =(AA398*100)/AB398 -> 83.568075117370896 | AD398: =(X398*4)+(Z398*2) -> 8
A399: WERRIBEE | C399: CROMPTON | F399: HEMLEY | I399: CHIRGWIN | L399: ELLIS | O399: B SMITH | W399: CAULFIELD | X399: 2 | Y399: 7 | Z399: 0 | AA399: 651 | AB399: 812 | AC399: =(AA399*100)/AB399 -> 80.172413793103445 | AD399: =(X399*4)+(Z399*2) -> 8
A400: GOALKICKERS | W400: CAMBERWELL | X400: 1 | Y400: 8 | Z400: 0 | AA400: 771 | AB400: 988 | AC400: =(AA400*100)/AB400 -> 78.036437246963558 | AD400: =(X400*4)+(Z400*2) -> 4
A401: CAULFIELD | C401: ROWE 5 | F401: BAKER 3 | I401: BRADY 2 | K401: LACHMUND
A402: WERRIBEE | C402: CHIRGWIN 3 | F402: HEMLEY 2 | I402: HOOPER 2 | L402: CROMPTON | O402: JAMIESON
A404: OAKLEIGH | C404: 3 | D404: 2 | E404: =C404*6+D404 -> 20 | G404: 7 | H404: 10 | I404: =G404*6+H404 -> 52 | K404: 10 | L404: 19 | M404: =K404*6+L404 -> 79 | O404: 11 | P404: 23 | Q404: =O404*6+P404 -> 89 | S404: OAKLEIGH
A405: CAMBERWELL | C405: 2 | D405: 4 | E405: =C405*6+D405 -> 16 | G405: 3 | H405: 5 | I405: =G405*6+H405 -> 23 | K405: 6 | L405: 7 | M405: =K405*6+L405 -> 43 | O405: 8 | P405: 11 | Q405: =O405*6+P405 -> 59
A406: BEST PLAYERS
A407: OAKLEIGH | C407: LUFF | F407: TAN | I407: THOMAS | L407: LOTHIAN | O407: O'BRIEN | Q407: RITCHIE
A408: CAMBERWELL | C408: WINKLEMAN | F408: J SMITH | I408: JAMES | L408: DOUGLAS | O408: PECK
A409: GOALKICKERS
A410: OAKLEIGH | C410: LOTHIAN 3 | F410: CUMMING 2 | I410: LYONS 2 | K410: WAPLING 2 | N410: BURKE | P410: JORDAN
A411: CAMBERWELL | C411: WINKLEMAN 2 | F411: McNAMARA 2 | I411: DJORDEVIC | L411: FRIEBERG | N411: J SMITH | P411: WICKS
E412: 12TH JUNE | I412: WEATHER
A413: FRANKSTON | C413: 3 | D413: 6 | E413: =C413*6+D413 -> 24 | G413: 9 | H413: 8 | I413: =G413*6+H413 -> 62 | K413: 14 | L413: 11 | M413: =K413*6+L413 -> 95 | O413: 16 | P413: 19 | Q413: =O413*6+P413 -> 115 | S413: FRANKSTON
A414: NORTHCOTE | C414: 6 | D414: 3 | E414: =C414*6+D414 -> 39 | G414: 6 | H414: 9 | I414: =G414*6+H414 -> 45 | K414: 11 | L414: 9 | M414: =K414*6+L414 -> 75 | O414: 13 | P414: 11 | Q414: =O414*6+P414 -> 89
A415: BEST PLAYERS
A416: FRANKSTON | C416: SLADE | F416: BOWES | I416: GLEESON | L416: McHUGH | O416: COUTTS | Q416: BLAKE
A417: NORTHCOTE | C417: WHITE | F417: K HENRY | I417: WILSON | L417: HAAG | O417: EASTAWAY | R417: McBREEN
A418: GOALKICKERS
A419: FRANKSTON | C419: KERR 6 | F419: SLADE 4 | H419: BOWES 3 | J419: McHUGH 2 | M419: ELLIS | O419: BOWEN
A420: NORTHCOTE | C420: HAAG 5 | F420: WHITE 3 | H420: CRAMERI 2 | K420: WILSON | M420: SLEEP | O420: THOMPSON
A422: GEELONG WEST | C422: 6 | D422: 3 | E422: =C422*6+D422 -> 39 | G422: 11 | H422: 4 | I422: =G422*6+H422 -> 70 | K422: 14 | L422: 7 | M422: =K422*6+L422 -> 91 | O422: 17 | P422: 10 | Q422: =O422*6+P422 -> 112 | S422: BOX HILL
A423: BOX HILL | C423: 3 | D423: 0 | E423: =C423*6+D423 -> 18 | G423: 5 | H423: 5 | I423: =G423*6+H423 -> 35 | K423: 8 | L423: 7 | M423: =K423*6+L423 -> 55 | O423: 12 | P423: 12 | Q423: =O423*6+P423 -> 84
A424: BEST PLAYERS
A425: GEELONG WEST | C425: VAN T'HAG | F425: NUSTELING | I425: BRUSHFIELD | L425: THOMPSON | O425: HARRIS
A426: BOX HILL | C426: LOOMES | F426: BRYANT | I426: C FELLOWS
A427: GOALKICKERS
A428: GEELONG WEST | C428: NUSTELING 4 | F428: HARRIS 3 | I428: THOMPSON 3 | L428: BRUSHFIELD 2 | O428: O'DONNELL 2 | R428: GIBBONS | T428: HOVEY | V428: BARKER
A429: BOX HILL | C429: RALPH 4 | F429: BRYANT 2 | I429: C FELLOWS 2 | L429: GRAY | N429: LOOMES | P429: GREAVES | R429: 1 SHORT
A431: ROUND 10 | E431: 17TH JUNE | J431: WEATHER | S431: PLAYED AT
D432: 1ST QTR | H432: 2ND QTR | L432: 3RD QTR | P432: FINAL | S432: PRINCES PARK, CAULFIELD
A433: NORTHCOTE | C433: 3 | D433: 2 | E433: =C433*6+D433 -> 20 | G433: 5 | H433: 4 | I433: =G433*6+H433 -> 34 | K433: 12 | L433: 8 | M433: =K433*6+L433 -> 80 | O433: 19 | P433: 9 | Q433: =O433*6+P433 -> 123 | S433: UMPIRE | X433: LADDER | AB433: ROUND | AD433: 10
A434: CAULFIELD | C434: 1 | D434: 6 | E434: =C434*6+D434 -> 12 | G434: 4 | H434: 12 | I434: =G434*6+H434 -> 36 | K434: 8 | L434: 14 | M434: =K434*6+L434 -> 62 | O434: 9 | P434: 19 | Q434: =O434*6+P434 -> 73
A435: BEST PLAYERS | W435: TEAM | X435: W | Y435: L | Z435: D | AA435: FOR | AB435: AGST | AC435: % | AD435: PTS
A436: NORTHCOTE | C436: SLEEP | F436: K HENRY | I436: PITTS | L436: KEANE | N436: EASTAWAY | Q436: CRAMERI
A437: CAULFIELD | C437: ROWE | F437: MARSHALL | I437: CLARK | L437: GRIMMER | N437: PARK | Q437: LACHMUND | W437: GEELONG WEST | X437: 9 | Y437: 1 | Z437: 0 | AA437: 1120 | AB437: 769 | AC437: =(AA437*100)/AB437 -> 145.64369310793239 | AD437: =(X437*4)+(Z437*2) -> 36
A438: GOALKICKERS | W438: OAKLEIGH | X438: 8 | Y438: 2 | Z438: 0 | AA438: 943 | AB438: 806 | AC438: =(AA438*100)/AB438 -> 116.99751861042184 | AD438: =(X438*4)+(Z438*2) -> 32
A439: NORTHCOTE | C439: SLEEP 5 | F439: CRAMERI 3 | I439: CALVERLEY 3 | L439: HAAG 2 | N439: PITTS 2 | P439: KEANE 2 | R439: McBREEN | T439: ECCLES | W439: FRANKSTON | X439: 7 | Y439: 3 | Z439: 0 | AA439: 970 | AB439: 927 | AC439: =(AA439*100)/AB439 -> 104.638619201726 | AD439: =(X439*4)+(Z439*2) -> 28
A440: CAULFIELD | C440: GRIMMER 2 | F440: ROWE 2 | H440: PARK 2 | J440: LACHMUND | M440: AUGHTERSON | P440: BRADY | W440: SUNSHINE | X440: 5 | Y440: 4 | Z440: 1 | AA440: 786 | AB440: 786 | AC440: =(AA440*100)/AB440 -> 100 | AD440: =(X440*4)+(Z440*2) -> 22
A442: FRANKSTON | C442: 1 | D442: 3 | E442: =C442*6+D442 -> 9 | G442: 4 | H442: 7 | I442: =G442*6+H442 -> 31 | K442: 6 | L442: 10 | M442: =K442*6+L442 -> 46 | O442: 12 | P442: 14 | Q442: =O442*6+P442 -> 86 | S442: FRANKSTON | W442: MORDIALLOC | X442: 5 | Y442: 5 | Z442: 0 | AA442: 1006 | AB442: 957 | AC442: =(AA442*100)/AB442 -> 105.1201671891327 | AD442: =(X442*4)+(Z442*2) -> 20
A443: GEELONG WEST | C443: 1 | D443: 2 | E443: =C443*6+D443 -> 8 | G443: 3 | H443: 5 | I443: =G443*6+H443 -> 23 | K443: 8 | L443: 6 | M443: =K443*6+L443 -> 54 | O443: 11 | P443: 6 | Q443: =O443*6+P443 -> 72 | W443: NORTHCOTE | X443: 5 | Y443: 5 | Z443: 0 | AA443: 1007 | AB443: 999 | AC443: =(AA443*100)/AB443 -> 100.8008008008008 | AD443: =(X443*4)+(Z443*2) -> 20
A444: BEST PLAYERS | W444: BOX HILL | X444: 4 | Y444: 6 | Z444: 0 | AA444: 942 | AB444: 962 | AC444: =(AA444*100)/AB444 -> 97.92099792099792 | AD444: =(X444*4)+(Z444*2) -> 16
A445: FRANKSTON | C445: SLADE | F445: SHEPHERD | I445: McHUGH | L445: BOWES | N445: BLACK | Q445: SADDINGTON | W445: WERRIBEE | X445: 2 | Y445: 7 | Z445: 1 | AA445: 779 | AB445: 919 | AC445: =(AA445*100)/AB445 -> 84.766050054406961 | AD445: =(X445*4)+(Z445*2) -> 10
A446: GEELONG WEST | C446: HARRIS | F446: THOMSON | I446: NUSTELING | L446: RAEBURN | N446: PETERS | Q446: BIEN | W446: CAULFIELD | X446: 2 | Y446: 8 | Z446: 0 | AA446: 924 | AB446: 935 | AC446: =(AA446*100)/AB446 -> 98.82352941176471 | AD446: =(X446*4)+(Z446*2) -> 8
A447: GOALKICKERS | W447: CAMBERWELL | X447: 2 | Y447: 8 | Z447: 0 | AA447: 866 | AB447: 1074 | AC447: =(AA447*100)/AB447 -> 80.633147113594035 | AD447: =(X447*4)+(Z447*2) -> 8
A448: FRANKSTON | C448: McHUGH 2 | F448: SLADE 2 | H448: BOWES 2 | J448: KERR 2 | L448: LEE 2 | N448: E ? 1 | P448: ELLIS
A449: GEELONG WEST | C449: NUSTELING 3 | F449: THOMSON 3 | I449: HARRIS 2 | K449: O'DONNELL | N449: BIEN | P449: BRUSHFIELD
A451: CAMBERWELL | C451: 1 | D451: 2 | E451: =C451*6+D451 -> 8 | G451: 7 | H451: 7 | I451: =G451*6+H451 -> 49 | K451: 11 | L451: 9 | M451: =K451*6+L451 -> 75 | O451: 14 | P451: 11 | Q451: =O451*6+P451 -> 95 | S451: BOX HILL
A452: BOX HILL | C452: 6 | D452: 4 | E452: =C452*6+D452 -> 40 | G452: 8 | H452: 7 | I452: =G452*6+H452 -> 55 | K452: 11 | L452: 11 | M452: =K452*6+L452 -> 77 | O452: 12 | P452: 14 | Q452: =O452*6+P452 -> 86
A453: BEST PLAYERS
A454: CAMBERWELL | C454: WICKS | F454: WINKLEMAN | I454: McNAMARA | L454: BOYD | Q454: DOCKER
A455: BOX HILL | C455: RALPH | F455: GREAVES | I455: FELTHAM | L455: C FELLOWS | O455: LOOMES | Q455: BRYANT
A456: GOALKICKERS
A457: CAMBERWELL | C457: WICKS 6 | E457: McNAMARA 3 | H457: WINKLEMAN | K457: VINEY | M457: DELANTY | O457: BOYD | Q457: I BATES
A458: BOX HILL | C458: RALPH 3 | F458: GREAVES 3 | I458: FELTHAM 2 | L458: C FELLOWS 2 | O458: BRYANT | Q458: INNES
A460: OAKLEIGH | C460: 2 | D460: 6 | E460: =C460*6+D460 -> 18 | G460: 7 | H460: 11 | I460: =G460*6+H460 -> 53 | K460: 13 | L460: 18 | M460: =K460*6+L460 -> 96 | O460: 18 | P460: 20 | Q460: =O460*6+P460 -> 128 | S460: OAKLEIGH
A461: MORDIALLOC | C461: 0 | D461: 2 | E461: =C461*6+D461 -> 2 | G461: 2 | H461: 4 | I461: =G461*6+H461 -> 16 | K461: 5 | L461: 6 | M461: =K461*6+L461 -> 36 | O461: 11 | P461: 8 | Q461: =O461*6+P461 -> 74
A462: BEST PLAYERS
A463: OAKLEIGH | C463: FORD | F463: WAPLING | I463: HARRISON | L463: LOGAN | O463: CUMMING
A464: MORDIALLOC | C464: BIBRON | F464: RIDDLE | I464: POWER | L464: DANCKERT | O464: BACKMAN
A465: GOALKICKERS
A466: OAKLEIGH | C466: CUMMING 4 | F466: WAPLING 3 | I466: LYONS 3 | K466: LOTHIAN 2 | N466: FORD 2 | P466: BELL 2 | R466: HAINING
A467: MORDIALLOC | C467: POWER 6 | F467: BACKMAN 2 | I467: WILLIS | K467: TULLS | M467: SHIREFFS
A469: WERRIBEE | C469: 1 | D469: 5 | E469: =C469*6+D469 -> 11 | G469: 3 | H469: 8 | I469: =G469*6+H469 -> 26 | K469: 6 | L469: 14 | M469: =K469*6+L469 -> 50 | O469: 8 | P469: 19 | Q469: =O469*6+P469 -> 67 | S469: WERRIBEE
A470: SUNSHINE | C470: 3 | D470: 2 | E470: =C470*6+D470 -> 20 | G470: 5 | H470: 6 | I470: =G470*6+H470 -> 36 | K470: 7 | L470: 13 | M470: =K470*6+L470 -> 55 | O470: 9 | P470: 13 | Q470: =O470*6+P470 -> 67
A471: BEST PLAYERS
A472: WERRIBEE | C472: HOOPER | F472: SHEAHAN | I472: SPIERS | L472: ANDERSON | O472: DOVE | Q472: BRYAN
A473: SUNSHINE | C473: CROSBIE | F473: TREZISE | I473: CL | L473: DARUL | O473: HIPWORTH | Q473: CURRIE
A474: GOALKICKERS
A475: WERRIBEE | C475: HOOPER 3 | F475: HEMLEY 2 | I475: CHIRGWIN | L475: SHEAHAN | O475: B ? 1
A476: SUNSHINE | C476: HARRIS 3 | F476: SLATTERY 2 | I476: TREZISE | K476: CURRIE | M476: MUNROE | O476: HIPWORTH
A478: ROUND 11 | E478: 24TH JUNE | J478: WEATHER | S478: PLAYED AT
D479: 1ST QTR | H479: 2ND QTR | L479: 3RD QTR | P479: FINAL | S479: SUNSHINE
A480: OAKLEIGH | C480: 5 | D480: 4 | E480: =C480*6+D480 -> 34 | G480: 8 | H480: 8 | I480: =G480*6+H480 -> 56 | K480: 13 | L480: 13 | M480: =K480*6+L480 -> 91 | O480: 14 | P480: 16 | Q480: =O480*6+P480 -> 100 | S480: UMPIRE | X480: LADDER | AB480: ROUND | AD480: 11
A481: SUNSHINE | C481: 1 | D481: 1 | E481: =C481*6+D481 -> 7 | G481: 3 | H481: 7 | I481: =G481*6+H481 -> 25 | K481: 4 | L481: 9 | M481: =K481*6+L481 -> 33 | O481: 9 | P481: 13 | Q481: =O481*6+P481 -> 67
A482: BEST PLAYERS | W482: TEAM | X482: W | Y482: L | Z482: D | AA482: FOR | AB482: AGST | AC482: % | AD482: PTS
A483: OAKLEIGH | C483: CUMMING | F483: WAPLING | I483: RITCHIE | L483: LYONS | N483: O'BRIEN | Q483: McCORKELL
A484: SUNSHINE | C484: McGARRITY | F484: DARUL | I484: HIPWORTH | L484: CROSBIE | N484: TREZISE | Q484: CURRIE | W484: GEELONG WEST | X484: 10 | Y484: 1 | Z484: 0 | AA484: 1270 | AB484: 867 | AC484: =(AA484*100)/AB484 -> 146.48212226066897 | AD484: =(X484*4)+(Z484*2) -> 40
A485: GOALKICKERS | W485: OAKLEIGH | X485: 9 | Y485: 2 | Z485: 0 | AA485: 1043 | AB485: 873 | AC485: =(AA485*100)/AB485 -> 119.47308132875143 | AD485: =(X485*4)+(Z485*2) -> 36
A486: OAKLEIGH | C486: CUMMING 5 | F486: WAPLING 3 | I486: LOTHIAN 2 | L486: JORDAN 2 | N486: McCORKELL | Q486: LUFF | W486: FRANKSTON | X486: 8 | Y486: 3 | Z486: 0 | AA486: 1065 | AB486: 1001 | AC486: =(AA486*100)/AB486 -> 106.39360639360639 | AD486: =(X486*4)+(Z486*2) -> 32
A487: SUNSHINE | C487: WISE 2 | E487: LEGAWICZ 2 | H487: CROSBIE 2 | J487: CURRIE | L487: TREZISE | N487: DODD | W487: MORDIALLOC | X487: 6 | Y487: 5 | Z487: 0 | AA487: 1125 | AB487: 1043 | AC487: =(AA487*100)/AB487 -> 107.86193672099712 | AD487: =(X487*4)+(Z487*2) -> 24
A489: MORDIALLOC | C489: 4 | D489: 0 | E489: =C489*6+D489 -> 24 | G489: 6 | H489: 4 | I489: =G489*6+H489 -> 40 | K489: 12 | L489: 9 | M489: =K489*6+L489 -> 81 | O489: 18 | P489: 11 | Q489: =O489*6+P489 -> 119 | S489: MORDIALLOC | W489: SUNSHINE | X489: 5 | Y489: 5 | Z489: 1 | AA489: 853 | AB489: 886 | AC489: =(AA489*100)/AB489 -> 96.27539503386005 | AD489: =(X489*4)+(Z489*2) -> 22
A490: BOX HILL | C490: 3 | D490: 4 | E490: =C490*6+D490 -> 22 | G490: 6 | H490: 7 | I490: =G490*6+H490 -> 43 | K490: 10 | L490: 8 | M490: =K490*6+L490 -> 68 | O490: 13 | P490: 8 | Q490: =O490*6+P490 -> 86 | W490: NORTHCOTE | X490: 5 | Y490: 6 | Z490: 0 | AA490: 1085 | AB490: 1097 | AC490: =(AA490*100)/AB490 -> 98.906107566089332 | AD490: =(X490*4)+(Z490*2) -> 20
A491: BEST PLAYERS | W491: BOX HILL | X491: 4 | Y491: 7 | Z491: 0 | AA491: 1028 | AB491: 1081 | AC491: =(AA491*100)/AB491 -> 95.097132284921372 | AD491: =(X491*4)+(Z491*2) -> 16
A492: MORDIALLOC | C492: POWER | F492: BACKMAN | I492: LAIRD | L492: CAREY | N492: HYNES | Q492: THOMPSON | W492: WERRIBEE | X492: 3 | Y492: 7 | Z492: 1 | AA492: 877 | AB492: 997 | AC492: =(AA492*100)/AB492 -> 87.963891675025081 | AD492: =(X492*4)+(Z492*2) -> 14
A493: BOX HILL | C493: O'NEILL | F493: GRAY | I493: FELTHAM | L493: FELLOWS | N493: BAKER | Q493: WALES | W493: CAULFIELD | X493: 2 | Y493: 9 | Z493: 0 | AA493: 1022 | AB493: 1085 | AC493: =(AA493*100)/AB493 -> 94.193548387096769 | AD493: =(X493*4)+(Z493*2) -> 8
A494: GOALKICKERS | W494: CAMBERWELL | X494: 2 | Y494: 9 | Z494: 0 | AA494: 940 | AB494: 1169 | AC494: =(AA494*100)/AB494 -> 80.410607356715147 | AD494: =(X494*4)+(Z494*2) -> 8
A495: MORDIALLOC | C495: CAREY 5 | E495: POWER 5 | G495: BACKMAN 3 | J495: THOMPSON 2 | M495: HYNES | O495: GRANGER | R495: LESLIE
A496: BOX HILL | C496: RONALDSON 3 | G496: GREAVES 3 | I496: FELLOWS 2 | L496: FELTHAM 2 | N496: MACKO 2 | Q496: I BATES
A498: FRANKSTON | C498: 4 | D498: 5 | E498: =C498*6+D498 -> 29 | G498: 8 | H498: 11 | I498: =G498*6+H498 -> 59 | K498: 10 | L498: 14 | M498: =K498*6+L498 -> 74 | O498: 13 | P498: 17 | Q498: =O498*6+P498 -> 95 | S498: CAMBERWELL
A499: CAMBERWELL | C499: 3 | D499: 3 | E499: =C499*6+D499 -> 21 | G499: 3 | H499: 4 | I499: =G499*6+H499 -> 22 | K499: 10 | L499: 7 | M499: =K499*6+L499 -> 67 | O499: 11 | P499: 8 | Q499: =O499*6+P499 -> 74
A500: BEST PLAYERS
A501: FRANKSTON | C501: PAYNE | F501: ELLIS | I501: BLAKE | L501: COUTTS | N501: MARTELLO | Q501: BOWES
A502: CAMBERWELL | C502: SMITH | F502: FRIEBERG | I502: McNAMARA | L502: BOYD | N502: WICKS | Q502: DJORDEVIC
A503: GOALKICKERS
A504: FRANKSTON | C504: PAYNE 5 | F504: SLADE 3 | I504: BOWES 2 | K504: McNAUGHT | N504: LEE | P504: KERR
A505: CAMBERWELL | C505: WICKS 2 | F505: DJORDEVIC 2 | I505: McNAMARA 2 | L505: BOYD 2 | N505: VINEY | P505: FRIEBERG | R505: JAMES
A507: GEELONG WEST | C507: 5 | D507: 5 | E507: =C507*6+D507 -> 35 | G507: 11 | H507: 9 | I507: =G507*6+H507 -> 75 | K507: 16 | L507: 13 | M507: =K507*6+L507 -> 109 | O507: 22 | P507: 18 | Q507: =O507*6+P507 -> 150 | S507: GEELONG WEST
A508: CAULFIELD | C508: 3 | D508: 6 | E508: =C508*6+D508 -> 24 | G508: 5 | H508: 10 | I508: =G508*6+H508 -> 40 | K508: 7 | L508: 16 | M508: =K508*6+L508 -> 58 | O508: 13 | P508: 20 | Q508: =O508*6+P508 -> 98
A509: BEST PLAYERS
A510: GEELONG WEST | C510: GROVES | F510: NUSTELING | I510: BRUSHFIELD | L510: RAEBURN | N510: STACEY | Q510: BARKER
A511: CAULFIELD | C511: WILLIAMS | F511: CLARK | I511: GOWANS | L511: ARRELL | N511: COLLINS | Q511: ROWE
A512: GOALKICKERS
A513: GEELONG WEST | C513: NUSTELING 7 | F513: BRUSHFIELD 4 | I513: STACEY 4 | K513: HARRIS 3 | N513: GROVES 2 | P513: KEAYS | R513: BUSH
A514: CAULFIELD | C514: GRIMMER 4 | F514: BRADY 2 | I514: ROWE 2 | K514: WILLIAMS 2 | N514: DE BONDE | Q514: BAKER | S514: PARK
A516: WERRIBEE | C516: 2 | D516: 2 | E516: =C516*6+D516 -> 14 | G516: 6 | H516: 3 | I516: =G516*6+H516 -> 39 | K516: 9 | L516: 6 | M516: =K516*6+L516 -> 60 | O516: 15 | P516: 8 | Q516: =O516*6+P516 -> 98 | S516: NORTHCOTE
A517: NORTHCOTE | C517: 5 | D517: 5 | E517: =C517*6+D517 -> 35 | G517: 9 | H517: 9 | I517: =G517*6+H517 -> 63 | K517: 11 | L517: 9 | M517: =K517*6+L517 -> 75 | O517: 11 | P517: 12 | Q517: =O517*6+P517 -> 78
A518: BEST PLAYERS
A519: WERRIBEE | C519: ELLIS | F519: BRYANT | I519: ANDERSON | L519: CROMPTON | O519: HOOPER | R519: B SMITH
A520: NORTHCOTE | C520: K HENRY | F520: BRYANT | I520: NICHOLSON | L520: EASTAWAY | O520: SLEEP | R520: KEANE
A521: GOALKICKERS
A522: WERRIBEE | C522: CHIRGWIN 4 | F522: HEMLEY 3 | I522: HOOPER 3 | K522: BRYAN 2 | M522: ELLIS | O522: DENT | Q522: LYONS
A523: NORTHCOTE | C523: NICHOLSON 4 | F523: SLEEP 2 | I523: ECCLES 2 | K523: CRAMERI | M523: HAAG
A525: ROUND 12 | E525: 1ST JULY | J525: WEATHER | S525: PLAYED AT
D526: 1ST QTR | H526: 2ND QTR | L526: 3RD QTR | P526: FINAL | S526: PRINCES PARK, CAULFIELD
A527: CAULFIELD | C527: 2 | D527: 4 | E527: =C527*6+D527 -> 16 | G527: 5 | H527: 11 | I527: =G527*6+H527 -> 41 | K527: 9 | L527: 18 | M527: =K527*6+L527 -> 72 | O527: 11 | P527: 27 | Q527: =O527*6+P527 -> 93 | S527: UMPIRE | X527: LADDER | AB527: ROUND | AD527: 12
A528: CAMBERWELL | C528: 3 | D528: 3 | E528: =C528*6+D528 -> 21 | G528: 4 | H528: 11 | I528: =G528*6+H528 -> 35 | K528: 10 | L528: 13 | M528: =K528*6+L528 -> 73 | O528: 12 | P528: 16 | Q528: =O528*6+P528 -> 88
A529: BEST PLAYERS | W529: TEAM | X529: W | Y529: L | Z529: D | AA529: FOR | AB529: AGST | AC529: % | AD529: PTS
A530: CAULFIELD | C530: BRADY | F530: CLARK | I530: BAKER | L530: ROWE | O530: GOWANS | R530: LOGAN
A531: CAMBERWELL | C531: WICKS | F531: FRIEBERG | I531: McNAMARA | L531: DELANTY | O531: ALLISON | W531: GEELONG WEST | X531: 10 | Y531: 2 | Z531: 0 | AA531: 1341 | AB531: 947 | AC531: =(AA531*100)/AB531 -> 141.60506863780358 | AD531: =(X531*4)+(Z531*2) -> 40
A532: GOALKICKERS | W532: OAKLEIGH | X532: 9 | Y532: 3 | Z532: 0 | AA532: 1133 | AB532: 968 | AC532: =(AA532*100)/AB532 -> 117.04545454545455 | AD532: =(X532*4)+(Z532*2) -> 36
A533: CAULFIELD | C533: BRADY 5 | E533: GOWANS 3 | H533: LOGAN 2 | K533: LOGAN | W533: FRANKSTON | X533: 9 | Y533: 3 | Z533: 0 | AA533: 1146 | AB533: 1077 | AC533: =(AA533*100)/AB533 -> 106.40668523676881 | AD533: =(X533*4)+(Z533*2) -> 36
A534: CAMBERWELL | C534: WICKS 5 | E534: DELANTY 2 | H534: BOYD 2 | J534: DJORDEVIC | M534: McNAMARA | P534: FRIEBERG | W534: SUNSHINE | X534: 6 | Y534: 5 | Z534: 1 | AA534: 944 | AB534: 936 | AC534: =(AA534*100)/AB534 -> 100.85470085470085 | AD534: =(X534*4)+(Z534*2) -> 26
A536: FRANKSTON | C536: 2 | D536: 2 | E536: =C536*6+D536 -> 14 | G536: 5 | H536: 8 | I536: =G536*6+H536 -> 38 | K536: 7 | L536: 12 | M536: =K536*6+L536 -> 54 | O536: 11 | P536: 15 | Q536: =O536*6+P536 -> 81 | S536: FRANKSTON | W536: MORDIALLOC | X536: 6 | Y536: 6 | Z536: 0 | AA536: 1201 | AB536: 1124 | AC536: =(AA536*100)/AB536 -> 106.85053380782918 | AD536: =(X536*4)+(Z536*2) -> 24
A537: MORDIALLOC | C537: 3 | D537: 3 | E537: =C537*6+D537 -> 21 | G537: 5 | H537: 10 | I537: =G537*6+H537 -> 40 | K537: 8 | L537: 13 | M537: =K537*6+L537 -> 61 | O537: 10 | P537: 16 | Q537: =O537*6+P537 -> 76 | W537: NORTHCOTE | X537: 6 | Y537: 6 | Z537: 0 | AA537: 1165 | AB537: 1168 | AC537: =(AA537*100)/AB537 -> 99.743150684931507 | AD537: =(X537*4)+(Z537*2) -> 24
A538: BEST PLAYERS | W538: WERRIBEE | X538: 4 | Y538: 7 | Z538: 1 | AA538: 972 | AB538: 1087 | AC538: =(AA538*100)/AB538 -> 89.420423183072671 | AD538: =(X538*4)+(Z538*2) -> 18
A539: FRANKSTON | C539: SHOOINGTON | F539: BLAKE | I539: SLADE | L539: KERR | O539: McHUGH | R539: LEWIS | W539: BOX HILL | X539: 4 | Y539: 8 | Z539: 0 | AA539: 1078 | AB539: 1172 | AC539: =(AA539*100)/AB539 -> 91.979522184300336 | AD539: =(X539*4)+(Z539*2) -> 16
A540: MORDIALLOC | C540: WILLIAMS | F540: BLAINEY | I540: DANCKERT | L540: LAIRD | O540: POWER | R540: SCAIFFE | W540: CAULFIELD | X540: 3 | Y540: 9 | Z540: 0 | AA540: 1115 | AB540: 1173 | AC540: =(AA540*100)/AB540 -> 95.055413469735726 | AD540: =(X540*4)+(Z540*2) -> 12
A541: GOALKICKERS | W541: CAMBERWELL | X541: 2 | Y541: 10 | Z541: 0 | AA541: 1028 | AB541: 1262 | AC541: =(AA541*100)/AB541 -> 81.458003169572109 | AD541: =(X541*4)+(Z541*2) -> 8
A542: FRANKSTON | C542: PAYNE 2 | F542: BOWES 2 | I542: KERR 2 | K542: THATCHER | M542: SLADE | O542: ELLIS | Q542: McHUGH | S542: LEE
A543: MORDIALLOC | C543: POWER 5 | F543: STUDHAM 3 | I543: LESLIE | K543: CAREY
A545: SUNSHINE | C545: 3 | D545: 3 | E545: =C545*6+D545 -> 21 | G545: 4 | H545: 4 | I545: =G545*6+H545 -> 28 | K545: 9 | L545: 7 | M545: =K545*6+L545 -> 61 | O545: 13 | P545: 13 | Q545: =O545*6+P545 -> 91 | S545: BOX HILL
A546: BOX HILL | C546: 3 | D546: 2 | E546: =C546*6+D546 -> 20 | G546: 4 | H546: 4 | I546: =G546*6+H546 -> 28 | K546: 5 | L546: 6 | M546: =K546*6+L546 -> 36 | O546: 7 | P546: 8 | Q546: =O546*6+P546 -> 50
A547: BEST PLAYERS
A548: SUNSHINE | C548: CROSBIE | F548: TREZISE | I548: DARUL | L548: PLAIN | O548: HIPWORTH | R548: McGARRITY
A549: BOX HILL | C549: C FELLOWS | F549: G FELLOWS | I549: MILLER | L549: I BATES | O549: BAKER | R549: MACKE
A550: GOALKICKERS
A551: SUNSHINE | C551: CROSBIE 4 | F551: BANT 3 | H551: YOUNG 2 | J551: CURRIE | L551: POWER | N551: CLARKE | P551: WISE
A552: BOX HILL | C552: C FELLOWS 3 | F552: RONALDSON 2 | I552: BAKER | K552: LA ROCHE
A554: WERRIBEE | C554: 6 | D554: 1 | E554: =C554*6+D554 -> 37 | G554: 10 | H554: 4 | I554: =G554*6+H554 -> 64 | K554: 14 | L554: 10 | M554: =K554*6+L554 -> 94 | O554: 14 | P554: 11 | Q554: =O554*6+P554 -> 95 | S554: WERRIBEE
A555: OAKLEIGH | C555: 3 | D555: 4 | E555: =C555*6+D555 -> 22 | G555: 8 | H555: 10 | I555: =G555*6+H555 -> 58 | K555: 11 | L555: 13 | M555: =K555*6+L555 -> 79 | O555: 12 | P555: 18 | Q555: =O555*6+P555 -> 90
A556: BEST PLAYERS
A557: WERRIBEE | C557: GILLETT | F557: ELLIS | I557: HEMLEY | L557: HYLAND | O557: CROMPTON
A558: OAKLEIGH | C558: JORDAN | F558: FORD | I558: LYON | L558: WAPLING | O558: LUFF | Q558: LOTHIAN
A559: GOALKICKERS
A560: WERRIBEE | C560: HEMLEY 5 | F560: CROMPTON 2 | I560: LYONS 2 | K560: SHEAHAN 2 | N560: OGILVIE 2 | P560: CHIRGWIN
A561: OAKLEIGH | C561: LOTHIAN 5 | F561: FORD 2 | H561: JORDAN 2 | J561: HAINING 2 | M561: HARRISON
E562: 2ND JULY | I562: WEATHER
A563: NORTHCOTE | C563: 2 | D563: 1 | E563: =C563*6+D563 -> 13 | G563: 7 | H563: 2 | I563: =G563*6+H563 -> 44 | K563: 10 | L563: 8 | M563: =K563*6+L563 -> 68 | O563: 12 | P563: 8 | Q563: =O563*6+P563 -> 80 | S563: NORTHCOTE
A564: GEELONG WEST | C564: 2 | D564: 5 | E564: =C564*6+D564 -> 17 | G564: 5 | H564: 8 | I564: =G564*6+H564 -> 38 | K564: 10 | L564: 9 | M564: =K564*6+L564 -> 69 | O564: 10 | P564: 11 | Q564: =O564*6+P564 -> 71
A565: BEST PLAYERS
A566: NORTHCOTE | C566: R DEAN | F566: SLEEP | I566: M HENRY | L566: K HENRY | O566: KOZARIS | R566: SMITH
A567: GEELONG WEST | C567: RAEBURN | F567: SNELL | I567: HARRIS | L567: BIEN | O567: CRONIN | R567: BRUSHFIELD
A568: GOALKICKERS
A569: NORTHCOTE | C569: SLEEP 4 | F569: PITTS 3 | I569: R DEAN 2 | L569: ECCLES 2 | O569: UNDERWOOD
A570: GEELONG WEST | C570: HARRIS 3 | F570: BRUSHFIELD 2 | I570: BARKER 2 | L570: NUSTELING | O570: GROVES | Q570: THOMPSON
A572: ROUND 13 | E572: 8TH JULY | J572: WEATHER | S572: PLAYED AT
D573: 1ST QTR | H573: 2ND QTR | L573: 3RD QTR | P573: FINAL | S573: SUNSHINE
A574: SUNSHINE | C574: 2 | D574: 1 | E574: =C574*6+D574 -> 13 | G574: 9 | H574: 9 | I574: =G574*6+H574 -> 63 | K574: 10 | L574: 13 | M574: =K574*6+L574 -> 73 | O574: 14 | P574: 18 | Q574: =O574*6+P574 -> 102 | S574: UMPIRE | X574: LADDER | AB574: ROUND | AD574: 13
A575: FRANKSTON | C575: 1 | D575: 3 | E575: =C575*6+D575 -> 9 | G575: 1 | H575: 4 | I575: =G575*6+H575 -> 10 | K575: 5 | L575: 6 | M575: =K575*6+L575 -> 36 | O575: 5 | P575: 10 | Q575: =O575*6+P575 -> 40
A576: BEST PLAYERS | W576: TEAM | X576: W | Y576: L | Z576: D | AA576: FOR | AB576: AGST | AC576: % | AD576: PTS
A577: SUNSHINE | C577: CROSBIE | F577: TREZISE | I577: HIPWORTH | L577: McGARRITY | O577: DARUL | R577: POWER
A578: FRANKSTON | C578: PAYNE | F578: SLADE | I578: GLEESON | L578: LEE | O578: THATCHER | W578: GEELONG WEST | X578: 11 | Y578: 2 | Z578: 0 | AA578: 1465 | AB578: 1019 | AC578: =(AA578*100)/AB578 -> 143.76840039254171 | AD578: =(X578*4)+(Z578*2) -> 44
A579: GOALKICKERS | W579: OAKLEIGH | X579: 10 | Y579: 3 | Z579: 0 | AA579: 1239 | AB579: 1029 | AC579: =(AA579*100)/AB579 -> 120.40816326530613 | AD579: =(X579*4)+(Z579*2) -> 40
A580: SUNSHINE | C580: CROSBIE 4 | F580: POWER 3 | I580: HIPWORTH 2 | L580: SLATTERY 2 | N580: YOUNG | P580: BANT | R580: WISE | W580: FRANKSTON | X580: 9 | Y580: 4 | Z580: 0 | AA580: 1186 | AB580: 1179 | AC580: =(AA580*100)/AB580 -> 100.59372349448685 | AD580: =(X580*4)+(Z580*2) -> 36
A581: FRANKSTON | C581: PAYNE 2 | F581: LEE | H581: THATCHER | K581: BOWEN | W581: SUNSHINE | X581: 7 | Y581: 5 | Z581: 1 | AA581: 1046 | AB581: 976 | AC581: =(AA581*100)/AB581 -> 107.17213114754098 | AD581: =(X581*4)+(Z581*2) -> 30
A583: CAULFIELD | C583: 1 | D583: 3 | E583: =C583*6+D583 -> 9 | G583: 4 | H583: 6 | I583: =G583*6+H583 -> 30 | K583: 5 | L583: 9 | M583: =K583*6+L583 -> 39 | O583: 10 | P583: 12 | Q583: =O583*6+P583 -> 72 | S583: MORDIALLOC | W583: NORTHCOTE | X583: 7 | Y583: 6 | Z583: 0 | AA583: 1351 | AB583: 1274 | AC583: =(AA583*100)/AB583 -> 106.04395604395604 | AD583: =(X583*4)+(Z583*2) -> 28
A584: MORDIALLOC | C584: 2 | D584: 6 | E584: =C584*6+D584 -> 18 | G584: 3 | H584: 8 | I584: =G584*6+H584 -> 26 | K584: 5 | L584: 11 | M584: =K584*6+L584 -> 41 | O584: 6 | P584: 13 | Q584: =O584*6+P584 -> 49 | W584: MORDIALLOC | X584: 6 | Y584: 7 | Z584: 0 | AA584: 1250 | AB584: 1196 | AC584: =(AA584*100)/AB584 -> 104.51505016722408 | AD584: =(X584*4)+(Z584*2) -> 24
A585: BEST PLAYERS | W585: WERRIBEE | X585: 4 | Y585: 8 | Z585: 1 | AA585: 1044 | AB585: 1217 | AC585: =(AA585*100)/AB585 -> 85.784716516023011 | AD585: =(X585*4)+(Z585*2) -> 18
A586: CAULFIELD | C586: GRIMMER | F586: COLLINS | I586: McCOOKE | L586: BARKER | W586: CAULFIELD | X586: 4 | Y586: 9 | Z586: 0 | AA586: 1187 | AB586: 1222 | AC586: =(AA586*100)/AB586 -> 97.135842880523725 | AD586: =(X586*4)+(Z586*2) -> 16
A587: MORDIALLOC | C587: CAREY | F587: WILLIAMS | I587: POWER | L587: THOMPSON | O587: WILLIS | W587: BOX HILL | X587: 4 | Y587: 9 | Z587: 0 | AA587: 1139 | AB587: 1278 | AC587: =(AA587*100)/AB587 -> 89.123630672926453 | AD587: =(X587*4)+(Z587*2) -> 16
A588: GOALKICKERS | W588: CAMBERWELL | X588: 2 | Y588: 11 | Z588: 0 | AA588: 1074 | AB588: 1448 | AC588: =(AA588*100)/AB588 -> 74.171270718232037 | AD588: =(X588*4)+(Z588*2) -> 8
A589: CAULFIELD | C589: COLLINS 4 | F589: McCOOKE 2 | I589: GRIMMER | L589: GOWANS | N589: BAKER | Q589: 1
A590: MORDIALLOC | C590: CAREY 2 | F590: STUDHAM | I590: WILLIS | K590: DAVEY | M590: POWER
A592: OAKLEIGH | C592: 4 | D592: 4 | E592: =C592*6+D592 -> 28 | G592: 7 | H592: 9 | I592: =G592*6+H592 -> 51 | K592: 11 | L592: 12 | M592: =K592*6+L592 -> 78 | O592: 15 | P592: 16 | Q592: =O592*6+P592 -> 106 | S592: OAKLEIGH
A593: BOX HILL | C593: 3 | D593: 1 | E593: =C593*6+D593 -> 19 | G593: 4 | H593: 7 | I593: =G593*6+H593 -> 31 | K593: 6 | L593: 11 | M593: =K593*6+L593 -> 47 | O593: 8 | P593: 13 | Q593: =O593*6+P593 -> 61
A594: BEST PLAYERS
A595: OAKLEIGH | C595: JORDAN | F595: LOTHIAN | I595: LOGAN | L595: FORD | O595: BELL
A596: BOX HILL | C596: C FELLOWS | F596: DIXON | I596: O'NEILL | L596: FELTHAM | O596: I BATES
A597: GOALKICKERS
A598: OAKLEIGH | C598: JORDAN 6 | F598: LOTHIAN 3 | I598: WAPLING 3 | L598: LUFF 2 | N598: CUMMING
A599: BOX HILL | C599: FELTHAM 3 | F599: GRAY 2 | H599: CARROLL | J599: I BATES | L599: LOOMES
E600: 9TH JULY | I600: WEATHER
A601: NORTHCOTE | C601: 6 | D601: 7 | E601: =C601*6+D601 -> 43 | G601: 15 | H601: 14 | I601: =G601*6+H601 -> 104 | K601: 20 | L601: 19 | M601: =K601*6+L601 -> 139 | O601: 27 | P601: 24 | Q601: =O601*6+P601 -> 186 | S601: CAMBERWELL
A602: CAMBERWELL | C602: 0 | D602: 4 | E602: =C602*6+D602 -> 4 | G602: 2 | H602: 6 | I602: =G602*6+H602 -> 18 | K602: 4 | L602: 8 | M602: =K602*6+L602 -> 32 | O602: 6 | P602: 10 | Q602: =O602*6+P602 -> 46
A603: BEST PLAYERS
A604: NORTHCOTE | C604: KEANE | F604: MICKLESON | I604: M HENRY | L604: K HENRY | O604: OGILVIE | R604: THOMPSON
A605: CAMBERWELL | C605: J SMITH | F605: DELANTY | I605: McNAMARA | L605: DOCKER | O605: ALLISON
A606: GOALKICKERS
A607: NORTHCOTE | C607: MICKLESON 7 | F607: KEANE 6 | H607: SLEEP 5 | J607: K HENRY 2 | M607: THOMPSON 2 | P607: RORISON 2 | R607: KEAYS | T607: ECCLES | W607: PITTS
A608: CAMBERWELL | C608: McNAMARA 2 | F608: WITHERS | I608: ALLISON | K608: WICKS | M608: FRIEBERG
A610: GEELONG WEST | C610: 5 | D610: 4 | E610: =C610*6+D610 -> 34 | G610: 10 | H610: 6 | I610: =G610*6+H610 -> 66 | K610: 15 | L610: 8 | M610: =K610*6+L610 -> 98 | O610: 19 | P610: 10 | Q610: =O610*6+P610 -> 124 | S610: GEELONG WEST
A611: WERRIBEE | C611: 4 | D611: 5 | E611: =C611*6+D611 -> 29 | G611: 5 | H611: 6 | I611: =G611*6+H611 -> 36 | K611: 5 | L611: 10 | M611: =K611*6+L611 -> 40 | O611: 10 | P611: 12 | Q611: =O611*6+P611 -> 72
A612: BEST PLAYERS
A613: GEELONG WEST | C613: NUSTELING | F613: STACEY | I613: HETHERINGTON | L613: RAEBURN | O613: GIBBONS | R613: BIEN
A614: WERRIBEE | C614: SPIERS | F614: B SMITH | I614: SHEAHAN | L614: GILLETT | O614: HOOPER | R614: HOLCOMBE
A615: GOALKICKERS
A616: GEELONG WEST | C616: NUSTELING 10 | F616: HARRIS 3 | I616: McKAY 2 | K616: MOORE 2 | N616: BUSH | P616: GIBBONS
A617: WERRIBEE | C617: CHIRGWIN 4 | F617: HEMLEY 2 | I617: SHEAHAN 2 | L617: HOOPER | N617: GOULOPOLOUS
A619: ROUND 14 | E619: 15TH JULY | J619: WEATHER | S619: PLAYED AT
D620: 1ST QTR | H620: 2ND QTR | L620: 3RD QTR | P620: FINAL | S620: GEELONG WEST
A621: GEELONG WEST | C621: 6 | D621: 1 | E621: =C621*6+D621 -> 37 | G621: 12 | H621: 4 | I621: =G621*6+H621 -> 76 | K621: 18 | L621: 9 | M621: =K621*6+L621 -> 117 | O621: 28 | P621: 12 | Q621: =O621*6+P621 -> 180 | S621: UMPIRE | X621: LADDER | AB621: ROUND | AD621: 14
A622: CAMBERWELL | C622: 1 | D622: 2 | E622: =C622*6+D622 -> 8 | G622: 1 | H622: 4 | I622: =G622*6+H622 -> 10 | K622: 5 | L622: 5 | M622: =K622*6+L622 -> 35 | O622: 7 | P622: 7 | Q622: =O622*6+P622 -> 49
A623: BEST PLAYERS | W623: TEAM | X623: W | Y623: L | Z623: D | AA623: FOR | AB623: AGST | AC623: % | AD623: PTS
A624: GEELONG WEST | C624: WHITE | F624: NUSTELING | I624: HARRIS | L624: RAEBURN
A625: CAMBERWELL | C625: DELANTY | F625: ? | I625: KISS | L625: BRAYNE | O625: BOYD | W625: GEELONG WEST | X625: 12 | Y625: 2 | Z625: 0 | AA625: 1645 | AB625: 1068 | AC625: =(AA625*100)/AB625 -> 154.02621722846442 | AD625: =(X625*4)+(Z625*2) -> 48
A626: GOALKICKERS | L626: SNELL | N626: KEAYS | P626: SALTER | W626: OAKLEIGH | X626: 11 | Y626: 3 | Z626: 0 | AA626: 1328 | AB626: 1109 | AC626: =(AA626*100)/AB626 -> 119.74752028854824 | AD626: =(X626*4)+(Z626*2) -> 44
A627: GEELONG WEST | C627: NUSTELING 6 | F627: BUSH 4 | H627: WHITE 4 | J627: H ? 4 | L627: GIBBONS 2 | N627: STACEY 2 | P627: O'DONNELL 2 | S627: McKAY | W627: FRANKSTON | X627: 9 | Y627: 5 | Z627: 0 | AA627: 1266 | AB627: 1268 | AC627: =(AA627*100)/AB627 -> 99.84227129337539 | AD627: =(X627*4)+(Z627*2) -> 36
A628: CAMBERWELL | C628: McNAMARA 3 | F628: FRIEBERG 2 | I628: BOYD | K628: BRAYNE | W628: SUNSHINE | X628: 8 | Y628: 5 | Z628: 1 | AA628: 1170 | AB628: 1063 | AC628: =(AA628*100)/AB628 -> 110.06585136406397 | AD628: =(X628*4)+(Z628*2) -> 34
A630: NORTHCOTE | C630: 1 | D630: 4 | E630: =C630*6+D630 -> 10 | G630: 4 | H630: 8 | I630: =G630*6+H630 -> 32 | K630: 5 | L630: 14 | M630: =K630*6+L630 -> 44 | O630: 8 | P630: 17 | Q630: =O630*6+P630 -> 65 | S630: NORTHCOTE | W630: NORTHCOTE | X630: 8 | Y630: 6 | Z630: 0 | AA630: 1416 | AB630: 1321 | AC630: =(AA630*100)/AB630 -> 107.19152157456472 | AD630: =(X630*4)+(Z630*2) -> 32
A631: MORDIALLOC | C631: 3 | D631: 2 | E631: =C631*6+D631 -> 20 | G631: 4 | H631: 3 | I631: =G631*6+H631 -> 27 | K631: 6 | L631: 4 | M631: =K631*6+L631 -> 40 | O631: 7 | P631: 5 | Q631: =O631*6+P631 -> 47 | W631: MORDIALLOC | X631: 6 | Y631: 8 | Z631: 0 | AA631: 1297 | AB631: 1261 | AC631: =(AA631*100)/AB631 -> 102.85487708168121 | AD631: =(X631*4)+(Z631*2) -> 24
A632: BEST PLAYERS | W632: WERRIBEE | X632: 5 | Y632: 8 | Z632: 1 | AA632: 1145 | AB632: 1316 | AC632: =(AA632*100)/AB632 -> 87.006079027355625 | AD632: =(X632*4)+(Z632*2) -> 22
A633: NORTHCOTE | C633: KOZARIS | F633: OGILVIE | I633: K HENRY | L633: SMITH | N633: KEANE | W633: CAULFIELD | X633: 4 | Y633: 10 | Z633: 0 | AA633: 1274 | AB633: 1346 | AC633: =(AA633*100)/AB633 -> 94.650817236255577 | AD633: =(X633*4)+(Z633*2) -> 16
A634: MORDIALLOC | C634: VAUGHAN | F634: COLLEY | I634: GROVES | L634: WILSON | W634: BOX HILL | X634: 4 | Y634: 10 | Z634: 0 | AA634: 1238 | AB634: 1379 | AC634: =(AA634*100)/AB634 -> 89.775199419869466 | AD634: =(X634*4)+(Z634*2) -> 16
A635: GOALKICKERS | W635: CAMBERWELL | X635: 2 | Y635: 12 | Z635: 0 | AA635: 1123 | AB635: 1628 | AC635: =(AA635*100)/AB635 -> 68.980343980343974 | AD635: =(X635*4)+(Z635*2) -> 8
A636: NORTHCOTE | C636: M ? 2 | F636: SLEEP | H636: KEANE | J636: CALVERLEY | M636: ? 1 | O636: KEAYS | Q636: KOZARIS
A637: MORDIALLOC | C637: BLAINEY 2 | F637: BACKMAN | I637: W ? 1 | L637: SCAIFFE | N637: POWER | P637: VAUGHAN
A639: SUNSHINE | C639: 8 | D639: 5 | E639: =C639*6+D639 -> 53 | G639: 9 | H639: 6 | I639: =G639*6+H639 -> 60 | K639: 15 | L639: 13 | M639: =K639*6+L639 -> 103 | O639: 18 | P639: 16 | Q639: =O639*6+P639 -> 124 | S639: PRINCES PARK, CAULFIELD
A640: CAULFIELD | C640: 0 | D640: 2 | E640: =C640*6+D640 -> 2 | G640: 7 | H640: 7 | I640: =G640*6+H640 -> 49 | K640: 8 | L640: 8 | M640: =K640*6+L640 -> 56 | O640: 12 | P640: 15 | Q640: =O640*6+P640 -> 87
A641: BEST PLAYERS
A642: SUNSHINE | C642: HIPWORTH | F642: POWER | I642: WISE | L642: McGARRITY | O642: S ? | Q642: TREZISE
A643: CAULFIELD | C643: GOWANS | F643: LACHMUND | I643: ROWE | L643: STONE | O643: CLARK
A644: GOALKICKERS
A645: SUNSHINE | C645: CIOS 3 | E645: SLATTERY 3 | H645: TREZISE 2 | J645: HIPWORTH 2 | M645: POWER 2 | O645: BANT 2 | Q645: WISE 2 | S645: B 1 | V645: CURRIE
A646: CAULFIELD | C646: LACHMUND 7 | F646: POWER | I646: GRIMMER | L646: HUNT | N646: GOWANS | Q646: MELBOURNE
A648: OAKLEIGH | C648: 3 | D648: 1 | E648: =C648*6+D648 -> 19 | G648: 3 | H648: 8 | I648: =G648*6+H648 -> 26 | K648: 11 | L648: 10 | M648: =K648*6+L648 -> 76 | O648: 13 | P648: 11 | Q648: =O648*6+P648 -> 89 | S648: FRANKSTON
A649: FRANKSTON | C649: 3 | D649: 3 | E649: =C649*6+D649 -> 21 | G649: 8 | H649: 6 | I649: =G649*6+H649 -> 54 | K649: 11 | L649: 7 | M649: =K649*6+L649 -> 73 | O649: 12 | P649: 8 | Q649: =O649*6+P649 -> 80
A650: BEST PLAYERS
A651: OAKLEIGH | C651: LOTHIAN | F651: McCORKELL | I651: FORD | L651: SHERIDAN | O651: TEGG | Q651: TRAILL
A652: FRANKSTON | C652: ? | F652: COUTTS | I652: SLADE | L652: LEE | O652: THATCHER
A653: GOALKICKERS
A654: OAKLEIGH | C654: LOTHIAN 5 | F654: SHERIDAN 3 | I654: WAPLING 3 | L654: CUMMING | O654: JORDAN
A655: FRANKSTON | C655: SLADE 3 | F655: BOWEN 3 | I655: QUINN 2 | K655: LEE | L655: THATCHER | O655: GLEESON | Q655: BENNETT
A657: WERRIBEE | C657: 2 | D657: 1 | E657: =C657*6+D657 -> 13 | G657: 5 | H657: 8 | I657: =G657*6+H657 -> 38 | K657: 8 | L657: 10 | M657: =K657*6+L657 -> 58 | O657: 15 | P657: 11 | Q657: =O657*6+P657 -> 101 | S657: BOX HILL
A658: BOX HILL | C658: 7 | D658: 3 | E658: =C658*6+D658 -> 45 | G658: 8 | H658: 4 | I658: =G658*6+H658 -> 52 | K658: 12 | L658: 12 | M658: =K658*6+L658 -> 84 | O658: 14 | P658: 15 | Q658: =O658*6+P658 -> 99
A659: BEST PLAYERS
A660: WERRIBEE | C660: HEMLEY | F660: ? | I660: STUART | L660: ANDERSON | O660: JAMIESON
A661: BOX HILL | C661: C FELLOWS | F661: G FELLOWS | I661: CARROLL | L661: BRYANT | O661: N BATES
A662: GOALKICKERS
A663: WERRIBEE | C663: HEMLEY 5 | F663: TRAINION 3 | I663: HOOPER 2 | K663: SHEAHAN 2 | N663: LYONS | P663: STUART | R663: GOULOPOLOUS
A664: BOX HILL | C664: CARROLL 5 | F664: I BATES 2 | I664: C FELLOWS 2 | L664: BRYANT 2 | N664: LOOMES | P664: ? 1 | R664: VERNON
A666: ROUND 15 | E666: 22ND JULY | J666: WEATHER | S666: PLAYED AT
D667: 1ST QTR | H667: 2ND QTR | L667: 3RD QTR | P667: FINAL | S667: SUNSHINE
A668: SUNSHINE | C668: 8 | D668: 4 | E668: =C668*6+D668 -> 52 | G668: 11 | H668: 7 | I668: =G668*6+H668 -> 73 | K668: 14 | L668: 7 | M668: =K668*6+L668 -> 91 | O668: 16 | P668: 12 | Q668: =O668*6+P668 -> 108 | S668: UMPIRE | X668: LADDER | AB668: ROUND | AD668: 15
A669: NORTHCOTE | C669: 2 | D669: 1 | E669: =C669*6+D669 -> 13 | G669: 4 | H669: 2 | I669: =G669*6+H669 -> 26 | K669: 11 | L669: 7 | M669: =K669*6+L669 -> 73 | O669: 13 | P669: 10 | Q669: =O669*6+P669 -> 88
A670: BEST PLAYERS | W670: TEAM | X670: W | Y670: L | Z670: D | AA670: FOR | AB670: AGST | AC670: % | AD670: PTS
A671: SUNSHINE | C671: TARCZON | F671: BANT | I671: BENSON | L671: DARUL | N671: POWER | Q671: McGARRITY
A672: NORTHCOTE | C672: K HENRY | F672: KOZARIS | I672: EASTAWAY | L672: OGILVIE | N672: SLEEP | Q672: M HENRY | W672: GEELONG WEST | X672: 12 | Y672: 3 | Z672: 0 | AA672: 1734 | AB672: 1174 | AC672: =(AA672*100)/AB672 -> 147.70017035775129 | AD672: =(X672*4)+(Z672*2) -> 48
A673: GOALKICKERS | W673: OAKLEIGH | X673: 12 | Y673: 3 | Z673: 0 | AA673: 1436 | AB673: 1196 | AC673: =(AA673*100)/AB673 -> 120.06688963210702 | AD673: =(X673*4)+(Z673*2) -> 48
A674: SUNSHINE | C674: BANT 5 | F674: BENSON 4 | I674: POWER 3 | K674: WISE 2 | M674: YOUNG | O674: HARRIS | W674: FRANKSTON | X674: 10 | Y674: 5 | Z674: 0 | AA674: 1399 | AB674: 1368 | AC674: =(AA674*100)/AB674 -> 102.26608187134502 | AD674: =(X674*4)+(Z674*2) -> 40
A675: NORTHCOTE | C675: SLEEP 3 | E675: KEANE 2 | G675: MICKLESON 2 | J675: OGILVIE 2 | M675: MUIR 2 | O675: DEAN | Q675: M HENRY | W675: SUNSHINE | X675: 9 | Y675: 5 | Z675: 1 | AA675: 1278 | AB675: 1151 | AC675: =(AA675*100)/AB675 -> 111.03388357949609 | AD675: =(X675*4)+(Z675*2) -> 38
A677: MORDIALLOC | C677: 0 | D677: 0 | E677: =C677*6+D677 -> 0 | G677: 0 | H677: 0 | I677: =G677*6+H677 -> 0 | K677: 0 | L677: 0 | M677: =K677*6+L677 -> 0 | O677: 16 | P677: 10 | Q677: =O677*6+P677 -> 106 | S677: MORDIALLOC | W677: NORTHCOTE | X677: 8 | Y677: 7 | Z677: 0 | AA677: 1504 | AB677: 1429 | AC677: =(AA677*100)/AB677 -> 105.24842547235829 | AD677: =(X677*4)+(Z677*2) -> 32
A678: GEELONG WEST | C678: 0 | D678: 0 | E678: =C678*6+D678 -> 0 | G678: 0 | H678: 0 | I678: =G678*6+H678 -> 0 | K678: 0 | L678: 0 | M678: =K678*6+L678 -> 0 | O678: 13 | P678: 11 | Q678: =O678*6+P678 -> 89 | W678: MORDIALLOC | X678: 7 | Y678: 8 | Z678: 0 | AA678: 1403 | AB678: 1350 | AC678: =(AA678*100)/AB678 -> 103.92592592592592 | AD678: =(X678*4)+(Z678*2) -> 28
A679: BEST PLAYERS | W679: WERRIBEE | X679: 6 | Y679: 8 | Z679: 1 | AA679: 1286 | AB679: 1409 | AC679: =(AA679*100)/AB679 -> 91.270404542228533 | AD679: =(X679*4)+(Z679*2) -> 26
A680: MORDIALLOC | C680: BACKMAN | F680: LESLIE | I680: DANCKERT | L680: WILLIAMSON | O680: HOBSON | Q680: VAUGHAN | W680: CAULFIELD | X680: 4 | Y680: 11 | Z680: 0 | AA680: 1361 | AB680: 1454 | AC680: =(AA680*100)/AB680 -> 93.603851444291607 | AD680: =(X680*4)+(Z680*2) -> 16
A681: GEELONG WEST | C681: GIBBONS | F681: O'DONNELL | I681: RAEBURN | L681: STACEY | O681: VAN T'HAG | W681: BOX HILL | X681: 4 | Y681: 11 | Z681: 0 | AA681: 1338 | AB681: 1512 | AC681: =(AA681*100)/AB681 -> 88.492063492063494 | AD681: =(X681*4)+(Z681*2) -> 16
A682: GOALKICKERS | W682: CAMBERWELL | X682: 2 | Y682: 13 | Z682: 0 | AA682: 1216 | AB682: 1769 | AC682: =(AA682*100)/AB682 -> 68.739400791407576 | AD682: =(X682*4)+(Z682*2) -> 8
A683: MORDIALLOC | C683: POWER 6 | F683: BACKMAN 4 | I683: RIDDLE 3 | K683: THOMPSON 2 | N683: VAUGHAN
A684: GEELONG WEST | C684: GIBBONS 6 | F684: STACEY 2 | I684: BIEN | K684: O'DONNELL | N684: SNELL | P684: HARRIS | R684: MOORE
A686: FRANKSTON | C686: 9 | D686: 6 | E686: =C686*6+D686 -> 60 | G686: 15 | H686: 10 | I686: =G686*6+H686 -> 100 | K686: 17 | L686: 17 | M686: =K686*6+L686 -> 119 | O686: 19 | P686: 19 | Q686: =O686*6+P686 -> 133 | S686: BOX HILL
A687: BOX HILL | C687: 3 | D687: 2 | E687: =C687*6+D687 -> 20 | G687: 7 | H687: 5 | I687: =G687*6+H687 -> 47 | K687: 9 | L687: 7 | M687: =K687*6+L687 -> 61 | O687: 15 | P687: 10 | Q687: =O687*6+P687 -> 100
A688: BEST PLAYERS
A689: FRANKSTON | C689: HINES | F689: HEPNER | I689: THATCHER | L689: SLADE | O689: LEE | Q689: PAYNE
A690: BOX HILL | C690: VERNON | F690: CARROLL | I690: BAKER | L690: RALPH | O690: LOOMES | Q690: C FELLOWS
A691: GOALKICKERS
A692: FRANKSTON | C692: THATCHER 5 | F692: HINES 4 | H692: PAYNE 3 | J692: LEE 2 | L692: HEPNER 2 | N692: SLADE | P692: LEWIS | R692: ALDERSON
A693: BOX HILL | C693: C FELLOWS 5 | F693: GARDINER 3 | I693: BAKER 2 | K693: VERNON 2 | M693: CARROLL 2 | P693: BRYANT
A695: OAKLEIGH | C695: 5 | D695: 6 | E695: =C695*6+D695 -> 36 | G695: 10 | H695: 11 | I695: =G695*6+H695 -> 71 | K695: 11 | L695: 16 | M695: =K695*6+L695 -> 82 | O695: 15 | P695: 18 | Q695: =O695*6+P695 -> 108 | S695: OAKLEIGH
A696: CAULFIELD | C696: 5 | D696: 1 | E696: =C696*6+D696 -> 31 | G696: 7 | H696: 2 | I696: =G696*6+H696 -> 44 | K696: 10 | L696: 2 | M696: =K696*6+L696 -> 62 | O696: 14 | P696: 3 | Q696: =O696*6+P696 -> 87
A697: BEST PLAYERS
A698: OAKLEIGH | C698: LOTHIAN | F698: TRAILL | I698: WAPLING | L698: McCORKELL | O698: HAINING
A699: CAULFIELD | C699: DE BONDE | F699: ROWE | I699: J MOORE | L699: M MOORE | O699: GOWANS | Q699: CLARK
A700: GOALKICKERS
A701: OAKLEIGH | C701: LOTHIAN 6 | F701: CUMMING 3 | I701: FORD 2 | K701: JORDAN | N701: WAPLING | P701: TRAILL | R701: TEGG
A702: CAULFIELD | C702: ROWE 4 | F702: McCOOKE 3 | I702: BRADY 2 | K702: GOWANS 2 | N702: MELBOURNE | Q702: DOUGLAS | S702: SMITH
A704: WERRIBEE | C704: 5 | D704: 3 | E704: =C704*6+D704 -> 33 | G704: 11 | H704: 8 | I704: =G704*6+H704 -> 74 | K704: 15 | L704: 12 | M704: =K704*6+L704 -> 102 | O704: 21 | P704: 15 | Q704: =O704*6+P704 -> 141 | S704: WERRIBEE
A705: CAMBERWELL | C705: 4 | D705: 2 | E705: =C705*6+D705 -> 26 | G705: 5 | H705: 6 | I705: =G705*6+H705 -> 36 | K705: 8 | L705: 11 | M705: =K705*6+L705 -> 59 | O705: 13 | P705: 15 | Q705: =O705*6+P705 -> 93
A706: BEST PLAYERS
A707: WERRIBEE | C707: TRAINION | F707: CHIRGWIN | I707: CROMPTON | L707: OGILVIE | O707: HEMLEY | Q707: GILLETT
A708: CAMBERWELL | C708: J SMITH | F708: L BOYD | I708: DELANTY | L708: BRAYNE | O708: J WICKS
A709: GOALKICKERS
A710: WERRIBEE | C710: CHIRGWIN 7 | F710: HEMLEY 5 | H710: SHEAHAN 2 | K710: TRAINION 2 | N710: GOULOPOLOUS 2 | R710: JAMIESON 2 | U710: CROMPTON
A711: CAMBERWELL | C711: J SMITH 4 | F711: WICKS 2 | H711: BOYD 2 | J711: VINEY 2 | L711: DELANTY | N711: McNAMARA | Q711: BRAYNE
A713: ROUND 16 | E713: 29TH JULY | J713: WEATHER | S713: PLAYED AT
D714: 1ST QTR | H714: 2ND QTR | L714: 3RD QTR | P714: FINAL | S714: CAMBERWELL
A715: CAMBERWELL | C715: 3 | D715: 2 | E715: =C715*6+D715 -> 20 | G715: 4 | H715: 10 | I715: =G715*6+H715 -> 34 | K715: 8 | L715: 12 | M715: =K715*6+L715 -> 60 | O715: 13 | P715: 16 | Q715: =O715*6+P715 -> 94 | S715: UMPIRE | X715: LADDER | AB715: ROUND | AD715: 16
A716: MORDIALLOC | C716: 5 | D716: 10 | E716: =C716*6+D716 -> 40 | G716: 7 | H716: 11 | I716: =G716*6+H716 -> 53 | K716: 8 | L716: 13 | M716: =K716*6+L716 -> 61 | O716: 10 | P716: 13 | Q716: =O716*6+P716 -> 73
A717: BEST PLAYERS | W717: TEAM | X717: W | Y717: L | Z717: D | AA717: FOR | AB717: AGST | AC717: % | AD717: PTS
A718: CAMBERWELL | C718: DELANTY | F718: DOCKER | I718: BOYD | L718: McNAMARA | O718: ALLISON | R718: PECK
A719: MORDIALLOC | C719: BACKMAN | F719: THOMPSON | I719: GROVES | L719: BLAINEY | O719: LAIRD | R719: RIDDLE | W719: GEELONG WEST | X719: 13 | Y719: 3 | Z719: 0 | AA719: 1827 | AB719: 1227 | AC719: =(AA719*100)/AB719 -> 148.8997555012225 | AD719: =(X719*4)+(Z719*2) -> 52
A720: GOALKICKERS | W720: OAKLEIGH | X720: 12 | Y720: 4 | Z720: 0 | AA720: 1477 | AB720: 1270 | AC720: =(AA720*100)/AB720 -> 116.2992125984252 | AD720: =(X720*4)+(Z720*2) -> 48
A721: CAMBERWELL | C721: McNAMARA 4 | F721: L BOYD 3 | I721: VINEY 2 | K721: D BOYD | M721: PECK | O721: SMITH | Q721: DELANTY | W721: FRANKSTON | X721: 11 | Y721: 5 | Z721: 0 | AA721: 1498 | AB721: 1455 | AC721: =(AA721*100)/AB721 -> 102.9553264604811 | AD721: =(X721*4)+(Z721*2) -> 44
A722: MORDIALLOC | C722: THOMPSON 2 | F722: BACKMAN 2 | I722: McGUINNESS | L722: RIDDLE | N722: VAUGHAN | P722: GROVES | R722: POWER | T722: LESLIE | W722: SUNSHINE | X722: 9 | Y722: 6 | Z722: 1 | AA722: 1331 | AB722: 1244 | AC722: =(AA722*100)/AB722 -> 106.9935691318328 | AD722: =(X722*4)+(Z722*2) -> 38
A724: GEELONG WEST | C724: 4 | D724: 4 | E724: =C724*6+D724 -> 28 | G724: 8 | H724: 5 | I724: =G724*6+H724 -> 53 | K724: 13 | L724: 9 | M724: =K724*6+L724 -> 87 | O724: 14 | P724: 9 | Q724: =O724*6+P724 -> 93 | S724: GEELONG WEST | W724: NORTHCOTE | X724: 9 | Y724: 7 | Z724: 0 | AA724: 1578 | AB724: 1470 | AC724: =(AA724*100)/AB724 -> 107.34693877551021 | AD724: =(X724*4)+(Z724*2) -> 36
A725: SUNSHINE | C725: 1 | D725: 1 | E725: =C725*6+D725 -> 7 | G725: 4 | H725: 7 | I725: =G725*6+H725 -> 31 | K725: 5 | L725: 9 | M725: =K725*6+L725 -> 39 | O725: 7 | P725: 11 | Q725: =O725*6+P725 -> 53 | W725: MORDIALLOC | X725: 7 | Y725: 9 | Z725: 0 | AA725: 1476 | AB725: 1444 | AC725: =(AA725*100)/AB725 -> 102.21606648199446 | AD725: =(X725*4)+(Z725*2) -> 28
A726: BEST PLAYERS | W726: WERRIBEE | X726: 6 | Y726: 9 | Z726: 1 | AA726: 1373 | AB726: 1508 | AC726: =(AA726*100)/AB726 -> 91.047745358090182 | AD726: =(X726*4)+(Z726*2) -> 26
A727: GEELONG WEST | C727: GIBBONS | F727: SNELL | I727: SALTER | L727: KEAYS | O727: RAEBURN | R727: O'DONNELL | W727: BOX HILL | X727: 5 | Y727: 11 | Z727: 0 | AA727: 1417 | AB727: 1576 | AC727: =(AA727*100)/AB727 -> 89.911167512690355 | AD727: =(X727*4)+(Z727*2) -> 20
A728: SUNSHINE | C728: CROSBIE | F728: TREZISE | I728: SLATTERY | L728: DONNELL | O728: WISE | R728: BENSON | W728: CAULFIELD | X728: 4 | Y728: 12 | Z728: 0 | AA728: 1425 | AB728: 1533 | AC728: =(AA728*100)/AB728 -> 92.954990215264189 | AD728: =(X728*4)+(Z728*2) -> 16
A729: GOALKICKERS | W729: CAMBERWELL | X729: 3 | Y729: 13 | Z729: 0 | AA729: 1310 | AB729: 1842 | AC729: =(AA729*100)/AB729 -> 71.118349619978289 | AD729: =(X729*4)+(Z729*2) -> 12
A730: GEELONG WEST | C730: NIEWEAROWICZ 3 | G730: GIBBONS 3 | J730: O'DONNELL 3 | M730: THOMPSON 3 | P730: McKAY | R730: BRUSHFIELD
A731: SUNSHINE | C731: BENSON 2 | F731: HARRIS 2 | I731: WISE 2 | K731: SLATTERY
A733: NORTHCOTE | C733: 2 | D733: 3 | E733: =C733*6+D733 -> 15 | G733: 3 | H733: 9 | I733: =G733*6+H733 -> 27 | K733: 7 | L733: 12 | M733: =K733*6+L733 -> 54 | O733: 10 | P733: 14 | Q733: =O733*6+P733 -> 74 | S733: NORTHCOTE
A734: OAKLEIGH | C734: 2 | D734: 3 | E734: =C734*6+D734 -> 15 | G734: 2 | H734: 5 | I734: =G734*6+H734 -> 17 | K734: 2 | L734: 9 | M734: =K734*6+L734 -> 21 | O734: 5 | P734: 11 | Q734: =O734*6+P734 -> 41
A735: BEST PLAYERS
A736: NORTHCOTE | C736: CRAMERI | F736: SMITH | I736: BEYNON | L736: McBREEN | O736: KEANE | R736: OGILVIE
A737: OAKLEIGH | C737: McCORKELL | F737: THOMAS | I737: LOGAN | L737: O'BRIEN | O737: WARREN | R737: LOTHIAN
A738: GOALKICKERS
A739: NORTHCOTE | C739: MUIR 4 | F739: WHITE 2 | I739: MICKLESON | L739: McBREEN | O739: KEANE | Q739: SLEEP
A740: OAKLEIGH | C740: LOTHIAN 2 | F740: CUMMING 2 | I740: HAINING
A742: BOX HILL | C742: 2 | D742: 12 | E742: =C742*6+D742 -> 24 | G742: 8 | H742: 14 | I742: =G742*6+H742 -> 62 | K742: 8 | L742: 21 | M742: =K742*6+L742 -> 69 | O742: 9 | P742: 25 | Q742: =O742*6+P742 -> 79 | S742: PRINCES PARK, CAULFIELD
A743: CAULFIELD | C743: 1 | D743: 0 | E743: =C743*6+D743 -> 6 | G743: 4 | H743: 2 | I743: =G743*6+H743 -> 26 | K743: 6 | L743: 4 | M743: =K743*6+L743 -> 40 | O743: 10 | P743: 4 | Q743: =O743*6+P743 -> 64
A744: BEST PLAYERS
A745: BOX HILL | C745: GARDINER | F745: FELTHAM | I745: G FELLOWS | L745: BAKER | O745: BRYANT | R745: I BATES
A746: CAULFIELD | C746: CLARK | F746: ROWE | I746: MOORE | L746: GOWANS | O746: DE BONDE
A747: GOALKICKERS
A748: BOX HILL | C748: BRYANT 2 | F748: FELTHAM 2 | I748: I BATES 2 | L748: GARDINER | O748: LA ROCHE | Q748: CARROLL
A749: CAULFIELD | C749: SMITH 3 | F749: ROWE 3 | I749: WILLIAMS 2 | L749: ARRELL | N749: DOUGLAS
A751: FRANKSTON | C751: 2 | D751: 4 | E751: =C751*6+D751 -> 16 | G751: 7 | H751: 13 | I751: =G751*6+H751 -> 55 | K751: 8 | L751: 15 | M751: =K751*6+L751 -> 63 | O751: 13 | P751: 21 | Q751: =O751*6+P751 -> 99 | S751: FRANKSTON
A752: WERRIBEE | C752: 4 | D752: 3 | E752: =C752*6+D752 -> 27 | G752: 6 | H752: 4 | I752: =G752*6+H752 -> 40 | K752: 11 | L752: 7 | M752: =K752*6+L752 -> 73 | O752: 13 | P752: 9 | Q752: =O752*6+P752 -> 87
A753: BEST PLAYERS
A754: FRANKSTON | C754: HINES | F754: HEPNER | I754: KERR | L754: THATCHER | O754: BOWEN | R754: GLEESON
A755: WERRIBEE | C755: HOLCOMBE | F755: CROMPTON | I755: GILLETT | L755: SPIERS | O755: ANDERSON | R755: OGILVIE
A756: GOALKICKERS
A757: FRANKSTON | C757: HINES 4 | E757: KERR 3 | G757: PAYNE 3 | I757: LEE 2 | K757: SLADE
A758: WERRIBEE | C758: HOLCOMBE 4 | F758: HEMLEY 3 | I758: TRAINION 2 | L758: CHIRGWIN | O758: LYONS | Q758: GOULOPOLOUS | T758: CROMPTON
A760: ROUND 17 | E760: 5TH AUGUST | J760: WEATHER | S760: PLAYED AT
D761: 1ST QTR | H761: 2ND QTR | L761: 3RD QTR | P761: FINAL | S761: WERRIBEE
A762: WERRIBEE | C762: 3 | D762: 3 | E762: =C762*6+D762 -> 21 | G762: 8 | H762: 11 | I762: =G762*6+H762 -> 59 | K762: 11 | L762: 15 | M762: =K762*6+L762 -> 81 | O762: 16 | P762: 17 | Q762: =O762*6+P762 -> 113 | S762: UMPIRE | X762: LADDER | AB762: ROUND | AD762: 17
A763: MORDIALLOC | C763: 4 | D763: 3 | E763: =C763*6+D763 -> 27 | G763: 8 | H763: 6 | I763: =G763*6+H763 -> 54 | K763: 12 | L763: 8 | M763: =K763*6+L763 -> 80 | O763: 13 | P763: 10 | Q763: =O763*6+P763 -> 88
A764: BEST PLAYERS | W764: TEAM | X764: W | Y764: L | Z764: D | AA764: FOR | AB764: AGST | AC764: % | AD764: PTS
A765: WERRIBEE | C765: GILLETT | F765: MORTON | I765: TRAINION | L765: OGILVIE | O765: HOOPER | Q765: HYLAND
A766: MORDIALLOC | C766: CULLEY | F766: PORTER | I766: RIDDLE | L766: DANCKERT | O766: BLAINEY | W766: GEELONG WEST | X766: 13 | Y766: 4 | Z766: 0 | AA766: 1902 | AB766: 1355 | AC766: =(AA766*100)/AB766 -> 140.36900369003689 | AD766: =(X766*4)+(Z766*2) -> 52
A767: GOALKICKERS | W767: OAKLEIGH | X767: 13 | Y767: 4 | Z767: 0 | AA767: 1605 | AB767: 1345 | AC767: =(AA767*100)/AB767 -> 119.33085501858736 | AD767: =(X767*4)+(Z767*2) -> 52
A768: WERRIBEE | C768: CHIRGWIN 4 | F768: HEMLEY 3 | I768: SHEAHAN 2 | L768: LYONS 2 | N768: HOOPER | P768: HYLAND | W768: FRANKSTON | X768: 12 | Y768: 5 | Z768: 0 | AA768: 1638 | AB768: 1537 | AC768: =(AA768*100)/AB768 -> 106.57124268054652 | AD768: =(X768*4)+(Z768*2) -> 48
A769: MORDIALLOC | C769: POWER 5 | F769: THOMPSON 2 | I769: BACKMAN 2 | L769: VAUGHAN 2 | N769: WILLIS | P769: RIDDLE | W769: SUNSHINE | X769: 10 | Y769: 6 | Z769: 1 | AA769: 1494 | AB769: 1340 | AC769: =(AA769*100)/AB769 -> 111.49253731343283 | AD769: =(X769*4)+(Z769*2) -> 42
A771: SUNSHINE | C771: 9 | D771: 5 | E771: =C771*6+D771 -> 59 | G771: 16 | H771: 11 | I771: =G771*6+H771 -> 107 | K771: 21 | L771: 12 | M771: =K771*6+L771 -> 138 | O771: 24 | P771: 19 | Q771: =O771*6+P771 -> 163 | S771: SUNSHINE | W771: NORTHCOTE | X771: 10 | Y771: 7 | Z771: 0 | AA771: 1732 | AB771: 1560 | AC771: =(AA771*100)/AB771 -> 111.02564102564102 | AD771: =(X771*4)+(Z771*2) -> 40
A772: CAMBERWELL | C772: 4 | D772: 3 | E772: =C772*6+D772 -> 27 | G772: 8 | H772: 5 | I772: =G772*6+H772 -> 53 | K772: 12 | L772: 6 | M772: =K772*6+L772 -> 78 | O772: 15 | P772: 6 | Q772: =O772*6+P772 -> 96 | W772: WERRIBEE | X772: 7 | Y772: 9 | Z772: 1 | AA772: 1486 | AB772: 1596 | AC772: =(AA772*100)/AB772 -> 93.107769423558892 | AD772: =(X772*4)+(Z772*2) -> 30
A773: BEST PLAYERS | W773: MORDIALLOC | X773: 7 | Y773: 10 | Z773: 0 | AA773: 1564 | AB773: 1567 | AC773: =(AA773*100)/AB773 -> 99.808551372048498 | AD773: =(X773*4)+(Z773*2) -> 28
A774: SUNSHINE | C774: GRAHAM | F774: PLAIN | I774: HIPWORTH | L774: WISE | O774: TREZISE | R774: POWER | W774: BOX HILL | X774: 5 | Y774: 12 | Z774: 0 | AA774: 1507 | AB774: 1730 | AC774: =(AA774*100)/AB774 -> 87.109826589595372 | AD774: =(X774*4)+(Z774*2) -> 20
A775: CAMBERWELL | C775: WICKS | F775: L BOYD | I775: SMITH | L775: McNAMARA | O775: ALLISON | R775: DELANTY | W775: CAULFIELD | X775: 4 | Y775: 13 | Z775: 0 | AA775: 1507 | AB775: 1673 | AC775: =(AA775*100)/AB775 -> 90.077704722056183 | AD775: =(X775*4)+(Z775*2) -> 16
A776: GOALKICKERS | R776: CROSBIE | W776: CAMBERWELL | X776: 3 | Y776: 14 | Z776: 0 | AA776: 1406 | AB776: 2005 | AC776: =(AA776*100)/AB776 -> 70.124688279301751 | AD776: =(X776*4)+(Z776*2) -> 12
A777: SUNSHINE | C777: WISE 6 | E777: GRAHAM 5 | G777: HIPWORTH 3 | J777: BANT 3 | L777: SLATTERY 2 | O777: YOUNG | Q777: CURRIE | S777: PLAIN | U777: BENSON
A778: CAMBERWELL | C778: VINEY 3 | E778: DELANTY 2 | H778: L BOYD 2 | J778: WICKS 2 | L778: McNAMARA 2 | O778: BRAYNE 2 | Q778: D BOYD | S778: SMITH
A780: FRANKSTON | C780: 3 | D780: 7 | E780: =C780*6+D780 -> 25 | G780: 7 | H780: 11 | I780: =G780*6+H780 -> 53 | K780: 13 | L780: 18 | M780: =K780*6+L780 -> 96 | O780: 20 | P780: 20 | Q780: =O780*6+P780 -> 140 | S780: FRANKSTON
A781: CAULFIELD | C781: 2 | D781: 0 | E781: =C781*6+D781 -> 12 | G781: 7 | H781: 7 | I781: =G781*6+H781 -> 49 | K781: 9 | L781: 9 | M781: =K781*6+L781 -> 63 | O781: 12 | P781: 10 | Q781: =O781*6+P781 -> 82
A782: BEST PLAYERS
A783: FRANKSTON | C783: KERR | F783: SLADE | I783: HEPNER | L783: PAYNE | O783: GLEESON | R783: THATCHER
A784: CAULFIELD | C784: DE BONDE | F784: COLLINS | I784: GOWANS | L784: LOGAN | O784: SMITH | R784: CLARK
A785: GOALKICKERS
A786: FRANKSTON | C786: SLADE 6 | E786: PAYNE 4 | G786: KERR 3 | I786: HEPNER 3 | K786: LEE 2 | M786: HINES | O786: BOSSE
A787: CAULFIELD | C787: DE BONDE 3 | F787: WILLIAMS 3 | I787: LACHMUND 2 | L787: SMITH 2 | N787: GOWANS | Q787: BAKER
A789: OAKLEIGH | C789: 1 | D789: 1 | E789: =C789*6+D789 -> 7 | G789: 8 | H789: 7 | I789: =G789*6+H789 -> 55 | K789: 13 | L789: 11 | M789: =K789*6+L789 -> 89 | O789: 19 | P789: 14 | Q789: =O789*6+P789 -> 128 | S789: OAKLEIGH
A790: GEELONG WEST | C790: 6 | D790: 3 | E790: =C790*6+D790 -> 39 | G790: 6 | H790: 3 | I790: =G790*6+H790 -> 39 | K790: 9 | L790: 6 | M790: =K790*6+L790 -> 60 | O790: 11 | P790: 9 | Q790: =O790*6+P790 -> 75
A791: BEST PLAYERS
A792: OAKLEIGH | C792: MORCOM | F792: LOTHIAN | I792: McCORKELL | L792: JORDAN | O792: O'BRIEN | R792: WAPLING
A793: GEELONG WEST | C793: NUSTELING | F793: GIBBONS | I793: KEAYS | L793: RAEBURN | O793: McKAY | R793: THOMPSON
A794: GOALKICKERS
A795: OAKLEIGH | C795: MORCOM 5 | F795: LOTHIAN 5 | I795: CUMMING 4 | L795: JORDAN 3 | N795: WAPLING | Q795: WARREN
A796: GEELONG WEST | C796: NUSTELING 4 | F796: GIBBONS 2 | I796: BURGOYNE 2 | L796: THOMPSON | N796: McKAY | Q796: O'DONNELL
A798: NORTHCOTE | C798: 5 | D798: 1 | E798: =C798*6+D798 -> 31 | G798: 9 | H798: 11 | I798: =G798*6+H798 -> 65 | K798: 15 | L798: 17 | M798: =K798*6+L798 -> 107 | O798: 22 | P798: 22 | Q798: =O798*6+P798 -> 154 | S798: BOX HILL
A799: BOX HILL | C799: 5 | D799: 5 | E799: =C799*6+D799 -> 35 | G799: 5 | H799: 8 | I799: =G799*6+H799 -> 38 | K799: 8 | L799: 10 | M799: =K799*6+L799 -> 58 | O799: 13 | P799: 12 | Q799: =O799*6+P799 -> 90
A800: BEST PLAYERS
A801: NORTHCOTE | C801: SLEEP | F801: WHITE | I801: McBREEN | L801: SMITH | O801: R DEAN | Q801: MICKLESON
A802: BOX HILL | C802: G FELLOWS | F802: GARDINER | I802: LOOMES | L802: BAKER | O802: RALPH | Q802: I BATES
A803: GOALKICKERS
A804: NORTHCOTE | C804: A WHITE 5 | F804: SLEEP 4 | H804: CALVERLEY 4 | K804: CRAMERI 3 | N804: MICKLESON 3 | Q804: KEANE | S804: 2 SHORT
A805: BOX HILL | C805: I BATES 5 | F805: BAKER 2 | H805: G FELLOWS | K805: GARDINER | N805: FELTHAM | P805: VERNON | R805: BRYANT | T805: MACKO
A807: ROUND 18 | E807: 12TH AUGUST | J807: WEATHER | S807: PLAYED AT
D808: 1ST QTR | H808: 2ND QTR | L808: 3RD QTR | P808: FINAL | S808: MORDIALLOC
A809: SUNSHINE | C809: 4 | D809: 6 | E809: =C809*6+D809 -> 30 | G809: 4 | H809: 6 | I809: =G809*6+H809 -> 30 | K809: 8 | L809: 8 | M809: =K809*6+L809 -> 56 | O809: 11 | P809: 10 | Q809: =O809*6+P809 -> 76 | S809: UMPIRE | X809: LADDER | AB809: ROUND | AD809: 18
A810: MORDIALLOC | C810: 1 | D810: 0 | E810: =C810*6+D810 -> 6 | G810: 4 | H810: 5 | I810: =G810*6+H810 -> 29 | K810: 4 | L810: 5 | M810: =K810*6+L810 -> 29 | O810: 7 | P810: 6 | Q810: =O810*6+P810 -> 48
A811: BEST PLAYERS | W811: TEAM | X811: W | Y811: L | Z811: D | AA811: FOR | AB811: AGST | AC811: % | AD811: PTS
A812: SUNSHINE | C812: HIPWORTH | F812: KENNEDY | I812: TREZISE | L812: CURRIE | O812: WISE | R812: SLATTERY
A813: MORDIALLOC | C813: BLAINEY | F813: LESLIE | I813: WILLIAMS | L813: WILLIAMSON | O813: DANCKERT | R813: CULLEY | W813: OAKLEIGH | X813: 14 | Y813: 4 | Z813: 0 | AA813: 1729 | AB813: 1404 | AC813: =(AA813*100)/AB813 -> 123.14814814814815 | AD813: =(X813*4)+(Z813*2) -> 56
A814: GOALKICKERS | W814: GEELONG WEST | X814: 13 | Y814: 5 | Z814: 0 | AA814: 1968 | AB814: 1425 | AC814: =(AA814*100)/AB814 -> 138.10526315789474 | AD814: =(X814*4)+(Z814*2) -> 52
A815: SUNSHINE | C815: WISE 4 | E815: CROSBIE 2 | H815: TREZISE | J815: GRAHAM | M815: HIPWORTH | P815: BANT | R815: POWER | W815: FRANKSTON | X815: 12 | Y815: 6 | Z815: 0 | AA815: 1715 | AB815: 1639 | AC815: =(AA815*100)/AB815 -> 104.63697376449055 | AD815: =(X815*4)+(Z815*2) -> 48
A816: MORDIALLOC | C816: PORTER 2 | F816: POWER | H816: PEARCE | J816: LESLIE | L816: RIDDLE | N816: IRVING | W816: SUNSHINE | X816: 11 | Y816: 6 | Z816: 1 | AA816: 1570 | AB816: 1378 | AC816: =(AA816*100)/AB816 -> 113.933236574746 | AD816: =(X816*4)+(Z816*2) -> 46
A818: OAKLEIGH | C818: 6 | D818: 4 | E818: =C818*6+D818 -> 40 | G818: 10 | H818: 11 | I818: =G818*6+H818 -> 71 | K818: 13 | L818: 11 | M818: =K818*6+L818 -> 89 | O818: 18 | P818: 16 | Q818: =O818*6+P818 -> 124 | S818: CAMBERWELL | W818: NORTHCOTE | X818: 11 | Y818: 7 | Z818: 0 | AA818: 1834 | AB818: 1637 | AC818: =(AA818*100)/AB818 -> 112.03420891875382 | AD818: =(X818*4)+(Z818*2) -> 44
A819: CAMBERWELL | C819: 1 | D819: 5 | E819: =C819*6+D819 -> 11 | G819: 1 | H819: 6 | I819: =G819*6+H819 -> 12 | K819: 5 | L819: 13 | M819: =K819*6+L819 -> 43 | O819: 7 | P819: 17 | Q819: =O819*6+P819 -> 59 | W819: WERRIBEE | X819: 8 | Y819: 9 | Z819: 1 | AA819: 1564 | AB819: 1671 | AC819: =(AA819*100)/AB819 -> 93.596648713345303 | AD819: =(X819*4)+(Z819*2) -> 34
A820: BEST PLAYERS | W820: MORDIALLOC | X820: 7 | Y820: 11 | Z820: 0 | AA820: 1612 | AB820: 1643 | AC820: =(AA820*100)/AB820 -> 98.113207547169807 | AD820: =(X820*4)+(Z820*2) -> 28
A821: OAKLEIGH | C821: LOTHIAN | F821: THOMAS | I821: WAPLING | L821: BELL | O821: HAINING | R821: LYONS | W821: BOX HILL | X821: 6 | Y821: 12 | Z821: 0 | AA821: 1577 | AB821: 1796 | AC821: =(AA821*100)/AB821 -> 87.806236080178181 | AD821: =(X821*4)+(Z821*2) -> 24
A822: CAMBERWELL | C822: DELANTY | F822: WITHERS | I822: WICKS | L822: CONYERS | O822: PECK | W822: CAULFIELD | X822: 4 | Y822: 14 | Z822: 0 | AA822: 1582 | AB822: 1751 | AC822: =(AA822*100)/AB822 -> 90.348372358652199 | AD822: =(X822*4)+(Z822*2) -> 16
A823: GOALKICKERS | W823: CAMBERWELL | X823: 3 | Y823: 15 | Z823: 0 | AA823: 1465 | AB823: 2129 | AC823: =(AA823*100)/AB823 -> 68.811648661343355 | AD823: =(X823*4)+(Z823*2) -> 12
A824: OAKLEIGH | C824: LOTHIAN 5 | F824: WAPLING 5 | I824: CUMMING 2 | L824: HAINING 2 | N824: MORCOM | Q824: LYONS | S824: TEGG
A825: CAMBERWELL | C825: PECK 2 | E825: DELANTY 2 | H825: T SMITH | J825: D BOYD | L825: WICKS
A827: BOX HILL | C827: 4 | D827: 1 | E827: =C827*6+D827 -> 25 | G827: 7 | H827: 5 | I827: =G827*6+H827 -> 47 | K827: 9 | L827: 8 | M827: =K827*6+L827 -> 62 | O827: 10 | P827: 10 | Q827: =O827*6+P827 -> 70 | S827: GEELONG WEST
A828: GEELONG WEST | C828: 2 | D828: 3 | E828: =C828*6+D828 -> 15 | G828: 3 | H828: 8 | I828: =G828*6+H828 -> 26 | K828: 8 | L828: 11 | M828: =K828*6+L828 -> 59 | O828: 9 | P828: 12 | Q828: =O828*6+P828 -> 66
A829: BEST PLAYERS
A830: BOX HILL | C830: GARDINER | F830: C FELLOWS | I830: G FELLOWS | L830: WHITE | O830: LA ROCHE | R830: BRYANT
A831: GEELONG WEST | C831: SNELL | F831: GROVES | I831: BURGOYNE | L831: RAEBURN | O831: GIBBONS
A832: GOALKICKERS
A833: BOX HILL | C833: C FELLOWS 2 | F833: GARDINER 2 | I833: I BATES 2 | K833: BRYANT 2 | N833: LA ROCHE | Q833: BAKER
A834: GEELONG WEST | C834: GIBBONS 2 | F834: SNELL 2 | I834: GROVES 2 | K834: BIEN | M834: BURGOYNE | P834: MOORE
A836: NORTHCOTE | C836: 0 | D836: 1 | E836: =C836*6+D836 -> 1 | G836: 11 | H836: 3 | I836: =G836*6+H836 -> 69 | K836: 14 | L836: 6 | M836: =K836*6+L836 -> 90 | O836: 16 | P836: 6 | Q836: =O836*6+P836 -> 102 | S836: NORTHCOTE
A837: FRANKSTON | C837: 5 | D837: 6 | E837: =C837*6+D837 -> 36 | G837: 6 | H837: 10 | I837: =G837*6+H837 -> 46 | K837: 7 | L837: 16 | M837: =K837*6+L837 -> 58 | O837: 9 | P837: 23 | Q837: =O837*6+P837 -> 77
A838: BEST PLAYERS
A839: NORTHCOTE | C839: R WHITE | F839: K HENRY | I839: SLEEP | L839: CRAMERI | O839: CALVERLEY
A840: FRANKSTON | C840: SLADE | F840: GLEESON | I840: HEPNER | L840: HINES | O840: LEE | Q840: PAYNE
A841: GOALKICKERS
A842: NORTHCOTE | C842: R WHITE 5 | F842: CALVERLEY 3 | I842: MICKLESON 3 | L842: SLEEP 2 | N842: K HENRY 2 | Q842: KEANE
A843: FRANKSTON | C843: SLADE 3 | F843: PAYNE 3 | I843: LEE | K843: HEPNER | M843: McHUGH
A845: WERRIBEE | C845: 3 | D845: 6 | E845: =C845*6+D845 -> 24 | G845: 6 | H845: 15 | I845: =G845*6+H845 -> 51 | K845: 7 | L845: 16 | M845: =K845*6+L845 -> 58 | O845: 10 | P845: 18 | Q845: =O845*6+P845 -> 78 | S845: PRINCES PARK, CAULFIELD
A846: CAULFIELD | C846: 2 | D846: 4 | E846: =C846*6+D846 -> 16 | G846: 4 | H846: 6 | I846: =G846*6+H846 -> 30 | K846: 10 | L846: 10 | M846: =K846*6+L846 -> 70 | O846: 10 | P846: 15 | Q846: =O846*6+P846 -> 75
A847: BEST PLAYERS
A848: WERRIBEE | C848: OGILVIE | F848: ANDERSON | I848: TRAINION | L848: LYONS | O848: HYLAND | R848: MORTON
A849: CAULFIELD | C849: BAKER | F849: GOWANS | I849: ARRELL | L849: CLARK | O849: VINE | R849: J MOORE
A850: GOALKICKERS
A851: WERRIBEE | C851: CHIRGWIN 3 | F851: LYONS 2 | I851: TRAINION | L851: HEMLEY | N851: CROMPTON | Q851: GOULOPOLOUS | U851: SHEAHAN
A852: CAULFIELD | C852: DE BONDE 2 | F852: GOWANS 2 | I852: SMITH 2 | K852: BAKER 2 | M852: MELBOURNE | P852: HOSKING
A854: FINALS
A855: 1ST SEMI | E855: 20TH AUGUST | J855: WEATHER | S855: PLAYED AT
D856: 1ST QTR | H856: 2ND QTR | L856: 3RD QTR | P856: FINAL | S856: TOORAK PARK
A857: FRANKSTON | C857: 2 | D857: 1 | E857: =C857*6+D857 -> 13 | G857: 10 | H857: 6 | I857: =G857*6+H857 -> 66 | K857: 14 | L857: 11 | M857: =K857*6+L857 -> 95 | O857: 14 | P857: 16 | Q857: =O857*6+P857 -> 100 | S857: UMPIRE
A858: SUNSHINE | C858: 5 | D858: 8 | E858: =C858*6+D858 -> 38 | G858: 6 | H858: 10 | I858: =G858*6+H858 -> 46 | K858: 6 | L858: 10 | M858: =K858*6+L858 -> 46 | O858: 8 | P858: 14 | Q858: =O858*6+P858 -> 62 | S858: GARLICK
A859: BEST PLAYERS
A860: FRANKSTON | C860: SHEPHERD | F860: SLADE | I860: LEE | L860: ALDERSON | O860: KERR | Q860: HEPNER
A861: SUNSHINE | C861: TREZISE | F861: KENNEDY | I861: POWER | L861: YOUNG | O861: SLATTERY | Q861: DUNNE
A862: GOALKICKERS
A863: FRANKSTON | C863: SLADE 4 | F863: HEPNER 2 | I863: LEE 2 | K863: THATCHER 2 | N863: PAYNE 2 | P863: KERR | R863: SHEPHERD
A864: SUNSHINE | C864: GRAHAM 2 | F864: POWER 2 | I864: TREZISE | K864: CROSBIE | M864: SLATTERY | P864: LEGAWIECZ
A866: 2ND SEMI | E866: 27TH AUGUST | J866: WEATHER
A867: OAKLEIGH | C867: 4 | D867: 6 | E867: =C867*6+D867 -> 30 | G867: 6 | H867: 10 | I867: =G867*6+H867 -> 46 | K867: 10 | L867: 12 | M867: =K867*6+L867 -> 72 | O867: 15 | P867: 17 | Q867: =O867*6+P867 -> 107 | S867: TOORAK PARK
A868: GEELONG WEST | C868: 3 | D868: 0 | E868: =C868*6+D868 -> 18 | G868: 8 | H868: 2 | I868: =G868*6+H868 -> 50 | K868: 9 | L868: 3 | M868: =K868*6+L868 -> 57 | O868: 11 | P868: 9 | Q868: 4 | S868: TOOHEY
A869: BEST PLAYERS
A870: OAKLEIGH | C870: BELL | F870: JORDAN | I870: LYONS | L870: FORD | O870: HAINING | R870: CUMMING
A871: GEELONG WEST | C871: RAEBURN | F871: KEAYS | I871: O'DONNELL | L871: BIEN | O871: SNELL
A872: GOALKICKERS
A873: OAKLEIGH | C873: CUMMING 4 | F873: JORDAN 3 | I873: LOTHIAN 2 | L873: WAPLING 2 | O873: THOMAS | Q873: MORCAM | S873: TRAILL | U873: LYONS
A874: GEELONG WEST | C874: O'DONNELL 3 | F874: BRUSHFIELD 2 | I874: STACEY 2 | L874: SALTER 2 | O874: GIBBONS | Q874: HOVEY
A876: PRELIMINARY | E876: 3RD SEPTEMBER | J876: WEATHER
A877: GEELONG WEST | C877: 2 | D877: 1 | E877: =C877*6+D877 -> 13 | G877: 7 | H877: 5 | I877: =G877*6+H877 -> 47 | K877: 12 | L877: 7 | M877: =K877*6+L877 -> 79 | O877: 17 | P877: 13 | Q877: =O877*6+P877 -> 115 | S877: TOORAK PARK
A878: FRANKSTON | C878: 5 | D878: 6 | E878: =C878*6+D878 -> 36 | G878: 7 | H878: 8 | I878: =G878*6+H878 -> 50 | K878: 9 | L878: 15 | M878: =K878*6+L878 -> 69 | O878: 12 | P878: 20 | Q878: =O878*6+P878 -> 92
A879: BEST PLAYERS
A880: GEELONG WEST | C880: GIBBONS | F880: BRUSHFIELD | I880: NUSTELING | L880: STACEY | O880: VAN T'HAG
A881: FRANKSTON | C881: LEE | F881: BENNETT | I881: SLADE | L881: GLEESON | O881: KERR | Q881: ANDERSON
A882: GOALKICKERS
A883: GEELONG WEST
A884: FRANKSTON | C884: KERR 4 | F884: PAYNE 3 | I884: BOWES 2 | L884: GLEESON 2 | O884: LEE
A886: GRAND | E886: 10TH SEPTEMBER | J886: WEATHER
A887: OAKLEIGH | C887: 3 | D887: 3 | E887: =C887*6+D887 -> 21 | G887: 5 | H887: 4 | I887: =G887*6+H887 -> 34 | K887: 9 | L887: 10 | M887: =K887*6+L887 -> 64 | O887: 12 | P887: 14 | Q887: =O887*6+P887 -> 86 | S887: TOORAK PARK
A888: GEELONG WEST | C888: 3 | D888: 1 | E888: =C888*6+D888 -> 19 | G888: 6 | H888: 4 | I888: =G888*6+H888 -> 40 | K888: 9 | L888: 5 | M888: =K888*6+L888 -> 59 | O888: 11 | P888: 7 | Q888: =O888*6+P888 -> 73 | S888: JACKSON
A889: BEST PLAYERS
A890: OAKLEIGH | C890: LUFF | F890: BELL | I890: FORD | L890: TRAILL | O890: LOTHIAN | R890: JORDAN
A891: GEELONG WEST | C891: BIEN | F891: NUSTELING | I891: RAEBURN | L891: SALTER | O891: VAN T'HAG | R891: KEAYS
A892: GOALKICKERS
A893: OAKLEIGH | C893: LOTHIAN 5 | F893: LYONS 2 | I893: CUMMING 2 | L893: HAINING | O893: TEGG | Q893: JORDAN
A894: GEELONG WEST | C894: NUSTELING 5 | F894: WHITE 2 | I894: BUSH | K894: HOVEY | M894: O'DONNELL | P894: STACEY