A1: Victorian Football Association
A2: Season 1968 - Division Two
A3: © Copyright Wal Williams | F3: First created: 28 March 2016
A4: Contact: joywalwi at gmail dot com | F4: Last updated: 28 March 2016 | W4: VFA Results and tables - Link to the main index page
A5: You are free to copy this document in whole or part provided that proper acknowledgement is given to the author. All rights reserved.
A7: 1968 | C7: V.F.A. SEASON 2ND DIVISION
A8: ROUND 1 | E8: 13TH APRIL | J8: WEATHER | S8: PLAYED AT
D9: 1ST QTR | H9: 2ND QTR | L9: 3RD QTR | P9: FINAL | S9: BOX HILL
A10: CAMBERWELL | C10: 2 | D10: 2 | E10: =C10*6+D10 -> 14 | G10: 4 | H10: 6 | I10: =G10*6+H10 -> 30 | K10: 9 | L10: 8 | M10: =K10*6+L10 -> 62 | O10: 13 | P10: 12 | Q10: =O10*6+P10 -> 90 | S10: UMPIRE | X10: LADDER | AB10: ROUND | AD10: 1
A11: BOX HILL | C11: 2 | D11: 5 | E11: =C11*6+D11 -> 17 | G11: 4 | H11: 5 | I11: =G11*6+H11 -> 29 | K11: 6 | L11: 8 | M11: =K11*6+L11 -> 44 | O11: 11 | P11: 11 | Q11: =O11*6+P11 -> 77
A12: BEST PLAYERS | W12: TEAM | X12: W | Y12: L | Z12: D | AA12: FOR | AB12: AGST | AC12: % | AD12: PTS
A13: CAMBERWELL | C13: DELANTY | F13: RIETSHAL | I13: ALLISON | L13: DOCKER | N13: G BOYD | Q13: L BOYD
A14: BOX HILL | C14: DOULIS | F14: BRYANT | I14: RONALDSON | L14: LOOMES | W14: NORTHCOTE | X14: 1 | Y14: 0 | Z14: 0 | AA14: 102 | AB14: 80 | AC14: =(AA14*100)/AB14 -> 127.5 | AD14: =(X14*4)+(Z14*2) -> 4
A15: GOALKICKERS | W15: WILLIAMSTOWN | X15: 1 | Y15: 0 | Z15: 0 | AA15: 67 | AB15: 53 | AC15: =(AA15*100)/AB15 -> 126.41509433962264 | AD15: =(X15*4)+(Z15*2) -> 4
A16: CAMBERWELL | C16: RIETSHAL 3 | F16: DELANTY 3 | I16: WICKS 3 | K16: L BOYD | M16: CONYERS | W16: CAMBERWELL | X16: 1 | Y16: 0 | Z16: 0 | AA16: 90 | AB16: 77 | AC16: =(AA16*100)/AB16 -> 116.88311688311688 | AD16: =(X16*4)+(Z16*2) -> 4
A17: BOX HILL | C17: LOOMES 3 | F17: DOULIS 2 | I17: WADE 2 | K17: BRYANT 2 | N17: BATES | P17: CARROLL | W17: GEELONG WEST | X17: 1 | Y17: 0 | Z17: 0 | AA17: 123 | AB17: 111 | AC17: =(AA17*100)/AB17 -> 110.81081081081081 | AD17: =(X17*4)+(Z17*2) -> 4
A19: WILLIAMSTOWN | C19: 2 | D19: 0 | E19: =C19*6+D19 -> 12 | G19: 4 | H19: 2 | I19: =G19*6+H19 -> 26 | K19: 6 | L19: 10 | M19: =K19*6+L19 -> 46 | O19: 9 | P19: 13 | Q19: =O19*6+P19 -> 67 | S19: PRINCES PARK, CAULFIELD | W19: WERRIBEE | X19: 1 | Y19: 0 | Z19: 0 | AA19: 85 | AB19: 81 | AC19: =(AA19*100)/AB19 -> 104.93827160493827 | AD19: =(X19*4)+(Z19*2) -> 4
A20: CAULFIELD | C20: 1 | D20: 0 | E20: =C20*6+D20 -> 6 | G20: 4 | H20: 12 | I20: =G20*6+H20 -> 36 | K20: 5 | L20: 14 | M20: =K20*6+L20 -> 44 | O20: 6 | P20: 17 | Q20: =O20*6+P20 -> 53 | S20: JACKSON | W20: SUNSHINE | X20: 0 | Y20: 1 | Z20: 0 | AA20: 81 | AB20: 85 | AC20: =(AA20*100)/AB20 -> 95.294117647058826 | AD20: =(X20*4)+(Z20*2) -> 0
A21: BEST PLAYERS | W21: FRANKSTON | X21: 0 | Y21: 1 | Z21: 0 | AA21: 111 | AB21: 123 | AC21: =(AA21*100)/AB21 -> 90.243902439024396 | AD21: =(X21*4)+(Z21*2) -> 0
A22: WILLIAMSTOWN | C22: MEYERS | F22: RUSSELL | I22: PAPLEY | L22: BARNES | O22: WARE | Q22: BUCHANAN | W22: BOX HILL | X22: 0 | Y22: 1 | Z22: 0 | AA22: 77 | AB22: 90 | AC22: =(AA22*100)/AB22 -> 85.555555555555557 | AD22: =(X22*4)+(Z22*2) -> 0
A23: CAULFIELD | C23: RIGG | F23: HORGAN | I23: SANDERS | L23: HAILES | O23: BARKER | W23: CAULFIELD | X23: 0 | Y23: 1 | Z23: 0 | AA23: 53 | AB23: 67 | AC23: =(AA23*100)/AB23 -> 79.104477611940297 | AD23: =(X23*4)+(Z23*2) -> 0
A24: GOALKICKERS | W24: MORDIALLOC | X24: 0 | Y24: 1 | Z24: 0 | AA24: 80 | AB24: 102 | AC24: =(AA24*100)/AB24 -> 78.431372549019613 | AD24: =(X24*4)+(Z24*2) -> 0
A25: WILLIAMSTOWN | C25: SZYSZKA 3 | F25: MEYERS 3 | I25: BUCHANAN | L25: NANKERVIS | O25: O'BRIEN
A26: CAULFIELD | C26: RIGG 2 | F26: ARRELL | I26: GOWANS | L26: HOSKING | O26: HORGAN
A28: GEELONG WEST | C28: 5 | D28: 4 | E28: =C28*6+D28 -> 34 | G28: 13 | H28: 8 | I28: =G28*6+H28 -> 86 | K28: 14 | L28: 13 | M28: =K28*6+L28 -> 97 | O28: 18 | P28: 15 | Q28: =O28*6+P28 -> 123 | S28: FRANKSTON
A29: FRANKSTON | C29: 2 | D29: 1 | E29: =C29*6+D29 -> 13 | G29: 6 | H29: 2 | I29: =G29*6+H29 -> 38 | K29: 10 | L29: 9 | M29: =K29*6+L29 -> 69 | O29: 16 | P29: 15 | Q29: =O29*6+P29 -> 111
A30: BEST PLAYERS
A31: GEELONG WEST | C31: BRUSHFIELD | F31: GIBBONS | I31: O'DONNELL | L31: HARDIMAN | O31: ADAMS
A32: FRANKSTON | C32: ANDERSON | F32: KERR | I32: SLADE | L32: CARR | O32: LOVELL | Q32: BISHOP
A33: GOALKICKERS
A34: GEELONG WEST | C34: O'DONNELL 5 | F34: EMOND 3 | H34: GIBBONS 3 | K34: BRUSHFIELD 2 | N34: ADAMS 2 | P34: DEEATH 2 | S34: HOVEY
A35: FRANKSTON | C35: KERR 3 | E35: HINES 3 | G35: CARR 2 | I35: BISHOP 2 | K35: SHEPPARD 2 | N35: ANDERSON | Q35: HEPNER | S35: LEE | U35: LOVELL
E36: 14TH QPRIL | J36: WEATHER
A37: WERRIBEE | C37: 2 | D37: 3 | E37: =C37*6+D37 -> 15 | G37: 5 | H37: 6 | I37: =G37*6+H37 -> 36 | K37: 7 | L37: 10 | M37: =K37*6+L37 -> 52 | O37: 12 | P37: 13 | Q37: =O37*6+P37 -> 85 | S37: WERRIBEE
A38: SUNSHINE | C38: 1 | D38: 4 | E38: =C38*6+D38 -> 10 | G38: 3 | H38: 9 | I38: =G38*6+H38 -> 27 | K38: 7 | L38: 13 | M38: =K38*6+L38 -> 55 | O38: 11 | P38: 15 | Q38: =O38*6+P38 -> 81
A39: BEST PLAYERS
A40: WERRIBEE | C40: COMBEN | F40: SMITH | I40: DOVE | L40: CHIRGWIN | O40: OGILVIE | Q40: LYONS
A41: SUNSHINE | C41: MUNRO | F41: BENSON | I41: BEAN | L41: McGARRITY | O41: HARRIS
A42: GOALKICKERS
A43: WERRIBEE | C43: JAMESON 3 | F43: CHIRGWIN 2 | I43: SHEAHAN 2 | K43: CROMPTON 2 | N43: TRAINION | P43: HEMLEY | R43: HUMPHRIES
A44: SUNSHINE | C44: HARRIS 5 | F44: WEAKLEY 3 | I44: BENSON 2 | L44: CROSBIE
A46: NORTHCOTE | C46: 0 | D46: 0 | E46: =C46*6+D46 -> 0 | G46: 0 | H46: 0 | I46: =G46*6+H46 -> 0 | K46: 0 | L46: 0 | M46: =K46*6+L46 -> 0 | O46: 15 | P46: 12 | Q46: =O46*6+P46 -> 102 | S46: NORTHCOTE
A47: MORDIALLOC | C47: 0 | D47: 0 | E47: =C47*6+D47 -> 0 | G47: 0 | H47: 0 | I47: =G47*6+H47 -> 0 | K47: 0 | L47: 0 | M47: =K47*6+L47 -> 0 | O47: 11 | P47: 14 | Q47: =O47*6+P47 -> 80
A48: BEST PLAYERS
A49: NORTHCOTE
A50: MORDIALLOC
A51: GOALKICKERS
A52: NORTHCOTE
A53: MORDIALLOC
A55: ROUND 2 | E55: 20TH APRIL | J55: WEATHER | S55: PLAYED AT
D56: 1ST QTR | H56: 2ND QTR | L56: 3RD QTR | P56: FINAL | S56: WILLIAMSTOWN
A57: WILLIAMSTOWN | C57: 2 | D57: 7 | E57: =C57*6+D57 -> 19 | G57: 6 | H57: 12 | I57: =G57*6+H57 -> 48 | K57: 11 | L57: 15 | M57: =K57*6+L57 -> 81 | O57: 12 | P57: 21 | Q57: =O57*6+P57 -> 93 | S57: UMPIRE | X57: LADDER | AB57: ROUND | AD57: 2
A58: WERRIBEE | C58: 1 | D58: 2 | E58: =C58*6+D58 -> 8 | G58: 3 | H58: 4 | I58: =G58*6+H58 -> 22 | K58: 3 | L58: 7 | M58: =K58*6+L58 -> 25 | O58: 4 | P58: 7 | Q58: =O58*6+P58 -> 31
A59: BEST PLAYERS | W59: TEAM | X59: W | Y59: L | Z59: D | AA59: FOR | AB59: AGST | AC59: % | AD59: PTS
A60: WILLIAMSTOWN | C60: BUCHANAN | F60: PAPLEY | I60: JOHNSON | L60: WARE | O60: LANE | Q60: BARNES
A61: WERRIBEE | C61: OGILVIE | F61: COMBEN | I61: SMITH | L61: TAYLOR | O61: DOVE | Q61: TYQUIN | W61: WILLIAMSTOWN | X61: 2 | Y61: 0 | Z61: 0 | AA61: 160 | AB61: 84 | AC61: =(AA61*100)/AB61 -> 190.47619047619048 | AD61: =(X61*4)+(Z61*2) -> 8
A62: GOALKICKERS | W62: GEELONG WEST | X62: 2 | Y62: 0 | Z62: 0 | AA62: 246 | AB62: 160 | AC62: =(AA62*100)/AB62 -> 153.75 | AD62: =(X62*4)+(Z62*2) -> 8
A63: WILLIAMSTOWN | C63: NANKERVIS 5 | F63: SZYSZKA 4 | I63: PAPLEY | L63: MADIGAN | O63: KNIGHT | W63: CAMBERWELL | X63: 2 | Y63: 0 | Z63: 0 | AA63: 185 | AB63: 162 | AC63: =(AA63*100)/AB63 -> 114.19753086419753 | AD63: =(X63*4)+(Z63*2) -> 8
A64: WERRIBEE | C64: SHEAHAN 2 | F64: LYONS 2 | W64: SUNSHINE | X64: 1 | Y64: 1 | Z64: 0 | AA64: 157 | AB64: 135 | AC64: =(AA64*100)/AB64 -> 116.29629629629629 | AD64: =(X64*4)+(Z64*2) -> 4
A66: SUNSHINE | C66: 3 | D66: 1 | E66: =C66*6+D66 -> 19 | G66: 9 | H66: 4 | I66: =G66*6+H66 -> 58 | K66: 10 | L66: 7 | M66: =K66*6+L66 -> 67 | O66: 11 | P66: 10 | Q66: =O66*6+P66 -> 76 | S66: SUNSHINE | W66: NORTHCOTE | X66: 1 | Y66: 1 | Z66: 0 | AA66: 152 | AB66: 156 | AC66: =(AA66*100)/AB66 -> 97.435897435897431 | AD66: =(X66*4)+(Z66*2) -> 4
A67: NORTHCOTE | C67: 1 | D67: 2 | E67: =C67*6+D67 -> 8 | G67: 2 | H67: 4 | I67: =G67*6+H67 -> 16 | K67: 5 | L67: 9 | M67: =K67*6+L67 -> 39 | O67: 6 | P67: 14 | Q67: =O67*6+P67 -> 50 | W67: BOX HILL | X67: 1 | Y67: 1 | Z67: 0 | AA67: 161 | AB67: 167 | AC67: =(AA67*100)/AB67 -> 96.407185628742511 | AD67: =(X67*4)+(Z67*2) -> 4
A68: BEST PLAYERS | W68: WERRIBEE | X68: 1 | Y68: 1 | Z68: 0 | AA68: 116 | AB68: 174 | AC68: =(AA68*100)/AB68 -> 66.666666666666671 | AD68: =(X68*4)+(Z68*2) -> 4
A69: SUNSHINE | C69: TREZISE | F69: BENSON | I69: TARCZON | L69: WEAKLEY | O69: CROSBIE | W69: FRANKSTON | X69: 0 | Y69: 2 | Z69: 0 | AA69: 196 | AB69: 218 | AC69: =(AA69*100)/AB69 -> 89.908256880733944 | AD69: =(X69*4)+(Z69*2) -> 0
A70: NORTHCOTE | C70: THOMPSON | F70: KEANE | I70: R WHITE | L70: UNDERWOOD | O70: HENRY | Q70: N WHITE | W70: MORDIALLOC | X70: 0 | Y70: 2 | Z70: 0 | AA70: 157 | AB70: 186 | AC70: =(AA70*100)/AB70 -> 84.408602150537632 | AD70: =(X70*4)+(Z70*2) -> 0
A71: GOALKICKERS | W71: CAULFIELD | X71: 0 | Y71: 2 | Z71: 0 | AA71: 102 | AB71: 190 | AC71: =(AA71*100)/AB71 -> 53.684210526315788 | AD71: =(X71*4)+(Z71*2) -> 0
A72: SUNSHINE | C72: CROSBIE 3 | F72: HARRIS 3 | H72: DEAN | J72: BROWN | L72: BENSON | N72: HIPWORTH | Q72: WEAKLEY
A73: NORTHCOTE | C73: R WHITE 2 | F73: N WHITE | I73: DEAN | K73: HENRY | M73: MICKLESON
A75: BOX HILL | C75: 2 | D75: 4 | E75: =C75*6+D75 -> 16 | G75: 5 | H75: 7 | I75: =G75*6+H75 -> 37 | K75: 7 | L75: 10 | M75: =K75*6+L75 -> 52 | O75: 12 | P75: 12 | Q75: =O75*6+P75 -> 84 | S75: MORDIALLOC
A76: MORDIALLOC | C76: 3 | D76: 1 | E76: =C76*6+D76 -> 19 | G76: 5 | H76: 7 | I76: =G76*6+H76 -> 37 | K76: 7 | L76: 8 | M76: =K76*6+L76 -> 50 | O76: 11 | P76: 11 | Q76: =O76*6+P76 -> 77
A77: BEST PLAYERS
A78: BOX HILL | C78: BRYANT | F78: C FELLOWS | I78: WADE | L78: RONALDSON | O78: LOOMES
A79: MORDIALLOC | C79: BACKMAN | F79: DANCKERT | I79: GROVES | L79: THOMPSON | O79: HYNES
A80: GOALKICKERS
A81: BOX HILL | C81: C FELLOWS 4 | F81: BRYANT 3 | I81: LA ROCHE | L81: SALMON | N81: DOULIS | P81: BAKER | R81: LOOMES
A82: MORDIALLOC | C82: THOMPSON 4 | F82: HYNES 2 | I82: GROVES 2 | L82: DAVEY | N82: BACKMAN | Q82: GARDINER
A84: CAMBERWELL | C84: 3 | D84: 5 | E84: =C84*6+D84 -> 23 | G84: 8 | H84: 8 | I84: =G84*6+H84 -> 56 | K84: 10 | L84: 9 | M84: =K84*6+L84 -> 69 | O84: 13 | P84: 17 | Q84: =O84*6+P84 -> 95 | S84: CAMBERWELL
A85: FRANKSTON | C85: 3 | D85: 5 | E85: =C85*6+D85 -> 23 | G85: 6 | H85: 6 | I85: =G85*6+H85 -> 42 | K85: 9 | L85: 16 | M85: =K85*6+L85 -> 70 | O85: 11 | P85: 19 | Q85: =O85*6+P85 -> 85
A86: BEST PLAYERS
A87: CAMBERWELL | C87: ALLISON | F87: CONYERS | I87: PECK | L87: McNAMARA | O87: RIETSHAL | R87: ARMSTRONG
A88: FRANKSTON | C88: THATCHER | F88: BISHOP | I88: BLAKE | L88: KERR
A89: GOALKICKERS
A90: CAMBERWELL | C90: McNAMARA 4 | F90: WICKS 3 | I90: DELANTY 2 | L90: COLLINS | N90: J SMITH | Q90: PECK | S90: CONYERS
A91: FRANKSTON | C91: THATCHER 3 | F91: SLOANE 2 | I91: LEWIS 2 | K91: SHEPPARD 2 | N91: HUGHES | Q91: BISHOP
A93: GEELONG WEST | C93: 4 | D93: 3 | E93: =C93*6+D93 -> 27 | G93: 6 | H93: 7 | I93: =G93*6+H93 -> 43 | K93: 13 | L93: 7 | M93: =K93*6+L93 -> 85 | O93: 19 | P93: 9 | Q93: =O93*6+P93 -> 123 | S93: GEELONG WEST
A94: CAULFIELD | C94: 2 | D94: 1 | E94: =C94*6+D94 -> 13 | G94: 2 | H94: 3 | I94: =G94*6+H94 -> 15 | K94: 3 | L94: 3 | M94: =K94*6+L94 -> 21 | O94: 7 | P94: 7 | Q94: =O94*6+P94 -> 49
A95: BEST PLAYERS
A96: GEELONG WEST | C96: ADAMS | F96: STACEY | I96: KEAYS | L96: GIBBONS | O96: OLIVER | R96: LARKINS
A97: CAULFIELD | C97: CLARK | F97: FARRELLY | I97: GOWANS | L97: BAKER | O97: SANDERS | R97: STONE
A98: GOALKICKERS
A99: GEELONG WEST | C99: GIBBONS 6 | F99: EVANS 5 | H99: BRUSHFIELD 2 | K99: ADAMS 2 | N99: O'DONNELL | P99: HARRIS | R99: JENNINGS | T99: HOVEY
A100: CAULFIELD | C100: BAKER 3 | F100: MORGAN 2 | I100: ARRELL | K100: LOGAN
A102: ROUND 3 | E102: 27TH APRIL | J102: WEATHER | S102: PLAYED AT
D103: 1ST QTR | H103: 2ND QTR | L103: 3RD QTR | P103: FINAL | S103: FRANKSTON
A104: WILLIAMSTOWN | C104: 1 | D104: 3 | E104: =C104*6+D104 -> 9 | G104: 5 | H104: 7 | I104: =G104*6+H104 -> 37 | K104: 15 | L104: 11 | M104: =K104*6+L104 -> 101 | O104: 23 | P104: 16 | Q104: =O104*6+P104 -> 154 | S104: UMPIRE | X104: LADDER | AB104: ROUND | AD104: 3
A105: FRANKSTON | C105: 7 | D105: 3 | E105: =C105*6+D105 -> 45 | G105: 12 | H105: 6 | I105: =G105*6+H105 -> 78 | K105: 15 | L105: 8 | M105: =K105*6+L105 -> 98 | O105: 18 | P105: 8 | Q105: =O105*6+P105 -> 116
A106: BEST PLAYERS | W106: TEAM | X106: W | Y106: L | Z106: D | AA106: FOR | AB106: AGST | AC106: % | AD106: PTS
A107: WILLIAMSTOWN | C107: PAPLEY | F107: NANKERVIS | I107: COFFEY | L107: WARE | O107: BARNES | R107: LANE
A108: FRANKSTON | C108: SLADE | F108: HINES | I108: THATCHER | L108: KERR | O108: CARR | R108: HEPNER | W108: GEELONG WEST | X108: 3 | Y108: 0 | Z108: 0 | AA108: 395 | AB108: 223 | AC108: =(AA108*100)/AB108 -> 177.13004484304932 | AD108: =(X108*4)+(Z108*2) -> 12
A109: GOALKICKERS | R109: SMITH | W109: WILLIAMSTOWN | X109: 3 | Y109: 0 | Z109: 0 | AA109: 314 | AB109: 200 | AC109: =(AA109*100)/AB109 -> 157 | AD109: =(X109*4)+(Z109*2) -> 12
A110: WILLIAMSTOWN | C110: NANKERVIS 6 | F110: SZYSZKA 4 | H110: WARE 4 | J110: PAPLEY 2 | L110: MEYERS 2 | N110: BUCHANAN 2 | Q110: COFFEY | S110: MADIGAN | W110: SUNSHINE | X110: 2 | Y110: 1 | Z110: 0 | AA110: 248 | AB110: 196 | AC110: =(AA110*100)/AB110 -> 126.53061224489795 | AD110: =(X110*4)+(Z110*2) -> 8
A111: FRANKSTON | C111: KERR 4 | E111: HEPNER 3 | G111: THATCHER 3 | J111: CARR 3 | L111: SLADE | N111: LEE | O111: HINES | Q111: BOWES | S111: GARDINER | W111: CAMBERWELL | X111: 2 | Y111: 1 | Z111: 0 | AA111: 246 | AB111: 253 | AC111: =(AA111*100)/AB111 -> 97.233201581027672 | AD111: =(X111*4)+(Z111*2) -> 8
A113: CAULFIELD | C113: 3 | D113: 2 | E113: =C113*6+D113 -> 20 | G113: 4 | H113: 4 | I113: =G113*6+H113 -> 28 | K113: 9 | L113: 9 | M113: =K113*6+L113 -> 63 | O113: 14 | P113: 17 | Q113: =O113*6+P113 -> 101 | S113: BOX HILL | W113: WERRIBEE | X113: 2 | Y113: 1 | Z113: 0 | AA113: 215 | AB113: 267 | AC113: =(AA113*100)/AB113 -> 80.524344569288388 | AD113: =(X113*4)+(Z113*2) -> 8
A114: BOX HILL | C114: 3 | D114: 3 | E114: =C114*6+D114 -> 21 | G114: 5 | H114: 7 | I114: =G114*6+H114 -> 37 | K114: 6 | L114: 11 | M114: =K114*6+L114 -> 47 | O114: 8 | P114: 13 | Q114: =O114*6+P114 -> 61 | W114: NORTHCOTE | X114: 1 | Y114: 2 | Z114: 0 | AA114: 245 | AB114: 255 | AC114: =(AA114*100)/AB114 -> 96.078431372549019 | AD114: =(X114*4)+(Z114*2) -> 4
A115: BEST PLAYERS | W115: BOX HILL | X115: 1 | Y115: 2 | Z115: 0 | AA115: 222 | AB115: 268 | AC115: =(AA115*100)/AB115 -> 82.835820895522389 | AD115: =(X115*4)+(Z115*2) -> 4
A116: CAULFIELD | C116: BAKER | F116: HORGAN | I116: DOUGLAS | L116: GOWANS | O116: LOGAN | R116: ROWE | W116: CAULFIELD | X116: 1 | Y116: 2 | Z116: 0 | AA116: 203 | AB116: 251 | AC116: =(AA116*100)/AB116 -> 80.876494023904385 | AD116: =(X116*4)+(Z116*2) -> 4
A117: BOX HILL | C117: C FELLOWS | F117: JONES | I117: G FELLOWS | L117: LOOMES | O117: SALMON | R117: WADE | W117: FRANKSTON | X117: 0 | Y117: 3 | Z117: 0 | AA117: 312 | AB117: 372 | AC117: =(AA117*100)/AB117 -> 83.870967741935488 | AD117: =(X117*4)+(Z117*2) -> 0
A118: GOALKICKERS | W118: MORDIALLOC | X118: 0 | Y118: 3 | Z118: 0 | AA118: 220 | AB118: 335 | AC118: =(AA118*100)/AB118 -> 65.671641791044777 | AD118: =(X118*4)+(Z118*2) -> 0
A119: CAULFIELD | C119: BAKER 3 | E119: HORGAN 3 | G119: GOWANS 2 | J119: DOUGLAS 2 | M119: LOGAN 2 | O119: ROWE 2
A120: BOX HILL | C120: BOWYER-SMITH 2 | G120: C FELLOWS | J120: LOOMES | L120: WADE | N120: BRYANT | P120: DOULIS | R120: NOLAN
A122: WERRIBEE | C122: 4 | D122: 2 | E122: =C122*6+D122 -> 26 | G122: 8 | H122: 6 | I122: =G122*6+H122 -> 54 | K122: 10 | L122: 11 | M122: =K122*6+L122 -> 71 | O122: 14 | P122: 15 | Q122: =O122*6+P122 -> 99 | S122: NORTHCOTE
A123: NORTHCOTE | C123: 1 | D123: 4 | E123: =C123*6+D123 -> 10 | G123: 2 | H123: 8 | I123: =G123*6+H123 -> 20 | K123: 11 | L123: 13 | M123: =K123*6+L123 -> 79 | O123: 13 | P123: 15 | Q123: =O123*6+P123 -> 93
A124: BEST PLAYERS
A125: WERRIBEE | C125: ANDERSON | F125: HEMLEY | I125: LYONS | L125: COMBEN | O125: TAYLOR | R125: DOVE
A126: NORTHCOTE | C126: TEESE | F126: UNDERWOOD | I126: McBREEN | L126: ELLIS | O126: MUIR | R126: N WHITE
A127: GOALKICKERS
A128: WERRIBEE | C128: LYONS 4 | E128: HEMLEY 4 | H128: CHIRGWIN 3 | K128: GOULOPOLOUS 2 | N128: TAYLOR
A129: NORTHCOTE | C129: N WHITE 2 | F129: DEAN 2 | H129: SIMPSON | J129: R WHITE | L129: MUIR | N129: KEANE | P129: UNDERWOOD | S129: MICKLESON | V129: McBREEN | X129: TEESE | Z129: HENRY
E130: 28TH APRIL | I130: WEATHER
A131: SUNSHINE | C131: 4 | D131: 7 | E131: =C131*6+D131 -> 31 | G131: 7 | H131: 8 | I131: =G131*6+H131 -> 50 | K131: 8 | L131: 15 | M131: =K131*6+L131 -> 63 | O131: 12 | P131: 19 | Q131: =O131*6+P131 -> 91 | S131: SUNSHINE
A132: CAMBERWELL | C132: 0 | D132: 1 | E132: =C132*6+D132 -> 1 | G132: 3 | H132: 7 | I132: =G132*6+H132 -> 25 | K132: 4 | L132: 8 | M132: =K132*6+L132 -> 32 | O132: 8 | P132: 13 | Q132: =O132*6+P132 -> 61
A133: BEST PLAYERS
A134: SUNSHINE | C134: HIPWORTH | F134: CLARKE | I134: TARCZON | L134: TREZISE | O134: HARRIS | R134: McLEOD
A135: CAMBERWELL | C135: DELANTY | F135: D BOYD | I135: L BOYD | L135: RIETSCHEL | O135: ARMSTRONG | R135: PECK
A136: GOALKICKERS
A137: SUNSHINE | C137: HARRIS 6 | F137: HIPWORTH 2 | I137: TARCZON 2 | L137: DEAN | N137: EDWARDS
A138: CAMBERWELL | C138: WICKS 3 | F138: DELANTY 3 | I138: McNAMARA | L138: ALLISON | N138: L BOYD
A140: GEELONG WEST | C140: 4 | D140: 6 | E140: =C140*6+D140 -> 30 | G140: 8 | H140: 11 | I140: =G140*6+H140 -> 59 | K140: 14 | L140: 19 | M140: =K140*6+L140 -> 103 | O140: 21 | P140: 23 | Q140: =O140*6+P140 -> 149 | S140: GEELONG WEST
A141: MORDIALLOC | C141: 3 | D141: 1 | E141: =C141*6+D141 -> 19 | G141: 6 | H141: 6 | I141: =G141*6+H141 -> 42 | K141: 7 | L141: 6 | M141: =K141*6+L141 -> 48 | O141: 9 | P141: 9 | Q141: =O141*6+P141 -> 63
A142: BEST PLAYERS
A143: GEELONG WEST | C143: OLIVER | F143: HARRIS | I143: ADAMS | L143: HENRY | O143: GIBBONS | R143: HARDIMAN
A144: MORDIALLOC | C144: WILLIS | F144: WILLIAMS | I144: GARDINER | L144: WILLIAMSON | O144: DAVEY | R144: LAIRD
A145: GOALKICKERS
A146: GEELONG WEST | C146: ADAMS 5 | F146: ? 4 | H146: GIBBONS 3 | K146: BRUSHFIELD 3 | N146: BIEN 2 | P146: HOVEY | R146: EMOND | T146: HARRIS | V146: DEEATH
A147: MORDIALLOC | C147: POWER 2 | E147: ANDERSON | H147: DAVEY | J147: MONCRIEFF | M147: HYNES | O147: GARDINER | R147: DANCKERT
A149: ROUND 4 | E149: 4TH MAY | J149: WEATHER | S149: PLAYED AT
D150: 1ST QTR | H150: 2ND QTR | L150: 3RD QTR | P150: FINAL | S150: WERRIBEE
A151: WERRIBEE | C151: 0 | D151: 0 | E151: =C151*6+D151 -> 0 | G151: 0 | H151: 0 | I151: =G151*6+H151 -> 0 | K151: 0 | L151: 0 | M151: =K151*6+L151 -> 0 | O151: 8 | P151: 11 | Q151: =O151*6+P151 -> 59 | S151: UMPIRE | X151: LADDER | AB151: ROUND | AD151: 4
A152: BOX HILL | C152: 0 | D152: 0 | E152: =C152*6+D152 -> 0 | G152: 0 | H152: 0 | I152: =G152*6+H152 -> 0 | K152: 0 | L152: 0 | M152: =K152*6+L152 -> 0 | O152: 8 | P152: 6 | Q152: =O152*6+P152 -> 54
A153: BEST PLAYERS | W153: TEAM | X153: W | Y153: L | Z153: D | AA153: FOR | AB153: AGST | AC153: % | AD153: PTS
A154: WERRIBEE
A155: BOX HILL | W155: WILLIAMSTOWN | X155: 4 | Y155: 0 | Z155: 0 | AA155: 416 | AB155: 289 | AC155: =(AA155*100)/AB155 -> 143.94463667820068 | AD155: =(X155*4)+(Z155*2) -> 16
A156: GOALKICKERS | W156: GEELONG WEST | X156: 3 | Y156: 1 | Z156: 0 | AA156: 484 | AB156: 325 | AC156: =(AA156*100)/AB156 -> 148.92307692307693 | AD156: =(X156*4)+(Z156*2) -> 12
A157: WERRIBEE | W157: WERRIBEE | X157: 3 | Y157: 1 | Z157: 0 | AA157: 273 | AB157: 321 | AC157: =(AA157*100)/AB157 -> 85.046728971962622 | AD157: =(X157*4)+(Z157*2) -> 12
A158: BOX HILL | W158: SUNSHINE | X158: 2 | Y158: 2 | Z158: 0 | AA158: 327 | AB158: 285 | AC158: =(AA158*100)/AB158 -> 114.73684210526316 | AD158: =(X158*4)+(Z158*2) -> 8
A160: NORTHCOTE | C160: 0 | D160: 0 | E160: =C160*6+D160 -> 0 | G160: 0 | H160: 0 | I160: =G160*6+H160 -> 0 | K160: 0 | L160: 0 | M160: =K160*6+L160 -> 0 | O160: 12 | P160: 19 | Q160: =O160*6+P160 -> 91 | S160: CAMBERWELL | W160: NORTHCOTE | X160: 2 | Y160: 2 | Z160: 0 | AA160: 336 | AB160: 324 | AC160: =(AA160*100)/AB160 -> 103.70370370370371 | AD160: =(X160*4)+(Z160*2) -> 8
A161: CAMBERWELL | C161: 0 | D161: 0 | E161: =C161*6+D161 -> 0 | G161: 0 | H161: 0 | I161: =G161*6+H161 -> 0 | K161: 0 | L161: 0 | M161: =K161*6+L161 -> 0 | O161: 10 | P161: 9 | Q161: =O161*6+P161 -> 69 | W161: CAMBERWELL | X161: 2 | Y161: 2 | Z161: 0 | AA161: 315 | AB161: 344 | AC161: =(AA161*100)/AB161 -> 91.569767441860463 | AD161: =(X161*4)+(Z161*2) -> 8
A162: BEST PLAYERS | W162: FRANKSTON | X162: 1 | Y162: 3 | Z162: 0 | AA162: 428 | AB162: 448 | AC162: =(AA162*100)/AB162 -> 95.535714285714292 | AD162: =(X162*4)+(Z162*2) -> 4
A163: NORTHCOTE | W163: BOX HILL | X163: 1 | Y163: 3 | Z163: 0 | AA163: 276 | AB163: 327 | AC163: =(AA163*100)/AB163 -> 84.403669724770637 | AD163: =(X163*4)+(Z163*2) -> 4
A164: CAMBERWELL | W164: CAULFIELD | X164: 1 | Y164: 3 | Z164: 0 | AA164: 279 | AB164: 367 | AC164: =(AA164*100)/AB164 -> 76.021798365122621 | AD164: =(X164*4)+(Z164*2) -> 4
A165: GOALKICKERS | W165: MORDIALLOC | X165: 1 | Y165: 3 | Z165: 0 | AA165: 309 | AB165: 414 | AC165: =(AA165*100)/AB165 -> 74.637681159420296 | AD165: =(X165*4)+(Z165*2) -> 4
A166: NORTHCOTE
A167: CAMBERWELL
A169: FRANKSTON | C169: 0 | D169: 0 | E169: =C169*6+D169 -> 0 | G169: 0 | H169: 0 | I169: =G169*6+H169 -> 0 | K169: 0 | L169: 0 | M169: =K169*6+L169 -> 0 | O169: 17 | P169: 14 | Q169: =O169*6+P169 -> 116 | S169: PRINCES PARK, CAULFIELD
A170: CAULFIELD | C170: 0 | D170: 0 | E170: =C170*6+D170 -> 0 | G170: 0 | H170: 0 | I170: =G170*6+H170 -> 0 | K170: 0 | L170: 0 | M170: =K170*6+L170 -> 0 | O170: 11 | P170: 10 | Q170: =O170*6+P170 -> 76
A171: BEST PLAYERS
A172: FRANKSTON
A173: CAULFIELD
A174: GOALKICKERS
A175: FRANKSTON
A176: CAULFIELD
E177: 5TH MAY | I177: WEATHER
A178: WILLIAMSTOWN | C178: 0 | D178: 0 | E178: =C178*6+D178 -> 0 | G178: 0 | H178: 0 | I178: =G178*6+H178 -> 0 | K178: 0 | L178: 0 | M178: =K178*6+L178 -> 0 | O178: 15 | P178: 12 | Q178: =O178*6+P178 -> 102 | S178: WILLIAMSTOWN
A179: GEELONG WEST | C179: 0 | D179: 0 | E179: =C179*6+D179 -> 0 | G179: 0 | H179: 0 | I179: =G179*6+H179 -> 0 | K179: 0 | L179: 0 | M179: =K179*6+L179 -> 0 | O179: 13 | P179: 11 | Q179: =O179*6+P179 -> 89
A180: BEST PLAYERS
A181: WILLIAMSTOWN
A182: GEELONG WEST
A183: GOALKICKERS
A184: WILLIAMSTOWN
A185: GEELONG WEST
A187: MORDIALLOC | C187: 0 | D187: 0 | E187: =C187*6+D187 -> 0 | G187: 0 | H187: 0 | I187: =G187*6+H187 -> 0 | K187: 0 | L187: 0 | M187: =K187*6+L187 -> 0 | O187: 12 | P187: 17 | Q187: =O187*6+P187 -> 89 | S187: MORDIALLOC
A188: SUNSHINE | C188: 0 | D188: 0 | E188: =C188*6+D188 -> 0 | G188: 0 | H188: 0 | I188: =G188*6+H188 -> 0 | K188: 0 | L188: 0 | M188: =K188*6+L188 -> 0 | O188: 11 | P188: 13 | Q188: =O188*6+P188 -> 79
A189: BEST PLAYERS
A190: MORDIALLOC
A191: SUNSHINE
A192: GOALKICKERS
A193: MORDIALLOC
A194: SUNSHINE
A196: ROUND 5 | E196: 11TH MAY | J196: WEATHER | S196: PLAYED AT
D197: 1ST QTR | H197: 2ND QTR | L197: 3RD QTR | P197: FINAL | S197: FRANKSTON
A198: FRANKSTON | C198: 0 | D198: 0 | E198: =C198*6+D198 -> 0 | G198: 0 | H198: 0 | I198: =G198*6+H198 -> 0 | K198: 0 | L198: 0 | M198: =K198*6+L198 -> 0 | O198: 21 | P198: 17 | Q198: =O198*6+P198 -> 143 | S198: UMPIRE | X198: LADDER | AB198: ROUND | AD198: 5
A199: WERRIBEE | C199: 0 | D199: 0 | E199: =C199*6+D199 -> 0 | G199: 0 | H199: 0 | I199: =G199*6+H199 -> 0 | K199: 0 | L199: 0 | M199: =K199*6+L199 -> 0 | O199: 8 | P199: 9 | Q199: =O199*6+P199 -> 57
A200: BEST PLAYERS | W200: TEAM | X200: W | Y200: L | Z200: D | AA200: FOR | AB200: AGST | AC200: % | AD200: PTS
A201: FRANKSTON
A202: WERRIBEE | W202: WILLIAMSTOWN | X202: 5 | Y202: 0 | Z202: 0 | AA202: 556 | AB202: 377 | AC202: =(AA202*100)/AB202 -> 147.48010610079575 | AD202: =(X202*4)+(Z202*2) -> 20
A203: GOALKICKERS | W203: SUNSHINE | X203: 3 | Y203: 2 | Z203: 0 | AA203: 471 | AB203: 364 | AC203: =(AA203*100)/AB203 -> 129.39560439560441 | AD203: =(X203*4)+(Z203*2) -> 12
A204: FRANKSTON | W204: GEELONG WEST | X204: 3 | Y204: 2 | Z204: 0 | AA204: 563 | AB204: 469 | AC204: =(AA204*100)/AB204 -> 120.04264392324095 | AD204: =(X204*4)+(Z204*2) -> 12
A205: WERRIBEE | W205: NORTHCOTE | X205: 3 | Y205: 2 | Z205: 0 | AA205: 444 | AB205: 415 | AC205: =(AA205*100)/AB205 -> 106.98795180722891 | AD205: =(X205*4)+(Z205*2) -> 12
A207: NORTHCOTE | C207: 0 | D207: 0 | E207: =C207*6+D207 -> 0 | G207: 0 | H207: 0 | I207: =G207*6+H207 -> 0 | K207: 0 | L207: 0 | M207: =K207*6+L207 -> 0 | O207: 16 | P207: 12 | Q207: =O207*6+P207 -> 108 | S207: BOX HILL | W207: WERRIBEE | X207: 3 | Y207: 2 | Z207: 0 | AA207: 330 | AB207: 464 | AC207: =(AA207*100)/AB207 -> 71.120689655172413 | AD207: =(X207*4)+(Z207*2) -> 12
A208: BOX HILL | C208: 0 | D208: 0 | E208: =C208*6+D208 -> 0 | G208: 0 | H208: 0 | I208: =G208*6+H208 -> 0 | K208: 0 | L208: 0 | M208: =K208*6+L208 -> 0 | O208: 14 | P208: 7 | Q208: =O208*6+P208 -> 91 | W208: FRANKSTON | X208: 2 | Y208: 3 | Z208: 0 | AA208: 571 | AB208: 505 | AC208: =(AA208*100)/AB208 -> 113.06930693069307 | AD208: =(X208*4)+(Z208*2) -> 8
A209: BEST PLAYERS | W209: MORDIALLOC | X209: 2 | Y209: 3 | Z209: 0 | AA209: 438 | AB209: 517 | AC209: =(AA209*100)/AB209 -> 84.719535783365572 | AD209: =(X209*4)+(Z209*2) -> 8
A210: NORTHCOTE | W210: CAMBERWELL | X210: 2 | Y210: 3 | Z210: 0 | AA210: 403 | AB210: 484 | AC210: =(AA210*100)/AB210 -> 83.264462809917362 | AD210: =(X210*4)+(Z210*2) -> 8
A211: BOX HILL | W211: BOX HILL | X211: 1 | Y211: 4 | Z211: 0 | AA211: 367 | AB211: 435 | AC211: =(AA211*100)/AB211 -> 84.367816091954026 | AD211: =(X211*4)+(Z211*2) -> 4
A212: GOALKICKERS | W212: CAULFIELD | X212: 1 | Y212: 4 | Z212: 0 | AA212: 382 | AB212: 496 | AC212: =(AA212*100)/AB212 -> 77.016129032258064 | AD212: =(X212*4)+(Z212*2) -> 4
A213: NORTHCOTE
A214: BOX HILL
A216: SUNSHINE | C216: 0 | D216: 0 | E216: =C216*6+D216 -> 0 | G216: 0 | H216: 0 | I216: =G216*6+H216 -> 0 | K216: 0 | L216: 0 | M216: =K216*6+L216 -> 0 | O216: 22 | P216: 12 | Q216: =O216*6+P216 -> 144 | S216: SUNSHINE
A217: GEELONG WEST | C217: 0 | D217: 0 | E217: =C217*6+D217 -> 0 | G217: 0 | H217: 0 | I217: =G217*6+H217 -> 0 | K217: 0 | L217: 0 | M217: =K217*6+L217 -> 0 | O217: 12 | P217: 7 | Q217: =O217*6+P217 -> 79
A218: BEST PLAYERS
A219: SUNSHINE
A220: GEELONG WEST
A221: GOALKICKERS
A222: SUNSHINE
A223: GEELONG WEST
A225: MORDIALLOC | C225: 0 | D225: 0 | E225: =C225*6+D225 -> 0 | G225: 0 | H225: 0 | I225: =G225*6+H225 -> 0 | K225: 0 | L225: 0 | M225: =K225*6+L225 -> 0 | O225: 19 | P225: 15 | Q225: =O225*6+P225 -> 129 | S225: MORDIALLOC
A226: CAULFIELD | C226: 0 | D226: 0 | E226: =C226*6+D226 -> 0 | G226: 0 | H226: 0 | I226: =G226*6+H226 -> 0 | K226: 0 | L226: 0 | M226: =K226*6+L226 -> 0 | O226: 16 | P226: 7 | Q226: =O226*6+P226 -> 103
A227: BEST PLAYERS
A228: MORDIALLOC
A229: CAULFIELD
A230: GOALKICKERS
A231: MORDIALLOC
A232: CAULFIELD
A234: WILLIAMSTOWN | C234: 0 | D234: 0 | E234: =C234*6+D234 -> 0 | G234: 0 | H234: 0 | I234: =G234*6+H234 -> 0 | K234: 0 | L234: 0 | M234: =K234*6+L234 -> 0 | O234: 20 | P234: 20 | Q234: =O234*6+P234 -> 140 | S234: CAMBERWELL
A235: CAMBERWELL | C235: 0 | D235: 0 | E235: =C235*6+D235 -> 0 | G235: 0 | H235: 0 | I235: =G235*6+H235 -> 0 | K235: 0 | L235: 0 | M235: =K235*6+L235 -> 0 | O235: 13 | P235: 10 | Q235: =O235*6+P235 -> 88
A236: BEST PLAYERS
A237: WILLIAMSTOWN
A238: CAMBERWELL
A239: GOALKICKERS
A240: WILLIAMSTOWN
A241: CAMBERWELL
A243: ROUND 6 | E243: 18TH MAY | J243: WEATHER | S243: PLAYED AT
D244: 1ST QTR | H244: 2ND QTR | L244: 3RD QTR | P244: FINAL | S244: BOX HILL
A245: SUNSHINE | C245: 0 | D245: 0 | E245: =C245*6+D245 -> 0 | G245: 0 | H245: 0 | I245: =G245*6+H245 -> 0 | K245: 0 | L245: 0 | M245: =K245*6+L245 -> 0 | O245: 8 | P245: 8 | Q245: =O245*6+P245 -> 56 | S245: UMPIRE | X245: LADDER | AB245: ROUND | AD245: 6
A246: BOX HILL | C246: 0 | D246: 0 | E246: =C246*6+D246 -> 0 | G246: 0 | H246: 0 | I246: =G246*6+H246 -> 0 | K246: 0 | L246: 0 | M246: =K246*6+L246 -> 0 | O246: 7 | P246: 12 | Q246: =O246*6+P246 -> 54
A247: BEST PLAYERS | W247: TEAM | X247: W | Y247: L | Z247: D | AA247: FOR | AB247: AGST | AC247: % | AD247: PTS
A248: SUNSHINE
A249: BOX HILL | W249: WILLIAMSTOWN | X249: 6 | Y249: 0 | Z249: 0 | AA249: 629 | AB249: 417 | AC249: =(AA249*100)/AB249 -> 150.83932853717027 | AD249: =(X249*4)+(Z249*2) -> 24
A250: GOALKICKERS | W250: GEELONG WEST | X250: 4 | Y250: 2 | Z250: 0 | AA250: 734 | AB250: 531 | AC250: =(AA250*100)/AB250 -> 138.22975517890771 | AD250: =(X250*4)+(Z250*2) -> 16
A251: SUNSHINE | W251: SUNSHINE | X251: 4 | Y251: 2 | Z251: 0 | AA251: 527 | AB251: 418 | AC251: =(AA251*100)/AB251 -> 126.07655502392345 | AD251: =(X251*4)+(Z251*2) -> 16
A252: BOX HILL | W252: NORTHCOTE | X252: 4 | Y252: 2 | Z252: 0 | AA252: 545 | AB252: 472 | AC252: =(AA252*100)/AB252 -> 115.46610169491525 | AD252: =(X252*4)+(Z252*2) -> 16
A254: NORTHCOTE | C254: 0 | D254: 0 | E254: =C254*6+D254 -> 0 | G254: 0 | H254: 0 | I254: =G254*6+H254 -> 0 | K254: 0 | L254: 0 | M254: =K254*6+L254 -> 0 | O254: 15 | P254: 11 | Q254: =O254*6+P254 -> 101 | S254: NORTHCOTE | W254: WERRIBEE | X254: 4 | Y254: 2 | Z254: 0 | AA254: 420 | AB254: 544 | AC254: =(AA254*100)/AB254 -> 77.205882352941174 | AD254: =(X254*4)+(Z254*2) -> 16
A255: FRANKSTON | C255: 0 | D255: 0 | E255: =C255*6+D255 -> 0 | G255: 0 | H255: 0 | I255: =G255*6+H255 -> 0 | K255: 0 | L255: 0 | M255: =K255*6+L255 -> 0 | O255: 9 | P255: 13 | Q255: =O255*6+P255 -> 67 | W255: FRANKSTON | X255: 2 | Y255: 4 | Z255: 0 | AA255: 638 | AB255: 606 | AC255: =(AA255*100)/AB255 -> 105.28052805280528 | AD255: =(X255*4)+(Z255*2) -> 8
A256: BEST PLAYERS | W256: MORDIALLOC | X256: 2 | Y256: 4 | Z256: 0 | AA256: 478 | AB256: 590 | AC256: =(AA256*100)/AB256 -> 81.016949152542367 | AD256: =(X256*4)+(Z256*2) -> 8
A257: NORTHCOTE | W257: CAMBERWELL | X257: 2 | Y257: 4 | Z257: 0 | AA257: 465 | AB257: 655 | AC257: =(AA257*100)/AB257 -> 70.992366412213741 | AD257: =(X257*4)+(Z257*2) -> 8
A258: FRANKSTON | W258: BOX HILL | X258: 1 | Y258: 5 | Z258: 0 | AA258: 421 | AB258: 491 | AC258: =(AA258*100)/AB258 -> 85.743380855397149 | AD258: =(X258*4)+(Z258*2) -> 4
A259: GOALKICKERS | W259: CAULFIELD | X259: 1 | Y259: 5 | Z259: 0 | AA259: 462 | AB259: 586 | AC259: =(AA259*100)/AB259 -> 78.839590443686006 | AD259: =(X259*4)+(Z259*2) -> 4
A260: NORTHCOTE
A261: FRANKSTON
A263: WERRIBEE | C263: 0 | D263: 0 | E263: =C263*6+D263 -> 0 | G263: 0 | H263: 0 | I263: =G263*6+H263 -> 0 | K263: 0 | L263: 0 | M263: =K263*6+L263 -> 0 | O263: 11 | P263: 24 | Q263: =O263*6+P263 -> 90 | S263: PRINCES PARK, CAULFIELD
A264: CAULFIELD | C264: 0 | D264: 0 | E264: =C264*6+D264 -> 0 | G264: 0 | H264: 0 | I264: =G264*6+H264 -> 0 | K264: 0 | L264: 0 | M264: =K264*6+L264 -> 0 | O264: 11 | P264: 14 | Q264: =O264*6+P264 -> 80
A265: BEST PLAYERS
A266: WERRIBEE
A267: CAULFIELD
A268: GOALKICKERS
A269: WERRIBEE
A270: CAULFIELD
A272: WILLIAMSTOWN | C272: 0 | D272: 0 | E272: =C272*6+D272 -> 0 | G272: 0 | H272: 0 | I272: =G272*6+H272 -> 0 | K272: 0 | L272: 0 | M272: =K272*6+L272 -> 0 | O272: 11 | P272: 7 | Q272: =O272*6+P272 -> 73 | S272: WILLIAMSTOWN
A273: MORDIALLOC | C273: 0 | D273: 0 | E273: =C273*6+D273 -> 0 | G273: 0 | H273: 0 | I273: =G273*6+H273 -> 0 | K273: 0 | L273: 0 | M273: =K273*6+L273 -> 0 | O273: 6 | P273: 4 | Q273: =O273*6+P273 -> 40
A274: BEST PLAYERS
A275: WILLIAMSTOWN
A276: MORDIALLOC
A277: GOALKICKERS
A278: WILLIAMSTOWN
A279: MORDIALLOC
A281: GEELONG WEST | C281: 0 | D281: 0 | E281: =C281*6+D281 -> 0 | G281: 0 | H281: 0 | I281: =G281*6+H281 -> 0 | K281: 0 | L281: 0 | M281: =K281*6+L281 -> 0 | O281: 24 | P281: 27 | Q281: =O281*6+P281 -> 171 | S281: GEELONG WEST
A282: CAMBERWELL | C282: 0 | D282: 0 | E282: =C282*6+D282 -> 0 | G282: 0 | H282: 0 | I282: =G282*6+H282 -> 0 | K282: 0 | L282: 0 | M282: =K282*6+L282 -> 0 | O282: 9 | P282: 8 | Q282: =O282*6+P282 -> 62
A283: BEST PLAYERS
A284: GEELONG WEST
A285: CAMBERWELL
A286: GOALKICKERS
A287: GEELONG WEST
A288: CAMBERWELL
A290: ROUND 7 | E290: 25TH MAY | J290: WEATHER | S290: PLAYED AT
D291: 1ST QTR | H291: 2ND QTR | L291: 3RD QTR | P291: FINAL | S291: FRANKSTON
A292: FRANKSTON | C292: 0 | D292: 0 | E292: =C292*6+D292 -> 0 | G292: 0 | H292: 0 | I292: =G292*6+H292 -> 0 | K292: 0 | L292: 0 | M292: =K292*6+L292 -> 0 | O292: 12 | P292: 22 | Q292: =O292*6+P292 -> 94 | S292: UMPIRE | X292: LADDER | AB292: ROUND | AD292: 7
A293: BOX HILL | C293: 0 | D293: 0 | E293: =C293*6+D293 -> 0 | G293: 0 | H293: 0 | I293: =G293*6+H293 -> 0 | K293: 0 | L293: 0 | M293: =K293*6+L293 -> 0 | O293: 7 | P293: 14 | Q293: =O293*6+P293 -> 56
A294: BEST PLAYERS | W294: TEAM | X294: W | Y294: L | Z294: D | AA294: FOR | AB294: AGST | AC294: % | AD294: PTS
A295: FRANKSTON
A296: BOX HILL | W296: WILLIAMSTOWN | X296: 6 | Y296: 1 | Z296: 0 | AA296: 681 | AB296: 477 | AC296: =(AA296*100)/AB296 -> 142.76729559748426 | AD296: =(X296*4)+(Z296*2) -> 24
A297: GOALKICKERS | W297: GEELONG WEST | X297: 5 | Y297: 2 | Z297: 0 | AA297: 834 | AB297: 602 | AC297: =(AA297*100)/AB297 -> 138.53820598006644 | AD297: =(X297*4)+(Z297*2) -> 20
A298: FRANKSTON | W298: SUNSHINE | X298: 5 | Y298: 2 | Z298: 0 | AA298: 587 | AB298: 470 | AC298: =(AA298*100)/AB298 -> 124.8936170212766 | AD298: =(X298*4)+(Z298*2) -> 20
A299: BOX HILL | W299: NORTHCOTE | X299: 4 | Y299: 3 | Z299: 0 | AA299: 598 | AB299: 553 | AC299: =(AA299*100)/AB299 -> 108.13743218806511 | AD299: =(X299*4)+(Z299*2) -> 16
A301: CAULFIELD | C301: 0 | D301: 0 | E301: =C301*6+D301 -> 0 | G301: 0 | H301: 0 | I301: =G301*6+H301 -> 0 | K301: 0 | L301: 0 | M301: =K301*6+L301 -> 0 | O301: 12 | P301: 9 | Q301: =O301*6+P301 -> 81 | S301: NORTHCOTE | W301: WERRIBEE | X301: 4 | Y301: 3 | Z301: 0 | AA301: 491 | AB301: 644 | AC301: =(AA301*100)/AB301 -> 76.242236024844715 | AD301: =(X301*4)+(Z301*2) -> 16
A302: NORTHCOTE | C302: 0 | D302: 0 | E302: =C302*6+D302 -> 0 | G302: 0 | H302: 0 | I302: =G302*6+H302 -> 0 | K302: 0 | L302: 0 | M302: =K302*6+L302 -> 0 | O302: 7 | P302: 11 | Q302: =O302*6+P302 -> 53 | W302: FRANKSTON | X302: 3 | Y302: 4 | Z302: 0 | AA302: 732 | AB302: 662 | AC302: =(AA302*100)/AB302 -> 110.57401812688822 | AD302: =(X302*4)+(Z302*2) -> 12
A303: BEST PLAYERS | W303: MORDIALLOC | X303: 3 | Y303: 4 | Z303: 0 | AA303: 569 | AB303: 647 | AC303: =(AA303*100)/AB303 -> 87.944358578052544 | AD303: =(X303*4)+(Z303*2) -> 12
A304: CAULFIELD | W304: CAULFIELD | X304: 2 | Y304: 5 | Z304: 0 | AA304: 543 | AB304: 634 | AC304: =(AA304*100)/AB304 -> 85.646687697160885 | AD304: =(X304*4)+(Z304*2) -> 8
A305: NORTHCOTE | W305: CAMBERWELL | X305: 2 | Y305: 5 | Z305: 0 | AA305: 522 | AB305: 746 | AC305: =(AA305*100)/AB305 -> 69.973190348525463 | AD305: =(X305*4)+(Z305*2) -> 8
A306: GOALKICKERS | W306: BOX HILL | X306: 1 | Y306: 6 | Z306: 0 | AA306: 477 | AB306: 585 | AC306: =(AA306*100)/AB306 -> 81.538461538461533 | AD306: =(X306*4)+(Z306*2) -> 4
A307: CAULFIELD
A308: NORTHCOTE
A310: GEELONG WEST | C310: 0 | D310: 0 | E310: =C310*6+D310 -> 0 | G310: 0 | H310: 0 | I310: =G310*6+H310 -> 0 | K310: 0 | L310: 0 | M310: =K310*6+L310 -> 0 | O310: 14 | P310: 16 | Q310: =O310*6+P310 -> 100 | S310: WERRIBEE
A311: WERRIBEE | C311: 0 | D311: 0 | E311: =C311*6+D311 -> 0 | G311: 0 | H311: 0 | I311: =G311*6+H311 -> 0 | K311: 0 | L311: 0 | M311: =K311*6+L311 -> 0 | O311: 9 | P311: 17 | Q311: =O311*6+P311 -> 71
A312: BEST PLAYERS
A313: GEELONG WEST
A314: WERRIBEE
A315: GOALKICKERS
A316: GEELONG WEST
A317: WERRIBEE
A319: SUNSHINE | C319: 0 | D319: 0 | E319: =C319*6+D319 -> 0 | G319: 0 | H319: 0 | I319: =G319*6+H319 -> 0 | K319: 0 | L319: 0 | M319: =K319*6+L319 -> 0 | O319: 8 | P319: 12 | Q319: =O319*6+P319 -> 60 | S319: SUNSHINE
A320: WILLIAMSTOWN | C320: 0 | D320: 0 | E320: =C320*6+D320 -> 0 | G320: 0 | H320: 0 | I320: =G320*6+H320 -> 0 | K320: 0 | L320: 0 | M320: =K320*6+L320 -> 0 | O320: 7 | P320: 10 | Q320: =O320*6+P320 -> 52
A321: BEST PLAYERS
A322: SUNSHINE
A323: WILLIAMSTOWN
A324: GOALKICKERS
A325: SUNSHINE
A326: WILLIAMSTOWN
A328: MORDIALLOC | C328: 0 | D328: 0 | E328: =C328*6+D328 -> 0 | G328: 0 | H328: 0 | I328: =G328*6+H328 -> 0 | K328: 0 | L328: 0 | M328: =K328*6+L328 -> 0 | O328: 13 | P328: 13 | Q328: =O328*6+P328 -> 91 | S328: MORDIALLOC
A329: CAMBERWELL | C329: 0 | D329: 0 | E329: =C329*6+D329 -> 0 | G329: 0 | H329: 0 | I329: =G329*6+H329 -> 0 | K329: 0 | L329: 0 | M329: =K329*6+L329 -> 0 | O329: 8 | P329: 9 | Q329: =O329*6+P329 -> 57
A330: BEST PLAYERS
A331: MORDIALLOC
A332: CAMBERWELL
A333: GOALKICKERS
A334: MORDIALLOC
A335: CAMBERWELL
A337: ROUND 8 | E337: 1ST JUNE | J337: WEATHER | S337: PLAYED AT
D338: 1ST QTR | H338: 2ND QTR | L338: 3RD QTR | P338: FINAL | S338: WILLIAMSTOWN
A339: WILLIAMSTOWN | C339: 10 | D339: 2 | E339: =C339*6+D339 -> 62 | G339: 11 | H339: 4 | I339: =G339*6+H339 -> 70 | K339: 14 | L339: 11 | M339: =K339*6+L339 -> 95 | O339: 16 | P339: 12 | Q339: =O339*6+P339 -> 108 | S339: UMPIRE | X339: LADDER | AB339: ROUND | AD339: 8
A340: NORTHCOTE | C340: 1 | D340: 1 | E340: =C340*6+D340 -> 7 | G340: 2 | H340: 5 | I340: =G340*6+H340 -> 17 | K340: 2 | L340: 5 | M340: =K340*6+L340 -> 17 | O340: 4 | P340: 6 | Q340: =O340*6+P340 -> 30
A341: BEST PLAYERS | W341: TEAM | X341: W | Y341: L | Z341: D | AA341: FOR | AB341: AGST | AC341: % | AD341: PTS
A342: WILLIAMSTOWN | C342: MADIGAN | F342: JOHNSON | I342: CAMILLIERI | L342: BUCHANAN | O342: RUSSELL | R342: NANKERVIS
A343: NORTHCOTE | C343: K HENRY | F343: STAFFORD | I343: McBREEN | L343: ALLEN | O343: TEESE | W343: WILLIAMSTOWN | X343: 7 | Y343: 1 | Z343: 0 | AA343: 789 | AB343: 507 | AC343: =(AA343*100)/AB343 -> 155.62130177514794 | AD343: =(X343*4)+(Z343*2) -> 28
A344: GOALKICKERS | W344: GEELONG WEST | X344: 6 | Y344: 2 | Z344: 0 | AA344: 968 | AB344: 665 | AC344: =(AA344*100)/AB344 -> 145.5639097744361 | AD344: =(X344*4)+(Z344*2) -> 24
A345: WILLIAMSTOWN | C345: PAPLEY 4 | F345: NANKERVIS 3 | I345: BUCHANAN 3 | L345: SZYSZKA 2 | O345: CAMILLIERI 2 | R345: HAYWARD | T345: SMITH | W345: SUNSHINE | X345: 6 | Y345: 2 | Z345: 0 | AA345: 649 | AB345: 518 | AC345: =(AA345*100)/AB345 -> 125.2895752895753 | AD345: =(X345*4)+(Z345*2) -> 24
A346: NORTHCOTE | C346: MOUNTENAY 2 | G346: DEAN | I346: KEANE | W346: WERRIBEE | X346: 5 | Y346: 3 | Z346: 0 | AA346: 577 | AB346: 722 | AC346: =(AA346*100)/AB346 -> 79.91689750692521 | AD346: =(X346*4)+(Z346*2) -> 20
A348: SUNSHINE | C348: 1 | D348: 0 | E348: =C348*6+D348 -> 6 | G348: 8 | H348: 9 | I348: =G348*6+H348 -> 57 | K348: 8 | L348: 12 | M348: =K348*6+L348 -> 60 | O348: 8 | P348: 14 | Q348: =O348*6+P348 -> 62 | S348: SUNSHINE | W348: NORTHCOTE | X348: 4 | Y348: 4 | Z348: 0 | AA348: 628 | AB348: 661 | AC348: =(AA348*100)/AB348 -> 95.007564296520428 | AD348: =(X348*4)+(Z348*2) -> 16
A349: CAULFIELD | C349: 2 | D349: 8 | E349: =C349*6+D349 -> 20 | G349: 2 | H349: 8 | I349: =G349*6+H349 -> 20 | K349: 5 | L349: 11 | M349: =K349*6+L349 -> 41 | O349: 6 | P349: 12 | Q349: =O349*6+P349 -> 48 | W349: MORDIALLOC | X349: 4 | Y349: 4 | Z349: 0 | AA349: 640 | AB349: 685 | AC349: =(AA349*100)/AB349 -> 93.430656934306569 | AD349: =(X349*4)+(Z349*2) -> 16
A350: BEST PLAYERS | W350: FRANKSTON | X350: 3 | Y350: 5 | Z350: 0 | AA350: 770 | AB350: 733 | AC350: =(AA350*100)/AB350 -> 105.04774897680764 | AD350: =(X350*4)+(Z350*2) -> 12
A351: SUNSHINE | C351: POWER | F351: BENSON | I351: THORNTON | L351: BROWN | O351: TREZISE | R351: DEAN | W351: CAULFIELD | X351: 2 | Y351: 6 | Z351: 0 | AA351: 591 | AB351: 696 | AC351: =(AA351*100)/AB351 -> 84.91379310344827 | AD351: =(X351*4)+(Z351*2) -> 8
A352: CAULFIELD | C352: SANDERS | F352: ROWE | I352: COLLINS | L352: NEAL | O352: BAKER | R352: BARBER | W352: CAMBERWELL | X352: 2 | Y352: 6 | Z352: 0 | AA352: 600 | AB352: 832 | AC352: =(AA352*100)/AB352 -> 72.115384615384613 | AD352: =(X352*4)+(Z352*2) -> 8
A353: GOALKICKERS | W353: BOX HILL | X353: 1 | Y353: 7 | Z353: 0 | AA353: 540 | AB353: 719 | AC353: =(AA353*100)/AB353 -> 75.104311543810852 | AD353: =(X353*4)+(Z353*2) -> 4
A354: SUNSHINE | C354: GRAHAM 3 | F354: BROWN 2 | I354: CROSBIE | K354: ALLEN | M354: HIPWORTH
A355: CAULFIELD | C355: NEAL 3 | F355: BARBER | I355: STREET | K355: WOODHAMS
A357: MORDIALLOC | C357: 5 | D357: 7 | E357: =C357*6+D357 -> 37 | G357: 8 | H357: 8 | I357: =G357*6+H357 -> 56 | K357: 8 | L357: 16 | M357: =K357*6+L357 -> 64 | O357: 9 | P357: 17 | Q357: =O357*6+P357 -> 71 | S357: MORDIALLOC
A358: FRANKSTON | C358: 0 | D358: 1 | E358: =C358*6+D358 -> 1 | G358: 3 | H358: 2 | I358: =G358*6+H358 -> 20 | K358: 4 | L358: 4 | M358: =K358*6+L358 -> 28 | O358: 5 | P358: 8 | Q358: =O358*6+P358 -> 38
A359: BEST PLAYERS
A360: MORDIALLOC | C360: BACKMAN | F360: STUDHAM | I360: HOBSON | L360: POWER | O360: HYNES | R360: DANCKERT
A361: FRANKSTON | C361: SLADE | F361: LEWIS | I361: HUGHES | L361: GLEESON | O361: BOWES | R361: SMITH
A362: GOALKICKERS
A363: MORDIALLOC | C363: HYNES 3 | F363: POWER 2 | H363: JOHNSON | K363: STUDHAM | N363: WILLIAMS | Q363: DAVEY
A364: FRANKSTON | C364: BOWES 2 | F364: KERR | H364: SLADE | J364: THATCHER
A366: WERRIBEE | C366: 5 | D366: 12 | E366: =C366*6+D366 -> 42 | G366: 7 | H366: 13 | I366: =G366*6+H366 -> 55 | K366: 10 | L366: 19 | M366: =K366*6+L366 -> 79 | O366: 11 | P366: 20 | Q366: =O366*6+P366 -> 86 | S366: CAMBERWELL
A367: CAMBERWELL | C367: 0 | D367: 2 | E367: =C367*6+D367 -> 2 | G367: 3 | H367: 5 | I367: =G367*6+H367 -> 23 | K367: 4 | L367: 8 | M367: =K367*6+L367 -> 32 | O367: 11 | P367: 12 | Q367: =O367*6+P367 -> 78
A368: BEST PLAYERS
A369: WERRIBEE | C369: HEMLEY | F369: CROMPTON | I369: GILLETT | L369: LYONS | O369: MURRELL | R369: DAWE
A370: CAMBERWELL | C370: QUINN | F370: WILSON | I370: SMITH | L370: PECK | O370: VINEY | R370: DELANTY
A371: GOALKICKERS
A372: WERRIBEE | C372: HEMLEY 4 | F372: LYONS 2 | H372: DAWE | J372: CROMPTON | M372: MURRELL | O372: TWEEDLE | R372: GILLETT
A373: CAMBERWELL | C373: PECK 3 | E373: DELANTY 2 | H373: J SMITH | J373: DANIELS | L373: BRAYNE | N373: McNAMARA | Q373: RIETSCHEL | T373: 1 SHORT
A375: GEELONG WEST | C375: 2 | D375: 3 | E375: =C375*6+D375 -> 15 | G375: 9 | H375: 3 | I375: =G375*6+H375 -> 57 | K375: 13 | L375: 14 | M375: =K375*6+L375 -> 92 | O375: 18 | P375: 26 | Q375: =O375*6+P375 -> 134 | S375: GEELONG WEST
A376: BOX HILL | C376: 3 | D376: 3 | E376: =C376*6+D376 -> 21 | G376: 4 | H376: 9 | I376: =G376*6+H376 -> 33 | K376: 5 | L376: 14 | M376: =K376*6+L376 -> 44 | O376: 8 | P376: 15 | Q376: =O376*6+P376 -> 63
A377: BEST PLAYERS
A378: GEELONG WEST | C378: ADAMS | F378: TENABEL | I378: O'DONNELL | L378: HYNES | O378: EMOND | R378: DEEATH
A379: BOX HILL | C379: BRYANT | F379: SALMON | I379: LEAKE | L379: G FELLOWS | O379: PRITCHARD
A380: GOALKICKERS
A381: GEELONG WEST | C381: O'DONNELL 5 | F381: GIBBONS 3 | I381: TENABEL 2 | L381: EMOND 2 | N381: ADAMS 2 | Q381: HARRIS 2 | S381: DEEATH 2
A382: BOX HILL | C382: LEAKE 2 | F382: BRYANT 2 | I382: C FELLOWS | L382: HUNT | N382: JOHNSON | Q382: RONALDSON
A384: ROUND 9 | E384: 8TH JUNE | J384: WEATHER | S384: PLAYED AT
D385: 1ST QTR | H385: 2ND QTR | L385: 3RD QTR | P385: FINAL | S385: FRANKSTON
A386: FRANKSTON | C386: 4 | D386: 5 | E386: =C386*6+D386 -> 29 | G386: 5 | H386: 9 | I386: =G386*6+H386 -> 39 | K386: 13 | L386: 14 | M386: =K386*6+L386 -> 92 | O386: 16 | P386: 16 | Q386: =O386*6+P386 -> 112 | S386: UMPIRE | X386: LADDER | AB386: ROUND | AD386: 9
A387: SUNSHINE | C387: 3 | D387: 8 | E387: =C387*6+D387 -> 26 | G387: 7 | H387: 12 | I387: =G387*6+H387 -> 54 | K387: 9 | L387: 14 | M387: =K387*6+L387 -> 68 | O387: 14 | P387: 21 | Q387: =O387*6+P387 -> 105
A388: BEST PLAYERS | W388: TEAM | X388: W | Y388: L | Z388: D | AA388: FOR | AB388: AGST | AC388: % | AD388: PTS
A389: FRANKSTON | C389: BISHOP | F389: THATCHER | I389: SHEPPARD | L389: KERR | N389: COUTTS | Q389: HUGHES
A390: SUNSHINE | C390: ALLEN | F390: RUSSELL | I390: FERNE | L390: KENNEDY | N390: TREZISE | Q390: McLEOD | W390: WILLIAMSTOWN | X390: 8 | Y390: 1 | Z390: 0 | AA390: 887 | AB390: 564 | AC390: =(AA390*100)/AB390 -> 157.26950354609929 | AD390: =(X390*4)+(Z390*2) -> 32
A391: GOALKICKERS | W391: GEELONG WEST | X391: 7 | Y391: 2 | Z391: 0 | AA391: 1069 | AB391: 726 | AC391: =(AA391*100)/AB391 -> 147.24517906336089 | AD391: =(X391*4)+(Z391*2) -> 28
A392: FRANKSTON | C392: BISHOP 5 | F392: THATCHER 3 | I392: LEE 3 | K392: BOWES 2 | M392: KERR 2 | O392: BRODIE | W392: SUNSHINE | X392: 6 | Y392: 3 | Z392: 0 | AA392: 754 | AB392: 630 | AC392: =(AA392*100)/AB392 -> 119.68253968253968 | AD392: =(X392*4)+(Z392*2) -> 24
A393: SUNSHINE | C393: ALLEN 5 | F393: RUSSELL 5 | I393: CLARKE 2 | L393: BENSON | N393: TARCZON | W393: WERRIBEE | X393: 6 | Y393: 3 | Z393: 0 | AA393: 676 | AB393: 801 | AC393: =(AA393*100)/AB393 -> 84.394506866416975 | AD393: =(X393*4)+(Z393*2) -> 24
A395: WILLIAMSTOWN | C395: 5 | D395: 6 | E395: =C395*6+D395 -> 36 | G395: 5 | H395: 7 | I395: =G395*6+H395 -> 37 | K395: 12 | L395: 13 | M395: =K395*6+L395 -> 85 | O395: 14 | P395: 14 | Q395: =O395*6+P395 -> 98 | S395: BOX HILL | W395: FRANKSTON | X395: 4 | Y395: 5 | Z395: 0 | AA395: 882 | AB395: 838 | AC395: =(AA395*100)/AB395 -> 105.25059665871122 | AD395: =(X395*4)+(Z395*2) -> 16
A396: BOX HILL | C396: 2 | D396: 1 | E396: =C396*6+D396 -> 13 | G396: 6 | H396: 4 | I396: =G396*6+H396 -> 40 | K396: 7 | L396: 9 | M396: =K396*6+L396 -> 51 | O396: 8 | P396: 9 | Q396: =O396*6+P396 -> 57 | W396: MORDIALLOC | X396: 4 | Y396: 5 | Z396: 0 | AA396: 719 | AB396: 784 | AC396: =(AA396*100)/AB396 -> 91.709183673469383 | AD396: =(X396*4)+(Z396*2) -> 16
A397: BEST PLAYERS | W397: NORTHCOTE | X397: 4 | Y397: 5 | Z397: 0 | AA397: 689 | AB397: 762 | AC397: =(AA397*100)/AB397 -> 90.419947506561684 | AD397: =(X397*4)+(Z397*2) -> 16
A398: WILLIAMSTOWN | C398: PAPLEY | F398: SMITH | I398: CAMILLIERI | L398: BUCHANAN | O398: MADIGAN | W398: CAULFIELD | X398: 3 | Y398: 6 | Z398: 0 | AA398: 677 | AB398: 775 | AC398: =(AA398*100)/AB398 -> 87.354838709677423 | AD398: =(X398*4)+(Z398*2) -> 12
A399: BOX HILL | C399: BARNETT | F399: BAKER | I399: BATES | L399: C FELLOWS | O399: TAYLOR | W399: CAMBERWELL | X399: 2 | Y399: 7 | Z399: 0 | AA399: 679 | AB399: 918 | AC399: =(AA399*100)/AB399 -> 73.965141612200441 | AD399: =(X399*4)+(Z399*2) -> 8
A400: GOALKICKERS | W400: BOX HILL | X400: 1 | Y400: 8 | Z400: 0 | AA400: 597 | AB400: 817 | AC400: =(AA400*100)/AB400 -> 73.072215422276628 | AD400: =(X400*4)+(Z400*2) -> 4
A401: WILLIAMSTOWN | C401: SZYSZKA 4 | F401: NASH 3 | H401: CAMILLIERI 2 | K401: BUCHANAN 2 | N401: PAPLEY | P401: BARNES | R401: LANE
A402: BOX HILL | C402: BAKER 3 | F402: JONES | H402: INNES | J402: TOMLINSON | M402: BRYANT | P402: 1 SHORT
A404: GEELONG WEST | C404: 3 | D404: 4 | E404: =C404*6+D404 -> 22 | G404: 6 | H404: 10 | I404: =G404*6+H404 -> 46 | K404: 10 | L404: 14 | M404: =K404*6+L404 -> 74 | O404: 14 | P404: 17 | Q404: =O404*6+P404 -> 101 | S404: NORTHCOTE
A405: NORTHCOTE | C405: 3 | D405: 0 | E405: =C405*6+D405 -> 18 | G405: 4 | H405: 3 | I405: =G405*6+H405 -> 27 | K405: 6 | L405: 5 | M405: =K405*6+L405 -> 41 | O405: 9 | P405: 7 | Q405: =O405*6+P405 -> 61
A406: BEST PLAYERS
A407: GEELONG WEST | C407: BRUSHFIELD | F407: TENABEL | I407: OLIVER | L407: O'DONNELL | O407: LARKINS | R407: YOUNG
A408: NORTHCOTE | C408: EASTAWAY | F408: PITTS | I408: SMITH | L408: UNDERWOOD | O408: MAYNE
A409: GOALKICKERS
A410: GEELONG WEST | C410: O'DONNELL 3 | F410: GIBBONS 2 | I410: TENABEL 2 | K410: YOUNG 2 | M410: BRUSHFIELD 2 | P410: EMOND | R410: ADAMS | T410: HARRIS
A411: NORTHCOTE | C411: MICKLESON 2 | F411: UNDERWOOD 2 | I411: ELLIS | K411: ECCLES | M411: McCARTHY | P411: DEAN | R411: VINEY
A413: WERRIBEE | C413: 3 | D413: 3 | E413: =C413*6+D413 -> 21 | G413: 6 | H413: 8 | I413: =G413*6+H413 -> 44 | K413: 11 | L413: 11 | M413: =K413*6+L413 -> 77 | O413: 14 | P413: 15 | Q413: =O413*6+P413 -> 99 | S413: WERRIBEE
A414: MORDIALLOC | C414: 3 | D414: 3 | E414: =C414*6+D414 -> 21 | G414: 4 | H414: 8 | I414: =G414*6+H414 -> 32 | K414: 7 | L414: 11 | M414: =K414*6+L414 -> 53 | O414: 11 | P414: 13 | Q414: =O414*6+P414 -> 79
A415: BEST PLAYERS
A416: WERRIBEE | C416: CHIRGWIN | F416: LYONS | I416: SMITH | L416: PETHERIC
A417: MORDIALLOC | C417: BACKMAN | F417: DAVEY | I417: McPHERSON | L417: POWER
A418: GOALKICKERS
A419: WERRIBEE | C419: HEMLEY 6 | F419: CHIRGWIN 3 | I419: LYONS 3 | K419: CROMPTON | N419: McEVOY
A420: MORDIALLOC | C420: POWER 4 | F420: DAVEY 2 | I420: BACKMAN 2 | L420: TULL | N420: HYNES | P420: GARDINER
A422: CAULFIELD | C422: 2 | D422: 7 | E422: =C422*6+D422 -> 19 | G422: 6 | H422: 13 | I422: =G422*6+H422 -> 49 | K422: 7 | L422: 16 | M422: =K422*6+L422 -> 58 | O422: 11 | P422: 20 | Q422: =O422*6+P422 -> 86 | S422: PRINCES PARK, CAULFIELD
A423: CAMBERWELL | C423: 3 | D423: 1 | E423: =C423*6+D423 -> 19 | G423: 7 | H423: 3 | I423: =G423*6+H423 -> 45 | K423: 10 | L423: 9 | M423: =K423*6+L423 -> 69 | O423: 11 | P423: 13 | Q423: =O423*6+P423 -> 79
A424: BEST PLAYERS
A425: CAULFIELD | C425: HORGAN | F425: ROWE | I425: ARRELL | L425: BARBER | O425: BUCKLEY | R425: WOODHAMS
A426: CAMBERWELL | C426: SMITH | F426: McNAMARA | I426: MACINLAY | L426: BOYD | O426: CASEY | R426: BRAYNE
A427: GOALKICKERS
A428: CAULFIELD | C428: HORGAN 3 | F428: BARBER 2 | I428: ROBINSON 2 | L428: NEAL 2 | N428: COLLINS | P428: STREET
A429: CAMBERWELL | C429: CASEY 3 | F429: FRIEBERG 3 | I429: BRAYNE 2 | L429: McNAMARA | O429: QUINN | Q429: PECK
A431: ROUND 10 | E431: 16TH JUNE | J431: WEATHER | S431: PLAYED AT
D432: 1ST QTR | H432: 2ND QTR | L432: 3RD QTR | P432: FINAL | S432: WILLIAMSTOWN
A433: WILLIAMSTOWN | C433: 5 | D433: 3 | E433: =C433*6+D433 -> 33 | G433: 13 | H433: 5 | I433: =G433*6+H433 -> 83 | K433: 15 | L433: 9 | M433: =K433*6+L433 -> 99 | O433: 23 | P433: 14 | Q433: =O433*6+P433 -> 152 | S433: UMPIRE | X433: LADDER | AB433: ROUND | AD433: 10
A434: CAULFIELD | C434: 1 | D434: 8 | E434: =C434*6+D434 -> 14 | G434: 2 | H434: 10 | I434: =G434*6+H434 -> 22 | K434: 5 | L434: 15 | M434: =K434*6+L434 -> 45 | O434: 7 | P434: 16 | Q434: =O434*6+P434 -> 58
A435: BEST PLAYERS | W435: TEAM | X435: W | Y435: L | Z435: D | AA435: FOR | AB435: AGST | AC435: % | AD435: PTS
A436: WILLIAMSTOWN | C436: NANKERVIS | F436: SZYSZKA | I436: CAMILLIERI | L436: PAPLEY | N436: PATTERSON | Q436: O'MARA
A437: CAULFIELD | C437: ROWE | F437: ARRELL | I437: GOWANS | L437: SANDERS | N437: DALGLEISH | Q437: WILLIAMS | W437: WILLIAMSTOWN | X437: 9 | Y437: 1 | Z437: 0 | AA437: 1039 | AB437: 622 | AC437: =(AA437*100)/AB437 -> 167.04180064308682 | AD437: =(X437*4)+(Z437*2) -> 36
A438: GOALKICKERS | W438: GEELONG WEST | X438: 8 | Y438: 2 | Z438: 0 | AA438: 1200 | AB438: 821 | AC438: =(AA438*100)/AB438 -> 146.16321559074299 | AD438: =(X438*4)+(Z438*2) -> 32
A439: WILLIAMSTOWN | C439: SZYSZKA 10 | F439: NANKERVIS 6 | I439: CAMILLIERI 4 | L439: LANE | N439: PAPLEY | P439: BUCHANAN | W439: SUNSHINE | X439: 7 | Y439: 3 | Z439: 0 | AA439: 847 | AB439: 679 | AC439: =(AA439*100)/AB439 -> 124.74226804123711 | AD439: =(X439*4)+(Z439*2) -> 28
A440: CAULFIELD | C440: GREEN 2 | F440: GOWANS | I440: WOODHAMS | L440: STREET | N440: WILLIAMS | Q440: ANDERSON | W440: WERRIBEE | X440: 6 | Y440: 4 | Z440: 0 | AA440: 725 | AB440: 894 | AC440: =(AA440*100)/AB440 -> 81.096196868008946 | AD440: =(X440*4)+(Z440*2) -> 24
A442: SUNSHINE | C442: 2 | D442: 2 | E442: =C442*6+D442 -> 14 | G442: 7 | H442: 7 | I442: =G442*6+H442 -> 49 | K442: 9 | L442: 9 | M442: =K442*6+L442 -> 63 | O442: 13 | P442: 15 | Q442: =O442*6+P442 -> 93 | S442: SUNSHINE | W442: NORTHCOTE | X442: 5 | Y442: 5 | Z442: 0 | AA442: 785 | AB442: 844 | AC442: =(AA442*100)/AB442 -> 93.009478672985779 | AD442: =(X442*4)+(Z442*2) -> 20
A443: WERRIBEE | C443: 2 | D443: 3 | E443: =C443*6+D443 -> 15 | G443: 2 | H443: 4 | I443: =G443*6+H443 -> 16 | K443: 6 | L443: 6 | M443: =K443*6+L443 -> 42 | O443: 7 | P443: 7 | Q443: =O443*6+P443 -> 49 | W443: FRANKSTON | X443: 4 | Y443: 6 | Z443: 0 | AA443: 977 | AB443: 969 | AC443: =(AA443*100)/AB443 -> 100.82559339525284 | AD443: =(X443*4)+(Z443*2) -> 16
A444: BEST PLAYERS | W444: MORDIALLOC | X444: 4 | Y444: 6 | Z444: 0 | AA444: 801 | AB444: 880 | AC444: =(AA444*100)/AB444 -> 91.022727272727266 | AD444: =(X444*4)+(Z444*2) -> 16
A445: SUNSHINE | C445: TREZISE | F445: ALLEN | I445: McGARRITY | L445: BENSON | O445: DARUL | Q445: DEAN | W445: CAULFIELD | X445: 3 | Y445: 7 | Z445: 0 | AA445: 735 | AB445: 927 | AC445: =(AA445*100)/AB445 -> 79.288025889967642 | AD445: =(X445*4)+(Z445*2) -> 12
A446: WERRIBEE | C446: ANDERSON | F446: SMITH | I446: OGILVIE | L446: TAYLOR | O446: HENRY | Q446: CHIRGWIN | W446: CAMBERWELL | X446: 3 | Y446: 7 | Z446: 0 | AA446: 748 | AB446: 975 | AC446: =(AA446*100)/AB446 -> 76.717948717948715 | AD446: =(X446*4)+(Z446*2) -> 12
A447: GOALKICKERS | W447: BOX HILL | X447: 1 | Y447: 9 | Z447: 0 | AA447: 654 | AB447: 886 | AC447: =(AA447*100)/AB447 -> 73.814898419864562 | AD447: =(X447*4)+(Z447*2) -> 4
A448: SUNSHINE | C448: ALLEN 7 | F448: BENSON 3 | I448: RUSSELL 2 | L448: BROWN
A449: WERRIBEE | C449: CROMPTON 2 | F449: CHIRGWIN 2 | I449: Mc ? 1 | L449: PETHERIC | N449: HEMLEY
A451: NORTHCOTE | C451: 6 | D451: 1 | E451: =C451*6+D451 -> 37 | G451: 11 | H451: 6 | I451: =G451*6+H451 -> 72 | K451: 12 | L451: 8 | M451: =K451*6+L451 -> 80 | O451: 14 | P451: 12 | Q451: =O451*6+P451 -> 96 | S451: MORDIALLOC
A452: MORDIALLOC | C452: 8 | D452: 1 | E452: =C452*6+D452 -> 49 | G452: 8 | H452: 4 | I452: =G452*6+H452 -> 52 | K452: 11 | L452: 9 | M452: =K452*6+L452 -> 75 | O452: 12 | P452: 10 | Q452: =O452*6+P452 -> 82
A453: BEST PLAYERS
A454: NORTHCOTE | C454: WHITE | F454: UNDERWOOD | I454: KOZARIS | L454: BEVAN | O454: SMITH | R454: STAFFORD
A455: MORDIALLOC | C455: BACKMAN | F455: DANCKERT | I455: BENTLEY | L455: GARDINER | O455: WILLIS | R455: POWER
A456: GOALKICKERS
A457: NORTHCOTE | C457: McCARTHY 3 | F457: WHITE 3 | H457: UNDERWOOD 3 | K457: McBREEN 2 | N457: PITTS | P457: MAYNE | R457: STAFFORD
A458: MORDIALLOC | C458: BACKMAN 3 | F458: HYNES 2 | H458: GARDINER 2 | K458: DAVEY | M458: SHIREFFS | P458: POWER | R458: LESLIE | T458: 1 SHORT
A460: CAMBERWELL | C460: 5 | D460: 2 | E460: =C460*6+D460 -> 32 | G460: 5 | H460: 5 | I460: =G460*6+H460 -> 35 | K460: 10 | L460: 8 | M460: =K460*6+L460 -> 68 | O460: 10 | P460: 9 | Q460: =O460*6+P460 -> 69 | S460: CAMBERWELL
A461: BOX HILL | C461: 1 | D461: 1 | E461: =C461*6+D461 -> 7 | G461: 3 | H461: 5 | I461: =G461*6+H461 -> 23 | K461: 5 | L461: 10 | M461: =K461*6+L461 -> 40 | O461: 7 | P461: 15 | Q461: =O461*6+P461 -> 57
A462: BEST PLAYERS
A463: CAMBERWELL | C463: D BOYD | F463: RICHARDSON | I463: J SMITH | L463: ROBERTSON | O463: MACINLAY | R463: STAFFORD
A464: BOX HILL | C464: RONALDSON | F464: PERRY | I464: PRITCHARD | L464: SALMON | O464: BRYANT | R464: BARNETT
A465: GOALKICKERS
A466: CAMBERWELL | C466: DELANTY 3 | F466: FRIEBERG 2 | I466: L BOYD 2 | L466: CAREY | N466: WICKS | P466: QUINN
A467: BOX HILL | C467: PERRY 2 | F467: LA ROCHE | I467: DOURIS | K467: EBERT | M467: TOMLINSON | P467: BATES
A469: GEELONG WEST | C469: 4 | D469: 2 | E469: =C469*6+D469 -> 26 | G469: 10 | H469: 5 | I469: =G469*6+H469 -> 65 | K469: 16 | L469: 7 | M469: =K469*6+L469 -> 103 | O469: 20 | P469: 11 | Q469: =O469*6+P469 -> 131 | S469: GEELONG WEST
A470: FRANKSTON | C470: 3 | D470: 0 | E470: =C470*6+D470 -> 18 | G470: 4 | H470: 0 | I470: =G470*6+H470 -> 24 | K470: 10 | L470: 3 | M470: =K470*6+L470 -> 63 | O470: 15 | P470: 5 | Q470: =O470*6+P470 -> 95
A471: BEST PLAYERS
A472: GEELONG WEST | C472: GIBBONS | F472: LARKINS | I472: EMOND | L472: HARRIS | O472: TENABEL | R472: OLIVER
A473: FRANKSTON | C473: KERR | F473: BRODIE | I473: LEWIS | L473: HUGHES | O473: BUNOVITCH | R473: ANDERSON
A474: GOALKICKERS
A475: GEELONG WEST | C475: GIBBONS 7 | F475: EMOND 4 | H475: TENABEL 3 | K475: O'DONNELL 2 | N475: HARRIS 2 | P475: BIEN | R475: BRUSHFIELD
A476: FRANKSTON | C476: KERR 3 | E476: SLADE 3 | G476: PRICE 2 | I476: BOWEN 2 | K476: ANDERSON | N476: LEE | O476: THATCHER | R476: BISHOP | T476: BOWES
A478: ROUND 11 | E478: 22ND JUNE | J478: WEATHER | S478: PLAYED AT
D479: 1ST QTR | H479: 2ND QTR | L479: 3RD QTR | P479: FINAL | S479: FRANKSTON
A480: FRANKSTON | C480: 4 | D480: 4 | E480: =C480*6+D480 -> 28 | G480: 12 | H480: 9 | I480: =G480*6+H480 -> 81 | K480: 14 | L480: 16 | M480: =K480*6+L480 -> 100 | O480: 17 | P480: 23 | Q480: =O480*6+P480 -> 125 | S480: UMPIRE | X480: LADDER | AB480: ROUND | AD480: 11
A481: CAMBERWELL | C481: 1 | D481: 5 | E481: =C481*6+D481 -> 11 | G481: 3 | H481: 6 | I481: =G481*6+H481 -> 24 | K481: 5 | L481: 9 | M481: =K481*6+L481 -> 39 | O481: 5 | P481: 11 | Q481: =O481*6+P481 -> 41
A482: BEST PLAYERS | W482: TEAM | X482: W | Y482: L | Z482: D | AA482: FOR | AB482: AGST | AC482: % | AD482: PTS
A483: FRANKSTON | C483: KERR | F483: SHEPPARD | I483: SLADE | L483: NICHOLSON | O483: THATCHER | R483: GLEESON
A484: CAMBERWELL | C484: BOYD | F484: McNAMARA | I484: STAFFORD | L484: RICHARDSON | O484: SMITH | R484: DELANTY | W484: WILLIAMSTOWN | X484: 10 | Y484: 1 | Z484: 0 | AA484: 1151 | AB484: 655 | AC484: =(AA484*100)/AB484 -> 175.72519083969465 | AD484: =(X484*4)+(Z484*2) -> 40
A485: GOALKICKERS | W485: GEELONG WEST | X485: 9 | Y485: 2 | Z485: 0 | AA485: 1305 | AB485: 922 | AC485: =(AA485*100)/AB485 -> 141.54013015184381 | AD485: =(X485*4)+(Z485*2) -> 36
A486: FRANKSTON | C486: PRICE 4 | E486: KERR 4 | G486: SLADE 3 | I486: THATCHER 3 | L486: BUNOVITCH 2 | O486: BRODIE | W486: SUNSHINE | X486: 7 | Y486: 4 | Z486: 0 | AA486: 900 | AB486: 750 | AC486: =(AA486*100)/AB486 -> 120 | AD486: =(X486*4)+(Z486*2) -> 28
A487: CAMBERWELL | C487: FRIEBERG 3 | F487: DELANTY | I487: McNAMARA | W487: NORTHCOTE | X487: 6 | Y487: 5 | Z487: 0 | AA487: 846 | AB487: 897 | AC487: =(AA487*100)/AB487 -> 94.314381270903013 | AD487: =(X487*4)+(Z487*2) -> 24
A489: BOX HILL | C489: 1 | D489: 2 | E489: =C489*6+D489 -> 8 | G489: 7 | H489: 5 | I489: =G489*6+H489 -> 47 | K489: 8 | L489: 7 | M489: =K489*6+L489 -> 55 | O489: 12 | P489: 7 | Q489: =O489*6+P489 -> 79 | S489: BOX HILL | W489: WERRIBEE | X489: 6 | Y489: 5 | Z489: 0 | AA489: 758 | AB489: 1006 | AC489: =(AA489*100)/AB489 -> 75.347912524850898 | AD489: =(X489*4)+(Z489*2) -> 24
A490: MORDIALLOC | C490: 3 | D490: 5 | E490: =C490*6+D490 -> 23 | G490: 3 | H490: 7 | I490: =G490*6+H490 -> 25 | K490: 6 | L490: 12 | M490: =K490*6+L490 -> 48 | O490: 10 | P490: 15 | Q490: =O490*6+P490 -> 75 | W490: FRANKSTON | X490: 5 | Y490: 6 | Z490: 0 | AA490: 1102 | AB490: 1010 | AC490: =(AA490*100)/AB490 -> 109.10891089108911 | AD490: =(X490*4)+(Z490*2) -> 20
A491: BEST PLAYERS | W491: MORDIALLOC | X491: 4 | Y491: 7 | Z491: 0 | AA491: 876 | AB491: 959 | AC491: =(AA491*100)/AB491 -> 91.345151199165798 | AD491: =(X491*4)+(Z491*2) -> 16
A492: BOX HILL | C492: G FELLOWS | F492: BRYANT | I492: BAKER | L492: BENNETT | O492: PERRY | W492: CAULFIELD | X492: 3 | Y492: 8 | Z492: 0 | AA492: 836 | AB492: 1032 | AC492: =(AA492*100)/AB492 -> 81.007751937984494 | AD492: =(X492*4)+(Z492*2) -> 12
A493: MORDIALLOC | C493: HYNES | F493: BACKMAN | I493: LESLIE | L493: BENTLEY | O493: GARDINER | W493: CAMBERWELL | X493: 3 | Y493: 8 | Z493: 0 | AA493: 789 | AB493: 1100 | AC493: =(AA493*100)/AB493 -> 71.727272727272734 | AD493: =(X493*4)+(Z493*2) -> 12
A494: GOALKICKERS | W494: BOX HILL | X494: 2 | Y494: 9 | Z494: 0 | AA494: 733 | AB494: 961 | AC494: =(AA494*100)/AB494 -> 76.274713839750262 | AD494: =(X494*4)+(Z494*2) -> 8
A495: BOX HILL | C495: BAKER 5 | F495: BENNETT 2 | I495: NOLAN 2 | K495: BRYANT | M495: EBERT | O495: LEAKE
A496: MORDIALLOC | C496: HYNES 3 | F496: CULPH 2 | I496: GARDINER 2 | L496: WILLIS | N496: POWER | P496: JOHNSON
A498: GEELONG WEST | C498: 6 | D498: 3 | E498: =C498*6+D498 -> 39 | G498: 7 | H498: 5 | I498: =G498*6+H498 -> 47 | K498: 12 | L498: 9 | M498: =K498*6+L498 -> 81 | O498: 16 | P498: 9 | Q498: =O498*6+P498 -> 105 | S498: PRINCES PARK, CAULFIELD
A499: CAULFIELD | C499: 2 | D499: 1 | E499: =C499*6+D499 -> 13 | G499: 8 | H499: 8 | I499: =G499*6+H499 -> 56 | K499: 11 | L499: 8 | M499: =K499*6+L499 -> 74 | O499: 15 | P499: 11 | Q499: =O499*6+P499 -> 101
A500: BEST PLAYERS
A501: GEELONG WEST | C501: HARRIS | F501: MAHON | I501: O'DONNELL | L501: DEEATH | O501: GIBBONS | R501: TENABEL
A502: CAULFIELD | C502: WILLIAMS | F502: GOWANS | I502: BAKER | L502: ROWE | O502: HORGAN | R502: ARRELL
A503: GOALKICKERS
A504: GEELONG WEST | C504: I O'DONNELL 5 | F504: HISCOX 3 | H504: HARRIS 2 | J504: MAHON 2 | L504: TENABEL | N504: EMOND | P504: GIBBONS | R504: G O'DONNELL
A505: CAULFIELD | C505: HOGAN 4 | E505: BAKER 3 | G505: ROWE 2 | I505: SANDERS 2 | L505: WILLIAMS | N505: NEAL | P505: MOORE | R505: REID
F506: 23RD JUNE | J506: WEATHER
A507: NORTHCOTE | C507: 0 | D507: 0 | E507: =C507*6+D507 -> 0 | G507: 3 | H507: 5 | I507: =G507*6+H507 -> 23 | K507: 4 | L507: 9 | M507: =K507*6+L507 -> 33 | O507: 8 | P507: 13 | Q507: =O507*6+P507 -> 61 | S507: NORTHCOTE
A508: SUNSHINE | C508: 2 | D508: 5 | E508: =C508*6+D508 -> 17 | G508: 4 | H508: 5 | I508: =G508*6+H508 -> 29 | K508: 5 | L508: 9 | M508: =K508*6+L508 -> 39 | O508: 7 | P508: 11 | Q508: =O508*6+P508 -> 53
A509: BEST PLAYERS
A510: NORTHCOTE | C510: UNDERWOOD | F510: WHITE | I510: ELLIS | L510: STAFFORD | O510: HENRY | R510: SMITH
A511: SUNSHINE | C511: THORNTON | F511: DARUL | I511: McLEAN | L511: MUNRO | O511: RUSSELL | R511: DEAN
A512: GOALKICKERS
A513: NORTHCOTE | C513: STAFFORD 3 | F513: MICKLESON 2 | I513: VINEY | K513: PITTS | M513: WHITE
A514: SUNSHINE | C514: HARRIS 3 | F514: COLLINS 2 | I514: KENNEDY | K514: MUNRO
A516: WILLIAMSTOWN | C516: 5 | D516: 7 | E516: =C516*6+D516 -> 37 | G516: 7 | H516: 11 | I516: =G516*6+H516 -> 53 | K516: 16 | L516: 15 | M516: =K516*6+L516 -> 111 | O516: 17 | P516: 10 | Q516: =O516*6+P516 -> 112 | S516: WERRIBEE
A517: WERRIBEE | C517: 1 | D517: 0 | E517: =C517*6+D517 -> 6 | G517: 2 | H517: 6 | I517: =G517*6+H517 -> 18 | K517: 2 | L517: 6 | M517: =K517*6+L517 -> 18 | O517: 4 | P517: 9 | Q517: =O517*6+P517 -> 33
A518: BEST PLAYERS
A519: WILLIAMSTOWN | C519: BUCHANAN | F519: NANKERVIS | I519: CAMILLIERI | L519: JOHNSON | O519: MORGAN | R519: HAYWARD
A520: WERRIBEE | C520: AR | F520: CROMPTON | I520: HEMLEY | L520: SMITH | O520: OGILVIE | R520: PETHERIC
A521: GOALKICKERS
A522: WILLIAMSTOWN | C522: SZYSZKA 4 | F522: NANKERVIS 2 | I522: SMITH 2 | K522: CAMILLIERI 2 | N522: BUCHANAN 2 | Q522: MAHON | S522: LANE | U522: PAPLEY | W522: MADIGAN | X522: PATTERSON
A523: WERRIBEE | C523: McEVOY | F523: PETHERIC | I523: LYONS | K523: KNIGHT
A525: ROUND 12 | E525: 29TH JUNE | J525: WEATHER | S525: PLAYED AT
D526: 1ST QTR | H526: 2ND QTR | L526: 3RD QTR | P526: FINAL | S526: WERRIBEE
A527: WERRIBEE | C527: 7 | D527: 13 | E527: =C527*6+D527 -> 55 | G527: 11 | H527: 16 | I527: =G527*6+H527 -> 82 | K527: 15 | L527: 23 | M527: =K527*6+L527 -> 113 | O527: 16 | P527: 24 | Q527: =O527*6+P527 -> 120 | S527: UMPIRE | X527: LADDER | AB527: ROUND | AD527: 12
A528: NORTHCOTE | C528: 0 | D528: 0 | E528: =C528*6+D528 -> 0 | G528: 1 | H528: 2 | I528: =G528*6+H528 -> 8 | K528: 2 | L528: 4 | M528: =K528*6+L528 -> 16 | O528: 7 | P528: 10 | Q528: =O528*6+P528 -> 52
A529: BEST PLAYERS | W529: TEAM | X529: W | Y529: L | Z529: D | AA529: FOR | AB529: AGST | AC529: % | AD529: PTS
A530: WERRIBEE | C530: CROMPTON | F530: CHIRGWIN | I530: B SMITH | L530: CRELLIN | O530: ELLIS | R530: ANDERSON
A531: NORTHCOTE | C531: ELLIS | F531: UNDERWOOD | I531: H SMITH | L531: BRYANT | O531: WASTELL | R531: VINEY | W531: WILLIAMSTOWN | X531: 11 | Y531: 1 | Z531: 0 | AA531: 1285 | AB531: 731 | AC531: =(AA531*100)/AB531 -> 175.78659370725035 | AD531: =(X531*4)+(Z531*2) -> 44
A532: GOALKICKERS | W532: GEELONG WEST | X532: 10 | Y532: 2 | Z532: 0 | AA532: 1427 | AB532: 1002 | AC532: =(AA532*100)/AB532 -> 142.41516966067863 | AD532: =(X532*4)+(Z532*2) -> 40
A533: WERRIBEE | C533: CRELLIN 4 | F533: CROMPTON 4 | I533: CHIRGWIN 2 | L533: COMBEN 2 | N533: PETHERIC 2 | Q533: LYONS | S533: D SMITH | W533: SUNSHINE | X533: 8 | Y533: 4 | Z533: 0 | AA533: 1056 | AB533: 806 | AC533: =(AA533*100)/AB533 -> 131.01736972704714 | AD533: =(X533*4)+(Z533*2) -> 32
A534: NORTHCOTE | C534: STAFFORD 2 | F534: PITTS 2 | I534: BRYANT | K534: UNDERWOOD | N534: MAYNE | W534: WERRIBEE | X534: 7 | Y534: 5 | Z534: 0 | AA534: 878 | AB534: 1058 | AC534: =(AA534*100)/AB534 -> 82.986767485822313 | AD534: =(X534*4)+(Z534*2) -> 28
A536: CAULFIELD | C536: 6 | D536: 4 | E536: =C536*6+D536 -> 40 | G536: 12 | H536: 11 | I536: =G536*6+H536 -> 83 | K536: 13 | L536: 16 | M536: =K536*6+L536 -> 94 | O536: 16 | P536: 20 | Q536: =O536*6+P536 -> 116 | S536: PRINCES PARK, CAULFIELD | W536: NORTHCOTE | X536: 6 | Y536: 6 | Z536: 0 | AA536: 898 | AB536: 1017 | AC536: =(AA536*100)/AB536 -> 88.298918387413963 | AD536: =(X536*4)+(Z536*2) -> 24
A537: BOX HILL | C537: 2 | D537: 3 | E537: =C537*6+D537 -> 15 | G537: 3 | H537: 6 | I537: =G537*6+H537 -> 24 | K537: 7 | L537: 10 | M537: =K537*6+L537 -> 52 | O537: 9 | P537: 15 | Q537: =O537*6+P537 -> 69 | W537: FRANKSTON | X537: 5 | Y537: 7 | Z537: 0 | AA537: 1178 | AB537: 1144 | AC537: =(AA537*100)/AB537 -> 102.97202797202797 | AD537: =(X537*4)+(Z537*2) -> 20
A538: BEST PLAYERS | W538: MORDIALLOC | X538: 4 | Y538: 8 | Z538: 0 | AA538: 956 | AB538: 1081 | AC538: =(AA538*100)/AB538 -> 88.436632747456059 | AD538: =(X538*4)+(Z538*2) -> 16
A539: CAULFIELD | C539: ARRELL | F539: BAKER | I539: WILLIAMS | L539: ROWE | O539: GOWANS | R539: SANDERS | W539: CAULFIELD | X539: 4 | Y539: 8 | Z539: 0 | AA539: 952 | AB539: 1101 | AC539: =(AA539*100)/AB539 -> 86.466848319709356 | AD539: =(X539*4)+(Z539*2) -> 16
A540: BOX HILL | C540: PRITCHARD | F540: PERRY | I540: EBERT | L540: JONES | O540: BATES | R540: BARKER | W540: CAMBERWELL | X540: 3 | Y540: 9 | Z540: 0 | AA540: 845 | AB540: 1256 | AC540: =(AA540*100)/AB540 -> 67.277070063694268 | AD540: =(X540*4)+(Z540*2) -> 12
A541: GOALKICKERS | W541: BOX HILL | X541: 2 | Y541: 10 | Z541: 0 | AA541: 802 | AB541: 1077 | AC541: =(AA541*100)/AB541 -> 74.4661095636026 | AD541: =(X541*4)+(Z541*2) -> 8
A542: CAULFIELD | C542: SANDERS 5 | F542: NEAL 3 | H542: BARBER 3 | J542: WILLIAMS 3 | M542: ROWE | O542: DALGLEISH
A543: BOX HILL | C543: PERRY 2 | E543: EBERT 2 | G543: C FELLOWS | J543: G FELLOWS | M543: LA ROCHE | P543: BAKER | R543: NOLAN
E544: 30TH JUNE | J544: WEATHER
A545: WILLIAMSTOWN | C545: 3 | D545: 1 | E545: =C545*6+D545 -> 19 | G545: 12 | H545: 3 | I545: =G545*6+H545 -> 75 | K545: 13 | L545: 5 | M545: =K545*6+L545 -> 83 | O545: 21 | P545: 8 | Q545: =O545*6+P545 -> 134 | S545: WILLIAMSTOWN
A546: FRANKSTON | C546: 3 | D546: 9 | E546: =C546*6+D546 -> 27 | G546: 5 | H546: 12 | I546: =G546*6+H546 -> 42 | K546: 7 | L546: 15 | M546: =K546*6+L546 -> 57 | O546: 10 | P546: 16 | Q546: =O546*6+P546 -> 76
A547: BEST PLAYERS
A548: WILLIAMSTOWN | C548: JOHNSON | F548: LANE | I548: CAMILLIERI | L548: MADIGAN | O548: BARNES | R548: CALLAN
A549: FRANKSTON | C549: HUGHES | F549: LEE | I549: SMITH | L549: NICHOLSON | O549: LEWIS | R549: KERR
A550: GOALKICKERS
A551: WILLIAMSTOWN | C551: NANKERVIS 5 | F551: LANE 4 | H551: MULLIGAN 3 | K551: PATTERSON 3 | N551: BUCHANAN 2 | Q551: WARE 2 | S551: CAMILLIERI | V551: BARNES
A552: FRANKSTON | C552: KERR 4 | F552: NICHOLSON 3 | I552: BRODIE | K552: SLADE | M552: BUNOVITCH
A554: GEELONG WEST | C554: 3 | D554: 3 | E554: =C554*6+D554 -> 21 | G554: 6 | H554: 4 | I554: =G554*6+H554 -> 40 | K554: 13 | L554: 9 | M554: =K554*6+L554 -> 87 | O554: 18 | P554: 14 | Q554: =O554*6+P554 -> 122 | S554: MORDIALLOC
A555: MORDIALLOC | C555: 3 | D555: 5 | E555: =C555*6+D555 -> 23 | G555: 7 | H555: 8 | I555: =G555*6+H555 -> 50 | K555: 9 | L555: 9 | M555: =K555*6+L555 -> 63 | O555: 11 | P555: 14 | Q555: =O555*6+P555 -> 80
A556: BEST PLAYERS
A557: GEELONG WEST | C557: TENABEL | F557: HARRIS | I557: EMOND | L557: STREET | O557: KEAYS | R557: DEEATH
A558: MORDIALLOC | C558: BENTLEY | F558: HYNES | I558: STUDHAM | L558: LAIRD | O558: CULPH | R558: BACKMAN
A559: GOALKICKERS
A560: GEELONG WEST | C560: STACEY 4 | F560: HARRIS 4 | H560: G O'DONNELL 3 | K560: TENABEL 3 | N560: DEEATH 2 | Q560: 2 SHORT
A561: MORDIALLOC | C561: LESLIE 4 | F561: GARDINER 2 | I561: BACKMAN 2 | L561: MATTHEWS 2 | O561: LYONS
A563: SUNSHINE | C563: 7 | D563: 3 | E563: =C563*6+D563 -> 45 | G563: 11 | H563: 9 | I563: =G563*6+H563 -> 75 | K563: 15 | L563: 10 | M563: =K563*6+L563 -> 100 | O563: 24 | P563: 12 | Q563: =O563*6+P563 -> 156 | S563: CAMBERWELL
A564: CAMBERWELL | C564: 0 | D564: 7 | E564: =C564*6+D564 -> 7 | G564: 3 | H564: 7 | I564: =G564*6+H564 -> 25 | K564: 7 | L564: 12 | M564: =K564*6+L564 -> 54 | O564: 7 | P564: 14 | Q564: =O564*6+P564 -> 56
A565: BEST PLAYERS
A566: SUNSHINE | C566: RUSSELL | F566: McLEOD | I566: THORNTON | L566: McGARRITY | O566: TREZISE | Q566: FERGUSON
A567: CAMBERWELL | C567: DOCKER | F567: RICHARDSON | I567: CONYERS | L567: McNAMARA | O567: PECK | Q567: J SMITH
A568: GOALKICKERS
A569: SUNSHINE | C569: ALLEN 6 | F569: RUSSELL 4 | I569: BROWN 4 | K569: FERGUSON 4 | N569: FITZGERALD 3 | Q569: BENSON 2 | S569: CROSBIE
A570: CAMBERWELL | C570: DELANTY 2 | F570: FRIEBERG 2 | I570: L BOYD 2 | L570: PECK
A572: ROUND 13 | E572: 6TH JULY | J572: WEATHER | S572: PLAYED AT
D573: 1ST QTR | H573: 2ND QTR | L573: 3RD QTR | P573: FINAL | S573: FRANKSTON
A574: FRANKSTON | C574: 4 | D574: 3 | E574: =C574*6+D574 -> 27 | G574: 9 | H574: 9 | I574: =G574*6+H574 -> 63 | K574: 14 | L574: 14 | M574: =K574*6+L574 -> 98 | O574: 19 | P574: 21 | Q574: =O574*6+P574 -> 135 | S574: UMPIRE | X574: LADDER | AB574: ROUND | AD574: 13
A575: CAULFIELD | C575: 4 | D575: 1 | E575: =C575*6+D575 -> 25 | G575: 7 | H575: 4 | I575: =G575*6+H575 -> 46 | K575: 11 | L575: 10 | M575: =K575*6+L575 -> 76 | O575: 12 | P575: 13 | Q575: =O575*6+P575 -> 85
A576: BEST PLAYERS | W576: TEAM | X576: W | Y576: L | Z576: D | AA576: FOR | AB576: AGST | AC576: % | AD576: PTS
A577: FRANKSTON | C577: CRAWFORD | F577: THATCHER | I577: KERR | L577: LEE | N577: CARR
A578: CAULFIELD | C578: ROWE | F578: CLARK | I578: BAKER | L578: HORGAN | N578: SANDERS | W578: WILLIAMSTOWN | X578: 12 | Y578: 1 | Z578: 0 | AA578: 1382 | AB578: 781 | AC578: =(AA578*100)/AB578 -> 176.95262483994878 | AD578: =(X578*4)+(Z578*2) -> 48
A579: GOALKICKERS | W579: GEELONG WEST | X579: 10 | Y579: 3 | Z579: 0 | AA579: 1477 | AB579: 1099 | AC579: =(AA579*100)/AB579 -> 134.39490445859872 | AD579: =(X579*4)+(Z579*2) -> 40
A580: FRANKSTON | C580: CRAWFORD 6 | F580: THATCHER 4 | I580: MIDDLETON 3 | L580: SLADE 2 | N580: KERR 2 | P580: LEE | Q580: BISHOP | W580: SUNSHINE | X580: 9 | Y580: 4 | Z580: 0 | AA580: 1202 | AB580: 854 | AC580: =(AA580*100)/AB580 -> 140.74941451990631 | AD580: =(X580*4)+(Z580*2) -> 36
A581: CAULFIELD | C581: NEAL 3 | E581: GREEN 3 | G581: HORGAN 2 | J581: SANDERS 2 | M581: GOWANS | O581: ARRELL | W581: WERRIBEE | X581: 8 | Y581: 5 | Z581: 0 | AA581: 998 | AB581: 1131 | AC581: =(AA581*100)/AB581 -> 88.240495137046864 | AD581: =(X581*4)+(Z581*2) -> 32
A583: WERRIBEE | C583: 4 | D583: 5 | E583: =C583*6+D583 -> 29 | G583: 8 | H583: 10 | I583: =G583*6+H583 -> 58 | K583: 13 | L583: 20 | M583: =K583*6+L583 -> 98 | O583: 16 | P583: 24 | Q583: =O583*6+P583 -> 120 | S583: BOX HILL | W583: NORTHCOTE | X583: 7 | Y583: 6 | Z583: 0 | AA583: 1036 | AB583: 1058 | AC583: =(AA583*100)/AB583 -> 97.920604914933833 | AD583: =(X583*4)+(Z583*2) -> 28
A584: BOX HILL | C584: 3 | D584: 2 | E584: =C584*6+D584 -> 20 | G584: 5 | H584: 4 | I584: =G584*6+H584 -> 34 | K584: 7 | L584: 5 | M584: =K584*6+L584 -> 47 | O584: 11 | P584: 7 | Q584: =O584*6+P584 -> 73 | W584: FRANKSTON | X584: 6 | Y584: 7 | Z584: 0 | AA584: 1313 | AB584: 1229 | AC584: =(AA584*100)/AB584 -> 106.83482506102523 | AD584: =(X584*4)+(Z584*2) -> 24
A585: BEST PLAYERS | W585: CAULFIELD | X585: 4 | Y585: 9 | Z585: 0 | AA585: 1037 | AB585: 1236 | AC585: =(AA585*100)/AB585 -> 83.899676375404525 | AD585: =(X585*4)+(Z585*2) -> 16
A586: WERRIBEE | C586: CHIRGWIN | F586: LYONS | I586: SMITH | L586: ELLIS | W586: MORDIALLOC | X586: 4 | Y586: 9 | Z586: 0 | AA586: 1004 | AB586: 1227 | AC586: =(AA586*100)/AB586 -> 81.825590872045638 | AD586: =(X586*4)+(Z586*2) -> 16
A587: BOX HILL | C587: BRYANT | F587: BATES | I587: McKEOWN | L587: BARNETT | W587: CAMBERWELL | X587: 3 | Y587: 10 | Z587: 0 | AA587: 886 | AB587: 1394 | AC587: =(AA587*100)/AB587 -> 63.558106169296984 | AD587: =(X587*4)+(Z587*2) -> 12
A588: GOALKICKERS | W588: BOX HILL | X588: 2 | Y588: 11 | Z588: 0 | AA588: 875 | AB588: 1197 | AC588: =(AA588*100)/AB588 -> 73.099415204678365 | AD588: =(X588*4)+(Z588*2) -> 8
A589: WERRIBEE | C589: CRELLIN 4 | F589: CHIRGWIN 4 | I589: HEMLEY 3 | L589: OGILVIE 2 | N589: LYONS 2 | P589: ELLIS
A590: BOX HILL | C590: McKEOWN 5 | F590: BATES 2 | I590: C FELLOWS | L590: BRYANT | N590: NOLAN | P590: EBERT
E591: 7TH JULY | I591: WEATHER
A592: NORTHCOTE | C592: 6 | D592: 4 | E592: =C592*6+D592 -> 40 | G592: 12 | H592: 8 | I592: =G592*6+H592 -> 80 | K592: 16 | L592: 11 | M592: =K592*6+L592 -> 107 | O592: 20 | P592: 18 | Q592: =O592*6+P592 -> 138 | S592: NORTHCOTE
A593: CAMBERWELL | C593: 2 | D593: 2 | E593: =C593*6+D593 -> 14 | G593: 3 | H593: 2 | I593: =G593*6+H593 -> 20 | K593: 5 | L593: 2 | M593: =K593*6+L593 -> 32 | O593: 6 | P593: 5 | Q593: =O593*6+P593 -> 41
A594: BEST PLAYERS
A595: NORTHCOTE | C595: SMITH | F595: KEANE | I595: STAFFORD | L595: VINEY | N595: McBREEN | Q595: WASTELL
A596: CAMBERWELL | C596: WILSON | F596: DOCKER | I596: DELANTY | L596: McNAMARA | O596: WICKS | Q596: J SMITH
A597: GOALKICKERS
A598: NORTHCOTE | C598: KEANE 5 | F598: WHITE 4 | H598: WASTELL 3 | K598: R DEAN 3 | N598: STAFFORD 2 | Q598: MICKLESON | S598: UNDERWOOD | V598: VINEY
A599: CAMBERWELL | C599: DELANTY 2 | F599: WICKS 2 | I599: CASEY | K599: QUINN
A601: SUNSHINE | C601: 6 | D601: 2 | E601: =C601*6+D601 -> 38 | G601: 14 | H601: 7 | I601: =G601*6+H601 -> 91 | K601: 16 | L601: 11 | M601: =K601*6+L601 -> 107 | O601: 22 | P601: 14 | Q601: =O601*6+P601 -> 146 | S601: SUNSHINE
A602: MORDIALLOC | C602: 3 | D602: 2 | E602: =C602*6+D602 -> 20 | G602: 4 | H602: 4 | I602: =G602*6+H602 -> 28 | K602: 5 | L602: 7 | M602: =K602*6+L602 -> 37 | O602: 6 | P602: 12 | Q602: =O602*6+P602 -> 48
A603: BEST PLAYERS
A604: SUNSHINE | C604: THORNTON | F604: CROSBIE | I604: FITZGERALD | L604: DEAN | O604: ALLEN | R604: BROWN
A605: MORDIALLOC | C605: WILLIS | F605: BACKMAN | I605: BENTLEY | L605: MATTHEWS | O605: PATTERSON | R605: SHIREFFS
A606: GOALKICKERS
A607: SUNSHINE | C607: ALLEN 8 | F607: FITZGERALD 4 | I607: FERGUSON 3 | L607: BROWN 3 | N607: TREZISE | P607: DEAN | R607: CROSBIE | T607: PLAIN
A608: MORDIALLOC | C608: BACKMAN 3 | F608: LESLIE | I608: GARDINER | L608: PALMER
A610: WILLIAMSTOWN | C610: 6 | D610: 1 | E610: =C610*6+D610 -> 37 | G610: 10 | H610: 5 | I610: =G610*6+H610 -> 65 | K610: 12 | L610: 10 | M610: =K610*6+L610 -> 82 | O610: 14 | P610: 13 | Q610: =O610*6+P610 -> 97 | S610: GEELONG WEST
A611: GEELONG WEST | C611: 2 | D611: 1 | E611: =C611*6+D611 -> 13 | G611: 3 | H611: 5 | I611: =G611*6+H611 -> 23 | K611: 3 | L611: 14 | M611: =K611*6+L611 -> 32 | O611: 5 | P611: 20 | Q611: =O611*6+P611 -> 50
A612: BEST PLAYERS
A613: WILLIAMSTOWN | C613: NANKERVIS | F613: PATTERSON | I613: BARNES | L613: PAGE | N613: SMITH | Q613: JOHNSON
A614: GEELONG WEST | C614: TENABEL | F614: OLIVER | I614: HARRIS | L614: ADAMS | N614: SKROWONSKI | Q614: MOORE
A615: GOALKICKERS
A616: WILLIAMSTOWN | C616: SZYSZKA 3 | F616: PATTERSON 3 | I616: NANKERVIS 3 | L616: MULLIGAN 2 | N616: CAMILLIERI | Q616: BARNES | S616: BUCHANAN
A617: GEELONG WEST | C617: TENABEL | F617: GIBBONS | I617: G O'DONNELL | L617: ADAMS | N617: HISCOX
A619: ROUND 14 | E619: 13TH JULY | J619: WEATHER | S619: PLAYED AT
D620: 1ST QTR | H620: 2ND QTR | L620: 3RD QTR | P620: FINAL | S620: WERRIBEE
A621: WERRIBEE | C621: 5 | D621: 1 | E621: =C621*6+D621 -> 31 | G621: 10 | H621: 4 | I621: =G621*6+H621 -> 64 | K621: 13 | L621: 9 | M621: =K621*6+L621 -> 87 | O621: 17 | P621: 10 | Q621: =O621*6+P621 -> 112 | S621: UMPIRE | X621: LADDER | AB621: ROUND | AD621: 14
A622: FRANKSTON | C622: 2 | D622: 1 | E622: =C622*6+D622 -> 13 | G622: 2 | H622: 4 | I622: =G622*6+H622 -> 16 | K622: 3 | L622: 4 | M622: =K622*6+L622 -> 22 | O622: 3 | P622: 9 | Q622: =O622*6+P622 -> 27
A623: BEST PLAYERS | W623: TEAM | X623: W | Y623: L | Z623: D | AA623: FOR | AB623: AGST | AC623: % | AD623: PTS
A624: WERRIBEE | C624: ANDERSON | F624: DOVE | I624: LYONS | L624: HEMLEY | O624: CHIRGWIN
A625: FRANKSTON | C625: LEWIS | F625: CRAWFORD | I625: COUTTS | L625: SLADE | O625: LEE | W625: WILLIAMSTOWN | X625: 13 | Y625: 1 | Z625: 0 | AA625: 1572 | AB625: 818 | AC625: =(AA625*100)/AB625 -> 192.17603911980441 | AD625: =(X625*4)+(Z625*2) -> 52
A626: GOALKICKERS | P626: LYONS | W626: GEELONG WEST | X626: 11 | Y626: 3 | Z626: 0 | AA626: 1552 | AB626: 1168 | AC626: =(AA626*100)/AB626 -> 132.87671232876713 | AD626: =(X626*4)+(Z626*2) -> 44
A627: WERRIBEE | C627: CHIRGWIN 4 | F627: CRELLIN 3 | H627: ELLIS 3 | J627: HEMLEY 2 | L627: PETHERIC | N627: SMITH | P627: CROMPTON | S627: OGILVIE | W627: SUNSHINE | X627: 9 | Y627: 5 | Z627: 0 | AA627: 1271 | AB627: 929 | AC627: =(AA627*100)/AB627 -> 136.81377825618944 | AD627: =(X627*4)+(Z627*2) -> 36
A628: FRANKSTON | C628: KERR | F628: CRAWFORD | I628: SLADE | W628: WERRIBEE | X628: 9 | Y628: 5 | Z628: 0 | AA628: 1110 | AB628: 1158 | AC628: =(AA628*100)/AB628 -> 95.854922279792746 | AD628: =(X628*4)+(Z628*2) -> 36
A630: CAULFIELD | C630: 4 | D630: 6 | E630: =C630*6+D630 -> 30 | G630: 9 | H630: 9 | I630: =G630*6+H630 -> 63 | K630: 12 | L630: 11 | M630: =K630*6+L630 -> 83 | O630: 19 | P630: 18 | Q630: =O630*6+P630 -> 132 | S630: PRINCES PARK, CAULFIELD | W630: NORTHCOTE | X630: 8 | Y630: 6 | Z630: 0 | AA630: 1118 | AB630: 1123 | AC630: =(AA630*100)/AB630 -> 99.55476402493322 | AD630: =(X630*4)+(Z630*2) -> 32
A631: MORDIALLOC | C631: 3 | D631: 2 | E631: =C631*6+D631 -> 20 | G631: 6 | H631: 9 | I631: =G631*6+H631 -> 45 | K631: 12 | L631: 15 | M631: =K631*6+L631 -> 87 | O631: 15 | P631: 17 | Q631: =O631*6+P631 -> 107 | W631: FRANKSTON | X631: 6 | Y631: 8 | Z631: 0 | AA631: 1340 | AB631: 1341 | AC631: =(AA631*100)/AB631 -> 99.925428784489185 | AD631: =(X631*4)+(Z631*2) -> 24
A632: BEST PLAYERS | W632: CAULFIELD | X632: 5 | Y632: 9 | Z632: 0 | AA632: 1169 | AB632: 1343 | AC632: =(AA632*100)/AB632 -> 87.043931496649293 | AD632: =(X632*4)+(Z632*2) -> 20
A633: CAULFIELD | C633: ARRELL | F633: BAKER | I633: COLLINS | L633: SANDERS | O633: ROBINSON | R633: WILLIAMS | W633: MORDIALLOC | X633: 4 | Y633: 10 | Z633: 0 | AA633: 1111 | AB633: 1359 | AC633: =(AA633*100)/AB633 -> 81.751287711552607 | AD633: =(X633*4)+(Z633*2) -> 16
A634: MORDIALLOC | C634: McPHERSON | F634: IRVING | I634: BACKMAN | L634: BENTLEY | O634: HYNES | R634: LESLIE | W634: CAMBERWELL | X634: 3 | Y634: 11 | Z634: 0 | AA634: 923 | AB634: 1584 | AC634: =(AA634*100)/AB634 -> 58.270202020202021 | AD634: =(X634*4)+(Z634*2) -> 12
A635: GOALKICKERS | W635: BOX HILL | X635: 2 | Y635: 12 | Z635: 0 | AA635: 940 | AB635: 1279 | AC635: =(AA635*100)/AB635 -> 73.494917904612976 | AD635: =(X635*4)+(Z635*2) -> 8
A636: CAULFIELD | C636: J WILLIAMS 6 | F636: NEAL 4 | H636: JESS 3 | J636: SANDERS 2 | M636: GOWANS 2 | P636: BAKER | R636: MELBOURNE
A637: MORDIALLOC | C637: LESLIE 7 | F637: IRVING 3 | I637: BACKMAN 2 | L637: THOMPSON 2 | O637: HYNES
E638: 14TH JULY | I638: WEATHER
A639: NORTHCOTE | C639: 3 | D639: 2 | E639: =C639*6+D639 -> 20 | G639: 7 | H639: 3 | I639: =G639*6+H639 -> 45 | K639: 9 | L639: 6 | M639: =K639*6+L639 -> 60 | O639: 12 | P639: 10 | Q639: =O639*6+P639 -> 82 | S639: NORTHCOTE
A640: BOX HILL | C640: 3 | D640: 4 | E640: =C640*6+D640 -> 22 | G640: 7 | H640: 8 | I640: =G640*6+H640 -> 50 | K640: 8 | L640: 9 | M640: =K640*6+L640 -> 57 | O640: 9 | P640: 11 | Q640: =O640*6+P640 -> 65
A641: BEST PLAYERS
A642: NORTHCOTE | C642: ELLIS | F642: WHITE | I642: STAFFORD | L642: UNDERWOOD | O642: KEANE | R642: McBREEN
A643: BOX HILL | C643: DOULIS | F643: BATES | I643: PERRY | L643: RALPH | O643: BRYANT
A644: GOALKICKERS
A645: NORTHCOTE | C645: KEANE 6 | F645: ROBSON 3 | I645: MICKLESON | L645: STAFFORD | O645: VINEY
A646: BOX HILL | C646: G FELLOWS 2 | F646: RALPH 2 | I646: NOLAN 2 | L646: BATES | N646: BRYANT | Q646: EBERT
A648: GEELONG WEST | C648: 3 | D648: 1 | E648: =C648*6+D648 -> 19 | G648: 4 | H648: 2 | I648: =G648*6+H648 -> 26 | K648: 5 | L648: 5 | M648: =K648*6+L648 -> 35 | O648: 11 | P648: 9 | Q648: =O648*6+P648 -> 75 | S648: GEELONG WEST
A649: SUNSHINE | C649: 0 | D649: 0 | E649: =C649*6+D649 -> 0 | G649: 4 | H649: 6 | I649: =G649*6+H649 -> 30 | K649: 7 | L649: 8 | M649: =K649*6+L649 -> 50 | O649: 10 | P649: 9 | Q649: =O649*6+P649 -> 69
A650: BEST PLAYERS
A651: GEELONG WEST | C651: KEAYS | F651: TENABEL | I651: JENNINGS | L651: STACEY | O651: SKROWONSKY | R651: ADAMS
A652: SUNSHINE | C652: PLAIN | F652: BROWN | I652: THORNTON | L652: DEAN | O652: RUSSELL | R652: TREZISE
A653: GOALKICKERS
A654: GEELONG WEST | C654: TENABEL 4 | F654: G O'DONNELL 2 | I654: BRUSHFIELD | L654: EMOND | N654: GIBBONS | Q654: WHITE | S654: HARRIS
A655: SUNSHINE | C655: RUSSELL 2 | F655: BROWN 2 | I655: YOUNG | K655: FERGUSON | M655: TREZISE | O655: ALLEN | Q655: FITZGERALD | T655: PLAIN
A657: WILLIAMSTOWN | C657: 6 | D657: 6 | E657: =C657*6+D657 -> 42 | G657: 14 | H657: 12 | I657: =G657*6+H657 -> 96 | K657: 20 | L657: 17 | M657: =K657*6+L657 -> 137 | O657: 27 | P657: 28 | Q657: =O657*6+P657 -> 190 | S657: WILLIAMSTOWN
A658: CAMBERWELL | C658: 0 | D658: 2 | E658: =C658*6+D658 -> 2 | G658: 3 | H658: 3 | I658: =G658*6+H658 -> 21 | K658: 5 | L658: 7 | M658: =K658*6+L658 -> 37 | O658: 5 | P658: 7 | Q658: =O658*6+P658 -> 37
A659: BEST PLAYERS
A660: WILLIAMSTOWN | C660: JOHNSON | F660: BUCHANAN | I660: BARNES | L660: CAMILLIERI | O660: PAPLEY | R660: NANKERVIS
A661: CAMBERWELL | C661: STAFFORD | F661: J SMITH | I661: McNAMARA | L661: WICKS | O661: OBORNE
A662: GOALKICKERS
A663: WILLIAMSTOWN | C663: BUCHANAN 8 | F663: SZYSZKA 4 | H663: CAMILLIERI 3 | K663: PAPLEY 3 | M663: LANE 2 | O663: WARE 2 | Q663: NANKERVIS 2 | T663: MULLIGAN | W663: PATTERSON | X663: HAYWARD
A664: CAMBERWELL | C664: WICKS 2 | F664: DELANTY | I664: RICHARDSON | L664: RIETSCHAL
A666: ROUND 15 | E666: 20TH JULY | J666: WEATHER | S666: PLAYED AT
D667: 1ST QTR | H667: 2ND QTR | L667: 3RD QTR | P667: FINAL | S667: FRANKSTON
A668: FRANKSTON | C668: 8 | D668: 2 | E668: =C668*6+D668 -> 50 | G668: 11 | H668: 4 | I668: =G668*6+H668 -> 70 | K668: 13 | L668: 9 | M668: =K668*6+L668 -> 87 | O668: 15 | P668: 10 | Q668: =O668*6+P668 -> 100 | S668: UMPIRE | X668: LADDER | AB668: ROUND | AD668: 15
A669: NORTHCOTE | C669: 1 | D669: 4 | E669: =C669*6+D669 -> 10 | G669: 7 | H669: 7 | I669: =G669*6+H669 -> 49 | K669: 10 | L669: 10 | M669: =K669*6+L669 -> 70 | O669: 14 | P669: 14 | Q669: =O669*6+P669 -> 98
A670: BEST PLAYERS | W670: TEAM | X670: W | Y670: L | Z670: D | AA670: FOR | AB670: AGST | AC670: % | AD670: PTS
A671: FRANKSTON | C671: ROSENBROCK | F671: SLADE | I671: GRAHAM | L671: CARR | O671: SHEPPARD | R671: McMAHON
A672: NORTHCOTE | C672: WASTELL | F672: UNDERWOOD | I672: McBREEN | L672: ELLIS | O672: HENRY | R672: RORISON | W672: WILLIAMSTOWN | X672: 14 | Y672: 1 | Z672: 0 | AA672: 1686 | AB672: 852 | AC672: =(AA672*100)/AB672 -> 197.88732394366198 | AD672: =(X672*4)+(Z672*2) -> 56
A673: GOALKICKERS | W673: GEELONG WEST | X673: 12 | Y673: 3 | Z673: 0 | AA673: 1710 | AB673: 1275 | AC673: =(AA673*100)/AB673 -> 134.11764705882354 | AD673: =(X673*4)+(Z673*2) -> 48
A674: FRANKSTON | C674: ROSENBROCK 7 | F674: SLADE 3 | H674: LEWIS | J674: QUIN | L674: ELLIS | N674: CRAWFORD | Q674: McMAHON | W674: SUNSHINE | X674: 10 | Y674: 5 | Z674: 0 | AA674: 1408 | AB674: 1011 | AC674: =(AA674*100)/AB674 -> 139.26805143422354 | AD674: =(X674*4)+(Z674*2) -> 40
A675: NORTHCOTE | C675: WASTELL 3 | F675: STAFFORD 3 | I675: VINEY 2 | K675: MARTIN 2 | N675: R DEAN 2 | P675: G DEAN | R675: MOUNTSEY | W675: WERRIBEE | X675: 10 | Y675: 5 | Z675: 0 | AA675: 1198 | AB675: 1233 | AC675: =(AA675*100)/AB675 -> 97.161394971613944 | AD675: =(X675*4)+(Z675*2) -> 40
A677: WERRIBEE | C677: 5 | D677: 1 | E677: =C677*6+D677 -> 31 | G677: 8 | H677: 8 | I677: =G677*6+H677 -> 56 | K677: 11 | L677: 9 | M677: =K677*6+L677 -> 75 | O677: 12 | P677: 16 | Q677: =O677*6+P677 -> 88 | S677: WERRIBEE | W677: NORTHCOTE | X677: 8 | Y677: 7 | Z677: 0 | AA677: 1216 | AB677: 1223 | AC677: =(AA677*100)/AB677 -> 99.42763695829926 | AD677: =(X677*4)+(Z677*2) -> 32
A678: CAULFIELD | C678: 5 | D678: 3 | E678: =C678*6+D678 -> 33 | G678: 5 | H678: 6 | I678: =G678*6+H678 -> 36 | K678: 7 | L678: 12 | M678: =K678*6+L678 -> 54 | O678: 10 | P678: 15 | Q678: =O678*6+P678 -> 75 | W678: FRANKSTON | X678: 7 | Y678: 8 | Z678: 0 | AA678: 1440 | AB678: 1439 | AC678: =(AA678*100)/AB678 -> 100.06949270326616 | AD678: =(X678*4)+(Z678*2) -> 28
A679: BEST PLAYERS | W679: CAULFIELD | X679: 5 | Y679: 10 | Z679: 0 | AA679: 1244 | AB679: 1431 | AC679: =(AA679*100)/AB679 -> 86.932215234102031 | AD679: =(X679*4)+(Z679*2) -> 20
A680: WERRIBEE | C680: CROMPTON | F680: CRELLIN | I680: LYONS | L680: CHIRGWIN | O680: SMITH | W680: MORDIALLOC | X680: 4 | Y680: 11 | Z680: 0 | AA680: 1145 | AB680: 1471 | AC680: =(AA680*100)/AB680 -> 77.838205302515291 | AD680: =(X680*4)+(Z680*2) -> 16
A681: CAULFIELD | C681: SANDERS | F681: PRENTICE | I681: ROWE | L681: ARRELL | O681: GOWANS | R681: COLLINS | W681: CAMBERWELL | X681: 3 | Y681: 12 | Z681: 0 | AA681: 1030 | AB681: 1742 | AC681: =(AA681*100)/AB681 -> 59.127439724454646 | AD681: =(X681*4)+(Z681*2) -> 12
A682: GOALKICKERS | W682: BOX HILL | X682: 2 | Y682: 13 | Z682: 0 | AA682: 1022 | AB682: 1416 | AC682: =(AA682*100)/AB682 -> 72.175141242937855 | AD682: =(X682*4)+(Z682*2) -> 8
A683: WERRIBEE | C683: CROMPTON 4 | F683: ELLIS 4 | I683: CRELLIN 2 | L683: SMITH | N683: LYONS
A684: CAULFIELD | C684: SANDERS 3 | F684: PRENTICE 2 | I684: WILLIAMS 2 | L684: GOWANS | N684: JESS
A686: SUNSHINE | C686: 5 | D686: 7 | E686: =C686*6+D686 -> 37 | G686: 8 | H686: 9 | I686: =G686*6+H686 -> 57 | K686: 12 | L686: 13 | M686: =K686*6+L686 -> 85 | O686: 20 | P686: 17 | Q686: =O686*6+P686 -> 137 | S686: SUNSHINE
A687: BOX HILL | C687: 3 | D687: 0 | E687: =C687*6+D687 -> 18 | G687: 8 | H687: 4 | I687: =G687*6+H687 -> 52 | K687: 11 | L687: 8 | M687: =K687*6+L687 -> 74 | O687: 12 | P687: 10 | Q687: =O687*6+P687 -> 82
A688: BEST PLAYERS
A689: SUNSHINE | C689: McGARRITY | F689: HIPWORTH | I689: ALLEN | L689: BROWN | O689: RUSSELL | R689: THORNTON
A690: BOX HILL | C690: PERRY | F690: SA | I690: MULLIN | L690: G FELLOWS | O690: EBERT | R690: PRITCHARD
A691: GOALKICKERS
A692: SUNSHINE | C692: RUSSELL 8 | F692: ALLEN 4 | H692: FERGUSON 3 | K692: WALSH | M692: CROSBIE | O692: BROWN | Q692: TREZISE | S692: METCHER
A693: BOX HILL | C693: G FELLOWS 3 | F693: BATES 2 | I693: HUNT 2 | K693: BRYANT 2 | M693: C FELLOWS | P693: McKEOWN | R693: EBERT
A695: GEELONG WEST | C695: 9 | D695: 8 | E695: =C695*6+D695 -> 62 | G695: 13 | H695: 8 | I695: =G695*6+H695 -> 86 | K695: 20 | L695: 11 | M695: =K695*6+L695 -> 131 | O695: 24 | P695: 14 | Q695: =O695*6+P695 -> 158 | S695: CAMBERWELL
A696: CAMBERWELL | C696: 0 | D696: 1 | E696: =C696*6+D696 -> 1 | G696: 7 | H696: 6 | I696: =G696*6+H696 -> 48 | K696: 11 | L696: 7 | M696: =K696*6+L696 -> 73 | O696: 16 | P696: 11 | Q696: =O696*6+P696 -> 107
A697: BEST PLAYERS
A698: GEELONG WEST | C698: TENABEL | F698: ADAMS | I698: KEAYS | L698: STACEY | O698: GIBBONS | R698: HARRIS
A699: CAMBERWELL | C699: SMITH | F699: McNAMARA | I699: BOYD | L699: DELANTY | O699: WICKS | R699: STAFFORD
A700: GOALKICKERS
A701: GEELONG WEST | C701: TENABEL 6 | F701: GIBBONS 5 | H701: G O'DONNELL 3 | K701: WI ? 2 | M701: ADAMS 2 | O701: BRUSHFIELD | R701: STACEY | T701: HARRIS | V701: KEAYS | X701: I O'DONNELL | Z701: DEEATH
A702: CAMBERWELL | C702: DELANTY 6 | F702: WICKS 3 | I702: BRAYNE 2 | L702: R CASEY | N702: McNAMARA | Q702: BOYD | S702: OBORNE | V702: B CASEY
E703: 21ST JULY | I703: WEATHER
A704: WILLIAMSTOWN | C704: 4 | D704: 5 | E704: =C704*6+D704 -> 29 | G704: 9 | H704: 13 | I704: =G704*6+H704 -> 67 | K704: 12 | L704: 18 | M704: =K704*6+L704 -> 90 | O704: 15 | P704: 22 | Q704: =O704*6+P704 -> 112 | S704: MORDIALLOC
A705: MORDIALLOC | C705: 2 | D705: 0 | E705: =C705*6+D705 -> 12 | G705: 4 | H705: 1 | I705: =G705*6+H705 -> 25 | K705: 5 | L705: 3 | M705: =K705*6+L705 -> 33 | O705: 5 | P705: 4 | Q705: =O705*6+P705 -> 34
A706: BEST PLAYERS
A707: WILLIAMSTOWN | C707: NANKERVIS | F707: RUSSELL | I707: BARNES | L707: CAMILLIERI | O707: CAL | Q707: O'MARA
A708: MORDIALLOC | C708: STUDHAM | F708: W | I708: WILLIAMS | L708: HOBSON | O708: LESLIE | Q708: GARDINER
A709: GOALKICKERS
A710: WILLIAMSTOWN | C710: NANKERVIS 7 | F710: WARE 3 | H710: SZYSZKA 2 | K710: PATTERSON | N710: MULLIGAN | Q710: CAMILLIERI
A711: MORDIALLOC | C711: W ? 3 | F711: THOMPSON | I711: GARDINER
A713: ROUND 16 | E713: 27TH JULY | J713: WEATHER | S713: PLAYED AT
D714: 1ST QTR | H714: 2ND QTR | L714: 3RD QTR | P714: FINAL | S714: BOX HILL
A715: BOX HILL | C715: 9 | D715: 2 | E715: =C715*6+D715 -> 56 | G715: 10 | H715: 4 | I715: =G715*6+H715 -> 64 | K715: 13 | L715: 8 | M715: =K715*6+L715 -> 86 | O715: 16 | P715: 9 | Q715: =O715*6+P715 -> 105 | S715: UMPIRE | X715: LADDER | AB715: ROUND | AD715: 16
A716: FRANKSTON | C716: 0 | D716: 0 | E716: =C716*6+D716 -> 0 | G716: 4 | H716: 6 | I716: =G716*6+H716 -> 30 | K716: 4 | L716: 9 | M716: =K716*6+L716 -> 33 | O716: 7 | P716: 12 | Q716: =O716*6+P716 -> 54
A717: BEST PLAYERS | W717: TEAM | X717: W | Y717: L | Z717: D | AA717: FOR | AB717: AGST | AC717: % | AD717: PTS
A718: BOX HILL | C718: G FELLOWS | F718: BATES | I718: BARNETT | L718: BRYANT | N718: PRITCHARD
A719: FRANKSTON | C719: KERR | F719: SLADE | I719: BOWES | L719: PRICE | N719: STAPLETON | W719: WILLIAMSTOWN | X719: 14 | Y719: 1 | Z719: 1 | AA719: 1777 | AB719: 943 | AC719: =(AA719*100)/AB719 -> 188.44114528101804 | AD719: =(X719*4)+(Z719*2) -> 58
A720: GOALKICKERS | W720: GEELONG WEST | X720: 13 | Y720: 3 | Z720: 0 | AA720: 1823 | AB720: 1354 | AC720: =(AA720*100)/AB720 -> 134.63810930576071 | AD720: =(X720*4)+(Z720*2) -> 52
A721: BOX HILL | C721: BATES 4 | F721: G FELLOWS 4 | I721: BRYANT 3 | K721: McKEOWN 2 | N721: BAKER 2 | P721: PERRY | W721: SUNSHINE | X721: 10 | Y721: 5 | Z721: 1 | AA721: 1499 | AB721: 1102 | AC721: =(AA721*100)/AB721 -> 136.02540834845735 | AD721: =(X721*4)+(Z721*2) -> 42
A722: FRANKSTON | C722: KERR 2 | F722: LEEDS 2 | I722: BOWES | K722: NICHOLSON | N722: JOHNSON | W722: WERRIBEE | X722: 10 | Y722: 6 | Z722: 0 | AA722: 1277 | AB722: 1346 | AC722: =(AA722*100)/AB722 -> 94.873699851411587 | AD722: =(X722*4)+(Z722*2) -> 40
A724: NORTHCOTE | C724: 1 | D724: 2 | E724: =C724*6+D724 -> 8 | G724: 5 | H724: 9 | I724: =G724*6+H724 -> 39 | K724: 8 | L724: 11 | M724: =K724*6+L724 -> 59 | O724: 14 | P724: 21 | Q724: =O724*6+P724 -> 105 | S724: PRINCES PARK, CAULFIELD | W724: NORTHCOTE | X724: 9 | Y724: 7 | Z724: 0 | AA724: 1321 | AB724: 1295 | AC724: =(AA724*100)/AB724 -> 102.00772200772201 | AD724: =(X724*4)+(Z724*2) -> 36
A725: CAULFIELD | C725: 1 | D725: 5 | E725: =C725*6+D725 -> 11 | G725: 2 | H725: 5 | I725: =G725*6+H725 -> 17 | K725: 9 | L725: 11 | M725: =K725*6+L725 -> 65 | O725: 10 | P725: 12 | Q725: =O725*6+P725 -> 72 | W725: FRANKSTON | X725: 7 | Y725: 9 | Z725: 0 | AA725: 1494 | AB725: 1544 | AC725: =(AA725*100)/AB725 -> 96.761658031088089 | AD725: =(X725*4)+(Z725*2) -> 28
A726: BEST PLAYERS | W726: CAULFIELD | X726: 5 | Y726: 11 | Z726: 0 | AA726: 1316 | AB726: 1536 | AC726: =(AA726*100)/AB726 -> 85.677083333333329 | AD726: =(X726*4)+(Z726*2) -> 20
A727: NORTHCOTE | C727: ELLIS | F727: MICKLESON | I727: STAFFORD | L727: KEAYS | O727: WHITE | R727: VINEY | W727: MORDIALLOC | X727: 4 | Y727: 12 | Z727: 0 | AA727: 1199 | AB727: 1575 | AC727: =(AA727*100)/AB727 -> 76.126984126984127 | AD727: =(X727*4)+(Z727*2) -> 16
A728: CAULFIELD | C728: PRENTICE | F728: COLLINS | I728: GOWANS | L728: WILLIAMS | O728: ROWE | R728: DALGLEISH | W728: CAMBERWELL | X728: 4 | Y728: 12 | Z728: 0 | AA728: 1134 | AB728: 1796 | AC728: =(AA728*100)/AB728 -> 63.14031180400891 | AD728: =(X728*4)+(Z728*2) -> 16
A729: GOALKICKERS | W729: BOX HILL | X729: 3 | Y729: 13 | Z729: 0 | AA729: 1127 | AB729: 1470 | AC729: =(AA729*100)/AB729 -> 76.666666666666671 | AD729: =(X729*4)+(Z729*2) -> 12
A730: NORTHCOTE | C730: HARVIE 4 | F730: STAFFORD 2 | I730: MICKLESON 2 | L730: KEANE 2 | N730: WHITE 2 | P730: WEST | R730: VINEY
A731: CAULFIELD | C731: GOWANS 3 | F731: WILLIAMS 3 | I731: COLLINS | K731: ARRELL | M731: NEAL | O731: ROBERTSON
E732: 28TH JULY | I732: WEATHER
A733: WILLIAMSTOWN | C733: 3 | D733: 5 | E733: =C733*6+D733 -> 23 | G733: 4 | H733: 12 | I733: =G733*6+H733 -> 36 | K733: 5 | L733: 12 | M733: =K733*6+L733 -> 42 | O733: 12 | P733: 19 | Q733: =O733*6+P733 -> 91 | S733: WILLIAMSTOWN
A734: SUNSHINE | C734: 6 | D734: 3 | E734: =C734*6+D734 -> 39 | G734: 7 | H734: 8 | I734: =G734*6+H734 -> 50 | K734: 10 | L734: 17 | M734: =K734*6+L734 -> 77 | O734: 12 | P734: 19 | Q734: =O734*6+P734 -> 91
A735: BEST PLAYERS
A736: WILLIAMSTOWN | C736: MADIGAN | F736: O'MARA | I736: CALLAN | L736: PATTERSON | O736: RUSSELL | R736: SMITH
A737: SUNSHINE | C737: BROWN | F737: TREZISE | I737: RUSSELL | L737: DEAN | O737: HIPWORTH | R737: BENSON
A738: GOALKICKERS
A739: WILLIAMSTOWN | C739: NANKERVIS 2 | F739: MULLIGAN 2 | I739: PAPLEY 2 | K739: SZYSZKA 2 | M739: CAMILLIERI | P739: SMITH | R739: PATTERSON | U739: WARE
A740: SUNSHINE | C740: BROWN 4 | F740: RUSSELL 2 | I740: WALSH 2 | K740: HARRIS 2 | M740: TREZISE | O740: FERGUSON
A742: CAMBERWELL | C742: 5 | D742: 4 | E742: =C742*6+D742 -> 34 | G742: 7 | H742: 7 | I742: =G742*6+H742 -> 49 | K742: 13 | L742: 13 | M742: =K742*6+L742 -> 91 | O742: 15 | P742: 14 | Q742: =O742*6+P742 -> 104 | S742: CAMBERWELL
A743: MORDIALLOC | C743: 1 | D743: 0 | E743: =C743*6+D743 -> 6 | G743: 3 | H743: 5 | I743: =G743*6+H743 -> 23 | K743: 6 | L743: 6 | M743: =K743*6+L743 -> 42 | O743: 7 | P743: 12 | Q743: =O743*6+P743 -> 54
A744: BEST PLAYERS
A745: CAMBERWELL | C745: PECK | F745: D BOYD | I745: L BOYD | L745: BRAYNE | O745: DOCKER | R745: McNAMARA
A746: MORDIALLOC | C746: HYNES | F746: HOBSON | I746: W THOMPSON | L746: STUDHAM | O746: WILLIAMS | R746: BENTLEY
A747: GOALKICKERS
A748: CAMBERWELL | C748: D BOYD 3 | F748: DANIELS 3 | I748: RIETSCHAL 3 | L748: DELANTY 2 | N748: PECK 2 | P748: WICKS | R748: McNAMARA
A749: MORDIALLOC | C749: PATTERSON 2 | F749: STUDHAM | I749: DAVEY | K749: HYNES | M749: LESLIE | O749: MATTHEWS
A751: GEELONG WEST | C751: 3 | D751: 1 | E751: =C751*6+D751 -> 19 | G751: 6 | H751: 4 | I751: =G751*6+H751 -> 40 | K751: 12 | L751: 8 | M751: =K751*6+L751 -> 80 | O751: 17 | P751: 11 | Q751: =O751*6+P751 -> 113 | S751: GEELONG WEST
A752: WERRIBEE | C752: 2 | D752: 3 | E752: =C752*6+D752 -> 15 | G752: 7 | H752: 5 | I752: =G752*6+H752 -> 47 | K752: 9 | L752: 10 | M752: =K752*6+L752 -> 64 | O752: 11 | P752: 13 | Q752: =O752*6+P752 -> 79
A753: BEST PLAYERS
A754: GEELONG WEST | C754: KEAYS | F754: STACEY | I754: EMOND | L754: TENABEL | O754: ADAMS | R754: OLIVER
A755: WERRIBEE | C755: COMBEN | F755: ANDERSON | I755: ELLIS | L755: CHIRGWIN | O755: LYONS | R755: MANOLAKIS
A756: GOALKICKERS
A757: GEELONG WEST | C757: ADAMS 4 | F757: TENABEL 2 | H757: EMOND 2 | J757: G O'DONNELL 2 | M757: BRUSHFIELD 2 | P757: MOORE 2 | R757: L WHITE | T757: STACEY | V757: HARRIS
A758: WERRIBEE | C758: CHIRGWIN 3 | F758: CROMPTON 2 | I758: TYQUIN 2 | K758: PETHERIC 2 | N758: HEMLEY | P758: LYONS
A760: ROUND 17 | E760: 3RD AUGUST | J760: WEATHER | S760: PLAYED AT
D761: 1ST QTR | H761: 2ND QTR | L761: 3RD QTR | P761: FINAL | S761: FRANKSTON
A762: FRANKSTON | C762: 0 | D762: 0 | E762: =C762*6+D762 -> 0 | G762: 0 | H762: 0 | I762: =G762*6+H762 -> 0 | K762: 0 | L762: 0 | M762: =K762*6+L762 -> 0 | O762: 16 | P762: 13 | Q762: =O762*6+P762 -> 109 | S762: UMPIRE | X762: LADDER | AB762: ROUND | AD762: 17
A763: MORDIALLOC | C763: 0 | D763: 0 | E763: =C763*6+D763 -> 0 | G763: 0 | H763: 0 | I763: =G763*6+H763 -> 0 | K763: 0 | L763: 0 | M763: =K763*6+L763 -> 0 | O763: 6 | P763: 13 | Q763: =O763*6+P763 -> 49
A764: BEST PLAYERS | W764: TEAM | X764: W | Y764: L | Z764: D | AA764: FOR | AB764: AGST | AC764: % | AD764: PTS
A765: FRANKSTON
A766: MORDIALLOC | W766: WILLIAMSTOWN | X766: 15 | Y766: 1 | Z766: 1 | AA766: 1905 | AB766: 1013 | AC766: =(AA766*100)/AB766 -> 188.05528134254689 | AD766: =(X766*4)+(Z766*2) -> 62
A767: GOALKICKERS | W767: GEELONG WEST | X767: 14 | Y767: 3 | Z767: 0 | AA767: 1964 | AB767: 1441 | AC767: =(AA767*100)/AB767 -> 136.29424011103401 | AD767: =(X767*4)+(Z767*2) -> 56
A768: FRANKSTON | W768: SUNSHINE | X768: 11 | Y768: 5 | Z768: 1 | AA768: 1640 | AB768: 1168 | AC768: =(AA768*100)/AB768 -> 140.41095890410958 | AD768: =(X768*4)+(Z768*2) -> 46
A769: MORDIALLOC | W769: WERRIBEE | X769: 11 | Y769: 6 | Z769: 0 | AA769: 1414 | AB769: 1430 | AC769: =(AA769*100)/AB769 -> 98.88111888111888 | AD769: =(X769*4)+(Z769*2) -> 44
A771: GEELONG WEST | C771: 0 | D771: 0 | E771: =C771*6+D771 -> 0 | G771: 0 | H771: 0 | I771: =G771*6+H771 -> 0 | K771: 0 | L771: 0 | M771: =K771*6+L771 -> 0 | O771: 20 | P771: 21 | Q771: =O771*6+P771 -> 141 | S771: BOX HILL | W771: NORTHCOTE | X771: 9 | Y771: 8 | Z771: 0 | AA771: 1391 | AB771: 1423 | AC771: =(AA771*100)/AB771 -> 97.751229796205195 | AD771: =(X771*4)+(Z771*2) -> 36
A772: BOX HILL | C772: 0 | D772: 0 | E772: =C772*6+D772 -> 0 | G772: 0 | H772: 0 | I772: =G772*6+H772 -> 0 | K772: 0 | L772: 0 | M772: =K772*6+L772 -> 0 | O772: 13 | P772: 9 | Q772: =O772*6+P772 -> 87 | W772: FRANKSTON | X772: 8 | Y772: 9 | Z772: 0 | AA772: 1603 | AB772: 1593 | AC772: =(AA772*100)/AB772 -> 100.62774639045826 | AD772: =(X772*4)+(Z772*2) -> 32
A773: BEST PLAYERS | W773: CAULFIELD | X773: 5 | Y773: 12 | Z773: 0 | AA773: 1382 | AB773: 1677 | AC773: =(AA773*100)/AB773 -> 82.409063804412639 | AD773: =(X773*4)+(Z773*2) -> 20
A774: GEELONG WEST | W774: MORDIALLOC | X774: 4 | Y774: 13 | Z774: 0 | AA774: 1248 | AB774: 1684 | AC774: =(AA774*100)/AB774 -> 74.109263657957243 | AD774: =(X774*4)+(Z774*2) -> 16
A775: BOX HILL | W775: CAMBERWELL | X775: 4 | Y775: 13 | Z775: 0 | AA775: 1218 | AB775: 1933 | AC775: =(AA775*100)/AB775 -> 63.010863942058975 | AD775: =(X775*4)+(Z775*2) -> 16
A776: GOALKICKERS | W776: BOX HILL | X776: 3 | Y776: 14 | Z776: 0 | AA776: 1214 | AB776: 1611 | AC776: =(AA776*100)/AB776 -> 75.356921166977031 | AD776: =(X776*4)+(Z776*2) -> 12
A777: GEELONG WEST
A778: BOX HILL
A780: WERRIBEE | C780: 0 | D780: 0 | E780: =C780*6+D780 -> 0 | G780: 0 | H780: 0 | I780: =G780*6+H780 -> 0 | K780: 0 | L780: 0 | M780: =K780*6+L780 -> 0 | O780: 20 | P780: 17 | Q780: =O780*6+P780 -> 137 | S780: WERRIBEE
A781: CAMBERWELL | C781: 0 | D781: 0 | E781: =C781*6+D781 -> 0 | G781: 0 | H781: 0 | I781: =G781*6+H781 -> 0 | K781: 0 | L781: 0 | M781: =K781*6+L781 -> 0 | O781: 12 | P781: 12 | Q781: =O781*6+P781 -> 84
A782: BEST PLAYERS
A783: WERRIBEE
A784: CAMBERWELL
A785: GOALKICKERS
A786: WERRIBEE
A787: CAMBERWELL
A789: SUNSHINE | C789: 0 | D789: 0 | E789: =C789*6+D789 -> 0 | G789: 0 | H789: 0 | I789: =G789*6+H789 -> 0 | K789: 0 | L789: 0 | M789: =K789*6+L789 -> 0 | O789: 20 | P789: 21 | Q789: =O789*6+P789 -> 141 | S789: PRINCES PARK, CAULFIELD
A790: CAULFIELD | C790: 0 | D790: 0 | E790: =C790*6+D790 -> 0 | G790: 0 | H790: 0 | I790: =G790*6+H790 -> 0 | K790: 0 | L790: 0 | M790: =K790*6+L790 -> 0 | O790: 10 | P790: 6 | Q790: =O790*6+P790 -> 66
A791: BEST PLAYERS
A792: SUNSHINE
A793: CAULFIELD
A794: GOALKICKERS
A795: SUNSHINE
A796: CAULFIELD
E797: 4TH AUGUST | I797: WEATHER
A798: WILLIAMSTOWN | C798: 0 | D798: 0 | E798: =C798*6+D798 -> 0 | G798: 0 | H798: 0 | I798: =G798*6+H798 -> 0 | K798: 0 | L798: 0 | M798: =K798*6+L798 -> 0 | O798: 19 | P798: 14 | Q798: =O798*6+P798 -> 128 | S798: NORTHCOTE
A799: NORTHCOTE | C799: 0 | D799: 0 | E799: =C799*6+D799 -> 0 | G799: 0 | H799: 0 | I799: =G799*6+H799 -> 0 | K799: 0 | L799: 0 | M799: =K799*6+L799 -> 0 | O799: 10 | P799: 10 | Q799: =O799*6+P799 -> 70
A800: BEST PLAYERS
A801: WILLIAMSTOWN
A802: NORTHCOTE
A803: GOALKICKERS
A804: WILLIAMSTOWN
A805: NORTHCOTE
A807: FINALS
A808: 1ST SEMI | E808: 10TH AUGUST | J808: WEATHER | S808: PLAYED AT
D809: 1ST QTR | H809: 2ND QTR | L809: 3RD QTR | P809: FINAL | S809: YARRAVILLE
A810: SUNSHINE | C810: 1 | D810: 2 | E810: =C810*6+D810 -> 8 | G810: 8 | H810: 13 | I810: =G810*6+H810 -> 61 | K810: 10 | L810: 16 | M810: =K810*6+L810 -> 76 | O810: 13 | P810: 24 | Q810: =O810*6+P810 -> 102 | S810: UMPIRE
A811: WERRIBEE | C811: 4 | D811: 4 | E811: =C811*6+D811 -> 28 | G811: 4 | H811: 5 | I811: =G811*6+H811 -> 29 | K811: 8 | L811: 9 | M811: =K811*6+L811 -> 57 | O811: 10 | P811: 11 | Q811: =O811*6+P811 -> 71 | S811: TURNER
A812: BEST PLAYERS
A813: SUNSHINE | C813: RUSSELL | F813: McLEOD | I813: McGARRITY | L813: HIPWORTH | O813: CROSBIE | R813: KENNEDY
A814: WERRIBEE | C814: LYONS | F814: B SMITH | I814: ELLIS | L814: COMBEN | O814: D SMITH | R814: CRELLIN
A815: GOALKICKERS
A816: SUNSHINE | C816: HARRIS 3 | F816: RUSSELL 3 | I816: FERGUSON 2 | L816: BROWN | N816: CROSBIE | P816: HIPWORTH | S816: KENNEDY | V816: FITZGERALD
A817: WERRIBEE | C817: CRELLIN 3 | F817: LYONS 3 | I817: CHIRGWIN 2 | L817: CROMPTON | O817: PETHERIC
A819: 2ND SEMI | E819: 10TH AUGUST
A820: WILLIAMSTOWN | C820: 8 | D820: 9 | E820: =C820*6+D820 -> 57 | G820: 10 | H820: 10 | I820: =G820*6+H820 -> 70 | K820: 16 | L820: 14 | M820: =K820*6+L820 -> 110 | O820: 19 | P820: 18 | Q820: =O820*6+P820 -> 132 | S820: TOORAK PARK
A821: GEELONG WEST | C821: 3 | D821: 1 | E821: =C821*6+D821 -> 19 | G821: 10 | H821: 4 | I821: =G821*6+H821 -> 64 | K821: 11 | L821: 5 | M821: =K821*6+L821 -> 71 | O821: 19 | P821: 11 | Q821: =O821*6+P821 -> 125 | S821: McMASTER
A822: BEST PLAYERS
A823: WILLIAMSTOWN | C823: JOHNSON | F823: CAMILLIERI | I823: NANKERVIS | L823: SMITH | O823: PAPLEY | R823: PATTERSON
A824: GEELONG WEST | C824: D HARRIS | F824: EMOND | I824: SKOWRONSKI | L824: ADAMS | O824: TENABEL | R824: SNELL
A825: GOALKICKERS
A826: WILLIAMSTOWN | C826: CAMILLIERI 3 | F826: PATTERSON 3 | I826: PAPLEY 3 | K826: SMITH 3 | M826: NANKERVIS 3 | P826: SZYSZKA 2 | R826: BUCHANAN | U826: JOHNSON
A827: GEELONG WEST | C827: ADAMS 4 | F827: TENABEL 3 | I827: EMOND 2 | K827: BRUSHFIELD 2 | N827: GIBBONS 2 | P827: D HARRIS 2 | S827: DEEATH 2 | V827: SKOWRONSKI | X827: SMITH
A829: PRELIMINARY | E829: 17TH AUGUST | I829: WEATHER
A830: GEELONG WEST | C830: 4 | D830: 7 | E830: =C830*6+D830 -> 31 | G830: 6 | H830: 8 | I830: =G830*6+H830 -> 44 | K830: 12 | L830: 10 | M830: =K830*6+L830 -> 82 | O830: 17 | P830: 12 | Q830: =O830*6+P830 -> 114 | S830: TOORAK PARK
A831: SUNSHINE | C831: 2 | D831: 0 | E831: =C831*6+D831 -> 12 | G831: 3 | H831: 12 | I831: =G831*6+H831 -> 30 | K831: 6 | L831: 15 | M831: =K831*6+L831 -> 51 | O831: 11 | P831: 18 | Q831: =O831*6+P831 -> 84 | S831: O'NEILL
A832: BEST PLAYERS
A833: GEELONG WEST | C833: HARRIS | F833: EMOND | I833: GIBBONS | L833: TENABEL | O833: LARKINS | R833: JENNINGS
A834: SUNSHINE | C834: DEAN | F834: FITZGERALD | I834: FERGUSON | L834: HIPWORTH | O834: KENNEDY | R834: BROWN
A835: GOALKICKERS
A836: GEELONG WEST | C836: EMOND 4 | F836: BRUSHFIELD 3 | I836: HARRIS 3 | K836: DEEATH 2 | N836: ADAMS 2 | P836: TENABEL 2 | R836: STACEY
A837: SUNSHINE | C837: FERGUSON 4 | F837: HARRIS 3 | I837: FITZGERALD 2 | L837: HIPWORTH | O837: BROWN
A839: GRAND
A840: GEELONG WEST | C840: 4 | D840: 3 | E840: =C840*6+D840 -> 27 | G840: 10 | H840: 6 | I840: =G840*6+H840 -> 66 | K840: 14 | L840: 12 | M840: =K840*6+L840 -> 96 | O840: 20 | P840: 15 | Q840: =O840*6+P840 -> 135 | S840: TOORAK PARK
A841: WILLIAMSTOWN | C841: 4 | D841: 3 | E841: =C841*6+D841 -> 27 | G841: 11 | H841: 8 | I841: =G841*6+H841 -> 74 | K841: 15 | L841: 11 | M841: =K841*6+L841 -> 101 | O841: 18 | P841: 15 | Q841: =O841*6+P841 -> 123 | S841: O'NEILL
A842: BEST PLAYERS
A843: GEELONG WEST | C843: TENABEL | F843: HARRIS | I843: KEAYS | L843: ADAMS | O843: GIBBONS | R843: EMOND
A844: WILLIAMSTOWN | C844: PAPLEY | F844: PATTERSON | I844: CAMILLIERI | L844: WARE | O844: MULLIGAN | R844: JOHNSON
A845: GOALKICKERS
A846: GEELONG WEST | C846: ? 3 | E846: TENABEL 3 | H846: HARRIS 3 | J846: ? 2 | L846: STACEY 2 | N846: EMOND 2 | Q846: ? 1 | R846: SKOWRONSKI | U846: GIBBONS
A847: WILLIAMSTOWN | C847: WARE 4 | E847: MULLIGAN 3 | H847: CAMILLIERI 3 | K847: SZYSZKA 2 | N847: BARNES 2 | P847: PAPLEY 2 | R847: PATTERSON | U847: R ? 1