A1: Victorian Football Association
A2: Season 1968 - Division One
A3: © Copyright Wal Williams | F3: First created: 2 May 2015
A4: Contact: joywalwi at gmail dot com | F4: Last updated: 8 October 2017 | W4: VFA Results and tables - Link to the main index page
A5: You are free to copy this document in whole or part provided that proper acknowledgement is given to the author. All rights reserved.
A7: 1968 V.F.A. | C7: SEASON 1ST DIVISION | CA7: \D | CB7: {GOTO}BJ3~/M{RIGHT 7}{END}{DOWN}~G4~
A8: ROUND 1 | E8: 20TH APRIL | J8: WEATHER | M8: WEST WIND DULL | S8: PLAYED AT | CB8: {GOTO}AL3~/M{END}{RIGHT}{END}{DOWN}~P3~
D9: 1ST QTR | H9: 2ND QTR | L9: 3RD QTR | P9: FINAL | S9: OAKLEIGH | CB9: {GOTO}BJ23~/M{RIGHT 7}{END}{DOWN}~V4~
A10: OAKLEIGH | C10: 2 | D10: 4 | E10: =C10*6+D10 -> 16 | G10: 4 | H10: 11 | I10: =G10*6+H10 -> 35 | K10: 5 | L10: 16 | M10: =K10*6+L10 -> 46 | O10: 11 | P10: 20 | Q10: =O10*6+P10 -> 86 | S10: UMPIRE | X10: LADDER | AB10: ROUND | AD10: 1 | CB10: {GOTO}BJ43~/M{RIGHT 7}{END}{DOWN}~G24~
A11: YARRAVILLE | C11: 4 | D11: 6 | E11: =C11*6+D11 -> 30 | G11: 6 | H11: 6 | I11: =G11*6+H11 -> 42 | K11: 9 | L11: 11 | M11: =K11*6+L11 -> 65 | O11: 11 | P11: 14 | Q11: =O11*6+P11 -> 80 | S11: JACKSON | CB11: {GOTO}AL23~/M{END}{RIGHT}{END}{DOWN}~P23~
A12: BEST PLAYERS | W12: TEAM | X12: W | Y12: L | Z12: D | AA12: FOR | AB12: AGST | AC12: % | AD12: PTS | CB12: {GOTO}BJ63~/M{RIGHT 7}{END}{DOWN}~V24~
A13: OAKLEIGH | C13: MORCAM | F13: BEARD | I13: LOGAN | L13: C RITCHIE | O13: LUFF | Q13: EDWARDS | CB13: {GOTO}BJ83~/M{RIGHT 7}{END}{DOWN}~G44~
A14: YARRAVILLE | C14: HENDERSON | F14: MATHESON | I14: ROACH | L14: CASTRIKUM | O14: HEYME | Q14: BARROW | W14: PRAHRAN | X14: 1 | Y14: 0 | Z14: 0 | AA14: 102 | AB14: 57 | AC14: 178.95 | AD14: 4 | CB14: {GOTO}AL43~/M{END}{RIGHT}{END}{DOWN}~P43~
A15: GOALKICKERS | W15: BRUNSWICK | X15: 1 | Y15: 0 | Z15: 0 | AA15: 91 | AB15: 80 | AC15: 113.75 | AD15: 4 | CB15: {GOTO}BJ103~/M{RIGHT 7}{END}{DOWN}~V44~
A16: OAKLEIGH | C16: CUMMINGS 3 | F16: LYON 2 | I16: BEARD 2 | K16: LOGAN | M16: BELL | N16: McCORKELL | Q16: QUINN | W16: PRESTON | X16: 1 | Y16: 0 | Z16: 0 | AA16: 98 | AB16: 87 | AC16: 112.64367816091954 | AD16: 4 | CB16: {GOTO}BJ123~/M{RIGHT 7}{END}{DOWN}~G64~
A17: YARRAVILLE | C17: MATHESON 3 | F17: HEYME 3 | I17: HENDERSON 2 | L17: McLAUGHLIN | O17: BONGETTI | Q17: ROACH | W17: OAKLEIGH | X17: 1 | Y17: 0 | Z17: 0 | AA17: 86 | AB17: 80 | AC17: 107.5 | AD17: 4 | CB17: {GOTO}AL63~/M{END}{RIGHT}{END}{DOWN}~P63~
D18: 21ST APRIL | J18: WEATHER | CB18: {GOTO}BJ143~/M{RIGHT 7}{END}{DOWN}~V64~
A19: PRESTON | C19: 4 | D19: 3 | E19: =C19*6+D19 -> 27 | G19: 9 | H19: 4 | I19: =G19*6+H19 -> 58 | K19: 12 | L19: 4 | M19: =K19*6+L19 -> 76 | O19: 15 | P19: 8 | Q19: =O19*6+P19 -> 98 | S19: BEACH ROAD | W19: PORT MELBOURNE | X19: 0 | Y19: 0 | Z19: 1 | AA19: 57 | AB19: 57 | AC19: 100 | AD19: 2 | CB19: {GOTO}BJ163~/M{RIGHT 7}{END}{DOWN}~G84~
A20: SANDRINGHAM | C20: 5 | D20: 5 | E20: =C20*6+D20 -> 35 | G20: 5 | H20: 9 | I20: =G20*6+H20 -> 39 | K20: 10 | L20: 13 | M20: =K20*6+L20 -> 73 | O20: 12 | P20: 15 | Q20: =O20*6+P20 -> 87 | S20: TOOHEY | W20: DANDENONG | X20: 0 | Y20: 0 | Z20: 1 | AA20: 57 | AB20: 57 | AC20: 100 | AD20: 2 | CB20: {GOTO}AL83~/M{END}{RIGHT}{END}{DOWN}~P83~
A21: BEST PLAYERS | W21: YARRAVILLE | X21: 0 | Y21: 1 | Z21: 0 | AA21: 80 | AB21: 86 | AC21: 93.023255813953483 | AD21: 0 | CB21: {GOTO}BJ183~/M{RIGHT 7}{END}{DOWN}~V84~
A22: PRESTON | C22: DALTON | F22: DELLAMARTA | I22: McLEAN | L22: CHAPMAN | O22: DEAN | Q22: MYERS | W22: SANDRINGHAM | X22: 0 | Y22: 1 | Z22: 0 | AA22: 87 | AB22: 98 | AC22: 88.775510204081627 | AD22: 0 | CB22: {GOTO}BJ203~/M{RIGHT 7}{END}{DOWN}~G104~
A23: SANDRINGHAM | C23: VAUGHAN | F23: HANCE | I23: LATCHAM | L23: HOGAN | O23: EASTOE | Q23: SELLECK | W23: COBURG | X23: 0 | Y23: 1 | Z23: 0 | AA23: 80 | AB23: 91 | AC23: 87.912087912087912 | AD23: 0 | CB23: {GOTO}AL103~/M{END}{RIGHT}{END}{DOWN}~P103~
A24: GOALKICKERS | W24: WAVERLEY | X24: 0 | Y24: 1 | Z24: 0 | AA24: 57 | AB24: 102 | AC24: 55.88 | AD24: 0 | CB24: {GOTO}BJ223~/M{RIGHT 7}{END}{DOWN}~V104~
A25: PRESTON | C25: DELLAMARTA 4 | F25: McARTHUR 3 | I25: DALTON 2 | L25: JOYCE 2 | N25: DEAN 2 | P25: REID | Q25: WADDELL | CB25: {GOTO}BJ243~/M{RIGHT 7}{END}{DOWN}~G124~
A26: SANDRINGHAM | C26: HOGAN 4 | F26: HANCE 2 | I26: WESTON 2 | L26: LATCHAM 2 | O26: BANKS | Q26: J WARD | CB26: {GOTO}AL123~/M{END}{RIGHT}{END}{DOWN}~P123~
CB27: {GOTO}BJ263~/M{RIGHT 7}{END}{DOWN}~V124~
A28: PRAHRAN | C28: 3 | D28: 5 | E28: =C28*6+D28 -> 23 | G28: 9 | H28: 8 | I28: =G28*6+H28 -> 62 | K28: 11 | L28: 9 | M28: =K28*6+L28 -> 75 | O28: 15 | P28: 12 | Q28: =O28*6+P28 -> 102 | S28: TOORAK PARK | CB28: {GOTO}BJ283~/M{RIGHT 7}{END}{DOWN}~G144~
A29: WAVERLEY | C29: 1 | D29: 4 | E29: =C29*6+D29 -> 10 | G29: 1 | H29: 7 | I29: =G29*6+H29 -> 13 | K29: 5 | L29: 15 | M29: =K29*6+L29 -> 45 | O29: 7 | P29: 15 | Q29: =O29*6+P29 -> 57 | S29: CRAIG | CB29: {GOTO}AL143~/M{END}{RIGHT}{END}{DOWN}~P143~
A30: BEST PLAYERS | CB30: {GOTO}BJ303~/M{RIGHT 7}{END}{DOWN}~V144~
A31: PRAHRAN | C31: CULPIN | F31: DICKESON | I31: SKIDMORE | L31: ALBISTON | O31: ROSE | R31: KERLEY | CB31: {GOTO}BJ323~/M{RIGHT 7}{END}{DOWN}~G164~
A32: WAVERLEY | C32: McKENZIE | F32: ROLFE | I32: LAWSON | L32: POORE | O32: McQUEEN | R32: PARKER | CB32: {GOTO}AL163~/M{END}{RIGHT}{END}{DOWN}~P163~
A33: GOALKICKERS | CB33: {GOTO}BJ343~/M{RIGHT 7}{END}{DOWN}~V164~
A34: PRAHRAN | C34: KERLEY 4 | F34: RYAN 3 | H34: BARTLETT 2 | K34: GRANGE 2 | N34: SKIDMORE 2 | Q34: BRADLEY | S34: ALBISTON | CB34: {HOME}
A35: WAVERLEY | C35: LAWSON 3 | F35: ALLAN | H35: POORE | J35: PRYTULA | M35: McQUEEN
A37: BRUNSWICK | C37: 1 | D37: 12 | E37: =C37*6+D37 -> 18 | G37: 5 | H37: 16 | I37: =G37*6+H37 -> 46 | K37: 11 | L37: 19 | M37: =K37*6+L37 -> 85 | O37: 12 | P37: 19 | Q37: =O37*6+P37 -> 91 | S37: COBURG
A38: COBURG | C38: 2 | D38: 1 | E38: =C38*6+D38 -> 13 | G38: 6 | H38: 5 | I38: =G38*6+H38 -> 41 | K38: 7 | L38: 9 | M38: =K38*6+L38 -> 51 | O38: 11 | P38: 14 | Q38: =O38*6+P38 -> 80 | S38: FLANAGAN
A39: BEST PLAYERS
A40: BRUNSWICK | C40: NOONAN | F40: ROBINSON | I40: WILSON | L40: COOK | O40: BURNS | R40: LEYDIN
A41: COBURG | C41: CHALLENGER | F41: TASIC | I41: HIRST | L41: THOMPSON | O41: McNABB | R41: VINCENT
A42: GOALKICKERS
A43: BRUNSWICK | C43: COOK 5 | F43: BURNS | H43: WHELAN | J43: ANDERSON | M43: DUNLOP | O43: SMITH | Q43: McKINNON | S43: OGSTON
A44: COBURG | C44: HIRST 3 | F44: McNABB 2 | I44: THOMPSON | K44: KARP | M44: BROMLEY | O44: FRUSCALZO | R44: VINCENT | T44: SCHULZ
A46: DANDENONG | C46: 4 | D46: 4 | E46: =C46*6+D46 -> 28 | G46: 4 | H46: 6 | I46: =G46*6+H46 -> 30 | K46: 8 | L46: 7 | M46: =K46*6+L46 -> 55 | O46: 8 | P46: 9 | Q46: =O46*6+P46 -> 57 | S46: DANDENONG
A47: PORT MELBOURNE | C47: 1 | D47: 5 | E47: =C47*6+D47 -> 11 | G47: 4 | H47: 10 | I47: =G47*6+H47 -> 34 | K47: 4 | L47: 10 | M47: =K47*6+L47 -> 34 | O47: 7 | P47: 15 | Q47: =O47*6+P47 -> 57 | S47: O'NEILL
A48: BEST PLAYERS
A49: DANDENONG | C49: MITCHELL | F49: WYATT | I49: CROSS | L49: EVANS | N49: OSBORNE | Q49: McDONALD
A50: PORT MELBOURNE | C50: GRIFFITH | F50: CAULFIELD | I50: QUIRK | L50: BAHEN | N50: BROWNHILL | Q50: WILLIAMS
A51: GOALKICKERS
A52: DANDENONG | C52: MILLER 2 | F52: MORROW 2 | I52: CROFT | K52: MELAI | M52: McDONALD | P52: HILL
A53: PORT MELBOURNE | C53: BOOTH 2 | F53: QUIRK | H53: BONNETT | K53: HOWELL | M53: BAHEN | O53: ALLEN
A55: ROUND 2 | E55: 27TH APRIL | J55: WEATHER | M55: N.W.BREEZE WARM | S55: PLAYED AT
D56: 1ST QTR | H56: 2ND QTR | L56: 3RD QTR | P56: FINAL | S56: WAVERLEY
A57: WAVERLEY | C57: 8 | D57: 3 | E57: =C57*6+D57 -> 51 | G57: 11 | H57: 7 | I57: =G57*6+H57 -> 73 | K57: 15 | L57: 10 | M57: =K57*6+L57 -> 100 | O57: 16 | P57: 17 | Q57: =O57*6+P57 -> 113 | S57: UMPIRE | X57: LADDER | AB57: ROUND | AD57: 2
A58: OAKLEIGH | C58: 1 | D58: 0 | E58: =C58*6+D58 -> 6 | G58: 2 | H58: 6 | I58: =G58*6+H58 -> 18 | K58: 5 | L58: 9 | M58: =K58*6+L58 -> 39 | O58: 11 | P58: 12 | Q58: =O58*6+P58 -> 78 | S58: GARLICK
A59: BEST PLAYERS | W59: TEAM | X59: W | Y59: L | Z59: D | AA59: FOR | AB59: AGST | AC59: % | AD59: PTS
A60: WAVERLEY | C60: ROLFE | F60: STEPHENS | I60: LAWSON | L60: BELL | N60: McQUEEN | Q60: POORE
A61: OAKLEIGH | C61: C RITCHIE | F61: TEGG | I61: TRAILL | L61: MORCOM | N61: WAPLING | Q61: CUMMINGS | W61: PRAHRAN | X61: 2 | Y61: 0 | Z61: 0 | AA61: 189 | AB61: 125 | AC61: 151.2 | AD61: 8
A62: GOALKICKERS | W62: PORT MELBOURNE | X62: 1 | Y62: 0 | Z62: 1 | AA62: 162 | AB62: 100 | AC62: 162 | AD62: 6
A63: WAVERLEY | C63: STEPHENS 3 | F63: LAWSON 3 | I63: BELL 3 | K63: FRYER 2 | M63: POORE 2 | O63: G PARKER 2 | R63: B ALLAN | W63: DANDENONG | X63: 1 | Y63: 0 | Z63: 1 | AA63: 158 | AB63: 154 | AC63: 102.59740259740259 | AD63: 6
A64: OAKLEIGH | C64: CUMMINGS 3 | F64: LYON 3 | I64: WAPLING | K64: TEMME | M64: HUGHES | O64: BEARD | Q64: TEGG | W64: SANDRINGHAM | X64: 1 | Y64: 1 | Z64: 0 | AA64: 237 | AB64: 186 | AC64: 127.41935483870968 | AD64: 4
E65: 28TH APRIL | J65: WEATHER
A66: PRAHRAN | C66: 5 | D66: 1 | E66: =C66*6+D66 -> 31 | G66: 6 | H66: 7 | I66: =G66*6+H66 -> 43 | K66: 9 | L66: 10 | M66: =K66*6+L66 -> 64 | O66: 12 | P66: 15 | Q66: =O66*6+P66 -> 87 | S66: BRUNSWICK | W66: PRESTON | X66: 1 | Y66: 1 | Z66: 0 | AA66: 195 | AB66: 188 | AC66: 103.72340425531915 | AD66: 4
A67: BRUNSWICK | C67: 2 | D67: 2 | E67: =C67*6+D67 -> 14 | G67: 3 | H67: 5 | I67: =G67*6+H67 -> 23 | K67: 6 | L67: 6 | M67: =K67*6+L67 -> 42 | O67: 10 | P67: 8 | Q67: =O67*6+P67 -> 68 | S67: PIMBLETT | W67: BRUNSWICK | X67: 1 | Y67: 1 | Z67: 0 | AA67: 159 | AB67: 167 | AC67: 95.209580838323348 | AD67: 4
A68: BEST PLAYERS | W68: WAVERLEY | X68: 1 | Y68: 1 | Z68: 0 | AA68: 170 | AB68: 180 | AC68: 94.44 | AD68: 4
A69: PRAHRAN | C69: RAEBURN | F69: BARTLETT | I69: RYAN | K69: BRADLEY | N69: SKIDMORE | Q69: DICKESON | W69: OAKLEIGH | X69: 1 | Y69: 1 | Z69: 0 | AA69: 164 | AB69: 193 | AC69: 84.974093264248708 | AD69: 4
A70: BRUNSWICK | C70: NOONAN | F70: McKINNON | I70: BURNS | K70: KERWOOD | N70: ROBINSON | Q70: ANDERSON | W70: YARRAVILLE | X70: 0 | Y70: 2 | Z70: 0 | AA70: 168 | AB70: 236 | AC70: 71.186440677966104 | AD70: 0
A71: GOALKICKERS | W71: COBURG | X71: 0 | Y71: 2 | Z71: 0 | AA71: 123 | AB71: 196 | AC71: 62.755102040816325 | AD71: 0
A72: PRAHRAN | C72: RYAN 3 | F72: BARTLETT 3 | I72: KERLEY 3 | K72: ROSE | M72: BRADLEY | O72: MARINKO
A73: BRUNSWICK | C73: COOK 4 | F73: BURNS 2 | I73: WHELAN 2 | L73: ANDERSON | O73: McKINNON
A75: DANDENONG | C75: 3 | D75: 4 | E75: =C75*6+D75 -> 22 | G75: 6 | H75: 6 | I75: =G75*6+H75 -> 42 | K75: 11 | L75: 9 | M75: =K75*6+L75 -> 75 | O75: 15 | P75: 11 | Q75: =O75*6+P75 -> 101 | S75: PRESTON
A76: PRESTON | C76: 3 | D76: 1 | E76: =C76*6+D76 -> 19 | G76: 7 | H76: 3 | I76: =G76*6+H76 -> 45 | K76: 12 | L76: 4 | M76: =K76*6+L76 -> 76 | O76: 15 | P76: 7 | Q76: =O76*6+P76 -> 97 | S76: ALEXANDER
A77: BEST PLAYERS
A78: DANDENONG | C78: MORROW | F78: EVANS | I78: MILLER | L78: OSBORNE | O78: STEDWELL | R78: CROSS
A79: PRESTON | C79: REID | F79: DALTON | I79: HINDMARSH | L79: DELLAMARTA | O79: WALKER | R79: CORBETT
A80: GOALKICKERS
A81: DANDENONG | C81: MILLER 4 | F81: MELAI 3 | I81: ABRAHAM 3 | L81: KENDALL 2 | O81: MORROW | Q81: TOWNSEND | T81: HILL
A82: PRESTON | C82: WALKER 5 | F82: REID 2 | I82: HINDMARSH 2 | L82: DELLAMARTA 2 | P82: DALTON 2 | R82: McBEAN | U82: MYERS
A84: SANDRINGHAM | C84: 5 | D84: 3 | E84: =C84*6+D84 -> 33 | G84: 11 | H84: 6 | I84: =G84*6+H84 -> 72 | K84: 18 | L84: 10 | M84: =K84*6+L84 -> 118 | O84: 23 | P84: 12 | Q84: =O84*6+P84 -> 150 | S84: YARRAVILLE
A85: YARRAVILLE | C85: 3 | D85: 5 | E85: =C85*6+D85 -> 23 | G85: 9 | H85: 6 | I85: =G85*6+H85 -> 60 | K85: 10 | L85: 10 | M85: =K85*6+L85 -> 70 | O85: 12 | P85: 16 | Q85: =O85*6+P85 -> 88 | S85: TURNER
A86: BEST PLAYERS
A87: SANDRINGHAM | C87: PETHERBRIDGE | G87: ROBINSON | J87: J WARD | L87: HANCE | O87: WESTON | R87: VAUGHAN
A88: YARRAVILLE | C88: QUARANTOTTO | G88: CONNELLY | J88: CASTIKUM | L88: ROACH | O88: HEYME | R88: BARROW
A89: GOALKICKERS
A90: SANDRINGHAM | C90: B ZEUSCHNER 5 | F90: WESTON 3 | I90: SELLECK 3 | L90: ROBINSON 3 | O90: HOGAN 3 | Q90: LATCHAM 2 | T90: J WARD | V90: SMITH | X90: HANCE | Z90: CHAPMAN
A91: YARRAVILLE | C91: UBERGANG 3 | F91: CONNELLY 3 | I91: FOGARTY 2 | L91: QURANTOTTO 2 | P91: BONGETTI | R91: ROACH
A93: PORT MELBOURNE | C93: 4 | D93: 4 | E93: =C93*6+D93 -> 28 | G93: 8 | H93: 8 | I93: =G93*6+H93 -> 56 | K93: 10 | L93: 13 | M93: =K93*6+L93 -> 73 | O93: 15 | P93: 15 | Q93: =O93*6+P93 -> 105 | S93: PORT MELBOURNE
A94: COBURG | C94: 1 | D94: 1 | E94: =C94*6+D94 -> 7 | G94: 3 | H94: 3 | I94: =G94*6+H94 -> 21 | K94: 5 | L94: 6 | M94: =K94*6+L94 -> 36 | O94: 6 | P94: 7 | Q94: =O94*6+P94 -> 43 | S94: HOLZER
A95: BEST PLAYERS
A96: PORT MELBOURNE | C96: GRIFFITH | F96: BOOTH | I96: TEAGUE | L96: CAULFIELD | O96: BROWNHILL | R96: BAHEN
A97: COBURG | C97: BOSCHEN | F97: GRAHAM | I97: McNABB | L97: MATHEWS | O97: HUNT | R97: WELSH
A98: GOALKICKERS
A99: PORT MELBOURNE | C99: TEAGUE 3 | F99: BOOTH 3 | I99: EKLUND 2 | K99: COLLINS 2 | N99: BAHEN | P99: HOWELL | R99: QUIRK | T99: KERR | V99: BRICE
A100: COBURG | C100: McNABB 3 | F100: TASIC | H100: SCHULZE | J100: HUNT
A102: ROUND 3 | E102: 4TH MAY | J102: WEATHER | M102: WEST WIND | S102: PLAYED AT
D103: 1ST QTR | H103: 2ND QTR | L103: 3RD QTR | P103: FINAL | S103: OAKLEIGH
A104: DANDENONG | C104: 7 | D104: 6 | E104: =C104*6+D104 -> 48 | G104: 9 | H104: 12 | I104: =G104*6+H104 -> 66 | K104: 13 | L104: 18 | M104: =K104*6+L104 -> 96 | O104: 15 | P104: 20 | Q104: =O104*6+P104 -> 110 | S104: UMPIRE | X104: LADDER | AB104: ROUND | AD104: 3
A105: OAKLEIGH | C105: 2 | D105: 3 | E105: =C105*6+D105 -> 15 | G105: 4 | H105: 5 | I105: =G105*6+H105 -> 29 | K105: 5 | L105: 12 | M105: =K105*6+L105 -> 42 | O105: 6 | P105: 14 | Q105: =O105*6+P105 -> 50 | S105: TOOHEY
A106: BEST PLAYERS | W106: TEAM | X106: W | Y106: L | Z106: D | AA106: FOR | AB106: AGST | AC106: % | AD106: PTS
A107: DANDENONG | C107: STAUNTON | F107: MITCHELL | I107: STEDWELL | L107: MORROW | O107: TOWNSEND | R107: MILLER
A108: OAKLEIGH | C108: JONES | F108: LYON | I108: LUFF | L108: MORCOM | O108: WAPLING | R108: BEARD | W108: PRAHRAN | X108: 3 | Y108: 0 | Z108: 0 | AA108: 311 | AB108: 180 | AC108: 172.78 | AD108: 12
A109: GOALKICKERS | W109: PORT MELBOURNE | X109: 2 | Y109: 0 | Z109: 1 | AA109: 299 | AB109: 221 | AC109: 135.29411764705881 | AD109: 10
A110: DANDENONG | C110: MILLER 7 | F110: MORROW 2 | I110: ABRAHAM 2 | L110: TOWNSEND | O110: MELAI | Q110: SAVVA | S110: HILL | W110: DANDENONG | X110: 2 | Y110: 0 | Z110: 1 | AA110: 268 | AB110: 204 | AC110: 131.37254901960785 | AD110: 10
A111: OAKLEIGH | C111: JONES 3 | F111: TEMME | H111: BEARD | J111: LYON | W111: PRESTON | X111: 2 | Y111: 1 | Z111: 0 | AA111: 279 | AB111: 266 | AC111: 104.88721804511279 | AD111: 8
E112: 5TH MAY | J112: WEATHER | M112: SOUTH WEST WIND
A113: PORT MELBOURNE | C113: 5 | D113: 6 | E113: =C113*6+D113 -> 36 | G113: 9 | H113: 10 | I113: =G113*6+H113 -> 64 | K113: 15 | L113: 14 | M113: =K113*6+L113 -> 104 | O113: 20 | P113: 17 | Q113: =O113*6+P113 -> 137 | S113: BEACH ROAD | W113: SANDRINGHAM | X113: 1 | Y113: 2 | Z113: 0 | AA113: 358 | AB113: 323 | AC113: 110.83591331269349 | AD113: 4
A114: SANDRINGHAM | C114: 5 | D114: 2 | E114: =C114*6+D114 -> 32 | G114: 9 | H114: 6 | I114: =G114*6+H114 -> 60 | K114: 14 | L114: 9 | M114: =K114*6+L114 -> 93 | O114: 18 | P114: 13 | Q114: =O114*6+P114 -> 121 | S114: CRAIG | W114: WAVERLEY | X114: 1 | Y114: 2 | Z114: 0 | AA114: 248 | AB114: 264 | AC114: 93.94 | AD114: 4
A115: BEST PLAYERS | W115: YARRAVILLE | X115: 1 | Y115: 2 | Z115: 0 | AA115: 274 | AB115: 307 | AC115: 89.250814332247558 | AD115: 4
A116: PORT MELBOURNE | C116: BRICE | F116: WILLIAMS | I116: BUCKLEY | L116: COLLINS | O116: CAULFIELD | R116: IRELAND | W116: BRUNSWICK | X116: 1 | Y116: 2 | Z116: 0 | AA116: 230 | AB116: 273 | AC116: 84.249084249084248 | AD116: 4
A117: SANDRINGHAM | C117: HANCE | F117: JOHNSON | I117: HOGAN | L117: ROBINSON | O117: VAUGHAN | R117: SELLECK | W117: OAKLEIGH | X117: 1 | Y117: 2 | Z117: 0 | AA117: 214 | AB117: 303 | AC117: 70.627062706270621 | AD117: 4
A118: GOALKICKERS | O118: BUCKLEY | R118: BONNETT | W118: COBURG | X118: 0 | Y118: 3 | Z118: 0 | AA118: 178 | AB118: 318 | AC118: 55.974842767295598 | AD118: 0
A119: PORT MELBOURNE | C119: BOOTH 3 | E119: HOWELL 3 | H119: TEAGUE 3 | J119: COLLINS 2 | M119: KERR 2 | O119: QUIRK 2 | Q119: BRICE 2 | S119: ROWLANDS
A120: SANDRINGHAM | C120: HOGAN 5 | F120: ROBINSON 5 | I120: J WARD 2 | K120: JOHNSON 2 | N120: ZEUSCHNER 2 | Q120: SELLECK | S120: D WILLS
A122: PRESTON | C122: 3 | D122: 3 | E122: =C122*6+D122 -> 21 | G122: 9 | H122: 7 | I122: =G122*6+H122 -> 61 | K122: 12 | L122: 10 | M122: =K122*6+L122 -> 82 | O122: 12 | P122: 12 | Q122: =O122*6+P122 -> 84 | S122: PRESTON
A123: WAVERLEY | C123: 1 | D123: 2 | E123: =C123*6+D123 -> 8 | G123: 4 | H123: 3 | I123: =G123*6+H123 -> 27 | K123: 8 | L123: 4 | M123: =K123*6+L123 -> 52 | O123: 12 | P123: 6 | Q123: =O123*6+P123 -> 78 | S123: FLANAGAN
A124: BEST PLAYERS
A125: PRESTON | C125: PERRY | F125: REID | I125: HINDMARSH | L125: McARTHUR | O125: DALTON
A126: WAVERLEY | C126: ROLFE | F126: G PARKER | I126: POORE | L126: EBERT | O126: LAWSON
A127: GOALKICKERS
A128: PRESTON | C128: WALKER 3 | F128: REID 2 | H128: DALTON 2 | J128: DELLAMARTA | M128: PERRY | O128: JOYCE | Q128: HINDMARSH | T128: MYERS
A129: WAVERLEY | C129: POORE 3 | F129: G PARKER 2 | I129: LAWSON 2 | L129: EBERT 2 | N129: FRYER | P129: BELL | R129: DOYLE
A131: YARRAVILLE | C131: 1 | D131: 3 | E131: =C131*6+D131 -> 9 | G131: 7 | H131: 9 | I131: =G131*6+H131 -> 51 | K131: 9 | L131: 11 | M131: =K131*6+L131 -> 65 | O131: 15 | P131: 16 | Q131: =O131*6+P131 -> 106 | S131: BRUNSWICK
A132: BRUNSWICK | C132: 4 | D132: 7 | E132: =C132*6+D132 -> 31 | G132: 6 | H132: 7 | I132: =G132*6+H132 -> 43 | K132: 9 | L132: 10 | M132: =K132*6+L132 -> 64 | O132: 10 | P132: 11 | Q132: =O132*6+P132 -> 71 | S132: O'NEILL
A133: BEST PLAYERS
A134: YARRAVILLE | C134: DAVIES | F134: QUARANTOTTO | I134: TAURINS | L134: HEYME | O134: J HENDERSON | R134: CONNELLY
A135: BRUNSWICK | C135: ROBINSON | F135: LEYDIN | I135: KICK | L135: KERWOOD | O135: COOK | R135: WILSON
A136: GOALKICKERS
A137: YARRAVILLE | C137: DAVIES 4 | F137: QUARANTOTTO 3 | J137: CHARLES 2 | M137: J HENDERSON 2 | Q137: FOGARTY 2 | T137: ROACH | V137: CONNELLY
A138: BRUNSWICK | C138: COOK 4 | F138: BRADLEY 2 | I138: BURNS | K138: WILSON | M138: LEYDIN | O138: OGSTON
A140: PRAHRAN | C140: 7 | D140: 4 | E140: =C140*6+D140 -> 46 | G140: 11 | H140: 7 | I140: =G140*6+H140 -> 73 | K140: 12 | L140: 10 | M140: =K140*6+L140 -> 82 | O140: 18 | P140: 14 | Q140: =O140*6+P140 -> 122 | S140: TOORAK PARK
A141: COBURG | C141: 2 | D141: 1 | E141: =C141*6+D141 -> 13 | G141: 4 | H141: 3 | I141: =G141*6+H141 -> 27 | K141: 7 | L141: 5 | M141: =K141*6+L141 -> 47 | O141: 8 | P141: 7 | Q141: =O141*6+P141 -> 55 | S141: JACKSON
A142: BEST PLAYERS
A143: PRAHRAN | C143: WATSON | F143: ROSE | I143: ALBISTON | L143: BARTLETT | O143: RAEBURN | R143: McMAHON
A144: COBURG | C144: THOMPSON | F144: CHALLENGER | I144: KIRKMAN | L144: FIELD | O144: WATSON
A145: GOALKICKERS
A146: PRAHRAN | C146: BRADLEY 4 | F146: BARTLETT 3 | I146: PAYNE 3 | K146: RYAN 2 | M146: ROSE | O146: KERLEY | Q146: GRANGE
A147: COBURG | C147: FIELD 2 | F147: CHALLENGER 2 | J147: LEATHAM 2 | M147: THOMPSON | P147: TWYFORD
A149: ROUND 4 | E149: 11TH MAY | J149: WEATHER | M149: SOUTH WEST WIND AFTER RAIN | S149: PLAYED AT
D150: 1ST QTR | H150: 2ND QTR | L150: 3RD QTR | P150: FINAL | S150: PORT MELBOURNE
A151: PRESTON | C151: 2 | D151: 3 | E151: =C151*6+D151 -> 15 | G151: 4 | H151: 4 | I151: =G151*6+H151 -> 28 | K151: 8 | L151: 7 | M151: =K151*6+L151 -> 55 | O151: 12 | P151: 11 | Q151: =O151*6+P151 -> 83 | S151: UMPIRE | X151: LADDER | AB151: ROUND | AD151: 4
A152: PORT MELBOURNE | C152: 2 | D152: 2 | E152: =C152*6+D152 -> 14 | G152: 6 | H152: 6 | I152: =G152*6+H152 -> 42 | K152: 8 | L152: 7 | M152: =K152*6+L152 -> 55 | O152: 8 | P152: 7 | Q152: =O152*6+P152 -> 55 | S152: PIMBLETT
A153: BEST PLAYERS | W153: TEAM | X153: W | Y153: L | Z153: D | AA153: FOR | AB153: AGST | AC153: % | AD153: PTS
A154: PRESTON | C154: DALTON | F154: REID | I154: JOYCE | K154: G PERRY | N154: WARD | Q154: McLEAN
A155: PORT MELBOURNE | C155: CAULFIELD | F155: GROVER | I155: BAHEN | K155: WILLIAMS | N155: BROWNHILL | Q155: TEAGUE | W155: PRAHRAN | X155: 4 | Y155: 0 | Z155: 0 | AA155: 421 | AB155: 248 | AC155: 169.76 | AD155: 16
A156: GOALKICKERS | W156: PRESTON | X156: 3 | Y156: 1 | Z156: 0 | AA156: 362 | AB156: 321 | AC156: 112.77258566978193 | AD156: 12
A157: PRESTON | C157: JOYCE 4 | E157: DALTON 2 | H157: MURNANE | J157: REID | L157: CORBETT | N157: GOAD | P157: G PERRY | R157: HINDMARSH | W157: PORT MELBOURNE | X157: 2 | Y157: 1 | Z157: 1 | AA157: 354 | AB157: 304 | AC157: 116.44736842105263 | AD157: 10
A158: PORT MELBOURNE | C158: TEAGUE 2 | F158: BRICE 2 | H158: COLLINS | J158: BEATTIE | M158: HOWELL | O158: BAHEN | W158: DANDENONG | X158: 2 | Y158: 1 | Z158: 1 | AA158: 348 | AB158: 325 | AC158: 107.07692307692308 | AD158: 10
A160: SANDRINGHAM | C160: 4 | D160: 3 | E160: =C160*6+D160 -> 27 | G160: 7 | H160: 7 | I160: =G160*6+H160 -> 49 | K160: 8 | L160: 8 | M160: =K160*6+L160 -> 56 | O160: 18 | P160: 13 | Q160: =O160*6+P160 -> 121 | S160: DANDENONG | W160: SANDRINGHAM | X160: 2 | Y160: 2 | Z160: 0 | AA160: 479 | AB160: 403 | AC160: 118.85856079404466 | AD160: 8
A161: DANDENONG | C161: 0 | D161: 2 | E161: =C161*6+D161 -> 2 | G161: 6 | H161: 3 | I161: =G161*6+H161 -> 39 | K161: 10 | L161: 8 | M161: =K161*6+L161 -> 68 | O161: 12 | P161: 8 | Q161: =O161*6+P161 -> 80 | S161: HOLZER | W161: WAVERLEY | X161: 2 | Y161: 2 | Z161: 0 | AA161: 328 | AB161: 338 | AC161: 97.04 | AD161: 8
A162: BEST PLAYERS | W162: OAKLEIGH | X162: 2 | Y162: 2 | Z162: 0 | AA162: 316 | AB162: 399 | AC162: 79.197994987468675 | AD162: 8
A163: SANDRINGHAM | C163: SHARROCK | F163: ROBINSON | I163: PETHERBRIDGE | L163: HAMMOND | O163: VAUGHAN | R163: HANCE | W163: BRUNSWICK | X163: 1 | Y163: 3 | Z163: 0 | AA163: 304 | AB163: 353 | AC163: 86.118980169971678 | AD163: 4
A164: DANDENONG | C164: LIENERT | F164: ABRAHAM | I164: STEDWELL | L164: MORROW | O164: WYATT | R164: EVANS | W164: YARRAVILLE | X164: 1 | Y164: 3 | Z164: 0 | AA164: 342 | AB164: 417 | AC164: 82.014388489208628 | AD164: 4
A165: GOALKICKERS | W165: COBURG | X165: 0 | Y165: 4 | Z165: 0 | AA165: 274 | AB165: 420 | AC165: 65.238095238095241 | AD165: 0
A166: SANDRINGHAM | C166: ROBINSON 5 | F166: SHARROCK 5 | I166: HOGAN 2 | K166: J WARD 2 | M166: HAMMOND | P166: LATCHAM | R166: JOHNSON | U166: D WILLS
A167: DANDENONG | C167: MILLER 4 | F167: MELAI 2 | I167: ABRAHAM 2 | L167: McDONALD 2 | O167: TOWNSEND | R167: EVANS
A169: WAVERLEY | C169: 3 | D169: 3 | E169: =C169*6+D169 -> 21 | G169: 6 | H169: 10 | I169: =G169*6+H169 -> 46 | K169: 8 | L169: 10 | M169: =K169*6+L169 -> 58 | O169: 11 | P169: 14 | Q169: =O169*6+P169 -> 80 | S169: WAVERLEY
A170: BRUNSWICK | C170: 3 | D170: 4 | E170: =C170*6+D170 -> 22 | G170: 3 | H170: 6 | I170: =G170*6+H170 -> 24 | K170: 7 | L170: 12 | M170: =K170*6+L170 -> 54 | O170: 10 | P170: 14 | Q170: =O170*6+P170 -> 74 | S170: TURNER
A171: BEST PLAYERS
A172: WAVERLEY | C172: WARNER | F172: DOYLE | I172: POORE | L172: MORDEN | O172: McQUEEN | R172: ROLFE
A173: BRUNSWICK | C173: WHELAN | F173: WILSON | I173: McGRATH | L173: KERWOOD | O173: COOK | R173: BURNS
A174: GOALKICKERS
A175: WAVERLEY | C175: WARNER 4 | F175: POORE 3 | I175: O'DONNELL 2 | L175: G PARKER | O175: ALLAN
A176: BRUNSWICK | C176: COOK 5 | F176: WHELAN | H176: LEYDIN | J176: PENDLEBURY | M176: GREIG | O176: CAPUANO
A178: OAKLEIGH | C178: 2 | D178: 4 | E178: =C178*6+D178 -> 16 | G178: 11 | H178: 7 | I178: =G178*6+H178 -> 73 | K178: 13 | L178: 10 | M178: =K178*6+L178 -> 88 | O178: 15 | P178: 12 | Q178: =O178*6+P178 -> 102 | S178: COBURG
A179: COBURG | C179: 3 | D179: 7 | E179: =C179*6+D179 -> 25 | G179: 5 | H179: 8 | I179: =G179*6+H179 -> 38 | K179: 9 | L179: 13 | M179: =K179*6+L179 -> 67 | O179: 13 | P179: 18 | Q179: =O179*6+P179 -> 96 | S179: ANDERSON
A180: BEST PLAYERS
A181: OAKLEIGH | C181: JORDAN | F181: TRAILL | I181: McGUINNESS | L181: CUMMINGS | O181: WEARNE | R181: JONES
A182: COBURG | C182: LEATHAM | F182: FIELD | I182: McLACHLAN | L182: TWYFORD | O182: TASIC | R182: McNABB
A183: GOALKICKERS
A184: OAKLEIGH | C184: McGUINNESS 4 | F184: TEMME 3 | I184: CUMMINGS 3 | L184: JONES 2 | N184: JORDAN 2 | Q184: BEARD
A185: COBURG | C185: LEATHAM 4 | F185: TWYFORD 3 | I185: FIELD 2 | K185: GRAHAM 2 | N185: JESS | P185: HARRISON
A187: PRAHRAN | C187: 5 | D187: 4 | E187: =C187*6+D187 -> 34 | G187: 10 | H187: 7 | I187: =G187*6+H187 -> 67 | K187: 12 | L187: 7 | M187: =K187*6+L187 -> 79 | O187: 17 | P187: 8 | Q187: =O187*6+P187 -> 110 | S187: YARRAVILLE
A188: YARRAVILLE | C188: 4 | D188: 1 | E188: =C188*6+D188 -> 25 | G188: 4 | H188: 5 | I188: =G188*6+H188 -> 29 | K188: 6 | L188: 11 | M188: =K188*6+L188 -> 47 | O188: 9 | P188: 14 | Q188: =O188*6+P188 -> 68 | S188: ALEXANDER
A189: BEST PLAYERS
A190: PRAHRAN | C190: WATSON | F190: BRADLEY | I190: GRANGE | L190: PAYNE | O190: RYAN | R190: BARTLETT
A191: YARRAVILLE | C191: HEYME | F191: DAVIES | I191: CHARLES | L191: QUARANTOTTO | O191: J HENDERSON | R191: CONNELLY
A192: GOALKICKERS
A193: PRAHRAN | C193: BRADLEY 6 | F193: RYAN 3 | I193: PAYNE 3 | K193: GRANGE 2 | M193: BARTLETT | O193: SKIDMORE | Q193: GLOVER
A194: YARRAVILLE | C194: SMITH 2 | F194: B DOWLING 2 | I194: CHARLES 2 | L194: DAVIES | N194: QUARANTOTTO | R194: J HENDERSON
A196: ROUND 5 | E196: 18TH MAY | J196: WEATHER | M196: W .WIND AFTER RAIN | S196: PLAYED AT
D197: 1ST QTR | H197: 2ND QTR | L197: 3RD QTR | P197: FINAL | S197: OAKLEIGH
A198: PRAHRAN | C198: 5 | D198: 2 | E198: =C198*6+D198 -> 32 | G198: 6 | H198: 3 | I198: =G198*6+H198 -> 39 | K198: 8 | L198: 6 | M198: =K198*6+L198 -> 54 | O198: 10 | P198: 6 | Q198: =O198*6+P198 -> 66 | S198: UMPIRE | X198: LADDER | AB198: ROUND | AD198: 5
A199: OAKLEIGH | C199: 1 | D199: 1 | E199: =C199*6+D199 -> 7 | G199: 3 | H199: 2 | I199: =G199*6+H199 -> 20 | K199: 3 | L199: 2 | M199: =K199*6+L199 -> 20 | O199: 5 | P199: 5 | Q199: =O199*6+P199 -> 35 | S199: FLANAGAN
A200: BEST PLAYERS | W200: TEAM | X200: W | Y200: L | Z200: D | AA200: FOR | AB200: AGST | AC200: % | AD200: PTS
A201: PRAHRAN | C201: SKIDMORE | F201: RYAN | I201: CULPIN | K201: RAEBURN | N201: PAYNE | Q201: BARTLETT
A202: OAKLEIGH | C202: JONES | F202: THOMAS | I202: LUFF | K202: MORCAM | N202: McGUINNESS | Q202: JORDAN | W202: PRAHRAN | X202: 5 | Y202: 0 | Z202: 0 | AA202: 487 | AB202: 283 | AC202: 172.08 | AD202: 20
A203: GOALKICKERS | W203: PRESTON | X203: 4 | Y203: 1 | Z203: 0 | AA203: 464 | AB203: 420 | AC203: 110.47619047619048 | AD203: 16
A204: PRAHRAN | C204: RYAN 3 | E204: SKIDMORE 2 | H204: McMAHON | J204: BRADLEY | M204: GRANGE | O204: MARINKO | Q204: ORR | W204: PORT MELBOURNE | X204: 3 | Y204: 1 | Z204: 1 | AA204: 445 | AB204: 392 | AC204: 113.5204081632653 | AD204: 14
A205: OAKLEIGH | C205: JONES 2 | F205: CUMMINGS 2 | I205: JORDAN | W205: SANDRINGHAM | X205: 3 | Y205: 2 | Z205: 0 | AA205: 577 | AB205: 425 | AC205: 135.76470588235293 | AD205: 12
E206: 19TH MAY | J206: WEATHER | M206: WEST WIND RAIN
A207: WAVERLEY | C207: 1 | D207: 2 | E207: =C207*6+D207 -> 8 | G207: 3 | H207: 4 | I207: =G207*6+H207 -> 22 | K207: 6 | L207: 5 | M207: =K207*6+L207 -> 41 | O207: 10 | P207: 9 | Q207: =O207*6+P207 -> 69 | S207: WAVERLEY | W207: WAVERLEY | X207: 3 | Y207: 2 | Z207: 0 | AA207: 397 | AB207: 389 | AC207: 102.06 | AD207: 12
A208: DANDENONG | C208: 2 | D208: 1 | E208: =C208*6+D208 -> 13 | G208: 3 | H208: 4 | I208: =G208*6+H208 -> 22 | K208: 5 | L208: 6 | M208: =K208*6+L208 -> 36 | O208: 7 | P208: 9 | Q208: =O208*6+P208 -> 51 | S208: CRAIG | W208: DANDENONG | X208: 2 | Y208: 2 | Z208: 1 | AA208: 399 | AB208: 394 | AC208: 101.26903553299492 | AD208: 10
A209: BEST PLAYERS | W209: OAKLEIGH | X209: 2 | Y209: 3 | Z209: 0 | AA209: 351 | AB209: 465 | AC209: 75.483870967741936 | AD209: 8
A210: WAVERLEY | C210: LAWSON | F210: MORDEN | I210: ROLFE | L210: REEVES | O210: McNAMEE | R210: B PARKER | W210: BRUNSWICK | X210: 1 | Y210: 4 | Z210: 0 | AA210: 403 | AB210: 455 | AC210: 88.571428571428569 | AD210: 4
A211: DANDENONG | C211: STAUNTON | F211: MITCHELL | I211: WYATT | L211: McNAMARA | O211: MILLER | R211: EVANS | W211: YARRAVILLE | X211: 1 | Y211: 4 | Z211: 0 | AA211: 430 | AB211: 508 | AC211: 84.645669291338578 | AD211: 4
A212: GOALKICKERS | W212: COBURG | X212: 0 | Y212: 5 | Z212: 0 | AA212: 296 | AB212: 518 | AC212: 57.142857142857146 | AD212: 0
A213: WAVERLEY | C213: REEVES 4 | F213: WARNER 2 | I213: G PARKER | K213: STEPHENS | M213: LAWSON | O213: PROBYN
A214: DANDENONG | C214: MILLER 3 | F214: SAVVA 2 | I214: MITCHELL | K214: MELAI
A216: SANDRINGHAM | C216: 2 | D216: 3 | E216: =C216*6+D216 -> 15 | G216: 10 | H216: 10 | I216: =G216*6+H216 -> 70 | K216: 12 | L216: 17 | M216: =K216*6+L216 -> 89 | O216: 13 | P216: 20 | Q216: =O216*6+P216 -> 98 | S216: BEACH ROAD
A217: COBURG | C217: 0 | D217: 1 | E217: =C217*6+D217 -> 1 | G217: 0 | H217: 1 | I217: =G217*6+H217 -> 1 | K217: 1 | L217: 3 | M217: =K217*6+L217 -> 9 | O217: 3 | P217: 4 | Q217: =O217*6+P217 -> 22 | S217: O'NEILL
A218: BEST PLAYERS
A219: SANDRINGHAM | C219: VAUGHAN | F219: JOHNSON | I219: ROBINSON | L219: ZEUSCHNER | O219: FENTON | R219: WILLIAMS
A220: COBURG | C220: CHALLENGER | F220: VINCENT | I220: BOSCHEN | L220: McLACHLAN | O220: THOMPSON | R220: McNABB
A221: GOALKICKERS
A222: SANDRINGHAM | C222: ROBINSON 6 | F222: D WILLS 2 | I222: HAMMOND | L222: J WARD | N222: SHARROCK | Q222: FENTON | S222: WILLIAMS
A223: COBURG | C223: BOSCHEN | F223: VINCENT | I223: McLACHLAN
A225: PRESTON | C225: 9 | D225: 5 | E225: =C225*6+D225 -> 59 | G225: 11 | H225: 6 | I225: =G225*6+H225 -> 72 | K225: 14 | L225: 10 | M225: =K225*6+L225 -> 94 | O225: 15 | P225: 12 | Q225: =O225*6+P225 -> 102 | S225: BRUNSWICK
A226: BRUNSWICK | C226: 5 | D226: 2 | E226: =C226*6+D226 -> 32 | G226: 8 | H226: 7 | I226: =G226*6+H226 -> 55 | K226: 8 | L226: 11 | M226: =K226*6+L226 -> 59 | O226: 14 | P226: 15 | Q226: =O226*6+P226 -> 99 | S226: DIXON
A227: BEST PLAYERS
A228: PRESTON | C228: REID | F228: TELFORD | I228: GOAD | L228: G PERRY | O228: CORBETT | R228: DALTON
A229: BRUNSWICK | C229: NOONAN | F229: ROBINSON | I229: WILSON | L229: GREIG | O229: McKINNON | R229: LEYDIN
A230: GOALKICKERS
A231: PRESTON | C231: HINDMARSH 5 | F231: REID 4 | H231: MYERS 2 | K231: JOYCE | M231: DALTON | O231: JOHNSTON | Q231: GOAD
A232: BRUNSWICK | C232: LEYDIN 3 | F232: COOK 2 | H232: NOONAN 2 | K232: SMITH 2 | M232: PENDLEBURY | P232: ROBINS | R232: WILSON | T232: GREIG | V232: McKINNON
A234: PORT MELBOURNE | C234: 4 | D234: 5 | E234: =C234*6+D234 -> 29 | G234: 6 | H234: 7 | I234: =G234*6+H234 -> 43 | K234: 12 | L234: 9 | M234: =K234*6+L234 -> 81 | O234: 13 | P234: 13 | Q234: =O234*6+P234 -> 91 | S234: YARRAVILLE
A235: YARRAVILLE | C235: 2 | D235: 1 | E235: =C235*6+D235 -> 13 | G235: 5 | H235: 8 | I235: =G235*6+H235 -> 38 | K235: 7 | L235: 11 | M235: =K235*6+L235 -> 53 | O235: 12 | P235: 16 | Q235: =O235*6+P235 -> 88 | S235: TOOHEY
A236: BEST PLAYERS
A237: PORT MELBOURNE | C237: WILLIAMS | F237: BOOTH | I237: BAHEN | L237: GRIFFITH | O237: BONNETT | R237: COLLINS
A238: YARRAVILLE | C238: QUARANTOTTO | F238: HEYME | I238: DAVIES | L238: BARROW | O238: L DOWLING | R238: B DOWLING
A239: GOALKICKERS
A240: PORT MELBOURNE | C240: BAHEN 3 | F240: KERR 3 | I240: COLLINS 2 | L240: BOOTH 2 | O240: CAULFIELD | R240: TEAGUE | T240: BRICE
A241: YARRAVILLE | C241: BARROW 2 | F241: KEMP 2 | I241: DAVIES 2 | L241: McBEAN 2 | O241: HENDERSON | R241: ROWE | T241: B DOWLING | W241: WARWICK
A243: ROUND 6 | E243: 25TH MAY | J243: WEATHER | M243: N.W.WIND RAIN LAST QTR | S243: PLAYED AT
D244: 1ST QTR | H244: 2ND QTR | L244: 3RD QTR | P244: FINAL | S244: OAKLEIGH
A245: BRUNSWICK | C245: 3 | D245: 4 | E245: =C245*6+D245 -> 22 | G245: 6 | H245: 5 | I245: =G245*6+H245 -> 41 | K245: 7 | L245: 6 | M245: =K245*6+L245 -> 48 | O245: 9 | P245: 9 | Q245: =O245*6+P245 -> 63 | S245: UMPIRE | X245: LADDER | AB245: ROUND | AD245: 6
A246: OAKLEIGH | C246: 2 | D246: 1 | E246: =C246*6+D246 -> 13 | G246: 3 | H246: 4 | I246: =G246*6+H246 -> 22 | K246: 4 | L246: 10 | M246: =K246*6+L246 -> 34 | O246: 8 | P246: 13 | Q246: =O246*6+P246 -> 61 | S246: ALEXANDER
A247: BEST PLAYERS | W247: TEAM | X247: W | Y247: L | Z247: D | AA247: FOR | AB247: AGST | AC247: % | AD247: PTS
A248: BRUNSWICK | C248: ROBINS | F248: LEYDIN | I248: BONSACK | L248: McGRATH | O248: PENDLEBURY | R248: WILSON
A249: OAKLEIGH | C249: WAPLING | F249: JORDAN | I249: LUFF | L249: C RITCHIE | O249: O'BRIEN | R249: THOMAS | W249: PRAHRAN | X249: 5 | Y249: 1 | Z249: 0 | AA249: 577 | AB249: 376 | AC249: 153.46 | AD249: 20
A250: GOALKICKERS | W250: PRESTON | X250: 5 | Y250: 1 | Z250: 0 | AA250: 569 | AB250: 499 | AC250: 114.02805611222445 | AD250: 20
A251: BRUNSWICK | C251: COOK 5 | F251: BONSACK | I251: LEYDIN | K251: PENDLEBURY | N251: BRADLEY | W251: PORT MELBOURNE | X251: 4 | Y251: 1 | Z251: 1 | AA251: 542 | AB251: 458 | AC251: 118.34061135371179 | AD251: 18
A252: OAKLEIGH | C252: CUMMINGS 4 | F252: WAPLING | I252: JONES | K252: WEARNE | N252: JORDAN | W252: SANDRINGHAM | X252: 4 | Y252: 2 | Z252: 0 | AA252: 670 | AB252: 515 | AC252: 130.09708737864077 | AD252: 16
E253: 26TH MAY | I253: WEATHER | L253: DULL COLD
A254: SANDRINGHAM | C254: 3 | D254: 2 | E254: =C254*6+D254 -> 20 | G254: 5 | H254: 5 | I254: =G254*6+H254 -> 35 | K254: 9 | L254: 6 | M254: =K254*6+L254 -> 60 | O254: 14 | P254: 9 | Q254: =O254*6+P254 -> 93 | S254: TOORAK PARK | W254: DANDENONG | X254: 3 | Y254: 2 | Z254: 1 | AA254: 506 | AB254: 443 | AC254: 114.22121896162528 | AD254: 14
A255: PRAHRAN | C255: 3 | D255: 2 | E255: =C255*6+D255 -> 20 | G255: 7 | H255: 6 | I255: =G255*6+H255 -> 48 | K255: 12 | L255: 7 | M255: =K255*6+L255 -> 79 | O255: 13 | P255: 12 | Q255: =O255*6+P255 -> 90 | S255: DIXON | W255: WAVERLEY | X255: 3 | Y255: 3 | Z255: 0 | AA255: 463 | AB255: 486 | AC255: 95.27 | AD255: 12
A256: BEST PLAYERS | W256: BRUNSWICK | X256: 2 | Y256: 4 | Z256: 0 | AA256: 466 | AB256: 516 | AC256: 90.310077519379846 | AD256: 8
A257: SANDRINGHAM | C257: JOHNSON | F257: HAMMOND | I257: B WARD | L257: SHARROCK | O257: WILLIAMS | R257: D WILLS | W257: OAKLEIGH | X257: 2 | Y257: 4 | Z257: 0 | AA257: 412 | AB257: 528 | AC257: 78.030303030303031 | AD257: 8
A258: PRAHRAN | C258: WATSON | F258: PAYNE | I258: KRAMER | L258: BARTLETT | O258: HUTCHESSON | R258: CULPIN | W258: YARRAVILLE | X258: 1 | Y258: 5 | Z258: 0 | AA258: 509 | AB258: 613 | AC258: 83.034257748776511 | AD258: 4
A259: GOALKICKERS | S259: LOVETT | W259: COBURG | X259: 0 | Y259: 6 | Z259: 0 | AA259: 345 | AB259: 625 | AC259: 55.2 | AD259: 0
A260: SANDRINGHAM | C260: ROBINSON 3 | F260: FENTON 3 | I260: LATCHAM 2 | L260: J WARD | N260: JOHNSON | P260: WILLIAMS | R260: K WILLS | T260: D WILLS
A261: PRAHRAN | C261: PAYNE 4 | F261: RYAN 2 | H261: GRANGE 2 | J261: CAFFYN | L261: CAVEY | N261: MARINKO | Q261: HUTCHESSON | T261: SKIDMORE
A263: PORT MELBOURNE | C263: 1 | D263: 3 | E263: =C263*6+D263 -> 9 | G263: 7 | H263: 6 | I263: =G263*6+H263 -> 48 | K263: 12 | L263: 7 | M263: =K263*6+L263 -> 79 | O263: 14 | P263: 13 | Q263: =O263*6+P263 -> 97 | S263: PORT MELBOURNE
A264: WAVERLEY | C264: 3 | D264: 5 | E264: =C264*6+D264 -> 23 | G264: 5 | H264: 6 | I264: =G264*6+H264 -> 36 | K264: 6 | L264: 8 | M264: =K264*6+L264 -> 44 | O264: 9 | P264: 12 | Q264: =O264*6+P264 -> 66 | S264: ANDERSON
A265: BEST PLAYERS
A266: PORT MELBOURNE | C266: BONNETT | F266: GOSS | I266: McKEW | L266: SCHMIDT | O266: WILLIAMS | R266: ALLEN
A267: WAVERLEY | C267: B PARKER | F267: G PARKER | I267: McNAMEE | L267: PROBYN | O267: WARNER | R267: DOYLE
A268: GOALKICKERS
A269: PORT MELBOURNE | C269: ALLEN 4 | F269: BRICE 2 | I269: BAHEN 2 | K269: McKEW 2 | M269: GOSS | O269: TEAGUE | Q269: KERR | S269: COLLINS
A270: WAVERLEY | C270: EBERT 3 | F270: ALLAN 2 | I270: WARNER 2 | L270: STEPHENS | O270: McKENZIE
A272: DANDENONG | C272: 4 | D272: 2 | E272: =C272*6+D272 -> 26 | G272: 7 | H272: 2 | I272: =G272*6+H272 -> 44 | K272: 14 | L272: 11 | M272: =K272*6+L272 -> 95 | O272: 16 | P272: 11 | Q272: =O272*6+P272 -> 107 | S272: DANDENONG
A273: COBURG | C273: 2 | D273: 1 | E273: =C273*6+D273 -> 13 | G273: 5 | H273: 5 | I273: =G273*6+H273 -> 35 | K273: 6 | L273: 5 | M273: =K273*6+L273 -> 41 | O273: 7 | P273: 7 | Q273: =O273*6+P273 -> 49 | S273: TURNER
A274: BEST PLAYERS
A275: DANDENONG | C275: KENDALL | F275: MITCHELL | I275: MELAI | L275: BETHKE | O275: STEDWELL | R275: MORROW
A276: COBURG | C276: KIRKMAN | F276: JACKSON | I276: HUNT | L276: THOMPSON | O276: McNABB | R276: VINCENT
A277: GOALKICKERS
A278: DANDENONG | C278: BETHKE 6 | F278: MELAI 3 | I278: MILLER 2 | K278: FLAHERTY 2 | N278: MITCHELL 2 | Q278: MORROW
A279: COBURG | C279: THOMPSON 3 | F279: JACKSON 3 | I279: VINCENT
A281: PRESTON | C281: 3 | D281: 4 | E281: =C281*6+D281 -> 22 | G281: 6 | H281: 6 | I281: =G281*6+H281 -> 42 | K281: 12 | L281: 8 | M281: =K281*6+L281 -> 80 | O281: 15 | P281: 15 | Q281: =O281*6+P281 -> 105 | S281: PRESTON
A282: YARRAVILLE | C282: 5 | D282: 3 | E282: =C282*6+D282 -> 33 | G282: 7 | H282: 10 | I282: =G282*6+H282 -> 52 | K282: 9 | L282: 12 | M282: =K282*6+L282 -> 66 | O282: 11 | P282: 13 | Q282: =O282*6+P282 -> 79 | S282: HOLZER
A283: BEST PLAYERS
A284: PRESTON | C284: McLEAN | F284: REID | I284: TELFORD | L284: WARD | O284: DELLAMARTA | R284: CORBETT
A285: YARRAVILLE | C285: L DOWLING | F285: B DOWLING | I285: TAURINS | L285: J HENDERSON | O285: WARWICK | R285: GROSE
A286: GOALKICKERS
A287: PRESTON | C287: DELLAMARTA 3 | F287: HINDMARSH 3 | I287: JOYCE 2 | K287: McARTHUR 2 | N287: JOHNSTONE 2 | Q287: WADDELL | S287: MYERS | U287: REID
A288: YARRAVILLE | C288: ROWE 3 | F288: B DOWLING 3 | I288: KEMP 3 | K288: MARTIN 2
A290: ROUND 7 | D290: 1ST JUNE | I290: WEATHER | L290: STRONG N.W.WIND RAIN AFTER 1/2 TIME | S290: PLAYED AT
D291: 1ST QTR | H291: 2ND QTR | L291: 3RD QTR | P291: FINAL | S291: WAVERLEY
A292: WAVERLEY | C292: 1 | D292: 1 | E292: =C292*6+D292 -> 7 | G292: 6 | H292: 5 | I292: =G292*6+H292 -> 41 | K292: 6 | L292: 7 | M292: =K292*6+L292 -> 43 | O292: 10 | P292: 14 | Q292: =O292*6+P292 -> 74 | S292: UMPIRE | X292: LADDER | AB292: ROUND | AD292: 7
A293: YARRAVILLE | C293: 3 | D293: 5 | E293: =C293*6+D293 -> 23 | G293: 5 | H293: 7 | I293: =G293*6+H293 -> 37 | K293: 7 | L293: 12 | M293: =K293*6+L293 -> 54 | O293: 8 | P293: 12 | Q293: =O293*6+P293 -> 60 | S293: JACKSON
A294: BEST PLAYERS | W294: TEAM | X294: W | Y294: L | Z294: D | AA294: FOR | AB294: AGST | AC294: % | AD294: PTS
A295: WAVERLEY | C295: LAWSON | F295: LANG | I295: PROBYN | L295: POORE | N295: B PARKER | Q295: WARNER
A296: YARRAVILLE | C296: CHARLES | F296: KEMP | I296: J HENDERSON | L296: DAVIES | N296: QUARANTOTTO | Q296: ROWE | W296: PRESTON | X296: 6 | Y296: 1 | Z296: 0 | AA296: 640 | AB296: 562 | AC296: 113.87900355871886 | AD296: 24
A297: GOALKICKERS | W297: PRAHRAN | X297: 5 | Y297: 2 | Z297: 0 | AA297: 636 | AB297: 454 | AC297: 140.09 | AD297: 20
A298: WAVERLEY | C298: WARNER 4 | F298: G PARKER 2 | I298: STEPHENS | K298: LAWSON | M298: PROBYN | O298: GRANT | W298: SANDRINGHAM | X298: 5 | Y298: 2 | Z298: 0 | AA298: 769 | AB298: 554 | AC298: 138.80866425992781 | AD298: 20
A299: YARRAVILLE | C299: KEMP 3 | F299: QUARANTOTTO 2 | J299: UBERGANG | M299: DAVIES | O299: BONGETTI | W299: DANDENONG | X299: 4 | Y299: 2 | Z299: 1 | AA299: 584 | AB299: 502 | AC299: 116.33466135458167 | AD299: 18
D300: 2ND JUNE | G300: WEATHER | K300: RAIN
A301: DANDENONG | C301: 3 | D301: 7 | E301: =C301*6+D301 -> 25 | G301: 3 | H301: 9 | I301: =G301*6+H301 -> 27 | K301: 4 | L301: 12 | M301: =K301*6+L301 -> 36 | O301: 10 | P301: 18 | Q301: =O301*6+P301 -> 78 | S301: TOORAK PARK | W301: PORT MELBOURNE | X301: 4 | Y301: 2 | Z301: 1 | AA301: 616 | AB301: 553 | AC301: 111.39240506329114 | AD301: 18
A302: PRAHRAN | C302: 1 | D302: 3 | E302: =C302*6+D302 -> 9 | G302: 3 | H302: 7 | I302: =G302*6+H302 -> 25 | K302: 7 | L302: 10 | M302: =K302*6+L302 -> 52 | O302: 8 | P302: 11 | Q302: =O302*6+P302 -> 59 | S302: O'NEILL | W302: WAVERLEY | X302: 4 | Y302: 3 | Z302: 0 | AA302: 537 | AB302: 546 | AC302: 98.35 | AD302: 16
A303: BEST PLAYERS | W303: BRUNSWICK | X303: 3 | Y303: 4 | Z303: 0 | AA303: 561 | AB303: 590 | AC303: 95.084745762711862 | AD303: 12
A304: DANDENONG | C304: EVANS | F304: ANDREWS | I304: MILLER | L304: OSBORNE | O304: ABRAHAM | R304: FLAHERTY | W304: OAKLEIGH | X304: 2 | Y304: 5 | Z304: 0 | AA304: 451 | AB304: 627 | AC304: 71.929824561403507 | AD304: 8
A305: PRAHRAN | C305: McMAHON | F305: BARTLETT | I305: RAEBURN | L305: WATSON | O305: JUNGWIRTH | R305: RYAN | W305: YARRAVILLE | X305: 1 | Y305: 6 | Z305: 0 | AA305: 569 | AB305: 687 | AC305: 82.823871906841333 | AD305: 4
A306: GOALKICKERS | W306: COBURG | X306: 0 | Y306: 7 | Z306: 0 | AA306: 408 | AB306: 696 | AC306: 58.620689655172413 | AD306: 0
A307: DANDENONG | C307: ANDREWS 3 | F307: FLAHERTY 3 | I307: MILLER 2 | K307: OSBORNE | M307: MELAI
A308: PRAHRAN | C308: BARTLETT 2 | F308: RYAN 2 | I308: PAYNE 2 | K308: JUNGWIRTH | N308: BRADLEY
A310: BRUNSWICK | C310: 4 | D310: 2 | E310: =C310*6+D310 -> 26 | G310: 9 | H310: 2 | I310: =G310*6+H310 -> 56 | K310: 13 | L310: 4 | M310: =K310*6+L310 -> 82 | O310: 15 | P310: 5 | Q310: =O310*6+P310 -> 95 | S310: BRUNSWICK
A311: PORT MELBOURNE | C311: 2 | D311: 4 | E311: =C311*6+D311 -> 16 | G311: 7 | H311: 7 | I311: =G311*6+H311 -> 49 | K311: 8 | L311: 7 | M311: =K311*6+L311 -> 55 | O311: 11 | P311: 8 | Q311: =O311*6+P311 -> 74 | S311: FLANAGAN
A312: BEST PLAYERS
A313: BRUNSWICK | C313: COOK | E313: ROBINS | H313: LEYDIN | J313: BRADLEY | M313: PENDLEBURY | Q313: McGHIE
A314: PORT MELBOURNE | C314: GRIFFITH | E314: TEAGUE | H314: ALLEN | J314: PECK | M314: BAHEN | Q314: WILLIAMS
A315: GOALKICKERS
A316: BRUNSWICK | C316: COOK 6 | F316: PENDLEBURY 3 | J316: BRADLEY 3 | M316: LEYDIN 2 | O316: WHELAN
A317: PORT MELBOURNE | C317: TEAGUE 4 | F317: ALLEN 3 | I317: GOSS | K317: BAHEN | M317: BOOTH | O317: McKEW
A319: SANDRINGHAM | C319: 4 | D319: 7 | E319: =C319*6+D319 -> 31 | G319: 6 | H319: 9 | I319: =G319*6+H319 -> 45 | K319: 10 | L319: 11 | M319: =K319*6+L319 -> 71 | O319: 14 | P319: 15 | Q319: =O319*6+P319 -> 99 | S319: BEACH ROAD
A320: OAKLEIGH | C320: 1 | D320: 6 | E320: =C320*6+D320 -> 12 | G320: 3 | H320: 9 | I320: =G320*6+H320 -> 27 | K320: 4 | L320: 13 | M320: =K320*6+L320 -> 37 | O320: 4 | P320: 15 | Q320: =O320*6+P320 -> 39 | S320: TOOHEY
A321: BEST PLAYERS
A322: SANDRINGHAM | C322: JOHNSON | F322: PETHERBRIDGE | J322: HOGAN | L322: ZEUSCHNER | O322: VAUGHAN | R322: SMITH
A323: OAKLEIGH | C323: LUFF | F323: BEARD | J323: QUINN | L323: McGUINNESS | O323: JORDAN | R323: MORCAM
A324: GOALKICKERS
A325: SANDRINGHAM | C325: HOGAN 7 | F325: ROBINSON 3 | I325: SHARROCK 2 | L325: JOHNSON | N325: WILLIAMS
A326: OAKLEIGH | C326: McGUINNESS 2 | F326: CUMMINGS | I326: MORCOM
A328: PRESTON | C328: 1 | D328: 5 | E328: =C328*6+D328 -> 11 | G328: 2 | H328: 10 | I328: =G328*6+H328 -> 22 | K328: 6 | L328: 14 | M328: =K328*6+L328 -> 50 | O328: 9 | P328: 17 | Q328: =O328*6+P328 -> 71 | S328: COBURG
A329: COBURG | C329: 2 | D329: 5 | E329: =C329*6+D329 -> 17 | G329: 3 | H329: 8 | I329: =G329*6+H329 -> 26 | K329: 5 | L329: 12 | M329: =K329*6+L329 -> 42 | O329: 8 | P329: 15 | Q329: =O329*6+P329 -> 63 | S329: CRAIG
A330: BEST PLAYERS
A331: PRESTON | C331: JOHNSTONE | F331: CORBETT | I331: PAUL | L331: PERRY | O331: DALTON | R331: MYERS
A332: COBURG | C332: CHALLENGER | F332: THOMPSON | I332: NICHOLS | L332: SHALLARD | O332: VINCENT | R332: OATEN
A333: GOALKICKERS
A334: PRESTON | C334: VENABLES 3 | F334: JOHNSTONE 2 | I334: JOYCE | K334: DALTON | M334: DELLAMARTA | P334: TELFORD
A335: COBURG | C335: THOMPSON 2 | F335: VINCENT 2 | I335: JESS | K335: JACKSON | M335: NICHOLS | P335: KIRKMAN
A337: ROUND 8 | D337: 8TH JUNE | J337: WEATHER | M337: LIGHT S.BREEZE DULL | S337: PLAYED AT
D338: 1ST QTR | H338: 2ND QTR | L338: 3RD QTR | P338: FINAL | S338: PRESTON
A339: PRESTON | C339: 4 | D339: 6 | E339: =C339*6+D339 -> 30 | G339: 9 | H339: 11 | I339: =G339*6+H339 -> 65 | K339: 11 | L339: 18 | M339: =K339*6+L339 -> 84 | O339: 12 | P339: 22 | Q339: =O339*6+P339 -> 94 | S339: UMPIRE | X339: LADDER | AB339: ROUND | AD339: 8
A340: OAKLEIGH | C340: 1 | D340: 4 | E340: =C340*6+D340 -> 10 | G340: 5 | H340: 4 | I340: =G340*6+H340 -> 34 | K340: 7 | L340: 5 | M340: =K340*6+L340 -> 47 | O340: 11 | P340: 7 | Q340: =O340*6+P340 -> 73 | S340: O'NEILL
A341: BEST PLAYERS | W341: TEAM | X341: W | Y341: L | Z341: D | AA341: FOR | AB341: AGST | AC341: % | AD341: PTS
A342: PRESTON | C342: DELLAMARTA | F342: HEARD | I342: TELFORD | L342: CORBETT | N342: JOHNSTONE | Q342: DALTON
A343: OAKLEIGH | C343: BEARD | F343: McGUINNESS | I343: MORCOM | L343: C RITCHIE | N343: O'BRIEN | Q343: B McCORKELL | W343: PRESTON | X343: 7 | Y343: 1 | Z343: 0 | AA343: 734 | AB343: 635 | AC343: 115.59055118110236 | AD343: 28
A344: GOALKICKERS | O344: JOHNSTONE | R344: JOYCE | W344: DANDENONG | X344: 5 | Y344: 2 | Z344: 1 | AA344: 653 | AB344: 551 | AC344: 118.51179673321234 | AD344: 22
A345: PRESTON | C345: DALTON 2 | F345: HEARD 2 | H345: VENABLES 2 | K345: DELLAMARTA 2 | N345: WADDELL | Q345: HINDMARSH | W345: PORT MELBOURNE | X345: 5 | Y345: 2 | Z345: 1 | AA345: 720 | AB345: 647 | AC345: 111.28284389489954 | AD345: 22
A346: OAKLEIGH | C346: MORCAM 4 | F346: McGUINNESS 2 | I346: JORDAN | K346: HEGARTY | M346: WEARNE | O346: JONES | Q346: B McCORKELL | W346: PRAHRAN | X346: 5 | Y346: 3 | Z346: 0 | AA346: 730 | AB346: 558 | AC346: 130.82 | AD346: 20
D347: 9TH JUNE | I347: WEATHER | L347: FINE
A348: PORT MELBOURNE | C348: 1 | D348: 5 | E348: =C348*6+D348 -> 11 | G348: 6 | H348: 11 | I348: =G348*6+H348 -> 47 | K348: 10 | L348: 13 | M348: =K348*6+L348 -> 73 | O348: 14 | P348: 20 | Q348: =O348*6+P348 -> 104 | S348: PORT MELBOURNE | W348: SANDRINGHAM | X348: 5 | Y348: 3 | Z348: 0 | AA348: 840 | AB348: 650 | AC348: 129.23076923076923 | AD348: 20
A349: PRAHRAN | C349: 4 | D349: 5 | E349: =C349*6+D349 -> 29 | G349: 6 | H349: 7 | I349: =G349*6+H349 -> 43 | K349: 10 | L349: 13 | M349: =K349*6+L349 -> 73 | O349: 13 | P349: 16 | Q349: =O349*6+P349 -> 94 | S349: TURNER | W349: WAVERLEY | X349: 5 | Y349: 3 | Z349: 0 | AA349: 633 | AB349: 617 | AC349: 102.59 | AD349: 20
A350: BEST PLAYERS | W350: BRUNSWICK | X350: 3 | Y350: 5 | Z350: 0 | AA350: 610 | AB350: 659 | AC350: 92.564491654021239 | AD350: 12
A351: PORT MELBOURNE | C351: BAHEN | F351: SCHMIDT | I351: CAULFIELD | L351: HOWELL | O351: TEAGUE | Q351: BUCKLEY | W351: YARRAVILLE | X351: 2 | Y351: 6 | Z351: 0 | AA351: 682 | AB351: 757 | AC351: 90.092470277410825 | AD351: 8
A352: PRAHRAN | C352: HUTCHESSON | F352: PROBYN | I352: ALBISTON | L352: BRADLEY | O352: ROSE | Q352: ORR | W352: OAKLEIGH | X352: 2 | Y352: 6 | Z352: 0 | AA352: 524 | AB352: 721 | AC352: 72.676837725381418 | AD352: 8
A353: GOALKICKERS | W353: COBURG | X353: 0 | Y353: 8 | Z353: 0 | AA353: 478 | AB353: 809 | AC353: 59.085290482076637 | AD353: 0
A354: PORT MELBOURNE | C354: PECK 4 | F354: COLLINS 3 | I354: GOSS | J354: ALLEN | L354: BAHEN | N354: CAULFIELD | Q354: TEAGUE
A355: PRAHRAN | C355: BRADLEY 3 | F355: CAFFYN 3 | I355: PAYNE 3 | K355: BARTLETT 2 | N355: ROSE | P355: ORR
A357: WAVERLEY | C357: 6 | D357: 5 | E357: =C357*6+D357 -> 41 | G357: 10 | H357: 5 | I357: =G357*6+H357 -> 65 | K357: 14 | L357: 6 | M357: =K357*6+L357 -> 90 | O357: 15 | P357: 6 | Q357: =O357*6+P357 -> 96 | S357: WAVERLEY
A358: SANDRINGHAM | C358: 2 | D358: 1 | E358: =C358*6+D358 -> 13 | G358: 6 | H358: 5 | I358: =G358*6+H358 -> 41 | K358: 8 | L358: 7 | M358: =K358*6+L358 -> 55 | O358: 10 | P358: 11 | Q358: =O358*6+P358 -> 71 | S358: BORRACK
A359: BEST PLAYERS
A360: WAVERLEY | C360: B PARKER | F360: POORE | I360: WARNER | L360: MORDEN | O360: LAWSON | R360: G PARKER
A361: SANDRINGHAM | C361: D WILLS | F361: VAUGHAN | I361: B WARD | L361: HANCE | O361: SHARROCK | R361: J WARD
A362: GOALKICKERS
A363: WAVERLEY | C363: WARNER 4 | F363: LAWSON 4 | I363: G PARKER 4 | L363: GRANT 2 | N363: McNAMEE
A364: SANDRINGHAM | C364: D WILLS 3 | F364: ROBINSON 3 | I364: HOGAN 2 | K364: SELLECK | M364: HANCE
A366: DANDENONG | C366: 1 | D366: 2 | E366: =C366*6+D366 -> 8 | G366: 1 | H366: 6 | I366: =G366*6+H366 -> 12 | K366: 5 | L366: 12 | M366: =K366*6+L366 -> 42 | O366: 9 | P366: 15 | Q366: =O366*6+P366 -> 69 | S366: BRUNSWICK
A367: BRUNSWICK | C367: 3 | D367: 3 | E367: =C367*6+D367 -> 21 | G367: 3 | H367: 4 | I367: =G367*6+H367 -> 22 | K367: 6 | L367: 4 | M367: =K367*6+L367 -> 40 | O367: 7 | P367: 7 | Q367: =O367*6+P367 -> 49 | S367: GARLICK
A368: BEST PLAYERS
A369: DANDENONG | C369: KENDALL | F369: FLAHERTY | I369: WYATT | L369: STEDWELL | O369: MORROW | R369: STAUNTON
A370: BRUNSWICK | C370: WILSON | F370: LEYDIN | I370: McKINNON | L370: OGSTON | O370: ROBINS | R370: BRIGLIA
A371: GOALKICKERS
A372: DANDENONG | C372: MILLER 3 | F372: BETHKE 2 | I372: MORROW 2 | L372: ANDREWS | N372: FLAHERTY
A373: BRUNSWICK | C373: COOK 3 | F373: LEYDIN | I373: GREIG | K373: WHELAN | N373: OGSTON
A375: YARRAVILLE | C375: 5 | D375: 4 | E375: =C375*6+D375 -> 34 | G375: 7 | H375: 6 | I375: =G375*6+H375 -> 48 | K375: 9 | L375: 18 | M375: =K375*6+L375 -> 72 | O375: 15 | P375: 23 | Q375: =O375*6+P375 -> 113 | S375: YARRAVILLE
A376: COBURG | C376: 4 | D376: 2 | E376: =C376*6+D376 -> 26 | G376: 8 | H376: 5 | I376: =G376*6+H376 -> 53 | K376: 9 | L376: 8 | M376: =K376*6+L376 -> 62 | O376: 10 | P376: 10 | Q376: =O376*6+P376 -> 70 | S376: DIXON
A377: BEST PLAYERS
A378: YARRAVILLE | C378: WARWICK | F378: QUARANTOTTO | I378: B DOWLING | L378: WAGHORNE | O378: DAVIES | R378: KEMP
A379: COBURG | C379: THOMPSON | F379: CHALLENGER | I379: GONINAN | L379: KIRKMAN | O379: WATSON | R379: TASIC
A380: GOALKICKERS
A381: YARRAVILLE | C381: DAVIES 4 | F381: B DOWLING 4 | I381: FOGARTY 2 | L381: QUARANTOTTO | O381: MARTIN
A382: COBURG | C382: GONINAN 4 | F382: McNABB 2 | I382: THOMPSON | L382: JACKSON | N382: VINCENT | P382: NICHOL
A384: ROUND 9 | D384: 15TH JUNE | J384: WEATHER | N384: S.BREEZE FINE MILD | S384: PLAYED AT
D385: 1ST QTR | H385: 2ND QTR | L385: 3RD QTR | P385: FINAL | S385: COBURG
A386: COBURG | C386: 3 | D386: 8 | E386: =C386*6+D386 -> 26 | G386: 6 | H386: 13 | I386: =G386*6+H386 -> 49 | K386: 10 | L386: 18 | M386: =K386*6+L386 -> 78 | O386: 11 | P386: 19 | Q386: =O386*6+P386 -> 85 | S386: UMPIRE | X386: LADDER | AB386: ROUND | AD386: 9
A387: WAVERLEY | C387: 4 | D387: 0 | E387: =C387*6+D387 -> 24 | G387: 5 | H387: 3 | I387: =G387*6+H387 -> 33 | K387: 8 | L387: 6 | M387: =K387*6+L387 -> 54 | O387: 11 | P387: 9 | Q387: =O387*6+P387 -> 75 | S387: TOOHEY
A388: BEST PLAYERS | W388: TEAM | X388: W | Y388: L | Z388: D | AA388: FOR | AB388: AGST | AC388: % | AD388: PTS
A389: COBURG | C389: ERWIN | F389: THOMPSON | I389: VINCENT | L389: KIRKMAN | O389: PALMER | R389: BOSCHEN
A390: WAVERLEY | C390: McQUEEN | F390: GRANT | I390: ROLFE | L390: WARNER | O390: B PARKER | R390: PROBYN | W390: PRESTON | X390: 8 | Y390: 1 | Z390: 0 | AA390: 815 | AB390: 707 | AC390: 115.27581329561528 | AD390: 32
A391: GOALKICKERS | W391: DANDENONG | X391: 6 | Y391: 2 | Z391: 1 | AA391: 746 | AB391: 623 | AC391: 119.74 | AD391: 26
A392: COBURG | C392: VINCENT 2 | F392: PALMER 2 | I392: THOMPSON 2 | L392: GONINAN 2 | O392: NICHOL | Q392: SHALLARD | S392: CHALLENGER | W392: PORT MELBOURNE | X392: 6 | Y392: 2 | Z392: 1 | AA392: 786 | AB392: 697 | AC392: 112.7690100430416 | AD392: 26
A393: WAVERLEY | C393: LAWSON 3 | F393: WARNER 2 | I393: READ 2 | K393: McQUEEN | M393: ALLAN | O393: PRICE | Q393: BATEMAN | W393: SANDRINGHAM | X393: 6 | Y393: 3 | Z393: 0 | AA393: 945 | AB393: 725 | AC393: 130.34482758620689 | AD393: 24
D394: 16TH JUNE | I394: WEATHER | L394: FINE
A395: SANDRINGHAM | C395: 5 | D395: 4 | E395: =C395*6+D395 -> 34 | G395: 9 | H395: 4 | I395: =G395*6+H395 -> 58 | K395: 13 | L395: 16 | M395: =K395*6+L395 -> 94 | O395: 14 | P395: 21 | Q395: =O395*6+P395 -> 105 | S395: BEACH ROAD | W395: PRAHRAN | X395: 5 | Y395: 4 | Z395: 0 | AA395: 802 | AB395: 639 | AC395: 125.51 | AD395: 20
A396: BRUNSWICK | C396: 2 | D396: 5 | E396: =C396*6+D396 -> 17 | G396: 5 | H396: 8 | I396: =G396*6+H396 -> 38 | K396: 8 | L396: 9 | M396: =K396*6+L396 -> 57 | O396: 11 | P396: 9 | Q396: =O396*6+P396 -> 75 | S396: JACKSON | W396: WAVERLEY | X396: 5 | Y396: 4 | Z396: 0 | AA396: 708 | AB396: 702 | AC396: 100.85 | AD396: 20
A397: BEST PLAYERS | W397: BRUNSWICK | X397: 3 | Y397: 6 | Z397: 0 | AA397: 685 | AB397: 764 | AC397: 89.659685863874344 | AD397: 12
A398: SANDRINGHAM | C398: MACKENZIE | F398: HOGAN | I398: LATCHAM | L398: J WARD | N398: B WARD | Q398: ZEUSCHNER | W398: YARRAVILLE | X398: 2 | Y398: 7 | Z398: 0 | AA398: 754 | AB398: 850 | AC398: 88.71 | AD398: 8
A399: BRUNSWICK | C399: BONSACK | F399: BRADLEY | I399: McGHIE | L399: KICK | N399: LEYDIN | Q399: OGSTAN | W399: OAKLEIGH | X399: 2 | Y399: 7 | Z399: 0 | AA399: 574 | AB399: 787 | AC399: 72.93519695044472 | AD399: 8
A400: GOALKICKERS | W400: COBURG | X400: 1 | Y400: 8 | Z400: 0 | AA400: 563 | AB400: 884 | AC400: 63.687782805429862 | AD400: 4
A401: SANDRINGHAM | C401: LATCHAM 3 | F401: SHARROCK 2 | I401: HOGAN 2 | K401: D WILLS 2 | M401: J WARD 2 | O401: HAMMOND | R401: JOHNSON | U401: HANCE
A402: BRUNSWICK | C402: COOK 4 | F402: BONSACK 2 | I402: NOONAN 2 | L402: BRADLEY | N402: OGSTAN | P402: PENDLEBURY
A404: DANDENONG | C404: 0 | D404: 6 | E404: =C404*6+D404 -> 6 | G404: 3 | H404: 14 | I404: =G404*6+H404 -> 32 | K404: 9 | L404: 17 | M404: =K404*6+L404 -> 71 | O404: 12 | P404: 21 | Q404: =O404*6+P404 -> 93 | S404: DANDENONG
A405: YARRAVILLE | C405: 1 | D405: 7 | E405: =C405*6+D405 -> 13 | G405: 5 | H405: 8 | I405: =G405*6+H405 -> 38 | K405: 7 | L405: 14 | M405: =K405*6+L405 -> 56 | O405: 9 | P405: 18 | Q405: =O405*6+P405 -> 72 | S405: TURNER
A406: BEST PLAYERS
A407: DANDENONG | C407: MILLER | F407: LIENERT | I407: ABRAHAM | L407: MORROW | O407: MITCHELL | R407: FLAHERTY
A408: YARRAVILLE | C408: WARWICK | F408: MARTIN | I408: DAVIES | L408: J HENDERSON | O408: BARR | R408: ROWE
A409: GOALKICKERS
A410: DANDENONG | C410: MILLER 8 | F410: MORROW 2 | I410: MITCHELL | L410: FLAHERTY
A411: YARRAVILLE | C411: DAVIES 4 | F411: KEMP 3 | I411: MARTIN 2
D412: 22ND JUNE | J412: WEATHER | M412: S.BREEZE RAIN GROUNDS HEAVY
A413: PORT MELBOURNE | C413: 1 | D413: 0 | E413: =C413*6+D413 -> 6 | G413: 2 | H413: 1 | I413: =G413*6+H413 -> 13 | K413: 5 | L413: 5 | M413: =K413*6+L413 -> 35 | O413: 9 | P413: 12 | Q413: =O413*6+P413 -> 66 | S413: OAKLEIGH
A414: OAKLEIGH | C414: 2 | D414: 4 | E414: =C414*6+D414 -> 16 | G414: 5 | H414: 6 | I414: =G414*6+H414 -> 36 | K414: 7 | L414: 7 | M414: =K414*6+L414 -> 49 | O414: 7 | P414: 8 | Q414: =O414*6+P414 -> 50 | S414: BORRACK
A415: BEST PLAYERS
A416: PORT MELBOURNE | C416: SCHMIDT | F416: BRICE | I416: BAHEN | L416: COLLINS | N416: GRIFFITH | Q416: TEAGUE
A417: OAKLEIGH | C417: QUINN | F417: McGUINNESS | I417: B McCORKELL | L417: TEMME | N417: LUFF | Q417: JONES
A418: GOALKICKERS
A419: PORT MELBOURNE | C419: BAHEN 3 | F419: COLLINS 3 | I419: TEAGUE 2 | L419: BRICE
A420: OAKLEIGH | C420: TEMME 3 | F420: McGUINNESS 2 | J420: JONES | L420: LYON
D421: 23RD JUNE | J421: WEATHER | M421: RAIN
A422: PRESTON | C422: 1 | D422: 0 | E422: =C422*6+D422 -> 6 | G422: 5 | H422: 7 | I422: =G422*6+H422 -> 37 | K422: 8 | L422: 11 | M422: =K422*6+L422 -> 59 | O422: 11 | P422: 15 | Q422: =O422*6+P422 -> 81 | S422: TOORAK PARK
A423: PRAHRAN | C423: 5 | D423: 11 | E423: =C423*6+D423 -> 41 | G423: 6 | H423: 13 | I423: =G423*6+H423 -> 49 | K423: 7 | L423: 15 | M423: =K423*6+L423 -> 57 | O423: 9 | P423: 18 | Q423: =O423*6+P423 -> 72 | S423: McMASTER
A424: BEST PLAYERS
A425: PRESTON | C425: REID | E425: JOHNSTONE | H425: McARTHUR | K425: DALTON | N425: PERRY | Q425: HEARD
A426: PRAHRAN | C426: CAFFYN | E426: WATSON | H426: DICKESON | K426: ROSE | N426: McLAREN | Q426: HUTCHESSON
A427: GOALKICKERS
A428: PRESTON | C428: REID 3 | F428: DALTON 2 | I428: HEARD 2 | K428: VENABLES 2 | N428: HINDMARSH | Q428: DELLAMARTA
A429: PRAHRAN | C429: BARTLETT 2 | F429: PEARSON 2 | I429: PAYNE 2 | K429: ROSE | M429: DICKESON | P429: HUTCHESSON
A431: ROUND 10 | D431: 23RD JUNE | J431: WEATHER | M431: RAIN | S431: PLAYED AT
D432: 1ST QTR | H432: 2ND QTR | L432: 3RD QTR | P432: FINAL | S432: BRUNSWICK
A433: BRUNSWICK | C433: 3 | D433: 1 | E433: =C433*6+D433 -> 19 | G433: 6 | H433: 3 | I433: =G433*6+H433 -> 39 | K433: 9 | L433: 4 | M433: =K433*6+L433 -> 58 | O433: 10 | P433: 7 | Q433: =O433*6+P433 -> 67 | S433: UMPIRE | X433: LADDER | AB433: ROUND | AD433: 10
A434: COBURG | C434: 4 | D434: 5 | E434: =C434*6+D434 -> 29 | G434: 6 | H434: 9 | I434: =G434*6+H434 -> 45 | K434: 7 | L434: 15 | M434: =K434*6+L434 -> 57 | O434: 8 | P434: 15 | Q434: =O434*6+P434 -> 63 | S434: HOLZER
A435: BEST PLAYERS | W435: TEAM | X435: W | Y435: L | Z435: D | AA435: FOR | AB435: AGST | AC435: % | AD435: PTS
A436: BRUNSWICK | C436: KICK | F436: KERWOOD | I436: OGSTON | L436: NOONAN | O436: WILSON | Q436: LEYDIN
A437: COBURG | C437: PALMER | F437: KIRKMAN | I437: THOMPSON | L437: McNABB | O437: VINCENT | Q437: ERWIN | W437: PRESTON | X437: 9 | Y437: 1 | Z437: 0 | AA437: 920 | AB437: 738 | AC437: 124.66124661246613 | AD437: 36
A438: GOALKICKERS | W438: PORT MELBOURNE | X438: 7 | Y438: 2 | Z438: 1 | AA438: 934 | AB438: 764 | AC438: 122.25130890052355 | AD438: 30
A439: BRUNSWICK | C439: COOK 3 | F439: NOONAN 2 | I439: BRADLEY 2 | L439: PENDLEBURY | O439: McKINNON | R439: OGSTAN | W439: DANDENONG | X439: 6 | Y439: 3 | Z439: 1 | AA439: 813 | AB439: 771 | AC439: 105.45 | AD439: 26
A440: COBURG | C440: McNABB 3 | F440: PALMER 2 | I440: GONINAN | K440: THOMPSON | N440: VINCENT | W440: PRAHRAN | X440: 6 | Y440: 4 | Z440: 0 | AA440: 867 | AB440: 699 | AC440: 124.03 | AD440: 24
D441: 29TH JUNE | J441: WEATHER | M441: S.W.BREEZE RAIN
A442: YARRAVILLE | C442: 6 | D442: 6 | E442: =C442*6+D442 -> 42 | G442: 11 | H442: 10 | I442: =G442*6+H442 -> 76 | K442: 17 | L442: 16 | M442: =K442*6+L442 -> 118 | O442: 23 | P442: 20 | Q442: =O442*6+P442 -> 158 | S442: YARRAVILLE | W442: SANDRINGHAM | X442: 6 | Y442: 4 | Z442: 0 | AA442: 976 | AB442: 830 | AC442: 117.59036144578313 | AD442: 24
A443: OAKLEIGH | C443: 3 | D443: 3 | E443: =C443*6+D443 -> 21 | G443: 6 | H443: 7 | I443: =G443*6+H443 -> 43 | K443: 15 | L443: 8 | M443: =K443*6+L443 -> 98 | O443: 16 | P443: 12 | Q443: =O443*6+P443 -> 108 | S443: TURNER | W443: WAVERLEY | X443: 5 | Y443: 5 | Z443: 0 | AA443: 768 | AB443: 767 | AC443: 100.13 | AD443: 20
A444: BEST PLAYERS | W444: BRUNSWICK | X444: 4 | Y444: 6 | Z444: 0 | AA444: 752 | AB444: 827 | AC444: 90.931076178960097 | AD444: 16
A445: YARRAVILLE | C445: DAVIES | F445: KEMP | H445: MARTIN | K445: BARR | N445: McBEAN | Q445: TAURINS | W445: YARRAVILLE | X445: 3 | Y445: 7 | Z445: 0 | AA445: 912 | AB445: 958 | AC445: 95.2 | AD445: 12
A446: OAKLEIGH | C446: MURNANE | F446: LUFF | H446: TEMME | K446: MORCAM | N446: CUMMINGS | Q446: LYON | W446: OAKLEIGH | X446: 2 | Y446: 8 | Z446: 0 | AA446: 682 | AB446: 945 | AC446: 72.169312169312164 | AD446: 8
A447: GOALKICKERS | W447: COBURG | X447: 1 | Y447: 9 | Z447: 0 | AA447: 626 | AB447: 951 | AC447: 65.825446898002099 | AD447: 4
A448: YARRAVILLE | C448: KEMP 10 | E448: DAVIES 5 | G448: QUARANTOTTO 3 | K448: MADIGAN | M448: BARR | O448: MARTIN | Q448: McBEAN | S448: WARWICK
A449: OAKLEIGH | C449: CUMMINGS 5 | F449: MURNANE 3 | I449: TEMME 2 | K449: MORCOM 2 | N449: BELL | P449: LYON | R449: McGUINNESS | U449: WAPLING
E450: 30TH JUNE
A451: PORT MELBOURNE | C451: 5 | D451: 7 | E451: =C451*6+D451 -> 37 | G451: 8 | H451: 8 | I451: =G451*6+H451 -> 56 | K451: 15 | L451: 10 | M451: =K451*6+L451 -> 100 | O451: 22 | P451: 16 | Q451: =O451*6+P451 -> 148 | S451: PORT MELBOURNE
A452: DANDENONG | C452: 1 | D452: 3 | E452: =C452*6+D452 -> 9 | G452: 6 | H452: 6 | I452: =G452*6+H452 -> 42 | K452: 8 | L452: 10 | M452: =K452*6+L452 -> 58 | O452: 9 | P452: 13 | Q452: =O452*6+P452 -> 67 | S452: CRAIG
A453: BEST PLAYERS
A454: PORT MELBOURNE | C454: COLLINS | F454: WILLIAMS | I454: BRICE | L454: IRELAND | N454: TEAGUE | Q454: PECK
A455: DANDENONG | C455: MELAI | F455: ANDREWS | I455: LIENERT | L455: MILLER | N455: EVANS | Q455: BETHKE
A456: GOALKICKERS
A457: PORT MELBOURNE | C457: PECK 5 | F457: TEAGUE 4 | I457: COLLINS 4 | L457: BRICE 4 | N457: ALLEN 2 | Q457: EKLUND 2 | T457: BAHEN
A458: DANDENONG | C458: MILLER 3 | F458: ANDREWS 3 | I458: BETHKE | K458: KENDALL | M458: JOHNSON
A460: PRESTON | C460: 2 | D460: 3 | E460: =C460*6+D460 -> 15 | G460: 5 | H460: 5 | I460: =G460*6+H460 -> 35 | K460: 9 | L460: 10 | M460: =K460*6+L460 -> 64 | O460: 15 | P460: 15 | Q460: =O460*6+P460 -> 105 | S460: PRESTON
A461: SANDRINGHAM | C461: 0 | D461: 5 | E461: =C461*6+D461 -> 5 | G461: 0 | H461: 9 | I461: =G461*6+H461 -> 9 | K461: 2 | L461: 12 | M461: =K461*6+L461 -> 24 | O461: 3 | P461: 13 | Q461: =O461*6+P461 -> 31 | S461: FLANAGAN
A462: BEST PLAYERS
A463: PRESTON | C463: TELFORD | F463: REID | I463: HINDMARSH | L463: PAUL | O463: JOYCE | Q463: VENABLES
A464: SANDRINGHAM | C464: ZEUSCHNER | F464: HAMMOND | I464: HANCE | L464: ROBINSON | O464: HOGAN | Q464: SHARROCK
A465: GOALKICKERS
A466: PRESTON | C466: JOYCE 4 | F466: VENABLES 4 | I466: HINDMARSH 3 | L466: JOHNSTONE 2 | O466: HEARD | Q466: McKERNAN
A467: SANDRINGHAM | C467: HANCE | F467: LATCHAM | I467: K WILLS
A469: PRAHRAN | C469: 2 | D469: 3 | E469: =C469*6+D469 -> 15 | G469: 5 | H469: 7 | I469: =G469*6+H469 -> 37 | K469: 9 | L469: 9 | M469: =K469*6+L469 -> 63 | O469: 9 | P469: 11 | Q469: =O469*6+P469 -> 65 | S469: WAVERLEY
A470: WAVERLEY | C470: 3 | D470: 3 | E470: =C470*6+D470 -> 21 | G470: 5 | H470: 4 | I470: =G470*6+H470 -> 34 | K470: 7 | L470: 5 | M470: =K470*6+L470 -> 47 | O470: 9 | P470: 6 | Q470: =O470*6+P470 -> 60 | S470: HOLZER
A471: BEST PLAYERS
A472: PRAHRAN | C472: HUTCHESSON | F472: PAYNE | I472: ROSE | K472: SKIDMORE | N472: DICKESON | Q472: MARINKO
A473: WAVERLEY | C473: BATEMAN | F473: R HORKINGS | I473: PROBYN | K473: BELL | N473: MORDEN | Q473: WARNER
A474: GOALKICKERS
A475: PRAHRAN | C475: POWER 3 | F475: PAYNE 3 | I475: CAFFYN | K475: RYAN | M475: SKIDMORE
A476: WAVERLEY | C476: R HORKINGS 2 | F476: WARNER 2 | I476: BELL | K476: BATEMAN | M476: POORE | O476: GRANT | Q476: PRICE
A478: ROUND 11 | D478: 6TH JULY | J478: WEATHER | M478: S.WIND LIGHT RAIN A.M. | S478: PLAYED AT
D479: 1ST QTR | H479: 2ND QTR | L479: 3RD QTR | P479: FINAL | S479: OAKLEIGH
A480: WAVERLEY | C480: 3 | D480: 4 | E480: =C480*6+D480 -> 22 | G480: 7 | H480: 8 | I480: =G480*6+H480 -> 50 | K480: 8 | L480: 10 | M480: =K480*6+L480 -> 58 | O480: 8 | P480: 14 | Q480: =O480*6+P480 -> 62 | S480: UMPIRE | X480: LADDER | AB480: ROUND | AD480: 11
A481: OAKLEIGH | C481: 4 | D481: 5 | E481: =C481*6+D481 -> 29 | G481: 5 | H481: 5 | I481: =G481*6+H481 -> 35 | K481: 7 | L481: 7 | M481: =K481*6+L481 -> 49 | O481: 8 | P481: 9 | Q481: =O481*6+P481 -> 57 | S481: CRAIG
A482: BEST PLAYERS | W482: TEAM | X482: W | Y482: L | Z482: D | AA482: FOR | AB482: AGST | AC482: % | AD482: PTS
A483: WAVERLEY | C483: McKENZIE | F483: BELL | H483: PROBYN | K483: R HORKINGS | N483: POORE | Q483: McNAMEE
A484: OAKLEIGH | C484: LUFF | F484: BEARD | H484: B McCORKELL | K484: EDWARDS | N484: MURNANE | Q484: QUINN | W484: PRESTON | X484: 9 | Y484: 2 | Z484: 0 | AA484: 955 | AB484: 825 | AC484: 115.75757575757575 | AD484: 36
A485: GOALKICKERS | W485: PORT MELBOURNE | X485: 7 | Y485: 3 | Z485: 1 | AA485: 1007 | AB485: 851 | AC485: 118.33137485311399 | AD485: 30
A486: WAVERLEY | C486: POORE 2 | F486: R HORKINGS 2 | J486: PROBYN | L486: LAWSON | N486: WARNER | P486: ALLAN | W486: DANDENONG | X486: 7 | Y486: 3 | Z486: 1 | AA486: 900 | AB486: 806 | AC486: 111.66 | AD486: 30
A487: OAKLEIGH | C487: MORCOM 2 | F487: MURNANE 2 | I487: TEMME 2 | L487: McGUINNESS | O487: WAPLING | W487: PRAHRAN | X487: 7 | Y487: 4 | Z487: 0 | AA487: 984 | AB487: 770 | AC487: 127.79 | AD487: 28
D488: 7TH JULY | J488: WEATHER | M488: FINE
A489: DANDENONG | C489: 5 | D489: 0 | E489: =C489*6+D489 -> 30 | G489: 9 | H489: 4 | I489: =G489*6+H489 -> 58 | K489: 11 | L489: 5 | M489: =K489*6+L489 -> 71 | O489: 13 | P489: 9 | Q489: =O489*6+P489 -> 87 | S489: DANDENONG | W489: SANDRINGHAM | X489: 6 | Y489: 5 | Z489: 0 | AA489: 1100 | AB489: 974 | AC489: 112.93634496919918 | AD489: 24
A490: PRESTON | C490: 1 | D490: 4 | E490: =C490*6+D490 -> 10 | G490: 2 | H490: 5 | I490: =G490*6+H490 -> 17 | K490: 3 | L490: 6 | M490: =K490*6+L490 -> 24 | O490: 4 | P490: 11 | Q490: =O490*6+P490 -> 35 | S490: JACKSON | W490: WAVERLEY | X490: 6 | Y490: 5 | Z490: 0 | AA490: 830 | AB490: 824 | AC490: 100.73 | AD490: 24
A491: BEST PLAYERS | W491: YARRAVILLE | X491: 4 | Y491: 7 | Z491: 0 | AA491: 1056 | AB491: 1082 | AC491: 97.6 | AD491: 16
A492: DANDENONG | C492: MITCHELL | F492: CROSS | I492: EVANS | L492: ABRAHAM | O492: MELAI | Q492: ANDREWS | W492: BRUNSWICK | X492: 4 | Y492: 7 | Z492: 0 | AA492: 823 | AB492: 944 | AC492: 87.182203389830505 | AD492: 16
A493: PRESTON | C493: REID | F493: HEARD | I493: McARTHUR | L493: TICKELL | O493: JOYCE | Q493: DALTON | W493: OAKLEIGH | X493: 2 | Y493: 9 | Z493: 0 | AA493: 739 | AB493: 1007 | AC493: 73.386295928500502 | AD493: 8
A494: GOALKICKERS | W494: COBURG | X494: 2 | Y494: 9 | Z494: 0 | AA494: 713 | AB494: 1024 | AC494: 69.62890625 | AD494: 8
A495: DANDENONG | C495: MILLER 3 | F495: ANDREWS 3 | I495: FLAHERTY 2 | L495: MELAI 2 | N495: McNAMARA | Q495: MORROW | S495: VAN LINT
A496: PRESTON | C496: McARTHUR | F496: HINDMARSH | I496: McLEAN | K496: DELLAMARTA
A498: PRAHRAN | C498: 2 | D498: 4 | E498: =C498*6+D498 -> 16 | G498: 7 | H498: 11 | I498: =G498*6+H498 -> 53 | K498: 12 | L498: 12 | M498: =K498*6+L498 -> 84 | O498: 17 | P498: 15 | Q498: =O498*6+P498 -> 117 | S498: TOORAK PARK
A499: BRUNSWICK | C499: 1 | D499: 3 | E499: =C499*6+D499 -> 9 | G499: 2 | H499: 8 | I499: =G499*6+H499 -> 20 | K499: 6 | L499: 13 | M499: =K499*6+L499 -> 49 | O499: 9 | P499: 17 | Q499: =O499*6+P499 -> 71 | S499: O'NEILL
A500: BEST PLAYERS
A501: PRAHRAN | C501: HUTCHESSON | F501: McLAREN | I501: BRADLEY | L501: ROSE | O501: CAFFYN | R501: DICKESON
A502: BRUNSWICK | C502: ROBINS | F502: BRADLEY | I502: COOK | L502: LEYDIN | O502: ROBINSON | R502: PENDLEBURY
A503: GOALKICKERS
A504: PRAHRAN | C504: THOMAS 3 | F504: BARTLETT 2 | I504: GRANGE 2 | K504: CAFFYN 2 | M504: POWER 2 | O504: HUTCHESSON 2 | R504: BRADLEY | U504: KERLEY | W504: MARINKO
A505: BRUNSWICK | C505: COOK 2 | F505: PENDLEBURY 2 | J505: BRADLEY 2 | M505: BURNS | O505: LEYDIN | Q505: ROBINSON
A507: YARRAVILLE | C507: 3 | D507: 8 | E507: =C507*6+D507 -> 26 | G507: 7 | H507: 11 | I507: =G507*6+H507 -> 53 | K507: 14 | L507: 12 | M507: =K507*6+L507 -> 96 | O507: 21 | P507: 18 | Q507: =O507*6+P507 -> 144 | S507: BEACH ROAD
A508: SANDRINGHAM | C508: 4 | D508: 2 | E508: =C508*6+D508 -> 26 | G508: 9 | H508: 7 | I508: =G508*6+H508 -> 61 | K508: 12 | L508: 10 | M508: =K508*6+L508 -> 82 | O508: 18 | P508: 16 | Q508: =O508*6+P508 -> 124 | S508: McMASTER
A509: BEST PLAYERS
A510: YARRAVILLE | C510: J HENDERSON | F510: KEMP | I510: DAVIES | L510: PLOZZA | O510: WARWICK | R510: BARR
A511: SANDRINGHAM | C511: PETHERBRIDGE | F511: VAUGHAN | I511: SMITH | L511: SHARROCK | O511: ZEUSCHNER | R511: WILLIAMS
A512: GOALKICKERS
A513: YARRAVILLE | C513: KEMP 6 | F513: CONNELLY 5 | I513: DAVIES 2 | K513: ROWE 2 | M513: BONGETTI 2 | P513: McBEAN 2 | R513: MARTIN | U513: BARR
A514: SANDRINGHAM | C514: SELLECK 3 | F514: WILLIAMS 3 | I514: LATCHAM 2 | L514: D WILLS 2 | N514: SHARROCK | Q514: ROBINSON | S514: HANCE | U514: J WARD | W514: ZEUSCHNER | X514: WESTON | Z514: KENNEDY | AB514: VAUGHAN
A516: COBURG | C516: 2 | D516: 3 | E516: =C516*6+D516 -> 15 | G516: 5 | H516: 7 | I516: =G516*6+H516 -> 37 | K516: 6 | L516: 7 | M516: =K516*6+L516 -> 43 | O516: 12 | P516: 15 | Q516: =O516*6+P516 -> 87 | S516: COBURG
A517: PORT MELBOURNE | C517: 4 | D517: 2 | E517: =C517*6+D517 -> 26 | G517: 7 | H517: 4 | I517: =G517*6+H517 -> 46 | K517: 9 | L517: 11 | M517: =K517*6+L517 -> 65 | O517: 10 | P517: 13 | Q517: =O517*6+P517 -> 73 | S517: DIXON
A518: BEST PLAYERS
A519: COBURG | C519: HIRST | F519: PALMER | I519: CHALLENGER | L519: McNABB | O519: BOSCHEN | R519: ERWIN
A520: PORT MELBOURNE | C520: WILLIAMS | F520: BRICE | I520: TEAGUE | L520: ALLEN | O520: BOOTH | R520: RENOUF
A521: GOALKICKERS
A522: COBURG | C522: PALMER 3 | F522: McNABB 3 | I522: HIRST 3 | K522: CHALLENGER | N522: ERWIN | P522: VINCENT
A523: PORT MELBOURNE | C523: PECK 3 | F523: TEAGUE 2 | I523: COLLINS 2 | L523: BOOTH | N523: EKLUND | P523: BRICE
A525: ROUND 12 | D525: 13TH JULY | J525: WEATHER | M525: S.BREEZE LIGHT RAIN A.M. | S525: PLAYED AT
D526: 1ST QTR | H526: 2ND QTR | L526: 3RD QTR | P526: FINAL | S526: DANDENONG
A527: DANDENONG | C527: 5 | D527: 2 | E527: =C527*6+D527 -> 32 | G527: 7 | H527: 7 | I527: =G527*6+H527 -> 49 | K527: 13 | L527: 10 | M527: =K527*6+L527 -> 88 | O527: 20 | P527: 20 | Q527: =O527*6+P527 -> 140 | S527: UMPIRE | X527: LADDER | AB527: ROUND | AD527: 12
A528: OAKLEIGH | C528: 3 | D528: 5 | E528: =C528*6+D528 -> 23 | G528: 4 | H528: 8 | I528: =G528*6+H528 -> 32 | K528: 5 | L528: 8 | M528: =K528*6+L528 -> 38 | O528: 5 | P528: 8 | Q528: =O528*6+P528 -> 38 | S528: DIXON
A529: BEST PLAYERS | W529: TEAM | X529: W | Y529: L | Z529: D | AA529: FOR | AB529: AGST | AC529: % | AD529: PTS
A530: DANDENONG | C530: MILLER | F530: MITCHELL | I530: EVANS | L530: OSBORNE | N530: ANDREWS | Q530: ABRAHAM
A531: OAKLEIGH | C531: BEARD | F531: TRAILL | I531: MURNANE | L531: MORCOM | N531: LUFF | Q531: WAPLING | W531: PRESTON | X531: 9 | Y531: 3 | Z531: 0 | AA531: 1014 | AB531: 905 | AC531: 112.04419889502762 | AD531: 36
A532: GOALKICKERS | W532: DANDENONG | X532: 8 | Y532: 3 | Z532: 1 | AA532: 1040 | AB532: 844 | AC532: 123.22 | AD532: 34
A533: DANDENONG | C533: MILLER 7 | F533: FLAHERTY 5 | I533: ANDREWS 4 | L533: HILL | M533: MELAI | O533: EVANS | Q533: OSBORNE | W533: PRAHRAN | X533: 8 | Y533: 4 | Z533: 0 | AA533: 1079 | AB533: 838 | AC533: 128.76 | AD533: 32
A534: OAKLEIGH | C534: CUMMINGS 2 | F534: WAPLING | I534: MURNANE | L534: MORCOM | W534: PORT MELBOURNE | X534: 7 | Y534: 4 | Z534: 1 | AA534: 1089 | AB534: 983 | AC534: 110.78331637843337 | AD534: 30
D535: 14TH JULY | J535: WEATHER | M535: FINE
A536: SANDRINGHAM | C536: 7 | D536: 4 | E536: =C536*6+D536 -> 46 | G536: 11 | H536: 6 | I536: =G536*6+H536 -> 72 | K536: 16 | L536: 8 | M536: =K536*6+L536 -> 104 | O536: 20 | P536: 12 | Q536: =O536*6+P536 -> 132 | S536: PORT MELBOURNE | W536: SANDRINGHAM | X536: 7 | Y536: 5 | Z536: 0 | AA536: 1232 | AB536: 1056 | AC536: 116.66666666666667 | AD536: 28
A537: PORT MELBOURNE | C537: 2 | D537: 2 | E537: =C537*6+D537 -> 14 | G537: 3 | H537: 8 | I537: =G537*6+H537 -> 26 | K537: 5 | L537: 13 | M537: =K537*6+L537 -> 43 | O537: 11 | P537: 16 | Q537: =O537*6+P537 -> 82 | S537: HOLZER | W537: WAVERLEY | X537: 7 | Y537: 5 | Z537: 0 | AA537: 910 | AB537: 883 | AC537: 103.06 | AD537: 28
A538: BEST PLAYERS | W538: YARRAVILLE | X538: 5 | Y538: 7 | Z538: 0 | AA538: 1235 | AB538: 1206 | AC538: 102.4 | AD538: 20
A539: SANDRINGHAM | C539: PETHERBRIDGE | F539: VAUGHAN | I539: SMITH | K539: MACKENZIE | N539: J WARD | Q539: HOGAN | W539: BRUNSWICK | X539: 4 | Y539: 8 | Z539: 0 | AA539: 947 | AB539: 1123 | AC539: 84.327693677649151 | AD539: 16
A540: PORT MELBOURNE | C540: GROVER | F540: BRICE | I540: RENOUF | K540: EKLUND | N540: BOOTH | Q540: CAULFIELD | W540: COBURG | X540: 2 | Y540: 10 | Z540: 0 | AA540: 781 | AB540: 1119 | AC540: 69.794459338695262 | AD540: 8
A541: GOALKICKERS | S541: LOCKHART | W541: OAKLEIGH | X541: 2 | Y541: 10 | Z541: 0 | AA541: 777 | AB541: 1147 | AC541: 67.741935483870961 | AD541: 8
A542: SANDRINGHAM | C542: J WARD 5 | E542: HOGAN 4 | G542: LATCHAM 3 | J542: HANCE 2 | L542: SHARROCK 2 | O542: WILLIAMS | Q542: SMITH | S542: CLIFFORD
A543: PORT MELBOURNE | C543: COLLINS 3 | F543: CAULFIELD 2 | I543: HOWELL 2 | L543: BRICE 2 | N543: SCHMIDT | Q543: TEAGUE
A545: WAVERLEY | C545: 1 | D545: 2 | E545: =C545*6+D545 -> 8 | G545: 7 | H545: 9 | I545: =G545*6+H545 -> 51 | K545: 8 | L545: 10 | M545: =K545*6+L545 -> 58 | O545: 11 | P545: 14 | Q545: =O545*6+P545 -> 80 | S545: WAVERLEY
A546: PRESTON | C546: 3 | D546: 4 | E546: =C546*6+D546 -> 22 | G546: 6 | H546: 4 | I546: =G546*6+H546 -> 40 | K546: 8 | L546: 7 | M546: =K546*6+L546 -> 55 | O546: 8 | P546: 11 | Q546: =O546*6+P546 -> 59 | S546: TURNER
A547: BEST PLAYERS
A548: WAVERLEY | C548: McKENZIE | F548: WARNER | I548: POORE | K548: R HORKINGS | N548: PROBYN | Q548: PARKER
A549: PRESTON | C549: McLEAN | F549: LEMPRIERE | I549: REID | K549: McARTHUR | N549: DELLAMARTA | Q549: HINDMARSH
A550: GOALKICKERS
A551: WAVERLEY | C551: WARNER 4 | F551: R HORKINGS 3 | I551: McNAMEE 2 | L551: STEPHENS | O551: POORE
A552: PRESTON | C552: HINDMARSH 4 | F552: McARTHUR 2 | I552: LEMPRIERE | L552: REID
A554: YARRAVILLE | C554: 12 | D554: 4 | E554: =C554*6+D554 -> 76 | G554: 16 | H554: 7 | I554: =G554*6+H554 -> 103 | K554: 22 | L554: 10 | M554: =K554*6+L554 -> 142 | O554: 28 | P554: 11 | Q554: =O554*6+P554 -> 179 | S554: YARRAVILLE
A555: BRUNSWICK | C555: 0 | D555: 2 | E555: =C555*6+D555 -> 2 | G555: 7 | H555: 6 | I555: =G555*6+H555 -> 48 | K555: 12 | L555: 10 | M555: =K555*6+L555 -> 82 | O555: 18 | P555: 16 | Q555: =O555*6+P555 -> 124 | S555: PIMBLETT
A556: BEST PLAYERS
A557: YARRAVILLE | C557: DAVIES | F557: WARWICK | I557: ROWE | K557: CONNELLY | N557: HEYME | Q557: MADIGAN
A558: BRUNSWICK | C558: OGSTAN | F558: K BURNS | I558: McKINNON | K558: PENDLEBURY | N558: BRADLEY | Q558: ROBINSON
A559: GOALKICKERS
A560: YARRAVILLE | C560: ROWE 9 | E560: DAVIES 5 | G560: KEMP 4 | I560: ROACH 3 | K560: MADIGAN 3 | N560: CONNELLY 3 | Q560: J HENDERSON
A561: BRUNSWICK | C561: PENDLEBURY 3 | F561: OGSTAN 2 | I561: K BURNS 2 | L561: COOK 2 | N561: ROBINSON 2 | Q561: BRADLEY 2 | T561: LEYDIN 2 | W561: McKINNON 2 | X561: W BURNS
A563: PRAHRAN | C563: 2 | D563: 2 | E563: =C563*6+D563 -> 14 | G563: 6 | H563: 7 | I563: =G563*6+H563 -> 43 | K563: 9 | L563: 8 | M563: =K563*6+L563 -> 62 | O563: 14 | P563: 11 | Q563: =O563*6+P563 -> 95 | S563: COBURG
A564: COBURG | C564: 0 | D564: 6 | E564: =C564*6+D564 -> 6 | G564: 2 | H564: 8 | I564: =G564*6+H564 -> 20 | K564: 6 | L564: 15 | M564: =K564*6+L564 -> 51 | O564: 8 | P564: 20 | Q564: =O564*6+P564 -> 68 | S564: FLANAGAN
A565: BEST PLAYERS
A566: PRAHRAN | C566: BRADLEY | F566: DICKESON | I566: ROSE | K566: McLAREN | N566: POWER | Q566: CULPIN
A567: COBURG | C567: TASIC | F567: NICHOL | I567: ERWIN | K567: O'SULLIVAN | N567: PALMER | Q567: SHALLARD
A568: GOALKICKERS
A569: PRAHRAN | C569: POWER 7 | F569: BRADLEY 5 | I569: CAFFYN | K569: HUTCHESSON
A570: COBURG | C570: PALMER 3 | F570: ERWIN 2 | I570: GONINAN | K570: CHALLENGER | N570: SHULZE
A572: ROUND 13 | D572: 20TH JULY | I572: WEATHER | L572: NORTHWEST BREEZE FINE | S572: PLAYED AT
D573: 1ST QTR | H573: 2ND QTR | L573: 3RD QTR | P573: FINAL | S573: BRUNSWICK
A574: WAVERLEY | C574: 2 | D574: 6 | E574: =C574*6+D574 -> 18 | G574: 5 | H574: 6 | I574: =G574*6+H574 -> 36 | K574: 9 | L574: 11 | M574: =K574*6+L574 -> 65 | O574: 11 | P574: 16 | Q574: =O574*6+P574 -> 82 | S574: UMPIRE | X574: LADDER | AB574: ROUND | AD574: 13
A575: BRUNSWICK | C575: 4 | D575: 2 | E575: =C575*6+D575 -> 26 | G575: 7 | H575: 9 | I575: =G575*6+H575 -> 51 | K575: 8 | L575: 11 | M575: =K575*6+L575 -> 59 | O575: 11 | P575: 13 | Q575: =O575*6+P575 -> 79 | S575: FLANAGAN
A576: BEST PLAYERS | W576: TEAM | X576: W | Y576: L | Z576: D | AA576: FOR | AB576: AGST | AC576: % | AD576: PTS
A577: WAVERLEY | C577: ABBOTT | F577: PRICE | I577: STEPHENS | L577: LAWSON | N577: McNAMEE | Q577: POORE
A578: BRUNSWICK | C578: K BURNS | F578: WHELAN | I578: ROBINSON | L578: GREIG | N578: BRADLEY | Q578: WILSON | W578: PRESTON | X578: 10 | Y578: 3 | Z578: 0 | AA578: 1094 | AB578: 960 | AC578: 113.95833333333333 | AD578: 40
A579: GOALKICKERS | W579: PRAHRAN | X579: 9 | Y579: 4 | Z579: 0 | AA579: 1185 | AB579: 882 | AC579: 134.35 | AD579: 36
A580: WAVERLEY | C580: LAWSON 3 | F580: WARNER 2 | I580: POORE 2 | K580: McQUEEN 2 | N580: STEPHENS | Q580: ABBOTT | W580: DANDENONG | X580: 8 | Y580: 4 | Z580: 1 | AA580: 1101 | AB580: 911 | AC580: 120.86 | AD580: 34
A581: BRUNSWICK | C581: BRADLEY 4 | F581: WHELAN 3 | I581: W BURNS | K581: K BURNS | N581: McKINNON | Q581: PENDLEBURY | W581: SANDRINGHAM | X581: 8 | Y581: 5 | Z581: 0 | AA581: 1299 | AB581: 1117 | AC581: 116.29364368845121 | AD581: 32
A583: OAKLEIGH | C583: 7 | D583: 0 | E583: =C583*6+D583 -> 42 | G583: 9 | H583: 7 | I583: =G583*6+H583 -> 61 | K583: 10 | L583: 11 | M583: =K583*6+L583 -> 71 | O583: 19 | P583: 18 | Q583: =O583*6+P583 -> 132 | S583: OAKLEIGH | W583: WAVERLEY | X583: 8 | Y583: 5 | Z583: 0 | AA583: 992 | AB583: 962 | AC583: 103.12 | AD583: 32
A584: COBURG | C584: 2 | D584: 2 | E584: =C584*6+D584 -> 14 | G584: 5 | H584: 6 | I584: =G584*6+H584 -> 36 | K584: 10 | L584: 10 | M584: =K584*6+L584 -> 70 | O584: 12 | P584: 13 | Q584: =O584*6+P584 -> 85 | S584: McMASTER | W584: PORT MELBOURNE | X584: 7 | Y584: 5 | Z584: 1 | AA584: 1144 | AB584: 1063 | AC584: 107.61994355597366 | AD584: 30
A585: BEST PLAYERS | W585: YARRAVILLE | X585: 5 | Y585: 8 | Z585: 0 | AA585: 1279 | AB585: 1312 | AC585: 97.48 | AD585: 20
A586: OAKLEIGH | C586: MURNANE | F586: B McCORKELL | I586: CUMMINGS | L586: C RITCHIE | O586: LUFF | Q586: KITTO | W586: BRUNSWICK | X586: 4 | Y586: 9 | Z586: 0 | AA586: 1026 | AB586: 1205 | AC586: 85.145228215767631 | AD586: 16
A587: COBURG | C587: KIRKMAN | F587: NICHOL | I587: THOMPSON | L587: OATEN | O587: PALMER | Q587: CHALLENGER | W587: OAKLEIGH | X587: 3 | Y587: 10 | Z587: 0 | AA587: 909 | AB587: 1232 | AC587: 73.782467532467535 | AD587: 12
A588: GOALKICKERS | W588: COBURG | X588: 2 | Y588: 11 | Z588: 0 | AA588: 866 | AB588: 1251 | AC588: 69.224620303756993 | AD588: 8
A589: OAKLEIGH | C589: CUMMINGS 6 | F589: MURNANE 4 | I589: TEMME 4 | K589: JONES 3 | M589: GORDES | O589: McGUINNESS
A590: COBURG | C590: KIRKMAN 3 | F590: MORRIS 3 | I590: PALMER 2 | L590: CHALLENGER 2 | O590: VINCENT | Q590: THOMPSON
E591: 21ST JULY | J591: WEATHER | N591: RAIN
A592: PRESTON | C592: 2 | D592: 2 | E592: =C592*6+D592 -> 14 | G592: 4 | H592: 3 | I592: =G592*6+H592 -> 27 | K592: 8 | L592: 4 | M592: =K592*6+L592 -> 52 | O592: 12 | P592: 8 | Q592: =O592*6+P592 -> 80 | S592: PRESTON
A593: PORT MELBOURNE | C593: 5 | D593: 0 | E593: =C593*6+D593 -> 30 | G593: 7 | H593: 3 | I593: =G593*6+H593 -> 45 | K593: 8 | L593: 4 | M593: =K593*6+L593 -> 52 | O593: 8 | P593: 7 | Q593: =O593*6+P593 -> 55 | S593: GARLICK
A594: BEST PLAYERS
A595: PRESTON | C595: DALTON | F595: McLEAN | I595: McBEAN | L595: REID | O595: McARTHUR | R595: McKERNAN
A596: PORT MELBOURNE | C596: CAULFIELD | F596: RENOUF | I596: IRELAND | L596: SCHMIDT | O596: PASQUILL | R596: EKLUND
A597: GOALKICKERS
A598: PRESTON | C598: DALTON 4 | F598: REID 4 | I598: HEARD 2 | L598: VENABLES 2
A599: PORT MELBOURNE | C599: SCHMIDT 2 | F599: McKEW 2 | I599: HOWELL | K599: BONNETT | M599: KERR | O599: EKLUND
A601: SANDRINGHAM | C601: 4 | D601: 5 | E601: =C601*6+D601 -> 29 | G601: 5 | H601: 5 | I601: =G601*6+H601 -> 35 | K601: 9 | L601: 7 | M601: =K601*6+L601 -> 61 | O601: 10 | P601: 7 | Q601: =O601*6+P601 -> 67 | S601: BEACH ROAD
A602: DANDENONG | C602: 1 | D602: 4 | E602: =C602*6+D602 -> 10 | G602: 4 | H602: 7 | I602: =G602*6+H602 -> 31 | K602: 5 | L602: 13 | M602: =K602*6+L602 -> 43 | O602: 7 | P602: 19 | Q602: =O602*6+P602 -> 61 | S602: O'NEILL
A603: BEST PLAYERS
A604: SANDRINGHAM | C604: PETHERBRIDGE | F604: WILLIAMS | I604: MACKENZIE | L604: ZEUSCHNER | O604: SMITH | Q604: CLIFFORD
A605: DANDENONG | C605: ANDREWS | F605: EVANS | I605: CROSS | L605: MITCHELL | O605: WYATT | Q605: WHITEHEAD
A606: GOALKICKERS
A607: SANDRINGHAM | C607: WILLIAMS 4 | F607: HOGAN 2 | I607: SELLECK | K607: CLIFFORD | N607: LATCHAM | Q607: SHARROCK
A608: DANDENONG | C608: MILLER 2 | F608: ANDREWS 2 | I608: EVANS | K608: FLAHERTY | N608: MELAI
A610: PRAHRAN | C610: 0 | D610: 9 | E610: =C610*6+D610 -> 9 | G610: 6 | H610: 9 | I610: =G610*6+H610 -> 45 | K610: 10 | L610: 13 | M610: =K610*6+L610 -> 73 | O610: 14 | P610: 22 | Q610: =O610*6+P610 -> 106 | S610: TOORAK PARK
A611: YARRAVILLE | C611: 1 | D611: 1 | E611: =C611*6+D611 -> 7 | G611: 3 | H611: 3 | I611: =G611*6+H611 -> 21 | K611: 5 | L611: 6 | M611: =K611*6+L611 -> 36 | O611: 6 | P611: 8 | Q611: =O611*6+P611 -> 44 | S611: TOOHEY
A612: BEST PLAYERS
A613: PRAHRAN | C613: HUTCHESSON | F613: MARINKO | I613: JUNGWIRTH | L613: WATSON | O613: DICKESON | R613: ROSE
A614: YARRAVILLE | C614: WARWICK | F614: HENDERSON | I614: BARROW | L614: MADIGAN | O614: DAVIES | R614: ROACH
A615: GOALKICKERS
A616: PRAHRAN | C616: POWER 4 | F616: RYAN 3 | H616: GRANGE 2 | J616: HUTCHESSON 2 | N616: ROSE | P616: MARINKO | R616: JUNGWIRTH
A617: YARRAVILLE | C617: BARR | E617: HENDERSON | H617: ROWE | J617: KEMP | L617: DAVIES | N617: WARWICK
A619: ROUND 14 | E619: 28TH JULY | J619: WEATHER | N619: NORTH WIND | S619: PLAYED AT
D620: 1ST QTR | H620: 2ND QTR | L620: 3RD QTR | P620: FINAL | S620: D,NONG
A621: DANDENONG | C621: 6 | D621: 1 | E621: =C621*6+D621 -> 37 | G621: 8 | H621: 4 | I621: =G621*6+H621 -> 52 | K621: 15 | L621: 5 | M621: =K621*6+L621 -> 95 | O621: 17 | P621: 8 | Q621: =O621*6+P621 -> 110 | S621: UMPIRE | X621: LADDER | AB621: ROUND | AD621: 14
A622: WAVERLEY | C622: 0 | D622: 2 | E622: =C622*6+D622 -> 2 | G622: 4 | H622: 9 | I622: =G622*6+H622 -> 33 | K622: 5 | L622: 11 | M622: =K622*6+L622 -> 41 | O622: 8 | P622: 16 | Q622: =O622*6+P622 -> 64 | S622: HOLZER
A623: BEST PLAYERS | W623: TEAM | X623: W | Y623: L | Z623: D | AA623: FOR | AB623: AGST | AC623: % | AD623: PTS
A624: DANDENONG | C624: ANDREWS | F624: EVANS | I624: VAN LINT | L624: BETHKE | N624: STEDWELL | Q624: FLAHERTY
A625: WAVERLEY | C625: MORDEN | F625: STEPHENS | I625: ROLFE | L625: PRICE | N625: B PARKER | Q625: LANG | W625: PRESTON | X625: 11 | Y625: 3 | Z625: 0 | AA625: 1180 | AB625: 1003 | AC625: 117.64705882352941 | AD625: 44
A626: GOALKICKERS | R626: MELAI | W626: PRAHRAN | X626: 10 | Y626: 4 | Z626: 0 | AA626: 1265 | AB626: 942 | AC626: 134.29 | AD626: 40
A627: DANDENONG | C627: ANDREWS 5 | F627: MORROW 2 | I627: BETHKE 2 | K627: FLAHERTY 2 | N627: MILLER 2 | Q627: HILL 2 | S627: OSBORNE | W627: DANDENONG | X627: 9 | Y627: 4 | Z627: 1 | AA627: 1211 | AB627: 975 | AC627: 124.21 | AD627: 38
A628: WAVERLEY | C628: WARNER 2 | F628: PROBYN 2 | I628: PRICE | K628: STEPHENS | M628: R HORKINGS | P628: POORE | W628: SANDRINGHAM | X628: 9 | Y628: 5 | Z628: 0 | AA628: 1379 | AB628: 1156 | AC628: 119.29065743944636 | AD628: 36
A630: YARRAVILLE | C630: 1 | D630: 2 | E630: =C630*6+D630 -> 8 | G630: 8 | H630: 6 | I630: =G630*6+H630 -> 54 | K630: 11 | L630: 7 | M630: =K630*6+L630 -> 73 | O630: 16 | P630: 10 | Q630: =O630*6+P630 -> 106 | S630: PORT MELBOURNE | W630: WAVERLEY | X630: 8 | Y630: 6 | Z630: 0 | AA630: 1056 | AB630: 1072 | AC630: 98.51 | AD630: 32
A631: PORT MELBOURNE | C631: 4 | D631: 3 | E631: =C631*6+D631 -> 27 | G631: 7 | H631: 3 | I631: =G631*6+H631 -> 45 | K631: 10 | L631: 8 | M631: =K631*6+L631 -> 68 | O631: 14 | P631: 15 | Q631: =O631*6+P631 -> 99 | S631: JACKSON | W631: PORT MELBOURNE | X631: 7 | Y631: 6 | Z631: 1 | AA631: 1243 | AB631: 1169 | AC631: 106.33019674935842 | AD631: 30
A632: BEST PLAYERS | W632: YARRAVILLE | X632: 6 | Y632: 8 | Z632: 0 | AA632: 1385 | AB632: 1411 | AC632: 98.16 | AD632: 24
A633: YARRAVILLE | C633: CONNELLY | F633: WARWICK | I633: CHARLES | L633: TAURINS | O633: MADIGAN | R633: BARR | W633: BRUNSWICK | X633: 4 | Y633: 10 | Z633: 0 | AA633: 1069 | AB633: 1291 | AC633: 82.804027885360185 | AD633: 16
A634: PORT MELBOURNE | C634: KERR | F634: BRICE | I634: TEAGUE | L634: HOWELL | O634: BONNETT | R634: RENOUF | W634: OAKLEIGH | X634: 3 | Y634: 11 | Z634: 0 | AA634: 969 | AB634: 1312 | AC634: 73.856707317073173 | AD634: 12
A635: GOALKICKERS | W635: COBURG | X635: 2 | Y635: 12 | Z635: 0 | AA635: 905 | AB635: 1331 | AC635: 67.993989481592791 | AD635: 8
A636: YARRAVILLE | C636: MADIGAN 3 | F636: ROWE 3 | H636: KEMP 3 | J636: DAVIES 2 | M636: CONNELLY 2 | P636: QUARANTOTTO 2 | T636: WARWICK
A637: PORT MELBOURNE | C637: HOWELL 5 | F637: BRICE 4 | I637: KERR 2 | K637: McKEW 2 | N637: TEAGUE
A639: SANDRINGHAM | C639: 1 | D639: 6 | E639: =C639*6+D639 -> 12 | G639: 3 | H639: 9 | I639: =G639*6+H639 -> 27 | K639: 8 | L639: 11 | M639: =K639*6+L639 -> 59 | O639: 11 | P639: 14 | Q639: =O639*6+P639 -> 80 | S639: COBURG
A640: COBURG | C640: 1 | D640: 1 | E640: =C640*6+D640 -> 7 | G640: 2 | H640: 6 | I640: =G640*6+H640 -> 18 | K640: 2 | L640: 7 | M640: =K640*6+L640 -> 19 | O640: 5 | P640: 9 | Q640: =O640*6+P640 -> 39 | S640: BORRACK
A641: BEST PLAYERS
A642: SANDRINGHAM | C642: SHARROCK | F642: J WARD | I642: PETHERBRIDGE | L642: MACKENZIE | O642: WILLIAMS | R642: CLIFFORD
A643: COBURG | C643: SHALLARD | F643: WELSH | I643: KIRKMAN | L643: NICHOL | O643: HIRST | R643: TASIC
A644: GOALKICKERS
A645: SANDRINGHAM | C645: HAMMOND 2 | F645: SHARROCK 2 | I645: LATCHAM 2 | L645: HOGAN | N645: LOCKHART | Q645: SELLECK | S645: MACKENZIE | V645: HANCE
A646: COBURG | C646: WELSH 2 | F646: KIRKMAN | I646: McNABB | L646: HIRST
A648: PRESTON | C648: 1 | D648: 3 | E648: =C648*6+D648 -> 9 | G648: 6 | H648: 8 | I648: =G648*6+H648 -> 44 | K648: 7 | L648: 9 | M648: =K648*6+L648 -> 51 | O648: 11 | P648: 20 | Q648: =O648*6+P648 -> 86 | S648: PRESTON
A649: BRUNSWICK | C649: 1 | D649: 7 | E649: =C649*6+D649 -> 13 | G649: 2 | H649: 9 | I649: =G649*6+H649 -> 21 | K649: 5 | L649: 13 | M649: =K649*6+L649 -> 43 | O649: 5 | P649: 13 | Q649: =O649*6+P649 -> 43 | S649: TOOHEY
A650: BEST PLAYERS
A651: PRESTON | C651: JOYCE | F651: TELFORD | I651: HEARD | L651: McLEAN | O651: McARTHUR | R651: McKERNAN
A652: BRUNSWICK | C652: WILSON | F652: ROBINS | I652: ROBINSON | L652: BRADLEY | O652: K BURNS
A653: GOALKICKERS
A654: PRESTON | C654: JOYCE 4 | F654: GOAD 2 | I654: HEARD 2 | L654: WESTON | N654: HINDMARSH | Q654: VENABLES
A655: BRUNSWICK | C655: COOK 2 | F655: WROUT | I655: OGSTON | K655: BRADLEY
A657: PRAHRAN | C657: 2 | D657: 1 | E657: =C657*6+D657 -> 13 | G657: 5 | H657: 10 | I657: =G657*6+H657 -> 40 | K657: 7 | L657: 12 | M657: =K657*6+L657 -> 54 | O657: 10 | P657: 20 | Q657: =O657*6+P657 -> 80 | S657: TOORAK PARK
A658: OAKLEIGH | C658: 3 | D658: 4 | E658: =C658*6+D658 -> 22 | G658: 4 | H658: 7 | I658: =G658*6+H658 -> 31 | K658: 5 | L658: 8 | M658: =K658*6+L658 -> 38 | O658: 8 | P658: 12 | Q658: =O658*6+P658 -> 60 | S658: TURNER
A659: BEST PLAYERS
A660: PRAHRAN | C660: WATSON | F660: CULPIN | I660: HUTCHESSON | L660: ROSE | N660: POWER | Q660: JUNGWIRTH
A661: OAKLEIGH | C661: LUFF | F661: MURNANE | I661: JONES | L661: KITTO | N661: TEMME | Q661: O'BRIEN
A662: GOALKICKERS
A663: PRAHRAN | C663: POWER 5 | F663: MARINKO 2 | I663: GRANGE | K663: RYAN | M663: PAYNE
A664: OAKLEIGH | C664: MURNANE 2 | F664: CUMMINGS 2 | I664: KITTO | K664: WALTON | M664: TEMME | O664: JONES
A666: ROUND 15 | E666: 3RD AUGUST | S666: PLAYED AT
D667: 1ST QTR | H667: 2ND QTR | L667: 3RD QTR | P667: FINAL
A668: PRAHRAN | C668: 3 | D668: 3 | E668: =C668*6+D668 -> 21 | G668: 6 | H668: 8 | I668: =G668*6+H668 -> 44 | K668: 10 | L668: 9 | M668: =K668*6+L668 -> 69 | O668: 14 | P668: 9 | Q668: =O668*6+P668 -> 93 | S668: UMPIRE | X668: LADDER | AB668: ROUND | AD668: 15
A669: SANDRINGHAM | C669: 2 | D669: 3 | E669: =C669*6+D669 -> 15 | G669: 4 | H669: 9 | I669: =G669*6+H669 -> 33 | K669: 8 | L669: 10 | M669: =K669*6+L669 -> 58 | O669: 10 | P669: 16 | Q669: =O669*6+P669 -> 76
A670: BEST PLAYERS | W670: TEAM | X670: W | Y670: L | Z670: D | AA670: FOR | AB670: AGST | AC670: % | AD670: PTS
A671: PRAHRAN | C671: POWER | F671: PAYNE | I671: ROSE | K671: CULPIN | N671: GRANGE | Q671: BRADLEY
A672: SANDRINGHAM | W672: PRESTON | X672: 12 | Y672: 3 | Z672: 0 | AA672: 1282 | AB672: 1098 | AC672: 116.75774134790528 | AD672: 48
A673: GOALKICKERS | W673: PRAHRAN | X673: 11 | Y673: 4 | Z673: 0 | AA673: 1358 | AB673: 1018 | AC673: 133.4 | AD673: 44
A674: PRAHRAN | C674: POWER 8 | F674: BRADLEY 2 | I674: GRANGE 2 | L674: RYAN | N674: ALBISTON | W674: DANDENONG | X674: 10 | Y674: 4 | Z674: 1 | AA674: 1289 | AB674: 1034 | AC674: 124.66 | AD674: 42
A675: SANDRINGHAM | W675: SANDRINGHAM | X675: 9 | Y675: 6 | Z675: 0 | AA675: 1455 | AB675: 1249 | AC675: 116.49319455564452 | AD675: 36
A677: PORT MELBOURNE | C677: 2 | D677: 3 | E677: =C677*6+D677 -> 15 | G677: 9 | H677: 4 | I677: =G677*6+H677 -> 58 | K677: 10 | L677: 8 | M677: =K677*6+L677 -> 68 | O677: 13 | P677: 12 | Q677: =O677*6+P677 -> 90 | W677: PORT MELBOURNE | X677: 8 | Y677: 6 | Z677: 1 | AA677: 1333 | AB677: 1251 | AC677: 106.55475619504396 | AD677: 34
A678: WAVERLEY | C678: 2 | D678: 1 | E678: =C678*6+D678 -> 13 | G678: 3 | H678: 3 | I678: =G678*6+H678 -> 21 | K678: 9 | L678: 7 | M678: =K678*6+L678 -> 61 | O678: 12 | P678: 10 | Q678: =O678*6+P678 -> 82 | W678: WAVERLEY | X678: 8 | Y678: 7 | Z678: 0 | AA678: 1138 | AB678: 1162 | AC678: 97.93 | AD678: 32
A679: BEST PLAYERS | W679: YARRAVILLE | X679: 6 | Y679: 9 | Z679: 0 | AA679: 1480 | AB679: 1513 | AC679: 97.82 | AD679: 24
A680: PORT MELBOURNE | W680: BRUNSWICK | X680: 4 | Y680: 11 | Z680: 0 | AA680: 1132 | AB680: 1374 | AC680: 82.387190684133913 | AD680: 16
A681: WAVERLEY | W681: OAKLEIGH | X681: 4 | Y681: 11 | Z681: 0 | AA681: 1052 | AB681: 1375 | AC681: 76.509090909090915 | AD681: 16
A682: GOALKICKERS | W682: COBURG | X682: 2 | Y682: 13 | Z682: 0 | AA682: 964 | AB682: 1409 | AC682: 68.417317246273953 | AD682: 8
A683: PORT MELBOURNE
A684: WAVERLEY
A686: PRESTON | C686: 1 | D686: 3 | E686: =C686*6+D686 -> 9 | G686: 6 | H686: 7 | I686: =G686*6+H686 -> 43 | K686: 9 | L686: 11 | M686: =K686*6+L686 -> 65 | O686: 14 | P686: 18 | Q686: =O686*6+P686 -> 102
A687: YARRAVILLE | C687: 4 | D687: 5 | E687: =C687*6+D687 -> 29 | G687: 6 | H687: 9 | I687: =G687*6+H687 -> 45 | K687: 12 | L687: 14 | M687: =K687*6+L687 -> 86 | O687: 13 | P687: 17 | Q687: =O687*6+P687 -> 95
A688: BEST PLAYERS
A689: PRESTON
A690: YARRAVILLE
A691: GOALKICKERS
A692: PRESTON
A693: YARRAVILLE
A695: OAKLEIGH | E695: =C695*6+D695 -> 0 | I695: =G695*6+H695 -> 0 | M695: =K695*6+L695 -> 0 | O695: 12 | P695: 11 | Q695: =O695*6+P695 -> 83
A696: BRUNSWICK | E696: =C696*6+D696 -> 0 | I696: =G696*6+H696 -> 0 | M696: =K696*6+L696 -> 0 | O696: 8 | P696: 15 | Q696: =O696*6+P696 -> 63
A697: BEST PLAYERS
A698: OAKLEIGH
A699: BRUNSWICK
A700: GOALKICKERS
A701: OAKLEIGH
A702: BRUNSWICK
A704: DANDENONG | C704: 1 | D704: 2 | E704: =C704*6+D704 -> 8 | G704: 5 | H704: 6 | I704: =G704*6+H704 -> 36 | K704: 10 | L704: 10 | M704: =K704*6+L704 -> 70 | O704: 11 | P704: 12 | Q704: =O704*6+P704 -> 78
A705: COBURG | C705: 2 | D705: 7 | E705: =C705*6+D705 -> 19 | G705: 5 | H705: 10 | I705: =G705*6+H705 -> 40 | K705: 5 | L705: 11 | M705: =K705*6+L705 -> 41 | O705: 7 | P705: 17 | Q705: =O705*6+P705 -> 59
A706: BEST PLAYERS
A707: DANDENONG
A708: COBURG | C708: HUNT | E708: McLACHLAN | H708: VINCENT | K708: JESS | N708: CHALLENGER | Q708: WELSH
A709: GOALKICKERS
A710: DANDENONG
A711: COBURG | C711: HUNT 3 | F711: PALMER | I711: McNABB | K711: HARRISON | N711: HIRST
A713: ROUND 16 | E713: 10TH AUGUST | J713: WEATHER | N713: WEST WIND | S713: PLAYED AT
D714: 1ST QTR | H714: 2ND QTR | L714: 3RD QTR | P714: FINAL | S714: DANDENONG
A715: PRAHRAN | C715: 3 | D715: 1 | E715: =C715*6+D715 -> 19 | G715: 10 | H715: 5 | I715: =G715*6+H715 -> 65 | K715: 12 | L715: 8 | M715: =K715*6+L715 -> 80 | O715: 18 | P715: 9 | Q715: =O715*6+P715 -> 117 | S715: UMPIRE | X715: LADDER | AB715: ROUND | AD715: 16
A716: DANDENONG | C716: 8 | D716: 5 | E716: =C716*6+D716 -> 53 | G716: 10 | H716: 8 | I716: =G716*6+H716 -> 68 | K716: 13 | L716: 13 | M716: =K716*6+L716 -> 91 | O716: 14 | P716: 14 | Q716: =O716*6+P716 -> 98 | S716: BORRACK
A717: BEST PLAYERS | W717: TEAM | X717: W | Y717: L | Z717: D | AA717: FOR | AB717: AGST | AC717: % | AD717: PTS
A718: PRAHRAN | C718: PAYNE | F718: BRADLEY | I718: ORR | L718: CAFFYN | N718: ROSE | Q718: POWER
A719: DANDENONG | C719: MORROW | F719: MILLER | I719: McNAMARA | L719: MELAI | N719: MITCHELL | Q719: EVANS | W719: PRESTON | X719: 13 | Y719: 3 | Z719: 0 | AA719: 1415 | AB719: 1131 | AC719: 125.1105216622458 | AD719: 52
A720: GOALKICKERS | W720: PRAHRAN | X720: 12 | Y720: 4 | Z720: 0 | AA720: 1475 | AB720: 1116 | AC720: 132.17 | AD720: 48
A721: PRAHRAN | C721: POWER 4 | F721: ORR 3 | H721: CAFFYN 3 | J721: RYAN 3 | L721: GRANGE 3 | N721: BRADLEY 2 | W721: DANDENONG | X721: 10 | Y721: 5 | Z721: 1 | AA721: 1387 | AB721: 1151 | AC721: 120.5 | AD721: 42
A722: DANDENONG | C722: MILLER 7 | F722: BETHKE 4 | I722: MELAI 2 | K722: McNAMARA | W722: SANDRINGHAM | X722: 10 | Y722: 6 | Z722: 0 | AA722: 1557 | AB722: 1310 | AC722: 118.85496183206106 | AD722: 40
A724: YARRAVILLE | C724: 6 | D724: 3 | E724: =C724*6+D724 -> 39 | G724: 8 | H724: 5 | I724: =G724*6+H724 -> 53 | K724: 10 | L724: 10 | M724: =K724*6+L724 -> 70 | O724: 15 | P724: 13 | Q724: =O724*6+P724 -> 103 | S724: YARRAVILLE | W724: PORT MELBOURNE | X724: 9 | Y724: 6 | Z724: 1 | AA724: 1472 | AB724: 1321 | AC724: 111.43073429220287 | AD724: 38
A725: WAVERLEY | C725: 5 | D725: 2 | E725: =C725*6+D725 -> 32 | G725: 8 | H725: 8 | I725: =G725*6+H725 -> 56 | K725: 12 | L725: 8 | M725: =K725*6+L725 -> 80 | O725: 13 | P725: 14 | Q725: =O725*6+P725 -> 92 | S725: GARLICK | W725: WAVERLEY | X725: 8 | Y725: 8 | Z725: 0 | AA725: 1230 | AB725: 1265 | AC725: 97.23 | AD725: 32
A726: BEST PLAYERS | W726: YARRAVILLE | X726: 7 | Y726: 9 | Z726: 0 | AA726: 1583 | AB726: 1605 | AC726: 98.63 | AD726: 28
A727: YARRAVILLE | C727: TAURENS | F727: WAGHORNE | I727: HEYME | K727: CONNELLY | N727: KEMP | Q727: ROACH | W727: BRUNSWICK | X727: 4 | Y727: 12 | Z727: 0 | AA727: 1202 | AB727: 1513 | AC727: 79.444811632518181 | AD727: 16
A728: WAVERLEY | C728: ROLFE | F728: ARNOTT | I728: B PARKER | K728: GRANT | N728: LAWSON | Q728: LOCKWOOD | W728: OAKLEIGH | X728: 4 | Y728: 12 | Z728: 0 | AA728: 1113 | AB728: 1477 | AC728: 75.355450236966831 | AD728: 16
A729: GOALKICKERS | R729: TAURENS | W729: COBURG | X729: 2 | Y729: 14 | Z729: 0 | AA729: 997 | AB729: 1542 | AC729: 64.656290531776918 | AD729: 8
A730: YARRAVILLE | C730: KEMP 4 | E730: CASTRIKUM 2 | H730: ROACH 2 | J730: DAVIES 2 | M730: CONNELLY 2 | P730: MADIGAN | R730: McLAUGHLIN
A731: WAVERLEY | C731: B PARKER 4 | F731: WARNER 2 | I731: PRICE 2 | K731: STEPHENS | N731: LAWSON | P731: McNAMEE | R731: GRANT
A733: PORT MELBOURNE | C733: 2 | D733: 2 | E733: =C733*6+D733 -> 14 | G733: 9 | H733: 11 | I733: =G733*6+H733 -> 65 | K733: 12 | L733: 13 | M733: =K733*6+L733 -> 85 | O733: 20 | P733: 19 | Q733: =O733*6+P733 -> 139 | S733: PORT MELBOURNE
A734: BRUNSWICK | C734: 4 | D734: 7 | E734: =C734*6+D734 -> 31 | G734: 6 | H734: 8 | I734: =G734*6+H734 -> 44 | K734: 8 | L734: 8 | M734: =K734*6+L734 -> 56 | O734: 10 | P734: 10 | Q734: =O734*6+P734 -> 70 | S734: DIXON
A735: BEST PLAYERS
A736: PORT MELBOURNE | C736: WISEMAN | F736: ALLEN | I736: BRICE | K736: CAULFIELD | N736: TEAGUE | Q736: BOOTH
A737: BRUNSWICK | C737: LEYDIN | F737: K BURNS | I737: COOK | K737: ROBINSON | N737: BRADLEY | Q737: OGSTON
A738: GOALKICKERS
A739: PORT MELBOURNE | C739: BOOTH 4 | E739: TEAGUE 3 | H739: MCKEW 3 | J739: COLLINS 2 | M739: BRICE 2 | O739: HOWELL 2 | Q739: KERR | R739: PASQUILL | U739: WISEMAN | X739: SCHINCK
A740: BRUNSWICK | C740: COOK 3 | F740: LEYDIN 2 | I740: K BURNS | K740: WROUT | M740: McKINNON | P740: CARTER | R740: BRADLEY
A742: SANDRINGHAM | C742: 4 | D742: 5 | E742: =C742*6+D742 -> 29 | G742: 7 | H742: 12 | I742: =G742*6+H742 -> 54 | K742: 13 | L742: 20 | M742: =K742*6+L742 -> 98 | O742: 13 | P742: 24 | Q742: =O742*6+P742 -> 102 | S742: OAKLEIGH
A743: OAKLEIGH | C743: 1 | D743: 2 | E743: =C743*6+D743 -> 8 | G743: 3 | H743: 6 | I743: =G743*6+H743 -> 24 | K743: 3 | L743: 6 | M743: =K743*6+L743 -> 24 | O743: 9 | P743: 7 | Q743: =O743*6+P743 -> 61 | S743: TOOHEY
A744: BEST PLAYERS
A745: SANDRINGHAM | C745: J WARD | F745: PETHERBRIDGE | I745: HOGAN | K745: WILLIAMS | N745: HAMMOND | Q745: STRACHAN
A746: OAKLEIGH | C746: MURNANE | F746: TEMME | I746: KITTO | K746: LUFF | N746: WOOD | Q746: LYON
A747: GOALKICKERS
A748: SANDRINGHAM | C748: ZEUSCHNER 4 | F748: HOGAN 3 | I748: MACKENZIE 2 | L748: J WARD 2 | N748: HAMMOND | Q748: WILLIAMS
A749: OAKLEIGH | C749: THOMAS 2 | F749: MURNANE 2 | I749: WOOD 2 | K749: MORCOM | M749: JONES | O749: TEMME
A751: PRESTON | C751: 4 | D751: 3 | E751: =C751*6+D751 -> 27 | G751: 8 | H751: 7 | I751: =G751*6+H751 -> 55 | K751: 15 | L751: 9 | M751: =K751*6+L751 -> 99 | O751: 20 | P751: 13 | Q751: =O751*6+P751 -> 133 | S751: PRESTON
A752: COBURG | C752: 1 | D752: 2 | E752: =C752*6+D752 -> 8 | G752: 3 | H752: 5 | I752: =G752*6+H752 -> 23 | K752: 3 | L752: 9 | M752: =K752*6+L752 -> 27 | O752: 4 | P752: 9 | Q752: =O752*6+P752 -> 33 | S752: DUGARD
A753: BEST PLAYERS
A754: PRESTON | C754: TELFORD | F754: HINDMARSH | I754: McLEAN | L754: McARTHUR | O754: VENABLES | R754: DALTON
A755: COBURG | C755: McLACHLAN | F755: CHALLENGER | I755: WELSH | L755: JOHNSON | O755: HIRST | R755: KIRKMAN
A756: GOALKICKERS
A757: PRESTON | C757: VENABLES 5 | F757: HINDMARSH 4 | I757: REID 3 | K757: WESTON 3 | N757: DELLAMARTA 2 | R757: DALTON | T757: HEARD | V757: TELFORD
A758: COBURG | C758: CHALLENGER 3 | F758: JACKSON
A760: ROUND 17 | E760: 17TH AUGUST | J760: WEATHER | N760: NORTH WEST WIND | S760: PLAYED AT
D761: 1ST QTR | H761: 2ND QTR | L761: 3RD QTR | P761: FINAL | S761: TOORAK PARK
A762: PRAHRAN | C762: 1 | D762: 8 | E762: =C762*6+D762 -> 14 | G762: 4 | H762: 10 | I762: =G762*6+H762 -> 34 | K762: 9 | L762: 13 | M762: =K762*6+L762 -> 67 | O762: 13 | P762: 13 | Q762: =O762*6+P762 -> 91 | S762: UMPIRE | X762: LADDER | AB762: ROUND | AD762: 17
A763: PORT MELBOURNE | C763: 3 | D763: 4 | E763: =C763*6+D763 -> 22 | G763: 5 | H763: 11 | I763: =G763*6+H763 -> 41 | K763: 8 | L763: 12 | M763: =K763*6+L763 -> 60 | O763: 11 | P763: 18 | Q763: =O763*6+P763 -> 84 | S763: TOOHEY
A764: BEST PLAYERS | W764: TEAM | X764: W | Y764: L | Z764: D | AA764: FOR | AB764: AGST | AC764: % | AD764: PTS
A765: PRAHRAN | C765: POWER | F765: CULPIN | I765: HUTCHESSON | L765: ROSE | N765: WATSON | Q765: CAFFYN
A766: PORT MELBOURNE | C766: BOOTH | F766: RENOUF | I766: CAULFIELD | L766: TEAGUE | N766: ALLEN | Q766: SCHMIDT | W766: PRESTON | X766: 14 | Y766: 3 | Z766: 0 | AA766: 1554 | AB766: 1203 | AC766: 129.17705735660849 | AD766: 56
A767: GOALKICKERS | W767: PRAHRAN | X767: 13 | Y767: 4 | Z767: 0 | AA767: 1566 | AB767: 1200 | AC767: 130.5 | AD767: 52
A768: PRAHRAN | C768: POWER 7 | F768: CAFFYN 4 | I768: GRANGE | K768: RYAN | W768: DANDENONG | X768: 11 | Y768: 5 | Z768: 1 | AA768: 1538 | AB768: 1250 | AC768: 123.04 | AD768: 46
A769: PORT MELBOURNE | C769: HOWELL 4 | F769: ROWLANDS 2 | I769: PASQUILL 2 | L769: TEAGUE | N769: BOOTH | P769: McKEW | W769: SANDRINGHAM | X769: 11 | Y769: 6 | Z769: 0 | AA769: 1676 | AB769: 1373 | AC769: 122.06846321922797 | AD769: 44
A771: SANDRINGHAM | C771: 9 | D771: 3 | E771: =C771*6+D771 -> 57 | G771: 14 | H771: 4 | I771: =G771*6+H771 -> 88 | K771: 15 | L771: 9 | M771: =K771*6+L771 -> 99 | O771: 18 | P771: 11 | Q771: =O771*6+P771 -> 119 | S771: BEACH ROAD | W771: PORT MELBOURNE | X771: 9 | Y771: 7 | Z771: 1 | AA771: 1556 | AB771: 1412 | AC771: 110.19830028328612 | AD771: 38
A772: WAVERLEY | C772: 1 | D772: 6 | E772: =C772*6+D772 -> 12 | G772: 7 | H772: 3 | I772: =G772*6+H772 -> 45 | K772: 7 | L772: 4 | M772: =K772*6+L772 -> 46 | O772: 8 | P772: 15 | Q772: =O772*6+P772 -> 63 | S772: TURNER | W772: YARRAVILLE | X772: 8 | Y772: 9 | Z772: 0 | AA772: 1678 | AB772: 1687 | AC772: 99.47 | AD772: 32
A773: BEST PLAYERS | W773: WAVERLEY | X773: 8 | Y773: 9 | Z773: 0 | AA773: 1293 | AB773: 1384 | AC773: 93.42 | AD773: 32
A774: SANDRINGHAM | C774: PETHERBRIDGE | F774: ZEUSCHNER | I774: WILLIAMS | L774: J WARD | N774: B WARD | Q774: HOGAN | W774: BRUNSWICK | X774: 4 | Y774: 13 | Z774: 0 | AA774: 1301 | AB774: 1664 | AC774: 78.18509615384616 | AD774: 16
A775: WAVERLEY | C775: WARNER | F775: LAWSON | I775: PARKER | L775: McNAMEE | N775: STEPHENS | Q775: R HORKINGS | W775: OAKLEIGH | X775: 4 | Y775: 13 | Z775: 0 | AA775: 1185 | AB775: 1616 | AC775: 73.329207920792072 | AD775: 16
A776: GOALKICKERS | W776: COBURG | X776: 2 | Y776: 15 | Z776: 0 | AA776: 1079 | AB776: 1637 | AC776: 65.91325595601711 | AD776: 8
A777: SANDRINGHAM | C777: ZEUSHNER 6 | F777: WILLIAMS 5 | I777: J WARD 4 | L777: HOGAN 2 | O777: SHARROCK
A778: WAVERLEY | C778: WARNER 4 | F778: ALLAN | I778: STEPHENS | L778: R HORKINGS | O778: LAWSON
A780: YARRAVILLE | C780: 3 | D780: 8 | E780: =C780*6+D780 -> 26 | G780: 8 | H780: 9 | I780: =G780*6+H780 -> 57 | K780: 12 | L780: 17 | M780: =K780*6+L780 -> 89 | O780: 13 | P780: 17 | Q780: =O780*6+P780 -> 95 | S780: COBURG
A781: COBURG | C781: 3 | D781: 2 | E781: =C781*6+D781 -> 20 | G781: 8 | H781: 10 | I781: =G781*6+H781 -> 58 | K781: 10 | L781: 11 | M781: =K781*6+L781 -> 71 | O781: 11 | P781: 16 | Q781: =O781*6+P781 -> 82 | S781: JACKSON
A782: BEST PLAYERS
A783: YARRAVILLE | C783: DAVIES | F783: WAGHORNE | I783: MADIGAN | L783: ROACH | O783: GUNTHER | R783: HEYME
A784: COBURG | C784: HIRST | F784: KIRKMAN | I784: THOMPSON | L784: CHALLENGER | O784: McLACHLAN | R784: FIELD
A785: GOALKICKERS
A786: YARRAVILLE | C786: DAVIES 3 | F786: GUNTHER 3 | I786: KEMP 2 | K786: MADIGAN 2 | N786: CONNELLY | Q786: WAGHORNE | T786: CASTRIKUM
A787: COBURG | C787: HIRST 5 | F787: SCHULZ 2 | I787: THOMPSON | K787: HARRISON | N787: CHALLENGER | Q787: NICHOL
A789: DANDENONG | C789: 5 | D789: 11 | E789: =C789*6+D789 -> 41 | G789: 7 | H789: 14 | I789: =G789*6+H789 -> 56 | K789: 14 | L789: 22 | M789: =K789*6+L789 -> 106 | O789: 21 | P789: 25 | Q789: =O789*6+P789 -> 151 | S789: DANDENONG
A790: BRUNSWICK | C790: 4 | D790: 1 | E790: =C790*6+D790 -> 25 | G790: 8 | H790: 5 | I790: =G790*6+H790 -> 53 | K790: 9 | L790: 5 | M790: =K790*6+L790 -> 59 | O790: 15 | P790: 9 | Q790: =O790*6+P790 -> 99 | S790: DUGARD
A791: BEST PLAYERS
A792: DANDENONG | C792: MELAI | F792: EVANS | I792: MORROW | L792: MITCHELL | O792: MILLER | R792: McNAMARA
A793: BRUNSWICK | C793: COOK | F793: BRADLEY | I793: KICK | L793: McKINNON | O793: WALTON | R793: LEYDIN
A794: GOALKICKERS
A795: DANDENONG | C795: MILLER 7 | F795: MELAI 4 | I795: FLAHERTY 3 | L795: ANDREWS 2 | O795: OSBORNE 2 | R795: McNAMARA | U795: BETHKE | X795: CROFT
A796: BRUNSWICK | C796: COOK 8 | F796: BRADLEY 3 | I796: McKINNON 2 | L796: WALTON | O796: NOONAN
A798: PRESTON | C798: 5 | D798: 4 | E798: =C798*6+D798 -> 34 | G798: 11 | H798: 8 | I798: =G798*6+H798 -> 74 | K798: 15 | L798: 14 | M798: =K798*6+L798 -> 104 | O798: 20 | P798: 19 | Q798: =O798*6+P798 -> 139 | S798: OAKLEIGH
A799: OAKLEIGH | C799: 2 | D799: 2 | E799: =C799*6+D799 -> 14 | G799: 5 | H799: 6 | I799: =G799*6+H799 -> 36 | K799: 9 | L799: 8 | M799: =K799*6+L799 -> 62 | O799: 10 | P799: 12 | Q799: =O799*6+P799 -> 72 | S799: McMASTER
A800: BEST PLAYERS
A801: PRESTON | C801: JOYCE | F801: REID | I801: TELFORD | L801: McARTHUR | O801: HINDMARSH | R801: VENABLES
A802: OAKLEIGH | C802: MURNANE | F802: GODDARD | I802: GARNER | L802: JONES | O802: LUFF | R802: WOOD
A803: GOALKICKERS
A804: PRESTON | C804: JOYCE 4 | F804: VENABLES 4 | I804: REID 3 | K804: DELLAMARTA 3 | N804: DALTON 2 | Q804: HEARD 2 | S804: TELFORD | V804: GOAD
A805: OAKLEIGH | C805: JONES 4 | F805: CUMMINGS 3 | I805: MURNANE 2 | L805: THOMAS
A807: ROUND 18 | E807: 24TH AUGUST | J807: WEATHER | N807: NORTH WEST WIND | S807: PLAYED AT
D808: 1ST QTR | H808: 2ND QTR | L808: 3RD QTR | P808: FINAL | S808: PRESTON
A809: PRESTON | C809: 6 | D809: 7 | E809: =C809*6+D809 -> 43 | G809: 8 | H809: 8 | I809: =G809*6+H809 -> 56 | K809: 12 | L809: 10 | M809: =K809*6+L809 -> 82 | O809: 14 | P809: 10 | Q809: =O809*6+P809 -> 94 | S809: UMPIRE | X809: LADDER | AB809: ROUND | AD809: 18
A810: PRAHRAN | C810: 2 | D810: 0 | E810: =C810*6+D810 -> 12 | G810: 9 | H810: 6 | I810: =G810*6+H810 -> 60 | K810: 9 | L810: 6 | M810: =K810*6+L810 -> 60 | O810: 13 | P810: 7 | Q810: =O810*6+P810 -> 85 | S810: TURNER
A811: BEST PLAYERS | W811: TEAM | X811: W | Y811: L | Z811: D | AA811: FOR | AB811: AGST | AC811: % | AD811: PTS
A812: PRESTON | C812: TELFORD | F812: JOYCE | I812: REID | L812: HINDMARSH | O812: McLEAN | R812: HEARD
A813: PRAHRAN | C813: ALBISTON | F813: CULPIN | I813: RAEBURN | L813: ROSE | O813: STEWART | R813: HUTCHESSON | W813: PRESTON | X813: 15 | Y813: 3 | Z813: 0 | AA813: 1648 | AB813: 1288 | AC813: 127.95031055900621 | AD813: 60
A814: GOALKICKERS | P814: VENABLES | W814: PRAHRAN | X814: 13 | Y814: 5 | Z814: 0 | AA814: 1651 | AB814: 1294 | AC814: 127.59 | AD814: 52
A815: PRESTON | C815: REID 2 | E815: WESTON 2 | H815: DALTON 2 | J815: HEARD 2 | L815: HINDMARSH 2 | O815: GOAD | Q815: TELFORD | S815: G PERRY | W815: SANDRINGHAM | X815: 12 | Y815: 6 | Z815: 0 | AA815: 1792 | AB815: 1435 | AC815: 124.8780487804878 | AD815: 48
A816: PRAHRAN | C816: BARTLETT 3 | F816: POWER 3 | I816: HUTCHESSON 3 | L816: ALBISTON 2 | O816: BRADLEY | Q816: RYAN | W816: DANDENONG | X816: 11 | Y816: 6 | Z816: 1 | AA816: 1600 | AB816: 1315 | AC816: 121.67 | AD816: 46
A818: YARRAVILLE | C818: 2 | D818: 7 | E818: =C818*6+D818 -> 19 | G818: 3 | H818: 11 | I818: =G818*6+H818 -> 29 | K818: 7 | L818: 20 | M818: =K818*6+L818 -> 62 | O818: 7 | P818: 23 | Q818: =O818*6+P818 -> 65 | S818: YARRAVILLE | W818: PORT MELBOURNE | X818: 10 | Y818: 7 | Z818: 1 | AA818: 1702 | AB818: 1480 | AC818: 115 | AD818: 42
A819: DANDENONG | C819: 2 | D819: 4 | E819: =C819*6+D819 -> 16 | G819: 3 | H819: 13 | I819: =G819*6+H819 -> 31 | K819: 4 | L819: 14 | M819: =K819*6+L819 -> 38 | O819: 7 | P819: 20 | Q819: =O819*6+P819 -> 62 | S819: TOOHEY | W819: YARRAVILLE | X819: 9 | Y819: 9 | Z819: 0 | AA819: 1743 | AB819: 1749 | AC819: 99.66 | AD819: 36
A820: BEST PLAYERS | W820: WAVERLEY | X820: 9 | Y820: 9 | Z820: 0 | AA820: 1400 | AB820: 1436 | AC820: 97.49 | AD820: 36
A821: YARRAVILLE | C821: BONGETTI | F821: CHARLES | I821: KEMP | L821: HEYME | O821: ROACH | Q821: WARWICK | W821: BRUNSWICK | X821: 4 | Y821: 14 | Z821: 0 | AA821: 1363 | AB821: 1780 | AC821: 76.573033707865164 | AD821: 16
A822: DANDENONG | C822: EVANS | F822: STAUNTON | I822: ANDREWS | L822: OSBORNE | O822: CROSS | Q822: McNAMARA | W822: OAKLEIGH | X822: 4 | Y822: 14 | Z822: 0 | AA822: 1253 | AB822: 1762 | AC822: 71.112372304199766 | AD822: 16
A823: GOALKICKERS | W823: COBURG | X823: 2 | Y823: 16 | Z823: 0 | AA823: 1131 | AB823: 1744 | AC823: 64.850917431192656 | AD823: 8
A824: YARRAVILLE | C824: KEMP 5 | F824: CASTRIKUM | I824: GUNTHER
A825: DANDENONG | C825: MILLER 3 | F825: MITCHELL 2 | I825: EVANS | K825: ANDREWS
A827: WAVERLEY | C827: 0 | D827: 3 | E827: =C827*6+D827 -> 3 | G827: 7 | H827: 8 | I827: =G827*6+H827 -> 50 | K827: 8 | L827: 12 | M827: =K827*6+L827 -> 60 | O827: 14 | P827: 23 | Q827: =O827*6+P827 -> 107 | S827: WAVERLEY
A828: COBURG | C828: 3 | D828: 2 | E828: =C828*6+D828 -> 20 | G828: 5 | H828: 6 | I828: =G828*6+H828 -> 36 | K828: 7 | L828: 10 | M828: =K828*6+L828 -> 52 | O828: 7 | P828: 10 | Q828: =O828*6+P828 -> 52 | S828: HOLZER
A829: BEST PLAYERS
A830: WAVERLEY | C830: ROLFE | F830: McKENZIE | I830: STEPHENS | L830: MORDEN | N830: DOYLE | Q830: R HORKINGS
A831: COBURG | C831: CHALLENGER | F831: SCHULZ | I831: McLACHLAN | L831: WELSH | N831: BOSCHEN | Q831: PALMER
A832: GOALKICKERS
A833: WAVERLEY | C833: STEPHENS 4 | F833: WARNER 3 | I833: McKENZIE 2 | L833: HAHN 2 | N833: ALLAN | P833: R HORKINGS | S833: LAWSON
A834: COBURG | C834: VINCENT 2 | F834: HIRST | H834: HARRISON | K834: SCHULZ | M834: CHALLENGER | P834: THOMPSON
A836: SANDRINGHAM | C836: 0 | D836: 3 | E836: =C836*6+D836 -> 3 | G836: 8 | H836: 8 | I836: =G836*6+H836 -> 56 | K836: 12 | L836: 9 | M836: =K836*6+L836 -> 81 | O836: 17 | P836: 14 | Q836: =O836*6+P836 -> 116 | S836: BRUNSWICK
A837: BRUNSWICK | C837: 3 | D837: 3 | E837: =C837*6+D837 -> 21 | G837: 4 | H837: 3 | I837: =G837*6+H837 -> 27 | K837: 6 | L837: 6 | M837: =K837*6+L837 -> 42 | O837: 9 | P837: 8 | Q837: =O837*6+P837 -> 62 | S837: GARLICK
A838: BEST PLAYERS
A839: SANDRINGHAM | C839: J WARD | F839: B WARD | I839: SELLECK | L839: WILLIAMS | O839: PETHERBRIDGE | S839: MACKENZIE
A840: BRUNSWICK | C840: McGHIE | F840: K BURNS | I840: GREIG | L840: COUGHLAN | O840: WILSON | S840: LEYDIN
A841: GOALKICKERS
A842: SANDRINGHAM | C842: ZEUSCHNER 3 | F842: HOGAN 3 | I842: WILLIAMS 3 | L842: WESTON 2 | N842: SHARROCK 2 | Q842: J WARD | S842: MACKENZIE | V842: FENTON | X842: K WILLS
A843: BRUNSWICK | C843: WALTON 2 | F843: PENDLEBURY 2 | J843: K BURNS 2 | M843: WHELAN | O843: LEYDIN | Q843: BRADLEY
A845: PORT MELBOURNE | C845: 6 | D845: 4 | E845: =C845*6+D845 -> 40 | G845: 9 | H845: 8 | I845: =G845*6+H845 -> 62 | K845: 21 | L845: 10 | M845: =K845*6+L845 -> 136 | O845: 22 | P845: 14 | Q845: =O845*6+P845 -> 146 | S845: PORT MELBOURNE
A846: OAKLEIGH | C846: 0 | D846: 2 | E846: =C846*6+D846 -> 2 | G846: 4 | H846: 5 | I846: =G846*6+H846 -> 29 | K846: 6 | L846: 8 | M846: =K846*6+L846 -> 44 | O846: 9 | P846: 14 | Q846: =O846*6+P846 -> 68 | S846: DUGARD
A847: BEST PLAYERS
A848: PORT MELBOURNE | C848: COLLINS | F848: RENOUF | I848: TEAGUE | L848: WISEMAN | O848: McKEW | R848: GOSS
A849: OAKLEIGH | C849: MURNANE | F849: LUFF | I849: C RITCHIE | L849: MORCOM | O849: WAPLING
A850: GOALKICKERS
A851: PORT MELBOURNE | C851: TEAGUE 6 | F851: GOSS 4 | H851: HOWELL 3 | J851: COLLINS 3 | M851: McKEW 2 | O851: BOOTH 2 | Q851: ANDERSON 2
A852: OAKLEIGH | C852: WAPLING 2 | F852: MORCOM 2 | I852: THOMAS | K852: MURNANE | M852: EDWARDS | O852: JONES | Q852: GARNER
A854: FINALS
A855: 1ST SEMI | D855: 1ST SEPTEMBER | J855: WEATHER | M855: NORTH WEST WIND RAIN
D856: 1ST QTR | H856: 2ND QTR | L856: 3RD QTR | P856: FINAL
A857: SANDRINGHAM | C857: 6 | D857: 2 | E857: =C857*6+D857 -> 38 | G857: 12 | H857: 8 | I857: =G857*6+H857 -> 80 | K857: 15 | L857: 11 | M857: =K857*6+L857 -> 101 | O857: 20 | P857: 13 | Q857: =O857*6+P857 -> 133 | S857: PUNT ROAD
A858: DANDENONG | C858: 3 | D858: 7 | E858: =C858*6+D858 -> 25 | G858: 8 | H858: 11 | I858: =G858*6+H858 -> 59 | K858: 11 | L858: 17 | M858: =K858*6+L858 -> 83 | O858: 11 | P858: 19 | Q858: =O858*6+P858 -> 85 | S858: TURNER
A859: BEST PLAYERS
A860: SANDRINGHAM | C860: ZEUSCHNER | F860: PETHERBRIDGE | I860: SHARROCK | L860: HOGAN | O860: WILLIAMS | R860: B WARD
A861: DANDENONG | C861: EVANS | F861: MILLER | I861: ANDREWS | L861: MORROW | O861: ABRAHAM | R861: MITCHELL
A862: GOALKICKERS
A863: SANDRINGHAM | C863: ZEUSCHNER 8 | F863: HOGAN 6 | I863: WILLIAMS 2 | L863: J WARD | N863: WESTON | Q863: MACKENZIE | T863: ADDISON
A864: DANDENONG | C864: MILLER 4 | F864: BETHKE 2 | I864: FLAHERTY 2 | L864: MORROW | N864: ANDREWS | Q864: ABRAHAM
A866: 2ND SEMI | D866: 8TH SEPTEMBER | J866: WEATHER | M866: SOUTH WEST WIND FINE
A867: PRAHRAN | C867: 8 | D867: 8 | E867: =C867*6+D867 -> 56 | G867: 8 | H867: 11 | I867: =G867*6+H867 -> 59 | K867: 13 | L867: 13 | M867: =K867*6+L867 -> 91 | O867: 18 | P867: 15 | Q867: =O867*6+P867 -> 123 | S867: PUNT ROAD
A868: PRESTON | C868: 1 | D868: 6 | E868: =C868*6+D868 -> 12 | G868: 4 | H868: 7 | I868: =G868*6+H868 -> 31 | K868: 8 | L868: 11 | M868: =K868*6+L868 -> 59 | O868: 13 | P868: 17 | Q868: =O868*6+P868 -> 95 | S868: TOOHEY
A869: BEST PLAYERS
A870: PRAHRAN | C870: CAFFYN | F870: ROSE | I870: DICKESON | L870: HUTCHESSON | O870: ALBISTON | R870: WILLIAMS
A871: PRESTON | C871: HEARD | F871: REID | I871: WESTON | L871: TELFORD | O871: McKERNAN | R871: DALTON
A872: GOALKICKERS
A873: PRAHRAN | C873: CAFFYN 7 | F873: POWER 4 | I873: PAYNE 3 | K873: BRADLEY | M873: BARTLETT | P873: ORR | R873: HUTCHESSON
A874: PRESTON | C874: DALTON 3 | F874: WESTON 2 | I874: HEARD 2 | K874: VENABLES 2 | N874: JOYCE | P874: McBEAN | R874: McLEAN | U874: G PERRY
A876: PRELIMINARY FINAL | F876: 15TH SEPTEMBER | K876: WEATHER | O876: EAST BREEZE
A877: PRESTON | C877: 9 | D877: 5 | E877: =C877*6+D877 -> 59 | G877: 12 | H877: 6 | I877: =G877*6+H877 -> 78 | K877: 18 | L877: 9 | M877: =K877*6+L877 -> 117 | O877: 22 | P877: 11 | Q877: =O877*6+P877 -> 143 | S877: PUNT ROAD
A878: SANDRINGHAM | C878: 3 | D878: 4 | E878: =C878*6+D878 -> 22 | G878: 10 | H878: 2 | I878: =G878*6+H878 -> 62 | K878: 13 | L878: 6 | M878: =K878*6+L878 -> 84 | O878: 18 | P878: 7 | Q878: =O878*6+P878 -> 115 | S878: O'NEILL
A879: BEST PLAYERS
A880: PRESTON | C880: JOYCE | F880: TELFORD | I880: DALTON | L880: GOAD | O880: REID | R880: McLEAN
A881: SANDRINGHAM | C881: SHARROCK | F881: B WARD | I881: HAMMOND | L881: VAUGHAN | O881: ZEUSCHNER | R881: K WILLS
A882: GOALKICKERS
A883: PRESTON | C883: JOYCE 9 | F883: DALTON 5 | I883: WESTON 3 | K883: TELFORD 2 | N883: LEMPRIERE | Q883: HEARD | S883: CORBETT
A884: SANDRINGHAM | C884: ZEUSCHNER 6 | F884: WESTON 2 | I884: J WARD 2 | L884: SMITH 2 | N884: HANCE | P884: MACKENZIE | S884: VAUGHAN | V884: ADDISON | X884: HOGAN | Z884: SHARROCK
A886: GRAND FINAL | E886: 22ND SEPTEMBER | J886: WEATHER | N886: NORTH WIND
A887: PRESTON | C887: 4 | D887: 3 | E887: 27 | G887: 8 | H887: 4 | I887: 52 | K887: 12 | L887: 8 | M887: 80 | O887: 15 | P887: 8 | Q887: =O887*6+P887 -> 98 | S887: PUNT ROAD
A888: PRAHRAN | C888: 2 | D888: 3 | E888: 15 | G888: 7 | H888: 9 | I888: 51 | K888: 10 | L888: 10 | M888: 70 | O888: 12 | P888: 12 | Q888: =O888*6+P888 -> 84 | S888: O'NEILL
A889: BEST PLAYERS
A890: PRESTON | C890: HEARD | F890: McKERNAN | I890: TELFORD | L890: JOYCE | O890: McLEAN | R890: REID
A891: PRAHRAN | C891: PAYNE | F891: ORR | I891: ROSE | L891: ALBISTON | O891: DICKESON | R891: POWER
A892: GOALKICKERS
A893: PRESTON | C893: JOYCE 5 | F893: DALTON 3 | I893: LEMPRIERE 2 | L893: WESTON 2 | O893: REID | Q893: HEARD | S893: CORBETT
A894: PRAHRAN | C894: POWER 6 | F894: BARTLETT 3 | I894: PAYNE 2 | L894: ROSE
A896: REPRESENTATIVE MATCHES | H896: 26TH JUNE | L896: WEATHER
D897: 1ST QTR | H897: 2ND QTR | L897: 3RD QTR | P897: FINAL
A898: V.F.A. | C898: 3 | D898: 2 | E898: =C898*6+D898 -> 20 | G898: 13 | H898: 3 | I898: =G898*6+H898 -> 81 | K898: 17 | L898: 9 | M898: =K898*6+L898 -> 111 | O898: 21 | P898: 16 | Q898: =O898*6+P898 -> 142 | S898: MANUKA OVAL
A899: CANBERRA | C899: 1 | D899: 6 | E899: =C899*6+D899 -> 12 | G899: 2 | H899: 11 | I899: =G899*6+H899 -> 23 | K899: 3 | L899: 13 | M899: =K899*6+L899 -> 31 | O899: 6 | P899: 15 | Q899: =O899*6+P899 -> 51 | S899: GRANT
A900: BEST PLAYERS
A901: V.F.A. | C901: BRYANT | F901: BEARD | I901: PETHERBRIDGE | L901: SZYSKA | O901: ABRAHAM
A902: CANBERRA | C902: HILTON | F902: O'TOOLE | I902: SMITH | L902: FELTHAM | O902: BLACK
A903: GOALKICKERS
A904: V.F.A. | C904: SZYSKA 10 | F904: BEARD 6 | I904: BENSON 2 | L904: BRUSHFIELD | O904: BRYANT | Q904: LAWSON
A905: CANBERRA | C905: O'TOOLE 3 | F905: FELTHAM | I905: DONOVAN | L905: McNEIL
E907: 30TH JUNE | I907: WEATHER
A908: V.F.A. | C908: 5 | D908: 2 | E908: =C908*6+D908 -> 32 | G908: 12 | H908: 4 | I908: =G908*6+H908 -> 76 | K908: 14 | L908: 10 | M908: =K908*6+L908 -> 94 | O908: 19 | P908: 15 | Q908: =O908*6+P908 -> 129 | S908: YORK PARK
A909: TASMANIA | C909: 5 | D909: 2 | E909: =C909*6+D909 -> 32 | G909: 10 | H909: 3 | I909: =G909*6+H909 -> 63 | K909: 14 | L909: 4 | M909: =K909*6+L909 -> 88 | O909: 18 | P909: 8 | Q909: =O909*6+P909 -> 116
A910: BEST PLAYERS
A911: V.F.A. | C911: ROLFE | F911: WATSON | I911: BARTLETT | L911: MORROW | O911: PAPLEY | R911: SZYSKA
A912: TASMANIA | C912: DEVINE | F912: LAWRENCE | I912: SHEPPARD | L912: DUNN | O912: VINAR | R912: LEE
A913: GOALKICKERS
A914: V.F.A. | C914: SZYSKA 5 | F914: BARTLETT 4 | I914: MORROW 3 | L914: MITCHELL 2 | O914: BOSCHEN 2 | R914: LAWSON 2 | U914: ABRAHAM
A915: TASMANIA | C915: KING 4 | F915: DEVINE 4 | I915: MILLS 3 | K915: DUNN 2 | M915: PAYNE 2 | O915: BAKER | Q915: LEE | S915: HEWITT