A1: Victorian Football Association
A2: Season 1969 - Division One
A3: © Copyright Wal Williams | F3: First created: 2 May 2015
A4: Contact: joywalwi at gmail dot com | F4: Last updated: 2 May 2015 | W4: VFA Results and tables - Link to the main index page
A5: You are free to copy this document in whole or part provided that proper acknowledgement is given to the author. All rights reserved.
A7: 1969 V.F.A. SEASON 1ST DIVISION | CA7: \D | CB7: {GOTO}BJ3~/M{RIGHT 7}{END}{DOWN}~G4~
A8: ROUND 1 | E8: 13TH APRIL | J8: WEATHER | N8: SOUTH WIND | S8: PLAYED AT | CB8: {GOTO}AL3~/M{END}{RIGHT}{END}{DOWN}~P3~
D9: 1ST QTR | H9: 2ND QTR | L9: 3RD QTR | P9: FINAL | S9: WAVERLEY | CB9: {GOTO}BJ23~/M{RIGHT 7}{END}{DOWN}~V4~
A10: WAVERLEY | C10: 4 | D10: 6 | E10: =C10*6+D10 -> 30 | G10: 7 | H10: 7 | I10: =G10*6+H10 -> 49 | K10: 15 | L10: 15 | M10: =K10*6+L10 -> 105 | O10: 17 | P10: 20 | Q10: =O10*6+P10 -> 122 | S10: UMPIRE | X10: LADDER | AB10: ROUND | AD10: 1 | CB10: {GOTO}BJ43~/M{RIGHT 7}{END}{DOWN}~G24~
A11: DANDENONG | C11: 3 | D11: 1 | E11: =C11*6+D11 -> 19 | G11: 8 | H11: 3 | I11: =G11*6+H11 -> 51 | K11: 9 | L11: 4 | M11: =K11*6+L11 -> 58 | O11: 11 | P11: 8 | Q11: =O11*6+P11 -> 74 | S11: DUGARD | CB11: {GOTO}AL23~/M{END}{RIGHT}{END}{DOWN}~P23~
A12: BEST PLAYERS | W12: TEAM | X12: W | Y12: L | Z12: D | AA12: FOR | AB12: AGST | AC12: % | AD12: PTS | CB12: {GOTO}BJ63~/M{RIGHT 7}{END}{DOWN}~V24~
A13: WAVERLEY | C13: LAWSON | F13: ALLAN | I13: BELL | L13: BLEW | N13: POORE | Q13: WARNER | CB13: {GOTO}BJ83~/M{RIGHT 7}{END}{DOWN}~G44~
A14: DANDENONG | C14: ABRAHAM | F14: NANKERVIS | I14: McNAMARA | L14: ANDREWS | N14: MORROW | Q14: BETHKE | W14: PORT MELBOURNE | X14: 1 | Y14: 0 | Z14: 0 | AA14: 126 | AB14: 40 | AC14: 315 | AD14: 4 | CB14: {GOTO}AL43~/M{END}{RIGHT}{END}{DOWN}~P43~
A15: GOALKICKERS | W15: YARRAVILLE | X15: 1 | Y15: 0 | Z15: 0 | AA15: 143 | AB15: 77 | AC15: 185.71428571428572 | AD15: 4 | CB15: {GOTO}BJ103~/M{RIGHT 7}{END}{DOWN}~V44~
A16: WAVERLEY | C16: LAWSON 5 | F16: POORE 4 | H16: ALLAN 3 | J16: STEPHENS 2 | M16: R HORKINGS 2 | P16: WARNER | W16: WAVERLEY | X16: 1 | Y16: 0 | Z16: 0 | AA16: 122 | AB16: 74 | AC16: 164.86486486486487 | AD16: 4 | CB16: {GOTO}BJ123~/M{RIGHT 7}{END}{DOWN}~G64~
A17: DANDENONG | C17: MILLER 3 | F17: NANKERVIS 3 | I17: ANDREWS 2 | L17: MELAI | N17: ROBERTSON | Q17: EMBON | W17: PRESTON | X17: 1 | Y17: 0 | Z17: 0 | AA17: 108 | AB17: 88 | AC17: 122.72727272727273 | AD17: 4 | CB17: {GOTO}AL63~/M{END}{RIGHT}{END}{DOWN}~P63~
CB18: {GOTO}BJ143~/M{RIGHT 7}{END}{DOWN}~V64~
A19: YARRAVILLE | C19: 9 | D19: 3 | E19: =C19*6+D19 -> 57 | G19: 15 | H19: 4 | I19: =G19*6+H19 -> 94 | K19: 19 | L19: 9 | M19: =K19*6+L19 -> 123 | O19: 22 | P19: 11 | Q19: =O19*6+P19 -> 143 | S19: YARRAVILLE | W19: SANDRINGHAM | X19: 1 | Y19: 0 | Z19: 0 | AA19: 75 | AB19: 63 | AC19: 119.04761904761905 | AD19: 4 | CB19: {GOTO}BJ163~/M{RIGHT 7}{END}{DOWN}~G84~
A20: GEELONG WEST | C20: 1 | D20: 3 | E20: =C20*6+D20 -> 9 | G20: 6 | H20: 6 | I20: =G20*6+H20 -> 42 | K20: 7 | L20: 7 | M20: =K20*6+L20 -> 49 | O20: 11 | P20: 11 | Q20: =O20*6+P20 -> 77 | S20: O'NEILL | W20: BRUNSWICK | X20: 0 | Y20: 1 | Z20: 0 | AA20: 63 | AB20: 75 | AC20: 84 | AD20: 0 | CB20: {GOTO}AL83~/M{END}{RIGHT}{END}{DOWN}~P83~
A21: BEST PLAYERS | W21: PRAHRAN | X21: 0 | Y21: 1 | Z21: 0 | AA21: 88 | AB21: 108 | AC21: 81.481481481481481 | AD21: 0 | CB21: {GOTO}BJ183~/M{RIGHT 7}{END}{DOWN}~V84~
A22: YARRAVILLE | C22: DAVIES | F22: CASTRIKUM | I22: TAURENS | K22: MATHESON | N22: BARR | Q22: HERIOT | W22: DANDENONG | X22: 0 | Y22: 1 | Z22: 0 | AA22: 74 | AB22: 122 | AC22: 60.655737704918032 | AD22: 0 | CB22: {GOTO}BJ203~/M{RIGHT 7}{END}{DOWN}~G104~
A23: GEELONG WEST | C23: BARRY | F23: O'DONNELL | I23: FRY | K23: TENABEL | N23: WILLIAMS | Q23: SMITH | W23: GEELONG WEST | X23: 0 | Y23: 1 | Z23: 0 | AA23: 77 | AB23: 143 | AC23: 53.846153846153847 | AD23: 0 | CB23: {GOTO}AL103~/M{END}{RIGHT}{END}{DOWN}~P103~
A24: GOALKICKERS | W24: OAKLEIGH | X24: 0 | Y24: 1 | Z24: 0 | AA24: 40 | AB24: 126 | AC24: 31.746031746031747 | AD24: 0 | CB24: {GOTO}BJ223~/M{RIGHT 7}{END}{DOWN}~V104~
A25: YARRAVILLE | C25: KEMP 6 | F25: DAVIES 4 | I25: HERIOT 4 | K25: MATHESON 3 | N25: WAGHORN 3 | Q25: BURGE 2 | CB25: {GOTO}BJ243~/M{RIGHT 7}{END}{DOWN}~G124~
A26: GEELONG WEST | C26: O'DONNELL 4 | F26: JULIEN 3 | I26: BARRY 2 | K26: TENABEL 2 | CB26: {GOTO}AL123~/M{END}{RIGHT}{END}{DOWN}~P123~
CB27: {GOTO}BJ263~/M{RIGHT 7}{END}{DOWN}~V124~
A28: PRESTON | C28: 2 | D28: 6 | E28: =C28*6+D28 -> 18 | G28: 5 | H28: 11 | I28: =G28*6+H28 -> 41 | K28: 11 | L28: 14 | M28: =K28*6+L28 -> 80 | O28: 15 | P28: 18 | Q28: =O28*6+P28 -> 108 | S28: TOORAK PARK | CB28: {GOTO}BJ283~/M{RIGHT 7}{END}{DOWN}~G144~
A29: PRAHRAN | C29: 3 | D29: 4 | E29: =C29*6+D29 -> 22 | G29: 7 | H29: 5 | I29: =G29*6+H29 -> 47 | K29: 10 | L29: 7 | M29: =K29*6+L29 -> 67 | O29: 13 | P29: 10 | Q29: =O29*6+P29 -> 88 | S29: McMASTER | CB29: {GOTO}AL143~/M{END}{RIGHT}{END}{DOWN}~P143~
A30: BEST PLAYERS | CB30: {GOTO}BJ303~/M{RIGHT 7}{END}{DOWN}~V144~
A31: PRESTON | C31: REID | F31: FISHER | I31: HEARD | L31: LESLIE | O31: DALTON | R31: McLEAN | CB31: {GOTO}BJ323~/M{RIGHT 7}{END}{DOWN}~G164~
A32: PRAHRAN | C32: CULPIN | F32: CROWE | I32: KNOX | L32: HUTCHESSON | O32: FARQUHARSON | R32: RAEBURN | CB32: {GOTO}AL163~/M{END}{RIGHT}{END}{DOWN}~P163~
A33: GOALKICKERS | CB33: {GOTO}BJ343~/M{RIGHT 7}{END}{DOWN}~V164~
A34: PRESTON | C34: JOYCE 4 | F34: REID 3 | H34: DALTON 2 | J34: LESLIE 2 | L34: HINDMARSH | O34: MYERS | Q34: HEARD | S34: GOAD | CB34: {HOME}
A35: PRAHRAN | C35: FAHEY 4 | F35: KNOX 2 | H35: POWER 2 | J35: BARTLETT | M35: GRANGE | O35: CROWE | Q35: CAFFYN | S35: HUTCHESSON
A37: PORT MELBOURNE | C37: 5 | D37: 6 | E37: =C37*6+D37 -> 36 | G37: 10 | H37: 9 | I37: =G37*6+H37 -> 69 | K37: 16 | L37: 16 | M37: =K37*6+L37 -> 112 | O37: 18 | P37: 18 | Q37: =O37*6+P37 -> 126 | S37: PORT MELBOURNE
A38: OAKLEIGH | C38: 2 | D38: 2 | E38: =C38*6+D38 -> 14 | G38: 3 | H38: 7 | I38: =G38*6+H38 -> 25 | K38: 3 | L38: 8 | M38: =K38*6+L38 -> 26 | O38: 5 | P38: 10 | Q38: =O38*6+P38 -> 40 | S38: FLANAGAN
A39: BEST PLAYERS
A40: PORT MELBOURNE | C40: JENSEN | F40: GOSS | I40: McKEW | L40: IRELAND | O40: QUIRK | Q40: BOOTH
A41: OAKLEIGH | C41: DONNELLY | F41: LYONS | I41: McCORKELL | L41: C RITCHIE | O41: TEMME | Q41: TRAILL
A42: GOALKICKERS
A43: PORT MELBOURNE | C43: McKEW 5 | F43: GOSS 4 | H43: JENSEN 3 | J43: BEATTIE 3 | M43: BOOTH 2 | O43: ALLEN
A44: OAKLEIGH | C44: DONNELLY 2 | F44: FORD 2 | I44: THOMAS
A46: SANDRINGHAM | C46: 1 | D46: 12 | E46: =C46*6+D46 -> 18 | G46: 3 | H46: 17 | I46: =G46*6+H46 -> 35 | K46: 7 | L46: 24 | M46: =K46*6+L46 -> 66 | O46: 8 | P46: 27 | Q46: =O46*6+P46 -> 75 | S46: BRUNSWICK
A47: BRUNSWICK | C47: 0 | D47: 0 | E47: =C47*6+D47 -> 0 | G47: 3 | H47: 4 | I47: =G47*6+H47 -> 22 | K47: 7 | L47: 5 | M47: =K47*6+L47 -> 47 | O47: 9 | P47: 9 | Q47: =O47*6+P47 -> 63 | S47: HOLZER
A48: BEST PLAYERS
A49: SANDRINGHAM | C49: SHARROCK | F49: J WARD | I49: ZEUSCHNER | L49: MACKENZIE | O49: HAMMOND | R49: ADDISON
A50: BRUNSWICK | C50: KICK | F50: HOEY | I50: DALTON | L50: CAIN | O50: WROUT | R50: I GREIG
A51: GOALKICKERS
A52: SANDRINGHAM | C52: AUSTIN 4 | F52: SHARROCK | I52: HOGAN | K52: WILLIAMS | N52: HAMMOND
A53: BRUNSWICK | C53: COOK 3 | F53: I GREIG 3 | I53: HILL | K53: McLEOD | N53: MATTHEWS
A55: ROUND 2 | D55: 26TH APRIL | I55: WEATHER | M55: N.W.WIND FINE SUNNY | S55: PLAYED AT
D56: 1ST QTR | H56: 2ND QTR | L56: 3RD QTR | P56: FINAL | S56: GEELONG WEST
A57: GEELONG WEST | C57: 1 | D57: 3 | E57: =C57*6+D57 -> 9 | G57: 6 | H57: 10 | I57: =G57*6+H57 -> 46 | K57: 8 | L57: 14 | M57: =K57*6+L57 -> 62 | O57: 13 | P57: 24 | Q57: =O57*6+P57 -> 102 | S57: UMPIRE | X57: LADDER | AB57: ROUND | AD57: 2
A58: WAVERLEY | C58: 3 | D58: 4 | E58: =C58*6+D58 -> 22 | G58: 4 | H58: 8 | I58: =G58*6+H58 -> 32 | K58: 8 | L58: 12 | M58: =K58*6+L58 -> 60 | O58: 12 | P58: 13 | Q58: =O58*6+P58 -> 85 | S58: PASK
A59: BEST PLAYERS | W59: TEAM | X59: W | Y59: L | Z59: D | AA59: FOR | AB59: AGST | AC59: % | AD59: PTS
A60: GEELONG WEST | C60: SMITH | F60: OLIVER | I60: EMOND | L60: JULIEN | N60: G O'DONNELL | Q60: HAMILTON
A61: WAVERLEY | C61: ARNOTT | F61: POORE | I61: McKENZIE | L61: LAWSON | N61: McQUEEN | Q61: HORKINGS | W61: PRESTON | X61: 2 | Y61: 0 | Z61: 0 | AA61: 237 | AB61: 186 | AC61: 127.41935483870968 | AD61: 8
A62: GOALKICKERS | W62: SANDRINGHAM | X62: 2 | Y62: 0 | Z62: 0 | AA62: 199 | AB62: 168 | AC62: 118.45238095238095 | AD62: 8
A63: GEELONG WEST | C63: EMOND 4 | F63: G O'DONNELL 3 | J63: BARRY 2 | M63: JULIEN 2 | O63: HAMILTON | R63: SMITH | W63: PORT MELBOURNE | X63: 1 | Y63: 1 | Z63: 0 | AA63: 231 | AB63: 164 | AC63: 140.85365853658536 | AD63: 4
A64: WAVERLEY | C64: ARNOTT 6 | F64: POORE 3 | I64: HORKINGS | K64: LAWSON | M64: OWENS | W64: DANDENONG | X64: 1 | Y64: 1 | Z64: 0 | AA64: 252 | AB64: 197 | AC64: 127.91878172588832 | AD64: 4
D65: 27TH APRIL | I65: WEATHER | L65: FINE
A66: PRESTON | C66: 6 | D66: 0 | E66: =C66*6+D66 -> 36 | G66: 12 | H66: 0 | I66: =G66*6+H66 -> 72 | K66: 14 | L66: 6 | M66: =K66*6+L66 -> 90 | O66: 20 | P66: 9 | Q66: =O66*6+P66 -> 129 | S66: PRESTON | W66: WAVERLEY | X66: 1 | Y66: 1 | Z66: 0 | AA66: 207 | AB66: 176 | AC66: 117.61363636363636 | AD66: 4
A67: YARRAVILLE | C67: 1 | D67: 3 | E67: =C67*6+D67 -> 9 | G67: 4 | H67: 9 | I67: =G67*6+H67 -> 33 | K67: 10 | L67: 15 | M67: =K67*6+L67 -> 75 | O67: 13 | P67: 20 | Q67: =O67*6+P67 -> 98 | S67: TURNER | W67: YARRAVILLE | X67: 1 | Y67: 1 | Z67: 0 | AA67: 241 | AB67: 206 | AC67: 116.99029126213593 | AD67: 4
A68: BEST PLAYERS | W68: PRAHRAN | X68: 1 | Y68: 1 | Z68: 0 | AA68: 218 | AB68: 199 | AC68: 109.54773869346734 | AD68: 4
A69: PRESTON | C69: REID | F69: HEARD | I69: GOAD | L69: GRAHAM | O69: G PERRY | R69: FISHER | W69: GEELONG WEST | X69: 1 | Y69: 1 | Z69: 0 | AA69: 179 | AB69: 228 | AC69: 78.508771929824562 | AD69: 4
A70: YARRAVILLE | C70: WAGHORN | F70: CONNELLY | I70: ROACH | L70: MATHESON | O70: WARWICK | R70: KEMP | W70: BRUNSWICK | X70: 0 | Y70: 2 | Z70: 0 | AA70: 138 | AB70: 253 | AC70: 54.545454545454547 | AD70: 0
A71: GOALKICKERS | W71: OAKLEIGH | X71: 0 | Y71: 2 | Z71: 0 | AA71: 131 | AB71: 256 | AC71: 51.171875 | AD71: 0
A72: PRESTON | C72: JOYCE 7 | E72: HINDMARSH 4 | H72: ASPINALL 2 | K72: MYERS 2 | M72: LESLIE 2 | O72: TELFORD 2 | R72: G PERRY
A73: YARRAVILLE | C73: WAGHORN 5 | F73: KEMP 4 | H73: DAVIES 3 | K73: ROACH
A75: SANDRINGHAM | C75: 7 | D75: 2 | E75: =C75*6+D75 -> 44 | G75: 13 | H75: 6 | I75: =G75*6+H75 -> 84 | K75: 13 | L75: 8 | M75: =K75*6+L75 -> 86 | O75: 19 | P75: 10 | Q75: =O75*6+P75 -> 124 | S75: BEACH ROAD
A76: PORT MELBOURNE | C76: 4 | D76: 2 | E76: =C76*6+D76 -> 26 | G76: 7 | H76: 4 | I76: =G76*6+H76 -> 46 | K76: 15 | L76: 6 | M76: =K76*6+L76 -> 96 | O76: 16 | P76: 9 | Q76: =O76*6+P76 -> 105 | S76: TOOHEY
A77: BEST PLAYERS
A78: SANDRINGHAM | C78: ZEUSCHNER | F78: SHARROCK | I78: MACKENZIE | L78: B WARD | O78: WILLIAMS | R78: HOGAN
A79: PORT MELBOURNE | C79: McKEW | F79: CAULFIELD | I79: GOSS | L79: BOOTH | O79: BROWN | R79: BEHAN
A80: GOALKICKERS
A81: SANDRINGHAM | C81: WILIAMS 5 | F81: J WARD 4 | I81: HOGAN 3 | K81: SPURRELL 2 | N81: WALFORD 2 | Q81: HANCE | S81: JOHNSON | V81: AUSTIN
A82: PORT MELBOURNE | C82: McKEW 7 | F82: BROWN 4 | I82: GOSS 2 | K82: PASQUILL 2 | N82: JENSEN
A84: DANDENONG | C84: 5 | D84: 7 | E84: =C84*6+D84 -> 37 | G84: 11 | H84: 12 | I84: =G84*6+H84 -> 78 | K84: 16 | L84: 16 | M84: =K84*6+L84 -> 112 | O84: 26 | P84: 22 | Q84: =O84*6+P84 -> 178 | S84: DANDENONG
A85: BRUNSWICK | C85: 2 | D85: 3 | E85: =C85*6+D85 -> 15 | G85: 5 | H85: 7 | I85: =G85*6+H85 -> 37 | K85: 8 | L85: 12 | M85: =K85*6+L85 -> 60 | O85: 10 | P85: 15 | Q85: =O85*6+P85 -> 75 | S85: McKENZIE
A86: BEST PLAYERS
A87: DANDENONG | C87: ANDREWS | F87: McDONALD | I87: WALKER | L87: GUINANE | O87: NANKERVIS | R87: MILLER
A88: BRUNSWICK | C88: BRADLEY | F88: COOK | I88: McKINNON | L88: HILL | O88: HOEY | R88: I GREIG
A89: GOALKICKERS
A90: DANDENONG | C90: MILLER 8 | E90: ANDREWS 6 | H90: NANKERVIS 5 | K90: ABRAHAM 2 | N90: GUINANE | P90: MORROW | R90: ROBERTSON | U90: McDONALD | X90: SMITH
A91: BRUNSWICK | C91: COOK 4 | F91: BRADLEY 3 | I91: HOEY | K91: I GREIG | M91: MATTHEWS
A93: PRAHRAN | C93: 3 | D93: 5 | E93: =C93*6+D93 -> 23 | G93: 9 | H93: 10 | I93: =G93*6+H93 -> 64 | K93: 14 | L93: 13 | M93: =K93*6+L93 -> 97 | O93: 19 | P93: 16 | Q93: =O93*6+P93 -> 130 | S93: OAKLEIGH
A94: OAKLEIGH | C94: 1 | D94: 5 | E94: =C94*6+D94 -> 11 | G94: 5 | H94: 9 | I94: =G94*6+H94 -> 39 | K94: 10 | L94: 14 | M94: =K94*6+L94 -> 74 | O94: 12 | P94: 19 | Q94: =O94*6+P94 -> 91 | S94: BREWER
A95: BEST PLAYERS
A96: PRAHRAN | C96: ANDREWS | F96: RAEBURN | I96: CROWE | L96: PARKER | N96: HUTCHESSON | Q96: POWER
A97: OAKLEIGH | C97: C RITCHIE | F97: GORDES | I97: LYONS | L97: TEMME | N97: TRAILL | Q97: DONNELLY
A98: GOALKICKERS
A99: PRAHRAN | C99: POWER 7 | F99: PARKER 3 | I99: KARANICHOLAS 2 | M99: CAFFYN 2 | P99: HUTCHESSON 2 | S99: ANDREWS 2 | V99: FAHEY
A100: OAKLEIGH | C100: CUMMINGS 4 | F100: DONNELLY 2 | I100: THOMAS 2 | L100: STEWART | N100: MOULDEN | Q100: TEMME | S100: TRAILL
A102: ROUND 3 | E102: 4TH MAY | J102: WEATHER | N102: FINE | S102: PLAYED AT
D103: 1ST QTR | H103: 2ND QTR | L103: 3RD QTR | P103: FINAL | S103: DANDENONG
A104: DANDENONG | C104: 4 | D104: 3 | E104: =C104*6+D104 -> 27 | G104: 7 | H104: 8 | I104: =G104*6+H104 -> 50 | K104: 15 | L104: 10 | M104: =K104*6+L104 -> 100 | O104: 15 | P104: 10 | Q104: =O104*6+P104 -> 100 | S104: UMPIRE | X104: LADDER | AB104: ROUND | AD104: 3
A105: PRESTON | C105: 5 | D105: 2 | E105: =C105*6+D105 -> 32 | G105: 9 | H105: 8 | I105: =G105*6+H105 -> 62 | K105: 9 | L105: 13 | M105: =K105*6+L105 -> 67 | O105: 12 | P105: 20 | Q105: =O105*6+P105 -> 92 | S105: HOLZER
A106: BEST PLAYERS | W106: TEAM | X106: W | Y106: L | Z106: D | AA106: FOR | AB106: AGST | AC106: % | AD106: PTS
A107: DANDENONG | C107: McNAMARA | F107: ABRAHAM | I107: MILLER | L107: LIENERT | N107: BETHKE | Q107: NANKERVIS
A108: PRESTON | C108: HEARD | F108: McLEAN | I108: McKERNAN | L108: TELFORD | N108: ASPINALL | Q108: SCHICKERT | W108: SANDRINGHAM | X108: 3 | Y108: 0 | Z108: 0 | AA108: 280 | AB108: 234 | AC108: 119.65811965811966 | AD108: 12
A109: GOALKICKERS | W109: YARRAVILLE | X109: 2 | Y109: 1 | Z109: 0 | AA109: 351 | AB109: 279 | AC109: 125.80645161290323 | AD109: 8
A110: DANDENONG | C110: MILLER 7 | F110: ANDREWS 2 | I110: NANKERVIS 2 | L110: ABRAHAM 2 | O110: EVANS | Q110: GUINANE | W110: DANDENONG | X110: 2 | Y110: 1 | Z110: 0 | AA110: 352 | AB110: 289 | AC110: 121.79930795847751 | AD110: 8
A111: PRESTON | C111: ASPINALL 3 | F111: JOYCE 2 | H111: REID 2 | J111: MYERS | L111: HEARD | N111: HINDMARSH | Q111: LESLIE | S111: GOAD | W111: PRESTON | X111: 2 | Y111: 1 | Z111: 0 | AA111: 329 | AB111: 286 | AC111: 115.03496503496504 | AD111: 8
A113: SANDRINGHAM | C113: 6 | D113: 2 | E113: =C113*6+D113 -> 38 | G113: 6 | H113: 6 | I113: =G113*6+H113 -> 42 | K113: 9 | L113: 12 | M113: =K113*6+L113 -> 66 | O113: 11 | P113: 15 | Q113: =O113*6+P113 -> 81 | S113: WAVERLEY | W113: PRAHRAN | X113: 2 | Y113: 1 | Z113: 0 | AA113: 330 | AB113: 287 | AC113: 114.98257839721255 | AD113: 8
A114: WAVERLEY | C114: 1 | D114: 3 | E114: =C114*6+D114 -> 9 | G114: 5 | H114: 10 | I114: =G114*6+H114 -> 40 | K114: 5 | L114: 11 | M114: =K114*6+L114 -> 41 | O114: 8 | P114: 18 | Q114: =O114*6+P114 -> 66 | S114: O'NEILL | W114: GEELONG WEST | X114: 2 | Y114: 1 | Z114: 0 | AA114: 283 | AB114: 291 | AC114: 97.250859106529205 | AD114: 8
A115: BEST PLAYERS | W115: PORT MELBOURNE | X115: 1 | Y115: 2 | Z115: 0 | AA115: 319 | AB115: 276 | AC115: 115.57971014492753 | AD115: 4
A116: SANDRINGHAM | C116: J WARD | E116: WALFORD | H116: AUSTIN | K116: WILLIAMS | N116: SPURRELL | Q116: MACKENZIE | W116: WAVERLEY | X116: 1 | Y116: 2 | Z116: 0 | AA116: 273 | AB116: 257 | AC116: 106.22568093385215 | AD116: 4
A117: WAVERLEY | C117: SYKES | E117: STEPHENS | H117: LANGFORD | K117: HORKINGS | N117: POORE | Q117: BLEW | W117: BRUNSWICK | X117: 0 | Y117: 3 | Z117: 0 | AA117: 211 | AB117: 363 | AC117: 58.126721763085399 | AD117: 0
A118: GOALKICKERS | W118: OAKLEIGH | X118: 0 | Y118: 3 | Z118: 0 | AA118: 194 | AB118: 360 | AC118: 53.888888888888886 | AD118: 0
A119: SANDRINGHAM | C119: WALFORD 3 | F119: WILLIAMS 2 | I119: HOGAN 2 | K119: J WARD | M119: HANCE | O119: ROBINSON | Q119: ADDISON
A120: WAVERLEY | C120: STEPHENS 3 | F120: HORKINGS 2 | I120: POORE 2 | K120: BELL
A122: PRAHRAN | C122: 4 | D122: 4 | E122: =C122*6+D122 -> 28 | G122: 6 | H122: 6 | I122: =G122*6+H122 -> 42 | K122: 12 | L122: 7 | M122: =K122*6+L122 -> 79 | O122: 17 | P122: 10 | Q122: =O122*6+P122 -> 112 | S122: TOORAK PARK
A123: PORT MELBOURNE | C123: 3 | D123: 1 | E123: =C123*6+D123 -> 19 | G123: 7 | H123: 4 | I123: =G123*6+H123 -> 46 | K123: 9 | L123: 8 | M123: =K123*6+L123 -> 62 | O123: 12 | P123: 16 | Q123: =O123*6+P123 -> 88 | S123: DUGARD
A124: BEST PLAYERS
A125: PRAHRAN | C125: CROWE | F125: POWER | I125: HUTCHESSON | L125: RAEBURN | O125: PARKER | R125: CAFFYN
A126: PORT MELBOURNE | C126: BONNETT | F126: GARDNER | I126: GOSS | L126: EKLUND | O126: BEHAN | R126: CAULFIELD
A127: GOALKICKERS
A128: PRAHRAN | C128: POWER 10 | F128: CAFFYN 4 | I128: KNOX | K128: PARKER | M128: JUNGWIRTH
A129: PORT MELBOURNE | C129: McKEW 3 | F129: PASQUILL 2 | I129: BEHAN 2 | K129: GOSS | M129: M ALLEN | O129: BONNETT | Q129: EKLUND | S129: BROWN
A131: GEELONG WEST | C131: 2 | D131: 2 | E131: =C131*6+D131 -> 14 | G131: 7 | H131: 6 | I131: =G131*6+H131 -> 48 | K131: 11 | L131: 8 | M131: =K131*6+L131 -> 74 | O131: 15 | P131: 14 | Q131: =O131*6+P131 -> 104 | S131: OAKLEIGH
A132: OAKLEIGH | C132: 1 | D132: 6 | E132: =C132*6+D132 -> 12 | G132: 5 | H132: 10 | I132: =G132*6+H132 -> 40 | K132: 7 | L132: 15 | M132: =K132*6+L132 -> 57 | O132: 8 | P132: 15 | Q132: =O132*6+P132 -> 63 | S132: McMASTER
A133: BEST PLAYERS
A134: GEELONG WEST | C134: FRY | F134: BARY | I134: MOORE | L134: EMOND | O134: SMITH | R134: DEEATH
A135: OAKLEIGH | C135: McCORKELL | F135: FORD | I135: DONNELLY | L135: BEARD | O135: C RITCHIE | R135: SYKES
A136: GOALKICKERS
A137: GEELONG WEST | C137: ADAMS 3 | F137: BARRY 3 | I137: EMOND 2 | K137: HAMILTON 2 | N137: SMITH 2 | P137: TENABEL | R137: O'REILLY | U137: WILLIAMS
A138: OAKLEIGH | C138: CUMMINGS 3 | F138: BEARD 2 | I138: STEWART 2 | L138: COLLETTA
A140: YARRAVILLE | C140: 3 | D140: 2 | E140: =C140*6+D140 -> 20 | G140: 6 | H140: 4 | I140: =G140*6+H140 -> 40 | K140: 6 | L140: 7 | M140: =K140*6+L140 -> 43 | O140: 16 | P140: 14 | Q140: =O140*6+P140 -> 110 | S140: YARRAVILLE
A141: BRUNSWICK | C141: 0 | D141: 2 | E141: =C141*6+D141 -> 2 | G141: 2 | H141: 5 | I141: =G141*6+H141 -> 17 | K141: 7 | L141: 12 | M141: =K141*6+L141 -> 54 | O141: 10 | P141: 13 | Q141: =O141*6+P141 -> 73 | S141: FLANAGAN
A142: BEST PLAYERS
A143: YARRAVILLE | C143: GROSE | F143: TAURENS | I143: BARR | L143: MATHESON | O143: DAVIES | Q143: WAGHORN
A144: BRUNSWICK | C144: BRADLEY | F144: NEAL | I144: DALTON | L144: KICK | O144: HILL | Q144: NOONAN
A145: GOALKICKERS
A146: YARRAVILLE | C146: ROACH 3 | E146: WAGHORN 2 | H146: KEMP 2 | J146: DAVIES 2 | M146: TAURENS 2 | P146: MATHESON 2 | S146: PETERSON | V146: CONNELLY | X146: CHARLES
A147: BRUNSWICK | C147: DALTON 3 | F147: BRADLEY 2 | I147: HOEY 2 | K147: NEAL | M147: LEYDIN | O147: WROUT
A149: ROUND 4 | D149: 10TH MAY | I149: WEATHER | L149: STRONG NORTH WIND | S149: PLAYED AT
D150: 1ST QTR | H150: 2ND QTR | L150: 3RD QTR | P150: FINAL | S150: BRUNSWICK
A151: WAVERLEY | C151: 3 | D151: 8 | E151: =C151*6+D151 -> 26 | G151: 5 | H151: 9 | I151: =G151*6+H151 -> 39 | K151: 13 | L151: 13 | M151: =K151*6+L151 -> 91 | O151: 15 | P151: 15 | Q151: =O151*6+P151 -> 105 | S151: UMPIRE | X151: LADDER | AB151: ROUND | AD151: 4
A152: BRUNSWICK | C152: 3 | D152: 2 | E152: =C152*6+D152 -> 20 | G152: 5 | H152: 9 | I152: =G152*6+H152 -> 39 | K152: 7 | L152: 10 | M152: =K152*6+L152 -> 52 | O152: 8 | P152: 16 | Q152: =O152*6+P152 -> 64 | S152: TURNER
A153: BEST PLAYERS | W153: TEAM | X153: W | Y153: L | Z153: D | AA153: FOR | AB153: AGST | AC153: % | AD153: PTS
A154: WAVERLEY | C154: MORDEN | F154: POORE | I154: HORKINGS | L154: LAWSON | N154: LANGFORD | Q154: McKENZIE
A155: BRUNSWICK | C155: KICK | F155: LEYDIN | I155: COOK | L155: CAIN | N155: KERWOOD | Q155: HOEY | W155: SANDRINGHAM | X155: 4 | Y155: 0 | Z155: 0 | AA155: 391 | AB155: 329 | AC155: 118.84498480243161 | AD155: 16
A156: GOALKICKERS | R156: PARKER | W156: PRESTON | X156: 3 | Y156: 1 | Z156: 0 | AA156: 445 | AB156: 334 | AC156: 133.23353293413174 | AD156: 12
A157: WAVERLEY | C157: LANGFORD 4 | F157: POORE 2 | H157: BLEW 2 | J157: LAWSON 2 | M157: HORKINGS 2 | P157: ALLAN | R157: McKENZIE | W157: PRAHRAN | X157: 3 | Y157: 1 | Z157: 0 | AA157: 487 | AB157: 396 | AC157: 122.97979797979798 | AD157: 12
A158: BRUNSWICK | C158: COOK 4 | F158: I GREIG 2 | I158: OGSTON | K158: BRADLEY | W158: YARRAVILLE | X158: 2 | Y158: 2 | Z158: 0 | AA158: 431 | AB158: 362 | AC158: 119.06077348066299 | AD158: 8
A160: PRESTON | C160: 1 | D160: 3 | E160: =C160*6+D160 -> 9 | G160: 5 | H160: 10 | I160: =G160*6+H160 -> 40 | K160: 9 | L160: 10 | M160: =K160*6+L160 -> 64 | O160: 17 | P160: 14 | Q160: =O160*6+P160 -> 116 | S160: PRESTON | W160: WAVERLEY | X160: 2 | Y160: 2 | Z160: 0 | AA160: 378 | AB160: 321 | AC160: 117.75700934579439 | AD160: 8
A161: OAKLEIGH | C161: 1 | D161: 2 | E161: =C161*6+D161 -> 8 | G161: 1 | H161: 4 | I161: =G161*6+H161 -> 10 | K161: 6 | L161: 10 | M161: =K161*6+L161 -> 46 | O161: 6 | P161: 12 | Q161: =O161*6+P161 -> 48 | S161: TOOHEY | W161: PORT MELBOURNE | X161: 2 | Y161: 2 | Z161: 0 | AA161: 402 | AB161: 356 | AC161: 112.92134831460675 | AD161: 8
A162: BEST PLAYERS | W162: DANDENONG | X162: 2 | Y162: 2 | Z162: 0 | AA162: 447 | AB162: 400 | AC162: 111.75 | AD162: 8
A163: PRESTON | C163: HEARD | F163: TELFORD | I163: LEMPRIERE | L163: REID | N163: HILL | Q163: SCHICKERT | W163: GEELONG WEST | X163: 2 | Y163: 2 | Z163: 0 | AA163: 392 | AB163: 448 | AC163: 87.5 | AD163: 8
A164: OAKLEIGH | C164: STEWART | F164: MOULDON | I164: LUFF | L164: SYKES | N164: BEARD | Q164: LYON | W164: BRUNSWICK | X164: 0 | Y164: 4 | Z164: 0 | AA164: 275 | AB164: 468 | AC164: 58.760683760683762 | AD164: 0
A165: GOALKICKERS | W165: OAKLEIGH | X165: 0 | Y165: 4 | Z165: 0 | AA165: 242 | AB165: 476 | AC165: 50.840336134453779 | AD165: 0
A166: PRESTON | C166: TELFORD 5 | F166: JOYCE 3 | H166: McARTHUR 3 | K166: REID 2 | M166: LEMPRIERE | P166: HEARD | R166: G PERRY | U166: HILL
A167: OAKLEIGH | C167: CUMMINGS 2 | F167: MOULDEN | I167: FORD | K167: BEARD | M167: LYON
E168: 11TH MAY | J168: WEATHER | N168: NORTH WIND
A169: SANDRINGHAM | C169: 6 | D169: 10 | E169: =C169*6+D169 -> 46 | G169: 7 | H169: 11 | I169: =G169*6+H169 -> 53 | K169: 13 | L169: 19 | M169: =K169*6+L169 -> 97 | O169: 15 | P169: 21 | Q169: =O169*6+P169 -> 111 | S169: BEACH ROAD
A170: DANDENONG | C170: 1 | D170: 3 | E170: =C170*6+D170 -> 9 | G170: 5 | H170: 10 | I170: =G170*6+H170 -> 40 | K170: 7 | L170: 15 | M170: =K170*6+L170 -> 57 | O170: 13 | P170: 17 | Q170: =O170*6+P170 -> 95 | S170: PASK
A171: BEST PLAYERS
A172: SANDRINGHAM | C172: HANCE | F172: ZEUSCHNER | I172: J WARD | L172: B WARD | O172: ADDISON | R172: MACKENZIE
A173: DANDENONG | C173: MORROW | F173: BETHKE | I173: NANKERVIS | L173: GOODES | O173: McDONALD | R173: FLAHERTY
A174: GOALKICKERS
A175: SANDRINGHAM | C175: ROBINSON 5 | F175: HANCE 2 | I175: J WARD 2 | L175: HOGAN 2 | N175: AUSTIN 2 | Q175: ADDISON | S175: WILLIAMS
A176: DANDENONG | C176: NANKERVIS 3 | F176: MILLER 3 | I176: FLAHERTY 3 | L176: MORROW 2 | O176: STEDWELL | Q176: GUINANE
A178: PRAHRAN | C178: 7 | D178: 3 | E178: =C178*6+D178 -> 45 | G178: 11 | H178: 7 | I178: =G178*6+H178 -> 73 | K178: 17 | L178: 16 | M178: =K178*6+L178 -> 118 | O178: 23 | P178: 19 | Q178: =O178*6+P178 -> 157 | S178: GEELONG WEST
A179: GEELONG WEST | C179: 5 | D179: 0 | E179: =C179*6+D179 -> 30 | G179: 8 | H179: 1 | I179: =G179*6+H179 -> 49 | K179: 11 | L179: 5 | M179: =K179*6+L179 -> 71 | O179: 17 | P179: 7 | Q179: =O179*6+P179 -> 109 | S179: McKENZIE
A180: BEST PLAYERS
A181: PRAHRAN | C181: PARKER | F181: McMAHON | I181: POWER | L181: ROSE | O181: CAFFYN | R181: KNOX
A182: GEELONG WEST | C182: SMITH | F182: STACEY | I182: ADAMS | L182: SKOWRONSKI | O182: MOORE
A183: GOALKICKERS
A184: PRAHRAN | C184: POWER 7 | E184: CAFFYN 5 | G184: PARKER 4 | I184: McKENZIE 2 | L184: FAHEY 2 | N184: McMAHON | Q184: KARANICHOLAS | U184: HUTCHESSON
A185: GEELONG WEST | C185: SMITH 5 | E185: ADAMS 4 | G185: G O'DONNELL 3 | J185: TENABEL 2 | M185: BARRY | O185: SKOWRONSKI | R185: DEEATH
A187: PORT MELBOURNE | C187: 1 | D187: 2 | E187: =C187*6+D187 -> 8 | G187: 5 | H187: 9 | I187: =G187*6+H187 -> 39 | K187: 8 | L187: 11 | M187: =K187*6+L187 -> 59 | O187: 11 | P187: 17 | Q187: =O187*6+P187 -> 83 | S187: PORT MELBOURNE
A188: YARRAVILLE | C188: 2 | D188: 2 | E188: =C188*6+D188 -> 14 | G188: 3 | H188: 5 | I188: =G188*6+H188 -> 23 | K188: 8 | L188: 10 | M188: =K188*6+L188 -> 58 | O188: 11 | P188: 14 | Q188: =O188*6+P188 -> 80 | S188: BREWER
A189: BEST PLAYERS
A190: PORT MELBOURNE | C190: GARDNER | F190: EKLUND | I190: BEHAN | L190: BRICE | N190: McKEW | Q190: GOSS
A191: YARRAVILLE | C191: WARWICK | F191: KEMP | I191: BONGETTI | L191: MARTIN | N191: CASTRIKUM | Q191: GROSE
A192: GOALKICKERS
A193: PORT MELBOURNE | C193: GOSS 2 | E193: EKLUND 2 | H193: BARCLAY | J193: BONNETT | M193: QUIRK | O193: PASQUILL | Q193: BROWN | S193: BRICE | U193: McKEW
A194: YARRAVILLE | C194: BONGETTI 4 | F194: MARTIN 3 | I194: KEMP 2 | K194: ROACH | M194: WAGHORN
A196: ROUND 5 | E196: 18TH MAY | J196: WEATHER | N196: SOUTH WEST WIND | S196: PLAYED AT
D197: 1ST QTR | H197: 2ND QTR | L197: 3RD QTR | P197: FINAL | S197: YARRAVILLE
A198: PRAHRAN | C198: 6 | D198: 4 | E198: =C198*6+D198 -> 40 | G198: 7 | H198: 6 | I198: =G198*6+H198 -> 48 | K198: 8 | L198: 14 | M198: =K198*6+L198 -> 62 | O198: 11 | P198: 17 | Q198: =O198*6+P198 -> 83 | S198: UMPIRE | X198: LADDER | AB198: ROUND | AD198: 5
A199: YARRAVILLE | C199: 2 | D199: 2 | E199: =C199*6+D199 -> 14 | G199: 5 | H199: 10 | I199: =G199*6+H199 -> 40 | K199: 5 | L199: 13 | M199: =K199*6+L199 -> 43 | O199: 9 | P199: 15 | Q199: =O199*6+P199 -> 69 | S199: HOLZER
A200: BEST PLAYERS | W200: TEAM | X200: W | Y200: L | Z200: D | AA200: FOR | AB200: AGST | AC200: % | AD200: PTS
A201: PRAHRAN | C201: PARKER | F201: KNOX | I201: CULPIN | K201: CROWE | N201: RAEBURN | Q201: HUTCHESSON
A202: YARRAVILLE | C202: MARTIN | F202: DAVIES | I202: BARR | K202: WARWICK | N202: TAURENS | Q202: HEYME | W202: SANDRINGHAM | X202: 5 | Y202: 0 | Z202: 0 | AA202: 474 | AB202: 407 | AC202: 116.46191646191646 | AD202: 20
A203: GOALKICKERS | W203: PRESTON | X203: 4 | Y203: 1 | Z203: 0 | AA203: 604 | AB203: 367 | AC203: 164.57765667574932 | AD203: 16
A204: PRAHRAN | C204: POWER 3 | F204: CROWE 2 | I204: PARKER 2 | L204: GRANGE | N204: FAHEY | P204: CAFFYN | R204: MCKENZIE | W204: PRAHRAN | X204: 4 | Y204: 1 | Z204: 0 | AA204: 570 | AB204: 465 | AC204: 122.58064516129032 | AD204: 16
A205: YARRAVILLE | C205: KEMP 3 | F205: WAGHORN 2 | I205: MARTIN 2 | L205: WALSH | N205: QUARANTOTTO | W205: PORT MELBOURNE | X205: 3 | Y205: 2 | Z205: 0 | AA205: 494 | AB205: 420 | AC205: 117.61904761904762 | AD205: 12
A207: PORT MELBOURNE | C207: 1 | D207: 6 | E207: =C207*6+D207 -> 12 | G207: 6 | H207: 10 | I207: =G207*6+H207 -> 46 | K207: 11 | L207: 13 | M207: =K207*6+L207 -> 79 | O207: 13 | P207: 14 | Q207: =O207*6+P207 -> 92 | S207: WAVERLEY | W207: DANDENONG | X207: 3 | Y207: 2 | Z207: 0 | AA207: 582 | AB207: 524 | AC207: 111.07 | AD207: 12
A208: WAVERLEY | C208: 3 | D208: 2 | E208: =C208*6+D208 -> 20 | G208: 6 | H208: 3 | I208: =G208*6+H208 -> 39 | K208: 8 | L208: 5 | M208: =K208*6+L208 -> 53 | O208: 9 | P208: 10 | Q208: =O208*6+P208 -> 64 | S208: McMASTER | W208: YARRAVILLE | X208: 2 | Y208: 3 | Z208: 0 | AA208: 500 | AB208: 445 | AC208: 112.35955056179775 | AD208: 8
A209: BEST PLAYERS | W209: WAVERLEY | X209: 2 | Y209: 3 | Z209: 0 | AA209: 442 | AB209: 413 | AC209: 107.02179176755448 | AD209: 8
A210: PORT MELBOURNE | C210: PASQUILL | F210: WISEMAN | I210: GOSS | L210: BRICE | N210: EKLUND | Q210: CAULFIELD | W210: GEELONG WEST | X210: 2 | Y210: 3 | Z210: 0 | AA210: 470 | AB210: 531 | AC210: 88.512241054613938 | AD210: 8
A211: WAVERLEY | C211: HORKINGS | F211: BLEW | I211: BACKHOUSE | L211: SMITH | N211: PARKER | Q211: POORE | W211: OAKLEIGH | X211: 0 | Y211: 5 | Z211: 0 | AA211: 366 | AB211: 611 | AC211: 59.9 | AD211: 0
A212: GOALKICKERS | W212: BRUNSWICK | X212: 0 | Y212: 5 | Z212: 0 | AA212: 308 | AB212: 627 | AC212: 49.122807017543863 | AD212: 0
A213: PORT MELBOURNE | C213: BEHAN 3 | F213: PASQUILL 3 | I213: GOSS 2 | K213: BARCLAY 2 | N213: BONNETT | P213: BRICE | R213: McKEW
A214: WAVERLEY | C214: ALLAN 2 | F214: HORKINGS 2 | I214: McKENZIE | K214: BLEW | M214: LANGFORD | O214: POORE | Q214: BELL
A216: DANDENONG | C216: 4 | D216: 7 | E216: =C216*6+D216 -> 31 | G216: 6 | H216: 8 | I216: =G216*6+H216 -> 44 | K216: 13 | L216: 12 | M216: =K216*6+L216 -> 90 | O216: 20 | P216: 15 | Q216: =O216*6+P216 -> 135 | S216: OAKLEIGH
A217: OAKLEIGH | C217: 3 | D217: 1 | E217: =C217*6+D217 -> 19 | G217: 10 | H217: 2 | I217: =G217*6+H217 -> 62 | K217: 17 | L217: 3 | M217: =K217*6+L217 -> 105 | O217: 20 | P217: 4 | Q217: =O217*6+P217 -> 124 | S217: O'NEILL
A218: BEST PLAYERS
A219: DANDENONG | C219: MILLER | F219: LIENERT | I219: FLAHERTY | L219: MELAI | O219: ANDREWS | R219: ABRAHAM
A220: OAKLEIGH | C220: STEWART | F220: FORD | I220: BEARD | L220: HAYNE | O220: GORDES | R220: MOULDEN
A221: GOALKICKERS
A222: DANDENONG | C222: MILLER 8 | F222: ANDREWS 4 | I222: GUINANE 3 | L222: FLAHERTY 3 | O222: ABRAHAM | R222: MORROW
A223: OAKLEIGH | C223: STEWART 6 | F223: MOULDEN 3 | I223: MORCAM 3 | L223: LYON 3 | N223: BEARD 2 | Q223: TRAILL 2 | S223: HEYME
A225: SANDRINGHAM | C225: 3 | D225: 6 | E225: =C225*6+D225 -> 24 | G225: 4 | H225: 7 | I225: =G225*6+H225 -> 31 | K225: 8 | L225: 12 | M225: =K225*6+L225 -> 60 | O225: 11 | P225: 17 | Q225: =O225*6+P225 -> 83 | S225: GEELONG WEST
A226: GEELONG WEST | C226: 3 | D226: 2 | E226: =C226*6+D226 -> 20 | G226: 7 | H226: 8 | I226: =G226*6+H226 -> 50 | K226: 9 | L226: 12 | M226: =K226*6+L226 -> 66 | O226: 10 | P226: 18 | Q226: =O226*6+P226 -> 78 | S226: FLANAGAN
A227: BEST PLAYERS
A228: SANDRINGHAM | C228: J WARD | F228: AUSTIN | I228: HANCE | L228: LOCKHART | O228: ZEUSCHNER | R228: HOGAN
A229: GEELONG WEST | C229: G O'DONNELL | F229: LARKIN | I229: ANDJELKOVIC | L229: SMITH | O229: MOORE | R229: ADAMS
A230: GOALKICKERS
A231: SANDRINGHAM | C231: AUSTIN 5 | F231: J WARD 3 | I231: WILLIAMS 2 | L231: HOGAN
A232: GEELONG WEST | C232: SMITH 3 | F232: G O'DONNELL 3 | J232: TENABEL | M232: ADAMS | O232: ANDJELKOVIC | R232: M FRY
A234: PRESTON | C234: 6 | D234: 4 | E234: =C234*6+D234 -> 40 | G234: 9 | H234: 13 | I234: =G234*6+H234 -> 67 | K234: 14 | L234: 26 | M234: =K234*6+L234 -> 110 | O234: 21 | P234: 33 | Q234: =O234*6+P234 -> 159 | S234: PRESTON
A235: BRUNSWICK | C235: 2 | D235: 1 | E235: =C235*6+D235 -> 13 | G235: 3 | H235: 1 | I235: =G235*6+H235 -> 19 | K235: 4 | L235: 2 | M235: =K235*6+L235 -> 26 | O235: 5 | P235: 3 | Q235: =O235*6+P235 -> 33 | S235: DUGARD
A236: BEST PLAYERS
A237: PRESTON | C237: REID | F237: TELFORD | I237: LEMPRIERE | L237: HILL | N237: CLARK | Q237: A PERRY
A238: BRUNSWICK | C238: BURNS | F238: BRADLEY | I238: LEYDIN | L238: HOEY | N238: KICK | Q238: OGSTON
A239: GOALKICKERS
A240: PRESTON | C240: REID 9 | F240: JOYCE 3 | I240: MCARTHUR 3 | L240: A PERRY 2 | N240: CLARK 2 | Q240: HYDE | S240: MYERS
A241: BRUNSWICK | C241: OGSTON 2 | F241: LEYDIN | I241: HILL | K241: BRADLEY
A243: ROUND 6 | E243: 24TH MAY | H243: WEATHER | K243: SOUTH WEST WIND GROUNDS WET AFTER RAIN | S243: PLAYED AT
D244: 1ST QTR | H244: 2ND QTR | L244: 3RD QTR | P244: FINAL | S244: BEACH ROAD
A245: PRESTON | C245: 2 | D245: 1 | E245: =C245*6+D245 -> 13 | G245: 5 | H245: 5 | I245: =G245*6+H245 -> 35 | K245: 11 | L245: 10 | M245: =K245*6+L245 -> 76 | O245: 15 | P245: 17 | Q245: =O245*6+P245 -> 107 | S245: UMPIRE | X245: LADDER | AB245: ROUND | AD245: 6
A246: SANDRINGHAM | C246: 4 | D246: 4 | E246: =C246*6+D246 -> 28 | G246: 8 | H246: 4 | I246: =G246*6+H246 -> 52 | K246: 8 | L246: 5 | M246: =K246*6+L246 -> 53 | O246: 13 | P246: 6 | Q246: =O246*6+P246 -> 84 | S246: McKENZIE
A247: BEST PLAYERS | W247: TEAM | X247: W | Y247: L | Z247: D | AA247: FOR | AB247: AGST | AC247: % | AD247: PTS
A248: PRESTON | C248: HEARD | F248: CLARK | I248: ASPINALL | L248: GOAD | O248: JOYCE | R248: HILL
A249: SANDRINGHAM | C249: MACKENZIE | F249: WILLIAMS | I249: AUSTIN | L249: LOCKHART | O249: ZEUSCHNER | R249: B WARD | W249: PRESTON | X249: 5 | Y249: 1 | Z249: 0 | AA249: 711 | AB249: 451 | AC249: 157.64966740576497 | AD249: 20
A250: GOALKICKERS | S250: HEARD | W250: PRAHRAN | X250: 5 | Y250: 1 | Z250: 0 | AA250: 664 | AB250: 546 | AC250: 121.61172161172161 | AD250: 20
A251: PRESTON | C251: McARTHUR 3 | F251: ASPINALL 3 | I251: JOYCE 2 | K251: G PERRY 2 | M251: McLEAN | O251: MYERS | Q251: TELFORD | S251: CLARK | W251: SANDRINGHAM | X251: 5 | Y251: 1 | Z251: 0 | AA251: 558 | AB251: 514 | AC251: 108.56031128404669 | AD251: 20
A252: SANDRINGHAM | C252: AUSTIN 5 | F252: WALFORD 3 | I252: ADDISON 2 | L252: WILLIAMS 2 | O252: SPURRELL | W252: DANDENONG | X252: 4 | Y252: 2 | Z252: 0 | AA252: 733 | AB252: 590 | AC252: 124.24 | AD252: 16
A254: PRAHRAN | C254: 5 | D254: 5 | E254: =C254*6+D254 -> 35 | G254: 8 | H254: 8 | I254: =G254*6+H254 -> 56 | K254: 11 | L254: 9 | M254: =K254*6+L254 -> 75 | O254: 14 | P254: 10 | Q254: =O254*6+P254 -> 94 | S254: TOORAK PARK | W254: PORT MELBOURNE | X254: 4 | Y254: 2 | Z254: 0 | AA254: 598 | AB254: 496 | AC254: 120.56451612903226 | AD254: 16
A255: WAVERLEY | C255: 2 | D255: 2 | E255: =C255*6+D255 -> 14 | G255: 3 | H255: 6 | I255: =G255*6+H255 -> 24 | K255: 8 | L255: 11 | M255: =K255*6+L255 -> 59 | O255: 11 | P255: 15 | Q255: =O255*6+P255 -> 81 | S255: BREWER | W255: YARRAVILLE | X255: 3 | Y255: 3 | Z255: 0 | AA255: 617 | AB255: 513 | AC255: 120.27290448343079 | AD255: 12
A256: BEST PLAYERS | W256: WAVERLEY | X256: 2 | Y256: 4 | Z256: 0 | AA256: 523 | AB256: 507 | AC256: 103.15581854043393 | AD256: 8
A257: PRAHRAN | C257: HUTCHESSON | F257: MCKENZIE | I257: DICKESON | L257: McMAHON | O257: RAEBURN | R257: POWER | W257: GEELONG WEST | X257: 2 | Y257: 4 | Z257: 0 | AA257: 536 | AB257: 682 | AC257: 78.592375366568916 | AD257: 8
A258: WAVERLEY | C258: HORKINGS | F258: BELL | I258: BACKHOUSE | L258: LAWSON | O258: JEFFERSON | R258: LANGFORD | W258: OAKLEIGH | X258: 0 | Y258: 6 | Z258: 0 | AA258: 434 | AB258: 728 | AC258: 59.62 | AD258: 0
A259: GOALKICKERS | W259: BRUNSWICK | X259: 0 | Y259: 6 | Z259: 0 | AA259: 384 | AB259: 731 | AC259: 52.530779753761969 | AD259: 0
A260: PRAHRAN | C260: McKENZIE 4 | F260: POWER 3 | I260: McMAHON 2 | L260: FAHEY 2 | N260: ROSE | P260: KARANICHOLAS | T260: PARKER
A261: WAVERLEY | C261: WARNER 3 | F261: PRICE 3 | I261: LAWSON 2 | L261: BELL | N261: POORE | P261: HORKINGS
A263: DANDENONG | C263: 3 | D263: 3 | E263: =C263*6+D263 -> 21 | G263: 11 | H263: 11 | I263: =G263*6+H263 -> 77 | K263: 14 | L263: 14 | M263: =K263*6+L263 -> 98 | O263: 22 | P263: 19 | Q263: =O263*6+P263 -> 151 | S263: DANDENONG
A264: GEELONG WEST | C264: 1 | D264: 6 | E264: =C264*6+D264 -> 12 | G264: 4 | H264: 8 | I264: =G264*6+H264 -> 32 | K264: 7 | L264: 16 | M264: =K264*6+L264 -> 58 | O264: 8 | P264: 18 | Q264: =O264*6+P264 -> 66 | S264: TOOHEY
A265: BEST PLAYERS
A266: DANDENONG | C266: GOODES | F266: FLAHERTY | I266: MORROW | L266: MILLER | O266: MELAI | Q266: NANKERVIS
A267: GEELONG WEST | C267: LARKINS | F267: M FRY | I267: TENABEL | L267: SKROWRONSKI | O267: EMOND | Q267: WILLIAMS
A268: GOALKICKERS
A269: DANDENONG | C269: MILLER 7 | F269: FLAHERTY 4 | I269: NANKERVIS 3 | L269: ANDREWS 2 | O269: MORROW 2 | R269: GUINANE 2 | U269: ABRAHAM | X269: KENDALL
A270: GEELONG WEST | C270: TENABEL 2 | F270: M FRY 2) | I270: ANDJELKOVIC 2 | M270: DEEATH | O270: EMOND
A272: YARRAVILLE | C272: 5 | D272: 4 | E272: =C272*6+D272 -> 34 | G272: 11 | H272: 12 | I272: =G272*6+H272 -> 78 | K272: 13 | L272: 13 | M272: =K272*6+L272 -> 91 | O272: 16 | P272: 21 | Q272: =O272*6+P272 -> 117 | S272: YARRAVILLE
A273: OAKLEIGH | C273: 3 | D273: 1 | E273: =C273*6+D273 -> 19 | G273: 6 | H273: 2 | I273: =G273*6+H273 -> 38 | K273: 10 | L273: 5 | M273: =K273*6+L273 -> 65 | O273: 10 | P273: 8 | Q273: =O273*6+P273 -> 68 | S273: TURNER
A274: BEST PLAYERS
A275: YARRAVILLE | C275: DAVIES | F275: BURGE | I275: BARR | L275: TAURENS | O275: BONGETTI | R275: KEMP
A276: OAKLEIGH | C276: LUFF | F276: MOULDEN | I276: LYON | L276: McCORKELL | O276: STEWART | R276: TRAILL
A277: GOALKICKERS
A278: YARRAVILLE | C278: BONGETTI 4 | F278: DAVIES 4 | I278: MARTIN 3 | L278: BARR 3 | N278: ROWE | P278: MATHESON
A279: OAKLEIGH | C279: MOULDEN 4 | F279: LYON 3 | H279: STEWART | J279: DONNELLY | M279: BEARD
A281: PORT MELBOURNE | C281: 3 | D281: 3 | E281: =C281*6+D281 -> 21 | G281: 7 | H281: 7 | I281: =G281*6+H281 -> 49 | K281: 11 | L281: 8 | M281: =K281*6+L281 -> 74 | O281: 15 | P281: 14 | Q281: =O281*6+P281 -> 104 | S281: BRUNSWICK
A282: BRUNSWICK | C282: 2 | D282: 1 | E282: =C282*6+D282 -> 13 | G282: 6 | H282: 6 | I282: =G282*6+H282 -> 42 | K282: 9 | L282: 9 | M282: =K282*6+L282 -> 63 | O282: 11 | P282: 10 | Q282: =O282*6+P282 -> 76 | S282: PASK
A283: BEST PLAYERS
A284: PORT MELBOURNE | C284: GOSS | E284: GARDNER | H284: HANNA | K284: PASQUILL | N284: IRELAND | Q284: EKLUND
A285: BRUNSWICK | C285: HILL | E285: BRADLEY | H285: PAGONIS | K285: LEYDIN | N285: ROBINSON | Q285: CROWLEY
A286: GOALKICKERS
A287: PORT MELBOURNE | C287: GOSS 7 | E287: McKEW 2 | H287: EKLUND 2 | K287: BEHAN | M287: BARCLAY | P287: BONNETT | R287: PASQUILL
A288: BRUNSWICK | C288: COOK 3 | E288: CROWLEY 2 | H288: MCLEOD | J288: LEYDIN | L288: HILL | M288: OGSTON | O288: BRADLEY | Q288: PAGONIS
A290: ROUND 7 | E290: 1ST JUNE | M290: WEATHER | S290: PLAYED AT
D291: 1ST QTR | H291: 2ND QTR | L291: 3RD QTR | P291: FINAL | S291: PORT MELBOURNE
A292: PORT MELBOURNE | C292: 0 | D292: 5 | E292: =C292*6+D292 -> 5 | G292: 9 | H292: 8 | I292: =G292*6+H292 -> 62 | K292: 15 | L292: 9 | M292: =K292*6+L292 -> 99 | O292: 17 | P292: 14 | Q292: =O292*6+P292 -> 116 | S292: UMPIRE | X292: LADDER | AB292: ROUND | AD292: 7
A293: DANDENONG | C293: 2 | D293: 7 | E293: =C293*6+D293 -> 19 | G293: 3 | H293: 9 | I293: =G293*6+H293 -> 27 | K293: 9 | L293: 10 | M293: =K293*6+L293 -> 64 | O293: 13 | P293: 12 | Q293: =O293*6+P293 -> 90 | S293: FLANAGAN
A294: BEST PLAYERS | W294: TEAM | X294: W | Y294: L | Z294: D | AA294: FOR | AB294: AGST | AC294: % | AD294: PTS
A295: PORT MELBOURNE | C295: GARDNER | F295: GOSS | I295: PASQUILL | L295: BARCLAY | O295: WISEMAN | R295: GROVER
A296: DANDENONG | C296: STEDWELL | F296: BETHKE | I296: MILLER | L296: ABRAHAM | O296: MORROW | R296: KENDALL | W296: PRESTON | X296: 6 | Y296: 1 | Z296: 0 | AA296: 800 | AB296: 487 | AC296: 164.27104722792609 | AD296: 24
A297: GOALKICKERS | W297: PRAHRAN | X297: 6 | Y297: 1 | Z297: 0 | AA297: 767 | AB297: 614 | AC297: 124.9185667752443 | AD297: 24
A298: PORT MELBOURNE | C298: GOSS 5 | E298: EKLUND 4 | H298: BARCLAY 3 | K298: BRICE 2 | M298: WISEMAN | O298: BROWN | Q298: McKEW | W298: SANDRINGHAM | X298: 6 | Y298: 1 | Z298: 0 | AA298: 620 | AB298: 569 | AC298: 108.96309314586995 | AD298: 24
A299: DANDENONG | C299: MILLER 5 | F299: KENDALL 3 | I299: MORROW 2 | L299: LIENERT | N299: ANDREWS | Q299: SHEEHAN | W299: PORT MELBOURNE | X299: 5 | Y299: 2 | Z299: 0 | AA299: 714 | AB299: 586 | AC299: 121.84300341296928 | AD299: 20
A301: YARRAVILLE | C301: 5 | D301: 9 | E301: =C301*6+D301 -> 39 | G301: 5 | H301: 10 | I301: =G301*6+H301 -> 40 | K301: 7 | L301: 11 | M301: =K301*6+L301 -> 53 | O301: 13 | P301: 13 | Q301: =O301*6+P301 -> 91 | S301: WAVERLEY | W301: YARRAVILLE | X301: 4 | Y301: 3 | Z301: 0 | AA301: 708 | AB301: 587 | AC301: 120.61328790459966 | AD301: 16
A302: WAVERLEY | C302: 1 | D302: 0 | E302: =C302*6+D302 -> 6 | G302: 4 | H302: 4 | I302: =G302*6+H302 -> 28 | K302: 8 | L302: 7 | M302: =K302*6+L302 -> 55 | O302: 11 | P302: 8 | Q302: =O302*6+P302 -> 74 | S302: ANDERSON | W302: DANDENONG | X302: 4 | Y302: 3 | Z302: 0 | AA302: 823 | AB302: 706 | AC302: 116.57 | AD302: 16
A303: BEST PLAYERS | W303: WAVERLEY | X303: 2 | Y303: 5 | Z303: 0 | AA303: 597 | AB303: 598 | AC303: 99.832775919732441 | AD303: 8
A304: YARRAVILLE | C304: WAGHORN | F304: DAVIES | I304: BONGETTI | L304: MARTIN | O304: QUARANTOTTO | R304: CHARLES | W304: GEELONG WEST | X304: 2 | Y304: 5 | Z304: 0 | AA304: 572 | AB304: 771 | AC304: 74.189364461738009 | AD304: 8
A305: WAVERLEY | C305: LANG | F305: POORE | I305: R HORKINGS | L305: BACKHOUSE | O305: BELL | R305: LANGFORD | W305: OAKLEIGH | X305: 0 | Y305: 7 | Z305: 0 | AA305: 489 | AB305: 790 | AC305: 61.9 | AD305: 0
A306: GOALKICKERS | W306: BRUNSWICK | X306: 0 | Y306: 7 | Z306: 0 | AA306: 452 | AB306: 834 | AC306: 54.196642685851316 | AD306: 0
A307: YARRAVILLE | C307: CASTRIKUM 3 | F307: BONGETTI 2 | I307: MARTIN 2 | L307: DAVIES 2 | N307: UBERGANG 2 | Q307: WAGHORN | S307: QUARANTOTTO
A308: WAVERLEY | C308: WARNER 3 | F308: R HORKINGS 2 | I308: LANGFORD 2 | L308: BACKHOUSE | O308: ALLAN | Q308: BATEMAN | S308: POORE
A310: PRESTON | C310: 5 | D310: 7 | E310: =C310*6+D310 -> 37 | G310: 9 | H310: 9 | I310: =G310*6+H310 -> 63 | K310: 11 | L310: 15 | M310: =K310*6+L310 -> 81 | O310: 12 | P310: 17 | Q310: =O310*6+P310 -> 89 | S310: PRESTON
A311: GEELONG WEST | C311: 1 | D311: 0 | E311: =C311*6+D311 -> 6 | G311: 2 | H311: 2 | I311: =G311*6+H311 -> 14 | K311: 3 | L311: 4 | M311: =K311*6+L311 -> 22 | O311: 5 | P311: 6 | Q311: =O311*6+P311 -> 36 | S311: O'NEILL
A312: BEST PLAYERS
A313: PRESTON | C313: TELFORD | F313: HILL | I313: CLARK | K313: REID | N313: McKERNAN | Q313: FISHER
A314: GEELONG WEST | C314: HAMILTON | F314: WILLIAMS | I314: FRY | K314: SKOWRONSKI | N314: STACEY | Q314: TENABEL
A315: GOALKICKERS
A316: PRESTON | C316: REID 4 | F316: CLARK 4 | I316: JOYCE 3 | K316: A PERRY
A317: GEELONG WEST | C317: SMITH 3 | F317: ADAMS | I317: FRY
A319: SANDRINGHAM | C319: 2 | D319: 2 | E319: =C319*6+D319 -> 14 | G319: 3 | H319: 4 | I319: =G319*6+H319 -> 22 | K319: 6 | L319: 6 | M319: =K319*6+L319 -> 42 | O319: 9 | P319: 8 | Q319: =O319*6+P319 -> 62 | S319: OAKLEIGH
A320: OAKLEIGH | C320: 1 | D320: 4 | E320: =C320*6+D320 -> 10 | G320: 3 | H320: 7 | I320: =G320*6+H320 -> 25 | K320: 5 | L320: 10 | M320: =K320*6+L320 -> 40 | O320: 7 | P320: 13 | Q320: =O320*6+P320 -> 55 | S320: HOLZER
A321: BEST PLAYERS
A322: SANDRINGHAM | C322: LOCKHART | F322: HANCE | I322: AUSTIN | L322: HAMMOND | O322: B WARD | R322: HOGAN
A323: OAKLEIGH | C323: FORD | F323: LUFF | I323: LYON | L323: B McCORKELL | O323: DONNELLY | R323: WAPLING
A324: GOALKICKERS
A325: SANDRINGHAM | C325: ADDISON 2 | F325: HOGAN 2 | I325: ELLIS | K325: J WARD | M325: HANCE | O325: AUSTIN | Q325: WILLIAMS
A326: OAKLEIGH | C326: WAPLING 2 | F326: STEWART | I326: DONNELLY | K326: JONES | M326: HAYNES | O326: LYON
A328: PRAHRAN | C328: 6 | D328: 7 | E328: =C328*6+D328 -> 43 | G328: 7 | H328: 8 | I328: =G328*6+H328 -> 50 | K328: 13 | L328: 12 | M328: =K328*6+L328 -> 90 | O328: 15 | P328: 13 | Q328: =O328*6+P328 -> 103 | S328: TOORAK PARK
A329: BRUNSWICK | C329: 1 | D329: 3 | E329: =C329*6+D329 -> 9 | G329: 5 | H329: 5 | I329: =G329*6+H329 -> 35 | K329: 7 | L329: 7 | M329: =K329*6+L329 -> 49 | O329: 10 | P329: 8 | Q329: =O329*6+P329 -> 68 | S329: TOOHEY
A330: BEST PLAYERS
A331: PRAHRAN | C331: KNOX | F331: POWER | I331: GRANGE | L331: CROWE | O331: JUNGWIRTH | R331: PARKER
A332: BRUNSWICK | C332: CROWLEY | F332: OGSTON | I332: COOK | L332: MATTHEWS | O332: BRIGLIA | R332: McLEOD
A333: GOALKICKERS
A334: PRAHRAN | C334: POWER 5 | F334: GRANGE 4 | I334: FAHEY 2 | K334: CAFFYN 2 | M334: CROWE | O334: JUNGWIRTH
A335: BRUNSWICK | C335: COOK 4 | F335: HATWELL | I335: McLEOD | K335: MATTHEWS | N335: BRADLEY | P335: ROBINSON
A337: ROUND 8 | E337: 8TH JUNE | J337: WEATHER | N337: NORTH WIND | S337: PLAYED AT
D338: 1ST QTR | H338: 2ND QTR | L338: 3RD QTR | P338: FINAL | S338: BEACH ROAD
A339: SANDRINGHAM | C339: 2 | D339: 3 | E339: =C339*6+D339 -> 15 | G339: 9 | H339: 9 | I339: =G339*6+H339 -> 63 | K339: 11 | L339: 9 | M339: =K339*6+L339 -> 75 | O339: 16 | P339: 14 | Q339: =O339*6+P339 -> 110 | S339: UMPIRE | X339: LADDER | AB339: ROUND | AD339: 8
A340: PRAHRAN | C340: 5 | D340: 4 | E340: =C340*6+D340 -> 34 | G340: 9 | H340: 5 | I340: =G340*6+H340 -> 59 | K340: 13 | L340: 7 | M340: =K340*6+L340 -> 85 | O340: 16 | P340: 8 | Q340: =O340*6+P340 -> 104 | S340: McMASTER
A341: BEST PLAYERS | W341: TEAM | X341: W | Y341: L | Z341: D | AA341: FOR | AB341: AGST | AC341: % | AD341: PTS
A342: SANDRINGHAM | C342: ADDISON | F342: MUTER | I342: K WILLS | L342: HAMMOND | O342: HOGAN | Q342: SELLECK
A343: PRAHRAN | C343: HUTCHESSON | F343: PARKER | I343: McMAHON | L343: BRADLEY | O343: ROSE | Q343: CAFFYN | W343: PRESTON | X343: 7 | Y343: 1 | Z343: 0 | AA343: 876 | AB343: 555 | AC343: 157.83783783783784 | AD343: 28
A344: GOALKICKERS | Q344: HAMMOND | W344: SANDRINGHAM | X344: 7 | Y344: 1 | Z344: 0 | AA344: 730 | AB344: 673 | AC344: 108.46953937592868 | AD344: 28
A345: SANDRINGHAM | C345: ADDISON 4 | F345: J WARD 3 | I345: HOGAN 2 | K345: WILIAMS 2 | N345: HANCE | P345: LATCHEM | R345: AUSTIN | T345: K WILLS | W345: PRAHRAN | X345: 6 | Y345: 2 | Z345: 0 | AA345: 871 | AB345: 724 | AC345: 120.30386740331491 | AD345: 24
A346: PRAHRAN | C346: HUTCHESSON 5 | F346: PARKER 4 | I346: ANDREW 2 | L346: POWER 2 | N346: KARANICHOLAS | R346: FAHEY | T346: CAFFYN | W346: PORT MELBOURNE | X346: 5 | Y346: 3 | Z346: 0 | AA346: 782 | AB346: 662 | AC346: 118.12688821752266 | AD346: 20
A348: GEELONG WEST | C348: 1 | D348: 1 | E348: =C348*6+D348 -> 7 | G348: 2 | H348: 5 | I348: =G348*6+H348 -> 17 | K348: 6 | L348: 6 | M348: =K348*6+L348 -> 42 | O348: 11 | P348: 10 | Q348: =O348*6+P348 -> 76 | S348: GEELONG WEST | W348: DANDENONG | X348: 5 | Y348: 3 | Z348: 0 | AA348: 955 | AB348: 836 | AC348: 114.23 | AD348: 20
A349: PORT MELBOURNE | C349: 1 | D349: 6 | E349: =C349*6+D349 -> 12 | G349: 3 | H349: 9 | I349: =G349*6+H349 -> 27 | K349: 8 | L349: 11 | M349: =K349*6+L349 -> 59 | O349: 9 | P349: 14 | Q349: =O349*6+P349 -> 68 | S349: HOLZER | W349: YARRAVILLE | X349: 4 | Y349: 4 | Z349: 0 | AA349: 838 | AB349: 719 | AC349: 116.55076495132128 | AD349: 16
A350: BEST PLAYERS | W350: GEELONG WEST | X350: 3 | Y350: 5 | Z350: 0 | AA350: 648 | AB350: 839 | AC350: 77.234803337306317 | AD350: 12
A351: GEELONG WEST | C351: WILLIAMS | F351: M FRY | I351: EMOND | L351: HAMILTON | O351: TENABEL | R351: STACEY | W351: WAVERLEY | X351: 2 | Y351: 6 | Z351: 0 | AA351: 665 | AB351: 674 | AC351: 98.664688427299708 | AD351: 8
A352: PORT MELBOURNE | C352: PASQUILL | F352: GOSS | I352: GARDNER | L352: BRICE | O352: G ALLEN | R352: IRELAND | W352: OAKLEIGH | X352: 1 | Y352: 7 | Z352: 0 | AA352: 597 | AB352: 843 | AC352: 70.82 | AD352: 4
A353: GOALKICKERS | W353: BRUNSWICK | X353: 0 | Y353: 8 | Z353: 0 | AA353: 505 | AB353: 942 | AC353: 53.609341825902334 | AD353: 0
A354: GEELONG WEST | C354: EMOND 4 | F354: M FRY 4 | I354: ADAMS 2 | L354: JULIEN
A355: PORT MELBOURNE | C355: BRICE 2 | E355: GOSS | G355: BEHAN | I355: WISEMAN | K355: IRELAND | M355: PASQUILL | O355: EKLUND | Q355: McKEW
A357: PRESTON | C357: 2 | D357: 5 | E357: =C357*6+D357 -> 17 | G357: 3 | H357: 7 | I357: =G357*6+H357 -> 25 | K357: 8 | L357: 13 | M357: =K357*6+L357 -> 61 | O357: 10 | P357: 16 | Q357: =O357*6+P357 -> 76 | S357: PRESTON
A358: WAVERLEY | C358: 0 | D358: 0 | E358: =C358*6+D358 -> 0 | G358: 5 | H358: 4 | I358: =G358*6+H358 -> 34 | K358: 6 | L358: 7 | M358: =K358*6+L358 -> 43 | O358: 9 | P358: 14 | Q358: =O358*6+P358 -> 68 | S358: PASK
A359: BEST PLAYERS
A360: PRESTON | C360: McARTHUR | F360: McKERNAN | I360: TELFORD | L360: REID | O360: HILL | Q360: McLEAN
A361: WAVERLEY | C361: BLEW | F361: POORE | I361: WARNER | L361: BATEMAN | O361: SYKES | Q361: R HORKINGS
A362: GOALKICKERS
A363: PRESTON | C363: JOYCE 3 | F363: McLEAN 2 | I363: TICKELL | K363: G PERRY | M363: REID | N363: McARTHUR | Q363: CLARK
A364: WAVERLEY | C364: BLEW 3 | F364: POORE 3 | I364: R HORKINGS | L364: BATEMAN | O364: ALLAN
E365: 14TH JUNE | J365: WEATHER | M365: WEST BREEZE FINE
A366: OAKLEIGH | C366: 7 | D366: 5 | E366: =C366*6+D366 -> 47 | G366: 7 | H366: 9 | I366: =G366*6+H366 -> 51 | K366: 11 | L366: 15 | M366: =K366*6+L366 -> 81 | O366: 15 | P366: 18 | Q366: =O366*6+P366 -> 108 | S366: OAKLEIGH
A367: BRUNSWICK | C367: 2 | D367: 1 | E367: =C367*6+D367 -> 13 | G367: 3 | H367: 2 | I367: =G367*6+H367 -> 20 | K367: 5 | L367: 7 | M367: =K367*6+L367 -> 37 | O367: 7 | P367: 11 | Q367: =O367*6+P367 -> 53 | S367: BREWER
A368: BEST PLAYERS
A369: OAKLEIGH | C369: STEWART | F369: FORD | I369: WAPLING | L369: LYON | O369: BONESS | R369: JORDAN
A370: BRUNSWICK | C370: McLEOD | F370: COOK | I370: KICK | L370: DALTON | O370: OGSTAN | R370: DIETRICH
A371: GOALKICKERS
A372: OAKLEIGH | C372: MOULDEN 3 | F372: WAPLING 3 | I372: FORD 2 | K372: LYON 2 | M372: TRAILL 2 | O372: HAYNES | Q372: JONES | S372: SYKES
A373: BRUNSWICK | C373: McLEOD 2 | F373: SINCLAIR 2 | I373: MATTHEWS | L373: DALTON | N373: McKINNON
D374: 15TH JUNE | J374: WEATHER | M374: SOUTH EAST WIND
A375: DANDENONG | C375: 3 | D375: 7 | E375: =C375*6+D375 -> 25 | G375: 7 | H375: 14 | I375: =G375*6+H375 -> 56 | K375: 13 | L375: 16 | M375: =K375*6+L375 -> 94 | O375: 18 | P375: 24 | Q375: =O375*6+P375 -> 132 | S375: DANDENONG
A376: YARRAVILLE | C376: 7 | D376: 3 | E376: =C376*6+D376 -> 45 | G376: 10 | H376: 5 | I376: =G376*6+H376 -> 65 | K376: 18 | L376: 6 | M376: =K376*6+L376 -> 114 | O376: 20 | P376: 10 | Q376: =O376*6+P376 -> 130 | S376: MCKENZIE
A377: BEST PLAYERS
A378: DANDENONG | C378: SHEEHAN | F378: BETHKE | I378: TONKS | L378: NANKERVIS | O378: MORROW | R378: FLAHERTY
A379: YARRAVILLE | C379: COOK | F379: HERIOT | I379: TAURENS | L379: BARR | O379: WARWICK | R379: DAVIES
A380: GOALKICKERS
A381: DANDENONG | C381: FLAHERTY 4 | F381: NANKERVIS 4 | I381: MELAI 3 | K381: MORROW 2 | N381: MILLER 2 | Q381: ABRAHAM | T381: GUINANE | W381: SHEEHAN
A382: YARRAVILLE | C382: COOK 5 | F382: BONGETTI 4 | I382: DAVIES 3 | K382: CONNELLY 2 | N382: KEMP 2 | P382: BARR | R382: MARTIN | T382: CASTRIKUM | W382: QUARANTOTTO
A384: ROUND 9 | E384: 22ND JUNE | J384: WEATHER | N384: FINE | S384: PLAYED AT
D385: 1ST QTR | H385: 2ND QTR | L385: 3RD QTR | P385: FINAL | S385: PORT MELBOURNE
A386: PRESTON | C386: 6 | D386: 3 | E386: =C386*6+D386 -> 39 | G386: 9 | H386: 4 | I386: =G386*6+H386 -> 58 | K386: 13 | L386: 9 | M386: =K386*6+L386 -> 87 | O386: 18 | P386: 14 | Q386: =O386*6+P386 -> 122 | S386: UMPIRE | X386: LADDER | AB386: ROUND | AD386: 9
A387: PORT MELBOURNE | C387: 4 | D387: 2 | E387: =C387*6+D387 -> 26 | G387: 8 | H387: 5 | I387: =G387*6+H387 -> 53 | K387: 14 | L387: 5 | M387: =K387*6+L387 -> 89 | O387: 19 | P387: 7 | Q387: =O387*6+P387 -> 121 | S387: BREWER
A388: BEST PLAYERS | W388: TEAM | X388: W | Y388: L | Z388: D | AA388: FOR | AB388: AGST | AC388: % | AD388: PTS
A389: PRESTON | C389: CLARK | F389: HINDMARSH | I389: JOYCE | L389: McKERNAN | O389: GOAD | Q389: REID
A390: PORT MELBOURNE | C390: BEHAN | F390: GARDNER | I390: IRELAND | L390: GOSS | O390: BRICE | Q390: PASQUILL | W390: PRESTON | X390: 8 | Y390: 1 | Z390: 0 | AA390: 998 | AB390: 676 | AC390: 147.63313609467457 | AD390: 32
A391: GOALKICKERS | W391: SANDRINGHAM | X391: 8 | Y391: 1 | Z391: 0 | AA391: 887 | AB391: 816 | AC391: 108.70098039215686 | AD391: 32
A392: PRESTON | C392: JOYCE 5 | F392: CLARK 5 | I392: HINDMARSH 3 | L392: REID 2 | N392: McARTHUR | Q392: RULE | R392: LESLIE | W392: DANDENONG | X392: 6 | Y392: 3 | Z392: 0 | AA392: 1101 | AB392: 930 | AC392: 118.39 | AD392: 24
A393: PORT MELBOURNE | C393: IRELAND 5 | F393: GOSS 4 | H393: PASQUILL 3 | K393: BARCLAY 2 | N393: EKLUND 2 | Q393: BRICE 2 | S393: BEHAN | W393: PRAHRAN | X393: 6 | Y393: 3 | Z393: 0 | AA393: 965 | AB393: 870 | AC393: 110.91954022988506 | AD393: 24
A395: DANDENONG | C395: 9 | D395: 3 | E395: =C395*6+D395 -> 57 | G395: 13 | H395: 8 | I395: =G395*6+H395 -> 86 | K395: 18 | L395: 11 | M395: =K395*6+L395 -> 119 | O395: 22 | P395: 14 | Q395: =O395*6+P395 -> 146 | S395: TOORAK PARK | W395: PORT MELBOURNE | X395: 5 | Y395: 4 | Z395: 0 | AA395: 903 | AB395: 784 | AC395: 115.17857142857143 | AD395: 20
A396: PRAHRAN | C396: 5 | D396: 3 | E396: =C396*6+D396 -> 33 | G396: 8 | H396: 6 | I396: =G396*6+H396 -> 54 | K396: 11 | L396: 9 | M396: =K396*6+L396 -> 75 | O396: 13 | P396: 16 | Q396: =O396*6+P396 -> 94 | S396: O'NEILL | W396: YARRAVILLE | X396: 4 | Y396: 5 | Z396: 0 | AA396: 981 | AB396: 876 | AC396: 111.98630136986301 | AD396: 16
A397: BEST PLAYERS | W397: GEELONG WEST | X397: 3 | Y397: 6 | Z397: 0 | AA397: 737 | AB397: 931 | AC397: 79.162191192266377 | AD397: 12
A398: DANDENONG | C398: FLAHERTY | F398: STEDWELL | I398: MILLER | L398: NANKERVIS | O398: SHEEHAN | R398: BETHKE | W398: WAVERLEY | X398: 2 | Y398: 7 | Z398: 0 | AA398: 765 | AB398: 781 | AC398: 97.951344430217674 | AD398: 8
A399: PRAHRAN | C399: ROSE | F399: HUTCHESSON | I399: KNOX | L399: FAHEY | O399: McMAHON | R399: DICKESON | W399: OAKLEIGH | X399: 2 | Y399: 7 | Z399: 0 | AA399: 704 | AB399: 943 | AC399: 74.66 | AD399: 8
A400: GOALKICKERS | W400: BRUNSWICK | X400: 1 | Y400: 8 | Z400: 0 | AA400: 597 | AB400: 1031 | AC400: 57.904946653734235 | AD400: 4
A401: DANDENONG | C401: MILLER 9 | E401: NANKERVIS 4 | H401: MORROW 3 | K401: FLAHERTY 3 | N401: GUINANE | P401: ABRAHAM | R401: SHEEHAN
A402: PRAHRAN | C402: POWER 3 | E402: CAFFYN 2 | H402: CROWE 2 | J402: GRANGE 2 | M402: BRADLEY | O402: BARTLETT | Q402: FAHEY | S402: HUTCHESSON
A404: SANDRINGHAM | C404: 6 | D404: 2 | E404: =C404*6+D404 -> 38 | G404: 8 | H404: 6 | I404: =G404*6+H404 -> 54 | K404: 19 | L404: 8 | M404: =K404*6+L404 -> 122 | O404: 24 | P404: 13 | Q404: =O404*6+P404 -> 157 | S404: YARRAVILLE
A405: YARRAVILLE | C405: 6 | D405: 4 | E405: =C405*6+D405 -> 40 | G405: 15 | H405: 8 | I405: =G405*6+H405 -> 98 | K405: 18 | L405: 10 | M405: =K405*6+L405 -> 118 | O405: 22 | P405: 11 | Q405: =O405*6+P405 -> 143 | S405: TOOHEY
A406: BEST PLAYERS
A407: SANDRINGHAM | C407: WILLIAMS | F407: HANCE | I407: SELLECK | L407: HOGAN | O407: K WILLS | R407: MACKENZIE
A408: YARRAVILLE | C408: BONGETTI | F408: WAGHORN | I408: TAURINS | L408: COOK | O408: WARWICK | R408: DAVIES
A409: GOALKICKERS
A410: SANDRINGHAM | C410: WILLIAMS 6 | F410: HANCE 4 | I410: ZEUSCHNER 3 | L410: HOGAN 3 | N410: J WARD 2 | Q410: SELLECK 2 | S410: ADDISON 2 | V410: MUTER | X410: MACKENZIE
A411: YARRAVILLE | C411: BONGETTI 8 | F411: WAGHORN 4 | I411: SKIDMORE 2 | L411: KEMP 2 | N411: CONNELLY 2 | Q411: COOK | R411: MATHESON | U411: WARWICK | X411: QUARANTOTTO
A413: OAKLEIGH | C413: 4 | D413: 3 | E413: =C413*6+D413 -> 27 | G413: 7 | H413: 7 | I413: =G413*6+H413 -> 49 | K413: 14 | L413: 11 | M413: =K413*6+L413 -> 95 | O413: 16 | P413: 11 | Q413: =O413*6+P413 -> 107 | S413: WAVERLEY
A414: WAVERLEY | C414: 2 | D414: 5 | E414: =C414*6+D414 -> 17 | G414: 6 | H414: 9 | I414: =G414*6+H414 -> 45 | K414: 9 | L414: 10 | M414: =K414*6+L414 -> 64 | O414: 14 | P414: 16 | Q414: =O414*6+P414 -> 100 | S414: FLANAGAN
A415: BEST PLAYERS
A416: OAKLEIGH | C416: BEARD | F416: JONES | I416: MOULDEN | L416: GORDES | N416: WAPLING | Q416: FORD
A417: WAVERLEY | C417: McKENZIE | F417: WARNER | I417: R HORKINGS | L417: BLEW | N417: LANE | Q417: LANGFORD
A418: GOALKICKERS
A419: OAKLEIGH | C419: MOULDEN 6 | F419: JONES 3 | I419: WAPLING 2 | L419: BEARD 2 | N419: DONNELLY | Q419: TEMME | S419: TRAILL
A420: WAVERLEY | C420: WARNER 4 | F420: STEPHENS 3 | I420: MCKENZIE 2 | L420: BACKHOUSE | N420: R HORKINGS | Q420: LANGFORD | S420: POORE | U420: BELL
A422: BRUNSWICK | C422: 1 | D422: 3 | E422: =C422*6+D422 -> 9 | G422: 4 | H422: 9 | I422: =G422*6+H422 -> 33 | K422: 11 | L422: 10 | M422: =K422*6+L422 -> 76 | O422: 13 | P422: 14 | Q422: =O422*6+P422 -> 92 | S422: BRUNSWICK
A423: GEELONG WEST | C423: 3 | D423: 5 | E423: =C423*6+D423 -> 23 | G423: 7 | H423: 11 | I423: =G423*6+H423 -> 53 | K423: 7 | L423: 14 | M423: =K423*6+L423 -> 56 | O423: 12 | P423: 17 | Q423: =O423*6+P423 -> 89 | S423: GAMBETTA
A424: BEST PLAYERS
A425: BRUNSWICK | C425: COOK | F425: DALTON | I425: NOONAN | L425: OGSTON | O425: K GREIG | Q425: BOOTH
A426: GEELONG WEST | C426: WILLIAMS | F426: SMITH | I426: ADAMS | L426: EMOND | O426: G FRY | Q426: LARKINS
A427: GOALKICKERS
A428: BRUNSWICK | C428: COOK 5 | F428: K GREIG 3 | I428: LEYDIN 2 | K428: MCLEOD | M428: DALTON | O428: OGSTON
A429: GEELONG WEST | C429: TENABEL 3 | F429: SMITH 3 | I429: BARRY 2 | K429: ADAMS 2 | N429: ANDJELKOVIC | Q429: M FRY
A431: ROUND 10 | E431: 29TH JUNE | J431: WEATHER | N431: NORTH WIND | S431: PLAYED AT
D432: 1ST QTR | H432: 2ND QTR | L432: 3RD QTR | P432: FINAL | S432: PRESTON
A433: PRESTON | C433: 7 | D433: 7 | E433: =C433*6+D433 -> 49 | G433: 7 | H433: 8 | I433: =G433*6+H433 -> 50 | K433: 13 | L433: 11 | M433: =K433*6+L433 -> 89 | O433: 14 | P433: 15 | Q433: =O433*6+P433 -> 99 | S433: UMPIRE | X433: LADDER | AB433: ROUND | AD433: 10
A434: PRAHRAN | C434: 2 | D434: 0 | E434: =C434*6+D434 -> 12 | G434: 5 | H434: 5 | I434: =G434*6+H434 -> 35 | K434: 5 | L434: 6 | M434: =K434*6+L434 -> 36 | O434: 7 | P434: 10 | Q434: =O434*6+P434 -> 52 | S434: HOLZER
A435: BEST PLAYERS | W435: TEAM | X435: W | Y435: L | Z435: D | AA435: FOR | AB435: AGST | AC435: % | AD435: PTS
A436: PRESTON | C436: HILL | F436: McKERNAN | I436: REID | L436: TELFORD | O436: JOYCE | Q436: HEARD
A437: PRAHRAN | C437: ROSE | F437: HUTCHESSON | I437: DICKESON | L437: CROWE | O437: POWER | Q437: GRANGE | W437: PRESTON | X437: 9 | Y437: 1 | Z437: 0 | AA437: 1097 | AB437: 728 | AC437: 150.6868131868132 | AD437: 36
A438: GOALKICKERS | W438: SANDRINGHAM | X438: 9 | Y438: 1 | Z438: 0 | AA438: 995 | AB438: 919 | AC438: 108.26985854189336 | AD438: 36
A439: PRESTON | C439: JOYCE 6 | F439: REID 2 | H439: HEARD 2 | J439: McLEAN 2 | M439: LESLIE | O439: TELFORD | W439: DANDENONG | X439: 7 | Y439: 3 | Z439: 0 | AA439: 1209 | AB439: 1025 | AC439: 117.95 | AD439: 28
A440: PRAHRAN | C440: POWER 4 | F440: PARKER | I440: KEDDIE | K440: HUTCHESSON | W440: PORT MELBOURNE | X440: 6 | Y440: 4 | Z440: 0 | AA440: 973 | AB440: 834 | AC440: 116.66666666666667 | AD440: 24
A442: YARRAVILLE | C442: 3 | D442: 4 | E442: =C442*6+D442 -> 22 | G442: 7 | H442: 8 | I442: =G442*6+H442 -> 50 | K442: 12 | L442: 12 | M442: =K442*6+L442 -> 84 | O442: 18 | P442: 15 | Q442: =O442*6+P442 -> 123 | S442: GEELONG WEST | W442: PRAHRAN | X442: 6 | Y442: 4 | Z442: 0 | AA442: 1017 | AB442: 969 | AC442: 104.95356037151703 | AD442: 24
A443: GEELONG WEST | C443: 2 | D443: 2 | E443: =C443*6+D443 -> 14 | G443: 7 | H443: 7 | I443: =G443*6+H443 -> 49 | K443: 8 | L443: 7 | M443: =K443*6+L443 -> 55 | O443: 9 | P443: 15 | Q443: =O443*6+P443 -> 69 | S443: DUGARD | W443: YARRAVILLE | X443: 5 | Y443: 5 | Z443: 0 | AA443: 1104 | AB443: 945 | AC443: 116.82539682539682 | AD443: 20
A444: BEST PLAYERS | W444: GEELONG WEST | X444: 3 | Y444: 7 | Z444: 0 | AA444: 806 | AB444: 1054 | AC444: 76.470588235294116 | AD444: 12
A445: YARRAVILLE | C445: CUMMING | F445: COOK | I445: BONGETTI | L445: MARTIN | O445: WARWICK | R445: HEYME | W445: WAVERLEY | X445: 2 | Y445: 8 | Z445: 0 | AA445: 860 | AB445: 889 | AC445: 96.737907761529812 | AD445: 8
A446: GEELONG WEST | C446: SKOWRONSKI | F446: G FRY | I446: ADAMS | L446: O'REILLY | O446: WILLIAMS | R446: G O'DONNELL | W446: OAKLEIGH | X446: 2 | Y446: 8 | Z446: 0 | AA446: 754 | AB446: 1013 | AC446: 74.43 | AD446: 8
A447: GOALKICKERS | O447: CHARLES | Q447: QUARANTOTTO | W447: BRUNSWICK | X447: 1 | Y447: 9 | Z447: 0 | AA447: 700 | AB447: 1139 | AC447: 61.457418788410884 | AD447: 4
A448: YARRAVILLE | C448: UBERGANG 4 | F448: CUMMING 3 | I448: MARTIN 3 | K448: BONGETTI 2 | N448: COOK 2 | P448: WAGHORN | R448: DAVIES
A449: GEELONG WEST | C449: G O'DONNELL 2 | F449: TENABEL | I449: R MOORE | K449: JULIEN | M449: ADAMS | O449: DEEATH | Q449: WILLIAMS | S449: M FRY
A451: DANDENONG | C451: 6 | D451: 4 | E451: =C451*6+D451 -> 40 | G451: 7 | H451: 6 | I451: =G451*6+H451 -> 48 | K451: 14 | L451: 9 | M451: =K451*6+L451 -> 93 | O451: 16 | P451: 12 | Q451: =O451*6+P451 -> 108 | S451: DANDENONG
A452: WAVERLEY | C452: 0 | D452: 0 | E452: =C452*6+D452 -> 0 | G452: 5 | H452: 9 | I452: =G452*6+H452 -> 39 | K452: 5 | L452: 10 | M452: =K452*6+L452 -> 40 | O452: 13 | P452: 17 | Q452: =O452*6+P452 -> 95 | S452: McMASTER
A453: BEST PLAYERS
A454: DANDENONG | C454: FLAHERTY | F454: STEDWELL | I454: McNAMARA | L454: MILLER | O454: EVANS | Q454: SHEEHAN
A455: WAVERLEY | C455: ALLAN | F455: R HORKINGS | I455: STEPHENS | L455: PETZKE | O455: MORRIS | Q455: BLEW
A456: GOALKICKERS
A457: DANDENONG | C457: MILLER 6 | F457: FLAHERTY 4 | I457: ELLIS 2 | K457: SHEEHAN 2 | N457: NANKERVIS | Q457: GUINANE
A458: WAVERLEY | C458: EBERT 3 | F458: HARDERS 3 | I458: POORE 2 | K458: MORRIS | M458: McKENZIE | P458: ALLAN | R458: STEPHENS | U458: R HORKINGS
A460: PORT MELBOURNE | C460: 6 | D460: 3 | E460: =C460*6+D460 -> 39 | G460: 8 | H460: 7 | I460: =G460*6+H460 -> 55 | K460: 9 | L460: 7 | M460: =K460*6+L460 -> 61 | O460: 10 | P460: 10 | Q460: =O460*6+P460 -> 70 | S460: OAKLEIGH
A461: OAKLEIGH | C461: 3 | D461: 2 | E461: =C461*6+D461 -> 20 | G461: 5 | H461: 5 | I461: =G461*6+H461 -> 35 | K461: 7 | L461: 6 | M461: =K461*6+L461 -> 48 | O461: 7 | P461: 8 | Q461: =O461*6+P461 -> 50 | S461: McKENZIE
A462: BEST PLAYERS
A463: PORT MELBOURNE | C463: G ALLEN | F463: CAULFIELD | I463: BRICE | K463: DAVEY | N463: GARDNER | Q463: ANDERSON
A464: OAKLEIGH | C464: STEWART | F464: FORD | I464: LYON | K464: TRAILL | N464: SYKES | Q464: BEARD
A465: GOALKICKERS
A466: PORT MELBOURNE | C466: N ANDERSON 5 | F466: GOSS | H466: BEHAN | J466: BARCLAY | M466: PASQUILL | O466: EKLUND
A467: OAKLEIGH | C467: WAPLING 2 | F467: JONES 2 | I467: HAYNES | K467: LYON | M467: FORD
A469: SANDRINGHAM | C469: 2 | D469: 0 | E469: =C469*6+D469 -> 12 | G469: 10 | H469: 5 | I469: =G469*6+H469 -> 65 | K469: 12 | L469: 5 | M469: =K469*6+L469 -> 77 | O469: 16 | P469: 12 | Q469: =O469*6+P469 -> 108 | S469: BEACH ROAD
A470: BRUNSWICK | C470: 7 | D470: 6 | E470: =C470*6+D470 -> 48 | G470: 8 | H470: 6 | I470: =G470*6+H470 -> 54 | K470: 13 | L470: 11 | M470: =K470*6+L470 -> 89 | O470: 15 | P470: 13 | Q470: =O470*6+P470 -> 103 | S470: ANDERSON
A471: BEST PLAYERS
A472: SANDRINGHAM | C472: K WILLS | F472: WILLIAMS | I472: HAMMOND | L472: HANCE | O472: AUSTIN | R472: B WARD
A473: BRUNSWICK | C473: K GREIG | F473: OGSTON | I473: BRADLEY | L473: DALTON | O473: McKINNON | R473: COOK
A474: GOALKICKERS
A475: SANDRINGHAM | C475: WILLIAMS 3 | F475: AUSTIN 3 | I475: D WILLS 3 | L475: ADDISON 2 | O475: HANCE 2 | Q475: J WARD | S475: MACKENZIE | W475: SHARROCK
A476: BRUNSWICK | C476: COOK 6 | F476: K GREIG 3 | I476: BRADLEY 2 | L476: WROUT | N476: SMITH | P476: ANDERSON | S476: LEYDIN
A478: ROUND 11 | E478: 6TH JULY | J478: WEATHER | N478: WEST WIND | S478: PLAYED AT
D479: 1ST QTR | H479: 2ND QTR | L479: 3RD QTR | P479: FINAL | S479: PORT MELBOURNE
A480: PORT MELBOURNE | C480: 4 | D480: 8 | E480: =C480*6+D480 -> 32 | G480: 6 | H480: 10 | I480: =G480*6+H480 -> 46 | K480: 11 | L480: 15 | M480: =K480*6+L480 -> 81 | O480: 14 | P480: 17 | Q480: =O480*6+P480 -> 101 | S480: UMPIRE | X480: LADDER | AB480: ROUND | AD480: 11
A481: SANDRINGHAM | C481: 1 | D481: 6 | E481: =C481*6+D481 -> 12 | G481: 6 | H481: 9 | I481: =G481*6+H481 -> 45 | K481: 9 | L481: 12 | M481: =K481*6+L481 -> 66 | O481: 11 | P481: 15 | Q481: =O481*6+P481 -> 81 | S481: O'NEILL
A482: BEST PLAYERS | W482: TEAM | X482: W | Y482: L | Z482: D | AA482: FOR | AB482: AGST | AC482: % | AD482: PTS
A483: PORT MELBOURNE | C483: BRICE | F483: GOSS | I483: PHILLIPS | L483: BEHAN | N483: EKLUND | Q483: GROVER
A484: SANDRINGHAM | C484: LOCKHART | F484: HAMMOND | I484: WILLIAMS | L484: BUSSE | N484: MACKENZIE | Q484: SELLECK | W484: PRESTON | X484: 10 | Y484: 1 | Z484: 0 | AA484: 1252 | AB484: 786 | AC484: 159.28753180661579 | AD484: 40
A485: GOALKICKERS | W485: SANDRINGHAM | X485: 9 | Y485: 2 | Z485: 0 | AA485: 1076 | AB485: 1020 | AC485: 105.49019607843137 | AD485: 36
A486: PORT MELBOURNE | C486: EKLUND 5 | F486: GOSS 3 | H486: BRICE 2 | J486: BEHAN | L486: BARCLAY | N486: PHILLIPS | Q486: McKEW | W486: DANDENONG | X486: 8 | Y486: 3 | Z486: 0 | AA486: 1315 | AB486: 1097 | AC486: 119.87 | AD486: 32
A487: SANDRINGHAM | C487: WILLIAMS 4 | F487: SHARROCK 2 | I487: AUSTIN 2 | L487: HANCE | N487: ZEUSCHNER | Q487: HOGAN | W487: PORT MELBOURNE | X487: 7 | Y487: 4 | Z487: 0 | AA487: 1074 | AB487: 915 | AC487: 117.37704918032787 | AD487: 28
A489: PRESTON | C489: 1 | D489: 5 | E489: =C489*6+D489 -> 11 | G489: 10 | H489: 9 | I489: =G489*6+H489 -> 69 | K489: 14 | L489: 11 | M489: =K489*6+L489 -> 95 | O489: 23 | P489: 17 | Q489: =O489*6+P489 -> 155 | S489: YARRAVILLE | W489: PRAHRAN | X489: 7 | Y489: 4 | Z489: 0 | AA489: 1117 | AB489: 1039 | AC489: 107.50721847930703 | AD489: 28
A490: YARRAVILLE | C490: 2 | D490: 3 | E490: =C490*6+D490 -> 15 | G490: 2 | H490: 3 | I490: =G490*6+H490 -> 15 | K490: 8 | L490: 8 | M490: =K490*6+L490 -> 56 | O490: 8 | P490: 10 | Q490: =O490*6+P490 -> 58 | S490: FLANAGAN | W490: YARRAVILLE | X490: 5 | Y490: 6 | Z490: 0 | AA490: 1162 | AB490: 1100 | AC490: 105.63636363636364 | AD490: 20
A491: BEST PLAYERS | W491: WAVERLEY | X491: 3 | Y491: 8 | Z491: 0 | AA491: 960 | AB491: 982 | AC491: 97.759674134419555 | AD491: 12
A492: PRESTON | C492: CLARK | F492: HILL | I492: SCHICKERT | L492: McLEAN | O492: LESLIE | R492: HEARD | W492: GEELONG WEST | X492: 3 | Y492: 8 | Z492: 0 | AA492: 899 | AB492: 1154 | AC492: 77.902946273830153 | AD492: 12
A493: YARRAVILLE | C493: HERIOT | F493: CHARLES | I493: MATHESON | L493: DAVIES | O493: CUMMING | R493: COOK | W493: OAKLEIGH | X493: 2 | Y493: 9 | Z493: 0 | AA493: 824 | AB493: 1113 | AC493: 74.03 | AD493: 8
A494: GOALKICKERS | W494: BRUNSWICK | X494: 1 | Y494: 10 | Z494: 0 | AA494: 772 | AB494: 1245 | AC494: 62.008032128514053 | AD494: 4
A495: PRESTON | C495: CLARK 8 | F495: McLEAN 4 | I495: JOYCE 3 | K495: KING 3 | M495: LESLIE 2 | O495: HEARD | Q495: McARTHUR | T495: REID
A496: YARRAVILLE | C496: BONGETTI 2 | F496: WAGHORN | I496: KEMP | K496: DAVIES | M496: CUMMING | O496: COOK | Q496: WARWICK
A498: WAVERLEY | C498: 4 | D498: 5 | E498: =C498*6+D498 -> 29 | G498: 7 | H498: 9 | I498: =G498*6+H498 -> 51 | K498: 12 | L498: 15 | M498: =K498*6+L498 -> 87 | O498: 13 | P498: 22 | Q498: =O498*6+P498 -> 100 | S498: WAVERLEY
A499: GEELONG WEST | C499: 2 | D499: 0 | E499: =C499*6+D499 -> 12 | G499: 6 | H499: 1 | I499: =G499*6+H499 -> 37 | K499: 11 | L499: 2 | M499: =K499*6+L499 -> 68 | O499: 15 | P499: 3 | Q499: =O499*6+P499 -> 93 | S499: BREWER
A500: BEST PLAYERS
A501: WAVERLEY | C501: BLEW | F501: McKENZIE | I501: STEPHENS | L501: POORE | N501: LANG | Q501: BACKHOUSE
A502: GEELONG WEST | C502: BARRY | F502: TENABEL | I502: EMOND | L502: JULIEN | N502: ADAMS | Q502: JENNINGS
A503: GOALKICKERS
A504: WAVERLEY | C504: McKENZIE 3 | F504: WARNER 3 | I504: R HORKINGS 2 | L504: MORRIS 2 | N504: BLEW | P504: POORE | R504: HARDERS
A505: GEELONG WEST | C505: BARRY 4 | F505: JULIEN 4 | I505: DEEATH 2 | L505: TENABEL | N505: EMOND | P505: G O'DONNELL | S505: ADAMS | U505: WILLIAMS
A507: PRAHRAN | C507: 3 | D507: 5 | E507: =C507*6+D507 -> 23 | G507: 7 | H507: 13 | I507: =G507*6+H507 -> 55 | K507: 12 | L507: 19 | M507: =K507*6+L507 -> 91 | O507: 13 | P507: 22 | Q507: =O507*6+P507 -> 100 | S507: TOORAK PARK
A508: OAKLEIGH | C508: 2 | D508: 4 | E508: =C508*6+D508 -> 16 | G508: 5 | H508: 5 | I508: =G508*6+H508 -> 35 | K508: 6 | L508: 8 | M508: =K508*6+L508 -> 44 | O508: 10 | P508: 10 | Q508: =O508*6+P508 -> 70 | S508: GAMBETTA
A509: BEST PLAYERS
A510: PRAHRAN | C510: HUTCHESSON | F510: GRANGE | I510: DICKESON | L510: CAFFYN | O510: MARINKO | Q510: CROWE
A511: OAKLEIGH | C511: FORD | F511: WAPLING | I511: MURNANE | L511: HAYNES | O511: LUFF | Q511: BEARD
A512: GOALKICKERS
A513: PRAHRAN | C513: POWER 4 | F513: FAHEY 2 | I513: CAFFYN 2 | L513: PARKER 2 | N513: CROWE | P513: ANDREW | R513: HUTCHESSON
A514: OAKLEIGH | C514: WAPLING 3 | F514: FORD 2 | H514: BEARD 2 | J514: STEWART | L514: SYKES | N514: MURNANE
A516: DANDENONG | C516: 3 | D516: 3 | E516: =C516*6+D516 -> 21 | G516: 6 | H516: 9 | I516: =G516*6+H516 -> 45 | K516: 12 | L516: 14 | M516: =K516*6+L516 -> 86 | O516: 14 | P516: 22 | Q516: =O516*6+P516 -> 106 | S516: BRUNSWICK
A517: BRUNSWICK | C517: 3 | D517: 1 | E517: =C517*6+D517 -> 19 | G517: 5 | H517: 4 | I517: =G517*6+H517 -> 34 | K517: 8 | L517: 5 | M517: =K517*6+L517 -> 53 | O517: 11 | P517: 6 | Q517: =O517*6+P517 -> 72 | S517: TOOHEY
A518: BEST PLAYERS
A519: DANDENONG | C519: MORROW | F519: ELLIS | I519: NANKERVIS | L519: FLAHERTY | O519: TONKS | R519: GUINANE
A520: BRUNSWICK | C520: COOK | F520: BURNS | I520: BRADLEY | L520: K GREIG | O520: DEITRICH | R520: SKIDMORE
A521: GOALKICKERS
A522: DANDENONG | C522: NANKERVIS 4 | F522: FLAHERTY 3 | I522: MORROW 2 | L522: GUINANE 2 | O522: MILLER | Q522: VAN LINT | T522: SHEEHAN
A523: BRUNSWICK | C523: BRADLEY 3 | F523: DALTON 2 | I523: COOK 2 | K523: McLEOD 2 | N523: BURNS | P523: K GREIG
A525: ROUND 12 | E525: 13TH JULY | J525: WEATHER | N525: WEST WIND SHOWERS | S525: PLAYED AT
D526: 1ST QTR | H526: 2ND QTR | L526: 3RD QTR | P526: FINAL | S526: PRESTON
A527: PRESTON | C527: 4 | D527: 2 | E527: =C527*6+D527 -> 26 | G527: 13 | H527: 7 | I527: =G527*6+H527 -> 85 | K527: 14 | L527: 10 | M527: =K527*6+L527 -> 94 | O527: 24 | P527: 15 | Q527: =O527*6+P527 -> 159 | S527: UMPIRE | X527: LADDER | AB527: ROUND | AD527: 12
A528: DANDENONG | C528: 6 | D528: 2 | E528: =C528*6+D528 -> 38 | G528: 6 | H528: 3 | I528: =G528*6+H528 -> 39 | K528: 10 | L528: 9 | M528: =K528*6+L528 -> 69 | O528: 11 | P528: 12 | Q528: =O528*6+P528 -> 78 | S528: ANDERSON
A529: BEST PLAYERS | W529: TEAM | X529: W | Y529: L | Z529: D | AA529: FOR | AB529: AGST | AC529: % | AD529: PTS
A530: PRESTON | C530: HILL | F530: FAWCETT | I530: HEARD | L530: SCHICKERT | O530: McARTHUR | R530: JOYCE
A531: DANDENONG | C531: MORROW | F531: VAN LINT | I531: TONKS | L531: ELLIS | O531: MELAI | R531: LIENERT | W531: PRESTON | X531: 11 | Y531: 1 | Z531: 0 | AA531: 1411 | AB531: 864 | AC531: 163.31018518518519 | AD531: 44
A532: GOALKICKERS | W532: SANDRINGHAM | X532: 9 | Y532: 3 | Z532: 0 | AA532: 1181 | AB532: 1129 | AC532: 104.6058458813109 | AD532: 36
A533: PRESTON | C533: JOYCE 8 | E533: McLEAN 4 | H533: HEARD 4 | J533: McARTHUR 2 | M533: LESLIE 2 | O533: CLARK 2 | Q533: KING | R533: HILL | W533: PORT MELBOURNE | X533: 8 | Y533: 4 | Z533: 0 | AA533: 1161 | AB533: 984 | AC533: 117.98780487804878 | AD533: 32
A534: DANDENONG | C534: MILLER 4 | F534: FLAHERTY 2 | I534: ANDREWS 2 | L534: MORROW | N534: NANKERVIS | Q534: SHEEHAN | W534: DANDENONG | X534: 8 | Y534: 4 | Z534: 0 | AA534: 1393 | AB534: 1256 | AC534: 10.91 | AD534: 32
A536: PORT MELBOURNE | C536: 4 | D536: 2 | E536: =C536*6+D536 -> 26 | G536: 5 | H536: 7 | I536: =G536*6+H536 -> 37 | K536: 9 | L536: 10 | M536: =K536*6+L536 -> 64 | O536: 12 | P536: 15 | Q536: =O536*6+P536 -> 87 | S536: PORT MELBOURNE | W536: PRAHRAN | X536: 7 | Y536: 5 | Z536: 0 | AA536: 1186 | AB536: 1126 | AC536: 105.32859680284191 | AD536: 28
A537: PRAHRAN | C537: 3 | D537: 1 | E537: =C537*6+D537 -> 19 | G537: 8 | H537: 3 | I537: =G537*6+H537 -> 51 | K537: 8 | L537: 7 | M537: =K537*6+L537 -> 55 | O537: 10 | P537: 9 | Q537: =O537*6+P537 -> 69 | S537: DUGARD | W537: YARRAVILLE | X537: 6 | Y537: 6 | Z537: 0 | AA537: 1270 | AB537: 1191 | AC537: 106.63308144416457 | AD537: 24
A538: BEST PLAYERS | W538: WAVERLEY | X538: 4 | Y538: 8 | Z538: 0 | AA538: 1069 | AB538: 1087 | AC538: 98.344066237350503 | AD538: 16
A539: PORT MELBOURNE | C539: BARCLAY | F539: BEHAN | I539: EKLUND | L539: WILLIAMS | O539: GOSS | R539: BRICE | W539: GEELONG WEST | X539: 4 | Y539: 8 | Z539: 0 | AA539: 984 | AB539: 1228 | AC539: 80.130293159609124 | AD539: 16
A540: PRAHRAN | C540: GRANGE | F540: CROWE | I540: PARKER | L540: ANDREW | O540: HUTCHESSON | R540: MURPHY | W540: OAKLEIGH | X540: 2 | Y540: 10 | Z540: 0 | AA540: 898 | AB540: 1198 | AC540: 74.96 | AD540: 8
A541: GOALKICKERS | W541: BRUNSWICK | X541: 1 | Y541: 11 | Z541: 0 | AA541: 863 | AB541: 1353 | AC541: 63.784183296378416 | AD541: 4
A542: PORT MELBOURNE | C542: BEHAN 4 | F542: BARCLAY 3 | I542: EKLUND 2 | L542: GOSS | N542: McKEW | P542: N ANDERSON
A543: PRAHRAN | C543: POWER 4 | F543: ANDREW 2 | I543: CROWE | K543: CAFFYN | M543: PARKER | O543: HUTCHESSON
A545: GEELONG WEST | C545: 2 | D545: 5 | E545: =C545*6+D545 -> 17 | G545: 5 | H545: 6 | I545: =G545*6+H545 -> 36 | K545: 9 | L545: 11 | M545: =K545*6+L545 -> 65 | O545: 12 | P545: 13 | Q545: =O545*6+P545 -> 85 | S545: GEELONG WEST
A546: OAKLEIGH | C546: 3 | D546: 4 | E546: =C546*6+D546 -> 22 | G546: 5 | H546: 7 | I546: =G546*6+H546 -> 37 | K546: 6 | L546: 10 | M546: =K546*6+L546 -> 46 | O546: 10 | P546: 14 | Q546: =O546*6+P546 -> 74 | S546: TOOHEY
A547: BEST PLAYERS
A548: GEELONG WEST | C548: TENABEL | F548: HAMILTON | I548: EMOND | L548: LARKINS | O548: ADAMS | R548: WILLIAMS
A549: OAKLEIGH | C549: MURNANE | F549: HAYNES | I549: TEMME | L549: BEARD | O549: TRAILL | R549: SYKES
A550: GOALKICKERS
A551: GEELONG WEST | C551: JULIEN 3 | F551: ADAMS 2 | I551: TENABEL | K551: EMOND | M551: BARRY | O551: SMITH | Q551: G O'DONNELL | T551: DEEATH | V551: HISCOX
A552: OAKLEIGH | C552: MURNANE 3 | F552: JORDAN 2 | I552: DONNELLY | K552: BEARD | M552: HAYNES | O552: TRAILL | Q552: CORRIGAN
A554: WAVERLEY | C554: 4 | D554: 10 | E554: =C554*6+D554 -> 34 | G554: 6 | H554: 12 | I554: =G554*6+H554 -> 48 | K554: 11 | L554: 18 | M554: =K554*6+L554 -> 84 | O554: 15 | P554: 19 | Q554: =O554*6+P554 -> 109 | S554: BEACH ROAD
A555: SANDRINGHAM | C555: 3 | D555: 3 | E555: =C555*6+D555 -> 21 | G555: 8 | H555: 11 | I555: =G555*6+H555 -> 59 | K555: 13 | L555: 13 | M555: =K555*6+L555 -> 91 | O555: 15 | P555: 15 | Q555: =O555*6+P555 -> 105 | S555: PASK
A556: BEST PLAYERS
A557: WAVERLEY | C557: EBERT | F557: POORE | I557: STEPHENS | L557: LANGFORD | O557: R HORKINGS | R557: HARDERS
A558: SANDRINGHAM | C558: SHARROCK | F558: WALFORD | I558: HANCE | L558: LOCKHART | O558: BUSSE | R558: WILLIAMS
A559: GOALKICKERS
A560: WAVERLEY | C560: HARDERS 4 | F560: EBERT 3 | I560: STEPHENS 2 | L560: R HORKINGS 2 | O560: G PARKER 2 | R560: POORE | T560: WARNER
A561: SANDRINGHAM | C561: WALFORD 5 | F561: J WARD 4 | I561: HOGAN 2 | K561: HANCE 2 | M561: SELLECK | O561: ADDISON
A563: YARRAVILLE | C563: 4 | D563: 4 | E563: =C563*6+D563 -> 28 | G563: 9 | H563: 7 | I563: =G563*6+H563 -> 61 | K563: 13 | L563: 13 | M563: =K563*6+L563 -> 91 | O563: 15 | P563: 18 | Q563: =O563*6+P563 -> 108 | S563: BRUNSWICK
A564: BRUNSWICK | C564: 3 | D564: 3 | E564: =C564*6+D564 -> 21 | G564: 5 | H564: 5 | I564: =G564*6+H564 -> 35 | K564: 8 | L564: 9 | M564: =K564*6+L564 -> 57 | O564: 13 | P564: 13 | Q564: =O564*6+P564 -> 91 | S564: O'NEILL
A565: BEST PLAYERS
A566: YARRAVILLE | C566: MATHESON | F566: BARR | I566: HEYME | L566: MADIGAN | O566: KEMP | R566: HERIOT
A567: BRUNSWICK | C567: K GREIG | F567: DALTON | I567: WHELAN | L567: BOOTH | O567: BURNS | R567: McLEOD
A568: GOALKICKERS
A569: YARRAVILLE | C569: WALSH 5 | F569: MADIGAN 3 | I569: KEMP 2 | K569: DAVIES 2 | M569: CHARLES | O569: COOK | Q569: PLOZZA
A570: BRUNSWICK | C570: K GREIG 4 | F570: WHELAN 3 | I570: COOK 2 | K570: BURNS 2 | M570: McLEOD | O570: BRADLEY
A572: ROUND 13 | D572: 19TH JULY | I572: WEATHER | L572: SOUTH WEST BREEZE FINE | S572: PLAYED AT
D573: 1ST QTR | H573: 2ND QTR | L573: 3RD QTR | P573: FINAL | S573: WAVERLEY
A574: WAVERLEY | C574: 7 | D574: 2 | E574: =C574*6+D574 -> 44 | G574: 10 | H574: 10 | I574: =G574*6+H574 -> 70 | K574: 12 | L574: 14 | M574: =K574*6+L574 -> 86 | O574: 13 | P574: 19 | Q574: =O574*6+P574 -> 97 | S574: UMPIRE | X574: LADDER | AB574: ROUND | AD574: 13
A575: BRUNSWICK | C575: 3 | D575: 2 | E575: =C575*6+D575 -> 20 | G575: 5 | H575: 7 | I575: =G575*6+H575 -> 37 | K575: 11 | L575: 9 | M575: =K575*6+L575 -> 75 | O575: 14 | P575: 11 | Q575: =O575*6+P575 -> 95 | S575: HOLZER
A576: BEST PLAYERS | W576: TEAM | X576: W | Y576: L | Z576: D | AA576: FOR | AB576: AGST | AC576: % | AD576: PTS
A577: WAVERLEY | C577: G PARKER | F577: McKENZIE | I577: POORE | L577: WARNER | O577: BACKHOUSE | R577: SYKES
A578: BRUNSWICK | C578: K GREIG | F578: BURNS | I578: WHELAN | L578: OGSTON | O578: COOK | R578: LEYDIN | W578: PRESTON | X578: 12 | Y578: 1 | Z578: 0 | AA578: 1581 | AB578: 980 | AC578: 161.32653061224491 | AD578: 48
A579: GOALKICKERS | W579: DANDENONG | X579: 9 | Y579: 4 | Z579: 0 | AA579: 1512 | AB579: 1349 | AC579: 112.08 | AD579: 36
A580: WAVERLEY | C580: HARDERS 3 | F580: WARNER 2 | I580: R HORKINGS 2 | L580: MORRIS 2 | N580: POORE 2 | Q580: McKENZIE | S580: G PARKER | W580: SANDRINGHAM | X580: 9 | Y580: 4 | Z580: 0 | AA580: 1274 | AB580: 1248 | AC580: 102.08333333333333 | AD580: 36
A581: BRUNSWICK | C581: K GREIG 4 | F581: WHELAN 4 | I581: BURNS 3 | K581: COOK 2 | M581: OGSTON | W581: PORT MELBOURNE | X581: 8 | Y581: 5 | Z581: 0 | AA581: 1251 | AB581: 1079 | AC581: 115.9406858202039 | AD581: 32
A583: PRESTON | C583: 4 | D583: 2 | E583: =C583*6+D583 -> 26 | G583: 7 | H583: 5 | I583: =G583*6+H583 -> 47 | K583: 16 | L583: 9 | M583: =K583*6+L583 -> 105 | O583: 26 | P583: 14 | Q583: =O583*6+P583 -> 170 | S583: OAKLEIGH | W583: PRAHRAN | X583: 8 | Y583: 5 | Z583: 0 | AA583: 1287 | AB583: 1215 | AC583: 105.92592592592592 | AD583: 32
A584: OAKLEIGH | C584: 6 | D584: 8 | E584: =C584*6+D584 -> 44 | G584: 11 | H584: 15 | I584: =G584*6+H584 -> 81 | K584: 13 | L584: 17 | M584: =K584*6+L584 -> 95 | O584: 16 | P584: 20 | Q584: =O584*6+P584 -> 116 | S584: McMASTER | W584: YARRAVILLE | X584: 7 | Y584: 6 | Z584: 0 | AA584: 1365 | AB584: 1281 | AC584: 106.55737704918033 | AD584: 28
A585: BEST PLAYERS | W585: WAVERLEY | X585: 5 | Y585: 8 | Z585: 0 | AA585: 1166 | AB585: 1182 | AC585: 98.646362098138752 | AD585: 20
A586: PRESTON | C586: JOYCE | F586: REID | I586: LESLIE | L586: CLARK | N586: G PERRY | Q586: McLEAN | W586: GEELONG WEST | X586: 4 | Y586: 9 | Z586: 0 | AA586: 1073 | AB586: 1329 | AC586: 80.737396538750943 | AD586: 16
A587: OAKLEIGH | C587: MOULDEN | F587: SYKES | I587: MURNANE | L587: LUFF | N587: STEWART | Q587: BEARD | W587: OAKLEIGH | X587: 2 | Y587: 11 | Z587: 0 | AA587: 1014 | AB587: 1368 | AC587: 74.12 | AD587: 8
A588: GOALKICKERS | W588: BRUNSWICK | X588: 1 | Y588: 12 | Z588: 0 | AA588: 958 | AB588: 1450 | AC588: 66.068965517241381 | AD588: 4
A589: PRESTON | C589: REID 7 | E589: JOYCE 5 | G589: LESLIE 5 | I589: CLARK 3 | K589: MCLEAN 2 | N589: KING | P589: HEARD | R589: GOAD
A590: OAKLEIGH | C590: MURNANE 4 | F590: MOULDEN 3 | I590: JORDAN 3 | L590: BEARD 2 | N590: DONNELLY 2 | Q590: LYON | S590: STEWART
E591: 20TH JULY | I591: WEATHER | M591: NORTH WEST WIND
A592: DANDENONG | C592: 6 | D592: 1 | E592: =C592*6+D592 -> 37 | G592: 7 | H592: 5 | I592: =G592*6+H592 -> 47 | K592: 16 | L592: 8 | M592: =K592*6+L592 -> 104 | O592: 18 | P592: 11 | Q592: =O592*6+P592 -> 119 | S592: DANDENONG
A593: SANDRINGHAM | C593: 3 | D593: 1 | E593: =C593*6+D593 -> 19 | G593: 5 | H593: 7 | I593: =G593*6+H593 -> 37 | K593: 7 | L593: 9 | M593: =K593*6+L593 -> 51 | O593: 13 | P593: 15 | Q593: =O593*6+P593 -> 93 | S593: McKENZIE
A594: BEST PLAYERS
A595: DANDENONG | C595: EVANS | F595: ELLIS | I595: NANKERVIS | L595: BETHKE | O595: ANDREWS | R595: JEFFRIES
A596: SANDRINGHAM | C596: SHARROCK | F596: HUTCHINSON | I596: K WILLS | L596: HOGAN | O596: D WILLS | R596: MACKENZIE
A597: GOALKICKERS
A598: DANDENONG | C598: JEFFRIES 5 | F598: NANKERVIS 5 | I598: ELLIS 4 | K598: ROBERTSON 2 | N598: MORROW | P598: ANDREWS
A599: SANDRINGHAM | C599: HOGAN 3 | F599: PRESNELL 2 | I599: WALFORD 2 | L599: HANCE | N599: J WARD | P599: SPURRELL | R599: ADDISON | U599: SHARROCK | X599: HUTCHINSON
A601: YARRAVILLE | C601: 5 | D601: 4 | E601: =C601*6+D601 -> 34 | G601: 8 | H601: 8 | I601: =G601*6+H601 -> 56 | K601: 11 | L601: 13 | M601: =K601*6+L601 -> 79 | O601: 13 | P601: 17 | Q601: =O601*6+P601 -> 95 | S601: YARRAVILLE
A602: PORT MELBOURNE | C602: 1 | D602: 0 | E602: =C602*6+D602 -> 6 | G602: 7 | H602: 7 | I602: =G602*6+H602 -> 49 | K602: 9 | L602: 10 | M602: =K602*6+L602 -> 64 | O602: 12 | P602: 18 | Q602: =O602*6+P602 -> 90 | S602: ANDERSON
A603: BEST PLAYERS
A604: YARRAVILLE | C604: COOK | F604: DAVIES | I604: HERIOT | L604: GROSE | O604: TAURENS | R604: QUARANTOTTO
A605: PORT MELBOURNE | C605: GARDNER | F605: GOSS | I605: McKEW | L605: CAULFIELD | O605: BARCLAY | R605: GROVER
A606: GOALKICKERS
A607: YARRAVILLE | C607: KEMP 3 | E607: MADIGAN 2 | H607: DAVIES 2 | J607: CUMMING 2 | M607: PLOZZA 2 | P607: ROACH | R607: WALSH
A608: PORT MELBOURNE | C608: GOSS 3 | E608: BARCLAY 3 | H608: BEHAN 2 | J608: BRICE 2 | L608: PASQUILL | N608: CAULFIELD
A610: PRAHRAN | C610: 6 | D610: 3 | E610: =C610*6+D610 -> 39 | G610: 9 | H610: 5 | I610: =G610*6+H610 -> 59 | K610: 13 | L610: 10 | M610: =K610*6+L610 -> 88 | O610: 15 | P610: 11 | Q610: =O610*6+P610 -> 101 | S610: TOORAK PARK
A611: GEELONG WEST | C611: 3 | D611: 3 | E611: =C611*6+D611 -> 21 | G611: 7 | H611: 8 | I611: =G611*6+H611 -> 50 | K611: 10 | L611: 8 | M611: =K611*6+L611 -> 68 | O611: 13 | P611: 11 | Q611: =O611*6+P611 -> 89 | S611: FLANAGAN
A612: BEST PLAYERS
A613: PRAHRAN | C613: HUTCHESSON | F613: RAEBURN | I613: POWER | L613: BRADLEY | O613: KARANICHOLAS | R613: GRANGE
A614: GEELONG WEST | C614: WILLIAMS | F614: EMOND | I614: BARRY | L614: DEEATH | O614: HAMILTON | R614: TENABEL
A615: GOALKICKERS
A616: PRAHRAN | C616: POWER 6 | F616: McKENZIE 3 | I616: CAFFYN 3 | L616: FAHEY | N616: KARANICHOLAS | R616: BRADLEY
A617: GEELONG WEST | C617: EMOND 5 | F617: ADAMS 3 | I617: BARRY 2 | K617: HAMILTON | N617: TENABEL | Q617: HISCOX
A619: ROUND 14 | E619: 27TH JULY | M619: WEATHER | S619: PLAYED AT
D620: 1ST QTR | H620: 2ND QTR | L620: 3RD QTR | P620: FINAL | S620: TOORAK PARK
A621: PRAHRAN | C621: 4 | D621: 7 | E621: =C621*6+D621 -> 31 | G621: 8 | H621: 11 | I621: =G621*6+H621 -> 59 | K621: 14 | L621: 16 | M621: =K621*6+L621 -> 100 | O621: 17 | P621: 18 | Q621: =O621*6+P621 -> 120 | S621: UMPIRE | X621: LADDER | AB621: ROUND | AD621: 14
A622: YARRAVILLE | C622: 0 | D622: 1 | E622: =C622*6+D622 -> 1 | G622: 4 | H622: 9 | I622: =G622*6+H622 -> 33 | K622: 6 | L622: 11 | M622: =K622*6+L622 -> 47 | O622: 10 | P622: 20 | Q622: =O622*6+P622 -> 80 | S622: BREWER
A623: BEST PLAYERS | W623: TEAM | X623: W | Y623: L | Z623: D | AA623: FOR | AB623: AGST | AC623: % | AD623: PTS
A624: PRAHRAN | C624: HUTCHESSON | F624: ROSE | I624: CROWE | L624: PAYNE | N624: KNOX | Q624: CAFFYN
A625: YARRAVILLE | C625: CUMMING | F625: COOK | I625: DAVIES | L625: HEYME | N625: BONGETTI | Q625: MADIGAN | W625: PRESTON | X625: 13 | Y625: 1 | Z625: 0 | AA625: 1662 | AB625: 1057 | AC625: 157.23746452223273 | AD625: 52
A626: GOALKICKERS | Q626: BRADLEY | W626: DANDENONG | X626: 10 | Y626: 4 | Z626: 0 | AA626: 1646 | AB626: 1426 | AC626: 115.43 | AD626: 40
A627: PRAHRAN | C627: CAFFYN 4 | E627: KNOX 3 | G627: PAYNE 2 | I627: CROWE 2 | K627: HUTCHESSON 2 | N627: ROSE | P627: POWER | R627: BARTLETT | W627: SANDRINGHAM | X627: 10 | Y627: 4 | Z627: 0 | AA627: 1418 | AB627: 1304 | AC627: 108.74233128834356 | AD627: 40
A628: YARRAVILLE | C628: MADIGAN 3 | F628: HERIOT 2 | I628: PLOZZA | K628: BONGETTI | M628: BARR | O628: CUMMING | Q628: DAVIES | W628: PORT MELBOURNE | X628: 9 | Y628: 5 | Z628: 0 | AA628: 1325 | AB628: 1135 | AC628: 116.74008810572687 | AD628: 36
A630: PORT MELBOURNE | C630: 3 | D630: 6 | E630: =C630*6+D630 -> 24 | G630: 5 | H630: 8 | I630: =G630*6+H630 -> 38 | K630: 8 | L630: 13 | M630: =K630*6+L630 -> 61 | O630: 10 | P630: 14 | Q630: =O630*6+P630 -> 74 | S630: PORT MELBOURNE | W630: PRAHRAN | X630: 9 | Y630: 5 | Z630: 0 | AA630: 1407 | AB630: 1295 | AC630: 108.64864864864865 | AD630: 36
A631: WAVERLEY | C631: 1 | D631: 3 | E631: =C631*6+D631 -> 9 | G631: 3 | H631: 7 | I631: =G631*6+H631 -> 25 | K631: 4 | L631: 8 | M631: =K631*6+L631 -> 32 | O631: 7 | P631: 14 | Q631: =O631*6+P631 -> 56 | S631: GAMBETTA | W631: YARRAVILLE | X631: 7 | Y631: 7 | Z631: 0 | AA631: 1445 | AB631: 1401 | AC631: 103.14061384725196 | AD631: 28
A632: BEST PLAYERS | W632: WAVERLEY | X632: 5 | Y632: 9 | Z632: 0 | AA632: 1222 | AB632: 1256 | AC632: 97.29299363057325 | AD632: 20
A633: PORT MELBOURNE | C633: CAULFIELD | F633: BRICE | I633: BARCLAY | L633: WISEMAN | O633: BONNETT | R633: GOSS | W633: GEELONG WEST | X633: 4 | Y633: 10 | Z633: 0 | AA633: 1129 | AB633: 1473 | AC633: 76.64630006788866 | AD633: 16
A634: WAVERLEY | C634: TRELOAR | F634: MORDEN | I634: MORRIS | L634: BLEW | O634: R HORKINGS | R634: SYKES | W634: OAKLEIGH | X634: 2 | Y634: 12 | Z634: 0 | AA634: 1091 | AB634: 1502 | AC634: 72.64 | AD634: 8
A635: GOALKICKERS | W635: BRUNSWICK | X635: 1 | Y635: 13 | Z635: 0 | AA635: 1035 | AB635: 1531 | AC635: 67.602873938602215 | AD635: 4
A636: PORT MELBOURNE | C636: BRICE 3 | F636: M ALLEN 2 | I636: EKLUND 2 | L636: WISEMAN | N636: BARCLAY | Q636: G ALLEN
A637: WAVERLEY | C637: HARDERS 2 | F637: MORRIS | H637: EBERT | J637: LANGFORD | M637: ALLAN | O637: BACKHOUSE
A639: SANDRINGHAM | C639: 1 | D639: 2 | E639: =C639*6+D639 -> 8 | G639: 9 | H639: 11 | I639: =G639*6+H639 -> 65 | K639: 12 | L639: 13 | M639: =K639*6+L639 -> 85 | O639: 21 | P639: 18 | Q639: =O639*6+P639 -> 144 | S639: BEACH ROAD
A640: GEELONG WEST | C640: 2 | D640: 8 | E640: =C640*6+D640 -> 20 | G640: 2 | H640: 9 | I640: =G640*6+H640 -> 21 | K640: 6 | L640: 13 | M640: =K640*6+L640 -> 49 | O640: 7 | P640: 14 | Q640: =O640*6+P640 -> 56 | S640: TORNEY
A641: BEST PLAYERS
A642: SANDRINGHAM | C642: HUTCHINSON | F642: WILLIAMS | I642: SHARROCK | L642: BUSSE | N642: HANCE | Q642: LOCKHART
A643: GEELONG WEST | C643: B JENNINGS | F643: EMOND | I643: HISCOX | L643: DEEATH | N643: LARKINS | Q643: ADAMS
A644: GOALKICKERS
A645: SANDRINGHAM | C645: WILLIAMS 4 | F645: HANCE 3 | H645: HUTCHINSON 2 | K645: SPURRELL 2 | N645: PRESNELL 2 | Q645: AUSTIN 2 | S645: SHARROCK 2 | W645: MACKENZIE | X645: LATCHEM | AA645: ROBINSON | AC645: ADDISON
A646: GEELONG WEST | C646: TENABEL 3 | F646: ANDJELKOVIC | J646: G FRY
A648: DANDENONG | C648: 2 | D648: 3 | E648: =C648*6+D648 -> 15 | G648: 10 | H648: 8 | I648: =G648*6+H648 -> 68 | K648: 12 | L648: 11 | M648: =K648*6+L648 -> 83 | O648: 19 | P648: 20 | Q648: =O648*6+P648 -> 134 | S648: DANDENONG
A649: OAKLEIGH | C649: 7 | D649: 6 | E649: =C649*6+D649 -> 48 | G649: 7 | H649: 6 | I649: =G649*6+H649 -> 48 | K649: 11 | L649: 11 | M649: =K649*6+L649 -> 77 | O649: 11 | P649: 11 | Q649: =O649*6+P649 -> 77 | S649: O'NEILL
A650: BEST PLAYERS
A651: DANDENONG | C651: ABRAHAM | F651: MILLER | I651: FLAHERTY | L651: MELAI | N651: STEDWELL | Q651: BETHKE
A652: OAKLEIGH | C652: COLLEJA | F652: HAYNES | I652: STEWART | L652: McCORKELL | N652: FORD | Q652: DONNELLY
A653: GOALKICKERS
A654: DANDENONG | C654: MILLER 8 | F654: FLAHERTY 4 | I654: GUINANE 2 | L654: ELLIS 2 | N654: STEDWELL | Q654: MORROW | S654: NANKERVIS
A655: OAKLEIGH | C655: DONNELLY 3 | F655: BEARD 2 | I655: JORDAN | K655: FORD | M655: COLLEJA | O655: SYKES | Q655: HAYNES | S655: CORRIGAN
A657: PRESTON | C657: 3 | D657: 6 | E657: =C657*6+D657 -> 24 | G657: 5 | H657: 8 | I657: =G657*6+H657 -> 38 | K657: 10 | L657: 11 | M657: =K657*6+L657 -> 71 | O657: 11 | P657: 15 | Q657: =O657*6+P657 -> 81 | S657: BRUNSWICK
A658: BRUNSWICK | C658: 3 | D658: 3 | E658: =C658*6+D658 -> 21 | G658: 7 | H658: 5 | I658: =G658*6+H658 -> 47 | K658: 9 | L658: 7 | M658: =K658*6+L658 -> 61 | O658: 11 | P658: 11 | Q658: =O658*6+P658 -> 77 | S658: McKENZIE
A659: BEST PLAYERS
A660: PRESTON | C660: TELFORD | F660: McARTHUR | I660: HEARD | L660: REID | O660: SCHICKERT
A661: BRUNSWICK | C661: NOONAN | F661: DEITRICH | I661: BOOTH | L661: WHELAN | O661: MCKINNON
A662: GOALKICKERS
A663: PRESTON | C663: MCARTHUR 3 | F663: HEARD 3 | I663: HILL 2 | L663: REID | N663: CLARK | P663: TELFORD
A664: BRUNSWICK | C664: K GREIG 3 | F664: COOK 2 | I664: WHELAN 2 | L664: LEYDIN | N664: BURNS | P664: BRADLEY | R664: BOOTH
A666: ROUND 15 | C666: 2ND AUGUST | I666: WEATHER | M666: STRONG NORTH WIND | S666: PLAYED AT
D667: 1ST QTR | H667: 2ND QTR | L667: 3RD QTR | P667: FINAL | S667: OAKLEIGH
A668: YARRAVILLE | C668: 4 | D668: 3 | E668: =C668*6+D668 -> 27 | G668: 5 | H668: 7 | I668: =G668*6+H668 -> 37 | K668: 8 | L668: 10 | M668: =K668*6+L668 -> 58 | O668: 11 | P668: 17 | Q668: =O668*6+P668 -> 83 | S668: UMPIRE | X668: LADDER | AB668: ROUND | AD668: 15
A669: OAKLEIGH | C669: 2 | D669: 1 | E669: =C669*6+D669 -> 13 | G669: 4 | H669: 2 | I669: =G669*6+H669 -> 26 | K669: 6 | L669: 4 | M669: =K669*6+L669 -> 40 | O669: 7 | P669: 7 | Q669: =O669*6+P669 -> 49 | S669: GAMBETTA
A670: BEST PLAYERS | W670: TEAM | X670: W | Y670: L | Z670: D | AA670: FOR | AB670: AGST | AC670: % | AD670: PTS
A671: YARRAVILLE | C671: CUMMING | F671: DAVIES | I671: COOK | L671: MADIGAN | O671: HERIOT | R671: BARR
A672: OAKLEIGH | C672: LUFF | F672: SYKES | I672: MURNANE | L672: WAPLING | O672: COLLEGA | R672: BEARD | W672: PRESTON | X672: 14 | Y672: 1 | Z672: 0 | AA672: 1751 | AB672: 1126 | AC672: 155.50621669626997 | AD672: 56
A673: GOALKICKERS | W673: DANDENONG | X673: 11 | Y673: 4 | Z673: 0 | AA673: 1722 | AB673: 1496 | AC673: 115.11 | AD673: 44
A674: YARRAVILLE | C674: MADIGAN 5 | F674: BARR 2 | I674: WAGHORN 2 | L674: CUMMING | N674: SKIDMORE | W674: PORT MELBOURNE | X674: 10 | Y674: 5 | Z674: 0 | AA674: 1452 | AB674: 1226 | AC674: 118.43 | AD674: 40
A675: OAKLEIGH | C675: BEARD 2 | F675: COLLEJA | H675: HAYNES | J675: MURNANE | M675: WAPLING | O675: DONNELLY | W675: SANDRINGHAM | X675: 10 | Y675: 5 | Z675: 0 | AA675: 1487 | AB675: 1393 | AC675: 106.74802584350323 | AD675: 40
D676: 3RD AUGUST | I676: WEATHER | M676: WEST WIND
A677: PRESTON | C677: 2 | D677: 1 | E677: =C677*6+D677 -> 13 | G677: 4 | H677: 7 | I677: =G677*6+H677 -> 31 | K677: 10 | L677: 13 | M677: =K677*6+L677 -> 73 | O677: 12 | P677: 17 | Q677: =O677*6+P677 -> 89 | S677: PRESTON | W677: PRAHRAN | X677: 9 | Y677: 6 | Z677: 0 | AA677: 1515 | AB677: 1412 | AC677: 107.29461756373938 | AD677: 36
A678: SANDRINGHAM | C678: 3 | D678: 2 | E678: =C678*6+D678 -> 20 | G678: 5 | H678: 7 | I678: =G678*6+H678 -> 37 | K678: 7 | L678: 14 | M678: =K678*6+L678 -> 56 | O678: 9 | P678: 15 | Q678: =O678*6+P678 -> 69 | S678: BREWER | W678: YARRAVILLE | X678: 8 | Y678: 7 | Z678: 0 | AA678: 1528 | AB678: 1450 | AC678: 105.37931034482759 | AD678: 32
A679: BEST PLAYERS | W679: WAVERLEY | X679: 6 | Y679: 9 | Z679: 0 | AA679: 1339 | AB679: 1364 | AC679: 98.167155425219946 | AD679: 24
A680: PRESTON | C680: TELFORD | F680: HEARD | I680: McKERNAN | L680: HELLINGS | O680: GOAD | Q680: McLEAN | W680: GEELONG WEST | X680: 4 | Y680: 11 | Z680: 0 | AA680: 1199 | AB680: 1549 | AC680: 77.404777275661715 | AD680: 16
A681: SANDRINGHAM | C681: LOCKHART | F681: HANCE | I681: BUSSE | L681: MACKENZIE | O681: AUSTIN | Q681: FENTON | W681: OAKLEIGH | X681: 2 | Y681: 13 | Z681: 0 | AA681: 1140 | AB681: 1585 | AC681: 71.92 | AD681: 8
A682: GOALKICKERS | W682: BRUNSWICK | X682: 1 | Y682: 14 | Z682: 0 | AA682: 1126 | AB682: 1658 | AC682: 67.91 | AD682: 4
A683: PRESTON | C683: JOYCE 2 | F683: HILL 2 | H683: MCLEAN 2 | J683: TELFORD 2 | M683: REID | N683: MCARTHUR | Q683: LESLIE | S683: GOAD
A684: SANDRINGHAM | C684: AUSTIN 5 | F684: HANCE | H684: SPURRELL | J684: ADDISON | M684: ROBINSON
A686: WAVERLEY | C686: 3 | D686: 2 | E686: =C686*6+D686 -> 20 | G686: 5 | H686: 4 | I686: =G686*6+H686 -> 34 | K686: 11 | L686: 7 | M686: =K686*6+L686 -> 73 | O686: 18 | P686: 9 | Q686: =O686*6+P686 -> 117 | S686: WAVERLEY
A687: PRAHRAN | C687: 2 | D687: 2 | E687: =C687*6+D687 -> 14 | G687: 7 | H687: 7 | I687: =G687*6+H687 -> 49 | K687: 11 | L687: 9 | M687: =K687*6+L687 -> 75 | O687: 16 | P687: 12 | Q687: =O687*6+P687 -> 108 | S687: ANDERSON
A688: BEST PLAYERS
A689: WAVERLEY | C689: ALLAN | F689: R HORKINGS | I689: SYKES | L689: MCKENZIE | O689: TRELOAR | R689: MORRIS
A690: PRAHRAN | C690: ROSE | F690: CROWE | I690: KNOX | L690: DICKESON | O690: HUTCHESSON | R690: RAEBURN
A691: GOALKICKERS
A692: WAVERLEY | C692: MORRIS 6 | F692: HARDERS 4 | I692: MCKENZIE 2 | L692: G PARKER 2 | O692: R HORKINGS | R692: LANGFORD | U692: PETZKE | X692: HARRY
A693: PRAHRAN | C693: KNOX 3 | E693: POWER 3 | G693: HUTCHESSON 3 | J693: CAFFYN 2 | M693: CROWE 2 | O693: PARKER | Q693: MARINKO | S693: DICKESON
A695: PORT MELBOURNE | C695: 7 | D695: 7 | E695: =C695*6+D695 -> 49 | G695: 8 | H695: 7 | I695: =G695*6+H695 -> 55 | K695: 14 | L695: 14 | M695: =K695*6+L695 -> 98 | O695: 18 | P695: 19 | Q695: =O695*6+P695 -> 127 | S695: PORT MELBOURNE
A696: BRUNSWICK | C696: 0 | D696: 6 | E696: =C696*6+D696 -> 6 | G696: 6 | H696: 10 | I696: =G696*6+H696 -> 46 | K696: 9 | L696: 10 | M696: =K696*6+L696 -> 64 | O696: 13 | P696: 13 | Q696: =O696*6+P696 -> 91 | S696: FLANAGAN
A697: BEST PLAYERS
A698: PORT MELBOURNE | C698: WISEMAN | F698: GROVER | I698: GOSS | L698: McKEW | N698: BEHAN | Q698: BONNETT
A699: BRUNSWICK | C699: WHELAN | F699: McKINNON | I699: DALTON | L699: BURNS | N699: K GREIG | Q699: LEYDIN
A700: GOALKICKERS
A701: PORT MELBOURNE | C701: BRICE 4 | F701: GOSS 3 | H701: M ALLEN 3 | K701: BEHAN 3 | M701: NORTON 2 | P701: GARDNER | R701: BARCLAY | U701: EKLUND
A702: BRUNSWICK | C702: BURNS 4 | F702: WHELAN 3 | I702: DALTON 2 | L702: McKINNON 2 | O702: CROWLEY | Q702: COOK
A704: DANDENONG | C704: 0 | D704: 5 | E704: =C704*6+D704 -> 5 | G704: 7 | H704: 7 | I704: =G704*6+H704 -> 49 | K704: 7 | L704: 12 | M704: =K704*6+L704 -> 54 | O704: 10 | P704: 16 | Q704: =O704*6+P704 -> 76 | S704: GEELONG WEST
A705: GEELONG WEST | C705: 4 | D705: 2 | E705: =C705*6+D705 -> 26 | G705: 6 | H705: 4 | I705: =G705*6+H705 -> 40 | K705: 7 | L705: 9 | M705: =K705*6+L705 -> 51 | O705: 10 | P705: 10 | Q705: =O705*6+P705 -> 70 | S705: MINNS
A706: BEST PLAYERS
A707: DANDENONG | C707: FLAHERTY | F707: McNAMARA | I707: EVANS | L707: SHEEHAN | O707: MELAI | Q707: ABRAHAM
A708: GEELONG WEST | C708: ROCHFORD | F708: EMOND | I708: LARKINS | L708: ADAMS | O708: BARRY | Q708: SKROWRONSKI
A709: GOALKICKERS
A710: DANDENONG | C710: FLAHERTY 3 | F710: MORROW 2 | I710: MILLER 2 | K710: SHEEHAN 2 | N710: KENNEDY
A711: GEELONG WEST | C711: BARRY 3 | F711: EMOND 2 | I711: ANDJELKOVIC 2 | M711: TENABEL | O711: HISCOX | Q711: ADAMS
A713: ROUND 16 | E713: 10TH AUGUST | I713: WEATHER | M713: FINE | S713: PLAYED AT
D714: 1ST QTR | H714: 2ND QTR | L714: 3RD QTR | P714: FINAL | S714: DANDENONG
A715: DANDENONG | C715: 5 | D715: 5 | E715: =C715*6+D715 -> 35 | G715: 6 | H715: 6 | I715: =G715*6+H715 -> 42 | K715: 14 | L715: 10 | M715: =K715*6+L715 -> 94 | O715: 16 | P715: 13 | Q715: =O715*6+P715 -> 109 | S715: UMPIRE | X715: LADDER | AB715: ROUND | AD715: 16
A716: PORT MELBOURNE | C716: 1 | D716: 0 | E716: =C716*6+D716 -> 6 | G716: 6 | H716: 7 | I716: =G716*6+H716 -> 43 | K716: 9 | L716: 9 | M716: =K716*6+L716 -> 63 | O716: 12 | P716: 18 | Q716: =O716*6+P716 -> 90 | S716: McMASTER
A717: BEST PLAYERS | W717: TEAM | X717: W | Y717: L | Z717: D | AA717: FOR | AB717: AGST | AC717: % | AD717: PTS
A718: DANDENONG | C718: EVANS | E718: NANKERVIS | H718: MELAI | K718: STEDWELL | N718: ABRAHAM | Q718: CROFT
A719: PORT MELBOURNE | C719: BEHAN | E719: BARCLAY | H719: GARDNER | K719: GROVER | N719: BAHEN | Q719: PASQUILL | W719: PRESTON | X719: 15 | Y719: 1 | Z719: 0 | AA719: 1909 | AB719: 1192 | AC719: 160.15100671140939 | AD719: 60
A720: GOALKICKERS | R720: KENNEDY | W720: DANDENONG | X720: 12 | Y720: 4 | Z720: 0 | AA720: 1831 | AB720: 1586 | AC720: 115.45 | AD720: 48
A721: DANDENONG | C721: MILLER 4 | F721: NANKERVIS 4 | I721: FLAHERTY 2 | L721: GUINANE 2 | O721: EVANS | Q721: MELAI | S721: ROBERTSON | W721: SANDRINGHAM | X721: 11 | Y721: 5 | Z721: 0 | AA721: 1615 | AB721: 1464 | AC721: 110.31420765027322 | AD721: 44
A722: PORT MELBOURNE | C722: BEHAN 5 | F722: BARCLAY 4 | I722: NORTON 2 | L722: BRICE | W722: PORT MELBOURNE | X722: 10 | Y722: 6 | Z722: 0 | AA722: 1542 | AB722: 1335 | AC722: 115.51 | AD722: 40
A724: YARRAVILLE | C724: 4 | D724: 5 | E724: =C724*6+D724 -> 29 | G724: 10 | H724: 10 | I724: =G724*6+H724 -> 70 | K724: 13 | L724: 13 | M724: =K724*6+L724 -> 91 | O724: 20 | P724: 18 | Q724: =O724*6+P724 -> 138 | S724: YARRAVILLE | W724: YARRAVILLE | X724: 9 | Y724: 7 | Z724: 0 | AA724: 1666 | AB724: 1522 | AC724: 109.46123521681997 | AD724: 36
A725: WAVERLEY | C725: 1 | D725: 3 | E725: =C725*6+D725 -> 9 | G725: 4 | H725: 6 | I725: =G725*6+H725 -> 30 | K725: 7 | L725: 11 | M725: =K725*6+L725 -> 53 | O725: 10 | P725: 12 | Q725: =O725*6+P725 -> 72 | S725: TORNEY | W725: PRAHRAN | X725: 9 | Y725: 7 | Z725: 0 | AA725: 1591 | AB725: 1501 | AC725: 105.99600266489007 | AD725: 36
A726: BEST PLAYERS | W726: WAVERLEY | X726: 6 | Y726: 10 | Z726: 0 | AA726: 1411 | AB726: 1502 | AC726: 93.941411451398139 | AD726: 24
A727: YARRAVILLE | C727: HEYME | E727: QUARANTOTTO | H727: MADIGAN | K727: HERIOT | N727: WAGHORN | Q727: DAVIES | W727: GEELONG WEST | X727: 4 | Y727: 12 | Z727: 0 | AA727: 1265 | AB727: 1707 | AC727: 74.106619800820155 | AD727: 16
A728: WAVERLEY | C728: ALLAN | E728: MORRIS | H728: PARKER | K728: SYKES | N728: POORE | Q728: R HORKINGS | W728: OAKLEIGH | X728: 2 | Y728: 14 | Z728: 0 | AA728: 1211 | AB728: 1713 | AC728: 70.69 | AD728: 8
A729: GOALKICKERS | R729: GROSE | W729: BRUNSWICK | X729: 2 | Y729: 14 | Z729: 0 | AA729: 1215 | AB729: 1734 | AC729: 70.07 | AD729: 8
A730: YARRAVILLE | C730: MADIGAN 5 | F730: WAGHORN 3 | I730: HEYME 3 | K730: UBERGANG 3 | N730: COOK 2 | P730: PLOZZA | R730: ROWE | T730: BARR
A731: WAVERLEY | C731: POORE 2 | F731: JONES 2 | H731: MORRIS 2 | J731: HARRY 2 | M731: LANGFORD | O731: G PARKER
A733: SANDRINGHAM | C733: 5 | D733: 4 | E733: =C733*6+D733 -> 34 | G733: 6 | H733: 7 | I733: =G733*6+H733 -> 43 | K733: 15 | L733: 12 | M733: =K733*6+L733 -> 102 | O733: 19 | P733: 14 | Q733: =O733*6+P733 -> 128 | S733: BEACH ROAD
A734: OAKLEIGH | C734: 2 | D734: 5 | E734: =C734*6+D734 -> 17 | G734: 4 | H734: 8 | I734: =G734*6+H734 -> 32 | K734: 5 | L734: 8 | M734: =K734*6+L734 -> 38 | O734: 10 | P734: 11 | Q734: =O734*6+P734 -> 71 | S734: MINNS
A735: BEST PLAYERS
A736: SANDRINGHAM | C736: HANCE | F736: J WARD | I736: LOCKHART | L736: BUSSE | O736: ZEUSCHNER | R736: K WILLS
A737: OAKLEIGH | C737: WAPLING | F737: LUFF | I737: BONESS | L737: BEARD | O737: STEPHENS | R737: RITCHIE
A738: GOALKICKERS
A739: SANDRINGHAM | C739: ZEUSCHNER 6 | F739: HOGAN 3 | I739: WILLIAMS 3 | L739: J WARD 2 | N739: PRESNELL 2 | Q739: AUSTIN 2 | S739: SHARROCK
A740: OAKLEIGH | C740: WAPLING 3 | F740: LUFF 2 | I740: BEARD 2 | K740: STEPHENS | M740: MOULDEN | O740: THOMAS
A742: BRUNSWICK | C742: 5 | D742: 6 | E742: =C742*6+D742 -> 36 | G742: 7 | H742: 6 | I742: =G742*6+H742 -> 48 | K742: 10 | L742: 10 | M742: =K742*6+L742 -> 70 | O742: 13 | P742: 11 | Q742: =O742*6+P742 -> 89 | S742: BRUNSWICK
A743: PRAHRAN | C743: 2 | D743: 2 | E743: =C743*6+D743 -> 14 | G743: 4 | H743: 11 | I743: =G743*6+H743 -> 35 | K743: 7 | L743: 12 | M743: =K743*6+L743 -> 54 | O743: 10 | P743: 16 | Q743: =O743*6+P743 -> 76 | S743: O'NEILL
A744: BEST PLAYERS
A745: BRUNSWICK | C745: WHELAN | F745: COOK | I745: KERWOOD | L745: McKINNON | O745: K GREIG | R745: LEYDIN
A746: PRAHRAN | C746: HUTCHESSON | F746: ROSE | I746: GRANGE | L746: CAFFYN | O746: DICKESON | R746: CROWE
A747: GOALKICKERS
A748: BRUNSWICK | C748: WHELAN 5 | F748: COOK 4 | I748: BURNS 2 | L748: K GREIG 2
A749: PRAHRAN | C749: PAYNE 2 | F749: CROWE 2 | I749: BRADLEY | K749: GRANGE | M749: MURPHY | O749: CAFFYN | Q749: PARKER | S749: HUTCHESSON
A751: PRESTON | C751: 6 | D751: 6 | E751: =C751*6+D751 -> 42 | G751: 11 | H751: 7 | I751: =G751*6+H751 -> 73 | K751: 18 | L751: 13 | M751: =K751*6+L751 -> 121 | O751: 24 | P751: 14 | Q751: =O751*6+P751 -> 158 | S751: GEELONG WEST
A752: GEELONG WEST | C752: 2 | D752: 2 | E752: =C752*6+D752 -> 14 | G752: 6 | H752: 9 | I752: =G752*6+H752 -> 45 | K752: 7 | L752: 10 | M752: =K752*6+L752 -> 52 | O752: 9 | P752: 12 | Q752: =O752*6+P752 -> 66 | S752: HOLZER
A753: BEST PLAYERS
A754: PRESTON | C754: CLARK | F754: TELFORD | I754: JOYCE | L754: SCHICKERT | O754: HEARD | R754: MCARTHUR
A755: GEELONG WEST | C755: DEEATH | F755: HISCOX | I755: SMITH | L755: ADAMS | O755: WILLIAMS | R755: EMOND
A756: GOALKICKERS
A757: PRESTON | C757: CLARK 8 | F757: TELFORD 5 | I757: HEARD 4 | K757: JOYCE 3 | M757: McARTHUR 2 | P757: LESLIE | R757: MCLEAN
A758: GEELONG WEST | C758: SMITH 3 | F758: BARRY 2 | I758: ANDJELKOVIC 2 | M758: EMOND | O758: HISCOX
A760: ROUND 17 | E760: 16TH AUGUST | I760: WEATHER | M760: S BREEZE DULL | S760: PLAYED AT
D761: 1ST QTR | H761: 2ND QTR | L761: 3RD QTR | P761: FINAL | S761: BRUNSWICK
A762: BRUNSWICK | C762: 3 | D762: 0 | E762: =C762*6+D762 -> 18 | G762: 5 | H762: 4 | I762: =G762*6+H762 -> 34 | K762: 8 | L762: 9 | M762: =K762*6+L762 -> 57 | O762: 13 | P762: 11 | Q762: =O762*6+P762 -> 89 | S762: UMPIRE | X762: LADDER | AB762: ROUND | AD762: 17
A763: OAKLEIGH | C763: 2 | D763: 5 | E763: =C763*6+D763 -> 17 | G763: 3 | H763: 10 | I763: =G763*6+H763 -> 28 | K763: 6 | L763: 11 | M763: =K763*6+L763 -> 47 | O763: 8 | P763: 16 | Q763: =O763*6+P763 -> 64 | S763: TORNEY
A764: BEST PLAYERS | W764: TEAM | X764: W | Y764: L | Z764: D | AA764: FOR | AB764: AGST | AC764: % | AD764: PTS
A765: BRUNSWICK | C765: WHELAN | F765: ANDERSON | I765: TONKIN | K765: BRADLEY | N765: K GREIG | Q765: DIETRICH
A766: OAKLEIGH | C766: STEWART | F766: WAPLING | I766: LUFF | K766: SYKES | N766: C RITCHIE | Q766: MURNANE | W766: PRESTON | X766: 16 | Y766: 1 | Z766: 0 | AA766: 2030 | AB766: 1289 | AC766: 157.48642358417379 | AD766: 64
A767: GOALKICKERS | W767: DANDENONG | X767: 13 | Y767: 4 | Z767: 0 | AA767: 1957 | AB767: 1703 | AC767: 114.91 | AD767: 52
A768: BRUNSWICK | C768: WHELAN 4 | F768: COOK 3 | H768: BRADLEY 2 | K768: ANDERSON | N768: OGSTON | P768: BURNS | R768: K GREIG | W768: SANDRINGHAM | X768: 12 | Y768: 5 | Z768: 0 | AA768: 1739 | AB768: 1585 | AC768: 109.71608832807571 | AD768: 48
A769: OAKLEIGH | C769: MURNANE 2 | F769: BEARD 2 | I769: WAPLING 2 | L769: MOULDEN | N769: JORDAN | W769: PORT MELBOURNE | X769: 11 | Y769: 6 | Z769: 0 | AA769: 1691 | AB769: 1398 | AC769: 120.96 | AD769: 44
D770: 17TH AUGUST | I770: WEATHER
A771: DANDENONG | C771: 5 | D771: 2 | E771: =C771*6+D771 -> 32 | G771: 11 | H771: 6 | I771: =G771*6+H771 -> 72 | K771: 16 | L771: 11 | M771: =K771*6+L771 -> 107 | O771: 19 | P771: 12 | Q771: =O771*6+P771 -> 126 | S771: YARRAVILLE | W771: YARRAVILLE | X771: 9 | Y771: 8 | Z771: 0 | AA771: 1783 | AB771: 1648 | AC771: 108.19174757281553 | AD771: 36
A772: YARRAVILLE | C772: 1 | D772: 2 | E772: =C772*6+D772 -> 8 | G772: 7 | H772: 5 | I772: =G772*6+H772 -> 47 | K772: 12 | L772: 7 | M772: =K772*6+L772 -> 79 | O772: 17 | P772: 15 | Q772: =O772*6+P772 -> 117 | S772: DUGARD | W772: PRAHRAN | X772: 9 | Y772: 8 | Z772: 0 | AA772: 1712 | AB772: 1625 | AC772: 105.35384615384615 | AD772: 36
A773: BEST PLAYERS | W773: WAVERLEY | X773: 6 | Y773: 11 | Z773: 0 | AA773: 1508 | AB773: 1623 | AC773: 92.914356130622309 | AD773: 24
A774: DANDENONG | C774: EVANS | F774: ROBERTSON | I774: FLAHERTY | L774: ABRAHAM | O774: STEDWELL | R774: LIENERT | W774: GEELONG WEST | X774: 4 | Y774: 13 | Z774: 0 | AA774: 1328 | AB774: 1856 | AC774: 71.551724137931032 | AD774: 16
A775: YARRAVILLE | C775: HEYME | F775: HERIOT | I775: DAVIES | L775: N MADIGAN | O775: BARR | R775: GROSE | W775: BRUNSWICK | X775: 3 | Y775: 14 | Z775: 0 | AA775: 1304 | AB775: 1798 | AC775: 72.53 | AD775: 12
A776: GOALKICKERS | W776: OAKLEIGH | X776: 2 | Y776: 15 | Z776: 0 | AA776: 1275 | AB776: 1802 | AC776: 70.75 | AD776: 8
A777: DANDENONG | C777: MILLER 5 | E777: ROBERTSON 5 | H777: FLAHERTY 4 | K777: LIENERT | M777: MORROW | O777: EVANS | Q777: GUINANE | S777: NANKERVIS
A778: YARRAVILLE | C778: HEYME 4 | E778: DAVIES 3 | G778: N MADIGAN 3 | J778: UBERGANG 2 | M778: BARR | O778: ROWE | Q778: CHARLES | S778: CUMMING | V778: MATHESON
A780: SANDRINGHAM | C780: 3 | D780: 6 | E780: =C780*6+D780 -> 24 | G780: 8 | H780: 10 | I780: =G780*6+H780 -> 58 | K780: 10 | L780: 20 | M780: =K780*6+L780 -> 80 | O780: 17 | P780: 22 | Q780: =O780*6+P780 -> 124 | S780: TOORAK PARK
A781: PRAHRAN | C781: 4 | D781: 2 | E781: =C781*6+D781 -> 26 | G781: 9 | H781: 6 | I781: =G781*6+H781 -> 60 | K781: 14 | L781: 10 | M781: =K781*6+L781 -> 94 | O781: 18 | P781: 13 | Q781: =O781*6+P781 -> 121 | S781: GAMBETTA
A782: BEST PLAYERS
A783: SANDRINGHAM | C783: HANCE | F783: SHARROCK | I783: HOGAN | L783: J WARD | O783: ADDISON | R783: K WILLS
A784: PRAHRAN | C784: HUTCHESSON | F784: CROWE | I784: PARKER | L784: MCMAHON | O784: RAEBURN | R784: DICKESON
A785: GOALKICKERS
A786: SANDRINGHAM | C786: HOGAN 6 | F786: J WARD 3 | I786: ZEUSCHNER 2 | L786: SHARROCK 2 | O786: HANCE | Q786: AUSTIN | S786: WILLIAMS | V786: HUTCHINSON
A787: PRAHRAN | C787: POWER 5 | F787: BARTLETT 3 | I787: PARKER 3 | L787: PAYNE 3 | N787: CAFFYN 2 | Q787: BRADLEY | S787: HUTCHESSON
A789: PRESTON | C789: 4 | D789: 5 | E789: =C789*6+D789 -> 29 | G789: 8 | H789: 9 | I789: =G789*6+H789 -> 57 | K789: 14 | L789: 15 | M789: =K789*6+L789 -> 99 | O789: 17 | P789: 19 | Q789: =O789*6+P789 -> 121 | S789: WAVERLEY
A790: WAVERLEY | C790: 3 | D790: 0 | E790: =C790*6+D790 -> 18 | G790: 7 | H790: 4 | I790: =G790*6+H790 -> 46 | K790: 8 | L790: 5 | M790: =K790*6+L790 -> 53 | O790: 15 | P790: 7 | Q790: =O790*6+P790 -> 97 | S790: FLANAGAN
A791: BEST PLAYERS
A792: PRESTON | C792: McKERNAN | F792: TELFORD | I792: REID | L792: DALTON | O792: McLEAN | R792: HILL
A793: WAVERLEY | C793: BLEW | F793: BACKHOUSE | I793: POORE | L793: G PARKER | O793: McKENZIE | R793: ALLAN
A794: GOALKICKERS
A795: PRESTON | C795: McLEAN 4 | F795: CLARK 3 | I795: JOYCE 3 | K795: REID 3 | M795: LESLIE 2 | O795: DALTON 2
A796: WAVERLEY | C796: G PARKER 3 | F796: POORE 3 | I796: HARDERS 2 | L796: MORRIS 2 | N796: McKENZIE | Q796: WARNER | S796: R HORKINGS | V796: JONES | X796: BLEW
A798: PORT MELBOURNE | C798: 5 | D798: 5 | E798: =C798*6+D798 -> 35 | G798: 15 | H798: 9 | I798: =G798*6+H798 -> 99 | K798: 20 | L798: 13 | M798: =K798*6+L798 -> 133 | O798: 22 | P798: 17 | Q798: =O798*6+P798 -> 149 | S798: PORT MELBOURNE
A799: GEELONG WEST | C799: 1 | D799: 2 | E799: =C799*6+D799 -> 8 | G799: 2 | H799: 6 | I799: =G799*6+H799 -> 18 | K799: 5 | L799: 6 | M799: =K799*6+L799 -> 36 | O799: 9 | P799: 9 | Q799: =O799*6+P799 -> 63 | S799: O'NEILL
A800: BEST PLAYERS
A801: PORT MELBOURNE | C801: BONNETT | F801: BARCLAY | I801: CAULFIELD | L801: M ALLEN | O801: BEHAN | R801: GOSS
A802: GEELONG WEST | C802: SKROWROSKI | F802: WILLIAMS | I802: ADAMS | L802: DEEATH | O802: SMITH | R802: ROCHFORD
A803: GOALKICKERS
A804: PORT MELBOURNE | C804: NORTON 4 | F804: M ALLEN 4 | I804: BARCLAY 4 | L804: WISEMAN 3 | O804: GOSS 2 | Q804: IRELAND 2 | T804: BRICE 2 | W804: BEHAN
A805: GEELONG WEST | C805: ANDERSON 3 | F805: DEEATH 2 | I805: WILLIAMS 2 | L805: HISCOX | N805: SMITH
A807: ROUND 18 | E807: 23RD AUGUST | J807: WEATHER | N807: FINE | S807: PLAYED AT
D808: 1ST QTR | H808: 2ND QTR | L808: 3RD QTR | P808: FINAL | S808: PRESTON
A809: PRESTON | C809: 3 | D809: 2 | E809: =C809*6+D809 -> 20 | G809: 13 | H809: 4 | I809: =G809*6+H809 -> 82 | K809: 18 | L809: 6 | M809: =K809*6+L809 -> 114 | O809: 20 | P809: 8 | Q809: =O809*6+P809 -> 128 | S809: UMPIRE | X809: LADDER | AB809: ROUND | AD809: 18
A810: PORT MELBOURNE | C810: 2 | D810: 5 | E810: =C810*6+D810 -> 17 | G810: 5 | H810: 8 | I810: =G810*6+H810 -> 38 | K810: 12 | L810: 11 | M810: =K810*6+L810 -> 83 | O810: 17 | P810: 16 | Q810: =O810*6+P810 -> 118 | S810: HOLZER
A811: BEST PLAYERS | W811: TEAM | X811: W | Y811: L | Z811: D | AA811: FOR | AB811: AGST | AC811: % | AD811: PTS
A812: PRESTON | C812: TELFORD | F812: HEARD | I812: HILL | K812: SCHICKERT | N812: LESLIE | Q812: GOAD
A813: PORT MELBOURNE | C813: BAHEN | F813: BEHAN | I813: GOSS | K813: BRICE | N813: GROVER | Q813: EKLUND | W813: PRESTON | X813: 17 | Y813: 1 | Z813: 0 | AA813: 2158 | AB813: 1407 | AC813: 153.37597725657426 | AD813: 68
A814: GOALKICKERS | W814: DANDENONG | X814: 14 | Y814: 4 | Z814: 0 | AA814: 2075 | AB814: 1784 | AC814: 116.31 | AD814: 56
A815: PRESTON | C815: CLARK 4 | E815: JOYCE 3 | G815: REID 3 | I815: McARTHUR 2 | L815: DALTON 2 | N815: HEARD 2 | P815: LESLIE 2 | R815: McLEAN | T815: DEAN | W815: SANDRINGHAM | X815: 13 | Y815: 5 | Z815: 0 | AA815: 1851 | AB815: 1684 | AC815: 109.91686460807601 | AD815: 52
A816: PORT MELBOURNE | C816: EKLUND 5) | F816: BRICE 4 | H816: GOSS 4 | J816: BEHAN | L816: BAHEN | N816: BARCLAY | P816: PHILLIPS | W816: PORT MELBOURNE | X816: 11 | Y816: 7 | Z816: 0 | AA816: 1809 | AB816: 1526 | AC816: 118.55 | AD816: 44
A818: SANDRINGHAM | C818: 3 | D818: 1 | E818: =C818*6+D818 -> 19 | G818: 8 | H818: 13 | I818: =G818*6+H818 -> 61 | K818: 8 | L818: 19 | M818: =K818*6+L818 -> 67 | O818: 15 | P818: 22 | Q818: =O818*6+P818 -> 112 | S818: BEACH ROAD | W818: YARRAVILLE | X818: 9 | Y818: 9 | Z818: 0 | AA818: 1882 | AB818: 1760 | AC818: 106.93181818181819 | AD818: 36
A819: YARRAVILLE | C819: 4 | D819: 6 | E819: =C819*6+D819 -> 30 | G819: 8 | H819: 8 | I819: =G819*6+H819 -> 56 | K819: 12 | L819: 14 | M819: =K819*6+L819 -> 86 | O819: 14 | P819: 15 | Q819: =O819*6+P819 -> 99 | S819: McMASTER | W819: PRAHRAN | X819: 9 | Y819: 9 | Z819: 0 | AA819: 1793 | AB819: 1743 | AC819: 102.86861732644866 | AD819: 36
A820: BEST PLAYERS | W820: WAVERLEY | X820: 6 | Y820: 12 | Z820: 0 | AA820: 1582 | AB820: 1743 | AC820: 90.763052208835347 | AD820: 24
A821: SANDRINGHAM | C821: WALFORD | F821: BUSSE | I821: WILLIAMS | L821: HOGAN | O821: AUSTIN | Q821: ELLIS | W821: GEELONG WEST | X821: 5 | Y821: 13 | Z821: 0 | AA821: 1402 | AB821: 1909 | AC821: 73.441592456783653 | AD821: 20
A822: YARRAVILLE | C822: HERIOT | F822: DAVIES | I822: UBERGANG | L822: CUMMING | O822: HEYME | Q822: COOK | W822: OAKLEIGH | X822: 3 | Y822: 15 | Z822: 0 | AA822: 1395 | AB822: 1876 | AC822: 74.36 | AD822: 12
A823: GOALKICKERS | W823: BRUNSWICK | X823: 3 | Y823: 15 | Z823: 0 | AA823: 1357 | AB823: 1872 | AC823: 72.49 | AD823: 12
A824: SANDRINGHAM | C824: WALFORD 5 | F824: HOGAN 5 | I824: WILLIAMS 3 | L824: HUTCHINSON 2
A825: YARRAVILLE | C825: BONGETTI 3 | F825: SKIDMORE 2 | I825: KEMP 2 | K825: DAVIES 2 | M825: COOK | N825: CUMMING | Q825: BARR | R825: WAGHORN | U825: N MADIGAN
A827: DANDENONG | C827: 4 | D827: 6 | E827: =C827*6+D827 -> 30 | G827: 8 | H827: 6 | I827: =G827*6+H827 -> 54 | K827: 11 | L827: 9 | M827: =K827*6+L827 -> 75 | O827: 17 | P827: 16 | Q827: =O827*6+P827 -> 118 | S827: DANDENONG
A828: PRAHRAN | C828: 3 | D828: 4 | E828: =C828*6+D828 -> 22 | G828: 5 | H828: 8 | I828: =G828*6+H828 -> 38 | K828: 8 | L828: 12 | M828: =K828*6+L828 -> 60 | O828: 11 | P828: 15 | Q828: =O828*6+P828 -> 81 | S828: O'NEILL
A829: BEST PLAYERS
A830: DANDENONG | C830: MILLER | F830: ABRAHAM | I830: NANKERVIS | L830: EVANS | O830: FLAHERTY | R830: BETHKE
A831: PRAHRAN | C831: HUTCHESSON | F831: ROSE | I831: PARKER | L831: RAEBURN | O831: BRADLEY | R831: JUNGWIRTH
A832: GOALKICKERS
A833: DANDENONG | C833: MILLER 9 | F833: FLAHERTY 4 | I833: MORROW | K833: MELAI | M833: ROBERTSON | P833: NANKERVIS
A834: PRAHRAN | C834: POWER 4 | F834: HUTCHESSON 2 | J834: PAYNE 2 | M834: ROSE | O834: CAFFYN | Q834: JUNGWIRTH
A836: OAKLEIGH | C836: 3 | D836: 2 | E836: =C836*6+D836 -> 20 | G836: 6 | H836: 5 | I836: =G836*6+H836 -> 41 | K836: 10 | L836: 9 | M836: =K836*6+L836 -> 69 | O836: 17 | P836: 18 | Q836: =O836*6+P836 -> 120 | S836: OAKLEIGH
A837: WAVERLEY | C837: 3 | D837: 2 | E837: =C837*6+D837 -> 20 | G837: 5 | H837: 6 | I837: =G837*6+H837 -> 36 | K837: 7 | L837: 11 | M837: =K837*6+L837 -> 53 | O837: 10 | P837: 14 | Q837: =O837*6+P837 -> 74 | S837: BREWER
A838: BEST PLAYERS
A839: OAKLEIGH | C839: BEARD | F839: JORDAN | I839: SYKES | L839: CUMMINGS | O839: FORD | R839: STEWART
A840: WAVERLEY | C840: BACKHOUSE | F840: POORE | I840: BLEW | L840: G PARKER | O840: R HORKINGS | R840: JONES
A841: GOALKICKERS
A842: OAKLEIGH | C842: CUMMINGS 8 | F842: BEARD 3 | I842: JORDAN 3 | L842: WAPLING 2 | O842: JONES
A843: WAVERLEY | C843: HARDERS 2 | F843: POORE 2 | I843: MCKENZIE | L843: G PARKER | N843: ALLAN | P843: R HORKINGS | S843: BLEW | U843: MORRIS
A845: GEELONG WEST | C845: 1 | D845: 7 | E845: =C845*6+D845 -> 13 | G845: 2 | H845: 17 | I845: =G845*6+H845 -> 29 | K845: 4 | L845: 17 | M845: =K845*6+L845 -> 41 | O845: 9 | P845: 20 | Q845: =O845*6+P845 -> 74 | S845: GEELONG WEST
A846: BRUNSWICK | C846: 2 | D846: 3 | E846: =C846*6+D846 -> 15 | G846: 4 | H846: 7 | I846: =G846*6+H846 -> 31 | K846: 6 | L846: 12 | M846: =K846*6+L846 -> 48 | O846: 6 | P846: 17 | Q846: =O846*6+P846 -> 53 | S846: FLANAGAN
A847: BEST PLAYERS
A848: GEELONG WEST | C848: ADAMS | F848: SKROWRONSKI | I848: B JENNINGS | L848: ROCHFORD | O848: SMITH | Q848: G FRY
A849: BRUNSWICK | C849: DIETRICH | F849: WHELAN | I849: BRADLEY | L849: LEYDIN | O849: BURNS | Q849: K GREIG
A850: GOALKICKERS
A851: GEELONG WEST | C851: ANDERSON 2 | F851: G MOORE 2 | I851: HISCOX | K851: SMITH | M851: LARKINS | O851: G O'DONNELL | R851: ADAMS
A852: BRUNSWICK | C852: COOK | E852: WHELAN | G852: MATTHEWS | J852: LEYDIN | L852: TONKIN | N852: BRADLEY
A854: FINALS
A855: 1ST SEMI | E855: 31ST AUGUST | J855: WEATHER | N855: FINE
D856: 1ST QTR | H856: 2ND QTR | L856: 3RD QTR | P856: FINAL
A857: PORT MELBOURNE | C857: 3 | D857: 4 | E857: =C857*6+D857 -> 22 | G857: 10 | H857: 7 | I857: =G857*6+H857 -> 67 | K857: 13 | L857: 9 | M857: =K857*6+L857 -> 87 | O857: 16 | P857: 18 | Q857: =O857*6+P857 -> 114 | S857: PUNT ROAD
A858: SANDRINGHAM | C858: 3 | D858: 8 | E858: =C858*6+D858 -> 26 | G858: 6 | H858: 9 | I858: =G858*6+H858 -> 45 | K858: 14 | L858: 16 | M858: =K858*6+L858 -> 100 | O858: 14 | P858: 20 | Q858: =O858*6+P858 -> 104 | S858: O'NEILL
A859: BEST PLAYERS
A860: PORT MELBOURNE | C860: GOSS | F860: BEHAN | I860: McKEW | L860: CAULFIELD | O860: BAHEN | R860: BRICE
A861: SANDRINGHAM | C861: SHARROCK | F861: ZEUSCHNER | I861: BUSSE | L861: SELLECK | O861: WALFORD | R861: HANCE
A862: GOALKICKERS
A863: PORT MELBOURNE | C863: GOSS 5 | E863: BEHAN 2 | G863: WISEMAN 2 | J863: PASQUILL 2 | M863: BAHEN | O863: IRELAND | Q863: BARCLAY | S863: EKLUND | U863: BRICE
A864: SANDRINGHAM | C864: ZEUSCHNER 9 | F864: WALFORD 2 | I864: WILLIAMS 2 | L864: J WARD
A866: 2ND SEMI | E866: 7TH SEPTEMBER | J866: WEATHER | M866: SOUTH WEST WIND FINE
A867: PRESTON | C867: 2 | D867: 4 | E867: =C867*6+D867 -> 16 | G867: 5 | H867: 8 | I867: =G867*6+H867 -> 38 | K867: 7 | L867: 11 | M867: =K867*6+L867 -> 53 | O867: 10 | P867: 18 | Q867: =O867*6+P867 -> 78 | S867: PUNT ROAD
A868: DANDENONG | C868: 2 | D868: 3 | E868: =C868*6+D868 -> 15 | G868: 3 | H868: 6 | I868: =G868*6+H868 -> 24 | K868: 6 | L868: 9 | M868: =K868*6+L868 -> 45 | O868: 11 | P868: 9 | Q868: =O868*6+P868 -> 75 | S868: McMASTER
A869: BEST PLAYERS
A870: PRESTON | C870: HEARD | F870: REID | I870: DALTON | L870: TELFORD | O870: MCARTHUR | R870: CLARK
A871: DANDENONG | C871: EVANS | F871: VAN LINT | I871: FLAHERTY | L871: ABRAHAM | O871: NANKERVIS | R871: LIENERT
A872: GOALKICKERS
A873: PRESTON | C873: DALTON 3 | F873: REID 2 | I873: HEARD 2 | L873: CLARK 2 | O873: JOYCE
A874: DANDENONG | C874: MILLER 4 | F874: FLAHERTY 3 | I874: MORROW 2 | L874: ANDREWS | O874: KENDALL
A876: PRELIMINARY FINAL | F876: 14TH SEPTEMBER | K876: WEATHER | N876: SOUTH WEST WIND
A877: DANDENONG | C877: 3 | D877: 2 | E877: =C877*6+D877 -> 20 | G877: 6 | H877: 4 | I877: =G877*6+H877 -> 40 | K877: 11 | L877: 14 | M877: =K877*6+L877 -> 80 | O877: 15 | P877: 16 | Q877: =O877*6+P877 -> 106 | S877: PUNT ROAD
A878: PORT MELBOURNE | C878: 1 | D878: 4 | E878: =C878*6+D878 -> 10 | G878: 7 | H878: 11 | I878: =G878*6+H878 -> 53 | K878: 10 | L878: 11 | M878: =K878*6+L878 -> 71 | O878: 13 | P878: 15 | Q878: =O878*6+P878 -> 93 | S878: BREWER
A879: BEST PLAYERS
A880: DANDENONG | C880: FLAHERTY | F880: ABRAHAM | I880: EVANS | L880: MORROW | O880: MELAI | R880: NANKERVIS
A881: PORT MELBOURNE | C881: BEHAN | F881: GARDNER | I881: IRELAND | L881: BAHEN | O881: BARCLAY | R881: PASQUILL
A882: GOALKICKERS
A883: DANDENONG | C883: FLAHERTY 6 | F883: MILLER 4 | I883: NANKERVIS 2 | L883: MORROW | N883: ELLIS | P883: SHEEHAN
A884: PORT MELBOURNE | C884: BARCLAY 4 | F884: IRELAND 3 | I884: BEHAN 2 | K884: PASQUILL 2 | N884: EKLUND | P884: BRICE
A886: GRAND FINAL | E886: 21ST SEPTEMBER | J886: WEATHER | M886: SOUTH WIND RAIN COLD
A887: PRESTON | C887: 5 | D887: 5 | E887: 35 | G887: 7 | H887: 9 | I887: 51 | K887: 9 | L887: 11 | M887: 65 | O887: 12 | P887: 11 | Q887: =O887*6+P887 -> 83 | S887: PUNT ROAD
A888: DANDENONG | C888: 3 | D888: 0 | E888: 18 | G888: 5 | H888: 4 | I888: 34 | K888: 7 | L888: 8 | M888: 50 | O888: 10 | P888: 11 | Q888: =O888*6+P888 -> 71 | S888: BREWER
A889: BEST PLAYERS
A890: PRESTON | C890: TELFORD | F890: McARTHUR | I890: HILL | K890: REID | N890: HEARD | Q890: CLARK
A891: DANDENONG | C891: STEDWELL | F891: MILLER | I891: MELAI | K891: TONKS | N891: MORROW | Q891: NANKERVIS
A892: GOALKICKERS
A893: PRESTON | C893: JOYCE 3 | F893: TELFORD 2 | I893: REID | K893: DEAN | M893: DALTON | O893: HEARD | Q893: McLEAN | S893: LESLIE | U893: CLARK
A894: DANDENONG | C894: MILLER 7 | F894: STEDWELL | I894: GUINANE | L894: SHEEHAN