A1: Victorian Football Association
A2: Season 1969 - Division Two
A3: © Copyright Wal Williams | F3: First created: 28 March 2016
A4: Contact: joywalwi at gmail dot com | F4: Last updated: 28 March 2016 | W4: VFA Results and tables - Link to the main index page
A5: You are free to copy this document in whole or part provided that proper acknowledgement is given to the author. All rights reserved.
A7: 1969 | C7: V.F.A. SEASON 2ND DIVISION
A8: ROUND 1 | E8: 12TH APRIL | J8: WEATHER | S8: PLAYED AT
D9: 1ST QTR | H9: 2ND QTR | L9: 3RD QTR | P9: FINAL | S9: MORDIALLOC
A10: FRANKSTON | C10: 0 | D10: 0 | E10: =C10*6+D10 -> 0 | G10: 0 | H10: 0 | I10: =G10*6+H10 -> 0 | K10: 0 | L10: 0 | M10: =K10*6+L10 -> 0 | O10: 14 | P10: 16 | Q10: =O10*6+P10 -> 100 | S10: UMPIRE | X10: LADDER | AB10: ROUND | AD10: 1
A11: MORDIALLOC | C11: 0 | D11: 0 | E11: =C11*6+D11 -> 0 | G11: 0 | H11: 0 | I11: =G11*6+H11 -> 0 | K11: 0 | L11: 0 | M11: =K11*6+L11 -> 0 | O11: 8 | P11: 18 | Q11: =O11*6+P11 -> 66
A12: BEST PLAYERS | W12: TEAM | X12: W | Y12: L | Z12: D | AA12: FOR | AB12: AGST | AC12: % | AD12: PTS
A13: FRANKSTON
A14: MORDIALLOC | W14: COBURG | X14: 1 | Y14: 0 | Z14: 0 | AA14: 140 | AB14: 71 | AC14: =(AA14*100)/AB14 -> 197.18309859154928 | AD14: =(X14*4)+(Z14*2) -> 4
A15: GOALKICKERS | W15: BOX HILL | X15: 1 | Y15: 0 | Z15: 0 | AA15: 100 | AB15: 51 | AC15: =(AA15*100)/AB15 -> 196.07843137254903 | AD15: =(X15*4)+(Z15*2) -> 4
A16: FRANKSTON | W16: FRANKSTON | X16: 1 | Y16: 0 | Z16: 0 | AA16: 100 | AB16: 66 | AC16: =(AA16*100)/AB16 -> 151.5151515151515 | AD16: =(X16*4)+(Z16*2) -> 4
A17: MORDIALLOC | W17: SUNSHINE | X17: 1 | Y17: 0 | Z17: 0 | AA17: 101 | AB17: 76 | AC17: =(AA17*100)/AB17 -> 132.89473684210526 | AD17: =(X17*4)+(Z17*2) -> 4
A19: SUNSHINE | C19: 0 | D19: 0 | E19: =C19*6+D19 -> 0 | G19: 0 | H19: 0 | I19: =G19*6+H19 -> 0 | K19: 0 | L19: 0 | M19: =K19*6+L19 -> 0 | O19: 15 | P19: 11 | Q19: =O19*6+P19 -> 101 | S19: WILLIAMSTOWN | W19: CAULFIELD | X19: 1 | Y19: 0 | Z19: 0 | AA19: 91 | AB19: 76 | AC19: =(AA19*100)/AB19 -> 119.73684210526316 | AD19: =(X19*4)+(Z19*2) -> 4
A20: WILLIAMSTOWN | C20: 0 | D20: 0 | E20: =C20*6+D20 -> 0 | G20: 0 | H20: 0 | I20: =G20*6+H20 -> 0 | K20: 0 | L20: 0 | M20: =K20*6+L20 -> 0 | O20: 10 | P20: 16 | Q20: =O20*6+P20 -> 76 | W20: WERRIBEE | X20: 0 | Y20: 1 | Z20: 0 | AA20: 76 | AB20: 91 | AC20: =(AA20*100)/AB20 -> 83.516483516483518 | AD20: =(X20*4)+(Z20*2) -> 0
A21: BEST PLAYERS | W21: WILLIAMSTOWN | X21: 0 | Y21: 1 | Z21: 0 | AA21: 76 | AB21: 101 | AC21: =(AA21*100)/AB21 -> 75.247524752475243 | AD21: =(X21*4)+(Z21*2) -> 0
A22: SUNSHINE | W22: MORDIALLOC | X22: 0 | Y22: 1 | Z22: 0 | AA22: 66 | AB22: 100 | AC22: =(AA22*100)/AB22 -> 66 | AD22: =(X22*4)+(Z22*2) -> 0
A23: WILLIAMSTOWN | W23: CAMBERWELL | X23: 0 | Y23: 1 | Z23: 0 | AA23: 51 | AB23: 100 | AC23: =(AA23*100)/AB23 -> 51 | AD23: =(X23*4)+(Z23*2) -> 0
A24: GOALKICKERS | W24: NORTHCOTE | X24: 0 | Y24: 1 | Z24: 0 | AA24: 71 | AB24: 140 | AC24: =(AA24*100)/AB24 -> 50.714285714285715 | AD24: =(X24*4)+(Z24*2) -> 0
A25: SUNSHINE
A26: WILLIAMSTOWN
A28: BOX HILL | C28: 0 | D28: 0 | E28: =C28*6+D28 -> 0 | G28: 0 | H28: 0 | I28: =G28*6+H28 -> 0 | K28: 0 | L28: 0 | M28: =K28*6+L28 -> 0 | O28: 14 | P28: 16 | Q28: =O28*6+P28 -> 100 | S28: CAMBERWELL
A29: CAMBERWELL | C29: 0 | D29: 0 | E29: =C29*6+D29 -> 0 | G29: 0 | H29: 0 | I29: =G29*6+H29 -> 0 | K29: 0 | L29: 0 | M29: =K29*6+L29 -> 0 | O29: 7 | P29: 9 | Q29: =O29*6+P29 -> 51
A30: BEST PLAYERS
A31: BOX HILL
A32: CAMBERWELL
A33: GOALKICKERS
A34: BOX HILL
A35: CAMBERWELL
A37: CAULFIELD | C37: 0 | D37: 0 | E37: =C37*6+D37 -> 0 | G37: 0 | H37: 0 | I37: =G37*6+H37 -> 0 | K37: 0 | L37: 0 | M37: =K37*6+L37 -> 0 | O37: 12 | P37: 19 | Q37: =O37*6+P37 -> 91 | S37: PRINCES PARK, CAULFIELD
A38: WERRIBEE | C38: 0 | D38: 0 | E38: =C38*6+D38 -> 0 | G38: 0 | H38: 0 | I38: =G38*6+H38 -> 0 | K38: 0 | L38: 0 | M38: =K38*6+L38 -> 0 | O38: 12 | P38: 4 | Q38: =O38*6+P38 -> 76
A39: BEST PLAYERS
A40: CAULFIELD
A41: WERRIBEE
A42: GOALKICKERS
A43: CAULFIELD
A44: WERRIBEE
A46: COBURG | C46: 0 | D46: 0 | E46: =C46*6+D46 -> 0 | G46: 0 | H46: 0 | I46: =G46*6+H46 -> 0 | K46: 0 | L46: 0 | M46: =K46*6+L46 -> 0 | O46: 19 | P46: 26 | Q46: =O46*6+P46 -> 140 | S46: NORTHCOTE
A47: NORTHCOTE | C47: 0 | D47: 0 | E47: =C47*6+D47 -> 0 | G47: 0 | H47: 0 | I47: =G47*6+H47 -> 0 | K47: 0 | L47: 0 | M47: =K47*6+L47 -> 0 | O47: 10 | P47: 11 | Q47: =O47*6+P47 -> 71
A48: BEST PLAYERS
A49: COBURG
A50: NORTHCOTE
A51: GOALKICKERS
A52: COBURG
A53: NORTHCOTE
A55: ROUND 2 | E55: 19TH APRIL | J55: WEATHER | S55: PLAYED AT
D56: 1ST QTR | H56: 2ND QTR | L56: 3RD QTR | P56: FINAL | S56: NORTHCOTE
A57: NORTHCOTE | C57: 5 | D57: 4 | E57: =C57*6+D57 -> 34 | G57: 7 | H57: 7 | I57: =G57*6+H57 -> 49 | K57: 12 | L57: 11 | M57: =K57*6+L57 -> 83 | O57: 15 | P57: 13 | Q57: =O57*6+P57 -> 103 | S57: UMPIRE | X57: LADDER | AB57: ROUND | AD57: 2
A58: CAULFIELD | C58: 3 | D58: 2 | E58: =C58*6+D58 -> 20 | G58: 7 | H58: 7 | I58: =G58*6+H58 -> 49 | K58: 7 | L58: 8 | M58: =K58*6+L58 -> 50 | O58: 9 | P58: 12 | Q58: =O58*6+P58 -> 66
A59: BEST PLAYERS | W59: TEAM | X59: W | Y59: L | Z59: D | AA59: FOR | AB59: AGST | AC59: % | AD59: PTS
A60: NORTHCOTE | C60: QUAIFE | F60: McGORLICK | I60: DEAN | L60: STAFFORD | O60: SMITH | Q60: HEAL
A61: CAULFIELD | C61: ROBINSON | F61: JONES | I61: ARRELL | L61: SCHMIDT | O61: MELBOURNE | R61: WILLIAMS | W61: SUNSHINE | X61: 2 | Y61: 0 | Z61: 0 | AA61: 252 | AB61: 128 | AC61: =(AA61*100)/AB61 -> 196.875 | AD61: =(X61*4)+(Z61*2) -> 8
A62: GOALKICKERS | W62: COBURG | X62: 2 | Y62: 0 | Z62: 0 | AA62: 278 | AB62: 153 | AC62: =(AA62*100)/AB62 -> 181.69934640522877 | AD62: =(X62*4)+(Z62*2) -> 8
A63: NORTHCOTE | C63: QUAIFE 8 | F63: STAFFORD 2 | I63: HEAL 2 | K63: DEAN | M63: MOLLO | O63: JONES | W63: WERRIBEE | X63: 1 | Y63: 1 | Z63: 0 | AA63: 230 | AB63: 123 | AC63: =(AA63*100)/AB63 -> 186.99186991869919 | AD63: =(X63*4)+(Z63*2) -> 4
A64: CAULFIELD | C64: BROWN 2 | F64: ROBINSON 2 | I64: WILLIAMS 2 | L64: BROMLEY 2 | O64: WHITE | W64: WILLIAMSTOWN | X64: 1 | Y64: 1 | Z64: 0 | AA64: 194 | AB64: 142 | AC64: =(AA64*100)/AB64 -> 136.61971830985917 | AD64: =(X64*4)+(Z64*2) -> 4
A66: WERRIBEE | C66: 2 | D66: 0 | E66: =C66*6+D66 -> 12 | G66: 9 | H66: 6 | I66: =G66*6+H66 -> 60 | K66: 16 | L66: 8 | M66: =K66*6+L66 -> 104 | O66: 24 | P66: 10 | Q66: =O66*6+P66 -> 154 | S66: WERRIBEE | W66: FRANKSTON | X66: 1 | Y66: 1 | Z66: 0 | AA66: 182 | AB66: 204 | AC66: =(AA66*100)/AB66 -> 89.215686274509807 | AD66: =(X66*4)+(Z66*2) -> 4
A67: CAMBERWELL | C67: 2 | D67: 4 | E67: =C67*6+D67 -> 16 | G67: 3 | H67: 4 | I67: =G67*6+H67 -> 22 | K67: 4 | L67: 8 | M67: =K67*6+L67 -> 32 | O67: 4 | P67: 8 | Q67: =O67*6+P67 -> 32 | W67: CAULFIELD | X67: 1 | Y67: 1 | Z67: 0 | AA67: 157 | AB67: 179 | AC67: =(AA67*100)/AB67 -> 87.709497206703915 | AD67: =(X67*4)+(Z67*2) -> 4
A68: BEST PLAYERS | W68: NORTHCOTE | X68: 1 | Y68: 1 | Z68: 0 | AA68: 174 | AB68: 206 | AC68: =(AA68*100)/AB68 -> 84.466019417475735 | AD68: =(X68*4)+(Z68*2) -> 4
A69: WERRIBEE | C69: OGILVIE | F69: ELLIS | I69: SHEAHAN | L69: SERTORI | O69: BIDDICK | R69: MONTGOMERY | W69: BOX HILL | X69: 1 | Y69: 1 | Z69: 0 | AA69: 141 | AB69: 169 | AC69: =(AA69*100)/AB69 -> 83.431952662721898 | AD69: =(X69*4)+(Z69*2) -> 4
A70: CAMBERWELL | C70: DELANTY | F70: K SMITH | I70: EDWARDS | L70: TAYLOR | O70: FLOYD | W70: MORDIALLOC | X70: 0 | Y70: 2 | Z70: 0 | AA70: 118 | AB70: 251 | AC70: =(AA70*100)/AB70 -> 47.011952191235061 | AD70: =(X70*4)+(Z70*2) -> 0
A71: GOALKICKERS | N71: B WINTLE | Q71: TRAINION | W71: CAMBERWELL | X71: 0 | Y71: 2 | Z71: 0 | AA71: 83 | AB71: 254 | AC71: =(AA71*100)/AB71 -> 32.677165354330711 | AD71: =(X71*4)+(Z71*2) -> 0
A72: WERRIBEE | C72: BIDDICK 5 | E72: SHEAHAN 5 | G72: ELLIS 3 | I72: SERTORI 3 | K72: NORMAN 2 | N72: PETHERIC 2 | Q72: OGILVIE | S72: SMITH
A73: CAMBERWELL | C73: K SMITH 2 | F73: DELANTY | I73: TAYLOR
A75: WILLIAMSTOWN | C75: 3 | D75: 5 | E75: =C75*6+D75 -> 23 | G75: 6 | H75: 6 | I75: =G75*6+H75 -> 42 | K75: 11 | L75: 12 | M75: =K75*6+L75 -> 78 | O75: 17 | P75: 16 | Q75: =O75*6+P75 -> 118 | S75: BOX HILL
A76: BOX HILL | C76: 2 | D76: 0 | E76: =C76*6+D76 -> 12 | G76: 4 | H76: 1 | I76: =G76*6+H76 -> 25 | K76: 5 | L76: 3 | M76: =K76*6+L76 -> 33 | O76: 6 | P76: 5 | Q76: =O76*6+P76 -> 41
A77: BEST PLAYERS
A78: WILLIAMSTOWN | C78: JACKMAN | F78: LANE | I78: VINEY | L78: RUSSELL | O78: PERCY | Q78: PAGE
A79: BOX HILL | C79: WADE | F79: BARNETT | I79: FELLOWS | L79: GREAVES | O79: BATES
A80: GOALKICKERS
A81: WILLIAMSTOWN | C81: CAMILLIERI 4 | F81: JACKMAN 3 | I81: LANE 2 | K81: WILSON 2 | N81: VINEY 2 | P81: BUCHANAN 2 | S81: PAGE | U81: DEY
A82: BOX HILL | C82: PERRY 2 | F82: BATES 2 | I82: FELLOWS | L82: WADE
A84: SUNSHINE | C84: 4 | D84: 3 | E84: =C84*6+D84 -> 27 | G84: 8 | H84: 8 | I84: =G84*6+H84 -> 56 | K84: 14 | L84: 14 | M84: =K84*6+L84 -> 98 | O84: 21 | P84: 25 | Q84: =O84*6+P84 -> 151 | S84: SUNSHINE
A85: MORDIALLOC | C85: 2 | D85: 3 | E85: =C85*6+D85 -> 15 | G85: 4 | H85: 6 | I85: =G85*6+H85 -> 30 | K85: 6 | L85: 9 | M85: =K85*6+L85 -> 45 | O85: 7 | P85: 10 | Q85: =O85*6+P85 -> 52
A86: BEST PLAYERS
A87: SUNSHINE | C87: HIPWORTH | F87: FERGUSON | I87: RUSSELL | L87: BEAN | O87: DARUL | R87: ALLEN
A88: MORDIALLOC | C88: SMITH | F88: BRUTON | I88: MERVITCH | L88: CULPH | O88: McPHERSON | R88: JUDKINS
A89: GOALKICKERS
A90: SUNSHINE | C90: ALLEN 8 | F90: FERGUSON 7 | I90: RUSSELL 2 | L90: BROWN 2 | N90: DEAN | P90: YOUNG
A91: MORDIALLOC | C91: HOBSON 3 | F91: JUDKINS 2 | I91: JOHNSTONE | L91: HYNES
A93: COBURG | C93: 4 | D93: 1 | E93: =C93*6+D93 -> 25 | G93: 10 | H93: 5 | I93: =G93*6+H93 -> 65 | K93: 14 | L93: 9 | M93: =K93*6+L93 -> 93 | O93: 21 | P93: 12 | Q93: =O93*6+P93 -> 138 | S93: FRANKSTON
A94: FRANKSTON | C94: 1 | D94: 5 | E94: =C94*6+D94 -> 11 | G94: 3 | H94: 10 | I94: =G94*6+H94 -> 28 | K94: 8 | L94: 15 | M94: =K94*6+L94 -> 63 | O94: 11 | P94: 16 | Q94: =O94*6+P94 -> 82
A95: BEST PLAYERS
A96: COBURG | C96: GALE | F96: SULLIVAN | I96: ROWE | L96: JACKSON | O96: VINCENT | R96: PRICE
A97: FRANKSTON | C97: COUTTS | F97: BISHOP | I97: KAINE | L97: HEPNER | O97: ARTHUR | R97: WINSTANLEY
A98: GOALKICKERS
A99: COBURG | C99: GALE 6 | E99: SPORTON 3 | G99: BUSBRIDGE 2 | J99: MORRISON 2 | M99: VINCENT 2 | O99: ELVERY | Q99: JACKSON | S99: SULLIVAN | V99: BRANSTON | X99: JENKINS | Z99: PRICE
A100: FRANKSTON | C100: BISHOP 3 | F100: KAINE 2 | H100: WINSTANLEY 2 | K100: ARTHUR | M100: HEPNER | O100: BOWES | Q100: McCALL
A102: ROUND 3 | E102: 26TH APRIL | J102: WEATHER | S102: PLAYED AT
D103: 1ST QTR | H103: 2ND QTR | L103: 3RD QTR | P103: FINAL | S103: CAMBERWELL
A104: CAULFIELD | C104: 2 | D104: 5 | E104: =C104*6+D104 -> 17 | G104: 7 | H104: 11 | I104: =G104*6+H104 -> 53 | K104: 12 | L104: 14 | M104: =K104*6+L104 -> 86 | O104: 16 | P104: 24 | Q104: =O104*6+P104 -> 120 | S104: UMPIRE | X104: LADDER | AB104: ROUND | AD104: 3
A105: CAMBERWELL | C105: 1 | D105: 3 | E105: =C105*6+D105 -> 9 | G105: 3 | H105: 7 | I105: =G105*6+H105 -> 25 | K105: 3 | L105: 14 | M105: =K105*6+L105 -> 32 | O105: 4 | P105: 16 | Q105: =O105*6+P105 -> 40
A106: BEST PLAYERS | W106: TEAM | X106: W | Y106: L | Z106: D | AA106: FOR | AB106: AGST | AC106: % | AD106: PTS
A107: CAULFIELD | C107: MARSHALL | F107: SANDERS | I107: BROWN | L107: ROBINSON | O107: BAKER | Q107: LOGAN
A108: CAMBERWELL | C108: TAYLOR | F108: BOYD | I108: McNAMARA | L108: CONYERS | O108: STAFFORD | W108: SUNSHINE | X108: 3 | Y108: 0 | Z108: 0 | AA108: 412 | AB108: 175 | AC108: =(AA108*100)/AB108 -> 235.42857142857142 | AD108: =(X108*4)+(Z108*2) -> 12
A109: GOALKICKERS | W109: COBURG | X109: 3 | Y109: 0 | Z109: 0 | AA109: 379 | AB109: 208 | AC109: =(AA109*100)/AB109 -> 182.21153846153845 | AD109: =(X109*4)+(Z109*2) -> 12
A110: CAULFIELD | C110: BROWN 5 | F110: ROBINSON 3 | I110: LOGAN 3 | K110: BAKER 2 | M110: TEMPEST | O110: WHITE | Q110: BROMLEY | W110: FRANKSTON | X110: 2 | Y110: 1 | Z110: 0 | AA110: 344 | AB110: 262 | AC110: =(AA110*100)/AB110 -> 131.29770992366412 | AD110: =(X110*4)+(Z110*2) -> 8
A111: CAMBERWELL | C111: RICHARDSON | F111: BRAYNE | I111: WATSFORD | L111: McNAMARA | W111: CAULFIELD | X111: 2 | Y111: 1 | Z111: 0 | AA111: 277 | AB111: 219 | AC111: =(AA111*100)/AB111 -> 126.48401826484019 | AD111: =(X111*4)+(Z111*2) -> 8
A113: FRANKSTON | C113: 6 | D113: 5 | E113: =C113*6+D113 -> 41 | G113: 10 | H113: 8 | I113: =G113*6+H113 -> 68 | K113: 21 | L113: 19 | M113: =K113*6+L113 -> 145 | O113: 23 | P113: 24 | Q113: =O113*6+P113 -> 162 | S113: FRANKSTON | W113: NORTHCOTE | X113: 2 | Y113: 1 | Z113: 0 | AA113: 247 | AB113: 277 | AC113: =(AA113*100)/AB113 -> 89.16967509025271 | AD113: =(X113*4)+(Z113*2) -> 8
A114: BOX HILL | C114: 2 | D114: 4 | E114: =C114*6+D114 -> 16 | G114: 4 | H114: 9 | I114: =G114*6+H114 -> 33 | K114: 5 | L114: 11 | M114: =K114*6+L114 -> 41 | O114: 7 | P114: 16 | Q114: =O114*6+P114 -> 58 | W114: WILLIAMSTOWN | X114: 1 | Y114: 2 | Z114: 0 | AA114: 249 | AB114: 243 | AC114: =(AA114*100)/AB114 -> 102.46913580246914 | AD114: =(X114*4)+(Z114*2) -> 4
A115: BEST PLAYERS | W115: WERRIBEE | X115: 1 | Y115: 2 | Z115: 0 | AA115: 277 | AB115: 283 | AC115: =(AA115*100)/AB115 -> 97.879858657243815 | AD115: =(X115*4)+(Z115*2) -> 4
A116: FRANKSTON | C116: COUTTS | F116: ALDERSON | I116: RENOUF | L116: WESTON | O116: ARTHUR | R116: STAPLETON | W116: BOX HILL | X116: 1 | Y116: 2 | Z116: 0 | AA116: 199 | AB116: 331 | AC116: =(AA116*100)/AB116 -> 60.120845921450154 | AD116: =(X116*4)+(Z116*2) -> 4
A117: BOX HILL | C117: HARRIS | F117: BATES | I117: SALMON | L117: RALPH | O117: McQUALTER | W117: MORDIALLOC | X117: 0 | Y117: 3 | Z117: 0 | AA117: 189 | AB117: 324 | AC117: =(AA117*100)/AB117 -> 58.333333333333336 | AD117: =(X117*4)+(Z117*2) -> 0
A118: GOALKICKERS | W118: CAMBERWELL | X118: 0 | Y118: 3 | Z118: 0 | AA118: 123 | AB118: 274 | AC118: =(AA118*100)/AB118 -> 44.89051094890511 | AD118: =(X118*4)+(Z118*2) -> 0
A119: FRANKSTON | C119: WESTON 6 | F119: LEE 6 | H119: BISHOP 4 | J119: ARTHUR 2 | M119: GRAHAM 2 | O119: NICHOLSON 2 | R119: ROSENBROCK
A120: BOX HILL | C120: GREAVES 3 | F120: K HARRIS 2 | I120: WADE | K120: SHACKLOCK
E121: 27TH APRIL | J121: WEATHER
A122: NORTHCOTE | C122: 3 | D122: 0 | E122: =C122*6+D122 -> 18 | G122: 5 | H122: 2 | I122: =G122*6+H122 -> 32 | K122: 9 | L122: 5 | M122: =K122*6+L122 -> 59 | O122: 11 | P122: 7 | Q122: =O122*6+P122 -> 73 | S122: MORDIALLOC
A123: MORDIALLOC | C123: 4 | D123: 4 | E123: =C123*6+D123 -> 28 | G123: 8 | H123: 8 | I123: =G123*6+H123 -> 56 | K123: 9 | L123: 9 | M123: =K123*6+L123 -> 63 | O123: 10 | P123: 11 | Q123: =O123*6+P123 -> 71
A124: BEST PLAYERS
A125: NORTHCOTE | C125: MUIR | F125: HEAL | I125: VINEY | L125: KEANE | O125: KOZARIS
A126: MORDIALLOC | C126: BRUTON | F126: LANG | I126: SMITH | L126: MATHESON | O126: BENTLEY
A127: GOALKICKERS
A128: NORTHCOTE | C128: KEANE 3 | F128: QUAIFE 2 | I128: HEAL 2 | K128: MOLLO 2 | M128: VINEY | O128: McGORLICK
A129: MORDIALLOC | C129: SMITH 4 | F129: HOBSON | H129: BRUTON | J129: HYNES | L129: GARDINER | O129: THOMPSON | R129: O'FARRELL
A131: COBURG | C131: 3 | D131: 2 | E131: =C131*6+D131 -> 20 | G131: 8 | H131: 4 | I131: =G131*6+H131 -> 52 | K131: 9 | L131: 5 | M131: =K131*6+L131 -> 59 | O131: 15 | P131: 11 | Q131: =O131*6+P131 -> 101 | S131: WILLIAMSTOWN
A132: WILLIAMSTOWN | C132: 2 | D132: 5 | E132: =C132*6+D132 -> 17 | G132: 3 | H132: 7 | I132: =G132*6+H132 -> 25 | K132: 5 | L132: 11 | M132: =K132*6+L132 -> 41 | O132: 7 | P132: 13 | Q132: =O132*6+P132 -> 55
A133: BEST PLAYERS
A134: COBURG | C134: KIRKMAN | F134: ROBINSON | I134: SPORTON | L134: McLACHLAN | O134: GALE
A135: WILLIAMSTOWN | C135: MITCHELL | F135: BUCHANAN | I135: SMITH | L135: JOHNSTON | O135: PAGE | Q135: BARNES
A136: GOALKICKERS
A137: COBURG | C137: SPORTON 7 | F137: BUSBRIDGE 3 | I137: BRANSTON 2 | L137: GALE | N137: VINCENT | Q137: ROBINSON
A138: WILLIAMSTOWN | C138: BUCHANAN 3 | F138: VINEY | I138: WILSON | K138: CAMILLIERI
A140: SUNSHINE | C140: 2 | D140: 6 | E140: =C140*6+D140 -> 18 | G140: 8 | H140: 10 | I140: =G140*6+H140 -> 58 | K140: 18 | L140: 15 | M140: =K140*6+L140 -> 123 | O140: 23 | P140: 22 | Q140: =O140*6+P140 -> 160 | S140: WERRIBEE
A141: WERRIBEE | C141: 4 | D141: 2 | E141: =C141*6+D141 -> 26 | G141: 5 | H141: 7 | I141: =G141*6+H141 -> 37 | K141: 6 | L141: 10 | M141: =K141*6+L141 -> 46 | O141: 6 | P141: 11 | Q141: =O141*6+P141 -> 47
A142: BEST PLAYERS
A143: SUNSHINE | C143: RUSSELL | F143: DARUL | I143: BENSON | L143: IBRAHIM | O143: FERGUSON | R143: BROWN
A144: WERRIBEE | C144: MONTGOMERY | F144: OGILVIE | I144: WINTLE | L144: SMITH | O144: ELLIS | R144: GILLETT
A145: GOALKICKERS
A146: SUNSHINE | C146: ALLEN 6 | E146: FERGUSON 5 | H146: RUSSELL 5 | K146: YOUNG 3 | M146: McGREGOR | P146: BEAN | R146: GOOLD | T146: McGARRITY
A147: WERRIBEE | C147: SMITH 2 | F147: SHEAHAN | I147: ELLIS | K147: SERTORI | N147: OGILVIE
A149: ROUND 4 | E149: 3RD MAY | J149: WEATHER | S149: PLAYED AT
D150: 1ST QTR | H150: 2ND QTR | L150: 3RD QTR | P150: FINAL | S150: PRINCES PARK, CAULFIELD
A151: WILLIAMSTOWN | C151: 4 | D151: 7 | E151: =C151*6+D151 -> 31 | G151: 8 | H151: 14 | I151: =G151*6+H151 -> 62 | K151: 12 | L151: 23 | M151: =K151*6+L151 -> 95 | O151: 15 | P151: 24 | Q151: =O151*6+P151 -> 114 | S151: UMPIRE | X151: LADDER | AB151: ROUND | AD151: 4
A152: CAULFIELD | C152: 2 | D152: 1 | E152: =C152*6+D152 -> 13 | G152: 5 | H152: 7 | I152: =G152*6+H152 -> 37 | K152: 8 | L152: 13 | M152: =K152*6+L152 -> 61 | O152: 14 | P152: 17 | Q152: =O152*6+P152 -> 101
A153: BEST PLAYERS | W153: TEAM | X153: W | Y153: L | Z153: D | AA153: FOR | AB153: AGST | AC153: % | AD153: PTS
A154: WILLIAMSTOWN | C154: SMITH | F154: CAMILLIERI | I154: PAPLEY | L154: VINEY | O154: TISDALE | R154: BARNES
A155: CAULFIELD | C155: YOUNG | F155: GOWANS | I155: ARRELL | L155: BAKER | O155: McGINTY | R155: SANDERS | W155: SUNSHINE | X155: 4 | Y155: 0 | Z155: 0 | AA155: 648 | AB155: 229 | AC155: =(AA155*100)/AB155 -> 282.96943231441048 | AD155: =(X155*4)+(Z155*2) -> 16
A156: GOALKICKERS | W156: COBURG | X156: 4 | Y156: 0 | Z156: 0 | AA156: 546 | AB156: 286 | AC156: =(AA156*100)/AB156 -> 190.90909090909091 | AD156: =(X156*4)+(Z156*2) -> 16
A157: WILLIAMSTOWN | C157: PAPLEY 5 | F157: CAMILLIERI 4 | I157: BARNES 2 | L157: TISDALE 2 | O157: MITCHELL | R157: NASH | W157: NORTHCOTE | X157: 3 | Y157: 1 | Z157: 0 | AA157: 327 | AB157: 338 | AC157: =(AA157*100)/AB157 -> 96.745562130177518 | AD157: =(X157*4)+(Z157*2) -> 12
A158: CAULFIELD | C158: McGINTY 4 | F158: ROBINSON 3 | I158: CURTAIN 2 | L158: ARRELL | N158: GOWANS | P158: BROWN | R158: BROMLEY | T158: O'DONNELL | W158: FRANKSTON | X158: 2 | Y158: 2 | Z158: 0 | AA158: 405 | AB158: 342 | AC158: =(AA158*100)/AB158 -> 118.42105263157895 | AD158: =(X158*4)+(Z158*2) -> 8
A160: NORTHCOTE | C160: 1 | D160: 4 | E160: =C160*6+D160 -> 10 | G160: 4 | H160: 8 | I160: =G160*6+H160 -> 32 | K160: 8 | L160: 12 | M160: =K160*6+L160 -> 60 | O160: 11 | P160: 14 | Q160: =O160*6+P160 -> 80 | S160: NORTHCOTE | W160: CAULFIELD | X160: 2 | Y160: 2 | Z160: 0 | AA160: 378 | AB160: 343 | AC160: =(AA160*100)/AB160 -> 110.20408163265306 | AD160: =(X160*4)+(Z160*2) -> 8
A161: FRANKSTON | C161: 2 | D161: 3 | E161: =C161*6+D161 -> 15 | G161: 3 | H161: 4 | I161: =G161*6+H161 -> 22 | K161: 7 | L161: 8 | M161: =K161*6+L161 -> 50 | O161: 8 | P161: 13 | Q161: =O161*6+P161 -> 61 | W161: WERRIBEE | X161: 2 | Y161: 2 | Z161: 0 | AA161: 399 | AB161: 364 | AC161: =(AA161*100)/AB161 -> 109.61538461538461 | AD161: =(X161*4)+(Z161*2) -> 8
A162: BEST PLAYERS | W162: WILLIAMSTOWN | X162: 2 | Y162: 2 | Z162: 0 | AA162: 363 | AB162: 344 | AC162: =(AA162*100)/AB162 -> 105.52325581395348 | AD162: =(X162*4)+(Z162*2) -> 8
A163: NORTHCOTE | C163: PITT | F163: McCARTHY | I163: VINEY | L163: McGORLICK | O163: KOZARSI | R163: MUIR | W163: BOX HILL | X163: 1 | Y163: 3 | Z163: 0 | AA163: 280 | AB163: 453 | AC163: =(AA163*100)/AB163 -> 61.810154525386316 | AD163: =(X163*4)+(Z163*2) -> 4
A164: FRANKSTON | C164: VAUGHAN | F164: RENOUF | I164: COUTTS | L164: NICHOLSON | O164: BUNOVITCH | R164: WINSTANLEY | W164: MORDIALLOC | X164: 0 | Y164: 4 | Z164: 0 | AA164: 267 | AB164: 491 | AC164: =(AA164*100)/AB164 -> 54.378818737270876 | AD164: =(X164*4)+(Z164*2) -> 0
A165: GOALKICKERS | W165: CAMBERWELL | X165: 0 | Y165: 4 | Z165: 0 | AA165: 177 | AB165: 510 | AC165: =(AA165*100)/AB165 -> 34.705882352941174 | AD165: =(X165*4)+(Z165*2) -> 0
A166: NORTHCOTE | C166: VINEY 4 | F166: DEAN 2 | I166: KEANE 2 | K166: QUAIFE 2 | N166: KOZARIS
A167: FRANKSTON | C167: KAINE 3 | F167: ALDERSON | I167: LEWIS | K167: WESTON | M167: McCOLL | O167: ARTHUR
A169: WERRIBEE | C169: 6 | D169: 5 | E169: =C169*6+D169 -> 41 | G169: 7 | H169: 14 | I169: =G169*6+H169 -> 56 | K169: 13 | L169: 21 | M169: =K169*6+L169 -> 99 | O169: 16 | P169: 26 | Q169: =O169*6+P169 -> 122 | S169: BOX HILL
A170: BOX HILL | C170: 1 | D170: 3 | E170: =C170*6+D170 -> 9 | G170: 5 | H170: 7 | I170: =G170*6+H170 -> 37 | K170: 8 | L170: 9 | M170: =K170*6+L170 -> 57 | O170: 11 | P170: 15 | Q170: =O170*6+P170 -> 81
A171: BEST PLAYERS
A172: WERRIBEE | C172: OGILVIE | F172: TRAINION | I172: CHIRGWIN | L172: BUTTON | O172: HEMLEY | R172: PANETTA
A173: BOX HILL | C173: McQUALTER | F173: GREAVES | I173: WALKER | L173: HUNT | O173: DOULIS | R173: McCURRY
A174: GOALKICKERS
A175: WERRIBEE | C175: OGILVIE 3 | E175: HEMLEY 3 | G175: CHIRGWIN 2 | J175: PANETTA 2 | M175: ELLIS 2 | O175: BUTTON 2 | R175: TRAINION | T175: LYONS
A176: BOX HILL | C176: WALKER 3 | F176: HUNT 2 | H176: HANSEY 2 | J176: BATES | L176: CROZIER | N176: GIORGETTI | Q176: SALMON
E177: 4TH MAY | J177: WEATHER
A178: COBURG | C178: 4 | D178: 1 | E178: =C178*6+D178 -> 25 | G178: 9 | H178: 10 | I178: =G178*6+H178 -> 64 | K178: 16 | L178: 16 | M178: =K178*6+L178 -> 112 | O178: 24 | P178: 23 | Q178: =O178*6+P178 -> 167 | S178: COBURG
A179: MORDIALLOC | C179: 5 | D179: 2 | E179: =C179*6+D179 -> 32 | G179: 8 | H179: 5 | I179: =G179*6+H179 -> 53 | K179: 8 | L179: 10 | M179: =K179*6+L179 -> 58 | O179: 11 | P179: 12 | Q179: =O179*6+P179 -> 78
A180: BEST PLAYERS
A181: COBURG | C181: MORRISON | F181: SULLIVAN | I181: GALE | L181: ELVERY | O181: ROWE | Q181: ERWIN
A182: MORDIALLOC | C182: LANG | F182: JOHNSTONE | I182: MERVICH | L182: HALL | O182: BENTLEY
A183: GOALKICKERS
A184: COBURG | C184: MORRISON 6 | F184: ERWIN 4 | H184: ELVERY 4 | J184: VINCENT 3 | M184: BRANSTON 3 | P184: GALE 2 | R184: ROBINSON | T184: BOSCHEN
A185: MORDIALLOC | C185: POWER 3 | F185: O'FARRELL 3 | I185: THOMPSON 2 | L185: JOHNSTONE | O185: PIERCE | Q185: LITTLE
A187: SUNSHINE | C187: 7 | D187: 7 | E187: =C187*6+D187 -> 49 | G187: 19 | H187: 12 | I187: =G187*6+H187 -> 126 | K187: 28 | L187: 14 | M187: =K187*6+L187 -> 182 | O187: 36 | P187: 20 | Q187: =O187*6+P187 -> 236 | S187: NORTHCOTE
A188: CAMBERWELL | C188: 1 | D188: 3 | E188: =C188*6+D188 -> 9 | G188: 2 | H188: 4 | I188: =G188*6+H188 -> 16 | K188: 4 | L188: 5 | M188: =K188*6+L188 -> 29 | O188: 8 | P188: 6 | Q188: =O188*6+P188 -> 54
A189: BEST PLAYERS
A190: SUNSHINE | C190: BEAN | F190: RUSSELL | I190: ALLEN | L190: IBRAHIM | O190: GOOLD | R190: DARUL
A191: CAMBERWELL | C191: CONYERS | F191: TAYLOR | I191: D BOYD | L191: ALLISON | O191: BRAYNE
A192: GOALKICKERS
A193: SUNSHINE | C193: ALLEN 11 | F193: FERGUSON 7 | I193: RUSSELL 6 | K193: BEAN 6 | M193: KELLETT 2 | O193: YOUNG 2 | Q193: IBRAHIM | S193: GOOLD
A194: CAMBERWELL | C194: BRAYNE 4 | F194: TAYLOR 2 | I194: WILSON | L194: WEINERT
A196: ROUND 5 | E196: 10TH MAY | J196: WEATHER | S196: PLAYED AT
D197: 1ST QTR | H197: 2ND QTR | L197: 3RD QTR | P197: FINAL | S197: MORDIALLOC
A198: CAULFIELD | C198: 4 | D198: 2 | E198: =C198*6+D198 -> 26 | G198: 6 | H198: 11 | I198: =G198*6+H198 -> 47 | K198: 7 | L198: 14 | M198: =K198*6+L198 -> 56 | O198: 11 | P198: 19 | Q198: =O198*6+P198 -> 85 | S198: UMPIRE | X198: LADDER | AB198: ROUND | AD198: 5
A199: MORDIALLOC | C199: 4 | D199: 4 | E199: =C199*6+D199 -> 28 | G199: 4 | H199: 7 | I199: =G199*6+H199 -> 31 | K199: 8 | L199: 12 | M199: =K199*6+L199 -> 60 | O199: 9 | P199: 14 | Q199: =O199*6+P199 -> 68
A200: BEST PLAYERS | W200: TEAM | X200: W | Y200: L | Z200: D | AA200: FOR | AB200: AGST | AC200: % | AD200: PTS
A201: CAULFIELD | C201: BAKER | F201: ROBINSON | I201: LOGAN | L201: CURTAIN | O201: YOUNG
A202: MORDIALLOC | C202: HYNES | F202: HALL | I202: BRUTON | L202: ? | O202: HOBSON | R202: SMITH | W202: SUNSHINE | X202: 5 | Y202: 0 | Z202: 0 | AA202: 753 | AB202: 282 | AC202: =(AA202*100)/AB202 -> 267.02127659574467 | AD202: =(X202*4)+(Z202*2) -> 20
A203: GOALKICKERS | W203: COBURG | X203: 5 | Y203: 0 | Z203: 0 | AA203: 712 | AB203: 352 | AC203: =(AA203*100)/AB203 -> 202.27272727272728 | AD203: =(X203*4)+(Z203*2) -> 20
A204: CAULFIELD | C204: BROWN 4 | F204: BAKER 2 | I204: McGINTY 2 | L204: LOGAN 2 | O204: ROBINSON | W204: WILLIAMSTOWN | X204: 3 | Y204: 2 | Z204: 0 | AA204: 497 | AB204: 407 | AC204: =(AA204*100)/AB204 -> 122.11302211302211 | AD204: =(X204*4)+(Z204*2) -> 12
A205: MORDIALLOC | C205: HYNES 3 | F205: SMITH 2 | I205: JOHNSTONE | L205: O'FARRELL | O205: PIERCE | R205: BRUTON | W205: WERRIBEE | X205: 3 | Y205: 2 | Z205: 0 | AA205: 535 | AB205: 449 | AC205: =(AA205*100)/AB205 -> 119.15367483296214 | AD205: =(X205*4)+(Z205*2) -> 12
A207: WERRIBEE | C207: 2 | D207: 3 | E207: =C207*6+D207 -> 15 | G207: 8 | H207: 8 | I207: =G207*6+H207 -> 56 | K207: 15 | L207: 14 | M207: =K207*6+L207 -> 104 | O207: 20 | P207: 16 | Q207: =O207*6+P207 -> 136 | S207: WERRIBEE | W207: CAULFIELD | X207: 3 | Y207: 2 | Z207: 0 | AA207: 463 | AB207: 411 | AC207: =(AA207*100)/AB207 -> 112.65206812652067 | AD207: =(X207*4)+(Z207*2) -> 12
A208: FRANKSTON | C208: 3 | D208: 3 | E208: =C208*6+D208 -> 21 | G208: 8 | H208: 4 | I208: =G208*6+H208 -> 52 | K208: 12 | L208: 6 | M208: =K208*6+L208 -> 78 | O208: 13 | P208: 7 | Q208: =O208*6+P208 -> 85 | W208: NORTHCOTE | X208: 3 | Y208: 2 | Z208: 0 | AA208: 380 | AB208: 443 | AC208: =(AA208*100)/AB208 -> 85.778781038374717 | AD208: =(X208*4)+(Z208*2) -> 12
A209: BEST PLAYERS | W209: FRANKSTON | X209: 2 | Y209: 3 | Z209: 0 | AA209: 490 | AB209: 478 | AC209: =(AA209*100)/AB209 -> 102.51046025104603 | AD209: =(X209*4)+(Z209*2) -> 8
A210: WERRIBEE | C210: LYONS | F210: CHIRGWIN | I210: TRAINION | L210: PANETTA | O210: OGILVIE | R210: ELLIS | W210: BOX HILL | X210: 1 | Y210: 4 | Z210: 0 | AA210: 346 | AB210: 619 | AC210: =(AA210*100)/AB210 -> 55.896607431340875 | AD210: =(X210*4)+(Z210*2) -> 4
A211: FRANKSTON | C211: LEWIS | F211: ROSENBROCK | I211: VAUGHAN | L211: HUGHES | O211: NICHOLSON | R211: BUNOVITCH | W211: MORDIALLOC | X211: 0 | Y211: 5 | Z211: 0 | AA211: 335 | AB211: 576 | AC211: =(AA211*100)/AB211 -> 58.159722222222221 | AD211: =(X211*4)+(Z211*2) -> 0
A212: GOALKICKERS | W212: CAMBERWELL | X212: 0 | Y212: 5 | Z212: 0 | AA212: 240 | AB212: 644 | AC212: =(AA212*100)/AB212 -> 37.267080745341616 | AD212: =(X212*4)+(Z212*2) -> 0
A213: WERRIBEE | C213: HEMLEY 5 | F213: CHIRGWIN 4 | I213: LYONS 3 | K213: TRAINION 3 | N213: PANETTA 2 | Q213: ANDERSON | S213: ELLIS | U213: OGILVIE
A214: FRANKSTON | C214: ROSENBROCK 5 | F214: NICHOLSON 2 | I214: GRAHAM 2 | L214: LEE | M214: ARTHUR | O214: McCOLL | Q214: JOHNSON
A216: COBURG | C216: 0 | D216: 3 | E216: =C216*6+D216 -> 3 | G216: 9 | H216: 9 | I216: =G216*6+H216 -> 63 | K216: 14 | L216: 14 | M216: =K216*6+L216 -> 98 | O216: 24 | P216: 22 | Q216: =O216*6+P216 -> 166 | S216: BOX HILL
A217: BOX HILL | C217: 4 | D217: 3 | E217: =C217*6+D217 -> 27 | G217: 5 | H217: 4 | I217: =G217*6+H217 -> 34 | K217: 8 | L217: 5 | M217: =K217*6+L217 -> 53 | O217: 10 | P217: 6 | Q217: =O217*6+P217 -> 66
A218: BEST PLAYERS
A219: COBURG | C219: ROWE | F219: SULLIVAN | I219: ERWIN | L219: SPORTON | O219: MORRISON | R219: KIRKMAN
A220: BOX HILL | C220: HARRIS | F220: McQUALTER | I220: G PERRY | L220: MERRICK | O220: SALMON | R220: HUNT
A221: GOALKICKERS
A222: COBURG | C222: SPORTON 7 | F222: MORRISON 5 | I222: GALE 2 | K222: ERWIN 2 | M222: VINCENT 2 | O222: BRANSTON 2 | R222: SULLIVAN | T222: HAWKING | W222: JONES | X222: BOSCHEN
A223: BOX HILL | C223: GREAVES 2 | F223: WALKER 2 | I223: HARRIS | K223: MERRICK | M223: PERRY | O223: BATES | Q223: BARNETT | T223: LANCASTER
E224: 11TH MAY | J224: WEATHER
A225: WILLIAMSTOWN | C225: 3 | D225: 4 | E225: =C225*6+D225 -> 22 | G225: 8 | H225: 6 | I225: =G225*6+H225 -> 54 | K225: 15 | L225: 9 | M225: =K225*6+L225 -> 99 | O225: 20 | P225: 14 | Q225: =O225*6+P225 -> 134 | S225: WILLIAMSTOWN
A226: CAMBERWELL | C226: 3 | D226: 4 | E226: =C226*6+D226 -> 22 | G226: 4 | H226: 6 | I226: =G226*6+H226 -> 30 | K226: 6 | L226: 10 | M226: =K226*6+L226 -> 46 | O226: 8 | P226: 15 | Q226: =O226*6+P226 -> 63
A227: BEST PLAYERS
A228: WILLIAMSTOWN | C228: VINEY | F228: HAYWARD | I228: PAPLEY | L228: JACKMAN | O228: MITCHELL | R228: PAGE
A229: CAMBERWELL | C229: TAYLOR | F229: WILSON | I229: BOYD | L229: CONYERS | O229: ALLISON | R229: DELANTY
A230: GOALKICKERS
A231: WILLIAMSTOWN | C231: JACKMAN 5 | F231: MITCHELL 4 | I231: HAYWARD 4 | L231: SMITH 2 | N231: LANE | P231: CAMILLIERI
A232: CAMBERWELL | C232: FLOYD 3 | F232: BRAYNE 2 | I232: DELANTY | L232: BOYD | N232: CONYERS
A234: SUNSHINE | C234: 3 | D234: 5 | E234: =C234*6+D234 -> 23 | G234: 6 | H234: 11 | I234: =G234*6+H234 -> 47 | K234: 10 | L234: 20 | M234: =K234*6+L234 -> 80 | O234: 14 | P234: 21 | Q234: =O234*6+P234 -> 105 | S234: SUNSHINE
A235: NORTHCOTE | C235: 1 | D235: 2 | E235: =C235*6+D235 -> 8 | G235: 3 | H235: 3 | I235: =G235*6+H235 -> 21 | K235: 4 | L235: 4 | M235: =K235*6+L235 -> 28 | O235: 8 | P235: 5 | Q235: =O235*6+P235 -> 53
A236: BEST PLAYERS
A237: SUNSHINE | C237: DARUL | F237: GOOLD | I237: BROWN | L237: McGARRITY | O237: IBRAHIM | R237: ALLEN
A238: NORTHCOTE | C238: McCARTHY | F238: HEAL | I238: McGORLICK | L238: VINEY | O238: STAFFORD | R238: MAYNE
A239: GOALKICKERS
A240: SUNSHINE | C240: ALLEN 5 | F240: GOOLD 2 | I240: LEGAWICZ 2 | L240: KELLETT 2 | N240: RUSSELL | Q240: YOUNG | S240: BEAN
A241: NORTHCOTE | C241: RORISON 3 | F241: DEAN 2 | I241: STAFFORD 2 | L241: KEANE
A243: ROUND 6 | E243: 17TH MAY | J243: WEATHER | S243: PLAYED AT
D244: 1ST QTR | H244: 2ND QTR | L244: 3RD QTR | P244: FINAL | S244: FRANKSTON
A245: SUNSHINE | C245: 5 | D245: 2 | E245: =C245*6+D245 -> 32 | G245: 11 | H245: 5 | I245: =G245*6+H245 -> 71 | K245: 15 | L245: 10 | M245: =K245*6+L245 -> 100 | O245: 17 | P245: 12 | Q245: =O245*6+P245 -> 114 | S245: UMPIRE | X245: LADDER | AB245: ROUND | AD245: 6
A246: FRANKSTON | C246: 4 | D246: 4 | E246: =C246*6+D246 -> 28 | G246: 9 | H246: 8 | I246: =G246*6+H246 -> 62 | K246: 11 | L246: 10 | M246: =K246*6+L246 -> 76 | O246: 13 | P246: 11 | Q246: =O246*6+P246 -> 89
A247: BEST PLAYERS | W247: TEAM | X247: W | Y247: L | Z247: D | AA247: FOR | AB247: AGST | AC247: % | AD247: PTS
A248: SUNSHINE | C248: KELLETT | F248: FERGUSON | I248: IBRAHIM | L248: DEAN | O248: GOOLD | Q248: McLEOD
A249: FRANKSTON | C249: SHEPPARD | F249: LOVELL | I249: COUTTS | L249: ROSENBROCK | O249: BLAKE | Q249: RENOUF | W249: SUNSHINE | X249: 6 | Y249: 0 | Z249: 0 | AA249: 867 | AB249: 371 | AC249: =(AA249*100)/AB249 -> 233.69272237196765 | AD249: =(X249*4)+(Z249*2) -> 24
A250: GOALKICKERS | W250: COBURG | X250: 6 | Y250: 0 | Z250: 0 | AA250: 830 | AB250: 411 | AC250: =(AA250*100)/AB250 -> 201.94647201946472 | AD250: =(X250*4)+(Z250*2) -> 24
A251: SUNSHINE | C251: KELLETT 5 | F251: ALLEN 3 | I251: RUSSELL 2 | L251: GOOLD 2 | N251: FERGUSON 2 | Q251: BENSON | S251: IBRAHIM | W251: WILLIAMSTOWN | X251: 4 | Y251: 2 | Z251: 0 | AA251: 587 | AB251: 477 | AC251: =(AA251*100)/AB251 -> 123.06079664570231 | AD251: =(X251*4)+(Z251*2) -> 16
A252: FRANKSTON | C252: SHEPPARD 4 | F252: COUTTS 2 | I252: ROSENBROCK 2 | L252: PRICE | N252: LOVELL | P252: McCOLL | R252: GRAHAM | W252: NORTHCOTE | X252: 4 | Y252: 2 | Z252: 0 | AA252: 446 | AB252: 497 | AC252: =(AA252*100)/AB252 -> 89.738430583501 | AD252: =(X252*4)+(Z252*2) -> 16
E253: 18TH MAY | J253: WEATHER | M253: LANDRY
A254: WILLIAMSTOWN | C254: 4 | D254: 1 | E254: =C254*6+D254 -> 25 | G254: 7 | H254: 3 | I254: =G254*6+H254 -> 45 | K254: 10 | L254: 10 | M254: =K254*6+L254 -> 70 | O254: 13 | P254: 12 | Q254: =O254*6+P254 -> 90 | S254: WILLIAMSTOWN | W254: WERRIBEE | X254: 3 | Y254: 3 | Z254: 0 | AA254: 605 | AB254: 539 | AC254: =(AA254*100)/AB254 -> 112.24489795918367 | AD254: =(X254*4)+(Z254*2) -> 12
A255: WERRIBEE | C255: 2 | D255: 4 | E255: =C255*6+D255 -> 16 | G255: 7 | H255: 7 | I255: =G255*6+H255 -> 49 | K255: 8 | L255: 10 | M255: =K255*6+L255 -> 58 | O255: 9 | P255: 16 | Q255: =O255*6+P255 -> 70 | W255: CAULFIELD | X255: 3 | Y255: 3 | Z255: 0 | AA255: 522 | AB255: 529 | AC255: =(AA255*100)/AB255 -> 98.67674858223063 | AD255: =(X255*4)+(Z255*2) -> 12
A256: BEST PLAYERS | W256: FRANKSTON | X256: 2 | Y256: 4 | Z256: 0 | AA256: 579 | AB256: 592 | AC256: =(AA256*100)/AB256 -> 97.804054054054049 | AD256: =(X256*4)+(Z256*2) -> 8
A257: WILLIAMSTOWN | C257: MITCHELL | F257: CAMILLIERI | I257: HAYWARD | L257: PAPLEY | O257: RUSSELL | R257: LANE | W257: MORDIALLOC | X257: 1 | Y257: 5 | Z257: 0 | AA257: 440 | AB257: 664 | AC257: =(AA257*100)/AB257 -> 66.265060240963862 | AD257: =(X257*4)+(Z257*2) -> 4
A258: WERRIBEE | C258: CROMPTON | F258: COMBEN | I258: CHIRGWIN | L258: SHANAHAN | O258: MONTGOMERY | R258: OGILVIE | W258: BOX HILL | X258: 1 | Y258: 5 | Z258: 0 | AA258: 400 | AB258: 685 | AC258: =(AA258*100)/AB258 -> 58.394160583941606 | AD258: =(X258*4)+(Z258*2) -> 4
A259: GOALKICKERS | W259: CAMBERWELL | X259: 0 | Y259: 6 | Z259: 0 | AA259: 328 | AB259: 749 | AC259: =(AA259*100)/AB259 -> 43.791722296395193 | AD259: =(X259*4)+(Z259*2) -> 0
A260: WILLIAMSTOWN | C260: ? 3 | F260: CAMILLIERI 2 | I260: ULBER 2 | K260: JACKMAN 2 | N260: SMITH 2 | P260: MITCHELL | R260: VINEY
A261: WERRIBEE | C261: HEMLEY 3 | F261: CROMPTON 3 | I261: LYONS | K261: PANETTA | M261: CHIRGWIN
A263: MORDIALLOC | C263: 4 | D263: 7 | E263: =C263*6+D263 -> 31 | G263: 9 | H263: 11 | I263: =G263*6+H263 -> 65 | K263: 11 | L263: 18 | M263: =K263*6+L263 -> 84 | O263: 14 | P263: 21 | Q263: =O263*6+P263 -> 105 | S263: CAMBERWELL
A264: CAMBERWELL | C264: 3 | D264: 1 | E264: =C264*6+D264 -> 19 | G264: 6 | H264: 5 | I264: =G264*6+H264 -> 41 | K264: 9 | L264: 7 | M264: =K264*6+L264 -> 61 | O264: 13 | P264: 10 | Q264: =O264*6+P264 -> 88
A265: BEST PLAYERS
A266: MORDIALLOC | C266: SMITH | F266: LESLIE | I266: JOHNSTONE | L266: BRUTON | O266: MATTHEWS | R266: BENTLEY
A267: CAMBERWELL | C267: TAYLOR | F267: CONYERS | I267: D BOYD | L267: L BOYD | O267: ALLSOP | R267: STAFFORD
A268: GOALKICKERS
A269: MORDIALLOC | C269: JOHNSTONE 4 | F269: MATTHEWS 2 | I269: DEAN 2 | K269: O'FARRELL 2 | N269: DUO | P269: HYNES | R269: SMITH | U269: BRUTON
A270: CAMBERWELL | C270: BRAYNE 3 | F270: L BOYD 3 | I270: FRIEBERG 2 | L270: WEINERT 2 | O270: TAYLOR | Q270: D BOYD | S270: ALLISON
A272: COBURG | C272: 4 | D272: 3 | E272: =C272*6+D272 -> 27 | G272: 10 | H272: 5 | I272: =G272*6+H272 -> 65 | K272: 15 | L272: 12 | M272: =K272*6+L272 -> 102 | O272: 17 | P272: 16 | Q272: =O272*6+P272 -> 118 | S272: COBURG
A273: CAULFIELD | C273: 1 | D273: 3 | E273: =C273*6+D273 -> 9 | G273: 2 | H273: 4 | I273: =G273*6+H273 -> 16 | K273: 2 | L273: 6 | M273: =K273*6+L273 -> 18 | O273: 8 | P273: 11 | Q273: =O273*6+P273 -> 59
A274: BEST PLAYERS
A275: COBURG | C275: SULLIVAN | F275: ERWIN | I275: KIRKMAN | L275: GALE | O275: ROWE
A276: CAULFIELD | C276: LOGAN | F276: GOWANS | I276: ROBINSON | L276: FARRELLY | O276: TEMPEST
A277: GOALKICKERS
A278: COBURG | C278: BRANSTON 3 | F278: BOSCHEN 3 | I278: ERWIN 3 | K278: GALE 2 | M278: FE ? 2 | O278: SPORTON 2 | R278: ELVERY | T278: MORRISON
A279: CAULFIELD | C279: SANDERS 2 | F279: BROWN 2 | I279: ROBINSON | K279: TEMPEST | M279: COLLINS | O279: McGINTY
A281: NORTHCOTE | C281: 3 | D281: 1 | E281: =C281*6+D281 -> 19 | G281: 5 | H281: 7 | I281: =G281*6+H281 -> 37 | K281: 7 | L281: 11 | M281: =K281*6+L281 -> 53 | O281: 9 | P281: 12 | Q281: =O281*6+P281 -> 66 | S281: NORTHCOTE
A282: BOX HILL | C282: 2 | D282: 5 | E282: =C282*6+D282 -> 17 | G282: 4 | H282: 7 | I282: =G282*6+H282 -> 31 | K282: 5 | L282: 7 | M282: =K282*6+L282 -> 37 | O282: 7 | P282: 12 | Q282: =O282*6+P282 -> 54
A283: BEST PLAYERS
A284: NORTHCOTE | C284: HENRY
A285: BOX HILL
A286: GOALKICKERS
A287: NORTHCOTE | C287: RORISON 3 | F287: VINEY 2 | I287: STAFFORD 2 | L287: UNDERWOOD | O287: KEANE
A288: BOX HILL | C288: PERRY 2 | E288: BATES 2 | G288: WALKER 2 | J288: HUNT
A290: ROUND 7 | E290: 24TH MAY | J290: WEATHER | S290: PLAYED AT
D291: 1ST QTR | H291: 2ND QTR | L291: 3RD QTR | P291: FINAL | S291: PRINCES PARK, CAULFIELD
A292: CAULFIELD | C292: 2 | D292: 0 | E292: =C292*6+D292 -> 12 | G292: 9 | H292: 9 | I292: =G292*6+H292 -> 63 | K292: 12 | L292: 9 | M292: =K292*6+L292 -> 81 | O292: 19 | P292: 16 | Q292: =O292*6+P292 -> 130 | S292: UMPIRE | X292: LADDER | AB292: ROUND | AD292: 7
A293: FRANKSTON | C293: 4 | D293: 2 | E293: =C293*6+D293 -> 26 | G293: 6 | H293: 5 | I293: =G293*6+H293 -> 41 | K293: 10 | L293: 9 | M293: =K293*6+L293 -> 69 | O293: 11 | P293: 12 | Q293: =O293*6+P293 -> 78
A294: BEST PLAYERS | W294: TEAM | X294: W | Y294: L | Z294: D | AA294: FOR | AB294: AGST | AC294: % | AD294: PTS
A295: CAULFIELD | C295: LOGAN | F295: M ROBINSON | I295: CLARK | L295: CURTAIN | N295: GOWANS | Q295: ARRELL
A296: FRANKSTON | C296: BOWES | F296: COUTTS | I296: THATCHER | L296: LANDRY | N296: LAWRIE | Q296: WESTON | W296: COBURG | X296: 7 | Y296: 0 | Z296: 0 | AA296: 1030 | AB296: 468 | AC296: =(AA296*100)/AB296 -> 220.08547008547009 | AD296: =(X296*4)+(Z296*2) -> 28
A297: GOALKICKERS | W297: SUNSHINE | X297: 7 | Y297: 0 | Z297: 0 | AA297: 1005 | AB297: 463 | AC297: =(AA297*100)/AB297 -> 217.06263498920086 | AD297: =(X297*4)+(Z297*2) -> 28
A298: CAULFIELD | C298: McGINTY 7 | F298: COLLINS 4 | I298: CURTAIN 3 | L298: P ROBINSON 2 | O298: SANDERS | R298: BAKER | W298: WILLIAMSTOWN | X298: 5 | Y298: 2 | Z298: 0 | AA298: 672 | AB298: 539 | AC298: =(AA298*100)/AB298 -> 124.67532467532467 | AD298: =(X298*4)+(Z298*2) -> 20
A299: FRANKSTON | C299: LANDRY 4 | F299: PRICE 2 | I299: GRAHAM 2 | L299: COUTTS | N299: LAWRIE | P299: WESTON | W299: WERRIBEE | X299: 4 | Y299: 3 | Z299: 0 | AA299: 713 | AB299: 589 | AC299: =(AA299*100)/AB299 -> 121.05263157894737 | AD299: =(X299*4)+(Z299*2) -> 16
A301: WERRIBEE | C301: 3 | D301: 2 | E301: =C301*6+D301 -> 20 | G301: 7 | H301: 9 | I301: =G301*6+H301 -> 51 | K301: 12 | L301: 11 | M301: =K301*6+L301 -> 83 | O301: 15 | P301: 18 | Q301: =O301*6+P301 -> 108 | S301: WERRIBEE | W301: CAULFIELD | X301: 4 | Y301: 3 | Z301: 0 | AA301: 652 | AB301: 607 | AC301: =(AA301*100)/AB301 -> 107.41350906095552 | AD301: =(X301*4)+(Z301*2) -> 16
A302: NORTHCOTE | C302: 2 | D302: 3 | E302: =C302*6+D302 -> 15 | G302: 3 | H302: 3 | I302: =G302*6+H302 -> 21 | K302: 6 | L302: 6 | M302: =K302*6+L302 -> 42 | O302: 7 | P302: 8 | Q302: =O302*6+P302 -> 50 | W302: NORTHCOTE | X302: 4 | Y302: 3 | Z302: 0 | AA302: 496 | AB302: 605 | AC302: =(AA302*100)/AB302 -> 81.983471074380162 | AD302: =(X302*4)+(Z302*2) -> 16
A303: BEST PLAYERS | W303: FRANKSTON | X303: 2 | Y303: 5 | Z303: 0 | AA303: 657 | AB303: 722 | AC303: =(AA303*100)/AB303 -> 90.99722991689751 | AD303: =(X303*4)+(Z303*2) -> 8
A304: WERRIBEE | C304: HEMLEY | F304: TYQUIN | I304: LYONS | L304: SHEAHAN | N304: SHANAHAN | Q304: PANETTI | W304: MORDIALLOC | X304: 1 | Y304: 6 | Z304: 0 | AA304: 502 | AB304: 749 | AC304: =(AA304*100)/AB304 -> 67.02269692923899 | AD304: =(X304*4)+(Z304*2) -> 4
A305: NORTHCOTE | C305: KOZARIS | F305: HENRY | I305: QUAIFE | L305: UNDERWOOD | O305: SMITH | Q305: VINEY | W305: BOX HILL | X305: 1 | Y305: 6 | Z305: 0 | AA305: 492 | AB305: 823 | AC305: =(AA305*100)/AB305 -> 59.781287970838399 | AD305: =(X305*4)+(Z305*2) -> 4
A306: GOALKICKERS | W306: CAMBERWELL | X306: 0 | Y306: 7 | Z306: 0 | AA306: 385 | AB306: 949 | AC306: =(AA306*100)/AB306 -> 40.569020021074813 | AD306: =(X306*4)+(Z306*2) -> 0
A307: WERRIBEE | C307: HEMLEY 5 | F307: TYQUIN 3 | I307: OGILVIE 2 | K307: CHIRGWIN 2 | N307: LYONS | P307: SHANAHAN | S307: SHEAHAN
A308: NORTHCOTE | C308: NEAL 2 | E308: QUAIFE | G308: LAWRENCE | J308: KOZARIS | M308: STAFFORD | P308: DEAN
E309: 25TH MAY | J309: WEATHER
A310: WILLIAMSTOWN | C310: 3 | D310: 3 | E310: =C310*6+D310 -> 21 | G310: 7 | H310: 6 | I310: =G310*6+H310 -> 48 | K310: 9 | L310: 10 | M310: =K310*6+L310 -> 64 | O310: 12 | P310: 13 | Q310: =O310*6+P310 -> 85 | S310: MORDIALLOC
A311: MORDIALLOC | C311: 2 | D311: 3 | E311: =C311*6+D311 -> 15 | G311: 4 | H311: 5 | I311: =G311*6+H311 -> 29 | K311: 6 | L311: 7 | M311: =K311*6+L311 -> 43 | O311: 9 | P311: 8 | Q311: =O311*6+P311 -> 62
A312: BEST PLAYERS
A313: WILLIAMSTOWN | C313: HAYWARD | F313: BARNES | I313: WHITTINGTON | L313: JOHNSON | N313: LANE
A314: MORDIALLOC | C314: DURO | F314: BRUTON | I314: JOHNSTONE | L314: MERVICH | N314: HARRY
A315: GOALKICKERS
A316: WILLIAMSTOWN | C316: JACKMAN 2 | F316: LANE 2 | H316: VINEY 2 | J316: PAGE 2 | L316: BARNES | N316: PAPLEY | P316: CAMILLIERI | S316: HAYWARD
A317: MORDIALLOC | C317: O'FARRELL 3 | F317: JOHNSTONE 3 | I317: LITTLE 2 | K317: MATTHEWS
A319: COBURG | C319: 7 | D319: 10 | E319: =C319*6+D319 -> 52 | G319: 11 | H319: 15 | I319: =G319*6+H319 -> 81 | K319: 21 | L319: 23 | M319: =K319*6+L319 -> 149 | O319: 29 | P319: 26 | Q319: =O319*6+P319 -> 200 | S319: CAMBERWELL
A320: CAMBERWELL | C320: 1 | D320: 2 | E320: =C320*6+D320 -> 8 | G320: 4 | H320: 7 | I320: =G320*6+H320 -> 31 | K320: 6 | L320: 7 | M320: =K320*6+L320 -> 43 | O320: 8 | P320: 9 | Q320: =O320*6+P320 -> 57
A321: BEST PLAYERS
A322: COBURG | C322: McLACHLAN | F322: SPORTON | I322: ERWIN | L322: BRANSTON | O322: SULLIVAN | R322: OSBORNE
A323: CAMBERWELL | C323: L BOYD | F323: FRASER | I323: TAYLOR | L323: ALLISON | O323: MAWSON | R323: McNAMARA
A324: GOALKICKERS
A325: COBURG | C325: SPORTON 8 | F325: BRANSTON 5 | I325: ELVERY 4 | K325: BOSCHEN 3 | M325: ERWIN 3 | O325: GALE 2 | Q325: MORRISON 2 | S325: BUSBRIDGE | V325: SULLIVAN
A326: CAMBERWELL | C326: L BOYD 3 | F326: FRIEBERG | I326: D BOYD | K326: TAYLOR | M326: McNAMARA | P326: DELANTY
A328: SUNSHINE | C328: 5 | D328: 9 | E328: =C328*6+D328 -> 39 | G328: 11 | H328: 13 | I328: =G328*6+H328 -> 79 | K328: 14 | L328: 18 | M328: =K328*6+L328 -> 102 | O328: 19 | P328: 24 | Q328: =O328*6+P328 -> 138 | S328: BOX HILL
A329: BOX HILL | C329: 5 | D329: 4 | E329: =C329*6+D329 -> 34 | G329: 9 | H329: 4 | I329: =G329*6+H329 -> 58 | K329: 13 | L329: 6 | M329: =K329*6+L329 -> 84 | O329: 14 | P329: 8 | Q329: =O329*6+P329 -> 92
A330: BEST PLAYERS
A331: SUNSHINE | C331: GOOLD | F331: RUSSELL | I331: BROWN | L331: IBRAHIM | O331: DEAN | Q331: HIPWORTH
A332: BOX HILL | C332: SMITH | F332: ATKINSON | I332: WALKER | L332: BIERL | O332: PERRY | Q332: McQUALTER
A333: GOALKICKERS | C333: 1 SHORT
A334: SUNSHINE | C334: KELLETT 5 | E334: ALLEN 3 | G334: RUSSELL 3 | I334: BENSON 3 | K334: GOOLD 2 | M334: CLARKE | O334: YOUNG
A335: BOX HILL | C335: WALKER 5 | F335: ATKINSON 2 | I335: SMITH 2 | K335: BATES | M335: BIERL | O335: PERRY | Q335: BARNETT | S335: McCURRY
A337: ROUND 8 | E337: 31ST MAY | J337: WEATHER | S337: PLAYED AT
D338: 1ST QTR | H338: 2ND QTR | L338: 3RD QTR | P338: FINAL | S338: FRANKSTON
A339: WILLIAMSTOWN | C339: 4 | D339: 4 | E339: =C339*6+D339 -> 28 | G339: 6 | H339: 6 | I339: =G339*6+H339 -> 42 | K339: 8 | L339: 9 | M339: =K339*6+L339 -> 57 | O339: 10 | P339: 10 | Q339: =O339*6+P339 -> 70 | S339: UMPIRE | X339: LADDER | AB339: ROUND | AD339: 8
A340: FRANKSTON | C340: 2 | D340: 3 | E340: =C340*6+D340 -> 15 | G340: 3 | H340: 6 | I340: =G340*6+H340 -> 24 | K340: 4 | L340: 7 | M340: =K340*6+L340 -> 31 | O340: 8 | P340: 12 | Q340: =O340*6+P340 -> 60
A341: BEST PLAYERS | W341: TEAM | X341: W | Y341: L | Z341: D | AA341: FOR | AB341: AGST | AC341: % | AD341: PTS
A342: WILLIAMSTOWN | C342: LANE | F342: RUSSELL | I342: JOHNSON | L342: PAGE | O342: MITCHELL | R342: HAYWARD
A343: FRANKSTON | C343: NICHOLSON | F343: LOVELL | I343: WATSON | L343: ALDERSON | O343: VAUGHAN | R343: BOWES | W343: SUNSHINE | X343: 8 | Y343: 0 | Z343: 0 | AA343: 1142 | AB343: 507 | AC343: =(AA343*100)/AB343 -> 225.24654832347139 | AD343: =(X343*4)+(Z343*2) -> 32
A344: GOALKICKERS | W344: COBURG | X344: 8 | Y344: 0 | Z344: 0 | AA344: 1156 | AB344: 523 | AC344: =(AA344*100)/AB344 -> 221.03250478011472 | AD344: =(X344*4)+(Z344*2) -> 32
A345: WILLIAMSTOWN | C345: PAGE 3 | E345: LANE 2 | G345: RAFFLE | I345: SMITH | K345: PAPLEY | M345: CAMILLIERI | P345: HAYWARD | W345: WILLIAMSTOWN | X345: 6 | Y345: 2 | Z345: 0 | AA345: 742 | AB345: 599 | AC345: =(AA345*100)/AB345 -> 123.87312186978298 | AD345: =(X345*4)+(Z345*2) -> 24
A346: FRANKSTON | C346: ROSENBROCK 3 | F346: NICHOLSON 2 | I346: PRICE | K346: THATCHER | M346: LANDRY | W346: NORTHCOTE | X346: 5 | Y346: 3 | Z346: 0 | AA346: 565 | AB346: 655 | AC346: =(AA346*100)/AB346 -> 86.25954198473282 | AD346: =(X346*4)+(Z346*2) -> 20
A348: BOX HILL | C348: 4 | D348: 0 | E348: =C348*6+D348 -> 24 | G348: 11 | H348: 5 | I348: =G348*6+H348 -> 71 | K348: 12 | L348: 5 | M348: =K348*6+L348 -> 77 | O348: 14 | P348: 8 | Q348: =O348*6+P348 -> 92 | S348: BOX HILL | W348: WERRIBEE | X348: 4 | Y348: 4 | Z348: 0 | AA348: 768 | AB348: 715 | AC348: =(AA348*100)/AB348 -> 107.41258741258741 | AD348: =(X348*4)+(Z348*2) -> 16
A349: MORDIALLOC | C349: 1 | D349: 2 | E349: =C349*6+D349 -> 8 | G349: 1 | H349: 2 | I349: =G349*6+H349 -> 8 | K349: 7 | L349: 5 | M349: =K349*6+L349 -> 47 | O349: 8 | P349: 4 | Q349: =O349*6+P349 -> 52 | W349: CAULFIELD | X349: 4 | Y349: 4 | Z349: 0 | AA349: 696 | AB349: 744 | AC349: =(AA349*100)/AB349 -> 93.548387096774192 | AD349: =(X349*4)+(Z349*2) -> 16
A350: BEST PLAYERS | W350: FRANKSTON | X350: 2 | Y350: 6 | Z350: 0 | AA350: 717 | AB350: 792 | AC350: =(AA350*100)/AB350 -> 90.530303030303031 | AD350: =(X350*4)+(Z350*2) -> 8
A351: BOX HILL | C351: SMITH | F351: ATKINSON | I351: DAWSON | L351: LANCASTER | O351: HUNT | R351: THOMPSON | W351: BOX HILL | X351: 2 | Y351: 6 | Z351: 0 | AA351: 584 | AB351: 875 | AC351: =(AA351*100)/AB351 -> 66.742857142857147 | AD351: =(X351*4)+(Z351*2) -> 8
A352: MORDIALLOC | C352: HARRY | F352: O'FARRELL | I352: BENTLEY | L352: LANG | O352: BRUTON | R352: DURO | W352: MORDIALLOC | X352: 1 | Y352: 7 | Z352: 0 | AA352: 554 | AB352: 841 | AC352: =(AA352*100)/AB352 -> 65.873959571938173 | AD352: =(X352*4)+(Z352*2) -> 4
A353: GOALKICKERS | W353: CAMBERWELL | X353: 0 | Y353: 8 | Z353: 0 | AA353: 435 | AB353: 1018 | AC353: =(AA353*100)/AB353 -> 42.73084479371316 | AD353: =(X353*4)+(Z353*2) -> 0
A354: BOX HILL | C354: WALKER 4 | F354: PERRY 3 | H354: THOMPSON 3 | K354: HUNT | M354: SMITH | O354: BATES | Q354: ATKINSON
A355: MORDIALLOC | C355: HARRY 2 | F355: LESLIE 2 | H355: CULPH | J355: THOMPSON | M355: O'FARRELL | P355: JOHNSTONE
E356: 1ST JUNE | J356: WEATHER
A357: NORTHCOTE | C357: 1 | D357: 5 | E357: =C357*6+D357 -> 11 | G357: 4 | H357: 12 | I357: =G357*6+H357 -> 36 | K357: 5 | L357: 12 | M357: =K357*6+L357 -> 42 | O357: 9 | P357: 15 | Q357: =O357*6+P357 -> 69 | S357: NORTHCOTE
A358: CAMBERWELL | C358: 1 | D358: 4 | E358: =C358*6+D358 -> 10 | G358: 2 | H358: 4 | I358: =G358*6+H358 -> 16 | K358: 6 | L358: 8 | M358: =K358*6+L358 -> 44 | O358: 7 | P358: 8 | Q358: =O358*6+P358 -> 50
A359: BEST PLAYERS
A360: NORTHCOTE | C360: McGORLICK | F360: RORISON | I360: ELLIS | L360: QUAIFE | O360: SMITH | R360: LONG
A361: CAMBERWELL | C361: L BOYD | F361: CONYERS | I361: MAWSON | L361: TAYLOR | O361: BRAYNE | R361: ALLISON
A362: GOALKICKERS
A363: NORTHCOTE | C363: RORISON 3 | F363: QUAIFE 3 | I363: MAYNE | K363: SMITH | M363: KEANE
A364: CAMBERWELL | C364: NRAYNE 4 | F364: TAYLOR | I364: LAIDLAW | L364: CONYERS
A366: COBURG | C366: 8 | D366: 7 | E366: =C366*6+D366 -> 55 | G366: 8 | H366: 7 | I366: =G366*6+H366 -> 55 | K366: 13 | L366: 10 | M366: =K366*6+L366 -> 88 | O366: 19 | P366: 12 | Q366: =O366*6+P366 -> 126 | S366: WERRIBEE
A367: WERRIBEE | C367: 6 | D367: 3 | E367: =C367*6+D367 -> 39 | G367: 6 | H367: 7 | I367: =G367*6+H367 -> 43 | K367: 7 | L367: 10 | M367: =K367*6+L367 -> 52 | O367: 7 | P367: 13 | Q367: =O367*6+P367 -> 55
A368: BEST PLAYERS
A369: COBURG | C369: SULLIVAN | F369: VINCENT | I369: GALE | L369: BUSBRIDGE | O369: KIRKMAN
A370: WERRIBEE | C370: SERTORI | F370: SHANAHAN | I370: COMBEN | L370: PANETTO | O370: MANDULAKIS | R370: ANDERSON
A371: GOALKICKERS
A372: COBURG | C372: VINCENT 4 | F372: SPORTON 3 | I372: GALE 2 | K372: BUSBRIDGE 2 | N372: PALMER 2 | P372: ERWIN 2 | R372: MORRISON 2 | U372: SULLIVAN | W372: ELVERY
A373: WERRIBEE | C373: PANETTO 3 | F373: LYONS 2 | I373: ELLIS | K373: HEMLEY
A375: SUNSHINE | C375: 6 | D375: 3 | E375: =C375*6+D375 -> 39 | G375: 11 | H375: 4 | I375: =G375*6+H375 -> 70 | K375: 14 | L375: 6 | M375: =K375*6+L375 -> 90 | O375: 21 | P375: 11 | Q375: =O375*6+P375 -> 137 | S375: SUNSHINE
A376: CAULFIELD | C376: 0 | D376: 1 | E376: =C376*6+D376 -> 1 | G376: 3 | H376: 5 | I376: =G376*6+H376 -> 23 | K376: 6 | L376: 7 | M376: =K376*6+L376 -> 43 | O376: 6 | P376: 8 | Q376: =O376*6+P376 -> 44
A377: BEST PLAYERS
A378: SUNSHINE | C378: GOOLD | F378: HIPWORTH | I378: McLEOD | L378: McGARRITY | O378: DARUL | R378: FERGUSON
A379: CAULFIELD | C379: GOWANS | F379: ROBINSON | I379: SMITH | L379: LOGAN | O379: COLLINS
A380: GOALKICKERS
A381: SUNSHINE | C381: ALLEN 6 | F381: GOOLD 5 | H381: FERGUSON 3 | K381: CLARKE 2 | M381: DEAN | O381: BEAN | Q381: HIPWORTH | S381: RUSSELL | U381: BENSON
A382: CAULFIELD | C382: WILLIAMS 2 | F382: McGINTY 2 | I382: GOWANS | L382: RENOWDEN
A384: ROUND 9 | E384: 7TH JUNE | J384: WEATHER | S384: PLAYED AT
D385: 1ST QTR | H385: 2ND QTR | L385: 3RD QTR | P385: FINAL | S385: MORDIALLOC
A386: WERRIBEE | C386: 5 | D386: 4 | E386: =C386*6+D386 -> 34 | G386: 9 | H386: 8 | I386: =G386*6+H386 -> 62 | K386: 11 | L386: 13 | M386: =K386*6+L386 -> 79 | O386: 15 | P386: 17 | Q386: =O386*6+P386 -> 107 | S386: UMPIRE | X386: LADDER | AB386: ROUND | AD386: 9
A387: MORDIALLOC | C387: 5 | D387: 1 | E387: =C387*6+D387 -> 31 | G387: 7 | H387: 4 | I387: =G387*6+H387 -> 46 | K387: 10 | L387: 8 | M387: =K387*6+L387 -> 68 | O387: 11 | P387: 13 | Q387: =O387*6+P387 -> 79
A388: BEST PLAYERS | W388: TEAM | X388: W | Y388: L | Z388: D | AA388: FOR | AB388: AGST | AC388: % | AD388: PTS
A389: WERRIBEE | C389: CHIRGWIN | F389: COMBEN | I389: TYQUIN | L389: BUTTON | O389: W ? | R389: OGILVIE
A390: MORDIALLOC | C390: SMITH | F390: CULPH | I390: LESLIE | L390: JOHNSTONE | O390: McPHERSON | R390: HYNES | W390: SUNSHINE | X390: 9 | Y390: 0 | Z390: 0 | AA390: 1279 | AB390: 611 | AC390: =(AA390*100)/AB390 -> 209.32896890343699 | AD390: =(X390*4)+(Z390*2) -> 36
A391: GOALKICKERS | W391: COBURG | X391: 8 | Y391: 1 | Z391: 0 | AA391: 1260 | AB391: 660 | AC391: =(AA391*100)/AB391 -> 190.90909090909091 | AD391: =(X391*4)+(Z391*2) -> 32
A392: WERRIBEE | C392: CHIRGWIN 5 | F392: HEMLEY 3 | H392: ELLIS 2 | J392: LYONS 2 | L392: TYQUIN | N392: COMBEN | P392: SHANAHAN | W392: WILLIAMSTOWN | X392: 7 | Y392: 2 | Z392: 0 | AA392: 803 | AB392: 633 | AC392: =(AA392*100)/AB392 -> 126.8562401263823 | AD392: =(X392*4)+(Z392*2) -> 28
A393: MORDIALLOC | C393: JOHNSTONE 2 | F393: HARRY 2 | H393: SMITH 2 | J393: HYNES | L393: DURO | N393: O'FARRELL | P393: THOMPSON | S393: LITTLE | W393: WERRIBEE | X393: 5 | Y393: 4 | Z393: 0 | AA393: 875 | AB393: 794 | AC393: =(AA393*100)/AB393 -> 110.2015113350126 | AD393: =(X393*4)+(Z393*2) -> 20
E394: 8TH JUNE | J394: WEATHER
A395: WILLIAMSTOWN | C395: 4 | D395: 6 | E395: =C395*6+D395 -> 30 | G395: 5 | H395: 8 | I395: =G395*6+H395 -> 38 | K395: 5 | L395: 13 | M395: =K395*6+L395 -> 43 | O395: 8 | P395: 13 | Q395: =O395*6+P395 -> 61 | S395: WILLIAMSTOWN | W395: NORTHCOTE | X395: 5 | Y395: 4 | Z395: 0 | AA395: 589 | AB395: 716 | AC395: =(AA395*100)/AB395 -> 82.262569832402235 | AD395: =(X395*4)+(Z395*2) -> 20
A396: NORTHCOTE | C396: 1 | D396: 2 | E396: =C396*6+D396 -> 8 | G396: 3 | H396: 4 | I396: =G396*6+H396 -> 22 | K396: 3 | L396: 5 | M396: =K396*6+L396 -> 23 | O396: 4 | P396: 10 | Q396: =O396*6+P396 -> 34 | W396: CAULFIELD | X396: 4 | Y396: 5 | Z396: 0 | AA396: 779 | AB396: 841 | AC396: =(AA396*100)/AB396 -> 92.62782401902497 | AD396: =(X396*4)+(Z396*2) -> 16
A397: BEST PLAYERS | W397: FRANKSTON | X397: 3 | Y397: 6 | Z397: 0 | AA397: 835 | AB397: 860 | AC397: =(AA397*100)/AB397 -> 97.093023255813947 | AD397: =(X397*4)+(Z397*2) -> 12
A398: WILLIAMSTOWN | C398: BARNES | F398: HAYWARD | I398: RUSSELL | L398: SMITH | N398: JOHNSON | Q398: O'MARA | W398: BOX HILL | X398: 3 | Y398: 6 | Z398: 0 | AA398: 681 | AB398: 958 | AC398: =(AA398*100)/AB398 -> 71.085594989561585 | AD398: =(X398*4)+(Z398*2) -> 12
A399: NORTHCOTE | C399: ELLIS | F399: McGORLICK | I399: KOZARIS | L399: UNDERWOOD | O399: WHITE | Q399: KEANE | W399: MORDIALLOC | X399: 1 | Y399: 8 | Z399: 0 | AA399: 633 | AB399: 948 | AC399: =(AA399*100)/AB399 -> 66.77215189873418 | AD399: =(X399*4)+(Z399*2) -> 4
A400: GOALKICKERS | W400: CAMBERWELL | X400: 0 | Y400: 9 | Z400: 0 | AA400: 503 | AB400: 1136 | AC400: =(AA400*100)/AB400 -> 44.278169014084504 | AD400: =(X400*4)+(Z400*2) -> 0
A401: WILLIAMSTOWN | C401: BARNES 2 | F401: CAMILLIERI | I401: SMITH | K401: PATTERSON | N401: VINEY | P401: PERCY | R401: JOHNSON
A402: NORTHCOTE | C402: STAFFORD | F402: UNDERWOOD | I402: KEANE | K402: ROSS
E403: 14TH JUNE | J403: WEATHER
A404: BOX HILL | C404: 3 | D404: 3 | E404: =C404*6+D404 -> 21 | G404: 6 | H404: 6 | I404: =G404*6+H404 -> 42 | K404: 8 | L404: 11 | M404: =K404*6+L404 -> 59 | O404: 13 | P404: 19 | Q404: =O404*6+P404 -> 97 | S404: PRINCES PARK, CAULFIELD
A405: CAULFIELD | C405: 5 | D405: 3 | E405: =C405*6+D405 -> 33 | G405: 7 | H405: 8 | I405: =G405*6+H405 -> 50 | K405: 10 | L405: 15 | M405: =K405*6+L405 -> 75 | O405: 11 | P405: 17 | Q405: =O405*6+P405 -> 83
A406: BEST PLAYERS
A407: BOX HILL | C407: SMITH | F407: DAWSON | I407: McQUALTER | L407: BATES | N407: WALKER | Q407: BIERL
A408: CAULFIELD | C408: LOGAN | F408: BAKER | I408: TEMPEST | L408: FARRELLY | N408: SCHMIDT | Q408: COLLINS
A409: GOALKICKERS
A410: BOX HILL | C410: WALKER 7 | F410: BIERL 3 | I410: CRISP 2 | K410: DAWSON
A411: CAULFIELD | C411: CURTAIN 3 | F411: COLLINS 2 | I411: McGINTY 2 | L411: ROBINSON | N411: P BAKER | Q411: TEMPEST | S411: RENOWDEN
E412: 15TH JUNE | J412: WEATHER
A413: FRANKSTON | C413: 7 | D413: 4 | E413: =C413*6+D413 -> 46 | G413: 11 | H413: 5 | I413: =G413*6+H413 -> 71 | K413: 15 | L413: 9 | M413: =K413*6+L413 -> 99 | O413: 18 | P413: 10 | Q413: =O413*6+P413 -> 118 | S413: CAMBERWELL
A414: CAMBERWELL | C414: 3 | D414: 2 | E414: =C414*6+D414 -> 20 | G414: 6 | H414: 5 | I414: =G414*6+H414 -> 41 | K414: 6 | L414: 6 | M414: =K414*6+L414 -> 42 | O414: 9 | P414: 14 | Q414: =O414*6+P414 -> 68
A415: BEST PLAYERS
A416: FRANKSTON | C416: ROSENBROCK | F416: SHEPPARD | I416: VAUGHAN | L416: ALDERSON | N416: BLAKE | Q416: NICHOLSON
A417: CAMBERWELL | C417: TAYLOR | F417: ALLISON | I417: BRAYNE | L417: WILSON | N417: DELANTY | Q417: PANETTA
A418: GOALKICKERS
A419: FRANKSTON | C419: ROSENBROCK 7 | F419: NICHOLSON 4 | I419: PRICE 2 | K419: WESTON 2 | N419: COUTTS | P419: LEE | Q419: WATSON
A420: CAMBERWELL | C420: BRAYNE 3 | F420: TAYLOR 2 | I420: DELANTY | K420: PECK | M420: McNAMARA | P420: CONYERS
A422: SUNSHINE | C422: 6 | D422: 3 | E422: =C422*6+D422 -> 39 | G422: 12 | H422: 7 | I422: =G422*6+H422 -> 79 | K422: 17 | L422: 10 | M422: =K422*6+L422 -> 112 | O422: 21 | P422: 11 | Q422: =O422*6+P422 -> 137 | S422: SUNSHINE
A423: COBURG | C423: 2 | D423: 1 | E423: =C423*6+D423 -> 13 | G423: 5 | H423: 3 | I423: =G423*6+H423 -> 33 | K423: 9 | L423: 6 | M423: =K423*6+L423 -> 60 | O423: 16 | P423: 8 | Q423: =O423*6+P423 -> 104
A424: BEST PLAYERS
A425: SUNSHINE | C425: FERGUSON | F425: CLARKE | I425: McGARRITY | L425: BEAN | N425: DEAN | Q425: BROWN
A426: COBURG | C426: KIRKMAN | F426: GALE | I426: BOSCHEN | L426: SPORTON | N426: SULLIVAN | Q426: BRANSTON
A427: GOALKICKERS
A428: SUNSHINE | C428: FERGUSON 8 | F428: ALLEN 4 | I428: CLARKE 3 | L428: IBRAHIM 2 | N428: BROWN 2 | Q428: HIPWORTH | T428: GOOLD
A429: COBURG | C429: SPORTON 6 | F429: GALE 3 | H429: VINCENT 2 | K429: BRANSTON 2 | N429: MORRISON | Q429: BUSBRIDGE | T429: ERWIN
A431: ROUND 10 | E431: 21ST JUNE | J431: WEATHER | S431: PLAYED AT
D432: 1ST QTR | H432: 2ND QTR | L432: 3RD QTR | P432: FINAL | S432: WERRIBEE
A433: CAULFIELD | C433: 2 | D433: 5 | E433: =C433*6+D433 -> 17 | G433: 9 | H433: 10 | I433: =G433*6+H433 -> 64 | K433: 11 | L433: 14 | M433: =K433*6+L433 -> 80 | O433: 16 | P433: 19 | Q433: =O433*6+P433 -> 115 | S433: UMPIRE | X433: LADDER | AB433: ROUND | AD433: 10
A434: WERRIBEE | C434: 3 | D434: 1 | E434: =C434*6+D434 -> 19 | G434: 9 | H434: 6 | I434: =G434*6+H434 -> 60 | K434: 12 | L434: 12 | M434: =K434*6+L434 -> 84 | O434: 14 | P434: 12 | Q434: =O434*6+P434 -> 96
A435: BEST PLAYERS | W435: TEAM | X435: W | Y435: L | Z435: D | AA435: FOR | AB435: AGST | AC435: % | AD435: PTS
A436: CAULFIELD | C436: GOWANS | F436: CLARK | I436: BROWN | L436: TEMPEST | O436: BAKER | R436: M ROBINSON
A437: WERRIBEE | C437: LYONS | F437: SHANAHAN | I437: CHIRGWIN | L437: COMBEN | O437: ELLIS | R437: A ROBINSON | W437: SUNSHINE | X437: 9 | Y437: 1 | Z437: 0 | AA437: 1368 | AB437: 734 | AC437: =(AA437*100)/AB437 -> 186.37602179836512 | AD437: =(X437*4)+(Z437*2) -> 36
A438: GOALKICKERS | O438: LOGAN | W438: COBURG | X438: 9 | Y438: 1 | Z438: 0 | AA438: 1360 | AB438: 733 | AC438: =(AA438*100)/AB438 -> 185.53888130968622 | AD438: =(X438*4)+(Z438*2) -> 36
A439: CAULFIELD | C439: BROWN 7 | F439: P ROBINSON 2 | I439: TEMPEST 2 | L439: FARRELLY | N439: BAKER | P439: McGINTY | R439: CURTAIN | W439: WILLIAMSTOWN | X439: 8 | Y439: 2 | Z439: 0 | AA439: 932 | AB439: 722 | AC439: =(AA439*100)/AB439 -> 129.08587257617728 | AD439: =(X439*4)+(Z439*2) -> 32
A440: WERRIBEE | C440: LYONS 5 | E440: OGILVIE 2 | H440: HEMLEY 2 | J440: A ROBINSON 2 | M440: CHIRGWIN | P440: COMBEN | R440: PANETTA | W440: WERRIBEE | X440: 5 | Y440: 5 | Z440: 0 | AA440: 971 | AB440: 909 | AC440: =(AA440*100)/AB440 -> 106.82068206820682 | AD440: =(X440*4)+(Z440*2) -> 20
A442: MORDIALLOC | C442: 4 | D442: 4 | E442: =C442*6+D442 -> 28 | G442: 7 | H442: 6 | I442: =G442*6+H442 -> 48 | K442: 10 | L442: 10 | M442: =K442*6+L442 -> 70 | O442: 17 | P442: 15 | Q442: =O442*6+P442 -> 117 | S442: FRANKSTON | W442: CAULFIELD | X442: 5 | Y442: 5 | Z442: 0 | AA442: 894 | AB442: 937 | AC442: =(AA442*100)/AB442 -> 95.410885805763073 | AD442: =(X442*4)+(Z442*2) -> 20
A443: FRANKSTON | C443: 2 | D443: 3 | E443: =C443*6+D443 -> 15 | G443: 9 | H443: 7 | I443: =G443*6+H443 -> 61 | K443: 11 | L443: 9 | M443: =K443*6+L443 -> 75 | O443: 14 | P443: 16 | Q443: =O443*6+P443 -> 100 | W443: NORTHCOTE | X443: 5 | Y443: 5 | Z443: 0 | AA443: 662 | AB443: 816 | AC443: =(AA443*100)/AB443 -> 81.127450980392155 | AD443: =(X443*4)+(Z443*2) -> 20
A444: BEST PLAYERS | W444: BOX HILL | X444: 4 | Y444: 6 | Z444: 0 | AA444: 789 | AB444: 1032 | AC444: =(AA444*100)/AB444 -> 76.45348837209302 | AD444: =(X444*4)+(Z444*2) -> 16
A445: MORDIALLOC | C445: HARRY | F445: JOHNSTONE | I445: HYNES | L445: LANG | O445: DURO | Q445: SMITH | W445: FRANKSTON | X445: 3 | Y445: 7 | Z445: 0 | AA445: 935 | AB445: 977 | AC445: =(AA445*100)/AB445 -> 95.701125895598778 | AD445: =(X445*4)+(Z445*2) -> 12
A446: FRANKSTON | C446: BLAKE | F446: COUTTS | I446: ALDERSON | L446: NICHOLSON | O446: RENOUF | Q446: BOWES | W446: MORDIALLOC | X446: 2 | Y446: 8 | Z446: 0 | AA446: 750 | AB446: 1048 | AC446: =(AA446*100)/AB446 -> 71.564885496183209 | AD446: =(X446*4)+(Z446*2) -> 8
A447: GOALKICKERS | W447: CAMBERWELL | X447: 0 | Y447: 10 | Z447: 0 | AA447: 577 | AB447: 1244 | AC447: =(AA447*100)/AB447 -> 46.382636655948552 | AD447: =(X447*4)+(Z447*2) -> 0
A448: MORDIALLOC | C448: HARRY 9 | F448: JOHNSTONE 3 | I448: O'FARRELL 2 | L448: SMITH | N448: SCAIFE | P448: HYNES
A449: FRANKSTON | C449: NICHOLSON 3 | F449: ROSENBROCK 2 | I449: LEE 2 | J449: GOODING 2 | M449: WATSON | O449: BISHOP | Q449: WESTON | S449: ALDERSON | W449: COUTTS
E450: 22ND JUNE | J450: WEATHER
A451: BOX HILL | C451: 6 | D451: 7 | E451: =C451*6+D451 -> 43 | G451: 11 | H451: 9 | I451: =G451*6+H451 -> 75 | K451: 12 | L451: 12 | M451: =K451*6+L451 -> 84 | O451: 16 | P451: 12 | Q451: =O451*6+P451 -> 108 | S451: BOX HILL
A452: CAMBERWELL | C452: 3 | D452: 4 | E452: =C452*6+D452 -> 22 | G452: 4 | H452: 6 | I452: =G452*6+H452 -> 30 | K452: 7 | L452: 14 | M452: =K452*6+L452 -> 56 | O452: 9 | P452: 20 | Q452: =O452*6+P452 -> 74
A453: BEST PLAYERS
A454: BOX HILL
A455: CAMBERWELL | C455: DELANTY | F455: WILSON | I455: CONYERS | L455: TAYLOR | O455: MACKINLAY | R455: LAWSON
A456: GOALKICKERS
A457: BOX HILL
A458: CAMBERWELL | C458: DELANTY 2 | F458: BRAYNE 2 | I458: FRIEBERG 2 | L458: TAYLOR | N458: MACKINLAY | Q458: L BOYD
A460: COBURG | C460: 3 | D460: 5 | E460: =C460*6+D460 -> 23 | G460: 7 | H460: 9 | I460: =G460*6+H460 -> 51 | K460: 9 | L460: 13 | M460: =K460*6+L460 -> 67 | O460: 14 | P460: 16 | Q460: =O460*6+P460 -> 100 | S460: COBURG
A461: NORTHCOTE | C461: 0 | D461: 0 | E461: =C461*6+D461 -> 0 | G461: 0 | H461: 0 | I461: =G461*6+H461 -> 0 | K461: 0 | L461: 0 | M461: =K461*6+L461 -> 0 | O461: 10 | P461: 13 | Q461: =O461*6+P461 -> 73
A462: BEST PLAYERS
A463: COBURG | C463: BOSCHEN | F463: HAWKING | I463: BUSBRIDGE | L463: MORRISON | O463: McLACHLAN
A464: NORTHCOTE | C464: SMITH | F464: KOZARIS | I464: LESTER | L464: McGORLICK | O464: STAFFORD
A465: GOALKICKERS
A466: COBURG | C466: MORRISON 5 | F466: BRENNAN 3 | I466: SPORTON 2 | L466: GALE | N466: SULLIVAN | Q466: VINCENT | S466: ELVERY
A467: NORTHCOTE | C467: RORISON 2 | F467: QUAIFE 2 | I467: R WHITE 2 | L467: STAFFORD | N467: KOZARIS | Q467: MUIR | S467: McGORLICK
A469: WILLIAMSTOWN | C469: 6 | D469: 2 | E469: =C469*6+D469 -> 38 | G469: 9 | H469: 3 | I469: =G469*6+H469 -> 57 | K469: 15 | L469: 7 | M469: =K469*6+L469 -> 97 | O469: 19 | P469: 9 | Q469: =O469*6+P469 -> 123 | S469: SUNSHINE
A470: SUNSHINE | C470: 5 | D470: 3 | E470: =C470*6+D470 -> 33 | G470: 7 | H470: 8 | I470: =G470*6+H470 -> 50 | K470: 9 | L470: 9 | M470: =K470*6+L470 -> 63 | O470: 13 | P470: 11 | Q470: =O470*6+P470 -> 89
A471: BEST PLAYERS
A472: WILLIAMSTOWN | C472: CAMILLIERI | F472: BARNES | I472: O'MARA | L472: MADIGAN | O472: HAYWARD | R472: JOHNSON
A473: SUNSHINE | C473: BENSON | F473: RUSSELL | I473: BEAN | L473: McLEOD | O473: McGARRITY | R473: BROWN
A474: GOALKICKERS
A475: WILLIAMSTOWN | C475: PATTERSON 4 | F475: CAMILLIERI 3 | I475: PAPLEY 3 | K475: JOHNSON 3 | M475: BARNES 2 | O475: MADIGAN 2 | R475: DEY 2
A476: SUNSHINE | C476: FERGUSON 4 | F476: WALSH 3 | I476: DEAN 2 | K476: BROWN 2 | M476: IBRAHIM | O476: BENSON
A478: ROUND 11 | E478: 28TH JUNE | J478: WEATHER | S478: PLAYED AT
D479: 1ST QTR | H479: 2ND QTR | L479: 3RD QTR | P479: FINAL | S479: MORDIALLOC
A480: SUNSHINE | C480: 3 | D480: 0 | E480: =C480*6+D480 -> 18 | G480: 8 | H480: 3 | I480: =G480*6+H480 -> 51 | K480: 9 | L480: 7 | M480: =K480*6+L480 -> 61 | O480: 15 | P480: 16 | Q480: =O480*6+P480 -> 106 | S480: UMPIRE | X480: LADDER | AB480: ROUND | AD480: 11
A481: MORDIALLOC | C481: 5 | D481: 9 | E481: =C481*6+D481 -> 39 | G481: 6 | H481: 13 | I481: =G481*6+H481 -> 49 | K481: 8 | L481: 17 | M481: =K481*6+L481 -> 65 | O481: 9 | P481: 17 | Q481: =O481*6+P481 -> 71
A482: BEST PLAYERS | W482: TEAM | X482: W | Y482: L | Z482: D | AA482: FOR | AB482: AGST | AC482: % | AD482: PTS
A483: SUNSHINE | C483: McGARRITY | F483: McLEOD | I483: BEAN | L483: BROWN | O483: BENSON | R483: ALLEN
A484: MORDIALLOC | C484: SMITH | F484: DURO | I484: THOMPSON | L484: O'FARRELL | O484: JOHNSTONE | R484: SCAIFE | W484: COBURG | X484: 10 | Y484: 1 | Z484: 0 | AA484: 1513 | AB484: 819 | AC484: =(AA484*100)/AB484 -> 184.73748473748475 | AD484: =(X484*4)+(Z484*2) -> 40
A485: GOALKICKERS | W485: SUNSHINE | X485: 10 | Y485: 1 | Z485: 0 | AA485: 1474 | AB485: 805 | AC485: =(AA485*100)/AB485 -> 183.10559006211179 | AD485: =(X485*4)+(Z485*2) -> 40
A486: SUNSHINE | C486: ALLEN 6 | E486: FERGUSON 3 | H486: KELLETT 2 | J486: WALSH | L486: McLEOD | N486: THOMPSON | Q486: KENNEDY | W486: WILLIAMSTOWN | X486: 9 | Y486: 2 | Z486: 0 | AA486: 1027 | AB486: 786 | AC486: =(AA486*100)/AB486 -> 130.66157760814249 | AD486: =(X486*4)+(Z486*2) -> 36
A487: MORDIALLOC | C487: JOHNSTONE 3 | F487: O'FARRELL 3 | I487: HYNES 2 | K487: THOMPSON | W487: WERRIBEE | X487: 6 | Y487: 5 | Z487: 0 | AA487: 1097 | AB487: 982 | AC487: =(AA487*100)/AB487 -> 111.71079429735234 | AD487: =(X487*4)+(Z487*2) -> 24
A489: WILLIAMSTOWN | C489: 6 | D489: 7 | E489: =C489*6+D489 -> 43 | G489: 7 | H489: 10 | I489: =G489*6+H489 -> 52 | K489: 10 | L489: 15 | M489: =K489*6+L489 -> 75 | O489: 13 | P489: 17 | Q489: =O489*6+P489 -> 95 | S489: WILLIAMSTOWN | W489: NORTHCOTE | X489: 6 | Y489: 5 | Z489: 0 | AA489: 776 | AB489: 912 | AC489: =(AA489*100)/AB489 -> 85.087719298245617 | AD489: =(X489*4)+(Z489*2) -> 24
A490: BOX HILL | C490: 1 | D490: 0 | E490: =C490*6+D490 -> 6 | G490: 6 | H490: 5 | I490: =G490*6+H490 -> 41 | K490: 7 | L490: 5 | M490: =K490*6+L490 -> 47 | O490: 9 | P490: 10 | Q490: =O490*6+P490 -> 64 | W490: CAULFIELD | X490: 5 | Y490: 6 | Z490: 0 | AA490: 990 | AB490: 1051 | AC490: =(AA490*100)/AB490 -> 94.196003805899139 | AD490: =(X490*4)+(Z490*2) -> 20
A491: BEST PLAYERS | W491: BOX HILL | X491: 4 | Y491: 7 | Z491: 0 | AA491: 853 | AB491: 1127 | AC491: =(AA491*100)/AB491 -> 75.687666370896181 | AD491: =(X491*4)+(Z491*2) -> 16
A492: WILLIAMSTOWN | C492: HAYWARD | F492: CAMILLIERI | I492: JACKMAN | L492: COCKS | O492: PATTERSON | R492: RUSSELL | W492: FRANKSTON | X492: 3 | Y492: 8 | Z492: 0 | AA492: 1021 | AB492: 1130 | AC492: =(AA492*100)/AB492 -> 90.353982300884951 | AD492: =(X492*4)+(Z492*2) -> 12
A493: BOX HILL | C493: DAWSON | F493: BAKER | I493: BARNETT | L493: SMITH | O493: ABBOTT | W493: MORDIALLOC | X493: 2 | Y493: 9 | Z493: 0 | AA493: 821 | AB493: 1154 | AC493: =(AA493*100)/AB493 -> 71.143847487001736 | AD493: =(X493*4)+(Z493*2) -> 8
A494: GOALKICKERS | W494: CAMBERWELL | X494: 0 | Y494: 11 | Z494: 0 | AA494: 650 | AB494: 1370 | AC494: =(AA494*100)/AB494 -> 47.445255474452551 | AD494: =(X494*4)+(Z494*2) -> 0
A495: WILLIAMSTOWN | C495: CAMILLIERI 3 | F495: JACKMAN 3 | I495: COCKS 3 | K495: MITCHELL | N495: HAYWARD | Q495: PAPLEY | S495: JOHNSON
A496: BOX HILL | C496: WALKER 3 | F496: ATKINSON | I496: THOMPSON | L496: BIERL | N496: SMITH | P496: EBERT | R496: RALPH
A498: WERRIBEE | C498: 2 | D498: 2 | E498: =C498*6+D498 -> 14 | G498: 10 | H498: 11 | I498: =G498*6+H498 -> 71 | K498: 12 | L498: 18 | M498: =K498*6+L498 -> 90 | O498: 18 | P498: 18 | Q498: =O498*6+P498 -> 126 | S498: CAMBERWELL
A499: CAMBERWELL | C499: 2 | D499: 8 | E499: =C499*6+D499 -> 20 | G499: 3 | H499: 9 | I499: =G499*6+H499 -> 27 | K499: 12 | L499: 10 | M499: =K499*6+L499 -> 82 | O499: 10 | P499: 13 | Q499: =O499*6+P499 -> 73
A500: BEST PLAYERS
A501: WERRIBEE | C501: SHANAHAN | F501: LYONS | I501: ELLIS | L501: COMBEN | O501: PANETTA | R501: SHEAHAN
A502: CAMBERWELL | C502: BRAYNE | F502: CONYERS | I502: PECK | L502: DELANTY | O502: FLOYD | R502: L BOYD
A503: GOALKICKERS
A504: WERRIBEE | C504: SHANAHAN 4 | F504: ROBINSON 3 | I504: PANETTA 3 | L504: ELLIS 2 | N504: COMBEN 2 | Q504: LYONS 2 | S504: WINTLE | U504: SHEAHAN
A505: CAMBERWELL | C505: BRAYNE 4 | F505: DELANTY 2 | I505: WESTACOTT | L505: CONYERS | N505: L BOYD | P505: PECK
A507: NORTHCOTE | C507: 4 | D507: 6 | E507: =C507*6+D507 -> 30 | G507: 8 | H507: 12 | I507: =G507*6+H507 -> 60 | K507: 14 | L507: 17 | M507: =K507*6+L507 -> 101 | O507: 16 | P507: 18 | Q507: =O507*6+P507 -> 114 | S507: PRINCES PARK, CAULFIELD
A508: CAULFIELD | C508: 2 | D508: 1 | E508: =C508*6+D508 -> 13 | G508: 7 | H508: 5 | I508: =G508*6+H508 -> 47 | K508: 7 | L508: 7 | M508: =K508*6+L508 -> 49 | O508: 14 | P508: 12 | Q508: =O508*6+P508 -> 96
A509: BEST PLAYERS
A510: NORTHCOTE | C510: SMITH | F510: DEAN | I510: KOZARIS | L510: WHITE | O510: BEYNON | R510: MUIR
A511: CAULFIELD | C511: BAKER | F511: SANDERS | I511: MELBOURNE | L511: ROBINSON | O511: ARRELL | R511: CURTAIN
A512: GOALKICKERS
A513: NORTHCOTE | C513: WHITE 5 | E513: HENRY 3 | G513: VINEY | I513: KOZARIS | K513: ELLIS | M513: MUIR | O513: DEAN | Q513: STAFFORD | S513: ECCLES | U513: BEYNON
A514: CAULFIELD | C514: BROWN 3 | E514: BAKER 2 | G514: ROBINSON 2 | J514: RENOWDEN | M514: COLLINS | O514: TEMPEST | Q514: WHITE | S514: LOGAN | U514: CLARK | W514: O'DONNELL
A516: COBURG | C516: 2 | D516: 3 | E516: =C516*6+D516 -> 15 | G516: 10 | H516: 7 | I516: =G516*6+H516 -> 67 | K516: 15 | L516: 11 | M516: =K516*6+L516 -> 101 | O516: 23 | P516: 15 | Q516: =O516*6+P516 -> 153 | S516: COBURG
A517: FRANKSTON | C517: 3 | D517: 6 | E517: =C517*6+D517 -> 24 | G517: 3 | H517: 9 | I517: =G517*6+H517 -> 27 | K517: 9 | L517: 10 | M517: =K517*6+L517 -> 64 | O517: 12 | P517: 14 | Q517: =O517*6+P517 -> 86
A518: BEST PLAYERS
A519: COBURG | C519: MORRISON | F519: NICHOL | I519: ROWE | L519: JENKINS | O519: BUSBRIDGE | R519: HIRST
A520: FRANKSTON | C520: COUTTS | F520: BOWES | I520: ALDERSON | L520: SHEPPARD | O520: BLAKE | R520: NICHOL
A521: GOALKICKERS
A522: COBURG | C522: HIRST 5 | E522: MORRISON 4 | H522: JENKINS 3 | J522: SPORTON 2 | M522: BRENNAN 2 | O522: SULLIVAN 2 | R522: GALE 2 | T522: BUSBRIDGE | W522: CHALLENGER | X522: N ? 1 | Z522: N
A523: FRANKSTON | C523: ROSENBROCK 4 | F523: COUTTS 3 | I523: NICHOLSON | L523: GOODING | N523: VAUGHAN | Q523: McCOLL | S523: PRICE
A525: ROUND 12 | E525: 5TH JULY | J525: WEATHER | S525: PLAYED AT
D526: 1ST QTR | H526: 2ND QTR | L526: 3RD QTR | P526: FINAL | S526: PRINCES PARK, CAULFIELD
A527: CAULFIELD | C527: 6 | D527: 3 | E527: =C527*6+D527 -> 39 | G527: 10 | H527: 8 | I527: =G527*6+H527 -> 68 | K527: 18 | L527: 10 | M527: =K527*6+L527 -> 118 | O527: 23 | P527: 15 | Q527: =O527*6+P527 -> 153 | S527: UMPIRE | X527: LADDER | AB527: ROUND | AD527: 12
A528: CAMBERWELL | C528: 1 | D528: 6 | E528: =C528*6+D528 -> 12 | G528: 6 | H528: 9 | I528: =G528*6+H528 -> 45 | K528: 10 | L528: 13 | M528: =K528*6+L528 -> 73 | O528: 11 | P528: 16 | Q528: =O528*6+P528 -> 82
A529: BEST PLAYERS | W529: TEAM | X529: W | Y529: L | Z529: D | AA529: FOR | AB529: AGST | AC529: % | AD529: PTS
A530: CAULFIELD | C530: FARRELLY | F530: ROBINSON | I530: COLLINS | L530: BAKER | O530: DOWSETT | R530: SANDERS
A531: CAMBERWELL | C531: CONYERS | F531: TAYLOR | I531: MACKINLAY | L531: FRASER | O531: L BOYD | R531: D BOYD | W531: COBURG | X531: 11 | Y531: 1 | Z531: 0 | AA531: 1608 | AB531: 908 | AC531: =(AA531*100)/AB531 -> 177.09251101321587 | AD531: =(X531*4)+(Z531*2) -> 44
A532: GOALKICKERS | W532: SUNSHINE | X532: 11 | Y532: 1 | Z532: 0 | AA532: 1592 | AB532: 919 | AC532: =(AA532*100)/AB532 -> 173.23177366702939 | AD532: =(X532*4)+(Z532*2) -> 44
A533: CAULFIELD | C533: BROWN 6 | E533: ROBINSON 5 | H533: COLLINS 4 | J533: WHITE 4 | L533: CURTAIN 3 | O533: BAKER | W533: WILLIAMSTOWN | X533: 9 | Y533: 3 | Z533: 0 | AA533: 1116 | AB533: 881 | AC533: =(AA533*100)/AB533 -> 126.67423382519864 | AD533: =(X533*4)+(Z533*2) -> 36
A534: CAMBERWELL | C534: DELANTY 3 | F534: D BOYD 3 | I534: TAYLOR 2 | L534: BRAYNE 2 | O534: FLOYD | W534: NORTHCOTE | X534: 7 | Y534: 5 | Z534: 0 | AA534: 923 | AB534: 1009 | AC534: =(AA534*100)/AB534 -> 91.47670961347869 | AD534: =(X534*4)+(Z534*2) -> 28
E535: 6TH JULY | J535: WEATHER
A536: COBURG | C536: 6 | D536: 9 | E536: =C536*6+D536 -> 45 | G536: 8 | H536: 10 | I536: =G536*6+H536 -> 58 | K536: 10 | L536: 15 | M536: =K536*6+L536 -> 75 | O536: 13 | P536: 17 | Q536: =O536*6+P536 -> 95 | S536: COBURG | W536: WERRIBEE | X536: 6 | Y536: 6 | Z536: 0 | AA536: 1211 | AB536: 1100 | AC536: =(AA536*100)/AB536 -> 110.09090909090909 | AD536: =(X536*4)+(Z536*2) -> 24
A537: WILLIAMSTOWN | C537: 2 | D537: 1 | E537: =C537*6+D537 -> 13 | G537: 9 | H537: 4 | I537: =G537*6+H537 -> 58 | K537: 11 | L537: 8 | M537: =K537*6+L537 -> 74 | O537: 13 | P537: 11 | Q537: =O537*6+P537 -> 89 | W537: CAULFIELD | X537: 6 | Y537: 6 | Z537: 0 | AA537: 1143 | AB537: 1133 | AC537: =(AA537*100)/AB537 -> 100.88261253309797 | AD537: =(X537*4)+(Z537*2) -> 24
A538: BEST PLAYERS | W538: BOX HILL | X538: 5 | Y538: 7 | Z538: 0 | AA538: 990 | AB538: 1241 | AC538: =(AA538*100)/AB538 -> 79.774375503626104 | AD538: =(X538*4)+(Z538*2) -> 20
A539: COBURG | C539: GALE | F539: JENKINS | I539: JONES | L539: BUSBRIDGE | O539: MORRISON | R539: KIRKMAN | W539: FRANKSTON | X539: 3 | Y539: 9 | Z539: 0 | AA539: 1135 | AB539: 1267 | AC539: =(AA539*100)/AB539 -> 89.581689029202835 | AD539: =(X539*4)+(Z539*2) -> 12
A540: WILLIAMSTOWN | C540: PERCY | F540: JOHNSON | I540: BARNES | L540: MADIGAN | O540: WHITTINGTON | R540: MULLIGAN | W540: MORDIALLOC | X540: 2 | Y540: 10 | Z540: 0 | AA540: 918 | AB540: 1301 | AC540: =(AA540*100)/AB540 -> 70.561106840891625 | AD540: =(X540*4)+(Z540*2) -> 8
A541: GOALKICKERS | W541: CAMBERWELL | X541: 0 | Y541: 12 | Z541: 0 | AA541: 732 | AB541: 1523 | AC541: =(AA541*100)/AB541 -> 48.063033486539723 | AD541: =(X541*4)+(Z541*2) -> 0
A542: COBURG | C542: ERWIN 4 | E542: GALE 3 | G542: SPORTON 2 | I542: SULLIVAN | L542: JONES | N542: BRENNAN | Q542: JENKINS
A543: WILLIAMSTOWN | C543: COCKS 3 | E543: MULLIGAN 3 | H543: BUCHANAN 2 | K543: BARNES 2 | N543: RYAN | P543: JACKMAN | R543: J JOHNSON
A545: NORTHCOTE | C545: 6 | D545: 6 | E545: =C545*6+D545 -> 42 | G545: 14 | H545: 9 | I545: =G545*6+H545 -> 93 | K545: 17 | L545: 12 | M545: =K545*6+L545 -> 114 | O545: 22 | P545: 15 | Q545: =O545*6+P545 -> 147 | S545: NORTHCOTE
A546: MORDIALLOC | C546: 3 | D546: 4 | E546: =C546*6+D546 -> 22 | G546: 7 | H546: 8 | I546: =G546*6+H546 -> 50 | K546: 9 | L546: 14 | M546: =K546*6+L546 -> 68 | O546: 13 | P546: 19 | Q546: =O546*6+P546 -> 97
A547: BEST PLAYERS
A548: NORTHCOTE | C548: HEAL | F548: LESTER | I548: ELLIS | L548: KOZARIS | O548: McCARTHY
A549: MORDIALLOC | C549: DURO | F549: LANG | I549: SMITH | L549: HARRY | O549: SCAIFE
A550: GOALKICKERS
A551: NORTHCOTE | C551: HENRY 6 | E551: LESTER 3 | G551: DEAN 3 | I551: McGORLICK 2 | L551: NEAL 2 | N551: MUIR 2 | P551: RORISON | R551: QUAIFE | T551: KOZARIS | W551: VINEY
A552: MORDIALLOC | C552: HARRY 5 | E552: JOHNSTONE 2 | H552: O'FARRELL 2 | K552: SMITH | M552: LESLIE | O552: SCAIFE | Q552: GARDINER
A554: BOX HILL | C554: 3 | D554: 4 | E554: =C554*6+D554 -> 22 | G554: 10 | H554: 9 | I554: =G554*6+H554 -> 69 | K554: 16 | L554: 11 | M554: =K554*6+L554 -> 107 | O554: 20 | P554: 17 | Q554: =O554*6+P554 -> 137 | S554: BOX HILL
A555: FRANKSTON | C555: 3 | D555: 5 | E555: =C555*6+D555 -> 23 | G555: 6 | H555: 8 | I555: =G555*6+H555 -> 44 | K555: 11 | L555: 11 | M555: =K555*6+L555 -> 77 | O555: 17 | P555: 12 | Q555: =O555*6+P555 -> 114
A556: BEST PLAYERS
A557: BOX HILL | C557: COBAIN | F557: DAWSON | I557: ABBOTT | L557: BARNETT | O557: WALKER | R557: SMITH
A558: FRANKSTON | C558: PRICE | F558: NICHOLSON | I558: SHEPPARD | L558: McCOLL | O558: ROSENBROCK
A559: GOALKICKERS
A560: BOX HILL | C560: BATES 4 | E560: WALKER 3 | G560: PERRY 2 | I560: HUNT 2 | K560: DAWSON 2 | M560: ATKINSON 2 | P560: THOMPSON 2 | S560: COBAIN | U560: BARNETT | W560: SMITH
A561: FRANKSTON | C561: ROSENBROCK 7 | F561: PRICE 6 | H561: McCOLL | J561: NICHOLSON | M561: GRAHAM | P561: GOODINGS
A563: SUNSHINE | C563: 5 | D563: 1 | E563: =C563*6+D563 -> 31 | G563: 11 | H563: 5 | I563: =G563*6+H563 -> 71 | K563: 13 | L563: 8 | M563: =K563*6+L563 -> 86 | O563: 18 | P563: 10 | Q563: =O563*6+P563 -> 118 | S563: SUNSHINE
A564: WERRIBEE | C564: 4 | D564: 2 | E564: =C564*6+D564 -> 26 | G564: 9 | H564: 4 | I564: =G564*6+H564 -> 58 | K564: 13 | L564: 4 | M564: =K564*6+L564 -> 82 | O564: 18 | P564: 6 | Q564: =O564*6+P564 -> 114
A565: BEST PLAYERS
A566: SUNSHINE | C566: McGARRITY | F566: BROWN | I566: BENSON | L566: RUSSELL | O566: GOOLD | R566: DEAN
A567: WERRIBEE | C567: HEMLEY | F567: COMBEN | I567: ELLIS | L567: PANETTA | O567: LYONS | R567: HINKLEY
A568: GOALKICKERS
A569: SUNSHINE | C569: ALLEN 7 | F569: FERGUSON 4 | I569: ROSSER 3 | K569: IBRAHIM | M569: DEAN | O569: BENSON | Q569: CLARKE
A570: WERRIBEE | C570: LYONS 5 | F570: SHANAHAN 3 | I570: ROBINSON 3 | L570: TYQUIN 2 | N570: HINKLEY 2 | R570: 3 SHORT
A572: ROUND 13 | E572: 12TH JULY | J572: WEATHER | S572: PLAYED AT
D573: 1ST QTR | H573: 2ND QTR | L573: 3RD QTR | P573: FINAL | S573: WERRIBEE
A574: BOX HILL | C574: 2 | D574: 1 | E574: =C574*6+D574 -> 13 | G574: 8 | H574: 2 | I574: =G574*6+H574 -> 50 | K574: 10 | L574: 4 | M574: =K574*6+L574 -> 64 | O574: 17 | P574: 7 | Q574: =O574*6+P574 -> 109 | S574: UMPIRE | X574: LADDER | AB574: ROUND | AD574: 13
A575: WERRIBEE | C575: 3 | D575: 2 | E575: =C575*6+D575 -> 20 | G575: 5 | H575: 10 | I575: =G575*6+H575 -> 40 | K575: 10 | L575: 13 | M575: =K575*6+L575 -> 73 | O575: 15 | P575: 16 | Q575: =O575*6+P575 -> 106
A576: BEST PLAYERS | W576: TEAM | X576: W | Y576: L | Z576: D | AA576: FOR | AB576: AGST | AC576: % | AD576: PTS
A577: BOX HILL | C577: SMITH | F577: COBAIN | I577: McQUALTER | L577: ATKINSON | O577: BARNETT | R577: DAWSON
A578: WERRIBEE | C578: PANETTA | F578: ROBINSON | I578: MONTGOMERY | L578: SERTORI | O578: COMBEN | W578: SUNSHINE | X578: 12 | Y578: 1 | Z578: 0 | AA578: 1760 | AB578: 982 | AC578: =(AA578*100)/AB578 -> 179.22606924643586 | AD578: =(X578*4)+(Z578*2) -> 48
A579: GOALKICKERS | Q579: THOMPSON | W579: COBURG | X579: 12 | Y579: 1 | Z579: 0 | AA579: 1719 | AB579: 966 | AC579: =(AA579*100)/AB579 -> 177.9503105590062 | AD579: =(X579*4)+(Z579*2) -> 48
A580: BOX HILL | C580: SMITH 6 | E580: COBAIN 2 | G580: DAWSON 2 | I580: ATKINSON 2 | L580: BIERL | N580: TERRY | P580: BATES | R580: WALKER | W580: WILLIAMSTOWN | X580: 10 | Y580: 3 | Z580: 0 | AA580: 1254 | AB580: 960 | AC580: =(AA580*100)/AB580 -> 130.625 | AD580: =(X580*4)+(Z580*2) -> 40
A581: WERRIBEE | C581: SHANAHAN 4 | F581: ROBINSON 4 | I581: ELLIS 3 | K581: CROMPTON 2 | N581: LYONS 2 | W581: NORTHCOTE | X581: 8 | Y581: 5 | Z581: 0 | AA581: 1048 | AB581: 1128 | AC581: =(AA581*100)/AB581 -> 92.907801418439718 | AD581: =(X581*4)+(Z581*2) -> 32
A583: NORTHCOTE | C583: 4 | D583: 5 | E583: =C583*6+D583 -> 29 | G583: 8 | H583: 10 | I583: =G583*6+H583 -> 58 | K583: 17 | L583: 13 | M583: =K583*6+L583 -> 115 | O583: 18 | P583: 17 | Q583: =O583*6+P583 -> 125 | S583: FRANKSTON | W583: WERRIBEE | X583: 6 | Y583: 7 | Z583: 0 | AA583: 1317 | AB583: 1209 | AC583: =(AA583*100)/AB583 -> 108.93300248138958 | AD583: =(X583*4)+(Z583*2) -> 24
A584: FRANKSTON | C584: 3 | D584: 2 | E584: =C584*6+D584 -> 20 | G584: 11 | H584: 6 | I584: =G584*6+H584 -> 72 | K584: 15 | L584: 6 | M584: =K584*6+L584 -> 96 | O584: 18 | P584: 11 | Q584: =O584*6+P584 -> 119 | W584: CAULFIELD | X584: 6 | Y584: 7 | Z584: 0 | AA584: 1222 | AB584: 1271 | AC584: =(AA584*100)/AB584 -> 96.144767899291892 | AD584: =(X584*4)+(Z584*2) -> 24
A585: BEST PLAYERS | W585: BOX HILL | X585: 6 | Y585: 7 | Z585: 0 | AA585: 1099 | AB585: 1347 | AC585: =(AA585*100)/AB585 -> 81.588715664439491 | AD585: =(X585*4)+(Z585*2) -> 24
A586: NORTHCOTE | C586: HENRY | F586: SMITH | I586: MUIR | L586: HEAL | O586: MCCARTHY | R586: LESTER | W586: FRANKSTON | X586: 3 | Y586: 10 | Z586: 0 | AA586: 1254 | AB586: 1392 | AC586: =(AA586*100)/AB586 -> 90.08620689655173 | AD586: =(X586*4)+(Z586*2) -> 12
A587: FRANKSTON | C587: LAWRIE | F587: BOWES | I587: ALDERSON | L587: RENOUF | O587: VAUGHAN | R587: ROSENBROCK | W587: MORDIALLOC | X587: 2 | Y587: 11 | Z587: 0 | AA587: 976 | AB587: 1412 | AC587: =(AA587*100)/AB587 -> 69.12181303116148 | AD587: =(X587*4)+(Z587*2) -> 8
A588: GOALKICKERS | W588: CAMBERWELL | X588: 0 | Y588: 13 | Z588: 0 | AA588: 795 | AB588: 1691 | AC588: =(AA588*100)/AB588 -> 47.013601419278537 | AD588: =(X588*4)+(Z588*2) -> 0
A589: NORTHCOTE | C589: HENRY 6 | E589: VINEY 4 | G589: MUIR 3 | I589: WHITE 2 | K589: LESTER | M589: HEAL | O589: KOZARIS
A590: FRANKSTON | C590: McCOLL 4 | E590: LAWRIE 3 | G590: NICHOLSON 3 | J590: VAUGHAN 2 | M590: ROSENBROCK 2 | P590: THURLEY | R590: GRAHAM | T590: ALDERSON | W590: COUTTS
E591: 13TH JULY | J591: WEATHER
A592: COBURG | C592: 1 | D592: 4 | E592: =C592*6+D592 -> 10 | G592: 5 | H592: 8 | I592: =G592*6+H592 -> 38 | K592: 7 | L592: 10 | M592: =K592*6+L592 -> 52 | O592: 16 | P592: 15 | Q592: =O592*6+P592 -> 111 | S592: MORDIALLOC
A593: MORDIALLOC | C593: 6 | D593: 5 | E593: =C593*6+D593 -> 41 | G593: 7 | H593: 5 | I593: =G593*6+H593 -> 47 | K593: 8 | L593: 8 | M593: =K593*6+L593 -> 56 | O593: 8 | P593: 10 | Q593: =O593*6+P593 -> 58
A594: BEST PLAYERS
A595: COBURG | C595: BUSBRIDGE | F595: WALSH | I595: GALE | L595: SULLIVAN | O595: HAWKING | R595: KIRKMAN
A596: MORDIALLOC | C596: SMITH | F596: LANG | I596: SCAIFE | L596: GARDINER | O596: BENTLEY | R596: DURO
A597: GOALKICKERS
A598: COBURG | C598: GALE 4 | E598: BUSBRIDGE 2 | H598: KIRKMAN 2 | K598: EDWARDS 2 | N598: JENKINS 2 | P598: HIRST 2 | R598: TYTLER | T598: MORRISON
A599: MORDIALLOC | C599: GARDINER 2 | F599: SMITH 2 | H599: SCAIFE | J599: LANG | L599: DURO | N599: HENRY
A601: WILLIAMSTOWN | C601: 5 | D601: 0 | E601: =C601*6+D601 -> 30 | G601: 12 | H601: 2 | I601: =G601*6+H601 -> 74 | K601: 18 | L601: 6 | M601: =K601*6+L601 -> 114 | O601: 22 | P601: 6 | Q601: =O601*6+P601 -> 138 | S601: WILLIAMSTOWN
A602: CAULFIELD | C602: 3 | D602: 3 | E602: =C602*6+D602 -> 21 | G602: 5 | H602: 6 | I602: =G602*6+H602 -> 36 | K602: 5 | L602: 8 | M602: =K602*6+L602 -> 38 | O602: 11 | P602: 13 | Q602: =O602*6+P602 -> 79
A603: BEST PLAYERS
A604: WILLIAMSTOWN | C604: PERCY | F604: O MADIGAN | I604: O'MARA | L604: JACKMAN | O604: WHITTINGTON
A605: CAULFIELD | C605: WHITE | F605: BAKER | I605: LOGAN | L605: ARRELL | O605: SANDERS
A606: GOALKICKERS
A607: WILLIAMSTOWN | C607: PATTERSON 6 | F607: MULLIGAN 4 | I607: JACKMAN 3 | L607: JOHNSON 3 | N607: HAYWARD 2 | Q607: COCKS 2 | S607: MEYERS | U607: BUCHANAN
A608: CAULFIELD | C608: COLLINS 4 | F608: BROWN 3 | I608: WHITE | K608: BAKER | M608: CURTAIN | P608: O'DONNELL
A610: SUNSHINE | C610: 9 | D610: 9 | E610: =C610*6+D610 -> 63 | G610: 12 | H610: 16 | I610: =G610*6+H610 -> 88 | K610: 19 | L610: 23 | M610: =K610*6+L610 -> 137 | O610: 23 | P610: 30 | Q610: =O610*6+P610 -> 168 | S610: CAMBERWELL
A611: CAMBERWELL | C611: 1 | D611: 3 | E611: =C611*6+D611 -> 9 | G611: 4 | H611: 9 | I611: =G611*6+H611 -> 33 | K611: 5 | L611: 13 | M611: =K611*6+L611 -> 43 | O611: 8 | P611: 15 | Q611: =O611*6+P611 -> 63
A612: BEST PLAYERS
A613: SUNSHINE | C613: BROWN | F613: IBRAHIM | I613: BEAN | L613: RUSSELL | O613: McLEOD | R613: McGARRITY
A614: CAMBERWELL | C614: CONYERS | F614: TAYLOR | I614: MACKINLAY | L614: STAFFORD | O614: D BOYD | R614: ZANTUCK
A615: GOALKICKERS
A616: SUNSHINE | C616: IBRAHIM 6 | F616: ALLEN 5 | H616: FERGUSON 2 | K616: RUSSELL 2 | N616: ROSSER 2 | P616: GOOLD | R616: BEAN | S616: DEAN | U616: HIPWORTH | X616: MRTCHER | Z616: OVERS
A617: CAMBERWELL | C617: BRAYNE 3 | F617: ZANTUCK 2 | I617: FLOYD | K617: EDWARDS | N617: CONYERS
A619: ROUND 14 | E619: 19TH JULY | J619: WEATHER | S619: PLAYED AT
D620: 1ST QTR | H620: 2ND QTR | L620: 3RD QTR | P620: FINAL | S620: PRINCES PARK, CAULFIELD
A621: CAULFIELD | C621: 2 | D621: 6 | E621: =C621*6+D621 -> 18 | G621: 6 | H621: 7 | I621: =G621*6+H621 -> 43 | K621: 10 | L621: 11 | M621: =K621*6+L621 -> 71 | O621: 16 | P621: 14 | Q621: =O621*6+P621 -> 110 | S621: UMPIRE | X621: LADDER | AB621: ROUND | AD621: 14
A622: MORDIALLOC | C622: 3 | D622: 1 | E622: =C622*6+D622 -> 19 | G622: 6 | H622: 3 | I622: =G622*6+H622 -> 39 | K622: 10 | L622: 9 | M622: =K622*6+L622 -> 69 | O622: 15 | P622: 12 | Q622: =O622*6+P622 -> 102
A623: BEST PLAYERS | W623: TEAM | X623: W | Y623: L | Z623: D | AA623: FOR | AB623: AGST | AC623: % | AD623: PTS
A624: CAULFIELD | C624: CLARK | F624: ARRELL | I624: FARRELLY | L624: BAKER | O624: BROWN | R624: SANDERS
A625: MORDIALLOC | C625: SMITH | F625: LANG | I625: THOMPSON | L625: BENTLEY | O625: LESLIE | R625: DURO | W625: SUNSHINE | X625: 13 | Y625: 1 | Z625: 0 | AA625: 1860 | AB625: 1081 | AC625: =(AA625*100)/AB625 -> 172.06290471785383 | AD625: =(X625*4)+(Z625*2) -> 52
A626: GOALKICKERS | W626: COBURG | X626: 13 | Y626: 1 | Z626: 0 | AA626: 1853 | AB626: 1081 | AC626: =(AA626*100)/AB626 -> 171.41535615171136 | AD626: =(X626*4)+(Z626*2) -> 52
A627: CAULFIELD | C627: BROWN 5 | F627: O'DONNELL 4 | I627: WHITE 2 | K627: McGINTY 2 | N627: ROBINSON | P627: BAKER | R627: COLLINS | W627: WILLIAMSTOWN | X627: 11 | Y627: 3 | Z627: 0 | AA627: 1420 | AB627: 1005 | AC627: =(AA627*100)/AB627 -> 141.29353233830847 | AD627: =(X627*4)+(Z627*2) -> 44
A628: MORDIALLOC | C628: LESLIE 7 | F628: JOHNSTONE 2 | I628: HARRY | K628: SMITH | M628: GARDINER | P628: SCAIFE | R628: HYNES | T628: DURO | W628: NORTHCOTE | X628: 8 | Y628: 6 | Z628: 0 | AA628: 1147 | AB628: 1228 | AC628: =(AA628*100)/AB628 -> 93.403908794788279 | AD628: =(X628*4)+(Z628*2) -> 32
A630: FRANKSTON | C630: 3 | D630: 1 | E630: =C630*6+D630 -> 19 | G630: 10 | H630: 5 | I630: =G630*6+H630 -> 65 | K630: 14 | L630: 9 | M630: =K630*6+L630 -> 93 | O630: 17 | P630: 12 | Q630: =O630*6+P630 -> 114 | S630: FRANKSTON | W630: CAULFIELD | X630: 7 | Y630: 7 | Z630: 0 | AA630: 1332 | AB630: 1373 | AC630: =(AA630*100)/AB630 -> 97.013838310269477 | AD630: =(X630*4)+(Z630*2) -> 28
A631: WERRIBEE | C631: 5 | D631: 1 | E631: =C631*6+D631 -> 31 | G631: 6 | H631: 10 | I631: =G631*6+H631 -> 46 | K631: 11 | L631: 15 | M631: =K631*6+L631 -> 81 | O631: 15 | P631: 18 | Q631: =O631*6+P631 -> 108 | W631: WERRIBEE | X631: 6 | Y631: 8 | Z631: 0 | AA631: 1425 | AB631: 1323 | AC631: =(AA631*100)/AB631 -> 107.70975056689342 | AD631: =(X631*4)+(Z631*2) -> 24
A632: BEST PLAYERS | W632: BOX HILL | X632: 6 | Y632: 8 | Z632: 0 | AA632: 1214 | AB632: 1481 | AC632: =(AA632*100)/AB632 -> 81.971640783254557 | AD632: =(X632*4)+(Z632*2) -> 24
A633: FRANKSTON | C633: ALDERSON | F633: BISHOP | I633: JOHNSON | L633: VAUGHAN | O633: WINSTANLEY | R633: NICHOLSON | W633: FRANKSTON | X633: 4 | Y633: 10 | Z633: 0 | AA633: 1368 | AB633: 1500 | AC633: =(AA633*100)/AB633 -> 91.2 | AD633: =(X633*4)+(Z633*2) -> 16
A634: WERRIBEE | C634: CROMPTON | F634: HINKLEY | I634: SHANAHAN | L634: ELLIS | O634: ANDERSON | R634: WINTLE | W634: MORDIALLOC | X634: 2 | Y634: 12 | Z634: 0 | AA634: 1078 | AB634: 1522 | AC634: =(AA634*100)/AB634 -> 70.827858081471746 | AD634: =(X634*4)+(Z634*2) -> 8
A635: GOALKICKERS | W635: CAMBERWELL | X635: 0 | Y635: 14 | Z635: 0 | AA635: 840 | AB635: 1857 | AC635: =(AA635*100)/AB635 -> 45.234248788368333 | AD635: =(X635*4)+(Z635*2) -> 0
A636: FRANKSTON | C636: McCOLL 5 | F636: THURLEY 3 | I636: GRAHAM 2 | L636: LANDRY 2 | N636: NICHOLSON 2 | Q636: ALDERSON 2 | T636: VAUGHAN
A637: WERRIBEE | C637: SHEAHAN 4 | F637: SHANAHAN 3 | I637: CROMPTON 2 | L637: ELLIS | N637: HINKLEY | Q637: ROBINSON
E638: 20TH JULY | J638: WEATHER
A639: WILLIAMSTOWN | C639: 4 | D639: 2 | E639: =C639*6+D639 -> 26 | G639: 11 | H639: 7 | I639: =G639*6+H639 -> 73 | K639: 17 | L639: 11 | M639: =K639*6+L639 -> 113 | O639: 24 | P639: 22 | Q639: =O639*6+P639 -> 166 | S639: CAMBERWELL
A640: CAMBERWELL | C640: 2 | D640: 3 | E640: =C640*6+D640 -> 15 | G640: 3 | H640: 5 | I640: =G640*6+H640 -> 23 | K640: 6 | L640: 7 | M640: =K640*6+L640 -> 43 | O640: 6 | P640: 9 | Q640: =O640*6+P640 -> 45
A641: BEST PLAYERS
A642: WILLIAMSTOWN | C642: HAYWARD | F642: JACKMAN | I642: PAPLEY | L642: BARNES | O642: ROWLANDS | R642: CAMILLIERI
A643: CAMBERWELL | C643: CONYERS | F643: D BOYD | I643: FLOYD | L643: EDWARDS | O643: MACKINLAY | R643: TAYLOR
A644: GOALKICKERS
A645: WILLIAMSTOWN | C645: PAPLEY 5 | F645: JACKMAN 5 | I645: HAYWARD 4 | L645: MULLIGAN 4 | O645: PATTERSON 3 | R645: ROWLANDS 2 | U645: CAMILLIERI
A646: CAMBERWELL | C646: DELANTY 2 | F646: BRAYNE | I646: McNAMARA | L646: CONYERS | N646: ZANTUCK
A648: COBURG | C648: 4 | D648: 7 | E648: =C648*6+D648 -> 31 | G648: 9 | H648: 9 | I648: =G648*6+H648 -> 63 | K648: 17 | L648: 12 | M648: =K648*6+L648 -> 114 | O648: 20 | P648: 14 | Q648: =O648*6+P648 -> 134 | S648: COBURG
A649: BOX HILL | C649: 4 | D649: 4 | E649: =C649*6+D649 -> 28 | G649: 8 | H649: 8 | I649: =G649*6+H649 -> 56 | K649: 11 | L649: 10 | M649: =K649*6+L649 -> 76 | O649: 17 | P649: 13 | Q649: =O649*6+P649 -> 115
A650: BEST PLAYERS
A651: COBURG | C651: MORRISON | F651: KIRKMAN | I651: BOSCHEN | L651: SULLIVAN | O651: GALE | R651: ROWE
A652: BOX HILL | C652: BAKER | F652: COLE | I652: DAWSON | L652: BARNETT | O652: THOMPSON
A653: GOALKICKERS
A654: COBURG | C654: MORRISON 5 | F654: HIRST 3 | H654: ERWIN 3 | J654: EDWARDS 2 | M654: KIRKMAN 2 | O654: GALE | Q654: BUSBRIDGE | S654: SULLIVAN | V654: JINKS | X654: NICOL
A655: BOX HILL | C655: COLE 3 | E655: BATES 3 | G655: DAWSON 3 | I655: THOMPSON 2 | L655: ATKINSON 2 | O655: COBAIN | Q655: BARNETT | S655: SMITH | U655: BIERL
A657: SUNSHINE | C657: 4 | D657: 5 | E657: =C657*6+D657 -> 29 | G657: 6 | H657: 10 | I657: =G657*6+H657 -> 46 | K657: 12 | L657: 10 | M657: =K657*6+L657 -> 82 | O657: 14 | P657: 16 | Q657: =O657*6+P657 -> 100 | S657: NORTHCOTE
A658: NORTHCOTE | C658: 2 | D658: 2 | E658: =C658*6+D658 -> 14 | G658: 9 | H658: 7 | I658: =G658*6+H658 -> 61 | K658: 12 | L658: 11 | M658: =K658*6+L658 -> 83 | O658: 14 | P658: 15 | Q658: =O658*6+P658 -> 99
A659: BEST PLAYERS
A660: SUNSHINE | C660: BENSON | F660: BROWN | I660: McGARRITY | L660: METCHER | O660: McLEOD | R660: HIPWORTH
A661: NORTHCOTE | C661: ELLIS | F661: DEAN | I661: UNDERWOOD | L661: PITTS | O661: LESTER | R661: VINEY
A662: GOALKICKERS
A663: SUNSHINE | C663: ALLEN 4 | E663: GOOLD 2 | G663: FERGUSON 2 | J663: ROSSER 2 | L663: RUSSELL | N663: BENSON | P663: MUNROE | R663: HIPWORTH
A664: NORTHCOTE | C664: HENRY 3 | E664: QUAIFE 2 | H664: MUIR 2 | J664: WHITE 2 | L664: LESTER 2 | N664: ELLIS | P664: DEAN | R664: McGORLICK
A666: ROUND 15 | E666: 26TH JULY | J666: WEATHER | S666: PLAYED AT
D667: 1ST QTR | H667: 2ND QTR | L667: 3RD QTR | P667: FINAL | S667: PRINCES PARK, CAULFIELD
A668: COBURG | C668: 5 | D668: 3 | E668: =C668*6+D668 -> 33 | G668: 11 | H668: 5 | I668: =G668*6+H668 -> 71 | K668: 16 | L668: 16 | M668: =K668*6+L668 -> 112 | O668: 19 | P668: 22 | Q668: =O668*6+P668 -> 136 | S668: UMPIRE | X668: LADDER | AB668: ROUND | AD668: 15
A669: CAULFIELD | C669: 1 | D669: 2 | E669: =C669*6+D669 -> 8 | G669: 6 | H669: 6 | I669: =G669*6+H669 -> 42 | K669: 10 | L669: 7 | M669: =K669*6+L669 -> 67 | O669: 16 | P669: 11 | Q669: =O669*6+P669 -> 107
A670: BEST PLAYERS | W670: TEAM | X670: W | Y670: L | Z670: D | AA670: FOR | AB670: AGST | AC670: % | AD670: PTS
A671: COBURG | C671: SHALLARD | F671: JENKINS | I671: O'SULLIVAN | L671: SULLIVAN | O671: KIRKMAN | R671: HIRST
A672: CAULFIELD | C672: LOGAN | F672: FARRELLY | I672: ARRELL | L672: MARSHALL | O672: BAKER | R672: GOWANS | W672: SUNSHINE | X672: 14 | Y672: 1 | Z672: 0 | AA672: 2023 | AB672: 1183 | AC672: =(AA672*100)/AB672 -> 171.0059171597633 | AD672: =(X672*4)+(Z672*2) -> 56
A673: GOALKICKERS | O673: HIRST | W673: COBURG | X673: 14 | Y673: 1 | Z673: 0 | AA673: 1989 | AB673: 1188 | AC673: =(AA673*100)/AB673 -> 167.42424242424244 | AD673: =(X673*4)+(Z673*2) -> 56
A674: COBURG | C674: GALE 5 | E674: ERWIN 4 | G674: CHALLENGER 3 | J674: KIRKMAN 2 | M674: BUSBRIDGE 2 | P674: MORRISON | S674: SHALLARD | W674: WILLIAMSTOWN | X674: 12 | Y674: 3 | Z674: 0 | AA674: 1531 | AB674: 1070 | AC674: =(AA674*100)/AB674 -> 143.0841121495327 | AD674: =(X674*4)+(Z674*2) -> 48
A675: CAULFIELD | C675: BROWN 8 | E675: ROBINSON 4 | H675: GOWANS 2 | K675: SANDERS | N675: McGINTY | W675: NORTHCOTE | X675: 8 | Y675: 7 | Z675: 0 | AA675: 1223 | AB675: 1351 | AC675: =(AA675*100)/AB675 -> 90.52553663952628 | AD675: =(X675*4)+(Z675*2) -> 32
A677: BOX HILL | C677: 4 | D677: 3 | E677: =C677*6+D677 -> 27 | G677: 7 | H677: 7 | I677: =G677*6+H677 -> 49 | K677: 14 | L677: 13 | M677: =K677*6+L677 -> 97 | O677: 18 | P677: 15 | Q677: =O677*6+P677 -> 123 | S677: BOX HILL | W677: CAULFIELD | X677: 7 | Y677: 8 | Z677: 0 | AA677: 1439 | AB677: 1509 | AC677: =(AA677*100)/AB677 -> 95.3611663353214 | AD677: =(X677*4)+(Z677*2) -> 28
A678: NORTHCOTE | C678: 0 | D678: 3 | E678: =C678*6+D678 -> 3 | G678: 4 | H678: 6 | I678: =G678*6+H678 -> 30 | K678: 7 | L678: 6 | M678: =K678*6+L678 -> 48 | O678: 10 | P678: 16 | Q678: =O678*6+P678 -> 76 | W678: BOX HILL | X678: 7 | Y678: 8 | Z678: 0 | AA678: 1337 | AB678: 1557 | AC678: =(AA678*100)/AB678 -> 85.870263326910731 | AD678: =(X678*4)+(Z678*2) -> 28
A679: BEST PLAYERS | W679: WERRIBEE | X679: 6 | Y679: 9 | Z679: 0 | AA679: 1490 | AB679: 1434 | AC679: =(AA679*100)/AB679 -> 103.90516039051604 | AD679: =(X679*4)+(Z679*2) -> 24
A680: BOX HILL | C680: COBAIN | F680: COLE | I680: GREAVES | L680: DAWSON | O680: SMITH | Q680: BIERL | W680: FRANKSTON | X680: 4 | Y680: 11 | Z680: 0 | AA680: 1470 | AB680: 1663 | AC680: =(AA680*100)/AB680 -> 88.394467829224297 | AD680: =(X680*4)+(Z680*2) -> 16
A681: NORTHCOTE | C681: DEAN | F681: UNDERWOOD | I681: WHITE | L681: ELLIS | O681: ROSS | Q681: VIMEY | W681: MORDIALLOC | X681: 2 | Y681: 13 | Z681: 0 | AA681: 1171 | AB681: 1617 | AC681: =(AA681*100)/AB681 -> 72.418058132343845 | AD681: =(X681*4)+(Z681*2) -> 8
A682: GOALKICKERS | W682: CAMBERWELL | X682: 1 | Y682: 14 | Z682: 0 | AA682: 935 | AB682: 1950 | AC682: =(AA682*100)/AB682 -> 47.948717948717949 | AD682: =(X682*4)+(Z682*2) -> 4
A683: BOX HILL | C683: DAWSON 4 | F683: WALKER 4 | H683: BATES 3 | J683: SMITH 2 | L683: COBAIN 2 | N683: ATKINSON | P683: THOMPSON | S683: BARNETT
A684: NORTHCOTE | C684: WHITE 4 | F684: McGORLICK 2 | I684: HENRY 2 | K684: VINEY | M684: DEAN
A686: SUNSHINE | C686: 2 | D686: 3 | E686: =C686*6+D686 -> 15 | G686: 12 | H686: 6 | I686: =G686*6+H686 -> 78 | K686: 16 | L686: 9 | M686: =K686*6+L686 -> 105 | O686: 25 | P686: 13 | Q686: =O686*6+P686 -> 163 | S686: FRANKSTON
A687: FRANKSTON | C687: 4 | D687: 6 | E687: =C687*6+D687 -> 30 | G687: 6 | H687: 8 | I687: =G687*6+H687 -> 44 | K687: 14 | L687: 11 | M687: =K687*6+L687 -> 95 | O687: 15 | P687: 12 | Q687: =O687*6+P687 -> 102
A688: BEST PLAYERS
A689: SUNSHINE | C689: KENNEDY | F689: BENSON | I689: WALSH | L689: DEAN | O689: BROWN | R689: OVERS
A690: FRANKSTON | C690: ALDERSON | F690: ROSENBROCK | I690: BLAKE | L690: COUTTS | O690: McCOLL | R690: BOWES
A691: GOALKICKERS
A692: SUNSHINE | C692: ALLEN 7 | E692: WALSH 4 | G692: RUSSELL 4 | I692: FERGUSON 3 | L692: ROSSER 3 | N692: OVERS 2 | P692: KENNEDY | R692: BENSON
A693: FRANKSTON | C693: ROSENBROCK 4 | F693: McCOLL 2 | H693: COUTTS 2 | J693: VAUGHAN 2 | M693: WINSTANLEY 2 | P693: LANDRY 2 | S693: THURLEY
E694: 274TH JULY | J694: WEATHER
A695: CAMBERWELL | C695: 1 | D695: 4 | E695: =C695*6+D695 -> 10 | G695: 7 | H695: 13 | I695: =G695*6+H695 -> 55 | K695: 9 | L695: 17 | M695: =K695*6+L695 -> 71 | O695: 12 | P695: 23 | Q695: =O695*6+P695 -> 95 | S695: MORDIALLOC
A696: MORDIALLOC | C696: 4 | D696: 8 | E696: =C696*6+D696 -> 32 | G696: 7 | H696: 8 | I696: =G696*6+H696 -> 50 | K696: 12 | L696: 14 | M696: =K696*6+L696 -> 86 | O696: 13 | P696: 15 | Q696: =O696*6+P696 -> 93
A697: BEST PLAYERS
A698: CAMBERWELL | C698: D BOYD | F698: CONYERS | I698: EDWARDS | L698: BRAYNE | O698: L BOYD
A699: MORDIALLOC | C699: LANG | F699: McGUINNESS | I699: SCAIFE | L699: MATTHEWS | O699: SMITH
A700: GOALKICKERS
A701: CAMBERWELL | C701: DELANTY 3 | F701: FLOYD 2 | H701: YUNGHANS 2 | K701: L BOYD 2 | M701: BRAYNE | O701: D BOYD | Q701: EDWARDS
A702: MORDIALLOC | C702: LESLIE 3 | F702: MATTHEWS 3 | I702: JOHNSON 2 | L702: SMITH | N702: GARDINER | Q702: SCAIFE | S702: HYNES
A704: WILLIAMSTOWN | C704: 7 | D704: 3 | E704: =C704*6+D704 -> 45 | G704: 8 | H704: 10 | I704: =G704*6+H704 -> 58 | K704: 10 | L704: 14 | M704: =K704*6+L704 -> 74 | O704: 16 | P704: 15 | Q704: =O704*6+P704 -> 111 | S704: WERRIBEE
A705: WERRIBEE | C705: 2 | D705: 0 | E705: =C705*6+D705 -> 12 | G705: 6 | H705: 2 | I705: =G705*6+H705 -> 38 | K705: 8 | L705: 3 | M705: =K705*6+L705 -> 51 | O705: 10 | P705: 5 | Q705: =O705*6+P705 -> 65
A706: BEST PLAYERS
A707: WILLIAMSTOWN | C707: CAMILLIERI | F707: PERCY | I707: JOHNSON | L707: O'MARA | O707: JACKMAN | R707: MULLIGAN
A708: WERRIBEE | C708: HEMLEY | F708: PARK | I708: OGILVIE | L708: SERTORI | O708: CUNNINGHAM
A709: GOALKICKERS
A710: WILLIAMSTOWN | C710: MULLIGAN 5 | F710: ROBINSON 3 | I710: JACKMAN 3 | L710: ROWLANDS 3 | O710: CAMILLIERI | R710: VINEY
A711: WERRIBEE | C711: OGILVIE 3 | F711: CUNNINGHAM 2 | J711: CROMPTON | M711: COMBEN | O711: ELLIS | Q711: HINKLEY | S711: SHEAHAN
A713: ROUND 16 | E713: 2ND AUGUST | J713: WEATHER | S713: PLAYED AT
D714: 1ST QTR | H714: 2ND QTR | L714: 3RD QTR | P714: FINAL | S714: NORTHCOTE
A715: WERRIBEE | C715: 2 | D715: 1 | E715: =C715*6+D715 -> 13 | G715: 2 | H715: 1 | I715: =G715*6+H715 -> 13 | K715: 7 | L715: 2 | M715: =K715*6+L715 -> 44 | O715: 9 | P715: 4 | Q715: =O715*6+P715 -> 58 | S715: UMPIRE | X715: LADDER | AB715: ROUND | AD715: 16
A716: NORTHCOTE | C716: 0 | D716: 6 | E716: =C716*6+D716 -> 6 | G716: 0 | H716: 11 | I716: =G716*6+H716 -> 11 | K716: 2 | L716: 16 | M716: =K716*6+L716 -> 28 | O716: 2 | P716: 22 | Q716: =O716*6+P716 -> 34
A717: BEST PLAYERS | W717: TEAM | X717: W | Y717: L | Z717: D | AA717: FOR | AB717: AGST | AC717: % | AD717: PTS
A718: WERRIBEE | C718: OGILVIE | F718: GILLETT | I718: CROMPTON | L718: BUTTON | N718: WINTLE | Q718: LYONS
A719: NORTHCOTE | C719: PITTS | F719: ELLIS | I719: KOZARIS | L719: QUAIFE | N719: VINEY | Q719: WHITE | W719: COBURG | X719: 15 | Y719: 1 | Z719: 0 | AA719: 2150 | AB719: 1245 | AC719: =(AA719*100)/AB719 -> 172.69076305220884 | AD719: =(X719*4)+(Z719*2) -> 60
A720: GOALKICKERS | W720: SUNSHINE | X720: 15 | Y720: 1 | Z720: 0 | AA720: 2115 | AB720: 1255 | AC720: =(AA720*100)/AB720 -> 168.52589641434264 | AD720: =(X720*4)+(Z720*2) -> 60
A721: WERRIBEE | C721: LYONS 4 | F721: CROMPTON 2 | I721: CUNNINGHAM | L721: OGILVIE | N721: MONTGOMERY | W721: WILLIAMSTOWN | X721: 13 | Y721: 3 | Z721: 0 | AA721: 1703 | AB721: 1124 | AC721: =(AA721*100)/AB721 -> 151.51245551601423 | AD721: =(X721*4)+(Z721*2) -> 52
A722: NORTHCOTE | C722: WEST | F722: HENRY | W722: CAULFIELD | X722: 8 | Y722: 8 | Z722: 0 | AA722: 1564 | AB722: 1592 | AC722: =(AA722*100)/AB722 -> 98.241206030150749 | AD722: =(X722*4)+(Z722*2) -> 32
A724: CAULFIELD | C724: 4 | D724: 2 | E724: =C724*6+D724 -> 26 | G724: 7 | H724: 13 | I724: =G724*6+H724 -> 55 | K724: 10 | L724: 18 | M724: =K724*6+L724 -> 78 | O724: 17 | P724: 23 | Q724: =O724*6+P724 -> 125 | S724: FRANKSTON | W724: NORTHCOTE | X724: 8 | Y724: 8 | Z724: 0 | AA724: 1257 | AB724: 1409 | AC724: =(AA724*100)/AB724 -> 89.21220723917672 | AD724: =(X724*4)+(Z724*2) -> 32
A725: FRANKSTON | C725: 6 | D725: 7 | E725: =C725*6+D725 -> 43 | G725: 6 | H725: 9 | I725: =G725*6+H725 -> 45 | K725: 10 | L725: 11 | M725: =K725*6+L725 -> 71 | O725: 12 | P725: 11 | Q725: =O725*6+P725 -> 83 | W725: WERRIBEE | X725: 7 | Y725: 9 | Z725: 0 | AA725: 1548 | AB725: 1468 | AC725: =(AA725*100)/AB725 -> 105.44959128065395 | AD725: =(X725*4)+(Z725*2) -> 28
A726: BEST PLAYERS | W726: BOX HILL | X726: 7 | Y726: 9 | Z726: 0 | AA726: 1409 | AB726: 1649 | AC726: =(AA726*100)/AB726 -> 85.445724681625222 | AD726: =(X726*4)+(Z726*2) -> 28
A727: CAULFIELD | C727: ROBINSON | F727: ARRELL | I727: BROWN | L727: CLARK | N727: BAKER | Q727: GOWANS | W727: FRANKSTON | X727: 4 | Y727: 12 | Z727: 0 | AA727: 1553 | AB727: 1788 | AC727: =(AA727*100)/AB727 -> 86.856823266219237 | AD727: =(X727*4)+(Z727*2) -> 16
A728: FRANKSTON | C728: VAUGHAN | F728: McCOLL | I728: COUTTS | L728: ALDERSON | N728: JOHNSON | W728: MORDIALLOC | X728: 2 | Y728: 14 | Z728: 0 | AA728: 1225 | AB728: 1789 | AC728: =(AA728*100)/AB728 -> 68.474007825600893 | AD728: =(X728*4)+(Z728*2) -> 8
A729: GOALKICKERS | W729: CAMBERWELL | X729: 1 | Y729: 15 | Z729: 0 | AA729: 992 | AB729: 2111 | AC729: =(AA729*100)/AB729 -> 46.991946944576028 | AD729: =(X729*4)+(Z729*2) -> 4
A730: CAULFIELD | C730: BROWN 6 | F730: SANDERS 5 | I730: GOWANS | K730: ROBINSON | N730: SUTTIE | P730: BAKER | R730: O'DONNELL | T730: WHITE
A731: FRANKSTON | C731: ROSENBROCK 2 | F731: VAUGHAN 2 | I731: COUTTS 2 | K731: GRAHAM 2 | M731: ALDERSON | O731: McCOLL | Q731: LAWRIE | S731: NICHOLSON
E732: 3RD AUGUST | J732: WEATHER
A733: WILLIAMSTOWN | C733: 3 | D733: 7 | E733: =C733*6+D733 -> 25 | G733: 8 | H733: 12 | I733: =G733*6+H733 -> 60 | K733: 18 | L733: 15 | M733: =K733*6+L733 -> 123 | O733: 26 | P733: 16 | Q733: =O733*6+P733 -> 172 | S733: WILLIAMSTOWN
A734: MORDIALLOC | C734: 2 | D734: 1 | E734: =C734*6+D734 -> 13 | G734: 5 | H734: 4 | I734: =G734*6+H734 -> 34 | K734: 6 | L734: 5 | M734: =K734*6+L734 -> 41 | O734: 8 | P734: 6 | Q734: =O734*6+P734 -> 54
A735: BEST PLAYERS
A736: WILLIAMSTOWN | C736: PATTERSON | F736: JACKMAN | I736: PAPLEY | L736: BARNES | N736: HARVEY | Q736: O MADIGAN
A737: MORDIALLOC | C737: HARRY | F737: DURO | I737: JOHNSTONE | L737: SCAIFE | N737: MATTHEWS | Q737: LANG
A738: GOALKICKERS
A739: WILLIAMSTOWN | C739: PATTERSON 11 | F739: JACKMAN 4 | I739: HAYWARD 2 | L739: PAPLEY 2 | N739: MULLIGAN 2 | Q739: ROWLANDS 2 | T739: O MADIGAN 2 | W739: CAMILLIERI | X739: LANE
A740: MORDIALLOC | C740: HARRY 3 | F740: JOHNSTONE 2 | I740: LANG | K740: SCAIFE | M740: POWER
A742: COBURG | C742: 7 | D742: 9 | E742: =C742*6+D742 -> 51 | G742: 12 | H742: 15 | I742: =G742*6+H742 -> 87 | K742: 13 | L742: 20 | M742: =K742*6+L742 -> 98 | O742: 23 | P742: 23 | Q742: =O742*6+P742 -> 161 | S742: COBURG
A743: CAMBERWELL | C743: 1 | D743: 0 | E743: =C743*6+D743 -> 6 | G743: 3 | H743: 2 | I743: =G743*6+H743 -> 20 | K743: 7 | L743: 3 | M743: =K743*6+L743 -> 45 | O743: 9 | P743: 3 | Q743: =O743*6+P743 -> 57
A744: BEST PLAYERS
A745: COBURG | C745: GALE | F745: JENKINS | I745: ROWE | L745: KIRKMAN | N745: SULLIVAN | Q745: ERWIN
A746: CAMBERWELL | C746: D BOYD | F746: DELANTY | I746: EDWARDS | L746: BEVAN | N746: PANETTA | Q746: PITTOCK
A747: GOALKICKERS
A748: COBURG | C748: GALE 5 | E748: JENKINS 5 | G748: ERWIN 4 | I748: MORRISON 3 | L748: KIRKMAN 2 | O748: SULLIVAN | R748: BOSCHEN | T748: HIRST | V748: HUNT
A749: CAMBERWELL | C749: BRAYNE 3 | F749: DELANTY 2 | I749: FLOYD | K749: D BOYD | M749: STAFFORD | P749: ZANTUCK
A751: SUNSHINE | C751: 5 | D751: 4 | E751: =C751*6+D751 -> 34 | G751: 7 | H751: 4 | I751: =G751*6+H751 -> 46 | K751: 9 | L751: 9 | M751: =K751*6+L751 -> 63 | O751: 13 | P751: 14 | Q751: =O751*6+P751 -> 92 | S751: SUNSHINE
A752: BOX HILL | C752: 1 | D752: 3 | E752: =C752*6+D752 -> 9 | G752: 3 | H752: 7 | I752: =G752*6+H752 -> 25 | K752: 5 | L752: 8 | M752: =K752*6+L752 -> 38 | O752: 10 | P752: 12 | Q752: =O752*6+P752 -> 72
A753: BEST PLAYERS
A754: SUNSHINE | C754: BROWN | F754: BENSON | I754: METCHER | L754: BEAN | N754: RUSSELL | Q754: McGARRITY
A755: BOX HILL | C755: DAWSON | F755: FELLOWS | I755: BAKER | L755: COBAIN | N755: COLE | Q755: THOMPSON
A756: GOALKICKERS
A757: SUNSHINE | C757: WALSH 4 | F757: ALLEN 3 | I757: RUSSELL 2 | L757: DEAN | N757: BENSON | P757: ROSSER | R757: METCHER
A758: BOX HILL | C758: DAWSON 3 | F758: BATES 2 | I758: THOMPSON 2 | L758: ATKINSON | N758: COBAIN | P758: WALKER
A760: ROUND 17 | E760: 9TH AUGUST | J760: WEATHER | S760: PLAYED AT
D761: 1ST QTR | H761: 2ND QTR | L761: 3RD QTR | P761: FINAL | S761: MORDIALLOC
A762: BOX HILL | C762: 4 | D762: 3 | E762: =C762*6+D762 -> 27 | G762: 9 | H762: 7 | I762: =G762*6+H762 -> 61 | K762: 16 | L762: 11 | M762: =K762*6+L762 -> 107 | O762: 18 | P762: 19 | Q762: =O762*6+P762 -> 127 | S762: UMPIRE | X762: LADDER | AB762: ROUND | AD762: 17
A763: MORDIALLOC | C763: 6 | D763: 0 | E763: =C763*6+D763 -> 36 | G763: 10 | H763: 7 | I763: =G763*6+H763 -> 67 | K763: 12 | L763: 8 | M763: =K763*6+L763 -> 80 | O763: 15 | P763: 8 | Q763: =O763*6+P763 -> 98
A764: BEST PLAYERS | W764: TEAM | X764: W | Y764: L | Z764: D | AA764: FOR | AB764: AGST | AC764: % | AD764: PTS
A765: BOX HILL | C765: BAKER | F765: DAWSON | I765: R HARRIS | L765: ATKINSON | O765: HUNT | R765: COBAIN
A766: MORDIALLOC | C766: LITTLE | F766: HARRY | I766: JOHNSTONE | L766: LESLIE | O766: SMITH | R766: LANG | W766: COBURG | X766: 16 | Y766: 1 | Z766: 0 | AA766: 2267 | AB766: 1316 | AC766: =(AA766*100)/AB766 -> 172.26443768996961 | AD766: =(X766*4)+(Z766*2) -> 64
A767: GOALKICKERS | W767: SUNSHINE | X767: 16 | Y767: 1 | Z767: 0 | AA767: 2233 | AB767: 1364 | AC767: =(AA767*100)/AB767 -> 163.70967741935485 | AD767: =(X767*4)+(Z767*2) -> 64
A768: BOX HILL | C768: COBAIN 6 | F768: WALKER 3 | H768: THOMPSON 3 | K768: BATES 2 | M768: SMITH | O768: ABBOTT | Q768: BAKER | S768: ATKINSON | W768: WILLIAMSTOWN | X768: 14 | Y768: 3 | Z768: 0 | AA768: 1890 | AB768: 1190 | AC768: =(AA768*100)/AB768 -> 158.8235294117647 | AD768: =(X768*4)+(Z768*2) -> 56
A769: MORDIALLOC | C769: LESLIE 5 | F769: HARRY 5 | I769: JOHNSTONE 3 | L769: SCAIFE | N769: DURO | W769: CAULFIELD | X769: 8 | Y769: 9 | Z769: 0 | AA769: 1673 | AB769: 1710 | AC769: =(AA769*100)/AB769 -> 97.836257309941516 | AD769: =(X769*4)+(Z769*2) -> 32
A771: SUNSHINE | C771: 4 | D771: 1 | E771: =C771*6+D771 -> 25 | G771: 8 | H771: 6 | I771: =G771*6+H771 -> 54 | K771: 13 | L771: 9 | M771: =K771*6+L771 -> 87 | O771: 18 | P771: 10 | Q771: =O771*6+P771 -> 118 | S771: PRINCES PARK, CAULFIELD | W771: NORTHCOTE | X771: 8 | Y771: 9 | Z771: 0 | AA771: 1352 | AB771: 1510 | AC771: =(AA771*100)/AB771 -> 89.536423841059602 | AD771: =(X771*4)+(Z771*2) -> 32
A772: CAULFIELD | C772: 7 | D772: 3 | E772: =C772*6+D772 -> 45 | G772: 8 | H772: 5 | I772: =G772*6+H772 -> 53 | K772: 13 | L772: 9 | M772: =K772*6+L772 -> 87 | O772: 16 | P772: 13 | Q772: =O772*6+P772 -> 109 | W772: BOX HILL | X772: 8 | Y772: 9 | Z772: 0 | AA772: 1536 | AB772: 1747 | AC772: =(AA772*100)/AB772 -> 87.922152261018894 | AD772: =(X772*4)+(Z772*2) -> 32
A773: BEST PLAYERS | W773: WERRIBEE | X773: 7 | Y773: 10 | Z773: 0 | AA773: 1619 | AB773: 1585 | AC773: =(AA773*100)/AB773 -> 102.14511041009463 | AD773: =(X773*4)+(Z773*2) -> 28
A774: SUNSHINE | C774: KENNEDY | F774: BAWDIN | I774: McGARRITY | L774: ROSSER | O774: DARUL | Q774: WALSH | W774: FRANKSTON | X774: 4 | Y774: 13 | Z774: 0 | AA774: 1619 | AB774: 1975 | AC774: =(AA774*100)/AB774 -> 81.974683544303801 | AD774: =(X774*4)+(Z774*2) -> 16
A775: CAULFIELD | C775: GOWANS | F775: LOGAN | I775: COLLINS | L775: BAKER | O775: ARRELL | W775: MORDIALLOC | X775: 2 | Y775: 15 | Z775: 0 | AA775: 1323 | AB775: 1916 | AC775: =(AA775*100)/AB775 -> 69.050104384133618 | AD775: =(X775*4)+(Z775*2) -> 8
A776: GOALKICKERS | W776: CAMBERWELL | X776: 2 | Y776: 15 | Z776: 0 | AA776: 1093 | AB776: 2206 | AC776: =(AA776*100)/AB776 -> 49.546690843155034 | AD776: =(X776*4)+(Z776*2) -> 8
A777: SUNSHINE | C777: WALSH 5 | F777: ROSSER 3 | I777: GOOLD 3 | K777: ALLEN 2 | M777: DEAN 2 | O777: RUSSELL | Q777: WISE | S777: KENNEDY
A778: CAULFIELD | C778: BROWN 5 | F778: BAKER 3 | H778: SANDERS 2 | K778: ROBINSON 2 | N778: COLLINS 2 | P778: CURTAIN | R778: LOGAN
E779: 10TH AUGUST | J779: WEATHER
A780: WILLIAMSTOWN | C780: 8 | D780: 5 | E780: =C780*6+D780 -> 53 | G780: 16 | H780: 9 | I780: =G780*6+H780 -> 105 | K780: 25 | L780: 14 | M780: =K780*6+L780 -> 164 | O780: 28 | P780: 19 | Q780: =O780*6+P780 -> 187 | S780: WILLIAMSTOWN
A781: FRANKSTON | C781: 1 | D781: 1 | E781: =C781*6+D781 -> 7 | G781: 4 | H781: 7 | I781: =G781*6+H781 -> 31 | K781: 4 | L781: 9 | M781: =K781*6+L781 -> 33 | O781: 9 | P781: 12 | Q781: =O781*6+P781 -> 66
A782: BEST PLAYERS
A783: WILLIAMSTOWN | C783: BARNES | F783: O'MARA | I783: PATTERSON | L783: CAMILLIERI | O783: MADIGAN
A784: FRANKSTON | C784: WEST | F784: NICHOLSON | I784: VAUGHAN | L784: RENOUF | O784: COUTTS
A785: GOALKICKERS
A786: WILLIAMSTOWN | C786: PATTERSON 10 | F786: CAMILLIERI 6 | I786: MULLIGAN 4 | L786: PAPLEY 3 | N786: JACKMAN 2 | Q786: HAYWARD 2 | T786: ROWLANDS
A787: FRANKSTON | C787: ROSENBROCK 5 | F787: BISHOP | I787: BOWES | K787: COUTTS | M787: NICHOLSON
A789: CAMBERWELL | C789: 2 | D789: 3 | E789: =C789*6+D789 -> 15 | G789: 9 | H789: 6 | I789: =G789*6+H789 -> 60 | K789: 11 | L789: 8 | M789: =K789*6+L789 -> 74 | O789: 15 | P789: 11 | Q789: =O789*6+P789 -> 101 | S789: CAMBERWELL
A790: NORTHCOTE | C790: 4 | D790: 10 | E790: =C790*6+D790 -> 34 | G790: 7 | H790: 17 | I790: =G790*6+H790 -> 59 | K790: 11 | L790: 21 | M790: =K790*6+L790 -> 87 | O790: 12 | P790: 23 | Q790: =O790*6+P790 -> 95
A791: BEST PLAYERS
A792: CAMBERWELL | C792: D BOYD | F792: CONYERS | I792: TAYLOR | L792: EDWARDS | O792: L BOYD | Q792: PANETTA
A793: NORTHCOTE | C793: SMITH | F793: KOZARIS | I793: ELLIS | L793: STAFFORD | O793: VINEY | Q793: WEST
A794: GOALKICKERS
A795: CAMBERWELL | C795: YUNGHANS 4 | F795: FLOYD 3 | H795: BRAYNE 2 | J795: L BOYD 2 | L795: TAYLOR | N795: D BOYD | P795: CONYERS | S795: ZANTUCK
A796: NORTHCOTE | C796: HENRY 3 | E796: MERCURI 3 | H796: KEANE 2 | J796: HEAL | L796: McGORLICK | O796: KOZARIS | Q796: PITTS | S796: DEAN
A798: COBURG | C798: 2 | D798: 2 | E798: =C798*6+D798 -> 14 | G798: 8 | H798: 10 | I798: =G798*6+H798 -> 58 | K798: 12 | L798: 14 | M798: =K798*6+L798 -> 86 | O798: 17 | P798: 15 | Q798: =O798*6+P798 -> 117 | S798: COBURG
A799: WERRIBEE | C799: 4 | D799: 3 | E799: =C799*6+D799 -> 27 | G799: 6 | H799: 3 | I799: =G799*6+H799 -> 39 | K799: 6 | L799: 7 | M799: =K799*6+L799 -> 43 | O799: 10 | P799: 11 | Q799: =O799*6+P799 -> 71
A800: BEST PLAYERS
A801: COBURG | C801: JONES | F801: GALE | I801: KIRKMAN | L801: ROWE | O801: HUNT | R801: McLACHLAN
A802: WERRIBEE | C802: SERTORI | F802: OGILVIE | I802: MANDOLAKIS | L802: ELLIS | O802: INKSTER | R802: HINKLEY
A803: GOALKICKERS
A804: COBURG | C804: MORRISON 4 | F804: JENKINS 4 | H804: GALE 2 | J804: BUSBRIDGE 2 | M804: KIRKMAN 2 | P804: ERWIN | R804: SHALLARD | U804: HUNT
A805: WERRIBEE | C805: INKSTER 3 | F805: MONTGOMERY 2 | J805: CROMPTON 2 | M805: CUNNINGHAM | P805: ELLIS | R805: LYONS
A807: ROUND 18 | E807: 16TH AUGUST | J807: WEATHER | S807: PLAYED AT
D808: 1ST QTR | H808: 2ND QTR | L808: 3RD QTR | P808: FINAL | S808: BOX HILL
A809: BOX HILL | C809: 8 | D809: 9 | E809: =C809*6+D809 -> 57 | G809: 12 | H809: 13 | I809: =G809*6+H809 -> 85 | K809: 15 | L809: 15 | M809: =K809*6+L809 -> 105 | O809: 19 | P809: 17 | Q809: =O809*6+P809 -> 131 | S809: UMPIRE | X809: LADDER | AB809: ROUND | AD809: 18
A810: CAULFIELD | C810: 6 | D810: 2 | E810: =C810*6+D810 -> 38 | G810: 13 | H810: 4 | I810: =G810*6+H810 -> 82 | K810: 16 | L810: 7 | M810: =K810*6+L810 -> 103 | O810: 18 | P810: 12 | Q810: =O810*6+P810 -> 120
A811: BEST PLAYERS | W811: TEAM | X811: W | Y811: L | Z811: D | AA811: FOR | AB811: AGST | AC811: % | AD811: PTS
A812: BOX HILL | C812: COBAIN | F812: SMITH | I812: COLE | L812: BATES | O812: DAWSON | R812: WALKER
A813: CAULFIELD | C813: ARRELL | F813: GOWANS | I813: SANDERS | L813: BROWN | O813: ROBINSON | R813: BAKER | W813: SUNSHINE | X813: 17 | Y813: 1 | Z813: 0 | AA813: 2362 | AB813: 1441 | AC813: =(AA813*100)/AB813 -> 163.91394864677306 | AD813: =(X813*4)+(Z813*2) -> 68
A814: GOALKICKERS | W814: COBURG | X814: 16 | Y814: 2 | Z814: 0 | AA814: 2344 | AB814: 1445 | AC814: =(AA814*100)/AB814 -> 162.21453287197232 | AD814: =(X814*4)+(Z814*2) -> 64
A815: BOX HILL | C815: BATES 5 | E815: WALKER 4 | H815: DAWSON 3 | J815: SMITH 2 | L815: COBAIN 2 | N815: HUNT | P815: ATKINSON | R815: THOMPSON | W815: WILLIAMSTOWN | X815: 15 | Y815: 3 | Z815: 0 | AA815: 2013 | AB815: 1260 | AC815: =(AA815*100)/AB815 -> 159.76190476190476 | AD815: =(X815*4)+(Z815*2) -> 60
A816: CAULFIELD | C816: BROWN 5 | E816: ROBINSON 3 | H816: WHITE 3 | J816: SANDERS 2 | M816: RENOWDEN 2 | P816: CURTAIN | R816: BAKER | W816: BOX HILL | X816: 9 | Y816: 9 | Z816: 0 | AA816: 1667 | AB816: 1867 | AC816: =(AA816*100)/AB816 -> 89.287627209426887 | AD816: =(X816*4)+(Z816*2) -> 36
O817: GOWANS
A818: MORDIALLOC | C818: 4 | D818: 1 | E818: =C818*6+D818 -> 25 | G818: 9 | H818: 2 | I818: =G818*6+H818 -> 56 | K818: 13 | L818: 4 | M818: =K818*6+L818 -> 82 | O818: 16 | P818: 6 | Q818: =O818*6+P818 -> 102 | S818: WERRIBEE | W818: CAULFIELD | X818: 8 | Y818: 10 | Z818: 0 | AA818: 1793 | AB818: 1841 | AC818: =(AA818*100)/AB818 -> 97.392721347093968 | AD818: =(X818*4)+(Z818*2) -> 32
A819: WERRIBEE | C819: 3 | D819: 3 | E819: =C819*6+D819 -> 21 | G819: 9 | H819: 6 | I819: =G819*6+H819 -> 60 | K819: 13 | L819: 7 | M819: =K819*6+L819 -> 85 | O819: 15 | P819: 11 | Q819: =O819*6+P819 -> 101 | W819: NORTHCOTE | X819: 8 | Y819: 10 | Z819: 0 | AA819: 1422 | AB819: 1633 | AC819: =(AA819*100)/AB819 -> 87.078995713410905 | AD819: =(X819*4)+(Z819*2) -> 32
A820: BEST PLAYERS | W820: WERRIBEE | X820: 7 | Y820: 11 | Z820: 0 | AA820: 1720 | AB820: 1687 | AC820: =(AA820*100)/AB820 -> 101.95613515115589 | AD820: =(X820*4)+(Z820*2) -> 28
A821: MORDIALLOC | C821: HYNES | F821: HARRY | I821: SMITH | L821: CULPH | O821: DURO | R821: THOMPSON | W821: FRANKSTON | X821: 5 | Y821: 13 | Z821: 0 | AA821: 1767 | AB821: 2061 | AC821: =(AA821*100)/AB821 -> 85.735080058224156 | AD821: =(X821*4)+(Z821*2) -> 20
A822: WERRIBEE | C822: OGILVIE | F822: MONTGOMERY | I822: ELLIS | L822: KYONS | O822: SERTORI | R822: BUTTON | W822: MORDIALLOC | X822: 3 | Y822: 15 | Z822: 0 | AA822: 1425 | AB822: 2017 | AC822: =(AA822*100)/AB822 -> 70.649479424888455 | AD822: =(X822*4)+(Z822*2) -> 12
A823: GOALKICKERS | W823: CAMBERWELL | X823: 2 | Y823: 16 | Z823: 0 | AA823: 1179 | AB823: 2354 | AC823: =(AA823*100)/AB823 -> 50.08496176720476 | AD823: =(X823*4)+(Z823*2) -> 8
A824: MORDIALLOC | C824: LESLIE 4 | F824: JOHNSTONE 2 | I824: HARRY 2 | K824: ADAMS 2 | M824: SMITH 2 | O824: CULPH 2 | Q824: COOK 2
A825: WERRIBEE | C825: MONTGOMERY 8 | F825: OGILVIE 2 | I825: LYONS 2 | K825: CROMPTON | N825: ELLIS | P825: INKSTER
A827: FRANKSTON | C827: 6 | D827: 5 | E827: =C827*6+D827 -> 41 | G827: 13 | H827: 9 | I827: =G827*6+H827 -> 87 | K827: 18 | L827: 13 | M827: =K827*6+L827 -> 121 | O827: 22 | P827: 16 | Q827: =O827*6+P827 -> 148 | S827: FRANKSTON
A828: CAMBERWELL | C828: 1 | D828: 4 | E828: =C828*6+D828 -> 10 | G828: 5 | H828: 7 | I828: =G828*6+H828 -> 37 | K828: 9 | L828: 11 | M828: =K828*6+L828 -> 65 | O828: 12 | P828: 14 | Q828: =O828*6+P828 -> 86
A829: BEST PLAYERS
A830: FRANKSTON | C830: LANDRY | F830: COUTTS | I830: BISHOP | L830: NICHOLSON | O830: THURLEY | R830: WESTON
A831: CAMBERWELL | C831: TAYLOR | F831: BOYD | I831: EDWARDS | L831: CONYERS | O831: MACKINLAY | R831: FLOYD
A832: GOALKICKERS
A833: FRANKSTON | C833: ROSENBROCK 7 | F833: LANDRY 3 | I833: BISHOP 3 | K833: COUTTS 3 | M833: WESTON 3 | O833: McCOLL | Q833: NICHOLSON | S833: THURLEY
A834: CAMBERWELL | C834: YUNGHANS 4 | F834: EDWARDS 2 | I834: FLOYD 2 | K834: DELANTY | M834: TAYLOR | O834: ZANTUCK | Q834: CONYERS
E835: 17TH AUGUST | J835: WEATHER
A836: WILLIAMSTOWN | C836: 3 | D836: 3 | E836: =C836*6+D836 -> 21 | G836: 10 | H836: 6 | I836: =G836*6+H836 -> 66 | K836: 14 | L836: 11 | M836: =K836*6+L836 -> 95 | O836: 18 | P836: 15 | Q836: =O836*6+P836 -> 123 | S836: NORTHCOTE
A837: NORTHCOTE | C837: 5 | D837: 2 | E837: =C837*6+D837 -> 32 | G837: 8 | H837: 8 | I837: =G837*6+H837 -> 56 | K837: 9 | L837: 9 | M837: =K837*6+L837 -> 63 | O837: 10 | P837: 10 | Q837: =O837*6+P837 -> 70
A838: BEST PLAYERS
A839: WILLIAMSTOWN | C839: PAPLEY | F839: HARVEY | I839: O MADIGAN | L839: MITCHELL | O839: JOHNSON | R839: BARNES
A840: NORTHCOTE | C840: ELLIS | F840: UNDERWOOD | I840: KOZARIS | L840: STAFFORD | O840: RORISON | R840: DEAN
A841: GOALKICKERS
A842: WILLIAMSTOWN | C842: PATTERSON 6 | F842: PAPLEY 4 | I842: JACKMAN 4 | L842: MULLIGAN 2 | O842: PERCY | Q842: ROWLANDS
A843: NORTHCOTE | C843: DEAN 2 | E843: RORISON 2 | H843: McGORLICK 2 | K843: WHITE | M843: MUIR | O843: KOZARIS | Q843: PITTS
A845: SUNSHINE | C845: 1 | D845: 5 | E845: =C845*6+D845 -> 11 | G845: 9 | H845: 6 | I845: =G845*6+H845 -> 60 | K845: 11 | L845: 8 | M845: =K845*6+L845 -> 74 | O845: 19 | P845: 15 | Q845: =O845*6+P845 -> 129 | S845: SUNSHINE
A846: COBURG | C846: 3 | D846: 4 | E846: =C846*6+D846 -> 22 | G846: 4 | H846: 5 | I846: =G846*6+H846 -> 29 | K846: 10 | L846: 9 | M846: =K846*6+L846 -> 69 | O846: 11 | P846: 11 | Q846: =O846*6+P846 -> 77
A847: BEST PLAYERS
A848: SUNSHINE | C848: BENSON | F848: BEAN | I848: ROSSER | L848: RUSSELL | O848: DARUL | Q848: IBRAHIM
A849: COBURG | C849: ELVERY | F849: SULLIVAN | I849: BOSCHEN | L849: McLACHLAN | O849: ROWE
A850: GOALKICKERS
A851: SUNSHINE | C851: ALLEN 6 | F851: RUSSELL 4 | I851: WALSH 3 | K851: ROSSER 2 | M851: DEAN | O851: BENSON | Q851: FERGUSON | T851: METCHER
A852: COBURG | C852: JENKINS 3 | F852: SULLIVAN 2 | I852: ERWIN | K852: MORRISON | N852: EDWARDS | P852: ELVERY | R852: HIRST | T852: HUNT
A854: FINALS
A855: 1ST SEMI | E855: 24TH AUGUST | J855: WEATHER | S855: PLAYED AT
D856: 1ST QTR | H856: 2ND QTR | L856: 3RD QTR | P856: FINAL | S856: TOORAK PARK
A857: WILLIAMSTOWN | C857: 3 | D857: 6 | E857: =C857*6+D857 -> 24 | G857: 8 | H857: 7 | I857: =G857*6+H857 -> 55 | K857: 20 | L857: 14 | M857: =K857*6+L857 -> 134 | O857: 26 | P857: 18 | Q857: =O857*6+P857 -> 174 | S857: UMPIRE
A858: BOX HILL | C858: 1 | D858: 2 | E858: =C858*6+D858 -> 8 | G858: 3 | H858: 6 | I858: =G858*6+H858 -> 24 | K858: 4 | L858: 7 | M858: =K858*6+L858 -> 31 | O858: 7 | P858: 11 | Q858: =O858*6+P858 -> 53 | S858: GAMBETTA
A859: BEST PLAYERS
A860: WILLIAMSTOWN | C860: O'MARA | F860: PATTERSON | I860: PERCY | L860: BARNES | O860: HAYWARD | R860: PAPLEY
A861: BOX HILL | C861: BIERL | F861: COLE | I861: ATKINSON | L861: COBAIN | O861: PERRY | R861: CRISP
A862: GOALKICKERS
A863: WILLIAMSTOWN | C863: PATTERSON 8 | F863: MULLIGAN 5 | I863: PAPLEY 3 | K863: HAYWARD 3 | N863: SMITH 3 | P863: PAGE 2 | R863: JACKMAN | T863: BARNES
A864: BOX HILL | C864: CRISP 2 | E864: SMITH | G864: PERRY | I864: LANCASTER | L864: COBAIN | N864: THOMPSON
A866: 2ND SEMI | E866: 31ST AUGUST | J866: WEATHER
A867: SUNSHINE | C867: 4 | D867: 4 | E867: =C867*6+D867 -> 28 | G867: 11 | H867: 8 | I867: =G867*6+H867 -> 74 | K867: 16 | L867: 12 | M867: =K867*6+L867 -> 108 | O867: 19 | P867: 17 | Q867: =O867*6+P867 -> 131 | S867: TOORAK PARK
A868: COBURG | C868: 3 | D868: 2 | E868: =C868*6+D868 -> 20 | G868: 10 | H868: 4 | I868: =G868*6+H868 -> 64 | K868: 16 | L868: 7 | M868: =K868*6+L868 -> 103 | O868: 18 | P868: 13 | Q868: =O868*6+P868 -> 121 | S868: McKENZIE/HOLZER
A869: BEST PLAYERS
A870: SUNSHINE | C870: BENSON | F870: KENNEDY | I870: WALSH | L870: IBRAHIM | O870: McLEOD | R870: GOOLD
A871: COBURG | C871: GALE | F871: SPORTON | I871: ROBINSON | L871: ELVERY | O871: ERWIN | R871: ROWE
A872: GOALKICKERS
A873: SUNSHINE | C873: ALLEN 6 | F873: WALSH 5 | I873: RUSSELL 2 | K873: ROSSER 2 | M873: DEAN | O873: BENSON | Q873: GOOLD | S873: IBRAHIM
A874: COBURG | C874: SPORTON 7 | F874: ERWIN 3 | I874: ELVERY 2 | K874: SHALLARD | N874: GALE | O874: BUSBRIDGE | R874: MORRISON | U874: ROBINSON | X874: JENKINS
A876: PRLIMINARY | E876: 7TH SEPTEMBER | J876: WEATHER
A877: WILLIAMSTOWN | C877: 2 | D877: 4 | E877: =C877*6+D877 -> 16 | G877: 9 | H877: 8 | I877: =G877*6+H877 -> 62 | K877: 10 | L877: 10 | M877: =K877*6+L877 -> 70 | O877: 14 | P877: 12 | Q877: =O877*6+P877 -> 96 | S877: TOORAK PARK
A878: COBURG | C878: 4 | D878: 2 | E878: =C878*6+D878 -> 26 | G878: 4 | H878: 2 | I878: =G878*6+H878 -> 26 | K878: 6 | L878: 4 | M878: =K878*6+L878 -> 40 | O878: 8 | P878: 5 | Q878: =O878*6+P878 -> 53 | S878: GAMBETTA
A879: BEST PLAYERS
A880: WILLIAMSTOWN | C880: PERCY | F880: JOHNSON | I880: PAPLEY | L880: JACKMAN | O880: BARNES | R880: MULLIGAN
A881: COBURG | C881: CHALLLENGER | F881: ERWIN | I881: SULLIVAN | L881: GALE | O881: McLACHLAN | R881: ELVERY
A882: GOALKICKERS
A883: WILLIAMSTOWN | C883: PATTERSON 5 | F883: MULLIGAN 4 | I883: SMITH 3 | K883: HAYWARD | N883: JOHNSON
A884: COBURG | C884: ERWIN 3 | F884: KIRKMAN | I884: SPORTON | L884: ELVERY | N884: HIRST | P884: JENKINS
A886: GRAND | E886: 14TH SEPTEMBER | J886: WEATHER
A887: WILLIAMSTOWN | C887: 2 | D887: 2 | E887: =C887*6+D887 -> 14 | G887: 8 | H887: 8 | I887: =G887*6+H887 -> 56 | K887: 10 | L887: 9 | M887: =K887*6+L887 -> 69 | O887: 15 | P887: 14 | Q887: =O887*6+P887 -> 104 | S887: TOORAK PARK
A888: SUNSHINE | C888: 4 | D888: 3 | E888: =C888*6+D888 -> 27 | G888: 7 | H888: 5 | I888: =G888*6+H888 -> 47 | K888: 11 | L888: 12 | M888: =K888*6+L888 -> 78 | O888: 12 | P888: 12 | Q888: =O888*6+P888 -> 84 | S888: McMASTER
A889: BEST PLAYERS
A890: WILLIAMSTOWN
A891: SUNSHINE
A892: GOALKICKERS
A893: WILLIAMSTOWN | C893: JACKMAN 4 | F893: SMITH 3 | I893: PAPLEY 3 | K893: PAGE | M893: LANE | O893: PATTERSON | R893: HAYWARD | U893: MULLIGAN
A894: SUNSHINE | C894: ALLEN 4 | F894: IBRAHIM 2 | I894: RUSSELL | K894: BEAN | M894: DEAN | O894: KENNEDY | R894: ROSSER | U894: GOOLD