A1: Victorian Football Association
A2: Season 1970 - Division One
A3: © Copyright Wal Williams | F3: First created: 2 May 2015
A4: Contact: joywalwi at gmail dot com | F4: Last updated: 2 May 2015 | W4: VFA Results and tables - Link to the main index page
A5: You are free to copy this document in whole or part provided that proper acknowledgement is given to the author. All rights reserved.
A7: 1970 V.F.A. | B7: SEASON 1ST DIVISION | CA7: \D | CB7: {GOTO}BJ3~/M{RIGHT 7}{END}{DOWN}~G4~
A8: ROUND 1 | E8: 19TH APRIL | K8: WEATHER | O8: RAIN | S8: PLAYED AT | CB8: {GOTO}AL3~/M{END}{RIGHT}{END}{DOWN}~P3~
D9: 1ST QTR | H9: 2ND QTR | L9: 3RD QTR | P9: FINAL | S9: PRESTON | CB9: {GOTO}BJ23~/M{RIGHT 7}{END}{DOWN}~V4~
A10: PRESTON | C10: 4 | D10: 7 | E10: =C10*6+D10 -> 31 | G10: 5 | H10: 9 | I10: =G10*6+H10 -> 39 | K10: 11 | L10: 16 | M10: =K10*6+L10 -> 82 | O10: 14 | P10: 20 | Q10: =O10*6+P10 -> 104 | S10: UMPIRE | X10: LADDER | AB10: ROUND | AD10: 1 | CB10: {GOTO}BJ43~/M{RIGHT 7}{END}{DOWN}~G24~
A11: PORT MELBOURNE | C11: 0 | D11: 1 | E11: =C11*6+D11 -> 1 | G11: 6 | H11: 4 | I11: =G11*6+H11 -> 40 | K11: 8 | L11: 6 | M11: =K11*6+L11 -> 54 | O11: 12 | P11: 12 | Q11: =O11*6+P11 -> 84 | S11: O'NEILL | CB11: {GOTO}AL23~/M{END}{RIGHT}{END}{DOWN}~P23~
A12: BEST PLAYERS | W12: TEAM | X12: W | Y12: L | Z12: D | AA12: FOR | AB12: AGST | AC12: % | AD12: PTS | CB12: {GOTO}BJ63~/M{RIGHT 7}{END}{DOWN}~V24~
A13: PRESTON | C13: WEIGHTMAN | F13: HILL | I13: MARTIN | L13: REID | N13: KING | Q13: BROWNE | CB13: {GOTO}BJ83~/M{RIGHT 7}{END}{DOWN}~G44~
A14: PORT MELBOURNE | C14: GOSS | F14: GARDNER | I14: CAULFIELD | L14: BARCLAY | N14: BUCKLEY | Q14: BEHAN | W14: WAVERLEY | X14: 1 | Y14: 0 | Z14: 0 | AA14: 192 | AB14: 83 | AC14: 231.32530120481928 | AD14: 4 | CB14: {GOTO}AL43~/M{END}{RIGHT}{END}{DOWN}~P43~
A15: GOALKICKERS | W15: DANDENONG | X15: 1 | Y15: 0 | Z15: 0 | AA15: 185 | AB15: 111 | AC15: 166.66666666666666 | AD15: 4 | CB15: {GOTO}BJ103~/M{RIGHT 7}{END}{DOWN}~V44~
A16: PRESTON | C16: JOYCE 3 | E16: KING 3 | G16: REID 2 | I16: WEIGHTMAN 2 | L16: TELFORD | N16: BROWNE | P16: LESLIE | R16: MARTIN | W16: PRAHRAN | X16: 1 | Y16: 0 | Z16: 0 | AA16: 145 | AB16: 106 | AC16: 136.79245283018867 | AD16: 4 | CB16: {GOTO}BJ123~/M{RIGHT 7}{END}{DOWN}~G64~
A17: PORT MELBOURNE | C17: GOSS 4 | E17: BARCLAY 4 | H17: M ALLEN | J17: BEHAN | L17: FELDMAN | N17: PASQUILL | W17: WILLIAMSTOWN | X17: 1 | Y17: 0 | Z17: 0 | AA17: 129 | AB17: 98 | AC17: 131.63265306122449 | AD17: 4 | CB17: {GOTO}AL63~/M{END}{RIGHT}{END}{DOWN}~P63~
CB18: {GOTO}BJ143~/M{RIGHT 7}{END}{DOWN}~V64~
A19: WILLIAMSTOWN | C19: 6 | D19: 4 | E19: =C19*6+D19 -> 40 | G19: 9 | H19: 8 | I19: =G19*6+H19 -> 62 | K19: 17 | L19: 12 | M19: =K19*6+L19 -> 114 | O19: 19 | P19: 15 | Q19: =O19*6+P19 -> 129 | S19: OAKLEIGH | W19: PRESTON | X19: 1 | Y19: 0 | Z19: 0 | AA19: 104 | AB19: 84 | AC19: 123.80952380952381 | AD19: 4 | CB19: {GOTO}BJ163~/M{RIGHT 7}{END}{DOWN}~G84~
A20: OAKLEIGH | C20: 4 | D20: 6 | E20: =C20*6+D20 -> 30 | G20: 7 | H20: 6 | I20: =G20*6+H20 -> 48 | K20: 7 | L20: 7 | M20: =K20*6+L20 -> 49 | O20: 14 | P20: 14 | Q20: =O20*6+P20 -> 98 | S20: ANDERSON | W20: PORT MELBOURNE | X20: 0 | Y20: 1 | Z20: 0 | AA20: 84 | AB20: 104 | AC20: 80.769230769230774 | AD20: 0 | CB20: {GOTO}AL83~/M{END}{RIGHT}{END}{DOWN}~P83~
A21: BEST PLAYERS | W21: OAKLEIGH | X21: 0 | Y21: 1 | Z21: 0 | AA21: 98 | AB21: 129 | AC21: 75.968992248062023 | AD21: 0 | CB21: {GOTO}BJ183~/M{RIGHT 7}{END}{DOWN}~V84~
A22: WILLIAMSTOWN | C22: HAYWARD | F22: JOHNSON | I22: MITCHELL | L22: PAGE | N22: CAMILIERI | Q22: PATTERSON | W22: SANDRINGHAM | X22: 0 | Y22: 1 | Z22: 0 | AA22: 106 | AB22: 145 | AC22: 73.103448275862064 | AD22: 0 | CB22: {GOTO}BJ203~/M{RIGHT 7}{END}{DOWN}~G104~
A23: OAKLEIGH | C23: BEARD | F23: LYON | I23: SYKES | L23: STEWART | N23: JORDAN | Q23: FORD | W23: YARRAVILLE | X23: 0 | Y23: 1 | Z23: 0 | AA23: 111 | AB23: 185 | AC23: 60 | AD23: 0 | CB23: {GOTO}AL103~/M{END}{RIGHT}{END}{DOWN}~P103~
A24: GOALKICKERS | W24: GEELONG WEST | X24: 0 | Y24: 1 | Z24: 0 | AA24: 83 | AB24: 192 | AC24: 43.229166666666664 | AD24: 0 | CB24: {GOTO}BJ223~/M{RIGHT 7}{END}{DOWN}~V104~
A25: WILLIAMSTOWN | C25: PATTERSON 5 | F25: CAMILIERI 3 | I25: SMITH 3 | K25: JACKMAN 2 | N25: VINEY 2 | P25: PAGE 2 | R25: PAPLEY 2 | CB25: {GOTO}BJ243~/M{RIGHT 7}{END}{DOWN}~G124~
A26: OAKLEIGH | C26: LOTHIAN 4 | F26: HUGHES 3 | I26: BEARD 2 | K26: JOHNSON 2 | N26: LYON | P26: MURNANE | R26: JORDAN | CB26: {GOTO}AL123~/M{END}{RIGHT}{END}{DOWN}~P123~
CB27: {GOTO}BJ263~/M{RIGHT 7}{END}{DOWN}~V124~
A28: WAVERLEY | C28: 7 | D28: 7 | E28: =C28*6+D28 -> 49 | G28: 16 | H28: 8 | I28: =G28*6+H28 -> 104 | K28: 21 | L28: 15 | M28: =K28*6+L28 -> 141 | O28: 29 | P28: 18 | Q28: =O28*6+P28 -> 192 | S28: GEELONG WEST | CB28: {GOTO}BJ283~/M{RIGHT 7}{END}{DOWN}~G144~
A29: GEELONG WEST | C29: 2 | D29: 1 | E29: =C29*6+D29 -> 13 | G29: 6 | H29: 4 | I29: =G29*6+H29 -> 40 | K29: 8 | L29: 5 | M29: =K29*6+L29 -> 53 | O29: 12 | P29: 11 | Q29: =O29*6+P29 -> 83 | S29: GAMBETTA | CB29: {GOTO}AL143~/M{END}{RIGHT}{END}{DOWN}~P143~
A30: BEST PLAYERS | CB30: {GOTO}BJ303~/M{RIGHT 7}{END}{DOWN}~V144~
A31: WAVERLEY | C31: BLEW | F31: LANG | I31: EBERT | L31: PRICE | N31: ALLAN | Q31: IRISH | CB31: {GOTO}BJ323~/M{RIGHT 7}{END}{DOWN}~G164~
A32: GEELONG WEST | C32: EMOND | F32: LARKINS | I32: McKEON | L32: ROOM | N32: GILLIES | Q32: TREVASKIS | CB32: {GOTO}AL163~/M{END}{RIGHT}{END}{DOWN}~P163~
A33: GOALKICKERS | CB33: {GOTO}BJ343~/M{RIGHT 7}{END}{DOWN}~V164~
A34: WAVERLEY | C34: EBERT 8 | F34: PRICE 7 | H34: MORRIS 4 | J34: GRANT 3 | M34: HORKINGS 2 | P34: BLEW 2 | R34: BROWN | T34: POORE | V34: HARDERS | CB34: {HOME}
A35: GEELONG WEST | C35: McKEON 4 | F35: SMITH 2 | H35: ROOM 2 | J35: GILLIES 2 | M35: HISCOX | O35: STRINGER
A37: DANDENONG | C37: 9 | D37: 1 | E37: =C37*6+D37 -> 55 | G37: 17 | H37: 3 | I37: =G37*6+H37 -> 105 | K37: 22 | L37: 9 | M37: =K37*6+L37 -> 141 | O37: 29 | P37: 11 | Q37: =O37*6+P37 -> 185 | S37: DANDENONG
A38: YARRAVILLE | C38: 2 | D38: 5 | E38: =C38*6+D38 -> 17 | G38: 6 | H38: 13 | I38: =G38*6+H38 -> 49 | K38: 10 | L38: 19 | M38: =K38*6+L38 -> 79 | O38: 15 | P38: 21 | Q38: =O38*6+P38 -> 111 | S38: McKENZIE
A39: BEST PLAYERS
A40: DANDENONG | C40: JEFFRIES | F40: NANKERVIS | I40: ELLIS | L40: MILLER | O40: GUINANE | R40: STEDWELL
A41: YARRAVILLE | C41: CUMMINGS | F41: KEMP | I41: QUARANTOTTO | L41: MARTIN | O41: COOK | R41: BONGETTI
A42: GOALKICKERS
A43: DANDENONG | C43: MILLER 8 | F43: JEFFERIES 7 | I43: ELLIS 3 | K43: McDONALD 3 | N43: WALKER 2 | Q43: NANKERVIS 2 | T43: DAVENPORT | W43: STEDWELL | X43: GUINANE | AA43: HARRINGTON
A44: YARRAVILLE | C44: KEMP 9 | F44: MARTIN 2 | I44: BARR | K44: CONNELLY | N44: QUARANTOTTO | Q44: UBERGANG
A46: PRAHRAN | C46: 3 | D46: 5 | E46: =C46*6+D46 -> 23 | G46: 10 | H46: 8 | I46: =G46*6+H46 -> 68 | K46: 11 | L46: 11 | M46: =K46*6+L46 -> 77 | O46: 22 | P46: 13 | Q46: =O46*6+P46 -> 145 | S46: BEACH ROAD
A47: SANDRINGHAM | C47: 4 | D47: 1 | E47: =C47*6+D47 -> 25 | G47: 7 | H47: 2 | I47: =G47*6+H47 -> 44 | K47: 12 | L47: 10 | M47: =K47*6+L47 -> 82 | O47: 15 | P47: 16 | Q47: =O47*6+P47 -> 106 | S47: HOLZER
A48: BEST PLAYERS
A49: PRAHRAN | C49: PARKER | F49: BRADLEY | I49: ROSE | K49: HUTCHESSON | N49: EMSELLE | Q49: CAFFYN
A50: SANDRINGHAM | C50: BUSSE | F50: HOGAN | I50: STEPHENS | K50: BROWNE | N50: ELLIS | Q50: B WARD
A51: GOALKICKERS
A52: PRAHRAN | C52: PAYNE 4 | E52: KNOX 4 | G52: HUTCHESSON 4 | J52: PARKER 3 | L52: CAFFYN 2 | N52: DOWSING 2 | Q52: MURPHY | T52: EMSELLE | W52: BARTLETT
A53: SANDRINGHAM | C53: HOGAN 6 | F53: BROWNE 3 | I53: STEPHENS 2 | L53: WALFORD 2 | O53: ZEUSCHNER | R53: WATTS
A55: ROUND 2 | E55: 26TH APRIL | J55: WEATHER | N55: WEST WIND | S55: PLAYED AT
D56: 1ST QTR | H56: 2ND QTR | L56: 3RD QTR | P56: FINAL | S56: WAVERLEY
A57: WAVERLEY | C57: 3 | D57: 3 | E57: =C57*6+D57 -> 21 | G57: 9 | H57: 9 | I57: =G57*6+H57 -> 63 | K57: 10 | L57: 12 | M57: =K57*6+L57 -> 72 | O57: 15 | P57: 15 | Q57: =O57*6+P57 -> 105 | S57: UMPIRE | X57: LADDER | AB57: ROUND | AD57: 2
A58: DANDENONG | C58: 4 | D58: 3 | E58: =C58*6+D58 -> 27 | G58: 6 | H58: 6 | I58: =G58*6+H58 -> 42 | K58: 11 | L58: 9 | M58: =K58*6+L58 -> 75 | O58: 13 | P58: 12 | Q58: =O58*6+P58 -> 90 | S58: FLANAGAN
A59: BEST PLAYERS | W59: TEAM | X59: W | Y59: L | Z59: D | AA59: FOR | AB59: AGST | AC59: % | AD59: PTS
A60: WAVERLEY | C60: MORRIS | F60: HORKINGS | I60: BLEW | L60: BROWN | N60: MORDEN | Q60: LANG
A61: DANDENONG | C61: STEDWELL | F61: ABRAHAM | I61: NANKERVIS | L61: BETHKE | N61: MELAI | Q61: FLAHERTY | W61: WAVERLEY | X61: 2 | Y61: 0 | Z61: 0 | AA61: 297 | AB61: 173 | AC61: 171.67630057803467 | AD61: 8
A62: GOALKICKERS | W62: WILLIAMSTOWN | X62: 2 | Y62: 0 | Z62: 0 | AA62: 275 | AB62: 171 | AC62: 160.81871345029239 | AD62: 8
A63: WAVERLEY | C63: MORRIS 10 | F63: EBERT | H63: PRICE | J63: GRANT | L63: BROWN | N63: HARDERS | W63: PRAHRAN | X63: 2 | Y63: 0 | Z63: 0 | AA63: 255 | AB63: 200 | AC63: 127.5 | AD63: 8
A64: DANDENONG | C64: NANKERVIS 4 | F64: GUINANE 3 | I64: JEFFERIES 2 | L64: MELAI 2 | N64: MILLER | P64: KENDALL | W64: PORT MELBOURNE | X64: 1 | Y64: 1 | Z64: 0 | AA64: 245 | AB64: 172 | AC64: 142.44186046511629 | AD64: 4
A66: PRAHRAN | C66: 3 | D66: 9 | E66: =C66*6+D66 -> 27 | G66: 10 | H66: 14 | I66: =G66*6+H66 -> 74 | K66: 13 | L66: 18 | M66: =K66*6+L66 -> 96 | O66: 14 | P66: 26 | Q66: =O66*6+P66 -> 110 | S66: TOORAK PARK | W66: DANDENONG | X66: 1 | Y66: 1 | Z66: 0 | AA66: 275 | AB66: 216 | AC66: 127.31481481481481 | AD66: 4
A67: PRESTON | C67: 7 | D67: 1 | E67: =C67*6+D67 -> 43 | G67: 5 | H67: 2 | I67: =G67*6+H67 -> 32 | K67: 12 | L67: 10 | M67: =K67*6+L67 -> 82 | O67: 13 | P67: 16 | Q67: =O67*6+P67 -> 94 | S67: McMASTER | W67: SANDRINGHAM | X67: 1 | Y67: 1 | Z67: 0 | AA67: 285 | AB67: 226 | AC67: 126.10619469026548 | AD67: 4
A68: BEST PLAYERS | W68: PRESTON | X68: 1 | Y68: 1 | Z68: 0 | AA68: 198 | AB68: 194 | AC68: 102.0618556701031 | AD68: 4
A69: PRAHRAN | C69: CROWE | F69: EMSELLE | I69: VAGG | L69: DOWSING | O69: CAFFYN | Q69: ROSE | W69: OAKLEIGH | X69: 0 | Y69: 2 | Z69: 0 | AA69: 166 | AB69: 290 | AC69: 57.241379310344826 | AD69: 0
A70: PRESTON | C70: HILL | F70: WEIGHTMAN | I70: JOYCE | L70: REID | O70: KING | Q70: BROWNE | W70: YARRAVILLE | X70: 0 | Y70: 2 | Z70: 0 | AA70: 192 | AB70: 364 | AC70: 52.747252747252745 | AD70: 0
A71: GOALKICKERS | W71: GEELONG WEST | X71: 0 | Y71: 2 | Z71: 0 | AA71: 156 | AB71: 338 | AC71: 46.153846153846153 | AD71: 0
A72: PRAHRAN | C72: VAGG 5 | F72: BARTLETT 3 | I72: ROSE 2 | K72: DOWSING 2 | N72: KNOX | P72: KARANICHOLAS
A73: PRESTON | C73: JOYCE 7 | F73: WEIGHTMAN 2 | J73: McARTHUR | M73: HILL | N73: McLEAN | P73: GOAD
A75: PORT MELBOURNE | C75: 6 | D75: 4 | E75: =C75*6+D75 -> 40 | G75: 13 | H75: 8 | I75: =G75*6+H75 -> 86 | K75: 22 | L75: 15 | M75: =K75*6+L75 -> 147 | O75: 24 | P75: 17 | Q75: =O75*6+P75 -> 161 | S75: PORT MELBOURNE
A76: OAKLEIGH | C76: 2 | D76: 1 | E76: =C76*6+D76 -> 13 | G76: 5 | H76: 2 | I76: =G76*6+H76 -> 32 | K76: 6 | L76: 5 | M76: =K76*6+L76 -> 41 | O76: 9 | P76: 14 | Q76: =O76*6+P76 -> 68 | S76: GAMBETTA
A77: BEST PLAYERS
A78: PORT MELBOURNE | C78: G ALLEN | F78: BEHAN | I78: BONNETT | L78: DAVIS | N78: PHILLIPS | Q78: BUCKLEY
A79: OAKLEIGH | C79: BEARD | F79: McCORKELL | I79: SYKES | L79: LYON | N79: WAPLING | Q79: BETHUNE
A80: GOALKICKERS
A81: PORT MELBOURNE | C81: HAYES 5 | F81: GOSS 4 | H81: BARCLAY 3 | K81: PASQUILL 3 | N81: JOHN 2 | P81: ECKLUND 2 | S81: BEHAN | U81: DAVIS | W81: BUCKLEY | X81: BONNETT | AA81: PHILLIPS
A82: OAKLEIGH | C82: BEARD 4 | F82: JORDAN 2 | I82: LOTHIAN | K82: MURNANE | N82: BETHUNE
A84: SANDRINGHAM | C84: 9 | D84: 3 | E84: =C84*6+D84 -> 57 | G84: 13 | H84: 6 | I84: =G84*6+H84 -> 84 | K84: 24 | L84: 15 | M84: =K84*6+L84 -> 159 | O84: 27 | P84: 17 | Q84: =O84*6+P84 -> 179 | S84: YARRAVILLE
A85: YARRAVILLE | C85: 1 | D85: 1 | E85: =C85*6+D85 -> 7 | G85: 3 | H85: 8 | I85: =G85*6+H85 -> 26 | K85: 5 | L85: 10 | M85: =K85*6+L85 -> 40 | O85: 11 | P85: 15 | Q85: =O85*6+P85 -> 81 | S85: DUGARD
A86: BEST PLAYERS
A87: SANDRINGHAM | C87: J WARD | F87: MACKENZIE | I87: BUSSE | L87: ZEUSCHNER | O87: WILLS | R87: HOGAN
A88: YARRAVILLE | C88: CUMMINGS | F88: MARTIN | I88: MUMFORD | L88: QUARANTOTTO | O88: CHARLES | R88: COOK
A89: GOALKICKERS
A90: SANDRINGHAM | C90: ZEUSCHNER 8 | F90: STEPHENS 4 | I90: J WARD 4 | L90: HOGAN 3 | N90: BROWNE 3 | Q90: WALFORD 2 | T90: HUTCHINSON 2 | X90: WATTS
A91: YARRAVILLE | C91: MARTIN 3 | F91: QUARANTOTTO 2 | J91: COOK 2 | L91: BONGETTI | N91: SMITH | P91: TAURENS | R91: McMILLAN
A93: WILLIAMSTOWN | C93: 8 | D93: 4 | E93: =C93*6+D93 -> 52 | G93: 14 | H93: 10 | I93: =G93*6+H93 -> 94 | K93: 18 | L93: 16 | M93: =K93*6+L93 -> 124 | O93: 21 | P93: 20 | Q93: =O93*6+P93 -> 146 | S93: WILLIAMSTOWN
A94: GEELONG WEST | C94: 1 | D94: 2 | E94: =C94*6+D94 -> 8 | G94: 1 | H94: 6 | I94: =G94*6+H94 -> 12 | K94: 8 | L94: 8 | M94: =K94*6+L94 -> 56 | O94: 10 | P94: 13 | Q94: =O94*6+P94 -> 73 | S94: PASK
A95: BEST PLAYERS
A96: WILLIAMSTOWN | C96: PAPLEY | F96: JACKMAN | I96: JOHNSON | L96: JONES | O96: HARVEY | R96: BARNES
A97: GEELONG WEST | C97: SMITH | F97: BARRY | I97: LARKINS | L97: GILLIES | O97: EMOND | R97: McKEON
A98: GOALKICKERS
A99: WILLIAMSTOWN | C99: PAPLEY 8 | F99: PATTERSON 5 | I99: JACKMAN 3 | L99: PAGE 2 | N99: SMITH | P99: HAYWARD | R99: STARK
A100: GEELONG WEST | C100: GILLIES 4 | F100: McKEON 3 | I100: SMITH | K100: STRINGER | N100: DEEATH
A102: ROUND 3 | E102: 3RD MAY | J102: WEATHER | M102: SOUTH WEST WIND SHOWER | S102: PLAYED AT
D103: 1ST QTR | H103: 2ND QTR | L103: 3RD QTR | P103: FINAL | S103: TOORAK PARK
A104: PRAHRAN | C104: 6 | D104: 4 | E104: =C104*6+D104 -> 40 | G104: 11 | H104: 7 | I104: =G104*6+H104 -> 73 | K104: 19 | L104: 12 | M104: =K104*6+L104 -> 126 | O104: 22 | P104: 17 | Q104: =O104*6+P104 -> 149 | S104: UMPIRE | X104: LADDER | AB104: ROUND | AD104: 3
A105: WAVERLEY | C105: 2 | D105: 2 | E105: =C105*6+D105 -> 14 | G105: 2 | H105: 9 | I105: =G105*6+H105 -> 21 | K105: 3 | L105: 9 | M105: =K105*6+L105 -> 27 | O105: 8 | P105: 12 | Q105: =O105*6+P105 -> 60 | S105: TURNER
A106: BEST PLAYERS | W106: TEAM | X106: W | Y106: L | Z106: D | AA106: FOR | AB106: AGST | AC106: % | AD106: PTS
A107: PRAHRAN | C107: CAFFYN | F107: EMSELLE | I107: PARKER | L107: ROSE | N107: HUTCHESSON | Q107: CROWE
A108: WAVERLEY | C108: SYKES | F108: GRANT | I108: LANG | L108: BROWN | N108: BLEW | Q108: ALLAN | W108: PRAHRAN | X108: 3 | Y108: 0 | Z108: 0 | AA108: 404 | AB108: 260 | AC108: 155.38461538461539 | AD108: 12
A109: GOALKICKERS | P109: EMSELLE | W109: WILLIAMSTOWN | X109: 3 | Y109: 0 | Z109: 0 | AA109: 367 | AB109: 244 | AC109: 150.40983606557376 | AD109: 12
A110: PRAHRAN | C110: HUTCHESSON 4 | F110: PARKER 4 | I110: CAFFYN 3 | K110: BARTLETT 3 | N110: ROSE 3 | P110: DIXON 2 | R110: KNOX | T110: VAGG | W110: SANDRINGHAM | X110: 2 | Y110: 1 | Z110: 0 | AA110: 395 | AB110: 333 | AC110: 118.61861861861861 | AD110: 8
A111: WAVERLEY | C111: MORRIS 3 | F111: GRANT 2 | I111: EBERT | K111: POORE | M111: McGOWAN | W111: WAVERLEY | X111: 2 | Y111: 1 | Z111: 0 | AA111: 357 | AB111: 322 | AC111: 110.8695652173913 | AD111: 8
A113: SANDRINGHAM | C113: 4 | D113: 2 | E113: =C113*6+D113 -> 26 | G113: 6 | H113: 8 | I113: =G113*6+H113 -> 44 | K113: 11 | L113: 11 | M113: =K113*6+L113 -> 77 | O113: 16 | P113: 14 | Q113: =O113*6+P113 -> 110 | S113: BEACH ROAD | W113: PRESTON | X113: 2 | Y113: 1 | Z113: 0 | AA113: 279 | AB113: 269 | AC113: 103.71747211895911 | AD113: 8
A114: PORT MELBOURNE | C114: 4 | D114: 4 | E114: =C114*6+D114 -> 28 | G114: 8 | H114: 9 | I114: =G114*6+H114 -> 57 | K114: 11 | L114: 13 | M114: =K114*6+L114 -> 79 | O114: 15 | P114: 17 | Q114: =O114*6+P114 -> 107 | S114: ANDERSON | W114: PORT MELBOURNE | X114: 1 | Y114: 2 | Z114: 0 | AA114: 352 | AB114: 282 | AC114: 124.822695035461 | AD114: 4
A115: BEST PLAYERS | W115: DANDENONG | X115: 1 | Y115: 2 | Z115: 0 | AA115: 350 | AB115: 297 | AC115: 117.84511784511784 | AD115: 4
A116: SANDRINGHAM | C116: WALFORD | F116: EVANS | I116: K WILLS | L116: HOGAN | N116: STEPHENS | Q116: ELLIS | W116: GEELONG WEST | X116: 1 | Y116: 2 | Z116: 0 | AA116: 253 | AB116: 428 | AC116: 59.112149532710283 | AD116: 4
A117: PORT MELBOURNE | C117: GOSS | F117: HAYES | I117: BARCLAY | L117: BEHAN | N117: GROVER | Q117: BONNETT | W117: OAKLEIGH | X117: 0 | Y117: 3 | Z117: 0 | AA117: 256 | AB117: 387 | AC117: 66.149870801033586 | AD117: 0
A118: GOALKICKERS | W118: YARRAVILLE | X118: 0 | Y118: 3 | Z118: 0 | AA118: 265 | AB118: 456 | AC118: 58.114035087719301 | AD118: 0
A119: SANDRINGHAM | C119: HOGAN 4 | F119: STEPHENS 4 | I119: WATTS 3 | K119: BROWNE | M119: WALFORD | O119: AUSTIN | Q119: HUTCHINSON | T119: AUSTIN
A120: PORT MELBOURNE | C120: HAYES 4 | F120: GOSS 3 | H120: BARCLAY 2 | K120: BEHAN 2 | M120: JOHN 2 | O120: FELDMAN | Q120: PHILLIPS
A122: PRESTON | C122: 5 | D122: 3 | E122: =C122*6+D122 -> 33 | G122: 7 | H122: 7 | I122: =G122*6+H122 -> 49 | K122: 9 | L122: 9 | M122: =K122*6+L122 -> 63 | O122: 11 | P122: 15 | Q122: =O122*6+P122 -> 81 | S122: DANDENONG
A123: DANDENONG | C123: 1 | D123: 1 | E123: =C123*6+D123 -> 7 | G123: 4 | H123: 2 | I123: =G123*6+H123 -> 26 | K123: 10 | L123: 5 | M123: =K123*6+L123 -> 65 | O123: 11 | P123: 9 | Q123: =O123*6+P123 -> 75 | S123: PASK
A124: BEST PLAYERS
A125: PRESTON | C125: MARTIN | F125: SCHICKERT | I125: WEIGHTMAN | L125: REID | O125: HILL | R125: MERCURI
A126: DANDENONG | C126: DAVENPORT | F126: MILLER | I126: STEDWELL | L126: GUINANE | O126: NANKERVIS | R126: McNAMARA
A127: GOALKICKERS
A128: PRESTON | C128: REID 2 | F128: WEIGHTMAN 2 | I128: MERCURI 2 | L128: JOYCE | N128: KING | P128: MARTIN | R128: HILL | T128: McLEAN
A129: DANDENONG | C129: MILLER 6 | F129: NANKERVIS 2 | I129: GUINANE | K129: HARRINGTON | N129: TONKS
A131: GEELONG WEST | C131: 4 | D131: 4 | E131: =C131*6+D131 -> 28 | G131: 6 | H131: 12 | I131: =G131*6+H131 -> 48 | K131: 7 | L131: 16 | M131: =K131*6+L131 -> 58 | O131: 13 | P131: 19 | Q131: =O131*6+P131 -> 97 | S131: GEELONG WEST
A132: OAKLEIGH | C132: 3 | D132: 9 | E132: =C132*6+D132 -> 27 | G132: 9 | H132: 10 | I132: =G132*6+H132 -> 64 | K132: 12 | L132: 15 | M132: =K132*6+L132 -> 87 | O132: 12 | P132: 18 | Q132: =O132*6+P132 -> 90 | S132: DUGARD
A133: BEST PLAYERS
A134: GEELONG WEST | C134: PIEC | F134: GILLIES | I134: LARKINS | L134: BRYANT | N134: DEEATH | Q134: ZURAWEL
A135: OAKLEIGH | C135: QUINN | F135: BETHUNE | I135: BEARD | L135: SYKES | N135: FORD | Q135: KING
A136: GOALKICKERS
A137: GEELONG WEST | C137: GILLIES 6 | F137: PIEC 3 | H137: STRINGER 2 | K137: SMITH | M137: BARRY
A138: OAKLEIGH | C138: QUINN 3 | F138: BETHUNE 2 | I138: BEARD 2 | K138: ARON | M138: FORD | N138: ROBERTS | P138: HAYNE | R138: CUMMINGS
A140: WILLIAMSTOWN | C140: 4 | D140: 0 | E140: =C140*6+D140 -> 24 | G140: 9 | H140: 4 | I140: =G140*6+H140 -> 58 | K140: 11 | L140: 4 | M140: =K140*6+L140 -> 70 | O140: 14 | P140: 8 | Q140: =O140*6+P140 -> 92 | S140: WILLIAMSTOWN
A141: YARRAVILLE | C141: 4 | D141: 6 | E141: =C141*6+D141 -> 30 | G141: 6 | H141: 7 | I141: =G141*6+H141 -> 43 | K141: 9 | L141: 10 | M141: =K141*6+L141 -> 64 | O141: 10 | P141: 13 | Q141: =O141*6+P141 -> 73 | S141: HOLZER
A142: BEST PLAYERS
A143: WILLIAMSTOWN | C143: STARK | F143: CAMILLIERI | I143: BARNES | L143: PAGE | N143: SMITH | Q143: WHITTINGTON
A144: YARRAVILLE | C144: MADIGAN | F144: MUMFORD | I144: MARTIN | L144: COOK | N144: TAURENS | Q144: QUARANTOTTO
A145: GOALKICKERS
A146: WILLIAMSTOWN | C146: PATTERSON 4 | F146: PAPLEY 3 | I146: STARK 3 | K146: CAMILERI 2 | N146: SMITH | P146: MEYERS
A147: YARRAVILLE | C147: KEMP 3 | F147: MADIGAN 3 | I147: WAGHORNE 2 | L147: QUARANTOTTO | O147: COLE
A149: ROUND 4 | D149: 9TH MAY | J149: WEATHER | M149: N BREEZE FINE SUNNY | S149: PLAYED AT
D150: 1ST QTR | H150: 2ND QTR | L150: 3RD QTR | P150: FINAL | S150: WAVERLEY
A151: WILLIAMSTOWN | C151: 3 | D151: 4 | E151: =C151*6+D151 -> 22 | G151: 7 | H151: 5 | I151: =G151*6+H151 -> 47 | K151: 13 | L151: 10 | M151: =K151*6+L151 -> 88 | O151: 18 | P151: 12 | Q151: =O151*6+P151 -> 120 | S151: UMPIRE | X151: LADDER | AB151: ROUND | AD151: 4
A152: WAVERLEY | C152: 5 | D152: 1 | E152: =C152*6+D152 -> 31 | G152: 9 | H152: 8 | I152: =G152*6+H152 -> 62 | K152: 11 | L152: 12 | M152: =K152*6+L152 -> 78 | O152: 15 | P152: 16 | Q152: =O152*6+P152 -> 106 | S152: McMASTER
A153: BEST PLAYERS | W153: TEAM | X153: W | Y153: L | Z153: D | AA153: FOR | AB153: AGST | AC153: % | AD153: PTS
A154: WILLIAMSTOWN | C154: CAMILLIERI | F154: O'MARA | I154: PATTERSON | L154: JACKMAN | O154: STARK | R154: RUSSELL
A155: WAVERLEY | C155: STONE | F155: STEPHENS | I155: EBERT | L155: BLEW | O155: HORKINGS | R155: PETZKE | W155: WILLIAMSTOWN | X155: 4 | Y155: 0 | Z155: 0 | AA155: 487 | AB155: 350 | AC155: 139.14285714285714 | AD155: 16
A156: GOALKICKERS | W156: PRAHRAN | X156: 3 | Y156: 1 | Z156: 0 | AA156: 480 | AB156: 345 | AC156: 139.13043478260869 | AD156: 12
A157: WILLIAMSTOWN | C157: PATTERSON 6 | F157: JACKMAN 4 | I157: PAGE 3 | K157: CAMILLIERI 2 | N157: MEYERS 2 | Q157: HAYWARD | W157: SANDRINGHAM | X157: 3 | Y157: 1 | Z157: 0 | AA157: 499 | AB157: 435 | AC157: 114.71264367816092 | AD157: 12
A158: WAVERLEY | C158: EBERT 4 | F158: POORE 4 | I158: MORRIS 2 | K158: STONE 2 | M158: GRANT | O158: BROWN | Q158: PITTS | W158: PORT MELBOURNE | X158: 2 | Y158: 2 | Z158: 0 | AA158: 437 | AB158: 358 | AC158: 122.06703910614524 | AD158: 8
D159: 10TH MAY | J159: WEATHER | M159: NORTH WIND
A160: SANDRINGHAM | C160: 2 | D160: 0 | E160: =C160*6+D160 -> 12 | G160: 6 | H160: 6 | I160: =G160*6+H160 -> 42 | K160: 9 | L160: 9 | M160: =K160*6+L160 -> 63 | O160: 15 | P160: 14 | Q160: =O160*6+P160 -> 104 | S160: PRESTON | W160: DANDENONG | X160: 2 | Y160: 2 | Z160: 0 | AA160: 456 | AB160: 375 | AC160: 121.6 | AD160: 8
A161: PRESTON | C161: 4 | D161: 5 | E161: =C161*6+D161 -> 29 | G161: 9 | H161: 6 | I161: =G161*6+H161 -> 60 | K161: 13 | L161: 10 | M161: =K161*6+L161 -> 88 | O161: 15 | P161: 12 | Q161: =O161*6+P161 -> 102 | S161: GAMBETTA | W161: WAVERLEY | X161: 2 | Y161: 2 | Z161: 0 | AA161: 463 | AB161: 442 | AC161: 104.75113122171946 | AD161: 8
A162: BEST PLAYERS | W162: PRESTON | X162: 2 | Y162: 2 | Z162: 0 | AA162: 381 | AB162: 373 | AC162: 102.14477211796246 | AD162: 8
A163: SANDRINGHAM | C163: J WARD | E163: MACKENZIE | H163: EVANS | K163: ROBINSON | N163: LOCKHART | Q163: STEPHENS | W163: GEELONG WEST | X163: 2 | Y163: 2 | Z163: 0 | AA163: 371 | AB163: 538 | AC163: 68.959107806691449 | AD163: 8
A164: PRESTON | C164: JOYCE | E164: WEIGHTMAN | H164: FISHER | K164: HILL | N164: SCHICKERT | Q164: A PERRY | W164: OAKLEIGH | X164: 0 | Y164: 4 | Z164: 0 | AA164: 334 | AB164: 493 | AC164: 67.748478701825562 | AD164: 0
A165: GOALKICKERS | W165: YARRAVILLE | X165: 0 | Y165: 4 | Z165: 0 | AA165: 375 | AB165: 574 | AC165: 65.331010452961678 | AD165: 0
A166: SANDRINGHAM | C166: ROBINSON 5 | F166: HOGAN 2 | H166: STEPHENS 2 | K166: ZEUSCHNER 2 | N166: WATTS | P166: DIXON | R166: EVANS | T166: SAMPSON
A167: PRESTON | C167: JOYCE 5 | F167: KING 2 | H167: CHAPMAN 2 | K167: HILL 2 | M167: REID | N167: WEIGHTMAN | Q167: McARTHUR | T167: McLEAN
A169: PORT MELBOURNE | C169: 1 | D169: 4 | E169: =C169*6+D169 -> 10 | G169: 6 | H169: 14 | I169: =G169*6+H169 -> 50 | K169: 8 | L169: 16 | M169: =K169*6+L169 -> 64 | O169: 11 | P169: 19 | Q169: =O169*6+P169 -> 85 | S169: PORT MELBOURNE
A170: PRAHRAN | C170: 2 | D170: 5 | E170: =C170*6+D170 -> 17 | G170: 3 | H170: 6 | I170: =G170*6+H170 -> 24 | K170: 7 | L170: 9 | M170: =K170*6+L170 -> 51 | O170: 10 | P170: 16 | Q170: =O170*6+P170 -> 76 | S170: McKENZIE
A171: BEST PLAYERS
A172: PORT MELBOURNE | C172: GOSS | F172: BEHAN | I172: JOHN | L172: MALLETT | O172: HAYES | Q172: PHILLIPS
A173: PRAHRAN | C173: DICKESON | F173: HUTCHESSON | I173: CROWE | L173: McKENZIE | O173: DIXON | Q173: CAFFYN
A174: GOALKICKERS
A175: PORT MELBOURNE | C175: HAYES 3 | F175: GOSS 2 | H175: PHILLIPS 2 | K175: BARCLAY | M175: BEHAN | O175: JOHN | Q175: AANENSEN
A176: PRAHRAN | C176: HUTCHESSON 2 | F176: VAGG 2 | H176: MCKENZIE 2 | K176: CAFFYN | M176: MURPHY | O176: EMSELLE | Q176: BARTLETT
A178: DANDENONG | C178: 5 | D178: 3 | E178: =C178*6+D178 -> 33 | G178: 8 | H178: 8 | I178: =G178*6+H178 -> 56 | K178: 11 | L178: 12 | M178: =K178*6+L178 -> 78 | O178: 15 | P178: 16 | Q178: =O178*6+P178 -> 106 | S178: OAKLEIGH
A179: OAKLEIGH | C179: 2 | D179: 3 | E179: =C179*6+D179 -> 15 | G179: 7 | H179: 4 | I179: =G179*6+H179 -> 46 | K179: 8 | L179: 7 | M179: =K179*6+L179 -> 55 | O179: 11 | P179: 12 | Q179: =O179*6+P179 -> 78 | S179: O'NEILL
A180: BEST PLAYERS
A181: DANDENONG | C181: STEDWELL | F181: ABRAHAM | I181: FLAHERTY | L181: NANKERVIS | O181: SHEEHAN | R181: MILLER
A182: OAKLEIGH | C182: ROBERTS | F182: BEARD | I182: FORD | L182: SYKES | O182: BILLINGS | R182: BONESS
A183: GOALKICKERS
A184: DANDENONG | C184: MILLER 4 | F184: GUINANE 3 | I184: NANKERVIS 2 | L184: DAVENPORT 2 | O184: FLAHERTY 2 | R184: KENDALL | U184: SHEEHAN
A185: OAKLEIGH | C185: ARON 4 | F185: BETHUNE 3 | I185: KING | K185: SYKES | M185: BEARD | O185: M QUINN
A187: GEELONG WEST | C187: 5 | D187: 2 | E187: =C187*6+D187 -> 32 | G187: 8 | H187: 10 | I187: =G187*6+H187 -> 58 | K187: 10 | L187: 13 | M187: =K187*6+L187 -> 73 | O187: 17 | P187: 16 | Q187: =O187*6+P187 -> 118 | S187: YARRAVILLE
A188: YARRAVILLE | C188: 6 | D188: 4 | E188: =C188*6+D188 -> 40 | G188: 6 | H188: 5 | I188: =G188*6+H188 -> 41 | K188: 15 | L188: 6 | M188: =K188*6+L188 -> 96 | O188: 17 | P188: 8 | Q188: =O188*6+P188 -> 110 | S188: ANDERSON
A189: BEST PLAYERS
A190: GEELONG WEST | C190: M FRY | F190: BRYANT | I190: TENABEL | K190: EMOND | N190: SMITH | Q190: PIEC
A191: YARRAVILLE | C191: COOK | F191: HERIOT | I191: HEYME | K191: CHARLES | N191: MARTIN | Q191: BURGE
A192: GOALKICKERS
A193: GEELONG WEST | C193: M FRY 5 | F193: PIEC 3 | H193: SMITH 2 | J193: DEEATH 2 | M193: TENABEL 2 | P193: GILLIES | R193: STRINGER | U193: BRYANT
A194: YARRAVILLE | C194: HERIOT 7 | F194: COLE 4 | H194: BONGETTI 3 | K194: MARTIN | M194: COOK | O194: WAGHORNE
A196: ROUND 5 | E196: 17TH MAY | J196: WEATHER | N196: RAIN | S196: PLAYED AT
D197: 1ST QTR | H197: 2ND QTR | L197: 3RD QTR | P197: FINAL | S197: WILLIAMSTOWN
A198: WILLIAMSTOWN | C198: 6 | D198: 4 | E198: =C198*6+D198 -> 40 | G198: 7 | H198: 5 | I198: =G198*6+H198 -> 47 | K198: 13 | L198: 13 | M198: =K198*6+L198 -> 91 | O198: 15 | P198: 16 | Q198: =O198*6+P198 -> 106 | S198: UMPIRE | X198: LADDER | AB198: ROUND | AD198: 5
A199: PRAHRAN | C199: 1 | D199: 0 | E199: =C199*6+D199 -> 6 | G199: 7 | H199: 5 | I199: =G199*6+H199 -> 47 | K199: 8 | L199: 6 | M199: =K199*6+L199 -> 54 | O199: 10 | P199: 11 | Q199: =O199*6+P199 -> 71 | S199: O'NEILL
A200: BEST PLAYERS | W200: TEAM | X200: W | Y200: L | Z200: D | AA200: FOR | AB200: AGST | AC200: % | AD200: PTS
A201: WILLIAMSTOWN | C201: CAMILLIERI | F201: WHITTINGTON | I201: VAN LIEMPD | L201: PAGE | N201: HAYWARD | Q201: MEYERS
A202: PRAHRAN | C202: CROWE | F202: DIXON | I202: EMSELLE | L202: PARKER | N202: McKENZIE | Q202: HUTCHESSON
A203: GOALKICKERS | R203: PERCY | W203: WILLIAMSTOWN | X203: 5 | Y203: 0 | Z203: 0 | AA203: 593 | AB203: 421 | AC203: 140.85510688836104 | AD203: 20
A204: WILLIAMSTOWN | C204: CAMILLIERI 4 | F204: PAGE 3 | H204: VAN LIEMPD 2 | K204: PATTERSON | N204: JACKMAN | P204: HAYWARD | R204: STARK | T204: MEYERS | W204: SANDRINGHAM | X204: 4 | Y204: 1 | Z204: 0 | AA204: 599 | AB204: 510 | AC204: 117.45098039215686 | AD204: 16
A205: PRAHRAN | C205: KNOX | E205: HUTCHESSON | H205: CAFFYN | J205: MURPHY | L205: EMSELLE | N205: VAGG | P205: DIXON | R205: CROWE | T205: POWER | W205: PORT MELBOURNE | X205: 3 | Y205: 2 | Z205: 0 | AA205: 557 | AB205: 412 | AC205: 135.19417475728156 | AD205: 12
W206: DANDENONG | X206: 3 | Y206: 2 | Z206: 0 | AA206: 574 | AB206: 443 | AC206: 129.57110609480813 | AD206: 12
A207: WAVERLEY | C207: 3 | D207: 3 | E207: =C207*6+D207 -> 21 | G207: 5 | H207: 8 | I207: =G207*6+H207 -> 38 | K207: 9 | L207: 9 | M207: =K207*6+L207 -> 63 | O207: 12 | P207: 13 | Q207: =O207*6+P207 -> 85 | S207: WAVERLEY
A208: PRESTON | C208: 2 | D208: 2 | E208: =C208*6+D208 -> 14 | G208: 3 | H208: 3 | I208: =G208*6+H208 -> 21 | K208: 5 | L208: 5 | M208: =K208*6+L208 -> 35 | O208: 6 | P208: 6 | Q208: =O208*6+P208 -> 42 | S208: TURNER | W208: PRAHRAN | X208: 3 | Y208: 2 | Z208: 0 | AA208: 551 | AB208: 451 | AC208: 122.17294900221729 | AD208: 12
A209: BEST PLAYERS | W209: WAVERLEY | X209: 3 | Y209: 2 | Z209: 0 | AA209: 548 | AB209: 484 | AC209: 113.22314049586777 | AD209: 12
A210: WAVERLEY | C210: SYKES | E210: BLEW | H210: ALLAN | K210: STEPHENS | N210: BACKHOUSE | Q210: PITTS | W210: PRESTON | X210: 2 | Y210: 3 | Z210: 0 | AA210: 423 | AB210: 458 | AC210: 92.358078602620083 | AD210: 8
A211: PRESTON | C211: HILL | E211: REID | H211: FISHER | K211: LESLIE | N211: GOAD | Q211: WEIGHTMAN | W211: GEELONG WEST | X211: 2 | Y211: 3 | Z211: 0 | AA211: 439 | AB211: 656 | AC211: 66.920731707317074 | AD211: 8
A212: GOALKICKERS | W212: OAKLEIGH | X212: 0 | Y212: 5 | Z212: 0 | AA212: 409 | AB212: 593 | AC212: 68.971332209106237 | AD212: 0
A213: WAVERLEY | C213: MORRIS 3 | F213: HARDERS 3 | I213: POORE 2 | K213: PITTS 2 | M213: BLEW | O213: BACKHOUSE | W213: YARRAVILLE | X213: 0 | Y213: 5 | Z213: 0 | AA213: 429 | AB213: 694 | AC213: 61.815561959654175 | AD213: 0
A214: PRESTON | C214: WEIGHTMAN 2 | F214: LESLIE 2 | I214: REID | K214: GOAD
A216: DANDENONG | C216: 3 | D216: 5 | E216: =C216*6+D216 -> 23 | G216: 9 | H216: 7 | I216: =G216*6+H216 -> 61 | K216: 15 | L216: 13 | M216: =K216*6+L216 -> 103 | O216: 17 | P216: 16 | Q216: =O216*6+P216 -> 118 | S216: DANDENONG
A217: GEELONG WEST | C217: 1 | D217: 3 | E217: =C217*6+D217 -> 9 | G217: 2 | H217: 8 | I217: =G217*6+H217 -> 20 | K217: 5 | L217: 11 | M217: =K217*6+L217 -> 41 | O217: 9 | P217: 14 | Q217: =O217*6+P217 -> 68 | S217: HOLZER
A218: BEST PLAYERS
A219: DANDENONG | C219: KENDALL | F219: ESLER | I219: DAVENPORT | L219: NANKERVIS | O219: ABRAHAM | R219: MELAI
A220: GEELONG WEST | C220: BRYANT | F220: SMITH | I220: ANDJELKOVIC | L220: LARKINS | O220: RENABEL | R220: EMOND
A221: GOALKICKERS
A222: DANDENONG | C222: NANKERVIS 5 | F222: MILLER 4 | I222: FLAHERTY 3 | L222: DAVENPORT 2 | O222: McDONALD | R222: GUINANE | U222: SHEEHAN
A223: GEELONG WEST | C223: SMITH 3 | F223: PIEC 3 | H223: GILLIES 2 | J223: LARKINS
A225: SANDRINGHAM | C225: 2 | D225: 2 | E225: =C225*6+D225 -> 14 | G225: 7 | H225: 6 | I225: =G225*6+H225 -> 48 | K225: 11 | L225: 13 | M225: =K225*6+L225 -> 79 | O225: 13 | P225: 22 | Q225: =O225*6+P225 -> 100 | S225: BEACH ROAD
A226: OAKLEIGH | C226: 2 | D226: 5 | E226: =C226*6+D226 -> 17 | G226: 3 | H226: 9 | I226: =G226*6+H226 -> 27 | K226: 6 | L226: 14 | M226: =K226*6+L226 -> 50 | O226: 10 | P226: 15 | Q226: =O226*6+P226 -> 75 | S226: DUGARD
A227: BEST PLAYERS
A228: SANDRINGHAM | C228: BROWNE | F228: WALFORD | I228: STEPHENS | L228: EVANS | O228: K WILLS | R228: ZEUSCHNER
A229: OAKLEIGH | C229: LINNELL | F229: FORD | I229: ROBERTS | L229: BEARD | O229: STEPHENS | R229: BONESS
A230: GOALKICKERS
A231: SANDRINGHAM | C231: ZEUSCHNER 4 | F231: WALFORD 3 | I231: SAMPSON 2 | L231: WATTS 2 | N231: J WARD | P231: STEPHENS
A232: OAKLEIGH | C232: FORD 2 | F232: CUMMINGS 2 | I232: ROBERTS | K232: ARON | M232: KING | O232: BEARD | Q232: BETHUNE | S232: QUINN
A234: PORT MELBOURNE | C234: 1 | D234: 0 | E234: =C234*6+D234 -> 6 | G234: 9 | H234: 6 | I234: =G234*6+H234 -> 60 | K234: 13 | L234: 9 | M234: =K234*6+L234 -> 87 | O234: 18 | P234: 12 | Q234: =O234*6+P234 -> 120 | S234: YARRAVILLE
A235: YARRAVILLE | C235: 2 | D235: 5 | E235: =C235*6+D235 -> 17 | G235: 4 | H235: 6 | I235: =G235*6+H235 -> 30 | K235: 7 | L235: 10 | M235: =K235*6+L235 -> 52 | O235: 7 | P235: 12 | Q235: =O235*6+P235 -> 54 | S235: PASK
A236: BEST PLAYERS
A237: PORT MELBOURNE | C237: GOSS | F237: BEHAN | I237: BUCKLEY | L237: CAULFIELD | O237: McCRAE | Q237: BUCKLEY
A238: YARRAVILLE | C238: BONGETTI | F238: MARTIN | I238: CHARLES | L238: CUMMINGS | O238: COOK | Q238: SQUIRES
A239: GOALKICKERS
A240: PORT MELBOURNE | C240: HAYES 4 | E240: BARCLAY 2 | H240: BEHAN 2 | J240: JOHN 2 | L240: AANENSEN 2 | O240: BUCKLEY 2 | R240: GOSS | T240: G ALLEN | W240: G ANDERSON | X240: PHILLIPS
A241: YARRAVILLE | C241: WAGHORNE 2 | F241: SQUIRES 2 | I241: MARTIN | K241: HERIOT | M241: MATHIESON
A243: ROUND 6 | E243: 24TH MAY | J243: WEATHER | N243: GROUNDS HEAVY | S243: PLAYED AT
D244: 1ST QTR | H244: 2ND QTR | L244: 3RD QTR | P244: FINAL | S244: DANDENONG
A245: DANDENONG | C245: 2 | D245: 4 | E245: =C245*6+D245 -> 16 | G245: 5 | H245: 9 | I245: =G245*6+H245 -> 39 | K245: 11 | L245: 10 | M245: =K245*6+L245 -> 76 | O245: 13 | P245: 14 | Q245: =O245*6+P245 -> 92 | S245: UMPIRE | X245: LADDER | AB245: ROUND | AD245: 6
A246: WILLIAMSTOWN | C246: 2 | D246: 1 | E246: =C246*6+D246 -> 13 | G246: 3 | H246: 2 | I246: =G246*6+H246 -> 20 | K246: 5 | L246: 5 | M246: =K246*6+L246 -> 35 | O246: 8 | P246: 9 | Q246: =O246*6+P246 -> 57 | S246: DUGARD
A247: BEST PLAYERS | W247: TEAM | X247: W | Y247: L | Z247: D | AA247: FOR | AB247: AGST | AC247: % | AD247: PTS
A248: DANDENONG | C248: MELAI | F248: McNAMARA | I248: WYATT | L248: KENDALL | O248: ESLER | R248: TONKS
A249: WILLIAMSTOWN | C249: CAMILLIERI | F249: MEYERS | I249: JACKMAN | L249: PERCY | O249: O'MARA | R249: PATTERSON | W249: WILLIAMSTOWN | X249: 5 | Y249: 1 | Z249: 0 | AA249: 650 | AB249: 513 | AC249: 126.7056530214425 | AD249: 20
A250: GOALKICKERS | W250: SANDRINGHAM | X250: 5 | Y250: 1 | Z250: 0 | AA250: 708 | AB250: 614 | AC250: 115.30944625407166 | AD250: 20
A251: DANDENONG | C251: MILLER 4 | F251: GUINANE 3 | I251: NANKERVIS 2 | L251: KENDALL | N251: FLAHERTY | Q251: SHEEHAN | S251: ROBERTSON | W251: PRAHRAN | X251: 4 | Y251: 2 | Z251: 0 | AA251: 733 | AB251: 523 | AC251: 140.15296367112811 | AD251: 16
A252: WILLIAMSTOWN | C252: CAMILLIERI 2 | F252: PAGE 2 | I252: JACKMAN 2 | L252: PATTERSON | O252: PERCY | W252: DANDENONG | X252: 4 | Y252: 2 | Z252: 0 | AA252: 666 | AB252: 500 | AC252: 133.2 | AD252: 16
A254: WAVERLEY | C254: 2 | D254: 3 | E254: =C254*6+D254 -> 15 | G254: 6 | H254: 6 | I254: =G254*6+H254 -> 42 | K254: 12 | L254: 16 | M254: =K254*6+L254 -> 88 | O254: 17 | P254: 17 | Q254: =O254*6+P254 -> 119 | S254: PORT MELBOURNE | W254: WAVERLEY | X254: 4 | Y254: 2 | Z254: 0 | AA254: 667 | AB254: 584 | AC254: 114.21232876712328 | AD254: 16
A255: PORT MELBOURNE | C255: 4 | D255: 5 | E255: =C255*6+D255 -> 29 | G255: 9 | H255: 9 | I255: =G255*6+H255 -> 63 | K255: 11 | L255: 12 | M255: =K255*6+L255 -> 78 | O255: 14 | P255: 16 | Q255: =O255*6+P255 -> 100 | S255: HOLZER | W255: PORT MELBOURNE | X255: 3 | Y255: 3 | Z255: 0 | AA255: 657 | AB255: 531 | AC255: 123.72881355932203 | AD255: 12
A256: BEST PLAYERS | W256: PRESTON | X256: 3 | Y256: 3 | Z256: 0 | AA256: 544 | AB256: 540 | AC256: 100.74074074074075 | AD256: 12
A257: WAVERLEY | C257: OWENS | F257: ALLAN | I257: BLEW | L257: EBERT | O257: BROWN | Q257: PITTS | W257: GEELONG WEST | X257: 2 | Y257: 4 | Z257: 0 | AA257: 543 | AB257: 765 | AC257: 70.980392156862749 | AD257: 8
A258: PORT MELBOURNE | C258: BARCLAY | F258: McCRAE | I258: HOLT | L258: MALLETT | O258: GOSS | Q258: BUCKLEY | W258: OAKLEIGH | X258: 0 | Y258: 6 | Z258: 0 | AA258: 491 | AB258: 714 | AC258: 68.767507002801125 | AD258: 0
A259: GOALKICKERS | W259: YARRAVILLE | X259: 0 | Y259: 6 | Z259: 0 | AA259: 501 | AB259: 876 | AC259: 57.19178082191781 | AD259: 0
A260: WAVERLEY | C260: EBERT 5 | F260: BLEW 5 | H260: PITTS 3 | J260: HARDERS 2 | M260: OWENS | O260: BELL
A261: PORT MELBOURNE | C261: BARCLAY 5 | F261: HAYES 2 | H261: JOHN 2 | J261: BUCKLEY 2 | M261: BEHAN | O261: MACRAE | Q261: GARDNER
A263: PRESTON | C263: 4 | D263: 7 | E263: =C263*6+D263 -> 31 | G263: 7 | H263: 11 | I263: =G263*6+H263 -> 53 | K263: 14 | L263: 15 | M263: =K263*6+L263 -> 99 | O263: 17 | P263: 19 | Q263: =O263*6+P263 -> 121 | S263: PRESTON
A264: OAKLEIGH | C264: 3 | D264: 1 | E264: =C264*6+D264 -> 19 | G264: 8 | H264: 2 | I264: =G264*6+H264 -> 50 | K264: 9 | L264: 5 | M264: =K264*6+L264 -> 59 | O264: 12 | P264: 10 | Q264: =O264*6+P264 -> 82 | S264: ANDERSON
A265: BEST PLAYERS
A266: PRESTON | C266: SCHICKERT | F266: FAWCETT | I266: MARTIN | L266: HILL | N266: LE GASSICK | Q266: McARTHUR
A267: OAKLEIGH | C267: KING | F267: LYON | I267: JUDD | L267: SYKES | N267: FORD | Q267: GORDES
A268: GOALKICKERS
A269: PRESTON | C269: WEIGHTMAN 3 | F269: LESLIE 3 | I269: JOYCE 2 | K269: McLEAN 2 | N269: A PERRY 2 | Q269: LE GASSICK 2 | T269: KING | V269: MARTIN | W269: HILL
A270: OAKLEIGH | C270: JUDD 3 | F270: WAPLING 3 | I270: FORD | K270: LYON | M270: CUMMINGS | P270: QUINN | R270: KUZIMAK | U270: CORRIGAN
A272: PRAHRAN | C272: 6 | D272: 9 | E272: =C272*6+D272 -> 45 | G272: 10 | H272: 15 | I272: =G272*6+H272 -> 75 | K272: 18 | L272: 20 | M272: =K272*6+L272 -> 128 | O272: 26 | P272: 26 | Q272: =O272*6+P272 -> 182 | S272: TOORAK PARK
A273: YARRAVILLE | C273: 3 | D273: 1 | E273: =C273*6+D273 -> 19 | G273: 5 | H273: 4 | I273: =G273*6+H273 -> 34 | K273: 8 | L273: 4 | M273: =K273*6+L273 -> 52 | O273: 10 | P273: 12 | Q273: =O273*6+P273 -> 72 | S273: GAMBETTA
A274: BEST PLAYERS
A275: PRAHRAN | C275: PARKER | F275: EMSELLE | I275: POWER | L275: KARANICHOLAS | O275: KNOX | Q275: ROSE
A276: YARRAVILLE | C276: HERIOT | F276: WAGHORNE | I276: BONGETTI | L276: UBERGANG | O276: MARTIN | Q276: MUMFORD
A277: GOALKICKERS
A278: PRAHRAN | C278: POWER 8 | E278: KARANICHOLAS 4 | I278: PARKER 3 | K278: KNOX 2 | M278: DOWSING 2 | P278: VAGG 2 | R278: BARTLETT 2 | V278: MARINKO 2 | X278: RUTH
A279: YARRAVILLE | C279: MARTIN 3 | F279: WAGHORNE 3 | I279: HEYME 2 | K279: QUARANTOTTO | N279: SQUIRES
A281: SANDRINGHAM | C281: 3 | D281: 2 | E281: =C281*6+D281 -> 20 | G281: 6 | H281: 7 | I281: =G281*6+H281 -> 43 | K281: 10 | L281: 14 | M281: =K281*6+L281 -> 74 | O281: 16 | P281: 13 | Q281: =O281*6+P281 -> 109 | S281: GEELONG WEST
A282: GEELONG WEST | C282: 4 | D282: 4 | E282: =C282*6+D282 -> 28 | G282: 7 | H282: 8 | I282: =G282*6+H282 -> 50 | K282: 13 | L282: 11 | M282: =K282*6+L282 -> 89 | O282: 14 | P282: 20 | Q282: =O282*6+P282 -> 104 | S282: FLANAGAN
A283: BEST PLAYERS
A284: SANDRINGHAM | C284: STEPHENS | F284: EVANS | I284: SAMPSON | L284: WALFORD | O284: BROWNE | R284: WATTS
A285: GEELONG WEST | C285: EMOND | F285: BRYANT | I285: FRY | L285: SMITH | O285: GILLIES | R285: TENABEL
A286: GOALKICKERS
A287: SANDRINGHAM | C287: STEPHENS 4 | F287: J WARD 3 | I287: SAMPSON 3 | L287: ROBINSON 2 | O287: HOGAN | Q287: ANTONIE | S287: ZEUSCHNER | V287: K WILLS
A288: GEELONG WEST | C288: GILLIES 5 | F288: SMITH 2 | H288: PIEC 2 | J288: BRYANT 2 | M288: ROOM | O288: M FRY | Q288: TENABEL
A290: ROUND 7 | E290: 31ST MAY | J290: WEATHER | N290: SOUTH EAST WIND | S290: PLAYED AT
D291: 1ST QTR | H291: 2ND QTR | L291: 3RD QTR | P291: FINAL | S291: BEACH ROAD
A292: SANDRINGHAM | C292: 7 | D292: 3 | E292: =C292*6+D292 -> 45 | G292: 8 | H292: 6 | I292: =G292*6+H292 -> 54 | K292: 17 | L292: 9 | M292: =K292*6+L292 -> 111 | O292: 20 | P292: 10 | Q292: =O292*6+P292 -> 130 | S292: UMPIRE | X292: LADDER | AB292: ROUND | AD292: 7
A293: DANDENONG | C293: 1 | D293: 4 | E293: =C293*6+D293 -> 10 | G293: 8 | H293: 11 | I293: =G293*6+H293 -> 59 | K293: 12 | L293: 14 | M293: =K293*6+L293 -> 86 | O293: 15 | P293: 20 | Q293: =O293*6+P293 -> 110 | S293: McMASTER
A294: BEST PLAYERS | W294: TEAM | X294: W | Y294: L | Z294: D | AA294: FOR | AB294: AGST | AC294: % | AD294: PTS
A295: SANDRINGHAM | C295: WALFORD | F295: J WARD | I295: MACKENZIE | L295: STEPHENS | O295: ZEUSCHNER | R295: ANTONIE
A296: DANDENONG | C296: FLAHERTY | F296: GUINANE | I296: ESLER | L296: DAVENPORT | O296: MATTHEWS | R296: BETHKE | W296: SANDRINGHAM | X296: 6 | Y296: 1 | Z296: 0 | AA296: 838 | AB296: 724 | AC296: 115.74585635359117 | AD296: 24
A297: GOALKICKERS | O297: WATTS | Q297: ROBINSON | S297: WILLIAMS | W297: PRAHRAN | X297: 5 | Y297: 2 | Z297: 0 | AA297: 859 | AB297: 588 | AC297: 146.08843537414967 | AD297: 20
A298: SANDRINGHAM | C298: STEPHENS 3 | F298: ZEUSCHNER 3 | I298: AUSTIN 3 | K298: ANTONIE 2 | N298: WALFORD 2 | Q298: J WARD 2 | S298: HOGAN 2 | W298: WAVERLEY | X298: 5 | Y298: 2 | Z298: 0 | AA298: 788 | AB298: 655 | AC298: 120.30534351145039 | AD298: 20
A299: DANDENONG | C299: MILLER 5 | F299: GUINANE 4 | I299: FLAHERTY 4 | L299: SHEEHAN | N299: ESLER | W299: WILLIAMSTOWN | X299: 5 | Y299: 2 | Z299: 0 | AA299: 728 | AB299: 656 | AC299: 110.97560975609755 | AD299: 20
A301: PORT MELBOURNE | C301: 3 | D301: 9 | E301: =C301*6+D301 -> 27 | G301: 9 | H301: 15 | I301: =G301*6+H301 -> 69 | K301: 11 | L301: 21 | M301: =K301*6+L301 -> 87 | O301: 20 | P301: 23 | Q301: =O301*6+P301 -> 143 | S301: WILLIAMSTOWN | W301: PORT MELBOURNE | X301: 4 | Y301: 3 | Z301: 0 | AA301: 800 | AB301: 609 | AC301: 131.36288998357963 | AD301: 16
A302: WILLIAMSTOWN | C302: 3 | D302: 3 | E302: =C302*6+D302 -> 21 | G302: 4 | H302: 6 | I302: =G302*6+H302 -> 30 | K302: 7 | L302: 9 | M302: =K302*6+L302 -> 51 | O302: 11 | P302: 12 | Q302: =O302*6+P302 -> 78 | S302: TURNER | W302: DANDENONG | X302: 4 | Y302: 3 | Z302: 0 | AA302: 776 | AB302: 630 | AC302: 123.17460317460318 | AD302: 16
A303: BEST PLAYERS | W303: PRESTON | X303: 4 | Y303: 3 | Z303: 0 | AA303: 654 | AB303: 632 | AC303: 103.48101265822785 | AD303: 16
A304: PORT MELBOURNE | C304: BEHAN | F304: GOSS | I304: EKLUND | L304: BUCKLEY | N304: MALLETT | Q304: STEVENSON | W304: GEELONG WEST | X304: 2 | Y304: 5 | Z304: 0 | AA304: 635 | AB304: 875 | AC304: 72.571428571428569 | AD304: 8
A305: WILLIAMSTOWN | C305: HAYWARD | F305: MITCHELL | I305: WALLACE | L305: RUSSELL | N305: HARVEY | Q305: PAGE | W305: OAKLEIGH | X305: 0 | Y305: 7 | Z305: 0 | AA305: 556 | AB305: 840 | AC305: 66.19047619047619 | AD305: 0
A306: GOALKICKERS | R306: MALLETT | W306: YARRAVILLE | X306: 0 | Y306: 7 | Z306: 0 | AA306: 572 | AB306: 997 | AC306: 57.37211634904714 | AD306: 0
A307: PORT MELBOURNE | C307: HAYES 4 | E307: EKLUND 4 | G307: GOSS 3 | I307: PASQUILL 2 | L307: BONNETT 2 | O307: HOLT 2 | Q307: G ALLEN | S307: MACRAE
A308: WILLIAMSTOWN | C308: NOBLE 2 | F308: LANE 2 | H308: WALLACE 2 | K308: PATTERSON | N308: JACKMAN | Q308: PAGE | S308: HAYWARD | V308: STARK
A310: PRESTON | C310: 2 | D310: 4 | E310: =C310*6+D310 -> 16 | G310: 8 | H310: 9 | I310: =G310*6+H310 -> 57 | K310: 11 | L310: 14 | M310: =K310*6+L310 -> 80 | O310: 15 | P310: 20 | Q310: =O310*6+P310 -> 110 | S310: GEELONG WEST
A311: GEELONG WEST | C311: 4 | D311: 4 | E311: =C311*6+D311 -> 28 | G311: 4 | H311: 8 | I311: =G311*6+H311 -> 32 | K311: 9 | L311: 17 | M311: =K311*6+L311 -> 71 | O311: 12 | P311: 20 | Q311: =O311*6+P311 -> 92 | S311: McKENZIE
A312: BEST PLAYERS
A313: PRESTON | C313: LESLIE | F313: McLEAN | I313: SCHICKERT | L313: KINNEALLY | O313: LE GASSICK | R313: JOYCE
A314: GEELONG WEST | C314: BRYANT | F314: C SMITH | I314: CROWE | L314: GRATTON | O314: BARRY | R314: STACEY
A315: GOALKICKERS
A316: PRESTON | C316: JOYCE 4 | F316: McLEAN 4 | I316: LE GASSICK 3 | L316: LESLIE 2 | N316: HINDMARSH | Q316: RULE
A317: GEELONG WEST | C317: SMITH 2 | F317: GILLIES 2 | I317: GRATTON 2 | L317: EMOND 2 | O317: DEEATH | Q317: PIEC | R317: M FRY | T317: TENABEL
A319: WAVERLEY | C319: 3 | D319: 1 | E319: =C319*6+D319 -> 19 | G319: 7 | H319: 8 | I319: =G319*6+H319 -> 50 | K319: 12 | L319: 12 | M319: =K319*6+L319 -> 84 | O319: 17 | P319: 19 | Q319: =O319*6+P319 -> 121 | S319: WAVERLEY
A320: YARRAVILLE | C320: 4 | D320: 5 | E320: =C320*6+D320 -> 29 | G320: 5 | H320: 6 | I320: =G320*6+H320 -> 36 | K320: 7 | L320: 7 | M320: =K320*6+L320 -> 49 | O320: 10 | P320: 11 | Q320: =O320*6+P320 -> 71 | S320: O'NEILL
A321: BEST PLAYERS
A322: WAVERLEY | C322: PITTS | F322: BLEW | I322: BACKHOUSE | L322: MORDEN | O322: MORRIS | Q322: SYKES
A323: YARRAVILLE | C323: COOK | F323: MARTIN | I323: MUMFORD | L323: BARROW | O323: COLLINS | Q323: WAGHORNE
A324: GOALKICKERS
A325: WAVERLEY | C325: MORRIS 4 | F325: EBERT 3 | H325: HARDERS 3 | J325: GRANT 2 | L325: BACKHOUSE 2 | O325: HORKINGS | Q325: PITTS | R325: MORDEN
A326: YARRAVILLE | C326: MARTIN 2 | F326: COOK 2 | H326: HERIOT 2 | J326: COLLINS 2 | M326: SQUIRES | O326: MUMFORD
A328: PRAHRAN | C328: 5 | D328: 8 | E328: =C328*6+D328 -> 38 | G328: 8 | H328: 15 | I328: =G328*6+H328 -> 63 | K328: 11 | L328: 22 | M328: =K328*6+L328 -> 88 | O328: 17 | P328: 24 | Q328: =O328*6+P328 -> 126 | S328: OAKLEIGH
A329: OAKLEIGH | C329: 0 | D329: 3 | E329: =C329*6+D329 -> 3 | G329: 3 | H329: 6 | I329: =G329*6+H329 -> 24 | K329: 5 | L329: 7 | M329: =K329*6+L329 -> 37 | O329: 9 | P329: 11 | Q329: =O329*6+P329 -> 65 | S329: FLANAGAN
A330: BEST PLAYERS
A331: PRAHRAN | C331: HUTCHESSON | F331: EMSELLE | I331: KARANICHOLAS | L331: PARKER | N331: ROSE | Q331: KENNEALLY
A332: OAKLEIGH | C332: FORD | F332: LYON | I332: BONESS | L332: SYKES | N332: LINNELL | Q332: KING
A333: GOALKICKERS
A334: PRAHRAN | C334: KARANICHOLAS 4 | G334: POWER 4 | I334: PARKER 3 | L334: KNOX 2 | N334: DOWSING | Q334: VAGG | R334: BARTLETT | U334: ROSE
A335: OAKLEIGH | C335: LYON 3 | F335: McCORKELL 2 | I335: SMITH 2 | L335: STEWART | N335: CUMMINGS
A337: ROUND 8 | E337: 7TH JUNE | J337: WEATHER | N337: FINE | S337: PLAYED AT
D338: 1ST QTR | H338: 2ND QTR | L338: 3RD QTR | P338: FINAL | S338: WAVERLEY
A339: WAVERLEY | C339: 7 | D339: 7 | E339: =C339*6+D339 -> 49 | G339: 9 | H339: 18 | I339: =G339*6+H339 -> 72 | K339: 11 | L339: 19 | M339: =K339*6+L339 -> 85 | O339: 21 | P339: 23 | Q339: =O339*6+P339 -> 149 | S339: UMPIRE | X339: LADDER | AB339: ROUND | AD339: 8
A340: SANDRINGHAM | C340: 3 | D340: 4 | E340: =C340*6+D340 -> 22 | G340: 6 | H340: 8 | I340: =G340*6+H340 -> 44 | K340: 9 | L340: 11 | M340: =K340*6+L340 -> 65 | O340: 12 | P340: 12 | Q340: =O340*6+P340 -> 84 | S340: PASK
A341: BEST PLAYERS | W341: TEAM | X341: W | Y341: L | Z341: D | AA341: FOR | AB341: AGST | AC341: % | AD341: PTS
A342: WAVERLEY | C342: BLEW | E342: HORKINGS | H342: SYKES | K342: ALLAN | N342: EBERT | Q342: PITTS
A343: SANDRINGHAM | C343: BUSSE | E343: HOGAN | H343: AUSTIN | K343: BROWNE | N343: ELLIS | Q343: STEPHENS | W343: PRAHRAN | X343: 6 | Y343: 2 | Z343: 0 | AA343: 962 | AB343: 679 | AC343: 141.67893961708396 | AD343: 24
A344: GOALKICKERS | P344: BELL | W344: WAVERLEY | X344: 6 | Y344: 2 | Z344: 0 | AA344: 937 | AB344: 739 | AC344: 126.79296346414073 | AD344: 24
A345: WAVERLEY | C345: OWENS 4 | E345: MORRIS 3 | G345: POORE 3 | I345: BLEW 3 | K345: PITTS 3 | M345: EBERT | N345: GRANT | P345: HORKINGS | R345: P STEPHENS | W345: WILLIAMSTOWN | X345: 6 | Y345: 2 | Z345: 0 | AA345: 848 | AB345: 743 | AC345: 114.13189771197847 | AD345: 24
A346: SANDRINGHAM | C346: HOGAN 4 | F346: AUSTIN 4 | I346: ZEUSCHNER 2 | L346: WALFORD | N346: ANTONIE | W346: SANDRINGHAM | X346: 6 | Y346: 2 | Z346: 0 | AA346: 922 | AB346: 873 | AC346: 105.61282932416952 | AD346: 24
A348: PRAHRAN | C348: 5 | D348: 5 | E348: =C348*6+D348 -> 35 | G348: 7 | H348: 7 | I348: =G348*6+H348 -> 49 | K348: 11 | L348: 10 | M348: =K348*6+L348 -> 76 | O348: 15 | P348: 13 | Q348: =O348*6+P348 -> 103 | S348: TOORAK PARK | W348: PORT MELBOURNE | X348: 5 | Y348: 3 | Z348: 0 | AA348: 938 | AB348: 695 | AC348: 134.96402877697841 | AD348: 20
A349: DANDENONG | C349: 3 | D349: 3 | E349: =C349*6+D349 -> 21 | G349: 7 | H349: 7 | I349: =G349*6+H349 -> 49 | K349: 11 | L349: 14 | M349: =K349*6+L349 -> 80 | O349: 12 | P349: 19 | Q349: =O349*6+P349 -> 91 | S349: McKENZIE | W349: DANDENONG | X349: 4 | Y349: 4 | Z349: 0 | AA349: 867 | AB349: 733 | AC349: 118.28103683492496 | AD349: 16
A350: BEST PLAYERS | W350: PRESTON | X350: 4 | Y350: 4 | Z350: 0 | AA350: 741 | AB350: 752 | AC350: 98.537234042553195 | AD350: 16
A351: PRAHRAN | C351: BARTLETT | F351: CULPIN | I351: POWER | L351: CROWE | N351: VAGG | Q351: HUTCHESSON | W351: GEELONG WEST | X351: 2 | Y351: 6 | Z351: 0 | AA351: 721 | AB351: 1013 | AC351: 71.174728529121424 | AD351: 8
A352: DANDENONG | C352: FLAHERTY | F352: GUINANE | I352: KENDALL | L352: MELAI | N352: BETHKE | Q352: NANKERVIS | W352: OAKLEIGH | X352: 1 | Y352: 7 | Z352: 0 | AA352: 692 | AB352: 965 | AC352: 71.709844559585491 | AD352: 4
A353: GOALKICKERS | W353: YARRAVILLE | X353: 0 | Y353: 8 | Z353: 0 | AA353: 697 | AB353: 1133 | AC353: 61.518093556928505 | AD353: 0
A354: PRAHRAN | C354: POWER 5 | F354: VAGG 3 | H354: HUTCHESSON 2 | K354: BARTLETT 2 | N354: PARKER | P354: EMSELLE | R354: ROSE
A355: DANDENONG | C355: GUINANE 3 | F355: NANKERVIS 2 | I355: SHEEHAN 2 | L355: JEFFERIES | N355: DAVENPORT | Q355: KENDALL | S355: NANKERVIS | V355: ESLER
A357: WILLIAMSTOWN | C357: 5 | D357: 3 | E357: =C357*6+D357 -> 33 | G357: 10 | H357: 4 | I357: =G357*6+H357 -> 64 | K357: 15 | L357: 7 | M357: =K357*6+L357 -> 97 | O357: 18 | P357: 12 | Q357: =O357*6+P357 -> 120 | S357: WILLIAMSTOWN
A358: PRESTON | C358: 1 | D358: 4 | E358: =C358*6+D358 -> 10 | G358: 8 | H358: 10 | I358: =G358*6+H358 -> 58 | K358: 10 | L358: 12 | M358: =K358*6+L358 -> 72 | O358: 12 | P358: 15 | Q358: =O358*6+P358 -> 87 | S358: McMASTER
A359: BEST PLAYERS
A360: WILLIAMSTOWN | C360: CAMILLIERI | F360: MEYERS | I360: PATTERSON | L360: HARVEY | O360: RYAN | R360: LANE
A361: PRESTON | C361: WEIGHTMAN | F361: FISHER | I361: McLEAN | L361: BROWNE | O361: McARTHUR | R361: GOAD
A362: GOALKICKERS
A363: WILLIAMSTOWN | C363: PATTERSON 7 | F363: JACKMAN 2 | I363: PAPLEY 2 | K363: LANE 2 | M363: TISDALE 2 | P363: CAMILLIERI | R363: HAYWARD | U363: NOBLE
A364: PRESTON | C364: McLEAN 5 | F364: WEIGHTMAN 4 | I364: LE GASSICK | L364: LESLIE | N364: A PERRY
A366: PORT MELBOURNE | C366: 3 | D366: 3 | E366: =C366*6+D366 -> 21 | G366: 11 | H366: 11 | I366: =G366*6+H366 -> 77 | K366: 18 | L366: 17 | M366: =K366*6+L366 -> 125 | O366: 20 | P366: 18 | Q366: =O366*6+P366 -> 138 | S366: PORT MELBOURNE
A367: GEELONG WEST | C367: 2 | D367: 6 | E367: =C367*6+D367 -> 18 | G367: 3 | H367: 11 | I367: =G367*6+H367 -> 29 | K367: 7 | L367: 12 | M367: =K367*6+L367 -> 54 | O367: 12 | P367: 14 | Q367: =O367*6+P367 -> 86 | S367: DUGARD
A368: BEST PLAYERS
A369: PORT MELBOURNE | C369: GROVER | F369: CAULFIELD | I369: BARCLAY | L369: HAYES | N369: BONNETT | Q369: MALLETT
A370: GEELONG WEST | C370: BRYANT | F370: TENABEL | I370: EMOND | L370: ROOM | N370: GRATTON | Q370: M FRY
A371: GOALKICKERS
A372: PORT MELBOURNE | C372: HAYES 8 | F372: BARCLAY 4 | I372: EKLUND 3 | L372: BONNETT 2 | O372: GOSS | Q372: BEHAN | S372: GARDNER
A373: GEELONG WEST | C373: ROOM 3 | F373: TENABEL 2 | I373: JENNINGS 2 | L373: SMITH | N373: GILLIES | P373: M FRY | R373: BRYANT | T373: GRATTON
A375: OAKLEIGH | C375: 2 | D375: 4 | E375: =C375*6+D375 -> 16 | G375: 8 | H375: 8 | I375: =G375*6+H375 -> 56 | K375: 13 | L375: 9 | M375: =K375*6+L375 -> 87 | O375: 20 | P375: 16 | Q375: =O375*6+P375 -> 136 | S375: YARRAVILLE
A376: YARRAVILLE | C376: 5 | D376: 6 | E376: =C376*6+D376 -> 36 | G376: 7 | H376: 10 | I376: =G376*6+H376 -> 52 | K376: 14 | L376: 17 | M376: =K376*6+L376 -> 101 | O376: 18 | P376: 17 | Q376: =O376*6+P376 -> 125 | S376: BARBER
A377: BEST PLAYERS
A378: OAKLEIGH | C378: KING | F378: FORD | I378: MURNANE | L378: WAPLING | O378: BEARD | R378: ARON
A379: YARRAVILLE | C379: BONGETTI | F379: MUMFORD | I379: COOK | L379: MARTIN | O379: COLLINS | R379: CHARLES
A380: GOALKICKERS
A381: OAKLEIGH | C381: ROBERTS 3 | F381: MURNANE 3 | I381: ARON 3 | K381: BEARD 3 | M381: FORD 2 | O381: WAPLING 2 | R381: JUDD 2 | U381: McCORKELL | X381: LYON
A382: YARRAVILLE | C382: BONGETTI 8 | F382: COLLINS 4 | I382: MARTIN 2 | K382: UBERGANG | N382: HERIOT | P382: MUMFORD | R382: CUMMING
A384: ROUND 9 | D384: 13TH JUNE | I384: WEATHER | L384: MISTY RAIN GROUNDS HEAVY | S384: PLAYED AT
D385: 1ST QTR | H385: 2ND QTR | L385: 3RD QTR | P385: FINAL | S385: BEACH ROAD
A386: SANDRINGHAM | C386: 4 | D386: 5 | E386: =C386*6+D386 -> 29 | G386: 7 | H386: 9 | I386: =G386*6+H386 -> 51 | K386: 14 | L386: 13 | M386: =K386*6+L386 -> 97 | O386: 15 | P386: 13 | Q386: =O386*6+P386 -> 103 | S386: UMPIRE | X386: LADDER | AB386: ROUND | AD386: 9
A387: WILLIAMSTOWN | C387: 1 | D387: 3 | E387: =C387*6+D387 -> 9 | G387: 4 | H387: 6 | I387: =G387*6+H387 -> 30 | K387: 6 | L387: 8 | M387: =K387*6+L387 -> 44 | O387: 13 | P387: 10 | Q387: =O387*6+P387 -> 88 | S387: TURNER
A388: BEST PLAYERS | W388: TEAM | X388: W | Y388: L | Z388: D | AA388: FOR | AB388: AGST | AC388: % | AD388: PTS
A389: SANDRINGHAM | C389: AUSTIN | F389: STEPHENS | I389: ZEUSCHNER | L389: HOGAN | N389: COLLIER | Q389: HANCE
A390: WILLIAMSTOWN | C390: LANE | F390: CAMILLIERI | I390: PATTERSON | L390: PAPLEY | N390: HAYWARD | Q390: MEYERS | W390: PRAHRAN | X390: 7 | Y390: 2 | Z390: 0 | AA390: 1134 | AB390: 777 | AC390: 145.94594594594594 | AD390: 28
A391: GOALKICKERS | W391: WAVERLEY | X391: 7 | Y391: 2 | Z391: 0 | AA391: 1054 | AB391: 803 | AC391: 131.25778331257783 | AD391: 28
A392: SANDRINGHAM | C392: HOGAN 5 | E392: STEPHENS 4 | H392: AUSTIN | J392: ROBINSON | M392: EVANS | O392: HANCE | Q392: MACKENZIE | T392: COLLIER | W392: SANDRINGHAM | X392: 7 | Y392: 2 | Z392: 0 | AA392: 1025 | AB392: 961 | AC392: 106.65972944849115 | AD392: 28
A393: WILLIAMSTOWN | C393: PATTERSON 2 | F393: JACKMAN 2 | I393: PAPLEY 2 | K393: LANE 2 | M393: CAMILERI | O393: HAYWARD | Q393: PERCY | R393: TISDALE | T393: FANNING | W393: WILLIAMSTOWN | X393: 6 | Y393: 3 | Z393: 0 | AA393: 936 | AB393: 846 | AC393: 110.63829787234043 | AD393: 24
A395: WAVERLEY | C395: 2 | D395: 4 | E395: =C395*6+D395 -> 16 | G395: 6 | H395: 7 | I395: =G395*6+H395 -> 43 | K395: 10 | L395: 13 | M395: =K395*6+L395 -> 73 | O395: 16 | P395: 21 | Q395: =O395*6+P395 -> 117 | S395: OAKLEIGH | W395: PORT MELBOURNE | X395: 5 | Y395: 4 | Z395: 0 | AA395: 1015 | AB395: 780 | AC395: 130.12820512820514 | AD395: 20
A396: OAKLEIGH | C396: 4 | D396: 4 | E396: =C396*6+D396 -> 28 | G396: 5 | H396: 10 | I396: =G396*6+H396 -> 40 | K396: 7 | L396: 15 | M396: =K396*6+L396 -> 57 | O396: 8 | P396: 16 | Q396: =O396*6+P396 -> 64 | S396: HOLZER | W396: DANDENONG | X396: 5 | Y396: 4 | Z396: 0 | AA396: 952 | AB396: 810 | AC396: 117.53086419753086 | AD396: 20
A397: BEST PLAYERS | W397: PRESTON | X397: 5 | Y397: 4 | Z397: 0 | AA397: 828 | AB397: 837 | AC397: 98.924731182795696 | AD397: 20
A398: WAVERLEY | C398: ALLAN | F398: POORE | I398: MORRIS | L398: BLEW | N398: MORDEN | Q398: BROWN | W398: GEELONG WEST | X398: 2 | Y398: 7 | Z398: 0 | AA398: 819 | AB398: 1185 | AC398: 69.113924050632917 | AD398: 8
A399: OAKLEIGH | C399: BEARD | F399: McCORKELL | I399: FORD | L399: ROBERTS | N399: BONESS | Q399: QUINN | W399: OAKLEIGH | X399: 1 | Y399: 8 | Z399: 0 | AA399: 756 | AB399: 1082 | AC399: 69.870609981515713 | AD399: 4
A400: GOALKICKERS | W400: YARRAVILLE | X400: 0 | Y400: 9 | Z400: 0 | AA400: 782 | AB400: 1220 | AC400: 64.098360655737707 | AD400: 0
A401: WAVERLEY | C401: MORRIS 5 | F401: POORE 4 | I401: EBERT 3 | K401: PITTS 2 | M401: OWENS | O401: ARNOTT
A402: OAKLEIGH | C402: ARON 3 | F402: BEARD 3 | I402: MURNANE | K402: KING
D403: 14TH JUNE | I403: WEATHER | L403: FINE
A404: PRAHRAN | C404: 3 | D404: 4 | E404: =C404*6+D404 -> 22 | G404: 8 | H404: 12 | I404: =G404*6+H404 -> 60 | K404: 15 | L404: 17 | M404: =K404*6+L404 -> 107 | O404: 25 | P404: 22 | Q404: =O404*6+P404 -> 172 | S404: GEELONG WEST
A405: GEELONG WEST | C405: 4 | D405: 2 | E405: =C405*6+D405 -> 26 | G405: 8 | H405: 5 | I405: =G405*6+H405 -> 53 | K405: 13 | L405: 6 | M405: =K405*6+L405 -> 84 | O405: 15 | P405: 8 | Q405: =O405*6+P405 -> 98 | S405: O'NEILL
A406: BEST PLAYERS
A407: PRAHRAN | C407: PARKER | F407: EMSELLE | I407: BARTLETT | L407: ROSE | O407: HUTCHESSON | R407: DOWSING
A408: GEELONG WEST | C408: HAMILTON | F408: ROOM | I408: GRATTON | L408: TENABEL | O408: GILLIES
A409: GOALKICKERS
A410: PRAHRAN | C410: BARTLETT 7 | F410: PARKER 4 | I410: EMSELLE 4 | L410: DOWSING 3 | O410: HUTCHESSON 2 | R410: KARANICHOLAS 2 | W410: KNOX | X410: ROSE | Z410: POWER
A411: GEELONG WEST | C411: ROOM 5 | F411: GILLIES 3 | I411: GRATTON 2 | L411: EMOND 2 | O411: SMITH | Q411: TENABEL | S411: LARKINS
D412: 21ST JUNE | I412: WEATHER | L412: RAIN GROUNDS BAD
A413: DANDENONG | C413: 4 | D413: 1 | E413: =C413*6+D413 -> 25 | G413: 7 | H413: 3 | I413: =G413*6+H413 -> 45 | K413: 11 | L413: 7 | M413: =K413*6+L413 -> 73 | O413: 12 | P413: 13 | Q413: =O413*6+P413 -> 85 | S413: DANDENONG
A414: PORT MELBOURNE | C414: 5 | D414: 7 | E414: =C414*6+D414 -> 37 | G414: 7 | H414: 9 | I414: =G414*6+H414 -> 51 | K414: 9 | L414: 10 | M414: =K414*6+L414 -> 64 | O414: 11 | P414: 11 | Q414: =O414*6+P414 -> 77 | S414: ANDERSON
A415: BEST PLAYERS
A416: DANDENONG | C416: BETHKE | F416: MILLER | I416: STEDWELL | L416: NANKERVIS | O416: MELAI | R416: MATTHEWS
A417: PORT MELBOURNE | C417: GARDNER | F417: N GOSS | I417: AANENSEN | L417: BARCLAY | O417: PASQUILL | R417: HAYES
A418: GOALKICKERS
A419: DANDENONG | C419: MILLER 6 | F419: NANKERVIS 2 | I419: MELAI | K419: FLAHERTY | N419: SHEEHAN | P419: DAVIES
A420: PORT MELBOURNE | C420: HAYES 3 | F420: GOSS 2 | H420: BARCLAY 2 | K420: AANENSEN 2 | N420: PASQUILL | P420: MACRAE
A422: PRESTON | C422: 3 | D422: 2 | E422: =C422*6+D422 -> 20 | G422: 6 | H422: 7 | I422: =G422*6+H422 -> 43 | K422: 8 | L422: 9 | M422: =K422*6+L422 -> 57 | O422: 12 | P422: 15 | Q422: =O422*6+P422 -> 87 | S422: PRESTON
A423: YARRAVILLE | C423: 6 | D423: 5 | E423: =C423*6+D423 -> 41 | G423: 7 | H423: 7 | I423: =G423*6+H423 -> 49 | K423: 13 | L423: 7 | M423: =K423*6+L423 -> 85 | O423: 13 | P423: 7 | Q423: =O423*6+P423 -> 85 | S423: GAMBETTA
A424: BEST PLAYERS
A425: PRESTON | C425: HILL | F425: GOAD | I425: LESLIE | L425: WEIGHTMAN | O425: LE GASSICK | R425: BROWNE
A426: YARRAVILLE | C426: CHARLES | F426: COOK | I426: MARTIN | L426: COLLINS | O426: SQUIRES | R426: BONGETTI
A427: GOALKICKERS
A428: PRESTON | C428: JOYCE 3 | F428: LESLIE 3 | I428: LE GASSICK 2 | L428: WEIGHTMAN | O428: McLEAN | Q428: GOAD | S428: GARRETT
A429: YARRAVILLE | C429: BONGETTI 4 | F429: WALSH 3 | I429: SKIDMORE 2 | L429: UBERGANG | O429: WAGHORNE | R429: SQUIRES | T429: COLLINS
A431: ROUND 10 | E431: 28TH JUNE | J431: WEATHER | N431: SOUTH WEST WIND | S431: PLAYED AT
D432: 1ST QTR | H432: 2ND QTR | L432: 3RD QTR | P432: FINAL | S432: TOORAK PARK
A433: PRAHRAN | C433: 6 | D433: 5 | E433: =C433*6+D433 -> 41 | G433: 10 | H433: 6 | I433: =G433*6+H433 -> 66 | K433: 19 | L433: 12 | M433: =K433*6+L433 -> 126 | O433: 20 | P433: 15 | Q433: =O433*6+P433 -> 135 | S433: UMPIRE | X433: LADDER | AB433: ROUND | AD433: 10
A434: SANDRINGHAM | C434: 0 | D434: 1 | E434: =C434*6+D434 -> 1 | G434: 4 | H434: 4 | I434: =G434*6+H434 -> 28 | K434: 11 | L434: 4 | M434: =K434*6+L434 -> 70 | O434: 18 | P434: 7 | Q434: =O434*6+P434 -> 115 | S434: BARBER
A435: BEST PLAYERS | W435: TEAM | X435: W | Y435: L | Z435: D | AA435: FOR | AB435: AGST | AC435: % | AD435: PTS
A436: PRAHRAN | C436: EMSELLE | F436: HUTCHESSON | I436: ROSE | L436: PARKER | O436: KARANICOLAS | R436: KNOX
A437: SANDRINGHAM | C437: BUSSE | F437: STEPHENS | I437: ROBINSON | L437: ZEUSCHNER | O437: WALFORD | R437: LOCKHART | W437: PRAHRAN | X437: 8 | Y437: 2 | Z437: 0 | AA437: 1269 | AB437: 892 | AC437: 142.2645739910314 | AD437: 32
A438: GOALKICKERS | P438: JUNGWIRTH | W438: WAVERLEY | X438: 8 | Y438: 2 | Z438: 0 | AA438: 1213 | AB438: 874 | AC438: 138.79 | AD438: 32
A439: PRAHRAN | C439: KNOX 5 | E439: PARKER 4 | G439: KARANICHOLAS 4 | K439: DOWSING 2 | N439: BARTLETT 2 | Q439: HUTCHESSON | T439: POWER | W439: WILLIAMSTOWN | X439: 7 | Y439: 3 | Z439: 0 | AA439: 1057 | AB439: 909 | AC439: 116.28162816281628 | AD439: 28
A440: SANDRINGHAM | C440: STEPHENS 5 | F440: WALFORD 4 | I440: EVANS 2 | K440: HOGAN 2 | M440: ZEUSCHNER 2 | P440: AUSTIN | R440: ROBINSON | W440: SANDRINGHAM | X440: 7 | Y440: 3 | Z440: 0 | AA440: 1140 | AB440: 1096 | AC440: 104.01459854014598 | AD440: 28
R441: HANCE
A442: PORT MELBOURNE | C442: 0 | D442: 2 | E442: =C442*6+D442 -> 2 | G442: 5 | H442: 9 | I442: =G442*6+H442 -> 39 | K442: 9 | L442: 13 | M442: =K442*6+L442 -> 67 | O442: 15 | P442: 17 | Q442: =O442*6+P442 -> 107 | S442: PORT MELBOURNE | W442: PORT MELBOURNE | X442: 6 | Y442: 4 | Z442: 0 | AA442: 1122 | AB442: 835 | AC442: 134.37125748502993 | AD442: 24
A443: PRESTON | C443: 2 | D443: 4 | E443: =C443*6+D443 -> 16 | G443: 3 | H443: 7 | I443: =G443*6+H443 -> 25 | K443: 5 | L443: 11 | M443: =K443*6+L443 -> 41 | O443: 7 | P443: 13 | Q443: =O443*6+P443 -> 55 | S443: O'NEILL | W443: DANDENONG | X443: 6 | Y443: 4 | Z443: 0 | AA443: 1082 | AB443: 877 | AC443: 123.3751425313569 | AD443: 24
A444: BEST PLAYERS | W444: PRESTON | X444: 5 | Y444: 5 | Z444: 0 | AA444: 883 | AB444: 944 | AC444: 93.538135593220332 | AD444: 20
A445: PORT MELBOURNE | C445: STEVENSON | F445: N GOSS | I445: AANENSEN | L445: G ALLEN | O445: GROVER | R445: BUCKLEY | W445: GEELONG WEST | X445: 2 | Y445: 8 | Z445: 0 | AA445: 890 | AB445: 1344 | AC445: 66.22 | AD445: 8
A446: PRESTON | C446: TELFORD | F446: FAWCETT | I446: SCHICKERT | L446: LE GASSICK | O446: KINNEALLY | R446: REID | W446: OAKLEIGH | X446: 1 | Y446: 9 | Z446: 0 | AA446: 819 | AB446: 1203 | AC446: 68.079800498753116 | AD446: 4
A447: GOALKICKERS | W447: YARRAVILLE | X447: 0 | Y447: 10 | Z447: 0 | AA447: 849 | AB447: 1350 | AC447: 62.888888888888886 | AD447: 0
A448: PORT MELBOURNE | C448: HAYES 3 | E448: BUCKLEY 3 | H448: N GOSS 2 | J448: M ALLEN 2 | M448: AANENSEN 2 | P448: BARCLAY | R448: BONNETT | U448: DAVIS
A449: PRESTON | C449: JOYCE 2 | F449: REID | H449: BROWNE | J449: LESLIE | L449: McARTHUR | O449: LE GASSICK
A451: DANDENONG | C451: 4 | D451: 6 | E451: =C451*6+D451 -> 30 | G451: 9 | H451: 9 | I451: =G451*6+H451 -> 63 | K451: 16 | L451: 14 | M451: =K451*6+L451 -> 110 | O451: 19 | P451: 16 | Q451: =O451*6+P451 -> 130 | S451: YARRAVILLE
A452: YARRAVILLE | C452: 0 | D452: 1 | E452: =C452*6+D452 -> 1 | G452: 4 | H452: 3 | I452: =G452*6+H452 -> 27 | K452: 4 | L452: 6 | M452: =K452*6+L452 -> 30 | O452: 9 | P452: 13 | Q452: =O452*6+P452 -> 67 | S452: DUGARD
A453: BEST PLAYERS
A454: DANDENONG | C454: SHEEHAN | F454: FLAHERTY | I454: DAVENPORT | L454: MILLER | O454: ESLER | R454: ABRAHAM
A455: YARRAVILLE | C455: COOK | F455: McMILLAN | I455: MARTIN | L455: CHARLES | O455: BONGETTI | R455: COLLINS
A456: GOALKICKERS
A457: DANDENONG | C457: MILLER 6 | F457: SHEEHAN 5 | I457: FLAHERTY 4 | L457: WALKER 2 | O457: DAVIES | Q457: McNAMARA
A458: YARRAVILLE | C458: MARTIN 2 | F458: COOK 2 | I458: BONGETTI 2 | L458: UBERGANG | O458: MATHESON | R458: WALSH
A460: WILLIAMSTOWN | C460: 2 | D460: 6 | E460: =C460*6+D460 -> 18 | G460: 6 | H460: 8 | I460: =G460*6+H460 -> 44 | K460: 13 | L460: 13 | M460: =K460*6+L460 -> 91 | O460: 17 | P460: 19 | Q460: =O460*6+P460 -> 121 | S460: WILLIAMSTOWN
A461: OAKLEIGH | C461: 0 | D461: 2 | E461: =C461*6+D461 -> 2 | G461: 2 | H461: 3 | I461: =G461*6+H461 -> 15 | K461: 3 | L461: 8 | M461: =K461*6+L461 -> 26 | O461: 8 | P461: 15 | Q461: =O461*6+P461 -> 63 | S461: PASK
A462: BEST PLAYERS
A463: WILLIAMSTOWN | C463: PAPLEY | F463: THOMPSON | I463: BARNES | L463: O'MARA | O463: HAYWARD | R463: HARVEY
A464: OAKLEIGH | C464: KING | F464: SYKES | I464: BONESS | L464: BILLING | O464: FORD | R464: ARON
A465: GOALKICKERS
A466: WILLIAMSTOWN | C466: PATTERSON 6 | F466: JACKMAN 4 | I466: HAYWARD 3 | L466: BARNES 2 | N466: LANE | P466: THOMPSON
A467: OAKLEIGH | C467: BEARD 2 | F467: ARON 2 | I467: FORD | J467: ROBERTS | M467: JUDD | O467: KING
A469: WAVERLEY | C469: 3 | D469: 3 | E469: =C469*6+D469 -> 21 | G469: 11 | H469: 11 | I469: =G469*6+H469 -> 77 | K469: 16 | L469: 14 | M469: =K469*6+L469 -> 110 | O469: 23 | P469: 21 | Q469: =O469*6+P469 -> 159 | S469: WAVERLEY
A470: GEELONG WEST | C470: 4 | D470: 7 | E470: =C470*6+D470 -> 31 | G470: 6 | H470: 9 | I470: =G470*6+H470 -> 45 | K470: 6 | L470: 17 | M470: =K470*6+L470 -> 53 | O470: 9 | P470: 17 | Q470: =O470*6+P470 -> 71 | S470: ANDERSON
A471: BEST PLAYERS
A472: WAVERLEY | C472: BELL | F472: PITTS | I472: HORKINGS | L472: MORDEN | O472: PRICE | Q472: B ALLAN
A473: GEELONG WEST | C473: EMOND | F473: BRYANT | I473: GRATTON | L473: LARKINS | O473: SMITH | Q473: TREVASKIS
A474: GOALKICKERS
A475: WAVERLEY | C475: PITTS 6 | F475: PRICE 4 | H475: MORRIS 4 | J475: HORKINGS 2 | M475: BLEW 2 | O475: STONE 2 | Q475: BROWN | S475: BELL | U475: ARNOTT
A476: GEELONG WEST | C476: STRINGER 2 | F476: SMITH | H476: ROOM | J476: DEEATH | L476: M FRY | N476: GRATTON | P476: EMOND | R476: CROWE
A478: ROUND 11 | E478: 5TH JULY | M478: WEATHER | S478: PLAYED AT
D479: 1ST QTR | H479: 2ND QTR | L479: 3RD QTR | P479: FINAL | S479: DANDENONG
A480: DANDENONG | C480: 2 | D480: 4 | E480: =C480*6+D480 -> 16 | G480: 6 | H480: 6 | I480: =G480*6+H480 -> 42 | K480: 8 | L480: 10 | M480: =K480*6+L480 -> 58 | O480: 13 | P480: 14 | Q480: =O480*6+P480 -> 92 | S480: UMPIRE | X480: LADDER | AB480: ROUND | AD480: 11
A481: WAVERLEY | C481: 3 | D481: 5 | E481: =C481*6+D481 -> 23 | G481: 6 | H481: 8 | I481: =G481*6+H481 -> 44 | K481: 10 | L481: 9 | M481: =K481*6+L481 -> 69 | O481: 10 | P481: 10 | Q481: =O481*6+P481 -> 70 | S481: McMASTER
A482: BEST PLAYERS | W482: TEAM | X482: W | Y482: L | Z482: D | AA482: FOR | AB482: AGST | AC482: % | AD482: PTS
A483: DANDENONG | C483: MILLER | F483: ABRAHAM | I483: BETHKE | L483: FLAHERTY | O483: KENDALL | R483: McNAMARA
A484: WAVERLEY | C484: PITTS | F484: HORKINGS | I484: STONE | L484: PRICE | O484: BROWN | R484: BLEW | W484: PRAHRAN | X484: 9 | Y484: 2 | Z484: 0 | AA484: 1340 | AB484: 951 | AC484: 140.9043112513144 | AD484: 36
A485: GOALKICKERS | W485: WAVERLEY | X485: 8 | Y485: 3 | Z485: 0 | AA485: 1283 | AB485: 966 | AC485: 132.82 | AD485: 32
A486: DANDENONG | C486: MILLER 8 | F486: SHEEHAN 2 | I486: GUINANE | K486: FLAHERTY | N486: DAVENPORT | W486: SANDRINGHAM | X486: 8 | Y486: 3 | Z486: 0 | AA486: 1292 | AB486: 1183 | AC486: 109.21386306001691 | AD486: 32
A487: WAVERLEY | C487: PITTS 3 | F487: PRICE 2 | I487: HORKINGS 2 | L487: BLEW | N487: STONE | P487: BELL | W487: PORT MELBOURNE | X487: 7 | Y487: 4 | Z487: 0 | AA487: 1189 | AB487: 892 | AC487: 133.29596412556054 | AD487: 28
A489: PRAHRAN | C489: 2 | D489: 3 | E489: =C489*6+D489 -> 15 | G489: 3 | H489: 6 | I489: =G489*6+H489 -> 24 | K489: 7 | L489: 8 | M489: =K489*6+L489 -> 50 | O489: 10 | P489: 11 | Q489: =O489*6+P489 -> 71 | S489: PRESTON | W489: DANDENONG | X489: 7 | Y489: 4 | Z489: 0 | AA489: 1174 | AB489: 947 | AC489: 123.97043294614572 | AD489: 28
A490: PRESTON | C490: 3 | D490: 5 | E490: =C490*6+D490 -> 23 | G490: 3 | H490: 10 | I490: =G490*6+H490 -> 28 | K490: 5 | L490: 15 | M490: =K490*6+L490 -> 45 | O490: 7 | P490: 17 | Q490: =O490*6+P490 -> 59 | S490: TURNER | W490: WILLIAMSTOWN | X490: 7 | Y490: 4 | Z490: 0 | AA490: 1149 | AB490: 1018 | AC490: 112.86836935166994 | AD490: 28
A491: BEST PLAYERS | W491: PRESTON | X491: 5 | Y491: 6 | Z491: 0 | AA491: 942 | AB491: 1015 | AC491: 92.807881773399018 | AD491: 20
A492: PRAHRAN | C492: RUTH | F492: KENNEALLY | I492: HUTCHESSON | L492: BARTLETT | O492: KARANICOLAS | R492: CROWE | W492: GEELONG WEST | X492: 3 | Y492: 8 | Z492: 0 | AA492: 999 | AB492: 1436 | AC492: 69.57 | AD492: 12
A493: PRESTON | C493: BROWNE | F493: MARTIN | I493: HILL | L493: GIBLETT | O493: FISHER | R493: FAWCETT | W493: OAKLEIGH | X493: 1 | Y493: 10 | Z493: 0 | AA493: 876 | AB493: 1270 | AC493: 68.976377952755911 | AD493: 4
A494: GOALKICKERS | W494: YARRAVILLE | X494: 0 | Y494: 11 | Z494: 0 | AA494: 936 | AB494: 1502 | AC494: 62.316910785619172 | AD494: 0
A495: PRAHRAN | C495: KARANICHOLAS 2 | G495: HUTCHESSON 2 | J495: PARKER 2 | M495: POWER 2 | O495: FAHEY | Q495: DOWSING
A496: PRESTON | C496: BROWNE 2 | F496: LESLIE 2 | I496: REID | K496: GOAD | M496: GIBLETT
A498: GEELONG WEST | C498: 6 | D498: 7 | E498: =C498*6+D498 -> 43 | G498: 11 | H498: 11 | I498: =G498*6+H498 -> 77 | K498: 13 | L498: 14 | M498: =K498*6+L498 -> 92 | O498: 15 | P498: 19 | Q498: =O498*6+P498 -> 109 | S498: GEELONG WEST
A499: WILLIAMSTOWN | C499: 3 | D499: 0 | E499: =C499*6+D499 -> 18 | G499: 5 | H499: 6 | I499: =G499*6+H499 -> 36 | K499: 10 | L499: 10 | M499: =K499*6+L499 -> 70 | O499: 13 | P499: 14 | Q499: =O499*6+P499 -> 92 | S499: TORNEY
A500: BEST PLAYERS
A501: GEELONG WEST | C501: LARKINS | F501: SMITH | I501: ROOM | K501: PIEC | N501: GRATTON | Q501: BARRY
A502: WILLIAMSTOWN | C502: HARVEY | F502: JACKMAN | I502: BYERS | K502: THOMPSON | N502: MITCHELL | Q502: FANNING
A503: GOALKICKERS
A504: GEELONG WEST | C504: PIEC 6 | F504: GRATTON 3 | I504: SMITH 2 | K504: STRINGER | M504: TENABEL | O504: EMOND | Q504: TREVASKIS
A505: WILLIAMSTOWN | C505: JACKMAN 4 | F505: FANNING 4 | I505: SMITH 2 | K505: PATTERSON | N505: THOMPSON | Q505: BUCHANAN
A507: PORT MELBOURNE | C507: 2 | D507: 1 | E507: =C507*6+D507 -> 13 | G507: 5 | H507: 8 | I507: =G507*6+H507 -> 38 | K507: 7 | L507: 10 | M507: =K507*6+L507 -> 52 | O507: 9 | P507: 13 | Q507: =O507*6+P507 -> 67 | S507: OAKLEIGH
A508: OAKLEIGH | C508: 2 | D508: 6 | E508: =C508*6+D508 -> 18 | G508: 3 | H508: 9 | I508: =G508*6+H508 -> 27 | K508: 4 | L508: 15 | M508: =K508*6+L508 -> 39 | O508: 7 | P508: 15 | Q508: =O508*6+P508 -> 57 | S508: GAMBETTA
A509: BEST PLAYERS
A510: PORT MELBOURNE | C510: BONNETT | F510: CAULFIELD | I510: GROVER | L510: AANENSEN | O510: MACRAE | Q510: GOSS
A511: OAKLEIGH | C511: FORD | F511: ROBERTS | I511: BEARD | L511: FRYER | O511: ARON | Q511: KING
A512: GOALKICKERS
A513: PORT MELBOURNE | C513: GOSS 2 | F513: AANENSEN 2 | I513: BARCLAY | K513: G ALLEN | N513: BUCKLEY | P513: MACRAE | R513: MALLETT
A514: OAKLEIGH | C514: BEARD 2 | F514: FORD 2 | I514: ROBERTS | K514: McCORKELL | N514: BILLINGS
A516: SANDRINGHAM | C516: 5 | D516: 2 | E516: =C516*6+D516 -> 32 | G516: 10 | H516: 8 | I516: =G516*6+H516 -> 68 | K516: 13 | L516: 13 | M516: =K516*6+L516 -> 91 | O516: 22 | P516: 20 | Q516: =O516*6+P516 -> 152 | S516: BEACH ROAD
A517: YARRAVILLE | C517: 2 | D517: 3 | E517: =C517*6+D517 -> 15 | G517: 5 | H517: 6 | I517: =G517*6+H517 -> 36 | K517: 8 | L517: 9 | M517: =K517*6+L517 -> 57 | O517: 13 | P517: 9 | Q517: =O517*6+P517 -> 87 | S517: HOLZER
A518: BEST PLAYERS
A519: SANDRINGHAM | C519: BUSSE | F519: SPURRELL | I519: HOGAN | L519: SAMPSON | O519: AUSTIN | Q519: J WARD
A520: YARRAVILLE | C520: TAURENS | F520: SMITH | I520: VAN LINT | L520: MATHESON | O520: HERIOT | Q520: COOK
A521: GOALKICKERS
A522: SANDRINGHAM | C522: SAMPSON 7 | F522: SPURRELL 5 | I522: HOGAN 2 | K522: WALFORD 2 | N522: J WARD 2 | Q522: AUSTIN 2 | S522: ZEUSCHNER | V522: ANTONIE
A523: YARRAVILLE | C523: HEYME 3 | F523: MARTIN 2 | I523: CONNELLY | K523: COOK | M523: BONGETTI | O523: HERIOT | Q523: SQUIRES | S523: COLLINS | V523: BARROW | X523: SALMON
A525: ROUND 12 | E525: 12TH JULY | M525: WEATHER | S525: PLAYED AT
D526: 1ST QTR | H526: 2ND QTR | L526: 3RD QTR | P526: FINAL | S526: WAVERLEY
A527: PRAHRAN | C527: 6 | D527: 3 | E527: =C527*6+D527 -> 39 | G527: 7 | H527: 6 | I527: =G527*6+H527 -> 48 | K527: 10 | L527: 7 | M527: =K527*6+L527 -> 67 | O527: 10 | P527: 8 | Q527: =O527*6+P527 -> 68 | S527: UMPIRE | X527: LADDER | AB527: ROUND | AD527: 12
A528: WAVERLEY | C528: 2 | D528: 3 | E528: =C528*6+D528 -> 15 | G528: 3 | H528: 8 | I528: =G528*6+H528 -> 26 | K528: 5 | L528: 9 | M528: =K528*6+L528 -> 39 | O528: 9 | P528: 10 | Q528: =O528*6+P528 -> 64 | S528: GAMBETTA
A529: BEST PLAYERS | W529: TEAM | X529: W | Y529: L | Z529: D | AA529: FOR | AB529: AGST | AC529: % | AD529: PTS
A530: PRAHRAN | C530: CROWE | F530: BARTLETT | J530: DICKESON | M530: ROSE | O530: HUTCHESSON | R530: KNOX
A531: WAVERLEY | C531: STONE | F531: BROWN | J531: BLEW | M531: EBERT | O531: PITTS | R531: LANG | W531: PRAHRAN | X531: 10 | Y531: 2 | Z531: 0 | AA531: 1408 | AB531: 1015 | AC531: 138.7192118226601 | AD531: 40
A532: GOALKICKERS | W532: PORT MELBOURNE | X532: 8 | Y532: 4 | Z532: 0 | AA532: 1319 | AB532: 983 | AC532: 134.18107833163785 | AD532: 32
A533: PRAHRAN | C533: KNOX 2 | E533: CAFFYN 2 | G533: BARTLETT 2 | J533: HUTCHESSON | M533: PARKER | O533: KARANICHOLAS | R533: JUNGWIRTH | W533: WAVERLEY | X533: 8 | Y533: 4 | Z533: 0 | AA533: 1347 | AB533: 1034 | AC533: 130.27 | AD533: 32
A534: WAVERLEY | C534: EBERT 2 | F534: HORKINGS 2 | I534: MORRIS | K534: BLEW | M534: POORE | O534: STONE | Q534: BELL | W534: WILLIAMSTOWN | X534: 8 | Y534: 4 | Z534: 0 | AA534: 1303 | AB534: 1139 | AC534: 114.39859525899912 | AD534: 32
A536: PORT MELBOURNE | C536: 4 | D536: 6 | E536: =C536*6+D536 -> 30 | G536: 6 | H536: 13 | I536: =G536*6+H536 -> 49 | K536: 12 | L536: 17 | M536: =K536*6+L536 -> 89 | O536: 18 | P536: 22 | Q536: =O536*6+P536 -> 130 | S536: PORT MELBOURNE | W536: SANDRINGHAM | X536: 8 | Y536: 4 | Z536: 0 | AA536: 1383 | AB536: 1313 | AC536: 105.33130236100533 | AD536: 32
A537: SANDRINGHAM | C537: 4 | D537: 2 | E537: =C537*6+D537 -> 26 | G537: 6 | H537: 4 | I537: =G537*6+H537 -> 40 | K537: 11 | L537: 8 | M537: =K537*6+L537 -> 74 | O537: 13 | P537: 13 | Q537: =O537*6+P537 -> 91 | S537: ANDERSON | W537: DANDENONG | X537: 7 | Y537: 5 | Z537: 0 | AA537: 1273 | AB537: 1079 | AC537: 117.97961075069509 | AD537: 28
A538: BEST PLAYERS | W538: PRESTON | X538: 6 | Y538: 6 | Z538: 0 | AA538: 1074 | AB538: 1114 | AC538: 96.409335727109521 | AD538: 24
A539: PORT MELBOURNE | C539: AANENSEN | F539: N GOSS | I539: MALLETT | L539: BONNETT | O539: G ALLEN | R539: HAYES | W539: GEELONG WEST | X539: 3 | Y539: 9 | Z539: 0 | AA539: 1117 | AB539: 1576 | AC539: 70.88 | AD539: 12
A540: SANDRINGHAM | C540: STEPHENS | F540: BUSSE | I540: AUSTIN | L540: J WARD | O540: HOGAN | R540: ZEUSCHNER | W540: OAKLEIGH | X540: 2 | Y540: 10 | Z540: 0 | AA540: 1016 | AB540: 1388 | AC540: 73.198847262247838 | AD540: 8
A541: GOALKICKERS | W541: YARRAVILLE | X541: 0 | Y541: 12 | Z541: 0 | AA541: 1057 | AB541: 1656 | AC541: 63.828502415458935 | AD541: 0
A542: PORT MELBOURNE | C542: HAYES 5 | F542: AANENSEN 5 | I542: N GOSS 2 | K542: G ALLEN 2 | M542: BUCKLEY | O542: MACRAE | Q542: MALLETT | S542: GROWCOTT
A543: SANDRINGHAM | C543: STEPHENS 4 | F543: HOGAN 3 | I543: J WARD 2 | K543: WALFORD | M543: ZEUSCHNER | O543: AUSTIN | Q543: SAMPSON
A545: PRESTON | C545: 4 | D545: 5 | E545: =C545*6+D545 -> 29 | G545: 8 | H545: 10 | I545: =G545*6+H545 -> 58 | K545: 14 | L545: 16 | M545: =K545*6+L545 -> 100 | O545: 19 | P545: 18 | Q545: =O545*6+P545 -> 132 | S545: PRESTON
A546: DANDENONG | C546: 5 | D546: 1 | E546: =C546*6+D546 -> 31 | G546: 7 | H546: 5 | I546: =G546*6+H546 -> 47 | K546: 9 | L546: 5 | M546: =K546*6+L546 -> 59 | O546: 15 | P546: 9 | Q546: =O546*6+P546 -> 99 | S546: McKENZIE
A547: BEST PLAYERS
A548: PRESTON | C548: BROWNE | F548: JOYCE | I548: McLEAN | L548: HILL | N548: FISHER | Q548: TELFORD
A549: DANDENONG | C549: FLAHERTY | F549: ABRAHAM | I549: ELLIS | L549: DAVIES | N549: KENDALL | Q549: MILLER
A550: GOALKICKERS
A551: PRESTON | C551: JOYCE 8 | F551: GIBLETT 4 | I551: McLEAN 3 | L551: LESLIE 2 | N551: GOAD | P551: FISHER
A552: DANDENONG | C552: MILLER 6 | F552: FLAHERTY 5 | I552: DAVENPORT | L552: MELAI | N552: McNAMARA | Q552: DAVIES
A554: OAKLEIGH | C554: 5 | D554: 3 | E554: =C554*6+D554 -> 33 | G554: 10 | H554: 8 | I554: =G554*6+H554 -> 68 | K554: 15 | L554: 13 | M554: =K554*6+L554 -> 103 | O554: 21 | P554: 14 | Q554: =O554*6+P554 -> 140 | S554: OAKLEIGH
A555: GEELONG WEST | C555: 6 | D555: 6 | E555: =C555*6+D555 -> 42 | G555: 9 | H555: 9 | I555: =G555*6+H555 -> 63 | K555: 12 | L555: 9 | M555: =K555*6+L555 -> 81 | O555: 18 | P555: 10 | Q555: =O555*6+P555 -> 118 | S555: DUGARD
A556: BEST PLAYERS
A557: OAKLEIGH | C557: FORD | F557: BEARD | I557: KING | L557: McCORKELL | O557: ARON
A558: GEELONG WEST | C558: BRYANT | F558: TENABEL | I558: DEEATH | L558: PIEC | O558: GRATTON
A559: GOALKICKERS
A560: OAKLEIGH | C560: FORD 3 | E560: BEARD 3 | G560: ARON 3 | I560: LYON 3 | K560: ROBERTS 2 | N560: KING 2 | P560: GORDES 2 | R560: McCORKELL 2 | V560: SYKES
A561: GEELONG WEST | C561: DEEATH 4 | F561: SMITH 4 | H561: TREVASKIS 3 | K561: PIEC 2 | M561: TENABEL 2 | P561: GRATTON | R561: STRINGER | U561: EMOND | W561: STACEY
A563: WILLIAMSTOWN | C563: 4 | D563: 7 | E563: =C563*6+D563 -> 31 | G563: 10 | H563: 15 | I563: =G563*6+H563 -> 75 | K563: 13 | L563: 17 | M563: =K563*6+L563 -> 95 | O563: 22 | P563: 22 | Q563: =O563*6+P563 -> 154 | S563: YARRAVILLE
A564: YARRAVILLE | C564: 2 | D564: 3 | E564: =C564*6+D564 -> 15 | G564: 4 | H564: 6 | I564: =G564*6+H564 -> 30 | K564: 12 | L564: 8 | M564: =K564*6+L564 -> 80 | O564: 18 | P564: 13 | Q564: =O564*6+P564 -> 121 | S564: McMASTER
A565: BEST PLAYERS
A566: WILLIAMSTOWN | C566: PATTERSON | F566: JACKMAN | I566: LANE | L566: SMITH | O566: BARNES | Q566: VAN LIEMPD
A567: YARRAVILLE | C567: COOK | F567: TAURENS | I567: DOWLING | L567: BONGETTI | O567: SMITH | Q567: MARTIN
A568: GOALKICKERS
A569: WILLIAMSTOWN | C569: PATTERSON 8 | F569: JACKMAN 5 | I569: LANE 3 | K569: FANNING 2 | N569: BARNES 2 | Q569: HAYWARD | T569: STARK
A570: YARRAVILLE | C570: MARTIN 3 | F570: BONGETTI 3 | I570: DOWLING 3 | L570: KEMP 2 | N570: RYAN 2 | P570: CONNELLY | R570: TAURENS | U570: WAGHORNE | X570: HEYME | Z570: SALMON
A572: ROUND 13 | D572: 18TH JULY | I572: WEATHER | M572: NORTH WEST WIND | S572: PLAYED AT
D573: 1ST QTR | H573: 2ND QTR | L573: 3RD QTR | P573: FINAL | S573: WILLIAMSTOWN
A574: WILLIAMSTOWN | C574: 4 | D574: 4 | E574: =C574*6+D574 -> 28 | G574: 10 | H574: 6 | I574: =G574*6+H574 -> 66 | K574: 20 | L574: 7 | M574: =K574*6+L574 -> 127 | O574: 22 | P574: 10 | Q574: =O574*6+P574 -> 142 | S574: UMPIRE | X574: LADDER | AB574: ROUND | AD574: 13
A575: WAVERLEY | C575: 5 | D575: 4 | E575: =C575*6+D575 -> 34 | G575: 9 | H575: 8 | I575: =G575*6+H575 -> 62 | K575: 10 | L575: 15 | M575: =K575*6+L575 -> 75 | O575: 13 | P575: 23 | Q575: =O575*6+P575 -> 101 | S575: ANDERSON
A576: BEST PLAYERS | W576: TEAM | X576: W | Y576: L | Z576: D | AA576: FOR | AB576: AGST | AC576: % | AD576: PTS
A577: WILLIAMSTOWN | C577: PATTERSON | F577: SMITH | I577: MEYERS | L577: HARVEY | O577: LANE | Q577: STARK
A578: WAVERLEY | C578: MORDEN | F578: B ALLAN | I578: BROWN | L578: POORE | O578: STONE | Q578: LANG | W578: PRAHRAN | X578: 11 | Y578: 2 | Z578: 0 | AA578: 1502 | AB578: 1099 | AC578: 136.66969972702458 | AD578: 44
A579: GOALKICKERS | W579: WILLIAMSTOWN | X579: 9 | Y579: 4 | Z579: 0 | AA579: 1445 | AB579: 1240 | AC579: 116.53225806451613 | AD579: 36
A580: WILLIAMSTOWN | C580: PATTERSON 10 | F580: SMITH 3 | H580: MEYERS 2 | J580: VAN LIMPD 2 | M580: FANNING 2 | P580: JACKMAN | R580: PAGE | T580: STARK | W580: PORT MELBOURNE | X580: 8 | Y580: 5 | Z580: 0 | AA580: 1403 | AB580: 1077 | AC580: 130.26926648096565 | AD580: 32
A581: WAVERLEY | C581: POORE 4 | E581: MORRIS 2 | G581: EBERT | I581: PRICE | K581: HORKINGS | M581: BLEW | O581: P STEPHENS | R581: PITTS | T581: BELL | W581: WAVERLEY | X581: 8 | Y581: 5 | Z581: 0 | AA581: 1448 | AB581: 1176 | AC581: 123.13 | AD581: 32
D582: 19TH JULY | I582: WEATHER | L582: WEST WIND RAIN
A583: PRAHRAN | C583: 4 | D583: 4 | E583: =C583*6+D583 -> 28 | G583: 9 | H583: 8 | I583: =G583*6+H583 -> 62 | K583: 10 | L583: 12 | M583: =K583*6+L583 -> 72 | O583: 13 | P583: 16 | Q583: =O583*6+P583 -> 94 | S583: TOORAK PARK | W583: DANDENONG | X583: 8 | Y583: 5 | Z583: 0 | AA583: 1395 | AB583: 1154 | AC583: 120.8838821490468 | AD583: 32
A584: PORT MELBOURNE | C584: 3 | D584: 5 | E584: =C584*6+D584 -> 23 | G584: 5 | H584: 8 | I584: =G584*6+H584 -> 38 | K584: 8 | L584: 11 | M584: =K584*6+L584 -> 59 | O584: 12 | P584: 12 | Q584: =O584*6+P584 -> 84 | S584: McKENZIE | W584: SANDRINGHAM | X584: 8 | Y584: 5 | Z584: 0 | AA584: 1483 | AB584: 1425 | AC584: 104.07017543859649 | AD584: 32
A585: BEST PLAYERS | W585: PRESTON | X585: 7 | Y585: 6 | Z585: 0 | AA585: 1186 | AB585: 1214 | AC585: 97.693574958813841 | AD585: 28
A586: PRAHRAN | C586: EMSELLE | F586: KARANICOLAS | I586: KNOX | L586: CROWE | N586: ROSE | Q586: RUTH | W586: GEELONG WEST | X586: 3 | Y586: 10 | Z586: 0 | AA586: 1191 | AB586: 1669 | AC586: 71.36 | AD586: 12
A587: PORT MELBOURNE | C587: MACRAE | F587: BEHAN | I587: MALLETT | L587: G ALLEN | N587: BONNETT | Q587: N GOSS | W587: OAKLEIGH | X587: 2 | Y587: 11 | Z587: 0 | AA587: 1091 | AB587: 1510 | AC587: 72.25165562913908 | AD587: 8
A588: GOALKICKERS | W588: YARRAVILLE | X588: 1 | Y588: 12 | Z588: 0 | AA588: 1150 | AB588: 1730 | AC588: 66.473988439306353 | AD588: 4
A589: PRAHRAN | C589: BARTLETT 4 | F589: KARANICHOLAS 3 | J589: KNOX 2 | L589: HUTCHESSON | O589: PARKER | Q589: EMSELLE | S589: MCKENZIE
A590: PORT MELBOURNE | C590: MACRAE 3 | F590: HAYES 2 | H590: GOSS | J590: M ALLEN | L590: G ALLEN | N590: BARCLAY | Q590: BUCKLEY | S590: AANENSEN | V590: BEHAN
A592: PRESTON | C592: 2 | D592: 3 | E592: =C592*6+D592 -> 15 | G592: 7 | H592: 9 | I592: =G592*6+H592 -> 51 | K592: 11 | L592: 13 | M592: =K592*6+L592 -> 79 | O592: 16 | P592: 16 | Q592: =O592*6+P592 -> 112 | S592: BEACH ROAD
A593: SANDRINGHAM | C593: 4 | D593: 0 | E593: =C593*6+D593 -> 24 | G593: 6 | H593: 5 | I593: =G593*6+H593 -> 41 | K593: 9 | L593: 6 | M593: =K593*6+L593 -> 60 | O593: 15 | P593: 10 | Q593: =O593*6+P593 -> 100 | S593: O'NEILL
A594: BEST PLAYERS
A595: PRESTON | C595: LESLIE | F595: McLEAN | I595: BROWNE | L595: FISHER | O595: TELFORD | R595: HILL
A596: SANDRINGHAM | C596: AUSTIN | F596: MORRIS | I596: WALFORD | L596: WILLS | O596: J STEPHENS | R596: MACK
A597: GOALKICKERS
A598: PRESTON | C598: JOYCE 3 | F598: LESLIE 3 | I598: McLEAN 3 | K598: LE GASSICK 2 | N598: RULE 2 | P598: GIBLETT 2 | R598: TELFORD
A599: SANDRINGHAM | C599: AUSTIN 5 | F599: HOGAN 2 | I599: STEPHENS 2 | L599: SAMPSON 2 | O599: MORRIS 2 | R599: ELLIS | T599: STEVENS
A601: YARRAVILLE | C601: 3 | D601: 4 | E601: =C601*6+D601 -> 22 | G601: 8 | H601: 8 | I601: =G601*6+H601 -> 56 | K601: 10 | L601: 11 | M601: =K601*6+L601 -> 71 | O601: 13 | P601: 15 | Q601: =O601*6+P601 -> 93 | S601: GEELONG WEST
A602: GEELONG WEST | C602: 3 | D602: 8 | E602: =C602*6+D602 -> 26 | G602: 4 | H602: 10 | I602: =G602*6+H602 -> 34 | K602: 8 | L602: 12 | M602: =K602*6+L602 -> 60 | O602: 10 | P602: 14 | Q602: =O602*6+P602 -> 74 | S602: JACKSON
A603: BEST PLAYERS
A604: YARRAVILLE | C604: COOK | F604: HEYME | I604: MADIGAN | L604: KEMP | O604: MARTIN | R604: HERIOT
A605: GEELONG WEST | C605: GRATTON | F605: TENABEL | I605: EMOND | L605: TREVASKIS | O605: BRYANT
A606: GOALKICKERS
A607: YARRAVILLE | C607: KEMP 4 | F607: MADIGAN 4 | I607: MARTIN 2 | L607: SQUIRES | N607: MATHESON | Q607: SALMON
A608: GEELONG WEST | C608: GRATTON 4 | F608: BRYANT 2 | I608: GILLIES | K608: STRINGER | N608: TENABEL | Q608: TREVASKIS
A610: DANDENONG | C610: 4 | D610: 7 | E610: =C610*6+D610 -> 31 | G610: 9 | H610: 7 | I610: =G610*6+H610 -> 61 | K610: 13 | L610: 10 | M610: =K610*6+L610 -> 88 | O610: 18 | P610: 14 | Q610: =O610*6+P610 -> 122 | S610: DANDENONG
A611: OAKLEIGH | C611: 0 | D611: 0 | E611: =C611*6+D611 -> 0 | G611: 3 | H611: 4 | I611: =G611*6+H611 -> 22 | K611: 4 | L611: 7 | M611: =K611*6+L611 -> 31 | O611: 10 | P611: 15 | Q611: =O611*6+P611 -> 75
A612: BEST PLAYERS
A613: DANDENONG | C613: DAVIES | F613: GUINANE | I613: ELLIS | L613: SHEEHAN | O613: DAVENPORT | R613: MILLER
A614: OAKLEIGH | C614: FORD | F614: LYON | I614: STEPHENS | L614: ROBERTS | O614: KING | R614: QUINN
A615: GOALKICKERS
A616: DANDENONG | C616: MILLER 7 | F616: DAVIES 4 | I616: GUINANE 3 | L616: FLAHERTY 2 | O616: DAVENPORT | R616: SHEEHAN
A617: OAKLEIGH | C617: FORD 5 | F617: LYON 3 | I617: ARON | K617: DE KRUIFF
A619: ROUND 14 | E619: 26TH JULY | L619: WEATHER | P619: SHOWERS | S619: PLAYED AT
D620: 1ST QTR | H620: 2ND QTR | L620: 3RD QTR | P620: FINAL | S620: TOORAK PARK
A621: PRAHRAN | C621: 6 | D621: 5 | E621: =C621*6+D621 -> 41 | G621: 10 | H621: 8 | I621: =G621*6+H621 -> 68 | K621: 12 | L621: 14 | M621: =K621*6+L621 -> 86 | O621: 19 | P621: 16 | Q621: =O621*6+P621 -> 130 | S621: UMPIRE | X621: LADDER | AB621: ROUND | AD621: 14
A622: WILLIAMSTOWN | C622: 3 | D622: 1 | E622: =C622*6+D622 -> 19 | G622: 4 | H622: 10 | I622: =G622*6+H622 -> 34 | K622: 8 | L622: 14 | M622: =K622*6+L622 -> 62 | O622: 11 | P622: 19 | Q622: =O622*6+P622 -> 85 | S622: DUGARD
A623: BEST PLAYERS | W623: TEAM | X623: W | Y623: L | Z623: D | AA623: FOR | AB623: AGST | AC623: % | AD623: PTS
A624: PRAHRAN | C624: HUTCHESSON | F624: DOWSING | I624: PEACH | L624: RUTH | O624: ROSE | Q624: KNOX
A625: WILLIAMSTOWN | C625: FANNING | F625: STARK | I625: HARVEY | L625: PERCY | O625: MEYERS | Q625: SMITH | W625: PRAHRAN | X625: 12 | Y625: 2 | Z625: 0 | AA625: 1632 | AB625: 1184 | AC625: 137.83783783783784 | AD625: 48
A626: GOALKICKERS | M626: DICKESON | P626: JUNGWIRTH | S626: EMSELLE | W626: PORT MELBOURNE | X626: 9 | Y626: 5 | Z626: 0 | AA626: 1532 | AB626: 1168 | AC626: 131.16438356164383 | AD626: 36
A627: PRAHRAN | C627: KNOX 5 | E627: KARANICHOLAS 3 | I627: BARTLETT 2 | L627: McKENZIE 2 | O627: DOWSING | Q627: ROSE | R627: RUTH | T627: PEACH | W627: DANDENONG | X627: 9 | Y627: 5 | Z627: 0 | AA627: 1555 | AB627: 1270 | AC627: 122.44094488188976 | AD627: 36
A628: WILLIAMSTOWN | C628: FANNING 3 | F628: SMITH 2 | I628: MEYERS 2 | K628: STARK | M628: BARNETT | O628: BARNES | Q628: WHITTINGTON | W628: WILLIAMSTOWN | X628: 9 | Y628: 5 | Z628: 0 | AA628: 1530 | AB628: 1370 | AC628: 111.67883211678833 | AD628: 36
A630: PRESTON | C630: 3 | D630: 6 | E630: =C630*6+D630 -> 24 | G630: 5 | H630: 10 | I630: =G630*6+H630 -> 40 | K630: 11 | L630: 11 | M630: =K630*6+L630 -> 77 | O630: 19 | P630: 17 | Q630: =O630*6+P630 -> 131 | S630: PRESTON | W630: WAVERLEY | X630: 8 | Y630: 6 | Z630: 0 | AA630: 1522 | AB630: 1307 | AC630: 116.45 | AD630: 32
A631: WAVERLEY | C631: 3 | D631: 3 | E631: =C631*6+D631 -> 21 | G631: 7 | H631: 8 | I631: =G631*6+H631 -> 50 | K631: 8 | L631: 9 | M631: =K631*6+L631 -> 57 | O631: 10 | P631: 14 | Q631: =O631*6+P631 -> 74 | S631: FLANAGAN | W631: PRESTON | X631: 8 | Y631: 6 | Z631: 0 | AA631: 1317 | AB631: 1288 | AC631: 102.25155279503106 | AD631: 32
A632: BEST PLAYERS | W632: SANDRINGHAM | X632: 8 | Y632: 6 | Z632: 0 | AA632: 1576 | AB632: 1561 | AC632: 100.96092248558617 | AD632: 32
A633: PRESTON | C633: TELFORD | F633: JOYCE | I633: HILL | L633: McARTHUR | O633: McLEAN | R633: REID | W633: OAKLEIGH | X633: 3 | Y633: 11 | Z633: 0 | AA633: 1227 | AB633: 1603 | AC633: 76.543980037429819 | AD633: 12
A634: WAVERLEY | C634: POORE | F634: BACKHOUSE | I634: B ALLAN | L634: BELL | O634: MORRIS | R634: A STEPHENS | W634: GEELONG WEST | X634: 3 | Y634: 11 | Z634: 0 | AA634: 1307 | AB634: 1829 | AC634: 71.46 | AD634: 12
A635: GOALKICKERS | W635: YARRAVILLE | X635: 1 | Y635: 13 | Z635: 0 | AA635: 1241 | AB635: 1859 | AC635: 66.756320602474446 | AD635: 4
A636: PRESTON | C636: JOYCE 7 | E636: BROWNE 2 | H636: McLEAN 2 | J636: GOAD 2 | L636: REID | M636: LESLIE | O636: RULE | Q636: GARRETT | S636: GIBLETT | U636: FISHER
A637: WAVERLEY | C637: P STEPHENS 2 | F637: A STEPHENS 2 | I637: BELL 2 | K637: POORE | M637: IVEY | O637: HARRY | Q637: MORRIS
A639: DANDENONG | C639: 8 | D639: 4 | E639: =C639*6+D639 -> 52 | G639: 13 | H639: 5 | I639: =G639*6+H639 -> 83 | K639: 20 | L639: 9 | M639: =K639*6+L639 -> 129 | O639: 24 | P639: 16 | Q639: =O639*6+P639 -> 160 | S639: GEELONG WEST
A640: GEELONG WEST | C640: 2 | D640: 6 | E640: =C640*6+D640 -> 18 | G640: 7 | H640: 11 | I640: =G640*6+H640 -> 53 | K640: 13 | L640: 11 | M640: =K640*6+L640 -> 89 | O640: 17 | P640: 14 | Q640: =O640*6+P640 -> 116 | S640: PASK
A641: BEST PLAYERS
A642: DANDENONG | C642: FLAHERTY | F642: SHEEHAN | I642: MILLER | L642: ABRAHAM | O642: DAVENPORT | R642: BETHKE
A643: GEELONG WEST | C643: GRATTON | F643: EMOND | I643: TREVASKIS | L643: HAMILTON | O643: STRINGER | R643: PIEC
A644: GOALKICKERS
A645: DANDENONG | C645: MILLER 6 | F645: FLAHERTY 5 | I645: SHEEHAN 4 | L645: GUINANE 4 | O645: NANKERVIS 2 | R645: DAVIES 2 | U645: GOODE
A646: GEELONG WEST | C646: GRATTON 4 | F646: TREVASKIS 4 | I646: SMITH 3 | K646: PIEC 2 | M646: EMOND 2 | O646: STRINGER | R646: BRYANT
A648: OAKLEIGH | C648: 6 | D648: 10 | E648: =C648*6+D648 -> 46 | G648: 7 | H648: 13 | I648: =G648*6+H648 -> 55 | K648: 12 | L648: 15 | M648: =K648*6+L648 -> 87 | O648: 20 | P648: 16 | Q648: =O648*6+P648 -> 136 | S648: OAKLEIGH
A649: SANDRINGHAM | C649: 1 | D649: 1 | E649: =C649*6+D649 -> 7 | G649: 9 | H649: 5 | I649: =G649*6+H649 -> 59 | K649: 12 | L649: 7 | M649: =K649*6+L649 -> 79 | O649: 14 | P649: 9 | Q649: =O649*6+P649 -> 93 | S649: TURNER
A650: BEST PLAYERS
A651: OAKLEIGH | C651: KING | F651: BILLING | I651: FORD | L651: BEARD | N651: LYON | Q651: ROBERTS
A652: SANDRINGHAM | C652: BUSSE | F652: AUSTIN | I652: ZEUSCHNER | L652: WILLS | N652: WALFORD | Q652: ALLEN
A653: GOALKICKERS
A654: OAKLEIGH | C654: ARON 5 | E654: LYON 3 | G654: FORD 3 | I654: JUDD 3 | K654: KING 3 | M654: McCORKELL 2 | P654: ROBERTS
A655: SANDRINGHAM | C655: DARE 3 | E655: HOGAN 2 | G655: ZEUSCHNER 2 | J655: ELLIS 2 | L655: STEVENS 2 | O655: STEPHENS | Q655: AUSTIN | S655: MORRIS
A657: PORT MELBOURNE | C657: 6 | D657: 2 | E657: =C657*6+D657 -> 38 | G657: 9 | H657: 7 | I657: =G657*6+H657 -> 61 | K657: 12 | L657: 8 | M657: =K657*6+L657 -> 80 | O657: 19 | P657: 15 | Q657: =O657*6+P657 -> 129 | S657: PORT MELBOURNE
A658: YARRAVILLE | C658: 1 | D658: 7 | E658: =C658*6+D658 -> 13 | G658: 3 | H658: 10 | I658: =G658*6+H658 -> 28 | K658: 10 | L658: 16 | M658: =K658*6+L658 -> 76 | O658: 12 | P658: 19 | Q658: =O658*6+P658 -> 91 | S658: O'NEILL
A659: BEST PLAYERS
A660: PORT MELBOURNE | C660: N GOSS | F660: BUCKLEY | I660: G ALLEN | L660: BONNETT | O660: MACRAE | R660: MALLETT
A661: YARRAVILLE | C661: COOK | F661: HERIOT | I661: BARROW | L661: MARTIN | O661: VAN LINT | R661: CHARLES
A662: GOALKICKERS
A663: PORT MELBOURNE | C663: N GOSS 6 | F663: MACRAE 3 | I663: HAYES 2 | K663: BONNETT 2 | N663: BEHAN | P663: EKLUND | R663: BUCKLEY | U663: MALLETT | X663: M ALLEN | AA663: JEACLE
A664: YARRAVILLE | C664: MARTIN 3 | F664: SALMON 3 | I664: MANGAN 2 | L664: KEMP | N664: COOK | P664: BONGETTI | R664: CHARLES
A666: ROUND 15 | E666: 2ND AUGUST | J666: WEATHER | N666: WEST WIND | S666: PLAYED AT
D667: 1ST QTR | H667: 2ND QTR | L667: 3RD QTR | P667: FINAL | S667: WILLIAMSTOWN
A668: WILLIAMSTOWN | C668: 5 | D668: 4 | E668: =C668*6+D668 -> 34 | G668: 7 | H668: 7 | I668: =G668*6+H668 -> 49 | K668: 10 | L668: 10 | M668: =K668*6+L668 -> 70 | O668: 13 | P668: 11 | Q668: =O668*6+P668 -> 89 | S668: UMPIRE | X668: LADDER | AB668: ROUND | AD668: 15
A669: DANDENONG | C669: 1 | D669: 2 | E669: =C669*6+D669 -> 8 | G669: 8 | H669: 6 | I669: =G669*6+H669 -> 54 | K669: 8 | L669: 9 | M669: =K669*6+L669 -> 57 | O669: 12 | P669: 12 | Q669: =O669*6+P669 -> 84 | S669: O'NEILL
A670: BEST PLAYERS | W670: TEAM | X670: W | Y670: L | Z670: D | AA670: FOR | AB670: AGST | AC670: % | AD670: PTS
A671: WILLIAMSTOWN | C671: O'MARA | F671: JACKMAN | I671: HARVEY | K671: PAPLEY | N671: LANE | Q671: BARNES
A672: DANDENONG | C672: DAVIES | F672: GUINANE | I672: ELLIS | K672: SHEEHAN | N672: ABRAHAM | Q672: BETHKE | W672: PRAHRAN | X672: 13 | Y672: 2 | Z672: 0 | AA672: 1767 | AB672: 1272 | AC672: 138.91509433962264 | AD672: 52
A673: GOALKICKERS | W673: WILLIAMSTOWN | X673: 10 | Y673: 5 | Z673: 0 | AA673: 1619 | AB673: 1454 | AC673: 111.34800550206327 | AD673: 40
A674: WILLIAMSTOWN | C674: FANNING 3 | F674: BARNES 3 | I674: PAPLEY 2 | K674: SMITH | M674: JACKMAN | O674: PAGE | Q674: MEYERS | S674: VAN LIMPD | W674: PORT MELBOURNE | X674: 9 | Y674: 6 | Z674: 0 | AA674: 1620 | AB674: 1284 | AC674: 126.16822429906541 | AD674: 36
A675: DANDENONG | C675: GUINANE 4 | F675: NANKERVIS 3 | I675: DAVIES 2 | K675: MILLER | M675: FLAHERTY | O675: ROBERTSON | W675: DANDENONG | X675: 9 | Y675: 6 | Z675: 0 | AA675: 1639 | AB675: 1359 | AC675: 120.60338484179543 | AD675: 36
A677: WAVERLEY | C677: 5 | D677: 4 | E677: =C677*6+D677 -> 34 | G677: 7 | H677: 7 | I677: =G677*6+H677 -> 49 | K677: 11 | L677: 16 | M677: =K677*6+L677 -> 82 | O677: 16 | P677: 20 | Q677: =O677*6+P677 -> 116 | S677: WAVERLEY | W677: WAVERLEY | X677: 9 | Y677: 6 | Z677: 0 | AA677: 1638 | AB677: 1395 | AC677: 117.42 | AD677: 36
A678: PORT MELBOURNE | C678: 2 | D678: 1 | E678: =C678*6+D678 -> 13 | G678: 9 | H678: 5 | I678: =G678*6+H678 -> 59 | K678: 12 | L678: 7 | M678: =K678*6+L678 -> 79 | O678: 13 | P678: 10 | Q678: =O678*6+P678 -> 88 | S678: TURNER | W678: SANDRINGHAM | X678: 9 | Y678: 6 | Z678: 0 | AA678: 1736 | AB678: 1625 | AC678: 106.83076923076923 | AD678: 36
A679: BEST PLAYERS | W679: PRESTON | X679: 9 | Y679: 6 | Z679: 0 | AA679: 1475 | AB679: 1408 | AC679: 104.75852272727273 | AD679: 36
A680: WAVERLEY | C680: B ALLAN | F680: PITTS | I680: MORDEN | L680: BLEW | O680: A STEPHENS | W680: OAKLEIGH | X680: 3 | Y680: 12 | Z680: 0 | AA680: 1347 | AB680: 1761 | AC680: 76.490630323679724 | AD680: 12
A681: PORT MELBOURNE | C681: BONNETT | F681: BEHAN | I681: ECKLUND | L681: MACRAE | O681: CAULFIELD | R681: MALLETT | W681: GEELONG WEST | X681: 3 | Y681: 12 | Z681: 0 | AA681: 1371 | AB681: 1989 | AC681: 68.93 | AD681: 12
A682: GOALKICKERS | W682: YARRAVILLE | X682: 1 | Y682: 14 | Z682: 0 | AA682: 1329 | AB682: 1994 | AC682: 66.649949849548648 | AD682: 4
A683: WAVERLEY | C683: MORRIS 4 | F683: BLEW 3 | H683: PITTS 2 | J683: ALLAN 2 | L683: BELL | M683: POORE | O683: STONE | Q683: EBERT | S683: A STEPHENS
A684: PORT MELBOURNE | C684: EKLUND 3 | F684: GOSS 2 | H684: MACRAE 2 | J684: BEHAN | L684: BONNETT | N684: BUCKLEY | P684: AANENSEN | R684: HOLT | T684: JEACLE
A686: PRESTON | C686: 7 | D686: 2 | E686: =C686*6+D686 -> 44 | G686: 10 | H686: 7 | I686: =G686*6+H686 -> 67 | K686: 18 | L686: 8 | M686: =K686*6+L686 -> 116 | O686: 24 | P686: 14 | Q686: =O686*6+P686 -> 158 | S686: PRESTON
A687: OAKLEIGH | C687: 7 | D687: 5 | E687: =C687*6+D687 -> 47 | G687: 12 | H687: 7 | I687: =G687*6+H687 -> 79 | K687: 17 | L687: 9 | M687: =K687*6+L687 -> 111 | O687: 18 | P687: 12 | Q687: =O687*6+P687 -> 120 | S687: McMASTER
A688: BEST PLAYERS
A689: PRESTON | C689: BROWNE | F689: FISHER | I689: JOYCE | L689: WEIGHTMAN | O689: HILL | Q689: MARTIN
A690: OAKLEIGH | C690: BEARD | F690: KING | I690: BILLING | L690: TRAILL | O690: LYON | Q690: MURNANE
A691: GOALKICKERS
A692: PRESTON | C692: JOYCE 9 | F692: McLEAN 4 | I692: WEIGHTMAN 3 | L692: LESLIE 3 | N692: RULE 3 | P692: GIBLETT 2
A693: OAKLEIGH | C693: BEARD 3 | E693: JUDD 3 | G693: KING 3 | I693: SMITH 3 | K693: LYON 3 | M693: ARON | N693: BILLINGS | Q693: FRYER
A695: SANDRINGHAM | C695: 3 | D695: 1 | E695: =C695*6+D695 -> 19 | G695: 8 | H695: 7 | I695: =G695*6+H695 -> 55 | K695: 19 | L695: 9 | M695: =K695*6+L695 -> 123 | O695: 24 | P695: 16 | Q695: =O695*6+P695 -> 160 | S695: BEACH ROAD
A696: GEELONG WEST | C696: 2 | D696: 6 | E696: =C696*6+D696 -> 18 | G696: 2 | H696: 9 | I696: =G696*6+H696 -> 21 | K696: 7 | L696: 15 | M696: =K696*6+L696 -> 57 | O696: 8 | P696: 16 | Q696: =O696*6+P696 -> 64 | S696: FLANAGAN
A697: BEST PLAYERS
A698: SANDRINGHAM | C698: J STEPHENS | G698: HANCE | J698: ANTONIE | M698: LOCKHART | P698: WILLS
A699: GEELONG WEST | C699: BARRY | G699: PIEC | J699: GRATTON | M699: EMOND | P699: TENABEL
A700: GOALKICKERS
A701: SANDRINGHAM | C701: STEPHENS 10 | F701: J WARD 4 | I701: HUTCHINSON 4 | L701: FENTON 2 | O701: WALFORD | Q701: AUSTIN | S701: ANTONIE | V701: STEVENS
A702: GEELONG WEST | C702: TEAGUE 4 | F702: STRINGER | I702: PIEC | J702: GRATTON | L702: EMOND
A704: PRAHRAN | C704: 5 | D704: 1 | E704: =C704*6+D704 -> 31 | G704: 7 | H704: 6 | I704: =G704*6+H704 -> 48 | K704: 9 | L704: 10 | M704: =K704*6+L704 -> 64 | O704: 19 | P704: 21 | Q704: =O704*6+P704 -> 135 | S704: YARRAVILLE
A705: YARRAVILLE | C705: 4 | D705: 1 | E705: =C705*6+D705 -> 25 | G705: 6 | H705: 5 | I705: =G705*6+H705 -> 41 | K705: 12 | L705: 9 | M705: =K705*6+L705 -> 81 | O705: 13 | P705: 10 | Q705: =O705*6+P705 -> 88 | S705: ANDERSON
A706: BEST PLAYERS
A707: PRAHRAN | C707: CROWE | F707: BARTLETT | I707: EMSELLE | L707: ROSE | O707: HUTCHESSON | R707: KNOX
A708: YARRAVILLE | C708: MARTIN | F708: COOK | I708: SALMON | L708: HERIOT | O708: MATHESON | R708: BARROW
A709: GOALKICKERS
A710: PRAHRAN | C710: KNOX 6 | F710: BARTLETT 5 | I710: HUTCHESSON 2 | L710: EMSELLE 2 | N710: DOWSING 2 | Q710: CROWE | S710: PEACH
A711: YARRAVILLE | C711: HERIOT 4 | F711: COOK 3 | H711: MARTIN 2 | J711: SALMON 2 | M711: MADIGAN | P711: MUMFORD
A713: ROUND 16 | E713: 9TH AUGUST | J713: WEATHER | N713: NORTH WIND | S713: PLAYED AT
D714: 1ST QTR | H714: 2ND QTR | L714: 3RD QTR | P714: FINAL | S714: PORT MELBOURNE
A715: WILLIAMSTOWN | C715: 4 | D715: 7 | E715: =C715*6+D715 -> 31 | G715: 5 | H715: 10 | I715: =G715*6+H715 -> 40 | K715: 12 | L715: 14 | M715: =K715*6+L715 -> 86 | O715: 13 | P715: 17 | Q715: =O715*6+P715 -> 95 | S715: UMPIRE | X715: LADDER | AB715: ROUND | AD715: 16
A716: PORT MELBOURNE | C716: 2 | D716: 4 | E716: =C716*6+D716 -> 16 | G716: 7 | H716: 9 | I716: =G716*6+H716 -> 51 | K716: 8 | L716: 11 | M716: =K716*6+L716 -> 59 | O716: 11 | P716: 16 | Q716: =O716*6+P716 -> 82 | S716: FLANAGAN
A717: BEST PLAYERS | W717: TEAM | X717: W | Y717: L | Z717: D | AA717: FOR | AB717: AGST | AC717: % | AD717: PTS
A718: WILLIAMSTOWN | C718: PAPLEY | F718: BARNES | I718: WHITTINGTON | M718: O'MARA | P718: SMITH
A719: PORT MELBOURNE | C719: BEHAN | F719: BUCKLEY | I719: GROVER | M719: BONNETT | P719: MACRAE | W719: PRAHRAN | X719: 14 | Y719: 2 | Z719: 0 | AA719: 1882 | AB719: 1384 | AC719: 135.98265895953756 | AD719: 56
A720: GOALKICKERS | W720: WILLIAMSTOWN | X720: 11 | Y720: 5 | Z720: 0 | AA720: 1714 | AB720: 1536 | AC720: 111.58854166666667 | AD720: 44
A721: WILLIAMSTOWN | C721: PAPLEY 3 | F721: BARNES 3 | I721: VAN LIMPD 2 | L721: WHITTINGTON 2 | P721: SMITH | R721: MEYERS | T721: BAHR | W721: WAVERLEY | X721: 10 | Y721: 6 | Z721: 0 | AA721: 1737 | AB721: 1490 | AC721: 116.58 | AD721: 40
A722: PORT MELBOURNE | C722: NORTON 6 | F722: MACRAE 3 | I722: GOSS | K722: M ALLEN | W722: SANDRINGHAM | X722: 10 | Y722: 6 | Z722: 0 | AA722: 1836 | AB722: 1703 | AC722: 107.80974750440399 | AD722: 40
A724: SANDRINGHAM | C724: 0 | D724: 0 | E724: =C724*6+D724 -> 0 | G724: 7 | H724: 3 | I724: =G724*6+H724 -> 45 | K724: 9 | L724: 5 | M724: =K724*6+L724 -> 59 | O724: 15 | P724: 10 | Q724: =O724*6+P724 -> 100 | S724: DANDENONG | W724: PRESTON | X724: 10 | Y724: 6 | Z724: 0 | AA724: 1585 | AB724: 1508 | AC724: 105.10610079575596 | AD724: 40
A725: DANDENONG | C725: 7 | D725: 9 | E725: =C725*6+D725 -> 51 | G725: 8 | H725: 10 | I725: =G725*6+H725 -> 58 | K725: 9 | L725: 16 | M725: =K725*6+L725 -> 70 | O725: 10 | P725: 18 | Q725: =O725*6+P725 -> 78 | S725: DUGARD | W725: PORT MELBOURNE | X725: 9 | Y725: 7 | Z725: 0 | AA725: 1702 | AB725: 1379 | AC725: 123.42277012327774 | AD725: 36
A726: BEST PLAYERS | W726: DANDENONG | X726: 9 | Y726: 7 | Z726: 0 | AA726: 1717 | AB726: 1459 | AC726: 117.68334475668266 | AD726: 36
A727: SANDRINGHAM | C727: BUSSE | F727: HANCE | I727: WALFORD | L727: WILLS | O727: LOCKHART | R727: J STEPHENS | W727: OAKLEIGH | X727: 3 | Y727: 13 | Z727: 0 | AA727: 1459 | AB727: 1876 | AC727: 77.771855010660985 | AD727: 12
A728: DANDENONG | C728: STEDWELL | F728: OGNEW | I728: ESLER | L728: DAVIES | O728: MATTHEWS | R728: DAVENPORT | W728: GEELONG WEST | X728: 3 | Y728: 13 | Z728: 0 | AA728: 1471 | AB728: 2099 | AC728: 70.08 | AD728: 12
A729: GOALKICKERS | W729: YARRAVILLE | X729: 1 | Y729: 15 | Z729: 0 | AA729: 1424 | AB729: 2093 | AC729: 68.03631151457239 | AD729: 4
A730: SANDRINGHAM | C730: J WARD 3 | F730: SPURRELL 3 | I730: DARE 3 | K730: WALFORD 2 | N730: STEPHENS | P730: AUSTIN | R730: HANCE | T730: FENTON
A731: DANDENONG | C731: FLAHERTY 3 | F731: MILLER | H731: NANKERVIS | K731: DAVENPORT | N731: GUINANE | P731: MELAI | R731: SHEEHAN | U731: OGNEW
A733: PRESTON | C733: 2 | D733: 8 | E733: =C733*6+D733 -> 20 | G733: 3 | H733: 14 | I733: =G733*6+H733 -> 32 | K733: 12 | L733: 25 | M733: =K733*6+L733 -> 97 | O733: 14 | P733: 26 | Q733: =O733*6+P733 -> 110 | S733: PRESTON
A734: GEELONG WEST | C734: 5 | D734: 1 | E734: =C734*6+D734 -> 31 | G734: 7 | H734: 4 | I734: =G734*6+H734 -> 46 | K734: 8 | L734: 5 | M734: =K734*6+L734 -> 53 | O734: 15 | P734: 10 | Q734: =O734*6+P734 -> 100 | S734: McMASTER
A735: BEST PLAYERS
A736: PRESTON | C736: HILL | F736: TELFORD | I736: JOYCE | L736: McLEAN | O736: GOAD | R736: LESLIE
A737: GEELONG WEST | C737: BRYANT | F737: BARRY | I737: GRATTON | L737: EMOND | O737: TENABEL
A738: GOALKICKERS
A739: PRESTON | C739: JOYCE 4 | F739: LESLIE 4 | I739: McLEAN 2 | L739: GARRETT 2 | O739: GOAD | Q739: RULE
A740: GEELONG WEST | C740: GRATTON 5 | F740: TENABEL 3 | I740: EMOND 2 | K740: BARRY | M740: BRYANT | O740: LARKINS | Q740: PIEC | S740: ZURAWEL
A742: WAVERLEY | C742: 6 | D742: 10 | E742: =C742*6+D742 -> 46 | G742: 7 | H742: 12 | I742: =G742*6+H742 -> 54 | K742: 8 | L742: 19 | M742: =K742*6+L742 -> 67 | O742: 13 | P742: 21 | Q742: =O742*6+P742 -> 99 | S742: YARRAVILLE
A743: YARRAVILLE | C743: 0 | D743: 1 | E743: =C743*6+D743 -> 1 | G743: 8 | H743: 3 | I743: =G743*6+H743 -> 51 | K743: 11 | L743: 4 | M743: =K743*6+L743 -> 70 | O743: 15 | P743: 5 | Q743: =O743*6+P743 -> 95 | S743: PASK
A744: BEST PLAYERS
A745: WAVERLEY | C745: BLEW | F745: STONE | I745: MORRIS | L745: BELL | O745: LANG | R745: A STEPHENS
A746: YARRAVILLE | C746: COOK | F746: MADIGAN | I746: BARROW | L746: MATHESON | O746: WAGHORN | R746: TAURENS
A747: GOALKICKERS
A748: WAVERLEY | C748: EBERT 3 | F748: BLEW 2 | H748: STONE 2 | J748: A STEPHENS 2 | N748: MORRIS | P748: BELL | Q748: P STEPHENS | T748: HARRY
A749: YARRAVILLE | C749: MADIGAN 5 | F749: KEMP 3 | H749: SQUIRES 2 | J749: DOWLING 2 | M749: COOK | O749: MATHESON | R749: STURNEIKS
A751: PRAHRAN | C751: 2 | D751: 3 | E751: =C751*6+D751 -> 15 | G751: 9 | H751: 8 | I751: =G751*6+H751 -> 62 | K751: 11 | L751: 9 | M751: =K751*6+L751 -> 75 | O751: 17 | P751: 13 | Q751: =O751*6+P751 -> 115 | S751: TOORAK PARK
A752: OAKLEIGH | C752: 4 | D752: 1 | E752: =C752*6+D752 -> 25 | G752: 8 | H752: 2 | I752: =G752*6+H752 -> 50 | K752: 16 | L752: 9 | M752: =K752*6+L752 -> 105 | O752: 17 | P752: 10 | Q752: =O752*6+P752 -> 112 | S752: JACKSON
A753: BEST PLAYERS
A754: PRAHRAN | C754: KNOX | F754: HUTCHESSON | J754: BARTLETT | M754: ROSE | O754: CROWE | Q754: EMSELLE
A755: OAKLEIGH | C755: KING | F755: McCORKELL | J755: BILLING | M755: FORD | O755: JUDD | Q755: KUZIMAK
A756: GOALKICKERS
A757: PRAHRAN | C757: KNOX 5 | F757: BARTLETT 4 | I757: PEACH 2 | K757: ROSE 2 | M757: HUTCHESSON | P757: MURPHY | R757: EMSELLE | U757: RUTH
A758: OAKLEIGH | C758: LYON 3 | F758: JUDD 3 | H758: KUZIMAK 3 | K758: MURNANE 2 | N758: BILLINGS 2 | Q758: ARON | S758: FORD | U758: KING | W758: SMITH
A760: ROUND 17 | E760: 16TH AUGUST | J760: WEATHER | N760: COLD WET | S760: PLAYED AT
D761: 1ST QTR | H761: 2ND QTR | L761: 3RD QTR | P761: FINAL | S761: BEACH ROAD
A762: SANDRINGHAM | C762: 5 | D762: 1 | E762: =C762*6+D762 -> 31 | G762: 12 | H762: 3 | I762: =G762*6+H762 -> 75 | K762: 20 | L762: 4 | M762: =K762*6+L762 -> 124 | O762: 21 | P762: 6 | Q762: =O762*6+P762 -> 132 | S762: UMPIRE | X762: LADDER | AB762: ROUND | AD762: 17
A763: WAVERLEY | C763: 1 | D763: 4 | E763: =C763*6+D763 -> 10 | G763: 5 | H763: 8 | I763: =G763*6+H763 -> 38 | K763: 11 | L763: 12 | M763: =K763*6+L763 -> 78 | O763: 16 | P763: 20 | Q763: =O763*6+P763 -> 116 | S763: McMASTER
A764: BEST PLAYERS | W764: TEAM | X764: W | Y764: L | Z764: D | AA764: FOR | AB764: AGST | AC764: % | AD764: PTS
A765: SANDRINGHAM | C765: HANCE | F765: J WARD | I765: T STEVENS | L765: BUSSE | N765: J STEPHENS | Q765: ANTONIE
A766: WAVERLEY | C766: POORE | F766: STONE | I766: A STEPHENS | L766: BROWN | N766: BLEW | Q766: B ALLAN | W766: PRAHRAN | X766: 14 | Y766: 3 | Z766: 0 | AA766: 1932 | AB766: 1497 | AC766: 129.06 | AD766: 56
A767: GOALKICKERS | W767: WILLIAMSTOWN | X767: 12 | Y767: 5 | Z767: 0 | AA767: 1806 | AB767: 1613 | AC767: 111.96528208307501 | AD767: 48
A768: SANDRINGHAM | C768: J WARD 6 | E768: STEPHENS 4 | H768: ANTONIE 4 | K768: WALFORD 2 | N768: AUSTIN 2 | Q768: DARE 2 | S768: SPURRELL | W768: SANDRINGHAM | X768: 11 | Y768: 6 | Z768: 0 | AA768: 1968 | AB768: 1819 | AC768: 108.19131390874107 | AD768: 44
A769: WAVERLEY | C769: POORE 3 | E769: A STEPHENS 3 | H769: STONE 2 | J769: BELL 2 | L769: PARKER 2 | N769: BLEW 2 | P769: MORRIS | R769: REID | W769: PORT MELBOURNE | X769: 10 | Y769: 7 | Z769: 0 | AA769: 1771 | AB769: 1425 | AC769: 124.28070175438596 | AD769: 40
A771: WILLIAMSTOWN | C771: 2 | D771: 2 | E771: =C771*6+D771 -> 14 | G771: 6 | H771: 2 | I771: =G771*6+H771 -> 38 | K771: 13 | L771: 7 | M771: =K771*6+L771 -> 85 | O771: 14 | P771: 8 | Q771: =O771*6+P771 -> 92 | S771: PRESTON | W771: DANDENONG | X771: 10 | Y771: 7 | Z771: 0 | AA771: 1830 | AB771: 1509 | AC771: 121.27 | AD771: 40
A772: PRESTON | C772: 4 | D772: 2 | E772: =C772*6+D772 -> 26 | G772: 7 | H772: 10 | I772: =G772*6+H772 -> 52 | K772: 9 | L772: 12 | M772: =K772*6+L772 -> 66 | O772: 10 | P772: 17 | Q772: =O772*6+P772 -> 77 | S772: TURNER | W772: WAVERLEY | X772: 10 | Y772: 7 | Z772: 0 | AA772: 1853 | AB772: 1622 | AC772: 114.24 | AD772: 40
A773: BEST PLAYERS | W773: PRESTON | X773: 10 | Y773: 7 | Z773: 0 | AA773: 1662 | AB773: 1600 | AC773: 103.875 | AD773: 40
A774: WILLIAMSTOWN | C774: PAPLEY | F774: SMITH | J774: FANNING | M774: HEMLEY | O774: BYERS | Q774: LESLIE | W774: OAKLEIGH | X774: 4 | Y774: 13 | Z774: 0 | AA774: 1558 | AB774: 1937 | AC774: 80.433660299432105 | AD774: 16
A775: PRESTON | C775: HILL | F775: WEIGHTMAN | J775: TELFORD | M775: RULE | O775: JOYCE | Q775: JACKMAN | W775: GEELONG WEST | X775: 3 | Y775: 14 | Z775: 0 | AA775: 1517 | AB775: 2168 | AC775: 69.97 | AD775: 12
A776: GOALKICKERS | W776: YARRAVILLE | X776: 1 | Y776: 16 | Z776: 0 | AA776: 1485 | AB776: 2192 | AC776: 67.746350364963504 | AD776: 4
A777: WILLIAMSTOWN | C777: PAPLEY 4 | F777: FANNING 3 | I777: SMITH 2 | K777: JACKMAN | M777: MEYERS | O777: VAN LIMPD | R777: PERCY | T777: BARNES
A778: PRESTON | C778: McLEAN 3 | F778: JOYCE 2 | I778: LESLIE 2 | K778: REID | M778: RULE | O778: GIBLETT
A780: DANDENONG | C780: 1 | D780: 2 | E780: =C780*6+D780 -> 8 | G780: 4 | H780: 4 | I780: =G780*6+H780 -> 28 | K780: 11 | L780: 6 | M780: =K780*6+L780 -> 72 | O780: 17 | P780: 11 | Q780: =O780*6+P780 -> 113 | S780: DANDENONG
A781: PRAHRAN | C781: 1 | D781: 10 | E781: =C781*6+D781 -> 16 | G781: 4 | H781: 13 | I781: =G781*6+H781 -> 37 | K781: 4 | L781: 14 | M781: =K781*6+L781 -> 38 | O781: 6 | P781: 14 | Q781: =O781*6+P781 -> 50 | S781: FLANAGAN
A782: BEST PLAYERS
A783: DANDENONG | C783: DAVIES | F783: FLAHERTY | I783: ABRAHAM | L783: MATTHEWS | O783: DAVENPORT | R783: McNAMARA
A784: PRAHRAN | C784: DOWSING | F784: CROWE | I784: TUCKWELL | L784: RUTH | O784: EMSELLE | R784: BARTLETT
A785: GOALKICKERS
A786: DANDENONG | C786: DAVIES 4 | F786: MILLER 3 | I786: NANKERVIS 3 | L786: FLAHERTY 3 | O786: GUINANE 2 | R786: SHEEHAN | U786: ROBERTSON
A787: PRAHRAN | C787: DOWSING 3 | F787: TUCKWELL 2 | I787: EMSELLE
A789: PORT MELBOURNE | C789: 5 | D789: 1 | E789: =C789*6+D789 -> 31 | G789: 7 | H789: 8 | I789: =G789*6+H789 -> 50 | K789: 8 | L789: 13 | M789: =K789*6+L789 -> 61 | O789: 9 | P789: 15 | Q789: =O789*6+P789 -> 69 | S789: GEELONG WEST
A790: GEELONG WEST | C790: 2 | D790: 3 | E790: =C790*6+D790 -> 15 | G790: 3 | H790: 2 | I790: =G790*6+H790 -> 20 | K790: 6 | L790: 2 | M790: =K790*6+L790 -> 38 | O790: 7 | P790: 4 | Q790: =O790*6+P790 -> 46 | S790: DUGARD
A791: BEST PLAYERS
A792: PORT MELBOURNE | C792: G ALLEN | F792: DAVEY | I792: BUCKLEY | L792: BEHAN | O792: MACRAE | R792: JEACLE
A793: GEELONG WEST | C793: BARRY | F793: TREVASKIS | I793: HOVEY | L793: GILLIES | O793: CROWE | R793: ROOM
A794: GOALKICKERS
A795: PORT MELBOURNE | C795: BUCKLEY 3 | F795: M ALLEN 2 | I795: JEACLE 2 | L795: HOLT | N795: NORTON
A796: GEELONG WEST | C796: ROOM 2 | F796: GILLIES | H796: PIEC | J796: BRYANT | L796: LARKINS | N796: GRATTON
A798: OAKLEIGH | C798: 2 | D798: 4 | E798: =C798*6+D798 -> 16 | G798: 6 | H798: 10 | I798: =G798*6+H798 -> 46 | K798: 8 | L798: 16 | M798: =K798*6+L798 -> 64 | O798: 13 | P798: 21 | Q798: =O798*6+P798 -> 99 | S798: OAKLEIGH
A799: YARRAVILLE | C799: 4 | D799: 6 | E799: =C799*6+D799 -> 30 | G799: 6 | H799: 7 | I799: =G799*6+H799 -> 43 | K799: 7 | L799: 13 | M799: =K799*6+L799 -> 55 | O799: 8 | P799: 13 | Q799: =O799*6+P799 -> 61 | S799: CHINN
A800: BEST PLAYERS
A801: OAKLEIGH | C801: BILLING | F801: JUDD | I801: ROBERTS | L801: LYON | O801: BEARD | R801: KING
A802: YARRAVILLE | C802: COOK | F802: BARROW | I802: WAGHORN | L802: VAN LINT | O802: MARTIN | R802: DOWLING
A803: GOALKICKERS
A804: OAKLEIGH | C804: JUDD 6 | F804: LYON 3 | I804: KUZIMAK 2 | L804: FORD | N804: GORDES
A805: YARRAVILLE | C805: STURNEIKS 2 | F805: MADIGAN 2 | I805: DOWLING 2 | L805: KEMP | N805: MARTIN
A807: ROUND 18 | D807: 22ND AUGUST | I807: WEATHER | M807: N BREEZE DULL | S807: PLAYED AT
D808: 1ST QTR | H808: 2ND QTR | L808: 3RD QTR | P808: FINAL | S808: TOORAK PARK
A809: PRAHRAN | C809: 2 | D809: 8 | E809: =C809*6+D809 -> 20 | G809: 10 | H809: 11 | I809: =G809*6+H809 -> 71 | K809: 15 | L809: 14 | M809: =K809*6+L809 -> 104 | O809: 25 | P809: 18 | Q809: =O809*6+P809 -> 168 | S809: UMPIRE | X809: LADDER | AB809: ROUND | AD809: 18
A810: GEELONG WEST | C810: 3 | D810: 1 | E810: =C810*6+D810 -> 19 | G810: 6 | H810: 7 | I810: =G810*6+H810 -> 43 | K810: 8 | L810: 14 | M810: =K810*6+L810 -> 62 | O810: 8 | P810: 16 | Q810: =O810*6+P810 -> 64 | S810: CHINN
A811: BEST PLAYERS | W811: TEAM | X811: W | Y811: L | Z811: D | AA811: FOR | AB811: AGST | AC811: % | AD811: PTS
A812: PRAHRAN | C812: VAGG | E812: HUTCHESSON | H812: EMSELLE | K812: KNOX | N812: KARANICOLAS | Q812: CULPIN
A813: GEELONG WEST | C813: HOVEY | E813: ROOM | H813: O'LOUGHLIN | K813: TEAGUE | N813: LARKINS | Q813: BRYANT | W813: PRAHRAN | X813: 15 | Y813: 3 | Z813: 0 | AA813: 2100 | AB813: 1561 | AC813: 134.53 | AD813: 60
A814: GOALKICKERS | M814: KARANICHOLAS | W814: WILLIAMSTOWN | X814: 13 | Y814: 5 | Z814: 0 | AA814: 1962 | AB814: 1728 | AC814: 113.54166666666667 | AD814: 52
A815: PRAHRAN | C815: KNOX 4 | E815: HUTCHESSON 4 | H815: VAGG 4 | J815: BARTLETT 4 | M815: PARKER 3 | O815: EMSELLE 2 | Q815: POWER 2 | S815: RUTH | W815: PORT MELBOURNE | X815: 11 | Y815: 7 | Z815: 0 | AA815: 1890 | AB815: 1531 | AC815: 123.44872632266492 | AD815: 44
A816: GEELONG WEST | C816: TEAGUE 3 | F816: DEEATH | H816: BRYANT | J816: LARKINS | L816: GRATTON | N816: EMOND | W816: WAVERLEY | X816: 11 | Y816: 7 | Z816: 0 | AA816: 2044 | AB816: 1720 | AC816: 118.84 | AD816: 44
D817: 23RD AUGUST | I817: WEATHER | L817: FINE
A818: WILLIAMSTOWN | C818: 11 | D818: 2 | E818: =C818*6+D818 -> 68 | G818: 16 | H818: 7 | I818: =G818*6+H818 -> 103 | K818: 19 | L818: 20 | M818: =K818*6+L818 -> 134 | O818: 22 | P818: 24 | Q818: =O818*6+P818 -> 156 | S818: WILLIAMSTOWN | W818: PRESTON | X818: 11 | Y818: 7 | Z818: 0 | AA818: 1794 | AB818: 1700 | AC818: 105.52941176470588 | AD818: 44
A819: SANDRINGHAM | C819: 1 | D819: 5 | E819: =C819*6+D819 -> 11 | G819: 8 | H819: 8 | I819: =G819*6+H819 -> 56 | K819: 11 | L819: 10 | M819: =K819*6+L819 -> 76 | O819: 17 | P819: 13 | Q819: =O819*6+P819 -> 115 | S819: McKENZIE | W819: SANDRINGHAM | X819: 11 | Y819: 7 | Z819: 0 | AA819: 2083 | AB819: 1975 | AC819: 105.46835443037975 | AD819: 44
A820: BEST PLAYERS | W820: DANDENONG | X820: 10 | Y820: 8 | Z820: 0 | AA820: 1936 | AB820: 1628 | AC820: 118.92 | AD820: 40
A821: WILLIAMSTOWN | C821: JOHNSTON | F821: FANNING | J821: PAPLEY | M821: BARNES | O821: SMITH | Q821: JACKMAN | W821: OAKLEIGH | X821: 4 | Y821: 14 | Z821: 0 | AA821: 1656 | AB821: 2128 | AC821: 77.819548872180448 | AD821: 16
A822: SANDRINGHAM | C822: J WARD | F822: HUTCHINSON | J822: T STEVENS | M822: AUSTIN | O822: HOGAN | W822: GEELONG WEST | X822: 3 | Y822: 15 | Z822: 0 | AA822: 1581 | AB822: 2336 | AC822: 67.68 | AD822: 12
A823: GOALKICKERS | W823: YARRAVILLE | X823: 1 | Y823: 17 | Z823: 0 | AA823: 1585 | AB823: 2324 | AC823: 68.201376936316692 | AD823: 4
A824: WILLIAMSTOWN | C824: JACKMAN 5 | F824: PAPLEY 5 | I824: SMITH 3 | K824: BARNES 3 | M824: PATTERSON 2 | P824: FANNING 2 | R824: MEYERS | T824: LANE
A825: SANDRINGHAM | C825: HOGAN 5 | F825: HUTCHINSON 3 | J825: WALFORD 2 | M825: AUSTIN 2 | O825: STEPHENS 2 | R825: STEVENS 2 | U825: ANTONIE
A827: PORT MELBOURNE | C827: 7 | D827: 3 | E827: =C827*6+D827 -> 45 | G827: 13 | H827: 5 | I827: =G827*6+H827 -> 83 | K827: 16 | L827: 7 | M827: =K827*6+L827 -> 103 | O827: 18 | P827: 11 | Q827: =O827*6+P827 -> 119 | S827: PORT MELBOURNE
A828: DANDENONG | C828: 3 | D828: 4 | E828: =C828*6+D828 -> 22 | G828: 7 | H828: 8 | I828: =G828*6+H828 -> 50 | K828: 11 | L828: 11 | M828: =K828*6+L828 -> 77 | O828: 15 | P828: 16 | Q828: =O828*6+P828 -> 106 | S828: ANDERSON
A829: BEST PLAYERS
A830: PORT MELBOURNE | C830: BEHAN | F830: BUCKLEY | I830: N GOSS | L830: MACRAE | O830: BONNETT | R830: GROVER
A831: DANDENONG | C831: BETHKE | F831: STEDWELL | I831: SHEEHAN | L831: FLAHERTY | O831: DAVIES | R831: GUINANE
A832: GOALKICKERS
A833: PORT MELBOURNE | C833: N GOSS 4 | F833: MACRAE 4 | I833: M ALLEN 2 | L833: JEACLE 2 | N833: NORTON 2 | Q833: BARCLAY | S833: BEHAN | U833: BONNETT | X833: BUCKLEY
A834: DANDENONG | C834: MILLER 4 | F834: GUINANE 3 | I834: ESLER 2 | K834: DAVIES 2 | M834: NANKERVIS | P834: MELAI | R834: FLAHERTY | U834: GOODE
A836: WAVERLEY | C836: 8 | D836: 2 | E836: =C836*6+D836 -> 50 | G836: 18 | H836: 9 | I836: =G836*6+H836 -> 117 | K836: 22 | L836: 11 | M836: =K836*6+L836 -> 143 | O836: 29 | P836: 17 | Q836: =O836*6+P836 -> 191 | S836: WAVERLEY
A837: OAKLEIGH | C837: 3 | D837: 5 | E837: =C837*6+D837 -> 23 | G837: 3 | H837: 8 | I837: =G837*6+H837 -> 26 | K837: 10 | L837: 17 | M837: =K837*6+L837 -> 77 | O837: 13 | P837: 20 | Q837: =O837*6+P837 -> 98 | S837: TURNER
A838: BEST PLAYERS
A839: WAVERLEY | C839: A STEPHENS | F839: BLEW | I839: STONE | L839: MORRIS | O839: B ALLAN | R839: IRISH
A840: OAKLEIGH | C840: KING | F840: MURNANE | I840: STEWART | L840: BRITTEN | O840: STEPHENS | R840: KUZIMUIK
A841: GOALKICKERS
A842: WAVERLEY | C842: BLEW 5 | E842: A STEPHENS 5 | H842: MORRIS 4 | J842: PITTS 3 | L842: BROWN 2 | N842: POORE 2 | P842: STONE 2 | R842: BELL 2 | T842: P STEPHENS 2 | X842: ALLAN | Z842: BACKHOUSE
A843: OAKLEIGH | C843: STEWART 3 | F843: MURNANE 2 | I843: BILLINGS 2 | L843: KING 2 | N843: M QUINN | Q843: FORD | R843: JUDD | T843: SMITH | V843: KUZIMAK | X843: T QUINN
A845: PRESTON | C845: 3 | D845: 1 | E845: =C845*6+D845 -> 19 | G845: 8 | H845: 9 | I845: =G845*6+H845 -> 57 | K845: 13 | L845: 11 | M845: =K845*6+L845 -> 89 | O845: 20 | P845: 12 | Q845: =O845*6+P845 -> 132 | S845: YARRAVILLE
A846: YARRAVILLE | C846: 4 | D846: 4 | E846: =C846*6+D846 -> 28 | G846: 6 | H846: 5 | I846: =G846*6+H846 -> 41 | K846: 11 | L846: 9 | M846: =K846*6+L846 -> 75 | O846: 15 | P846: 10 | Q846: =O846*6+P846 -> 100 | S846: McMASTER
A847: BEST PLAYERS
A848: PRESTON | C848: RULE | F848: McLEAN | I848: HILL | L848: WEIGHTMAN | O848: CHAPMAN | R848: REID
A849: YARRAVILLE | C849: CHARLES | F849: COOK | I849: HERIOT | L849: DOWLING | O849: CONDUIT | R849: BARROW
A850: GOALKICKERS
A851: PRESTON | C851: McLEAN 4 | F851: RULE 4 | H851: CHAPMAN 3 | K851: JOYCE 2 | M851: REID 2 | O851: HINDMARSH 2 | R851: LESLIE | T851: HILL | V851: MERCURI
A852: YARRAVILLE | C852: DOWLING 5 | F852: MARTIN 4 | I852: COLLINS 2 | L852: COOK | N852: MADIGAN | P852: HEYME | R852: BARROW
A854: FINALS
A855: 1ST SEMI | E855: 30TH AUGUST | J855: WEATHER | N855: COLD WET
A856: WAVERLEY | C856: 1 | D856: 3 | E856: =C856*6+D856 -> 9 | G856: 5 | H856: 8 | I856: =G856*6+H856 -> 38 | K856: 9 | L856: 12 | M856: =K856*6+L856 -> 66 | O856: 15 | P856: 16 | Q856: =O856*6+P856 -> 106 | S856: JUNCTION OVAL
A857: PORT MELBOURNE | C857: 3 | D857: 4 | E857: =C857*6+D857 -> 22 | G857: 7 | H857: 11 | I857: =G857*6+H857 -> 53 | K857: 8 | L857: 12 | M857: =K857*6+L857 -> 60 | O857: 10 | P857: 15 | Q857: =O857*6+P857 -> 75 | S857: TURNER
A858: BEST PLAYERS
A859: WAVERLEY | C859: STONE | F859: PITTS | I859: A STEPHENS | L859: BROWN | O859: POORE | R859: SYKES
A860: PORT MELBOURNE | C860: BEHAN | F860: GOSS | I860: CAULFIELD | L860: GROVER | O860: G ALLEN | R860: BONNETT
A861: GOALKICKERS
A862: WAVERLEY | C862: A STEPHENS 3 | F862: ALLAN 3 | I862: MORRIS 2 | L862: POORE 2 | N862: BELL 2 | P862: BLEW | R862: STONE | T862: PITTS
A863: PORT MELBOURNE | C863: NORTON 2 | F863: AANENSEN 2 | I863: GOSS | K863: G ALLEN | M863: BONNETT | O863: MACRAE | Q863: M ALLEN | S863: HOLT
A865: 2ND SEMI | D865: 6TH SEPTEMBER | I865: WEATHER | M865: FINE
A866: PRAHRAN | C866: 3 | D866: 3 | E866: =C866*6+D866 -> 21 | G866: 5 | H866: 9 | I866: =G866*6+H866 -> 39 | K866: 7 | L866: 14 | M866: =K866*6+L866 -> 56 | O866: 10 | P866: 15 | Q866: =O866*6+P866 -> 75 | S866: JUNCTION OVAL
A867: WILLIAMSTOWN | C867: 3 | D867: 2 | E867: =C867*6+D867 -> 20 | G867: 4 | H867: 5 | I867: =G867*6+H867 -> 29 | K867: 6 | L867: 9 | M867: =K867*6+L867 -> 45 | O867: 9 | P867: 15 | Q867: =O867*6+P867 -> 69 | S867: GAMBETTA
A868: BEST PLAYERS
A869: PRAHRAN | C869: EMSELLE | F869: HUTCHESSON | I869: RUTH | L869: ROSE | N869: CROWE | Q869: DICKESON
A870: WILLIAMSTOWN | C870: JACKMAN | F870: PAPLEY | I870: JOHNSON | L870: PAGE | N870: STARK | Q870: HARVEY
A871: GOALKICKERS
A872: PRAHRAN | C872: KNOX 3 | F872: HUTCHESSON 2 | J872: DOWSING | L872: ROSE | N872: KARANICHOLAS | R872: MARINKO | U872: RUTH | W872: KENNEALLY
A873: WILLIAMSTOWN | C873: JACKMAN 3 | F873: PATTERSON 2 | J873: PAPLEY 2 | M873: STARK | O873: MEYERS
A875: PRELIMINARY FINAL | F875: 13TH SEPTEMBER | K875: WEATHER | N875: NORTH BREEZE FINE
A876: WILLIAMSTOWN | C876: 0 | D876: 5 | E876: =C876*6+D876 -> 5 | G876: 6 | H876: 11 | I876: =G876*6+H876 -> 47 | K876: 13 | L876: 16 | M876: =K876*6+L876 -> 94 | O876: 22 | P876: 22 | Q876: =O876*6+P876 -> 154 | S876: JUNCTION OVAL
A877: WAVERLEY | C877: 2 | D877: 4 | E877: =C877*6+D877 -> 16 | G877: 4 | H877: 5 | I877: =G877*6+H877 -> 29 | K877: 7 | L877: 8 | M877: =K877*6+L877 -> 50 | O877: 7 | P877: 9 | Q877: =O877*6+P877 -> 51 | S877: DUGARD/PASK
A878: BEST PLAYERS
A879: WILLIAMSTOWN | C879: JACKMAN | F879: PATTERSON | I879: PAPLEY | L879: HAYWARD | O879: FANNING | R879: SMITH
A880: WAVERLEY | C880: POORE | F880: BLEW | I880: A STEPHENS | L880: PITTS | O880: ALLAN | R880: BROWN
A881: GOALKICKERS
A882: WILLIAMSTOWN | C882: PATTERSON 10 | F882: JACKMAN 3 | I882: HAYWARD 3 | L882: VAN LIMPD 2 | O882: PERCY 2 | Q882: SMITH | S882: PAPLEY | U882: STARK
A883: WAVERLEY | C883: P STEPHENS 4 | F883: MORRIS | I883: BLEW | K883: PITTS
A885: GRAND FINAL | E885: 20TH SEPTEMBER | J885: WEATHER | M885: SOUTH WEST BREEZE FINE
A886: PRAHRAN | C886: 3 | D886: 5 | E886: 23 | G886: 9 | H886: 7 | I886: 61 | K886: 16 | L886: 15 | M886: 111 | O886: 17 | P886: 18 | Q886: =O886*6+P886 -> 120 | S886: JUNCTION OVAL
A887: WILLIAMSTOWN | C887: 3 | D887: 1 | E887: 19 | G887: 5 | H887: 4 | I887: 34 | K887: 5 | L887: 5 | M887: 35 | O887: 10 | P887: 10 | Q887: =O887*6+P887 -> 70 | S887: ANDERSON
A888: BEST PLAYERS
A889: PRAHRAN | C889: PARKER | F889: DOWSING | I889: CROWE | L889: HUTCHESSON | O889: BARTLETT | R889: ROSE
A890: WILLIAMSTOWN | C890: JACKMAN | F890: PAPLEY | I890: PERCY | L890: JOHNSON | O890: O'MARA | R890: STARK
A891: GOALKICKERS
A892: PRAHRAN | C892: KNOX 4 | F892: BARTLETT 4 | I892: DOWSING 3 | L892: MARINKO 2 | O892: PARKER | Q892: KARANICHOLAS | U892: EMSELLE | X892: KENNEALLY
A893: WILLIAMSTOWN | C893: JACKMAN 2 | F893: HAYWARD 2 | I893: PERCY 2 | K893: PATTERSON | N893: SMITH | P893: PAPLEY | R893: STARK