A1: Victorian Football Association
A2: Season 1970 - Division Two
A3: © Copyright Wal Williams | F3: First created: 28 March 2016
A4: Contact: joywalwi at gmail dot com | F4: Last updated: 28 March 2016 | W4: VFA Results and tables - Link to the main index page
A5: You are free to copy this document in whole or part provided that proper acknowledgement is given to the author. All rights reserved.
A7: 1970 | C7: V.F.A. SEASON 2ND DIVISION
A8: ROUND 1 | E8: 12TH APRIL | J8: WEATHER | S8: PLAYED AT
D9: 1ST QTR | H9: 2ND QTR | L9: 3RD QTR | P9: FINAL | S9: FRANKSTON
A10: FRANKSTON | C10: 4 | D10: 4 | E10: =C10*6+D10 -> 28 | G10: 11 | H10: 14 | I10: =G10*6+H10 -> 80 | K10: 12 | L10: 16 | M10: =K10*6+L10 -> 88 | O10: 18 | P10: 19 | Q10: =O10*6+P10 -> 127 | S10: UMPIRE | X10: LADDER | AB10: ROUND | AD10: 1
A11: WERRIBEE | C11: 1 | D11: 1 | E11: =C11*6+D11 -> 7 | G11: 3 | H11: 1 | I11: =G11*6+H11 -> 19 | K11: 5 | L11: 5 | M11: =K11*6+L11 -> 35 | O11: 11 | P11: 5 | Q11: =O11*6+P11 -> 71
A12: BEST PLAYERS | W12: TEAM | X12: W | Y12: L | Z12: D | AA12: FOR | AB12: AGST | AC12: % | AD12: PTS
A13: FRANKSTON | C13: McNAB | F13: WHITE | I13: WESTON | L13: NICHOLSON | O13: VAUGHAN
A14: WERRIBEE | C14: PARK | F14: WINTLE | I14: COMBEN | L14: HEATHERINGTON | P14: LYONS | W14: COBURG | X14: 1 | Y14: 0 | Z14: 0 | AA14: 143 | AB14: 37 | AC14: =(AA14*100)/AB14 -> 386.48648648648651 | AD14: =(X14*4)+(Z14*2) -> 4
A15: GOALKICKERS | C15: 1 | W15: FRANKSTON | X15: 1 | Y15: 0 | Z15: 0 | AA15: 127 | AB15: 71 | AC15: =(AA15*100)/AB15 -> 178.87323943661971 | AD15: =(X15*4)+(Z15*2) -> 4
A16: FRANKSTON | C16: NICHOLSON 5 | F16: McNAB 5 | H16: CLARK 2 | J16: GRAHAM 2 | M16: WESTON 2 | O16: VAUGHAN 2 | R16: LOVELOCK | W16: SUNSHINE | X16: 1 | Y16: 0 | Z16: 0 | AA16: 126 | AB16: 82 | AC16: =(AA16*100)/AB16 -> 153.65853658536585 | AD16: =(X16*4)+(Z16*2) -> 4
A17: WERRIBEE | C17: ARRIGO 2 | E17: EDWARDS 2 | H17: LYONS 2 | J17: MONTGOMERY 2 | N17: TYQUIN | P17: PANETTA | R17: RUSH | W17: BRUNSWICK | X17: 1 | Y17: 0 | Z17: 0 | AA17: 137 | AB17: 96 | AC17: =(AA17*100)/AB17 -> 142.70833333333334 | AD17: =(X17*4)+(Z17*2) -> 4
A19: SUNSHINE | C19: 4 | D19: 4 | E19: =C19*6+D19 -> 28 | G19: 10 | H19: 8 | I19: =G19*6+H19 -> 68 | K19: 14 | L19: 10 | M19: =K19*6+L19 -> 94 | O19: 19 | P19: 12 | Q19: =O19*6+P19 -> 126 | S19: SUNSHINE | W19: BOX HILL | X19: 1 | Y19: 0 | Z19: 0 | AA19: 107 | AB19: 80 | AC19: =(AA19*100)/AB19 -> 133.75 | AD19: =(X19*4)+(Z19*2) -> 4
A20: CAULFIELD | C20: 1 | D20: 4 | E20: =C20*6+D20 -> 10 | G20: 4 | H20: 6 | I20: =G20*6+H20 -> 30 | K20: 10 | L20: 7 | M20: =K20*6+L20 -> 67 | O20: 12 | P20: 10 | Q20: =O20*6+P20 -> 82 | S20: HOLZER | W20: CAMBERWELL | X20: 0 | Y20: 1 | Z20: 0 | AA20: 80 | AB20: 107 | AC20: =(AA20*100)/AB20 -> 74.766355140186917 | AD20: =(X20*4)+(Z20*2) -> 0
A21: BEST PLAYERS | W21: NORTHCOTE | X21: 0 | Y21: 1 | Z21: 0 | AA21: 96 | AB21: 137 | AC21: =(AA21*100)/AB21 -> 70.072992700729927 | AD21: =(X21*4)+(Z21*2) -> 0
A22: SUNSHINE | C22: DARUL | F22: NICHOLSON | I22: BROWN | L22: HIPWORTH | O22: IBRAHIM | R22: McGREGOR | W22: CAULFIELD | X22: 0 | Y22: 1 | Z22: 0 | AA22: 82 | AB22: 126 | AC22: =(AA22*100)/AB22 -> 65.079365079365076 | AD22: =(X22*4)+(Z22*2) -> 0
A23: CAULFIELD | C23: GOWANS | F23: ROBINSON | I23: COLLINS | L23: DOWSETT | O23: BROWN | R23: SAUNDERS | W23: WERRIBEE | X23: 0 | Y23: 1 | Z23: 0 | AA23: 71 | AB23: 127 | AC23: =(AA23*100)/AB23 -> 55.905511811023622 | AD23: =(X23*4)+(Z23*2) -> 0
A24: GOALKICKERS | W24: MORDIALLOC | X24: 0 | Y24: 1 | Z24: 0 | AA24: 37 | AB24: 143 | AC24: =(AA24*100)/AB24 -> 25.874125874125873 | AD24: =(X24*4)+(Z24*2) -> 0
A25: SUNSHINE | C25: ALLEN 5 | E25: FERGUSON 4 | H25: CLARKE 3 | J25: RUSSELL 3 | M25: CRAWFORD 2 | P25: IBRAHIM | S25: GOOLD
A26: CAULFIELD | C26: BROWN 3 | E26: TEMPEST 3 | H26: GOWANS 2 | J26: HANCOCK | M26: WILLIAMS | P26: ROBINSON | S26: COLLINS
A28: COBURG | C28: 5 | D28: 4 | E28: =C28*6+D28 -> 34 | G28: 13 | H28: 10 | I28: =G28*6+H28 -> 88 | K28: 15 | L28: 12 | M28: =K28*6+L28 -> 102 | O28: 20 | P28: 23 | Q28: =O28*6+P28 -> 143 | S28: COBURG
A29: MORDIALLOC | C29: 2 | D29: 5 | E29: =C29*6+D29 -> 17 | G29: 2 | H29: 7 | I29: =G29*6+H29 -> 19 | K29: 4 | L29: 13 | M29: =K29*6+L29 -> 37 | O29: 4 | P29: 13 | Q29: =O29*6+P29 -> 37 | S29: ANDERSON
A30: BEST PLAYERS
A31: COBURG | C31: GALE | F31: ELVERY | I31: LAWSON | L31: ERWIN | O31: MARSH
A32: MORDIALLOC | C32: LESLIE | F32: POWER | I32: HOCKING | L32: HUTTON | O32: LITTLE
A33: GOALKICKERS
A34: COBURG | C34: GALE 6 | E34: LAWSON 6 | H34: MORRISON 3 | K34: KIRKMAN 2 | N34: ERWIN 2 | Q34: JENKINS
A35: MORDIALLOC | C35: POWER 2 | F35: SMITH | I35: HOCKING
A37: BOX HILL | C37: 1 | D37: 6 | E37: =C37*6+D37 -> 12 | G37: 10 | H37: 8 | I37: =G37*6+H37 -> 68 | K37: 12 | L37: 12 | M37: =K37*6+L37 -> 84 | O37: 15 | P37: 17 | Q37: =O37*6+P37 -> 107 | S37: BOX HILL
A38: CAMBERWELL | C38: 5 | D38: 1 | E38: =C38*6+D38 -> 31 | G38: 7 | H38: 4 | I38: =G38*6+H38 -> 46 | K38: 11 | L38: 6 | M38: =K38*6+L38 -> 72 | O38: 11 | P38: 14 | Q38: =O38*6+P38 -> 80 | S38: GAMBETTA
A39: BEST PLAYERS
A40: BOX HILL | C40: McKAY | F40: QUIRK | I40: BURGESS | L40: COBAIN | O40: DAWSON
A41: CAMBERWELL | C41: BOYD | F41: BRUCE | I41: McNAMARA | L41: SMITH | O41: TAYLOR
A42: GOALKICKERS
A43: BOX HILL | C43: RONALDSON 4 | F43: COBAIN 3 | I43: QUIRK 2 | K43: NEILLY 2 | M43: SMITH | O43: WILLIAMS | R43: ABBOTT | T43: CRISP
A44: CAMBERWELL | C44: BRUCE 3 | F44: McNAMARA 3 | I44: FLOYD 3 | K44: TAYLOR | M44: BRAYNE
A46: BRUNSWICK | C46: 3 | D46: 3 | E46: =C46*6+D46 -> 21 | G46: 9 | H46: 9 | I46: =G46*6+H46 -> 63 | K46: 12 | L46: 15 | M46: =K46*6+L46 -> 87 | O46: 20 | P46: 17 | Q46: =O46*6+P46 -> 137 | S46: NORTHCOTE
A47: NORTHCOTE | C47: 5 | D47: 4 | E47: =C47*6+D47 -> 34 | G47: 5 | H47: 4 | I47: =G47*6+H47 -> 34 | K47: 8 | L47: 10 | M47: =K47*6+L47 -> 58 | O47: 14 | P47: 12 | Q47: =O47*6+P47 -> 96 | S47: McKENZIE
A48: BEST PLAYERS
A49: BRUNSWICK | C49: EGAN | F49: WROUT | I49: LEYDIN | L49: BOOTH | O49: K GREIG
A50: NORTHCOTE | C50: SMITH | F50: CLOTZ | I50: WHITE | L50: COHEN | O50: QUAIFE
A51: GOALKICKERS
A52: BRUNSWICK | C52: BOOTH 4 | E52: WHELAN 4 | H52: COOK 3 | J52: K GREIG 3 | M52: HOWARD 2 | P52: NEIL 2 | R52: LEYDIN | T52: ANDERSON
A53: NORTHCOTE | C53: COHEN 4 | E53: HAYES 3 | H53: VINEY | J53: YOUNG | M53: 5 SHORT
A55: ROUND 2 | E55: 19TH APRIL | J55: WEATHER | S55: PLAYED AT
D56: 1ST QTR | H56: 2ND QTR | L56: 3RD QTR | P56: FINAL | S56: NORTHCOTE
A57: NORTHCOTE | C57: 2 | D57: 3 | E57: =C57*6+D57 -> 15 | G57: 6 | H57: 10 | I57: =G57*6+H57 -> 46 | K57: 10 | L57: 12 | M57: =K57*6+L57 -> 72 | O57: 14 | P57: 13 | Q57: =O57*6+P57 -> 97 | S57: UMPIRE | X57: LADDER | AB57: ROUND | AD57: 2
A58: CAULFIELD | C58: 0 | D58: 3 | E58: =C58*6+D58 -> 3 | G58: 3 | H58: 6 | I58: =G58*6+H58 -> 24 | K58: 8 | L58: 10 | M58: =K58*6+L58 -> 58 | O58: 12 | P58: 17 | Q58: =O58*6+P58 -> 89 | S58: DUGARD
A59: BEST PLAYERS | W59: TEAM | X59: W | Y59: L | Z59: D | AA59: FOR | AB59: AGST | AC59: % | AD59: PTS
A60: NORTHCOTE | C60: UNDERWOOD | F60: KOZARIS | I60: CLOTZ | L60: PITTS | N60: SMITH | Q60: McGRATH
A61: CAULFIELD | C61: ROBINSON | F61: LOGAN | I61: BROWN | L61: CLARK | N61: WILLIAMS | Q61: GOWANS | W61: COBURG | X61: 2 | Y61: 0 | Z61: 0 | AA61: 335 | AB61: 108 | AC61: =(AA61*100)/AB61 -> 310.18518518518516 | AD61: =(X61*4)+(Z61*2) -> 8
A62: GOALKICKERS | W62: SUNSHINE | X62: 2 | Y62: 0 | Z62: 0 | AA62: 249 | AB62: 155 | AC62: =(AA62*100)/AB62 -> 160.64516129032259 | AD62: =(X62*4)+(Z62*2) -> 8
A63: NORTHCOTE | C63: COHEN 3 | E63: QUAIFE 3 | G63: VINEY 3 | I63: WESTON 2 | L63: PITTS | N63: DEAN | P63: WHITE | W63: FRANKSTON | X63: 2 | Y63: 0 | Z63: 0 | AA63: 232 | AB63: 147 | AC63: =(AA63*100)/AB63 -> 157.82312925170069 | AD63: =(X63*4)+(Z63*2) -> 8
A64: CAULFIELD | C64: ROBINSON 6 | F64: WILLIAMS 2 | I64: CURTAIN | L64: BAKER | N64: COLLINS | P64: RICHARDSON | W64: BRUNSWICK | X64: 2 | Y64: 0 | Z64: 0 | AA64: 231 | AB64: 183 | AC64: =(AA64*100)/AB64 -> 126.22950819672131 | AD64: =(X64*4)+(Z64*2) -> 8
A66: BRUNSWICK | C66: 4 | D66: 1 | E66: =C66*6+D66 -> 25 | G66: 5 | H66: 9 | I66: =G66*6+H66 -> 39 | K66: 9 | L66: 11 | M66: =K66*6+L66 -> 65 | O66: 13 | P66: 16 | Q66: =O66*6+P66 -> 94 | S66: BRUNSWICK | W66: BOX HILL | X66: 1 | Y66: 1 | Z66: 0 | AA66: 194 | AB66: 174 | AC66: =(AA66*100)/AB66 -> 111.49425287356321 | AD66: =(X66*4)+(Z66*2) -> 4
A67: BOX HILL | C67: 2 | D67: 3 | E67: =C67*6+D67 -> 15 | G67: 7 | H67: 8 | I67: =G67*6+H67 -> 50 | K67: 8 | L67: 13 | M67: =K67*6+L67 -> 61 | O67: 12 | P67: 15 | Q67: =O67*6+P67 -> 87 | S67: MINNIS | W67: NORTHCOTE | X67: 1 | Y67: 1 | Z67: 0 | AA67: 193 | AB67: 226 | AC67: =(AA67*100)/AB67 -> 85.398230088495581 | AD67: =(X67*4)+(Z67*2) -> 4
A68: BEST PLAYERS | W68: CAULFIELD | X68: 0 | Y68: 2 | Z68: 0 | AA68: 171 | AB68: 223 | AC68: =(AA68*100)/AB68 -> 76.681614349775785 | AD68: =(X68*4)+(Z68*2) -> 0
A69: BRUNSWICK | C69: K GREIG | F69: O'BRIEN | I69: LEYDIN | L69: BRIGLIA | N69: ANDERSON | Q69: EGAN | W69: WERRIBEE | X69: 0 | Y69: 2 | Z69: 0 | AA69: 144 | AB69: 250 | AC69: =(AA69*100)/AB69 -> 57.6 | AD69: =(X69*4)+(Z69*2) -> 0
A70: BOX HILL | C70: CRISP | F70: DAWSON | I70: SMITH | L70: McKAY | N70: COBAIN | Q70: BAKER | W70: CAMBERWELL | X70: 0 | Y70: 2 | Z70: 0 | AA70: 151 | AB70: 299 | AC70: =(AA70*100)/AB70 -> 50.501672240802677 | AD70: =(X70*4)+(Z70*2) -> 0
A71: GOALKICKERS | W71: MORDIALLOC | X71: 0 | Y71: 2 | Z71: 0 | AA71: 113 | AB71: 248 | AC71: =(AA71*100)/AB71 -> 45.564516129032256 | AD71: =(X71*4)+(Z71*2) -> 0
A72: BRUNSWICK | C72: K GREIG 7 | F72: HOWARD 2 | I72: I GREIG | K72: WHELAN | M72: A COOK | O72: WROUT
A73: BOX HILL | C73: RONALDSON 3 | F73: DAWSON 2 | I73: COBAIN | K73: QUIRK | M73: BAKER | O73: GREAVES | Q73: COLE | S73: 2 SHORT
A75: COBURG | C75: 6 | D75: 7 | E75: =C75*6+D75 -> 43 | G75: 17 | H75: 11 | I75: =G75*6+H75 -> 113 | K75: 22 | L75: 21 | M75: =K75*6+L75 -> 153 | O75: 28 | P75: 24 | Q75: =O75*6+P75 -> 192 | S75: CAMBERWELL
A76: CAMBERWELL | C76: 3 | D76: 8 | E76: =C76*6+D76 -> 26 | G76: 5 | H76: 12 | I76: =G76*6+H76 -> 42 | K76: 7 | L76: 14 | M76: =K76*6+L76 -> 56 | O76: 9 | P76: 17 | Q76: =O76*6+P76 -> 71 | S76: McMASTER
A77: BEST PLAYERS
A78: COBURG | C78: LAWSON | F78: McCARTHY | I78: GALE | L78: MORRISON | O78: KIRKMAN | R78: JENKINS
A79: CAMBERWELL | C79: D BOYD | F79: STEWART | I79: BUTLER | L79: TAYLOR | O79: BRUCE | R79: McNAMARA
A80: GOALKICKERS
A81: COBURG | C81: LAWSON 8 | F81: GALE 5 | I81: McCUBBIN 4 | L81: MORRISON 4 | O81: HEPPER 3 | Q81: JENKINS 2 | S81: KIRKMAN 2
A82: CAMBERWELL | C82: TAYLOR 4 | F82: WARD 2 | I82: SMITH | K82: FLOYD | M82: McNAMARA
A84: FRANKSTON | C84: 3 | D84: 9 | E84: =C84*6+D84 -> 27 | G84: 5 | H84: 11 | I84: =G84*6+H84 -> 41 | K84: 10 | L84: 19 | M84: =K84*6+L84 -> 79 | O84: 14 | P84: 21 | Q84: =O84*6+P84 -> 105 | S84: MORDIALLOC
A85: MORDIALLOC | C85: 1 | D85: 0 | E85: =C85*6+D85 -> 6 | G85: 7 | H85: 6 | I85: =G85*6+H85 -> 48 | K85: 9 | L85: 6 | M85: =K85*6+L85 -> 60 | O85: 10 | P85: 16 | Q85: =O85*6+P85 -> 76
A86: BEST PLAYERS
A87: FRANKSTON | C87: WESTON | F87: CLARK | I87: VAUGHAN | L87: SHEPHERD | O87: RENOUF | R87: WINSTANLEY
A88: MORDIALLOC | C88: DANCKERT | F88: GIBBON | I88: LESLIE | L88: SMITH | O88: HARRY | R88: STUDHAM
A89: GOALKICKERS
A90: FRANKSTON | C90: CLARK 4 | F90: WESTON 4 | I90: McNAB 2 | K90: PITT 2 | M90: NICHOLSON | P90: GRAHAM
A91: MORDIALLOC | C91: LESLIE 3 | F91: HARRY 3 | I91: LITTLE 2 | K91: DANCKERT | N91: MARTELLO
A93: SUNSHINE | C93: 4 | D93: 3 | E93: =C93*6+D93 -> 27 | G93: 8 | H93: 5 | I93: =G93*6+H93 -> 53 | K93: 13 | L93: 12 | M93: =K93*6+L93 -> 90 | O93: 18 | P93: 15 | Q93: =O93*6+P93 -> 123 | S93: WERRIBEE
A94: WERRIBEE | C94: 4 | D94: 4 | E94: =C94*6+D94 -> 28 | G94: 5 | H94: 8 | I94: =G94*6+H94 -> 38 | K94: 7 | L94: 12 | M94: =K94*6+L94 -> 54 | O94: 10 | P94: 13 | Q94: =O94*6+P94 -> 73 | S94: FLANAGAN
A95: BEST PLAYERS
A96: SUNSHINE | C96: RUSSELL | F96: CRAWFORD | I96: IBRAHIM | L96: DARUL | O96: BEAN
A97: WERRIBEE | C97: COMBEN | F97: ARRIGO | I97: HEATHERINGTON | M97: EDWARDS | P97: McNAUGHTON
A98: GOALKICKERS
A99: SUNSHINE | C99: ALLEN 5 | F99: RUSSELL 3 | I99: HIPWORTH 3 | L99: CRAWFORD 3 | O99: FERGUSON 2 | R99: IBRAHIM | T99: McGREGOR
A100: WERRIBEE | C100: MONTGOMERY 4 | F100: LYONS 3 | I100: HEATHERINGTON | M100: TYQUIN | O100: ARRIGO
A102: ROUND 3 | E102: 25TH APRIL | J102: WEATHER | S102: PLAYED AT
D103: 1ST QTR | H103: 2ND QTR | L103: 3RD QTR | P103: FINAL | S103: FRANKSTON
A104: CAULFIELD | C104: 10 | D104: 6 | E104: =C104*6+D104 -> 66 | G104: 12 | H104: 10 | I104: =G104*6+H104 -> 82 | K104: 14 | L104: 15 | M104: =K104*6+L104 -> 99 | O104: 17 | P104: 17 | Q104: =O104*6+P104 -> 119 | S104: UMPIRE | X104: LADDER | AB104: ROUND | AD104: 3
A105: FRANKSTON | C105: 1 | D105: 4 | E105: =C105*6+D105 -> 10 | G105: 6 | H105: 13 | I105: =G105*6+H105 -> 49 | K105: 7 | L105: 20 | M105: =K105*6+L105 -> 62 | O105: 12 | P105: 25 | Q105: =O105*6+P105 -> 97 | S105: HOLZER
A106: BEST PLAYERS | W106: TEAM | X106: W | Y106: L | Z106: D | AA106: FOR | AB106: AGST | AC106: % | AD106: PTS
A107: CAULFIELD | C107: GOWANS | F107: ROBINSON | I107: WILLIAMS | L107: CLARK | N107: BAKER | Q107: ARRELL
A108: FRANKSTON | C108: LEWIS | F108: SLADE | I108: WESTON | L108: WHITE | N108: CLARKE | Q108: RENOUF | W108: COBURG | X108: 3 | Y108: 0 | Z108: 0 | AA108: 470 | AB108: 192 | AC108: =(AA108*100)/AB108 -> 244.79166666666666 | AD108: =(X108*4)+(Z108*2) -> 12
A109: GOALKICKERS | W109: BRUNSWICK | X109: 3 | Y109: 0 | Z109: 0 | AA109: 344 | AB109: 265 | AC109: =(AA109*100)/AB109 -> 129.81132075471697 | AD109: =(X109*4)+(Z109*2) -> 12
A110: CAULFIELD | C110: WHITE 3 | E110: ROBINSON 3 | G110: WILLIAMS 3 | J110: McGINTY 2 | M110: GOWANS 2 | O110: TEMPEST 2 | R110: LOGAN | T110: BAKER | W110: BOX HILL | X110: 2 | Y110: 1 | Z110: 0 | AA110: 374 | AB110: 268 | AC110: =(AA110*100)/AB110 -> 139.55223880597015 | AD110: =(X110*4)+(Z110*2) -> 8
A111: FRANKSTON | C111: KERR 3 | E111: CLARKE 2 | G111: GRAHAM 2 | J111: PITT | L111: WESTON | N111: SLADE | P111: McNAB | R111: CROUGHAN | W111: FRANKSTON | X111: 2 | Y111: 1 | Z111: 0 | AA111: 329 | AB111: 266 | AC111: =(AA111*100)/AB111 -> 123.68421052631579 | AD111: =(X111*4)+(Z111*2) -> 8
E112: 26TH APRIL | J112: WEATHER
A113: COBURG | C113: 8 | D113: 5 | E113: =C113*6+D113 -> 53 | G113: 14 | H113: 5 | I113: =G113*6+H113 -> 89 | K113: 18 | L113: 11 | M113: =K113*6+L113 -> 119 | O113: 20 | P113: 15 | Q113: =O113*6+P113 -> 135 | S113: COBURG | W113: SUNSHINE | X113: 2 | Y113: 1 | Z113: 0 | AA113: 333 | AB113: 290 | AC113: =(AA113*100)/AB113 -> 114.82758620689656 | AD113: =(X113*4)+(Z113*2) -> 8
A114: SUNSHINE | C114: 0 | D114: 1 | E114: =C114*6+D114 -> 1 | G114: 5 | H114: 5 | I114: =G114*6+H114 -> 35 | K114: 8 | L114: 7 | M114: =K114*6+L114 -> 55 | O114: 12 | P114: 12 | Q114: =O114*6+P114 -> 84 | S114: McKENZIE | W114: CAULFIELD | X114: 1 | Y114: 2 | Z114: 0 | AA114: 290 | AB114: 320 | AC114: =(AA114*100)/AB114 -> 90.625 | AD114: =(X114*4)+(Z114*2) -> 4
A115: BEST PLAYERS | W115: WERRIBEE | X115: 1 | Y115: 2 | Z115: 0 | AA115: 256 | AB115: 321 | AC115: =(AA115*100)/AB115 -> 79.750778816199372 | AD115: =(X115*4)+(Z115*2) -> 4
A116: COBURG | C116: ERWIN | F116: MARSH | I116: ELVERY | L116: GALE | N116: JENKINS | W116: NORTHCOTE | X116: 1 | Y116: 2 | Z116: 0 | AA116: 287 | AB116: 406 | AC116: =(AA116*100)/AB116 -> 70.689655172413794 | AD116: =(X116*4)+(Z116*2) -> 4
A117: SUNSHINE | C117: THOMAS | F117: CRAWFORD | I117: FERGUSON | L117: BROWN | N117: NICHOLSON | W117: MORDIALLOC | X117: 0 | Y117: 3 | Z117: 0 | AA117: 195 | AB117: 361 | AC117: =(AA117*100)/AB117 -> 54.016620498614955 | AD117: =(X117*4)+(Z117*2) -> 0
A118: GOALKICKERS | W118: CAMBERWELL | X118: 0 | Y118: 3 | Z118: 0 | AA118: 222 | AB118: 411 | AC118: =(AA118*100)/AB118 -> 54.014598540145982 | AD118: =(X118*4)+(Z118*2) -> 0
A119: COBURG | C119: LAWSON 4 | F119: ERWIN 4 | H119: MORRISON 4 | K119: GALE 2 | M119: HEPPER 2 | O119: JENKINS 2 | R119: SULLIVAN | T119: RUSSIAN
A120: SUNSHINE | C120: CLARKE 3 | E120: CRAWFORD 2 | H120: BEAN 2 | J120: RUSSELL | L120: IBRAHIM | N120: JAMIESON | Q120: BENSON | S120: McGREGOR
A122: BOX HILL | C122: 5 | D122: 3 | E122: =C122*6+D122 -> 33 | G122: 15 | H122: 6 | I122: =G122*6+H122 -> 96 | K122: 19 | L122: 10 | M122: =K122*6+L122 -> 124 | O122: 27 | P122: 18 | Q122: =O122*6+P122 -> 180 | S122: BOX HILL
A123: NORTHCOTE | C123: 3 | D123: 3 | E123: =C123*6+D123 -> 21 | G123: 6 | H123: 4 | I123: =G123*6+H123 -> 40 | K123: 12 | L123: 8 | M123: =K123*6+L123 -> 80 | O123: 14 | P123: 10 | Q123: =O123*6+P123 -> 94 | S123: ANDERSON
A124: BEST PLAYERS
A125: BOX HILL | C125: GRIFFITHS | F125: BIERL | I125: COBAIN | L125: RALPH | N125: IRELAND | Q125: ATKINSON
A126: NORTHCOTE | C126: COHEN | F126: MARTIN | I126: PITTS | L126: MAYNE
A127: GOALKICKERS
A128: BOX HILL | C128: ATKINSON 5 | F128: BIERL 5 | H128: COBAIN 4 | J128: DAWSON 3 | M128: SMITH 2 | O128: CRISP 2 | Q128: BAKER 2 | S128: QUIRK 2 | U128: THOMPSON 2
A129: NORTHCOTE | C129: COHEN 5 | F129: VINEY 2 | H129: PITTS | J129: MAYNE | L129: WHITE | N129: QUAIFE | P129: WEST | S129: 2 SHORT
A131: BRUNSWICK | C131: 2 | D131: 2 | E131: =C131*6+D131 -> 14 | G131: 7 | H131: 7 | I131: =G131*6+H131 -> 49 | K131: 11 | L131: 10 | M131: =K131*6+L131 -> 76 | O131: 16 | P131: 17 | Q131: =O131*6+P131 -> 113 | S131: BRUNSWICK
A132: MORDIALLOC | C132: 3 | D132: 2 | E132: =C132*6+D132 -> 20 | G132: 5 | H132: 12 | I132: =G132*6+H132 -> 42 | K132: 8 | L132: 13 | M132: =K132*6+L132 -> 61 | O132: 11 | P132: 16 | Q132: =O132*6+P132 -> 82 | S132: O'NEILL
A133: BEST PLAYERS
A134: BRUNSWICK | C134: LEYDIN | F134: FEWSTER | I134: BRIGLIA | L134: ALLEN | N134: DENMEAD | Q134: McKINNON
A135: MORDIALLOC | C135: HENDERSON | F135: LESLIE | I135: SMITH | L135: HARRY | N135: STUDHAM | Q135: HUTTON
A136: GOALKICKERS
A137: BRUNSWICK | C137: BOOTH 4 | E137: K GREIG 3 | G137: A COOK 2 | J137: LEYDIN 2 | L137: HOWARD 2 | O137: DENMEAD | R137: WHELAN | T137: McKINNON
A138: MORDIALLOC | C138: LESLIE 5 | F138: STUDHAM 2 | I138: SMITH 2 | K138: ZEALLY | M138: HOCKING
A140: WERRIBEE | C140: 4 | D140: 2 | E140: =C140*6+D140 -> 26 | G140: 8 | H140: 5 | I140: =G140*6+H140 -> 53 | K140: 11 | L140: 8 | M140: =K140*6+L140 -> 74 | O140: 17 | P140: 10 | Q140: =O140*6+P140 -> 112 | S140: WERRIBEE
A141: CAMBERWELL | C141: 5 | D141: 3 | E141: =C141*6+D141 -> 33 | G141: 6 | H141: 7 | I141: =G141*6+H141 -> 43 | K141: 8 | L141: 8 | M141: =K141*6+L141 -> 56 | O141: 10 | P141: 11 | Q141: =O141*6+P141 -> 71 | S141: MINNS
A142: BEST PLAYERS
A143: WERRIBEE | C143: TYQUIN | F143: EDWARDS | I143: BUTTON | L143: RUSH | N143: SHEAHAN | Q143: LYONS
A144: CAMBERWELL | C144: D BOYD | F144: SMITH | I144: CONYERS | L144: PALMER | N144: BRODIE | Q144: BRUCE
A145: GOALKICKERS
A146: WERRIBEE | C146: LYONS 4 | E146: TYQUIN 3 | G146: EDWARDS 3 | J146: RUSH 2 | L146: ARRIGO 2 | N146: MONTGOMERY 2 | R146: McNAUGHTON
A147: CAMBERWELL | C147: RICHMOND 3 | F147: SMITH 2 | H147: PALMER 2 | J147: BRUCE | L147: D BOYD | N147: EDWARDS
A149: ROUND 4 | E149: 2ND MAY | J149: WEATHER | S149: PLAYED AT
D150: 1ST QTR | H150: 2ND QTR | L150: 3RD QTR | P150: FINAL | S150: SUNSHINE
A151: SUNSHINE | C151: 5 | D151: 5 | E151: =C151*6+D151 -> 35 | G151: 10 | H151: 10 | I151: =G151*6+H151 -> 70 | K151: 14 | L151: 17 | M151: =K151*6+L151 -> 101 | O151: 16 | P151: 22 | Q151: =O151*6+P151 -> 118 | S151: UMPIRE | X151: LADDER | AB151: ROUND | AD151: 4
A152: FRANKSTON | C152: 3 | D152: 4 | E152: =C152*6+D152 -> 22 | G152: 5 | H152: 7 | I152: =G152*6+H152 -> 37 | K152: 7 | L152: 8 | M152: =K152*6+L152 -> 50 | O152: 9 | P152: 9 | Q152: =O152*6+P152 -> 63 | S152: GAMBETTA
A153: BEST PLAYERS | W153: TEAM | X153: W | Y153: L | Z153: D | AA153: FOR | AB153: AGST | AC153: % | AD153: PTS
A154: SUNSHINE | C154: BEAN | F154: IBRAHIM | I154: HIPWORTH | L154: THOMAS | O154: ALLEN | Q154: RUSSELL
A155: FRANKSTON | C155: RENOUF | F155: AUSTIN | I155: VAUGHAN | L155: SLADE | O155: KERR | Q155: SHEPHERD | W155: COBURG | X155: 4 | Y155: 0 | Z155: 0 | AA155: 576 | AB155: 250 | AC155: =(AA155*100)/AB155 -> 230.4 | AD155: =(X155*4)+(Z155*2) -> 16
A156: GOALKICKERS | W156: BRUNSWICK | X156: 4 | Y156: 0 | Z156: 0 | AA156: 466 | AB156: 307 | AC156: =(AA156*100)/AB156 -> 151.79153094462541 | AD156: =(X156*4)+(Z156*2) -> 16
A157: SUNSHINE | C157: ALLEN 7 | F157: RUSSELL 2 | I157: IBRAHIM 2 | L157: BENSON 2 | N157: CRAWFORD 2 | Q157: JAMIESON | W157: BOX HILL | X157: 3 | Y157: 1 | Z157: 0 | AA157: 516 | AB157: 335 | AC157: =(AA157*100)/AB157 -> 154.02985074626866 | AD157: =(X157*4)+(Z157*2) -> 12
A158: FRANKSTON | C158: KERR 3 | F158: AUSTIN 2 | I158: McNAB | K158: SHEPHERD | N158: CROUGHAN | Q158: LOVELOCK | W158: SUNSHINE | X158: 3 | Y158: 1 | Z158: 0 | AA158: 451 | AB158: 353 | AC158: =(AA158*100)/AB158 -> 127.76203966005666 | AD158: =(X158*4)+(Z158*2) -> 12
A160: CAULFIELD | C160: 4 | D160: 8 | E160: =C160*6+D160 -> 32 | G160: 9 | H160: 10 | I160: =G160*6+H160 -> 64 | K160: 13 | L160: 14 | M160: =K160*6+L160 -> 92 | O160: 18 | P160: 16 | Q160: =O160*6+P160 -> 124 | S160: PRINCES PARK, CAULFIELD | W160: FRANKSTON | X160: 2 | Y160: 2 | Z160: 0 | AA160: 447 | AB160: 329 | AC160: =(AA160*100)/AB160 -> 135.86626139817631 | AD160: =(X160*4)+(Z160*2) -> 8
A161: WERRIBEE | C161: 2 | D161: 0 | E161: =C161*6+D161 -> 12 | G161: 6 | H161: 3 | I161: =G161*6+H161 -> 39 | K161: 7 | L161: 3 | M161: =K161*6+L161 -> 45 | O161: 9 | P161: 6 | Q161: =O161*6+P161 -> 60 | S161: O'NEILL | W161: CAULFIELD | X161: 2 | Y161: 2 | Z161: 0 | AA161: 414 | AB161: 380 | AC161: =(AA161*100)/AB161 -> 108.94736842105263 | AD161: =(X161*4)+(Z161*2) -> 8
A162: BEST PLAYERS | W162: WERRIBEE | X162: 1 | Y162: 3 | Z162: 0 | AA162: 316 | AB162: 445 | AC162: =(AA162*100)/AB162 -> 71.011235955056179 | AD162: =(X162*4)+(Z162*2) -> 4
A163: CAULFIELD | C163: CLARK | F163: P ROBINSON | I163: DOWSETT | L163: HOCKING | O163: RENOWDEN | R163: CURTAIN | W163: NORTHCOTE | X163: 1 | Y163: 3 | Z163: 0 | AA163: 345 | AB163: 512 | AC163: =(AA163*100)/AB163 -> 67.3828125 | AD163: =(X163*4)+(Z163*2) -> 4
A164: WERRIBEE | C164: PANETTA | F164: A ROBINSON | I164: LYONS | L164: McNAUGHTON | O164: YOUNG | R164: SERTORI | W164: MORDIALLOC | X164: 0 | Y164: 4 | Z164: 0 | AA164: 262 | AB164: 503 | AC164: =(AA164*100)/AB164 -> 52.087475149105366 | AD164: =(X164*4)+(Z164*2) -> 0
A165: GOALKICKERS | W165: CAMBERWELL | X165: 0 | Y165: 4 | Z165: 0 | AA165: 264 | AB165: 533 | AC165: =(AA165*100)/AB165 -> 49.530956848030016 | AD165: =(X165*4)+(Z165*2) -> 0
A166: CAULFIELD | C166: LOGAN 5 | E166: McGINTY 4 | G166: HOCKING 2 | I166: TEMPEST 2 | L166: BAKER 2 | N166: WILLIAMS | P166: P ROBINSON | S166: CURTAIN
A167: WERRIBEE | C167: PANETTA 2 | F167: EDWARDS 2 | I167: YOUNG 2 | K167: LYONS | M167: McNAUGHTON | P167: TYQUIN
A169: BOX HILL | C169: 5 | D169: 2 | E169: =C169*6+D169 -> 32 | G169: 12 | H169: 6 | I169: =G169*6+H169 -> 78 | K169: 15 | L169: 7 | M169: =K169*6+L169 -> 97 | O169: 22 | P169: 10 | Q169: =O169*6+P169 -> 142 | S169: MORDIALLOC
A170: MORDIALLOC | C170: 3 | D170: 7 | E170: =C170*6+D170 -> 25 | G170: 5 | H170: 8 | I170: =G170*6+H170 -> 38 | K170: 7 | L170: 16 | M170: =K170*6+L170 -> 58 | O170: 8 | P170: 19 | Q170: =O170*6+P170 -> 67 | S170: McMASTER
A171: BEST PLAYERS
A172: BOX HILL | C172: COLE | F172: DAWSON | I172: CREWDSON | L172: COBAIN | O172: GRIFFITHS | R172: IRELAND
A173: MORDIALLOC | C173: DANCKERT | F173: SMITH | I173: HOCKING | L173: HENDERSON | O173: SCAIFE | R173: HARRY
A174: GOALKICKERS
A175: BOX HILL | C175: DAWSON 6 | F175: CREWDSON 5 | I175: COBAIN 3 | K175: COLE 3 | M175: SMITH 2 | O175: THOMPSON 2 | R175: BIERL
A176: MORDIALLOC | C176: SMITH 3 | F176: LESLIE 2 | I176: DANCKERT | L176: SOUTHEE | O176: HENDERSON
E177: 3RD MAY | K177: WEATHER
A178: COBURG | C178: 7 | D178: 9 | E178: =C178*6+D178 -> 51 | G178: 13 | H178: 11 | I178: =G178*6+H178 -> 89 | K178: 14 | L178: 8 | M178: =K178*6+L178 -> 92 | O178: 16 | P178: 10 | Q178: =O178*6+P178 -> 106 | S178: NORTHCOTE
A179: NORTHCOTE | C179: 0 | D179: 0 | E179: =C179*6+D179 -> 0 | G179: 4 | H179: 2 | I179: =G179*6+H179 -> 26 | K179: 4 | L179: 9 | M179: =K179*6+L179 -> 33 | O179: 7 | P179: 16 | Q179: =O179*6+P179 -> 58 | S179: FLANAGAN
A180: BEST PLAYERS
A181: COBURG | C181: KIRKMAN | F181: GALE | I181: MARSH | L181: ELVERY | O181: JENKINS
A182: NORTHCOTE | C182: UNDERWOOD | F182: MARTIN | I182: BATE | L182: QUAIFE | O182: COHEN | Q182: McGRATH
A183: GOALKICKERS
A184: COBURG | C184: HOUGH 4 | F184: GALE 2 | H184: LAWSON 2 | J184: RUSSIAN 2 | M184: McCUBBIN 2 | P184: HEPPER 2 | R184: McCARTHY | T184: SULLIVAN
A185: NORTHCOTE | C185: QUAIFE 3 | F185: MAYNE | I185: COHEN | K185: BATE | M185: VINEY
A187: BRUNSWICK | C187: 7 | D187: 3 | E187: =C187*6+D187 -> 45 | G187: 10 | H187: 7 | I187: =G187*6+H187 -> 67 | K187: 13 | L187: 11 | M187: =K187*6+L187 -> 89 | O187: 18 | P187: 14 | Q187: =O187*6+P187 -> 122 | S187: CAMBERWELL
A188: CAMBERWELL | C188: 0 | D188: 1 | E188: =C188*6+D188 -> 1 | G188: 2 | H188: 1 | I188: =G188*6+H188 -> 13 | K188: 4 | L188: 4 | M188: =K188*6+L188 -> 28 | O188: 6 | P188: 6 | Q188: =O188*6+P188 -> 42 | S188: McKENZIE
A189: BEST PLAYERS
A190: BRUNSWICK | C190: I GREIG | F190: NOONAN | I190: LEYDIN | L190: BOOTH | O190: O'BRIEN | R190: K GREIG
A191: CAMBERWELL | C191: BUTLER | F191: McKINLAY | I191: CONYERS | L191: BRODIE | O191: PALMER | R191: BRUCE
A192: GOALKICKERS
A193: BRUNSWICK | C193: COOK 4 | E193: WROUT 2 | G193: LEYDIN 2 | I193: HOWARD 2 | K193: McKINNON 2 | N193: K GREIG 2 | P193: BOOTH | R193: ALLEN | T193: EGAN | V193: O'BRIEN
A194: CAMBERWELL | C194: PALMER 2 | F194: BRAYNE 2 | I194: BRUCE 2
A196: ROUND 5 | E196: 9TH MAY | J196: WEATHER | S196: PLAYED AT
D197: 1ST QTR | H197: 2ND QTR | L197: 3RD QTR | P197: FINAL | S197: FRANKSTON
A198: FRANKSTON | C198: 6 | D198: 2 | E198: =C198*6+D198 -> 38 | G198: 11 | H198: 9 | I198: =G198*6+H198 -> 75 | K198: 17 | L198: 14 | M198: =K198*6+L198 -> 116 | O198: 23 | P198: 15 | Q198: =O198*6+P198 -> 153 | S198: UMPIRE | X198: LADDER | AB198: ROUND | AD198: 5
A199: NORTHCOTE | C199: 6 | D199: 1 | E199: =C199*6+D199 -> 37 | G199: 10 | H199: 5 | I199: =G199*6+H199 -> 65 | K199: 11 | L199: 7 | M199: =K199*6+L199 -> 73 | O199: 15 | P199: 12 | Q199: =O199*6+P199 -> 102 | S199: PASK
A200: BEST PLAYERS | W200: TEAM | X200: W | Y200: L | Z200: D | AA200: FOR | AB200: AGST | AC200: % | AD200: PTS
A201: FRANKSTON | C201: SLADE | F201: KERR | I201: McNAB | L201: WESTON
A202: NORTHCOTE | C202: LESTER | F202: WESTON | I202: COHEN | L202: LEARY | W202: BRUNSWICK | X202: 5 | Y202: 0 | Z202: 0 | AA202: 560 | AB202: 399 | AC202: =(AA202*100)/AB202 -> 140.35087719298247 | AD202: =(X202*4)+(Z202*2) -> 20
A203: GOALKICKERS | W203: COBURG | X203: 4 | Y203: 1 | Z203: 0 | AA203: 693 | AB203: 382 | AC203: =(AA203*100)/AB203 -> 181.41361256544502 | AD203: =(X203*4)+(Z203*2) -> 16
A204: FRANKSTON | C204: McNAB 6 | E204: WESTON 5 | G204: CROUGHAN 4 | J204: KERR 3 | L204: AUSTIN 2 | N204: SLADE | P204: PRENDERGAST | S204: STAPLETON | W204: BOX HILL | X204: 4 | Y204: 1 | Z204: 0 | AA204: 648 | AB204: 452 | AC204: =(AA204*100)/AB204 -> 143.36283185840708 | AD204: =(X204*4)+(Z204*2) -> 16
A205: NORTHCOTE | C205: COHEN 4 | E205: WESTON 4 | H205: LESTER 2 | J205: KEANE 2 | M205: BATE 2 | O205: LEARY | W205: SUNSHINE | X205: 4 | Y205: 1 | Z205: 0 | AA205: 599 | AB205: 420 | AC205: =(AA205*100)/AB205 -> 142.61904761904762 | AD205: =(X205*4)+(Z205*2) -> 16
A207: MORDIALLOC | C207: 6 | D207: 2 | E207: =C207*6+D207 -> 38 | G207: 7 | H207: 3 | I207: =G207*6+H207 -> 45 | K207: 10 | L207: 7 | M207: =K207*6+L207 -> 67 | O207: 16 | P207: 12 | Q207: =O207*6+P207 -> 108 | S207: MORDIALLOC | W207: FRANKSTON | X207: 3 | Y207: 2 | Z207: 0 | AA207: 600 | AB207: 431 | AC207: =(AA207*100)/AB207 -> 139.21113689095128 | AD207: =(X207*4)+(Z207*2) -> 12
A208: CAULFIELD | C208: 5 | D208: 7 | E208: =C208*6+D208 -> 37 | G208: 7 | H208: 12 | I208: =G208*6+H208 -> 54 | K208: 8 | L208: 17 | M208: =K208*6+L208 -> 65 | O208: 12 | P208: 17 | Q208: =O208*6+P208 -> 89 | S208: FLANAGAN | W208: CAULFIELD | X208: 2 | Y208: 3 | Z208: 0 | AA208: 503 | AB208: 488 | AC208: =(AA208*100)/AB208 -> 103.07377049180327 | AD208: =(X208*4)+(Z208*2) -> 8
A209: BEST PLAYERS | W209: WERRIBEE | X209: 1 | Y209: 4 | Z209: 0 | AA209: 408 | AB209: 539 | AC209: =(AA209*100)/AB209 -> 75.695732838589976 | AD209: =(X209*4)+(Z209*2) -> 4
A210: MORDIALLOC | C210: DANCKERT | F210: HOBSON | I210: MARTELLO | L210: SMITH | O210: HINES | W210: NORTHCOTE | X210: 1 | Y210: 4 | Z210: 0 | AA210: 447 | AB210: 665 | AC210: =(AA210*100)/AB210 -> 67.218045112781951 | AD210: =(X210*4)+(Z210*2) -> 4
A211: CAULFIELD | C211: RENOWDEN | F211: GOWANS | I211: FARRELLY | L211: McGINTY | O211: WILLIAMS | W211: MORDIALLOC | X211: 1 | Y211: 4 | Z211: 0 | AA211: 370 | AB211: 592 | AC211: =(AA211*100)/AB211 -> 62.5 | AD211: =(X211*4)+(Z211*2) -> 4
A212: GOALKICKERS | W212: CAMBERWELL | X212: 0 | Y212: 5 | Z212: 0 | AA212: 331 | AB212: 681 | AC212: =(AA212*100)/AB212 -> 48.604992657856094 | AD212: =(X212*4)+(Z212*2) -> 0
A213: MORDIALLOC | C213: LESLIE 5 | E213: MARTELLO 3 | H213: HOCKING 2 | J213: STUDHAM 2 | M213: HARRY 2 | O213: SMITH | Q213: DANCKERT
A214: CAULFIELD | C214: LOGAN 3 | E214: WILLIAMS 2 | H214: BAKER | J214: CURTAIN | L214: HOCKING | N214: GOWANS | P214: WALTON | R214: ROBINSON | T214: TEMPEST
E215: 10TH MAY | J215: WEATHER
A216: BOX HILL | C216: 3 | D216: 0 | E216: =C216*6+D216 -> 18 | G216: 11 | H216: 5 | I216: =G216*6+H216 -> 71 | K216: 15 | L216: 7 | M216: =K216*6+L216 -> 97 | O216: 20 | P216: 12 | Q216: =O216*6+P216 -> 132 | S216: COBURG
A217: COBURG | C217: 6 | D217: 9 | E217: =C217*6+D217 -> 45 | G217: 9 | H217: 12 | I217: =G217*6+H217 -> 66 | K217: 16 | L217: 19 | M217: =K217*6+L217 -> 115 | O217: 16 | P217: 21 | Q217: =O217*6+P217 -> 117 | S217: TURNER
A218: BEST PLAYERS
A219: BOX HILL | C219: COBAIN | F219: DAWSON | I219: BAKER | L219: SMITH | O219: GRIFFITHS
A220: COBURG | C220: KIRKMAN | F220: MARSH | I220: GALE | L220: ROBINSON | O220: SULLIVAN
A221: GOALKICKERS
A222: BOX HILL | C222: DAWSON 5 | F222: SMITH 4 | H222: COBAIN 3 | J222: ATKINSON 3 | M222: THOMPSON 2 | P222: CREWDSON | S222: BIERL | U222: BAKER
A223: COBURG | C223: SPORTON 5 | F223: GALE 3 | H223: KIRKMAN 3 | K223: LAWSON 2 | N223: McCARTHY | Q223: SULLIVAN | S223: MORRISON
A225: BRUNSWICK | C225: 2 | D225: 2 | E225: =C225*6+D225 -> 14 | G225: 6 | H225: 7 | I225: =G225*6+H225 -> 43 | K225: 11 | L225: 13 | M225: =K225*6+L225 -> 79 | O225: 13 | P225: 16 | Q225: =O225*6+P225 -> 94 | S225: BRUNSWICK
A226: WERRIBEE | C226: 3 | D226: 4 | E226: =C226*6+D226 -> 22 | G226: 7 | H226: 5 | I226: =G226*6+H226 -> 47 | K226: 9 | L226: 5 | M226: =K226*6+L226 -> 59 | O226: 14 | P226: 8 | Q226: =O226*6+P226 -> 92 | S226: HOLZER
A227: BEST PLAYERS
A228: BRUNSWICK | C228: K GREIG | F228: FEWSTER | I228: O'BRIEN | L228: BOOTH | O228: NOONAN | Q228: WROUT
A229: WERRIBEE | C229: HEATHERINGTON | F229: ROBINSON | I229: BUTTON | L229: COMBEN | O229: YOUNG | Q229: LYONS
A230: GOALKICKERS
A231: BRUNSWICK | C231: COOK 4 | F231: K GREIG 4 | I231: BOOTH 2 | K231: WROUT 2 | M231: ALLEN
A232: WERRIBEE | C232: LYONS 6 | F232: BUTTON 3 | I232: RUSH | K232: TYQUIN | M232: YOUNG | O232: ROBINSON | R232: McNAUGHTON
A234: SUNSHINE | C234: 7 | D234: 2 | E234: =C234*6+D234 -> 44 | G234: 15 | H234: 6 | I234: =G234*6+H234 -> 96 | K234: 18 | L234: 8 | M234: =K234*6+L234 -> 116 | O234: 22 | P234: 16 | Q234: =O234*6+P234 -> 148 | S234: CAMBERWELL
A235: CAMBERWELL | C235: 1 | D235: 3 | E235: =C235*6+D235 -> 9 | G235: 6 | H235: 5 | I235: =G235*6+H235 -> 41 | K235: 7 | L235: 12 | M235: =K235*6+L235 -> 54 | O235: 9 | P235: 13 | Q235: =O235*6+P235 -> 67 | S235: DUGARD
A236: BEST PLAYERS
A237: SUNSHINE | C237: RUSSELL | F237: OVERS | I237: THOMAS | L237: BROWN | O237: METCHER | R237: CRAWFORD
A238: CAMBERWELL | C238: BRODIE | F238: D BOYD | I238: STEWART | L238: CONYERS | O238: BUTLER | R238: MACKINLAY
A239: GOALKICKERS
A240: SUNSHINE | C240: RUSSELL 8 | F240: ALLEN 4 | H240: CRAWFORD 2 | K240: BENSON 2 | M240: MORRISON 2 | O240: OVERS | Q240: JAMIESON | S240: FERGUSON | V240: CLARKE
A241: CAMBERWELL | C241: RICHMOND 3 | F241: D BOYD 2 | I241: WARD | K241: SMITH | M241: BRUCE | O241: EDWARDS
A243: ROUND 6 | E243: 16TH MAY | J243: WEATHER | S243: PLAYED AT
D244: 1ST QTR | H244: 2ND QTR | L244: 3RD QTR | P244: FINAL | S244: BOX HILL
A245: FRANKSTON | C245: 1 | D245: 4 | E245: =C245*6+D245 -> 10 | G245: 5 | H245: 4 | I245: =G245*6+H245 -> 34 | K245: 11 | L245: 6 | M245: =K245*6+L245 -> 72 | O245: 13 | P245: 10 | Q245: =O245*6+P245 -> 88 | S245: UMPIRE | X245: LADDER | AB245: ROUND | AD245: 6
A246: BOX HILL | C246: 3 | D246: 2 | E246: =C246*6+D246 -> 20 | G246: 7 | H246: 5 | I246: =G246*6+H246 -> 47 | K246: 8 | L246: 7 | M246: =K246*6+L246 -> 55 | O246: 8 | P246: 10 | Q246: =O246*6+P246 -> 58 | S246: FLANAGAN
A247: BEST PLAYERS | W247: TEAM | X247: W | Y247: L | Z247: D | AA247: FOR | AB247: AGST | AC247: % | AD247: PTS
A248: FRANKSTON | C248: SLADE | F248: WINSTANLEY | I248: GOODINGS | L248: ROSENBROCK | O248: KEETH
A249: BOX HILL | C249: COLE | F249: CRISP | I249: RALPH | L249: DAWSON | O249: McQUALTER | W249: COBURG | X249: 5 | Y249: 1 | Z249: 0 | AA249: 846 | AB249: 434 | AC249: =(AA249*100)/AB249 -> 194.93087557603687 | AD249: =(X249*4)+(Z249*2) -> 20
A250: GOALKICKERS | W250: SUNSHINE | X250: 5 | Y250: 1 | Z250: 0 | AA250: 731 | AB250: 527 | AC250: =(AA250*100)/AB250 -> 138.70967741935485 | AD250: =(X250*4)+(Z250*2) -> 20
A251: FRANKSTON | C251: ROSENBROCK 3 | F251: WESTON 3 | I251: NICHOLSON 3 | L251: GOODINGS 2 | N251: STAPLETON | Q251: KERR | W251: BRUNSWICK | X251: 5 | Y251: 1 | Z251: 0 | AA251: 612 | AB251: 552 | AC251: =(AA251*100)/AB251 -> 110.8695652173913 | AD251: =(X251*4)+(Z251*2) -> 20
A252: BOX HILL | C252: COLE 2 | E252: COBAIN 2 | G252: DAWSON 2 | J252: THOMPSON | M252: CRISP | W252: FRANKSTON | X252: 4 | Y252: 2 | Z252: 0 | AA252: 688 | AB252: 489 | AC252: =(AA252*100)/AB252 -> 140.69529652351738 | AD252: =(X252*4)+(Z252*2) -> 16
W253: BOX HILL | X253: 4 | Y253: 2 | Z253: 0 | AA253: 706 | AB253: 540 | AC253: =(AA253*100)/AB253 -> 130.74074074074073 | AD253: =(X253*4)+(Z253*2) -> 16
A254: CAULFIELD | C254: 7 | D254: 2 | E254: =C254*6+D254 -> 44 | G254: 10 | H254: 13 | I254: =G254*6+H254 -> 73 | K254: 13 | L254: 20 | M254: =K254*6+L254 -> 98 | O254: 16 | P254: 22 | Q254: =O254*6+P254 -> 118 | S254: PRINCES PARK, CAULFIELD | W254: CAULFIELD | X254: 3 | Y254: 3 | Z254: 0 | AA254: 621 | AB254: 564 | AC254: =(AA254*100)/AB254 -> 110.1063829787234 | AD254: =(X254*4)+(Z254*2) -> 12
A255: CAMBERWELL | C255: 2 | D255: 4 | E255: =C255*6+D255 -> 16 | G255: 6 | H255: 6 | I255: =G255*6+H255 -> 42 | K255: 9 | L255: 7 | M255: =K255*6+L255 -> 61 | O255: 11 | P255: 10 | Q255: =O255*6+P255 -> 76 | S255: ANDERSON | W255: WERRIBEE | X255: 2 | Y255: 4 | Z255: 0 | AA255: 509 | AB255: 623 | AC255: =(AA255*100)/AB255 -> 81.701444622792934 | AD255: =(X255*4)+(Z255*2) -> 8
A256: BEST PLAYERS | W256: NORTHCOTE | X256: 1 | Y256: 5 | Z256: 0 | AA256: 554 | AB256: 797 | AC256: =(AA256*100)/AB256 -> 69.510664993726479 | AD256: =(X256*4)+(Z256*2) -> 4
A257: CAULFIELD | C257: WILLIAMS | F257: TEMPEST | I257: RENOWDEN | L257: ARRELL | O257: CLARK | Q257: EVERALL | W257: MORDIALLOC | X257: 1 | Y257: 5 | Z257: 0 | AA257: 454 | AB257: 693 | AC257: =(AA257*100)/AB257 -> 65.512265512265515 | AD257: =(X257*4)+(Z257*2) -> 4
A258: CAMBERWELL | C258: CONYERS | F258: BRODIE | I258: STEWART | L258: TAYLOR | O258: WARD | W258: CAMBERWELL | X258: 0 | Y258: 6 | Z258: 0 | AA258: 407 | AB258: 799 | AC258: =(AA258*100)/AB258 -> 50.938673341677095 | AD258: =(X258*4)+(Z258*2) -> 0
A259: GOALKICKERS
A260: CAULFIELD | C260: WILLIAMS 5 | F260: TEMPEST 4 | I260: WESTON 3 | L260: LOGAN | N260: WHITE | P260: ROBINSON | S260: BAKER
A261: CAMBERWELL | C261: WARD 3 | F261: BRUCE 2 | I261: TAYLOR | K261: BRAYNE | M261: GIBB | O261: CONYERS | Q261: EDWARDS | T261: SMITH
A263: WERRIBEE | C263: 2 | D263: 1 | E263: =C263*6+D263 -> 13 | G263: 8 | H263: 7 | I263: =G263*6+H263 -> 55 | K263: 12 | L263: 8 | M263: =K263*6+L263 -> 80 | O263: 15 | P263: 11 | Q263: =O263*6+P263 -> 101 | S263: WERRIBEE
A264: MORDIALLOC | C264: 4 | D264: 6 | E264: =C264*6+D264 -> 30 | G264: 6 | H264: 7 | I264: =G264*6+H264 -> 43 | K264: 11 | L264: 7 | M264: =K264*6+L264 -> 73 | O264: 12 | P264: 12 | Q264: =O264*6+P264 -> 84 | S264: McKENZIE
A265: BEST PLAYERS
A266: WERRIBEE | C266: LYONS | F266: ROBINSON | I266: McNAUGHTON | L266: CUNNINGHAM | O266: MONTGOMERY
A267: MORDIALLOC | C267: DANCKERT | F267: HUTTON | I267: HOCKING | L267: MARTELLO | O267: PEARCE
A268: GOALKICKERS
A269: WERRIBEE | C269: McNAUGHTON 3 | F269: LYONS 3 | I269: MONTGOMERY 3 | L269: ROBINSON 2 | O269: CUNNINGHAM 2 | S269: EDWARDS | V269: ARRIGO
A270: MORDIALLOC | C270: LESLIE 3 | F270: HARRY 3 | I270: HOCKING 2 | L270: MARTELLO | O270: LITTLE | Q270: SMITH | S270: PEARCE
E271: 17TH MAY | K271: WEATHER
A272: COBURG | C272: 7 | D272: 9 | E272: =C272*6+D272 -> 51 | G272: 13 | H272: 11 | I272: =G272*6+H272 -> 89 | K272: 18 | L272: 16 | M272: =K272*6+L272 -> 124 | O272: 22 | P272: 21 | Q272: =O272*6+P272 -> 153 | S272: COBURG
A273: BRUNSWICK | C273: 0 | D273: 0 | E273: =C273*6+D273 -> 0 | G273: 4 | H273: 2 | I273: =G273*6+H273 -> 26 | K273: 5 | L273: 6 | M273: =K273*6+L273 -> 36 | O273: 7 | P273: 10 | Q273: =O273*6+P273 -> 52 | S273: GAMBETTA
A274: BEST PLAYERS
A275: COBURG | C275: KIRKMAN | F275: GALE | I275: TYTLER | L275: WIN | O275: JONES | R275: SPORTON
A276: BRUNSWICK | C276: BOOTH | F276: COOK | I276: HOWARD | L276: LEYDIN | O276: NOONAN
A277: GOALKICKERS
A278: COBURG | C278: SPORTON 7 | F278: GALE 5 | H278: ERWIN 4 | J278: McCARTHY 3 | M278: HEPPER 2 | O278: MARSH
A279: BRUNSWICK | C279: COOK 3 | F279: WHELAN | I279: FEWSTER | L279: BOOTH | N279: BEST
A281: SUNSHINE | C281: 6 | D281: 4 | E281: =C281*6+D281 -> 40 | G281: 12 | H281: 7 | I281: =G281*6+H281 -> 79 | K281: 18 | L281: 11 | M281: =K281*6+L281 -> 119 | O281: 20 | P281: 12 | Q281: =O281*6+P281 -> 132 | S281: SUNSHINE
A282: NORTHCOTE | C282: 4 | D282: 1 | E282: =C282*6+D282 -> 25 | G282: 11 | H282: 5 | I282: =G282*6+H282 -> 71 | K282: 13 | L282: 6 | M282: =K282*6+L282 -> 84 | O282: 16 | P282: 11 | Q282: =O282*6+P282 -> 107 | S282: McMASTER
A283: BEST PLAYERS
A284: SUNSHINE | C284: DARUL | F284: BEAN | I284: RUSSELL | L284: OVERS | O284: NICHOLSON | R284: HIPWORTH
A285: NORTHCOTE | C285: McGORLICK | F285: COHEN | I285: KOZARIS | L285: YAKSENDER | O285: McORIST | R285: KEANE
A286: GOALKICKERS
A287: SUNSHINE | C287: JAMIESON 4 | F287: ALLEN 3 | I287: RUSSELL 3 | L287: FERGUSON 3 | O287: CRAWFORD 3 | R287: CLARKE 3 | U287: BEAN
A288: NORTHCOTE | C288: COHEN 6 | F288: McGORLICK 3 | I288: LESTER 2 | L288: WESTON 2 | N288: DEAN | P288: KEANE | R288: LASKY
A290: ROUND 7 | E290: 23RD MAY | J290: WEATHER | S290: PLAYED AT
D291: 1ST QTR | H291: 2ND QTR | L291: 3RD QTR | P291: FINAL | S291: FRANKSTON
A292: COBURG | C292: 4 | D292: 5 | E292: =C292*6+D292 -> 29 | G292: 10 | H292: 10 | I292: =G292*6+H292 -> 70 | K292: 16 | L292: 14 | M292: =K292*6+L292 -> 110 | O292: 22 | P292: 19 | Q292: =O292*6+P292 -> 151 | S292: UMPIRE | X292: LADDER | AB292: ROUND | AD292: 7
A293: FRANKSTON | C293: 2 | D293: 0 | E293: =C293*6+D293 -> 12 | G293: 4 | H293: 3 | I293: =G293*6+H293 -> 27 | K293: 7 | L293: 6 | M293: =K293*6+L293 -> 48 | O293: 10 | P293: 9 | Q293: =O293*6+P293 -> 69 | S293: McKENZIE
A294: BEST PLAYERS | W294: TEAM | X294: W | Y294: L | Z294: D | AA294: FOR | AB294: AGST | AC294: % | AD294: PTS
A295: COBURG | C295: ERWIN | F295: HEPPER | I295: SULLIVAN | L295: JACKSON | O295: SPORTON | R295: MORRISON
A296: FRANKSTON | C296: KERR | F296: WESTON | I296: McNAB | L296: BLAKE | O296: ROSENBROCK | W296: COBURG | X296: 6 | Y296: 1 | Z296: 0 | AA296: 997 | AB296: 503 | AC296: =(AA296*100)/AB296 -> 198.21073558648112 | AD296: =(X296*4)+(Z296*2) -> 24
A297: GOALKICKERS | M297: BRENNAN | P297: JENKINS | W297: SUNSHINE | X297: 6 | Y297: 1 | Z297: 0 | AA297: 865 | AB297: 616 | AC297: =(AA297*100)/AB297 -> 140.42207792207793 | AD297: =(X297*4)+(Z297*2) -> 24
A298: COBURG | C298: SPORTON 7 | F298: ERWIN 4 | I298: GALE 3 | K298: MORRISON 3 | N298: McCARTHY | Q298: HEPPER | S298: LAWSON | W298: BRUNSWICK | X298: 6 | Y298: 1 | Z298: 0 | AA298: 758 | AB298: 689 | AC298: =(AA298*100)/AB298 -> 110.0145137880987 | AD298: =(X298*4)+(Z298*2) -> 24
A299: FRANKSTON | C299: WESTON 3 | F299: KOSCH 2 | I299: KERR 2 | K299: GOODINGS | N299: STAPLETON | Q299: ROSENBROCK | W299: FRANKSTON | X299: 4 | Y299: 3 | Z299: 0 | AA299: 757 | AB299: 640 | AC299: =(AA299*100)/AB299 -> 118.28125 | AD299: =(X299*4)+(Z299*2) -> 16
A301: CAMBERWELL | C301: 0 | D301: 3 | E301: =C301*6+D301 -> 3 | G301: 5 | H301: 9 | I301: =G301*6+H301 -> 39 | K301: 7 | L301: 12 | M301: =K301*6+L301 -> 54 | O301: 12 | P301: 15 | Q301: =O301*6+P301 -> 87 | S301: CAMBERWELL | W301: BOX HILL | X301: 4 | Y301: 3 | Z301: 0 | AA301: 795 | AB301: 674 | AC301: =(AA301*100)/AB301 -> 117.95252225519287 | AD301: =(X301*4)+(Z301*2) -> 16
A302: MORDIALLOC | C302: 4 | D302: 3 | E302: =C302*6+D302 -> 27 | G302: 7 | H302: 5 | I302: =G302*6+H302 -> 47 | K302: 9 | L302: 8 | M302: =K302*6+L302 -> 62 | O302: 10 | P302: 8 | Q302: =O302*6+P302 -> 68 | S302: GIBBONS | W302: CAULFIELD | X302: 3 | Y302: 4 | Z302: 0 | AA302: 758 | AB302: 710 | AC302: =(AA302*100)/AB302 -> 106.7605633802817 | AD302: =(X302*4)+(Z302*2) -> 12
A303: BEST PLAYERS | W303: WERRIBEE | X303: 2 | Y303: 5 | Z303: 0 | AA303: 588 | AB303: 740 | AC303: =(AA303*100)/AB303 -> 79.459459459459453 | AD303: =(X303*4)+(Z303*2) -> 8
A304: CAMBERWELL | C304: ? | F304: MACKINLAY | I304: BRENCHLEY | L304: BOYD | N304: RICHMOND | Q304: TAYLOR | W304: NORTHCOTE | X304: 2 | Y304: 5 | Z304: 0 | AA304: 671 | AB304: 876 | AC304: =(AA304*100)/AB304 -> 76.598173515981742 | AD304: =(X304*4)+(Z304*2) -> 8
A305: MORDIALLOC | C305: ? | F305: McGUINNESS | I305: STUDHAM | N305: DANCKERT | Q305: GIBBONS | W305: MORDIALLOC | X305: 1 | Y305: 6 | Z305: 0 | AA305: 522 | AB305: 780 | AC305: =(AA305*100)/AB305 -> 66.92307692307692 | AD305: =(X305*4)+(Z305*2) -> 4
A306: GOALKICKERS | W306: CAMBERWELL | X306: 1 | Y306: 6 | Z306: 0 | AA306: 494 | AB306: 867 | AC306: =(AA306*100)/AB306 -> 56.978085351787776 | AD306: =(X306*4)+(Z306*2) -> 4
A307: CAMBERWELL | C307: ? 4 | F307: BRENCHLEY 3 | I307: BOYD 2 | K307: ? 2 | M307: EDWARDS
A308: MORDIALLOC | C308: ? 4 | F308: LESLIE 2 | I308: GIBBON | K308: HARRY | M308: MARTELLO | P308: PEARCE
E309: 24TH MAY | J309: WEATHER
A310: SUNSHINE | C310: 3 | D310: 4 | E310: =C310*6+D310 -> 22 | G310: 7 | H310: 5 | I310: =G310*6+H310 -> 47 | K310: 12 | L310: 8 | M310: =K310*6+L310 -> 80 | O310: 21 | P310: 8 | Q310: =O310*6+P310 -> 134 | S310: BOX HILL
A311: BOX HILL | C311: 4 | D311: 3 | E311: =C311*6+D311 -> 27 | G311: 7 | H311: 7 | I311: =G311*6+H311 -> 49 | K311: 13 | L311: 7 | M311: =K311*6+L311 -> 85 | O311: 13 | P311: 11 | Q311: =O311*6+P311 -> 89 | S311: O'NEILL
A312: BEST PLAYERS
A313: SUNSHINE | C313: CRAWFORD | F313: CHADWICK | I313: IBRAHIM | L313: BROWN | N313: RUSSELL | Q313: FERGUSON
A314: BOX HILL | C314: WISEMAN | F314: McQUALTER | I314: THOMPSON | L314: COLE | N314: DAWSON
A315: GOALKICKERS
A316: SUNSHINE | C316: RUSSELL 7 | F316: FERGUSON 3 | I316: WAGLAND 3 | L316: ARRIGO 2 | N316: BENSON 2 | Q316: CRAWFORD | T316: OVERS
A317: BOX HILL | C317: THOMPSON 5 | F317: COLE 3 | H317: DAWSON 3 | K317: WISEMAN | N317: IRELAND
A319: NORTHCOTE | C319: 5 | D319: 5 | E319: =C319*6+D319 -> 35 | G319: 11 | H319: 8 | I319: =G319*6+H319 -> 74 | K319: 16 | L319: 9 | M319: =K319*6+L319 -> 105 | O319: 18 | P319: 9 | Q319: =O319*6+P319 -> 117 | S319: NORTHCOTE
A320: WERRIBEE | C320: 2 | D320: 3 | E320: =C320*6+D320 -> 15 | G320: 3 | H320: 11 | I320: =G320*6+H320 -> 29 | K320: 6 | L320: 14 | M320: =K320*6+L320 -> 50 | O320: 10 | P320: 19 | Q320: =O320*6+P320 -> 79 | S320: TURNER
A321: BEST PLAYERS
A322: NORTHCOTE | C322: ? | F322: KEANE | I322: JONES | L322: MAYNE | N322: McORIST | Q322: SCHRIPPA
A323: WERRIBEE | C323: ? | F323: ROBINSON | I323: COMBEN | L323: YOUNG | N323: TAYLOR | Q323: EDWARDS
A324: GOALKICKERS
A325: NORTHCOTE | C325: ? 10 | F325: WESTON 3 | I325: MAYNE 3 | K325: QUAIFE | M325: LEARY
A326: WERRIBEE | C326: EDWARDS 5 | F326: LYONS | I326: COMBEN | K326: TAYLOR | M326: YOUNG | O326: MONTGOMERY
A328: BRUNSWICK | C328: 5 | D328: 3 | E328: =C328*6+D328 -> 33 | G328: 11 | H328: 6 | I328: =G328*6+H328 -> 72 | K328: 16 | L328: 12 | M328: =K328*6+L328 -> 108 | O328: 22 | P328: 14 | Q328: =O328*6+P328 -> 146 | S328: BRUNSWICK
A329: CAULFIELD | C329: 7 | D329: 2 | E329: =C329*6+D329 -> 44 | G329: 12 | H329: 2 | I329: =G329*6+H329 -> 74 | K329: 15 | L329: 6 | M329: =K329*6+L329 -> 96 | O329: 21 | P329: 11 | Q329: =O329*6+P329 -> 137 | S329: McMASTER
A330: BEST PLAYERS
A331: BRUNSWICK | C331: BOOTH | F331: ? | I331: WHELAN | L331: COOK | O331: ?
A332: CAULFIELD | C332: WHITE | F332: ? | I332: GOWANS | L332: ROBINSON | O332: TEMPEST | R332: CURTAIN
A333: GOALKICKERS
A334: BRUNSWICK | C334: WHELAN 8 | F334: K GREIG 5 | I334: COOK 4 | K334: ? 4 | M334: LEYDIN
A335: CAULFIELD | C335: WHITE 7 | F335: ROBINSON 6 | I335: WILLIAMS 4 | L335: CURTAIN | N335: 1 | P335: TEMPEST | R335: HOCKING
A337: ROUND 8 | E337: 30TH MAY | J337: WEATHER | S337: PLAYED AT
D338: 1ST QTR | H338: 2ND QTR | L338: 3RD QTR | P338: FINAL | S338: PRINCES PARK, CAULFIELD
A339: BOX HILL | C339: 8 | D339: 4 | E339: =C339*6+D339 -> 52 | G339: 12 | H339: 6 | I339: =G339*6+H339 -> 78 | K339: 19 | L339: 11 | M339: =K339*6+L339 -> 125 | O339: 22 | P339: 12 | Q339: =O339*6+P339 -> 144 | S339: UMPIRE | X339: LADDER | AB339: ROUND | AD339: 8
A340: CAULFIELD | C340: 1 | D340: 2 | E340: =C340*6+D340 -> 8 | G340: 7 | H340: 6 | I340: =G340*6+H340 -> 48 | K340: 10 | L340: 7 | M340: =K340*6+L340 -> 67 | O340: 18 | P340: 10 | Q340: =O340*6+P340 -> 118 | S340: GAMBETTA
A341: BEST PLAYERS | W341: TEAM | X341: W | Y341: L | Z341: D | AA341: FOR | AB341: AGST | AC341: % | AD341: PTS
A342: BOX HILL | C342: BAKER | F342: ATKINSON | I342: THOMPSON | L342: HUMPHREY | O342: CREWDSEN
A343: CAULFIELD | C343: CURTAIN | F343: ARRELL | I343: HOCKING | L343: O'DONNELL | O343: PRENTICE | W343: COBURG | X343: 7 | Y343: 1 | Z343: 0 | AA343: 1133 | AB343: 585 | AC343: =(AA343*100)/AB343 -> 193.67521367521368 | AD343: =(X343*4)+(Z343*2) -> 28
A344: GOALKICKERS | N344: IRELAND | P344: BIERL | R344: BARNETT | W344: SUNSHINE | X344: 7 | Y344: 1 | Z344: 0 | AA344: 998 | AB344: 694 | AC344: =(AA344*100)/AB344 -> 143.80403458213257 | AD344: =(X344*4)+(Z344*2) -> 28
A345: BOX HILL | C345: THOMPSON 5 | F345: FARNSWORTH 3 | I345: COLE 3 | K345: WISEMAN 3 | N345: ATKINSON 2 | Q345: COBAIN 2 | S345: DAWSON | W345: BRUNSWICK | X345: 6 | Y345: 2 | Z345: 0 | AA345: 836 | AB345: 822 | AC345: =(AA345*100)/AB345 -> 101.70316301703163 | AD345: =(X345*4)+(Z345*2) -> 24
A346: CAULFIELD | C346: BROWN 5 | F346: WHITE 3 | I346: BAKER 3 | K346: CURTAIN 2 | M346: McGINTY 2 | P346: ARRELL 2 | W346: FRANKSTON | X346: 5 | Y346: 3 | Z346: 0 | AA346: 872 | AB346: 712 | AC346: =(AA346*100)/AB346 -> 122.47191011235955 | AD346: =(X346*4)+(Z346*2) -> 20
A348: MORDIALLOC | C348: 4 | D348: 9 | E348: =C348*6+D348 -> 33 | G348: 4 | H348: 12 | I348: =G348*6+H348 -> 36 | K348: 6 | L348: 15 | M348: =K348*6+L348 -> 51 | O348: 7 | P348: 16 | Q348: =O348*6+P348 -> 58 | S348: MORDIALLOC | W348: BOX HILL | X348: 5 | Y348: 3 | Z348: 0 | AA348: 939 | AB348: 792 | AC348: =(AA348*100)/AB348 -> 118.56060606060606 | AD348: =(X348*4)+(Z348*2) -> 20
A349: NORTHCOTE | C349: 0 | D349: 0 | E349: =C349*6+D349 -> 0 | G349: 1 | H349: 5 | I349: =G349*6+H349 -> 11 | K349: 2 | L349: 5 | M349: =K349*6+L349 -> 17 | O349: 5 | P349: 8 | Q349: =O349*6+P349 -> 38 | S349: McKENZIE | W349: CAULFIELD | X349: 3 | Y349: 5 | Z349: 0 | AA349: 876 | AB349: 854 | AC349: =(AA349*100)/AB349 -> 102.57611241217799 | AD349: =(X349*4)+(Z349*2) -> 12
A350: BEST PLAYERS | W350: WERRIBEE | X350: 2 | Y350: 6 | Z350: 0 | AA350: 670 | AB350: 876 | AC350: =(AA350*100)/AB350 -> 76.484018264840188 | AD350: =(X350*4)+(Z350*2) -> 8
A351: MORDIALLOC | C351: HARRY | F351: LESLIE | I351: LAIRD | L351: DANCKERT | O351: MARTELLO | W351: NORTHCOTE | X351: 2 | Y351: 6 | Z351: 0 | AA351: 709 | AB351: 934 | AC351: =(AA351*100)/AB351 -> 75.910064239828699 | AD351: =(X351*4)+(Z351*2) -> 8
A352: NORTHCOTE | C352: KOZARIS | F352: SMITH | I352: LESTER | L352: COHEN | O352: BEYNON | W352: MORDIALLOC | X352: 2 | Y352: 6 | Z352: 0 | AA352: 580 | AB352: 818 | AC352: =(AA352*100)/AB352 -> 70.904645476772615 | AD352: =(X352*4)+(Z352*2) -> 8
A353: GOALKICKERS | W353: CAMBERWELL | X353: 1 | Y353: 7 | Z353: 0 | AA353: 566 | AB353: 982 | AC353: =(AA353*100)/AB353 -> 57.63747454175153 | AD353: =(X353*4)+(Z353*2) -> 4
A354: MORDIALLOC | C354: SMITH 2 | F354: MARTELLO 2 | I354: HOCKING | L354: HARRY | N354: PEARCE
A355: NORTHCOTE | C355: WESTON 2 | F355: LESTER | I355: QUAIFE | L355: VINEY
E356: 31ST MAY | J356: WEATHER
A357: SUNSHINE | C357: 5 | D357: 3 | E357: =C357*6+D357 -> 33 | G357: 12 | H357: 5 | I357: =G357*6+H357 -> 77 | K357: 14 | L357: 8 | M357: =K357*6+L357 -> 92 | O357: 20 | P357: 13 | Q357: =O357*6+P357 -> 133 | S357: BRUNSWICK
A358: BRUNSWICK | C358: 1 | D358: 5 | E358: =C358*6+D358 -> 11 | G358: 3 | H358: 7 | I358: =G358*6+H358 -> 25 | K358: 5 | L358: 13 | M358: =K358*6+L358 -> 43 | O358: 10 | P358: 18 | Q358: =O358*6+P358 -> 78 | S358: PECK
A359: BEST PLAYERS
A360: SUNSHINE | C360: THOMAS | F360: BROWN | I360: IBRAHIM | L360: RUSSELL | O360: BENSON | Q360: OVERS
A361: BRUNSWICK | C361: K GREIG | F361: BOOTH | I361: O'BRIEN | L361: LEYDIN | O361: OGSTON
A362: GOALKICKERS
A363: SUNSHINE | C363: ALLEN 6 | F363: RUSSELL 5 | I363: BENSON 3 | K363: FERGUSON 2 | N363: WAGLAND 2 | Q363: CRAWFORD | T363: CLARKE
A364: BRUNSWICK | C364: K GREIG 4 | F364: WHELAN 2 | I364: OGSTON | K364: GENT | M364: WADHAM | P364: BOOTH
A366: FRANKSTON | C366: 3 | D366: 1 | E366: =C366*6+D366 -> 19 | G366: 8 | H366: 2 | I366: =G366*6+H366 -> 50 | K366: 14 | L366: 4 | M366: =K366*6+L366 -> 88 | O366: 18 | P366: 7 | Q366: =O366*6+P366 -> 115 | S366: CAMBERWELL
A367: CAMBERWELL | C367: 0 | D367: 6 | E367: =C367*6+D367 -> 6 | G367: 2 | H367: 9 | I367: =G367*6+H367 -> 21 | K367: 6 | L367: 10 | M367: =K367*6+L367 -> 46 | O367: 10 | P367: 12 | Q367: =O367*6+P367 -> 72 | S367: HOLZER
A368: BEST PLAYERS
A369: FRANKSTON | C369: LOVELOCK | F369: WESTON | I369: HINES | L369: KERR | O369: CLARKE
A370: CAMBERWELL | C370: BULMER | F370: STEWART | I370: D BOYD | L370: D WILSON | O370: WAYE | R370: RICHMOND
A371: GOALKICKERS
A372: FRANKSTON | C372: WESTON 5 | F372: HINES 4 | I372: CLARKE 2 | K372: LOVELOCK 2 | N372: AUSTIN 2 | Q372: PITT 2 | S372: KEECH
A373: CAMBERWELL | C373: RICHMOND 4 | F373: TAYLOR 2 | I373: EDWARDS 2 | L373: BRENCHLEY | O373: SMITH
A375: COBURG | C375: 3 | D375: 6 | E375: =C375*6+D375 -> 24 | G375: 8 | H375: 14 | I375: =G375*6+H375 -> 62 | K375: 13 | L375: 19 | M375: =K375*6+L375 -> 97 | O375: 19 | P375: 22 | Q375: =O375*6+P375 -> 136 | S375: WERRIBEE
A376: WERRIBEE | C376: 2 | D376: 4 | E376: =C376*6+D376 -> 16 | G376: 4 | H376: 5 | I376: =G376*6+H376 -> 29 | K376: 6 | L376: 13 | M376: =K376*6+L376 -> 49 | O376: 11 | P376: 16 | Q376: =O376*6+P376 -> 82 | S376: ANDERSON
A377: BEST PLAYERS
A378: COBURG | C378: KIRKMAN | F378: MARSH | I378: SULLIVAN | L378: GALE | O378: MORRISON
A379: WERRIBEE | C379: BUTTON | F379: TAYLOR | I379: McNAUGHTON | L379: HEATHERINGTON | P379: LLOYD
A380: GOALKICKERS
A381: COBURG | C381: SPORTON 5 | F381: GALE 4 | H381: MORRISON 3 | K381: LAWSON 3 | M381: JENKINS 2 | O381: SULLIVAN | R381: ERWIN
A382: WERRIBEE | C382: HEATHERINGTON 2 | G382: LYONS 2 | I382: YOUNG 2 | K382: TAYLOR 2 | M382: TYQUIN | O382: MANOLAKAKIS | R382: SERTORI
A384: ROUND 9 | E384: 6TH JUNE | J384: WEATHER | S384: PLAYED AT
D385: 1ST QTR | H385: 2ND QTR | L385: 3RD QTR | P385: FINAL | S385: BOX HILL
A386: BOX HILL | C386: 3 | D386: 3 | E386: =C386*6+D386 -> 21 | G386: 8 | H386: 4 | I386: =G386*6+H386 -> 52 | K386: 12 | L386: 8 | M386: =K386*6+L386 -> 80 | O386: 16 | P386: 14 | Q386: =O386*6+P386 -> 110 | S386: UMPIRE | X386: LADDER | AB386: ROUND | AD386: 9
A387: WERRIBEE | C387: 3 | D387: 2 | E387: =C387*6+D387 -> 20 | G387: 5 | H387: 9 | I387: =G387*6+H387 -> 39 | K387: 7 | L387: 12 | M387: =K387*6+L387 -> 54 | O387: 9 | P387: 14 | Q387: =O387*6+P387 -> 68 | S387: HOLZER
A388: BEST PLAYERS | W388: TEAM | X388: W | Y388: L | Z388: D | AA388: FOR | AB388: AGST | AC388: % | AD388: PTS
A389: BOX HILL | C389: IRELAND | F389: COLE | I389: ABBOTT | L389: DODDS | N389: THOMPSON | Q389: ATKINSON
A390: WERRIBEE | C390: MANOLAKAKIS | F390: COMBEN | I390: ARRIGO | L390: TAYLOR | N390: LEWSZUK | W390: COBURG | X390: 8 | Y390: 1 | Z390: 0 | AA390: 1332 | AB390: 677 | AC390: =(AA390*100)/AB390 -> 196.75036927621861 | AD390: =(X390*4)+(Z390*2) -> 32
A391: GOALKICKERS | W391: SUNSHINE | X391: 8 | Y391: 1 | Z391: 0 | AA391: 1147 | AB391: 758 | AC391: =(AA391*100)/AB391 -> 151.31926121372032 | AD391: =(X391*4)+(Z391*2) -> 32
A392: BOX HILL | C392: IRELAND 5 | F392: ABBOTT 3 | I392: COLE 2 | K392: FARNSWORTH 2 | N392: McKAY 2 | P392: ATKINSON | R392: WISEMAN | W392: BRUNSWICK | X392: 7 | Y392: 2 | Z392: 0 | AA392: 967 | AB392: 936 | AC392: =(AA392*100)/AB392 -> 103.31196581196581 | AD392: =(X392*4)+(Z392*2) -> 28
A393: WERRIBEE | C393: TAYLOR 3 | F393: MANOLAKAKIS 2 | J393: HEATHERINGTON | N393: COMBEN | Q393: LYONS | S393: ARRIGO | W393: BOX HILL | X393: 6 | Y393: 3 | Z393: 0 | AA393: 1049 | AB393: 860 | AC393: =(AA393*100)/AB393 -> 121.97674418604652 | AD393: =(X393*4)+(Z393*2) -> 24
A395: SUNSHINE | C395: 6 | D395: 4 | E395: =C395*6+D395 -> 40 | G395: 12 | H395: 6 | I395: =G395*6+H395 -> 78 | K395: 16 | L395: 10 | M395: =K395*6+L395 -> 106 | O395: 22 | P395: 17 | Q395: =O395*6+P395 -> 149 | S395: SUNSHINE | W395: FRANKSTON | X395: 5 | Y395: 4 | Z395: 0 | AA395: 986 | AB395: 843 | AC395: =(AA395*100)/AB395 -> 116.96322657176749 | AD395: =(X395*4)+(Z395*2) -> 20
A396: MORDIALLOC | C396: 4 | D396: 5 | E396: =C396*6+D396 -> 29 | G396: 5 | H396: 8 | I396: =G396*6+H396 -> 38 | K396: 5 | L396: 8 | M396: =K396*6+L396 -> 38 | O396: 9 | P396: 10 | Q396: =O396*6+P396 -> 64 | S396: ANDERSON | W396: CAULFIELD | X396: 3 | Y396: 6 | Z396: 0 | AA396: 968 | AB396: 1053 | AC396: =(AA396*100)/AB396 -> 91.927825261158588 | AD396: =(X396*4)+(Z396*2) -> 12
A397: BEST PLAYERS | W397: NORTHCOTE | X397: 3 | Y397: 6 | Z397: 0 | AA397: 818 | AB397: 1035 | AC397: =(AA397*100)/AB397 -> 79.033816425120776 | AD397: =(X397*4)+(Z397*2) -> 12
A398: SUNSHINE | C398: RUSSELL | F398: IBRAHIM | I398: CRAWFORD | L398: CLARKE | N398: DARUL | Q398: OVERS | W398: WERRIBEE | X398: 2 | Y398: 7 | Z398: 0 | AA398: 738 | AB398: 986 | AC398: =(AA398*100)/AB398 -> 74.847870182555781 | AD398: =(X398*4)+(Z398*2) -> 8
A399: MORDIALLOC | C399: GARDINER | F399: DANCKERT | I399: LESLIE | L399: LITTLE | N399: LAIRD | Q399: HUTTON | W399: MORDIALLOC | X399: 2 | Y399: 7 | Z399: 0 | AA399: 644 | AB399: 967 | AC399: =(AA399*100)/AB399 -> 66.597724922440534 | AD399: =(X399*4)+(Z399*2) -> 8
A400: GOALKICKERS | W400: CAMBERWELL | X400: 1 | Y400: 8 | Z400: 0 | AA400: 667 | AB400: 1091 | AC400: =(AA400*100)/AB400 -> 61.136571952337306 | AD400: =(X400*4)+(Z400*2) -> 4
A401: SUNSHINE | C401: RUSSELL 7 | F401: ALLEN 6 | I401: CLARKE 3 | L401: FERGUSON 2 | O401: WAGLAND 2 | R401: CRAWFORD 2
A402: MORDIALLOC | C402: LESLIE 6 | F402: GIBBON | I402: HOCKING | L402: HARRY
A404: BRUNSWICK | C404: 7 | D404: 5 | E404: =C404*6+D404 -> 47 | G404: 13 | H404: 6 | I404: =G404*6+H404 -> 84 | K404: 16 | L404: 7 | M404: =K404*6+L404 -> 103 | O404: 20 | P404: 11 | Q404: =O404*6+P404 -> 131 | S404: FRANKSTON
A405: FRANKSTON | C405: 3 | D405: 5 | E405: =C405*6+D405 -> 23 | G405: 7 | H405: 8 | I405: =G405*6+H405 -> 50 | K405: 15 | L405: 11 | M405: =K405*6+L405 -> 101 | O405: 17 | P405: 12 | Q405: =O405*6+P405 -> 114 | S405: TURNER
A406: BEST PLAYERS
A407: BRUNSWICK | C407: K GREIG | F407: COOK | I407: LEYDIN | L407: HORSINGTON | O407: O'BRIEN
A408: FRANKSTON | C408: WESTON | F408: McNAB | I408: HINES | L408: KEECH | O408: RENOUF
A409: GOALKICKERS
A410: BRUNSWICK | C410: COOK 5 | E410: K GREIG 5 | H410: WHELAN 2 | J410: LEYDIN 2 | M410: DALTON 2 | O410: HORSINGTON 2 | R410: OGSTON | U410: HOWARD
A411: FRANKSTON | C411: AUSTIN 5 | F411: WESTON 4 | I411: HINES 3 | K411: KEECH 2 | M411: KERR 2 | O411: CLARK
E412: 7TH JUNE | J412: WEATHER
A413: COBURG | C413: 13 | D413: 5 | E413: =C413*6+D413 -> 83 | G413: 17 | H413: 6 | I413: =G413*6+H413 -> 108 | K413: 27 | L413: 14 | M413: =K413*6+L413 -> 176 | O413: 30 | P413: 19 | Q413: =O413*6+P413 -> 199 | S413: COBURG
A414: CAULFIELD | C414: 1 | D414: 1 | E414: =C414*6+D414 -> 7 | G414: 8 | H414: 7 | I414: =G414*6+H414 -> 55 | K414: 9 | L414: 9 | M414: =K414*6+L414 -> 63 | O414: 13 | P414: 14 | Q414: =O414*6+P414 -> 92 | S414: O'NEILL
A415: BEST PLAYERS
A416: COBURG | C416: HEPPER | F416: SHALLARD | I416: SPORTON | L416: SULLIVAN | O416: ELVERY | Q416: GALE
A417: CAULFIELD | C417: GOWANS | F417: WILLIAMS | I417: CLARK | L417: HOCKING | O417: ARRELL | Q417: FARRELLY
A418: GOALKICKERS
A419: COBURG | C419: SPORTON 9 | F419: HEPPER 8 | I419: MORRISON 5 | L419: GALE 4 | N419: McCARTHY 2 | Q419: LAWSON | T419: KIRKMAN
A420: CAULFIELD | C420: GOWANS 2 | F420: CURTAIN 2 | I420: LOGAN 2 | K420: WILLIAMS 2 | N420: BROWN | P420: BAKER | R420: WHITE | T420: RENOWDEN | W420: O'DONNELL
A422: NORTHCOTE | C422: 4 | D422: 3 | E422: =C422*6+D422 -> 27 | G422: 7 | H422: 8 | I422: =G422*6+H422 -> 50 | K422: 10 | L422: 18 | M422: =K422*6+L422 -> 78 | O422: 14 | P422: 25 | Q422: =O422*6+P422 -> 109 | S422: NORTHCOTE
A423: CAMBERWELL | C423: 2 | D423: 3 | E423: =C423*6+D423 -> 15 | G423: 6 | H423: 6 | I423: =G423*6+H423 -> 42 | K423: 10 | L423: 8 | M423: =K423*6+L423 -> 68 | O423: 15 | P423: 11 | Q423: =O423*6+P423 -> 101 | S423: GAMBETTA
A424: BEST PLAYERS
A425: NORTHCOTE | C425: MAYNE | F425: STAFFORD | I425: SMITH | L425: LESTER | O425: VINEY
A426: CAMBERWELL | C426: STEWART | F426: D BOYD | I426: SMITH | L426: L BOYD | O426: TAYLOR
A427: GOALKICKERS
A428: NORTHCOTE | C428: COHEN 4 | E428: MAYNE 3 | G428: MARTIN 2 | I428: KEANE 2 | K428: VINEY | M428: WESTON | P428: KOZARIS
A429: CAMBERWELL | C429: L BOYD 3 | F429: TAYLOR 3 | I429: BRAYNE 2 | K429: WESTACOTT 2 | N429: BRUCE SMITH | Q429: D BOYD | S429: CONYERS | V429: RICHMOND
A431: ROUND 10 | E431: 13TH JUNE | J431: WEATHER | S431: PLAYED AT
D432: 1ST QTR | H432: 2ND QTR | L432: 3RD QTR | P432: FINAL | S432: MORDIALLOC
A433: COBURG | C433: 0 | D433: 0 | E433: =C433*6+D433 -> 0 | G433: 0 | H433: 0 | I433: =G433*6+H433 -> 0 | K433: 0 | L433: 0 | M433: =K433*6+L433 -> 0 | O433: 25 | P433: 11 | Q433: =O433*6+P433 -> 161 | S433: UMPIRE | X433: LADDER | AB433: ROUND | AD433: 10
A434: MORDIALLOC | C434: 0 | D434: 0 | E434: =C434*6+D434 -> 0 | G434: 0 | H434: 0 | I434: =G434*6+H434 -> 0 | K434: 0 | L434: 0 | M434: =K434*6+L434 -> 0 | O434: 13 | P434: 5 | Q434: =O434*6+P434 -> 83
A435: BEST PLAYERS | W435: TEAM | X435: W | Y435: L | Z435: D | AA435: FOR | AB435: AGST | AC435: % | AD435: PTS
A436: COBURG
A437: MORDIALLOC | W437: COBURG | X437: 9 | Y437: 1 | Z437: 0 | AA437: 1493 | AB437: 760 | AC437: =(AA437*100)/AB437 -> 196.44736842105263 | AD437: =(X437*4)+(Z437*2) -> 36
A438: GOALKICKERS | W438: SUNSHINE | X438: 9 | Y438: 1 | Z438: 0 | AA438: 1292 | AB438: 894 | AC438: =(AA438*100)/AB438 -> 144.51901565995524 | AD438: =(X438*4)+(Z438*2) -> 36
A439: COBURG | W439: BOX HILL | X439: 7 | Y439: 3 | Z439: 0 | AA439: 1146 | AB439: 941 | AC439: =(AA439*100)/AB439 -> 121.78533475026568 | AD439: =(X439*4)+(Z439*2) -> 28
A440: MORDIALLOC | W440: BRUNSWICK | X440: 7 | Y440: 3 | Z440: 0 | AA440: 1033 | AB440: 1003 | AC440: =(AA440*100)/AB440 -> 102.99102691924227 | AD440: =(X440*4)+(Z440*2) -> 28
A442: FRANKSTON | C442: 0 | D442: 0 | E442: =C442*6+D442 -> 0 | G442: 0 | H442: 0 | I442: =G442*6+H442 -> 0 | K442: 0 | L442: 0 | M442: =K442*6+L442 -> 0 | O442: 16 | P442: 14 | Q442: =O442*6+P442 -> 110 | S442: WERRIBEE | W442: FRANKSTON | X442: 6 | Y442: 4 | Z442: 0 | AA442: 1096 | AB442: 947 | AC442: =(AA442*100)/AB442 -> 115.73389651531151 | AD442: =(X442*4)+(Z442*2) -> 24
A443: WERRIBEE | C443: 0 | D443: 0 | E443: =C443*6+D443 -> 0 | G443: 0 | H443: 0 | I443: =G443*6+H443 -> 0 | K443: 0 | L443: 0 | M443: =K443*6+L443 -> 0 | O443: 15 | P443: 14 | Q443: =O443*6+P443 -> 104 | W443: NORTHCOTE | X443: 4 | Y443: 6 | Z443: 0 | AA443: 885 | AB443: 1101 | AC443: =(AA443*100)/AB443 -> 80.381471389645782 | AD443: =(X443*4)+(Z443*2) -> 16
A444: BEST PLAYERS | W444: CAULFIELD | X444: 3 | Y444: 7 | Z444: 0 | AA444: 1104 | AB444: 1197 | AC444: =(AA444*100)/AB444 -> 92.230576441102755 | AD444: =(X444*4)+(Z444*2) -> 12
A445: FRANKSTON | W445: WERRIBEE | X445: 2 | Y445: 8 | Z445: 0 | AA445: 842 | AB445: 1096 | AC445: =(AA445*100)/AB445 -> 76.824817518248182 | AD445: =(X445*4)+(Z445*2) -> 8
A446: WERRIBEE | W446: MORDIALLOC | X446: 2 | Y446: 8 | Z446: 0 | AA446: 727 | AB446: 1128 | AC446: =(AA446*100)/AB446 -> 64.450354609929079 | AD446: =(X446*4)+(Z446*2) -> 8
A447: GOALKICKERS | W447: CAMBERWELL | X447: 1 | Y447: 9 | Z447: 0 | AA447: 748 | AB447: 1188 | AC447: =(AA447*100)/AB447 -> 62.962962962962962 | AD447: =(X447*4)+(Z447*2) -> 4
A448: FRANKSTON
A449: WERRIBEE
E450: 14TH JUNE | J450: WEATHER
A451: SUNSHINE | C451: 0 | D451: 0 | E451: =C451*6+D451 -> 0 | G451: 0 | H451: 0 | I451: =G451*6+H451 -> 0 | K451: 0 | L451: 0 | M451: =K451*6+L451 -> 0 | O451: 22 | P451: 13 | Q451: =O451*6+P451 -> 145 | S451: PRINCES PARK, CAULFIELD
A452: CAULFIELD | C452: 0 | D452: 0 | E452: =C452*6+D452 -> 0 | G452: 0 | H452: 0 | I452: =G452*6+H452 -> 0 | K452: 0 | L452: 0 | M452: =K452*6+L452 -> 0 | O452: 21 | P452: 10 | Q452: =O452*6+P452 -> 136
A453: BEST PLAYERS
A454: SUNSHINE
A455: CAULFIELD
A456: GOALKICKERS
A457: SUNSHINE
A458: CAULFIELD
A460: NORTHCOTE | C460: 0 | D460: 0 | E460: =C460*6+D460 -> 0 | G460: 0 | H460: 0 | I460: =G460*6+H460 -> 0 | K460: 0 | L460: 0 | M460: =K460*6+L460 -> 0 | O460: 10 | P460: 7 | Q460: =O460*6+P460 -> 67 | S460: BRUNSWICK
A461: BRUNSWICK | C461: 0 | D461: 0 | E461: =C461*6+D461 -> 0 | G461: 0 | H461: 0 | I461: =G461*6+H461 -> 0 | K461: 0 | L461: 0 | M461: =K461*6+L461 -> 0 | O461: 9 | P461: 12 | Q461: =O461*6+P461 -> 66
A462: BEST PLAYERS
A463: NORTHCOTE
A464: BRUNSWICK
A465: GOALKICKERS
A466: NORTHCOTE
A467: BRUNSWICK
A469: BOX HILL | C469: 0 | D469: 0 | E469: =C469*6+D469 -> 0 | G469: 0 | H469: 0 | I469: =G469*6+H469 -> 0 | K469: 0 | L469: 0 | M469: =K469*6+L469 -> 0 | O469: 14 | P469: 13 | Q469: =O469*6+P469 -> 97 | S469: CAMBERWELL
A470: CAMBERWELL | C470: 0 | D470: 0 | E470: =C470*6+D470 -> 0 | G470: 0 | H470: 0 | I470: =G470*6+H470 -> 0 | K470: 0 | L470: 0 | M470: =K470*6+L470 -> 0 | O470: 12 | P470: 9 | Q470: =O470*6+P470 -> 81
A471: BEST PLAYERS
A472: BOX HILL
A473: CAMBERWELL
A474: GOALKICKERS
A475: BOX HILL
A476: CAMBERWELL
A478: ROUND 11 | E478: 20TH JUNE | J478: WEATHER | S478: PLAYED AT
D479: 1ST QTR | H479: 2ND QTR | L479: 3RD QTR | P479: FINAL | S479: FRANKSTON
A480: MORDIALLOC | C480: 5 | D480: 5 | E480: =C480*6+D480 -> 35 | G480: 11 | H480: 8 | I480: =G480*6+H480 -> 74 | K480: 15 | L480: 10 | M480: =K480*6+L480 -> 100 | O480: 19 | P480: 13 | Q480: =O480*6+P480 -> 127 | S480: UMPIRE | X480: LADDER | AB480: ROUND | AD480: 11
A481: FRANKSTON | C481: 3 | D481: 2 | E481: =C481*6+D481 -> 20 | G481: 6 | H481: 4 | I481: =G481*6+H481 -> 40 | K481: 10 | L481: 7 | M481: =K481*6+L481 -> 67 | O481: 16 | P481: 10 | Q481: =O481*6+P481 -> 106
A482: BEST PLAYERS | W482: TEAM | X482: W | Y482: L | Z482: D | AA482: FOR | AB482: AGST | AC482: % | AD482: PTS
A483: MORDIALLOC | C483: PIERCE | F483: SMITH | I483: BENTLEY | L483: MARTELLO | O483: McGUINNESS | R483: HARRY
A484: FRANKSTON | C484: CLARK | F484: LOVELOCK | I484: RENOUF | L484: HINES | O484: CROUGHAN | R484: VAUGHAN | W484: COBURG | X484: 10 | Y484: 1 | Z484: 0 | AA484: 1631 | AB484: 794 | AC484: =(AA484*100)/AB484 -> 205.41561712846348 | AD484: =(X484*4)+(Z484*2) -> 40
A485: GOALKICKERS | W485: SUNSHINE | X485: 10 | Y485: 1 | Z485: 0 | AA485: 1388 | AB485: 945 | AC485: =(AA485*100)/AB485 -> 146.87830687830689 | AD485: =(X485*4)+(Z485*2) -> 40
A486: MORDIALLOC | C486: McGUINNESS 5 | F486: LESLIE 4 | H486: HARRY 3 | J486: GIBBON 2 | L486: PIERCE 2 | N486: MARTELLO | P486: NERI | R486: SMITH | W486: BOX HILL | X486: 8 | Y486: 3 | Z486: 0 | AA486: 1272 | AB486: 1019 | AC486: =(AA486*100)/AB486 -> 124.82826300294407 | AD486: =(X486*4)+(Z486*2) -> 32
A487: FRANKSTON | C487: HINES 5 | F487: CROUGHAN 4 | I487: CLARK 2 | K487: AUSTIN 2 | N487: LOVELOCK | P487: STAPLETON | S487: KERR | W487: BRUNSWICK | X487: 7 | Y487: 4 | Z487: 0 | AA487: 1111 | AB487: 1129 | AC487: =(AA487*100)/AB487 -> 98.405668733392389 | AD487: =(X487*4)+(Z487*2) -> 28
A489: COBURG | C489: 5 | D489: 3 | E489: =C489*6+D489 -> 33 | G489: 8 | H489: 7 | I489: =G489*6+H489 -> 55 | K489: 13 | L489: 16 | M489: =K489*6+L489 -> 94 | O489: 20 | P489: 18 | Q489: =O489*6+P489 -> 138 | S489: COBURG | W489: FRANKSTON | X489: 6 | Y489: 5 | Z489: 0 | AA489: 1202 | AB489: 1074 | AC489: =(AA489*100)/AB489 -> 111.91806331471136 | AD489: =(X489*4)+(Z489*2) -> 24
A490: CAMBERWELL | C490: 1 | D490: 0 | E490: =C490*6+D490 -> 6 | G490: 4 | H490: 1 | I490: =G490*6+H490 -> 25 | K490: 4 | L490: 2 | M490: =K490*6+L490 -> 26 | O490: 5 | P490: 4 | Q490: =O490*6+P490 -> 34 | W490: CAULFIELD | X490: 4 | Y490: 7 | Z490: 0 | AA490: 1199 | AB490: 1273 | AC490: =(AA490*100)/AB490 -> 94.186959937156317 | AD490: =(X490*4)+(Z490*2) -> 16
A491: BEST PLAYERS | W491: NORTHCOTE | X491: 4 | Y491: 7 | Z491: 0 | AA491: 961 | AB491: 1196 | AC491: =(AA491*100)/AB491 -> 80.351170568561869 | AD491: =(X491*4)+(Z491*2) -> 16
A492: COBURG | C492: KIRKMAN | F492: MARSH | I492: LAWSON | L492: HARRISON | O492: BRENNAN | R492: ELVERY | W492: MORDIALLOC | X492: 3 | Y492: 8 | Z492: 0 | AA492: 854 | AB492: 1234 | AC492: =(AA492*100)/AB492 -> 69.20583468395462 | AD492: =(X492*4)+(Z492*2) -> 12
A493: CAMBERWELL | C493: STEWART | F493: MACKINLAY | I493: BUTLER | L493: WESTACOTT | O493: L BOYD | W493: WERRIBEE | X493: 2 | Y493: 9 | Z493: 0 | AA493: 893 | AB493: 1192 | AC493: =(AA493*100)/AB493 -> 74.916107382550337 | AD493: =(X493*4)+(Z493*2) -> 8
A494: GOALKICKERS | W494: CAMBERWELL | X494: 1 | Y494: 10 | Z494: 0 | AA494: 782 | AB494: 1326 | AC494: =(AA494*100)/AB494 -> 58.974358974358971 | AD494: =(X494*4)+(Z494*2) -> 4
A495: COBURG | C495: BRENNAN 5 | F495: LAWSON 4 | H495: SULLIVAN 2 | K495: KIRKMAN 2 | N495: MORRISON 2 | Q495: SPORTON 2 | S495: ROBINSON
A496: CAMBERWELL | C496: SMITH 2 | F496: BRUCE | H496: RICHMOND | K496: FRASER
A498: BOX HILL | C498: 5 | D498: 4 | E498: =C498*6+D498 -> 34 | G498: 11 | H498: 8 | I498: =G498*6+H498 -> 74 | K498: 15 | L498: 13 | M498: =K498*6+L498 -> 103 | O498: 18 | P498: 18 | Q498: =O498*6+P498 -> 126 | S498: BOX HILL
A499: BRUNSWICK | C499: 2 | D499: 4 | E499: =C499*6+D499 -> 16 | G499: 4 | H499: 10 | I499: =G499*6+H499 -> 34 | K499: 8 | L499: 11 | M499: =K499*6+L499 -> 59 | O499: 11 | P499: 12 | Q499: =O499*6+P499 -> 78
A500: BEST PLAYERS
A501: BOX HILL | C501: SMITH | F501: COBAIN | I501: DAWSON | L501: COLE | O501: THOMPSON | R501: BARNETT
A502: BRUNSWICK | C502: LEYDON | F502: WROUT | I502: WHELAN | L502: HORSINGTON
A503: GOALKICKERS
A504: BOX HILL | C504: BARNETT 5 | F504: THOMPSON 3 | I504: ABBOTT 3 | K504: COBAIN 2 | N504: DAWSON 2 | Q504: COLE 2 | S504: SMITH
A505: BRUNSWICK | C505: WHELAN 3 | F505: LEYDON 3 | H505: COOK 2 | J505: K GREIG 2 | L505: WROUT
A507: CAULFIELD | C507: 2 | D507: 3 | E507: =C507*6+D507 -> 15 | G507: 5 | H507: 8 | I507: =G507*6+H507 -> 38 | K507: 10 | L507: 10 | M507: =K507*6+L507 -> 70 | O507: 14 | P507: 11 | Q507: =O507*6+P507 -> 95 | S507: NORTHCOTE
A508: NORTHCOTE | C508: 6 | D508: 11 | E508: =C508*6+D508 -> 47 | G508: 8 | H508: 17 | I508: =G508*6+H508 -> 65 | K508: 9 | L508: 21 | M508: =K508*6+L508 -> 75 | O508: 9 | P508: 22 | Q508: =O508*6+P508 -> 76
A509: BEST PLAYERS
A510: CAULFIELD | C510: CLARK | F510: ROBINSON | I510: LOGAN | L510: BAKER | O510: McGINTY | R510: HOCKING
A511: NORTHCOTE | C511: STAFFORD | F511: SMITH | I511: WESTON | L511: KOZARIS | O511: MAYNE | R511: McGORLICK
A512: GOALKICKERS
A513: CAULFIELD | C513: McGINTY 5 | F513: WILLIAMS 3 | I513: LOGAN 2 | K513: ROBINSON 2 | N513: CURTAIN | P513: GOWANS
A514: NORTHCOTE | C514: WESTON 3 | F514: MAYNE 2 | H514: UNDERWOOD | K514: McGORLICK | N514: VINEY | P514: COHEN
A516: SUNSHINE | C516: 2 | D516: 3 | E516: =C516*6+D516 -> 15 | G516: 8 | H516: 7 | I516: =G516*6+H516 -> 55 | K516: 10 | L516: 9 | M516: =K516*6+L516 -> 69 | O516: 14 | P516: 12 | Q516: =O516*6+P516 -> 96 | S516: SUNSHINE
A517: WERRIBEE | C517: 3 | D517: 4 | E517: =C517*6+D517 -> 22 | G517: 3 | H517: 4 | I517: =G517*6+H517 -> 22 | K517: 5 | L517: 8 | M517: =K517*6+L517 -> 38 | O517: 7 | P517: 9 | Q517: =O517*6+P517 -> 51
A518: BEST PLAYERS
A519: SUNSHINE | C519: HIPWORTH | F519: OVERS | I519: RUSSELL | L519: CRAWFORD | O519: IBRAHIM | R519: GOOLD
A520: WERRIBEE | C520: SERTORI | F520: HINKLEY | I520: ROBINSON | L520: LYON | O520: HETHERINGTON
A521: GOALKICKERS
A522: SUNSHINE | C522: ALLEN 5 | F522: FERGUSON 3 | I522: OVERS 2 | K522: RUSSELL 2 | N522: CLARK | P522: IBRAHIM
A523: WERRIBEE | C523: TAYLOR 2 | F523: LYON 2 | H523: PARK 2 | J523: YOUNG
A525: ROUND 12 | E525: 27TH JUNE | J525: WEATHER | S525: PLAYED AT
D526: 1ST QTR | H526: 2ND QTR | L526: 3RD QTR | P526: FINAL | S526: CAMBERWELL
A527: CAMBERWELL | C527: 2 | D527: 0 | E527: =C527*6+D527 -> 12 | G527: 5 | H527: 4 | I527: =G527*6+H527 -> 34 | K527: 10 | L527: 5 | M527: =K527*6+L527 -> 65 | O527: 11 | P527: 9 | Q527: =O527*6+P527 -> 75 | S527: UMPIRE | X527: LADDER | AB527: ROUND | AD527: 12
A528: WERRIBEE | C528: 4 | D528: 6 | E528: =C528*6+D528 -> 30 | G528: 6 | H528: 6 | I528: =G528*6+H528 -> 42 | K528: 9 | L528: 11 | M528: =K528*6+L528 -> 65 | O528: 9 | P528: 16 | Q528: =O528*6+P528 -> 70
A529: BEST PLAYERS | W529: TEAM | X529: W | Y529: L | Z529: D | AA529: FOR | AB529: AGST | AC529: % | AD529: PTS
A530: CAMBERWELL | C530: BRAYNE | F530: STEWART | I530: L BOYD | L530: FOX | O530: MACKINLAY | R530: D BOYD
A531: WERRIBEE | C531: MONTGOMERY | F531: TAYLOR | I531: MASON | L531: RYAN | O531: YOUNG | R531: THOMPSON | W531: COBURG | X531: 11 | Y531: 1 | Z531: 0 | AA531: 1738 | AB531: 886 | AC531: =(AA531*100)/AB531 -> 196.16252821670429 | AD531: =(X531*4)+(Z531*2) -> 44
A532: GOALKICKERS | W532: SUNSHINE | X532: 10 | Y532: 2 | Z532: 0 | AA532: 1480 | AB532: 1052 | AC532: =(AA532*100)/AB532 -> 140.68441064638785 | AD532: =(X532*4)+(Z532*2) -> 40
A533: CAMBERWELL | C533: BRAYNE 2 | F533: TAYLOR 2 | I533: FOX 2 | K533: L BOYD 2 | N533: WESTACOTT | Q533: SMITH | S533: WARD | W533: BOX HILL | X533: 9 | Y533: 3 | Z533: 0 | AA533: 1373 | AB533: 1111 | AC533: =(AA533*100)/AB533 -> 123.58235823582358 | AD533: =(X533*4)+(Z533*2) -> 36
A534: WERRIBEE | C534: TAYLOR 2 | F534: LYONS 2 | I534: MASON 2 | K534: YOUNG | M534: ARRIGO | O534: COMBEN | W534: FRANKSTON | X534: 7 | Y534: 5 | Z534: 0 | AA534: 1300 | AB534: 1148 | AC534: =(AA534*100)/AB534 -> 113.24041811846691 | AD534: =(X534*4)+(Z534*2) -> 28
A536: MORDIALLOC | C536: 1 | D536: 3 | E536: =C536*6+D536 -> 9 | G536: 3 | H536: 5 | I536: =G536*6+H536 -> 23 | K536: 5 | L536: 9 | M536: =K536*6+L536 -> 39 | O536: 8 | P536: 14 | Q536: =O536*6+P536 -> 62 | S536: MORDIALLOC | W536: BRUNSWICK | X536: 7 | Y536: 5 | Z536: 0 | AA536: 1172 | AB536: 1191 | AC536: =(AA536*100)/AB536 -> 98.404701931150299 | AD536: =(X536*4)+(Z536*2) -> 28
A537: BRUNSWICK | C537: 1 | D537: 6 | E537: =C537*6+D537 -> 12 | G537: 3 | H537: 10 | I537: =G537*6+H537 -> 28 | K537: 7 | L537: 10 | M537: =K537*6+L537 -> 52 | O537: 8 | P537: 13 | Q537: =O537*6+P537 -> 61 | W537: CAULFIELD | X537: 4 | Y537: 8 | Z537: 0 | AA537: 1273 | AB537: 1371 | AC537: =(AA537*100)/AB537 -> 92.851932895696578 | AD537: =(X537*4)+(Z537*2) -> 16
A538: BEST PLAYERS | W538: NORTHCOTE | X538: 4 | Y538: 8 | Z538: 0 | AA538: 1053 | AB538: 1297 | AC538: =(AA538*100)/AB538 -> 81.18735543562066 | AD538: =(X538*4)+(Z538*2) -> 16
A539: MORDIALLOC | C539: MARTELLO | F539: SMITH | I539: HOCKING | L539: BENTLEY | O539: LESLIE | R539: PIERCE | W539: MORDIALLOC | X539: 4 | Y539: 8 | Z539: 0 | AA539: 916 | AB539: 1295 | AC539: =(AA539*100)/AB539 -> 70.733590733590731 | AD539: =(X539*4)+(Z539*2) -> 16
A540: BRUNSWICK | C540: K GREIG | F540: ANDERSON | I540: OGSTON | L540: HOWARD | O540: NOONAN | W540: WERRIBEE | X540: 2 | Y540: 10 | Z540: 0 | AA540: 963 | AB540: 1267 | AC540: =(AA540*100)/AB540 -> 76.006314127861089 | AD540: =(X540*4)+(Z540*2) -> 8
A541: GOALKICKERS | W541: CAMBERWELL | X541: 2 | Y541: 10 | Z541: 0 | AA541: 857 | AB541: 1396 | AC541: =(AA541*100)/AB541 -> 61.389684813753583 | AD541: =(X541*4)+(Z541*2) -> 8
A542: MORDIALLOC | C542: HOCKING 3 | F542: PIERCE 2 | H542: BENTLEY | K542: MARTELLO | N542: GIBBON
A543: BRUNSWICK | C543: OGSTON 2 | F543: K GREIG 2 | I543: ANDERSON 2 | L543: WHELAN | O543: CROWLEY
A545: FRANKSTON | C545: 2 | D545: 7 | E545: =C545*6+D545 -> 19 | G545: 5 | H545: 12 | I545: =G545*6+H545 -> 42 | K545: 9 | L545: 15 | M545: =K545*6+L545 -> 69 | O545: 13 | P545: 20 | Q545: =O545*6+P545 -> 98 | S545: PRINCES PARK, CAULFIELD
A546: CAULFIELD | C546: 3 | D546: 3 | E546: =C546*6+D546 -> 21 | G546: 5 | H546: 7 | I546: =G546*6+H546 -> 37 | K546: 7 | L546: 9 | M546: =K546*6+L546 -> 51 | O546: 10 | P546: 14 | Q546: =O546*6+P546 -> 74
A547: BEST PLAYERS
A548: FRANKSTON | C548: LEWIS | F548: RENOUF | I548: ROSENBROCK | L548: KERR | O548: WINSTANLEY | R548: LOVELL
A549: CAULFIELD | C549: CLARK | F549: FARRELLY | I549: ROBINSON | L549: HOCKING | O549: CURTAIN | R549: ARRELL
A550: GOALKICKERS
A551: FRANKSTON | C551: WESTON 4 | F551: LOVELOCK 3 | I551: STAPLETON 2 | L551: V GOODINGS | O551: CLARKE | Q551: AUSTIN | S551: LOVELL
A552: CAULFIELD | C552: WILLIAMS 3 | F552: McGINTY 2 | I552: ROBINSON | L552: CURTAIN | O552: BAKER | Q552: HUBBARD | S552: HOCKING
A554: COBURG | C554: 4 | D554: 2 | E554: =C554*6+D554 -> 26 | G554: 7 | H554: 4 | I554: =G554*6+H554 -> 46 | K554: 13 | L554: 7 | M554: =K554*6+L554 -> 85 | O554: 16 | P554: 11 | Q554: =O554*6+P554 -> 107 | S554: SUNSHINE
A555: SUNSHINE | C555: 4 | D555: 3 | E555: =C555*6+D555 -> 27 | G555: 9 | H555: 8 | I555: =G555*6+H555 -> 62 | K555: 11 | L555: 12 | M555: =K555*6+L555 -> 78 | O555: 13 | P555: 14 | Q555: =O555*6+P555 -> 92
A556: BEST PLAYERS
A557: COBURG | C557: ERWIN | F557: MARSH | I557: KIRKMAN | L557: McCARTHY | O557: GALE | R557: ELVERY
A558: SUNSHINE | C558: OVERS | F558: CRAWFORD | I558: GOOLD | L558: IBRAHIM | O558: RUSSELL | R558: FERGUSON
A559: GOALKICKERS
A560: COBURG | C560: GALE 3 | F560: McCARTHY 3 | I560: LAWSON 2 | K560: MORRISON 2 | N560: ROBERTSON 2 | Q560: SULLIVAN 2 | S560: HEPPER | U560: ERWIN
A561: SUNSHINE | C561: ALLEN 3 | F561: OVERS 3 | I561: BENSON 3 | K561: RUSSELL | N561: FERGUSON | Q561: CLARKE | S561: GOOLD
A563: BOX HILL | C563: 2 | D563: 2 | E563: =C563*6+D563 -> 14 | G563: 6 | H563: 9 | I563: =G563*6+H563 -> 45 | K563: 10 | L563: 11 | M563: =K563*6+L563 -> 71 | O563: 14 | P563: 17 | Q563: =O563*6+P563 -> 101 | S563: NORTHCOTE
A564: NORTHCOTE | C564: 5 | D564: 5 | E564: =C564*6+D564 -> 35 | G564: 7 | H564: 9 | I564: =G564*6+H564 -> 51 | K564: 12 | L564: 12 | M564: =K564*6+L564 -> 84 | O564: 13 | P564: 14 | Q564: =O564*6+P564 -> 92
A565: BEST PLAYERS
A566: BOX HILL | C566: DEED | F566: BARNETT | I566: SMITH | L566: BIERL | O566: COBAIN | R566: THOMPSON
A567: NORTHCOTE | C567: KEENE | F567: VINEY | I567: STAFFORD | L567: COHEN | O567: WESTON | R567: McGORLICK
A568: GOALKICKERS
A569: BOX HILL | C569: BARNETT 7 | F569: SMITH 2 | H569: THOMPSON | K569: DAWSON | N569: ABBOTT | P569: COLE
A570: NORTHCOTE | C570: COHEN 3 | F570: WESTON 3 | I570: MAYNE 3 | K570: QUAIFE 2 | N570: McGORLICK 2
A572: ROUND 13 | E572: 4TH JULY | J572: WEATHER | S572: PLAYED AT
D573: 1ST QTR | H573: 2ND QTR | L573: 3RD QTR | P573: FINAL | S573: FRANKSTON
A574: SUNSHINE | C574: 6 | D574: 6 | E574: =C574*6+D574 -> 42 | G574: 8 | H574: 9 | I574: =G574*6+H574 -> 57 | K574: 14 | L574: 15 | M574: =K574*6+L574 -> 99 | O574: 23 | P574: 17 | Q574: =O574*6+P574 -> 155 | S574: UMPIRE | X574: LADDER | AB574: ROUND | AD574: 13
A575: FRANKSTON | C575: 0 | D575: 3 | E575: =C575*6+D575 -> 3 | G575: 5 | H575: 5 | I575: =G575*6+H575 -> 35 | K575: 6 | L575: 9 | M575: =K575*6+L575 -> 45 | O575: 9 | P575: 17 | Q575: =O575*6+P575 -> 71 | S575: O'NEILL
A576: BEST PLAYERS | W576: TEAM | X576: W | Y576: L | Z576: D | AA576: FOR | AB576: AGST | AC576: % | AD576: PTS
A577: SUNSHINE | C577: CRAWFORD | F577: BEAN | I577: ALLEN | L577: IBRAHIM | O577: BROWN | R577: ROBERTS
A578: FRANKSTON | C578: VUAGHAN | F578: ROSE | I578: WATSON | L578: HINES | O578: RENOUF | R578: LEWIS | W578: COBURG | X578: 12 | Y578: 1 | Z578: 0 | AA578: 1856 | AB578: 964 | AC578: =(AA578*100)/AB578 -> 192.53112033195021 | AD578: =(X578*4)+(Z578*2) -> 48
A579: GOALKICKERS | W579: SUNSHINE | X579: 11 | Y579: 2 | Z579: 0 | AA579: 1635 | AB579: 1123 | AC579: =(AA579*100)/AB579 -> 145.59216384683882 | AD579: =(X579*4)+(Z579*2) -> 44
A580: SUNSHINE | C580: ALLEN 6 | F580: RUSSELL 4 | I580: BEAN 4 | K580: FERGUSON 3 | N580: OVERS 3 | P580: WAGLAND 2 | S580: CRAWFORD | W580: BOX HILL | X580: 9 | Y580: 3 | Z580: 1 | AA580: 1462 | AB580: 1200 | AC580: =(AA580*100)/AB580 -> 121.83333333333333 | AD580: =(X580*4)+(Z580*2) -> 38
A581: FRANKSTON | C581: McNAB 2 | F581: STAPLETON 2 | I581: KERR 2 | K581: CLARK | M581: JINES | O581: AUSTIN | W581: BRUNSWICK | X581: 8 | Y581: 5 | Z581: 0 | AA581: 1268 | AB581: 1252 | AC581: =(AA581*100)/AB581 -> 101.27795527156549 | AD581: =(X581*4)+(Z581*2) -> 32
A583: BOX HILL | C583: 3 | D583: 4 | E583: =C583*6+D583 -> 22 | G583: 8 | H583: 6 | I583: =G583*6+H583 -> 54 | K583: 11 | L583: 8 | M583: =K583*6+L583 -> 74 | O583: 13 | P583: 11 | Q583: =O583*6+P583 -> 89 | S583: BOX HILL | W583: FRANKSTON | X583: 7 | Y583: 6 | Z583: 0 | AA583: 1371 | AB583: 1303 | AC583: =(AA583*100)/AB583 -> 105.21872601688412 | AD583: =(X583*4)+(Z583*2) -> 28
A584: MORDIALLOC | C584: 6 | D584: 7 | E584: =C584*6+D584 -> 43 | G584: 10 | H584: 9 | I584: =G584*6+H584 -> 69 | K584: 13 | L584: 10 | M584: =K584*6+L584 -> 88 | O584: 13 | P584: 11 | Q584: =O584*6+P584 -> 89 | S584: DUGARD | W584: CAULFIELD | X584: 5 | Y584: 8 | Z584: 0 | AA584: 1391 | AB584: 1476 | AC584: =(AA584*100)/AB584 -> 94.241192411924118 | AD584: =(X584*4)+(Z584*2) -> 20
A585: BEST PLAYERS | W585: MORDIALLOC | X585: 4 | Y585: 8 | Z585: 1 | AA585: 1005 | AB585: 1384 | AC585: =(AA585*100)/AB585 -> 72.615606936416185 | AD585: =(X585*4)+(Z585*2) -> 18
A586: BOX HILL | C586: McQUALTER | F586: THOMPSON | I586: CRISP | L586: DAWSON | O586: DEED | Q586: ATKINSON | W586: NORTHCOTE | X586: 4 | Y586: 9 | Z586: 0 | AA586: 1131 | AB586: 1415 | AC586: =(AA586*100)/AB586 -> 79.929328621908127 | AD586: =(X586*4)+(Z586*2) -> 16
A587: MORDIALLOC | C587: SMITH | F587: McGUINNESS | I587: MARTELLO | L587: GARDINER | O587: HARRY | W587: WERRIBEE | X587: 2 | Y587: 11 | Z587: 0 | AA587: 1068 | AB587: 1385 | AC587: =(AA587*100)/AB587 -> 77.111913357400724 | AD587: =(X587*4)+(Z587*2) -> 8
A588: GOALKICKERS | W588: CAMBERWELL | X588: 2 | Y588: 11 | Z588: 0 | AA588: 918 | AB588: 1492 | AC588: =(AA588*100)/AB588 -> 61.528150134048261 | AD588: =(X588*4)+(Z588*2) -> 8
A589: BOX HILL | C589: THOMPSON 4 | F589: CRISP 3 | H589: COBAIN 3 | J589: DAWSON | M589: ATKINSON | P589: RALPH
A590: MORDIALLOC | C590: McGUINNESS 7 | F590: MARTELLO 2 | I590: STUDHAM | L590: HARRY | N590: SMITH | P590: GARDINER
A592: CAULFIELD | C592: 5 | D592: 3 | E592: =C592*6+D592 -> 33 | G592: 10 | H592: 7 | I592: =G592*6+H592 -> 67 | K592: 14 | L592: 9 | M592: =K592*6+L592 -> 93 | O592: 18 | P592: 10 | Q592: =O592*6+P592 -> 118 | S592: WERRIBEE
A593: WERRIBEE | C593: 4 | D593: 5 | E593: =C593*6+D593 -> 29 | G593: 5 | H593: 8 | I593: =G593*6+H593 -> 38 | K593: 10 | L593: 12 | M593: =K593*6+L593 -> 72 | O593: 15 | P593: 15 | Q593: =O593*6+P593 -> 105 | S593: ANDERSON
A594: BEST PLAYERS
A595: CAULFIELD | C595: WILLIAMS | F595: McGINTY | I595: BAKER | L595: CURTAIN | O595: GOWERS
A596: WERRIBEE | C596: COMBEN | F596: ARRIGO | I596: LYONS | L596: EDWARDS | O596: McNAUGHTON
A597: GOALKICKERS
A598: CAULFIELD | C598: McGINTY 6 | F598: WILLIAMS 6 | I598: BAKER 2 | K598: CURTAIN 2 | M598: SAUNDERS | P598: LOGAN
A599: WERRIBEE | C599: LYONS 4 | E599: ARRIGO 3 | G599: TAYLOR 2 | I599: YOUNG 2 | K599: COMBEN | M599: MASON | O599: McNAUGHTON | R599: ROBINSON
A601: COBURG | C601: 4 | D601: 1 | E601: =C601*6+D601 -> 25 | G601: 9 | H601: 3 | I601: =G601*6+H601 -> 57 | K601: 15 | L601: 6 | M601: =K601*6+L601 -> 96 | O601: 18 | P601: 10 | Q601: =O601*6+P601 -> 118 | S601: COBURG
A602: NORTHCOTE | C602: 2 | D602: 1 | E602: =C602*6+D602 -> 13 | G602: 8 | H602: 7 | I602: =G602*6+H602 -> 55 | K602: 10 | L602: 8 | M602: =K602*6+L602 -> 68 | O602: 11 | P602: 12 | Q602: =O602*6+P602 -> 78 | S602: PASK
A603: BEST PLAYERS
A604: COBURG | C604: ELVERY | F604: KIRKMAN | I604: GALE | L604: SULLIVAN | O604: SHALLARD | R604: MARSH
A605: NORTHCOTE | C605: McORIST | F605: STAFFORD | I605: KEANE | L605: FARRINGTON | O605: McGORLICK | R605: KOZARIS
A606: GOALKICKERS
A607: COBURG | C607: GALE 4 | E607: HEPPER 3 | G607: SPORTON 3 | J607: LAWSON 2 | M607: SULLIVAN 2 | P607: KIRKMAN 2 | S607: McCARTHY | V607: MORRISON
A608: NORTHCOTE | C608: COHEN 5 | F608: McORIST 3 | I608: YAKSENDER | L608: CLOTZ | N608: QUAIFE
A610: BRUNSWICK | C610: 6 | D610: 1 | E610: =C610*6+D610 -> 37 | G610: 7 | H610: 5 | I610: =G610*6+H610 -> 47 | K610: 11 | L610: 12 | M610: =K610*6+L610 -> 78 | O610: 14 | P610: 12 | Q610: =O610*6+P610 -> 96 | S610: BRUNSWICK
A611: CAMBERWELL | C611: 1 | D611: 2 | E611: =C611*6+D611 -> 8 | G611: 5 | H611: 6 | I611: =G611*6+H611 -> 36 | K611: 5 | L611: 6 | M611: =K611*6+L611 -> 36 | O611: 9 | P611: 7 | Q611: =O611*6+P611 -> 61 | S611: BARBER
A612: BEST PLAYERS
A613: BRUNSWICK | C613: GENT | F613: I GREIG | I613: LEYDIN | L613: OGSTON | O613: PERRY | R613: BOOTH
A614: CAMBERWELL | C614: McKINLAY | F614: D BOYD | I614: WILSON | L614: J SMITH | O614: TAYLOR | R614: L BOYD
A615: GOALKICKERS
A616: BRUNSWICK | C616: K GREIG 4 | F616: COOK 3 | H616: ALLEN 2 | J616: OGSTON | L616: ANDERSON | N616: LEYDIN | P616: PERRY | R616: BOOTH
A617: CAMBERWELL | C617: J SMITH 4 | F617: TAYLOR 2 | I617: BRAYNE | K617: McGREGOR | N617: FOX
A619: ROUND 14 | E619: 11TH JULY | J619: WEATHER | S619: PLAYED AT
D620: 1ST QTR | H620: 2ND QTR | L620: 3RD QTR | P620: FINAL | S620: PRINCES PARK, CAULFIELD
A621: CAULFIELD | C621: 3 | D621: 6 | E621: =C621*6+D621 -> 24 | G621: 7 | H621: 8 | I621: =G621*6+H621 -> 50 | K621: 10 | L621: 11 | M621: =K621*6+L621 -> 71 | O621: 13 | P621: 16 | Q621: =O621*6+P621 -> 94 | S621: UMPIRE | X621: LADDER | AB621: ROUND | AD621: 14
A622: MORDIALLOC | C622: 1 | D622: 5 | E622: =C622*6+D622 -> 11 | G622: 5 | H622: 9 | I622: =G622*6+H622 -> 39 | K622: 11 | L622: 11 | M622: =K622*6+L622 -> 77 | O622: 12 | P622: 16 | Q622: =O622*6+P622 -> 88 | S622: JACKSON
A623: BEST PLAYERS | W623: TEAM | X623: W | Y623: L | Z623: D | AA623: FOR | AB623: AGST | AC623: % | AD623: PTS
A624: CAULFIELD | C624: BAKER | F624: GOWANS | I624: WILLIAMS | L624: LOGAN | O624: TEMPEST
A625: MORDIALLOC | C625: LAIRD | F625: LESLIE | I625: DANCKERT | L625: PIERCE | O625: HARRY | W625: COBURG | X625: 12 | Y625: 2 | Z625: 0 | AA625: 1917 | AB625: 1027 | AC625: =(AA625*100)/AB625 -> 186.6601752677702 | AD625: =(X625*4)+(Z625*2) -> 48
A626: GOALKICKERS | W626: SUNSHINE | X626: 12 | Y626: 2 | Z626: 0 | AA626: 1752 | AB626: 1158 | AC626: =(AA626*100)/AB626 -> 151.29533678756476 | AD626: =(X626*4)+(Z626*2) -> 48
A627: CAULFIELD | C627: WILLIAMS 6 | F627: BAKER 2 | H627: CURTAIN | J627: TEMPEST | L627: WHITE | N627: EVERALL | P627: HOCKING | W627: BOX HILL | X627: 10 | Y627: 3 | Z627: 1 | AA627: 1525 | AB627: 1261 | AC627: =(AA627*100)/AB627 -> 120.93576526566217 | AD627: =(X627*4)+(Z627*2) -> 42
A628: MORDIALLOC | C628: McGUINNESS 5 | F628: PIERCE 2 | H628: MARTELLO 2 | K628: HOCKING | M628: BENTLEY | O628: LESLIE | W628: BRUNSWICK | X628: 9 | Y628: 5 | Z628: 0 | AA628: 1408 | AB628: 1349 | AC628: =(AA628*100)/AB628 -> 104.37361008154188 | AD628: =(X628*4)+(Z628*2) -> 36
E629: 12TH JULY | I629: WEATHER
A630: BOX HILL | C630: 3 | D630: 4 | E630: =C630*6+D630 -> 22 | G630: 5 | H630: 8 | I630: =G630*6+H630 -> 38 | K630: 7 | L630: 11 | M630: =K630*6+L630 -> 53 | O630: 8 | P630: 15 | Q630: =O630*6+P630 -> 63 | S630: BOX HILL | W630: FRANKSTON | X630: 7 | Y630: 7 | Z630: 0 | AA630: 1445 | AB630: 1392 | AC630: =(AA630*100)/AB630 -> 103.80747126436782 | AD630: =(X630*4)+(Z630*2) -> 28
A631: COBURG | C631: 3 | D631: 2 | E631: =C631*6+D631 -> 20 | G631: 6 | H631: 6 | I631: =G631*6+H631 -> 42 | K631: 7 | L631: 7 | M631: =K631*6+L631 -> 49 | O631: 8 | P631: 13 | Q631: =O631*6+P631 -> 61 | S631: TURNER | W631: CAULFIELD | X631: 6 | Y631: 8 | Z631: 0 | AA631: 1485 | AB631: 1564 | AC631: =(AA631*100)/AB631 -> 94.948849104859335 | AD631: =(X631*4)+(Z631*2) -> 24
A632: BEST PLAYERS | W632: NORTHCOTE | X632: 5 | Y632: 9 | Z632: 0 | AA632: 1220 | AB632: 1489 | AC632: =(AA632*100)/AB632 -> 81.934184016118195 | AD632: =(X632*4)+(Z632*2) -> 20
A633: BOX HILL | C633: BAKER | F633: COBAIN | I633: NEILLY | L633: BIERL | O633: DAWSON | R633: THOMPSON | W633: MORDIALLOC | X633: 4 | Y633: 9 | Z633: 1 | AA633: 1093 | AB633: 1478 | AC633: =(AA633*100)/AB633 -> 73.951285520974295 | AD633: =(X633*4)+(Z633*2) -> 18
A634: COBURG | C634: SULLIVAN | F634: LAWSON | I634: PRICE | L634: MARSH | W634: WERRIBEE | X634: 2 | Y634: 12 | Z634: 0 | AA634: 1165 | AB634: 1525 | AC634: =(AA634*100)/AB634 -> 76.393442622950815 | AD634: =(X634*4)+(Z634*2) -> 8
A635: GOALKICKERS | W635: CAMBERWELL | X635: 2 | Y635: 12 | Z635: 0 | AA635: 953 | AB635: 1609 | AC635: =(AA635*100)/AB635 -> 59.229334990677437 | AD635: =(X635*4)+(Z635*2) -> 8
A636: BOX HILL | C636: DAWSON 2 | F636: THOMPSON 2 | I636: BAKER | K636: NEILLY | M636: CRISP | O636: BARNETT
A637: COBURG | C637: SPORTON 4 | F637: MORRISON 2 | I637: McCARTHY | L637: CURWOOD
A639: NORTHCOTE | C639: 4 | D639: 2 | E639: =C639*6+D639 -> 26 | G639: 7 | H639: 3 | I639: =G639*6+H639 -> 45 | K639: 12 | L639: 7 | M639: =K639*6+L639 -> 79 | O639: 13 | P639: 11 | Q639: =O639*6+P639 -> 89 | S639: NORTHCOTE
A640: FRANKSTON | C640: 3 | D640: 3 | E640: =C640*6+D640 -> 21 | G640: 6 | H640: 7 | I640: =G640*6+H640 -> 43 | K640: 9 | L640: 9 | M640: =K640*6+L640 -> 63 | O640: 10 | P640: 14 | Q640: =O640*6+P640 -> 74 | S640: BARBER
A641: BEST PLAYERS
A642: NORTHCOTE | C642: SMITH | F642: KOZARIS | I642: McORIST | L642: COHEN | O642: CLOTZ | Q642: VINEY
A643: FRANKSTON | C643: WINSTANLEY | F643: LOVELOCK | I643: LEWIS | L643: CROUGHAN | O643: ROSENBROCK | R643: RENOUF
A644: GOALKICKERS
A645: NORTHCOTE | C645: COHEN 4 | F645: WESTON 2 | I645: MAYNE 2 | K645: VINEY 2 | M645: McGORLICK | P645: McORIST | R645: LESTER
A646: FRANKSTON | C646: STAPLETON 3 | F646: CROUGHAN 2 | I646: HINES 2 | K646: WESTON | M646: LOVELOCK | P646: McNAB
A648: SUNSHINE | C648: 3 | D648: 2 | E648: =C648*6+D648 -> 20 | G648: 8 | H648: 5 | I648: =G648*6+H648 -> 53 | K648: 12 | L648: 12 | M648: =K648*6+L648 -> 84 | O648: 17 | P648: 15 | Q648: =O648*6+P648 -> 117 | S648: SUNSHINE
A649: CAMBERWELL | C649: 0 | D649: 1 | E649: =C649*6+D649 -> 1 | G649: 1 | H649: 1 | I649: =G649*6+H649 -> 7 | K649: 2 | L649: 2 | M649: =K649*6+L649 -> 14 | O649: 5 | P649: 5 | Q649: =O649*6+P649 -> 35 | S649: TORNEY
A650: BEST PLAYERS
A651: SUNSHINE | C651: DARUL | F651: HIPWORTH | I651: BENSON | L651: BROWN | O651: CRAWFORD | R651: ALLEN
A652: CAMBERWELL | C652: D BOYD | F652: STEWART | I652: McKINLAY | L652: L BOYD | O652: MILLS | R652: FOX
A653: GOALKICKERS
A654: SUNSHINE | C654: ALLEN 6 | E654: BENSON 5 | H654: BEAN 3 | J654: FERGUSON | M654: CLARK | O654: ROBERTS
A655: CAMBERWELL | C655: WESTACOTT 2 | F655: SMITH | I655: RICHMOND | L655: L BOYD
A657: BRUNSWICK | C657: 8 | D657: 4 | E657: =C657*6+D657 -> 52 | G657: 11 | H657: 10 | I657: =G657*6+H657 -> 76 | K657: 17 | L657: 15 | M657: =K657*6+L657 -> 117 | O657: 20 | P657: 20 | Q657: =O657*6+P657 -> 140 | S657: WERRIBEE
A658: WERRIBEE | C658: 1 | D658: 0 | E658: =C658*6+D658 -> 6 | G658: 7 | H658: 4 | I658: =G658*6+H658 -> 46 | K658: 9 | L658: 6 | M658: =K658*6+L658 -> 60 | O658: 14 | P658: 13 | Q658: =O658*6+P658 -> 97 | S658: O'NEILL
A659: BEST PLAYERS
A660: BRUNSWICK | C660: I GREIG | F660: LEYDIN | I660: HOWARD | L660: McKINNON | O660: I ALLEN
A661: WERRIBEE | C661: COMBEN | F661: RICHENS | I661: LYONS | L661: ARRIGO | O661: BUTTON | R661: TAYLOR
A662: GOALKICKERS
A663: BRUNSWICK | C663: COOK 6 | E663: HOWARD 4 | G663: OGSTON 2 | J663: I ALLEN 2 | L663: PERRY 2 | N663: WROUT | P663: K GREIG | R663: BOOTH | T663: LEYDIN
A664: WERRIBEE | C664: TAYLOR 5 | F664: LYONS 3 | H664: ARRIGO 2 | J664: STOIOS | L664: YOUNG | N664: O'BRIEN | P664: BUTTON
A666: ROUND 15 | E666: 18TH JULY | J666: WEATHER | S666: PLAYED AT
D667: 1ST QTR | H667: 2ND QTR | L667: 3RD QTR | P667: FINAL | S667: FRANKSTON
A668: BOX HILL | C668: 3 | D668: 3 | E668: =C668*6+D668 -> 21 | G668: 9 | H668: 14 | I668: =G668*6+H668 -> 68 | K668: 15 | L668: 21 | M668: =K668*6+L668 -> 111 | O668: 25 | P668: 28 | Q668: =O668*6+P668 -> 178 | S668: UMPIRE | X668: LADDER | AB668: ROUND | AD668: 15
A669: FRANKSTON | C669: 4 | D669: 10 | E669: =C669*6+D669 -> 34 | G669: 8 | H669: 15 | I669: =G669*6+H669 -> 63 | K669: 10 | L669: 18 | M669: =K669*6+L669 -> 78 | O669: 13 | P669: 22 | Q669: =O669*6+P669 -> 100
A670: BEST PLAYERS | W670: TEAM | X670: W | Y670: L | Z670: D | AA670: FOR | AB670: AGST | AC670: % | AD670: PTS
A671: BOX HILL | C671: BARNETT | F671: THOMPSON | I671: COLE | L671: COBAIN | O671: McKAY | R671: CRISP
A672: FRANKSTON | C672: KERR | F672: WESTON | I672: RENOUF | L672: HINES | O672: STAPLETON | W672: COBURG | X672: 13 | Y672: 2 | Z672: 0 | AA672: 2045 | AB672: 1131 | AC672: =(AA672*100)/AB672 -> 180.81343943412909 | AD672: =(X672*4)+(Z672*2) -> 52
A673: GOALKICKERS | S673: CRISP | W673: SUNSHINE | X673: 13 | Y673: 2 | Z673: 0 | AA673: 1868 | AB673: 1251 | AC673: =(AA673*100)/AB673 -> 149.32054356514789 | AD673: =(X673*4)+(Z673*2) -> 52
A674: BOX HILL | C674: BARNETT 9 | F674: COLE 4 | H674: THOMPSON 3 | K674: NEILLY 2 | M674: BAKER 2 | O674: COBAIN 2 | R674: BIERL | T674: DAWSON | W674: BOX HILL | X674: 11 | Y674: 3 | Z674: 1 | AA674: 1703 | AB674: 1361 | AC674: =(AA674*100)/AB674 -> 125.1285819250551 | AD674: =(X674*4)+(Z674*2) -> 46
A675: FRANKSTON | C675: WESTON 2 | F675: KERR 2 | H675: BREMNER 2 | K675: CROUGHAN 2 | N675: PITT | O675: SHEPHERD | R675: STAPLETON | W675: BRUNSWICK | X675: 9 | Y675: 6 | Z675: 0 | AA675: 1512 | AB675: 1477 | AC675: =(AA675*100)/AB675 -> 102.3696682464455 | AD675: =(X675*4)+(Z675*2) -> 36
O676: LOVELOCK | R676: McNAB
A677: MORDIALLOC | C677: 5 | D677: 8 | E677: =C677*6+D677 -> 38 | G677: 7 | H677: 10 | I677: =G677*6+H677 -> 52 | K677: 15 | L677: 13 | M677: =K677*6+L677 -> 103 | O677: 21 | P677: 16 | Q677: =O677*6+P677 -> 142 | S677: MORDIALLOC | W677: FRANKSTON | X677: 7 | Y677: 8 | Z677: 0 | AA677: 1545 | AB677: 1570 | AC677: =(AA677*100)/AB677 -> 98.407643312101911 | AD677: =(X677*4)+(Z677*2) -> 28
A678: WERRIBEE | C678: 1 | D678: 5 | E678: =C678*6+D678 -> 11 | G678: 3 | H678: 12 | I678: =G678*6+H678 -> 30 | K678: 5 | L678: 14 | M678: =K678*6+L678 -> 44 | O678: 7 | P678: 18 | Q678: =O678*6+P678 -> 60 | W678: CAULFIELD | X678: 7 | Y678: 8 | Z678: 0 | AA678: 1569 | AB678: 1639 | AC678: =(AA678*100)/AB678 -> 95.729103111653444 | AD678: =(X678*4)+(Z678*2) -> 28
A679: BEST PLAYERS | W679: MORDIALLOC | X679: 5 | Y679: 9 | Z679: 1 | AA679: 1235 | AB679: 1538 | AC679: =(AA679*100)/AB679 -> 80.299089726918069 | AD679: =(X679*4)+(Z679*2) -> 22
A680: MORDIALLOC | C680: HARRY | F680: DANCKERT | I680: SMITH | L680: PIERCE | O680: LAIRD | R680: LITTLE | W680: NORTHCOTE | X680: 5 | Y680: 10 | Z680: 0 | AA680: 1313 | AB680: 1605 | AC680: =(AA680*100)/AB680 -> 81.806853582554524 | AD680: =(X680*4)+(Z680*2) -> 20
A681: WERRIBEE | C681: ARRIGO | F681: NATION | I681: COMBEN | L681: McNAUGHTON | O681: STOIS | R681: YOUNG | W681: WERRIBEE | X681: 2 | Y681: 13 | Z681: 0 | AA681: 1225 | AB681: 1667 | AC681: =(AA681*100)/AB681 -> 73.485302939412122 | AD681: =(X681*4)+(Z681*2) -> 8
A682: GOALKICKERS | W682: CAMBERWELL | X682: 2 | Y682: 13 | Z682: 0 | AA682: 1028 | AB682: 1693 | AC682: =(AA682*100)/AB682 -> 60.720614294152391 | AD682: =(X682*4)+(Z682*2) -> 8
A683: MORDIALLOC | C683: McGUINNESS 7 | F683: LESLIE 4 | H683: PIERCE 3 | J683: POWER 2 | L683: STUDHAM | N683: HARRY | P683: SMITH | R683: BENTLEY | T683: MARTELLO
A684: WERRIBEE | C684: TAYLOR 3 | F684: COMBEN 2 | I684: LYONS | K684: YOUNG
E685: 19TH JULY | I685: WEATHER
A686: SUNSHINE | C686: 2 | D686: 5 | E686: =C686*6+D686 -> 17 | G686: 7 | H686: 10 | I686: =G686*6+H686 -> 52 | K686: 9 | L686: 13 | M686: =K686*6+L686 -> 67 | O686: 16 | P686: 20 | Q686: =O686*6+P686 -> 116 | S686: NORTHCOTE
A687: NORTHCOTE | C687: 8 | D687: 1 | E687: =C687*6+D687 -> 49 | G687: 8 | H687: 1 | I687: =G687*6+H687 -> 49 | K687: 15 | L687: 3 | M687: =K687*6+L687 -> 93 | O687: 15 | P687: 3 | Q687: =O687*6+P687 -> 93
A688: BEST PLAYERS
A689: SUNSHINE | C689: RUSSELL | F689: BAWDEN | I689: ROBERTS | L689: BROWN | O689: CLARKE | R689: HIPWORTH
A690: NORTHCOTE | C690: CLOTZ | F690: BATE | I690: SCHIRRIPA | L690: COHEN | O690: WESTON | R690: SMITH
A691: GOALKICKERS
A692: SUNSHINE | C692: RUSSELL 7 | F692: ALLEN 3 | H692: IBRAHIM 2 | K692: FERGUSON 2 | N692: CLARK | P692: CRAWFORD
A693: NORTHCOTE | C693: COHEN 4 | F693: MOUNTNEY 4 | I693: WESTON 3 | K693: BATE 2 | M693: KOZARIS | O693: UNDERWOOD
A695: COBURG | C695: 9 | D695: 7 | E695: =C695*6+D695 -> 61 | G695: 11 | H695: 7 | I695: =G695*6+H695 -> 73 | K695: 13 | L695: 11 | M695: =K695*6+L695 -> 89 | O695: 19 | P695: 14 | Q695: =O695*6+P695 -> 128 | S695: BRUNSWICK
A696: BRUNSWICK | C696: 3 | D696: 1 | E696: =C696*6+D696 -> 19 | G696: 9 | H696: 6 | I696: =G696*6+H696 -> 60 | K696: 11 | L696: 6 | M696: =K696*6+L696 -> 72 | O696: 15 | P696: 14 | Q696: =O696*6+P696 -> 104
A697: BEST PLAYERS
A698: COBURG | C698: MARSH | F698: SULLIVAN | I698: KIRKMAN | L698: SHALLARD | O698: GALE | R698: EVERALL
A699: BRUNSWICK | C699: WROUT | F699: LEYDIN | I699: I GREIG | L699: GENT | O699: McKINNON | R699: OGSTON
A700: GOALKICKERS
A701: COBURG | C701: McCARTHY 4 | F701: HOUGH 4 | H701: KIRKMAN 3 | K701: HEPPER 3 | N701: MARSH 3 | P701: GALE | R701: LAWSON
A702: BRUNSWICK | C702: K GREIG 3 | F702: WROUT 3 | I702: PERRY 2 | K702: HOWARD 2 | N702: LEYDIN 2 | P702: COOK | R702: OGSTON | T702: McKINNON
A704: CAULFIELD | C704: 2 | D704: 4 | E704: =C704*6+D704 -> 16 | G704: 6 | H704: 7 | I704: =G704*6+H704 -> 43 | K704: 9 | L704: 9 | M704: =K704*6+L704 -> 63 | O704: 12 | P704: 12 | Q704: =O704*6+P704 -> 84 | S704: CAMBERWELL
A705: CAMBERWELL | C705: 2 | D705: 1 | E705: =C705*6+D705 -> 13 | G705: 3 | H705: 6 | I705: =G705*6+H705 -> 24 | K705: 6 | L705: 7 | M705: =K705*6+L705 -> 43 | O705: 11 | P705: 9 | Q705: =O705*6+P705 -> 75
A706: BEST PLAYERS
A707: CAULFIELD | C707: LOGAN | F707: ARRELL | I707: WILLIAMS | L707: GOWANS | O707: JULIER | R707: McGINTY
A708: CAMBERWELL | C708: MACKINLAY | F708: D WILSON | I708: STEWART | L708: CONYERS | O708: D BOYD | R708: SMITH
A709: GOALKICKERS
A710: CAULFIELD | C710: McGINTY 5 | F710: GOWANS 3 | I710: WILLIAMS 2 | L710: RENOWDEN | O710: TEMPEST
A711: CAMBERWELL | C711: TAYLOR 2 | F711: SMITH 2 | H711: PECK 2 | J711: DOBSON | L711: BRAYNE | N711: J BRODIE | P711: L BOYD | R711: FOX
A713: ROUND 16 | E713: 25TH JULY | J713: WEATHER | S713: PLAYED AT
D714: 1ST QTR | H714: 2ND QTR | L714: 3RD QTR | P714: FINAL | S714: MORDIALLOC
A715: MORDIALLOC | C715: 4 | D715: 3 | E715: =C715*6+D715 -> 27 | G715: 9 | H715: 6 | I715: =G715*6+H715 -> 60 | K715: 10 | L715: 8 | M715: =K715*6+L715 -> 68 | O715: 15 | P715: 9 | Q715: =O715*6+P715 -> 99 | S715: UMPIRE | X715: LADDER | AB715: ROUND | AD715: 16
A716: CAMBERWELL | C716: 2 | D716: 1 | E716: =C716*6+D716 -> 13 | G716: 4 | H716: 4 | I716: =G716*6+H716 -> 28 | K716: 5 | L716: 10 | M716: =K716*6+L716 -> 40 | O716: 9 | P716: 10 | Q716: =O716*6+P716 -> 64
A717: BEST PLAYERS | W717: TEAM | X717: W | Y717: L | Z717: D | AA717: FOR | AB717: AGST | AC717: % | AD717: PTS
A718: MORDIALLOC | C718: PIERCE | F718: McGUINNESS | I718: SMITH | L718: MARTELLO | O718: DANCKERT | R718: LANG
A719: CAMBERWELL | C719: TAYLOR | F719: O'DONNELL | I719: L BOYD | L719: WARD | O719: MACKINLAY | R719: STEWART | W719: COBURG | X719: 14 | Y719: 2 | Z719: 0 | AA719: 2212 | AB719: 1203 | AC719: =(AA719*100)/AB719 -> 183.87364921030758 | AD719: =(X719*4)+(Z719*2) -> 56
A720: GOALKICKERS | W720: SUNSHINE | X720: 14 | Y720: 2 | Z720: 0 | AA720: 2050 | AB720: 1330 | AC720: =(AA720*100)/AB720 -> 154.13533834586465 | AD720: =(X720*4)+(Z720*2) -> 56
A721: MORDIALLOC | C721: McGUINNESS 4 | F721: MARTELLO 4 | I721: LESTER 2 | K721: POWER | M721: LITTLE | O721: HARRY | Q721: PIERCE | S721: SMITH | W721: BOX HILL | X721: 11 | Y721: 4 | Z721: 1 | AA721: 1782 | AB721: 1543 | AC721: =(AA721*100)/AB721 -> 115.48930654569021 | AD721: =(X721*4)+(Z721*2) -> 46
A722: CAMBERWELL | C722: O'DONNELL 4 | F722: TAYLOR 3 | I722: SMITH 2 | W722: BRUNSWICK | X722: 9 | Y722: 7 | Z722: 0 | AA722: 1596 | AB722: 1571 | AC722: =(AA722*100)/AB722 -> 101.59134309357097 | AD722: =(X722*4)+(Z722*2) -> 36
A724: SUNSHINE | C724: 9 | D724: 4 | E724: =C724*6+D724 -> 58 | G724: 10 | H724: 6 | I724: =G724*6+H724 -> 66 | K724: 21 | L724: 11 | M724: =K724*6+L724 -> 137 | O724: 28 | P724: 14 | Q724: =O724*6+P724 -> 182 | S724: SUNSHINE | W724: CAULFIELD | X724: 8 | Y724: 8 | Z724: 0 | AA724: 1663 | AB724: 1723 | AC724: =(AA724*100)/AB724 -> 96.517701683110857 | AD724: =(X724*4)+(Z724*2) -> 32
A725: BOX HILL | C725: 1 | D725: 3 | E725: =C725*6+D725 -> 9 | G725: 5 | H725: 14 | I725: =G725*6+H725 -> 44 | K725: 7 | L725: 15 | M725: =K725*6+L725 -> 57 | O725: 9 | P725: 25 | Q725: =O725*6+P725 -> 79 | W725: FRANKSTON | X725: 7 | Y725: 9 | Z725: 0 | AA725: 1617 | AB725: 1737 | AC725: =(AA725*100)/AB725 -> 93.091537132987909 | AD725: =(X725*4)+(Z725*2) -> 28
A726: BEST PLAYERS | W726: MORDIALLOC | X726: 6 | Y726: 9 | Z726: 1 | AA726: 1334 | AB726: 1602 | AC726: =(AA726*100)/AB726 -> 83.270911360799005 | AD726: =(X726*4)+(Z726*2) -> 26
A727: SUNSHINE | C727: BROWN | F727: FERGUSON | I727: RUSSELL | L727: BENSON | O727: THOMAS | R727: RUSSELL | W727: NORTHCOTE | X727: 5 | Y727: 11 | Z727: 0 | AA727: 1398 | AB727: 1727 | AC727: =(AA727*100)/AB727 -> 80.949623624782859 | AD727: =(X727*4)+(Z727*2) -> 20
A728: BOX HILL | C728: BAKER | F728: ABBOTT | I728: DEED | W728: WERRIBEE | X728: 3 | Y728: 13 | Z728: 0 | AA728: 1347 | AB728: 1752 | AC728: =(AA728*100)/AB728 -> 76.88356164383562 | AD728: =(X728*4)+(Z728*2) -> 12
A729: GOALKICKERS | P729: BROWN | R729: OVERS | W729: CAMBERWELL | X729: 2 | Y729: 14 | Z729: 0 | AA729: 1092 | AB729: 1792 | AC729: =(AA729*100)/AB729 -> 60.9375 | AD729: =(X729*4)+(Z729*2) -> 8
A730: SUNSHINE | C730: ALLEN 6 | F730: FERGUSON 6 | I730: RUSSELL 5 | K730: CRAWFORD 3 | N730: BENSON 2 | P730: CLARKE 2 | R730: IBRAHIM | T730: BEAN
A731: BOX HILL | C731: CRISP 2 | F731: THOMPSON 2 | I731: BARNETT | K731: COLE | M731: BAKER | O731: COBAIN | Q731: DAWSON
A733: CAULFIELD | C733: 4 | D733: 3 | E733: =C733*6+D733 -> 27 | G733: 7 | H733: 10 | I733: =G733*6+H733 -> 52 | K733: 11 | L733: 15 | M733: =K733*6+L733 -> 81 | O733: 12 | P733: 22 | Q733: =O733*6+P733 -> 94 | S733: PRINCES PARK, CAULFIELD
A734: BRUNSWICK | C734: 2 | D734: 4 | E734: =C734*6+D734 -> 16 | G734: 8 | H734: 8 | I734: =G734*6+H734 -> 56 | K734: 9 | L734: 9 | M734: =K734*6+L734 -> 63 | O734: 12 | P734: 12 | Q734: =O734*6+P734 -> 84
A735: BEST PLAYERS
A736: CAULFIELD | C736: BAKER | F736: GOWANS | I736: HOCKING | L736: CLARK | O736: LOGAN | R736: WILLIAMS
A737: BRUNSWICK | C737: LEYDIN | F737: OGSTON | I737: ALLEN | L737: EGAN | O737: K GREIG | R737: I GREIG
A738: GOALKICKERS
A739: CAULFIELD | C739: WILLIAMS 4 | F739: McGINTY 2 | I739: BAKER 2 | K739: CURTAIN 2 | N739: FELDMAN | Q739: HOCKING
A740: BRUNSWICK | C740: ALLEN 3 | F740: LEYDIN 2 | I740: OGSTON | K740: WHELAN | N740: WROUT | P740: HOWARD | R740: PERRY | S740: K GREIG | U740: BOOTH
A742: WERRIBEE | C742: 7 | D742: 4 | E742: =C742*6+D742 -> 46 | G742: 10 | H742: 9 | I742: =G742*6+H742 -> 69 | K742: 15 | L742: 13 | M742: =K742*6+L742 -> 103 | O742: 18 | P742: 14 | Q742: =O742*6+P742 -> 122 | S742: WERRIBEE
A743: NORTHCOTE | C743: 1 | D743: 1 | E743: =C743*6+D743 -> 7 | G743: 7 | H743: 3 | I743: =G743*6+H743 -> 45 | K743: 10 | L743: 6 | M743: =K743*6+L743 -> 66 | O743: 12 | P743: 13 | Q743: =O743*6+P743 -> 85
A744: BEST PLAYERS
A745: WERRIBEE | C745: LLOYD | F745: BUTTON | I745: RUSH | L745: JONES | O745: STOIOS | R745: ANDERSON
A746: NORTHCOTE | C746: KOZARIS | F746: WATERS | I746: McGORLICK | L746: McORIST | O746: YAKSENDER | R746: COHEN
A747: GOALKICKERS
A748: WERRIBEE | C748: ROBINSON 6 | F748: COMBEN 3 | I748: BUTTON 2 | K748: NORMAN 2 | N748: JONES 2 | P748: TAYLOR | R748: LYONS | T748: RUSH
A749: NORTHCOTE | C749: COHEN 4 | F749: MAYNE 2 | I749: KEANE | K749: YAKSENDER | N749: BATE | P749: UNDERWOOD | S749: VINEY | U749: McORIST
A751: COBURG | C751: 6 | D751: 6 | E751: =C751*6+D751 -> 42 | G751: 11 | H751: 7 | I751: =G751*6+H751 -> 73 | K751: 21 | L751: 11 | M751: =K751*6+L751 -> 137 | O751: 25 | P751: 17 | Q751: =O751*6+P751 -> 167 | S751: COBURG
A752: FRANKSTON | C752: 4 | D752: 3 | E752: =C752*6+D752 -> 27 | G752: 7 | H752: 7 | I752: =G752*6+H752 -> 49 | K752: 7 | L752: 10 | M752: =K752*6+L752 -> 52 | O752: 10 | P752: 12 | Q752: =O752*6+P752 -> 72
A753: BEST PLAYERS
A754: COBURG | C754: MORRISON | F754: SULLIVAN | I754: HOUGH | L754: HEPPER | O754: MARSH
A755: FRANKSTON | C755: PRENDERGAST | F755: THURLEY | I755: WINSTANLEY | L755: PITT | O755: WESTON
A756: GOALKICKERS
A757: COBURG | C757: HOUGH 8 | F757: MORRISON 5 | I757: HEPPER 4 | K757: GALE 3 | M757: McARTHY 2 | O757: LAWSON | R757: SULLIVAN | T757: RYBALKO
A758: FRANKSTON | C758: CROUGHAN 3 | F758: BREMNER 2 | I758: PRICE | K758: McNAB | M758: WESTON | O758: CLARK | Q758: LOVELOCK
A760: ROUND 17 | E760: 1ST AUGUST | J760: WEATHER | S760: PLAYED AT
D761: 1ST QTR | H761: 2ND QTR | L761: 3RD QTR | P761: FINAL | S761: BOX HILL
A762: CAULFIELD | C762: 10 | D762: 4 | E762: =C762*6+D762 -> 64 | G762: 15 | H762: 5 | I762: =G762*6+H762 -> 95 | K762: 17 | L762: 14 | M762: =K762*6+L762 -> 116 | O762: 19 | P762: 15 | Q762: =O762*6+P762 -> 129 | S762: UMPIRE | X762: LADDER | AB762: ROUND | AD762: 17
A763: BOX HILL | C763: 2 | D763: 1 | E763: =C763*6+D763 -> 13 | G763: 4 | H763: 7 | I763: =G763*6+H763 -> 31 | K763: 8 | L763: 10 | M763: =K763*6+L763 -> 58 | O763: 11 | P763: 16 | Q763: =O763*6+P763 -> 82 | S763: JACKSON
A764: BEST PLAYERS | W764: TEAM | X764: W | Y764: L | Z764: D | AA764: FOR | AB764: AGST | AC764: % | AD764: PTS
A765: CAULFIELD | C765: LOGAN | F765: GOWANS | I765: BROWN | L765: McGINTY | O765: JEWELL | R765: WILLIAMS
A766: BOX HILL | C766: RALPH | F766: CRISP | I766: BARNETT | L766: KING | O766: COLE | W766: COBURG | X766: 15 | Y766: 2 | Z766: 0 | AA766: 2363 | AB766: 1279 | AC766: =(AA766*100)/AB766 -> 184.75371383893668 | AD766: =(X766*4)+(Z766*2) -> 60
A767: GOALKICKERS | W767: SUNSHINE | X767: 15 | Y767: 2 | Z767: 0 | AA767: 2147 | AB767: 1418 | AC767: =(AA767*100)/AB767 -> 151.41043723554301 | AD767: =(X767*4)+(Z767*2) -> 60
A768: CAULFIELD | C768: McGINTY 8 | F768: WILLIAMS 3 | I768: JEWELL 2 | K768: CURTAIN 2 | M768: GOWANS | O768: BROWN | Q768: EVERALL | S768: COLLINS | W768: BOX HILL | X768: 11 | Y768: 5 | Z768: 1 | AA768: 1864 | AB768: 1672 | AC768: =(AA768*100)/AB768 -> 111.48325358851675 | AD768: =(X768*4)+(Z768*2) -> 46
A769: BOX HILL | C769: KING 3 | E769: CRISP 3 | G769: BARNETT 2 | J769: THOMPSON | M769: McKAY | O769: ABBOTT | W769: BRUNSWICK | X769: 9 | Y769: 8 | Z769: 0 | AA769: 1684 | AB769: 1668 | AC769: =(AA769*100)/AB769 -> 100.95923261390887 | AD769: =(X769*4)+(Z769*2) -> 36
A771: FRANKSTON | C771: 8 | D771: 5 | E771: =C771*6+D771 -> 53 | G771: 11 | H771: 8 | I771: =G771*6+H771 -> 74 | K771: 14 | L771: 12 | M771: =K771*6+L771 -> 96 | O771: 16 | P771: 14 | Q771: =O771*6+P771 -> 110 | S771: FRANKSTON | W771: CAULFIELD | X771: 9 | Y771: 8 | Z771: 0 | AA771: 1792 | AB771: 1805 | AC771: =(AA771*100)/AB771 -> 99.279778393351805 | AD771: =(X771*4)+(Z771*2) -> 36
A772: CAMBERWELL | C772: 1 | D772: 0 | E772: =C772*6+D772 -> 6 | G772: 7 | H772: 3 | I772: =G772*6+H772 -> 45 | K772: 10 | L772: 4 | M772: =K772*6+L772 -> 64 | O772: 17 | P772: 6 | Q772: =O772*6+P772 -> 108 | S772: CHINN | W772: FRANKSTON | X772: 8 | Y772: 9 | Z772: 0 | AA772: 1727 | AB772: 1845 | AC772: =(AA772*100)/AB772 -> 93.604336043360433 | AD772: =(X772*4)+(Z772*2) -> 32
A773: BEST PLAYERS | W773: MORDIALLOC | X773: 6 | Y773: 10 | Z773: 1 | AA773: 1372 | AB773: 1717 | AC773: =(AA773*100)/AB773 -> 79.906814210832849 | AD773: =(X773*4)+(Z773*2) -> 26
A774: FRANKSTON | C774: PRENDERGAST | F774: LOVELOCK | I774: P | L774: HINES | O774: BREMNER | R774: CROUGHAN | W774: NORTHCOTE | X774: 6 | Y774: 11 | Z774: 0 | AA774: 1513 | AB774: 1765 | AC774: =(AA774*100)/AB774 -> 85.722379603399432 | AD774: =(X774*4)+(Z774*2) -> 24
A775: CAMBERWELL | C775: O'DONNELL | F775: WARD | I775: BRAYNE | L775: TAYLOR | O775: SMITH | R775: D BOYD | W775: WERRIBEE | X775: 3 | Y775: 14 | Z775: 0 | AA775: 1423 | AB775: 1903 | AC775: =(AA775*100)/AB775 -> 74.776668418286917 | AD775: =(X775*4)+(Z775*2) -> 12
A776: GOALKICKERS | W776: CAMBERWELL | X776: 2 | Y776: 15 | Z776: 0 | AA776: 1200 | AB776: 1902 | AC776: =(AA776*100)/AB776 -> 63.09148264984227 | AD776: =(X776*4)+(Z776*2) -> 8
A777: FRANKSTON | C777: McNAB 3 | E777: LOVELOCK 3 | G777: CROUGHAN 3 | J777: WESTON 2 | L777: HINES | N777: THURLEY | P777: BREMNER | R777: CLARK | T777: KERR
A778: CAMBERWELL | C778: VINEY 6 | E778: L BOYD 4 | G778: TAYLOR 2 | J778: BRAYNE | L778: EDWARDS | N778: BRODIE | P778: O'DONNELL | R778: CONYERS
A780: NORTHCOTE | C780: 3 | D780: 2 | E780: =C780*6+D780 -> 20 | G780: 7 | H780: 7 | I780: =G780*6+H780 -> 49 | K780: 10 | L780: 9 | M780: =K780*6+L780 -> 69 | O780: 17 | P780: 13 | Q780: =O780*6+P780 -> 115 | S780: NORTHCOTE
A781: MORDIALLOC | C781: 2 | D781: 6 | E781: =C781*6+D781 -> 18 | G781: 3 | H781: 11 | I781: =G781*6+H781 -> 29 | K781: 4 | L781: 14 | M781: =K781*6+L781 -> 38 | O781: 4 | P781: 14 | Q781: =O781*6+P781 -> 38 | S781: DUGARD
A782: BEST PLAYERS
A783: NORTHCOTE | C783: KOZARIS | F783: MAYNE | I783: KEANE | L783: COHEN | O783: MARTIN | R783: SMITH
A784: MORDIALLOC | C784: McGUINNESS | F784: HARRY | I784: MARTELLO | L784: SMITH | O784: LANG | R784: LAIRD
A785: GOALKICKERS
A786: NORTHCOTE | C786: KEANE 6 | E786: MOUNTNEY 3 | H786: COHEN 2 | J786: McORIST 2 | M786: LASKEY 2 | O786: MAYNE | Q786: MARTIN
A787: MORDIALLOC | C787: McGUINNESS 2 | F787: SMITH | H787: HARRY
A789: SUNSHINE | C789: 5 | D789: 8 | E789: =C789*6+D789 -> 38 | G789: 8 | H789: 12 | I789: =G789*6+H789 -> 60 | K789: 11 | L789: 15 | M789: =K789*6+L789 -> 81 | O789: 13 | P789: 19 | Q789: =O789*6+P789 -> 97 | S789: SUNSHINE
A790: BRUNSWICK | C790: 3 | D790: 1 | E790: =C790*6+D790 -> 19 | G790: 8 | H790: 3 | I790: =G790*6+H790 -> 51 | K790: 10 | L790: 9 | M790: =K790*6+L790 -> 69 | O790: 13 | P790: 10 | Q790: =O790*6+P790 -> 88 | S790: PASK
A791: BEST PLAYERS
A792: SUNSHINE | C792: FERGUSON | F792: BELL | I792: BROWN | L792: HIPWORTH | O792: RUSSELL
A793: BRUNSWICK | C793: COOK | F793: GENT | I793: EGAN | L793: I GREIG | O793: BOOTH
A794: GOALKICKERS
A795: SUNSHINE | C795: FERGUSON 5 | F795: RUSSELL 4 | I795: OVERS 2 | K795: ALLEN | M795: BENSON
A796: BRUNSWICK | C796: COOK 8 | F796: OGSTON | I796: WROUT | K796: K GREIG | M796: BOOTH
A798: COBURG | C798: 9 | D798: 5 | E798: =C798*6+D798 -> 59 | G798: 10 | H798: 9 | I798: =G798*6+H798 -> 69 | K798: 15 | L798: 20 | M798: =K798*6+L798 -> 110 | O798: 21 | P798: 25 | Q798: =O798*6+P798 -> 151 | S798: COBURG
A799: WERRIBEE | C799: 3 | D799: 1 | E799: =C799*6+D799 -> 19 | G799: 6 | H799: 3 | I799: =G799*6+H799 -> 39 | K799: 7 | L799: 4 | M799: =K799*6+L799 -> 46 | O799: 11 | P799: 10 | Q799: =O799*6+P799 -> 76 | S799: BOOTH
A800: BEST PLAYERS
A801: COBURG | C801: LAWSON | F801: BRENNAN | I801: KIRKMAN | L801: HEPPER | O801: ERWIN
A802: WERRIBEE | C802: COMBEN | F802: BUTTON | I802: RUSH | L802: ARRIGO | O802: NORMAN
A803: GOALKICKERS
A804: COBURG | C804: LAWSON 5 | F804: HEPPER 4 | H804: MORRISON 3 | K804: HOUGH 3 | M804: McCARTHY 2 | P804: ERWIN 2 | R804: SULLIVAN | T804: KIRKMAN
A805: WERRIBEE | C805: COMBEN 4 | F805: TAYLOR 3 | I805: BUTTON | K805: LYONS | M805: JONES | O805: NORMAN
A807: ROUND 18 | E807: 8TH AUGUST | J807: WEATHER | S807: PLAYED AT
D808: 1ST QTR | H808: 2ND QTR | L808: 3RD QTR | P808: FINAL | S808: BRUNSWICK
A809: BRUNSWICK | C809: 2 | D809: 3 | E809: =C809*6+D809 -> 15 | G809: 7 | H809: 7 | I809: =G809*6+H809 -> 49 | K809: 11 | L809: 9 | M809: =K809*6+L809 -> 75 | O809: 14 | P809: 13 | Q809: =O809*6+P809 -> 97 | S809: UMPIRE | X809: LADDER | AB809: ROUND | AD809: 18
A810: FRANKSTON | C810: 3 | D810: 1 | E810: =C810*6+D810 -> 19 | G810: 3 | H810: 2 | I810: =G810*6+H810 -> 20 | K810: 5 | L810: 3 | M810: =K810*6+L810 -> 33 | O810: 7 | P810: 4 | Q810: =O810*6+P810 -> 46 | S810: ABBOTT
A811: BEST PLAYERS | W811: TEAM | X811: W | Y811: L | Z811: D | AA811: FOR | AB811: AGST | AC811: % | AD811: PTS
A812: BRUNSWICK | C812: DALTON | F812: COOK | I812: GENT | L812: K GREIG | O812: TERRY | Q812: OGSTON
A813: FRANKSTON | C813: WESTON | F813: KERR | I813: PRENDERGAST | L813: KEETH | O813: STAPLETON | W813: COBURG | X813: 16 | Y813: 2 | Z813: 0 | AA813: 2472 | AB813: 1378 | AC813: =(AA813*100)/AB813 -> 179.39042089985486 | AD813: =(X813*4)+(Z813*2) -> 64
A814: GOALKICKERS | W814: SUNSHINE | X814: 15 | Y814: 3 | Z814: 0 | AA814: 2228 | AB814: 1501 | AC814: =(AA814*100)/AB814 -> 148.43437708194537 | AD814: =(X814*4)+(Z814*2) -> 60
A815: BRUNSWICK | C815: COOK 5 | F815: K GREIG 3 | I815: BOOTH 2 | K815: OGSTON 2 | N815: McKINNON | Q815: TERRY | W815: BOX HILL | X815: 12 | Y815: 5 | Z815: 1 | AA815: 1983 | AB815: 1773 | AC815: =(AA815*100)/AB815 -> 111.84433164128596 | AD815: =(X815*4)+(Z815*2) -> 50
A816: FRANKSTON | C816: WESTON 4 | F816: KERR | H816: SAVVA | J816: WINSTANLEY | W816: BRUNSWICK | X816: 10 | Y816: 8 | Z816: 0 | AA816: 1781 | AB816: 1714 | AC816: =(AA816*100)/AB816 -> 103.90898483080514 | AD816: =(X816*4)+(Z816*2) -> 40
A818: MORDIALLOC | C818: 0 | D818: 0 | E818: =C818*6+D818 -> 0 | G818: 5 | H818: 4 | I818: =G818*6+H818 -> 34 | K818: 6 | L818: 5 | M818: =K818*6+L818 -> 41 | O818: 12 | P818: 11 | Q818: =O818*6+P818 -> 83 | S818: MORDIALLOC | W818: CAULFIELD | X818: 9 | Y818: 9 | Z818: 0 | AA818: 1891 | AB818: 1914 | AC818: =(AA818*100)/AB818 -> 98.798328108672933 | AD818: =(X818*4)+(Z818*2) -> 36
A819: SUNSHINE | C819: 6 | D819: 5 | E819: =C819*6+D819 -> 41 | G819: 6 | H819: 7 | I819: =G819*6+H819 -> 43 | K819: 11 | L819: 9 | M819: =K819*6+L819 -> 75 | O819: 12 | P819: 9 | Q819: =O819*6+P819 -> 81 | S819: GAMBETTA | W819: FRANKSTON | X819: 8 | Y819: 10 | Z819: 0 | AA819: 1773 | AB819: 1942 | AC819: =(AA819*100)/AB819 -> 91.297631307929976 | AD819: =(X819*4)+(Z819*2) -> 32
A820: BEST PLAYERS | W820: MORDIALLOC | X820: 7 | Y820: 10 | Z820: 1 | AA820: 1455 | AB820: 1798 | AC820: =(AA820*100)/AB820 -> 80.923248053392655 | AD820: =(X820*4)+(Z820*2) -> 30
A821: MORDIALLOC | C821: DANCKERT | F821: PIERCE | I821: HUTTON | L821: LANG | O821: LESLIE | Q821: BENTLEY | W821: NORTHCOTE | X821: 7 | Y821: 11 | Z821: 0 | AA821: 1621 | AB821: 1852 | AC821: =(AA821*100)/AB821 -> 87.526997840172783 | AD821: =(X821*4)+(Z821*2) -> 28
A822: SUNSHINE | C822: FERGUSON | F822: BROWN | I822: THOMAS | L822: BOWDEN | O822: IBRAHIM | W822: WERRIBEE | X822: 3 | Y822: 15 | Z822: 0 | AA822: 1524 | AB822: 2022 | AC822: =(AA822*100)/AB822 -> 75.370919881305639 | AD822: =(X822*4)+(Z822*2) -> 12
A823: GOALKICKERS | W823: CAMBERWELL | X823: 2 | Y823: 16 | Z823: 0 | AA823: 1287 | AB823: 2010 | AC823: =(AA823*100)/AB823 -> 64.02985074626865 | AD823: =(X823*4)+(Z823*2) -> 8
A824: MORDIALLOC | C824: McGUINNESS 4 | F824: HARRY 2 | I824: LESLIE 2 | K824: STUDHAM | N824: PIERCE | P824: MARTELLO | S824: LITTLE
A825: SUNSHINE | C825: FERGUSON 5 | F825: BEAN 3 | H825: RUSSELL | J825: BENSON | M825: GROSSMAN | P825: CLARK
A827: BOX HILL | C827: 4 | D827: 2 | E827: =C827*6+D827 -> 26 | G827: 12 | H827: 7 | I827: =G827*6+H827 -> 79 | K827: 15 | L827: 7 | M827: =K827*6+L827 -> 97 | O827: 18 | P827: 11 | Q827: =O827*6+P827 -> 119 | S827: WERRIBEE
A828: WERRIBEE | C828: 2 | D828: 3 | E828: =C828*6+D828 -> 15 | G828: 4 | H828: 9 | I828: =G828*6+H828 -> 33 | K828: 9 | L828: 12 | M828: =K828*6+L828 -> 66 | O828: 14 | P828: 17 | Q828: =O828*6+P828 -> 101 | S828: CHINN
A829: BEST PLAYERS
A830: BOX HILL | C830: BAKER | F830: BARNETT | I830: LONRA | L830: CRISP | O830: COBAIN
A831: WERRIBEE | C831: HINKLEY | F831: EDWARDS | I831: TAYLOR | L831: ROBINSON | O831: LYONS
A832: GOALKICKERS
A833: BOX HILL | C833: ABBOTT 5 | F833: BAKER 4 | I833: CRISP 3 | K833: BIERL 2 | M833: HUNT 2 | O833: COBAIN | Q833: LANCASTER
A834: WERRIBEE | C834: TAYLOR 4 | F834: HINKLEY 4 | I834: COMBEN 2 | L834: McNAUGHTON 2 | O834: ARRIGO | Q834: NORMAN
E835: 9TH AUGUST | K835: WEATHER
A836: COBURG | C836: 3 | D836: 6 | E836: =C836*6+D836 -> 24 | G836: 7 | H836: 10 | I836: =G836*6+H836 -> 52 | K836: 13 | L836: 21 | M836: =K836*6+L836 -> 99 | O836: 14 | P836: 25 | Q836: =O836*6+P836 -> 109 | S836: PRINCES PARK, CAULFIELD
A837: CAULFIELD | C837: 0 | D837: 1 | E837: =C837*6+D837 -> 1 | G837: 4 | H837: 4 | I837: =G837*6+H837 -> 28 | K837: 4 | L837: 5 | M837: =K837*6+L837 -> 29 | O837: 15 | P837: 9 | Q837: =O837*6+P837 -> 99 | S837: ANDERSON
A838: BEST PLAYERS
A839: COBURG | C839: KIRKMAN | F839: MARSH | I839: McCARTHY | L839: ELVERY | O839: McLACHLAN | R839: LAWSON
A840: CAULFIELD | C840: LOGAN | F840: GOWANS | I840: McGINTY | L840: HOCKING | O840: EVERALL | R840: CLARK
A841: GOALKICKERS
A842: COBURG | C842: SPORTON 5 | F842: McCARTHY 3 | I842: KIRKMAN 2 | L842: MORRISON 2 | O842: GALE | Q842: LAWSON
A843: CAULFIELD | C843: McGINTY 5 | F843: GOWANS 3 | I843: WILLIAMS 3 | L843: EVERALL | N843: CURTAIN | Q843: BROWN | S843: M ROBINSON
A845: NORTHCOTE | C845: 0 | D845: 2 | E845: =C845*6+D845 -> 2 | G845: 7 | H845: 3 | I845: =G845*6+H845 -> 45 | K845: 10 | L845: 3 | M845: =K845*6+L845 -> 63 | O845: 17 | P845: 6 | Q845: =O845*6+P845 -> 108 | S845: CAMBERWELL
A846: CAMBERWELL | C846: 3 | D846: 8 | E846: =C846*6+D846 -> 26 | G846: 3 | H846: 9 | I846: =G846*6+H846 -> 27 | K846: 10 | L846: 19 | M846: =K846*6+L846 -> 79 | O846: 11 | P846: 21 | Q846: =O846*6+P846 -> 87 | S846: TURNER
A847: BEST PLAYERS
A848: NORTHCOTE | C848: KOZARIS | F848: McORIST | I848: SCHIRIPPA | L848: MARTIN | O848: LASKEY | R848: WATERS
A849: CAMBERWELL | C849: D BOYD | F849: PANETTA | I849: L BOYD | L849: TAYLOR | O849: FOX | R849: WILSON
A850: GOALKICKERS
A851: NORTHCOTE | C851: COHEN 4 | F851: MARTIN 4 | I851: LASKEY 4 | K851: McORIST 2 | N851: K MOUNTNEY | Q851: UNDERWOOD | T851: KEANE
A852: CAMBERWELL | C852: TAYLOR 3 | F852: SMITH 2 | I852: L BOYD 2 | K852: BRAYNE | M852: EDWARDS | P852: O'DONNELL | S852: VINEY
A854: FINALS
A855: 1ST SEMI | E855: 16TH AUGUST | J855: WEATHER | S855: PLAYED AT
D856: 1ST QTR | H856: 2ND QTR | L856: 3RD QTR | P856: FINAL | S856: TOORAK PK
A857: BOX HILL | C857: 5 | D857: 1 | E857: =C857*6+D857 -> 31 | G857: 9 | H857: 3 | I857: =G857*6+H857 -> 57 | K857: 13 | L857: 9 | M857: =K857*6+L857 -> 87 | O857: 20 | P857: 15 | Q857: =O857*6+P857 -> 135 | S857: UMPIRE
A858: BRUNSWICK | C858: 3 | D858: 4 | E858: =C858*6+D858 -> 22 | G858: 8 | H858: 5 | I858: =G858*6+H858 -> 53 | K858: 13 | L858: 6 | M858: =K858*6+L858 -> 84 | O858: 16 | P858: 7 | Q858: =O858*6+P858 -> 103 | S858: ANDERSON
A859: BEST PLAYERS
A860: BOX HILL | C860: BIERL | F860: CRISP | I860: ABBOTT | L860: BAKER | O860: LONG | R860: COBAIN
A861: BRUNSWICK | C861: LEYDIN | F861: HOWARD | I861: McKINNON | L861: WADHAM | O861: K GREIG | R861: BOOTH
A862: GOALKICKERS
A863: BOX HILL | C863: BARNETT 5 | F863: ABBOTT 5 | I863: COBAIN 4 | K863: DAWSON 2 | M863: SMITH | O863: BIERL | Q863: McKAY | S863: GRIFFTH
A864: BRUNSWICK | C864: COOK 5 | F864: WROUT 3 | I864: K GREIG 2 | K864: ALLEN 2 | M864: OGSTON | O864: McKINNON | R864: HORSINGTON | V864: SKIDMORE
A866: 2ND SEMI | E866: 23RD AUGUST | I866: WEATHER
A867: COBURG | C867: 5 | D867: 1 | E867: =C867*6+D867 -> 31 | G867: 17 | H867: 4 | I867: =G867*6+H867 -> 106 | K867: 21 | L867: 7 | M867: =K867*6+L867 -> 133 | O867: 25 | P867: 12 | Q867: =O867*6+P867 -> 162 | S867: TOORAK PARK
A868: SUNSHINE | C868: 5 | D868: 4 | E868: =C868*6+D868 -> 34 | G868: 5 | H868: 5 | I868: =G868*6+H868 -> 35 | K868: 10 | L868: 8 | M868: =K868*6+L868 -> 68 | O868: 14 | P868: 12 | Q868: =O868*6+P868 -> 96 | S868: PASK
A869: BEST PLAYERS
A870: COBURG | C870: KIRKMAN | F870: LAWSON | I870: GALE | L870: ERWIN | O870: BRENNAN | R870: JONES
A871: SUNSHINE | C871: HIPWORTH | F871: BENSON | I871: CLARKE | L871: THOMAS | O871: DARUL
A872: GOALKICKERS
A873: COBURG | C873: GALE 5 | E873: SPORTON 5 | G873: SULLIVAN 3 | J873: HEPPER 3 | L873: McCARTHY 2 | O873: LAWSON 2 | R873: KIRKMAN 2 | U873: ERWIN | W873: MORRISON | X873: PRICE
A874: SUNSHINE | C874: RUSSELL 4 | F874: ALLEN 2 | H874: McGREGOR 2 | K874: FERGUSON 2 | N874: BENSON | P874: METCHER | R874: OVERS | T874: CLARKE
A876: PRELIMINARY | E876: 30TH AUGUST | I876: WEATHER
A877: BOX HILL | C877: 0 | D877: 0 | E877: =C877*6+D877 -> 0 | G877: 0 | H877: 0 | I877: =G877*6+H877 -> 0 | K877: 0 | L877: 0 | M877: =K877*6+L877 -> 0 | O877: 16 | P877: 7 | Q877: =O877*6+P877 -> 103 | S877: TOORAK PARK
A878: SUNSHINE | C878: 0 | D878: 0 | E878: =C878*6+D878 -> 0 | G878: 0 | H878: 0 | I878: =G878*6+H878 -> 0 | K878: 0 | L878: 0 | M878: =K878*6+L878 -> 0 | O878: 12 | P878: 12 | Q878: =O878*6+P878 -> 84
A879: BEST PLAYERS
A880: BOX HILL
A881: SUNSHINE
A882: GOALKICKERS
A883: BOX HILL
A884: SUNSHINE
A886: GRAND
A887: COBURG | C887: 5 | D887: 4 | E887: =C887*6+D887 -> 34 | G887: 11 | H887: 13 | I887: =G887*6+H887 -> 79 | K887: 16 | L887: 15 | M887: =K887*6+L887 -> 111 | O887: 20 | P887: 17 | Q887: =O887*6+P887 -> 137 | S887: TOORAK PARK
A888: BOX HILL | C888: 4 | D888: 2 | E888: =C888*6+D888 -> 26 | G888: 8 | H888: 6 | I888: =G888*6+H888 -> 54 | K888: 12 | L888: 10 | M888: =K888*6+L888 -> 82 | O888: 16 | P888: 11 | Q888: =O888*6+P888 -> 107 | S888: ANDERSON
A889: BEST PLAYERS
A890: COBURG | C890: GALE | F890: KIRKMAN | I890: HEPPER | L890: MARSH | O890: ROBINSON
A891: BOX HILL | C891: BARNETT | F891: BAKER | I891: LONZA | L891: COBAIN | O891: McQUALTER
A892: GOALKICKERS
A893: COBURG | C893: SPORTON 5 | F893: HEPPER 4 | H893: McCARTHY 3 | K893: MORRISON 3 | N893: KIRKMAN 2 | Q893: LAWSON | S893: SULLIVAN | V893: MARSH
A894: BOX HILL | C894: BARNETT 6 | F894: DAWSON 3 | I894: BAKER 2 | K894: ABBOTT 2 | N894: SMITH 2 | P894: CRISP