A1: Victorian Football Association
A2: Season 1971 - Division One
A3: © Copyright Wal Williams | F3: First created: 28 July 2015
A4: Contact: joywalwi at gmail dot com | F4: Last updated: 28 July 2015 | W4: VFA Results and tables - Link to the main index page
A5: You are free to copy this document in whole or part provided that proper acknowledgement is given to the author. All rights reserved.
A7: 1971 V.F.A. | B7: SEASON | E7: 1ST | F7: DIVISION | CA7: \D | CB7: {GOTO}BJ3~/M{RIGHT 7}{END}{DOWN}~G4~
A8: ROUND 1 | E8: 18TH APRIL | M8: WEATHER | S8: PLAYED AT | CB8: {GOTO}AL3~/M{END}{RIGHT}{END}{DOWN}~P3~
D9: 1ST QTR | H9: 2ND QTR | L9: 3RD QTR | P9: FINAL | S9: TOORAK PARK | CB9: {GOTO}BJ23~/M{RIGHT 7}{END}{DOWN}~V4~
A10: DANDENONG | C10: 0 | D10: 2 | E10: =C10*6+D10 -> 2 | G10: 3 | H10: 7 | I10: =G10*6+H10 -> 25 | K10: 9 | L10: 9 | M10: =K10*6+L10 -> 63 | O10: 14 | P10: 15 | Q10: =O10*6+P10 -> 99 | S10: UMPIRE | X10: LADDER | AB10: ROUND | AD10: 1 | CB10: {GOTO}BJ43~/M{RIGHT 7}{END}{DOWN}~G24~
A11: PRAHRAN | C11: 2 | D11: 1 | E11: =C11*6+D11 -> 13 | G11: 6 | H11: 3 | I11: =G11*6+H11 -> 39 | K11: 10 | L11: 6 | M11: =K11*6+L11 -> 66 | O11: 11 | P11: 12 | Q11: =O11*6+P11 -> 78 | S11: DUGARD | CB11: {GOTO}AL23~/M{END}{RIGHT}{END}{DOWN}~P23~
A12: BEST PLAYERS | W12: TEAM | X12: W | Y12: L | Z12: D | AA12: FOR | AB12: AGST | AC12: % | AD12: PTS | CB12: {GOTO}BJ63~/M{RIGHT 7}{END}{DOWN}~V24~
A13: DANDENONG | C13: DAVIES | E13: MADDEN | I13: ELLIS | K13: DAVENPORT | N13: FLAHERTY | Q13: ORCHARD | CB13: {GOTO}BJ83~/M{RIGHT 7}{END}{DOWN}~G44~
A14: PRAHRAN | C14: CROWE | E14: KARANICOLAS | I14: KNOX | K14: KENNEALLY | N14: BASTIAN | Q14: ANDERSON | W14: PRESTON | X14: 1 | Y14: 0 | Z14: 0 | AA14: 125 | AB14: 80 | AC14: 156.25 | AD14: 4 | CB14: {GOTO}AL43~/M{END}{RIGHT}{END}{DOWN}~P43~
A15: GOALKICKERS | W15: COBURG | X15: 1 | Y15: 0 | Z15: 0 | AA15: 100 | AB15: 75 | AC15: 133.33333333333334 | AD15: 4 | CB15: {GOTO}BJ103~/M{RIGHT 7}{END}{DOWN}~V44~
A16: DANDENONG | C16: FLAHERTY 4 | F16: DAVIES 3 | I16: MADDEN 3 | L16: REID 2 | N16: KENDALL | Q16: ORCHARD | W16: DANDENONG | X16: 1 | Y16: 0 | Z16: 0 | AA16: 99 | AB16: 78 | AC16: 126.92307692307692 | AD16: 4 | CB16: {GOTO}BJ123~/M{RIGHT 7}{END}{DOWN}~G64~
A17: PRAHRAN | C17: KNOX 3 | F17: BARTLETT 2 | I17: KARANICHOLAS 2 | M17: BASTIEN 2 | P17: PAYNE | R17: THOMAS | W17: GEELONG WEST | X17: 1 | Y17: 0 | Z17: 0 | AA17: 130 | AB17: 106 | AC17: 122.64150943396227 | AD17: 4 | CB17: {GOTO}AL63~/M{END}{RIGHT}{END}{DOWN}~P63~
CB18: {GOTO}BJ143~/M{RIGHT 7}{END}{DOWN}~V64~
A19: GEELONG WEST | C19: 2 | D19: 3 | E19: =C19*6+D19 -> 15 | G19: 14 | H19: 6 | I19: =G19*6+H19 -> 90 | K19: 17 | L19: 8 | M19: =K19*6+L19 -> 110 | O19: 20 | P19: 10 | Q19: =O19*6+P19 -> 130 | S19: WAVERLEY | W19: OAKLEIGH | X19: 1 | Y19: 0 | Z19: 0 | AA19: 100 | AB19: 95 | AC19: 105.26315789473684 | AD19: 4 | CB19: {GOTO}BJ163~/M{RIGHT 7}{END}{DOWN}~G84~
A20: WAVERLEY | C20: 3 | D20: 12 | E20: =C20*6+D20 -> 30 | G20: 6 | H20: 14 | I20: =G20*6+H20 -> 50 | K20: 10 | L20: 24 | M20: =K20*6+L20 -> 84 | O20: 13 | P20: 28 | Q20: =O20*6+P20 -> 106 | S20: CHINN | W20: PORT MELBOURNE | X20: 0 | Y20: 1 | Z20: 0 | AA20: 95 | AB20: 100 | AC20: 95 | AD20: 0 | CB20: {GOTO}AL83~/M{END}{RIGHT}{END}{DOWN}~P83~
A21: BEST PLAYERS | W21: WAVERLEY | X21: 0 | Y21: 1 | Z21: 0 | AA21: 106 | AB21: 130 | AC21: 81.538461538461533 | AD21: 0 | CB21: {GOTO}BJ183~/M{RIGHT 7}{END}{DOWN}~V84~
A22: GEELONG WEST | C22: TENABEL | F22: EMOND | I22: McLEAN | L22: HAMER | N22: TREVASKIS | Q22: BRYANT | W22: PRAHRAN | X22: 0 | Y22: 1 | Z22: 0 | AA22: 78 | AB22: 99 | AC22: 78.787878787878782 | AD22: 0 | CB22: {GOTO}BJ203~/M{RIGHT 7}{END}{DOWN}~G104~
A23: WAVERLEY | C23: STONE | F23: HORKINGS | I23: REID | L23: OWENS | N23: ALLAN | Q23: POORE | W23: WILLIAMSTOWN | X23: 0 | Y23: 1 | Z23: 0 | AA23: 75 | AB23: 100 | AC23: 75 | AD23: 0 | CB23: {GOTO}AL103~/M{END}{RIGHT}{END}{DOWN}~P103~
A24: GOALKICKERS | W24: SANDRINGHAM | X24: 0 | Y24: 1 | Z24: 0 | AA24: 80 | AB24: 125 | AC24: 64 | AD24: 0 | CB24: {GOTO}BJ223~/M{RIGHT 7}{END}{DOWN}~V104~
A25: GEELONG WEST | C25: TENABEL 7 | F25: McLEAN 5 | I25: EMOND 4 | K25: GRATTON 2 | N25: SMITH | P25: BARRY | CB25: {GOTO}BJ243~/M{RIGHT 7}{END}{DOWN}~G124~
A26: WAVERLEY | C26: OWENS 4 | F26: REID 3 | I26: STONE 2 | K26: BROWN | M26: B ALLAN | O26: TATTERSON | R26: POORE | CB26: {GOTO}AL123~/M{END}{RIGHT}{END}{DOWN}~P123~
CB27: {GOTO}BJ263~/M{RIGHT 7}{END}{DOWN}~V124~
A28: COBURG | C28: 4 | D28: 5 | E28: =C28*6+D28 -> 29 | G28: 8 | H28: 6 | I28: =G28*6+H28 -> 54 | K28: 13 | L28: 12 | M28: =K28*6+L28 -> 90 | O28: 14 | P28: 16 | Q28: =O28*6+P28 -> 100 | S28: WILLIAMSTOWN | CB28: {GOTO}BJ283~/M{RIGHT 7}{END}{DOWN}~G144~
A29: WILLIAMSTOWN | C29: 2 | D29: 2 | E29: =C29*6+D29 -> 14 | G29: 10 | H29: 5 | I29: =G29*6+H29 -> 65 | K29: 11 | L29: 7 | M29: =K29*6+L29 -> 73 | O29: 11 | P29: 9 | Q29: =O29*6+P29 -> 75 | S29: GAMBETTA | CB29: {GOTO}AL143~/M{END}{RIGHT}{END}{DOWN}~P143~
A30: BEST PLAYERS | CB30: {GOTO}BJ303~/M{RIGHT 7}{END}{DOWN}~V144~
A31: COBURG | C31: SULLIVAN | F31: McCARTHY | I31: LAWSON | L31: MORRISON | O31: GALE | Q31: WHELAN | CB31: {GOTO}BJ323~/M{RIGHT 7}{END}{DOWN}~G164~
A32: WILLIAMSTOW | C32: BARNES | F32: JACKMAN | I32: MULLIGAN | L32: JOHNSTON | O32: PERCY | Q32: RUSSELL | CB32: {GOTO}AL163~/M{END}{RIGHT}{END}{DOWN}~P163~
A33: GOALKICKERS | CB33: {GOTO}BJ343~/M{RIGHT 7}{END}{DOWN}~V164~
A34: COBURG | C34: GALE 2 | F34: McCARTHY 2 | I34: HEPPER 2 | K34: MORRISON 2 | N34: LAWSON | P34: SULLIVAN | R34: ERWIN | T34: MARSH | V34: McEWAN | X34: POBYAN | CB34: {HOME}
A35: WILLIAMSTOW | C35: MULLIGAN 4 | F35: JACKMAN 3 | I35: PATTERSON 2 | L35: HYNES | N35: PERCY
A37: PRESTON | C37: 2 | D37: 3 | E37: =C37*6+D37 -> 15 | G37: 6 | H37: 9 | I37: =G37*6+H37 -> 45 | K37: 8 | L37: 10 | M37: =K37*6+L37 -> 58 | O37: 18 | P37: 17 | Q37: =O37*6+P37 -> 125 | S37: PRESTON
A38: SANDRINGHAM | C38: 7 | D38: 2 | E38: =C38*6+D38 -> 44 | G38: 8 | H38: 4 | I38: =G38*6+H38 -> 52 | K38: 11 | L38: 8 | M38: =K38*6+L38 -> 74 | O38: 12 | P38: 8 | Q38: =O38*6+P38 -> 80 | S38: ANDERSON
A39: BEST PLAYERS
A40: PRESTON | C40: WEIGHTMAN | F40: CHAPMAN | I40: DICKSON | L40: THORNLEY | O40: SCHICKERT | R40: NICOLL
A41: SANDRINGHAM | C41: WILLS | F41: HUTCHINSON | I41: BROWNE | L41: SCHWARZMAN | O41: WALFORD | R41: CLARKE
A42: GOALKICKERS
A43: PRESTON | C43: WEIGHTMAN 5 | F43: LEMPRIERE 3 | I43: LE GASSICK 2 | L43: MOYLAN 2 | N43: NICHOL 2 | P43: GOAD | R43: DICKSON | T43: THORNLEY | W43: CHAPMAN
A44: SANDRINGHAM | C44: CLARKE 4 | F44: J WARD 2 | I44: MORRIS | K44: BROWNE | M44: MURPHY | O44: WALFORD | Q44: CHISNALL | T44: K WILLS
A46: OAKLEIGH | C46: 3 | D46: 4 | E46: =C46*6+D46 -> 22 | G46: 9 | H46: 11 | I46: =G46*6+H46 -> 65 | K46: 9 | L46: 13 | M46: =K46*6+L46 -> 67 | O46: 14 | P46: 16 | Q46: =O46*6+P46 -> 100 | S46: PORT MELBOURNE
A47: PORT MELBOURNE | C47: 3 | D47: 2 | E47: =C47*6+D47 -> 20 | G47: 5 | H47: 8 | I47: =G47*6+H47 -> 38 | K47: 9 | L47: 15 | M47: =K47*6+L47 -> 69 | O47: 13 | P47: 17 | Q47: =O47*6+P47 -> 95 | S47: TURNER
A48: BEST PLAYERS
A49: OAKLEIGH | C49: BILLING | F49: STEPHENS | I49: BISHOP | L49: M QUINN | O49: MURNANE | R49: SMITH
A50: PORT MELBOURNE | C50: P SMITH | F50: COOK | I50: N GOSS | L50: BUCKLEY | O50: GROVER | R50: S ANDERSON
A51: GOALKICKERS
A52: OAKLEIGH | C52: MURNANE 3 | F52: FORSTER 3 | I52: BISHOP 2 | K52: FORD 2 | M52: T QUINN | O52: JOHNSON | Q52: GATES | S52: M QUINN
A53: PORT MELBOURNE | C53: N GOSS 4 | F53: JOHN 2 | I53: P SMITH 2 | L53: BEHAN | N53: BUCKLEY | P53: S ANDERSON | S53: WILLIAMS | V53: G ANDERSON
A55: ROUND 2 | D55: 15TH APRIL | J55: WEATHER
D56: 1ST QTR | H56: 2ND QTR | L56: 3RD QTR | P56: FINAL | S56: PLAYED AT
A57: PRESTON | C57: 8 | D57: 6 | E57: =C57*6+D57 -> 54 | G57: 8 | H57: 7 | I57: =G57*6+H57 -> 55 | K57: 12 | L57: 14 | M57: =K57*6+L57 -> 86 | O57: 13 | P57: 14 | Q57: =O57*6+P57 -> 92 | S57: GEELONG WEST | X57: LADDER | AB57: ROUND | AD57: 2
A58: GEELONG WEST | C58: 0 | D58: 0 | E58: =C58*6+D58 -> 0 | G58: 2 | H58: 4 | I58: =G58*6+H58 -> 16 | K58: 4 | L58: 5 | M58: =K58*6+L58 -> 29 | O58: 9 | P58: 12 | Q58: =O58*6+P58 -> 66 | S58: UMPIRE
A59: BEST PLAYERS | S59: FLANAGAN | W59: TEAM | X59: W | Y59: L | Z59: D | AA59: FOR | AB59: AGST | AC59: % | AD59: PTS
A60: PRESTON | C60: THORNLEY | F60: WEIGHTMAN | I60: LE GASSICK | L60: HILL | N60: GOAD | P60: ALLEN
A61: GEELONG WEST | C61: SMITH | F61: LINDSAY | I61: MARSDEN | L61: EGAN | N61: ROOM | P61: TREVASKIS | W61: DANDENONG | X61: 2 | Y61: 0 | Z61: 0 | AA61: 228 | AB61: 153 | AC61: 149.01960784313727 | AD61: 8
A62: GOALKICKERS | W62: PRESTON | X62: 2 | Y62: 0 | Z62: 0 | AA62: 217 | AB62: 146 | AC62: 148.63013698630138 | AD62: 8
A63: PRESTON | C63: LE GASSICK 3 | F63: DICKSON 3 | I63: ALLEN 3 | K63: MOYLAN | M63: CHAPMAN | O63: HUNT | Q63: BAIRD | W63: COBURG | X63: 1 | Y63: 1 | Z63: 0 | AA63: 190 | AB63: 181 | AC63: 104.97237569060773 | AD63: 4
A64: GEELONG WEST | C64: SMITH 4 | F64: ANDJELKOVIC 2 | J64: McLEAN | L64: HAMER | N64: MARSDEN | W64: WAVERLEY | X64: 1 | Y64: 1 | Z64: 0 | AA64: 218 | AB64: 217 | AC64: 100.46082949308756 | AD64: 4
A66: DANDENONG | C66: 6 | D66: 3 | E66: =C66*6+D66 -> 39 | G66: 7 | H66: 4 | I66: =G66*6+H66 -> 46 | K66: 11 | L66: 14 | M66: =K66*6+L66 -> 80 | O66: 19 | P66: 15 | Q66: =O66*6+P66 -> 129 | S66: DANDENONG | W66: GEELONG WEST | X66: 1 | Y66: 1 | Z66: 0 | AA66: 196 | AB66: 198 | AC66: 98.98989898989899 | AD66: 4
A67: PORT MELBOURNE | C67: 2 | D67: 2 | E67: =C67*6+D67 -> 14 | G67: 6 | H67: 7 | I67: =G67*6+H67 -> 43 | K67: 8 | L67: 7 | M67: =K67*6+L67 -> 55 | O67: 11 | P67: 9 | Q67: =O67*6+P67 -> 75 | S67: McMASTER | W67: PRAHRAN | X67: 1 | Y67: 1 | Z67: 0 | AA67: 184 | AB67: 189 | AC67: 97.354497354497354 | AD67: 4
A68: BEST PLAYERS | W68: WILLIAMSTOWN | X68: 1 | Y68: 1 | Z68: 0 | AA68: 179 | AB68: 191 | AC68: 93.72 | AD68: 4
A69: DANDENONG | C69: ORCHARD | F69: FLAHERTY | I69: EVANS | L69: HENDRIKSEN | O69: WALKER | Q69: DAVENPORT | W69: OAKLEIGH | X69: 1 | Y69: 1 | Z69: 0 | AA69: 187 | AB69: 207 | AC69: 90.338164251207729 | AD69: 4
A70: PORT MELBOURNE | C70: CAULFIELD | F70: BUCKLEY | I70: WILLIAMS | L70: GROVER | O70: COOK | Q70: BONNETT | W70: SANDRINGHAM | X70: 0 | Y70: 2 | Z70: 0 | AA70: 171 | AB70: 229 | AC70: 74.67 | AD70: 0
A71: GOALKICKERS | W71: PORT MELBOURNE | X71: 0 | Y71: 2 | Z71: 0 | AA71: 170 | AB71: 229 | AC71: 74.235807860262014 | AD71: 0
A72: DANDENONG | C72: FLAHERTY 8 | F72: MADDEN 3 | I72: DAVIES 2 | K72: REID 2 | M72: ELLIS | N72: DAVENPORT | Q72: ESLER | S72: HIBBERT
A73: PORT MELBOURNE | C73: P SMITH 3 | F73: AANENSEN 3 | I73: WILLIAMS 2 | L73: BEHAN | N73: G ANDERSON | Q73: COOK
A75: WAVERLEY | C75: 4 | D75: 4 | E75: =C75*6+D75 -> 28 | G75: 7 | H75: 8 | I75: =G75*6+H75 -> 50 | K75: 12 | L75: 11 | M75: =K75*6+L75 -> 83 | O75: 16 | P75: 16 | Q75: =O75*6+P75 -> 112 | S75: OAKLEIGH
A76: OAKLEIGH | C76: 5 | D76: 4 | E76: =C76*6+D76 -> 34 | G76: 8 | H76: 7 | I76: =G76*6+H76 -> 55 | K76: 10 | L76: 10 | M76: =K76*6+L76 -> 70 | O76: 12 | P76: 15 | Q76: =O76*6+P76 -> 87 | S76: ABBOTT
A77: BEST PLAYERS
A78: WAVERLEY | C78: POORE | F78: THIESSON | I78: OWENS | L78: B ALLAN | O78: SYKES | R78: HORKINGS
A79: OAKLEIGH | C79: BILLING | F79: M QUINN | I79: STANTON | L79: FORSTER | O79: MURNANE | R79: SYKES
A80: GOALKICKERS
A81: WAVERLEY | C81: POORE 5 | F81: B ALLAN 3 | I81: GOSPER 2 | K81: HORKINGS 2 | N81: REID | P81: BROWN | R81: O'BRIEN | U81: BELL
A82: OAKLEIGH | C82: GATES 3 | F82: BISHOP 2 | I82: JOHNSON 2 | L82: BILLING 2 | N82: MURNANE | Q82: FORD | R82: M QUINN
A84: WILLIAMSTOWN | C84: 2 | D84: 2 | E84: =C84*6+D84 -> 14 | G84: 9 | H84: 4 | I84: =G84*6+H84 -> 58 | K84: 10 | L84: 8 | M84: =K84*6+L84 -> 68 | O84: 15 | P84: 14 | Q84: =O84*6+P84 -> 104 | S84: BEACH ROAD
A85: SANDRINGHAM | C85: 2 | D85: 4 | E85: =C85*6+D85 -> 16 | G85: 3 | H85: 8 | I85: =G85*6+H85 -> 26 | K85: 10 | L85: 14 | M85: =K85*6+L85 -> 74 | O85: 12 | P85: 19 | Q85: =O85*6+P85 -> 91 | S85: JACKSON
A86: BEST PLAYERS
A87: WILLIAMSTOWN | C87: JACKMAN | F87: PERCY | I87: VAUGHAN | L87: RUSSELL | O87: MULLIGAN | R87: HEMLEY
A88: SANDRINGHAM | C88: K CLARKE | F88: MURPHY | I88: ELLIS | L88: BROWNE | O88: SCHWARZMAN | R88: SPURRELL
A89: GOALKICKERS
A90: WILLIAMSTOWN | C90: MULLIGAN 5 | F90: JACKMAN 3 | I90: PATTERSON | L90: PERCY | N90: DAY | P90: VAUGHAN | R90: SMITH | T90: STARK | V90: WALLACE
A91: SANDRINGHAM | C91: CLARKE 4 | F91: J WARD 3 | I91: WALFORD | K91: CHISNALL | M91: SPURRELL | O91: SCHWARTZMANN | S91: DOUTHIE
A93: PRAHRAN | C93: 0 | D93: 1 | E93: =C93*6+D93 -> 1 | G93: 7 | H93: 3 | I93: =G93*6+H93 -> 45 | K93: 10 | L93: 6 | M93: =K93*6+L93 -> 66 | O93: 16 | P93: 10 | Q93: =O93*6+P93 -> 106 | S93: COBURG
A94: COBURG | C94: 8 | D94: 3 | E94: =C94*6+D94 -> 51 | G94: 9 | H94: 10 | I94: =G94*6+H94 -> 64 | K94: 13 | L94: 11 | M94: =K94*6+L94 -> 89 | O94: 13 | P94: 12 | Q94: =O94*6+P94 -> 90 | S94: TURNER
A95: BEST PLAYERS
A96: PRAHRAN | C96: KENNEALLY | F96: CUMMING | I96: ROSE | L96: ANDERSON | O96: PAYNE | R96: CULPIN
A97: COBURG | C97: HEPPER | F97: GALE | I97: LAWSON | L97: ERWIN | O97: MORRISON
A98: GOALKICKERS
A99: PRAHRAN | C99: CUMMING 3 | F99: KENNEALLY 3 | I99: KARANICHOLAS 2 | M99: PAYNE 2 | O99: DOWSING 2 | R99: BARTLETT | U99: BASTIEN | W99: PEACH | X99: HUTCHESSON
A100: COBURG | C100: GALE 3 | E100: HEPPER 2 | G100: MORRISON 2 | J100: ERWIN 2 | M100: McCARTHY | P100: McEWAN | R100: FINCHER | U100: BARNETT
A102: ROUND 3 | E102: 9TH MAY | M102: WEATHER | Q102: FINE
D103: 1ST QTR | H103: 2ND QTR | L103: 3RD QTR | P103: FINAL | S103: PLAYED AT
A104: PRESTON | C104: 6 | D104: 12 | E104: =C104*6+D104 -> 48 | G104: 10 | H104: 14 | I104: =G104*6+H104 -> 74 | K104: 19 | L104: 24 | M104: =K104*6+L104 -> 138 | O104: 24 | P104: 28 | Q104: =O104*6+P104 -> 172 | S104: PRESTON | X104: LADDER | AB104: ROUND | AD104: 3
A105: WAVERLEY | C105: 1 | D105: 0 | E105: =C105*6+D105 -> 6 | G105: 4 | H105: 6 | I105: =G105*6+H105 -> 30 | K105: 6 | L105: 8 | M105: =K105*6+L105 -> 44 | O105: 8 | P105: 12 | Q105: =O105*6+P105 -> 60 | S105: UMPIRE
A106: BEST PLAYERS | S106: HOLZER | W106: TEAM | X106: W | Y106: L | Z106: D | AA106: FOR | AB106: AGST | AC106: % | AD106: PTS
A107: PRESTON | C107: NICOLL | F107: CHAPMAN | I107: HUNT | L107: LEMPRIERE | O107: DICKSON | R107: MOYLAN
A108: WAVERLEY | C108: HORKINGS | F108: BROWN | I108: P STEPHENS | L108: THIESSON | O108: POORE | R108: REID | W108: PRESTON | X108: 3 | Y108: 0 | Z108: 0 | AA108: 390 | AB108: 206 | AC108: 189.32038834951456 | AD108: 12
A109: GOALKICKERS | M109: WEIGHTMAN | P109: ALLEN | R109: SLATER | W109: DANDENONG | X109: 2 | Y109: 1 | Z109: 0 | AA109: 316 | AB109: 267 | AC109: 118.35205992509363 | AD109: 8
A110: PRESTON | C110: LEMPRIERE 5 | F110: CHAPMAN 4 | I110: LE GASSICK 3 | L110: MOYLAN 3 | N110: NICHOL 2 | Q110: DICKSON 2 | T110: HUNT 2 | W110: GEELONG WEST | X110: 2 | Y110: 1 | Z110: 0 | AA110: 314 | AB110: 288 | AC110: 109.02777777777777 | AD110: 8
A111: WAVERLEY | C111: HORKINGS 3 | F111: OWENS 2 | I111: POORE 2 | L111: REID | W111: OAKLEIGH | X111: 2 | Y111: 1 | Z111: 0 | AA111: 321 | AB111: 308 | AC111: 104.22077922077922 | AD111: 8
A113: GEELONG WEST | C113: 5 | D113: 6 | E113: =C113*6+D113 -> 36 | G113: 9 | H113: 11 | I113: =G113*6+H113 -> 65 | K113: 11 | L113: 12 | M113: =K113*6+L113 -> 78 | O113: 17 | P113: 16 | Q113: =O113*6+P113 -> 118 | S113: GEELONG WEST | W113: COBURG | X113: 1 | Y113: 2 | Z113: 0 | AA113: 280 | AB113: 299 | AC113: 93.645484949832777 | AD113: 4
A114: COBURG | C114: 1 | D114: 3 | E114: =C114*6+D114 -> 9 | G114: 4 | H114: 7 | I114: =G114*6+H114 -> 31 | K114: 10 | L114: 13 | M114: =K114*6+L114 -> 73 | O114: 12 | P114: 18 | Q114: =O114*6+P114 -> 90 | S114: DUGARD | W114: SANDRINGHAM | X114: 1 | Y114: 2 | Z114: 0 | AA114: 285 | AB114: 317 | AC114: 89.91 | AD114: 4
A115: BEST PLAYERS | W115: WILLIAMSTOWN | X115: 1 | Y115: 2 | Z115: 0 | AA115: 260 | AB115: 293 | AC115: 88.74 | AD115: 4
A116: GEELONG WEST | C116: BRYANT | F116: ROOM | I116: EMOND | L116: SMITH | O116: GRATTON | R116: McLEAN | W116: PRAHRAN | X116: 1 | Y116: 2 | Z116: 0 | AA116: 285 | AB116: 323 | AC116: 88.235294117647058 | AD116: 4
A117: COBURG | C117: LAWSON | F117: FINCHER | I117: BARNETT | L117: HEPPER | O117: GALE | R117: TYTLER | W117: PORT MELBOURNE | X117: 1 | Y117: 2 | Z117: 0 | AA117: 272 | AB117: 310 | AC117: 87.741935483870961 | AD117: 4
A118: GOALKICKERS | W118: WAVERLEY | X118: 1 | Y118: 2 | Z118: 0 | AA118: 278 | AB118: 390 | AC118: 71.282051282051285 | AD118: 4
A119: GEELONG WEST | C119: McLEAN 3 | E119: EMOND 3 | G119: GRATTON 2 | J119: SMITH 2 | L119: BARRY 2 | N119: M BROWNE 2 | Q119: ROOM 2 | S119: PIEC
A120: COBURG | C120: FARMER 4 | F120: LAWSON 3 | I120: MORRISON 2 | L120: GALE | N120: HEPPER | P120: BARNETT | R120: WESCOMBE
A122: OAKLEIGH | C122: 4 | D122: 1 | E122: =C122*6+D122 -> 25 | G122: 8 | H122: 5 | I122: =G122*6+H122 -> 53 | K122: 15 | L122: 6 | M122: =K122*6+L122 -> 96 | O122: 20 | P122: 14 | Q122: =O122*6+P122 -> 134 | S122: TOORAK PARK
A123: PRAHRAN | C123: 7 | D123: 4 | E123: =C123*6+D123 -> 46 | G123: 9 | H123: 5 | I123: =G123*6+H123 -> 59 | K123: 15 | L123: 5 | M123: =K123*6+L123 -> 95 | O123: 15 | P123: 11 | Q123: =O123*6+P123 -> 101 | S123: GAMBETTA
A124: BEST PLAYERS
A125: OAKLEIGH | C125: FORSTER | G125: STANTON | J125: KING | M125: LINNELL | P125: BILLING | S125: STEWART
A126: PRAHRAN | C126: HUTCHESSON | G126: JOHNSTON | J126: KNOX | M126: PAYNE | P126: CROWE
A127: GOALKICKERS
A128: OAKLEIGH | C128: JOHNSON 5 | F128: MURNANE 3 | I128: FORD 3 | K128: M QUINN 3 | N128: FORSTER 2 | Q128: GATES | S128: BILLING | U128: TRAILL | W128: KING
A129: PRAHRAN | C129: KNOX 5 | F129: BARTLETT 2 | I129: PAYNE 2 | K129: DOWSING 2 | N129: KARANICHOLAS | R129: CUMMING | U129: PEACH | W129: HUTCHESSON
A131: PORT MELBOURNE | C131: 1 | D131: 6 | E131: =C131*6+D131 -> 12 | G131: 3 | H131: 13 | I131: =G131*6+H131 -> 31 | K131: 7 | L131: 15 | M131: =K131*6+L131 -> 57 | O131: 14 | P131: 18 | Q131: =O131*6+P131 -> 102 | S131: WILLIAMSTOWN
A132: WILLIAMSTOWN | C132: 2 | D132: 1 | E132: =C132*6+D132 -> 13 | G132: 6 | H132: 5 | I132: =G132*6+H132 -> 41 | K132: 9 | L132: 7 | M132: =K132*6+L132 -> 61 | O132: 12 | P132: 9 | Q132: =O132*6+P132 -> 81 | S132: ANDERSON
A133: BEST PLAYERS
A134: PORT MELBOURNE | C134: N GOSS | F134: BUCKLEY | I134: AANENSEN | L134: CAULFIELD | O134: MALLETT | R134: P SMITH
A135: WILLIAMSTOWN | C135: BARNES | F135: MULLIGAN | I135: WALLIS | L135: DEY | O135: JOHNSTON | R135: HEMLEY
A136: GOALKICKERS
A137: PORT MELBOURNE | C137: N GOSS 5 | F137: WILLIAMS 3 | I137: P SMITH 2 | L137: HARLAND 2 | O137: JOHN | Q137: AANENSEN
A138: WILLIAMSTOWN | C138: MULLIGAN 5 | F138: PATTERSON 4 | I138: JACKMAN 2 | L138: WALLACE
A140: SANDRINGHAM | C140: 4 | D140: 3 | E140: =C140*6+D140 -> 27 | G140: 8 | H140: 5 | I140: =G140*6+H140 -> 53 | K140: 9 | L140: 7 | M140: =K140*6+L140 -> 61 | O140: 17 | P140: 12 | Q140: =O140*6+P140 -> 114 | S140: DANDENONG
A141: DANDENONG | C141: 4 | D141: 6 | E141: =C141*6+D141 -> 30 | G141: 5 | H141: 11 | I141: =G141*6+H141 -> 41 | K141: 12 | L141: 16 | M141: =K141*6+L141 -> 88 | O141: 12 | P141: 16 | Q141: =O141*6+P141 -> 88 | S141: CHINN
A142: BEST PLAYERS
A143: SANDRINGHAM | C143: BROWNE | F143: SARAU | I143: ELLIS | L143: HUTCHINSON | O143: DOUTHIE | R143: SAMPSON
A144: DANDENONG | C144: EVANS | F144: SHINNERS | I144: HENRIKSEN | L144: MADDEN | O144: HIBBERT | R144: MELAI
A145: GOALKICKERS
A146: SANDRINGHAM | C146: DOUTHIE 5 | F146: CLARKE 2 | I146: J WARD 2 | K146: MORRIS 2 | M146: HUTCHINSON 2 | P146: SARAU 2 | R146: SCHWARTZMANN | W146: SAMPSON
A147: DANDENONG | C147: MADDEN 5 | F147: FLAHERTY 2 | I147: MELAI 2 | K147: HIBBERT | M147: ORCHARD | P147: EVANS
A149: ROUND 4 | E149: 16TH MAY | M149: WEATHER | Q149: FINE | S149: PLAYED AT
D150: 1ST QTR | H150: 2ND QTR | L150: 3RD QTR | P150: FINAL | S150: OAKLEIGH
A151: DANDENONG | C151: 5 | D151: 2 | E151: =C151*6+D151 -> 32 | G151: 10 | H151: 7 | I151: =G151*6+H151 -> 67 | K151: 15 | L151: 11 | M151: =K151*6+L151 -> 101 | O151: 26 | P151: 14 | Q151: =O151*6+P151 -> 170 | S151: UMPIRE | X151: LADDER | AB151: ROUND | AD151: 4
A152: OAKLEIGH | C152: 2 | D152: 2 | E152: =C152*6+D152 -> 14 | G152: 9 | H152: 6 | I152: =G152*6+H152 -> 60 | K152: 10 | L152: 9 | M152: =K152*6+L152 -> 69 | O152: 15 | P152: 12 | Q152: =O152*6+P152 -> 102 | S152: HOLZER
A153: BEST PLAYERS | W153: TEAM | X153: W | Y153: L | Z153: D | AA153: FOR | AB153: AGST | AC153: % | AD153: PTS
A154: DANDENONG | C154: MELAI | F154: EVANS | I154: WALKER | L154: HIBBERT | O154: MILLER | Q154: DAVENPORT
A155: OAKLEIGH | C155: STEPHENS | F155: STEWART | I155: MURNANE | L155: JOHNSON | O155: KING | Q155: GATES | W155: PRESTON | X155: 4 | Y155: 0 | Z155: 0 | AA155: 539 | AB155: 282 | AC155: 191.13 | AD155: 16
A156: GOALKICKERS | Q156: MELAI | S156: SOUTHERN | W156: DANDENONG | X156: 3 | Y156: 1 | Z156: 0 | AA156: 486 | AB156: 369 | AC156: 131.70731707317074 | AD156: 12
A157: DANDENONG | C157: HIBBERT 5 | E157: MILLER 5 | G157: FLAHERTY 4 | J157: DAVENPORT 4 | M157: MADDEN 3 | P157: EVANS 2 | R157: ESLER | W157: SANDRINGHAM | X157: 2 | Y157: 2 | Z157: 0 | AA157: 431 | AB157: 412 | AC157: 104.61 | AD157: 8
A158: OAKLEIGH | C158: MURNANE 4 | F158: JOHNSON 4 | I158: GATES 2 | K158: FORSTER | M158: FORD | O158: BILLING | Q158: M QUINN | S158: TRAILL | W158: PORT MELBOURNE | X158: 2 | Y158: 2 | Z158: 0 | AA158: 404 | AB158: 401 | AC158: 100.74812967581047 | AD158: 8
A160: PRESTON | C160: 5 | D160: 5 | E160: =C160*6+D160 -> 35 | G160: 9 | H160: 9 | I160: =G160*6+H160 -> 63 | K160: 15 | L160: 14 | M160: =K160*6+L160 -> 104 | O160: 21 | P160: 23 | Q160: =O160*6+P160 -> 149 | S160: COBURG | W160: GEELONG WEST | X160: 2 | Y160: 2 | Z160: 0 | AA160: 409 | AB160: 434 | AC160: 94.239631336405523 | AD160: 8
A161: COBURG | C161: 3 | D161: 2 | E161: =C161*6+D161 -> 20 | G161: 6 | H161: 4 | I161: =G161*6+H161 -> 40 | K161: 6 | L161: 8 | M161: =K161*6+L161 -> 44 | O161: 11 | P161: 10 | Q161: =O161*6+P161 -> 76 | S161: McKENZIE | W161: OAKLEIGH | X161: 2 | Y161: 2 | Z161: 0 | AA161: 423 | AB161: 478 | AC161: 88.493723849372387 | AD161: 8
A162: BEST PLAYERS | W162: WAVERLEY | X162: 2 | Y162: 2 | Z162: 0 | AA162: 424 | AB162: 524 | AC162: 80.916030534351151 | AD162: 8
A163: PRESTON | C163: HILL | E163: NICOLL | H163: IRELAND | K163: CHAPMAN | N163: LE GASSICK | Q163: BAIRD | W163: WILLIAMSTOWN | X163: 1 | Y163: 3 | Z163: 0 | AA163: 394 | AB163: 439 | AC163: 89.75 | AD163: 4
A164: COBURG | C164: GALE | E164: ERWIN | H164: TYTLER | K164: HOWELL | N164: FINCHER | Q164: ELVERY | W164: PRAHRAN | X164: 1 | Y164: 3 | Z164: 0 | AA164: 376 | AB164: 455 | AC164: 82.637362637362642 | AD164: 4
A165: GOALKICKERS | W165: COBURG | X165: 1 | Y165: 3 | Z165: 0 | AA165: 356 | AB165: 448 | AC165: 79.46 | AD165: 4
A166: PRESTON | C166: BAIRD 8 | E166: LE GASSICK 5 | H166: NICHOL 3 | J166: CHAPMAN 3 | M166: DICKSON | O166: IRELAND
A167: COBURG | C167: GALE 2 | E167: LAWSON 2 | H167: HEPPER | J167: MORRISON | M167: ERWIN | N167: MARSH | P167: BARNETT | R167: FARMER | U167: HOWELL
A169: SANDRINGHAM | C169: 7 | D169: 4 | E169: =C169*6+D169 -> 46 | G169: 12 | H169: 8 | I169: =G169*6+H169 -> 80 | K169: 13 | L169: 12 | M169: =K169*6+L169 -> 90 | O169: 21 | P169: 20 | Q169: =O169*6+P169 -> 146 | S169: BEACH ROAD
A170: GEELONG WEST | C170: 3 | D170: 4 | E170: =C170*6+D170 -> 22 | G170: 7 | H170: 10 | I170: =G170*6+H170 -> 52 | K170: 10 | L170: 16 | M170: =K170*6+L170 -> 76 | O170: 13 | P170: 17 | Q170: =O170*6+P170 -> 95 | S170: ABBOTT
A171: BEST PLAYERS
A172: SANDRINGHAM | C172: HUTCHINSON | F172: MORRIS | I172: J WARD | L172: MURPHY | O172: K CLARKE | R172: SAMPSON
A173: GEELONG WEST | C173: HAMER | F173: COLLEY | I173: GRATTON | L173: ANDJELKOVIC | O173: BRYANT | R173: McLEAN
A174: GOALKICKERS
A175: SANDRINGHAM | C175: HUTCHINSON 4 | F175: J WARD 3 | I175: SCHWARTZMANN 3 | M175: ZEUSCHNER 3 | P175: CLARKE 2 | R175: MORRIS 2 | U175: DOUTHIE 2
A176: GEELONG WEST | C176: GRATTON 4 | F176: McLEAN 3 | I176: SMITH 2 | K176: PIEC 2 | M176: ANDJELKOVIC | P176: COLLEY
A178: PORT MELBOURNE | C178: 5 | D178: 2 | E178: =C178*6+D178 -> 32 | G178: 8 | H178: 8 | I178: =G178*6+H178 -> 56 | K178: 11 | L178: 10 | M178: =K178*6+L178 -> 76 | O178: 19 | P178: 18 | Q178: =O178*6+P178 -> 132 | S178: PORT MELBOURNE
A179: PRAHRAN | C179: 1 | D179: 4 | E179: =C179*6+D179 -> 10 | G179: 4 | H179: 12 | I179: =G179*6+H179 -> 36 | K179: 10 | L179: 16 | M179: =K179*6+L179 -> 76 | O179: 12 | P179: 19 | Q179: =O179*6+P179 -> 91 | S179: FLANAGAN
A180: BEST PLAYERS
A181: PORT MELBOURNE | C181: BUCKLEY | F181: N GOSS | I181: COOK | K181: MALLET | N181: HARLAND | Q181: BEHAN
A182: PRAHRAN | C182: BARTLETT | F182: DOWSING | I182: CROWE | K182: HUTCHESSON | N182: CULPIN | Q182: JOHNSTON
A183: GOALKICKERS
A184: PORT MELBOURNE | C184: N GOSS 4 | F184: COOK 4 | H184: P SMITH 3 | J184: WILLIAMS 3 | M184: BUCKLEY | O184: G ANDERSON | R184: CARLON
A185: PRAHRAN | C185: BARTLETT 5 | F185: KARANICHOLAS 2 | J185: PAYNE 2 | M185: KNOX | O185: DOWSING | Q185: JOHNSTON
A187: WAVERLEY | C187: 5 | D187: 5 | E187: =C187*6+D187 -> 35 | G187: 11 | H187: 7 | I187: =G187*6+H187 -> 73 | K187: 20 | L187: 11 | M187: =K187*6+L187 -> 131 | O187: 22 | P187: 14 | Q187: =O187*6+P187 -> 146 | S187: WAVERLEY
A188: WILLIAMSTOWN | C188: 3 | D188: 0 | E188: =C188*6+D188 -> 18 | G188: 10 | H188: 5 | I188: =G188*6+H188 -> 65 | K188: 13 | L188: 9 | M188: =K188*6+L188 -> 87 | O188: 20 | P188: 14 | Q188: =O188*6+P188 -> 134 | S188: McMASTER
A189: BEST PLAYERS
A190: WAVERLEY | C190: GOSPER | F190: CRUSE | I190: HARRY | L190: PITTS | O190: B ALLAN | R190: STONE
A191: WILLIAMSTOWN | C191: MULLIGAN | F191: JACKMAN | I191: PATTERSON | L191: SVORINICH | O191: PERCY | R191: DUNLOP
A192: GOALKICKERS
A193: WAVERLEY | C193: HARRY 5 | F193: STONE 4 | H193: B ALLAN 3 | K193: STEPHENS 3 | N193: LEES 2 | P193: REID | Q193: GOSPER | S193: HORKINGS | V193: PITTS | X193: BLEW
A194: WILLIAMSTOWN | C194: PATTERSON 6 | F194: MULLIGAN 5 | I194: SVORINICH 4 | L194: JACKMAN | N194: SMITH | P194: STARK
A196: ROUND 5 | E196: 23RD MAY | M196: WEATHER | Q196: FINE | S196: PLAYED AT
D197: 1ST QTR | H197: 2ND QTR | L197: 3RD QTR | P197: FINAL | S197: BEACH ROAD
A198: PORT MELBOURNE | C198: 5 | D198: 3 | E198: =C198*6+D198 -> 33 | G198: 11 | H198: 9 | I198: =G198*6+H198 -> 75 | K198: 16 | L198: 14 | M198: =K198*6+L198 -> 110 | O198: 20 | P198: 18 | Q198: =O198*6+P198 -> 138 | S198: UMPIRE | X198: LADDER | AB198: ROUND | AD198: 5
A199: SANDRINGHAM | C199: 5 | D199: 2 | E199: =C199*6+D199 -> 32 | G199: 8 | H199: 6 | I199: =G199*6+H199 -> 54 | K199: 10 | L199: 10 | M199: =K199*6+L199 -> 70 | O199: 16 | P199: 14 | Q199: =O199*6+P199 -> 110 | S199: DUGARD
A200: BEST PLAYERS | W200: TEAM | X200: W | Y200: L | Z200: D | AA200: FOR | AB200: AGST | AC200: % | AD200: PTS
A201: PORT MELBOURNE | C201: DAVIS | F201: BUCKLEY | I201: GOSS | K201: COOK | N201: G ALLEN | Q201: GROVER
A202: SANDRINGHAM | C202: HUTCHINSON | F202: CHISNALL | I202: K CLARKE | K202: BROWNE | N202: J WARD | Q202: SARAU | W202: PRESTON | X202: 4 | Y202: 1 | Z202: 0 | AA202: 627 | AB202: 382 | AC202: 164.14 | AD202: 16
A203: GOALKICKERS | W203: DANDENONG | X203: 4 | Y203: 1 | Z203: 0 | AA203: 616 | AB203: 480 | AC203: 128.33333333333334 | AD203: 16
A204: PORT MELBOURNE | C204: WILLIAMS 7 | F204: N GOSS 3 | H204: DAVIS 3 | J204: CARLON 2 | M204: HOLT 2 | O204: COOK | Q204: G ANDERSON | T204: HARLAND | W204: PORT MELBOURNE | X204: 3 | Y204: 2 | Z204: 0 | AA204: 542 | AB204: 511 | AC204: 106.0665362035225 | AD204: 12
A205: SANDRINGHAM | C205: J WARD 5 | F205: MORRIS 3 | I205: SARAU 3 | K205: HUTCHINSON 2 | N205: ZEUSCHNER 2 | Q205: WALFORD | W205: OAKLEIGH | X205: 3 | Y205: 2 | Z205: 0 | AA205: 555 | AB205: 609 | AC205: 91.13300492610837 | AD205: 12
A207: DANDENONG | C207: 5 | D207: 2 | E207: =C207*6+D207 -> 32 | G207: 8 | H207: 5 | I207: =G207*6+H207 -> 53 | K207: 13 | L207: 13 | M207: =K207*6+L207 -> 91 | O207: 19 | P207: 16 | Q207: =O207*6+P207 -> 130 | S207: GEELONG WEST | W207: SANDRINGHAM | X207: 2 | Y207: 3 | Z207: 0 | AA207: 541 | AB207: 550 | AC207: 98.36 | AD207: 8
A208: GEELONG WEST | C208: 2 | D208: 6 | E208: =C208*6+D208 -> 18 | G208: 9 | H208: 9 | I208: =G208*6+H208 -> 63 | K208: 12 | L208: 11 | M208: =K208*6+L208 -> 83 | O208: 16 | P208: 15 | Q208: =O208*6+P208 -> 111 | S208: GAMBETTA | W208: WILLIAMSTOWN | X208: 2 | Y208: 3 | Z208: 0 | AA208: 494 | AB208: 527 | AC208: 93.74 | AD208: 8
A209: BEST PLAYERS | W209: GEELONG WEST | X209: 2 | Y209: 3 | Z209: 0 | AA209: 520 | AB209: 564 | AC209: 92.198581560283685 | AD209: 8
A210: DANDENONG | C210: ORCHARD | F210: STEDWELL | I210: HIBBERT | L210: MILLER | N210: EVANS | Q210: ELLIS | W210: PRAHRAN | X210: 2 | Y210: 3 | Z210: 0 | AA210: 521 | AB210: 572 | AC210: 91.08391608391608 | AD210: 8
A211: GEELONG WEST | C211: EMOND | F211: ANDJELKOVIC | I211: LINDSAY | L211: BARRY | N211: R BROWNE | Q211: BRYANT | W211: WAVERLEY | X211: 2 | Y211: 3 | Z211: 0 | AA211: 541 | AB211: 669 | AC211: 80.866965620328855 | AD211: 8
A212: GOALKICKERS | R212: STEDWELL | W212: COBURG | X212: 1 | Y212: 4 | Z212: 0 | AA212: 487 | AB212: 580 | AC212: 83.97 | AD212: 4
A213: DANDENONG | C213: MILLER 8 | E213: REID 3 | G213: HIBBERT 2 | I213: ORCHARD 2 | L213: DAVIES | N213: ELLIS | P213: MELAI | R213: ANDREWS
A214: GEELONG WEST | C214: EMOND 4 | E214: McLEAN 3 | H214: SMITH 2 | J214: BRYANT 2 | M214: GRATTON | O214: BARRY | Q214: ANDJELKOVIC | T214: HAMER | W214: M BROWNE
A216: PRAHRAN | C216: 6 | D216: 4 | E216: =C216*6+D216 -> 40 | G216: 14 | H216: 6 | I216: =G216*6+H216 -> 90 | K216: 16 | L216: 8 | M216: =K216*6+L216 -> 104 | O216: 22 | P216: 13 | Q216: =O216*6+P216 -> 145 | S216: TOORAK PARK
A217: WAVERLEY | C217: 2 | D217: 4 | E217: =C217*6+D217 -> 16 | G217: 6 | H217: 9 | I217: =G217*6+H217 -> 45 | K217: 12 | L217: 12 | M217: =K217*6+L217 -> 84 | O217: 17 | P217: 15 | Q217: =O217*6+P217 -> 117 | S217: ANDERSON
A218: BEST PLAYERS
A219: PRAHRAN | C219: ROSE | F219: CROWE | I219: JOHNSTON | L219: BARTLETT | O219: KENNEALLY | R219: GRANGE
A220: WAVERLEY | C220: B ALLAN | F220: PITTS | I220: OWENS | L220: GOSPER | O220: STONE | R220: MORDEN
A221: GOALKICKERS
A222: PRAHRAN | C222: BARTLETT 7 | F222: DOWSING 3 | I222: KARANICHOLAS 2 | M222: HUTCHESSON 2 | P222: ROBERTSON 2 | S222: KNOX | U222: ROSE | W222: JOHNSTON | X222: CROWE | Z222: CUMMING | AB222: MARINKO
A223: WAVERLEY | C223: OWENS 4 | F223: B ALLAN 2 | I223: PITTS 2 | K223: BLEW 2 | M223: STONE | O223: POORE | Q223: GOSPER | S223: HORKINGS | V223: HARRY | X223: LEES | Z223: SYKES
A225: OAKLEIGH | C225: 4 | D225: 3 | E225: =C225*6+D225 -> 27 | G225: 9 | H225: 9 | I225: =G225*6+H225 -> 63 | K225: 16 | L225: 17 | M225: =K225*6+L225 -> 113 | O225: 19 | P225: 18 | Q225: =O225*6+P225 -> 132 | S225: COBURG
A226: COBURG | C226: 5 | D226: 5 | E226: =C226*6+D226 -> 35 | G226: 13 | H226: 8 | I226: =G226*6+H226 -> 86 | K226: 16 | L226: 15 | M226: =K226*6+L226 -> 111 | O226: 18 | P226: 23 | Q226: =O226*6+P226 -> 131 | S226: CHINN
A227: BEST PLAYERS
A228: OAKLEIGH | C228: KING | F228: MURNANE | I228: HOWELL | L228: SYKES | O228: STANTON | R228: FORSTER
A229: COBURG | C229: MORRISON | F229: McCARTHY | I229: GALE | L229: FARMER | O229: MARSH | R229: ERWIN
A230: GOALKICKERS
A231: OAKLEIGH | C231: MURNANE 5 | F231: GATES 3 | H231: KING 3 | J231: JOHNSON 2 | M231: HOWELL 2 | P231: STEPHENS 2 | S231: M QUINN | V231: PROWSE
A232: COBURG | C232: FARMER 5 | F232: MARSH 3 | I232: HEPPER 2 | K232: MORRISON 2 | N232: ERWIN 2 | P232: PAUL 2 | R232: BARNETT | U232: BRENNAN
A234: WILLIAMSTOWN | C234: 4 | D234: 3 | E234: =C234*6+D234 -> 27 | G234: 8 | H234: 9 | I234: =G234*6+H234 -> 57 | K234: 11 | L234: 13 | M234: =K234*6+L234 -> 79 | O234: 14 | P234: 16 | Q234: =O234*6+P234 -> 100 | S234: WILLIAMSTOWN
A235: PRESTON | C235: 1 | D235: 3 | E235: =C235*6+D235 -> 9 | G235: 7 | H235: 8 | I235: =G235*6+H235 -> 50 | K235: 10 | L235: 14 | M235: =K235*6+L235 -> 74 | O235: 12 | P235: 16 | Q235: =O235*6+P235 -> 88 | S235: TURNER
A236: BEST PLAYERS
A237: WILLIAMSTOWN | C237: JOHNSTON | F237: WALLACE | I237: SVORINICH | L237: STARK | O237: BARNES | R237: HEMLEY
A238: PRESTON | C238: NICHOL | F238: HUNT | I238: SCHICKERT | L238: HILL | O238: LE GASSICK | R238: BAIRD
A239: GOALKICKERS
A240: WILLIAMSTOWN | C240: PATTERSON 3 | F240: SVORINICH 3 | I240: MULLIGAN 2 | L240: WALLACE 2 | O240: FENTON 2 | Q240: JACKMAN | T240: HEMLEY
A241: PRESTON | C241: LE GASSICK 4 | F241: BAIRD 4 | I241: WEIGHTMAN | L241: MOYLAN | N241: NICHOL | P241: ALLEN
A243: ROUND 6 | E243: 30TH MAY | J243: WEATHER | N243: SOUTH WIND WET | S243: PLAYED AT
D244: 1ST QTR | H244: 2ND QTR | L244: 3RD QTR | P244: FINAL | S244: OAKLEIGH
A245: SANDRINGHAM | C245: 2 | D245: 2 | E245: =C245*6+D245 -> 14 | G245: 5 | H245: 7 | I245: =G245*6+H245 -> 37 | K245: 7 | L245: 9 | M245: =K245*6+L245 -> 51 | O245: 11 | P245: 10 | Q245: =O245*6+P245 -> 76 | S245: UMPIRE | X245: LADDER | AB245: ROUND | AD245: 6
A246: OAKLEIGH | C246: 6 | D246: 6 | E246: =C246*6+D246 -> 42 | G246: 6 | H246: 8 | I246: =G246*6+H246 -> 44 | K246: 8 | L246: 11 | M246: =K246*6+L246 -> 59 | O246: 8 | P246: 14 | Q246: =O246*6+P246 -> 62 | S246: FLANAGAN
A247: BEST PLAYERS | W247: TEAM | X247: W | Y247: L | Z247: D | AA247: FOR | AB247: AGST | AC247: % | AD247: PTS
A248: SANDRINGHAM | C248: WALFORD | F248: ELLIS | I248: LOCKHART | L248: HUTCHISON | O248: SARAU | Q248: DOUTHIE
A249: OAKLEIGH | C249: FORD | F249: SYKES | I249: STANTON | L249: CHINN | O249: KING | Q249: FORSTER | W249: PRESTON | X249: 5 | Y249: 1 | Z249: 0 | AA249: 725 | AB249: 479 | AC249: 151.36 | AD249: 20
A250: GOALKICKERS | W250: DANDENONG | X250: 5 | Y250: 1 | Z250: 0 | AA250: 691 | AB250: 532 | AC250: 129.88721804511277 | AD250: 20
A251: SANDRINGHAM | C251: CLARKE 3 | F251: DOUTHIE 3 | I251: J WARD 2 | L251: MORRIS | N251: HUTCHINSON | Q251: SARAU | W251: PORT MELBOURNE | X251: 4 | Y251: 2 | Z251: 0 | AA251: 653 | AB251: 584 | AC251: 111.81506849315069 | AD251: 16
A252: OAKLEIGH | C252: MURNANE 4 | F252: JOHNSON 2 | I252: FORD | K252: CHINN | W252: SANDRINGHAM | X252: 3 | Y252: 3 | Z252: 0 | AA252: 617 | AB252: 612 | AC252: 100.82 | AD252: 12
A254: WILLIAMSTOWN | C254: 6 | D254: 6 | E254: =C254*6+D254 -> 42 | G254: 6 | H254: 6 | I254: =G254*6+H254 -> 42 | K254: 10 | L254: 11 | M254: =K254*6+L254 -> 71 | O254: 12 | P254: 12 | Q254: =O254*6+P254 -> 84 | S254: WILLIAMSTOWN | W254: WILLIAMSTOWN | X254: 3 | Y254: 3 | Z254: 0 | AA254: 578 | AB254: 596 | AC254: 96.98 | AD254: 12
A255: GEELONG WEST | C255: 0 | D255: 0 | E255: =C255*6+D255 -> 0 | G255: 5 | H255: 7 | I255: =G255*6+H255 -> 37 | K255: 7 | L255: 9 | M255: =K255*6+L255 -> 51 | O255: 9 | P255: 15 | Q255: =O255*6+P255 -> 69 | S255: HOLZER | W255: OAKLEIGH | X255: 3 | Y255: 3 | Z255: 0 | AA255: 617 | AB255: 685 | AC255: 90.072992700729927 | AD255: 12
A256: BEST PLAYERS | W256: PRAHRAN | X256: 2 | Y256: 4 | Z256: 0 | AA256: 618 | AB256: 670 | AC256: 92.238805970149258 | AD256: 8
A257: WILLIAMSTOWN | C257: HARVEY | F257: VAN LIMPD | I257: VAUGHAN | L257: PATTERSON | O257: HEMLEY | R257: MULLIGAN | W257: GEELONG WEST | X257: 2 | Y257: 4 | Z257: 0 | AA257: 589 | AB257: 648 | AC257: 90.895061728395063 | AD257: 8
A258: GEELONG WEST | C258: R BROWNE | F258: SMITH | I258: LINDSAY | L258: BRYANT | O258: MARSDEN | R258: M BROWNE | W258: WAVERLEY | X258: 2 | Y258: 4 | Z258: 0 | AA258: 614 | AB258: 780 | AC258: 78.717948717948715 | AD258: 8
A259: GOALKICKERS | W259: COBURG | X259: 1 | Y259: 5 | Z259: 0 | AA259: 539 | AB259: 655 | AC259: 82.29 | AD259: 4
A260: WILLIAMSTOWN | C260: VAN LIEMPD 4 | F260: MULLIGAN 3 | I260: PATTERSON 3 | L260: WALLACE | O260: BARNES
A261: GEELONG WEST | C261: EMOND 2 | F261: SMITH 2 | I261: M BROWNE 2 | L261: McLEAN | N261: HAMER | P261: COLLEY
A263: PRESTON | C263: 3 | D263: 3 | E263: =C263*6+D263 -> 21 | G263: 7 | H263: 5 | I263: =G263*6+H263 -> 47 | K263: 11 | L263: 6 | M263: =K263*6+L263 -> 72 | O263: 15 | P263: 8 | Q263: =O263*6+P263 -> 98 | S263: PRESTON
A264: PRAHRAN | C264: 2 | D264: 1 | E264: =C264*6+D264 -> 13 | G264: 8 | H264: 4 | I264: =G264*6+H264 -> 52 | K264: 12 | L264: 7 | M264: =K264*6+L264 -> 79 | O264: 15 | P264: 7 | Q264: =O264*6+P264 -> 97 | S264: McMASTER
A265: BEST PLAYERS
A266: PRESTON | C266: WEIGHTMAN | F266: IRELAND | I266: HILL | L266: THORNLEY | O266: MARTIN | Q266: FISHER
A267: PRAHRAN | C267: DOWSING | F267: KARANICHOLAS | I267: JOHNSTON | L267: CULPIN | O267: ROSE | Q267: HUTCHESSON
A268: GOALKICKERS
A269: PRESTON | C269: WEIGHTMAN 3 | F269: BAIRD 3 | I269: IRELAND 3 | L269: DICKSON 2 | N269: LE GASSICK | Q269: NICHOL | S269: CHAPMAN | V269: MARTIN
A270: PRAHRAN | C270: DOWSING 4 | F270: BAIRD 3 | I270: ANDERSON 2 | L270: HUTCHESSON 2 | O270: BARTLETT | Q270: KARANICHOLAS | U270: CROWE
A272: PORT MELBOURNE | C272: 2 | D272: 1 | E272: =C272*6+D272 -> 13 | G272: 6 | H272: 3 | I272: =G272*6+H272 -> 39 | K272: 10 | L272: 6 | M272: =K272*6+L272 -> 66 | O272: 16 | P272: 15 | Q272: =O272*6+P272 -> 111 | S272: PORT MELBOURNE
A273: WAVERLEY | C273: 4 | D273: 5 | E273: =C273*6+D273 -> 29 | G273: 5 | H273: 8 | I273: =G273*6+H273 -> 38 | K273: 8 | L273: 12 | M273: =K273*6+L273 -> 60 | O273: 10 | P273: 13 | Q273: =O273*6+P273 -> 73 | S273: McKENZIE
A274: BEST PLAYERS
A275: PORT MELBOURNE | C275: WILLIAMS | F275: GOSS | I275: GROVER | L275: BUCKLEY | O275: COOK | R275: CAULFIELD
A276: WAVERLEY | C276: GOSPER | F276: PITTS | I276: HORKINGS | L276: POORE | O276: LANCASHIRE | R276: B ALLAN
A277: GOALKICKERS
A278: PORT MELBOURNE | C278: WILLIAMS 7 | F278: BONNETT 3 | I278: N GOSS 2 | L278: P SMITH 2 | O278: CARLON | Q278: CARTER
A279: WAVERLEY | C279: LANCASHIRE 3 | F279: B ALLAN 2 | I279: POORE | K279: GOSPER | M279: HORKINGS | O279: BELL | Q279: HARRY
A281: DANDENONG | C281: 2 | D281: 1 | E281: =C281*6+D281 -> 13 | G281: 6 | H281: 4 | I281: =G281*6+H281 -> 40 | K281: 8 | L281: 6 | M281: =K281*6+L281 -> 54 | O281: 11 | P281: 9 | Q281: =O281*6+P281 -> 75 | S281: DANDENONG
A282: COBURG | C282: 4 | D282: 3 | E282: =C282*6+D282 -> 27 | G282: 5 | H282: 5 | I282: =G282*6+H282 -> 35 | K282: 5 | L282: 10 | M282: =K282*6+L282 -> 40 | O282: 7 | P282: 10 | Q282: =O282*6+P282 -> 52 | S282: ABBOTT
A283: BEST PLAYERS
A284: DANDENONG | C284: EVANS | F284: REID | I284: WALKER | L284: STEDWELL | O284: SHINNERS | R284: KENDALL
A285: COBURG | C285: BRENNAN | F285: MORRISON | I285: FINCHER | L285: ELVERY | O285: CURWOOD | R285: MARSH
A286: GOALKICKERS
A287: DANDENONG | C287: REID 4 | F287: KENDALL 2 | I287: MILLER 2 | L287: SOUTHERN 2 | O287: DAVIES
A288: COBURG | C288: MORRISON 3 | F288: WHELAN 2 | I288: LAWSON | L288: POLUJAH
A290: ROUND 7 | E290: 6TH JUNE | J290: WEATHER | N290: NORTH EAST WIND FINE | S290: PLAYED AT
D291: 1ST QTR | H291: 2ND QTR | L291: 3RD QTR | P291: FINAL | S291: PRESTON
A292: PRESTON | C292: 1 | D292: 1 | E292: =C292*6+D292 -> 7 | G292: 6 | H292: 7 | I292: =G292*6+H292 -> 43 | K292: 11 | L292: 12 | M292: =K292*6+L292 -> 78 | O292: 17 | P292: 13 | Q292: =O292*6+P292 -> 115 | S292: UMPIRE | X292: LADDER | AB292: ROUND | AD292: 7
A293: PORT MELBOURNE | C293: 3 | D293: 5 | E293: =C293*6+D293 -> 23 | G293: 5 | H293: 7 | I293: =G293*6+H293 -> 37 | K293: 7 | L293: 11 | M293: =K293*6+L293 -> 53 | O293: 11 | P293: 14 | Q293: =O293*6+P293 -> 80 | S293: GAMBETTA
A294: BEST PLAYERS | W294: TEAM | X294: W | Y294: L | Z294: D | AA294: FOR | AB294: AGST | AC294: % | AD294: PTS
A295: PRESTON | C295: WEIGHTMAN | F295: THORNLEY | I295: LE GASSICK | L295: IRELAND | O295: DICKSON | R295: MARTIN
A296: PORT MELBOURNE | C296: COOK | F296: GOSS | I296: AANENSEN | L296: DAVIS | O296: BONNETT | R296: BUCKLEY | W296: PRESTON | X296: 6 | Y296: 1 | Z296: 0 | AA296: 840 | AB296: 559 | AC296: 150.27 | AD296: 24
A297: GOALKICKERS | W297: DANDENONG | X297: 6 | Y297: 1 | Z297: 0 | AA297: 804 | AB297: 622 | AC297: 129.26045016077171 | AD297: 24
A298: PRESTON | C298: LE GASSICK 5 | F298: BAIRD 3 | H298: IRELAND 3 | J298: SLATER 2 | M298: DICKSON | O298: ALLEN | Q298: MARTIN | S298: SCHICKERT | W298: PORT MELBOURNE | X298: 4 | Y298: 3 | Z298: 0 | AA298: 733 | AB298: 699 | AC298: 104.86409155937054 | AD298: 16
A299: PORT MELBOURNE | C299: AANENSEN 3 | F299: N GOSS 2 | I299: BUCKLEY 2 | L299: WILLIAMS 2 | O299: BONNETT 2 | W299: SANDRINGHAM | X299: 4 | Y299: 3 | Z299: 0 | AA299: 739 | AB299: 729 | AC299: 101.37 | AD299: 16
A301: PRAHRAN | C301: 7 | D301: 9 | E301: =C301*6+D301 -> 51 | G301: 11 | H301: 13 | I301: =G301*6+H301 -> 79 | K301: 14 | L301: 10 | M301: =K301*6+L301 -> 94 | O301: 21 | P301: 23 | Q301: =O301*6+P301 -> 149 | S301: TOORAK PARK | W301: OAKLEIGH | X301: 4 | Y301: 3 | Z301: 0 | AA301: 750 | AB301: 789 | AC301: 95.06 | AD301: 16
A302: WILLIAMSTOWN | C302: 6 | D302: 3 | E302: =C302*6+D302 -> 39 | G302: 10 | H302: 7 | I302: =G302*6+H302 -> 67 | K302: 15 | L302: 8 | M302: =K302*6+L302 -> 98 | O302: 16 | P302: 10 | Q302: =O302*6+P302 -> 106 | S302: DUGARD | W302: PRAHRAN | X302: 3 | Y302: 4 | Z302: 0 | AA302: 767 | AB302: 776 | AC302: 98.840206185567013 | AD302: 12
A303: BEST PLAYERS | W303: WILLIAMSTOWN | X303: 3 | Y303: 4 | Z303: 0 | AA303: 684 | AB303: 745 | AC303: 91.81 | AD303: 12
A304: PRAHRAN | C304: PAYNE | F304: THOMAS | I304: KARANICHOLAS | L304: DOWSING | O304: ROBERTSON | R304: CROWE | W304: GEELONG WEST | X304: 2 | Y304: 5 | Z304: 0 | AA304: 693 | AB304: 781 | AC304: 88.73 | AD304: 8
A305: WILLIAMSTOWN | C305: MULLIGAN | F305: JACKMAN | I305: PATTERSON | L305: SVORINICH | O305: DEY | R305: FENTON | W305: WAVERLEY | X305: 2 | Y305: 5 | Z305: 0 | AA305: 704 | AB305: 893 | AC305: 78.835386338185884 | AD305: 8
A306: GOALKICKERS | P306: DOWSING | W306: COBURG | X306: 1 | Y306: 6 | Z306: 0 | AA306: 656 | AB306: 777 | AC306: 84.43 | AD306: 4
A307: PRAHRAN | C307: THOMAS 6 | F307: PAYNE 4 | H307: ROBERTSON 4 | K307: CROWE 2 | M307: FAHEY 2 | O307: KARANICHOLAS | R307: HUTCHESSON
A308: WILLIAMSTOWN | C308: MULLIGAN 5 | F308: SVORINICH 3 | I308: VAN LIEMPD 3 | L308: FENTON 2 | N308: PATTERSON | Q308: PERCY | S308: WILSON
A310: OAKLEIGH | C310: 5 | D310: 5 | E310: =C310*6+D310 -> 35 | G310: 10 | H310: 7 | I310: =G310*6+H310 -> 67 | K310: 16 | L310: 10 | M310: =K310*6+L310 -> 106 | O310: 20 | P310: 13 | Q310: =O310*6+P310 -> 133 | S310: GEELONG WEST
A311: GEELONG WEST | C311: 4 | D311: 6 | E311: =C311*6+D311 -> 30 | G311: 11 | H311: 8 | I311: =G311*6+H311 -> 74 | K311: 12 | L311: 11 | M311: =K311*6+L311 -> 83 | O311: 15 | P311: 14 | Q311: =O311*6+P311 -> 104 | S311: ANDERSON
A312: BEST PLAYERS
A313: OAKLEIGH | C313: MURNANE | F313: JOHNSON | I313: KING | L313: HITCHES | O313: CHINN | Q313: T QUINN
A314: GEELONG WEST | C314: HAMER | F314: BARRY | I314: EMOND | L314: BRYANT | O314: COLLEY | Q314: PIEC
A315: GOALKICKERS
A316: OAKLEIGH | C316: JOHNSON 7 | F316: MURNANE 6 | I316: KING 4 | K316: FORD | M316: CHINN
A317: GEELONG WEST | C317: SMITH 4 | F317: PIEC 4 | H317: EMOND 2 | J317: HAMER 2 | M317: M BROWNE 2 | P317: BRYANT
A319: SANDRINGHAM | C319: 4 | D319: 6 | E319: =C319*6+D319 -> 30 | G319: 8 | H319: 10 | I319: =G319*6+H319 -> 58 | K319: 14 | L319: 13 | M319: =K319*6+L319 -> 97 | O319: 17 | P319: 20 | Q319: =O319*6+P319 -> 122 | S319: BEACH ROAD
A320: COBURG | C320: 1 | D320: 3 | E320: =C320*6+D320 -> 9 | G320: 7 | H320: 8 | I320: =G320*6+H320 -> 50 | K320: 12 | L320: 13 | M320: =K320*6+L320 -> 85 | O320: 17 | P320: 15 | Q320: =O320*6+P320 -> 117 | S320: TORNEY
A321: BEST PLAYERS
A322: SANDRINGHAM | C322: HUTCHNISON | F322: CHISNELL | I322: ELLIS | L322: SARAU | N322: BROWNE | Q322: K CLARKE
A323: COBURG | C323: FINCHER | F323: ERWIN | I323: McCARTHY | L323: GALE | N323: MARSH | Q323: S WHELAN
A324: GOALKICKERS
A325: SANDRINGHAM | C325: CLARKE 4 | F325: DOUTHIE 4 | I325: J WARD 3 | L325: ZEUSCHNER 3 | O325: SCHWARTZMANN | R325: SARAU | T325: ELLIS
A326: COBURG | C326: McCARTHY 5 | F326: GALE 3 | H326: MORRISON 3 | K326: WHELAN 2 | N326: FAWNS 2 | Q326: LAWSON | S326: LAXTON
A328: DANDENONG | C328: 2 | D328: 4 | E328: =C328*6+D328 -> 16 | G328: 10 | H328: 8 | I328: =G328*6+H328 -> 68 | K328: 13 | L328: 10 | M328: =K328*6+L328 -> 88 | O328: 17 | P328: 11 | Q328: =O328*6+P328 -> 113 | S328: WAVERLEY
A329: WAVERLEY | C329: 2 | D329: 4 | E329: =C329*6+D329 -> 16 | G329: 5 | H329: 6 | I329: =G329*6+H329 -> 36 | K329: 6 | L329: 8 | M329: =K329*6+L329 -> 44 | O329: 13 | P329: 12 | Q329: =O329*6+P329 -> 90 | S329: TURNER
A330: BEST PLAYERS
A331: DANDENONG | C331: MELAI | F331: DAVIES | I331: MILLER | L331: HIBBERT | O331: SHINNERS | R331: KENDALL
A332: WAVERLEY | C332: HORKINGS | F332: PITTS | I332: BLEW | L332: HARRY | O332: STEENHOLDT | R332: POORE
A333: GOALKICKERS
A334: DANDENONG | C334: MILLER 9 | F334: HIBBERT 3 | I334: KENDALL 2 | L334: SOUTHERN 2 | O334: DAVIES
A335: WAVERLEY | C335: POORE 2 | E335: HARRY 2 | G335: BLEW 2 | I335: CRUSE 2 | K335: HORKINGS | M335: PITTS | O335: EBERT | Q335: P GRANT | S335: IVEY
A337: ROUND 8 | E337: 13TH JUNE | J337: WEATHER | N337: FINE | S337: PLAYED AT
D338: 1ST QTR | H338: 2ND QTR | L338: 3RD QTR | P338: FINAL | S338: OAKLEIGH
A339: OAKLEIGH | C339: 6 | D339: 5 | E339: =C339*6+D339 -> 41 | G339: 9 | H339: 10 | I339: =G339*6+H339 -> 64 | K339: 15 | L339: 14 | M339: =K339*6+L339 -> 104 | O339: 21 | P339: 17 | Q339: =O339*6+P339 -> 143 | S339: UMPIRE | X339: LADDER | AB339: ROUND | AD339: 8
A340: PRESTON | C340: 3 | D340: 1 | E340: =C340*6+D340 -> 19 | G340: 7 | H340: 7 | I340: =G340*6+H340 -> 49 | K340: 13 | L340: 12 | M340: =K340*6+L340 -> 90 | O340: 15 | P340: 14 | Q340: =O340*6+P340 -> 104 | S340: STIRLING
A341: BEST PLAYERS | W341: TEAM | X341: W | Y341: L | Z341: D | AA341: FOR | AB341: AGST | AC341: % | AD341: PTS
A342: OAKLEIGH | C342: FORD | E342: SYKES | H342: JOHNSON | K342: KING | N342: ROBBINS | Q342: WEST
A343: PRESTON | C343: HILL | E343: IRELAND | H343: LE GASSICK | K343: BAIRD | N343: MARTIN | W343: DANDENONG | X343: 7 | Y343: 1 | Z343: 0 | AA343: 986 | AB343: 713 | AC343: 138.28892005610098 | AD343: 28
A344: GOALKICKERS | W344: PRESTON | X344: 6 | Y344: 2 | Z344: 0 | AA344: 944 | AB344: 702 | AC344: 134.47 | AD344: 24
A345: OAKLEIGH | C345: JOHNSON 9 | F345: FORD 3 | H345: KING 3 | J345: MURNANE 2 | M345: ROBBINS 2 | P345: CHINN | R345: ROBERTS | W345: PORT MELBOURNE | X345: 5 | Y345: 3 | Z345: 0 | AA345: 868 | AB345: 800 | AC345: 108.5 | AD345: 20
A346: PRESTON | C346: BAIRD 5 | F346: LE GASSICK 4 | I346: SLATER 2 | K346: NICHOL | M346: IRELAND | P346: STEWART | R346: MORRIS | W346: OAKLEIGH | X346: 5 | Y346: 3 | Z346: 0 | AA346: 893 | AB346: 893 | AC346: 100 | AD346: 20
A348: PRAHRAN | C348: 0 | D348: 2 | E348: =C348*6+D348 -> 2 | G348: 6 | H348: 6 | I348: =G348*6+H348 -> 42 | K348: 12 | L348: 12 | M348: =K348*6+L348 -> 84 | O348: 16 | P348: 14 | Q348: =O348*6+P348 -> 110 | S348: TOORAK PARK | W348: PRAHRAN | X348: 4 | Y348: 4 | Z348: 0 | AA348: 877 | AB348: 872 | AC348: 100.57339449541284 | AD348: 16
A349: SANDRINGHAM | C349: 5 | D349: 4 | E349: =C349*6+D349 -> 34 | G349: 10 | H349: 6 | I349: =G349*6+H349 -> 66 | K349: 10 | L349: 9 | M349: =K349*6+L349 -> 69 | O349: 14 | P349: 12 | Q349: =O349*6+P349 -> 96 | S349: HOLZER | W349: SANDRINGHAM | X349: 4 | Y349: 4 | Z349: 0 | AA349: 835 | AB349: 839 | AC349: 99.52 | AD349: 16
A350: BEST PLAYERS | W350: WILLIAMSTOWN | X350: 3 | Y350: 5 | Z350: 0 | AA350: 775 | AB350: 927 | AC350: 83.6 | AD350: 12
A351: PRAHRAN | C351: CROWE | F351: KENNEALLY | I351: KARANICHOLAS | L351: HUTCHESSON | O351: MINTON-CONNELL | S351: THOMAS | W351: COBURG | X351: 2 | Y351: 6 | Z351: 0 | AA351: 774 | AB351: 875 | AC351: 88.46 | AD351: 8
A352: SANDRINGHAM | C352: CONNICK | F352: HUTCHISON | I352: BROWNE | L352: LOCKHART | O352: J WARD | S352: ELLIS | W352: GEELONG WEST | X352: 2 | Y352: 6 | Z352: 0 | AA352: 794 | AB352: 916 | AC352: 86.68 | AD352: 8
A353: GOALKICKERS | W353: WAVERLEY | X353: 2 | Y353: 6 | Z353: 0 | AA353: 802 | AB353: 1011 | AC353: 79.32739861523244 | AD353: 8
A354: PRAHRAN | C354: CROWE 7 | F354: KARANICHOLAS 3 | J354: THOMAS 3 | M354: PAYNE | O354: ROBERTSON | R354: FAHEY
A355: SANDRINGHAM | C355: SPURRELL 3 | F355: DOUTHIE 3 | I355: J WARD 2 | L355: SARAU 2 | N355: AUSTIN 2 | Q355: WALFORD | S355: HUTCHINSON
A357: DANDENONG | C357: 8 | D357: 5 | E357: =C357*6+D357 -> 53 | G357: 14 | H357: 6 | I357: =G357*6+H357 -> 90 | K357: 23 | L357: 11 | M357: =K357*6+L357 -> 149 | O357: 28 | P357: 14 | Q357: =O357*6+P357 -> 182 | S357: DANDENONG
A358: WILLIAMSTOWN | C358: 1 | D358: 1 | E358: =C358*6+D358 -> 7 | G358: 6 | H358: 3 | I358: =G358*6+H358 -> 39 | K358: 10 | L358: 3 | M358: =K358*6+L358 -> 63 | O358: 14 | P358: 7 | Q358: =O358*6+P358 -> 91 | S358: McKENZIE
A359: BEST PLAYERS
A360: DANDENONG | C360: EVANS | F360: HENRIKSEN | I360: REID | L360: MELAI | O360: SHEEHAN | R360: MILLER
A361: WILLIAMSTOWN | C361: LANE | F361: VAUGHAN | I361: JOHNSON | L361: JACKMAN | O361: HARVEY | R361: BARNES
A362: GOALKICKERS
A363: DANDENONG | C363: MILLER 7 | F363: DAVIES 6 | I363: REID 5 | K363: SHEEHAN 5 | N363: ELLIS 3 | P363: SOUTHERN | S363: FRANKLIN
A364: WILLIAMSTOWN | C364: JACKMAN 5 | F364: MULLIGAN 3 | I364: SVORINICH 2 | L364: PATTERSON | O364: PERCY | Q364: FENTON | S364: HARVEY
A366: COBURG | C366: 5 | D366: 6 | E366: =C366*6+D366 -> 36 | G366: 6 | H366: 10 | I366: =G366*6+H366 -> 46 | K366: 14 | L366: 14 | M366: =K366*6+L366 -> 98 | O366: 17 | P366: 16 | Q366: =O366*6+P366 -> 118 | S366: COBURG
A367: WAVERLEY | C367: 1 | D367: 3 | E367: =C367*6+D367 -> 9 | G367: 2 | H367: 9 | I367: =G367*6+H367 -> 21 | K367: 7 | L367: 10 | M367: =K367*6+L367 -> 52 | O367: 14 | P367: 14 | Q367: =O367*6+P367 -> 98 | S367: FLANAGAN
A368: BEST PLAYERS
A369: COBURG | C369: BRENNAN | F369: HOBBS | I369: FARMER | L369: PERKINS | O369: MARSH | R369: GALE
A370: WAVERLEY | C370: HORKINGS | F370: LANCASHIRE | I370: PITTS | L370: B ALLAN | O370: R ALLAN | R370: GOSPER
A371: GOALKICKERS
A372: COBURG | C372: GALE 4 | F372: McCARTHY 3 | I372: MORRISON 3 | L372: LAWSON 2 | N372: WHELAN 2 | Q372: LAXTON 2 | T372: HOBBS
A373: WAVERLEY | C373: LANCASHIRE 5 | F373: B ALLAN 4 | I373: P GRANT 2 | L373: GOSPER | N373: HORKINGS | Q373: SYKES
A375: PORT MELBOURNE | C375: 7 | D375: 4 | E375: =C375*6+D375 -> 46 | G375: 12 | H375: 4 | I375: =G375*6+H375 -> 76 | K375: 17 | L375: 7 | M375: =K375*6+L375 -> 109 | O375: 21 | P375: 9 | Q375: =O375*6+P375 -> 135 | S375: GEELONG WEST
A376: GEELONG WEST | C376: 1 | D376: 5 | E376: =C376*6+D376 -> 11 | G376: 7 | H376: 8 | I376: =G376*6+H376 -> 50 | K376: 12 | L376: 9 | M376: =K376*6+L376 -> 81 | O376: 14 | P376: 17 | Q376: =O376*6+P376 -> 101 | S376: McMASTER
A377: BEST PLAYERS
A378: PORT MELBOURNE | C378: BUCKLEY | F378: COOK | I378: N GOSS | L378: BONNETT | O378: AANENSEN | R378: DAVIS
A379: GEELONG WEST | C379: BERRY | F379: McLEAN | I379: LINDSAY | L379: BUTCHER | O379: R BROWNE | R379: HALL
A380: GOALKICKERS
A381: PORT MELBOURNE | C381: BONNETT 5 | F381: N GOSS 4 | I381: BUCKLEY 4 | L381: JOHN 3 | N381: AANENSEN 2 | Q381: HOLT | R381: MALLETT | U381: M ALLEN
A382: GEELONG WEST | C382: McLEAN 7 | F382: EMOND 2 | I382: GRATTON 2 | L382: MARSDEN | N382: M BROWNE | Q382: HOVEY
A384: ROUND 9 | E384: 20TH JUNE | M384: WEATHER | S384: PLAYED AT
D385: 1ST QTR | H385: 2ND QTR | L385: 3RD QTR | P385: FINAL | S385: PRESTON
A386: PRESTON | C386: 6 | D386: 6 | E386: =C386*6+D386 -> 42 | G386: 7 | H386: 8 | I386: =G386*6+H386 -> 50 | K386: 10 | L386: 13 | M386: =K386*6+L386 -> 73 | O386: 11 | P386: 16 | Q386: =O386*6+P386 -> 82 | S386: UMPIRE | X386: LADDER | AB386: ROUND | AD386: 9
A387: DANDENONG | C387: 2 | D387: 2 | E387: =C387*6+D387 -> 14 | G387: 4 | H387: 9 | I387: =G387*6+H387 -> 33 | K387: 6 | L387: 11 | M387: =K387*6+L387 -> 47 | O387: 10 | P387: 18 | Q387: =O387*6+P387 -> 78 | S387: ANDERSON
A388: BEST PLAYERS | W388: TEAM | X388: W | Y388: L | Z388: D | AA388: FOR | AB388: AGST | AC388: % | AD388: PTS
A389: PRESTON | C389: WEIGHTMAN | F389: HILL | I389: IRELAND | L389: MARTIN | N389: GOAD | Q389: DICKSON
A390: DANDENONG | C390: ORCHARD | F390: KENDALL | I390: REID | L390: ELLIS | N390: MILLER | Q390: STEDWELL | W390: DANDENONG | X390: 7 | Y390: 2 | Z390: 0 | AA390: 1064 | AB390: 795 | AC390: 133.83647798742138 | AD390: 28
A391: GOALKICKERS | W391: PRESTON | X391: 7 | Y391: 2 | Z391: 0 | AA391: 1026 | AB391: 780 | AC391: 131.54 | AD391: 28
A392: PRESTON | C392: BAIRD 6 | F392: LE GASSICK 2 | I392: WEIGHTMAN | L392: IRELAND | N392: PAPPAS | W392: PORT MELBOURNE | X392: 6 | Y392: 3 | Z392: 0 | AA392: 945 | AB392: 872 | AC392: 108.37155963302752 | AD392: 24
A393: DANDENONG | C393: MILLER 5 | F393: DAVIES 2 | I393: HIBBERT | K393: SOUTHERN | N393: SHEEHAN | W393: OAKLEIGH | X393: 5 | Y393: 4 | Z393: 0 | AA393: 997 | AB393: 1032 | AC393: 96.61 | AD393: 20
A395: WILLIAMSTOWN | C395: 4 | D395: 1 | E395: =C395*6+D395 -> 25 | G395: 9 | H395: 6 | I395: =G395*6+H395 -> 60 | K395: 14 | L395: 11 | M395: =K395*6+L395 -> 95 | O395: 21 | P395: 13 | Q395: =O395*6+P395 -> 139 | S395: WILLIAMSTOWN | W395: SANDRINGHAM | X395: 4 | Y395: 5 | Z395: 0 | AA395: 889 | AB395: 913 | AC395: 97.37 | AD395: 16
A396: OAKLEIGH | C396: 6 | D396: 1 | E396: =C396*6+D396 -> 37 | G396: 8 | H396: 3 | I396: =G396*6+H396 -> 51 | K396: 13 | L396: 4 | M396: =K396*6+L396 -> 82 | O396: 16 | P396: 8 | Q396: =O396*6+P396 -> 104 | S396: ABBOTT | W396: PRAHRAN | X396: 4 | Y396: 5 | Z396: 0 | AA396: 975 | AB396: 1011 | AC396: 96.439169139465875 | AD396: 16
A397: BEST PLAYERS | W397: WILLIAMSTOWN | X397: 4 | Y397: 5 | Z397: 0 | AA397: 914 | AB397: 1031 | AC397: 88.65 | AD397: 16
A398: WILLIAMSTOWN | C398: JACKMAN | F398: PERCY | I398: O'MARA | K398: LANE | N398: JOHNSON | Q398: BOXALL | W398: GEELONG WEST | X398: 3 | Y398: 6 | Z398: 0 | AA398: 933 | AB398: 1014 | AC398: 92.01 | AD398: 12
A399: OAKLEIGH | C399: KING | F399: MURNANE | I399: SYKES | K399: STANTON | N399: HITCHES | Q399: PROWSE | W399: WAVERLEY | X399: 3 | Y399: 6 | Z399: 0 | AA399: 876 | AB399: 1065 | AC399: 82.25352112676056 | AD399: 12
A400: GOALKICKERS | R400: WILSON | W400: COBURG | X400: 2 | Y400: 7 | Z400: 0 | AA400: 846 | AB400: 952 | AC400: 88.87 | AD400: 8
A401: WILLIAMSTOWN | C401: SVORINICH 5 | F401: BOXALL 5 | I401: STILLMAN 3 | L401: MULLIGAN 2 | O401: JAMES 2 | Q401: MEYERS 2 | S401: JACKMAN
A402: OAKLEIGH | C402: JOHNSON 5 | F402: ROBBINS 5 | I402: MURNANE 3 | L402: FORSTER 2 | O402: CHINN
A404: GEELONG WEST | C404: 2 | D404: 4 | E404: =C404*6+D404 -> 16 | G404: 9 | H404: 10 | I404: =G404*6+H404 -> 64 | K404: 15 | L404: 10 | M404: =K404*6+L404 -> 100 | O404: 21 | P404: 13 | Q404: =O404*6+P404 -> 139 | S404: GEELONG WEST
A405: PRAHRAN | C405: 4 | D405: 8 | E405: =C405*6+D405 -> 32 | G405: 5 | H405: 12 | I405: =G405*6+H405 -> 42 | K405: 10 | L405: 12 | M405: =K405*6+L405 -> 72 | O405: 14 | P405: 14 | Q405: =O405*6+P405 -> 98 | S405: PASK
A406: BEST PLAYERS
A407: GEELONG WEST | C407: McLEAN | F407: TENABEL | I407: BRYANT | L407: M BROWNE | O407: GRATTON | R407: STACEY
A408: PRAHRAN | C408: BARTLETT | F408: MINTON-CONNELL | J408: DOWSING | M408: MARINKO | O408: PAYNE | R408: HUTCHESSON
A409: GOALKICKERS
A410: GEELONG WEST | C410: McLEAN 9 | F410: BRYANT 4 | I410: TENABEL 3 | L410: M BROWNE 2 | O410: EMOND | Q410: GRATTON | S410: STACEY
A411: PRAHRAN | C411: BARTLETT 6 | F411: DOWSING 3 | I411: PAYNE 2 | K411: CROWE
A413: WAVERLEY | C413: 5 | D413: 4 | E413: =C413*6+D413 -> 34 | G413: 6 | H413: 7 | I413: =G413*6+H413 -> 43 | K413: 8 | L413: 13 | M413: =K413*6+L413 -> 61 | O413: 9 | P413: 20 | Q413: =O413*6+P413 -> 74 | S413: WAVERLEY
A414: SANDRINGHAM | C414: 1 | D414: 4 | E414: =C414*6+D414 -> 10 | G414: 3 | H414: 5 | I414: =G414*6+H414 -> 23 | K414: 7 | L414: 11 | M414: =K414*6+L414 -> 53 | O414: 7 | P414: 12 | Q414: =O414*6+P414 -> 54 | S414: GAMBETTA
A415: BEST PLAYERS
A416: WAVERLEY | C416: PITTS | F416: IVEY | I416: SYKES | L416: BROWN | O416: GOSPER | R416: HORKINGS
A417: SANDRINGHAM | C417: ELLIS | F417: CLARKE | I417: SAMPSON | L417: SARAU | O417: CHISNELL | R417: WALFORD
A418: GOALKICKERS
A419: WAVERLEY | C419: BLEW 3 | F419: B ALLAN 2 | I419: P GRANT 2 | L419: LANCASHIRE | O419: LAKE
A420: SANDRINGHAM | C420: CLARKE 3 | F420: J WARD | I420: SPURRELL | L420: SARAU | O420: SAMPSON
A422: PORT MELBOURNE | C422: 3 | D422: 1 | E422: =C422*6+D422 -> 19 | G422: 5 | H422: 2 | I422: =G422*6+H422 -> 32 | K422: 7 | L422: 7 | M422: =K422*6+L422 -> 49 | O422: 11 | P422: 11 | Q422: =O422*6+P422 -> 77 | S422: PORT MELBOURNE
A423: COBURG | C423: 3 | D423: 2 | E423: =C423*6+D423 -> 20 | G423: 7 | H423: 5 | I423: =G423*6+H423 -> 47 | K423: 9 | L423: 7 | M423: =K423*6+L423 -> 61 | O423: 10 | P423: 12 | Q423: =O423*6+P423 -> 72 | S423: DUGARD
A424: BEST PLAYERS
A425: PORT MELBOURNE | C425: CAULFIELD | F425: COOK | I425: BUCKLEY | L425: G ALLEN | O425: OPPY | Q425: GOSS
A426: COBURG | C426: HOBBS | F426: ERWIN | I426: McCARTHY | L426: BRENNAN | O426: MARSH | Q426: MORRISON
A427: GOALKICKERS
A428: PORT MELBOURNE | C428: BONNETT 3 | F428: G ANDERSON 2 | J428: MALLETT 2 | M428: P SMITH | O428: BUCKLEY | Q428: AANENSEN | T428: COOK
A429: COBURG | C429: McCARTHY 6 | F429: GALE 2 | H429: LAWSON | J429: ROBINSON
A431: ROUND 10 | D431: 27TH JUNE | I431: WEATHER | S431: PLAYED AT
D432: 1ST QTR | H432: 2ND QTR | L432: 3RD QTR | P432: FINAL | S432: BEACH ROAD
A433: SANDRINGHAM | C433: 4 | D433: 5 | E433: =C433*6+D433 -> 29 | G433: 7 | H433: 12 | I433: =G433*6+H433 -> 54 | K433: 8 | L433: 16 | M433: =K433*6+L433 -> 64 | O433: 12 | P433: 20 | Q433: =O433*6+P433 -> 92 | S433: UMPIRE | X433: LADDER | AB433: ROUND | AD433: 10
A434: PRESTON | C434: 2 | D434: 8 | E434: =C434*6+D434 -> 20 | G434: 3 | H434: 12 | I434: =G434*6+H434 -> 30 | K434: 6 | L434: 15 | M434: =K434*6+L434 -> 51 | O434: 8 | P434: 21 | Q434: =O434*6+P434 -> 69 | S434: ABBOTT
A435: BEST PLAYERS | W435: TEAM | X435: W | Y435: L | Z435: D | AA435: FOR | AB435: AGST | AC435: % | AD435: PTS
A436: SANDRINGHAM | C436: BUSSE | E436: ELLIS | H436: CHISNALL | K436: K CLARKE | N436: HUTCHINSON | Q436: PAGE
A437: PRESTON | C437: HILL | E437: ALLEN | H437: WEIGHTMAN | K437: DICKSON | N437: GOAD | Q437: MARTIN | W437: DANDENONG | X437: 8 | Y437: 2 | Z437: 0 | AA437: 1193 | AB437: 879 | AC437: 135.72241183162686 | AD437: 32
A438: GOALKICKERS | W438: PRESTON | X438: 7 | Y438: 3 | Z438: 0 | AA438: 1095 | AB438: 872 | AC438: 125.57 | AD438: 28
A439: SANDRINGHAM | C439: SAMPSON 4 | F439: CLARKE 3 | I439: SARAU 2 | K439: J WARD | M439: CHISNALL | O439: SPURRELL | W439: OAKLEIGH | X439: 6 | Y439: 4 | Z439: 0 | AA439: 1157 | AB439: 1118 | AC439: 103.49 | AD439: 24
A440: PRESTON | C440: ALLEN 2 | F440: BAIRD 2 | I440: DICKSON | K440: THORNLEY | M440: MARTIN | O440: SHEARER | W440: PORT MELBOURNE | X440: 6 | Y440: 4 | Z440: 0 | AA440: 1031 | AB440: 1032 | AC440: 99.903100775193792 | AD440: 24
A442: DANDENONG | C442: 2 | D442: 5 | E442: =C442*6+D442 -> 17 | G442: 10 | H442: 8 | I442: =G442*6+H442 -> 68 | K442: 13 | L442: 10 | M442: =K442*6+L442 -> 88 | O442: 19 | P442: 15 | Q442: =O442*6+P442 -> 129 | S442: DANDENONG | W442: SANDRINGHAM | X442: 5 | Y442: 5 | Z442: 0 | AA442: 981 | AB442: 982 | AC442: 99.9 | AD442: 20
A443: PRAHRAN | C443: 4 | D443: 4 | E443: =C443*6+D443 -> 28 | G443: 5 | H443: 4 | I443: =G443*6+H443 -> 34 | K443: 12 | L443: 11 | M443: =K443*6+L443 -> 83 | O443: 12 | P443: 12 | Q443: =O443*6+P443 -> 84 | S443: McMASTER | W443: GEELONG WEST | X443: 4 | Y443: 6 | Z443: 0 | AA443: 1075 | AB443: 1137 | AC443: 94.55 | AD443: 16
A444: BEST PLAYERS | W444: PRAHRAN | X444: 4 | Y444: 6 | Z444: 0 | AA444: 1059 | AB444: 1140 | AC444: 92.89473684210526 | AD444: 16
A445: DANDENONG | C445: MILLER | F445: HIBBERT | I445: ORCHARD | L445: ABRAHAM | O445: WALKER | R445: STEDWELL | W445: WILLIAMSTOWN | X445: 4 | Y445: 6 | Z445: 0 | AA445: 1000 | AB445: 1136 | AC445: 88.03 | AD445: 16
A446: PRAHRAN | C446: GRANGE | F446: JUNGWIRTH | I446: CROWE | L446: DICKESON | O446: HUTCHESSON | R446: DOWSING | W446: COBURG | X446: 3 | Y446: 7 | Z446: 0 | AA446: 951 | AB446: 1038 | AC446: 91.62 | AD446: 12
A447: GOALKICKERS | W447: WAVERLEY | X447: 3 | Y447: 7 | Z447: 0 | AA447: 999 | AB447: 1207 | AC447: 82.767191383595687 | AD447: 12
A448: DANDENONG | C448: MILLER 9 | F448: KENDALL 3 | I448: REID 2 | K448: ORCHARD 2 | N448: MADDEN | P448: SOUTHERN | R448: SHEEHAN
A449: PRAHRAN | C449: BARTLETT 2 | F449: PAYNE 2 | I449: ROBERTSON 2 | L449: BAIRD 2 | N449: HUTCHESSON | Q449: MARINKO | S449: FAHEY | U449: WALKER
E450: 4TH JULY | M450: WEATHER
A451: OAKLEIGH | C451: 7 | D451: 2 | E451: =C451*6+D451 -> 44 | G451: 13 | H451: 3 | I451: =G451*6+H451 -> 81 | K451: 19 | L451: 3 | M451: =K451*6+L451 -> 117 | O451: 26 | P451: 4 | Q451: =O451*6+P451 -> 160 | S451: OAKLEIGH
A452: PORT MELBOURNE | C452: 2 | D452: 6 | E452: =C452*6+D452 -> 18 | G452: 7 | H452: 14 | I452: =G452*6+H452 -> 56 | K452: 8 | L452: 16 | M452: =K452*6+L452 -> 64 | O452: 11 | P452: 20 | Q452: =O452*6+P452 -> 86 | S452: FLANAGAN
A453: BEST PLAYERS
A454: OAKLEIGH | C454: M QUINN | F454: HITCHES | I454: JOHNSON | L454: STANTON | O454: MURNANE | R454: KING
A455: PORT MELBOURNE | C455: COOK | F455: DAVIS | I455: G ALLEN | L455: CAULFIELD | O455: S ANDERSON | R455: NEAL
A456: GOALKICKERS
A457: OAKLEIGH | C457: JOHNSON 11 | F457: HITCHES 5 | I457: MURNANE 4 | L457: KING 3 | N457: T QUINN | P457: M QUINN | R457: SMITH
A458: PORT MELBOURNE | C458: S ANDERSON 4 | F458: P SMITH 2 | I458: NEAL 2 | K458: N GOSS | M458: DAVIS | O458: BONNETT
A460: GEELONG WEST | C460: 5 | D460: 5 | E460: =C460*6+D460 -> 35 | G460: 9 | H460: 8 | I460: =G460*6+H460 -> 62 | K460: 15 | L460: 14 | M460: =K460*6+L460 -> 104 | O460: 21 | P460: 16 | Q460: =O460*6+P460 -> 142 | S460: GEELONG WEST
A461: WAVERLEY | C461: 6 | D461: 4 | E461: =C461*6+D461 -> 40 | G461: 12 | H461: 8 | I461: =G461*6+H461 -> 80 | K461: 14 | L461: 12 | M461: =K461*6+L461 -> 96 | O461: 18 | P461: 15 | Q461: =O461*6+P461 -> 123 | S461: PASK
A462: BEST PLAYERS
A463: GEELONG WEST | C463: McLEAN | F463: COLLEY | I463: LINDSAY | L463: TENABEL | O463: M BROWNE | R463: BARRY
A464: WAVERLEY | C464: R ALLAN | F464: HORKINGS | I464: GOSPER | L464: LAKE | O464: STONE | R464: PITTS
A465: GOALKICKERS
A466: GEELONG WEST | C466: McLEAN 11 | F466: GRATTON 2 | I466: M BROWNE 2 | L466: COLLEY 2 | N466: BRYANT 2 | Q466: TENABEL | S466: STACEY
A467: WAVERLEY | C467: LAKE 7 | F467: P GRANT 3 | I467: STONE 2 | K467: BLEW 2 | M467: GOSPER | O467: HORKINGS | Q467: LANCASHIRE | T467: THIESSEN
A469: COBURG | C469: 5 | D469: 4 | E469: =C469*6+D469 -> 34 | G469: 7 | H469: 6 | I469: =G469*6+H469 -> 48 | K469: 14 | L469: 13 | M469: =K469*6+L469 -> 97 | O469: 15 | P469: 15 | Q469: =O469*6+P469 -> 105 | S469: COBURG
A470: WILLIAMSTOWN | C470: 2 | D470: 3 | E470: =C470*6+D470 -> 15 | G470: 6 | H470: 10 | I470: =G470*6+H470 -> 46 | K470: 7 | L470: 11 | M470: =K470*6+L470 -> 53 | O470: 12 | P470: 14 | Q470: =O470*6+P470 -> 86 | S470: TURNER
A471: BEST PLAYERS
A472: COBURG | C472: PERKINS | F472: HOBBS | I472: ERWIN | L472: GALE | O472: FARMER | R472: MORRISON
A473: WILLIAMSTOWN | C473: PERCY | F473: JOHNSON | I473: JAMES | L473: SVORINICH | O473: LANE | R473: MULLIGAN
A474: GOALKICKERS
A475: COBURG | C475: McCARTHY 4 | F475: MORRISON 3 | I475: ERWIN 3 | K475: GALE 2 | M475: FARMER 2 | P475: HOBBS
A476: WILLIAMSTOWN | C476: MULLIGAN 3 | F476: JACKMAN 2 | I476: STILLMAN 2 | L476: MEYERS 2 | O476: BOXALL
A478: ROUND 11 | E478: 11TH JULY | M478: WEATHER | Q478: FINE | S478: PLAYED AT
D479: 1ST QTR | H479: 2ND QTR | L479: 3RD QTR | P479: FINAL | S479: PORT MELBOURNE
A480: DANDENONG | C480: 4 | D480: 2 | E480: =C480*6+D480 -> 26 | G480: 10 | H480: 6 | I480: =G480*6+H480 -> 66 | K480: 15 | L480: 11 | M480: =K480*6+L480 -> 101 | O480: 18 | P480: 16 | Q480: =O480*6+P480 -> 124 | S480: UMPIRE | X480: LADDER | AB480: ROUND | AD480: 11
A481: PORT MELBOURNE | C481: 0 | D481: 4 | E481: =C481*6+D481 -> 4 | G481: 4 | H481: 10 | I481: =G481*6+H481 -> 34 | K481: 9 | L481: 12 | M481: =K481*6+L481 -> 66 | O481: 14 | P481: 19 | Q481: =O481*6+P481 -> 103 | S481: STIRLING
A482: BEST PLAYERS | W482: TEAM | X482: W | Y482: L | Z482: D | AA482: FOR | AB482: AGST | AC482: % | AD482: PTS
A483: DANDENONG | C483: ORCHARD | F483: EVANS | I483: STEDWELL | L483: FRANKLIN | O483: SHINNERS | R483: SOUTHERN
A484: PORT MELBOURNE | C484: G ALLEN | F484: BUCKLEY | I484: M ALLEN | L484: MALLETT | O484: DAVIS | R484: HOLT | W484: DANDENONG | X484: 9 | Y484: 2 | Z484: 0 | AA484: 1317 | AB484: 982 | AC484: 134.11405295315683 | AD484: 36
A485: GOALKICKERS | W485: PRESTON | X485: 8 | Y485: 3 | Z485: 0 | AA485: 1216 | AB485: 954 | AC485: 127.46 | AD485: 32
A486: DANDENONG | C486: DAVIES 4 | F486: HIBBERT 3 | I486: SOUTHERN 3 | L486: KENDALL 2 | O486: MILLER 2 | Q486: FRANKLIN 2 | W486: OAKLEIGH | X486: 7 | Y486: 4 | Z486: 0 | AA486: 1255 | AB486: 1185 | AC486: 105.91 | AD486: 28
A487: PORT MELBOURNE | C487: COOK 3 | E487: HARLAND 3 | H487: BUCKLEY 2 | K487: NEAL 2 | M487: HUDSON 2 | P487: M ALLEN | R487: NORTON | W487: SANDRINGHAM | X487: 6 | Y487: 5 | Z487: 0 | AA487: 1116 | AB487: 1101 | AC487: 101.36 | AD487: 24
A489: PRESTON | C489: 4 | D489: 4 | E489: =C489*6+D489 -> 28 | G489: 7 | H489: 6 | I489: =G489*6+H489 -> 48 | K489: 13 | L489: 10 | M489: =K489*6+L489 -> 88 | O489: 18 | P489: 13 | Q489: =O489*6+P489 -> 121 | S489: PRESTON | W489: PORT MELBOURNE | X489: 6 | Y489: 5 | Z489: 0 | AA489: 1134 | AB489: 1156 | AC489: 98.096885813148788 | AD489: 24
A490: GEELONG WEST | C490: 1 | D490: 1 | E490: =C490*6+D490 -> 7 | G490: 7 | H490: 6 | I490: =G490*6+H490 -> 48 | K490: 11 | L490: 8 | M490: =K490*6+L490 -> 74 | O490: 12 | P490: 10 | Q490: =O490*6+P490 -> 82 | S490: DUGARD | W490: COBURG | X490: 4 | Y490: 7 | Z490: 0 | AA490: 1071 | AB490: 1115 | AC490: 96.05 | AD490: 16
A491: BEST PLAYERS | W491: GEELONG WEST | X491: 4 | Y491: 7 | Z491: 0 | AA491: 1157 | AB491: 1258 | AC491: 91.97 | AD491: 16
A492: PRESTON | C492: LE GASSICK | F492: FISHER | I492: HILL | K492: WEIGHTMAN | N492: BAIRD | Q492: IRELAND | W492: PRAHRAN | X492: 4 | Y492: 7 | Z492: 0 | AA492: 1136 | AB492: 1260 | AC492: 90.158730158730165 | AD492: 16
A493: GEELONG WEST | C493: M BROWNE | F493: DEEATH | I493: BRYANT | K493: R BROWNE | N493: MCLEAN | Q493: LINDSAY | W493: WILLIAMSTOWN | X493: 4 | Y493: 7 | Z493: 0 | AA493: 1119 | AB493: 1271 | AC493: 88.04 | AD493: 16
A494: GOALKICKERS | W494: WAVERLEY | X494: 3 | Y494: 8 | Z494: 0 | AA494: 1066 | AB494: 1305 | AC494: 81.685823754789268 | AD494: 12
A495: PRESTON | C495: LE GASSICK 6 | F495: BAIRD 4 | H495: IRELAND 2 | J495: DOWDLE 2 | M495: SALTMARSH 2 | P495: WEIGHTMAN | S495: SLATER
A496: GEELONG WEST | C496: BRYANT 4 | F496: McLEAN 3 | I496: COLLEY 2 | K496: EMOND | M496: ROOM | O496: STACEY
A498: SANDRINGHAM | C498: 4 | D498: 4 | E498: =C498*6+D498 -> 28 | G498: 9 | H498: 7 | I498: =G498*6+H498 -> 61 | K498: 12 | L498: 10 | M498: =K498*6+L498 -> 82 | O498: 20 | P498: 15 | Q498: =O498*6+P498 -> 135 | S498: WILLIAMSTOWN
A499: WILLIAMSTOWN | C499: 4 | D499: 3 | E499: =C499*6+D499 -> 27 | G499: 9 | H499: 6 | I499: =G499*6+H499 -> 60 | K499: 13 | L499: 10 | M499: =K499*6+L499 -> 88 | O499: 18 | P499: 11 | Q499: =O499*6+P499 -> 119 | S499: ANDERSON
A500: BEST PLAYERS
A501: SANDRINGHAM | C501: K CLARKE | F501: LOCKHART | I501: HUTCHISON | L501: WARD | O501: WALFORD | R501: MACK
A502: WILLIAMSTOWN | C502: PERCY | F502: SVORINICH | I502: VINEY | L502: BARNES | O502: STARK | R502: LANE
A503: GOALKICKERS
A504: SANDRINGHAM | C504: J WARD 4 | F504: SAMPSON 4 | I504: SPURRELL 3 | L504: CLARKE 2 | N504: HUTCHINSON 2 | R504: SARAU 2 | U504: KENNEDY 2 | X504: BUSSE
A505: WILLIAMSTOWN | C505: SVORINICH 7 | F505: MEYERS 3 | I505: EGAN 3 | K505: STARK 2 | M505: BARNES 2 | P505: BOXALL
A507: COBURG | C507: 3 | D507: 7 | E507: =C507*6+D507 -> 25 | G507: 5 | H507: 11 | I507: =G507*6+H507 -> 41 | K507: 12 | L507: 18 | M507: =K507*6+L507 -> 90 | O507: 16 | P507: 24 | Q507: =O507*6+P507 -> 120 | S507: TOORAK PARK
A508: PRAHRAN | C508: 4 | D508: 2 | E508: =C508*6+D508 -> 26 | G508: 7 | H508: 6 | I508: =G508*6+H508 -> 48 | K508: 9 | L508: 10 | M508: =K508*6+L508 -> 64 | O508: 11 | P508: 11 | Q508: =O508*6+P508 -> 77 | S508: HOLZER
A509: BEST PLAYERS
A510: COBURG | C510: ERWIN | F510: BRENNAN | I510: GALE | L510: JONES | O510: McCARTHY | R510: FARMER
A511: PRAHRAN | C511: THOMAS | F511: EMSELLE | I511: HUTCHESSON | L511: BARTLETT | O511: FAHEY
A512: GOALKICKERS
A513: COBURG | C513: BRENNAN 4 | F513: GALE 3 | H513: BARNETT 3 | K513: MORRISON 2 | N513: FARMER 2 | Q513: HOBBS | S513: JONES
A514: PRAHRAN | C514: THOMAS 3 | F514: BARTLETT 2 | I514: ROSE 2 | K514: HUTCHESSON | N514: DOWSING | Q514: FAHEY | S514: O'BRIEN
A516: OAKLEIGH | C516: 3 | D516: 7 | E516: =C516*6+D516 -> 25 | G516: 6 | H516: 10 | I516: =G516*6+H516 -> 46 | K516: 9 | L516: 12 | M516: =K516*6+L516 -> 66 | O516: 14 | P516: 14 | Q516: =O516*6+P516 -> 98 | S516: WAVERLEY
A517: WAVERLEY | C517: 2 | D517: 2 | E517: =C517*6+D517 -> 14 | G517: 3 | H517: 5 | I517: =G517*6+H517 -> 23 | K517: 6 | L517: 17 | M517: =K517*6+L517 -> 53 | O517: 8 | P517: 19 | Q517: =O517*6+P517 -> 67 | S517: McKENZIE
A518: BEST PLAYERS
A519: OAKLEIGH | C519: FORD | F519: FORSTER | I519: JOHNSON | L519: KING | N519: WEST | Q519: M QUINN
A520: WAVERLEY | C520: BROWN | F520: HORKINGS | I520: MORDEN | L520: GOSPER | N520: R ALLAN | Q520: THIESSON
A521: GOALKICKERS
A522: OAKLEIGH | C522: JOHNSON 6 | F522: M QUINN 2 | I522: ROBBINS 2 | L522: FORSTER | N522: FORD | P522: T QUINN | R522: HITCHES
A523: WAVERLEY | C523: BLEW 2 | F523: BACKHOUSE 2 | I523: GOSPER | K523: P GRANT | M523: LAKE | O523: THIESSEN
A525: ROUND 12 | E525: 18TH JULY | J525: WEATHER | N525: SOUTH WIND GROUNDS WET | S525: PLAYED AT
D526: 1ST QTR | H526: 2ND QTR | L526: 3RD QTR | P526: FINAL | S526: BEACH ROAD
A527: SANDRINGHAM | C527: 1 | D527: 2 | E527: =C527*6+D527 -> 8 | G527: 7 | H527: 2 | I527: =G527*6+H527 -> 44 | K527: 11 | L527: 7 | M527: =K527*6+L527 -> 73 | O527: 14 | P527: 11 | Q527: =O527*6+P527 -> 95 | S527: UMPIRE | X527: LADDER | AB527: ROUND | AD527: 12
A528: DANDENONG | C528: 3 | D528: 4 | E528: =C528*6+D528 -> 22 | G528: 8 | H528: 10 | I528: =G528*6+H528 -> 58 | K528: 9 | L528: 13 | M528: =K528*6+L528 -> 67 | O528: 11 | P528: 15 | Q528: =O528*6+P528 -> 81 | S528: McKENZIE
A529: BEST PLAYERS | W529: TEAM | X529: W | Y529: L | Z529: D | AA529: FOR | AB529: AGST | AC529: % | AD529: PTS
A530: SANDRINGHAM | C530: CHISNELL | F530: HUTCHISON | I530: CLARKE | L530: ELLIS | N530: SAMPSON | Q530: KENNEDY
A531: DANDENONG | C531: STEDWELL | F531: ABRAHAM | I531: TONKS | L531: HIBBERT | N531: EVANS | Q531: HENRIKSEN | W531: DANDENONG | X531: 9 | Y531: 3 | Z531: 0 | AA531: 1398 | AB531: 1077 | AC531: 129.8050139275766 | AD531: 36
A532: GOALKICKERS | W532: PRESTON | X532: 9 | Y532: 3 | Z532: 0 | AA532: 1297 | AB532: 1008 | AC532: 128.67 | AD532: 36
A533: SANDRINGHAM | C533: J WARD 4 | F533: SAMPSON 3 | I533: KENNEDY 3 | L533: HUTCHINSON 2 | O533: SARAU 2 | Q533: CLARKE | S533: SPURRELL | W533: OAKLEIGH | X533: 7 | Y533: 5 | Z533: 0 | AA533: 1357 | AB533: 1296 | AC533: 104.71 | AD533: 28
A534: DANDENONG | C534: FLAHERTY 3 | F534: MILLER 3 | I534: DAVIES | K534: KENDALL | M534: HIBBERT | O534: STEDWELL | Q534: SHEEHAN | W534: SANDRINGHAM | X534: 7 | Y534: 5 | Z534: 0 | AA534: 1211 | AB534: 1182 | AC534: 102.45 | AD534: 28
A536: COBURG | C536: 1 | D536: 5 | E536: =C536*6+D536 -> 11 | G536: 8 | H536: 11 | I536: =G536*6+H536 -> 59 | K536: 12 | L536: 14 | M536: =K536*6+L536 -> 86 | O536: 21 | P536: 15 | Q536: =O536*6+P536 -> 141 | S536: COBURG | W536: PORT MELBOURNE | X536: 6 | Y536: 6 | Z536: 0 | AA536: 1223 | AB536: 1265 | AC536: 96.679841897233203 | AD536: 24
A537: GEELONG WEST | C537: 5 | D537: 3 | E537: =C537*6+D537 -> 33 | G537: 6 | H537: 5 | I537: =G537*6+H537 -> 41 | K537: 9 | L537: 6 | M537: =K537*6+L537 -> 60 | O537: 12 | P537: 6 | Q537: =O537*6+P537 -> 78 | S537: GAMBETTA | W537: COBURG | X537: 5 | Y537: 7 | Z537: 0 | AA537: 1212 | AB537: 1193 | AC537: 101.59 | AD537: 20
A538: BEST PLAYERS | W538: PRAHRAN | X538: 5 | Y538: 7 | Z538: 0 | AA538: 1247 | AB538: 1362 | AC538: 91.556534508076354 | AD538: 20
A539: COBURG | C539: TYTLER | F539: MCCARTHY | I539: MORRISON | L539: HEPPER | O539: ERWIN | R539: GALE | W539: WILLIAMSTOWN | X539: 5 | Y539: 7 | Z539: 0 | AA539: 1228 | AB539: 1360 | AC539: 90.29 | AD539: 20
A540: GEELONG WEST | C540: DEEATH | F540: ROOM | I540: BARRY | L540: BRYANT | O540: McLEAN | W540: GEELONG WEST | X540: 4 | Y540: 8 | Z540: 0 | AA540: 1235 | AB540: 1399 | AC540: 88.28 | AD540: 16
A541: GOALKICKERS | W541: WAVERLEY | X541: 3 | Y541: 9 | Z541: 0 | AA541: 1120 | AB541: 1386 | AC541: 80.808080808080803 | AD541: 12
A542: COBURG | C542: McCARTHY 5 | F542: HEPPER 5 | I542: FARMER 4 | L542: MORRISON 3 | O542: BRENNAN 3 | R542: GALE
A543: GEELONG WEST | C543: McLEAN 4 | F543: BRYANT 3 | I543: TENABEL 2 | L543: M BROWNE 2 | O543: R BROWNE
A545: WILLIAMSTOWN | C545: 4 | D545: 6 | E545: =C545*6+D545 -> 30 | G545: 5 | H545: 9 | I545: =G545*6+H545 -> 39 | K545: 12 | L545: 16 | M545: =K545*6+L545 -> 88 | O545: 15 | P545: 19 | Q545: =O545*6+P545 -> 109 | S545: PORT MELBOURNE
A546: PORT MELBOURNE | C546: 4 | D546: 2 | E546: =C546*6+D546 -> 26 | G546: 9 | H546: 7 | I546: =G546*6+H546 -> 61 | K546: 10 | L546: 9 | M546: =K546*6+L546 -> 69 | O546: 13 | P546: 11 | Q546: =O546*6+P546 -> 89 | S546: PASK
A547: BEST PLAYERS
A548: WILLIAMSTOWN | C548: VINEY | F548: PERCY | I548: MEYERS | L548: STARK | N548: DUNLOP | Q548: FENTON
A549: PORT MELBOURNE | C549: COOK | F549: MALLETT | I549: BUCKLEY | L549: GOSS | N549: G ALLEN | Q549: DAVIS
A550: GOALKICKERS
A551: WILLIAMSTOWN | C551: BOXALL 3 | F551: MEYERS 3 | I551: BARNES 2 | K551: SVORINICH | N551: HEMLEY | P551: STILLMAN | R551: JAMES | T551: LANE | V551: VINEY | X551: DUNLOP
A552: PORT MELBOURNE | C552: BUCKLEY 4 | F552: N GOSS 2 | I552: COOK 2 | K552: HARLAND | M552: HOLT | O552: G ALLEN | Q552: BONNETT | T552: NORTON
A554: PRAHRAN | C554: 7 | D554: 7 | E554: =C554*6+D554 -> 49 | G554: 9 | H554: 9 | I554: =G554*6+H554 -> 63 | K554: 13 | L554: 11 | M554: =K554*6+L554 -> 89 | O554: 16 | P554: 15 | Q554: =O554*6+P554 -> 111 | S554: OAKLEIGH
A555: OAKLEIGH | C555: 1 | D555: 2 | E555: =C555*6+D555 -> 8 | G555: 7 | H555: 6 | I555: =G555*6+H555 -> 48 | K555: 11 | L555: 8 | M555: =K555*6+L555 -> 74 | O555: 15 | P555: 12 | Q555: =O555*6+P555 -> 102 | S555: TURNER
A556: BEST PLAYERS
A557: PRAHRAN | C557: ROSE | F557: BARTLETT | I557: KENNEALLY | L557: EMSELLE | O557: HUTCHESSON | R557: PAYNE
A558: OAKLEIGH | C558: SYKES | F558: MURNANE | I558: STANTON | L558: JOHNSON | O558: WEST | R558: FORSTER
A559: GOALKICKERS
A560: PRAHRAN | C560: BARTLETT 3 | F560: ANDERSON 3 | I560: JUNGWIRTH 3 | L560: THOMAS 2 | N560: ARMSTRONG 2 | Q560: PAYNE | S560: KENNEALLY | V560: EMSELLE
A561: OAKLEIGH | C561: MURNANE 4 | F561: JOHNSON 3 | I561: ROBERTS 3 | L561: HITCHES 2 | N561: M QUINN | Q561: KING | S561: ROBBINS
A563: PRESTON | C563: 4 | D563: 3 | E563: =C563*6+D563 -> 27 | G563: 4 | H563: 5 | I563: =G563*6+H563 -> 29 | K563: 9 | L563: 6 | M563: =K563*6+L563 -> 60 | O563: 12 | P563: 9 | Q563: =O563*6+P563 -> 81 | S563: WAVERLEY
A564: WAVERLEY | C564: 1 | D564: 2 | E564: =C564*6+D564 -> 8 | G564: 2 | H564: 4 | I564: =G564*6+H564 -> 16 | K564: 7 | L564: 5 | M564: =K564*6+L564 -> 47 | O564: 8 | P564: 6 | Q564: =O564*6+P564 -> 54 | S564: STIRLING
A565: BEST PLAYERS
A566: PRESTON | C566: HILL | F566: LE GASSICK | I566: LESLIE | L566: IRELAND | O566: BAIRD | R566: WEIGHTMAN
A567: WAVERLEY | C567: HORKINGS | F567: MORDEN | I567: STONE | L567: BROWN | O567: R ALLAN | R567: IVEY
A568: GOALKICKERS
A569: PRESTON | C569: LE GASSICK 7 | F569: BAIRD 2 | I569: MOYLAN | K569: DICKSON | M569: IRELAND
A570: WAVERLEY | C570: STONE 2 | F570: LAKE 2 | I570: OWENS | K570: B ALLAN | M570: HORKINGS | P570: THIESSEN
A572: ROUND 13 | E572: 25TH JULY | J572: WEATHER | N572: SOUTH WIND DULL | S572: PLAYED AT
D573: 1ST QTR | H573: 2ND QTR | L573: 3RD QTR | P573: FINAL | S573: DANDENONG
A574: OAKLEIGH | C574: 6 | D574: 3 | E574: =C574*6+D574 -> 39 | G574: 9 | H574: 9 | I574: =G574*6+H574 -> 63 | K574: 14 | L574: 13 | M574: =K574*6+L574 -> 97 | O574: 19 | P574: 15 | Q574: =O574*6+P574 -> 129 | S574: UMPIRE | X574: LADDER | AB574: ROUND | AD574: 13
A575: DANDENONG | C575: 5 | D575: 3 | E575: =C575*6+D575 -> 33 | G575: 10 | H575: 8 | I575: =G575*6+H575 -> 68 | K575: 11 | L575: 11 | M575: =K575*6+L575 -> 77 | O575: 17 | P575: 15 | Q575: =O575*6+P575 -> 117 | S575: ANDERSON
A576: BEST PLAYERS | W576: TEAM | X576: W | Y576: L | Z576: D | AA576: FOR | AB576: AGST | AC576: % | AD576: PTS
A577: OAKLEIGH | C577: KING | E577: FORD | H577: ROBERTS | K577: WEST | N577: FORSTER | Q577: SYKES
A578: DANDENONG | C578: MELAI | E578: ELLIS | H578: STEDWELL | K578: MILLER | N578: DAVENPORT | Q578: FLAHERTY | W578: PRESTON | X578: 10 | Y578: 3 | Z578: 0 | AA578: 1442 | AB578: 1137 | AC578: 126.82 | AD578: 40
A579: GOALKICKERS | W579: DANDENONG | X579: 9 | Y579: 4 | Z579: 0 | AA579: 1515 | AB579: 1206 | AC579: 125.62189054726367 | AD579: 36
A580: OAKLEIGH | C580: JOHNSON 6 | F580: MURNANE 4 | I580: KING 4 | K580: SMITH 3 | M580: FORD | O580: ROBERTS | W580: OAKLEIGH | X580: 8 | Y580: 5 | Z580: 0 | AA580: 1486 | AB580: 1413 | AC580: 105.17 | AD580: 32
A581: DANDENONG | C581: MILLER 8 | F581: FLAHERTY 3 | I581: DAVIES 3 | K581: MADDEN | M581: MELAI | O581: EVANS | W581: SANDRINGHAM | X581: 8 | Y581: 5 | Z581: 0 | AA581: 1339 | AB581: 1304 | AC581: 102.68 | AD581: 32
A583: PRESTON | C583: 4 | D583: 4 | E583: =C583*6+D583 -> 28 | G583: 12 | H583: 9 | I583: =G583*6+H583 -> 81 | K583: 16 | L583: 12 | M583: =K583*6+L583 -> 108 | O583: 21 | P583: 19 | Q583: =O583*6+P583 -> 145 | S583: PRESTON | W583: PORT MELBOURNE | X583: 6 | Y583: 7 | Z583: 0 | AA583: 1298 | AB583: 1365 | AC583: 95.091575091575095 | AD583: 24
A584: COBURG | C584: 5 | D584: 3 | E584: =C584*6+D584 -> 33 | G584: 9 | H584: 8 | I584: =G584*6+H584 -> 62 | K584: 13 | L584: 11 | M584: =K584*6+L584 -> 89 | O584: 19 | P584: 15 | Q584: =O584*6+P584 -> 129 | S584: McMASTER | W584: PRAHRAN | X584: 6 | Y584: 7 | Z584: 0 | AA584: 1347 | AB584: 1437 | AC584: 93.736951983298539 | AD584: 24
A585: BEST PLAYERS | W585: COBURG | X585: 5 | Y585: 8 | Z585: 0 | AA585: 1341 | AB585: 1338 | AC585: 100.22 | AD585: 20
A586: PRESTON | C586: WEIGHTMAN | F586: LE GASSICK | I586: HILL | K586: TELFORD | N586: IRELAND | W586: WILLIAMSTOWN | X586: 5 | Y586: 8 | Z586: 0 | AA586: 1321 | AB586: 1461 | AC586: 90.42 | AD586: 20
A587: COBURG | C587: GALE | F587: HEPPER | I587: HOBBS | K587: MORRISON | N587: BARNETT | Q587: ERWIN | W587: GEELONG WEST | X587: 4 | Y587: 9 | Z587: 0 | AA587: 1357 | AB587: 1527 | AC587: 88.87 | AD587: 16
A588: GOALKICKERS | Q588: McCARTIN | S588: RULE | W588: WAVERLEY | X588: 4 | Y588: 9 | Z588: 0 | AA588: 1221 | AB588: 1479 | AC588: 82.555780933062877 | AD588: 16
A589: PRESTON | C589: WEIGHTMAN 5 | F589: LE GASSICK 5 | I589: BAIRD 3 | K589: ASHMEAD 3 | N589: THORNLEY | Q589: IRELAND | S589: MARTIN
A590: COBURG | C590: GALE 4 | F590: FARMER 4 | I590: HEPPER 2 | K590: MORRISON 2 | N590: BARNETT 2 | Q590: HOBBS 2 | S590: McCARTHY | V590: BRENNAN | X590: PAUL
A592: PRAHRAN | C592: 5 | D592: 5 | E592: =C592*6+D592 -> 35 | G592: 8 | H592: 8 | I592: =G592*6+H592 -> 56 | K592: 11 | L592: 12 | M592: =K592*6+L592 -> 78 | O592: 14 | P592: 16 | Q592: =O592*6+P592 -> 100 | S592: TOORAK PARK
A593: PORT MELBOURNE | C593: 1 | D593: 4 | E593: =C593*6+D593 -> 10 | G593: 5 | H593: 6 | I593: =G593*6+H593 -> 36 | K593: 7 | L593: 8 | M593: =K593*6+L593 -> 50 | O593: 10 | P593: 15 | Q593: =O593*6+P593 -> 75 | S593: ABBOTT
A594: BEST PLAYERS
A595: PRAHRAN | C595: PAYNE | F595: KARANICHOLAS | J595: MINTON-CONNELL | N595: ARMSTRONG | Q595: BARTLETT | T595: CULPIN
A596: PORT MELBOURNE | C596: MALLETT | F596: G ANDERSON | J596: COOK | N596: DAVIS | Q596: DAVEY | T596: BUCKLEY
A597: GOALKICKERS
A598: PRAHRAN | C598: KARANICHOLAS 3 | G598: BARTLETT 2 | J598: PAYNE 2 | L598: THOMAS 2 | N598: PEACH 2 | P598: ARMSTRONG 2 | S598: HUTCHESSON
A599: PORT MELBOURNE | C599: COOK 4 | F599: G ANDERSON 2 | J599: N GOSS | L599: P SMITH | N599: BUCKLEY | Q599: HARLAND
A601: WAVERLEY | C601: 3 | D601: 5 | E601: =C601*6+D601 -> 23 | G601: 7 | H601: 10 | I601: =G601*6+H601 -> 52 | K601: 9 | L601: 14 | M601: =K601*6+L601 -> 68 | O601: 14 | P601: 17 | Q601: =O601*6+P601 -> 101 | S601: WILLIAMSTOWN
A602: WILLIAMSTOWN | C602: 2 | D602: 6 | E602: =C602*6+D602 -> 18 | G602: 5 | H602: 12 | I602: =G602*6+H602 -> 42 | K602: 8 | L602: 16 | M602: =K602*6+L602 -> 64 | O602: 12 | P602: 21 | Q602: =O602*6+P602 -> 93 | S602: FLANAGAN
A603: BEST PLAYERS
A604: WAVERLEY | C604: R ALLAN | F604: GOSPER | I604: PITTS | L604: GRANT | O604: HARRY | R604: STONE
A605: WILLIAMSTOWN | C605: STILLMAN | F605: HARVEY | I605: JAMES | L605: O'MARA | O605: DUNLOP | R605: PERCY
A606: GOALKICKERS
A607: WAVERLEY | C607: HARRY 3 | F607: B ALLAN 2 | I607: GOSPER 2 | L607: PITTS 2 | N607: P GRANT 2 | Q607: LAKE 2 | S607: STONE
A608: WILLIAMSTOWN | C608: BOXALL 4 | F608: SVORINICH 2 | I608: HEMLEY 2 | L608: MEYERS 2 | N608: STILLMAN | Q608: VINEY
A610: SANDRINGHAM | C610: 6 | D610: 6 | E610: =C610*6+D610 -> 42 | G610: 11 | H610: 11 | I610: =G610*6+H610 -> 77 | K610: 15 | L610: 13 | M610: =K610*6+L610 -> 103 | O610: 19 | P610: 14 | Q610: =O610*6+P610 -> 128 | S610: GEELONG WEST
A611: GEELONG WEST | C611: 4 | D611: 1 | E611: =C611*6+D611 -> 25 | G611: 7 | H611: 4 | I611: =G611*6+H611 -> 46 | K611: 13 | L611: 11 | M611: =K611*6+L611 -> 89 | O611: 18 | P611: 14 | Q611: =O611*6+P611 -> 122 | S611: HOLZER
A612: BEST PLAYERS
A613: SANDRINGHAM | C613: CHISNELL | F613: CLARKE | I613: HUTCHISON | L613: WARD | O613: WALFORD | R613: ELLIS
A614: GEELONG WEST | C614: DEEATH | F614: R BROWNE | I614: BRYANT | L614: McLEAN | O614: CROWE | R614: HAMER
A615: GOALKICKERS
A616: SANDRINGHAM | C616: J WARD 7 | F616: SARAU 5 | I616: CLARKE 4 | L616: SAMPSON 2 | O616: HUTCHINSON
A617: GEELONG WEST | C617: McLEAN 7 | F617: SMITH 3 | I617: BRYANT 3 | L617: M BROWNE 2 | O617: EMOND | Q617: BARRY | S617: PIEC
A619: ROUND 14 | E619: 1ST AUGUST | J619: WEATHER | N619: FINE | S619: PLAYED AT
D620: 1ST QTR | H620: 2ND QTR | L620: 3RD QTR | P620: FINAL | S620: PORT MELBOURNE
A621: PORT MELBOURNE | C621: 4 | D621: 5 | E621: =C621*6+D621 -> 29 | G621: 7 | H621: 6 | I621: =G621*6+H621 -> 48 | K621: 12 | L621: 11 | M621: =K621*6+L621 -> 83 | O621: 13 | P621: 13 | Q621: =O621*6+P621 -> 91 | S621: UMPIRE | X621: LADDER | AB621: ROUND | AD621: 14
A622: SANDRINGHAM | C622: 1 | D622: 2 | E622: =C622*6+D622 -> 8 | G622: 4 | H622: 6 | I622: =G622*6+H622 -> 30 | K622: 6 | L622: 7 | M622: =K622*6+L622 -> 43 | O622: 11 | P622: 16 | Q622: =O622*6+P622 -> 82 | S622: GAMBETTA
A623: BEST PLAYERS | W623: TEAM | X623: W | Y623: L | Z623: D | AA623: FOR | AB623: AGST | AC623: % | AD623: PTS
A624: PORT MELBOURNE | C624: COOK | F624: M ALLEN | I624: G ALLEN | L624: MALLETT | N624: STEVENSON | Q624: P SMITH
A625: SANDRINGHAM | C625: CHISNELL | F625: K CLARKE | I625: ZEUSCHNER | L625: MURPHY | N625: AUSTIN | Q625: WALFORD | W625: PRESTON | X625: 11 | Y625: 3 | Z625: 0 | AA625: 1573 | AB625: 1228 | AC625: 128.09 | AD625: 44
A626: GOALKICKERS | W626: DANDENONG | X626: 10 | Y626: 4 | Z626: 0 | AA626: 1660 | AB626: 1286 | AC626: 129.08242612752721 | AD626: 40
A627: PORT MELBOURNE | C627: P SMITH 6 | F627: N GOSS 2 | I627: COOK 2 | K627: BUCKLEY | M627: CARLON | O627: M ALLEN | W627: OAKLEIGH | X627: 9 | Y627: 5 | Z627: 0 | AA627: 1593 | AB627: 1484 | AC627: 107.35 | AD627: 36
A628: SANDRINGHAM | C628: J WARD 3 | F628: CLARKE 2 | I628: ZEUSCHNER 2 | L628: MORRIS | N628: MURPHY | P628: AUSTIN | R628: KENNEDY | W628: SANDRINGHAM | X628: 8 | Y628: 6 | Z628: 0 | AA628: 1421 | AB628: 1395 | AC628: 101.86 | AD628: 32
A630: OAKLEIGH | C630: 4 | D630: 3 | E630: =C630*6+D630 -> 27 | G630: 9 | H630: 6 | I630: =G630*6+H630 -> 60 | K630: 13 | L630: 9 | M630: =K630*6+L630 -> 87 | O630: 16 | P630: 11 | Q630: =O630*6+P630 -> 107 | S630: OAKLEIGH | W630: PORT MELBOURNE | X630: 7 | Y630: 7 | Z630: 0 | AA630: 1389 | AB630: 1447 | AC630: 95.991706979958536 | AD630: 28
A631: COBURG | C631: 3 | D631: 1 | E631: =C631*6+D631 -> 19 | G631: 5 | H631: 2 | I631: =G631*6+H631 -> 32 | K631: 10 | L631: 3 | M631: =K631*6+L631 -> 63 | O631: 11 | P631: 5 | Q631: =O631*6+P631 -> 71 | S631: PASK | W631: PRAHRAN | X631: 7 | Y631: 7 | Z631: 0 | AA631: 1423 | AB631: 1511 | AC631: 94.176042356055589 | AD631: 28
A632: BEST PLAYERS | W632: COBURG | X632: 5 | Y632: 9 | Z632: 0 | AA632: 1412 | AB632: 1445 | AC632: 97.72 | AD632: 20
A633: OAKLEIGH | C633: KING | F633: FORD | I633: JOHNSON | L633: STANTON | O633: T QUINN | R633: KUZIMAK | W633: WILLIAMSTOWN | X633: 5 | Y633: 9 | Z633: 0 | AA633: 1412 | AB633: 1592 | AC633: 88.69 | AD633: 20
A634: COBURG | C634: HEPPER | F634: BRENNAN | I634: GALE | L634: FINCHER | O634: MARSH | R634: ERWIN | W634: GEELONG WEST | X634: 4 | Y634: 10 | Z634: 0 | AA634: 1437 | AB634: 1672 | AC634: 85.94 | AD634: 16
A635: GOALKICKERS | W635: WAVERLEY | X635: 4 | Y635: 10 | Z635: 0 | AA635: 1295 | AB635: 1555 | AC635: 83.279742765273312 | AD635: 16
A636: OAKLEIGH | C636: JOHNSON 7 | F636: ROBBINS 3 | I636: MURNANE 2 | L636: FORD 2 | N636: STEPHENS 2
A637: COBURG | C637: GALE 2 | F637: McCARTHY 2 | I637: HEPPER 2 | K637: BRENNAN 2 | N637: MORRISON | Q637: ERWIN | S637: POBYAN
A639: PRAHRAN | C639: 1 | D639: 2 | E639: =C639*6+D639 -> 8 | G639: 3 | H639: 3 | I639: =G639*6+H639 -> 21 | K639: 8 | L639: 9 | M639: =K639*6+L639 -> 57 | O639: 11 | P639: 10 | Q639: =O639*6+P639 -> 76 | S639: WAVERLEY
A640: WAVERLEY | C640: 4 | D640: 5 | E640: =C640*6+D640 -> 29 | G640: 6 | H640: 13 | I640: =G640*6+H640 -> 49 | K640: 8 | L640: 17 | M640: =K640*6+L640 -> 65 | O640: 9 | P640: 20 | Q640: =O640*6+P640 -> 74 | S640: DUGARD
A641: BEST PLAYERS
A642: PRAHRAN | C642: CROWE | F642: PAYNE | I642: KENNEALLY | L642: KARANICHOLAS | P642: DICKESON | S642: BAIRD
A643: WAVERLEY | C643: HORKINGS | F643: PITTS | I643: SYKES | L643: STONE | P643: IVEY | S643: POORE
A644: GOALKICKERS
A645: PRAHRAN | C645: CROWE 3 | F645: PAYNE 2 | I645: BARTLETT | K645: CUMMING | M645: HUTCHESSON | P645: ROBERTSON | S645: ARMSTRONG | V645: GRANGE
A646: WAVERLEY | C646: PITTS 2 | F646: BROWN | H646: HORKINGS | J646: HARRY | L646: BLEW | N646: SYKES | P646: LAKE | R646: THIESSEN
A648: PRESTON | C648: 7 | D648: 7 | E648: =C648*6+D648 -> 49 | G648: 8 | H648: 8 | I648: =G648*6+H648 -> 56 | K648: 15 | L648: 15 | M648: =K648*6+L648 -> 105 | O648: 19 | P648: 17 | Q648: =O648*6+P648 -> 131 | S648: PRESTON
A649: WILLIAMSTOWN | C649: 1 | D649: 0 | E649: =C649*6+D649 -> 6 | G649: 10 | H649: 6 | I649: =G649*6+H649 -> 66 | K649: 10 | L649: 7 | M649: =K649*6+L649 -> 67 | O649: 13 | P649: 13 | Q649: =O649*6+P649 -> 91 | S649: McKENZIE
A650: BEST PLAYERS
A651: PRESTON | C651: MARTIN | F651: WEIGHTMAN | I651: LE GASSICK | L651: LESLIE | N651: McCARTHY | Q651: THORNLEY
A652: WILLIAMSTOWN | C652: HARVEY | F652: BOXALL | I652: O'MARA | L652: FENTON | N652: LANE | Q652: WALLACE
A653: GOALKICKERS
A654: PRESTON | C654: LE GASSICK 7 | F654: WEIGHTMAN 5 | J654: BAIRD 4 | L654: MARTIN | N654: McCARTEN | Q654: FISHER
A655: WILLIAMSTOWN | C655: SVORINICH 3 | F655: BOXALL 3 | I655: WALLACE 2 | L655: STILLMAN 2 | O655: VINEY | Q655: DUNLOP
A657: DANDENONG | C657: 3 | D657: 3 | E657: =C657*6+D657 -> 21 | G657: 8 | H657: 8 | I657: =G657*6+H657 -> 56 | K657: 12 | L657: 9 | M657: =K657*6+L657 -> 81 | O657: 22 | P657: 13 | Q657: =O657*6+P657 -> 145 | S657: DANDENONG
A658: GEELONG WEST | C658: 6 | D658: 6 | E658: =C658*6+D658 -> 42 | G658: 7 | H658: 8 | I658: =G658*6+H658 -> 50 | K658: 10 | L658: 14 | M658: =K658*6+L658 -> 74 | O658: 11 | P658: 14 | Q658: =O658*6+P658 -> 80 | S658: TURNER
A659: BEST PLAYERS
A660: DANDENONG | C660: STEDWELL | F660: MILLER | I660: ABRAHAM | L660: FLAHERTY | O660: DAVIES | Q660: HARRINGTON
A661: GEELONG WEST | C661: ROOM | F661: STACEY | I661: HAMER | L661: R BROWNE | O661: COLLEY | Q661: M BROWNE
A662: GOALKICKERS
A663: DANDENONG | C663: MILLER 10 | F663: FLAHERTY 4 | I663: SHEEHAN 3 | L663: DAVIES 2 | N663: ORCHARD 2 | Q663: ELLIS
A664: GEELONG WEST | C664: McLEAN 3 | F664: BRYANT 2 | I664: STACEY 2 | L664: BARRY | N664: M BROWNE | Q664: PIEC | S664: R BROWNE
A666: ROUND 15 | E666: 8TH AUGUST | J666: WEATHER | N666: NORTH WEST WIND | S666: PLAYED AT
D667: 1ST QTR | H667: 2ND QTR | L667: 3RD QTR | P667: FINAL | S667: BEACH ROAD
A668: SANDRINGHAM | C668: 9 | D668: 4 | E668: =C668*6+D668 -> 58 | G668: 10 | H668: 4 | I668: =G668*6+H668 -> 64 | K668: 18 | L668: 13 | M668: =K668*6+L668 -> 121 | O668: 18 | P668: 15 | Q668: =O668*6+P668 -> 123 | S668: UMPIRE | X668: LADDER | AB668: ROUND | AD668: 15
A669: OAKLEIGH | C669: 1 | D669: 0 | E669: =C669*6+D669 -> 6 | G669: 7 | H669: 14 | I669: =G669*6+H669 -> 56 | K669: 8 | L669: 14 | M669: =K669*6+L669 -> 62 | O669: 11 | P669: 23 | Q669: =O669*6+P669 -> 89 | S669: STIRLING
A670: BEST PLAYERS | W670: TEAM | X670: W | Y670: L | Z670: D | AA670: FOR | AB670: AGST | AC670: % | AD670: PTS
A671: SANDRINGHAM | C671: WARD | E671: CLARKE | H671: McNICHOLAS | K671: WALFORD | N671: BUSSE | Q671: SARAU
A672: OAKLEIGH | C672: FORD | E672: WEST | H672: SYKES | K672: T QUINN | N672: FORSTER | Q672: KING | W672: PRESTON | X672: 11 | Y672: 3 | Z672: 1 | AA672: 1641 | AB672: 1296 | AC672: 126.62 | AD672: 46
A673: GOALKICKERS | Q673: McNICHOLAS | W673: DANDENONG | X673: 10 | Y673: 5 | Z673: 0 | AA673: 1737 | AB673: 1375 | AC673: 126.33 | AD673: 40
A674: SANDRINGHAM | C674: ZEUSCHNER 4 | F674: CLARKE 3 | I674: J WARD 3 | K674: MORRIS 2 | M674: CONNICK 2 | P674: CHISNALL | R674: SCHWARTZMANN | W674: OAKLEIGH | X674: 9 | Y674: 6 | Z674: 0 | AA674: 1682 | AB674: 1607 | AC674: 104.67 | AD674: 36
A675: OAKLEIGH | C675: FORD 3 | F675: M QUINN 2 | I675: ROBERTS 2 | L675: JOHNSON | N675: KING | P675: ROBBINS | R675: WEST | W675: SANDRINGHAM | X675: 9 | Y675: 6 | Z675: 0 | AA675: 1544 | AB675: 1484 | AC675: 104.04 | AD675: 36
A677: PRAHRAN | C677: 4 | D677: 9 | E677: =C677*6+D677 -> 33 | G677: 5 | H677: 11 | I677: =G677*6+H677 -> 41 | K677: 7 | L677: 18 | M677: =K677*6+L677 -> 60 | O677: 8 | P677: 20 | Q677: =O677*6+P677 -> 68 | S677: TOORAK PARK | W677: PRAHRAN | X677: 7 | Y677: 7 | Z677: 1 | AA677: 1491 | AB677: 1579 | AC677: 94.426852438252055 | AD677: 30
A678: PRESTON | C678: 0 | D678: 0 | E678: =C678*6+D678 -> 0 | G678: 3 | H678: 7 | I678: =G678*6+H678 -> 25 | K678: 3 | L678: 7 | M678: =K678*6+L678 -> 25 | O678: 9 | P678: 14 | Q678: =O678*6+P678 -> 68 | S678: FLANAGAN | W678: PORT MELBOURNE | X678: 7 | Y678: 8 | Z678: 0 | AA678: 1473 | AB678: 1546 | AC678: 95.278137128072444 | AD678: 28
A679: BEST PLAYERS | W679: COBURG | X679: 6 | Y679: 9 | Z679: 0 | AA679: 1502 | AB679: 1521 | AC679: 98.7508218277449 | AD679: 24
A680: PRAHRAN | C680: CULPIN | F680: KARANICHOLAS | I680: PAYNE | L680: DICKESON | O680: PEACH | Q680: HUTCHESSON | W680: WILLIAMSTOWN | X680: 6 | Y680: 9 | Z680: 0 | AA680: 1503 | AB680: 1650 | AC680: 91.09 | AD680: 24
A681: PRESTON | C681: NICHOL | F681: WALKER | I681: FAWCETT | L681: ASHMEAD | O681: OWEN | Q681: HILL | W681: WAVERLEY | X681: 5 | Y681: 10 | Z681: 0 | AA681: 1394 | AB681: 1639 | AC681: 85.051860890787069 | AD681: 20
A682: GOALKICKERS | W682: GEELONG WEST | X682: 4 | Y682: 11 | Z682: 0 | AA682: 1495 | AB682: 1763 | AC682: 84.8 | AD682: 16
A683: PRAHRAN | C683: HUTCHESSON 2 | F683: JUNGWIRTH 2 | I683: KARANICHOLAS | L683: THOMAS | N683: KENNEALLY | Q683: BAIRD
A684: PRESTON | C684: NICHOL 2 | F684: McCARTEN 2 | I684: GREEN 2 | K684: LE GASSICK | N684: ASHMEAD | Q684: LESLIE
A686: COBURG | C686: 6 | D686: 8 | E686: =C686*6+D686 -> 44 | G686: 7 | H686: 9 | I686: =G686*6+H686 -> 51 | K686: 13 | L686: 12 | M686: =K686*6+L686 -> 90 | O686: 13 | P686: 12 | Q686: =O686*6+P686 -> 90 | S686: COBURG
A687: DANDENONG | C687: 1 | D687: 3 | E687: =C687*6+D687 -> 9 | G687: 5 | H687: 8 | I687: =G687*6+H687 -> 38 | K687: 5 | L687: 10 | M687: =K687*6+L687 -> 40 | O687: 10 | P687: 16 | Q687: =O687*6+P687 -> 76 | S687: ANDERSON
A688: BEST PLAYERS
A689: COBURG | C689: GALE | F689: ERWIN | I689: MARSH | L689: FINCHER | O689: LAWSON | R689: PRICE
A690: DANDENONG | C690: EVANS | F690: ELLIS | I690: HIBBERT | L690: ORCHARD | O690: STEDWELL | R690: MATTHEWS
A691: GOALKICKERS
A692: COBURG | C692: GALE 6 | F692: FARMER 2 | I692: BRENNAN 2 | L692: HEPPER | N692: BARNETT | P692: ROBINSON
A693: DANDENONG | C693: REID 2 | F693: HIBBERT 2 | I693: FLAHERTY | K693: DAVIES | M693: ELLIS | O693: EVANS | Q693: MILLER | S693: SHEEHAN
A695: WILLIAMSTOWN | C695: 4 | D695: 3 | E695: =C695*6+D695 -> 27 | G695: 8 | H695: 5 | I695: =G695*6+H695 -> 53 | K695: 10 | L695: 12 | M695: =K695*6+L695 -> 72 | O695: 13 | P695: 13 | Q695: =O695*6+P695 -> 91 | S695: GEELONG WEST
A696: GEELONG WEST | C696: 2 | D696: 0 | E696: =C696*6+D696 -> 12 | G696: 3 | H696: 4 | I696: =G696*6+H696 -> 22 | K696: 5 | L696: 9 | M696: =K696*6+L696 -> 39 | O696: 7 | P696: 16 | Q696: =O696*6+P696 -> 58 | S696: ABBOTT
A697: BEST PLAYERS
A698: WILLIAMSTOWN | C698: COX | F698: HARVEY | I698: BOXALL | L698: SVORINICH | O698: DUNLOP | R698: STILLMAN
A699: GEELONG WEST | C699: R BROWNE | F699: LINDSAY | I699: BRYANT | L699: DEEATH | O699: McLEAN | R699: HAMER
A700: GOALKICKERS
A701: WILLIAMSTOWN | C701: SVORINICH 4 | F701: BOXALL 4 | I701: BARNES 2 | L701: JACKMAN | N701: HYNES | P701: STILLMAN
A702: GEELONG WEST | C702: LINDSAY 3 | F702: McLEAN | H702: COLLEY | J702: STACEY | L702: DEEATH
A704: WAVERLEY | C704: 3 | D704: 1 | E704: =C704*6+D704 -> 19 | G704: 9 | H704: 6 | I704: =G704*6+H704 -> 60 | K704: 11 | L704: 7 | M704: =K704*6+L704 -> 73 | O704: 15 | P704: 9 | Q704: =O704*6+P704 -> 99 | S704: WAVERLEY
A705: PORT MELBOURNE | C705: 5 | D705: 5 | E705: =C705*6+D705 -> 35 | G705: 6 | H705: 6 | I705: =G705*6+H705 -> 42 | K705: 10 | L705: 10 | M705: =K705*6+L705 -> 70 | O705: 12 | P705: 12 | Q705: =O705*6+P705 -> 84 | S705: TORNEY
A706: BEST PLAYERS
A707: WAVERLEY | C707: GOSPER | F707: B ALLAN | I707: R ALLAN | L707: POORE | O707: BROWN | R707: LAKE
A708: PORT MELBOURNE | C708: WILLIAMS | F708: GOSS | I708: COOK | L708: STEVENSON | O708: HOLT | R708: BUCKLEY
A709: GOALKICKERS
A710: WAVERLEY | C710: LAKE 4 | F710: STONE 3 | I710: REID 2 | K710: B ALLAN 2 | N710: BLEW 2 | P710: HORKINGS | R710: STEPHENS
A711: PORT MELBOURNE | C711: P SMITH 3 | F711: HOLT 3 | I711: BUCKLEY 2 | L711: COOK 2 | N711: N GOSS
A713: ROUND 16 | E713: 15TH AUGUST | J713: WEATHER | N713: SOUTH WIND FINE | S713: PLAYED AT
D714: 1ST QTR | H714: 2ND QTR | L714: 3RD QTR | P714: FINAL | S714: PORT MELBOURNE
A715: PRESTON | C715: 3 | D715: 5 | E715: =C715*6+D715 -> 23 | G715: 6 | H715: 8 | I715: =G715*6+H715 -> 44 | K715: 12 | L715: 11 | M715: =K715*6+L715 -> 83 | O715: 14 | P715: 14 | Q715: =O715*6+P715 -> 98 | S715: UMPIRE | X715: LADDER | AB715: ROUND | AD715: 16
A716: PORT MELBOURNE | C716: 3 | D716: 1 | E716: =C716*6+D716 -> 19 | G716: 6 | H716: 6 | I716: =G716*6+H716 -> 42 | K716: 9 | L716: 10 | M716: =K716*6+L716 -> 64 | O716: 13 | P716: 14 | Q716: =O716*6+P716 -> 92 | S716: STIRLING
A717: BEST PLAYERS | W717: TEAM | X717: W | Y717: L | Z717: D | AA717: FOR | AB717: AGST | AC717: % | AD717: PTS
A718: PRESTON | C718: GREEN | F718: SLATER | I718: LESLIE | L718: McCARTHY | O718: ALLEN | R718: NICHOL
A719: PORT MELBOURNE | C719: HOLT | F719: CAULFIELD | I719: COOK | L719: WILLIAMS | O719: MALLETT | R719: STEVENSON | W719: PRESTON | X719: 12 | Y719: 3 | Z719: 1 | AA719: 1739 | AB719: 1388 | AC719: 125.29 | AD719: 50
A720: GOALKICKERS | W720: DANDENONG | X720: 11 | Y720: 5 | Z720: 0 | AA720: 1846 | AB720: 1459 | AC720: 126.53 | AD720: 44
A721: PRESTON | C721: SLATER 4 | F721: SALTMARSH 4 | I721: ALLEN 2 | K721: ASHMEAD 2 | N721: McCARTEN | Q721: LLOYD | W721: OAKLEIGH | X721: 10 | Y721: 6 | Z721: 0 | AA721: 1833 | AB721: 1707 | AC721: 107.38 | AD721: 40
A722: PORT MELBOURNE | C722: P SMITH 2 | F722: WILLIAMS 2 | I722: COOK 2 | K722: HOLT 2 | M722: BONNETT 2 | P722: BRICE 2 | R722: CARLON | W722: SANDRINGHAM | X722: 9 | Y722: 7 | Z722: 0 | AA722: 1617 | AB722: 1582 | AC722: 102.21 | AD722: 36
A724: COBURG | C724: 6 | D724: 10 | E724: =C724*6+D724 -> 46 | G724: 6 | H724: 11 | I724: =G724*6+H724 -> 47 | K724: 11 | L724: 16 | M724: =K724*6+L724 -> 82 | O724: 13 | P724: 20 | Q724: =O724*6+P724 -> 98 | S724: COBURG | W724: PRAHRAN | X724: 8 | Y724: 7 | Z724: 1 | AA724: 1567 | AB724: 1652 | AC724: 94.854721549636807 | AD724: 34
A725: SANDRINGHAM | C725: 1 | D725: 5 | E725: =C725*6+D725 -> 11 | G725: 5 | H725: 16 | I725: =G725*6+H725 -> 46 | K725: 7 | L725: 17 | M725: =K725*6+L725 -> 59 | O725: 9 | P725: 19 | Q725: =O725*6+P725 -> 73 | S725: DUGARD | W725: COBURG | X725: 7 | Y725: 9 | Z725: 0 | AA725: 1600 | AB725: 1594 | AC725: 100.37641154328733 | AD725: 28
A726: BEST PLAYERS | W726: PORT MELBOURNE | X726: 7 | Y726: 9 | Z726: 0 | AA726: 1565 | AB726: 1644 | AC726: 95.194647201946466 | AD726: 28
A727: COBURG | C727: GALE | E727: ERWIN | H727: FINCHER | K727: BARNETT | N727: HOBBS | Q727: MARSH | W727: WILLIAMSTOWN | X727: 6 | Y727: 10 | Z727: 0 | AA727: 1576 | AB727: 1726 | AC727: 91.31 | AD727: 24
A728: SANDRINGHAM | C728: WARD | E728: MURPHY | H728: SARAU | K728: BUSSE | N728: WALFORD | Q728: CONNICK | W728: WAVERLEY | X728: 5 | Y728: 11 | Z728: 0 | AA728: 1477 | AB728: 1749 | AC728: 84.44825614636936 | AD728: 20
A729: GOALKICKERS | W729: GEELONG WEST | X729: 4 | Y729: 12 | Z729: 0 | AA729: 1595 | AB729: 1914 | AC729: 83.33 | AD729: 16
A730: COBURG | C730: McCARTHY 4 | F730: HEPPER 2 | I730: BARNETT 2 | L730: FARMER 2 | O730: GALE | Q730: ERWIN | S730: ROBINSON
A731: SANDRINGHAM | C731: J WARD 5 | F731: CLARKE | H731: MURPHY | J731: CONNICK | M731: McNICHOLAS
A733: PRAHRAN | C733: 5 | D733: 7 | E733: =C733*6+D733 -> 37 | G733: 7 | H733: 8 | I733: =G733*6+H733 -> 50 | K733: 10 | L733: 14 | M733: =K733*6+L733 -> 74 | O733: 10 | P733: 16 | Q733: =O733*6+P733 -> 76 | S733: WILLIAMSTOWN
A734: WILLIAMSTOWN | C734: 2 | D734: 4 | E734: =C734*6+D734 -> 16 | G734: 5 | H734: 10 | I734: =G734*6+H734 -> 40 | K734: 8 | L734: 13 | M734: =K734*6+L734 -> 61 | O734: 9 | P734: 19 | Q734: =O734*6+P734 -> 73 | S734: TURNER
A735: BEST PLAYERS
A736: PRAHRAN | C736: PEACH | F736: PAYNE | I736: BAIRD | K736: CROWE | N736: ROSE | Q736: KARANICHOLAS
A737: WILLIAMSTOWN | C737: HARVEY | F737: LANE | I737: PERCY | K737: STILLMAN | N737: WALLACE | Q737: JACKMAN
A738: GOALKICKERS
A739: PRAHRAN | C739: PEACH 4 | F739: BAIRD 2 | I739: BARTLETT | K739: KARANICHOLAS | N739: DOWSING | Q739: CROWE
A740: WILLIAMSTOWN | C740: JACKMAN 3 | F740: WALLACE 2 | I740: BARNES 2 | K740: SVORINICH | N740: DUNLOP
A742: OAKLEIGH | C742: 5 | D742: 4 | E742: =C742*6+D742 -> 34 | G742: 12 | H742: 9 | I742: =G742*6+H742 -> 81 | K742: 18 | L742: 13 | M742: =K742*6+L742 -> 121 | O742: 22 | P742: 19 | Q742: =O742*6+P742 -> 151 | S742: OAKLEIGH
A743: GEELONG WEST | C743: 4 | D743: 5 | E743: =C743*6+D743 -> 29 | G743: 8 | H743: 5 | I743: =G743*6+H743 -> 53 | K743: 10 | L743: 11 | M743: =K743*6+L743 -> 71 | O743: 14 | P743: 16 | Q743: =O743*6+P743 -> 100 | S743: McMASTER
A744: BEST PLAYERS
A745: OAKLEIGH | C745: FORD | F745: ROBERTS | I745: KING | K745: T QUINN | N745: JUDD | Q745: FORSTER
A746: GEELONG WEST | C746: HAMER | F746: R BROWNE | I746: PIEC | K746: MARSDEN | N746: McLEAN | Q746: TEAGUE
A747: GOALKICKERS
A748: OAKLEIGH | C748: KING 4 | F748: JUDD 4 | H748: FORSTER 3 | J748: MURNANE 2 | M748: FORD 2 | O748: JOHNSON 2 | R748: M QUINN 2 | U748: ROBERTS 2 | X748: BILLING
A749: GEELONG WEST | C749: TEAGUE 6 | F749: M BROWNE 3 | I749: McLEAN 2 | L749: EGAN | N749: O'DONNELL | Q749: WOLFENDON
A751: DANDENONG | C751: 5 | D751: 1 | E751: =C751*6+D751 -> 31 | G751: 11 | H751: 7 | I751: =G751*6+H751 -> 73 | K751: 13 | L751: 13 | M751: =K751*6+L751 -> 91 | O751: 15 | P751: 20 | Q751: =O751*6+P751 -> 110 | S751: DANDENONG
A752: WAVERLEY | C752: 5 | D752: 1 | E752: =C752*6+D752 -> 31 | G752: 7 | H752: 4 | I752: =G752*6+H752 -> 46 | K752: 10 | L752: 7 | M752: =K752*6+L752 -> 67 | O752: 12 | P752: 11 | Q752: =O752*6+P752 -> 83 | S752: GAMBETTA
A753: BEST PLAYERS
A754: DANDENONG | C754: HIBBERT | F754: ORCHARD | I754: SHINNERS | L754: ABRAHAM | O754: EVANS | Q754: REID
A755: WAVERLEY | C755: STONE | F755: POORE | I755: BROWN | L755: IVEY | O755: REID | Q755: CRUSE
A756: GOALKICKERS
A757: DANDENONG | C757: MILLER 5 | F757: HIBBERT 4 | I757: SHEEHAN 3 | L757: DAVIES | N757: REID | P757: SHINNERS
A758: WAVERLEY | C758: REID 4 | F758: STONE 4 | I758: B ALLAN | K758: HORKINGS | N758: BLEW | P758: LAKE
A760: ROUND 17 | E760: 22ND AUGUST | J760: WEATHER | N760: FINE | S760: PLAYED AT
D761: 1ST QTR | H761: 2ND QTR | L761: 3RD QTR | P761: FINAL | S761: PRESTON
A762: OAKLEIGH | C762: 4 | D762: 4 | E762: =C762*6+D762 -> 28 | G762: 12 | H762: 6 | I762: =G762*6+H762 -> 78 | K762: 18 | L762: 13 | M762: =K762*6+L762 -> 121 | O762: 20 | P762: 15 | Q762: =O762*6+P762 -> 135 | S762: UMPIRE | X762: LADDER | AB762: ROUND | AD762: 17
A763: PRESTON | C763: 4 | D763: 4 | E763: =C763*6+D763 -> 28 | G763: 7 | H763: 8 | I763: =G763*6+H763 -> 50 | K763: 9 | L763: 10 | M763: =K763*6+L763 -> 64 | O763: 15 | P763: 17 | Q763: =O763*6+P763 -> 107 | S763: TURNER
A764: BEST PLAYERS | W764: TEAM | X764: W | Y764: L | Z764: D | AA764: FOR | AB764: AGST | AC764: % | AD764: PTS
A765: OAKLEIGH | C765: ROBERTS | F765: BILLING | I765: JUDD | L765: FORSTER | O765: FORD | R765: STEPHENS
A766: PRESTON | C766: GREEN | F766: LE GASSICK | I766: FAWCETT | L766: ASHMEAD | O766: TELFORD | W766: PRESTON | X766: 12 | Y766: 4 | Z766: 1 | AA766: 1846 | AB766: 1523 | AC766: 121.21 | AD766: 50
A767: GOALKICKERS | W767: DANDENONG | X767: 12 | Y767: 5 | Z767: 0 | AA767: 1981 | AB767: 1569 | AC767: 126.26 | AD767: 48
A768: OAKLEIGH | C768: JOHNSON 6 | F768: JUDD 5 | H768: MURNANE 4 | K768: ROBERTS 3 | N768: M QUINN | Q768: KING | W768: OAKLEIGH | X768: 11 | Y768: 6 | Z768: 0 | AA768: 1968 | AB768: 1814 | AC768: 108.49 | AD768: 44
A769: PRESTON | C769: ASHMEAD 4 | F769: LE GASSICK 3 | I769: SLATER 3 | K769: SCHICKERT 2 | N769: WEIGHTMAN | Q769: GREEN | S769: WALKER | W769: SANDRINGHAM | X769: 10 | Y769: 7 | Z769: 0 | AA769: 1735 | AB769: 1691 | AC769: 102.6 | AD769: 40
A771: SANDRINGHAM | C771: 4 | D771: 2 | E771: =C771*6+D771 -> 26 | G771: 8 | H771: 8 | I771: =G771*6+H771 -> 56 | K771: 12 | L771: 13 | M771: =K771*6+L771 -> 85 | O771: 17 | P771: 16 | Q771: =O771*6+P771 -> 118 | S771: BEACH ROAD | W771: PRAHRAN | X771: 8 | Y771: 8 | Z771: 1 | AA771: 1676 | AB771: 1770 | AC771: 94.68926553672317 | AD771: 34
A772: PRAHRAN | C772: 5 | D772: 3 | E772: =C772*6+D772 -> 33 | G772: 7 | H772: 6 | I772: =G772*6+H772 -> 48 | K772: 12 | L772: 10 | M772: =K772*6+L772 -> 82 | O772: 16 | P772: 13 | Q772: =O772*6+P772 -> 109 | S772: ANDERSON | W772: COBURG | X772: 7 | Y772: 10 | Z772: 0 | AA772: 1680 | AB772: 1681 | AC772: 99.940511600237954 | AD772: 28
A773: BEST PLAYERS | W773: PORT MELBOURNE | X773: 7 | Y773: 10 | Z773: 0 | AA773: 1659 | AB773: 1755 | AC773: 94.529914529914535 | AD773: 28
A774: SANDRINGHAM | C774: HUTCHISON | F774: WARD | I774: ZEUSCHNER | L774: CLARKE | O774: CHISNELL | R774: BUSSE | W774: WILLIAMSTOWN | X774: 6 | Y774: 11 | Z774: 0 | AA774: 1686 | AB774: 1861 | AC774: 90.6 | AD774: 24
A775: PRAHRAN | C775: CROWE | F775: PAYNE | I775: HUTCHESSON | L775: PEACH | N775: MINTON-CONNELL | R775: JOHNSTON | W775: WAVERLEY | X775: 6 | Y775: 11 | Z775: 0 | AA775: 1564 | AB775: 1829 | AC775: 85.51120831055222 | AD775: 24
A776: GOALKICKERS | R776: KENNEDY | W776: GEELONG WEST | X776: 5 | Y776: 12 | Z776: 0 | AA776: 1706 | AB776: 2008 | AC776: 84.96 | AD776: 20
A777: SANDRINGHAM | C777: HUTCHINSON 4 | F777: CLARKE 3 | I777: J WARD 3 | L777: McNICHOLAS 2 | O777: LOCKHART 2 | R777: MORRIS | T777: MURPHY
A778: PRAHRAN | C778: CROWE 4 | E778: PEACH 3 | G778: PAYNE 2 | I778: HUTCHESSON 2 | L778: EMSELLE 2 | O778: BARTLETT | Q778: KARANICHOLAS | U778: DOWSING
A780: WAVERLEY | C780: 3 | D780: 2 | E780: =C780*6+D780 -> 20 | G780: 6 | H780: 6 | I780: =G780*6+H780 -> 42 | K780: 10 | L780: 9 | M780: =K780*6+L780 -> 69 | O780: 12 | P780: 15 | Q780: =O780*6+P780 -> 87 | S780: WAVERLEY
A781: COBURG | C781: 2 | D781: 4 | E781: =C781*6+D781 -> 16 | G781: 4 | H781: 7 | I781: =G781*6+H781 -> 31 | K781: 8 | L781: 13 | M781: =K781*6+L781 -> 61 | O781: 11 | P781: 14 | Q781: =O781*6+P781 -> 80 | S781: McMASTER
A782: BEST PLAYERS
A783: WAVERLEY | C783: IVEY | F783: GOSPER | I783: R ALLAN | L783: BROWN | O783: MORDEN | R783: HORKINGS
A784: COBURG | C784: FARMER | F784: GALE | I784: HOBBS | L784: ERWIN | O784: MARSH | R784: BRENNAN
A785: GOALKICKERS
A786: WAVERLEY | C786: LEES 3 | F786: CRUSE 3 | I786: LAKE 2 | K786: BROWN | M786: B ALLAN | O786: HORKINGS | Q786: R ALLAN
A787: COBURG | C787: FARMER 3 | F787: GALE 2 | I787: BRENNAN 2 | L787: REILLY 2 | N787: LAWSON | P787: HOBBS
A789: GEELONG WEST | C789: 1 | D789: 3 | E789: =C789*6+D789 -> 9 | G789: 5 | H789: 5 | I789: =G789*6+H789 -> 35 | K789: 11 | L789: 6 | M789: =K789*6+L789 -> 72 | O789: 17 | P789: 9 | Q789: =O789*6+P789 -> 111 | S789: PORT MELBOURNE
A790: PORT MELBOURNE | C790: 3 | D790: 0 | E790: =C790*6+D790 -> 18 | G790: 8 | H790: 7 | I790: =G790*6+H790 -> 55 | K790: 10 | L790: 8 | M790: =K790*6+L790 -> 68 | O790: 14 | P790: 10 | Q790: =O790*6+P790 -> 94 | S790: FLANAGAN
A791: BEST PLAYERS
A792: GEELONG WEST | C792: R BROWNE | F792: EMOND | I792: TENABEL | L792: MARSDEN | O792: HAMER | R792: GILLIES
A793: PORT MELBOURNE | C793: P SMITH | F793: STEVENSON | I793: GOSS | L793: MALLETT | O793: DAVIS | R793: COOK
A794: GOALKICKERS
A795: GEELONG WEST | C795: McLEAN 4 | F795: EMOND 3 | I795: M BROWNE 3 | L795: STACEY 3 | N795: TENABEL 2 | Q795: COLLEY | S795: HOVEY
A796: PORT MELBOURNE | C796: P SMITH 10 | F796: WILLIAMS 2 | I796: BUCKLEY | L796: COOK
A798: DANDENONG | C798: 6 | D798: 4 | E798: =C798*6+D798 -> 40 | G798: 11 | H798: 7 | I798: =G798*6+H798 -> 73 | K798: 14 | L798: 11 | M798: =K798*6+L798 -> 95 | O798: 20 | P798: 15 | Q798: =O798*6+P798 -> 135 | S798: WILLIAMSTOWN
A799: WILLIAMSTOWN | C799: 5 | D799: 5 | E799: =C799*6+D799 -> 35 | G799: 7 | H799: 10 | I799: =G799*6+H799 -> 52 | K799: 13 | L799: 15 | M799: =K799*6+L799 -> 93 | O799: 15 | P799: 20 | Q799: =O799*6+P799 -> 110 | S799: DUGARD
A800: BEST PLAYERS
A801: DANDENONG | C801: MELAI | F801: HIBBERT | I801: ORCHARD | L801: ELLIS | O801: REID | R801: WALKER
A802: WILLIAMSTOWN | C802: HARVEY | F802: PERCY | I802: STILLMAN | L802: SVORINICH | O802: DUNLOP | R802: LANE
A803: GOALKICKERS
A804: DANDENONG | C804: MILLER 5 | F804: REID 3 | H804: ELLIS 3 | J804: ORCHARD 3 | M804: KENDALL 2 | P804: MELAI 2 | R804: HIBBERT | U804: SHINNERS
A805: WILLIAMSTOWN | C805: BOXALL 5 | F805: SVORINICH 4 | I805: JACKMAN 2 | L805: FENTON 2 | N805: EGAN 2
A807: ROUND 18 | E807: 29TH AUGUST | J807: WEATHER | N807: SOUTH WIND | S807: PLAYED AT
D808: 1ST QTR | H808: 2ND QTR | L808: 3RD QTR | P808: FINAL | S808: DANDENONG
A809: PRESTON | C809: 2 | D809: 5 | E809: =C809*6+D809 -> 17 | G809: 10 | H809: 6 | I809: =G809*6+H809 -> 66 | K809: 13 | L809: 6 | M809: =K809*6+L809 -> 84 | O809: 15 | P809: 9 | Q809: =O809*6+P809 -> 99 | S809: UMPIRE | X809: LADDER | AB809: ROUND | AD809: 18
A810: DANDENONG | C810: 3 | D810: 7 | E810: =C810*6+D810 -> 25 | G810: 5 | H810: 11 | I810: =G810*6+H810 -> 41 | K810: 11 | L810: 16 | M810: =K810*6+L810 -> 82 | O810: 11 | P810: 19 | Q810: =O810*6+P810 -> 85 | S810: McMASTER
A811: BEST PLAYERS | W811: TEAM | X811: W | Y811: L | Z811: D | AA811: FOR | AB811: AGST | AC811: % | AD811: PTS
A812: PRESTON | C812: HILL | F812: MOYLAN | I812: WEIGHTMAN | L812: McCARTHY | O812: SCHICKERT | R812: WALKER
A813: DANDENONG | C813: ELLIS | F813: DAVIES | I813: HENRIKSEN | L813: WALKER | O813: STEDWELL | R813: MELAI | W813: PRESTON | X813: 13 | Y813: 4 | Z813: 1 | AA813: 1945 | AB813: 1608 | AC813: 120.96 | AD813: 54
A814: GOALKICKERS | W814: DANDENONG | X814: 12 | Y814: 6 | Z814: 0 | AA814: 2067 | AB814: 1668 | AC814: 123.92086330935251 | AD814: 48
A815: PRESTON | C815: MOYLAN 6 | F815: WEIGHTMAN 2 | I815: LE GASSICK 2 | L815: IRELAND 2 | O815: NICHOL | Q815: MARTIN | S815: MCCARTEN | W815: OAKLEIGH | X815: 12 | Y815: 6 | Z815: 0 | AA815: 2109 | AB815: 1940 | AC815: 108.71 | AD815: 48
A816: DANDENONG | C816: MILLER 5 | F816: FLAHERTY 2 | I816: REID | K816: ELLIS | M816: MELAI | O816: EVANS | W816: SANDRINGHAM | X816: 10 | Y816: 8 | Z816: 0 | AA816: 1854 | AB816: 1821 | AC816: 101.81 | AD816: 40
A818: PORT MELBOURNE | C818: 8 | D818: 1 | E818: =C818*6+D818 -> 49 | G818: 14 | H818: 8 | I818: =G818*6+H818 -> 92 | K818: 17 | L818: 11 | M818: =K818*6+L818 -> 113 | O818: 19 | P818: 15 | Q818: =O818*6+P818 -> 129 | S818: COBURG | W818: PRAHRAN | X818: 8 | Y818: 9 | Z818: 1 | AA818: 1768 | AB818: 1897 | AC818: 93.19978914074855 | AD818: 34
A819: COBURG | C819: 5 | D819: 2 | E819: =C819*6+D819 -> 32 | G819: 8 | H819: 5 | I819: =G819*6+H819 -> 53 | K819: 12 | L819: 8 | M819: =K819*6+L819 -> 80 | O819: 15 | P819: 10 | Q819: =O819*6+P819 -> 100 | S819: GAMBETTA | W819: PORT MELBOURNE | X819: 8 | Y819: 10 | Z819: 0 | AA819: 1788 | AB819: 1855 | AC819: 96.388140161725062 | AD819: 32
A820: BEST PLAYERS | W820: COBURG | X820: 7 | Y820: 11 | Z820: 0 | AA820: 1780 | AB820: 1810 | AC820: 98.342541436464089 | AD820: 28
A821: PORT MELBOURNE | C821: BUCKLEY | F821: M ALLEN | I821: CAULFIELD | L821: COOK | O821: MALLETT | R821: GOSS | W821: WAVERLEY | X821: 7 | Y821: 11 | Z821: 0 | AA821: 1694 | AB821: 1948 | AC821: 86.960985626283374 | AD821: 28
A822: COBURG | C822: ERWIN | F822: GALE | I822: REILLY | L822: FINCHER | O822: MARSH | R822: RYBALKO | W822: WILLIAMSTOWN | X822: 6 | Y822: 12 | Z822: 0 | AA822: 1812 | AB822: 2002 | AC822: 90.51 | AD822: 24
A823: GOALKICKERS | R823: HARLAND | W823: GEELONG WEST | X823: 6 | Y823: 12 | Z823: 0 | AA823: 1833 | AB823: 2100 | AC823: 87.29 | AD823: 24
A824: PORT MELBOURNE | C824: N GOSS 5 | F824: M ALLEN 4 | I824: NEAL 3 | K824: P SMITH 2 | N824: HUDSON 2 | Q824: BUCKLEY | S824: S ANDERSON
A825: COBURG | C825: BRENNAN 4 | F825: GALE 3 | H825: REILLY 3 | K825: FARMER 2 | N825: McCARTHY | Q825: HEPPER | S825: BARNETT
A827: OAKLEIGH | C827: 7 | D827: 3 | E827: =C827*6+D827 -> 45 | G827: 10 | H827: 8 | I827: =G827*6+H827 -> 68 | K827: 15 | L827: 14 | M827: =K827*6+L827 -> 104 | O827: 20 | P827: 21 | Q827: =O827*6+P827 -> 141 | S827: OAKLEIGH
A828: WILLIAMSTOWN | C828: 6 | D828: 4 | E828: =C828*6+D828 -> 40 | G828: 9 | H828: 6 | I828: =G828*6+H828 -> 60 | K828: 15 | L828: 8 | M828: =K828*6+L828 -> 98 | O828: 19 | P828: 12 | Q828: =O828*6+P828 -> 126 | S828: ANDERSON
A829: BEST PLAYERS
A830: OAKLEIGH | C830: FORD | F830: BILLING | I830: JOHNSON | L830: JUDD | O830: WEST | R830: FERGUSON
A831: WILLIAMSTOWN | C831: SVORINICH | F831: HARVEY | I831: JACKMAN | L831: HEMLEY | O831: STILLMAN | R831: EGAN
A832: GOALKICKERS
A833: OAKLEIGH | C833: JOHNSON 8 | F833: JUDD 4 | H833: MURNANE 2 | K833: BILLING 2 | M833: FORD | O833: GATES | Q833: M QUINN | S833: ROBERTS
A834: WILLIAMSTOWN | C834: SVORINICH 6 | F834: BOXALL 6 | I834: JACKMAN 4 | L834: WALLACE 2 | O834: STILLMAN
A836: WAVERLEY | C836: 2 | D836: 5 | E836: =C836*6+D836 -> 17 | G836: 11 | H836: 12 | I836: =G836*6+H836 -> 78 | K836: 12 | L836: 18 | M836: =K836*6+L836 -> 90 | O836: 18 | P836: 22 | Q836: =O836*6+P836 -> 130 | S836: BEACH ROAD
A837: SANDRINGHAM | C837: 7 | D837: 1 | E837: =C837*6+D837 -> 43 | G837: 10 | H837: 7 | I837: =G837*6+H837 -> 67 | K837: 14 | L837: 16 | M837: =K837*6+L837 -> 100 | O837: 17 | P837: 17 | Q837: =O837*6+P837 -> 119 | S837: TURNER
A838: BEST PLAYERS
A839: WAVERLEY | C839: B ALLAN | F839: HORKINGS | I839: STONE | L839: R ALLAN | O839: CRUSE | R839: PITTS
A840: SANDRINGHAM | C840: SAMPSON | F840: WALFORD | I840: MORRIS | L840: WARD | O840: K CLARKE | R840: CHISNELL
A841: GOALKICKERS
A842: WAVERLEY | C842: STONE 5 | F842: R ALLAN 5 | I842: LEES 3 | K842: HORKINGS 2 | N842: BROWN | P842: GOSPER | R842: STEENHODLT
A843: SANDRINGHAM | C843: ZEUSCHNER 4 | F843: SAMPSON 3 | I843: CLARKE 2 | L843: MORRIS 2 | N843: BROWNE 2 | Q843: HUTCHINSON 2 | U843: J WARD | W843: K WILLS
A845: GEELONG WEST | C845: 4 | D845: 3 | E845: =C845*6+D845 -> 27 | G845: 9 | H845: 6 | I845: =G845*6+H845 -> 60 | K845: 14 | L845: 10 | M845: =K845*6+L845 -> 94 | O845: 19 | P845: 13 | Q845: =O845*6+P845 -> 127 | S845: GEELONG WEST
A846: PRAHRAN | C846: 5 | D846: 4 | E846: =C846*6+D846 -> 34 | G846: 6 | H846: 5 | I846: =G846*6+H846 -> 41 | K846: 9 | L846: 9 | M846: =K846*6+L846 -> 63 | O846: 13 | P846: 14 | Q846: =O846*6+P846 -> 92 | S846: TORNEY
A847: BEST PLAYERS
A848: GEELONG WEST | C848: R BROWNE | F848: EMOND | I848: COLLEY | L848: McLEAN | O848: BARRY | R848: HAMER
A849: PRAHRAN | C849: EMSELLE | F849: O'BRIEN | I849: PEACH | L849: HUTCHESSON | O849: HUGHES | R849: MINTON-CONNELL
A850: GOALKICKERS
A851: GEELONG WEST | C851: EMOND 4 | F851: McLEAN 3 | I851: TENABEL 2 | L851: M BROWNE 2 | O851: COLLEY 2 | Q851: R BROWNE 2 | T851: TEAGUE 2
A852: PRAHRAN | C852: PEACH 3 | F852: ROBERTSON 3 | I852: HUTCHESSON 2 | L852: THOMAS | N852: KENNEALLY | Q852: BAIRD | S852: O'BRIEN | U852: ARMSTRONG | X852: GRANGE
A854: FINALS
A855: 1ST SEMI | E855: 5TH SEPTEMBER | J855: WEATHER | N855: FINE
D856: 1ST QTR | H856: 2ND QTR | L856: 3RD QTR | P856: FINAL
A857: SANDRINGHAM | C857: 5 | D857: 1 | E857: =C857*6+D857 -> 31 | G857: 9 | H857: 5 | I857: =G857*6+H857 -> 59 | K857: 17 | L857: 7 | M857: =K857*6+L857 -> 109 | O857: 21 | P857: 7 | Q857: =O857*6+P857 -> 133 | S857: JUNCTION OVAL
A858: OAKLEIGH | C858: 2 | D858: 2 | E858: =C858*6+D858 -> 14 | G858: 4 | H858: 4 | I858: =G858*6+H858 -> 28 | K858: 9 | L858: 12 | M858: =K858*6+L858 -> 66 | O858: 15 | P858: 17 | Q858: =O858*6+P858 -> 107 | S858: DUGARD
A859: BEST PLAYERS
A860: SANDRINGHAM | C860: CLARKE | F860: CHISNELL | I860: HUTCHISON | L860: WALFORD | O860: BUSSE | Q860: McNICHOLAS
A861: OAKLEIGH | C861: KUZIMAK | F861: ROBERTS | I861: MURNANE | L861: STANTON | O861: WEST | Q861: T QUINN
A862: GOALKICKERS
A863: SANDRINGHAM | C863: CLARKE 6 | E863: J WARD 3 | G863: KENNEDY 3 | J863: MORRIS 2 | M863: MURPHY 2 | P863: SAMPSON 2 | S863: ZEUSCHNER 2 | W863: HUTCHINSON | Y863: McNICHOLAS
A864: OAKLEIGH | C864: MURNANE 5 | F864: JOHNSON 4 | I864: BILLING 2 | L864: FORSTER | N864: FORD | P864: M QUINN | R864: ROBBINS
A866: 2ND SEMI | E866: 12TH SEPTEMBER | J866: WEATHER | N866: FINE
A867: DANDENONG | C867: 12 | D867: 2 | E867: =C867*6+D867 -> 74 | G867: 16 | H867: 5 | I867: =G867*6+H867 -> 101 | K867: 20 | L867: 10 | M867: =K867*6+L867 -> 130 | O867: 24 | P867: 11 | Q867: =O867*6+P867 -> 155 | S867: JUNCTION OVAL
A868: PRESTON | C868: 1 | D868: 2 | E868: =C868*6+D868 -> 8 | G868: 5 | H868: 9 | I868: =G868*6+H868 -> 39 | K868: 8 | L868: 11 | M868: =K868*6+L868 -> 59 | O868: 11 | P868: 15 | Q868: =O868*6+P868 -> 81 | S868: McMASTER
A869: BEST PLAYERS
A870: DANDENONG | C870: ABRAHAM | F870: STEDWELL | I870: MILLER | L870: WALKER | O870: HIBBERT | R870: MELAI
A871: PRESTON | C871: DOWDLE | F871: HILL | I871: ASHMEAD | L871: McCARTHY | O871: THORNLEY | R871: GREEN
A872: GOALKICKERS
A873: DANDENONG | C873: MILLER 10 | F873: FLAHERTY 4 | I873: HIBBERT 3 | L873: REID 2 | N873: ORCHARD 2 | Q873: MELAI | S873: SHEEHAN | V873: SHINNERS
A874: PRESTON | C874: GREEN 4 | F874: LE GASSICK | I874: MOYLAN | K874: GOAD | M874: BAIRD | O874: MARTIN | Q874: DOWDLE | S874: ASHMEAD
A876: PRELIMINARY FINAL | F876: 19TH SEPTEMBER | K876: WEATHER | N876: NORTH WIND FINE
A877: PRESTON | C877: 6 | D877: 10 | E877: =C877*6+D877 -> 46 | G877: 7 | H877: 10 | I877: =G877*6+H877 -> 52 | K877: 13 | L877: 16 | M877: =K877*6+L877 -> 94 | O877: 17 | P877: 17 | Q877: =O877*6+P877 -> 119 | S877: JUNCTION OVAL
A878: SANDRINGHAM | C878: 1 | D878: 3 | E878: =C878*6+D878 -> 9 | G878: 8 | H878: 9 | I878: =G878*6+H878 -> 57 | K878: 10 | L878: 15 | M878: =K878*6+L878 -> 75 | O878: 14 | P878: 21 | Q878: =O878*6+P878 -> 105 | S878: McKENZIE
A879: BEST PLAYERS
A880: PRESTON | C880: DICKSON | F880: HILL | I880: ASHMEAD | L880: McCARTHY | O880: TELFORD | R880: ALLEN
A881: SANDRINGHAM | C881: CHISNELL | F881: SAMPSON | I881: CLARKE | L881: LOCKHART | O881: McNICHOLAS | R881: HUTCHINSON
A882: GOALKICKERS
A883: PRESTON | C883: DICKSON 4 | F883: ALLEN 3 | H883: GREEN 2 | J883: TELFORD 2 | M883: MOYLAN | O883: IRELAND | Q883: MARTIN | S883: SALTMARSH | V883: ASHMEAD | X883: McCARTEN
A884: SANDRINGHAM | C884: CLARKE 3 | F884: SAMPSON 3 | I884: J WARD 2 | K884: MURPHY 2 | N884: ZEUSCHNER 2 | Q884: KENNEDY | S884: McNICHOLAS
A886: GRAND FINAL | E886: 26TH SEPTEMBER | J886: WEATHER
A887: DANDENONG | C887: 7 | D887: 8 | E887: 50 | G887: 10 | H887: 8 | I887: 68 | K887: 12 | L887: 12 | M887: 84 | O887: 14 | P887: 14 | Q887: =O887*6+P887 -> 98 | S887: JUNCTION OVAL
A888: PRESTON | C888: 3 | D888: 4 | E888: 22 | G888: 8 | H888: 6 | I888: 54 | K888: 9 | L888: 9 | M888: 63 | O888: 13 | P888: 14 | Q888: =O888*6+P888 -> 92 | S888: McMASTER
A889: BEST PLAYERS
A890: DANDENONG | C890: ELLIS | F890: STEDWELL | I890: EVANS | L890: WALKER | O890: DAVIES | R890: REID
A891: PRESTON | C891: McCARTHY | F891: HILL | I891: SALTMARSH | L891: GOAD | O891: ASHMEAD | R891: WEIGHTMAN
A892: GOALKICKERS
A893: DANDENONG | C893: MILLER 5 | F893: FLAHERTY 2 | I893: ELLIS 2 | K893: ORCHARD 2 | N893: REID | P893: HIBBERT | R893: EVANS
A894: PRESTON | C894: SALTMARSH 4 | F894: TELFORD 2 | I894: MOYLAN | K894: DICKSON | M894: ALLEN | O894: IRELAND | Q894: MARTIN | S894: ASHMEAD | V894: McCARTEN